{
  "metadata": {
    "title": "Mo–V–Al–K–O catalyst for low-temperature oxidative dehydrogenation of propane",
    "authors": "; ; ",
    "journal": "Molecular Catalysis",
    "date": "2024-12-31",
    "doi": "10.1016/j.mcat.2024.114640",
    "abstract": "",
    "uri": "https://api.elsevier.com/content/article/pii/S2468823124008228",
    "pii": "S2468823124008228"
  },
  "fulltext": {
    "full-text-retrieval-response": {
      "scopus-eid": "2-s2.0-85207650324",
      "originalText": "serial JL 315758 291210 291744 291790 291809 31 Molecular Catalysis MOLECULARCATALYSIS 2024-10-28 2024-10-28 2024-10-28 2024-10-28 2024-11-15T16:17:10 1-s2.0-S2468823124008228 S2468-8231(24)00822-8 S2468823124008228 10.1016/j.mcat.2024.114640 S300 S300.1 FULL-TEXT 1-s2.0-S2468823124X00152 2024-11-15T17:47:59.107425Z 0 0 20241201 20241231 2024 2024-10-28T08:41:06.484877Z absattachment articleinfo articlenumber articletitlenorm authfirstinitialnorm authfirstsurnamenorm cid cids contenttype copyright crossmark dateloaded dateloadedtxt datesearch datesort dateupdated dco docsubtype doctype doi eid ewtransactionid hubeid indexeddate issn issnnorm itemstage itemtransactionid itemweight openaccess openarchive pg pgfirst pii piinorm pubdateend pubdatestart pubdatetxt pubyr sectiontitle sortorder srctitle srctitlenorm srctype ssids alllist content subj subheadings suppl tomb volfirst volissue volumelist webpdf webpdfpagecount yearnav figure table e-component body mmlmath affil appendices articletitle auth authfirstini authfull authkeywords authlast highlightsabst orcid primabst ref specialabst 2468-8231 24688231 true 569 569 C Volume 569 107 114640 114640 114640 202412 December 2024 2024-12-01 2024-12-31 2024 Regular Papers article fla © 2024 Elsevier B.V. All rights are reserved, including those for text and data mining, AI training, and similar technologies. MOVALKOCATALYSTFORLOWTEMPERATUREOXIDATIVEDEHYDROGENATIONPROPANE YAN X 1 Introduction 2 Experimental methods 2.1 Materials 2.2 Synthesis of catalysts 2.3 Catalytic testing 2.4 Material characterizations 2.5 Catalytic responses 3 Results 3.1 Catalytic performance 3.2 Structural characterization of catalysts 4 Discussion 4.1 Brønsted acid sites are unfavorable for propene selectivity 4.2 Mo5+ and V4+ positively affects propene selectivity 4.3 Steam promotes propene to form oxygenates 5 Conclusions CRediT authorship contribution statement Appendix Supplementary materials References JIANG 2021 2182 2234 X KIM 2017 1 7 T CARTER 2021 9747 9799 J SHAN 2021 111466 Y VALENTE 2023 1693 1716 J CARRERO 2014 3357 3380 C ALAMDARI 2021 481 532 A GAMBO 2021 117914 Y PLESS 2004 419 431 J WANG 2022 2129 2152 Z LUO 2019 110504 Y LI 2017 31 38 Z LI 2010 99 105 J GRANT 2016 1570 1573 J CHATURBEDY 2018 369 374 P ZHANG 2018 1 10 S CORMA 1993 425 438 A CONCEPCION 2002 2574 2582 P ALGHAMDI 2014 15317 15332 S BLASCO 1997 117 142 T NIETO 2006 3 15 J KATOU 2003 1028 1029 T OBUNAI 2021 118294 R SADAKANE 2012 229 235 M ISHIKAWA 2018 2935 2943 S ISHIKAWA 2019 117151 S ISHIKAWA 2015 7195 7206 S ISHIKAWA 2021 10294 10307 S ISHIKAWA 2019 1408 1417 S ISHIKAWA 2020 10535 10545 S ISHIKAWA 2017 2939 2950 S LI 2024 113770 N CAMPOSECO 2022 112738 R LIN 2003 305 318 M HIBST 2006 234 241 H TSILOMELEKIS 2007 139 147 G IVARS 2009 294 299 F OLIVER 2004 241 249 J GRASSELLI 1981 133 163 R QUINTANASOLORZANO 2020 118852 R QUINTANASOLORZANO 2021 15279 15291 R SAMSON 2014 3730 3741 K SVINTSITSKIY 2021 147676 D CHOI 1996 143 149 J LEDE 2002 7824 7831 E ONFROY 2005 99 104 T EMEIS 1993 347 354 C BLASCO 2004 362 373 T USHIKUBO 2003 79 84 T IVARSBARCELO 2014 41 48 F BETTAHAR 1996 1 48 M GRASSELLI 2006 7 16 R CHEN 2000 244 252 K GULIANTS 2005 24046 24055 V VITRY 2004 67 76 D CHEN 2019 18653 18657 S TOYOSHIMA 2021 4540 4549 R CHEN 2017 249 259 D ISHIKAWA 2023 15526 15534 S AI 1998 297 301 M WERNBACHER 2019 13269 13282 A HAVECKER 2012 48 60 M ZHU 2004 229 234 B XU 2013 2183 2191 A GRASSELLI 2010 33 38 R BACA 2003 39 46 M YANX2024X114640 YANX2024X114640XX 2026-10-28T00:00:00.000Z 2026-10-28T00:00:00.000Z http://creativecommons.org/licenses/by-nc-nd/4.0/ © 2024 Elsevier B.V. All rights are reserved, including those for text and data mining, AI training, and similar technologies. https://doi.org/10.15223/policy-017 https://doi.org/10.15223/policy-037 https://doi.org/10.15223/policy-012 https://doi.org/10.15223/policy-029 https://doi.org/10.15223/policy-004 item S2468-8231(24)00822-8 S2468823124008228 1-s2.0-S2468823124008228 10.1016/j.mcat.2024.114640 315758 2024-11-15T17:47:59.107425Z 2024-12-01 2024-12-31 1-s2.0-S2468823124008228-main.pdf https://s3-eu-west-1.amazonaws.com/prod-ucs-content-store-eu-west/content/pii:S2468823124008228/MAIN/application/pdf/f054525700f764b3e1007b0786a01e43/main.pdf main.pdf pdf true 9439066 MAIN 13 1-s2.0-S2468823124008228-main_1.png https://s3-eu-west-1.amazonaws.com/prod-ucs-content-store-eu-west/content/pii:S2468823124008228/PREVIEW/image/png/c722ed2c037ee9ef58d52e47f82f362d/main_1.png main_1.png png 57958 849 656 IMAGE-WEB-PDF 1 1-s2.0-S2468823124008228-gr2.jpg https://s3-eu-west-1.amazonaws.com/prod-ucs-content-store-eu-west/content/pii:S2468823124008228/gr2/DOWNSAMPLED/image/jpeg/c4c607c817f47ea29766c7170c647c51/gr2.jpg gr2 gr2.jpg jpg 34969 290 715 IMAGE-DOWNSAMPLED 1-s2.0-S2468823124008228-gr3.jpg https://s3-eu-west-1.amazonaws.com/prod-ucs-content-store-eu-west/content/pii:S2468823124008228/gr3/DOWNSAMPLED/image/jpeg/0d5122788bb534fe3115350d045f5e43/gr3.jpg gr3 gr3.jpg jpg 36964 292 715 IMAGE-DOWNSAMPLED 1-s2.0-S2468823124008228-gr1.jpg https://s3-eu-west-1.amazonaws.com/prod-ucs-content-store-eu-west/content/pii:S2468823124008228/gr1/DOWNSAMPLED/image/jpeg/4239b3a4a6cffe022daf419cd7cdf20e/gr1.jpg gr1 gr1.jpg jpg 42835 290 715 IMAGE-DOWNSAMPLED 1-s2.0-S2468823124008228-gr13.jpg https://s3-eu-west-1.amazonaws.com/prod-ucs-content-store-eu-west/content/pii:S2468823124008228/gr13/DOWNSAMPLED/image/jpeg/8ecf494bab44b0e212b9c6db0d6e37da/gr13.jpg gr13 gr13.jpg jpg 28063 322 376 IMAGE-DOWNSAMPLED 1-s2.0-S2468823124008228-gr11.jpg https://s3-eu-west-1.amazonaws.com/prod-ucs-content-store-eu-west/content/pii:S2468823124008228/gr11/DOWNSAMPLED/image/jpeg/9292a1645ccf60a9fed45a597bd3fd42/gr11.jpg gr11 gr11.jpg jpg 27583 325 376 IMAGE-DOWNSAMPLED 1-s2.0-S2468823124008228-gr12.jpg https://s3-eu-west-1.amazonaws.com/prod-ucs-content-store-eu-west/content/pii:S2468823124008228/gr12/DOWNSAMPLED/image/jpeg/ffcdd3d61f292d19745b3f2f26f12e41/gr12.jpg gr12 gr12.jpg jpg 24127 328 376 IMAGE-DOWNSAMPLED 1-s2.0-S2468823124008228-gr10.jpg https://s3-eu-west-1.amazonaws.com/prod-ucs-content-store-eu-west/content/pii:S2468823124008228/gr10/DOWNSAMPLED/image/jpeg/3e3228c7e6aeac811b09fe69379ed1e0/gr10.jpg gr10 gr10.jpg jpg 41394 313 715 IMAGE-DOWNSAMPLED 1-s2.0-S2468823124008228-ga1.jpg https://s3-eu-west-1.amazonaws.com/prod-ucs-content-store-eu-west/content/pii:S2468823124008228/ga1/DOWNSAMPLED/image/jpeg/91df85df449e7a4ee152a3109c974cd9/ga1.jpg ga1 true ga1.jpg jpg 26746 200 356 IMAGE-DOWNSAMPLED 1-s2.0-S2468823124008228-gr6.jpg https://s3-eu-west-1.amazonaws.com/prod-ucs-content-store-eu-west/content/pii:S2468823124008228/gr6/DOWNSAMPLED/image/jpeg/e1b902b6626f7102fc10b3bcc5e23773/gr6.jpg gr6 gr6.jpg jpg 229974 847 565 IMAGE-DOWNSAMPLED 1-s2.0-S2468823124008228-gr7.jpg https://s3-eu-west-1.amazonaws.com/prod-ucs-content-store-eu-west/content/pii:S2468823124008228/gr7/DOWNSAMPLED/image/jpeg/805c48d0dd6d0b1cc2505d9d5654c2d8/gr7.jpg gr7 gr7.jpg jpg 35128 321 376 IMAGE-DOWNSAMPLED 1-s2.0-S2468823124008228-gr4.jpg https://s3-eu-west-1.amazonaws.com/prod-ucs-content-store-eu-west/content/pii:S2468823124008228/gr4/DOWNSAMPLED/image/jpeg/3b903a7381fc924c4d7bbe6db93ae4bf/gr4.jpg gr4 gr4.jpg jpg 24916 319 376 IMAGE-DOWNSAMPLED 1-s2.0-S2468823124008228-gr5.jpg https://s3-eu-west-1.amazonaws.com/prod-ucs-content-store-eu-west/content/pii:S2468823124008228/gr5/DOWNSAMPLED/image/jpeg/177fb5488944d8ebc6479501656494ef/gr5.jpg gr5 gr5.jpg jpg 44204 393 376 IMAGE-DOWNSAMPLED 1-s2.0-S2468823124008228-gr8.jpg https://s3-eu-west-1.amazonaws.com/prod-ucs-content-store-eu-west/content/pii:S2468823124008228/gr8/DOWNSAMPLED/image/jpeg/7afa1650b1cb92742dfaca6471445df8/gr8.jpg gr8 gr8.jpg jpg 90079 572 715 IMAGE-DOWNSAMPLED 1-s2.0-S2468823124008228-gr9.jpg https://s3-eu-west-1.amazonaws.com/prod-ucs-content-store-eu-west/content/pii:S2468823124008228/gr9/DOWNSAMPLED/image/jpeg/333cf8a6d37d73e558884c56a16384e3/gr9.jpg gr9 gr9.jpg jpg 43151 216 753 IMAGE-DOWNSAMPLED 1-s2.0-S2468823124008228-gr2.sml https://s3-eu-west-1.amazonaws.com/prod-ucs-content-store-eu-west/content/pii:S2468823124008228/gr2/THUMBNAIL/image/gif/99df0b17b123a4c195d013c8c8f28c14/gr2.sml gr2 gr2.sml sml 6470 89 219 IMAGE-THUMBNAIL 1-s2.0-S2468823124008228-gr3.sml https://s3-eu-west-1.amazonaws.com/prod-ucs-content-store-eu-west/content/pii:S2468823124008228/gr3/THUMBNAIL/image/gif/6f5647b21f6a766fa44c08667f5fdec1/gr3.sml gr3 gr3.sml sml 6817 89 219 IMAGE-THUMBNAIL 1-s2.0-S2468823124008228-gr1.sml https://s3-eu-west-1.amazonaws.com/prod-ucs-content-store-eu-west/content/pii:S2468823124008228/gr1/THUMBNAIL/image/gif/f9d197b5730593f42cb066652872d8b0/gr1.sml gr1 gr1.sml sml 7213 89 219 IMAGE-THUMBNAIL 1-s2.0-S2468823124008228-gr13.sml https://s3-eu-west-1.amazonaws.com/prod-ucs-content-store-eu-west/content/pii:S2468823124008228/gr13/THUMBNAIL/image/gif/35b5bf5dbb689aba9b902f741297b681/gr13.sml gr13 gr13.sml sml 9241 164 191 IMAGE-THUMBNAIL 1-s2.0-S2468823124008228-gr11.sml https://s3-eu-west-1.amazonaws.com/prod-ucs-content-store-eu-west/content/pii:S2468823124008228/gr11/THUMBNAIL/image/gif/a37e2691e388b572163af72b3acda383/gr11.sml gr11 gr11.sml sml 8509 164 190 IMAGE-THUMBNAIL 1-s2.0-S2468823124008228-gr12.sml https://s3-eu-west-1.amazonaws.com/prod-ucs-content-store-eu-west/content/pii:S2468823124008228/gr12/THUMBNAIL/image/gif/cf68f881bdc49ee40dbf8f0c8b827489/gr12.sml gr12 gr12.sml sml 8114 164 188 IMAGE-THUMBNAIL 1-s2.0-S2468823124008228-gr10.sml https://s3-eu-west-1.amazonaws.com/prod-ucs-content-store-eu-west/content/pii:S2468823124008228/gr10/THUMBNAIL/image/gif/042f8928feb51155db60b55150feb81f/gr10.sml gr10 gr10.sml sml 7431 96 219 IMAGE-THUMBNAIL 1-s2.0-S2468823124008228-ga1.sml https://s3-eu-west-1.amazonaws.com/prod-ucs-content-store-eu-west/content/pii:S2468823124008228/ga1/THUMBNAIL/image/gif/7e2d6c81fa54a4d8fce512bd6550ccd7/ga1.sml ga1 true ga1.sml sml 10914 123 219 IMAGE-THUMBNAIL 1-s2.0-S2468823124008228-gr6.sml https://s3-eu-west-1.amazonaws.com/prod-ucs-content-store-eu-west/content/pii:S2468823124008228/gr6/THUMBNAIL/image/gif/458ecd7e10da11092a0f568f9576aea2/gr6.sml gr6 gr6.sml sml 16704 163 109 IMAGE-THUMBNAIL 1-s2.0-S2468823124008228-gr7.sml https://s3-eu-west-1.amazonaws.com/prod-ucs-content-store-eu-west/content/pii:S2468823124008228/gr7/THUMBNAIL/image/gif/91a7d652246b3ff541858f6dbcf78ba1/gr7.sml gr7 gr7.sml sml 10650 164 192 IMAGE-THUMBNAIL 1-s2.0-S2468823124008228-gr4.sml https://s3-eu-west-1.amazonaws.com/prod-ucs-content-store-eu-west/content/pii:S2468823124008228/gr4/THUMBNAIL/image/gif/9709bfac034d82b8f0fd3079990a3866/gr4.sml gr4 gr4.sml sml 8075 164 193 IMAGE-THUMBNAIL 1-s2.0-S2468823124008228-gr5.sml https://s3-eu-west-1.amazonaws.com/prod-ucs-content-store-eu-west/content/pii:S2468823124008228/gr5/THUMBNAIL/image/gif/d33d01de8ce8a5a614a9b96ad7829e5c/gr5.sml gr5 gr5.sml sml 10359 164 157 IMAGE-THUMBNAIL 1-s2.0-S2468823124008228-gr8.sml https://s3-eu-west-1.amazonaws.com/prod-ucs-content-store-eu-west/content/pii:S2468823124008228/gr8/THUMBNAIL/image/gif/5058dae6b98c3a13ad3f1e966e433168/gr8.sml gr8 gr8.sml sml 14211 164 205 IMAGE-THUMBNAIL 1-s2.0-S2468823124008228-gr9.sml https://s3-eu-west-1.amazonaws.com/prod-ucs-content-store-eu-west/content/pii:S2468823124008228/gr9/THUMBNAIL/image/gif/4d4b226c03ab771813ced910e40ef3cb/gr9.sml gr9 gr9.sml sml 7684 63 219 IMAGE-THUMBNAIL 1-s2.0-S2468823124008228-gr2_lrg.jpg https://s3-eu-west-1.amazonaws.com/prod-ucs-content-store-eu-west/content/pii:S2468823124008228/HIGHRES/image/jpeg/c32620bebf972cd051e3dd6a1936b604/gr2_lrg.jpg gr2 gr2_lrg.jpg jpg 218144 1286 3167 IMAGE-HIGH-RES 1-s2.0-S2468823124008228-gr3_lrg.jpg https://s3-eu-west-1.amazonaws.com/prod-ucs-content-store-eu-west/content/pii:S2468823124008228/HIGHRES/image/jpeg/77bdd7da32e231b2f37894710654ad16/gr3_lrg.jpg gr3 gr3_lrg.jpg jpg 227297 1292 3167 IMAGE-HIGH-RES 1-s2.0-S2468823124008228-gr1_lrg.jpg https://s3-eu-west-1.amazonaws.com/prod-ucs-content-store-eu-west/content/pii:S2468823124008228/HIGHRES/image/jpeg/4e4462490da9130eda0fc94fadc7d1a8/gr1_lrg.jpg gr1 gr1_lrg.jpg jpg 265030 1283 3167 IMAGE-HIGH-RES 1-s2.0-S2468823124008228-gr13_lrg.jpg https://s3-eu-west-1.amazonaws.com/prod-ucs-content-store-eu-west/content/pii:S2468823124008228/HIGHRES/image/jpeg/4c4cc91781a8a5a5615eb2a67aae46f8/gr13_lrg.jpg gr13 gr13_lrg.jpg jpg 179798 1428 1667 IMAGE-HIGH-RES 1-s2.0-S2468823124008228-gr11_lrg.jpg https://s3-eu-west-1.amazonaws.com/prod-ucs-content-store-eu-west/content/pii:S2468823124008228/HIGHRES/image/jpeg/e09c5cb3de5d2657f47613f025279088/gr11_lrg.jpg gr11 gr11_lrg.jpg jpg 169865 1441 1667 IMAGE-HIGH-RES 1-s2.0-S2468823124008228-gr12_lrg.jpg https://s3-eu-west-1.amazonaws.com/prod-ucs-content-store-eu-west/content/pii:S2468823124008228/HIGHRES/image/jpeg/5bfc53a28edf7c90ce763eb59d930c95/gr12_lrg.jpg gr12 gr12_lrg.jpg jpg 149826 1452 1667 IMAGE-HIGH-RES 1-s2.0-S2468823124008228-gr10_lrg.jpg https://s3-eu-west-1.amazonaws.com/prod-ucs-content-store-eu-west/content/pii:S2468823124008228/HIGHRES/image/jpeg/be4d235e160b7655a0c6bbaf541e54fe/gr10_lrg.jpg gr10 gr10_lrg.jpg jpg 266382 1388 3167 IMAGE-HIGH-RES 1-s2.0-S2468823124008228-ga1_lrg.jpg https://s3-eu-west-1.amazonaws.com/prod-ucs-content-store-eu-west/content/pii:S2468823124008228/HIGHRES/image/jpeg/ee804c83b69621c3ec687c38d4b95970/ga1_lrg.jpg ga1 true ga1_lrg.jpg jpg 155699 886 1579 IMAGE-HIGH-RES 1-s2.0-S2468823124008228-gr6_lrg.jpg https://s3-eu-west-1.amazonaws.com/prod-ucs-content-store-eu-west/content/pii:S2468823124008228/HIGHRES/image/jpeg/4b1a90f59ce36b2e0f925ec3dcd5af59/gr6_lrg.jpg gr6 gr6_lrg.jpg jpg 2054375 3747 2500 IMAGE-HIGH-RES 1-s2.0-S2468823124008228-gr7_lrg.jpg https://s3-eu-west-1.amazonaws.com/prod-ucs-content-store-eu-west/content/pii:S2468823124008228/HIGHRES/image/jpeg/585f35fbd20ff378d73e323fa2b295a3/gr7_lrg.jpg gr7 gr7_lrg.jpg jpg 223933 1424 1667 IMAGE-HIGH-RES 1-s2.0-S2468823124008228-gr4_lrg.jpg https://s3-eu-west-1.amazonaws.com/prod-ucs-content-store-eu-west/content/pii:S2468823124008228/HIGHRES/image/jpeg/d2bb01556a00dd3ba4fceafcb3c53951/gr4_lrg.jpg gr4 gr4_lrg.jpg jpg 152099 1415 1667 IMAGE-HIGH-RES 1-s2.0-S2468823124008228-gr5_lrg.jpg https://s3-eu-west-1.amazonaws.com/prod-ucs-content-store-eu-west/content/pii:S2468823124008228/HIGHRES/image/jpeg/2d8262d62faebdbad1f31241532e3ea0/gr5_lrg.jpg gr5 gr5_lrg.jpg jpg 259220 1742 1667 IMAGE-HIGH-RES 1-s2.0-S2468823124008228-gr8_lrg.jpg https://s3-eu-west-1.amazonaws.com/prod-ucs-content-store-eu-west/content/pii:S2045232219178881/HIGHRES/image/jpeg/93223dae00096fab4e4241eb55bc8332/gr8_lrg.jpg gr8 gr8_lrg.jpg jpg 607679 2535 3167 IMAGE-HIGH-RES 1-s2.0-S2468823124008228-gr9_lrg.jpg https://s3-eu-west-1.amazonaws.com/prod-ucs-content-store-eu-west/content/pii:S2468823124008228/HIGHRES/image/jpeg/90f67cd5f720f6aefd5acb99688e918a/gr9_lrg.jpg gr9 gr9_lrg.jpg jpg 286860 955 3333 IMAGE-HIGH-RES 1-s2.0-S2468823124008228-mmc1.docx https://s3-eu-west-1.amazonaws.com/prod-ucs-content-store-eu-west/content/pii:S2468823124008228/mmc1/MAIN/application/vnd.openxmlformats-officedocument.wordprocessingml.document/f38188873ae43aa9fb1de03b6f42c655/mmc1.docx mmc1 mmc1.docx docx 4442727 APPLICATION 1-s2.0-S2468823124008228-si1.svg https://s3-eu-west-1.amazonaws.com/prod-ucs-content-store-eu-west/content/pii:S2468823124008228/image/svg+xml/8f7ac7dfc8fb3025444feff4502f130b/si1.svg si1 si1.svg svg 19465 ALTIMG 1-s2.0-S2468823124008228-si2.svg https://s3-eu-west-1.amazonaws.com/prod-ucs-content-store-eu-west/content/pii:S2468823124008228/image/svg+xml/26d8d563748378ab5aba3f649f60b3be/si2.svg si2 si2.svg svg 21481 ALTIMG 1-s2.0-S2468823124008228-si3.svg https://s3-eu-west-1.amazonaws.com/prod-ucs-content-store-eu-west/content/pii:S2468823124008228/image/svg+xml/ccd925f613d5f816bd33866077b11054/si3.svg si3 si3.svg svg 17816 ALTIMG 1-s2.0-S2468823124008228-am.pdf https://s3-eu-west-1.amazonaws.com/prod-ucs-content-store-eu-west/content/egi:10PLC7L7K8L/MAIN/application/pdf/596fd72bc16ebd2ff8c32d69bd1fa57b/am.pdf am am.pdf pdf false 1130748 AAM-PDF MCAT 114640 114640 S2468-8231(24)00822-8 10.1016/j.mcat.2024.114640 Elsevier B.V. Fig. 1 Influence of K/Mo. Fig. 1 Reaction conditions: 300 °C. C3H8/O2 with a molar ratio of 8/1. The contact time of each reaction was kept consistent by changing the weight of catalyst. The atomic ratio of Al to Mo remains constant at 0.02/1. Fig. 2 Influence of steam amounts. Fig. 2 Reaction conditions: 300 °C, C3H8/O2 with a molar ratio of 8/1. The contact time of each reaction was kept consistent by changing the weight of catalyst. Fig. 3 Influence of the ratio of alkane to oxygen. Fig. 3 Reaction conditions: 300 °C, catalyst weight, 4.0 g, no steam. Fig. 4 NH3-TPD of the catalysts. Fig. 4 Fig. 5 FT-IR spectra of adsorbed pyridine were collected from several catalyst samples after desorption at three different temperatures: (a) 50 °C, (b) 100 °C, (c) 150 °C. Fig. 5 Fig. 6 TEM images of (a) Mo1V0.5Al0.02K0.03Ox (Fresh) and (b) Mo1V0.5Al0.02K0.03Ox (Used), along with the distribution of several species on Mo1V0.5Al0.02K0.03Ox (Fresh): (c) Mo, (d) V, (e) K, (f) Al. Fig. 6 Fig. 7 XRD patterns of catalysts. Fig. 7 Fig. 8 XPS spectra of (a) Mo 3d, (b) V 2p for several catalyst samples. Fig. 8 Fig. 9 XPS patterns of O 1s with catalysts: (a) Mo1V0.5Ox, (b) Mo1V0.5K0.03Ox, (c) Mo1V0.5Al0.02K0.03Ox (Fresh), and (d) Mo1V0.5Al0.02K0.03Ox (Used). Fig. 9 Fig. 10 (a) Content of Brønsted acid sites (%) in several catalyst samples at various temperature ( °C), (b) Relationship between propane conversion (%), product selectivity (%) and the content of Brønsted acid sites (%). Fig. 10 Fig. 11 Effect of relative abundance of Mo6+ and V5+. Fig. 11 Fig. 12 Effect of relative abundance of M-OH. Fig. 12 Fig. 13 Effect of steam content. Fig. 13 Reaction conditions: 400 °C, C3H8/O2 with a molar ratio of 8/1. The contact time of each reaction was kept consistent by changing the weight of catalyst. Table 1 Catalytic performance of three catalysts. Table 1 Catalyst Conversion (%) Selectivity (%) Propene Acetone HAc COx Others Mo1V0.5Ox 14.58 72.09 5.47 1.65 20.19 0.60 Mo1V0.5K0.03Ox 7.70 88.31 1.68 0.56 9.04 0.41 Mo1V0.5Al0.02K0.03Ox 12.73 83.18 2.98 0.85 12.00 0.99 Reaction conditions: 300 °C, catalyst weight, 4.0 g. WHSV=2.4 gC3H8·gcat -1·h-1, C3H8/O2 with a molar ratio of 8/1. No steam in feed gas. Table 2 Element content and surface area of three catalysts. Table 2 Catalyst Mo (%) V (%) Al (%) K (%) Surface area (m2/g) Pore size (nm) Mo1V0.5Ox 65.9 33.5 – – 4.7 18.2 Mo1V0.5K0.03Ox 66.1 31.4 – 2.1 3.7 10.8 Mo1V0.5Al0.02K0.03Ox 65.9 29.8 1.6 1.8 5.2 12.6 Mo–V–Al–K–O catalyst for low-temperature oxidative dehydrogenation of propane Xiaoyu Yan Writing – review & editing Writing – original draft Validation Investigation Formal analysis Data curation Conceptualization Xiaoqing Xu Validation Investigation Yuhan Sun Validation Investigation Xiuyi Li Writing – review & editing Jiale Xu Writing – review & editing Renjie Ji Writing – review & editing Rui Huang Writing – review & editing Chunyi Li Writing – review & editing Supervision Resources Project administration Funding acquisition Formal analysis Conceptualization ⁎ State Key Laboratory of Heavy Oil Processing, China University of Petroleum, Qingdao 266580, China State Key Laboratory of Heavy Oil Processing China University of Petroleum Qingdao 266580 China State Key Laboratory of Heavy Oil Processing, China University of Petroleum, Qingdao 266580, China ⁎ Corresponding author. Compared with propane dehydrogenation (PDH) technology, oxidative dehydrogenation (ODH) of propane is an effective way to break through the thermodynamic constraints, which has changed the endothermic reaction into exothermic. Meanwhile, coking in PDH was significantly reduced by the presence of an oxidant in ODH of propane. Therefore, ODH of propane has attracted wide interest and has been studied in recent years. However, the contradiction between the conversion of propane and the selectivity of propene was the intrinsic problem of ODH of propane that required further study. In this work, a novel aluminum/potassium-doped mixed metal oxide catalyst Mo1V0.5Al0.02K0.03Ox was synthesized using a simple co-impregnation method, whose selectivity for propene (83.2 %) and conversion of propane (12.7 %) at 300 °C were the best among all other alkali metal/alkaline-earth metal-doped catalysts. The further discussion illustrated that doping potassium and alumina could synergistically adjust the density of acid sites on the catalyst, establishing an equilibrium between high propane conversion and the ideal propene selectivity. After modification, the density of Brønsted acid decreased, leading to an enhancement in the selectivity of propene. Simultaneously, the addition of steam in the feed gas promotes propene to oxygenates and improves the conversion of propane under the condition of constant contact time. Graphical abstract Image, graphical abstract Keywords Oxidative dehydrogenation of propane Mixed metal oxide catalyst Propene Steam Selectivity Data availability Data will be made available on request. 1 Introduction Propene is an essential organic raw material in the petrochemical industry. It is generally served as the primary raw material for synthesizing polypropene, acrylonitrile, carbonyl alcohol, epichlorohydrin, cumene, acrylic acid, and other products. Currently, it is primarily produced through the catalytic cracking of by-products like naphtha and light diesel oil, as well as through the direct dehydrogenation of propane [1,2]. Propane is used as a feedstock for dehydrogenation to produce propene in order to reduce costs. In recent years, propane dehydrogenation (PDH) has become a well-established commercial process, which is environmentally preferable to obtaining propene from steam cracking and fluid catalytic cracking [3]. However, due to the high energy consumption required for PDH, and issues such as catalyst deactivation via coke formation, its large-scale production is limited to a certain extent [4]. Oppositely, oxidative dehydrogenation (ODH) of propane can break through the thermodynamic constraints at lower temperatures due to its exothermic nature [5]. Moreover, the presence of oxidants (such as oxygen) can also alleviate problems such as catalyst deactivation caused by coke formation [6,7]. Consequently, ODH of propane is extensively researched. Metal oxides have high research value as catalysts for the ODH of propane because of their unique chemical coordination and adjustable reducibility. Lattice oxygen is considered the active site of metal oxide catalysts that promote the ODH of propane through the Mars-van Krevelen (MVK) mechanism [8]. Currently, molybdenum-based [9], vanadium-based [9], chromium-based [10], cobalt-based [11,12], and nickel-based [13] metal oxide catalysts have been extensively researched in the realm of mixed oxide catalysts for propane ODH to propene. The hexagonal boron nitride catalyst proposed by Grant et al. was a popular non-metallic boron-based catalyst in recent years with a 14 % conversion of propane, and a 79 % selectivity of propene [14]. Despite this, the challenge of easily deactivating boron-based catalysts still needs to be addressed. Their high activity and selectivity can only be sustained for at most ten to dozens of hours [15], and it is difficult to regenerate them, as the lifetime of these catalysts is much lower than that of mixed metal oxides. Vanadium-based catalysts with remarkable ODH performance have been extensively studied, such as V–Mg–O and VOx/Al2O3 catalytic systems [16–19]. The general view is that an excessive amount of Brønsted acid sites on the surface of vanadium-based catalysts can lead to over-oxidation, which is detrimental to the selectivity of olefins. Some studies have suggested that doping heteroatoms such as alkali metals, is beneficial for improving the selectivity of olefins by reducing the density of Brønsted acid sites [20,21]. For ODH of propane, the limitation lies in the contradiction between propane conversion and propene selectivity. In recent years, many groups have made in-depth research and achieved remarkable results. Since the MoVTeNbOx catalyst developed by Mitsubishi [22] in the 1990s has achieved remarkable success in the selective oxidation of propane to acrylic acid, Mo–V-based mixed metal oxide catalysts have garnered significant attention due to their outstanding performance at low temperatures ranging of 350 to 420 °C. Based on the previous studies, the orthorhombic Mo–V–O catalyst was first synthesized by Katou et al., through a hydrothermal method, which had a propane conversion of 5.9 % and propene selectivity of 30.8 % [23]. In the following studies, extensive research was conducted on Mo–V–O catalysts. For instance, using mesoporous carbon as a template, ternary Mo–V oxide nanocrystals (nano MOVO) were synthesized by a hydrothermal method in a confined space. In ODH of propane, there was a 5.5 % propane conversion and a 57.7 % propene selectivity, respectively [24]. The study by Sadakane et al. [25], pointed out that the crystal structure of Mo–V-based composite oxide catalyst was complex and could not be simply synthesized by a solid-phase method. The structural design of catalysts, selection of metal sources, metal ratios, initial concentration and pH of precursor mixtures, calcination conditions, and other factors need to be considered. Through further research, Ishikawa discovered additional applications of Mo–V–Ox catalysts and achieved significant milestones, including the selective oxidation of ethane [26–28], acrolein [29,30], methacrolein [31], and the ammonia oxidation of light alkanes [32]. The aforementioned groups have conducted extensive research on Mo–V-based catalysts for propane oxidative activation and have achieved remarkable results. However, similar to many other ODH catalysts, the contradiction between the activity of Mo–V-based catalysts and the selectivity of intermediate products remains the primary obstacle to their further development, despite their excellent performance at low temperatures. In this work, Mo–V-based mixed metal oxide catalysts for propane oxidation activation reaction were prepared using the co-impregnation method. Doping potassium and alumina have been found to enhance the synergy among the components of the catalyst by adjusting the density of acid sites. The catalyst can effectively activate and oxidize propane at 300 °C to produce propene with a 12.7 % propane conversion and 83.2 % propene selectivity, which were the highest among all other alkali metal/alkaline-earth metal-doped catalysts. In addition, the selectivity of acetone in oxygenates improved when the feed gas contained a small amount of steam (from 2.4 % to 9.4 %). At the same time, the selectivity of COx decreased (from 13.0 % to 12.7 %), At this time, the molar ratio of feed gas is C3H8/O2/H2O=8/1/12.5. 2 Experimental methods 2.1 Materials In this work, ammonium molybdate tetrahydrate, ammonium metavanadate, and salts or hydroxides of metals were purchased from Aladdin Biochemical Technology Co. Ltd. (Shanghai, China). Nano alumina sol was purchased from Guolian Technology Co. Ltd. (Jiangsu, China). All of the chemicals used in this study were of analytical grade without further purification. 2.2 Synthesis of catalysts The catalysts were synthesized using the co-impregnation method. 6 g ammonium molybdate tetrahydrate and 2 g ammonium metavanadate were dissolved in distilled water at 80 °C and stirred until completely dissolved. Subsequently, alkali metal salt or alkaline earth metal salt was added, followed by a specific amount of aluminum sol (the content of Al2O3 was 20 wt%). Then, 1.6 mol/L dilute nitric acid was added dropwise to the mixture until the pH reached 3. The mixture was continuously stirred at 80 °C until it evaporated to dryness. It was then placed in an oven at 80 °C overnight for drying to obtain a light yellow catalyst precursor powder. The precursor powder was placed into a tubular furnace and roasted in a nitrogen gas flow for 2 h at 600 °C with a heating rate of 5 °C/min. A black solid catalyst powder was then obtained. After pressing and screening, solid catalyst particles with a size of 40–60 mesh were obtained. 2.3 Catalytic testing The catalytic experiments were conducted in a fixed-bed quartz tube reactor with continuous gas flow at atmospheric pressure. The quartz tube had a length of 360 mm, an inner diameter of 12 mm, and an outer diameter of 18 mm. The catalyst bed was located in the middle of the reactor, and the rest was filled with SiO2. Propane, oxygen, and steam are used as feed gases, with the gas flow controlled by the mass flow meters. To ensure safety, the mixed gas in the reactor and at the reactor outlet should be controlled within the explosion limit of propane. In general, the molar ratio of propane to oxygen is 8/1. The composition of the products obtained after reaction evaluation was analyzed by gas chromatography (GC). Nitrogen was used as the carrier gas for the FID channel to analyze the hydrocarbons in the product using a PLOT/Al2O3 chromatography column and FID detector. Hydrogen was employed as the carrier gas for the TCD channel, and the products were pre-separated using a Porpak Q chromatographic column with a TCD detector. The COx in the product were analyzed using a 5A chromatographic column. Likewise, it was confirmed that in a reactor composed only of SiO2 as the bed, propane did not convert at 300 °C. 2.4 Material characterizations To analyze the phase structure of the catalyst, the catalyst samples were packed in a glass holder. The XRD patterns were then recorded using an Empyrean diffractometer produced by PANalytical Company. The diffraction intensities were measured from 5 to 80° with a 2θ step equal to 0.02° for 8 s per point using Cu Kα1, 2 radiation at 40 kV and 30 mA. The specific surface area was calculated from the adsorption data in the relative pressure range of 0.05 to 0.3 using the Brunauer−Emmett−Teller (BET) method. Total pore volumes were calculated based on the amount of nitrogen adsorbed at a relative pressure (P/P0) of 0.95. The X-ray fluorescence spectrum (XRF) was analyzed using the Axios-Petro spectrometer from PANalytical Company. The PCA-1200 chemical adsorption analyzer, produced by Beijing Bioelectronics Technology Company, was utilized to measure the surface acidity properties of catalysts. A 100 mg sample was subjected to pre-treatment at 300 °C under argon (Ar) gas to eliminate impurities and moisture adsorbed on the catalyst surface. After the pre-treatment was completed, the sample was cooled to 100 °C and subjected to NH3 adsorption under the following conditions: a mixture of 5 vol.% NH3/N2 gas at a flow rate of 40 mL/min was introduced for adsorption for 30 min. Once the adsorption reached saturation, a flow of 40 mL/min of Ar gas was introduced for 20 min to purge the physically adsorbed NH3 from the catalyst surface. Subsequently, the determination of NH3 desorption was conducted under the following conditions: Helium gas was introduced at a flow rate of 30 mL/min. The temperature was programmed to increase to 600 °C at a rate of 10 °C/min and was maintained at that temperature for 1 min [33]. The spectrum of Fourier Transform Infrared (FT-IR) pyridine absorption-desorption was recorded using a Bruker Tensor 27 spectrometer with a resolution of 4 cm-1 [33,34]. Samples to be adsorbed and blank samples of each catalyst were prepared and placed in the oven for overnight drying. The sample to be adsorbed was then exposed to pyridine vapor for 1 hour to facilitate pyridine adsorption. After vacuum pumping, pyridine desorption was carried out in an oven at different temperatures. The surface morphology and microcomposition of the catalyst were analyzed using the Talos F200X field emission scanning transmission electron microscope (TEM) from Thermo Fisher Scientific in the United States. Similarly, the K-Alpha X-ray photoelectron spectrometer (XPS) from the company was applied to analyze the valence state changes of oxygen species and active components on the catalyst surface. The analytical instrument utilizes the standard Al Kα X-ray as the excitation source, with an acceleration voltage of 1486.6 eV The measured elements were charge-corrected using C1 s (284.6 eV) as the internal standard. 2.5 Catalytic responses The values of hydrocarbon conversion, selectivity, and yield to products were calculated to quantify the catalysts’ behavior. On a carbon basis, these catalytic responses were obtained after reaching a steady state during the operation of the catalysts. For instance, propane conversion, acrylic acid selectivity, and yield were computed by Eqs. (1), (2), and (3), respectively [22,35]. (1) Conv ersi on of prop ane ( % ) = moles of cons umed prop ane moles of supp lied prop ane × 100 % (2) Sele ctiv ity of prop ene ( % ) = moles of form ed prop ene moles of cons umed prop ane × 100 % (3) Yield of prop ene ( % ) = moles of form ed prop ene moles of supp lied prop ane × 100 % 3 Results 3.1 Catalytic performance The catalyst was synthesized using the co-impregnation method. In the catalytic testing, various alkali and alkaline-earth metals were used as dopants for comparative analysis, and the results are listed in Table S1. It can be inferred that the doping of potassium species effectively improved the selectivity of the catalyst for the intermediate product propene and reduced the selectivity of COx, which had a better effect than other alkali metals and alkaline-earth metals with propene selectivity of 88.3 %. Obviously, the selectivity of the catalyst is not entirely consistent with the electronegativity of modified metals. For instance, the selectivity of the Cs-doped catalyst for propene is 79.4 %, which is lower than the propene selectivity of the K-doped catalyst. Hibst et al. [36]. have identified the reason for this discrepancy: the concentration of Cs+ ions blocks the active sites for propane oxidation. Consequently, although the selectivity of propene is influenced by the electronegativity of the modified metal [37], the electronegativity of the metal is not the only decisive factor. The influencing factors of propene selectivity still need to be analyzed based on the type of doped metal [20,38]. Several Mo–V-based catalysts were synthesized, which can be expressed as Mo1V0.5Ox, Mo1V0.5K0.03Ox, and Mo1V0.5Al0.02K0.03Ox, respectively. The test results of several catalysts are listed in Table 1 . For the catalyst Mo1V0.5K0.03Ox, it was found that although the doping of potassium in the Mo1V0.5Ox catalyst could significantly enhance the selectivity of propene (from 72.1 % to 88.3 %), it also led to a significant reduction in the catalyst's activity (from 14.6 % to 7.7 %). Therefore, Al2O3 was doped into the catalytic system using the co-impregnation method to enhance the activity of the catalyst. For ODH of propane, Al2O3 typically enhances the activity of the catalyst. The high acidity of Al2O3 may promote the strong adsorption of propene and other intermediate products on the catalyst, which can easily lead to the production of deep oxidation products [8]. Nevertheless, our experiments indicated that the activity of the catalyst can be improved by doping a small amount of Al2O3 (increasing propane conversion from 7.7 % to 12.7 % and decreasing propene selectivity from 88.1 % to 83.2 %). We speculate that Al2O3 plays a role in balancing the acidic sites in the reaction. However, the amount added should be carefully controlled. The effect of potassium doping amount on the catalytic activity of the Mo1V0.5Al0.02K0.03Ox catalyst is illustrated in Fig. 1 . Fig. 1a and b display the conversion of propane and selectivity of products in the absence of steam and at a water flow rate of 0.1 mL/min. At the same time, after adding steam to the feed gas, the contact time of the reaction is controlled by adjusting the weight of the catalyst. As the atomic ratio of K to Mo increases, the conversion of propane decreases, the selectivity of propene increases, the selectivity of acetone decreases, and the selectivity of COx decreases. Studies on the selective oxidation of propane indicate that propene is the initial intermediate product [5,39–41]. Subsequently, propene undergoes further oxidation to produce acetone or acrolein, with this process being facilitated by more acidic sites. According to reports [20,21], potassium doping can decrease the number of acid sites. Consequently, the catalyst's activity decreases, hindering the further oxidation of propene to acetone or acrolein. This results in a decrease in the degree of deep oxidation and thus a reduction in COx selectivity, ultimately leading to an enhancement in the selectivity of the intermediate product propene. When the reaction temperature was 300 °C and the flow rate of H2O was 0.1 mL/min, the selectivity of propene in the reaction with steam was lower, and the selectivity of acetone was higher than that in the reaction without steam. The conversion of propane was higher than that without steam, and the selectivity of COx was also lower than that without steam. Apparently, the steam content in the feed gas significantly influenced the product distribution of the reaction. The doping effect of potassium species and alumina was thoroughly researched and identified. Specifically, the effects of doping with potassium and alumina, individually and in combination, and their respective amounts on catalytic performance were investigated (Fig. S1). It was observed that when solely doped with alumina, trace amounts of alumina did not significantly enhance propane conversion (Fig. S1a). In contrast, when exclusively doped with potassium, propane conversion decreased substantially as the amount of potassium increased. However, this trend was effectively mitigated by the presence of alumina, resulting in only a minor decrease in propane conversion, while the selectivity for propene remained relatively high (Fig. S1b). Therefore, we suspected that potassium species may exhibit a synergistic effect with alumina in the ODH process of propane, promoting a balance between propane conversion and propene selectivity. In addition, we investigated the impact of varying amounts of alumina on catalytic performance. Subsequently, we identified the optimal range for alumina addition (Fig. S2). By comparing the effects of feed gas with different steam amounts on the reaction (Fig. 2 ), it is observed that the propane conversion increased slightly with the enhancement in steam amount (Fig. 2a), with the H2O flow rate increasing from 0 to 0.15 mL/min, the propane conversion increased from 12.7 % to 13.5 %. The total selectivity of propene + acetone, surprisingly, did not change significantly in the range of H2O flow rate from 0 to 0.1 mL/min (from 85.6 % to 86.0 %). Further, a decrease in propene and COx selectivity and an enhancement in the selectivity of the oxygenates acetone and acetic acid were observed (Fig. 2b). The changing trend of reaction products with the ratio of alkane to oxygen is illustrated in Fig. 3 . It can be seen in Fig. 3a that as the ratio of alkane to oxygen increased, the conversion of propane gradually decreased (15.7 % when C3H8/O2=2, and 8.9 % when C3H8/O2=10). In contrast, the total selectivity of propene and acetone gradually increased (from 73.6 % to 86.5 %). In Fig. 3b, the selectivity of propene gradually increased (from 68.1 % to 84.5 %), while the selectivity of COx gradually decreased (from 21.7 % to 12.3 %), and acetone and acetic acid's selectivity gradually decreased (5.5 % to 2.0 % and 4.5 % to 0.9 %, respectively). This is because, with the increased ratio of alkane to oxygen, the degree of excessive oxidation in the reaction is restricted. As a result, the reaction products tended to produce more intermediate product propene rather than the more stable acetone. When the ratio of alkane to oxygen is low, propene tends to be further converted into acetone, which is subsequently oxidized to COx. Therefore, controlling the degree of oxidation can enhance the selectivity of intermediate target products. When the reaction temperature was raised to 350 °C, the conversion of propane was 18.2 %, with selectivities of 70.3 % for propene and 10.5 % for acetone. The conversion of propane was 29.8 % at 400 °C. At this time, the selectivity of 56.6 % for propene and 13.6 % for acetone. As the temperature increased, the selectivity of COx significantly rose. It is worth noting that the mentioned temperature is still lower than the conventional temperature typically used in many studies on the oxidative dehydrogenation of propane. In addition, for the most effective catalyst, Mo1V0.5Al0.02K0.03Ox, we tested its performance stability at a reaction temperature of 300 °C (Fig. S3). The results indicated that the catalyst consistently maintained stable activity and propene selectivity during the 48-hour oxidative dehydrogenation reaction of propane. 3.2 Structural characterization of catalysts Various techniques were applied to characterize several catalysts. Three kinds of catalyst samples, Mo1V0.5Ox, Mo1V0.5K0.03Ox, and Mo1V0.5Al0.02K0.03Ox, were analyzed through the NH3-TPD. The NH3-TPD spectra (Fig. 4 ) showed that the amount of ammonia adsorbed by catalyst Mo1V0.5Ox was significantly larger than that of the other two catalysts. The total amount of acidic sites of several catalysts was in the order of Mo1V0.5Ox> Mo1V0.5Al0.02K0.03Ox> Mo1V0.5K0.03Ox, we have provided the amounts of acid sites in Table S2. Another notable observation is that the Mo–V–O catalyst contains numerous strong acid sites. However, after doping with potassium species, these strong acid sites nearly disappear. The subsequent introduction of alumina increases the number of strong acid sites once again, resulting in a catalyst with optimal acidity. Subsequently, the pyridine adsorption-desorption method was used to further determine the nature, density, and strength of their surface acid sites [42]. The FT-IR spectra of several catalysts at different pyridine desorption temperatures were recorded using a Bruker Tensor 27 spectrometer (Fig. 5 ). The presence of two absorption peaks located at 1484 and 1451 cm-1 is related to the Lewis site coordinated with pyridine. In addition, an absorption peak located at 1541 cm-1 was observed in Fig. 5, which is the characteristic peak of the Brønsted acid site [43]. The doping of potassium species resulted in a significant reduction in the acid sites of the Mo1V0.5K0.03Ox catalyst. Subsequently, after adding Al2O3 species, the Mo1V0.5Al0.02K0.03Ox catalyst showed a significant increase in the amount of acid sites. This phenomenon also confirms our previous speculation that doping potassium species can alter the number of acidic sites on the surface of the Mo–V-based catalysts. In addition, with the increase in pyridine desorption temperature from 50 °C to 150 °C, it is worth noting that the intensities of all the bands decreased. The adsorption amount of pyridine at 150 °C has approached zero, which means that this series of catalyst samples exhibited weak Brønsted and Lewis acidity. Another effect of Al2O3 doping, according to our speculation, is to increase the specific surface area of the catalyst. The elemental composition of the three catalysts obtained by XRF and the specific surface area determined using the Brunauer-Emmett-Teller (BET) method are listed in Table 2 . The specific surface area of the catalyst modified with potassium decreased slightly (from 4.7 m2/g to 3.7 m2/g). The average pore size change trend calculated by the Barrett-Joyner-Halenda (BJH) method was consistent with that of the surface area (from 18.2 nm to 10.8 nm). Subsequently, the specific surface area of the Mo1V0.5K0.03Ox catalyst increased slightly after doping Al2O3 (from 3.7 m2/g to 5.2 m2/g). The porous structure of Al2O3 itself will slightly increase the specific surface area of the catalyst. However, it can be seen that the doping of potassium species or Al2O3 has little effect on the specific surface area and average pore size of the catalyst, so it is impossible to accurately determine the effect of doping on the specific surface area and average pore size of the catalyst. Especially for metal oxide catalysts with small specific surface area, weak changes in specific surface area and average pore size will not have a significant impact on the reaction. Therefore, the factor that affects the performance of the catalyst due to changes in specific surface area or average pore size can be excluded. The changes in the average pore size and specific surface area of the Mo1V0.5Al0.02K0.03Ox (Fresh) catalyst before use and the Mo1V0.5Al0.02K0.03Ox (Used) catalyst after the ODH reaction were also compared. After 48 h of operation, we observed that the average pore size of the catalyst was 13.2 nm, and the specific surface area was 5.4 m²/g. These values showed minimal changes compared to the fresh catalyst, indicating the stability of the mesostructure of the Mo1V0.5Al0.02K0.03Ox catalyst during the ODH of propane. Transmission electron microscopy (TEM) was utilized to analyze the surface morphology and micro area composition of the catalyst Mo1V0.5Al0.02K0.03Ox (Fig. 6 ). It can be observed that the catalyst generally has a cylindrical structure. Furthermore, there was no significant change in the morphology of the catalyst after 48 h of ODH reaction compared to the fresh catalyst. By observing the distribution of elements through energy-dispersive X-ray Spectroscopy (EDS) mapping, it was discovered that several elements, including doped species, were evenly dispersed on the surface of the catalyst sample. The X-ray diffraction (XRD) spectra of Mo1V0.5Ox, Mo1V0.5K0.03Ox, Mo1V0.5Al0.02K0.03Ox (Fresh), and Mo1V0.5Al0.02K0.03Ox (Used) catalysts (Fig. 7 ) indicated that the diffraction peaks at 2θ equal to 14.6°, 21.9°, 25.0°, 26.5°, 29.5°, 32.7°, 33.4°, 36.9°, 44.8°, 48.9°, 54.3°, and 58.8° belonged to the characteristic peaks of the crystalline phase V0.95Mo0.97O5 (ICSD, PDF 77–0649), which was the main crystalline phase of the Mo1V0.5Ox catalyst. Additionally, the diffraction peaks located at 2θ equal to 26.0°, 37.0°, and 53.6° indicated the presence of the crystalline phase MoO2 (ICSD, PDF 78–1069). After incorporating potassium and Al2O3 components, the XRD spectra of the Mo1V0.5K0.03Ox and Mo1V0.5Al0.02K0.03Ox catalysts revealed diffraction peaks located at 2θ equal to 8.2°, 9.2°, 10.0°, 22.9°, 25.6°, 28.9°, and 30.7°, indicated the presence of crystalline phases K2Mo7O20 (ICSD, PDF 82–0069), Mo9O26 (ICSD, PDF 84–1466), Mo17O47 (ICSD, PDF 71–0566), and Mo4O11 (ICSD, PDF 72–0048). This indicates that the valence state of Mo has changed, a finding that was further confirmed and discussed in subsequent experiments. For the Mo1V0.5Al0.02K0.03Ox (Used) catalyst, the diffraction peaks located at 2θ equal to 12.7°, 23.3°, 25.6°, and 27.3° belonged to the characteristic peaks of the crystalline phase MoO3 (ICSD, PDF 76–1003). The presence of the MoO3 crystal phase indicates that the Mo component in the catalyst underwent further oxidation by the oxygen in the feed gas after the reaction. At the same time, it can also be observed from the curve that the intensity of some diffraction peaks at 26.5°, 36.9°, and 54.3° was weakened. This indicates that as the reaction progresses, the crystal phase undergoes a change during the reaction process. The catalytic performance of catalysts is strongly affected by the valence states of Mo, V, and other elements on the surface. To examine the alterations in the valence states of elements on the catalysts' surface after modification and before and after a reaction, several catalyst samples were tested using X-ray photoelectron spectroscopy (XPS). The valence distribution of Mo species was estimated by deconvolution of the Mo 3d spectrum (Fig. 8 a), as described in the literature [44–46]. The binding energies of Mo5+ and Mo6+ in the Mo 3d5/2 region of the catalyst Mo1V0.5Ox were 232.9 eV and 234.0 eV, respectively, with corresponding full width at half maximum (FWHM) values of 1.58 eV and 1.46 eV It can be observed that the Mo 3d spectrum of the K-modified catalyst shifted towards the low valence state, indicating that the Mo6+ species were partially transformed into Mo5+ species. The relative abundance of Mo6+ to the total Mo species decreased from 34.4 at.% to 25.9 at.%. After a 48-hour ODH reaction on the catalyst Mo1V0.5Al0.02K0.03Ox, Mo5+ transitions back towards Mo6+, and the relative abundance of Mo6+ increased from 27.0 at.% to 32.7 at.%. A small amount of Mo4+ species indicated the presence of MoO2, which is consistent with the results from XRD. The deconvolution of the V 2p3/2 region for catalyst samples allowed the identification, based on literature [44]. For the catalyst Mo1V0.5Ox, of two V species at 516.3 and 517.2 eV of binding energy assigned to V4+ and V5+, respectively, with corresponding full width at half maximum (FWHM) values of 1.58 and 1.46 eV (Fig. 8b). After potassium doping, the relative abundance of V5+ decreased from 64.9 % to 59.4 %, as V5+ shifted to V4+. For the catalyst Mo1V0.5Al0.02K0.03Ox, as the reaction progressed, the relative abundance of V5+ decreased slightly from 63.2 % to 61.7 %. The O 1s XPS spectra of several catalyst samples are listed in Fig. 9 . In the case of the Mo1V0.5Ox catalyst, the peak at a binding energy of 530.9 eV corresponds to the characteristic peak of lattice oxygen bound to metal (M–O, including M–O–M), while the peak at 531.8 eV represents the characteristic peak of M–OH oxygen species. After K-modification, M–O (M–O–M) shifted to M–OH, and the relative abundance of M–OH increased from 37.5 at.% to 41.2 at.%. For the catalyst Mo1V0.5Al0.02K0.03Ox, the XPS pattern after a 48-hour reaction indicated that M-O (M-O-M) shifted to M-OH, and the relative abundance of M-OH increased from 38.1 at.% to 40.0 at.%. It indicated that lattice oxygen is consumed, but the change is weak. 4 Discussion 4.1 Brønsted acid sites are unfavorable for propene selectivity In the FT-IR spectra pyridine adsorption-desorption experiments, we compared three catalyst samples: undoped, doped with potassium species, and doped with potassium species and Al2O3. According to the results in Section 3.2 (Fig. 5), the weight and radius of the sample tablet, the characteristic peak area of Brønsted acid or Lewis acid in the spectrum, and other data were collected. The density of Brønsted and Lewis acid sites of several catalysts at different pyridine desorption temperatures was roughly calculated using the Beer-Lambert law [47], which uses the extinction coefficient defined by Emeis [48]. Fig. 10 a compares the calculated ratios of Brønsted acid sites for the three catalysts. The effect of different pyridine desorption temperatures on the ratio of Brønsted acid sites is beyond the scope of this paper, as no pattern was observed. The content of Brønsted acid sites is <1/2 for all three catalysts. confirming the slight predominance of Lewis-type acidity, a feature that is particularly evident for the catalyst Mo1V0.5K0.03Ox. The doping of Al2O3 subsequently further increased the density of Brønsted acid sites with a consequent increase in their ratio. According to reports, Brønsted acid is associated with the acetone pathway, which can result in deep oxidation to COx [36,49]. However, the low content of acid sites is not conducive to the activation of propane. This is because the selective oxidation of propane is initiated by the synergistic mechanism of acid-base pairs to abstract H from propane, and the Lewis acid site interacts with the α-H of propane to generate propene [50,51]. As a result, the reaction tends to favor low propane conversion and high propene selectivity [51]. Therefore, the density of acidic sites on the catalyst's surface must be adjusted accordingly to optimize propane conversion and propene selectivity. During the process of propane ODH, propane is initially converted into an oxygen-containing intermediate (which is suggested to be 2-propanol according to the literature [52]), under the influence of Mo–V–Ox. These oxygen-containing intermediates subsequently undergo CO bond cracking due to the catalyst's acidity, resulting in the production of H2O and olefins. The doping of potassium species serves two primary functions: first, it promotes the desorption of propene; second, it works in conjunction with alumina to adjust the catalyst's acidity. However, the introduction of only potassium species into the Mo–V–Ox catalyst results in a significant decrease in catalytic activity [49]. According to Table S2, the amount of strong acid sites nearly disappears after the introduction of potassium species. We believe that strong acid sites play a crucial role in the cracking of oxygen-containing intermediates, and a specific amount of these sites is essential. Building on this, we incorporated alumina, which enhanced the catalyst's acidity [8]. When potassium and alumina are co-doped and modified, the catalyst retains an appropriate amount of strong acid sites, resulting in higher propane conversion and increased propene selectivity. According to Fig. 10a, the ratio of Brønsted to Lewis acid site densities decreases after doping of the Mo1V0.5Ox catalyst with potassium species. This finding aligns with the research conducted by Quintana-Solórzano et al., which indicates that the addition of potassium species leads to a reduction in Brønsted acid sites, with a lesser impact on Lewis acid sites [42]. Consequently, the selectivity for propene increased, while the conversion of propane decreased. The formation of Brønsted acid sites, promoted by alumina, positively contributes to the catalyst's activity [8]. Furthermore, the pyridine-FTIR results indicate that the densities of Lewis acid sites and Brønsted acid sites on the surfaces of catalysts doped with both species are not simply superimposed or canceled out. Thus, we can conclude that doping with potassium and alumina can synergistically modify the density of acid sites on the catalyst, establishing a balance between high propane conversion and optimal propene selectivity. Fig. 10b shows the trends of propane conversion (gradually increasing), propene selectivity (gradually decreasing), and COx selectivity (gradually increasing) for several catalysts with increasing density of Brønsted acid sites, which can validate our above conclusions. In addition, the effect of Lewis acid sites content is illustrated in Fig. S4a. It is important to note that the total acid sites content significantly impacts the performance of the catalyst. Therefore, based on the total acid content calculated through NH3-TPD (Table S2), we have also included a trend curve depicting the relationship between propane conversion rate and propene selectivity as total acid content varies (Fig. S4b). It is evident that as total acidity increases, the conversion rate of propane rises, while the selectivity for propene declines. 4.2 Mo5+ and V4+ positively affects propene selectivity The catalytic test shows that potassium doping can increase the selectivity of propene and reduce the selectivity of oxygenates. According to the XPS results in Section 3.2, we aimed to elucidate the factors contributing to the enhanced catalytic performance from a different perspective, in addition to the variation in acid site density. The catalyst Mo1V0.5K0.03Ox exhibits weaker activity than the catalyst Mo1V0.5Ox, but higher selectivity for propene. The partial transition from Mo6+ species to Mo5+ species explains this phenomenon from one aspect (Fig. 8a). According to the literature, the role of Mo6+ species is to insert oxygen into the intermediate product propene to further generate oxygenates [53], and the decrease in the relative abundance of Mo6+ reduces the catalyst activity [54]. Fig. 11 shows trends in propane conversion, propene selectivity, acetone selectivity, and COx selectivity as the relative abundance of Mo6+ increases, which validates the above statement. After 48 h of propane ODH reaction, the Mo 3d spectrum of the catalyst Mo1V0.5Al0.02K0.03Ox shifted to a higher valence state. Mo5+ species were oxidized to Mo6+ species, indicating that the presence of oxygen in the feed gas during the reaction process can \"reactivate\" the catalyst, continuously supplement the consumed lattice oxygen, and maintain the activity of the catalyst. It is inferred that this process can provide a long service life for the catalyst. During XPS testing, exposing catalyst samples to X-rays will induce the transition of species valence [44]. Due to the weak transition of Mo4+ species, it is difficult to accurately determine the influence of dopants or the oxidation reaction process on Mo4+ species. Propane is activated by V5+ species, which then breaks the CH bond of propane, resulting in the conversion of V5+ species to V4+ species. The V4+ species are then oxidized by gaseous oxygen to regenerate V5+ species, thereby achieving a balance of V4+ and V5+ [55,56]. As indicated by XPS results in Fig. 8b, when only potassium species were doped, V5+ shifted towards V4+, which can explain the decrease in catalyst activity from one perspective [57], This pattern can be observed in Fig. 11, i.e., an increase in the relative abundance of V5+ leads to an increase in catalyst activity, an increase in the oxidation of propane, an increase in propane conversion, and a decrease in propene selectivity. With the addition of Al2O3, V4+ species transitioned to the higher valence V5+ species. As the ODH reaction progressed, the V5+ species were partially reduced back to V4+ species. This phenomenon may be attributed to the redox of the catalyst during the reaction, this slight change can be ignored, so it can be considered that the catalyst is relatively stable in the propane ODH reaction. As illustrated in Fig. 9, after the K-modification of Mo1V0.5Ox, it is evident that the lattice oxygen transitions from M–O (or M–O–M) to M–OH. As the ODH reaction progresses, M-OH moves towards the lattice oxygen. Toyoshima [58] pointed out through Density Functional Theory (DFT) calculations that the M-OH species is a stable and excellent species under thermodynamic conditions. The enhancement of catalytic stability is closely associated with the rapid migration of bulk lattice oxygen, and the movement of oxygen species typically corresponds to the migration of cation species [59]. We concluded that the partial transfer of this oxygen species is one of the reasons why the modified catalyst exhibits weaker activity but higher selectivity, as the relative abundance of M-OH increased, the trends in propane conversion and several product selectivities were opposite to those of Mo6+ and V5+ (Fig. 12 ). In addition, after 48 h of the propane ODH reaction, the oxygen content of the catalyst Mo1V0.5Al0.02K0.03Ox changed only slightly. Ishikawa further studied the type of lattice oxygen and believed that the catalytically active species in Mo–V–Ox were generated by oxygen defects [60]. Therefore, during the reaction process, these oxygen defects support the stability of the catalyst by being continuously consumed and created. This is also consistent with our results. In general, the effects of potassium species and Al2O3 doping on the performance of Mo–V–Ox catalysts are multifaceted. Apart from influencing the number of acid sites, these effects also manifest in the modifications of crystal phase, molybdenum species, vanadium species, and the migration of lattice oxygen. A comprehensive analysis should be conducted from various perspectives. 4.3 Steam promotes propene to form oxygenates Steam is considered to enhance the desorption of intermediate products from the catalyst bed. This helps prevent deep oxidation, leading to an improvement in intermediate products selectivity [39,61]. Under these conditions, it is speculated that water competed with propane, propene, or other intermediates for adsorption sites. The density of acidic sites on the catalyst surface will also change with the increase in surface hydroxyl concentration. At this point, the degree of surface hydroxylation increases [62], which reduces the number of oxygen sites available for alkane adsorption, consequently lowering the reaction rate. It is the reason for the decreased in propane conversion. However, if only steam is added to the feed gas without controlling the contact time, the contact time will be reduced. Therefore the contact time of the reaction was kept consistent for different steam additions by controlling the weight of the catalyst bed. Fig. 2 have indicated that steam has promoted further oxidation of propene to produce acetone and acetic acid (mostly acetone), the conversion of propane increased, yet the selectivity of COx did not increase. Steam has a significant effect on the selective oxidation of propane when using mixed metal oxide catalysts. Some studies have indicated that introducing steam to the feed gas can enhance the selectivity towards oxygenates [63,64]. The impact of steam varies depending on the catalyst used, on some catalysts, steam in the feed gas is necessary for acid formation [65,66]. The influence of water on the catalytic performance in the selective oxidation process is multifaceted. It can alter the reaction pathway and the surface properties of the catalyst simultaneously. To investigate the effect of steam on propane ODH, targeted supplementary experiments were carried out using a Mo1V0.5Al0.02K0.03Ox catalyst, choosing to carry out the reaction at a temperature of 400 °C to make the trend in the selectivity of the oxygenated products clearer (Fig. 13 ). The pattern of change in propane conversion and in the selectivity of several major products can be seen in Fig. 13. As the water flow rate was elevated from 0 to 0.4 ml/min, the propane conversion increased from 29.8 % to 46.8 %, while the propylene selectivity decreased from 56.6 % to 42.2 %, with the selectivity of COx decreasing and then increasing, and the selectivity of acetone increasing and then decreasing. According to Baca et al. [67], it was pointed out that in the presence of steam in the feed gas, the Lewis acid site was converted to the Brønsted acid site, providing an acidic environment for the conversion of propene to acetone. Similar conclusions have also been mentioned in the research of Ishikawa et al. [29]. Therefore, when controlling for a consistent contact time for each reaction, the presence of water caused a higher density of Brønsted acid sites, promoting the conversion of propene towards the reaction path of acetone, and as the amount of water increased, the density of Brønsted acid sites increased further, and acetone was further oxidized to COx. Thus, it will lead to excessive oxidation and the production of acetic acid or COx, reducing the selectivity of the target product, propene. The conversion of propane is increasing, while the selectivity for propene is decreasing. In the other case, when the water content in the feed gas is low, although propene is oxidized to acetone, the increase in density of the lower Brønsted acid sites is not sufficient to allow further oxidation of acetone, which increases the selectivity of propene + acetone and decreases the selectivity of COx due to desorption of water. As the water content increases, the density of Brønsted acid sites increases, resulting the decrease in acetone selectivity caused by the formation of COx (Fig. 13). This is the reason why the selectivity of COx decreases and then increases while the selectivity of acetone increases and then decreases in Fig. 13. To summarize, we conclude that during the ODH process of propane using this type of catalyst, it is important to decide whether to add steam to the feed gas and adjust the steam according to the requirements. This approach enables us to achieve reaction products with diverse compositions. 5 Conclusions A novel mixed metal oxide catalyst Mo1V0.5Al0.02K0.03Ox doped with aluminum and potassium was synthesized using a simple co-impregnation method. Its propene selectivity reached 83.2 %, and the propane conversion rate was 12.7 % at 300 °C. FT-IR pyridine adsorption-desorption experiments revealed that the concentration of acidic sites on the modified catalyst surface, particularly Brønsted acid sites, decreased. Further discussion suggests that the synergistic doping of potassium and alumina can regulate the density of acid centers on the catalyst, achieving a balance between high propane conversion and optimal propene selectivity. The catalyst was characterized using BET, TEM, XPS, and other methods before and after a 48-hour ODH reaction. The results indicate that the catalyst exhibits good stability throughout the propane ODH reaction. After modification, the Brønsted acid content is reduced, the metal moves toward lower valence states, leading to an enhancement in the selectivity of propene. Additionally, in this study, the reaction temperature is lower than the typical propane ODH reaction temperature. Based on the experimental results, we conclude that the presence of steam promotes the conversion of the intermediate product propene to oxygenates during the reaction. At a temperature of 300 °C and a molar ratio of propane to oxygen of 8:1, the addition of a small amount of steam to the feed gas changes the composition of the oxidation products. The conversion of propane is enhanced and the generation of oxides does not lead to over-oxidation (which increases COx selectivity). CRediT authorship contribution statement Xiaoyu Yan: Writing – review & editing, Writing – original draft, Validation, Investigation, Formal analysis, Data curation, Conceptualization. Xiaoqing Xu: Validation, Investigation. Yuhan Sun: Validation, Investigation. Xiuyi Li: Writing – review & editing. Jiale Xu: Writing – review & editing. Renjie Ji: Writing – review & editing. Rui Huang: Writing – review & editing. Chunyi Li: Writing – review & editing, Supervision, Resources, Project administration, Funding acquisition, Formal analysis, Conceptualization. Declaration of competing interest The authors declare that they have no known competing financial interests or personal relationships that could have appeared to influence the work reported in this paper. Supplementary materials Supplementary material associated with this article can be found, in the online version, at doi:10.1016/j.mcat.2024.114640. Appendix Supplementary materials Image, application 1 References [1] X. Jiang L. Sharma V. Fung S.J. Park C.W. Jones B.G. Sumpter J. Baltrusaitis Z. Wu Oxidative dehydrogenation of propane to propylene with soft oxidants via heterogeneous catalysis ACS Catal. 11 2021 2182 2234 10.1021/acscatal.0c03999 X. Jiang, L. Sharma, V. Fung, S.J. Park, C.W. Jones, B.G. Sumpter, J. Baltrusaitis, Z. Wu, Oxidative dehydrogenation of propane to propylene with soft oxidants via heterogeneous catalysis. ACS Catal.. 11 (2021) 2182–2234, https://doi.org/10.1021/acscatal.0c03999. [2] T.H. Kim K.H. Kang M. Baek J.H. Song U.G. Hong D.S. Park W.C. Choi Y.K. Park I.K. Song Dehydrogenation of propane to propylene with lattice oxygen over CrOy/Al2O3-ZrO2 catalysts Mol. Catal. 433 2017 1 7 10.1016/j.mcat.2016.12.004 T.H. Kim, K.H. Kang, M. Baek, J.H. Song, U.G. Hong, D.S. Park, W.C. Choi, Y.K. Park, I.K. Song, Dehydrogenation of propane to propylene with lattice oxygen over CrOy/Al2O3-ZrO2 catalysts. Mol. Catal. 433 (2017) 1–7, https://doi.org/10.1016/j.mcat.2016.12.004. [3] J.H. Carter T. Bere J.R. Pitchers D.G. Hewes B.D. Vandegehuchte C.J. Kiely S.H. Taylor G.J. Hutchings Direct and oxidative dehydrogenation of propane: from catalyst design to industrial application Green Chem 23 2021 9747 9799 10.1039/D1GC03700E J.H. Carter, T. Bere, J.R. Pitchers, D.G. Hewes, B.D. Vandegehuchte, C.J. Kiely, S.H. Taylor, G.J. Hutchings, Direct and oxidative dehydrogenation of propane: from catalyst design to industrial application. Green Chem. 23 (2021) 9747–9799, https://doi.org/10.1039/D1GC03700E. [4] Y.L. Shan W.T. Zhao S.L. Zhao X.X. Wang H.L. Sun W.L. Yu J.W. Ding X. Feng D. Chen Effects of alumina phases on the structure and performance of VOx/Al2O3 catalysts in non-oxidative propane dehydrogenation Mol. Catal. 504 2021 111466 10.1016/j.mcat.2021.111466 Y.L. Shan, W.T. Zhao, S.L. Zhao, X.X. Wang, H.L. Sun, W.L. Yu, J.W. Ding, X. Feng, D. Chen, Effects of alumina phases on the structure and performance of VOx/Al2O3 catalysts in non-oxidative propane dehydrogenation. Mol. Catal. 504 (2021) 111466, https://doi.org/10.1016/j.mcat.2021.111466. [5] J.S. Valente R. Quintana-Solórzano H. Armendáriz-Herrera J.M.M. Millet Decarbonizing petrochemical processes: contribution and perspectives of the selective oxidation of C1–C3 paraffins ACS Catal. 13 2023 1693 1716 10.1021/acscatal.2c05161 J.S. Valente, R. Quintana-Solórzano, H. Armendáriz-Herrera, J.M.M. Millet, Decarbonizing petrochemical processes: contribution and perspectives of the selective oxidation of C1–C3 paraffins. ACS Catal.. 13 (2023) 1693–1716, https://doi.org/10.1021/acscatal.2c05161. [6] C.A. Carrero R. Schlögl I.E. Wachs R. Schomaecker Critical literature review of the kinetics for the oxidative dehydrogenation of propane over well-defined supported vanadium oxide catalysts ACS Catal. 4 2014 3357 3380 10.1021/cs5003417 C.A. Carrero, R. Schlögl, I.E. Wachs, R. Schomaecker, Critical literature review of the kinetics for the oxidative dehydrogenation of propane over well-defined supported vanadium oxide catalysts. ACS Catal.. 4 (2014) 3357–3380, https://doi.org/10.1021/cs5003417. [7] A. Alamdari R. Karimzadeh S. Abbasizadeh Present state of the art of and outlook on oxidative dehydrogenation of ethane: catalysts and mechanisms Rev. Chem. Eng. 37 2021 481 532 10.1515/revce-2017-0109 A. Alamdari, R. Karimzadeh, S. Abbasizadeh, Present state of the art of and outlook on oxidative dehydrogenation of ethane: catalysts and mechanisms. Rev. Chem. Eng. 37 (2021) 481–532, https://doi.org/10.1515/revce-2017-0109. [8] Y. Gambo S. Adamu A.A. Abdulrasheed R.A. Lucky M.S. Ba-Shammakh M.M. Hossain Catalyst design and tuning for oxidative dehydrogenation of propane–A review Appl. Catal. A Gen. 609 2021 117914 10.1016/j.apcata.2020.117914 Y. Gambo, S. Adamu, A.A. Abdulrasheed, R.A. Lucky, M.S. Ba-Shammakh, M.M. Hossain, Catalyst design and tuning for oxidative dehydrogenation of propane–A review. Appl. Catal. A Gen. 609 (2021) 117914, https://doi.org/10.1016/j.apcata.2020.117914. [9] J.D. Pless B.B. Bardin H.S. Kim D. Ko M.T. Smith R.R. Hammond P.C. Stair K.R. Poeppelmeier Catalytic oxidative dehydrogenation of propane over Mg-V/Mo oxides J. Catal. 223 2004 419 431 10.1016/j.jcat.2004.01.023 J.D. Pless, B.B. Bardin, H.S. Kim, D. Ko, M.T. Smith, R.R. Hammond, P.C. Stair, K.R. Poeppelmeier, Catalytic oxidative dehydrogenation of propane over Mg-V/Mo oxides. J. Catal. 223 (2004) 419–431, https://doi.org/10.1016/j.jcat.2004.01.023. [10] Z.Y. Wang Z.H. He L.Y. Li S.Y. Yang M.X. He Y.C. Sun K. Wang J.G. Chen Z.T. Liu Research progress of CO2 oxidative dehydrogenation of propane to propylene over Cr-free metal catalysts Rare Met. 41 2022 2129 2152 10.1007/s12598-021-01959-y Z.Y. Wang, Z.H. He, L.Y. Li, S.Y. Yang, M.X. He, Y.C. Sun, K. Wang, J.G. Chen, Z.T. Liu, Research progress of CO2 oxidative dehydrogenation of propane to propylene over Cr-free metal catalysts. Rare Met.. 41 (2022) 2129–2152, https://doi.org/10.1007/s12598-021-01959-y. [11] Y. Luo J. Zuo D. Lin Q. Qian Y. Zheng X. Feng B. Huang Q. Chen Anchoring Pt on surface/bulk of LaCoO3 nanotubes via one step of coaxial electrospinning for efficient total propane oxidation Mol. Catal. 475 2019 110504 10.1016/j.mcat.2019.110504 Y. Luo, J. Zuo, D. Lin, Q. Qian, Y. Zheng, X. Feng, B. Huang, Q. Chen, Anchoring Pt on surface/bulk of LaCoO3 nanotubes via one step of coaxial electrospinning for efficient total propane oxidation. Mol. Catal. 475 (2019) 110504, https://doi.org/10.1016/j.mcat.2019.110504. [12] Z. Li A.W. Peters V. Bernales M.A. Ortuño N.M. Schweitzer M.R. DeStefano L.C. Gallington A.E.P. Prats K.W. Chapman C.J. Cramer L. Gagliardi J.T. Hupp O.K. Farha Metal-organic framework supported cobalt catalysts for the oxidative dehydrogenation of propane at low temperature ACS Cent. Sci. 3 2017 31 38 10.1021/acscentsci.6b00290 Z. Li, A.W. Peters, V. Bernales, M.A. Ortuño, N.M. Schweitzer, M.R. DeStefano, L.C. Gallington, A.E.P. Prats, K.W. Chapman, C.J. Cramer, L. Gagliardi, J.T. Hupp, O.K. Farha, Metal-organic framework supported cobalt catalysts for the oxidative dehydrogenation of propane at low temperature. ACS Cent. Sci. 3 (2017) 31–38, https://doi.org/10.1021/acscentsci.6b00290. [13] J.H. Li C.C. Wang C.J. Huang Y.F. Sun W.Z. Weng H.L. Wan Mesoporous nickel oxides as effective catalysts for oxidative dehydrogenation of propane to propene Appl. Catal. A Gen. 382 2010 99 105 10.1016/j.apcata.2010.04.034 J.H. Li, C.C. Wang, C.J. Huang, Y.F. Sun, W.Z. Weng, H.L. Wan, Mesoporous nickel oxides as effective catalysts for oxidative dehydrogenation of propane to propene. Appl. Catal. A Gen. 382 (2010) 99–105, https://doi.org/10.1016/j.apcata.2010.04.034. [14] J.T. Grant C.A. Carrero F. Goeltl J. Venegas P. Mueller S.P. Burt S.E. Specht W.P. McDermott A. Chieregato I. Hermans Selective oxidative dehydrogenation of propane to propene using boron nitride catalysts Science 54 2016 1570 1573 10.1126/science.aaf788 J.T. Grant, C.A. Carrero, F. Goeltl, J. Venegas, P. Mueller, S.P. Burt, S.E. Specht, W.P. McDermott, A. Chieregato, I. Hermans, Selective oxidative dehydrogenation of propane to propene using boron nitride catalysts. Science 54 (2016) 1570–1573, https://doi.org/10.1126/science.aaf788. [15] P. Chaturbedy M. Ahamed M. Eswaramoorthy Oxidative dehydrogenation of propane over a high surface area boron nitride catalyst: exceptional selectivity for olefins at high conversion ACS Omega 3 2018 369 374 10.1021/acsomega.7b01489 P. Chaturbedy, M. Ahamed, M. Eswaramoorthy, Oxidative dehydrogenation of propane over a high surface area boron nitride catalyst: exceptional selectivity for olefins at high conversion. ACS Omega 3 (2018) 369–374, https://doi.org/10.1021/acsomega.7b01489. [16] S. Zhang H. Liu Insights into the structural requirements for oxidative dehydrogenation of propane on crystalline Mg–VO catalysts Appl. Catal. A Gen. 568 2018 1 10 10.1016/j.apcata.2018.09.019 S. Zhang, H. Liu, Insights into the structural requirements for oxidative dehydrogenation of propane on crystalline Mg–VO catalysts. Appl. Catal. A Gen. 568 (2018) 1–10, https://doi.org/10.1016/j.apcata.2018.09.019. [17] A. Corma J.M.L. Nieto N. Paredes Influence of the preparation methods of V-Mg-O catalysts on their catalytic properties for the oxidative dehydrogenation of propane J. Catal. 144 1993 425 438 10.1006/jcat.1993.1343 A. Corma, J.M.L. Nieto, N. Paredes, Influence of the preparation methods of V-Mg-O catalysts on their catalytic properties for the oxidative dehydrogenation of propane. J. Catal. 144 (1993) 425–438, https://doi.org/10.1006/jcat.1993.1343. [18] P. Concepción H. Knözinger J.M.L. Nieto A. Martínez-Arias Characterization of supported vanadium oxide catalysts. Nature of the vanadium species in reduced catalysts J. Phys. Chem. B 106 2002 2574 2582 10.1021/jp010918s P. Concepción, H. Knözinger, J.M.L. Nieto, A. Martínez-Arias, Characterization of supported vanadium oxide catalysts. Nature of the vanadium species in reduced catalysts. J. Phys. Chem. B 106 (2002) 2574–2582, https://doi.org/10.1021/jp010918s. [19] S. Al-Ghamdi J. Moreira H.D. Lasa Kinetic modeling of propane oxidative dehydrogenation over VOx/γ-Al2O3 catalysts in the chemical reactor engineering center riser reactor simulator Ind. Eng. Chem. Res. 53 2014 15317 15332 10.1021/ie404064j S. Al-Ghamdi, J. Moreira, H.D. Lasa, Kinetic modeling of propane oxidative dehydrogenation over VOx/γ-Al2O3 catalysts in the chemical reactor engineering center riser reactor simulator. Ind. Eng. Chem. Res. 53 (2014) 15317–15332, https://doi.org/10.1021/ie404064j. [20] T. Blasco J.M.L. Nieto Oxidative dyhydrogenation of short chain alkanes on supported vanadium oxide catalysts Appl. Catal. A Gen. 157 1997 117 142 10.1016/S0926-860X(97)00029-X T. Blasco, J.M.L. Nieto, Oxidative dyhydrogenation of short chain alkanes on supported vanadium oxide catalysts. Appl. Catal. A Gen. 157 (1997) 117–142, https://doi.org/10.1016/S0926-860X(97)00029-X. [21] J.M.L. Nieto The selective oxidative activation of light alkanes. From supported vanadia to multicomponent bulk V-containing catalysts Top. Catal. 41 2006 3 15 10.1007/s11244-006-0088-4 J.M.L. Nieto, The selective oxidative activation of light alkanes. From supported vanadia to multicomponent bulk V-containing catalysts. Top. Catal. 41 (2006) 3–15, https://doi.org/10.1007/s11244-006-0088-4. [22] T. Ushikubo, H. Nakamura, Y. Koyasu, S. Wajiki, Method for producing an unsaturated carboxylic acid, US Patent 5 380 933 (1995). [23] T. Katou D. Vitry W. Ueda Hydrothermal synthesis of a new Mo–V–O complex metal oxide and its catalytic activity for the oxidation of propane Chem. Lett. 32 2003 1028 1029 10.1246/cl.2003.1028 T. Katou, D. Vitry, W. Ueda, Hydrothermal synthesis of a new Mo–V–O complex metal oxide and its catalytic activity for the oxidation of propane. Chem. Lett. 32 (2003) 1028–1029, https://doi.org/10.1246/cl.2003.1028. [24] R. Obunai K. Tamura I. Ogino S.R. Mukai W. Ueda Mo–V–O nanocrystals synthesized in the confined space of a mesoporous carbon Appl. Catal. A Gen. 624 2021 118294 10.1016/j.apcata.2021.118294 R. Obunai, K. Tamura, I. Ogino, S.R. Mukai, W. Ueda, Mo–V–O nanocrystals synthesized in the confined space of a mesoporous carbon. Appl. Catal. A Gen. 624 (2021) 118294, https://doi.org/10.1016/j.apcata.2021.118294. [25] M. Sadakane W. Ueda Building block synthesis of crystalline Mo–V-based oxides: selective oxidation catalysts J. Jpn. Petrol. Inst. 55 2012 229 235 10.1627/jpi.55.229 M. Sadakane, W. Ueda, Building block synthesis of crystalline Mo–V-based oxides: selective oxidation catalysts. J. Jpn. Petrol. Inst. 55 (2012) 229–235, https://doi.org/10.1627/jpi.55.229. [26] S. Ishikawa Z. Zhang W. Ueda Unit synthesis approach for creating high dimensionally structured complex metal oxides as catalysts for selective oxidations ACS Catal. 8 2018 2935 2943 10.1021/acscatal.7b02244 S. Ishikawa, Z. Zhang, W. Ueda, Unit synthesis approach for creating high dimensionally structured complex metal oxides as catalysts for selective oxidations. ACS Catal.. 8 (2018) 2935–2943, https://doi.org/10.1021/acscatal.7b02244. [27] S. Ishikawa T. Murayama B. Katryniok F. Dumeignil M. Araque S. Heyte S. Paul Y. Yamada M. Iwazaki N. Noda W. Ueda Influence of the structure of trigonal Mo–V–M3rd oxides (M3rd=–, Fe, Cu, W) on catalytic performances in selective oxidations of ethane, acrolein, and allyl alcohol Appl. Catal. A Gen. 584 2019 117151 10.1016/j.apcata.2019.117151 S. Ishikawa, T. Murayama, B. Katryniok, F. Dumeignil, M. Araque, S. Heyte, S. Paul, Y. Yamada, M. Iwazaki, N. Noda, W. Ueda, Influence of the structure of trigonal Mo–V–M3rd oxides (M3rd=–, Fe, Cu, W) on catalytic performances in selective oxidations of ethane, acrolein, and allyl alcohol. Appl. Catal. A Gen. 584 (2019) 117151, https://doi.org/10.1016/j.apcata.2019.117151. [28] S. Ishikawa D. Kobayashi T. Konya S. Ohmura T. Murayama N. Yasuda M. Sadakane W. Ueda Redox treatment of orthorhombic Mo29V11O112 and relationships between crystal structure, microporosity and catalytic performance for selective oxidation of ethane J. Phys. Chem. C 119 2015 7195 7206 10.1021/jp512848w S. Ishikawa, D. Kobayashi, T. Konya, S. Ohmura, T. Murayama, N. Yasuda, M. Sadakane, W. Ueda, Redox treatment of orthorhombic Mo29V11O112 and relationships between crystal structure, microporosity and catalytic performance for selective oxidation of ethane. J. Phys. Chem. C 119 (2015) 7195–7206, https://doi.org/10.1021/jp512848w. [29] S. Ishikawa Y. Yamada N. Kashio N. Noda K. Shimoda M. Hayashi T. Murayama W. Ueda True catalytically active structure in Mo–V-based mixed oxide catalysts for selective oxidation of acrolein ACS Catal. 11 2021 10294 10307 10.1021/acscatal.1c01570 S. Ishikawa, Y. Yamada, N. Kashio, N. Noda, K. Shimoda, M. Hayashi, T. Murayama, W. Ueda, True catalytically active structure in Mo–V-based mixed oxide catalysts for selective oxidation of acrolein. ACS Catal.. 11 (2021) 10294–10307, https://doi.org/10.1021/acscatal.1c01570. [30] S. Ishikawa Y. Yamada C. Qiu Y. Kawahara N. Hiyoshi A. Yoshida W. Ueda Synthesis of a crystalline orthorhombic Mo–V–Cu oxide for selective oxidation of acrolein Chem. Mater. 31 2019 1408 1417 10.1021/acs.chemmater.8b04962 S. Ishikawa, Y. Yamada, C. Qiu, Y. Kawahara, N. Hiyoshi, A. Yoshida, W. Ueda, Synthesis of a crystalline orthorhombic Mo–V–Cu oxide for selective oxidation of acrolein. Chem. Mater. 31 (2019) 1408–1417, https://doi.org/10.1021/acs.chemmater.8b04962. [31] S. Ishikawa N. Noda M. Wada S. Tsurumi W. Ueda Selective oxidation of methacrolein over crystalline Mo3VOx catalysts and comparison of their catalytic properties with heteropoly acid catalysts ACS Catal. 10 2020 10535 10545 10.1021/acscatal.0c02530 S. Ishikawa, N. Noda, M. Wada, S. Tsurumi, W. Ueda, Selective oxidation of methacrolein over crystalline Mo3VOx catalysts and comparison of their catalytic properties with heteropoly acid catalysts. ACS Catal.. 10 (2020) 10535–10545, https://doi.org/10.1021/acscatal.0c02530. [32] S. Ishikawa Y. Goto Y. Kawahara S. Inukai N. Hiyoshi N.F. Dummer T. Murayama A. Yoshida M. Sadakane W. Ueda Synthesis of crystalline microporous Mo–V–Bi oxide for selective (amm) oxidation of light alkanes Chem. Mater. 29 2017 2939 2950 10.1021/acs.chemmater.6b05224 S. Ishikawa, Y. Goto, Y. Kawahara, S. Inukai, N. Hiyoshi, N.F. Dummer, T. Murayama, A. Yoshida, M. Sadakane, W. Ueda, Synthesis of crystalline microporous Mo–V–Bi oxide for selective (amm) oxidation of light alkanes. Chem. Mater. 29 (2017) 2939–2950, https://doi.org/10.1021/acs.chemmater.6b05224. [33] N. Li M. Yuan J. Xu X. Li G. Wang X. Zhu C. Li Efficient synthesis of the di-tert-butyl peroxide by isobutane selective peroxidation with molecular oxygen over sulfated titanium oxide Mol. Catal. 553 2024 113770 10.1016/j.mcat.2023.113770 N. Li, M. Yuan, J. Xu, X. Li, G. Wang, X. Zhu, C. Li, Efficient synthesis of the di-tert-butyl peroxide by isobutane selective peroxidation with molecular oxygen over sulfated titanium oxide. Mol. Catal. 553 (2024) 113770, https://doi.org/10.1016/j.mcat.2023.113770. [34] R. Camposeco A.E. Torres R. Zanella Catalytic oxidation of propane over Pt-Pd bimetallic nanoparticles supported on TiO2 Mol. Catal. 532 2022 112738 10.1016/j.mcat.2022.112738 R. Camposeco, A.E. Torres, R. Zanella, Catalytic oxidation of propane over Pt-Pd bimetallic nanoparticles supported on TiO2. Mol. Catal. 532 (2022) 112738, https://doi.org/10.1016/j.mcat.2022.112738. [35] M.M. Lin Complex metal-oxide catalysts for selective oxidation of propane and derivatives: I. Catalysts preparation and application in propane selective oxidation to acrylic acid Appl. Catal. A Gen. 250 2003 305 318 10.1016/S0926-860X(03)00257-6 M.M. Lin, Complex metal-oxide catalysts for selective oxidation of propane and derivatives: I. Catalysts preparation and application in propane selective oxidation to acrylic acid. Appl. Catal. A Gen. 250 (2003) 305–318, https://doi.org/10.1016/S0926-860X(03)00257-6. [36] H. Hibst F. Rosowski G. Cox New Cs-containing Mo–V4+ based oxides with the structure of the M1 phase-Base for new catalysts for the direct alkane activation Catal. Today 117 2006 234 241 10.1016/j.cattod.2006.05.045 H. Hibst, F. Rosowski, G. Cox, New Cs-containing Mo–V4+ based oxides with the structure of the M1 phase-Base for new catalysts for the direct alkane activation. Catal. Today 117 (2006) 234–241, https://doi.org/10.1016/j.cattod.2006.05.045. [37] G. Tsilomelekis A. Christodoulakis S. Boghosian Support effects on structure and activity of molybdenum oxide catalysts for the oxidative dehydrogenation of ethane Catal. Today 127 2007 139 147 10.1016/j.cattod.2007.03.026 G. Tsilomelekis, A. Christodoulakis, S. Boghosian, Support effects on structure and activity of molybdenum oxide catalysts for the oxidative dehydrogenation of ethane. Catal. Today, 127 (2007) 139–147, https://doi.org/10.1016/j.cattod.2007.03.026. [38] F. Ivars B. Solsona P. Botella M.D. Soriano J.M.L. Nieto Selective oxidation of propane over alkali-doped Mo–V–Sb–O catalysts Catal. Today 141 2009 294 299 10.1016/j.cattod.2008.07.002 F. Ivars, B. Solsona, P. Botella, M.D. Soriano, J.M.L. Nieto, Selective oxidation of propane over alkali-doped Mo–V–Sb–O catalysts. Catal. Today 141 (2009) 294–299, https://doi.org/10.1016/j.cattod.2008.07.002. [39] J.M. Oliver J.M.L. Nieto P. Botella Selective oxidation and ammoxidation of propane on a Mo–V–Te–Nb–O mixed metal oxide catalyst: a comparative study Catal. Today 96 2004 241 249 10.1016/j.cattod.2004.06.148 J.M. Oliver, J.M.L. Nieto, P. Botella, Selective oxidation and ammoxidation of propane on a Mo–V–Te–Nb–O mixed metal oxide catalyst: a comparative study. Catal. Today 96 (2004) 241–249, https://doi.org/10.1016/j.cattod.2004.06.148. [40] R.K. Grasselli J.D. Burrington Selective oxidation and ammoxidation of propylene by heterogeneous catalysis Adv. Catal. 30 1981 133 163 10.1016/S0360-0564(08)60327-2 R.K. Grasselli, J.D. Burrington, Selective oxidation and ammoxidation of propylene by heterogeneous catalysis. Adv. Catal. 30 (1981) 133–163, https://doi.org/10.1016/S0360-0564(08)60327-2. [41] R. Quintana-Solórzano M.L. Trejo-Reyes I. Mejía-Centeno H. Armendáriz-Herrera A. Rodríguez M.L. Guzmán J.S. Valente On the simultaneous effect of temperature, pressure, water content and space-time on acrylic acid production from propane Fuel 282 2020 118852 10.1016/j.fuel.2020.118852 R. Quintana-Solórzano, M.L. Trejo-Reyes, I. Mejía-Centeno, H. Armendáriz-Herrera, A. Rodríguez, M.L. Guzmán, J.S. Valente, On the simultaneous effect of temperature, pressure, water content and space-time on acrylic acid production from propane. Fuel 282 (2020) 118852, https://doi.org/10.1016/j.fuel.2020.118852. [42] R. Quintana-Solórzano I. Mejía-Centeno H. Armendáriz-Herrera J. Ramírez-Salgado A. Rodríguez-Hernandez M.D.L. Guzman-Castillo J.M.L. Nieto J.S. Valente Discerning the metal doping effect on surface redox and acidic properties in a MoVTeNbOx for Propa(e)ne oxidation ACS Omega 6 2021 15279 15291 10.1021/acsomega.1c01591 R. Quintana-Solórzano, I. Mejía-Centeno, H. Armendáriz-Herrera, J. Ramírez-Salgado, A. Rodríguez-Hernandez, M.D.L. Guzman-Castillo, J.M.L. Nieto, J.S. Valente, Discerning the metal doping effect on surface redox and acidic properties in a MoVTeNbOx for Propa(e)ne oxidation. ACS Omega 6 (2021) 15279–15291, https://doi.org/10.1021/acsomega.1c01591. [43] K. Samson M. Sliwa R.P. Socha K. Góra-Marek D. Mucha D. Rutkowska-Zbik J.F. Paul M. Ruggiero-Mikołajczyk R. Grabowski J. Słoczyński Influence of ZrO2 structure and copper electronic state on activity of Cu/ZrO2 catalysts in methanol synthesis from CO2 ACS Catal. 4 2014 3730 3741 10.1021/cs500979c K. Samson, M. Sliwa, R.P. Socha, K. Góra-Marek, D. Mucha, D. Rutkowska-Zbik, J.F. Paul, M. Ruggiero-Mikołajczyk, R. Grabowski, J. Słoczyński, Influence of ZrO2 structure and copper electronic state on activity of Cu/ZrO2 catalysts in methanol synthesis from CO2. ACS Catal.. 4 (2014) 3730–3741, https://doi.org/10.1021/cs500979c. [44] D.A. Svintsitskiy T.Y. Kardash E.V. Lazareva V.M. Bondareva X-ray-induced transformations on the surface of MoVNbTe mixed oxide catalyst: an XPS study Appl. Surf. Sci. 535 2021 147676 10.1016/j.apsusc.2020.147676 D.A. Svintsitskiy, T.Y. Kardash, E.V. Lazareva, V.M. Bondareva, X-ray-induced transformations on the surface of MoVNbTe mixed oxide catalyst: an XPS study. Appl. Surf. Sci. 535 (2021) 147676, https://doi.org/10.1016/j.apsusc.2020.147676. [45] J.G. Choi L.T. Thompson XPS study of as-prepared and reduced molybdenum oxides Appl. Surf. Sci. 93 1996 143 149 10.1016/0169-4332(95)00317-7 J.G. Choi, L.T. Thompson, XPS study of as-prepared and reduced molybdenum oxides. Appl. Surf. Sci. 93 (1996) 143–149, https://doi.org/10.1016/0169-4332(95)00317-7. [46] E.J. Lede F.G. Requejo B. Pawelec J.L.G. Fierro XANES Mo L-edges and XPS study of Mo loaded in HY zeolite J. Phys. Chem. B 106 2002 7824 7831 10.1021/jp014648p E.J. Lede, F.G. Requejo, B. Pawelec, J.L.G. Fierro, XANES Mo L-edges and XPS study of Mo loaded in HY zeolite. J. Phys. Chem. B 106 (2002) 7824–7831, https://doi.org/10.1021/jp014648p. [47] T. Onfroy G. Clet M. Houalla Quantitative IR characterization of the acidity of various oxide catalysts Microporous Mesoporous Mater. 82 2005 99 104 10.1016/j.micromeso.2005.02.020 T. Onfroy, G. Clet, M. Houalla, Quantitative IR characterization of the acidity of various oxide catalysts. Microporous Mesoporous Mater.. 82 (2005) 99–104, https://doi.org/10.1016/j.micromeso.2005.02.020. [48] C.A. Emeis Determination of integrated molar extinction coefficients for infrared absorption bands of pyridine adsorbed on solid acid catalysts J. Catal. 141 1993 347 354 10.1006/jcat.1993.1145 C.A. Emeis, Determination of integrated molar extinction coefficients for infrared absorption bands of pyridine adsorbed on solid acid catalysts. J. Catal. 141 (1993) 347–354, https://doi.org/10.1006/jcat.1993.1145. [49] T. Blasco P. Botella P. Concepción J.M.L. Nieto A. Martinez-Arias C. Prieto Selective oxidation of propane to acrylic acid on K-doped MoVSbO catalysts: catalyst characterization and catalytic performance J. Catal. 228 2004 362 373 10.1016/j.jcat.2004.08.036 T. Blasco, P. Botella, P. Concepción, J.M.L. Nieto, A. Martinez-Arias, C. Prieto, Selective oxidation of propane to acrylic acid on K-doped MoVSbO catalysts: catalyst characterization and catalytic performance. J. Catal. 228 (2004) 362–373, https://doi.org/10.1016/j.jcat.2004.08.036. [50] T. Ushikubo Activation of propane and butanes over niobium-and tantalum-based oxide catalysts Catal. Today 78 2003 79 84 10.1016/S0920-5861(02)00346-2 T. Ushikubo, Activation of propane and butanes over niobium-and tantalum-based oxide catalysts. Catal. Today 78 (2003) 79–84, https://doi.org/10.1016/S0920-5861(02)00346-2. [51] F. Ivars-Barceló J.M.M. Millet T. Blasco P. Concepción J.S. Valente J.M.L. Nieto Understanding effects of activation-treatments in K-free and K-MoVSbO bronze catalysts for propane partial oxidation Catal. Today 238 2014 41 48 10.1016/j.cattod.2014.01.036 F. Ivars-Barceló, J.M.M. Millet, T. Blasco, P. Concepción, J.S. Valente, J.M.L. Nieto, Understanding effects of activation-treatments in K-free and K-MoVSbO bronze catalysts for propane partial oxidation. Catal. Today 238 (2014) 41–48, https://doi.org/10.1016/j.cattod.2014.01.036. [52] M.M. Bettahar G. Costentin L. Savary J.C. Lavalley On the partial oxidation of propane and propylene on mixed metal oxide catalysts Appl. Catal. A Gen. 145 1996 1 48 10.1016/0926-860X(96)00138-X M.M. Bettahar, G. Costentin, L. Savary, J.C. Lavalley, On the partial oxidation of propane and propylene on mixed metal oxide catalysts. Appl. Catal. A Gen. 145 (1996) 1–48, https://doi.org/10.1016/0926-860X(96)00138-X. [53] R.K. Grasselli D.J. Buttrey J.D. Burrington A. Andersson J. Holmberg W. Ueda J. Kubo C.G. Lugmair A.F. Volpe Active centers, catalytic behavior, symbiosis and redox properties of MoV (Nb, Ta) TeO ammoxidation catalysts Top. Catal. 38 2006 7 16 10.1007/s11244-006-0066-x R.K. Grasselli, D.J. Buttrey, J.D. Burrington, A. Andersson, J. Holmberg, W. Ueda, J. Kubo, C.G. Lugmair, A.F. Volpe, Active centers, catalytic behavior, symbiosis and redox properties of MoV (Nb, Ta) TeO ammoxidation catalysts. Top. Catal. 38 (2006) 7–16, https://doi.org/10.1007/s11244-006-0066-x. [54] K. Chen S. Xie A.T. Bell E. Iglesia Alkali effects on molybdenum oxide catalysts for the oxidative dehydrogenation of propane J. Catal. 195 2000 244 252 10.1006/jcat.2000.3025 K. Chen, S. Xie, A.T. Bell, E. Iglesia, Alkali effects on molybdenum oxide catalysts for the oxidative dehydrogenation of propane. J. Catal. 195 (2000) 244–252, https://doi.org/10.1006/jcat.2000.3025. [55] V.V. Guliants R. Bhandari B. Swaminathan V.K. Vasudevan H.H. Brongersma A. Knoester A.M. Gaffney S. Han Roles of surface Te, Nb, and Sb oxides in propane oxidation to acrylic acid over bulk orthorhombic Mo–V–O phase J. Phys. Chem. B 109 2005 24046 24055 10.1021/jp054641y V.V. Guliants, R. Bhandari, B. Swaminathan, V.K. Vasudevan, H.H. Brongersma, A. Knoester, A.M. Gaffney, S. Han, Roles of surface Te, Nb, and Sb oxides in propane oxidation to acrylic acid over bulk orthorhombic Mo–V–O phase. J. Phys. Chem. B 109 (2005) 24046–24055, https://doi.org/10.1021/jp054641y. [56] D. Vitry J.L. Dubois W. Ueda Strategy in achieving propane selective oxidation over multi-functional Mo-based oxide catalysts J. Mol. Catal. A Chem. 220 2004 67 76 10.1016/j.molcata.2004.01.026 D. Vitry, J.L. Dubois, W. Ueda, Strategy in achieving propane selective oxidation over multi-functional Mo-based oxide catalysts. J. Mol. Catal. A Chem. 220 (2004) 67–76, https://doi.org/10.1016/j.molcata.2004.01.026. [57] S. Chen L. Zeng R. Mu C. Xiong Z.J. Zhao C. Zhao C. Pei L. Peng J. Luo L.S. Fan J. Gong Modulating lattice oxygen in dual-functional Mo–V–O mixed oxides for chemical looping oxidative dehydrogenation J. Am. Chem. Soc. 141 2019 18653 18657 10.1021/jacs.9b09235 S. Chen, L. Zeng, R. Mu, C. Xiong, Z.J. Zhao, C. Zhao, C. Pei, L. Peng, J. Luo, L.S. Fan, J. Gong, Modulating lattice oxygen in dual-functional Mo–V–O mixed oxides for chemical looping oxidative dehydrogenation. J. Am. Chem. Soc. 141 (2019) 18653–18657, https://doi.org/10.1021/jacs.9b09235. [58] R. Toyoshima J. Kawai K. Isegawa H. Kondoh A. Junkaew A. Nakayama T. Asano M. Tamura Y. Nakagawa M. Yabushita K. Tomishige Detailed characterization of MoOx-modified Rh metal particles by ambient-pressure XPS and DFT calculations J. Phys. Chem. C 125 2021 4540 4549 10.1021/acs.jpcc.0c10380 R. Toyoshima, J. Kawai, K. Isegawa, H. Kondoh, A. Junkaew, A. Nakayama, T. Asano, M. Tamura, Y. Nakagawa, M. Yabushita, K. Tomishige, Detailed characterization of MoOx-modified Rh metal particles by ambient-pressure XPS and DFT calculations. J. Phys. Chem. C 125 (2021) 4540–4549, https://doi.org/10.1021/acs.jpcc.0c10380. [59] D. Chen D. He J. Lu L. Zhong F. Liu J. Liu J. Yu G. Wan S. He Y. Luo Investigation of the role of surface lattice oxygen and bulk lattice oxygen migration of cerium-based oxygen carriers: XPS and designed H2-TPR characterization Appl. Catal. B Environ. 218 2017 249 259 10.1016/j.apcatb.2017.06.053 D. Chen, D. He, J. Lu, L. Zhong, F. Liu, J. Liu, J. Yu, G. Wan, S. He, Y. Luo, Investigation of the role of surface lattice oxygen and bulk lattice oxygen migration of cerium-based oxygen carriers: XPS and designed H2-TPR characterization. Appl. Catal. B Environ. 218 (2017) 249–259, https://doi.org/10.1016/j.apcatb.2017.06.053. [60] S. Ishikawa K. Shimoda T. Kamachi N. Aoki T. Hagiwara A. Urakawa W. Ueda Oxidation catalysis of crystalline Mo3VOx for the selective oxidation of ethane ACS Catal. 13 2023 15526 15534 10.1021/acscatal.3c04591 S. Ishikawa, K. Shimoda, T. Kamachi, N. Aoki, T. Hagiwara, A. Urakawa, W. Ueda, Oxidation catalysis of crystalline Mo3VOx for the selective oxidation of ethane. ACS Catal.. 13 (2023) 15526–15534, https://doi.org/10.1021/acscatal.3c04591. [61] M. Ai Oxidation of propane over V2O5-P2O5-based catalysts at relatively low temperatures Catal. Today 42 1998 297 301 10.1016/S0920-5861(98)00105-9 M. Ai, Oxidation of propane over V2O5-P2O5-based catalysts at relatively low temperatures. Catal. Today 42 (1998) 297–301, https://doi.org/10.1016/S0920-5861(98)00105-9. [62] A.M. Wernbacher P. Kube M. Hävecker R. Schlögl A. Trunschke Electronic and dielectric properties of MoV-oxide (M1 phase) under alkane oxidation conditions J. Phys. Chem. C 123 2019 13269 13282 10.1021/acs.jpcc.9b01273 A.M. Wernbacher, P. Kube, M. Hävecker, R. Schlögl, A. Trunschke, Electronic and dielectric properties of MoV-oxide (M1 phase) under alkane oxidation conditions. J. Phys. Chem. C 123 (2019) 13269–13282, https://doi.org/10.1021/acs.jpcc.9b01273. [63] M. Hävecker S. Wrabetz J. Kröhnert L.I. Csepei R.N. d'Alnoncourt Y.V. Kolen'ko F. Girgsdies R. Schlögl A. Trunschke Surface chemistry of phase-pure M1 MoVTeNb oxide during operation in selective oxidation of propane to acrylic acid J. Catal. 285 2012 48 60 10.1016/j.jcat.2011.09.012 M. Hävecker, S. Wrabetz, J. Kröhnert, L.I. Csepei, R.N. d'Alnoncourt, Y.V. Kolen'ko, F. Girgsdies, R. Schlögl, A. Trunschke, Surface chemistry of phase-pure M1 MoVTeNb oxide during operation in selective oxidation of propane to acrylic acid. J. Catal. 285 (2012) 48–60, https://doi.org/10.1016/j.jcat.2011.09.012. [64] B. Zhu H. Li W. Yang L. Lin Effects of reaction conditions on the selective oxidation of propane to acrylic acid on Mo–V–Te–Nb oxides Catal. Today 93-95 2004 229 234 10.1016/j.cattod.2004.06.045 B. Zhu, H. Li, W. Yang, L. Lin, Effects of reaction conditions on the selective oxidation of propane to acrylic acid on Mo–V–Te–Nb oxides. Catal. Today 93-95 (2004) 229–234, https://doi.org/10.1016/j.cattod.2004.06.045. [65] A. Xu Y. Wang H. Ge S. Chen Y. Li W. Lu An outstanding Cr-doped catalyst for selective oxidation of propane to acrylic acid Chin. J. Catal. 34 2013 2183 2191 10.1016/S1872-2067(12)60671-8 A. Xu, Y. Wang, H. Ge, S. Chen, Y. Li, W. Lu, An outstanding Cr-doped catalyst for selective oxidation of propane to acrylic acid. Chin. J. Catal. 34 (2013) 2183–2191, https://doi.org/10.1016/S1872-2067(12)60671-8. [66] R.K. Grasselli C.G. Lugmair J.A.F. Volpe A. Andersson J.D. Burrington Enhancement of acrylic acid yields in propane and propylene oxidation by selective P doping of MoV (Nb) TeO-based M1 and M2 catalysts Catal. Today 157 2010 33 38 10.1016/j.cattod.2010.01.044 R.K. Grasselli, C.G. Lugmair, J.A.F. Volpe, A. Andersson, J.D. Burrington, Enhancement of acrylic acid yields in propane and propylene oxidation by selective P doping of MoV (Nb) TeO-based M1 and M2 catalysts. Catal. Today 157 (2010) 33–38, https://doi.org/10.1016/j.cattod.2010.01.044. [67] M. Baca A. Pigamo J.L. Dubois J.M.M. Millet Propane oxidation on MoVTeNbO mixed oxide catalysts: study of the phase composition of active and selective catalysts Top. Catal. 23 2003 39 46 10.1023/A:1024864118695 M. Baca, A. Pigamo, J.L. Dubois, J.M.M. Millet, Propane oxidation on MoVTeNbO mixed oxide catalysts: study of the phase composition of active and selective catalysts. Top. Catal. 23 (2003) 39–46, https://doi.org/10.1023/A:1024864118695.",
      "scopus-id": "85207650324",
      "coredata": {
        "eid": "1-s2.0-S2468823124008228",
        "dc:description": "Compared with propane dehydrogenation (PDH) technology, oxidative dehydrogenation (ODH) of propane is an effective way to break through the thermodynamic constraints, which has changed the endothermic reaction into exothermic. Meanwhile, coking in PDH was significantly reduced by the presence of an oxidant in ODH of propane. Therefore, ODH of propane has attracted wide interest and has been studied in recent years. However, the contradiction between the conversion of propane and the selectivity of propene was the intrinsic problem of ODH of propane that required further study. In this work, a novel aluminum/potassium-doped mixed metal oxide catalyst Mo1V0.5Al0.02K0.03Ox was synthesized using a simple co-impregnation method, whose selectivity for propene (83.2 %) and conversion of propane (12.7 %) at 300 °C were the best among all other alkali metal/alkaline-earth metal-doped catalysts. The further discussion illustrated that doping potassium and alumina could synergistically adjust the density of acid sites on the catalyst, establishing an equilibrium between high propane conversion and the ideal propene selectivity. After modification, the density of Brønsted acid decreased, leading to an enhancement in the selectivity of propene. Simultaneously, the addition of steam in the feed gas promotes propene to oxygenates and improves the conversion of propane under the condition of constant contact time.",
        "openArchiveArticle": "false",
        "prism:coverDate": "2024-12-31",
        "openaccessUserLicense": null,
        "prism:aggregationType": "Journal",
        "prism:url": "https://api.elsevier.com/content/article/pii/S2468823124008228",
        "dc:creator": [
          {
            "@_fa": "true",
            "$": "Yan, Xiaoyu"
          },
          {
            "@_fa": "true",
            "$": "Xu, Xiaoqing"
          },
          {
            "@_fa": "true",
            "$": "Sun, Yuhan"
          },
          {
            "@_fa": "true",
            "$": "Li, Xiuyi"
          },
          {
            "@_fa": "true",
            "$": "Xu, Jiale"
          },
          {
            "@_fa": "true",
            "$": "Ji, Renjie"
          },
          {
            "@_fa": "true",
            "$": "Huang, Rui"
          },
          {
            "@_fa": "true",
            "$": "Li, Chunyi"
          }
        ],
        "link": [
          {
            "@_fa": "true",
            "@rel": "self",
            "@href": "https://api.elsevier.com/content/article/pii/S2468823124008228"
          },
          {
            "@_fa": "true",
            "@rel": "scidir",
            "@href": "https://www.sciencedirect.com/science/article/pii/S2468823124008228"
          }
        ],
        "dc:format": "application/json",
        "openaccessType": null,
        "pii": "S2468-8231(24)00822-8",
        "prism:volume": "569",
        "articleNumber": "114640",
        "prism:publisher": "Elsevier B.V. All rights are reserved, including those for text and data mining, AI training, and similar technologies.",
        "dc:title": "Mo–V–Al–K–O catalyst for low-temperature oxidative dehydrogenation of propane",
        "prism:copyright": "© 2024 Elsevier B.V. All rights are reserved, including those for text and data mining, AI training, and similar technologies.",
        "openaccess": "0",
        "prism:issn": "24688231",
        "dcterms:subject": [
          {
            "@_fa": "true",
            "$": "Oxidative dehydrogenation of propane"
          },
          {
            "@_fa": "true",
            "$": "Mixed metal oxide catalyst"
          },
          {
            "@_fa": "true",
            "$": "Propene"
          },
          {
            "@_fa": "true",
            "$": "Steam"
          },
          {
            "@_fa": "true",
            "$": "Selectivity"
          }
        ],
        "openaccessArticle": "false",
        "prism:publicationName": "Molecular Catalysis",
        "openaccessSponsorType": null,
        "prism:pageRange": "114640",
        "pubType": "fla",
        "prism:coverDisplayDate": "December 2024",
        "prism:doi": "10.1016/j.mcat.2024.114640",
        "prism:startingPage": "114640",
        "dc:identifier": "doi:10.1016/j.mcat.2024.114640",
        "openaccessSponsorName": null
      },
      "objects": {
        "object": [
          {
            "@category": "standard",
            "@height": "290",
            "@width": "715",
            "@_fa": "true",
            "$": "https://api.elsevier.com/content/object/eid/1-s2.0-S2468823124008228-gr2.jpg?httpAccept=%2A%2F%2A",
            "@multimediatype": "JPEG image file",
            "@type": "IMAGE-DOWNSAMPLED",
            "@size": "34969",
            "@ref": "gr2",
            "@mimetype": "image/jpeg"
          },
          {
            "@category": "standard",
            "@height": "292",
            "@width": "715",
            "@_fa": "true",
            "$": "https://api.elsevier.com/content/object/eid/1-s2.0-S2468823124008228-gr3.jpg?httpAccept=%2A%2F%2A",
            "@multimediatype": "JPEG image file",
            "@type": "IMAGE-DOWNSAMPLED",
            "@size": "36964",
            "@ref": "gr3",
            "@mimetype": "image/jpeg"
          },
          {
            "@category": "standard",
            "@height": "290",
            "@width": "715",
            "@_fa": "true",
            "$": "https://api.elsevier.com/content/object/eid/1-s2.0-S2468823124008228-gr1.jpg?httpAccept=%2A%2F%2A",
            "@multimediatype": "JPEG image file",
            "@type": "IMAGE-DOWNSAMPLED",
            "@size": "42835",
            "@ref": "gr1",
            "@mimetype": "image/jpeg"
          },
          {
            "@category": "standard",
            "@height": "322",
            "@width": "376",
            "@_fa": "true",
            "$": "https://api.elsevier.com/content/object/eid/1-s2.0-S2468823124008228-gr13.jpg?httpAccept=%2A%2F%2A",
            "@multimediatype": "JPEG image file",
            "@type": "IMAGE-DOWNSAMPLED",
            "@size": "28063",
            "@ref": "gr13",
            "@mimetype": "image/jpeg"
          },
          {
            "@category": "standard",
            "@height": "325",
            "@width": "376",
            "@_fa": "true",
            "$": "https://api.elsevier.com/content/object/eid/1-s2.0-S2468823124008228-gr11.jpg?httpAccept=%2A%2F%2A",
            "@multimediatype": "JPEG image file",
            "@type": "IMAGE-DOWNSAMPLED",
            "@size": "27583",
            "@ref": "gr11",
            "@mimetype": "image/jpeg"
          },
          {
            "@category": "standard",
            "@height": "328",
            "@width": "376",
            "@_fa": "true",
            "$": "https://api.elsevier.com/content/object/eid/1-s2.0-S2468823124008228-gr12.jpg?httpAccept=%2A%2F%2A",
            "@multimediatype": "JPEG image file",
            "@type": "IMAGE-DOWNSAMPLED",
            "@size": "24127",
            "@ref": "gr12",
            "@mimetype": "image/jpeg"
          },
          {
            "@category": "standard",
            "@height": "313",
            "@width": "715",
            "@_fa": "true",
            "$": "https://api.elsevier.com/content/object/eid/1-s2.0-S2468823124008228-gr10.jpg?httpAccept=%2A%2F%2A",
            "@multimediatype": "JPEG image file",
            "@type": "IMAGE-DOWNSAMPLED",
            "@size": "41394",
            "@ref": "gr10",
            "@mimetype": "image/jpeg"
          },
          {
            "@category": "standard",
            "@height": "200",
            "@width": "356",
            "@_fa": "true",
            "$": "https://api.elsevier.com/content/object/eid/1-s2.0-S2468823124008228-ga1.jpg?httpAccept=%2A%2F%2A",
            "@multimediatype": "JPEG image file",
            "@type": "IMAGE-DOWNSAMPLED",
            "@size": "26746",
            "@ref": "ga1",
            "@mimetype": "image/jpeg"
          },
          {
            "@category": "standard",
            "@height": "847",
            "@width": "565",
            "@_fa": "true",
            "$": "https://api.elsevier.com/content/object/eid/1-s2.0-S2468823124008228-gr6.jpg?httpAccept=%2A%2F%2A",
            "@multimediatype": "JPEG image file",
            "@type": "IMAGE-DOWNSAMPLED",
            "@size": "229974",
            "@ref": "gr6",
            "@mimetype": "image/jpeg"
          },
          {
            "@category": "standard",
            "@height": "321",
            "@width": "376",
            "@_fa": "true",
            "$": "https://api.elsevier.com/content/object/eid/1-s2.0-S2468823124008228-gr7.jpg?httpAccept=%2A%2F%2A",
            "@multimediatype": "JPEG image file",
            "@type": "IMAGE-DOWNSAMPLED",
            "@size": "35128",
            "@ref": "gr7",
            "@mimetype": "image/jpeg"
          },
          {
            "@category": "standard",
            "@height": "319",
            "@width": "376",
            "@_fa": "true",
            "$": "https://api.elsevier.com/content/object/eid/1-s2.0-S2468823124008228-gr4.jpg?httpAccept=%2A%2F%2A",
            "@multimediatype": "JPEG image file",
            "@type": "IMAGE-DOWNSAMPLED",
            "@size": "24916",
            "@ref": "gr4",
            "@mimetype": "image/jpeg"
          },
          {
            "@category": "standard",
            "@height": "393",
            "@width": "376",
            "@_fa": "true",
            "$": "https://api.elsevier.com/content/object/eid/1-s2.0-S2468823124008228-gr5.jpg?httpAccept=%2A%2F%2A",
            "@multimediatype": "JPEG image file",
            "@type": "IMAGE-DOWNSAMPLED",
            "@size": "44204",
            "@ref": "gr5",
            "@mimetype": "image/jpeg"
          },
          {
            "@category": "standard",
            "@height": "572",
            "@width": "715",
            "@_fa": "true",
            "$": "https://api.elsevier.com/content/object/eid/1-s2.0-S2468823124008228-gr8.jpg?httpAccept=%2A%2F%2A",
            "@multimediatype": "JPEG image file",
            "@type": "IMAGE-DOWNSAMPLED",
            "@size": "90079",
            "@ref": "gr8",
            "@mimetype": "image/jpeg"
          },
          {
            "@category": "standard",
            "@height": "216",
            "@width": "753",
            "@_fa": "true",
            "$": "https://api.elsevier.com/content/object/eid/1-s2.0-S2468823124008228-gr9.jpg?httpAccept=%2A%2F%2A",
            "@multimediatype": "JPEG image file",
            "@type": "IMAGE-DOWNSAMPLED",
            "@size": "43151",
            "@ref": "gr9",
            "@mimetype": "image/jpeg"
          },
          {
            "@category": "thumbnail",
            "@height": "89",
            "@width": "219",
            "@_fa": "true",
            "$": "https://api.elsevier.com/content/object/eid/1-s2.0-S2468823124008228-gr2.sml?httpAccept=%2A%2F%2A",
            "@multimediatype": "GIF image file",
            "@type": "IMAGE-THUMBNAIL",
            "@size": "6470",
            "@ref": "gr2",
            "@mimetype": "image/gif"
          },
          {
            "@category": "thumbnail",
            "@height": "89",
            "@width": "219",
            "@_fa": "true",
            "$": "https://api.elsevier.com/content/object/eid/1-s2.0-S2468823124008228-gr3.sml?httpAccept=%2A%2F%2A",
            "@multimediatype": "GIF image file",
            "@type": "IMAGE-THUMBNAIL",
            "@size": "6817",
            "@ref": "gr3",
            "@mimetype": "image/gif"
          },
          {
            "@category": "thumbnail",
            "@height": "89",
            "@width": "219",
            "@_fa": "true",
            "$": "https://api.elsevier.com/content/object/eid/1-s2.0-S2468823124008228-gr1.sml?httpAccept=%2A%2F%2A",
            "@multimediatype": "GIF image file",
            "@type": "IMAGE-THUMBNAIL",
            "@size": "7213",
            "@ref": "gr1",
            "@mimetype": "image/gif"
          },
          {
            "@category": "thumbnail",
            "@height": "164",
            "@width": "191",
            "@_fa": "true",
            "$": "https://api.elsevier.com/content/object/eid/1-s2.0-S2468823124008228-gr13.sml?httpAccept=%2A%2F%2A",
            "@multimediatype": "GIF image file",
            "@type": "IMAGE-THUMBNAIL",
            "@size": "9241",
            "@ref": "gr13",
            "@mimetype": "image/gif"
          },
          {
            "@category": "thumbnail",
            "@height": "164",
            "@width": "190",
            "@_fa": "true",
            "$": "https://api.elsevier.com/content/object/eid/1-s2.0-S2468823124008228-gr11.sml?httpAccept=%2A%2F%2A",
            "@multimediatype": "GIF image file",
            "@type": "IMAGE-THUMBNAIL",
            "@size": "8509",
            "@ref": "gr11",
            "@mimetype": "image/gif"
          },
          {
            "@category": "thumbnail",
            "@height": "164",
            "@width": "188",
            "@_fa": "true",
            "$": "https://api.elsevier.com/content/object/eid/1-s2.0-S2468823124008228-gr12.sml?httpAccept=%2A%2F%2A",
            "@multimediatype": "GIF image file",
            "@type": "IMAGE-THUMBNAIL",
            "@size": "8114",
            "@ref": "gr12",
            "@mimetype": "image/gif"
          },
          {
            "@category": "thumbnail",
            "@height": "96",
            "@width": "219",
            "@_fa": "true",
            "$": "https://api.elsevier.com/content/object/eid/1-s2.0-S2468823124008228-gr10.sml?httpAccept=%2A%2F%2A",
            "@multimediatype": "GIF image file",
            "@type": "IMAGE-THUMBNAIL",
            "@size": "7431",
            "@ref": "gr10",
            "@mimetype": "image/gif"
          },
          {
            "@category": "thumbnail",
            "@height": "123",
            "@width": "219",
            "@_fa": "true",
            "$": "https://api.elsevier.com/content/object/eid/1-s2.0-S2468823124008228-ga1.sml?httpAccept=%2A%2F%2A",
            "@multimediatype": "GIF image file",
            "@type": "IMAGE-THUMBNAIL",
            "@size": "10914",
            "@ref": "ga1",
            "@mimetype": "image/gif"
          },
          {
            "@category": "thumbnail",
            "@height": "163",
            "@width": "109",
            "@_fa": "true",
            "$": "https://api.elsevier.com/content/object/eid/1-s2.0-S2468823124008228-gr6.sml?httpAccept=%2A%2F%2A",
            "@multimediatype": "GIF image file",
            "@type": "IMAGE-THUMBNAIL",
            "@size": "16704",
            "@ref": "gr6",
            "@mimetype": "image/gif"
          },
          {
            "@category": "thumbnail",
            "@height": "164",
            "@width": "192",
            "@_fa": "true",
            "$": "https://api.elsevier.com/content/object/eid/1-s2.0-S2468823124008228-gr7.sml?httpAccept=%2A%2F%2A",
            "@multimediatype": "GIF image file",
            "@type": "IMAGE-THUMBNAIL",
            "@size": "10650",
            "@ref": "gr7",
            "@mimetype": "image/gif"
          },
          {
            "@category": "thumbnail",
            "@height": "164",
            "@width": "193",
            "@_fa": "true",
            "$": "https://api.elsevier.com/content/object/eid/1-s2.0-S2468823124008228-gr4.sml?httpAccept=%2A%2F%2A",
            "@multimediatype": "GIF image file",
            "@type": "IMAGE-THUMBNAIL",
            "@size": "8075",
            "@ref": "gr4",
            "@mimetype": "image/gif"
          },
          {
            "@category": "thumbnail",
            "@height": "164",
            "@width": "157",
            "@_fa": "true",
            "$": "https://api.elsevier.com/content/object/eid/1-s2.0-S2468823124008228-gr5.sml?httpAccept=%2A%2F%2A",
            "@multimediatype": "GIF image file",
            "@type": "IMAGE-THUMBNAIL",
            "@size": "10359",
            "@ref": "gr5",
            "@mimetype": "image/gif"
          },
          {
            "@category": "thumbnail",
            "@height": "164",
            "@width": "205",
            "@_fa": "true",
            "$": "https://api.elsevier.com/content/object/eid/1-s2.0-S2468823124008228-gr8.sml?httpAccept=%2A%2F%2A",
            "@multimediatype": "GIF image file",
            "@type": "IMAGE-THUMBNAIL",
            "@size": "14211",
            "@ref": "gr8",
            "@mimetype": "image/gif"
          },
          {
            "@category": "thumbnail",
            "@height": "63",
            "@width": "219",
            "@_fa": "true",
            "$": "https://api.elsevier.com/content/object/eid/1-s2.0-S2468823124008228-gr9.sml?httpAccept=%2A%2F%2A",
            "@multimediatype": "GIF image file",
            "@type": "IMAGE-THUMBNAIL",
            "@size": "7684",
            "@ref": "gr9",
            "@mimetype": "image/gif"
          },
          {
            "@category": "high",
            "@height": "1286",
            "@width": "3167",
            "@_fa": "true",
            "$": "https://api.elsevier.com/content/object/eid/1-s2.0-S2468823124008228-gr2_lrg.jpg?httpAccept=%2A%2F%2A",
            "@multimediatype": "JPEG image file",
            "@type": "IMAGE-HIGH-RES",
            "@size": "218144",
            "@ref": "gr2",
            "@mimetype": "image/jpeg"
          },
          {
            "@category": "high",
            "@height": "1292",
            "@width": "3167",
            "@_fa": "true",
            "$": "https://api.elsevier.com/content/object/eid/1-s2.0-S2468823124008228-gr3_lrg.jpg?httpAccept=%2A%2F%2A",
            "@multimediatype": "JPEG image file",
            "@type": "IMAGE-HIGH-RES",
            "@size": "227297",
            "@ref": "gr3",
            "@mimetype": "image/jpeg"
          },
          {
            "@category": "high",
            "@height": "1283",
            "@width": "3167",
            "@_fa": "true",
            "$": "https://api.elsevier.com/content/object/eid/1-s2.0-S2468823124008228-gr1_lrg.jpg?httpAccept=%2A%2F%2A",
            "@multimediatype": "JPEG image file",
            "@type": "IMAGE-HIGH-RES",
            "@size": "265030",
            "@ref": "gr1",
            "@mimetype": "image/jpeg"
          },
          {
            "@category": "high",
            "@height": "1428",
            "@width": "1667",
            "@_fa": "true",
            "$": "https://api.elsevier.com/content/object/eid/1-s2.0-S2468823124008228-gr13_lrg.jpg?httpAccept=%2A%2F%2A",
            "@multimediatype": "JPEG image file",
            "@type": "IMAGE-HIGH-RES",
            "@size": "179798",
            "@ref": "gr13",
            "@mimetype": "image/jpeg"
          },
          {
            "@category": "high",
            "@height": "1441",
            "@width": "1667",
            "@_fa": "true",
            "$": "https://api.elsevier.com/content/object/eid/1-s2.0-S2468823124008228-gr11_lrg.jpg?httpAccept=%2A%2F%2A",
            "@multimediatype": "JPEG image file",
            "@type": "IMAGE-HIGH-RES",
            "@size": "169865",
            "@ref": "gr11",
            "@mimetype": "image/jpeg"
          },
          {
            "@category": "high",
            "@height": "1452",
            "@width": "1667",
            "@_fa": "true",
            "$": "https://api.elsevier.com/content/object/eid/1-s2.0-S2468823124008228-gr12_lrg.jpg?httpAccept=%2A%2F%2A",
            "@multimediatype": "JPEG image file",
            "@type": "IMAGE-HIGH-RES",
            "@size": "149826",
            "@ref": "gr12",
            "@mimetype": "image/jpeg"
          },
          {
            "@category": "high",
            "@height": "1388",
            "@width": "3167",
            "@_fa": "true",
            "$": "https://api.elsevier.com/content/object/eid/1-s2.0-S2468823124008228-gr10_lrg.jpg?httpAccept=%2A%2F%2A",
            "@multimediatype": "JPEG image file",
            "@type": "IMAGE-HIGH-RES",
            "@size": "266382",
            "@ref": "gr10",
            "@mimetype": "image/jpeg"
          },
          {
            "@category": "high",
            "@height": "886",
            "@width": "1579",
            "@_fa": "true",
            "$": "https://api.elsevier.com/content/object/eid/1-s2.0-S2468823124008228-ga1_lrg.jpg?httpAccept=%2A%2F%2A",
            "@multimediatype": "JPEG image file",
            "@type": "IMAGE-HIGH-RES",
            "@size": "155699",
            "@ref": "ga1",
            "@mimetype": "image/jpeg"
          },
          {
            "@category": "high",
            "@height": "3747",
            "@width": "2500",
            "@_fa": "true",
            "$": "https://api.elsevier.com/content/object/eid/1-s2.0-S2468823124008228-gr6_lrg.jpg?httpAccept=%2A%2F%2A",
            "@multimediatype": "JPEG image file",
            "@type": "IMAGE-HIGH-RES",
            "@size": "2054375",
            "@ref": "gr6",
            "@mimetype": "image/jpeg"
          },
          {
            "@category": "high",
            "@height": "1424",
            "@width": "1667",
            "@_fa": "true",
            "$": "https://api.elsevier.com/content/object/eid/1-s2.0-S2468823124008228-gr7_lrg.jpg?httpAccept=%2A%2F%2A",
            "@multimediatype": "JPEG image file",
            "@type": "IMAGE-HIGH-RES",
            "@size": "223933",
            "@ref": "gr7",
            "@mimetype": "image/jpeg"
          },
          {
            "@category": "high",
            "@height": "1415",
            "@width": "1667",
            "@_fa": "true",
            "$": "https://api.elsevier.com/content/object/eid/1-s2.0-S2468823124008228-gr4_lrg.jpg?httpAccept=%2A%2F%2A",
            "@multimediatype": "JPEG image file",
            "@type": "IMAGE-HIGH-RES",
            "@size": "152099",
            "@ref": "gr4",
            "@mimetype": "image/jpeg"
          },
          {
            "@category": "high",
            "@height": "1742",
            "@width": "1667",
            "@_fa": "true",
            "$": "https://api.elsevier.com/content/object/eid/1-s2.0-S2468823124008228-gr5_lrg.jpg?httpAccept=%2A%2F%2A",
            "@multimediatype": "JPEG image file",
            "@type": "IMAGE-HIGH-RES",
            "@size": "259220",
            "@ref": "gr5",
            "@mimetype": "image/jpeg"
          },
          {
            "@category": "high",
            "@height": "2535",
            "@width": "3167",
            "@_fa": "true",
            "$": "https://api.elsevier.com/content/object/eid/1-s2.0-S2468823124008228-gr8_lrg.jpg?httpAccept=%2A%2F%2A",
            "@multimediatype": "JPEG image file",
            "@type": "IMAGE-HIGH-RES",
            "@size": "607679",
            "@ref": "gr8",
            "@mimetype": "image/jpeg"
          },
          {
            "@category": "high",
            "@height": "955",
            "@width": "3333",
            "@_fa": "true",
            "$": "https://api.elsevier.com/content/object/eid/1-s2.0-S2468823124008228-gr9_lrg.jpg?httpAccept=%2A%2F%2A",
            "@multimediatype": "JPEG image file",
            "@type": "IMAGE-HIGH-RES",
            "@size": "286860",
            "@ref": "gr9",
            "@mimetype": "image/jpeg"
          },
          {
            "@category": "standard",
            "@_fa": "true",
            "$": "https://api.elsevier.com/content/object/eid/1-s2.0-S2468823124008228-mmc1.docx?httpAccept=%2A%2F%2A",
            "@multimediatype": "Microsoft Word file",
            "@type": "APPLICATION",
            "@size": "4442727",
            "@ref": "mmc1",
            "@mimetype": "application/word"
          },
          {
            "@category": "thumbnail",
            "@_fa": "true",
            "$": "https://api.elsevier.com/content/object/eid/1-s2.0-S2468823124008228-si1.svg?httpAccept=%2A%2F%2A",
            "@multimediatype": "Scalable Vector Graphics file",
            "@type": "ALTIMG",
            "@size": "19465",
            "@ref": "si1",
            "@mimetype": "image/svg+xml"
          },
          {
            "@category": "thumbnail",
            "@_fa": "true",
            "$": "https://api.elsevier.com/content/object/eid/1-s2.0-S2468823124008228-si2.svg?httpAccept=%2A%2F%2A",
            "@multimediatype": "Scalable Vector Graphics file",
            "@type": "ALTIMG",
            "@size": "21481",
            "@ref": "si2",
            "@mimetype": "image/svg+xml"
          },
          {
            "@category": "thumbnail",
            "@_fa": "true",
            "$": "https://api.elsevier.com/content/object/eid/1-s2.0-S2468823124008228-si3.svg?httpAccept=%2A%2F%2A",
            "@multimediatype": "Scalable Vector Graphics file",
            "@type": "ALTIMG",
            "@size": "17816",
            "@ref": "si3",
            "@mimetype": "image/svg+xml"
          },
          {
            "@category": "standard",
            "@_fa": "true",
            "$": "https://api.elsevier.com/content/object/eid/1-s2.0-S2468823124008228-am.pdf?httpAccept=%2A%2F%2A",
            "@multimediatype": "Acrobat PDF file",
            "@type": "AAM-PDF",
            "@size": "1130748",
            "@ref": "am",
            "@mimetype": "application/pdf"
          }
        ]
      },
      "link": {
        "@rel": "abstract",
        "@href": "https://api.elsevier.com/content/abstract/scopus_id/85207650324"
      }
    }
  }
}