{
  "metadata": {
    "title": "Deoxygenation of pyrolysis vapor from palm fruit cake over NiMo/γ-Al<ce:inf loc=post>2</ce:inf>O<ce:inf loc=post>3</ce:inf> catalyst: Effect of CeO<ce:inf loc=post>2</ce:inf>, TiO<ce:inf loc=post>2,</ce:inf> and ZrO<ce:inf loc=post>2</ce:inf> additives",
    "authors": "; ",
    "journal": "Molecular Catalysis",
    "date": "2022-05-31",
    "doi": "10.1016/j.mcat.2021.111712",
    "abstract": "",
    "uri": "https://api.elsevier.com/content/article/pii/S2468823121003291",
    "pii": "S2468823121003291"
  },
  "fulltext": {
    "full-text-retrieval-response": {
      "scopus-eid": "2-s2.0-85109622466",
      "originalText": "serial JL 315758 291210 291744 291790 291809 31 Molecular Catalysis MOLECULARCATALYSIS 2021-07-08 2021-07-08 2022-04-25 2022-04-25 2022-04-25T12:00:19 1-s2.0-S2468823121003291 S2468-8231(21)00329-1 S2468823121003291 10.1016/j.mcat.2021.111712 S300 S300.1 FULL-TEXT 1-s2.0-S2468823122X00060 2023-01-06T05:42:24.985026Z 0 0 20220501 20220531 2022 2021-07-08T22:41:02.545279Z absattachment articleinfo articlenumber articletitlenorm authfirstinitialnorm authfirstsurnamenorm cid cids contenttype copyright crossmark dateloaded dateloadedtxt datesearch datesort dateupdated dco docsubtype doctype doi eid ewtransactionid hubeid indexeddate issn issnnorm itemstage itemtransactionid itemweight openaccess openarchive pg pgfirst pii piinorm pubdateend pubdatestart pubdatetxt pubyr sortorder srctitle srctitlenorm srctype ssids alllist content subj subheadings suppl tomb volfirst volissue volumelist webpdf webpdfpagecount yearnav figure table body mmlmath acknowledge affil articletitle auth authfirstini authfull authkeywords authlast highlightsabst primabst ref specialabst 2468-8231 24688231 true 523 523 C Volume 523 12 111712 111712 111712 202205 May 2022 2022-05-01 2022-05-31 2022 article fla © 2021 Elsevier B.V. All rights reserved. DEOXYGENATIONPYROLYSISVAPORPALMFRUITCAKEOVERNIMOAL2O3CATALYSTEFFECTCEO2TIO2ZRO2ADDITIVES MOONSRIKAEW W 1 Introduction 2 Experimental 2.1 Materials 2.2 Catalyst preparation 2.2.1 Ni 2.2.2 Mo / γ − A l 2 O 3 2.2.3 NiMo / γ − A l 2 O 3 2.2.4 NiMo / γ − A l 2 O 3 / metal oxides ( Ce O 2 , Ti O 2 , and Zr O 2 ) 2.3 Catalyst characterization 2.4 Pyrolysis and upgrading processes 2.5 Characterization of the bio-oils 3 Results and discussion 3.1 Catalyst characterization 3.2 Analysis of raw material 3.3 Products from pyrolysis of PFC 3.4 Upgrading of the bio-oil 3.5 Catalyst deactivation 4 Conclusions Dear Editor-in-Chief Acknowledgements References MAZAHERI 2010 745 751 H WANG 2015 494 499 L KIM 2013 118 124 S BU 2012 470 477 Q QI 2007 87 92 Z XIU 2012 4406 4414 S KIM 2014 437 443 T ZHANG 2016 312 321 X TEMPLIS 2019 6278 6287 C QU 2002 86 295 L KOHLI 2020 1 16 K GANDARIAS 2008 3485 3488 I YAN 2010 11693 11699 C HANUDOMLARPYOS 2015 512 518 V KUBICKA 2010 199 208 D ZULKEPLI 2018 495 508 S KONDOH 2016 288 294 H TAJRISHI 2018 14103 14120 O VELU 2003 317 331 S OI 2016 108741 108754 L YAKOVLEV 2009 362 366 V KAEWPENGKROW 2014 262 269 P LU 2014 1937 1941 Q LU 2010 2096 2103 Q CHEN 2017 79 90 H CHOI 2018 675 685 I LEE 2020 6299 6308 Y GURBANI 2009 547 553 A SHARIFI 2014 993 1004 M CAI 2011 318 324 M THYSSEN 2013 358 363 V GRAMS 2015 1223 1228 J KARNJANAKOM 2016 235 244 S LIN 2011 890 896 Y ANAS 2004 213 217 K UZUN 2007 325 340 B JEONG 2019 104708 J SULAIMAN 2011 2352 2359 F HORNE 1996 1051 1059 P KUBICKA 2010 199 208 D HAKIM 2013 368 376 S TELES 2017 2850 2863 C PURON 2017 4843 4850 H WANG 2019 10780 10893 Y VESES 2015 17 22 A MOONSRIKAEWX2022X111712 MOONSRIKAEWX2022X111712XW 2024-04-25T00:00:00.000Z 2024-04-25T00:00:00.000Z http://creativecommons.org/licenses/by-nc-nd/4.0/ © 2021 Elsevier B.V. All rights reserved. 0 2022-05-28T06:35:08.680Z http://vtw.elsevier.com/data/voc/AddOnTypes/50.7/aggregated-refined Prachuab Khirikhan Province Chaipattana Foundation Chaipattana Foundation http://data.elsevier.com/vocabulary/SciValFunders/100009078 http://sws.geonames.org/1605651/ Hua Hin District Kasetsart University Research and Development Institute KURDI Kasetsart University Research and Development Institute http://data.elsevier.com/vocabulary/SciValFunders/501100005621 http://sws.geonames.org/1605651/ This research was granted from the Kasetsart University Research and Development Institute. The authors thank the Chaipattana Foundation at Hua Hin District, Prachuab Khirikhan Province, for palm fruit cake. Many thanks to PTT Research and Development Center at Ayutthaya Province, and the Center of Fuels and Energy at Cham Phak Pheo District, Saraburi Province, for the use of elemental analyser. https://doi.org/10.15223/policy-017 https://doi.org/10.15223/policy-037 https://doi.org/10.15223/policy-012 https://doi.org/10.15223/policy-029 https://doi.org/10.15223/policy-004 item S2468-8231(21)00329-1 S2468823121003291 1-s2.0-S2468823121003291 10.1016/j.mcat.2021.111712 315758 2023-01-06T05:42:24.985026Z 2022-05-01 2022-05-31 1-s2.0-S2468823121003291-main.pdf https://s3-eu-west-1.amazonaws.com/prod-ucs-content-store-eu-west/content/pii:S2468823121003291/MAIN/application/pdf/d46f5c5f4d2b10754184ecdb4f2eff34/main.pdf main.pdf pdf true 7448011 MAIN 12 1-s2.0-S2468823121003291-main_1.png https://s3-eu-west-1.amazonaws.com/prod-ucs-content-store-eu-west/content/pii:S2468823121003291/PREVIEW/image/png/0f7c6410323463daf49977a14c532a97/main_1.png main_1.png png 58997 849 656 IMAGE-WEB-PDF 1 1-s2.0-S2468823121003291-fx2.jpg https://s3-eu-west-1.amazonaws.com/prod-ucs-content-store-eu-west/content/pii:S2468823121003291/fx2/DOWNSAMPLED/image/jpeg/cd1fe93b4593a0792501ebe2723dec88/fx2.jpg fx2 fx2.jpg jpg 4220 48 471 IMAGE-DOWNSAMPLED 1-s2.0-S2468823121003291-fx1.jpg https://s3-eu-west-1.amazonaws.com/prod-ucs-content-store-eu-west/content/pii:S2468823121003291/fx1/DOWNSAMPLED/image/jpeg/244248e5c7316d01d5384093807cff50/fx1.jpg fx1 fx1.jpg jpg 886 11 55 IMAGE-DOWNSAMPLED 1-s2.0-S2468823121003291-gr9.jpg https://s3-eu-west-1.amazonaws.com/prod-ucs-content-store-eu-west/content/pii:S2468823121003291/gr9/DOWNSAMPLED/image/jpeg/7da554c811ee9f40e114d4b54bcd520b/gr9.jpg gr9 gr9.jpg jpg 23886 295 339 IMAGE-DOWNSAMPLED 1-s2.0-S2468823121003291-gr8.jpg https://s3-eu-west-1.amazonaws.com/prod-ucs-content-store-eu-west/content/pii:S2468823121003291/gr8/DOWNSAMPLED/image/jpeg/1219de03e43fc87f4774bffc92fa2580/gr8.jpg gr8 gr8.jpg jpg 81484 355 565 IMAGE-DOWNSAMPLED 1-s2.0-S2468823121003291-gr7.jpg https://s3-eu-west-1.amazonaws.com/prod-ucs-content-store-eu-west/content/pii:S2468823121003291/gr7/DOWNSAMPLED/image/jpeg/14f8657b07a060b7bfa64755bbf85d1e/gr7.jpg gr7 gr7.jpg jpg 25598 304 565 IMAGE-DOWNSAMPLED 1-s2.0-S2468823121003291-gr6.jpg https://s3-eu-west-1.amazonaws.com/prod-ucs-content-store-eu-west/content/pii:S2468823121003291/gr6/DOWNSAMPLED/image/jpeg/6dfba3babdd09247f96043e88eff70f8/gr6.jpg gr6 gr6.jpg jpg 36062 369 564 IMAGE-DOWNSAMPLED 1-s2.0-S2468823121003291-gr5.jpg https://s3-eu-west-1.amazonaws.com/prod-ucs-content-store-eu-west/content/pii:S2468823121003291/gr5/DOWNSAMPLED/image/jpeg/34baf62068aff84fda6ec87cf64cde6b/gr5.jpg gr5 gr5.jpg jpg 16389 272 376 IMAGE-DOWNSAMPLED 1-s2.0-S2468823121003291-gr4.jpg https://s3-eu-west-1.amazonaws.com/prod-ucs-content-store-eu-west/content/pii:S2468823121003291/gr4/DOWNSAMPLED/image/jpeg/9820f0667e9b13333116edcc036e988b/gr4.jpg gr4 gr4.jpg jpg 35041 361 583 IMAGE-DOWNSAMPLED 1-s2.0-S2468823121003291-gr3.jpg https://s3-eu-west-1.amazonaws.com/prod-ucs-content-store-eu-west/content/pii:S2468823121003291/gr3/DOWNSAMPLED/image/jpeg/190cfac5a9eb83eb8eb5b6c8ab293555/gr3.jpg gr3 gr3.jpg jpg 134181 474 564 IMAGE-DOWNSAMPLED 1-s2.0-S2468823121003291-gr2.jpg https://s3-eu-west-1.amazonaws.com/prod-ucs-content-store-eu-west/content/pii:S2468823121003291/gr2/DOWNSAMPLED/image/jpeg/0dfc10b32c27437f0fdc344b4a9f0438/gr2.jpg gr2 gr2.jpg jpg 51660 258 564 IMAGE-DOWNSAMPLED 1-s2.0-S2468823121003291-ga1.jpg https://s3-eu-west-1.amazonaws.com/prod-ucs-content-store-eu-west/content/pii:S2468823121003291/ga1/DOWNSAMPLED/image/jpeg/235f6b31dd653a4584f009caec9afde6/ga1.jpg ga1 true ga1.jpg jpg 18594 149 301 IMAGE-DOWNSAMPLED 1-s2.0-S2468823121003291-gr1.jpg https://s3-eu-west-1.amazonaws.com/prod-ucs-content-store-eu-west/content/pii:S2468823121003291/gr1/DOWNSAMPLED/image/jpeg/df80511de283a28ab068eb04bb9b9397/gr1.jpg gr1 gr1.jpg jpg 18896 235 341 IMAGE-DOWNSAMPLED 1-s2.0-S2468823121003291-fx2.sml https://s3-eu-west-1.amazonaws.com/prod-ucs-content-store-eu-west/content/pii:S2468823121003291/fx2/THUMBNAIL/image/gif/4e9502e4b93b1be98d7eb733cdec2c2c/fx2.sml fx2 fx2.sml sml 1583 22 219 IMAGE-THUMBNAIL 1-s2.0-S2468823121003291-fx1.sml https://s3-eu-west-1.amazonaws.com/prod-ucs-content-store-eu-west/content/pii:S2468823121003291/fx1/THUMBNAIL/image/gif/2a557459fd77985018e23195748880a4/fx1.sml fx1 fx1.sml sml 3714 46 219 IMAGE-THUMBNAIL 1-s2.0-S2468823121003291-gr9.sml https://s3-eu-west-1.amazonaws.com/prod-ucs-content-store-eu-west/content/pii:S2468823121003291/gr9/THUMBNAIL/image/gif/83b20fefbb962f6e16320f3d8c474aa2/gr9.sml gr9 gr9.sml sml 7542 164 188 IMAGE-THUMBNAIL 1-s2.0-S2468823121003291-gr8.sml https://s3-eu-west-1.amazonaws.com/prod-ucs-content-store-eu-west/content/pii:S2468823121003291/gr8/THUMBNAIL/image/gif/cdece6edaaaf3dae91a56fe6db98c091/gr8.sml gr8 gr8.sml sml 14757 137 219 IMAGE-THUMBNAIL 1-s2.0-S2468823121003291-gr7.sml https://s3-eu-west-1.amazonaws.com/prod-ucs-content-store-eu-west/content/pii:S2468823121003291/gr7/THUMBNAIL/image/gif/1658465db25a6511a027ca1c25cbced4/gr7.sml gr7 gr7.sml sml 7149 118 219 IMAGE-THUMBNAIL 1-s2.0-S2468823121003291-gr6.sml https://s3-eu-west-1.amazonaws.com/prod-ucs-content-store-eu-west/content/pii:S2468823121003291/gr6/THUMBNAIL/image/gif/9ac4829fdca3457498e0b8fd7272797e/gr6.sml gr6 gr6.sml sml 10760 143 219 IMAGE-THUMBNAIL 1-s2.0-S2468823121003291-gr5.sml https://s3-eu-west-1.amazonaws.com/prod-ucs-content-store-eu-west/content/pii:S2468823121003291/gr5/THUMBNAIL/image/gif/2a88443fe0bf20cfe698ce762861c46c/gr5.sml gr5 gr5.sml sml 5238 159 219 IMAGE-THUMBNAIL 1-s2.0-S2468823121003291-gr4.sml https://s3-eu-west-1.amazonaws.com/prod-ucs-content-store-eu-west/content/pii:S2468823121003291/gr4/THUMBNAIL/image/gif/beed1a5bdcc16350a37cbd171e034fa8/gr4.sml gr4 gr4.sml sml 6091 136 219 IMAGE-THUMBNAIL 1-s2.0-S2468823121003291-gr3.sml https://s3-eu-west-1.amazonaws.com/prod-ucs-content-store-eu-west/content/pii:S2468823121003291/gr3/THUMBNAIL/image/gif/55746d0d68b9fe5b1901409254a24c0d/gr3.sml gr3 gr3.sml sml 29114 164 195 IMAGE-THUMBNAIL 1-s2.0-S2468823121003291-gr2.sml https://s3-eu-west-1.amazonaws.com/prod-ucs-content-store-eu-west/content/pii:S2468823121003291/gr2/THUMBNAIL/image/gif/2a49306f644ca70553de0ed86c2d324d/gr2.sml gr2 gr2.sml sml 19491 100 219 IMAGE-THUMBNAIL 1-s2.0-S2468823121003291-ga1.sml https://s3-eu-west-1.amazonaws.com/prod-ucs-content-store-eu-west/content/pii:S2468823121003291/ga1/THUMBNAIL/image/gif/853f7a2374ca5ec01c5664658a50d9b1/ga1.sml ga1 true ga1.sml sml 12950 109 219 IMAGE-THUMBNAIL 1-s2.0-S2468823121003291-gr1.sml https://s3-eu-west-1.amazonaws.com/prod-ucs-content-store-eu-west/content/pii:S2468823121003291/gr1/THUMBNAIL/image/gif/d08d799fc31462808f05da63befb9b5f/gr1.sml gr1 gr1.sml sml 11397 151 219 IMAGE-THUMBNAIL 1-s2.0-S2468823121003291-fx2_lrg.jpg https://s3-eu-west-1.amazonaws.com/prod-ucs-content-store-eu-west/content/pii:S2468823121003291/fx2/HIGHRES/image/jpeg/b9bb75607b366555cdc9ad0ee9c2a5ca/fx2_lrg.jpg fx2 fx2_lrg.jpg jpg 35025 256 2503 IMAGE-HIGH-RES 1-s2.0-S2468823121003291-fx1_lrg.jpg https://s3-eu-west-1.amazonaws.com/prod-ucs-content-store-eu-west/content/pii:S2468823121003291/fx1/HIGHRES/image/jpeg/8eedfe02285e6cd3090ebeeac2d8aa51/fx1_lrg.jpg fx1 fx1_lrg.jpg jpg 6204 61 293 IMAGE-HIGH-RES 1-s2.0-S2468823121003291-gr9_lrg.jpg https://s3-eu-west-1.amazonaws.com/prod-ucs-content-store-eu-west/content/pii:S2468823121003291/gr9/HIGHRES/image/jpeg/4edbad95d51fd36161b63c8c8bd79aad/gr9_lrg.jpg gr9 gr9_lrg.jpg jpg 274082 1307 1500 IMAGE-HIGH-RES 1-s2.0-S2468823121003291-gr8_lrg.jpg https://s3-eu-west-1.amazonaws.com/prod-ucs-content-store-eu-west/content/pii:S2468823121003291/gr8/HIGHRES/image/jpeg/8902a929e0fdcc950cb6b54c18d2a70a/gr8_lrg.jpg gr8 gr8_lrg.jpg jpg 1043835 1569 2500 IMAGE-HIGH-RES 1-s2.0-S2468823121003291-gr7_lrg.jpg https://s3-eu-west-1.amazonaws.com/prod-ucs-content-store-eu-west/content/pii:S2468823121003291/gr7/HIGHRES/image/jpeg/9b811acb288bcf52db1dfa8c619ce5c9/gr7_lrg.jpg gr7 gr7_lrg.jpg jpg 209630 1347 2501 IMAGE-HIGH-RES 1-s2.0-S2468823121003291-gr6_lrg.jpg https://s3-eu-west-1.amazonaws.com/prod-ucs-content-store-eu-west/content/pii:S2468823121003291/gr6/HIGHRES/image/jpeg/c86a48c69e113a98ff7bbebffe037a70/gr6_lrg.jpg gr6 gr6_lrg.jpg jpg 302429 1636 2499 IMAGE-HIGH-RES 1-s2.0-S2468823121003291-gr5_lrg.jpg https://s3-eu-west-1.amazonaws.com/prod-ucs-content-store-eu-west/content/pii:S2468823121003291/gr5/HIGHRES/image/jpeg/a53b89e9cbfd1ada5b11927da33cc049/gr5_lrg.jpg gr5 gr5_lrg.jpg jpg 164326 1448 2000 IMAGE-HIGH-RES 1-s2.0-S2468823121003291-gr4_lrg.jpg https://s3-eu-west-1.amazonaws.com/prod-ucs-content-store-eu-west/content/pii:S2468823121003291/gr4/HIGHRES/image/jpeg/461fc81b144fd4920534b2abb37f5459/gr4_lrg.jpg gr4 gr4_lrg.jpg jpg 269514 1601 2583 IMAGE-HIGH-RES 1-s2.0-S2468823121003291-gr3_lrg.jpg https://s3-eu-west-1.amazonaws.com/prod-ucs-content-store-eu-west/content/pii:S2468823121003291/gr3/HIGHRES/image/jpeg/0680ebd14f94f67e13b34835eec2f442/gr3_lrg.jpg gr3 gr3_lrg.jpg jpg 1303054 2099 2499 IMAGE-HIGH-RES 1-s2.0-S2468823121003291-gr2_lrg.jpg https://s3-eu-west-1.amazonaws.com/prod-ucs-content-store-eu-west/content/pii:S2468823121003291/gr2/HIGHRES/image/jpeg/57f03c5d93832dd52ac7988e7fbcff59/gr2_lrg.jpg gr2 gr2_lrg.jpg jpg 476459 1141 2499 IMAGE-HIGH-RES 1-s2.0-S2468823121003291-ga1_lrg.jpg https://s3-eu-west-1.amazonaws.com/prod-ucs-content-store-eu-west/content/pii:S2468823121003291/ga1/HIGHRES/image/jpeg/473cdab0e5a52639497c184e295dec49/ga1_lrg.jpg ga1 true ga1_lrg.jpg jpg 192851 662 1333 IMAGE-HIGH-RES 1-s2.0-S2468823121003291-gr1_lrg.jpg https://s3-eu-west-1.amazonaws.com/prod-ucs-content-store-eu-west/content/pii:S2468823121003291/gr1/HIGHRES/image/jpeg/4aa6814016a0a0c07f6b5866c00be8f1/gr1_lrg.jpg gr1 gr1_lrg.jpg jpg 143220 1040 1509 IMAGE-HIGH-RES 1-s2.0-S2468823121003291-si1.svg https://s3-eu-west-1.amazonaws.com/prod-ucs-content-store-eu-west/content/pii:S2468823121003291/STRIPIN/image/svg+xml/57a160841c718035956c934da71e9be2/si1.svg si1 si1.svg svg 6160 ALTIMG 1-s2.0-S2468823121003291-si2.svg https://s3-eu-west-1.amazonaws.com/prod-ucs-content-store-eu-west/content/pii:S2468823121003291/STRIPIN/image/svg+xml/4d00707b7691f02a3447c98c907e7f77/si2.svg si2 si2.svg svg 7470 ALTIMG 1-s2.0-S2468823121003291-si3.svg https://s3-eu-west-1.amazonaws.com/prod-ucs-content-store-eu-west/content/pii:S2468823121003291/STRIPIN/image/svg+xml/bee95d7a1400247fcd8188c47f812586/si3.svg si3 si3.svg svg 19569 ALTIMG 1-s2.0-S2468823121003291-si4.svg https://s3-eu-west-1.amazonaws.com/prod-ucs-content-store-eu-west/content/pii:S2468823121003291/STRIPIN/image/svg+xml/463af5d6e3fb9b27c5bbdebbbd069d51/si4.svg si4 si4.svg svg 1025 ALTIMG 1-s2.0-S2468823121003291-si5.svg https://s3-eu-west-1.amazonaws.com/prod-ucs-content-store-eu-west/content/pii:S2468823121003291/STRIPIN/image/svg+xml/df7a62c5932368b9888653c8185ae031/si5.svg si5 si5.svg svg 19085 ALTIMG 1-s2.0-S2468823121003291-si6.svg https://s3-eu-west-1.amazonaws.com/prod-ucs-content-store-eu-west/content/pii:S2468823121003291/STRIPIN/image/svg+xml/9cab394990164a5ce64b70a2020e27f0/si6.svg si6 si6.svg svg 12686 ALTIMG 1-s2.0-S2468823121003291-am.pdf am am.pdf pdf 1392930 AAM-PDF https://s3-eu-west-1.amazonaws.com/prod-ucs-content-store-eu-west/content/egi:10ZN613ZZCH/MAIN/application/pdf/bc3f6f80e0d3d6cf4fc8639b2bc123bb/am.pdf MCAT 111712 111712 S2468-8231(21)00329-1 10.1016/j.mcat.2021.111712 Fig. 1 Schematic diagram of the experimental setup for pyrolysis (P = pressure gauge, T = thermocouple). Fig 1 Fig. 2 SEM images of NiMo/γ-Al2O3 catalyst surface at (a) 50,000x and (b) 100,000x magnifications. Fig 2 Fig. 3 Mapping of metals on the NiMo/γ-Al2O3 catalyst surface: (a) Al, (b) O, (c) Ni, and (d) Mo. Fig 3 Fig. 4 XRD pattern of the NiMo/γ-Al2O3 catalyst at low angle. Fig 4 Fig. 5 Temperature-programmed reduction of NiMo/γ-Al2O3 profile. Fig 5 Fig. 6 NH3-TPD profile for (a) NiMo/γ-Al2O3/CeO2, (b) NiMo/γ-Al2O3/ZrO2 and (c) NiMo/γ-Al2O3/TiO2 catalysts (heating rate = 10/min; NH3 adsorbed at 150 °C). Fig 6 Fig. 7 TGA and DTA profiles of palm fruit cake under N2, at a heating rate of 10°C/min. Fig 7 Fig. 8 Yields of products at various pyrolysis temperatures. Fig 8 Fig. 9 Coke formation on the spent catalysts. Fig 9 Table 1 Properties of the palm fruit cake, palm kernel cake, and palm empty fruit bunch. Table 1 Ultimate analysis (wt%) Palm fruit cake Palm kernel cakec Palm empty fruit bunchesd Bio-oil C 47.53 50.8 49.07 68.45 H 6.40 6.1 6.48 9.43 N 1.19 3.1 0.70 1.21 S - 0.2 - - Oa 44.88 39.8 38.29 20.91 H/C molar ratio 1.62 - - 1.65 O/C molar ratio 0.71 - - 0.23 Empirical formula CH1.62O0.71N0.02 - - CH1.65O0.23N0.02 HHVb (MJ/kg) 17.02 20.5 19.35 32.85 LHV (MJ/kg) 15.80 - - 30.79 aCalculated by difference. cJeong et al. [38] bCalculated by Dulong's formula dSulaiman et al. [39] Table 2 Components of the crude bio-oil determined by GC-MS. Table 2 Components %Area Components %Area Acid 39.21 Aromatic 7.69 n-Hexadecanoic acid 18.05 Toluene 2.11 Oleic Acid 10.79 1,2,4-Trimethoxybenzene 1.15 Acetic acid 4.06 5-tert-Butylpyrogallol 0.67 Dodecanoic acid 3.83 Benzofuran, 2-methyl 0.57 Tetradecanoic acid 1.20 Ethylbenzene 0.56 Propanoic acid 0.75 Benzene, 1,3-dimethyl- 0.39 Octanoic acid 0.40 p-Xylene 0.37 Dodecanoic acid, 3-hydroxy- 0.13 Benzene, 1,1′-propylidenebis 0.32 Phenol 31.55 1,3-Benzenediol, 4-ethyl- 0.30 Phenol 19.28 Naphthalene 0.28 Phenol, 2-ethyl- 3.33 Benzene, 1-ethyl-2-methyl- 0.25 Phenol, 2-methoxy 2.88 Styrene 0.23 Phenol, 2,6-dimethoxy 1.61 Bicyclo[4.4.1]undeca-1,3,5,7,9-pentaene 0.17 Phenol, 4-ethyl-2-methoxy- 1.51 Benzene, (3-methylpentyl)- 0.16 Phenol, 2-methyl- 1.26 Naphthalene, 2-methyl- 0.16 Phenol, 2,6-dimethyl 0.80 Hydrocarbon 6.48 Phenol, 2,6-dimethoxy-4-(2-propenyl)- 0.41 Pentadecane 1.62 Phenol, 2-methoxy-4-propyl- 0.24 Undecane 0.89 Phenol, 2,4-dimethyl- 0.23 Tridecane 0.86 Ketone 2.14 Tetradecane 0.55 2-Cyclopenten-1-one, 2-methyl- 0.46 Decane 0.45 2-Tridecanone 0.37 3-Dodecane, (Z)- 0.39 2,4,6-Cycloheptatrien-1-one, 2-hydroxy-4-(1-methylethyl)- 0.32 Dodecane 0.37 2-Cyclopenten-1-one, 2-hydroxy-3-methyl- 0.32 5-Undecane, (Z)- 0.34 2-Cyclopenten-1-one, 2,3-dimethyl- 0.29 4-Tridecene, (Z)- 0.32 2-Heptadecanone 0.23 Thiophene, 2-(2-butenyl)-, (E)- 0.27 2-Cyclopenten-1-one, 3-ethyl-2-hydroxy- 0.15 1,3-cyclopentadiene, (1-methylethylidene)- 0.25 Ester 9.36 1,5,5-Trimethyl-6-methylene-cyclohexene 0.17 Hexadecanoic acid, methyl ester 3.91 Alcohol 3.01 9-Octadecenoic acid (Z)-, methyl ester 3.06 2-Methoxy-5-methylphenol 1.47 Dodecanoic acid, methyl ester 1.72 2-Furanmethanol 0.59 Methyl stearate 0.36 Cyclohexanol, 3-methyl 0.41 Benzoic acid, methyl ester 0.31 1-Tetradecanol 0.31 Ether 0.27 1H-Inden-2-ol, 2,3-dihydro-1-methoxy- 0.23 Furan, 2-ethyl-5-methyl- 0.27 N-compound 0.29 3-Pyridinol 0.29 Table 3 Product yields of various catalytic pyrolysis products of palm fruit cake using different catalysts at 450°C under nitrogen atmosphere. Table 3 Types of catalysts Product yield (wt%) Solid Gas Liquid Liquid Aqueous phase Organic phase No catalyst 31.15±0.70 24.14±1.24 44.71±0.82 33.15±0.52 11.56±0.31 Ni/γ-Al2O3 32.11±1.43 23.96±0.31 43.93±1.12 32.20±1.40 11.73±0.28 Mo/γ-Al2O3 32.84±0.65 22.35±0.45 44.80±0.64 31.58±0.10 13.22±0.55 NiMo/γ-Al2O3 32.43±0.21 23.11±0.82 44.46±0.82 31.70±1.30 12.76±1.08 NiMo/γ-Al2O3/CeO2 32.33±0.70 22.56±0.99 45.11±0.66 32.25±0.59 12.86±0.34 NiMo/γ-Al2O3/TiO2 32.50±0.45 23.71±0.88 43.80±1.24 32.11±1.00 11.69±0.72 NiMo/γ-Al2O3/ZrO2 32.96±0.58 22.76±1.30 44.28±1.86 30.27±1.17 14.01±0.72 Table 4 Elemental compositions, %DOD, and calorific values of bio-oils using Ni/γ-Al2O3, Mo/γ-Al2O3, and NiMo/γ-Al2O3 with TiO2, CeO2, and ZrO2. Table 4 Catalysts Properties %C %H %N %O %DOD H/C O/C HHV a (MJ/kg) No catalyst 68.45 9.43 1.21 20.91 53.41 1.65 0.23 32.85 Ni/γ-Al2O3 68.86 9.36 1.28 20.50 54.32 1.63 0.22 32.96 Mo/γ-Al2O3 68.26 9.72 1.18 20.84 53.57 1.71 0.23 33.21 NiMo/γ-Al2O3 69.79 9.04 1.87 19.30 57.00 1.55 0.21 33.03 NiMo/γ-Al2O3/CeO2 70.24 10.01 1.31 18.44 58.91 1.66 0.22 34.72 NiMo/γ-Al2O3/TiO2 74.08 9.55 1.75 14.62 67.42 1.55 0.16 36.04 NiMo/γ-Al2O3/ZrO2 75.69 9.53 1.70 13.08 70.86 1.51 0.14 36.83 a HHV calculated by Dulong's formula Table 5 Composition (area %) of the bio-oil upgraded by various catalysts at 450°C under nitrogen atmosphere. Table 5 Catalysts Organic compounds Acids Phenols Esters Aromatics Hydrocarbons Ketones Aldehydes Ethers Alcohols N-compounds Crude bio-oil(non-catalyst) 39.21 31.55 9.36 7.69 6.48 2.14 0.00 0.27 3.01 0.26 NiMo/γ-Al2O3/CeO2 47.82 21.76 12.03 6.56 3.75 3.47 0.59 0.69 0.70 2.62 NiMo/γ-Al2O3/TiO2 26.63 32.10 9.28 10.38 6.81 7.07 0.51 1.17 2.10 3.96 NiMo/γ-Al2O3/ZrO2 24.58 29.03 9.92 11.79 12.27 6.02 0.18 0.68 1.46 4.08 Table 6 Properties data of reusability of NiMo/γ-Al2O3 catalyst under nitrogen atmosphere. Table 6 Properties 1st Run 2nd Run Without catalyst Solid 32.64±0.29 31.63±0.68 31.15±0.70 Gas 22.73±0.54 24.05±0.13 24.14±1.24 Liquid 44.63±0.24 44.32±0.55 44.71±0.82 Aqueous phase 31.64±0.08 32.675±0.67 33.15±0.52 Organic phase 12.99±0.33 11.65±0.12 11.56±0.31 %C 74.95±0.17 68.655±0.29 68.45±0.44 %H 9.71±0.07 9.395±0.05 9.43±0.16 %N 1.63±0.52 1.25±0.05 1.21±0.07 %O 13.70±0.27 20.71±0.29 20.91±0.66 H/C ratio 1.56±0.01 1.64±0.02 1.65±0.02 O/C ratio 0.14±0.00 0.23±0.00 0.23±0.01 HHV (MJ/kg) 35.77±0.24 32.52±0.14 32.85±0.86 Deoxygenation of pyrolysis vapor from palm fruit cake over NiMo/γ-Al2O3 catalyst: Effect of CeO2, TiO2, and ZrO2 additives Worada Moonsrikaew Apinya Duangchan ⁎ Department of Chemical Engineering, Kasetsart University, Bangkok 10900, Thailand Department of Chemical Engineering Kasetsart University Bangkok 10900 Thailand Department of Chemical Engineering, Kasetsart University, Bangkok 10900, Thailand ⁎ Corresponding author. Deoxygenation of pyrolysis vapor from palm fruit cake by different catalysts was prior investigated by using Ni/γ-Al2O3, Mo/γ-Al2O3, and NiMo/γ-Al2O3 prepared by wet impregnation method. NiMo/γ-Al2O3 showing the highest degree of deoxygenation (%DOD) activity was subsequently mixed with metal oxides: CeO2, TiO2, and ZrO2. Effects of the catalysts on upgrading of pyrolysis vapor from palm fruit cake at 450°C under N2 atmosphere in a semi-batch process were investigated. The oil products were analyzed for CHNO elements by elemental analyzer, chemical compositions by a gas chromatograph coupled to a mass spectrometer (GC-MS), and higher heating values (HHV) by Dulong's equation. Catalysts have been characterized and discussed related to the product yields and properties. Acidity and acid strength of the catalyst mixture play an important role on the products. NiMo/γ-Al2O3 improved properties of the crude bio-oil by increasing organic phase yield, %DOD, and HHV. Addition of CeO2 to NiMo/γ-Al2O3 reduced phenol compound in the liquid products while addition of TiO2 to NiMo/γ-Al2O3 provided high aromatics and hydrocarbons comparable to those obtained from NiMo/γ-Al2O3/ZrO2. Addition of ZrO2 to NiMo/γ-Al2O3 exhibited the highest organic phase yield (%), %DOD (71%), and HHV (37 MJ/kg). Graphical abstract Image, graphical abstract Key words Deoxygenation Palm fruit cake Alumina Nickel Molybdenum Metal Oxides 1 Introduction Due to the prediction of a shortage of fossil fuels in the near future, clean energy sources such as wind, hydroelectric power, solar, hydrogen, nuclear power and biomass are of great interest [1,2]. Among these, biomass is recognized as an important source of alternative energy, particularly in developing countries. Agricultural residue is cheap, abundant, and does not require much effort to collect [3]. Moreover, biomass has a negligible content of sulfur, nitrogen, and ash. Biomass consists mainly of cellulose, hemicellulose and lignin. Palm fruit cake in this study was from the extraction process in a palm oil industry. It was readily available and considered a good source of biomass. Pyrolysis is a choice to convert biomass to bio-oil. It is the thermal decomposition of the organic matter in the absence of oxygen to produce renewable energy resources in forms of liquid (bio-oil), solid char, and gases [4]. Bio-oil, a dark brown liquid with an unpleasant odor, has both advantages and disadvantages. It is a complex and chemically unstable mixture. When it is used for combustion, the emissions of sulfur oxides (SOx) and nitrogen oxides are less than those from petroleum diesel [5]. Bio-oil is an alternative to petroleum-based fractions for the production of fuels and high value-added chemicals. The major organic compounds of the bio-oils are oxygenates like acids, alcohols, ethers, ketones, aldehydes, phenols, esters, sugars, furans, and nitrogen compounds. The oxygenated compounds in bio-oil consist of carbonyl, carboxyl, and phenolic groups. Bio-oil is not suitable for commercial transportation due to its corrosiveness (acidity), instability, high water and oxygen contents, low heating value, and high viscosity [6,7]. Conversion of bio-oil to transportation fuels needs its upgrading to increase heating value, thermal stability, and reduce viscosity and the content of oxygenates. Therefore, upgrading of pyrolytic oils is of high necessity. Many efficient processes have been proposed for upgrading of bio-oil, such as dehydration, deoxygenation, hydrodeoxygenation, supercritical fluids, steam reforming, chemical extraction, esterification, hydrogenation, depolymerization, and alkylation [6,8]. Two possible ways to upgrade bio-oil are: (1) treatment with zeolites at atmospheric pressure and high temperatures and (2) catalytic hydrodeoxygenation (HDO) under high pressure. The HDO is extensively studied as it is based on the well-known hydrotreatment process of petroleum fractions and appears to be very effective for the bio-oil upgrading [9]. In hydrotreating in oil refinery, nickel-molybdenum supported on the surface of oxidic supports such as alumina (Al2O3) and silica-alumina (SiO2–Al2O3) catalysts are extensively used [10]. The commercial catalysts are in general consists of NiMo or CoMo metals supported on alumina. Although SBA-15 and AC-supported NiMo have very high surface area compared to the alumina-supported catalyst, the NiMo/Al2O3 catalyst has a higher pore diameter and pore volume with an appropriate surface area. The NiMo catalyst supported on mesoporous alumina showed the highest hydrotreating and hydrocracking conversions [11]. The high activity of NiMo/Al2O3 in hydrogenation processes, especially at low temperatures, was reported by Gandarias et al. [12] and Platanitis et al. [13]. The special interest in NiMo/Al2O3 catalysts is in fact that they are widely available and used in the petroleum industry for hydrotreatment of light to heavy fractions, they are relatively cheap, and they appear very active and attractive for HDO applications [11]. For deoxygenation reaction of bio-oil, even though hydrogen gas was not used, it was reported that hydrogen gas was produced from steam reforming of the aqueous phase in the bio-oil using different catalysts. Yan et al. [14] used Ni/CeO2-ZrO2 catalyst to produce H2 in steam reforming process at 800°C and water-to-bio-oil ratio (W/B) of 4.9 in a fixed-bed reactor. The best performance exhibited when the Ni and Ce load were 12% and 7.5% by weight, respectively, the H2 yield was 69.7%. Moreover, Han-u-domlarpyos et al. [15] investigated catalytic deoxygenation of pyrolysis oil from palm shell over NiMoS/γ-Al2O3 catalyst in a fixed-bed reactor at a temperature range 350–450°C. The results showed that the oxygenated compound in the bio-oil product were mainly phenol and its derivatives. Kubička and Kaluža [16] conducted pyrolysis of pine wood in a fixed-bed reactor, at 500°C, weight hourly space velocity (WHSV) of 6 h−1, and reported that Ni-modified ZSM-5 increased the overall aromatic hydrocarbon yield and conversion of the pyrolysis vapor oxygenates over biomass/catalyst ratio 1 to 1. Moreover, increasing in Ni loading led to increasing in aromatic hydrocarbon production. Zulkepli et al. [17] have studied effect of various Ni loadings (5–100 wt% Ni) on hexagonal mesoporous silica (HMS). It was reported that the incorporation of Ni into HMS has generated new acid sites of weak and moderate strengths. The incorporation of Ni loading into the HMS framework showed an increase in catalytic activity compared to that of HMS in the deoxygenation of triolein to produce a hydrocarbon fuel in the absence of hydrogen and solvent. Moreover, it was reported that 10 wt% Ni/HMS catalyst exhibited the highest conversion. Conversion of 92.5% and selectivity of 95.2% were achieved. The 10 wt% Ni/HMS exhibited a weak and strong level of acidity at 150–170 °C and 490–700 °C respectively. It was explained that the highest conversion received was due to the synergistic effect of Si-O-Ni bonding and high dispersion of NiO on HMS. This was explained that the high surface area and the interaction of HMS and NiO has enhanced the formation of additional acid sites. They have observed that 10 wt% Ni loading was highly dispersed on the HMS. CeO2, TiO2 and ZrO2 are very promising materials for industrial applications [18]. CeO2 has fluorite structure, in which the oxygen atoms are all co-planar, this allows oxygen atoms to diffuse rapidly through the lattice. CeO2 has been widely used as support. It improves thermal stability of the catalyst, metal dispersion, and suppresses coke formation due to a good oxygen storage capacity [19]. Some researchers informed that an addition of ZrO2 to CeO2 improved the redox capacity and used as a good support [20]. TiO2 is a non-toxic, stable, and low cost chemical. It is not only used as a catalyst support but also as an active site that impacts the catalytic performance. TiO2 is a weak acid support, mainly with Lewis acid properties since Bronsted acidity is not observed [21]. The Lewis acid sites have a tendency to attract the oxygen ion pair of the molecules, this leads to higher selectivity for the hydrogenated product. Using TiO2 as a catalyst to catalyze the transformation of guaiacol through demethylation, it was observed that hydrogenation was the main pathway. TiO2 performs as a reservoir of H atoms where H atoms can migrate from one reactant to another reactant. The hydrogen molecules adsorbed and dissociated on the metal surface can migrate to the TiO2 where they are trapped at surface defects. The H+ on TiO2 can be exchanged with H2 in the presence of the metal phase. The hydrogen spill-over enhances reduction and the hydrogenation ability of TiO2. Moreover, it was mentioned that TiO2 effectively prevents the growth and sintering of metal particles. Anatase, rutile, and brookite are the three main crystal polymorphs of TiO2. Each polymorph has different physical properties. Among the three polymorphs, rutile is the most stable phase under ambient temperature while anatase and brookite are metastable at all temperatures and will transform to rutile when they are heated. Most experimental work has been carried out with anatase or rutile. The presence of either or both of these phases leads to different activities for chemical reactions. Brookite is the least stable phase among the three thus it is seldom studied [21]. ZrO2 has been shown to inhibit sintering of some active components, due to its high mechanical strength and good thermal resistance. In addition, Yakovlev et al. [22] showed that CeO2 and ZrO2 were most effective additives because of possible additional activation of oxy-compounds on the surface. Kaewpengkrow et al. [23] used Al2O3, ZrO2, and TiO2, which have 2 phases: rutile and anatase for upgrading of bio-oil from Jatropha wastes. The results showed that Al2O3 and TiO2 (anatase) were the most effective metal oxides for increasing hydrocarbon while decreasing oxygenated compounds. Meanwhile Lu et al. [24] studied mesoporous ZrO2, TiO2, and SiO2 (SBA-15) for catalytic cracking of biomass in fast pyrolysis. ZrO2 was the best catalyst for improving the product properties. It was able to convert lignin-derived oligomers to monomeric phenolic compounds. In addition, it decreased anhydrosugars, linear aldehydes, and linear acid, while production of linear ketones, furans, hydrocarbons, and cyclopentanone was increased. Similarly, Lu et al. [25] studied the upgrading of bio-oil from poplar wood using 12 different catalysts over various meso- or macroporous supports. As a result, ZrO2 and TiO2 decreased phenol, organic acid, and anhydrous sugar while increasing hydrocarbons, ketones, and cyclopentanone. Likewise, Chen et al. [26] conducted deoxygenation of octanoic acid using hollow spherical Ni/ZrO2 in a nanoreactor. ZrO2 which had oxygen vacancies increased the conversion of octanoic acid to alkanes. Furthermore, Choi et al. [27] used WOx/Pt/TiO2 (WPT) catalyst for the deoxygenation of stearic acid, a model compound of free-fatty acid, and jatropha fatty acid, a real feed, to produce bio-jet fuel range alkane. The deoxygenation reaction was carried out in a batch reactor at 300°C for 3 h, and initial N2 pressure of 15 bar. It was reported that WPT enhanced degree of deoxygenation (%DOD) up to 86%. In our work, palm fruit cake was used as a source of biomass due to its abundance and availability in Thailand. The bio-oil produced from pyrolysis is well known for its low quality due to high acidity and low hydrocarbons. In line with the above discussion, NiMo/γ-Al2O3 catalysts were expected to lower acidity and increase hydrocarbon production. In addition, metal oxides CeO2, ZrO2, and TiO2 were added to NiMo/γ-Al2O3 catalyst, and the bio-oil properties were expected to be improved. The activity of NiMo/γ-Al2O3 promoted by CeO2, ZrO2, and TiO2 has not been reported. 2 Experimental 2.1 Materials Palm fruit cake (PFC) used in this study was a waste from a vegetable oil refining and bio-diesel plant. The oil palm fruit was squeezed to separate the crude palm oil and the palm fruit cake. PFC was a by-product from crude palm oil extraction process from the Chaipattana Foundation at Hua Hin District, Prachuab Khiri Khan Province. Prior to use, PFC was dried in an oven at 105°C for 24 hours and then crushed and sieved. Particles with dimensions less than 1 mm were used. The proximate analysis of PFC which includes moisture content (ASTM D1756-08), ash content (ASTM E11755-01), and volatile matter (ASTM E872-82) is shown in Table 1 . The ultimate analysis was determined by using a LECO model 628 Series CNH 2000 elemental analyzer for C, H, N, and O (by difference) contents. 2.2 Catalyst preparation Compositions of Ni and Mo on γ-Al2O3 were 10 wt% Ni and 10 wt% Mo. The amount of 10 wt% Ni on alumina was from the study of Zulkepli et al. [17]. They studied the use of Ni on mesoporous silica for deoxygenation of triolein into hydrocarbon-biofuel production. The use of 10 wt% of Ni/hexagonal mesoporous silica (HMS) catalyst exhibited the highest conversion of triolein into hydrocarbon-biofuel products compared to 5 wt%, 40 wt% of Ni/ HMS and 100 wt% of Ni. Moreover, the use of 10 wt% Mo on support was based on the content of Mo in a commercial NiMo/Al2O3 which contained 12.5 wt% Mo [9]. In addition, catalyst preparation method also affects activities of the catalysts. Lee et al. [28] have studied the effects of the catalyst preparation method and CeO2 particle morphology of Pt/CeO2 catalysts for the water–gas shift reaction. The Pt metal was loaded via either the incipient wetness impregnation (IWI) method or the strong electrostatic adsorption (SEA) method. The results show preparation method strongly affects the catalyst activity. The catalyst prepared by IWI method showed higher catalytic activity than the SEA-prepared catalysts regardless of the morphology of the CeO2. Moreover, the cube-shaped-CeO2-based catalysts showed higher catalytic activities than the rod-shaped-CeO2-based catalysts regardless of the catalyst preparation method. Their results highlight the fact that the catalyst preparation method and the morphology of the CeO2 support strongly affects the key factors related to the catalytic activity in the water–gas shift reaction separately. Moreover, Gurbani et al. [29] has prepared 7 wt% CuO–CeO2 catalyst by conventional wet impregnation (WI) and deposition–precipitation (DP) methods. The catalyst from wet impregnation method has shown a great activity and selectivity, as well as high surface area and good interaction with CO for CO oxidation reaction, with a considerably small particle size. It shows that the interaction needed between metal and support for an efficient performance of the catalyst is obtained by such a simple wet impregnation method, also obtain large interface Cu–Ce where the CO is adsorbed and reacts to form CO2. Compared to the DP method which provides catalyst with very high dispersion, but the intimate contact between CuO and ceria is less active than that prepared by WI. Wet impregnation method is a common technique used for the synthesis of heterogeneous catalysts, it is simple, cost effective and provides high catalytic activity. Therefore, the catalyst used in this study was simply prepared by wet impregnation method. 2.2.1 Ni γ-Al2O3 was obtained from Dong Yang (HK) group limited, Hongwa Nanometer, Guangzhou, China. It has a particle size of 15–20 nm, and a surface area of 220 m2/g. The 10 wt% of Ni on γ-Al2O3 catalyst was prepared by wet impregnation method using Ni(NO3)2.6H2O (Extra pure, QRëC) as a precursor. 4.955 g of Ni(NO3)2.6H2O was dissolved in 15 ml deionized water. The precursor solution was added to 9 g γ-Al2O3 support, stirred at 80°C for 2 hours, dried in a hot air oven at 105°C overnight, and calcined at 500°C for 4 hours. 2.2.2 Mo / γ − A l 2 O 3 The 10 wt% Mo on γ-Al2O3 catalyst was prepared by wet impregnation method identical to Ni/γ-Al2O3 preparation but using 1.8398 g (NH4)6Mo7O24.4H2O (UNIVAR, Purity 99%, grade AR) as a precursor. 2.2.3 NiMo / γ − A l 2 O 3 The 10 wt% Ni and 10 wt% Mo on γ-Al2O3 catalyst was prepared by wet impregnation method using 4.955 g Ni(NO3)2.6H2O and 1.8398 g (NH4)6Mo7O24.4H2O as precursors. Both precursors were dissolved in 15 ml deionized water. The precursor solutions were then added to 8 g γ-Al2O3 support, stirred at 80°C for 2 hours, dried in a hot air oven at 105°C overnight, and calcined at 500°C for 4 hours. Prior to use, all the catalysts were reduced with H2 gas at 50 cm3/min, 700°C for 2 hours. 2.2.4 NiMo / γ − A l 2 O 3 / metal oxides ( Ce O 2 , Ti O 2 , and Zr O 2 ) The NiMo/γ-Al2O3 and metal oxide catalyst was prepared by simply mixing NiMo/γ-Al2O3 with metal oxide powder at a weight ratio of 1:1. Each experiment, 0.15 g NiMo/γ-Al2O3 was mixed with 0.15 g of each metal oxide including cerium (IV) oxide (99.0%, CeO2 (Aldrich), surface area of 196.6 m2/g, pore volume of 0.004 cm3/g, pore size 0.09 nm), titanium (IV) dioxide (98% anatase powder, TiO2 (Acros), surface area of 66.8 m2/g, pore volume of 0.002 cm3/g, pore size 0.075 nm), and zirconium (IV) dioxide (98.5%, ZrO2 (Acros), surface area of 184.6 m2/g, pore volume of 0.003 cm3/g, pore size 0.069 nm). The amount of catalyst used for each experiment was 0.3 g catalyst per 100 g palm fruit cake. Larger amount of catalyst can be used with an increase amount of biomass. 2.3 Catalyst characterization Brunauer–Emmett–Teller (BET) surface area, pore volume, and pore diameter of the catalysts were analyzed by an Autosorb-1 using multipoint BET. Images of the catalyst and the amounts of Ni and Mo were obtained by Scanning Electron Microscope (SEM)/Energy Dispersive X-Ray Spectrometer (EDS) and X-Ray Fluorescence Spectrometer (XRF), and the catalyst structure was analyzed by X-ray Diffractometer (XRD). Scanning electron micrographs of the fresh synthesized oxide catalysts were obtained from Philips XL 30 SEM with the energy dispersive X-ray of 13 kV and 10000x magnification. Prior to analysis, the samples were coated with carbon as a conducting material by using an Edwards Scancoat Six coating machine. X-ray diffraction patterns of oxides of NiMo/γ-Al2O3 were recorded on a Bruker D8 Advance Powder Diffractometer using a Cu Ka radiation source at 40 kV 40 mA, a 2-theta (2 θ ) range of 20–80°, and a wavelength (λ) of 0.020449 Å. The crystal structure was determined in reference to ICDD PDF-2 (2011 version). TPR was performed to find the reduction temperature of the catalysts. H2-TPR profile of the NiMo/γ-Al2O3 catalyst sample was conducted in Microactive for AutoChem II 2920 Version 6.01. About 0.2 g of NiMo/γ-Al2O3 catalyst was used for measurement. Temperature was increased up to 1000 °C with a 5 °C/min heating rate. A mixture of 10 mol % H2/Ar was introduced as a reducing agent at 30 cm3/min into the sample loop and was also used as a reference gas. The hydrogen consumption was detected by a thermal conductive detector. NH3-TPD analysis is available in 3 Flex version 5.2 analyzer from Micromeritics. For each experiment, an amount of 150−200 mg of catalyst sample was first pretreated for 1 h at 700 °C with a 10 mol% H2/Ar at a flow rate of 30 cm3/min. Then, the sample was cooled to 150 °C and brought to saturation using a 97 mol% NH3/3 mol% He gas mixture, at a 30 cm3/min flow rate for 1 h. After that, the NH3 flow was switched off. Then, 30 cm3/min of a pure inert gas (He) at 100 °C was contacted with the catalyst for 1 h extra, to remove the physically adsorbed NH3. The temperature was then raised to 800 °C at a rate of 10 °C/min, with NH3 being desorbed progressively. The NH3 concentration in the effluent gas was monitored by using a TCD. 2.4 Pyrolysis and upgrading processes 100 g of PFC was placed in a stainless steel vessel in a pyrolyser. Pyrolysis was carried out under N2 atmosphere with a N2 flow rate of 100 ml/min. The pyrolyser was heated by an electric furnace to the specified temperature (400, 450, or 500°C). The pyrolysis vapor passed through the empty tubular reactor (Fig. 1 ) which was at 400, 450 or 500°C, i.e. the same temperature. The pyrolyser was maintained at the specified temperature for 1 h. The condensable vapor products were condensed in a condenser which was maintained at 10°C. The liquid product was collected in a conical flask, which was immersed in an ice bath with salt at a temperature of about -5°C, while the uncondensed vapor left through a fume hood. The upgrading process was almost identical to the pyrolysis process, except that the tubular reactor (internal diameter of 7 mm) was loaded with catalyst (0.30-0.45 g catalyst/100 g biomass) and the temperature was adjusted to 450°C prior to pyrolysis of the biomass. The flow rate of N2 was 100 cm3/min, weight hourly space velocity of 2,000 cm3/g⋅h, and the pyrolysis reactor was heated by an electric furnace to 450°C. The pyrolysis vapor was upgraded in the packed-bed-tubular reactor, and the upgraded bio-oil was collected in a condensate collector. Char was collected in the pyrolysis vessel, and gas was calculated by difference. 2.5 Characterization of the bio-oils Bio-oil was separated into two phases—an organic phase and an aqueous phase by a separatory funnel. The organic phase of bio-oil was dehydrated using sodium sulfate salt prior undertaking proximate and ultimate analyses by elemental analyzer (TruSpec CHNSO, LECO Instruments) The degree of deoxygenation, an important parameter of the deoxygenation of PFC, can be calculated from Eq. (1), following the work of Oh et al. [19]: (1) Degree of deoxygenation ( DOD , % ) = ( 1 − − oxygen in oil / oxygen in PFC ) x 100 The elemental composition data were used for determination of the higher heating value (HHV) by applying Dulong's Eq. (2) [20,21]: (2) HHV ( MJ / kg ) = [ 338 . 2 C + 1442 . 8 ( H − O / 8 ) ] / 1000 Where C, H, and O = weight percent of C, H, and O from elemental analysis. The chemical composition of bio-oil (organic phase) was analyzed by gas chromatography-mass spectrometry, GC-MS (Model: Agilent 7890B GC system and 7000C GC/MS Triple Quad) with a HP-INNO Wax capillary column (30 m × 0.25 mm × 0.25 µm) part no 19091S-433UI. The injector inlet temperature was kept at 220 °C and sample volume of 0.5 µl was injected in the split mode with split ratios of 50:1 and 10:1. Helium gas was used as a carrier gas at a constant flow rate of 1 cm3/min. The initial oven temperature was programmed from 50 °C (3 min of holding time) to 90, 120 and 250 °C with heating rates of 10, 4 and 8 °C/min, respectively. The final temperature at 250 °C was held for 10 min. The mass spectrometer analysis was carried out in EI mode at the following operation conditions: transfer line of 250 °C, ion source of 230 °C and electron energy at 70 eV. The mass spectra were in range 33-450 m/z. The interpretation of chromatograms was based on NIST2011 library. 3 Results and discussion 3.1 Catalyst characterization BET analysis revealed that the calcined NiMo/γ-Al2O3 catalyst has a surface area, a pore volume, and average pore diameter of 60.29 m2/g, 0.3447 cm3/g, and 22.8 nm compared to 276 m2/g, 1.08 cm3/g, and 10.02 nm, respectively, as reported by Kohli et al. [11]. The lower surface area comes from the γ-Al2O3 used. The γ-Al2O3 was used as received and its surface area was only 220 m2/g. After impregnation, Ni and Mo may have blocked some of the small pores of the γ-Al2O3, therefore, the NiMo/γ-Al2O3 catalyst surface area was lessened. The small pore volume was not desirable but the large pore diameter was quite useful for the access of large molecules. Catalyst that possesses a large pore diameter, high pore volume, and good active metal dispersion is highly desirable for the bio-oil upgrading. The study of Kohli et al. [11] has shown that the highest hydrotreating and hydrocracking conversions were observed with the NiMo/γ-Al2O3 while NiMo/SBA-15 and NiMo/activated carbon which had about twice surface area had lower activities. Analysis of NiMo/γ-Al2O3 catalyst by SEM and EDS produced images of the catalyst and metal dispersion as shown in Figs. 2 and 3 . At the magnifications of 50,000x and 100,000x (in Fig. 2), the catalyst can be seen to be made up of rough clusters of rounded solid particles. Each particle was about 20 micrometers in size. Fig. 3. (a-d) shows distributions of O, Al, Ni, and Mo, respectively. Oxygen and aluminum are the main chemicals in the support. Ni and Mo show good distributions all over the support (a desirable property for the upgrading). From elemental analysis of NiMo/γ-Al2O3 catalyst by SEM-EDS and XRF, it was found that weight percentages of Ni were 8.08 and 8.93 (theoretical Ni of 10 wt%), and of Mo were 7.03 and 6.90 (theoretical Mo of 10 wt%), respectively. The XRD pattern of the fresh calcined NiMo/γ-Al2O3 catalyst is shown in Fig. 4 . From γ-Al2O3 pattern (ICDD Card No. 00-056-0457), it shows diffraction peaks at 2θ = 19.58°, 31.94°, 37.60°. 39.49°, 45.79°, 60.45°, and 66.76°. In Fig. 4, it can be seen that the γ-Al2O3 support exhibits some broad crystalline peaks at 2θ = 32.9°, 39.8°, 46.8° and 66.4°, which fits most of the XRD standard pattern of the cubic γ-Al2O3 phase. For molybdenum, the XRD pattern of a monoclinic structure of NiMoO4 shows diffraction peaks at 2θ = 23.9°, 25.3°, 28.8°, 32.6°, 38.7°, 41.2°, 43.9°, 47.4°, and 53.3°. The XRD pattern of our NiMo/γ-Al2O3 catalyst consists of peaks at 2θ = 28.1°, 32.8°, 43.8°, and 47.4°. The XRD standard pattern of NiO shows 2θ = 37.4°, 45.7°, 50.3°, 60.9°, 61.1°, 66.4°, 67.2° and 69.9°. Our catalyst shows NiO peaks at 2θ = 45.8°, 61.1°, 67.2° and 69.6°. Sharifi et al. [30] reported the presence of NiO cubic structure (JCPDS 01-073-1519) as indicated by diffraction at 2θ = 37.3°, 43.3°, 63.0°, 75.6° and 79.6°. In addition, Cai et al. [31] reported that 2θ of NiO (JCPDS 65-6920) showed at 37.4°, 43.3°. 63.0°, and 75.4°. The standard pattern of MoO3 shows 2θ = 23.3°, 25.7°, 27.3°, 33.7°, 38.9°, 46.3°, 52.7°, 57.6°, and 58.8°. The crystalline orthorhombic phase of MoO3 in our catalyst is clearly seen from peaks at 2θ = 23.3°, 25.7°, 27.3°, 34.3°, 39.6°, and 49.2°. Temperature-programmed reduction (TPR) of NiMo oxide supported on γ-Al2O3 is shown in Fig. 5 . TPR profile of the NiMo/γ-Al2O3 catalyst exhibited two major peaks. The first peak appeared at 475°C (360–600°C) while the second peak appeared approximately at 700°C (640–780°C). The total amount of H2 consumed in reduction up to 700°C is 21.335 mmol/ g catalyst and the reduction is 81%. TPR of Ni/Al2O3 and Mo/Al2O3 catalysts has been studied by Qu et al. [10] and reported that hydrogen reduction of the Ni/Al2O3 catalyst started approximately at 500°C–860°C. TPR of the Ni/Al2O3 catalyst exhibited two peaks at 641°C and 762°C while Mo exhibited two major peaks at 422°C (335°C–640°C) and 874°C (640°C–970°C). It is worth noting that reduction temperatures of nickel oxides may overlap with those of molybdenum oxides. Thyssen et al. [32] found that, in general, nickel oxide has a reduction temperature of about 360°C. In the work of Grams et al. [33] the TPR profile of Ni/Al2O3 showed reduction at a temperature slightly above 400°C, Ni/CeO2 at about 300°C, and Ni/ZrO2 at about 400–600°C. At a reduction temperature of about 410°C, the interaction between nickel compounds and the alumina support in the amorphous phase was weak. At temperatures above 850°C, a stronger interaction occurred, resulting in a structure of nickel aluminate (NiAl2O4) [34]. The first peak of NiMo/γ-Al2O3 in this study appeared at 475°C (360–600°C), it could be related either to Mo and/or Ni. The reduction of MoO3 with H2 was observed at 400–650°C and 650–1000°C [35]. Comparison with conventional TPR of Mo, Lin et al. [35] mentioned that the first reduction range corresponds to the change of MoO3 to MoO2 and the second temperature range at 650–1000°C is attributable to the reduction of MoO2 to Mo. Anas and Yusuff [36] suggested that even though MoO2 became Mo at a reduction temperature between 800 and 950°C, at temperature as high as 850°C, new phases might occur—for example, NiAl2O4. Due to the strong interaction of metal oxides on support at high temperatures, doped metal oxides could not be completely reduced [34]. Thus, in this work, the catalysts were reduced at 700°C. Fig. 6 shows the desorbed NH3 (NH3 pre-adsorbed at 150 °C) as the temperature increases at a rate 10 °C/min of the NiMo/γ-Al2O3/CeO2, NiMo/γ-Al2O3/ZrO2, and NiMo/γ-Al2O3/TiO2 catalyst samples. The maximum desorption rate was between 150 and 400 °C and then gradually decreased until temperature reached 800 °C. The total acidity was established by accounting for the total amount of NH3 desorbed from the catalyst. The total acidity of each catalyst was investigated from the integration of desorbed NH3, as given by the TCD profiles. For the addition of CeO2, TiO2, and ZrO2 to the NiMo/γ-Al2O3, the NH3 desorption of different mixtures are slightly different. The amount of NH3 desorbed from NiMo/γ-Al2O3/CeO2 was the highest and that from NiMo/γ-Al2O3/TiO2 was close to that from NiMo/γ-Al2O3/ZrO2. This implies that NiMo/γ-Al2O3/CeO2 was the most acidic catalyst and the acidity of NiMo/γ-Al2O3/TiO2 is close to that of NiMo/γ-Al2O3/ZrO2. The maximum NH3-desorption temperatures are 235 °C, 243 °C, and 335 °C, for NiMo/γ-Al2O3/CeO2, NiMo/γ-Al2O3/TiO2, and NiMo/γ-Al2O3/ZrO2, respectively. The NH3 desorption peaks at temperatures of 100–250 °C, 250–400 °C and ≥400 °C correspond with the weak acid, moderate acid, and high acid strength, respectively [17]. Based on the maximum peaks at different temperatures, the NiMo/γ-Al2O3/CeO2 and NiMo/γ-Al2O3/TiO2 are considered weak acid catalysts while NiMo/γ-Al2O3/ZrO2 corresponds with moderate acid catalyst [9]. TiO2 which is well-known as a weak acid support covered the acid sites of NiMo/γ-Al2O3, therefore the NiMo/γ-Al2O3/TiO2 became weak acid catalyst. Some studies reported that a weak acid support with Lewis acid sites from TiO2 reduced coke formation or cracked products [21]. 3.2 Analysis of raw material It was found that the palm fruit cake consisted of 4.34% moisture, 85.16% volatile matter, 3.72% ash, and 6.78% fixed carbon. The C, H, N, and O in wt% were 47.53, 6.40, 1.19, and 44.88, respectively. Accordingly, the average chemical composition of palm fruit cake was CH1.62O0.71N0.02. The H/C and O/C molar ratios were equal to 1.62 and 0.71, respectively. Moreover, PFC consists of 20.8% cellulose, 16.4% hemicellulose and 19.0% lignin by weight. Its higher heating value and lower heating value were 17.02 and 15.80 MJ/kg, respectively. Thermal analysis of palm fruit cake was observed by thermogravimetric analyzer. The thermogravimetric analysis (TGA) and differential thermal analysis (DTA) profiles of palm fruit cake are shown in Fig. 7 . Weight loss in a temperature range 85–100°C was due to vaporization of moisture, which amounted to approximately 5%. The first peak of decomposition was in a temperature interval of 280–340°C, the second one 320–375°C, and the third one 380–600°C. These decomposition peaks are consistent with those of hemicellulose (220–350°C), cellulose (325–375°C), and lignin (200–700°C), as reported by Uzun et al. [37]. The pyrolysis temperature in this work was varied in a range 400–500°C due to low mass loss beyond 500°C, and the optimum pyrolysis temperature for the highest organic liquid yield was further investigated. 3.3 Products from pyrolysis of PFC Product yields from pyrolysis of PFC in a fixed-bed reactor with a heating rate of 5°C/min and final pyrolysis temperatures of 400, 450, and 500°C under N2 atmosphere are shown in Fig. 8 . Liquid product (bio-oil) was separated into two phases: aqueous phase and organic phase. At the pyrolysis temperatures of 400, 450, and 500°C, liquid product yields were 44.33, 44.71, and 41.00, respectively. The lower liquid product yield with increasing temperature was from the greater decomposition of liquid to gases. The increase in gas yield with increasing temperature was noticeable. At the pyrolysis temperatures of 400, 450, and 500°C, organic liquid product yields were 11.04, 12.46, and 11.13 wt%, respectively, and the char yields were 33.15, 31.15 and 31.13 wt%, respectively. There is an optimum pyrolysis conditions: high heating rate, short residence time, and intermediate temperature to reduce secondary reactions. As temperature increases, liquid yield decreases, however, liquid product contains two phases: aqueous phase and organic phase. Many reactions occur during pyrolysis including cracking, decarboxylation, decarbonylation, dealkylation, polymerization, water-gas shift reactions, and etc. At high temperature the water-gas shift reaction rate increases. It is possible that more water produced was used in the water-gas shift reaction with increasing temperature, resulting in a decrease in aqueous phase at high temperature. Moreover, secondary cracking occurs at high temperature and reduces organic liquid. The lower amount of organic liquid at 500 °C than that at 450 °C was observed, therefore, the optimum temperature for this experiment is at 450 °C. Jeong et al. [38] performed fast pyrolysis of palm kernel cake and the highest bio-oil yield, approximately 63 wt%, was obtained at a reaction temperature of 401 °C. We did not perform fast pyrolysis, however, it can be confirmed that fast pyrolysis produced high liquid yield. Different parts of oil palm tree produced less bio-oil. Sulaiman and Abdullah [39] performed fast pyrolysis of palm fruit bunch at 450 °C and produced the maximum bio-oil yield of 55%. The char yield decreases as the temperature increases. This could result from greater primary decomposition of biomass at a higher temperature or secondary decomposition of the char [40]. Gas yield has a tendency to increase at higher temperatures. At 400, 450, and 500°C, the gas yields were 23.51, 24.14 and 27.87%, respectively. The gas yield increased as the temperature increased due to the secondary cracking reaction of the pyrolysis vapor and the decomposition of the char. The highest liquid yield and organic phase yield were obtained at a pyrolysis temperature of 450°C. Thus, this temperature was selected as the pyrolysis temperature and used for investigation of the effect of different catalysts on pyrolysis vapor upgrading. Bio-oil from pyrolysis of palm fruit cake at 450°C was analyzed to determine its properties. Table 1 shows the elemental analysis of palm fruit cake in this study, palm kernel cake [38], palm empty fruit bunches [39], and bio-oil from pyrolysis of palm fruit cake at a temperature of 450°C. It seems that palm fruit cake in our study has the poorest properties for the lowest C content and the highest O content. The C, H, N, and O of the bio-oil produced were 68.45%, 9.43%, 1.21%, and 20.91%, respectively. It can be seen that C, H, and N of the bio-oil produced were relatively higher than those of the palm fruit cake, while O was lower after the O content was removed as CO, CO2, and H2O from the pyrolysis process. The H/C and O/C molar ratios were equal to 1.65 and 0.23, respectively. The higher heating value (32.85 MJ/kg) and lower heating value (30.79 MJ/kg) were much higher than those of PFC. The bio-oil compounds were identified by GC-MS analysis and classified based on their chemical structures and functional groups as acids, phenols, esters, aromatics, hydrocarbons, ketones, aldehydes, ethers, alcohols, or N-compounds. The main components of bio-oil are shown in Table 2 . Acids are the main components of the bio-oil. The acid yield was up to 39.21%; it causes corrosiveness and a reduction in heating value. Phenol and its derivatives were31.55%, esters 9.36%, aromatics 7.69%, hydrocarbons 6.48%, alcohols 3.01%, ketones 2.14%, N-compounds 0.29%, and ethers 0.27%. The crude bio-oil was not suitable for use as transportation fuel and needed to be improved in its properties. 3.4 Upgrading of the bio-oil Table 3 shows the product yields from catalytic pyrolysis of palm fruit cake at 450°C using different catalysts. Ni/γ-Al2O3, Mo/γ-Al2O3, and NiMo/γ-Al2O3 catalysts provided 32.11–32.84% solid, 43.93–44.80% liquid, and 22.35–23.96% gas. The liquid product was separated into two phases: aqueous phase and organic phase. Among Ni/γ-Al2O3, Mo/γ-Al2O3, and NiMo/γ-Al2O3 catalysts, Mo/γ-Al2O3 catalyst gave the highest amount of organic phase (13.22 wt%), while NiMo/γ-Al2O3 gave a slightly lower value (12.76 wt%) and the lowest one was from Ni/γ-Al2O3 (11.73 wt%). The differences in organic liquid yield using Ni/γ-Al2O3, Mo/γ-Al2O3, and NiMo/γ-Al2O3 catalysts may come from different pathways of reaction. Kubička and Kaluža [41] studied deoxygenation of vegetable oils over sulfided Ni, Mo and NiMo catalysts. The double bonds in triglycerides, the main components of vegetable oils, are at first saturated and then they are converted into fatty acids that can either (i) undergo further hydrogenation or (ii) undergo decarboxylation. Differences in reaction pathway consequently cause difference in the product distribution. They found that catalysts exhibited significantly different product distributions. Upgrading of bio-oil is quite complex and consists of many reactions. The Ni/γ-Al2O3, Mo/γ-Al2O3, and NiMo/γ-Al2O3 catalysts can undergo different reaction pathways, resulting in different organic liquid yields. Besides liquid yield, the quality of the organic liquid is also important. Acid sites measured in ammonia TPD studies were reported by Puron et al. [43] that NiMo loading resulted in a decrease in strong acidity of alumina. The increase in weak acidity upon NiMo loading might be related to the decrease in strong acidity occurred when metals covered the surface of Al2O3 and blocked acid sites and affected the cracking and hydrogenation activity. By adding CeO2, TiO2, and ZrO2 to NiMo/γ-Al2O3, the organic phase yields are in range 10.95–14.01 wt%. The highest organic phase yield was obtained from NiMo/γ-Al2O3/ZrO2 (14.01%). The increase in organic phase in the presence of ZrO2 may come from the weaker acid property of ZrO2 than that of Al2O3 (stronger bond). TPD results from the study of Lin et al. [35] showed no significant desorption for Al2O3 while ZrO2 exhibited at least three peaks. Moreover, the area of the TPD peaks of ZrO2 was greater than that of Al2O3. This means that species could be released from the ZrO2 surface more easily than from Al2O3 due to a weaker bond [35]. The additions of CeO2, TiO2 and ZrO2 facilitate NH3 desorption. The organic phase yields obtained as a decrease order: NiMo/γ-Al2O3/ZrO2 (14.01%) > NiMo/γ-Al2O3/CeO2 (12.86%) > NiMo/γ-Al2O3/TiO2 (11.69%). From Fig. 6. NH3-TPD of NiMo/γ-Al2O3/CeO2 shows highest NH3 desorbed, followed by NiMo/γ-Al2O3/TiO2, and NiMo/γ-Al2O3/ZrO2. NH3 desorption area of NiMo/γ-Al2O3/TiO2 is close to that of NiMo/γ-Al2O3/ZrO2. Based on the maximum desorption temperature, the NiMo/γ-Al2O3/CeO2 and NiMo/γ-Al2O3/TiO2 are considered weak acid catalysts and NiMo/γ-Al2O3/ZrO2 is moderate acid catalyst. The acidity of NiMo/γ-Al2O3/ZrO2 at moderate temperature (300-400 °C) promotes decomposition of the biomass at this temperature range, resulting in high organic liquid yield. NiMo/γ-Al2O3/CeO2 and NiMo/γ-Al2O3/TiO2 catalyst are both weak acid catalysts and desorbed NH3 at the same low temperature range (200-250 °C), the higher acidity of NiMo/γ-Al2O3/CeO2 may be the reason for the higher organic liquid yield than that of NiMo/γ-Al2O3/TiO2. This shows that NiMo/γ-Al2O3/ZrO2 was the best catalyst for producing the organic phase yield of bio-oil. Elemental analysis showed that Ni/γ-Al2O3 and Mo/γ-Al2O3 provided C, H, N, and O contents almost identical to those obtained without the use of catalyst. NiMo/γ-Al2O3 gave slightly higher C and lower O contents—69.79 and 19.30 wt%, respectively—as shown in Table 4 . For deoxygenation of the bio-oil without catalyst, and using Ni/γ-Al2O3, Mo/γ-Al2O3, and NiMo/γ-Al2O3 catalysts, the %DOD were in the range 53.41–57.00%. The highest %DOD was from NiMo/γ-Al2O3. Kubička and Kaluža [41] who studied deoxygenation of rapeseed oils at 260–280°C using sulfided Ni, Mo, and NiMo catalysts reported that NiMo/Al2O3 yielded a mixture of decarboxylation and hydrodeoxygenation hydrocarbon products while Ni/Al2O3 yielded only decarboxylation hydrocarbon products and Mo/Al2O3 yielded almost exclusively hydrodeoxygenation hydrocarbon products. They found that the activity of the catalyst decreased in the order sulfided NiMo/Al2O3 > sulfided Mo/Al2O3 > sulfided Ni/Al2O3. Their results are consistent with our work. In our study, NiMo/γ-Al2O3 was selected as the main catalyst as it provided high organic phase yield and the highest %DOD. NiMo/γ-Al2O3 was mixed with different metal oxides (CeO2, TiO2, and ZrO2), and the catalyst effect on yields, %DOD of the bio-oil and other properties were investigated. The elemental compositions of bio-oils upgraded by NiMo/γ-Al2O3, NiMo/γ-Al2O3/TiO2, NiMo/γ-Al2O3/ZrO2, and NiMo/γ-Al2O3/CeO2 are shown in Table 4. NiMo/γ-Al2O3 slightly improved the quality of the catalyst-free bio-oil. Most of the catalysts increased %C and decreased %O, especially NiMo/γ-Al2O3/ZrO2. %C, H, N, and O of the upgraded bio-oils were in the ranges 68.26–75.69, 9.04–10.01, 1.18–1.87, and 13.08–20.84, respectively. NiMo/γ-Al2O3/ZrO2 seems to be a good catalyst for providing organic phase of bio-oil with the highest %C (75.69), the lowest %O (13.08), and the highest HHV (36.83 MJ/kg). The effects of NiMo/γ-Al2O3 mixed with CeO2, TiO2, and ZrO2 catalysts on %DOD of the bio-oil and other properties were investigated. NiMo/γ-Al2O3, the main catalyst, provided %DOD of 57.00. However, NiMo/γ-Al2O3/metal oxides (CeO2, TiO2, and ZrO2) yielded %DOD from 58.91 to 70.86. The highest %DOD (70.86) was obtained from NiMo/γ-Al2O3/ZrO2, and the second highest one was from NiMo/γ-Al2O3/TiO2. From NH3-desorption area, the moderate acidity ZrO2 acts in synergy with NiMo/γ-Al2O3 increasing the catalyst deoxygenation activity. Compositions of liquid products from upgrading of the pyrolysis vapors by different catalysts are shown in Table 5 . Comparison of bio-oil produced using NiMo/γ-Al2O3/metal oxide (TiO2, ZrO2 and CeO2) catalysts with the crude bio-oil (without catalyst), revealed that using NiMo/γ-Al2O3/ZrO2 caused reductions of acid and phenol, and increases in ketones, esters, aromatics, and hydrocarbons. The decrease in acid (up to 37%, from 39.21to 24.58 %) and increase in ketone products indicates possible ketonization of acetic acid, in which two acetic acid molecules condense to a molecule of acetone, CO2 and H2O [42] as in Eq (3): (3) Aromatic compounds and hydrocarbons were highest in the presence of ZrO2. Compared to the crude bio-oil, the aromatics and hydrocarbons were increased by 53% (from 7.69 to 11.79 %) and 89% (from 6.48 to 12.27 %), respectively. This is consistent with the work of Grams et al. [33], in which the largest amount of aromatics was produced from Ni/ZrO2. The use of NiMo/γ-Al2O3/ZrO2 catalyst resulted in slightly increase in esters. The decrease in phenol and increase in ester were by 8% and 6%, respectively. NiMo/γ-Al2O3/TiO2 reduced acid, phenols, and esters, and increased ketones, aromatics, and hydrocarbons. However, the performance of NiMo/γ-Al2O3/TiO2 was slightly inferior to that of NiMo/γ-Al2O3/ZrO2 insofar as it gave lower reduction of phenol and lower amount of aromatics and hydrocarbons. In the work of Kaewpengkrow et al. [23], TiO2 (anatase) and Al2O3 were found to be more active than ZrO2 for increasing hydrocarbons and lowering oxygenated compounds; however, in this work, the addition of ZrO2 to NiMo/γ-Al2O3 revealed a better result than that obtained with the NiMo/γ-Al2O3/TiO2. NiMo/γ-Al2O3/CeO2 was not good at acid reduction, but it is the best for phenol reduction. So far the best chemical composition was from NiMo/γ-Al2O3/ZrO2 which gave low acids and phenols, and high aromatics and hydrocarbons in the organic phase of liquid product. 3.5 Catalyst deactivation The hydrodeoxygenation of phenol (a bio-oil model compound) occurs through a bifunctional mechanism, requiring a metallic site for hydrogenation/dehydrogenation together with an acid site of the support for dehydration [43]. In general, strong acid catalysts resulted in high cracking and high coke formation. Coke deposits were significantly affected by the hydrogenation capacity of the catalysts [44]. Puron et al. [44] found that catalyst with less hydrogenation activity but high cracking rate showed high solid yield. The amount of carbon deposited on the catalyst surface is shown in Fig. 9 . In our study coke found on Ni/γ-Al2O3, Mo/γ-Al2O3 and NiMo/γ-Al2O3 catalysts were 15, 60, and 63 wt%, respectively. Wang et al. [45] reported surface acidity from TPD of Ni/Al2O3 that showed high weak acid site and exhibited hydrogenation activity, the weak acid catalyst had low carbon deposited on the catalyst surface. Kubička and Kaluža [41] reported that Ni/Al2O3 showed decarboxylation activity, Mo/Al2O3 showed hydrodeoxygenation activity while NiMo/Al2O3 showed both decarboxylation and deoxygenation activity. This explained why low carbon deposited on the Ni/γ-Al2O3 catalyst and higher coke deposited on NiMo/γ-Al2O3 and Mo/γ-Al2O3 catalysts, moreover, NiMo/γ-Al2O3 had slightly higher carbon deposited than that on Mo/γ-Al2O3. Coke deposition on NiMo/γ-Al2O3/CeO2, NiMo/γ-Al2O3/TiO2 and NiMo/γ-Al2O3/ZrO2 were 47, 60, and 57 wt%, respectively. NiMo/γ-Al2O3/CeO2 reduced coke formation by gasification of deposited carbon promoted by CeO2 (due to a good oxygen storage capacity of CeO2) [46]. Coke deposition on NiMo/γ-Al2O3/TiO2 is close to that of NiMo/γ-Al2O3/ZrO2. NiMo/γ-Al2O3/ZrO2 has been reused once, organic liquid yield decreased from 12.99 to 11.65%, oxygen content increased from 13.70 to 20.71%, and HHV decreased from 35.77 to 32.52 MJ/kg which are close to those from pyrolysis without using catalyst as shown in Table 6 . The addition of metal oxides (CeO2, TiO2, and ZrO2) to NiMo/γ-Al2O3 successfully improved activity of the NiMo/γ-Al2O3 catalyst and lower coke formation. ZrO2 is the best metal oxide to mix with NiMo/γ-Al2O3 and CeO2 has tendency toward prolongation of catalyst lifespan due to low coke formation. 4 Conclusions The bimetal NiMo/γ-Al2O3 catalyst in reduced form shows higher activity than single metal catalyst for deoxygenation reaction. Ni acts as promoter to the Mo/γ-Al2O3 catalyst. The NiMo/γ-Al2O3 catalyst prepared by wet impregnation method, calcined at 500°C and reduced at 700°C was used as base catalyst to study effect of different metal oxides (CeO2, TiO2, and ZrO2) on deoxygenation of pyrolysis vapor from palm fruit cake which was widely available from palm oil extraction industry. In this study the catalyst mixture was prepared by hand mixing metal oxides powder to the impregnated NiMo on γ-Al2O3 support. The metal oxides have shown to significantly improve the upgrading activity of the NiMo/γ-Al2O3 catalyst in different manners. The difference in their activities was related to the strength and type of acidity of the catalyst mixture. From NH3-TPD analysis, both NiMo/γ-Al2O3/CeO2 and NiMo/γ-Al2O3/TiO2 are weak acid while NiMo/γ-Al2O3/ZrO2 is moderate acid. The area of TPD peaks of NiMo/γ-Al2O3/CeO2 was the highest, suggesting species could be released from the NiMo/γ-Al2O3/CeO2 easily while the TPD peak of NiMo/γ-Al2O3/TiO2 is close to that of NiMo/γ-Al2O3/ZrO2. ZrO2 powder acts in synergy with NiMo/γ-Al2O3 increasing the catalyst deoxygenation activity. NiMo/γ-Al2O3/ZrO2 was effective for deoxygenation reaction, acid reduction, and increasing aromatics and hydrocarbons, while NiMo/γ-Al2O3/TiO2 has slightly less activity than that of NiMo/γ-Al2O3/ZrO2. NiMo/γ-Al2O3/CeO2 was good at reductions of phenol and coke formation on the catalyst surface. Meanwhile, NiMo/γ-Al2O3/ZrO2 successfully produced liquid oil having properties and the calorific value close to those from the commercial diesel oil. Dear Editor-in-Chief I hereby submit a manuscript entitled “Deoxygenation of Pyrolysis Vapor from Palm Fruit Cake over NiMo/γ-Al2O3 Catalyst: Effect of CeO2, TiO2, and ZrO2 Additives” to be considered for publication as a research paper in Journal of Molecular Catalysis (special issue: catalytic deoxygenation for the green biofuels). To the best of my knowledge, activities of NiMo/γ-Al2O3 mixed with metal oxides (CeO2, TiO2, and ZrO2) has not been reported. Addition of CeO2 was found to reduce phenol and coke formation on catalyst surface while additions of TiO2 and ZrO2 increase aromatics and hydrocarbons. All the catalyst mixtures removed most oxygen from the crude bio-oil. I believe this finding will be of interest to the readers of your journal. I also declare that this manuscript is original and I agree that it should be submitted to the Journal of Molecular Catalysis. This manuscript has not been published yet and is not currently being considered for publication elsewhere. Hopefully, our manuscript meet your requirements and suitable for publishing. I am looking forward to hearing from you. Sincerely yours, Apinya Duangchan Declaration of Competing Interest The authors declare that we have no known competing financial interests or personal relationships that could have appeared to influence the work reported in this paper. Acknowledgements This research was granted from the Kasetsart University Research and Development Institute. The authors thank the Chaipattana Foundation at Hua Hin District, Prachuab Khirikhan Province, for palm fruit cake. Many thanks to PTT Research and Development Center at Ayutthaya Province, and the Center of Fuels and Energy at Cham Phak Pheo District, Saraburi Province, for the use of elemental analyser. References [1] H Mazaheri KT Lee S Bhatia AR. Mohamed Subcritical water liquefaction of oil palm fruit press fiber for the production of bio-oil: Effect of catalysts Bioresour. Technol. 101 2010 745 751 Mazaheri H, Lee KT, Bhatia S, Mohamed AR.Subcritical water liquefaction of oil palm fruit press fiber for the production of bio-oil: Effect of catalysts. Bioresour. Technol.2010;101:745–751. [2] L Wang F Yuan L Liu N Mominou S. Li Transformation of phenol into fuel over TiO2-CeO2/ZSM-5 aided by ultrasound and ultraviolet J. Ind. Eng. Chem. 21 2015 494 499 Wang L, Yuan F, Liu L, Mominou N, Li S.Transformation of phenol into fuel over TiO2-CeO2/ZSM-5 aided by ultrasound and ultraviolet. J. Ind. Eng. Chem.2015;21:494–499. [3] SW Kim BS Koo JW Ryu JS Lee CJ Kim DH Lee GR Kim S. Choi Bio-oil from the pyrolysis of palm and Jatropha wastes in a fluidized bed Fuel Process. Technol. 264 2013 118 124 Kim SW, Koo BS, Ryu JW, Lee JS, Kim CJ, Lee DH, Kim GR, Choi S.Bio-oil from the pyrolysis of palm and Jatropha wastes in a fluidized bed. Fuel Process. Technol.2013; 264:118–124. [4] Q Bu H Lei AH Zacher L Wang S Ren J Liang Y Wei Y Liu J Tang Q Zhang R. Ruan A review of catalytic hydrodeoxygenation of lignin-derived phenols from biomass pyrolysis Bioresour. Technol. 124 2012 470 477 Bu Q, Lei H, Zacher AH, Wang L, Ren S, Liang J, Wei Y, Liu Y, Tang J, Zhang Q, Ruan R.A review of catalytic hydrodeoxygenation of lignin-derived phenols from biomass pyrolysis. Bioresour. Technol.2012;124:470–477. [5] Z Qi C Jie W Tiejun X. Ying Review of biomass pyrolysis oil properties and upgrading research Energy Convers. Manage 48 2007 87 92 Qi Z, Jie C, Tiejun W, Ying X.Review of biomass pyrolysis oil properties and upgrading research. Energy Convers. Manage2007;48:87–92. [6] S Xiu A. Shahbazi Bio-oil production and upgrading research: A review Renewable Sustain. Energy Rev. 16 2012 4406 4414 Xiu S, Shahbazi A.Bio-oil production and upgrading research: A review. Renewable Sustain. Energy Rev.2012;16:4406–4414. [7] TS Kim S Oh JY Kim IG Choi JW. Choi Study on the hydrodeoxygenative upgrading of crude bio-oil produced from woody biomass by fast pyrolysis Energy 68 2014 437 443 Kim TS, Oh S, Kim JY, Choi IG, Choi JW.Study on the hydrodeoxygenative upgrading of crude bio-oil produced from woody biomass by fast pyrolysis. Energy2014;68:437–443. [8] X Zhang Q Zhang T Wang B Li Y Xu L. Ma Efficient upgrading process for production of low quality fuel from bio-oil Fuel 179 2016 312 321 Zhang X, Zhang Q, Wang T, Li B, Xu Y, Ma L.Efficient upgrading process for production of low quality fuel from bio-oil. Fuel2016;179:312–321. [9] CC Templis CJ Revelas AA Papastylianou NG. Papayannakos Phenol hydrodeoxygenation over a reduced and sulfide NiMo/γ-Al2O3 catalyst Ind. Eng. Chem. Res. 58 2019 6278 6287 Templis CC, Revelas CJ, Papastylianou AA, Papayannakos NG.Phenol Hydrodeoxygenation over a reduced and sulfide NiMo/γ-Al2O3 catalyst. Ind. Eng. Chem. Res.2019;58:6278–6287. [10] L Qu R. Prins Hydrogenation of cyclohexene over in situ fluorinated NiMoS catalysts supported on alumina and silica–alumina J. Catal. 207 2002 86 295 Qu L, Prins R.Hydrogenation of cyclohexene over in situ fluorinated NiMoS catalysts supported on alumina and silica–alumina. J. Catal.2002;207:86–295. [11] K Kohli R Prajapati SK Maity BK. Sharma Effect of silica, activated carbon, and alumina supports on NiMo catalysts for residue upgrading Energies 13 2020 1 16 Kohli, K, Prajapati R, Maity SK, Sharma BK.Effect of silica, activated carbon, and alumina supports on NiMo catalysts for residue upgrading. Energies2020;13:1–16. [12] I Gandarias V Barrio J Requies P Arias J Cambra M. Guemez From biomass to fuels: Hydrotreating of oxygenated compounds Int. J. Hydrog. Energy 33 2008 3485 3488 Gandarias I, Barrio V, Requies J, Arias P, Cambra J, Guemez M.From biomass to fuels: Hydrotreating of oxygenated compounds. Int. J. Hydrog. Energy2008;33:3485–3488. [13] Platanitis P, Panagiotou GD, Bourikas K, Kodulis Ch, Lycourghiotis A. Hydrodeoxygenation of phenol over hydrotreatment catalysts in their reduced and sulfided states 2014;7:18–25. [14] CF Yan FF Cheng RR. Hu Hydrogen production from catalytic steam reforming of bio-oil aqueous fraction over Ni/CeO2-ZrO2 catalysts Int. J. Hydrog. Energy 35 21 2010 11693 11699 Yan CF, Cheng FF, Hu RR.Hydrogen production from catalytic steam reforming of bio-oil aqueous fraction over Ni/CeO2-ZrO2 catalysts. Int. J. Hydrog. Energy2010;35(21):11693–11699. [15] V Han-u-domlarpyos P Kuchonthara P Reubroycharoen N. Hinchiranan Quality improvement of oil palm shell-derived pyrolysis oil via catalytic deoxygenation over NiMoS/γ-Al2O3 Fuel 143 2015 512 518 Han-u-domlarpyos V, Kuchonthara P, Reubroycharoen P, Hinchiranan N.Quality improvement of oil palm shell-derived pyrolysis oil via catalytic deoxygenation over NiMoS/γ-Al2O3. Fuel2015;143:512–518. [16] D Kubička L. Kaluža Deoxygenation of vegetable oils over sulfided Ni, Mo and NiMo catalysts Appl. Catal. A 372 2010 199 208 Kubička D, Kaluža L.Deoxygenation of vegetable oils over sulfided Ni, Mo and NiMo catalysts. Appl. Catal. A2010;372:199–208. [17] S Zulkepli JC Juan HV Lee NS Abd Rahman Show PL, Ng EP. Modified mesoporous HMS supported Ni for deoxygenation of triolein into hydrocarbon-biofuel production Energy Convers. Manage. 165 2018 495 508 Zulkepli S, Juan JC, Lee HV, Abd Rahman NS, Show PL, Ng EP. Modified mesoporous HMS supported Ni for deoxygenation of triolein into hydrocarbon-biofuel production. Energy Convers. Manage.2018;165:495–508. [18] H Kondoh K Tanaka Y Nakasaka T Tago T. Masuda Catalytic cracking of heavy oil over TiO2-ZrO2 catalysts under superheated steam conditions Fuel 167 2016 288 294 Kondoh H, Tanaka K, Nakasaka Y, Tago T, Masuda T.Catalytic cracking of heavy oil over TiO2-ZrO2 catalysts under superheated steam conditions. Fuel2016;167:288–294. [19] OZ Tajrishi M Taghizadeh AD. Kiadehi Methanol steam reforming in a microchannel reactor by Zn-, Ce- and Zr- modified mesoporous Cu/SBA-15 nanocatalyst Int. J. Hydrog. Energy 43 2018 14103 14120 Tajrishi, OZ, Taghizadeh M, Kiadehi AD.Methanol steam reforming in a microchannel reactor by Zn-, Ce- and Zr- modified mesoporous Cu/SBA-15 nanocatalyst. Int. J. Hydrog. Energy2018;43:14103–14120. [20] S Velu MP Kapoor S Inagaki K. Suzuki Vapors phase hydrogenation of phenol over palladium supported on mesoporous CeO2 and ZrO2 Appl. Catal. A 245 2003 317 331 Velu S, Kapoor MP, Inagaki S, Suzuki K.Vapors phase hydrogenation of phenol over palladium supported on mesoporous CeO2 and ZrO2. Appl. Catal. A2003;245:317–331. [21] LE Oi MY Choo HV Lee HC Ong SB Abd Hamid JC Juan Recent advances of titanium dioxide (TiO2) for green organic synthesis RSC Adv. 6 2016 108741 108754 Oi LE, Choo MY, Lee HV, Ong HC, Abd Hamid SB, Juan JC. Recent advances of titanium dioxide (TiO2) for green organic synthesis. RSC Adv.2016;6:108741–108754. [22] VA Yakovlev SA Khromova OV Sherstyuk VO Dundich DY Ermakov VM Novopashina MY Lebedev O Bulavchenko VN. Parmon Development of new catalytic systems for upgraded bio-fuels production from bio-crude-oil and biodiesel Catal. Today 144 2009 362 366 Yakovlev VA, Khromova SA, Sherstyuk OV, Dundich VO, Ermakov DY, Novopashina VM, Lebedev MY, Bulavchenko O, Parmon VN.Development of new catalytic systems for upgraded bio-fuels production from bio-crude-oil and biodiesel. Catal. Today2009;144:362–366. [23] P Kaewpengkrow D Atong V. Sricharoenchaikul Catalytic upgrading of pyrolysis vapors from Jatropha wastes using alumina, zirconia and titania based catalysts Bioresour. Technol. 163 2014 262 269 Kaewpengkrow P, Atong D, Sricharoenchaikul V.Catalytic upgrading of pyrolysis vapors from Jatropha wastes using alumina, zirconia and titania based catalysts. Bioresour. Technol.2014;163:262–269. [24] Q Lu Z Zhang X Wang C Dong Y. Liu Catalytic upgrading of biomass fast pyrolysis vapors ordered mesoporous ZrO2, TiO2 and SiO2 Energy Procedia 61 2014 1937 1941 Lu Q, Zhang Z, Wang X, Dong C, Liu Y.Catalytic upgrading of biomass fast pyrolysis vapors ordered mesoporous ZrO2, TiO2 and SiO2. Energy Procedia2014;61:1937–1941. [25] Q Lu Y Zhang Z Tang W-Z Li X-F. Zhu Catalytic upgrading of biomass fast pyrolysis vapors with titania and zirconia/titania based catalysts Fuel 89 2010 2096 2103 Lu Q, Zhang Y, Tang Z, Li W-Z, Zhu X-F.Catalytic upgrading of biomass fast pyrolysis vapors with titania and zirconia/titania based catalysts. Fuel2010;89:2096–2103. [26] H Chen Y Wu S Qi Y Chen M. Yang Deoxygenation of octanoic acid catalyzed by hollow spherical Ni/ZrO2 Appl. Catal. A 529 2017 79 90 Chen H, Wu Y, Qi S, Chen Y, Yang M.Deoxygenation of octanoic acid catalyzed by hollow spherical Ni/ZrO2. Appl. Catal. A2017;529:79–90. [27] IH Choi JS Lee CU Kim TW Kim KY. Lee Production of bio-jet fuel range alkanes from catalytic deoxygenation of Jatropha fatty acids on a WOx/Pt/TiO2 catalyst Fuel 215 2018 675 685 Choi IH, Lee JS, Kim CU, Kim TW, Lee KY.Production of bio-jet fuel range alkanes from catalytic deoxygenation of Jatropha fatty acids on a WOx/Pt/TiO2 catalyst. Fuel2018;215:675–685. [28] YL Lee A Mnoyan HS Na SY Ahn KJ Kim JO Shim K Lee HS. Roh Comparison of the effects of the catalyst preparation method and CeO2 morphology on the catalytic activity of Pt/CeO2 catalysts for the water–gas shift reaction Catal. Sci. Technol. 18 2020 6299 6308 Lee YL, Mnoyan A, Na HS, Ahn SY, Kim KJ, Shim JO, Lee K, Roh HS.Comparison of the effects of the catalyst preparation method and CeO2 morphology on the catalytic activity of Pt/CeO2 catalysts for the water–gas shift reaction. Catal. Sci. Technol. 2020;18:6299–6308. [29] A Gurbani JL Ayastuy MP Gonza´lez-Marcos JE Herrero JM Guil MA. Gutie´rrez-Ortiz Comparative study of CuO–CeO2 catalysts prepared by wet impregnation and deposition–precipitation Int. J. Hydrogen Energy 34 2009 547 553 Gurbani A, Ayastuy JL, Gonza´lez-Marcos MP, Herrero JE, Guil JM, Gutie´rrez-Ortiz MA.Comparative study of CuO–CeO2 catalysts prepared by wet impregnation and deposition–precipitation. Int. J. Hydrogen Energy2009;34:547–553. [30] M Sharifi M Haghighi F Rahmani S. Karimipour Syngas production via dry reforming of CH4 over Co- and Cu-promoted Ni/Al2O3–ZrO2 nanocatalysts synthesized via sequential impregnation and sol–gel methods J. Natur. Gas Sci. Eng. 21 2014 993 1004 Sharifi M, Haghighi M, Rahmani F, Karimipour S.Syngas production via dry reforming of CH4 over Co- and Cu-promoted Ni/Al2O3–ZrO2 nanocatalysts synthesized via sequential impregnation and sol–gel methods. J. Natur. Gas Sci. Eng. 2014;21:993–1004. [31] M Cai J Wen W Chu X Cheng Z. Li Methanation of carbon dioxide on Ni/ZrO2-Al2O3 catalysts: Effects of ZrO2 promoter and preparation method of novel ZrO2-Al2O3 carrier J. Nat. Gas Chem. 20 2011 318 324 Cai M, Wen J, Chu W, Cheng X, Li Z.Methanation of carbon dioxide on Ni/ZrO2-Al2O3 catalysts: Effects of ZrO2 promoter and preparation method of novel ZrO2-Al2O3 carrier. J. Nat. Gas Chem.2011;20:318–324. [32] VV Thyssen TA Maia EM. Assaf Ni supported on La2O3–SiO2 used to catalyze glycerol steam reforming Fuel 105 2013 358 363 Thyssen VV, Maia TA, Assaf EM.Ni supported on La2O3–SiO2 used to catalyze glycerol steam reforming. Fuel2013;105:358–363. [33] J Grams M Niewiadomski AM. Ruppert Catalytic performance of a Ni catalyst supported on CeO2, ZrO2 and CeO2-ZrO2 in the upgrading of cellulose fast pyrolysis vapors C. R. Chim. 18 2015 1223 1228 Grams J, Niewiadomski M, Ruppert AM.Catalytic performance of a Ni catalyst supported on CeO2, ZrO2 and CeO2-ZrO2 in the upgrading of cellulose fast pyrolysis vapors. C. R. Chim.2015;18:1223–1228. [34] S Karnjanakom A Bayu X Hao S Kongparakul C Samart A Abudula G. Guan Selectively catalytic upgrading of bio-oil to aromatic hydrocarbons over Zn, Ce, or Ni-doped mesoporous rod-like alumina catalysts J. Mol. Catal. A Chem. 421 2016 235 244 Karnjanakom S, Bayu A, Hao X, Kongparakul S, Samart C, Abudula A, Guan G.Selectively catalytic upgrading of bio-oil to aromatic hydrocarbons over Zn, Ce, or Ni-doped mesoporous rod-like alumina catalysts. J. Mol. Catal. A Chem.2016;421:235–244. [35] Y-C Lin C-L Li H-P Wan H-T Lee C-F Liu Catalytic hydrodeoxygenation of guaiacol on Rh-based and sulfided CoMo and NiMo catalysts Energy Fuel 25 2011 890 896 Lin Y-C, Li C-L, Wan H-P, Lee H-T, Liu C-F. Catalytic hydrodeoxygenation of guaiacol on Rh-based and sulfided CoMo and NiMo catalysts. Energy Fuel2011;25:890–896. [36] K Anas KKM. Yusuff Synthesis, characterization and hydrodesulphurization activity of CoMo/γ-Al2O3 catalyst prepared through molecular designed dispersion method Appl. Catal. A 264 2004 213 217 Anas K, Yusuff KKM.Synthesis, characterization and hydrodesulphurization activity of CoMo/γ-Al2O3 catalyst prepared through molecular designed dispersion method. Appl. Catal. A2004;264:213–217. [37] BB Uzun AE Putun E. Putun Composition of products obtained via fast pyrolysis of olive-oil residue: effect of pyrolysis temperature J. Anal. Appl. Pyrol. 79 2007 325 340 Uzun BB, Putun AE, Putun E.Composition of products obtained via fast pyrolysis of olived-oil residue: effect of pyrolysis temperature. J. Anal. Appl. Pyrol. 2007;79:325–340. [38] JY Jeong CW Yang UD Lee SW. Jeong Characteristics of the pyrolytic products from the fast pyrolysis of palm kernel cake in a bench-scale fluidized bed reactor Anal. Appl. Pyrol. 145 2019 104708 Jeong JY, Yang CW, Lee UD, Jeong SW.Characteristics of the pyrolytic products from the fast pyrolysis of palm kernel cake in a bench-scale fluidized bed reactor. Anal. Appl. Pyrol.2019;145:104708. [39] F Sulaiman N Abdullah Optimum conditions for maximising pyrolysis liquids of oil palm empty fruit bunches Energy 36 2011 2352 2359 Sulaiman, F, Abdullah N. Optimum conditions for maximising pyrolysis liquids of oil palm empty fruit bunches. Energy2011;36:2352–2359. [40] PA Horne PT. Williams Influence of temperature on the products from the flash pyrolysis of biomass Fuel 75 1996 1051 1059 Horne PA, Williams PT.Influence of temperature on the products from the flash pyrolysis of biomass. Fuel1996;75:1051–1059. [41] D Kubička L. Kaluža Deoxygenation of vegetable oils over sulfided Ni, Mo and NiMo catalysts Appl. Catal. A 372 2010 199 208 Kubička D, Kaluža L.Deoxygenation of vegetable oils over sulfided Ni, Mo and NiMo catalysts. Appl. Catal. A2010;372:199–208. [42] SH Hakim BH Shanks JA. Dumesic Catalytic upgrading of the light fraction of a simulated bio-oil over CeZrOx catalyst Appl. Catal. B 142–143 2013 368 376 Hakim SH, Shanks BH, Dumesic JA.Catalytic upgrading of the light fraction of a simulated bio-oil over CeZrOx catalyst. Appl. Catal. B2013;142–143:368–376. [43] CA Teles RC Rabelo-Neto G Jacobs BH Davis DE Resasco FB. Noronha Hydrodeoxygenation of phenol over zirconia-supported catalysts: The effects of metal type on reaction mechanism and catalyst deactivation ChemCatChem 9 2017 2850 2863 Teles CA, Rabelo-Neto RC, Jacobs G, Davis BH, Resasco DE, Noronha FB.Hydrodeoxygenation of phenol over zirconia-supported catalysts: The effects of metal type on reaction mechanism and catalyst deactivation. ChemCatChem2017;9:2850–2863. [44] H Puron JL Pinilla Fuente J Ascención Montoya de la MG Millan Effect of metal loading in NiMo/Al2O3 catalysts on maya vacuum residue hydrocracking Energy & Fuels Energy Fuels 31 2017 4843 4850 Puron H, Pinilla JL, Ascención Montoya de la Fuente J, Millan MG. Effect of metal loading in NiMo/Al2O3 catalysts on maya vacuum residue hydrocracking. Energy & Fuels Energy Fuels2017;31:4843–4850. [45] Y Wang M Craven X Yu J Ding P Bryant J Huang X Tu Plasma-enhanced catalytic synthesis of ammonia over a Ni/Al2O3 catalyst at near-room temperature: Insights into the importance of the catalyst surface on the reaction mechanism ACS Catal 9 2019 10780 10893 Wang Y, Craven M, Yu X, Ding J, Bryant P, Huang J, Tu X, Plasma-enhanced catalytic synthesis of ammonia over a Ni/Al2O3 catalyst at near-room temperature: Insights into the importance of the catalyst surface on the reaction mechanism, ACS Catal 9 (2019) 10780–10893. [46] A Veses M Aznar JM López MS Callén R Murillo T. Garćia Production of upgrading bio-oils by biomass catalytic pyrolysis in an auger reactor using low cost materials Fuel 141 2015 17 22 Veses A, Aznar M, López JM, Callén MS, Murillo R, Garćia T.Production of upgrading bio-oils by biomass catalytic pyrolysis in an auger reactor using low cost materials. Fuel2015;141:17–22.",
      "scopus-id": "85109622466",
      "coredata": {
        "eid": "1-s2.0-S2468823121003291",
        "dc:description": "Deoxygenation of pyrolysis vapor from palm fruit cake by different catalysts was prior investigated by using Ni/γ-Al2O3, Mo/γ-Al2O3, and NiMo/γ-Al2O3 prepared by wet impregnation method. NiMo/γ-Al2O3 showing the highest degree of deoxygenation (%DOD) activity was subsequently mixed with metal oxides: CeO2, TiO2, and ZrO2. Effects of the catalysts on upgrading of pyrolysis vapor from palm fruit cake at 450°C under N2 atmosphere in a semi-batch process were investigated. The oil products were analyzed for CHNO elements by elemental analyzer, chemical compositions by a gas chromatograph coupled to a mass spectrometer (GC-MS), and higher heating values (HHV) by Dulong's equation. Catalysts have been characterized and discussed related to the product yields and properties. Acidity and acid strength of the catalyst mixture play an important role on the products. NiMo/γ-Al2O3 improved properties of the crude bio-oil by increasing organic phase yield, %DOD, and HHV. Addition of CeO2 to NiMo/γ-Al2O3 reduced phenol compound in the liquid products while addition of TiO2 to NiMo/γ-Al2O3 provided high aromatics and hydrocarbons comparable to those obtained from NiMo/γ-Al2O3/ZrO2. Addition of ZrO2 to NiMo/γ-Al2O3 exhibited the highest organic phase yield (%), %DOD (71%), and HHV (37 MJ/kg).",
        "openArchiveArticle": "false",
        "prism:coverDate": "2022-05-31",
        "openaccessUserLicense": null,
        "prism:aggregationType": "Journal",
        "prism:url": "https://api.elsevier.com/content/article/pii/S2468823121003291",
        "dc:creator": [
          {
            "@_fa": "true",
            "$": "Moonsrikaew, Worada"
          },
          {
            "@_fa": "true",
            "$": "Duangchan, Apinya"
          }
        ],
        "link": [
          {
            "@_fa": "true",
            "@rel": "self",
            "@href": "https://api.elsevier.com/content/article/pii/S2468823121003291"
          },
          {
            "@_fa": "true",
            "@rel": "scidir",
            "@href": "https://www.sciencedirect.com/science/article/pii/S2468823121003291"
          }
        ],
        "dc:format": "application/json",
        "openaccessType": null,
        "pii": "S2468-8231(21)00329-1",
        "prism:volume": "523",
        "articleNumber": "111712",
        "prism:publisher": "Elsevier B.V.",
        "dc:title": "Deoxygenation of pyrolysis vapor from palm fruit cake over NiMo/γ-Al2O3 catalyst: Effect of CeO2, TiO2, and ZrO2 additives",
        "prism:copyright": "© 2021 Elsevier B.V. All rights reserved.",
        "openaccess": "0",
        "prism:issn": "24688231",
        "dcterms:subject": [
          {
            "@_fa": "true",
            "$": "Deoxygenation"
          },
          {
            "@_fa": "true",
            "$": "Palm fruit cake"
          },
          {
            "@_fa": "true",
            "$": "Alumina"
          },
          {
            "@_fa": "true",
            "$": "Nickel"
          },
          {
            "@_fa": "true",
            "$": "Molybdenum"
          },
          {
            "@_fa": "true",
            "$": "Metal"
          },
          {
            "@_fa": "true",
            "$": "Oxides"
          }
        ],
        "openaccessArticle": "false",
        "prism:publicationName": "Molecular Catalysis",
        "openaccessSponsorType": null,
        "prism:pageRange": "111712",
        "pubType": "fla",
        "prism:coverDisplayDate": "May 2022",
        "prism:doi": "10.1016/j.mcat.2021.111712",
        "prism:startingPage": "111712",
        "dc:identifier": "doi:10.1016/j.mcat.2021.111712",
        "openaccessSponsorName": null
      },
      "objects": {
        "object": [
          {
            "@category": "standard",
            "@height": "48",
            "@width": "471",
            "@_fa": "true",
            "$": "https://api.elsevier.com/content/object/eid/1-s2.0-S2468823121003291-fx2.jpg?httpAccept=%2A%2F%2A",
            "@multimediatype": "JPEG image file",
            "@type": "IMAGE-DOWNSAMPLED",
            "@size": "4220",
            "@ref": "fx2",
            "@mimetype": "image/jpeg"
          },
          {
            "@category": "standard",
            "@height": "11",
            "@width": "55",
            "@_fa": "true",
            "$": "https://api.elsevier.com/content/object/eid/1-s2.0-S2468823121003291-fx1.jpg?httpAccept=%2A%2F%2A",
            "@multimediatype": "JPEG image file",
            "@type": "IMAGE-DOWNSAMPLED",
            "@size": "886",
            "@ref": "fx1",
            "@mimetype": "image/jpeg"
          },
          {
            "@category": "standard",
            "@height": "295",
            "@width": "339",
            "@_fa": "true",
            "$": "https://api.elsevier.com/content/object/eid/1-s2.0-S2468823121003291-gr9.jpg?httpAccept=%2A%2F%2A",
            "@multimediatype": "JPEG image file",
            "@type": "IMAGE-DOWNSAMPLED",
            "@size": "23886",
            "@ref": "gr9",
            "@mimetype": "image/jpeg"
          },
          {
            "@category": "standard",
            "@height": "355",
            "@width": "565",
            "@_fa": "true",
            "$": "https://api.elsevier.com/content/object/eid/1-s2.0-S2468823121003291-gr8.jpg?httpAccept=%2A%2F%2A",
            "@multimediatype": "JPEG image file",
            "@type": "IMAGE-DOWNSAMPLED",
            "@size": "81484",
            "@ref": "gr8",
            "@mimetype": "image/jpeg"
          },
          {
            "@category": "standard",
            "@height": "304",
            "@width": "565",
            "@_fa": "true",
            "$": "https://api.elsevier.com/content/object/eid/1-s2.0-S2468823121003291-gr7.jpg?httpAccept=%2A%2F%2A",
            "@multimediatype": "JPEG image file",
            "@type": "IMAGE-DOWNSAMPLED",
            "@size": "25598",
            "@ref": "gr7",
            "@mimetype": "image/jpeg"
          },
          {
            "@category": "standard",
            "@height": "369",
            "@width": "564",
            "@_fa": "true",
            "$": "https://api.elsevier.com/content/object/eid/1-s2.0-S2468823121003291-gr6.jpg?httpAccept=%2A%2F%2A",
            "@multimediatype": "JPEG image file",
            "@type": "IMAGE-DOWNSAMPLED",
            "@size": "36062",
            "@ref": "gr6",
            "@mimetype": "image/jpeg"
          },
          {
            "@category": "standard",
            "@height": "272",
            "@width": "376",
            "@_fa": "true",
            "$": "https://api.elsevier.com/content/object/eid/1-s2.0-S2468823121003291-gr5.jpg?httpAccept=%2A%2F%2A",
            "@multimediatype": "JPEG image file",
            "@type": "IMAGE-DOWNSAMPLED",
            "@size": "16389",
            "@ref": "gr5",
            "@mimetype": "image/jpeg"
          },
          {
            "@category": "standard",
            "@height": "361",
            "@width": "583",
            "@_fa": "true",
            "$": "https://api.elsevier.com/content/object/eid/1-s2.0-S2468823121003291-gr4.jpg?httpAccept=%2A%2F%2A",
            "@multimediatype": "JPEG image file",
            "@type": "IMAGE-DOWNSAMPLED",
            "@size": "35041",
            "@ref": "gr4",
            "@mimetype": "image/jpeg"
          },
          {
            "@category": "standard",
            "@height": "474",
            "@width": "564",
            "@_fa": "true",
            "$": "https://api.elsevier.com/content/object/eid/1-s2.0-S2468823121003291-gr3.jpg?httpAccept=%2A%2F%2A",
            "@multimediatype": "JPEG image file",
            "@type": "IMAGE-DOWNSAMPLED",
            "@size": "134181",
            "@ref": "gr3",
            "@mimetype": "image/jpeg"
          },
          {
            "@category": "standard",
            "@height": "258",
            "@width": "564",
            "@_fa": "true",
            "$": "https://api.elsevier.com/content/object/eid/1-s2.0-S2468823121003291-gr2.jpg?httpAccept=%2A%2F%2A",
            "@multimediatype": "JPEG image file",
            "@type": "IMAGE-DOWNSAMPLED",
            "@size": "51660",
            "@ref": "gr2",
            "@mimetype": "image/jpeg"
          },
          {
            "@category": "standard",
            "@height": "149",
            "@width": "301",
            "@_fa": "true",
            "$": "https://api.elsevier.com/content/object/eid/1-s2.0-S2468823121003291-ga1.jpg?httpAccept=%2A%2F%2A",
            "@multimediatype": "JPEG image file",
            "@type": "IMAGE-DOWNSAMPLED",
            "@size": "18594",
            "@ref": "ga1",
            "@mimetype": "image/jpeg"
          },
          {
            "@category": "standard",
            "@height": "235",
            "@width": "341",
            "@_fa": "true",
            "$": "https://api.elsevier.com/content/object/eid/1-s2.0-S2468823121003291-gr1.jpg?httpAccept=%2A%2F%2A",
            "@multimediatype": "JPEG image file",
            "@type": "IMAGE-DOWNSAMPLED",
            "@size": "18896",
            "@ref": "gr1",
            "@mimetype": "image/jpeg"
          },
          {
            "@category": "thumbnail",
            "@height": "22",
            "@width": "219",
            "@_fa": "true",
            "$": "https://api.elsevier.com/content/object/eid/1-s2.0-S2468823121003291-fx2.sml?httpAccept=%2A%2F%2A",
            "@multimediatype": "GIF image file",
            "@type": "IMAGE-THUMBNAIL",
            "@size": "1583",
            "@ref": "fx2",
            "@mimetype": "image/gif"
          },
          {
            "@category": "thumbnail",
            "@height": "46",
            "@width": "219",
            "@_fa": "true",
            "$": "https://api.elsevier.com/content/object/eid/1-s2.0-S2468823121003291-fx1.sml?httpAccept=%2A%2F%2A",
            "@multimediatype": "GIF image file",
            "@type": "IMAGE-THUMBNAIL",
            "@size": "3714",
            "@ref": "fx1",
            "@mimetype": "image/gif"
          },
          {
            "@category": "thumbnail",
            "@height": "164",
            "@width": "188",
            "@_fa": "true",
            "$": "https://api.elsevier.com/content/object/eid/1-s2.0-S2468823121003291-gr9.sml?httpAccept=%2A%2F%2A",
            "@multimediatype": "GIF image file",
            "@type": "IMAGE-THUMBNAIL",
            "@size": "7542",
            "@ref": "gr9",
            "@mimetype": "image/gif"
          },
          {
            "@category": "thumbnail",
            "@height": "137",
            "@width": "219",
            "@_fa": "true",
            "$": "https://api.elsevier.com/content/object/eid/1-s2.0-S2468823121003291-gr8.sml?httpAccept=%2A%2F%2A",
            "@multimediatype": "GIF image file",
            "@type": "IMAGE-THUMBNAIL",
            "@size": "14757",
            "@ref": "gr8",
            "@mimetype": "image/gif"
          },
          {
            "@category": "thumbnail",
            "@height": "118",
            "@width": "219",
            "@_fa": "true",
            "$": "https://api.elsevier.com/content/object/eid/1-s2.0-S2468823121003291-gr7.sml?httpAccept=%2A%2F%2A",
            "@multimediatype": "GIF image file",
            "@type": "IMAGE-THUMBNAIL",
            "@size": "7149",
            "@ref": "gr7",
            "@mimetype": "image/gif"
          },
          {
            "@category": "thumbnail",
            "@height": "143",
            "@width": "219",
            "@_fa": "true",
            "$": "https://api.elsevier.com/content/object/eid/1-s2.0-S2468823121003291-gr6.sml?httpAccept=%2A%2F%2A",
            "@multimediatype": "GIF image file",
            "@type": "IMAGE-THUMBNAIL",
            "@size": "10760",
            "@ref": "gr6",
            "@mimetype": "image/gif"
          },
          {
            "@category": "thumbnail",
            "@height": "159",
            "@width": "219",
            "@_fa": "true",
            "$": "https://api.elsevier.com/content/object/eid/1-s2.0-S2468823121003291-gr5.sml?httpAccept=%2A%2F%2A",
            "@multimediatype": "GIF image file",
            "@type": "IMAGE-THUMBNAIL",
            "@size": "5238",
            "@ref": "gr5",
            "@mimetype": "image/gif"
          },
          {
            "@category": "thumbnail",
            "@height": "136",
            "@width": "219",
            "@_fa": "true",
            "$": "https://api.elsevier.com/content/object/eid/1-s2.0-S2468823121003291-gr4.sml?httpAccept=%2A%2F%2A",
            "@multimediatype": "GIF image file",
            "@type": "IMAGE-THUMBNAIL",
            "@size": "6091",
            "@ref": "gr4",
            "@mimetype": "image/gif"
          },
          {
            "@category": "thumbnail",
            "@height": "164",
            "@width": "195",
            "@_fa": "true",
            "$": "https://api.elsevier.com/content/object/eid/1-s2.0-S2468823121003291-gr3.sml?httpAccept=%2A%2F%2A",
            "@multimediatype": "GIF image file",
            "@type": "IMAGE-THUMBNAIL",
            "@size": "29114",
            "@ref": "gr3",
            "@mimetype": "image/gif"
          },
          {
            "@category": "thumbnail",
            "@height": "100",
            "@width": "219",
            "@_fa": "true",
            "$": "https://api.elsevier.com/content/object/eid/1-s2.0-S2468823121003291-gr2.sml?httpAccept=%2A%2F%2A",
            "@multimediatype": "GIF image file",
            "@type": "IMAGE-THUMBNAIL",
            "@size": "19491",
            "@ref": "gr2",
            "@mimetype": "image/gif"
          },
          {
            "@category": "thumbnail",
            "@height": "109",
            "@width": "219",
            "@_fa": "true",
            "$": "https://api.elsevier.com/content/object/eid/1-s2.0-S2468823121003291-ga1.sml?httpAccept=%2A%2F%2A",
            "@multimediatype": "GIF image file",
            "@type": "IMAGE-THUMBNAIL",
            "@size": "12950",
            "@ref": "ga1",
            "@mimetype": "image/gif"
          },
          {
            "@category": "thumbnail",
            "@height": "151",
            "@width": "219",
            "@_fa": "true",
            "$": "https://api.elsevier.com/content/object/eid/1-s2.0-S2468823121003291-gr1.sml?httpAccept=%2A%2F%2A",
            "@multimediatype": "GIF image file",
            "@type": "IMAGE-THUMBNAIL",
            "@size": "11397",
            "@ref": "gr1",
            "@mimetype": "image/gif"
          },
          {
            "@category": "high",
            "@height": "256",
            "@width": "2503",
            "@_fa": "true",
            "$": "https://api.elsevier.com/content/object/eid/1-s2.0-S2468823121003291-fx2_lrg.jpg?httpAccept=%2A%2F%2A",
            "@multimediatype": "JPEG image file",
            "@type": "IMAGE-HIGH-RES",
            "@size": "35025",
            "@ref": "fx2",
            "@mimetype": "image/jpeg"
          },
          {
            "@category": "high",
            "@height": "61",
            "@width": "293",
            "@_fa": "true",
            "$": "https://api.elsevier.com/content/object/eid/1-s2.0-S2468823121003291-fx1_lrg.jpg?httpAccept=%2A%2F%2A",
            "@multimediatype": "JPEG image file",
            "@type": "IMAGE-HIGH-RES",
            "@size": "6204",
            "@ref": "fx1",
            "@mimetype": "image/jpeg"
          },
          {
            "@category": "high",
            "@height": "1307",
            "@width": "1500",
            "@_fa": "true",
            "$": "https://api.elsevier.com/content/object/eid/1-s2.0-S2468823121003291-gr9_lrg.jpg?httpAccept=%2A%2F%2A",
            "@multimediatype": "JPEG image file",
            "@type": "IMAGE-HIGH-RES",
            "@size": "274082",
            "@ref": "gr9",
            "@mimetype": "image/jpeg"
          },
          {
            "@category": "high",
            "@height": "1569",
            "@width": "2500",
            "@_fa": "true",
            "$": "https://api.elsevier.com/content/object/eid/1-s2.0-S2468823121003291-gr8_lrg.jpg?httpAccept=%2A%2F%2A",
            "@multimediatype": "JPEG image file",
            "@type": "IMAGE-HIGH-RES",
            "@size": "1043835",
            "@ref": "gr8",
            "@mimetype": "image/jpeg"
          },
          {
            "@category": "high",
            "@height": "1347",
            "@width": "2501",
            "@_fa": "true",
            "$": "https://api.elsevier.com/content/object/eid/1-s2.0-S2468823121003291-gr7_lrg.jpg?httpAccept=%2A%2F%2A",
            "@multimediatype": "JPEG image file",
            "@type": "IMAGE-HIGH-RES",
            "@size": "209630",
            "@ref": "gr7",
            "@mimetype": "image/jpeg"
          },
          {
            "@category": "high",
            "@height": "1636",
            "@width": "2499",
            "@_fa": "true",
            "$": "https://api.elsevier.com/content/object/eid/1-s2.0-S2468823121003291-gr6_lrg.jpg?httpAccept=%2A%2F%2A",
            "@multimediatype": "JPEG image file",
            "@type": "IMAGE-HIGH-RES",
            "@size": "302429",
            "@ref": "gr6",
            "@mimetype": "image/jpeg"
          },
          {
            "@category": "high",
            "@height": "1448",
            "@width": "2000",
            "@_fa": "true",
            "$": "https://api.elsevier.com/content/object/eid/1-s2.0-S2468823121003291-gr5_lrg.jpg?httpAccept=%2A%2F%2A",
            "@multimediatype": "JPEG image file",
            "@type": "IMAGE-HIGH-RES",
            "@size": "164326",
            "@ref": "gr5",
            "@mimetype": "image/jpeg"
          },
          {
            "@category": "high",
            "@height": "1601",
            "@width": "2583",
            "@_fa": "true",
            "$": "https://api.elsevier.com/content/object/eid/1-s2.0-S2468823121003291-gr4_lrg.jpg?httpAccept=%2A%2F%2A",
            "@multimediatype": "JPEG image file",
            "@type": "IMAGE-HIGH-RES",
            "@size": "269514",
            "@ref": "gr4",
            "@mimetype": "image/jpeg"
          },
          {
            "@category": "high",
            "@height": "2099",
            "@width": "2499",
            "@_fa": "true",
            "$": "https://api.elsevier.com/content/object/eid/1-s2.0-S2468823121003291-gr3_lrg.jpg?httpAccept=%2A%2F%2A",
            "@multimediatype": "JPEG image file",
            "@type": "IMAGE-HIGH-RES",
            "@size": "1303054",
            "@ref": "gr3",
            "@mimetype": "image/jpeg"
          },
          {
            "@category": "high",
            "@height": "1141",
            "@width": "2499",
            "@_fa": "true",
            "$": "https://api.elsevier.com/content/object/eid/1-s2.0-S2468823121003291-gr2_lrg.jpg?httpAccept=%2A%2F%2A",
            "@multimediatype": "JPEG image file",
            "@type": "IMAGE-HIGH-RES",
            "@size": "476459",
            "@ref": "gr2",
            "@mimetype": "image/jpeg"
          },
          {
            "@category": "high",
            "@height": "662",
            "@width": "1333",
            "@_fa": "true",
            "$": "https://api.elsevier.com/content/object/eid/1-s2.0-S2468823121003291-ga1_lrg.jpg?httpAccept=%2A%2F%2A",
            "@multimediatype": "JPEG image file",
            "@type": "IMAGE-HIGH-RES",
            "@size": "192851",
            "@ref": "ga1",
            "@mimetype": "image/jpeg"
          },
          {
            "@category": "high",
            "@height": "1040",
            "@width": "1509",
            "@_fa": "true",
            "$": "https://api.elsevier.com/content/object/eid/1-s2.0-S2468823121003291-gr1_lrg.jpg?httpAccept=%2A%2F%2A",
            "@multimediatype": "JPEG image file",
            "@type": "IMAGE-HIGH-RES",
            "@size": "143220",
            "@ref": "gr1",
            "@mimetype": "image/jpeg"
          },
          {
            "@category": "thumbnail",
            "@_fa": "true",
            "$": "https://api.elsevier.com/content/object/eid/1-s2.0-S2468823121003291-si1.svg?httpAccept=%2A%2F%2A",
            "@multimediatype": "Scalable Vector Graphics file",
            "@type": "ALTIMG",
            "@size": "6160",
            "@ref": "si1",
            "@mimetype": "image/svg+xml"
          },
          {
            "@category": "thumbnail",
            "@_fa": "true",
            "$": "https://api.elsevier.com/content/object/eid/1-s2.0-S2468823121003291-si2.svg?httpAccept=%2A%2F%2A",
            "@multimediatype": "Scalable Vector Graphics file",
            "@type": "ALTIMG",
            "@size": "7470",
            "@ref": "si2",
            "@mimetype": "image/svg+xml"
          },
          {
            "@category": "thumbnail",
            "@_fa": "true",
            "$": "https://api.elsevier.com/content/object/eid/1-s2.0-S2468823121003291-si3.svg?httpAccept=%2A%2F%2A",
            "@multimediatype": "Scalable Vector Graphics file",
            "@type": "ALTIMG",
            "@size": "19569",
            "@ref": "si3",
            "@mimetype": "image/svg+xml"
          },
          {
            "@category": "thumbnail",
            "@_fa": "true",
            "$": "https://api.elsevier.com/content/object/eid/1-s2.0-S2468823121003291-si4.svg?httpAccept=%2A%2F%2A",
            "@multimediatype": "Scalable Vector Graphics file",
            "@type": "ALTIMG",
            "@size": "1025",
            "@ref": "si4",
            "@mimetype": "image/svg+xml"
          },
          {
            "@category": "thumbnail",
            "@_fa": "true",
            "$": "https://api.elsevier.com/content/object/eid/1-s2.0-S2468823121003291-si5.svg?httpAccept=%2A%2F%2A",
            "@multimediatype": "Scalable Vector Graphics file",
            "@type": "ALTIMG",
            "@size": "19085",
            "@ref": "si5",
            "@mimetype": "image/svg+xml"
          },
          {
            "@category": "thumbnail",
            "@_fa": "true",
            "$": "https://api.elsevier.com/content/object/eid/1-s2.0-S2468823121003291-si6.svg?httpAccept=%2A%2F%2A",
            "@multimediatype": "Scalable Vector Graphics file",
            "@type": "ALTIMG",
            "@size": "12686",
            "@ref": "si6",
            "@mimetype": "image/svg+xml"
          },
          {
            "@category": "standard",
            "@_fa": "true",
            "$": "https://api.elsevier.com/content/object/eid/1-s2.0-S2468823121003291-am.pdf?httpAccept=%2A%2F%2A",
            "@multimediatype": "Acrobat PDF file",
            "@type": "AAM-PDF",
            "@size": "1392930",
            "@ref": "am",
            "@mimetype": "application/pdf"
          }
        ]
      },
      "link": {
        "@rel": "abstract",
        "@href": "https://api.elsevier.com/content/abstract/scopus_id/85109622466"
      }
    }
  }
}