{
  "metadata": {
    "title": "Mechanistic insights of surface OH* modulation on methanol production with CO<ce:inf loc=post>2</ce:inf> hydrogenation by iron-based catalyst",
    "authors": "; ; ",
    "journal": "Molecular Catalysis",
    "date": "2024-12-31",
    "doi": "10.1016/j.mcat.2024.114599",
    "abstract": "",
    "uri": "https://api.elsevier.com/content/article/pii/S2468823124007818",
    "pii": "S2468823124007818"
  },
  "fulltext": {
    "full-text-retrieval-response": {
      "scopus-eid": "2-s2.0-85205819166",
      "originalText": "serial JL 315758 291210 291744 291790 291809 31 Molecular Catalysis MOLECULARCATALYSIS 2024-10-11 2024-10-11 2024-10-11 2024-10-11 2024-11-15T16:17:10 1-s2.0-S2468823124007818 S2468-8231(24)00781-8 S2468823124007818 10.1016/j.mcat.2024.114599 S300 S300.1 FULL-TEXT 1-s2.0-S2468823124X00152 2024-12-13T19:35:29.962258Z 0 0 20241201 20241231 2024 2024-10-11T03:30:53.819449Z absattachment articleinfo articlenumber articletitlenorm authfirstinitialnorm authfirstsurnamenorm cid cids contenttype copyright crossmark dateloaded dateloadedtxt datesearch datesort dateupdated dco docsubtype doctype doi eid ewtransactionid hubeid indexeddate issn issnnorm itemstage itemtransactionid itemweight openaccess openarchive pg pgfirst pii piinorm pubdateend pubdatestart pubdatetxt pubyr sectiontitle sortorder srctitle srctitlenorm srctype ssids alllist content subj subheadings suppl tomb volfirst volissue volumelist webpdf webpdfpagecount yearnav figure table e-component body acknowledge affil appendices articletitle auth authfirstini authfull authkeywords authlast grantnumber grantsponsor highlightsabst primabst pubtype ref specialabst 2468-8231 24688231 true 569 569 C Volume 569 78 114599 114599 114599 202412 December 2024 2024-12-01 2024-12-31 2024 Regular Papers article fla © 2024 Published by Elsevier B.V. MECHANISTICINSIGHTSSURFACEOHMODULATIONMETHANOLPRODUCTIONCO2HYDROGENATIONBYIRONBASEDCATALYST HE F 1 Introduction 2 Methods and models 2.1 Methods 2.1.1 Models 3 Results and discussion 3.1 Adsorption on Fe5C2(510) surface 3.2 CO2 initial hydrogenation pathway on pure Fe5C2(510) surface 3.3 Surface with 5/27 to 9/27ML OH* coverage 3.4 Control of surface OH* coverage 4 Conclusion CRediT authorship contribution statement Acknowledgments Appendix Supplementary materials References BOLUK 2014 439 G MORISON 1999 659 J FISCHER 1923 276 F WEI 2018 9958 J LIANG 2018 925 B YANG 2021 119554 Q KIRCHNER 2020 981 J HAO 2007 1157 X MIRZAEI 2013 106 A LI 2019 121456 T KARRE 2022 967 A HOOK 2010 848 M AIL 2016 267 S DING 2013 1241 M YUSOP 2022 18 A WILKE 2001 714 M WITUSIEWICZ 2004 346 V AI 2022 14884 X XU 2020 5250 D SMIT 2010 14928 E ZHAO 2012 47 S SONG 2020 11268 G LI 2018 28846 T SONG 2020 11268 G WANG 2014 1095 T YANG 2016 11 Y LI 2019 877 T HE 2018 2806 Y ZHANG 2021 120504 Y ZHANG 2023 122449 Z ZHU 2022 3629 J HE 2023 1540 F CAO 2011 55 D BENZIGER 1980 119 J CHANG 2018 3304 Q PHAM 2014 10170 T LIU 2021 11109 Q WANG 2024 159820 C PENG 2018 613 625 Y KRESSE 1996 15 G KRESSE 1996 11169 G BLOCHL 1994 17953 P KRESSE 1999 1758 G PERDEW 1997 1396 J PERDEW 1992 13244 J METHFESSEL 1989 3616 M MONKHORST 1976 5188 H HENKELMAN 2000 9978 G HU 2023 2205694 Y YIN 2023 291 P WANG 2018 160 H HE 2018 20907 Y BORDET 2018 4047 A BIONSKI 2005 88 P ZHANG 2023 118576 M BAI 2022 112236 Y GUO 2023 193 X LIU 2018 9120 J WANG 1991 T NIE 2016 9364 X TIAN 2014 20472 X HUO 2009 14713 C HEX2024X114599 HEX2024X114599XF 2026-10-11T00:00:00.000Z 2026-10-11T00:00:00.000Z http://creativecommons.org/licenses/by-nc-nd/4.0/ © 2024 Published by Elsevier B.V. 2024-10-25T08:55:59.835Z http://vtw.elsevier.com/data/voc/AddOnTypes/50.7/aggregated-refined Chinese Academy of Sciences XAB2019AW02 CAS Chinese Academy of Sciences http://data.elsevier.com/vocabulary/SciValFunders/501100002367 http://sws.geonames.org/1814991/ West Light Foundation West Light Foundation, Chinese Academy of Sciences http://data.elsevier.com/vocabulary/SciValFunders/501100013494 http://sws.geonames.org/1814991/ Ningxia Key Research and Development Project 2022BEE03002 2022BSB03056 TJGC2019022 Ningxia Key Research and Development Project (No. 2022BEE03002 and No 2022BSB03056). Fourth Batch of Ningxia Youth Talents Supporting Program (TJGC2019022) and West Light Foundation of the Chinese Academy of Sciences (XAB2019AW02). We gratefully acknowledge HZWTECH for providing computation facilities. Ningxia Key Research and Development Project (No. 2022BEE03002 and No. 2022BSB03056 ). Fourth Batch of Ningxia Youth Talents Supporting Program ( TJGC2019022 ) and West Light Foundation of the Chinese Academy of Sciences ( XAB2019AW02 ). We gratefully acknowledge HZWTECH for providing computation facilities . https://doi.org/10.15223/policy-017 https://doi.org/10.15223/policy-037 https://doi.org/10.15223/policy-012 https://doi.org/10.15223/policy-029 https://doi.org/10.15223/policy-004 item S2468-8231(24)00781-8 S2468823124007818 1-s2.0-S2468823124007818 10.1016/j.mcat.2024.114599 315758 2024-12-13T19:35:29.962258Z 2024-12-01 2024-12-31 1-s2.0-S2468823124007818-main.pdf https://s3-eu-west-1.amazonaws.com/prod-ucs-content-store-eu-west/content/pii:S2468823124007818/MAIN/application/pdf/8c0c3f9d55072d94503e11fd22b9321d/main.pdf main.pdf pdf true 13195972 MAIN 10 1-s2.0-S2468823124007818-main_1.png https://s3-eu-west-1.amazonaws.com/prod-ucs-content-store-eu-west/content/pii:S2468823124007818/PREVIEW/image/png/b500d28739aa638ffcf0eb112b02f829/main_1.png main_1.png png 59292 849 656 IMAGE-WEB-PDF 1 1-s2.0-S2468823124007818-gr6.jpg https://s3-eu-west-1.amazonaws.com/prod-ucs-content-store-eu-west/content/pii:S2468823124007818/gr6/DOWNSAMPLED/image/jpeg/59d2bb3831a2268ff265406b83524ea4/gr6.jpg gr6 gr6.jpg jpg 24174 201 376 IMAGE-DOWNSAMPLED 1-s2.0-S2468823124007818-gr12.jpg https://s3-eu-west-1.amazonaws.com/prod-ucs-content-store-eu-west/content/pii:S2468823124007818/gr12/DOWNSAMPLED/image/jpeg/71b6ffc068beecfdd35e98f034889ccb/gr12.jpg gr12 gr12.jpg jpg 37583 204 376 IMAGE-DOWNSAMPLED 1-s2.0-S2468823124007818-gr7.jpg https://s3-eu-west-1.amazonaws.com/prod-ucs-content-store-eu-west/content/pii:S2468823124007818/gr7/DOWNSAMPLED/image/jpeg/e35101dad6db7dd2e5c979dcf7b3dfb1/gr7.jpg gr7 gr7.jpg jpg 26298 192 376 IMAGE-DOWNSAMPLED 1-s2.0-S2468823124007818-gr11.jpg https://s3-eu-west-1.amazonaws.com/prod-ucs-content-store-eu-west/content/pii:S2468823124007818/gr11/DOWNSAMPLED/image/jpeg/d620432308c1928598edafa982eaa76d/gr11.jpg gr11 gr11.jpg jpg 27975 207 376 IMAGE-DOWNSAMPLED 1-s2.0-S2468823124007818-gr4.jpg https://s3-eu-west-1.amazonaws.com/prod-ucs-content-store-eu-west/content/pii:S2468823124007818/gr4/DOWNSAMPLED/image/jpeg/f7513b5ddfda5708e3a96f0701dfdd2f/gr4.jpg gr4 gr4.jpg jpg 38150 263 376 IMAGE-DOWNSAMPLED 1-s2.0-S2468823124007818-gr14.jpg https://s3-eu-west-1.amazonaws.com/prod-ucs-content-store-eu-west/content/pii:S2468823124007818/gr14/DOWNSAMPLED/image/jpeg/68db163c9d3ad51ef9f12f9f65707148/gr14.jpg gr14 gr14.jpg jpg 19017 178 376 IMAGE-DOWNSAMPLED 1-s2.0-S2468823124007818-gr5.jpg https://s3-eu-west-1.amazonaws.com/prod-ucs-content-store-eu-west/content/pii:S2468823124007818/gr5/DOWNSAMPLED/image/jpeg/79d6b64c216fe4be16e43219a51090a9/gr5.jpg gr5 gr5.jpg jpg 220749 429 791 IMAGE-DOWNSAMPLED 1-s2.0-S2468823124007818-gr13.jpg https://s3-eu-west-1.amazonaws.com/prod-ucs-content-store-eu-west/content/pii:S2468823124007818/gr13/DOWNSAMPLED/image/jpeg/d6fc49926b90891d9af97fc3bd80686c/gr13.jpg gr13 gr13.jpg jpg 22345 173 376 IMAGE-DOWNSAMPLED 1-s2.0-S2468823124007818-gr8.jpg https://s3-eu-west-1.amazonaws.com/prod-ucs-content-store-eu-west/content/pii:S2468823124007818/gr8/DOWNSAMPLED/image/jpeg/d41d9a8719cb3b8da4e2cdfeb94ea65c/gr8.jpg gr8 gr8.jpg jpg 154767 530 678 IMAGE-DOWNSAMPLED 1-s2.0-S2468823124007818-gr10.jpg https://s3-eu-west-1.amazonaws.com/prod-ucs-content-store-eu-west/content/pii:S2468823124007818/gr10/DOWNSAMPLED/image/jpeg/85ea753ed8bcb1c727e1576163f7fe44/gr10.jpg gr10 gr10.jpg jpg 185395 520 791 IMAGE-DOWNSAMPLED 1-s2.0-S2468823124007818-gr9.jpg https://s3-eu-west-1.amazonaws.com/prod-ucs-content-store-eu-west/content/pii:S2468823124007818/gr9/DOWNSAMPLED/image/jpeg/661dec8f8e0d4eba373bb8f43efa01d7/gr9.jpg gr9 gr9.jpg jpg 38177 264 339 IMAGE-DOWNSAMPLED 1-s2.0-S2468823124007818-gr2.jpg https://s3-eu-west-1.amazonaws.com/prod-ucs-content-store-eu-west/content/pii:S2468823124007818/gr2/DOWNSAMPLED/image/jpeg/a72d50f977f9a71229f9c965a0a7dc37/gr2.jpg gr2 gr2.jpg jpg 143101 371 791 IMAGE-DOWNSAMPLED 1-s2.0-S2468823124007818-gr3.jpg https://s3-eu-west-1.amazonaws.com/prod-ucs-content-store-eu-west/content/pii:S2468823124007818/gr3/DOWNSAMPLED/image/jpeg/3a82b717a9047480ca4913d8a5307eac/gr3.jpg gr3 gr3.jpg jpg 18011 158 339 IMAGE-DOWNSAMPLED 1-s2.0-S2468823124007818-gr1.jpg https://s3-eu-west-1.amazonaws.com/prod-ucs-content-store-eu-west/content/pii:S2468823124007818/gr1/DOWNSAMPLED/image/jpeg/68690374672659c0798e04949175867a/gr1.jpg gr1 gr1.jpg jpg 150617 383 678 IMAGE-DOWNSAMPLED 1-s2.0-S2468823124007818-ga1.jpg https://s3-eu-west-1.amazonaws.com/prod-ucs-content-store-eu-west/content/pii:S2468823124007818/ga1/DOWNSAMPLED/image/jpeg/dcffa354adc53ca4d4863007bc9ff109/ga1.jpg ga1 true ga1.jpg jpg 40425 200 296 IMAGE-DOWNSAMPLED 1-s2.0-S2468823124007818-gr6.sml https://s3-eu-west-1.amazonaws.com/prod-ucs-content-store-eu-west/content/pii:S2468823124007818/gr6/THUMBNAIL/image/gif/2d3b309163779304af1a4976e180eb38/gr6.sml gr6 gr6.sml sml 9194 117 219 IMAGE-THUMBNAIL 1-s2.0-S2468823124007818-gr12.sml https://s3-eu-west-1.amazonaws.com/prod-ucs-content-store-eu-west/content/pii:S2468823124007818/gr12/THUMBNAIL/image/gif/6973215483d4646c2c638baec8d92eb9/gr12.sml gr12 gr12.sml sml 14409 119 219 IMAGE-THUMBNAIL 1-s2.0-S2468823124007818-gr7.sml https://s3-eu-west-1.amazonaws.com/prod-ucs-content-store-eu-west/content/pii:S2468823124007818/gr7/THUMBNAIL/image/gif/e9529f55235e223a3713478858f60714/gr7.sml gr7 gr7.sml sml 9144 112 219 IMAGE-THUMBNAIL 1-s2.0-S2468823124007818-gr11.sml https://s3-eu-west-1.amazonaws.com/prod-ucs-content-store-eu-west/content/pii:S2468823124007818/gr11/THUMBNAIL/image/gif/d0ccc046189f03a444f7e366e0d6d346/gr11.sml gr11 gr11.sml sml 10601 121 219 IMAGE-THUMBNAIL 1-s2.0-S2468823124007818-gr4.sml https://s3-eu-west-1.amazonaws.com/prod-ucs-content-store-eu-west/content/pii:S2468823124007818/gr4/THUMBNAIL/image/gif/de76eef40c176af651d676b728635090/gr4.sml gr4 gr4.sml sml 13907 153 219 IMAGE-THUMBNAIL 1-s2.0-S2468823124007818-gr14.sml https://s3-eu-west-1.amazonaws.com/prod-ucs-content-store-eu-west/content/pii:S2468823124007818/gr14/THUMBNAIL/image/gif/5ae5463dc5e1cc02f93da37d85501745/gr14.sml gr14 gr14.sml sml 6867 104 219 IMAGE-THUMBNAIL 1-s2.0-S2468823124007818-gr5.sml https://s3-eu-west-1.amazonaws.com/prod-ucs-content-store-eu-west/content/pii:S2468823124007818/gr5/THUMBNAIL/image/gif/5ad08efd086fd8ab449354898cc07dba/gr5.sml gr5 gr5.sml sml 19827 119 219 IMAGE-THUMBNAIL 1-s2.0-S2468823124007818-gr13.sml https://s3-eu-west-1.amazonaws.com/prod-ucs-content-store-eu-west/content/pii:S2468823124007818/gr13/THUMBNAIL/image/gif/745f79b6331b63e94d4f2a4f38b75c26/gr13.sml gr13 gr13.sml sml 8061 101 219 IMAGE-THUMBNAIL 1-s2.0-S2468823124007818-gr8.sml https://s3-eu-west-1.amazonaws.com/prod-ucs-content-store-eu-west/content/pii:S2468823124007818/gr8/THUMBNAIL/image/gif/6b31eb3c2a8213e0c6245038722f57a9/gr8.sml gr8 gr8.sml sml 18856 164 210 IMAGE-THUMBNAIL 1-s2.0-S2468823124007818-gr10.sml https://s3-eu-west-1.amazonaws.com/prod-ucs-content-store-eu-west/content/pii:S2468823124007818/gr10/THUMBNAIL/image/gif/fc96aea83280e39b125ef77e54580d05/gr10.sml gr10 gr10.sml sml 18074 144 219 IMAGE-THUMBNAIL 1-s2.0-S2468823124007818-gr9.sml https://s3-eu-west-1.amazonaws.com/prod-ucs-content-store-eu-west/content/pii:S2468823124007818/gr9/THUMBNAIL/image/gif/805ff062e0830859a9e6ccb0fcb08efc/gr9.sml gr9 gr9.sml sml 14772 164 210 IMAGE-THUMBNAIL 1-s2.0-S2468823124007818-gr2.sml https://s3-eu-west-1.amazonaws.com/prod-ucs-content-store-eu-west/content/pii:S2468823124007818/gr2/THUMBNAIL/image/gif/d204f525d31bbafb6151ca6335341d9f/gr2.sml gr2 gr2.sml sml 16114 103 219 IMAGE-THUMBNAIL 1-s2.0-S2468823124007818-gr3.sml https://s3-eu-west-1.amazonaws.com/prod-ucs-content-store-eu-west/content/pii:S2468823124007818/gr3/THUMBNAIL/image/gif/d269795605a44f1f9049279682fc7ba3/gr3.sml gr3 gr3.sml sml 8079 102 219 IMAGE-THUMBNAIL 1-s2.0-S2468823124007818-gr1.sml https://s3-eu-west-1.amazonaws.com/prod-ucs-content-store-eu-west/content/pii:S2468823124007818/gr1/THUMBNAIL/image/gif/bee023bc08a7d02b4326de7838059f99/gr1.sml gr1 gr1.sml sml 21955 124 219 IMAGE-THUMBNAIL 1-s2.0-S2468823124007818-ga1.sml https://s3-eu-west-1.amazonaws.com/prod-ucs-content-store-eu-west/content/pii:S2468823124007818/ga1/THUMBNAIL/image/gif/c67cce7a659e2914fe874940d2544d4e/ga1.sml ga1 true ga1.sml sml 21932 148 219 IMAGE-THUMBNAIL 1-s2.0-S2468823124007818-gr6_lrg.jpg https://s3-eu-west-1.amazonaws.com/prod-ucs-content-store-eu-west/content/pii:S2468823124007818/HIGHRES/image/jpeg/d9217ab6041f7eb7234534ede368ce93/gr6_lrg.jpg gr6 gr6_lrg.jpg jpg 173626 892 1667 IMAGE-HIGH-RES 1-s2.0-S2468823124007818-gr12_lrg.jpg https://s3-eu-west-1.amazonaws.com/prod-ucs-content-store-eu-west/content/pii:S2468823124007818/HIGHRES/image/jpeg/1a9278a9578cbdd1f339cdde1b014263/gr12_lrg.jpg gr12 gr12_lrg.jpg jpg 258332 903 1667 IMAGE-HIGH-RES 1-s2.0-S2468823124007818-gr7_lrg.jpg https://s3-eu-west-1.amazonaws.com/prod-ucs-content-store-eu-west/content/pii:S2468823124007818/HIGHRES/image/jpeg/63e25f57e7c3bc034e94ad5606bc971d/gr7_lrg.jpg gr7 gr7_lrg.jpg jpg 172099 853 1667 IMAGE-HIGH-RES 1-s2.0-S2468823124007818-gr11_lrg.jpg https://s3-eu-west-1.amazonaws.com/prod-ucs-content-store-eu-west/content/pii:S2468823124007818/HIGHRES/image/jpeg/5bdd12eae55a0608950a55570008d71e/gr11_lrg.jpg gr11 gr11_lrg.jpg jpg 217496 918 1667 IMAGE-HIGH-RES 1-s2.0-S2468823124007818-gr4_lrg.jpg https://s3-eu-west-1.amazonaws.com/prod-ucs-content-store-eu-west/content/pii:S2468823124007818/HIGHRES/image/jpeg/e3b8afaabe893bd8393b9e4f62e38e07/gr4_lrg.jpg gr4 gr4_lrg.jpg jpg 280878 1166 1667 IMAGE-HIGH-RES 1-s2.0-S2468823124007818-gr14_lrg.jpg https://s3-eu-west-1.amazonaws.com/prod-ucs-content-store-eu-west/content/pii:S2468823124007818/HIGHRES/image/jpeg/ffda99ac61a7463a56ff01fa95e82ace/gr14_lrg.jpg gr14 gr14_lrg.jpg jpg 114349 791 1667 IMAGE-HIGH-RES 1-s2.0-S2468823124007818-gr5_lrg.jpg https://s3-eu-west-1.amazonaws.com/prod-ucs-content-store-eu-west/content/pii:S2468823124007818/HIGHRES/image/jpeg/77466137e3166d56ee0fce78140ae1a2/gr5_lrg.jpg gr5 gr5_lrg.jpg jpg 1962099 1899 3500 IMAGE-HIGH-RES 1-s2.0-S2468823124007818-gr13_lrg.jpg https://s3-eu-west-1.amazonaws.com/prod-ucs-content-store-eu-west/content/pii:S2468823124007818/HIGHRES/image/jpeg/5c3f748054d246d94201436b5f54e387/gr13_lrg.jpg gr13 gr13_lrg.jpg jpg 156100 768 1667 IMAGE-HIGH-RES 1-s2.0-S2468823124007818-gr8_lrg.jpg https://s3-eu-west-1.amazonaws.com/prod-ucs-content-store-eu-west/content/pii:S2468823124007818/HIGHRES/image/jpeg/2d75a56b632d850ef2f0826a458c08d2/gr8_lrg.jpg gr8 gr8_lrg.jpg jpg 1186715 2345 3000 IMAGE-HIGH-RES 1-s2.0-S2468823124007818-gr10_lrg.jpg https://s3-eu-west-1.amazonaws.com/prod-ucs-content-store-eu-west/content/pii:S2468823124007818/HIGHRES/image/jpeg/aaed55b0de3ebf68e8685b9d76e2e558/gr10_lrg.jpg gr10 gr10_lrg.jpg jpg 1416664 2302 3500 IMAGE-HIGH-RES 1-s2.0-S2468823124007818-gr9_lrg.jpg https://s3-eu-west-1.amazonaws.com/prod-ucs-content-store-eu-west/content/pii:S2468823124007818/HIGHRES/image/jpeg/d36bdb27e52ff5d5b16f09766949931e/gr9_lrg.jpg gr9 gr9_lrg.jpg jpg 277598 1169 1500 IMAGE-HIGH-RES 1-s2.0-S2468823124007818-gr2_lrg.jpg https://s3-eu-west-1.amazonaws.com/prod-ucs-content-store-eu-west/content/pii:S2468823124007818/HIGHRES/image/jpeg/915bf9a9cd3352dc7760583a0765e983/gr2_lrg.jpg gr2 gr2_lrg.jpg jpg 1081482 1643 3500 IMAGE-HIGH-RES 1-s2.0-S2468823124007818-gr3_lrg.jpg https://s3-eu-west-1.amazonaws.com/prod-ucs-content-store-eu-west/content/pii:S2468823124007818/HIGHRES/image/jpeg/d9f5b0c3c2560bddc5f45d95ff433f6e/gr3_lrg.jpg gr3 gr3_lrg.jpg jpg 109462 699 1500 IMAGE-HIGH-RES 1-s2.0-S2468823124007818-gr1_lrg.jpg https://s3-eu-west-1.amazonaws.com/prod-ucs-content-store-eu-west/content/pii:S2468823124007417/HIGHRES/image/jpeg/b97d3c62b8355fcff83a2fae351727c0/gr1_lrg.jpg gr1 gr1_lrg.jpg jpg 1106146 1696 3000 IMAGE-HIGH-RES 1-s2.0-S2468823124007818-ga1_lrg.jpg https://s3-eu-west-1.amazonaws.com/prod-ucs-content-store-eu-west/content/pii:S2468823124007417/HIGHRES/image/jpeg/b4dc0e8e0cbc698556a73ab09324ba8d/ga1_lrg.jpg ga1 true ga1_lrg.jpg jpg 310347 886 1313 IMAGE-HIGH-RES 1-s2.0-S2468823124007818-mmc1.docx https://s3-eu-west-1.amazonaws.com/prod-ucs-content-store-eu-west/content/pii:S2468823124007818/mmc1/MAIN/application/vnd.openxmlformats-officedocument.wordprocessingml.document/5b83de03daae60e6768c9e9b3a1e3c5e/mmc1.docx mmc1 mmc1.docx docx 20868529 APPLICATION 1-s2.0-S2468823124007818-am.pdf am am.pdf pdf 1782161 AAM-PDF https://s3-eu-west-1.amazonaws.com/prod-ucs-content-store-eu-west/content/egi:10TM42JD5Z5/MAIN/application/pdf/1a89cdd833fb45f5a6127248ddf477f5/am.pdf MCAT 114599 114599 S2468-8231(24)00781-8 10.1016/j.mcat.2024.114599 Fig. 1 Top and side views of CO2 and H adsorption sites on the Fe5C2(510) surface. (Blue (light blue) and gray represent Fe and C atoms). Fig 1 Fig. 2 Six co-adsorption configurations of 2H and CO2 on Fe5C2(510) surface obtained after optimization. (blue: Fe; gray: C Fe5C2; red: O; white: H; black: C of CO2). Fig 2 Fig. 3 CO2 activation mechanisms and their corresponding reaction pathways. Fig 3 Fig. 4 The energy and structures for CO2 dissociation on Fe5C2(510) surface. (blue: Fe; gray: C in Fe5C2; red: O; white: H; black: C of CO2). Fig 4 Fig. 5 Configurations and energy(eV) of CO on the surface of Fe5C2(510) (510) for the formation of CH4 and CH3OH via direct or H-assisted dissociation pathways (blue:Fe; gray: surface C; red:O; white:H; black: C of CO2). Fig 5 Fig. 6 The energy profiles (eV) of the pathways for the formation of CH4 and CH3OH on Fe5C2(510) surface. Fig 6 Fig. 7 The energy profiles of the pathways for the formation of CH4. Fig 7 Fig. 8 Initial, transition, and final states associated with OH* and H2O* formation on Fe5C2(510) surface. (blue: Fe; gray: C of Fe5C2(510) surface; red: O; white: H in H2; green: H in OH). Fig 8 Fig. 9 Configurations and energy(eV) of CO2 activation on the surface of Fe5C2(510) with 3/27 ML OH coverage (blue: Fe; gray: C of Fe5C2(510) surface; red: O; white: H in H2; black: C of CO2; green: H in OH). Fig 9 Fig. 10 Configurations and energy of CO2 hydrogenation pathways on the surface on Fe5C2(510) with 3/27 ML OH coverage (blue: Fe; gray: C of Fe5C2(510) surface; red: O; white: H in H2; black: C of CO2; green: H in OH). Fig 10 Fig. 11 The Configurations and energy(eV) of the energetically preferred path for the formation of CH4 and CH3OH from HCO* + 2OH* on Fe5C2(510) surface with 3/27 ML OH* coverage. Fig 11 Fig. 12 Configurations and energy(eV) of the four possible pathways for the initial conversion of CO2 on the surface of Fe5C2(510) with 5/27 ML OH* coverage. (Blue: Fe; gray: C of Fe5C2(510) surface; red: O; white: H in H2; black: C of CO2; green: H in OH). Fig 12 Fig. 13 Energy profiles of CO2 dissociation through different ways on Fe5C2(510) surface with different OH* coverage. Fig 13 Fig. 14 Comparison of the activation energies of O* hydrogenation to OH* and OH* hydrogenation to H2O on the surface of Fe5C2(510) with various H* coverage. Fig 14 Table 1 Adsorption energy and bond length for CO2 adsorption at different sites on the Fe5C2(510) surface (data in the brackets indicate adsorption energies obtained by using DS-PAW calculations). Table 1 Site E ads,CO (eV) dFe-C (Å) dFe-O (Å) dCO (Å) 2F-4 −1.01 (−0.94) 2.160 1.981 2.153 2.030 1.264 1.256 2F-3 −0.56 (−0.52) 2.195 1.993 1.290 1.221 2F-1 −0.86 (−0.78) 2.265 1.853 2.113 2.024 1.265 1.257 4F-1 −0.81 (−0.75) 2.130 2.801 2.185 2.111 1.355 1.276 2F-2 −0.36 1.900 2.008 1.279 1.250 3F-1 −0.88 (−0.84) 1.928 2.240 1.930 1.371 1.218 3F-2 −0.10 (−0.22) 1.961 2.167 2.044 1.360 1.212 3F-1 −0.13 (−0.05) 2.115 1.921 1.304 1.231 4F-2 −0.61 (−0.73) 2.292 2.005 2.075 1.902 1.401 1.225 Table 2 Comparison of activation energies to the energetically preferred pathways for CO2 hydrogenation to CH4 and CH3OH pathways on Fe5C2(510) pure surface and 3/27 ML OH* coverage surface. Table 2 E a(eV) of the corresponding intermediate formation HCO* H2CO* H3CO* H3COH* CH2* CH3* CH4* 0 ML 1.16 0.40 0.90 1.43 0.79 1.22 0.83 3/27 ML 0.75 0.39 0.78 0.92 0.12 0.43 0.81 Research Paper Mechanistic insights of surface OH* modulation on methanol production with CO2 hydrogenation by iron-based catalyst Fugui He Writing – original draft Validation Methodology Investigation Data curation Conceptualization a Xiangbin Kong Data curation Conceptualization a Tong Zhang Validation Data curation a Yongning Yuan Methodology a Jianli Zhang Visualization Supervision a Xinhua Gao Methodology Funding acquisition a b ⁎ Yurong He Writing – review & editing Visualization Methodology Funding acquisition Data curation Conceptualization a ⁎ Tiansheng Zhao Validation Data curation a a State Key Laboratory of High-Efficiency Utilization of Coal and Green Chemical Engineering, School of Chemistry and Chemical Engineering, Ningxia University, Yinchuan 750021, China State Key Laboratory of High-Efficiency Utilization of Coal and Green Chemical Engineering, School of Chemistry and Chemical Engineering Ningxia University Yinchuan 750021 China aState Key Laboratory of High-Efficiency Utilization of Coal and Green Chemical Engineering, School of Chemistry and Chemical Engineering, Ningxia University, Yinchuan 750021, China b Institute of Coal Chemical Industry Technology, National Energy Group Ningxia Coal Industry Co., Ltd., Yinchuan 750411, China Institute of Coal Chemical Industry Technology National Energy Group Ningxia Coal Industry Co., Ltd. Yinchuan 750411 China bInstitute of Coal Chemical Industry Technology, National Energy Group Ningxia Coal Industry Co., Ltd., Yinchuan 750411, China ⁎ Corresponding authors at: State Key Laboratory of High-Efficiency Utilization of Coal and Green Chemical Engineering, School of Chemistry and Chemical Engineering, Ningxia University, Yinchuan 750021, China. State Key Laboratory of High-Efficiency Utilization of Coal and Green Chemical Engineering, School of Chemistry and Chemical Engineering Ningxia University Yinchuan 750021 China The conversion of CO2 into high-value-added chemicals via the Fischer-Tropsch Synthesis (FTS) reaction has gathered a lot of attention. The surface oxygenation environment is a significant factor affecting the catalyst performance. In this work, spin-polarized density-functional theory calculations have been used to investigate the adsorption and reactions of CO2 and H to generate CH4 and CH3OH on Fe5C2(510) surfaces with varying OH* coverage. On the pure Fe5C2(510) surface, CO2 preferentially dissociates via direct dissociation, and the major C1 species generated is CH4. At low OH* coverage, the preferential pathway for CO2 dissociation changes from direct dissociation to the H-assisted route by the formation of COOH*. The major C1 product of the reaction in this state is transferred to CH3OH. In addition, CO2 hydrogenation reactions are facilitated by the OH* species. At high OH coverage, CO2 preferentially dissociates through the HCOO* intermediates. However, it appears that the CO2 hydrogenation reaction activity is suppressed. The results demonstrate that maintaining the surface environment with OH* and H* could be an indispensable measure to obtain the target product in the iron-based CO2 Fischer-Tropsch Synthesis system. Graphical abstract Image, graphical abstract Keywords Surface OH Iron-based catalyst CO2 hydrogenation Fischer-Tropsch Synthesis (FTS) Surface environment Data availability No data was used for the research described in the article. 1 Introduction As the energy industry expands, the concentration of greenhouse gases (GHGs), such as CO2, continues to rise in the atmosphere, resulting in a slew of environmental issues [1]. Despite significant efforts over the past decades, controlling CO2 concentrations and converting them efficiently remain tough [2]. The conversion of CO2 into high-value chemical feedstocks via the Fischer-Tropsch Synthesis (FTS) reaction has gathered a lot of attention [3–7]. And this synthetic technology, which converts greenhouse gases into high-value fuels and chemicals, contributes to reducing carbon emissions and achieving resource recycling [8]. Fe, Co, Ni, and noble metals are frequently used as active metals in Fischer-Tropsch catalysts [9,10]. Iron-based catalysts can be utilized to produce a mixture of hydrocarbon fuels, including a significant amount of branched alkanes [11]. Additionally, they have higher Reverse Water-Gas Shift (RWGS) reactivity than Co or Ru catalysts, making them very attractive for coal-to-liquid fuel, biomass-to-liquid fuel (BTL) technologies, [12,13] and CO2 conversion. [14] To create Fe-based catalysts with significant catalytic activity, some modification is usually required [15]. Effective strategies to modify the catalytic performance of iron-based catalysts include adding promoters (such as K and Mn) [16,17] and adopting other active components (such as Cu, Pd, Co, and Ni) [18,19]. Iron carbides were found in used Fe2O3 catalysts converting CO2 to hydrocarbons, indicating that the catalysts underwent a phase shift during the process [20,21]. Iron carbide has been identified as the primary active phase of Fe-based catalysts [22,23], while the other types of active phases are their zero-valent monomers [24,25]. Various stable iron carbide phases have been seen in experimental experiments, including h-Fe7C3, χ-Fe5C2, θ-Fe3C, ε'-Fe2.2C, and ε-Fe2C phases [26,27]. Extensive experimental and theoretical studies have demonstrated that the Fe5C2 phase possesses good activity for CO hydrogenation [28,29]. Recent experimental and theoretical investigations have also indicated that the Fe5C2 phase exhibits favorable performance for CO2 hydrogenation [10,30]. During the reaction process, the generation of surface O* species occurs concurrently with the hydrogenation of CO2 [31,32]. Because oxygen species (O* species) is not a feedstock for hydrocarbon generation, High coverage of O* species on the catalyst surface competes with the adsorption of reactants (CO2 and H2) and the desired products (lower carbon hydrocarbons), so O* species are regarded as a byproducts that should be quickly removed during the conversion of CO2 to hydrocarbons. [33,34]. However, comprehensive theoretical research on the impact of O* and its derivatives on the elementary reactions of CO2 hydrogenation on the catalyst surface is still needed. In the former research, the Fe5C2(510) surface has frequently been employed because of its superior FTS reactivity [35]. Since it has a high thermodynamic stability and makes up a significant portion of the overall surface area [36,37]. Previous work has shown that OH* groups can effectively enhance the catalytic performance of Fe-based catalysts, but investigating the mechanism of OH* action via experimental means presents certain difficulties. This is because the ligand clusters used for modification contain multiple OH* groups, and the coverage of OH* can significantly affect the catalytic performance of the catalyst [27,38]. Existing research indicates that OH* can promote the formation of CH3OH; therefore, studying the reaction mechanisms of CO2 hydrogenation to CH4 and CH3OH on the Fe5C2(510) surface under different OH coverages through theoretical calculations holds certain guiding significance for the experimental preparation of efficient catalysts [39]. In this study, we use spin-polarized density-functional theory (DFT) calculations to investigate the mechanisms of CO2 adsorption, H adsorption, CO2 and H co-adsorption on Fe5C2(510). CO2 dissociation, as well as surface CO2 hydrogenation to form CH4 and CH3OH are systematically studied at different OH* coverages. All feasible adsorption sites for CO2, H, and OH on the surface are considered to identify the most stable adsorption configurations in all co-adsorption states. Then, we investigate the elementary reactions of CH4 and CH3OH formation with varying amounts of OH adsorption. To provide more detailed suggestions for experimental trials, the surface reduction and doping by altering the coverage of H are further investigated. 2 Methods and models 2.1 Methods Spin-polarized density functional theory calculations were performed using the Vienna Ab initio Simulation Package (VASP) [40,41]. Electron-ion interactions were described by projector-augmented wave potentials (PAW) [42,43]. Exchange-correlation effects were described by the Perdew-Burke-Ernzerhof (PBE) functional and generalized gradient approximation (GGA) [44,45]. The plane wave cutoff energy was specified to be 400 eV, and electron smearing via a 2nd-order Methfessel-Paxton [46] technique with a width of 0.2 eV was employed to ensure energy with errors <1 meV per atom. The convergence criteria for electronic self-consistent interactions and forces were set to 10–4 eV and 0.03 eV/Å, respectively. Brillouin zone sampling was performed using the Monkhorst-Pack scheme [47]. To study the reactions, transition states (TSs) were estimated by the climbing image nudged elastic band (CI-NEB) method [48], and vibrational frequencies were analyzed to evaluate a transition state with only one imaginary frequency along with the reaction coordinate. Convergence tests for the relevant parameters are shown in Tables S1-S3 and Y. Comparison calculations were performed with spin polarization density functional theory methods implemented in the Device Studio program [49], which provides several functions for performing visualization, modeling, and simulation. The band structure and density of states simulation using the DS-PAW software is integrated into Device Studio [50]. The adsorption energy (E ads) of the surface species is calculated by: E ads = E species+surface - E surface - E species. ΔEm represents the energy change caused by configuration migration. ΔE represents the energy difference between two different adsorption configurations. ΔE a and ΔE r represent the changes in activation energy and reaction energy, respectively. ΔE dis represents the desorption energy required for the desorption of product A* from the surface to form A(g). where E species+surface is the total energy of the adsorbed species with catalyst, E surface and E species represent the energy of the unoccupied surface and species in the gas phase, respectively. Since OH* cannot exist independently in molecular form, the adsorption energy of OH* adsorbed on the surface is calculated as: E ads (OH*)=E species (OH*)+surface-(E (H2O)−1/2E (H2))-E surface. 2.1.1 Models For the Fe5C2(510) surface model, we used the same slab as our former study (Fig. 1 ) [30]. The p(2 × 2) supercells containing five carbon and three iron atom layers with a thickness of 5.18 Å were used (Fig. S2). The slab has a size of 9.96 Å × 12.64 Å, in which the top three atom layers with adsorbates are relaxed and the bottom five atom layers are fixed in their bulk position. According to the lattice sizes, 2 × 2 × 1 k-point grid sampling within the Brillouin zones was set. The vacuum gap space was set as 15 Å to avoid significant interactions between the two slabs. 3 Results and discussion 3.1 Adsorption on Fe5C2(510) surface Fig. 1 depicts the optimal structure of the Fe5C2(510) surface and lists all potential adsorption sites and the surface cell's lattice parameters are given in Table S4. Two iron regions are interspersed on the surface. Fe atoms exhibit strong interactions with adsorbates like CO2 and CO [51]. The first stage of CO2 activation is the adsorption. We built every potential adsorption structure (Fig. S3). After optimization, nine locations on the surface of Fe5C2(510) are capable of steady CO2 adsorption (Fig. S4). Including five bridge sites (2F), three 3-fold sites (3F), and one 4-fold site (4F). Table 1 displays the appropriate structural characteristics and adsorption energies, and the configuration for CO2 adsorption is dominated by 2F sites. These 2F sites are primarily found between Fe#12, Fe#13, Fe#5, and Fe#6 atoms. In our investigation, the adsorption of CO2 on the Fe region of the Fe5C2(510) surface is more stable than that on the C region, which is consistent with the conclusion of previous work. As shown in Table 1, the calculated CO2 adsorption energy ranges from −1.01 eV to −0.10 eV. CO2 preferentially adsorbs at the 2F-4 site, with the C-O bonds elongated to 1.264 Å and 1.256 Å, compared to 1.177 Å in the gas phase CO2 (Fig. S5). The adsorption energy difference was determined by VASP and DS-PAW software giving a range from −0.12 eV to 0.08 eV. Overall consistency can be seen in the adsorption stability trend calculated by the two programs (Tables S5–S7, Figs. S6–S10). The 2F-4 bridged coordination sites are composed of Fe#5-Fe#13 atoms. The second stable CO2 adsorption configuration is a 3-fold site composed of Fe#5-Fe#12-Fe#13 sites, whose C-O bonds are 1.371 Å and 1.264 Å. In this work, we selected the 2F-4 site to explore the CO2 activation pathway on the surface of Fe5C2(510), and we also compared a portion of the research on the CO2 hydrogenation energy pathway with the earlier studies [10]. For H2 dissociation on the Fe5C2(510) surface, the small reaction energy barrier from H2 to 2H needs to be overcome [52]. Then two hydrogen atoms adsorb on the surface at various adsorption sites. The two H atoms are adsorbed by the combination of ortho or meta sites, and all feasible adsorption configurations have been built (Fig. S11). At 12 locations on the Fe5C2 (510) surface, the dissociated H2 could have been steadily adsorbed after optimization (Fig. S12). The calculated 2H adsorption energy on the surface of Fe5C2(510) was changed from −0.94 eV to −1.53 eV. On the most stable adsorption configuration of 2H on the Fe5C2(510) surface, two H atoms adsorbed at the 3F sites. The most stable CO2 and H2 adsorption configurations are both in the Fe region on the surface, and the least stable and sub-least stable CO2 and H2 co-adsorption configurations are both in the C region. To create the surface co-adsorption states, different equivalent symmetry sites of the most sTable 2H and CO2 adsorption configurations are chosen. The most stable CO2 adsorption configuration on the surface of Fe5C2(510) has two equivalent symmetry sites (Fe#5-Fe#13 and Fe#1-Fe#11), and the two H atoms dissociated by H2 have four adsorption combinations at their symmetry sites, all the 2H and CO2 co-adsorption combinations were optimized to yield six stable existing adsorption configurations. As illustrated in Fig. 2 , six adsorption configurations' adsorption energies are −1.76 eV (Fig. 2 a), −2.46 eV (Fig. 2b), −2.34 eV (Fig. 2c), −2.81 eV (Fig. 2d), −2.75 eV (Fig. 2e), and −2.10 eV (Fig. 2f). Among these six co-adsorption arrangements, Fig. 2 d shows the most stable one, in which two H atoms and CO2 are dispersedly adsorbed on the surface of Fe5C2(510). The fluctuation of this adsorption energy demonstrates that the degree of dispersion also has a major impact on the stability of the adsorption on the surface, in addition to the proximity to the surface, the axis bias angle, and the ambient Fe density. Successfully minimizing the impact of the lateral interaction through improved dispersion can increase the adsorption stability of the surface species. Apart from the reactants and products of the CO2 hydrogenation process, we also looked into the adsorption of all potential intermediate species on the surface, including O*, OH*, H2O*, CO x *, CH x *, H x CO*, H x COH*, and COH* (Fig. S13). The stable adsorption configurations were achieved after optimizing these species, which coincides with the findings of Pham et al. [36]. The CO2 conversion process results in the formation of O* species, and the hydrogenation of O* results in the formation of OH* and H2O. The adsorption stability impacts the efficacy of the active site, as well as the reaction pathway [53]. The optimization produced 13 and 9 stable adsorption configurations for O* and OH*, respectively (Figs. S14 and S15). The two most stable adsorption configurations for O* and OH* both formed three-fold sites on the surface. The gradual migration of C* to the gas phase during the hydrogenation to form CH4 indicates the weak adsorption of CH4 on the surface. The coordination of O atoms to Fe atoms with an adsorption energy of −1.69 eV forms the top adsorption for the CH3OH molecule. 3.2 CO2 initial hydrogenation pathway on pure Fe5C2(510) surface CO2 initial conversion over Fe5C2(510) surfaces involves three possible pathways: direct dissociation of CO2 to CO, hydrogenation of CO2 to form HCOO* intermediates, or formation of COOH* intermediates. Furthermore, these intermediates can be generated by additional cracking of the C-O bond and hydrogenation, resulting in a succession of C1 intermediates. As illustrated in Fig. 3 , the combination of these options results in six CO2 activation routes, which are the possible beginning pathways for CO2-FTS. In the RWGS process, CO2 is first adsorbed (CO2*) and activated. These CO2* can dissociate or be hydrogenated to generate COOH* intermediates, which can then be further converted to CO through the RWGS-MeOH (CO2 + H2 → CO + H2O; CO + 2H2 → CH3OH) pathway. COOH* species are separated into OH* and CO* species. OH* then undergoes hydrogenation to produce H2O*, while CO* either desorbs to generate gaseous CO or undergoes additional FTS reactions. Direct CO dissociation produces the species C* and O*, which can then be further hydrogenated to form CH x* (x = 1–4) and OH* or H2O*, respectively. The creation of CH x* species, which are the building blocks for the synthesis of hydrocarbons, begins with the hydrogenation, dissociation, and dehydration of HCO* and COH* intermediates. CH x* undergoes further coupling to produce hydrocarbon compounds [33]. CO2 activation on the Fe5C2(510) surface was studied in this work. The energy and structural parameters for all states are displayed in Fig. 4 , and the energy data is also given in the supporting information (Table S8). It is energetically unfavorable for COOH* formation because of a high activation energy of 1.15 eV and an endothermic reaction energy of 0.79 eV. Additionally, HCOO* intermediates can be created when the surface H* attacks the C atom of CO2 with an activation energy of 0.87 eV and an endothermic reaction energy of 0.45 eV. For the direct CO2 dissociation, the activated C-O bond length of the transition state is 1.56 Å, and the O atoms move to the nearby hollow fourfold site (Fe#3, Fe#4, Fe#5, and Fe#6) to reach the final state (Fig. S16) [52]. The direct dissociation of CO2 has an activation energy of 0.74 eV, which is kinetically more advantageous in comparison to CO2 dissociation through the formation of COOH* or HCOO* intermediates. The process is exothermic by 1.15 eV, which is thermodynamically beneficial too. The results are generally consistent with the findings of Wang et al. [54]. The CO desorption energy in the CO* and O* co-adsorption state is −2.28 eV, but the activation energies of the O* hydrogenation to produce OH* and the CO* hydrogenation to produce HCO* in this state are 1.08 eV and 1.20 eV, respectively, and are both lower than the energy needed for CO desorption (Fig. S17). This suggests that CO* is a highly likely intermediate for the conversion of CO2 on the iron carbide catalyst. Therefore, as shown in Fig. 4, we further investigated the energy pathway of CO activation and hydrogenation to produce CH4 and CH3OH on the surface. As shown in Figs. 5 and 6 , CO on the Fe5C2(510) surface can produce CH4 through multiple paths. CO* → HCO* → H2CO* → H2C* → H3C* → H4C* is the energetically preferred path. The formation of H2C* intermediate through HC* hydrogenation has a low activation energy of 0.79 eV, but the H2C* to H3C* step has a high activation energy of 1.22 eV, indicating that H2C* could be a significant intermediate in the CO2 hydrogenation process. CO* → HCO* → H2CO* → H3CO* → H3COH* is the energetically preferred path for CH3OH production. The H3CO* to H3COH* step has a high activation reaction energy of 1.43 eV, which makes the CO hydrogenation to CH3OH have less energy advantage. The surface C* created by direct CO dissociation creates a stable adsorption on the hollow four-fold site (4F-1, Fig. 5), whereas the surface C* formed by H-assisted CO dissociation by formation CHO* intermediate dissociation route forms a stable adsorption on the three-fold site (3F-2, Fig. 5). At these two locations, we compared the configurations and energy of all intermediate C* hydrogenation to CH4 processes. The findings demonstrate that the formation of CH2*and CH4* intermediate reaction steps at the 4F-1 site need to overcome activation energy barriers of 1.05 and 1.28 eV, respectively. While the corresponding intermediate reaction steps at the 3F-2 site have activation energies of 0.44 eV and 0.83 eV, respectively. Comparing the activation energy and migration energy required for the hydrogenation of CHx* species at the two sites, the energy path of CH2* hydrogenation to CH4* in the main reaction path is CH2* (3F-2) → CH2* (4F-1) → CH3* (3F-2) → CH4* (4F-1). As shown in Fig. 7 , at the 3F-2 site, the intermediate reaction step of CH3* production must overcome a significant activation reaction energy barrier of 1.22 eV, but at the 4F-1 site, this step only has to overcome an activation energy barrier of 0.62 eV. At the two sites, surface C* hydrogenation to CH4 proceeds in a different number of steps, and with different intermediate reactions with high activation energies, the surface C atoms at the 3F-2 site being hydrogenated to CH4 is easier overall. though Hydrogenation of dissociated C at 3F-2 and 4F-1 site on Fe5C2(510) surface. As shown in Fig. S13, among all the OH adsorption sites, the most stable configuration is on the 3F-3 site with an adsorption energy of about −1.70 eV. The adsorption at the 2F-1 site, with an adsorption energy of −1.69 eV, is the second stable adsorption configuration. We first investigated the barrier for the surface hydrogenation of O* to OH*. Then we computed the production of H2O* on Fe5C2(510). As shown in Fig. 8 , generating H2O though the OH* + OH* → H2O* + O* pathway has the lowest activation energy, which is 0.77 eV. The barrier for hydrogenating O* to OH* is 0.95 eV, while the barrier for hydrogenating OH* to generate H2O* is 1.56 eV, this is consistent with our previous research findings [30,54]. Existing research results indicate that on surfaces with high hydrogen coverage, H2O* preferentially forms via the pathway OH* + H* → H2O*. However, in real reactions, the hydrogen coverage on the surface is typically high [55,56]. The high coverage of OH* on the carbide surface is caused by the strong adsorption energy of OH* and the high hydrogenation barrier of OH* to H2O*, which could cause an impact on the creation of C2+ hydrocarbons [51,54]. It demonstrates that in the real reaction, it is easy for OH* and H2O* to co-adsorb with other surface species. The impact of H2O adsorption on the surface on the CO2 hydrogenation reaction of Fe-based catalysts has been the subject of several experimental and theoretical research, the hydrophilic surface will inhibit the secondary hydrogenation of the surface and promote chain growth [57]. However, the active sites on the catalyst surface will be occupied by the high coverage of H2O, which will hinder the catalyst's performance [58]. We investigated the mechanism of the CO2 hydrogenation process on the surface of Fe5C2(510) with OH co-adsorption. Fig. S18 depicts the optimum stable structure of the Fe5C2(510) surface with various OH coverages [59]. We investigated the CO2 activation mechanism of the Fe5C2(510) surface at four coverages (1 OH* to 4 OH* co-adsorption states). Since 20 Fe and 7 C atoms make up the top layer of the Fe5C2(510) surface, and with the increasing of OH coverage, 3, 5, 7, and 9 Fe atoms are coordinated with OH* The corresponding OH coverage is therefore nominated as 3/27, 5/27, 7/27 and 9/27 ML, respectively. The θ OH represents the surface OH coverage [60,61]. On the surface with 3/27 ML OH coverage, we investigated four potential routes for the initial dissociation of CO2 on the surface in the co-adsorption state of OH*, including CO2 direct dissociation, CO2 dissociation by formation COOH* or HCOO* intermediates, and hydrogenation of co-adsorbed OH*. Fig. 9 depicts the configurations and energies of the initial state, transition state, and final state of dissociated CO2, The formation COOH* intermediate has the lowest activation energy, which is 0.42 eV. The reaction has an exothermic reaction energy of 0.10 eV. The formation of HCOO* intermediate has an activation energy of 0.50 eV and a high exothermic reaction energy of 1.23 eV. These two reactions could take place simultaneously. Compared with that on the pure surface, the activation energy for the formation of COOH* intermediates dropped from 1.15 eV to 0.42 eV, and the activation energy of HCOO* formation dropped from 0.87 eV to 0.50 eV, while CO2 direct dissociation barrier increased from 0.74 eV to 0.85 eV. Surface OH* easily undergoes hydrogenation to generate H2O in the co-adsorption state, with a reaction activation energy of 0.44 eV. The difference is merely 0.02 eV when compared to the activation energy needed to create COOH* intermediates. As an alkaline group, OH* can reduce the adsorption of H2 and olefins and increase the adsorption of the acidic gas CO2. CO2 is more likely to dissociate via the H-assisted pathway in the OH* co-adsorption state. On the surface of Fe5C2(510) with 3/27 ML OH coverage, the pathways of CO2 hydrogenation to CH4 and CH3OH were also examined. The H2O produced during the CO2 hydrogenation reaction was desorbed into the vacuum layer to more accurately compare the impact of OH on the reaction. As seen in Fig. 10 , the process for the direct dissociation of CO2 happened along the direction of CO2* → CO* → HCO*, and the surface O* tends to be hydrogenated to produce OH*. However, compared to other reactions, OH* hydrogenation does not have the energy advantage. On CO* + O* + OH* + 2H* and CO* + 2OH* + H* co-adsorbed surfaces, CO desorption requires 2.29 eV and 1.55 eV, respectively, and does not have an energy advantage over the subsequent CO activation. The direct CO dissociation, the dissociation of H-assisted CO through intermediates of HCO* and COH*, as well as the route of OH* hydrogenation to H2O* are the four probable reaction pathways on the CO* + 2OH* + H* co-adsorption stage. The activation energies are 1.95 eV, 0.75 eV, 1.94 eV, and 0.86 eV, respectively. There is a kinetic benefit to H-assisted CO dissociation via the HCO* intermediate. For H-assisted CO2 dissociation by the formation of the HCOO* intermediate, further hydrogenation of the HCOO* intermediate can produce HCOOH* and H2COO* intermediates. It is challenging for the reactions to take place with activation energy barriers of 1.45 eV and 1.61 eV, respectively. The HCOOH* intermediate will continue to break down into HCO* and OH* intermediates even if the reaction takes place. For H-assisted CO2 dissociation by the formation of the COOH* intermediate, it is possible to further hydrogenate for the COOH* intermediates to produce HCOOH* intermediates, as well as to separate them into CO* and OH* intermediates. The reactions have an activation energy of 0.38 eV and 0.75 eV, respectively. The activation of CO2 on the surface of Fe5C2(510) with 3/27 ML OH coverage leads to the HCO* + 2OH* intermediates through different pathways. So, we further explore the reactions originated from HCO* + 2OH* intermediates to produce CH3OH and CH4 (Figs. 11 , S19, and Table. S9). Compared to the pure surface, the major product of CO2 hydrogenation shifted from CH4 to CH3OH on the Fe5C2(510) surface with 3/27 ML OH* coverage. The energetically preferred pathway for the formation of CH3OH* is CO2* → COOH* → CO* → HCO* → H2CO* → H3CO* → H3COH*. The H3CO* + H* → H3COH* reaction is the rate-determining step for the synthesis of CH3OH, and its activation energy is 0.92 eV. The energetically preferred pathway for the formation of CH4 is CO2* → COOH* → CO* → HCO* → H2CO*→ H2C* → H3C* → H4C*. The H3C* + H* → CH4* reaction is the rate-determining step in CH4 synthesis, and its activation energy is 0.81 eV. On the Fe5C2(510) surface with 3/27 ML OH coverage, the energetically preferred pathway of CH4 and CH3OH* formation is essentially identical as compared to the pure surface. 3.3 Surface with 5/27 to 9/27ML OH* coverage The energy and configurations of the initial state, final state, and transition state of CO2 hydrogenation on the Fe5C2(510) surface with 5/27 OH* ML coverage are shown in Fig. 12 . The primary route for the dissociation of CO2 is through the formation of HCOO* with an activation energy of 0.85 eV. There are two OH* on the surface of Fe5C2(510) with a 5/27 OH* ML coverage. Among them, the hydrogenation of OH* adsorbed at the 3F-2 site to produce H2O has a low activation energy barrier of 0.54 eV and an exothermic reaction energy of 0.23 eV, which has the lowest activation barrier. After H2O desorption, the surface of Fe5C2(510) with a 3/27 OH* coverage was recovered, and the subsequent reaction on the Fe5C2(510) surface with 5/27 OH* coverage is the same as that on the Fe5C2(510) surface with 3/27 OH* coverage. CO2 activation is also investigated on the Fe5C2(510) surface with 7/27 ML and 9/27 ML OH* coverages (Figs. S20 and S21). The energy priority of the three pathways is consistent with the surface with 5/27 ML OH* coverage, that is, the H-assisted path through the HCOO* intermediate. The primary difference is that compared to the pure surface, greater dissociation barriers must be overcome on the surfaces with 7/27 ML and 9/27 ML OH* coverages. It is demonstrated that the surface with high OH* coverage is not favorable for the occurrence of the CO2 hydrogenation reaction, which is consistent with the findings of former experimental research [64,65]. The reason is that OH* resides at the active site of Fe5C2(510) and interferes with the migration of the H atom. We compare the activation energy and reaction energy of CO2 activation on various OH* coverage surfaces. As shown in Fig. 13 , when surface OH coverage rises, the activation energy barrier for CO2 direct dissociation correspondingly increases. On the 3/27 ML OH* coverage surface, the dissociation barriers of H-assisted CO2 dissociation through HCOO* and COOH* intermediates are significantly lower than that on the pure surface, and H-assisted CO2 dissociation through COOH* intermediates is favorable. The dissociation barriers of H-assisted CO2 dissociation through HCOO* and COOH* intermediates increase on the Fe5C2(510) surface with 5/27 ML OH* coverage compared to the surface with 3/27 ML OH* coverage, yet it still has advantages over the pure surface. The activation energy barriers of CO2 dissociation on the Fe5C2(510) surface with 7/27 and 9/27 ML OH* coverages are higher than those on the pure surface. With the increase of OH* coverage, the preferential dissociation way of CO2 changed from direct dissociation way to H-assisted CO2 dissociation by forming the COOH* and HCOO* intermediates, indicating that the surface OH* changes the reaction mechanisms. The activation energy of the intermediate formation in the energetically preferred pathway of CH4 and CH3OH production on the pure surface and the 3/27 ML OH* coverage Fe5C2(510) surface is compared in Table 2 . On the pure surface, CO2* → CO* → HCO* → H2CO* → H2C* → H3C* → H4C* and CO2* → CO* → HCO* → H2CO* → H3CO* → H3COH* are the preferred pathways, respectively. On the Fe5C2(510) surface with 3/27 ML OH coverage, CO2* → CO* → HCO* → H2CO* → H2COH* → H2C* → H3C* → H4C* and CO2* → CO* → HCO* → H2CO* → H3CO* → H3COH* are the preferred pathways for the formation of CH4 and CH3OH, respectively. On the pure surface, H2CO* tends to dissociate into CH2* species directly. While on the surface with 3/27 ML OH* coverage, H2CO* is more likely to generate H2COH* before dissociating into CH2* species. The calculation findings demonstrate that all elementary reactions in the energetically preferred pathway on the surface with 3/27 ML OH* coverage have lower activation energies, especially for HCO*, H3COH*, and H2C* intermediates. The direct dissociation of H2CO* to H2C* is more beneficial on a clean surface. But on the surface of Fe5C2(510) with 3/27 OH* coverage, the hydrogenation of H2CO* to H3CO* takes place more efficiently. As a result, the primary reaction product changes. To enhance the performance of the catalyst by rational design of the catalyst, it is essential to accurately manage the coverage and adsorption stability of OH* on the surface of Fe5C2(510). 3.4 Control of surface OH* coverage Surface O* is reduced by H* to generate OH*, which is then further reduced to H2O*. The surface reduction efficiency of the catalyst may be altered by adjusting the surface H* amount, which will affect the generation of surface OH*. On the Fe5C2(510) surface with various H* coverages, we investigated the pathways of O* hydrogenation to OH* and H2O* (Fig. 14 ) [62]. When the surface H* is lowly covered on the surface, the reduction ability is relatively weak, and the activation energy of O* hydrogenation to OH* reaction is around 1 eV. As the surface H* coverage gradually increases, the reduction ability gradually increases, and the activation energy of O* hydrogenation to OH* reaction markedly decreases. This encourages the further reduction of OH* intermediates, and also the production of H2O*. The difference in activation energy between the formation of OH* and H2O is greatest when H* coverage reaches 7/27. The activation energy of the O* hydrogenation is the lowest (0.22 eV), indicating that the Fe5C2(510) surface with 7/27 H* atoms is the most favorable for OH* production. The corresponding structures are given in the supporting information (Figs. S22 and S23) 4 Conclusion Spin-polarized density-functional theory calculations have been used to investigate the adsorption of CO2, the adsorption of H, the co-adsorption of CO2 and H, the dissociation of CO2, and the mechanism of CO2 hydrogenation to form CH4 and CH3OH on the Fe5C2(510) surface with different OH* coverages. Both CO2 and H* are preferentially adsorbed in the Fe region. The most stable CO2 adsorption occurs at the bridge site. The degree of dispersion among the surface-adsorbed species determines the stability of the adsorption of the surface species when CO2 and H are co-adsorbed. On the pure Fe5C2(510) surface, CO2 preferentially dissociates via direct dissociation, and the major C1 species generated is CH4. Calculations were made for all potential hydrogenation reaction steps involving the oxygenated intermediates, demonstrating that OH* is a stable species on the surface. The mechanisms of CO2 hydrogenation to CH4 and CH3OH on Fe5C2(510) surfaces with different OH coverages were investigated. When the OH* surface coverage was changed from 0 ML to 3/27 ML, the preferential pathway for CO2 dissociation changed from CO2 direct dissociation to H-assisted CO2 dissociation by the formation of COOH* intermediates. The major C1 product of the reaction in this state is CH3OH. Notedly, the 3/27 ML OH* coverage favors the CO2 hydrogenation reaction. When the surface OH* coverage exceeds 3/27 ML, CO2 preferentially dissociates through the H-assisted CO2 dissociation by the formation of HCOO* intermediates. The CO2 dissociation and activation barriers tended to rise when the surface OH* coverage rose from 3/27 ML to 9/27 ML. It appears that high OH* coverage suppresses the CO2 hydrogenation reaction activity. To design the iron-based catalysis system with specific product distribution, maintaining the surface environment with OH* and H* could be an indispensable measure. CRediT authorship contribution statement Fugui He: Writing – original draft, Validation, Methodology, Investigation, Data curation, Conceptualization. Xiangbin Kong: Data curation, Conceptualization. Tong Zhang: Validation, Data curation. Yongning Yuan: Methodology. Jianli Zhang: Visualization, Supervision. Xinhua Gao: Methodology, Funding acquisition. Yurong He: Writing – review & editing, Visualization, Methodology, Funding acquisition, Data curation, Conceptualization. Tiansheng Zhao: Validation, Data curation. Declaration of competing interest The authors declare that they have no known competing financial interests or personal relationships that could have appeared to influence the work reported in this paper Acknowledgments Ningxia Key Research and Development Project (No. 2022BEE03002 and No 2022BSB03056). Fourth Batch of Ningxia Youth Talents Supporting Program (TJGC2019022) and West Light Foundation of the Chinese Academy of Sciences (XAB2019AW02). We gratefully acknowledge HZWTECH for providing computation facilities. Supplementary materials Supplementary material associated with this article can be found, in the online version, at doi:10.1016/j.mcat.2024.114599. Appendix Supplementary materials Image, application 1 References [1] G. Bölük M. Mert Fossil & renewable energy consumption, GHGs (greenhouse gases) and economic growth: evidence from a panel of EU (European Union) countries Energy 74 2014 439 10.1016/j.energy.2014.07.008 G. Bölük, M. Mert, Fossil & renewable energy consumption, GHGs (greenhouse gases) and economic growth: evidence from a panel of EU (European Union) countries, Energy. 2014, 74: 439. 10.1016/j.energy.2014.07.008. [2] J.I.L. Morison D. W Interactions between increasing CO2 concentration and temperature on plant growth Plant Cell Environ. 22 6 1999 659 10.1046/j.1365-3040.1999.00443.x J.I.L. Morison, D. W, Interactions between increasing CO2 concentration and temperature on plant growth, Plant Cell Environ. 1999, 22(6): 659. 10.1046/j.1365-3040.1999.00443.x [3] F. Fischer H. Tropsch The preparation of synthetic oil mixtures (synthyol) from carbon monoxide and hydrogen Brennst. Chem. 4 1923 276 F. Fischer, H. Tropsch, The preparation of synthetic oil mixtures (synthyol) from carbon monoxide and hydrogen, Brennst. Chem., 1923, 4: 276. [4] J. Wei R. Yao Q. Ge Z. Wen X. Ji C. Fang J. Zhang H. Xu J. Sun Catalytic hydrogenation of CO2 to isoparaffins over Fe-based multifunctional catalysts ACS Catal. 8 11 2018 9958 10.1021/acscatal.8b02267 J. Wei, R. Yao, Q. Ge, Z. Wen, X. Ji, C. Fang, J. Zhang, H. Xu, J. Sun, Catalytic hydrogenation of CO2 to isoparaffins over Fe-based multifunctional catalysts. ACS Catal., 2018. 8(11), 9958. 10.1021/acscatal.8b02267 [5] B. Liang H. Duan T. Sun J. Ma X. Liu J. Xu X. Su Y. Huang T. Zhang Effect of Na promoter on Fe-based catalyst for CO2 hydrogenation to alkenes ACS Sustain. Chem. Eng. 7 1 2018 925 10.1021/acssuschemeng.8b04538 B. Liang, H. Duan, T. Sun, J. Ma, X. Liu, J. Xu, X. Su, Y. Huang, T. Zhang, Effect of Na promoter on Fe-based catalyst for CO2 hydrogenation to alkenes, ACS Sustain. Chem. Eng. 2018. 7(1), 925. 10.1021/acssuschemeng.8b04538 [6] Q. Yang A. Skrypnik A. Matvienko H. Lund M. Holena E.V. Kondratenko Revealing property-performance relationships for efficient CO2 hydrogenation to higher hydrocarbons over Fe-based catalysts: statistical analysis of literature data and its experimental validation Appl. Catal. B-Environ. 282 2021 119554 10.1016/j.apcatb.2020.119554 Q. Yang, A. Skrypnik, A. Matvienko, H. Lund, M. Holena, E.V. Kondratenko, Revealing property-performance relationships for efficient CO2 hydrogenation to higher hydrocarbons over Fe-based catalysts: statistical analysis of literature data and its experimental validation, Appl. Catal. B-Environ. 2021. 282, 119554. 10.1016/j.apcatb.2020.119554 [7] J. Kirchner Z. Baysal S. Kureti Activity and structural changes of Fe-based catalysts during CO2 hydrogenation towards CH4–a mini review ChemCatChem 12 4 2020 981 10.1002/cctc.201901956 J. Kirchner, Z. Baysal, S. Kureti, Activity and structural changes of Fe-based catalysts during CO2 hydrogenation towards CH4–a mini review, ChemCatChem. 2020. 12(4), 981. 10.1002/cctc.201901956 [8] X. Hao G. Dong Y. Yang Y. Xu Y. Li Coal to liquid (CTL): commercialization prospects in China Chem. Eng. Technol. 30 9 2007 1157 10.1002/ceat.200700148 X. Hao, G. Dong, Y. Yang, Y. Xu, Y. Li, Coal to liquid (CTL): commercialization prospects in China, Chem. Eng. Technol. 2007, 30(9): 1157. 10.1002/ceat.200700148 [9] A.A. Mirzaei S. Vahid H.O. Torshizi Effect of support and promoter on the catalytic performance and structural properties of the Fe-Co-Ni catalysts for CO hydrogenation J. Nat. Gas Sci. Eng. 15 2013 106 10.1016/j.jngse.2013.10.002 A.A. Mirzaei, S. Vahid, H.O. Torshizi, Effect of support and promoter on the catalytic performance and structural properties of the Fe-Co-Ni catalysts for CO hydrogenation, J. Nat. Gas Sci. Eng. 2013, 15: 106. 10.1016/j.jngse.2013.10.002 [10] T. Li X. Wen Y.W. Li H. Jiao Mechanistic insight into CO activation, methanation and C-C bond formation from coverage dependent CO hydrogenation on Fe (110) Surf. Sci. 689 2019 121456 10.1016/j.susc.2019.121456 T. Li, X. Wen, Y.W. Li, H. Jiao, Mechanistic insight into CO activation, methanation and C-C bond formation from coverage dependent CO hydrogenation on Fe (110), Surf. Sci. 2019, 689: 121456. 10.1016/j.susc.2019.121456 [11] A.V. Karre D.B. Dadyburjor Review of iron-based catalysts with and without zeolite supports used in fischer-tropsch processes Chem. Eng. Commun. 209 7 2022 967 10.1080/00986445.2021.1935252 A.V. Karre, D.B. Dadyburjor, Review of iron-based catalysts with and without zeolite supports used in fischer-tropsch processes, Chem. Eng. Commun. 2022, 209(7): 967. 10.1080/00986445.2021.1935252 [12] M. Höök K. Aleklett A review on coal to liquid fuels and its coal consumption Int. J. Energy Res. 34 10 2010 848 10.1080/00986445.2021.1935252 M. Höök, K. Aleklett, A review on coal to liquid fuels and its coal consumption, Int. J. Energy Res. 2010, 34(10): 848. 10.1080/00986445.2021.1935252 [13] S.S. Ail S. Dasappa Biomass to liquid transportation fuel via Fischer Tropsch synthesis-Technology review and current scenario Renew. Sustain. Energy Rev. 58 2016 267 10.1016/j.rser.2015.12.143 S.S. Ail, S. Dasappa, Biomass to liquid transportation fuel via Fischer Tropsch synthesis-Technology review and current scenario, Renew. Sustain. Energy Rev. 2016, 58: 267. 10.1016/j.rser.2015.12.143 [14] M. Ding Y. Yang Y. Li T. Wang L. Ma C. Wu Impact of H2/CO ratios on phase and performance of Mn-modified Fe-based Fischer Tropsch synthesis catalyst Appl. Energy 112 2013 1241 10.1016/j.apenergy.2012.12.052 M. Ding, Y. Yang, Y. Li, T. Wang, L. Ma, C. Wu, Impact of H2/CO ratios on phase and performance of Mn-modified Fe-based Fischer Tropsch synthesis catalyst, Appl. Energy. 2013, 112: 1241. 10.1016/j.apenergy.2012.12.052 [15] A.H.M. Yusop A.A. Sakkaf Modifications on porous absorbable Fe-based scaffolds for bone applications: a review from corrosion and biocompatibility viewpoints J. Biomed. Mater. Res. B Appl. Biomater. 110 1 2022 18 10.1002/jbm.b.34893 A.H.M. Yusop, A.A. Sakkaf, H, Modifications on porous absorbable Fe-based scaffolds for bone applications: a review from corrosion and biocompatibility viewpoints, J. Biomed. Mater. Res. B Appl. Biomater. 2022, 110(1): 18. 10.1002/jbm.b.34893 [16] M. Wilke F. Farges P.E. Petit J.G.E. Brown F. Martin Oxidation state and coordination of Fe in minerals: an Fe K-XANES spectroscopic study Am. Mineral. 86 5–6 2001 714 10.2138/am-2001-5-612 M. Wilke, F. Farges, P.E. Petit, J.G.E. Brown, F. Martin, Oxidation state and coordination of Fe in minerals: an Fe K-XANES spectroscopic study, Am. Mineral. 2001, 86(5–6): 714. 10.2138/am-2001-5-612 [17] V.T. Witusiewicz F. Sommer E.J. Mittemeijer Reevaluation of the Fe-Mn phase diagram J. Ph. Equilibria Diffus. 25 4 2004 346 https://springer.longhoe.net/article/10.1007/s11669-004-0152-3 V.T. Witusiewicz, F. Sommer, E.J. Mittemeijer, Reevaluation of the Fe-Mn phase diagram, J. Ph. Equilibria Diffus. 2004, 25(4): 346. https://springer.longhoe.net/article/10.1007/s11669-004-0152-3 [18] X. Ai H. Xie S. Chen G. Zhang B. Xu G. Zhou Highly dispersed mesoporous Cu/γ-Al2O3 catalyst for RWGS reaction Int. J. Hydrog. Energy 47 33 2022 14884 10.1016/j.ijhydene.2022.03.002 X. Ai, H. Xie, S. Chen, G. Zhang, B. Xu, G. Zhou, Highly dispersed mesoporous Cu/γ-Al2O3 catalyst for RWGS reaction, Int. J. Hydrog. Energy. 2022, 47(33): 14884. 10.1016/j.ijhydene.2022.03.002 [19] D. Xu M. Ding X. Hong G. Liu S.C.E. Tsang Selective C2+ alcohol synthesis from direct CO2 hydrogenation over a Cs-promoted Cu-Fe-Zn catalyst ACS Catal. 10 9 2020 5250 10.1021/acscatal.0c01184 D. Xu, M. Ding, X. Hong, G. Liu, S.C.E. Tsang, Selective C2+ alcohol synthesis from direct CO2 hydrogenation over a Cs-promoted Cu-Fe-Zn catalyst, ACS Catal. 2020, 10(9): 5250. 10.1021/acscatal.0c01184 [20] E.D. Smit F. Cinquini A.M. Beale O.V. Safonova W.V. Beek P. Sautet B.M. Weckhuysen Stability and reactivity of ϵ−χ−θ iron carbide catalyst phases in Fischer-Tropsch synthesis: controlling μc J. Am. Chem. Soc. 132 42 2010 14928 10.1021/ja105853q E.D. Smit, F. Cinquini, A.M. Beale, O.V. Safonova, W.V. Beek, P. Sautet, B.M. Weckhuysen, Stability and reactivity of ϵ−χ−θ iron carbide catalyst phases in Fischer-Tropsch synthesis: controlling μc, J. Am. Chem. Soc., 2010, 132(42): 14928. 10.1021/ja105853q [21] S. Zhao X.W. Liu C.F. Huo Y.W. Li J. Wang H. Jiao Surface morphology of Hägg iron carbide (Fe5C2(510)) from ab initio atomistic thermodynamics J. Catal. 294 2012 47 10.1016/j.jcat.2012.07.003 S. Zhao, X.W. Liu, C.F. Huo, Y.W. Li, J. Wang, H. Jiao, Surface morphology of Hägg iron carbide (Fe5C2(510)) from ab initio atomistic thermodynamics, J. Catal. 2012, 294: 47. 10.1016/j.jcat.2012.07.003 [22] G. Song M. Li P. Yan M.A. Nawaz D. Liu High conversion to aromatics via CO2-FT over a CO-reduced Cu-Fe2O3 catalyst integrated with HZSM-5 ACS Catal. 10 19 2020 11268 10.31635/ccschem.020.202000555 G. Song, M. Li, P. Yan, M.A. Nawaz, D. Liu, High conversion to aromatics via CO2-FT over a CO-reduced Cu-Fe2O3 catalyst integrated with HZSM-5, ACS Catal. 2020, 10(19), pp. 11268. 10.31635/ccschem.020.202000555 [23] T. Li X. Wen Y.W. L H. Jiao Successive dissociation of CO, CH4, C2H6, and CH3CHO on Fe(110): retrosynthetic understanding of FTS mechanism J. Phys. Chem. C 122 50 2018 28846 10.1021/acs.jpcc.8b10310 T. Li, X. Wen, Y.W. L, H. Jiao, Successive dissociation of CO, CH4, C2H6, and CH3CHO on Fe(110): retrosynthetic understanding of FTS mechanism, J. Phys. Chem. C. 2018, 122(50): 28846. 10.1021/acs.jpcc.8b10310 [24] G. Song M. Li P. Yan M.A. Nawaz D. Liu High conversion to aromatics via CO2-FT over a CO-reduced Cu-Fe2O3 catalyst integrated with HZSM-5 ACS Catal. 10 19 2020 11268 10.1021/acscatal.0c02722 G. Song, M. Li, P. Yan, M.A. Nawaz, D. Liu, High conversion to aromatics via CO2-FT over a CO-reduced Cu-Fe2O3 catalyst integrated with HZSM-5, ACS Catal. 2020, 10(19), 11268. 10.1021/acscatal.0c02722 [25] T. Wang X. Tian Y.W. Li J. Wang M. Beller H. Jiao High coverage CO activation mechanisms on Fe(100) from computations J. Phys. Chem. C 118 2 2014 1095 10.1021/jp4103367 T. Wang, X. Tian, Y.W. Li, J. Wang, M. Beller, H. Jiao, High coverage CO activation mechanisms on Fe(100) from computations, J. Phys. Chem. C, 2014, 118(2): 1095. 10.1021/jp4103367 [26] Y. Yang Y.W. Li X.D. Wen Mössbauer spectroscopy of iron carbides: from prediction to experimental confirmation Mater 5 2016 11 10.1038/srep26184 Y. Yang, Y.W. Li, X.D. Wen, Mössbauer spectroscopy of iron carbides: from prediction to experimental confirmation, Mater, 5: 11. DOI: 10.1038/srep26184 [27] T. Li X. Wen Y. Yang Y.W. Li H. Jiao Mechanistic aspects of CO activation and C–C bond formation on the Fe/C- and Fe-terminated Fe3C(010) surfaces ACS Catal. 10 1 2019 877 10.1021/acscatal.9b04433 T. Li, X. Wen, Y. Yang, Y.W. Li, H. Jiao, Mechanistic aspects of CO activation and C–C bond formation on the Fe/C- and Fe-terminated Fe3C(010) surfaces, ACS Catal. 2019, 10(1): 877. 10.1021/acscatal.9b04433 [28] Y. He P. Zhao Y. Meng W. Guo Y. Yang Y.W. Li C.F. Huo X.D. Wen Hunting the correlation between Fe5C2 surfaces and their activities on CO: the descriptor of bond valence J. Phys. Chem. C 122 5 2018 2806 10.1021/acs.jpcc.7b11430 Y. He, P. Zhao, Y. Meng, W. Guo, Y. Yang, Y.W. Li, C.F. Huo, X.D. Wen, Hunting the correlation between Fe5C2 surfaces and their activities on CO: the descriptor of bond valence, J. Phys. Chem. C 2018. 122(5), 2806. 10.1021/acs.jpcc.7b11430 [29] Y. Zhang X. Guo B. Liu J. Zhang X. Gao Q. Ma S. Fan T. Zhao Cellulose modified iron catalysts for enhanced light olefins and linear C5+ α-olefins from CO hydrogenation Fuel 294 2021 120504 10.1016/j.fuel.2021.120504 Y. Zhang, X. Guo, B. Liu, J. Zhang, X. Gao, Q. Ma, S. Fan, T. Zhao, Cellulose modified iron catalysts for enhanced light olefins and linear C5+ α-olefins from CO hydrogenation, Fuel, 2021. 294, 120504. 10.1016/j.fuel.2021.120504 [30] Z. Zhang B. Chen L. Jia W. Liu X. Gao J. Gao B. Meng Y. Tan Y. He W. Tu Y.F. Han Unraveling the role of Fe5C2 in CH4 formation during CO2 hydrogenation over hydrophobic iron catalysts Appl. Catal. B-Environ. 327 2023 122449 10.1016/j.apcatb.2023.122449 Z. Zhang, B. Chen, L. Jia, W. Liu, X. Gao, J. Gao, B. Meng, Y. Tan, Y. He, W. Tu, Y.F. Han, Unraveling the role of Fe5C2 in CH4 formation during CO2 hydrogenation over hydrophobic iron catalysts, Appl. Catal. B-Environ. 2023. 327, 122449. 10.1016/j.apcatb.2023.122449 [31] J. Zhu P. Wang X. Zhang G. Zhang R. Li W. Li T.P. Senftle W. Liu J. Wang Y. Wang A. Zhang Dynamic structural evolution of iron catalysts involving competitive oxidation and carburization during CO2 hydrogenation Sci. Adv. 8 5 2022 3629 10.1126/sciadv.abm3629 J. Zhu, P. Wang, X. Zhang, G. Zhang, R. Li, W. Li, T.P. Senftle, W. Liu, J. Wang, Y. Wang, A. Zhang, Dynamic structural evolution of iron catalysts involving competitive oxidation and carburization during CO2 hydrogenation, Sci. Adv. 2022. 8(5), 3629. DOI: 10.1126/sciadv.abm3629 [32] F.G. He T. Zhang J. Liang H.P. Li Y.R. He X.H. Gao J.L. Zhang T.S. Zhao The application of DFT calculation in the study of iron-based catalyst for Fischer-Tropsch synthesis J. Fuel Chem. Technol. 51 11 2023 1540 10.31635/ccschem.020.202000555 F.G. He, T. Zhang, J. Liang, H.P. Li, Y.R. He, X.H. Gao, J.L. Zhang, T.S. Zhao, The application of DFT calculation in the study of iron-based catalyst for Fischer-Tropsch synthesis. J. Fuel Chem. Technol., 2023. 51(11), 1540. 10.31635/ccschem.020.202000555 [33] D.B. Cao Y.W. Li J. Wang H. Jiao Chain growth mechanism of Fischer-Tropsch synthesis on Fe5C2(001) J. Mol. Catal. A Chem. 346 1–2 2011 55 10.1016/j.molcata.2011.06.009 D.B. Cao, Y.W. Li, J. Wang, H. Jiao, Chain growth mechanism of Fischer-Tropsch synthesis on Fe5C2(001), J. Mol. Catal. A Chem. 2011, 346(1–2): 55.10.1016/j.molcata.2011.06.009 [34] J. Benziger R.J. Madix The effects of carbon, oxygen, sulfur and potassium adlayers on CO and H2 adsorption on Fe(100) Surf. Sci. 94 1 1980 119 10.1016/0039-6028(80)90160-0 J. Benziger, R.J. Madix, The effects of carbon, oxygen, sulfur and potassium adlayers on CO and H2 adsorption on Fe(100), Surf. Sci. 1980, 94(1): 119.10.1016/0039-6028(80)90160-0 [35] Q. Chang C. Zhang C. Liu Y. Wei A.V. Cheruvathur A.I. Dugulan J.W. Niemantsverdriet X. Liu Y. He M. Qing L. Zheng Relationship between iron carbide phases (ε-Fe2C, Fe7C3, and Fe5C2(510)) and catalytic performances of Fe/SiO2 Fischer-Tropsch catalysts ACS Catal. 8 4 2018 3304 10.1021/acscatal.7b04085 Q. Chang, C. Zhang, C. Liu, Y. Wei, A.V. Cheruvathur, A.I. Dugulan, J.W. Niemantsverdriet, X. Liu, Y. He, M. Qing, L. Zheng, Relationship between iron carbide phases (ε-Fe2C, Fe7C3, and Fe5C2(510)) and catalytic performances of Fe/SiO2 Fischer-Tropsch catalysts, ACS Catal. 2018, 8(4): 3304. 10.1021/acscatal.7b04085 [36] T.H. Pham X. Duan G. Qian X. Zhou D. Chen CO activation pathways of Fischer-Tropsch synthesis on Fe5C2(510): direct versus hydrogen-assisted CO dissociation J. Phys. Chem. C 118 19 2014 10170 10.1021/jp502225r T.H. Pham, X. Duan, G. Qian, X. Zhou, D. Chen, CO activation pathways of Fischer-Tropsch synthesis on Fe5C2(510): direct versus hydrogen-assisted CO dissociation, J. Phys. Chem. C. 2014, 118(19): 10170. 10.1021/jp502225r [37] Q.Y. Liu C. Shang Z.P. Liu In situ active site for CO activation in Fe-catalyzed Fischer-Tropsch synthesis from machine learning J. Am. Chem. Soc. 143 29 2021 11109 10.1021/jacs.1c04624 Q.Y. Liu, C. Shang, Z.P. Liu, In situ active site for CO activation in Fe-catalyzed Fischer-Tropsch synthesis from machine learning, J. Am. Chem. Soc. 2021, 143(29): 11109. 10.1021/jacs.1c04624 [38] C. Wang X. Gao J. Zhang Q. Ma S. Fan T. Zhao Effects of surface groups on Fe/ZnO catalysts for CO2 hydrogenation to olefin Appl. Surf. Sci. 658 2024 159820 10.1016/j.apsusc.2024.159820 C. Wang, X. Gao, J. Zhang, Q. Ma, S. Fan, T. Zhao, Effects of surface groups on Fe/ZnO catalysts for CO2 hydrogenation to olefin, Appl. Surf. Sci. 2024. 658, 159820. 10.1016/j.apsusc.2024.159820 [39] Y. Peng L. Wang Q. Luo Y. Cao Y. Dai Z. Li H. Li X. Zheng W. Yan J. Yang J. Zeng Molecular-level insight into how hydroxyl groups boost catalytic activity in CO2 hydrogenation into methanol Chem 4 3 2018 613 625 10.1016/j.chempr.2018.01.019 Y. Peng, L. Wang, Q. Luo, Y. Cao, Y. Dai, Z. Li, H. Li, X. Zheng, W. Yan, J. Yang, J. Zeng, Molecular-level insight into how hydroxyl groups boost catalytic activity in CO2 hydrogenation into methanol, Chem 2018. 4(3), 613–625. 10.1016/j.chempr.2018.01.019 [40] G. Kresse J. Furthmuller Efficiency of ab-initio total energy calculations for metals and semiconductors using a plane-wave basis set Comput. Mater. Sci. 6 1996 15 10.1016/0927-0256(96)00008-0 G. Kresse, J. Furthmuller, Efficiency of ab-initio total energy calculations for metals and semiconductors using a plane-wave basis set, Comput. Mater. Sci. 6 (1996) 15. 10.1016/0927-0256(96)00008-0 [41] G. Kresse J. Furthmuller Efficient iterative schemes for ab initio total-energy calculations using a plane-wave basis set Phys. Rev. B 54 1996 11169 10.1103/PhysRevB.54.11169 G. Kresse, J. Furthmuller, Efficient iterative schemes for ab initio total-energy calculations using a plane-wave basis set, Phys. Rev. B. 54 (1996) 11169. 10.1103/PhysRevB.54.11169 [42] P.E. Blochl Projector augmented-wave method Phys. Rev. B 50 1994 17953 10.1103/PhysRevB.50.17953 P.E. Blochl, Projector augmented-wave method, Phys. Rev. B. 50 (1994) 17953. 10.1103/PhysRevB.50.17953 [43] G. Kresse D. Joubert From ultrasoft pseudopotentials to the projector augmented- wave method Phys. Rev. B 59 1999 1758 10.1103/PhysRevB.59.1758 G. Kresse, D. Joubert, From ultrasoft pseudopotentials to the projector augmented- wave method, Phys. Rev. B. 59 (1999) 1758. 10.1103/PhysRevB.59.1758 [44] J.P. Perdew K. Burke M. Ernzerhof Generalized gradient approximation made simple (vol 77, pg 3865, 1996) Phys. Rev. Lett. 78 1997 1396 10.1103/PhysRevLett.77.3865 J.P. Perdew, K. Burke, M. Ernzerhof, Generalized gradient approximation made simple (vol 77, pg 3865, 1996), Phys. Rev. Lett. 78 (1997), 1396. 10.1103/PhysRevLett.77.3865 [45] J.P. Perdew Y. Wang Accurate and simple analytic representation of the electron-gas correlation-energy Phys. Rev. B 45 1992 13244 10.1103/PhysRevB.45.13244 J.P. Perdew, Y. Wang, Accurate and simple analytic representation of the electron-gas correlation-energy, Phys. Rev. B. 45 (1992) 13244. 10.1103/PhysRevB.45.13244 [46] M. Methfessel A.T. Paxton High-precision sampling for brillouin-zone integration in metals Phys. Rev. B 40 1989 3616 10.1103/PhysRevB.40.3616 M. Methfessel, A.T. Paxton, High-precision sampling for brillouin-zone integration in metals, Phys. Rev. B. 40 (1989) 3616. 10.1103/PhysRevB.40.3616 [47] H.J. Monkhorst J.D. Pack Special points for brillouin-zone integrations Phys. Rev. B 13 1976 5188 10.1103/PhysRevB.13.5188 H.J. Monkhorst, J.D. Pack, Special points for brillouin-zone integrations, Phys. Rev. B. 13 (1976) 5188. 10.1103/PhysRevB.13.5188 [48] G. Henkelman H. Jonsson Improved tangent estimate in the nudged elastic band method for finding minimum energy paths and saddle points J. Chem. Phys. 113 2000 9978 10.1063/1.1323224 G. Henkelman, H. Jonsson, Improved tangent estimate in the nudged elastic band method for finding minimum energy paths and saddle points, J. Chem. Phys. 113 (2000) 9978. 10.1063/1.1323224 [49] Y. Hu L. Zheng J. Li Y. Huang Z. Wang X. Lu L. Yu S. Wang Y. Sun S. Ding D. Ji Organic phase-change memory transistor based on an organic semiconductor with reversible molecular conformation transition Adv. Sci. 10 4 2023 2205694 10.1002/advs.202205694 Y. Hu, L. Zheng, J. Li, Y. Huang, Z. Wang, X. Lu, L. Yu, S. Wang, Y. Sun, S. Ding, D. Ji, Organic phase-change memory transistor based on an organic semiconductor with reversible molecular conformation transition, Adv. Sci. 2023, 10(4), 2205694. 10.1002/advs.202205694 [50] P.A. Yin Q. Ou Q. Peng Z. Shuai Substituent-controlled aggregate luminescence: computational unraveling of S1/S0 surface crossing Aggregate 4 3 2023 291 10.1002/agt2.291 P.A. Yin, Q. Ou, Q. Peng, Z. Shuai, Substituent-controlled aggregate luminescence: computational unraveling of S1/S0 surface crossing, Aggregate. 2023. 4(3), 291.10.1002/agt2.291 [51] H. Wang X. Nie Y. Chen X. Guo C. Song Facet effect on CO2 adsorption, dissociation and hydrogenation over Fe catalysts: insight from DFT J. CO2 Util. 26 2018 160 10.1016/j.jcou.2018.05.003 H. Wang, X. Nie, Y. Chen, X. Guo, C. Song, Facet effect on CO2 adsorption, dissociation and hydrogenation over Fe catalysts: insight from DFT, J. CO2 Util. 2018, 26: 160. 10.1016/j.jcou.2018.05.003 [52] Y. He P. Zhao J. Yin W. Guo Y. Yang Y.W. Li C.F. Huo X.D. Wen CO direct versus H-assisted dissociation on hydrogen coadsorbed Fe5C2(510) Fischer-Tropsch catalysts J. Phys. Chem. C 122 36 2018 20907 10.1021/acs.jpcc.8b06988 Y. He, P. Zhao, J. Yin, W. Guo, Y. Yang, Y.W. Li, C.F. Huo, X.D. Wen, CO direct versus H-assisted dissociation on hydrogen coadsorbed Fe5C2(510) Fischer-Tropsch catalysts, J. Phys. Chem. C 2018, 122(36): 20907. 10.1021/acs.jpcc.8b06988 [53] A. Bordet J.M. Asensio K. Soulantica B. Chaudret Enhancement of carbon oxides hydrogenation on iron-based nanoparticles by in-situ water removal ChemCatChem 10 18 2018 4047 10.1002/cctc.201800821 A. Bordet, J.M. Asensio, K. Soulantica, B. Chaudret, Enhancement of carbon oxides hydrogenation on iron-based nanoparticles by in-situ water removal, ChemCatChem 2018, 10(18): 4047. 10.1002/cctc.201800821 [54] P. Bionski A. Kiejna J. Hafner Theoretical study of oxygen adsorption at the Fe(110) and (100) surfaces Surf. Sci. 590 1 2005 88 10.1016/j.susc.2005.06.011 P. Bionski, A. Kiejna, J. Hafner, Theoretical study of oxygen adsorption at the Fe(110) and (100) surfaces, Surf. Sci. 2005, 590(1): 88. 10.1016/j.susc.2005.06.011 [55] M. Zhang X. Guan Y. Yu Theoretical insights into the removal pathways of adsorbed oxygen on the surface of χ-Fe5C2 (510) Chem. Eng. Sci. 271 2023 118576 10.1016/j.ces.2023.118576 M. Zhang, X. Guan, Y. Yu, Theoretical insights into the removal pathways of adsorbed oxygen on the surface of χ-Fe5C2 (510), Chem. Eng. Sci. 2023. 271, 118576. 10.1016/j.ces.2023.118576 [56] Y. Bai J. Liu T. Wang Y.F. Song Y. Yang Y.W. Li X. Wen Theoretical study about adsorbed oxygen reduction over χ-Fe5C2: formation of H2O and CO2 Mol. Catal. 524 2022 112236 10.1016/j.mcat.2022.112236 Y. Bai, J. Liu, T. Wang, Y.F. Song, Y. Yang, Y.W. Li, X. Wen, Theoretical study about adsorbed oxygen reduction over χ-Fe5C2: formation of H2O and CO2, Mol. Catal., 2022, 524:112236. 10.1016/j.mcat.2022.112236 [57] X. Guo B. Liu X.H. Gao F.G. He Q.X. Ma S.B. Fan T.S. Zhao J. Tian P. Reubroycharoen J. Zhang Improved olefin selectivity during CO hydrogenation on hydrophilic Fe/HAP catalysts Catal. Today 410 2023 193 10.1016/j.cattod.2022.04.013 X. Guo, B. Liu, X.H. Gao, F.G. He, Q.X. Ma, S.B. Fan, T.S. Zhao, J. Tian, P. Reubroycharoen, J. Zhang, Improved olefin selectivity during CO hydrogenation on hydrophilic Fe/HAP catalysts, Catal. Today. 2023, 410: 193. 10.1016/j.cattod.2022.04.013 [58] J. Liu A. Zhang X. Jiang M. Liu J. Zhu C. Song X. Guo Direct transformation of carbon dioxide to value-added hydrocarbons by physical mixtures of Fe5C2 and K-modified Al2O3 Ind. Eng. Chem. Res. 57 28 2018 9120 10.1021/acs.iecr.8b02017 J. Liu, A. Zhang, X. Jiang, M. Liu, J. Zhu, C. Song, X. Guo, Direct transformation of carbon dioxide to value-added hydrocarbons by physical mixtures of Fe5C2 and K-modified Al2O3, Ind. Eng. Chem. Res. 2018, 57(28): 9120. 10.1021/acs.iecr.8b02017 [59] T. Wang X.X. Tian Y.W. Li J. Wang M. Beller H. Jiao Coverage-dependent CO adsorption and dissociation mechanisms on iron surfaces from DFT computations ACS Catal. 4 6 1991 10.1021/cs500287r 2014 T. Wang, X.X. Tian, Y.W. Li, J. Wang, M. Beller, H. Jiao, Coverage-dependent CO adsorption and dissociation mechanisms on iron surfaces from DFT computations, ACS Catal. 2014, 4(6): 1991. 10.1021/cs500287r [60] X. Nie H. Wang M.J. Janik X. Guo C. Song Computational investigation of Fe-Cu bimetallic catalysts for CO2 hydrogenation J. Phys. Chem. C 120 17 2016 9364 10.1021/acs.jpcc.6b03461 X. Nie, H. Wang, M.J. Janik, X. Guo, C. Song, Computational investigation of Fe-Cu bimetallic catalysts for CO2 hydrogenation, J. Phys. Chem. C. 2016, 120(17): 9364. 10.1021/acs.jpcc.6b03461 [61] X. Tian T. Wang Y. Yang Y.W. Li J. Wang H. Jiao Copper promotion in CO adsorption and dissociation on the Fe(100) surface J. Phys. Chem. C 118 35 2014 20472 10.1021/jp506794w X. Tian, T. Wang, Y. Yang, Y.W. Li, J. Wang, H. Jiao, Copper promotion in CO adsorption and dissociation on the Fe(100) surface, J. Phys. Chem. C. 2014, 118(35): 20472. 10.1021/jp506794w [62] C.F. Huo Y.W. Li J. Wang H. Jiao Insight into CH4 formation in iron-catalyzed Fischer-Tropsch synthesis J. Am. Chem. Soc. 131 41 2009 14713 10.1021/ja9021864 C.F. Huo, Y.W. Li, J. Wang, H. Jiao, Insight into CH4 formation in iron-catalyzed Fischer-Tropsch synthesis, J. Am. Chem. Soc. 2009, 131(41): 14713. 10.1021/ja9021864",
      "scopus-id": "85205819166",
      "coredata": {
        "eid": "1-s2.0-S2468823124007818",
        "dc:description": "The conversion of CO2 into high-value-added chemicals via the Fischer-Tropsch Synthesis (FTS) reaction has gathered a lot of attention. The surface oxygenation environment is a significant factor affecting the catalyst performance. In this work, spin-polarized density-functional theory calculations have been used to investigate the adsorption and reactions of CO2 and H to generate CH4 and CH3OH on Fe5C2(510) surfaces with varying OH* coverage. On the pure Fe5C2(510) surface, CO2 preferentially dissociates via direct dissociation, and the major C1 species generated is CH4. At low OH* coverage, the preferential pathway for CO2 dissociation changes from direct dissociation to the H-assisted route by the formation of COOH*. The major C1 product of the reaction in this state is transferred to CH3OH. In addition, CO2 hydrogenation reactions are facilitated by the OH* species. At high OH coverage, CO2 preferentially dissociates through the HCOO* intermediates. However, it appears that the CO2 hydrogenation reaction activity is suppressed. The results demonstrate that maintaining the surface environment with OH* and H* could be an indispensable measure to obtain the target product in the iron-based CO2 Fischer-Tropsch Synthesis system.",
        "openArchiveArticle": "false",
        "prism:coverDate": "2024-12-31",
        "openaccessUserLicense": null,
        "prism:aggregationType": "Journal",
        "prism:url": "https://api.elsevier.com/content/article/pii/S2468823124007818",
        "dc:creator": [
          {
            "@_fa": "true",
            "$": "He, Fugui"
          },
          {
            "@_fa": "true",
            "$": "Kong, Xiangbin"
          },
          {
            "@_fa": "true",
            "$": "Zhang, Tong"
          },
          {
            "@_fa": "true",
            "$": "Yuan, Yongning"
          },
          {
            "@_fa": "true",
            "$": "Zhang, Jianli"
          },
          {
            "@_fa": "true",
            "$": "Gao, Xinhua"
          },
          {
            "@_fa": "true",
            "$": "He, Yurong"
          },
          {
            "@_fa": "true",
            "$": "Zhao, Tiansheng"
          }
        ],
        "link": [
          {
            "@_fa": "true",
            "@rel": "self",
            "@href": "https://api.elsevier.com/content/article/pii/S2468823124007818"
          },
          {
            "@_fa": "true",
            "@rel": "scidir",
            "@href": "https://www.sciencedirect.com/science/article/pii/S2468823124007818"
          }
        ],
        "dc:format": "application/json",
        "openaccessType": null,
        "pii": "S2468-8231(24)00781-8",
        "prism:volume": "569",
        "articleNumber": "114599",
        "prism:publisher": "Published by Elsevier B.V.",
        "dc:title": "Mechanistic insights of surface OH* modulation on methanol production with CO2 hydrogenation by iron-based catalyst",
        "prism:copyright": "© 2024 Published by Elsevier B.V.",
        "openaccess": "0",
        "prism:issn": "24688231",
        "dcterms:subject": [
          {
            "@_fa": "true",
            "$": "Surface OH"
          },
          {
            "@_fa": "true",
            "$": "Iron-based catalyst"
          },
          {
            "@_fa": "true",
            "$": "CO2 hydrogenation"
          },
          {
            "@_fa": "true",
            "$": "Fischer-Tropsch Synthesis (FTS)"
          },
          {
            "@_fa": "true",
            "$": "Surface environment"
          }
        ],
        "openaccessArticle": "false",
        "prism:publicationName": "Molecular Catalysis",
        "openaccessSponsorType": null,
        "prism:pageRange": "114599",
        "pubType": "fla",
        "prism:coverDisplayDate": "December 2024",
        "prism:doi": "10.1016/j.mcat.2024.114599",
        "prism:startingPage": "114599",
        "dc:identifier": "doi:10.1016/j.mcat.2024.114599",
        "openaccessSponsorName": null
      },
      "objects": {
        "object": [
          {
            "@category": "standard",
            "@height": "201",
            "@width": "376",
            "@_fa": "true",
            "$": "https://api.elsevier.com/content/object/eid/1-s2.0-S2468823124007818-gr6.jpg?httpAccept=%2A%2F%2A",
            "@multimediatype": "JPEG image file",
            "@type": "IMAGE-DOWNSAMPLED",
            "@size": "24174",
            "@ref": "gr6",
            "@mimetype": "image/jpeg"
          },
          {
            "@category": "standard",
            "@height": "204",
            "@width": "376",
            "@_fa": "true",
            "$": "https://api.elsevier.com/content/object/eid/1-s2.0-S2468823124007818-gr12.jpg?httpAccept=%2A%2F%2A",
            "@multimediatype": "JPEG image file",
            "@type": "IMAGE-DOWNSAMPLED",
            "@size": "37583",
            "@ref": "gr12",
            "@mimetype": "image/jpeg"
          },
          {
            "@category": "standard",
            "@height": "192",
            "@width": "376",
            "@_fa": "true",
            "$": "https://api.elsevier.com/content/object/eid/1-s2.0-S2468823124007818-gr7.jpg?httpAccept=%2A%2F%2A",
            "@multimediatype": "JPEG image file",
            "@type": "IMAGE-DOWNSAMPLED",
            "@size": "26298",
            "@ref": "gr7",
            "@mimetype": "image/jpeg"
          },
          {
            "@category": "standard",
            "@height": "207",
            "@width": "376",
            "@_fa": "true",
            "$": "https://api.elsevier.com/content/object/eid/1-s2.0-S2468823124007818-gr11.jpg?httpAccept=%2A%2F%2A",
            "@multimediatype": "JPEG image file",
            "@type": "IMAGE-DOWNSAMPLED",
            "@size": "27975",
            "@ref": "gr11",
            "@mimetype": "image/jpeg"
          },
          {
            "@category": "standard",
            "@height": "263",
            "@width": "376",
            "@_fa": "true",
            "$": "https://api.elsevier.com/content/object/eid/1-s2.0-S2468823124007818-gr4.jpg?httpAccept=%2A%2F%2A",
            "@multimediatype": "JPEG image file",
            "@type": "IMAGE-DOWNSAMPLED",
            "@size": "38150",
            "@ref": "gr4",
            "@mimetype": "image/jpeg"
          },
          {
            "@category": "standard",
            "@height": "178",
            "@width": "376",
            "@_fa": "true",
            "$": "https://api.elsevier.com/content/object/eid/1-s2.0-S2468823124007818-gr14.jpg?httpAccept=%2A%2F%2A",
            "@multimediatype": "JPEG image file",
            "@type": "IMAGE-DOWNSAMPLED",
            "@size": "19017",
            "@ref": "gr14",
            "@mimetype": "image/jpeg"
          },
          {
            "@category": "standard",
            "@height": "429",
            "@width": "791",
            "@_fa": "true",
            "$": "https://api.elsevier.com/content/object/eid/1-s2.0-S2468823124007818-gr5.jpg?httpAccept=%2A%2F%2A",
            "@multimediatype": "JPEG image file",
            "@type": "IMAGE-DOWNSAMPLED",
            "@size": "220749",
            "@ref": "gr5",
            "@mimetype": "image/jpeg"
          },
          {
            "@category": "standard",
            "@height": "173",
            "@width": "376",
            "@_fa": "true",
            "$": "https://api.elsevier.com/content/object/eid/1-s2.0-S2468823124007818-gr13.jpg?httpAccept=%2A%2F%2A",
            "@multimediatype": "JPEG image file",
            "@type": "IMAGE-DOWNSAMPLED",
            "@size": "22345",
            "@ref": "gr13",
            "@mimetype": "image/jpeg"
          },
          {
            "@category": "standard",
            "@height": "530",
            "@width": "678",
            "@_fa": "true",
            "$": "https://api.elsevier.com/content/object/eid/1-s2.0-S2468823124007818-gr8.jpg?httpAccept=%2A%2F%2A",
            "@multimediatype": "JPEG image file",
            "@type": "IMAGE-DOWNSAMPLED",
            "@size": "154767",
            "@ref": "gr8",
            "@mimetype": "image/jpeg"
          },
          {
            "@category": "standard",
            "@height": "520",
            "@width": "791",
            "@_fa": "true",
            "$": "https://api.elsevier.com/content/object/eid/1-s2.0-S2468823124007818-gr10.jpg?httpAccept=%2A%2F%2A",
            "@multimediatype": "JPEG image file",
            "@type": "IMAGE-DOWNSAMPLED",
            "@size": "185395",
            "@ref": "gr10",
            "@mimetype": "image/jpeg"
          },
          {
            "@category": "standard",
            "@height": "264",
            "@width": "339",
            "@_fa": "true",
            "$": "https://api.elsevier.com/content/object/eid/1-s2.0-S2468823124007818-gr9.jpg?httpAccept=%2A%2F%2A",
            "@multimediatype": "JPEG image file",
            "@type": "IMAGE-DOWNSAMPLED",
            "@size": "38177",
            "@ref": "gr9",
            "@mimetype": "image/jpeg"
          },
          {
            "@category": "standard",
            "@height": "371",
            "@width": "791",
            "@_fa": "true",
            "$": "https://api.elsevier.com/content/object/eid/1-s2.0-S2468823124007818-gr2.jpg?httpAccept=%2A%2F%2A",
            "@multimediatype": "JPEG image file",
            "@type": "IMAGE-DOWNSAMPLED",
            "@size": "143101",
            "@ref": "gr2",
            "@mimetype": "image/jpeg"
          },
          {
            "@category": "standard",
            "@height": "158",
            "@width": "339",
            "@_fa": "true",
            "$": "https://api.elsevier.com/content/object/eid/1-s2.0-S2468823124007818-gr3.jpg?httpAccept=%2A%2F%2A",
            "@multimediatype": "JPEG image file",
            "@type": "IMAGE-DOWNSAMPLED",
            "@size": "18011",
            "@ref": "gr3",
            "@mimetype": "image/jpeg"
          },
          {
            "@category": "standard",
            "@height": "383",
            "@width": "678",
            "@_fa": "true",
            "$": "https://api.elsevier.com/content/object/eid/1-s2.0-S2468823124007818-gr1.jpg?httpAccept=%2A%2F%2A",
            "@multimediatype": "JPEG image file",
            "@type": "IMAGE-DOWNSAMPLED",
            "@size": "150617",
            "@ref": "gr1",
            "@mimetype": "image/jpeg"
          },
          {
            "@category": "standard",
            "@height": "200",
            "@width": "296",
            "@_fa": "true",
            "$": "https://api.elsevier.com/content/object/eid/1-s2.0-S2468823124007818-ga1.jpg?httpAccept=%2A%2F%2A",
            "@multimediatype": "JPEG image file",
            "@type": "IMAGE-DOWNSAMPLED",
            "@size": "40425",
            "@ref": "ga1",
            "@mimetype": "image/jpeg"
          },
          {
            "@category": "thumbnail",
            "@height": "117",
            "@width": "219",
            "@_fa": "true",
            "$": "https://api.elsevier.com/content/object/eid/1-s2.0-S2468823124007818-gr6.sml?httpAccept=%2A%2F%2A",
            "@multimediatype": "GIF image file",
            "@type": "IMAGE-THUMBNAIL",
            "@size": "9194",
            "@ref": "gr6",
            "@mimetype": "image/gif"
          },
          {
            "@category": "thumbnail",
            "@height": "119",
            "@width": "219",
            "@_fa": "true",
            "$": "https://api.elsevier.com/content/object/eid/1-s2.0-S2468823124007818-gr12.sml?httpAccept=%2A%2F%2A",
            "@multimediatype": "GIF image file",
            "@type": "IMAGE-THUMBNAIL",
            "@size": "14409",
            "@ref": "gr12",
            "@mimetype": "image/gif"
          },
          {
            "@category": "thumbnail",
            "@height": "112",
            "@width": "219",
            "@_fa": "true",
            "$": "https://api.elsevier.com/content/object/eid/1-s2.0-S2468823124007818-gr7.sml?httpAccept=%2A%2F%2A",
            "@multimediatype": "GIF image file",
            "@type": "IMAGE-THUMBNAIL",
            "@size": "9144",
            "@ref": "gr7",
            "@mimetype": "image/gif"
          },
          {
            "@category": "thumbnail",
            "@height": "121",
            "@width": "219",
            "@_fa": "true",
            "$": "https://api.elsevier.com/content/object/eid/1-s2.0-S2468823124007818-gr11.sml?httpAccept=%2A%2F%2A",
            "@multimediatype": "GIF image file",
            "@type": "IMAGE-THUMBNAIL",
            "@size": "10601",
            "@ref": "gr11",
            "@mimetype": "image/gif"
          },
          {
            "@category": "thumbnail",
            "@height": "153",
            "@width": "219",
            "@_fa": "true",
            "$": "https://api.elsevier.com/content/object/eid/1-s2.0-S2468823124007818-gr4.sml?httpAccept=%2A%2F%2A",
            "@multimediatype": "GIF image file",
            "@type": "IMAGE-THUMBNAIL",
            "@size": "13907",
            "@ref": "gr4",
            "@mimetype": "image/gif"
          },
          {
            "@category": "thumbnail",
            "@height": "104",
            "@width": "219",
            "@_fa": "true",
            "$": "https://api.elsevier.com/content/object/eid/1-s2.0-S2468823124007818-gr14.sml?httpAccept=%2A%2F%2A",
            "@multimediatype": "GIF image file",
            "@type": "IMAGE-THUMBNAIL",
            "@size": "6867",
            "@ref": "gr14",
            "@mimetype": "image/gif"
          },
          {
            "@category": "thumbnail",
            "@height": "119",
            "@width": "219",
            "@_fa": "true",
            "$": "https://api.elsevier.com/content/object/eid/1-s2.0-S2468823124007818-gr5.sml?httpAccept=%2A%2F%2A",
            "@multimediatype": "GIF image file",
            "@type": "IMAGE-THUMBNAIL",
            "@size": "19827",
            "@ref": "gr5",
            "@mimetype": "image/gif"
          },
          {
            "@category": "thumbnail",
            "@height": "101",
            "@width": "219",
            "@_fa": "true",
            "$": "https://api.elsevier.com/content/object/eid/1-s2.0-S2468823124007818-gr13.sml?httpAccept=%2A%2F%2A",
            "@multimediatype": "GIF image file",
            "@type": "IMAGE-THUMBNAIL",
            "@size": "8061",
            "@ref": "gr13",
            "@mimetype": "image/gif"
          },
          {
            "@category": "thumbnail",
            "@height": "164",
            "@width": "210",
            "@_fa": "true",
            "$": "https://api.elsevier.com/content/object/eid/1-s2.0-S2468823124007818-gr8.sml?httpAccept=%2A%2F%2A",
            "@multimediatype": "GIF image file",
            "@type": "IMAGE-THUMBNAIL",
            "@size": "18856",
            "@ref": "gr8",
            "@mimetype": "image/gif"
          },
          {
            "@category": "thumbnail",
            "@height": "144",
            "@width": "219",
            "@_fa": "true",
            "$": "https://api.elsevier.com/content/object/eid/1-s2.0-S2468823124007818-gr10.sml?httpAccept=%2A%2F%2A",
            "@multimediatype": "GIF image file",
            "@type": "IMAGE-THUMBNAIL",
            "@size": "18074",
            "@ref": "gr10",
            "@mimetype": "image/gif"
          },
          {
            "@category": "thumbnail",
            "@height": "164",
            "@width": "210",
            "@_fa": "true",
            "$": "https://api.elsevier.com/content/object/eid/1-s2.0-S2468823124007818-gr9.sml?httpAccept=%2A%2F%2A",
            "@multimediatype": "GIF image file",
            "@type": "IMAGE-THUMBNAIL",
            "@size": "14772",
            "@ref": "gr9",
            "@mimetype": "image/gif"
          },
          {
            "@category": "thumbnail",
            "@height": "103",
            "@width": "219",
            "@_fa": "true",
            "$": "https://api.elsevier.com/content/object/eid/1-s2.0-S2468823124007818-gr2.sml?httpAccept=%2A%2F%2A",
            "@multimediatype": "GIF image file",
            "@type": "IMAGE-THUMBNAIL",
            "@size": "16114",
            "@ref": "gr2",
            "@mimetype": "image/gif"
          },
          {
            "@category": "thumbnail",
            "@height": "102",
            "@width": "219",
            "@_fa": "true",
            "$": "https://api.elsevier.com/content/object/eid/1-s2.0-S2468823124007818-gr3.sml?httpAccept=%2A%2F%2A",
            "@multimediatype": "GIF image file",
            "@type": "IMAGE-THUMBNAIL",
            "@size": "8079",
            "@ref": "gr3",
            "@mimetype": "image/gif"
          },
          {
            "@category": "thumbnail",
            "@height": "124",
            "@width": "219",
            "@_fa": "true",
            "$": "https://api.elsevier.com/content/object/eid/1-s2.0-S2468823124007818-gr1.sml?httpAccept=%2A%2F%2A",
            "@multimediatype": "GIF image file",
            "@type": "IMAGE-THUMBNAIL",
            "@size": "21955",
            "@ref": "gr1",
            "@mimetype": "image/gif"
          },
          {
            "@category": "thumbnail",
            "@height": "148",
            "@width": "219",
            "@_fa": "true",
            "$": "https://api.elsevier.com/content/object/eid/1-s2.0-S2468823124007818-ga1.sml?httpAccept=%2A%2F%2A",
            "@multimediatype": "GIF image file",
            "@type": "IMAGE-THUMBNAIL",
            "@size": "21932",
            "@ref": "ga1",
            "@mimetype": "image/gif"
          },
          {
            "@category": "high",
            "@height": "892",
            "@width": "1667",
            "@_fa": "true",
            "$": "https://api.elsevier.com/content/object/eid/1-s2.0-S2468823124007818-gr6_lrg.jpg?httpAccept=%2A%2F%2A",
            "@multimediatype": "JPEG image file",
            "@type": "IMAGE-HIGH-RES",
            "@size": "173626",
            "@ref": "gr6",
            "@mimetype": "image/jpeg"
          },
          {
            "@category": "high",
            "@height": "903",
            "@width": "1667",
            "@_fa": "true",
            "$": "https://api.elsevier.com/content/object/eid/1-s2.0-S2468823124007818-gr12_lrg.jpg?httpAccept=%2A%2F%2A",
            "@multimediatype": "JPEG image file",
            "@type": "IMAGE-HIGH-RES",
            "@size": "258332",
            "@ref": "gr12",
            "@mimetype": "image/jpeg"
          },
          {
            "@category": "high",
            "@height": "853",
            "@width": "1667",
            "@_fa": "true",
            "$": "https://api.elsevier.com/content/object/eid/1-s2.0-S2468823124007818-gr7_lrg.jpg?httpAccept=%2A%2F%2A",
            "@multimediatype": "JPEG image file",
            "@type": "IMAGE-HIGH-RES",
            "@size": "172099",
            "@ref": "gr7",
            "@mimetype": "image/jpeg"
          },
          {
            "@category": "high",
            "@height": "918",
            "@width": "1667",
            "@_fa": "true",
            "$": "https://api.elsevier.com/content/object/eid/1-s2.0-S2468823124007818-gr11_lrg.jpg?httpAccept=%2A%2F%2A",
            "@multimediatype": "JPEG image file",
            "@type": "IMAGE-HIGH-RES",
            "@size": "217496",
            "@ref": "gr11",
            "@mimetype": "image/jpeg"
          },
          {
            "@category": "high",
            "@height": "1166",
            "@width": "1667",
            "@_fa": "true",
            "$": "https://api.elsevier.com/content/object/eid/1-s2.0-S2468823124007818-gr4_lrg.jpg?httpAccept=%2A%2F%2A",
            "@multimediatype": "JPEG image file",
            "@type": "IMAGE-HIGH-RES",
            "@size": "280878",
            "@ref": "gr4",
            "@mimetype": "image/jpeg"
          },
          {
            "@category": "high",
            "@height": "791",
            "@width": "1667",
            "@_fa": "true",
            "$": "https://api.elsevier.com/content/object/eid/1-s2.0-S2468823124007818-gr14_lrg.jpg?httpAccept=%2A%2F%2A",
            "@multimediatype": "JPEG image file",
            "@type": "IMAGE-HIGH-RES",
            "@size": "114349",
            "@ref": "gr14",
            "@mimetype": "image/jpeg"
          },
          {
            "@category": "high",
            "@height": "1899",
            "@width": "3500",
            "@_fa": "true",
            "$": "https://api.elsevier.com/content/object/eid/1-s2.0-S2468823124007818-gr5_lrg.jpg?httpAccept=%2A%2F%2A",
            "@multimediatype": "JPEG image file",
            "@type": "IMAGE-HIGH-RES",
            "@size": "1962099",
            "@ref": "gr5",
            "@mimetype": "image/jpeg"
          },
          {
            "@category": "high",
            "@height": "768",
            "@width": "1667",
            "@_fa": "true",
            "$": "https://api.elsevier.com/content/object/eid/1-s2.0-S2468823124007818-gr13_lrg.jpg?httpAccept=%2A%2F%2A",
            "@multimediatype": "JPEG image file",
            "@type": "IMAGE-HIGH-RES",
            "@size": "156100",
            "@ref": "gr13",
            "@mimetype": "image/jpeg"
          },
          {
            "@category": "high",
            "@height": "2345",
            "@width": "3000",
            "@_fa": "true",
            "$": "https://api.elsevier.com/content/object/eid/1-s2.0-S2468823124007818-gr8_lrg.jpg?httpAccept=%2A%2F%2A",
            "@multimediatype": "JPEG image file",
            "@type": "IMAGE-HIGH-RES",
            "@size": "1186715",
            "@ref": "gr8",
            "@mimetype": "image/jpeg"
          },
          {
            "@category": "high",
            "@height": "2302",
            "@width": "3500",
            "@_fa": "true",
            "$": "https://api.elsevier.com/content/object/eid/1-s2.0-S2468823124007818-gr10_lrg.jpg?httpAccept=%2A%2F%2A",
            "@multimediatype": "JPEG image file",
            "@type": "IMAGE-HIGH-RES",
            "@size": "1416664",
            "@ref": "gr10",
            "@mimetype": "image/jpeg"
          },
          {
            "@category": "high",
            "@height": "1169",
            "@width": "1500",
            "@_fa": "true",
            "$": "https://api.elsevier.com/content/object/eid/1-s2.0-S2468823124007818-gr9_lrg.jpg?httpAccept=%2A%2F%2A",
            "@multimediatype": "JPEG image file",
            "@type": "IMAGE-HIGH-RES",
            "@size": "277598",
            "@ref": "gr9",
            "@mimetype": "image/jpeg"
          },
          {
            "@category": "high",
            "@height": "1643",
            "@width": "3500",
            "@_fa": "true",
            "$": "https://api.elsevier.com/content/object/eid/1-s2.0-S2468823124007818-gr2_lrg.jpg?httpAccept=%2A%2F%2A",
            "@multimediatype": "JPEG image file",
            "@type": "IMAGE-HIGH-RES",
            "@size": "1081482",
            "@ref": "gr2",
            "@mimetype": "image/jpeg"
          },
          {
            "@category": "high",
            "@height": "699",
            "@width": "1500",
            "@_fa": "true",
            "$": "https://api.elsevier.com/content/object/eid/1-s2.0-S2468823124007818-gr3_lrg.jpg?httpAccept=%2A%2F%2A",
            "@multimediatype": "JPEG image file",
            "@type": "IMAGE-HIGH-RES",
            "@size": "109462",
            "@ref": "gr3",
            "@mimetype": "image/jpeg"
          },
          {
            "@category": "high",
            "@height": "1696",
            "@width": "3000",
            "@_fa": "true",
            "$": "https://api.elsevier.com/content/object/eid/1-s2.0-S2468823124007818-gr1_lrg.jpg?httpAccept=%2A%2F%2A",
            "@multimediatype": "JPEG image file",
            "@type": "IMAGE-HIGH-RES",
            "@size": "1106146",
            "@ref": "gr1",
            "@mimetype": "image/jpeg"
          },
          {
            "@category": "high",
            "@height": "886",
            "@width": "1313",
            "@_fa": "true",
            "$": "https://api.elsevier.com/content/object/eid/1-s2.0-S2468823124007818-ga1_lrg.jpg?httpAccept=%2A%2F%2A",
            "@multimediatype": "JPEG image file",
            "@type": "IMAGE-HIGH-RES",
            "@size": "310347",
            "@ref": "ga1",
            "@mimetype": "image/jpeg"
          },
          {
            "@category": "standard",
            "@_fa": "true",
            "$": "https://api.elsevier.com/content/object/eid/1-s2.0-S2468823124007818-mmc1.docx?httpAccept=%2A%2F%2A",
            "@multimediatype": "Microsoft Word file",
            "@type": "APPLICATION",
            "@size": "20868529",
            "@ref": "mmc1",
            "@mimetype": "application/word"
          },
          {
            "@category": "standard",
            "@_fa": "true",
            "$": "https://api.elsevier.com/content/object/eid/1-s2.0-S2468823124007818-am.pdf?httpAccept=%2A%2F%2A",
            "@multimediatype": "Acrobat PDF file",
            "@type": "AAM-PDF",
            "@size": "1782161",
            "@ref": "am",
            "@mimetype": "application/pdf"
          }
        ]
      },
      "link": {
        "@rel": "abstract",
        "@href": "https://api.elsevier.com/content/abstract/scopus_id/85205819166"
      }
    }
  }
}