{
  "metadata": {
    "title": "Improvement on the catalytic performances of butyl levulinate hydrogenation to γ-valerolactone over self-regenerated CuNiCoB/Palygorskite catalyst",
    "authors": "; ; ",
    "journal": "Molecular Catalysis",
    "date": "2021-03-31",
    "doi": "10.1016/j.mcat.2021.111483",
    "abstract": "",
    "uri": "https://api.elsevier.com/content/article/pii/S2468823121001000",
    "pii": "S2468823121001000"
  },
  "fulltext": {
    "full-text-retrieval-response": {
      "scopus-eid": "2-s2.0-85101524489",
      "originalText": "serial JL 315758 291210 291744 291790 291809 31 Molecular Catalysis MOLECULARCATALYSIS 2021-03-02 2021-03-02 2021-03-02 2021-03-02 2021-03-14T15:55:36 1-s2.0-S2468823121001000 S2468-8231(21)00100-0 S2468823121001000 10.1016/j.mcat.2021.111483 S300 S300.1 FULL-TEXT 1-s2.0-S2468823121X00041 2022-12-12T23:36:12.42485Z 0 0 20210301 20210331 2021 2021-03-02T13:36:30.58975Z absattachment articleinfo articlenumber articletitlenorm authfirstinitialnorm authfirstsurnamenorm cid cids contenttype copyright crossmark dateloaded dateloadedtxt datesearch datesort dateupdated dco docsubtype doctype doi eid ewtransactionid hubeid indexeddate issn issnnorm itemstage itemtransactionid itemweight openaccess openarchive pg pgfirst pii piinorm pubdateend pubdatestart pubdatetxt pubyr sectiontitle sortorder srctitle srctitlenorm srctype ssids alllist content subj subheadings suppl tomb volfirst volissue volumelist webpdf webpdfpagecount yearnav figure table e-component body mmlmath acknowledge affil appendices articletitle auth authfirstini authfull authkeywords authlast grantnumber grantsponsor highlightsabst orcid primabst ref specialabst 2468-8231 24688231 true 504 504 C Volume 504 28 111483 111483 111483 202103 March 2021 2021-03-01 2021-03-31 2021 Regular Papers article fla © 2021 Elsevier B.V. All rights reserved. IMPROVEMENTCATALYTICPERFORMANCESBUTYLLEVULINATEHYDROGENATIONVALEROLACTONEOVERSELFREGENERATEDCUNICOBPALYGORSKITECATALYST GUO H 1 Introduction 2 Experimental 2.1 Materials 2.2 Catalyst preparation 2.3 Catalyst characterization 2.4 Catalytic tests and product analysis 3 Results and discussion 3.1 Hydrogenation active site screening 3.2 Metal/solid acid bifunctional catalysts screening 3.3 Effect of reaction solvent on BL hydrogenation 3.4 Characterization of the samples 3.5 BL hydrogenation reaction conditions optimization 3.6 Reaction pathway 3.7 Catalyst recycling test 4 Conclusions CRediT authorship contribution statement Acknowledgments Appendix A Supplementary data References COSTA 2020 21 25 F JING 2019 2520 2546 Y YAN 2015 986 997 K MARISCAL 2016 1144 1189 R SUN 2016 19 25 P GUO 2019 168 175 T FERNANDES 2012 199 204 D HALDER 2020 111119 M KONG 2017 180 185 X CAI 2016 1322 1331 B SUN 2018 488 498 M DENG 2019 3837 3848 T TANG 2014 827 834 X LI 2017 67 77 F CHEN 2018 5527 5535 B CUI 2018 1316 1320 J DU 2012 935 939 X PATANKAR 2015 2619 2630 S OBREGON 2017 328 341 I YI 2020 116208 Z KARANWAL 2020 766 787 N ZHANG 2019 189 197 C WANG 2017 168 178 R XIE 2017 107 114 Y JI 2020 111155 N YU 2019 3915 3930 Z HE 2016 11 19 J LIN 2018 54 63 Z YU 2020 1182 1201 Z CUETO 2020 4371 4383 J FENG 2020 109858 J XU 2019 6979 6983 H GUO 2015 51 61 H WU 2019 1269 1281 Z GUO 2019 14 H GUO 2019 1346 1356 H WANG 2020 1163 1170 R CHEN 2020 105498 Y JIANG 2014 260 264 J HERNANDO 2019 789 802 H WANG 2017 596 602 J TIAN 2020 1576 1586 H GUO 2018 498 511 H YU 2020 Z XIE 2018 641 647 L ODRISCOLL 2017 194 201 A WANG 2018 37243 37253 G FU 2017 248 255 Z GHASHGHAEE 2017 318 327 M GHASHGHAEE 2017 304 309 M GHASHGHAEE 2018 669 678 M GHASHGHAEE 2017 134 147 M GUNDEKARI 2018 215 227 S SCOTTI 2018 8344 8348 N SHIRVANI 2018 79 86 S SINGH 2018 1901 1923 S GONG 2018 5506 5514 W WANG 2018 7926 7933 Y YANG 2013 5328 5330 Z YAN 2013 3853 3856 K ZHANG 2017 5982 5993 J LI 2020 163 174 J GUO 2015 83 89 H GUO 2017 8755 8774 H LE 2019 18483 18492 S SCHOLTEN 1985 151 206 J LI 2000 211 221 H LI 2008 104 110 H BRUNO 2020 31123 31138 A LUO 2001 404 405 H WEI 2014 19253 W GUO 2018 130 139 H LI 1999 25 34 H LI 2006 1704 1708 H LI 2004 2741 2746 H SHEN 2016 1362 1368 Y GUO 2020 9463 9472 H REN 2016 5999 6003 D SHAO 2019 4499 4511 Y HENGNE 2012 779 787 A GUOX2021X111483 GUOX2021X111483XH 2023-03-02T00:00:00.000Z 2023-03-02T00:00:00.000Z http://creativecommons.org/licenses/by-nc-nd/4.0/ © 2021 Elsevier B.V. All rights reserved. 2021-02-19T10:03:02.933Z http://vtw.elsevier.com/data/voc/AddOnTypes/50.7/eoas Science and Technology Support Program of Jiangsu Province http://data.elsevier.com/vocabulary/SciValFunders/501100004610 http://sws.geonames.org/1814991 NSFC National Natural Science Foundation of China http://data.elsevier.com/vocabulary/SciValFunders/501100001809 http://sws.geonames.org/1814991 Guangdong Provincial Natural Science Foundation http://data.elsevier.com/vocabulary/SciValFunders/501100003453 http://sws.geonames.org/1814991 https://doi.org/10.15223/policy-017 https://doi.org/10.15223/policy-037 https://doi.org/10.15223/policy-012 https://doi.org/10.15223/policy-029 https://doi.org/10.15223/policy-004 item S2468-8231(21)00100-0 S2468823121001000 1-s2.0-S2468823121001000 10.1016/j.mcat.2021.111483 315758 2021-04-24T11:47:14.747452Z 2021-03-01 2021-03-31 1-s2.0-S2468823121001000-main.pdf https://s3-eu-west-1.amazonaws.com/prod-ucs-content-store-eu-west/content/pii:S2468823121001000/MAIN/application/pdf/c6942cdb76bc74def7215f98017eba54/main.pdf main.pdf pdf true 4512584 MAIN 12 1-s2.0-S2468823121001000-main_1.png https://s3-eu-west-1.amazonaws.com/prod-ucs-content-store-eu-west/content/pii:S2468823121001000/PREVIEW/image/png/6f390d4f3dcda286372fc67cc4259c20/main_1.png main_1.png png 54683 849 656 IMAGE-WEB-PDF 1 1-s2.0-S2468823121001000-gr11.jpg https://s3-eu-west-1.amazonaws.com/prod-ucs-content-store-eu-west/content/pii:S2468823121001000/gr11/DOWNSAMPLED/image/jpeg/0c6f270b9177a0eaa3dde8cfee43f39d/gr11.jpg gr11 gr11.jpg jpg 46054 452 566 IMAGE-DOWNSAMPLED 1-s2.0-S2468823121001000-gr12.jpg https://s3-eu-west-1.amazonaws.com/prod-ucs-content-store-eu-west/content/pii:S2468823121001000/gr12/DOWNSAMPLED/image/jpeg/432bf7c45c7546dfe0ba7cd37f6fde71/gr12.jpg gr12 gr12.jpg jpg 43056 475 339 IMAGE-DOWNSAMPLED 1-s2.0-S2468823121001000-gr2.jpg https://s3-eu-west-1.amazonaws.com/prod-ucs-content-store-eu-west/content/pii:S2468823121001000/gr2/DOWNSAMPLED/image/jpeg/53a8a012b84c3b8e8d4f64473c2841fb/gr2.jpg gr2 gr2.jpg jpg 77744 799 339 IMAGE-DOWNSAMPLED 1-s2.0-S2468823121001000-gr3.jpg https://s3-eu-west-1.amazonaws.com/prod-ucs-content-store-eu-west/content/pii:S2468823121001000/gr3/DOWNSAMPLED/image/jpeg/60efdc446b55c012a9b0defe582b0be4/gr3.jpg gr3 gr3.jpg jpg 49058 522 339 IMAGE-DOWNSAMPLED 1-s2.0-S2468823121001000-gr10.jpg https://s3-eu-west-1.amazonaws.com/prod-ucs-content-store-eu-west/content/pii:S2468823121001000/gr10/DOWNSAMPLED/image/jpeg/19b510110fd57b4bef830c085ceb4d91/gr10.jpg gr10 gr10.jpg jpg 79091 855 339 IMAGE-DOWNSAMPLED 1-s2.0-S2468823121001000-gr1.jpg https://s3-eu-west-1.amazonaws.com/prod-ucs-content-store-eu-west/content/pii:S2468823121001000/gr1/DOWNSAMPLED/image/jpeg/5ac1dfbfb5ac2f0d9e5803742ef4693e/gr1.jpg gr1 gr1.jpg jpg 99778 527 679 IMAGE-DOWNSAMPLED 1-s2.0-S2468823121001000-gr6.jpg https://s3-eu-west-1.amazonaws.com/prod-ucs-content-store-eu-west/content/pii:S2468823121001000/gr6/DOWNSAMPLED/image/jpeg/1671920386a05c5260df4a3ca0f53a5a/gr6.jpg gr6 gr6.jpg jpg 55670 507 339 IMAGE-DOWNSAMPLED 1-s2.0-S2468823121001000-gr7.jpg https://s3-eu-west-1.amazonaws.com/prod-ucs-content-store-eu-west/content/pii:S2468823121001000/gr7/DOWNSAMPLED/image/jpeg/a822de6969f8c2cebb7c5c9d73071f71/gr7.jpg gr7 gr7.jpg jpg 81879 785 339 IMAGE-DOWNSAMPLED 1-s2.0-S2468823121001000-gr4.jpg https://s3-eu-west-1.amazonaws.com/prod-ucs-content-store-eu-west/content/pii:S2468823121001000/gr4/DOWNSAMPLED/image/jpeg/c6fd097214c92b5a841ed6f7104a1e46/gr4.jpg gr4 gr4.jpg jpg 38343 521 339 IMAGE-DOWNSAMPLED 1-s2.0-S2468823121001000-gr5.jpg https://s3-eu-west-1.amazonaws.com/prod-ucs-content-store-eu-west/content/pii:S2468823121001000/gr5/DOWNSAMPLED/image/jpeg/b3cbb2c92879b0f1b7b521d68af2bd59/gr5.jpg gr5 gr5.jpg jpg 26074 266 340 IMAGE-DOWNSAMPLED 1-s2.0-S2468823121001000-gr8.jpg https://s3-eu-west-1.amazonaws.com/prod-ucs-content-store-eu-west/content/pii:S2468823121001000/gr8/DOWNSAMPLED/image/jpeg/5d89a3180f37677a4917a26d0adb8233/gr8.jpg gr8 gr8.jpg jpg 68489 378 566 IMAGE-DOWNSAMPLED 1-s2.0-S2468823121001000-gr9.jpg https://s3-eu-west-1.amazonaws.com/prod-ucs-content-store-eu-west/content/pii:S2468823121001000/gr9/DOWNSAMPLED/image/jpeg/616ce405d1b792d6d4507f28244560b6/gr9.jpg gr9 gr9.jpg jpg 27618 264 339 IMAGE-DOWNSAMPLED 1-s2.0-S2468823121001000-ga1.jpg https://s3-eu-west-1.amazonaws.com/prod-ucs-content-store-eu-west/content/pii:S2468823121001000/ga1/DOWNSAMPLED/image/jpeg/5b77f1af3346a8cd8fd46a17801fd657/ga1.jpg ga1 true ga1.jpg jpg 21814 200 352 IMAGE-DOWNSAMPLED 1-s2.0-S2468823121001000-gr11.sml https://s3-eu-west-1.amazonaws.com/prod-ucs-content-store-eu-west/content/pii:S2468823121001000/gr11/THUMBNAIL/image/gif/e81ed199c4008f450e6176d1f891a11c/gr11.sml gr11 gr11.sml sml 8760 164 205 IMAGE-THUMBNAIL 1-s2.0-S2468823121001000-gr12.sml https://s3-eu-west-1.amazonaws.com/prod-ucs-content-store-eu-west/content/pii:S2468823121001000/gr12/THUMBNAIL/image/gif/3e32c7289de91f44dd2b43b1bb100e2f/gr12.sml gr12 gr12.sml sml 6102 164 117 IMAGE-THUMBNAIL 1-s2.0-S2468823121001000-gr2.sml https://s3-eu-west-1.amazonaws.com/prod-ucs-content-store-eu-west/content/pii:S2468823121001000/gr2/THUMBNAIL/image/gif/f412e9ad4a3a1f55b8018b44fb9b34ff/gr2.sml gr2 gr2.sml sml 4811 163 69 IMAGE-THUMBNAIL 1-s2.0-S2468823121001000-gr3.sml https://s3-eu-west-1.amazonaws.com/prod-ucs-content-store-eu-west/content/pii:S2468823121001000/gr3/THUMBNAIL/image/gif/6b5c9550df15759c40a05a417524ecbf/gr3.sml gr3 gr3.sml sml 5956 163 106 IMAGE-THUMBNAIL 1-s2.0-S2468823121001000-gr10.sml https://s3-eu-west-1.amazonaws.com/prod-ucs-content-store-eu-west/content/pii:S2468823121001000/gr10/THUMBNAIL/image/gif/82476d04d8c62ebc48a74c0ed9b0ad76/gr10.sml gr10 gr10.sml sml 4429 164 65 IMAGE-THUMBNAIL 1-s2.0-S2468823121001000-gr1.sml https://s3-eu-west-1.amazonaws.com/prod-ucs-content-store-eu-west/content/pii:S2468823121001000/gr1/THUMBNAIL/image/gif/f2f1775d05c437d0b0cf89ec227e1868/gr1.sml gr1 gr1.sml sml 13454 164 211 IMAGE-THUMBNAIL 1-s2.0-S2468823121001000-gr6.sml https://s3-eu-west-1.amazonaws.com/prod-ucs-content-store-eu-west/content/pii:S2468823121001000/gr6/THUMBNAIL/image/gif/6604615053ba2c416cbbfbd91eccd649/gr6.sml gr6 gr6.sml sml 8048 163 109 IMAGE-THUMBNAIL 1-s2.0-S2468823121001000-gr7.sml https://s3-eu-west-1.amazonaws.com/prod-ucs-content-store-eu-west/content/pii:S2468823121001000/gr7/THUMBNAIL/image/gif/bb597a28d0368ac665aeaa0c306c3241/gr7.sml gr7 gr7.sml sml 5877 162 70 IMAGE-THUMBNAIL 1-s2.0-S2468823121001000-gr4.sml https://s3-eu-west-1.amazonaws.com/prod-ucs-content-store-eu-west/content/pii:S2468823121001000/gr4/THUMBNAIL/image/gif/91a2a787436362479e62c37978d76b2e/gr4.sml gr4 gr4.sml sml 4569 163 106 IMAGE-THUMBNAIL 1-s2.0-S2468823121001000-gr5.sml https://s3-eu-west-1.amazonaws.com/prod-ucs-content-store-eu-west/content/pii:S2468823121001000/gr5/THUMBNAIL/image/gif/7ac14d1c487f0bc4d5e7fc1e2d647cdd/gr5.sml gr5 gr5.sml sml 10610 164 210 IMAGE-THUMBNAIL 1-s2.0-S2468823121001000-gr8.sml https://s3-eu-west-1.amazonaws.com/prod-ucs-content-store-eu-west/content/pii:S2468823121001000/gr8/THUMBNAIL/image/gif/2e3261ba6d1430fb4471afcad8568471/gr8.sml gr8 gr8.sml sml 21987 146 219 IMAGE-THUMBNAIL 1-s2.0-S2468823121001000-gr9.sml https://s3-eu-west-1.amazonaws.com/prod-ucs-content-store-eu-west/content/pii:S2468823121001000/gr9/THUMBNAIL/image/gif/66da5f60a116fc337dc37594c641df3c/gr9.sml gr9 gr9.sml sml 9205 164 210 IMAGE-THUMBNAIL 1-s2.0-S2468823121001000-ga1.sml https://s3-eu-west-1.amazonaws.com/prod-ucs-content-store-eu-west/content/pii:S2468823121001000/ga1/THUMBNAIL/image/gif/d6351206e152941bd5f67f928160426a/ga1.sml ga1 true ga1.sml sml 11245 124 219 IMAGE-THUMBNAIL 1-s2.0-S2468823121001000-mmc1.docx https://s3-eu-west-1.amazonaws.com/prod-ucs-content-store-eu-west/content/pii:S2468823121001000/mmc1/MAIN/application/vnd.openxmlformats-officedocument.wordprocessingml.document/e362f70d307872af75f0e9171ad1b978/mmc1.docx mmc1 mmc1.docx docx 2287467 APPLICATION 1-s2.0-S2468823121001000-si1.svg https://s3-eu-west-1.amazonaws.com/prod-ucs-content-store-eu-west/content/pii:S2468823121001000/STRIPIN/image/svg+xml/6e3973bc293110c7edbb7fc40554dbd7/si1.svg si1 si1.svg svg 4206 ALTIMG 1-s2.0-S2468823121001000-si2.svg https://s3-eu-west-1.amazonaws.com/prod-ucs-content-store-eu-west/content/pii:S2468823121001000/STRIPIN/image/svg+xml/918ff0c027be110a11a0472d12bc36b5/si2.svg si2 si2.svg svg 2591 ALTIMG 1-s2.0-S2468823121001000-si3.svg https://s3-eu-west-1.amazonaws.com/prod-ucs-content-store-eu-west/content/pii:S2468823121001000/STRIPIN/image/svg+xml/de27a3311347ee151af0f9e93969517e/si3.svg si3 si3.svg svg 2891 ALTIMG 1-s2.0-S2468823121001000-am.pdf am am.pdf pdf 1829837 AAM-PDF https://s3-eu-west-1.amazonaws.com/prod-ucs-content-store-eu-west/content/egi:107GBCN2RN0/MAIN/application/pdf/7eb12c158e761e5bde2b44611dcd0a9b/am.pdf MCAT 111483 111483 S2468-8231(21)00100-0 10.1016/j.mcat.2021.111483 Elsevier B.V. Fig. 1 N2 adsorption/desorption isotherms (A), BJH pore size distribution (B), XRD patterns (C) and FE-SEM images (D) of different samples. (a) H+-ATP, (b) Cu0.5Ni1Co1B, (c) Cu0.5Ni1Co1B/H+-PAL, (d) Cu0.25Mo0.25Ni1Co1B/H+-PAL. Fig. 1 Fig. 2 Ni 2p, Co 2p, and B 1 s XPS spectra of different catalysts: (a) Cu0.5Ni1Co1B; (b) Cu0.5Ni1Co1B/H+-PAL; (c) Cu0.25Mo0.25Ni1Co1B/H+-PAL. Fig. 2 Fig. 3 Cu 2p and Cu LMM XPS spectra of different catalysts: (a) Cu0.5Ni1Co1B; (b) Cu0.5Ni1Co1B/H+-PAL; (c) Cu0.25Mo0.25Ni1Co1B/H+-PAL. Fig. 3 Fig. 4 H2-TPD patterns (A) and NH3-TPD patterns (B) of different catalysts: (a) Cu0.5Ni1Co1B; (b) Cu0.5Ni1Co1B/H+-PAL; (c) Cu0.25Mo0.25Ni1Co1B/H+-PAL. Fig. 4 Fig. 5 FTIR spectra of pyridine adsorbed on (a) H+-PAL, (b) Cu0.5Ni1Co1B/H+-PAL and (c) Cu0.25Mo0.25Ni1Co1B/H+-PAL. Fig. 5 Fig. 6 Influences of (a) catalyst dosage and (b) reaction temperature on BL hydrogenation performances over Cu0.25Mo0.25Ni1Co1B/H+-PAL catalyst. Fig. 6 Fig. 7 Influences of reaction time on BL hydrogenation performances over (a) Cu0.5Ni1Co1B, (b) Cu0.5Ni1Co1B/H+-PAL and (c) Cu0.25Mo0.25Ni1Co1B/H+-PAL catalysts. Reaction conditions: BL 5 mL (28.3 mmol), catalyst a 0.146 g (b and c 0.73 g), CH 55 mL; 200 °C, H2 3 MPa, 800 rpm. Fig. 7 Fig. 8 HRTEM images of (a) Cu0.5Ni1Co1B/H+-PAL and (b) Cu0.25Mo0.25Ni1Co1B/H+-PAL catalysts before BL hydrogenation reaction (a1、b1) and after reaction for 6 h (a2、b2). Fig. 8 Fig. 9 XRD patterns of (a) Cu0.5Ni1Co1B/H+-PAL and (b) Cu0.25Mo0.25Ni1Co1B/H+-PAL catalysts before BL hydrogenation reaction (a1, b1) and after reaction for 6 h (a2, b2). Fig. 9 Fig. 10 XPS spectra of (a) Cu0.5Ni1Co1B/H+-PAL and (b) Cu0.25Mo0.25Ni1Co1B/H+-PAL catalysts before BL hydrogenation reaction (a1, b1) and after reaction for 6 h (a2, b2). Fig. 10 Fig. 11 BL hydrogenation reaction routes over H+-PAL supported Cu(M)NiCoB catalysts. Fig. 11 Fig. 12 Effect of catalyst recycling on BL hydrogenation performances over (a) Cu0.5Ni1Co1B/H+-PAL and (b) Cu0.25Mo0.25Ni1Co1B/H+-PAL catalysts. Reaction condition: BL 1 mL (5.66 mmol), CH 24 mL, catalyst 0.146 g, 200 °C, H2 3 MPa, 800 rpm, 3 h. Fig. 12 Table 1 Screening of the CuNiCoB hydrogenation active site for BL hydrogenation to GVL. a Table 1 Catalyst BL conversion (%) GVL selectivity (%) GVL yield (%) Ni1Co1B 40.8 86.4 35.3 Cu0.1Ni1Co1B 27.9 80.1 22.3 Cu0.3Ni1Co1B 45.2 82.3 37.2 Cu0.5Ni1Co1B 72.1 83.2 60.0 Cu1Ni1Co1B 45.4 73.2 33.2 Cu2Ni1Co1B 21.2 71.5 15.2 CuB 2.7 99.5 2.7 a Reaction conditions: VBL/CH = 1/24 (mL/mL), catalyst 0.0292 g (3 wt%), 200 °C, 3 MPa H2, 200 rpm, 3 h. Table 2 BL hydrogenation performances over Cu0.5Ni1Co1B and H+-PAL supported catalysts. a Table 2 Catalyst BL conversion (%) TOF (h−1) b Selectivity (%) n-PeOH GVL BV 1,4-PDO Cu0.5Ni1Co1B 71.6 10.9 0 81.7 0 0 Cu0.5Ni1Co1B/H+-PAL 98.2 12.4 0.2 77.1 0 0 Cu0.25Mo0.25Ni1Co1B/H+-PAL 98.1 11.8 0.8 66.0 0 2.7 Cu0.25La0.25Ni1Co1B/H+-PAL 100 - c 0.5 69.4 0 0 Cu0.25Zn0.25Ni1Co1B/H+-PAL 100 – 1.1 63.8 0 0.6 Cu0.25Fe0.25Ni1Co1B/H+-PAL 100 – 3.9 59.1 0 0.6 Cu0.25Ce0.25Ni1Co1B/H+-PAL 100 – 0.9 68.5 0.3 0.4 Cu0.25Zr0.25Ni1Co1B/H+-PAL 100 – 1.9 53.4 1.3 0.7 a Reaction conditions: VBL/CH = 1/24 (mL/mL), catalyst 0.0292 g (Cu0.5Ni1Co1B) and 0.1461 g (H+-PAL supported catalysts), 180 °C, 3 MPa H2, 800 rpm, 3 h. b TOF is defined as the mole number of GVL generated per hour per metal site, metal sites refer to the total amount of Cu(Mo), Ni and Co sites determined by ICP-OES. c uncalculated. Table 3 Effects of reaction solvent on BL hydrogenation performances. a Table 3 Reaction solvent BL conversion (%) Selectivity (%) GVL yield (%) GVL 1,4-PDO Methanol 37.6 96.4 0 36.2 Ethanol 95.0 82.7 0 78.6 n-propanol 88.9 63.0 0 56.0 Water 80.5 55.6 0 44.8 Cyclohexane/Water (1/1, v/v) 95.5 68.6 0 65.5 Cyclohexane 99.7 96.6 2.2 96.3 n-hexane 100 85.4 1.7 85.4 1, 4-dioxane 99.7 88.7 1.4 88.4 a Reaction conditions: BL (1 mL), solvent (24 mL), catalyst 0.1461 g (Cu0.5Ni1Co1B/H+-PAL), 200 °C, 3 MPa H2, 800 rpm, 3 h. Improvement on the catalytic performances of butyl levulinate hydrogenation to γ-valerolactone over self-regenerated CuNiCoB/Palygorskite catalyst Haijun Guo Methodology Formal analysis Investigation Writing - original draft Funding acquisition a b c d e Shuai Ding Investigation Formal analysis a c d e f Hairong Zhang Methodology Validation Resources Funding acquisition a c d e Can Wang Investigation Validation a c d e Fen Peng Investigation Formal analysis Funding acquisition a c d e Lian Xiong Conceptualization Writing - review & editing a c d e Xinde Chen Supervision Conceptualization Project administration Writing - review & editing a c d e * Xinping Ouyang Supervision Conceptualization Funding acquisition Writing - review & editing b ** a Guangzhou Institute of Energy Conversion, Chinese Academy of Sciences, Guangzhou, 510640, Guangdong, China Guangzhou Institute of Energy Conversion Chinese Academy of Sciences Guangzhou Guangdong 510640 China Guangzhou Institute of Energy Conversion, Chinese Academy of Sciences, Guangzhou 510640, Guangdong, China b School of Chemistry & Chemical Engineering, South China University of Technology, Guangzhou, 510640, Guangdong, China School of Chemistry & Chemical Engineering South China University of Technology Guangzhou Guangdong 510640 China School of Chemistry & Chemical Engineering, South China University of Technology, Guangzhou 510640, Guangdong, China c Key Laboratory of Renewable Energy, Chinese Academy of Sciences, Guangzhou, 510640, Guangdong, China Key Laboratory of Renewable Energy Chinese Academy of Sciences Guangzhou Guangdong 510640 China Key Laboratory of Renewable Energy, Chinese Academy of Sciences, Guangzhou 510640, Guangdong, China d Guangdong Provincial Key Laboratory of New and Renewable Energy Research and Development, Guangzhou, 510640, Guangdong, China Guangdong Provincial Key Laboratory of New and Renewable Energy Research and Development Guangzhou Guangdong 510640 China Guangdong Provincial Key Laboratory of New and Renewable Energy Research and Development, Guangzhou 510640, Guangdong, China e R&D Center of Xuyi Attapulgite Energy and Environmental Materials, Guangzhou Institute of Energy Conversion, Chinese Academy of Sciences, Xuyi, 211700, Jiangsu, China R&D Center of Xuyi Attapulgite Energy and Environmental Materials Guangzhou Institute of Energy Conversion Chinese Academy of Sciences Xuyi Jiangsu 211700 China R&D Center of Xuyi Attapulgite Energy and Environmental Materials, Guangzhou Institute of Energy Conversion, Chinese Academy of Sciences, Xuyi 211700, Jiangsu, China f Nano Science and Technology Institute, University of Science and Technology of China, Suzhou, 215123, Jiangsu, China Nano Science and Technology Institute University of Science and Technology of China Suzhou Jiangsu 215123 China Nano Science and Technology Institute, University of Science and Technology of China, Suzhou 215123, Jiangsu, China ⁎ Corresponding author at: No. 2 Nengyuan Road, Tianhe District, Guangzhou, 510640, China. No. 2 Nengyuan Road Tianhe District Guangzhou 510640 China ⁎⁎ Corresponding author at: No. 381 Wushan Road, Tianhe District, Guangzhou, 510641, China. No. 381 Wushan Road Tianhe District Guangzhou 510641 China Graphical abstract Butyl levulinate (BL) hydrogenation to γ-valerolactone (GVL) was effectively enhanced over a stable and magnetic Cu0.25Mo0.25Ni1Co1B/H+-PAL catalyst by the synergistic effect between the CuMoNiCoB and Cu2O/Cu hydrogenation sites and the acid sites of H+-PAL. The acid-activated Palygorskite (H+-PAL) was applied to support Cu(M)NiCoB amorphous alloy catalysts with high-activity and self-regeneration ability for selective hydrogenation of butyl levulinate (BL) to γ-valerolactone (GVL). The catalysts were characterized by ICP-OES, nitrogen physisorption, XRD, FE-SEM, TEM, XPS, H2-TPD, NH3-TPD and FTIR-pyridine adsorption techniques. Compared to the unsupported Cu0.5Ni1Co1B catalyst, the Cu0.5Ni1Co1B/H+-PAL catalyst showed the highest GVL yield of 96.3 % with BL conversion of 99.7 % at 200 °C. When Mo was doped into the Cu0.5Ni1Co1B/H+-PAL catalyst, the GVL yield showed gradually increase to 95.7 % with BL conversion of 100 % after five times run. The high activity and self-regeneration ability was attributed to the Mo doping effect and the synthetic effect between Cu hydrogenation active species and H+-PAL support. Various characterization results indicated that Mo acted as both structural promoter to improve the dispersion of metallic Cu and CuMoNiCoB amorphous alloy and electronic promoter to enhance the formation and increase the fraction of Cu+ species. In addition, the incorporation of Mo provided more Lewis acid sites to promote BL conversion to GVL and GVL conversion to 1,4-PDO and n-PeOH. On the basis of characterization and catalytic performance testing results, the synergistic effect between CuMoNiCoB amorphous alloy and Cu2O/Cu hydrogenation sites and Lewis/Brønsted acid site of H+-PAL support is considered to be the key to produce GVL. Keywords Catalytic hydrogenation Butyl levulinate CuNiCoB amorphous alloy Acid-activated palygorskite γ-Valerolactone 1 Introduction In view of the gradual increase of fossil fuel consumption and environmental pollution, the development of sustainable and clean energy derived from lignocellulosic biomass becomes more and more important [1,2]. Levulinic acid (LA), one of the top 12 potential bio-based platform chemicals, can be produced from the dehydration of hexose in acidic aqueous solution or the hydrolysis/alcoholysis of furfuryl alcohol (FA) derived from the hydrogenation of pentose [3,4]. Because of the reaction activity of unsaturated acetyl group (CH3CO‒) and carboxyl group (−COOH) in the molecular structure, LA can be directly converted into γ-valerolactone (GVL) and levulinate esters (LE) through hydrogenation and esterification reaction, respectively [3,5–9]. Furthermore, LA and LE including methyl levulinate (ML) [10,11], ethyl levulinate (EL) [10,12,13] and butyl levulinate (BL) [14,15] have been widely applied to produce 1,4-pentanediol (1,4-PDO) [16], 2-Methyltetrahydrofuran (2-MTHF) [17–19], valeric esters [20], valeric acid [21], etc. via the GVL intermediate [22–25]. Therefore, LA and LE play an important role in connecting renewable lignocellulosic biomass with biofuels and biochemical. Generally speaking, the cascade reaction involving in the transformation of LA and LE to GVL is regarded as a typical bifunctional catalytic process, that the metal-catalyzed hydrogenation step and the acid-catalyzed dehydration (or dealcoholization) and lactonization step [26–28]. At present, five categories of acid supports have been reported, including oxides (ZrO2, TiO2, Al2O3, SiO2 etc.), molecular sieves (ZrMCM-41, SnO2/SBA-15, H-β, HZSM-5, H-MFI, etc.), Metal-Organic Frameworks (MOFs) and their derivatives (UiO-66-SO3H, zirconium-cyanuric acid coordination polymer (Zr-CA), MIL-101(Cr), MOF derived carbon, etc.), Acid functionalized carbons (ordered mesoporous carbon (OMC), benzenesulfonic acid-functionalized reduced grapheme oxide (rCO)) and Acidic resins (DOWEX 50WX2-100, sulfonated polyethersulfone (SPES) resin, Amberlyst-70, etc.) [28–32]. The acidity type (Lewis and Brønsted acidity) and intensity of these supports have a large effect on the catalytic activity and GVL selectivity. In order to reduce the catalyst cost and operability, metallic oxides are regarded as much promising catalyst support for industrial application. However, compared to the SnO2/SBA-15 which has both Lewis (L) and Brønsted (B) acidity, the transition metal oxides, specifically, ZrO2, Al2O3 and SnO2, which only exhibited Lewis acidity was not suitable to improve the GVL yield [29]. Therefore, the oxide support with lower cost, higher accessibility and more importantly, suitable Lewis/Brønsted ratio is the basics for developing bifunctional catalysts. In recent years, Palygorskite (PAL, or Attapulgite as it often called), with a theoretical formula of Mg5Si8O20(OH)2(OH2)4·4H2O and fibrous structure, has been widely applied in heterogeneous catalysis as a catalyst or catalyst support [33–39]. PAL can be effectively modified to own higher surface area and pore volume through acid activation. The surface acidity can also be adjusted to obtain coexisting Brønsted and Lewis acidity sites which are generated from the structural hydroxyl groups in the layer structure of PAL and exposed Al3+, respectively [40]. Accordingly, the acid-activated PAL has been applied in different acid-catalyzed fields [37,39,41,42]. Except for the specific textures and surface acidity of PAL, the intrinsic SiO2 and Al2O3 contribute to adjust the interactions between metals and support, thus improving the dispersion of active metals and enhancing the catalytic activity. In our previous work, the acid-activated PAL (H+-PAL) supported NiCoB amorphous alloy catalysts showed excellent hydrogenation activity and stability for furfural (FUR) conversion into furfuryl alcohol (FA) [43]. The best catalyst (20%NiCoB/H+-PAL) showed an increase of 3.9 % in FUR conversion and 8.2 % in FA selectivity after six cycles due to the newly generated CoNi alloy active site. But as far as we know, the acid-activated PAL has not been applied in BL hydrogenation. In addition to the acidity of catalyst support, the metal loads, particle sizes as well as the dispersion of hydrogenation active metal are also very important control parameters in order to obtain a higher GVL yield. The precious metals, such as Ru, Rh, Pt, Ir, Au-Pd, etc. have displayed superior catalytic activity in FUR and BL hydrogenation reaction [44–47]. As a popular substitute for precious metals, the Ni-based, Cu-based or Ni-Cu-based catalysts have been extensively used due to low cost and high availability [48–59]. A hydrotalcite-like compounds (HTlcs) derived Cu-based catalyst achieved high GVL yield of 91 % from LA at 200 °C under 7.0 MPa H2 after 10 h [60]. Another magnetic and recyclable Ni4.59Cu1Mg1.58Al1.96Fe0.70 catalyst with HTlcs structure could yield 98.1 % of GVL from LA through the catalytic transfer hydrogenation (CTH) reaction using methanol as the H-donor at 142 °C after 3 h [61]. Furthermore, some oxides were also applied to support active metals to improve the catalyst activity and stability. The Al2O3 supported bimetallic Cu-Ni catalyst (10Cu-5Ni/Al2O3) had the highest activity for CTH of EL to GVL, providing a 97 % yield of GVL in 12 h at 150 °C [10], and another 10Cu-10Ni/Al2O3 catalyst showed a higher 2-methylfuran yield of 92 % from the CTH reaction of FUR with formic acid as a hydrogen donor [48]. The ZrO2-Al2O3 composite supported Cu catalyst, which possesses ternary active sites (metal active sites Cu°, oxygen deficiencies derived from ZrO2, and acidic Al2O3), displayed superior catalytic activity and excellent recycling stability for GVL synthesis from LA at low temperature due to the intimate synergies of these ternary active sites [62]. In a word, the bifunctional Ni-Cu-based catalysts including an acid support is a promising candidate for the cascade conversion reaction of LA and LE. In our previous work, in order to reduce the catalyst usage and reaction time, a highly active, low-cost and magnetic CuNiCoB amorphous alloy catalyst was applied for BL hydrogenation to GVL [15]. The best catalyst Cu0.5Ni1Co3B (3 wt% relative to BL) showed the highest GVL yield of 89.5 % with BL conversion of 99.7 % at 200 °C under 3.0 MPa. Nevertheless, there still exist some drawbacks of the previous catalyst such as harsh reaction conditions, low catalyst stability and partial loss of B species due to the lower surface area of Cu0.5Ni1Co3B amorphous alloy. The successful solution of these disadvantages of CuNiCoB amorphous alloy catalyst will provide a high-efficiency and environmental friendly catalyst for industrial application in lignocellulosic biomass conversion. Therefore, the CuNiCoB amorphous alloy catalyst was strongly expected to be loaded on a support with high surface area and suitable acidity to further improve the reaction efficiency of BL hydrogenation to GVL. Herein, Cu modified Ni1Co1B amorphous alloy catalysts with different Cu addition content were firstly prepared by chemical reduction method and evaluated through BL hydrogenation reaction to obtain the optimal CuNiCoB hydrogenation active site. H+-PAL was applied to load CuNiCoB amorphous alloy catalyst to enhance the activity and stability. Moreover, several third metals promoted H+-PAL supported CuNiCoB amorphous alloy catalyst were also prepared, characterized and tested for the BL hydrogenation reaction. The influences of the reaction conditions, the stability and recyclability of the catalysts were investigated. 2 Experimental 2.1 Materials Butyl levulinate (BL, 98 %), 1,4-pentanediol (1,4-PDO, 98 %) and NaBH4 (98 %) were purchased from Aladdin Reagent Co. Ltd. (Shanghai, China); γ-valerolactone (GVL, 98 %) from Macklin biochemical Co. Ltd. (Shanghai, China); Butyl valerate (BV, 98 %) from TCI Co. Ltd. (Shanghai, China). Copper chloride (CuCl2·6H2O), Nickel chloride (NiCl2·6H2O), Cobalt chloride (CoCl2·6H2O), Ammonium molybdate tetrahydrate ((NH4)6Mo7O24·4H2O), n-Butyl alcohol (n-BuOH) and Absolute ethyl alcohol (EtOH) were purchased from Sinopharm Chemical Reagent Co., Ltd. (Shanghai, China). n-Propyl alcohol (n-PrOH), Lanthanum nitrate (La(NO3)3·6H2O), Cerium nitrate (Ce(NO3)3·6H2O) and zirconium nitrate (Zr(NO3)4·5H2O) were purchased from Tianjin Kemiou Chemical Reagent Co., Ltd. (Tianjin, China). Methanol (MeOH), n-Pentyl alcohol (n-PeOH), cyclohexane (CH), n-Hexane and 1, 4-dioxane were purchased from Tianjin Fuyu Fine Chemical Co., Ltd. (Tianjin, China). Zinc nitrate (Zn(NO3)2.6H2O) and Ferric nitrate (Fe(NO3)3.9H2O) were purchased from Damao Chemical Reagent Factory (Tianjin, China). Natural palygorskite was provided by ZHONGKE New Energy Technological Development Co., Ltd (Huai-An, China). The H+-PAL was prepared according to the previous procedure with the acid concentration of 21 wt% [63]. All reagents were used without any further purification. 2.2 Catalyst preparation The Ni1Co1B amorphous alloy catalyst with Ni/Co molar ratio of 1/1, CuB catalyst and Cu modified Ni1Co1B catalyst with Cu/Ni molar ratio of x/1 (denoted as CuxNi1Co1B) were prepared by the chemical reduction method [64]. The following study results showed that Cu0.5Ni1Co1B is the optimized Cu0.5Ni1Co1B hydrogenation active site. The H+-PAL supported Cu0.5Ni1Co1B catalyst with a loading content of 20 wt% (named as Cu0.5Ni1Co1B/H+-PAL) was prepared by the impregnation-reduction method. Typically, 10 g H+-PAL powder (>100 mesh) was equivalent-volume impregnated with an aqueous solution of 1.43 g CuCl2·2H2O, 3.98 g NiCl2·6H2O and 3.98 g CoCl2·6H2O under vacuum for 24 h at room temperature. It was then dried at 120 °C for 1 h, and then dried at 80 °C for 6 h. The obtained precursor powder (>100 mesh) was reduced by dropwise adding 77.3 mL 2.0 M NaBH4 aqueous solution containing 0.2 M NaOH with vigorous stirring in an ice-water bath under consecutive nitrogen flow. After stirring for 3.0 h, the resulting precipitate was washed with deionized water several times until neutral, followed by washing with absolute ethyl alcohol three times to remove the residual water and water-soluble impurities. Finally, the obtained catalyst was kept in absolute ethyl alcohol for future use. Those different metal (M = Mo, La, Zn, Fe, Ce and Zr) promoted Cu0.5NiCoB/H+-PAL catalysts (named as Cu0.25M0.25Ni1Co1B/H+-PAL) with Cu/M/Ni/Co molar ratio of 0.25/0.25/1/1 and loading content of 20 wt% were also prepared according to the above procedure by dissolving their metal salt together with chloride of Cu, Ni and Co. 2.3 Catalyst characterization The ASIQMO002-2 analyzer (Quantachrome, US) was used to determine the surface area (SBET), total pore volume (Vp), and average pore diameter (Dp) of the catalysts by adsorption and desorption of nitrogen at −196 °C. Before performing the measurement, the samples were degassed at 80 °C for 6 h to remove impurities. The D/max-RA X-ray diffractometer (Rigaku, Japan) was applied to detect the X-ray diffraction (XRD) patterns of catalysts using Cu Kα radiation (λ =0.154 nm) at 40 kV and 40 mA on a 2θ range of 5–80 °. The Hitachi S-4800 high resolution Field Emission Scanning Electron Microscope (FE-SEM, Hitachi, Japan) was used to observe the morphology of catalysts at 2.0 kV and 10 μA. The high-resolution transmission electron microscopy (HRTEM) analysis and selected-area electron diffraction (SAED) of catalysts were performed on a Model JEM-2100 F microscope (JEOL, Japan) [43]. The X-ray photoelectron spectroscopy (XPS) measurement was carried out on an ESCALAB 250Xi spectrometer (Thermo Fisher Scientific Inc, US) with the monochromatic Al Kα radiation (1486 eV) X-ray resource to determine the surface atomic ratios and valence states of elements of the catalysts. The binding energies (BE) were calibrated using the C 1s spectrum (BE of 284.6 eV) [65]. Hydrogen temperature programmed desorption (H2-TPD) and Ammonia temperature programmed desorption (NH3-TPD) of catalysts was carried out on a DAS-7000 multifunctional dynamic adsorption instrument (Hunan Huasi Instrument Co. Ltd., China) from 50 to 800 °C. The desorbed hydrogen and ammonia was recorded by a thermal conduct detector (TCD). Fourier transform infrared spectroscopy (FTIR) of pyridine adsorption technique was performed on a TENSOR 27 FTIR spectrometer (Bruker, US). The sample (6～15 mg) circle sheet was prepared by tableting at pressure of 15 MPa. Before adsorption, the samples were heated at 350 °C for 30 min in vacuum to remove water adsorbed on the surface, and then cooled to 100 °C. Afterwards, the samples were exposed to 1 mL of liquid pyridine for 15 min. The IR spectra were recorded at 100 °C after evacuation for 15 min. 2.4 Catalytic tests and product analysis The BL hydrogenation reaction was carried out in a 100 mL YZPR-100 (M) stainless steel autoclave equipped with an electrical heating jacket and a mechanical stirrer. Before reaction, the catalyst was dried at room temperature under vacuum for 1 h, and then levigated and sieved to > 100 mesh. In a typical catalytic test, BL (1 mL, 0.974 g, 5.66 mmol), catalyst powder (0.0292 g Cu0.5Ni1Co1B or 0.1461 g Cu0.5Ni1Co1B/H+-PAL) and cyclohexane (24 mL) were added into the reactor and uniformly mixed. After removing the air in the reactor by repetitively filling N2 four times and H2 three times, the reactor was filled with an initial hydrogen pressure of 3.0 MPa and was heated to 200 °C at a rate of 5 °C/min. After reaction for 3 h under a stirring rate of 800 rpm, the product and catalyst were seperated by a magnet. The spent catalyst was washed by cyclohexane for three times and absolute ethyl alcohol for three times, subsequently was stored in absolute ethyl alcohol for next use. The liquid products were qualitatively analyzed by a TRACE 1300-ISQ gas chromatography - mass spectrometry (GC–MS) (Thermo Fisher Scientific Inc, US) equipped with an Agilent HP-5 MS column (5% phenyl methyl silox, 30 m ×0.25 mm ×0.25 μm). Helium (99.999 %) was used as the carrier gas. The column temperature was programmed from 50 °C to 250 °C at 10 °C/min and held for 10 min. The chemical compositions were identified through a mass spectral library (NIST 2014). The quantitative analysis of liquid product was carried out on a GC 9900 gas chromatograph (Jiafen, Beijing in China; Column: FFAP, 30 m ×0.25 mm ×0.25 μm) equipped with a flame ionization detector (FID). The analysis conditions were as follows: N2 flow (30 mL/min) as a carrier gas, injector temperature 230 °C, detector temperature 250 °C, and oven temperature programmed from 70 to 250 °C at a rate of 10 °C/min. The conversion, selectivity and yield were calculated in accordance with Deng et al.[12]. The turnover frequency (TOF) of BL hydrogenation to GVL was calculated according to the Eq. (1) as reported in our previous work [43]: (1) TOF= n × C ×6.02× 10 23 × S N × t Here n is the molar amount of BL used in the reaction feedstock, C the BL conversion, S the selectivity to GVL, N the number of surface Cu, Mo, Ni and Co atoms, t the reaction time, and 6.02 × 1023 the Avogadro’s number. The unit of TOF is per hour (h−1). N was calculated by the Eq. (2) [66]: (2) N = S M s with S M = 6 ρ × d M , here SM is the surface area of Cu(M)NiCoB alloy, ρ the density of Cu(M)NiCoB alloy, dM the statistical particle size of Cu(M)NiCoB alloy obtained from HRTEM, s the surface area of 6.5 × 10−20 m2 single Ni [67] or Co atom [68], 6.8 × 10−20 m2 single Cu atom [69] and 5.8 × 10−20 m2 single Mo atom calculated by the Mo atomic radius. 3 Results and discussion 3.1 Hydrogenation active site screening The screening of the hydrogenation active site for the conversion of BL to GVL is vitally important for developing the (metal/solid acid) bifunctional catalysts. Cyclohexane (CH), which has some advantages including well BL solubility, low cost and toxicity, was used as the reaction solvent for BL hydrogenation and determined as the optimum solvent in the following section. When Ni1Co1B catalyst was applied to BL hydrogenation reaction, a lower BL conversion of 40.8 % but a higher GVL selectivity of 86.4 % was obtained (Table 1 , entry 1). NiCoB amorphous alloy catalysts are high-effective for the hydrogenation conversion of α,β-unsaturated aldehydes [64,70,71]. The isolated Co-B active sites showed better hydrogenation activity of the CO bond on the carbonyl group of the furfural molecule than the isolated Ni-B active sites which have been proved in our previous study [64], in contrast, the isolated Ni-B active sites showed higher activity of the CC bond on the furan ring. In the BL molecule, the ester group (R − COO − R´) owns high steric hindrance and weak polarity which lead to more difficult conversion of ester group than aldehyde (−CHO) and ketone (R − CO − R) groups [15]. This is the cause for lower BL conversion over Ni1Co1B catalyst. Compared to Ni1Co1B catalyst, the BL conversion and GVL selectivity showed a decrease by 12.9 % and 6.3 % over Cu0.1Ni1Co1B catalyst, respectively (Table 1, entry 2). With the increase of Cu content in CuxNi1Co1B catalysts, the highest BL conversion of 72.1 % was obtained over the Cu0.5Ni1Co1B catalyst (Table 1, entry 4), indicating that the incorporation of suitable Cu into NiCoB amorphous alloy evidently promoted the conversion of BL. However, when the Cu content increased to Cu/Ni/Co ratio of 2/1/1, a little GVL yield of 15.2 % was showed at BL conversion of 21.2 % (Table 1, entry 6). For the CuB catalyst, the BL only achieved 2.7 % conversion but the highest GVL selectivity of 99.5 % was achieved, which confirmed that the concomitant crystalline Cu and Cu2O in the CuB catalyst (Fig. S1, Supporting Information) is beneficial to produce GVL. According to the N2 adsorption/desorption isotherms (Fig. S2A, Supporting Information), the textural properties of these CuxNi1Co1B catalysts and CuB catalyst were obtained (Table S1, Supporting Information). The introduction of Cu into NiCoB amorphous alloy catalyst increased the SBET and VP, implying that the amorphous alloy structure of NiCoB catalyst was affected by the generation of metallic Cu phase with an increasing particle size (Table S1, Supporting Information) in these CuxNi1Co1B catalysts as shown in the XRD patterns (Fig. S1, Supporting Information). Furthermore, observing the pore size distribution (PSD) curves of these CuxNiCoB and CuB catalysts (Fig. S2B, Supporting Information), more mesopores at 3.8 nm and 10∼100 nm were generated in these CuxNiCoB catalysts with the increase of Cu content. However, there is hardly mesopores at 3.8 nm in the CuB catalyst which has the maximum mesopores at 10∼100 nm. Therefore, the crystal structure and textural properties of CuxNi1Co1B catalyst are important factors for improving BL hydrogenation performances. For the optimum catalyst Cu0.5Ni1Co1B, the CuNiCoB amorphous alloy hydrogenation active site generated from well-dispersed Cu doped Ni1Co1B amorphous alloy has more plane defect (Fig. S3, Supporting Information), which promoted the transformation of reaction intermediate to GVL, thus playing decisive role on adjusting the formation of GVL. 3.2 Metal/solid acid bifunctional catalysts screening In order to further improve the BL hydrogenation activity of the Cu0.5Ni1Co1B catalyst, H+-PAL was used as a carrier to load and disperse it, and different metals were introduced to adjust the selectivity of BL hydrogenation products. As shown in Table 2 , the BL conversion over all H+-PAL supported catalysts increased obviously. The TOF for GVL formation over Cu0.5Ni1Co1B, Cu0.5Ni1Co1B/H+-PAL and Cu0.25Mo0.25Ni1Co1B/H+-PAL catalysts was also calculated in Table 2. It’s evident that the TOF was improved. Since there is no new active phase in these catalysts except for different peak intensity of metallic Cu (Fig. S4, Supporting Information), this can be ascribed to the improvement of the dispersion of Cu(M)NiCoB active site [22,43]. However, the GVL selectivity shows different extent of decrease over those H+-PAL supported catalysts due to further transformation of GVL into n-Pentyl alcohol (n-PeOH) and 1,4-PDO (Fig. S5, Supporting Information). The Cu0.25Fe0.25Ni1Co1B/H+-PAL catalyst showed the highest n-PeOH selectivity of 3.9 %. n-PeOH can be produced from the dehydration and over-hydrogenation of 1,4-PDO, which has been reported in a SBA-15 supported Cu-Fe catalyst due to the formation CuFeO2 Lewis acid site [12]. The Cu0.25Mo0.25Ni1Co1B/H+-PAL catalyst showed the highest 1,4-PDO selectivity of 2.7 %. 1,4-PDO is an important monomer for producing biodegradable polyesters and a raw material for the synthesis of many other chemicals and fuels [12]. In a Mo-modified Ru/Activated Carbon catalyst, LA was converted into 1,4-PDO with a high yield of 96.7 mol% due to the outstanding hydrogenation ability of Mo on the CO bond in either carbonyl or carboxyl group [16]. Therefore, the interaction between H+-PAL and Cu(Mo)NiCoB amorphous alloy is beneficial for improving the dispersion of Cu(Mo)NiCoB active site, thus enhancing the catalytic activity and their synergistic effect for adjusting the BL hydrogenation products distribution. The Cu0.25Mo0.25Ni1Co1B/H+-PAL catalyst was chose to optimize the BL hydrogenation reaction conditions and catalytic performances. 3.3 Effect of reaction solvent on BL hydrogenation The effect of reaction solvent on BL conversion over Cu0.5Ni1Co1B/H+-PAL catalyst was investigated. As shown in Table 3 , when using methanol as solvent, the lowest BL conversion of 37.6 % was obtained with a higher GVL selectivity of 96.4 %. Ethanol and n-propanol achieved the obvious increase of BL conversion to 95.0 % and 88.9 %, respectively, but brought the decrease of GVL selectivity to 82.7 % and 63.0 %. Therefore, the lower alcohols are not suitable for the BL hydrogenation reaction due to the strong polarity. In pure water, 80.5 % conversion of BL and a low yield of GVL of 44.8 % were obtained, which increased to 95.5 and 65.5 % in 50 vol% cyclohexane/water biphasic solvent and reached the highest GVL yield of 96.3 % in pure cyclohexane. Similarly, GVL yield of 85.4 and 88.4 % are obtained in the n-hexane and 1, 4-dioxane solvent, respectively. The difference of GVL yield can be ascribed to the different concentration of H2 dissolved in the solvent. In addition, the usage of alkanes also promoted the formation of 1,4-PDO. The stronger adsorption of oxygen-containing groups of BL and the promotion of hydrogen activation on H+-PAL support in alkane solvents are crucial factors for the highest GVL yield obtained in cyclohexane solvent [12]. 3.4 Characterization of the samples In order to clarify the structure-catalytic properties relationship of the H+-PAL supported Cu(M)NiCoB catalysts, N2 adsorption-desorption, XRD, SEM, XPS, H2-TPD, NH3-TPD and Fourier-transform IR (FTIR) spectra of pyridine adsorption were applied to detect them. From the N2 adsorption-desorption isotherms as shown in Fig. 1 (A), H+-PAL has the largest hysteresis loop which generated from the capillary condensation of liquid nitrogen in mesopores/macropores. The Cu0.5Ni1Co1B catalyst showed the smallest hysteresis loop due to the flake structure of CuNiCoB amorphous alloy. By contrast, the H+-PAL supported Cu0.5Ni1Co1B and Cu0.25Mo0.25Ni1Co1B catalysts showed an obvious increase in N2 adsorption, indicating they have much higher BET surface area and pore volume (Table S1, Supporting Information). From the Barret-Joyner-Halenda (BJH) pore size distribution patterns in Fig. 1(B), the mesopores/macropores are concomitant in H+-PAL and Cu0.5Ni1Co1B catalyst, of which one class is located at ～3.8 nm and the other is centered at ～17.3 nm and ～56.9 nm, respectively. This is why the Cu0.5Ni1Co1B catalyst showed a higher average pore size but a sharply lower total pore volume than H+-PAL (Table S1, Supporting Information). Compared to the Cu0.5Ni1Co1B catalyst, the H+-PAL supported Cu0.5Ni1Co1B and Cu0.25Mo0.25Ni1Co1B catalysts showed more mesopores/macropores which is beneficial for the adsorption of BL molecule. XRD patterns of H+-PAL, Cu0.5Ni1Co1B catalyst and H+-PAL supported Cu0.5Ni1Co1B and Cu0.25Mo0.25Ni1Co1B catalysts are shown in Fig. 1(C). H+-PAL shows the characteristic diffraction peaks of Palygorskite (JCPDS No. 31-0783) and Quartz (JCPDS No. 46-1045) [33]. The Cu0.5Ni1Co1B catalyst exhibits two broad peaks at 2θ ≈ 25° and 45° which are attributed to the amorphous boron oxides and typical amorphous alloy structure, respectively [64]. A sharp peak at 43.4° assigned to metallic Cu (Cu°) (JCPDS No. 04-0836) is displayed, implying that partial of Cu precursor was reduced to metallic Cu. H+-PAL supported Cu0.5Ni1Co1B and Cu0.25Mo0.25Ni1Co1B catalysts showed similar XRD patterns where the broad peak of CuNiCoB amorphous alloy is not evident due to high dispersion. From the calculated crystalline size of metallic Cu by Scherer equation (Table S1, Supporting Information), the dispersion of metallic Cu and CuNiCoB amorphous alloy was improved by introducing Mo. The FE-SEM observation as shown in Fig. 1(D) provided further evidence. The agglomeration of CuNiCoB amorphous alloy nanosheets with fuzzier boundary can be observed on the Cu0.5Ni1Co1B catalyst. After loading on H+-PAL, the dispersion of Cu(Mo)NiCoB amorphous alloy is effectively improved due to the enhanced interaction between H+-PAL and Cu(Mo)NiCoB amorphous alloy [72], especially for the Cu0.25Mo0.25Ni1Co1B/H+-PAL catalyst. The above results demonstrated the Mo doping effect as a structural promoter on reducing particle size and increasing metal dispersion. To further investigate the effect of H+-PAL supported Cu0.5Ni1Co1B and Cu0.25Mo0.25Ni1Co1B catalysts on the chemical state of metal species, XPS analysis was carried out as shown in Figs. 2 and 3. Fig. 2 shows the XPS spectra of Ni 2p, Co 2p and B 1 s. For Ni 2p, the peaks at binding energy (BE) of 856.0 ± 0.2 and 873.7 ± 0.3 eV are assigned to oxidized nickle (Ni2+) in Ni2+2p3/2/ Ni2+2p1/2 level, accompanying with two satellite peaks around 861.8 ± 0.2 and 879.8 ± 0.1 eV, respectively. Another group of weak peaks at BE of 853.2 ± 0.2 eV is assigned to metallic nickle (Ni°) in Ni°2p3/2 level [73]. For Co 2p, the oxidized cobalt (Co2+) in Co2+2p3/2/Co2+2p1/2 level are observed corresponding to the BE of 781.2 ± 0.2 and 797.1 ± 0.4 eV, respectively, accompanying with their satellite peaks [15]. Meanwhile, the weak peaks at BE of 778.0 ± 0.2 eV are ascribed to metallic cobalt (Co°) in Co°2p3/2 level [74]. In addition, the peaks around 188.4 ± 0.6 and 192.2 ± 0.3 eV are ascribed to the elemental boron (Be) and the oxidized boron (Bo), respectively [73]. The BE of Be over the Cu0.5Ni1Co1B catalyst shifted positively by 1.2 eV in comparison with the standard BE of the pure B (187.1 eV), indicating the transferring of partial electrons from B to Cu, Ni and Co in the CuNiCoB amorphous alloy which can promote the formation of electron-enriched Cu, Ni and Co but electron-deficient B [75]. Notably, the Cu0.5Ni1Co1B catalyst showed higher surface concentration but lower BE value of Ni, Co and B than H+-PAL supported Cu0.5Ni1Co1B and Cu0.25Mo0.25Ni1Co1B catalysts. This is a cue for the improvement of the dispersion of Cu(Mo)NiCoB amorphous alloy on H+-PAL that have been verified by XRD and SEM characterization (Fig. 1). Cu 2p spectra and Cu LMM Auger spectra are shown in Fig. 4 . In Cu 2p spectra, two groups of peaks at BE of 932.0 ± 0.3 and 953.0 ± 0.4 eV are corresponded to Cu°/Cu+2p3/2 and Cu°/Cu+2p1/2 [10], respectively, which can be further identified from the Auger spectra where the unsupported Cu0.5Ni1Co1B catalyst showed the highest surface concentration of Cu° while H+-PAL supported Cu0.25Mo0.25Ni1Co1B catalyst owned the highest surface concentration of Cu+. Meanwhile, the introduction of Mo did not obviously change the BE of Ni 2p and Co 2p but lead to the BE decrease of Cu°/Cu+, indicating the electron transferring between Cu and Ni1Co1B was suppressed. Therefore, Mo also acted as an electronic promoter that promoting the formation and increasing the fraction of Cu+ species. In order to reveal the catalytic hydrogenation active sites, H2-TPD of Cu0.5Ni1Co1B and H+-PAL supported Cu0.5Ni1Co1B and Cu0.25Mo0.25Ni1Co1B catalysts was performed, as shown in Fig. 4(A). A broad H2 desorption peak at 329 °C companying with a weak shoulder peak at 184 °C appeared on the Cu0.5Ni1Co1B catalyst, which is assigned to the CuNiCoB amorphous alloy and surface Cu0/Cu+ hydrogenation active sites, respectively. H+-PAL supported Cu(Mo)NiCoB catalysts showed more H2 adsorption sites and much higher H2 desorption concentration. Consequently, H2 could be more easily adsorbed over H+-PAL supported Cu0.5Ni1Co1B and Cu0.25Mo0.25Ni1Co1B catalysts during the process of BL hydrogenation, thus increasing the BL conversion (Table 2). Because of higher dispersion of CuMoNiCoB amorphous alloy and Cu0/Cu+ species as determined by XRD, SEM and XPS characterizations, the Cu0.25Mo0.25Ni1Co1B/H+-PAL catalyst displayed higher H2 adsorption ability which enhanced the further hydrogenation conversion of GVL to generate n-PeOH and 1,4-PDO (Table 2). The NH3-TPD spectra of Cu0.5Ni1Co1B catalyst and H+-PAL supported Cu0.5Ni1Co1B and Cu0.25Mo0.25Ni1Co1B catalysts are shown in Fig. 4 (B). The desorbed NH3 molecules at higher temperatures (≥ 150 °C) were attributed to acid site-bound NH3. A weak and broad NH3-TPD peak at 50−200 °C accompanying with a higher peak at 349 °C are observed over the Cu0.5Ni1Co1B catalyst, indicating the presence of some weakly acid sites derived from the nano-scale copper particles which catalyze BL conversion into GVL (Table 2). For H+-PAL supported catalysts, a group of higher abundance of weakly desorption peaks at about 100 and 208 °C are attributed to the physically adsorbed and hydrogen-bound NH3 by H+-PAL and the Lewis acid site derived from the exposed Al3+ in the layer structure of H+-PAL, respectively [76,77]. Another group of intermediate desorption peaks at 300−500 °C is assigned to the nano-scale copper particles and the Bronsted (B) acid site generated from the structural hydroxyl group in the layer structure of H+-PAL. Therefore, the enhancement in the acidity of H+-PAL supported catalysts is due to the additional acid sites provided by H+-PAL support, thus providing the acid sites for the further conversion of GVL (Table 2). The FTIR spectra of pyridine desorption of H+-PAL, Cu0.5Ni1Co1B/H+-PAL and Cu0.25Mo0.25Ni1Co1B/H+-PAL catalysts are shown in Fig. 5 (the inset reflects the assigned acid amount). The characteristic band at 1447 cm−1 on the curve of H+-PAL was attributed to Lewis acid sites. The weak band appearing at 1547 cm−1 was corresponded to the adsorption of pyridine on the Brønsted acid sites. The medium-strength band at 1491 cm-1 was associated with both types of acid sites [12]. Another band appeared at 1597 cm-1 which was related to the desorption of hydrogen-bonded pyridine [12]. Since the H+-PAL supported Cu0.5Ni1Co1B and Cu0.25Mo0.25Ni1Co1B catalysts was black, just almost half weight of H+-PAL was used when preparing the catalyst circle sheet by high pressure of 15 MPa to transmit infrared light. As a result, the adsorption of pyridine molecule by the structural hydroxyl group of H+-PAL was limited. Furthermore, the secondary activation of H+-PAL during the chemical reduction process of H+-PAL supported catalysts by BH4 − might lead to the decrease of structural hydroxyl [43]. Consequently, the B acid sites did not be detected on the H+-PAL supported Cu0.5Ni1Co1B and Cu0.25Mo0.25Ni1Co1B catalysts. However, the concentration of L acid sites increased from 0.0394 mmol/g to 0.0706 and 0.1002 mmol/g, respectively. It can be concluded that the loading and high dispersion of Cu(Mo)NiCoB amorphous alloy promoted the increase of L acid sites concentration. The higher concentration of L acid sites in Cu0.25Mo0.25Ni1Co1B/H+-PAL catalyst derived from the doping effect of Mo is beneficial for improving catalytic activity [29]. 3.5 BL hydrogenation reaction conditions optimization The catalyst dosage and reaction temperature have a large effect on reaction rate. Thus, the BL hydrogenation reaction conditions optimization over the Cu0.25Mo0.25Ni1Co1B/H+-PAL catalyst was carried out at different catalyst loading (the mass of CuMoNiCoB active site of catalyst divided by the mass of BL, ranging from 1 to 10 wt%) (Fig. 6 a) and different reaction temperature (ranging from 120 to 240 °C) (Fig. 6b). With the increase of catalyst loading from 1 to 3 wt%, the BL conversion increased significantly in the range of 74.5–94.7%, and then showed gradually increase to the maxima of 100 % when the catalyst loading reaches to 7 wt%. The increase of catalyst loading leaded to the gradual decrease of GVL selectivity ranging from 83.9–53.2%, on the contrary, the selectivity for n-PeOH and 1,4-PDO showed gradually increase to 2% and 5.9 %, respectively [78]. From the above results, it was evident that the synthetic effect between CuMoNiCoB hydrogenation site and L/B acid sites promoted BL conversion and GVL hydrogenation to n-PeOH and 1,4-PDO. The effect of reaction temperature on BL hydrogenation performances at the catalyst loading of 3 wt% is shown in Fig. 6b. When the reaction was conducted at a lower temperature (120 °C), only 7.3 % conversion of BL with a GVL selectivity of 64.5 % was achieved. The BL conversion obviously increased to 94.2 % when the reaction temperature increased to 140 °C and reached to 100 % at 220 °C. With the increase of reaction temperature, the selectivity of GVL and 1,4-PDO increased until the maxima of 78.1 % and 3.3 % was obtained at 200 °C, respectively. Further increasing the reaction temperature to 240 °C led to the decrease of the selectivity of GVL and 1,4-PDO to 50 % and 0.3 %, respectively. The selectivity of n-PeOH continuously increased from 0.7 to 6.4 %. GVL can be hydrogenated to produce 1,4-PDO which can be further transformed into dehydrated and over-hydrogenated byproducts n-PeOH [12,18]. Therefore, increasing reaction temperature promoted the cascade conversion of BL to n-PeOH [12]. The optimum reaction temperature for BL hydrogenation to GVL over H+-PAL supported Cu0.25Mo0.25Ni1Co1B catalyst is 200 °C. The effect of reaction time on BL hydrogenation performances over Cu0.5Ni1Co1B and H+-PAL supported Cu0.5Ni1Co1B and Cu0.25Mo0.25Ni1Co1B catalysts were investigated as shown in Fig. 7 . All catalysts achieved quick conversion of BL because of outstanding hydrogenation activity of CuNiCoB amorphous alloy. After reaction for 0.5 h, the BL conversion is 94.2 %, 96 % and 99.8 %, respectively. Prolonging the reaction time achieved the entire conversion of BL in only 1 h over the Cu0.25Mo0.25Ni1Co1B/H+-PAL catalyst. The GVL selectivity increased firstly and reached the maxima of 74.3 and 80.8 % over H+-PAL supported catalysts, respectively. However, further increasing the reaction time leaded to the obvious decrease of GVL selectivity but promoted the selectivity of 1,4-PDO and n-PeOH, which was correlated to that GVL could be further hydrogenated to 1,4-PDO and n-PeOH as mentioned above. These results indicated that the Cu0.25Mo0.25Ni1Co1B/H+-PAL catalyst is an efficient metal/acid bifunctional catalyst for one-pot catalytic conversion of BL to 1,4-PDO through the GVL intermediate under suitable reaction conditions. In order to figure out the composition, morphology and structure changes of the catalyst during the hydrogenation reaction, the used H+-PAL supported Cu0.5Ni1Co1B and Cu0.25Mo0.25Ni1Co1B catalysts after reaction for 6 h were collected and characterized. As shown in Fig. 8 , the uniformly-dispersed spherical particles were observed on the HRTEM images of the fresh H+-PAL supported Cu0.5Ni1Co1B and Cu0.25Mo0.25Ni1Co1B catalysts. The bright dots over the diffraction loop on the inserted SAED image indicated the formation of single crystal which is assigned to metallic Cu companying with CuNiCoB amorphous alloy (Fig. 1C). After reaction, some agglomeration appeared on the surface of H+-PAL rod crystal over the Cu0.5Ni1Co1B/H+-PAL catalyst. Though the concentration of B element showed a decrease (Table S2, Supporting Information), the diffraction loop of CuNiCoB amorphous alloy still can be observed due to the strong interaction between CuNiCoB hydrogenation active site and H+-PAL support. Since the Cu0.25Mo0.25Ni1Co1B/H+-PAL catalyst owned higher dispersion of CuMoNiCoB amorphous alloy as shown in XRD, SEM and XPS results (Figs. 1–3), the morphology did not show negative agglomeration. According to the XRD patterns (Fig. 9 ) of fresh and used H+-PAL supported Cu0.5Ni1Co1B and Cu0.25Mo0.25Ni1Co1B catalysts, carbon deposition was generated on the used Cu0.5Ni1Co1B/H+-PAL catalyst, which is not beneficial for maintaining the catalytic stability.[29] Because of the higher ratio of Lewis/Brønsted acid site of the Cu0.25Mo0.25Ni1Co1B/H+-PAL catalyst (Fig. 5), the formation of carbon deposition was effectively avoided. In addition, the XRD peak intensity of metallic Cu of used catalysts showed an increase than fresh catalysts, implying more metallic Cu was generated. XPS detection of the fresh and used H+-PAL supported Cu0.5Ni1Co1B and Cu0.25Mo0.25Ni1Co1B catalysts were also conducted (Fig. 10 ). The characteristic peaks intensity of Ni2+ and Co2+ species for the used Cu0.5Ni1Co1B/H+-PAL catalyst was similar with that of fresh catalyst, but the BE slightly shifted to lower values. However, for the used Cu0.25Mo0.25Ni1Co1B/H+-PAL catalyst, the peaks intensity and BE of Ni2+ and Co2+ species obviously declined. For Cu 2p spectra, the characteristic peaks intensity of Cu+/Cu° showed evident increase. This is a cue for the in-situ reduction of Cu2+ into Cu+/Cu° in the external H2 during the liquid-phase BL hydrogenation process [79], thus affecting the interaction between H+-PAL and Cu(Mo)NiCoB amorphous alloy site. According to the ICP results of the fresh and used catalysts including Cu0.5Ni1Co1B, Cu0.5Ni1Co1B/H+-PAL and Cu0.25Mo0.25Ni1Co1B/H+-PAL (Table S2, Supporting Information), the leaching of Cu was effectively improved by the loading of Cu(M)NiCoB amorphous alloy on H+-PAL, especially for the Cu0.25Mo0.25Ni1Co1B/H+-PAL catalyst which did not bring a change for the total content of CuMoNiCoB bulk composition. This is a successful solution for the loss of B species in the previous unsupported Cu0.5Ni1Co3B catalyst [15]. Due to the doping effect of Mo, the interaction between Cu hydrogenation active species and H+-PAL support and higher ratio of Lewis/Brønsted acid site, the Cu0.25Mo0.25Ni1Co1B/H+-PAL catalyst displayed prominent catalytic activity and stability for the sequential reaction of hydrogenation saturation of CO bond in acetyl group, dealcoholization and lactonization of BL molecule to form GVL. 3.6 Reaction pathway Based on the discussion mentioned above and previous research [21,79], a plausible reaction pathway for the BL hydrogenation over the bifunctional Cu0.25Mo0.25Ni1Co1B/H+-PAL catalyst was proposed (Fig. 11 ). The BL conversion involves several steps that depend on various factors such as the type and concentration of the acidic sites, the metallic sites available for hydrogenation, the solvent polarity, and the reaction parameters (temperature, pressure, time, and catalyst-to-feed ratio) [13,14,21]. In the case of the Cu0.25Mo0.25Ni1Co1B/H+-PAL catalyst, the carbonyl group of BL is first adsorbed on the acid sites in the H+-PAL support, and then hydrogenated over the CuMoNiCoB amorphous alloy and Cu2O/Cu sites to form butyl 4-hydroxypentanoate (BHP) intermediate. Subsequently, BHP rapidly undergoes lactonization to form GVL via dealcoholization over the acid sites. The carbonyl groups of GVL are adsorbed and reduced on the CuMoNiCoB amorphous alloy and Cu2O/Cu sites, and the resulting 2-hydroxy-5-methyltetrahydrofuran is further converted to 4-hydroxypentanal (HPN) through ring-opening isomerization [79]. Finally, the carbonyl groups of HPN are hydrogenated to generate 1,4-PDO on the CuMoNiCoB amorphous alloy and Cu2O/Cu sites. In addition, 1,4-PDO is dehydrated and hydrogenated to form by-product n-PeOH [17]. 3.7 Catalyst recycling test The catalyst recycle test for BL hydrogenation over H+-PAL supported Cu0.5Ni1Co1B and Cu0.25Mo0.25Ni1Co1B catalysts was performed under the following reaction condition: BL 5.66 mmol, CH 24 mL, catalyst 0.146 g, 200 °C, H2 3 MPa, 800 rpm, 3 h. After each run, the used catalyst was effectively separated from the mixed solution by a magnet (Fig. S6, Supporting Information), washed with absolute ethyl alcohol and then applied in the next run. As can be seen from Fig. 12 , the BL conversion is all above 98 % in five cycles, especially for the Cu0.5Ni1Co1B/H+-PAL catalyst which keeps 100 % unchanged. However, the GVL yield showed decrease from 78.9%–64.5% due to some agglomeration of CuNiCoB active site and the formation of carbon deposition (Fig. 9). It is surprisingly that the GVL yield over the Cu0.25Mo0.25Ni1Co1B/H+-PAL catalyst increased gradually to 95.7 % in the fifth run. In the furfural hydrogenation to furfuryl alcohol over our developed H+-PAL supported Ni1Co1B catalyst, the yield of furfuryl alcohol also showed a slight decrease in the first and second run but start to increase after the third run [43]. The specific self-regeneration ability of H+-PAL supported Ni1Co1B catalyst is due to the active site transformation from NiCoB amorphous alloy to Co-Ni alloy with high dispersion. However, the phase transformation of CuMoNiCoB active site did not be observed in the XRD pattern of the used catalyst after reaction for 6 h (Fig. 9). Therefore, the increase of GVL yield over the Cu0.25Mo0.25Ni1Co1B/H+-PAL catalyst might be due to the synergistic effect of several aspects, that include but not limited to Mo doping effect, higher concentration of L acid sites and suitable metal-support interaction [29]. Comparing the GVL production ability from BL hydrogenation, the Cu0.25Mo0.25Ni1Co1B/H+-PAL presented comparable hydrogenation efficiency with other catalysts in short reaction time and low catalyst dosage (Table S3, Supporting Information). Particularly, the more outstanding recyclability were achieved over the Cu0.25Mo0.25Ni1Co1B/H+-PAL catalyst than the typical Ru/C catalyst which showed a significant decrease in the activity of recycled Ru/C from 95 % to 83 % after 4th reuse [80]. According to above measurements, magnetic Cu0.25Mo0.25Ni1Co1B/H+-PAL catalyst could be an efficient candidate for catalytic conversion of BL into GVL. 4 Conclusions In this study, a series of CuxNi1Co1B amorphous alloy catalysts were developed through chemical reduction method to obtain the hydrogenation active site for BL hydrogenation to GVL. The optimal composition was manipulated as Cu0.5Ni1Co1B with moderate textures and more plane defect derived from the concomitant CuNiCoB amorphous alloy and highly-dispersed metallic Cu. Cu species acted as the key active site for improving BL hydrogenation activity. Different metal-doped Cu0.5Ni1Co1B was supported on H+-PAL to further enhance the BL hydrogenation activity. The Cu0.5Ni1Co1B/H+-PAL catalyst showed the highest GVL yield of 96.3 % with BL conversion of 99.7 % in the best cyclohexane solvent at 200 °C, 3.0 MPa H2 for 3 h. When Mo was doped into the Cu0.5Ni1Co1B/H+-PAL catalyst, the GVL yield showed gradually increase to 95.7 % with BL conversion of 100 % after five times run. The high activity and self-regeneration ability can be attributed to the Mo doping effect and the synthetic effect between Cu hydrogenation active species and H+-PAL support. The doping effect of Mo on the structure and microscopic properties of the catalysts was studied by various characterization methods. The results indicated that Mo can act as a structural promoter to improve the dispersion of metallic Cu and CuMoNiCoB amorphous alloy, and can also be used as an electronic modifier to promote the formation and increase the fraction of Cu+ species by restricting the electron transferring. In addition, more Lewis acid sites was generated by Mo doping to enhance the adsorption of carbonyl groups for improving BL conversion and the deep conversion of GVL to form 1,4-PDO and n-PeOH. On the basis of characterization and catalytic performances testing, the synergistic effect between CuMoNiCoB amorphous alloy and Cu2O/Cu hydrogenation sites and Lewis/Brønsted acid site of H+-PAL support is crucial factors to produce GVL from BL hydrogenation over self-regenerated Cu0.25Mo0.25Ni1Co1B/H+-PAL catalyst. The low-cost, high-activity, easily magnetic separation, environmental friendly features and the most important point of self-generation character gifted H+-PAL supported CuMoNiCoB amorphous alloy catalyst a potential as promising candidate for producing high value-added chemicals from levulinic compound mediated biomass transformations. CRediT authorship contribution statement Haijun Guo: Methodology, Formal analysis, Investigation, Writing - original draft, Funding acquisition. Shuai Ding: Investigation, Formal analysis. Hairong Zhang: Methodology, Validation, Resources, Funding acquisition. Can Wang: Investigation, Validation. Fen Peng: Investigation, Formal analysis, Funding acquisition. Lian Xiong: Conceptualization, Writing - review & editing. Xinde Chen: Supervision, Conceptualization, Project administration, Writing - review & editing. Xinping Ouyang: Supervision, Conceptualization, Funding acquisition, Writing - review & editing. Declaration of Competing Interest The authors report no declarations of interest. Acknowledgments This work was supported by the Project of Guangdong Provincial Natural Science Foundation (2018A030313150, 2018A030310126), the Project of National Natural Science Foundation of China (21776108, 51876207), the Project of Jiangsu Province Science and Technology (BE2018342), and the Guangdong Basic and Applied Basic Research Foundation (2020A1515010516). Appendix A Supplementary data Supplementary material related to this article can be found, in the online version, at doi:https://doi.org/10.1016/j.mcat.2021.111483. Appendix A Supplementary data The following is Supplementary data to this article: References [1] F.F. Costa D. Terra de Oliveira Y.P. Brito G. Narciso da Rocha Filho C.G. Alvarado A.M. Balu R. Luque L.A. Santos do Nascimento Curr. Opin. Green Sustain. Chem. 24 2020 21 25 F.F. Costa, D. Terra de Oliveira, Y.P. Brito, G. Narciso da Rocha Filho, C.G. Alvarado, A.M. Balu, R. Luque, L.A. Santos do Nascimento, Current Opinion in Green and Sustainable Chemistry, 24 (2020) 21-25. [2] Y. Jing Y. Guo Q. Xia X. Liu Y. Wang Chemistry 5 2019 2520 2546 Y. Jing, Y. Guo, Q. Xia, X. Liu, Y. Wang, Chem, 5 (2019) 2520-2546. [3] K. Yan C. Jarvis J. Gu Y. Yan Renew. Sustain. Energy Rev. 51 2015 986 997 K. Yan, C. Jarvis, J. Gu, Y. Yan, Renew. Sust. Energ. Rev., 51 (2015) 986-997. [4] R. Mariscal P. Maireles-Torres M. Ojeda I. Sádaba M. López Granados Energy Environ. Sci. 9 2016 1144 1189 R. Mariscal, P. Maireles-Torres, M. Ojeda, I. Sádaba, M. López Granados, Energy Environ. Sci., 9 (2016) 1144-1189. [5] P. Sun G. Gao Z. Zhao C. Xia F. Li Appl. Catal. B: Environ. 189 2016 19 25 P. Sun, G. Gao, Z. Zhao, C. Xia, F. Li, Appl. Catal. B: Environ., 189 (2016) 19-25. [6] T. Guo M. Qiu X. Qi Appl. Catal. A Gen. 572 2019 168 175 T. Guo, M. Qiu, X. Qi, Appl. Catal. A: Gen., 572 (2019) 168-175. [7] D.R. Fernandes A.S. Rocha E.F. Mai C.J.A. Mota V. Teixeira da Silva Appl. Catal. A Gen. 425-426 2012 199 204 D.R. Fernandes, A.S. Rocha, E.F. Mai, C.J.A. Mota, V. Teixeira da Silva, Appl. Catal. A: Gen., 425-426 (2012) 199-204. [8] M. Halder P. Bhanja M.M. Islam S. Chatterjee A. Khan A. Bhaumik S.M. Islam Mol. Catal. 494 2020 111119 M. Halder, P. Bhanja, M.M. Islam, S. Chatterjee, A. Khan, A. Bhaumik, S.M. Islam, Mol. Catal., 494 (2020) 111119. [9] X. Kong S. Wu L. Liu S. Li J. Liu Mole. Catal 439 2017 180 185 X. Kong, S. Wu, L. Liu, S. Li, J. Liu, Mole. Catal., 439 (2017) 180-185. [10] B. Cai X.-C. Zhou Y.-C. Miao J.-Y. Luo H. Pan Y.-B. Huang ACS Sustain. Chem. Eng. 5 2016 1322 1331 B. Cai, X.-C. Zhou, Y.-C. Miao, J.-Y. Luo, H. Pan, Y.-B. Huang, ACS Sustain. Chem. Eng., 5 (2016) 1322-1331. [11] M. Sun J. Xia H. Wang X. Liu Q. Xia Y. Wang Appl. Catal. B: Environ. 227 2018 488 498 M. Sun, J. Xia, H. Wang, X. Liu, Q. Xia, Y. Wang, Appl. Catal. B: Environ., 227 (2018) 488-498. [12] T. Deng L. Yan X. Li Y. Fu ChemSusChem 12 2019 3837 3848 T. Deng, L. Yan, X. Li, Y. Fu, ChemSusChem, 12 (2019) 3837-3848. [13] X. Tang H. Chen L. Hu W. Hao Y. Sun X. Zeng L. Lin S. Liu Appl. Catal. B: Environ. 147 2014 827 834 X. Tang, H. Chen, L. Hu, W. Hao, Y. Sun, X. Zeng, L. Lin, S. Liu, Appl. Catal. B: Environ., 147 (2014) 827-834. [14] F. Li L.J. France Z. Cai Y. Li S. Liu H. Lou J. Long X. Li Appl. Catal. B: Environ. 214 2017 67 77 F. Li, L.J. France, Z. Cai, Y. Li, S. Liu, H. Lou, J. Long, X. Li, Appl. Catal. B: Environ., 214 (2017) 67-77. [15] B. Chen H. Guo Z. Wan X. Xu H. Zhang D. Zhao X. Chen N. Zhang Energy Fuel. 32 2018 5527 5535 B. Chen, H. Guo, Z. Wan, X. Xu, H. Zhang, D. Zhao, X. Chen, N. Zhang, Energ. Fuel., 32 (2018) 5527-5535. [16] J. Cui J. Tan Y. Zhu F. Cheng ChemSusChem 11 2018 1316 1320 J. Cui, J. Tan, Y. Zhu, F. Cheng, ChemSusChem, 11 (2018) 1316-1320. [17] X. Du Q. Bi Y. Liu Y. Cao H. He K. Fan Green Chem. 14 2012 935 939 X. Du, Q. Bi, Y. Liu, Y. Cao, H. He, K. Fan, Green Chem., 14 (2012) 935-939. [18] S.C. Patankar G.D. Yadav ACS Sustain. Chem. Eng. 3 2015 2619 2630 S.C. Patankar, G.D. Yadav, ACS Sustain. Chem. Eng., 3 (2015) 2619-2630. [19] I. Obregón I. Gandarias A. Ocio I. García-García N. Alvarez de Eulate P.L. Arias Appl. Catal. B: Environ. 210 2017 328 341 I. Obregón, I. Gandarias, A. Ocio, I. García-García, N. Alvarez de Eulate, P.L. Arias, Appl. Catal. B: Environ., 210 (2017) 328-341. [20] Z. Yi D. Hu H. Xu Z. Wu M. Zhang K. Yan Fuel 259 2020 116208 Z. Yi, D. Hu, H. Xu, Z. Wu, M. Zhang, K. Yan, Fuel, 259 (2020) 116208. [21] N. Karanwal D. Verma P. Butolia S.M. Kim J. Kim Green Chem. 22 2020 766 787 N. Karanwal, D. Verma, P. Butolia, S.M. Kim, J. Kim, Green Chem., 22 (2020) 766-787. [22] C. Zhang Z. Huo D. Ren Z. Song Y. Liu F. Jin W. Zhou J. Energy Chem. 32 2019 189 197 C. Zhang, Z. Huo, D. Ren, Z. Song, Y. Liu, F. Jin, W. Zhou, J. Energ. Chem., 32 (2019) 189-197. [23] R. Wang J. Wang H. Zi Y. Xia H. Wang X. Liu Mol. Catal. 441 2017 168 178 R. Wang, J. Wang, H. Zi, Y. Xia, H. Wang, X. Liu, Mole. Catal., 441 (2017) 168-178. [24] Y. Xie F. Li J. Wang R. Wang H. Wang X. Liu Y. Xia Mol. Catal. 442 2017 107 114 Y. Xie, F. Li, J. Wang, R. Wang, H. Wang, X. Liu, Y. Xia, Mole. Catal., 442 (2017) 107-114. [25] N. Ji Z. Liu X. Diao J. Bao Z. Yu C. Song Q. Liu D. Ma X. Lu Mol. Catal. 495 2020 111155 N. Ji, Z. Liu, X. Diao, J. Bao, Z. Yu, C. Song, Q. Liu, D. Ma, X. Lu, Mole. Catal., 495 (2020) 111155. [26] Z. Yu X. Lu J. Xiong N. Ji ChemSusChem 12 2019 3915 3930 Z. Yu, X. Lu, J. Xiong, N. Ji, ChemSusChem, 12 (2019) 3915-3930. [27] J. He H. Li Y.-M. Lu Y.-X. Liu Z.-B. Wu D.-Y. Hu S. Yang Appl. Catal. A Gen. 510 2016 11 19 J. He, H. Li, Y.-M. Lu, Y.-X. Liu, Z.-B. Wu, D.-Y. Hu, S. Yang, Appl. Catal. A: Gen., 510 (2016) 11-19. [28] Z. Lin M. Luo Y. Zhang X. Wu Y. Fu F. Zhang W. Zhu Appl. Catal. A Gen. 563 2018 54 63 Z. Lin, M. Luo, Y. Zhang, X. Wu, Y. Fu, F. Zhang, W. Zhu, Appl. Catal. A: Gen., 563 (2018) 54-63. [29] Z. Yu X. Lu H. Bai J. Xiong W. Feng N. Ji Chem. Asian J. 15 2020 1182 1201 Z. Yu, X. Lu, H. Bai, J. Xiong, W. Feng, N. Ji, Chem.- Asian J., 15 (2020) 1182-1201. [30] J. Cueto V. Korobka L. Faba E. Diaz S. Ordonez ACS Sustain. Chem. Eng. 8 2020 4371 4383 J. Cueto, V. Korobka, L. Faba, E. Diaz, S. Ordonez, ACS Sustain. Chem. Eng., 8 (2020) 4371-4383. [31] J. Feng M. Li Y. Zhong Y. Xu X. Meng Z. Zhao C. Feng Microporous Mesoporous Mater. 294 2020 109858 J. Feng, M. Li, Y. Zhong, Y. Xu, X. Meng, Z. Zhao, C. Feng, Micropor. Mesopor. Mat., 294 (2020) 109858. [32] H. Xu D. Hu Z. Yi Z. Wu M. Zhang K. Yan ACS Appl. Energy Mater. 2 2019 6979 6983 H. Xu, D. Hu, Z. Yi, Z. Wu, M. Zhang, K. Yan, ACS Appl. Energ. Mater., 2 (2019) 6979-6983. [33] H.J. Guo H.R. Zhang F. Peng H.J. Yang L. Xiong C. Wang C. Huang X.D. Chen L.L. Ma Appl. Catal. A Gen. 503 2015 51 61 H.J. Guo, H.R. Zhang, F. Peng, H.J. Yang, L. Xiong, C. Wang, C. Huang, X.D. Chen, L.L. Ma, Appl. Catal. A: Gen., 503 (2015) 51-61. [34] Z. Wu J. Zhang X. Zhao X. Li Y. Zhang F. Wang J. Chem. Technol. Biotechnol. 94 2019 1269 1281 Z. Wu, J. Zhang, X. Zhao, X. Li, Y. Zhang, F. Wang, J. Chem. Technol. Biotechnol., 94 (2019) 1269-1281. [35] H.J. Guo Q.L. Li H.R. Zhang F. Peng L. Xiong S.M. Yao C. Huang X.D. Chen Mole. Catal. 476 2019 14 H.J. Guo, Q.L. Li, H.R. Zhang, F. Peng, L. Xiong, S.M. Yao, C. Huang, X.D. Chen, Mole. Catal., 476 (2019) 14. [36] H. Guo Q. Li H. Zhang L. Xiong F. Peng S. Yao X. Chen J. Fuel Chem. Tech. 47 2019 1346 1356 H. Guo, Q. Li, H. Zhang, L. Xiong, F. Peng, S. Yao, X. Chen, J. Fuel Chem. Tech., 47 (2019) 1346-1356. [37] R. Wang X. Liang F. Shen M. Qiu J. Yang X. Qi ACS Sustain. Chem. Eng. 8 2020 1163 1170 R. Wang, X. Liang, F. Shen, M. Qiu, J. Yang, X. Qi, ACS Sustain. Chem. Eng., 8 (2020) 1163-1170. [38] Y. Chen T. Chen H. Liu P. Zhang C. Wang S. Dong D. Chen J. Xie X. Zou S.L. Suib C. Li Appl. Clay Sci. 188 2020 105498 Y. Chen, T. Chen, H. Liu, P. Zhang, C. Wang, S. Dong, D. Chen, J. Xie, X. Zou, S.L. Suib, C. Li, Appl. Clay Sci., 188 (2020) 105498. [39] J. Jiang Y. Xu C. Duanmu X. Gu J. Chen Appl. Clay Sci. 95 2014 260 264 J. Jiang, Y. Xu, C. Duanmu, X. Gu, J. Chen, Appl. Clay Sci., 95 (2014) 260-264. [40] H. Hernando C. Ochoa-Hernández M. Shamzhy I. Moreno J. Fermoso P. Pizarro J.M. Coronado J. Čejka D.P. Serrano Catal. Sci. Technol. 9 2019 789 802 H. Hernando, C. Ochoa-Hernández, M. Shamzhy, I. Moreno, J. Fermoso, P. Pizarro, J.M. Coronado, J. Čejka, D.P. Serrano, Catal. Sci. Technol., 9 (2019) 789-802. [41] J. Wang A. Wang X. Tian H. Wang M. Xu L. Yang Appl. Clay Sci. 135 2017 596 602 J. Wang, A. Wang, X. Tian, H. Wang, M. Xu, L. Yang, Appl. Clay Sci., 135 (2017) 596-602. [42] H. Tian Y. Shao C. Liang Q. Xu L. Zhang S. Zhang S. Liu X. Hu Renew. Energy 162 2020 1576 1586 H. Tian, Y. Shao, C. Liang, Q. Xu, L. Zhang, S. Zhang, S. Liu, X. Hu, Renewable Energy, 162 (2020) 1576-1586. [43] H. Guo H. Zhang L. Zhang C. Wang F. Peng Q. Huang L. Xiong C. Huang X. Ouyang X. Chen X. Qiu Ind. Eng. Chem. Res. 57 2018 498 511 H. Guo, H. Zhang, L. Zhang, C. Wang, F. Peng, Q. Huang, L. Xiong, C. Huang, X. Ouyang, X. Chen, X. Qiu, Ind. Eng. Chem. Res., 57 (2018) 498-511. [44] Z. Yu X. Lu J. Xiong X. Li H. Bai N. Ji ChemSusChem 2020 Z. Yu, X. Lu, J. Xiong, X. Li, H. Bai, N. Ji, ChemSusChem, (2020). [45] L.F. Xie T. Chen H.C. Chan Y.J. Shu Q.S. Gao Chem. Asian J. 13 2018 641 647 L. F. Xie, T. Chen, H. C. Chan, Y. J. Shu, Q. S. Gao, Chem.- Asian J., 13 (2018) 641-647. [46] Á. O’Driscoll J.J. Leahy T. Curtin Catal. Today 279 2017 194 201 Á. O’Driscoll, J.J. Leahy, T. Curtin, Catal. Today, 279 (2017) 194-201. [47] G. Wang R. Yao H. Xin Y. Guan P. Wu X. Li RSC Adv. 8 2018 37243 37253 G. Wang, R. Yao, H. Xin, Y. Guan, P. Wu, X. Li, RSC Adv., 8 (2018) 37243-37253. [48] Z. Fu Z. Wang W. Lin W. Song S. Li Appl. Catal. A Gen. 547 2017 248 255 Z. Fu, Z. Wang, W. Lin, W. Song, S. Li, Appl. Catal. A: Gen., 547 (2017) 248-255. [49] M. Ghashghaee S. Sadjadi S. Shirvani V. Farzaneh Catal. Lett. 147 2017 318 327 M. Ghashghaee, S. Sadjadi, S. Shirvani, V. Farzaneh, Catal. Lett., 147 (2017) 318-327. [50] M. Ghashghaee S. Shirvani V. Farzaneh Russ. J. Appl. Chem. 90 2017 304 309 M. Ghashghaee, S. Shirvani, V. Farzaneh, Russ. J. Appl. Chem., 90 (2017) 304-309. [51] M. Ghashghaee S. Shirvani V. Farzaneh S. Sadjadi Braz. J. Chem. Eng. 35 2018 669 678 M. Ghashghaee, S. Shirvani, V. Farzaneh, S. Sadjadi, Braz. J. Chem. Eng., 35 (2018) 669-678. [52] M. Ghashghaee S. Shirvani M. Ghambarian Appl. Catal. A Gen. 545 2017 134 147 M. Ghashghaee, S. Shirvani, M. Ghambarian, Appl. Catal. A: Gen., 545 (2017) 134-147. [53] S. Gundekari K. Srinivasan Catal. Lett. 149 2018 215 227 S. Gundekari, K. Srinivasan, Catal. Lett., 149 (2018) 215-227. [54] N. Scotti F. Zaccheria C. Bisio C. Vittoni N. Ravasio ChemistrySelect 3 2018 8344 8348 N. Scotti, F. Zaccheria, C. Bisio, C. Vittoni, N. Ravasio, ChemistrySelect, 3 (2018) 8344-8348. [55] S. Shirvani M. Ghashghaee V. Farzaneh S. Sadjadi Biomass Convers. Bior. 8 2018 79 86 S. Shirvani, M. Ghashghaee, V. Farzaneh, S. Sadjadi, Biomass Convers. Bior., 8 (2018) 79-86. [56] S.K. Singh Asian J. Org. Chem. 7 2018 1901 1923 S.K. Singh, Asian J. Org. Chem., 7 (2018) 1901-1923. [57] W. Gong C. Chen H. Zhang G. Wang H. Zhao Catal. Sci. Technol. 8 2018 5506 5514 W. Gong, C. Chen, H. Zhang, G. Wang, H. Zhao, Catal. Sci. Technol., 8 (2018) 5506-5514. [58] Y. Wang F. Liu H. Han L. Xiao W. Wu ChemistrySelect 3 2018 7926 7933 Y. Wang, F. Liu, H. Han, L. Xiao, W. Wu, ChemistrySelect, 3 (2018) 7926-7933. [59] Z. Yang Y.B. Huang Q.X. Guo Y. Fu Chem. Commun. (Camb.) 49 2013 5328 5330 Z. Yang, Y.B. Huang, Q.X. Guo, Y. Fu, Chem. Commun. (Camb), 49 (2013) 5328-5330. [60] K. Yan J. Liao X. Wu X. Xie RSC Adv. 3 2013 3853 3856 K. Yan, J. Liao, X. Wu, X. Xie, RSC Adv., 3 (2013) 3853-3856. [61] J. Zhang J. Chen ACS Sustain. Chem. Eng. 5 2017 5982 5993 J. Zhang, J. Chen, ACS Sustain. Chem. Eng., 5 (2017) 5982-5993. [62] J. Li M. Li C. Zhang C.-L. Liu R.-Z. Yang W.-S. Dong J. Catal. 381 2020 163 174 J. Li, M. Li, C. Zhang, C.-L. Liu, R.-Z. Yang, W.-S. Dong, J. Catal., 381 (2020) 163-174. [63] H.J. Guo H.R. Zhang F. Peng H.J. Yang L. Xiong C. Huang C. Wang X.D. Chen L.L. Ma Appl. Clay Sci. 111 2015 83 89 H. J. Guo, H. R. Zhang, F. Peng, H. J. Yang, L. Xiong, C. Huang, C. Wang, X. D. Chen, L. L. Ma, Appl. Clay Sci., 111 (2015) 83-89. [64] H.J. Guo H.R. Zhang W.C. Tang C. Wang P. Chen X.D. Chen X.P. Ouyang BioResources 12 2017 8755 8774 H. J. Guo, H. R. Zhang, W. C. Tang, C. Wang, P. Chen, X. D. Chen, X. P. Ouyang, BioResources, 12 (2017) 8755-8774. [65] S.D. Le S. Nishimura ACS Sustain. Chem. Eng. 7 2019 18483 18492 S.D. Le, S. Nishimura, ACS Sustain. Chem. Eng., 7 (2019) 18483-18492. [66] J.J.F. Scholten A.P. Pijpers A.M.L. Hustings Catal. Rew. 27 1985 151 206 J.J.F. Scholten, A.P. Pijpers, A.M.L. Hustings, Catal. Rew., 27 (1985) 151-206. [67] H.X. Li W.J. Wang H. Li J.F. Deng J. Catal. 194 2000 211 221 H.X. Li, W.J. Wang, H. Li, J.F. Deng, J. Catal., 194 (2000) 211-221. [68] H. Li J. Liu S. Xie M. Qiao W. Dai H. Li J. Catal. 259 2008 104 110 H. Li, J. Liu, S. Xie, M. Qiao, W. Dai, H. Li, J. Catal., 259 (2008) 104-110. [69] A.M. Bruno T.D.R. Simões M.M.V.M. Souza R.L. Manfro RSC Adv. 10 2020 31123 31138 A.M. Bruno, T.D.R. Simões, M.M.V.M. Souza, R.L. Manfro, RSC Adv., 10 (2020) 31123-31138. [70] H.S. Luo H.I. Li L. Zhuang Chem. Lett. 2001 404 405 H.S. Luo, H.I. Li, L. Zhuang, Chem. Lett., (2001) 404-405. [71] W. Wei Y. Zhao S.C. Peng H.Y. Zhang Y.P. Bian H.X. Li H. Li J. Mater. Chem. A 2 2014 19253 W. Wei, Y. Zhao, S.C. Peng, H.Y. Zhang, Y.P. Bian, H.X. Li, H. Li, J. Mater. Chem. A, 2 (2014) 19253. [72] H.J. Guo H.R. Zhang X.F. Chen L.Q. Zhang C. Huang H.L. Li F. Peng Q.L. Huang L. Xiong X.P. Ouyang X.D. Chen Energ. Convers. Manage. 156 2018 130 139 H. J. Guo, H. R. Zhang, X. F. Chen, L. Q. Zhang, C. Huang, H. L. Li, F. Peng, Q. L. Huang, L. Xiong, X. P. Ouyang, X. D. Chen. Energ. Convers. Manage., 156 (2018) 130-139. [73] H. Li H.X. Li W.L. Dai W.J. Wang Z.G. Fang J.F. Deng Appl. Surf. Sci. 152 1999 25 34 H. Li, H.X. Li, W.L. Dai, W.J. Wang, Z.G. Fang, J.F. Deng, Appl. Surf. Sci., 152 (1999) 25-34. [74] H. Li W.M. Chai H.S. Luo H.X. Li Chin. J. Chem 24 2006 1704 1708 H. Li, W.M. Chai, H.S. Luo, H.X. Li, Chin. J. Chem. 24 (2006) 1704-1708. [75] H.X. Li S.Y. Zhang H.S. Luo Mater. Lett. 58 2004 2741 2746 H.X. Li, S.Y. Zhang, H.S. Luo, Mater. Lett., 58 (2004) 2741-2746. [76] Y. Shen Y. Kang J. Sun C. Wang B. Wang F. Xu R. Sun Chin. J. Catal. 37 2016 1362 1368 Y. Shen, Y. Kang, J. Sun, C. Wang, B. Wang, F. Xu, R. Sun, Chin. J. Catal., 37 (2016) 1362-1368. [77] H. Guo H. Zhang Q. Li F. Peng L. Xiong C. Wang A. Hu S. Yao X. Chen Energ. Fuels 34 2020 9463 9472 H. Guo, H. Zhang, Q. Li, F. Peng, L. Xiong, C. Wang, A. Hu, S. Yao, X. Chen, Energ. Fuels, 34 (2020) 9463-9472. [78] D. Ren X. Wan F. Jin Z. Song Y. Liu Z. Huo Green Chem. 18 2016 5999 6003 D. Ren, X. Wan, F. Jin, Z. Song, Y. Liu, Z. Huo, Green Chem., 18 (2016) 5999-6003. [79] Y. Shao K. Sun Q. Li Q. Liu S. Zhang Q. Liu G. Hu X. Hu Green Chem. 21 2019 4499 4511 Y. Shao, K. Sun, Q. Li, Q. Liu, S. Zhang, Q. Liu, G. Hu, X. Hu, Green Chem., 21 (2019) 4499-4511. [80] A.M. Hengne N.S. Biradar C.V. Rode Catal. Lett. 142 2012 779 787 A.M. Hengne, N.S. Biradar, C.V. Rode, Catal. Lett., 142 (2012) 779-787.",
      "scopus-id": "85101524489",
      "coredata": {
        "eid": "1-s2.0-S2468823121001000",
        "dc:description": "The acid-activated Palygorskite (H+-PAL) was applied to support Cu(M)NiCoB amorphous alloy catalysts with high-activity and self-regeneration ability for selective hydrogenation of butyl levulinate (BL) to γ-valerolactone (GVL). The catalysts were characterized by ICP-OES, nitrogen physisorption, XRD, FE-SEM, TEM, XPS, H2-TPD, NH3-TPD and FTIR-pyridine adsorption techniques. Compared to the unsupported Cu0.5Ni1Co1B catalyst, the Cu0.5Ni1Co1B/H+-PAL catalyst showed the highest GVL yield of 96.3 % with BL conversion of 99.7 % at 200 °C. When Mo was doped into the Cu0.5Ni1Co1B/H+-PAL catalyst, the GVL yield showed gradually increase to 95.7 % with BL conversion of 100 % after five times run. The high activity and self-regeneration ability was attributed to the Mo doping effect and the synthetic effect between Cu hydrogenation active species and H+-PAL support. Various characterization results indicated that Mo acted as both structural promoter to improve the dispersion of metallic Cu and CuMoNiCoB amorphous alloy and electronic promoter to enhance the formation and increase the fraction of Cu+ species. In addition, the incorporation of Mo provided more Lewis acid sites to promote BL conversion to GVL and GVL conversion to 1,4-PDO and n-PeOH. On the basis of characterization and catalytic performance testing results, the synergistic effect between CuMoNiCoB amorphous alloy and Cu2O/Cu hydrogenation sites and Lewis/Brønsted acid site of H+-PAL support is considered to be the key to produce GVL.",
        "openArchiveArticle": "false",
        "prism:coverDate": "2021-03-31",
        "openaccessUserLicense": null,
        "prism:aggregationType": "Journal",
        "prism:url": "https://api.elsevier.com/content/article/pii/S2468823121001000",
        "dc:creator": [
          {
            "@_fa": "true",
            "$": "Guo, Haijun"
          },
          {
            "@_fa": "true",
            "$": "Ding, Shuai"
          },
          {
            "@_fa": "true",
            "$": "Zhang, Hairong"
          },
          {
            "@_fa": "true",
            "$": "Wang, Can"
          },
          {
            "@_fa": "true",
            "$": "Peng, Fen"
          },
          {
            "@_fa": "true",
            "$": "Xiong, Lian"
          },
          {
            "@_fa": "true",
            "$": "Chen, Xinde"
          },
          {
            "@_fa": "true",
            "$": "Ouyang, Xinping"
          }
        ],
        "link": [
          {
            "@_fa": "true",
            "@rel": "self",
            "@href": "https://api.elsevier.com/content/article/pii/S2468823121001000"
          },
          {
            "@_fa": "true",
            "@rel": "scidir",
            "@href": "https://www.sciencedirect.com/science/article/pii/S2468823121001000"
          }
        ],
        "dc:format": "application/json",
        "openaccessType": null,
        "pii": "S2468-8231(21)00100-0",
        "prism:volume": "504",
        "articleNumber": "111483",
        "prism:publisher": "Elsevier B.V.",
        "dc:title": "Improvement on the catalytic performances of butyl levulinate hydrogenation to γ-valerolactone over self-regenerated CuNiCoB/Palygorskite catalyst",
        "prism:copyright": "© 2021 Elsevier B.V. All rights reserved.",
        "openaccess": "0",
        "prism:issn": "24688231",
        "dcterms:subject": [
          {
            "@_fa": "true",
            "$": "Catalytic hydrogenation"
          },
          {
            "@_fa": "true",
            "$": "Butyl levulinate"
          },
          {
            "@_fa": "true",
            "$": "CuNiCoB amorphous alloy"
          },
          {
            "@_fa": "true",
            "$": "Acid-activated palygorskite"
          },
          {
            "@_fa": "true",
            "$": "γ-Valerolactone"
          }
        ],
        "openaccessArticle": "false",
        "prism:publicationName": "Molecular Catalysis",
        "openaccessSponsorType": null,
        "prism:pageRange": "111483",
        "pubType": "fla",
        "prism:coverDisplayDate": "March 2021",
        "prism:doi": "10.1016/j.mcat.2021.111483",
        "prism:startingPage": "111483",
        "dc:identifier": "doi:10.1016/j.mcat.2021.111483",
        "openaccessSponsorName": null
      },
      "objects": {
        "object": [
          {
            "@category": "standard",
            "@height": "452",
            "@width": "566",
            "@_fa": "true",
            "$": "https://api.elsevier.com/content/object/eid/1-s2.0-S2468823121001000-gr11.jpg?httpAccept=%2A%2F%2A",
            "@multimediatype": "JPEG image file",
            "@type": "IMAGE-DOWNSAMPLED",
            "@size": "46054",
            "@ref": "gr11",
            "@mimetype": "image/jpeg"
          },
          {
            "@category": "standard",
            "@height": "475",
            "@width": "339",
            "@_fa": "true",
            "$": "https://api.elsevier.com/content/object/eid/1-s2.0-S2468823121001000-gr12.jpg?httpAccept=%2A%2F%2A",
            "@multimediatype": "JPEG image file",
            "@type": "IMAGE-DOWNSAMPLED",
            "@size": "43056",
            "@ref": "gr12",
            "@mimetype": "image/jpeg"
          },
          {
            "@category": "standard",
            "@height": "799",
            "@width": "339",
            "@_fa": "true",
            "$": "https://api.elsevier.com/content/object/eid/1-s2.0-S2468823121001000-gr2.jpg?httpAccept=%2A%2F%2A",
            "@multimediatype": "JPEG image file",
            "@type": "IMAGE-DOWNSAMPLED",
            "@size": "77744",
            "@ref": "gr2",
            "@mimetype": "image/jpeg"
          },
          {
            "@category": "standard",
            "@height": "522",
            "@width": "339",
            "@_fa": "true",
            "$": "https://api.elsevier.com/content/object/eid/1-s2.0-S2468823121001000-gr3.jpg?httpAccept=%2A%2F%2A",
            "@multimediatype": "JPEG image file",
            "@type": "IMAGE-DOWNSAMPLED",
            "@size": "49058",
            "@ref": "gr3",
            "@mimetype": "image/jpeg"
          },
          {
            "@category": "standard",
            "@height": "855",
            "@width": "339",
            "@_fa": "true",
            "$": "https://api.elsevier.com/content/object/eid/1-s2.0-S2468823121001000-gr10.jpg?httpAccept=%2A%2F%2A",
            "@multimediatype": "JPEG image file",
            "@type": "IMAGE-DOWNSAMPLED",
            "@size": "79091",
            "@ref": "gr10",
            "@mimetype": "image/jpeg"
          },
          {
            "@category": "standard",
            "@height": "527",
            "@width": "679",
            "@_fa": "true",
            "$": "https://api.elsevier.com/content/object/eid/1-s2.0-S2468823121001000-gr1.jpg?httpAccept=%2A%2F%2A",
            "@multimediatype": "JPEG image file",
            "@type": "IMAGE-DOWNSAMPLED",
            "@size": "99778",
            "@ref": "gr1",
            "@mimetype": "image/jpeg"
          },
          {
            "@category": "standard",
            "@height": "507",
            "@width": "339",
            "@_fa": "true",
            "$": "https://api.elsevier.com/content/object/eid/1-s2.0-S2468823121001000-gr6.jpg?httpAccept=%2A%2F%2A",
            "@multimediatype": "JPEG image file",
            "@type": "IMAGE-DOWNSAMPLED",
            "@size": "55670",
            "@ref": "gr6",
            "@mimetype": "image/jpeg"
          },
          {
            "@category": "standard",
            "@height": "785",
            "@width": "339",
            "@_fa": "true",
            "$": "https://api.elsevier.com/content/object/eid/1-s2.0-S2468823121001000-gr7.jpg?httpAccept=%2A%2F%2A",
            "@multimediatype": "JPEG image file",
            "@type": "IMAGE-DOWNSAMPLED",
            "@size": "81879",
            "@ref": "gr7",
            "@mimetype": "image/jpeg"
          },
          {
            "@category": "standard",
            "@height": "521",
            "@width": "339",
            "@_fa": "true",
            "$": "https://api.elsevier.com/content/object/eid/1-s2.0-S2468823121001000-gr4.jpg?httpAccept=%2A%2F%2A",
            "@multimediatype": "JPEG image file",
            "@type": "IMAGE-DOWNSAMPLED",
            "@size": "38343",
            "@ref": "gr4",
            "@mimetype": "image/jpeg"
          },
          {
            "@category": "standard",
            "@height": "266",
            "@width": "340",
            "@_fa": "true",
            "$": "https://api.elsevier.com/content/object/eid/1-s2.0-S2468823121001000-gr5.jpg?httpAccept=%2A%2F%2A",
            "@multimediatype": "JPEG image file",
            "@type": "IMAGE-DOWNSAMPLED",
            "@size": "26074",
            "@ref": "gr5",
            "@mimetype": "image/jpeg"
          },
          {
            "@category": "standard",
            "@height": "378",
            "@width": "566",
            "@_fa": "true",
            "$": "https://api.elsevier.com/content/object/eid/1-s2.0-S2468823121001000-gr8.jpg?httpAccept=%2A%2F%2A",
            "@multimediatype": "JPEG image file",
            "@type": "IMAGE-DOWNSAMPLED",
            "@size": "68489",
            "@ref": "gr8",
            "@mimetype": "image/jpeg"
          },
          {
            "@category": "standard",
            "@height": "264",
            "@width": "339",
            "@_fa": "true",
            "$": "https://api.elsevier.com/content/object/eid/1-s2.0-S2468823121001000-gr9.jpg?httpAccept=%2A%2F%2A",
            "@multimediatype": "JPEG image file",
            "@type": "IMAGE-DOWNSAMPLED",
            "@size": "27618",
            "@ref": "gr9",
            "@mimetype": "image/jpeg"
          },
          {
            "@category": "standard",
            "@height": "200",
            "@width": "352",
            "@_fa": "true",
            "$": "https://api.elsevier.com/content/object/eid/1-s2.0-S2468823121001000-ga1.jpg?httpAccept=%2A%2F%2A",
            "@multimediatype": "JPEG image file",
            "@type": "IMAGE-DOWNSAMPLED",
            "@size": "21814",
            "@ref": "ga1",
            "@mimetype": "image/jpeg"
          },
          {
            "@category": "thumbnail",
            "@height": "164",
            "@width": "205",
            "@_fa": "true",
            "$": "https://api.elsevier.com/content/object/eid/1-s2.0-S2468823121001000-gr11.sml?httpAccept=%2A%2F%2A",
            "@multimediatype": "GIF image file",
            "@type": "IMAGE-THUMBNAIL",
            "@size": "8760",
            "@ref": "gr11",
            "@mimetype": "image/gif"
          },
          {
            "@category": "thumbnail",
            "@height": "164",
            "@width": "117",
            "@_fa": "true",
            "$": "https://api.elsevier.com/content/object/eid/1-s2.0-S2468823121001000-gr12.sml?httpAccept=%2A%2F%2A",
            "@multimediatype": "GIF image file",
            "@type": "IMAGE-THUMBNAIL",
            "@size": "6102",
            "@ref": "gr12",
            "@mimetype": "image/gif"
          },
          {
            "@category": "thumbnail",
            "@height": "163",
            "@width": "69",
            "@_fa": "true",
            "$": "https://api.elsevier.com/content/object/eid/1-s2.0-S2468823121001000-gr2.sml?httpAccept=%2A%2F%2A",
            "@multimediatype": "GIF image file",
            "@type": "IMAGE-THUMBNAIL",
            "@size": "4811",
            "@ref": "gr2",
            "@mimetype": "image/gif"
          },
          {
            "@category": "thumbnail",
            "@height": "163",
            "@width": "106",
            "@_fa": "true",
            "$": "https://api.elsevier.com/content/object/eid/1-s2.0-S2468823121001000-gr3.sml?httpAccept=%2A%2F%2A",
            "@multimediatype": "GIF image file",
            "@type": "IMAGE-THUMBNAIL",
            "@size": "5956",
            "@ref": "gr3",
            "@mimetype": "image/gif"
          },
          {
            "@category": "thumbnail",
            "@height": "164",
            "@width": "65",
            "@_fa": "true",
            "$": "https://api.elsevier.com/content/object/eid/1-s2.0-S2468823121001000-gr10.sml?httpAccept=%2A%2F%2A",
            "@multimediatype": "GIF image file",
            "@type": "IMAGE-THUMBNAIL",
            "@size": "4429",
            "@ref": "gr10",
            "@mimetype": "image/gif"
          },
          {
            "@category": "thumbnail",
            "@height": "164",
            "@width": "211",
            "@_fa": "true",
            "$": "https://api.elsevier.com/content/object/eid/1-s2.0-S2468823121001000-gr1.sml?httpAccept=%2A%2F%2A",
            "@multimediatype": "GIF image file",
            "@type": "IMAGE-THUMBNAIL",
            "@size": "13454",
            "@ref": "gr1",
            "@mimetype": "image/gif"
          },
          {
            "@category": "thumbnail",
            "@height": "163",
            "@width": "109",
            "@_fa": "true",
            "$": "https://api.elsevier.com/content/object/eid/1-s2.0-S2468823121001000-gr6.sml?httpAccept=%2A%2F%2A",
            "@multimediatype": "GIF image file",
            "@type": "IMAGE-THUMBNAIL",
            "@size": "8048",
            "@ref": "gr6",
            "@mimetype": "image/gif"
          },
          {
            "@category": "thumbnail",
            "@height": "162",
            "@width": "70",
            "@_fa": "true",
            "$": "https://api.elsevier.com/content/object/eid/1-s2.0-S2468823121001000-gr7.sml?httpAccept=%2A%2F%2A",
            "@multimediatype": "GIF image file",
            "@type": "IMAGE-THUMBNAIL",
            "@size": "5877",
            "@ref": "gr7",
            "@mimetype": "image/gif"
          },
          {
            "@category": "thumbnail",
            "@height": "163",
            "@width": "106",
            "@_fa": "true",
            "$": "https://api.elsevier.com/content/object/eid/1-s2.0-S2468823121001000-gr4.sml?httpAccept=%2A%2F%2A",
            "@multimediatype": "GIF image file",
            "@type": "IMAGE-THUMBNAIL",
            "@size": "4569",
            "@ref": "gr4",
            "@mimetype": "image/gif"
          },
          {
            "@category": "thumbnail",
            "@height": "164",
            "@width": "210",
            "@_fa": "true",
            "$": "https://api.elsevier.com/content/object/eid/1-s2.0-S2468823121001000-gr5.sml?httpAccept=%2A%2F%2A",
            "@multimediatype": "GIF image file",
            "@type": "IMAGE-THUMBNAIL",
            "@size": "10610",
            "@ref": "gr5",
            "@mimetype": "image/gif"
          },
          {
            "@category": "thumbnail",
            "@height": "146",
            "@width": "219",
            "@_fa": "true",
            "$": "https://api.elsevier.com/content/object/eid/1-s2.0-S2468823121001000-gr8.sml?httpAccept=%2A%2F%2A",
            "@multimediatype": "GIF image file",
            "@type": "IMAGE-THUMBNAIL",
            "@size": "21987",
            "@ref": "gr8",
            "@mimetype": "image/gif"
          },
          {
            "@category": "thumbnail",
            "@height": "164",
            "@width": "210",
            "@_fa": "true",
            "$": "https://api.elsevier.com/content/object/eid/1-s2.0-S2468823121001000-gr9.sml?httpAccept=%2A%2F%2A",
            "@multimediatype": "GIF image file",
            "@type": "IMAGE-THUMBNAIL",
            "@size": "9205",
            "@ref": "gr9",
            "@mimetype": "image/gif"
          },
          {
            "@category": "thumbnail",
            "@height": "124",
            "@width": "219",
            "@_fa": "true",
            "$": "https://api.elsevier.com/content/object/eid/1-s2.0-S2468823121001000-ga1.sml?httpAccept=%2A%2F%2A",
            "@multimediatype": "GIF image file",
            "@type": "IMAGE-THUMBNAIL",
            "@size": "11245",
            "@ref": "ga1",
            "@mimetype": "image/gif"
          },
          {
            "@category": "standard",
            "@_fa": "true",
            "$": "https://api.elsevier.com/content/object/eid/1-s2.0-S2468823121001000-mmc1.docx?httpAccept=%2A%2F%2A",
            "@multimediatype": "Microsoft Word file",
            "@type": "APPLICATION",
            "@size": "2287467",
            "@ref": "mmc1",
            "@mimetype": "application/word"
          },
          {
            "@category": "thumbnail",
            "@_fa": "true",
            "$": "https://api.elsevier.com/content/object/eid/1-s2.0-S2468823121001000-si1.svg?httpAccept=%2A%2F%2A",
            "@multimediatype": "Scalable Vector Graphics file",
            "@type": "ALTIMG",
            "@size": "4206",
            "@ref": "si1",
            "@mimetype": "image/svg+xml"
          },
          {
            "@category": "thumbnail",
            "@_fa": "true",
            "$": "https://api.elsevier.com/content/object/eid/1-s2.0-S2468823121001000-si2.svg?httpAccept=%2A%2F%2A",
            "@multimediatype": "Scalable Vector Graphics file",
            "@type": "ALTIMG",
            "@size": "2591",
            "@ref": "si2",
            "@mimetype": "image/svg+xml"
          },
          {
            "@category": "thumbnail",
            "@_fa": "true",
            "$": "https://api.elsevier.com/content/object/eid/1-s2.0-S2468823121001000-si3.svg?httpAccept=%2A%2F%2A",
            "@multimediatype": "Scalable Vector Graphics file",
            "@type": "ALTIMG",
            "@size": "2891",
            "@ref": "si3",
            "@mimetype": "image/svg+xml"
          },
          {
            "@category": "standard",
            "@_fa": "true",
            "$": "https://api.elsevier.com/content/object/eid/1-s2.0-S2468823121001000-am.pdf?httpAccept=%2A%2F%2A",
            "@multimediatype": "Acrobat PDF file",
            "@type": "AAM-PDF",
            "@size": "1829837",
            "@ref": "am",
            "@mimetype": "application/pdf"
          }
        ]
      },
      "link": {
        "@rel": "abstract",
        "@href": "https://api.elsevier.com/content/abstract/scopus_id/85101524489"
      }
    }
  }
}