{
  "metadata": {
    "title": "Nanoporous montmorillonite clay stabilized copper nanoparticles: Efficient and reusable catalyst for oxidation of alcohols",
    "authors": "; ; ",
    "journal": "Molecular Catalysis",
    "date": "2018-05-31",
    "doi": "10.1016/j.mcat.2017.12.032",
    "abstract": "",
    "uri": "https://api.elsevier.com/content/article/pii/S2468823117306739",
    "pii": "S2468823117306739"
  },
  "fulltext": {
    "full-text-retrieval-response": {
      "scopus-eid": "2-s2.0-85044779610",
      "originalText": "serial JL 315758 291210 291744 291790 291809 31 Molecular Catalysis MOLECULARCATALYSIS 2018-01-05 2018-01-05 2018-05-24 2018-05-24 2018-05-24T08:48:01 1-s2.0-S2468823117306739 S2468-8231(17)30673-9 S2468823117306739 10.1016/j.mcat.2017.12.032 S300 S300.1 FULL-TEXT 1-s2.0-S2468823118X00066 2025-07-16T18:54:21.416085Z 0 0 20180501 20180531 2018 2018-01-05T21:35:32.273111Z absattachment articleinfo articletitlenorm authfirstinitialnorm authfirstsurnamenorm cid cids confeditor contenttype copyright crossmark dateloaded dateloadedtxt datesearch datesort dateupdated dco docsubtype doctype doi eid ewtransactionid hubeid indexeddate issn issnnorm itemstage itemtransactionid itemweight openaccess openarchive pg pgfirst pglast pii piinorm pubdateend pubdatestart pubdatetxt pubyr sortorder srctitle srctitlenorm srctype ssids alllist content subj subheadings suppl tomb vol volfirst volissue volumelist webpdf webpdfpagecount yearnav figure table e-component body acknowledge affil appendices articletitle auth authfirstini authfull authkeywords authlast highlightsabst primabst ref specialabst 2468-8231 24688231 true 451 451 C Volume 451 22 178 185 178 185 201805 May 2018 2018-05-01 2018-05-31 2018 Metal Oxides in Catalysis - Professor Benjaram M. Reddy Festschrift Ataullah Khan article fla © 2017 Elsevier B.V. All rights reserved. NANOPOROUSMONTMORILLONITECLAYSTABILIZEDCOPPERNANOPARTICLESEFFICIENTREUSABLECATALYSTFOROXIDATIONALCOHOLS DUTTA D 1 Introduction 2 Experimental 2.1 Materials and methods 2.2 Preparation of support 2.3 Preparation of copper nanoparticles 2.4 General procedure for oxidation reaction 3 Results and discussion 3.1 Characterization of support 3.2 Characterization of supported copper nanoparticles 3.3 Catalytic activity 4 Conclusion Acknowledgements Appendix A Supplementary data References FAVIER 2013 M NANOMATERIALSINCATALYSIS CHATURVEDI 2012 307 325 S ZEMTSOV 2006 633 637 L KHUTSISHVILI 2014 19338 19344 S SCHUMMER 2008 209 212 J LANZA 2011 1739 1744 F PANDE 2008 5179 5181 S MALLA 1991 555 557 P SARKAR 2008 3334 3340 A KANTAM 2006 273 277 M MOLTENI 2006 1137 G MARCOUX 1997 10539 10540 J KIDWAI 2007 8883 8887 M HE 2008 619 L KOMADEL 2013 P CHAPTER101ACIDACTIVATIONCLAYMINERALS DUTTA 2011 650 656 D BORAH 2011 3453 B BORAH 2014 1047 1054 B DUTTA 2014 158 164 D TOJO 2006 G OXIDATIONALCOHOLSALDEHYDESKETONES DAVIS 2013 17 45 S DORMAN 1994 5661 5673 G HOLUM 1961 4814 4816 J MENGER 1979 3446 3448 F MARKO 1996 2044 2046 I KANEDA 2010 8988 9007 K ALI 2013 4815 4819 R ALI 2013 512 517 R CHOUDHARY 2005 768 V CHOUDHARY 2009 1738 1742 V DENG 2010 222 228 M CHEN 2011 34 44 Y ZHANG 2011 1693 1701 H YASUEDA 2010 7 15 T YU 2009 1752 1756 H SHAPLEY 2000 1079 1091 P BARUAH 2015 2543 2547 D YAMADA 2007 704 706 Y MALLAT 1994 247 283 T ALI 2011 1844 1849 S BEHERA 2012 245 253 G SEYEDI 2010 1303 1306 S OZTURK 2008 1644 1648 O ALI 2009 60 64 S RAO 2011 1719 1726 P NAIK 2011 1124 1127 R PARASKEVOPOULOU 2005 27 32 P PASTORIZASANTOS 2008 1724 1737 I AYYAPPAN 1996 271 281 S KIRALY 1996 401 408 Z GUO 1999 591 594 L KUMARI 2013 1 P RAO 1974 C CRYSTALCHEMISTRYPHASETRANSITIONRELATEDASPECTS SEMMELHACK 1984 3374 3376 M VELUSAMY 2006 923 926 S SHEIKH 1972 257 260 M WILLIAMS 2004 11833 11837 S MITSUDOME 2008 4804 4806 T CHOUDHARY 2007 267 V ENACHE 2006 362 366 D DUTTAX2018X178 DUTTAX2018X178X185 DUTTAX2018X178XD DUTTAX2018X178X185XD 2020-05-24T00:00:00.000Z 2020-05-24T00:00:00.000Z http://creativecommons.org/licenses/by-nc-nd/4.0 © 2017 Elsevier B.V. All rights reserved. item S2468-8231(17)30673-9 S2468823117306739 1-s2.0-S2468823117306739 10.1016/j.mcat.2017.12.032 315758 2018-05-24T08:36:38.594733Z 2018-05-01 2018-05-31 1-s2.0-S2468823117306739-main.pdf https://s3-eu-west-1.amazonaws.com/prod-ucs-content-store-eu-west/content/pii:S2468823117306739/MAIN/application/pdf/ce76bf17945a81830a9eb9298d09e7f4/main.pdf https://s3.amazonaws.com/prod-ucs-content-store-us-east/content/pii:S2468823117306739/MAIN/application/pdf/ce76bf17945a81830a9eb9298d09e7f4/main.pdf main.pdf pdf true 4778434 MAIN 8 1-s2.0-S2468823117306739-main_1.png https://s3-eu-west-1.amazonaws.com/prod-ucs-content-store-eu-west/content/pii:S2468823117306739/PREVIEW/image/png/c4a9ad55aff57dbdc312203a5a9ae55a/main_1.png https://s3.amazonaws.com/prod-ucs-content-store-us-east/content/pii:S2468823117306739/PREVIEW/image/png/c4a9ad55aff57dbdc312203a5a9ae55a/main_1.png main_1.png png 58154 849 656 IMAGE-WEB-PDF 1 1-s2.0-S2468823117306739-fx1.sml https://s3-eu-west-1.amazonaws.com/prod-ucs-content-store-eu-west/content/pii:S2468823117306739/fx1/THUMBNAIL/image/gif/7be2257dd1a09400c9b59a60e4e0e8f3/fx1.sml https://s3.amazonaws.com/prod-ucs-content-store-us-east/content/pii:S2468823117306739/fx1/THUMBNAIL/image/gif/7be2257dd1a09400c9b59a60e4e0e8f3/fx1.sml fx1 true fx1.sml sml 14299 142 219 IMAGE-THUMBNAIL 1-s2.0-S2468823117306739-fx10.sml https://s3-eu-west-1.amazonaws.com/prod-ucs-content-store-eu-west/content/pii:S2468823117306739/fx10/THUMBNAIL/image/gif/e27134e3e8e5a66322904f2f1f8fd270/fx10.sml https://s3.amazonaws.com/prod-ucs-content-store-us-east/content/pii:S2468823117306739/fx10/THUMBNAIL/image/gif/e27134e3e8e5a66322904f2f1f8fd270/fx10.sml fx10 fx10.sml sml 2750 55 219 IMAGE-THUMBNAIL 1-s2.0-S2468823117306739-fx11.sml https://s3-eu-west-1.amazonaws.com/prod-ucs-content-store-eu-west/content/pii:S2468823117306739/fx11/THUMBNAIL/image/gif/489403fa2354d4737bace802611aecaf/fx11.sml https://s3.amazonaws.com/prod-ucs-content-store-us-east/content/pii:S2468823117306739/fx11/THUMBNAIL/image/gif/489403fa2354d4737bace802611aecaf/fx11.sml fx11 fx11.sml sml 2894 64 219 IMAGE-THUMBNAIL 1-s2.0-S2468823117306739-fx12.sml https://s3-eu-west-1.amazonaws.com/prod-ucs-content-store-eu-west/content/pii:S2468823117306739/fx12/THUMBNAIL/image/gif/32d7ae49baeec0f35ecbd1eda6b40d39/fx12.sml https://s3.amazonaws.com/prod-ucs-content-store-us-east/content/pii:S2468823117306739/fx12/THUMBNAIL/image/gif/32d7ae49baeec0f35ecbd1eda6b40d39/fx12.sml fx12 fx12.sml sml 3596 117 219 IMAGE-THUMBNAIL 1-s2.0-S2468823117306739-fx13.sml https://s3-eu-west-1.amazonaws.com/prod-ucs-content-store-eu-west/content/pii:S2468823117306739/fx13/THUMBNAIL/image/gif/9fe908984336bd3e39d3c316a4b3661a/fx13.sml https://s3.amazonaws.com/prod-ucs-content-store-us-east/content/pii:S2468823117306739/fx13/THUMBNAIL/image/gif/9fe908984336bd3e39d3c316a4b3661a/fx13.sml fx13 fx13.sml sml 3427 117 219 IMAGE-THUMBNAIL 1-s2.0-S2468823117306739-fx14.sml https://s3-eu-west-1.amazonaws.com/prod-ucs-content-store-eu-west/content/pii:S2468823117306739/fx14/THUMBNAIL/image/gif/7f3a0bc24581ed20c935d8b15e730b2a/fx14.sml https://s3.amazonaws.com/prod-ucs-content-store-us-east/content/pii:S2468823117306739/fx14/THUMBNAIL/image/gif/7f3a0bc24581ed20c935d8b15e730b2a/fx14.sml fx14 fx14.sml sml 3559 118 219 IMAGE-THUMBNAIL 1-s2.0-S2468823117306739-fx15.sml https://s3-eu-west-1.amazonaws.com/prod-ucs-content-store-eu-west/content/pii:S2468823117306739/fx15/THUMBNAIL/image/gif/594c7a073568128191cfbc63e2de4d2f/fx15.sml https://s3.amazonaws.com/prod-ucs-content-store-us-east/content/pii:S2468823117306739/fx15/THUMBNAIL/image/gif/594c7a073568128191cfbc63e2de4d2f/fx15.sml fx15 fx15.sml sml 3437 118 219 IMAGE-THUMBNAIL 1-s2.0-S2468823117306739-fx2.sml https://s3-eu-west-1.amazonaws.com/prod-ucs-content-store-eu-west/content/pii:S2468823117306739/fx2/THUMBNAIL/image/gif/ca55fc669195d078afc7aed9013ef6a1/fx2.sml https://s3.amazonaws.com/prod-ucs-content-store-us-east/content/pii:S2468823117306739/fx2/THUMBNAIL/image/gif/ca55fc669195d078afc7aed9013ef6a1/fx2.sml fx2 fx2.sml sml 3189 70 219 IMAGE-THUMBNAIL 1-s2.0-S2468823117306739-fx3.sml https://s3-eu-west-1.amazonaws.com/prod-ucs-content-store-eu-west/content/pii:S2468823117306739/fx3/THUMBNAIL/image/gif/054895b693fab530a0bf875cad554112/fx3.sml https://s3.amazonaws.com/prod-ucs-content-store-us-east/content/pii:S2468823117306739/fx3/THUMBNAIL/image/gif/054895b693fab530a0bf875cad554112/fx3.sml fx3 fx3.sml sml 3536 86 219 IMAGE-THUMBNAIL 1-s2.0-S2468823117306739-fx4.sml https://s3-eu-west-1.amazonaws.com/prod-ucs-content-store-eu-west/content/pii:S2468823117306739/fx4/THUMBNAIL/image/gif/fce14522401222f7baddd99e65a71e00/fx4.sml https://s3.amazonaws.com/prod-ucs-content-store-us-east/content/pii:S2468823117306739/fx4/THUMBNAIL/image/gif/fce14522401222f7baddd99e65a71e00/fx4.sml fx4 fx4.sml sml 4473 146 219 IMAGE-THUMBNAIL 1-s2.0-S2468823117306739-fx5.sml https://s3-eu-west-1.amazonaws.com/prod-ucs-content-store-eu-west/content/pii:S2468823117306739/fx5/THUMBNAIL/image/gif/5bc83c415beaf9164f7839060da4a2fa/fx5.sml https://s3.amazonaws.com/prod-ucs-content-store-us-east/content/pii:S2468823117306739/fx5/THUMBNAIL/image/gif/5bc83c415beaf9164f7839060da4a2fa/fx5.sml fx5 fx5.sml sml 4258 148 219 IMAGE-THUMBNAIL 1-s2.0-S2468823117306739-fx6.sml https://s3-eu-west-1.amazonaws.com/prod-ucs-content-store-eu-west/content/pii:S2468823117306739/fx6/THUMBNAIL/image/gif/44f3ea817675bc8faf55955837b1a2ad/fx6.sml https://s3.amazonaws.com/prod-ucs-content-store-us-east/content/pii:S2468823117306739/fx6/THUMBNAIL/image/gif/44f3ea817675bc8faf55955837b1a2ad/fx6.sml fx6 fx6.sml sml 5063 153 219 IMAGE-THUMBNAIL 1-s2.0-S2468823117306739-fx7.sml https://s3-eu-west-1.amazonaws.com/prod-ucs-content-store-eu-west/content/pii:S2468823117306739/fx7/THUMBNAIL/image/gif/bc3f05698d44ff283d658bc60b78e992/fx7.sml https://s3.amazonaws.com/prod-ucs-content-store-us-east/content/pii:S2468823117306739/fx7/THUMBNAIL/image/gif/bc3f05698d44ff283d658bc60b78e992/fx7.sml fx7 fx7.sml sml 4815 153 219 IMAGE-THUMBNAIL 1-s2.0-S2468823117306739-fx8.sml https://s3-eu-west-1.amazonaws.com/prod-ucs-content-store-eu-west/content/pii:S2468823117306739/fx8/THUMBNAIL/image/gif/fba4e1d72518ca0e5bbc30e2dc58e591/fx8.sml https://s3.amazonaws.com/prod-ucs-content-store-us-east/content/pii:S2468823117306739/fx8/THUMBNAIL/image/gif/fba4e1d72518ca0e5bbc30e2dc58e591/fx8.sml fx8 fx8.sml sml 2822 53 219 IMAGE-THUMBNAIL 1-s2.0-S2468823117306739-fx9.sml https://s3-eu-west-1.amazonaws.com/prod-ucs-content-store-eu-west/content/pii:S2468823117306739/fx9/THUMBNAIL/image/gif/948741cc0e3ac960893ed5ca005c3b05/fx9.sml https://s3.amazonaws.com/prod-ucs-content-store-us-east/content/pii:S2468823117306739/fx9/THUMBNAIL/image/gif/948741cc0e3ac960893ed5ca005c3b05/fx9.sml fx9 fx9.sml sml 2899 62 219 IMAGE-THUMBNAIL 1-s2.0-S2468823117306739-gr1.sml https://s3-eu-west-1.amazonaws.com/prod-ucs-content-store-eu-west/content/pii:S2468823117306739/gr1/THUMBNAIL/image/gif/593fa0401ba85731652936a3162d75a5/gr1.sml https://s3.amazonaws.com/prod-ucs-content-store-us-east/content/pii:S2468823117306739/gr1/THUMBNAIL/image/gif/593fa0401ba85731652936a3162d75a5/gr1.sml gr1 gr1.sml sml 14051 100 219 IMAGE-THUMBNAIL 1-s2.0-S2468823117306739-gr10.sml https://s3-eu-west-1.amazonaws.com/prod-ucs-content-store-eu-west/content/pii:S2468823117306739/gr10/THUMBNAIL/image/gif/a9669a34f5066c96e91d10d35477f49a/gr10.sml https://s3.amazonaws.com/prod-ucs-content-store-us-east/content/pii:S2468823117306739/gr10/THUMBNAIL/image/gif/a9669a34f5066c96e91d10d35477f49a/gr10.sml gr10 gr10.sml sml 7868 163 219 IMAGE-THUMBNAIL 1-s2.0-S2468823117306739-gr2.sml https://s3-eu-west-1.amazonaws.com/prod-ucs-content-store-eu-west/content/pii:S2468823117306739/gr2/THUMBNAIL/image/gif/68814207f7d2032ccf50a25a74696300/gr2.sml https://s3.amazonaws.com/prod-ucs-content-store-us-east/content/pii:S2468823117306739/gr2/THUMBNAIL/image/gif/68814207f7d2032ccf50a25a74696300/gr2.sml gr2 gr2.sml sml 5524 164 207 IMAGE-THUMBNAIL 1-s2.0-S2468823117306739-gr3.sml https://s3-eu-west-1.amazonaws.com/prod-ucs-content-store-eu-west/content/pii:S2468823117306739/gr3/THUMBNAIL/image/gif/7575c8586c19cd210e5ca02a4ee88af1/gr3.sml https://s3.amazonaws.com/prod-ucs-content-store-us-east/content/pii:S2468823117306739/gr3/THUMBNAIL/image/gif/7575c8586c19cd210e5ca02a4ee88af1/gr3.sml gr3 gr3.sml sml 6549 164 208 IMAGE-THUMBNAIL 1-s2.0-S2468823117306739-gr4.sml https://s3-eu-west-1.amazonaws.com/prod-ucs-content-store-eu-west/content/pii:S2468823117306739/gr4/THUMBNAIL/image/gif/d2c2d1ef9c88dcc42f5d6dfd69829b93/gr4.sml https://s3.amazonaws.com/prod-ucs-content-store-us-east/content/pii:S2468823117306739/gr4/THUMBNAIL/image/gif/d2c2d1ef9c88dcc42f5d6dfd69829b93/gr4.sml gr4 gr4.sml sml 5243 94 219 IMAGE-THUMBNAIL 1-s2.0-S2468823117306739-gr5.sml https://s3-eu-west-1.amazonaws.com/prod-ucs-content-store-eu-west/content/pii:S2468823117306739/gr5/THUMBNAIL/image/gif/6802cb30901b5094ceaf01779b68885b/gr5.sml https://s3.amazonaws.com/prod-ucs-content-store-us-east/content/pii:S2468823117306739/gr5/THUMBNAIL/image/gif/6802cb30901b5094ceaf01779b68885b/gr5.sml gr5 gr5.sml sml 12543 81 219 IMAGE-THUMBNAIL 1-s2.0-S2468823117306739-gr6.sml https://s3-eu-west-1.amazonaws.com/prod-ucs-content-store-eu-west/content/pii:S2468823117306739/gr6/THUMBNAIL/image/gif/75ba1047237e52a50609b19304a0cb37/gr6.sml https://s3.amazonaws.com/prod-ucs-content-store-us-east/content/pii:S2468823117306739/gr6/THUMBNAIL/image/gif/75ba1047237e52a50609b19304a0cb37/gr6.sml gr6 gr6.sml sml 19695 164 201 IMAGE-THUMBNAIL 1-s2.0-S2468823117306739-gr7.sml https://s3-eu-west-1.amazonaws.com/prod-ucs-content-store-eu-west/content/pii:S2468823117306739/gr7/THUMBNAIL/image/gif/7ce5687d302807bc616d593d0c15e198/gr7.sml https://s3.amazonaws.com/prod-ucs-content-store-us-east/content/pii:S2468823117306739/gr7/THUMBNAIL/image/gif/7ce5687d302807bc616d593d0c15e198/gr7.sml gr7 gr7.sml sml 16143 164 164 IMAGE-THUMBNAIL 1-s2.0-S2468823117306739-gr8.sml https://s3-eu-west-1.amazonaws.com/prod-ucs-content-store-eu-west/content/pii:S2468823117306739/gr8/THUMBNAIL/image/gif/aa90dafc0edd990bc7cf14abfba94a9c/gr8.sml https://s3.amazonaws.com/prod-ucs-content-store-us-east/content/pii:S2468823117306739/gr8/THUMBNAIL/image/gif/aa90dafc0edd990bc7cf14abfba94a9c/gr8.sml gr8 gr8.sml sml 22449 149 219 IMAGE-THUMBNAIL 1-s2.0-S2468823117306739-gr9.sml https://s3-eu-west-1.amazonaws.com/prod-ucs-content-store-eu-west/content/pii:S2468823117306739/gr9/THUMBNAIL/image/gif/3eeee5f2156ad908d8259d51ea7069fd/gr9.sml https://s3.amazonaws.com/prod-ucs-content-store-us-east/content/pii:S2468823117306739/gr9/THUMBNAIL/image/gif/3eeee5f2156ad908d8259d51ea7069fd/gr9.sml gr9 gr9.sml sml 6039 132 219 IMAGE-THUMBNAIL 1-s2.0-S2468823117306739-sc1.sml https://s3-eu-west-1.amazonaws.com/prod-ucs-content-store-eu-west/content/pii:S2468823117306739/sc1/THUMBNAIL/image/gif/cc27418b609a6f52ee6a7bf82ee8fd2c/sc1.sml https://s3.amazonaws.com/prod-ucs-content-store-us-east/content/pii:S2468823117306739/sc1/THUMBNAIL/image/gif/cc27418b609a6f52ee6a7bf82ee8fd2c/sc1.sml sc1 sc1.sml sml 5556 85 219 IMAGE-THUMBNAIL 1-s2.0-S2468823117306739-fx1.jpg https://s3-eu-west-1.amazonaws.com/prod-ucs-content-store-eu-west/content/pii:S2468823117306739/fx1/DOWNSAMPLED/image/jpeg/fcb4cbe1d2dbf932e75ba2897aa3af38/fx1.jpg https://s3.amazonaws.com/prod-ucs-content-store-us-east/content/pii:S2468823117306739/fx1/DOWNSAMPLED/image/jpeg/fcb4cbe1d2dbf932e75ba2897aa3af38/fx1.jpg fx1 true fx1.jpg jpg 18395 200 309 IMAGE-DOWNSAMPLED 1-s2.0-S2468823117306739-fx10.jpg https://s3-eu-west-1.amazonaws.com/prod-ucs-content-store-eu-west/content/pii:S2468823117306739/fx10/DOWNSAMPLED/image/jpeg/57a4d6f932e06a2d807dc17164bc9a60/fx10.jpg https://s3.amazonaws.com/prod-ucs-content-store-us-east/content/pii:S2468823117306739/fx10/DOWNSAMPLED/image/jpeg/57a4d6f932e06a2d807dc17164bc9a60/fx10.jpg fx10 fx10.jpg jpg 1248 23 92 IMAGE-DOWNSAMPLED 1-s2.0-S2468823117306739-fx11.jpg https://s3-eu-west-1.amazonaws.com/prod-ucs-content-store-eu-west/content/pii:S2468823117306739/fx11/DOWNSAMPLED/image/jpeg/7ab54d46fc201b930219016c38b3fdb5/fx11.jpg https://s3.amazonaws.com/prod-ucs-content-store-us-east/content/pii:S2468823117306739/fx11/DOWNSAMPLED/image/jpeg/7ab54d46fc201b930219016c38b3fdb5/fx11.jpg fx11 fx11.jpg jpg 1452 26 89 IMAGE-DOWNSAMPLED 1-s2.0-S2468823117306739-fx12.jpg https://s3-eu-west-1.amazonaws.com/prod-ucs-content-store-eu-west/content/pii:S2468823117306739/fx12/DOWNSAMPLED/image/jpeg/3c354a1c08aeb48e39438c5499f9dcf7/fx12.jpg https://s3.amazonaws.com/prod-ucs-content-store-us-east/content/pii:S2468823117306739/fx12/DOWNSAMPLED/image/jpeg/3c354a1c08aeb48e39438c5499f9dcf7/fx12.jpg fx12 fx12.jpg jpg 1540 47 88 IMAGE-DOWNSAMPLED 1-s2.0-S2468823117306739-fx13.jpg https://s3-eu-west-1.amazonaws.com/prod-ucs-content-store-eu-west/content/pii:S2468823117306739/fx13/DOWNSAMPLED/image/jpeg/b25dc549407eb5e79aedd0aa71bd6e64/fx13.jpg https://s3.amazonaws.com/prod-ucs-content-store-us-east/content/pii:S2468823117306739/fx13/DOWNSAMPLED/image/jpeg/b25dc549407eb5e79aedd0aa71bd6e64/fx13.jpg fx13 fx13.jpg jpg 1513 47 88 IMAGE-DOWNSAMPLED 1-s2.0-S2468823117306739-fx14.jpg https://s3-eu-west-1.amazonaws.com/prod-ucs-content-store-eu-west/content/pii:S2468823117306739/fx14/DOWNSAMPLED/image/jpeg/c79fc8b059a673ee2d2591964d5f701b/fx14.jpg https://s3.amazonaws.com/prod-ucs-content-store-us-east/content/pii:S2468823117306739/fx14/DOWNSAMPLED/image/jpeg/c79fc8b059a673ee2d2591964d5f701b/fx14.jpg fx14 fx14.jpg jpg 1572 49 92 IMAGE-DOWNSAMPLED 1-s2.0-S2468823117306739-fx15.jpg https://s3-eu-west-1.amazonaws.com/prod-ucs-content-store-eu-west/content/pii:S2468823117306739/fx15/DOWNSAMPLED/image/jpeg/1ec2f318f34155a4af191fe40eb91e54/fx15.jpg https://s3.amazonaws.com/prod-ucs-content-store-us-east/content/pii:S2468823117306739/fx15/DOWNSAMPLED/image/jpeg/1ec2f318f34155a4af191fe40eb91e54/fx15.jpg fx15 fx15.jpg jpg 1517 49 92 IMAGE-DOWNSAMPLED 1-s2.0-S2468823117306739-fx2.jpg https://s3-eu-west-1.amazonaws.com/prod-ucs-content-store-eu-west/content/pii:S2468823117306739/fx2/DOWNSAMPLED/image/jpeg/9758566ebe77c59d947cf28e9cd82e9d/fx2.jpg https://s3.amazonaws.com/prod-ucs-content-store-us-east/content/pii:S2468823117306739/fx2/DOWNSAMPLED/image/jpeg/9758566ebe77c59d947cf28e9cd82e9d/fx2.jpg fx2 fx2.jpg jpg 1099 22 68 IMAGE-DOWNSAMPLED 1-s2.0-S2468823117306739-fx3.jpg https://s3-eu-west-1.amazonaws.com/prod-ucs-content-store-eu-west/content/pii:S2468823117306739/fx3/DOWNSAMPLED/image/jpeg/2f80075439c305ad7794d8057ddc010f/fx3.jpg https://s3.amazonaws.com/prod-ucs-content-store-us-east/content/pii:S2468823117306739/fx3/DOWNSAMPLED/image/jpeg/2f80075439c305ad7794d8057ddc010f/fx3.jpg fx3 fx3.jpg jpg 923 22 55 IMAGE-DOWNSAMPLED 1-s2.0-S2468823117306739-fx4.jpg https://s3-eu-west-1.amazonaws.com/prod-ucs-content-store-eu-west/content/pii:S2468823117306739/fx4/DOWNSAMPLED/image/jpeg/8ce2de8a4b44ad38dbdbc5e18815fb09/fx4.jpg https://s3.amazonaws.com/prod-ucs-content-store-us-east/content/pii:S2468823117306739/fx4/DOWNSAMPLED/image/jpeg/8ce2de8a4b44ad38dbdbc5e18815fb09/fx4.jpg fx4 fx4.jpg jpg 1211 41 61 IMAGE-DOWNSAMPLED 1-s2.0-S2468823117306739-fx5.jpg https://s3-eu-west-1.amazonaws.com/prod-ucs-content-store-eu-west/content/pii:S2468823117306739/fx5/DOWNSAMPLED/image/jpeg/585ba0a67c5e69e8df34a2b306b72c5f/fx5.jpg https://s3.amazonaws.com/prod-ucs-content-store-us-east/content/pii:S2468823117306739/fx5/DOWNSAMPLED/image/jpeg/585ba0a67c5e69e8df34a2b306b72c5f/fx5.jpg fx5 fx5.jpg jpg 1198 41 60 IMAGE-DOWNSAMPLED 1-s2.0-S2468823117306739-fx6.jpg https://s3-eu-west-1.amazonaws.com/prod-ucs-content-store-eu-west/content/pii:S2468823117306739/fx6/DOWNSAMPLED/image/jpeg/6742adced8f042a460b48c6d53e6c223/fx6.jpg https://s3.amazonaws.com/prod-ucs-content-store-us-east/content/pii:S2468823117306739/fx6/DOWNSAMPLED/image/jpeg/6742adced8f042a460b48c6d53e6c223/fx6.jpg fx6 fx6.jpg jpg 1519 42 60 IMAGE-DOWNSAMPLED 1-s2.0-S2468823117306739-fx7.jpg https://s3-eu-west-1.amazonaws.com/prod-ucs-content-store-eu-west/content/pii:S2468823117306739/fx7/DOWNSAMPLED/image/jpeg/ae72dc565430c177ca88b99c01520aab/fx7.jpg https://s3.amazonaws.com/prod-ucs-content-store-us-east/content/pii:S2468823117306739/fx7/DOWNSAMPLED/image/jpeg/ae72dc565430c177ca88b99c01520aab/fx7.jpg fx7 fx7.jpg jpg 1523 42 60 IMAGE-DOWNSAMPLED 1-s2.0-S2468823117306739-fx8.jpg https://s3-eu-west-1.amazonaws.com/prod-ucs-content-store-eu-west/content/pii:S2468823117306739/fx8/DOWNSAMPLED/image/jpeg/09ffc8445da9ac9ba586eef4fde4cf4d/fx8.jpg https://s3.amazonaws.com/prod-ucs-content-store-us-east/content/pii:S2468823117306739/fx8/DOWNSAMPLED/image/jpeg/09ffc8445da9ac9ba586eef4fde4cf4d/fx8.jpg fx8 fx8.jpg jpg 1320 22 91 IMAGE-DOWNSAMPLED 1-s2.0-S2468823117306739-fx9.jpg https://s3-eu-west-1.amazonaws.com/prod-ucs-content-store-eu-west/content/pii:S2468823117306739/fx9/DOWNSAMPLED/image/jpeg/ced16d01a4a209d81697d7c1f9a9e461/fx9.jpg https://s3.amazonaws.com/prod-ucs-content-store-us-east/content/pii:S2468823117306739/fx9/DOWNSAMPLED/image/jpeg/ced16d01a4a209d81697d7c1f9a9e461/fx9.jpg fx9 fx9.jpg jpg 1346 25 88 IMAGE-DOWNSAMPLED 1-s2.0-S2468823117306739-gr1.jpg https://s3-eu-west-1.amazonaws.com/prod-ucs-content-store-eu-west/content/pii:S2468823117306739/gr1/DOWNSAMPLED/image/jpeg/cfe1d1d8a6d42da3db6f4b4dada9e08b/gr1.jpg https://s3.amazonaws.com/prod-ucs-content-store-us-east/content/pii:S2468823117306739/gr1/DOWNSAMPLED/image/jpeg/cfe1d1d8a6d42da3db6f4b4dada9e08b/gr1.jpg gr1 gr1.jpg jpg 77419 301 659 IMAGE-DOWNSAMPLED 1-s2.0-S2468823117306739-gr10.jpg https://s3-eu-west-1.amazonaws.com/prod-ucs-content-store-eu-west/content/pii:S2468823117306739/gr10/DOWNSAMPLED/image/jpeg/61d4a319098fed00ebda58219dca832f/gr10.jpg https://s3.amazonaws.com/prod-ucs-content-store-us-east/content/pii:S2468823117306739/gr10/DOWNSAMPLED/image/jpeg/61d4a319098fed00ebda58219dca832f/gr10.jpg gr10 gr10.jpg jpg 16064 210 282 IMAGE-DOWNSAMPLED 1-s2.0-S2468823117306739-gr2.jpg https://s3-eu-west-1.amazonaws.com/prod-ucs-content-store-eu-west/content/pii:S2468823117306739/gr2/DOWNSAMPLED/image/jpeg/5f8ef0eccf67d269f85d9749a1f0823b/gr2.jpg https://s3.amazonaws.com/prod-ucs-content-store-us-east/content/pii:S2468823117306739/gr2/DOWNSAMPLED/image/jpeg/5f8ef0eccf67d269f85d9749a1f0823b/gr2.jpg gr2 gr2.jpg jpg 12241 223 282 IMAGE-DOWNSAMPLED 1-s2.0-S2468823117306739-gr3.jpg https://s3-eu-west-1.amazonaws.com/prod-ucs-content-store-eu-west/content/pii:S2468823117306739/gr3/DOWNSAMPLED/image/jpeg/1efea214a6380598791606d878c13d97/gr3.jpg https://s3.amazonaws.com/prod-ucs-content-store-us-east/content/pii:S2468823117306739/gr3/DOWNSAMPLED/image/jpeg/1efea214a6380598791606d878c13d97/gr3.jpg gr3 gr3.jpg jpg 14073 222 282 IMAGE-DOWNSAMPLED 1-s2.0-S2468823117306739-gr4.jpg https://s3-eu-west-1.amazonaws.com/prod-ucs-content-store-eu-west/content/pii:S2468823117306739/gr4/DOWNSAMPLED/image/jpeg/dcdafebfa5d01e689754f486570040c1/gr4.jpg https://s3.amazonaws.com/prod-ucs-content-store-us-east/content/pii:S2468823117306739/gr4/DOWNSAMPLED/image/jpeg/dcdafebfa5d01e689754f486570040c1/gr4.jpg gr4 gr4.jpg jpg 28246 242 565 IMAGE-DOWNSAMPLED 1-s2.0-S2468823117306739-gr5.jpg https://s3-eu-west-1.amazonaws.com/prod-ucs-content-store-eu-west/content/pii:S2468823117306739/gr5/DOWNSAMPLED/image/jpeg/4c1ded7b5697338a45bc4fb2a5d6724d/gr5.jpg https://s3.amazonaws.com/prod-ucs-content-store-us-east/content/pii:S2468823117306739/gr5/DOWNSAMPLED/image/jpeg/4c1ded7b5697338a45bc4fb2a5d6724d/gr5.jpg gr5 gr5.jpg jpg 65684 243 659 IMAGE-DOWNSAMPLED 1-s2.0-S2468823117306739-gr6.jpg https://s3-eu-west-1.amazonaws.com/prod-ucs-content-store-eu-west/content/pii:S2468823117306739/gr6/DOWNSAMPLED/image/jpeg/1c78f0daa07bb88ce6675309ece8dfe5/gr6.jpg https://s3.amazonaws.com/prod-ucs-content-store-us-east/content/pii:S2468823117306739/gr6/DOWNSAMPLED/image/jpeg/1c78f0daa07bb88ce6675309ece8dfe5/gr6.jpg gr6 gr6.jpg jpg 173197 537 659 IMAGE-DOWNSAMPLED 1-s2.0-S2468823117306739-gr7.jpg https://s3-eu-west-1.amazonaws.com/prod-ucs-content-store-eu-west/content/pii:S2468823117306739/gr7/DOWNSAMPLED/image/jpeg/ea9bfe4b6b95126f2bf883b7bacba85a/gr7.jpg https://s3.amazonaws.com/prod-ucs-content-store-us-east/content/pii:S2468823117306739/gr7/DOWNSAMPLED/image/jpeg/ea9bfe4b6b95126f2bf883b7bacba85a/gr7.jpg gr7 gr7.jpg jpg 36691 339 339 IMAGE-DOWNSAMPLED 1-s2.0-S2468823117306739-gr8.jpg https://s3-eu-west-1.amazonaws.com/prod-ucs-content-store-eu-west/content/pii:S2468823117306739/gr8/DOWNSAMPLED/image/jpeg/3535ea26accabc5bc0c3ba898bcc6fd9/gr8.jpg https://s3.amazonaws.com/prod-ucs-content-store-us-east/content/pii:S2468823117306739/gr8/DOWNSAMPLED/image/jpeg/3535ea26accabc5bc0c3ba898bcc6fd9/gr8.jpg gr8 gr8.jpg jpg 105933 450 659 IMAGE-DOWNSAMPLED 1-s2.0-S2468823117306739-gr9.jpg https://s3-eu-west-1.amazonaws.com/prod-ucs-content-store-eu-west/content/pii:S2468823117306739/gr9/DOWNSAMPLED/image/jpeg/4e3ee28bb1a9f1741a94ce5847b1d6f9/gr9.jpg https://s3.amazonaws.com/prod-ucs-content-store-us-east/content/pii:S2468823117306739/gr9/DOWNSAMPLED/image/jpeg/4e3ee28bb1a9f1741a94ce5847b1d6f9/gr9.jpg gr9 gr9.jpg jpg 17104 205 339 IMAGE-DOWNSAMPLED 1-s2.0-S2468823117306739-sc1.jpg https://s3-eu-west-1.amazonaws.com/prod-ucs-content-store-eu-west/content/pii:S2468823117306739/sc1/DOWNSAMPLED/image/jpeg/0d30f849ab63a68577703720db864dbf/sc1.jpg https://s3.amazonaws.com/prod-ucs-content-store-us-east/content/pii:S2468823117306739/sc1/DOWNSAMPLED/image/jpeg/0d30f849ab63a68577703720db864dbf/sc1.jpg sc1 sc1.jpg jpg 16222 131 339 IMAGE-DOWNSAMPLED 1-s2.0-S2468823117306739-mmc1.doc https://s3-eu-west-1.amazonaws.com/prod-ucs-content-store-eu-west/content/pii:S2468823117306739/mmc1/MAIN/application/msword/cbda4f0e152194c7e7dd437371a69f02/mmc1.doc https://s3.amazonaws.com/prod-ucs-content-store-us-east/content/pii:S2468823117306739/mmc1/MAIN/application/msword/cbda4f0e152194c7e7dd437371a69f02/mmc1.doc mmc1 mmc1.doc doc 1073664 APPLICATION MCAT 439 S2468-8231(17)30673-9 10.1016/j.mcat.2017.12.032 Elsevier B.V. Scheme 1 Oxidation reaction of aromatic alcohols to the corresponding carbonyl compounds catalyzed by copper nanoparticles/AT-Mont. Scheme 1 Fig 1 HRTEM images of AT-Mont. (A) before and (B) after supporting copper nanoparticles. Fig 1 Fig. 2 Solid state UV of copper nanoparticles/AT-Mont. Fig. 2 Fig. 3 The powder XRD pattern of copper nanoparticles/AT-Mont. Fig. 3 Fig. 4 XPS pattern of (A) copper 2p and (B) oxygen 1s. Fig. 4 Fig. 5 (A) SEM image and (B) EDX analysis of copper nanoparticles/AT-Mont. Fig. 5 Fig. 6 Elemental dot mapping of O, Al, Si, Fe and Cu on the copper nanoparticles/AT-Mont. surface. Fig. 6 Fig. 7 (A) TEM images of copper nanoparticles/AT-Mont. Fig. 7 Fig. 8 (A) HRTEM images, (B) Selected Area Electron Pattern (SEAD) and (C) Enlarge image of HRTEM with fringe spacing of copper nanoparticles/AT-Mont. Fig. 8 Fig. 9 BJH pore size distribution curves of fresh and recovered catalysts. Fig. 9 Fig. 10 The powder XRD pattern of recovered catalyst. Fig. 10 Table 1 Oxide compositions and cation exchange capacities of parent montmorillonite and AT-Mont. Table 1 Samples Name Chemical analysis (%) CEC (meq/100 g of clay) SiO2 Al2O3 CaO Fe2O3 MgO (Na2O + K2O + TiO2) LOI Na-Mont. 41.6 34.0 0.36 7.5 3.2 3.0 15.8 126 AT-Mont. 73.0 14.0 0.22 5.2 1.2 1.3 3.9 42 Table 2 Results of oxidation reaction of aromatic alcohols to the corresponding carbonyl compounds catalyzed by copper nanoparticles/AT-Mont. Table 2 Entry Substrate Product Reaction time (h) Yield (%) Selectivity (%) 1 4.0 97.8 a , 91 b (1st run) 100 93.6 a , 88 b (2nd run) 92.1 a , 87 b (3rd run) 2 5.0 82 b 100 3 5.0 78 b 100 4 4.0 90 b 100 5 4.0 65 b 100 6 6.5 69 b 100 7 9.0 54 b 100 Reaction conditions: All reactions were conducted in THF at 66 °C (reflux temperature of THF) under oxygen atmosphere. Alcohol (1 mmol), THF (20 ml), copper nanoparticles/AT-Mont. (16 mg). a GC yield. b Isolated yield. Table 3 Comparison of oxidation of benzyl alcohol over copper nanoparticles/AT-Mont. with earlier reported catalysts. Table 3 Entry Catalyst Oxidizing agent Temperature (°C) Time (h) Yield (%) Ref. 1 Cu/CuO/Resin O2 205 5.0 90 [7] 2 Cu/Cellulose O2 120 48.0 30 [38] 3 Cu/Hydrotalcite – 130 13.0 85 [59] 4 Au/U3O8 O2 130 5.0 50 [60] 5 Au/TiO2 TBHP 94 2.0 50 [61] 6 Au/MgO O2 130 5.0 44 [30] 7 Au/MgO TBHP 94 0.5 73 [31] 8 Cu-clay O2 66 4.0 97.8 Present work Nanoporous montmorillonite clay stabilized copper nanoparticles: Efficient and reusable catalyst for oxidation of alcohols Dipanka Dutta Ankana Phukan Dipak Kumar Dutta ⁎ Materials Sciences & Technology Division, CSIR-North East Institute of Science and Technology, Jorhat, 785 006, Assam, India Materials Sciences & Technology Division CSIR-North East Institute of Science and Technology Jorhat Assam 785 006 India ⁎ Corresponding author. Graphical abstract Stable and spherical copper nanoparticles of size less than 10 nm were generated into nanopores of activated montmorillonite clay and evaluated their catalytic activity for liquid phase alcohol oxidation to corresponding carbonyl compounds. Synthesis of copper nanoparticles was accomplished by incipient wetness impregnation of Cu(CH3COO)2 into the nanopores of the acid activated montmorillonite followed by reduction with NaBH4. The activation of montmorillonite was carried out by treating with mineral acid such as H2SO4 under controlled conditions at 80 °C to generate nanopores and high surface area. Powder-XRD, SEM-EDX, HRTEM, N2 adsorption, XPS etc. analysis were carried out to characterize the stabilized copper nanoparticles as well as the support. The synthesized copper nanoparticles may serve as a new alternative to ligand and additive free green catalyst for broad range of oxidation of alcohols with molecular O2 to corresponding carbonyl compounds with excellent yields (up to 97%) and selectivity (100%) under mild reaction conditions. The metal nanocatalysts exhibit good reusability, simple workup procedure and straightforward approach to carbonyl compound formation. Keywords Copper nanoparticles Montmorillonite Nanopores Face centered cubic lattice Oxidation of alcohol 1 Introduction Currently, nanomaterials have attracted great attention due to their wide range of applications in different fields such as catalysis, water purification, biodiesel production, fuel cell application, drug delivery, thin flim solar cell production, nanotoxicology etc [1–4]. Considerable afford have been devoted to nano composite materials containing metal nanoparticles, particularly copper/copper-oxide nanoparticles for its potential as a high-critical-temperature superconductor, heterogeneous catalyst, complex magnetic phase, p-type semiconductor and its use in electrochemical cells [5–8]. Recently, copper/copper-oxide nanoparticles has been extensively studied as substituent of bulk copper metal in different organic reaction such as oxidation [7], click reaction [9–11], Ullman coupling reaction [12,13], carbonylation of methanol [14] etc. The size and shape of nanoparticles as well as the nature of supporting materials on which the nanoparticles are stabilized are utmost important for providing highly active surface for catalysis. In this context, there has also been increasing interest in employing environmentally benign, cheap, easily available and robust support/stabilizing materials for the synthesis of copper nanoparticles. Earlier, we reported the environmentally benign montmorillonite support collected from western depot of Gujarat, India, and its purification and activation with mineral acid under controlled conditions to generate a high surface area matrix containing micro- and mesopores on the surface [15–20], in order to stabilize copper nanoparticles. The oxidation of alcohols to the corresponding carbonyl compounds is an important organic transformation, because of their applications in pharmaceuticals, dyestuffs, agrochemicals, plastic additives, photo initiator in UV-curing applications such as inks, imaging and clear coatings in the printing industries, precursor to useful resins and fragrances in perfumes industries [21–23]. General approach of alcohol oxidation employs the strong stoichiometric oxidizing agents such as pyridinium chlorochromate (PCC), pyridinium dichromate (PDC), KMnO4, MnO2, Na2Cr2O7, (2,2,6,6-tetramethylpiperidin-1-yl)oxidanyl (TEMPO), CrO3 etc [24,25]. These oxidative operations are quite useful in laboratory, but these oxidants are expensive, hazardous or toxic. Moreover, toxic solvents are usually used to dissolve oxidizing agents and a large amount of inorganic wastes are produced after workup which makes these reagents less convenient for both environmental and economical point of view. Recently, catalytic aerobic oxidations over supported metal catalysts get much attraction because oxygen is the cheapest oxidizing agent and produces only water as by-product [26–30]. There are several reports for catalytic oxidation of alcohols to corresponding carbonyl compounds using primarily precious metal or metal based compounds as catalysts, such as Au [30,31], Ag [32], Pd [33,34], Ru [35,36], Os [37,38], Pt [39,40] etc. Numerous studies have also been devoted to other transition metal based catalysts, such as Ni [28,41], V [42], Co [43], Cr [44], Zn [45], Mo [46], Fe [47], Re [48] and Cu [28,29], for oxidation of alcohols with molecular oxygen. Although, many studies have been reported using transition metal catalysts, but the disadvantages of the above mentioned catalysts are the use of complex ligands or expensive metal supports or difficulty in preparation. Therefore, adaption of facile preparation method using more abundant and cheap transition metals like copper with high selective and environmental friendly system for the catalytic oxidation of alcohols to carbonyl compounds are of great importance. So far copper nanoparticles supported montmorillonite is not explored for the oxidation of alcohols to prepare corresponding carbonyl compounds. Here, we report the catalytic performance of the copper nanoparticles supported into the nanopores of modified montmorillonite on the oxidation of different primary and secondary alcohols to corresponding carbonyl compounds. Moreover, systematic characterization of copper nanoparticles, reduced catalyst loading, use of cheap oxidizing agent and no over oxidized product made the present work more significant compared to our previously published articles [17,18]. 2 Experimental 2.1 Materials and methods Bentonite clay (collected from Gujarat, India) was purified to collect the < 2 μm fraction by dispersion cum sedimentation technique as they contain various impurities like silica sand, iron oxide, quartz etc. Air dried samples were then converted to the homoionic Na+-exchanged form by stirring in 2 M NaCl solution for about 72 h, washed and dialysed against distilled water until the conductivity of the water approached that of distilled water. Na-exchanged montmorillonite was characterized by XRD and basal spacing (d001) value was found to be 12.5 Å. Specific surface area determined by N2 adsorption was 105 m2/g. The cation exchange capacity (CEC) was 126 meq per 100 g of clay (sample dried at 120 °C). Most of the reagents were purchased from Sigma Aldrich, USA and used as without further purification. Solid state UV–vis spectra were recorded at room temperature by the UV–vis spectrophotometer model Lambada 35, Perkin Elmer. Powder X-ray Diffractions were acquired on a Rigaku Ultima IV X-ray diffractometer from 2 to 80° 2θ using CuKα source (λ = 1.54 Å). Specific surface area, pore volume and average pore diameter were measured by using Autosorb-1 (Quantachrome, USA). Field Emission Scanning Electron Microscope (FESEM), (made Carl Zeiss, Sigma VP) was utilized for determining the FESEM images and energy dispersive X-ray spectroscopy (EDX) patterns. Transmission electron microscopy (TEM) and high resolution transmission electron microscopy (HRTEM) images were recorded on a JEOL JEM-2011 electron microscope and specimens were prepared by dispersing powder samples in isopropanol and placing them on a carbon coated copper grid and allowing them to dry. XPS experiments were performed on a Kratos ESCA model Axis 165 spectrophotometer with a position sensitive detector and hemispherical energy analyzer in an ion pumped chamber. The amount of Cu content was determined by atomic absorption spectrophotometer (Model: A Analyst, −700, Perkin Elmer). The preparation of the activated montmorillonite support as well as the stabilized copper nanoparticles prepared by adapting our earlier reported methods [17] are described below: 2.2 Preparation of support 8 g of Na-montmorillonite was dispersed in 200 ml of 4 M sulphuric acid in a three necked round bottom flask and the resulting dispersion was kept at 80 °C for 1 h. After 1 h, the solution is allowed to cool and the supernatant liquid was discarded. The acid activated Na-montmorillonite was washed repeatedly in deionized water until no SO4 2− ions could be detected by the BaCl2 test. The acid activated Na-montmorillonite was recovered, dried in air at 40 ± 5 °C overnight to obtain the solid product. This acid activated montmorillonite is designated as AT-Mont. 2.3 Preparation of copper nanoparticles 5 g of AT-Mont. was taken into 250 ml round bottom flask at room temperature and 100 ml of water was added to it under stirring condition. 0.2 g of Cu(CH3COO)2 metal precursor was dissolve in minimum amount of distilled water and then added drop wise into the clay dispersion with vigorous stirring condition for 7–8 h. The resultant slurry was aged for an additional day under ambient condition followed by evaporation to dryness in a rotary evaporator. The dry clay-Cu(CH3COO)2 composite was dispersed in 50 ml water and 10 ml of aqueous solution of NaBH4 (3 mmol) was then added slowly over a 15 min in a nitrogen environment under constant stirring condition. The reaction started immediately and colour changed from blue to black due to conversion of Cu(II) into Cu(0) and the stirring was continued for another 2 h. The black solid mass was filtered and washed with distilled water several times and then dried in a desiccator for 12 h. 2.4 General procedure for oxidation reaction 1 mmol of the reactant was dissolved in 20 ml tetrahydrofuran (THF) followed by addition of 16 mg of copper nanoparticles into a two necked 100 ml round bottom flask and purged with oxygen. The reaction mixture was refluxed at 66 °C under oxygen atmosphere for a period of 4–9 h depending upon the nature of the substrates used. Upon completion of the reaction (monitored by thin layer chromatography), the catalyst was separated by simple filtration and the filtrate was poured into water. The organic product was extracted with ethyl acetate. The combined organic fractions were dried over Na2SO4 and concentrated. The residue was purified by column chromatography using silica gel (60–120 mesh) with ethyl acetate/hexane as eluent to obtain the desired product. To investigate the recyclability, after separation, the used catalyst was washed with methanol followed by water and finally vacuum-dried at 40 °C before the next reaction run. The products were characterized by standard analytical techniques such as 1H NMR, 13C NMR, FTIR, melting point determination and GC. All the products are known compounds and compared with data of those commercially available. 3 Results and discussion 3.1 Characterization of support The oxide compositions of the clay before and after acid activation were determined by wet chemical and flame photometric methods and presented in Table 1 . Upon acid activation for 1 h, the surface area and the pore volume of AT-Mont. increase to 417 m2/g and 0.574 cm3/g from 105 m2/g and 0.232 cm3/g of the parent Na-montmorillonite respectively. Acid activation felicitate surface texture modification of layered structure of montmorillonite through partial leaching of Al from their tetrahedral and octahedral sites introducing porosity on the clay surface along with the partial retention of layered structure. The SEM images of parent Na-montmorillonite and AT-Mont. [Fig. S2 (A) and (C), supporting information] indicate the formation of porous surface on AT-Mont. which is not observed for the untreated Na-montmorillonite. The EDX patterns [Fig. S2 (B) and (D), supporting information] show a predominant amount of Si compared to Al content on the AT-Mont. surface, while Na-montmorillonite contains both Si and Al in predominant amounts. The leaching out of aluminum moiety from the clay structure inducing pores is clearly evidenced from the EDX analysis at the pores of AT-Mont. [Fig. S2 (E), supporting information] confirming the presence of silicon and oxygen only in the pores. Partial retention of layered structure was further clarified by HRTEM studies [Fig. 1 ], which distinctly shows the visible lattice fringes of d001 planes of montmorillonite. During controlled acid activation for 1 h, most of the layered structure of clay minerals are disrupted and only a fraction is retained [Fig. 1], which is also substantiated by CEC value [Table 1] of acid activated clay (42 meq per 100 g of clay) compared to parent Na-montmorillonite (126 meq per 100 g of clay). The detailed characterization was reported in our previously published papers [16–20]. 3.2 Characterization of supported copper nanoparticles The preliminary investigation of the formation of copper nanoparticles into the pores of modified montmorillonite was provided by UV–vis spectroscopy [Fig. 2 ]. The UV–vis spectra of the prepared copper nanoparticles show two extinction bands, which typically have two (in-plane and out-of-plane) plasmon modes [49]. The broad peak in the range 380–630 nm contain a contribution from the copper interband transitions below 600 nm, while the broad and weak band at 450 nm may be attributed to the out-of-plane dipolar mode. Thus, the appearances of the broad band indicates the formation of copper(0) nanoparticles [49]. The crystalline natures of the copper nanoparticles were confirmed by their corresponding powder XRD pattern [Fig. 3 ]. The XRD shows three peaks of 2θ values 43.3, 50.3 and 74.1° which are assigned to the (111), (200) and (220) indices of fcc lattice of metallic Cu (JCPDS No. 85–1326) [50,51]. XPS spectrum of the Cu 2p region [Fig. 4 (A)] shows two copper bands, 2p3/2 at 932.4 eV and 943.0 eV, which are in good agreement with the metallic copper(0) and CuO respectively [7,52,53]. The moderately broad O1s core-level spectrum observed at 533.5 eV revealed the presence of O2− of CuO [Fig. 4 (B)] [7]. SEM-EDX analysis also confirmed the formation of spherical nanoparticles into the nanopores of AT-Mont. [Fig. 5 (A)]. Moreover, EDX analysis [Fig. 5(B)] indicates the presence of copper on the surface of modified montmorillonite along with other elements of the clay. The elemental dot mapping [Fig. 6 ] clearly shows the homogeneous distribution of Cu throughout the support. The TEM image of the nanoparticle composites [Fig. 7 ] shows that copper nanoparticles having a spherical morphology and are well dispersed on the nanoporous support. The micrographs also indicate that the particles have sizes less than 10 nm. Some of the copper nanoparticles are found to be larger than the pore size of the support [Fig. 1 (B)]. HRTEM image of a single copper nanoparticles [Fig. 8 (A) and (C)] shows that particles have reticular lattice planes with inter-planar lattice fringe spacing of about 0.21 nm, which corresponds to the (111) plane of fcc copper crystals [7]. By focusing the electron beam on the nanoparticle lying on the TEM grid, the selected area electron diffraction (SAED) pattern of copper nanoparticles was found [Fig. 8(B)], where the hexagonal symmetrical diffraction spot patterns indicate the single crystalline nature of copper nanoparticles. The Cu content in the clay supported copper nanoparticles composites is found to be 0.8 wt%. 3.3 Catalytic activity The oxidation of alcohol towards carbonyl compounds catalysed by copper nanoparticles-montmorillonite is presented in Scheme 1 . Solvents play a significant role in the chemical reaction and the effect of solvents on the reaction [Table S1 (supporting information)] was investigated on benzyl alcohol as model substrate. It was found that the most appropriate solvent in which the catalyst proceeded efficiently is THF with 97.8% conversion under refluxing condition. This may be due to the moderate polarity (dielectric constant 7.5) and aprotic nature of THF which facilitate better contact of the catalyst with the substrate. The reaction was also investigated under solvent-free conditions and only 55.2% conversion was observed. In order to illuminate the active sites of the catalyst, two blank reactions were performed with or without the montmorillonite support (AT-Mont.) as catalyst in THF solvent. However, no product was detected in any of the two reactions indicating that the copper nanoparticles are the active catalytic sites of the catalyst. The oxidation of different alcohols to corresponding carbonyl compounds carried out in presence of copper nanoparticles with various substituted reactants are summarized in Table 2 . Both primary and secondary alcohols were oxidized to their corresponding carbonyl compounds with very good to excellent yields (54–97.8%) and 100% selectivity. In order to widen the scope of oxidation reaction, substituted benzyl alcohol and substituted 1-phenyl ethanol were also tested. Oxidation of benzyl alcohol and 1-phenyl ethanol having electron donating group resulted corresponding carbonyl compounds in good yield [Entry 4, 6 & 7, Table 2]. In case of electron withdrawing substituted benzyl alcohol, the yields are comparatively less than that of the electron rich counterparts [Entry 5, Table 2]. After completion of the oxidation reactions, the catalyst was recovered by filtration and vacuum dried at 40 °C before using in the next run. The catalyst remains active for several runs without significant lost of efficiency [Entry 1, Table 2]. No over oxidized product was noticed for any oxidation process. It is well known that the adsorption of substrate molecules to the surface of the catalyst is the main factor for determining the catalytic activity. Transition metals and metal oxides (particularly copper) may accommodate a higher proportion of oxygen in their lattice position compared to others [54]. This helps the oxidation of alcohol to the corresponding carbonyl compounds under mild conditions presumably due to tenacious oxygen retention and oxygen-activating property of copper nanoparticles. The presence of surface oxygen makes the oxidation entropically favorable and the most probable mechanism is via the abstraction of α-hydrogen by the surface oxygen [26,55–58]. The recovered catalyst was further investigated by N2-adsorption-desorption analysis, powder XRD and TEM to check if any morphological changes that might occur to the catalyst (copper nanoparticles) during the catalytic reaction. The specific surface area of the recovered catalyst decrease to 218 (after 1 st run), 193 (after 2nd run) and 122 (after 3rd run) compared to 296 m2/g of freshly prepared catalyst. This decrease in surface area of the catalyst may be due to the reason that, after each successive run, the nanopores were clogged by the reactant/product molecules or the breakdown of the pore walls of the catalyst support occurred and led to formation of larger pores; because the BJH pore size distribution curve [Fig. 9 ] of the recovered catalyst shows a gradual broadening of the distribution pattern compared to fresh catalyst. The similar shapes of the isotherms reveal that the catalyst retained their mesoporous nature even after the 3rd run [Fig. S3, supporting information]. The powder XRD spectra of recovered catalyst [Fig. 10 ], shows peaks at around the 2θ values 36 and 54°, apart from the characteristic peaks of metallic Cu(0) indicating conversion of considerable amount of copper to CuO after the 1 st run of the reaction, whereas for the fresh catalyst it was below the detection limit of XRD [7]. However, this conversion seems to be beneficial due to higher oxygen retention capacity of CuO [7]. The elemental dot mapping of recovered catalyst [Fig. S4, supporting information] shows almost similar homogenous distributions of copper on the support as obtained in the fresh catalyst. The TEM images of the recovered catalyst [Fig. S5, supporting information] confirms that the copper nanoparticles are stable inside the clay matrix but small fractions of the particles were agglomerated to form bigger sizes. From AAS analysis, the Cu content in the recovered catalyst after third run was found to be 0.74 wt% which indicates that only a very small amounts of copper were leaching out from clay matrix. Therefore, the catalyst remained active for several catalytic runs without significant loss of its efficiency. A comparison of several previously reported catalysts with the present work for oxidation reactions is presented in Table 3 , which indicates that the present catalyst is better compared to earlier reports in terms of yield, reaction temperature and catalyst recovery. 4 Conclusion Stabilized spherical copper nanoparticles having size below 10 nm, generated into the micro- and mesopores of acid activated montmorillonite, demonstrated high catalytic activity in oxidation of potential primary and secondary aromatic alcohols to corresponding carbonyl compounds within short reaction time with very good to excellent yields (54–97.8%) and 100% selectivity. The nanocatalysts could be reused for several times without significant loss of their activity under the same reaction conditions. The recovered catalysts characterized by the different analytical techniques like XRD, HRTEM and N2 adsorption-desorption demonstrated no significant change in size and shape of the copper nanoparticles. The operational simplicity and robustness of the catalyst as well as environmentally friendly reaction conditions surpasses previous catalytic systems and make it attractive for the large scale synthesis of the industrially important carbonyl compounds. Acknowledgements The authors are grateful to Dr. D. Ramaiah, Director, CSIR-North-East Institute of Science and Technology, Jorhat, Assam, India, for his kind permission to publish the work. The authors also acknowledge SAIF, NEHU, Shillong for TEM and SEM images and Dr. K. R. Patil, Scientist, NCL, Pune for XPS analysis. DKD is grateful to CSIR-New Delhi for awarding the Emeritus Scientist Scheme: Sanction No. 21(1029)/16/EMR-II. Appendix A Supplementary data Supplementary data associated with this article can be found, in the online version, at http://dx.doi.org/10.1016/j.mcat.2017.12.032. Appendix A Supplementary data The following is Supplementary data to this article: References [1] M.G.I. Favier D. Madec Nanomaterials in Catalysis 1st ed. 2013 Wiley-VCH [2] S. Chaturvedi P.N. Dave N.K. Shah Applications of nano-catalyst in new era J. Saudi Chem. Soc. 16 2012 307 325 [3] L.M. Zemtsov G.P. Karpacheva M.N. Efimov D.G. Muratov K.a. Bagdasarova Carbon nanostructures based on IR-pyrolyzed polyacrylonitrile Polym. Sci. Ser. A. 48 2006 633 637 [4] S.S. Khutsishvili T.I. Vakul’Skaya N.P. Kuznetsova T.G. Ermakova A.S. Pozdnyakov G.F. Prozorova Formation of stable paramagnetic nanocomposites containing zero-valence silver and copper in a polymeric matrix J. Phys. Chem. C. 118 2014 19338 19344 [5] J. Schummer Book review for NanoEthics Nanoethics 2 2008 209 212 [6] F. Lanza R. Feduzi J. Fuger Effects of lithium oxide on the electrical properties of CuO at low temperatures J. Mater. Res. 5 2011 1739 1744 [7] S. Pande A. Saha S. Jana S. Sarkar M. Basu M. Pradhan A.K. Sinha S. Saha A. Pal T. Pal Resin-immobilized CuO and Cu nanocomposites for alcohol oxidation Org. Lett. 10 2008 5179 5181 [8] P.B. Malla P. Ravindranatham S. Komarneni R. Roy Intercalation og copper metal cluster in montmorillonite Nature 351 1991 555 557 [9] A. Sarkar T. Mukherjee S. Kapoor PVP-Stabilized copper nanoparticles: a reusable catalyst for click reaction between terminal alkynes and azides in nonaqueous solvents PVP-Stabilized copper nanoparticles: a reusable catalyst for click reaction between terminal alkynes and azide J. Phys. Chem. C 2008 3334 3340 [10] M.L. Kantam V.S. Jaya B. Sreedhar M.M. Rao B.M. Choudary Preparation of alumina supported copper nanoparticles and their application in the synthesis of 1,2,3-triazoles J. Mol. Catal. A Chem. 256 2006 273 277 [11] G. Molteni C.L. Bianchi G. Marinoni N. Santo A. Ponti Cu/Cu-oxide nanoparticles as catalyst in the click azide-alkyne cycloaddition New J. Chem. 30 2006 1137 [12] J.F. Marcoux S. Doye S.L. Buchwald A general copper-catalyzed synthesis of diaryl ethers J. Am. Chem. Soc. 119 1997 10539 10540 [13] M. Kidwai N.K. Mishra V. Bansal A. Kumar S. Mozumdar Cu-nanoparticle catalyzed O-arylation of phenols with aryl halides via Ullmann coupling Tetrahedron Lett. 48 2007 8883 8887 [14] L. He H. Liu C. Xiao Y. Kou Liquid-phase synthesis of methyl formate via heterogeneous carbonylation of methanol over a soluble copper nanocluster catalyst Green Chem. 10 2008 619 [15] P. Komadel J. Madejová Chapter 10.1–Acid Activation of Clay Minerals 2nd ed. 2013 Elsevier Ltd. [16] D. Dutta B.J. Borah L. Saikia M.G. Pathak P. Sengupta D.K. Dutta Synthesis and catalytic activity of Ni°-acid activated montmorillonite nanoparticles Appl. Clay Sci. 53 2011 650 656 [17] B.J. Borah D. Dutta P.P. Saikia N.C. Barua D.K. Dutta Stabilization of Cu(0)-nanoparticles into the nanopores of modified montmorillonite: an implication on the catalytic approach for Click reaction between azides and terminal alkynes Green Chem. 13 2011 3453 [18] B.J. Borah S.J. Borah L. Saikia D.K. Dutta Efficient three-component coupling reactions catalyzed by Cu°-nanoparticles stabilized on modified montmorillonite Catal. Sci. Technol. 4 2014 1047 1054 [19] D. Dutta D.K. Dutta Selective and efficient hydrogenation of halonitrobenzene catalyzed by clay supported Nio-nanoparticles Appl. Catal. A Gen. 487 2014 158 164 [20] D.K. Dutta, D. Dutta, Process for reducing chloronitrobenzene catalyzed by platinum −nanoparticles stabilized on modified montmorillonite clay, US Pat. 9284259B2, March 15 2016. [21] G. Tojo M. Fernández Oxidation of Alcohols to Aldehydes and Ketones 2006 Springer [22] S.E. Davis M.S. Ide R.J. Davis Selective oxidation of alcohols and aldehydes over supported metal nanoparticles Green Chem. 15 2013 17 45 [23] G. Dormán G.D. Prestwich Benzophenone photophores in biochemistry Biochemistry 33 1994 5661 5673 [24] J.R. Holum Study of the chromium(VI) oxide-pyridine complex J. Org. Chem. 26 1961 4814 4816 [25] F.M. Menger C. Lee Oxidation with solid potassium permanganate J. Org. Chem. 19 1979 3446 3448 [26] I.E. Marko P.R. Giles M. Tsukazaki S.M. Brown C.J. Urch Copper-catalyzed oxidation of alcolos to aldehydes and ketones: an efficient and aerobic alternatives Science 274 1996 2044 2046 [27] K. Kaneda T. Mitsudome T. Mizugaki K. Jitsukawa Development of heterogeneous olympic medal metal nanoparticle catalysts for environmentally benign molecular transformations based on the surface properties of hydrotalcite Molecules 15 2010 8988 9007 [28] R. Ali M.E. Assal A. Al-Warthan M. Rafiq H. Siddiqui Selective oxidation of benzylic alcohols with molecular oxygen catalyzed by copper-manganese oxide nanoparticles Asian J. Chem. 25 2013 4815 4819 [29] R. Ali K. Nour A. Al-warthan M.R.H. Siddiqui Selective oxidation of benzylic alcohols using copper-manganese mixed oxide nanoparticles as catalyst Arab. J. Chem. 8 2013 512 517 [30] V.R. Choudhary A. Dhar P. Jana R. Jha B.S. Uphade A green process for chlorine-free benzaldehyde from the solvent-free oxidation of benzyl alcohol with molecular oxygen over a supported nano-size gold catalyst Green Chem. 7 2005 768 [31] V.R. Choudhary D.K. Dumbre Magnesium oxide supported nano-gold: a highly active catalyst for solvent-free oxidation of benzyl alcohol to benzaldehyde by TBHP Catal. Commun. 10 2009 1738 1742 [32] M. Deng G. Zhao Q. Xue L. Chen Y. Lu Microfibrous-structured silver catalyst for low-temperature gas-phase selective oxidation of benzyl alcohol Appl. Catal. B Environ. 99 2010 222 228 [33] Y. Chen H. Zheng Z. Guo C. Zhou C. Wang A. Borgna Y. Yang Pd catalysts supported on MnCeOx mixed oxides and their catalytic application in solvent-free aerobic oxidation of benzyl alcohol: support composition and structure sensitivity J. Catal. 283 2011 34 44 [34] H. Zhang Y. Liu X. Zhang Selective oxidation of benzyl alcohol catalyzed by Palladium nanoparticles supported on carbon-coated Iron nanocrystals Chinese J. Catal. 32 2011 1693 1701 [35] T. Yasu-eda S. Kitamura N. oki Ikenaga T. Miyake T. Suzuki Selective oxidation of alcohols with molecular oxygen over Ru/CaO-ZrO2 catalyst J. Mol. Catal. A Chem. 323 2010 7 15 [36] H. Yu Y. Zhang X. Fu F. Peng H. Wang J. Yang Deactivation and regeneration of RuO2·xH2O/CNT catalyst for aerobic oxidation of benzyl alcohol Catal. Commun. 10 2009 1752 1756 [37] P.A. Shapley N. Zhang J.L. Allen D.H. Pool H. Liang Selective alcohol oxidation with molecular oxygen catalyzed by Os − cr and Ru − Cr complexes J. Am. Chem. Soc. 122 2000 1079 1091 [38] D. Baruah U.P. Saikia P. Pahari D. Konwar Cu-nanoparticles on cellulose/H2O-CH3CN/microwave: a green system for the selective oxidation of alcohols to aldehydes Tetrahedron Lett. 56 2015 2543 2547 [39] Y.M.A. Yamada T. Arakawa H. Hocke Y. Uozumi A nanoplatinum catalyst for aerobic oxidation of alcohols in water Angew. Chemie − Int. Ed. 46 2007 704 706 [40] T. Mallat A. Baiker Oxidation of alcohols with molecular oxygen on platinum metal catalysts in aqueous solutions Catal. Today. 19 1994 247 283 [41] S.R. Ali P. Chandra M. Latwal S.K. Jain V.K. Bansal S.P. Singh Synthesis of nickel hexacyanoferrate nanoparticles and their potential as heterogeneous catalysts for the solvent-free oxidation of benzyl alcohol Chinese J. Catal. 32 2011 1844 1849 [42] G.C. Behera K.M. Parida Liquid phase catalytic oxidation of benzyl alcohol to benzaldehyde over vanadium phosphate catalyst Appl. Catal. A Gen. 413–414 2012 245 253 [43] S.M. Seyedi R. Sandaroos G.H. Zohuri Novel cobalt(II) complexes of amino acids-Schiff bases catalyzed aerobic oxidation of various alcohols to ketones and aldehyde Chinese Chem. Lett. 21 2010 1303 1306 [44] Ö.F. Öztürk B. Zümreoǧlu-Karan S. Karabulut Solvent-free oxidation of benzyl alcohol over chromium orthoborate Catal. Commun. 9 2008 1644 1648 [45] S.R. Ali V.K. Bansal A.A. Khan S.K. Jain M.A. Ansari Growth of zinc hexacyanoferrate nanocubes and their potential as heterogeneous catalyst for solvent-free oxidation of benzyl alcohol J. Mol. Catal. A Chem. 303 2009 60 64 [46] P.S.N. Rao K.T.V. Rao P.S. Sai Prasad N. Lingaiah The role of vanadia for the selective oxidation of benzyl alcohol over heteropolymolybdate supported on alumina Cuihua Xuebao/Chinese J. Catal. 32 2011 1719 1726 [47] R. Naik A. Nizam A. Siddekha M.A. Pasha An efficient sonochemical oxidation of benzyl alcohols into benzaldehydes by FeCl3/HNO3 in acetone Ultrason. Sonochem. 18 2011 1124 1127 [48] P. Paraskevopoulou N. Psaroudakis S. Koinis P. Stavropoulos K. Mertis Catalytic selective oxidation of benzyl alcohols to aldehydes with rhenium complexes J. Mol. Catal. A Chem. 240 2005 27 32 [49] I. Pastoriza-Santos L.M. Liz-Marzán Colloidal silver nanoplates. State of the art and future challenges J. Mater. Chem. 18 2008 1724 1737 [50] S. Ayyappan G.N. Subbanna R.S. Gopalan C.N.R. Rao Nanoparticles of nickel and silver produced by the polyol reduction of the metal salts intercalated in montmorillonite Solid State Ionics 84 1996 271 281 [51] Z. Kiraly I. Dekany A. Mastalir M. Bartok In-Situ generation of palladium nanoparticles in smectite clays J. Catal. 161 1996 401 408 [52] L. Guo Z.H. Wu K. Ibrahim T. Liu Y. Tao X. Ju Research of nonlinear optical properties of copper nanoparticles Eur. Phys. J. D. 9 1999 591 594 [53] P. Kumari P. Majewski Adsorption of albumin on silica surfaces modified by silver and copper nanoparticles J. Nanomater. 2013 2013 1 [54] C.N.R. Rao G.V.S. Rao Crystal Chemistry Phase Transition & Related Aspects 1974 U.S. GPO Washington DC [55] M.F. Semmelhack C.R. Schmid D.A. Cortés C.S. Chou Oxidation of alcohols to aldehydes with oxygen and cupric ion, mediated by nitrosonium ion J. Am. Chem. Soc. 106 1984 3374 3376 [56] S. Velusamy A. Srinivasan T. Punniyamurthy Copper(II) catalyzed selective oxidation of primary alcohols to aldehydes with atmospheric oxygen Tetrahedron Lett. 47 2006 923 926 [57] M.Y. Sheikh G. Eadon The vapor phase oxidation of alcohols by cupric oxide. a convenient preparation of aldehydes and ketones Tetrahedron Lett. 13 1972 257 260 [58] S.M. Williams K.R. Rodriguez S. Teeters-Kennedy A.D. Stafford S.R. Bishop U.K. Lincoln J.V. Coe Use of the extraordinary infrared transmission of metallic subwavelength arrays to study the catalyzed reaction of methanol to formaldehyde on copper oxide J. Phys. Chem. B. 108 2004 11833 11837 [59] T. Mitsudome Y. Mikami K. Ebata T. Mizugaki K. Jitsukawa K. Kaneda Copper nanoparticles on hydrotalcite as a heterogeneous catalyst for oxidant-free dehydrogenation of alcohols Chem. Commun. 2 2008 4804 4806 [60] V.R. Choudhary R. Jha P. Jana Solvent-free selective oxidation of benzyl alcohol by molecular oxygen over uranium oxide supported nano-gold catalyst for the production of chlorine-free benzaldehyde Green Chem. 9 2007 267 [61] D.I. Enache J.K. Edwards P. Landon B. Solsona-espriu A.F. Carley A.A. Herzing M. Watanabe C.J. Kiely D.W. Knight G.J. Hutchings Solvent-free oxidation of primary alcohols to aldehydes using Science 311 2006 362 366",
      "scopus-id": "85044779610",
      "coredata": {
        "eid": "1-s2.0-S2468823117306739",
        "dc:description": "Stable and spherical copper nanoparticles of size less than 10 nm were generated into nanopores of activated montmorillonite clay and evaluated their catalytic activity for liquid phase alcohol oxidation to corresponding carbonyl compounds. Synthesis of copper nanoparticles was accomplished by incipient wetness impregnation of Cu(CH3COO)2 into the nanopores of the acid activated montmorillonite followed by reduction with NaBH4. The activation of montmorillonite was carried out by treating with mineral acid such as H2SO4 under controlled conditions at 80 °C to generate nanopores and high surface area. Powder-XRD, SEM-EDX, HRTEM, N2 adsorption, XPS etc. analysis were carried out to characterize the stabilized copper nanoparticles as well as the support. The synthesized copper nanoparticles may serve as a new alternative to ligand and additive free green catalyst for broad range of oxidation of alcohols with molecular O2 to corresponding carbonyl compounds with excellent yields (up to 97%) and selectivity (100%) under mild reaction conditions. The metal nanocatalysts exhibit good reusability, simple workup procedure and straightforward approach to carbonyl compound formation.",
        "openArchiveArticle": "false",
        "prism:coverDate": "2018-05-31",
        "openaccessUserLicense": null,
        "prism:aggregationType": "Journal",
        "prism:url": "https://api.elsevier.com/content/article/pii/S2468823117306739",
        "dc:creator": [
          {
            "@_fa": "true",
            "$": "Dutta, Dipanka"
          },
          {
            "@_fa": "true",
            "$": "Phukan, Ankana"
          },
          {
            "@_fa": "true",
            "$": "Dutta, Dipak Kumar"
          }
        ],
        "link": [
          {
            "@_fa": "true",
            "@rel": "self",
            "@href": "https://api.elsevier.com/content/article/pii/S2468823117306739"
          },
          {
            "@_fa": "true",
            "@rel": "scidir",
            "@href": "https://www.sciencedirect.com/science/article/pii/S2468823117306739"
          }
        ],
        "dc:format": "application/json",
        "openaccessType": null,
        "pii": "S2468-8231(17)30673-9",
        "prism:volume": "451",
        "prism:publisher": "Elsevier B.V.",
        "dc:title": "Nanoporous montmorillonite clay stabilized copper nanoparticles: Efficient and reusable catalyst for oxidation of alcohols",
        "prism:copyright": "© 2017 Elsevier B.V. All rights reserved.",
        "prism:issueName": "Metal Oxides in Catalysis - Professor Benjaram M. Reddy Festschrift",
        "openaccess": "0",
        "prism:issn": "24688231",
        "dcterms:subject": [
          {
            "@_fa": "true",
            "$": "Copper nanoparticles"
          },
          {
            "@_fa": "true",
            "$": "Montmorillonite"
          },
          {
            "@_fa": "true",
            "$": "Nanopores"
          },
          {
            "@_fa": "true",
            "$": "Face centered cubic lattice"
          },
          {
            "@_fa": "true",
            "$": "Oxidation of alcohol"
          }
        ],
        "openaccessArticle": "false",
        "prism:publicationName": "Molecular Catalysis",
        "openaccessSponsorType": null,
        "prism:pageRange": "178-185",
        "prism:endingPage": "185",
        "pubType": "fla",
        "prism:coverDisplayDate": "May 2018",
        "prism:doi": "10.1016/j.mcat.2017.12.032",
        "prism:startingPage": "178",
        "dc:identifier": "doi:10.1016/j.mcat.2017.12.032",
        "openaccessSponsorName": null
      },
      "objects": {
        "object": [
          {
            "@category": "thumbnail",
            "@height": "142",
            "@width": "219",
            "@_fa": "true",
            "$": "https://api.elsevier.com/content/object/eid/1-s2.0-S2468823117306739-fx1.sml?httpAccept=%2A%2F%2A",
            "@multimediatype": "GIF image file",
            "@type": "IMAGE-THUMBNAIL",
            "@size": "14299",
            "@ref": "fx1",
            "@mimetype": "image/gif"
          },
          {
            "@category": "thumbnail",
            "@height": "55",
            "@width": "219",
            "@_fa": "true",
            "$": "https://api.elsevier.com/content/object/eid/1-s2.0-S2468823117306739-fx10.sml?httpAccept=%2A%2F%2A",
            "@multimediatype": "GIF image file",
            "@type": "IMAGE-THUMBNAIL",
            "@size": "2750",
            "@ref": "fx10",
            "@mimetype": "image/gif"
          },
          {
            "@category": "thumbnail",
            "@height": "64",
            "@width": "219",
            "@_fa": "true",
            "$": "https://api.elsevier.com/content/object/eid/1-s2.0-S2468823117306739-fx11.sml?httpAccept=%2A%2F%2A",
            "@multimediatype": "GIF image file",
            "@type": "IMAGE-THUMBNAIL",
            "@size": "2894",
            "@ref": "fx11",
            "@mimetype": "image/gif"
          },
          {
            "@category": "thumbnail",
            "@height": "117",
            "@width": "219",
            "@_fa": "true",
            "$": "https://api.elsevier.com/content/object/eid/1-s2.0-S2468823117306739-fx12.sml?httpAccept=%2A%2F%2A",
            "@multimediatype": "GIF image file",
            "@type": "IMAGE-THUMBNAIL",
            "@size": "3596",
            "@ref": "fx12",
            "@mimetype": "image/gif"
          },
          {
            "@category": "thumbnail",
            "@height": "117",
            "@width": "219",
            "@_fa": "true",
            "$": "https://api.elsevier.com/content/object/eid/1-s2.0-S2468823117306739-fx13.sml?httpAccept=%2A%2F%2A",
            "@multimediatype": "GIF image file",
            "@type": "IMAGE-THUMBNAIL",
            "@size": "3427",
            "@ref": "fx13",
            "@mimetype": "image/gif"
          },
          {
            "@category": "thumbnail",
            "@height": "118",
            "@width": "219",
            "@_fa": "true",
            "$": "https://api.elsevier.com/content/object/eid/1-s2.0-S2468823117306739-fx14.sml?httpAccept=%2A%2F%2A",
            "@multimediatype": "GIF image file",
            "@type": "IMAGE-THUMBNAIL",
            "@size": "3559",
            "@ref": "fx14",
            "@mimetype": "image/gif"
          },
          {
            "@category": "thumbnail",
            "@height": "118",
            "@width": "219",
            "@_fa": "true",
            "$": "https://api.elsevier.com/content/object/eid/1-s2.0-S2468823117306739-fx15.sml?httpAccept=%2A%2F%2A",
            "@multimediatype": "GIF image file",
            "@type": "IMAGE-THUMBNAIL",
            "@size": "3437",
            "@ref": "fx15",
            "@mimetype": "image/gif"
          },
          {
            "@category": "thumbnail",
            "@height": "70",
            "@width": "219",
            "@_fa": "true",
            "$": "https://api.elsevier.com/content/object/eid/1-s2.0-S2468823117306739-fx2.sml?httpAccept=%2A%2F%2A",
            "@multimediatype": "GIF image file",
            "@type": "IMAGE-THUMBNAIL",
            "@size": "3189",
            "@ref": "fx2",
            "@mimetype": "image/gif"
          },
          {
            "@category": "thumbnail",
            "@height": "86",
            "@width": "219",
            "@_fa": "true",
            "$": "https://api.elsevier.com/content/object/eid/1-s2.0-S2468823117306739-fx3.sml?httpAccept=%2A%2F%2A",
            "@multimediatype": "GIF image file",
            "@type": "IMAGE-THUMBNAIL",
            "@size": "3536",
            "@ref": "fx3",
            "@mimetype": "image/gif"
          },
          {
            "@category": "thumbnail",
            "@height": "146",
            "@width": "219",
            "@_fa": "true",
            "$": "https://api.elsevier.com/content/object/eid/1-s2.0-S2468823117306739-fx4.sml?httpAccept=%2A%2F%2A",
            "@multimediatype": "GIF image file",
            "@type": "IMAGE-THUMBNAIL",
            "@size": "4473",
            "@ref": "fx4",
            "@mimetype": "image/gif"
          },
          {
            "@category": "thumbnail",
            "@height": "148",
            "@width": "219",
            "@_fa": "true",
            "$": "https://api.elsevier.com/content/object/eid/1-s2.0-S2468823117306739-fx5.sml?httpAccept=%2A%2F%2A",
            "@multimediatype": "GIF image file",
            "@type": "IMAGE-THUMBNAIL",
            "@size": "4258",
            "@ref": "fx5",
            "@mimetype": "image/gif"
          },
          {
            "@category": "thumbnail",
            "@height": "153",
            "@width": "219",
            "@_fa": "true",
            "$": "https://api.elsevier.com/content/object/eid/1-s2.0-S2468823117306739-fx6.sml?httpAccept=%2A%2F%2A",
            "@multimediatype": "GIF image file",
            "@type": "IMAGE-THUMBNAIL",
            "@size": "5063",
            "@ref": "fx6",
            "@mimetype": "image/gif"
          },
          {
            "@category": "thumbnail",
            "@height": "153",
            "@width": "219",
            "@_fa": "true",
            "$": "https://api.elsevier.com/content/object/eid/1-s2.0-S2468823117306739-fx7.sml?httpAccept=%2A%2F%2A",
            "@multimediatype": "GIF image file",
            "@type": "IMAGE-THUMBNAIL",
            "@size": "4815",
            "@ref": "fx7",
            "@mimetype": "image/gif"
          },
          {
            "@category": "thumbnail",
            "@height": "53",
            "@width": "219",
            "@_fa": "true",
            "$": "https://api.elsevier.com/content/object/eid/1-s2.0-S2468823117306739-fx8.sml?httpAccept=%2A%2F%2A",
            "@multimediatype": "GIF image file",
            "@type": "IMAGE-THUMBNAIL",
            "@size": "2822",
            "@ref": "fx8",
            "@mimetype": "image/gif"
          },
          {
            "@category": "thumbnail",
            "@height": "62",
            "@width": "219",
            "@_fa": "true",
            "$": "https://api.elsevier.com/content/object/eid/1-s2.0-S2468823117306739-fx9.sml?httpAccept=%2A%2F%2A",
            "@multimediatype": "GIF image file",
            "@type": "IMAGE-THUMBNAIL",
            "@size": "2899",
            "@ref": "fx9",
            "@mimetype": "image/gif"
          },
          {
            "@category": "thumbnail",
            "@height": "100",
            "@width": "219",
            "@_fa": "true",
            "$": "https://api.elsevier.com/content/object/eid/1-s2.0-S2468823117306739-gr1.sml?httpAccept=%2A%2F%2A",
            "@multimediatype": "GIF image file",
            "@type": "IMAGE-THUMBNAIL",
            "@size": "14051",
            "@ref": "gr1",
            "@mimetype": "image/gif"
          },
          {
            "@category": "thumbnail",
            "@height": "163",
            "@width": "219",
            "@_fa": "true",
            "$": "https://api.elsevier.com/content/object/eid/1-s2.0-S2468823117306739-gr10.sml?httpAccept=%2A%2F%2A",
            "@multimediatype": "GIF image file",
            "@type": "IMAGE-THUMBNAIL",
            "@size": "7868",
            "@ref": "gr10",
            "@mimetype": "image/gif"
          },
          {
            "@category": "thumbnail",
            "@height": "164",
            "@width": "207",
            "@_fa": "true",
            "$": "https://api.elsevier.com/content/object/eid/1-s2.0-S2468823117306739-gr2.sml?httpAccept=%2A%2F%2A",
            "@multimediatype": "GIF image file",
            "@type": "IMAGE-THUMBNAIL",
            "@size": "5524",
            "@ref": "gr2",
            "@mimetype": "image/gif"
          },
          {
            "@category": "thumbnail",
            "@height": "164",
            "@width": "208",
            "@_fa": "true",
            "$": "https://api.elsevier.com/content/object/eid/1-s2.0-S2468823117306739-gr3.sml?httpAccept=%2A%2F%2A",
            "@multimediatype": "GIF image file",
            "@type": "IMAGE-THUMBNAIL",
            "@size": "6549",
            "@ref": "gr3",
            "@mimetype": "image/gif"
          },
          {
            "@category": "thumbnail",
            "@height": "94",
            "@width": "219",
            "@_fa": "true",
            "$": "https://api.elsevier.com/content/object/eid/1-s2.0-S2468823117306739-gr4.sml?httpAccept=%2A%2F%2A",
            "@multimediatype": "GIF image file",
            "@type": "IMAGE-THUMBNAIL",
            "@size": "5243",
            "@ref": "gr4",
            "@mimetype": "image/gif"
          },
          {
            "@category": "thumbnail",
            "@height": "81",
            "@width": "219",
            "@_fa": "true",
            "$": "https://api.elsevier.com/content/object/eid/1-s2.0-S2468823117306739-gr5.sml?httpAccept=%2A%2F%2A",
            "@multimediatype": "GIF image file",
            "@type": "IMAGE-THUMBNAIL",
            "@size": "12543",
            "@ref": "gr5",
            "@mimetype": "image/gif"
          },
          {
            "@category": "thumbnail",
            "@height": "164",
            "@width": "201",
            "@_fa": "true",
            "$": "https://api.elsevier.com/content/object/eid/1-s2.0-S2468823117306739-gr6.sml?httpAccept=%2A%2F%2A",
            "@multimediatype": "GIF image file",
            "@type": "IMAGE-THUMBNAIL",
            "@size": "19695",
            "@ref": "gr6",
            "@mimetype": "image/gif"
          },
          {
            "@category": "thumbnail",
            "@height": "164",
            "@width": "164",
            "@_fa": "true",
            "$": "https://api.elsevier.com/content/object/eid/1-s2.0-S2468823117306739-gr7.sml?httpAccept=%2A%2F%2A",
            "@multimediatype": "GIF image file",
            "@type": "IMAGE-THUMBNAIL",
            "@size": "16143",
            "@ref": "gr7",
            "@mimetype": "image/gif"
          },
          {
            "@category": "thumbnail",
            "@height": "149",
            "@width": "219",
            "@_fa": "true",
            "$": "https://api.elsevier.com/content/object/eid/1-s2.0-S2468823117306739-gr8.sml?httpAccept=%2A%2F%2A",
            "@multimediatype": "GIF image file",
            "@type": "IMAGE-THUMBNAIL",
            "@size": "22449",
            "@ref": "gr8",
            "@mimetype": "image/gif"
          },
          {
            "@category": "thumbnail",
            "@height": "132",
            "@width": "219",
            "@_fa": "true",
            "$": "https://api.elsevier.com/content/object/eid/1-s2.0-S2468823117306739-gr9.sml?httpAccept=%2A%2F%2A",
            "@multimediatype": "GIF image file",
            "@type": "IMAGE-THUMBNAIL",
            "@size": "6039",
            "@ref": "gr9",
            "@mimetype": "image/gif"
          },
          {
            "@category": "thumbnail",
            "@height": "85",
            "@width": "219",
            "@_fa": "true",
            "$": "https://api.elsevier.com/content/object/eid/1-s2.0-S2468823117306739-sc1.sml?httpAccept=%2A%2F%2A",
            "@multimediatype": "GIF image file",
            "@type": "IMAGE-THUMBNAIL",
            "@size": "5556",
            "@ref": "sc1",
            "@mimetype": "image/gif"
          },
          {
            "@category": "standard",
            "@height": "200",
            "@width": "309",
            "@_fa": "true",
            "$": "https://api.elsevier.com/content/object/eid/1-s2.0-S2468823117306739-fx1.jpg?httpAccept=%2A%2F%2A",
            "@multimediatype": "JPEG image file",
            "@type": "IMAGE-DOWNSAMPLED",
            "@size": "18395",
            "@ref": "fx1",
            "@mimetype": "image/jpeg"
          },
          {
            "@category": "standard",
            "@height": "23",
            "@width": "92",
            "@_fa": "true",
            "$": "https://api.elsevier.com/content/object/eid/1-s2.0-S2468823117306739-fx10.jpg?httpAccept=%2A%2F%2A",
            "@multimediatype": "JPEG image file",
            "@type": "IMAGE-DOWNSAMPLED",
            "@size": "1248",
            "@ref": "fx10",
            "@mimetype": "image/jpeg"
          },
          {
            "@category": "standard",
            "@height": "26",
            "@width": "89",
            "@_fa": "true",
            "$": "https://api.elsevier.com/content/object/eid/1-s2.0-S2468823117306739-fx11.jpg?httpAccept=%2A%2F%2A",
            "@multimediatype": "JPEG image file",
            "@type": "IMAGE-DOWNSAMPLED",
            "@size": "1452",
            "@ref": "fx11",
            "@mimetype": "image/jpeg"
          },
          {
            "@category": "standard",
            "@height": "47",
            "@width": "88",
            "@_fa": "true",
            "$": "https://api.elsevier.com/content/object/eid/1-s2.0-S2468823117306739-fx12.jpg?httpAccept=%2A%2F%2A",
            "@multimediatype": "JPEG image file",
            "@type": "IMAGE-DOWNSAMPLED",
            "@size": "1540",
            "@ref": "fx12",
            "@mimetype": "image/jpeg"
          },
          {
            "@category": "standard",
            "@height": "47",
            "@width": "88",
            "@_fa": "true",
            "$": "https://api.elsevier.com/content/object/eid/1-s2.0-S2468823117306739-fx13.jpg?httpAccept=%2A%2F%2A",
            "@multimediatype": "JPEG image file",
            "@type": "IMAGE-DOWNSAMPLED",
            "@size": "1513",
            "@ref": "fx13",
            "@mimetype": "image/jpeg"
          },
          {
            "@category": "standard",
            "@height": "49",
            "@width": "92",
            "@_fa": "true",
            "$": "https://api.elsevier.com/content/object/eid/1-s2.0-S2468823117306739-fx14.jpg?httpAccept=%2A%2F%2A",
            "@multimediatype": "JPEG image file",
            "@type": "IMAGE-DOWNSAMPLED",
            "@size": "1572",
            "@ref": "fx14",
            "@mimetype": "image/jpeg"
          },
          {
            "@category": "standard",
            "@height": "49",
            "@width": "92",
            "@_fa": "true",
            "$": "https://api.elsevier.com/content/object/eid/1-s2.0-S2468823117306739-fx15.jpg?httpAccept=%2A%2F%2A",
            "@multimediatype": "JPEG image file",
            "@type": "IMAGE-DOWNSAMPLED",
            "@size": "1517",
            "@ref": "fx15",
            "@mimetype": "image/jpeg"
          },
          {
            "@category": "standard",
            "@height": "22",
            "@width": "68",
            "@_fa": "true",
            "$": "https://api.elsevier.com/content/object/eid/1-s2.0-S2468823117306739-fx2.jpg?httpAccept=%2A%2F%2A",
            "@multimediatype": "JPEG image file",
            "@type": "IMAGE-DOWNSAMPLED",
            "@size": "1099",
            "@ref": "fx2",
            "@mimetype": "image/jpeg"
          },
          {
            "@category": "standard",
            "@height": "22",
            "@width": "55",
            "@_fa": "true",
            "$": "https://api.elsevier.com/content/object/eid/1-s2.0-S2468823117306739-fx3.jpg?httpAccept=%2A%2F%2A",
            "@multimediatype": "JPEG image file",
            "@type": "IMAGE-DOWNSAMPLED",
            "@size": "923",
            "@ref": "fx3",
            "@mimetype": "image/jpeg"
          },
          {
            "@category": "standard",
            "@height": "41",
            "@width": "61",
            "@_fa": "true",
            "$": "https://api.elsevier.com/content/object/eid/1-s2.0-S2468823117306739-fx4.jpg?httpAccept=%2A%2F%2A",
            "@multimediatype": "JPEG image file",
            "@type": "IMAGE-DOWNSAMPLED",
            "@size": "1211",
            "@ref": "fx4",
            "@mimetype": "image/jpeg"
          },
          {
            "@category": "standard",
            "@height": "41",
            "@width": "60",
            "@_fa": "true",
            "$": "https://api.elsevier.com/content/object/eid/1-s2.0-S2468823117306739-fx5.jpg?httpAccept=%2A%2F%2A",
            "@multimediatype": "JPEG image file",
            "@type": "IMAGE-DOWNSAMPLED",
            "@size": "1198",
            "@ref": "fx5",
            "@mimetype": "image/jpeg"
          },
          {
            "@category": "standard",
            "@height": "42",
            "@width": "60",
            "@_fa": "true",
            "$": "https://api.elsevier.com/content/object/eid/1-s2.0-S2468823117306739-fx6.jpg?httpAccept=%2A%2F%2A",
            "@multimediatype": "JPEG image file",
            "@type": "IMAGE-DOWNSAMPLED",
            "@size": "1519",
            "@ref": "fx6",
            "@mimetype": "image/jpeg"
          },
          {
            "@category": "standard",
            "@height": "42",
            "@width": "60",
            "@_fa": "true",
            "$": "https://api.elsevier.com/content/object/eid/1-s2.0-S2468823117306739-fx7.jpg?httpAccept=%2A%2F%2A",
            "@multimediatype": "JPEG image file",
            "@type": "IMAGE-DOWNSAMPLED",
            "@size": "1523",
            "@ref": "fx7",
            "@mimetype": "image/jpeg"
          },
          {
            "@category": "standard",
            "@height": "22",
            "@width": "91",
            "@_fa": "true",
            "$": "https://api.elsevier.com/content/object/eid/1-s2.0-S2468823117306739-fx8.jpg?httpAccept=%2A%2F%2A",
            "@multimediatype": "JPEG image file",
            "@type": "IMAGE-DOWNSAMPLED",
            "@size": "1320",
            "@ref": "fx8",
            "@mimetype": "image/jpeg"
          },
          {
            "@category": "standard",
            "@height": "25",
            "@width": "88",
            "@_fa": "true",
            "$": "https://api.elsevier.com/content/object/eid/1-s2.0-S2468823117306739-fx9.jpg?httpAccept=%2A%2F%2A",
            "@multimediatype": "JPEG image file",
            "@type": "IMAGE-DOWNSAMPLED",
            "@size": "1346",
            "@ref": "fx9",
            "@mimetype": "image/jpeg"
          },
          {
            "@category": "standard",
            "@height": "301",
            "@width": "659",
            "@_fa": "true",
            "$": "https://api.elsevier.com/content/object/eid/1-s2.0-S2468823117306739-gr1.jpg?httpAccept=%2A%2F%2A",
            "@multimediatype": "JPEG image file",
            "@type": "IMAGE-DOWNSAMPLED",
            "@size": "77419",
            "@ref": "gr1",
            "@mimetype": "image/jpeg"
          },
          {
            "@category": "standard",
            "@height": "210",
            "@width": "282",
            "@_fa": "true",
            "$": "https://api.elsevier.com/content/object/eid/1-s2.0-S2468823117306739-gr10.jpg?httpAccept=%2A%2F%2A",
            "@multimediatype": "JPEG image file",
            "@type": "IMAGE-DOWNSAMPLED",
            "@size": "16064",
            "@ref": "gr10",
            "@mimetype": "image/jpeg"
          },
          {
            "@category": "standard",
            "@height": "223",
            "@width": "282",
            "@_fa": "true",
            "$": "https://api.elsevier.com/content/object/eid/1-s2.0-S2468823117306739-gr2.jpg?httpAccept=%2A%2F%2A",
            "@multimediatype": "JPEG image file",
            "@type": "IMAGE-DOWNSAMPLED",
            "@size": "12241",
            "@ref": "gr2",
            "@mimetype": "image/jpeg"
          },
          {
            "@category": "standard",
            "@height": "222",
            "@width": "282",
            "@_fa": "true",
            "$": "https://api.elsevier.com/content/object/eid/1-s2.0-S2468823117306739-gr3.jpg?httpAccept=%2A%2F%2A",
            "@multimediatype": "JPEG image file",
            "@type": "IMAGE-DOWNSAMPLED",
            "@size": "14073",
            "@ref": "gr3",
            "@mimetype": "image/jpeg"
          },
          {
            "@category": "standard",
            "@height": "242",
            "@width": "565",
            "@_fa": "true",
            "$": "https://api.elsevier.com/content/object/eid/1-s2.0-S2468823117306739-gr4.jpg?httpAccept=%2A%2F%2A",
            "@multimediatype": "JPEG image file",
            "@type": "IMAGE-DOWNSAMPLED",
            "@size": "28246",
            "@ref": "gr4",
            "@mimetype": "image/jpeg"
          },
          {
            "@category": "standard",
            "@height": "243",
            "@width": "659",
            "@_fa": "true",
            "$": "https://api.elsevier.com/content/object/eid/1-s2.0-S2468823117306739-gr5.jpg?httpAccept=%2A%2F%2A",
            "@multimediatype": "JPEG image file",
            "@type": "IMAGE-DOWNSAMPLED",
            "@size": "65684",
            "@ref": "gr5",
            "@mimetype": "image/jpeg"
          },
          {
            "@category": "standard",
            "@height": "537",
            "@width": "659",
            "@_fa": "true",
            "$": "https://api.elsevier.com/content/object/eid/1-s2.0-S2468823117306739-gr6.jpg?httpAccept=%2A%2F%2A",
            "@multimediatype": "JPEG image file",
            "@type": "IMAGE-DOWNSAMPLED",
            "@size": "173197",
            "@ref": "gr6",
            "@mimetype": "image/jpeg"
          },
          {
            "@category": "standard",
            "@height": "339",
            "@width": "339",
            "@_fa": "true",
            "$": "https://api.elsevier.com/content/object/eid/1-s2.0-S2468823117306739-gr7.jpg?httpAccept=%2A%2F%2A",
            "@multimediatype": "JPEG image file",
            "@type": "IMAGE-DOWNSAMPLED",
            "@size": "36691",
            "@ref": "gr7",
            "@mimetype": "image/jpeg"
          },
          {
            "@category": "standard",
            "@height": "450",
            "@width": "659",
            "@_fa": "true",
            "$": "https://api.elsevier.com/content/object/eid/1-s2.0-S2468823117306739-gr8.jpg?httpAccept=%2A%2F%2A",
            "@multimediatype": "JPEG image file",
            "@type": "IMAGE-DOWNSAMPLED",
            "@size": "105933",
            "@ref": "gr8",
            "@mimetype": "image/jpeg"
          },
          {
            "@category": "standard",
            "@height": "205",
            "@width": "339",
            "@_fa": "true",
            "$": "https://api.elsevier.com/content/object/eid/1-s2.0-S2468823117306739-gr9.jpg?httpAccept=%2A%2F%2A",
            "@multimediatype": "JPEG image file",
            "@type": "IMAGE-DOWNSAMPLED",
            "@size": "17104",
            "@ref": "gr9",
            "@mimetype": "image/jpeg"
          },
          {
            "@category": "standard",
            "@height": "131",
            "@width": "339",
            "@_fa": "true",
            "$": "https://api.elsevier.com/content/object/eid/1-s2.0-S2468823117306739-sc1.jpg?httpAccept=%2A%2F%2A",
            "@multimediatype": "JPEG image file",
            "@type": "IMAGE-DOWNSAMPLED",
            "@size": "16222",
            "@ref": "sc1",
            "@mimetype": "image/jpeg"
          },
          {
            "@category": "standard",
            "@_fa": "true",
            "$": "https://api.elsevier.com/content/object/eid/1-s2.0-S2468823117306739-mmc1.doc?httpAccept=%2A%2F%2A",
            "@multimediatype": "Microsoft Word file",
            "@type": "APPLICATION",
            "@size": "1073664",
            "@ref": "mmc1",
            "@mimetype": "application/word"
          }
        ]
      },
      "link": {
        "@rel": "abstract",
        "@href": "https://api.elsevier.com/content/abstract/scopus_id/85044779610"
      }
    }
  }
}