{
  "metadata": {
    "title": "Upgrading of palmitic acid to diesel-like fuels over Ni@HZSM-5 bi-functional catalysts through the in situ encapsulation method",
    "authors": "; ; ",
    "journal": "Molecular Catalysis",
    "date": "2021-07-31",
    "doi": "10.1016/j.mcat.2021.111715",
    "abstract": "",
    "uri": "https://api.elsevier.com/content/article/pii/S2468823121003321",
    "pii": "S2468823121003321"
  },
  "fulltext": {
    "full-text-retrieval-response": {
      "scopus-eid": "2-s2.0-85111346673",
      "originalText": "serial JL 315758 291210 291744 291790 291809 31 Molecular Catalysis MOLECULARCATALYSIS 2021-07-08 2021-07-08 2021-07-08 2021-07-08 2021-09-21T23:55:52 1-s2.0-S2468823121003321 S2468-8231(21)00332-1 S2468823121003321 10.1016/j.mcat.2021.111715 S300 S300.1 FULL-TEXT 1-s2.0-S2468823121X00119 2022-12-12T23:36:21.627889Z 0 0 20210701 20210731 2021 2021-07-08T06:50:02.231456Z absattachment articleinfo articlenumber articletitlenorm authfirstinitialnorm authfirstsurnamenorm cid cids contenttype copyright crossmark dateloaded dateloadedtxt datesearch datesort dateupdated dco docsubtype doctype doi eid ewtransactionid hubeid indexeddate issn issnnorm itemstage itemtransactionid itemweight openaccess openarchive pg pgfirst pii piinorm pubdateend pubdatestart pubdatetxt pubyr sectiontitle sortorder srctitle srctitlenorm srctype ssids alllist content subj subheadings suppl tomb volfirst volissue volumelist webpdf webpdfpagecount yearnav figure table e-component body mmlmath acknowledge affil appendices articletitle auth authfirstini authfull authkeywords authlast grantnumber grantsponsor grantsponsorid highlightsabst primabst ref specialabst 2468-8231 24688231 true 511 511 C Volume 511 2 111715 111715 111715 202107 July 2021 2021-07-01 2021-07-31 2021 Regular Papers article fla © 2021 Elsevier B.V. All rights reserved. UPGRADINGPALMITICACIDDIESELLIKEFUELSOVERNIHZSM5BIFUNCTIONALCATALYSTSTHROUGHINSITUENCAPSULATIONMETHOD GAO C 1 Introduction 2 Experiments 3 Results and discussion 3.1 Physicochemical properties 3.2 Catalytic performances 4 Conclusion CRediT authorship contribution statement Acknowledgements Appendix Supplementary materials References HALL 2007 23 37 D PENG 2012 2114 2117 B KIM 2019 3715 3743 S PERONI 2017 6331 6341 M LIANG 2020 123472 J LUO 2019 3744 3768 W HURTADO 2019 40 B BOTAS 2014 205 215 J JENISTOVA 2017 401 409 K SRIFA 2018 107 113 A MARTINEZPRIETO 2019 429 437 L VALENCIA 2020 3470 3480 D MA 2015 4610 4617 B LIU 2020 126332 X XIE 2019 3753 3763 S AHMADI 2014 14 19 M YANG 2015 6497 6502 L YANG 2017 31993 32000 L SOTELOBOY 2011 2791 2799 R BURIMSTITTHIGUL 2021 1648 1659 T CAO 2017 188 195 Y CAO 2018 29 35 Y SHI 2019 21341 21349 Y SHI 2019 12096 12099 Y SHI 2017 262 273 Y MA 2017 5986 5995 B MA 2015 1692 1701 B WANG 2016 7484 7487 N ZHANG 2017 9747 9751 J GU 2015 6893 6901 J WU 2019 12468 12482 S LIU 2019 1607 1610 L LI 2015 276 282 S TAN 2012 6733 6745 Y MITCHELL 2012 825 831 S VALLE 2014 402 410 B REMIRO 2018 353 365 A XIN 2020 H YANG 2018 1672 1682 F SHI 2019 9464 9473 Y SHIN 2000 883 892 E WAGNER 1979 80 C HANDBOOKXRAYPHOTOELECTRONSPECTROSCOPY WAGNER 1979 42 43 C HANDBOOKXRAYPHOTOELECTRONSPECTROSCOPY OKAMOTO 1988 427 436 Y ZAHMAKIRAN 2011 76 84 M WU 2020 1380 1390 Y MEKKI 2021 110597 A FUKUOKO 2002 73 78 A SHI 2016 4633 4648 Y ZHAO 2012 12 23 C WU 2019 12468 12482 S KWOK 2019 14774 14785 K CHAI 2019 1 19 Y WANG 2018 474 481 C GAOX2021X111715 GAOX2021X111715XC 2023-07-08T00:00:00.000Z 2023-07-08T00:00:00.000Z http://creativecommons.org/licenses/by-nc-nd/4.0/ © 2021 Elsevier B.V. All rights reserved. 2021-07-10T21:53:57.653Z http://vtw.elsevier.com/data/voc/AddOnTypes/50.7/aggregated-refined National Natural Science Foundation of China 21908225 KFJ-STS-QYZD-081 NSFC National Natural Science Foundation of China http://data.elsevier.com/vocabulary/SciValFunders/501100001809 http://sws.geonames.org/1814991/ This study was supported financially by National Natural Science Foundation of China (no. 21908225 ) and the Science and Technology Service Network Initiative ( KFJ-STS-QYZD-081 ). 0 https://doi.org/10.15223/policy-017 https://doi.org/10.15223/policy-037 https://doi.org/10.15223/policy-012 https://doi.org/10.15223/policy-029 https://doi.org/10.15223/policy-004 item S2468-8231(21)00332-1 S2468823121003321 1-s2.0-S2468823121003321 10.1016/j.mcat.2021.111715 315758 2021-09-21T23:13:22.402161Z 2021-07-01 2021-07-31 1-s2.0-S2468823121003321-main.pdf https://s3-eu-west-1.amazonaws.com/prod-ucs-content-store-eu-west/content/pii:S2468823121003321/MAIN/application/pdf/62c7e69aec696b60a9f8aa92bd58e962/main.pdf main.pdf pdf true 7097317 MAIN 12 1-s2.0-S2468823121003321-main_1.png https://s3-eu-west-1.amazonaws.com/prod-ucs-content-store-eu-west/content/pii:S2468823121003321/PREVIEW/image/png/fc460c058260b31937e202baa0422d56/main_1.png main_1.png png 58178 849 656 IMAGE-WEB-PDF 1 1-s2.0-S2468823121003321-gr3.jpg https://s3-eu-west-1.amazonaws.com/prod-ucs-content-store-eu-west/content/pii:S2468823121003321/gr3/DOWNSAMPLED/image/jpeg/c2a69be5ff1877946944b255946e4346/gr3.jpg gr3 gr3.jpg jpg 76101 479 565 IMAGE-DOWNSAMPLED 1-s2.0-S2468823121003321-gr2.jpg https://s3-eu-west-1.amazonaws.com/prod-ucs-content-store-eu-west/content/pii:S2468823121003321/gr2/DOWNSAMPLED/image/jpeg/bbe15b9bdaf26e9fc6cc9c009b8de42e/gr2.jpg gr2 gr2.jpg jpg 114996 773 565 IMAGE-DOWNSAMPLED 1-s2.0-S2468823121003321-ga1.jpg https://s3-eu-west-1.amazonaws.com/prod-ucs-content-store-eu-west/content/pii:S2468823121003321/ga1/DOWNSAMPLED/image/jpeg/5090cb73a7f56efbc9ce6e235d86cf27/ga1.jpg ga1 true ga1.jpg jpg 18276 110 301 IMAGE-DOWNSAMPLED 1-s2.0-S2468823121003321-gr1.jpg https://s3-eu-west-1.amazonaws.com/prod-ucs-content-store-eu-west/content/pii:S2468823121003321/gr1/DOWNSAMPLED/image/jpeg/3440c1032d0d268241c47ffce2960bde/gr1.jpg gr1 gr1.jpg jpg 69329 429 565 IMAGE-DOWNSAMPLED 1-s2.0-S2468823121003321-gr7.jpg https://s3-eu-west-1.amazonaws.com/prod-ucs-content-store-eu-west/content/pii:S2468823121003321/gr7/DOWNSAMPLED/image/jpeg/53151671621a0d4b096af6490f3b88f6/gr7.jpg gr7 gr7.jpg jpg 64051 289 715 IMAGE-DOWNSAMPLED 1-s2.0-S2468823121003321-gr6.jpg https://s3-eu-west-1.amazonaws.com/prod-ucs-content-store-eu-west/content/pii:S2468823121003321/gr6/DOWNSAMPLED/image/jpeg/90e451ffe0dfab3d498e2b9f091b77bf/gr6.jpg gr6 gr6.jpg jpg 80154 485 565 IMAGE-DOWNSAMPLED 1-s2.0-S2468823121003321-gr5.jpg https://s3-eu-west-1.amazonaws.com/prod-ucs-content-store-eu-west/content/pii:S2468823121003321/gr5/DOWNSAMPLED/image/jpeg/ab16635afac8672dd55263b7cdbabb16/gr5.jpg gr5 gr5.jpg jpg 71112 491 565 IMAGE-DOWNSAMPLED 1-s2.0-S2468823121003321-gr4.jpg https://s3-eu-west-1.amazonaws.com/prod-ucs-content-store-eu-west/content/pii:S2468823121003321/gr4/DOWNSAMPLED/image/jpeg/5c4eb195831be8b60a44975947aee4d9/gr4.jpg gr4 gr4.jpg jpg 99788 670 565 IMAGE-DOWNSAMPLED 1-s2.0-S2468823121003321-gr9.jpg https://s3-eu-west-1.amazonaws.com/prod-ucs-content-store-eu-west/content/pii:S2468823121003321/gr9/DOWNSAMPLED/image/jpeg/f38b4300062d926d1775585607e4aa3c/gr9.jpg gr9 gr9.jpg jpg 57973 444 565 IMAGE-DOWNSAMPLED 1-s2.0-S2468823121003321-gr8.jpg https://s3-eu-west-1.amazonaws.com/prod-ucs-content-store-eu-west/content/pii:S2468823121003321/gr8/DOWNSAMPLED/image/jpeg/00fbf37b95d06754cc3dafbe1c9b90d9/gr8.jpg gr8 gr8.jpg jpg 28225 228 565 IMAGE-DOWNSAMPLED 1-s2.0-S2468823121003321-gr3.sml https://s3-eu-west-1.amazonaws.com/prod-ucs-content-store-eu-west/content/pii:S2468823121003321/gr3/THUMBNAIL/image/gif/8443de78eadb29297e19aec262d696dd/gr3.sml gr3 gr3.sml sml 16549 164 193 IMAGE-THUMBNAIL 1-s2.0-S2468823121003321-gr2.sml https://s3-eu-west-1.amazonaws.com/prod-ucs-content-store-eu-west/content/pii:S2468823121003321/gr2/THUMBNAIL/image/gif/5978aa5225e8dc121e93ac838013179c/gr2.sml gr2 gr2.sml sml 12446 164 120 IMAGE-THUMBNAIL 1-s2.0-S2468823121003321-ga1.sml https://s3-eu-west-1.amazonaws.com/prod-ucs-content-store-eu-west/content/pii:S2468823121003321/ga1/THUMBNAIL/image/gif/f9a2fac1e140619bad39764c36ede54d/ga1.sml ga1 true ga1.sml sml 12711 80 219 IMAGE-THUMBNAIL 1-s2.0-S2468823121003321-gr1.sml https://s3-eu-west-1.amazonaws.com/prod-ucs-content-store-eu-west/content/pii:S2468823121003321/gr1/THUMBNAIL/image/gif/4527bae18e6fe85695db5652d79b6f4e/gr1.sml gr1 gr1.sml sml 11422 164 216 IMAGE-THUMBNAIL 1-s2.0-S2468823121003321-gr7.sml https://s3-eu-west-1.amazonaws.com/prod-ucs-content-store-eu-west/content/pii:S2468823121003321/gr7/THUMBNAIL/image/gif/91ca359ecfab20bbb4462d9cbbd237c6/gr7.sml gr7 gr7.sml sml 9965 89 219 IMAGE-THUMBNAIL 1-s2.0-S2468823121003321-gr6.sml https://s3-eu-west-1.amazonaws.com/prod-ucs-content-store-eu-west/content/pii:S2468823121003321/gr6/THUMBNAIL/image/gif/74c98d4d7eb04d884b9e3ddeb5d76461/gr6.sml gr6 gr6.sml sml 12179 164 191 IMAGE-THUMBNAIL 1-s2.0-S2468823121003321-gr5.sml https://s3-eu-west-1.amazonaws.com/prod-ucs-content-store-eu-west/content/pii:S2468823121003321/gr5/THUMBNAIL/image/gif/3d978f77e14ba912d356dd4113f2a7d0/gr5.sml gr5 gr5.sml sml 11348 164 189 IMAGE-THUMBNAIL 1-s2.0-S2468823121003321-gr4.sml https://s3-eu-west-1.amazonaws.com/prod-ucs-content-store-eu-west/content/pii:S2468823121003321/gr4/THUMBNAIL/image/gif/f3d0a9b55b5cc058e50b712a3be39847/gr4.sml gr4 gr4.sml sml 10431 164 138 IMAGE-THUMBNAIL 1-s2.0-S2468823121003321-gr9.sml https://s3-eu-west-1.amazonaws.com/prod-ucs-content-store-eu-west/content/pii:S2468823121003321/gr9/THUMBNAIL/image/gif/408cc2b85412e0db26758574f944f8cf/gr9.sml gr9 gr9.sml sml 12220 164 208 IMAGE-THUMBNAIL 1-s2.0-S2468823121003321-gr8.sml https://s3-eu-west-1.amazonaws.com/prod-ucs-content-store-eu-west/content/pii:S2468823121003321/gr8/THUMBNAIL/image/gif/001c3525844e6374d66c913456910994/gr8.sml gr8 gr8.sml sml 6744 88 219 IMAGE-THUMBNAIL 1-s2.0-S2468823121003321-gr3_lrg.jpg https://s3-eu-west-1.amazonaws.com/prod-ucs-content-store-eu-west/content/pii:S2468823121003321/gr3/HIGHRES/image/jpeg/a4ea9fa9d257294cd3dc83a10d1ae9bf/gr3_lrg.jpg gr3 gr3_lrg.jpg jpg 562081 2119 2500 IMAGE-HIGH-RES 1-s2.0-S2468823121003321-gr2_lrg.jpg https://s3-eu-west-1.amazonaws.com/prod-ucs-content-store-eu-west/content/pii:S2468823121003321/gr2/HIGHRES/image/jpeg/44289f6913184a07d6b36bcdd787a8e7/gr2_lrg.jpg gr2 gr2_lrg.jpg jpg 1162104 3419 2500 IMAGE-HIGH-RES 1-s2.0-S2468823121003321-ga1_lrg.jpg https://s3-eu-west-1.amazonaws.com/prod-ucs-content-store-eu-west/content/pii:S2468823121003321/ga1/HIGHRES/image/jpeg/78acaf3687eaa179374ce65342e92de9/ga1_lrg.jpg ga1 true ga1_lrg.jpg jpg 160269 486 1333 IMAGE-HIGH-RES 1-s2.0-S2468823121003321-gr1_lrg.jpg https://s3-eu-west-1.amazonaws.com/prod-ucs-content-store-eu-west/content/pii:S2468823121003321/gr1/HIGHRES/image/jpeg/0e3f5e47e750236186daba2bb9baa8c6/gr1_lrg.jpg gr1 gr1_lrg.jpg jpg 543834 1900 2500 IMAGE-HIGH-RES 1-s2.0-S2468823121003321-gr7_lrg.jpg https://s3-eu-west-1.amazonaws.com/prod-ucs-content-store-eu-west/content/pii:S2468823121003321/gr7/HIGHRES/image/jpeg/85829ef0fd179429e713e9a6224ddf76/gr7_lrg.jpg gr7 gr7_lrg.jpg jpg 540969 1282 3167 IMAGE-HIGH-RES 1-s2.0-S2468823121003321-gr6_lrg.jpg https://s3-eu-west-1.amazonaws.com/prod-ucs-content-store-eu-west/content/pii:S2468823121003321/gr6/HIGHRES/image/jpeg/0182fd3ac9fa9a225d62ca6b6a5081c8/gr6_lrg.jpg gr6 gr6_lrg.jpg jpg 672308 2148 2500 IMAGE-HIGH-RES 1-s2.0-S2468823121003321-gr5_lrg.jpg https://s3-eu-west-1.amazonaws.com/prod-ucs-content-store-eu-west/content/pii:S2468823121003321/gr5/HIGHRES/image/jpeg/be242edb8168142a45aa464122eb14d1/gr5_lrg.jpg gr5 gr5_lrg.jpg jpg 627346 2171 2500 IMAGE-HIGH-RES 1-s2.0-S2468823121003321-gr4_lrg.jpg https://s3-eu-west-1.amazonaws.com/prod-ucs-content-store-eu-west/content/pii:S2468823121003321/gr4/HIGHRES/image/jpeg/364c45187d74bb44e3997dd822d31c95/gr4_lrg.jpg gr4 gr4_lrg.jpg jpg 808971 2964 2500 IMAGE-HIGH-RES 1-s2.0-S2468823121003321-gr9_lrg.jpg https://s3-eu-west-1.amazonaws.com/prod-ucs-content-store-eu-west/content/pii:S2468823121003321/gr9/HIGHRES/image/jpeg/6260c8ceede9853e9239387348d7509e/gr9_lrg.jpg gr9 gr9_lrg.jpg jpg 783642 1966 2500 IMAGE-HIGH-RES 1-s2.0-S2468823121003321-gr8_lrg.jpg https://s3-eu-west-1.amazonaws.com/prod-ucs-content-store-eu-west/content/pii:S2468823121003321/gr8/HIGHRES/image/jpeg/6f85e78149c749b37b89a6f15c1ae6c6/gr8_lrg.jpg gr8 gr8_lrg.jpg jpg 215001 1008 2500 IMAGE-HIGH-RES 1-s2.0-S2468823121003321-mmc1.docx https://s3-eu-west-1.amazonaws.com/prod-ucs-content-store-eu-west/content/pii:S2468823121003321/mmc1/MAIN/application/vnd.openxmlformats-officedocument.wordprocessingml.document/e626d2b143447d43815ac7ffaaf90f2b/mmc1.docx mmc1 mmc1.docx docx 501441 APPLICATION 1-s2.0-S2468823121003321-si1.svg https://s3-eu-west-1.amazonaws.com/prod-ucs-content-store-eu-west/content/pii:S2468823121003321/STRIPIN/image/svg+xml/b3995f3391d5db75730a38075c6f4eae/si1.svg si1 si1.svg svg 22902 ALTIMG 1-s2.0-S2468823121003321-si2.svg https://s3-eu-west-1.amazonaws.com/prod-ucs-content-store-eu-west/content/pii:S2468823121003321/STRIPIN/image/svg+xml/8f783737d1a75185b25b921d6c2490e3/si2.svg si2 si2.svg svg 21726 ALTIMG 1-s2.0-S2468823121003321-si3.svg https://s3-eu-west-1.amazonaws.com/prod-ucs-content-store-eu-west/content/pii:S2468823121003321/STRIPIN/image/svg+xml/d6ffef34221df126715f2dc74b644cda/si3.svg si3 si3.svg svg 19492 ALTIMG 1-s2.0-S2468823121003321-si4.svg https://s3-eu-west-1.amazonaws.com/prod-ucs-content-store-eu-west/content/pii:S2468823121003321/STRIPIN/image/svg+xml/86845c6a95f0dfb2b4b2e76eeec36412/si4.svg si4 si4.svg svg 24576 ALTIMG 1-s2.0-S2468823121003321-am.pdf https://s3-eu-west-1.amazonaws.com/prod-ucs-content-store-eu-west/content/egi:103XXZXPMHB/MAIN/application/pdf/b6abcdc6cd914a496a561b53b2e05e01/am.pdf am am.pdf pdf false 2472896 AAM-PDF MCAT 111715 111715 S2468-8231(21)00332-1 10.1016/j.mcat.2021.111715 Fig. 1 N2 adsorption-desorption curves (A), BJH curves (B), XRD patterns (C) and NH3-TPD curves (D) of encapsulated 2Ni@HZ-5, 3Ni@HZ-5, 4Ni@HZ-5 and 4Ni/HZ-5 bi-functional catalysts. Fig 1 Fig. 2 SEM and TEM images of 2Ni@HZ-5 (a and b), 3Ni@HZ-5 (c and d), 4Ni@HZ-5 (e and f) and 4Ni/HZ-5(g and h) bi-functional catalysts. Fig 2 Fig. 3 TEM-Mapping of 2Ni@HZ-5 bi-functional catalyst. Fig 3 Fig. 4 XPS curves of 2Ni@HZ-5 (a and d), 3Ni@HZ-5 (b and e) and 4Ni@HZ-5 (c and f) bi-functional catalysts. Fig 4 Fig. 5 A and B: Influence of reduction conditions on catalytic performance over 2Ni@HZ-5 bi-functional catalysts (0.5 g palmitic acid, 50 ml n-decane, 800 rpm); C: NH3-TPD curves of 2Ni@HZ-5 reduced at 500 and 600°C; D: XPS curves of 2Ni@HZ-5 reduced at 600°C. Fig 5 Fig. 6 Catalytic performance over 2Ni@HZ-5, 3Ni@HZ-5, 4Ni@HZ-5 and 4Ni/HZ-5 bi-functional catalysts (0.5 g palmitic acid, 50 ml n-decane, 800 rpm). Fig 6 Fig. 7 Regenerability and recycles of 2Ni@HZ-5 bi-functional catalysts (A and B) (0.5 g palmitic acid in 50 ml n-decane; 800 rpm). Fig 7 Fig. 8 IR (A) and NH3-TPD (B) curves of fresh 2Ni@HZ-5 and used 2Ni@HZ-5 catalysts. Fig 8 Fig. 9 TEM images of 2Ni@HZ-5-Reg.2 (A) and 4Ni/HZ-5-Reg.2 (B); Ni nanoparticle distribution of 2Ni@HZ-5-Fresh (C) and 2Ni@HZ-5-Reg.2 (D). Fig 9 Table 1 Textural properties of 2Ni@HZ-5, 3Ni@HZ-5, 4Ni@HZ-5 and 4Ni/HZ-5 catalysts. Table 1 Samples Ni (wt%) Si/Al (mol) SBET (m2/g) Smicro (m2/g) Sext (m2/g) Vmicro (cm3/g) Vmeso (cm3/g) Vtotal (cm3/g) 2Ni@HZ-5 2.4 80 325.5 118.7 206.8 0.04 1.03 1.07 3Ni@HZ-5 3.3 81 299.7 116.4 183.4 0.05 1.18 1.23 4Ni@HZ-5 4.1 78 279.8 104.7 175.1 0.05 1.10 1.15 4Ni/HZ-5 4.2 82 409.6 317.6 92.1 0.13 0.08 0.21 Table 2 Upgrading of palmitic acid over Ni-based bi-functional catalysts reacted for 1 h in presence of 4 MPa H2 at 260°C. Table 2 Catalysts (g, h) Conv. (%) Concentration of each component (mol%) C12-14 alkanes C15 alkanes C16 alkanes iso-alkanes -CH2-OH -COOH 2Ni@HZ-5 (0.5 g, 1 h) > 99.9 0.5 42.2 55.7 3.3 1.3 0 3Ni@HZ-5 (0.33 g, 1 h) > 99.9 0.4 37.3 57.7 3.2 4.2 0 4Ni@HZ-5 (0.25 g, 1 h) 79.3 0.3 26.8 42.0 2.3 9.7 20.4 4Ni@HZ-5 (0.25 g, 4 h) > 99.9 0.4 37.1 60.6 3.0 1.7 0 4Ni/HZ-5 (0.25 g, 1 h) 29.5 0.0 9.8 19.2 3.4 0.7 70.5 4Ni/HZ-5 (0.25 g, 4 h) 75.5 0.5 24.8 49.5 9.3 0.0 24.5 Table 3 Catalytic performance of Ni-based bi-functional catalysts at initial reaction during palmitic acid conversion (reaction conditions: 0.5 g palmitic acid, 50 mL n-decane, 0.1/0.25 g catalysts, 260°C, 4.0 MPa H2, 1 h, 800 rpm). Table 3 Catalysts (g, h) Conv.(%) TOF (mol[palmitic acid] • mol[Ni) −1 • h−1) Concentration of each component (mol%) C12-14 alkanes C15 alkanes C16 alkanes -CH2-OH -COOH 2Ni@HZ-5(0.1 g, 2.4 wt% Ni) 34.3 16.4 3.9 10.9 18.4 0.7 65.7 3Ni@HZ-5(0.1 g, 3.3 wt% Ni) 44.2 15.3 0.2 13.4 23.8 5.5 55.8 4Ni@HZ-5(0.1 g, 4.1 wt% Ni) 39.4 11.0 0.2 10.3 20.3 8.3 60.6 4Ni/HZ-5(0.25 g, 4.2 wt% Ni) 29.5 3.2 0 9.8 19.2 0.2 70.5 Upgrading of palmitic acid to diesel-like fuels over Ni@HZSM-5 bi-functional catalysts through the in situ encapsulation method Chen Gao Investigation Data curation Writing – original draft a b Jimei Zhang Data curation Software Writing – review & editing Visualization a b Enhui Xing Methodology Formal analysis c Yongbing Xie Investigation Formal analysis a He Zhao Visualization Writing – review & editing Resources a Pengge Ning Investigation Visualization a Yanchun Shi Project administration Validation Supervision Conceptualization a ⁎ a Beijing Engineering Research Center of Process Pollution Control, Division of Environmental Engineering and Technology, Institute of Process Engineering, Chinese Academy of Sciences, Beijing 100190, China Beijing Engineering Research Center of Process Pollution Control Division of Environmental Engineering and Technology Institute of Process Engineering Chinese Academy of Sciences Beijing 100190 China aBeijing Engineering Research Center of Process Pollution Control, Division of Environmental Engineering and Technology, Institute of Process Engineering, Chinese Academy of Sciences, Beijing 100190, China b University of Chinese Academy of Sciences, China University of Chinese Academy of Sciences China bUniversity of Chinese Academy of Sciences, China c State Key Laboratory of Catalytic Materials and Reaction Engineering, Research Institute of Petroleum Processing, Sinopec, Beijing 100083, China State Key Laboratory of Catalytic Materials and Reaction Engineering Research Institute of Petroleum Processing Sinopec Beijing 100083 China cState Key Laboratory of Catalytic Materials and Reaction Engineering, Research Institute of Petroleum Processing, Sinopec, Beijing 100083, China ⁎ Corresponding author. Ni@HZSM-5 bi-functional catalysts were successfully synthesized through the in situ encapsulation method to form 2-5 nm Ni nanoparticles within HZSM-5 crystals, which was applied in evaluating the hydrodeoxygenation performance of palmitic acid to diesel-like range fuels. As for Ni@HZSM-5, there was the certain interaction between Ni and Al, which further influenced the hydrogenation activity and acidity of catalysts. Complete deoxygenation of palmitic acid and 100% selectivity of alkanes were achieved over Ni@HZSM-5 bi-functional catalysts, and the corresponding main products were C15 and C16 alkanes. Importantly, Ni@HZSM-5 (2.4 wt% Ni) exhibited the high conversion activity of 16.4 mol(palmitic acid) •mol(Ni) −1 • h−1, which were attributed to 2-5 nm Ni nanoparticles uniformly dispersed within HZSM-5 crystals. Ni@HZSM-5 further exhibited the well catalytic stability during the process of regeneration and recycle runs without obvious change of Ni sizes and dispersion, which was totally different from impregnated Ni/HZSM-5 catalysts with the aggregation of Ni particles. The favorable performance of Ni@HZSM-5 was ascribed to small Ni nanoparticles within HZSM-5 crystals without any obvious aggregation, which would offer a novel strategy for synthesizing low metal@zeolite bi-functional catalysts with high activity and stability in upgrading of bio-mass oils. Graphic abstract Image, graphical abstract Keywords Palmitic acid Ni@HZSM-5 Diesel-like fuels Encapsulation Low Ni content 1 Introduction Recently, the depletion of fossil fuels and the reduction of greenhouse-gas (GHG) emissions have motivated many researchers to explore the renewable biomass energy [1-3]. Bio-diesel is considered as one of the most significant alternatives for petroleum-derived diesel to reduce beyond 50% GHG emissions, which has been widely researched both in academic and industrial areas [4-7]. As well known, the first generation bio-diesel process involves transesterification of triglycerides with alcohols into fatty acid alkyl esters (FAAEs) and glycerol which comprise, named as ester bio-diesel; while it has a relatively high oxygen content (10-40 wt%) and poor flow quality at low temperature, limiting its direct application as a high grade fuel. Complete deoxygenation is considered as one of the most effective methods for producing hydrocarbons to improve the quality of bio-diesel. The carbon number of fatty acids is considered as the most promising feedstock for producing the green bio-diesel (C10 - C20 alkanes), which are mainly derived from animal fatty acids, vegetable oils, microalgae-based bio-oils, waste fats and oils via pyrolysis process [8-11]. Importantly, palmitic acid (C15H31COOH) and stearic acid (C17H35COOH) are selected as model compounds to study [10-13], because of their dominant components (beyond 50 wt%) in these fatty acids. Three catalytic pathways could be concluded as follows: decarboxylation (DCX: R-COOH → R-H + CO2), hydro-decarbonylation (HDC: R-COOH + H2 → R-H + CO + H2O) and hydrodeoxygenation (HDO: R-COOH + 3H2 → R-CH3 + 2H2O). Efficient and stable catalyst is crucial for upgrading the deoxygenation of fatty acids to bio-diesel range hydrocarbons. The price of noble metals (Pt, Pd, Ru, etc.) is one disadvantage, which results in the limitation of commercial application in spite of outstanding catalytic performance [14-18]. Non-noble metals (Ni, Co, Mo) have been becoming the most potential candidates of hydro-deoxygenation, especially for Ni-based catalysts. NiMoS catalysts show good hydrogenation activity but rapid deactivation, which are caused by the coke deposition and the potential poisoning in aqueous atmosphere [19,20]. Ni/zeolite bi-functional catalysts (i.e., Ni/HZSM-5, Ni/HMCM-49, Ni/HBeta, and Ni/HZSM-22) have been significantly recommended based upon their efficient hydrogenation and dehydration activity [21-27,31]. Moreover, acidity and porosity of Ni/zeolite bi-functional catalysts could tailor the distribution of final products; for examples, main iso-alkanes over Ni/HZSM-22 [21] and Co/HZSM-22 [22], major C12-C14 cracking alkanes over Ni/HMCM-49 [23] and Co/HMCM-49 [24] and almost straight-chain alkanes (C15 - C18 n-alkanes) over Ni/HZSM-5 [25] and Ni/HBeta [13,26,27]. Therefore, zeolites as acid-supports are suitable for producing biodiesel range components during fatty acids conversion. As for Ni-based catalysts, Ni0 metal centers could effectively activate C-C bond in fatty acid (Cn) deoxygenation and produce Cn-1 alkanes with one C atom loss [10-13,25-27]. According to our previous study [25], Ni/HZSM-5 bi-functional catalysts prepared by the impregnation method, could tailor the distribution of final products through the major HDO route to decrease carbon loss. However, aggregation, migration and leaching of Ni particles are gradually increased with the recycle runs and regeneration, which directly lead to the deactivation (activity and selectivity) [25-27]. The synthesis and stability of Ni nanoparticles (below 10 nm) are considered as the big challenge for Ni-based catalysts via the conventional impregnation methods, including wetness impregnation, incipient wetness impregnation and solid-state impregnation. It has been proven that the encapsulation of metal within zeolites was extremely efficient method to synthesize metal@zeolite catalysts with metal nanoparticles, which also has exhibited the excellent stability of their catalytic performance [28-30]. However, most of metal@zeolite catalysts via the encapsulation method, have only hydrogenation/dehydrogenation function without any acid-catalyzed function, such as Pd@S-1 [28], Pd@Beta [29] and Pt@ZSM-5 [30]. In this paper, Ni@HZSM-5 bi-functional catalysts with Ni nano-particles (2-5 nm) and low Ni contents (2-4 wt%) were synthesized via in situ encapsulation method, and were investigated the hydrodeoxygenation performance during palmitic acid (model compound of fatty acids) conversion especially for the stability. 2 Experiments Ni/HZSM-5 catalysts preparation: Commercial HZSM-5 (Si/Al = 80, Sinopec Research Institute of Petroleum Processing, Beijing, China) was selected as parent zeolite to support Ni (4 wt% Ni loading) to prepared Ni/HZSM-5 bi-functional catalyst as a comparison via the conventional wet impregnation method. Ni/HZSM-5 precursor was dried at 105°C overnight, calcined at 550°C for 5 h in air atmosphere and reduced at 500°C for 10 h (ramp: 10°C •min−1) with the flow rate of (80 mL• min−1) hydrogen/argon (H2/Ar) flow, named as 4Ni/HZ-5. Ni@HZSM-5 catalysts encapsulation: All materials were applied as available. Pseudo-boehmite (Al2O3, 0.25 g) was firstly dissolved in aqueous phase with some tetrapropylammonium hydroxide (25wt% TPAOH, 30.5 g) at 140°C for 2 h to form the transparent solution; secondly, Si resource (silica gel, SiO2, 25.0 g), deionized water (H2O, 21.0 g) and the clathrate of Ni2+- ethanediamine (the mass ratio of 1:1) were added into above Al solution at stirring for 4 h; thirdly, the mixtures were transferred into Teflon-line vessels (50 mL) for hydrothermal encapsulation with rotating conditions. Finally, the as-synthesized samples were filtrated, dried, calcined and reduced, like the case of 4Ni/HZ-5. Based upon Ni content, the corresponding encapsulation catalysts were named as 2Ni@HZ-5, 3Ni@HZ-5 and 4Ni@HZ-5 bi-functional catalysts, respectively. It is worth noting that the Si/Al ratios of all Ni@HZ-5 catalysts were similar with 4Ni/HZ-5 about 80, which made sure the similar acidity in theory with similar Al contents. Additionally, Ni@HZ-5 bi-functional catalysts were reduced at 500/600/700°C for 10 h (ramp: 10°C •min−1) with the flow rate of (80 mL• min−1) hydrogen (H2) or hydrogen/argon (H2/Ar) flow to investigate the reduction influences on catalytic performance. 2Ni@HZ-5 regeneration: After 3 runs during recycles at identical reaction conditions, 2Ni@HZ-5 were filtered, dried at 105°C overnight, calcined at 550°C for 5 h in air atmosphere and reduced at 500°C for 10 h (ramp: 10°C •min−1) with the flow rate of (80 mL• min-1) hydrogen/argon (H2/Ar) flow, named as 2Ni@HZ-5-Reg. Ni-based catalysts characterization: All characterization analysis of Ni-based catalysts were reduced at 500°C in H2/Ar for 10 h. N2 adsorption-desorption curves (Micromeritics ASAP 2010 instrument), X-ray fluorescence (XRF, Philips), X-ray diffraction (XRD, Rigaku Corporation, Japan) and X-ray photoemission spectroscopy (XPS, ESCALAB 250Xi) were performed to characterize the porosity with Brunauer- Emmett-Teller (BET) data and Barrett-Joiner-Halenda (BJH) curves, chemical components, crystallinity and surface Ni species states of Ni-based catalysts, respectively. It's worth noting that XPS only detected the species on the very surface of the samples and the information of the incorporated species inside the HZSM-5 was limited. Moreover, all reduction Ni-based catalysts were saved in ethanol to isolate the air before characterization. In sample preparation bucket with purging continuously argon atmosphere, the reduced samples were fetched out, dried and pasted into conductive adhesive tape of sample stage one by one. The prepared samples were quickly transferred to the instrument station to vacuumize for detection. Scanning Electron Microscopy (SEM, JSM-7610F) and Transmission electron microscopy (TEM, FEI G20) images were shown the crystal morphology and Ni nano-particles and dispersion. The acidity of Ni-based catalysts was characterized by the temperature-programmed desorption with NH3 as a probe molecule (NH3-TPD, Autochem II 2920). Hydrodeoxygenation reaction: Palmitic acid (as model compound, 0.5 g) was dissolved into n-decane (45 mL) in the 100 mL autoclave with Ni-based catalysts. Firstly, the typical reaction system was purged with the H2 at ambient temperature for several times and then the pressure was increased up to 4.0 MPa H2 before reacting. Secondly, this system was heated to 260°C with stirring at 800 rpm for reacting. Finally, the liquid phase products were analyzed by an Agilent GC-MS (7890-597-5) with a FSFS J &W 122-5532 (30 m × 250 μm × 0.25 μm) column and a flame ionization detector. (1) C o n v e r s i o n o f p a l m i t i c a c i d = ( m o l e s o f c o n v e r t e d p a l m i t i c a c i d / m o l e o f t h e s t a r t i n g p a l m i t i c a c i d ) × 100 % . S e l e c t i v i t y o f p r o d u c t s = ( m o l e s o f e a c h p r o d u c t / m o l e s o f t o t a l p r o d u c t s ) × 100 % . (2) C o n c e n t r a t i o n o f e a c h c o m p o n e n t ( m o l % ) = m o l e s o f e a c h c o m p o n e n t / m o l e s o f t o t a l c o m p o n e n t s ) × 100 % . (3) T O F ( m o l [ p a l m i t i c a c i d ] • m o l [ N i ] − 1 • h − 1 ) = m o l e s o f c o n v e r t e d p a l m i t i c a c i d / ( m o l e s o f N i c o n t e n t × 1 h ) . 3 Results and discussion 3.1 Physicochemical properties Based upon XRF analysis (Table 1 ), similar Si/Al ratios of Ni-based catalysts have been obtained by 80 for 2Ni@HZ-5, 81 for 3Ni@HZ-5, 78 for 4Ni@HZ-5 and 82 for 4Ni/HZ-5 bi-functional catalysts. As for zeolite supports, Al contents are directly related to their acidity; that is, similar Al contents mean similar acidity in theory. The corresponding Ni contents were 2.4 wt% for 2Ni@HZ-5, 3.3 wt% for 3Ni@HZ-5, 4.1 wt% for 4Ni@HZ-5 and 4.2 wt% for 4Ni/HZ-5, which were higher than their theoretical feeding. To insight the surface area and pores, N2 adsorption-desorption isotherms and pore sizes distribution of BJH curves are shown in Fig. 1 A, B and Table 1, respectively. It could be seen that Ni@HZ-5 bi-functional catalysts had type IV curves in the IUPAC classification with the hysteresis loop at relatively high p/p0 (0.80-0.99) in Fig. 1A, which indicates that all encapsulated catalysts possessed hierarchical pores with micropores and mesopores [34,35]. Meanwhile, the pore sizes of Ni@HZ-5 catalysts are centralized at 18 nm for 2Ni@HZ-5 and 30 nm for 3Ni@HZ-5 and 4Ni@HZ-5 in Fig. 1B a, b and c respectively, which suggests that the inter-crystal mesopores were originated from the aggregation of Ni@HZ-5 crystals. On the contrary, type I adsorption-desorption of impregnated 4Ni/HZ-5 is obtained (Fig. 1A d), which points out only typical micropores as well as the results of BJH curves (Fig. 1B d). The corresponding textural properties of Ni-based catalysts are shown in Table 1, and it could be seen that the surface area (SBET) and micro surface area (Smicro) of 4Ni/HZ-5 (409.6 m2/g and 317.6 m2/g) are obviously higher than these of 2Ni@HZ-5 (325.5 m2/g and 118.7 m2/g), 3Ni@HZ-5 (299.7 m2/g and 116.4 m2/g) and 4Ni@HZ-5 (279.8 m2/g and 104.7 m2/g), as well as Vmicro comparison. On the contrary, the external surface area (Sext) and total volume (Vtotal) of 4Ni/HZ-5 (92.1 m2/g and 0.21 cm3/g) are much smaller than these of 2Ni@HZ-5 (206.8 m2/g and 1.07 cm3/g), 3Ni@HZ-5 (183.4 m2/g and 1.23 cm3/g) and 4Ni@HZ-5 (175.1 m2/g and 1.15 cm3/g). The decrease of surface area especially for external surface area is also observed with the increase of Ni content within HZ-5 crystals, which indicates that Ni contents directly influence the formation of micropores and mesopores. Based upon the larger external surface area and volume, it could be predicted that encapsulated Ni@HZ-5 bi-functional catalysts may possess the better accessibility of active centers than 4Ni/HZ-5 via the impregnation method. Compared 4Ni/HZ-5 in Fig. 1C d, new diffraction peaks are obviously observed at 2θ = 44.6o and 52.2o, which are ascribed to the reflections of Ni [111] and Ni [200] lattice planes [25-27] respectively. Differently, XRD patterns of all Ni@HZ-5 bi-functional catalysts show identical diffraction peaks of HZ-5 (MFI) crystals (Fig. 1C a, b and c) without any typical diffraction peaks of Ni/NiO species, which indicates that Ni nanoparticles may be enough small and well dispersion within HZ-5 crystals. As for Ni@HZ-5, the intensity of diffraction peaks especially for 2θ = 20-25o gradually decrease combining by the increase of Ni contents, which may exist the interaction between Ni and Al to influence the HZ-5 zeolitic framework [36,37]. Additionally, acidity of bi-functional catalysts has been proven as one of crucial factors to influence the distribution of final products [22-27], and the corresponding acid sites of these Ni-based catalysts are characterized by NH3-TPD in Fig. 1D. In view of NH3 desorption temperature, there are three regions of acid sites with weak acid sites (0-200°C), medium strong acid sites (200-335°C) and strong acid sites (335-450°C). All Ni-based catalysts showed less acid sites than pure HZ-5 (Fig. 1D-e), which disclosed the coverage of acid sites by the introduction of Ni species. Especially for 4Ni/HZ-5, most of Ni particles are exposed over HZ-5 for covering part of acid sites. Encapsulated Ni@HZ-5 present more acid sites (weak and strong) than impregnated 4Ni/HZ-5. With increasing Ni contents, the weak acid sites of Ni@HZ-5 bi-functional catalysts are increased in order as follow: 4Ni@HZ-5 > 3Ni@HZ-5 > 2Ni@HZ-5; while the contrary rule of medium strong and strong acid sites is obtained as follow: 2Ni@HZ-5 > 3Ni@HZ-5 > 4Ni@HZ-5. More Ni contents directly influence the acidity of Ni@HZ-5 especially for strong acid sites, which may be caused by the interaction between Ni and Al with the agreement in the XRD analysis (Fig. 1C). However, there are no obvious diffraction peaks of NiAl2O4 [32-34], which are probably ascribed to less Ni contents (below 4wt% Ni encapsulation) and/or low calcination/reduction temperature (< 600°C). To study the surface morphology of catalysts and Ni particle sizes, SEM and TEM images of Ni-based bi-functional catalysts are presented in Fig. 2 . Similar morphology of Ni@HZ-5 (Fig. 2a 2Ni@HZ-5, Fig. 2c 3Ni@HZ-5, Fig. 2e 4Ni@HZ-5) with about 1.0 - 1.5 μm cylinders are observed clearly, which are much larger than that of 4Ni/HZ-5 (200-500 nm, Fig. 2g). As for a comparison, it's no doubt that the unevenness distribution of 5-30 nm Ni particles is observed for impregnated 4Ni/HZ-5 (Fig. 2h). Most of Ni particles are exposed over the external surface of HZ-5, which easily migrate, aggregate and leach to form larger Ni particles resulting in quick deactivation. Significantly, sizes and dispersion of Ni nanoparticles within encapsulated Ni@HZ-5 are totally different from that of impregnated 4Ni/HZ-5. About 2-5 nm Ni nanoparticles of Ni@HZ-5 are dispersed uniformly within HZ-5, which indicates the advantage of encapsulation metal within zeolite crystals. Furthermore, 2Ni@HZ-5 (2.4 wt% Ni) shows slightly smaller than 3Ni@HZ-5 (3.3 wt% Ni) and 4Ni@HZ-5 (4.1 wt% Ni). It's well known that the sizes and dispersion of Ni nanoparticles strongly determine the hydrogenation activity, and small Ni nanoparticles usually possess high hydrogenation activity [39-41]. Therefore, Ni@HZ-5 bi-functional catalysts with 2-5 nm Ni nanoparticles (Fig. 2b 2Ni@HZ-5, Fig. 2d 3Ni@HZ-5, Fig. 2f 4Ni@HZ-5) may exhibit high catalytic performance than 4Ni/HZ-5 via impregnation method with 5-30 nm Ni particles (Fig. 2h) during palmitic acid conversion, which also are anticipated to present excellent stability both in catalytic performance and Ni nanoparticles. Additionally, taking an example of 2Ni@HZ-5 catalyst, TEM-Mapping was characterized as shown in Fig. 3 to further disclose the property of Ni nanoparticles. Firstly, Si, Al and Ni elements all were well dispersed over HZ-5 crystals, especially for Ni element (Fig. 3d), which indicated that the encapsulation method could be an effective synthesis of Ni-based catalysts with uniform dispersion of Ni nanoparticles over zeolite crystals. Secondly, it could be seen that there were overlap between Al and Ni elements to suggest the interaction between Ni and Al. XPS spectra of 2Ni@HZ-5, 3Ni@HZ-5 and 4Ni@HZ-5 bi-functional catalysts are shown in Fig. 4 to investigate electronic state of Ni and Al species. There are similar fitting peaks of Ni 2p for these three bi-functional catalysts. Ni 2p are fit to six peaks at 855.1-856.1 eV for Ni0 2p3/2, 857.8-859.8 eV for Ni2+ 2p3/2, 873.1-874.9 eV for Ni0 2p1/2, 876.2-880.6 eV for Ni2+ 2p1/2, 862.4-863.3 eV and 881.6-883.2 eV for Ni-satellite species. On one hand, 853 eV and 870 eV are ascribed to Ni0 2p3/2 and 2p1/2 according to Ni0 values [42], respectively. It can be found that the binding energies of Ni@HZ-5 catalysts are all shifted about 2-5 eV to higher values, which may be caused by the interaction between Ni nanoparticles and Al element (electronic properties) of zeolite matrix, like the case of Ni and Pd nanoparticles in zeolites [45-49]. On the other hand, Ni0/Ni2+ ratios decrease obviously with increasing Ni encapsulation, which may be caused by the interaction between Ni and Al of zeolite matrix leading to the difficult reduction of Ni2+ to Ni0. However, Ni contents (2-4 wt%) might be too low to detect the diffraction peaks of NiAl2O4 (Fig. 1C). Moreover, Ni2+ is hard to be reduced totally even at 500°C for 10 h in H2/Ar and/or pure H2 system, which also indicates that there may be the interaction between Ni and Al of HZ-5. According to Al XPS curves, Al2O3 peaks were obviously obtained over 2Ni@HZ-5 (74.1 eV in Fig. 4d), 3Ni@HZ-5 (74.5 eV in Fig. 4e) and 4Ni@HZ-5 (74.9 eV in Fig. 4f) [43,44]. With increasing Ni contents, strength of Al2O3 peak decreased possibly owing to the interaction between Ni and Al. 3.2 Catalytic performances Influence of reduction atmosphere and temperature: The reduction of Ni@HZ-5 were firstly investigated with different temperature (500/600/700°C) and atmosphere (H2/Ar and pure H2) for 10 h, which would seek for the optimal conditions to achieve the best catalytic performance during palmitic acid conversion. For example, 2Ni@HZ-5, reaction conditions were performed at 260°C in presence of 4.0 MPa H2 for 4 h to make sure high conversion of palmitic acid by our previous work [21-25]. The corresponding catalytic performances of 2Ni@HZ-5 are shown in Fig. 5 A. Similar results are obtained over 0.1 g 2Ni@HZ-5 with reduced at 500°C for 10 h in pure H2 (Fig. 5A a: 92.5% conversion of palmitic acid; the selectivity of products: 57.4% C16 alkanes, 35.7% C15 alkanes, 6.3% C14 alkanes and 0.3% hexadecanol) and in H2/Ar (Fig. 5A b: 92.9% conversion of palmitic acid; the selectivity of products: 57.5% C16 alkanes, 37.0% C15 alkanes, 4.4% C14 alkanes and 0.2% hexadecanol), which indicates that there is no obviously different performance over 2Ni@HZ-5 reduction in pure H2 or H2/Ar. Therefore, H2/Ar is selected as the reduction atmosphere for preparing other Ni@HZ-5 bi-functional catalysts. 0.2 g 2Ni@HZ-5 was performed to catalyze palmitic acid to achieve complete deoxygenation in Fig. 5B. 100% selectivity of hydrocarbons are obtained over 0.2 g 2Ni@HZ-5 reduced at 500°C in H2 (59.2% C16, 33.1% C15 and 7.0% C14 alkanes) and H2/Ar (58.8% C16, 37.2% C15 and 4.0% C14 alkanes), which still indicates that H2/Ar reduction atmosphere could make sure Ni2+ species to Ni0 as soon as possible for achieving high conversion and selectivity of hydrocarbons. The influences of the reduction temperature (500/600/700°C) in H2/Ar for 10 h on the catalytic performance are shown in Fig. 5A, and the conversion of palmitic acid are decreased over 2Ni@HZ-5 from 92.9% at 500 °C (Fig. 5A b) to 76.0% at 600°C (Fig. 5A c) and 66.0% at 700°C (Fig. 5A d) with increasing reduction temperature. Meanwhile, the higher selectivity of hexadecanol is observed over 2Ni@HZ-5 reduced at the higher temperature with the low conversion of palmitic acid, especially for 700°C reduction (15.1% hexadecanol), which directly discloses that the acid-catalyzed reaction such as hexadecanol dehydration becomes weakened over 2Ni@HZ-5 reduced at 600 and 700°C. It could be obtained that high reduction temperature of encapsulated 2Ni@HZ-5 catalysts directly influence both the hydrogenation activity and the dehydration reaction, which might be caused by the strong interaction of Ni and Al at high temperature leading to the decrease of Ni0 active centers and acid sites [36-40]. As for 2Ni@HZ-5 reduced at 500°C and 600°C, the corresponding NH3-TPD and XPS analysis are shown in Fig. 5C and Fig. 5D. Obviously, the strength and amount of acid centers over 2Ni@HZ-5 reduced at 600°C are weaker and less than those over 2Ni@HZ-5 reduced at 500°C (Fig. 5C), which usually decreases the dehydration to form hydrocarbons. XPS spectra of 2Ni@HZ-5 reduced at 600°C (Fig. 5D) are similar with 2Ni@HZ-5 reduced at 500°C (Fig. 4a), while the ratio of Ni0/Ni2+ decreases over 2Ni@HZ-5 reduced at 600°C leading to low activity of hydrogenation. Based upon above analysis, it could be concluded that the optimal reduction condition of Ni@HZ-5 bi-functional catalysts was at 500°C in hydrogen/argon (H2/Ar) for 10 h, which could make sure the better catalytic performance during palmitic acid conversion. Therefore, all Ni@HZ-5 bi-functional catalysts were reduced at 500°C in hydrogen/argon (H2/Ar) for 10 h to investigate the catalytic performance in next sections. Catalytic performance over Ni-based bi-functional catalysts: Fig. 6 A presents the catalytic performance of palmitic acid (260°C, 4.0 MPa H2, 1 h) over 2Ni@HZ-5 (0.5 g), 3Ni@HZ-5 (0.33 g), 4Ni@HZ-5 (0.25 g) and 4Ni/HZ-5 (0.25 g) bi-functional catalysts with similar Ni active centers in theory (about 0.01 g Ni contents), and the corresponding conversion is decreased as follow: 2Ni@HZ-5 (> 99.9%) ≈ 3Ni@HZ-5 (> 99.9%) > 4Ni@HZ-5 (79.6%) > 4Ni/HZ-5 (29.5%). All encapsulated Ni@HZ-5 exhibit obviously higher hydrogenation activity than impregnated 4Ni/HZ-5, which may be ascribed to the advantage of small Ni nano-particles (2-5 nm) via the in situ encapsulation method. The selectivity of alkanes are also obtained similar rules like the conversion as follow: 2Ni@HZ-5 (55.7% C16, 42.2% C15 and 0.5% C14) ≈ 3Ni@HZ-5 (57.7% C16, 37.3% C15 and 0.4% C14) > 4Ni@HZ-5 (52.8% C16, and 33.7% C15) > 4Ni/HZ-5 (64.3% C16 and 34.2% C15), which is agreement with the results of XPS and NH3-TPD analysis. As for encapsulated Ni@HZ-5 bi-functional catalysts, more Ni contents mean the stronger interaction between Ni and Al (Fig. 4), which discloses less Ni0 species formation. Meanwhile, more Ni contents also lead to more serious blockage of pores (Table 1) and coverage of acid sites (Fig. 1D, especially for weak/medium/strong acid sites), which decreases the selectivity of alkanes via dehydration reaction of hexadecanol. Therefore, lower conversion of palmitic acid and less selectivity of hydrocarbons are observed over 4Ni@HZ-5 than those of 2Ni@HZ-5 and 3Ni@HZ-5. The corresponding concentration of each component is shown in Table 2 . Palmitic acid is completely converted over 4Ni@HZ-5 (0.25 g) after reacting for 4 h with 98.1 mol% alkanes, while only 75.5% conversion of palmitic acid is achieved over 4Ni/HZ-5 (0.25 g) at identical reaction conditions. To further investigate the difference in catalytic performance, similar conversions of palmitic acid are also achieved over all Ni-based bi-functional catalysts with 81.7% for 2Ni@HZ-5 (0.2 g cat., reacting for 2 h), 78.8% for 3Ni@HZ-5 (0.13 g cat., reacting for 2 h), 79.2% for 4Ni@HZ-5 (0.1 g cat., reacting for 4 h) and 75.5% for 4Ni/HZ-5 (0.25 g cat., reacting for 4 h) at 260°C in presence of 4.0 MPa H2 in Fig. 6B. It could be concluded the decrease activity of Ni-based catalysts in order as follow: 2Ni@HZ-5 > 3Ni@HZ-5 > 4Ni@HZ-5 > 4Ni/HZ-5, which is in accordance with the results over similar Ni contents (Fig. 6A). Additionally, TOF (mol[palmitic acid] • mol[Ni) −1 • h−1) of each Ni-based bi-functional catalysts are calculated in Table 3 to exhibit the advantage of Ni nanoparticles for Ni@HZ-5 bi-functional catalysts. It could be seen 16.4 mol[palmitic acid] • mol[Ni] −1 • h−1 for 2Ni@HZ-5, 15.3 mol[palmitic acid] • mol[Ni] −1 • h−1 for 3Ni@HZ-5, 11.0 mol[palmitic acid] • mol[Ni] −1 • h−1 for 4Ni@HZ-5 and 3.2 mol[palmitic acid] • mol[Ni] −1 • h−1 for 4Ni/HZ-5. Significantly, 2Ni@HZ-5 bi-functional catalyst exhibited the best catalytic performance in spite of low Ni content (2.4 wt% Ni). Besides, plamitic/stearic acids deoxygenation over different Ni-HZSM-5 bi-functional catalysts has concluded in Table S1. 2Ni@HZ-5 also showed the best deoxygenation and C16 alkanes without carbon loss, which did not ignore the Si/Al of HZ-5 influence on products distribution over metal-zeolite bi-functional catalysts. Analysis of possible reaction network of palmitic acid conversion: The influence of reaction time on catalytic performance over 0.1 g and 0.2 g 2Ni@HZ-5 are given in Fig. 6C and D during palmitic acid conversion (260°C, 4.0 MPa H2, 1 to 4 h) respectively, which show the similar increase rules of alkanes. With reacting for 4 h, 6.1 mol% palmitic acid are not converted over 0.1 g 2Ni@HZ-5 (Fig. 6C), which suggests that there was no enough active centers or reaction time for complete hydrogenation and deoxygenation. As for 0.2 g 2Ni@HZ-5 system (Fig. 6D, with error bars), concentration of palmitic acid decrease gradually from 100 mol% (0 h) to 48.2 mol% (1 h), 19.6 mol% (2 h) and 0.5 mol% (3 h). Furthermore, there is no detection of palmitic acid for reacting 4 h over 0.2 g 2Ni@HZ-5, indicating the enough active centers with 0.2 g 2Ni@HZ-5 mass. The corresponding selectivity of main C16 and C15 alkanes increase consecutively from 30.1 mol% C16 and 18.4 mol% C15 (1 h) to 46.6 mol% C16 and 29.8 mol% C15 (2 h), 57.2 mol% C16 and 37.7 mol% C15 (3 h), 58.2 mol% C16 and 37.4 mol% C15 (4 h). It could be seen that the determine step of palmitic acid conversion is the initial hydrogenation of palmitic acid, not the dehydration over Ni@HZ-5 bi-functional catalysts. While C14 alkanes do not show significant increase (1.7 mol% for 1 h, 3.4 mol% for 2 h, 4.3 mol% for 3 h and 4.1 mol% for 4 h). The error bars were obtained by the standard deviation based upon three times of repeated experiments, which indicated the well reproducible data. Based upon above results in Fig. 6C and D, it could be hypothesized the possible reaction network of palmitic acid conversion over Ni@HZ-5 bi-functional catalysts as shown in Scheme S1. Firstly, C15 and C16 alkanes are both gradually increased with prolonging reaction time, which may indicate that these two alkanes are almost simultaneously produced. Therefore, it could be concluded that HDC (Scheme S1 Route 2: Path 1 and Path 7) and HDO (Scheme S1 Route 3: Path 1, Path 2 and Path 3) routes are major routes to produce C15 and C16 alkanes in presence of H2 atmosphere with hexadecanal and hexadecanal/1-hexadecanol as the intermediates [8-13,21-27,31-35], respectively. Furthermore, there are competing pathway between HDC and HDO (Scheme S1, Path 7 and Path 2). Secondly, trace C12-C14 alkanes are obtained via the hydro-cracking reaction of C15 and C16 alkanes over bi-functional catalysts in presence of H2 (Scheme S1, Path4, Path 5, Path 10 and Path 11), which is in accordance with literatures during hydrodeoxygenation of fatty acids [2,23,24]. Finally, there are some iso-alkanes in Table 2, which is originated from the isomerization of C15 and C16 alkanes over acid sites of bi-functional catalysts [21-25]. Stability of 2Ni@HZ-5 bi-functional catalyst: As well known, the stability of metal/zeolite bi-functional catalysts via the conventional impregnation method is a big challenge both in academic and industrial aspects despite of high hydrogenation activity [21-27,31-35,50,51]. On one hand, most of metal particles are exposed over the external surface of zeolite supports likely leading to the migration, aggregation, leaching, sintering and poisoning of metal active centers during the recycle use and regeneration process, which directly decrease the hydrogenation activity and even deactivate dramatically. On the other hand, the acidity alteration of zeolite supports generally influence the distribution of final products via acid-catalysis of dehydration, isomerization and cracking reactions, which are probably caused by desilication, dealumination, carbonaceous deposition and so on. It has been reported that encapsulation of metal particles within zeolites (metal@zeolite) is one of the most promising approach to enhance the stability of metal nanoparticles [52-54], compared to the impregnation method. Therefore, the stability of encapsulated 2Ni@HZ-5 was performed as shown in Fig. 7 A and B at identical reaction conditions (260°C, 4.0 MPa H2,), as comparison of impregnated 4Ni/HZ-5. As shown in Fig. 7A, the average conversion of palmitic acid decreased from 75.1% over fresh 4Ni/HZ-5 (0.25 g) to 71.1% over 4Ni/HZ-5-Reg.1 and 66.4% over 4Ni/HZ-5- Reg. 2 via impregnation method at 260°C in presence of 4.0 MPa H2 for 4 h, which suggests that the activity do not completely recover after regeneration with some deactivation. As for the corresponding selectivity of main alkanes (C16 and C15 alkanes), C16 alkanes increase from 65.3% (fresh) to 67.6% (Reg.1) and 75.1% (Reg.2), while C15 alkanes decrease from 33.0% (fresh) to 31.2% (Reg.1) and 23.4% (Reg.2). According to our previous work [49], C15 alkanes are formed via HDC route over strong acid sites of metal/zeolite bi-functional catalysts. Therefore, the decrease of C15 alkanes are observed over regenerated 4Ni/HZ-5, probably due to some loss of some strong acid sites during the process of regeneration. It is not necessary of strong acid sites for hexadecanol dehydration to form C16 alkanes via HDO route. Weak acid sites are enough for favoring this dehydration based upon the results of this paper, like the case of Ni/HZ-5 with high Si/Al (Si/Al ≈ 113) [25]. Importantly for encapsulated 2Ni@HZ-5 (0.2 g), similar results are obtained over fresh (80.4% conversion of palmitic acid and the selectivity of 56.9% C16, 38.0% C15 and 4.4% C14 alkanes) and 2Ni@HZ-5-Reg.2 (80.1% conversion of palmitic acid and the selectivity of 58.3% C16, 36.9% C15 and 4.2% C14 alkanes) at 260°C in presence of 4.0 MPa H2 for 2 h. The activity and selectivity of main products are totally recovered after regeneration without any deactivation phenomenon, which indicates that encapsulated 2Ni@HZ-5 bi-functional catalysts possess the better regenerability. To further evaluate the stability of 2Ni@HZ-5 and disclose the advantage of encapsulation, the recycles of 0.5 g 2Ni@HZ-5 bi-functional catalyst are also performed at 260°C in presence of 4.0 MPa H2 for 1 h to achieve the complete conversion of palmitic acid. The corresponding catalytic performance is shown in Fig. 7B. With the increase of run times, there is no obvious decrease for activity with complete conversion (> 99.9%), as well as for alkanes selectivity (97.9% at run 1, 99.1% at run 2 and 99.0% at run 3). However, there is significant phenomenon for the transformation selectivity between C16 and C15 alkanes during three runs, which is combining by the increase of C16 alkanes but the decrease of C15 alkanes as follows: 55.7% C16 and 42.2% C15 (run 1), 63.9% C16 and 35.2% C15 (run 2), 78.5% C16 and 20.5% C15 (run 3). It may be ascribed to the coverage of some strong acid sites to influence HDC route. The second recycles have been carried out with 6 runs in Fig. S1. Compared Fig. S1 to Fig. 7B, similar results of conversion and hydrocarbons selectivity were obtained among run1, run 2 and runs 3, which again suggested that the catalytic data were reproducible. It's worth noting that the decrease of conversion and hydrocarbons selectivity from run 4 to run 6 were observed to disclose some deactivation. After regeneration, the activity and hydrocarbons selectivity could be achieve the level of fresh catalyst, which also indicated 2Ni@HZ-5 through the in situ encapsulation method possess better regenerability. IR and NH3-TPD characterizations of used 2Ni@HZ-5 after 3 runs were given in Fig. 8 , compared with fresh 2Ni@HZ-5. After reacting 3 runs, new peaks were observed at 2944 and 2859 cm−1 over used 2Ni@HZ-5, which were ascribed to C-H stretching vibration of hydrocarbons (Fig. 8A). Additionally, it could be seen that acid sites of used 2Ni@HZ-5 decreased obviously based upon NH3-TPD compared to fresh 2Ni@HZ-5 (Fig. 8B). These results directly disclose that there were some hydrocarbons reserved over 2Ni@HZ-5 catalysts after reacting 3 runs to cover the acid sites, which influenced the dehydration and acid-catalysis performance to determine the distribution of final products. According to the regeneration performance of 4Ni/HZ-5 and 2Ni@HZ-5 during palmitic acid conversion (Fig. 7A and B), it could be seen the significant difference between two Ni-based bi-functional catalysts, especially for encapsulated 2Ni@HZ-5 without any deactivation. To disclose the different deactivation phenomenon of impregnated 4Ni/HZ-5 and encapsulated 2Ni@HZ-5, TEM characterization is analyzed as shown in Fig. S2A (2Ni@HZ-5-Reg.1), Fig. S2B (4Ni/HZ-5-Reg. 1), Fig. 9 A (2Ni@HZ-5–Reg.2) and 9B (4Ni/HZ-5-Reg. 2). Clearly, the aggregation of Ni particles is observed over 4Ni/HZ-5 via the impregnation method, with the obvious increase of Ni particle sizes (Fig.2h for fresh catalyst, Fig. S2B for Reg.1, Fig. 9B for Reg.2). Distinctly, there is no obvious increase sizes of Ni nanoparticles within HZ-5 crystals between fresh 2Ni@HZ-5 (Fig. 9C, 2-5 nm) and 2Ni@HZ-5-Reg. 2 (Fig. 9D, 2-5 nm), which indicates that Ni nanoparticles within HZ-5 crystals is hard to migrate and aggregate due to the confinement effect. Thus, 2Ni@HZ-5 synthesized by in situ encapsulation exhibits the higher activity, selectivity of alkanes and favorable stability, despite of low Ni contents (2 wt% in theory). Based upon above analysis, these results have verified that in situ encapsulation method is one of the most promising strategies to synthesize the well catalytic stability of metal@zeolite bi-functional catalysts for upgrading palmitic acid to diesel-like components. 4 Conclusion 2-5 nm Ni nanoparticles have been successfully encapsulated and uniformly dispersed within HZSM-5 crystals via in situ hydrothermal synthesis, which were totally different from impregnated Ni/HZSM-5 with 5-30 nm Ni particles exposed over the external surface of HZSM-5, as well as the porosity, acidity and morphology. Ni@HZSM-5 bi-functional catalysts possessed some mesopores caused by the aggregation of crystals. It has been proven that the interaction between Ni and Al of HZSM-5 crystals could influence the hydrogenation activity and final distribution of products. The less Ni contents, the less interaction between Ni and Al, and the higher hydrogenation activity. Significantly, Ni@HZSM-5 (2.4 wt% Ni) completely catalyzed palmitic acid to hydrocarbons with C15 and C16 alkanes as main products via hydro-decarbonylation (HDC) and hydro-deoxygenation (HDO) respectively. The conversion activity of palmitic acid (16.4 mol[palmitic acid] • mol[Ni] −1 • h−1) was much higher than that of impregnated Ni/HZSM-5 (3.2 mol[palmitic acid] • mol[Ni] −1 • h−1). Simultaneously, the favorable stability of Ni@HZSM-5 bi-functional catalysts was achieved both in regeneration and recycle runs without any obvious deactivation, which was ascribed to the advantage of Ni@HZSM-5 with 2-5 nm Ni nanoparticles via in situ encapsulation method. It could open a unique strategy to develop Ni@zeolite bi-functional catalysts for upgrading fatty acids to green bio-diesel fuels. CRediT authorship contribution statement Chen Gao: Investigation, Data curation, Writing – original draft. Jimei Zhang: Data curation, Software, Writing – review & editing, Visualization. Enhui Xing: Methodology, Formal analysis. Yongbing Xie: Investigation, Formal analysis. He Zhao: Visualization, Writing – review & editing, Resources. Pengge Ning: Investigation, Visualization. Yanchun Shi: Project administration, Validation, Supervision, Conceptualization. Declaration of Competing Interest The authors declare that they have no known competing financial interests or personal relationships that could have appeared to influence the work reported in this paper. Acknowledgements This study was supported financially by National Natural Science Foundation of China (no. 21908225) and the Science and Technology Service Network Initiative (KFJ-STS-QYZD-081). Supplementary materials Supplementary material associated with this article can be found, in the online version, at doi:10.1016/j.mcat.2021.111715. Appendix Supplementary materials Image, application 1 References [1] D. Hall Greenhouse gas emissions and the fossil-fuel supply chain in the United States Assess. US Clim. Policy Options 2007 23 37 D. Hall, Greenhouse gas emissions and the fossil-fuel supply chain in the United States, Assess. US Clim. Policy Options, 2007, pp. 23-37. [2] B.X. Peng Y. Yao C. Zhao J.A. Lercher Towards quantitative conversion of microalgae oil to diesel-range alkanes with bifunctional catalysts Angew. Chem. Int. Ed. 124 2012 2114 2117 10.1002/anie.201106243 B.X. Peng, Y. Yao, C. Zhao, J.A. Lercher, Towards quantitative conversion of microalgae oil to diesel-range alkanes with bifunctional catalysts, Angew. Chem. Int. Ed.124 (2012) 2114-2117. https://doi.org/10.1002/anie.201106243. [3] S. Kim E.E. Kwon Y.T. Kim S. Jung H.J. Kim G.W. Huber J. Lee Recent advances in hydrodeoxygenation of bio-mass-derived oxygenates over heterogeneous catalysts Green Chem. 21 2019 3715 3743 10.1039/c9gc01210a S. Kim, E.E. Kwon, Y.T. Kim, S. Jung, H.J. Kim, G.W. Huber, J. Lee, Recent advances in hydrodeoxygenation of bio-mass-derived oxygenates over heterogeneous catalysts, Green Chem.. 21 (2019) 3715-3743. https://doi.org/10.1039/c9gc01210a. [4] M. Peroni I. Lee X.Y. Huang E. Baráth O.Y. Gutiérrez J.A. Lercher Deoxygenation of palmitic acid on unsupported transition-metal phosphides ACS Catal. 7 2017 6331 6341 10.1021/acscatal.7b01294 M. Peroni, I. Lee, X.Y. Huang, E. Baráth, O.Y. Gutiérrez, J.A. Lercher, Deoxygenation of palmitic acid on unsupported transition-metal phosphides, ACS Catal.. 7 (2017) 6331-6341. https://doi.org/10.1021/acscatal.7b01294. [5] J.M. Liang T. Chen J.P. Liu Q.C. Zhang W.C. Peng Y. Li F.B. Zhang X.B. Fan Chemoselective hydrodeoxygenation of palmitic acid to diesel-like hydrocarbons over Ni/MoO2@Mo2CTx catalyst with extraordinary synergic effect Chem. Eng. J. 391 2020 123472 10.1016/j.cej.2019.123472 J.M. Liang, T. Chen, J.P. Liu, Q.C. Zhang, W.C. Peng, Y. Li, F.B. Zhang, X.B. Fan, Chemoselective hydrodeoxygenation of palmitic acid to diesel-like hydrocarbons over Ni/MoO2@Mo2CTx catalyst with extraordinary synergic effect, Chem. Eng. J.391 (2020) 123472. https://doi.org/10.1016/j.cej.2019.123472. [6] W.H. Luo W.X. Cao P.C.A. Bruijnincx L. Lin A. Wang T. Zhang Zeolite-supported metal catalysts for selective hydrodeoxygenation of biomass-derived platform molecules Green Chem. 21 2019 3744 3768 10.1039/c9gc01216h W.H. Luo, W.X. Cao, P.C.A. Bruijnincx, L. Lin, A. Wang, T. Zhang, Zeolite-supported metal catalysts for selective hydrodeoxygenation of biomass-derived platform molecules, Green Chem.. 21 (2019) 3744-3768. https://doi.org/10.1039/c9gc01216h. [7] B. Hurtado A. Posadillo D. Luna F.M. Bautista J.M. Hidalgo C. Luna J. Calero A.A. Romero R. Estevez Synthesis, performance and emission quality assessment of ecodiesel from castor oil in diesel/biofuel/alcohol triple blends in a diesel engine Catalysis 9 2019 40 10.3390/catal9010040 B. Hurtado, A. Posadillo, D. Luna, F. M. Bautista, J. M. Hidalgo, C. Luna, J. Calero, A. A. Romero, R. Estevez, Synthesis, performance and emission quality assessment of ecodiesel from castor oil in diesel/biofuel/alcohol triple blends in a diesel engine. Catalysis, 9 (2019) 40. 10.3390/catal9010040. [8] J.A. Botas D.P. Serrano A. García R. Ramos Catalytic conversion of rapeseed oil for the production of raw chemicals, fuels and carbon nanotubes over Ni-modified nanocrystalline and hierarchical ZSM-5 Appl. Catal. B: Environ. 145 2014 205 215 10.1016/j.apcatb.2012.12.023 J.A. Botas, D.P. Serrano, A. García, R.Ramos, Catalytic conversion of rapeseed oil for the production of raw chemicals, fuels and carbon nanotubes over Ni-modified nanocrystalline and hierarchical ZSM-5, Appl. Catal. B: Environ.145 (2014) 205-215. https://doi.org/10.1016/j.apcatb.2012.12.023. [9] K. Jeništová I. Hachemi P. Mäki-Arvela N. Kumar M. Peurla L. Čapek J. Wärnå D.Y. Murzin Hydrodeoxygenation of stearic acid and tall oil fatty acids over Ni-alumina catalysts: influence of reaction parameters and kinetic modelling Chem. Eng. J. 316 2017 401 409 10.1016/j.cej.2017.01.117 K. Jeništová, I. Hachemi, P. Mäki-Arvela, N. Kumar, M. Peurla, L. Čapek, J. Wärnå, D.Y. Murzin, Hydrodeoxygenation of stearic acid and tall oil fatty acids over Ni-alumina catalysts: influence of reaction parameters and kinetic modelling, Chem. Eng. J.316 (2017) 401-409. https://doi.org/10.1016/j.cej.2017.01.117. [10] A. Srifa R. Kaewmeesi C. Fang V. Itthibenchapong K. Faungnawakij NiAl2O4 spinel-type catalysts for deoxygenation of palm oil to green diesel Chem. Eng. J. 345 2018 107 113 10.1016/j.cej.2018.03.118 A. Srifa, R. Kaewmeesi, C. Fang, V. Itthibenchapong, K. Faungnawakij, NiAl2O4 spinel-type catalysts for deoxygenation of palm oil to green diesel, Chem. Eng. J.345 (2018) 107-113. https://doi.org/10.1016/j.cej.2018.03.118. [11] L.M. Martinez-Prieto M. Pyche C. Cerezo-Navarrete B. Chaydret Uniform Ru nanoparticles on N-doped grapheme for selective hydrogenation of fatty acids to alcohols J. Catal. 377 2019 429 437 10.1016/j.jcat.2019.07.040 L. M. Martinez-Prieto, M. Pyche, C. Cerezo-Navarrete, B. Chaydret, Uniform Ru nanoparticles on N-doped grapheme for selective hydrogenation of fatty acids to alcohols, J. Catal.377 (2019) 429-437. https://doi.org/10.1016/j.jcat.2019.07.040. [12] D. Valencia C. Zenteno D. Gomora-Herrera M.T. Gomez-Perez J. Aburto Ni-based heterogenemous catalysts for the transformation of fatty acids into higher yields of O-free hydrocarbons Green Chem. 22 2020 3470 3480 10.1039/d0gc00853b D. Valencia, C. Zenteno, D. Gomora-Herrera, M.T. Gomez-Perez, J. Aburto, Ni-based heterogenemous catalysts for the transformation of fatty acids into higher yields of O-free hydrocarbons, Green Chem.. 22 (2020) 3470-3480. https://doi.org/10.1039/d0gc00853b. [13] B. Ma J.B. Hu Y.M. Yang C. Zhao Ni nanoparticles encapsulated into mesoporous single-crystalline HBEA: application for drainage oil hydrodeoxygeantion to diesel Green Chem. 17 2015 4610 4617 10.1039/c5gc01199j B. Ma, J.B. Hu, Y.M. Yang, C. Zhao, Ni nanoparticles encapsulated into mesoporous single-crystalline HBEA: application for drainage oil hydrodeoxygeantion to diesel, Green Chem.. 17 (2015) 4610-4617. https://doi.org/10.1039/c5gc01199j. [14] X. Liu M. Yang Z.H. Deng A. Dasgupta Y. Guo Hydrothermal hydrodeoxygenation of palmitic acid over Pd/C catalysts: mechanism and kinetic modeling Chem. Eng. J. 20 2020 126332 10.1016/j.cej.2020.126332 X. Liu, M. Yang, Z.H. Deng, A. Dasgupta, Y. Guo, Hydrothermal hydrodeoxygenation of palmitic acid over Pd/C catalysts: mechanism and kinetic modeling, Chem. Eng. J.20 (2020) 126332. https://doi.org/10.1016/j.cej.2020.126332. [15] S.Q. Xie C.H. Jia A. Prakash M.I. Palafox J. Pfaendtner H.F. Lin Generic biphasic catalytic approach for producing renewable diesel from fatty acids and vegetable oils ACS Catal. 9 2019 3753 3763 10.1021/acscatal.9b00215 S.Q. Xie, C.H. Jia, A. Prakash, M.I. Palafox, J. Pfaendtner, H.F. Lin, Generic biphasic catalytic approach for producing renewable diesel from fatty acids and vegetable oils, ACS Catal.. 9 (2019) 3753-3763. https://doi.org/10.1021/acscatal.9b00215. [16] M. Ahmadi E.E. Macias J.B. Jasinski P. Ratnasamy M.A. Carreon Decarboxylation and further transformation of oleic acid over bifunctional, Pt/SAPO-11 catalyst and Pt/chloride Al2O3 catalysts J. Mole. Catal. A: Chem. 386 2014 14 19 10.1016/j.molcata.2014.02.004 M. Ahmadi, E. E. Macias, J. B. Jasinski, P. Ratnasamy, M. A. Carreon, Decarboxylation and further transformation of oleic acid over bifunctional, Pt/SAPO-11 catalyst and Pt/chloride Al2O3 catalysts. J. Mole. Catal. A: Chem., 386 (2014) 14-19. http://dx.doi.org/10.1016/j.molcata.2014.02.004. [17] L.Q. Yang K.L. Tate J.B. Jasinski M.A. Carreon Decarboxylation of oleic acid to heptadecane over Pt supported on zeolite 5A beads ACS Catal. 5 2015 6497 6502 10.1021/acscatal.sb01913 L. Q. Yang, K. L. Tate, J. B. Jasinski, M. A. Carreon, Decarboxylation of oleic acid to heptadecane over Pt supported on zeolite 5A beads. ACS Catal.., 5 (2015) 6497-6502. 10.1021/acscatal.sb01913. [18] L.Q. Yang M.A. Carreon Dexoygenation of palmitic and lauric acids over Pt/ZIF-67 membrane/zeolite 5A bead catalysts ACS Appl. Mater. Interfaces 9 2017 31993 32000 10.1021/acsmi.7b11638 L. Q. Yang, M. A. Carreon, Dexoygenation of palmitic and lauric acids over Pt/ZIF-67 membrane/zeolite 5A bead catalysts. ACS Appl. Mater. Interfaces, 9 (2017) 31993-32000. 10.1021/acsmi.7b11638. [19] R. Sotelo-Boy Y. Liu T. Minowa Renewable diesel production from the hydrotreating of rapeseed oil with Pt/zeolite and NiMo/Al2O3 catalysts Ind. Eng. Chem. Res. 50 2011 2791 2799 10.1021/ie100824d R. Sotelo-Boy, Y. Liu, T. Minowa, Renewable diesel production from the hydrotreating of rapeseed oil with Pt/zeolite and NiMo/Al2O3 catalysts. Ind. Eng. Chem. Res.50 (2011) 2791-2799. https://doi.org/10.1021/ie100824d. [20] T. Burimstitthigul B. Yoosuk C. Ngamcharussrivichai P. Prasassarakich Hydrocarbon biofuel from hydrotreating of palm oil over unsupported Ni-Mo sulfide catalysts Renew. Energy 163 2021 1648 1659 10.1016/j.renene.2020.10.044 T. Burimstitthigul, B. Yoosuk, C. Ngamcharussrivichai, P. Prasassarakich, Hydrocarbon biofuel from hydrotreating of palm oil over unsupported Ni-Mo sulfide catalysts, Renew. Energy163 (2021) 1648-1659. https://doi.org/10.1016/j.renene.2020.10.044. [21] Y.Y. Cao Y.C. Shi J.M. Liang Y.L. Wu S.B. Huang J.L. Wang M.D. Yang H.S. Hu High iso-alkanes production from palmitic acid over bi-functional Ni/H-ZSM-22 catalysts Chem. Eng. Sci. 158 2017 188 195 10.1016/j.ces.2016.10.007 Y.Y. Cao, Y.C. Shi, J.M. Liang, Y.L. Wu, S.B. Huang, J.L. Wang, M.D. Yang, H.S. Hu, High iso-alkanes production from palmitic acid over bi-functional Ni/H-ZSM-22 catalysts, Chem. Eng. Sci.158 (2017) 188-195. https://doi.org/10.1016/j.ces.2016.10.007. [22] Y.Y. Cao Y.C. Shi Y.F. Bi K.J. Wu S.J. Hu Y.L. Wu S.B. Huang Hydrodeoxygenation and hydroisomerization of palmitic acid over bi-functional Co/H-ZSM-22 catalysts Fuel. Process. Technol. 172 2018 29 35 10.1016/j.fuproc.2017.09.020 Y.Y. Cao, Y.C. Shi, Y.F. Bi, K.J. Wu, S.J. Hu, Y.L. Wu, S.B. Huang, Hydrodeoxygenation and hydroisomerization of palmitic acid over bi-functional Co/H-ZSM-22 catalysts, Fuel. Process. Technol.172 (2018) 29-35. https://doi.org/10.1016/j.fuproc.2017.09.020. [23] Y.C. Shi J.M. Zhang E.H. Xing Y.B. Xie H.B. Cao Selective production of jet-fuel range alkanes from palmitic acid over Ni/H-MCM-49 with two independent pore systems Ind. Eng. Chem. Res. 58 2019 21341 21349 10.1021/acs.iecr.9b04130 Y.C. Shi, J.M. Zhang, E.H. Xing, Y.B. Xie, H.B. Cao, Selective production of jet-fuel range alkanes from palmitic acid over Ni/H-MCM-49 with two independent pore systems, Ind. Eng. Chem. Res.58 (2019) 21341-21349. https://doi.org/10.1021/acs.iecr.9b04130. [24] Y.C. Shi R. Li Q.R. Shen M.D. Yang Y.L. Wu The selective production of jet fuel range alkanes via the catalytic upgrading of palmitic acid over Co/HMCM-49 catalysts Chem. Commun. 55 2019 12096 12099 10.1039/c9cc04503a Y.C. Shi, R. Li, Q.R. Shen, M.D. Yang, Y.L. Wu, The selective production of jet fuel range alkanes via the catalytic upgrading of palmitic acid over Co/HMCM-49 catalysts, Chem. Commun.55 (2019) 12096-12099. https://doi.org/10.1039/c9cc04503a. [25] Y.C. Shi E.H. Xing Y.Y. Cao M.J. Liu K.J. Wu M.D. Yang Y.L. Wu Tailoring product distribution during upgrading of palmitic acid over bi-functional metal/zeolite catalysts Chem. Eng. Sci. 166 2017 262 273 10.1016/j.ces.2017.03.052 Y.C. Shi, E.H. Xing, Y.Y. Cao, M.J. Liu, K.J. Wu, M.D. Yang, Y.L. Wu, Tailoring product distribution during upgrading of palmitic acid over bi-functional metal/zeolite catalysts, Chem. Eng. Sci.166 (2017) 262-273. https://doi.org/10.1016/j.ces.2017.03.052. [26] B. Ma H.M. Cui D.R. Wang P. Wu C. Zhao Controllable hydrothermal synthesis of Ni/H-BEA with a hierarchical core-shell structure and highly enhanced biomass hydrodeoxygenation performance Nanoscale 9 2017 5986 5995 10.1039/c7nr00471k B. Ma, H.M. Cui, D.R. Wang, P. Wu, C. Zhao, Controllable hydrothermal synthesis of Ni/H-BEA with a hierarchical core-shell structure and highly enhanced biomass hydrodeoxygenation performance, Nanoscale9 (2017) 5986-5995. https://doi.org/10.1039/c7nr00471k. [27] B. Ma C. Zhao High-grade diesel production by hydrodeoxygenation of palm oil over a hierarchically structured Ni/HBEA catalyst Green Chem. 17 2015 1692 1701 10.1039/c4gc02339k B. Ma, C. Zhao, High-grade diesel production by hydrodeoxygenation of palm oil over a hierarchically structured Ni/HBEA catalyst, Green Chem.. 17 (2015) 1692-1701. https://doi.org/10.1039/c4gc02339k. [28] N. Wang Q.M. Sun R.S. Bai X. Li G.Q. Guo J.H. Yu In situ confinement of ultrasmall Pd clusters within nanosized silicalite-1zeolite for highly efficient catalysis of hydrogen generation J. Am. Chem. Soc. 138 2016 7484 7487 10.1021/jacs.6b03518 N. Wang, Q.M. Sun, R.S. Bai, X. Li, G.Q. Guo, J.H. Yu, In situ confinement of ultrasmall Pd clusters within nanosized silicalite-1zeolite for highly efficient catalysis of hydrogen generation, J. Am. Chem. Soc.138 (2016) 7484-7487.https://doi.org/10.1021/jacs.6b03518. [29] J. Zhang L. Wang Y. Shao Y.Q. Wang B.C. Gates F.S. Xiao A Pd@Zeolite catalyst for nitroarene hydrogenation with high product selectivity by sterically controlled adsorption in the zeolite micropores Angew. Chem. Int. Ed. 56 2017 9747 9751 10.1002/anie.201703938 J. Zhang, L. Wang, Y. Shao, Y.Q. Wang, B.C. Gates, F.S. Xiao, A Pd@Zeolite catalyst for nitroarene hydrogenation with high product selectivity by sterically controlled adsorption in the zeolite micropores, Angew. Chem. Int. Ed.56 (2017) 9747-9751. https://doi.org/10.1002/anie.201703938. [30] J. Gu Z.Y. Zhang P. Hu L.P. Ding N.H. Xue L.M. Peng X.F. Guo M. Lin W.P. Ding Platinum nanoparticles encapsulated in MFI zeolite crystals by a two-step dry gel conversion method as a highly selective hydrogenation catalyst ACS Catal. 5 2015 6893 6901 10.1021/acscatal.5b01823 J. Gu, Z.Y. Zhang, P. Hu, L.P. Ding, N.H. Xue, L.M. Peng, X.F. Guo, M. Lin, W.P. Ding, Platinum nanoparticles encapsulated in MFI zeolite crystals by a two-step dry gel conversion method as a highly selective hydrogenation catalyst, ACS Catal.. 5 (2015) 6893-6901. https://doi.org/10.1021/acscatal.5b01823. [31] S.M. Wu X.Y. Yang C. Janiak Confinement effects in zeolite-confined noble metals Angew. Chem. 131 2019 12468 12482 10.1002/anie.201900013 S.M. Wu, X.Y. Yang, C. Janiak, Confinement effects in zeolite-confined noble metals, Angew. Chem.131 (2019) 12468-12482. https://doi.org/10.1002/anie.201900013. [32] L.C. Liu R. Arenal D.M. Meira A. Corma Generation of gold nanoclusters encapsulated in an MCM-22 zeolite for the aerobic oxidation of cyclohexane Chem. Commun. 55 2019 1607 1610 10.1039/c8cc07185c L.C. Liu, R. Arenal, D.M. Meira, A. Corma, Generation of gold nanoclusters encapsulated in an MCM-22 zeolite for the aerobic oxidation of cyclohexane, Chem. Commun.55 (2019) 1607-1610. https://doi.org/10.1039/c8cc07185c. [33] S.W. Li Tuel A D. Laprune F. Meunier D. Farrusseng Transition-metal nanoparticles in hollow zeolite single crystals as bifunctional and size-selective hydrogenation catalysts Chem. Mater. 27 2015 276 282 10.1021/cm503921f S.W. Li, A, Tuel, D. Laprune, F. Meunier, D. Farrusseng, Transition-metal nanoparticles in hollow zeolite single crystals as bifunctional and size-selective hydrogenation catalysts, Chem. Mater.27 (2015) 276-282. https://doi.org/10.1021/cm503921f. [34] Y.H. Tan J.A. Davis K. Fujikawa N.V. Ganesh A.V. Demchenka K.J. Stine Surface area and pore size characteristics of nanoporous gold subjected to thermal, mechanical, or surface modification studied using gas adsorption isotherms, cyclic voltammetry, thermogravimetric analysis, and scanning electron microscopy J. Mater. Chem. 22 2012 6733 6745 10.1039/c2jm16633j Y.H. Tan, J.A. Davis, K. Fujikawa, N.V. Ganesh, A.V. Demchenka, K.J. Stine, Surface area and pore size characteristics of nanoporous gold subjected to thermal, mechanical, or surface modification studied using gas adsorption isotherms, cyclic voltammetry, thermogravimetric analysis, and scanning electron microscopy, J. Mater. Chem.22 (2012) 6733-6745. https://doi.org/10.1039/c2jm16633j. [35] S. Mitchell N.L. Michels K. Kunze J. Perez-Ramirez Visualization of hierarchically structured zeolite bodies from macro to nano length scales Nat. Chm. 4 2012 825 831 10.1038/NCHEM.1403 S. Mitchell, N.L. Michels, K. Kunze, J. Perez-Ramirez, Visualization of hierarchically structured zeolite bodies from macro to nano length scales, Nat. Chm.4 (2012) 825-831. https://doi.org/10.1038/NCHEM.1403. [36] B. Valle B. Aramburu A. Remiro J. Bilbao A.G. Gayubo Effect of calcination/reduction conditions of Ni/La2O3-αAl2O3 catalyst on its activity and stability for hydrogen production by steam reforming of raw bio-oil/ethanol Appl. Catal. B: Environ. 147 2014 402 410 10.1016/j.apcatb.2013.09.022 B. Valle, B. Aramburu, A. Remiro, J. Bilbao, A.G. Gayubo, Effect of calcination/reduction conditions of Ni/La2O3-αAl2O3 catalyst on its activity and stability for hydrogen production by steam reforming of raw bio-oil/ethanol, Appl. Catal. B: Environ.147 (2014) 402-410. https://doi.org/10.1016/j.apcatb.2013.09.022. [37] A. Remiro A. Arandia L. Oar-Arteta J. Bilbao A.G. Gayubo Regeneration of NiAl2O4 spinel type catalysts used in the reforming of raw bio-oil Appl. Catal. B: Environ. 237 2018 353 365 10.1016/j.apcatb.2018.06.005 A. Remiro, A. Arandia, L. Oar-Arteta, J. Bilbao, A.G. Gayubo, Regeneration of NiAl2O4 spinel type catalysts used in the reforming of raw bio-oil, Appl. Catal. B: Environ.237 (2018) 353-365. https://doi.org/10.1016/j.apcatb.2018.06.005. [38] H. Xin H.R. Yang X.M. Lei X.Z. Du K.Y. Zhou D. Li C.W. Hu Ni-Fe catalysts supported on Al2O3/HZSM-5 for transformation of palmitic acid into hydrocarbon fuel Ind. Eng. Chem. Res. 2020 10.1021/acs.iecr.0c01937 H. Xin, H.R. Yang, X.M. Lei, X.Z. Du, K.Y. Zhou, D. Li, C.W. Hu, Ni-Fe catalysts supported on Al2O3/HZSM-5 for transformation of palmitic acid into hydrocarbon fuel, Ind. Eng. Chem. Res.2020. https://dx.doi.org/10.1021/acs.iecr.0c01937. [39] F.F. Yang D. Liu Y.T. Zhao H. Wang J.Y. Han Q.F. Ge Z.L. Zhu Size dependence of vapor phase hydrodeoxygenation of m-cresol on Ni/SiO2 catalysts ACS Catal. 8 2018 1672 1682 10.1021/acscatal.7b04097 F.F. Yang, D. Liu, Y.T. Zhao, H. Wang, J.Y. Han, Q.F. Ge, Z.L. Zhu, Size dependence of vapor phase hydrodeoxygenation of m-cresol on Ni/SiO2 catalysts, ACS Catal.. 8 (2018) 1672-1682. https://doi.org/10.1021/acscatal.7b04097. [40] Y.C. Shi E.H. Xing J.M. Zhang Y.B. Xie H. Zhao Y.X. Sheng H.B. Cao Temperature-dependent selectivity of hydrogenation/hydrogenolysis during phenol conversion over Ni catalysts ACS Sustainable Chem. Eng. 7 2019 9464 9473 10.1021/acssuschemeng.9b00703 Y.C. Shi, E.H. Xing, J.M. Zhang, Y.B. Xie, H. Zhao, Y.X. Sheng, H.B. Cao, Temperature-dependent selectivity of hydrogenation/hydrogenolysis during phenol conversion over Ni catalysts, ACS Sustainable Chem. Eng.7 (2019) 9464-9473. https://doi.org/10.1021/acssuschemeng.9b00703. [41] E.J. Shin M.A. Keane Gas-phase hydrogenation/hydrogenolysis of phenol over supported nickel catalysts Ind. Eng. Chem. Res. 39 2000 883 892 10.1021/ie990643r E.J. Shin, M.A. Keane, Gas-phase hydrogenation/hydrogenolysis of phenol over supported nickel catalysts, Ind. Eng. Chem. Res.39 (2000) 883-892. https://doi.org/10.1021/ie990643r. [42] C.D. Wagner W.M. Riggs L.E. Davis J.F. Moulder G.E. Muilenberg Handbook of X-Ray Photoelectron Spectroscopy 1979 80 C.D. Wagner, W.M. Riggs, L.E. Davis, J.F. Moulder, G.E. Muilenberg, Handbook of X-Ray Photoelectron Spectroscopy, 1979, pp. 80. [43] C.D. Wagner W.M. Riggs L.E. Davis J.F. Moulder G.E. Muilenberg Handbook of X-Ray Photoelectron Spectroscopy 1979 42 43 C.D. Wagner, W.M. Riggs, L.E. Davis, J.F. Moulder, G.E. Muilenberg, Handbook of X-Ray Photoelectron Spectroscopy, 1979, pp. 42-43 [44] Y. Okamoto M. Ogawa A. Maezawa T. Imanaka J. Catal. 112 1988 427 436 10.1016/0021-9517(88)90157-1 Y. Okamoto, M. Ogawa, A. Maezawa, T. Imanaka, J. Catal.112 (1988) 427-436.https://doi.org/10.1016/0021-9517(88)90157-1. [45] M. Zahmakiran T. Ayvali S. Akbayrak S. Caliskan D. Celik S. Ozkar Zeolite framework stabilized nickel (0) nanoparticles: active and long-lived catalyst for hydrogen generation from the hydrolysis of ammonia-borane and sodium borohydride Catal. Today 170 2011 76 84 10.1016/j.cattod.2010.09.022 M. Zahmakiran, T. Ayvali, S. Akbayrak, S. Caliskan, D. Celik, S. Ozkar, Zeolite framework stabilized nickel (0) nanoparticles: active and long-lived catalyst for hydrogen generation from the hydrolysis of ammonia-borane and sodium borohydride, Catal. Today170 (2011) 76-84. https://doi.org/10.1016/j.cattod.2010.09.022. [46] Y.J. Wu X.W. Xu Y. Sun E.C. Jiang X.D. Fan R. Tu J.M. Wang Gas-phase hydrodeoxygenation of guaiacol over Ni-based HUSY zeolite catalysts under atmospheric H2 pressure Renew. Energy 152 2020 1380 1390 10.1016/j.renene.2020.01.117 Y.J. Wu, X.W. Xu, Y. Sun, E.C. Jiang, X.D. Fan, R. Tu, J.M. Wang, Gas-phase hydrodeoxygenation of guaiacol over Ni-based HUSY zeolite catalysts under atmospheric H2 pressure, Renew. Energy152 (2020) 1380-1390. https://doi.org/10.1016/j.renene.2020.01.117. [47] A. Mekki A. Mokhtar M. Hachemaoui M. Beldjilali M.F. Meliani H.H. Zahmani S. Hacini B. Boukoussa Fe and Ni nanoparticles-loaded zeolites as effective catalysts for catalytic reduction of organic pollutants Micropor. Mesopor. Mater. 310 2021 110597 10.1016/j.micromeso.2020.110597 A. Mekki, A. Mokhtar, M. Hachemaoui, M. Beldjilali, M.F. Meliani, H.H. Zahmani, S. Hacini, B. Boukoussa, Fe and Ni nanoparticles-loaded zeolites as effective catalysts for catalytic reduction of organic pollutants, Micropor. Mesopor. Mater.310 (2021) 110597. https://doi.org/10.1016/j.micromeso.2020.110597. [48] A. Fukuoko N. Higashimoto Y. Sakamoto S. Inagaki Y. Fukushima M. Ichikawa Preparation, XAFS characterization, and catalysis of platinum nanowires and nanoparticles in mesoporous silica FSM-16 Top. Catal. 18 2002 73 78 10.1023/A:1013886301858 A. Fukuoko, N. Higashimoto, Y. Sakamoto, S. Inagaki, Y. Fukushima, M. Ichikawa, Preparation, XAFS characterization, and catalysis of platinum nanowires and nanoparticles in mesoporous silica FSM-16, Top. Catal.18 (2002) 73-78. https://doi.org/10.1023/A:1013886301858. [49] Y.C. Shi Y.Y. Cao Y.N. Duan H. Chen Y. Chen M.D. Yang Y.L. Wu Upgrading of palmitic acid to iso-alkanes over bi-functional Mo/H-ZSM-22 catalysts Green Chem. 18 2016 4633 4648 10.1039/c6gc01367h Y.C. Shi, Y.Y. Cao, Y.N. Duan, H. Chen, Y. Chen, M.D. Yang, Y.L. Wu, Upgrading of palmitic acid to iso-alkanes over bi-functional Mo/H-ZSM-22 catalysts, Green Chem.. 18 (2016) 4633-4648. https://doi.org/10.1039/c6gc01367h. [50] C. Zhao S. Kasakov J. He J.A. Lercher Comparison of kinetics, activity and stability of Ni/HZSM-5 and Ni/Al2O3-HZSM-5 for phenol hydrodeoxygenation J. Catal. 296 2012 12 23 10.1016/j.jcat.2012.08.017 C. Zhao, S. Kasakov, J. He, J.A. Lercher, Comparison of kinetics, activity and stability of Ni/HZSM-5 and Ni/Al2O3-HZSM-5 for phenol hydrodeoxygenation, J. Catal.296 (2012) 12-23. https://doi.org/10.1016/j.jcat.2012.08.017. [51] S.M. Wu X.Y. Yang C. Janiak Confinement effects in zeolite-confined noble metals Angew. Chem. 131 2019 12468 12482 10.1002/anie.201900013 S. M. Wu, X.Y. Yang, C. Janiak, Confinement effects in zeolite-confined noble metals, Angew. Chem.131 (2019) 12468-12482. https://doi.org/10.1002/anie.201900013. [52] K.M. Kwok S.W.D. Ong L. Chen H.C. Zeng Transformation of stober silica spheres to hollow hierarchical single-crystals ZSM-5 zeolites with encapsulated metal nanocatalysts for selective catalysis ACS Appl. Mater. Interfaces 11 2019 14774 14785 https://doi.org/10.1021/acsami.9b00630. 10.1021/acsami.9b00630 K.M. Kwok, S.W.D. Ong, L. Chen, H.C. Zeng, Transformation of stober silica spheres to hollow hierarchical single-crystals ZSM-5 zeolites with encapsulated metal nanocatalysts for selective catalysis, ACS Appl. Mater. Interfaces11 (2019) 14774-14785. https://doi.org/10.1021/acsami.9b00630. 10.1021/acsami.9b00630. [53] Y.C. Chai W.X. Shang W.J. Li G.J. Wu W.L. Dai N.J. Guan L.D. Li Noble metal particles confined in zeolites: synthesis, characterization, and applications Adv. Sci. 6 2019 1 19 10.1002/advs.201900299 1900299 Y.C. Chai, W.X. Shang, W.J. Li, G.J. Wu, W.L. Dai, N.J. Guan, L.D. Li, Noble metal particles confined in zeolites: synthesis, characterization, and applications, Adv. Sci.6 (2019) 1900299, 1-19. https://doi.org/10.1002/advs.201900299. [54] C.T. Wang Z.Q. Liu L. Wang X. Dong J. Zhang G.X. Wang S.C. Han X.J. Meng A.M. Zheng F.S. Xiao Importance of zeolite wettability for selective hydrogenation of furfural over Pd@zeolite catalysts ACS Catal. 8 2018 474 481 10.1021/acscatal.7b03443 C.T. Wang, Z.Q. Liu, L. Wang, X. Dong, J. Zhang, G.X. Wang, S.C. Han, X.J. Meng, A.M. Zheng, F.S. Xiao, Importance of zeolite wettability for selective hydrogenation of furfural over Pd@zeolite catalysts, ACS Catal.. 8 (2018) 474-481. https://doi.org/10.1021/acscatal.7b03443.",
      "scopus-id": "85111346673",
      "coredata": {
        "eid": "1-s2.0-S2468823121003321",
        "dc:description": "Ni@HZSM-5 bi-functional catalysts were successfully synthesized through the in situ encapsulation method to form 2-5 nm Ni nanoparticles within HZSM-5 crystals, which was applied in evaluating the hydrodeoxygenation performance of palmitic acid to diesel-like range fuels. As for Ni@HZSM-5, there was the certain interaction between Ni and Al, which further influenced the hydrogenation activity and acidity of catalysts. Complete deoxygenation of palmitic acid and 100% selectivity of alkanes were achieved over Ni@HZSM-5 bi-functional catalysts, and the corresponding main products were C15 and C16 alkanes. Importantly, Ni@HZSM-5 (2.4 wt% Ni) exhibited the high conversion activity of 16.4 mol(palmitic acid) •mol(Ni) −1 • h−1, which were attributed to 2-5 nm Ni nanoparticles uniformly dispersed within HZSM-5 crystals. Ni@HZSM-5 further exhibited the well catalytic stability during the process of regeneration and recycle runs without obvious change of Ni sizes and dispersion, which was totally different from impregnated Ni/HZSM-5 catalysts with the aggregation of Ni particles. The favorable performance of Ni@HZSM-5 was ascribed to small Ni nanoparticles within HZSM-5 crystals without any obvious aggregation, which would offer a novel strategy for synthesizing low metal@zeolite bi-functional catalysts with high activity and stability in upgrading of bio-mass oils.",
        "openArchiveArticle": "false",
        "prism:coverDate": "2021-07-31",
        "openaccessUserLicense": null,
        "prism:aggregationType": "Journal",
        "prism:url": "https://api.elsevier.com/content/article/pii/S2468823121003321",
        "dc:creator": [
          {
            "@_fa": "true",
            "$": "Gao, Chen"
          },
          {
            "@_fa": "true",
            "$": "Zhang, Jimei"
          },
          {
            "@_fa": "true",
            "$": "Xing, Enhui"
          },
          {
            "@_fa": "true",
            "$": "Xie, Yongbing"
          },
          {
            "@_fa": "true",
            "$": "Zhao, He"
          },
          {
            "@_fa": "true",
            "$": "Ning, Pengge"
          },
          {
            "@_fa": "true",
            "$": "Shi, Yanchun"
          }
        ],
        "link": [
          {
            "@_fa": "true",
            "@rel": "self",
            "@href": "https://api.elsevier.com/content/article/pii/S2468823121003321"
          },
          {
            "@_fa": "true",
            "@rel": "scidir",
            "@href": "https://www.sciencedirect.com/science/article/pii/S2468823121003321"
          }
        ],
        "dc:format": "application/json",
        "openaccessType": null,
        "pii": "S2468-8231(21)00332-1",
        "prism:volume": "511",
        "articleNumber": "111715",
        "prism:publisher": "Elsevier B.V.",
        "dc:title": "Upgrading of palmitic acid to diesel-like fuels over Ni@HZSM-5 bi-functional catalysts through the in situ encapsulation method",
        "prism:copyright": "© 2021 Elsevier B.V. All rights reserved.",
        "openaccess": "0",
        "prism:issn": "24688231",
        "dcterms:subject": [
          {
            "@_fa": "true",
            "$": "Palmitic acid"
          },
          {
            "@_fa": "true",
            "$": "Ni@HZSM-5"
          },
          {
            "@_fa": "true",
            "$": "Diesel-like fuels"
          },
          {
            "@_fa": "true",
            "$": "Encapsulation"
          },
          {
            "@_fa": "true",
            "$": "Low Ni content"
          }
        ],
        "openaccessArticle": "false",
        "prism:publicationName": "Molecular Catalysis",
        "openaccessSponsorType": null,
        "prism:pageRange": "111715",
        "pubType": "fla",
        "prism:coverDisplayDate": "July 2021",
        "prism:doi": "10.1016/j.mcat.2021.111715",
        "prism:startingPage": "111715",
        "dc:identifier": "doi:10.1016/j.mcat.2021.111715",
        "openaccessSponsorName": null
      },
      "objects": {
        "object": [
          {
            "@category": "standard",
            "@height": "479",
            "@width": "565",
            "@_fa": "true",
            "$": "https://api.elsevier.com/content/object/eid/1-s2.0-S2468823121003321-gr3.jpg?httpAccept=%2A%2F%2A",
            "@multimediatype": "JPEG image file",
            "@type": "IMAGE-DOWNSAMPLED",
            "@size": "76101",
            "@ref": "gr3",
            "@mimetype": "image/jpeg"
          },
          {
            "@category": "standard",
            "@height": "773",
            "@width": "565",
            "@_fa": "true",
            "$": "https://api.elsevier.com/content/object/eid/1-s2.0-S2468823121003321-gr2.jpg?httpAccept=%2A%2F%2A",
            "@multimediatype": "JPEG image file",
            "@type": "IMAGE-DOWNSAMPLED",
            "@size": "114996",
            "@ref": "gr2",
            "@mimetype": "image/jpeg"
          },
          {
            "@category": "standard",
            "@height": "110",
            "@width": "301",
            "@_fa": "true",
            "$": "https://api.elsevier.com/content/object/eid/1-s2.0-S2468823121003321-ga1.jpg?httpAccept=%2A%2F%2A",
            "@multimediatype": "JPEG image file",
            "@type": "IMAGE-DOWNSAMPLED",
            "@size": "18276",
            "@ref": "ga1",
            "@mimetype": "image/jpeg"
          },
          {
            "@category": "standard",
            "@height": "429",
            "@width": "565",
            "@_fa": "true",
            "$": "https://api.elsevier.com/content/object/eid/1-s2.0-S2468823121003321-gr1.jpg?httpAccept=%2A%2F%2A",
            "@multimediatype": "JPEG image file",
            "@type": "IMAGE-DOWNSAMPLED",
            "@size": "69329",
            "@ref": "gr1",
            "@mimetype": "image/jpeg"
          },
          {
            "@category": "standard",
            "@height": "289",
            "@width": "715",
            "@_fa": "true",
            "$": "https://api.elsevier.com/content/object/eid/1-s2.0-S2468823121003321-gr7.jpg?httpAccept=%2A%2F%2A",
            "@multimediatype": "JPEG image file",
            "@type": "IMAGE-DOWNSAMPLED",
            "@size": "64051",
            "@ref": "gr7",
            "@mimetype": "image/jpeg"
          },
          {
            "@category": "standard",
            "@height": "485",
            "@width": "565",
            "@_fa": "true",
            "$": "https://api.elsevier.com/content/object/eid/1-s2.0-S2468823121003321-gr6.jpg?httpAccept=%2A%2F%2A",
            "@multimediatype": "JPEG image file",
            "@type": "IMAGE-DOWNSAMPLED",
            "@size": "80154",
            "@ref": "gr6",
            "@mimetype": "image/jpeg"
          },
          {
            "@category": "standard",
            "@height": "491",
            "@width": "565",
            "@_fa": "true",
            "$": "https://api.elsevier.com/content/object/eid/1-s2.0-S2468823121003321-gr5.jpg?httpAccept=%2A%2F%2A",
            "@multimediatype": "JPEG image file",
            "@type": "IMAGE-DOWNSAMPLED",
            "@size": "71112",
            "@ref": "gr5",
            "@mimetype": "image/jpeg"
          },
          {
            "@category": "standard",
            "@height": "670",
            "@width": "565",
            "@_fa": "true",
            "$": "https://api.elsevier.com/content/object/eid/1-s2.0-S2468823121003321-gr4.jpg?httpAccept=%2A%2F%2A",
            "@multimediatype": "JPEG image file",
            "@type": "IMAGE-DOWNSAMPLED",
            "@size": "99788",
            "@ref": "gr4",
            "@mimetype": "image/jpeg"
          },
          {
            "@category": "standard",
            "@height": "444",
            "@width": "565",
            "@_fa": "true",
            "$": "https://api.elsevier.com/content/object/eid/1-s2.0-S2468823121003321-gr9.jpg?httpAccept=%2A%2F%2A",
            "@multimediatype": "JPEG image file",
            "@type": "IMAGE-DOWNSAMPLED",
            "@size": "57973",
            "@ref": "gr9",
            "@mimetype": "image/jpeg"
          },
          {
            "@category": "standard",
            "@height": "228",
            "@width": "565",
            "@_fa": "true",
            "$": "https://api.elsevier.com/content/object/eid/1-s2.0-S2468823121003321-gr8.jpg?httpAccept=%2A%2F%2A",
            "@multimediatype": "JPEG image file",
            "@type": "IMAGE-DOWNSAMPLED",
            "@size": "28225",
            "@ref": "gr8",
            "@mimetype": "image/jpeg"
          },
          {
            "@category": "thumbnail",
            "@height": "164",
            "@width": "193",
            "@_fa": "true",
            "$": "https://api.elsevier.com/content/object/eid/1-s2.0-S2468823121003321-gr3.sml?httpAccept=%2A%2F%2A",
            "@multimediatype": "GIF image file",
            "@type": "IMAGE-THUMBNAIL",
            "@size": "16549",
            "@ref": "gr3",
            "@mimetype": "image/gif"
          },
          {
            "@category": "thumbnail",
            "@height": "164",
            "@width": "120",
            "@_fa": "true",
            "$": "https://api.elsevier.com/content/object/eid/1-s2.0-S2468823121003321-gr2.sml?httpAccept=%2A%2F%2A",
            "@multimediatype": "GIF image file",
            "@type": "IMAGE-THUMBNAIL",
            "@size": "12446",
            "@ref": "gr2",
            "@mimetype": "image/gif"
          },
          {
            "@category": "thumbnail",
            "@height": "80",
            "@width": "219",
            "@_fa": "true",
            "$": "https://api.elsevier.com/content/object/eid/1-s2.0-S2468823121003321-ga1.sml?httpAccept=%2A%2F%2A",
            "@multimediatype": "GIF image file",
            "@type": "IMAGE-THUMBNAIL",
            "@size": "12711",
            "@ref": "ga1",
            "@mimetype": "image/gif"
          },
          {
            "@category": "thumbnail",
            "@height": "164",
            "@width": "216",
            "@_fa": "true",
            "$": "https://api.elsevier.com/content/object/eid/1-s2.0-S2468823121003321-gr1.sml?httpAccept=%2A%2F%2A",
            "@multimediatype": "GIF image file",
            "@type": "IMAGE-THUMBNAIL",
            "@size": "11422",
            "@ref": "gr1",
            "@mimetype": "image/gif"
          },
          {
            "@category": "thumbnail",
            "@height": "89",
            "@width": "219",
            "@_fa": "true",
            "$": "https://api.elsevier.com/content/object/eid/1-s2.0-S2468823121003321-gr7.sml?httpAccept=%2A%2F%2A",
            "@multimediatype": "GIF image file",
            "@type": "IMAGE-THUMBNAIL",
            "@size": "9965",
            "@ref": "gr7",
            "@mimetype": "image/gif"
          },
          {
            "@category": "thumbnail",
            "@height": "164",
            "@width": "191",
            "@_fa": "true",
            "$": "https://api.elsevier.com/content/object/eid/1-s2.0-S2468823121003321-gr6.sml?httpAccept=%2A%2F%2A",
            "@multimediatype": "GIF image file",
            "@type": "IMAGE-THUMBNAIL",
            "@size": "12179",
            "@ref": "gr6",
            "@mimetype": "image/gif"
          },
          {
            "@category": "thumbnail",
            "@height": "164",
            "@width": "189",
            "@_fa": "true",
            "$": "https://api.elsevier.com/content/object/eid/1-s2.0-S2468823121003321-gr5.sml?httpAccept=%2A%2F%2A",
            "@multimediatype": "GIF image file",
            "@type": "IMAGE-THUMBNAIL",
            "@size": "11348",
            "@ref": "gr5",
            "@mimetype": "image/gif"
          },
          {
            "@category": "thumbnail",
            "@height": "164",
            "@width": "138",
            "@_fa": "true",
            "$": "https://api.elsevier.com/content/object/eid/1-s2.0-S2468823121003321-gr4.sml?httpAccept=%2A%2F%2A",
            "@multimediatype": "GIF image file",
            "@type": "IMAGE-THUMBNAIL",
            "@size": "10431",
            "@ref": "gr4",
            "@mimetype": "image/gif"
          },
          {
            "@category": "thumbnail",
            "@height": "164",
            "@width": "208",
            "@_fa": "true",
            "$": "https://api.elsevier.com/content/object/eid/1-s2.0-S2468823121003321-gr9.sml?httpAccept=%2A%2F%2A",
            "@multimediatype": "GIF image file",
            "@type": "IMAGE-THUMBNAIL",
            "@size": "12220",
            "@ref": "gr9",
            "@mimetype": "image/gif"
          },
          {
            "@category": "thumbnail",
            "@height": "88",
            "@width": "219",
            "@_fa": "true",
            "$": "https://api.elsevier.com/content/object/eid/1-s2.0-S2468823121003321-gr8.sml?httpAccept=%2A%2F%2A",
            "@multimediatype": "GIF image file",
            "@type": "IMAGE-THUMBNAIL",
            "@size": "6744",
            "@ref": "gr8",
            "@mimetype": "image/gif"
          },
          {
            "@category": "high",
            "@height": "2119",
            "@width": "2500",
            "@_fa": "true",
            "$": "https://api.elsevier.com/content/object/eid/1-s2.0-S2468823121003321-gr3_lrg.jpg?httpAccept=%2A%2F%2A",
            "@multimediatype": "JPEG image file",
            "@type": "IMAGE-HIGH-RES",
            "@size": "562081",
            "@ref": "gr3",
            "@mimetype": "image/jpeg"
          },
          {
            "@category": "high",
            "@height": "3419",
            "@width": "2500",
            "@_fa": "true",
            "$": "https://api.elsevier.com/content/object/eid/1-s2.0-S2468823121003321-gr2_lrg.jpg?httpAccept=%2A%2F%2A",
            "@multimediatype": "JPEG image file",
            "@type": "IMAGE-HIGH-RES",
            "@size": "1162104",
            "@ref": "gr2",
            "@mimetype": "image/jpeg"
          },
          {
            "@category": "high",
            "@height": "486",
            "@width": "1333",
            "@_fa": "true",
            "$": "https://api.elsevier.com/content/object/eid/1-s2.0-S2468823121003321-ga1_lrg.jpg?httpAccept=%2A%2F%2A",
            "@multimediatype": "JPEG image file",
            "@type": "IMAGE-HIGH-RES",
            "@size": "160269",
            "@ref": "ga1",
            "@mimetype": "image/jpeg"
          },
          {
            "@category": "high",
            "@height": "1900",
            "@width": "2500",
            "@_fa": "true",
            "$": "https://api.elsevier.com/content/object/eid/1-s2.0-S2468823121003321-gr1_lrg.jpg?httpAccept=%2A%2F%2A",
            "@multimediatype": "JPEG image file",
            "@type": "IMAGE-HIGH-RES",
            "@size": "543834",
            "@ref": "gr1",
            "@mimetype": "image/jpeg"
          },
          {
            "@category": "high",
            "@height": "1282",
            "@width": "3167",
            "@_fa": "true",
            "$": "https://api.elsevier.com/content/object/eid/1-s2.0-S2468823121003321-gr7_lrg.jpg?httpAccept=%2A%2F%2A",
            "@multimediatype": "JPEG image file",
            "@type": "IMAGE-HIGH-RES",
            "@size": "540969",
            "@ref": "gr7",
            "@mimetype": "image/jpeg"
          },
          {
            "@category": "high",
            "@height": "2148",
            "@width": "2500",
            "@_fa": "true",
            "$": "https://api.elsevier.com/content/object/eid/1-s2.0-S2468823121003321-gr6_lrg.jpg?httpAccept=%2A%2F%2A",
            "@multimediatype": "JPEG image file",
            "@type": "IMAGE-HIGH-RES",
            "@size": "672308",
            "@ref": "gr6",
            "@mimetype": "image/jpeg"
          },
          {
            "@category": "high",
            "@height": "2171",
            "@width": "2500",
            "@_fa": "true",
            "$": "https://api.elsevier.com/content/object/eid/1-s2.0-S2468823121003321-gr5_lrg.jpg?httpAccept=%2A%2F%2A",
            "@multimediatype": "JPEG image file",
            "@type": "IMAGE-HIGH-RES",
            "@size": "627346",
            "@ref": "gr5",
            "@mimetype": "image/jpeg"
          },
          {
            "@category": "high",
            "@height": "2964",
            "@width": "2500",
            "@_fa": "true",
            "$": "https://api.elsevier.com/content/object/eid/1-s2.0-S2468823121003321-gr4_lrg.jpg?httpAccept=%2A%2F%2A",
            "@multimediatype": "JPEG image file",
            "@type": "IMAGE-HIGH-RES",
            "@size": "808971",
            "@ref": "gr4",
            "@mimetype": "image/jpeg"
          },
          {
            "@category": "high",
            "@height": "1966",
            "@width": "2500",
            "@_fa": "true",
            "$": "https://api.elsevier.com/content/object/eid/1-s2.0-S2468823121003321-gr9_lrg.jpg?httpAccept=%2A%2F%2A",
            "@multimediatype": "JPEG image file",
            "@type": "IMAGE-HIGH-RES",
            "@size": "783642",
            "@ref": "gr9",
            "@mimetype": "image/jpeg"
          },
          {
            "@category": "high",
            "@height": "1008",
            "@width": "2500",
            "@_fa": "true",
            "$": "https://api.elsevier.com/content/object/eid/1-s2.0-S2468823121003321-gr8_lrg.jpg?httpAccept=%2A%2F%2A",
            "@multimediatype": "JPEG image file",
            "@type": "IMAGE-HIGH-RES",
            "@size": "215001",
            "@ref": "gr8",
            "@mimetype": "image/jpeg"
          },
          {
            "@category": "standard",
            "@_fa": "true",
            "$": "https://api.elsevier.com/content/object/eid/1-s2.0-S2468823121003321-mmc1.docx?httpAccept=%2A%2F%2A",
            "@multimediatype": "Microsoft Word file",
            "@type": "APPLICATION",
            "@size": "501441",
            "@ref": "mmc1",
            "@mimetype": "application/word"
          },
          {
            "@category": "thumbnail",
            "@_fa": "true",
            "$": "https://api.elsevier.com/content/object/eid/1-s2.0-S2468823121003321-si1.svg?httpAccept=%2A%2F%2A",
            "@multimediatype": "Scalable Vector Graphics file",
            "@type": "ALTIMG",
            "@size": "22902",
            "@ref": "si1",
            "@mimetype": "image/svg+xml"
          },
          {
            "@category": "thumbnail",
            "@_fa": "true",
            "$": "https://api.elsevier.com/content/object/eid/1-s2.0-S2468823121003321-si2.svg?httpAccept=%2A%2F%2A",
            "@multimediatype": "Scalable Vector Graphics file",
            "@type": "ALTIMG",
            "@size": "21726",
            "@ref": "si2",
            "@mimetype": "image/svg+xml"
          },
          {
            "@category": "thumbnail",
            "@_fa": "true",
            "$": "https://api.elsevier.com/content/object/eid/1-s2.0-S2468823121003321-si3.svg?httpAccept=%2A%2F%2A",
            "@multimediatype": "Scalable Vector Graphics file",
            "@type": "ALTIMG",
            "@size": "19492",
            "@ref": "si3",
            "@mimetype": "image/svg+xml"
          },
          {
            "@category": "thumbnail",
            "@_fa": "true",
            "$": "https://api.elsevier.com/content/object/eid/1-s2.0-S2468823121003321-si4.svg?httpAccept=%2A%2F%2A",
            "@multimediatype": "Scalable Vector Graphics file",
            "@type": "ALTIMG",
            "@size": "24576",
            "@ref": "si4",
            "@mimetype": "image/svg+xml"
          },
          {
            "@category": "standard",
            "@_fa": "true",
            "$": "https://api.elsevier.com/content/object/eid/1-s2.0-S2468823121003321-am.pdf?httpAccept=%2A%2F%2A",
            "@multimediatype": "Acrobat PDF file",
            "@type": "AAM-PDF",
            "@size": "2472896",
            "@ref": "am",
            "@mimetype": "application/pdf"
          }
        ]
      },
      "link": {
        "@rel": "abstract",
        "@href": "https://api.elsevier.com/content/abstract/scopus_id/85111346673"
      }
    }
  }
}