{
  "metadata": {
    "title": "In-situ transfer hydrogenolysis of lignin into phenolic monomers over Ni<ce:inf loc=post>0.5</ce:inf>Co<ce:inf loc=post>1.5</ce:inf>Al catalyst",
    "authors": "; ; ",
    "journal": "Molecular Catalysis",
    "date": "2024-02-15",
    "doi": "10.1016/j.mcat.2024.113853",
    "abstract": "",
    "uri": "https://api.elsevier.com/content/article/pii/S2468823124000361",
    "pii": "S2468823124000361"
  },
  "fulltext": {
    "full-text-retrieval-response": {
      "scopus-eid": "2-s2.0-85183878478",
      "originalText": "serial JL 315758 291210 291744 291790 291809 31 Molecular Catalysis MOLECULARCATALYSIS 2024-01-29 2024-01-29 2024-01-29 2024-01-29 2024-02-10T11:58:48 1-s2.0-S2468823124000361 S2468-8231(24)00036-1 S2468823124000361 10.1016/j.mcat.2024.113853 S300 S300.1 FULL-TEXT 1-s2.0-S2468823123X00212 2024-03-06T05:22:30.394592Z 0 0 20240215 2024 2024-01-29T17:26:05.144228Z absattachment articleinfo articlenumber articletitlenorm authfirstinitialnorm authfirstsurnamenorm cid cids contenttype copyright crossmark dateloaded dateloadedtxt datesearch datesort dateupdated dco docsubtype doctype doi eid ewtransactionid hubeid indexeddate issn issnnorm itemstage itemtransactionid itemweight openaccess openarchive pg pgfirst pii piinorm pubdatestart pubdatetxt pubyr sectiontitle sortorder srctitle srctitlenorm srctype ssids alllist content subj subheadings suppl tomb volfirst volissue volumelist webpdf webpdfpagecount yearnav figure table e-component body mmlmath acknowledge affil appendices articletitle auth authfirstini authfull authkeywords authlast grantnumber grantsponsor grantsponsorid highlightsabst orcid primabst ref specialabst 2468-8231 24688231 true 555 555 C Volume 555 14 113853 113853 113853 20240215 15 February 2024 2024-02-15 2024 Regular Papers article fla © 2024 Elsevier B.V. All rights reserved. INSITUTRANSFERHYDROGENOLYSISLIGNINPHENOLICMONOMERSOVERNI05CO15ALCATALYST FU Z 1 Introduction 2 Materials and methods 2.1 Materials 2.2 Extraction of lignin from birch wood 2.2.1 Separation of organic solvents lignin in birch (OL) 2.2.2 Separation of acidic solvents lignin in birch (AL) 2.3 CTH of lignin and BW 2.4 Product analysis 3 Results and discussion 3.1 Catalytic hydrogenolysis of DL 3.2 Characterization of products 3.2.1 GPC analysis 3.2.2 2D HSQC NMR analysis 3.2.3 FTIR analysis 3.2.4 Orbitrap-MS analysis 3.3 CTH of lignin model compounds in deuterated isopropanol 3.4 Catalytic hydrogenolysis of Various lignin and BW 3.5 Lignin CTH mechanism 4 Conclusions CRediT authorship contribution statement Acknowledgements Appendix Supplementary materials References GAO 2013 118570 Y ATABANI 2012 2070 2093 A ZHU 2016 132 138 G PONNUSAMY 2019 462 472 V LI 2023 113551 X RINALDI 2016 8296 8354 R WONG 2020 551 556 S ZHANG 2021 111438 M LUO 2022 1 7 Z XIAO 2017 7535 7542 L WANG 2023 3800 3812 D WANG 2017 1824 1830 H SHAO 2017 16104 Y YANGSEE 2021 1586 1594 J HU 2019 228 233 J ZHOU 2023 126357 L ZENG 2021 106713 Z SHEN 2021 111832 C LUO 2016 5845 5858 Z WANG 2020 814 8168 X KUMAR 2023 113474 M ZHANG 2022 6619 6630 H JEONG 2017 140 146 S LUO 2018 1 6 L HUA 2019 5073 5079 M WANG 2022 125027 H PAONE 2016 7937 7941 E ZENG 2023 10701 10710 Q FU 2023 113334 Z LI 2019 5828 5836 T LUO 2018 745 753 H XU 2012 667 675 W DICK 2022 1285 1293 G N 2007 121 133 T RIZZI 1992 1666 1670 G CHEN 2022 1 12 L ZHU 2021 111765 Y SHU 2016 568 575 R TOTONG 2020 106248 S LIU 2020 111164 X SHU 2018 457 464 R DONG 2023 126206 C SMITH 2012 3796 3802 E LIU 2012 4532 4539 Y YAN 2020 125548 H MA 2014 7310 7315 R SONG 2013 994 Q CHENG 2021 124238 C CHENG 2019 1023 1030 C SHU 2016 14 22 R RENDERS 2018 4607 4619 T ABUOMAR 2021 262 292 M FUX2024X113853 FUX2024X113853XZ 2026-01-29T00:00:00.000Z 2026-01-29T00:00:00.000Z http://creativecommons.org/licenses/by-nc-nd/4.0/ © 2024 Elsevier B.V. All rights reserved. 2024-02-06T05:23:10.179Z http://vtw.elsevier.com/data/voc/AddOnTypes/50.7/aggregated-refined Priority Academic Program Development of Jiangsu Higher Education Institutions PAPD Priority Academic Program Development of Jiangsu Higher Education Institutions http://data.elsevier.com/vocabulary/SciValFunders/501100012246 http://sws.geonames.org/1814991/ Natural Science Foundation of Xinjiang, China Natural Science Foundation of Xinjiang http://data.elsevier.com/vocabulary/SciValFunders/501100015310 http://sws.geonames.org/1814991/ 2022D01C373 Xinjiang Uygur Autonomous Region Natural Science Foundation http://data.elsevier.com/vocabulary/SciValFunders/100009110 http://sws.geonames.org/1814991 National Natural Science Foundation of China 22178373 22378415 NSFC National Natural Science Foundation of China http://data.elsevier.com/vocabulary/SciValFunders/501100001809 http://sws.geonames.org/1814991/ This work was supported by the National Natural Science Foundation of China (Grant 22178373 , 22378415 ), Natural Science Foundation of Xinjiang, China (No. 2022D01C373 ) and Priority Academic Program Development of Jiangsu Higher Education Institutions . https://doi.org/10.15223/policy-017 https://doi.org/10.15223/policy-037 https://doi.org/10.15223/policy-012 https://doi.org/10.15223/policy-029 https://doi.org/10.15223/policy-004 item S2468-8231(24)00036-1 S2468823124000361 1-s2.0-S2468823124000361 10.1016/j.mcat.2024.113853 315758 2024-03-06T05:22:30.394592Z 2024-02-15 1-s2.0-S2468823124000361-main.pdf https://s3-eu-west-1.amazonaws.com/prod-ucs-content-store-eu-west/content/pii:S2468823124000361/MAIN/application/pdf/6aadcdc1ffb047a8cc6ce6026b6245d9/main.pdf main.pdf pdf true 5278917 MAIN 11 1-s2.0-S2468823124000361-main_1.png https://s3-eu-west-1.amazonaws.com/prod-ucs-content-store-eu-west/content/pii:S2468823124000361/PREVIEW/image/png/d1c13e274184c14044a0451335536cb9/main_1.png main_1.png png 59260 849 656 IMAGE-WEB-PDF 1 1-s2.0-S2468823124000361-ga1.jpg https://s3-eu-west-1.amazonaws.com/prod-ucs-content-store-eu-west/content/pii:S2468823124000361/ga1/DOWNSAMPLED/image/jpeg/98f44da685bceae976e6d36497d37f55/ga1.jpg ga1 true ga1.jpg jpg 29959 200 328 IMAGE-DOWNSAMPLED 1-s2.0-S2468823124000361-gr6.jpg https://s3-eu-west-1.amazonaws.com/prod-ucs-content-store-eu-west/content/pii:S2468823124000361/gr6/DOWNSAMPLED/image/jpeg/1d52f15bb0197ef8d073fcc9e71ddb2d/gr6.jpg gr6 gr6.jpg jpg 122266 620 715 IMAGE-DOWNSAMPLED 1-s2.0-S2468823124000361-gr2.jpg https://s3-eu-west-1.amazonaws.com/prod-ucs-content-store-eu-west/content/pii:S2468823124000361/gr2/DOWNSAMPLED/image/jpeg/ea2f1cf40934eadcf2d18838f1d7b7b7/gr2.jpg gr2 gr2.jpg jpg 46083 242 715 IMAGE-DOWNSAMPLED 1-s2.0-S2468823124000361-gr3.jpg https://s3-eu-west-1.amazonaws.com/prod-ucs-content-store-eu-west/content/pii:S2468823124000361/gr3/DOWNSAMPLED/image/jpeg/b544eeb6d2bed7417638feef16aa90d4/gr3.jpg gr3 gr3.jpg jpg 50849 393 715 IMAGE-DOWNSAMPLED 1-s2.0-S2468823124000361-gr4.jpg https://s3-eu-west-1.amazonaws.com/prod-ucs-content-store-eu-west/content/pii:S2468823124000361/gr4/DOWNSAMPLED/image/jpeg/d8658b6f69c056c71b274f6860436cce/gr4.jpg gr4 gr4.jpg jpg 72333 283 678 IMAGE-DOWNSAMPLED 1-s2.0-S2468823124000361-gr5.jpg https://s3-eu-west-1.amazonaws.com/prod-ucs-content-store-eu-west/content/pii:S2468823124000361/gr5/DOWNSAMPLED/image/jpeg/6cacb142ad5181a25229c98417dbf289/gr5.jpg gr5 gr5.jpg jpg 34715 270 678 IMAGE-DOWNSAMPLED 1-s2.0-S2468823124000361-sc3.jpg https://s3-eu-west-1.amazonaws.com/prod-ucs-content-store-eu-west/content/pii:S2468823124000361/sc3/DOWNSAMPLED/image/jpeg/529ad19479656dac865c08f5dc5d2d23/sc3.jpg sc3 sc3.jpg jpg 45604 282 742 IMAGE-DOWNSAMPLED 1-s2.0-S2468823124000361-sc4.jpg https://s3-eu-west-1.amazonaws.com/prod-ucs-content-store-eu-west/content/pii:S2468823124000361/sc4/DOWNSAMPLED/image/jpeg/5b1656daa8b9add087150329fb7c1f91/sc4.jpg sc4 sc4.jpg jpg 30099 226 489 IMAGE-DOWNSAMPLED 1-s2.0-S2468823124000361-sc5.jpg https://s3-eu-west-1.amazonaws.com/prod-ucs-content-store-eu-west/content/pii:S2468823124000361/sc5/DOWNSAMPLED/image/jpeg/e29761cba8ba2c48de9496bf5f8f23f5/sc5.jpg sc5 sc5.jpg jpg 79026 407 678 IMAGE-DOWNSAMPLED 1-s2.0-S2468823124000361-gr1.jpg https://s3-eu-west-1.amazonaws.com/prod-ucs-content-store-eu-west/content/pii:S2468823124000361/gr1/DOWNSAMPLED/image/jpeg/ee36ae332ee377fa787eb9652142c9fc/gr1.jpg gr1 gr1.jpg jpg 45186 266 678 IMAGE-DOWNSAMPLED 1-s2.0-S2468823124000361-sc1.jpg https://s3-eu-west-1.amazonaws.com/prod-ucs-content-store-eu-west/content/pii:S2468823124000361/sc1/DOWNSAMPLED/image/jpeg/9b521a5ac2bb974c5f40ac6ea9fe3638/sc1.jpg sc1 sc1.jpg jpg 49343 298 602 IMAGE-DOWNSAMPLED 1-s2.0-S2468823124000361-sc2.jpg https://s3-eu-west-1.amazonaws.com/prod-ucs-content-store-eu-west/content/pii:S2468823124000361/sc2/DOWNSAMPLED/image/jpeg/b0f97a9fcbe8f3ea6f95773dcf5dff60/sc2.jpg sc2 sc2.jpg jpg 35525 325 395 IMAGE-DOWNSAMPLED 1-s2.0-S2468823124000361-ga1.sml https://s3-eu-west-1.amazonaws.com/prod-ucs-content-store-eu-west/content/pii:S2468823124000361/ga1/THUMBNAIL/image/gif/40ba652e64a66e06b4e3535e74c6cc84/ga1.sml ga1 true ga1.sml sml 21213 134 219 IMAGE-THUMBNAIL 1-s2.0-S2468823124000361-gr6.sml https://s3-eu-west-1.amazonaws.com/prod-ucs-content-store-eu-west/content/pii:S2468823124000361/gr6/THUMBNAIL/image/gif/d8faf268206c949dedd951848b512cf7/gr6.sml gr6 gr6.sml sml 12834 164 189 IMAGE-THUMBNAIL 1-s2.0-S2468823124000361-gr2.sml https://s3-eu-west-1.amazonaws.com/prod-ucs-content-store-eu-west/content/pii:S2468823124000361/gr2/THUMBNAIL/image/gif/997786753feb28e201f68857a2fcaa96/gr2.sml gr2 gr2.sml sml 7972 74 219 IMAGE-THUMBNAIL 1-s2.0-S2468823124000361-gr3.sml https://s3-eu-west-1.amazonaws.com/prod-ucs-content-store-eu-west/content/pii:S2468823124000361/gr3/THUMBNAIL/image/gif/84a4833b4e41add971d99797255477da/gr3.sml gr3 gr3.sml sml 7374 120 219 IMAGE-THUMBNAIL 1-s2.0-S2468823124000361-gr4.sml https://s3-eu-west-1.amazonaws.com/prod-ucs-content-store-eu-west/content/pii:S2468823124000361/gr4/THUMBNAIL/image/gif/c92f5326cc1672078c6fe101cc6eafc7/gr4.sml gr4 gr4.sml sml 11768 91 219 IMAGE-THUMBNAIL 1-s2.0-S2468823124000361-gr5.sml https://s3-eu-west-1.amazonaws.com/prod-ucs-content-store-eu-west/content/pii:S2468823124000361/gr5/THUMBNAIL/image/gif/5b408bad173e24d9d090ac4ab3410bcb/gr5.sml gr5 gr5.sml sml 6175 87 219 IMAGE-THUMBNAIL 1-s2.0-S2468823124000361-sc3.sml https://s3-eu-west-1.amazonaws.com/prod-ucs-content-store-eu-west/content/pii:S2468823124000361/sc3/THUMBNAIL/image/gif/b49698e335c87559d214ac00444c4778/sc3.sml sc3 sc3.sml sml 7370 83 219 IMAGE-THUMBNAIL 1-s2.0-S2468823124000361-sc4.sml https://s3-eu-west-1.amazonaws.com/prod-ucs-content-store-eu-west/content/pii:S2468823124000361/sc4/THUMBNAIL/image/gif/2e9713389c2b2ca636919454ee427874/sc4.sml sc4 sc4.sml sml 6666 101 219 IMAGE-THUMBNAIL 1-s2.0-S2468823124000361-sc5.sml https://s3-eu-west-1.amazonaws.com/prod-ucs-content-store-eu-west/content/pii:S2468823124000361/sc5/THUMBNAIL/image/gif/c4ebcb019b7f8cdf3e438ea09ebc9c97/sc5.sml sc5 sc5.sml sml 10513 132 219 IMAGE-THUMBNAIL 1-s2.0-S2468823124000361-gr1.sml https://s3-eu-west-1.amazonaws.com/prod-ucs-content-store-eu-west/content/pii:S2468823124000361/gr1/THUMBNAIL/image/gif/e0bc50cfa5dedca9b1b4241fe25a8dd6/gr1.sml gr1 gr1.sml sml 9324 86 219 IMAGE-THUMBNAIL 1-s2.0-S2468823124000361-sc1.sml https://s3-eu-west-1.amazonaws.com/prod-ucs-content-store-eu-west/content/pii:S2468823124000361/sc1/THUMBNAIL/image/gif/c6c19e590a5d27e76c5691b0cd6f36f6/sc1.sml sc1 sc1.sml sml 14148 109 219 IMAGE-THUMBNAIL 1-s2.0-S2468823124000361-sc2.sml https://s3-eu-west-1.amazonaws.com/prod-ucs-content-store-eu-west/content/pii:S2468823124000361/sc2/THUMBNAIL/image/gif/9f6291976d6c651b5386b51d5ccd6394/sc2.sml sc2 sc2.sml sml 14087 164 199 IMAGE-THUMBNAIL 1-s2.0-S2468823124000361-ga1_lrg.jpg https://s3-eu-west-1.amazonaws.com/prod-ucs-content-store-eu-west/content/pii:S2468823124000361/HIGHRES/image/jpeg/6f9c70312499d67025f705291a0dc422/ga1_lrg.jpg ga1 true ga1_lrg.jpg jpg 266924 886 1453 IMAGE-HIGH-RES 1-s2.0-S2468823124000361-gr6_lrg.jpg https://s3-eu-west-1.amazonaws.com/prod-ucs-content-store-eu-west/content/pii:S2468823124000361/HIGHRES/image/jpeg/5b2f6fec3ab6d2d84d5b6ea3cb8958a8/gr6_lrg.jpg gr6 gr6_lrg.jpg jpg 915159 2748 3167 IMAGE-HIGH-RES 1-s2.0-S2468823124000361-gr2_lrg.jpg https://s3-eu-west-1.amazonaws.com/prod-ucs-content-store-eu-west/content/pii:S2468823124000361/HIGHRES/image/jpeg/812651c2e53d35bcd70161812f5177de/gr2_lrg.jpg gr2 gr2_lrg.jpg jpg 278950 1073 3167 IMAGE-HIGH-RES 1-s2.0-S2468823124000361-gr3_lrg.jpg https://s3-eu-west-1.amazonaws.com/prod-ucs-content-store-eu-west/content/pii:S2468823124000361/HIGHRES/image/jpeg/3ac02b5b667a3c3ac4a15810c89c3a37/gr3_lrg.jpg gr3 gr3_lrg.jpg jpg 342341 1739 3167 IMAGE-HIGH-RES 1-s2.0-S2468823124000361-gr4_lrg.jpg https://s3-eu-west-1.amazonaws.com/prod-ucs-content-store-eu-west/content/pii:S2468823124000361/HIGHRES/image/jpeg/18d2b01637f5ea442b9f5e17d246c48f/gr4_lrg.jpg gr4 gr4_lrg.jpg jpg 540949 1251 3000 IMAGE-HIGH-RES 1-s2.0-S2468823124000361-gr5_lrg.jpg https://s3-eu-west-1.amazonaws.com/prod-ucs-content-store-eu-west/content/pii:S2468823124000361/HIGHRES/image/jpeg/ae7b419368edc921454766d6bfe301fe/gr5_lrg.jpg gr5 gr5_lrg.jpg jpg 194059 1193 3000 IMAGE-HIGH-RES 1-s2.0-S2468823124000361-sc3_lrg.jpg https://s3-eu-west-1.amazonaws.com/prod-ucs-content-store-eu-west/content/pii:S2468823124000361/HIGHRES/image/jpeg/15f6f5b60569fa63882da212ab1426eb/sc3_lrg.jpg sc3 sc3_lrg.jpg jpg 372201 1250 3286 IMAGE-HIGH-RES 1-s2.0-S2468823124000361-sc4_lrg.jpg https://s3-eu-west-1.amazonaws.com/prod-ucs-content-store-eu-west/content/pii:S2468823124000361/HIGHRES/image/jpeg/24b09889eb44a71044ba96e2b639367d/sc4_lrg.jpg sc4 sc4_lrg.jpg jpg 200810 1001 2167 IMAGE-HIGH-RES 1-s2.0-S2468823124000361-sc5_lrg.jpg https://s3-eu-west-1.amazonaws.com/prod-ucs-content-store-eu-west/content/pii:S2468823124000361/HIGHRES/image/jpeg/7d785c1c34fcd3516acbfc57f1d781c9/sc5_lrg.jpg sc5 sc5_lrg.jpg jpg 521372 1802 3000 IMAGE-HIGH-RES 1-s2.0-S2468823124000361-gr1_lrg.jpg https://s3-eu-west-1.amazonaws.com/prod-ucs-content-store-eu-west/content/pii:S2468823124000361/HIGHRES/image/jpeg/93756dacf1a54596da96f993c53ad150/gr1_lrg.jpg gr1 gr1_lrg.jpg jpg 342204 1179 3000 IMAGE-HIGH-RES 1-s2.0-S2468823124000361-sc1_lrg.jpg https://s3-eu-west-1.amazonaws.com/prod-ucs-content-store-eu-west/content/pii:S2468823124000361/HIGHRES/image/jpeg/7e91dcbe2e7141de4e160e10a34d995f/sc1_lrg.jpg sc1 sc1_lrg.jpg jpg 347328 1322 2667 IMAGE-HIGH-RES 1-s2.0-S2468823124000361-sc2_lrg.jpg https://s3-eu-west-1.amazonaws.com/prod-ucs-content-store-eu-west/content/pii:S2468823124000361/HIGHRES/image/jpeg/e4ec55d174f406d7cd74077fcc4c8ef3/sc2_lrg.jpg sc2 sc2_lrg.jpg jpg 253882 1439 1750 IMAGE-HIGH-RES 1-s2.0-S2468823124000361-mmc1.docx https://s3-eu-west-1.amazonaws.com/prod-ucs-content-store-eu-west/content/pii:S2468823124000361/mmc1/MAIN/application/vnd.openxmlformats-officedocument.wordprocessingml.document/b05eff62dd6576720a5aaa450eb85802/mmc1.docx mmc1 mmc1.docx docx 1869801 APPLICATION 1-s2.0-S2468823124000361-si1.svg https://s3-eu-west-1.amazonaws.com/prod-ucs-content-store-eu-west/content/pii:S2468823124000361/image/svg+xml/7a72ff77b13097c46b821687dcad7fdc/si1.svg si1 si1.svg svg 7106 ALTIMG 1-s2.0-S2468823124000361-am.pdf am am.pdf pdf 1531452 AAM-PDF https://s3-eu-west-1.amazonaws.com/prod-ucs-content-store-eu-west/content/egi:10X6KKBR2X6/MAIN/application/pdf/7bbfdfa9be2c3213d09de12b6060b342/am.pdf MCAT 113853 113853 S2468-8231(24)00036-1 10.1016/j.mcat.2024.113853 Scheme 1 Extraction procedure of birch lignin. Scheme 1 Scheme 2 Lignin hydrogenolysis process. Scheme 2 Fig. 1 Solid residue and lignin oil yields of DL at different (a) reaction temperatures with 4 h and (b) reaction times under 300 ℃. NC: non-catalytic. Reaction conditions: 300 ℃, 4 h. Fig 1 Scheme 3 Condensation mechanism for phenolics with (a) Cα-OH types, (b) C=C types. Scheme 3 Fig. 2 The group composition distribution of DL liquid products under different (a) reaction temperatures with 4 h and (b) reaction times at 300 ℃. Fig 2 Fig. 3 2D HSQC spectra of lignin oil products (a) non-catalytic, (b) catalytic. Reaction conditions: 300 ℃, 4 h, 25 mL isopropanol. Fig 3 Fig. 4 FTIR spectra of lignin hydrogenolysis products. NC: non-catalytic, C: catalytic. Fig 4 Fig. 5 Iso-abundance plots of DBE vs CN number of liquid products under (a) non-catalytic and (b) catalytic conditions of lignin. Fig 5 Scheme 4 The CTH reaction of PPE under different reaction solvents and reaction atmospheres. Scheme 4 Fig. 6 The mass fragments of PPE CTH products in CD3CD(OD)CD3 by GCMS. (a) Ethylbenzene, (b) phenol, (c) 1-phenylethanol and (d) 2-phenoxyethylbenzene mass spectra. (red bars: reaction under N2 atmosphere; blue bars: reaction under H2 atmosphere). (e) Schematic of the CTH reaction mechanism of PPE in CD3CD(OD)CD3. Fig 6 Scheme 5 Possible reaction pathways involved in lignin CTH over Ni0.5Co1.5Al catalyst. Scheme 5 Table 1 Original lignin and residual molecular weights under the different reaction conditions. Table 1 Entry Temp. (℃) Time (h) Mw (Da) Mn (Da) PDI (Mw/Mn) 1* 300 4 861 424 2.03 2 300 4 727 311 2.34 3 300 8 607 271 2.24 ⁎ Without catalyst (NC) Table 2 Ni0.5Co1.5Al catalyzes the production of major monophenols from various lignin. Table 2 Retention time (min) Compound DL OL AL BW 12.68 Phenol 4.30 4.22 2.84 16.64 2-methylphenol 1.65 0.72 1.05 17.48 p-Cresol 2.89 3.50 2.93 17.99 guaiacol 38.99 10.82 16.21 1.87 20.21 2-ethylphenol 0.26 0.24 0.60 21.34 2,5-dimethylphenol 0.10 0.43 0.73 21.42 2,6-dimethylphenol 0.21 21.65 4-ethylphenol 0.58 0.76 21.81 3-ethylphenol 2.81 0.92 1.36 21.86 2,3-dimethylphenol 0.11 1.60 22.26 2-ethyl-6-methylphenol 0.87 0.86 23.31 3-(1-methylethyl)-phenol 0.14 0.39 23.64 4-(2-propenyl)-phenol 0.25 23.82 2-(1-methylethyl)-phenol 0.28 3.37 23.98 2-propylphenol 3.31 2.58 0.50 24.76 2,3,5,6-tetramethylphenol 5.62 24.94 2-methoxy-3-methylphenol 0.81 0.62 26.33 4-methoxy-3-(methoxymethyl)-phenol 3.76 26.67 4-ethyl-2-methoxyphenol 0.21 10.54 3.84 0.79 27.06 2-(2-methylpropyl)-phenol 4.45 28.14 2-methoxy-4-propylphenol 6.68 2.87 5.35 28.20 3,4-dimethoxy-phenol 15.24 12.08 29.83 2,6-dimethoxy-phenol 6.11 0.32 0.21 30.07 2-methoxy-4-(1-propenyl)-phenol 4.14 0.5 33.07 4-(ethoxy-methyl)-2-methoxyphenol 0.37 34.35 4-methoxy-2,3,6-trimethylphenol 0.16 1.34 34.58 3-methoxy-2,4,5-trimethylphenol 0.96 35.45 2-methoxy-4-propylphenol 4.67 41.33 2-methoxy-4-methyl-6-[propenyl]-phenol 0.42 42.6 2,4-bis(1-methylethyl)-phenol 0.37 Reaction conditions: 300 ℃, 4 h, 1.0 MPa N2, 25 mL isopropanol. In-situ transfer hydrogenolysis of lignin into phenolic monomers over Ni0.5Co1.5Al catalyst Zong-Pin Fu Methodology Formal analysis Writing – original draft a Le-Le Qiu Methodology Supervision Writing – review & editing a c ⁎ Yun-Peng Zhao Conceptualization Methodology Supervision Resources Funding acquisition a b ⁎ Fa-Peng Wu Methodology Formal analysis Data curation a Jin-Xuan Xie Methodology Formal analysis a Jian Xiao Data curation a c Jing Liang Writing – review & editing Validation a Jian Li Writing – review & editing b Fang-Jing Liu Conceptualization Methodology Validation a c Jing-Pei Cao Conceptualization Methodology Validation a c a Key Laboratory of Coal Processing and Efficient Utilization, Ministry of Education, China University of Mining & Technology, Xuzhou 221116, Jiangsu, PR China Key Laboratory of Coal Processing and Efficient Utilization Ministry of Education China University of Mining & Technology Xuzhou Jiangsu 221116 PR China aKey Laboratory of Coal Processing and Efficient Utilization, Ministry of Education, China University of Mining & Technology, Xuzhou 221116, Jiangsu, PR China b Key Laboratory of Coal Clean Conversion & Chemical Engineering Process of Xinjiang Uygur Autonomous Region, College of Chemical Engineering, Xinjiang University, Urumqi 830046, PR China Key Laboratory of Coal Clean Conversion & Chemical Engineering Process of Xinjiang Uygur Autonomous Region College of Chemical Engineering Xinjiang University Urumqi 830046 PR China bKey Laboratory of Coal Clean Conversion & Chemical Engineering Process of Xinjiang Uygur Autonomous Region, College of Chemical Engineering, Xinjiang University, Urumqi 830046, PR China c Jiangsu Province Engineering Research Center of Fine Utilization of Carbon Resources, China University of Mining & Technology, Xuzhou 221116, PR China Jiangsu Province Engineering Research Center of Fine Utilization of Carbon Resources China University of Mining & Technology Xuzhou 221116 PR China cJiangsu Province Engineering Research Center of Fine Utilization of Carbon Resources, China University of Mining & Technology, Xuzhou 221116, PR China ⁎ Corresponding authors. Hydrogenolysis of lignin to produce valuable aromatic chemicals under mild conditions can effectively realize the value-added utilization of lignin. In this work, catalytic transfer hydrogenolysis (CTH) of dealkaline lignin (DL) over Ni0.5Co1.5Al catalyst was studied for the production of phenolic compounds, and the reaction mechanism was elucidated through the reaction of 2-phenoxy-1-phenylethanol (PPE) in deuterated isopropanol (CD3CD(OD)CD3) and D2. Moreover, we investigated the CTH behaviors of various lignin including organic solvents lignin in birch (OL), acidic solvents lignin in birch (AL) and birch powder (BW) to explore the suitability of the Ni0.5Co1.5Al catalyst. The results showed that Ni0.5Co1.5Al was able to catalyze the hydrogenolysis of various lignin into phenolic monomers using isopropanol as an in-situ hydrogen source. Under optimized conditions, the hydrogenolysis of DL over Ni0.5Co1.5Al achieved 43.30 wt% lignin oil yield. The experimental results of isotope labeling experiments exhibited that the active hydrogen generated by isopropanol is used for the cleavage of C-O bonds, and the electronic interactions between Ni and Co promotes the C-O bonds breaking. Isopropanol can not only be a hydrogen donor, but also act as a reaction solvent to stabilize intermediates and enhance the yield of phenolic compounds in the lignin CTH process. Graphical abstract Image, graphical abstract Keywords Lignin NiCoAl catalyst Hydrogenolysis Isopropanol Phenolic compounds Data availability No data was used for the research described in the article. 1 Introduction Nowadays, the vast majority of chemicals and fuels are produced from fossil resources [1]. With the issues such as nonrenewable and increasing scarcity of fossil resources, developing renewable resources has become a focus of research [2,3]. Lignin is the only naturally occurring aromatic biopolymer, consisting mainly of guaiacyl (G), syringyl (S)- and p-hydroxyphenyl (H) units, which can be used as a supplement for the production of fossil-derived chemical products [4–6]. However, owing to the structural intricacy and carbon-based inert property, lignin is generally viewed as a solid waste for power generation in current practice, and only about 2 % of lignin is used for producing value-added chemicals [3]. With the development of biofuel technology, the amount of lignin will be bound to grow rapidly [7]. Therefore, it is of great significance to develop efficient depolymerization processes for lignin utilization by breaking the C-O bonds in lignin. Many approaches have been employed to convert lignin into small molecular compounds, such as pyrolysis [8], hydrogenolysis [9,10], oxidation [11], and tandem strategies [12–14], etc. Among these strategies, hydrogenolysis has attracted much attention because it can achieve highly selective production of mono-phenolic compounds under milder conditions. Kuznetsov et al. [15] studied the catalytic hydrogenolysis of poplar lignin over Ru/C, Pt/ZrO2 and NiCuMo/SiO2 catalysts under 250 ℃, 9.0 MPa H2 with supercritical ethanol. The yield of alkyl substituted phenols (mainly propyl eugenol and propyl guaiacol) were significantly increased under the action of catalysts, but excessive hydrogen pressure leads to further hydrogenation of aromatic compounds. Zhou et al. [16] used non-noble metal catalyst NiCo/C to catalyze the enzymatic hydrolysis lignin with a yield of 20.8 wt% of the monomeric product at 260 ℃ and 3.0 MPa H2. Zeng et al. [17] reported the influence of the structural properties of the Fe-Pd/HZSM-5 catalyst on the catalytic hydrocracking of sugarcane bagasse lignin for the preparation of aromatic monomers. Under the optimal reaction conditions of 1.0 MPa H2 and 320 ℃ in ethanol-water mixed solvent, the yield of aromatic monomers was 27.92 %. It must be pointed out that hydrogenolysis process is usually conducted with high pressure hydrogen, resulting in high cost and undesired hydrogenation of benzene ring. Additionally, hydrogen is mainly produced from fossil fuels and its use will increase the carbon footprint [18–20]. Thus, it is desirable to avoid the employment of high-pressure hydrogen for enhancing the product selectivity and overall efficiency of lignin hydrogenolysis. Catalytic transfer hydrogenolysis (CTH) using organic solvents (methanol, ethanol, formic acid, etc.) as hydrogen donors has been proved to be a promising way for C-O bonds cleavage and lignin depolymerization [21–23]. Among various organic hydrogen donors, isopropanol has a strong hydrogen supply capacity and higher reactivity, thus it is widely used in the CTH of lignin [24]. Hua et al. [25] demonstrated that using isopropanol as a hydrogen source, Ru/C and Ru/hydroxyapatite catalysts can effectively catalyze aromatic ether bonds cleavage in various lignin-derived compounds. Wang et al. [26] studied the hydrogenolysis of Enzymatic hydrolysis lignin (EHL) over Ni-Ru/Al2O3 catalyst using isopropanol as the reaction solvent without additional hydrogen. The 2D Heteronuclear Single Quantum Coherence Nuclear Magnetic Resonance Spectroscopy (2D HSQC NMR) analysis verified that Ni-Ru/Al2O3 catalyst was high activity for C-O bonds cleavage. Paone et al. [27] showed that the Pd/Fe3O4 catalyst was able to catalyze the hydrogenolysis of benzyl phenyl ether into phenol and toluene completely at 240 ℃ with isopropanol as the hydrogen donor. Zeng et al. [28] used different bimetallic (Ru, Pd and Pt) catalysts loaded on various carriers (activated carbon, γ-Al2O3, TiO2, HZSM-5) to improve the hydrogenolysis process of sulfated lignin using isopropanol as in-situ hydrogen source. Many studies have shown that isopropanol as the hydrogen source promoted the CTH of lignin, but the CTH process usually needed the involvement of precious metals as active components of catalysts. Meanwhile, the hydrogen supply mechanism of isopropanol in the CTH process and the cleavage mechanism of the C-O bonds in lignin are still ambiguous, which makes the process optimization of lignin hydrogenolysis difficult. In our previous studies [29], we found that the Ni0.5Co1.5Al catalyst can effectively cleave the C-O bonds via the CTH in different lignin model compounds. However, since the structure of lignin is far more complex than those of model compounds, it is necessary to investigate the suitability of the Ni0.5Co1.5Al catalyst on transfer hydrogenolysis of lignin. Herein, in-situ hydrogenolysis of dealkaline lignin (DL), organic solvents lignin in birch (OL), acidic solvents lignin in birch (AL) and birch powder was investigated in isopropanol over Ni0.5Co1.5Al catalyst. Firstly, the effects of reaction conditions on lignin oil yield during DL hydrogenolysis was studied. The products of lignin CTH were analyzed by GC–MS, GPC, FTIR, 2D HSQC NMR and Orbitrap-MS. Then, the CTH process of 2-phenoxy-1-phenylethanol (PPE) was studied by deuterated isopropanol (CD3CD(OD)CD3) and D2 isotope labeling method, and the CTH pathway of lignin was discussed in combination with the results of lignin model compounds. These results showed that lignin hydrogenolysis balance can be promoted by product consumption in situ hydrogenolysis reaction systems, thus obtaining high lignin conversion and phenolic monomer yields. 2 Materials and methods 2.1 Materials All reagents used in this work are of analytical purity without further purification. 2-phenoxy-1-phenylethanol and 2,2,6,6-Tetramethylpiperidinooxy (TEMPO) were obtained from Aladdin Reagents (Shanghai, China) Co. 2-propanol-D8 was obtained from Maclean's Reagents (Shanghai, China) Co. 1,4-dioxane, HCl, formic acid, acetic acid ethanol and isopropanol were purchased from Xilong Chemical Co., Ltd. and used as supplied. Birch wood (BW) was from a manufacturer in Zhejiang province, China, and dealkaline lignin (DL) was purchased from Tokyo Chemical Industry Co., Ltd. 2.2 Extraction of lignin from birch wood 2.2.1 Separation of organic solvents lignin in birch (OL) Birch organic solvent lignin (OL) was extracted according to the reported work [30]. 60 g of 40 mesh birch wood, 430 mL of 1,4-dioxane, and 50 mL of HCl solution (2 mol·L−1) were added to a flask. The mixture was refluxed at 110 ℃ in a nitrogen atmosphere for 90 min and cooled to room temperature. After filtration, the filtrate was combined and concentrated after washing with 1,4-dioxane three times. Then the concentrate was added to 2 L water to get the residue, which was filtered and washed. The crude dry birch lignin yield was 17.3 wt% (10.37 g). Next, 60 mL of a mixture of acetone and water (v:v = 9:1) was added to the residue and stirred for 1 h. After that, 1.5 L of ice water was added to the mixed system, and the precipitate was collected by filtrate and dried at 60 ℃. The dried lignin sample was registered as organic solvent lignin (OL). The yield of OL was 10.7 wt % (6.42 g). 2.2.2 Separation of acidic solvents lignin in birch (AL) According to previous reports [31,32], 3 g of 40 mesh dried birch wood, 30 mL formic acid and acetic acid mixed solution (v:v = 4:5) and 0.5 mL of HCl were added to a 100 mL of round bottom flask. The mixture was first heated to 91 ℃ and maintained at that temperature for 4 h. After cooling to room temperature, 10 times the volume of water was added to precipitate, then centrifuged and washed with water to neutral. The crude birch lignin yield was 14.3 wt% (0.43 g). The obtained crude birch lignin was dissolved in a mixed solvent of 1,4-dioxane/ethanol (v:v = 8:2), centrifuged to remove the residue, and the supernatant was added to an equal volume of ether/petroleum ether mixture (Scheme 1 ). The residue was dried in a vacuum drying oven at 60 ℃ to obtain acid-extracted birch lignin (AL). The yield of AL was 9.3 wt% (0.28 g). 2.3 CTH of lignin and BW The detailed catalyst preparation process and characterization analysis have been carried out in depth, which can be inferred from our previous work [29]. Catalytic hydrogenolysis of lignin was carried out in a 100 mL autoclave reactor. In a typical experiment, substrate (100 mg), catalyst (20 mg), and isopropanol (25 mL) were added into the autoclave. After purging with high-purity nitrogen gas three times and pressurizing to 1.0 MPa N2, the reactor was heated to the desired temperature at 200 r/min stirring speed and kept for a certain time. Then, the reactor was cooled to room temperature, the liquid product was separated through a sand core filtration device. All solvents in the liquid product were removed by vacuum rotary evaporation, and the substance left after rotary evaporation was considered to be lignin oil (Scheme 2 ). 2.4 Product analysis The lignin oil was identified using an Agilent 7890A-5975C GC–MS instrument equipped with an HP-5 capillary column (60 m × 250 μm × 0.25 μm). High-purity helium gas was used as the carrier gas, and the split ratio was set at 50 : 1 with an inlet temperature of 60 ℃. The macromolecular compounds obtained after the hydrogenolysis of lignin were analyzed by a quadrupole/Orbitrap MS (Q-Exactive, Thermo Fisher Co., USA). The sample was analyzed with an atmospheric pressure chemical ionization (APCI) source in Q-Exactive positive ion mode. The discharge current was selected at 4.0 µA, the capillary temperature was set at 275 ℃, and the nebulization temperature was chosen as 300 ℃. The ion scanning scope was 100–600 m/z, and the resolution as 140,000. The sheath gas and auxiliary gas were high-purity nitrogen (≥99.999 %), and the flow rates were 20 and 10 arb, respectively. The data obtained by Orbitrap MS were analyzed by Xcalibur Roadmap Software Data Analysis 3.0 software from Thermo Fisher. The signal-to-noise ratio for peak detection was 3, and the mass tolerance of the molecular formula was less than 3 ppm. The molecular formula was limited to a maximum of 50 C, 100 H, 6 O and 4 N atoms. Prominence GPC system developed by Shimadzu detected the molecular weight distribution of lignin residue. The dried lignin residue was dissolved in N, N-dimethylformamide (m: m = 1: 2) and filtered with a 0.45 μm organic filter after a period of static analysis. The structures of lignin and lignin oil were analyzed by Bruker Ascend TM 400 two-dimensional nuclear magnetic resonance (2D NMR). The DMSO-d6 solution was used to dissolve the sample, and the heterogeneous single quantum coherence spectroscopy (HSQC) was used to collect the signal of the program. Fourier transform infrared (FTIR) spectroscopy was used to detect the distribution of functional groups after lignin hydrogenolysis. In the transmission mode, the Nicolet Magna 560 FTIR spectrometer was measured using a mercury cadmium telluride (MCT) detector. The samples were mixed and ground with KBr, then pressed into tablets. The spectra were collected from 650 to 4000 cm−1 with 32 scans. The yields of reaction residue and lignin oil were calculated according to the following equations: (1) S i (%) = Y i / Y total ×100 (%) (2) Y (wt%) lignin oil = mass of lignin oil / mass of lignin ×100 (%) (3) Y (wt%) residue = mass of solid products-mass of catalyst / mass of lignin ×100 (%) (4) Conversion = moles of substrate reacted / total moles of substrate × 100 (%) Where S i means the selectivity of product i 3 Results and discussion 3.1 Catalytic hydrogenolysis of DL Previous studies [15,21] indicated that reaction temperature and time are the two essential factors for lignin hydrogenolysis. Therefore, the optimized Ni0.5Co1.5Al catalyst was used to study the products distribution after DL hydrogenolysis at different reaction temperatures (240–300 ℃) and reaction times (4–10 h). As shown in Fig. 1 a, the yields of lignin oil increased significantly with reaction temperature rising. This may be due to the fact that the hydrogenolysis reaction is endothermic process, and the high temperatures favor the catalytic hydrogenolysis of DL by enhancing the cleavage of the C-O bonds, thereby significantly increasing the yield of lignin oil. In addition, the increase of reaction temperature enhances the hydrogen transfer performance of isopropanol, thus promoting the depolymerization of lignin. Depolymerization at temperature above 300 ℃ was not investigated because the limit of the reactor in present work. Despite all this, GC–MS can detect a variety of phenolic compounds at the reaction temperature of 300 ℃, as revealed by 2D HSQC NMR below, indicating that the C-O bonds can be effectively broken under such temperature. Fig. 1b showed the effect of reaction time on the hydrogenolysis of DL at 300 ℃. It was observed that the lignin oil yield was positively correlated with the holding time, and the highest lignin oil yield of 43.30 wt% was obtained at 8 h. With the extension of reaction time to 10 h, the yield of lignin oil was slightly decreased. It is possible that prolongation of reaction time resulting in the condensation of monomer fragments and more complex oligomer products. Therefore, excessively long reaction time does not always have a positive impact on DL hydrogenolysis. It is worth noting that the lignin oil yield increased significantly after the introduction of the catalyst under the same reaction conditions, indicating that the Ni0.5Co1.5Al catalyst can effectively promote lignin depolymerization. Furthermore, the yield of lignin oil was reduced under hydrogen atmosphere (Table S1), resulting from the competitive adsorption of hydrogen, isopropanol and substrate on the catalyst active sites, which agreed with the results obtained from the CTH of lignin model compounds [29]. As shown in Fig. 2 , the compounds in lignin oil are mainly phenolic compounds, together with small amounts of aromatic ethers, aromatic ketones and aromatic aldehydes. In Fig. 2a, the relative content of phenolic compounds, aromatic ether compounds and aromatic ketone compounds decreased, which may be attributed to the elimination of unstable intermediates from lignin to produce active benzyl carbon cations or olefins. These reactive compounds that have not been converted in time, especially phenols may undergo recondensation reactions, resulting in the formation of oligomers products [33]. As shown in Table S4 and Table S6, Olefinic structural products such as 3-allylguaiacol and 2-methoxy-4-vinyphenol were detected in the products. Although there is no clear explanation about the polymerization mechanisms of lignin intermediates (free radicals or cations), previous studies have reported that styrene undergoes thermal polymerization at a certain temperature. Hence, based on the products distributions of lignin oil, it can be speculated that the intermediates generated from the hydrogenolysis of lignin may undergo the condensation reactions (Scheme 3 ). For the Cα-OH type, the vinyl condensation can also be dehydrated to a Cα=Cβ structure. The formation of dimer 3 indicated that the quinone formamide intermediate undergoes the nucleophilic addition of creosote, and this condensation reaction competes with the formation of Cα=Cβ and subsequent vinyl coupling [34]. For the reaction pathway b, dimers 4 and 5 are the coupling products between Cα=Cβ. Rizzi et al. [35] compared the 1H NMR spectra with the reported data, according to the large coupling constant (16.0 Hz) of the two adjacent protons attached to the double bond in the dimer, and they confirmed that dimer 4 is a coupling product of Cα and Cβ. Chen et al. [36] also indicated that styrene undergoes thermal polymerization and self-initiated condensation under similar reaction conditions. The interunit C-C bonds obtained from these recondensation reactions have high bond energy, and are difficult to be cleaved. When the temperature rose to 300 ℃, the relative content of phenolic compounds decreased to 75.27 %, while the production of lignin oil yield increased significantly. These results indicated that the condensation reactions of aromatic compounds will result in lower relative content of phenolic compounds in the products. Fig. 2b exhibited the effect of reaction time on the distribution of lignin oil products. With the elevation of reaction time, the yield of lignin oil first increased and then decreased. When the reaction time extended to 8 h, the yield of DL lignin oil products increased to 43.30 wt%, and the relative content of phenols was 79.29 %. According to previous studies [21,28,37], the interactions between alcohol solvents and polar groups of lignin can enhance the solubility of lignin, which facilitates the contact of the substrate with the catalyst. Moreover, the free radicals and carbon ions formed by isopropanol self-conversion are involved in the reaction, which promotes the breaking of the bonds in lignin and stabilizes the reactive intermediates [38]. Therefore, isopropanol as a hydrogen source can promote the lignin hydrogenolysis process. Notably, 2-isopropoxyphenol was detected in the products, and its relative content increased with reaction time. This may be caused by alcoholysis reactions formed between isopropanol and phenols. As the reaction time continued to elongate, the lignin oil yield and monomer selectivity declined significantly, and the kinds of intermediates generated from lignin hydrogenolysis became more diverse, and other compounds such as 2-methyl-2-hexanol, 3-octanol and trans-1,2-cyclohexanediol appeared in the products (Table S5 and Table S7). When the reaction time was extended to 10 h, the relative content of phenolic compounds decreased to 72.91 %, while the yield of DL lignin oil products decreased to 41.76 %, The decrease of lignin oil yield is probably due to the condensation and repolymerization reactions between the unstable fragments of lignin and the original lignin to form lignin residues [39]. Therefore, excessively long reaction times eventually lead to condensation of the products, producing complex macromolecular compounds with more complex structures and higher bond energies. 3.2 Characterization of products 3.2.1 GPC analysis The hydrogenolysis and repolymerization reactions of DL and their effect on molecular weight changes in the depolymerized products were studied via GPC analysis under various reaction conditions (Fig. S2). The results for the weight-average molecular weight (Mw), number-average molecular weight (Mn), and polydispersity index (PDI) of DL hydrogenolysis under different reaction conditions are presented in Table 1 . The addition of the catalyst resulted in decreased Mw and Mn values of the lignin residual products compared to non-catalyzed DL hydrogenolysis. Under a reaction temperature of 300 ℃, the depolymerized products showed a similar trend with extended reaction time, indicating that macromolecules in DL transformed into small molecules (monomers and oligomers). It confirms that the Ni0.5Co1.5Al catalyst is effectively catalyzed DL hydrogenolysis using isopropanol as solvent under a nitrogen atmosphere. Under the optimal reaction conditions of 300 ℃ and 8 h, the average weight molecular (Mw) of lignin residue was significantly reduced, indicating that more monomer compounds could be obtained by appropriately prolonging the reaction time. 3.2.2 2D HSQC NMR analysis To further investigate the structural changes of lignin after hydrogenolysis, 2D HSQC NMR was used to characterize the lignin oil products. The chemical shift assignment of identified peaks in HSQC is determined by comparison with literatures, standards or in combination with HMBC correlation [40]. The signal region of 2D HSQC NMR spectrum is mainly divided into aliphatic side-chain region (δC/δH=50–90/2.5–5.0 ppm) and aromatic region (δC/δH=100–150/6.5–8.0 ppm) (Fig. 3 ) [15,22,26]. In general, the lignin structure mainly contains the β-O-4 (A), β-5 (B) and β-β (C) unit structures. It is noteworthy that the signals of δc/δH = 60.0/3.4 ppm and δC/δH = 70.7/3.8 ppm were detected in the spectra of the catalytic DL hydrogenolysis products, which were associated with Aγ/Hγ and Cγ/Hγ of the β-O-4 and β-β substructures, respectively. This may be attributed to the fact that more stable C-C bonds still exist in lignin-derived oligomers (Table S2). Compared with the non-catalytic lignin oil products, the intensity of signal peaks of S2,6 (δC/δH=106.2/6.6 ppm), G2 (δC/δH=110.8/6.8 ppm), G5 (δC/δH=114.9/6.7 ppm) and G6 (δC/δH=119.0/6.8 ppm) increased significantly after the introduction of the catalyst, indicating that the catalyzed lignin produced a rich variety of phenolic compounds, which is consistent with the GC–MS analysis. Signal peaks of methoxy (–OCH3) at δC/δH=56.2/3.75 ppm are all present in Fig. 3, indicating that the products are all rich in ether bonding groups after depolymerization. Ni0.5Co1.5Al catalyst can selectively cleave the C-O bonds in dimers, but it has limited ability to cleave the C-O bonds in the monomer products containing methoxy (Table S3). Therefore, the products rich in ether bond groups are mainly monomer compounds, such as phenylethyl ether, 1,2-dimethoxybenzene, 1,2,3-trimethoxybenzene, 2,5-dimethoxyethylbenzene, etc. To summarize the above, the Ni0.5Co1.5Al catalyst can effectively catalyst the C-O bonds breaking between lignin structural units and obtain high-value phenolic compounds. 3.2.3 FTIR analysis FT-IR spectroscopy was used to study the structural changes of the lignin hydrogenolysis products (Fig. 4 ). It can be observed that after introducing the catalyst, the FT-IR spectra changed significantly, and the intensities of the characteristic peaks at different positions were enhanced significantly (Fig. 4a). The peak at 3377 cm−1 ascribed to the O-H stretching vibration of phenolic hydroxyl groups suggested the presence of phenolics hydroxyl groups after lignin hydrogenolysis. Moreover, the broadening and peak shift of the O-H bond stretching vibration peak associated with phenols demonstrated that the phenolic compounds increased and the types are diversified after introducing the catalyst. The C-H stretching peaks corresponding to methyl and methylene at 2973 cm−1 changed significantly, indicating that methylation reaction occurred during hydrogenolysis. The signal peak at 1718 cm−1 demonstrated the presence of the carbonyl group. The strong absorption peaks at 1605, 1500 and 1468 cm−1 were attributed to the benzene ring. The aromatic skeleton in the structure of lignin oil indicated that the original aromatic structure was retained in the hydrogenolysis products of lignin. The peaks at 818 cm−1 and 747 cm−1 were the C-O substituent groups of the benzene ring, the increase in peak intensity indicates an increase in the content of aromatic ring species [41]. Compared with the non-catalytic reaction, the increase in the 818 cm−1 and 747 cm−1 peaks intensity after introduction with Ni0.5Co1.5Al catalyst means an increase in the content of aromatic ring compounds. The FTIR results showed that the absorption peaks of the lignin products changed significantly after the introduction of the catalyst, indicating that the Ni0.5Co1.5Al can effectively depolymerize lignin. 3.2.4 Orbitrap-MS analysis As shown in Fig. S3, the peak positions of Orbitrap-MS mass spectra for the lignin oil were mainly in the range of 100–300 Da. The overall shift in the charge-to-mass ratio of the lignin oil products towards the lower value region after the introduction of the catalyst, indicated that Ni0.5Co1.5Al catalyzed hydrogenolysis of lignin producing more low molecular weight compounds. Fig. 5 was the DBE and carbon number diagram of lignin oil product. The heteroatom-containing compounds with characteristic ring structures (CcHhNnOo) usually exhibits a specific DBE value, which can be deduced from the plot of DBE versus carbon number. DBE represents the number of double bonds plus the number of rings in a given formula, which can be calculated by the previous reported equation ( DBE = c − h 2 + n 2 + 1 ) [42,43]. From the diagram, it can be seen that the DBE signal is mainly distributed in the range of 2–8, and the carbon number is distributed in the range of 6–15, corresponding to the aromatic structure containing oxygen atoms in the form of hydroxyl, methoxy, carboxyl or ester groups. Fig. S4 showed the isoabundance diagram of DBE and the carbon number of O1-O4 compounds. The O2 and O3 species with DBE≥4 may be some compounds with guaiacol and eugenol as the parent structure. The species with DBE values of 4–7, 8–11 and 12–14 should correspond to monomer, dimer and trimer phenols, respectively [43,44]. The O4-O6 species with DBE≥8 may be a random combination of benzene ring, phenol, guaiacol and eugenol [45]. More O2 and O3 species with DBE≥4 were detected in the liquid products after lignin catalytic hydrogenolysis, which corresponded to the rise in the types of aromatic compounds, corresponding to the increase in the content of mono-phenolic compounds detected by GC–MS. 3.3 CTH of lignin model compounds in deuterated isopropanol In order to understand the transfer hydrogenolysis pathway of lignin catalyzed by Ni0.5Co1.5Al, 2-phenoxy-1-phenylethanol (PPE) was chosen as a typical model compound to be explored. As shown in Scheme 4 , there are different products obtained by PPE with isopropanol and deuterated isopropanol (CD3CD(OD)CD3) under H2 and N2 atmospheres (Fig. S5). Compared with the reaction system with isopropanol as solvent, the CTH reaction of PPE in deuterated isopropanol became slower owing to the isotope effect. There were three main products in the hydrogen atmosphere, namely ethylbenzene, cyclohexanol and phenol, while the main components in the nitrogen atmosphere were ethylbenzene and cyclohexanol, and only trace amounts of phenol and 1-phenylethanol were detected. As listed in Table S1, the conversion of PPE in H2 atmosphere was lower than that in N2 atmosphere. It was observed that the introduction of H2 will lead to the decrease in PPE conversion, which may be caused by the competitive adsorption of H2 on the active sites of the catalyst [46,47]. To further verify the source of active hydrogen, the CTH of PPE was investigated in D2 atmosphere using isopropanol as reaction solvent. As expected, no D atoms were identified in the main products (Fig. S5), indicating the active hydrogen involved in the hydrogenolysis reaction is mainly derived from isopropanol rather than D2. In Fig. 6 , the signal peak of 2-phenoxyethylbenzene at m/z = 198 in the product was significantly increased to m/z = 199 using deuterated isopropanol as a reaction solvent, indicating that there is a direct cleavage of the Cα-OH bond during the hydrogenolysis of PPE, and the active hydrogen species for the dissociation of the Cα-OH bond are derived from the solvent rather than H2. In addition, the different mass shifts of ethylbenzene, phenol and 1-phenylethanol can be detected in PPE after a deuterated isopropanol reaction under N2 and H2 atmosphere. The mass spectrum showed that deuterated isopropanol will generate Acetone-D6 after the reaction, which demonstrates that the mixed hydrogen source will participate in the hydrogenation of the intermediate products, and the H/D exchange will occur on the benzene ring during the CTH reaction. The cleavage of the C-O bonds during the CTH of lignin is achieved by the attack of the active hydrogen intermediate. Cheng et al. [48,49] reported that isopropanol can be used for C-O bonds cleavage by releasing free radical hydrogen. Therefore, the free radical trapping agent TEMPO was selected to study the form of active hydrogen species produced by isopropanol. As shown in Fig. S6, PPE was converted into ethylbenzene, cyclohexanol and others without TEMPO. However, the addition of TEMPO into the reaction system restricted the conversion of PPE, indicating that TEMPO had a strong inhibitory effect on the hydrogenolysis reaction of PPE. In other words, the CTH of PPE catalyzed by Ni0.5Co1.5Al was a free radical process. During the hydrogenolysis reaction, isopropanol was adsorbed on the Ni-Co alloy site to produce active hydrogen, while the acidic sites on Ni0.5Co1.5Al catalyze the dehydration of PPE, resulting in the cleavage of Cα-OH to form 2-phenoxyethylbenzene. Furthermore, the electron transfer from Ni to Co weakens the C-O bond in PPE, leading to the C-O bonds cleavage in PPE. 3.4 Catalytic hydrogenolysis of Various lignin and BW To investigate the suitability of Ni0.5Co1.5Al catalysts in lignin hydrogenolysis reactions, other typical lignocellulosic biomasses were included in the extended hydrogenolysis reactions. The major monophenols of lignin oil products from various lignin hydrogenolysis are listed in Table 2 and Fig. S7. Hardwood lignin is usually composed of a large number of syringyl (S) units, typically has more C-O bonds, particularly β-O-4 bonds [31]. Birch is a typical hardwood whose lignin is primarily comprised of guaiacol (G) and syringyl (S) units. Therefore, we investigated the hydrogenolysis reaction of birch lignin extracted by different methods. Based on Table 2, it can be seen that Ni0.5Co1.5Al functions as a catalyst to promote the breaking of C-O bonds between lignin structure units. Isopropanol as a solvent and hydrogen donor can stabilize intermediates and release active hydrogen, which is consistent with the hydrogenolysis process of lignin model compounds. In addition, the hydrogenolysis products of OL and AL are enriched with phenolic compounds, which may be attributed to the higher content of ether bonds in the lignin from birch raw materials. Other factors such as the extraction method and the properties of the lignin may also contribute to the difference in the yield of phenolic compounds between extracted lignin and DL [50]. Although the main products distribution of OL and AL are similar after hydrogenolysis, the oil yield of AL (17.58 wt%) is lower than that of OL (20.10 wt%) (Fig. S8). This may be due to the fact that extracting lignin with organic solvents can better preserve the structure of lignin (Fig. S9). However, acid extraction of lignin leads to the repolymerization of interunit C-C bonds, resulting in a more complex lignin structure which is difficult to further upgrade [31]. In addition, lignin from hardwood typically contains more β-O-4 linkages, which results in a higher yield of monophenols [51]. Mild pretreatment methods can preserve more β-O-4 linkages in lignin and thus enhance the production of monophenols [52]. OL is more susceptible to hydrogenolysis due to its high degree of unsaturation and low molecular weight. Furthermore, the quantity of phenolic compounds during lignin hydrogenolysis is significantly influenced by the condensed structures and short side chains in lignin. 3.5 Lignin CTH mechanism According to the products distribution of lignin CTH and hydrogenolysis mechanism of model compounds catalyzed by Ni0.5Co1.5Al, the possible reaction path of lignin hydrogenolysis process can be inferred. From the results of catalysts characterization in our previous work [29], Ni0.5Co1.5Al catalyst has Ni-Co alloy sites and acidic sites. It has been reported that the Ni-Co alloy has a better affinity for oxygen and can bind to the hydroxyl group (-OH) in isopropanol at a much lower bond dissociation energy to produce active hydrogen. The presence of acidic sites on Ni0.5Co1.5Al contributes to the dehydration reaction of Cα-OH, which leads to the breakage of Cα-OH bonds. In addition, the electron transfer between Ni and Co optimizes the electronic structure of the metal active site, promotes the adsorption of active hydrogen and weakens the C-O bonds energy of the substrate. The active hydrogen is combined with the oxygen atom in the ether bonds (C-O) during the reaction, then the C-O bonds are broken over the Ni0.5Co1.5Al catalyst. As shown in Scheme 5 , the three-dimensional composite structure of lignin contains several typical C-O bonds: β-O-4, α-O-4 and 4-O-5. Among them, β-O-4 is rich in C-O ether bonds and has the highest content in natural lignin. In the process of lignin hydrogenolysis, the active hydrogen species generated by isopropanol can effectively adsorb the fragment molecules after lignin depolymerization, and the Ni0.5Co1.5Al catalyze the cleavage of C-O ether bonds to form a series of active phenolic compounds. Due to the complexity of the lignin depolymerization intermediate products, some soluble intermediates in the reaction will be converted into other aromatic compounds, and the intermediates will be repolymerized to form more complex compounds. 4 Conclusions In summary, the Ni0.5Co1.5Al catalyst can effectively catalyze the hydrogenolysis of lignin C-O bonds to generate phenolic compounds, where guaiacol is the main product. The hydrogenolysis experiments of PPE in deuterated isopropanol (CD3CD(OD)CD3), D2 and TEMPO indicated that isopropanol as a hydrogen donor can provide hydrogen radicals during the reaction process and participate in the hydrogenolysis process. Moreover, the Ni0.5Co1.5Al catalyst also exhibited better catalytic performance in AL and OL hydrogenolysis, and the catalyst are generally applicable to a wider range of lignin. This work provides a reference for the selective hydrogenolysis of lignin under mild conditions to produce phenolic monomers. CRediT authorship contribution statement Zong-Pin Fu: Methodology, Formal analysis, Writing – original draft. Le-Le Qiu: Methodology, Supervision, Writing – review & editing. Yun-Peng Zhao: Conceptualization, Methodology, Supervision, Resources, Funding acquisition. Fa-Peng Wu: Methodology, Formal analysis, Data curation. Jin-Xuan Xie: Methodology, Formal analysis. Jian Xiao: Data curation. Jing Liang: Writing – review & editing, Validation. Jian Li: Writing – review & editing. Fang-Jing Liu: Conceptualization, Methodology, Validation. Jing-Pei Cao: Conceptualization, Methodology, Validation. Declaration of competing interest The authors declare that they have no known competing financial interests or personal relationships that could have appeared to influence the work reported in this paper. Acknowledgements This work was supported by the National Natural Science Foundation of China (Grant 22178373, 22378415), Natural Science Foundation of Xinjiang, China (No. 2022D01C373) and Priority Academic Program Development of Jiangsu Higher Education Institutions. Supplementary materials Supplementary material associated with this article can be found, in the online version, at doi:10.1016/j.mcat.2024.113853. Appendix Supplementary materials Image, application 1 References [1] Y. Gao H.W. Ma Y. Rao K. Lv F. Shu J. Long Selective hydrogenolysis of lignin in the presence of Ni3Fe1 alloy supported on zirconium phosphate Chem Eng. Sci. 217 2013 118570 Y. Gao, H.W. Ma, Y. Rao, K. Lv, F. Shu, J. Long. Selective hydrogenolysis of lignin in the presence of Ni3Fe1 alloy supported on zirconium phosphate. Chem Eng. Sci. 217 (2013) 118570. [2] A.E. Atabani A.S. Silitonga I.A. Badruddin T.M.I. Mahlia H.H. Masjuki S. Mekhilef A comprehensive review on biodiesel an alternative energy resource and its characteristics Renew. Sust. Energ. Rev. 16 2012 2070 2093 A.E. Atabani, A.S. Silitonga, I.A. Badruddin, T.M.I. Mahlia, H.H. Masjuki, S. Mekhilef. A comprehensive review on biodiesel an alternative energy resource and its characteristics. Renew. Sust. Energ. Rev. 16 (2012) 2070–2093. [3] G. Zhu X. Ouyang L. Jiang Y. Zhu D. Jin Y. Peng Effect of functional groups on hydrogenolysis of lignin model compounds Fuel Process. Technol. 154 2016 132 138 G. Zhu, X. Ouyang, L. Jiang, Y. Zhu, D. Jin, Y. Peng. Effect of functional groups on hydrogenolysis of lignin model compounds. Fuel Process. Technol. 154 (2016) 132–138. [4] V.K. Ponnusamy D.D. Nguyen J. Dharmaraja S. Shobana J.R. Banu R.G. Saratale A review on lignin structure, pretreatments, fermentation reactions and biorefinery potential Bioresour. Technol. 271 2019 462 472 V.K. Ponnusamy, D.D. Nguyen, J. Dharmaraja, S. Shobana, J.R. Banu, R.G. Saratale. A review on lignin structure, pretreatments, fermentation reactions and biorefinery potential. Bioresour. Technol. 271 (2019) 462–72. [5] X. Li Y. Xu K. Alorku J. Wang L. Ma A review of lignin-first reductive catalytic fractionation of lignocellulose Mol. Catal. 550 2023 113551 X. Li, Y. Xu, K. Alorku, J. Wang, L. Ma. A review of lignin-first reductive catalytic fractionation of lignocellulose. Mol. Catal. 550 (2023) 113551. [6] R. Rinaldi R. Jastrzebski M.T. Clough J. Ralph M. Kennema P.C.A. Bruijnincx B.M. Wege zur verwertung von lignin: fortschritte in der biotechnik, der bioraffination und der katalyse Angew. Chem. Int. Ed. 128 2016 8296 8354 R. Rinaldi, R. Jastrzebski, M.T. Clough, J. Ralph, M. Kennema, P.C.A. Bruijnincx, B.M. Wege zur verwertung von lignin: fortschritte in der biotechnik, der bioraffination und der katalyse. Angew. Chem. Int. Ed. 128 (2016) 8296–354. [7] S. Wong R. Shu J. Zhang H. Liu N. Yan Downstream processing of lignin derived feedstock into end products Chem Soc. Rev. 49 2020 551 556 S. Wong, R. Shu, J. Zhang, H. Liu, N. Yan. Downstream processing of lignin derived feedstock into end products. Chem Soc. Rev. 49 (2020) 551–556. [8] M. Zhang Y. Hu H. Wang H. Li X. Han Y. Zeng C. Xu A review of bio-oil upgrading by catalytic hydrotreatment: advances, challenges, and prospects Mol. Catal. 504 2021 111438 M. Zhang, Y. Hu, H. Wang, H. Li, X. Han, Y. Zeng, C. Xu. A review of bio-oil upgrading by catalytic hydrotreatment: advances, challenges, and prospects. Mol. Catal. 504 (2021) 111438. [9] Z. Luo Z. Zhu R. Xiao Hydrogenolysis of lignin to aromatics over Ru-based catalysts Biomass Convers. Biorefinery. 2022 1 7 Z. Luo, Z. Zhu, R. Xiao. Hydrogenolysis of lignin to aromatics over Ru-based catalysts. Biomass Convers. Biorefinery. (2022) 1–7. [10] L. Xiao S. Wang H. Li Z. Li Z. Shi L. Xiao R. Sun Y. Fang G. Song Catalytic hydrogenolysis of lignins into phenolic compounds over carbon nanotube supported molybdenum oxide ACS Catal 7 2017 7535 7542 L. Xiao, S. Wang, H. Li, Z. Li, Z. Shi, L. Xiao, R. Sun, Y. Fang, G. Song. Catalytic hydrogenolysis of lignins into phenolic compounds over carbon nanotube supported molybdenum oxide. ACS Catal. 7 (2017) 7535–7542. [11] D. Wang M. Cui W. Zhao Y. Li S. Ma Z. Jiang X. Liu C. Liang R. Li L. Ma Y. Song X. Wei Production of diethyl maleate via oxidative depolymerization of organosolv lignin from wheat stalk over the cooperative acidic ionic liquid pair J. Agric Food Chem 71 2023 3800 3812 D. Wang, M. Cui, W. Zhao, Y. Li, S. Ma, Z. Jiang, X. Liu, C. Liang, R. Li, L. Ma, Y. Song, X. Wei. Production of diethyl maleate via oxidative depolymerization of organosolv lignin from wheat stalk over the cooperative acidic ionic liquid pair. J. Agric Food Chem. 71 (2023) 3800–3812. [12] H. Wang H. Ben H. Ruan L. Zhang Y. Pu M. Feng Effects of lignin structure on hydrodeoxygenation reactivity of pine wood lignin to valuable chemicals ACS. Sustain Chem. Eng. 5 2017 1824 1830 H. Wang, H. Ben, H. Ruan, L. Zhang, Y. Pu, M. Feng. Effects of lignin structure on hydrodeoxygenation reactivity of pine wood lignin to valuable chemicals. ACS. Sustain Chem. Eng. 5 (2017) 1824–30. [13] Y. Shao Q. Xia L. Dong X. Liu X. Han S.F. Parker Y. Cheng L.L. Daemen A.J. Ramirez Cuesta Selective production of arenes via direct lignin upgrading over a niobium-based catalyst Nat. Commun. 8 2017 16104 Y. Shao, Q. Xia, L. Dong, X. Liu, X. Han, S.F. Parker, Y. Cheng, L.L. Daemen, A.J. Ramirez Cuesta. Selective production of arenes via direct lignin upgrading over a niobium-based catalyst. Nat. Commun. 8 (2017) 16104. [14] J. Yang See S. Song Y. Xiao T. Trang. Pham. Transformation of corn lignin into sun cream ingredients ChemSusChem 14 2021 1586 1594 J. Yang See, S. Song, Y. Xiao, T. Trang. Pham. Transformation of corn lignin into sun cream ingredients. ChemSusChem 14 (2021) 1586–1594. [15] J. Hu S. Zhang R. Xiao X. Jiang Y. Wang Y. Sun P. Lu Catalytic transfer hydrogenolysis of lignin into monophenols over platinum-rhenium supported on titanium dioxide using isopropanol as in situ hydrogen source Bioresour. Technol. 279 2019 228 233 J. Hu, S. Zhang, R. Xiao, X. Jiang, Y. Wang, Y. Sun, P. Lu. Catalytic transfer hydrogenolysis of lignin into monophenols over platinum-rhenium supported on titanium dioxide using isopropanol as in situ hydrogen source. Bioresour. Technol. 279 (2019) 228–233. [16] L. Zhou Z. Zhu B. Luo Y. He R. Shu Z. Tian C. Bimetallic NiCo catalyzed enzymatic hydrolysis lignin hydrogenolysis to produce aromatic monomers Fuel 333 2023 126357 L. Zhou, Z. Zhu, B. Luo, Y. He, R. Shu, Z. Tian, C. Bimetallic NiCo catalyzed enzymatic hydrolysis lignin hydrogenolysis to produce aromatic monomers. Fuel. 333 (2023) 126357. [17] Z. Zeng J. Xie Y. Guo R. Rao B. Chen L. Cheng Y. Xie X. Ouyang Hydrogenolysis of lignin to produce aromatic monomers over Fe-Pd bimetallic catalyst supported on HZSM-5 Fuel Process. Technol. 213 2021 106713 Z. Zeng, J. Xie, Y. Guo, R. Rao, B. Chen, L. Cheng, Y. Xie, X. Ouyang, Hydrogenolysis of lignin to produce aromatic monomers over Fe-Pd bimetallic catalyst supported on HZSM-5. Fuel Process. Technol. 213 (2021) 106713. [18] C. Shen W. Li B. Zhang F. Xue X. Dou X. Zhang Valorization of lignin in native corn stover via fractionation-hydrogenolysis process over cobalt-supported catalyst without external hydrogen Mol. Catal. 514 2021 111832 C. Shen, W. Li, B. Zhang, F. Xue, X. Dou, X. Zhang. Valorization of lignin in native corn stover via fractionation-hydrogenolysis process over cobalt-supported catalyst without external hydrogen. Mol. Catal. 514 (2021) 111832. [19] Z. Luo Z. Zhang Y. Wang G. Sun H. Jiang C. Zhao Hydrothermally stable Ru/HZSM-5-catalyzed selective hydrogenolysis of lignin-derived substituted phenols to bio-arenes in water Green Chem 18 2016 5845 5858 Z. Luo, Z. Zhang, Y. Wang, G. Sun, H. Jiang, C. Zhao. Hydrothermally stable Ru/HZSM-5-catalyzed selective hydrogenolysis of lignin-derived substituted phenols to bio-arenes in water. Green Chem. 18 (2016) 5845–5858. [20] X. Wang M. Arai Q. Wu C. Zhang F. Zhao Hydrodeoxygenation of lignin-derived phenolics - a review on the active sites of supported metal catalysts Green Chem 22 2020 814 8168 X. Wang, M. Arai, Q. Wu, C. Zhang, F. Zhao Hydrodeoxygenation of lignin-derived phenolics - a review on the active sites of supported metal catalysts. Green Chem. 22 (2020) 814–8168. [21] M.M. Kumar V.S. Prabhudesai R. Vinu Lignin depolymerization to guaiacol and vanillin derivatives via catalytic transfer hydrogenolysis using pd-lewis metal oxide supported on activated carbon catalysts Mol. Catal. 549 2023 113474 M.M. Kumar, V.S. Prabhudesai, R. Vinu. Lignin depolymerization to guaiacol and vanillin derivatives via catalytic transfer hydrogenolysis using pd-lewis metal oxide supported on activated carbon catalysts. Mol. Catal. 549 (2023) 113474. [22] H Zhang S Fu Highly efficient catalytic transfer hydrogenolysis for the conversion of kraft lignin into bio-oil over heteropoly acids Green Chem 24 17 2022 6619 6630 H Zhang, S Fu. Highly efficient catalytic transfer hydrogenolysis for the conversion of kraft lignin into bio-oil over heteropoly acids. Green Chem. 24, 17 (2022) 6619–6630. [23] S. Jeong S. Yang D.H. Kim Depolymerization of Protobind lignin to produce monoaromatic compounds over Cu/ZSM-5 catalyst in supercritical ethanol Mol. Catal. 442 2017 140 146 S. Jeong, S. Yang, D.H. Kim. Depolymerization of Protobind lignin to produce monoaromatic compounds over Cu/ZSM-5 catalyst in supercritical ethanol. Mol. Catal. 442 (2017) 140–146. [24] L. Luo J. Yang G. Yao F. Jin Controlling the selectivity to chemicals from catalytic depolymerization of kraft lignin with in-situ H2 Bioresour. Technol. 264 2018 1 6 L. Luo, J. Yang, G. Yao, F. Jin. Controlling the selectivity to chemicals from catalytic depolymerization of kraft lignin with in-situ H2. Bioresour. Technol. 264 (2018) 1–6. [25] M.T. Hua J.L. Song C. Xie H.R. Wu Y. Hu X. Huang B.X. Han Ru/hydroxyapatite as a dual-functional catalyst for efficient transfer hydrogenolytic cleavage of aromatic ether bonds without additional bases Green Chem 21 2019 5073 5079 M.T. Hua, J.L. Song, C. Xie, H.R. Wu, Y. Hu, X. Huang, B.X. Han. Ru/hydroxyapatite as a dual-functional catalyst for efficient transfer hydrogenolytic cleavage of aromatic ether bonds without additional bases. Green Chem. 21 (2019) 5073–5079. [26] H. Wang Z. Li H. Yan Z. Lei J. Yan S. Ren Z. Wang S. Kang H. Catalytic hydrogenolysis of lignin and model compounds over highly dispersed Ni-Ru/Al2O3 without additional H2 Fuel 326 2022 125027 H. Wang, Z. Li, H. Yan, Z. Lei, J. Yan, S. Ren, Z. Wang, S. Kang, H. Catalytic hydrogenolysis of lignin and model compounds over highly dispersed Ni-Ru/Al2O3 without additional H2. Fuel. 326 (2022) 125027. [27] E. Paone C. Espro R. Pietropaolo F. Mauriello Selective arene production from transfer hydrogenolysis of benzyl phenyl ether promoted by a co-precipitated Pd/Fe3O4 catalyst Catal. Sci. Technol. 6 2016 7937 7941 E. Paone, C. Espro, R. Pietropaolo, F. Mauriello. Selective arene production from transfer hydrogenolysis of benzyl phenyl ether promoted by a co-precipitated Pd/Fe3O4 catalyst. Catal. Sci. Technol. 6 (2016) 7937–7941. [28] Q. Zeng Z. Du L. Luo Selective preparation of monomers from hydrotreatment of lignin using isopropanol over Ru-Pd/HZSM-5 catalysts Biomass Convers. Biorefinery. 13 2023 10701 10710 Q. Zeng, Z. Du, L. Luo. Selective preparation of monomers from hydrotreatment of lignin using isopropanol over Ru-Pd/HZSM-5 catalysts. Biomass Convers. Biorefinery. 13 (2023) 10701–10710. [29] Z. Fu Y. Zhao F. Wu J. Xie L. Qiu J. Xiao J. Liang Y. Bai F. Liu J. Cao Selective hydrogenolysis of C-O bonds in lignin model compounds and kraft lignin over highly efficient NixCoyAl catalysts Mol. Catal. 547 2023 113334 Z. Fu, Y. Zhao, F. Wu, J. Xie, L. Qiu, J. Xiao, J. Liang, Y. Bai, F. Liu, J. Cao. Selective hydrogenolysis of C-O bonds in lignin model compounds and kraft lignin over highly efficient NixCoyAl catalysts. Mol. Catal. 547 (2023) 113334. [30] T. Li H. Lin X. Ouyang X. Qiu Z. Wan In situ preparation of Ru@N-doped carbon catalyst for the hydrogenolysis of lignin to produce aromatic monomers ACS Catal 9 2019 5828 5836 T. Li, H. Lin, X. Ouyang, X. Qiu, Z. Wan. In situ preparation of Ru@N-doped carbon catalyst for the hydrogenolysis of lignin to produce aromatic monomers. ACS Catal. 9 (2019) 5828–5836. [31] H. Luo M.M. Abu-Omar Lignin extraction and catalytic upgrading from genetically modified poplar Green Chem 20 2018 745 753 H. Luo, M.M. Abu-Omar. Lignin extraction and catalytic upgrading from genetically modified poplar. Green Chem. 20 (2018) 745–753. [32] W. Xu S.J. Miller P.K. Agrawal C.W. Jones Depolymerization and hydrodeoxygenation of switchgrass lignin with formic acid ChemSusChem 5 2012 667 675 W. Xu, S.J. Miller, P.K. Agrawal, C.W. Jones. Depolymerization and hydrodeoxygenation of switchgrass lignin with formic acid. ChemSusChem. 5 (2012) 667–675. [33] G.R. Dick A.O. Komarova J.S. Luterbacher Controlling lignin solubility and hydrogenolysis selectivity by acetal-mediated functionalization Green Chem 24 2022 1285 1293 G.R. Dick, A.O. Komarova, J.S. Luterbacher. Controlling lignin solubility and hydrogenolysis selectivity by acetal-mediated functionalization. Green Chem. 24 (2022) 1285–1293. [34] Takeshi N H Kawamoto S Saka Condensation reactions of some lignin related compounds at relatively low pyrolysis temperature J. Wood Chem. Technol. 27 2 2007 121 133 N, Takeshi, H Kawamoto, S Saka. Condensation reactions of some lignin related compounds at relatively low pyrolysis temperature. J. Wood Chem. Technol. 27.2 (2007): 121–133. [35] G.P. Rizzi L, J. Boekley Observation of ether-linked phenolic products during thermal degradation of ferulic acid in the presence of alcohols J. Agric. Food Chem. 40 9 1992 1666 1670 G.P. Rizzi, and L, J. Boekley. Observation of ether-linked phenolic products during thermal degradation of ferulic acid in the presence of alcohols. J. Agric. Food Chem. 40.9 (1992): 1666–1670. [36] L. Chen S. Liu H. Pan K. Song X. Zhou J. Guo O. Zhuo J. He Naturally biodegradable polymer as an effective heterogeneous catalyst for synthesis of biofuels via Knoevenagel condensation strategy Biomass Convers. Biorefinery. 2022 1 12 L. Chen, S. Liu, H. Pan, K. Song, X. Zhou, J. Guo, O. Zhuo, J. He. Naturally biodegradable polymer as an effective heterogeneous catalyst for synthesis of biofuels via Knoevenagel condensation strategy. Biomass Convers. Biorefinery. (2022): 1–12. [37] Y. Zhu H. Wu Fang Z X. Yang K. Guo W. He Efficient and selective oxidation of 5-hydroxymethylfurfural catalyzed by metal porphyrin supported by alkaline lignin: Solvent optimization and catalyst loading Mol. Catal. 514 2021 111765 Y. Zhu, H. Wu, Z, Fang, X. Yang, K. Guo, W. He. Efficient and selective oxidation of 5-hydroxymethylfurfural catalyzed by metal porphyrin supported by alkaline lignin: Solvent optimization and catalyst loading. Mol. Catal. 514 (2021) 111765. [38] R. Shu Q. Zhang L. Ma Y. Xu P. Chen C. Wang T. Wang Insight into the solvent, temperature and time effects on the hydrogenolysis of hydrolyzed lignin Bioresour. Technol. 221 2016 568 575 R. Shu, Q. Zhang, L. Ma, Y. Xu, P. Chen, C. Wang, T. Wang. Insight into the solvent, temperature and time effects on the hydrogenolysis of hydrolyzed lignin. Bioresour. Technol. 221 (2016) 568–575. [39] S. Totong P. Daorattanachai N. Laosiripojana R. Idem Catalytic depolymerization of alkaline lignin to value-added phenolic-based compounds over Ni/CeO2-ZrO2 catalyst synthesized with a one-step chemical reduction of ni species using NaBH4 as the reducing agent Fuel Process. Technol. 198 2020 106248 S. Totong, P. Daorattanachai, N. Laosiripojana, R. Idem. Catalytic depolymerization of alkaline lignin to value-added phenolic-based compounds over Ni/CeO2-ZrO2 catalyst synthesized with a one-step chemical reduction of ni species using NaBH4 as the reducing agent. Fuel Process. Technol. 198 (2020) 106248. [40] X. Liu S. Feng Q. Fang Z. Jiang C. Hu Reductive catalytic fractionation of lignin in birch sawdust to monophenolic compounds with high selectivity Mol. Catal. 495 2020 111164 X. Liu, S. Feng, Q. Fang, Z. Jiang, C. Hu. Reductive catalytic fractionation of lignin in birch sawdust to monophenolic compounds with high selectivity. Mol. Catal. 495 (2020) 111164. [41] R. Shu Y. Xu L. Ma Q. Zhang C. Wang Y. Chen Controllable production of guaiacols and phenols from lignin depolymerization using Pd/C catalyst cooperated with metal chloride Chem. Eng J. 338 2018 457 464 R. Shu, Y. Xu, L. Ma, Q. Zhang, C. Wang, Y. Chen. Controllable production of guaiacols and phenols from lignin depolymerization using Pd/C catalyst cooperated with metal chloride. Chem. Eng J. 338 (2018) 457–464. [42] C. Dong W. Hu Y. Wang Y. Zhang G. Zhu Y. Han Double-bond equivalence linear equations for structural interpretation of fossil hydrocarbons Fuel 332 2023 126206 C. Dong, W. Hu, Y. Wang, Y. Zhang, G. Zhu, Y. Han. Double-bond equivalence linear equations for structural interpretation of fossil hydrocarbons. Fuel. 332 (2023) 126206. [43] E.A. Smith S. Park A.T. Klein Y.J. Lee Bio-oil analysis using negative electrospray ionization: comparative study of high-resolution mass spectrometers and phenolic versus sugaric components Energy Fuels 26 6 2012 3796 3802 E.A. Smith, S. Park, A.T. Klein, Y.J. Lee. Bio-oil analysis using negative electrospray ionization: comparative study of high-resolution mass spectrometers and phenolic versus sugaric components. Energy Fuels. 26.6 (2012): 3796–3802. [44] Y. Liu Q. Shi Y. Zhang Y. He K.H. Chung S. Zhao C. Xu Characterization of red pine pyrolysis bio-oil by gas chromatography–mass spectrometry and negative-ion electrospray ionization fourier transform ion cyclotron resonance mass spectrometry Energ. Fuel. 26 2012 4532 4539 Y. Liu, Q. Shi, Y. Zhang, Y. He, K.H. Chung, S. Zhao, C. Xu. Characterization of red pine pyrolysis bio-oil by gas chromatography–mass spectrometry and negative-ion electrospray ionization fourier transform ion cyclotron resonance mass spectrometry. Energ. Fuel. 26 (2012) 4532–4539. [45] H. Yan X. Liu H. Wang Z. Li H. Shui Z. Lei S. Ren Z. Wang S. Kang Valorization of lignin to phenols over highly dispersed NiRu/Al2O3 without extra H2: effect of reaction conditions and insight into the resulting phenols distributions Fuel 330 2020 125548 H. Yan, X. Liu, H. Wang, Z. Li, H. Shui, Z. Lei, S. Ren, Z. Wang, S. Kang. Valorization of lignin to phenols over highly dispersed NiRu/Al2O3 without extra H2: effect of reaction conditions and insight into the resulting phenols distributions. Fuel. 330 (2020) 125548. [46] R. Ma W. Hao X. Ma Y. Tian Y. Li Catalytic ethanolysis of kraft lignin into high-value small-molecular chemicals over a nanostructured α-molybdenum carbide catalyst Angew. Chem. Int. Ed. 53 2014 7310 7315 R. Ma, W. Hao, X. Ma, Y. Tian, Y. Li. Catalytic ethanolysis of kraft lignin into high-value small-molecular chemicals over a nanostructured α-molybdenum carbide catalyst. Angew. Chem. Int. Ed. 53 (2014) 7310–7315. [47] Q. Song F. Wang J. Cai Y. Wang J. Zhang W. Yu J. Xu Lignin depolymerization (LDP) in alcohol over nickel-based catalysts via a fragmentation-hydrogenolysis process Energy Environ. Sci. 6 2013 994 Q. Song, F. Wang, J. Cai, Y. Wang, J. Zhang, W. Yu, J. Xu. Lignin depolymerization (LDP) in alcohol over nickel-based catalysts via a fragmentation-hydrogenolysis process. Energy Environ. Sci. 6 (2013) 994. [48] C. Cheng P. Li Yu W D. Shen Gu S Catalytic hydrogenolysis of lignin in ethanol/isopropanol over an activated carbon supported nickel-copper catalyst Bioresour. Technol. 319 2021 124238 C. Cheng, P. Li, W, Yu, D. Shen, S, Gu. Catalytic hydrogenolysis of lignin in ethanol/isopropanol over an activated carbon supported nickel-copper catalyst. Bioresour. Technol. 319 (2021): 124238. [49] C. Cheng J. Truong JA. Barrett D. Shen Hydrogenolysis of organosolv lignin in ethanol/isopropanol media without added transition-metal catalyst ACS Sustain. Chem. Eng. 8 2019 1023 1030 C. Cheng, J. Truong, JA. Barrett, D. Shen. Hydrogenolysis of organosolv lignin in ethanol/isopropanol media without added transition-metal catalyst. ACS Sustain. Chem. Eng. 8 (2019): 1023–1030. [50] R. Shu J. Long Y. Xu L. Ma Q. Zhang T. Wang C. Wang Z. Yuan Q. Wu Investigation on the structural effect of lignin during the hydrogenolysis process Bioresour. Technol. 200 2016 14 22 R. Shu, J. Long, Y. Xu, L. Ma, Q. Zhang, T. Wang, C. Wang, Z. Yuan, Q. Wu. Investigation on the structural effect of lignin during the hydrogenolysis process. Bioresour. Technol. 200 (2016) 14–22. [51] T. Renders E. Cooreman S. Van den Bosch W. Schutyser S.F. Koelewijn T. Vangeel A. Deneyer G. Catalytic lignocellulose biorefining in n-butanol/water: a one-pot approach toward phenolics, polyols, and cellulose Green Chem 20 2018 4607 4619 T. Renders, E. Cooreman, S. Van den Bosch, W. Schutyser, S.F. Koelewijn, T. Vangeel, A. Deneyer, G. Catalytic lignocellulose biorefining in n-butanol/water: a one-pot approach toward phenolics, polyols, and cellulose. Green Chem. 20 (2018) 4607–4619. [52] M.M. Abu-Omar K. Barta G.T. Beckham J.S. Luterbacher J. Ralph R. Rinaldi Y. Román-Leshkov J.S.M. Samec B.F. Sels F. Wang G.C.U.S Guidelines for performing lignin-first biorefining Energy Environ. Sci. 14 2021 262 292 M.M. Abu-Omar, K. Barta, G.T. Beckham, J.S. Luterbacher, J. Ralph, R. Rinaldi, Y. Román-Leshkov, J.S.M. Samec, B.F. Sels, F. Wang, G.C.U.S. Guidelines for performing lignin-first biorefining. Energy Environ. Sci. 14 (2021) 262–292.",
      "scopus-id": "85183878478",
      "coredata": {
        "eid": "1-s2.0-S2468823124000361",
        "dc:description": "Hydrogenolysis of lignin to produce valuable aromatic chemicals under mild conditions can effectively realize the value-added utilization of lignin. In this work, catalytic transfer hydrogenolysis (CTH) of dealkaline lignin (DL) over Ni0.5Co1.5Al catalyst was studied for the production of phenolic compounds, and the reaction mechanism was elucidated through the reaction of 2-phenoxy-1-phenylethanol (PPE) in deuterated isopropanol (CD3CD(OD)CD3) and D2. Moreover, we investigated the CTH behaviors of various lignin including organic solvents lignin in birch (OL), acidic solvents lignin in birch (AL) and birch powder (BW) to explore the suitability of the Ni0.5Co1.5Al catalyst. The results showed that Ni0.5Co1.5Al was able to catalyze the hydrogenolysis of various lignin into phenolic monomers using isopropanol as an in-situ hydrogen source. Under optimized conditions, the hydrogenolysis of DL over Ni0.5Co1.5Al achieved 43.30 wt% lignin oil yield. The experimental results of isotope labeling experiments exhibited that the active hydrogen generated by isopropanol is used for the cleavage of C-O bonds, and the electronic interactions between Ni and Co promotes the C-O bonds breaking. Isopropanol can not only be a hydrogen donor, but also act as a reaction solvent to stabilize intermediates and enhance the yield of phenolic compounds in the lignin CTH process.",
        "openArchiveArticle": "false",
        "prism:coverDate": "2024-02-15",
        "openaccessUserLicense": null,
        "prism:aggregationType": "Journal",
        "prism:url": "https://api.elsevier.com/content/article/pii/S2468823124000361",
        "dc:creator": [
          {
            "@_fa": "true",
            "$": "Fu, Zong-Pin"
          },
          {
            "@_fa": "true",
            "$": "Qiu, Le-Le"
          },
          {
            "@_fa": "true",
            "$": "Zhao, Yun-Peng"
          },
          {
            "@_fa": "true",
            "$": "Wu, Fa-Peng"
          },
          {
            "@_fa": "true",
            "$": "Xie, Jin-Xuan"
          },
          {
            "@_fa": "true",
            "$": "Xiao, Jian"
          },
          {
            "@_fa": "true",
            "$": "Liang, Jing"
          },
          {
            "@_fa": "true",
            "$": "Li, Jian"
          },
          {
            "@_fa": "true",
            "$": "Liu, Fang-Jing"
          },
          {
            "@_fa": "true",
            "$": "Cao, Jing-Pei"
          }
        ],
        "link": [
          {
            "@_fa": "true",
            "@rel": "self",
            "@href": "https://api.elsevier.com/content/article/pii/S2468823124000361"
          },
          {
            "@_fa": "true",
            "@rel": "scidir",
            "@href": "https://www.sciencedirect.com/science/article/pii/S2468823124000361"
          }
        ],
        "dc:format": "application/json",
        "openaccessType": null,
        "pii": "S2468-8231(24)00036-1",
        "prism:volume": "555",
        "articleNumber": "113853",
        "prism:publisher": "Elsevier B.V.",
        "dc:title": "In-situ transfer hydrogenolysis of lignin into phenolic monomers over Ni0.5Co1.5Al catalyst",
        "prism:copyright": "© 2024 Elsevier B.V. All rights reserved.",
        "openaccess": "0",
        "prism:issn": "24688231",
        "dcterms:subject": [
          {
            "@_fa": "true",
            "$": "Lignin"
          },
          {
            "@_fa": "true",
            "$": "NiCoAl catalyst"
          },
          {
            "@_fa": "true",
            "$": "Hydrogenolysis"
          },
          {
            "@_fa": "true",
            "$": "Isopropanol"
          },
          {
            "@_fa": "true",
            "$": "Phenolic compounds"
          }
        ],
        "openaccessArticle": "false",
        "prism:publicationName": "Molecular Catalysis",
        "openaccessSponsorType": null,
        "prism:pageRange": "113853",
        "pubType": "fla",
        "prism:coverDisplayDate": "15 February 2024",
        "prism:doi": "10.1016/j.mcat.2024.113853",
        "prism:startingPage": "113853",
        "dc:identifier": "doi:10.1016/j.mcat.2024.113853",
        "openaccessSponsorName": null
      },
      "objects": {
        "object": [
          {
            "@category": "standard",
            "@height": "200",
            "@width": "328",
            "@_fa": "true",
            "$": "https://api.elsevier.com/content/object/eid/1-s2.0-S2468823124000361-ga1.jpg?httpAccept=%2A%2F%2A",
            "@multimediatype": "JPEG image file",
            "@type": "IMAGE-DOWNSAMPLED",
            "@size": "29959",
            "@ref": "ga1",
            "@mimetype": "image/jpeg"
          },
          {
            "@category": "standard",
            "@height": "620",
            "@width": "715",
            "@_fa": "true",
            "$": "https://api.elsevier.com/content/object/eid/1-s2.0-S2468823124000361-gr6.jpg?httpAccept=%2A%2F%2A",
            "@multimediatype": "JPEG image file",
            "@type": "IMAGE-DOWNSAMPLED",
            "@size": "122266",
            "@ref": "gr6",
            "@mimetype": "image/jpeg"
          },
          {
            "@category": "standard",
            "@height": "242",
            "@width": "715",
            "@_fa": "true",
            "$": "https://api.elsevier.com/content/object/eid/1-s2.0-S2468823124000361-gr2.jpg?httpAccept=%2A%2F%2A",
            "@multimediatype": "JPEG image file",
            "@type": "IMAGE-DOWNSAMPLED",
            "@size": "46083",
            "@ref": "gr2",
            "@mimetype": "image/jpeg"
          },
          {
            "@category": "standard",
            "@height": "393",
            "@width": "715",
            "@_fa": "true",
            "$": "https://api.elsevier.com/content/object/eid/1-s2.0-S2468823124000361-gr3.jpg?httpAccept=%2A%2F%2A",
            "@multimediatype": "JPEG image file",
            "@type": "IMAGE-DOWNSAMPLED",
            "@size": "50849",
            "@ref": "gr3",
            "@mimetype": "image/jpeg"
          },
          {
            "@category": "standard",
            "@height": "283",
            "@width": "678",
            "@_fa": "true",
            "$": "https://api.elsevier.com/content/object/eid/1-s2.0-S2468823124000361-gr4.jpg?httpAccept=%2A%2F%2A",
            "@multimediatype": "JPEG image file",
            "@type": "IMAGE-DOWNSAMPLED",
            "@size": "72333",
            "@ref": "gr4",
            "@mimetype": "image/jpeg"
          },
          {
            "@category": "standard",
            "@height": "270",
            "@width": "678",
            "@_fa": "true",
            "$": "https://api.elsevier.com/content/object/eid/1-s2.0-S2468823124000361-gr5.jpg?httpAccept=%2A%2F%2A",
            "@multimediatype": "JPEG image file",
            "@type": "IMAGE-DOWNSAMPLED",
            "@size": "34715",
            "@ref": "gr5",
            "@mimetype": "image/jpeg"
          },
          {
            "@category": "standard",
            "@height": "282",
            "@width": "742",
            "@_fa": "true",
            "$": "https://api.elsevier.com/content/object/eid/1-s2.0-S2468823124000361-sc3.jpg?httpAccept=%2A%2F%2A",
            "@multimediatype": "JPEG image file",
            "@type": "IMAGE-DOWNSAMPLED",
            "@size": "45604",
            "@ref": "sc3",
            "@mimetype": "image/jpeg"
          },
          {
            "@category": "standard",
            "@height": "226",
            "@width": "489",
            "@_fa": "true",
            "$": "https://api.elsevier.com/content/object/eid/1-s2.0-S2468823124000361-sc4.jpg?httpAccept=%2A%2F%2A",
            "@multimediatype": "JPEG image file",
            "@type": "IMAGE-DOWNSAMPLED",
            "@size": "30099",
            "@ref": "sc4",
            "@mimetype": "image/jpeg"
          },
          {
            "@category": "standard",
            "@height": "407",
            "@width": "678",
            "@_fa": "true",
            "$": "https://api.elsevier.com/content/object/eid/1-s2.0-S2468823124000361-sc5.jpg?httpAccept=%2A%2F%2A",
            "@multimediatype": "JPEG image file",
            "@type": "IMAGE-DOWNSAMPLED",
            "@size": "79026",
            "@ref": "sc5",
            "@mimetype": "image/jpeg"
          },
          {
            "@category": "standard",
            "@height": "266",
            "@width": "678",
            "@_fa": "true",
            "$": "https://api.elsevier.com/content/object/eid/1-s2.0-S2468823124000361-gr1.jpg?httpAccept=%2A%2F%2A",
            "@multimediatype": "JPEG image file",
            "@type": "IMAGE-DOWNSAMPLED",
            "@size": "45186",
            "@ref": "gr1",
            "@mimetype": "image/jpeg"
          },
          {
            "@category": "standard",
            "@height": "298",
            "@width": "602",
            "@_fa": "true",
            "$": "https://api.elsevier.com/content/object/eid/1-s2.0-S2468823124000361-sc1.jpg?httpAccept=%2A%2F%2A",
            "@multimediatype": "JPEG image file",
            "@type": "IMAGE-DOWNSAMPLED",
            "@size": "49343",
            "@ref": "sc1",
            "@mimetype": "image/jpeg"
          },
          {
            "@category": "standard",
            "@height": "325",
            "@width": "395",
            "@_fa": "true",
            "$": "https://api.elsevier.com/content/object/eid/1-s2.0-S2468823124000361-sc2.jpg?httpAccept=%2A%2F%2A",
            "@multimediatype": "JPEG image file",
            "@type": "IMAGE-DOWNSAMPLED",
            "@size": "35525",
            "@ref": "sc2",
            "@mimetype": "image/jpeg"
          },
          {
            "@category": "thumbnail",
            "@height": "134",
            "@width": "219",
            "@_fa": "true",
            "$": "https://api.elsevier.com/content/object/eid/1-s2.0-S2468823124000361-ga1.sml?httpAccept=%2A%2F%2A",
            "@multimediatype": "GIF image file",
            "@type": "IMAGE-THUMBNAIL",
            "@size": "21213",
            "@ref": "ga1",
            "@mimetype": "image/gif"
          },
          {
            "@category": "thumbnail",
            "@height": "164",
            "@width": "189",
            "@_fa": "true",
            "$": "https://api.elsevier.com/content/object/eid/1-s2.0-S2468823124000361-gr6.sml?httpAccept=%2A%2F%2A",
            "@multimediatype": "GIF image file",
            "@type": "IMAGE-THUMBNAIL",
            "@size": "12834",
            "@ref": "gr6",
            "@mimetype": "image/gif"
          },
          {
            "@category": "thumbnail",
            "@height": "74",
            "@width": "219",
            "@_fa": "true",
            "$": "https://api.elsevier.com/content/object/eid/1-s2.0-S2468823124000361-gr2.sml?httpAccept=%2A%2F%2A",
            "@multimediatype": "GIF image file",
            "@type": "IMAGE-THUMBNAIL",
            "@size": "7972",
            "@ref": "gr2",
            "@mimetype": "image/gif"
          },
          {
            "@category": "thumbnail",
            "@height": "120",
            "@width": "219",
            "@_fa": "true",
            "$": "https://api.elsevier.com/content/object/eid/1-s2.0-S2468823124000361-gr3.sml?httpAccept=%2A%2F%2A",
            "@multimediatype": "GIF image file",
            "@type": "IMAGE-THUMBNAIL",
            "@size": "7374",
            "@ref": "gr3",
            "@mimetype": "image/gif"
          },
          {
            "@category": "thumbnail",
            "@height": "91",
            "@width": "219",
            "@_fa": "true",
            "$": "https://api.elsevier.com/content/object/eid/1-s2.0-S2468823124000361-gr4.sml?httpAccept=%2A%2F%2A",
            "@multimediatype": "GIF image file",
            "@type": "IMAGE-THUMBNAIL",
            "@size": "11768",
            "@ref": "gr4",
            "@mimetype": "image/gif"
          },
          {
            "@category": "thumbnail",
            "@height": "87",
            "@width": "219",
            "@_fa": "true",
            "$": "https://api.elsevier.com/content/object/eid/1-s2.0-S2468823124000361-gr5.sml?httpAccept=%2A%2F%2A",
            "@multimediatype": "GIF image file",
            "@type": "IMAGE-THUMBNAIL",
            "@size": "6175",
            "@ref": "gr5",
            "@mimetype": "image/gif"
          },
          {
            "@category": "thumbnail",
            "@height": "83",
            "@width": "219",
            "@_fa": "true",
            "$": "https://api.elsevier.com/content/object/eid/1-s2.0-S2468823124000361-sc3.sml?httpAccept=%2A%2F%2A",
            "@multimediatype": "GIF image file",
            "@type": "IMAGE-THUMBNAIL",
            "@size": "7370",
            "@ref": "sc3",
            "@mimetype": "image/gif"
          },
          {
            "@category": "thumbnail",
            "@height": "101",
            "@width": "219",
            "@_fa": "true",
            "$": "https://api.elsevier.com/content/object/eid/1-s2.0-S2468823124000361-sc4.sml?httpAccept=%2A%2F%2A",
            "@multimediatype": "GIF image file",
            "@type": "IMAGE-THUMBNAIL",
            "@size": "6666",
            "@ref": "sc4",
            "@mimetype": "image/gif"
          },
          {
            "@category": "thumbnail",
            "@height": "132",
            "@width": "219",
            "@_fa": "true",
            "$": "https://api.elsevier.com/content/object/eid/1-s2.0-S2468823124000361-sc5.sml?httpAccept=%2A%2F%2A",
            "@multimediatype": "GIF image file",
            "@type": "IMAGE-THUMBNAIL",
            "@size": "10513",
            "@ref": "sc5",
            "@mimetype": "image/gif"
          },
          {
            "@category": "thumbnail",
            "@height": "86",
            "@width": "219",
            "@_fa": "true",
            "$": "https://api.elsevier.com/content/object/eid/1-s2.0-S2468823124000361-gr1.sml?httpAccept=%2A%2F%2A",
            "@multimediatype": "GIF image file",
            "@type": "IMAGE-THUMBNAIL",
            "@size": "9324",
            "@ref": "gr1",
            "@mimetype": "image/gif"
          },
          {
            "@category": "thumbnail",
            "@height": "109",
            "@width": "219",
            "@_fa": "true",
            "$": "https://api.elsevier.com/content/object/eid/1-s2.0-S2468823124000361-sc1.sml?httpAccept=%2A%2F%2A",
            "@multimediatype": "GIF image file",
            "@type": "IMAGE-THUMBNAIL",
            "@size": "14148",
            "@ref": "sc1",
            "@mimetype": "image/gif"
          },
          {
            "@category": "thumbnail",
            "@height": "164",
            "@width": "199",
            "@_fa": "true",
            "$": "https://api.elsevier.com/content/object/eid/1-s2.0-S2468823124000361-sc2.sml?httpAccept=%2A%2F%2A",
            "@multimediatype": "GIF image file",
            "@type": "IMAGE-THUMBNAIL",
            "@size": "14087",
            "@ref": "sc2",
            "@mimetype": "image/gif"
          },
          {
            "@category": "high",
            "@height": "886",
            "@width": "1453",
            "@_fa": "true",
            "$": "https://api.elsevier.com/content/object/eid/1-s2.0-S2468823124000361-ga1_lrg.jpg?httpAccept=%2A%2F%2A",
            "@multimediatype": "JPEG image file",
            "@type": "IMAGE-HIGH-RES",
            "@size": "266924",
            "@ref": "ga1",
            "@mimetype": "image/jpeg"
          },
          {
            "@category": "high",
            "@height": "2748",
            "@width": "3167",
            "@_fa": "true",
            "$": "https://api.elsevier.com/content/object/eid/1-s2.0-S2468823124000361-gr6_lrg.jpg?httpAccept=%2A%2F%2A",
            "@multimediatype": "JPEG image file",
            "@type": "IMAGE-HIGH-RES",
            "@size": "915159",
            "@ref": "gr6",
            "@mimetype": "image/jpeg"
          },
          {
            "@category": "high",
            "@height": "1073",
            "@width": "3167",
            "@_fa": "true",
            "$": "https://api.elsevier.com/content/object/eid/1-s2.0-S2468823124000361-gr2_lrg.jpg?httpAccept=%2A%2F%2A",
            "@multimediatype": "JPEG image file",
            "@type": "IMAGE-HIGH-RES",
            "@size": "278950",
            "@ref": "gr2",
            "@mimetype": "image/jpeg"
          },
          {
            "@category": "high",
            "@height": "1739",
            "@width": "3167",
            "@_fa": "true",
            "$": "https://api.elsevier.com/content/object/eid/1-s2.0-S2468823124000361-gr3_lrg.jpg?httpAccept=%2A%2F%2A",
            "@multimediatype": "JPEG image file",
            "@type": "IMAGE-HIGH-RES",
            "@size": "342341",
            "@ref": "gr3",
            "@mimetype": "image/jpeg"
          },
          {
            "@category": "high",
            "@height": "1251",
            "@width": "3000",
            "@_fa": "true",
            "$": "https://api.elsevier.com/content/object/eid/1-s2.0-S2468823124000361-gr4_lrg.jpg?httpAccept=%2A%2F%2A",
            "@multimediatype": "JPEG image file",
            "@type": "IMAGE-HIGH-RES",
            "@size": "540949",
            "@ref": "gr4",
            "@mimetype": "image/jpeg"
          },
          {
            "@category": "high",
            "@height": "1193",
            "@width": "3000",
            "@_fa": "true",
            "$": "https://api.elsevier.com/content/object/eid/1-s2.0-S2468823124000361-gr5_lrg.jpg?httpAccept=%2A%2F%2A",
            "@multimediatype": "JPEG image file",
            "@type": "IMAGE-HIGH-RES",
            "@size": "194059",
            "@ref": "gr5",
            "@mimetype": "image/jpeg"
          },
          {
            "@category": "high",
            "@height": "1250",
            "@width": "3286",
            "@_fa": "true",
            "$": "https://api.elsevier.com/content/object/eid/1-s2.0-S2468823124000361-sc3_lrg.jpg?httpAccept=%2A%2F%2A",
            "@multimediatype": "JPEG image file",
            "@type": "IMAGE-HIGH-RES",
            "@size": "372201",
            "@ref": "sc3",
            "@mimetype": "image/jpeg"
          },
          {
            "@category": "high",
            "@height": "1001",
            "@width": "2167",
            "@_fa": "true",
            "$": "https://api.elsevier.com/content/object/eid/1-s2.0-S2468823124000361-sc4_lrg.jpg?httpAccept=%2A%2F%2A",
            "@multimediatype": "JPEG image file",
            "@type": "IMAGE-HIGH-RES",
            "@size": "200810",
            "@ref": "sc4",
            "@mimetype": "image/jpeg"
          },
          {
            "@category": "high",
            "@height": "1802",
            "@width": "3000",
            "@_fa": "true",
            "$": "https://api.elsevier.com/content/object/eid/1-s2.0-S2468823124000361-sc5_lrg.jpg?httpAccept=%2A%2F%2A",
            "@multimediatype": "JPEG image file",
            "@type": "IMAGE-HIGH-RES",
            "@size": "521372",
            "@ref": "sc5",
            "@mimetype": "image/jpeg"
          },
          {
            "@category": "high",
            "@height": "1179",
            "@width": "3000",
            "@_fa": "true",
            "$": "https://api.elsevier.com/content/object/eid/1-s2.0-S2468823124000361-gr1_lrg.jpg?httpAccept=%2A%2F%2A",
            "@multimediatype": "JPEG image file",
            "@type": "IMAGE-HIGH-RES",
            "@size": "342204",
            "@ref": "gr1",
            "@mimetype": "image/jpeg"
          },
          {
            "@category": "high",
            "@height": "1322",
            "@width": "2667",
            "@_fa": "true",
            "$": "https://api.elsevier.com/content/object/eid/1-s2.0-S2468823124000361-sc1_lrg.jpg?httpAccept=%2A%2F%2A",
            "@multimediatype": "JPEG image file",
            "@type": "IMAGE-HIGH-RES",
            "@size": "347328",
            "@ref": "sc1",
            "@mimetype": "image/jpeg"
          },
          {
            "@category": "high",
            "@height": "1439",
            "@width": "1750",
            "@_fa": "true",
            "$": "https://api.elsevier.com/content/object/eid/1-s2.0-S2468823124000361-sc2_lrg.jpg?httpAccept=%2A%2F%2A",
            "@multimediatype": "JPEG image file",
            "@type": "IMAGE-HIGH-RES",
            "@size": "253882",
            "@ref": "sc2",
            "@mimetype": "image/jpeg"
          },
          {
            "@category": "standard",
            "@_fa": "true",
            "$": "https://api.elsevier.com/content/object/eid/1-s2.0-S2468823124000361-mmc1.docx?httpAccept=%2A%2F%2A",
            "@multimediatype": "Microsoft Word file",
            "@type": "APPLICATION",
            "@size": "1869801",
            "@ref": "mmc1",
            "@mimetype": "application/word"
          },
          {
            "@category": "thumbnail",
            "@_fa": "true",
            "$": "https://api.elsevier.com/content/object/eid/1-s2.0-S2468823124000361-si1.svg?httpAccept=%2A%2F%2A",
            "@multimediatype": "Scalable Vector Graphics file",
            "@type": "ALTIMG",
            "@size": "7106",
            "@ref": "si1",
            "@mimetype": "image/svg+xml"
          },
          {
            "@category": "standard",
            "@_fa": "true",
            "$": "https://api.elsevier.com/content/object/eid/1-s2.0-S2468823124000361-am.pdf?httpAccept=%2A%2F%2A",
            "@multimediatype": "Acrobat PDF file",
            "@type": "AAM-PDF",
            "@size": "1531452",
            "@ref": "am",
            "@mimetype": "application/pdf"
          }
        ]
      },
      "link": {
        "@rel": "abstract",
        "@href": "https://api.elsevier.com/content/abstract/scopus_id/85183878478"
      }
    }
  }
}