{
  "metadata": {
    "title": "Theoretical investigation on conversion of CO<ce:inf loc=post>2</ce:inf> with epoxides to cyclic carbonates by bifunctional metal-salen complexes bearing ionic liquid substsituents",
    "authors": "; ",
    "journal": "Molecular Catalysis",
    "date": "2021-07-31",
    "doi": "10.1016/j.mcat.2021.111733",
    "abstract": "",
    "uri": "https://api.elsevier.com/content/article/pii/S2468823121003503",
    "pii": "S2468823121003503"
  },
  "fulltext": {
    "full-text-retrieval-response": {
      "scopus-eid": "2-s2.0-85110178619",
      "originalText": "serial JL 315758 291210 291744 291790 291809 31 Molecular Catalysis MOLECULARCATALYSIS 2021-07-15 2021-07-15 2021-07-15 2021-07-15 2021-09-21T23:55:52 1-s2.0-S2468823121003503 S2468-8231(21)00350-3 S2468823121003503 10.1016/j.mcat.2021.111733 S300 S300.1 FULL-TEXT 1-s2.0-S2468823121X00119 2022-12-12T23:36:21.627889Z 0 0 20210701 20210731 2021 2021-07-15T18:26:15.818841Z absattachment articleinfo articlenumber articletitlenorm authfirstinitialnorm authfirstsurnamenorm cid cids contenttype copyright crossmark dateloaded dateloadedtxt datesearch datesort dateupdated dco docsubtype doctype doi eid ewtransactionid hubeid indexeddate issn issnnorm itemstage itemtransactionid itemweight openaccess openarchive pg pgfirst pii piinorm pubdateend pubdatestart pubdatetxt pubyr sectiontitle sortorder srctitle srctitlenorm srctype ssids alllist content subj subheadings suppl tomb volfirst volissue volumelist webpdf webpdfpagecount yearnav figure table e-component body acknowledge affil appendices articletitle auth authfirstini authfull authkeywords authlast grantnumber grantsponsor grantsponsorid highlightsabst primabst ref specialabst 2468-8231 24688231 true 511 511 C Volume 511 17 111733 111733 111733 202107 July 2021 2021-07-01 2021-07-31 2021 Regular Papers article fla © 2021 Published by Elsevier B.V. THEORETICALINVESTIGATIONCONVERSIONCO2EPOXIDESCYCLICCARBONATESBYBIFUNCTIONALMETALSALENCOMPLEXESBEARINGIONICLIQUIDSUBSTSITUENTS YANG H 1 Introduction 2 Models and computational details 3 Results and discussion 3.1 Active site 3.2 Favorable pathway catalyzed by Al-salen-Py 3.3 Effect of nonfunctionalized IL substituents 3.4 Effect of hydroxyl and amino functionalized ILs substituents 3.5 Effects of the substrate epoxides 3.6 Effects of the metal center in the salen complexes 3.7 Comparison of Co-salen complexes and Al-salen complexes 4 Conclusions CRediT authorship contribution statement Acknowledgements Appendix Supplementary materials References BUI 2018 1062 1176 M GRIM 2020 472 494 R JIANG 2020 7984 8034 X DAS 2020 2937 3004 S GRIGNARD 2019 4466 4514 B ARESTA 2014 1709 1742 M KAR 2019 2892 2903 S XU 2015 108 122 B FIORANI 2015 1375 1389 G SONG 2017 3707 3728 Q LU 2012 1462 1484 X MAEDA 2014 1482 1497 C ALVES 2017 2651 2684 M DARENSBOURG 2007 2388 2410 D TIAN 2012 2029 2035 D NORTH 2015 3398 3402 M CASTROOSMA 2016 5012 5025 J HATAZAWA 2016 13677 13681 M THEVENON 2018 6893 6903 A NG 2019 1549 1554 C WANG 2012 1480 1484 J ALASSMY 2019 3856 3863 Y CUI 2020 180 187 C BAHADORI 2020 8716 8725 M PAL 2020 213173 213217 T GUO 2020 9935 9947 F KLAUS 2011 1460 1479 S LI 2020 609 618 J CHO 2020 788 794 K MIAO 2008 236 241 C CHANG 2009 379 383 T REN 2009 11509 11518 W DECORTES 2010 9822 9837 A SUN 2011 502 507 J NORTH 2011 1685 1693 M REN 2014 9771 9777 W AN 2015 4969 4978 Q LANG 2016 208 215 X EMA 2014 15270 15279 T MA 2012 2410 2420 J STEPHENS 1994 11623 11627 P GOERIGK 2017 32184 32215 L HEHRE 1972 2257 2261 W FRISCH 2016 M FRISCH 1984 3265 3269 M HARIHARAN 1973 213 222 P FUKUI 1981 363 368 K WEIGEND 2005 3297 3305 F MARENICH 2009 6378 6396 A LU 2012 580 592 T LEGAULT 2009 C CYLVIEW10B DALTERIO 2020 2221 2225 M DALTERIO 2021 1611 1614 M UHE 2011 978 985 A KOZUCH 2011 101 110 S KOZUCH 2006 3355 3365 S SUN 2008 3588 3591 J YANG 2016 7773 7782 H DUAN 2019 4723 4731 R LIU 2020 4509 4515 J MONICA 2020 3483 3501 F YANGX2021X111733 YANGX2021X111733XH 2023-07-15T00:00:00.000Z 2023-07-15T00:00:00.000Z http://creativecommons.org/licenses/by-nc-nd/4.0/ © 2021 Published by Elsevier B.V. 2021-07-20T00:55:44.640Z http://vtw.elsevier.com/data/voc/AddOnTypes/50.7/aggregated-refined National Natural Science Foundation of China 21773105 NSFC National Natural Science Foundation of China http://data.elsevier.com/vocabulary/SciValFunders/501100001809 http://sws.geonames.org/1814991/ Nanjing University NJU Nanjing University http://data.elsevier.com/vocabulary/SciValFunders/501100008048 http://sws.geonames.org/1814991/ National Key Research and Development Program of China 2017YFB0702800 NKRDPC National Key Research and Development Program of China http://data.elsevier.com/vocabulary/SciValFunders/501100012166 http://sws.geonames.org/1814991/ Financial support from the National Key Research and Development Program of China 2017YFB0702800 and the National Natural Science Foundation of China No. 21773105 are acknowledged. Calculations were carried out at the high-performance computing center of Nanjing University. Financial support from the National Key Research and Development Program of China 2017YFB0702800 and the National Natural Science Foundation of China No. 21773105 are acknowledged. Calculations were carried out at the high-performance computing center of Nanjing University. 0 https://doi.org/10.15223/policy-017 https://doi.org/10.15223/policy-037 https://doi.org/10.15223/policy-012 https://doi.org/10.15223/policy-029 https://doi.org/10.15223/policy-004 item S2468-8231(21)00350-3 S2468823121003503 1-s2.0-S2468823121003503 10.1016/j.mcat.2021.111733 315758 2021-09-21T23:13:22.409977Z 2021-07-01 2021-07-31 1-s2.0-S2468823121003503-main.pdf https://s3-eu-west-1.amazonaws.com/prod-ucs-content-store-eu-west/content/pii:S2468823121003503/MAIN/application/pdf/26b93704dda628713a1de6d766393635/main.pdf main.pdf pdf true 3209595 MAIN 8 1-s2.0-S2468823121003503-main_1.png https://s3-eu-west-1.amazonaws.com/prod-ucs-content-store-eu-west/content/pii:S2468823121003503/PREVIEW/image/png/214ed84d7b984130dc51d772ba7f8631/main_1.png main_1.png png 56998 849 656 IMAGE-WEB-PDF 1 1-s2.0-S2468823121003503-gr6.jpg https://s3-eu-west-1.amazonaws.com/prod-ucs-content-store-eu-west/content/pii:S2468823121003503/gr6/DOWNSAMPLED/image/jpeg/f7ca1c261df1e114e97249908def84ee/gr6.jpg gr6 gr6.jpg jpg 22207 309 376 IMAGE-DOWNSAMPLED 1-s2.0-S2468823121003503-gr4.jpg https://s3-eu-west-1.amazonaws.com/prod-ucs-content-store-eu-west/content/pii:S2468823121003503/gr4/DOWNSAMPLED/image/jpeg/6e58c6bc0fddfd767cf0de5670f6148d/gr4.jpg gr4 gr4.jpg jpg 39745 343 376 IMAGE-DOWNSAMPLED 1-s2.0-S2468823121003503-gr5.jpg https://s3-eu-west-1.amazonaws.com/prod-ucs-content-store-eu-west/content/pii:S2468823121003503/gr5/DOWNSAMPLED/image/jpeg/9c9740022746fb9f5173be43066c3728/gr5.jpg gr5 gr5.jpg jpg 45648 316 376 IMAGE-DOWNSAMPLED 1-s2.0-S2468823121003503-gr2.jpg https://s3-eu-west-1.amazonaws.com/prod-ucs-content-store-eu-west/content/pii:S2468823121003503/gr2/DOWNSAMPLED/image/jpeg/a1d43522d425539812c8c2cc49f2704d/gr2.jpg gr2 gr2.jpg jpg 38193 324 376 IMAGE-DOWNSAMPLED 1-s2.0-S2468823121003503-gr3.jpg https://s3-eu-west-1.amazonaws.com/prod-ucs-content-store-eu-west/content/pii:S2468823121003503/gr3/DOWNSAMPLED/image/jpeg/9524c3c9c1b5fa9219cb8037c8f9fd07/gr3.jpg gr3 gr3.jpg jpg 40129 312 376 IMAGE-DOWNSAMPLED 1-s2.0-S2468823121003503-gr1.jpg https://s3-eu-west-1.amazonaws.com/prod-ucs-content-store-eu-west/content/pii:S2468823121003503/gr1/DOWNSAMPLED/image/jpeg/8d6f0c6438ba30ac94203dc2421f9335/gr1.jpg gr1 gr1.jpg jpg 44792 330 386 IMAGE-DOWNSAMPLED 1-s2.0-S2468823121003503-fx5.jpg https://s3-eu-west-1.amazonaws.com/prod-ucs-content-store-eu-west/content/pii:S2468823121003503/fx5/DOWNSAMPLED/image/jpeg/98f2f003b26abece5edf02d263b3f79e/fx5.jpg fx5 fx5.jpg jpg 882 34 40 IMAGE-DOWNSAMPLED 1-s2.0-S2468823121003503-fx6.jpg https://s3-eu-west-1.amazonaws.com/prod-ucs-content-store-eu-west/content/pii:S2468823121003503/fx6/DOWNSAMPLED/image/jpeg/212df10af035e48fcce3a51311922e52/fx6.jpg fx6 fx6.jpg jpg 783 23 38 IMAGE-DOWNSAMPLED 1-s2.0-S2468823121003503-sc1.jpg https://s3-eu-west-1.amazonaws.com/prod-ucs-content-store-eu-west/content/pii:S2468823121003503/sc1/DOWNSAMPLED/image/jpeg/c77d2a9f807b65d040bb5887f9c1c84b/sc1.jpg sc1 sc1.jpg jpg 29802 321 470 IMAGE-DOWNSAMPLED 1-s2.0-S2468823121003503-fx3.jpg https://s3-eu-west-1.amazonaws.com/prod-ucs-content-store-eu-west/content/pii:S2468823121003503/fx3/DOWNSAMPLED/image/jpeg/45f2a5a459490a2969d03acde481ddb5/fx3.jpg fx3 fx3.jpg jpg 1109 42 34 IMAGE-DOWNSAMPLED 1-s2.0-S2468823121003503-sc2.jpg https://s3-eu-west-1.amazonaws.com/prod-ucs-content-store-eu-west/content/pii:S2468823121003503/sc2/DOWNSAMPLED/image/jpeg/a8a536663e77e6bb9bd894d0eeaf4e17/sc2.jpg sc2 sc2.jpg jpg 103054 449 715 IMAGE-DOWNSAMPLED 1-s2.0-S2468823121003503-fx4.jpg https://s3-eu-west-1.amazonaws.com/prod-ucs-content-store-eu-west/content/pii:S2468823121003503/fx4/DOWNSAMPLED/image/jpeg/9da3dffc21d3df18108728d26f1d2a7e/fx4.jpg fx4 fx4.jpg jpg 1168 38 52 IMAGE-DOWNSAMPLED 1-s2.0-S2468823121003503-fx1.jpg https://s3-eu-west-1.amazonaws.com/prod-ucs-content-store-eu-west/content/pii:S2468823121003503/fx1/DOWNSAMPLED/image/jpeg/6debee41f646d7f80201119050ce2b76/fx1.jpg fx1 fx1.jpg jpg 763 26 35 IMAGE-DOWNSAMPLED 1-s2.0-S2468823121003503-fx2.jpg https://s3-eu-west-1.amazonaws.com/prod-ucs-content-store-eu-west/content/pii:S2468823121003503/fx2/DOWNSAMPLED/image/jpeg/394be929a9ebb7c4f8a84245a75873dc/fx2.jpg fx2 fx2.jpg jpg 653 20 24 IMAGE-DOWNSAMPLED 1-s2.0-S2468823121003503-ga1.jpg https://s3-eu-west-1.amazonaws.com/prod-ucs-content-store-eu-west/content/pii:S2468823121003503/ga1/DOWNSAMPLED/image/jpeg/1a5edd868fbee129e0120c85f91938cb/ga1.jpg ga1 true ga1.jpg jpg 24047 185 301 IMAGE-DOWNSAMPLED 1-s2.0-S2468823121003503-gr6.sml https://s3-eu-west-1.amazonaws.com/prod-ucs-content-store-eu-west/content/pii:S2468823121003503/gr6/THUMBNAIL/image/gif/92be7e2c8f14fe847d19e558a3dff4dd/gr6.sml gr6 gr6.sml sml 7507 164 200 IMAGE-THUMBNAIL 1-s2.0-S2468823121003503-gr4.sml https://s3-eu-west-1.amazonaws.com/prod-ucs-content-store-eu-west/content/pii:S2468823121003503/gr4/THUMBNAIL/image/gif/a836d53c5bc7832f414cca4971aa958d/gr4.sml gr4 gr4.sml sml 11735 163 179 IMAGE-THUMBNAIL 1-s2.0-S2468823121003503-gr5.sml https://s3-eu-west-1.amazonaws.com/prod-ucs-content-store-eu-west/content/pii:S2468823121003503/gr5/THUMBNAIL/image/gif/940e2484e6e3931a299dafcb2ced9e85/gr5.sml gr5 gr5.sml sml 13846 164 195 IMAGE-THUMBNAIL 1-s2.0-S2468823121003503-gr2.sml https://s3-eu-west-1.amazonaws.com/prod-ucs-content-store-eu-west/content/pii:S2468823121003503/gr2/THUMBNAIL/image/gif/08d727a1c44dfadb2ed3c988616eb51d/gr2.sml gr2 gr2.sml sml 12203 164 190 IMAGE-THUMBNAIL 1-s2.0-S2468823121003503-gr3.sml https://s3-eu-west-1.amazonaws.com/prod-ucs-content-store-eu-west/content/pii:S2468823121003503/gr3/THUMBNAIL/image/gif/29d15d9840bdcb9e2e131ac2e21d1dca/gr3.sml gr3 gr3.sml sml 13220 164 198 IMAGE-THUMBNAIL 1-s2.0-S2468823121003503-gr1.sml https://s3-eu-west-1.amazonaws.com/prod-ucs-content-store-eu-west/content/pii:S2468823121003503/gr1/THUMBNAIL/image/gif/ce2e923e5ae41e887c306ccd423adc4c/gr1.sml gr1 gr1.sml sml 11314 164 192 IMAGE-THUMBNAIL 1-s2.0-S2468823121003503-fx5.sml https://s3-eu-west-1.amazonaws.com/prod-ucs-content-store-eu-west/content/pii:S2468823121003503/fx5/THUMBNAIL/image/gif/ea3854d44e790a6b14d1a7decbf96c60/fx5.sml fx5 fx5.sml sml 3682 185 216 IMAGE-THUMBNAIL 1-s2.0-S2468823121003503-fx6.sml https://s3-eu-west-1.amazonaws.com/prod-ucs-content-store-eu-west/content/pii:S2468823121003503/fx6/THUMBNAIL/image/gif/cc3cf44b267c29d2f095d9a8c47d9fe7/fx6.sml fx6 fx6.sml sml 3739 125 205 IMAGE-THUMBNAIL 1-s2.0-S2468823121003503-sc1.sml https://s3-eu-west-1.amazonaws.com/prod-ucs-content-store-eu-west/content/pii:S2468823121003503/sc1/THUMBNAIL/image/gif/ba5363df3aeab6b0017a1d4cedf2256e/sc1.sml sc1 sc1.sml sml 6287 150 219 IMAGE-THUMBNAIL 1-s2.0-S2468823121003503-fx3.sml https://s3-eu-west-1.amazonaws.com/prod-ucs-content-store-eu-west/content/pii:S2468823121003503/fx3/THUMBNAIL/image/gif/91d81e975094954f24129944b75a5fce/fx3.sml fx3 fx3.sml sml 4862 225 181 IMAGE-THUMBNAIL 1-s2.0-S2468823121003503-sc2.sml https://s3-eu-west-1.amazonaws.com/prod-ucs-content-store-eu-west/content/pii:S2468823121003503/sc2/THUMBNAIL/image/gif/6349c0cc351d7a5aa0b29423cfbde007/sc2.sml sc2 sc2.sml sml 11446 138 219 IMAGE-THUMBNAIL 1-s2.0-S2468823121003503-fx4.sml https://s3-eu-west-1.amazonaws.com/prod-ucs-content-store-eu-west/content/pii:S2468823121003503/fx4/THUMBNAIL/image/gif/f96430ced7248682c4c8616d72f2b41d/fx4.sml fx4 fx4.sml sml 5144 159 219 IMAGE-THUMBNAIL 1-s2.0-S2468823121003503-fx1.sml https://s3-eu-west-1.amazonaws.com/prod-ucs-content-store-eu-west/content/pii:S2468823121003503/fx1/THUMBNAIL/image/gif/4bb73772b09a6f4f189831cadd1c6f91/fx1.sml fx1 fx1.sml sml 3108 141 188 IMAGE-THUMBNAIL 1-s2.0-S2468823121003503-fx2.sml https://s3-eu-west-1.amazonaws.com/prod-ucs-content-store-eu-west/content/pii:S2468823121003503/fx2/THUMBNAIL/image/gif/f73007385187515385e8d20d57205ba0/fx2.sml fx2 fx2.sml sml 2840 105 129 IMAGE-THUMBNAIL 1-s2.0-S2468823121003503-ga1.sml https://s3-eu-west-1.amazonaws.com/prod-ucs-content-store-eu-west/content/pii:S2468823121003503/ga1/THUMBNAIL/image/gif/ca6c464c28989dde46710eb548d75cd0/ga1.sml ga1 true ga1.sml sml 10498 135 219 IMAGE-THUMBNAIL 1-s2.0-S2468823121003503-gr6_lrg.jpg https://s3-eu-west-1.amazonaws.com/prod-ucs-content-store-eu-west/content/pii:S2468823121003503/gr6/HIGHRES/image/jpeg/6769fda51ab87cd11008b9f4023d927b/gr6_lrg.jpg gr6 gr6_lrg.jpg jpg 164881 1368 1667 IMAGE-HIGH-RES 1-s2.0-S2468823121003503-gr4_lrg.jpg https://s3-eu-west-1.amazonaws.com/prod-ucs-content-store-eu-west/content/pii:S2468823121003503/gr4/HIGHRES/image/jpeg/4e517174a775a6edf3e7c1117a28c674/gr4_lrg.jpg gr4 gr4_lrg.jpg jpg 263806 1522 1667 IMAGE-HIGH-RES 1-s2.0-S2468823121003503-gr5_lrg.jpg https://s3-eu-west-1.amazonaws.com/prod-ucs-content-store-eu-west/content/pii:S2468823121003503/gr5/HIGHRES/image/jpeg/c89f3366530c379f63600558652c94bd/gr5_lrg.jpg gr5 gr5_lrg.jpg jpg 326782 1399 1667 IMAGE-HIGH-RES 1-s2.0-S2468823121003503-gr2_lrg.jpg https://s3-eu-west-1.amazonaws.com/prod-ucs-content-store-eu-west/content/pii:S2468823121003503/gr2/HIGHRES/image/jpeg/97f372b395568e85ab6a5ada78ecb0f6/gr2_lrg.jpg gr2 gr2_lrg.jpg jpg 270594 1436 1667 IMAGE-HIGH-RES 1-s2.0-S2468823121003503-gr3_lrg.jpg https://s3-eu-west-1.amazonaws.com/prod-ucs-content-store-eu-west/content/pii:S2468823121003503/gr3/HIGHRES/image/jpeg/df9b18b3fab1acc3ddfa067adef88d74/gr3_lrg.jpg gr3 gr3_lrg.jpg jpg 264254 1382 1667 IMAGE-HIGH-RES 1-s2.0-S2468823121003503-gr1_lrg.jpg https://s3-eu-west-1.amazonaws.com/prod-ucs-content-store-eu-west/content/pii:S2468823121003503/gr1/HIGHRES/image/jpeg/956fa306e04a8b6e7dac1bd9c66a7287/gr1_lrg.jpg gr1 gr1_lrg.jpg jpg 306501 1460 1708 IMAGE-HIGH-RES 1-s2.0-S2468823121003503-fx5_lrg.jpg https://s3-eu-west-1.amazonaws.com/prod-ucs-content-store-eu-west/content/pii:S2468823121003503/fx5/HIGHRES/image/jpeg/18aacb2c7ee89b3a7377fb53c1355f11/fx5_lrg.jpg fx5 fx5_lrg.jpg jpg 4909 185 216 IMAGE-HIGH-RES 1-s2.0-S2468823121003503-fx6_lrg.jpg https://s3-eu-west-1.amazonaws.com/prod-ucs-content-store-eu-west/content/pii:S2468823121003503/fx6/HIGHRES/image/jpeg/e5e2b3841c0b66f8dbfcfc0f9b018b53/fx6_lrg.jpg fx6 fx6_lrg.jpg jpg 5251 125 205 IMAGE-HIGH-RES 1-s2.0-S2468823121003503-sc1_lrg.jpg https://s3-eu-west-1.amazonaws.com/prod-ucs-content-store-eu-west/content/pii:S2468823121003503/sc1/HIGHRES/image/jpeg/a5cce80853768131683a244dccbe774a/sc1_lrg.jpg sc1 sc1_lrg.jpg jpg 202732 1422 2083 IMAGE-HIGH-RES 1-s2.0-S2468823121003503-fx3_lrg.jpg https://s3-eu-west-1.amazonaws.com/prod-ucs-content-store-eu-west/content/pii:S2468823121003503/fx3/HIGHRES/image/jpeg/40bb71e7cd01487e1936dc44e95e0b3a/fx3_lrg.jpg fx3 fx3_lrg.jpg jpg 6814 225 181 IMAGE-HIGH-RES 1-s2.0-S2468823121003503-sc2_lrg.jpg https://s3-eu-west-1.amazonaws.com/prod-ucs-content-store-eu-west/content/pii:S2468823121003503/sc2/HIGHRES/image/jpeg/f5018297c67954f02c29ec38d496d2c1/sc2_lrg.jpg sc2 sc2_lrg.jpg jpg 684808 1991 3167 IMAGE-HIGH-RES 1-s2.0-S2468823121003503-fx4_lrg.jpg https://s3-eu-west-1.amazonaws.com/prod-ucs-content-store-eu-west/content/pii:S2468823121003503/fx4/HIGHRES/image/jpeg/a53f9747b8291ac7b6e7201b399e4a46/fx4_lrg.jpg fx4 fx4_lrg.jpg jpg 8340 204 281 IMAGE-HIGH-RES 1-s2.0-S2468823121003503-fx1_lrg.jpg https://s3-eu-west-1.amazonaws.com/prod-ucs-content-store-eu-west/content/pii:S2468823121003503/fx1/HIGHRES/image/jpeg/d417db1c72b5d34a4e51f63ce97593ac/fx1_lrg.jpg fx1 fx1_lrg.jpg jpg 3954 141 188 IMAGE-HIGH-RES 1-s2.0-S2468823121003503-fx2_lrg.jpg https://s3-eu-west-1.amazonaws.com/prod-ucs-content-store-eu-west/content/pii:S2468823121003503/fx2/HIGHRES/image/jpeg/e240cf28510f483c6b7fcd2a87f3c7db/fx2_lrg.jpg fx2 fx2_lrg.jpg jpg 3691 105 129 IMAGE-HIGH-RES 1-s2.0-S2468823121003503-ga1_lrg.jpg https://s3-eu-west-1.amazonaws.com/prod-ucs-content-store-eu-west/content/pii:S2468823121003503/ga1/HIGHRES/image/jpeg/fda2937599b38c4dfa98ab1e4a75deab/ga1_lrg.jpg ga1 true ga1_lrg.jpg jpg 152165 821 1333 IMAGE-HIGH-RES 1-s2.0-S2468823121003503-mmc1.doc https://s3-eu-west-1.amazonaws.com/prod-ucs-content-store-eu-west/content/pii:S2468823121003503/mmc1/MAIN/application/msword/cacd24d37cfca2e2b2a867e5c5c55cab/mmc1.doc mmc1 mmc1.doc doc 41733120 APPLICATION 1-s2.0-S2468823121003503-am.pdf https://s3-eu-west-1.amazonaws.com/prod-ucs-content-store-eu-west/content/egi:10VJW3QVNTJ/MAIN/application/pdf/06c534dac45c50c7c418b1da072cdb5c/am.pdf am am.pdf pdf false 1769557 AAM-PDF MCAT 111733 111733 S2468-8231(21)00350-3 10.1016/j.mcat.2021.111733 Scheme 1 A series of M-salen complexes considered in the present paper. M = AlIII, CrIII, MnIII, CoIII and ZnII. For Al and Co, the complexes of the salen ligand substituted with all the ionic liquids were studied. For Cr, Mn and Zn salen complexes, only the complexes of salen-Py ligand were calculated. The axial anion (counterion) for the complexes of the trivalent metals Al, Cr, Mn and Co is Cl-, and the Zn-salen complex has no axial anion. Scheme 1 Scheme 2 Sketched structures of stationary points along the four pathways (PathRO-IN-Al, PathRO-IN-H, PathIN-RO-Al and PathIN-RO-H) for the Al-salen-Py catalyzed coupling reaction of CO2 with PO. Scheme 2 Fig. 1 Relative free energy profiles for the Al-salen-Py catalyzed coupling reaction of CO2 and PO of the PathRO-IN-Al, PathRO-IN-H, PathIN-RO-Al and PathIN-RO-H. Subscript P means the four different pathways, for example, Int1P represents the four intermediates: Int1RO-IN-Al, Int1RO-IN-H, Int1IN-RO-Al and Int1IN-RO-H. Fig 1 Fig. 2 Relative free energy profiles for the coupling reaction of CO2 and PO by the catalyst Al-salen-Py, Al-salen-Im, Al-salen-QN, and Al-salen-QP. Subscript IL in Int1IL, TS1IL, etc represents the four ionic liquid substituents. Fig 2 Fig. 3 Relative free energy profiles for the coupling reaction of CO2 and PO catalyzed by Al-salen-PyOH and Al-salen-QNOH along PathRO-IN-Al. Subscript OH in Int1OH, TS1OH, etc denotes the two hydroxyl functionalized IL substituents. Fig 3 Fig. 4 Relative free energy profiles for the coupling reaction of CO2 and PO catalyzed by Al-salen-PyNH2 and Al-salen-QNNH2 along PathRO-IN-Al. Subscript NH2 in Int1NH2, TS1NH2, etc refers to the two amino functionalized IL substituents. Fig 4 Fig. 5 Relative free energy profiles for the coupling reaction of CO2 and PO by the catalyst Al-salen-Py, Co-salen-Py, Cr-salen-Py, Zn-salen-Py and Mn-salen-Py along the PathRO-IN-Al. Subscript M in Int1M, TS1M, etc denotes the five metal-salen complexes. Fig 5 Fig. 6 The linear relationship between the energy span δE and the bond length of M-O in the reaction complexes. Fig 6 Table 1 Energy span for the cycloaddition of CO2 to epoxides catalyzed by Al-salen-Py and the volume (Bohr^3) and NPA charge (e) of the six substrates. Table 1 Epoxides δE (kJ/mol) TDI TDTS Volume QC QO Image, table 1 74.7 reactant TS1 586.9 −0.141 −0.547 Image, table 1 81.0 reactant TS1 429.0 −0.145 −0.537 Image, table 1 86.0 reactant TS3 935.2 0.055 −0.562 Image, table 1 88.2 Int2 TS3 1075.2 −0.124 −0.539 Image, table 1 62.1 reactant TS3 890.5 −0.137 −0.553 Image, table 1 68.0 reactant TS1 688.7 −0.128 −0.535 Table 2 Energetic span for the metal-salen complexes catalyzed CO2 cycloaddition reaction. Table 2 δE (kJ/mol) TDI TDTS Al-salen-Py 74.7 reactant TS1 Co-salen-Py 49.8 Int2 TS3 Cr-salen-Py 56.6 Int4 TS1 Zn-salen-Py 74.6 Int4 TS1 Mn-salen-Py 103.6 reactant TS1 Table 3 Energetic span for the Co-salen and Al-salen catalyzed CO2 cycloaddition reaction*. Table 3 Complex δE (kJ/mol) TDI TDTS M-salen-Py 49.8 (74.7) Int2 (R) TS3 (TS1) M-salen-Im 70.6 (83.5) Int1 (R) TS3 (TS1) M-salen-QN 64.1 (60.3) Int2 (R) TS3 (TS1) M-salen-QP 62.0 (59.3) Int2 (R) TS3 (TS1) M-salen-PyOH 65.7 (81.8) Int1 (Int1) TS3 (TS1) M-salen-QNOH 60.5 (65.2) Int1 (R) TS3 (TS1) M-salen-PyNH2 41.4 (63.7) Int4 (Int4) TS1 or TS3 (TS1) M-salen-QNNH2 55.9 (57.6) Int2 (Int4) TS3 (TS1) *M = Co or Al. R refers to Reactant. Contents in parentheses are for Al-salen complexes. Theoretical investigation on conversion of CO2 with epoxides to cyclic carbonates by bifunctional metal-salen complexes bearing ionic liquid substsituents Hui-Qing Yang Conceptualization Formal analysis Data curation Investigation Writing – original draft Writing – review & editing Zhao-Xu Chen Conceptualization Formal analysis Data curation Supervision Writing – review & editing Project administration Funding acquisition ⁎ Institute of Theoretical and Computational Chemistry, Key Laboratory of Mesoscopic Chemistry of MOE, School of Chemistry and Chemical Engineering, Nanjing University, Nanjing 210023, P. R. China Institute of Theoretical and Computational Chemistry Key Laboratory of Mesoscopic Chemistry of MOE School of Chemistry and Chemical Engineering Nanjing University Nanjing 210023 PR China Institute of Theoretical and Computational Chemistry, Key Laboratory of Mesoscopic Chemistry of MOE, School of Chemistry and Chemical Engineering, Nanjing University, Nanjing 210023, PR China ⁎ Corresponding author. A series of bifunctional metal-salen complexes bearing ionic liquid substituents were investigated as catalysts for the synthesis of cyclic carbonates from carbon dioxide (CO2) and epoxides using density functional theory (DFT) and energy span model. Detailed studies reveal that the three-step mechanism involving the ring-opening of propylene oxide (PO), CO2 insertion, and ring-closure to the cyclic carbonate is kinetically more favorable than the two-step mechanism. The effect of ionic liquids, epoxide substituents and metal center of the metal-salen complexes were explored. Amino functionalized ionic liquids substituents tethered to the salen ligand of the metal-salen complexes performed well. Epoxide substituents affect the cycloaddition mainly through the electronic effect and the substituent that lowers the negative charges of the ring carbon atom to be attacked favors the cycloaddition. When the salen ligand is fixed, the catalytic activity metal-salen complexes can be measured by the interaction between the oxygen atom (O) of epoxides and the central metal (M) and there is a linear relationship between the energy span and the M-O bond length, which can be used as a descriptor to screen CO2 conversion catalysts. Graphical abstract Image, graphical abstract Keywords Metal salen Ionic liquid Cycloaddition DFT Energy span model 1 Introduction Carbon dioxide (CO2) is considered to be largely responsible for increasingly severe global warming, but it is also a highly desirable C1 feedstock as it is abundant, inexpensive and nontoxic [1,2]. The fixation of CO2 to valuable chemicals has been received considerable attention [3–7]. The cycloaddition reaction of CO2 with propylene oxide (PO) into propylene carbonate (PC) has been one of the most concerned reactions as it is an atom-economic and environment-benign process [8–10], because PC is often used as raw material for synthesis of polycarbonates and polymers, aprotic polar solvents and electrolytes in lithium batteries, as well as intermediate for pharmaceuticals [11–13]. However, it is still challenging to achieve highly efficient conversion of CO2 to PC, especially in the mild reaction conditions, because the energy barrier for the uncatalyzed cycloaddition of CO2 with PO is about 200 kJ/mol. To promote the conversion, efforts have been made to develop homogeneous and heterogeneous catalytic systems, such as metal-salen complexes [14–20], ionic liquids (ILs) [8,21–24], metal-organic frameworks (MOFs) [25,26], and etc. It is known that cooperative effects can significantly promote catalytic performance by synergistic activation through two or more active centers. Cooperativity can be realized by combination of multiple individual catalysts. On the one hand, metal-salen complexes, whose properties are easy to be modified by varying the steric and electronic properties about the metal centers that play the role of Lewis acid, have exhibited high activities and enantioselectivities. On the other hand, ionic liquids are eco-friendly and solvent-free and the anions are usually utilized as efficient nucleophiles. Combination of ionic liquids which provide nucleophiles with metal-salen complexes acting as Lewis acid centers can form unary bifunctional catalysts. Will such bifunctional catalysts acting as both Lewis acid and nucleophile enhance catalytic performance for CO2 conversion to propylene carbonate? In other words, can the two active centers work cooperatively for the CO2 cycloaddition? The answer is positive: the bifunctional catalysts having two active centers do exhibit high catalytic activity for the cycloaddition reaction [15]. In fact, several bifunctional catalytic systems including two or more active sites have been developed for the CO2 cycloaddition reaction [27–38]. For example, Al-salen (salen = N,N′-bis-(salicylidene)-cyclohexenediaminato) complexes which contain ionic liquid tethered to the salen ligand, Al-salen-Py and Al-salen-Im, were investigated for the conversion [15]. By Al-salen-Py and Al-salen-Im, we mean the Al-salen complexes with the salen ligand substituted by Py and Im ILs respectively (Scheme 1 ). Here, Py or Im denotes pyridinium or imidazolium IL. The experimental results demonstrate that although the cycloaddition reaction can be catalyzed alone either by an ionic liquid or by a metal-salen complex, the CO2 conversion is remarkably promoted by the bifunctional catalyst composed of the ionic liquid and the metal salen complex. It is assumed that the cooperation between the metal center (Lewis acid) of the metal-salen and the nucleophilic Cl- of the anion in the ionic liquid plays a key role in the cycloaddition reaction. However, the underlying synergistic details by the bifunctional catalyst are not clear. Herein, we focus on the mechanism and carry out kinetic analysis with the energy span model for the cycloaddition reaction catalyzed by the bifunctional catalysts of metal (M)-salen complexes with ILs tethered to salen ligand (M = AlIII, CrIII, MnIII, CoIII and ZnII). Specifically, in Section 3.2 we identified the favorable mechanism using Al-salen complexes with which experiments have been conducted. Then we compared the catalytic performance of Al-salen complexes with the salen ligand substituted by four different ILs in Section 3.3 and examined the activity of the Al-salen complexes of salen ligand tethered with hydroxyl and amino functionalized ILs in Section 3.4. Sections 3.5 and 3.6 are devoted to the effects of the epoxide substituents and the central metal in salen complexes respectively. Section 3.7 addresses the catalytic performance of Co-salen complexes of salen ligand tethered by different ILs. The present comprehensive study will shed lights on the mechanism and provide guiding information for designing efficient CO2 conversion systems. 2 Models and computational details In the present paper, we will first examine the CO2 cycloaddition with PO along the three-step and two-step mechanisms by the bifunctional catalysts of Al-salen complexes with ILs illustrated in Scheme 1. Among the eight catalysts, Al-salen-Py and Al-salen-Im have been studied experimentally, and the others are elaborately constructed in the present paper. The difference between the catalysts Al-salen-Py, Al-salen-Im, Al-salen-QN and Al-salen-QP lies in the substituent group -R. The substituent group -R in Al-salen-Py, Al-salen-Im, Al-salen-QN and Al-salen-QP are pyridine, imidazole, quaternary ammonium and quaternary phosphonium ILs respectively. PyOH (PyNH2) and QNOH (QNNH2) are the hydroxyl (amino) functionalized pyridine and quaternary ammonium ILs. Scheme 2 illustrates the three-step and two-step mechanisms. The three-step mechanism proceeds PO ring opening, CO2 insertion and ring closure steps. There are two pathways, PathRO-IN-Al and PathRO-IN-H, belonging to the three-step mechanism because the ring can be opened by either Al metal center or H of the ionic liquid. In notation PathRO-IN-Al/PathRO-IN-H, RO means ring opening; IN refers to CO2 insertion; Al or H represents the Lewis acid center to activate the oxygen atom of PO or CO2. PathIN-RO-Al/PathIN-RO-H denotes that the pathway in which the ring opening and the CO2 insertion happen concertedly, and the oxygen atom of CO2 is activated by Lewis acid center Al/H. In the two-step mechanism, the ring opening and the CO2 insertion happen concertedly (i.e., they finish in the same step, Scheme 2). The second step is the ring closure. Similar to the three-step mechanism, the two-step mechanism also has two pathways PathIN-RO-Al and PathIN-RO-H. Totally four pathways were examined. All calculations were performed using B3LYP functional which has been employed by several groups [39,40] to calculate this cycloaddition reaction. In addition, the dispersive effect could not be ignored owing to the high molecular weight of the systems under study. So the B3LYP-D3BJ [41,42] functional was used along with 6-31G(d) [43] basis set implemented in Gaussian 16 program [44] for all the calculations. Introduction of diffuse basis on heavy atoms, 6-31+x002BG(d,p) [45,46], exerts negligible influence on all the geometries and does not change the favorable pathway and conclusion (Table S1). Optimizations were stopped when the default convergence criteria were met. The vibrational analysis at the same level was performed to characterize all the structures with a single imaginary frequency for a transition state and none for a reactant, product or intermediate. The intrinsic reaction coordinate (IRC) [47] method was carried out to verify that the obtained transition states were connected to the desired local minima. To improve the estimation of calculated energies, single point energy calculations were conducted by using the def2-TZVP [48], and the solvent effect was taken into consideration with SMD [49] model in ethyl ether (Et2O) solvent [39]. The spin multiplicity of the Al-salen catalysis exists in low-lying singlet state, and the spin multiplicity of other metal-salen complexes were listed in Table S2. Molecular volumes were evaluated with the Multiwfn software [50]. The 3D structures were prepared using CYLView [51]. 3 Results and discussion 3.1 Active site Because there are two ionic liquid substituents in the salen ligand, there are four possible catalyst structures, three five-coordinated Al complexes and one six-coordinated complex (Table S3), depending on the position of the Cl- of the ionic liquid substituent. Cl- coordinating to the metal Al atom renders a six-coordinated aluminum species which is higher in energy than the five-coordinated aluminum species by 34.0 kJ/mol (Table S3). This result is in line with the experiment showing that the five-coordinated species is greatly favored in the equilibrium [15]. The most stable five-coordinated complex in which the two Cl- ions of ILs interact with the H atoms of the ILs and ligand (Table S3) was used for the following calculations. Wrapping-mode (Fac-Mer geometry in which the O-Al-O angle is 90°, and Fac-Fac geometry where the O-Al-O bond angle is 180°) of metal-salen catalysts is found to be important for explaining relevant experiments [52,53]. Nevertheless, all the calculations in the present paper were performed on the Fac-Mer geometry, not the Fac-Fac one, because the latter is much higher in energy than that of the former (Table S4). The molecular electrostatic potentials (MEP) (Fig. S1) of Al-salen-Py, Al-salen-Im, Al-salen-QN and Al-salen-QP show that the cation part of the ionic liquid substituent are baby blue which denotes positive potential. This means that the H atom of the cation part can play the same role as the metal center Al to activate the O atom of the PO or CO2, as long as the H atom sits at a position suitable for attacking the O atom, which brings about the PathRO-IN-H and PathIN-RO-H mentioned above. 3.2 Favorable pathway catalyzed by Al-salen-Py The barrier of uncatalyzed coupling reaction of CO2 and PO is at least 197.5 kJ/mol (Fig. S2), indicating that the reaction is difficult to take place in the absence of a catalyst. However, the common salen catalyst of which the substituent group is tertiary butyl catalyzes coupling reaction of CO2 and PO also with high free energy barrier 188.0 kJ/mol that is the lowest among the four pathways (Fig. S3). Thus, it is necessary to add extra catalyst or change its ligand of the metal salen catalyst system. As pointed out in Section 2, we will scrutinize two-step mechanism and three-step mechanism. Each mechanism consists of two pathways because the catalyst like Al-salen-Py has two Lewis acid centers, the metal Al and H of the IL substituent, which can activate the O atom of PO and CO2 (Scheme 2 and Fig. 1 ). Firstly we discuss PathRO-IN-Al, a three-step mechanism which includes (i) the PO ring opening accomplished through the metal Al activating the O atom and the nucleophile Cl- of the IL attacking the terminal carbon atom, (ii) the insertion of CO2, and (iii) the closure of the five-member ring to form the final product propylene carbonate. PathRO-IN-Al in which Cl- attacks the terminal carbon of PO was chosen because the energy span δE (smaller span indicates higher reaction rate [54–56].), 74.7 kJ/mol, is smaller than 84.3 kJ/mol for attacking the middle carbon (PathRO-IN-Al ', Fig. S4). This is likely due to less steric inhibition, as evidenced by the shorter C-Cl bond in the turnover frequency (TOF)-determining transition state (TDTS), TS1, in PathRO-IN-Al than that in PathRO-IN-Al ', 2.409 Å vs 2.527 Å (Fig. S5). As the previous work [21], we find the second step, CO2 insertion, is a barrierless process, which is supported by the scanned potential energy surface (Fig. S6). The final step, formation of the product propylene carbonate through the ring-closure of the Int3RO-IN-Al, needs to overcome a free energy barrier of 53.1 kJ/mol which is higher than that for the ring-opening step (47.6 kJ/mol). The other three-step mechanism, PathRO-IN-H, begins with activation of the O atom of PO by the H atom of the ionic liquid. The H atom activating the O atoms of PO or CO2 belongs to pyridine ring and has been marked with brown in Scheme 2. The difference between PathRO-IN-Al and PathRO-IN-H lies at the ring opening: it is opened by the H and Cl- in PathRO-IN-H, compared to that by the Al and Cl- in PathRO-IN-Al. The calculated energy span δE (108.7 kJ/mol) for PathRO-IN-H is 34 kJ/mol higher than that of PathRO-IN-Al. Thus, the favorable pathway of the three-step mechanism is PathRO-IN-Al. For the two-step mechanism, we also calculated two pathways. In PathIN-RO-Al the PO ring opening is realized via the simultaneous attacking the terminal C and the O atom of PO by the Cl- of ILs and the C atom of CO2 respectively. Note CO2 is coordinated to the Al center. The free energy barrier is calculated to be 84.2 kJ/mol. This step results in Int2IN-RO-Al (scheme 2, green), an opened five-membered ring. The final step, the five-membered ring closure, coincides the last step in PathRO-IN-Al. The calculated energy span δE is 141.4 kJ/mol, almost doubling the value of PathRO-IN-Al (74.7 kJ/mol). Hence, PathIN-RO-Al contributes negligibly to the product. The other pathway for the two-step mechanism is PathIN-RO-H. Its energy span is computed to be 168.9 kJ/mol which is higher than 141.4 kJ/mol for PathIN-RO-Al. Here, one can see that the three-step mechanism (PathRO-IN-Al and PathRO-IN-H) is kinetically more favorable than the two-step mechanism (PathIN-RO-Al and PathIN-RO-H). This phenomenon can be rationalized with the calculated NPA (natural population analysis) charges on the Al atom, the H atom and the Cl-. The charges on the Al/H atom in PathRO-IN-Al/PathRO-IN-H are 1.898/0.308 |e| which are higher than 1.880/0.295 |e| in PathIN-RO-Al/PathIN-RO-H, and the charges on the nucleophile Cl- are −0.657/−0.509 |e| in PathRO-IN-Al /PathRO-IN-H, and −0.704/−0.605 |e| in PathIN-RO-Al/PathIN-RO-H; the more positive/negative charges in Lewis acid center/nucleophile, the easier the synergistic ring opening. The above analysis reveals that the three-step mechanisms are favored over the two-step ones. The activity of the Al atom as Lewis acid is higher than that of the H atom in the ILs and the most favorable pathway is PathRO-IN-Al of the three-step mechanism. 3.3 Effect of nonfunctionalized IL substituents The above results indicate that PathRO-IN-Al is the most favorable. To understand the effect of traditional nonfunctionalized IL substituents on the CO2 conversion, we computed the free energy profiles of CO2 conversion along PathRO-IN-Al catalyzed by Al-salen-Py, Al-salen-Im, Al-salen-QN and Al-salen-QP (Fig. 2 ). The ball-and-stick structures of the transition states and intermediates are displayed in Fig. S7. As can be seen from Fig. 2, the TDTS is the TS1 for Al-salen-Im with the δE of 83.5 kJ/mol which is higher than 74.7 kJ/mol for Al-salen-Py. This result is in good agreement with the experiment [15] showing that the activity of Al-salen-Py is higher than that of Al-salen-Im. The δEs for Al-salen-QN and Al-salen-QP are 60.3 kJ/mol and 59.3 kJ/mol, respectively, implying that the catalytic activity of Al-salen-QN and Al-salen-QP is even higher than that of Al-salen-Py. The activity trend can be roughly understood with the nucleophilicity characterized by the NPA charges on the nucleophile Cl- in TS1IL: −0.639 |e| (Al-salen-Im) < −0.657 |e| (Al-salen-Py) < −0.671 |e| (Al-salen-QP) < −0.685 |e| (Al-salen-QN). Our calculated NPA charges on Cl- do show that systems whose Cl- are more negatively charged tend to be more active. 3.4 Effect of hydroxyl and amino functionalized ILs substituents It has been reported that functionalized ILs possess higher activity than nonfunctionalized ILs [57,58]. Inspired by this, we studied CO2 cycloaddition catalyzed by Al-salen complexes of salen ligands appended with hydroxyl and amino functionalized ionic liquids: Al-salen-PyOH, Al-salen-QNOH, Al-salen-PyNH2 and Al-salen-QNNH2 (Scheme 1). Fig. 3 and 4 display the potential energy profiles and relevant optimized structures of species involved in the coupling reaction are collected in Fig. S8. The calculated δEs are 81.8, 65.2, 63.7 and 57.6 kJ/mol for Al-salen-PyOH, Al-salen-QNOH, Al-salen-PyNH2 and Al-salen-QNNH2 respectively. The energy span ordering also coincides with the charges on Cl-: −0.505 |e| (Al-salen-PyOH) < −0.576 |e| (Al-salen-PyNH2) < −0.629 |e| (Al-salen-QNOH) < −0.660 |e| (Al-salen-QNNH2). In fact, the δEs correlate linearly with the NPA charges on the nucleophile Cl- in TS1 with R2 = 0.85. The energy span 81.8 and 65.2 kJ/mol for Al-salen-PyOH and Al-salen-QNOH are larger than 74.7 and 60.3 kJ/mol for the corresponding nonfunctionalized ILs Al-salen-Py and Al-salen-QN. Therefore, hydroxyl functionalized ILs show no enhanced activity of CO2 conversion. On the contrary, the calculated δEs, 63.7 kJ/mol for Al-salen-PyNH2 and 57.6 kJ/mol for Al-salen-QNNH2 are smaller than the corresponding values for Al-salen-Py/Al-salen-QN (74.7/60.3 kJ/mol). This result indicates that amino functionalized ILs tethered to the Al-salen can promote the catalytic performance for CO2 conversion. We would like to mention that although hydroxyl functionalized ILs do not facilitate the activity of CO2 conversion, the H atom in the OH group possesses higher activity to activate the O atom of PO than the H atom of nonfunctionalized ILs, as evidenced by our calculated energy span for PathRO-INH: 85.0 kJ/mol for Al-salen-PyOH (See Fig. S9), compared to 108.7 kJ/mol for Al-salen-Py. In fact, according to the computed energy span, 81.8 kJ/mol for Al-salen-PyOH (PathRO-IN-Al), 85.0 kJ/mol for Al-salen-PyOH (PathRO-IN-H) and 108.7 kJ/mol for Al-salen-Py (PathRO-IN-H), one can get the following activation sequence to the O atom of PO: the metal Al center > the H atom in the OH group > the H atom in nonfunctionalized IL substituent. Results for Al-salen-QNOH and Al-salen-QN lead to the same conclusion. 3.5 Effects of the substrate epoxides Experiments demonstrate that ethylene oxide (EO, 2) exhibits similar reactivity for the CO2 conversion as PO (1) (Table 1) [15]. On the contrary, cyclohexene oxide (CO, 3) is less active than PO. To explore the effect of the epoxide substituent on the cycloaddition, we brought compounds 4–6 (Table 1 ) into investigation. These compounds are computationally economic and helpful for figuring out the effect of substrates, although some of them are rarely used experimentally. Fig. S10 depicts the potential energy surfaces and Fig. S11 shows the relevant optimized structures. It is seen from Table 1 and Fig. S10 that δE of 81.0 kJ/mol (EO, 2) is slightly higher than 74.7 kJ/mol (PO, 1) whereas the energy span of CO (3), 86.0 kJ/mol, is 11.3 kJ/mol higher than that of PO. All these results agree with the available experimental observation [15], supporting our proposed mechanism as well as our computational methodology. The substrate effect can be roughly discussed from the steric effect and electronic effect. Here the former is characterized by the volume and the latter by NPA charges on the terminal carbon atom (QC) and the oxygen atom (QO) of the epoxides (for those with TS1 being the TDTS). The TDI and TDTS for 1, 2 and 6 are the corresponding reactants and TS1s. Substrate 6 has the lowest span, though it has the largest substituent. In fact, if the steric effect dominates the energy span, one would get δE (6) < δE (1) < δE (2), which is right opposite to our results (Table 1). Hence, the energy span is not controlled by the steric effect. Since TS1 is the key state determining the energy span, factors stabilizing TS1 would low the energy span. From scheme 2 one can see that the substrate interacts with the catalyst via the binding of the Lewis acid center Al to the epoxide O atom and the nucleophile Cl- to the terminal C atom. Therefore, more/less negative charges on the O/C atom would stabilize the TS1s and result in lower energy span. This is just what one observes in Table 1: substrate 6 which has the lowest energy span possesses the lowest negative charges on the C, −0.128 |e|. In fact, there is a linear relationship (R2 = 0.92) between the energy span and QC for 1, 2 and 6. Further analysis reveals that QO does not correlate with the energy span, indicating that the interaction between the Cl- and the attacked C atom is important in stabilizing TS1. These results imply that epoxides with substituents that lower the negative charges on the attacked carbon atom favor the CO2 conversion. For substrates 3 and 5, the TDTSs are TS3 and the charges QO and QC cannot be used to characterize the electronic effect of the substituent because CO2 has bonded to the substrate (Scheme 2). Substrate 3 has the higher energy span mainly due to a larger substituent which bonds to the attacked carbon atom. 3.6 Effects of the metal center in the salen complexes So far we have only studied Al-salen complexes as catalysts for CO2 conversion. In reality, M-salen complexes [M =AlIII, CrIII, MnIII, CoIII and ZnII] are often used or investigated in catalysis [17,59–61]. To explore the effect of the central metal ions on the conversion, we calculated the kinetics and thermodynamics of CO2 conversion catalyzed by M-salen-Py along PathRO-IN-Al (Fig. 5 ). Relevant optimized structures of species involved in the coupling reaction are collected in Fig. S12. As shown in Fig. 5, although different complexes have different TDTS or TDI, the energy span model analysis reveals that the δE (49.8 kJ/mol) of Co-salen-Py catalyst is the smallest among the five catalysts, followed by 56.6 kJ/mol (Cr-salen-Py). The energy span of Zn-salen-Py is similar to the Al-salen-Py, with the δE being 74.6 kJ/mol. Among these metal-salen complexes, Mn-salen-Py (103.6 kJ/mol) shows least activity. The calculated energy span predicts the following activity sequence: CoIII > CrIII > ZnII ~ AlIII > MnIII. Remember the energy span is related to the activation of the oxygen atom of PO, as demonstrated by the activity ordering of Al > the H in the OH group > the H in IL. Thus, the low activity or large energy span of Mn-salen-Py can be traced back to the activation of Mn to the oxygen atom of PO. Indeed, the above sequence is found to be consistent with the bond length between metal center and the O of PO (M-O) in the reaction complexes Int1M (Co-O: 1.982 Å; Cr-O: 2.102 Å; Zn-O: 2.149 Å; Al-O: 2.175 Å; Mn-O: 2.450 Å). Among the three transition metals Co, Cr, and Mn, the Mn-O bond is the longest, and the Co-O length is the shortest. This can be rationalized with the crystal field stabilization energy (CFSE) in octahedral field. The ground state spin multiplicity of Co-salen-Py, Cr-salen-Py and Mn-salen-Py is 1, 4 and 5, respectively. The number of electron in low-lying/high-lying t2g/eg orbitals are 6/0, 3/0 and 3/1 for CoIII, CrIII and MnIII. Hence, CoIII with 3d6 electron configuration has the largest CFSE, and MnIII with 3d4 configuration has the smallest CFSE. Further analysis shows that the energy span correlates linearly with the M-O bond length with R2 = 0.95 (Fig. 6 ). This result implies that one may estimate the energy span or catalytic performance of different metal-salen complexes by studying the distance between the metal and the O atom of epoxide in the reaction complexes. This finding is quite informative because it provides us a descriptor to screen better catalysts for CO2 conversion without invoking the computationally expensive transition state location. The maximum difference in energy span reaches 53.8 kJ/mol for the five metal salen complexes (Table 2 ), compared to 26.1 kJ/mol for different substrates (Table 1). Thus, to pursue high CO2 conversion efficiency, utilization of suitable metal-salen complexes is more effective than using active substrates. 3.7 Comparison of Co-salen complexes and Al-salen complexes Considering Co-salen-Py shows the best activity among the five M-salen-Py, we here investigate the effect of IL on the catalytic performance of Co-salen complexes, aiming to find the best metal-salen catalyst. All the calculations are along PathRO-IN-Al (Table 3 and Fig. S13). Relevant optimized structures of species involved in the coupling reaction are collected in Fig. S14. For the four nonfunctionalized IL tethered metal-salen complexes, Co-salen-Py and Co-salen-Im are much more active than the Al counterparts. However, Co-salen-QN and Co-alen-QP are inferior to the corresponding Al complexes, though the difference in energy span is less than 4 kJ/mol. This result implies that ILs can also exert notable influence on the catalytic activity of the catalysts, even though the metal center plays a dominant role. In fact, the maximum difference in energy span among the eight Co-salen catalysts are ~30 kJ/mol, indicating that one can adjust the catalytic activity by choosing suitable ILs. All the Co-salen complexes of the four functionalized ILs are more active than the corresponding Al-salen complexes, manifesting the role of the metal center. The energy span of the eight Co-salen-complexes is 9.5 kJ/mol smaller than that of the Al-salen-complexes on average. Co-salen-PyNH2 is the most active and Al-salen-QNNH2 shows the highest activity. Thus metal-salen complexes tethered with amino functionalized ILs exhibit promising activity to CO2 conversion to propylene carbonate. Quantitatively, on the basis of calculated energy span, the averaged activity of Co-salen complexes at room temperature is about 50 times that of Al-salen counterparts which are often used for CO2 conversion. Thus it is worthy to test Co-salen complexes experimentally. 4 Conclusions In this work, we have performed a comprehensive and theoretical study on the cycloaddition of CO2 with epoxides catalyzed by the single-component bifunctional catalysts of metal salen complexes tethered with various ionic liquids. We indentified the favorable mechanism and reaction pathway, and investigated the influence of ionic liquids, substituents in epoxides, and central metal ion in salen complexes. On the basis of detailed analyses, the following conclusions can be drawn. Among all the possible pathways studied, the most favorable one is PathRO-IN-Al which comprises ring-opening triggered by the metal center Al, barrierless CO2 insertion and ring-closure. Among the four metal-salen complexes tethered by nonfunctionalized ionic liquids, Al-salen-QN and Al-salen-QP exhibit the higher catalytic efficiency for the CO2 conversion. While hydroxyl functionalized ionic liquids do not show the propensity to promote the catalytic performance as anticipated, amino functionalized ionic liquids can enhance the catalytic activity notably. For epoxides with the substituents not bonded to the attacked carbon atoms, electronic effect of the substituent is more significant than the steric effect. The sequence of the catalytic activity of the metal salen complexes tethered by pyridine ionic liquid is: CoIII > CrIII > ZnII ~ AlIII > MnIII. Catalytic activity correlates linearly with the bond distance between the metal ion and the oxygen atom of epoxide. Co-salen complexes are generally more active than the Al-salen counterparts and are worthy being tested experimentally. The central metal ions play more important role than ionic liquids and epoxides for CO2 conversion. Although appropriate metal-salen complexes are important, an efficient CO2 conversion system should feature a perfect combination of metal-salen, ionic liquid and epoxide. CRediT authorship contribution statement Hui-Qing Yang: Conceptualization, Formal analysis, Data curation, Investigation, Writing – original draft, Writing – review & editing. Zhao-Xu Chen: Conceptualization, Formal analysis, Data curation, Supervision, Writing – review & editing, Project administration, Funding acquisition. Declaration of Competing Interest The authors declare no competing financial interest. Acknowledgements Financial support from the National Key Research and Development Program of China 2017YFB0702800 and the National Natural Science Foundation of China No. 21773105 are acknowledged. Calculations were carried out at the high-performance computing center of Nanjing University. Supplementary materials Supplementary material associated with this article can be found, in the online version, at doi:10.1016/j.mcat.2021.111733. Appendix Supplementary materials Image, application 1 References [1] M. Bui C.S. Adjiman A. Bardow E.J. Anthony A. Boston S. Brown P.S. Fennell S. Fuss A. Galindo L.A. Hackett J.P. Hallett H.J. Herzog G. Jackson J. Kemper S. Krevor G.C. Maitland M. Matuszewski I.S. Metcalfe C. Petit G. Puxty J. Reimer D.M. Reiner E.S. Rubin S.A. Scott N. Shah B. Smit J.P.M. Trusler P. Webley J. Wilcox N. Mac Dowell Carbon capture and storage (CCS): the way forward Energy Environ. Sci. 11 2018 1062 1176 M. Bui, C.S. Adjiman, A. Bardow, E.J. Anthony, A. Boston, S. Brown, P.S. Fennell, S. Fuss, A. Galindo, L.A. Hackett, J.P. Hallett, H.J. Herzog, G. Jackson, J. Kemper, S. Krevor, G.C. Maitland, M. Matuszewski, I.S. Metcalfe, C. Petit, G. Puxty, J. Reimer, D.M. Reiner, E.S. Rubin, S.A. Scott, N. Shah, B. Smit, J.P.M. Trusler, P. Webley, J. Wilcox, N. Mac Dowell, Carbon capture and storage (CCS): the way forward, Energy Environ. Sci. 11 (2018) 1062–1176. [2] R.G. Grim Z. Huang M.T. Guarnieri J.R. Ferrell III L. Tao J.A. Schaidle Transforming the carbon economy: challenges and opportunities in the convergence of low-cost electricity and reductive CO2 utilization Energy Environ. Sci. 13 2020 472 494 R.G. Grim, Z. Huang, M.T. Guarnieri, J.R. Ferrell III, L. Tao, J.A. Schaidle, Transforming the carbon economy: challenges and opportunities in the convergence of low-cost electricity and reductive CO2 utilization, Energy Environ. Sci.13 (2020) 472–494. [3] X. Jiang X.W. Nie X.W. Guo C.S. Song J.G. Chen Recent Advances in Carbon Dioxide Hydrogenation to Methanol via Heterogeneous Catalysis Chem. Rev. 120 2020 7984 8034 X. Jiang, X.W. Nie, X.W. Guo, C.S. Song, J.G. Chen, Recent Advances in Carbon Dioxide Hydrogenation to Methanol via Heterogeneous Catalysis, Chem. Rev.120 (2020) 7984–8034. [4] S. Das J. Pérez-Ramirez J.L. Gong N. Dewangan K. Hidajat B.C. Gates S. Kawi Core-shell structured catalysts for thermocatalytic, photocatalytic, and electrocatalytic conversion of CO2 Chem. Soc. Rev. 49 2020 2937 3004 S. Das, J. Pérez-Ramirez, J.L. Gong, N. Dewangan, K. Hidajat, B.C. Gates, S. Kawi, Core-shell structured catalysts for thermocatalytic, photocatalytic, and electrocatalytic conversion of CO2, Chem. Soc. Rev.49 (2020) 2937–3004. [5] B. Grignard S. Gennen C. Jérôme A.W. Kleij C. Detrembleur Advances in the use of CO2 as a renewable feedstock for the synthesis of polymers Chem. Soc. Rev. 48 2019 4466 4514 B. Grignard, S. Gennen, C. Jérôme, A.W. Kleij, C. Detrembleur, Advances in the use of CO2 as a renewable feedstock for the synthesis of polymers, Chem. Soc. Rev.48 (2019) 4466–4514. [6] M. Aresta A. Dibenedetto A. Angelini Catalysis for the valorization of exhaust carbon: from CO2 to chemicals, materials, and fuels. technological use of CO2 Chem. Rev. 114 2014 1709 1742 M. Aresta, A. Dibenedetto, A. Angelini, Catalysis for the valorization of exhaust carbon: from CO2 to chemicals, materials, and fuels. technological use of CO2, Chem. Rev.114 (2014) 1709–1742. [7] S. Kar A. Goeppert G.K.S. Prakash Integrated CO2 capture and conversion to formate and methanol: connecting two threads Acc. Chem. Res. 52 2019 2892 2903 S. Kar, A. Goeppert, G.K.S. Prakash, Integrated CO2 capture and conversion to formate and methanol: connecting two threads, Acc. Chem. Res.52 (2019) 2892–2903. [8] B.H. Xu J.Q. Wang J. Sun Y. Huang J.P. Zhang X.P. Zhang S.J. Zhang Fixation of CO2 into cyclic carbonates catalyzed by ionic liquids: a multi-scale approach Green Chem. 17 2015 108 122 B.H. Xu, J.Q. Wang, J. Sun, Y. Huang, J.P. Zhang, X.P. Zhang, S.J. Zhang, Fixation of CO2 into cyclic carbonates catalyzed by ionic liquids: a multi-scale approach, Green Chem.. 17 (2015) 108–122. [9] G. Fiorani W.S. Guo A.W. Kleij Sustainable conversion of carbon dioxide: the advent of organocatalysis Green Chem. 17 2015 1375 1389 G. Fiorani, W.S. Guo, A.W. Kleij, Sustainable conversion of carbon dioxide: the advent of organocatalysis, Green Chem.. 17 (2015) 1375–1389. [10] Q.W. Song Z.H. Zhou L.N. He Efficient, selective and sustainable catalysis of carbon dioxide Green Chem. 19 2017 3707 3728 Q.W. Song, Z.H. Zhou, L.N. He, Efficient, selective and sustainable catalysis of carbon dioxide, Green Chem.. 19 (2017) 3707–3728. [11] X.B. Lu D.J. Darensbourg Cobalt catalysts for the coupling of CO2 and epoxides to provide polycarbonates and cyclic carbonates Chem. Soc. Rev. 41 2012 1462 1484 X.B. Lu, D.J. Darensbourg, Cobalt catalysts for the coupling of CO2 and epoxides to provide polycarbonates and cyclic carbonates, Chem. Soc. Rev.41 (2012) 1462–1484. [12] C. Maeda Y. Miyazaki T. Ema Recent progress in catalytic conversions of carbon dioxide Catal. Sci. Technol. 4 2014 1482 1497 C. Maeda, Y. Miyazaki, T. Ema, Recent progress in catalytic conversions of carbon dioxide, Catal. Sci. Technol.4 (2014) 1482–1497. [13] M. Alves B. Grignard R. Mereau C. Jerome T. Tassaing C. Detrembleur Organocatalyzed coupling of carbon dioxide with epoxides for the synthesis of cyclic carbonates: catalyst design and mechanistic studies Catal. Sci. Technol. 7 2017 2651 2684 M. Alves, B. Grignard, R. Mereau, C. Jerome, T. Tassaing, C. Detrembleur, Organocatalyzed coupling of carbon dioxide with epoxides for the synthesis of cyclic carbonates: catalyst design and mechanistic studies, Catal. Sci. Technol.7 (2017) 2651–2684. [14] D.J. Darensbourg Making plastics from carbon dioxide: salen metal complexes as catalysts for the production of polycarbonates from epoxides and CO2 Chem. Rev. 107 2007 2388 2410 D.J. Darensbourg, Making plastics from carbon dioxide: salen metal complexes as catalysts for the production of polycarbonates from epoxides and CO2, Chem. Rev.107 (2007) 2388–2410. [15] D.W. Tian B.Y. Liu Q.Y. Gan H.R. Li D.J. Darensbourg Formation of Cyclic Carbonates from Carbon Dioxide and Epoxides Coupling Reactions Efficiently Catalyzed by Robust, Recyclable One-Component Aluminum-Salen Complexes ACS Catal. 2 2012 2029 2035 D.W. Tian, B.Y. Liu, Q.Y. Gan, H.R. Li, D.J. Darensbourg, Formation of Cyclic Carbonates from Carbon Dioxide and Epoxides Coupling Reactions Efficiently Catalyzed by Robust, Recyclable One-Component Aluminum-Salen Complexes, ACS Catal. 2 (2012) 2029–2035. [16] M. North S.C.Z. Quek N.E. Pridmore A.C. Whitwood X. Wu Aluminum(salen) Complexes as Catalysts for the Kinetic Resolution of Terminal Epoxides via CO2 Coupling ACS Catal. 5 2015 3398 3402 M. North, S.C.Z. Quek, N.E. Pridmore, A.C. Whitwood, X. Wu, Aluminum(salen) Complexes as Catalysts for the Kinetic Resolution of Terminal Epoxides via CO2 Coupling, ACS Catal. 5 (2015) 3398–3402. [17] J.A. Castro-Osma K.J. Lamb M. North Cr(salophen) Complex Catalyzed Cyclic Carbonate Synthesis at Ambient Temperature And Pressure ACS Catal. 6 2016 5012 5025 J.A. Castro-Osma, K.J. Lamb, M. North, Cr(salophen) Complex Catalyzed Cyclic Carbonate Synthesis at Ambient Temperature And Pressure, ACS Catal. 6 (2016) 5012–5025. [18] M. Hatazawa K. Nakabayashi S. Ohkoshi K. Nozaki In Situ Generation of CoIII-Salen Complexes for Copolymerization of Propylene Oxide and CO2 Chem. Eur. J. 22 2016 13677 13681 Hatazawa M., Nakabayashi K., Ohkoshi S., Nozaki K., In Situ Generation of CoIII-Salen Complexes for Copolymerization of Propylene Oxide and CO2, Chem. Eur. J. 22 (2016) 13677–13681. [19] A. Thevenon A. Cyriac D. Myers A.J.P. White C.B. Durr C.K. Williams Indium Catalysts for Low-Pressure CO2/Epoxide Ring-Opening Copolymerization: evidence for a Mononuclear Mechanism? J. Am. Chem. Soc. 140 2018 6893 6903 A. Thevenon, A. Cyriac, D. Myers, A.J.P. White, C.B. Durr, C.K. Williams, Indium Catalysts for Low-Pressure CO2/Epoxide Ring-Opening Copolymerization: evidence for a Mononuclear Mechanism?J. Am. Chem. Soc.140 (2018) 6893–6903. [20] C.K. Ng R.W. Toh T.T. Lin H.K. Luo T.S.A. Hor J. Wu Metal-salen molecular cages as efficient and recyclable heterogeneous catalysts for cycloaddition of CO2 with epoxides under ambient conditions Chem. Sci. 10 2019 1549 1554 C.K. Ng, R.W. Toh, T.T. Lin, H.K. Luo, T.S.A. Hor, J. Wu, Metal-salen molecular cages as efficient and recyclable heterogeneous catalysts for cycloaddition of CO2 with epoxides under ambient conditions, Chem. Sci.10 (2019) 1549–1554. [21] J.Q. Wang K. Dong W.G. Cheng J. Sun S.J. Zhang Metal–salen molecular cages as efficient and recyclable heterogeneous catalysts for cycloaddition of CO2 with epoxides under ambient conditions Catal. Sci. Technol. 2 2012 1480 1484 J.Q. Wang, K. Dong, W.G. Cheng, J. Sun, S.J. Zhang, Metal–salen molecular cages as efficient and recyclable heterogeneous catalysts for cycloaddition of CO2 with epoxides under ambient conditions, Catal. Sci. Technol.2 (2012) 1480–1484. [22] Y.A. Alassmy P.P. Pescarmona The Role of Water Revisited and Enhanced: a Sustainable Catalytic System for the Conversion of CO2 into Cyclic Carbonates under Mild Conditions ChemSusChem 12 2019 3856 3863 Y.A. Alassmy, P.P. Pescarmona, The Role of Water Revisited and Enhanced: a Sustainable Catalytic System for the Conversion of CO2 into Cyclic Carbonates under Mild Conditions, ChemSusChem 12 (2019) 3856–3863. [23] C.Y. Cui R.J. Sa Z.X. Hong H. Zhong R.H. Wang Ionic-Liquid-Modified Click-Based Porous Organic Polymers for Controlling Capture and Catalytic Conversion of CO2 ChemSusChem 13 2020 180 187 C.Y. Cui, R.J. Sa, Z.X. Hong, H. Zhong, R.H. Wang, Ionic-Liquid-Modified Click-Based Porous Organic Polymers for Controlling Capture and Catalytic Conversion of CO2, ChemSusChem 13 (2020) 180–187. [24] M. Bahadori A. Marandi S. Tangestaninejad M. Moghadam V. Mirkhani I. Mohammadpoor-Baltork Ionic Liquid-Decorated MIL-101(Cr) via Covalent and Coordination Bonds for Efficient Solvent-Free CO2 Conversion and CO2 Capture at Low Pressure J. Phys. Chem. C 124 2020 8716 8725 M. Bahadori, A. Marandi, S. Tangestaninejad, M. Moghadam, V. Mirkhani, I. Mohammadpoor-Baltork, Ionic Liquid-Decorated MIL-101(Cr) via Covalent and Coordination Bonds for Efficient Solvent-Free CO2 Conversion and CO2 Capture at Low Pressure, J. Phys. Chem. C124 (2020) 8716–8725. [25] T.K. Pal D. De P.K. Bharadwaj Coordin. Metal-organic frameworks for the chemical fixation of CO2 into cyclic Carbonates Chem. Rev. 408 2020 213173 213217 T.K. Pal, D. De, P.K. Bharadwaj, Coordin. Metal-organic frameworks for the chemical fixation of CO2 into cyclic Carbonates, Chem. Rev.408 (2020) 213173–213217. [26] F. Guo X.L. Zhang Metal-organic frameworks for the energy-related conversion of CO2 into cyclic carbonates Dalton Trans. 49 2020 9935 9947 F. Guo, X.L. Zhang, Metal-organic frameworks for the energy-related conversion of CO2 into cyclic carbonates, Dalton Trans. 49 (2020)9935–9947. [27] S. Klaus M.W. Lehenmeier C.E. Anderson B. Rieger Recent advances in CO2/epoxide copolymerization-new strategies and cooperative mechanisms Coordin. Chem. Rev. 255 2011 1460 1479 S. Klaus, M.W. Lehenmeier, C.E. Anderson, B. Rieger, Recent advances in CO2 /epoxide copolymerization-new strategies and cooperative mechanisms, Coordin. Chem. Rev. 255 (2011) 1460–1479. [28] J. Li Y.L. Han H. Lin N.H. Wu Q.K. Li J. Jiang J.H. Zhu Cobalt-salen-based porous ionic polymer: the role of valence on cooperative conversion of CO2 to cyclic carbonate ACS Appl. Mater. Interfaces 12 2020 609 618 J. Li, Y.L. Han, H. Lin, N.H. Wu, Q.K. Li, J. Jiang, J.H. Zhu, Cobalt-salen-based porous ionic polymer: the role of valence on cooperative conversion of CO2 to cyclic carbonate, ACS Appl. Mater. Interfaces12 (2020) 609–618. [29] K. Cho S.M. Lee H.J. Kim Y.J. Ko E.J. Kang S.U. Son Iron coordination to hollow microporous metal-free disalphen networks: heterogeneous iron catalysts for CO2 fixation to cyclic carbonates Chem. Eur. J. 26 2020 788 794 K. Cho, S.M. Lee, H.J. Kim, Y.J. Ko, E.J. Kang, S.U. Son, Iron coordination to hollow microporous metal-free disalphen networks: heterogeneous iron catalysts for CO2 fixation to cyclic carbonates, Chem. Eur. J.26 (2020) 788–794. [30] C.X. Miao J.Q. Wang Y. Wu Y. Du L.N. He Bifunctional metal-salen complexes as efficient catalysts for the fixation of CO2 with epoxides under solvent-free conditions ChemSusChem 1 2008 236 241 C.X. Miao, J.Q. Wang, Y. Wu, Y. Du, L.N. He, Bifunctional metal-salen complexes as efficient catalysts for the fixation of CO2 with epoxides under solvent-free conditions, ChemSusChem 1 (2008) 236–241. [31] T. Chang L.L. Jin H.W. Jing Bifunctional chiral catalyst for the synthesis of chiral cyclic carbonates from carbon dioxide and epoxides ChemCatChem 1 2009 379 383 T. Chang, L.L. Jin, H.W. Jing, Bifunctional chiral catalyst for the synthesis of chiral cyclic carbonates from carbon dioxide and epoxides, ChemCatChem 1 (2009) 379–383. [32] W.M. Ren Z.W. Liu Y.Q. Wen R. Zhang X.B. Lu Mechanistic aspects of the copolymerization of CO2 with epoxides using a thermally stable single-site Cobalt(III) J. Am. Chem. Soc. 131 2009 11509 11518 W.M. Ren, Z.W. Liu, Y.Q. Wen, R. Zhang, X.B. Lu, Mechanistic aspects of the copolymerization of CO2 with epoxides using a thermally stable single-site Cobalt(III), J. Am. Chem. Soc.131 (2009) 11509–11518. [33] A. Decortes A.M. Castilla A.W. Kleij Salen-complex-mediated formation of cyclic carbonates by cycloaddition of CO2 to epoxides Angew. Chem. Int. Ed. 49 2010 9822 9837 A. Decortes, A.M. Castilla, A.W. Kleij, Salen-complex-mediated formation of cyclic carbonates by cycloaddition of CO2 to epoxides, Angew. Chem. Int. Ed.49 (2010) 9822–9837. [34] J. Sun L.J. Han W.G. Cheng J.Q. Wang X.P. Zhang S.J. Zhang Efficient acid-base bifunctional catalysts for the fixation of CO2 with epoxides under metal- and solvent-free conditions ChemSusChem 4 2011 502 507 J. Sun, L.J. Han, W.G. Cheng, J.Q. Wang, X.P. Zhang, S.J. Zhang, Efficient acid-base bifunctional catalysts for the fixation of CO2 with epoxides under metal- and solvent-free conditions, ChemSusChem 4 (2011) 502–507. [35] M. North C. Young Reducing the cost of production of bimetallic aluminium catalysts for the synthesis of cyclic carbonates ChemSusChem 4 2011 1685 1693 M. North, C. Young, Reducing the cost of production of bimetallic aluminium catalysts for the synthesis of cyclic carbonates, ChemSusChem 4 (2011) 1685–1693. [36] W.M. Ren Y. Liu X.B. Lu Bifunctional aluminum catalyst for CO2 fixation: regioselective ring opening of three-membered heterocyclic compounds J. Org. Chem. 79 2014 9771 9777 W.M. Ren, Y. Liu, X.B. Lu, Bifunctional aluminum catalyst for CO2 fixation: regioselective ring opening of three-membered heterocyclic compounds, J. Org. Chem.79 (2014) 9771–9777. [37] Q. An Z.F. Li R. Graff J. Guo H.F. Gao C.C. Wang Core-double-shell Fe3O4@Carbon@Poly(InIII-carboxylate) microspheres: cycloaddition of CO2 and epoxides on coordination polymer shells constituted by imidazolium-derived AlIII -salen bifunctional catalysts ACS Appl. Mater. Interfaces 7 2015 4969 4978 Q. An, Z.F. Li, R. Graff, J. Guo, H.F. Gao, C.C. Wang, Core-double-shell Fe3O4@Carbon@Poly(InIII-carboxylate) microspheres: cycloaddition of CO2 and epoxides on coordination polymer shells constituted by imidazolium-derived AlIII -salen bifunctional catalysts, ACS Appl. Mater. Interfaces7 (2015) 4969–4978. [38] X.D. Lang Y.C. Yu L.N. He Zn-salen complexes with multiple hydrogen bonding donor and protic ammonium bromide: bifunctional catalysts for CO2 fixation with epoxides at atmospheric pressure J. Mol. Catal. A: Chemical 420 2016 208 215 X.D. Lang, Y.C. Yu, L.N. He, Zn-salen complexes with multiple hydrogen bonding donor and protic ammonium bromide: bifunctional catalysts for CO2 fixation with epoxides at atmospheric pressure, J. Mol. Catal. A: Chemical420 (2016) 208–215. [39] T. Ema Y. Miyazaki J. Shimonishi C. Maeda J. Hasegawa Bifunctional porphyrin catalysts for the synthesis of cyclic carbonates from epoxides and CO2: structural optimization and mechanistic study J. Am. Chem. Soc. 136 2014 15270 15279 T. Ema, Y. Miyazaki, J. Shimonishi, C. Maeda, J. Hasegawa, Bifunctional porphyrin catalysts for the synthesis of cyclic carbonates from epoxides and CO2: structural optimization and mechanistic study, J. Am. Chem. Soc.136 (2014) 15270–15279. [40] J. Ma J.L. Liu Z.F. Zhang B.X. Han The catalytic mechanism of KI and the co-catalytic mechanism of hydroxyl substances for cycloaddition of CO2 with propylene oxide Green Chem. 14 2012 2410 2420 J. Ma, J.L. Liu, Z.F. Zhang, B.X. Han, The catalytic mechanism of KI and the co-catalytic mechanism of hydroxyl substances for cycloaddition of CO2 with propylene oxide, Green Chem.. 14 (2012) 2410–2420. [41] P.J. Stephens F.J. Devlin C.F. Chabalowski M.J. Frisch Ab Initio calculation of vibrational absorption and circular dichroism spectra using density functional force fields J. Phys. Chem. 98 1994 11623 11627 P.J. Stephens, F.J. Devlin, C.F. Chabalowski, M.J. Frisch, Ab Initio calculation of vibrational absorption and circular dichroism spectra using density functional force fields, J. Phys. Chem.98 (1994) 11623–11627. [42] L. Goerigk A. Hansen C. Bauer S. Najibi A. Ehrlich S. Grimme A look at the density functional theory zoo with the advanced GMTKN55 database for general main group thermochemistry, kinetics and noncovalent interactions Phys. Chem. Chem. Phys. 19 2017 32184 32215 L. Goerigk, A. Hansen, C. Bauer, S. Najibi A. Ehrlich, S. Grimme, A look at the density functional theory zoo with the advanced GMTKN55 database for general main group thermochemistry, kinetics and noncovalent interactions, Phys. Chem. Chem. Phys.19 (2017) 32184–32215. [43] W.J. Hehre R. Ditchfield J.A. Pople Self-Consistent Molecular Orbital Methods. 12. Further extensions of Gaussian-type basis sets for use in molecular-orbital studies of organic-molecules J. Chem. Phys. 56 1972 2257 2261 W.J. Hehre, R. Ditchfield, J.A. Pople, Self-Consistent Molecular Orbital Methods. 12. Further extensions of Gaussian-type basis sets for use in molecular-orbital studies of organic-molecules, J. Chem. Phys., 56 (1972) 2257–2261. [44] Jr. M.J. Frisch G.W. Trucks H.B. Schlegel G.E. Scuseria M.A. Robb J.R. Cheeseman G. Scalmani V. Barone G.A. Petersson H. Nakatsuji X. Li M. Caricato A.V. Marenich J. Bloino B.G. Janesko R. Gomperts B. Mennucci H.P. Hratchian J.V. Ortiz A.F. Izmaylov J.L. Sonnenberg D. Williams-Young F. Ding F. Lipparini F. Egidi J. Goings B. Peng A. Petrone T. Henderson D. Ranasinghe V.G. Zakrzewski J. Gao N. Rega G. Zheng W. Liang M. Hada M. Ehara K. Toyota R. Fukuda J. Hasegawa M. Ishida T. Nakajima Y. Honda O. Kitao H. Nakai T. Vreven K. Throssell J.A. Montgomery J.E. Peralta F. Ogliaro M.J. Bearpark J.J. Heyd E.N. Brothers K.N. Kudin V.N. Staroverov T.A. Keith R. Kobayashi J. Normand K. Raghavachari A.P. Rendell J.C. Burant S.S. Iyengar J. Tomasi M. Cossi J.M. Millam M. Klene C. Adamo R. Cammi J.W. Ochterski R.L. Martin K. Morokuma O. Farkas J.B. Foresman D.J. Fox Gaussian 16, Revision A.03 2016 M.J. Frisch, G.W. Trucks, H.B. Schlegel, G.E. Scuseria, M.A. Robb, J.R. Cheeseman, G. Scalmani, V. Barone, G.A. Petersson, H. Nakatsuji, X. Li, M. Caricato, A.V. Marenich, J. Bloino, B.G. Janesko, R. Gomperts, B. Mennucci, H.P. Hratchian, J.V. Ortiz, A.F. Izmaylov, J.L. Sonnenberg, D. Williams-Young, F. Ding, F. Lipparini, F. Egidi, J. Goings, B. Peng, A. Petrone, T. Henderson, D. Ranasinghe, V.G. Zakrzewski, J. Gao, N. Rega, G. Zheng, W. Liang, M. Hada, M. Ehara, K. Toyota, R. Fukuda, J. Hasegawa, M. Ishida, T. Nakajima, Y. Honda, O. Kitao, H. Nakai, T. Vreven, K. Throssell, J.A. Montgomery, Jr., J.E. Peralta, F. Ogliaro, M.J. Bearpark, J.J. Heyd, E.N. Brothers, K.N. Kudin, V.N. Staroverov, T.A. Keith, R. Kobayashi, J. Normand, K. Raghavachari, A.P. Rendell, J.C. Burant, S.S. Iyengar, J. Tomasi, M. Cossi, J.M. Millam, M. Klene, C. Adamo, R. Cammi, J.W. Ochterski, R.L. Martin, K. Morokuma, O. Farkas, J.B. Foresman, D.J. Fox, Gaussian 16, Revision A.03, Gaussian, Inc., Wallingford CT, 2016. [45] M.J. Frisch J.A. Pople J.S. Binkley Self-consistent molecular orbital methods. 25. supplementary functions for gaussian basis sets J. Chem. Phys. 80 1984 3265 3269 M.J. Frisch, J.A. Pople, J.S. Binkley, Self-consistent molecular orbital methods. 25. supplementary functions for gaussian basis sets, J. Chem. Phys.80 (1984) 3265–3269. [46] P.C. Hariharan J.A. Pople The Influence of polarization functions on molecular-orbital hydrogenation energies Theor. Chem. Acc. 28 1973 213 222 P.C. Hariharan, J.A. Pople, The Influence of polarization functions on molecular-orbital hydrogenation energies, Theor. Chem. Acc.28 (1973) 213–222. [47] K. Fukui The path of chemical reactions-the IRC approach Acc. Chem. Res. 14 1981 363 368 K. Fukui, he path of chemical reactions-the IRC approach, Acc. Chem. Res.14 (1981) 363–368. [48] F. Weigend R. Ahlrichs Balanced basis sets of split valence, triple zeta valence and quadruple zeta valence quality for H to Rn: design and assessment of accuracy Phys. Chem. Chem. Phys. 7 2005 3297 3305 F. Weigend, R. Ahlrichs, Balanced basis sets of split valence, triple zeta valence and quadruple zeta valence quality for H to Rn: design and assessment of accuracy, Phys. Chem. Chem. Phys.7 (2005) 3297–3305. [49] A.V. Marenich C.J. Cramer D.G. Truhlar Universal solvation model based on solute electron density and on a continuum model of the solvent defined by the bulk dielectric constant and atomic surface tensions J. Phys. Chem. B 113 2009 6378 6396 A.V. Marenich, C.J. Cramer, D.G. Truhlar, Universal solvation model based on solute electron density and on a continuum model of the solvent defined by the bulk dielectric constant and atomic surface tensions, J. Phys. Chem. B113 (2009) 6378–6396. [50] T. Lu F.W. Chen Multiwfn: a multifunctional wavefunction analyzer J. Comput. Chem. 33 2012 580 592 T. Lu, F.W. Chen, Multiwfn: a multifunctional wavefunction analyzer, J. Comput. Chem., 33 (2012) 580–592. [51] C.Y. Legault CYLview, 1.0b 2009 Université de Sherbrooke http://www.cylview.org C.Y. Legault, CYLview, 1.0b.; Université de Sherbrooke, 2009; http://www.cylview.org. [52] M.C. D′Alterio C.D. Rosa G. Talarico Stereoselective lactide polymerization: the challenge of chiral catalyst recognition ACS Catal. 10 2020 2221 2225 M.C. D′Alterio, C.D. Rosa, G. Talarico, Stereoselective lactide polymerization: the challenge of chiral catalyst recognition, ACS Catal., 10 (2020) 2221–2225. [53] M.C. D′Alterio C.D. Rosa G. Talarico Syndiotactic PLA from meso-LA polymerization at the Al-chiral complex: a probe of DFT mechanistic insights Chem. Commun. 57 2021 1611 1614 M.C. D′Alterio, C.D. Rosa, G. Talarico, Syndiotactic PLA from meso-LA polymerization at the Al-chiral complex: a probe of DFT mechanistic insights, Chem. Commun., 57 (2021) 1611–1614. [54] A. Uhe S. Kozuch S. Shaik Software news and update automatic analysis of computed catalytic cycles J. Comput. Chem. 32 2011 978 985 A. Uhe, S. Kozuch, S. Shaik, Software news and update automatic analysis of computed catalytic cycles, J. Comput. Chem.32 (2011) 978–985. [55] S. Kozuch S. Shaik How to conceptualize catalytic cycles? The energetic span model Accounts Chem. Res. 44 2011 101 110 S. Kozuch, S. Shaik, How to conceptualize catalytic cycles? The energetic span model, Accounts Chem. Res. 44 (2011) 101–110. [56] S. Kozuch S. Shaik A Combined kinetic-quantum mechanical model for assessment of catalytic cycles: application to cross-coupling and heck reactions J. Am. Chem. Soc. 128 2006 3355 3365 S. Kozuch, S. Shaik, A Combined kinetic-quantum mechanical model for assessment of catalytic cycles: application to cross-coupling and heck reactions, J. Am. Chem. Soc.128 (2006) 3355–3365. [57] J. Sun S.J. Zhang W.G. Cheng J.Y. Ren Hydroxyl-functionalized ionic liquid: a novel efficient catalyst for chemical fixation of CO2 to cyclic carbonate Tetrahedron Lett. 49 2008 3588 3591 J. Sun, S.J. Zhang, W.G. Cheng, J.Y. Ren, Hydroxyl-functionalized ionic liquid: a novel efficient catalyst for chemical fixation of CO2 to cyclic carbonate, Tetrahedron Lett.49 (2008) 3588–3591. [58] H.Q. Yang X. Wang Y. Ma L. Wang J.L. Zhang Quaternary ammonium-based ionic liquids bearing different numbers of hydroxyl groups as highly efficient catalysts for the fixation of CO2: a theoretical study by QM and MD Catal. Sci. Technol. 6 2016 7773 7782 H.Q. Yang, X. Wang, Y. Ma, L. Wang, J.L. Zhang, Quaternary ammonium-based ionic liquids bearing different numbers of hydroxyl groups as highly efficient catalysts for the fixation of CO2: a theoretical study by QM and MD, Catal. Sci. Technol.6 (2016) 7773–7782. [59] R.L. Duan C.Y. Hu Z.Q. Sun H. Zhang X. Pang X.S. Chen Conjugated tri-nuclear salen-Co complexes for the copolymerization of epoxides/CO2: cocatalyst-free catalysis Green Chem. 21 2019 4723 4731 R.L. Duan, C.Y. Hu, Z.Q. Sun, H. Zhang, X. Pang, X.S. Chen, Conjugated tri-nuclear salen-Co complexes for the copolymerization of epoxides/CO2: cocatalyst-free catalysis, Green Chem.. 21 (2019) 4723–4731. [60] J. Liu G.Q. Yang Y. Liu D.J. Zhang X.B. Hu Z.B. Zhang Efficient conversion of CO2 into cyclic carbonates at room temperature catalyzed by Al-salen and imidazolium hydrogen carbonate ionic liquids Green Chem. 22 2020 4509 4515 J. Liu, G.Q. Yang, Y. Liu, D.J. Zhang, X.B. Hu, Z.B. Zhang, Efficient conversion of CO2 into cyclic carbonates at room temperature catalyzed by Al-salen and imidazolium hydrogen carbonate ionic liquids, Green Chem.. 22 (2020) 4509–4515. [61] F.D. Monica A.W. Kleij Mechanistic guidelines in nonreductive conversion of CO2: the case of cyclic carbonates Catal. Sci. Technol. 10 2020 3483 3501 F.D. Monica, A.W. Kleij, Mechanistic guidelines in nonreductive conversion of CO2: the case of cyclic carbonates, Catal. Sci. Technol.10 (2020) 3483–3501.",
      "scopus-id": "85110178619",
      "coredata": {
        "eid": "1-s2.0-S2468823121003503",
        "dc:description": "A series of bifunctional metal-salen complexes bearing ionic liquid substituents were investigated as catalysts for the synthesis of cyclic carbonates from carbon dioxide (CO2) and epoxides using density functional theory (DFT) and energy span model. Detailed studies reveal that the three-step mechanism involving the ring-opening of propylene oxide (PO), CO2 insertion, and ring-closure to the cyclic carbonate is kinetically more favorable than the two-step mechanism. The effect of ionic liquids, epoxide substituents and metal center of the metal-salen complexes were explored. Amino functionalized ionic liquids substituents tethered to the salen ligand of the metal-salen complexes performed well. Epoxide substituents affect the cycloaddition mainly through the electronic effect and the substituent that lowers the negative charges of the ring carbon atom to be attacked favors the cycloaddition. When the salen ligand is fixed, the catalytic activity metal-salen complexes can be measured by the interaction between the oxygen atom (O) of epoxides and the central metal (M) and there is a linear relationship between the energy span and the M-O bond length, which can be used as a descriptor to screen CO2 conversion catalysts.",
        "openArchiveArticle": "false",
        "prism:coverDate": "2021-07-31",
        "openaccessUserLicense": null,
        "prism:aggregationType": "Journal",
        "prism:url": "https://api.elsevier.com/content/article/pii/S2468823121003503",
        "dc:creator": [
          {
            "@_fa": "true",
            "$": "Yang, Hui-Qing"
          },
          {
            "@_fa": "true",
            "$": "Chen, Zhao-Xu"
          }
        ],
        "link": [
          {
            "@_fa": "true",
            "@rel": "self",
            "@href": "https://api.elsevier.com/content/article/pii/S2468823121003503"
          },
          {
            "@_fa": "true",
            "@rel": "scidir",
            "@href": "https://www.sciencedirect.com/science/article/pii/S2468823121003503"
          }
        ],
        "dc:format": "application/json",
        "openaccessType": null,
        "pii": "S2468-8231(21)00350-3",
        "prism:volume": "511",
        "articleNumber": "111733",
        "prism:publisher": "Published by Elsevier B.V.",
        "dc:title": "Theoretical investigation on conversion of CO2 with epoxides to cyclic carbonates by bifunctional metal-salen complexes bearing ionic liquid substsituents",
        "prism:copyright": "© 2021 Published by Elsevier B.V.",
        "openaccess": "0",
        "prism:issn": "24688231",
        "dcterms:subject": [
          {
            "@_fa": "true",
            "$": "Metal salen"
          },
          {
            "@_fa": "true",
            "$": "Ionic liquid"
          },
          {
            "@_fa": "true",
            "$": "Cycloaddition"
          },
          {
            "@_fa": "true",
            "$": "DFT"
          },
          {
            "@_fa": "true",
            "$": "Energy span model"
          }
        ],
        "openaccessArticle": "false",
        "prism:publicationName": "Molecular Catalysis",
        "openaccessSponsorType": null,
        "prism:pageRange": "111733",
        "pubType": "fla",
        "prism:coverDisplayDate": "July 2021",
        "prism:doi": "10.1016/j.mcat.2021.111733",
        "prism:startingPage": "111733",
        "dc:identifier": "doi:10.1016/j.mcat.2021.111733",
        "openaccessSponsorName": null
      },
      "objects": {
        "object": [
          {
            "@category": "standard",
            "@height": "309",
            "@width": "376",
            "@_fa": "true",
            "$": "https://api.elsevier.com/content/object/eid/1-s2.0-S2468823121003503-gr6.jpg?httpAccept=%2A%2F%2A",
            "@multimediatype": "JPEG image file",
            "@type": "IMAGE-DOWNSAMPLED",
            "@size": "22207",
            "@ref": "gr6",
            "@mimetype": "image/jpeg"
          },
          {
            "@category": "standard",
            "@height": "343",
            "@width": "376",
            "@_fa": "true",
            "$": "https://api.elsevier.com/content/object/eid/1-s2.0-S2468823121003503-gr4.jpg?httpAccept=%2A%2F%2A",
            "@multimediatype": "JPEG image file",
            "@type": "IMAGE-DOWNSAMPLED",
            "@size": "39745",
            "@ref": "gr4",
            "@mimetype": "image/jpeg"
          },
          {
            "@category": "standard",
            "@height": "316",
            "@width": "376",
            "@_fa": "true",
            "$": "https://api.elsevier.com/content/object/eid/1-s2.0-S2468823121003503-gr5.jpg?httpAccept=%2A%2F%2A",
            "@multimediatype": "JPEG image file",
            "@type": "IMAGE-DOWNSAMPLED",
            "@size": "45648",
            "@ref": "gr5",
            "@mimetype": "image/jpeg"
          },
          {
            "@category": "standard",
            "@height": "324",
            "@width": "376",
            "@_fa": "true",
            "$": "https://api.elsevier.com/content/object/eid/1-s2.0-S2468823121003503-gr2.jpg?httpAccept=%2A%2F%2A",
            "@multimediatype": "JPEG image file",
            "@type": "IMAGE-DOWNSAMPLED",
            "@size": "38193",
            "@ref": "gr2",
            "@mimetype": "image/jpeg"
          },
          {
            "@category": "standard",
            "@height": "312",
            "@width": "376",
            "@_fa": "true",
            "$": "https://api.elsevier.com/content/object/eid/1-s2.0-S2468823121003503-gr3.jpg?httpAccept=%2A%2F%2A",
            "@multimediatype": "JPEG image file",
            "@type": "IMAGE-DOWNSAMPLED",
            "@size": "40129",
            "@ref": "gr3",
            "@mimetype": "image/jpeg"
          },
          {
            "@category": "standard",
            "@height": "330",
            "@width": "386",
            "@_fa": "true",
            "$": "https://api.elsevier.com/content/object/eid/1-s2.0-S2468823121003503-gr1.jpg?httpAccept=%2A%2F%2A",
            "@multimediatype": "JPEG image file",
            "@type": "IMAGE-DOWNSAMPLED",
            "@size": "44792",
            "@ref": "gr1",
            "@mimetype": "image/jpeg"
          },
          {
            "@category": "standard",
            "@height": "34",
            "@width": "40",
            "@_fa": "true",
            "$": "https://api.elsevier.com/content/object/eid/1-s2.0-S2468823121003503-fx5.jpg?httpAccept=%2A%2F%2A",
            "@multimediatype": "JPEG image file",
            "@type": "IMAGE-DOWNSAMPLED",
            "@size": "882",
            "@ref": "fx5",
            "@mimetype": "image/jpeg"
          },
          {
            "@category": "standard",
            "@height": "23",
            "@width": "38",
            "@_fa": "true",
            "$": "https://api.elsevier.com/content/object/eid/1-s2.0-S2468823121003503-fx6.jpg?httpAccept=%2A%2F%2A",
            "@multimediatype": "JPEG image file",
            "@type": "IMAGE-DOWNSAMPLED",
            "@size": "783",
            "@ref": "fx6",
            "@mimetype": "image/jpeg"
          },
          {
            "@category": "standard",
            "@height": "321",
            "@width": "470",
            "@_fa": "true",
            "$": "https://api.elsevier.com/content/object/eid/1-s2.0-S2468823121003503-sc1.jpg?httpAccept=%2A%2F%2A",
            "@multimediatype": "JPEG image file",
            "@type": "IMAGE-DOWNSAMPLED",
            "@size": "29802",
            "@ref": "sc1",
            "@mimetype": "image/jpeg"
          },
          {
            "@category": "standard",
            "@height": "42",
            "@width": "34",
            "@_fa": "true",
            "$": "https://api.elsevier.com/content/object/eid/1-s2.0-S2468823121003503-fx3.jpg?httpAccept=%2A%2F%2A",
            "@multimediatype": "JPEG image file",
            "@type": "IMAGE-DOWNSAMPLED",
            "@size": "1109",
            "@ref": "fx3",
            "@mimetype": "image/jpeg"
          },
          {
            "@category": "standard",
            "@height": "449",
            "@width": "715",
            "@_fa": "true",
            "$": "https://api.elsevier.com/content/object/eid/1-s2.0-S2468823121003503-sc2.jpg?httpAccept=%2A%2F%2A",
            "@multimediatype": "JPEG image file",
            "@type": "IMAGE-DOWNSAMPLED",
            "@size": "103054",
            "@ref": "sc2",
            "@mimetype": "image/jpeg"
          },
          {
            "@category": "standard",
            "@height": "38",
            "@width": "52",
            "@_fa": "true",
            "$": "https://api.elsevier.com/content/object/eid/1-s2.0-S2468823121003503-fx4.jpg?httpAccept=%2A%2F%2A",
            "@multimediatype": "JPEG image file",
            "@type": "IMAGE-DOWNSAMPLED",
            "@size": "1168",
            "@ref": "fx4",
            "@mimetype": "image/jpeg"
          },
          {
            "@category": "standard",
            "@height": "26",
            "@width": "35",
            "@_fa": "true",
            "$": "https://api.elsevier.com/content/object/eid/1-s2.0-S2468823121003503-fx1.jpg?httpAccept=%2A%2F%2A",
            "@multimediatype": "JPEG image file",
            "@type": "IMAGE-DOWNSAMPLED",
            "@size": "763",
            "@ref": "fx1",
            "@mimetype": "image/jpeg"
          },
          {
            "@category": "standard",
            "@height": "20",
            "@width": "24",
            "@_fa": "true",
            "$": "https://api.elsevier.com/content/object/eid/1-s2.0-S2468823121003503-fx2.jpg?httpAccept=%2A%2F%2A",
            "@multimediatype": "JPEG image file",
            "@type": "IMAGE-DOWNSAMPLED",
            "@size": "653",
            "@ref": "fx2",
            "@mimetype": "image/jpeg"
          },
          {
            "@category": "standard",
            "@height": "185",
            "@width": "301",
            "@_fa": "true",
            "$": "https://api.elsevier.com/content/object/eid/1-s2.0-S2468823121003503-ga1.jpg?httpAccept=%2A%2F%2A",
            "@multimediatype": "JPEG image file",
            "@type": "IMAGE-DOWNSAMPLED",
            "@size": "24047",
            "@ref": "ga1",
            "@mimetype": "image/jpeg"
          },
          {
            "@category": "thumbnail",
            "@height": "164",
            "@width": "200",
            "@_fa": "true",
            "$": "https://api.elsevier.com/content/object/eid/1-s2.0-S2468823121003503-gr6.sml?httpAccept=%2A%2F%2A",
            "@multimediatype": "GIF image file",
            "@type": "IMAGE-THUMBNAIL",
            "@size": "7507",
            "@ref": "gr6",
            "@mimetype": "image/gif"
          },
          {
            "@category": "thumbnail",
            "@height": "163",
            "@width": "179",
            "@_fa": "true",
            "$": "https://api.elsevier.com/content/object/eid/1-s2.0-S2468823121003503-gr4.sml?httpAccept=%2A%2F%2A",
            "@multimediatype": "GIF image file",
            "@type": "IMAGE-THUMBNAIL",
            "@size": "11735",
            "@ref": "gr4",
            "@mimetype": "image/gif"
          },
          {
            "@category": "thumbnail",
            "@height": "164",
            "@width": "195",
            "@_fa": "true",
            "$": "https://api.elsevier.com/content/object/eid/1-s2.0-S2468823121003503-gr5.sml?httpAccept=%2A%2F%2A",
            "@multimediatype": "GIF image file",
            "@type": "IMAGE-THUMBNAIL",
            "@size": "13846",
            "@ref": "gr5",
            "@mimetype": "image/gif"
          },
          {
            "@category": "thumbnail",
            "@height": "164",
            "@width": "190",
            "@_fa": "true",
            "$": "https://api.elsevier.com/content/object/eid/1-s2.0-S2468823121003503-gr2.sml?httpAccept=%2A%2F%2A",
            "@multimediatype": "GIF image file",
            "@type": "IMAGE-THUMBNAIL",
            "@size": "12203",
            "@ref": "gr2",
            "@mimetype": "image/gif"
          },
          {
            "@category": "thumbnail",
            "@height": "164",
            "@width": "198",
            "@_fa": "true",
            "$": "https://api.elsevier.com/content/object/eid/1-s2.0-S2468823121003503-gr3.sml?httpAccept=%2A%2F%2A",
            "@multimediatype": "GIF image file",
            "@type": "IMAGE-THUMBNAIL",
            "@size": "13220",
            "@ref": "gr3",
            "@mimetype": "image/gif"
          },
          {
            "@category": "thumbnail",
            "@height": "164",
            "@width": "192",
            "@_fa": "true",
            "$": "https://api.elsevier.com/content/object/eid/1-s2.0-S2468823121003503-gr1.sml?httpAccept=%2A%2F%2A",
            "@multimediatype": "GIF image file",
            "@type": "IMAGE-THUMBNAIL",
            "@size": "11314",
            "@ref": "gr1",
            "@mimetype": "image/gif"
          },
          {
            "@category": "thumbnail",
            "@height": "185",
            "@width": "216",
            "@_fa": "true",
            "$": "https://api.elsevier.com/content/object/eid/1-s2.0-S2468823121003503-fx5.sml?httpAccept=%2A%2F%2A",
            "@multimediatype": "GIF image file",
            "@type": "IMAGE-THUMBNAIL",
            "@size": "3682",
            "@ref": "fx5",
            "@mimetype": "image/gif"
          },
          {
            "@category": "thumbnail",
            "@height": "125",
            "@width": "205",
            "@_fa": "true",
            "$": "https://api.elsevier.com/content/object/eid/1-s2.0-S2468823121003503-fx6.sml?httpAccept=%2A%2F%2A",
            "@multimediatype": "GIF image file",
            "@type": "IMAGE-THUMBNAIL",
            "@size": "3739",
            "@ref": "fx6",
            "@mimetype": "image/gif"
          },
          {
            "@category": "thumbnail",
            "@height": "150",
            "@width": "219",
            "@_fa": "true",
            "$": "https://api.elsevier.com/content/object/eid/1-s2.0-S2468823121003503-sc1.sml?httpAccept=%2A%2F%2A",
            "@multimediatype": "GIF image file",
            "@type": "IMAGE-THUMBNAIL",
            "@size": "6287",
            "@ref": "sc1",
            "@mimetype": "image/gif"
          },
          {
            "@category": "thumbnail",
            "@height": "225",
            "@width": "181",
            "@_fa": "true",
            "$": "https://api.elsevier.com/content/object/eid/1-s2.0-S2468823121003503-fx3.sml?httpAccept=%2A%2F%2A",
            "@multimediatype": "GIF image file",
            "@type": "IMAGE-THUMBNAIL",
            "@size": "4862",
            "@ref": "fx3",
            "@mimetype": "image/gif"
          },
          {
            "@category": "thumbnail",
            "@height": "138",
            "@width": "219",
            "@_fa": "true",
            "$": "https://api.elsevier.com/content/object/eid/1-s2.0-S2468823121003503-sc2.sml?httpAccept=%2A%2F%2A",
            "@multimediatype": "GIF image file",
            "@type": "IMAGE-THUMBNAIL",
            "@size": "11446",
            "@ref": "sc2",
            "@mimetype": "image/gif"
          },
          {
            "@category": "thumbnail",
            "@height": "159",
            "@width": "219",
            "@_fa": "true",
            "$": "https://api.elsevier.com/content/object/eid/1-s2.0-S2468823121003503-fx4.sml?httpAccept=%2A%2F%2A",
            "@multimediatype": "GIF image file",
            "@type": "IMAGE-THUMBNAIL",
            "@size": "5144",
            "@ref": "fx4",
            "@mimetype": "image/gif"
          },
          {
            "@category": "thumbnail",
            "@height": "141",
            "@width": "188",
            "@_fa": "true",
            "$": "https://api.elsevier.com/content/object/eid/1-s2.0-S2468823121003503-fx1.sml?httpAccept=%2A%2F%2A",
            "@multimediatype": "GIF image file",
            "@type": "IMAGE-THUMBNAIL",
            "@size": "3108",
            "@ref": "fx1",
            "@mimetype": "image/gif"
          },
          {
            "@category": "thumbnail",
            "@height": "105",
            "@width": "129",
            "@_fa": "true",
            "$": "https://api.elsevier.com/content/object/eid/1-s2.0-S2468823121003503-fx2.sml?httpAccept=%2A%2F%2A",
            "@multimediatype": "GIF image file",
            "@type": "IMAGE-THUMBNAIL",
            "@size": "2840",
            "@ref": "fx2",
            "@mimetype": "image/gif"
          },
          {
            "@category": "thumbnail",
            "@height": "135",
            "@width": "219",
            "@_fa": "true",
            "$": "https://api.elsevier.com/content/object/eid/1-s2.0-S2468823121003503-ga1.sml?httpAccept=%2A%2F%2A",
            "@multimediatype": "GIF image file",
            "@type": "IMAGE-THUMBNAIL",
            "@size": "10498",
            "@ref": "ga1",
            "@mimetype": "image/gif"
          },
          {
            "@category": "high",
            "@height": "1368",
            "@width": "1667",
            "@_fa": "true",
            "$": "https://api.elsevier.com/content/object/eid/1-s2.0-S2468823121003503-gr6_lrg.jpg?httpAccept=%2A%2F%2A",
            "@multimediatype": "JPEG image file",
            "@type": "IMAGE-HIGH-RES",
            "@size": "164881",
            "@ref": "gr6",
            "@mimetype": "image/jpeg"
          },
          {
            "@category": "high",
            "@height": "1522",
            "@width": "1667",
            "@_fa": "true",
            "$": "https://api.elsevier.com/content/object/eid/1-s2.0-S2468823121003503-gr4_lrg.jpg?httpAccept=%2A%2F%2A",
            "@multimediatype": "JPEG image file",
            "@type": "IMAGE-HIGH-RES",
            "@size": "263806",
            "@ref": "gr4",
            "@mimetype": "image/jpeg"
          },
          {
            "@category": "high",
            "@height": "1399",
            "@width": "1667",
            "@_fa": "true",
            "$": "https://api.elsevier.com/content/object/eid/1-s2.0-S2468823121003503-gr5_lrg.jpg?httpAccept=%2A%2F%2A",
            "@multimediatype": "JPEG image file",
            "@type": "IMAGE-HIGH-RES",
            "@size": "326782",
            "@ref": "gr5",
            "@mimetype": "image/jpeg"
          },
          {
            "@category": "high",
            "@height": "1436",
            "@width": "1667",
            "@_fa": "true",
            "$": "https://api.elsevier.com/content/object/eid/1-s2.0-S2468823121003503-gr2_lrg.jpg?httpAccept=%2A%2F%2A",
            "@multimediatype": "JPEG image file",
            "@type": "IMAGE-HIGH-RES",
            "@size": "270594",
            "@ref": "gr2",
            "@mimetype": "image/jpeg"
          },
          {
            "@category": "high",
            "@height": "1382",
            "@width": "1667",
            "@_fa": "true",
            "$": "https://api.elsevier.com/content/object/eid/1-s2.0-S2468823121003503-gr3_lrg.jpg?httpAccept=%2A%2F%2A",
            "@multimediatype": "JPEG image file",
            "@type": "IMAGE-HIGH-RES",
            "@size": "264254",
            "@ref": "gr3",
            "@mimetype": "image/jpeg"
          },
          {
            "@category": "high",
            "@height": "1460",
            "@width": "1708",
            "@_fa": "true",
            "$": "https://api.elsevier.com/content/object/eid/1-s2.0-S2468823121003503-gr1_lrg.jpg?httpAccept=%2A%2F%2A",
            "@multimediatype": "JPEG image file",
            "@type": "IMAGE-HIGH-RES",
            "@size": "306501",
            "@ref": "gr1",
            "@mimetype": "image/jpeg"
          },
          {
            "@category": "high",
            "@height": "185",
            "@width": "216",
            "@_fa": "true",
            "$": "https://api.elsevier.com/content/object/eid/1-s2.0-S2468823121003503-fx5_lrg.jpg?httpAccept=%2A%2F%2A",
            "@multimediatype": "JPEG image file",
            "@type": "IMAGE-HIGH-RES",
            "@size": "4909",
            "@ref": "fx5",
            "@mimetype": "image/jpeg"
          },
          {
            "@category": "high",
            "@height": "125",
            "@width": "205",
            "@_fa": "true",
            "$": "https://api.elsevier.com/content/object/eid/1-s2.0-S2468823121003503-fx6_lrg.jpg?httpAccept=%2A%2F%2A",
            "@multimediatype": "JPEG image file",
            "@type": "IMAGE-HIGH-RES",
            "@size": "5251",
            "@ref": "fx6",
            "@mimetype": "image/jpeg"
          },
          {
            "@category": "high",
            "@height": "1422",
            "@width": "2083",
            "@_fa": "true",
            "$": "https://api.elsevier.com/content/object/eid/1-s2.0-S2468823121003503-sc1_lrg.jpg?httpAccept=%2A%2F%2A",
            "@multimediatype": "JPEG image file",
            "@type": "IMAGE-HIGH-RES",
            "@size": "202732",
            "@ref": "sc1",
            "@mimetype": "image/jpeg"
          },
          {
            "@category": "high",
            "@height": "225",
            "@width": "181",
            "@_fa": "true",
            "$": "https://api.elsevier.com/content/object/eid/1-s2.0-S2468823121003503-fx3_lrg.jpg?httpAccept=%2A%2F%2A",
            "@multimediatype": "JPEG image file",
            "@type": "IMAGE-HIGH-RES",
            "@size": "6814",
            "@ref": "fx3",
            "@mimetype": "image/jpeg"
          },
          {
            "@category": "high",
            "@height": "1991",
            "@width": "3167",
            "@_fa": "true",
            "$": "https://api.elsevier.com/content/object/eid/1-s2.0-S2468823121003503-sc2_lrg.jpg?httpAccept=%2A%2F%2A",
            "@multimediatype": "JPEG image file",
            "@type": "IMAGE-HIGH-RES",
            "@size": "684808",
            "@ref": "sc2",
            "@mimetype": "image/jpeg"
          },
          {
            "@category": "high",
            "@height": "204",
            "@width": "281",
            "@_fa": "true",
            "$": "https://api.elsevier.com/content/object/eid/1-s2.0-S2468823121003503-fx4_lrg.jpg?httpAccept=%2A%2F%2A",
            "@multimediatype": "JPEG image file",
            "@type": "IMAGE-HIGH-RES",
            "@size": "8340",
            "@ref": "fx4",
            "@mimetype": "image/jpeg"
          },
          {
            "@category": "high",
            "@height": "141",
            "@width": "188",
            "@_fa": "true",
            "$": "https://api.elsevier.com/content/object/eid/1-s2.0-S2468823121003503-fx1_lrg.jpg?httpAccept=%2A%2F%2A",
            "@multimediatype": "JPEG image file",
            "@type": "IMAGE-HIGH-RES",
            "@size": "3954",
            "@ref": "fx1",
            "@mimetype": "image/jpeg"
          },
          {
            "@category": "high",
            "@height": "105",
            "@width": "129",
            "@_fa": "true",
            "$": "https://api.elsevier.com/content/object/eid/1-s2.0-S2468823121003503-fx2_lrg.jpg?httpAccept=%2A%2F%2A",
            "@multimediatype": "JPEG image file",
            "@type": "IMAGE-HIGH-RES",
            "@size": "3691",
            "@ref": "fx2",
            "@mimetype": "image/jpeg"
          },
          {
            "@category": "high",
            "@height": "821",
            "@width": "1333",
            "@_fa": "true",
            "$": "https://api.elsevier.com/content/object/eid/1-s2.0-S2468823121003503-ga1_lrg.jpg?httpAccept=%2A%2F%2A",
            "@multimediatype": "JPEG image file",
            "@type": "IMAGE-HIGH-RES",
            "@size": "152165",
            "@ref": "ga1",
            "@mimetype": "image/jpeg"
          },
          {
            "@category": "standard",
            "@_fa": "true",
            "$": "https://api.elsevier.com/content/object/eid/1-s2.0-S2468823121003503-mmc1.doc?httpAccept=%2A%2F%2A",
            "@multimediatype": "Microsoft Word file",
            "@type": "APPLICATION",
            "@size": "41733120",
            "@ref": "mmc1",
            "@mimetype": "application/word"
          },
          {
            "@category": "standard",
            "@_fa": "true",
            "$": "https://api.elsevier.com/content/object/eid/1-s2.0-S2468823121003503-am.pdf?httpAccept=%2A%2F%2A",
            "@multimediatype": "Acrobat PDF file",
            "@type": "AAM-PDF",
            "@size": "1769557",
            "@ref": "am",
            "@mimetype": "application/pdf"
          }
        ]
      },
      "link": {
        "@rel": "abstract",
        "@href": "https://api.elsevier.com/content/abstract/scopus_id/85110178619"
      }
    }
  }
}