{
  "metadata": {
    "title": "Enhanced CO<ce:inf loc=post>2</ce:inf> methanation activity over Ni/CeO<ce:inf loc=post>2</ce:inf> catalyst by one-pot method",
    "authors": "; ; ",
    "journal": "Molecular Catalysis",
    "date": "2021-05-31",
    "doi": "10.1016/j.mcat.2021.111602",
    "abstract": "",
    "uri": "https://api.elsevier.com/content/article/pii/S2468823121002194",
    "pii": "S2468823121002194"
  },
  "fulltext": {
    "full-text-retrieval-response": {
      "scopus-eid": "2-s2.0-85105555737",
      "originalText": "serial JL 315758 291210 291744 291790 291809 31 Molecular Catalysis MOLECULARCATALYSIS 2021-05-12 2021-05-12 2021-05-12 2021-05-12 2021-05-24T15:55:04 1-s2.0-S2468823121002194 S2468-8231(21)00219-4 S2468823121002194 10.1016/j.mcat.2021.111602 S300 S300.1 FULL-TEXT 1-s2.0-S2468823121X00089 2022-12-12T23:36:12.42485Z 0 0 20210501 20210531 2021 2021-05-12T10:29:42.378738Z absattachment articleinfo articlenumber articletitlenorm authfirstinitialnorm authfirstsurnamenorm cid cids contenttype copyright crossmark dateloaded dateloadedtxt datesearch datesort dateupdated dco docsubtype doctype doi eid ewtransactionid hubeid indexeddate issn issnnorm itemstage itemtransactionid itemweight openaccess openarchive pg pgfirst pii piinorm pubdateend pubdatestart pubdatetxt pubyr sectiontitle sortorder srctitle srctitlenorm srctype ssids alllist content subj subheadings suppl tomb volfirst volissue volumelist webpdf webpdfpagecount yearnav figure table body mmlmath acknowledge affil articletitle auth authfirstini authfull authkeywords authlast footnotes highlightsabst primabst ref specialabst 2468-8231 24688231 true 508 508 C Volume 508 18 111602 111602 111602 202105 May 2021 2021-05-01 2021-05-31 2021 Regular Papers article fla © 2021 Elsevier B.V. All rights reserved. ENHANCEDCO2METHANATIONACTIVITYOVERNICEO2CATALYSTBYONEPOTMETHOD TANG R 1 Introduction 2 Experimental 2.1 Chemical specification 2.2 Preparation of CeO2 supports and different Ni/CeO2 catalysts 2.3 Catalyst characterization 2.4 Catalytic activity test 3 Results and discussion 3.1 Effect of CeO2 preparation method on the structure and morphological properties of the supported Ni catalysts 3.1.1 Textural properties of 10Ni/CeO2 −X catalysts 3.1.2 Phase and morphologies of 10Ni/CeO2 −X catalysts 3.1.3 H2-TPR and H2-TPD analysis of 10Ni/CeO2−X catalysts 3.1.4 CO2-TPD analysis of 10Ni/CeO2−X catalysts 3.2 Effect of nickel loading on xNi/CeO2−M-1 catalysts 3.2.1 Textural properties of xNi/CeO2−M-1 catalysts 3.2.2 Phase and morphologies of xNi/CeO2−M-1 catalysts 3.2.3 H2-TPR and H2-TPD analysis of xNi/CeO2−M-1 catalysts 3.2.4 CO2-TPD analysis of xNi/CeO2−M-1 catalysts 3.3 CO2 methanation performance on different Ni/CeO2 catalysts 3.3.1 Effect of CeO2 preparation method on the performance of 10Ni/CeO2−X catalysts 3.3.2 Effect of Ni loading on the performance of xNi/CeO2−M-1 catalysts 3.3.3 Relationship of catalyst structure and performance 4 Conclusions Acknowledgements References HANSEN 2006 14288 14293 J YAN 2019 1289 1299 J ASHFORD 2020 119110 119119 B WU 2021 111304 111312 P WANG 2020 22 30 W YANG 2019 11242 11247 C YANG 2019 3161 3167 C ANIL 2020 11805 11815 C MA 2020 288 297 Q ZHOU 2019 3193 3228 W ARTZ 2018 434 504 J LI 2018 7651 7669 W VOGT 2019 188 197 C ITALIANO 2020 118494 118509 C SREEDHAR 2019 4478 4504 I SUN 2019 682 696 W FRONTERA 2017 59 86 P NGUYEN 2013 233 238 T AZIZ 2015 2647 2663 M ZHANG 2012 14455 14475 D MONTINI 2016 5987 6041 T SAKPAL 2018 171 180 T BIAN 2020 31 38 Z ARAIZA 2020 235 243 D DU 2012 10009 10016 X JOMJAREE 2020 T ROMBI 2016 144 153 E WINTER 2019 360 366 L ZHEN 2017 200 211 W ZHAO 2018 3160 3165 Z GONG 2020 2705 2709 Y PRINZ 2020 15800 15813 N MON 2018 6186 6191 M CHEN 2018 469 479 X TAO 2019 1060 1070 X THOMMES 2015 1051 1069 M REN 2020 1902 1913 J WESTERMANN 2015 120 125 A PAN 2014 74 78 Q RUI 2021 119581 119592 N DENG 2016 851 862 J GUO 2020 19278 119292 D BARRIO 2010 12689 12697 L LUISETTO 2019 63 78 I LIU 2016 7455 7459 Z SAGAR 2014 50226 50232 T GUO 2018 6203 6215 Y LEE 2019 8656 8662 S SUN 2020 12355 12368 C LI 2018 27 35 M LIAO 2014 256 264 X WANG 2013 5582 5588 S CARDENASARENAS 2020 118538 118546 A RUIZPUIGDOLLERS 2017 6493 6513 A GONG 2017 1770 1771 J TANGX2021X111602 TANGX2021X111602XR 2023-05-12T00:00:00.000Z 2023-05-12T00:00:00.000Z http://creativecommons.org/licenses/by-nc-nd/4.0/ © 2021 Elsevier B.V. All rights reserved. 2021-04-28T00:40:52.877Z http://vtw.elsevier.com/data/voc/AddOnTypes/50.7/eoas NSFC National Natural Science Foundation of China http://data.elsevier.com/vocabulary/SciValFunders/501100001809 http://sws.geonames.org/1814991 https://doi.org/10.15223/policy-017 https://doi.org/10.15223/policy-037 https://doi.org/10.15223/policy-012 https://doi.org/10.15223/policy-029 https://doi.org/10.15223/policy-004 item S2468-8231(21)00219-4 S2468823121002194 1-s2.0-S2468823121002194 10.1016/j.mcat.2021.111602 315758 2021-06-08T11:04:33.779143Z 2021-05-01 2021-05-31 1-s2.0-S2468823121002194-main.pdf https://s3-eu-west-1.amazonaws.com/prod-ucs-content-store-eu-west/content/pii:S2468823121002194/MAIN/application/pdf/44ad04760a89475aa95049ddb3ee3aaa/main.pdf main.pdf pdf true 7396539 MAIN 12 1-s2.0-S2468823121002194-main_1.png https://s3-eu-west-1.amazonaws.com/prod-ucs-content-store-eu-west/content/pii:S2468823121002194/PREVIEW/image/png/c7ee7e237a7caa937077ce6b7e0e57ac/main_1.png main_1.png png 56982 849 656 IMAGE-WEB-PDF 1 1-s2.0-S2468823121002194-gr11.jpg https://s3-eu-west-1.amazonaws.com/prod-ucs-content-store-eu-west/content/pii:S2468823121002194/gr11/DOWNSAMPLED/image/jpeg/8ce553410f6770e6c16d39fd84296a8f/gr11.jpg gr11 gr11.jpg jpg 38110 299 386 IMAGE-DOWNSAMPLED 1-s2.0-S2468823121002194-gr10.jpg https://s3-eu-west-1.amazonaws.com/prod-ucs-content-store-eu-west/content/pii:S2468823121002194/gr10/DOWNSAMPLED/image/jpeg/29c30269cb1caab16264eb7a1e4bcce7/gr10.jpg gr10 gr10.jpg jpg 102983 452 652 IMAGE-DOWNSAMPLED 1-s2.0-S2468823121002194-gr13.jpg https://s3-eu-west-1.amazonaws.com/prod-ucs-content-store-eu-west/content/pii:S2468823121002194/gr13/DOWNSAMPLED/image/jpeg/ae92fd77fbceeb2ee88f1b5578548291/gr13.jpg gr13 gr13.jpg jpg 71537 428 576 IMAGE-DOWNSAMPLED 1-s2.0-S2468823121002194-gr12.jpg https://s3-eu-west-1.amazonaws.com/prod-ucs-content-store-eu-west/content/pii:S2468823121002194/gr12/DOWNSAMPLED/image/jpeg/2ce23da64130d6cb26f8a064f29f37bc/gr12.jpg gr12 gr12.jpg jpg 44106 326 386 IMAGE-DOWNSAMPLED 1-s2.0-S2468823121002194-fx1.jpg https://s3-eu-west-1.amazonaws.com/prod-ucs-content-store-eu-west/content/pii:S2468823121002194/fx1/DOWNSAMPLED/image/jpeg/35d71b9c1c35480be573a215c6631301/fx1.jpg fx1 true fx1.jpg jpg 15650 98 301 IMAGE-DOWNSAMPLED 1-s2.0-S2468823121002194-gr4.jpg https://s3-eu-west-1.amazonaws.com/prod-ucs-content-store-eu-west/content/pii:S2468823121002194/gr4/DOWNSAMPLED/image/jpeg/4cd54ce203fa368bb5b350d83a921073/gr4.jpg gr4 gr4.jpg jpg 67869 300 646 IMAGE-DOWNSAMPLED 1-s2.0-S2468823121002194-gr3.jpg https://s3-eu-west-1.amazonaws.com/prod-ucs-content-store-eu-west/content/pii:S2468823121002194/gr3/DOWNSAMPLED/image/jpeg/8d2d2e64da9159dbf80b37fd9c7cddc1/gr3.jpg gr3 gr3.jpg jpg 50994 302 386 IMAGE-DOWNSAMPLED 1-s2.0-S2468823121002194-gr2.jpg https://s3-eu-west-1.amazonaws.com/prod-ucs-content-store-eu-west/content/pii:S2468823121002194/gr2/DOWNSAMPLED/image/jpeg/0453e56084098c29a7a1115864de9a1f/gr2.jpg gr2 gr2.jpg jpg 36481 306 386 IMAGE-DOWNSAMPLED 1-s2.0-S2468823121002194-gr1.jpg https://s3-eu-west-1.amazonaws.com/prod-ucs-content-store-eu-west/content/pii:S2468823121002194/gr1/DOWNSAMPLED/image/jpeg/45dd61e72f3a2e66cbc8e1cfe89df7af/gr1.jpg gr1 gr1.jpg jpg 56680 254 647 IMAGE-DOWNSAMPLED 1-s2.0-S2468823121002194-gr8.jpg https://s3-eu-west-1.amazonaws.com/prod-ucs-content-store-eu-west/content/pii:S2468823121002194/gr8/DOWNSAMPLED/image/jpeg/621a9187e4a13816b3e9d68e108fc25e/gr8.jpg gr8 gr8.jpg jpg 47573 284 386 IMAGE-DOWNSAMPLED 1-s2.0-S2468823121002194-gr15.jpg https://s3-eu-west-1.amazonaws.com/prod-ucs-content-store-eu-west/content/pii:S2468823121002194/gr15/DOWNSAMPLED/image/jpeg/a8339764d77fb682ce68b5ce48d3e017/gr15.jpg gr15 gr15.jpg jpg 54313 257 661 IMAGE-DOWNSAMPLED 1-s2.0-S2468823121002194-gr7.jpg https://s3-eu-west-1.amazonaws.com/prod-ucs-content-store-eu-west/content/pii:S2468823121002194/gr7/DOWNSAMPLED/image/jpeg/4b9373bc9c7690dda5e1645701b672da/gr7.jpg gr7 gr7.jpg jpg 59861 253 651 IMAGE-DOWNSAMPLED 1-s2.0-S2468823121002194-gr14.jpg https://s3-eu-west-1.amazonaws.com/prod-ucs-content-store-eu-west/content/pii:S2468823121002194/gr14/DOWNSAMPLED/image/jpeg/4c7cd2e4d3cca1db9927edd89c9a5aa1/gr14.jpg gr14 gr14.jpg jpg 41051 245 651 IMAGE-DOWNSAMPLED 1-s2.0-S2468823121002194-gr6.jpg https://s3-eu-west-1.amazonaws.com/prod-ucs-content-store-eu-west/content/pii:S2468823121002194/gr6/DOWNSAMPLED/image/jpeg/70b59c076cd9b02b0c431e0cbbec9eeb/gr6.jpg gr6 gr6.jpg jpg 37570 299 386 IMAGE-DOWNSAMPLED 1-s2.0-S2468823121002194-gr5.jpg https://s3-eu-west-1.amazonaws.com/prod-ucs-content-store-eu-west/content/pii:S2468823121002194/gr5/DOWNSAMPLED/image/jpeg/131fc0e1d3b468a1fb94de6561cb44f5/gr5.jpg gr5 gr5.jpg jpg 54094 259 644 IMAGE-DOWNSAMPLED 1-s2.0-S2468823121002194-gr9.jpg https://s3-eu-west-1.amazonaws.com/prod-ucs-content-store-eu-west/content/pii:S2468823121002194/gr9/DOWNSAMPLED/image/jpeg/29ec0000f45c44882805f70ec225e043/gr9.jpg gr9 gr9.jpg jpg 44161 301 386 IMAGE-DOWNSAMPLED 1-s2.0-S2468823121002194-gr11.sml https://s3-eu-west-1.amazonaws.com/prod-ucs-content-store-eu-west/content/pii:S2468823121002194/gr11/THUMBNAIL/image/gif/c3d4c6db2ae87342d459ba1ef9a1d781/gr11.sml gr11 gr11.sml sml 11551 164 211 IMAGE-THUMBNAIL 1-s2.0-S2468823121002194-gr10.sml https://s3-eu-west-1.amazonaws.com/prod-ucs-content-store-eu-west/content/pii:S2468823121002194/gr10/THUMBNAIL/image/gif/ed17fc1c8f6e163895303a9a5bda222e/gr10.sml gr10 gr10.sml sml 24958 152 219 IMAGE-THUMBNAIL 1-s2.0-S2468823121002194-gr13.sml https://s3-eu-west-1.amazonaws.com/prod-ucs-content-store-eu-west/content/pii:S2468823121002194/gr13/THUMBNAIL/image/gif/07bb0e842b9aacbf8a8f4a7354502b68/gr13.sml gr13 gr13.sml sml 12655 163 219 IMAGE-THUMBNAIL 1-s2.0-S2468823121002194-gr12.sml https://s3-eu-west-1.amazonaws.com/prod-ucs-content-store-eu-west/content/pii:S2468823121002194/gr12/THUMBNAIL/image/gif/ee97d4d4cd82e0610b741d596910939d/gr12.sml gr12 gr12.sml sml 12350 164 194 IMAGE-THUMBNAIL 1-s2.0-S2468823121002194-fx1.sml https://s3-eu-west-1.amazonaws.com/prod-ucs-content-store-eu-west/content/pii:S2468823121002194/fx1/THUMBNAIL/image/gif/f3995883268e9cd807598a46e7f4d132/fx1.sml fx1 true fx1.sml sml 8284 72 219 IMAGE-THUMBNAIL 1-s2.0-S2468823121002194-gr4.sml https://s3-eu-west-1.amazonaws.com/prod-ucs-content-store-eu-west/content/pii:S2468823121002194/gr4/THUMBNAIL/image/gif/a821c6851d55a8f6d41a6f377f91425b/gr4.sml gr4 gr4.sml sml 15185 102 219 IMAGE-THUMBNAIL 1-s2.0-S2468823121002194-gr3.sml https://s3-eu-west-1.amazonaws.com/prod-ucs-content-store-eu-west/content/pii:S2468823121002194/gr3/THUMBNAIL/image/gif/7eb9bb17647983cba91ced0ca934db19/gr3.sml gr3 gr3.sml sml 14124 164 210 IMAGE-THUMBNAIL 1-s2.0-S2468823121002194-gr2.sml https://s3-eu-west-1.amazonaws.com/prod-ucs-content-store-eu-west/content/pii:S2468823121002194/gr2/THUMBNAIL/image/gif/6be6d055b11578c0f11fab6b50439143/gr2.sml gr2 gr2.sml sml 10670 164 207 IMAGE-THUMBNAIL 1-s2.0-S2468823121002194-gr1.sml https://s3-eu-west-1.amazonaws.com/prod-ucs-content-store-eu-west/content/pii:S2468823121002194/gr1/THUMBNAIL/image/gif/cd2dd85b2414cb107d1725a3dcb14ed7/gr1.sml gr1 gr1.sml sml 8956 86 219 IMAGE-THUMBNAIL 1-s2.0-S2468823121002194-gr8.sml https://s3-eu-west-1.amazonaws.com/prod-ucs-content-store-eu-west/content/pii:S2468823121002194/gr8/THUMBNAIL/image/gif/bc411a0b9b8e86dff5511180f7f52763/gr8.sml gr8 gr8.sml sml 14206 161 219 IMAGE-THUMBNAIL 1-s2.0-S2468823121002194-gr15.sml https://s3-eu-west-1.amazonaws.com/prod-ucs-content-store-eu-west/content/pii:S2468823121002194/gr15/THUMBNAIL/image/gif/2a9235bea1af4ac09893bc4f6d91c80c/gr15.sml gr15 gr15.sml sml 11233 85 219 IMAGE-THUMBNAIL 1-s2.0-S2468823121002194-gr7.sml https://s3-eu-west-1.amazonaws.com/prod-ucs-content-store-eu-west/content/pii:S2468823121002194/gr7/THUMBNAIL/image/gif/0e8c48e1c345870ee7d72dbf82ebae6e/gr7.sml gr7 gr7.sml sml 8910 85 219 IMAGE-THUMBNAIL 1-s2.0-S2468823121002194-gr14.sml https://s3-eu-west-1.amazonaws.com/prod-ucs-content-store-eu-west/content/pii:S2468823121002194/gr14/THUMBNAIL/image/gif/0005594c93db57ebfb69e359db48d46c/gr14.sml gr14 gr14.sml sml 7266 82 219 IMAGE-THUMBNAIL 1-s2.0-S2468823121002194-gr6.sml https://s3-eu-west-1.amazonaws.com/prod-ucs-content-store-eu-west/content/pii:S2468823121002194/gr6/THUMBNAIL/image/gif/186c582978f8be8f158f9417a0152424/gr6.sml gr6 gr6.sml sml 14045 164 212 IMAGE-THUMBNAIL 1-s2.0-S2468823121002194-gr5.sml https://s3-eu-west-1.amazonaws.com/prod-ucs-content-store-eu-west/content/pii:S2468823121002194/gr5/THUMBNAIL/image/gif/45f81d9acecd7c68fa5f7e3c4af51d93/gr5.sml gr5 gr5.sml sml 8442 88 219 IMAGE-THUMBNAIL 1-s2.0-S2468823121002194-gr9.sml https://s3-eu-west-1.amazonaws.com/prod-ucs-content-store-eu-west/content/pii:S2468823121002194/gr9/THUMBNAIL/image/gif/d73d1b3c22190864e127729b79b137ba/gr9.sml gr9 gr9.sml sml 12248 164 210 IMAGE-THUMBNAIL 1-s2.0-S2468823121002194-si1.svg https://s3-eu-west-1.amazonaws.com/prod-ucs-content-store-eu-west/content/pii:S2468823121002194/STRIPIN/image/svg+xml/03ad7de22a44231e73f0d58d76e14f4f/si1.svg si1 si1.svg svg 4333 ALTIMG 1-s2.0-S2468823121002194-si2.svg https://s3-eu-west-1.amazonaws.com/prod-ucs-content-store-eu-west/content/pii:S2468823121002194/STRIPIN/image/svg+xml/1830c3f916bac56a1dc492cac8919305/si2.svg si2 si2.svg svg 12620 ALTIMG 1-s2.0-S2468823121002194-si3.svg https://s3-eu-west-1.amazonaws.com/prod-ucs-content-store-eu-west/content/pii:S2468823121002194/STRIPIN/image/svg+xml/e333d7719fefaced2cf7be8e9ef9020a/si3.svg si3 si3.svg svg 13516 ALTIMG 1-s2.0-S2468823121002194-si4.svg https://s3-eu-west-1.amazonaws.com/prod-ucs-content-store-eu-west/content/pii:S2468823121002194/STRIPIN/image/svg+xml/c5d16b440b7a5faebef7e13002d69ea0/si4.svg si4 si4.svg svg 11900 ALTIMG 1-s2.0-S2468823121002194-si5.svg https://s3-eu-west-1.amazonaws.com/prod-ucs-content-store-eu-west/content/pii:S2468823121002194/STRIPIN/image/svg+xml/9bd9a42287dffe218cffa478629d47aa/si5.svg si5 si5.svg svg 13870 ALTIMG 1-s2.0-S2468823121002194-am.pdf am am.pdf pdf 2941938 AAM-PDF https://s3-eu-west-1.amazonaws.com/prod-ucs-content-store-eu-west/content/egi:10QT5N8VZ3F/MAIN/application/pdf/7c2c26882d8f68db6f005692877dfa87/am.pdf MCAT 111602 111602 S2468-8231(21)00219-4 10.1016/j.mcat.2021.111602 Fig. 1 (a) N2 adsorption-desorption isotherms and (b) pore size distribution of fresh 10Ni/CeO2−X catalysts. Fig 1 Fig. 2 XRD patterns of fresh10Ni/CeO2−X catalysts. Fig 2 Fig. 3 Visible Raman spectra of reduced 10Ni/CeO2−X catalysts and corresponding supports. Fig 3 Fig. 4 SEM images of Ce-MOF precursor and catalysts supported on different CeO2:(a) Ce-MOF, (b) 10Ni/CeO2−M, (c) 10Ni/CeO2−M-1, (d) 10Ni/CeO2−P, (e) 10Ni/CeO2−C. Fig 4 Fig. 5 H2-TPR profiles of (a) calcined CeO2 supports and (b) corresponding 10Ni/CeO2−X catalysts. Fig 5 Fig. 6 CO2-TPD profiles of reduced 10Ni/CeO2−X catalysts. Fig 6 Fig. 7 N2 adsorption-desorption isotherms (a) and pore size distribution (b) of fresh xNi/CeO2−M-1 catalysts. Fig 7 Fig. 8 XRD patterns of fresh xNi/CeO2−M-1 catalysts. Fig 8 Fig. 9 Visible Raman spectra of reduced xNi/CeO2−M-1 catalysts. Fig 9 Fig. 10 SEM images of fresh catalysts: (a) 5Ni/CeO2−M-1, (b) 10Ni/CeO2−M-1, (c) 15Ni/CeO2−M-1, (d) 20Ni/CeO2−M-1. Fig 10 Fig. 11 H2-TPR profiles of fresh catalysts: (a) 5Ni/CeO2−M-1, (b) 10Ni/CeO2−M-1, (c) 15Ni/CeO2−M-1, (d) 20Ni/CeO2−M-1. Fig 11 Fig. 12 CO2-TPD profiles of reduced xNi/CeO2−M-1 catalysts. Fig 12 Fig. 13 The catalytic performance over different Ni/CeO2 catalysts: (a) CO2 conversion of 10Ni/CeO2−X, (b) CH4 selectivity of 10Ni/CeO2−X, (c) CO2 conversion of xNi/CeO2−M-1, (d) CH4 selectivity of xNi/CeO2−M-1. (Reaction conditions: 0.20 g catalyst, T = 325 °C, P = 0.1 MPa, n(CO2):n(H2) = 1:4, total flow rate = 150 mL/min, WHSV=45,000 mL•gcat −1•h − 1). Fig 13 Fig. 14 Catalytic stability over 10Ni/CeO2−M catalyst and 10Ni/CeO2−M-1 catalyst for CO2 methanation. (Reaction conditions: 0.20 g catalyst, T = 325 °C, P = 0.1 MPa, n(CO2):n(H2) = 1:4, total flow rate = 150 mL/min, WHSV = 45,000 mL•gcat −1•h− 1.). Fig 14 Fig. 15 Relationship of key physiochemical factors and CO2 conversion over different catalysts:(a) 10Ni/CeO2-X and (b) xNi/CeO2−M-1 catalysts. (Reaction conditions: 0.20 g catalyst, T = 325 °C, P = 0.1 MPa, n(CO2):n(H2) = 1:4, total flow rate = 150 mL/min, WHSV = 45,000 mL•gcat −1•h− 1). Fig 15 Table 1 Textural and chemical properties of fresh xNi/CeO2−X catalysts. Table 1 Catalyst SBET a (m2/g) Vp b (cm3/g) Dp c (nm) F2g Raman shift (cm−1) ID/IF2g d H2-uptake e (mL/gcat) 10Ni/CeO2−C 4.7 0.04 31.5 463 0.14 0.76 10Ni/CeO2−P 75 0.14 6.4 458 0.26 9.17 10Ni/CeO2−M 70 0.21 16.5 457 0.47 9.70 5Ni/CeO2−M-1 65 0.16 10.5 463 0.34 13.50 10Ni/CeO2−M-1 69 0.17 5.4 456 0.49 13.70 15Ni/CeO2−M-1 111 0.18 5.7 456 0.83 19.10 20Ni/CeO2−M-1 102 0.19 7.5 458 0.80 16.70 a Calculated by the BET equation. b BJH desorption pore volume. c BJH desorption average pore diameter. d Calculated by Raman spectrum. e Calculated by integrate peaks in H2-TPD. Table 2 CO2-TPD results of reduced 10Ni/CeO2−X catalysts. Table 2 Catalyst Peak temperature ( °C) Integrated area per gram catalyst (area⋅g − 1) Weak sites Medium sites Weak sites Medium sites Total sites 10Ni/CeO2−C 87 – 11.2 – 11.2 10Ni/CeO2−P 104 205 3.4 13 16.4 10Ni/CeO2−M 112 205 1.4 15.4 16.8 10Ni/CeO2−M-1 86 285 1.0 5.7 6.7 Table 3 CO2-TPD results of reduced xNi/CeO2−M-1 catalysts. Table 3 Catalyst Peak temperature ( °C) Integrated area per gram catalyst (area⋅g − 1) Weak sites Medium sites Weak sites Medium sites Total sites 5Ni/CeO2−M-1 92 276 1.8 3.3 5.1 10Ni/CeO2−M-1 86 285 1.0 5.7 6.7 15Ni/CeO2−M-1 90 290 1.3 6.9 8.2 20Ni/CeO2−M-1 83 263 1.1 8.2 9.3 Enhanced CO2 methanation activity over Ni/CeO2 catalyst by one-pot method Rui Tang 1 Niamat Ullah 1 Yajun Hui Xin Li Zhenhua Li ⁎ Key Laboratory for Green Chemical Technology of Ministry of Education, Collaborative Innovation Center of Chemical Science and Engineering (Tianjin), School of Chemical Engineering & Technology, Tianjin University, Tianjin 300072, China Key Laboratory for Green Chemical Technology of Ministry of Education Collaborative Innovation Center of Chemical Science and Engineering (Tianjin) School of Chemical Engineering & Technology Tianjin University Tianjin 300072 China Key Laboratory for Green Chemical Technology of Ministry of Education, Collaborative Innovation Center of Chemical Science and Engineering (Tianjin), School of Chemical Engineering & Technology, Tianjin University, Tianjin 300072, China ⁎ Corresponding author. 1 These authors contribute equally to this work. Carbon dioxide hydrogenation for value-added chemicals has been regarded as a promising way for CO2 utilization. This paper describes the preparation of Ni/CeO2 catalysts derived from Ce-MOF precursor by impregnation or one-pot method and their application in carbon dioxide methanation. Various techniques were employed to characterize the prepared catalysts, including N2 adsorption–desorption, X-ray diffraction (XRD), Raman spectroscopy, field emission scanning electron microscopy (SEM), H2-temperature programmed reduction (H2-TPR), H2-temperature programmed desorption (H2-TPD) and CO2-temperature programmed desorption (CO2-TPD). The results showed that compared with commercial CeO2 and CeO2 prepared by precipitation, CeO2 derived from Ce-MOF exhibited more oxygen vacancies and lower temperature reducibility, making it more beneficial for the adsorption and activation of CO2. Consequently, nickel supported on rod-shaped CeO2 derived from Ce-MOF exhibited higher CO2 conversion and methane selectivity at low temperatures. Furthermore, the Ni/CeO2−M-1 catalysts prepared by one-pot method showed superior activity since nickel could be partially incorporated into ceria lattice, leading to the formation of Ce1-xNixO2-y solid solutions and oxygen vacancies. The effect of nickel loading on the properties of the catalysts by one-pot method was also investigated, and the optimum Ni loading was 15 wt.% owing to the maximum number of oxygen vacancies being reached. Graphical abstract Image, graphical abstract Keywords CO2 methanation Hydrogenation Ni/CeO2 Ce-MOF 1 Introduction The consumption of fossil fuels continues to increase every day, leading to global emissions growth of CO2, which threatens the climate and causes serious environmental problems [1]. CCUS (Carbon Capture, Utilization and Storage) has been regard as a cost-effective technology for achieving large emission reductions [2], while chemical utilization plays a vital role among those processes, such as CO2 dissociation [3,4], CO2 hydrogenation reactions [5-7], methane dry reforming reaction [8,9] and so on [10-12]. Carbon dioxide hydrogenation to methane process (Eq. (1)), also known as Sabatier reaction, takes place at ambient pressure and methane (CH4) is the main product [13]. Besides, CH4 is a clean fuel as well as an energy vector, which can be used in manned spacecraft [14]. Consequently, carbon dioxide methanation catches great attention of researchers and chemical industries. However, CO2 with steady state is hard to be activated. Therefore, great efforts have been devoted to design efficient catalysts for CO2 methanation [15-17]. At the same time, with increased temperatures during the reaction, agglomeration and carbon deposition occurred on active metal particles resulting the deactivation of catalysts [18]. Therefore, it is also essential to develop catalysts with low temperature activities for carbon dioxide methanation. (1) C O 2 + 4 H 2 → C H 4 + 2 H 2 O Nickel has been used as an active metal because of its low price and good performance in the hydrogenation process [19]. CeO2 is often used as a catalyst support for its excellent redox property and the ability to store and release oxygen [20,21]. A large number of studies has shown that the morphologies of CeO2 affected the distribution of active metals, oxygen vacancies and further affected the catalytic activities [22,23]. Sakpal et al. compared the catalytic activity of Ru catalysts supported on CeO2 with different morphologies and found that the number of oxygen vacancies as well as catalytic activity reached highest over Ru/CeO2/r catalyst [22]. Bian et al. studied the effects of rod and cubic CeO2 and found that the rod-shaped CeO2 exhibited higher activity and the reaction followed the formate-intermediate route [23]. Many other studies have proved the view that CeO2 with rod structure was in favor in reduction of CO2 [24,25]. What's more, preparation methods for CeO2 such as precipitation, hydrothermal synthesis and the template method will exert a significant effect on its morphology and size [5,26,27]. However, alkaline reagent or template are required in these methods during the catalyst preparation, which needs to be removed, making the synthesis burdensome with increased cost. It has been found that nickel supported on ceria is a no-expensive but active catalyst for CO2 hydrogenation [28]. Therefore, the study on Ni/CeO2 catalysts for CO2 methanation with simple method is valuable and meaningful to design new effective Ni/CeO2 catalyst used in industry. In the past years, MOFs materials formed by self-assembly of organic ligands and metal ions/clusters have been widely studied as support or catalyst precursor due to their large specific surface areas and adjustable structures [29-33]. Among the MOFs materials, Ce-MOF attracted great interest due to the specific physiochemical properties of the corresponding CeO2 [16,34,35]. Sun et al. compared three kinds of CeO2 derived from MOFs, including Ce-MOF-808, Ce-BTC and Ce-UIO-66 precursors. The results showed that CeO2 derived from Ce-BTC exhibited rod like structure and more defective sites which were of great significance for the catalytic combustion [16]. Chen et al. investigated the effect of Ce-MOF pyrolysis temperature on catalyst performance for toluene combustion and found that CeO2−MOF/350 catalyst (pyrolyzed at 350 °C) exhibited great catalytic activity and stability due to its higher oxygen vacancies and lower temperature reducibility [34]. Tao et al. synthesized CeO2 derived from Ce-MOF with DBD plasma for methyl orange degradation which showed that the CeO2 derived from Ce-MOF had great photocatalytic performance attributed to its high crystallization, strong adsorption capacity and oxygen vacancies [35]. However, the properties and reaction performance of Ni catalysts support on CeO2 derived from Ce-MOF for CO2 methanation have not yet been reported. Hence, efforts are required to gain new insights into the synergy effect of CeO2 and nickel oxide along with the role of their interactions in the formation of oxygen vacancy sites on the catalyst surface. In this work, different CeO2 were obtained by Ce-MOF pyrolysis, precipitation and commercial way and the corresponding catalysts for CO2 methanation performance were tested to investigate the effect of preparation method of supports. Moreover, a facile approach to prepare the Ni/CeO2 catalysts via one-pot method was described and the effect of nickel loading was further investigated. The physical and chemical characters of catalysts were studied by N2 adsorption–desorption, X-ray diffraction (XRD), Raman spectroscopy, field emission scanning electron microscopy (SEM), H2-temperature programmed reduction (H2-TPR), H2-temperature programmed desorption (H2-TPD) and CO2-temperature programmed desorption (CO2-TPD) to explore the structure-activity relationship and the factors influencing the CO2 methanation activities. 2 Experimental 2.1 Chemical specification Ni(NO3)2•6H2O (98.0%, Tianjin Kermel Chemical Co., Ltd.), Ce(NO3)3•6H2O (99.0%, Tianjin Kermel Chemical Co., Ltd.), NH3•H2O (ammonium hydroxide, 28 wt.%, Tianjin Kermel Chemical Co., Ltd.) and 1,3,5-Benzenetricarboxylic acid (98 wt.%, Shanghai Aladdin Chemical Reagent Co., Ltd.) were used without further purification. 2.2 Preparation of CeO2 supports and different Ni/CeO2 catalysts 10 wt.% Ni/CeO2 catalysts were obtained by incipient wetness impregnation and CeO2 was obtained by Ce-MOF pyrolysis method, precipitation and commercial CeO2 respectively. Ce-MOF was prepared according to the method of Chen et al. [34] as follows: 2.1 g 1,3,5-benzenetricarboxylic acid was dissolved in 10 mL deionized water and 10 mL ethanol while 4.34 g Ce(NO3)3•6H2O was dissolved in 45 mL deionized water. The above solutions were mixed together under vigorous stirring at 70 °C for 1 h. Then the mixture was centrifuged and washed with water and ethanol three times. The obtained solids were dried at 100 °C for 10 h, then calcined at 460 °C for 3 h with a heating rate of 3 °C/min to get CeO2 derived from Ce-MOF. CeO2 derived from precipitation were synthesized by dissolving 12 g Ce(NO3)3•6H2O in 300 mL deionized water. Then 11.6 g ammonia (28 wt.%) in 300 mL deionized water was slowly added to the above solution under intensive stirring for 12 h. After filtration followed by washing three times with water, the solids were dried at 100 °C for 10 h, and calcined at 350 °C for 2 h with the heating rate of 3 °C/min. Commercial CeO2 were used as received without any treatment. The introduction of Ni on the support was carried out by incipient wetness impregnation. Typically, a certain amount of Ni(NO3)2•6H2O was dissolved in deionized water and the solution was added into the support dropwise. The solids were kept at room temperature for 10 h and dried at 100 °C for 10 h followed by calcination at 460 °C for 3 h. The obtained catalysts were denoted as 10Ni/CeO2−X , while X = M, P or C means support derived from Ce-MOF pyrolysis, precipitation preparation and commercial CeO2 respectively, 10 is nickel loading as 10 wt.%. We modified the Ce-MOF pyrolysis method by adding nickel precursor directly into Ce-MOF to prepare Ni/CeO2−M-1 in one step with different Ni loading. Specifically, 2.1 g 1,3,5-benzenetricarboxylic acid were dissolved in 10 mL deionized water and 10 mL ethanol (solution A). 4.34 g Ce(NO3)3•6H2O and a certain amount of Ni(NO3)2•6H2O were dissolved in 65 mL deionized water to get solution B. Then solution B was mixed with solution A with steady agitation at 70 °C for 10 h. The obtained solids were dried at 100 °C for 10 h, and then calcined in air at 460 °C for 3 h with the rate of 3 °C/min. These catalyst with different nickel loading were denoted as xNi/CeO2−M-1 (x = 5, 10, 15, 20 wt.%). 2.3 Catalyst characterization N2 adsorption–desorption measurements were carried on TriStar 3000 analyzer (Micromeritics, Norcross, GA, U.S.A.). Prior to the analysis, the degasification for all catalysts were carried out at 300 °C for 4 h. The surface area was evaluated by the Brunauer–Emmett–Teller (BET) method and the pore structure parameters including pore volume and average pore size were obtained by the Barrett–Joyner–Halenda (BJH) method. The X‐ray diffraction (XRD) patterns for all catalysts were measured on a X‐ray diffractometer (Rigaku, Japan) employing the Cu Kα radiation (c = 1.54056 Å). And the patterns were obtained from 10° to 80° at the scanning rate of 8 °/min. Crystalline phases were indexed and identified by JCPDS standard cards. Raman spectrums for all catalysts were obtained on an InVia-Reflex (Renishaw, England) spectrometer with 532 nm He-Ne lasers as the excitation and an Ar+ ion laser as the incident light beam. The laser beam intensity and the spectrum slit width were 8 mW and 25 μm, respectively. The micromorphology analysis for catalysts was performed on a field emission scanning electron microscope S4800 (Hitachi, Japan). Catalysts were first dispersed in ethanol and then on a piece of copper sheet which is attached to the conductive adhesive. Then the gold was sprayed on the surface of catalysts. H2 temperature-programmed reduction (H2-TPR) was carried on an AutoChem 2910 instrument (Micromeritics, Norcross, GA, U.S.A.). Fresh samples of 50 mg (20–40 mesh) were used in the test and they were treated under argon atmosphere at 200 °C for 1 h to obtain clean surfaces before the analysis. Then, at the flow of 10% H2/Ar, the samples were heated to 750 °C at the rate of 10 °C/min. A thermal conductivity detector (TCD) was employed to record the hydrogen consumption signal during heating process. Hydrogen temperature programmed desorption (H2-TPD) and CO2 temperature-programmed desorption (CO2-TPD) characterizations were also carried out on the AutoChem 2910 instrument (Micromeritics, Norcross, GA, U.S.A.). At the beginning, fresh catalysts were treated under argon atmosphere at 200 °C for 1 h to obtain the clean surfaces. And they were reduced at 400 °C for 1 h under hydrogen flow of 30 mL/min. After reduction, the gas was switched to argon and maintained for 1 h and the hydrogen or carbon dioxide was pulsed 15 times with helium treatment for 30 min to remove the physically adsorbed gasses. Finally, the temperature was increased to 450 °C at the rate of 10 °C/min. 2.4 Catalytic activity test A fixed‐bed quartz reactor with an inner diameter (I.D.) of 8 mm was used to test the carbon dioxide hydrogenation performance at 250–450 °C under atmospheric pressure. In detail, the mixture of 0.2 g fresh catalyst (20–40 mesh) and 0.4 g quartz sand (40–60 mesh) was loaded in the reactor. Prior to the reaction, samples were reduced in situ at 400 °C under hydrogen flow of 30 mL/min together with nitrogen (30 mL/min) for 1 h. The temperature then decreased to 250 °C at the nitrogen flow of 30 mL/min. The feed gas (CO2:H2=4:1 molar ratio) was introduced to the reactor at the total flow of 150 mL/min. At each temperature, reaction was maintained for 30 min before analyzing. The water vapor generated during the reaction was removed in a cold trap, and other products were quantitatively analyzed by a gas chromatograph (Agilent 4890D). Carbon dioxide conversion, methane or carbon monoxide selectivity as well as carbon balance were calculated by the following formula: X C O 2 ( % ) = F ( C O 2 ) in − F ( C O 2 ) out F ( C O 2 ) in × 100 % S C H 4 ( % ) = F ( C H 4 ) out F ( C O 2 ) in − F ( C O 2 ) out × 100 % S CO ( % ) = F ( CO ) out F ( C O 2 ) in − F ( C O 2 ) out × 100 % C B ( % ) = [ 1 − F ( C O 2 ) out + F ( C H 4 ) out + F ( CO ) out F ( C O 2 ) in ] × 100 % X means conversion while S represents selectivity. Fin and Fout (mL/min) represent the inlet flowrate and outlet flowrate, respectively. CB means carbon balance, which was within ±3% for all the tests that indicated the reliability of the results. 3 Results and discussion 3.1 Effect of CeO2 preparation method on the structure and morphological properties of the supported Ni catalysts 3.1.1 Textural properties of 10Ni/CeO2 −X catalysts The N2 adsorption desorption isotherms and pore size distribution profiles of 10Ni/CeO2−X catalysts are shown in Fig. 1 . According to IUPAC classification, 10Ni/CeO2−C catalyst showed an isotherm of type III without obvious hysteresis hoop and 10Ni/CeO2−P catalyst showed a typical IV isotherm with H2 hysteresis loop, which indicated mesoporous structures in the catalyst [36]. While 10Ni/CeO2−M catalyst and 10Ni/CeO2−M-1 catalyst showed an isotherm of type II with H4 hysteresis loop, indicating the existence of stacking pores [36]. As shown in Fig. 1 b, no obvious pore size distribution was observed for 10Ni/CeO2−C catalyst, which indicated few pores in the sample probably as the result of the properties of commercial CeO2. While pore size distribution of other catalysts were relatively broad and obvious peaks were observed for 10Ni/CeO2−P and 10Ni/CeO2−M-1 catalysts in the pattern. Differences in pores sizes and distributions of these catalysts were induced by interparticle voids to a large extent, should affect the ability of CO2 adsorption and dissociation, thus leading to different performance for CO2 methanation [37]. The structure parameters of the catalysts are calculated and summarized in Table 1 . It can be seen 10Ni/CeO2−P catalyst showed the highest specific surface area (75 m2/g) and 10Ni/CeO2−M catalyst showed the highest pore volume (0.21 cm3/g). Comparatively, 10Ni/CeO2−M-1 catalyst has moderate specific surface area (69 m2/g) and relatively large pore volume (0.17 cm3/g). Generally, the difference in specific surface area and pore volume plays an important role in the diffusion of reaction gas in the catalyst pore channels as well as adsorption and activation of reaction gas and intermediate products [38,39]. Therefore, compared with the other three catalysts, 10Ni/CeO2−M catalyst having relatively large SBET and Vpore together with a wide pore size distribution could benefit the dispersion of nickel particles during the preparation and improve CO2 adsorption/dissociation during the reaction. However, 10Ni/CeO2−M-1 catalyst showed more attractive performance than 10Ni/CeO2−M catalyst, further chemical properties should be investigated. 3.1.2 Phase and morphologies of 10Ni/CeO2 −X catalysts XRD patterns of 10Ni/CeO2−X catalysts are shown in Fig. 2 . The diffraction peaks located at 2θ= 28.5°, 33.1°, 47.5°, 56.3°, 59.1°, 69.4°, 76.7°and 79.1°, corresponding to (111), (200), (220), (331), (222), (400), (331) and (420) crystal facets of cubic fluorite CeO2 (JCPDS No.34–0394). Significant differences in peak intensities were observed which indicated that the crystallinity of CeO2 was affected by preparation methods. As shown in the pattern, CeO2 particle size of 10Ni/CeO2−C catalyst is relatively larger, which is nearly the same in the other three catalysts. While weak diffraction peaks located at 2θ= 37.2°, 43.3° which corresponds to NiO (JCPDS No.44–1159) were observed for all catalysts. That indicated NiO particles were reasonably small and dispersed well on different CeO2 supports. Moreover, some nickel species may have been incorporated into ceria lattice to form Ce1-xNixO2-y solid solutions, in which x represents the molar percentage of Ni substituted in the ceria lattice, and y represents the molar percentage of oxygen vacancies. Then Raman spectra was used to confirm the existence of the Ce1-xNixO2-y solid solutions and obtain oxygen vacancy information over as-prepared catalysts. As shown in Fig. 3 , the strong peaks at 460 cm−1 are assigned to the F2g mode of fluorite-like CeO2 phase [40]. It's clear that F2g mode peaks shifted to lower frequencies and broadened near 460 cm−1 for 10Ni/CeO2−X catalysts as compared to bare supports, suggesting a strong interaction between NiO and CeO2 caused by the formation of Ce1-xNixO2-y solid solutions in the catalysts [41]. As shown in Table 1 , the shift degree of the catalysts decreased in the order: 10Ni/CeO2−M-1>10Ni/CeO2−M>10Ni/CeO2−P>10Ni/CeO2−C, indicating that 10Ni/CeO2−M-1 possessed the largest portion of cerium-nickel solid solutions. As can be seen in the pattern, the D band at range of 500–700 cm−1 are caused by oxygen vacancies in catalysts, which can be decomposed into two components at 538 cm−1 (De) and 609 cm−1 (Di) [42]. Generally, De and Di modes are attributed to the oxygen vacancies produced by the dissolution of nickel into the ceria matrix and the transformation of different ceria (Ce3+ and Ce4+), respectively [42]. Therefore, the appearance of De mode confirms the existence of the Ce1-xNixO2-y solid solutions in the catalysts [41-43]. Compared with CeO2 supports, the increase intensities of D band were observed after Ni loaded, indicating that NiO promoted the formation of oxygen vacancies in CeO2 [30,44]. The relative intensity of D band to F2g band (ID/IF2g) is an indication of oxygen vacancy concentration [41,45] and the order of ID/IF2g values decreased as the following order: 10Ni/CeO2−M-1(0.49)>10Ni/CeO2−M(0.47)>10Ni/CeO2−P(0.26)>10Ni/CeO2−C(0.14) ( Table 1 ), indicating that the oxygen vacancy concentration in corresponding carriers decreased in the following order: CeO2−MOF>CeO2−P>CeO2−C. In brief, the Raman results verified the XRD data. From the characterizations of as-prepared samples discussed above, we conclude that nickel oxides and Ce1-xNixO2-y coexisted in fresh 10Ni/CeO2−X catalysts while nickel particles were relatively small and the Ce1-xNixO2-y proportion varied with preparation method. In order to observe morphologies of catalysts, field emission scanning electron microscopy (SEM) was carried out and the results were shown in Fig. 4 . Compared to other three catalysts, the 10Ni/CeO2−M showed rod-shaped structure and rough surface ( Fig. 4 a) which resulted larger specific surface area as listed in Table 1 . It is known that CeO2 with rod-shaped structure has lower temperature reducibility, leading to enhanced catalytic activity [30]. Hence 10Ni/CeO2−M catalyst should show a higher activity for carbon dioxide methanation. Unexpectedly, the rod-shaped structure of CeO2 was destroyed in 10Ni/CeO2−M-1 catalyst, which shows irregular spherical structure as shown in Fig. 4 c. Also, 10Ni/CeO2−P catalyst and 10Ni/CeO2−C catalyst show irregular spherical structure in Fig. 4 d and Fig. 4 e and the particle size on 10Ni/CeO2−C catalyst was apparently bigger than other three catalysts, which coincided with the results from XRD. 3.1.3 H2-TPR and H2-TPD analysis of 10Ni/CeO2−X catalysts H2-TPR characterization was carried to investigate the reducibility of (a) calcined CeO2 supports and (b) corresponding 10Ni/CeO2-X catalysts, as shown in Fig. 5 . For CeO2 prepared by different method, broad hydrogen consumption peaks were observed around 300 °C −600 °C along with a nonnegligible peak at 750 °C, attributing to the reduction of surface lattice oxygen species and interior lattice oxygen, respectively [46,47]. Lee et al. reported that the bulk CeO2 is reduced at following steps: CeO2→Ce2O3→CeO→Ce and the lower temperature peak is ascribed to two types of reduction of oxygen vacancies, including Ce4+-O-Ce4+ type and Ce3+-O-Ce4+ type, while the higher temperature peak is caused by the reduction of CeO to Ce [48]. Therefore, the first peak was attributed to the reduction of oxygen vacancies on the surface and the second peak was caused by the partial reduction of interior lattice oxygen in CeO2. Besides, the lower temperature peak centered at 440 °C, 506 °C and 508 °C for CeO2−MOF, CeO2−P and CeO2−C, respectively, indicating CeO2−MOF was the easiest one to be reduced with best low-temperature reducibility. Fig. 5 b shows the redox properties of 10Ni/CeO2−X catalysts and three reduction peaks were observed, named as α, β and γ [44,50]. According to literature, the α peak is attributed to the reduction of active oxygen species adsorbed on the oxygen vacancies and β peak is attributed to the reduction of nickel species [44,48]. The γ peak with weaker intense is attributed to the reduction of CeO2 [44,50]. Clearly, the 10Ni/CeO2−M catalyst exhibited a distinct α peak at 215 °C, more intense than other CeO2 supported Ni catalysts. It is believed that α peak is caused by the substitution of Ce4+by Ni2+, resulting the formation of oxygen vacancies [48]. An obvious β peak was observed on 10Ni/CeO2-P and 10Ni/CeO2−M, which is attributed to the reduction of NiO [48]. Apparently, the temperature of β peak over 10Ni/CeO2−P or 10Ni/CeO2−M catalyst was slightly higher than that of 10Ni/CeO2−C catalyst, indicating weaker interaction between NiO and CeO2 for 10Ni/CeO2−C catalyst. Moreover, β1 and β2 peak were observed on 10Ni/CeO2−M-1 catalyst, attributing to the reduction of NiO in weak and strong interaction with CeO2, respectively [49]. Comparatively, the β1 peak of 10Ni/CeO2−M-1 catalyst shifted to lower temperature, indicating partial NiO was easier to be reduced. And β2 peak of 10Ni/CeO2−M-1 catalyst suggested that NiO with strong interaction with CeO2 were smaller and well dispersed [49]. The desorption capacities of hydrogen were calculated and listed in Table 1 , which decreased in the order: 10Ni/CeO2−M-1(13.70 mL/g)>10Ni/CeO2−M(9.70 mL/g)>10Ni/CeO2−P(9.17 mL/g)>10Ni/CeO2−C(0.76 mL/g), indicating smallest Ni particle size and the strongest hydrogen overflow effect on the 10Ni/CeO2−M-1 catalyst [50,51]. As the fact that hydrogen spillover occurs on the surface of the catalysts, between the active metal Ni and the support CeO2, then more spillover hydrogen means more interface between Ni and CeO2 [47]. It is generally believed that the activation of CO2 is the rate determining step for CO2 methanation, which occurs at the interface between metal and support [28]. Therefore, the 10Ni/CeO2−M-1 catalyst should show a better activity than the other catalysts. 3.1.4 CO2-TPD analysis of 10Ni/CeO2−X catalysts The basicity of 10Ni/CeO2−X catalysts were charactered by CO2-TPD, as shown in Fig. 6 . The CO2 desorption peaks at 50–150 °C and 150–450 °C are ascribed to weak basic sites and medium basic sites, respectively [52]. The weak and medium basic sites are related to OH− and metal oxygen pairs on the catalyst surface, respectively [38]. It's well believed that CO2 adsorption and activation primarily occurs on these two basic sites [38], where the intermediates formed subsequently, such as bicarbonate, bidentate carbonate and unidentate carbonate species [40,42]. For the 10Ni/CeO2−C catalyst, only one desorption peak at 87 °C was observed, corresponding to weak basic sites. The other catalysts showed two CO2 desorption peaks, corresponding to weak basic site and medium basic site, respectively. Moreover, it was observed that the temperature corresponding to medium basic sites shifted to higher value with broader peak width for 10Ni/CeO2−M-1 catalyst, indicating higher basicity strength. The quantitative analysis of the basic sites is shown in Table 2 . It is clear that 10Ni/CeO2−M catalyst exhibited most medium basic sites while 10Ni/CeO2−C exhibited most weak basic sites. Pan et al. reported that CO2 adsorbed on the weak basic site is not fully activated to break the C−O bond for the subsequent hydrogenation and medium basic site is more active and leads to enhanced methanation activity [39]. Thus 10Ni/CeO2−M catalyst should show higher methanation activity than others. While 10Ni/CeO2−M-1 catalyst with weakest basicity showed higher activity than 10Ni/CeO2−M catalyst, indicating basicity was not the determining factor influencing the catalytic performance. In this work, Ce-MOF precursor was prepared by using 1,3,5-benzenetricarboxylic acid as organic source, which contains three carboxyl groups. To form the Ce-MOF structure, one cerium atom connects with nine oxygen atoms with three from the carboxyl groups and the others from water [34]. Three different coordination modes co-existed between the cerium and carboxyl groups, including unidentate, bidentate and a free carboxylate group [34,35]. The drying temperature is not sufficient to break these coordination band, thus the well-aligned nanorods Ce-MOF can be obtained after drying, as shown in Fig. 4 a. While CeO2−MOF with three-dimensional structure and abundant pores was formed during calcination process and the organic ligands of 1,3,5-benzenetricarboxylic acid were removed by releasing CO2. The CeO2−P was obtained by releasing H2O from decomposing cerium hydroxide. And CeO2−C was used as received without any treatment. According to literature, CeO2 supports exhibit oxygen vacancies since ceria lattice expansion takes place during thermal treatment [40]. Therefore, the degree of lattice expansion was different over these precursors, which will result in different oxygen vacancy concentration over various CeO2 supports. This can be further confirmed by H2-TPR results, as shown in Fig. 5 a. The initial reduction temperature of CeO2−MOF is lower than that of CeO2−P, indicating enriched oxygen vacancy and good reducibility of CeO2−MOF [26]. Furthermore, it is well believed that when nickel particles were supported on CeO2, oxygen vacancy is caused by the dissolution of nickel into the ceria matrix [40,42]. More nickel dissolving into the CeO2 matrix will have positive effect on the substitution defect on Ni/CeO2 catalyst. This is consistent with the observation of Raman and H2-TPR results. Therefore, more oxygen vacancies were found on either the CeO2−MOF alone or CeO2−MOF supported Ni catalysts. 3.2 Effect of nickel loading on xNi/CeO2−M-1 catalysts In the light of above work, CeO2 obtained by pyrolysis of Ce-MOF precursor has a promising application. Hence, we synthesized Ni/CeO2−MOF by one-pot method and investigated the effect of nickel loading. The catalysts are denoted as xNi/CeO2−M-1 (x = 5, 10, 15, 20, meaning the amount of nickel supported, M-1 meaning that nickel is directly introduced into Ce-MOF). 3.2.1 Textural properties of xNi/CeO2−M-1 catalysts As shown in Fig. 7 a, all the xNi/CeO2−M-1 catalysts exhibit classical type II isotherms and similar hysteresis hoop of H4 according to the IUPAC classification [36]. Apparently, hysteresis of all samples closed at a relative pressure of 0.2, indicating a broad pore size distribution [37]. And a significant uptake of N2 were observed at relative pressure of 0.91, which indicated interstitial pores between particles in these samples [37]. As shown in Table 1 , the specific surface areas of these catalysts were in shape of volcano as Ni loading increased, presumably as a result of accumulation of NiO and the change of catalyst structures. Moreover, as shown in Fig. 7 b, all xNi/CeO2−M-1 catalysts exhibited similar pore size distribution ranging from 3 nm to 10 nm. As we discussed above, the 15Ni/CeO2−M-1 catalyst possessed the largest surface area (111 m2/g) and relatively large pore volume (0.18 cm3/g), which was beneficial for mass transfer, leading to higher performance for CO2 methanation. 3.2.2 Phase and morphologies of xNi/CeO2−M-1 catalysts XRD patterns of xNi/CeO2−M-1 catalysts are shown in Fig. 8 . The diffraction peaks located at 2θ= 28.5°, 33.1°, 47.5°, 56.3°, 59.1°, 69.4°, 76.7°and 79.1°, corresponding to (111), (200), (220), (331), (222), (400), (331) and (420) crystal facets of cubic fluorite CeO2 (JCPDS No.34–0394). It's clear that the intensities are virous among xNi/CeO2−M-1 catalysts, suggesting crystallinity of CeO2 was affected by nickel loading and 15Ni/CeO2−M-1 exhibited the smallest size of CeO2. Except for 20Ni/CeO2−M-1 catalyst having obvious diffraction peaks at 37.2° and 43.3° corresponding to (111) and (200) NiO crystal face (JCPDS No.44–1159), no notable peak of NiO was observed for the other catalysts. XRD pattern at 2θ range from 35° to 45° was enlarged as shown in Fig. 8 , which showed comparatively weak NiO peaks for catalysts at Ni loading below 15 wt.% and indicated that NiO nanoparticles were highly dispersed over xNi/CeO2−M-1 catalysts. Moreover, some nickel species may have been incorporated into ceria lattice to form Ce1-xNixO2-y solid solutions as we discussed above. The Raman results are shown in Fig. 9 , in which the strong peak at 460 cm−1 is assigned to the F2g mode of fluorite-like CeO2 phase [40] while the broad peaks ranging within 540–610 cm−1 are assigned to the D mode that was resolved into two peaks at 540 cm−1 (De) and 609 cm−1 (Di) [42]. Generally, De and Di modes are attributed to the oxygen vacancies in the catalysts, and the former one is from the dissolution of nickel into the ceria matrix while the latter is from the transformation of different valence ceria (Ce3+ and Ce4+) [42]. Therefore, the appearance of De mode confirms the existence of the Ce1-xNixO2-y solid solutions in the catalysts. It can be seen from Raman that F2g mode peaks shifted to lower frequencies and broadened as nickel loading increased, suggesting a strong interaction between NiO and CeO2 in the catalysts [41]. And the shift degree compared with CeO2−MOF were calculated and listed in Table 1 , which shows that 10Ni/CeO2−M-1 catalyst as well as 15Ni/CeO2−M-1 catalyst possessed the largest portion of cerium-nickel solid solutions, suggesting the solubility of nickel into ceria reached the limit at 15 wt.% nickel loading. As shown in Table 1 , the order of ID/IF2g values decreased as the following order: 15Ni/CeO2−M-1(0.83)>20Ni/CeO2−M-1(0.80)>10Ni/CeO2−M-1(0.49)>5Ni/CeO2−M-1(0.34) ( Table 1 ), indicating that the support of 15Ni/CeO2−M-1 catalysts possessed highest oxygen vacancy concentration. It's clear that nickel oxides and Ce1-xNixO2-y coexisted in fresh xNi/CeO2−M-1 catalysts while nickel particles were small and the Ce1-xNixO2-y portions varied with nickel loading. It can be seen from Fig. 10 that the structures of CeO2 were no longer rod-like when Ni was directly added to Ce-MOF by one-pot method and different amounts of nickel led to various degrees of damage to CeO2. Catalysts were found in granular shape when the nickel loading was at 10 wt.% and 15 wt.%. while with higher or lower Ni content, catalysts showed a lamellar structure. In addition, particle sizes of 5Ni/CeO2−M-1 and 20Ni/CeO2−M-1 were significantly larger than those of 10Ni/CeO2−M-1 and 15Ni/CeO2−M-1, which is consistent with the results of XRD characterization. 3.2.3 H2-TPR and H2-TPD analysis of xNi/CeO2−M-1 catalysts The catalysts were characterized by H2-TPR as shown in Fig. 11 . It showed that all catalysts exhibit three reduction peaks, at 207 °C (α), 250–350 °C (β) and 750 °C (γ), respectively. As discussed above, the α peak is attributed to the reduction of adsorbed oxygen on the oxygen vacancies, and the β peak is attributed to the reduction of NiO particles [46,47]. The γ peak is attributed to the reduction of bulk CeO2 [44,48]. It can be seen that the intensity of α peak increased gradually as nickel loading increased and reached maximum at 20 wt.% nickel loading, suggesting that the addition of nickel promoted the formation of oxygen vacancy, consistent with the Raman spectra results. Moreover, the β peak shifted to higher temperature with the increase of nickel content, probably a result of the enhanced interaction between NiO and CeO2 as the decreased particle size of CeO2 (as shown in XRD). The particle size of CeO2 was the smallest over 15Ni/CeO2−M-1 catalyst, leading to the stronger interaction between NiO and CeO2, which induced higher dispersion of NiO and made NiO easier to be reduced. The desorption capacities of hydrogen over xNi/CeO2−M-1 catalysts were calculated and listed in Table 1 , which shows that 15Ni/CeO2−M-1 has a consumption of 13.70 mL/g, indicating smallest Ni particle size and the strongest hydrogen overflow effect over it [48,49]. As we discussed above, hydrogen spillover occurs between the active metal Ni and the support CeO2, so more interface between Ni and CeO2 were found over 15Ni/CeO2−M-1 catalysts [47]. 3.2.4 CO2-TPD analysis of xNi/CeO2−M-1 catalysts The CO2-TPD curves of xNi/CeO2−M-1 are shown in Fig. 12 , and all catalysts showed two distinct desorption peaks, at 50–150 °C and 150–400 °C, which corresponds to weak basic sites and medium basic sites, respectively [52]. It is obvious that as nickel loading increased, the intensity of medium basic sites increased. And 20Ni/CeO2−M-1 catalyst showed lowest temperature for medium basic sites. Quantitative analysis ( Table 3 ) showed that 5Ni/CeO2−M-1 catalyst had the most weak basic sites and the least medium basic sites. And with the increase of Ni loading, the number of medium strength basic sites increased and reached maximum over 20Ni/CeO2−M-1 catalyst. From the above discussion, properties of xNi/CeO2−M-1 catalysts were closely related to nickel loading. In other words, oxygen vacancy concentration and the strength of medium basic sites over different catalysts are induced by various nickel loading. 3.3 CO2 methanation performance on different Ni/CeO2 catalysts 3.3.1 Effect of CeO2 preparation method on the performance of 10Ni/CeO2−X catalysts The performances of CO2 methanation over 10Ni/CeO2−X catalysts at temperature range of 250–450 °C are shown in Fig. 13 a and Fig. 13 b. For all catalysts except for 10Ni/CeO2−C catalyst, CO2 conversion increased with temperature rising from 250 °C to 350 °C and reached the highest value at 350 °C. While CO2 conversion on 10Ni/CeO2−C was much lower than those on the other catalysts under experimental condition. Both 10Ni/CeO2−P and 10Ni/CeO2−M catalysts exhibited similar CO2 conversion below 300 °C, while the 10Ni/CeO2−M catalyst has higher CO2 conversion than 10Ni/CeO2−P catalyst at temperatures higher than 300 °C. Comparatively, the 10Ni/CeO2−M-1 catalyst showed the best activity among these four catalysts, especially at low temperatures. And it was observed that the highest CO2 conversion over 10Ni/CeO2−M-1 catalyst reached 80% at 350 °C. Besides, all catalysts with different CeO2 supports showed nearly 100% selectivity for CH4 at temperature range from 250 to 350 °C. At temperature higher than 350 °C, the selectivity for CH4 decreased as more by-product CO produced from reverse water gas shift reaction ( Fig. 13 b). 3.3.2 Effect of Ni loading on the performance of xNi/CeO2−M-1 catalysts As discussed above, the 10Ni/CeO2−M-1 catalyst showed the best activity among the four 10Ni/CeO2 catalysts. In this part, the effect of Ni loading on the performance of Ni/CeO2−M-1 catalysts was further investigated. The performances of CO2 methanation over xNi/CeO2−M-1 catalysts at temperature range 250–450 °C are shown in Fig. 13 c and Fig. 13 d. When nickel loading was 5 wt.%, the CO2 conversion increased with increasing temperature and was peaked at 450 °C. For the other catalysts with nickel loading from 10 to 20 wt.%, CO2 conversion also increased with increasing temperature and was peaked at 350 °C. It was also found that activities showed a volcano shape as Ni loading increased and 15 wt.% was the optimum Ni loading since the maximum CO2 conversion over the 15Ni/CeO2−M-1 catalyst was observed about 82% at 350 °C. Besides, all catalysts showed nearly 100% selectivity for CH4 at temperature blow 350 °C. At temperature higher than 350 °C, the selectivity for CH4 decreased because of the reverse water gas shift reaction ( Fig. 13 d). The long-term tests for 50 h were carried out for 10Ni/CeO2−M catalyst and 10Ni/CeO2−M-1 catalyst, as shown in Fig. 14 . It was found that CO2 conversion for 10Ni/CeO2−M catalyst and 10Ni/CeO2−M-1 catalyst were 78.5% and 69.1%, respectively, while CH4 selectivity for both catalysts were almost 100%. Both catalysts exhibited good stability with the 10Ni/CeO2−M-1 catalyst being a little better than the 10Ni/CeO2−M catalyst. 3.3.3 Relationship of catalyst structure and performance The above findings revealed that preparation method of CeO2 and nickel loading have a significant effect on CO2 methanation performance. Different Ni/CeO2 catalysts were characterized to show their textural properties, oxygen vacancy sites and basicity, as we discussed in part 3.1 and 3.2. Here, we take into accounts of CO2 methanation performance and key physiochemical factors for all the catalysts to explore the structure-activity relationship on different Ni/CeO2 catalysts, which is presented in Fig. 15 . As can be seen, SBET values (specific surface area), ID/IF2g values (oxygen vacancy concentration) as well as basic sites of the Ni/CeO2 catalysts are related to preparation method of supports and nickel loading. As for preparation method of CeO2, oxygen vacancy concentration is more vital than other factors since higher CO2 conversion was got over the 10Ni/CeO2−M catalyst with moderate SBET (70 m2/g), basic sites (16.8) and higher oxygen vacancy concentration (0.47). While the 10Ni/CeO2−M-1 catalyst exhibited higher activity than 10Ni/CeO2−M catalyst, suggesting the advantage of one-pot method. Moreover, by correlating nickel loading and catalyst properties, it was observed that the 15Ni/CeO2−M-1 catalyst with not only the highest SBET (111 m2/g) but also the highest oxygen vacancy concentration (0.83) exhibited highest CO2 conversion and CH4 selectivity at 300 °C in this work. It can be concluded that among the factors we discussed above, oxygen vacancy concentration plays a vital role in CO2 methanation. As indicated by the analysis of Raman spectra and H2-TPR, oxygen vacancy is caused by the transformation of Ce3+and Ce4+ as well as the dissolution of Ni2+ into the ceria matrix. The formed oxygen vacancy is helpful to anchor nickel metals on the support and improve dispersion of nickel metals [42], leading to smaller nickel size and more Ni active surface exposed in reduced Ni/CeO2 catalysts. Also, electron transfer occurs between Ni atoms and CeO2 via the oxygen vacancy sites, which further improve the reducibility of Ni/CeO2 catalyst and expose more active Ni metals [28,42]. During the reaction, active Ni surface facilitates the formation of active H atoms by splitting H2 and more Ni surface exposed provides sufficient H atoms for the reaction, driving the hydrogenation of adsorbed CO2 on the CeO2 support [53]. What's more, CeO2 with great redox properties is beneficial for the adsorption of CO2. Oxygen atoms on oxygen vacancy exhibiting extremely high reactivity can adsorb CO2 during the reaction [54,55]. Winter et al. reported that oxygen exchange occurs between the gas-phase CO2 molecule and the support CeO2 via simple hetero-exchange and complicated hetero-exchange ways under H2 atmosphere [28]. This further confirmed that oxygen atoms on the surface of CeO2 can participate in CO2 methanation. Therefore, oxygen vacancies formed on Ni/CeO2 catalysts are beneficial for active Ni metals exposure to split H2 as well as oxygen atoms exchange between CO2 and CeO2, leading to great catalytic performance in CO2 methanation. 4 Conclusions The 10Ni/CeO2−M catalyst with CeO2 being prepared by pyrolysis of Ce-MOF showed better CO2 methanation performance than the other CeO2 supported Ni catalysts. Characterization results proved that NiO as well as Ce1-xNixO2-y solid solutions coexist in these catalysts, while the Ce1-xNixO2-y solid solutions play a significant role in forming Ni-Ce interface which are beneficial for creating oxygen vacancies. Furthermore, the 10Ni/CeO2−M-1 catalysts prepared by one-pot method showed higher CO2 methanation activity than the other 10Ni/CeO2 catalysts especially at the temperature below 350 °C. It was found that CO2 conversion showed a volcano shape as Ni loading increased for xNi/CeO2−M-1 catalysts. The optimum Ni loading was 15 wt.% and CO2 conversion was as high as 82% at 350 °C with nearly 100% CH4 selectivity. Characterization for these catalysts proved that CO2 methanation activity over Ni/CeO2 catalysts is closely related with specific surface area and oxygen vacancy concentration. Therefore, large specific area and rich oxygen vacancies contributed to the enhanced activity over 15Ni/CeO2−M-1 catalyst. These results provided a solid basis for rational design of good performance Ni-based catalyst derived from Ce-MOF precursor for CO2 methanation. Declaration of Competing Interest The authors declare no competing interests. No conflict of interest exits in the submission of this manuscript. Acknowledgements We appreciate the financial support by the Joint Funds of the National Natural Science Foundation of China (Grant No. U20A20124) and the Program of Introducing Talents of Discipline to Universities (No. BP0618007). References [1] J. Hansen M. Sato R. Ruedy K. Lo D.W. Lea M. Medina-Elizade Global temperature change P. Natl. Acad. Sci. USA 103 2006 14288 14293 J. Hansen, M. Sato, R. Ruedy, K. Lo, D.W. Lea and M. Medina-Elizade, Global temperature change, P. Natl. Acad. Sci. USA103(2006) 14288–14293. [2] J. Yan Z. Zhang Carbon Capture, Utilization and Storage (CCUS) Appl. Energy 235 2019 1289 1299 J. Yan and Z. Zhang, Carbon Capture, Utilization and Storage (CCUS), Appl. Energy235(2019) 1289–1299. [3] B. Ashford Y.L. Wang C.K. Poh L.W. Chen X. Tu Plasma-catalytic conversion of CO2 to CO over binary metal oxide catalysts at low temperatures Appl. Catal. B-Environ. 276 2020 119110 119119 B. Ashford, Y.L. Wang, C.K. Poh, L.W. Chen and X. Tu, Plasma-catalytic conversion of CO2 to CO over binary metal oxide catalysts at low temperatures, Appl. Catal. B-Environ.. 276(2020) 119110–119119. [4] P. Wu X. Li N. Ullah Z. Li Synergistic effect of catalyst and plasma on CO2 decomposition in a dielectric barrier discharge plasma reactor Mol. Catal. 499 2021 111304 111312 P. Wu, X. Li, N. Ullah and Z. Li, Synergistic effect of catalyst and plasma on CO2 decomposition in a dielectric barrier discharge plasma reactor, Mol. Catal.499(2021) 111304–11312. [5] W. Wang Z. Qu L. Song Q. Fu CO2 hydrogenation to methanol over Cu/CeO2 and Cu/ZrO2 catalysts: tuning methanol selectivity via metal-support interaction J. Energy Chem. 40 2020 22 30 W. Wang, Z. Qu, L. Song and Q. Fu, CO2 hydrogenation to methanol over Cu/CeO2 and Cu/ZrO2 catalysts: tuning methanol selectivity via metal-support interaction, J. Energy Chem.40(2020) 22–30. [6] C. Yang S. Liu Y. Wang J. Song G. Wang S. Wang Z.J. Zhao R. Mu J. Gong The interplay between structure and product selectivity of CO2 hydrogenation Angew. Chem. Int. Ed. Engl. 58 2019 11242 11247 C. Yang, S. Liu, Y. Wang, J. Song, G. Wang, S. Wang, Z.J. Zhao, R. Mu and J. Gong, The interplay between structure and product selectivity of CO2 hydrogenation, Angew. Chem. Int. Ed. Engl.58(2019) 11242–11247. [7] C. Yang R. Mu G. Wang J. Song H. Tian Z.J. Zhao J. Gong Hydroxyl-mediated ethanol selectivity of CO2 hydrogenation Chem. Sci. 10 2019 3161 3167 C. Yang, R. Mu, G. Wang, J. Song, H. Tian, Z.J. Zhao and J. Gong, Hydroxyl-mediated ethanol selectivity of CO2 hydrogenation, Chem. Sci.10(2019) 3161–3167. [8] C. Anil J.M. Modak G. Madras Syngas production via CO2 reforming of methane over noble metal (Ru, Pt, and Pd) doped LaAlO3 perovskite catalyst Mol. Catal. 484 2020 11805 11815 C. Anil, J.M. Modak and G. Madras, Syngas production via CO2 reforming of methane over noble metal (Ru, Pt, and Pd) doped LaAlO3 perovskite catalyst, Mol. Catal.484(2020) 11805–11815. [9] Q. Ma Y. Han Q. Wei S. Makpal X. Gao J. Zhang T.S. Zhao Stabilizing Ni on bimodal mesoporous-macroporous alumina with enhanced coke tolerance in dry reforming of methane to syngas J. CO2 Util. 35 2020 288 297 Q. Ma, Y. Han, Q. Wei, S. Makpal, X. Gao, J. Zhang and T.S. Zhao, Stabilizing Ni on bimodal mesoporous-macroporous alumina with enhanced coke tolerance in dry reforming of methane to syngas, J. CO2 Util.35(2020) 288–297. [10] W. Zhou K. Cheng J.C. Kang C. Zhou V. Subramanian Q.H. Zhang Y. Wang New horizon in C1 chemistry: breaking the selectivity limitation in transformation of syngas and hydrogenation of CO2 into hydrocarbon chemicals and fuels Chem. Soc. Rev. 48 2019 3193 3228 W. Zhou, K. Cheng, J.C. Kang, C. Zhou, V. Subramanian, Q.H. Zhang and Y. Wang, New horizon in C1 chemistry: breaking the selectivity limitation in transformation of syngas and hydrogenation of CO2 into hydrocarbon chemicals and fuels, Chem. Soc. Rev.48(2019) 3193–3228. [11] J. Artz T.E. Muller K. Thenert J. Kleinekorte R. Meys A. Sternberg A. Bardow W. Leitner Sustainable conversion of carbon dioxide: an integrated review of catalysis and life cycle assessment Chem. Rev. 118 2018 434 504 J. Artz, T.E. Muller, K. Thenert, J. Kleinekorte, R. Meys, A. Sternberg, A. Bardow and W. Leitner, Sustainable conversion of carbon dioxide: an integrated review of catalysis and life cycle assessment, Chem. Rev.118(2018) 434–504. [12] W. Li H. Wang X. Jiang J. Zhu Z. Liu X. Guo C. Song A short review of recent advances in CO2 hydrogenation to hydrocarbons over heterogeneous catalysts RSC Adv 8 2018 7651 7669 W. Li, H. Wang, X. Jiang, J. Zhu, Z. Liu, X. Guo and C. Song, A short review of recent advances in CO2 hydrogenation to hydrocarbons over heterogeneous catalysts, RSC Adv. 8(2018) 7651–7669. [13] C. Vogt M. Monai G.J. Kramer B.M. Weckhuysen The renaissance of the Sabatier reaction and its applications on Earth and in space Nat Catal 2 2019 188 197 C. Vogt, M. Monai, G.J. Kramer and B.M. Weckhuysen, The renaissance of the Sabatier reaction and its applications on Earth and in space, Nat Catal. 2(2019) 188–197. [14] C. Italiano J. Llorca L. Pino M. Ferraro V. Antonucci A. Vita CO and CO2 methanation over Ni catalysts supported on CeO2, Al2O3 and Y2O3 oxides Appl. Catal. B-Environ. 264 2020 118494 118509 C. Italiano, J. Llorca, L. Pino, M. Ferraro, V. Antonucci and A. Vita, CO and CO2 methanation over Ni catalysts supported on CeO2, Al2O3 and Y2O3 oxides, Appl. Catal. B-Environ.264 (2020) 118494–118509. [15] I. Sreedhar Y. Varun S.A. Singh A. Venugopal B.M. Reddy Developmental trends in CO2 methanation using various catalysts Catal. Sci. Technol. 9 2019 4478 4504 I. Sreedhar, Y. Varun, S.A. Singh, A. Venugopal and B.M. Reddy, Developmental trends in CO2 methanation using various catalysts, Catal. Sci. Technol.9(2019) 4478–4504. [16] W.J. Sun X.M. Li C. Sun Z. Huang H.L. Xu W. Shen Insights into the pyrolysis processes of Ce-MOFs for preparing highly active catalysts of toluene combustion Catalysts 9 2019 682 696 W.J. Sun, X.M. Li, C. Sun, Z. Huang, H.L. Xu and W. Shen, Insights into the pyrolysis processes of Ce-MOFs for preparing highly active catalysts of toluene combustion, Catalysts9(2019) 682–696. [17] P. Frontera A. Macario M. Ferraro P. Antonucci Supported catalysts for CO2 methanation: a review Catalysts 7 2017 59 86 P. Frontera, A. Macario, M. Ferraro and P. Antonucci, Supported catalysts for CO2 methanation: a review, Catalysts7(2017) 59–86. [18] T.T.M. Nguyen L. Wissing M.S. Skjøth-Rasmussen High temperature methanation: catalyst considerations Catal. Today 215 2013 233 238 T.T.M. Nguyen, L. Wissing and M.S. Skjøth-Rasmussen, High temperature methanation: catalyst considerations, Catal. Today215(2013) 233–238. [19] M.A.A. Aziz A.A. Jalil S. Triwahyono A. Ahmad CO2 methanation over heterogeneous catalysts: recent progress and future prospects Green Chem 17 2015 2647 2663 M.A.A. Aziz, A.A. Jalil, S. Triwahyono and A. Ahmad, CO2 methanation over heterogeneous catalysts: recent progress and future prospects, Green Chem. 17(2015) 2647–2663. [20] D. Zhang X. Du L. Shi R. Gao Shape-controlled synthesis and catalytic application of ceria nanomaterials Dalton Trans 41 2012 14455 14475 D. Zhang, X. Du, L. Shi and R. Gao, Shape-controlled synthesis and catalytic application of ceria nanomaterials, Dalton Trans41(2012) 14455–14475. [21] T. Montini M. Melchionna M. Monai P. Fornasiero Fundamentals and catalytic applications of CeO2-based materials Chem. Rev. 116 2016 5987 6041 T. Montini, M. Melchionna, M. Monai and P. Fornasiero, Fundamentals and catalytic applications of CeO2-based materials, Chem. Rev.116(2016) 5987–6041. [22] T. Sakpal L. Lefferts Structure-dependent activity of CeO2 supported Ru catalysts for CO2 methanation J. Catal. 367 2018 171 180 T. Sakpal and L. Lefferts, Structure-dependent activity of CeO2 supported Ru catalysts for CO2 methanation, J. Catal.367(2018) 171–180. [23] Z. Bian Y.M. Chan Y. Yu S. Kawi Morphology dependence of catalytic properties of Ni/CeO2 for CO2 methanation: a kinetic and mechanism study Catal. Today 347 2020 31 38 Z. Bian, Y.M. Chan, Y. Yu and S. Kawi, Morphology dependence of catalytic properties of Ni/CeO2 for CO2 methanation: a kinetic and mechanism study, Catal. Today347(2020) 31–38. [24] D.G. Araiza A. Gómez-Cortés G. Díaz Effect of ceria morphology on the carbon deposition during steam reforming of ethanol over Ni/CeO2 catalysts Catal. Today 349 2020 235 243 D.G. Araiza, A. Gómez-Cortés and G. Díaz, Effect of ceria morphology on the carbon deposition during steam reforming of ethanol over Ni/CeO2 catalysts, Catal. Today349(2020) 235–243. [25] X. Du D. Zhang L. Shi R. Gao J. Zhang Morphology dependence of catalytic properties of Ni/CeO2 nanostructures for carbon dioxide reforming of methane J. Phys. Chem. C 116 2012 10009 10016 X. Du, D. Zhang, L. Shi, R. Gao and J. Zhang, Morphology dependence of catalytic properties of Ni/CeO2 nanostructures for carbon dioxide reforming of methane, J. Phys. Chem. C116(2012) 10009–10016. [26] T. Jomjaree P. Sintuya A. Srifa W. Koo-amornpattana S. Kiatphuengporn S. Assabumrungrat M. Sudoh R. Watanabe C. Fukuhara S. Ratchahat Catalytic performance of Ni catalysts supported on CeO2 with different morphologies for low-temperature CO2 methanation Catal. Today 2020 10.1016/j.cattod.2020.08.010 T. Jomjaree, P. Sintuya, A. Srifa, W. Koo-amornpattana, S. Kiatphuengporn, S. Assabumrungrat, M. Sudoh, R. Watanabe, C. Fukuhara and S. Ratchahat, Catalytic performance of Ni catalysts supported on CeO2 with different morphologies for low-temperature CO2 methanation, Catal. Today2020, DOI: 10.1016/j.cattod.2020.08.010. [27] E. Rombi M.G. Cutrufello L. Atzori R. Monaci A. Ardu D. Gazzoli P. Deiana I. Ferino CO methanation on Ni-Ce mixed oxides prepared by hard template method Appl. Catal. A: Gen. 515 2016 144 153 E. Rombi, M.G. Cutrufello, L. Atzori, R. Monaci, A. Ardu, D. Gazzoli, P. Deiana and I. Ferino, CO methanation on Ni-Ce mixed oxides prepared by hard template method, Appl. Catal. A: Gen.515(2016) 144–153. [28] L.R. Winter R. Chen X. Chen K. Chang Z. Liu S.D. Senanayake A.M. Ebrahim J.G. Chen Elucidating the roles of metallic Ni and oxygen vacancies in CO2 hydrogenation over Ni/CeO2 using isotope exchange and in situ measurements Appl. Catal. B-Environ. 245 2019 360 366 L.R. Winter, R. Chen, X. Chen, K. Chang, Z. Liu, S.D. Senanayake, A.M. Ebrahim and J.G. Chen, Elucidating the roles of metallic Ni and oxygen vacancies in CO2 hydrogenation over Ni/CeO2 using isotope exchange and in situ measurements, Appl. Catal. B-Environ.245(2019) 360–366. [29] W. Zhen F. Gao B. Tian P. Ding Y. Deng Z. Li H. Gao G. Lu Enhancing activity for carbon dioxide methanation by encapsulating (111) facet Ni particle in metal-organic frameworks at low temperature J. Catal. 348 2017 200 211 W. Zhen, F. Gao, B. Tian, P. Ding, Y. Deng, Z. Li, H. Gao and G. Lu, Enhancing activity for carbon dioxide methanation by encapsulating (111) facet Ni particle in metal-organic frameworks at low temperature, J. Catal.348(2017) 200–211. [30] Z.W. Zhao X. Zhou Y.N. Liu C.C. Shen C.Z. Yuan Y.F. Jiang S.J. Zhao L.B. Ma T.Y. Cheang A.W. Xu Ultrasmall Ni nanoparticles embedded in Zr-based MOFs provide high selectivity for CO2 hydrogenation to methane at low temperatures Catal. Sci. Technol. 8 2018 3160 3165 Z.W. Zhao, X. Zhou, Y.N. Liu, C.C. Shen, C.Z. Yuan, Y.F. Jiang, S.J. Zhao, L.B. Ma, T.Y. Cheang and A.W. Xu, Ultrasmall Ni nanoparticles embedded in Zr-based MOFs provide high selectivity for CO2 hydrogenation to methane at low temperatures, Catal. Sci. Technol.8(2018) 3160–3165. [31] Y.N. Gong L. Jiao Y. Qian C.Y. Pan L. Zheng X. Cai B. Liu S.H. Yu H.L. Jiang Regulating the coordination environment of MOF-templated single-atom nickel electrocatalysts for boosting CO2 reduction Angew. Chem. Int. Edit. Engl. 59 2020 2705 2709 Y.N. Gong, L. Jiao, Y. Qian, C.Y. Pan, L. Zheng, X. Cai, B. Liu, S.H. Yu and H.L. Jiang, Regulating the coordination environment of MOF-templated single-atom nickel electrocatalysts for boosting CO2 reduction, Angew. Chem. Int. Edit. Engl.59(2020) 2705–2709. [32] N. Prinz L. Schwensow S. Wendholt A. Jentys M. Bauer W. Kleist M. Zobel Hard X-ray-based techniques for structural investigations of CO2 methanation catalysts prepared by MOF decomposition Nanoscale 12 2020 15800 15813 N. Prinz, L. Schwensow, S. Wendholt, A. Jentys, M. Bauer, W. Kleist and M. Zobel, Hard X-ray-based techniques for structural investigations of CO2 methanation catalysts prepared by MOF decomposition, Nanoscale 12(2020)15800–15813. [33] M. Mon M.A. Rivero-Crespo J. Ferrando-Soria A. Vidal-Moya M. Boronat A. Leyva-Perez A. Corma J.C. Hernandez-Garrido M. Lopez-Haro J.J. Calvino G. Ragazzon A. Credi D. Armentano E. Pardo Ultrasmall Pt0 2 clusters within a thioether-functionalized MOF: catalytic activity in industrial reactions at low temperature Angew. Chem. Int. Edit. Engl. 57 2018 6186 6191 M. Mon, M.A. Rivero-Crespo, J. Ferrando-Soria, A. Vidal-Moya, M. Boronat, A. Leyva-Perez, A. Corma, J.C. Hernandez-Garrido, M. Lopez-Haro, J.J. Calvino, G. Ragazzon, A. Credi, D. Armentano and E. Pardo, Ultrasmall Pt02 clusters within a thioether-functionalized MOF: catalytic activity in industrial reactions at low temperature, Angew. Chem. Int. Edit. Engl.57(2018) 6186–6191. [34] X. Chen X. Chen E. Yu S. Cai H. Jia J. Chen P. Liang In situ pyrolysis of Ce-MOF to prepare CeO2 catalyst with obviously improved catalytic performance for toluene combustion Chem. Eng. J 344 2018 469 479 X. Chen, X. Chen, E. Yu, S. Cai, H. Jia, J. Chen and P. Liang, In situ pyrolysis of Ce-MOF to prepare CeO2 catalyst with obviously improved catalytic performance for toluene combustion, Chem. Eng. J344 (2018) 469–479. [35] X. Tao W. Cong L. Huang D. Xu J. CeO2 photocatalysts derived from Ce-MOFs synthesized with DBD plasma method for methyl orange degradation Alloy. Compd. 805 2019 1060 1070 X. Tao, W. Cong, L. Huang and D. Xu, J. CeO2 photocatalysts derived from Ce-MOFs synthesized with DBD plasma method for methyl orange degradation, Alloy. Compd.805(2019) 1060–1070. [36] M. Thommes K. Kaneko A.V. Neimark J.P. Olivier F. Rodriguez-Reinoso J. Rouquerol K.S.W. Sing Physisorption of gases, with special reference to the evaluation of surface area and pore size distribution (IUPAC Technical Report) Pure Appl. Chem. 87 2015 1051 1069 M. Thommes, K. Kaneko, A.V. Neimark, J.P. Olivier, F. Rodriguez-Reinoso, J. Rouquerol and K.S.W. Sing, Physisorption of gases, with special reference to the evaluation of surface area and pore size distribution (IUPAC Technical Report), Pure Appl. Chem.87(2015) 1051–1069. [37] J. Ren C. Mebrahtu R. Palkovits Ni-based catalysts supported on Mg-Al hydrotalcites with different morphologies for CO2 methanation: exploring the effect of metal-support interaction Catal. Sci. Technol. 10 2020 1902 1913 J. Ren, C. Mebrahtu and R. Palkovits, Ni-based catalysts supported on Mg-Al hydrotalcites with different morphologies for CO2 methanation: exploring the effect of metal-support interaction, Catal. Sci. Technol.10(2020) 1902–1913. [38] A. Westermann B. Azambre M.C. Bacariza I. Graca M.F. Ribeiro J.M. Lopes C. Henriques Insight into CO2 methanation mechanism over NiUSY zeolites: an operando IR study Appl. Catal. B-Environ. 174 2015 120 125 A. Westermann, B. Azambre, M.C. Bacariza, I. Graca, M.F. Ribeiro, J.M. Lopes and C. Henriques, Insight into CO2 methanation mechanism over NiUSY zeolites: an operando IR study, Appl. Catal. B-Environ.174(2015) 120–125. [39] Q. Pan J. Peng T. Sun S. Wang S. Wang Insight into the reaction route of CO2 methanation: promotion effect of medium basic sites Catal. Commun. 45 2014 74 78 Q. Pan, J. Peng, T. Sun, S. Wang and S. Wang, Insight into the reaction route of CO2 methanation: promotion effect of medium basic sites, Catal. Commun.45(2014) 74–78. [40] N. Rui X. Zhang F. Zhang Z. Liu X. Cao Z. Xie R. Zou S.D. Senanayake Y. Yang J.A. Rodriguez C.-.J. Liu Highly active Ni/CeO2 catalyst for CO2 methanation: preparation and characterization Appl. Catal. B-Environ. 282 2021 119581 119592 N. Rui, X. Zhang, F. Zhang, Z. Liu, X. Cao, Z. Xie, R. Zou, S.D. Senanayake, Y. Yang, J.A. Rodriguez and C.-.J. Liu, Highly active Ni/CeO2 catalyst for CO2 methanation: preparation and characterization, Appl. Catal. B-Environ.282(2021)119581–119592. [41] J. Deng W. Chu B. Wang W. Yang X.S. Zhao Mesoporous Ni/Ce1-xNixO2-y heterostructure as an efficient catalyst for converting greenhouse gas to H2 and syngas Catal. Sci. Technol. 6 2016 851 862 J. Deng, W. Chu, B. Wang, W. Yang and X.S. Zhao, Mesoporous Ni/Ce1-xNixO2-y heterostructure as an efficient catalyst for converting greenhouse gas to H2 and syngas, Catal. Sci. Technol.6(2016) 851–862. [42] D. Guo Y. Lu Y. Ruan Y. Zhao Y. Zhao S. Wang X. Ma Effects of extrinsic defects originating from the interfacial reaction of CeO2-x-nickel silicate on catalytic performance in methane dry reforming Appl. Catal. B-Environ. 277 2020 19278 119292 D. Guo, Y. Lu, Y. Ruan, Y. Zhao, Y. Zhao, S. Wang and X. Ma, Effects of extrinsic defects originating from the interfacial reaction of CeO2-x-nickel silicate on catalytic performance in methane dry reforming, Appl. Catal. B-Environ.277(2020) 19278–119292. [43] L. Barrio A. Kubacka G. Zhou M. Estrella A. Martinez-Arias J.C. Hanson M. Fernandez-Garcia J.A. Rodriguez Unusual physical and chemical properties of Ni in Ce1-xNixO2-y oxides: structural characterization and catalytic activity for the water gas shift reaction J. Phys. Chem. C 114 2010 12689 12697 L. Barrio, A. Kubacka, G. Zhou, M. Estrella, A. Martinez-Arias, J.C. Hanson, M. Fernandez-Garcia and J.A. Rodriguez, Unusual physical and chemical properties of Ni in Ce1-xNixO2-y oxides: structural characterization and catalytic activity for the water gas shift reaction, J. Phys. Chem. C114(2010) 12689–12697. [44] I. Luisetto S. Tuti C. Romano M. Boaro E. Di Bartolomeo J.K. Kesavan S.S. Kumar K. Selvakumar Dry reforming of methane over Ni supported on doped CeO2: new insight on the role of dopants for CO2 activation J. CO2 Util 30 2019 63 78 I. Luisetto, S. Tuti, C. Romano, M. Boaro, E. Di Bartolomeo, J.K. Kesavan, S.S. Kumar and K. Selvakumar, Dry reforming of methane over Ni supported on doped CeO2: new insight on the role of dopants for CO2 activation, J. CO2 Util. 30(2019) 63–78. [45] Z. Liu D.C. Grinter P.G. Lustemberg T.D. Nguyen-Phan Y. Zhou S. Luo I. Waluyo E.J. Crumlin D.J. Stacchiola J. Zhou J. Carrasco H.F. Busnengo M.V. Ganduglia-Pirovano S.D. Senanayake J.A. Rodriguez Dry reforming of methane on a highly-active Ni-CeO2 catalyst: effects of metal-support interactions on C-H bond breaking Angew. Chem. Int. Ed. Engl. 55 2016 7455 7459 Z. Liu, D.C. Grinter, P.G. Lustemberg, T.D. Nguyen-Phan, Y. Zhou, S. Luo, I. Waluyo, E.J. Crumlin, D.J. Stacchiola, J. Zhou, J. Carrasco, H.F. Busnengo, M.V. Ganduglia-Pirovano, S.D. Senanayake and J.A. Rodriguez, Dry reforming of methane on a highly-active Ni-CeO2 catalyst: effects of metal-support interactions on C-H bond breaking, Angew. Chem. Int. Ed. Engl.55(2016) 7455–7459. [46] T.V. Sagar N. Sreelatha G. Hanmant M. Surendar N. Lingaiah K.S.R. Rao C.V.V. Satyanarayana I.A.K. Reddy P.S.S. Prasad Influence of method of preparation on the activity of La-Ni-Ce mixed oxide catalysts for dry reforming of methane RSC Adv 4 2014 50226 50232 T.V. Sagar, N. Sreelatha, G. Hanmant, M. Surendar, N. Lingaiah, K.S.R. Rao, C.V.V. Satyanarayana, I.A.K. Reddy and P.S.S. Prasad, Influence of method of preparation on the activity of La-Ni-Ce mixed oxide catalysts for dry reforming of methane, RSC Adv. 4(2014) 50226–50232. [47] Y. Guo S. Mei K. Yuan D.J. Wang H.C. Liu C.H. Yan Y.W. Zhang Low-temperature CO2 methanation over CeO2-supported Ru single atoms, nanoclusters, and nanoparticles competitively tuned by strong metal–support interactions and H-spillover effect ACS Catal 8 2018 6203 6215 Y. Guo, S. Mei, K. Yuan, D.J. Wang, H.C. Liu, C.H. Yan and Y.W. Zhang, Low-temperature CO2 methanation over CeO2-supported Ru single atoms, nanoclusters, and nanoparticles competitively tuned by strong metal–support interactions and H-spillover effect, ACS Catal. 8(2018) 6203–6215. [48] S.M. Lee Y.H. Lee D.H. Moon J.Y. Ahn D.D. Nguyen S.W. Chang S.S. Kim Reaction mechanism and catalytic impact of Ni/CeO2–x catalyst for low-temperature CO2 methanation Ind. Eng. Chem. Res. 58 2019 8656 8662 S.M. Lee, Y.H. Lee, D.H. Moon, J.Y. Ahn, D.D. Nguyen, S.W. Chang, S.S. Kim, Reaction mechanism and catalytic impact of Ni/CeO2–x catalyst for low-temperature CO2 methanation, Ind. Eng. Chem. Res.58(2019) 8656–8662. [49] C. Sun P. Beaunier V.La Parola L.F. Liotta P.Da Costa Ni/CeO2 nanoparticles promoted by yttrium doping as catalysts for CO2 methanation ACS Appl. Nano Mater. 3 2020 12355 12368 C. Sun, P. Beaunier, V. La Parola, L.F. Liotta, P. Da Costa, Ni/CeO2 nanoparticles promoted by yttrium doping as catalysts for CO2 methanation, ACS Appl. Nano Mater.3(2020) 12355–12368. [50] M. Li H. Amari A.C. van Veen Metal-oxide interaction enhanced CO2 activation in methanation over ceria supported nickel nanocrystallites Appl. Catal. B-Environ. 239 2018 27 35 M. Li, H. Amari and A.C. van Veen, Metal-oxide interaction enhanced CO2 activation in methanation over ceria supported nickel nanocrystallites, Appl. Catal. B-Environ.239(2018) 27–35. [51] X. Liao Y. Zhang M. Hill X. Xia Y. Zhao Z. Jiang Highly efficient Ni/CeO2 catalyst for the liquid phase hydrogenation of maleic anhydride Appl. Catal. A: Gen. 488 2014 256 264 X. Liao, Y. Zhang, M. Hill, X. Xia, Y. Zhao and Z. Jiang, Highly efficient Ni/CeO2 catalyst for the liquid phase hydrogenation of maleic anhydride, Appl. Catal. A: Gen.488(2014) 256–264. [52] S. Wang L. Zhao W. Wang Y. Zhao G. Zhang X. Ma J. Gong Morphology control of ceria nanocrystals for catalytic conversion of CO2 with methanol Nanoscale 5 2013 5582 5588 S. Wang, L. Zhao, W. Wang, Y. Zhao, G. Zhang, X. Ma and J. Gong, Morphology control of ceria nanocrystals for catalytic conversion of CO2 with methanol, Nanoscale 5(2013) 5582–5588. [53] A. Cárdenas-Arenas A. Quindimil A. Davó-Quiñonero E. Bailón-García D. Lozano-Castelló U. De-La-Torre B. Pereda-Ayo J.A. González-Marcos J.R. González-Velasco A. Bueno-López Isotopic and in situ DRIFTS study of the CO2 methanation mechanism using Ni/CeO2 and Ni/Al2O3 catalysts Appl. Catal. B-Environ. 265 2020 118538 118546 A. Cárdenas-Arenas, A. Quindimil, A. Davó-Quiñonero, E. Bailón-García, D. Lozano-Castelló, U. De-La-Torre, B. Pereda-Ayo, J.A. González-Marcos, J.R. González-Velasco, A. Bueno-López, Isotopic and in situ DRIFTS study of the CO2 methanation mechanism using Ni/CeO2 and Ni/Al2O3 catalysts, Appl. Catal. B-Environ.265(2020) 118538–118546. [54] A. Ruiz Puigdollers P. Schlexer S. Tosoni G. Pacchioni Increasing Oxide reducibility: the role of metal/oxide interfaces in the formation of oxygen vacancies ACS Catal 7 2017 6493 6513 A. Ruiz Puigdollers, P. Schlexer, S. Tosoni, G. Pacchioni, Increasing Oxide reducibility: the role of metal/oxide interfaces in the formation of oxygen vacancies, ACS Catal. 7(2017) 6493–6513. [55] J. Gong X. Bao Fundamental insights into interfacial catalysis Chem Soc. Rev. 46 2017 1770 1771 J. Gong, X. Bao, Fundamental insights into interfacial catalysis, Chem Soc. Rev.46(2017) 1770–1771.",
      "scopus-id": "85105555737",
      "coredata": {
        "eid": "1-s2.0-S2468823121002194",
        "dc:description": "Carbon dioxide hydrogenation for value-added chemicals has been regarded as a promising way for CO2 utilization. This paper describes the preparation of Ni/CeO2 catalysts derived from Ce-MOF precursor by impregnation or one-pot method and their application in carbon dioxide methanation. Various techniques were employed to characterize the prepared catalysts, including N2 adsorption–desorption, X-ray diffraction (XRD), Raman spectroscopy, field emission scanning electron microscopy (SEM), H2-temperature programmed reduction (H2-TPR), H2-temperature programmed desorption (H2-TPD) and CO2-temperature programmed desorption (CO2-TPD). The results showed that compared with commercial CeO2 and CeO2 prepared by precipitation, CeO2 derived from Ce-MOF exhibited more oxygen vacancies and lower temperature reducibility, making it more beneficial for the adsorption and activation of CO2. Consequently, nickel supported on rod-shaped CeO2 derived from Ce-MOF exhibited higher CO2 conversion and methane selectivity at low temperatures. Furthermore, the Ni/CeO2−M-1 catalysts prepared by one-pot method showed superior activity since nickel could be partially incorporated into ceria lattice, leading to the formation of Ce1-xNixO2-y solid solutions and oxygen vacancies. The effect of nickel loading on the properties of the catalysts by one-pot method was also investigated, and the optimum Ni loading was 15 wt.% owing to the maximum number of oxygen vacancies being reached.",
        "openArchiveArticle": "false",
        "prism:coverDate": "2021-05-31",
        "openaccessUserLicense": null,
        "prism:aggregationType": "Journal",
        "prism:url": "https://api.elsevier.com/content/article/pii/S2468823121002194",
        "dc:creator": [
          {
            "@_fa": "true",
            "$": "Tang, Rui"
          },
          {
            "@_fa": "true",
            "$": "Ullah, Niamat"
          },
          {
            "@_fa": "true",
            "$": "Hui, Yajun"
          },
          {
            "@_fa": "true",
            "$": "Li, Xin"
          },
          {
            "@_fa": "true",
            "$": "Li, Zhenhua"
          }
        ],
        "link": [
          {
            "@_fa": "true",
            "@rel": "self",
            "@href": "https://api.elsevier.com/content/article/pii/S2468823121002194"
          },
          {
            "@_fa": "true",
            "@rel": "scidir",
            "@href": "https://www.sciencedirect.com/science/article/pii/S2468823121002194"
          }
        ],
        "dc:format": "application/json",
        "openaccessType": null,
        "pii": "S2468-8231(21)00219-4",
        "prism:volume": "508",
        "articleNumber": "111602",
        "prism:publisher": "Elsevier B.V.",
        "dc:title": "Enhanced CO2 methanation activity over Ni/CeO2 catalyst by one-pot method",
        "prism:copyright": "© 2021 Elsevier B.V. All rights reserved.",
        "openaccess": "0",
        "prism:issn": "24688231",
        "dcterms:subject": [
          {
            "@_fa": "true",
            "$": "CO2 methanation"
          },
          {
            "@_fa": "true",
            "$": "Hydrogenation"
          },
          {
            "@_fa": "true",
            "$": "Ni/CeO2 Ce-MOF"
          }
        ],
        "openaccessArticle": "false",
        "prism:publicationName": "Molecular Catalysis",
        "openaccessSponsorType": null,
        "prism:pageRange": "111602",
        "pubType": "fla",
        "prism:coverDisplayDate": "May 2021",
        "prism:doi": "10.1016/j.mcat.2021.111602",
        "prism:startingPage": "111602",
        "dc:identifier": "doi:10.1016/j.mcat.2021.111602",
        "openaccessSponsorName": null
      },
      "objects": {
        "object": [
          {
            "@category": "standard",
            "@height": "299",
            "@width": "386",
            "@_fa": "true",
            "$": "https://api.elsevier.com/content/object/eid/1-s2.0-S2468823121002194-gr11.jpg?httpAccept=%2A%2F%2A",
            "@multimediatype": "JPEG image file",
            "@type": "IMAGE-DOWNSAMPLED",
            "@size": "38110",
            "@ref": "gr11",
            "@mimetype": "image/jpeg"
          },
          {
            "@category": "standard",
            "@height": "452",
            "@width": "652",
            "@_fa": "true",
            "$": "https://api.elsevier.com/content/object/eid/1-s2.0-S2468823121002194-gr10.jpg?httpAccept=%2A%2F%2A",
            "@multimediatype": "JPEG image file",
            "@type": "IMAGE-DOWNSAMPLED",
            "@size": "102983",
            "@ref": "gr10",
            "@mimetype": "image/jpeg"
          },
          {
            "@category": "standard",
            "@height": "428",
            "@width": "576",
            "@_fa": "true",
            "$": "https://api.elsevier.com/content/object/eid/1-s2.0-S2468823121002194-gr13.jpg?httpAccept=%2A%2F%2A",
            "@multimediatype": "JPEG image file",
            "@type": "IMAGE-DOWNSAMPLED",
            "@size": "71537",
            "@ref": "gr13",
            "@mimetype": "image/jpeg"
          },
          {
            "@category": "standard",
            "@height": "326",
            "@width": "386",
            "@_fa": "true",
            "$": "https://api.elsevier.com/content/object/eid/1-s2.0-S2468823121002194-gr12.jpg?httpAccept=%2A%2F%2A",
            "@multimediatype": "JPEG image file",
            "@type": "IMAGE-DOWNSAMPLED",
            "@size": "44106",
            "@ref": "gr12",
            "@mimetype": "image/jpeg"
          },
          {
            "@category": "standard",
            "@height": "98",
            "@width": "301",
            "@_fa": "true",
            "$": "https://api.elsevier.com/content/object/eid/1-s2.0-S2468823121002194-fx1.jpg?httpAccept=%2A%2F%2A",
            "@multimediatype": "JPEG image file",
            "@type": "IMAGE-DOWNSAMPLED",
            "@size": "15650",
            "@ref": "fx1",
            "@mimetype": "image/jpeg"
          },
          {
            "@category": "standard",
            "@height": "300",
            "@width": "646",
            "@_fa": "true",
            "$": "https://api.elsevier.com/content/object/eid/1-s2.0-S2468823121002194-gr4.jpg?httpAccept=%2A%2F%2A",
            "@multimediatype": "JPEG image file",
            "@type": "IMAGE-DOWNSAMPLED",
            "@size": "67869",
            "@ref": "gr4",
            "@mimetype": "image/jpeg"
          },
          {
            "@category": "standard",
            "@height": "302",
            "@width": "386",
            "@_fa": "true",
            "$": "https://api.elsevier.com/content/object/eid/1-s2.0-S2468823121002194-gr3.jpg?httpAccept=%2A%2F%2A",
            "@multimediatype": "JPEG image file",
            "@type": "IMAGE-DOWNSAMPLED",
            "@size": "50994",
            "@ref": "gr3",
            "@mimetype": "image/jpeg"
          },
          {
            "@category": "standard",
            "@height": "306",
            "@width": "386",
            "@_fa": "true",
            "$": "https://api.elsevier.com/content/object/eid/1-s2.0-S2468823121002194-gr2.jpg?httpAccept=%2A%2F%2A",
            "@multimediatype": "JPEG image file",
            "@type": "IMAGE-DOWNSAMPLED",
            "@size": "36481",
            "@ref": "gr2",
            "@mimetype": "image/jpeg"
          },
          {
            "@category": "standard",
            "@height": "254",
            "@width": "647",
            "@_fa": "true",
            "$": "https://api.elsevier.com/content/object/eid/1-s2.0-S2468823121002194-gr1.jpg?httpAccept=%2A%2F%2A",
            "@multimediatype": "JPEG image file",
            "@type": "IMAGE-DOWNSAMPLED",
            "@size": "56680",
            "@ref": "gr1",
            "@mimetype": "image/jpeg"
          },
          {
            "@category": "standard",
            "@height": "284",
            "@width": "386",
            "@_fa": "true",
            "$": "https://api.elsevier.com/content/object/eid/1-s2.0-S2468823121002194-gr8.jpg?httpAccept=%2A%2F%2A",
            "@multimediatype": "JPEG image file",
            "@type": "IMAGE-DOWNSAMPLED",
            "@size": "47573",
            "@ref": "gr8",
            "@mimetype": "image/jpeg"
          },
          {
            "@category": "standard",
            "@height": "257",
            "@width": "661",
            "@_fa": "true",
            "$": "https://api.elsevier.com/content/object/eid/1-s2.0-S2468823121002194-gr15.jpg?httpAccept=%2A%2F%2A",
            "@multimediatype": "JPEG image file",
            "@type": "IMAGE-DOWNSAMPLED",
            "@size": "54313",
            "@ref": "gr15",
            "@mimetype": "image/jpeg"
          },
          {
            "@category": "standard",
            "@height": "253",
            "@width": "651",
            "@_fa": "true",
            "$": "https://api.elsevier.com/content/object/eid/1-s2.0-S2468823121002194-gr7.jpg?httpAccept=%2A%2F%2A",
            "@multimediatype": "JPEG image file",
            "@type": "IMAGE-DOWNSAMPLED",
            "@size": "59861",
            "@ref": "gr7",
            "@mimetype": "image/jpeg"
          },
          {
            "@category": "standard",
            "@height": "245",
            "@width": "651",
            "@_fa": "true",
            "$": "https://api.elsevier.com/content/object/eid/1-s2.0-S2468823121002194-gr14.jpg?httpAccept=%2A%2F%2A",
            "@multimediatype": "JPEG image file",
            "@type": "IMAGE-DOWNSAMPLED",
            "@size": "41051",
            "@ref": "gr14",
            "@mimetype": "image/jpeg"
          },
          {
            "@category": "standard",
            "@height": "299",
            "@width": "386",
            "@_fa": "true",
            "$": "https://api.elsevier.com/content/object/eid/1-s2.0-S2468823121002194-gr6.jpg?httpAccept=%2A%2F%2A",
            "@multimediatype": "JPEG image file",
            "@type": "IMAGE-DOWNSAMPLED",
            "@size": "37570",
            "@ref": "gr6",
            "@mimetype": "image/jpeg"
          },
          {
            "@category": "standard",
            "@height": "259",
            "@width": "644",
            "@_fa": "true",
            "$": "https://api.elsevier.com/content/object/eid/1-s2.0-S2468823121002194-gr5.jpg?httpAccept=%2A%2F%2A",
            "@multimediatype": "JPEG image file",
            "@type": "IMAGE-DOWNSAMPLED",
            "@size": "54094",
            "@ref": "gr5",
            "@mimetype": "image/jpeg"
          },
          {
            "@category": "standard",
            "@height": "301",
            "@width": "386",
            "@_fa": "true",
            "$": "https://api.elsevier.com/content/object/eid/1-s2.0-S2468823121002194-gr9.jpg?httpAccept=%2A%2F%2A",
            "@multimediatype": "JPEG image file",
            "@type": "IMAGE-DOWNSAMPLED",
            "@size": "44161",
            "@ref": "gr9",
            "@mimetype": "image/jpeg"
          },
          {
            "@category": "thumbnail",
            "@height": "164",
            "@width": "211",
            "@_fa": "true",
            "$": "https://api.elsevier.com/content/object/eid/1-s2.0-S2468823121002194-gr11.sml?httpAccept=%2A%2F%2A",
            "@multimediatype": "GIF image file",
            "@type": "IMAGE-THUMBNAIL",
            "@size": "11551",
            "@ref": "gr11",
            "@mimetype": "image/gif"
          },
          {
            "@category": "thumbnail",
            "@height": "152",
            "@width": "219",
            "@_fa": "true",
            "$": "https://api.elsevier.com/content/object/eid/1-s2.0-S2468823121002194-gr10.sml?httpAccept=%2A%2F%2A",
            "@multimediatype": "GIF image file",
            "@type": "IMAGE-THUMBNAIL",
            "@size": "24958",
            "@ref": "gr10",
            "@mimetype": "image/gif"
          },
          {
            "@category": "thumbnail",
            "@height": "163",
            "@width": "219",
            "@_fa": "true",
            "$": "https://api.elsevier.com/content/object/eid/1-s2.0-S2468823121002194-gr13.sml?httpAccept=%2A%2F%2A",
            "@multimediatype": "GIF image file",
            "@type": "IMAGE-THUMBNAIL",
            "@size": "12655",
            "@ref": "gr13",
            "@mimetype": "image/gif"
          },
          {
            "@category": "thumbnail",
            "@height": "164",
            "@width": "194",
            "@_fa": "true",
            "$": "https://api.elsevier.com/content/object/eid/1-s2.0-S2468823121002194-gr12.sml?httpAccept=%2A%2F%2A",
            "@multimediatype": "GIF image file",
            "@type": "IMAGE-THUMBNAIL",
            "@size": "12350",
            "@ref": "gr12",
            "@mimetype": "image/gif"
          },
          {
            "@category": "thumbnail",
            "@height": "72",
            "@width": "219",
            "@_fa": "true",
            "$": "https://api.elsevier.com/content/object/eid/1-s2.0-S2468823121002194-fx1.sml?httpAccept=%2A%2F%2A",
            "@multimediatype": "GIF image file",
            "@type": "IMAGE-THUMBNAIL",
            "@size": "8284",
            "@ref": "fx1",
            "@mimetype": "image/gif"
          },
          {
            "@category": "thumbnail",
            "@height": "102",
            "@width": "219",
            "@_fa": "true",
            "$": "https://api.elsevier.com/content/object/eid/1-s2.0-S2468823121002194-gr4.sml?httpAccept=%2A%2F%2A",
            "@multimediatype": "GIF image file",
            "@type": "IMAGE-THUMBNAIL",
            "@size": "15185",
            "@ref": "gr4",
            "@mimetype": "image/gif"
          },
          {
            "@category": "thumbnail",
            "@height": "164",
            "@width": "210",
            "@_fa": "true",
            "$": "https://api.elsevier.com/content/object/eid/1-s2.0-S2468823121002194-gr3.sml?httpAccept=%2A%2F%2A",
            "@multimediatype": "GIF image file",
            "@type": "IMAGE-THUMBNAIL",
            "@size": "14124",
            "@ref": "gr3",
            "@mimetype": "image/gif"
          },
          {
            "@category": "thumbnail",
            "@height": "164",
            "@width": "207",
            "@_fa": "true",
            "$": "https://api.elsevier.com/content/object/eid/1-s2.0-S2468823121002194-gr2.sml?httpAccept=%2A%2F%2A",
            "@multimediatype": "GIF image file",
            "@type": "IMAGE-THUMBNAIL",
            "@size": "10670",
            "@ref": "gr2",
            "@mimetype": "image/gif"
          },
          {
            "@category": "thumbnail",
            "@height": "86",
            "@width": "219",
            "@_fa": "true",
            "$": "https://api.elsevier.com/content/object/eid/1-s2.0-S2468823121002194-gr1.sml?httpAccept=%2A%2F%2A",
            "@multimediatype": "GIF image file",
            "@type": "IMAGE-THUMBNAIL",
            "@size": "8956",
            "@ref": "gr1",
            "@mimetype": "image/gif"
          },
          {
            "@category": "thumbnail",
            "@height": "161",
            "@width": "219",
            "@_fa": "true",
            "$": "https://api.elsevier.com/content/object/eid/1-s2.0-S2468823121002194-gr8.sml?httpAccept=%2A%2F%2A",
            "@multimediatype": "GIF image file",
            "@type": "IMAGE-THUMBNAIL",
            "@size": "14206",
            "@ref": "gr8",
            "@mimetype": "image/gif"
          },
          {
            "@category": "thumbnail",
            "@height": "85",
            "@width": "219",
            "@_fa": "true",
            "$": "https://api.elsevier.com/content/object/eid/1-s2.0-S2468823121002194-gr15.sml?httpAccept=%2A%2F%2A",
            "@multimediatype": "GIF image file",
            "@type": "IMAGE-THUMBNAIL",
            "@size": "11233",
            "@ref": "gr15",
            "@mimetype": "image/gif"
          },
          {
            "@category": "thumbnail",
            "@height": "85",
            "@width": "219",
            "@_fa": "true",
            "$": "https://api.elsevier.com/content/object/eid/1-s2.0-S2468823121002194-gr7.sml?httpAccept=%2A%2F%2A",
            "@multimediatype": "GIF image file",
            "@type": "IMAGE-THUMBNAIL",
            "@size": "8910",
            "@ref": "gr7",
            "@mimetype": "image/gif"
          },
          {
            "@category": "thumbnail",
            "@height": "82",
            "@width": "219",
            "@_fa": "true",
            "$": "https://api.elsevier.com/content/object/eid/1-s2.0-S2468823121002194-gr14.sml?httpAccept=%2A%2F%2A",
            "@multimediatype": "GIF image file",
            "@type": "IMAGE-THUMBNAIL",
            "@size": "7266",
            "@ref": "gr14",
            "@mimetype": "image/gif"
          },
          {
            "@category": "thumbnail",
            "@height": "164",
            "@width": "212",
            "@_fa": "true",
            "$": "https://api.elsevier.com/content/object/eid/1-s2.0-S2468823121002194-gr6.sml?httpAccept=%2A%2F%2A",
            "@multimediatype": "GIF image file",
            "@type": "IMAGE-THUMBNAIL",
            "@size": "14045",
            "@ref": "gr6",
            "@mimetype": "image/gif"
          },
          {
            "@category": "thumbnail",
            "@height": "88",
            "@width": "219",
            "@_fa": "true",
            "$": "https://api.elsevier.com/content/object/eid/1-s2.0-S2468823121002194-gr5.sml?httpAccept=%2A%2F%2A",
            "@multimediatype": "GIF image file",
            "@type": "IMAGE-THUMBNAIL",
            "@size": "8442",
            "@ref": "gr5",
            "@mimetype": "image/gif"
          },
          {
            "@category": "thumbnail",
            "@height": "164",
            "@width": "210",
            "@_fa": "true",
            "$": "https://api.elsevier.com/content/object/eid/1-s2.0-S2468823121002194-gr9.sml?httpAccept=%2A%2F%2A",
            "@multimediatype": "GIF image file",
            "@type": "IMAGE-THUMBNAIL",
            "@size": "12248",
            "@ref": "gr9",
            "@mimetype": "image/gif"
          },
          {
            "@category": "thumbnail",
            "@_fa": "true",
            "$": "https://api.elsevier.com/content/object/eid/1-s2.0-S2468823121002194-si1.svg?httpAccept=%2A%2F%2A",
            "@multimediatype": "Scalable Vector Graphics file",
            "@type": "ALTIMG",
            "@size": "4333",
            "@ref": "si1",
            "@mimetype": "image/svg+xml"
          },
          {
            "@category": "thumbnail",
            "@_fa": "true",
            "$": "https://api.elsevier.com/content/object/eid/1-s2.0-S2468823121002194-si2.svg?httpAccept=%2A%2F%2A",
            "@multimediatype": "Scalable Vector Graphics file",
            "@type": "ALTIMG",
            "@size": "12620",
            "@ref": "si2",
            "@mimetype": "image/svg+xml"
          },
          {
            "@category": "thumbnail",
            "@_fa": "true",
            "$": "https://api.elsevier.com/content/object/eid/1-s2.0-S2468823121002194-si3.svg?httpAccept=%2A%2F%2A",
            "@multimediatype": "Scalable Vector Graphics file",
            "@type": "ALTIMG",
            "@size": "13516",
            "@ref": "si3",
            "@mimetype": "image/svg+xml"
          },
          {
            "@category": "thumbnail",
            "@_fa": "true",
            "$": "https://api.elsevier.com/content/object/eid/1-s2.0-S2468823121002194-si4.svg?httpAccept=%2A%2F%2A",
            "@multimediatype": "Scalable Vector Graphics file",
            "@type": "ALTIMG",
            "@size": "11900",
            "@ref": "si4",
            "@mimetype": "image/svg+xml"
          },
          {
            "@category": "thumbnail",
            "@_fa": "true",
            "$": "https://api.elsevier.com/content/object/eid/1-s2.0-S2468823121002194-si5.svg?httpAccept=%2A%2F%2A",
            "@multimediatype": "Scalable Vector Graphics file",
            "@type": "ALTIMG",
            "@size": "13870",
            "@ref": "si5",
            "@mimetype": "image/svg+xml"
          },
          {
            "@category": "standard",
            "@_fa": "true",
            "$": "https://api.elsevier.com/content/object/eid/1-s2.0-S2468823121002194-am.pdf?httpAccept=%2A%2F%2A",
            "@multimediatype": "Acrobat PDF file",
            "@type": "AAM-PDF",
            "@size": "2941938",
            "@ref": "am",
            "@mimetype": "application/pdf"
          }
        ]
      },
      "link": {
        "@rel": "abstract",
        "@href": "https://api.elsevier.com/content/abstract/scopus_id/85105555737"
      }
    }
  }
}