{
  "metadata": {
    "title": "The graphene-supported Lanthanum oxide cluster as efficient bifunctional electrocatalyst for oxygen reaction",
    "authors": "; ; ",
    "journal": "Molecular Catalysis",
    "date": "2023-01-15",
    "doi": "10.1016/j.mcat.2022.112879",
    "abstract": "",
    "uri": "https://api.elsevier.com/content/article/pii/S2468823122007659",
    "pii": "S2468823122007659"
  },
  "fulltext": {
    "full-text-retrieval-response": {
      "scopus-eid": "2-s2.0-85144332789",
      "originalText": "serial JL 315758 291210 291744 291790 291809 31 Molecular Catalysis MOLECULARCATALYSIS 2022-12-19 2022-12-19 2022-12-19 2022-12-19 2023-01-07T15:56:45 1-s2.0-S2468823122007659 S2468-8231(22)00765-9 S2468823122007659 10.1016/j.mcat.2022.112879 S300 S300.1 FULL-TEXT 1-s2.0-S2468823122X00187 2024-06-26T17:47:58.012062Z 0 0 20230115 2023 2022-12-19T12:04:18.911408Z absattachment articleinfo articlenumber articletitlenorm authfirstinitialnorm authfirstsurnamenorm cid cids contenttype copyright crossmark dateloaded dateloadedtxt datesearch datesort dateupdated dco docsubtype doctype doi eid ewtransactionid hubeid indexeddate issn issnnorm itemstage itemtransactionid itemweight openaccess openarchive pg pgfirst pii piinorm pubdatestart pubdatetxt pubyr sectiontitle sortorder srctitle srctitlenorm srctype ssids alllist content subj subheadings suppl tomb volfirst volissue volumelist webpdf webpdfpagecount yearnav figure table e-component body mmlmath acknowledge affil appendices articletitle auth authfirstini authfull authkeywords authlast grantnumber grantsponsor grantsponsorid highlightsabst orcid primabst ref specialabst 2468-8231 24688231 true 535 535 C Volume 535 50 112879 112879 112879 20230115 15 January 2023 2023-01-15 2023 Regular Papers article fla © 2022 Elsevier B.V. All rights reserved. GRAPHENESUPPORTEDLANTHANUMOXIDECLUSTEREFFICIENTBIFUNCTIONALELECTROCATALYSTFOROXYGENREACTION WANG D 1 Introduction 2 Computational details 2.1 Model construction 2.2 Calculation parameters 2.3 Computational content 3 Results and discussions 3.1 Stability analysis of La2O3-Gra electrocatalyst 3.2 Mechanisms of ORR and OER on bare La2O3-Gra electrocatalyst 3.2.1 Bare O-Gra-1 3.2.2 Bare Face-Gra-1 3.3 Mechanisms of ORR and OER on OH modified O-Gra-1 and Face-Gra-1 3.3.1 OH modified O-Gra-1 3.3.2 OH modified Face-Gra-1 3.4 The descriptors for evaluating catalyst performance for ORR and OER 4 Conclusion CRediT authorship contribution statement Acknowledgments Appendix Supplementary materials References ALI 2021 251 260 A AMIRNEJAD 2021 100011 H TANC 2019 10120 10128 B WANG 2019 2787 C LIU 2019 22656 22667 F LOZANO 2018 105 117 T HE 2018 20312 20322 B CURUTCHET 2020 7031 7038 A ZHANG 2021 2100129 K ZHU 2019 1252 1265 K YING 2021 16860 16867 Y NIU 2020 6555 6563 H DENG 2019 378 384 Q ZHANG 2017 6930 6941 C ZHENG 2016 443 449 Y FENG 2015 30687 30694 L QI 2020 521 530 W QIN 2022 6902 6911 Z LI 2022 1005 1013 X CHEN 2020 112945 M LIANG 2019 19308 19317 Z YANG 2020 1442 1476 Y TAN 2021 105813 Y YANG 2020 105057 S WU 2014 2112 2124 Y KOU 2020 104288 Z YIN 2012 8288 8297 H ORAZI 2020 30805 30817 V WANG 2022 109459 Z MAITI 2021 128358 K JALILI 2017 14522 14533 S WANG 2018 1803712 L STOPIC 2021 978 S COEY 2020 119 131 J ANASHKINA 2020 30 E WANG 2020 101569 J WANG 2016 77786 77795 N ZHANG 2014 20229 20237 X SUN 2021 3974 3983 L IBRAHIM 2019 5367 5383 M DAI 2021 2102593 T KANG 2020 796 804 Y LI 2021 229052 D LI 2020 1903833 M ZHANG 2019 5769 5778 G LUO 2016 19601 19609 Y DORENBOS 2013 93 104 P KARIMZADEH 2015 263 270 I XIA 2010 245 252 T ZHAO 2020 12606 12614 J FERDOV 2011 4498 4504 S DING 2012 214311 X DELLEY 2000 7756 7764 B PERDEW 1996 3865 3868 J RODRIGUEZ 2007 1757 1760 J TKATCHENKO 2009 073005 A TODOROVA 2008 1013 1017 T DELLEY 2002 155125 B XIAO 2022 3073 3081 G ZHAO 2019 24583 24593 X HONG 2015 1404 1427 W WANG 2018 3375 3379 J LU 2019 2622 2626 Z HUANG 2021 108431 S XU 2021 2334 2344 J MARTINEZ 2019 F3136 F3142 U HOLBY 2015 9286 E LIANG 2020 20453 20462 Z LIANG 2020 54 62 Z LI 2021 4508 4515 J CHEN 2021 210332 F CAO 2018 134 141 L YANG 2020 2000176 X WANGX2023X112879 WANGX2023X112879XD 2024-12-19T00:00:00.000Z 2024-12-19T00:00:00.000Z http://creativecommons.org/licenses/by-nc-nd/4.0/ © 2022 Elsevier B.V. All rights reserved. 2022-12-24T05:08:37.910Z http://vtw.elsevier.com/data/voc/AddOnTypes/50.7/aggregated-refined Program of Qingjiang Excellent Young Talents Ministry of Science and ICT 2021R1F1A1046648 MSIP Ministry of Science, ICT and Future Planning http://data.elsevier.com/vocabulary/SciValFunders/501100003621 http://sws.geonames.org/1835841/ National Research Foundation of Korea NRF National Research Foundation of Korea http://data.elsevier.com/vocabulary/SciValFunders/501100003725 http://sws.geonames.org/1835841/ Natural Science Foundation of Jiangxi Province 20212BAB203015 20212BCJL23053 Natural Science Foundation of Jiangxi Province http://data.elsevier.com/vocabulary/SciValFunders/501100004479 http://sws.geonames.org/1814991/ Jiangxi University of Science and Technology JXUSTQJYX2020002 JUST Jiangxi University of Science and Technology http://data.elsevier.com/vocabulary/SciValFunders/501100008254 http://sws.geonames.org/1814991/ Education Department of Jiangxi Province GJJ200808 Education Department of Jiangxi Province http://data.elsevier.com/vocabulary/SciValFunders/501100009102 http://sws.geonames.org/1814991/ This work was supported by the Natural Science Foundation of Jiangxi Province (Grant No. 20212BCJL23053 and 20212BAB203015 ), the Research Foundation of the Education Department of Jiangxi Province (Grant No. GJJ200808) and the Program of Qingjiang Excellent Young Talents (JXUSTQJYX2020002), Jiangxi University of Science and Technology. The authors also thank the National Research Foundation of Korea (NRF) funded by the Korean government, Ministry of Science and ICT (MSIT) (No. 2021R1F1A1046648), Republic of Korea. 0 https://doi.org/10.15223/policy-017 https://doi.org/10.15223/policy-037 https://doi.org/10.15223/policy-012 https://doi.org/10.15223/policy-029 https://doi.org/10.15223/policy-004 item S2468-8231(22)00765-9 S2468823122007659 1-s2.0-S2468823122007659 10.1016/j.mcat.2022.112879 315758 2023-01-07T16:15:48.591745Z 2023-01-15 1-s2.0-S2468823122007659-main.pdf https://s3-eu-west-1.amazonaws.com/prod-ucs-content-store-eu-west/content/pii:S2468823122007659/MAIN/application/pdf/9a0d5cf4c07f3d254fcea1fd6cec4c05/main.pdf main.pdf pdf true 5494069 MAIN 11 1-s2.0-S2468823122007659-main_1.png https://s3-eu-west-1.amazonaws.com/prod-ucs-content-store-eu-west/content/pii:S2468823122007659/PREVIEW/image/png/0ae352f1ad8e6bbaa01b04a0dd582336/main_1.png main_1.png png 59458 849 656 IMAGE-WEB-PDF 1 1-s2.0-S2468823122007659-gr7.jpg https://s3-eu-west-1.amazonaws.com/prod-ucs-content-store-eu-west/content/pii:S2468823122007659/gr7/DOWNSAMPLED/image/jpeg/c41273d1ed709089c2ff0d3be2033d25/gr7.jpg gr7 gr7.jpg jpg 139839 773 489 IMAGE-DOWNSAMPLED 1-s2.0-S2468823122007659-gr8.jpg https://s3-eu-west-1.amazonaws.com/prod-ucs-content-store-eu-west/content/pii:S2468823122007659/gr8/DOWNSAMPLED/image/jpeg/c107d3fcaa8c869c0a23c6ec0ccc2251/gr8.jpg gr8 gr8.jpg jpg 81250 377 659 IMAGE-DOWNSAMPLED 1-s2.0-S2468823122007659-gr5.jpg https://s3-eu-west-1.amazonaws.com/prod-ucs-content-store-eu-west/content/pii:S2468823122007659/gr5/DOWNSAMPLED/image/jpeg/d13ee38b64feb6340368f134743ebd97/gr5.jpg gr5 gr5.jpg jpg 59526 397 489 IMAGE-DOWNSAMPLED 1-s2.0-S2468823122007659-gr6.jpg https://s3-eu-west-1.amazonaws.com/prod-ucs-content-store-eu-west/content/pii:S2468823122007659/gr6/DOWNSAMPLED/image/jpeg/739a5ee44d17c0e1b166619ad50fa558/gr6.jpg gr6 gr6.jpg jpg 84621 415 527 IMAGE-DOWNSAMPLED 1-s2.0-S2468823122007659-gr3.jpg https://s3-eu-west-1.amazonaws.com/prod-ucs-content-store-eu-west/content/pii:S2468823122007659/gr3/DOWNSAMPLED/image/jpeg/09da1b2b9751c83dbe09333a3e0ef5d4/gr3.jpg gr3 gr3.jpg jpg 63023 385 527 IMAGE-DOWNSAMPLED 1-s2.0-S2468823122007659-gr4.jpg https://s3-eu-west-1.amazonaws.com/prod-ucs-content-store-eu-west/content/pii:S2468823122007659/gr4/DOWNSAMPLED/image/jpeg/cd5d5b52019c629a43ece1598b3a23c3/gr4.jpg gr4 gr4.jpg jpg 38623 190 489 IMAGE-DOWNSAMPLED 1-s2.0-S2468823122007659-gr1.jpg https://s3-eu-west-1.amazonaws.com/prod-ucs-content-store-eu-west/content/pii:S2468823122007659/gr1/DOWNSAMPLED/image/jpeg/9811ca43e2e614019c11b5a42c53a829/gr1.jpg gr1 gr1.jpg jpg 26930 182 489 IMAGE-DOWNSAMPLED 1-s2.0-S2468823122007659-gr2.jpg https://s3-eu-west-1.amazonaws.com/prod-ucs-content-store-eu-west/content/pii:S2468823122007659/gr2/DOWNSAMPLED/image/jpeg/3cdb34a6a4e208ccaa856cbcc7d207ed/gr2.jpg gr2 gr2.jpg jpg 30488 139 489 IMAGE-DOWNSAMPLED 1-s2.0-S2468823122007659-ga1.jpg https://s3-eu-west-1.amazonaws.com/prod-ucs-content-store-eu-west/content/pii:S2468823122007659/ga1/DOWNSAMPLED/image/jpeg/6d36dba1e00abb06cd465764756686b1/ga1.jpg ga1 true ga1.jpg jpg 26124 245 243 IMAGE-DOWNSAMPLED 1-s2.0-S2468823122007659-gr7.sml https://s3-eu-west-1.amazonaws.com/prod-ucs-content-store-eu-west/content/pii:S2468823122007659/gr7/THUMBNAIL/image/gif/dbee8eb3a376fdb70f972fc6ab7cf88e/gr7.sml gr7 gr7.sml sml 10715 163 103 IMAGE-THUMBNAIL 1-s2.0-S2468823122007659-gr8.sml https://s3-eu-west-1.amazonaws.com/prod-ucs-content-store-eu-west/content/pii:S2468823122007659/gr8/THUMBNAIL/image/gif/54e48229fdbc46ec6b60a6708b13d644/gr8.sml gr8 gr8.sml sml 12437 125 219 IMAGE-THUMBNAIL 1-s2.0-S2468823122007659-gr5.sml https://s3-eu-west-1.amazonaws.com/prod-ucs-content-store-eu-west/content/pii:S2468823122007659/gr5/THUMBNAIL/image/gif/08fa7f3eeae800d7f3d9685ed0edeae2/gr5.sml gr5 gr5.sml sml 12607 164 202 IMAGE-THUMBNAIL 1-s2.0-S2468823122007659-gr6.sml https://s3-eu-west-1.amazonaws.com/prod-ucs-content-store-eu-west/content/pii:S2468823122007659/gr6/THUMBNAIL/image/gif/da2363708337af443b6014e949635020/gr6.sml gr6 gr6.sml sml 15945 164 208 IMAGE-THUMBNAIL 1-s2.0-S2468823122007659-gr3.sml https://s3-eu-west-1.amazonaws.com/prod-ucs-content-store-eu-west/content/pii:S2468823122007659/gr3/THUMBNAIL/image/gif/d1c9d37f82fac01e7e056f86432499ad/gr3.sml gr3 gr3.sml sml 13479 160 219 IMAGE-THUMBNAIL 1-s2.0-S2468823122007659-gr4.sml https://s3-eu-west-1.amazonaws.com/prod-ucs-content-store-eu-west/content/pii:S2468823122007659/gr4/THUMBNAIL/image/gif/6b890b50d393fbfb8b19fe8f40ba0aa9/gr4.sml gr4 gr4.sml sml 9763 85 219 IMAGE-THUMBNAIL 1-s2.0-S2468823122007659-gr1.sml https://s3-eu-west-1.amazonaws.com/prod-ucs-content-store-eu-west/content/pii:S2468823122007659/gr1/THUMBNAIL/image/gif/db16197ec47ac019d7b851ac71b89666/gr1.sml gr1 gr1.sml sml 7656 81 219 IMAGE-THUMBNAIL 1-s2.0-S2468823122007659-gr2.sml https://s3-eu-west-1.amazonaws.com/prod-ucs-content-store-eu-west/content/pii:S2468823122007659/gr2/THUMBNAIL/image/gif/5a816c93f11107c5565f2a5f4fd9019a/gr2.sml gr2 gr2.sml sml 8364 62 219 IMAGE-THUMBNAIL 1-s2.0-S2468823122007659-ga1.sml https://s3-eu-west-1.amazonaws.com/prod-ucs-content-store-eu-west/content/pii:S2468823122007659/ga1/THUMBNAIL/image/gif/56330a3504cdf7208e587f5b9208092e/ga1.sml ga1 true ga1.sml sml 17902 163 162 IMAGE-THUMBNAIL 1-s2.0-S2468823122007659-gr7_lrg.jpg https://s3-eu-west-1.amazonaws.com/prod-ucs-content-store-eu-west/content/pii:S2468823122007659/HIGHRES/image/jpeg/3eba2583333faefa62232ace5d8e474a/gr7_lrg.jpg gr7 gr7_lrg.jpg jpg 1088137 3424 2167 IMAGE-HIGH-RES 1-s2.0-S2468823122007659-gr8_lrg.jpg https://s3-eu-west-1.amazonaws.com/prod-ucs-content-store-eu-west/content/pii:S2468823122007659/HIGHRES/image/jpeg/286a3362444b5bbfd80ab6d245e43f9d/gr8_lrg.jpg gr8 gr8_lrg.jpg jpg 565742 1670 2917 IMAGE-HIGH-RES 1-s2.0-S2468823122007659-gr5_lrg.jpg https://s3-eu-west-1.amazonaws.com/prod-ucs-content-store-eu-west/content/pii:S2468823122007659/HIGHRES/image/jpeg/c9f4334e69a230668d9d9eb97377372f/gr5_lrg.jpg gr5 gr5_lrg.jpg jpg 434717 1758 2167 IMAGE-HIGH-RES 1-s2.0-S2468823122007659-gr6_lrg.jpg https://s3-eu-west-1.amazonaws.com/prod-ucs-content-store-eu-west/content/pii:S2468823122007659/HIGHRES/image/jpeg/bfd0e948c02d25ee92a86718650ca9dc/gr6_lrg.jpg gr6 gr6_lrg.jpg jpg 592673 1835 2333 IMAGE-HIGH-RES 1-s2.0-S2468823122007659-gr3_lrg.jpg https://s3-eu-west-1.amazonaws.com/prod-ucs-content-store-eu-west/content/pii:S2468823122007659/HIGHRES/image/jpeg/78c4645e7be65fa13873c1b76ba396a9/gr3_lrg.jpg gr3 gr3_lrg.jpg jpg 449285 1704 2333 IMAGE-HIGH-RES 1-s2.0-S2468823122007659-gr4_lrg.jpg https://s3-eu-west-1.amazonaws.com/prod-ucs-content-store-eu-west/content/pii:S2468823122007659/HIGHRES/image/jpeg/814bfc6c48dd715463efdc4f9d9d4606/gr4_lrg.jpg gr4 gr4_lrg.jpg jpg 262428 844 2167 IMAGE-HIGH-RES 1-s2.0-S2468823122007659-gr1_lrg.jpg https://s3-eu-west-1.amazonaws.com/prod-ucs-content-store-eu-west/content/pii:S2468823122007659/HIGHRES/image/jpeg/3a853a99c1514e55607af75744ccf982/gr1_lrg.jpg gr1 gr1_lrg.jpg jpg 190445 805 2167 IMAGE-HIGH-RES 1-s2.0-S2468823122007659-gr2_lrg.jpg https://s3-eu-west-1.amazonaws.com/prod-ucs-content-store-eu-west/content/pii:S2468823122007659/HIGHRES/image/jpeg/e0c04de450dc86eb93eacf98a0ef6f3c/gr2_lrg.jpg gr2 gr2_lrg.jpg jpg 200125 615 2167 IMAGE-HIGH-RES 1-s2.0-S2468823122007659-ga1_lrg.jpg https://s3-eu-west-1.amazonaws.com/prod-ucs-content-store-eu-west/content/pii:S2468823122007659/HIGHRES/image/jpeg/156575f19bc89a22d416b8e6789bff02/ga1_lrg.jpg ga1 true ga1_lrg.jpg jpg 175300 1085 1076 IMAGE-HIGH-RES 1-s2.0-S2468823122007659-mmc1.docx https://s3-eu-west-1.amazonaws.com/prod-ucs-content-store-eu-west/content/pii:S2468823122007659/mmc1/MAIN/application/vnd.openxmlformats-officedocument.wordprocessingml.document/61206a7263b0899b0b4039563f8538d9/mmc1.docx mmc1 mmc1.docx docx 95074277 APPLICATION 1-s2.0-S2468823122007659-mmc2.docx https://s3-eu-west-1.amazonaws.com/prod-ucs-content-store-eu-west/content/pii:S2468823122007659/mmc2/MAIN/application/vnd.openxmlformats-officedocument.wordprocessingml.document/a3402334e98821f8fa1feb1eedeff02a/mmc2.docx mmc2 mmc2.docx docx 9392555 APPLICATION 1-s2.0-S2468823122007659-si1.svg https://s3-eu-west-1.amazonaws.com/prod-ucs-content-store-eu-west/content/pii:S2468823122007659/image/svg+xml/af2f9926ae2d9e3103d7a92f2874406c/si1.svg si1 si1.svg svg 1925 ALTIMG 1-s2.0-S2468823122007659-si10.svg https://s3-eu-west-1.amazonaws.com/prod-ucs-content-store-eu-west/content/pii:S2468823122007659/image/svg+xml/9ab964472df265f8ec7d5de618f9a97c/si10.svg si10 si10.svg svg 8751 ALTIMG 1-s2.0-S2468823122007659-si11.svg https://s3-eu-west-1.amazonaws.com/prod-ucs-content-store-eu-west/content/pii:S2468823122007659/image/svg+xml/b870a05046b23b8abad155d13db30721/si11.svg si11 si11.svg svg 6489 ALTIMG 1-s2.0-S2468823122007659-si12.svg https://s3-eu-west-1.amazonaws.com/prod-ucs-content-store-eu-west/content/pii:S2468823122007659/image/svg+xml/550dedf96854358ba19f733333729ffa/si12.svg si12 si12.svg svg 3762 ALTIMG 1-s2.0-S2468823122007659-si13.svg https://s3-eu-west-1.amazonaws.com/prod-ucs-content-store-eu-west/content/pii:S2468823122007659/image/svg+xml/44c86cfbc48d638c960f88bc0a38a65c/si13.svg si13 si13.svg svg 4825 ALTIMG 1-s2.0-S2468823122007659-si14.svg https://s3-eu-west-1.amazonaws.com/prod-ucs-content-store-eu-west/content/pii:S2468823122007659/image/svg+xml/0b800f3435edc6da5f732fae4b317435/si14.svg si14 si14.svg svg 6861 ALTIMG 1-s2.0-S2468823122007659-si15.svg https://s3-eu-west-1.amazonaws.com/prod-ucs-content-store-eu-west/content/pii:S2468823122007659/image/svg+xml/0b682f3bb791707d5a59303d46e3dc22/si15.svg si15 si15.svg svg 5546 ALTIMG 1-s2.0-S2468823122007659-si16.svg https://s3-eu-west-1.amazonaws.com/prod-ucs-content-store-eu-west/content/pii:S2468823122007659/image/svg+xml/dafc8b133044711bd5c7c3b689d5c7b0/si16.svg si16 si16.svg svg 7777 ALTIMG 1-s2.0-S2468823122007659-si17.svg https://s3-eu-west-1.amazonaws.com/prod-ucs-content-store-eu-west/content/pii:S2468823122007659/image/svg+xml/6f10a4493ffb7d4761ca2a986d1308ba/si17.svg si17 si17.svg svg 6400 ALTIMG 1-s2.0-S2468823122007659-si18.svg https://s3-eu-west-1.amazonaws.com/prod-ucs-content-store-eu-west/content/pii:S2468823122007659/image/svg+xml/6384f6465f8c27064fa6cfcc8b3204df/si18.svg si18 si18.svg svg 7134 ALTIMG 1-s2.0-S2468823122007659-si19.svg https://s3-eu-west-1.amazonaws.com/prod-ucs-content-store-eu-west/content/pii:S2468823122007659/image/svg+xml/58043805ad79fcb9a6d7551192d95470/si19.svg si19 si19.svg svg 6783 ALTIMG 1-s2.0-S2468823122007659-si2.svg https://s3-eu-west-1.amazonaws.com/prod-ucs-content-store-eu-west/content/pii:S2468823122007659/image/svg+xml/416c0963a46a5648a41a102c0d1d3e61/si2.svg si2 si2.svg svg 1633 ALTIMG 1-s2.0-S2468823122007659-si20.svg https://s3-eu-west-1.amazonaws.com/prod-ucs-content-store-eu-west/content/pii:S2468823122007659/image/svg+xml/dc80b238d08d3a7324da09d2a1e94ab8/si20.svg si20 si20.svg svg 2434 ALTIMG 1-s2.0-S2468823122007659-si21.svg https://s3-eu-west-1.amazonaws.com/prod-ucs-content-store-eu-west/content/pii:S2468823122007659/image/svg+xml/c5b88c5d76b169cdf9edae329b403b17/si21.svg si21 si21.svg svg 4009 ALTIMG 1-s2.0-S2468823122007659-si22.svg https://s3-eu-west-1.amazonaws.com/prod-ucs-content-store-eu-west/content/pii:S2468823122007659/image/svg+xml/3fdea7b89fbad15ed817de5017cd7bae/si22.svg si22 si22.svg svg 3020 ALTIMG 1-s2.0-S2468823122007659-si23.svg https://s3-eu-west-1.amazonaws.com/prod-ucs-content-store-eu-west/content/pii:S2468823122007659/image/svg+xml/fb5fdb734ddfa9e4b33646534bf18e88/si23.svg si23 si23.svg svg 3956 ALTIMG 1-s2.0-S2468823122007659-si24.svg https://s3-eu-west-1.amazonaws.com/prod-ucs-content-store-eu-west/content/pii:S2468823122007659/image/svg+xml/cef5d177ebb882ccffb25427ebcf2c5e/si24.svg si24 si24.svg svg 4524 ALTIMG 1-s2.0-S2468823122007659-si25.svg https://s3-eu-west-1.amazonaws.com/prod-ucs-content-store-eu-west/content/pii:S2468823122007659/image/svg+xml/bdaf3f158eeeadf36aa585e631486d2f/si25.svg si25 si25.svg svg 5857 ALTIMG 1-s2.0-S2468823122007659-si26.svg https://s3-eu-west-1.amazonaws.com/prod-ucs-content-store-eu-west/content/pii:S2468823122007659/image/svg+xml/63a6e9ea0cf19e2a70bdbc82bab8c100/si26.svg si26 si26.svg svg 5034 ALTIMG 1-s2.0-S2468823122007659-si27.svg https://s3-eu-west-1.amazonaws.com/prod-ucs-content-store-eu-west/content/pii:S2468823122007659/image/svg+xml/a6448c410b6c2016561bf8ae40f57c34/si27.svg si27 si27.svg svg 5702 ALTIMG 1-s2.0-S2468823122007659-si28.svg https://s3-eu-west-1.amazonaws.com/prod-ucs-content-store-eu-west/content/pii:S2468823122007659/image/svg+xml/bc854832d55ed42c1b877d2f9e6fdaad/si28.svg si28 si28.svg svg 4929 ALTIMG 1-s2.0-S2468823122007659-si29.svg https://s3-eu-west-1.amazonaws.com/prod-ucs-content-store-eu-west/content/pii:S2468823122007659/image/svg+xml/ea1bec1c089a53ed5a1513012af381c7/si29.svg si29 si29.svg svg 5929 ALTIMG 1-s2.0-S2468823122007659-si3.svg https://s3-eu-west-1.amazonaws.com/prod-ucs-content-store-eu-west/content/pii:S2468823122007659/image/svg+xml/aee63ded2c55adf0b840bf244fa8e99a/si3.svg si3 si3.svg svg 2042 ALTIMG 1-s2.0-S2468823122007659-si30.svg https://s3-eu-west-1.amazonaws.com/prod-ucs-content-store-eu-west/content/pii:S2468823122007659/image/svg+xml/752da995edde169f7d4000ab44bb7cd8/si30.svg si30 si30.svg svg 5593 ALTIMG 1-s2.0-S2468823122007659-si31.svg https://s3-eu-west-1.amazonaws.com/prod-ucs-content-store-eu-west/content/pii:S2468823122007659/image/svg+xml/aa6efae8368325e1b814012e30e27e21/si31.svg si31 si31.svg svg 10183 ALTIMG 1-s2.0-S2468823122007659-si32.svg https://s3-eu-west-1.amazonaws.com/prod-ucs-content-store-eu-west/content/pii:S2468823122007659/image/svg+xml/3c611ace591364d30fc7fc8a46c9f274/si32.svg si32 si32.svg svg 2377 ALTIMG 1-s2.0-S2468823122007659-si33.svg https://s3-eu-west-1.amazonaws.com/prod-ucs-content-store-eu-west/content/pii:S2468823122007659/image/svg+xml/c665592e47e643726b5dbf05125a83c4/si33.svg si33 si33.svg svg 3678 ALTIMG 1-s2.0-S2468823122007659-si34.svg https://s3-eu-west-1.amazonaws.com/prod-ucs-content-store-eu-west/content/pii:S2468823122007659/image/svg+xml/3d5c42e2eee118ab92b74e3d147e0b07/si34.svg si34 si34.svg svg 2430 ALTIMG 1-s2.0-S2468823122007659-si35.svg https://s3-eu-west-1.amazonaws.com/prod-ucs-content-store-eu-west/content/pii:S2468823122007659/image/svg+xml/1bacf5b5ddaf2895387b713e9e816144/si35.svg si35 si35.svg svg 2130 ALTIMG 1-s2.0-S2468823122007659-si36.svg https://s3-eu-west-1.amazonaws.com/prod-ucs-content-store-eu-west/content/pii:S2468823122007659/image/svg+xml/68b15298d01c19f9657741706d27676d/si36.svg si36 si36.svg svg 3425 ALTIMG 1-s2.0-S2468823122007659-si37.svg https://s3-eu-west-1.amazonaws.com/prod-ucs-content-store-eu-west/content/pii:S2468823122007659/image/svg+xml/7434385ac88c515cd7156a4ef930b443/si37.svg si37 si37.svg svg 12013 ALTIMG 1-s2.0-S2468823122007659-si38.svg https://s3-eu-west-1.amazonaws.com/prod-ucs-content-store-eu-west/content/pii:S2468823122007659/image/svg+xml/8a2b6ef3531a380d813d1d30cd627a33/si38.svg si38 si38.svg svg 12752 ALTIMG 1-s2.0-S2468823122007659-si39.svg https://s3-eu-west-1.amazonaws.com/prod-ucs-content-store-eu-west/content/pii:S2468823122007659/image/svg+xml/f0954e3626ae994e66c7d0f9d1a1c226/si39.svg si39 si39.svg svg 9567 ALTIMG 1-s2.0-S2468823122007659-si4.svg https://s3-eu-west-1.amazonaws.com/prod-ucs-content-store-eu-west/content/pii:S2468823122007659/image/svg+xml/7e06333c4aea890bdb9c46e35d13a3d0/si4.svg si4 si4.svg svg 1737 ALTIMG 1-s2.0-S2468823122007659-si40.svg https://s3-eu-west-1.amazonaws.com/prod-ucs-content-store-eu-west/content/pii:S2468823122007659/image/svg+xml/3e11fc0c65d286ec7ba22407fed2fa2e/si40.svg si40 si40.svg svg 9946 ALTIMG 1-s2.0-S2468823122007659-si41.svg https://s3-eu-west-1.amazonaws.com/prod-ucs-content-store-eu-west/content/pii:S2468823122007659/image/svg+xml/164f8085dc2b60d1cbfa283787a42101/si41.svg si41 si41.svg svg 9658 ALTIMG 1-s2.0-S2468823122007659-si42.svg https://s3-eu-west-1.amazonaws.com/prod-ucs-content-store-eu-west/content/pii:S2468823122007659/image/svg+xml/63864878926eaae4e71e4304d15cab2c/si42.svg si42 si42.svg svg 8639 ALTIMG 1-s2.0-S2468823122007659-si5.svg https://s3-eu-west-1.amazonaws.com/prod-ucs-content-store-eu-west/content/pii:S2468823122007659/image/svg+xml/479702647a220577fafc8addb84f9f93/si5.svg si5 si5.svg svg 2043 ALTIMG 1-s2.0-S2468823122007659-si6.svg https://s3-eu-west-1.amazonaws.com/prod-ucs-content-store-eu-west/content/pii:S2468823122007659/image/svg+xml/a0f5a59c291585c2c5c2812287efede1/si6.svg si6 si6.svg svg 2547 ALTIMG 1-s2.0-S2468823122007659-si7.svg https://s3-eu-west-1.amazonaws.com/prod-ucs-content-store-eu-west/content/pii:S2468823122007659/image/svg+xml/20ebf6026bb298837a37001f37089553/si7.svg si7 si7.svg svg 2194 ALTIMG 1-s2.0-S2468823122007659-si8.svg https://s3-eu-west-1.amazonaws.com/prod-ucs-content-store-eu-west/content/pii:S2468823122007659/image/svg+xml/d21fa0317b5620da39ccc06dd63432f3/si8.svg si8 si8.svg svg 2546 ALTIMG 1-s2.0-S2468823122007659-si9.svg https://s3-eu-west-1.amazonaws.com/prod-ucs-content-store-eu-west/content/pii:S2468823122007659/image/svg+xml/8016c3afa166aa3ce3cfd500530ca8a3/si9.svg si9 si9.svg svg 2599 ALTIMG 1-s2.0-S2468823122007659-am.pdf https://s3-eu-west-1.amazonaws.com/prod-ucs-content-store-eu-west/content/egi:10NCCJ7RKC3/MAIN/application/pdf/b5e6cae2aa62ba836a357e9295f298f1/am.pdf am am.pdf pdf false 3694971 AAM-PDF MCAT 112879 112879 S2468-8231(22)00765-9 10.1016/j.mcat.2022.112879 Elsevier B.V. Fig. 1 Schematic diagram of La2O3-Gra. Fig 1 Fig. 2 Geometries of the O-Gra-1, La-Gra-2 and Face-Gra-1. Fig 2 Fig. 3 Oxygen adsorption on O-Gra-1, Face-Gra-1 and La-Gra-2. Fig 3 Fig. 4 Free energy diagrams at different sites on bare O-Gra-1. Fig 4 Fig. 5 Free energy diagrams at different sites on bare Face-Gra-1. Fig 5 Fig. 6 Free energy diagrams at different sites on OH modified O-Gra-1. Fig 6 Fig. 7 Free energy diagrams at different sites on OH modified Face-Gra-1. Fig 7 Fig. 8 The scaling relationship between the adsorption free energy of reaction intermediates. ((a) ΔG*OH vs. ΔG*OOH, (b) ΔG*OH vs. ΔG*O and (c)ΔG*OH vs. ΔG*2OH) and the volcano plots ((d) ηORR vs ΔG*OH, (e) ηOER vs ΔG*O-ΔG*OH for P1 and (f) ηOER vs ΔG*2OH-ΔG*OH for P2). Fig 8 Table 1 Atomic density of different crystal planes of lanthanum oxide. Table 1 Crystal plane Atom density/ atoms·Å−2 ( 0 0 0 1 ) 0.074 ( 1 1 ¯ 0 0 ) 0.041 ( 1 0 1 ¯ 0 ) 0.041 ( 1 1 2 ¯ 0 ) 0.119 ( 1 2 ¯ 1 0 ) 0.119 ( 2 1 ¯ 1 ¯ 0 ) 0.119 The graphene-supported Lanthanum oxide cluster as efficient bifunctional electrocatalyst for oxygen reaction Daomiao Wang Investigation Formal analysis Writing – original draft a Luya Jin Investigation Formal analysis a Meiling Liu Methodology Conceptualization a Tae Gwan Lee Resources Conceptualization b Shaik Gouse Peera Validation Funding acquisition Writing – review & editing b Chao Liu Investigation Formal analysis Writing – review & editing Funding acquisition a ⁎ a Faculty of Materials Metallurgy and Chemistry, Jiangxi University of Science and Technology, Ganzhou 341000, China Faculty of Materials Metallurgy and Chemistry Jiangxi University of Science and Technology Ganzhou 341000 China aFaculty of Materials Metallurgy and Chemistry, Jiangxi University of Science and Technology, Ganzhou 341000, China b Department of Environmental Science and Engineering, Keimyung University, Daegu 42601, Republic of Korea Department of Environmental Science and Engineering Keimyung University Daegu 42601 Republic of Korea bDepartment of Environmental Science and Engineering, Keimyung University, Daegu 42601, Republic of Korea ⁎ Corresponding author. The development of bifunctional oxygen electrode electrocatalysis for both the oxygen reduction reaction (ORR) and the oxygen evolution reaction (OER) plays a vital role in the solution of the energy crisis as well as the environmental pollution. The purpose of this paper is to investigate the potential of graphene-supported lanthanum oxide clusters (La2O3-Gra) as a bifunctional electrocatalyst; the results show that the optimal catalytic site (up-down1) of the most stable configuration (O-Gra-1) modified by OH group shows outstanding bifunctional catalytic activity with ηORR of 0.51 V and ηOER of 0.52 V, which can be compared to the commercial Pt-based ORR catalysts and the Ru/Ir-oxides OER catalysts. Furthermore, there is a strong scale-dependent relationship between the adsorption free energy (ΔGads) of reaction intermediates, resulting in volcano plots between the catalytic activity and ΔGads, which provides a valuable description for future performance prediction of structurally similar catalysts. Graphical abstract Image, graphical abstract Keywords Oxygen reduction reaction Oxygen evolution reaction Lanthanum oxide cluster Density functional theory Data availability Data will be made available on request. 1 Introduction Traditional fossil energy use is closely linked to the rapid development of modern societies. Yet the subsequent depletion of energy and pollution of the environment will in turn restrict the further development of society [1,2]. Humanity urgently needs environmentally friendly and renewable alternative energy to replace conventional fossil fuels. Technologies for storing and converting electrochemical energy, such as renewable fuel cells [3] and rechargeable metal-air batteries [4], have the advantages of safety, greenness, pollution-free and high-power density, which play a critical role in addressing the above issues. Unfortunately, the slow kinetics of the oxygen reduction reaction (ORR) and the oxygen evolution reaction (OER) in the oxygen electrodes severely hamper the overall reaction efficiency of the batteries, leading to the demand for electrocatalysis. Traditionally, platinum-based catalysts have been considered to be effective catalysts for ORR; [5–7] the oxides of ruthenium (Ru) and iridium (Ir) are known as outstanding OER catalysts [8–10]. However, the scarcity, high-cost, low stability, easy CO poisoning and single catalytic function hinder the further commercial application of the technology. Therefore, it is meaningful to develop green, efficient, safe, durable, low-pollution and low-cost bifunctional electrocatalysis for ORR and OER. In recent years, research on single-atom catalysts (SACs) is widespread due to the high atomic utilization [11] and high catalytic activity for either ORR or OER [12–21]. However, there are shortcomings in SACs as well [22]. As the metal particles are reduced to the monatomic level, the specific surface area increases sharply, leading to a large increase in the free energy of the metal surface, which means that it is very easy to agglomerate and to inactivate in the process of preparation and reaction. As a result, SACs face significant challenges to load capacity and stability. Metal nanoclusters, as a new type of nanomaterials with precise chemical composition and atomic structure, have attracted a great deal of attention due to their high surface volume ratio, tunable size and unsaturated coordination properties [23–25]. Compared to larger-sized nanoparticles, nanoclusters have a smaller size to expose more active sites. The stability of the nanocage clusters is also high, which is conducive to preventing the sintering and agglomeration of the catalyst in long-term work [26]. Graphene, as a two-dimensional material of sp2-hybridized carbon, has the advantages of high surface-area-to-volume ratio, high electrical conductivity, high ductility, high flexibility and good stability, and shows high selectivity, sustainability and high efficiency in electrocatalysis, is the ideal platform for supporting functional nanomaterials such as clusters [27–30]. For instance, Jalili et al. studied an Ag8 cluster deposited on nitrogen-doped graphene with theoretical calculation. It is found that supported Ag8 clusters exhibit excellent ORR activity because of higher charge transfer to O2 and significant decrease in O2 adsorption energy compared to unsupported clusters [31]. With a multi electronic structure, excellent magnetic, optical and electrical properties, rare earth elements (REEs) are widely used in many essential areas including catalysis, metallurgy, permanent magnets, lasers, and so forth [32–35]. Compared to precious metals REEs are not uncommon. World-proven reserves of rare earths (oxides) amount to 121 million metric tons [36], and even the lowest lutetium is almost 200 times greater than gold. Moreover, Turkey discovered 694 million tons of rare earth element reserves (minerals) not long ago. There are 17 different rare earth elements in the resource, which is the second largest reserve in the world, only surpassed by China's 800 million tons of reserves (minerals). REEs are known to be readily oxidized in nature. It is interesting to note that scientists found that oxidized REEs such as La2O3 [37,38], Eu2O3 [39,40], CeO2 [41,42] and so forth [43–47], have superior stability and excellent ORR or OER performance. Both of which could explain the excellent properties of these rare earth oxides. First, as a relatively independent block in the periodic table, the lanthanides have special 4f electronic structures, which contribute to the migration of 4f electrons between the f-f and f-d configurations, formation of unique bonding characteristics, reduction of activation energy, and ultimately promotion of the catalytic process [48–50]. Second, the formation of REE-O effectively regulates the electronic properties of the active centers and counteracts excessive adsorption of rare earth to reaction intermediates, which may be the primary reason for the excellent activity of the rare earth oxides. Zhao et al. [51] reported the superior activity of lanthanum oxide nanocrystals loaded N-doped porous carbon (La2O3/NPC) for ORR in alkalinity. La2O3/NPC was successfully prepared through the chemical deposition of CO(NH2)2 and LaCl3 and followed calcination. The hexagonal structure of La2O3 was confirmed by X-ray diffraction analyses. The Synthetic La2O3/NPC exhibits remarkable ORR activity, and the half-wave potential is 0.90 V, which is higher than that of the commercial Pt/C (0.83 V). What's else? Dai et al. [41] have constructed a CeO2 substrate supported CoS1.97 (CeO2-CoS1.97) and CoS1.97 with CeO2 surface decorated (CoS1.97-CeO2), respectively. Of these, CeO2-CoS1.97 exhibits a low overpotential of 264 mV at 10 mA·cm−2 due to the stable heterostructure and more rapid mass transfer. And CoS1.97-CeO2 has a smaller Tafel slope of 49 mV·dec−1 due to enhanced adsorption of OH group, rapid electron transfer, and in situ formation of Co(IV)O2 species under OER process. An efficient approach was taken in this paper to improve the utilization and loading capacity of rare earth elements and to increase the proportion of active sites by reducing rare earth oxides to cluster molecules and loading them onto conductive carbon-based materials. Based on density functional theory (DFT) calculation, the graphene-supported La2O3 cluster (La2O3-Gra) was designed as a bifunctional electrocatalyst for ORR and OER, with graphene as the substrate and the nanocage cluster cleaved from the hexagonal La2O3 crystal as the dopant. Firstly, the stability of various configurations of La2O3-Gra was discussed, and a few typical configurations were selected for follow up study. Secondly, the effects of different adsorption sites and hydroxylation on catalytic activity of La2O3-Gra were studied. Finally, we performed an inductive analysis of the adsorption free energy of each reaction intermediate and found the descriptors that rapidly predict the catalytic activity of La2O3-Gra, providing a fresh perspective for the development of electrocatalysis. 2 Computational details 2.1 Model construction Bravis’ law states that the actual crystal faces are parallel to the surface of the crystal with the highest atom density [52]. Therefore, the atom density of cubic lanthanum oxide crystal face was calculated; the results are given in Table 1 . It can be seen that the atom density on the surface of ( 1 1 2 ¯ 0 ) , ( 1 2 ¯ 1 0 ) and ( 2 1 ¯ 1 ¯ 0 ) is the highest in parallel, indicating which is the actual face of the crystal. Therefore, as shown in Fig. 1 , based on the actual external surface, the smallest cage-like cluster was cleaved from the cubic lanthanum oxide crystal, which has been shown to be highly symmetric and stable in previous studies [53]. The reduction of lanthanum oxide to atomic size results in an unsaturated coordination property, which tunes the electronic structure, thereby affecting catalytic performance. In addition, the supercell containing one (5 × 5 × 1) graphene sheet was used as a support for the La2O3 cluster. To avoid spurious interaction between neighboring layers, the thickness of the vacuum layer was set to 30 Å. 2.2 Calculation parameters All DFT calculations of La2O3-Gra system were performed by the DMol3 module on Material Studio software [54]. The generalized gradient approximation (GGA) [55] with the Perdew-Burke-Ernzerhof (PBE) model [56] was opted to optimize the models of La2O3-Gra and related adsorption configurations. We used the DFT-D with Grimme parameters to modify the van der Waals interactions [57]. The conductor-like screening model (COSMO) [58] was adopted to simulate an H2O solvent environment for all calculations with a dielectric constant of 78.54. Since La is a heavy element with many (57) electrons, the density-functional semi-core pseudo-potential (DSPP) approximation was used [59]. The convergence criteria of the structure were set as follows: energy tolerance of 1.0 × 10−5 Ha, maximum displacement tolerance of 0.05 Å, and maximum force of 0.02 Ha·Å−1. The Monkhorst-Pack K-point grid was chosen as 5 × 5 × 1 to ensure the accuracy of calculation results. 2.3 Computational content In this paper, the stable load configurations were selected by the binding energy (ΔEb) [17] between La2O3 cluster and graphene. The formula is as follows: (1) Δ E b = E G r a + E L a 2 O 3 − E L a 2 O 3 − G r a Where E L a 2 O 3 − G r a represents the total energy of La2O3-Gra, E G r a and E L a 2 O 3 represent the total energy of the graphene and La2O3. The adsorption energies (ΔE*ads) of adsorbates such as O2, OOH, O, OH and 2OH were calculated by Ref. [5]: (2) Δ E * a d s = E * a d s − E * − E a d s Where E * a d s represents the total energy of the system in which the catalyst adsorbs the intermediate such as O2, OOH, O, OH and 2OH, respectively. E* and Eads are the energy of clean catalyst and intermediate, respectively. The adsorption free energies (ΔG*ads) of oxygenated intermediate, including OOH, O, OH and 2OH, were calculated by Ref. [60]: (3) Δ G * O O H = G * O O H − G * − ( 2 G H 2 O − 3 2 G H 2 ) (4) Δ G * O = G * O − G * − ( G H 2 O − G H 2 ) (5) Δ G * O H = G * O H − G * − ( G H 2 O − 1 2 G H 2 ) (6) Δ G * 2 O H = G * 2 O H − G * − ( 2 G H 2 O − G H 2 ) Where G * , G * O O H , G * O , G * O H and G * 2 O H are the free energy of catalyst and adsorbed intermediates, including OOH, O, OH and 2OH, respectively. In alkaline environment, the 4e− ORR could be divided into two paths as follows: P1: (7) O 2 + * + H 2 O + e − → * O O H + O H − (8) * O O H + e − → * O + O H − (9) * O + H 2 O + e − → * O H + O H − (10) * O H + e − → * + O H − P2: (11) O 2 + * + H 2 O + e − → * O O H + O H − (12) * O O H + H 2 O + e − → * 2 O H + O H − (13) * 2 O H + e − → * O H + O H − (14) * O H + e − → * + O H − The reaction energy ΔGi for step i was calculated by Ref. [17]: (15) Δ G i = Δ E i + Δ Z P E i − T Δ S i + Δ G U + Δ G p H Where Δ E i represents the reaction heats, Δ Z P E i and Δ S i represent the changes of zero-point energy and entropy for certain steps, respectively. Δ G U and Δ G p H are the effects of potential and pH on Gibbs free energy, respectively. ΔGU = −eU, where U is the electrode potential. ΔGpH = pH × kb × T × ln10, where kb is the Boltzmann constant, T is the temperature, and pH is 14 in this paper. The 4e− OER is the reverse reaction of the ORR. The overpotentials η of ORR and OER were calculated by Ref. [61]: (16) η O R R = M a x ( Δ G i ) / e + 0.402 (17) η O E R = M a x ( Δ G i ) / e − 0.402 3 Results and discussions 3.1 Stability analysis of La2O3-Gra electrocatalyst High stability helps to prevent degradation of catalytic activity or even complete inactivation caused by the accumulation of La2O3 cluster aggregates during the long-term work. Thus, there is a need to investigate the stability of graphene-supported La2O3 clusters. Based on different loading forms, the configurations were divided into three types: point load (O-Gra and La-Gra), line load (Line-Gra) and face load (Face-Gra). In the case of O-Gra, all the different configurations were considered, and only three were found, namely O-Gra-1∼3. In the case of La-Gra, only three configurations were found: La-Gra-1∼3. In the Face-Gra condition, only two (Face-Gra-1∼2) were observed. In the case of Line-Gra, because the graphene substrate has a stronger adsorption strength for O than La, all of the Line-Gra geometries considered were converted to O-Gra, and no stable structures were found. Table S1† lists all configurations found and the corresponding ΔEb. In the case of O-Gra, the ΔEb is 5.04, 4.76 and 4.76 eV for O-Gra-1∼3, which indicates that O-Gra-1 is the most stable O-Gra structure. The Corresponding ΔEb values of La-Gra-1∼3 is 3.82 eV, 3.85 eV and 3.70 eV, respectively, suggesting that La-Gra-2 is the most stable of the three. The ΔEb of Face-Gra-1∼2 is 4.65 eV and 4.43 eV, respectively, meaning that Face-Gra-1 is the most robust. Overall, O-Gra is the most stable, followed by Face-Gra, whereas La-Gra is the low stable. The presence of the O-C bond is more conducive to improving the stability of La2O3-Gra, meaning that the La-Gra configuration may change in the long-term work. The respective optimal O-Gra, La-Gra and Face-Gra structures are visualized in Fig. 2 , which are selected for follow-on research. From the binding energy, O-Gra-1 has the highest stability, Face-Gra-1 is the second and La-Gra-2 has relatively low stability. This implies that O-Gra-1 is the most likely configuration to be obtained in the experimental synthesis, while La-Gra-2 is less likely to be obtained. Therefore, the activity of O-Gra-1 essentially determines the performance of the entire system. We performed a simple O2 adsorption test, and found that the configuration of La-Gra-2 changed after the adsorption of oxygen, so La-Gra-2 was excluded. (See next section for details). In addition, in order to prevent La2O3 clusters from migrating in long-term work, which may lead to the reduction of catalyst stability, it is necessary to calculate the energy barrier for cluster migration on the graphene surface. As can be seen from Fig. S1†, for the most thermodynamically stable O-Gra-1, the La2O3 cluster has to cross through the energy barrier of 0.46 eV to proceed to the adjacent loading position; and that of the metastable Face-gra-1 only needs to overcome the energy barrier of 0.20 eV, indicating that the O-Gra-1 is the most difficult to migrate in long-term work, followed by Face-Gra-1. we have considered the band structures of O-Gra-1 and Face-Gra-1. As shown in the Fig. S2†, the band gap of O-Gra-1 and Face-Gra-1 is 1.967 and 2.001 eV, respectively, indicating that they are semiconductors. Next, we carried out Mulliken charge analysis. As shown in Fig. S3†, the graphene of O-Gra-1 receives 1.506 electrons from the La2O3 cluster, and that of Face-Gra-1 receives 1.595 electrons from the La2O3 cluster, indicating that there is a strong electron transfer between the graphene and the La2O3 cluster. Due to the strong electronegativity difference between La and O atoms, the La atoms can provide electrons for oxygen containing species and thus become the active center of the catalyst. Furthermore, it can be found that the closer to the graphene substrate, the more positive charges La atoms carry, which will also become one of the main factors for their differences in the adsorption strength of reaction intermediates. 3.2 Mechanisms of ORR and OER on bare La2O3-Gra electrocatalyst In this section, we discussed the reaction pathways and mechanisms of ORR and OER at the different active sites on the bare O-Gra-1, La-Gra-2, and Face-Gra-1. It can be shown in Fig. 2 that there are six active sites on the La2O3 cluster, and the sites in the same layer are equivalent, so that they could be divided into different types; that is, O-Gra-1 can be divided into the up and down sites, Face-Gra-1 can be divided into the up, middle and down sites, while La-Gra-2 only be divided into the up and middle without down because of which undertakes the task of connecting the graphene substrate. Based on Sabatier's principle, a good catalyst cannot adsorb to reaction intermediates either too strongly or too weakly [62]. Since the adsorption of O2 is the key to the onset of ORR, and since its desorption is also an indispensable part of OER circulation, we first calculated the oxygen adsorption at the active sites. As shown in Fig. 3 , O2 can be adsorbed onto a single active site with both the side-on and end-on form, or dual sites at the same time with the bridge-on form. For O-Gra-1 and Face-Gra-1, the adsorption mode of end-on is permanently changed to side-on after optimization due to the strong adsorption of O2 on the catalyst, and the adsorption intensity of bridge-on is always less than the corresponding side-on mode because space constraints, all of which indicate that the main mode of O2 on catalysts is side-on. However, in the case of La-Gra-2, it can be seen that after the optimization of the O2 adsorption configuration, the loading form of La2O3 has changed severely, indicating that the La-Gra-2 is unstable with respect to the others. Its instability is also reflected in the binding energy Fig. 2. Thus, the La-Gra-2 configuration was excluded. The adsorption models for various reaction intermediates on O-Gra-1 and Face-Gra-1 were optimized on the basis of the adsorption of O2 with the side-on mode. For each adsorbate, the adsorption energy (ΔE*ads) and the adsorption free energy (ΔG*ads) were calculated, their effects on the catalytic performance were discussed, and the free energy plots of the reaction were thus obtained. The results are as follows: 3.2.1 Bare O-Gra-1 Fig. S4† shows the electrocatalysis process of bare O-Gra-1, from left to right is the ORR process, and the reverse is the OER process. Table S2† lists the optimal configurations as well as the corresponding ΔE*ads and ΔG*ads of the reaction intermediates. In the case of the up sites, the ΔE*ads of O2, OOH, O, OH, 2OH are −1.66 eV, −2.36 eV, −4.03 eV, −3.54 eV and −5.55 eV, respectively; and the ΔG*ads of OOH, O, OH, 2OH are 3.11 eV, 2.01 eV, −0.16 eV and 1.31 eV, respectively. For the down sites, the corresponding ΔE*ads are −1.56 eV, −2.24 eV, −4.80 eV, −3.44 eV and −5.47 eV, respectively; and the corresponding values of ΔG*ads are 3.26 eV, 1.32 eV, −0.18 eV and 1.26 eV. It can be seen from ΔE*ads that O2 and OH are more likely to be adsorbed at the up sites. However, the up sites are far away from the graphene substrate, which is difficult to transfer electrons, so the possibility of electrocatalysis is small. It is noteworthy that due to the open space and relative position of the active sites on the La2O3 cluster, it is difficult for the adsorbate to cross the high-energy barrier from one site to the next. Thus, even though the binding strength of adsorbate adsorbed at one site is slightly less than that at the other, it is still stable, and the possibility of its reaction is still large, which could not simply be overlooked. The reaction energies for each step of the electron under zero potential in alkaline were calculated from the adsorption free energy of the reaction intermediates. The reaction step diagrams were determined as shown in Fig. 4 . For the up sites, the ORR potential determination step (PDS) of both P1 and P2 is the last step of *OH → *+OH− with ηORR of 1.39 V. In terms of the reverse reaction of the ORR, the PDS of P1 for OER is *OH → *O which has to conquer the energy of 1.34 eV, whereas the PDS of P2 is *OOH → O2 which only has to overcome the energy of 0.99 eV with ηOER of 0.58 V. As with the up sites, the PDS of P1 and P2 at the down sites is also the last step of *OH → OH with ηORR of 1.41 V. While the P1 for OER is smoother, which the PDS is *O → *OOH with ηOER of 0.70 V; the reason for this is that the *O on the down sites has a synergistic effect with the substrate, thus strengthening its adsorption strength and smoothing the energy change from *OH to *OOH. However, in general, the electrocatalytic activity of both the up and down sites is not good, which may be related to the difficulty of OH desorption. 3.2.2 Bare Face-Gra-1 Fig. S5† shows the electrocatalysis process of bare Face-Gra-1. Table S3† exhibits the geometric configurations as well as the corresponding ΔE*ads and ΔG*ads of reaction intermediates for different active sites on bare Face-Gra-1. The ΔE*ads of O2, OOH, O, OH and 2OH at the up sites are −1.91 eV, −2.57 eV, −4.33 eV, −3.74 eV and −5.86 eV, respectively; and corresponding ΔG*ads of OOH, O, OH and 2OH are 2.90 eV, 1.76 eV, −0.46 eV and 0.88 eV, respectively. For the middle sites, the corresponding ΔE*ads are −1.88 eV, −2.53 eV, −4.31 eV, −3.78 eV and −5.94 eV, the corresponding ΔG*ads are 2.82 eV, 1.73 eV, −0.46 eV and 0.62 eV. And for the down sites, the corresponding ΔE*ads are −1.62 eV, −2.32 eV, −4.86 eV, −3.52 eV and −5.52 eV, the corresponding ΔG*ads are 3.11 eV, 1.29 eV, −0.33 eV and 1.13 eV. In general, the binding strength of the reaction intermediates on Face-Gra-1 is higher than that of O-Gra-1, meaning more difficult products desorption. For the Face-Gra-1 itself, the adsorption strength of O2 at the up and middle sites is similar, but obviously stronger than that at the down sites, implying that the adsorbates are more likely to be adsorbed at the up and middle sites. But similar to O-Gra-1, the up and middle sites are far away from the graphene substrate, so it is difficult to transfer electrons to continue the electrocatalytic reaction. As shown in Fig. 5 , regardless of whether P1 or P2, the PDS at the up, middle and down sites is the last step: *OH → OH- with ηORR of 1.69 V, 1.69 V and 1.56 V, respectively. As for OER, the favorable route at the up sites is P2 which the PDS is*2OH → *OOH with ηOER of 0.79 V; the difficulty degree of P1 and P2 at the middle sites is similar with ηOER of 0.96 V and 0.97 V, respectively, while the more accessible passageway at the down sites is P1 with ηOER of 0.60 V because of the presence of synergistic O. But in general, the bifunctional electrocatalysis performance of bare Face-Gra-1 is poor. 3.3 Mechanisms of ORR and OER on OH modified O-Gra-1 and Face-Gra-1 Recently, the theory of OH ligands modifying catalysts has received extensive attention. Theoretical calculations show that OH ligand can effectively improve the catalytic activity, and the introduction of OH ligand also makes the theoretical calculation results agree well with the experiment [61,63–72]. At the same time, the existence of OH ligand is also proved experimentally, which provides a strong factual basis for the OH ligand theory. For example, Cao et al. reported the atomic-level identification of the dynamic structure of catalytically active sites under alkaline. The O–H stretching peak becomes much stronger for Co1/PCN under the open-circuit condition by FTIR analysis, indicating considerable adsorption of OH species on the Co site. Further, the XANES analysis excludes H2O adsorption, suggesting that the Co site should chemically adsorb OH radicals under the open-circuit condition [73]. Also, Yang et al. verified the existence of OH ligand on Fe-N4 sites with the evaluation of pH-dependent ORR activity as well as pH-dependent poisoning kinetics [74]. Based on the research in the previous section, the active sites on the bare La2O3-Gra have a strong OH adsorption, which is likely to result in the hydroxylation of the catalyst. Furthermore, the La2O3 cluster has the feature of multiple adsorption sites; After hydroxylation at one of the sites, the other can continue to take part in the reaction. Therefore, the effect of the hydroxylation on La2O3-Gra was discussed. 3.3.1 OH modified O-Gra-1 The adsorption energy of OH at the up sites of bare O-Gra-1 is less than that at the down sites, which means the stronger adsorption. In addition, the up sites are far away from the graphene substrate, which are not conducive to electron transfer. Therefore, the optimal site for OH coordination of O-Gra-1 is the up sites. As shown in Table S4†, taking the up sites as an example, when it is modified by an OH ligand, the adsorption of the next adsorbent at other sites is far greater than the coordination site, which means that the possibility of electrocatalysis at the OH coordination site is small, so the OH coordination site is not considered as a reaction site. Fig. S6† shows the electrocatalysis process of OH modified O-Gra-1. Once one of the up sites (O-Gra-1-up) has been modified by OH group, the remaining active sites can be classified into three types: up-up, up-down1 and up-down2. The ΔE*ads and ΔG*ads as well as relevant oxygenated intermediates are given in Table S5†. For the up-up sites, the ΔE*ads of O2, OOH, O, OH, 2OH are −0.58 eV, −1.42 eV, −2.63 eV, −2.58 eV and −3.88 eV, respectively, and the ΔG*ads of OOH, O, OH, 2OH are 3.92 eV, 3.45 eV, 0.79 eV and 2.64 eV. For the up-down1 sites, the corresponding ΔE*ads are −0.65 eV, −1.43 eV, −3.70 eV, −2.58 eV and −3.93 eV, respectively, and corresponding ΔG*ads are 3.97 eV, 2.22 eV, 0.72 eV and 2.62 eV. And for the up-down2 sites, the corresponding ΔE*ads are −0.66 eV, −1.44 eV, −3.69 eV, −2.57 eV and −3.96 eV, respectively, and the corresponding ΔG*ads are 3.96 eV, 2.14 eV, 0.75 eV and 2.71 eV. In comparison to bare O-Gra-1, the adsorption strength of each of the adsorption intermediates can be found to be significantly reduced to a more suitable level. For ORR, appropriate O2 adsorption ensures the effective O2 activation, reduction of OH adsorption allows it to be rapidly desorbed and ultimately promotes the catalytic progress. For OER, appropriately decreased OH adsorption will not affect its activation; weakened O2 adsorption contributes to its removal, and OH adsorption is still stronger than O2 adsorption due to synchronous adsorption decay, so it speeds up the catalytic reaction even more. Return to O-Gra-1-up, after hydroxylation, the O2 adsorption at the up-down1 and up-down2 sites is more solid than that of up-up, and the down sites are easy to transfer electrons, indicating that ORR is more likely to occur here. As shown in Fig. 6, the PDS at the up-down1 and up-down2 sites, whatever P1 or P2 is both the last step: *OH → OH− with ηORR of 0.51 V and 0.48 V. The better passageway at the up-up sites is P2 with the ηORR of 0.44 V, while the PDS of P1 is *OOH → *O with ηORR of 0.75 V due to the absence of synergistic *O. For OER, although the adsorption strength of OH is similar, the closer the reaction site is to the substrate, the easier it is to accept electrons, which means the faster the catalytic rate. The best processes at the up-down1 and up-down2 sites are P1 with ηOER of 0.52 V and 0.59 V, and that at the up-up sites is P2 with ηOER of 0.63 V. Although the OH group is more likely to become a ligand at the up sites, it cannot be ignored as a ligand at the down sites. As with the up sites, when hydroxylation occurs at the down sites, the rest of the active sites could also be divided into three types: down-up1, down-up2 and down-down. Because OH group on the down sites is more readily available to accept the electron for reaction in the former as it is closer to the graphene substrate, both two down-up types (down-up1 and down-up2) will be converted to up-down types (up-down1 and up-down2) upon reaction equilibration. So only the down-down sites have to be discussed. The corresponding ΔE*ads at the down-down sites are −0.82 eV, −1.51 eV, −3.65 eV, −2.54 eV and −3.50 eV, and corresponding ΔG*ads are 3.90 eV, 2.34 eV, 0.77 eV and 3.16 eV, respectively. It can be seen that similar to the hydroxylation at the up sites, the adsorption capacity of catalyst for all adsorbates decreased. Furthermore, because the down sites are in close proximity to the substrate, the synergistic effect strengthens the adsorption of O atom, so that the major pathways for ORR and OER are P1 with ηORR of 0.46 V and ηOER of 0.34 V. Overall, because of the stronger adsorption and more difficult electron transfer, the up sites are the optimal site for OH coordination for O-Gra-1. The down sites are an excellent place for electrocatalysis because of easier electron exchange. When one of the up sites was modified by OH group, the up-down1 site shows outstanding bifunctional catalytic activity with η of 0.51 V and 0.52 V for ORR and OER respectively. Also, even other reaction sites still show good catalytic performance. We also discussed the stability of OH ligands. As shown in Fig. S7†, in an alkaline environment with a pH of 14, a large amount of energy is released when a up site generates the first OH ligand, indicating that the reaction is easy to occur. However, it needs to absorb a large amount of energy to continue to generate the second OH group at the same site, which means that only one OH ligand can stably exist at a site. When there is an OH ligand at a up site, others, such as the up-down1 site, continue to generate an OH, which releases a small amount of energy. This indicates that the second OH may exist as a reaction intermediate, but it is unlikely to exist stably as a ligand of the catalyst. Furthermore, under the assumption that both OH ligands can exist stably, other sites, such as up-down1-down2, needs to absorb a large amount of energy to continue to generate the third OH, indicating low reactivity. In addition, we have made Pourbaix diagrams about the electrocatalysis at down sites after the OH coordination at up sites. As can be seen in Fig. S8†, the OH ligand at up sites is stable throughout the whole electrocatalysis process, regardless of up-down1 or up-down2 sites and the reaction path. When the pH is 14, the OH ligand will fall off only when USHE is less than −0.99 V. Therefore, only one OH ligand can stably coordinate with the single site of O-Gra-1, and only one OH ligand can stably exist in O-Gra-1. 3.3.2 OH modified Face-Gra-1 In comparison to O-Gra-1, the OH specie on Face-Gra-1 has three passivation positions: up, middle and down. The OH adsorption of the up and middle sites are significantly greater than that of the down sites, which means that the probability of OH coordination at the down sites is small. The OH adsorption of the up and middle sites is similar, but the up sites are more far away from the graphene substrate, which is more difficult to accept electrons. Therefore, the optimal site for OH coordination is the up sites. Similar to O-Gra-1, as shown in Table S6†, taking the up sites as an example, it can be found that the possibility of electrocatalysis at the OH coordination site is small, so the OH coordination site is not considered as a reaction site . Fig. S9† shows the electrocatalysis process of OH modified Face-Gra-1. Table S7† lists the adsorption configurations of oxygenated intermediates at different active sites of Face-Gra-1 modified by OH ligand. When the OH is modified at the up sites (Face-Gra-1-up), there are four possible reaction sites: up-up, up-middle, up-down1 and up-down2. For the up-up sites, the ΔE*ads of O2, OOH, O, OH and 2OH are −0.71 eV, −1.55 eV, −2.77 eV, −2.70 eV and −4.02 eV, and the ΔG*ads of OOH, O, OH and 2OH are 3.90 eV, 3.15 eV, 0.56 eV and 2.46 eV, respectively. For the up-middle sites, the corresponding ΔE*ads are −0.74 eV, −1.62 eV, −2.78 eV, −2.77 eV and −4.10 eV, and corresponding ΔG*ads are 3.78 eV, 3.19 eV, 0.64 eV and 2.46 eV, respectively. For the up-down1 sites, the corresponding ΔE*ads are −0.91 eV, −1.69 eV, −3.69 eV, −2.58 eV and −1.02 eV, and corresponding ΔG*ads are 3.66 eV, 2.41 eV, 0.57 eV and 3.28 eV, respectively. And for the up-down2 sites, the corresponding ΔE*ads are −0.92 eV, −1.68 eV, −3.69 eV, −2.60 eV and −0.99 eV, respectively, and corresponding ΔG*ads are 3.73 eV, 2.37 eV, 0.75 eV and 3.18 eV, respectively. From the adsorption strength of each reaction intermediate on the catalyst, the up-down1 and up-down2 sites have stronger O2 adsorption than that of up-up and up-middle sites, indicating a higher possibility for ORR. Also, the adsorption ability of O atom at the up-down1 and up-down2 sites is stronger than that at the up-middle and up-up sites, which is due to the synergistic effect of atom O at the two up-down sites. While the adsorption intensity of 2OH at the up-down1 and up-down2 sites is weaker than that at the up-up and up-middle sites, this is because of the weakening of the adsorption capacity of the catalyst following hydroxylation as well as the steric hindering effect of the down sites. As shown in Fig. 7, in the above two cases, the best ORR route at the up-down1and up-down2 sites is P1 with ηORR of 0.66 V and 0.48 V, and the best OER path is P1 with ηOER of 0.61 V and 0.39 V, respectively. While the most favorable way at the up-up and up-middle sites is P2 with η of 0.67 V and 0.59 V for ORR, and 0.67 V and 0.59 V for OER. Once the OH is modified at the middle sites, there are three possible reaction types: middle-up, middle-middle and middle-down sites. Although the OH adsorption strength at the up and middle sites is similar, the middle sites are closer to the substrate and easier to transfer electrons for reaction. The OH group has a tendency to passivate at up sites. As a result, the middle-up sites were excluded. For middle-middle site, the ΔE*ads of O2, OOH, O, OH and 2OH are −0.73 eV, −1.60 eV, −2.98 eV, −2.90 eV and −4.15 eV, and the ΔG*ads of OOH, O, OH and 2OH are 3.87 eV, 2.92 eV 0.43 eV and 2.40 eV, respectively. For the middle-down sites, the corresponding ΔE*ads are −0.91 eV, −1.66 eV, −3.70 eV, −2.58 eV and −0.94 eV, and the corresponding ΔG*ads are 3.64 eV, 2.38 eV, 0.59 eV and 3.14 eV. For the middle-middle site, the best path is P2 with ηORR of 0.80 V and ηOER of 0.75 V. And the most facile pathway at the middle-down sites is P1 with ηORR of 0.64 V and ηOER of 0.56 V. With regard to the down sites with the least opportunity for OH modification, there are also four possible reaction types: down-up1, down-up2, down-middle and down-down sites. Similarly, the down-up1, down-up2 and down-middle sites were excluded due to the stronger adsorption strength of OH at the up or middle sites and the relative position with the substrate. For the remaining down-down site, the ΔE*ads of O2, OOH, O, OH and 2OH are −0.89 eV, −1.63 eV, −3.70 eV, −2.53 eV and −1.15 eV, and the ΔG*ads of OOH, O, OH and 2OH are 4.02 eV, 2.55 eV, 0.95 eV and 3.23 eV, respectively. The major reaction pathway is P1 with ηORR of 0.33 V and ηOER of 0.37 V. Similar to O-Gra-1, the up sites are the optimal site for OH coordination and the down sites are excellent place for electrocatalysis for Face-Gra-1. When one of the up sites was modified by OH group, the best reaction site (up-down2) shows excellent catalytic performance with ηORR of 0.48 V and ηOER of 0.39 V. And other reaction sites also show good catalytic performance. Also, as shown in Figs. S10† and S11†, the reaction energies for the formation of OH ligands and the Pourbaix diagram analysis show that only one OH ligand can stably coordinate with the single site of Face-Gra-1, and only one OH ligand can stably exist in Face-Gra-1. 3.4 The descriptors for evaluating catalyst performance for ORR and OER Based on the research of Nørskov et al., the inherent catalytic activity will be determined by the adsorption strength between the intermediate and the catalyst. For this reason, the ΔG*ads of reaction intermediates (*OOH, *O, *OH and *2OH) were used as the descriptors to evaluate the performance of catalysts for ORR and OER. As can be shown in Fig. 8 (a–c), strong linear relationships are observed between the ΔG*ads of OOH, O, 2OH and OH on both the bare and hydroxylated catalysts. The ΔG*OOH could be expressed as a function of ΔG*OH by Δ G * OOH = 0.81 Δ G * OH + 3.30 eV with a coefficient of determination (R2) of 0.93. The ΔG*O needs to be divided into two types: Ordinary *O (ΔG*O') and synergistic *O (ΔG*O''), the ΔG*O' could be expressed as a function of Δ G * O ′ = 1.39 Δ G * O H + 2.34 e V with the R2 of 0.99, and the ΔG*O'' could be expressed as a function of Δ G * O ″ = 1.05 Δ G * O H + 1.56 e V with the R2 of 0.99. As for *2OH, most of the G*2OH could be expressed as the function of Δ G * 2 OH = 1.55 Δ G * OH + 1.54 eV with the R2 of 0.98, Some *2OH at about 3.2 eV belongs to *HOOH species, and their adsorption free energy is irregular with ΔG*OH due to space constraints and some other reasons. In addition, we also performed the partial density of states (PDOS) analysis. We calculated the f-band center (εf) of La atoms in different environments. It can be found from Fig. S12† that there is a strong scale relationship between εf and the adsorption free energy of intermediates. The closer the εf is to the Fermi energy level, the weaker the adsorption of La atom on intermediates. Different load modes, different active sites and the presence or absence of OH ligand will lead to different electronic structures of the active centers, thus showing different adsorption capacities. Based on the solid scaling relationship between ΔG*ads of OOH, O, 2OH and OH above, the volcano plots for ORR and OER could be constructed. In the system, the PDS of the optimal path in P1 and P2 is always *+O2 → *OOH or *OH → *+OH−, so the volcano plot of ηORR vs. ΔG*OH can be obtained, as shown in Fig. 8(d). The volcanic plot for OER should be divided into two paths: P1 and P2. The ηOER of P1 could be described by ΔG*O-ΔG*OH; also, because of the existence of two kinds of *O, two volcanic plots can be obtained. It can be seen in Fig. 8 (e) that the peak overpotential of the synergistic oxygen is smaller, which means that synergistic oxygen is more conducive to OER. And ηOER of P2 could be described by ΔG*2OH-ΔG*OH as shown in Fig. 8 (f). We can find that different load modes, different active sites and the presence or absence of OH ligand will result in the different distribution in volcano plots, which means that they have a large effect on catalytic activity. This provides a judgment for rapidly evaluating the performance of catalysts with similar structures in the future. 4 Conclusion In summary, the catalytic performance of ORR and OER of La2O3-Gra in the alkaline environment was studied by DFT calculation in this paper. The La2O3 cluster is able to stably exist in the O-Gra and Face-Gra forms, of which O-Gra is the most stable and Face-Gra is metastable. The bare catalyst adsorbs too strongly to the intermediates, whereas hydroxyl modification can effectively reduce adsorption to an appropriate extent. As a result of the hydroxylation of O-Gra-1, the optimal catalytic site (up-down1) shows outstanding bifunctional catalytic activity with ηORR of 0.51 V and ηOER of 0.52 V. And the best active site of OH modified Face-Gra-1 (up-down2) exhibits excellent performance with ηORR of 0.48 V and ηOER of 0.39 V. All this means that the electrocatalytic performance of the La2O3-Gra can be comparable to the commercial Pt-based catalysts and the Ru/Ir oxides OER catalysts. In addition, we have found descriptors to assess the activity of La2O3-Gra catalyst for both ORR and OER, which provide powerful references for the rapid prediction of catalytic activity of similar systems in the future. CRediT authorship contribution statement Daomiao Wang: Investigation, Formal analysis, Writing – original draft. Luya Jin: Investigation, Formal analysis. Meiling Liu: Methodology, Conceptualization. Tae Gwan Lee: Resources, Conceptualization. Shaik Gouse Peera: Validation, Funding acquisition, Writing – review & editing. Chao Liu: Investigation, Formal analysis, Writing – review & editing, Funding acquisition. Declaration of Competing Interest The authors declare no competing financial interest. Acknowledgments This work was supported by the Natural Science Foundation of Jiangxi Province (Grant No. 20212BCJL23053 and 20212BAB203015), the Research Foundation of the Education Department of Jiangxi Province (Grant No. GJJ200808) and the Program of Qingjiang Excellent Young Talents (JXUSTQJYX2020002), Jiangxi University of Science and Technology. The authors also thank the National Research Foundation of Korea (NRF) funded by the Korean government, Ministry of Science and ICT (MSIT) (No. 2021R1F1A1046648), Republic of Korea. Supplementary materials Supplementary material associated with this article can be found, in the online version, at doi:10.1016/j.mcat.2022.112879. Appendix Supplementary materials Image, application 1 Image, application 2 References [1] A. Ali M. Audi Y. Roussel Natural Resources Depletion, Renewable Energy Consumption and Environmental Degradation: A Comparative Analysis of Developed and Developing World Int. J. Energy Econ. Policy 11 2021 251 260 A. Ali, M. Audi, Y. Roussel, Int. J. Energy Econ. Policy 11 (2021) 251-260. [2] H. Amirnejad A. Mehrjo S. Satari Yuzbashkandi Economic growth and air quality influences on energy sources depletion, forest sources and health in MENA Environ. Challenges 2 2021 100011 H. Amirnejad, A. Mehrjo, S. Satari Yuzbashkandi, Environ. Challenges 2 (2021) 100011. [3] B. Tanç H.T. Arat E. Baltacıoğlu K. Aydın Overview of the next quarter century vision of hydrogen fuel cell electric vehicles Int. J. Hydrog. Energy 44 2019 10120 10128 B. Tanç, H.T. Arat, E. Baltacıoğlu, K. Aydın, Int. J. Hydrog. Energy 44 (2019) 10120-10128. [4] C. Wang Y. Yu J. Niu Y. Liu D. Bridges X. Liu J. Pooran Y. Zhang A. Hu Recent Progress of Metal–Air Batteries—A Mini Review, Appl. Sci. 9 2019 2787 C. Wang, Y. Yu, J. Niu, Y. Liu, D. Bridges, X. Liu, J. Pooran, Y. Zhang, A. Hu, Appl. Sci. 9 (2019) 2787. [5] F. Liu G. Zhu D. Yang D. Jia F. Jin W. Wang Systematic exploration of N, C configurational effects on the ORR performance of Fe–N doped graphene catalysts based on DFT calculations RSC Adv. 9 2019 22656 22667 F. Liu, G. Zhu, D. Yang, D. Jia, F. Jin, W. Wang, RSC Adv. 9 (2019) 22656-22667. [6] T. Lozano R.B. Rankin Computational predictive design for metal-decorated-graphene size-specific subnanometer to nanometer ORR catalysts Catal. Today 312 2018 105 117 T. Lozano, R.B. Rankin, Catal. Today 312 (2018) 105-117. [7] B. He J. Shen D. Ma Z. Lu Z. Yang Boron-Doped C3N Monolayer as a Promising Metal-Free Oxygen Reduction Reaction Catalyst: A Theoretical Insight J. Phys. Chem. C 122 2018 20312 20322 B. He, J. Shen, D. Ma, Z. Lu, Z. Yang, J. Phys. Chem. C 122 (2018) 20312-20322. [8] A. Curutchet P. Colinet C. Michel S.N. Steinmann T. Le Bahers Two-sites are better than one: revisiting the OER mechanism on CoOOH by DFT with electrode polarization Phys. Chem. Chem. Phys. 22 2020 7031 7038 A. Curutchet, P. Colinet, C. Michel, S.N. Steinmann, T. Le Bahers, Phys. Chem. Chem. Phys. 22 (2020) 7031-7038. [9] K. Zhang R. Zou Advanced Transition Metal-Based OER Electrocatalysts: Current Status, Opportunities, and Challenges Small 17 2021 2100129 K. Zhang, R. Zou, Small 17 (2021) 2100129. [10] K. Zhu X. Zhu W. Yang Application of In Situ Techniques for the Characterization of NiFe-Based Oxygen Evolution Reaction (OER) Electrocatalysts Angew. Chem. Int. Ed. Engl. 58 2019 1252 1265 K. Zhu, X. Zhu, W. Yang, Angew. Chem. Int. Ed. Engl. 58 (2019) 1252-1265. [11] Y. Ying K. Fan X. Luo J. Qiao H. Huang Unravelling the origin of bifunctional OER/ORR activity for single-atom catalysts supported on C2N by DFT and machine learning J. Mater. Chem. A 9 2021 16860 16867 Y. Ying, K. Fan, X. Luo, J. Qiao, H. Huang, J. Mater. Chem. A 9 (2021) 16860-16867. [12] H. Niu X. Wang C. Shao Y. Liu Z. Zhang Y. Guo Revealing the oxygen reduction reaction activity origin of single atoms supported on g-C3N4 monolayers: a first-principles study J. Mater. Chem. A 8 2020 6555 6563 H. Niu, X. Wang, C. Shao, Y. Liu, Z. Zhang, Y. Guo, J. Mater. Chem. A 8 (2020) 6555-6563. [13] Q. Deng J. Zhao T. Wu G. Chen H.A. Hansen T. Vegge 2D transition metal–TCNQ sheets as bifunctional single-atom catalysts for oxygen reduction and evolution reaction (ORR/OER) J. Catal. 370 2019 378 384 Q. Deng, J. Zhao, T. Wu, G. Chen, H.A. Hansen, T. Vegge, J. Catal. 370 (2019) 378-384. [14] C. Zhang J. Sha H. Fei M. Liu S. Yazdi J. Zhang Q. Zhong X. Zou N. Zhao H. Yu Z. Jiang E. Ringe B.I. Yakobson J. Dong D. Chen J.M. Tour Single-Atomic Ruthenium Catalytic Sites on Nitrogen-Doped Graphene for Oxygen Reduction Reaction in Acidic Medium ACS Nano 11 2017 6930 6941 C. Zhang, J. Sha, H. Fei, M. Liu, S. Yazdi, J. Zhang, Q. Zhong, X. Zou, N. Zhao, H. Yu, Z. Jiang, E. Ringe, B.I. Yakobson, J. Dong, D. Chen, J.M. Tour, ACS Nano 11 (2017) 6930-6941. [15] Y. Zheng D.S. Yang J.M. Kweun C. Li K. Tan F. Kong C. Liang Y.J. Chabal Y.Y. Kim M. Cho J.S. Yu K. Cho Rational design of common transition metal-nitrogen-carbon catalysts for oxygen reduction reaction in fuel cells Nano Energy 30 2016 443 449 Y. Zheng, D.S. Yang, J.M. Kweun, C. Li, K. Tan, F. Kong, C. Liang, Y.J. Chabal, Y.Y. Kim, M. Cho, J.S. Yu, K. Cho, Nano Energy 30 (2016) 443-449. [16] L. Feng Y. Liu J. Zhao Fe- and Co-P4-embedded graphenes as electrocatalysts for the oxygen reduction reaction: theoretical insights Phys. Chem. Chem. Phys. 17 2015 30687 30694 L. Feng, Y. Liu, J. Zhao, Phys. Chem. Chem. Phys. 17 (2015) 30687-30694. [17] W. Qi J. Niu Z. Huang Z. Chen X. Chen F. Chen J. Tuo Mechanisms insight into oxygen reduction reaction on sulfur-doped Fe–N2 graphene electrocatalysts Int. J. Hydrog. Energy 45 2020 521 530 W. Qi, J. Niu, Z. Huang, Z. Chen, X. Chen, F. Chen, J. Tuo, Int. J. Hydrog. Energy 45 (2020) 521-530. [18] Z. Qin Z. Wang J. Zhao Computational screening of single-atom catalysts supported by VS2 monolayers for electrocatalytic oxygen reduction/evolution reactions Nanoscale 14 2022 6902 6911 Z. Qin, Z. Wang, J. Zhao, Nanoscale 14 (2022) 6902-6911. [19] X. Li Z. Su Z. Zhao Q. Cai Y. Li J. Zhao Single Ir atom anchored in pyrrolic-N4 doped graphene as a promising bifunctional electrocatalyst for the ORR/OER: a computational study J. Colloid Interface Sci. 607 2022 1005 1013 X. Li, Z. Su, Z. Zhao, Q. Cai, Y. Li, J. Zhao, J. Colloid Interface Sci. 607 (2022) 1005-1013. [20] M. Chen M. Luo C. Liu X. Qi S.G. Peera T. Liang Transition metal-Nx doped graphene as an efficient oxygen reduction reaction catalyst: A theoretical perspective Comput. Theor. Chem. 1187 2020 112945 M. Chen, M. Luo, C. Liu, X. Qi, S.G. Peera, T. Liang, Comput. Theor. Chem. 1187 (2020) 112945. [21] Z. Liang C. Liu M. Chen X. Qi P.K. U S.G. Peera J. Liu J. He T. Liang Oxygen reduction reaction mechanism on P, N co-doped graphene: a density functional theory study New J. Chem. 43 2019 19308 19317 Z. Liang, C. Liu, M. Chen, X. Qi, P.K. U, S.G. Peera, J. Liu, J. He, T. Liang, New J. Chem. 43 (2019) 19308-19317. [22] Y. Yang Y. Yang Z. Pei K.H. Wu C. Tan H. Wang L. Wei A. Mahmood C. Yan J. Dong S. Zhao Y. Chen Recent Progress of Carbon-Supported Single-Atom Catalysts for Energy Conversion and Storage Matter 3 2020 1442 1476 Y. Yang, Y. Yang, Z. Pei, K.H. Wu, C. Tan, H. Wang, L. Wei, A. Mahmood, C. Yan, J. Dong, S. Zhao, Y. Chen, Matter 3 (2020) 1442-1476. [23] Y. Tan W. Zhu Z. Zhang W. Wu R. Chen S. Mu H. Lv N. Cheng Electronic tuning of confined sub-nanometer cobalt oxide clusters boosting oxygen catalysis and rechargeable Zn–air batteries Nano Energy 83 2021 105813 Y. Tan, W. Zhu, Z. Zhang, W. Wu, R. Chen, S. Mu, H. Lv, N. Cheng, Nano Energy 83 (2021) 105813. [24] S. Yang R. Du Y. Yu Z. Zhang F. Wang One-step electrodeposition of carbon quantum dots and transition metal ions for N-doped carbon coupled with NiFe oxide clusters: A high-performance electrocatalyst for oxygen evolution Nano Energy 77 2020 105057 S. Yang, R. Du, Y. Yu, Z. Zhang, F. Wang, Nano Energy 77 (2020) 105057. [25] Y. Wu D. Wang Y. Li Nanocrystals from solutions: catalysts Chem. Soc. Rev. 43 2014 2112 2124 Y. Wu, D. Wang, Y. Li, Chem. Soc. Rev. 43 (2014) 2112-2124. [26] Z. Kou W. Zang Y. Ma Z. Pan S. Mu X. Gao B. Tang M. Xiong X. Zhao A.K. Cheetham L. Zheng J. Wang Cage-confinement pyrolysis route to size-controlled molybdenum-based oxygen electrode catalysts: From isolated atoms to clusters and nanoparticles Nano Energy 67 2020 104288 Z. Kou, W. Zang, Y. Ma, Z. Pan, S. Mu, X. Gao, B. Tang, M. Xiong, X. Zhao, A.K. Cheetham, L. Zheng, J. Wang, Nano Energy 67 (2020) 104288. [27] H. Yin H. Tang D. Wang Y. Gao Z. Tang Facile Synthesis of Surfactant-Free Au Cluster/Graphene Hybrids for High-Performance Oxygen Reduction Reaction ACS Nano 6 2012 8288 8297 H. Yin, H. Tang, D. Wang, Y. Gao, Z. Tang, ACS Nano 6 (2012) 8288-8297. [28] V. Orazi R.E. Ambrusi J.M. Marchetti M.E. Pronsato DFT study of the hydrogen adsorption and storage on Ni4 cluster embedded in multivacancy graphene Int. J. Hydrog. Energy 45 2020 30805 30817 V. Orazi, R.E. Ambrusi, J.M. Marchetti, M.E. Pronsato, Int. J. Hydrog. Energy 45 (2020) 30805-30817. [29] Z. Wang J. Li D. Zhao L. Zhang DFTB investigations of structures and electron states for a decahedron Ti7 cluster on graphene on electrical level Diam. Relat. Mater. 130 2022 109459 Z. Wang, J. Li, D. Zhao, L. Zhang, Diam. Relat. Mater. 130 (2022) 109459. [30] K. Maiti N.H. Kim J.H. Lee Strongly stabilized integrated bimetallic oxide of Fe2O3-MoO3 Nano-crystal entrapped N-doped graphene as a superior oxygen reduction reaction electrocatalyst Chem. Eng. J. 410 2021 128358 K. Maiti, N.H. Kim, J.H. Lee, Chem. Eng. J. 410 (2021) 128358. [31] S. Jalili E.M. Goliaei J. Schofield Silver cluster supported on nitrogen-doped graphene as an electrocatalyst with high activity and stability for oxygen reduction reaction Int. J. Hydrog. Energy 42 2017 14522 14533 S. Jalili, E.M. Goliaei, J. Schofield, Int. J. Hydrog. Energy 42 (2017) 14522-14533. [32] L. Wang K.A. Stoerzinger L. Chang J. Zhao Y. Li C.S. Tang X. Yin M.E. Bowden Z. Yang H. Guo L. You R. Guo J. Wang K. Ibrahim J. Chen A. Rusydi J. Wang S.A. Chambers Y. Du Tuning Bifunctional Oxygen Electrocatalysts by Changing the A‐Site Rare‐Earth Element in Perovskite Nickelates Adv. Funct. Mater. 28 2018 1803712 L. Wang, K.A. Stoerzinger, L. Chang, J. Zhao, Y. Li, C.S. Tang, X. Yin, M.E. Bowden, Z. Yang, H. Guo, L. You, R. Guo, J. Wang, K. Ibrahim, J. Chen, A. Rusydi, J. Wang, S.A. Chambers, Y. Du, Adv. Funct. Mater. 28 (2018) 1803712. [33] S. Stopic B. Friedrich Advances in Understanding of the Application of Unit Operations in Metallurgy of Rare Earth Elements Metals 11 2021 978 S. Stopic, B. Friedrich, Metals 11 (2021) 978. [34] J.M.D. Coey Perspective and Prospects for Rare Earth Permanent Magnets Engineering 6 2020 119 131 J.M.D. Coey, Engineering 6 (2020) 119-131. [35] E.A. Anashkina Laser Sources Based on Rare-Earth Ion Doped Tellurite Glass Fibers and Microspheres Fibers 8 2020 30 E.A. Anashkina, Fibers 8 (2020) 30. [36] J. Wang M. Guo M. Liu X. Wei Long-term outlook for global rare earth production Resour. Policy 65 2020 101569 J. Wang, M. Guo, M. Liu, X. Wei, Resour. Policy 65 (2020) 101569. [37] N. Wang J. Liu W. Gu Y. Song F. Wang Toward synergy of carbon and La2O3 in their hybrid as an efficient catalyst for the oxygen reduction reaction RSC Adv. 6 2016 77786 77795 N. Wang, J. Liu, W. Gu, Y. Song, F. Wang, RSC Adv. 6 (2016) 77786-77795. [38] X. Zhang Q. Xiao Y. Zhang X. Jiang Z. Yang Y. Xue Y.M. Yan K. Sun La2O3 Doped Carbonaceous Microspheres: A Novel Bifunctional Electrocatalyst for Oxygen Reduction and Evolution Reactions with Ultrahigh Mass Activity J. Phys. Chem. C 118 2014 20229 20237 X. Zhang, Q. Xiao, Y. Zhang, X. Jiang, Z. Yang, Y. Xue, Y.M. Yan, K. Sun, J. Phys. Chem. C 118 (2014) 20229-20237. [39] L. Sun D. Li H. Du J. Zhu L. Hu D. Guo Eu2O3–Cu/NC nanocomposite catalyst with improved oxygen reduction reaction activity for Zn-air batteries Int. J. Hydrog. Energy 46 2021 3974 3983 L. Sun, D. Li, H. Du, J. Zhu, L. Hu, D. Guo, Int. J. Hydrog. Energy 46 (2021) 3974-3983. [40] M.M. Ibrahim A. Mezni M. Alsawat T. Kumeria M.R. Das S. Alzahly A. Aldalbahi K. Gornicka J. Ryl M.A. Amin T. Altalhi Enhanced hydrogen evolution reaction on highly stable titania‐supported PdO and Eu2O3nanocomposites in a strong alkaline solution Int. J. Energy Res. 43 2019 5367 5383 M.M. Ibrahim, A. Mezni, M. Alsawat, T. Kumeria, M.R. Das, S. Alzahly, A. Aldalbahi, K. Gornicka, J. Ryl, M.A. Amin, T. Altalhi, Int. J. Energy Res. 43 (2019) 5367-5383. [41] T. Dai X. Zhang M. Sun B. Huang N. Zhang P. Da R. Yang Z. He W. Wang P. Xi C.H. Yan Uncovering the Promotion of CeO2 /CoS1.97 Heterostructure with Specific Spatial Architectures on Oxygen Evolution Reaction Adv. Mater. 33 2021 2102593 T. Dai, X. Zhang, M. Sun, B. Huang, N. Zhang, P. Da, R. Yang, Z. He, W. Wang, P. Xi, C.H. Yan, Adv. Mater. 33 (2021) 2102593. [42] Y. Kang W. Wang J. Li Y. Mi H. Gong Z. Lei 3D Rosa centifolia-like CeO2 encapsulated with N-doped carbon as an enhanced electrocatalyst for Zn-air batteries J. Colloid Interface Sci. 578 2020 796 804 Y. Kang, W. Wang, J. Li, Y. Mi, H. Gong, Z. Lei, J. Colloid Interface Sci. 578 (2020) 796-804. [43] D. Li, L. Sun, J. Zhu, L. Hu, D. Guo, Enhanced oxygen reduction reaction performance of ReOx/NC (Re = La, Ce, Pr, Sm, Eu, Tb, Er, Tm and Yb)-especially Pr6O11/NC via accommodating oxygen vacancies and its application for Zn-air battery, Appl. Surf. Sci. 535 (2021) 147689. [44] D. Li L. Sun L. Hu J. Zhu J. Shi D. Guo Rare earth insitu-doped ZIF-67 derived N doped C encapsulated Sm2O3/Co nanoparticles as excellent oxygen reduction reaction catalyst for Al-air batteries J. Power Sources 482 2021 229052 D. Li, L. Sun, L. Hu, J. Zhu, J. Shi, D. Guo, J. Power Sources 482 (2021) 229052. [45] M. Li Y. Wang Y. Zheng G. Fu D. Sun Y. Li Y. Tang T. Ma Gadolinium‐Induced Valence Structure Engineering for Enhanced Oxygen Electrocatalysis Adv. Energy Mater. 10 2020 1903833 M. Li, Y. Wang, Y. Zheng, G. Fu, D. Sun, Y. Li, Y. Tang, T. Ma, Adv. Energy Mater. 10 (2020) 1903833. [46] G. Zhang B. Wang J. Bi D. Fang S. Yang Constructing ultrathin CoP nanomeshes by Er-doping for highly efficient bifunctional electrocatalysts for overall water splitting J. Mater. Chem. A 7 2019 5769 5778 G. Zhang, B. Wang, J. Bi, D. Fang, S. Yang, J. Mater. Chem. A 7 (2019) 5769-5778. [47] Y. Luo L.A. Estudillo-Wong N. Alonso-Vante Carbon supported Pt-Y2O3 and Pt-Gd2O3 nanoparticles prepared via carbonyl chemical route towards oxygen reduction reaction: Kinetics and stability Int. J. Hydrog. Energy 41 2016 19601 19609 Y. Luo, L.A. Estudillo-Wong, N. Alonso-Vante, Int. J. Hydrog. Energy 41 (2016) 19601-19609. [48] P. Dorenbos Ce3+ 5d-centroid shift and vacuum referred 4f-electron binding energies of all lanthanide impurities in 150 different compounds J. Lumin. 135 2013 93 104 P. Dorenbos, J. Lumin. 135 (2013) 93-104. [49] I. Karimzadeh M. Aghazadeh B. Safibonab M.R. Ganjali S. Dalvand Facile preparation of La(OH)3 and La2O3 nanorods aligned along the electrode surface: Pulsed cathodic deposition followed by heat-treatment Russ. J. Electrochem. 51 2015 263 270 I. Karimzadeh, M. Aghazadeh, B. Safibonab, M.R. Ganjali, S. Dalvand, Russ. J. Electrochem. 51 (2015) 263-270. [50] T. Xia J. Wang N. Lin L. Huo H. Zhao G. Mountrichas Template-free synthesis, growth mechanism and photoluminescent properties of Ln(OH)3 and Ln2O3 nanorods (Ln: lanthanide ion) J. Alloy. Compd. 507 2010 245 252 T. Xia, J. Wang, N. Lin, L. Huo, H. Zhao, G. Mountrichas, J. Alloy. Compd. 507 (2010) 245-252. [51] J. Zhao J. Liu C. Jin N. Wang F. Wang Hexagonal La2O3 Nanocrystals Chemically Coupled with Nitrogen-Doped Porous Carbon as Efficient Catalysts for the Oxygen Reduction Reaction Chem. Eur. J 26 2020 12606 12614 J. Zhao, J. Liu, C. Jin, N. Wang, F. Wang, Chem. Eur. J 26 (2020) 12606-12614. [52] S. Ferdov Organic-Free and Selectively Oriented Recrystallization for Design of Natisite Microstructures Cryst. Growth Des. 11 2011 4498 4504 S. Ferdov, Cryst. Growth Des. 11 (2011) 4498-4504. [53] X.L. Ding Z.Y. Li J.H. Meng Y.X. Zhao S.G. He Density-functional global optimization of (La2O3)n clusters J. Chem. Phys. 137 2012 214311 X.L. Ding, Z.Y. Li, J.H. Meng, Y.X. Zhao, S.G. He, J. Chem. Phys. 137 (2012) 214311. [54] B. Delley From molecules to solids with the DMol3 approach J. Chem. Phys. 113 2000 7756 7764 B. Delley, J. Chem. Phys. 113 (2000) 7756-7764. [55] J.P. Perdew K. Burke M. Ernzerhof Generalized Gradient Approximation Made Simple Phys. Rev. Lett. 77 1996 3865 3868 J.P. Perdew, K. Burke, M. Ernzerhof, Phys. Rev. Lett. 77 (1996) 3865-3868. [56] J.A. Rodriguez S. Ma P. Liu J. Hrbek J. Evans M. Pérez Activity of CeOx and TiOx Nanoparticles Grown on Au(111) in the Water-Gas Shift Reaction Science 318 2007 1757 1760 J.A. Rodriguez, S. Ma, P. Liu, J. Hrbek, J. Evans, M. Pérez, Science 318 (2007) 1757-1760. [57] A. Tkatchenko M. Scheffler Accurate molecular van der Waals interactions from ground-state electron density and free-atom reference data Phys. Rev. Lett. 102 2009 073005 A. Tkatchenko, M. Scheffler, Phys. Rev. Lett. 102 (2009) 073005. [58] T. Todorova B. Delley Wetting of paracetamol surfaces studied by DMol3‐COSMO calculations Mol. Simul. 34 2008 1013 1017 T. Todorova, B. Delley, Mol. Simul. 34 (2008) 1013-1017. [59] B. Delley Hardness conserving semilocal pseudopotentials Phys. Rev. B 66 2002 155125 B. Delley, Phys. Rev. B 66 (2002) 155125. [60] G. Xiao R. Lu J. Liu X. Liao Z. Wang Y. Zhao Coordination environments tune the activity of oxygen catalysis on single atom catalysts: A computational study Nano Res. 15 2022 3073 3081 G. Xiao, R. Lu, J. Liu, X. Liao, Z. Wang, Y. Zhao, Nano Res.. 15 (2022) 3073-3081. [61] X. Zhao X. Liu B. Huang P. Wang Y. Pei Hydroxyl group modification improves the electrocatalytic ORR and OER activity of graphene supported single and bi-metal atomic catalysts (Ni, Co, and Fe) J. Mater. Chem. A 7 2019 24583 24593 X. Zhao, X. Liu, B. Huang, P. Wang, Y. Pei, J. Mater. Chem. A 7 (2019) 24583-24593. [62] W.T. Hong M. Risch K.A. Stoerzinger A. Grimaud J. Suntivich Y. Shao-Horn Toward the rational design of non-precious transition metal oxides for oxygen electrocatalysis Energy Environ. Sci. 8 2015 1404 1427 W.T. Hong, M. Risch, K.A. Stoerzinger, A. Grimaud, J. Suntivich, Y. Shao-Horn, Energy Environ. Sci. 8 (2015) 1404-1427. [63] J. Wang W. Liu G. Luo Z. Li C. Zhao H. Zhang M. Zhu Q. Xu X. Wang C. Zhao Y. Qu Z. Yang T. Yao Y. Li Y. Lin Y. Wu Y. Li Synergistic effect of well-defined dual sites boosting the oxygen reduction reaction Energy Environ. Sci. 11 2018 3375 3379 J. Wang, W. Liu, G. Luo, Z. Li, C. Zhao, H. Zhang, M. Zhu, Q. Xu, X. Wang, C. Zhao, Y. Qu, Z. Yang, T. Yao, Y. Li, Y. Lin, Y. Wu, Y. Li, Energy Environ. Sci. 11 (2018) 3375-3379. [64] Z. Lu B. Wang Y. Hu W. Liu Y. Zhao R. Yang Z. Li J. Luo B. Chi Z. Jiang M. Li S. Mu S. Liao J. Zhang X. Sun An Isolated Zinc-Cobalt Atomic Pair for Highly Active and Durable Oxygen Reduction Angew. Chem. Int. Ed. Engl. 58 2019 2622 2626 Z. Lu, B. Wang, Y. Hu, W. Liu, Y. Zhao, R. Yang, Z. Li, J. Luo, B. Chi, Z. Jiang, M. Li, S. Mu, S. Liao, J. Zhang, X. Sun, Angew. Chem. Int. Ed. Engl. 58 (2019) 2622-2626. [65] S. Huang Q. Qiao X. Chen S. Qing Iron-zinc bimetal embedded N-doped graphene for the oxygen reduction reaction catalysis: A density functional theory study Diam. Relat. Mater. 116 2021 108431 S. Huang, Q. Qiao, X. Chen, S. Qing, Diam. Relat. Mater. 116 (2021) 108431. [66] J. Xu A. Elangovan J. Li B. Liu Graphene-Based Dual-Metal Sites for Oxygen Reduction Reaction: A Theoretical Study J. Phys. Chem. C 125 2021 2334 2344 J. Xu, A. Elangovan, J. Li, B. Liu, J. Phys. Chem. C 125 (2021) 2334-2344. [67] U. Martinez E.F. Holby S.K. Babu K. Artyushkova L. Lin S. Choudhury G.M. Purdy P. Zelenay Experimental and Theoretical Trends of PGM-Free Electrocatalysts for the Oxygen Reduction Reaction with Different Transition Metals J. Electrochem. Soc. 166 2019 F3136 F3142 U. Martinez, E.F. Holby, S.K. Babu, K. Artyushkova, L. Lin, S. Choudhury, G.M. Purdy, P. Zelenay, J. Electrochem. Soc. 166 (2019) F3136-F3142. [68] E.F. Holby C.D. Taylor Activity of N-coordinated multi-metal-atom active site structures for Pt-free oxygen reduction reaction catalysis: role of *OH ligands Sci. Rep. 5 2015 9286 E.F. Holby, C.D. Taylor, Sci. Rep. 5 (2015) 9286. [69] Z. Liang M. Luo M. Chen X. Qi J. Liu C. Liu S.G. Peera T. Liang Exploring the oxygen electrode bi-functional activity of Ni–N–C-doped graphene systems with N, C co-ordination and OH ligand effects J. Mater. Chem. A 8 2020 20453 20462 Z. Liang, M. Luo, M. Chen, X. Qi, J. Liu, C. Liu, S.G. Peera, T. Liang, J. Mater. Chem. A 8 (2020) 20453-20462. [70] Z. Liang M. Luo M. Chen C. Liu S.G. Peera X. Qi J. Liu U.P. Kumar T.L.T. Liang Evaluating the catalytic activity of transition metal dimers for the oxygen reduction reaction J. Colloid Interface Sci. 568 2020 54 62 Z. Liang, M. Luo, M. Chen, C. Liu, S.G. Peera, X. Qi, J. Liu, U.P. Kumar, T.L.T. Liang, J. Colloid Interface Sci. 568 (2020) 54-62. [71] J.C. Li X. Qin F. Xiao C. Liang M. Xu Y. Meng E. Sarnello L. Fang T. Li S. Ding Z. Lyu S. Zhu X. Pan P.X. Hou C. Liu Y. Lin M. Shao Highly Dispersive Cerium Atoms on Carbon Nanowires as Oxygen Reduction Reaction Electrocatalysts for Zn-Air Batteries Nano Lett. 21 2021 4508 4515 J.C. Li, X. Qin, F. Xiao, C. Liang, M. Xu, Y. Meng, E. Sarnello, L. Fang, T. Li, S. Ding, Z. Lyu, S. Zhu, X. Pan, P.X. Hou, C. Liu, Y. Lin, M. Shao, Nano Lett. 21 (2021) 4508-4515. [72] F.X. Chen Cobalt-Phosphorus Decorated Graphene as Electrocatalyst for Oxygen Reduction Reactions: A Density Functional Theory Study Int. J. Electrochem. Sci. 16 2021 210332 F.X. Chen, Int. J. Electrochem. Sci. 16 (2021) 210332. [73] L. Cao Q. Luo W. Liu Y. Lin X. Liu Y. Cao W. Zhang Y. Wu J. Yang T. Yao S. Wei Identification of single-atom active sites in carbon-based cobalt catalysts during electrocatalytic hydrogen evolution Nat. Catal. 2 2018 134 141 L. Cao, Q. Luo, W. Liu, Y. Lin, X. Liu, Y. Cao, W. Zhang, Y. Wu, J. Yang, T. Yao, S. Wei, Nat. Catal. 2 (2018) 134-141. [74] X. Yang D. Xia Y. Kang H. Du F. Kang L. Gan J. Li Unveiling the Axial Hydroxyl Ligand on Fe-N4-C Electrocatalysts and Its Impact on the pH-Dependent Oxygen Reduction Activities and Poisoning Kinetics Adv. Sci. (Weinh) 7 2020 2000176 X. Yang, D. Xia, Y. Kang, H. Du, F. Kang, L. Gan, J. Li, Adv. Sci. (Weinh) 7 (2020) 2000176.",
      "scopus-id": "85144332789",
      "coredata": {
        "eid": "1-s2.0-S2468823122007659",
        "dc:description": "The development of bifunctional oxygen electrode electrocatalysis for both the oxygen reduction reaction (ORR) and the oxygen evolution reaction (OER) plays a vital role in the solution of the energy crisis as well as the environmental pollution. The purpose of this paper is to investigate the potential of graphene-supported lanthanum oxide clusters (La2O3-Gra) as a bifunctional electrocatalyst; the results show that the optimal catalytic site (up-down1) of the most stable configuration (O-Gra-1) modified by OH group shows outstanding bifunctional catalytic activity with ηORR of 0.51 V and ηOER of 0.52 V, which can be compared to the commercial Pt-based ORR catalysts and the Ru/Ir-oxides OER catalysts. Furthermore, there is a strong scale-dependent relationship between the adsorption free energy (ΔGads) of reaction intermediates, resulting in volcano plots between the catalytic activity and ΔGads, which provides a valuable description for future performance prediction of structurally similar catalysts.",
        "openArchiveArticle": "false",
        "prism:coverDate": "2023-01-15",
        "openaccessUserLicense": null,
        "prism:aggregationType": "Journal",
        "prism:url": "https://api.elsevier.com/content/article/pii/S2468823122007659",
        "dc:creator": [
          {
            "@_fa": "true",
            "$": "Wang, Daomiao"
          },
          {
            "@_fa": "true",
            "$": "Jin, Luya"
          },
          {
            "@_fa": "true",
            "$": "Liu, Meiling"
          },
          {
            "@_fa": "true",
            "$": "Lee, Tae Gwan"
          },
          {
            "@_fa": "true",
            "$": "Peera, Shaik Gouse"
          },
          {
            "@_fa": "true",
            "$": "Liu, Chao"
          }
        ],
        "link": [
          {
            "@_fa": "true",
            "@rel": "self",
            "@href": "https://api.elsevier.com/content/article/pii/S2468823122007659"
          },
          {
            "@_fa": "true",
            "@rel": "scidir",
            "@href": "https://www.sciencedirect.com/science/article/pii/S2468823122007659"
          }
        ],
        "dc:format": "application/json",
        "openaccessType": null,
        "pii": "S2468-8231(22)00765-9",
        "prism:volume": "535",
        "articleNumber": "112879",
        "prism:publisher": "Elsevier B.V.",
        "dc:title": "The graphene-supported Lanthanum oxide cluster as efficient bifunctional electrocatalyst for oxygen reaction",
        "prism:copyright": "© 2022 Elsevier B.V. All rights reserved.",
        "openaccess": "0",
        "prism:issn": "24688231",
        "dcterms:subject": [
          {
            "@_fa": "true",
            "$": "Oxygen reduction reaction"
          },
          {
            "@_fa": "true",
            "$": "Oxygen evolution reaction"
          },
          {
            "@_fa": "true",
            "$": "Lanthanum oxide cluster"
          },
          {
            "@_fa": "true",
            "$": "Density functional theory"
          }
        ],
        "openaccessArticle": "false",
        "prism:publicationName": "Molecular Catalysis",
        "openaccessSponsorType": null,
        "prism:pageRange": "112879",
        "pubType": "fla",
        "prism:coverDisplayDate": "15 January 2023",
        "prism:doi": "10.1016/j.mcat.2022.112879",
        "prism:startingPage": "112879",
        "dc:identifier": "doi:10.1016/j.mcat.2022.112879",
        "openaccessSponsorName": null
      },
      "objects": {
        "object": [
          {
            "@category": "standard",
            "@height": "773",
            "@width": "489",
            "@_fa": "true",
            "$": "https://api.elsevier.com/content/object/eid/1-s2.0-S2468823122007659-gr7.jpg?httpAccept=%2A%2F%2A",
            "@multimediatype": "JPEG image file",
            "@type": "IMAGE-DOWNSAMPLED",
            "@size": "139839",
            "@ref": "gr7",
            "@mimetype": "image/jpeg"
          },
          {
            "@category": "standard",
            "@height": "377",
            "@width": "659",
            "@_fa": "true",
            "$": "https://api.elsevier.com/content/object/eid/1-s2.0-S2468823122007659-gr8.jpg?httpAccept=%2A%2F%2A",
            "@multimediatype": "JPEG image file",
            "@type": "IMAGE-DOWNSAMPLED",
            "@size": "81250",
            "@ref": "gr8",
            "@mimetype": "image/jpeg"
          },
          {
            "@category": "standard",
            "@height": "397",
            "@width": "489",
            "@_fa": "true",
            "$": "https://api.elsevier.com/content/object/eid/1-s2.0-S2468823122007659-gr5.jpg?httpAccept=%2A%2F%2A",
            "@multimediatype": "JPEG image file",
            "@type": "IMAGE-DOWNSAMPLED",
            "@size": "59526",
            "@ref": "gr5",
            "@mimetype": "image/jpeg"
          },
          {
            "@category": "standard",
            "@height": "415",
            "@width": "527",
            "@_fa": "true",
            "$": "https://api.elsevier.com/content/object/eid/1-s2.0-S2468823122007659-gr6.jpg?httpAccept=%2A%2F%2A",
            "@multimediatype": "JPEG image file",
            "@type": "IMAGE-DOWNSAMPLED",
            "@size": "84621",
            "@ref": "gr6",
            "@mimetype": "image/jpeg"
          },
          {
            "@category": "standard",
            "@height": "385",
            "@width": "527",
            "@_fa": "true",
            "$": "https://api.elsevier.com/content/object/eid/1-s2.0-S2468823122007659-gr3.jpg?httpAccept=%2A%2F%2A",
            "@multimediatype": "JPEG image file",
            "@type": "IMAGE-DOWNSAMPLED",
            "@size": "63023",
            "@ref": "gr3",
            "@mimetype": "image/jpeg"
          },
          {
            "@category": "standard",
            "@height": "190",
            "@width": "489",
            "@_fa": "true",
            "$": "https://api.elsevier.com/content/object/eid/1-s2.0-S2468823122007659-gr4.jpg?httpAccept=%2A%2F%2A",
            "@multimediatype": "JPEG image file",
            "@type": "IMAGE-DOWNSAMPLED",
            "@size": "38623",
            "@ref": "gr4",
            "@mimetype": "image/jpeg"
          },
          {
            "@category": "standard",
            "@height": "182",
            "@width": "489",
            "@_fa": "true",
            "$": "https://api.elsevier.com/content/object/eid/1-s2.0-S2468823122007659-gr1.jpg?httpAccept=%2A%2F%2A",
            "@multimediatype": "JPEG image file",
            "@type": "IMAGE-DOWNSAMPLED",
            "@size": "26930",
            "@ref": "gr1",
            "@mimetype": "image/jpeg"
          },
          {
            "@category": "standard",
            "@height": "139",
            "@width": "489",
            "@_fa": "true",
            "$": "https://api.elsevier.com/content/object/eid/1-s2.0-S2468823122007659-gr2.jpg?httpAccept=%2A%2F%2A",
            "@multimediatype": "JPEG image file",
            "@type": "IMAGE-DOWNSAMPLED",
            "@size": "30488",
            "@ref": "gr2",
            "@mimetype": "image/jpeg"
          },
          {
            "@category": "standard",
            "@height": "245",
            "@width": "243",
            "@_fa": "true",
            "$": "https://api.elsevier.com/content/object/eid/1-s2.0-S2468823122007659-ga1.jpg?httpAccept=%2A%2F%2A",
            "@multimediatype": "JPEG image file",
            "@type": "IMAGE-DOWNSAMPLED",
            "@size": "26124",
            "@ref": "ga1",
            "@mimetype": "image/jpeg"
          },
          {
            "@category": "thumbnail",
            "@height": "163",
            "@width": "103",
            "@_fa": "true",
            "$": "https://api.elsevier.com/content/object/eid/1-s2.0-S2468823122007659-gr7.sml?httpAccept=%2A%2F%2A",
            "@multimediatype": "GIF image file",
            "@type": "IMAGE-THUMBNAIL",
            "@size": "10715",
            "@ref": "gr7",
            "@mimetype": "image/gif"
          },
          {
            "@category": "thumbnail",
            "@height": "125",
            "@width": "219",
            "@_fa": "true",
            "$": "https://api.elsevier.com/content/object/eid/1-s2.0-S2468823122007659-gr8.sml?httpAccept=%2A%2F%2A",
            "@multimediatype": "GIF image file",
            "@type": "IMAGE-THUMBNAIL",
            "@size": "12437",
            "@ref": "gr8",
            "@mimetype": "image/gif"
          },
          {
            "@category": "thumbnail",
            "@height": "164",
            "@width": "202",
            "@_fa": "true",
            "$": "https://api.elsevier.com/content/object/eid/1-s2.0-S2468823122007659-gr5.sml?httpAccept=%2A%2F%2A",
            "@multimediatype": "GIF image file",
            "@type": "IMAGE-THUMBNAIL",
            "@size": "12607",
            "@ref": "gr5",
            "@mimetype": "image/gif"
          },
          {
            "@category": "thumbnail",
            "@height": "164",
            "@width": "208",
            "@_fa": "true",
            "$": "https://api.elsevier.com/content/object/eid/1-s2.0-S2468823122007659-gr6.sml?httpAccept=%2A%2F%2A",
            "@multimediatype": "GIF image file",
            "@type": "IMAGE-THUMBNAIL",
            "@size": "15945",
            "@ref": "gr6",
            "@mimetype": "image/gif"
          },
          {
            "@category": "thumbnail",
            "@height": "160",
            "@width": "219",
            "@_fa": "true",
            "$": "https://api.elsevier.com/content/object/eid/1-s2.0-S2468823122007659-gr3.sml?httpAccept=%2A%2F%2A",
            "@multimediatype": "GIF image file",
            "@type": "IMAGE-THUMBNAIL",
            "@size": "13479",
            "@ref": "gr3",
            "@mimetype": "image/gif"
          },
          {
            "@category": "thumbnail",
            "@height": "85",
            "@width": "219",
            "@_fa": "true",
            "$": "https://api.elsevier.com/content/object/eid/1-s2.0-S2468823122007659-gr4.sml?httpAccept=%2A%2F%2A",
            "@multimediatype": "GIF image file",
            "@type": "IMAGE-THUMBNAIL",
            "@size": "9763",
            "@ref": "gr4",
            "@mimetype": "image/gif"
          },
          {
            "@category": "thumbnail",
            "@height": "81",
            "@width": "219",
            "@_fa": "true",
            "$": "https://api.elsevier.com/content/object/eid/1-s2.0-S2468823122007659-gr1.sml?httpAccept=%2A%2F%2A",
            "@multimediatype": "GIF image file",
            "@type": "IMAGE-THUMBNAIL",
            "@size": "7656",
            "@ref": "gr1",
            "@mimetype": "image/gif"
          },
          {
            "@category": "thumbnail",
            "@height": "62",
            "@width": "219",
            "@_fa": "true",
            "$": "https://api.elsevier.com/content/object/eid/1-s2.0-S2468823122007659-gr2.sml?httpAccept=%2A%2F%2A",
            "@multimediatype": "GIF image file",
            "@type": "IMAGE-THUMBNAIL",
            "@size": "8364",
            "@ref": "gr2",
            "@mimetype": "image/gif"
          },
          {
            "@category": "thumbnail",
            "@height": "163",
            "@width": "162",
            "@_fa": "true",
            "$": "https://api.elsevier.com/content/object/eid/1-s2.0-S2468823122007659-ga1.sml?httpAccept=%2A%2F%2A",
            "@multimediatype": "GIF image file",
            "@type": "IMAGE-THUMBNAIL",
            "@size": "17902",
            "@ref": "ga1",
            "@mimetype": "image/gif"
          },
          {
            "@category": "high",
            "@height": "3424",
            "@width": "2167",
            "@_fa": "true",
            "$": "https://api.elsevier.com/content/object/eid/1-s2.0-S2468823122007659-gr7_lrg.jpg?httpAccept=%2A%2F%2A",
            "@multimediatype": "JPEG image file",
            "@type": "IMAGE-HIGH-RES",
            "@size": "1088137",
            "@ref": "gr7",
            "@mimetype": "image/jpeg"
          },
          {
            "@category": "high",
            "@height": "1670",
            "@width": "2917",
            "@_fa": "true",
            "$": "https://api.elsevier.com/content/object/eid/1-s2.0-S2468823122007659-gr8_lrg.jpg?httpAccept=%2A%2F%2A",
            "@multimediatype": "JPEG image file",
            "@type": "IMAGE-HIGH-RES",
            "@size": "565742",
            "@ref": "gr8",
            "@mimetype": "image/jpeg"
          },
          {
            "@category": "high",
            "@height": "1758",
            "@width": "2167",
            "@_fa": "true",
            "$": "https://api.elsevier.com/content/object/eid/1-s2.0-S2468823122007659-gr5_lrg.jpg?httpAccept=%2A%2F%2A",
            "@multimediatype": "JPEG image file",
            "@type": "IMAGE-HIGH-RES",
            "@size": "434717",
            "@ref": "gr5",
            "@mimetype": "image/jpeg"
          },
          {
            "@category": "high",
            "@height": "1835",
            "@width": "2333",
            "@_fa": "true",
            "$": "https://api.elsevier.com/content/object/eid/1-s2.0-S2468823122007659-gr6_lrg.jpg?httpAccept=%2A%2F%2A",
            "@multimediatype": "JPEG image file",
            "@type": "IMAGE-HIGH-RES",
            "@size": "592673",
            "@ref": "gr6",
            "@mimetype": "image/jpeg"
          },
          {
            "@category": "high",
            "@height": "1704",
            "@width": "2333",
            "@_fa": "true",
            "$": "https://api.elsevier.com/content/object/eid/1-s2.0-S2468823122007659-gr3_lrg.jpg?httpAccept=%2A%2F%2A",
            "@multimediatype": "JPEG image file",
            "@type": "IMAGE-HIGH-RES",
            "@size": "449285",
            "@ref": "gr3",
            "@mimetype": "image/jpeg"
          },
          {
            "@category": "high",
            "@height": "844",
            "@width": "2167",
            "@_fa": "true",
            "$": "https://api.elsevier.com/content/object/eid/1-s2.0-S2468823122007659-gr4_lrg.jpg?httpAccept=%2A%2F%2A",
            "@multimediatype": "JPEG image file",
            "@type": "IMAGE-HIGH-RES",
            "@size": "262428",
            "@ref": "gr4",
            "@mimetype": "image/jpeg"
          },
          {
            "@category": "high",
            "@height": "805",
            "@width": "2167",
            "@_fa": "true",
            "$": "https://api.elsevier.com/content/object/eid/1-s2.0-S2468823122007659-gr1_lrg.jpg?httpAccept=%2A%2F%2A",
            "@multimediatype": "JPEG image file",
            "@type": "IMAGE-HIGH-RES",
            "@size": "190445",
            "@ref": "gr1",
            "@mimetype": "image/jpeg"
          },
          {
            "@category": "high",
            "@height": "615",
            "@width": "2167",
            "@_fa": "true",
            "$": "https://api.elsevier.com/content/object/eid/1-s2.0-S2468823122007659-gr2_lrg.jpg?httpAccept=%2A%2F%2A",
            "@multimediatype": "JPEG image file",
            "@type": "IMAGE-HIGH-RES",
            "@size": "200125",
            "@ref": "gr2",
            "@mimetype": "image/jpeg"
          },
          {
            "@category": "high",
            "@height": "1085",
            "@width": "1076",
            "@_fa": "true",
            "$": "https://api.elsevier.com/content/object/eid/1-s2.0-S2468823122007659-ga1_lrg.jpg?httpAccept=%2A%2F%2A",
            "@multimediatype": "JPEG image file",
            "@type": "IMAGE-HIGH-RES",
            "@size": "175300",
            "@ref": "ga1",
            "@mimetype": "image/jpeg"
          },
          {
            "@category": "standard",
            "@_fa": "true",
            "$": "https://api.elsevier.com/content/object/eid/1-s2.0-S2468823122007659-mmc1.docx?httpAccept=%2A%2F%2A",
            "@multimediatype": "Microsoft Word file",
            "@type": "APPLICATION",
            "@size": "95074277",
            "@ref": "mmc1",
            "@mimetype": "application/word"
          },
          {
            "@category": "standard",
            "@_fa": "true",
            "$": "https://api.elsevier.com/content/object/eid/1-s2.0-S2468823122007659-mmc2.docx?httpAccept=%2A%2F%2A",
            "@multimediatype": "Microsoft Word file",
            "@type": "APPLICATION",
            "@size": "9392555",
            "@ref": "mmc2",
            "@mimetype": "application/word"
          },
          {
            "@category": "thumbnail",
            "@_fa": "true",
            "$": "https://api.elsevier.com/content/object/eid/1-s2.0-S2468823122007659-si1.svg?httpAccept=%2A%2F%2A",
            "@multimediatype": "Scalable Vector Graphics file",
            "@type": "ALTIMG",
            "@size": "1925",
            "@ref": "si1",
            "@mimetype": "image/svg+xml"
          },
          {
            "@category": "thumbnail",
            "@_fa": "true",
            "$": "https://api.elsevier.com/content/object/eid/1-s2.0-S2468823122007659-si10.svg?httpAccept=%2A%2F%2A",
            "@multimediatype": "Scalable Vector Graphics file",
            "@type": "ALTIMG",
            "@size": "8751",
            "@ref": "si10",
            "@mimetype": "image/svg+xml"
          },
          {
            "@category": "thumbnail",
            "@_fa": "true",
            "$": "https://api.elsevier.com/content/object/eid/1-s2.0-S2468823122007659-si11.svg?httpAccept=%2A%2F%2A",
            "@multimediatype": "Scalable Vector Graphics file",
            "@type": "ALTIMG",
            "@size": "6489",
            "@ref": "si11",
            "@mimetype": "image/svg+xml"
          },
          {
            "@category": "thumbnail",
            "@_fa": "true",
            "$": "https://api.elsevier.com/content/object/eid/1-s2.0-S2468823122007659-si12.svg?httpAccept=%2A%2F%2A",
            "@multimediatype": "Scalable Vector Graphics file",
            "@type": "ALTIMG",
            "@size": "3762",
            "@ref": "si12",
            "@mimetype": "image/svg+xml"
          },
          {
            "@category": "thumbnail",
            "@_fa": "true",
            "$": "https://api.elsevier.com/content/object/eid/1-s2.0-S2468823122007659-si13.svg?httpAccept=%2A%2F%2A",
            "@multimediatype": "Scalable Vector Graphics file",
            "@type": "ALTIMG",
            "@size": "4825",
            "@ref": "si13",
            "@mimetype": "image/svg+xml"
          },
          {
            "@category": "thumbnail",
            "@_fa": "true",
            "$": "https://api.elsevier.com/content/object/eid/1-s2.0-S2468823122007659-si14.svg?httpAccept=%2A%2F%2A",
            "@multimediatype": "Scalable Vector Graphics file",
            "@type": "ALTIMG",
            "@size": "6861",
            "@ref": "si14",
            "@mimetype": "image/svg+xml"
          },
          {
            "@category": "thumbnail",
            "@_fa": "true",
            "$": "https://api.elsevier.com/content/object/eid/1-s2.0-S2468823122007659-si15.svg?httpAccept=%2A%2F%2A",
            "@multimediatype": "Scalable Vector Graphics file",
            "@type": "ALTIMG",
            "@size": "5546",
            "@ref": "si15",
            "@mimetype": "image/svg+xml"
          },
          {
            "@category": "thumbnail",
            "@_fa": "true",
            "$": "https://api.elsevier.com/content/object/eid/1-s2.0-S2468823122007659-si16.svg?httpAccept=%2A%2F%2A",
            "@multimediatype": "Scalable Vector Graphics file",
            "@type": "ALTIMG",
            "@size": "7777",
            "@ref": "si16",
            "@mimetype": "image/svg+xml"
          },
          {
            "@category": "thumbnail",
            "@_fa": "true",
            "$": "https://api.elsevier.com/content/object/eid/1-s2.0-S2468823122007659-si17.svg?httpAccept=%2A%2F%2A",
            "@multimediatype": "Scalable Vector Graphics file",
            "@type": "ALTIMG",
            "@size": "6400",
            "@ref": "si17",
            "@mimetype": "image/svg+xml"
          },
          {
            "@category": "thumbnail",
            "@_fa": "true",
            "$": "https://api.elsevier.com/content/object/eid/1-s2.0-S2468823122007659-si18.svg?httpAccept=%2A%2F%2A",
            "@multimediatype": "Scalable Vector Graphics file",
            "@type": "ALTIMG",
            "@size": "7134",
            "@ref": "si18",
            "@mimetype": "image/svg+xml"
          },
          {
            "@category": "thumbnail",
            "@_fa": "true",
            "$": "https://api.elsevier.com/content/object/eid/1-s2.0-S2468823122007659-si19.svg?httpAccept=%2A%2F%2A",
            "@multimediatype": "Scalable Vector Graphics file",
            "@type": "ALTIMG",
            "@size": "6783",
            "@ref": "si19",
            "@mimetype": "image/svg+xml"
          },
          {
            "@category": "thumbnail",
            "@_fa": "true",
            "$": "https://api.elsevier.com/content/object/eid/1-s2.0-S2468823122007659-si2.svg?httpAccept=%2A%2F%2A",
            "@multimediatype": "Scalable Vector Graphics file",
            "@type": "ALTIMG",
            "@size": "1633",
            "@ref": "si2",
            "@mimetype": "image/svg+xml"
          },
          {
            "@category": "thumbnail",
            "@_fa": "true",
            "$": "https://api.elsevier.com/content/object/eid/1-s2.0-S2468823122007659-si20.svg?httpAccept=%2A%2F%2A",
            "@multimediatype": "Scalable Vector Graphics file",
            "@type": "ALTIMG",
            "@size": "2434",
            "@ref": "si20",
            "@mimetype": "image/svg+xml"
          },
          {
            "@category": "thumbnail",
            "@_fa": "true",
            "$": "https://api.elsevier.com/content/object/eid/1-s2.0-S2468823122007659-si21.svg?httpAccept=%2A%2F%2A",
            "@multimediatype": "Scalable Vector Graphics file",
            "@type": "ALTIMG",
            "@size": "4009",
            "@ref": "si21",
            "@mimetype": "image/svg+xml"
          },
          {
            "@category": "thumbnail",
            "@_fa": "true",
            "$": "https://api.elsevier.com/content/object/eid/1-s2.0-S2468823122007659-si22.svg?httpAccept=%2A%2F%2A",
            "@multimediatype": "Scalable Vector Graphics file",
            "@type": "ALTIMG",
            "@size": "3020",
            "@ref": "si22",
            "@mimetype": "image/svg+xml"
          },
          {
            "@category": "thumbnail",
            "@_fa": "true",
            "$": "https://api.elsevier.com/content/object/eid/1-s2.0-S2468823122007659-si23.svg?httpAccept=%2A%2F%2A",
            "@multimediatype": "Scalable Vector Graphics file",
            "@type": "ALTIMG",
            "@size": "3956",
            "@ref": "si23",
            "@mimetype": "image/svg+xml"
          },
          {
            "@category": "thumbnail",
            "@_fa": "true",
            "$": "https://api.elsevier.com/content/object/eid/1-s2.0-S2468823122007659-si24.svg?httpAccept=%2A%2F%2A",
            "@multimediatype": "Scalable Vector Graphics file",
            "@type": "ALTIMG",
            "@size": "4524",
            "@ref": "si24",
            "@mimetype": "image/svg+xml"
          },
          {
            "@category": "thumbnail",
            "@_fa": "true",
            "$": "https://api.elsevier.com/content/object/eid/1-s2.0-S2468823122007659-si25.svg?httpAccept=%2A%2F%2A",
            "@multimediatype": "Scalable Vector Graphics file",
            "@type": "ALTIMG",
            "@size": "5857",
            "@ref": "si25",
            "@mimetype": "image/svg+xml"
          },
          {
            "@category": "thumbnail",
            "@_fa": "true",
            "$": "https://api.elsevier.com/content/object/eid/1-s2.0-S2468823122007659-si26.svg?httpAccept=%2A%2F%2A",
            "@multimediatype": "Scalable Vector Graphics file",
            "@type": "ALTIMG",
            "@size": "5034",
            "@ref": "si26",
            "@mimetype": "image/svg+xml"
          },
          {
            "@category": "thumbnail",
            "@_fa": "true",
            "$": "https://api.elsevier.com/content/object/eid/1-s2.0-S2468823122007659-si27.svg?httpAccept=%2A%2F%2A",
            "@multimediatype": "Scalable Vector Graphics file",
            "@type": "ALTIMG",
            "@size": "5702",
            "@ref": "si27",
            "@mimetype": "image/svg+xml"
          },
          {
            "@category": "thumbnail",
            "@_fa": "true",
            "$": "https://api.elsevier.com/content/object/eid/1-s2.0-S2468823122007659-si28.svg?httpAccept=%2A%2F%2A",
            "@multimediatype": "Scalable Vector Graphics file",
            "@type": "ALTIMG",
            "@size": "4929",
            "@ref": "si28",
            "@mimetype": "image/svg+xml"
          },
          {
            "@category": "thumbnail",
            "@_fa": "true",
            "$": "https://api.elsevier.com/content/object/eid/1-s2.0-S2468823122007659-si29.svg?httpAccept=%2A%2F%2A",
            "@multimediatype": "Scalable Vector Graphics file",
            "@type": "ALTIMG",
            "@size": "5929",
            "@ref": "si29",
            "@mimetype": "image/svg+xml"
          },
          {
            "@category": "thumbnail",
            "@_fa": "true",
            "$": "https://api.elsevier.com/content/object/eid/1-s2.0-S2468823122007659-si3.svg?httpAccept=%2A%2F%2A",
            "@multimediatype": "Scalable Vector Graphics file",
            "@type": "ALTIMG",
            "@size": "2042",
            "@ref": "si3",
            "@mimetype": "image/svg+xml"
          },
          {
            "@category": "thumbnail",
            "@_fa": "true",
            "$": "https://api.elsevier.com/content/object/eid/1-s2.0-S2468823122007659-si30.svg?httpAccept=%2A%2F%2A",
            "@multimediatype": "Scalable Vector Graphics file",
            "@type": "ALTIMG",
            "@size": "5593",
            "@ref": "si30",
            "@mimetype": "image/svg+xml"
          },
          {
            "@category": "thumbnail",
            "@_fa": "true",
            "$": "https://api.elsevier.com/content/object/eid/1-s2.0-S2468823122007659-si31.svg?httpAccept=%2A%2F%2A",
            "@multimediatype": "Scalable Vector Graphics file",
            "@type": "ALTIMG",
            "@size": "10183",
            "@ref": "si31",
            "@mimetype": "image/svg+xml"
          },
          {
            "@category": "thumbnail",
            "@_fa": "true",
            "$": "https://api.elsevier.com/content/object/eid/1-s2.0-S2468823122007659-si32.svg?httpAccept=%2A%2F%2A",
            "@multimediatype": "Scalable Vector Graphics file",
            "@type": "ALTIMG",
            "@size": "2377",
            "@ref": "si32",
            "@mimetype": "image/svg+xml"
          },
          {
            "@category": "thumbnail",
            "@_fa": "true",
            "$": "https://api.elsevier.com/content/object/eid/1-s2.0-S2468823122007659-si33.svg?httpAccept=%2A%2F%2A",
            "@multimediatype": "Scalable Vector Graphics file",
            "@type": "ALTIMG",
            "@size": "3678",
            "@ref": "si33",
            "@mimetype": "image/svg+xml"
          },
          {
            "@category": "thumbnail",
            "@_fa": "true",
            "$": "https://api.elsevier.com/content/object/eid/1-s2.0-S2468823122007659-si34.svg?httpAccept=%2A%2F%2A",
            "@multimediatype": "Scalable Vector Graphics file",
            "@type": "ALTIMG",
            "@size": "2430",
            "@ref": "si34",
            "@mimetype": "image/svg+xml"
          },
          {
            "@category": "thumbnail",
            "@_fa": "true",
            "$": "https://api.elsevier.com/content/object/eid/1-s2.0-S2468823122007659-si35.svg?httpAccept=%2A%2F%2A",
            "@multimediatype": "Scalable Vector Graphics file",
            "@type": "ALTIMG",
            "@size": "2130",
            "@ref": "si35",
            "@mimetype": "image/svg+xml"
          },
          {
            "@category": "thumbnail",
            "@_fa": "true",
            "$": "https://api.elsevier.com/content/object/eid/1-s2.0-S2468823122007659-si36.svg?httpAccept=%2A%2F%2A",
            "@multimediatype": "Scalable Vector Graphics file",
            "@type": "ALTIMG",
            "@size": "3425",
            "@ref": "si36",
            "@mimetype": "image/svg+xml"
          },
          {
            "@category": "thumbnail",
            "@_fa": "true",
            "$": "https://api.elsevier.com/content/object/eid/1-s2.0-S2468823122007659-si37.svg?httpAccept=%2A%2F%2A",
            "@multimediatype": "Scalable Vector Graphics file",
            "@type": "ALTIMG",
            "@size": "12013",
            "@ref": "si37",
            "@mimetype": "image/svg+xml"
          },
          {
            "@category": "thumbnail",
            "@_fa": "true",
            "$": "https://api.elsevier.com/content/object/eid/1-s2.0-S2468823122007659-si38.svg?httpAccept=%2A%2F%2A",
            "@multimediatype": "Scalable Vector Graphics file",
            "@type": "ALTIMG",
            "@size": "12752",
            "@ref": "si38",
            "@mimetype": "image/svg+xml"
          },
          {
            "@category": "thumbnail",
            "@_fa": "true",
            "$": "https://api.elsevier.com/content/object/eid/1-s2.0-S2468823122007659-si39.svg?httpAccept=%2A%2F%2A",
            "@multimediatype": "Scalable Vector Graphics file",
            "@type": "ALTIMG",
            "@size": "9567",
            "@ref": "si39",
            "@mimetype": "image/svg+xml"
          },
          {
            "@category": "thumbnail",
            "@_fa": "true",
            "$": "https://api.elsevier.com/content/object/eid/1-s2.0-S2468823122007659-si4.svg?httpAccept=%2A%2F%2A",
            "@multimediatype": "Scalable Vector Graphics file",
            "@type": "ALTIMG",
            "@size": "1737",
            "@ref": "si4",
            "@mimetype": "image/svg+xml"
          },
          {
            "@category": "thumbnail",
            "@_fa": "true",
            "$": "https://api.elsevier.com/content/object/eid/1-s2.0-S2468823122007659-si40.svg?httpAccept=%2A%2F%2A",
            "@multimediatype": "Scalable Vector Graphics file",
            "@type": "ALTIMG",
            "@size": "9946",
            "@ref": "si40",
            "@mimetype": "image/svg+xml"
          },
          {
            "@category": "thumbnail",
            "@_fa": "true",
            "$": "https://api.elsevier.com/content/object/eid/1-s2.0-S2468823122007659-si41.svg?httpAccept=%2A%2F%2A",
            "@multimediatype": "Scalable Vector Graphics file",
            "@type": "ALTIMG",
            "@size": "9658",
            "@ref": "si41",
            "@mimetype": "image/svg+xml"
          },
          {
            "@category": "thumbnail",
            "@_fa": "true",
            "$": "https://api.elsevier.com/content/object/eid/1-s2.0-S2468823122007659-si42.svg?httpAccept=%2A%2F%2A",
            "@multimediatype": "Scalable Vector Graphics file",
            "@type": "ALTIMG",
            "@size": "8639",
            "@ref": "si42",
            "@mimetype": "image/svg+xml"
          },
          {
            "@category": "thumbnail",
            "@_fa": "true",
            "$": "https://api.elsevier.com/content/object/eid/1-s2.0-S2468823122007659-si5.svg?httpAccept=%2A%2F%2A",
            "@multimediatype": "Scalable Vector Graphics file",
            "@type": "ALTIMG",
            "@size": "2043",
            "@ref": "si5",
            "@mimetype": "image/svg+xml"
          },
          {
            "@category": "thumbnail",
            "@_fa": "true",
            "$": "https://api.elsevier.com/content/object/eid/1-s2.0-S2468823122007659-si6.svg?httpAccept=%2A%2F%2A",
            "@multimediatype": "Scalable Vector Graphics file",
            "@type": "ALTIMG",
            "@size": "2547",
            "@ref": "si6",
            "@mimetype": "image/svg+xml"
          },
          {
            "@category": "thumbnail",
            "@_fa": "true",
            "$": "https://api.elsevier.com/content/object/eid/1-s2.0-S2468823122007659-si7.svg?httpAccept=%2A%2F%2A",
            "@multimediatype": "Scalable Vector Graphics file",
            "@type": "ALTIMG",
            "@size": "2194",
            "@ref": "si7",
            "@mimetype": "image/svg+xml"
          },
          {
            "@category": "thumbnail",
            "@_fa": "true",
            "$": "https://api.elsevier.com/content/object/eid/1-s2.0-S2468823122007659-si8.svg?httpAccept=%2A%2F%2A",
            "@multimediatype": "Scalable Vector Graphics file",
            "@type": "ALTIMG",
            "@size": "2546",
            "@ref": "si8",
            "@mimetype": "image/svg+xml"
          },
          {
            "@category": "thumbnail",
            "@_fa": "true",
            "$": "https://api.elsevier.com/content/object/eid/1-s2.0-S2468823122007659-si9.svg?httpAccept=%2A%2F%2A",
            "@multimediatype": "Scalable Vector Graphics file",
            "@type": "ALTIMG",
            "@size": "2599",
            "@ref": "si9",
            "@mimetype": "image/svg+xml"
          },
          {
            "@category": "standard",
            "@_fa": "true",
            "$": "https://api.elsevier.com/content/object/eid/1-s2.0-S2468823122007659-am.pdf?httpAccept=%2A%2F%2A",
            "@multimediatype": "Acrobat PDF file",
            "@type": "AAM-PDF",
            "@size": "3694971",
            "@ref": "am",
            "@mimetype": "application/pdf"
          }
        ]
      },
      "link": {
        "@rel": "abstract",
        "@href": "https://api.elsevier.com/content/abstract/scopus_id/85144332789"
      }
    }
  }
}