{
  "metadata": {
    "title": "Design and optimization of CuCo-LDO catalysts via ZIF-67 sacrificial templates for enhanced toluene oxidation: A comprehensive study on morphology, structure, and catalytic activity",
    "authors": "; ; ",
    "journal": "Molecular Catalysis",
    "date": "2024-05-01",
    "doi": "10.1016/j.mcat.2024.114113",
    "abstract": "",
    "uri": "https://api.elsevier.com/content/article/pii/S2468823124002967",
    "pii": "S2468823124002967"
  },
  "fulltext": {
    "full-text-retrieval-response": {
      "scopus-eid": "2-s2.0-85189745202",
      "originalText": "serial JL 315758 291210 291744 291790 291809 31 Molecular Catalysis MOLECULARCATALYSIS 2024-04-09 2024-04-09 2024-04-09 2024-04-09 2024-04-25T19:58:46 1-s2.0-S2468823124002967 S2468-8231(24)00296-7 S2468823124002967 10.1016/j.mcat.2024.114113 S300 S300.1 FULL-TEXT 1-s2.0-S2468823124X00061 2024-05-25T12:02:52.610825Z 0 0 20240501 2024 2024-04-09T22:13:19.724873Z absattachment articleinfo articlenumber articletitlenorm authfirstinitialnorm authfirstsurnamenorm cid cids contenttype copyright crossmark dateloaded dateloadedtxt datesearch datesort dateupdated dco docsubtype doctype doi eid ewtransactionid hubeid indexeddate issn issnnorm itemstage itemtransactionid itemweight openaccess openarchive pg pgfirst pii piinorm pubdatestart pubdatetxt pubyr sectiontitle sortorder srctitle srctitlenorm srctype ssids alllist content subj subheadings suppl tomb volfirst volissue volumelist webpdf webpdfpagecount yearnav figure table body mmlmath acknowledge affil articletitle auth authfirstini authfull authkeywords authlast grantnumber grantsponsor grantsponsorid highlightsabst orcid primabst ref specialabst 2468-8231 24688231 true 560 560 C Volume 560 11 114113 114113 114113 20240501 1 May 2024 2024-05-01 2024 Regular Papers article fla © 2024 Published by Elsevier B.V. DESIGNOPTIMIZATIONCUCOLDOCATALYSTSVIAZIF67SACRIFICIALTEMPLATESFORENHANCEDTOLUENEOXIDATIONACOMPREHENSIVESTUDYMORPHOLOGYSTRUCTURECATALYTICACTIVITY XU Y 1 Introduction 2 Experimental section 2.1 Catalyst preparation 2.2 Catalyst characterization 2.3 Catalytic activity assessment 3 Results 3.1 Structure analysis 3.2 Morphological and structural analysis 3.3 Surface chemical analysis 3.4 Reduction performance analysis 3.5 Surface oxygen species analysis 3.6 Catalytic performance analysis 4 Discussion 5 Conclusions CRediT authorship contribution statement Acknowledgements References LOU 2022 132523 B ZHU 2020 122102 L KUMAR 2023 162163 P CAO 2022 232 263 Y GAO 2019 1 10 G JEUNG 2019 1262 D REN 2018 498 509 Q LIU 2022 36633 36643 Y LI 2020 88 95 M LI 2020 127173 C RIVERATORRENTE 2019 3059 3069 M KONG 2018 161 168 W CHEN 2018 4636 4641 L XU 2018 8654 8658 H WANG 2020 122757 Y FENG 2018 145 153 X KHAN 2018 50 58 A ZHANG 2019 109568 H LIU 2010 317 323 H CHEN 2019 6790 6800 M JIN 2017 45 52 M GAO 2021 127829 Z GENTY 2019 163 172 E CHANG 2018 15 25 T REN 2023 130 140 Q ZHONG 2020 125375 J ZHAO 2019 77 86 J ZHANG 2017 2317 2327 S LUO 2019 8428 8438 J LI 2019 61 70 X SONG 2014 4629 4639 W CAO 2021 7033 7042 C HE 2015 216 225 C XUE 2007 167 174 L SUN 2016 540 545 Y ZHANG 2019 1132 1140 S WANG 2017 392 402 C XIE 2017 282 292 S ANPO 2021 259 280 M ZANG 2022 137414 P CAO 2020 122802 J KARIM 2022 100965 A YANG 2020 100944 J ZHANG 2022 112043 Y DUAN 2019 15772 15777 Y WEI 2022 121694 X HU 2024 112213 G LI 2020 118827 Z XUX2024X114113 XUX2024X114113XY 2026-04-09T00:00:00.000Z 2026-04-09T00:00:00.000Z http://creativecommons.org/licenses/by-nc-nd/4.0/ © 2024 Published by Elsevier B.V. 2024-04-26T12:30:37.678Z http://vtw.elsevier.com/data/voc/AddOnTypes/50.7/aggregated-refined National Natural Science Foundation of China 52270110 NSFC National Natural Science Foundation of China http://data.elsevier.com/vocabulary/SciValFunders/501100001809 http://sws.geonames.org/1814991/ The authors are grateful to the financial support from the National Natural Science Foundation of China (No. 52270110). https://doi.org/10.15223/policy-017 https://doi.org/10.15223/policy-037 https://doi.org/10.15223/policy-012 https://doi.org/10.15223/policy-029 https://doi.org/10.15223/policy-004 item S2468-8231(24)00296-7 S2468823124002967 1-s2.0-S2468823124002967 10.1016/j.mcat.2024.114113 315758 2024-05-25T12:02:52.610825Z 2024-05-01 1-s2.0-S2468823124002967-main.pdf https://s3-eu-west-1.amazonaws.com/prod-ucs-content-store-eu-west/content/pii:S2468823124002967/MAIN/application/pdf/ef9f1fa79cd4d5ca48bc083160424e06/main.pdf main.pdf pdf true 5887617 MAIN 9 1-s2.0-S2468823124002967-main_1.png https://s3-eu-west-1.amazonaws.com/prod-ucs-content-store-eu-west/content/pii:S2468823124002967/PREVIEW/image/png/bb8c666eeb6ca13599e03681c2e0b23e/main_1.png main_1.png png 59357 849 656 IMAGE-WEB-PDF 1 1-s2.0-S2468823124002967-gr6.jpg https://s3-eu-west-1.amazonaws.com/prod-ucs-content-store-eu-west/content/pii:S2468823124002967/gr6/DOWNSAMPLED/image/jpeg/57dd2a0120f3791909f188bc6a031031/gr6.jpg gr6 gr6.jpg jpg 36781 205 565 IMAGE-DOWNSAMPLED 1-s2.0-S2468823124002967-gr5.jpg https://s3-eu-west-1.amazonaws.com/prod-ucs-content-store-eu-west/content/pii:S2468823124002967/gr5/DOWNSAMPLED/image/jpeg/8980b71b2b0acec5a1b51c45a92963ec/gr5.jpg gr5 gr5.jpg jpg 39671 282 565 IMAGE-DOWNSAMPLED 1-s2.0-S2468823124002967-gr4.jpg https://s3-eu-west-1.amazonaws.com/prod-ucs-content-store-eu-west/content/pii:S2468823124002967/gr4/DOWNSAMPLED/image/jpeg/fd59a4c372bc998cf059b0e78647326b/gr4.jpg gr4 gr4.jpg jpg 28262 260 339 IMAGE-DOWNSAMPLED 1-s2.0-S2468823124002967-gr3.jpg https://s3-eu-west-1.amazonaws.com/prod-ucs-content-store-eu-west/content/pii:S2468823124002967/gr3/DOWNSAMPLED/image/jpeg/311ad53342f58a080e04dbadfb20f020/gr3.jpg gr3 gr3.jpg jpg 66144 278 678 IMAGE-DOWNSAMPLED 1-s2.0-S2468823124002967-gr2.jpg https://s3-eu-west-1.amazonaws.com/prod-ucs-content-store-eu-west/content/pii:S2468823124002967/gr2/DOWNSAMPLED/image/jpeg/1f195b08df55aae714ab28a7fe04457f/gr2.jpg gr2 gr2.jpg jpg 226768 823 659 IMAGE-DOWNSAMPLED 1-s2.0-S2468823124002967-ga1.jpg https://s3-eu-west-1.amazonaws.com/prod-ucs-content-store-eu-west/content/pii:S2468823124002967/ga1/DOWNSAMPLED/image/jpeg/11c41385b43c59148300f6bcba781b4d/ga1.jpg ga1 true ga1.jpg jpg 33314 200 492 IMAGE-DOWNSAMPLED 1-s2.0-S2468823124002967-gr1.jpg https://s3-eu-west-1.amazonaws.com/prod-ucs-content-store-eu-west/content/pii:S2468823124002967/gr1/DOWNSAMPLED/image/jpeg/fd8e620236ad8999ce40641e094b75e9/gr1.jpg gr1 gr1.jpg jpg 110659 542 678 IMAGE-DOWNSAMPLED 1-s2.0-S2468823124002967-gr6.sml https://s3-eu-west-1.amazonaws.com/prod-ucs-content-store-eu-west/content/pii:S2468823124002967/gr6/THUMBNAIL/image/gif/2207b119ad6c274e73bf02f8f5c97442/gr6.sml gr6 gr6.sml sml 7048 79 219 IMAGE-THUMBNAIL 1-s2.0-S2468823124002967-gr5.sml https://s3-eu-west-1.amazonaws.com/prod-ucs-content-store-eu-west/content/pii:S2468823124002967/gr5/THUMBNAIL/image/gif/19c7c33b647472c32af28f63999bcc70/gr5.sml gr5 gr5.sml sml 7696 109 219 IMAGE-THUMBNAIL 1-s2.0-S2468823124002967-gr4.sml https://s3-eu-west-1.amazonaws.com/prod-ucs-content-store-eu-west/content/pii:S2468823124002967/gr4/THUMBNAIL/image/gif/591f5d2cd75ab9392d0bfe6bd23df693/gr4.sml gr4 gr4.sml sml 9192 164 214 IMAGE-THUMBNAIL 1-s2.0-S2468823124002967-gr3.sml https://s3-eu-west-1.amazonaws.com/prod-ucs-content-store-eu-west/content/pii:S2468823124002967/gr3/THUMBNAIL/image/gif/59acc09d39b13c0810c06e0a77db054b/gr3.sml gr3 gr3.sml sml 9738 90 219 IMAGE-THUMBNAIL 1-s2.0-S2468823124002967-gr2.sml https://s3-eu-west-1.amazonaws.com/prod-ucs-content-store-eu-west/content/pii:S2468823124002967/gr2/THUMBNAIL/image/gif/22d04515dfdd5a0098c3e63f9a93e202/gr2.sml gr2 gr2.sml sml 18018 164 131 IMAGE-THUMBNAIL 1-s2.0-S2468823124002967-ga1.sml https://s3-eu-west-1.amazonaws.com/prod-ucs-content-store-eu-west/content/pii:S2468823124002967/ga1/THUMBNAIL/image/gif/da3a2a1acd195f1323109a6462cf862d/ga1.sml ga1 true ga1.sml sml 9685 89 219 IMAGE-THUMBNAIL 1-s2.0-S2468823124002967-gr1.sml https://s3-eu-west-1.amazonaws.com/prod-ucs-content-store-eu-west/content/pii:S2468823124002967/gr1/THUMBNAIL/image/gif/33cad4ce0c262c08752cf4ce7ad168fb/gr1.sml gr1 gr1.sml sml 13890 164 205 IMAGE-THUMBNAIL 1-s2.0-S2468823124002967-gr6_lrg.jpg https://s3-eu-west-1.amazonaws.com/prod-ucs-content-store-eu-west/content/pii:S2468823124002967/HIGHRES/image/jpeg/f98097421d3a9d7ada4a508b3b70c03d/gr6_lrg.jpg gr6 gr6_lrg.jpg jpg 229744 907 2500 IMAGE-HIGH-RES 1-s2.0-S2468823124002967-gr5_lrg.jpg https://s3-eu-west-1.amazonaws.com/prod-ucs-content-store-eu-west/content/pii:S2468823124002967/HIGHRES/image/jpeg/d86808323dac648fedff6e31ecc34b28/gr5_lrg.jpg gr5 gr5_lrg.jpg jpg 266212 1246 2500 IMAGE-HIGH-RES 1-s2.0-S2468823124002967-gr4_lrg.jpg https://s3-eu-west-1.amazonaws.com/prod-ucs-content-store-eu-west/content/pii:S2468823124002967/HIGHRES/image/jpeg/133f54d98603ef6c545bf659ed8e29d1/gr4_lrg.jpg gr4 gr4_lrg.jpg jpg 180451 1150 1500 IMAGE-HIGH-RES 1-s2.0-S2468823124002967-gr3_lrg.jpg https://s3-eu-west-1.amazonaws.com/prod-ucs-content-store-eu-west/content/pii:S2468823124002967/HIGHRES/image/jpeg/c8c73fb4901eddb6fd7a3f154f521757/gr3_lrg.jpg gr3 gr3_lrg.jpg jpg 521162 1232 3000 IMAGE-HIGH-RES 1-s2.0-S2468823124002967-gr2_lrg.jpg https://s3-eu-west-1.amazonaws.com/prod-ucs-content-store-eu-west/content/pii:S2468823124002967/HIGHRES/image/jpeg/36db93eb63a5ef4696ef24c0a0b09e5c/gr2_lrg.jpg gr2 gr2_lrg.jpg jpg 1989202 3642 2917 IMAGE-HIGH-RES 1-s2.0-S2468823124002967-ga1_lrg.jpg https://s3-eu-west-1.amazonaws.com/prod-ucs-content-store-eu-west/content/pii:S2468823124002967/HIGHRES/image/jpeg/8ff20e148c3c3a996d0c17b3e407d753/ga1_lrg.jpg ga1 true ga1_lrg.jpg jpg 222814 886 2179 IMAGE-HIGH-RES 1-s2.0-S2468823124002967-gr1_lrg.jpg https://s3-eu-west-1.amazonaws.com/prod-ucs-content-store-eu-west/content/pii:S2468823124002967/HIGHRES/image/jpeg/1627ab490e719684a29db37c44b8b949/gr1_lrg.jpg gr1 gr1_lrg.jpg jpg 742346 2400 3000 IMAGE-HIGH-RES 1-s2.0-S2468823124002967-si1.svg https://s3-eu-west-1.amazonaws.com/prod-ucs-content-store-eu-west/content/pii:S2468823124002967/image/svg+xml/39049076abe54cbd841db57460f7a569/si1.svg si1 si1.svg svg 11832 ALTIMG 1-s2.0-S2468823124002967-am.pdf am am.pdf pdf 3104200 AAM-PDF https://s3-eu-west-1.amazonaws.com/prod-ucs-content-store-eu-west/content/egi:1061ZHPWN9P/MAIN/application/pdf/fb69ee98b3009b68d133708249d1cb91/am.pdf MCAT 114113 114113 S2468-8231(24)00296-7 10.1016/j.mcat.2024.114113 Fig. 1 XRD patterns (A) of (a) ZIF-67, (b) 1CuCo-LDH, (c) 2CuCo-LDH, (d) 3CuCo-LDH, (e) Cu-LDH; (B) of (a) Co3O4, (b) 1CuCo-LDO, (c) 2CuCo-LDO, (d) 3CuCo-LDO, (e) CuO; (C) FT-IR spectra of (a) ZIF-67, (b) 1CuCo-LDH, (c) 2CuCo-LDH, (d) 3CuCo-LDH and (e) Cu-LDH; (D) N2 adsorption/desorption isotherms and (E) the pore size distribution curves of (a) Co3O4, (b) 1CuCo-LDO, (c) 2CuCo-LDO, (d) 3CuCo-LDO and (e) CuO. Fig 1 Fig. 2 FESEM, TEM and HRTEM images of (a1) ZIF-67, (a2-a4) Co3O4, (b1-d1) 1CuCo-LDH, 2CuCo-LDH and 3CuCo-LDH (b2-d4) 1CuCo-LDO, 2CuCo-LDO, 3CuCo-LDO, (e1) Cu-LDH and (e2-e4) CuO. Fig 2 Fig. 3 XPS spectra of (a) Co3O4, (b) 1CuCo-LDO, (c) 2CuCo-LDO, (d) 3CuCo-LDO and (e) CuO. Fig 3 Fig. 4 H2-TPR profiles of (a) Co3O4, (b) 1CuCo-LDO, (c) 2CuCo-LDO, (d) 3CuCo-LDO and (e) CuO. Fig 4 Fig. 5 O2-TPD profiles of (a) Co3O4, (b) 1CuCo-LDO, (c) 2CuCo-LDO, (d) 3CuCo-LDO and (e) CuO. Fig 5 Fig. 6 Toluene conversion (A) and Arrhenius plots (B) over (a) Co3O4, (b) 1CuCo-LDO, (c) 2CuCo-LDO, (d) 3CuCo-LDO and (e) CuO. Reaction conditions: 0.2 g catalyst, 1000 ppm toluene, 20 % O2, N2 balance and GHSV = 24,000 mL/g/h. Fig 6 Table 1 The XRD, N2 adsorption/desorption and EDS results of Co3O4, xCuCo-LDO and CuO. Table 1 Sample d111 a (Å) Dcrys. b (nm) SBET c (m2/g) Dp d (nm) Vp e (cm3/g) Elemental Content f (wt.%) O Cu Co Co3O4 8.095 13.0 64.2 27.5 0.41 23.79 / 76.21 1CuCo-LDO 8.096 11.8 59.8 22.0 0.30 25.83 0.25 73.92 2CuCo-LDO 9.099 10.7 53.4 15.6 0.20 29.76 4.07 66.17 3CuCo-LDO 8.101 9.1 52.5 18.3 0.23 27.34 20.14 52.51 CuO / / 10.2 10.1 0.03 22.97 77.03 / a,b Crystallite size of Co3O4 were calculated by the Scherrer equation. c Specific surface area measured through the BET method. d,e Average diameter and pore volume calculated by the BJH method. f Measured by EDS. Table 2 The H2-TPR, O2-TPD and XPS results of Co3O4, xCuCo-LDO and CuO. Table 2 Sample H2 consumption a (mmol/gcat) O2 desorption b (mmol/gcat) (Osur+Oads)/Olat Co3+/Co2+ Peak α Peak β Total 50–150 ℃ 200–450 ℃ >700 ℃ Co3O4 7.58 30.70 38.28 0.84 0.43 8.23 0.756 1.03 1CuCo-LDO 10.23 27.94 38.17 0.95 0.62 8.11 0.772 1.07 2CuCo-LDO 23.01 13.04 36.05 1.27 0.65 8.01 0.875 1.47 3CuCo-LDO 23.74 10.76 34.50 1.05 1.22 7.95 0.983 1.59 CuO / / 26.94 0.72 0.21 12.40 0.521 / a Estimated by quantitatively analyzing the results of TPR. b Estimated by quantitatively analyzing the results of TPD. Table 3 The catalytic activity of Co3O4, xCuCo-LDO and CuO for toluene. Table 3 Sample T 10 (℃) T 50 (℃) T 90 (℃) a r × 10−2 (mol·g−1·s−1) E a b (kJ/mol) Co3O4 195 232 260 3.18 109.7 1CuCo-LDO 190 227 257 3.87 101.8 2CuCo-LDO 178 218 245 6.05 92.2 3CuCo-LDO 170 210 232 8.41 85.6 CuO 202 239 273 2.47 127.5 a Reaction rate calculated at 210 ℃. b Apparent activation energy estimated using the Arrhenius plots. Design and optimization of CuCo-LDO catalysts via ZIF-67 sacrificial templates for enhanced toluene oxidation: A comprehensive study on morphology, structure, and catalytic activity Yang Xu Writing – review & editing Writing – original draft Methodology Investigation Formal analysis Data curation Jinghuan Chen Writing – review & editing Supervision Resources ⁎ Zhiping Ye Writing – review & editing Supervision Jiade Wang Supervision Resources Funding acquisition Key Laboratory of Microbial Technology for Industrial Pollution Control, College of Environment, Zhejiang University of Technology, Hangzhou 310014, China Key Laboratory of Microbial Technology for Industrial Pollution Control, College of Environment Zhejiang University of Technology Hangzhou 310014 China Key Laboratory of Microbial Technology for Industrial Pollution Control, College of Environment, Zhejiang University of Technology, Hangzhou 310014, China ⁎ Corresponding author. The investigation into the development of an active transition-metal oxide catalyst with controllable morphology for the degradation of volatile organic compounds (VOCs) is a subject of considerable importance and warrants further exploration. In this study, ZIF-67 was prepared and employed as a sacrificial template, with varying quantities of Cu ions incorporated to synthesize layered copper-cobalt double oxide (CuCo-LDO) featuring a modifiable surface state. A comprehensive characterization of the CuCo-LDO catalysts was conducted, encompassing structural properties, morphology, surface chemical state, and redox properties, utilizing a range of analytical techniques. Subsequent evaluations included testing the catalytic activity for toluene oxidation and assessing stability performance. The results revealed that differing Cu contents played a pivotal role in inducing changes in the morphology and structure of CuCo-LDO, thereby significantly influencing its oxidation activity towards toluene. Notably, the flower-like structure of 3CuCo-LDO (Cu% = 20.14 wt.%) exhibited outstanding toluene oxidation activity attributable to its unique structure and composition. This research contributes novel insights to the design of highs-performance catalysts targeting volatile organic compounds. Graphical abstract Image, graphical abstract Keywords ZIF-67 CuCo-LDO Volatile organic compounds Catalytic oxidation Data availability Data will be made available on request. 1 Introduction Volatile organic compounds (VOCs) pose significant hazards, both for the environment and human health. In the atmospheric environment, certain VOCs can contribute to photochemical reactions, generating secondary pollutants [1]. Moreover, VOCs can ascend to the stratosphere, potentially causing harm to the ozone layer [2]. From a human health perspective, VOCs have the capacity to irritate the eyes, nasal passages, and respiratory mucosa [3]. Technologies for VOCs abatement can be broadly categorized into recovery and destruction methods. Recovery technologies encompass absorption, adsorption, membrane separation, and condensation, while destruction methods include thermal oxidation, catalytic oxidation, and biological oxidation. Among these, catalytic oxidation has gained significant attention due to its high efficiency and low toxicity. Cobalt-based metal oxides have been widely investigated and have demonstrated remarkable catalytic efficacy in various catalytic reactions. More recently, cobalt-containing metal oxides have often been obtained through the direct thermal decomposition of precursors, such as layered double hydroxides (LDH). LDHs, characterized by the general formula, consist of divalent metal cations (M2+), trivalent metal cations (M3+), and interlayer anions (e.g., NO3 −, CO3 2−, SO4 2−, surfactants, or other ligands) [4]. Common methods for LDH preparation include co-precipitation, hydrothermal synthesis, and ion exchange [5,6]. While these methods yield crystals with uniform compositions, they often fall short in controlling catalyst morphology, crystallite size, and specific surface area. The structure and morphology of a catalyst play a pivotal role in determining its catalytic efficiency [7]. The development of LDH catalytic materials with controllable morphologies, such as layered, mesostructured, and porous structures, is essential for enhancing catalyst performance [8]. Metal-organic frameworks (MOFs) have garnered extensive attention in the field of catalysis [9–11]. These studies have synthesized MOFs with specific morphologies, highlighting the potential for preparing LDHs with tailored morphologies using MOFs as templates to enhance their catalytic performance. The zeolitic imidazolate framework (e.g., ZIF-67 and ZIF-8) is an ideal template due to its tunable chemistry and chemical stability. For instance, Li et al. [12] designed a hollow Co-Ni-LDH structure utilizing ZIF as a template. The resulting calcined product, layered double oxide (LDO) exhibited exceptional catalytic activity in CO oxidation. Chen et al. [13] directly prepared Co-LDH catalysts in nanocage form via the solvothermal method using ZIF-67 as the precursor. These as-synthesized Co-LDHs displayed efficient electrocatalytic activity for the oxygen evolution reaction (OER) based on their well-structured assembly. While metal oxides derived from ZIFs have been widely studied in the context of CO oxidation and electrocatalysis, there is limited research on the utilization of hollow layered double oxide catalysts, prepared with ZIF-67 as a template, in the catalytic oxidation of toluene. Furthermore, CuO and Cu-based catalysts, being common transition metal oxides, have rarely been doped into Co3O4 during the synthesis of LDO and LDH. Given the strong synergy between these two components, we anticipate that a Cu-Co composite bimetallic oxide may yield enhanced catalytic performance. In this study, we employed ZIF-67 as a template to synthesize catalysts using a straightforward method. Initially, a range of CuCo-LDHs was prepared by introducing varying quantities of copper nitrate. These synthesized LDH products were subsequently oxidized in ambient air to yield layered Cu-Co double oxides. The physicochemical properties of these catalysts and their performance in catalytic oxidation of toluene were comprehensively investigated. 2 Experimental section 2.1 Catalyst preparation ZIF-67 was synthesized in according with previously published protocols [14]. Copper nitrate trihydrate (Aladdin, 99 %) was accurately weighed in varying amounts (1.5 mg, 6.0 mg, 24.0 mg, 48.0 mg) and individually dispersed in 50 mL of methanol. The resulting solutions were then placed in a water bath at 85 ℃, followed by the addition of 80 mg of ZIF-67. The mixture was subsequently refluxed with continuous stirring for a duration of 3 h. After cooling to room temperature, the resulting precipitate was harvested through centrifugation, followed by a thorough wash with methanol. The collected precipitate was then dried overnight at 60 ℃, yielding xCuCo-LDH (x = 1, 2, 3, 4) catalysts. The final step involved calcination at 350 ℃ for 2 h in a tube furnace, producing xCuCo-LDO (x = 1, 2, 3, 4). To facilitate a comparative analysis, the same synthesis procedure was employed. In this case, 302.0 mg of copper nitrate trihydrate (Aladdin, 99 %) was dispersed in 50 mL of methanol. Subsequently, 410.5 mg of 2-methylimidazole (Aladdin, 98 %) was added to the solution. The mixture underwent reflux under identical conditions in a water bath for 3 h, culminating in the acquisition of the Cu-LDH sample through centrifugation, washing, and drying. CuO was obtained by subjecting the sample to calcination at 350 ℃ for 2 h. 2.2 Catalyst characterization X-ray diffraction (XRD) patterns were obtained using a PANalytical X'Pert PRO powder diffractometer using Cu Kα radiation (λ = 0.1541 nm). The instrument operated at a voltage of 40 kV and a current of 40 mA. Data collection occurred over a 2θ range from 5° to 80° at a scanning rate of 6°/min. X-ray photoelectron spectroscopy (XPS) experiments were carried out employing an Escalab 250Xi instrument. Fourier transform infrared spectroscopy was performed using a Bruker VERTEX 70 spectrometer. N2 adsorption-desorption analysis was conducted using a Micromeritics ASAP 2010 instrument. Field emission scanning electron microscopy (FETEM) was employed with a Nano nova 450 device, operating at a voltage of 15 kV. Transmission electron microscopy (TEM) and High-resolution transmission electron microscopy (HRTEM) were executed on a JEM-2100 microscope equipped with an EDX detector, with the acceleration voltage set at 200 kV. The H2-temperature-programmed reduction (H2-TPR) experiments were conducted using a Micromeritics AutoChem 2910 instrument. Prior to each test, a 30 mg sample underwent pretreatment at 250 ℃ for 1 h in an argon flow of 30 mL/min, followed by cooling to room temperature. Subsequently, the sample was heated up to 600 ℃ in a 5 vol.% H2/Ar flow, with a heating rate of 10 ℃/min. Additionally, O2-temperature-programmed desorption (O2-TPD) experiments were also carried out using the same instrument. After the same pretreatment as in H2-TPR, the sample was treated firstly for 30 min at 50 ℃ in a 5 vol.% O2/Ar flow of 30 mL/min. Then the sample was heated up to 950 ℃ in a 5 vol.% O2/Ar flow, with a heating rate of 10 ℃/min. 2.3 Catalytic activity assessment The catalytic activity of the samples was evaluated within a fixed-bed quartz tubular reactor. Initially, 200 mg of catalyst (crushed, 40–60 mesh) was loaded into the quartz tube. Toluene vapor was generated by passing a N2 flow through a bottle containing pure toluene in a low-temperature thermostatic bath. The total flow rate of the toluene and dry air mixture was meticulously controlled at 80 mL/min. This mixture comprised 1000 ppm of toluene and 20 % oxygen, with nitrogen serving as the balance gas, resulting in a gas hourly space velocity (GHSV) set at 24,000 mL·g−1·h−1. Subsequently, the temperature was ramped up from room temperature to 120 ℃ at a controlled rate of 2.5 ℃/min and held steady for a duration of 2 h. At specific temperature intervals, typically every 15 ℃, the temperature was increased and maintained for 30 min upon reaching each pre-set temperature point. The concentration of toluene in the mixture was quantified using a GC-6820 gas chromatograph equipped with a flame ionization detector. Toluene conversion was determined using the following formula: X toluene = C toluene ( in ) − C toluene ( out ) C toluene ( in ) × 100 % Where: Ctoluene (in) (ppm): Inlet toluene concentration Ctoluene (out) (ppm): Outlet toluene concentration The study identified the reaction temperature required to achieve 50 % and 90 % conversion of toluene. 3 Results 3.1 Structure analysis The XRD patterns of all samples are presented in Fig. 1 . Fig. 1A reveals that the diffraction peaks of ZIF-67 at 7.3°, 10.4°, 12.8°, 14.6°, 16.3°, 18.0°, and 26.6° align with the standard card, corresponding to the (110), (002), (112), (022), (013), (222), and (134) crystal planes. This observation unequivocally verifies the successful synthesis of ZIF-67 [15]. Furthermore, all the XRD patterns for 1CuCo-LDH, 2CuCo-LDH, 3CuCo-LDH, and Cu-LDH display distinct diffraction peaks characteristic of LDH. These patterns can be attributed to Co(OH)2 (PDF 74–1057) and Cu2(OH)3NO3 (PDF 03–0061) species. Fig. 1B illustrates the XRD patterns of the respective oxides obtained after the aforementioned materials underwent calcination in air for 2 h. In these patterns, the diffraction peaks at 19.0°, 31.3°, 36.8°, 44.8°, 55.6°, 59.3°, 65.2°, and 77.3° are ascribed to Co3O4 (JCPDS 74–2120). Additionally, diffraction peaks at 32.5°, 35.5°, 38.7°, 46.2°, 48.7°, 54.3°, 58.4°, 61.5°, 66.2°, 68.1°, 72.4°, and 75.1° are evident in the XRD patterns. These peaks are readily indexed to the CuO phase (JCPDS 80–1917). Notably, there is a lack of conspicuous diffraction peaks of CuO in the XRD patterns of 1CuCo-LDO and 2CuCo-LDO samples, likely attributed to the relatively low Cu content or enhanced dispersion in these samples. In contrast, the XRD pattern of the 3CuCo-LDO sample unmistakably displays diffraction peaks at 35.5° and 38.7°, confirming the presence of CuO. Table 1 provides insight into the lattice parameters of Co3O4, which slightly increased from 8.095 Å to 8.101 Å following the introduction of copper species. This observation can be attributed to the larger ionic radius of Cu2+ compared to Co3+, serving as conclusive evidence of successful Cu ion incorporation into the Co3O4 crystals. Furthermore, crystallite size calculations were derived from the Co3O4 (311) diffraction peaks using the Scherrer equation. The results indicate that the addition of Cu ions effectively inhibits crystal growth, as evidenced by the reduction in Co3O4 particle size with increasing Cu content [16]. To ascertain the chemical identity of CuCo-LDH, the FT-IR spectra of all uncalcined samples are presented in Fig. 1C. In comparison to established data for ZIF-67, it is evident that we have successfully synthesized ZIF-67 [17]. Notably, two distinct bands observed at 2925 cm−1 and 3135 cm−1 in all three CuCo-LDH samples can be attributed to the CH vibration of the methyl group and the aromatic ring of 2-methylimidazolate [18]. Moreover, the presence of hydroxyl groups and interlayer water in the tested samples is reflected by the peaks in the range of 3400–3650 cm−1 [19]. In addition, a narrow band at 1384 cm−1, associated with the stretching vibration of NO3 − [20], is consistent across all samples, further confirming the successful synthesis of CuCo-LDH and Cu-LDH. Based on the evidence presented in XRD and FT-IR spectra, the utilization of ZIF-67 as a template facilitated the successful preparation of CuCo-LDH and its corresponding oxides. The N2 adsorption/desorption isotherms and BJH pore size distributions of the five samples after calcination are presented in Fig. 1D and 1E. As depicted in Fig. 1D, all the catalysts displayed IV isotherms with characteristic H3-type hysteresis loops, underscoring the presence of mesopores in each of the samples. This observation is further corroborated by the pore size distribution data in Fig. 1E. Moreover, Table 1 provides additional insights. The introduction of Cu into the catalysts resulted in a notable decrease in specific surface area, ranging from 64.2 to 52.5 m2·g−1, while pure CuO exhibited a significantly lower specific surface area of only 10.2 m2·g−1. Meanwhile, the average pore size and pore volume decreased with increasing Cu content. This discrepancy underscores the influence of metal oxides with higher Cu content, which promotes the formation of larger aggregates, albeit at the cost of partial pore blockage and a subsequent reduction in specific surface area [21]. In general, the larger specific surface area of Cu-Co oxides yields superior catalytic performance when compared to pure CuO samples. 3.2 Morphological and structural analysis The morphology of the synthesized samples was characterized using FESEM and TEM. As illustrated in Fig. 2 a1, ZIF-67 presented as a rhombic dodecahedron with an approximate particle size of 800 nm. Following calcination in air, Co3O4 exhibited a discernible core-shell structure while retaining the overall shape of ZIF-67 (Fig. 2a2). However, as the content of Cu ions increased, the surface of ZIF-67 underwent gradual etching by the Cu particles, resulting in the transformation of its morphology (Table 1, Fig. 2b1 and 2c1). When the Cu content reached 20.14 wt.%, the formation of the distinctive flower-like 3CuCo-LDH structure became evident (Fig. 2d1), a product of self-assembly involving leaf-like structures. Additionally, the corresponding LDO maintained its flower-like morphology. Cu-LDH, on the other hand, exhibited irregular particles with a size range of 20–80 nm, and the morphology of CuO after calcination closely resembled that of Cu-LDH. For a more detailed comparison, we prepared a catalyst with a higher copper content (40.54 %). The FESEM images of the sample were illustrated in Fig. S1, revealing that the morphology before and after calcination closely resembles those of 3CuCo-LDO. High-resolution TEM images of Co3O4 (Fig. 2a5) revealed well-defined (111) and (311) crystal planes of the Co3O4 phase, with corresponding interplanar spacings of 0.46 nm and 0.24 nm. This structural feature was consistently observed in all cobalt-containing samples, including CuCo-LDH and CuCo-LDO, as indicated by (111) planes with lattice fringes of 0.46 nm (Fig. 2b5, 2d5). Moreover, HRTEM images of CuO and xCuCo-LDO (Fig. 2e5 and 2b5–2d5) exhibited lattice fringes measuring 0.23 nm, corresponding to the (111) crystal plane of CuO. These observations provided further evidence of the successful formation of CuCo-LDO. The elemental compositions of the samples were analyzed using energy dispersive spectroscopy (EDS), and the results were summarized in Table 1. The data in Table 1 revealed the presence of Cu and Co elements in all the catalysts, with the Cu content increasing from 0.25 wt.% to 20.14 wt.%. A representative EDS image (3CuCo-LDO) is presented in Fig. S2A, further confirming the coexistence of the two metal oxides. Moreover, the elemental mapping of the 3CuCo-LDO sample, displayed in Fig. S2B, illustrates the uniform distribution of Cu, Co, and O elements within its flower-like structure. To reveal the growth process of the flower-like 3CuCo-LDO, time-dependent experiments were implemented and the SEM images of the products obtained at different reaction times were shown in Fig. S3. The process commenced with the corrosion of the ZIF-67 framework by Cu2+ ions (Fig. S1a and S1b), leading to the gradual release of Co3+ ions from the ZIF-67 structure [22]. Subsequently, imidazole molecules underwent facile decomposition in an alcoholic solution under elevated temperature, generating an alkaline environment concomitant with the formation of OH− ions [13]. In this context, free metal cations, including Cu2+ and Co3+, readily combined with anions, such as NO3 − and OH−, to form Cu-Co nanosheets (Fig. S3c). Ultimately, the flower-like 3CuCo-LDH material emerged through the self-assembly of these nanosheets (Fig. S3d–f), while the application of heat treatment in air resulted in the formation of CuCo-LDO. 3.3 Surface chemical analysis To elucidate the surface chemical states and species of the catalyst, we conducted XPS analysis. As displayed in Fig. 3A , the O 1 s spectra of all samples were deconvoluted into three distinct peaks: the lowest energy peak, situated at 529.7 − 530.0 eV, was attributed to lattice oxygen (Olat); the peak at 531.3 − 531.7 eV was likely associated with oxygen adsorbed on the surface (Oads); and the highest binding energy peak, at 533.3 - 533.5 eV, corresponded to surface oxygen existing in the form of adsorbed carbonate or adsorbed water molecules (Osur) [23]. As reported in literature, oxygen species present on the surface (Osur and Oads) played pivotal roles in catalytic oxidation reaction [24]. The molar ratios of (Osur + Oads)/Olat for all the catalysts are summarized in Table 2 . Remarkably, the flower-like 3CuCo-LDO sample exhibited the highest (Osur + Oads)/Olat ratio among all the samples, suggesting its superior catalytic activity. Moving to Fig. 3B, the Co 2p spectra of Co3O4, 1CuCo-LDO, 2CuCo-LDO, 3CuCo-LDO were deconvoluted into two prominent main peaks (D1 and D2). The peaks at 781.2 ± 0.2 and 796.1 ± 0.2 eV were attributed to Co3+, while those at 779.7 ± 0.2 [25] and 794.7 ± 0.2 eV signified Co2+ [26,27]. It is widely acknowledged that Co3+ plays a pivotal role in the catalytic oxidation process [28]. Consequently, we calculated the Co3+/Co2+ ratio in the cobalt-containing oxides, as presented in Table 2. Notably, the results revealed that 3CuCo-LDO possessed the highest molar ratio of Co3+/Co2+. This might imply that the 3CuCo-LDO catalyst exhibits higher catalytic performance. Additionally, the Cu 2p spectrum of the copper-containing catalyst is depicted in Fig. 3C. All samples exhibited two main peaks at 935.2 ± 0.2 eV and 954.1 ± 0.2 eV, respectively [29]. In the case of the aforementioned catalysts, particularly 3CuCo-LDO and CuO, satellite peaks were observed around 942.3 eV, providing evidence for the presence of Cu2+ or CuO. 3.4 Reduction performance analysis To further explore the reduction performance of the catalysts, we conducted H2-TPR tests. The H2-TPR profiles are shown in Fig. 4 . In the case of pure Co3O4, the H2-TPR profile displayed two distinctive reduction peaks at 273 ℃ and 367 ℃ (Fig. 4): the narrower, initial peak (α) was attributed to the reduction of Co3+ to Co2+ [30], while the subsequent peak (β) denoted the reduction of Co2+ to metallic Co [31]. Notably, the strong reduction peak observed at 246 ℃ in the CuO reduction curve was indicative of the reduction of Cu2+ to Cu0 [32]. Regarding the CuCo-LDO samples, the position of the reduction peaks (α and β) gradually shifted to lower temperatures with an increase in Cu content. It is evident that the 3CuCo-LDO sample exhibited the most favorable reducibility, and the reduction peak of the 3CuCo-LDO catalyst occurred at the lowest temperature. This signifies that an appropriate level of Cu ion doping could enhance the catalyst's reduction performance. Furthermore, we quantified the H2 consumption of all catalysts, and the results are summarized in Table 2. The data revealed that, as the Cu content increased, hydrogen consumption of the α peak progressively rose, consistent with earlier findings. However, total hydrogen consumption decreased at higher temperatures with an increase in Cu content, likely due to the accumulation of Cu species on the catalyst surface, which may impede the reduction of metal oxides [33]. 3.5 Surface oxygen species analysis In order to investigate the oxygen species and their surface components on the solid catalysts, we conducted O2-TPR tests, and the results are presented in Fig. 5 . Peaks within the range of 50–150 ℃ for all samples were attributed to the desorption of molecular oxygen (O2) [34]. Meanwhile, peaks within the range of 200–450 ℃ were ascribed to surface adsorbed oxygen (O2 −, O −) [35]. Furthermore, the peaks observed above 700 ℃ in Fig. 5B were attributed to the desorption of lattice oxygen (O2 −) [36], with the noteworthy observation that these peaks shifted to lower temperatures with increasing Cu content. This shift indicated that the desorption of lattice oxygen species occurred more readily in Cu-Co composites compared to Co3O4 and CuO samples [34,37]. The quantities of oxygen desorption for all catalysts are summarized in Table 2. Notably, the 3CuCo-LDO sample exhibited the highest release of oxygen within the 200–450 ℃ range, signifying an abundance of adsorbed oxygen species. This observation aligns with the XPS results and is in accordance with previous research, which has suggested that high concentrations of surface adsorbed oxygen are conducive to oxidation reactions [38]. 3.6 Catalytic performance analysis The catalytic performance in toluene oxidation over Co3O4, CoCu-LDO, and CuO is displayed in Fig. 6A , and the results are summarized in Table 3 . Throughout the tests, toluene was completely converted into CO2 and H2O. Using T 90 as the standard for activity assessment, the order of activity was as follows: 3CuCo-LDO > 2CuCo-LDO > 1CuCo-LDO > Co3O4 > CuO. This result underscores the improved catalytic activity of the Co-Cu oxide with increasing Cu content. To investigate whether the activity further increases with the higher Cu content, we synthesized a Cu-Co bimetallic oxide catalyst with higher Cu content (40.54 %) and tested its catalytic activity. As shown in Fig. S4, the sample with higher Cu content exhibited inferior activity compared to the 3CuCo-LDO catalyst. These findings emphasize the crucial role of a specific amount of CuO combined with Co3O4 in achieving complete toluene oxidation. Moreover, under identical conditions, the flower-like 3CuCo-LDO catalyst demonstrated superior catalytic oxidation activity for toluene compared to other cobalt-based and copper-based catalysts reported in the literature, as detailed in Table S1. Fig. 6B illustrates an Arrhenius plot for all samples, revealing a strong linear relationship between the natural logarithm of the reaction rate and the reciprocal of temperature (1000/T) for each sample. The apparent activation energies (E a) of these samples were calculated and are listed in Table 3. The order of Ea is consistent with the observed trends in T 90 and T 50. Particularly, 3CuCo-LDO exhibited the lowest activation energy (E a = 85.6 kJ/mol), underlining its superior catalytic activity for toluene oxidation. 4 Discussion In our study, a series of CuCo-LDO catalysts were synthesized using ZIF-67 as a sacrificial template. FT-IR analysis revealed the presence of hydroxide and nitrate groups in the 1CuCo-LDH, 2CuCo-LDH, and 3CuCo-LDH samples, consistent with the XRD results, confirming the successful synthesis of LDHs. Morphological analysis disclosed a progressive chemical etching of ZIF-67 by Cu ions with increasing Cu content. The higher the copper nitrate content in the solution, the more severe the erosion of the ZIF-67 structure. When the copper nitrate concentration is low, the LDH samples (1CuCo-LDH and 2CuCo-LDH) are essentially spherical. However, as the copper nitrate concentration continues to increase, the ZIF-67 framework is completely destroyed, and the LDH exhibits a flower-like structure assembled from nanosheets. After calcination in air, these LDH samples transformed into the corresponding LDOs. The TEM images of 1CuCo-LDO and 2CuCo-LDO displayed layered structures, indicating that the etching process begins from the outer layer of ZIF-67, gradually extending towards the interior of the ZIF-67 particles. The TEM image of the 3CoCu-LDO sample demonstrated the complete chemical etching of ZIF-67, resulting in the formation of sheet-like Cu-Co composites. HR-TEM imaging confirmed the presence of lattice fringes corresponding to Co3O4 and CuO, providing evidence for the formation of Cu-Co composite oxides. Elemental mapping revealed a uniform distribution of Co and Cu elements within the sample. The interaction between Co3O4 and CuO in the flower-like CuCo-LDH was found to underpin its superior catalytic performance in toluene oxidation. The interaction between oxides in binary composite oxide catalysts plays a crucial role in catalytic activity, as validated in numerous catalyst systems and reactions [39,40]. In this study, the unique layered structure provides abundant surface area and pore volume, creating conditions for additional phase contact interfaces [41,42]. This facilitates the adsorption and activation of gaseous reactants on the catalyst surface, leading to their complete oxidation. The H2-TPR curves clearly demonstrated that 3CuCo-LDO had the lowest reduction peak temperature, a result of the interaction between Co3O4 and CuO. XPS analysis revealed the coexistence of cobalt and copper ions with different valences on the catalyst surface. Notably, the flower-like 3CuCo-LDO sample exhibited the highest Co3+/Co2+ ratio, a factor conducive to enhancing reactivity. This interaction likely contributed to the exceptional performance of the catalyst. XRD analysis of the calcined product revealed an increase in the lattice parameter of Co3O4 upon the incorporation of Cu, confirming the successful integration of Cu ions into the Co3O4 lattice. The introduction of foreign ions into the lattice may induce lattice distortion, consequently resulting in the formation of oxygen vacancies [43,44]. These vacancies serve as sites for the adsorption and activation of oxygen molecules facilitating the generation of reactive oxygen species such as O2 −, O − and peroxide ions O2 2− [45,46], which play pivotal roles in the catalytic oxidation of toluene. Thus, elevating the concentration of oxygen vacancies can enhance the production of reactive oxygen species, thereby boosting catalytic activity, which has been well-demonstrated in various studies [47,48]. In our study, the addition of an appropriate amount of Cu led to a progressive increase in the relative amount of surface oxygen vacancies, as indicated by XPS results. Additionally, O2-TPD results confirmed a continuous increase in the quantity of surface adsorbed oxygen species (O2 −, O −) within the temperature range of 200−450 °C as the Cu content increased. Therefore, appropriate Cu doping resulted in the generation of a greater number of oxygen vacancies and reactive oxygen species, thereby enhancing the catalytic oxidation activity for toluene. 5 Conclusions In this investigation, we successfully synthesized CuCo-LDO catalysts using ZIF-67 sacrificial templating. Modulating the copper nitrate content induced a morphological transition, converting LDH samples from spherical to flower-like structures. Subsequent calcination validated this transformation into LDOs, as confirmed by XRD and TEM imaging. The catalytic activity in toluene oxidation revealed a nuanced trend in Cu-Co composite oxides, with an initial rise and subsequent decline correlated with increasing Cu content. Notably, the nanoflower-like 3CuCo-LDO, containing 20.14 wt.% Cu, emerged as the optimal catalyst, exhibiting a T 90 of 232 °C and the lowest activation energy (E a = 85.6 kJ/mol). This highlights the catalytic potential of a judiciously balanced CuO and Co3O4 combination. The interaction between Co3O4 and CuO in the flower-like CuCo-LDH significantly influenced its superior catalytic performance in toluene oxidation. The XRD analysis verified Cu ion integration into the Co3O4 lattice, inducing lattice distortion and oxygen vacancies. The flower-like 3CuCo-LDO demonstrated the highest concentration of active oxygen species, corroborated by O2-TPD results, highlighting their pivotal role in the catalytic oxidation process. The exceptional performance of the flower-like 3CuCo-LDO catalyst can be attributed to several factors, including the interaction between different metals within the sample, the presence of abundant reactive oxygen species, enhanced reducibility, and a higher Co3+ ion content. This work underscores the importance of tailored structures and metal interactions in enhancing catalytic activity for environmental applications. CRediT authorship contribution statement Yang Xu: Writing – review & editing, Writing – original draft, Methodology, Investigation, Formal analysis, Data curation. Jinghuan Chen: Writing – review & editing, Supervision, Resources. Zhiping Ye: Writing – review & editing, Supervision. Jiade Wang: Supervision, Resources, Funding acquisition. Declaration of competing interest The authors declare that they have no known competing financial interests or personal relationships that could have appeared to influence the work reported in this paper. Acknowledgements The authors are grateful to the financial support from the National Natural Science Foundation of China (No. 52270110). References [1] B. Lou N. Shakoor M. Adeel P. Zhang L. Huang Y. Zhao W. Zhao Y. Jiang Y. Rui Catalytic oxidation of volatile organic compounds by non-noble metal catalyst: current advancement and future prospectives J. Clean. Prod. 363 2022 132523 10.1016/j.jclepro.2022.132523 B. Lou, N. Shakoor, M. Adeel, P. Zhang, L. Huang, Y. Zhao, W. Zhao, Y. Jiang, Y. Rui, Catalytic oxidation of volatile organic compounds by non-noble metal catalyst: current advancement and future prospectives, J. Clean. Prod. 363 (2022) 132523. 10.1016/j.jclepro.2022.132523. [2] L. Zhu D. Shen K.H. Luo A critical review on VOCs adsorption by different porous materials: species, mechanisms and modification methods J. Hazard. Mater. 389 2020 122102 10.1016/j.jhazmat.2020.122102 L. Zhu, D. Shen, K.H. Luo, A critical review on VOCs adsorption by different porous materials: species, mechanisms and modification methods, J. Hazard. Mater. 389 (2020) 122102. 10.1016/j.jhazmat.2020.122102. [3] P. Kumar A.B. Singh T. Arora S. Singh R. Singh Critical review on emerging health effects associated with the indoor air quality and its sustainable management Sci. Total Environ. 872 2023 162163 10.1016/j.scitotenv.2023.162163 P. Kumar, A.B. Singh, T. Arora, S. Singh, R. Singh, Critical review on emerging health effects associated with the indoor air quality and its sustainable management, Sci. Total Environ. 872 (2023) 162163. 10.1016/j.scitotenv.2023.162163. [4] Y. Cao D. Zheng F. Zhang J. Pan C. Lin Layered double hydroxide (LDH) for multi-functionalized corrosion protection of metals: a review J. Mater. Sci. Technol. 102 2022 232 263 10.1016/j.jmst.2021.05.078 Y. Cao, D. Zheng, F. Zhang, J. Pan, C. Lin, Layered double hydroxide (LDH) for multi-functionalized corrosion protection of metals: a review, J. Mater. Sci. Technol. 102 (2022) 232–263. 10.1016/j.jmst.2021.05.078. [5] G. Gao Z. Zhu J. Zheng Z. Liu Q. Wang Y. Yan Ultrathin magnetic Mg-Al LDH photocatalyst for enhanced CO2 reduction: fabrication and mechanism J. Colloid Interface Sci. 555 2019 1 10 10.1016/j.jcis.2019.07.025 G. Gao, Z. Zhu, J. Zheng, Z. Liu, Q. Wang, Y. Yan, Ultrathin magnetic Mg-Al LDH photocatalyst for enhanced CO2 reduction: fabrication and mechanism, J. Colloid Interface Sci. 555 (2019) 1–10. 10.1016/j.jcis.2019.07.025. [6] D.G. Jeung H.J. Kim J.M. Oh Incorporation of glycine max merrill extract into layered double hydroxide through ion-exchange and reconstruction Nanomaterials 9 2019 1262 10.3390/nano9091262 D.G. Jeung, H.J. Kim, J.M. Oh, Incorporation of glycine max merrill extract into layered double hydroxide through ion-exchange and reconstruction, Nanomaterials 9 (2019) 1262. 10.3390/nano9091262. [7] Q. Ren S. Mo R. Peng Z. Feng M. Zhang L. Chen M. Fu J. Wu D. Ye Controllable synthesis of 3D hierarchical Co3O4 nanocatalysts with various morphologies for the catalytic oxidation of toluene J. Mater. Chem. A 6 2018 498 509 10.1039/c7ta09149d Q. Ren, S. Mo, R. Peng, Z. Feng, M. Zhang, L. Chen, M. Fu, J. Wu, D. Ye, Controllable synthesis of 3D hierarchical Co3O4 nanocatalysts with various morphologies for the catalytic oxidation of toluene, J. Mater. Chem. A 6 (2018) 498–509. 10.1039/c7ta09149d. [8] Y. Liu M. Pei H. Liang X. Wu B. Li Z. Si F. Kang Rational design and preparation of Pt–LDH/CeO2 catalyst for high-efficiency photothermal catalytic oxidation of toluene ACS Appl. Mater. Interfaces 14 2022 36633 36643 10.1021/acsami.2c08819 Y. Liu, M. Pei, H. Liang, X. Wu, B. Li, Z. Si, F. Kang, Rational design and preparation of Pt–LDH/CeO2 catalyst for high-efficiency photothermal catalytic oxidation of toluene, ACS Appl. Mater. Interfaces 14 (2022) 36633–36643. 10.1021/acsami.2c08819. [9] M. Li Q. Guo L. Xing L. Yang T. Qi P. Xu S. Zhang L. Wang Cobalt-based metal-organic frameworks promoting magnesium sulfite oxidation with ultrahigh catalytic activity and stability J. Colloid Interface Sci. 559 2020 88 95 10.1016/j.jcis.2019.10.004 M. Li, Q. Guo, L. Xing, L. Yang, T. Qi, P. Xu, S. Zhang, L. Wang, Cobalt-based metal-organic frameworks promoting magnesium sulfite oxidation with ultrahigh catalytic activity and stability, J. Colloid Interface Sci. 559 (2020) 88–95. 10.1016/j.jcis.2019.10.004. [10] C. Li W. Meng X. Xu X. Zhuang Y. Wen L. Wang Z. He L. Dai High performance solid electrolyte-based NO2 sensor based on Co3V2O8 derived from metal-organic framework Sens. Actuators B Chem. 302 2020 127173 10.1016/j.snb.2019.127173 C. Li, W. Meng, X. Xu, X. Zhuang, Y. Wen, L. Wang, Z. He, L. Dai, High performance solid electrolyte-based NO2 sensor based on Co3V2O8 derived from metal-organic framework, Sens. Actuators B Chem. 302 (2020) 127173. 10.1016/j.snb.2019.127173. [11] M. Rivera-Torrente P.D. Pletcher M.K. Jongkind N. Nikolopoulos B.M. Weckhuysen Ethylene polymerization over metal-organic framework crystallites and the influence of linkers on their fracturing process ACS Catal. 9 2019 3059 3069 10.1021/acscatal.9b00150 M. Rivera-Torrente, P.D. Pletcher, M.K. Jongkind, N. Nikolopoulos, B.M. Weckhuysen, Ethylene polymerization over metal-organic framework crystallites and the influence of linkers on their fracturing process, ACS Catal. 9 (2019) 3059–3069. 10.1021/acscatal.9b00150. [12] W. Kong J. Li Y. Chen Y. Ren Y. Guo S. Niu Y. Yang ZIF-67-derived hollow nanocages with layered double oxides shell as high-Efficiency catalysts for CO oxidation Appl. Surf. Sci. 437 2018 161 168 10.1016/j.apsusc.2017.12.158 W. Kong, J. Li, Y. Chen, Y. Ren, Y. Guo, S. Niu, Y. Yang, ZIF-67-derived hollow nanocages with layered double oxides shell as high-Efficiency catalysts for CO oxidation, Appl. Surf. Sci. 437 (2018) 161–168. 10.1016/j.apsusc.2017.12.158. [13] L. Chen Y. Guo H. Wang Z. Gu Y. Zhang X. Li H. Wang C. Duan Imidazolate-mediated assembled structures of Co-LDH sheets for efficient electrocatalytic oxygen evolution J. Mater. Chem. A 6 2018 4636 4641 10.1039/c7ta11078b L. Chen, Y. Guo, H. Wang, Z. Gu, Y. Zhang, X. Li, H. Wang, C. Duan, Imidazolate-mediated assembled structures of Co-LDH sheets for efficient electrocatalytic oxygen evolution, J. Mater. Chem. A 6 (2018) 4636–4641. 10.1039/c7ta11078b. [14] H. Xu J. Cao C. Shan B. Wang P. Xi W. Liu Y. Tang MOF-derived hollow CoS decorated with CeO x nanoparticles for boosting oxygen evolution reaction electrocatalysis Angew. Chem. Int. Ed. 57 2018 8654 8658 10.1002/anie.201804673 H. Xu, J. Cao, C. Shan, B. Wang, P. Xi, W. Liu, Y. Tang, MOF-derived hollow CoS decorated with CeOx nanoparticles for boosting oxygen evolution reaction electrocatalysis, Angew. Chem. Int. Ed. 57 (2018) 8654–8658. 10.1002/anie.201804673. [15] Y. Wang L. Zhang R. Li H. He H. Wang L. Huang MOFs-based coating derived Me-ZIF-67@CuO x materials as low-temperature NO-CO catalysts Chem. Eng. J. 381 2020 122757 10.1016/j.cej.2019.122757 Y. Wang, L. Zhang, R. Li, H. He, H. Wang, L. Huang, MOFs-based coating derived Me-ZIF-67@CuOx materials as low-temperature NO-CO catalysts, Chem. Eng. J. 381 (2020) 122757. 10.1016/j.cej.2019.122757. [16] X. Feng J. Guo X. Wen M. Xu Y. Chu S. Yuan Enhancing performance of Co/CeO2 catalyst by Sr doping for catalytic combustion of toluene Appl. Surf. Sci. 445 2018 145 153 10.1016/j.apsusc.2018.03.070 X. Feng, J. Guo, X. Wen, M. Xu, Y. Chu, S. Yuan, Enhancing performance of Co/CeO2 catalyst by Sr doping for catalytic combustion of toluene, Appl. Surf. Sci. 445 (2018) 145–153. 10.1016/j.apsusc.2018.03.070. [17] A. Khan M. Ali A. Ilyas P. Naik F.J. Ivo I.F.J. Vankelecom M.A. Gilani M.R. Bilad Z. Sajjad A.L. Khan ZIF-67 filled PDMS mixed matrix membranes for recovery of ethanol via pervaporation Sep. Purif. Technol. 206 2018 50 58 10.1016/j.seppur.2018.05.055 A. Khan, M. Ali, A. Ilyas, P. Naik, F.J. Ivo, I.F.J. Vankelecom, M.A. Gilani, M.R. Bilad, Z. Sajjad, A.L. Khan, ZIF-67 filled PDMS mixed matrix membranes for recovery of ethanol via pervaporation, Sep. Purif. Technol. 206 (2018) 50–58. 10.1016/j.seppur.2018.05.055. [18] H. Zhang M. Zhao Y. Yang Y.S. Lin Hydrolysis and condensation of ZIF-8 in water Microporous Mesoporous Mater. 288 2019 109568 10.1016/j.micromeso.2019.109568 H. Zhang, M. Zhao, Y. Yang, Y.S. Lin, Hydrolysis and condensation of ZIF-8 in water, Microporous Mesoporous Mater. 288 (2019) 109568. 10.1016/j.micromeso.2019.109568. [19] H. Liu Q. Jiao Y. Zhao H. Li C. Sun X. Li Mixed oxides derived from Cu-Co layered double hydroxide nanorods: preparation, characterization and their catalytic activities J. Alloy. Compd. 496 2010 317 323 10.1016/j.jallcom.2010.02.004 H. Liu, Q. Jiao, Y. Zhao, H. Li, C. Sun, X. Li, Mixed oxides derived from Cu-Co layered double hydroxide nanorods: preparation, characterization and their catalytic activities, J. Alloy. Compd. 496 (2010) 317–323. 10.1016/j.jallcom.2010.02.004. [20] M. Chen F. Wu L. Yu Y. Cai H. Chen M. Zhang Chloride binding capacity of LDHs with various divalent cations and divalent to trivalent cation ratios in different solutions CrystEngComm 21 2019 6790 6800 10.1039/c9ce01322a M. Chen, F. Wu, L. Yu, Y. Cai, H. Chen, M. Zhang, Chloride binding capacity of LDHs with various divalent cations and divalent to trivalent cation ratios in different solutions, CrystEngComm 21 (2019) 6790–6800. 10.1039/c9ce01322a. [21] M. Jin Z. Li W. Piao J. Chen L.Y. Jin J.M. Kim Highly ordered mesoporous cobalt-copper composite oxides for preferential CO oxidation Catal. Surv. Asia 21 2017 45 52 10.1007/s10563-017-9224-3 M. Jin, Z. Li, W. Piao, J. Chen, L.Y. Jin, J.M. Kim, Highly ordered mesoporous cobalt-copper composite oxides for preferential CO oxidation, Catal. Surv. Asia 21 (2017) 45–52. 10.1007/s10563-017-9224-3. [22] Z. Gao J. Zhang S. zhang J. Wang Y. Song Cationic etching of ZIF-67 derived LaCoO3/Co3O4 as high-efficiency electromagnetic absorbents Chem. Eng. J. 421 2021 127829 10.1016/j.cej.2020.127829 Z. Gao, J. Zhang, S. zhang, J. Wang, Y. Song, Cationic etching of ZIF-67 derived LaCoO3/Co3O4 as high-efficiency electromagnetic absorbents, Chem. Eng. J. 421 (2021) 127829. 10.1016/j.cej.2020.127829. [23] E. Genty J. Brunet C. Poupin S. Ojala S. Siffert R. Cousin Influence of CO addition on the toluene total oxidation over Co based mixed oxide catalysts Appl. Catal. B Environ. 247 2019 163 172 10.1016/j.apcatb.2019.01.081 E. Genty, J. Brunet, C. Poupin, S. Ojala, S. Siffert, R. Cousin, Influence of CO addition on the toluene total oxidation over Co based mixed oxide catalysts, Appl. Catal. B Environ. 247 (2019) 163–172. 10.1016/j.apcatb.2019.01.081. [24] T. Chang Z. Shen Y. Huang J. Lu D. Ren J. Sun J. Cao H. Liu Post-plasma-catalytic removal of toluene using MnO2-Co3O4catalysts and their synergistic mechanism Chem. Eng. J. 348 2018 15 25 10.1016/j.cej.2018.04.186 T. Chang, Z. Shen, Y. Huang, J. Lu, D. Ren, J. Sun, J. Cao, H. Liu, Post-plasma-catalytic removal of toluene using MnO2-Co3O4catalysts and their synergistic mechanism, Chem. Eng. J. 348 (2018) 15–25. 10.1016/j.cej.2018.04.186. [25] Q. Ren X. Zhao J. Zhong J. Zhang J. Tian D. Yan P. Liu M. Fu L. Chen J. Wu D. Ye Unravelling the role of oxygen species in toluene oxidation over Co3O4-base catalysts: in situ DRIFTS coupled with quasi in situ XPS J. Catal. 418 2023 130 140 10.1016/j.jcat.2023.01.002 Q. Ren, X. Zhao, J. Zhong, J. Zhang, J. Tian, D. Yan, P. Liu, M. Fu, L. Chen, J. Wu, D. Ye, Unravelling the role of oxygen species in toluene oxidation over Co3O4-base catalysts: in situ DRIFTS coupled with quasi in situ XPS, J. Catal. 418 (2023) 130–140. 10.1016/j.jcat.2023.01.002. [26] J. Zhong Y. Zeng M. Zhang W. Feng D. Xiao J. Wu P. Chen M. Fu D. Ye Toluene oxidation process and proper mechanism over Co3O4 nanotubes: investigation through in-situ DRIFTS combined with PTR-TOF-MS and quasi in-situ XPS Chem. Eng. J. 397 2020 125375 10.1016/j.cej.2020.125375 J. Zhong, Y. Zeng, M. Zhang, W. Feng, D. Xiao, J. Wu, P. Chen, M. Fu, D. Ye, Toluene oxidation process and proper mechanism over Co3O4 nanotubes: investigation through in-situ DRIFTS combined with PTR-TOF-MS and quasi in-situ XPS, Chem. Eng. J. 397 (2020) 125375. 10.1016/j.cej.2020.125375. [27] J. Zhao Z. Tang F. Dong J. Zhang Controlled porous hollow Co3O4 polyhedral nanocages derived from metal-organic frameworks (MOFs) for toluene catalytic oxidation Mol. Catal. 463 2019 77 86 10.1016/j.mcat.2018.10.020 J. Zhao, Z. Tang, F. Dong, J. Zhang, Controlled porous hollow Co3O4 polyhedral nanocages derived from metal-organic frameworks (MOFs) for toluene catalytic oxidation, Mol. Catal. 463 (2019) 77–86. 10.1016/j.mcat.2018.10.020. [28] S. Zhang X. Zhu C. Zheng D. Hu J. Zhang X. Gao Study on catalytic soot oxidation over spinel type ACo2O4 (A = Co, Ni, Cu, Zn) catalysts Aerosol Air Qual. Res. 17 2017 2317 2327 10.4209/aaqr.2016.12.0564 S. Zhang, X. Zhu, C. Zheng, D. Hu, J. Zhang, X. Gao, Study on catalytic soot oxidation over spinel type ACo2O4 (A = Co, Ni, Cu, Zn) catalysts, Aerosol Air Qual. Res. 17 (2017) 2317–2327. 10.4209/aaqr.2016.12.0564. [29] J. Luo K. Xuan Y. Wang F. Li F. Wang Y. Pu L. Li N. Zhao F. Xiao Aerobic oxidation of fluorene to fluorenone over Co-Cu bimetal oxides New J. Chem. 43 2019 8428 8438 10.1039/c9nj00499h J. Luo, K. Xuan, Y. Wang, F. Li, F. Wang, Y. Pu, L. Li, N. Zhao, F. Xiao, Aerobic oxidation of fluorene to fluorenone over Co-Cu bimetal oxides, New J. Chem. 43 (2019) 8428–8438. 10.1039/c9nj00499h. [30] X. Li X. Li X. Zeng T. Zhu Correlation between the physicochemical properties and catalytic performances of micro/mesoporous CoCeO x mixed oxides for propane combustion Appl. Catal. A Gen. 572 2019 61 70 10.1016/j.apcata.2018.12.026 X. Li, X. Li, X. Zeng, T. Zhu, Correlation between the physicochemical properties and catalytic performances of micro/mesoporous CoCeOx mixed oxides for propane combustion, Appl. Catal. A Gen. 572 (2019) 61–70. 10.1016/j.apcata.2018.12.026. [31] W. Song A.S. Poyraz Y. Meng Z. Ren S.Y. Chen S.L. Suib Mesoporous Co3O4 with controlled porosity: inverse micelle synthesis and high-performance catalytic CO oxidation at-60 degrees C Chem. Mater. 26 2014 4629 4639 10.1021/cm502106v W. Song, A.S. Poyraz, Y. Meng, Z. Ren, S.Y. Chen, S.L. Suib, Mesoporous Co3O4 with controlled porosity: inverse micelle synthesis and high-performance catalytic CO oxidation at-60 degrees C, Chem. Mater. 26 (2014) 4629–4639. 10.1021/cm502106v. [32] C. Cao Y. Xie Y. Chen J. Lu J. Shi H. Jin S. Wang L. Zhang Hydrogen production from supercritical water gasification of lignin and cellulose with coprecipitated CuO–ZnO and Fe2O3–Cr2O3 Ind. Eng. Chem. Res. 60 2021 7033 7042 10.1021/acs.iecr.1c00963 C. Cao, Y. Xie, Y. Chen, J. Lu, J. Shi, H. Jin, S. Wang, L. Zhang, Hydrogen production from supercritical water gasification of lignin and cellulose with coprecipitated CuO–ZnO and Fe2O3–Cr2O3, Ind. Eng. Chem. Res. 60 (2021) 7033–7042. 10.1021/acs.iecr.1c00963. [33] C. He X. Liu J. Shi C. Ma H. Pan G. Li Anionic starch-induced Cu-based composite with flake-like mesostructure for gas-phase propanal efficient removal J. Colloid Interface Sci. 454 2015 216 225 10.1016/j.jcis.2015.05.021 C. He, X. Liu, J. Shi, C. Ma, H. Pan, G. Li, Anionic starch-induced Cu-based composite with flake-like mesostructure for gas-phase propanal efficient removal, J. Colloid Interface Sci. 454 (2015) 216–225. 10.1016/j.jcis.2015.05.021. [34] L. Xue C. Zhang H. He Y. Teraoka Catalytic decomposition of N2O over CeO2 promoted CO3O4 spinel catalyst Appl. Catal. B-Environ. 75 2007 167 174 10.1016/j.apcatb.2007.04.013 L. Xue, C. Zhang, H. He, Y. Teraoka, Catalytic decomposition of N2O over CeO2 promoted CO3O4 spinel catalyst, Appl. Catal. B-Environ. 75 (2007) 167–174. 10.1016/j.apcatb.2007.04.013. [35] Y. Sun J. Liu J. Song S. Huang N. Yang J. Zhang Y. Sun Y. Zhu Exploring the effect of Co3O4 nanocatalysts with different dimensional architectures on methane combustion ChemCatChem 8 2016 540 545 10.1002/cctc.201501056 Y. Sun, J. Liu, J. Song, S. Huang, N. Yang, J. Zhang, Y. Sun, Y. Zhu, Exploring the effect of Co3O4 nanocatalysts with different dimensional architectures on methane combustion, ChemCatChem 8 (2016) 540–545. 10.1002/cctc.201501056. [36] S. Zhang S. Liu X. Zhu Y. Yang W. Hu H. Zhao R. Qu C. Zheng X. Gao Low temperature catalytic oxidation of propane over cobalt-cerium spinel oxides catalysts Appl. Surf. Sci. 479 2019 1132 1140 10.1016/j.apsusc.2019.02.118 S. Zhang, S. Liu, X. Zhu, Y. Yang, W. Hu, H. Zhao, R. Qu, C. Zheng, X. Gao, Low temperature catalytic oxidation of propane over cobalt-cerium spinel oxides catalysts, Appl. Surf. Sci. 479 (2019) 1132–1140. 10.1016/j.apsusc.2019.02.118. [37] C. Wang C. Zhang W. Hua Y. Guo G. Lu S. Gil A. Giroir-Fendler Catalytic oxidation of vinyl chloride emissions over Co-Ce composite oxide catalysts Chem. Eng. J. 315 2017 392 402 10.1016/j.cej.2017.01.007 C. Wang, C. Zhang, W. Hua, Y. Guo, G. Lu, S. Gil, A. Giroir-Fendler, Catalytic oxidation of vinyl chloride emissions over Co-Ce composite oxide catalysts, Chem. Eng. J. 315 (2017) 392–402. 10.1016/j.cej.2017.01.007. [38] S. Xie Y. Liu J. Deng J. Yang X. Zhao Z. Han K. Zhang H. Dai Insights into the active sites of ordered mesoporous cobalt oxide catalysts for the total oxidation of o-xylene J. Catal. 352 2017 282 292 10.1016/j.jcat.2017.05.016 S. Xie, Y. Liu, J. Deng, J. Yang, X. Zhao, Z. Han, K. Zhang, H. Dai, Insights into the active sites of ordered mesoporous cobalt oxide catalysts for the total oxidation of o-xylene, J. Catal. 352 (2017) 282–292. 10.1016/j.jcat.2017.05.016. [39] M. Anpo G. Costentin E. Giamello H. Lauron-Pernot Z. Sojka Characterisation and reactivity of oxygen species at the surface of metal oxides J. Catal. 393 2021 259 280 10.1016/j.jcat.2020.10.011 M. Anpo, G. Costentin, E. Giamello, H. Lauron-Pernot, Z. Sojka, Characterisation and reactivity of oxygen species at the surface of metal oxides, J. Catal. 393 (2021) 259–280. 10.1016/j.jcat.2020.10.011. [40] P. Zang J. Liu Y. He G. Zhang G. Li Y. Wang Y. Lv LDH-derived preparation of CuMgFe layered double oxides for NH3-SCR and CO oxidation reactions: performance study and synergistic mechanism Chem. Eng. J. 446 2022 137414 10.1016/j.cej.2022.137414 P. Zang, J. Liu, Y. He, G. Zhang, G. Li, Y. Wang, Y. Lv, LDH-derived preparation of CuMgFe layered double oxides for NH3-SCR and CO oxidation reactions: performance study and synergistic mechanism, Chem. Eng. J. 446 (2022) 137414. 10.1016/j.cej.2022.137414. [41] J. Cao S. Sun X. Li Z. Yang W. Xiong Y. Wu M. Jia Y. Zhou C. Zhou Y. Zhang Efficient charge transfer in aluminum-cobalt layered double hydroxide derived from Co-ZIF for enhanced catalytic degradation of tetracycline through peroxymonosulfate activation Chem. Eng. J. 382 2020 122802 10.1016/j.cej.2019.122802 J. Cao, S. Sun, X. Li, Z. Yang, W. Xiong, Y. Wu, M. Jia, Y. Zhou, C. Zhou, Y. Zhang, Efficient charge transfer in aluminum-cobalt layered double hydroxide derived from Co-ZIF for enhanced catalytic degradation of tetracycline through peroxymonosulfate activation, Chem. Eng. J. 382 (2020) 122802. 10.1016/j.cej.2019.122802. [42] A.V. Karim A. Hassani P. Eghbali P.V. Nidheesh Nanostructured modified layered double hydroxides (LDHs)-based catalysts: a review on synthesis, characterization, and applications in water remediation by advanced oxidation processes Curr. Opin. Solid State Mater. 26 2022 100965 10.1016/j.cossms.2021.100965 A.V. Karim, A. Hassani, P. Eghbali, P.V. Nidheesh, Nanostructured modified layered double hydroxides (LDHs)-based catalysts: a review on synthesis, characterization, and applications in water remediation by advanced oxidation processes, Curr. Opin. Solid State Mater. 26 (2022) 100965. 10.1016/j.cossms.2021.100965. [43] J. Yang Y. Huang Y.W. Chen D. Xia C.Y. Mou L. Hu J. Zeng C. He P.K. Wong H.Y. Zhu Active site-directed tandem catalysis on CuO/VO-MnO2 for efficient and stable catalytic ozonation of S-VOCs under mild condition Nano Today 35 2020 100944 10.1016/j.nantod.2020.100944 J. Yang, Y. Huang, Y.W. Chen, D. Xia, C.Y. Mou, L. Hu, J. Zeng, C. He, P.K. Wong, H.Y. Zhu, Active site-directed tandem catalysis on CuO/VO-MnO2 for efficient and stable catalytic ozonation of S-VOCs under mild condition, Nano Today 35 (2020) 100944. 10.1016/j.nantod.2020.100944. [44] Y. Zhang Y. Li Z. Zeng J. Hu Y. Hou Z. Huang Synergically engineering Cu+ and oxygen vacancies in CuMn2O4 catalysts for enhanced toluene oxidation performance Mol. Catal. 517 2022 112043 10.1016/j.mcat.2021.112043 Y. Zhang, Y. Li, Z. Zeng, J. Hu, Y. Hou, Z. Huang, Synergically engineering Cu+ and oxygen vacancies in CuMn2O4 catalysts for enhanced toluene oxidation performance, Mol. Catal. 517 (2022) 112043. 10.1016/j.mcat.2021.112043. [45] Y. Duan Z.Y. Yu S.J. Hu X.S. Zheng C.T. Zhang H.H. Ding B.C. Hu Q.Q. Fu Z.L. Yu X. Zheng J.F. Zhu M.R. Gao S.H. Yu Scaled-up synthesis of amorphous NiFeMo oxides and their rapid surface reconstruction for superior oxygen evolution catalysis Angew. Chem. Int. Ed. 58 2019 15772 15777 10.1002/anie.201909939 Y. Duan, Z.Y. Yu, S.J. Hu, X.S. Zheng, C.T. Zhang, H.H. Ding, B.C. Hu, Q.Q. Fu, Z.L. Yu, X. Zheng, J.F. Zhu, M.R. Gao, S.H. Yu, Scaled-up synthesis of amorphous NiFeMo oxides and their rapid surface reconstruction for superior oxygen evolution catalysis, Angew. Chem. Int. Ed. 58 (2019) 15772–15777. 10.1002/anie.201909939. [46] X. Wei K. Li X. Zhang Q. Tong J. Ji Y. Cai B. Gao W. Zou L. Dong CeO2 nanosheets with anion-induced oxygen vacancies for promoting photocatalytic toluene mineralization: toluene adsorption and reactive oxygen species Appl. Catal. B Environ. 317 2022 121694 10.1016/j.apcatb.2022.121694 X. Wei, K. Li, X. Zhang, Q. Tong, J. Ji, Y. Cai, B. Gao, W. Zou, L. Dong, CeO2 nanosheets with anion-induced oxygen vacancies for promoting photocatalytic toluene mineralization: toluene adsorption and reactive oxygen species, Appl. Catal. B Environ. 317 (2022) 121694. 10.1016/j.apcatb.2022.121694. [47] G. Hu Z. Zhang C. Wang G. Li D. Zhou J. Wang D. Che R. Kang New insight into oxygen vacancy and synergism in CuCeO x catalysts based on the toluene oxidation J. Environ. Chem. Eng. 12 2024 112213 10.1016/j.jece.2024.112213 G. Hu, Z. Zhang, C. Wang, G. Li, D. Zhou, J. Wang, D. Che, R. Kang, New insight into oxygen vacancy and synergism in CuCeOx catalysts based on the toluene oxidation, J. Environ. Chem. Eng. 12 (2024) 112213. 10.1016/j.jece.2024.112213. [48] Z. Li Q. Yan Q. Jiang Y. Gao T. Xue R. Li Y. Liu Q. Wang Oxygen vacancy mediated CuyCo3-yFe1O x mixed oxide as highly active and stable toluene oxidation catalyst by multiple phase interfaces formation and metal doping effect Appl. Catal. B Environ. 269 2020 118827 10.1016/j.apcatb.2020.118827 Z. Li, Q. Yan, Q. Jiang, Y. Gao, T. Xue, R. Li, Y. Liu, Q. Wang, Oxygen vacancy mediated CuyCo3-yFe1Ox mixed oxide as highly active and stable toluene oxidation catalyst by multiple phase interfaces formation and metal doping effect, Appl. Catal. B Environ. 269 (2020) 118827. 10.1016/j.apcatb.2020.118827.",
      "scopus-id": "85189745202",
      "coredata": {
        "eid": "1-s2.0-S2468823124002967",
        "dc:description": "The investigation into the development of an active transition-metal oxide catalyst with controllable morphology for the degradation of volatile organic compounds (VOCs) is a subject of considerable importance and warrants further exploration. In this study, ZIF-67 was prepared and employed as a sacrificial template, with varying quantities of Cu ions incorporated to synthesize layered copper-cobalt double oxide (CuCo-LDO) featuring a modifiable surface state. A comprehensive characterization of the CuCo-LDO catalysts was conducted, encompassing structural properties, morphology, surface chemical state, and redox properties, utilizing a range of analytical techniques. Subsequent evaluations included testing the catalytic activity for toluene oxidation and assessing stability performance. The results revealed that differing Cu contents played a pivotal role in inducing changes in the morphology and structure of CuCo-LDO, thereby significantly influencing its oxidation activity towards toluene. Notably, the flower-like structure of 3CuCo-LDO (Cu% = 20.14 wt.%) exhibited outstanding toluene oxidation activity attributable to its unique structure and composition. This research contributes novel insights to the design of highs-performance catalysts targeting volatile organic compounds.",
        "openArchiveArticle": "false",
        "prism:coverDate": "2024-05-01",
        "openaccessUserLicense": null,
        "prism:aggregationType": "Journal",
        "prism:url": "https://api.elsevier.com/content/article/pii/S2468823124002967",
        "dc:creator": [
          {
            "@_fa": "true",
            "$": "Xu, Yang"
          },
          {
            "@_fa": "true",
            "$": "Chen, Jinghuan"
          },
          {
            "@_fa": "true",
            "$": "Ye, Zhiping"
          },
          {
            "@_fa": "true",
            "$": "Wang, Jiade"
          }
        ],
        "link": [
          {
            "@_fa": "true",
            "@rel": "self",
            "@href": "https://api.elsevier.com/content/article/pii/S2468823124002967"
          },
          {
            "@_fa": "true",
            "@rel": "scidir",
            "@href": "https://www.sciencedirect.com/science/article/pii/S2468823124002967"
          }
        ],
        "dc:format": "application/json",
        "openaccessType": null,
        "pii": "S2468-8231(24)00296-7",
        "prism:volume": "560",
        "articleNumber": "114113",
        "prism:publisher": "Published by Elsevier B.V.",
        "dc:title": "Design and optimization of CuCo-LDO catalysts via ZIF-67 sacrificial templates for enhanced toluene oxidation: A comprehensive study on morphology, structure, and catalytic activity",
        "prism:copyright": "© 2024 Published by Elsevier B.V.",
        "openaccess": "0",
        "prism:issn": "24688231",
        "dcterms:subject": [
          {
            "@_fa": "true",
            "$": "ZIF-67"
          },
          {
            "@_fa": "true",
            "$": "CuCo-LDO"
          },
          {
            "@_fa": "true",
            "$": "Volatile organic compounds"
          },
          {
            "@_fa": "true",
            "$": "Catalytic oxidation"
          }
        ],
        "openaccessArticle": "false",
        "prism:publicationName": "Molecular Catalysis",
        "openaccessSponsorType": null,
        "prism:pageRange": "114113",
        "pubType": "fla",
        "prism:coverDisplayDate": "1 May 2024",
        "prism:doi": "10.1016/j.mcat.2024.114113",
        "prism:startingPage": "114113",
        "dc:identifier": "doi:10.1016/j.mcat.2024.114113",
        "openaccessSponsorName": null
      },
      "objects": {
        "object": [
          {
            "@category": "standard",
            "@height": "205",
            "@width": "565",
            "@_fa": "true",
            "$": "https://api.elsevier.com/content/object/eid/1-s2.0-S2468823124002967-gr6.jpg?httpAccept=%2A%2F%2A",
            "@multimediatype": "JPEG image file",
            "@type": "IMAGE-DOWNSAMPLED",
            "@size": "36781",
            "@ref": "gr6",
            "@mimetype": "image/jpeg"
          },
          {
            "@category": "standard",
            "@height": "282",
            "@width": "565",
            "@_fa": "true",
            "$": "https://api.elsevier.com/content/object/eid/1-s2.0-S2468823124002967-gr5.jpg?httpAccept=%2A%2F%2A",
            "@multimediatype": "JPEG image file",
            "@type": "IMAGE-DOWNSAMPLED",
            "@size": "39671",
            "@ref": "gr5",
            "@mimetype": "image/jpeg"
          },
          {
            "@category": "standard",
            "@height": "260",
            "@width": "339",
            "@_fa": "true",
            "$": "https://api.elsevier.com/content/object/eid/1-s2.0-S2468823124002967-gr4.jpg?httpAccept=%2A%2F%2A",
            "@multimediatype": "JPEG image file",
            "@type": "IMAGE-DOWNSAMPLED",
            "@size": "28262",
            "@ref": "gr4",
            "@mimetype": "image/jpeg"
          },
          {
            "@category": "standard",
            "@height": "278",
            "@width": "678",
            "@_fa": "true",
            "$": "https://api.elsevier.com/content/object/eid/1-s2.0-S2468823124002967-gr3.jpg?httpAccept=%2A%2F%2A",
            "@multimediatype": "JPEG image file",
            "@type": "IMAGE-DOWNSAMPLED",
            "@size": "66144",
            "@ref": "gr3",
            "@mimetype": "image/jpeg"
          },
          {
            "@category": "standard",
            "@height": "823",
            "@width": "659",
            "@_fa": "true",
            "$": "https://api.elsevier.com/content/object/eid/1-s2.0-S2468823124002967-gr2.jpg?httpAccept=%2A%2F%2A",
            "@multimediatype": "JPEG image file",
            "@type": "IMAGE-DOWNSAMPLED",
            "@size": "226768",
            "@ref": "gr2",
            "@mimetype": "image/jpeg"
          },
          {
            "@category": "standard",
            "@height": "200",
            "@width": "492",
            "@_fa": "true",
            "$": "https://api.elsevier.com/content/object/eid/1-s2.0-S2468823124002967-ga1.jpg?httpAccept=%2A%2F%2A",
            "@multimediatype": "JPEG image file",
            "@type": "IMAGE-DOWNSAMPLED",
            "@size": "33314",
            "@ref": "ga1",
            "@mimetype": "image/jpeg"
          },
          {
            "@category": "standard",
            "@height": "542",
            "@width": "678",
            "@_fa": "true",
            "$": "https://api.elsevier.com/content/object/eid/1-s2.0-S2468823124002967-gr1.jpg?httpAccept=%2A%2F%2A",
            "@multimediatype": "JPEG image file",
            "@type": "IMAGE-DOWNSAMPLED",
            "@size": "110659",
            "@ref": "gr1",
            "@mimetype": "image/jpeg"
          },
          {
            "@category": "thumbnail",
            "@height": "79",
            "@width": "219",
            "@_fa": "true",
            "$": "https://api.elsevier.com/content/object/eid/1-s2.0-S2468823124002967-gr6.sml?httpAccept=%2A%2F%2A",
            "@multimediatype": "GIF image file",
            "@type": "IMAGE-THUMBNAIL",
            "@size": "7048",
            "@ref": "gr6",
            "@mimetype": "image/gif"
          },
          {
            "@category": "thumbnail",
            "@height": "109",
            "@width": "219",
            "@_fa": "true",
            "$": "https://api.elsevier.com/content/object/eid/1-s2.0-S2468823124002967-gr5.sml?httpAccept=%2A%2F%2A",
            "@multimediatype": "GIF image file",
            "@type": "IMAGE-THUMBNAIL",
            "@size": "7696",
            "@ref": "gr5",
            "@mimetype": "image/gif"
          },
          {
            "@category": "thumbnail",
            "@height": "164",
            "@width": "214",
            "@_fa": "true",
            "$": "https://api.elsevier.com/content/object/eid/1-s2.0-S2468823124002967-gr4.sml?httpAccept=%2A%2F%2A",
            "@multimediatype": "GIF image file",
            "@type": "IMAGE-THUMBNAIL",
            "@size": "9192",
            "@ref": "gr4",
            "@mimetype": "image/gif"
          },
          {
            "@category": "thumbnail",
            "@height": "90",
            "@width": "219",
            "@_fa": "true",
            "$": "https://api.elsevier.com/content/object/eid/1-s2.0-S2468823124002967-gr3.sml?httpAccept=%2A%2F%2A",
            "@multimediatype": "GIF image file",
            "@type": "IMAGE-THUMBNAIL",
            "@size": "9738",
            "@ref": "gr3",
            "@mimetype": "image/gif"
          },
          {
            "@category": "thumbnail",
            "@height": "164",
            "@width": "131",
            "@_fa": "true",
            "$": "https://api.elsevier.com/content/object/eid/1-s2.0-S2468823124002967-gr2.sml?httpAccept=%2A%2F%2A",
            "@multimediatype": "GIF image file",
            "@type": "IMAGE-THUMBNAIL",
            "@size": "18018",
            "@ref": "gr2",
            "@mimetype": "image/gif"
          },
          {
            "@category": "thumbnail",
            "@height": "89",
            "@width": "219",
            "@_fa": "true",
            "$": "https://api.elsevier.com/content/object/eid/1-s2.0-S2468823124002967-ga1.sml?httpAccept=%2A%2F%2A",
            "@multimediatype": "GIF image file",
            "@type": "IMAGE-THUMBNAIL",
            "@size": "9685",
            "@ref": "ga1",
            "@mimetype": "image/gif"
          },
          {
            "@category": "thumbnail",
            "@height": "164",
            "@width": "205",
            "@_fa": "true",
            "$": "https://api.elsevier.com/content/object/eid/1-s2.0-S2468823124002967-gr1.sml?httpAccept=%2A%2F%2A",
            "@multimediatype": "GIF image file",
            "@type": "IMAGE-THUMBNAIL",
            "@size": "13890",
            "@ref": "gr1",
            "@mimetype": "image/gif"
          },
          {
            "@category": "high",
            "@height": "907",
            "@width": "2500",
            "@_fa": "true",
            "$": "https://api.elsevier.com/content/object/eid/1-s2.0-S2468823124002967-gr6_lrg.jpg?httpAccept=%2A%2F%2A",
            "@multimediatype": "JPEG image file",
            "@type": "IMAGE-HIGH-RES",
            "@size": "229744",
            "@ref": "gr6",
            "@mimetype": "image/jpeg"
          },
          {
            "@category": "high",
            "@height": "1246",
            "@width": "2500",
            "@_fa": "true",
            "$": "https://api.elsevier.com/content/object/eid/1-s2.0-S2468823124002967-gr5_lrg.jpg?httpAccept=%2A%2F%2A",
            "@multimediatype": "JPEG image file",
            "@type": "IMAGE-HIGH-RES",
            "@size": "266212",
            "@ref": "gr5",
            "@mimetype": "image/jpeg"
          },
          {
            "@category": "high",
            "@height": "1150",
            "@width": "1500",
            "@_fa": "true",
            "$": "https://api.elsevier.com/content/object/eid/1-s2.0-S2468823124002967-gr4_lrg.jpg?httpAccept=%2A%2F%2A",
            "@multimediatype": "JPEG image file",
            "@type": "IMAGE-HIGH-RES",
            "@size": "180451",
            "@ref": "gr4",
            "@mimetype": "image/jpeg"
          },
          {
            "@category": "high",
            "@height": "1232",
            "@width": "3000",
            "@_fa": "true",
            "$": "https://api.elsevier.com/content/object/eid/1-s2.0-S2468823124002967-gr3_lrg.jpg?httpAccept=%2A%2F%2A",
            "@multimediatype": "JPEG image file",
            "@type": "IMAGE-HIGH-RES",
            "@size": "521162",
            "@ref": "gr3",
            "@mimetype": "image/jpeg"
          },
          {
            "@category": "high",
            "@height": "3642",
            "@width": "2917",
            "@_fa": "true",
            "$": "https://api.elsevier.com/content/object/eid/1-s2.0-S2468823124002967-gr2_lrg.jpg?httpAccept=%2A%2F%2A",
            "@multimediatype": "JPEG image file",
            "@type": "IMAGE-HIGH-RES",
            "@size": "1989202",
            "@ref": "gr2",
            "@mimetype": "image/jpeg"
          },
          {
            "@category": "high",
            "@height": "886",
            "@width": "2179",
            "@_fa": "true",
            "$": "https://api.elsevier.com/content/object/eid/1-s2.0-S2468823124002967-ga1_lrg.jpg?httpAccept=%2A%2F%2A",
            "@multimediatype": "JPEG image file",
            "@type": "IMAGE-HIGH-RES",
            "@size": "222814",
            "@ref": "ga1",
            "@mimetype": "image/jpeg"
          },
          {
            "@category": "high",
            "@height": "2400",
            "@width": "3000",
            "@_fa": "true",
            "$": "https://api.elsevier.com/content/object/eid/1-s2.0-S2468823124002967-gr1_lrg.jpg?httpAccept=%2A%2F%2A",
            "@multimediatype": "JPEG image file",
            "@type": "IMAGE-HIGH-RES",
            "@size": "742346",
            "@ref": "gr1",
            "@mimetype": "image/jpeg"
          },
          {
            "@category": "thumbnail",
            "@_fa": "true",
            "$": "https://api.elsevier.com/content/object/eid/1-s2.0-S2468823124002967-si1.svg?httpAccept=%2A%2F%2A",
            "@multimediatype": "Scalable Vector Graphics file",
            "@type": "ALTIMG",
            "@size": "11832",
            "@ref": "si1",
            "@mimetype": "image/svg+xml"
          },
          {
            "@category": "standard",
            "@_fa": "true",
            "$": "https://api.elsevier.com/content/object/eid/1-s2.0-S2468823124002967-am.pdf?httpAccept=%2A%2F%2A",
            "@multimediatype": "Acrobat PDF file",
            "@type": "AAM-PDF",
            "@size": "3104200",
            "@ref": "am",
            "@mimetype": "application/pdf"
          }
        ]
      },
      "link": {
        "@rel": "abstract",
        "@href": "https://api.elsevier.com/content/abstract/scopus_id/85189745202"
      }
    }
  }
}