{
  "metadata": {
    "title": "Efficient decarbonylation of 5-hydroxymethylfurfural over an Pd/Al<ce:inf loc=post>2</ce:inf>O<ce:inf loc=post>3</ce:inf> catalyst: Preparation via electrostatic attraction between Pd(II) complex and anionic Al<ce:inf loc=post>2</ce:inf>O<ce:inf loc=post>3</ce:inf>",
    "authors": "; ; ",
    "journal": "Molecular Catalysis",
    "date": "2017-05-31",
    "doi": "10.1016/j.mcat.2017.02.035",
    "abstract": "",
    "uri": "https://api.elsevier.com/content/article/pii/S2468823117301268",
    "pii": "S2468823117301268"
  },
  "fulltext": {
    "full-text-retrieval-response": {
      "scopus-eid": "2-s2.0-85029648697",
      "originalText": "serial JL 315758 291210 291744 291790 291809 31 Molecular Catalysis MOLECULARCATALYSIS 2017-04-01 2017-04-01 2017-04-01 2017-04-01 2017-03-31T21:48:52 1-s2.0-S2468823117301268 S2468-8231(17)30126-8 S2468823117301268 10.1016/j.mcat.2017.02.035 S300 S300.1 FULL-TEXT 1-s2.0-S2468823117X00072 2021-10-25T09:17:11.654594Z 0 0 20170501 20170531 2017 2017-04-01T01:20:04.14901Z absattachment articleinfo articletitlenorm authfirstinitialnorm authfirstsurnamenorm cid cids contenttype copyright crossmark dateloaded dateloadedtxt datesearch datesort dateupdated dco docsubtype doctype doi eid ewtransactionid hubeid indexeddate issn issnnorm itemstage itemtransactionid itemweight openaccess openarchive pg pgfirst pglast pii piinorm pubdateend pubdatestart pubdatetxt pubyr sectiontitle sortorder srctitle srctitlenorm srctype ssids alllist content subj subheadings suppl tomb volfirst volissue volumelist webpdf webpdfpagecount yearnav figure table e-component body mmlmath acknowledge affil appendices articletitle auth authfirstini authfull authkeywords authlast grantnumber grantsponsor highlightsabst primabst ref specialabst 2468-8231 24688231 true 433 433 C Volume 433 17 111 121 111 121 201705 May 2017 2017-05-01 2017-05-31 2017 Regular Papers article fla © 2017 Elsevier B.V. All rights reserved. EFFICIENTDECARBONYLATION5HYDROXYMETHYLFURFURALOVERPDAL2O3CATALYSTPREPARATIONVIAELECTROSTATICATTRACTIONBETWEENPDIICOMPLEXANIONICAL2O3 MENG Q 1 Introduction 2 Experimental section 2.1 Preparation of catalysts 2.2 Activity tests 2.3 Catalyst characterization 3 Results and discussions 3.1 pH-dependent properties of Al2O3 and palladium compounds 3.2 Characterizations of catalysts 3.3 Catalytic performance of PA-X-C catalysts 3.4 The structure-performance relationships 3.5 Catalyst stability 4 Conclusions Acknowledgement Appendix A Supplementary data References BLASER 2001 3 18 H PILLAI 2003 131 138 U CHOUDHARY 2007 70 78 V BISIGNANI 2005 161 164 R CUKIC 2007 25 37 T XIANG 2010 227 235 Y WANG 2015 6337 6349 X BEEBE 1986 663 671 T GASPAR 2000 241 251 A GRUNWALDT 2003 291 295 J HUANG 2013 1206 1212 S CARLSSON 2007 1 7 P ROTH 2000 37 45 D CHEN 2010 307 313 H CHEN 2008 1106 1110 J YANG 2004 61 65 J LOMOT 1997 99 113 D SKOTAK 2004 11 25 M HUBER 2006 4044 4098 G DENG 2015 1594 1601 J WEI 2014 5634 H FUJIWARA 2016 1887 1893 K MAENO 2011 180 181 Z HACKETT 2007 8593 8596 S PUSHKAREV 2012 5196 5201 V ROSTAMNIA 2014 59626 59632 S ROSTAMNIA 2014 86 91 S ROSTAMNIA 2015 218 224 S ROSTAMNIA 2015 471 475 S MENG 2016 4377 4388 Q DUARTE 2016 54 63 D SHI 2015 43 52 C FULAJTAROVA 2015 78 85 K BHOGESWARARAO 2015 65 77 S WANG 2015 1 13 Y MING 1995 23 36 H RAVENELLE 2011 552 561 R MOHINO 2005 192 199 F DRELINKIEWICZ 1999 205 215 A SATSUMA 2015 308 314 A LALIK 2015 16127 16136 E BYCHKOV 2016 103 107 V KIM 2000 285 289 D CONTESCU 1987 259 271 C SEEMALA 2016 640 647 B HUANG 2013 1348 1351 Y GEILEN 2011 6831 6834 F SHEKHAR 2012 4700 4708 M WILLIAMS 2010 14018 14020 W CARGNELLO 2013 771 773 M YU 1997 199 203 J DU 2011 192 201 M ATCHUDAN 2016 432 441 R CHEN 2012 402 408 H ALTASS 2016 177 186 H YUAN 2008 3465 3472 Q LAYMAN 2003 8538 8546 K CAI 2011 9066 W CAO 2011 225 233 D YUAN 2016 119 127 E CASTELLAZZI 2010 218 227 P AGOSTINI 2009 10485 10492 G DIGREGORIO 2009 50 60 F BERTARIONE 2004 3603 3613 S VOROTNIKOV 2012 2496 2504 V GUTMANN 2014 11557 11561 B SIWEK 2016 3806 3812 M MENG 2016 76 82 Q KONG 2015 5914 5920 X KUSUNOKI 2005 645 649 Y MORIMOTO 2002 3806 3807 T SHIBATA 2002 1619 1621 T OLSEN 2015 834 842 E DAVIS 1989 1782 1792 J MAVRIKAKIS 1998 135 147 M WANG 2015 104 112 S HUANG 2014 1068 1072 Y JAE 2013 1158 1162 J AGRELL 2001 239 250 J MENGX2017X111 MENGX2017X111X121 MENGX2017X111XQ MENGX2017X111X121XQ 2019-04-01T00:00:00Z http://creativecommons.org/licenses/by-nc-nd/4.0/ © 2017 Elsevier B.V. All rights reserved. 0 item S2468-8231(17)30126-8 S2468823117301268 1-s2.0-S2468823117301268 10.1016/j.mcat.2017.02.035 315758 2017-03-31T20:20:04.14901-04:00 2017-05-01 2017-05-31 1-s2.0-S2468823117301268-main.pdf https://s3-eu-west-1.amazonaws.com/prod-ucs-content-store-eu-west/content/pii:S2468823117301268/MAIN/application/pdf/947281c3d671910aa728deb8e0c0b9b9/main.pdf https://s3.amazonaws.com/prod-ucs-content-store-us-east/content/pii:S2468823117301268/MAIN/application/pdf/947281c3d671910aa728deb8e0c0b9b9/main.pdf main.pdf pdf true 3219479 MAIN 11 1-s2.0-S2468823117301268-main_1.png https://s3-eu-west-1.amazonaws.com/prod-ucs-content-store-eu-west/content/pii:S2468823117301268/PREVIEW/image/png/6c1181f30faead4b22a767499927aa80/main_1.png https://s3.amazonaws.com/prod-ucs-content-store-us-east/content/pii:S2468823117301268/PREVIEW/image/png/6c1181f30faead4b22a767499927aa80/main_1.png main_1.png png 56218 849 656 IMAGE-WEB-PDF 1 1-s2.0-S2468823117301268-fx1.sml https://s3-eu-west-1.amazonaws.com/prod-ucs-content-store-eu-west/content/pii:S2468823117301268/fx1/THUMBNAIL/image/gif/f9a1023446a5bb402a5b53a789f6c3c4/fx1.sml https://s3.amazonaws.com/prod-ucs-content-store-us-east/content/pii:S2468823117301268/fx1/THUMBNAIL/image/gif/f9a1023446a5bb402a5b53a789f6c3c4/fx1.sml fx1 true fx1.sml sml 4228 88 219 IMAGE-THUMBNAIL 1-s2.0-S2468823117301268-fx2.sml https://s3-eu-west-1.amazonaws.com/prod-ucs-content-store-eu-west/content/pii:S2468823117301268/fx2/THUMBNAIL/image/gif/a88bf4c3bc23fff66263bf286dd54898/fx2.sml https://s3.amazonaws.com/prod-ucs-content-store-us-east/content/pii:S2468823117301268/fx2/THUMBNAIL/image/gif/a88bf4c3bc23fff66263bf286dd54898/fx2.sml fx2 fx2.sml sml 4446 88 219 IMAGE-THUMBNAIL 1-s2.0-S2468823117301268-fx3.sml https://s3-eu-west-1.amazonaws.com/prod-ucs-content-store-eu-west/content/pii:S2468823117301268/fx3/THUMBNAIL/image/gif/8c11dd64a7bc5829572d1c2ab2aa6bf5/fx3.sml https://s3.amazonaws.com/prod-ucs-content-store-us-east/content/pii:S2468823117301268/fx3/THUMBNAIL/image/gif/8c11dd64a7bc5829572d1c2ab2aa6bf5/fx3.sml fx3 fx3.sml sml 3752 88 219 IMAGE-THUMBNAIL 1-s2.0-S2468823117301268-fx4.sml https://s3-eu-west-1.amazonaws.com/prod-ucs-content-store-eu-west/content/pii:S2468823117301268/fx4/THUMBNAIL/image/gif/92b706c8f6e9f1d78094c65605fa8186/fx4.sml https://s3.amazonaws.com/prod-ucs-content-store-us-east/content/pii:S2468823117301268/fx4/THUMBNAIL/image/gif/92b706c8f6e9f1d78094c65605fa8186/fx4.sml fx4 fx4.sml sml 2594 88 219 IMAGE-THUMBNAIL 1-s2.0-S2468823117301268-fx5.sml https://s3-eu-west-1.amazonaws.com/prod-ucs-content-store-eu-west/content/pii:S2468823117301268/fx5/THUMBNAIL/image/gif/46c5c21fdbaccdd3a3b73c832dd0b823/fx5.sml https://s3.amazonaws.com/prod-ucs-content-store-us-east/content/pii:S2468823117301268/fx5/THUMBNAIL/image/gif/46c5c21fdbaccdd3a3b73c832dd0b823/fx5.sml fx5 fx5.sml sml 3279 88 219 IMAGE-THUMBNAIL 1-s2.0-S2468823117301268-fx6.sml https://s3-eu-west-1.amazonaws.com/prod-ucs-content-store-eu-west/content/pii:S2468823117301268/fx6/THUMBNAIL/image/gif/f379281f4f7a9ba241f437f5e7ddac5f/fx6.sml https://s3.amazonaws.com/prod-ucs-content-store-us-east/content/pii:S2468823117301268/fx6/THUMBNAIL/image/gif/f379281f4f7a9ba241f437f5e7ddac5f/fx6.sml fx6 fx6.sml sml 3922 88 219 IMAGE-THUMBNAIL 1-s2.0-S2468823117301268-fx7.sml https://s3-eu-west-1.amazonaws.com/prod-ucs-content-store-eu-west/content/pii:S2468823117301268/fx7/THUMBNAIL/image/gif/10dd1fd4d46bd32df941ac8bd663406d/fx7.sml https://s3.amazonaws.com/prod-ucs-content-store-us-east/content/pii:S2468823117301268/fx7/THUMBNAIL/image/gif/10dd1fd4d46bd32df941ac8bd663406d/fx7.sml fx7 fx7.sml sml 5707 88 219 IMAGE-THUMBNAIL 1-s2.0-S2468823117301268-gr1.sml https://s3-eu-west-1.amazonaws.com/prod-ucs-content-store-eu-west/content/pii:S2468823117301268/gr1/THUMBNAIL/image/gif/8e18fc1f6810d1e1403c2e7250411c5e/gr1.sml https://s3.amazonaws.com/prod-ucs-content-store-us-east/content/pii:S2468823117301268/gr1/THUMBNAIL/image/gif/8e18fc1f6810d1e1403c2e7250411c5e/gr1.sml gr1 gr1.sml sml 4117 85 219 IMAGE-THUMBNAIL 1-s2.0-S2468823117301268-gr2.sml https://s3-eu-west-1.amazonaws.com/prod-ucs-content-store-eu-west/content/pii:S2468823117301268/gr2/THUMBNAIL/image/gif/2d8718587555685c2f3ecf68c57613be/gr2.sml https://s3.amazonaws.com/prod-ucs-content-store-us-east/content/pii:S2468823117301268/gr2/THUMBNAIL/image/gif/2d8718587555685c2f3ecf68c57613be/gr2.sml gr2 gr2.sml sml 10067 164 111 IMAGE-THUMBNAIL 1-s2.0-S2468823117301268-gr3.sml https://s3-eu-west-1.amazonaws.com/prod-ucs-content-store-eu-west/content/pii:S2468823117301268/gr3/THUMBNAIL/image/gif/32846c197d424e4db5013bc5ebcd857b/gr3.sml https://s3.amazonaws.com/prod-ucs-content-store-us-east/content/pii:S2468823117301268/gr3/THUMBNAIL/image/gif/32846c197d424e4db5013bc5ebcd857b/gr3.sml gr3 gr3.sml sml 7729 86 219 IMAGE-THUMBNAIL 1-s2.0-S2468823117301268-gr4.sml https://s3-eu-west-1.amazonaws.com/prod-ucs-content-store-eu-west/content/pii:S2468823117301268/gr4/THUMBNAIL/image/gif/978eceaf2287851d4afa15a9a30f7123/gr4.sml https://s3.amazonaws.com/prod-ucs-content-store-us-east/content/pii:S2468823117301268/gr4/THUMBNAIL/image/gif/978eceaf2287851d4afa15a9a30f7123/gr4.sml gr4 gr4.sml sml 5967 164 210 IMAGE-THUMBNAIL 1-s2.0-S2468823117301268-gr5.sml https://s3-eu-west-1.amazonaws.com/prod-ucs-content-store-eu-west/content/pii:S2468823117301268/gr5/THUMBNAIL/image/gif/790f10a661730f97eff6f1a9f30792dd/gr5.sml https://s3.amazonaws.com/prod-ucs-content-store-us-east/content/pii:S2468823117301268/gr5/THUMBNAIL/image/gif/790f10a661730f97eff6f1a9f30792dd/gr5.sml gr5 gr5.sml sml 6632 85 219 IMAGE-THUMBNAIL 1-s2.0-S2468823117301268-gr6.sml https://s3-eu-west-1.amazonaws.com/prod-ucs-content-store-eu-west/content/pii:S2468823117301268/gr6/THUMBNAIL/image/gif/f586407f1aabdef61b22a42e17ec2077/gr6.sml https://s3.amazonaws.com/prod-ucs-content-store-us-east/content/pii:S2468823117301268/gr6/THUMBNAIL/image/gif/f586407f1aabdef61b22a42e17ec2077/gr6.sml gr6 gr6.sml sml 8408 164 209 IMAGE-THUMBNAIL 1-s2.0-S2468823117301268-gr7.sml https://s3-eu-west-1.amazonaws.com/prod-ucs-content-store-eu-west/content/pii:S2468823117301268/gr7/THUMBNAIL/image/gif/5f908ded8a96f786833d99df04f4ea43/gr7.sml https://s3.amazonaws.com/prod-ucs-content-store-us-east/content/pii:S2468823117301268/gr7/THUMBNAIL/image/gif/5f908ded8a96f786833d99df04f4ea43/gr7.sml gr7 gr7.sml sml 7967 152 219 IMAGE-THUMBNAIL 1-s2.0-S2468823117301268-gr8.sml https://s3-eu-west-1.amazonaws.com/prod-ucs-content-store-eu-west/content/pii:S2468823117301268/gr8/THUMBNAIL/image/gif/df277ee9a5d81979d5e2be8436959eb3/gr8.sml https://s3.amazonaws.com/prod-ucs-content-store-us-east/content/pii:S2468823117301268/gr8/THUMBNAIL/image/gif/df277ee9a5d81979d5e2be8436959eb3/gr8.sml gr8 gr8.sml sml 4412 81 219 IMAGE-THUMBNAIL 1-s2.0-S2468823117301268-sc1.sml https://s3-eu-west-1.amazonaws.com/prod-ucs-content-store-eu-west/content/pii:S2468823117301268/sc1/THUMBNAIL/image/gif/15a2ff7e86a55763cf2c28fec214df9d/sc1.sml https://s3.amazonaws.com/prod-ucs-content-store-us-east/content/pii:S2468823117301268/sc1/THUMBNAIL/image/gif/15a2ff7e86a55763cf2c28fec214df9d/sc1.sml sc1 sc1.sml sml 2557 38 219 IMAGE-THUMBNAIL 1-s2.0-S2468823117301268-sc2.sml https://s3-eu-west-1.amazonaws.com/prod-ucs-content-store-eu-west/content/pii:S2468823117301268/sc2/THUMBNAIL/image/gif/9ca41a859aab060f95aec93379e50036/sc2.sml https://s3.amazonaws.com/prod-ucs-content-store-us-east/content/pii:S2468823117301268/sc2/THUMBNAIL/image/gif/9ca41a859aab060f95aec93379e50036/sc2.sml sc2 sc2.sml sml 2951 36 219 IMAGE-THUMBNAIL 1-s2.0-S2468823117301268-sc3.sml https://s3-eu-west-1.amazonaws.com/prod-ucs-content-store-eu-west/content/pii:S2468823117301268/sc3/THUMBNAIL/image/gif/4cef3dba2f8cc96668a9e441048ff704/sc3.sml https://s3.amazonaws.com/prod-ucs-content-store-us-east/content/pii:S2468823117301268/sc3/THUMBNAIL/image/gif/4cef3dba2f8cc96668a9e441048ff704/sc3.sml sc3 sc3.sml sml 7470 153 219 IMAGE-THUMBNAIL 1-s2.0-S2468823117301268-sc4.sml https://s3-eu-west-1.amazonaws.com/prod-ucs-content-store-eu-west/content/pii:S2468823117301268/sc4/THUMBNAIL/image/gif/0e56b48c6318cbe91eaebc7e7734db97/sc4.sml https://s3.amazonaws.com/prod-ucs-content-store-us-east/content/pii:S2468823117301268/sc4/THUMBNAIL/image/gif/0e56b48c6318cbe91eaebc7e7734db97/sc4.sml sc4 sc4.sml sml 4710 163 132 IMAGE-THUMBNAIL 1-s2.0-S2468823117301268-fx1.jpg https://s3-eu-west-1.amazonaws.com/prod-ucs-content-store-eu-west/content/pii:S2468823117301268/fx1/DOWNSAMPLED/image/jpeg/c1aa2d85544d9dd6c7d83ee054a945d8/fx1.jpg https://s3.amazonaws.com/prod-ucs-content-store-us-east/content/pii:S2468823117301268/fx1/DOWNSAMPLED/image/jpeg/c1aa2d85544d9dd6c7d83ee054a945d8/fx1.jpg fx1 true fx1.jpg jpg 18067 200 500 IMAGE-DOWNSAMPLED 1-s2.0-S2468823117301268-fx2.jpg https://s3-eu-west-1.amazonaws.com/prod-ucs-content-store-eu-west/content/pii:S2468823117301268/fx2/DOWNSAMPLED/image/jpeg/08b0413a26e5dac8fc95ed03bea8d9e1/fx2.jpg https://s3.amazonaws.com/prod-ucs-content-store-us-east/content/pii:S2468823117301268/fx2/DOWNSAMPLED/image/jpeg/08b0413a26e5dac8fc95ed03bea8d9e1/fx2.jpg fx2 fx2.jpg jpg 9659 200 500 IMAGE-DOWNSAMPLED 1-s2.0-S2468823117301268-fx3.jpg https://s3-eu-west-1.amazonaws.com/prod-ucs-content-store-eu-west/content/pii:S2468823117301268/fx3/DOWNSAMPLED/image/jpeg/516c3c1c6dd640ed7cb8499fa9c50857/fx3.jpg https://s3.amazonaws.com/prod-ucs-content-store-us-east/content/pii:S2468823117301268/fx3/DOWNSAMPLED/image/jpeg/516c3c1c6dd640ed7cb8499fa9c50857/fx3.jpg fx3 fx3.jpg jpg 7978 200 500 IMAGE-DOWNSAMPLED 1-s2.0-S2468823117301268-fx4.jpg https://s3-eu-west-1.amazonaws.com/prod-ucs-content-store-eu-west/content/pii:S2468823117301268/fx4/DOWNSAMPLED/image/jpeg/e557ca81634eaa58d231831d1fb5f323/fx4.jpg https://s3.amazonaws.com/prod-ucs-content-store-us-east/content/pii:S2468823117301268/fx4/DOWNSAMPLED/image/jpeg/e557ca81634eaa58d231831d1fb5f323/fx4.jpg fx4 fx4.jpg jpg 9944 200 500 IMAGE-DOWNSAMPLED 1-s2.0-S2468823117301268-fx5.jpg https://s3-eu-west-1.amazonaws.com/prod-ucs-content-store-eu-west/content/pii:S2468823117301268/fx5/DOWNSAMPLED/image/jpeg/f25c67d9ed57330367b294f39c04a384/fx5.jpg https://s3.amazonaws.com/prod-ucs-content-store-us-east/content/pii:S2468823117301268/fx5/DOWNSAMPLED/image/jpeg/f25c67d9ed57330367b294f39c04a384/fx5.jpg fx5 fx5.jpg jpg 7234 200 500 IMAGE-DOWNSAMPLED 1-s2.0-S2468823117301268-fx6.jpg https://s3-eu-west-1.amazonaws.com/prod-ucs-content-store-eu-west/content/pii:S2468823117301268/fx6/DOWNSAMPLED/image/jpeg/63fbdd455b4519b0edaa7ded6c1172fd/fx6.jpg https://s3.amazonaws.com/prod-ucs-content-store-us-east/content/pii:S2468823117301268/fx6/DOWNSAMPLED/image/jpeg/63fbdd455b4519b0edaa7ded6c1172fd/fx6.jpg fx6 fx6.jpg jpg 8432 200 500 IMAGE-DOWNSAMPLED 1-s2.0-S2468823117301268-fx7.jpg https://s3-eu-west-1.amazonaws.com/prod-ucs-content-store-eu-west/content/pii:S2468823117301268/fx7/DOWNSAMPLED/image/jpeg/ed2097a6762b2a4f482d67db5f2aecef/fx7.jpg https://s3.amazonaws.com/prod-ucs-content-store-us-east/content/pii:S2468823117301268/fx7/DOWNSAMPLED/image/jpeg/ed2097a6762b2a4f482d67db5f2aecef/fx7.jpg fx7 fx7.jpg jpg 13733 200 500 IMAGE-DOWNSAMPLED 1-s2.0-S2468823117301268-gr1.jpg https://s3-eu-west-1.amazonaws.com/prod-ucs-content-store-eu-west/content/pii:S2468823117301268/gr1/DOWNSAMPLED/image/jpeg/3e336382019967955bdcf7c005cf740f/gr1.jpg https://s3.amazonaws.com/prod-ucs-content-store-us-east/content/pii:S2468823117301268/gr1/DOWNSAMPLED/image/jpeg/3e336382019967955bdcf7c005cf740f/gr1.jpg gr1 gr1.jpg jpg 30335 292 753 IMAGE-DOWNSAMPLED 1-s2.0-S2468823117301268-gr2.jpg https://s3-eu-west-1.amazonaws.com/prod-ucs-content-store-eu-west/content/pii:S2468823117301268/gr2/DOWNSAMPLED/image/jpeg/ce621f2d6e2561065f1758cb6e3820dc/gr2.jpg https://s3.amazonaws.com/prod-ucs-content-store-us-east/content/pii:S2468823117301268/gr2/DOWNSAMPLED/image/jpeg/ce621f2d6e2561065f1758cb6e3820dc/gr2.jpg gr2 gr2.jpg jpg 164080 973 659 IMAGE-DOWNSAMPLED 1-s2.0-S2468823117301268-gr3.jpg https://s3-eu-west-1.amazonaws.com/prod-ucs-content-store-eu-west/content/pii:S2468823117301268/gr3/DOWNSAMPLED/image/jpeg/1f13da46eb15dbabc773040b9c76440d/gr3.jpg https://s3.amazonaws.com/prod-ucs-content-store-us-east/content/pii:S2468823117301268/gr3/DOWNSAMPLED/image/jpeg/1f13da46eb15dbabc773040b9c76440d/gr3.jpg gr3 gr3.jpg jpg 69368 297 753 IMAGE-DOWNSAMPLED 1-s2.0-S2468823117301268-gr4.jpg https://s3-eu-west-1.amazonaws.com/prod-ucs-content-store-eu-west/content/pii:S2468823117301268/gr4/DOWNSAMPLED/image/jpeg/e93b1fa311d7e05d2f4acdf3b4f4ab02/gr4.jpg https://s3.amazonaws.com/prod-ucs-content-store-us-east/content/pii:S2468823117301268/gr4/DOWNSAMPLED/image/jpeg/e93b1fa311d7e05d2f4acdf3b4f4ab02/gr4.jpg gr4 gr4.jpg jpg 19889 293 376 IMAGE-DOWNSAMPLED 1-s2.0-S2468823117301268-gr5.jpg https://s3-eu-west-1.amazonaws.com/prod-ucs-content-store-eu-west/content/pii:S2468823117301268/gr5/DOWNSAMPLED/image/jpeg/76b0ea5f030ba61970898f35a4c6ba1f/gr5.jpg https://s3.amazonaws.com/prod-ucs-content-store-us-east/content/pii:S2468823117301268/gr5/DOWNSAMPLED/image/jpeg/76b0ea5f030ba61970898f35a4c6ba1f/gr5.jpg gr5 gr5.jpg jpg 56679 293 753 IMAGE-DOWNSAMPLED 1-s2.0-S2468823117301268-gr6.jpg https://s3-eu-west-1.amazonaws.com/prod-ucs-content-store-eu-west/content/pii:S2468823117301268/gr6/DOWNSAMPLED/image/jpeg/9ab4c2a5954fb5b21ba5193fe44f5530/gr6.jpg https://s3.amazonaws.com/prod-ucs-content-store-us-east/content/pii:S2468823117301268/gr6/DOWNSAMPLED/image/jpeg/9ab4c2a5954fb5b21ba5193fe44f5530/gr6.jpg gr6 gr6.jpg jpg 29975 295 376 IMAGE-DOWNSAMPLED 1-s2.0-S2468823117301268-gr7.jpg https://s3-eu-west-1.amazonaws.com/prod-ucs-content-store-eu-west/content/pii:S2468823117301268/gr7/DOWNSAMPLED/image/jpeg/449d01df2b098383acb392848ae3a219/gr7.jpg https://s3.amazonaws.com/prod-ucs-content-store-us-east/content/pii:S2468823117301268/gr7/DOWNSAMPLED/image/jpeg/449d01df2b098383acb392848ae3a219/gr7.jpg gr7 gr7.jpg jpg 46537 392 565 IMAGE-DOWNSAMPLED 1-s2.0-S2468823117301268-gr8.jpg https://s3-eu-west-1.amazonaws.com/prod-ucs-content-store-eu-west/content/pii:S2468823117301268/gr8/DOWNSAMPLED/image/jpeg/b9cae922f7dad9c4fab090344fb71fc4/gr8.jpg https://s3.amazonaws.com/prod-ucs-content-store-us-east/content/pii:S2468823117301268/gr8/DOWNSAMPLED/image/jpeg/b9cae922f7dad9c4fab090344fb71fc4/gr8.jpg gr8 gr8.jpg jpg 32479 279 753 IMAGE-DOWNSAMPLED 1-s2.0-S2468823117301268-sc1.jpg https://s3-eu-west-1.amazonaws.com/prod-ucs-content-store-eu-west/content/pii:S2468823117301268/sc1/DOWNSAMPLED/image/jpeg/5496d5e81bf52cafdce73642d6447146/sc1.jpg https://s3.amazonaws.com/prod-ucs-content-store-us-east/content/pii:S2468823117301268/sc1/DOWNSAMPLED/image/jpeg/5496d5e81bf52cafdce73642d6447146/sc1.jpg sc1 sc1.jpg jpg 7019 66 376 IMAGE-DOWNSAMPLED 1-s2.0-S2468823117301268-sc2.jpg https://s3-eu-west-1.amazonaws.com/prod-ucs-content-store-eu-west/content/pii:S2468823117301268/sc2/DOWNSAMPLED/image/jpeg/3832ec4d5d601324a18ca1c26b0fc54c/sc2.jpg https://s3.amazonaws.com/prod-ucs-content-store-us-east/content/pii:S2468823117301268/sc2/DOWNSAMPLED/image/jpeg/3832ec4d5d601324a18ca1c26b0fc54c/sc2.jpg sc2 sc2.jpg jpg 16757 108 659 IMAGE-DOWNSAMPLED 1-s2.0-S2468823117301268-sc3.jpg https://s3-eu-west-1.amazonaws.com/prod-ucs-content-store-eu-west/content/pii:S2468823117301268/sc3/DOWNSAMPLED/image/jpeg/5994025e414acddce5ecec0825c1fba9/sc3.jpg https://s3.amazonaws.com/prod-ucs-content-store-us-east/content/pii:S2468823117301268/sc3/DOWNSAMPLED/image/jpeg/5994025e414acddce5ecec0825c1fba9/sc3.jpg sc3 sc3.jpg jpg 35569 342 489 IMAGE-DOWNSAMPLED 1-s2.0-S2468823117301268-sc4.jpg https://s3-eu-west-1.amazonaws.com/prod-ucs-content-store-eu-west/content/pii:S2468823117301268/sc4/DOWNSAMPLED/image/jpeg/d20620191a064650cd51253e3f2f7977/sc4.jpg https://s3.amazonaws.com/prod-ucs-content-store-us-east/content/pii:S2468823117301268/sc4/DOWNSAMPLED/image/jpeg/d20620191a064650cd51253e3f2f7977/sc4.jpg sc4 sc4.jpg jpg 25925 419 339 IMAGE-DOWNSAMPLED 1-s2.0-S2468823117301268-mmc1.docx https://s3-eu-west-1.amazonaws.com/prod-ucs-content-store-eu-west/content/pii:S2468823117301268/mmc1/MAIN/application/msword/093d9360b5710fea18c558ee77336958/mmc1.docx https://s3.amazonaws.com/prod-ucs-content-store-us-east/content/pii:S2468823117301268/mmc1/MAIN/application/msword/093d9360b5710fea18c558ee77336958/mmc1.docx mmc1 mmc1.docx docx 2720079 APPLICATION 1-s2.0-S2468823117301268-si1.gif https://s3-eu-west-1.amazonaws.com/prod-ucs-content-store-eu-west/content/pii:S2468823117301268/STRIPIN/image/gif/96a5510a149c63028dc6d52c4a523a7c/si1.gif https://s3.amazonaws.com/prod-ucs-content-store-us-east/content/pii:S2468823117301268/STRIPIN/image/gif/96a5510a149c63028dc6d52c4a523a7c/si1.gif si1 si1.gif gif 700 43 105 ALTIMG MCAT 91 S2468-8231(17)30126-8 10.1016/j.mcat.2017.02.035 Elsevier B.V. Scheme 1 Changes of surface charges on Al2O3 in solution at different pH values. Scheme 1 Scheme 2 Reaction pathway from biomass to FOL. Scheme 2 Scheme 3 pH-dependence of electron interactions between Al2O3 and Pd compounds. Scheme 3 Scheme 4 The reaction pathway of HMF decarbonylation. Scheme 4 Fig. 1 (a) Zeta potential of Al2O3 as a function of pH value; (b) pH of the solution before and after impregnation. Fig. 1 Fig. 2 Representative HRTEM images and particle size distributions of reduced PA-X-C catalysts. Fig. 2 Fig. 3 (a) Pd 3d XPS patterns of the calcined PA-X-C catalysts; (b) Cl 2p XPS patterns of the reduced PA-X-C catalysts. Fig. 3 Fig. 4 The 27Al MAS NMR spectra of Al2O3, PA-2 and PA-5. Fig. 4 Fig. 5 (a) Pyridine-IR of the reduced catalysts; (b) NH3-TPD of the reduced catalysts, the inset shows a higher-magnification view of NH3-TPD for reduced PA-1-C, PA-2-C and Al2O3. Fig. 5 Fig. 6 In situ FTIR spectra of CO adsorbed on reduced catalysts, PL: proportion of linear carbonyls. Fig. 6 Fig. 7 (a) Average Pd particle size and dispersion of metal Pd as a function of pH of impregnation solution; (b) TOFs for decarbonylation as a function of average Pd particle size; (c) TOFs for decarbonylation and average Pd particle size as a function of proportion of linear carbonyls. Fig. 7 Fig. 8 (a) Reusability of PA-1-C catalyst for decarbonylation of HMF to FOL; (b) TG result of used PA-1-C catalyst for five times. Fig. 8 Table 1 Main physicochemical properties of the catalysts. Table 1 Catalysts Initial pH Pd loading(wt%) a SBET b (m2/g) Vp b (m3/g) dp b (nm) dPd c (nm) dPd d (nm) DPd d (%) total acidity e (mmol NH3/gcat.) Al2O3 – – 135 0.5 14.0 – – – 3.96×10−2 PA-1-C 14 0.48 134 0.5 14.0 3.3 3.5 31.8 4.38×10−2 PA-2-C 12 0.51 135 0.5 14.1 3.9 4.2 26.3 4.22×10−2 PA-3-C 8 0.50 130 0.5 14.5 4.7 5.5 20.2 7.51×10−2 PA-4-C 6 0.49 124 0.5 14.6 8.0 9.2 12.1 8.09×10−2 PA-5-C 1 0.51 124 0.5 14.9 6.4 7.1 15.7 8.28×10−2 a Determined by ICP-OES. b The BET surface area, pore volume, and pore size were determined by N2 physical adsorption. c Average diameter of Pd NPs was calculated based on statistical results of TEM images (see Fig. S2). d Pd dispersion and diameter of Pd NPs were determined by CO-chemisorption. e Amount of acid sites was estimated by NH3-TPD. Table 2 Catalytic performances of PA-X-C catalysts a . Table 2 Cat. Conv.(%) Yield (%) Carbon balance(%) C4 +C5 b C6 c PA-1-C 97.3 68.2 14 3.1 3.4 6.2 1.7 95.0 PA-2-C 90.2 66.5 13.1 2.2 0.4 4.5 2.2 93.2 PA-3-C 26.9 25.0 0.2 0.9 0 0.4 0.4 92.1 PA-4-C 7.5 4.6 1.2 0 0 0.8 0.8 90.5 PA-5-C 19.8 7.2 6.8 1.4 0.9 1.8 1.4 92.4 PA−1-C d 100 84.0 6.1 4.0 1.2 3.5 1.0 93.5 PA−1-C e 100 95.0 0.3 2.1 2.0 0.2 0 94.2 a Conditions: 20g 1,4-dioxane, 1g HMF, 0.2g cat., H2 atmosphere, 180°C, 16h. b C5: furfuryl alcohol, 2-methylfuran, furfural, C4: furan. c C6: 2,5-dimethylfuran, 5-methylfurfural. d Reaction for 8h, cooled down and purged with N2, reaction for another 8h. e Solvent: 15g 1,4-dioxane and 5g water; Reaction for 8h, cooled down and purged with H2, reaction for another 8h. Efficient decarbonylation of 5-hydroxymethylfurfural over an Pd/Al2O3 catalyst: Preparation via electrostatic attraction between Pd(II) complex and anionic Al2O3 Qingwei Meng a b Chengwu Qiu a b Hongyan Zheng c Xianqing Li c Yulei Zhu a c ⁎ Yongwang Li a c a State Key Laboratory of Coal Conversion, Institute of Coal Chemistry, Chinese Academy of Sciences, Taiyuan 030001, PR China State Key Laboratory of Coal Conversion Institute of Coal Chemistry Chinese Academy of Sciences Taiyuan 030001 PR China b University of Chinese Academy of Sciences, Beijing 100039, PR China University of Chinese Academy of Sciences Beijing 100039 PR China c Synfuels China Co. Ltd., Beijing 101407, PR China Synfuels China Co. Ltd. Beijing 101407 PR China ⁎ Corresponding author at: State Key Laboratory of Coal Conversion, Institute of Coal Chemistry, Chinese Academy of Sciences, Taiyuan 030001, PR China. Graphical abstract Decarbonylation of 5-hydroxymethylfurfural (HMF) provides a potential way to utilize the abundant natural hexoses derived from cellulose or hemicellulose. Herein, we propose for the first time that a Pd/Al2O3 prepared based on an electrostatic attraction strategy can efficiently convert HMF into furfuryl alcohol (FOL). Ammonia solution with high pH value could realize the electrostatic attraction assumption in the interface of support and palladium complex, while diluted hydrochloric acid with low pH value could cause the instability of H+ ions on Al2O3 surface, leading to larger Pd nanoparticles (NPs) of the catalyst and lowering the decarbonylation activity. A structure-sensitive behavior was discussed that the intrinsic activity of catalyst rised with the decreased size of Pd NPs, which could be illustrated by that the smaller particles exposed more defective Pd sites, on which the decarbonylation adsorption mode of η2(C, O) was preferred. FOL yield of 95% was obtained through modulation of reaction conditions. Keywords Pd/Al2O3 Electrostatic attraction pH 5-hydroxymethylfurfural Decarbonylation 1 Introduction Noble catalysts, as widely known are expensive. How to improve the dispersion or to lower the loading of noble metal is the continued pursuit in catalysis research. Pd/Al2O3, as a commercially available catalyst, [1] has been widely used in the catalytic transformation, including hydrogenation [2–8] and hydrogenolysis [9] reactions, oxidation [10–13] and reduction [14–16] reactions, reforming [17] and isomerization [18] reactions, etc. The strong metal-support interaction and the synergistic effect of the metallic sites and the Lewis acid sites promise Pd/Al2O3 a good stability and superior catalytic performances. [17–19] Thus, preparing efficient Pd/Al2O3 catalyst is highly desirable but challenging. Generally, metallic nanoparticles (NPs) with small sizes exhibit high catalytic activity. [20–26] For example, anchoring Pd species onto the support through bifunctional ligands has been adopted to prepare highly dispersed Pd based catalysts. [27–29] However, the generally complicated preparation methods, such as vapor deposition, alcohol reduction or photodeposition method, restricted their application on a large scale. Incipient wetness impregnation is the most commonly used method to prepare supported noble metal catalysts, considering its safety, simpleness and low cost. [7,24,30–34] Therefore, it is of great significance to develop an effective impregnation method to promote dispersion of Pd/Al2O3 catalyst with small Pd NPs. Moreover, it would shed light on the preparation method of other noble metal catalysts. The impregnation process usually involves different adsorption interactions between active species and the support, which could be tuned by properly choosing the metal compound, the carrier or the pH of the solution. [35,36] The adsorption of palladium complexes on alumina may results from either electrostatic interaction or from simple physisorption. The adsorption strength is affected by the pH of the impregnation solution, as either the charges of the complex or the electric state of the support surface is pH dependent. Al2O3 obtains large amount of hydroxyl groups on the surface especially in the presence of water. [37] In contact with the active phase solution, the surface OH may undergo protonation (when the pH is below the isoelectric point (IEP) of the alumina) or deprotonation (when the pH>IEP of the support). [38] Thus, the support surface would be positively or negatively charged as shown in Scheme 1 . Furthermore, the palladium complex could also be negatively charged (for example in form of [PdCl4]2− or [PdCl3]− with high hydrochloric acid content) or positively charged (for example [Pd(NH3)4]2+ with ammonia water) depending on the pH of solution. [39] On the basis of this understanding, it is envisaged that a highly dispersed Pd/Al2O3 could be prepared through electrostatic attraction between surface-charged support and metallic ions at low pH or at high pH. However, usually Pd/Al2O3 catalysts are prepared by acidic impregnation solution of palladium salts and are restricted to poor dispersion. [40–42] It even has been reported that a highly dispersed Pd/Al2O3 catalyst with high activity was prepared at pH=10, while that prepared at pH=4 was poorly dispersed. [43] This is not consistent with the electrostatic attraction mechanism so well and no work has illustrated this contradiction. Furthermore, though the adsorption isotherm of Pd (II) on alumina at different pH has been studied long ago [44], the effect of pH on the dispersion of catalysts and further on their performances has not been investigated systematically. In this work, we envisage promoting dispersion of Pd/Al2O3 via metal-support electrostatic attraction by tuning the pH of impregnation solution and further shed light on the action mechanism of the pH. Recently, decarbonylation of 5-hydroxymethylfurfural (HMF, one of the key platform chemical in the biomass utilization from cellulose) [45] to furfuryl alcohol (FOL) has attracted much attention (Scheme 2 ) [46]. Presently, homogeneous (Ir compounds) [47] and heterogeneous catalyst (Pd/SBA-15) [46] have been investigated on decarbonylation of HMF aiming at a high FOL yield. However, the homogenous catalyst is unrecoverable and the heterogeneous Pd/SBA-15 is necessarily in need of molecule sieves for unclear reasons presently. Pd/Al2O3 has been used for decarbonylation of HMF, but the catalytic activity is remained to be promoted. [30] Furthermore, it has been reported that, decarbonylation of another platform chemical-furfural is highly structure sensitive, exhibiting high decarbonylation activity on small metallic particles. [25] Therefore, it is expected to be favorable to perform HMF decarbonylation on Pd/Al2O3 catalyst with smaller Pd NPs. In this work, a wide scale of pH values (1–14) were investigated for preparation of Pd/Al2O3 catalyst. The surface charges of Al2O3 support and Pd complex are significantly pH-dependent, leading to different kind of interactions in the interface and resulting in various particle sizes. Decarbonylation performances were significantly improved by promoting dispersion of catalysts prepared in basic ammonia solution. The behavior of structure sensitivity exhibited by the catalytic performances, which are greatly influenced by metallic particle size is an important issue in heterogeneous catalysis. [48–50] Thus, the surface properties of catalysts were explored and their relationship with the size-sensitive behavior was discussed. 2 Experimental section 2.1 Preparation of catalysts Typically, 0.42g palladium chloride (Sigma-Aldrich) was dissolved in the mixture of 2g 25% ammonia solution (Sinopharm Chemical Reagents) and 48g deionized water. Then 15g deionized water was added. The pH of this impregnation solution was 12. Then hydrochloric acid (Sinopharm Chemical Reagents) was used to modify the pH of the solution to 8 and 6 respectively. Pd/Al2O3 was prepared by impregnating 50g Al2O3 (Aluminum Co., Ltd, of China) particles with 20–40mesh in the different impregnation solutions for 5h and drying at 80°C for 12h. The catalysts prepared by solution with pH=12, 8, 6 are donated as PA-2, PA-3, PA-4. PA-1 was prepared in the impregnation solution that PdCl2 dissolved in ammonia solution with the pH=14. PA-5 was prepared in the impregnation solution that PdCl2 dissolved in hydrochloric acid solution with pH=1. All the Pd precursor solutions were put overnight and no precipitate was discovered. The calcined catalysts at 400°C for 2h in air are denoted as PA-X-C (X=1, 2, 3, 4, 5). The Pd loading of all the catalysts is 0.5wt%. 2.2 Activity tests The catalytic tests were performed in a 50mL stainless steel autoclave. Prior to the tests, the catalysts were reduced offline in H2 flow at 200°C for 2h. In a typical run, 1g HMF (Shanghai DEMO Medical Tech. Co., Ltd, China), 20g 1, 4-dioxane (Sinopharm Chemical Reagents) and 0.20g catalysts were introduced into the autoclave. Then, the reactor was purged with H2 for five times to replace the air in the autoclave, and then was heated to 180°C, stirred at 500rpm. Thus, the reactions were conducted under the autogenous pressure. After the reaction, the autoclave was cooled down by ice-water bath. The gas was collected and analyzed off-line by two gas chromatographs (GC) (models 6890N, Agilent, USA) equipped with a FID and a TCD detector respectively. The products in the liquid phase were separated from the catalyst by filtration and were analyzed by a GC (model 6890N, Agilent; column: DB-WAXETR, 30m*0.32mm*0.5um) equipped with a FID detector. The products in the gaseous phase were neglected with a content of less than 1% as determined by the gaseous analysis. The conversion and the selectivity were determined based on the area normalization method. The contents of FOL and HMF were also tested by an internal standard, which were consistent with the results of area normalization method. 2.3 Catalyst characterization Zeta potential measurements were carried out on a Zeta Potential analyser (Malvern Nano-ZS-90) to determine the IEP of Al2O3. The Al2O3 powder was suspended in deionized water through ultrasonic vibration with a concentration of 1mg/ml. Prior to the measurement, the pH value of the suspension was adjusted using 1M HCl or 1M NaOH solution. The BET surface area (SBET), pore size (Dp) and pore volume (VP) were determined by N2 physisorption at −196°C at a micromeritics ASAP 2420 instrument. The samples were degassed under vacuum at 90°C for 1h and 300°C for 8h prior to the measurements. Palladium dispersion was measured by CO chemisorption on Auto Chem. II 2920 equipment (Micromeritics, USA) at 50°C with a pulse of 5% CO/95% He. Prior to the measurements, the samples were in situ reduced by flowing H2 at 200°C for 2h and purged by flowing He at 250°C for 30min to remove the adsorbed hydrogen. The Pd dispersion was calculated based on an adsorption stoichiometry of one CO per exposed palladium atom. X-ray photoelectron spectroscopy was measured on a Thermo XPS ESCALAB 250Xi spectrometer with a monochro-matic Alα (1486.8eV) source. The XPS of reduced catalysts was recorded after in situ reduction by H2 at 200°C for 2h, while that of calcined catalysts was scanned as received. The binding energies were calibrated with the reference of C1s at 284.6eV. The 27Al MAS NMR experiments of the dried catalysts were conducted on a Bruker Avance III 600MHz Wide Bore spectrometer (14.2T), with the MAS spining rate at ∼13kHz. The chemical shift is referenced to Al(NO3)3 solution at 0ppm. The thermal programmed desorption of NH3 was performed on an Auto Chem. II 2920 equipment (Micromeritics, USA) with a mass spectra. In a typical run, 200mg sample was in situ reduced by H2 at 200°C for 2h, purging with He for 1h and cooling down to 100°C. Then, the sample was adsorbed with NH3 until saturation and subsequently flushed with He for 0.5h to remove the physisorbed NH3. Finally, desorption was conducted at a rate of 10°C/min from 100°C to 700°C. The Pyridine-FTIR was performed on a VERTEX70 Bruker FTIR Spectrometer. Prior to measurements, the catalysts were in situ reduced with H2 at 200°C for 2h. Then the samples were degassed in vacuum (1×10−2 MPa) at 200°C for 1h, cooled down to 30°C and exposed to the vapor of pyridine. The Pyridine-FTIR spectra were recorded at 100°C after applying vacuum for 30min. The in situ CO-FTIR was conducted on an infrared spectrometer (VEREX70, Bruker, Germany). Firstly, the catalysts were reduced by H2 (50mL/min) at 200°C for 2h, purged with He for 30min and then cooled down to 30°C. The adsorption of CO was subsequently conducted until saturation. Then the catalysts were purged with helium to remove the physisorbed CO and the CO-FTIR spectra were recorded. Thermogravimetry (TG) experiment was performed on a Mettler Toledo TGA/SDTA 851 instrument (air atmosphere with heating rate of 10°C/min). Prior to the test, the catalyst was dried in air at 100°C for 24h. TEM was conducted on a field-emission transmission electron microscopy (FETEM, JEM-2011F) operated at 200keV. The average diameter of Pd nanoparticles was determined by the following equation. d P d = Σ n i × d i 3 Σ n i × d i 2 Herein, di is the Pd particle diameter, ni is the number of Pd particles of a certain size counted from the TEM pictures. For each sample, at least 150 particles were counted. 3 Results and discussions 3.1 pH-dependent properties of Al2O3 and palladium compounds IEP is the boundary point of positively or negatively charged metallic oxide, at which the zeta potential (ζ) of solid is zero. [51] Thus, ζ study was performed to determine the IEP of Al2O3. Two messages could be delivered by the ζ characterization showed in Fig. 1 (a): (1) the IEP of Al2O3 (pH around 8); (2) the charges state of the support. As ζ measures the potential difference between the slipping plane outside the solid particles and the bulk solution, it reflects the ions state in the electrical double layer. [52] Based on the electrical double-layer theory, the negative and positive ζ reflects the domination of anions and cations on the surface of support respectively. [52] Thus, when pH>IEP, the increased negative ζ with increase of pH indicates the rising concentration of anions outside Al2O3 support, while when pH<IEP, the increased positive ζ reveals the rising concentration of cations on Al2O3 surface. Fig. 1(b) shows the pH changes of solution after impregnation in process of catalysts preparation. When beginning pH>8 (IEP of Al2O3), the pH of solution decrease after impregnating the Al2O3 support (PA-1, PA-2), indicating the adsorption or reaction of the negative OH− on Al2O3 surface. On the contrary, when initial pH<8, the pH increase after impregnation process (PA-4, PA-5), revealing the adsorption of the positive H+ on support surface. At the IEP of Al2O3 (PA-3), the pH exhibits no obvious changes in impregnation procedure, indicating nearly no charges adsorption on support surface. This is consistent with the ζ study results. Another message delivered by Fig. 1(b) is that, at the point with higher difference with the IEP, larger pH changes occurred. This means that larger amount of positive or negative charges (for example PA-5>PA-4, PA-1>PA-2) are adsorbed on Al2O3 surface. The surface electronic states of Al2O3 in Pd precursor solutions with different pH are clear now, still that of Pd complex are necessarily to be uncovered in order to shed light on the metal-support interactions in preparation process. [Pd(NH3)4]2+ nearly exclusively prevails in precursor solution with pH=14, 12 and 8, [44] while anionic species [PdCl4]2− and [PdCl3(H2O)]− are dominant in precursor solution with pH=1. With addition of HCl, the number of coordinated NH3 in Pd complex would decrease, while that of Cl− would inversely increase dependent on pH, following the equation in Scheme 3 (a). [44] The precursor solutions with pH=8 and 6 were obtained by modifying the pH using HCl based on the solution with pH=12, insoluble palladium species in these solution were examined according to the Tyndall effect. As shown in Fig. S1 in the ESI, the phenomena of the solution with pH=6, 8, 12 and 25wt% ammonia water are similar, and the Tyndall effect of all the solutions is slight, indicating that no Pd species in form of colloid exist. Thus, the insoluble Pd(NH3)2Cl2 species was not formed even in solution with pH=8 and 6. However, when we tried to modify pH of the precursor solution with HCl to 5, Pd species started to precipitate, probably becoming Pd(NH3)2Cl2 or its hydrolysed products. Thus, it is deduced that [Pd(NH3)3Cl]+ prevails in solution with pH=6. Based on the understanding of the electronic states of Al2O3 surface and Pd complex, metallic-support interactions, including electrostatic attraction, electrostatic repulsion or simple physical adsorption, are assumed as depicted in Scheme 3 (b). At pH>IEP or pH=1, electrostatic attraction interaction is expected between Pd complexes and the oppositely charged support in precursor solution, while electrostatic repulsion would occur at pH=6 and mainly physical adsorption would occur at pH=8 (the IEP of Al2O3). The electrostatic attraction could promote the metallic dispersion while the electrostatic repulsion would promote the formation of large Pd NPs. Furthermore, this picture could be enlarged at high difference between the support IEP and the precursor solution pH, because larger amount of positive or negative charges on Al2O3 surface may lead to more negative or positive effect on the metal dispersion. Moreover, higher valence of the Pd complexes could also give rise to stronger interaction. Thus, the dispersion of metallic Pd on Al2O3 is expected to follow the order: PA-1-C>PA-2-C>PA-5-C>PA-3-C>PA-4-C. 3.2 Characterizations of catalysts Table 1 presents the main physicochemical properties of the PA-X-C catalysts. The Pd loadings of the catalysts determined by ICP are in agreement with the nominal values. The catalysts prepared in the acidic precursor solutions (PA-4-C and PA-5-C) exhibit relatively lower BET surface area and larger pore diameter compared with that prepared in basic solutions (PA-1-C and PA-2-C), while PA-1-C and PA-2-C catalysts show similar BET results with Al2O3 support. This may due to the slightly corrosive effect of HCl on Al2O3 support. Similar corrosive effect of HNO3 on Al2O3 has been discovered. [30] The reducing BET surface area with the decreasing pH indicates that the corrosion becomes more serious. From CO-chemisorption results, the dispersion is roughly consistent with the expectation, except that PA-5-C failed to the assumption (PA-1-C>PA-2-C >PA-3-C>PA-5-C>PA-4-C). The representative TEM images and particle statistic results are displayed in Fig. 2 . The average diameters of Pd NPs determined by TEM are consistent with that obtained by the CO-chemisorption. The dispersion of the catalysts, except that of PA-5-C, meets the mechanism of charge interactions between the support surface and the metallic precursor during impregnation process as depicted in Scheme 3 (b). N 1s XPS spectra were examined to figure out the state of Pd species in the calcined PA-X-C catalysts as shown in Fig. S3. No obvious peak attributed to N 1s [53] can be observed in all the catalysts, indicating that the coordinated NH3 molecules in the Pd precursors (namely [Pd(NH3)4]2+ and [Pd(NH3)3Cl)] +) were removed by calcination and palladium oxide could be formed. Thus, PdO is the major species in the calcined catalysts PA-X-C (X=1, 2, 3, 4). The dried catalysts PA-X exhibit different colors, due to the different Pd precursors, while the calcined catalysts PA-X-C show the same color, indicating the same Pd species due to the color sensitive property of Pd-based catalysts. Thus, it is deduced that PdO is also the major species in PA-5-C. Fig. 3 (a) shows the deconvolution results for Pd 3d XPS spectra of the as prepared PA-X-C catalysts. Evident Pd 3d3/2 peaks at ∼342.2eV and Pd 3d5/2 peaks at ∼337.0eV are observed, which are in good agreement with the values for Pd (II) state. [54] The peak top of Pd 3d5/2 shifts to higher binding energy side by about 0.3eV (from 337.0eV for PA-1-C to 337.3eV for PA-5-C), and that of Pd 3d3/2 is increased by 0.4eV (from 342.2eV for PA-1-C to 342.6eV for PA-5-C), indicating the decreased electron density of Pd species: PA-1-C>PA-2-C>PA-3-C>PA-4-C>PA-5-C. As evidenced by the zeta potential characterization of Al2O3 and pH changes in the impregnation process shown in Fig. 1, with the decline of the impregnation pH, the anion concentration on Al2O3 surface is gradually decreased to zero and then H+ appears and its concentration is increased. The Al2O3 surface charges are expected to influence the electron density of the Pd species, for example the electron density of Pd species is increased by the anions while decreased by the H+. The Pd 3d XPS results of the as prepared PA-X-C catalysts best reflect this ionic interaction due to the same Pd species (PdO), indicating the assumption to enhance the Pd dispersion by modulating the electro interactions in the interface is reasonable. To examine the effect of the residual Cl− over catalyst surfaces on the catalytic performance, the Cl 2p XPS spectra of the reduced PA-X-C were monitored. As shown in Fig. 3(b), weak peaks attributed to Cl 2p appear at 199.1eV, [55] but no obvious differences in the peak intensity can be observed among the PA-X-C catalysts. This means that major of Cl− ions introduced in the impregnating process could be removed by the subsequent heat treatment, namely calcination and reduction procedures. As no HCl was added in the preparation solution of PA-1-C and PA-2-C, the weak peaks of Cl 2p XP spectra indicate trace residues from Palladium chloride. Thus, it is assumed that the effect of Cl− on the catalysts performances could be neglected. Based on the assumption of electron interactions as described in Scheme 3, PA-5-C, prepared according to the electrostatic attraction mechanism between Al2O3 and Pd precursors in the acidic impregnation solution, should have exhibited a good dispersion. However, both CO-chemisorption and TEM measurements (shown in Table 1) indicate that, the acidic impregnation solution leads to a poor dispersion of metallic Pd. A possible mechanism is the instability of the positively charged alumina surface in acidic solutions, caused by the attack of high content of hydrochloric acid on surface aluminium ions. [44] The BET results in Table 1 indicate the possible corrosion effect of HCl on alumina. The coordination status of Al species in the dried catalyst PA-5 could best reflect the structure damages of Al2O3 by HCl. Fig. 4 shows the 27Al MAS NMR spectra of PA-2, PA-5 and the Al2O3. The peak at 10.1ppm is typical of octahedral aluminum, and the peak at 68.4ppm is derived from tetrahedral aluminum. [43] No obvious changes in spectra of PA-2 according to Al2O3 could be observed, while a splitting peak in the pattern of PA-5 appears at −1.1ppm, indicating the formation of another kind of octahedral aluminum, which is more similar to that of Al(NO3)3 solution whose chemical shift is at 0ppm. This could be explained by that the alumina surfaces were slightly dissolved by acid in the impregnation solution, resulting in different coordinated Al atoms, for example ones partly coordinated by Cl− ions. Therefore, the 27Al MAS NMR provides a direct evidence for the corrosion effect of the acidic impregnating solution on the metal oxide support, which leads to the instability of the positively charged Al2O3 surface. The coordination status of aluminum in catalysts after heat treatment could be reflected by the Lewis acidity of the reduced PA-X-C catalysts. Fig. 5 shows the pyridine-IR and NH3-TPD of the reduced catalysts. In Fig. 5(a), the characteristic adsorption bands at 1448cm−1 (mode 19b), 1492cm−1 (mode 19a), 1615cm−1 (mode 8a), indicating the adsorption of pyridine via hydrogen bonding with hydroxyl groups on surface Al2O3 and nitrogen-lone-pair electrons donating to the coordinatively unsaturated Al3+ ions in octahedral and tetrahedral coordination, are attributed to Lewis acid sites. [56,57] The absence of the characteristic band at 1540cm−1 indicates that the Brønsted acid sites are negligible over the catalysts. The enlarging intensity of peak at 1448cm−1 from PA-1-C to PA-5-C reveals increased Lewis acid amount (unsaturated Al3+). In NH3-TPD patterns shown in Fig. 5(b), a main peak around 175°C and a shoulder around 280°C are observed for all the PA-X-C catalysts, corresponding to the weak and medium acidic sites, respectively. The weak peak around 400°C could be assigned to strong acidic sites. [58] A remarkable rise in the intensity of weak acid peak (peak at 175°C) can be observed as a result of increasing acidity of the impregnating solution (Fig. 5(b)), indicating the increased weak acid amount. However, though the total acid amount roughly follows the tendency of weak acid amount (see Table 2 ), Al2O3 support exhibits less total acid amount than PA-1-C and PA-2-C. This may because that a small quantity of NH3 or NH4 + introduced by impregnating solution was not removed by heat treament (calcination and reduction), as obviously larger peaks appear over PA-1-C and PA-2-C than that over Al2O3 around 500°C (see the inset of Fig. 5(b)), while the calcination temperature is 400°C. Considering that the added HCl in impregnation solution mainly increases the amount of weak acid sites, the NH3-TPD results are consistent with that of Pyridine-IR. As discussed in characterization of Pyridine-IR, the increased acid amount indicates more coordinatively unsaturated Al3+. This confirms the corrosive effect of HCl on Al2O3 as evidenced by the Al27 MAS NMR measurement and further reveals that the destructive effect influences the structure of the reduced catalysts. The H+ ions on Al2O3 surface are thus instable, which would decrease the assumed electrostatic attraction effect (as described in Scheme 3). DFT calculation also revealed that heat treatment could induce dehydration of surface hydroxyls on Al2O3, [59] on which H+ ions cling to, as a result leading to the aggregation of Pd species attracted by H+ ions. Thus, though the residual H+ ions may facilitate the dispersion of Pd species in the impregnation procedure through electrostatic attraction, the following heat treatment would lead to serious aggregation of particles. As a result, PA-5-C exhibits a poor dispersion, even worse than PA-3-C, inconsistent with the ideal assumption. Surface properties of catalysts are closely related with the adsorption characters of substrates, [60] which could subsequently influence the intrinsic reactivity of catalysts. In situ CO-FTIR was used to characterize the exposed faces of supported Pd NPs and their defectivity, with the spectra exhibited in Fig. S4. The spectra in the region of 1750–2200cm−1 corresponding to the chemisorbed CO are resolved and the results are shown in Fig. 6 . Generally, the peak at 2066cm−1 corresponds to linear adsorbed species of CO over Pd atoms of defective sites (or low coordination), at particle corners or edge positions. The asymmetric shape of this peak, tailing toward lower frequencies, indicates the presence of heterogeneous Pd metal sites. [61–64] While the bands around 1800–2000cm−1 (1904 and 1925cm−1 in this work) can be attributed to different types of CO species on bridged sites over well-faceted Pd NPs exposing (111) faces. [61,62] A semi-quantitative comparison of the adsorbed carbonyls was achieved by deconvolution of peaks using a Gaussian function and the proportions of linear carbonyls for the PA-X-C catalysts are also presented in Fig. 6, which follows the order: PA-1-C>PA-2-C>PA-3-C>PA-5-C>PA-4-C. Thus, it can be speculated that a high proportion of low-coordinated Pd atoms are present on PA-1-C and PA-2-C catalysts, while in PA-3-C, PA-4-C and PA-5-C majority of Pd atoms are coordinatively saturated. DFT calculation indicated that aldehyde was adsorbed on the defective Pd surfaces in form of a di-sigma complex η2(C, O), while an acyl intermediate η1(C) might be readily formed on the perfect Pd surface. [60] However, η2(C, O) is the necessary adsorption form for decarbonylation of furfural [34,65], HMF [30] or other aldehyde [66,67]. It is to say that the higher proportion of linear carbonyls indicates the more beneficial adsorption form for decarbonylation reaction. 3.3 Catalytic performance of PA-X-C catalysts Table 2 summarizes the performances of decarbonylation of HMF over the PA-X-C catalysts. 1, 4-dioxane was used as a solvent, as HMF exhibits fantastic stability in this solvent. [46,47] As a certain amount of dehydrogenation and polymerization side reactions would occur on acid sites of catalysts under N2 atmosphere, [30] H2 atmosphere was used in this system. Thus, small amounts of hydrogenation products were produced. The reaction pathway is depicted in Scheme 4 . [68] Hydrogenation/hydrogenolysis of the C6 HMF forms 2, 5-dimethylfuran and 5-methylfurfural, while the decarbonylation products include FOL and its derivatives, namely the C5 furfural and 2-methylfuran, the C4 furan. The catalysts exhibit significantly different catalytic performances. The yield of FOL, as well as that of total decarbonylation yield (Table S1) rise remarkably with increase of metallic dispersion of the catalysts shown in Table 1. Among the catalysts, PA-1-C exhibits the highest total decarbonylation yield of 88.7% (Table S1) with the FOL yield of 68.2%, while PA-4-C shows the lowest total decarbonylation yield of 5.8% (Table S1) with the FOL yield of 4.6%. The C6 hydrogenolysis products (5-methylfurfural and 2, 5-dimethylfuran) as well as the C5 2-methylfuran show generally the same trend with decarbonylation products, except that the yields over PA-3-C are lower than that over PA-5-C catalyst. It is generally considered that metal-acid bifunctional catalysts are good candidates for hydrogenation/hydrogenolysis reactions, where the acid promotes dehydration of the CH2 OH and the metal performs as the active phase to hydrogenate the intermediates. [69,70] Thus, the lower yields of hydrogenolysis products over PA-3-C probably due to its lower acidity than that of PA-5-C as determined by NH3-TPD. The FOL yield of ∼84% was obtained over PA-1-C by purging with fresh N2 in the middle of reaction to suppress the poisoning effect of CO as shown in Table 2. To further promote the FOL selectivity, water was added as a co-solvent and a yield of ∼95% was achieved. The effect mechanism of water is being explored, which may due to the hydrogen bonding interaction between water and the furan ring-branched hydroxymethyl, as well as the decreased acidity of the catalyst by water. These results demonstrate the superior ability of the electrostatic attraction interaction between the different charged Pd precursor and support for dispersing Pd NPs and for promoting the decarbonylation performance. 3.4 The structure-performance relationships Turnover frequencies (TOFs) for decarbonylation based on numbers of Pd sites (determined by CO-chemisorption) were calculated according to the report (see Table S2). [69] To obtain the intrinsic activity of catalysts, HMF conversion was kept below 30% by shortening the reaction time. Interestingly, TOFs decrease with the increasing diameter of Pd NPs (Table 1), revealing a strong structure-sensitive behavior which will be discussed below. The pH of the impregnation solution greatly modulated the charges on Al2O3 surface and that of Pd complex, causing different interfacial interactions in the preparation process, and thus changed the Pd particle size and surface properties, leading to different catalytic performance. With decreasing pH of the impregnation solution from 14 to 6, the metallic dispersion decreases (Fig. 7 (a)), because the interfacial interaction changes from electrostatic attraction (at pH=14, 12) to simple physical adsorption (at pH around 8) and then to electrostatic repulsion (at pH=6) as depicted in Scheme 3(b). Though in impregnating solution of strong acidity, another kind of electrostatic-attractive interaction is envisaged (as shown in Scheme 3(b)), the instability of surface H+ on Al2O3 surface caused by acid (HCl) and heat treatment (calcination and reduction as discussed previously) lead to a low dispersion of PA-5-C (Fig. 7 (a)). The particle size shows the adverse tendency upon changing pH. The TOFs calculated based on total decarbonylation yield decline sharply with increasing average Pd NP size (Fig. 7 (b)), exhibiting high particle size-dependence. Decarbonylation of furfural has also been found to be enhanced over smaller Pt NPs. [25] In Fig. 7(c), TOFs are drawn as a function of the proportion of linear carbonyls and a perfect positive correlation is obtained. Furthermore, the proportion of linear carbonyls reduces over larger Pd particles. As discussed in the characterization of CO-FTIR, the increasing proportion of linear carbonyls indicates preferable aldehyde adsorption form of η2(C, O), which is the necessary adsorption mode for decarbonylation. Thus, we can see that, smaller Pd particles expose more defective Pd surface, leading to more aldehyde (HMF) adsorption in form of η2(C, O), which leads to decarbonylation, while larger Pd NPs expose more well faceted Pd surface, which is in favor of η1(C) adsorption mode, inhibiting decarbonylation reaction. For decarbonylation reaction, metal centers were reported to be the active sites on both homogeneous [66,71–73] and heterogeneous [34,74–76] catalysts. The adsorbed aldehydes went through three elementary steps sequentially: dehydrogenation, decarbonylation and hydrogenation reactions. We have found that furfural transferred from the acidic Al2O3 support to Pd particles before decarbonylation reaction. Furfural adsorbed on Al2O3 by means of electron donation from lone pair of the aldehydic O atom to the coordinatively unsaturated Al (the Lewis acid sites). [30] Thus, the increased acidity (Lewis acid in case of Al2O3) may promote the adsorption of aldehyde and then facilitate the decarbonylation reaction. However, though the acidity increased from PA-1-C to PA-5-C, the decarbonylation reactivity decreased, in confromity with the increased metal particle size. This indicates that the main factor influences decarbonylation performances is the metal particle size. The catalyst acidity influenced the hydrogenolysis side reaction in a metal-acid synergistic mode as disscussed in section 3.3. 3.5 Catalyst stability The reusability of PA-1-C catalyst for HMF decarbonylation to FOL was examined at severe conditions (180°C, 16h). Gradually decrease of HMF conversion and FOL yield was observed after running for three times (Fig. 8 (a)), indicating that the catalyst deactivated after reaction for a long tiome. Meanwhile, the FOL selectivity was increased on used PA-1-C catalyst, which may results from the decreased acidity of the catalyst as we reported previously. [30] This indicates that deposition of carbonaceous species may occurred, covering the acidic sites. Thermo-gravity (TG) experiment of the used PA-1-C catalyst was performed to examine the deposition of carbonaceous species (Fig. 8(b)). Dramatic weight loss of used PA-1-C catalyst was observed, indicating that the carbonaceous species can strongly adsorb on the catalyst, hindering the activity [77] and increase the FOL selectivity. Pd particle size distribution revealed that Pd particles were somewhat grown after 5 runs (Fig. S5). Besides, the recovery processes (e.g., washing) would inevitably cause weight loss and oxidation of catalyst. The results suggested that deactivation of PA-1-C was mainly resulted from deposition of carbonaceous species and Pd particle growth. [78,79] The weight loss and slight oxidation of catalyst may also cause the loss of reactivity to some extent. 4 Conclusions The surface charges of Al2O3 support and Pd complex are highly pH dependent, so electrostatic attraction interaction in the interface could be achieved at appropriate pH, realizing the design of small metallic NPs. Based on theory, both the ammonia solution with high pH and diluted HCl solution with low pH could facilitate the desired electrostatic attraction interaction. However, the HCl could attack the Al2O3 and make the H+ ions on Al2O3 surface instable, which destroys the interfacial interaction. Furthermore, the heat treatment in calcination and reduction procedures could also decrease the concentration of surface hydroxyls on Al2O3, resulting in instability of the surface H+ ions. Thus, only in diluted ammonia solution with a high pH, a well dispersed Pd/Al2O3 catalyst could be prepared with superior decarbonylation performance. Furthermore, a strong structure-sensitive behavior was demonstrated that the intrinsic decarbonylation activity increases with the decreasing size of Pd NPs. This phenomenon can be attributed to that smaller particles expose more coordination unsaturated Pd atoms, with a preferential aldehyde adsorption mode of η2(C, O), essential adsorption form for decarbonylation reaction, while larger Pd NPs expose more well faceted surfaces, which mainly adsorb aldehyde in form of η1(C). As the surface charges of metal-oxides are related with their IEP, while the noble metals could form different coordination status, this strategy could be used for other noble catalysts. Acknowledgement The authors gratefully acknowledge the financial support of the Major State Basic Research Development Program of China (973 Program) (no. 2012CB215305). Appendix A Supplementary data Supplementary data associated with this article can be found, in the online version, at http://dx.doi.org/10.1016/j.mcat.2017.02.035. Appendix A Supplementary data The following is Supplementary data to this article: References [1] H.U. Blaser A. Indolese A. Schnyder H. Steiner M. Studer J. Mol. Catal. A: Chem. 173 2001 3 18 [2] U.R. Pillai E.A. Sahle-Demessie D. Young Appl. Catal. B: Environ. 43 2003 131 138 [3] V.R. Choudhary C. Samanta P. Jana Appl. Catal. A: Gen. 332 2007 70 78 [4] R. Bisignani S. Franceschini O. Piccolo A. Vaccari J. Mol. Catal. A: Chem. 232 2005 161 164 [5] T. Cukic R. Kraehnert M. Holena D. Herein D. Linke U. Dingerdissen Appl. Catal. A: Gen. 323 2007 25 37 [6] Y.Z. Xiang L.N. Kong C.S. Lu L. Ma X.N. Li React. Kinet. Mech. Catal. 100 2010 227 235 [7] X. Wang H. Shi J.H. Kwak J. Szanyi ACS Catal. 5 2015 6337 6349 [8] T.P. Beebe J.T. Yates J. Am. Chem. Soc. 108 1986 663 671 [9] A.B. Gaspar L.C. Dieguez Appl. Catal. A: Gen. 201 2000 241 251 [10] J.D. Grunwaldt C. Keresszegi T. Mallat A. Baiker J. Catal. 213 2003 291 295 [11] S. Huang C. Zhang H. He J. Environ. Sci. China 25 2013 1206 1212 [12] P.A. Carlsson E. Fridell M. Skoglundh Catal. Lett. 115 2007 1 7 [13] D. Roth P. Gelin M. Primet E. Tena Appl. Catal. A: Gen. 203 2000 37 45 [14] H. Chen Z. Xu H. Wan J. Zheng D. Yin S. Zheng Appl. Catal. B: Environ. 96 2010 307 313 [15] J.C. Chen F.Y. Chang M.Y. Wey Catal. Commun. 9 2008 1106 1110 [16] J.B. Yang O.Z. Fu D.Y. Wu S.D. Wang Appl. Catal. B: Environ. 49 2004 61 65 [17] D. Lomot W. Juszczyk Z. Karpinski Appl. Catal. A: Gen. 155 1997 99 113 [18] M. Skotak Z. Karpinski W. Juszczyk J. Pielaszek L. Kepinski D.V. Kazachkin V.I. Kovalchuk J.L. d'Itri J. Catal. 227 2004 11 25 [19] G.W. Huber S. Iborra A. Corma Chem. Res. 106 2006 4044 4098 [20] J. Deng H. Li J. Xiao Y. Tu D. Deng H. Yang H. Tian J. Li P. Ren X. Bao Energy Environ. Sci. 8 2015 1594 1601 [21] H. Wei X. Liu A. Wang L. Zhang B. Qiao X. Yang Y. Huang S. Miao J. Liu T. Zhang Nat. Commun. 5 2014 5634 [22] K. Fujiwara U. Müller S.E. Pratsinis ACS Catal. 6 2016 1887 1893 [23] Z. Maeno T. Kibata T. Mitsudome T. Mizugaki K. Jitsukawa K. Kaneda Chem. Lett. 40 2011 180 181 [24] S.F. Hackett R.M. Brydson M.H. Gass I. Harvey A.D. Newman K. Wilson A.F. Lee Angew. Chem. Int. Ed. 46 2007 8593 8596 [25] V.V. Pushkarev N. Musselwhite K. An S. Alayoglu G.A. Somorjai Nano Lett. 12 2012 5196 5201 [26] S. Rostamnia K. Lamei F. Pourhassan RSC Adv. 4 2014 59626 59632 [27] S. Rostamnia X. Liu D. Zheng J. Colloid Interface Sci. 432 2014 86 91 [28] S. Rostamnia T. Rahmani H. Xin J. Ind. Eng. Chem. 32 2015 218 224 [29] S. Rostamnia T. Rahmani Appl. Organometal. Chem. 29 2015 471 475 [30] Q. Meng C. Qiu G. Ding J. Cui Y. Zhu Y. Li Catal. Sci. Technol. 6 2016 4377 4388 [31] D.P. Duarte R. Martínez L.J. Hoyos Ind. Eng. Chem. Res. 55 2016 54 63 [32] C. Shi P. Zhang Appl. Catal. B: Environ. 170 2015 43 52 [33] K. Fulajtárova T. Soták M. Hronec I. Vávra E. Dobročka M. Omastová Appl. Catal. A: Gen. 502 2015 78 85 [34] S. Bhogeswararao D. Srinivas J. Catal. 327 2015 65 77 [35] Y. Wang Z. Tao B. Wu J. Xu C. Huo K. Li H. Chen Y. Yang Y. Li J. Catal. 322 2015 1 13 [36] H. Ming B.C. Baker Appl. Catal. A: Gen. 123 1995 23 36 [37] R.M. Ravenelle J.R. Copeland W.G. Kim J.C. Crittenden C. Sievers ACS Catal. 2011 552 561 [38] F. Mohino P. Avila P. Salerno A. Bahamonde S. Mendioroz Catal. Today 107–08 2005 192 199 [39] A. Drelinkiewicz M. Hasik S. Quillard C. Paluskiewicz J. Mol. Struct. 511 1999 205 215 [40] A. Satsuma T. Tojo K. Okuda Y. Yamamoto S. Arai J. Oyama Catal. Today 242 2015 308 314 [41] E. Lalik A. Drelinkiewicz R. Kosydar W. Rojek T. Machej J. Gurgul T. Szumełda M. Kołodziej E. Bielańska Int. J. Hydrogen Energy 40 2015 16127 16136 [42] V.Y. Bychkov Y.P. Tulenin M.M. Slinko A.K. Khudorozhkov V.I. Bukhtiyarov S. Sokolov V.N. Korchak Catal. Commun. 77 2016 103 107 [43] D.H. Kim S.I. Woo O.B. Yang Appl. Catal. B: Environ. 26 2000 285 289 [44] C. Contescu M.I. Vass Appl. Catal. 33 1987 259 271 [45] B. Seemala V. Haritos A. Tanksale ChemCatChem 8 2016 640 647 [46] Y.B. Huang Z. Yang M.Y. Chen J.J. Dai Q.X. Guo Y. Fu ChemSusChem 6 2013 1348 1351 [47] F.M.A. Geilen T.V. Stein B. Engendahl S. Winterle M.A. Liauw J. Klankermayer W. Leitner Angew. Chem. Int. Ed. 50 2011 6831 6834 [48] M. Shekhar J. Wang W.S. Lee W.D. Williams S.M. Kim E.A. Stach J.T. Miller W.N. Delgass F.H. Ribeiro J. Am. Chem. Soc. 134 2012 4700 4708 [49] W.D. Williams M. Shekhar W.S. Lee V. Kispersky W.N. Delgass F.H. Ribeiro S.M. Kim E.A. Stach J.T. Miller L.F. Allard J. Am. Chem. Soc. 132 2010 14018 14020 [50] M. Cargnello V.V.T. Doan-Nguyen T.R. Gordon R.E. Diaz E.A. Stach R.J. Gorte P. Fornasiero C.B. Murray Science 341 2013 771 773 [51] J.C. Yu J. Lin R.W.M. Kwok J. Photochem. Photobiol. A 1997 199 203 [52] M. Du G. Zhan X. Yang H. Wang W. Lin Y. Zhou J. Zhu L. Lin J. Huang D. Sun L. Jia Q. Li J. Catal. 283 2011 192 201 [53] R. Atchudan T. Edison M.G. Sethuraman Y.R. Lee Appl. Surf. Sci. 384 2016 432 441 [54] H.J. Chen H.W. Liu W. Liao H.B. Pan C.M. Wai K.H. Chiu J.F. Jen Appl. Catal. B: Environ. 111–112 2012 402 408 [55] H. Altass A.F. Carley P.R. Davies R.J. Davies Surf. Sci. 650 2016 177 186 [56] Q. Yuan A.X. Yin C. Luo L.D. Sun Y.W. Zhang W.T. Duan H.C. Liu C.H. Yan J. Am. Chem. Soc. 130 2008 3465 3472 [57] K.A. Layman M.M. Ivey J.C. Hemminger J. Phys. Chem. B 107 2003 8538 8546 [58] W. Cai J. Yu M. Jaroniec J. Mater. Chem. 21 2011 9066 [59] D.B. Cao Y.W. Li J.G. Wang H.J. Jiao J. Phys. Chem. C 115 2011 225 233 [60] E. Yuan C. Wu G. Liu L. Wang Appl. Catal. A: Gen. 525 2016 119 127 [61] P. Castellazzi G. Groppi P. Forzatti E. Finocchio G. Busca J. Catal. 275 2010 218 227 [62] G. Agostini R. Pellegrini G. Leofanti L. Bertinetti S. Bertarione E. Groppo A. Zecchina C. Lamberti J. Phys. Chem. C 113 2009 10485 10492 [63] F. Di Gregorio L. Bisson T. Armaroli C. Verdon L. Lemaitre C. Thomazeau Appl. Catal. A: Gen. 352 2009 50 60 [64] S. Bertarione D. Scarano A. Zecchina V. Johanek J. Hoffmann S. Schauermann M.M. Frank J. Libuda G. Rupprechter H.J. Freund J. Phys. Chem. B 108 2004 3603 3613 [65] V. Vorotnikov G. Mpourmpakis D.G. Vlachos ACS Catal. 2 2012 2496 2504 [66] B. Gutmann P. Elsner T. Glasnov D.M. Roberge C.O. Kappe Angew. Chem. Int. Ed. 53 2014 11557 11561 [67] M.M. Siwek M.B. Jaffee B. Imperiali J. Am. Chem. Soc. 138 2016 3806 3812 [68] Q. Meng H. Zheng Y. Zhu Y. Li J. Mol. Catal. A: Chem. 421 2016 76 82 [69] X. Kong Y. Zhu H. Zheng X. Li Y. Zhu Y.W. Li ACS Catal. 5 2015 5914 5920 [70] Y. Kusunoki T. Miyazawa K. Kunimori K. Tomishige Catal. Commun. 6 2005 645 649 [71] T. Morimoto K. Fuji K. Tsutsumi K. Kakiuchi J. Am. Chem. Soc. 124 2002 3806 3807 [72] T. Shibata N. Toshida K. Takagi Org. Lett. 4 2002 1619 1621 [73] E.P.K. Olsen T. Singh P. Harris P.G. Andersson R. Madsen J. Am. Chem. Soc. 137 2015 834 842 [74] J. Davis M. Barteau J. Am. Chem. Soc. 111 1989 1782 1792 [75] M. Mavrikakis M.A. Barteau J. Mol. Catal. A: Chem. 131 1998 135 147 [76] S. Wang V. Vorotnikov D.G. Vlachos ACS Catal. 5 2015 104 112 [77] Y.B. Huang M.Y. Chen L. Yan Q.X. Guo Y. Fu ChemSusChem 7 2014 1068 1072 [78] J. Jae W. Zheng R.F. Lobo D.G. Vlachos ChemSusChem 6 2013 1158 1162 [79] J. Agrell K. Hasselbo K. Jansson S.G. Järås M. Boutonnet Appl. Catal. A: Gen. 211 2001 239 250",
      "scopus-id": "85029648697",
      "coredata": {
        "eid": "1-s2.0-S2468823117301268",
        "dc:description": "Decarbonylation of 5-hydroxymethylfurfural (HMF) provides a potential way to utilize the abundant natural hexoses derived from cellulose or hemicellulose. Herein, we propose for the first time that a Pd/Al2O3 prepared based on an electrostatic attraction strategy can efficiently convert HMF into furfuryl alcohol (FOL). Ammonia solution with high pH value could realize the electrostatic attraction assumption in the interface of support and palladium complex, while diluted hydrochloric acid with low pH value could cause the instability of H+ ions on Al2O3 surface, leading to larger Pd nanoparticles (NPs) of the catalyst and lowering the decarbonylation activity. A structure-sensitive behavior was discussed that the intrinsic activity of catalyst rised with the decreased size of Pd NPs, which could be illustrated by that the smaller particles exposed more defective Pd sites, on which the decarbonylation adsorption mode of η2(C, O) was preferred. FOL yield of 95% was obtained through modulation of reaction conditions.",
        "openArchiveArticle": "false",
        "prism:coverDate": "2017-05-31",
        "openaccessUserLicense": null,
        "prism:aggregationType": "Journal",
        "prism:url": "https://api.elsevier.com/content/article/pii/S2468823117301268",
        "dc:creator": [
          {
            "@_fa": "true",
            "$": "Meng, Qingwei"
          },
          {
            "@_fa": "true",
            "$": "Qiu, Chengwu"
          },
          {
            "@_fa": "true",
            "$": "Zheng, Hongyan"
          },
          {
            "@_fa": "true",
            "$": "Li, Xianqing"
          },
          {
            "@_fa": "true",
            "$": "Zhu, Yulei"
          },
          {
            "@_fa": "true",
            "$": "Li, Yongwang"
          }
        ],
        "link": [
          {
            "@_fa": "true",
            "@rel": "self",
            "@href": "https://api.elsevier.com/content/article/pii/S2468823117301268"
          },
          {
            "@_fa": "true",
            "@rel": "scidir",
            "@href": "https://www.sciencedirect.com/science/article/pii/S2468823117301268"
          }
        ],
        "dc:format": "application/json",
        "openaccessType": null,
        "pii": "S2468-8231(17)30126-8",
        "prism:volume": "433",
        "prism:publisher": "Elsevier B.V.",
        "dc:title": "Efficient decarbonylation of 5-hydroxymethylfurfural over an Pd/Al2O3 catalyst: Preparation via electrostatic attraction between Pd(II) complex and anionic Al2O3",
        "prism:copyright": "© 2017 Elsevier B.V. All rights reserved.",
        "openaccess": "0",
        "prism:issn": "24688231",
        "dcterms:subject": [
          {
            "@_fa": "true",
            "$": "Pd/Al2O3"
          },
          {
            "@_fa": "true",
            "$": "Electrostatic attraction"
          },
          {
            "@_fa": "true",
            "$": "pH"
          },
          {
            "@_fa": "true",
            "$": "5-hydroxymethylfurfural"
          },
          {
            "@_fa": "true",
            "$": "Decarbonylation"
          }
        ],
        "openaccessArticle": "false",
        "prism:publicationName": "Molecular Catalysis",
        "openaccessSponsorType": null,
        "prism:pageRange": "111-121",
        "prism:endingPage": "121",
        "pubType": "fla",
        "prism:coverDisplayDate": "May 2017",
        "prism:doi": "10.1016/j.mcat.2017.02.035",
        "prism:startingPage": "111",
        "dc:identifier": "doi:10.1016/j.mcat.2017.02.035",
        "openaccessSponsorName": null
      },
      "objects": {
        "object": [
          {
            "@category": "thumbnail",
            "@height": "88",
            "@width": "219",
            "@_fa": "true",
            "$": "https://api.elsevier.com/content/object/eid/1-s2.0-S2468823117301268-fx1.sml?httpAccept=%2A%2F%2A",
            "@multimediatype": "GIF image file",
            "@type": "IMAGE-THUMBNAIL",
            "@size": "4228",
            "@ref": "fx1",
            "@mimetype": "image/gif"
          },
          {
            "@category": "thumbnail",
            "@height": "88",
            "@width": "219",
            "@_fa": "true",
            "$": "https://api.elsevier.com/content/object/eid/1-s2.0-S2468823117301268-fx2.sml?httpAccept=%2A%2F%2A",
            "@multimediatype": "GIF image file",
            "@type": "IMAGE-THUMBNAIL",
            "@size": "4446",
            "@ref": "fx2",
            "@mimetype": "image/gif"
          },
          {
            "@category": "thumbnail",
            "@height": "88",
            "@width": "219",
            "@_fa": "true",
            "$": "https://api.elsevier.com/content/object/eid/1-s2.0-S2468823117301268-fx3.sml?httpAccept=%2A%2F%2A",
            "@multimediatype": "GIF image file",
            "@type": "IMAGE-THUMBNAIL",
            "@size": "3752",
            "@ref": "fx3",
            "@mimetype": "image/gif"
          },
          {
            "@category": "thumbnail",
            "@height": "88",
            "@width": "219",
            "@_fa": "true",
            "$": "https://api.elsevier.com/content/object/eid/1-s2.0-S2468823117301268-fx4.sml?httpAccept=%2A%2F%2A",
            "@multimediatype": "GIF image file",
            "@type": "IMAGE-THUMBNAIL",
            "@size": "2594",
            "@ref": "fx4",
            "@mimetype": "image/gif"
          },
          {
            "@category": "thumbnail",
            "@height": "88",
            "@width": "219",
            "@_fa": "true",
            "$": "https://api.elsevier.com/content/object/eid/1-s2.0-S2468823117301268-fx5.sml?httpAccept=%2A%2F%2A",
            "@multimediatype": "GIF image file",
            "@type": "IMAGE-THUMBNAIL",
            "@size": "3279",
            "@ref": "fx5",
            "@mimetype": "image/gif"
          },
          {
            "@category": "thumbnail",
            "@height": "88",
            "@width": "219",
            "@_fa": "true",
            "$": "https://api.elsevier.com/content/object/eid/1-s2.0-S2468823117301268-fx6.sml?httpAccept=%2A%2F%2A",
            "@multimediatype": "GIF image file",
            "@type": "IMAGE-THUMBNAIL",
            "@size": "3922",
            "@ref": "fx6",
            "@mimetype": "image/gif"
          },
          {
            "@category": "thumbnail",
            "@height": "88",
            "@width": "219",
            "@_fa": "true",
            "$": "https://api.elsevier.com/content/object/eid/1-s2.0-S2468823117301268-fx7.sml?httpAccept=%2A%2F%2A",
            "@multimediatype": "GIF image file",
            "@type": "IMAGE-THUMBNAIL",
            "@size": "5707",
            "@ref": "fx7",
            "@mimetype": "image/gif"
          },
          {
            "@category": "thumbnail",
            "@height": "85",
            "@width": "219",
            "@_fa": "true",
            "$": "https://api.elsevier.com/content/object/eid/1-s2.0-S2468823117301268-gr1.sml?httpAccept=%2A%2F%2A",
            "@multimediatype": "GIF image file",
            "@type": "IMAGE-THUMBNAIL",
            "@size": "4117",
            "@ref": "gr1",
            "@mimetype": "image/gif"
          },
          {
            "@category": "thumbnail",
            "@height": "164",
            "@width": "111",
            "@_fa": "true",
            "$": "https://api.elsevier.com/content/object/eid/1-s2.0-S2468823117301268-gr2.sml?httpAccept=%2A%2F%2A",
            "@multimediatype": "GIF image file",
            "@type": "IMAGE-THUMBNAIL",
            "@size": "10067",
            "@ref": "gr2",
            "@mimetype": "image/gif"
          },
          {
            "@category": "thumbnail",
            "@height": "86",
            "@width": "219",
            "@_fa": "true",
            "$": "https://api.elsevier.com/content/object/eid/1-s2.0-S2468823117301268-gr3.sml?httpAccept=%2A%2F%2A",
            "@multimediatype": "GIF image file",
            "@type": "IMAGE-THUMBNAIL",
            "@size": "7729",
            "@ref": "gr3",
            "@mimetype": "image/gif"
          },
          {
            "@category": "thumbnail",
            "@height": "164",
            "@width": "210",
            "@_fa": "true",
            "$": "https://api.elsevier.com/content/object/eid/1-s2.0-S2468823117301268-gr4.sml?httpAccept=%2A%2F%2A",
            "@multimediatype": "GIF image file",
            "@type": "IMAGE-THUMBNAIL",
            "@size": "5967",
            "@ref": "gr4",
            "@mimetype": "image/gif"
          },
          {
            "@category": "thumbnail",
            "@height": "85",
            "@width": "219",
            "@_fa": "true",
            "$": "https://api.elsevier.com/content/object/eid/1-s2.0-S2468823117301268-gr5.sml?httpAccept=%2A%2F%2A",
            "@multimediatype": "GIF image file",
            "@type": "IMAGE-THUMBNAIL",
            "@size": "6632",
            "@ref": "gr5",
            "@mimetype": "image/gif"
          },
          {
            "@category": "thumbnail",
            "@height": "164",
            "@width": "209",
            "@_fa": "true",
            "$": "https://api.elsevier.com/content/object/eid/1-s2.0-S2468823117301268-gr6.sml?httpAccept=%2A%2F%2A",
            "@multimediatype": "GIF image file",
            "@type": "IMAGE-THUMBNAIL",
            "@size": "8408",
            "@ref": "gr6",
            "@mimetype": "image/gif"
          },
          {
            "@category": "thumbnail",
            "@height": "152",
            "@width": "219",
            "@_fa": "true",
            "$": "https://api.elsevier.com/content/object/eid/1-s2.0-S2468823117301268-gr7.sml?httpAccept=%2A%2F%2A",
            "@multimediatype": "GIF image file",
            "@type": "IMAGE-THUMBNAIL",
            "@size": "7967",
            "@ref": "gr7",
            "@mimetype": "image/gif"
          },
          {
            "@category": "thumbnail",
            "@height": "81",
            "@width": "219",
            "@_fa": "true",
            "$": "https://api.elsevier.com/content/object/eid/1-s2.0-S2468823117301268-gr8.sml?httpAccept=%2A%2F%2A",
            "@multimediatype": "GIF image file",
            "@type": "IMAGE-THUMBNAIL",
            "@size": "4412",
            "@ref": "gr8",
            "@mimetype": "image/gif"
          },
          {
            "@category": "thumbnail",
            "@height": "38",
            "@width": "219",
            "@_fa": "true",
            "$": "https://api.elsevier.com/content/object/eid/1-s2.0-S2468823117301268-sc1.sml?httpAccept=%2A%2F%2A",
            "@multimediatype": "GIF image file",
            "@type": "IMAGE-THUMBNAIL",
            "@size": "2557",
            "@ref": "sc1",
            "@mimetype": "image/gif"
          },
          {
            "@category": "thumbnail",
            "@height": "36",
            "@width": "219",
            "@_fa": "true",
            "$": "https://api.elsevier.com/content/object/eid/1-s2.0-S2468823117301268-sc2.sml?httpAccept=%2A%2F%2A",
            "@multimediatype": "GIF image file",
            "@type": "IMAGE-THUMBNAIL",
            "@size": "2951",
            "@ref": "sc2",
            "@mimetype": "image/gif"
          },
          {
            "@category": "thumbnail",
            "@height": "153",
            "@width": "219",
            "@_fa": "true",
            "$": "https://api.elsevier.com/content/object/eid/1-s2.0-S2468823117301268-sc3.sml?httpAccept=%2A%2F%2A",
            "@multimediatype": "GIF image file",
            "@type": "IMAGE-THUMBNAIL",
            "@size": "7470",
            "@ref": "sc3",
            "@mimetype": "image/gif"
          },
          {
            "@category": "thumbnail",
            "@height": "163",
            "@width": "132",
            "@_fa": "true",
            "$": "https://api.elsevier.com/content/object/eid/1-s2.0-S2468823117301268-sc4.sml?httpAccept=%2A%2F%2A",
            "@multimediatype": "GIF image file",
            "@type": "IMAGE-THUMBNAIL",
            "@size": "4710",
            "@ref": "sc4",
            "@mimetype": "image/gif"
          },
          {
            "@category": "standard",
            "@height": "200",
            "@width": "500",
            "@_fa": "true",
            "$": "https://api.elsevier.com/content/object/eid/1-s2.0-S2468823117301268-fx1.jpg?httpAccept=%2A%2F%2A",
            "@multimediatype": "JPEG image file",
            "@type": "IMAGE-DOWNSAMPLED",
            "@size": "18067",
            "@ref": "fx1",
            "@mimetype": "image/jpeg"
          },
          {
            "@category": "standard",
            "@height": "200",
            "@width": "500",
            "@_fa": "true",
            "$": "https://api.elsevier.com/content/object/eid/1-s2.0-S2468823117301268-fx2.jpg?httpAccept=%2A%2F%2A",
            "@multimediatype": "JPEG image file",
            "@type": "IMAGE-DOWNSAMPLED",
            "@size": "9659",
            "@ref": "fx2",
            "@mimetype": "image/jpeg"
          },
          {
            "@category": "standard",
            "@height": "200",
            "@width": "500",
            "@_fa": "true",
            "$": "https://api.elsevier.com/content/object/eid/1-s2.0-S2468823117301268-fx3.jpg?httpAccept=%2A%2F%2A",
            "@multimediatype": "JPEG image file",
            "@type": "IMAGE-DOWNSAMPLED",
            "@size": "7978",
            "@ref": "fx3",
            "@mimetype": "image/jpeg"
          },
          {
            "@category": "standard",
            "@height": "200",
            "@width": "500",
            "@_fa": "true",
            "$": "https://api.elsevier.com/content/object/eid/1-s2.0-S2468823117301268-fx4.jpg?httpAccept=%2A%2F%2A",
            "@multimediatype": "JPEG image file",
            "@type": "IMAGE-DOWNSAMPLED",
            "@size": "9944",
            "@ref": "fx4",
            "@mimetype": "image/jpeg"
          },
          {
            "@category": "standard",
            "@height": "200",
            "@width": "500",
            "@_fa": "true",
            "$": "https://api.elsevier.com/content/object/eid/1-s2.0-S2468823117301268-fx5.jpg?httpAccept=%2A%2F%2A",
            "@multimediatype": "JPEG image file",
            "@type": "IMAGE-DOWNSAMPLED",
            "@size": "7234",
            "@ref": "fx5",
            "@mimetype": "image/jpeg"
          },
          {
            "@category": "standard",
            "@height": "200",
            "@width": "500",
            "@_fa": "true",
            "$": "https://api.elsevier.com/content/object/eid/1-s2.0-S2468823117301268-fx6.jpg?httpAccept=%2A%2F%2A",
            "@multimediatype": "JPEG image file",
            "@type": "IMAGE-DOWNSAMPLED",
            "@size": "8432",
            "@ref": "fx6",
            "@mimetype": "image/jpeg"
          },
          {
            "@category": "standard",
            "@height": "200",
            "@width": "500",
            "@_fa": "true",
            "$": "https://api.elsevier.com/content/object/eid/1-s2.0-S2468823117301268-fx7.jpg?httpAccept=%2A%2F%2A",
            "@multimediatype": "JPEG image file",
            "@type": "IMAGE-DOWNSAMPLED",
            "@size": "13733",
            "@ref": "fx7",
            "@mimetype": "image/jpeg"
          },
          {
            "@category": "standard",
            "@height": "292",
            "@width": "753",
            "@_fa": "true",
            "$": "https://api.elsevier.com/content/object/eid/1-s2.0-S2468823117301268-gr1.jpg?httpAccept=%2A%2F%2A",
            "@multimediatype": "JPEG image file",
            "@type": "IMAGE-DOWNSAMPLED",
            "@size": "30335",
            "@ref": "gr1",
            "@mimetype": "image/jpeg"
          },
          {
            "@category": "standard",
            "@height": "973",
            "@width": "659",
            "@_fa": "true",
            "$": "https://api.elsevier.com/content/object/eid/1-s2.0-S2468823117301268-gr2.jpg?httpAccept=%2A%2F%2A",
            "@multimediatype": "JPEG image file",
            "@type": "IMAGE-DOWNSAMPLED",
            "@size": "164080",
            "@ref": "gr2",
            "@mimetype": "image/jpeg"
          },
          {
            "@category": "standard",
            "@height": "297",
            "@width": "753",
            "@_fa": "true",
            "$": "https://api.elsevier.com/content/object/eid/1-s2.0-S2468823117301268-gr3.jpg?httpAccept=%2A%2F%2A",
            "@multimediatype": "JPEG image file",
            "@type": "IMAGE-DOWNSAMPLED",
            "@size": "69368",
            "@ref": "gr3",
            "@mimetype": "image/jpeg"
          },
          {
            "@category": "standard",
            "@height": "293",
            "@width": "376",
            "@_fa": "true",
            "$": "https://api.elsevier.com/content/object/eid/1-s2.0-S2468823117301268-gr4.jpg?httpAccept=%2A%2F%2A",
            "@multimediatype": "JPEG image file",
            "@type": "IMAGE-DOWNSAMPLED",
            "@size": "19889",
            "@ref": "gr4",
            "@mimetype": "image/jpeg"
          },
          {
            "@category": "standard",
            "@height": "293",
            "@width": "753",
            "@_fa": "true",
            "$": "https://api.elsevier.com/content/object/eid/1-s2.0-S2468823117301268-gr5.jpg?httpAccept=%2A%2F%2A",
            "@multimediatype": "JPEG image file",
            "@type": "IMAGE-DOWNSAMPLED",
            "@size": "56679",
            "@ref": "gr5",
            "@mimetype": "image/jpeg"
          },
          {
            "@category": "standard",
            "@height": "295",
            "@width": "376",
            "@_fa": "true",
            "$": "https://api.elsevier.com/content/object/eid/1-s2.0-S2468823117301268-gr6.jpg?httpAccept=%2A%2F%2A",
            "@multimediatype": "JPEG image file",
            "@type": "IMAGE-DOWNSAMPLED",
            "@size": "29975",
            "@ref": "gr6",
            "@mimetype": "image/jpeg"
          },
          {
            "@category": "standard",
            "@height": "392",
            "@width": "565",
            "@_fa": "true",
            "$": "https://api.elsevier.com/content/object/eid/1-s2.0-S2468823117301268-gr7.jpg?httpAccept=%2A%2F%2A",
            "@multimediatype": "JPEG image file",
            "@type": "IMAGE-DOWNSAMPLED",
            "@size": "46537",
            "@ref": "gr7",
            "@mimetype": "image/jpeg"
          },
          {
            "@category": "standard",
            "@height": "279",
            "@width": "753",
            "@_fa": "true",
            "$": "https://api.elsevier.com/content/object/eid/1-s2.0-S2468823117301268-gr8.jpg?httpAccept=%2A%2F%2A",
            "@multimediatype": "JPEG image file",
            "@type": "IMAGE-DOWNSAMPLED",
            "@size": "32479",
            "@ref": "gr8",
            "@mimetype": "image/jpeg"
          },
          {
            "@category": "standard",
            "@height": "66",
            "@width": "376",
            "@_fa": "true",
            "$": "https://api.elsevier.com/content/object/eid/1-s2.0-S2468823117301268-sc1.jpg?httpAccept=%2A%2F%2A",
            "@multimediatype": "JPEG image file",
            "@type": "IMAGE-DOWNSAMPLED",
            "@size": "7019",
            "@ref": "sc1",
            "@mimetype": "image/jpeg"
          },
          {
            "@category": "standard",
            "@height": "108",
            "@width": "659",
            "@_fa": "true",
            "$": "https://api.elsevier.com/content/object/eid/1-s2.0-S2468823117301268-sc2.jpg?httpAccept=%2A%2F%2A",
            "@multimediatype": "JPEG image file",
            "@type": "IMAGE-DOWNSAMPLED",
            "@size": "16757",
            "@ref": "sc2",
            "@mimetype": "image/jpeg"
          },
          {
            "@category": "standard",
            "@height": "342",
            "@width": "489",
            "@_fa": "true",
            "$": "https://api.elsevier.com/content/object/eid/1-s2.0-S2468823117301268-sc3.jpg?httpAccept=%2A%2F%2A",
            "@multimediatype": "JPEG image file",
            "@type": "IMAGE-DOWNSAMPLED",
            "@size": "35569",
            "@ref": "sc3",
            "@mimetype": "image/jpeg"
          },
          {
            "@category": "standard",
            "@height": "419",
            "@width": "339",
            "@_fa": "true",
            "$": "https://api.elsevier.com/content/object/eid/1-s2.0-S2468823117301268-sc4.jpg?httpAccept=%2A%2F%2A",
            "@multimediatype": "JPEG image file",
            "@type": "IMAGE-DOWNSAMPLED",
            "@size": "25925",
            "@ref": "sc4",
            "@mimetype": "image/jpeg"
          },
          {
            "@category": "standard",
            "@_fa": "true",
            "$": "https://api.elsevier.com/content/object/eid/1-s2.0-S2468823117301268-mmc1.docx?httpAccept=%2A%2F%2A",
            "@multimediatype": "Microsoft Word file",
            "@type": "APPLICATION",
            "@size": "2720079",
            "@ref": "mmc1",
            "@mimetype": "application/word"
          },
          {
            "@category": "thumbnail",
            "@height": "43",
            "@width": "105",
            "@_fa": "true",
            "$": "https://api.elsevier.com/content/object/eid/1-s2.0-S2468823117301268-si1.gif?httpAccept=%2A%2F%2A",
            "@multimediatype": "GIF image file",
            "@type": "ALTIMG",
            "@size": "700",
            "@ref": "si1",
            "@mimetype": "image/gif"
          }
        ]
      },
      "link": {
        "@rel": "abstract",
        "@href": "https://api.elsevier.com/content/abstract/scopus_id/85029648697"
      }
    }
  }
}