{
  "metadata": {
    "title": "Exploring the impact of S-doped Fe-N-C materials on the ORR mechanism within a constant potential solvation model",
    "authors": "; ; ",
    "journal": "Molecular Catalysis",
    "date": "2024-04-15",
    "doi": "10.1016/j.mcat.2024.114119",
    "abstract": "",
    "uri": "https://api.elsevier.com/content/article/pii/S246882312400302X",
    "pii": "S246882312400302X"
  },
  "fulltext": {
    "full-text-retrieval-response": {
      "scopus-eid": "2-s2.0-85189690971",
      "originalText": "serial JL 315758 291210 291744 291790 291809 31 Molecular Catalysis MOLECULARCATALYSIS 2024-04-06 2024-04-06 2024-04-06 2024-04-06 2024-05-16T03:59:56 1-s2.0-S246882312400302X S2468-8231(24)00302-X S246882312400302X 10.1016/j.mcat.2024.114119 S300 S300.1 FULL-TEXT 1-s2.0-S2468823124X0005X 2024-05-23T08:05:56.050379Z 0 0 20240415 2024 2024-04-06T18:35:16.094832Z absattachment articleinfo articlenumber articletitlenorm authfirstinitialnorm authfirstsurnamenorm cid cids contenttype copyright crossmark dateloaded dateloadedtxt datesearch datesort dateupdated dco docsubtype doctype doi eid ewtransactionid hubeid indexeddate issn issnnorm itemstage itemtransactionid itemweight openaccess openarchive pg pgfirst pii piinorm pubdatestart pubdatetxt pubyr sectiontitle sortorder srctitle srctitlenorm srctype ssids alllist content subj subheadings suppl tomb volfirst volissue volumelist webpdf webpdfpagecount yearnav figure e-component body mmlmath acknowledge affil appendices articletitle auth authfirstini authfull authkeywords authlast highlightsabst orcid primabst pubtype ref specialabst 2468-8231 24688231 true 559 559 C Volume 559 55 114119 114119 114119 20240415 15 April 2024 2024-04-15 2024 Regular Papers article fla © 2024 Elsevier B.V. All rights reserved. EXPLORINGIMPACTSDOPEDFENCMATERIALSORRMECHANISMWITHINACONSTANTPOTENTIALSOLVATIONMODEL REN P 1 Introduction 2 Computational method 3 Results and discussions 3.1 Electronic characters and structure stability 3.2 ORR catalytic activity 4 Conclusions CRediT authorship contribution statement Acknowledgment Appendix Supplementary materials References ZHANG 2019 20118 20126 J LIU 2022 791 815 M LUO 2020 8575 8585 J ZHAO 2023 2300550 W LIU 2022 3126 3133 G KATO 2020 81 93 M WANG 2021 470 485 H CHEN 2020 101532 W WANG 2020 524 532 X GONG 2022 639 649 Y SUN 2023 107031 Y LIU 2023 202300943 P ZHANG 2021 9835 9837 T MA 2023 212 W BHATT 2017 619 627 M XIAO 2021 147846 B XU 2021 2695 2703 H DU 2023 13913 13922 Z LI 2021 963 970 J KIM 2020 852 863 H SHIMOJO 2001 364 367 F KRESSE 1996 11169 11186 F PERDEW 1996 3865 3868 J MASSARO 2022 112036 A FASULO 2023 5210 5220 F FARO 2020 M SOLIDOXIDEBASEDELECTROCHEMICALDEVICESADVANCESSMARTMATERIALSFUTUREENERGYAPPLICATIONS NG 2020 13799 13808 M HE 2020 16135 16143 F GRIMME 2006 1787 1799 S ZHANG 2020 2425 2434 W HU 2022 18144 18152 X HUANG 2022 21606 21615 Z YANG 2021 14530 14539 J LIU 2020 407 412 Q MENG 2019 17273 17281 Y YAN 2022 154969 T WU 2019 426 430 T LI 2020 2000054 Y QI 2021 148325 W LI 2023 1023 1031 B WANG 2023 202200734 D HE 2023 140 149 H CHOI 2014 9070 9077 C RENX2024X114119 RENX2024X114119XP 2026-04-06T00:00:00.000Z 2026-04-06T00:00:00.000Z http://creativecommons.org/licenses/by-nc-nd/4.0/ © 2024 Elsevier B.V. All rights reserved. https://doi.org/10.15223/policy-017 https://doi.org/10.15223/policy-037 https://doi.org/10.15223/policy-012 https://doi.org/10.15223/policy-029 https://doi.org/10.15223/policy-004 item S2468-8231(24)00302-X S246882312400302X 1-s2.0-S246882312400302X 10.1016/j.mcat.2024.114119 315758 2024-05-23T08:05:56.050379Z 2024-04-15 1-s2.0-S246882312400302X-main.pdf https://s3-eu-west-1.amazonaws.com/prod-ucs-content-store-eu-west/content/pii:S246882312400302X/MAIN/application/pdf/21b6e919dde85c78511efd09f87c0b26/main.pdf main.pdf pdf true 4497101 MAIN 8 1-s2.0-S246882312400302X-main_1.png https://s3-eu-west-1.amazonaws.com/prod-ucs-content-store-eu-west/content/pii:S246882312400302X/PREVIEW/image/png/632335ca093aa479a7329182f21fc342/main_1.png main_1.png png 58741 849 656 IMAGE-WEB-PDF 1 1-s2.0-S246882312400302X-gr3.jpg https://s3-eu-west-1.amazonaws.com/prod-ucs-content-store-eu-west/content/pii:S246882312400302X/gr3/DOWNSAMPLED/image/jpeg/ba01e4a663f6ea89804369c93389c969/gr3.jpg gr3 gr3.jpg jpg 23452 283 320 IMAGE-DOWNSAMPLED 1-s2.0-S246882312400302X-gr4.jpg https://s3-eu-west-1.amazonaws.com/prod-ucs-content-store-eu-west/content/pii:S246882312400302X/gr4/DOWNSAMPLED/image/jpeg/b3dcb60619328d757d9b4c2a0c46c2d7/gr4.jpg gr4 gr4.jpg jpg 80156 522 570 IMAGE-DOWNSAMPLED 1-s2.0-S246882312400302X-gr1.jpg https://s3-eu-west-1.amazonaws.com/prod-ucs-content-store-eu-west/content/pii:S246882312400302X/gr1/DOWNSAMPLED/image/jpeg/97c1a98eaef5a72f08d4bc02dca87606/gr1.jpg gr1 gr1.jpg jpg 67212 197 651 IMAGE-DOWNSAMPLED 1-s2.0-S246882312400302X-gr2.jpg https://s3-eu-west-1.amazonaws.com/prod-ucs-content-store-eu-west/content/pii:S246882312400302X/gr2/DOWNSAMPLED/image/jpeg/da9a4512c07aea559ff88b7a7a0b1c37/gr2.jpg gr2 gr2.jpg jpg 62724 452 649 IMAGE-DOWNSAMPLED 1-s2.0-S246882312400302X-ga1.jpg https://s3-eu-west-1.amazonaws.com/prod-ucs-content-store-eu-west/content/pii:S246882312400302X/ga1/DOWNSAMPLED/image/jpeg/6f02e1b6e9e346fb18853c81480e233d/ga1.jpg ga1 true ga1.jpg jpg 24681 200 310 IMAGE-DOWNSAMPLED 1-s2.0-S246882312400302X-gr7.jpg https://s3-eu-west-1.amazonaws.com/prod-ucs-content-store-eu-west/content/pii:S246882312400302X/gr7/DOWNSAMPLED/image/jpeg/6a3210122edd70a957278f1f521df4ff/gr7.jpg gr7 gr7.jpg jpg 103262 477 597 IMAGE-DOWNSAMPLED 1-s2.0-S246882312400302X-gr8.jpg https://s3-eu-west-1.amazonaws.com/prod-ucs-content-store-eu-west/content/pii:S246882312400302X/gr8/DOWNSAMPLED/image/jpeg/3f0b9db6e2c40f85827ca1b10d08dc2f/gr8.jpg gr8 gr8.jpg jpg 68481 516 635 IMAGE-DOWNSAMPLED 1-s2.0-S246882312400302X-gr5.jpg https://s3-eu-west-1.amazonaws.com/prod-ucs-content-store-eu-west/content/pii:S246882312400302X/gr5/DOWNSAMPLED/image/jpeg/2f3edb963c157ecb3b8d9f411d07d42d/gr5.jpg gr5 gr5.jpg jpg 91830 524 628 IMAGE-DOWNSAMPLED 1-s2.0-S246882312400302X-gr6.jpg https://s3-eu-west-1.amazonaws.com/prod-ucs-content-store-eu-west/content/pii:S246882312400302X/gr6/DOWNSAMPLED/image/jpeg/832c641a314cd7db1ccb6834f85e2a50/gr6.jpg gr6 gr6.jpg jpg 106892 530 627 IMAGE-DOWNSAMPLED 1-s2.0-S246882312400302X-gr3.sml https://s3-eu-west-1.amazonaws.com/prod-ucs-content-store-eu-west/content/pii:S246882312400302X/gr3/THUMBNAIL/image/gif/4e79648caf6d14581228ff94926834ee/gr3.sml gr3 gr3.sml sml 10326 164 185 IMAGE-THUMBNAIL 1-s2.0-S246882312400302X-gr4.sml https://s3-eu-west-1.amazonaws.com/prod-ucs-content-store-eu-west/content/pii:S246882312400302X/gr4/THUMBNAIL/image/gif/9ff300565a373f607e68b36f29b294b5/gr4.sml gr4 gr4.sml sml 11054 164 179 IMAGE-THUMBNAIL 1-s2.0-S246882312400302X-gr1.sml https://s3-eu-west-1.amazonaws.com/prod-ucs-content-store-eu-west/content/pii:S246882312400302X/gr1/THUMBNAIL/image/gif/13268d93ed99c72a1dad36d84485d059/gr1.sml gr1 gr1.sml sml 11621 66 219 IMAGE-THUMBNAIL 1-s2.0-S246882312400302X-gr2.sml https://s3-eu-west-1.amazonaws.com/prod-ucs-content-store-eu-west/content/pii:S246882312400302X/gr2/THUMBNAIL/image/gif/7efe2244a8d4f9bc5ca182c67c532342/gr2.sml gr2 gr2.sml sml 14369 153 219 IMAGE-THUMBNAIL 1-s2.0-S246882312400302X-ga1.sml https://s3-eu-west-1.amazonaws.com/prod-ucs-content-store-eu-west/content/pii:S246882312400302X/ga1/THUMBNAIL/image/gif/3fd98a328931569fb6dab73e5aa89282/ga1.sml ga1 true ga1.sml sml 12965 141 219 IMAGE-THUMBNAIL 1-s2.0-S246882312400302X-gr7.sml https://s3-eu-west-1.amazonaws.com/prod-ucs-content-store-eu-west/content/pii:S246882312400302X/gr7/THUMBNAIL/image/gif/bac3f97db099b4d3309642a3800359b3/gr7.sml gr7 gr7.sml sml 13664 164 205 IMAGE-THUMBNAIL 1-s2.0-S246882312400302X-gr8.sml https://s3-eu-west-1.amazonaws.com/prod-ucs-content-store-eu-west/content/pii:S246882312400302X/gr8/THUMBNAIL/image/gif/bd8f55b3e0ab8608a6233326990f72c9/gr8.sml gr8 gr8.sml sml 11660 164 202 IMAGE-THUMBNAIL 1-s2.0-S246882312400302X-gr5.sml https://s3-eu-west-1.amazonaws.com/prod-ucs-content-store-eu-west/content/pii:S246882312400302X/gr5/THUMBNAIL/image/gif/2813606bae8bdbd705be9e2355ea8c16/gr5.sml gr5 gr5.sml sml 11208 164 196 IMAGE-THUMBNAIL 1-s2.0-S246882312400302X-gr6.sml https://s3-eu-west-1.amazonaws.com/prod-ucs-content-store-eu-west/content/pii:S246882312400302X/gr6/THUMBNAIL/image/gif/b84837b57138afe6a3ec9c702d55a3ed/gr6.sml gr6 gr6.sml sml 14765 164 194 IMAGE-THUMBNAIL 1-s2.0-S246882312400302X-gr3_lrg.jpg https://s3-eu-west-1.amazonaws.com/prod-ucs-content-store-eu-west/content/pii:S246882312400302X/HIGHRES/image/jpeg/30043c552ccaf325ac4e69a9203159de/gr3_lrg.jpg gr3 gr3_lrg.jpg jpg 149615 1256 1418 IMAGE-HIGH-RES 1-s2.0-S246882312400302X-gr4_lrg.jpg https://s3-eu-west-1.amazonaws.com/prod-ucs-content-store-eu-west/content/pii:S246882312400302X/HIGHRES/image/jpeg/1dc7925c5533239f01b819c6a14c14fc/gr4_lrg.jpg gr4 gr4_lrg.jpg jpg 604511 2311 2524 IMAGE-HIGH-RES 1-s2.0-S246882312400302X-gr1_lrg.jpg https://s3-eu-west-1.amazonaws.com/prod-ucs-content-store-eu-west/content/pii:S246882312400302X/HIGHRES/image/jpeg/4d309d0731c5e35bac226e505fbc1bb5/gr1_lrg.jpg gr1 gr1_lrg.jpg jpg 509446 873 2883 IMAGE-HIGH-RES 1-s2.0-S246882312400302X-gr2_lrg.jpg https://s3-eu-west-1.amazonaws.com/prod-ucs-content-store-eu-west/content/pii:S246882312400302X/HIGHRES/image/jpeg/ec880db0ef361b26c7b71b83ccc90c3d/gr2_lrg.jpg gr2 gr2_lrg.jpg jpg 519793 2003 2876 IMAGE-HIGH-RES 1-s2.0-S246882312400302X-ga1_lrg.jpg https://s3-eu-west-1.amazonaws.com/prod-ucs-content-store-eu-west/content/pii:S246882312400302X/HIGHRES/image/jpeg/a446dc0c8c9eeba523274ad7a35396af/ga1_lrg.jpg ga1 true ga1_lrg.jpg jpg 161060 886 1374 IMAGE-HIGH-RES 1-s2.0-S246882312400302X-gr7_lrg.jpg https://s3-eu-west-1.amazonaws.com/prod-ucs-content-store-eu-west/content/pii:S246882312400302X/HIGHRES/image/jpeg/f97b1ce720edb39dba1794eb2618b0e9/gr7_lrg.jpg gr7 gr7_lrg.jpg jpg 740500 2115 2645 IMAGE-HIGH-RES 1-s2.0-S246882312400302X-gr8_lrg.jpg https://s3-eu-west-1.amazonaws.com/prod-ucs-content-store-eu-west/content/pii:S246882312400302X/HIGHRES/image/jpeg/2dd40e226e2d1434c7ecebb3e3dd357b/gr8_lrg.jpg gr8 gr8_lrg.jpg jpg 511768 2286 2814 IMAGE-HIGH-RES 1-s2.0-S246882312400302X-gr5_lrg.jpg https://s3-eu-west-1.amazonaws.com/prod-ucs-content-store-eu-west/content/pii:S246882312400302X/HIGHRES/image/jpeg/f6cc26ad9f6fd608b4c02c2e9f0070cc/gr5_lrg.jpg gr5 gr5_lrg.jpg jpg 661462 2322 2783 IMAGE-HIGH-RES 1-s2.0-S246882312400302X-gr6_lrg.jpg https://s3-eu-west-1.amazonaws.com/prod-ucs-content-store-eu-west/content/pii:S246882312400302X/HIGHRES/image/jpeg/23b43ac6d6452c00ef6069783e193477/gr6_lrg.jpg gr6 gr6_lrg.jpg jpg 847106 2347 2778 IMAGE-HIGH-RES 1-s2.0-S246882312400302X-mmc1.docx https://s3-eu-west-1.amazonaws.com/prod-ucs-content-store-eu-west/content/pii:S246882312400302X/mmc1/MAIN/application/vnd.openxmlformats-officedocument.wordprocessingml.document/d60118bbf8357fee34fc7f010413a7de/mmc1.docx mmc1 mmc1.docx docx 1289446 APPLICATION 1-s2.0-S246882312400302X-si1.svg https://s3-eu-west-1.amazonaws.com/prod-ucs-content-store-eu-west/content/pii:S246882312400302X/image/svg+xml/a5e5544b0bf1744a3f088bc6d2bd05a2/si1.svg si1 si1.svg svg 551 ALTIMG 1-s2.0-S246882312400302X-si10.svg https://s3-eu-west-1.amazonaws.com/prod-ucs-content-store-eu-west/content/pii:S246882312400302X/image/svg+xml/606cbc9764a76ffce7060ed49db2826c/si10.svg si10 si10.svg svg 12588 ALTIMG 1-s2.0-S246882312400302X-si11.svg https://s3-eu-west-1.amazonaws.com/prod-ucs-content-store-eu-west/content/pii:S246882312400302X/image/svg+xml/a785a83a2e85049199f99be73c56fac7/si11.svg si11 si11.svg svg 5306 ALTIMG 1-s2.0-S246882312400302X-si12.svg https://s3-eu-west-1.amazonaws.com/prod-ucs-content-store-eu-west/content/pii:S246882312400302X/image/svg+xml/e75ef76d477561d3e3a1a30726c0f717/si12.svg si12 si12.svg svg 5460 ALTIMG 1-s2.0-S246882312400302X-si13.svg https://s3-eu-west-1.amazonaws.com/prod-ucs-content-store-eu-west/content/pii:S246882312400302X/image/svg+xml/0116b71d8bc8c413f246ad24177e72f8/si13.svg si13 si13.svg svg 4688 ALTIMG 1-s2.0-S246882312400302X-si14.svg https://s3-eu-west-1.amazonaws.com/prod-ucs-content-store-eu-west/content/pii:S246882312400302X/image/svg+xml/b3893c8173acee6b0e379882420701fd/si14.svg si14 si14.svg svg 5470 ALTIMG 1-s2.0-S246882312400302X-si2.svg https://s3-eu-west-1.amazonaws.com/prod-ucs-content-store-eu-west/content/pii:S246882312400302X/image/svg+xml/0dfa7d54d3c735c708144e6253ca9f8a/si2.svg si2 si2.svg svg 644 ALTIMG 1-s2.0-S246882312400302X-si3.svg https://s3-eu-west-1.amazonaws.com/prod-ucs-content-store-eu-west/content/pii:S246882312400302X/image/svg+xml/67f1fd20c182aecd79eca64b1555d887/si3.svg si3 si3.svg svg 15993 ALTIMG 1-s2.0-S246882312400302X-si4.svg https://s3-eu-west-1.amazonaws.com/prod-ucs-content-store-eu-west/content/pii:S246882312400302X/image/svg+xml/e28a88833529b6f6b840a052f1eccd25/si4.svg si4 si4.svg svg 9184 ALTIMG 1-s2.0-S246882312400302X-si5.svg https://s3-eu-west-1.amazonaws.com/prod-ucs-content-store-eu-west/content/pii:S246882312400302X/image/svg+xml/cf9e5b0c122a7591c2c9244d09defef9/si5.svg si5 si5.svg svg 13068 ALTIMG 1-s2.0-S246882312400302X-si6.svg https://s3-eu-west-1.amazonaws.com/prod-ucs-content-store-eu-west/content/pii:S246882312400302X/image/svg+xml/1ff39e411d15d025ab8444504e971720/si6.svg si6 si6.svg svg 11724 ALTIMG 1-s2.0-S246882312400302X-si7.svg https://s3-eu-west-1.amazonaws.com/prod-ucs-content-store-eu-west/content/pii:S246882312400302X/image/svg+xml/6aef7933281e4ec266cabb98e3361fd3/si7.svg si7 si7.svg svg 12425 ALTIMG 1-s2.0-S246882312400302X-si8.svg https://s3-eu-west-1.amazonaws.com/prod-ucs-content-store-eu-west/content/pii:S246882312400302X/image/svg+xml/b7e43140f4a10d0410948cdbc844022b/si8.svg si8 si8.svg svg 11104 ALTIMG 1-s2.0-S246882312400302X-si9.svg https://s3-eu-west-1.amazonaws.com/prod-ucs-content-store-eu-west/content/pii:S246882312400302X/image/svg+xml/cf05d895bafd7b982d9427b997955b2b/si9.svg si9 si9.svg svg 10072 ALTIMG 1-s2.0-S246882312400302X-am.pdf am am.pdf pdf 820453 AAM-PDF https://s3-eu-west-1.amazonaws.com/prod-ucs-content-store-eu-west/content/egi:10X44XN0VDW/MAIN/application/pdf/f3f7339c9454c22f0008da0aac76f4be/am.pdf MCAT 114119 114119 S2468-8231(24)00302-X 10.1016/j.mcat.2024.114119 Elsevier B.V. Fig. 1 The atomic structures of FeN4S-N and optimized reaction models during ORR catalyzed by pyridinic FeN4S2 at −2.0 e. Fig 1 Fig. 2 Ionic countercharge density isosurfaces of 1 × 10−7 e/Å −3 for *OOH adsorbed on pyrrolic FeN4S2 corresponding to (a) −1.92 V/SHE and (b) 1.31 V/SHE, adjusted by adding and removing two, respectively. The cyan and yellow areas indicated positively and negatively charged ions, respectively. Fig 2 Fig. 3 Formation energy (eV) and binding energy (eV) of FeN4S-N. Fig 3 Fig. 4 Free energy diagram for the oxygen reduction process on FeN4S-N at 0 V and 1.23 V under vacuum environment. Fig 4 Fig. 5 Calculated energies of the FeN4S-N and corresponding three reaction intermediates as a function of the applied electrode potential. Fig 5 Fig. 6 Contour plot of Bader charge and potential dependent adsorption energy of O2 on FeN4S-N. Fig 6 Fig. 7 Free energy diagrams of ORR for FeN4S-N under constant potential implicit solvent model. Fig 7 Fig. 8 Structures of the initial state (IS), transition state (TS), and final state (FS) of ORR elemental steps on FeN4S2 (−2.0 e); the corresponding energy barriers and reaction energy are also marked: (a) *O2 + H + → *OOH; (b) *OOH + H + → *O + H2O; (c) *O + H + → *OH; (d) *OH + H + → *H2O. Fig 8 Research Paper Exploring the impact of S-doped Fe-N-C materials on the ORR mechanism within a constant potential solvation model Penghui Ren Conceptualization Writing – original draft a ⁎ Zhongbao Feng Software c Ying Zhao Visualization a Chunyang Liu Data curation a Huixia Li Data curation a Ruopeng Li Writing – review & editing b ⁎ Xuebo Chen Conceptualization Data curation a ⁎ a Shandong Laboratory of Advanced Materials and Green Manufacturing at Yantai, Yantai 264000, China Shandong Laboratory of Advanced Materials and Green Manufacturing at Yantai Yantai 264000 China aShandong Laboratory of Advanced Materials and Green Manufacturing at Yantai, Yantai 264000, China b School of Chemistry and Chemical Engineering, Harbin Institute of Technology, Harbin 150001, China School of Chemistry and Chemical Engineering Harbin Institute of Technology Harbin 150001 China bSchool of Chemistry and Chemical Engineering, Harbin Institute of Technology, Harbin 150001, China c Key Laboratory for Ecological Metallurgy of Multimetallic Mineral (Ministry of Education), Northeastern University, Shenyang 110819, China Key Laboratory for Ecological Metallurgy of Multimetallic Mineral (Ministry of Education) Northeastern University Shenyang 110819 China cKey Laboratory for Ecological Metallurgy of Multimetallic Mineral (Ministry of Education), Northeastern University, Shenyang 110819, China ⁎ Corresponding authors. The widespread application of S doping in Fe-N-C materials aims to enhance the catalytic activity for oxygen reduction reactions (ORR). However, the current doping strategies are primarily centered on the first coordination layer encompassing Fe atoms. Consequently, this study employs first-principles calculations to compute the formation and binding energies of FeN4 doped with S atom. It further delves into the influence of diverse doping sites on catalyst stability and meticulously analyzes the configurations and corresponding ORR activities of four catalysts, namely FeN4S-N (Number=0∼3), utilizing a constant-potential implicit solvent model to simulate authentic electrocatalytic environments. The findings reveal that under vacuum conditions, FeN4S1 exhibits the utmost ORR activity, boasting a potential of 0.53 V. Conversely, within the constant-potential implicit solvation model, FeN4S2 emerges as the catalyst with the highest ORR activity, achieving a potential of 0.39 V. Therefore, calculations leveraging the constant-potential solvation model offer more realistic insights into catalyst design, thereby guiding the development of superior catalysts. Graphical abstract Image, graphical abstract Keywords Implicit solvent model Single atom catalysts ORR mechanisms Constant-potential Data availability Data will be made available on request. 1 Introduction Over the past few years, the extravagant consumption of traditional energy has led to global energy depletion and environmental pollution [1–3]. To address the above issues, researchers have conducted research on various clean energy technologies, such as proton exchange membrane fuel cell (PEMFC) [4–6], due to its high energy efficiency, high energy density, and negligible exhaust emissions, it has been regarded as an important research direction. Although PEMFC have many advantages, its oxygen reduction reaction (ORR) kinetic process is relatively slow, which has become an important research barrier in the development of PEMFC [7]. At present stage, the cathode catalyst for proton exchange membrane batteries is composed of Pt/C on the market. However, Pt has disadvantages such as high price, scarcity, and poor durability, which makes it impossible for PEMFC to be widely used in automobiles [8–10]. Therefore, as a cheaper and less polluting non precious metal catalyst, it has become a favored object for researchers. During the research period of proton exchange membranes, transition metal oxides and multiple heteroatoms-doped carbon materials became the main research objects of cathode catalysts [11–13]. The co-doping of transition metal and non-metallic atoms has the characteristics of high activity and low cost in graphene catalysts. Ma et al. [14] compared the electronic properties, adsorption energy, structural stability and catalytic activity of ruthenium nitrogen co-doped graphene catalysts with single atom ruthenium doped graphene catalysts. They found that the structure of ruthenium is stable and the ORR crossing point is lower. Bhatt et al. [15] applied density functional theory to calculate the 2-electron transport pathway and 4-electron transport pathway in the ORR process of M-N2-G (M=Ti, Cu, Mo, Nb and Ru) catalyst, and compared their electrocatalytic performance. The calculation results indicate that the four electron transfer paths are more likely to occur on the surface of M-N2-G (M=Ti, Mo, Nb and Ru), and the energy required to generate water molecules is lower. Xiao et al. [16] used first principles calculations to investigate the oxygen reduction and evolution reactions of TMN4 (TM=Fe, Co and Ni) encapsulated graphene and fluorographene in order to develop metal air batteries with better performance. They found that TMN4 improved the ORR/OER activity of graphene, especially with H/F modified catalysts. During the ORR process, ηORR of G/FeN4, G/FeN4 and GF/FeN4 are 0.98 V, 0.46 V and 0.38 V, respectively, and the CoN4 has better OER activity, ηORR of G/CoN4, G/CoN4 and GF/CoN4 are −0.73 V, −0.50 V and −0.53 V, respectively. Based on the above results, it can be seen that FeN4 has broader development prospects as metal air batteries catalysts. Recent studies have shown that sulfur atom doping can reduce the adsorption strength of Fe centers to oxygen-containing intermediates, thereby improving the intrinsic activity of Fe-N-C catalysts. Xu and his team [17] successfully prepared a Fe-N-S-C catalyst with high intrinsic activity by substituting nitrogen atoms in FeN4 with sulfur atoms. Experimental results have demonstrated that the Fe-N-S-C catalyst exhibits high porosity and abundant active sites, achieving a half-wave potential of 0.9 V and excellent stability under 0.1 M KOH conditions. Furthermore, its ORR performance in all-solid-state zinc-air batteries has been further verified, displaying high power densities of 109 and 68 mW cm−2, respectively, as well as good discharge stability. However, the optimal doping site of sulfur atoms in FeN4 remains to be studied. Therefore, this paper adopts the first-principles method to calculate the formation energy, binding energy, density of states, charge, adsorption energy, and redox process of Fe-N-S-C catalysts containing different sulfur sites (see Fig. 1a∼1d ). Among them, the most important aspect is the changes in the interaction between different oxygen-containing intermediates and the catalyst. Therefore, to simulate the electrochemical catalytic reaction process under realistic conditions, solvation effects and constant potential have been added to the model to obtain the changes in the adsorption configurations of oxygen-containing intermediates on the catalyst surface. 2 Computational method This paper applies the density-functional theory (DFT) [18–20] method to calculate all materials in the article using Vienna ab-initio simulation package (VASP) [21,22], and the Perdew-Burke-Ernzerhof (PBE) [23–26] exchange-correlation energy with Hubbard correction (+U) is employed. The adopted U values for Fe is 4.30 eV [27]. function within the generalized gradient approximation was applied by the exchange-correlation energy. The convergence criteria for energy and force during the optimization process were 0.01 eV/Å and 10−5 eV, respectively. The cutoff energy and K-point were set to 500 eV and 3 × 3 × 1, respectively [28]. The vacuum layer thickness of the model was 15 Å in the z-direction for avoiding interaction between planes. The zero damping DFT-D3 method of Grimme was used to consider the van der Waals interaction forces [29]. The climbing image nudged elastic band (CI-NEB) method was used to calculate the reaction transition state and potential energy barrier of oxygen-containing intermediates on the catalyst surface [30]. The model solvent environment was constructed using the VASPsol code [31], with a relative permittivity of 80 simulating the aqueous electrolyte, an effective surface tension parameter of 0, and no consideration of cavitation energy. The linearized Poissobn-Boltzmann model with a Debye length of 3 Å mimics the compensating charge. To describe the reaction mechanism of intermediates at different electrode potentials, the excess charge of the unit cell was varied from −2.0 e to +2.0 e in increments of 0.5 e in this study [32]. Fig. 2 showed an example of the coupling between application potential, adsorption configuration, and corresponding ion distribution. The data obtained from VASP calculations were post-processed using the VASPKIT code [33]. In this study, graphene was used as the original model, with two C atoms removed to fix the Fe atom. Four surrounding C atoms were then replaced with four N atoms, and S atom was substituted for C atoms in the vicinity of the Fe atom, starting from the nearest and proceeding outward, to construct the FeN4S-N (Number=0∼3) catalyst. The formation energy, binding energy and adsorption energy are obtained by Eqs. (1)∼(5) [34–37]. (1) E f = E c a t a l y s t + x μ C − ( E G + y μ N + E M + z E S ) (2) E b = E c a t a l y s t − E G − E M (3) E a d s ( * O O H ) = E ( * O O H ) − E ( s l a b ) − 2 E ( H 2 O ) + 3 2 E ( H 2 ) (4) E a d s ( * O ) = E ( * O ) − E ( s l a b ) − E ( H 2 O ) + E ( H 2 ) (5) E a d s ( * O H ) = E ( * O H ) − E ( s l a b ) − E ( H 2 O ) + 1 2 E ( H 2 ) Where, Ecatalyst, EG and EM are catalyst energy in a solvent-free environment, graphene sheet and single metal atom, respectively. µC is the chemical potential of the energy of a single carbon atom on intact graphene, and x is the number of carbon atoms replaced. µN is half the energy of nitrogen molecules, y represents the number of nitrogen atoms on the catalyst. ES is the energy of single sulfur atom, and z represents the number of S atom doped in the catalytic sheet. The potential- dependent energy of the model (E) is defined in Eq. (6). [31] (6) E = E D F T − Δ n ( V s o l + Φ q / e ) Here, EDFT is the DFT-calculated energy, Vsol is the electrostatic potential of the bulk electrolyte, and -Φq is the work function of the charged system. The referenced to the standard hydrogen electrode (SHE) scale is formulated in Eq. (7). (7) U q ( V / S H E ) = − 4.6 V − Φ / e The energy change of each reaction in the ORR process can be obtained from Eq. (8) [38,39]. (8) Δ G = Δ E D F T + Δ Z P E − T Δ S − n e U + Δ G p H Here, the ΔEDFT is the calculated DFT reaction energy, ΔZPE is the change in zero-point energy (ZPE) calculated from the vibrational frequencies and ΔS is the change in the entropy referring to thermodynamics databases. The reference potential during the reaction process is adjusted to standard hydrogen electrode (SHE), n and U are the number of transferred electrons and electrode potential, respectively. ΔGpH=kBT × ln10 × pH, here, kB is the Boltzmann constant, and in this work, we assume that the ORR reaction environment is an acidic system, where pH is equal to 0. 3 Results and discussions 3.1 Electronic characters and structure stability Four different configurations of catalysts (FeN4S0∼FeN4S3) were constructed in this study, and their formation energies were calculated using Eq. (1), as shown in Table S1 and Fig. 3 . According to Table S1 and Fig. 3, the catalyst materials were easier to synthesize without doping with S atom, with the formation energy of FeN4S0 being −5.80 eV. However, after doping S atom into FeN4S0, the formation energy of FeN4S2 was the highest, with a value of −2.99 eV. In addition, in order to analyze the stability of four catalyst materials, Eq. (2) was used to calculate the binding energy of the catalyst, and they were shown in Fig. 3. The binding energy of FeN4S0∼FeN4S3 were ordered by −1.24 eV (FeN4S0) > −1.01 eV (FeN4S2) > −0.73 eV (FeN4S3) > −0.60 eV (FeN4S1). Based on the above results, it could be concluded that FeN4S0 exhibits the best stability, while FeN4S2 exhibits the highest stability after doping with S atom. In the absence of a solvent environment and under the influence of electrode potential, we conducted a thorough analysis of the density of states (DOS) and Bader charges of four catalyst materials using VASP software. The DOS diagram of FeN4S0 exhibits a large energy gap of 0.38 eV (see Fig. S1). With the introduction of S atoms, the energy gaps of FeN4S1 and FeN4S2 narrow, and as the distance between Fe and S further increases, the energy gap of FeN4S2 correspondingly widens, which is consistent with the trend of charge variation. Specifically, we explored the changes in charge transfer between different atoms after doping with S atom, as shown in Fig. S2. When no S atom was doped, Fe in FeN4S0 acquires 1.04 e of electrons. However, due to the strong electronegativity of S atom, when S atom was doped into FeN4S0 to form FeN4S1 and FeN4S2, they acquired 0.96 e of electrons, respectively. As the distance between Fe and S increases, the number of electrons on Fe gradually increased, as illustrated in Fig. S2. This electron transfer results in an increase in the valence state of Fe in FeN4S1 and FeN4S2, which in turn reduced the adsorption capacity for oxygen-containing intermediates [40]. To gain a deeper understanding of the adsorption changes of oxygen-containing intermediates on the surface of the catalyst, we calculated the adsorption energies of oxygen-containing intermediates (O2, OOH, OH, and O) on the surface of the catalyst. According to the calculation results, oxygen-containing intermediates were more likely to adsorb on the metal sites of the catalyst. All calculation models, adsorption energies, and changes in interatomic distances were presented in Fig. S3, Tables S2, and S3. As the first step of the ORR reaction, the adsorption energy and morphology of O2 on the catalyst surface played a crucial role in subsequent reactions. Based on Fig. S3 ((a), (e), (i), and (m)) and Table S3, the adsorption model structures of O2 on the catalyst surface tend to have a certain angle, ranging from 102° to 134° In the FeN4S0 model, the adsorption energy of O2 is −2.50 eV (refer to Table S2). After doping with S atom, the absorption energy of O2 decreased to −1.97 eV, −2.14 eV, and −2.32 eV, respectively. Based on the above results, it could be seen that the addition of S atom weakens the adsorption capacity of Fe atoms for O2, and as the distance between S atom and Fe atoms changes, the distance between the catalyst and O2 also varied, being 1.77 Å, 1.80 Å, 1.76 Å, and 1.83 Å, respectively. As observed in Fig. S3 ((a), (e), (i), and (m)), O2 moved towards the position of S atom, resulting in significant changed in the angles between O2 and FeN4S-N. Even in the FeN4S3 model, the angle between O2 and FeN4S3 changed to 102° In the four-electron reaction process of ORR, once O2 was adsorbed on the surface of the catalyst, it would subsequently form *OOH, *O, and *OH in sequence. As clearly seen in Table S2, these oxygen-containing intermediates exhibited excellent adsorption states on the catalyst surface, which was crucial for ensuring the smooth progress of the ORR reaction. Upon further examination of Table S3, we observed that the distances and angle variations between these oxygen-containing intermediates and the catalyst surface remain within a narrow range, indicating stable adsorption characteristics. The strength of the adsorption states during the adsorption process of *OOH, *O, and *OH could be quantitatively represented by their adsorption energies on the FeN4S-N surface, with specific values detailed in Table S2. The data in Table S2 revealed that FeN4S-N exhibited relatively strong adsorption capabilities towards OOH, O, and OH, with OH adsorption being particularly prominent. The adsorption energies of OH on the FeN4S-N surface were −3.85 eV, −3.25 eV, −4.40 eV, and −3.93 eV, respectively. However, it was noteworthy that excessively strong adsorption energy can sometimes poison the catalytic surface, thereby hindering the smooth progress of the ORR reaction. FeN4S1 exhibited the weakest adsorption energy for OH among the four catalysts, thus making it the best candidate for promoting the ORR process. 3.2 ORR catalytic activity Based on the aforementioned data, we delved into the adsorption states and ORR activities of various oxygen-containing intermediates on the FeN4S-N catalyst surface. The primary focus of this paper was the four-electron process in the ORR reaction catalyzed by FeN4S-N [41,42]: (9) O 2 * + H + + e − → OO H * (10) OO H * + H + + e − → O * + H 2 O (11) O * + H + + e − → O H * (12) O H * + H + + e − → + H 2 O + * According to the ET-OHP mechanism [43], the first hydrogen ion on the outer Helmholtz plane first combined with O2 molecules to form OOH+, and then adsorbed on the catalytic site to form OOH*. The hydroxyl group was removed to form OH*, and finally continued hydrogenation to reduce to H2O. As shown in Fig. 4 , for the FeN4S-N catalyst, the Gibbs free energy of the four-step elementary reaction in the ORR reaction decreases, indicated that the reaction can occur spontaneously in thermodynamics (when U is equal to 0.00 V). From Fig. 4, it could be observed that the rate-determining step of FeN4S-N was the third step (U = 1.23 V), and their ηORR are 1.01 V, 0.53 V, 0.66 V and 1.16 V, respectively. Therefore, in Fe, N, S doped graphene materials, FeN4S1 had the smallest ηORR and the best ORR activity. To simulate a more realistic computational environment, the constant potential and solvent effects were incorporated into the FeN4S-N model. Therefore, this paper delved into the reaction mechanism based on the constant-potential implicit model. The calculated energies of the FeN4S-N catalyst as a function of the applied electrode potential (referenced to the SHE scale) were shown in Fig. 5 . The model energies of slab, *OOH, *O, and *OH exhibited a similar trend with the applied potential, first increasing and then decreasing. Among slab, *O, and *OH, the applied potential at zero charge shifted toward the positive direction as the distance between Fe and S atom changes, and then shifted toward the negative direction, while the applied potential of *OOH shifted continuously towards the negative direction. The relationship between the adsorption energies of the three oxygen-containing intermediates and the applied potential was shown in Fig. S4. For FeN4S0 and FeN4S1, the adsorption energies of the three oxygen-containing intermediates increase as the applied potential shifts from the negative direction to the positive direction. For FeN4S2, the adsorption energies of the three oxygen-containing intermediates first increase and then decrease with the shift of the applied voltage, which was different from the previous three catalysts. The adsorption energy of the OOH model adsorbed on FeN4S3 first increases and then decreases with the shift of the applied voltage, while the adsorption energies of *O and *OH continuously increased with the shift of the applied voltage. These varying degrees of correlation would affect the rate-determining step (RDS) and onset potential at different applied potentials, which would be discussed in detail below. Based on the potential-dependent adsorption energies of oxygen-containing intermediates and the reaction mechanism, we obtained contour plots of Bader charges referenced to the RHE scale (as shown in Fig. 6 ). O2 adsorption was the first step of the ORR reaction, and Fig. 6 revealed that as the applied potential shifts, the charge of the Fe atom in FeN4S-N decreases continuously, leading to an increase in its valence state and consequently a weakening of O2 adsorption on FeN4S-N. Among them, FeN4S2 exhibited the strongest adsorption capacity for O2, with an adsorption energy of −1.45 eV. Fig. 7 depicted the reaction pathways of the ORR process for four different catalysts under various applied voltages. As can be seen from Fig. 7, for FeN4S2 at a charge of −2.0 e, the RDS occurs at the fourth step of the reaction, and its overpotential was the smallest among all models and potentials, being −0.39 V. To further investigate the reaction activation of hydrogenation steps, we first considered the protonation of the O2 molecule on the FeN4S2 surface, leading to the formation of *OOH with an activation energy of 0.13 eV (as shown in Fig. 8 a). According to Fig. 8b, the activation energy barrier for the subsequent hydrogenation of OOH was 0.07 eV, indicating that the direct hydrogenation of O2 was energetically more favorable. After hydrogenation and dehydration of *OOH, *O was formed. In the subsequent steps, *O undergoes two consecutive hydrogenations to form *OH, ultimately leading to the production of H2O. The activation energy barriers for these steps were 0.14 eV and 0.31 eV, respectively. Combined with previous discussions, it could be seen that FeN4S2 exhibited a strong adsorption energy for O2 molecules under a −2.0 e environment, and the activation of O2 into *OOH requires only a low amount of energy. This suggested that the O2 molecules did not poison the FeN4S2 surface, and its overpotential of −0.39 V further supported the potential of FeN4S2 as a promising ORR catalyst. 4 Conclusions In summary, we conducted a detailed investigation into the impact of S atom doping on the ORR activity of Fe-N-C materials, encompassing the optimization of doping sites, material stability, and the calculation of charge transfer and ORR activity for FeN4S0 to FeN4S3 under both vacuum and constant-potential implicit solvent models. The calculation results indicate that although S atom doping increases the synthesis difficulty of the catalyst, its high electronegativity enhances the valence state of Fe atoms, reduces the adsorption energy of intermediates, and thereby promotes the ORR reaction process. By comparing the results obtained under vacuum conditions and the constant-potential implicit solvent model, we found that FeN4S1 exhibits the highest ORR activity with a potential of 0.53 V in vacuum. However, within the constant-potential implicit solvation model, FeN4S2 demonstrates the highest ORR activity with a potential of 0.39 V. Therefore, calculations employing the constant-potential solvation model provide more realistic insights for catalyst design and can serve as a guide for developing superior catalysts. CRediT authorship contribution statement Penghui Ren: Conceptualization, Writing – original draft. Zhongbao Feng: Software. Ying Zhao: Visualization. Chunyang Liu: Data curation. Huixia Li: Data curation. Ruopeng Li: Writing – review & editing. Xuebo Chen: Conceptualization, Data curation. Declaration of competing interest The authors declare that they have no known competing financial interests or personal relationships that could have appeared to influence the work reported in this paper. Acknowledgment The numerical calculations in this work have been done on Hefei advanced computing center. Supplementary materials Supplementary material associated with this article can be found, in the online version, at doi:10.1016/j.mcat.2024.114119. Appendix Supplementary materials Image, application 1 References [1] J. Zhang Y. Zhao C. Chen Y.C. Huang C.L. Dong C.J. Chen Tuning the coordination environment in single-atom catalysts to achieve highly efficient oxygen reduction reactions J. Am. Chem. Soc. 141 2019 20118 20126 Zhang J., Zhao Y., Chen C., Huang Y.C., Dong C.L., Chen C.J., et al. Tuning the coordination environment in single-atom catalysts to achieve highly efficient oxygen reduction reactions. J. Am. Chem. Soc. 2019; 141: 20118–20126. [2] M.Y. Liu X.D. Xiao Q. Li L.Y. Luo M.H. Ding B. Zhang Recent progress of electrocatalysts for oxygen reduction in fuel cells J. Colloid Interface Sci. 607 2022 791 815 Liu M.Y., Xiao X.D., Li Q., Luo L.Y., Ding M.H., Zhang B., et al. Recent progress of electrocatalysts for oxygen reduction in fuel cells. J. Colloid Interface Sci. 2022; 607: 791–815. [3] J.M. Luo X.C. Qiao J.T. Jin X.L. Tian H.B. Fan D.M. Yu A strategy to unlock the potential of CrN as a highly active oxygen reduction reaction catalyst J. Mater. Chem. A 8 2020 8575 8585 Luo J.M., Qiao X.C., Jin J.T., Tian X.L., Fan H.B., Yu D.M., et al. A strategy to unlock the potential of CrN as a highly active oxygen reduction reaction catalyst. J. Mater. Chem. A. 2020; 8: 8575–8585. [4] W.H. Zhao G.T. Xu W.Y. Dong Y.W. Zhang Z.P. Zhao L.M. Qiu Progress and perspective for in situ studies of oxygen reduction reaction in proton exchange membrane fuel cells Adv. Sci. 10 2023 2300550 Zhao W.H., Xu G.T., Dong W.Y., Zhang Y.W., Zhao Z.P., Qiu L.M., et al. Progress and perspective for in situ studies of oxygen reduction reaction in proton exchange membrane fuel cells. Adv. Sci. 2023; 10: 2300550. [5] G.D. Liu H.Q. Deng J. Greeley Z.H. Zeng Density functional theory study of active sites and reaction mechanism of ORR on Pt surfaces under anhydrous conditions Chin. J. Catal. 43 2022 3126 3133 Liu G.D., Deng H.Q., Greeley J., Zeng Z.H. Density functional theory study of active sites and reaction mechanism of ORR on Pt surfaces under anhydrous conditions. Chin. J. Catal. 2022; 43: 3126–33. [6] M. Kato I. Yagi Electrocatalytic oxygen reduction at multinuclear metal active sites inspired by metalloenzymes E-J. Surf. Sci. Nanotechnol. 18 2020 81 93 Kato M., Yagi I. Electrocatalytic oxygen reduction at multinuclear metal active sites inspired by metalloenzymes. E-J. Surf. Sci. Nanotechnol. 2020; 18: 81–93. [7] H.Y. Wang C.C. Weng Z.Y. Yuan Insights into efficient transition metal-nitrogen/carbon oxygen reduction electrocatalysts J. Energy Chem. 56 2021 470 485 Wang H.Y., Weng C.C., Yuan Z.Y. Insights into efficient transition metal-nitrogen/carbon oxygen reduction electrocatalysts. J. Energy Chem. 2021; 56: 470–85. [8] W.L. Chen Q. Xiang T. Peng C.Y. Song W. Shang T. Deng Reconsidering the benchmarking evaluation of catalytic activity in oxygen reduction reaction iScience 23 2020 101532 Chen W.L., Xiang Q., Peng T., Song C.Y., Shang W., Deng T., et al. Reconsidering the benchmarking evaluation of catalytic activity in oxygen reduction reaction. iScience. 2020; 23: 101532. [9] X.D. Wang J.J. Fang X.R. Liu X.Q. Zhang Q.Q. Lv Z.X. Xu Converting biomass into efficient oxygen reduction reaction catalysts for proton exchange membrane fuel Cells Sci. China Mater. 63 2020 524 532 Wang X.D., Fang J.J., Liu X.R., Zhang X.Q., Lv Q.Q., Xu Z.X., et al. Converting biomass into efficient oxygen reduction reaction catalysts for proton exchange membrane fuel Cells. Sci. China Mater. 2020; 63: 524–532. [10] Y.M. Gong Y. Xu Y.P. Que X.L. Xu Y. Tang D.X. Ye Prussian blue analogues derived electrocatalyst with multicatalytic centers for boosting oxygen reduction reaction in the wide pH range J. Colloid Interface Sci. 612 2022 639 649 Gong Y.M., Xu Y., Que Y.P., Xu X.L., Tang Y., Ye D.X., et al. Prussian blue analogues derived electrocatalyst with multicatalytic centers for boosting oxygen reduction reaction in the wide pH range. J. Colloid Interface Sci. 2022; 612: 639–649. [11] Y.J. Sun C.C. Ding W. Jin T. Liu J.S Hu A Potentially efficient ORR catalyst: transition metal doped 2D Haeckelite MoS2 Mater. Today Commun. 37 2023 107031 Sun Y.J., Ding C.C., Jin W., Liu T., Hu J.S. A Potentially efficient ORR catalyst: transition metal doped 2D Haeckelite MoS2. Mater. Today Commun. 2023; 37: 107031. [12] P. Liu D. Yen B.S. Vishnugopi V.R. Kankanallu D. Gürsoy M. Ge J. Watt P.P. Mukherjee C.W. YcK D. Mitlin Influence of potassium metal-support interactions on dendrite growth Angew. Chem. Int. Ed. 62 2023 202300943 Liu P., Yen D., Vishnugopi B.S., Kankanallu V.R., Gürsoy D., Ge M., Watt J., Mukherjee P.P., YcK C.W., Mitlin D. Influence of potassium metal-support interactions on dendrite growth. Angew. Chem. Int. Ed. 2023; 62: 202300943. [13] T. Zhang Single-atom catalysis: far beyond the matter of metal dispersion Nano Lett. 21 2021 9835 9837 Zhang, T. Single-atom catalysis: far beyond the matter of metal dispersion. Nano Lett. 2021; 21: 9835–9837. [14] W. Ma C. Jing P. Wu W. Li Understanding the selection of catalytic pathway on graphene supported nitrogen coordinated Ru-atom by Ab initio molecular dynamics simulation J. Mol. Model. 29 2023 212 Ma W., Jing C., Wu P., Li W. Understanding the selection of catalytic pathway on graphene supported nitrogen coordinated Ru-atom by Ab initio molecular dynamics simulation. J. Mol. Model. 2023; 29: 212. [15] M.D. Bhatt G. Lee J.S. Lee Density functional theory (DFT) calculations for oxygen reduction reaction mechanisms on metal-, nitrogen- co-doped graphene (M-N2-G (M = Ti, Cu, Mo, Nb and Ru)) Electrocatalysts. Electrochimica Acta 228 2017 619 627 Bhatt M.D., Lee G., Lee J.S. Density functional theory (DFT) calculations for oxygen reduction reaction mechanisms on metal-, nitrogen- co-doped graphene (M-N2-G (M = Ti, Cu, Mo, Nb and Ru)) Electrocatalysts. Electrochimica Acta. 2017; 228: 619–627. [16] B.B. Xiao L. Yang H.Y. Liu X.B. Jiang B. Aleksandr E.H. Song Designing fluorographene with FeN4 and CoN4 moieties for oxygen electrode reaction: a density functional theory study Appl. Surf. Sci. 537 2021 147846 Xiao B.B., Yang L., Liu H.Y., Jiang X.B., Aleksandr B., Song E.H., et al. Designing fluorographene with FeN4 and CoN4 moieties for oxygen electrode reaction: a density functional theory study. Appl. Surf. Sci. 2021; 537: 147846. [17] H. Xu D. Wang P.X. Yang A. Liu R.P. Li L. Xiao J.Q. Zhang Z. Qu M.Z. An FeS encapsulated hierarchical porous S, N-dual-doped carbon for oxygen reduction reaction facilitation in Zn–air batteries Sustain. Energy Fuels 5 2021 2695 2703 Xu H., Wang D., Yang P.X., Liu A., Li R.P., Xiao L., Zhang J.Q., Qu Z., An M.Z. FeS encapsulated hierarchical porous S, N-dual-doped carbon for oxygen reduction reaction facilitation in Zn–air batteries. Sustain. Energy Fuels 2021; 5: 2695–2703. [18] Z.W. Du K.M. Deng E.R. Kan C. Zhan Exploring the catalytic activity of graphene-based TM-NxC4-x single atom catalysts for the oxygen reduction reaction via density functional theory calculation Phys. Chem. Chem. Phys. 25 2023 13913 13922 Du Z.W., Deng K.M., Kan E.R., Zhan C. Exploring the catalytic activity of graphene-based TM-NxC4-x single atom catalysts for the oxygen reduction reaction via density functional theory calculation. Phys. Chem. Chem. Phys. 2023; 25:13913–13922. [19] J. Li X. Sun Y.Z. Duan D.M. Jia Y.J. Li J.G. Wang Enhanced oxygen reduction reaction performance over Pd catalysts by oxygen-surface-modified SiC Chin. J. Catal. 42 2021 963 970 Li J., Sun X., Duan Y.Z., Jia D.M., Li Y.J., Wang J.G. Enhanced oxygen reduction reaction performance over Pd catalysts by oxygen-surface-modified SiC. Chin. J. Catal. 2021; 42: 963–970. [20] H.W. Kim V.J. Bukas H. Park S. Park K.M. Diederichsen J. Lim Mechanisms of two electron and four electron electrochemical oxygen reduction reactions at nitrogen doped reduced graphene oxide ACS Catal. 10 2020 852 863 Kim H.W., Bukas V.J., Park H., Park S., Diederichsen K.M., Lim J., et al. Mechanisms of two electron and four electron electrochemical oxygen reduction reactions at nitrogen doped reduced graphene oxide. ACS Catal. 2020; 10: 852–863. [21] F. Shimojo K. Hoshino Y. Zempo Ab initio molecular-dynamics simulation method for complex liquids Comput. Phys. Commun. 142 2001 364 367 Shimojo F., Hoshino K., Zempo Y. Ab initio molecular-dynamics simulation method for complex liquids. Comput. Phys. Commun. 2001; 142: 364–367. [22] F. Kresse Efficient iterative schemes for Ab initio total-energy calculations using a plane-wave basis set Phys. Rev. B Condensed Matter 54 1996 11169 11186 Kresse, F. Efficient iterative schemes for Ab initio total-energy calculations using a plane-wave basis set. Phys. Rev. B Condensed Matter. 1996; 54: 11169–11186. [23] J.P. Perdew K. Burke M. Ernzerhof Generalized gradient approximation made simple Phys. Rev. Lett. 77 1996 3865 3868 Perdew J.P., Burke K., Ernzerhof M. Generalized gradient approximation made simple. Phys. Rev. Lett. 1996; 77: 3865–3868. [24] A. Massaro A. Pecoraro S. Hernández G. Talarico A.B. Muñoz-García M. Pavone Oxygen evolution reaction at the Mo/W-doped bismuth vanadate surface: assessing the dopant role by DFT calculations Mol. Catal. 517 2022 112036 Massaro A., Pecoraro A., Hernández S., Talarico G., Muñoz-García A.B., Pavone M. Oxygen evolution reaction at the Mo/W-doped bismuth vanadate surface: assessing the dopant role by DFT calculations. Mol. Catal. 2022; 517: 112036. [25] F. Fasulo A. Massaro A.B. Muñoz-García M. Pavone New insights on singlet oxygen release from Li-air battery cathode: periodic DFT versus CASPT2 embedded cluster calculations J. Chem. Theory Comput. 19 2023 5210 5220 Fasulo F., Massaro A., Muñoz-García A.B., Pavone M. New insights on singlet oxygen release from Li-air battery cathode: periodic DFT versus CASPT2 embedded cluster calculations. J. Chem. Theory Comput. 2023; 19: 5210–5220. [26] M.L. Faro Solid Oxide-based Electrochemical Devices: Advances, Smart Materials and Future Energy Applications 2020 Academic Press Faro M.L. Solid Oxide-based Electrochemical Devices: Advances, Smart Materials and Future Energy Applications; Academic Press, 2020. [27] M.F. Ng D.J. Blackwood H. Jin T.L Tan DFT study of oxygen reduction reaction on chromia and hematite: insights into corrosion inhibition J. Phys. Chem. C 124 2020 13799 13808 Ng M.F., Blackwood D.J., Jin H., Tan T.L. DFT study of oxygen reduction reaction on chromia and hematite: insights into corrosion inhibition. J. Phys. Chem. C 2020; 124: 13799–13808. [28] F. He Y. Liu Q. Cai J. Zhao Size dependent electrocatalytic activity of ORR/OER on palladium nanoclusters anchored on defective MoS2 monolayers New J. Chem. 44 2020 16135 16143 He F., Liu Y., Cai Q., Zhao J. Size dependent electrocatalytic activity of ORR/OER on palladium nanoclusters anchored on defective MoS2 monolayers. New J. Chem. 2020;44: 16135–16143. [29] S. Grimme Semiempirical GGA-type density functional constructed with a long-range dispersion correction J. Comput. Chem. 27 2006 1787 1799 Grimme S. Semiempirical GGA-type density functional constructed with a long-range dispersion correction. J. Comput. Chem. 2006; 27: 1787–1799. [30] W. Zhang Y. Xiao Mechanism of electrocatalytically active precious metal (Ni, Pd, Pt, and Ru) complexes in the graphene basal plane for ORR applications in novel fuel cells Energy Fuels 34 2020 2425 2434 Zhang W., Xiao Y. Mechanism of electrocatalytically active precious metal (Ni, Pd, Pt, and Ru) complexes in the graphene basal plane for ORR applications in novel fuel cells. Energy Fuels 2020; 34: 2425–2434. [31] X. Hu S. Chen L. Chen Y. Tian S. Yao Z. Lu X. Zhang Z. Zhou What is the real origin of the activity of Fe–N–C electrocatalysts in the O2 reduction reaction? Critical roles of coordinating pyrrolic N and axially adsorbing species J. Am. Chem. Soc. 144 2022 18144 18152 Hu X., Chen S., Chen L., Tian Y., Yao S., Lu Z., Zhang X., Zhou Z. What is the real origin of the activity of Fe–N–C electrocatalysts in the O2 reduction reaction? Critical roles of coordinating pyrrolic N and axially adsorbing species. J. Am. Chem. Soc. 2022; 144: 18144–18152. [32] Z. Huang Q. Tang Axial coordination effect on the oxygen reduction reaction of FeN4 electrocatalysts based on grand canonical density functional theory J. Phys. Chem. C 126 2022 21606 21615 Huang Z., Tang Q. Axial coordination effect on the oxygen reduction reaction of FeN4 electrocatalysts based on grand canonical density functional theory. J. Phys. Chem. C 2022; 126: 21606–21615. [33] J. Yang W.G. Liu M.Q. Xu X.Y. Liu H.F. Qi L.L. Zhang X.F. Yang S.S. Niu D. Zhou Y.F. Liu Dynamic behavior of single-atom catalysts in electrocatalysis: identification of Cu-N3 as an active site for the oxygen reduction reaction J. Am. Chem. Soc. 143 2021 14530 14539 Yang J., Liu W.G., Xu M.Q., Liu X.Y., Qi H.F., Zhang L.L., Yang X.F., Niu S.S., Zhou D., Liu Y.F. Dynamic behavior of single-atom catalysts in electrocatalysis: identification of Cu-N3 as an active site for the oxygen reduction reaction. J. Am. Chem. Soc. 2021; 143: 14530–14539. [34] Q. Liu B. Yu X. Liao Y. Zhao Facet-dependent oxygen reduction reaction activity on the surfaces of Co3O4 Energy Environ. Mater. 4 2020 407 412 Liu Q., Yu B., Liao X., Zhao Y. Facet-dependent oxygen reduction reaction activity on the surfaces of Co3O4. Energy Environ. Mater. 2020; 4: 407–412. [35] Y. Meng C. Yin K. Li H. Tang Y. Wang Z. Wu Improved oxygen reduction activity in heteronuclear FeCo-codoped graphene: a theoretical study ACS Sustain. Chem. Eng. 7 2019 17273 17281 Meng Y., Yin C., Li K., Tang H., Wang Y., Wu Z. Improved oxygen reduction activity in heteronuclear FeCo-codoped graphene: a theoretical study. ACS Sustain. Chem. Eng. 2019; 7: 17273–17281. [36] T. Yan X. Li Z. Li J. Zhao Rationally designed metal-N-C/MoS2 heterostructures as bifunctional oxygen electrocatalysts: a computational study Appl. Surf. Sci. 606 2022 154969 Yan T., Li X., Li Z., Zhao J. Rationally designed metal-N-C/MoS2 heterostructures as bifunctional oxygen electrocatalysts: a computational study. Appl. Surf. Sci. 2022; 606: 154969. [37] T. Wu M. Sun B. Huang Highly active electron-affinity for ultra-low barrier for alkaline ORR in Pd3Cu Mater. Today Energy 12 2019 426 430 Wu T., Sun M., Huang B. Highly active electron-affinity for ultra-low barrier for alkaline ORR in Pd3Cu. Mater. Today Energy. 2019; 12: 426–430. [38] Y. Li R. Hu X. Wan J.X. Shang F.H. Wang J. Shui Density functional theory calculation of Zn and N Co-doped Graphene for oxygen reduction and evolution reactions Adv. Theory Simul. 3 2020 2000054 Li Y., Hu R., Wan X., Shang J.X., Wang F.H., Shui J. Density functional theory calculation of Zn and N Co-doped Graphene for oxygen reduction and evolution reactions. Adv. Theory Simul. 2020; 3: 2000054. [39] W. Qi W. Huang J. Niu B. Zhang Z. Zhang W. Li The role of S in the Co-N-S-C catalysis system towards the ORR for proton exchange membrane fuel cells Appl. Surf. Sci. 540 2021 148325 Qi W., Huang W., Niu J., Zhang B., Zhang Z., Li W. The role of S in the Co-N-S-C catalysis system towards the ORR for proton exchange membrane fuel cells. Appl. Surf. Sci. 2021; 540: 148325. [40] B. Li C. Shi N. Zhao E. Liu Hydrogen-bond-promoted ORR mechanism in P-Doped Fe–N–C materials J. Phys. Chem. C 127 2023 1023 1031 Li B., Shi C., Zhao N., Liu E. Hydrogen-bond-promoted ORR mechanism in P-Doped Fe–N–C materials. J. Phys. Chem. C 2023; 127: 1023–1031. [41] D.L. Wang J.P. Hu J.J. Wei X.L. Liu H.J. Hou Insights into nitrogen-doped carbon for oxygen reduction: the role of graphitic and pyridinic nitrogen species Chemphyschem. 24 2023 202200734 Wang D.L., Hu J.P., Wei J.J., Liu X.L., Hou H.J. Insights into nitrogen-doped carbon for oxygen reduction: the role of graphitic and pyridinic nitrogen species. Chemphyschem. 2023; 24: 202200734. [42] H. He Y.X. Lei S. Liu K. Thummavichai Y.Q. Zhu N.N. Wang Tunable active-sites of Co- nanoparticles encapsulated in carbon nanofiber as high performance bifunctional OER/ORR electrocatalyst J. Colloid Interface Sci. 630 2023 140 149 He H., Lei Y.X., Liu S., Thummavichai K., Zhu Y.Q., Wang N.N. Tunable active-sites of Co- nanoparticles encapsulated in carbon nanofiber as high performance bifunctional OER/ORR electrocatalyst. J. Colloid Interface Sci. 2023; 630: 140–149. [43] C.H. Choi H.K. Lim M.W. Chung J.C. Park H. Shin H. Kim S.I. Woo Long-range electron transfer over graphene-based catalyst for high-performing oxygen reduction reactions: importance of size, N-doping, and metallic impurities J. Am. Chem. Soc. 136 2014 9070 9077 Choi C.H., Lim H.K., Chung M.W., Park J.C., Shin H., Kim H., Woo S.I. Long-range electron transfer over graphene-based catalyst for high-performing oxygen reduction reactions: importance of size, N-doping, and metallic impurities. J. Am. Chem. Soc. 2014; 136:9070–9077.",
      "scopus-id": "85189690971",
      "coredata": {
        "eid": "1-s2.0-S246882312400302X",
        "dc:description": "The widespread application of S doping in Fe-N-C materials aims to enhance the catalytic activity for oxygen reduction reactions (ORR). However, the current doping strategies are primarily centered on the first coordination layer encompassing Fe atoms. Consequently, this study employs first-principles calculations to compute the formation and binding energies of FeN4 doped with S atom. It further delves into the influence of diverse doping sites on catalyst stability and meticulously analyzes the configurations and corresponding ORR activities of four catalysts, namely FeN4S-N (Number=0∼3), utilizing a constant-potential implicit solvent model to simulate authentic electrocatalytic environments. The findings reveal that under vacuum conditions, FeN4S1 exhibits the utmost ORR activity, boasting a potential of 0.53 V. Conversely, within the constant-potential implicit solvation model, FeN4S2 emerges as the catalyst with the highest ORR activity, achieving a potential of 0.39 V. Therefore, calculations leveraging the constant-potential solvation model offer more realistic insights into catalyst design, thereby guiding the development of superior catalysts.",
        "openArchiveArticle": "false",
        "prism:coverDate": "2024-04-15",
        "openaccessUserLicense": null,
        "prism:aggregationType": "Journal",
        "prism:url": "https://api.elsevier.com/content/article/pii/S246882312400302X",
        "dc:creator": [
          {
            "@_fa": "true",
            "$": "Ren, Penghui"
          },
          {
            "@_fa": "true",
            "$": "Feng, Zhongbao"
          },
          {
            "@_fa": "true",
            "$": "Zhao, Ying"
          },
          {
            "@_fa": "true",
            "$": "Liu, Chunyang"
          },
          {
            "@_fa": "true",
            "$": "Li, Huixia"
          },
          {
            "@_fa": "true",
            "$": "Li, Ruopeng"
          },
          {
            "@_fa": "true",
            "$": "Chen, Xuebo"
          }
        ],
        "link": [
          {
            "@_fa": "true",
            "@rel": "self",
            "@href": "https://api.elsevier.com/content/article/pii/S246882312400302X"
          },
          {
            "@_fa": "true",
            "@rel": "scidir",
            "@href": "https://www.sciencedirect.com/science/article/pii/S246882312400302X"
          }
        ],
        "dc:format": "application/json",
        "openaccessType": null,
        "pii": "S2468-8231(24)00302-X",
        "prism:volume": "559",
        "articleNumber": "114119",
        "prism:publisher": "Elsevier B.V.",
        "dc:title": "Exploring the impact of S-doped Fe-N-C materials on the ORR mechanism within a constant potential solvation model",
        "prism:copyright": "© 2024 Elsevier B.V. All rights reserved.",
        "openaccess": "0",
        "prism:issn": "24688231",
        "dcterms:subject": [
          {
            "@_fa": "true",
            "$": "Implicit solvent model"
          },
          {
            "@_fa": "true",
            "$": "Single atom catalysts"
          },
          {
            "@_fa": "true",
            "$": "ORR mechanisms"
          },
          {
            "@_fa": "true",
            "$": "Constant-potential"
          }
        ],
        "openaccessArticle": "false",
        "prism:publicationName": "Molecular Catalysis",
        "openaccessSponsorType": null,
        "prism:pageRange": "114119",
        "pubType": "fla",
        "prism:coverDisplayDate": "15 April 2024",
        "prism:doi": "10.1016/j.mcat.2024.114119",
        "prism:startingPage": "114119",
        "dc:identifier": "doi:10.1016/j.mcat.2024.114119",
        "openaccessSponsorName": null
      },
      "objects": {
        "object": [
          {
            "@category": "standard",
            "@height": "283",
            "@width": "320",
            "@_fa": "true",
            "$": "https://api.elsevier.com/content/object/eid/1-s2.0-S246882312400302X-gr3.jpg?httpAccept=%2A%2F%2A",
            "@multimediatype": "JPEG image file",
            "@type": "IMAGE-DOWNSAMPLED",
            "@size": "23452",
            "@ref": "gr3",
            "@mimetype": "image/jpeg"
          },
          {
            "@category": "standard",
            "@height": "522",
            "@width": "570",
            "@_fa": "true",
            "$": "https://api.elsevier.com/content/object/eid/1-s2.0-S246882312400302X-gr4.jpg?httpAccept=%2A%2F%2A",
            "@multimediatype": "JPEG image file",
            "@type": "IMAGE-DOWNSAMPLED",
            "@size": "80156",
            "@ref": "gr4",
            "@mimetype": "image/jpeg"
          },
          {
            "@category": "standard",
            "@height": "197",
            "@width": "651",
            "@_fa": "true",
            "$": "https://api.elsevier.com/content/object/eid/1-s2.0-S246882312400302X-gr1.jpg?httpAccept=%2A%2F%2A",
            "@multimediatype": "JPEG image file",
            "@type": "IMAGE-DOWNSAMPLED",
            "@size": "67212",
            "@ref": "gr1",
            "@mimetype": "image/jpeg"
          },
          {
            "@category": "standard",
            "@height": "452",
            "@width": "649",
            "@_fa": "true",
            "$": "https://api.elsevier.com/content/object/eid/1-s2.0-S246882312400302X-gr2.jpg?httpAccept=%2A%2F%2A",
            "@multimediatype": "JPEG image file",
            "@type": "IMAGE-DOWNSAMPLED",
            "@size": "62724",
            "@ref": "gr2",
            "@mimetype": "image/jpeg"
          },
          {
            "@category": "standard",
            "@height": "200",
            "@width": "310",
            "@_fa": "true",
            "$": "https://api.elsevier.com/content/object/eid/1-s2.0-S246882312400302X-ga1.jpg?httpAccept=%2A%2F%2A",
            "@multimediatype": "JPEG image file",
            "@type": "IMAGE-DOWNSAMPLED",
            "@size": "24681",
            "@ref": "ga1",
            "@mimetype": "image/jpeg"
          },
          {
            "@category": "standard",
            "@height": "477",
            "@width": "597",
            "@_fa": "true",
            "$": "https://api.elsevier.com/content/object/eid/1-s2.0-S246882312400302X-gr7.jpg?httpAccept=%2A%2F%2A",
            "@multimediatype": "JPEG image file",
            "@type": "IMAGE-DOWNSAMPLED",
            "@size": "103262",
            "@ref": "gr7",
            "@mimetype": "image/jpeg"
          },
          {
            "@category": "standard",
            "@height": "516",
            "@width": "635",
            "@_fa": "true",
            "$": "https://api.elsevier.com/content/object/eid/1-s2.0-S246882312400302X-gr8.jpg?httpAccept=%2A%2F%2A",
            "@multimediatype": "JPEG image file",
            "@type": "IMAGE-DOWNSAMPLED",
            "@size": "68481",
            "@ref": "gr8",
            "@mimetype": "image/jpeg"
          },
          {
            "@category": "standard",
            "@height": "524",
            "@width": "628",
            "@_fa": "true",
            "$": "https://api.elsevier.com/content/object/eid/1-s2.0-S246882312400302X-gr5.jpg?httpAccept=%2A%2F%2A",
            "@multimediatype": "JPEG image file",
            "@type": "IMAGE-DOWNSAMPLED",
            "@size": "91830",
            "@ref": "gr5",
            "@mimetype": "image/jpeg"
          },
          {
            "@category": "standard",
            "@height": "530",
            "@width": "627",
            "@_fa": "true",
            "$": "https://api.elsevier.com/content/object/eid/1-s2.0-S246882312400302X-gr6.jpg?httpAccept=%2A%2F%2A",
            "@multimediatype": "JPEG image file",
            "@type": "IMAGE-DOWNSAMPLED",
            "@size": "106892",
            "@ref": "gr6",
            "@mimetype": "image/jpeg"
          },
          {
            "@category": "thumbnail",
            "@height": "164",
            "@width": "185",
            "@_fa": "true",
            "$": "https://api.elsevier.com/content/object/eid/1-s2.0-S246882312400302X-gr3.sml?httpAccept=%2A%2F%2A",
            "@multimediatype": "GIF image file",
            "@type": "IMAGE-THUMBNAIL",
            "@size": "10326",
            "@ref": "gr3",
            "@mimetype": "image/gif"
          },
          {
            "@category": "thumbnail",
            "@height": "164",
            "@width": "179",
            "@_fa": "true",
            "$": "https://api.elsevier.com/content/object/eid/1-s2.0-S246882312400302X-gr4.sml?httpAccept=%2A%2F%2A",
            "@multimediatype": "GIF image file",
            "@type": "IMAGE-THUMBNAIL",
            "@size": "11054",
            "@ref": "gr4",
            "@mimetype": "image/gif"
          },
          {
            "@category": "thumbnail",
            "@height": "66",
            "@width": "219",
            "@_fa": "true",
            "$": "https://api.elsevier.com/content/object/eid/1-s2.0-S246882312400302X-gr1.sml?httpAccept=%2A%2F%2A",
            "@multimediatype": "GIF image file",
            "@type": "IMAGE-THUMBNAIL",
            "@size": "11621",
            "@ref": "gr1",
            "@mimetype": "image/gif"
          },
          {
            "@category": "thumbnail",
            "@height": "153",
            "@width": "219",
            "@_fa": "true",
            "$": "https://api.elsevier.com/content/object/eid/1-s2.0-S246882312400302X-gr2.sml?httpAccept=%2A%2F%2A",
            "@multimediatype": "GIF image file",
            "@type": "IMAGE-THUMBNAIL",
            "@size": "14369",
            "@ref": "gr2",
            "@mimetype": "image/gif"
          },
          {
            "@category": "thumbnail",
            "@height": "141",
            "@width": "219",
            "@_fa": "true",
            "$": "https://api.elsevier.com/content/object/eid/1-s2.0-S246882312400302X-ga1.sml?httpAccept=%2A%2F%2A",
            "@multimediatype": "GIF image file",
            "@type": "IMAGE-THUMBNAIL",
            "@size": "12965",
            "@ref": "ga1",
            "@mimetype": "image/gif"
          },
          {
            "@category": "thumbnail",
            "@height": "164",
            "@width": "205",
            "@_fa": "true",
            "$": "https://api.elsevier.com/content/object/eid/1-s2.0-S246882312400302X-gr7.sml?httpAccept=%2A%2F%2A",
            "@multimediatype": "GIF image file",
            "@type": "IMAGE-THUMBNAIL",
            "@size": "13664",
            "@ref": "gr7",
            "@mimetype": "image/gif"
          },
          {
            "@category": "thumbnail",
            "@height": "164",
            "@width": "202",
            "@_fa": "true",
            "$": "https://api.elsevier.com/content/object/eid/1-s2.0-S246882312400302X-gr8.sml?httpAccept=%2A%2F%2A",
            "@multimediatype": "GIF image file",
            "@type": "IMAGE-THUMBNAIL",
            "@size": "11660",
            "@ref": "gr8",
            "@mimetype": "image/gif"
          },
          {
            "@category": "thumbnail",
            "@height": "164",
            "@width": "196",
            "@_fa": "true",
            "$": "https://api.elsevier.com/content/object/eid/1-s2.0-S246882312400302X-gr5.sml?httpAccept=%2A%2F%2A",
            "@multimediatype": "GIF image file",
            "@type": "IMAGE-THUMBNAIL",
            "@size": "11208",
            "@ref": "gr5",
            "@mimetype": "image/gif"
          },
          {
            "@category": "thumbnail",
            "@height": "164",
            "@width": "194",
            "@_fa": "true",
            "$": "https://api.elsevier.com/content/object/eid/1-s2.0-S246882312400302X-gr6.sml?httpAccept=%2A%2F%2A",
            "@multimediatype": "GIF image file",
            "@type": "IMAGE-THUMBNAIL",
            "@size": "14765",
            "@ref": "gr6",
            "@mimetype": "image/gif"
          },
          {
            "@category": "high",
            "@height": "1256",
            "@width": "1418",
            "@_fa": "true",
            "$": "https://api.elsevier.com/content/object/eid/1-s2.0-S246882312400302X-gr3_lrg.jpg?httpAccept=%2A%2F%2A",
            "@multimediatype": "JPEG image file",
            "@type": "IMAGE-HIGH-RES",
            "@size": "149615",
            "@ref": "gr3",
            "@mimetype": "image/jpeg"
          },
          {
            "@category": "high",
            "@height": "2311",
            "@width": "2524",
            "@_fa": "true",
            "$": "https://api.elsevier.com/content/object/eid/1-s2.0-S246882312400302X-gr4_lrg.jpg?httpAccept=%2A%2F%2A",
            "@multimediatype": "JPEG image file",
            "@type": "IMAGE-HIGH-RES",
            "@size": "604511",
            "@ref": "gr4",
            "@mimetype": "image/jpeg"
          },
          {
            "@category": "high",
            "@height": "873",
            "@width": "2883",
            "@_fa": "true",
            "$": "https://api.elsevier.com/content/object/eid/1-s2.0-S246882312400302X-gr1_lrg.jpg?httpAccept=%2A%2F%2A",
            "@multimediatype": "JPEG image file",
            "@type": "IMAGE-HIGH-RES",
            "@size": "509446",
            "@ref": "gr1",
            "@mimetype": "image/jpeg"
          },
          {
            "@category": "high",
            "@height": "2003",
            "@width": "2876",
            "@_fa": "true",
            "$": "https://api.elsevier.com/content/object/eid/1-s2.0-S246882312400302X-gr2_lrg.jpg?httpAccept=%2A%2F%2A",
            "@multimediatype": "JPEG image file",
            "@type": "IMAGE-HIGH-RES",
            "@size": "519793",
            "@ref": "gr2",
            "@mimetype": "image/jpeg"
          },
          {
            "@category": "high",
            "@height": "886",
            "@width": "1374",
            "@_fa": "true",
            "$": "https://api.elsevier.com/content/object/eid/1-s2.0-S246882312400302X-ga1_lrg.jpg?httpAccept=%2A%2F%2A",
            "@multimediatype": "JPEG image file",
            "@type": "IMAGE-HIGH-RES",
            "@size": "161060",
            "@ref": "ga1",
            "@mimetype": "image/jpeg"
          },
          {
            "@category": "high",
            "@height": "2115",
            "@width": "2645",
            "@_fa": "true",
            "$": "https://api.elsevier.com/content/object/eid/1-s2.0-S246882312400302X-gr7_lrg.jpg?httpAccept=%2A%2F%2A",
            "@multimediatype": "JPEG image file",
            "@type": "IMAGE-HIGH-RES",
            "@size": "740500",
            "@ref": "gr7",
            "@mimetype": "image/jpeg"
          },
          {
            "@category": "high",
            "@height": "2286",
            "@width": "2814",
            "@_fa": "true",
            "$": "https://api.elsevier.com/content/object/eid/1-s2.0-S246882312400302X-gr8_lrg.jpg?httpAccept=%2A%2F%2A",
            "@multimediatype": "JPEG image file",
            "@type": "IMAGE-HIGH-RES",
            "@size": "511768",
            "@ref": "gr8",
            "@mimetype": "image/jpeg"
          },
          {
            "@category": "high",
            "@height": "2322",
            "@width": "2783",
            "@_fa": "true",
            "$": "https://api.elsevier.com/content/object/eid/1-s2.0-S246882312400302X-gr5_lrg.jpg?httpAccept=%2A%2F%2A",
            "@multimediatype": "JPEG image file",
            "@type": "IMAGE-HIGH-RES",
            "@size": "661462",
            "@ref": "gr5",
            "@mimetype": "image/jpeg"
          },
          {
            "@category": "high",
            "@height": "2347",
            "@width": "2778",
            "@_fa": "true",
            "$": "https://api.elsevier.com/content/object/eid/1-s2.0-S246882312400302X-gr6_lrg.jpg?httpAccept=%2A%2F%2A",
            "@multimediatype": "JPEG image file",
            "@type": "IMAGE-HIGH-RES",
            "@size": "847106",
            "@ref": "gr6",
            "@mimetype": "image/jpeg"
          },
          {
            "@category": "standard",
            "@_fa": "true",
            "$": "https://api.elsevier.com/content/object/eid/1-s2.0-S246882312400302X-mmc1.docx?httpAccept=%2A%2F%2A",
            "@multimediatype": "Microsoft Word file",
            "@type": "APPLICATION",
            "@size": "1289446",
            "@ref": "mmc1",
            "@mimetype": "application/word"
          },
          {
            "@category": "thumbnail",
            "@_fa": "true",
            "$": "https://api.elsevier.com/content/object/eid/1-s2.0-S246882312400302X-si1.svg?httpAccept=%2A%2F%2A",
            "@multimediatype": "Scalable Vector Graphics file",
            "@type": "ALTIMG",
            "@size": "551",
            "@ref": "si1",
            "@mimetype": "image/svg+xml"
          },
          {
            "@category": "thumbnail",
            "@_fa": "true",
            "$": "https://api.elsevier.com/content/object/eid/1-s2.0-S246882312400302X-si10.svg?httpAccept=%2A%2F%2A",
            "@multimediatype": "Scalable Vector Graphics file",
            "@type": "ALTIMG",
            "@size": "12588",
            "@ref": "si10",
            "@mimetype": "image/svg+xml"
          },
          {
            "@category": "thumbnail",
            "@_fa": "true",
            "$": "https://api.elsevier.com/content/object/eid/1-s2.0-S246882312400302X-si11.svg?httpAccept=%2A%2F%2A",
            "@multimediatype": "Scalable Vector Graphics file",
            "@type": "ALTIMG",
            "@size": "5306",
            "@ref": "si11",
            "@mimetype": "image/svg+xml"
          },
          {
            "@category": "thumbnail",
            "@_fa": "true",
            "$": "https://api.elsevier.com/content/object/eid/1-s2.0-S246882312400302X-si12.svg?httpAccept=%2A%2F%2A",
            "@multimediatype": "Scalable Vector Graphics file",
            "@type": "ALTIMG",
            "@size": "5460",
            "@ref": "si12",
            "@mimetype": "image/svg+xml"
          },
          {
            "@category": "thumbnail",
            "@_fa": "true",
            "$": "https://api.elsevier.com/content/object/eid/1-s2.0-S246882312400302X-si13.svg?httpAccept=%2A%2F%2A",
            "@multimediatype": "Scalable Vector Graphics file",
            "@type": "ALTIMG",
            "@size": "4688",
            "@ref": "si13",
            "@mimetype": "image/svg+xml"
          },
          {
            "@category": "thumbnail",
            "@_fa": "true",
            "$": "https://api.elsevier.com/content/object/eid/1-s2.0-S246882312400302X-si14.svg?httpAccept=%2A%2F%2A",
            "@multimediatype": "Scalable Vector Graphics file",
            "@type": "ALTIMG",
            "@size": "5470",
            "@ref": "si14",
            "@mimetype": "image/svg+xml"
          },
          {
            "@category": "thumbnail",
            "@_fa": "true",
            "$": "https://api.elsevier.com/content/object/eid/1-s2.0-S246882312400302X-si2.svg?httpAccept=%2A%2F%2A",
            "@multimediatype": "Scalable Vector Graphics file",
            "@type": "ALTIMG",
            "@size": "644",
            "@ref": "si2",
            "@mimetype": "image/svg+xml"
          },
          {
            "@category": "thumbnail",
            "@_fa": "true",
            "$": "https://api.elsevier.com/content/object/eid/1-s2.0-S246882312400302X-si3.svg?httpAccept=%2A%2F%2A",
            "@multimediatype": "Scalable Vector Graphics file",
            "@type": "ALTIMG",
            "@size": "15993",
            "@ref": "si3",
            "@mimetype": "image/svg+xml"
          },
          {
            "@category": "thumbnail",
            "@_fa": "true",
            "$": "https://api.elsevier.com/content/object/eid/1-s2.0-S246882312400302X-si4.svg?httpAccept=%2A%2F%2A",
            "@multimediatype": "Scalable Vector Graphics file",
            "@type": "ALTIMG",
            "@size": "9184",
            "@ref": "si4",
            "@mimetype": "image/svg+xml"
          },
          {
            "@category": "thumbnail",
            "@_fa": "true",
            "$": "https://api.elsevier.com/content/object/eid/1-s2.0-S246882312400302X-si5.svg?httpAccept=%2A%2F%2A",
            "@multimediatype": "Scalable Vector Graphics file",
            "@type": "ALTIMG",
            "@size": "13068",
            "@ref": "si5",
            "@mimetype": "image/svg+xml"
          },
          {
            "@category": "thumbnail",
            "@_fa": "true",
            "$": "https://api.elsevier.com/content/object/eid/1-s2.0-S246882312400302X-si6.svg?httpAccept=%2A%2F%2A",
            "@multimediatype": "Scalable Vector Graphics file",
            "@type": "ALTIMG",
            "@size": "11724",
            "@ref": "si6",
            "@mimetype": "image/svg+xml"
          },
          {
            "@category": "thumbnail",
            "@_fa": "true",
            "$": "https://api.elsevier.com/content/object/eid/1-s2.0-S246882312400302X-si7.svg?httpAccept=%2A%2F%2A",
            "@multimediatype": "Scalable Vector Graphics file",
            "@type": "ALTIMG",
            "@size": "12425",
            "@ref": "si7",
            "@mimetype": "image/svg+xml"
          },
          {
            "@category": "thumbnail",
            "@_fa": "true",
            "$": "https://api.elsevier.com/content/object/eid/1-s2.0-S246882312400302X-si8.svg?httpAccept=%2A%2F%2A",
            "@multimediatype": "Scalable Vector Graphics file",
            "@type": "ALTIMG",
            "@size": "11104",
            "@ref": "si8",
            "@mimetype": "image/svg+xml"
          },
          {
            "@category": "thumbnail",
            "@_fa": "true",
            "$": "https://api.elsevier.com/content/object/eid/1-s2.0-S246882312400302X-si9.svg?httpAccept=%2A%2F%2A",
            "@multimediatype": "Scalable Vector Graphics file",
            "@type": "ALTIMG",
            "@size": "10072",
            "@ref": "si9",
            "@mimetype": "image/svg+xml"
          },
          {
            "@category": "standard",
            "@_fa": "true",
            "$": "https://api.elsevier.com/content/object/eid/1-s2.0-S246882312400302X-am.pdf?httpAccept=%2A%2F%2A",
            "@multimediatype": "Acrobat PDF file",
            "@type": "AAM-PDF",
            "@size": "820453",
            "@ref": "am",
            "@mimetype": "application/pdf"
          }
        ]
      },
      "link": {
        "@rel": "abstract",
        "@href": "https://api.elsevier.com/content/abstract/scopus_id/85189690971"
      }
    }
  }
}