{
  "metadata": {
    "title": "Selective epoxidation and allylic oxidation of olefins catalyzed by BEA-Ti and porphyrin catalysts",
    "authors": "; ; ",
    "journal": "Molecular Catalysis",
    "date": "2023-04-15",
    "doi": "10.1016/j.mcat.2023.113074",
    "abstract": "",
    "uri": "https://api.elsevier.com/content/article/pii/S2468823123001608",
    "pii": "S2468823123001608"
  },
  "fulltext": {
    "full-text-retrieval-response": {
      "scopus-eid": "2-s2.0-85150382306",
      "originalText": "serial JL 315758 291210 291744 291790 291809 31 Molecular Catalysis MOLECULARCATALYSIS 2023-03-20 2023-03-20 2023-03-20 2023-03-20 2023-04-14T11:57:02 1-s2.0-S2468823123001608 S2468-8231(23)00160-8 S2468823123001608 10.1016/j.mcat.2023.113074 S300 S300.1 FULL-TEXT 1-s2.0-S2468823123X00078 2024-06-26T17:47:58.02126Z 0 0 20230415 2023 2023-03-20T08:16:31.783901Z absattachment articleinfo articlenumber articletitlenorm authfirstinitialnorm authfirstsurnamenorm cid cids contenttype copyright crossmark dateloaded dateloadedtxt datesearch datesort dateupdated dco docsubtype doctype doi eid ewtransactionid hubeid indexeddate issn issnnorm itemstage itemtransactionid itemweight openaccess openarchive pg pgfirst pii piinorm pubdatestart pubdatetxt pubyr sectiontitle sortorder srctitle srctitlenorm srctype ssids alllist content subj subheadings suppl tomb volfirst volissue volumelist webpdf webpdfpagecount yearnav figure table e-component body acknowledge affil appendices articletitle auth authfirstini authfull authkeywords authlast grantnumber grantsponsor highlightsabst primabst ref specialabst 2468-8231 24688231 true 541 541 C Volume 541 9 113074 113074 113074 20230415 15 April 2023 2023-04-15 2023 Regular Papers article fla © 2023 Elsevier B.V. All rights reserved. SELECTIVEEPOXIDATIONALLYLICOXIDATIONOLEFINSCATALYZEDBYBEATIPORPHYRINCATALYSTS MA T 1 Introduction 2 Experimental 2.1 Materials 2.2 Preparation of 5-(4-Hydroxyphenyl)-10, 15, 20-triphenylporphyrin (H2MTPP) and its metalloporphyrin MnMTPP 2.3 Preparation of BEA-Ti zeolite 2.4 Synthesis of BEA-Ti-H2MTPP and BEA-Ti-MnMTPP 2.5 Characterization of catalyst 2.6 Catalytic experiment 2.6.1 Typical procedure for the selective oxidation of cyclohexene by BEA-Ti-H2MTPP or BEA-Ti-MnMTPP 2.6.2 Procedure for the selective oxidation of cyclohexene by adding BEA-Ti and H2MTPP (MnMTPP) separately 3 Results and discussion 3.1 Catalyst characterization 3.2 Catalytic performance of different catalysts 3.3 Selective epoxidation catalyzed by BEA-Ti and porphyrin H2MTPP 3.4 Selective allylic oxidation catalyzed by BEA-Ti and metalloporphyrin MnMTPP 3.5 Reaction mechanism 4 Conclusions Credit author statement CRediT authorship contribution statement Acknowledgement Appendix Supplementary materials References OLOO 2015 2612 2621 W BRYLIAKOV 2014 73 96 K ENGELMANN 2016 7632 7649 X MILAN 2018 1984 1995 M SACRAMENTO 2018 2641 2652 J NAM 2018 2014 2022 W SMEETS 2022 e202101132 V JAPPAR 1998 132 141 N LIU 2019 1222 1228 X DAURA 2020 4737 4750 A GORDON 2020 708 713 C GIORDANO 2019 7090 7106 N BREGANTE 2020 10169 10184 D XIA 2001 179 193 Q ZHAO 2018 6390 6397 Y BREGANTE 2019 7302 7319 D DEGNAN 2003 32 46 T CORMA 2003 298 312 A LIU 2017 14113 Y MOOR 2011 1204 1219 B BREGANTE 2018 2995 3010 D GOUNDER 2012 229 238 R JCORDON 2018 14244 14266 M JONES 2014 17787 17800 A WOLFENDEN 2001 938 945 R ROMESBERG 1998 1929 1933 F NOTESTEIN 2007 15585 15595 J BASS 2003 5219 5222 J BOUH 1999 7201 7210 A LU 2012 1002 1012 J NANDI 2013 2484 2489 P BORDIGA 2007 4854 4878 S RADHAKRISHNAN 2001 4245 4253 R BREGANTE 2017 75 89 D BREGANTE 2017 6888 6898 D FREUDE 1994 271 286 D HUNGER 1996 349 353 M CHALUPKA 2018 7071524 K NOGIER 2009 4885 4889 J MAKSOD 2017 140 149 I MA 2018 4645 4659 W MOOSAVIFAR 2014 1561 1567 M ROZ 2013 111 119 M LIANG 2021 1219 1230 X VICTOR 2022 150 155 W BELVISO 2016 228 234 S FISER 2001 725 731 S PETROVIC 2002 293 299 Z GOUD 2007 4065 4076 V STULTZ 2000 5984 5996 L XIA 2005 1603 1662 Q TONG 2017 222 230 J LIN 2002 9292 9298 W ZBIK 2011 10 15 D MAX2023X113074 MAX2023X113074XT 2025-03-20T00:00:00.000Z 2025-03-20T00:00:00.000Z http://creativecommons.org/licenses/by-nc-nd/4.0/ © 2023 Elsevier B.V. All rights reserved. 2023-03-24T06:13:17.605Z http://vtw.elsevier.com/data/voc/AddOnTypes/50.7/aggregated-refined National Natural Science Foundation of China 21908094 22078150 22178168 22278221 NSFC National Natural Science Foundation of China http://data.elsevier.com/vocabulary/SciValFunders/501100001809 http://sws.geonames.org/1814991/ National Key Research and Development Program of China 2021YFC2101900 2022YFC2105603 NKRDPC National Key Research and Development Program of China http://data.elsevier.com/vocabulary/SciValFunders/501100012166 http://sws.geonames.org/1814991/ Key Research and Development Plan of Jiangsu Province BE2021083 SBE2022740422 Key Research and Development Program of Jiangxi Province http://data.elsevier.com/vocabulary/SciValFunders/501100013064 http://sws.geonames.org/1814991/ Top-notch Academic Programs Project of Jiangsu Higher Education Institutions Nanjing International Joint Research and Development Project 202002037 The research has been supported by The National Natural Science Foundation of China ( 21908094 , 22178168 , 22078150 and 22278221 ); The National Key Research and Development Program of China ( 2021YFC2101900 and 2022YFC2105603 ); Key Research and Development Plan of Jiangsu Province ( SBE2022740422 and BE2021083 ); Nanjing International Joint Research and Development Project ( 202002037 ); The Top-notch Academic Programs Project of Jiangsu Higher Education Institutions. https://doi.org/10.15223/policy-017 https://doi.org/10.15223/policy-037 https://doi.org/10.15223/policy-012 https://doi.org/10.15223/policy-029 https://doi.org/10.15223/policy-004 item S2468-8231(23)00160-8 S2468823123001608 1-s2.0-S2468823123001608 10.1016/j.mcat.2023.113074 315758 2023-04-14T11:15:23.202466Z 2023-04-15 1-s2.0-S2468823123001608-main.pdf https://s3-eu-west-1.amazonaws.com/prod-ucs-content-store-eu-west/content/pii:S2468823123001608/MAIN/application/pdf/ff0626787d643c0c0af47f67081ae30a/main.pdf main.pdf pdf true 2408346 MAIN 9 1-s2.0-S2468823123001608-main_1.png https://s3-eu-west-1.amazonaws.com/prod-ucs-content-store-eu-west/content/pii:S2468823123001608/PREVIEW/image/png/194bb7ea1e4fed9d5b309547cc37759c/main_1.png main_1.png png 58385 849 656 IMAGE-WEB-PDF 1 1-s2.0-S2468823123001608-gr5.jpg https://s3-eu-west-1.amazonaws.com/prod-ucs-content-store-eu-west/content/pii:S2468823123001608/gr5/DOWNSAMPLED/image/jpeg/93f0ada34426db12b4a077c85cd8866c/gr5.jpg gr5 gr5.jpg jpg 35871 231 753 IMAGE-DOWNSAMPLED 1-s2.0-S2468823123001608-gr4.jpg https://s3-eu-west-1.amazonaws.com/prod-ucs-content-store-eu-west/content/pii:S2468823123001608/gr4/DOWNSAMPLED/image/jpeg/77db78e1e0672f1729bb0e917bb2cde7/gr4.jpg gr4 gr4.jpg jpg 30398 182 678 IMAGE-DOWNSAMPLED 1-s2.0-S2468823123001608-gr7.jpg https://s3-eu-west-1.amazonaws.com/prod-ucs-content-store-eu-west/content/pii:S2468823123001608/gr7/DOWNSAMPLED/image/jpeg/3a6648350cd63520361f95014e06ade7/gr7.jpg gr7 gr7.jpg jpg 51276 471 753 IMAGE-DOWNSAMPLED 1-s2.0-S2468823123001608-gr6.jpg https://s3-eu-west-1.amazonaws.com/prod-ucs-content-store-eu-west/content/pii:S2468823123001608/gr6/DOWNSAMPLED/image/jpeg/3c1f49b5219d02d6b4565f7328aef5a1/gr6.jpg gr6 gr6.jpg jpg 43710 233 753 IMAGE-DOWNSAMPLED 1-s2.0-S2468823123001608-gr1.jpg https://s3-eu-west-1.amazonaws.com/prod-ucs-content-store-eu-west/content/pii:S2468823123001608/gr1/DOWNSAMPLED/image/jpeg/32fc26a7d4f8df0c3a5e7d303719267e/gr1.jpg gr1 gr1.jpg jpg 43513 275 678 IMAGE-DOWNSAMPLED 1-s2.0-S2468823123001608-gr3.jpg https://s3-eu-west-1.amazonaws.com/prod-ucs-content-store-eu-west/content/pii:S2468823123001608/gr3/DOWNSAMPLED/image/jpeg/704063a66910026d32813717f158a6da/gr3.jpg gr3 gr3.jpg jpg 52649 281 678 IMAGE-DOWNSAMPLED 1-s2.0-S2468823123001608-gr2.jpg https://s3-eu-west-1.amazonaws.com/prod-ucs-content-store-eu-west/content/pii:S2468823123001608/gr2/DOWNSAMPLED/image/jpeg/4052bf2a8114a7200a767c28a018bbe9/gr2.jpg gr2 gr2.jpg jpg 44793 279 678 IMAGE-DOWNSAMPLED 1-s2.0-S2468823123001608-ga1.jpg https://s3-eu-west-1.amazonaws.com/prod-ucs-content-store-eu-west/content/pii:S2468823123001608/ga1/DOWNSAMPLED/image/jpeg/22883a3fa7bbbc2c9c737860c63ddbe7/ga1.jpg ga1 true ga1.jpg jpg 21018 134 500 IMAGE-DOWNSAMPLED 1-s2.0-S2468823123001608-gr5.sml https://s3-eu-west-1.amazonaws.com/prod-ucs-content-store-eu-west/content/pii:S2468823123001608/gr5/THUMBNAIL/image/gif/0ff5cf6878ae5146c4e22b86926b4475/gr5.sml gr5 gr5.sml sml 7127 67 219 IMAGE-THUMBNAIL 1-s2.0-S2468823123001608-gr4.sml https://s3-eu-west-1.amazonaws.com/prod-ucs-content-store-eu-west/content/pii:S2468823123001608/gr4/THUMBNAIL/image/gif/6473451c83e0c80faa82d35242d43203/gr4.sml gr4 gr4.sml sml 6555 59 219 IMAGE-THUMBNAIL 1-s2.0-S2468823123001608-gr7.sml https://s3-eu-west-1.amazonaws.com/prod-ucs-content-store-eu-west/content/pii:S2468823123001608/gr7/THUMBNAIL/image/gif/e7a601506044559e4f178cc1c630e7a7/gr7.sml gr7 gr7.sml sml 8286 137 219 IMAGE-THUMBNAIL 1-s2.0-S2468823123001608-gr6.sml https://s3-eu-west-1.amazonaws.com/prod-ucs-content-store-eu-west/content/pii:S2468823123001608/gr6/THUMBNAIL/image/gif/065764cc3b5a912dced4d7b247bc874c/gr6.sml gr6 gr6.sml sml 7737 68 219 IMAGE-THUMBNAIL 1-s2.0-S2468823123001608-gr1.sml https://s3-eu-west-1.amazonaws.com/prod-ucs-content-store-eu-west/content/pii:S2468823123001608/gr1/THUMBNAIL/image/gif/8db13345370b20ab1a98aaf37d450780/gr1.sml gr1 gr1.sml sml 7623 89 219 IMAGE-THUMBNAIL 1-s2.0-S2468823123001608-gr3.sml https://s3-eu-west-1.amazonaws.com/prod-ucs-content-store-eu-west/content/pii:S2468823123001608/gr3/THUMBNAIL/image/gif/e0ac1561814e67b48fdd5287d7fbb61a/gr3.sml gr3 gr3.sml sml 9063 91 219 IMAGE-THUMBNAIL 1-s2.0-S2468823123001608-gr2.sml https://s3-eu-west-1.amazonaws.com/prod-ucs-content-store-eu-west/content/pii:S2468823123001608/gr2/THUMBNAIL/image/gif/e77506a563678e5974c97905cf39888b/gr2.sml gr2 gr2.sml sml 7602 90 219 IMAGE-THUMBNAIL 1-s2.0-S2468823123001608-ga1.sml https://s3-eu-west-1.amazonaws.com/prod-ucs-content-store-eu-west/content/pii:S2468823123001608/ga1/THUMBNAIL/image/gif/fb49146bca57f52679a18a53ab5dd977/ga1.sml ga1 true ga1.sml sml 6530 59 219 IMAGE-THUMBNAIL 1-s2.0-S2468823123001608-gr5_lrg.jpg https://s3-eu-west-1.amazonaws.com/prod-ucs-content-store-eu-west/content/pii:S2468823123001608/HIGHRES/image/jpeg/51df5e7031c4e9531938ec443e279f02/gr5_lrg.jpg gr5 gr5_lrg.jpg jpg 218260 1023 3333 IMAGE-HIGH-RES 1-s2.0-S2468823123001608-gr4_lrg.jpg https://s3-eu-west-1.amazonaws.com/prod-ucs-content-store-eu-west/content/pii:S2468823123001608/HIGHRES/image/jpeg/f4750ebead167cd7c7b3345b3f707901/gr4_lrg.jpg gr4 gr4_lrg.jpg jpg 178785 806 3000 IMAGE-HIGH-RES 1-s2.0-S2468823123001608-gr7_lrg.jpg https://s3-eu-west-1.amazonaws.com/prod-ucs-content-store-eu-west/content/pii:S2468823123001608/HIGHRES/image/jpeg/866b0c843b5129a53bf5a6d380084152/gr7_lrg.jpg gr7 gr7_lrg.jpg jpg 327446 2085 3333 IMAGE-HIGH-RES 1-s2.0-S2468823123001608-gr6_lrg.jpg https://s3-eu-west-1.amazonaws.com/prod-ucs-content-store-eu-west/content/pii:S2468823123001608/HIGHRES/image/jpeg/69d13052bc134991a82fd1a0902b780b/gr6_lrg.jpg gr6 gr6_lrg.jpg jpg 261776 1032 3333 IMAGE-HIGH-RES 1-s2.0-S2468823123001608-gr1_lrg.jpg https://s3-eu-west-1.amazonaws.com/prod-ucs-content-store-eu-west/content/pii:S2468823123001608/HIGHRES/image/jpeg/e9427eba95a0218f67b1ce95a23bcf8a/gr1_lrg.jpg gr1 gr1_lrg.jpg jpg 286731 1219 3000 IMAGE-HIGH-RES 1-s2.0-S2468823123001608-gr3_lrg.jpg https://s3-eu-west-1.amazonaws.com/prod-ucs-content-store-eu-west/content/pii:S2468823123001608/HIGHRES/image/jpeg/335038aef0ea2ce5c7e9bcda0c71b08b/gr3_lrg.jpg gr3 gr3_lrg.jpg jpg 310541 1242 3000 IMAGE-HIGH-RES 1-s2.0-S2468823123001608-gr2_lrg.jpg https://s3-eu-west-1.amazonaws.com/prod-ucs-content-store-eu-west/content/pii:S2468823123001608/HIGHRES/image/jpeg/59b675c9eb145cba74c62c0c48517ca3/gr2_lrg.jpg gr2 gr2_lrg.jpg jpg 276262 1236 3000 IMAGE-HIGH-RES 1-s2.0-S2468823123001608-ga1_lrg.jpg https://s3-eu-west-1.amazonaws.com/prod-ucs-content-store-eu-west/content/pii:S2468823123001608/HIGHRES/image/jpeg/f2577da6f52ac5f89ec86ca527100c0c/ga1_lrg.jpg ga1 true ga1_lrg.jpg jpg 121839 593 2213 IMAGE-HIGH-RES 1-s2.0-S2468823123001608-mmc1.docx https://s3-eu-west-1.amazonaws.com/prod-ucs-content-store-eu-west/content/pii:S2468823123001608/mmc1/MAIN/application/vnd.openxmlformats-officedocument.wordprocessingml.document/7697136da14b22ba9105a87ee0362a2d/mmc1.docx mmc1 mmc1.docx docx 719711 APPLICATION 1-s2.0-S2468823123001608-am.pdf https://s3-eu-west-1.amazonaws.com/prod-ucs-content-store-eu-west/content/egi:10XW0C7N0C9/MAIN/application/pdf/df9a94240e5441eb3c30a73736da2ca8/am.pdf am am.pdf pdf false 845440 AAM-PDF MCAT 113074 113074 S2468-8231(23)00160-8 10.1016/j.mcat.2023.113074 Fig. 1 (A) XRD patterns of BEA, dealuminated BEA (Si-β) and BEA-Ti. (B) The attenuated total reflection infrared spectroscopy of BEA, Si-β and BEA-Ti. Fig 1 Fig. 2 (A) 1H MAS NMR of BEA, Si-β and BEA-Ti. (B) 29Si MAS NMR of BEA, Si-β and BEA-Ti. Fig 2 Fig. 3 (A) The IR spectrum of H2MTPP, MnMTPP, BEA-Ti, BEA-Ti-H2MTPP, BEA-Ti-MnMTPP, BEA-Ti+H2MTPP and BEA-Ti+MnMTPP. (B) UV-vis spectra of BEA-Ti, BEA-Ti-H2MTPP and BEA-Ti-MnMTPP. Fig 3 Fig. 4 Selective oxidation of cyclohexene with different catalysts. Fig 4 Fig. 5 Epoxidation of cyclohexene. (A) Different catalysts. (B) The ratio between BEA-Ti and porphyrin. (C) The content of Ti. Fig 5 Fig. 6 Allylic oxidation of cyclohexene. (A) Different metal porphyrins. (B) The ratio of BEA-Ti and Mn-porphyrin. (C) The content of Ti. Fig 6 Fig. 7 Proposed reaction mechanism in the selective oxidation of cyclohexene. Fig 7 Table 1 Reaction conditions for the selective epoxidation catalyzed by BEA-Ti and porphyrin catalysts. Table 1 Entry Temperature/°C Time/h Catalysts/% Oxidants/eq Conversion/% Epoxideyield/% 2-cyclohexen-1-oneyield/% Epoxides/ 2-cyclohexen-1-one 1 50 6 11 2 32.5 26.0 6.4 80:20 2 60 6 11 2 49.8 42.8 7.1 86:14 3 70 6 11 2 46.8 39.8 6.8 85:15 4 60 10 11 2 51.3 43.1 7.4 84:16 5a 60 16 11 2 74.0 54.0 15.1 78:22 6b 60 18 11 2 71.0 51.0 11.7 81:19 7 60 16 10 2 63.3 47.5 15.8 75:25 8c 60 16 20 2 67.1 52.0 12.6 80:20 9 60 16 20 1 47.1 37.2 9.9 79:21 10 60 16 20 3 60.4 47.1 13.6 78:22 Carbon balance: a(93.4%); b(88.3%); c(96.3%). Table 2 Reaction conditions for the allylic oxidation of cyclohexene catalyzed by BEA-Ti and MnMTPP. Table 2 Entry Temperature/°C Time/h Catalysts/% Oxidants/eq Conversion/% Epoxideyield/% 2-cyclohexen-1-oneyield/% Epoxides/ 2-cyclohexen-1-one 1 20 8 11 2 60.6 11.6 49.1 19:81 2 30 8 11 2 69.1 10.0 60.7 14:86 3 40 8 11 2 70.1 9.2 54.2 14:86 4 30 4 11 2 53.9 0 53.9 0:100 5 30 12 11 2 71.3 9.0 61.0 13:87 6a 30 16 11 2 77.5 8.9 69.0 11:89 7b 30 18 11 2 77.6 8.6 66.6 11:89 8c 30 16 15 2 80.8 9.9 71.1 12:88 9 30 16 20 2 79.7 10.2 70.1 12:88 10 30 16 15 1 64.9 7.5 57.8 11:89 11 30 16 15 3 80.6 10.4 70.1 13:87 Carbon balance: a(100%); b(96.9%); c(100%). Selective epoxidation and allylic oxidation of olefins catalyzed by BEA-Ti and porphyrin catalysts Tingting Ma Investigation Writing – original draft Writing – review & editing a Chao Xu Validation Funding acquisition b ⁎ Fengyang Liu Investigation Validation c Yirong Feng Writing – review & editing a Wenyan Zhang Investigation a Weiwei Tang Investigation c Haoyu Zhang Investigation a Xiaowei Li Investigation a Yingying Nie Investigation a Shuangfei Zhao Project administration Funding acquisition a Yuguang Li Project administration Funding acquisition d Dong Ji Project administration Funding acquisition d Zheng Fang Project administration Funding acquisition a e Wei He Funding acquisition Writing – review & editing a b ⁎ Kai Guo Funding acquisition Writing – review & editing a e a College of Biotechnology and Pharmaceutical Engineering, Nanjing Tech University, Nanjing 211816, PR China College of Biotechnology and Pharmaceutical Engineering Nanjing Tech University Nanjing 211816 PR China aCollege of Biotechnology and Pharmaceutical Engineering, Nanjing Tech University, Nanjing 211816, PR China b CAS Key Laboratory of Biobased Materials, Qingdao Institute of Bioenergy and Bioprocess Technology, Chinese Academy of Sciences, 266101, Qingdao, PR China CAS Key Laboratory of Biobased Materials Qingdao Institute of Bioenergy and Bioprocess Technology Chinese Academy of Sciences Qingdao 266101 PR China bCAS Key Laboratory of Biobased Materials, Qingdao Institute of Bioenergy and Bioprocess Technology, Chinese Academy of Sciences, 266101, Qingdao, PR China c School of Pharmaceutical Sciences, Nanjing Tech University, Nanjing 211816, PR China School of Pharmaceutical Sciences Nanjing Tech University Nanjing 211816 PR China cSchool of Pharmaceutical Sciences, Nanjing Tech University, Nanjing 211816, PR China d Institute of Nanjing Advanced Biomaterials & Processing Equipment, Nanjing 211299, PR China Institute of Nanjing Advanced Biomaterials & Processing Equipment Nanjing 211299 PR China dInstitute of Nanjing Advanced Biomaterials & Processing Equipment, Nanjing 211299, PR China e State Key Laboratory of Materials-Oriented Chemical Engineering, Nanjing Tech University, Nanjing 210009, PR China State Key Laboratory of Materials-Oriented Chemical Engineering Nanjing Tech University Nanjing 210009 PR China eState Key Laboratory of Materials-Oriented Chemical Engineering, Nanjing Tech University, Nanjing 210009, PR China ⁎ Corresponding authors. Selective epoxidation and allylic oxidation of cyclohexene were realized in the presence of BEA-Ti and (metallo)porphyrin catalysts. The integration of BEA-Ti and porphyrin H2MTPP afforded cyclohexene oxide with excellent selectivity (cyclohexene oxide/ 2-cyclohexen-1-one=85:15). BEA-Ti and metalloporphyrin MnMTPP yielded 2-cyclohexen-1-one with high selectivity (cyclohexene oxide/ 2-cyclohexen-1-one=12:88). Resulting active species involving of (metallo)porphyrin, TiIV sites and tert-butyl hydroperoxide (TBHP) promoted the oxidation process of cyclohexene. A possible mechanism resulting in the formation cyclohexene oxide and 2-cyclohexen-1-one was proposed. The outer-sphere effect constructed by (metallo)porphyrin, TiIV sites and TBHP on the surface of BEA-Ti framework improved the epoxidation and allylic oxidation both in the conversion and selectivity. Graphical abstract Image, graphical abstract Keywords Epoxidation Allylic oxidation BEA-Ti Porphyrin Outer-sphere effect Data availability No data was used for the research described in the article. 1 Introduction Oxidation reactions, such as C=C bond oxidations and allyl oxidation, played an important role in organic synthesis both in the laboratory and industrial processes [1–5]. In nature, these transformations could be realized in a selective manner when heme and non-heme iron-containing enzymes were involved in the oxidation reactions. Inspired by these natural enzymes, considerable efforts had been made to develop novel selective catalysts for these chemical transformations [6]. Among these catalysts, titanium silicalite zeolite-based catalysts displayed certain catalytic activity towards epoxidation reaction [7], such as tetrahedrally coordinated Ti active sites and framework topology. Notably, their catalytic performances were closely related to the inherent structure characteristics affected by the synthesis conditions of titanium silicalite zeolite [8,9]. Many researches focused more on the precise control of microenvironment of Ti active sites in the zeolite [10–13]. The distinct differences in the catalytic activity were observed when Ti active sites were located in different confinement environments of the same zeolite framework revealing the promoting effect of structural confinement in the mass transfer between the reactants and Ti active sites [12]. For example, Ti-beta displayed the weak ability to activate TBHP, which was ascribed to the difficult accommodation of small pores of Ti-beta for large transition state of Ti-OOtBu and bulky cycloalkene [14,15]. Herein, we hoped the cooperation of Ti-beta and (metallo)porphyrin could separately catalyze selective epoxidation and allylic oxidation of olefins. In addition, the silanol nests in the BEA framework showed obvious promotion effect in the catalytic activity of Ti active sites towards epoxidation. The maximum content of silanol nests in the framework displayed excellent catalytic activity than that free of defect sites [16]. A series of experimental and theoretical studies demonstrated that the delicate control of Ti active sites in suitable microenvironment would be crucial for the catalytic performance [17–20]. Confinement of Ti active sites within micropores has been proved to be an efficient approach to adjust their catalytic properties [21–24] through the noncovalent interactions of pore walls with reacting species in the inner-sphere of active site. Recent research about partially confining environments on the surfaces of zeolites similar with the surface pockets of enzymes [25,26], has received tremendous interests. Thus, a much wider range of reactions, involving intermediates and molecules that are too large to enter the inner-sphere of active sites, could be improved through the beneficial confinement effect of outer-sphere in the active sites. Generally, outer-sphere effects could be adjusted by surface moieties that were vicinal (noncoordinating) to the active centers [27–33]. Here, we demonstrated that the outer-sphere environments had a profound effect on the catalytic performance of TiIV sites supported on BEA framework. The oxidation of cyclohexene with TBHP was selected as the model reaction. Porphyrins and metal porphyrins were applied in the construction of microenvironment of TiIV active sites to realize the selective oxidation of cyclohexene. 2 Experimental 2.1 Materials Benzaldehyde, p-hydroxybenzaldehyde, propionic acid, pyrrole, methanol, acetonitrile, dichloromethane, anhydrous ethanol and other chemicals were reagent grade, which were provided by Aladdin Corp. (Shanghai, China). Cyclohexene, zirconium n-butoxide, hafnium n-butoxide, metal chloride were purchased from McLean Biochemical Technology Co., Ltd., (Shanghai, China). β zeolite, TBHP in decane and urea peroxide were supplied by Thain Chemical Technology Co., Ltd., (Shanghai, China). Concentrated nitric acid and 30% hydrogen peroxide were purchased from Sinopharm Chemical Reagent Company. 2.2 Preparation of 5-(4-Hydroxyphenyl)-10, 15, 20-triphenylporphyrin (H2MTPP) and its metalloporphyrin MnMTPP 4-Hydroxybenzaldehyde (3.675 g, 30 mmol), benzaldehyde (9.55 g, 90 mmol) and propionic acid (100 ml) were added into a three-necked bottle (500 mL). The reaction mixture was heated at 160 °C under vigorous stirring conditions until the solid reactant disappeared. Then, pyrrole (8 g, 120 mmol) dissolved in 60 ml propionic acid were dropped dropwise into the solution. After being heated to reflux for 90 min, the hot reaction solution was poured into a large amount of ethanol quickly. The resulting ethanol solution was transferred to the refrigerator for recrystallization. The precipitated solid was filtered and purified on a silica gel column with dichloromethane as eluent. The purple product was dried and stored in vacuum drying oven. H2MTPP and a certain amount of manganese chloride were dissolved in dimethyl formamide. After being heated to reflux for 4 h, the hot reaction solution was poured into a large amount of water. The resulting aqueous solution was extracted with dichloromethane. The metalloporphyrin MnMTPP and unreacted porphyrin were dissolved in dichloromethane phase, while unreacted metal chlorides were dissolved in the aqueous phase. After purification by silica gel column, resulting metalloporphyrin MnMTPP was dried and stored in vacuum drying oven. 2.3 Preparation of BEA-Ti zeolite For BEA-Ti, a modified liquid phase infiltration method was applied in the dealumination process. At first, dealumination process was conducted to create necessary vacant framework sites in the zeolite. Parent BEA zeolites (Si: Al = 12.5, NH4+ cation) were added into concentrated nitric acid. After being heated to reflux for 20 h, the resulting dealuminated BEA zeolites were washed with concentrated nitric acid and deionized water. After drying at 100 °C, the obtained solid was calcined at 550 °C for 6 h, affording dealuminated Si-β zeolite (Si: Al > 1200). Then, the resulting dealuminated BEA was dispersed in dichloromethane in nitrogen atmosphere. A certain amount of TiCl4 was added into the suspension. The introduction of Ti ions into the framework of dealuminated BEA was conducted at 50 °C for 3 h. BEA-Ti with different Ti contents could be prepared by adjusting the amount of TiCl4. It should be noticed that TiCl4 could easily react with water in the air to form toxic HCl gas. Thus, TiCl4 should be added carefully under inert gas protection. After the reaction, dichloromethane was removed under vacuum. The obtained solid was calcined at 550 °C for 6 h. The resulting white BEA-Ti powder was stored in the vacuum oven. 2.4 Synthesis of BEA-Ti-H2MTPP and BEA-Ti-MnMTPP The prepared BEA-Ti zeolite was added into the toluene solution containing porphyrin H2MTPP or metalloporphyrin MnMTPP. The preparation process was monitored by TLC. Once no porphyrin H2MTPP or metalloporphyrin MnMTPP was detected in the reaction mixture, the reaction was terminated. After being stirred at 80 °C for 10 h, no porphyrin H2MTPP or metalloporphyrin MnMTPP was detected. Meanwhile, the suspension changed from color purple to green. After reaction, the green solid was obtained through filtration and washing. Then, the resulting BEA-Ti-H2MTPP and BEA-Ti-MnMTPP was dried in vacuum oven and stored for use. 2.5 Characterization of catalyst The structure of porphyrin and corresponding metalloporphyrin could be confirmed by NMR. The content of Ti in BEA-Ti was determined by ICP-OES (PerkinElmer 8300). The crystal phase of the sample was determined by X-ray powder diffraction (XRD) (Bruker D8 Advance, Cu Kα). The hydrogen and silicon spectra of BEA-Ti were determined by solid state nuclear magnetic resonance (Agilent 600M). Attenuated total reflection infrared spectroscopy of BEA-Ti in KBr pellets were recorded using Bruker Tensor [27] spectrometer to determine the formed bonds of Ti in BEA skeleton. 2.6 Catalytic experiment 2.6.1 Typical procedure for the selective oxidation of cyclohexene by BEA-Ti-H2MTPP or BEA-Ti-MnMTPP The catalytic experiments for epoxides were carried out in a 15 ml pressure tube. In the tube, BEA-Ti-H2MTPP was dispersed in acetonitrile solution (2 mL) containing cyclohexene (0.13 g). The mass ratio of BEA-Ti-H2MTPP to cyclohexene was 20:100. The mass content of Ti in the catalyst (BEA-Ti-H2MTPP) was 10 mg/Kg. The molar ratio of Ti to H2MTPP was 2:1. Then, a certain amount of TBHP was added into the solution. The molar ratio of TBHP to cyclohexene was 2:1. After stirring and heating at 60 °C for 16 h, the mixture was cooled to room temperature. The organic phase was analyzed by gas chromatography with DB-WAX column. The catalytic experiments for 2-cyclohexen-1-one were carried out in a 15 ml pressure tube. In the tube, BEA-Ti-MnMTPP was dispersed in acetonitrile solution (2 mL) containing cyclohexene (0.13 g). The mass ratio of BEA-Ti-MnMTPP to cyclohexene was 15:100. The mass content of Ti in the catalyst (BEA-Ti-MnMTPP) was 25 mg/Kg. The molar ratio of Ti to MnMTPP was 2:1. Then, a certain amount of TBHP was added into the solution. The molar ratio of TBHP to cyclohexene was 2:1. After stirring and heating at 60 °C for 16 h, the mixture was cooled to room temperature. The organic phase was analyzed by gas chromatography with DB-WAX column. 2.6.2 Procedure for the selective oxidation of cyclohexene by adding BEA-Ti and H2MTPP (MnMTPP) separately The catalytic experiments for epoxides were carried out in a 15 ml pressure tube. In the tube, BEA-Ti and H2MTPP were dispersed in acetonitrile solution (2 mL) containing cyclohexene (0.13 g). The total mass of BEA-Ti and H2MTPP held 20 percent of mass of cyclohexene. The mass content of Ti in BEA-Ti was 10 mg/Kg. The molar ratio of Ti to H2MTPP was 2:1. Then, a certain amount of TBHP was added into the solution. The molar ratio of TBHP to cyclohexene was 2:1. After stirring and heating at 60 °C for 16 h, the mixture was cooled to room temperature. The organic phase was analyzed by gas chromatography with DB-WAX column. The catalytic experiments for 2-cyclohexen-1-one were carried out in a 15 ml pressure tube. In the tube, BEA-Ti and MnMTPP were dispersed in acetonitrile solution (2 mL) containing cyclohexene (0.13 g). The total mass of BEA-Ti and MnMTPP held 15 percent of mass of cyclohexene. The mass content of Ti in BEA-Ti was 25 mg/Kg. The molar ratio of Ti to MnMTPP was 2:1. Then, a certain amount of TBHP was added into the solution. The molar ratio of TBHP to cyclohexene was 2:1. After stirring and heating at 60 °C for 16 h, the mixture was cooled to room temperature. The organic phase was analyzed by gas chromatography with DB-WAX column. 3 Results and discussion 3.1 Catalyst characterization To verify the stability of BEA zeolites in the dealumination and metal-doping process, the structures of the as-prepared dealuminated BEA (Si-β) and BEA-Ti were characterized by XRD. As shown in Fig. 1 A, XRD patterns of dealuminated BEA and BEA-Ti was consistent with that in BEA, demonstrating that resulting zeolites still maintained the integrity of BEA framework after dealumination and metal-doping process [34]. To further confirm the doping situation of Ti atoms, attenuated total reflection infrared spectroscopy of BEA, Si-β and BEA-Ti were performed (Fig. 1B). Three characteristic absorption peaks were observed in the above three samples. The peaks at 1234, 1095, and 805 cm-1 belonged to the inner tetrahedral stretching of SiO4, the Vas(Si-O), and the Vs(Si-O), respectively [34]. A new weak absorption peak at 960 cm-1 was detected in BEA-Ti compared with BEA and Si-β [35]. This peak corresponded to the stretching vibration of Si-O-Ti, demonstrating that Ti atoms were incorporated into the framework of BEA. Fig. 2 A displayed the 1H MAS NMR spectrum of BEA, Si-β and BEA-Ti. In the 1H MAS NMR spectrum of BEA framework, the peaks at 0.89 ppm corresponded to protons of isolated and/or terminal SiO-H. The signals observed at 3.40 pm and 3.86 ppm were due to protons of bridged Si-O(H)-Al Brønsted groups or H-bonded silanol groups at vacant T-atom sites [36,37]. The 1H MAS NMR signal at 6.59 ppm could be explained by the water adsorption on the Lewis acid site of the zeolite framework [38]. Due to the removal of Al atoms and formation of vacant T-atom sites related to SiO-H groups, two signals at 3.40 pm and 3.86 ppm appeared a right shift. Sharper peaks were displayed in the 1H MAS NMR spectrum of Si-β. The appearance of the characteristic peak at 4.09 ppm evidenced the reaction of TiCl4 with H-bonded SiO-H groups. The decrease in the peak intensity at 0.89 ppm further confirmed the introduction of Ti into BEA zeolite by reacting with isolated SiO-H groups [37]. Generally, there were three kinds of Si atoms in the BEA framework. Si atoms in the Si(OSi)4 environment represented at -116.3 ppm. Si atoms in the Si(OH)(OSi)3 environment displayed at -107.6 ppm. Furthermore, few Si atoms in the Si(OH)2(OSi)2 environment was also proved by the weak peak at -97.8 ppm. In the spectrum of Si-β, the peak at -107.2 ppm corresponding to the Si atoms in the Si(OH)(OSi)3 environment showed a strong increase in the intensity due to the removal of Al atoms from BEA zeolite [37]. In the spectrum of BEA-Ti, the characteristic peak at -106.8 ppm belonged to the Si atom in Si(OH)(OSi)3. The peak at -116.3 ppm (Fig. 2B) represented the Si atom in Si(OM)4 (M= Si, Ti). After incorporating Ti ions in the Si-β, a smaller peak located at 106.8 ppm was observed. The right shift and decreased intensity further confirmed the reaction between TiCl4 and silanol groups [39]. Fig. 3 A showed that the Mn-N characteristic vibration of MnMTPP was around 1010 cm-1, indicating that the metal cation was coordinated in the porphyrin ring. In BEA-Ti, the peaks of 1050-1225 cm-1 could be attributed to asymmetric stretch of T-O bond [40]. The mixed catalyst (BEA-Ti+H2MTPP) retained the special absorption peaks of BEA-Ti and H2MTPP. Similarly, another mixed catalyst (BEA-Ti+MnMTPP) retained the special absorption peaks of BEA-Ti and MnMTPP. But in BEA-Ti-H2MTPP or BEA-Ti-MnMTPP, a strong peak at 576 cm-1 referring to v[Ti(O2)], appeared simultaneously [41]. Additional peaks observed at 1630 and 3422 cm-1 were related to lattice water molecules and surface hydroxylic groups, indicating that the bond between BEA-Ti and H2MTPP/ MnMTPP were accompanied by the disruption of hydrogen-bonded of H2O molecules at the adsorption sites and the hydroxyl groups [42,43]. UV-vis spectroscopy could be used to characterize the coordination state of titanium species in titanium-containing zeolites. In Fig. 3B, there was a strong asymmetric peak at about 225 nm, which could be attributed to an oxygen-tetrahedral Ti(IV) coordination compound. And the peaks at 275 and 278 nm were assigned to dimers/oligomers of extra framework Ti species [40,44,45]. When BEA-Ti was coordinated with hydroxyl groups in H2MTPP or MnMTPP, a right shift was observed. Compared to pure BEA-Ti, BEA-Ti-H2MTPP showed obvious B-band and Q-band absorption peaks of porphyrin at around 427 nm and 665 nm [46]. In addition, BEA-Ti-MnMTPP revealed CT-band, Q-band and Soret band absorption peaks of MnMTPP at 413 nm, 475 nm, 570 nm, respectively. These results proved that Ti atoms in BEA-Ti was coordinated with the hydroxyl group in H2MTPP or MnMTPP. 3.2 Catalytic performance of different catalysts Initially, BEA-Ti-H2MTPP or BEA-Ti-MnMTPP catalysts were evaluated in the oxidation of cyclohexene. Two interesting phenomena existed in the oxidation process. Firstly, obvious differences in the selectivity were detected when BEA-Ti-H2MTPP or BEA-Ti-MnMTPP was applied in the oxidation of cyclohexene. The combination of BEA-Ti-H2MTPP porphyrin afforded cyclohexene oxide with high selectivity, while the integration of BEA-Ti-MnMTPP yielded 2-cyclohexen-1-one with high selectivity (Fig. 4 ). In the preparation of BEA-Ti-H2MTPP or BEA-Ti-MnMTPP, the coordination of BEA-Ti with purple porphyrin or metal porphyrin (Fig. S3A) afforded a green catalyst (BEA-Ti-H2MTPP or BEA-Ti-MnMTPP) (Fig. S3B). In addition, the color of reaction solution changed upon the addition of TBHP. When the green catalyst (BEA-Ti-H2MTPP or BEA-Ti-MnMTPP) was added into the acetonitrile solution, a solid-liquid mixture containing green solution was obtained (Fig. S3C). Interestingly, addition of TBHP into the reaction mixture resulted in a solid-liquid mixture containing purple solution (Fig. S3D). Thus, the change in the color of the solution demonstrated the linkage between (metal) porphyrin and BEA-Ti might be destroyed after the addition of TBHP. To confirm this hypothesis, BEA-Ti and H2MTPP were added into acetonitrile solution containing TBHP and cyclohexene, yielding a mixture similar with that in Fig. S3D. After reacting at 60 °C for 16 h, the ratio between cyclohexene oxide and 2-cyclohexen-1-one was 78:22. Similarly, BEA-Ti and MnMTPP promoted allylic oxidation of cyclohexene, affording 2-cyclohexen-1-one with excellent selectivity. The ratio between cyclohexene oxide and 2-cyclohexen-1-one was 12:88. Similar results were obtained when BEA-Ti and H2MTPP (MnMTPP) were added separately into the reaction solution without the coordination between TiIV sites in the BEA-Ti framework and phenolic hydroxyl group in the H2MTPP (MnMTPP). Thus, coordinated catalysts (BEA-Ti-H2MTPP or BEA-Ti-MnMTPP) were not used in the subsequent optimization process of epoxidation and allylic oxidation. On the contrary, BEA-Ti and H2MTPP (MnMTPP) were added separately. 3.3 Selective epoxidation catalyzed by BEA-Ti and porphyrin H2MTPP The reaction data of selective oxidation catalyzed BEA-Ti and porphyrin catalysts and the carbon balance yield calculated by dividing the total yields of the oxidation products (cyclohexene oxide and 2-cyclohexen-1-one) by the conversion of cyclohexene were listed in Table 1 . Initially, the amount of oxidant was evaluated. When the molar ratio between cyclohexene and TBHP was 1:2, the yield and selectivity of product reached the best. More TBHP would lead to a decrease in the selectivity [47]. When the amount of catalyst was set to be 11%, the yield of epoxides was 54.0% (Table 1, entry 5). Further increase in the amount of catalyst did not change the yield and selectivity significantly (Table 1, entry 8). When the temperature was increased from 50 °C to 60 °C, the conversion increased significantly, affording a conversion of 42.8 %. The ratio between cyclohexene oxide and 2-cyclohexen-1-one was 86:14 (Table 1, entry 2). Higher temperature went against the conversion of cyclohexene (Table 1, entry 3). A slight fluctuation was observed in the selectivity for cyclohexene oxides with the increase in the reaction temperature mainly due to the decomposition of partial TBHP [48]. In addition, the yield increased significantly when the reaction time was increased from 6 h to 16 h, yielding a conversion of 74%. Extended reaction time resulted in decreased selectivity. When the reaction was set to 16 h, the yield of epoxides was 54.0% and the carbon balance was 93.4%. Enough reaction time was necessary for the epoxidation reaction. However, a series of side reaction would be occurred with increased reaction time in view of the instability of epoxides [49]. The decomposition of partial TBHP resulted in a slight fluctuation in the conversion of cyclohexene [48]. In the control experiment, single BEA-Ti was also applied in the oxidation of cyclohexene. Of course, single H2MTPP displayed no catalytic activity for epoxidation (Fig. 5 A). On the contrary, a yield of 15.6% for 2-cyclohexen-1-one was detected when H2MTPP was used as the catalyst. A combination of 2-cyclohexen-1-one and cyclohexene oxide were observed when BEA-Ti was applied in the oxidation of cyclohexene. The ratio between cyclohexene oxide and 2-cyclohexen-1-one was 49:51 (Fig. 5A). Amazingly, more epoxides were formed when BEA-Ti met with H2MTPP porphyrin catalyst. The selectivity for epoxides increased from 49:51 to 78:22. Above results revealed that BEA-Ti and porphyrin catalysts acted synergistically in the oxidation of cyclohexene. The introduction of porphyrin catalysts improved the selectivity for epoxidation. Thus, the ratio of BEA-Ti to porphyrin was also one important issue that needed to be considered. When the ratio of BEA-Ti to porphyrin was 2:1, a significant increase in the selectivity was obtained. An excellent selectivity of 81:19 was detected (Fig. 5B). BEA-Ti with different contents of Ti were prepared based on the experimental procedure described in the experimental section. The contents of Ti in these catalysts were determined based on standard curve (t2) and displayed in Table S1. The effect of Ti content in BEA-Ti on the selectivity for epoxides was studied. The average values of the yields would be obtained through three parallel experiments. The experimental errors between three parallel experiments were below ±2%. Initially, the increase in the content of Ti yielded an obvious increase in the selectivity. When the content of Ti was 10 mg/Kg, an excellent selectivity (85:15) for epoxides was obtained, affording a yield of 74.7% (Fig. 5C). Further increase in the content of Ti resulted in a slight decrease in the selectivity. 3.4 Selective allylic oxidation catalyzed by BEA-Ti and metalloporphyrin MnMTPP As revealed in the previous section, allylic oxidation of cyclohexene could be realized when BEA-Ti and metalloporphyrin were used as the catalyst. Different metalloporphyrins were evaluated to investigate the effect of metalloporphyrins on the catalytic performance. Among the four metalloporphyrins, the combination of manganese porphyrin and BEA-Ti displayed the best catalytic activity towards the allylic oxidation of cyclohexene (Fig. 6 A), affording 2-cyclohexen-1-one with excellent selectivity. The reaction data of selective oxidation catalyzed BEA-Ti and metalloporphyrin MnMTPP catalysts and the carbon balance yield calculated by dividing the total yields of the oxidation products (2-cyclohexen-1-one and cyclohexene oxide) by the conversion of cyclohexene were listed in Table 2 . When the reaction time was increased from 4 h to 16 h, the yield of 2-cyclohexen-1-one increased from 53.9% to 69.0% (Table 2, entry 4 and 6). Further increase in the reaction time resulted in a slight decrease in the yield (Table 2, entry 7) with the decrease of conversion of cyclohexene due to decomposition of oxidants. It was worth noting that the highest field of 69.0 % could be obtained when the reaction time was 16 h, and the selectivity could be 89:11 (2-cyclohexen-1-one: cyclohexene oxide) (Table 2, entry 6). It was found that in the first 4 h, the selectivity of 2-cyclohexen-1-one could up close to 100%. In addition, when the reaction temperature was increased from 20 °C to 30 °C, the yield could reach 60.7% with a selectivity of 86:14. However, a downward trend was observed with further increase in temperature [50]. It was clearly that the yield of 2-cyclohexen-1-one reached 71.1 % and the carbon balance was 100% when the amount of catalyst was 15 % (Table 2, entry 8). And when the amount of catalyst was further increased, the yield and selectivity of the catalyst remained constant. When the molar ration of TBHP and cyclohexene was set to be 2:1, the yield of 2-cyclohexen-1-one could reach up to 71.1% with a selectivity of 88:12. Different from the trend in the epoxidation, no decrease in the selectivity was detected when more TBHP was added into the reaction mixture. Relatively higher stability of 2-cyclohexen-1-one under these conditions might be the cause for this phenomenon compared with cyclohexene oxide. With the optimized reaction conditions in hand, the content of Ti and metalloporphyrin on the allylic oxidation of cyclohexene catalyzed by BEA-Ti and MnMTPP catalysts was investigated. Mn-porphyrin could activate TBHP to oxidize alkene [51], and more MnMTPP promoted the improvement in the selectivity for 2-cyclohexen-1-one. When the ratio of BEA-Ti to MnMTPP was set to 2:1, the yield and selectivity for 2-cyclohexen-1-one were 69.0% and 88.0%, respectively (Fig. 6B). When the content of Ti was less than 25 mg/Kg, the yield and selectivity of 2-cyclohexen-1-one gradually increased with the increase in the content of Ti (Fig. 6C). A constant selectivity was observed with higher content of Ti. 3.5 Reaction mechanism Ti-beta zeolites showed a high activity for the epoxidation of cyclohexene, and the selectivity of the epoxide depended on the synthesis conditions of Ti-beta zeolites [8,9]. Specifically in our trials, BEA-Ti yielded a mixture of epoxides and 2-cyclohexen-1-one with a ratio of 50:50. The addition of MnMTPP into the reaction mixture accelerated the allylic oxidation [51], promoting the improvement in the yield of 2-cyclohexen-1-one (Fig. 4). Correspondingly, the epoxidation of cyclohexene was weakened [52]. On the contrary, the introduction of H2MTPP catalysts accelerated the formation of epoxides, weakening the allylic oxidation of cyclohexene. In other words, metal-coordinated or uncoordinated porphyrins would work with BEA-Ti in the oxidation of cyclohexene, resulting in different oxidation products. In the epoxidation reaction catalyzed by TS-1, the addition of H2O2 promoted the formation of silanol functionality through the cleavage Ti-OSi bonds in the zeolite [53]. Similarly, the cleavage of Ti-OSi would also be occurred upon TBHP bonding to TiIV, instead of the cleavage of porphyrin(O)-Ti. The change in the color of reaction solution (Fig. S3C and S3D) confirmed that the dissociation of H2MTPP (MnMTPP) and BEA-Ti occurred upon the addition of TBHP. Resulting active species could be stabilized through interaction with the walls of the pockets in the zeolite, yielding a sub-nanometer cavity. The interaction between calixarene and TiIV revealed by experimental and calculation based on density functional theory also confirmed this hypothesis [27,20]. When BEA-Ti-H2MTPP met with TBHP, active species generated through the cleavage of Ti-OSi and coordination with TBHP could react with cyclohexene in the assistance of cooperating silanol [20], affording cyclohexene oxide. When BEA-Ti-MnMTPP was used in the oxidation reaction, resulting active species including MnMTPP, TiIV sites and TBHP could react with cyclohexene, yielding 2-cyclohexen-1-one (Fig. 7 ). In the oxidation of cyclohexene catalyzed by BEA-Ti-H2MTPP, free radical scavengers displayed no obvious influence on the yield. In addition, the allylic oxidation reaction of cyclohexene was not inhibited when radical scavengers for hydroxyl radical, peroxy radical and alkoxy radical were added into the reaction mixture, demonstrating that a free radical mechanism mediated by MnMTPP [54] was not involved in this allylic oxidation reaction. 4 Conclusions The selective oxidation of cyclohexene was realized through the adjustment in the partner of BEA-Ti zeolite. When porphyrin H2MTPP was used in the oxidation, cyclohexene oxide was the main product. Metalloporphyrin MnMTPP promoted the formation of 2-cyclohexen-1-one with high selectivity. The transfer of oxygen atoms in the active species generated through the coordination between H2MTPP, TiIV sites and TBHP was the possible reaction mechanism for epoxidation. Free radical capture experiment indicated that non-radical route was the dominant position rather than free radical route mediated by MnMTPP. Credit author statement Tingting Ma: Investigation, Experiments, Data analysis, Writing – original draft, Writing – review & editing. Chao Xu: Validation, Funding acquisition. Fengyang Liu: Investigation, Validation. Yirong Feng: Writing – review & editing. Wenyan Zhang, Weiwei Tang, Haoyu Zhang, Xiaowei Li, Yingying Nie: Investigation, Experiments. Shuangfei Zhao, Yuguang Li, Dong Ji, Zheng Fang: Project administration, Funding acquisition. Wei He, Kai Guo:Funding acquisition, Writing – review & editing. CRediT authorship contribution statement Tingting Ma: Investigation, Writing – original draft, Writing – review & editing. Chao Xu: Validation, Funding acquisition. Fengyang Liu: Investigation, Validation. Yirong Feng: Writing – review & editing. Wenyan Zhang: Investigation. Weiwei Tang: Investigation. Haoyu Zhang: Investigation. Xiaowei Li: Investigation. Yingying Nie: Investigation. Shuangfei Zhao: Project administration, Funding acquisition. Yuguang Li: Project administration, Funding acquisition. Dong Ji: Project administration, Funding acquisition. Zheng Fang: Project administration, Funding acquisition. Wei He: Funding acquisition, Writing – review & editing. Kai Guo: Funding acquisition, Writing – review & editing. Declaration of Competing Interest The authors declare that they have no known competing financial interests or personal relationships that could have appeared to influence the work reported in this paper. Acknowledgement The research has been supported by The National Natural Science Foundation of China (21908094, 22178168, 22078150 and 22278221); The National Key Research and Development Program of China (2021YFC2101900 and 2022YFC2105603); Key Research and Development Plan of Jiangsu Province (SBE2022740422 and BE2021083); Nanjing International Joint Research and Development Project (202002037); The Top-notch Academic Programs Project of Jiangsu Higher Education Institutions. Supplementary materials Supplementary material associated with this article can be found, in the online version, at doi:10.1016/j.mcat.2023.113074. Appendix Supplementary materials Image, application 1 References [1] W.N. Oloo L. Que Bioinspired nonheme iron catalysts for C-H and C=C bond oxidation: insights into the nature of the metal-based oxidants Acc. Chem. Res. 48 2015 2612 2621 W. N. Oloo, L. Que. Bioinspired nonheme iron catalysts for C-H and C=C bond oxidation: insights into the nature of the metal-based oxidants. Acc. Chem. Res. 48 (2015) 2612-2621. [2] K.P. Bryliakov E.P. Talsi Active sites and mechanisms of bioinspired oxidation with H2O2, catalyzed by Non-Heme Fe and related Mn complexes Coordin. Chem. Rev. 276 2014 73 96 K. P. Bryliakov, E. P. Talsi. Active sites and mechanisms of bioinspired oxidation with H2O2, catalyzed by Non-Heme Fe and related Mn complexes. Coordin. Chem. Rev. 276 (2014) 73-96. [3] X. Engelmann I. Monte-Pérez K. Ray Oxidation reactions with bioinspired mononuclear Non-Heme Metal-Oxo complexes Angew. Chem. Int. Ed. 55 2016 7632 7649 X. Engelmann, I. Monte-Pérez, K. Ray. Oxidation reactions with bioinspired mononuclear Non-Heme Metal-Oxo complexes. Angew. Chem. Int. Ed. 55 (2016) 7632-7649. [4] M. Milan M. Salamone M. Costas M. Bietti The quest for selectivity in hydrogen atom transfer based aliphatic C-H bond oxygenation Acc. Chem. Res. 51 2018 1984 1995 M. Milan, M. Salamone, M. Costas, M. Bietti. The quest for selectivity in hydrogen atom transfer based aliphatic C-H bond oxygenation. Acc. Chem. Res. 51 (2018) 1984-1995. [5] J.J.D. Sacramento D.P. Goldberg Factors affecting hydrogen atom transfer reactivity of metal-oxo porphyrinoid complexes Acc. Chem. Res. 51 2018 2641 2652 J. J. D. Sacramento, D. P. Goldberg. Factors affecting hydrogen atom transfer reactivity of metal-oxo porphyrinoid complexes. Acc. Chem. Res. 51 (2018) 2641-2652. [6] W. Nam Y.-M. Lee S. Fukuzumi Hydrogen atom transfer reactions of mononuclear nonheme metal−oxygen intermediates Acc. Chem. Res. 51 2018 2014 2022 W. Nam, Y. -M. Lee, S. Fukuzumi. Hydrogen atom transfer reactions of mononuclear nonheme metal−oxygen intermediates. Acc. Chem. Res. 51 (2018) 2014-2022. [7] V. Smeets E.M. Gaigneaux D.P. Debecker Titanosilicate epoxidation catalysts: a review of challenges and opportunities ChemCatChem 14 2022 e202101132 V. Smeets, E. M. Gaigneaux, D. P. Debecker. Titanosilicate epoxidation catalysts: a review of challenges and opportunities. ChemCatChem. 14(2022) e202101132. [8] N. Jappar Q.H. Xia T. Tatsumi Oxidation activity of Ti-beta zeolites synthesized by a dry-gel conversion method J. Catal. 180 1998 132 141 N. Jappar, Q. H. Xia, T. Tatsumi. Oxidation activity of Ti-beta zeolites synthesized by a dry-gel conversion method. J. Catal. 180 (1998) 132-141. [9] X.C. Liu Y.R. Zhao Z.Y. Yuan Controllable synthesis of T-beta zeolite and efficiently catalytic epoxidation of cyclohexene Chem. J. Chinese U. 40 6 2019 1222 1228 X. C. Liu, Y. R. Zhao, Z. Y. Yuan, et al. Controllable synthesis of T-beta zeolite and efficiently catalytic epoxidation of cyclohexene. Chem. J. Chinese U. 40(6) (2019) 1222-1228. [10] A.S. -Daura T. Zhang H. Fouilloux C. Robert C.M. Thomas L.-M. Chamoreau J.J. Carbó A. Proust G. Guillemot J.M. Poblet Catalyst design for alkene epoxidation by molecular analogues of heterogeneous titanium-silicalite catalysts ACS Catal 10 2020 4737 4750 A. S. -Daura, T. Zhang, H. Fouilloux, C. Robert, C. M. Thomas, L. -M. Chamoreau, J. J. Carbó, A. Proust, G. Guillemot, J. M. Poblet. Catalyst design for alkene epoxidation by molecular analogues of heterogeneous titanium-silicalite catalysts. ACS Catal. 10 (2020) 4737-4750. [11] C.P. Gordon H. Engler A.S. Tragl M. Plodinec T. Lunkenbein A. Berkessel J.H. Teles A.-N. Parvulescu C. Copéret Efficient epoxidation over dinuclear sites in titanium silicalite-1 Nature 586 2020 708 713 C. P. Gordon, H. Engler, A. S. Tragl, M. Plodinec, T. Lunkenbein, A. Berkessel, J. H. Teles, A.-N. Parvulescu, C. Copéret. Efficient epoxidation over dinuclear sites in titanium silicalite-1. Nature. 586 (2020) 708-713. [12] N.A.G. -Giordano A.S. Hoffman A. Boubnov D.W. Small S.R. Bare S.I. Zones A. Katz Dynamic reorganization and confinement of Ti(IV) active sites controls olefin epoxidation catalysis on two-dimensional Zeotypes J. Am. Chem. Soc. 141 2019 7090 7106 N. A. G. -Giordano, A. S. Hoffman, A. Boubnov, D. W. Small, S. R. Bare, S. I. Zones, A. Katz. Dynamic reorganization and confinement of Ti(IV) active sites controls olefin epoxidation catalysis on two-dimensional Zeotypes. J. Am. Chem. Soc. 141 (2019) 7090-7106. [13] D.T. Bregante J.Z. Tan R.L. Schultz E.Z. Ayla D.S. Potts C. Torres D.W. Flaherty Catalytic consequences of oxidant, alkene, and pore structures on alkene epoxidations within titanium silicates ACS Catal 10 2020 10169 10184 D. T. Bregante, J. Z. Tan, R. L. Schultz, E. Z. Ayla, D. S. Potts, C. Torres, D. W. Flaherty. Catalytic consequences of oxidant, alkene, and pore structures on alkene epoxidations within titanium silicates. ACS Catal. 10 (2020) 10169-10184. [14] Q.H. Xia X. Chen T. Tatsumi Epoxidation of cyclic alkenes with aqueous hydrogen peroxide and tert-butyl hydroperoxide over Na-containing Ti J. Mol. Catal. A: Chem. 176 2001 179 193 Q. H. Xia, X. Chen, T. Tatsumi. Epoxidation of cyclic alkenes with aqueous hydrogen peroxide and tert-butyl hydroperoxide over Na-containing Ti. J. Mol. Catal. A: Chem. 176 (2001) 179-193. [15] Y.R. Zhao D. Zhou T.J. Zhang High-rota-synthesis of single-/double/multi-unit-cell Ti-HSZ nanosheets to catalyze epoxidation of large cycloalkenes efficiently ACS Appl. Mater. Interfaces. 10 7 2018 6390 6397 Y. R. Zhao, D. Zhou, T. J. Zhang. High-rota-synthesis of single-/double/multi-unit-cell Ti-HSZ nanosheets to catalyze epoxidation of large cycloalkenes efficiently. ACS Appl. Mater. Interfaces. 10(7) (2018) 6390-6397. [16] D.T. Bregante A.M. Johnson A.Y. Patel E.Z. Ayla M.J. Cordon B.C. Bukowski R.Gounder J.Greeley D.W. Flaherty Cooperative effects between hydrophilic pores and solvents: catalytic consequences of hydrogen bonding on alkene epoxidation in zeolites J. Am. Chem. Soc. 141 2019 7302 7319 D. T. Bregante, A. M. Johnson, A. Y. Patel, E. Z. Ayla, M. J. Cordon, B. C. Bukowski, J.Greeley, R. Gounder, D. W. Flaherty. Cooperative effects between hydrophilic pores and solvents: catalytic consequences of hydrogen bonding on alkene epoxidation in zeolites. J. Am. Chem. Soc. 141 (2019) 7302-7319. [17] T.F. Degnan The implications of the fundamentals of shape selectivity for the development of catalysts for the petroleum and petrochemical industries J. Catal. 216 2003 32 46 T. F. Degnan. The implications of the fundamentals of shape selectivity for the development of catalysts for the petroleum and petrochemical industries. J. Catal. 216 (2003) 32-46. [18] A. Corma State of the art and future challenges of zeolites as catalysts J. Catal. 216 2003 298 312 A. Corma. State of the art and future challenges of zeolites as catalysts. J. Catal. 216 (2003) 298-312. [19] Y.S. Liu A. Vjunov H. Shi S. Eckstein D.M. Camaioni D.H. Mei E. Baráth J.A. Lercher Enhancing the catalytic activity of hydronium ions through constrained environments Nat. Commun. 8 2017 14113 Y. S. Liu, A. Vjunov, H. Shi, S. Eckstein, D. M. Camaioni, D. H. Mei, E. Baráth, J. A. Lercher. Enhancing the catalytic activity of hydronium ions through constrained environments. Nat. Commun. 8 (2017) 14113. [20] B.A.D. Moor M.F. Reyniers O.C. Gobin J. A.Lercher G. B.Marin Adsorption of C2-C8 n-Alkanes in Zeolites J. Phys. Chem. C. 115 2011 1204 1219 B. A. D. Moor, M. F. Reyniers, O. C. Gobin, J. A.Lercher, G. B.Marin. Adsorption of C2-C8 n-Alkanes in Zeolites. J. Phys. Chem. C. 115 (2011) 1204-1219. [21] D.T. Bregante N.E. Thornburg J.M. Notestein D.W. Flaherty Consequences of confinement for alkene epoxidation with hydrogen peroxide on highly dispersed group 4 and 5 metal oxide catalysts ACS Catal 8 2018 2995 3010 D. T. Bregante, N. E. Thornburg, J. M. Notestein, D. W. Flaherty. Consequences of confinement for alkene epoxidation with hydrogen peroxide on highly dispersed group 4 and 5 metal oxide catalysts. ACS Catal. 8 (2018) 2995-3010. [22] R. Gounder E. Iglesia The roles of entropy and enthalpy in stabilizing ion-pairs at transition states in zeolite acid catalysis Acc. Chem. Res. 45 2012 229 238 R. Gounder, E. Iglesia. The roles of entropy and enthalpy in stabilizing ion-pairs at transition states in zeolite acid catalysis. Acc. Chem. Res. 45 (2012) 229-238. [23] M. J.Cordon J.W. Harris J.C.V. -Vila J.S. Bates S. Kaur M. Gupta M.E. Witzke E.C. Wegener J.T. Miller D.W. Flaherty D.D. Hibbitts R. Gounder Dominant role of entropy in stabilizing sugar isomerization transition states within hydrophobic zeolite pores J. Am. Chem. Soc. 140 2018 14244 14266 M. J.Cordon, J. W. Harris, J. C. V. -Vila, J. S. Bates, S. Kaur, M. Gupta, M. E. Witzke, E. C. Wegener, J. T. Miller, D. W. Flaherty, D. D. Hibbitts, R. Gounder. Dominant role of entropy in stabilizing sugar isomerization transition states within hydrophobic zeolite pores. J. Am. Chem. Soc. 140 (2018) 14244-14266. [24] A.J. Jones S.I. Zones E. Iglesia Implications of transition state confinement within small voids for acid catalysis J. Phys. Chem. C. 118 2014 17787 17800 A. J. Jones, S. I. Zones, E. Iglesia. Implications of transition state confinement within small voids for acid catalysis. J. Phys. Chem. C. 118 (2014) 17787-17800. [25] R. Wolfenden M.J. Snider The depth of chemical time and the power of enzymes as catalysts Acc. Chem. Res. 34 2001 938 945 R. Wolfenden, M. J. Snider. The depth of chemical time and the power of enzymes as catalysts. Acc. Chem. Res. 34 (2001) 938-945. [26] F.E. Romesberg B. Spiller P.G. Schultz R.C. Stevens Immunological origins of binding and catalysis in a diels-alderase antibody Science 279 1998 1929 1933 F. E. Romesberg, B. Spiller, P. G. Schultz, R. C. Stevens. Immunological origins of binding and catalysis in a diels-alderase antibody. Science. 279 (1998) 1929-1933. [27] J.M. Notestein L.R. Andrini F.G. Requejo A. Katz E. Iglesia The role of outer-sphere surface acidity in alkene epoxidation catalyzed by Calixarene-Ti (IV) complexes J. Am. Chem. Soc. 129 2007 15585 15595 J. M. Notestein, L. R. Andrini, F. G. Requejo, A. Katz, E. Iglesia. The role of outer-sphere surface acidity in alkene epoxidation catalyzed by Calixarene-Ti (IV) complexes. J. Am. Chem. Soc. 129 (2007) 15585-15595. [28] J.D. Bass S.L. Anderson A. Katz The effect of outer-sphere acidity on chemical reactivity in a synthetic heterogeneous base catalyst Angew. Chem., Int. Ed. 42 2003 5219 5222 J. D. Bass, S. L. Anderson, A. Katz. The effect of outer-sphere acidity on chemical reactivity in a synthetic heterogeneous base catalyst. Angew. Chem., Int. Ed. 42 (2003) 5219-5222. [29] A.O. Bouh G.L. Rice S.L. Scott Mono- and dinuclear silica-supported titanium (IV) complexes and the effect of TiOTi connectivity on reactivity J. Am. Chem. Soc. 121 1999 7201 7210 A. O. Bouh, G. L. Rice, S. L. Scott. Mono- and dinuclear silica-supported titanium (IV) complexes and the effect of TiOTi connectivity on reactivity. J. Am. Chem. Soc. 121 (1999) 7201-7210. [30] J. Lu C. Aydin A.J. Liang C.-Y. Chen N.D. Browning B.C. Gates Site-isolated molecular iridium complex catalyst supported in the 1-Dimensional channels of Zeolite HSSZ-53: characterization by spectroscopy and aberration-corrected scanning transmission electron microscopy ACS Catal 2 2012 1002 1012 J. Lu, C. Aydin, A. J. Liang, C. -Y. Chen, N. D. Browning, B. C. Gates. Site-isolated molecular iridium complex catalyst supported in the 1-Dimensional channels of Zeolite HSSZ-53: characterization by spectroscopy and aberration-corrected scanning transmission electron microscopy. ACS Catal. 2 (2012) 1002-1012. [31] P. Nandi W.J. Tang A. Okrut X.Q. Kong S.-J. Hwang M. Neurock A. Katz Catalytic consequences of open and closed grafted Al (III)-Calix [4]arene complexes for hydride and Oxo transfer reactions Proc. Natl. Acad. Sci. USA. 110 2013 2484 2489 P. Nandi, W. J. Tang, A. Okrut, X. Q. Kong, S.-J. Hwang, M. Neurock, A. Katz. Catalytic consequences of open and closed grafted Al (III)-Calix [4]arene complexes for hydride and Oxo transfer reactions. Proc. Natl. Acad. Sci. USA. 110 (2013) 2484-2489. [32] S. Bordiga F. Bonino A. Damin C. Lamberti Reactivity of Ti (IV) species hosted in TS-1 towards H2O2-H2O solutions investigated by Ab initio cluster and periodic approaches combined with experimental XANES and EXAFS data: a review and new highlights Phys. Chem. Chem. Phys. 9 2007 4854 4878 S. Bordiga, F. Bonino, A. Damin, C. Lamberti. Reactivity of Ti (IV) species hosted in TS-1 towards H2O2-H2O solutions investigated by Ab initio cluster and periodic approaches combined with experimental XANES and EXAFS data: a review and new highlights. Phys. Chem. Chem. Phys. 9 (2007) 4854-4878. [33] R. Radhakrishnan S.T. Oyama J.G. Chen K. Asakura Electron Transfer Effects in Ozone Decomposition on Supported Manganese Oxide J. Phys. Chem. B. 105 2001 4245 4253 R. Radhakrishnan, S. T. Oyama, J. G. Chen, K. Asakura. Electron Transfer Effects in Ozone Decomposition on Supported Manganese Oxide. J. Phys. Chem. B. 105 (2001) 4245-4253. [34] D.T. Bregante P. Priyadarshini D.W. Flaherty Kinetic and spectroscopic evidence for reaction pathways and intermediates for olefin epoxidation on Nb in *BEA J. Catal. 348 2017 75 89 D. T. Bregante, P. Priyadarshini, D. W. Flaherty. Kinetic and spectroscopic evidence for reaction pathways and intermediates for olefin epoxidation on Nb in *BEA. J. Catal. 348 (2017) 75-89. [35] D.T. Bregante D.W. Flaherty Periodic trends in olefin epoxidation over group IV and V framework-substituted zeolite catalysts: a kinetic and spectroscopic study J. Am. Chem. Soc. 139 2017 6888 6898 D. T. Bregante, D. W. Flaherty. Periodic trends in olefin epoxidation over group IV and V framework-substituted zeolite catalysts: a kinetic and spectroscopic study. J. Am. Chem. Soc. 139 (2017) 6888-6898. [36] D. Freude H. Ernst I. Wolf Solid-state nuclear magnetic resonance studies of acid sites in zeolites Solid State Nucl. Magn. Reson. 3 1994 271 286 D. Freude, H. Ernst, I. Wolf. Solid-state nuclear magnetic resonance studies of acid sites in zeolites. Solid State Nucl. Magn. Reson. 3 (1994) 271-286. [37] M. Hunger S. Ernst S. Steuernagel J. Weitkamp High-field 1H MAS NMR investigations of acidic and non-acidic hydroxyl groups in zeolites H-Beta, H-ZSM-5, H-ZSM-58 and H-MCM-22 Microporous Mater 6 1996 349 353 M. Hunger, S. Ernst, S. Steuernagel, J. Weitkamp. High-field 1H MAS NMR investigations of acidic and non-acidic hydroxyl groups in zeolites H-Beta, H-ZSM-5, H-ZSM-58 and H-MCM-22. Microporous Mater. 6 (1996) 349-353. [38] K. Chalupka R. Sadek L. Valentin Y. Millot C. Calers. M. Nowosielska J. Rynkowski S. Dzwigaj Dealuminated Beta Zeolite modified by alkaline earth metals J. Chem 2018 2018 7071524 K. Chalupka, R. Sadek, L. Valentin, Y. Millot, C. Calers. M. Nowosielska, J. Rynkowski, S. Dzwigaj. Dealuminated Beta Zeolite modified by alkaline earth metals. J. Chem, 2018 (2018) 7071524. [39] J.P. Nogier Y. Millot P.P. Man T. Shishido M. Che S. Dzwigaj Probing the incorporation of Ti(IV) into the BEA Zeolite framework by XRD, FTIR, NMR, and DR UV-jp810722bis J. Phys. Chem. C. 113 2009 4885 4889 J. P. Nogier, Y. Millot, P. P. Man, T. Shishido, M. Che, S. Dzwigaj. Probing the incorporation of Ti(IV) into the BEA Zeolite framework by XRD, FTIR, NMR, and DR UV-jp810722bis. J. Phys. Chem. C. 113 (2009) 4885-4889. [40] I.H.A.E. Maksod A.A. -Shehri S. Bawakeda M. Mokhtar K. Narasimharaoa Structural and photocatalytic properties of precious metals modified TiO2-BEA zeolite composites Mol. Catal. 441 2017 140 149 I. H. A. E. Maksod, A. A. -Shehri, S. Bawakeda, M. Mokhtar, K. Narasimharaoa. Structural and photocatalytic properties of precious metals modified TiO2-BEA zeolite composites. Mol. Catal. 441 (2017) 140–149. [41] W. Ma H. Yuan H. Wang Q. Zhou K. Kong D. Li Y. Yao Z. Hou Identifying catalytically active mononuclear peroxoniobate anion of ionic liquids in the epoxidation of olefins ACS Catal. 8 2018 4645 4659 W. Ma, H. Yuan, H. Wang, Q. Zhou, K. Kong, D. Li, Y. Yao, Z. Hou. Identifying catalytically active mononuclear peroxoniobate anion of ionic liquids in the epoxidation of olefins. ACS Catal. 8 (2018) 4645–4659. [42] M. Moosavifar A. Alemi M.R. Marefat N. Nouruzi H. Mahmoodi The effect of synthesis method and post-synthesis treatment on the formation of neutral Mn(II) complex into anionic zeolite structure and investigation of its catalytic activity in the epoxidation of alkenes J. Iran. Chem. Soc. 11 2014 1561 1567 M. Moosavifar, A. Alemi, M. R. Marefat, N. Nouruzi, H. Mahmoodi. The effect of synthesis method and post-synthesis treatment on the formation of neutral Mn(II) complex into anionic zeolite structure and investigation of its catalytic activity in the epoxidation of alkenes. J. Iran. Chem. Soc. 11 (2014) 1561–1567. [43] M.E. Roz P. Bazin F.T. Starzyk An operando-IR study of photocatalytic reaction of methanol on new *BEA supported TiO2 catalyst Catal. Today. 205 2013 111 119 M. E. Roz, P. Bazin, F. T. Starzyk. An operando-IR study of photocatalytic reaction of methanol on new *BEA supported TiO2 catalyst. Catal. Today. 205 (2013) 111–119. [44] X.H. Liang X.X. Peng C.J. Xia H. Yuan K. Zou K.M. Huang M. Lin B. Zhu Y.B. Luo X.T. Shu Improving Ti incorporation into the BEA framework by employing ethoxylated chlorotitanate as Ti precursor: postsynthesis, characterization, and incorporation mechanism Ind. Eng. Chem. Res. 60 2021 1219 1230 X. H. Liang, X. X. Peng, C. J. Xia, H. Yuan, K. Zou, K. M. Huang, M. Lin, B. Zhu, Y.B. Luo, X. T. Shu. Improving Ti incorporation into the BEA framework by employing ethoxylated chlorotitanate as Ti precursor: postsynthesis, characterization, and incorporation mechanism. Ind. Eng. Chem. Res. 60 (2021) 1219-1230. [45] W.S. Victor S. Vijayakumar E. Vidhya V.N. Punitha M. Nilavukkarasi P.K. Praseetha Biogenesis of TiO2 nanoparticles: an approach to prove multidisciplinary application Green Synthesis Catal. 3 2022 150 155 W. S. Victor, S. Vijayakumar, E. Vidhya, V. N. Punitha, M. Nilavukkarasi, P. K. Praseetha. Biogenesis of TiO2 nanoparticles: an approach to prove multidisciplinary application. Green Synthesis Catal.. 3 (2022) 150–155. [46] S. Belviso F. Cavalcante A. Lettino P. Ragone C. Belvis Fly ash as raw material for the synthesis of zeolite-encapsulated porphyrazine and metallo porphyrazine tetrapyrrolic macrocycles Micropor. Mesopor. Mater. 236 2016 228 234 S. Belviso, F. Cavalcante, A. Lettino, P. Ragone, C. Belvis. Fly ash as raw material for the synthesis of zeolite-encapsulated porphyrazine and metallo porphyrazine tetrapyrrolic macrocycles. Micropor. Mesopor. Mater. 236 (2016) 228-234. [47] S.S. -Fiser M. Jankovic Z.S. Petrovic Kinetics of in Situ epoxidation of soybean oil in bulk catalyzed by ion exchange resin J. Am. Oil. Chem. Soc. 78 2001 725 731 S. S. -Fiser, M. Jankovic, Z. S. Petrovic. Kinetics of in Situ epoxidation of soybean oil in bulk catalyzed by ion exchange resin. J. Am. Oil. Chem. Soc. 78 (2001) 725-731. [48] Z.S. Petrovic A. Zlatanic C.C. Lava S.S. -Fiser Epoxidation of soybean oil in toluene with peroxoacetic and peroxoformic acids-kinetics and side reactions Eur. J. Lipid Sci. Technol. 104 2002 293 299 Z. S. Petrovic, A. Zlatanic, C. C. Lava, S. S. -Fiser. Epoxidation of soybean oil in toluene with peroxoacetic and peroxoformic acids-kinetics and side reactions. Eur. J. Lipid Sci. Technol. 104 (2002) 293-299. [49] V.V. Goud A.V. Patwardhan S. Dinda N.C. Pradhan Kinetics of epoxidation of Jatropha oil with peroxyacetic and Peroxyformic acid catalyzed by acidic ion exchange resin Chem. Eng. Sci. 62 2007 4065 4076 V. V. Goud, A. V. Patwardhan, S. Dinda, N. C. Pradhan. Kinetics of epoxidation of Jatropha oil with peroxyacetic and Peroxyformic acid catalyzed by acidic ion exchange resin. Chem. Eng. Sci. 62 (2007) 4065-4076. [50] L.K. Stultz M.H.V. Huynh R.A. Binstead M. Curry T.J. Meyer Allylic oxidation of cyclohexene and indene bycis-[RuIV(bpy)2(py)(O)]2+ J. Am. Chem. Soc. 122 2000 5984 5996 L. K. Stultz, M. H. V. Huynh, R. A. Binstead, M. Curry, T. J. Meyer. Allylic oxidation of cyclohexene and indene bycis-[RuIV(bpy)2(py)(O)]2+. J. Am. Chem. Soc. 122 (2000) 5984-5996. [51] Q.H. Xia H.Q. Ge C.P. Ye Advances in homogeneous and heterogeneous catalytic asymmetric epoxidation Chem. Rev. 105 2005 1603 1662 Q. H. Xia, H. Q. Ge, C. P. Ye, et al. Advances in homogeneous and heterogeneous catalytic asymmetric epoxidation. Chem. Rev. 105 (2005) 1603-1662. [52] J.H. Tong W.H. Wang L.D. Su Q. Li F.F. Liu W.M. Ma Z.Q. Lei L.L. Bo Highly selective oxidation of cyclohexene to 2-Cyclohexene-1-one over Polyoxometalate/Metal-organic framework hybrids with greatly improved performances Catal. Sci. Technol. 7 2017 222 230 J. H. Tong, W. H. Wang, L. D. Su, Q. Li, F. F. Liu, W. M. Ma, Z. Q. Lei, L. L. Bo. Highly selective oxidation of cyclohexene to 2-Cyclohexene-1-one over Polyoxometalate/Metal-organic framework hybrids with greatly improved performances. Catal. Sci. Technol. 7 (2017) 222-230. [53] W.Y. Lin H. Frei Photochemical and FT-IR probing of the active site of hydrogen peroxide in Ti silicalite sieve J. Am. Chem. Soc. 124 2002 9292 9298 W.Y. Lin, H. Frei. Photochemical and FT-IR probing of the active site of hydrogen peroxide in Ti silicalite sieve. J. Am. Chem. Soc. 124 (2002) 9292-9298. [54] D.R. Zbik M. Witko E.M. Serwicka Allylic oxidation of cyclohexene catalyzed by manganese porphyrins: DFT studies Catal. Today. 169 2011 10 15 D. R. Zbik, M. Witko, E. M. Serwicka. Allylic oxidation of cyclohexene catalyzed by manganese porphyrins: DFT studies. Catal. Today. 169 (2011) 10-15.",
      "scopus-id": "85150382306",
      "coredata": {
        "eid": "1-s2.0-S2468823123001608",
        "dc:description": "Selective epoxidation and allylic oxidation of cyclohexene were realized in the presence of BEA-Ti and (metallo)porphyrin catalysts. The integration of BEA-Ti and porphyrin H2MTPP afforded cyclohexene oxide with excellent selectivity (cyclohexene oxide/ 2-cyclohexen-1-one=85:15). BEA-Ti and metalloporphyrin MnMTPP yielded 2-cyclohexen-1-one with high selectivity (cyclohexene oxide/ 2-cyclohexen-1-one=12:88). Resulting active species involving of (metallo)porphyrin, TiIV sites and tert-butyl hydroperoxide (TBHP) promoted the oxidation process of cyclohexene. A possible mechanism resulting in the formation cyclohexene oxide and 2-cyclohexen-1-one was proposed. The outer-sphere effect constructed by (metallo)porphyrin, TiIV sites and TBHP on the surface of BEA-Ti framework improved the epoxidation and allylic oxidation both in the conversion and selectivity.",
        "openArchiveArticle": "false",
        "prism:coverDate": "2023-04-15",
        "openaccessUserLicense": null,
        "prism:aggregationType": "Journal",
        "prism:url": "https://api.elsevier.com/content/article/pii/S2468823123001608",
        "dc:creator": [
          {
            "@_fa": "true",
            "$": "Ma, Tingting"
          },
          {
            "@_fa": "true",
            "$": "Xu, Chao"
          },
          {
            "@_fa": "true",
            "$": "Liu, Fengyang"
          },
          {
            "@_fa": "true",
            "$": "Feng, Yirong"
          },
          {
            "@_fa": "true",
            "$": "Zhang, Wenyan"
          },
          {
            "@_fa": "true",
            "$": "Tang, Weiwei"
          },
          {
            "@_fa": "true",
            "$": "Zhang, Haoyu"
          },
          {
            "@_fa": "true",
            "$": "Li, Xiaowei"
          },
          {
            "@_fa": "true",
            "$": "Nie, Yingying"
          },
          {
            "@_fa": "true",
            "$": "Zhao, Shuangfei"
          },
          {
            "@_fa": "true",
            "$": "Li, Yuguang"
          },
          {
            "@_fa": "true",
            "$": "Ji, Dong"
          },
          {
            "@_fa": "true",
            "$": "Fang, Zheng"
          },
          {
            "@_fa": "true",
            "$": "He, Wei"
          },
          {
            "@_fa": "true",
            "$": "Guo, Kai"
          }
        ],
        "link": [
          {
            "@_fa": "true",
            "@rel": "self",
            "@href": "https://api.elsevier.com/content/article/pii/S2468823123001608"
          },
          {
            "@_fa": "true",
            "@rel": "scidir",
            "@href": "https://www.sciencedirect.com/science/article/pii/S2468823123001608"
          }
        ],
        "dc:format": "application/json",
        "openaccessType": null,
        "pii": "S2468-8231(23)00160-8",
        "prism:volume": "541",
        "articleNumber": "113074",
        "prism:publisher": "Elsevier B.V.",
        "dc:title": "Selective epoxidation and allylic oxidation of olefins catalyzed by BEA-Ti and porphyrin catalysts",
        "prism:copyright": "© 2023 Elsevier B.V. All rights reserved.",
        "openaccess": "0",
        "prism:issn": "24688231",
        "dcterms:subject": [
          {
            "@_fa": "true",
            "$": "Epoxidation"
          },
          {
            "@_fa": "true",
            "$": "Allylic oxidation"
          },
          {
            "@_fa": "true",
            "$": "BEA-Ti"
          },
          {
            "@_fa": "true",
            "$": "Porphyrin"
          },
          {
            "@_fa": "true",
            "$": "Outer-sphere effect"
          }
        ],
        "openaccessArticle": "false",
        "prism:publicationName": "Molecular Catalysis",
        "openaccessSponsorType": null,
        "prism:pageRange": "113074",
        "pubType": "fla",
        "prism:coverDisplayDate": "15 April 2023",
        "prism:doi": "10.1016/j.mcat.2023.113074",
        "prism:startingPage": "113074",
        "dc:identifier": "doi:10.1016/j.mcat.2023.113074",
        "openaccessSponsorName": null
      },
      "objects": {
        "object": [
          {
            "@category": "standard",
            "@height": "231",
            "@width": "753",
            "@_fa": "true",
            "$": "https://api.elsevier.com/content/object/eid/1-s2.0-S2468823123001608-gr5.jpg?httpAccept=%2A%2F%2A",
            "@multimediatype": "JPEG image file",
            "@type": "IMAGE-DOWNSAMPLED",
            "@size": "35871",
            "@ref": "gr5",
            "@mimetype": "image/jpeg"
          },
          {
            "@category": "standard",
            "@height": "182",
            "@width": "678",
            "@_fa": "true",
            "$": "https://api.elsevier.com/content/object/eid/1-s2.0-S2468823123001608-gr4.jpg?httpAccept=%2A%2F%2A",
            "@multimediatype": "JPEG image file",
            "@type": "IMAGE-DOWNSAMPLED",
            "@size": "30398",
            "@ref": "gr4",
            "@mimetype": "image/jpeg"
          },
          {
            "@category": "standard",
            "@height": "471",
            "@width": "753",
            "@_fa": "true",
            "$": "https://api.elsevier.com/content/object/eid/1-s2.0-S2468823123001608-gr7.jpg?httpAccept=%2A%2F%2A",
            "@multimediatype": "JPEG image file",
            "@type": "IMAGE-DOWNSAMPLED",
            "@size": "51276",
            "@ref": "gr7",
            "@mimetype": "image/jpeg"
          },
          {
            "@category": "standard",
            "@height": "233",
            "@width": "753",
            "@_fa": "true",
            "$": "https://api.elsevier.com/content/object/eid/1-s2.0-S2468823123001608-gr6.jpg?httpAccept=%2A%2F%2A",
            "@multimediatype": "JPEG image file",
            "@type": "IMAGE-DOWNSAMPLED",
            "@size": "43710",
            "@ref": "gr6",
            "@mimetype": "image/jpeg"
          },
          {
            "@category": "standard",
            "@height": "275",
            "@width": "678",
            "@_fa": "true",
            "$": "https://api.elsevier.com/content/object/eid/1-s2.0-S2468823123001608-gr1.jpg?httpAccept=%2A%2F%2A",
            "@multimediatype": "JPEG image file",
            "@type": "IMAGE-DOWNSAMPLED",
            "@size": "43513",
            "@ref": "gr1",
            "@mimetype": "image/jpeg"
          },
          {
            "@category": "standard",
            "@height": "281",
            "@width": "678",
            "@_fa": "true",
            "$": "https://api.elsevier.com/content/object/eid/1-s2.0-S2468823123001608-gr3.jpg?httpAccept=%2A%2F%2A",
            "@multimediatype": "JPEG image file",
            "@type": "IMAGE-DOWNSAMPLED",
            "@size": "52649",
            "@ref": "gr3",
            "@mimetype": "image/jpeg"
          },
          {
            "@category": "standard",
            "@height": "279",
            "@width": "678",
            "@_fa": "true",
            "$": "https://api.elsevier.com/content/object/eid/1-s2.0-S2468823123001608-gr2.jpg?httpAccept=%2A%2F%2A",
            "@multimediatype": "JPEG image file",
            "@type": "IMAGE-DOWNSAMPLED",
            "@size": "44793",
            "@ref": "gr2",
            "@mimetype": "image/jpeg"
          },
          {
            "@category": "standard",
            "@height": "134",
            "@width": "500",
            "@_fa": "true",
            "$": "https://api.elsevier.com/content/object/eid/1-s2.0-S2468823123001608-ga1.jpg?httpAccept=%2A%2F%2A",
            "@multimediatype": "JPEG image file",
            "@type": "IMAGE-DOWNSAMPLED",
            "@size": "21018",
            "@ref": "ga1",
            "@mimetype": "image/jpeg"
          },
          {
            "@category": "thumbnail",
            "@height": "67",
            "@width": "219",
            "@_fa": "true",
            "$": "https://api.elsevier.com/content/object/eid/1-s2.0-S2468823123001608-gr5.sml?httpAccept=%2A%2F%2A",
            "@multimediatype": "GIF image file",
            "@type": "IMAGE-THUMBNAIL",
            "@size": "7127",
            "@ref": "gr5",
            "@mimetype": "image/gif"
          },
          {
            "@category": "thumbnail",
            "@height": "59",
            "@width": "219",
            "@_fa": "true",
            "$": "https://api.elsevier.com/content/object/eid/1-s2.0-S2468823123001608-gr4.sml?httpAccept=%2A%2F%2A",
            "@multimediatype": "GIF image file",
            "@type": "IMAGE-THUMBNAIL",
            "@size": "6555",
            "@ref": "gr4",
            "@mimetype": "image/gif"
          },
          {
            "@category": "thumbnail",
            "@height": "137",
            "@width": "219",
            "@_fa": "true",
            "$": "https://api.elsevier.com/content/object/eid/1-s2.0-S2468823123001608-gr7.sml?httpAccept=%2A%2F%2A",
            "@multimediatype": "GIF image file",
            "@type": "IMAGE-THUMBNAIL",
            "@size": "8286",
            "@ref": "gr7",
            "@mimetype": "image/gif"
          },
          {
            "@category": "thumbnail",
            "@height": "68",
            "@width": "219",
            "@_fa": "true",
            "$": "https://api.elsevier.com/content/object/eid/1-s2.0-S2468823123001608-gr6.sml?httpAccept=%2A%2F%2A",
            "@multimediatype": "GIF image file",
            "@type": "IMAGE-THUMBNAIL",
            "@size": "7737",
            "@ref": "gr6",
            "@mimetype": "image/gif"
          },
          {
            "@category": "thumbnail",
            "@height": "89",
            "@width": "219",
            "@_fa": "true",
            "$": "https://api.elsevier.com/content/object/eid/1-s2.0-S2468823123001608-gr1.sml?httpAccept=%2A%2F%2A",
            "@multimediatype": "GIF image file",
            "@type": "IMAGE-THUMBNAIL",
            "@size": "7623",
            "@ref": "gr1",
            "@mimetype": "image/gif"
          },
          {
            "@category": "thumbnail",
            "@height": "91",
            "@width": "219",
            "@_fa": "true",
            "$": "https://api.elsevier.com/content/object/eid/1-s2.0-S2468823123001608-gr3.sml?httpAccept=%2A%2F%2A",
            "@multimediatype": "GIF image file",
            "@type": "IMAGE-THUMBNAIL",
            "@size": "9063",
            "@ref": "gr3",
            "@mimetype": "image/gif"
          },
          {
            "@category": "thumbnail",
            "@height": "90",
            "@width": "219",
            "@_fa": "true",
            "$": "https://api.elsevier.com/content/object/eid/1-s2.0-S2468823123001608-gr2.sml?httpAccept=%2A%2F%2A",
            "@multimediatype": "GIF image file",
            "@type": "IMAGE-THUMBNAIL",
            "@size": "7602",
            "@ref": "gr2",
            "@mimetype": "image/gif"
          },
          {
            "@category": "thumbnail",
            "@height": "59",
            "@width": "219",
            "@_fa": "true",
            "$": "https://api.elsevier.com/content/object/eid/1-s2.0-S2468823123001608-ga1.sml?httpAccept=%2A%2F%2A",
            "@multimediatype": "GIF image file",
            "@type": "IMAGE-THUMBNAIL",
            "@size": "6530",
            "@ref": "ga1",
            "@mimetype": "image/gif"
          },
          {
            "@category": "high",
            "@height": "1023",
            "@width": "3333",
            "@_fa": "true",
            "$": "https://api.elsevier.com/content/object/eid/1-s2.0-S2468823123001608-gr5_lrg.jpg?httpAccept=%2A%2F%2A",
            "@multimediatype": "JPEG image file",
            "@type": "IMAGE-HIGH-RES",
            "@size": "218260",
            "@ref": "gr5",
            "@mimetype": "image/jpeg"
          },
          {
            "@category": "high",
            "@height": "806",
            "@width": "3000",
            "@_fa": "true",
            "$": "https://api.elsevier.com/content/object/eid/1-s2.0-S2468823123001608-gr4_lrg.jpg?httpAccept=%2A%2F%2A",
            "@multimediatype": "JPEG image file",
            "@type": "IMAGE-HIGH-RES",
            "@size": "178785",
            "@ref": "gr4",
            "@mimetype": "image/jpeg"
          },
          {
            "@category": "high",
            "@height": "2085",
            "@width": "3333",
            "@_fa": "true",
            "$": "https://api.elsevier.com/content/object/eid/1-s2.0-S2468823123001608-gr7_lrg.jpg?httpAccept=%2A%2F%2A",
            "@multimediatype": "JPEG image file",
            "@type": "IMAGE-HIGH-RES",
            "@size": "327446",
            "@ref": "gr7",
            "@mimetype": "image/jpeg"
          },
          {
            "@category": "high",
            "@height": "1032",
            "@width": "3333",
            "@_fa": "true",
            "$": "https://api.elsevier.com/content/object/eid/1-s2.0-S2468823123001608-gr6_lrg.jpg?httpAccept=%2A%2F%2A",
            "@multimediatype": "JPEG image file",
            "@type": "IMAGE-HIGH-RES",
            "@size": "261776",
            "@ref": "gr6",
            "@mimetype": "image/jpeg"
          },
          {
            "@category": "high",
            "@height": "1219",
            "@width": "3000",
            "@_fa": "true",
            "$": "https://api.elsevier.com/content/object/eid/1-s2.0-S2468823123001608-gr1_lrg.jpg?httpAccept=%2A%2F%2A",
            "@multimediatype": "JPEG image file",
            "@type": "IMAGE-HIGH-RES",
            "@size": "286731",
            "@ref": "gr1",
            "@mimetype": "image/jpeg"
          },
          {
            "@category": "high",
            "@height": "1242",
            "@width": "3000",
            "@_fa": "true",
            "$": "https://api.elsevier.com/content/object/eid/1-s2.0-S2468823123001608-gr3_lrg.jpg?httpAccept=%2A%2F%2A",
            "@multimediatype": "JPEG image file",
            "@type": "IMAGE-HIGH-RES",
            "@size": "310541",
            "@ref": "gr3",
            "@mimetype": "image/jpeg"
          },
          {
            "@category": "high",
            "@height": "1236",
            "@width": "3000",
            "@_fa": "true",
            "$": "https://api.elsevier.com/content/object/eid/1-s2.0-S2468823123001608-gr2_lrg.jpg?httpAccept=%2A%2F%2A",
            "@multimediatype": "JPEG image file",
            "@type": "IMAGE-HIGH-RES",
            "@size": "276262",
            "@ref": "gr2",
            "@mimetype": "image/jpeg"
          },
          {
            "@category": "high",
            "@height": "593",
            "@width": "2213",
            "@_fa": "true",
            "$": "https://api.elsevier.com/content/object/eid/1-s2.0-S2468823123001608-ga1_lrg.jpg?httpAccept=%2A%2F%2A",
            "@multimediatype": "JPEG image file",
            "@type": "IMAGE-HIGH-RES",
            "@size": "121839",
            "@ref": "ga1",
            "@mimetype": "image/jpeg"
          },
          {
            "@category": "standard",
            "@_fa": "true",
            "$": "https://api.elsevier.com/content/object/eid/1-s2.0-S2468823123001608-mmc1.docx?httpAccept=%2A%2F%2A",
            "@multimediatype": "Microsoft Word file",
            "@type": "APPLICATION",
            "@size": "719711",
            "@ref": "mmc1",
            "@mimetype": "application/word"
          },
          {
            "@category": "standard",
            "@_fa": "true",
            "$": "https://api.elsevier.com/content/object/eid/1-s2.0-S2468823123001608-am.pdf?httpAccept=%2A%2F%2A",
            "@multimediatype": "Acrobat PDF file",
            "@type": "AAM-PDF",
            "@size": "845440",
            "@ref": "am",
            "@mimetype": "application/pdf"
          }
        ]
      },
      "link": {
        "@rel": "abstract",
        "@href": "https://api.elsevier.com/content/abstract/scopus_id/85150382306"
      }
    }
  }
}