{
  "metadata": {
    "title": "Recent advance in metal-organic frameworks based catalysts for production of fine chemicals <ce:italic>via</ce:italic> thermal catalysis",
    "authors": "; ; ",
    "journal": "Molecular Catalysis",
    "date": "2025-02-15",
    "doi": "10.1016/j.mcat.2024.114811",
    "abstract": "",
    "uri": "https://api.elsevier.com/content/article/pii/S2468823124009933",
    "pii": "S2468823124009933"
  },
  "fulltext": {
    "full-text-retrieval-response": {
      "scopus-eid": "2-s2.0-85214109398",
      "originalText": "serial JL 315758 291210 291744 291790 291809 31 Molecular Catalysis MOLECULARCATALYSIS 2025-01-07 2025-01-07 2025-01-07 2025-01-07 2025-01-25T11:56:29 1-s2.0-S2468823124009933 S2468-8231(24)00993-3 S2468823124009933 10.1016/j.mcat.2024.114811 S300 S300.1 FULL-TEXT 1-s2.0-S2468823124X0019X 2025-02-23T20:53:32.813679Z 0 0 20250215 2025 2025-01-07T01:34:50.024025Z absattachment articleinfo articlenumber articletitlenorm authfirstinitialnorm authfirstsurnamenorm cid cids contenttype copyright crossmark dateloaded dateloadedtxt datesearch datesort dateupdated dco docsubtype doctype doi eid ewtransactionid hubeid indexeddate issn issnnorm itemstage itemtransactionid itemweight openaccess openarchive pg pgfirst pii piinorm pubdatestart pubdatetxt pubyr sectiontitle sortorder srctitle srctitlenorm srctype ssids alllist content subj subheadings suppl tomb volfirst volissue volumelist webpdf webpdfpagecount yearnav figure table body acknowledge affil articletitle auth authfirstini authfull authkeywords authlast grantnumber grantsponsor highlightsabst nomenclature primabst pubtype ref specialabst 2468-8231 24688231 true 573 573 C Volume 573 44 114811 114811 114811 20250215 15 February 2025 2025-02-15 2025 Regular Papers article rev © 2024 Elsevier B.V. All rights are reserved, including those for text and data mining, AI training, and similar technologies. RECENTADVANCEINMETALORGANICFRAMEWORKSBASEDCATALYSTSFORPRODUCTIONFINECHEMICALSVIATHERMALCATALYSIS FU R Abbreviations of proper nouns 1 Introduction 2 Types of MOFs based materials 2.1 Pristine MOFs materials 2.1.1 IRMOFs 2.1.2 ZIFs 2.1.3 MILs 2.1.4 PCNs 2.2 Composite MOFs materials 2.2.1 NPs@MOFs materials 2.2.2 PS@MOFs materials 2.2.3 POMs@MOFs materials 2.3 MOFs-derived materials 2.3.1 MOFs-derived carbon/carbon-nitrogen based materials 2.3.2 MOFs-derived metal, metal oxide, and/or metallic alloy incorporated carbon based catalysts 2.3.3 MOFs-derived metal@CN, metal oxide, metal alloy@CN 3 Role of metals and ligands in MOFs for production of fine chemicals 3.1 Metals in MOFs for fine chemical production 3.2 Ligands in MOFs for fine chemical production 4 MOFs catalysts used for organocatalytic reactions and cascade organic reactions 4.1 Researches on a wide range of organic reactions and their cascade reactions 4.1.1 Applications of MOFs based catalysts in hydrogenation reactions 4.1.1.1 Hydrogenation of nitroarenes 4.1.1.2 Hydrogenation of aldehydes 4.1.1.3 Hydrogenation of alkynes 4.1.1.4 Other hydrogenation reactions 4.1.2 Applications of MOFs based catalysts in oxidation reactions 4.1.2.1 Oxidation of styrenes 4.1.2.2 Oxidation of alcohols 4.1.2.3 Oxidation of cycloalkanes 4.1.2.4 Other oxidation reactions 4.1.3 Applications of MOFs based catalysts in condensation reactions 4.1.3.1 Knoevenagel condension reactions 4.1.3.2 Aldol condension reactions 4.1.3.3 Friedlander condension reactions 4.1.3.4 Other condension reactions 4.1.4 Applications of MOFs based catalysts in cross-coupling reactions 4.1.4.1 Suzuki-Miyaura cross-coupling reactions 4.1.4.2 Heck cross-coupling reactions 4.1.4.3 Sonogashira cross-coupling reactions 4.1.4.4 Other cross-coupling reactions 4.1.5 Other types of organic reactions 4.1.5.1 Cycloaddition of CO2 and epoxides reactions 4.1.5.2 N-alkylation reactions 4.1.5.3 Hydroformylation reactions 4.2 Progress of MOFs based materials used in cascade reactions 4.2.1 Hydrogenation-alkylation cascade reaction 4.2.2 Hydrogenation-formylation cascade reaction 4.2.3 Hydrogenation-crosscoupling cascade reaction 4.2.4 Oxidation-condensation cascade reaction 4.2.5 Oxidation-cross-coupling cascade reaction 4.2.6 Oxidation-cycloaddition cascade reaction 4.2.7 Cross-coupling condensation cascade reaction 4.2.8 Condensation-hydrogenation cascade reaction 4.2.9 Condensation-oxidation cascade reaction 4.2.10 Other cascade reactions 5 Conclusions and outlook 5.1 Future development directions of MOFs materials 5.1.1 Design and synthesis of new MOFs materials 5.1.2 Construction of multifunctional MOFs catalysts 5.1.3 Composite materials development 5.1.4 Combined computational simulation and experimental approaches 5.1.5 Green and sustainable development CRediT authorship contribution statement Acknowledgements References YAGHI 1995 703 706 O CHEN 2023 100115 D REN 2022 68 S YANG 2019 177 D BEGUM 2019 1598 S YANG 2020 5359 L XIE 2020 8536 L LI 2020 6364 H YAN 2023 113608 S ZEESHAN 2022 1675 M LIU 2020 2840 X LU 2014 5561 W HU 2017 4066 Z YOUNIS 2021 213620 S REN 2017 187 J JAMPAIAH 2019 4226 D SHEN 2016 5887 K WANG 2020 1414 H LEE 2014 5476 H LIU 2008 5390 B GUAN 2017 1703614 B LIU 2021 213827 K SALUNKHE 2017 5293 R CHEN 2015 5010 Y ZHAO 2016 76 M MUELLER 2006 626 U LI 1999 276 H PARK 2006 10186 K FEREY 2004 6296 G FEREY 2005 2040 G AI 2013 15105 L FENG 2012 1030 D ZHANG 2013 9544 M SHI 2018 262 R CHUI 1999 1148 S MA 2008 1012 S WU 2020 16861 F JIAO 2020 20589 L DANG 2017 17075 S YANG 2017 4774 Q BAO 2020 e5607 L LI 2018 6834 B SUN 2019 940 J ZHANG 2023 5869 W YANG 2020 18126 W SHEN 2018 206 K LIU 2023 6630 Z LIU 2023 6716 J ZHANG 2021 16581 Z LI 2023 2304532 X LIU 2021 13374 Y JUANALCANIZ 2012 10102 J DOLBECQ 2010 6009 A LI 2023 10227 Y ZHANG 2014 16978 W LEE 2017 2684 K LI 2023 6107 J WANG 2023 142466 F KHAN 2022 e202200316 I ZHENG 2023 12919 F HUANG 2023 113110 H JIANG 2021 102523 L WANG 2020 19 C KONNERTH 2020 213319 H ABAZARI 2024 2306353 R ABAZARI 2025 216256 R ABAZARI 2024 11149 R JIANG 2017 388 L BEHERA 2022 214392 P CHEN 2018 1 Y YANG 2018 1704537 L WU 2022 2450 Y DAS 2012 591 R OARARTETA 2017 1709 L CHEN 2018 1417 H WANG 2016 56 X LIU 2020 2179 J WANG 2020 114576 Y YANG 2022 130991 J REZAEE 2019 802 S MENG 2022 2101188 T CHEN 2023 215121 J XIE 2021 147786 Y AHMED 2022 3003 M WEI 2014 1570 W CHEN 2012 5593 S VANNGUYEN 2019 117888 C LI 2014 4371 M INAGAKI 2018 104 M FENG 2021 149837 B XU 2021 15168 Q YE 2022 3090 C CAO 2017 8090 Y BAI 2021 11876 Y ZHENG 2023 12919 F GUO 2021 5366 J ALHUMAIMESS 2020 461 M WEI 2023 144494 R JIAO 2019 43 L JIANG 2022 13651 L YANG 2024 112995 C WRIGHT 2024 A XU 2024 2401248 Z SANATI 2021 11048 S PAN 2025 216231 Y SAPTAL 2023 e202219306 V WU 2022 1009 1045 Z GUO 2023 e202306905 Q WANG 2023 229 Q SERNA 2015 7114 P FORMENTI 2019 2611 D DOWNING 1997 121 R SHEN 2018 16460 M A 2021 17 W LI 2023 465 W ZHONG 2023 4659 Y LI 2021 4627 X TANG 2019 5543 F GAO 2022 e202211216 M LU 2022 13715 S LI 2024 X ZHENG 2025 158727 Z YAO 2021 23729 W YANG 2022 122584 Q GOLUB 2019 6040 K WU 2022 411 J WANG 2022 10044 Z GE 2022 e202215225 X BAI 2023 e202313101 R LING 2021 9835935 J LI 2023 48135 N CAI 2020 6241 J LI 2020 7753 L BAKURU 2020 5024 V LIANG 2023 e202309030 Y ZHANG 2022 2238 Y GUO 2022 104561 R YUAN 2023 3224 P MA 2023 11772 Y DING 2024 134269 P BUSTAMANTE 2020 330 T NAGPURE 2016 44333 A YANG 2019 704 F ZHANG 2018 10843 L ZHANG 2024 151677 J ZHANG 2024 152881 H GUO 2021 2089 Q WU 2024 370 Y WANG 2024 4118 H FENG 2022 1474 T AYED 2023 e202216159 C MA 2022 151363 D DANG 2024 133 J HUANG 2019 4744 K HU 2021 111552 D XIAO 2019 1580 Y HAO 2023 e202312808 Q TANG 2023 80 D SHI 2022 112764 J SHI 2023 133506 J WANG 2021 404 J LI 2022 5839 R HAO 2021 7732 J WANG 2019 8306 X NIKL 2023 4565 J SHEN 2018 1064 H SHI 2022 e202103546 Z TANG 2023 2368 T SHEN 2021 117904 H LI 2020 4837 S SUN 2022 37681 J LI 2023 2308534 X WANG 2016 89503 Z HAO 2023 e202312808 Q THAO 2019 3370 N GARCIABOSCH 2016 12873 I MAO 2023 e202300735 S YAO 2018 462 N KACEM 2023 111561 M YANG 2022 120970 S ZHANG 2024 127 X LIU 2022 10373 S ZHANG 2023 7119 Z BIESEMANS 2024 401 B TAMPIERI 2022 121889 A ZHU 2022 21574 J CHEN 2021 4362 Z PAZOCARBALLO 2023 5422 C GHAEDRAHMAT 2023 58 H RUBIOPRESA 2018 2216 R LUNCHEV 2018 3715 A GHOSH 2022 112748 S DAS 2020 10982 A FU 2023 1272 L NEUMANN 2021 52113 C SRIRATTANASAKUNSUK 2023 46904 P NEUMANN 2021 8521 C SAYED 2024 413 M DOND 2023 2717 B VISWANADHAM 2016 1470 B LIU 2022 1989 N BING 2018 656 W PATEL 2022 109175 D KALITA 2011 82 P CHEN 2020 2287 J MIYAHARA 2014 6801 Y DIYALI 2022 214667 N CLAVE 2017 4093 G LIN 2024 109656 S ASGHAR 2017 16367 S CASEY 2022 16196 E MOHAMMADNIA 2022 109078 M LIU 2022 845274 Y CARTAGENOVA 2022 954 D MIGUELCASAN 2023 179 E WU 2022 8575 X XIA 2023 113217 C LIANG 2022 734 R BHOYARE 2023 8810 V ZHU 2021 2340 J KEYPOUR 2023 122646 H DANG 2022 111 M ZHENG 2023 10219 D WU 2022 6995 Y PARSHAMONI 2021 693 S CHEN 2019 3730 Q MOHJER 2021 121712 F YANG 2021 206 Y ZHANG 2022 7475 L NIKNAM 2021 121676 E KARIMI 2023 8101 S TAHMASBI 2022 7189 M HUANG 2024 121351 Y VEISI 2021 22278 H WANG 2020 3945 W ROUZIFAR 2021 19963 M ZHOU 2019 2005 L MANGIN 2018 67 F KUNFI 2018 84 A CERVANTESREYES 2022 1678 A LEE 2019 14984 S KOTOVSHCHIKOV 2022 7650 Y SANGON 2023 2603 S LI 2021 3304 X CHEN 2022 1411 F WANG 2024 e202404911 Y PAL 2020 213173 T FEI 2024 18914 Y HU 2023 37300 Y A 2021 111641 T QI 2021 514 T WANG 2022 125569 J QIAO 2022 17773 J CHEN 2023 2303235 Y DUAN 2023 112351 C WANG 2023 23430 Z STINIYA 2021 e6444 S LI 2021 e6294 X VALVERDEGONZALEZ 2021 118287 A YUAN 2023 24127 Y LI 2024 1958 J SAMANTA 2023 e202301435 P LI 2023 660 H YU 2024 11955 Z SUN 2022 112005 Y SAMANTA 2023 4193 P DOU 2023 105725 H WASILKE 2005 1001 J YAMADA 2011 372 Y SITHAMBARAM 2008 269 S ARRONIZ 2018 8290 C WU 2022 1009 Z DENG 2025 114735 D DENG 2024 D LI 2023 21470 21478 W REN 2024 e202402168 C SHE 2021 151033 W WANG 2022 153250 J CHENG 2020 121 H SHE 2021 151033 W LI 2022 112520 W QIN 2023 8372 Z CAI 2020 6241 J CHENG 2023 1024 L SUN 2021 23558 J ROUZIFAR 2024 M ZAN 2023 38716 Y FAN 2023 4158 Y HAN 2015 10007 Q WANG 2022 838 Y YU 2023 118898 Y CHENG 2023 5435 L CHENG 2020 7991 L HUANG 2020 602 A HE 2023 17164 H ZHAO 2020 6316 Z QI 2018 14467 M DANG 2020 14529 M FUX2025X114811 FUX2025X114811XR 2027-01-07T00:00:00.000Z 2027-01-07T00:00:00.000Z http://creativecommons.org/licenses/by-nc-nd/4.0/ © 2024 Elsevier B.V. All rights are reserved, including those for text and data mining, AI training, and similar technologies. 2025-02-23T00:41:00.393Z http://vtw.elsevier.com/data/voc/AddOnTypes/50.7/aggregated-refined Ministry of Education of China 2017M621315 MOE Ministry of Education of the People&apos;s Republic of China http://data.elsevier.com/vocabulary/SciValFunders/501100002338 http://sws.geonames.org/1814991/ Heilongjiang Provincial Government Postdoctoral Science Foundation LBH-Z17190 Heilongjiang Provincial Postdoctoral Science Foundation http://data.elsevier.com/vocabulary/SciValFunders/501100010009 http://sws.geonames.org/1814991/ This work was financially supported by the Doctoral Fund of Ministry of Education of China ( 2017M621315 ), Heilongjiang Provincial Government Postdoctoral Science Foundation ( LBH-Z17190 ). https://doi.org/10.15223/policy-017 https://doi.org/10.15223/policy-037 https://doi.org/10.15223/policy-012 https://doi.org/10.15223/policy-029 https://doi.org/10.15223/policy-004 item S2468-8231(24)00993-3 S2468823124009933 1-s2.0-S2468823124009933 10.1016/j.mcat.2024.114811 315758 2025-01-25T12:10:06.186093Z 2025-02-15 1-s2.0-S2468823124009933-main.pdf https://s3-eu-west-1.amazonaws.com/prod-ucs-content-store-eu-west/content/pii:S2468823124009933/MAIN/application/pdf/325dff05bfe86fd29d6d9780ff5efc78/main.pdf main.pdf pdf true 52535397 MAIN 39 1-s2.0-S2468823124009933-main_1.png https://s3-eu-west-1.amazonaws.com/prod-ucs-content-store-eu-west/content/pii:S2468823124009933/PREVIEW/image/png/816dd5606a8b21fb539c012b40f8ddd9/main_1.png main_1.png png 60380 849 656 IMAGE-WEB-PDF 1 1-s2.0-S2468823124009933-ga1.jpg https://s3-eu-west-1.amazonaws.com/prod-ucs-content-store-eu-west/content/pii:S2468823124009933/ga1/DOWNSAMPLED/image/jpeg/4d24f814fa760558b0ed159d0ec3d26b/ga1.jpg ga1 true ga1.jpg jpg 34309 244 244 IMAGE-DOWNSAMPLED 1-s2.0-S2468823124009933-gr21.jpg https://s3-eu-west-1.amazonaws.com/prod-ucs-content-store-eu-west/content/pii:S2468823124009933/gr21/DOWNSAMPLED/image/jpeg/56e9aedae48ce1d89f09ad684626988d/gr21.jpg gr21 gr21.jpg jpg 148318 418 753 IMAGE-DOWNSAMPLED 1-s2.0-S2468823124009933-gr20.jpg https://s3-eu-west-1.amazonaws.com/prod-ucs-content-store-eu-west/content/pii:S2468823124009933/gr20/DOWNSAMPLED/image/jpeg/2604f9553f959ab27789d6d16aff2a33/gr20.jpg gr20 gr20.jpg jpg 58803 239 508 IMAGE-DOWNSAMPLED 1-s2.0-S2468823124009933-gr25.jpg https://s3-eu-west-1.amazonaws.com/prod-ucs-content-store-eu-west/content/pii:S2468823124009933/gr25/DOWNSAMPLED/image/jpeg/080684bc919ee0c3cad673ca07a83513/gr25.jpg gr25 gr25.jpg jpg 158803 673 753 IMAGE-DOWNSAMPLED 1-s2.0-S2468823124009933-gr24.jpg https://s3-eu-west-1.amazonaws.com/prod-ucs-content-store-eu-west/content/pii:S2468823124009933/gr24/DOWNSAMPLED/image/jpeg/4963178f7da108ea8317b68a0dad41a1/gr24.jpg gr24 gr24.jpg jpg 197706 792 753 IMAGE-DOWNSAMPLED 1-s2.0-S2468823124009933-gr23.jpg https://s3-eu-west-1.amazonaws.com/prod-ucs-content-store-eu-west/content/pii:S2468823124009933/gr23/DOWNSAMPLED/image/jpeg/7739edc1eb696b16d8e06fb118e213fb/gr23.jpg gr23 gr23.jpg jpg 104120 492 565 IMAGE-DOWNSAMPLED 1-s2.0-S2468823124009933-gr22.jpg https://s3-eu-west-1.amazonaws.com/prod-ucs-content-store-eu-west/content/pii:S2468823124009933/gr22/DOWNSAMPLED/image/jpeg/53088e007a0dcba1c83e3e322fbafcca/gr22.jpg gr22 gr22.jpg jpg 227078 927 753 IMAGE-DOWNSAMPLED 1-s2.0-S2468823124009933-gr9.jpg https://s3-eu-west-1.amazonaws.com/prod-ucs-content-store-eu-west/content/pii:S2468823124009933/gr9/DOWNSAMPLED/image/jpeg/8daade899676bf77a0f571956366327e/gr9.jpg gr9 gr9.jpg jpg 137507 840 753 IMAGE-DOWNSAMPLED 1-s2.0-S2468823124009933-gr8.jpg https://s3-eu-west-1.amazonaws.com/prod-ucs-content-store-eu-west/content/pii:S2468823124009933/gr8/DOWNSAMPLED/image/jpeg/85c3b12b0c33d0519a9ee30409732968/gr8.jpg gr8 gr8.jpg jpg 217956 740 753 IMAGE-DOWNSAMPLED 1-s2.0-S2468823124009933-gr5.jpg https://s3-eu-west-1.amazonaws.com/prod-ucs-content-store-eu-west/content/pii:S2468823124009933/gr5/DOWNSAMPLED/image/jpeg/b47c59d0bd02d1c875e5a7ee486c75b9/gr5.jpg gr5 gr5.jpg jpg 133177 369 753 IMAGE-DOWNSAMPLED 1-s2.0-S2468823124009933-gr4.jpg https://s3-eu-west-1.amazonaws.com/prod-ucs-content-store-eu-west/content/pii:S2468823124009933/gr4/DOWNSAMPLED/image/jpeg/360084580f1bba48755a31aded216e35/gr4.jpg gr4 gr4.jpg jpg 65828 281 508 IMAGE-DOWNSAMPLED 1-s2.0-S2468823124009933-gr7.jpg https://s3-eu-west-1.amazonaws.com/prod-ucs-content-store-eu-west/content/pii:S2468823124009933/gr7/DOWNSAMPLED/image/jpeg/df2b40d702e84e5c46bb4bfb0c825517/gr7.jpg gr7 gr7.jpg jpg 159214 537 753 IMAGE-DOWNSAMPLED 1-s2.0-S2468823124009933-gr6.jpg https://s3-eu-west-1.amazonaws.com/prod-ucs-content-store-eu-west/content/pii:S2468823124009933/gr6/DOWNSAMPLED/image/jpeg/bc896c9ae3c6615ef2263c6846deed2a/gr6.jpg gr6 gr6.jpg jpg 91376 304 753 IMAGE-DOWNSAMPLED 1-s2.0-S2468823124009933-gr10.jpg https://s3-eu-west-1.amazonaws.com/prod-ucs-content-store-eu-west/content/pii:S2468823124009933/gr10/DOWNSAMPLED/image/jpeg/4f7d5c6dfa943cac732fcb3c798cbc0d/gr10.jpg gr10 gr10.jpg jpg 164976 577 753 IMAGE-DOWNSAMPLED 1-s2.0-S2468823124009933-gr14.jpg https://s3-eu-west-1.amazonaws.com/prod-ucs-content-store-eu-west/content/pii:S2468823124009933/gr14/DOWNSAMPLED/image/jpeg/646644940ce23fff4a529bc2261039cf/gr14.jpg gr14 gr14.jpg jpg 127442 559 753 IMAGE-DOWNSAMPLED 1-s2.0-S2468823124009933-gr13.jpg https://s3-eu-west-1.amazonaws.com/prod-ucs-content-store-eu-west/content/pii:S2468823124009933/gr13/DOWNSAMPLED/image/jpeg/dbe0e355de3b06fb296ccaaab85e771c/gr13.jpg gr13 gr13.jpg jpg 169389 487 753 IMAGE-DOWNSAMPLED 1-s2.0-S2468823124009933-gr12.jpg https://s3-eu-west-1.amazonaws.com/prod-ucs-content-store-eu-west/content/pii:S2468823124009933/gr12/DOWNSAMPLED/image/jpeg/27564a3c4e7ad30e02d5051a915688ad/gr12.jpg gr12 gr12.jpg jpg 110808 366 753 IMAGE-DOWNSAMPLED 1-s2.0-S2468823124009933-gr11.jpg https://s3-eu-west-1.amazonaws.com/prod-ucs-content-store-eu-west/content/pii:S2468823124009933/gr11/DOWNSAMPLED/image/jpeg/c270e4d84d7658637577e402f8ae05fe/gr11.jpg gr11 gr11.jpg jpg 135352 700 753 IMAGE-DOWNSAMPLED 1-s2.0-S2468823124009933-gr1.jpg https://s3-eu-west-1.amazonaws.com/prod-ucs-content-store-eu-west/content/pii:S2468823124009933/gr1/DOWNSAMPLED/image/jpeg/6724bbaae3455313ff8d2842c5f617fd/gr1.jpg gr1 gr1.jpg jpg 46441 229 376 IMAGE-DOWNSAMPLED 1-s2.0-S2468823124009933-gr18.jpg https://s3-eu-west-1.amazonaws.com/prod-ucs-content-store-eu-west/content/pii:S2468823124009933/gr18/DOWNSAMPLED/image/jpeg/6dd4ca7ce30929128c2af5e4fa27c2ac/gr18.jpg gr18 gr18.jpg jpg 147076 500 508 IMAGE-DOWNSAMPLED 1-s2.0-S2468823124009933-gr17.jpg https://s3-eu-west-1.amazonaws.com/prod-ucs-content-store-eu-west/content/pii:S2468823124009933/gr17/DOWNSAMPLED/image/jpeg/b336c1d89a0f5555e01357ec6dc37b50/gr17.jpg gr17 gr17.jpg jpg 163155 796 753 IMAGE-DOWNSAMPLED 1-s2.0-S2468823124009933-gr3.jpg https://s3-eu-west-1.amazonaws.com/prod-ucs-content-store-eu-west/content/pii:S2468823124009933/gr3/DOWNSAMPLED/image/jpeg/373c125d973488fc5b3f19c438c1a2e6/gr3.jpg gr3 gr3.jpg jpg 94676 447 753 IMAGE-DOWNSAMPLED 1-s2.0-S2468823124009933-gr16.jpg https://s3-eu-west-1.amazonaws.com/prod-ucs-content-store-eu-west/content/pii:S2468823124009933/gr16/DOWNSAMPLED/image/jpeg/863258205da438d7c24961ca90c236f6/gr16.jpg gr16 gr16.jpg jpg 162987 580 753 IMAGE-DOWNSAMPLED 1-s2.0-S2468823124009933-gr2.jpg https://s3-eu-west-1.amazonaws.com/prod-ucs-content-store-eu-west/content/pii:S2468823124009933/gr2/DOWNSAMPLED/image/jpeg/7528460f23b5ede9d24bb5dab3df0140/gr2.jpg gr2 gr2.jpg jpg 58853 228 508 IMAGE-DOWNSAMPLED 1-s2.0-S2468823124009933-gr15.jpg https://s3-eu-west-1.amazonaws.com/prod-ucs-content-store-eu-west/content/pii:S2468823124009933/gr15/DOWNSAMPLED/image/jpeg/032e78dff65b0b949a1f334111b825a2/gr15.jpg gr15 gr15.jpg jpg 143875 570 753 IMAGE-DOWNSAMPLED 1-s2.0-S2468823124009933-gr19.jpg https://s3-eu-west-1.amazonaws.com/prod-ucs-content-store-eu-west/content/pii:S2468823124009933/gr19/DOWNSAMPLED/image/jpeg/d2717c0d2f5d48db83a5423d80407db7/gr19.jpg gr19 gr19.jpg jpg 150762 624 753 IMAGE-DOWNSAMPLED 1-s2.0-S2468823124009933-ga1.sml https://s3-eu-west-1.amazonaws.com/prod-ucs-content-store-eu-west/content/pii:S2468823124009933/ga1/THUMBNAIL/image/gif/f796c6e2570da5bc6fb841f6e0e731f4/ga1.sml ga1 true ga1.sml sml 13474 163 163 IMAGE-THUMBNAIL 1-s2.0-S2468823124009933-gr21.sml https://s3-eu-west-1.amazonaws.com/prod-ucs-content-store-eu-west/content/pii:S2468823124009933/gr21/THUMBNAIL/image/gif/faf07f8521bc11bcbd9cec5e6f3cee13/gr21.sml gr21 gr21.sml sml 17806 121 219 IMAGE-THUMBNAIL 1-s2.0-S2468823124009933-gr20.sml https://s3-eu-west-1.amazonaws.com/prod-ucs-content-store-eu-west/content/pii:S2468823124009933/gr20/THUMBNAIL/image/gif/a9c40cb36b25e77c50a15fc7294bf26e/gr20.sml gr20 gr20.sml sml 9738 103 219 IMAGE-THUMBNAIL 1-s2.0-S2468823124009933-gr25.sml https://s3-eu-west-1.amazonaws.com/prod-ucs-content-store-eu-west/content/pii:S2468823124009933/gr25/THUMBNAIL/image/gif/0094217faa3e886734b252a6778041cd/gr25.sml gr25 gr25.sml sml 18276 164 183 IMAGE-THUMBNAIL 1-s2.0-S2468823124009933-gr24.sml https://s3-eu-west-1.amazonaws.com/prod-ucs-content-store-eu-west/content/pii:S2468823124009933/gr24/THUMBNAIL/image/gif/6f8808237f9dac817d1a7af7bf42fbc8/gr24.sml gr24 gr24.sml sml 16011 164 156 IMAGE-THUMBNAIL 1-s2.0-S2468823124009933-gr23.sml https://s3-eu-west-1.amazonaws.com/prod-ucs-content-store-eu-west/content/pii:S2468823124009933/gr23/THUMBNAIL/image/gif/d8e1dbf6301eed2dee33e39ccbcfa979/gr23.sml gr23 gr23.sml sml 16785 164 188 IMAGE-THUMBNAIL 1-s2.0-S2468823124009933-gr22.sml https://s3-eu-west-1.amazonaws.com/prod-ucs-content-store-eu-west/content/pii:S2468823124009933/gr22/THUMBNAIL/image/gif/4c9e13e2aba5a7609f92c3af5cdc777f/gr22.sml gr22 gr22.sml sml 17041 164 133 IMAGE-THUMBNAIL 1-s2.0-S2468823124009933-gr9.sml https://s3-eu-west-1.amazonaws.com/prod-ucs-content-store-eu-west/content/pii:S2468823124009933/gr9/THUMBNAIL/image/gif/31a9f49a1d82382a323b16aecc70a742/gr9.sml gr9 gr9.sml sml 13131 164 147 IMAGE-THUMBNAIL 1-s2.0-S2468823124009933-gr8.sml https://s3-eu-west-1.amazonaws.com/prod-ucs-content-store-eu-west/content/pii:S2468823124009933/gr8/THUMBNAIL/image/gif/f675be85cc2799a9171ae027d8236081/gr8.sml gr8 gr8.sml sml 17757 164 167 IMAGE-THUMBNAIL 1-s2.0-S2468823124009933-gr5.sml https://s3-eu-west-1.amazonaws.com/prod-ucs-content-store-eu-west/content/pii:S2468823124009933/gr5/THUMBNAIL/image/gif/76037ce8a61e6695d49620bb4585c036/gr5.sml gr5 gr5.sml sml 16593 107 219 IMAGE-THUMBNAIL 1-s2.0-S2468823124009933-gr4.sml https://s3-eu-west-1.amazonaws.com/prod-ucs-content-store-eu-west/content/pii:S2468823124009933/gr4/THUMBNAIL/image/gif/efa81b1e1a2234874d5309ccccd0e79d/gr4.sml gr4 gr4.sml sml 18633 121 219 IMAGE-THUMBNAIL 1-s2.0-S2468823124009933-gr7.sml https://s3-eu-west-1.amazonaws.com/prod-ucs-content-store-eu-west/content/pii:S2468823124009933/gr7/THUMBNAIL/image/gif/5bec81138f03d4c545b0d28cf37f6d89/gr7.sml gr7 gr7.sml sml 18589 156 219 IMAGE-THUMBNAIL 1-s2.0-S2468823124009933-gr6.sml https://s3-eu-west-1.amazonaws.com/prod-ucs-content-store-eu-west/content/pii:S2468823124009933/gr6/THUMBNAIL/image/gif/68e9fe838bd456729edca6f0b55913bb/gr6.sml gr6 gr6.sml sml 11771 88 219 IMAGE-THUMBNAIL 1-s2.0-S2468823124009933-gr10.sml https://s3-eu-west-1.amazonaws.com/prod-ucs-content-store-eu-west/content/pii:S2468823124009933/gr10/THUMBNAIL/image/gif/21f85cb85e7ce1dd053af8683560f4bc/gr10.sml gr10 gr10.sml sml 19634 164 214 IMAGE-THUMBNAIL 1-s2.0-S2468823124009933-gr14.sml https://s3-eu-west-1.amazonaws.com/prod-ucs-content-store-eu-west/content/pii:S2468823124009933/gr14/THUMBNAIL/image/gif/2780ed31be5b48515b57d6d7101db649/gr14.sml gr14 gr14.sml sml 15627 163 219 IMAGE-THUMBNAIL 1-s2.0-S2468823124009933-gr13.sml https://s3-eu-west-1.amazonaws.com/prod-ucs-content-store-eu-west/content/pii:S2468823124009933/gr13/THUMBNAIL/image/gif/2c111b86a66da9836dd75b5ef4951821/gr13.sml gr13 gr13.sml sml 18999 142 219 IMAGE-THUMBNAIL 1-s2.0-S2468823124009933-gr12.sml https://s3-eu-west-1.amazonaws.com/prod-ucs-content-store-eu-west/content/pii:S2468823124009933/gr12/THUMBNAIL/image/gif/f9f1329e023e9d30ecae395bc6064caa/gr12.sml gr12 gr12.sml sml 13673 106 219 IMAGE-THUMBNAIL 1-s2.0-S2468823124009933-gr11.sml https://s3-eu-west-1.amazonaws.com/prod-ucs-content-store-eu-west/content/pii:S2468823124009933/gr11/THUMBNAIL/image/gif/c74ab485fedf2866aeed5181390a3dc9/gr11.sml gr11 gr11.sml sml 14230 164 176 IMAGE-THUMBNAIL 1-s2.0-S2468823124009933-gr1.sml https://s3-eu-west-1.amazonaws.com/prod-ucs-content-store-eu-west/content/pii:S2468823124009933/gr1/THUMBNAIL/image/gif/fd31b188e980ddf41a9c251fd9215656/gr1.sml gr1 gr1.sml sml 16348 133 219 IMAGE-THUMBNAIL 1-s2.0-S2468823124009933-gr18.sml https://s3-eu-west-1.amazonaws.com/prod-ucs-content-store-eu-west/content/pii:S2468823124009933/gr18/THUMBNAIL/image/gif/d91964ff14328c9765533779f4509894/gr18.sml gr18 gr18.sml sml 22896 163 166 IMAGE-THUMBNAIL 1-s2.0-S2468823124009933-gr17.sml https://s3-eu-west-1.amazonaws.com/prod-ucs-content-store-eu-west/content/pii:S2468823124009933/gr17/THUMBNAIL/image/gif/83d7fd53245de04d89fb1b15850576c2/gr17.sml gr17 gr17.sml sml 13275 164 155 IMAGE-THUMBNAIL 1-s2.0-S2468823124009933-gr3.sml https://s3-eu-west-1.amazonaws.com/prod-ucs-content-store-eu-west/content/pii:S2468823124009933/gr3/THUMBNAIL/image/gif/6bb618dfe6a7db3d99b599e3c4e93735/gr3.sml gr3 gr3.sml sml 11554 130 219 IMAGE-THUMBNAIL 1-s2.0-S2468823124009933-gr16.sml https://s3-eu-west-1.amazonaws.com/prod-ucs-content-store-eu-west/content/pii:S2468823124009933/gr16/THUMBNAIL/image/gif/ea49e41ac6d3e9f531d120ad3efd6998/gr16.sml gr16 gr16.sml sml 16941 164 213 IMAGE-THUMBNAIL 1-s2.0-S2468823124009933-gr2.sml https://s3-eu-west-1.amazonaws.com/prod-ucs-content-store-eu-west/content/pii:S2468823124009933/gr2/THUMBNAIL/image/gif/a0e472c75c703fde82fb8b8371623473/gr2.sml gr2 gr2.sml sml 13079 98 219 IMAGE-THUMBNAIL 1-s2.0-S2468823124009933-gr15.sml https://s3-eu-west-1.amazonaws.com/prod-ucs-content-store-eu-west/content/pii:S2468823124009933/gr15/THUMBNAIL/image/gif/1ecf1fbe2f10b6fe805f05c037dd4d34/gr15.sml gr15 gr15.sml sml 20769 164 217 IMAGE-THUMBNAIL 1-s2.0-S2468823124009933-gr19.sml https://s3-eu-west-1.amazonaws.com/prod-ucs-content-store-eu-west/content/pii:S2468823125000392/gr19/THUMBNAIL/image/gif/c253fdf91c4feaae0121b0350c114f73/gr19.sml gr19 gr19.sml sml 16199 164 198 IMAGE-THUMBNAIL 1-s2.0-S2468823124009933-ga1_lrg.jpg https://s3-eu-west-1.amazonaws.com/prod-ucs-content-store-eu-west/content/pii:S2468823124009933/HIGHRES/image/jpeg/9ed07def22e63727e4bc15e3a5cef66e/ga1_lrg.jpg ga1 true ga1_lrg.jpg jpg 238386 1085 1083 IMAGE-HIGH-RES 1-s2.0-S2468823124009933-gr21_lrg.jpg https://s3-eu-west-1.amazonaws.com/prod-ucs-content-store-eu-west/content/pii:S2468823124009933/HIGHRES/image/jpeg/bca81e1da649b70d8d2efe1c723b22fe/gr21_lrg.jpg gr21 gr21_lrg.jpg jpg 1057993 1849 3333 IMAGE-HIGH-RES 1-s2.0-S2468823124009933-gr20_lrg.jpg https://s3-eu-west-1.amazonaws.com/prod-ucs-content-store-eu-west/content/pii:S2468823124009933/HIGHRES/image/jpeg/08cd54cf92f39052a4b718dc979e5c60/gr20_lrg.jpg gr20 gr20_lrg.jpg jpg 411195 1057 2250 IMAGE-HIGH-RES 1-s2.0-S2468823124009933-gr25_lrg.jpg https://s3-eu-west-1.amazonaws.com/prod-ucs-content-store-eu-west/content/pii:S2468823124009933/HIGHRES/image/jpeg/bac18224dc615557c84aa24d8405f376/gr25_lrg.jpg gr25 gr25_lrg.jpg jpg 1111035 2980 3333 IMAGE-HIGH-RES 1-s2.0-S2468823124009933-gr24_lrg.jpg https://s3-eu-west-1.amazonaws.com/prod-ucs-content-store-eu-west/content/pii:S2468823124009933/HIGHRES/image/jpeg/aa0e5c0304667022032bf4c6187eb70b/gr24_lrg.jpg gr24 gr24_lrg.jpg jpg 1342395 3505 3333 IMAGE-HIGH-RES 1-s2.0-S2468823124009933-gr23_lrg.jpg https://s3-eu-west-1.amazonaws.com/prod-ucs-content-store-eu-west/content/pii:S2468823124009933/HIGHRES/image/jpeg/9b9b10f25885cf72d2df641addd5422a/gr23_lrg.jpg gr23 gr23_lrg.jpg jpg 695074 2176 2500 IMAGE-HIGH-RES 1-s2.0-S2468823124009933-gr22_lrg.jpg https://s3-eu-west-1.amazonaws.com/prod-ucs-content-store-eu-west/content/pii:S2468823124009933/HIGHRES/image/jpeg/c1a8745600f05c34225e392209ae476f/gr22_lrg.jpg gr22 gr22_lrg.jpg jpg 1692271 4102 3333 IMAGE-HIGH-RES 1-s2.0-S2468823124009933-gr9_lrg.jpg https://s3-eu-west-1.amazonaws.com/prod-ucs-content-store-eu-west/content/pii:S2468823124009933/HIGHRES/image/jpeg/d636f0ab9fb1d43be5c181b7a9d29e88/gr9_lrg.jpg gr9 gr9_lrg.jpg jpg 1015336 3719 3333 IMAGE-HIGH-RES 1-s2.0-S2468823124009933-gr8_lrg.jpg https://s3-eu-west-1.amazonaws.com/prod-ucs-content-store-eu-west/content/pii:S2468823124009933/HIGHRES/image/jpeg/e32c444a2fbbf32df6b94a0159c9bf20/gr8_lrg.jpg gr8 gr8_lrg.jpg jpg 1529283 3277 3333 IMAGE-HIGH-RES 1-s2.0-S2468823124009933-gr5_lrg.jpg https://s3-eu-west-1.amazonaws.com/prod-ucs-content-store-eu-west/content/pii:S2468823124009933/HIGHRES/image/jpeg/a0a4e0991e0ae566c4ab50759786bdf1/gr5_lrg.jpg gr5 gr5_lrg.jpg jpg 907431 1632 3333 IMAGE-HIGH-RES 1-s2.0-S2468823124009933-gr4_lrg.jpg https://s3-eu-west-1.amazonaws.com/prod-ucs-content-store-eu-west/content/pii:S2468823124009933/HIGHRES/image/jpeg/9e7a41c256eb389896d527a43e8afba8/gr4_lrg.jpg gr4 gr4_lrg.jpg jpg 474867 1243 2250 IMAGE-HIGH-RES 1-s2.0-S2468823124009933-gr7_lrg.jpg https://s3-eu-west-1.amazonaws.com/prod-ucs-content-store-eu-west/content/pii:S2468823124009933/HIGHRES/image/jpeg/a3173c3f68e3a011b9c7125009aacdb1/gr7_lrg.jpg gr7 gr7_lrg.jpg jpg 1048126 2378 3333 IMAGE-HIGH-RES 1-s2.0-S2468823124009933-gr6_lrg.jpg https://s3-eu-west-1.amazonaws.com/prod-ucs-content-store-eu-west/content/pii:S2468823124009933/HIGHRES/image/jpeg/57e15835ae4c1564f934a3f26a7d5400/gr6_lrg.jpg gr6 gr6_lrg.jpg jpg 585934 1345 3333 IMAGE-HIGH-RES 1-s2.0-S2468823124009933-gr10_lrg.jpg https://s3-eu-west-1.amazonaws.com/prod-ucs-content-store-eu-west/content/pii:S2468823124009933/HIGHRES/image/jpeg/4d5b60cf3754813aa813a373c5e7727a/gr10_lrg.jpg gr10 gr10_lrg.jpg jpg 1154722 2552 3333 IMAGE-HIGH-RES 1-s2.0-S2468823124009933-gr14_lrg.jpg https://s3-eu-west-1.amazonaws.com/prod-ucs-content-store-eu-west/content/pii:S2468823124009933/HIGHRES/image/jpeg/02d920fc6d779bf0458b8273b6062b14/gr14_lrg.jpg gr14 gr14_lrg.jpg jpg 890323 2475 3333 IMAGE-HIGH-RES 1-s2.0-S2468823124009933-gr13_lrg.jpg https://s3-eu-west-1.amazonaws.com/prod-ucs-content-store-eu-west/content/pii:S2468823124009933/HIGHRES/image/jpeg/d2d3f9ee2ac4d3c0886a9b677650cfd3/gr13_lrg.jpg gr13 gr13_lrg.jpg jpg 1103081 2157 3333 IMAGE-HIGH-RES 1-s2.0-S2468823124009933-gr12_lrg.jpg https://s3-eu-west-1.amazonaws.com/prod-ucs-content-store-eu-west/content/pii:S2468823124009933/HIGHRES/image/jpeg/f0ff48e8d2889cddbe658e594278f89c/gr12_lrg.jpg gr12 gr12_lrg.jpg jpg 717716 1619 3333 IMAGE-HIGH-RES 1-s2.0-S2468823124009933-gr11_lrg.jpg https://s3-eu-west-1.amazonaws.com/prod-ucs-content-store-eu-west/content/pii:S2468823124009933/HIGHRES/image/jpeg/1cf8ff8a91e031a97b4ac7f3cfc651d6/gr11_lrg.jpg gr11 gr11_lrg.jpg jpg 1008505 3099 3333 IMAGE-HIGH-RES 1-s2.0-S2468823124009933-gr1_lrg.jpg https://s3-eu-west-1.amazonaws.com/prod-ucs-content-store-eu-west/content/pii:S2468823124009933/HIGHRES/image/jpeg/39d398e255d1a1793a21e223f18277a5/gr1_lrg.jpg gr1 gr1_lrg.jpg jpg 350721 1015 1667 IMAGE-HIGH-RES 1-s2.0-S2468823124009933-gr18_lrg.jpg https://s3-eu-west-1.amazonaws.com/prod-ucs-content-store-eu-west/content/pii:S2468823124009933/HIGHRES/image/jpeg/e9ac56f8661196698c9b455eb76f4648/gr18_lrg.jpg gr18 gr18_lrg.jpg jpg 1146854 2214 2250 IMAGE-HIGH-RES 1-s2.0-S2468823124009933-gr17_lrg.jpg https://s3-eu-west-1.amazonaws.com/prod-ucs-content-store-eu-west/content/pii:S2468823124009933/HIGHRES/image/jpeg/3c7cf98c3540cd68120c5281ce463eac/gr17_lrg.jpg gr17 gr17_lrg.jpg jpg 1134646 3522 3333 IMAGE-HIGH-RES 1-s2.0-S2468823124009933-gr3_lrg.jpg https://s3-eu-west-1.amazonaws.com/prod-ucs-content-store-eu-west/content/pii:S2468823124009933/HIGHRES/image/jpeg/6f0ef082391646e589bcc1cf0f0d1a29/gr3_lrg.jpg gr3 gr3_lrg.jpg jpg 599311 1980 3333 IMAGE-HIGH-RES 1-s2.0-S2468823124009933-gr16_lrg.jpg https://s3-eu-west-1.amazonaws.com/prod-ucs-content-store-eu-west/content/pii:S2468823124009933/HIGHRES/image/jpeg/57830282a97c3b8d7ed19c8dd79e9d3c/gr16_lrg.jpg gr16 gr16_lrg.jpg jpg 993119 2567 3333 IMAGE-HIGH-RES 1-s2.0-S2468823124009933-gr2_lrg.jpg https://s3-eu-west-1.amazonaws.com/prod-ucs-content-store-eu-west/content/pii:S2468823124009933/HIGHRES/image/jpeg/dcac873007b2c81a17b2e7d6bffd2eed/gr2_lrg.jpg gr2 gr2_lrg.jpg jpg 467379 1011 2250 IMAGE-HIGH-RES 1-s2.0-S2468823124009933-gr15_lrg.jpg https://s3-eu-west-1.amazonaws.com/prod-ucs-content-store-eu-west/content/pii:S2468823125000392/HIGHRES/image/jpeg/c9bec7bb22d4c30fe97ccd7ed65d1433/gr15_lrg.jpg gr15 gr15_lrg.jpg jpg 986874 2522 3333 IMAGE-HIGH-RES 1-s2.0-S2468823124009933-gr19_lrg.jpg https://s3-eu-west-1.amazonaws.com/prod-ucs-content-store-eu-west/content/pii:S2468823125000392/HIGHRES/image/jpeg/9efd24d04e88fa87e9c9c483fdb59d73/gr19_lrg.jpg gr19 gr19_lrg.jpg jpg 1015267 2762 3333 IMAGE-HIGH-RES MCAT 114811 114811 S2468-8231(24)00993-3 10.1016/j.mcat.2024.114811 Elsevier B.V. Fig. 1 Types of MOFs based materials. Fig 1 Fig. 2 The main methods for synthesis of MOFs materials. Fig 2 Fig. 3 The classic structures of the pristine MOFs and their respective organic linkers. Fig 3 Fig. 4 Applications of MOFs based catalysts in organic reactions. Fig 4 Fig. 5 Schematic diagram of combining imine bonds with linkers through aldol condensation reactions and in situ growth of Au NPs (a); Synthetic process of Au@L-ZIF-90 (b); Preparation of Fe-Fe3C-LaOCl/CN-hmta catalyst for hydrogenation of nitroarenes (c); Schematic illustration of the synthesis of HPC-supported bimetallic catalysts for the selective hydrogenation of nitro compounds to amines (d); Illustration of the synthetic strategies for the sandwich structure of ZIF-8X@Pd@ZIF-8 composite (e). Fig 5 Fig. 6 Schematic illustration of the synthesis process of H-three-dimensional OM-Co/NC (a); Plausible mechanism for the hydrogenation of FFA to CPL over the H-3DOM-Co/NC catalyst (b); Schematic diagram of the preparation procedure for the Pt/M-CeO2 (c). Fig 6 Fig. 7 Illustration of the synthesis procedures of dual-MOFs HKUST-1/ZIF-8 and its derivative Cu@ZIF-8 composite for semi-hydrogenation of phenylacetylene into styrene (a); Preparation of Ni-S/C NPs for hydrogenation of alkyne through thermal decomposition of Ni-S-MOFs precursors (b); Transfer hydrogenation of phenylacetylene with ammonia borane as hydrogen source under non-catalytic and catalytic conditions (c); M06–2X/cc-pVTZ (PCM, 1,4-dioxane) calculated structures and free energies (kcal mol−1) for the reduction of phenylacetylene with NH3BH3.(d); Preparation of Dx-NENU-3 with FLP sites through a coordination defect engineering strategy (e). Fig 7 Fig. 8 Schematic illustration of the fabrication process of the NixCo@NC@C composite (a); Procedures for the preparation of the Ni@DC-x-T catalyst (b); Schiff base-tagged Ni-ZrO2/N-C nanocatalysts for the coordination-driven self-assembly of renewable levulinic acid ester selective transformation. (c). Fig 8 Fig. 9 Preparation of metal Salen@NH2−MIL-101(Cr) used to epoxidation of styrene (a); Aerobic epoxidation of styrene over Zr-based MOFs encapsulated transition metal substituted phosphomolybdic acid (b); The synthetic process of M-TCPP (c). Fig 9 Fig. 10 Synthetic strategy for CeO2@N-C (a); Structure of M-NU-1200 with the four 8-connected M6 nodes and the tritopic linker TMTB (b); Recycling catalytic performances on VM-NU-1200 (c). Fig 10 Fig. 11 A series of Zr-MOFs with different SBUs and pore sizes as Fe supports for photocatalytic alkane activation (a); Metal porphyrins and Zn(AcO)2 catalyze the efficient oxidation of cycloalkanes with O2, simultaneously enhancing both the conversion rate and selectivity (b). Fig 11 Fig. 12 Synthetic route of Fe@NH2−MIL-101-POM (a); and Fe@NH2−MIL-101-POM (b); Polyhedron model of Th6 cluster (c); Diagram of various metal complex units (d); The coordination pattern of the Th6 cluster in M-Ligand-Th6 (e). The crystal structures of M-Th6−MOFs (M = Ni, Cd, and Co) (f); Conversion and selectivity of photocatalytic MPS oxidation on M-l-Th6. Fig 12 Fig. 13 The pristine Zn-MOFs for knoevenagel condensation (a); as well as {Co3} (b); {Pb10K2} (c) and θ-[Mo8O26]4− for CO2 cycloaddition and Knoevenagel condensation (d). Fig 13 Fig. 14 Preparation of DCMOF with mixed ligand strategy (a); For the preparation of Faujasite zeolite/ZIF-8 catalytic composite (b). Fig 14 Fig. 15 MOFs derived RuCo catalyst for Guerbet reaction (a); Comparison of IR spectra (b); Synthesis of 1 and its conversion to a catalytically active substance under Guerbet reaction conditions (c). Fig 15 Fig. 16 Synthetic procedure of Pd0@UIO-66-SB-Im (a); The structure of MUV-22 MOFs (b); The proposed Suzuki-Miyaura coupling mechanism (c); The powder XRD patterns of various catalysts (d). Fig 16 Fig. 17 Schematic illustration of preparation of Pd@MIL-101-DMF (a); Heck reaction of iodobenzene and ethyl acrylate over different catalysts (b); Models of Pd13-nanocluster with TPA (I), TPA-NH2 (II),and TPA-PPh3 (III). σ-bond molecular orbitals of N-Pd and P-Pd bonds, respectively, in model II and III (c); Proposed molecule of Pd-MOFs (d); N2 adsorption isotherms of Cu-MOFs and Pd-MOFs (e). Fig 17 Fig. 18 Schematic illustration of the synthetic procedures for the synthesis of OM-CeO2 (a); Plausible mechanism for cycloaddition of epichlorohydrin with CO2 over OM-Zr0.20Ce0.80O2 (b). Fig 18 Fig. 19 Modificated ZIF-8 for CO2 adsorption and cycloaddition reaction (a); Ln-based MOFs for CO2 cycloaddition (b), and their proposed reaction mechanism (c). Fig 19 Fig. 20 Types of various cascade reactions. Fig 20 Fig. 21 Photocatalytic hydrogenation-alkylation of nitrobenzenes/benzonitriles with alcohols over Pd/MOFs (a); Preparing of Cu-ZnO/NC-550 catalyst (b); The performance contrast of the Cu-ZnO/NC-BMOFs and Cu/ZnO/NC-IWI catalysts (c); XRD patterns of Cu-ZnO/NC-BMOFs and Cu/ZnO/NC-IWI (d); The synthetic procedure of the NiCo/MgOC catalyst derived from the tri-metallic Ni-Co-Mg@H2dhbdc MOFs and applied for cascade reactions (e); SEM images of Ni-Co-Mg@H2dhbdc MOFs (f-h); Catalytic performance for tandem reaction (i); Catalytic activity and selectivity of developed Co@CN-hmta catalyst (h). Fig 21 Fig. 22 Preparation of ZrO2/C@x-Co-NC (a); Yields over various catalysts with different reaction time (b-c); Product distribution for CO2 fixation with 4-nitroanisole as a function of reaction time over ZrO2/C@1.0-Co-NC (d); A schematic illustration of advantages and disadvantages of ZrO2/C@1.0-Co-NC in comparison to the physical mixture of ZrO2/C and Co-NC is presented. (e); Reaction mechanism of cascade CO2 fixation with nitroarenes over ZrO2/C@x-Co-NC (f). Fig 22 Fig. 23 Au/Pd based catalysts for cascade oxidation/asymmetric aldol reactions (a); Synthetic process of PMoV2@DETA-MIL-101 (b). Fig 23 Fig. 24 The design concept of achieving a cascade catalyst (a); The prepared MOFs for the asymmetric cyclic carbonate transformation of CO2 and alkenes (b); Layered structure of MOFs. d) Catalytic performance of various Ni-MOFs catalysts under the conditions of styrene (c). Fig 24 Fig. 25 Synthesis of SSHS and DSHS (a); Performance the reaction towards 4-chlorobenzaldehyde and o-aminobenzamide (b); Performance of oxidation of cyclohexane (c). Fig 25 Table 1 Summary of MOFs based and solid catalysts used for hydrogenation reactions. Table 1 Type of substrates Nitroarene Furfural Alkyne Others Entry Catalyst Carrier/Precursor Temperature(℃) Time(h) Performance Cycles and performance change Reference Conversion(%) Selectivity(%) Yield(%) 1 Au@La-ZIF-90 ZIF-90 25 0.08 99 99 98 20 (98 to 89) 116 2 CuPd@ZIF-8 ZIF-8 R.T. 0.2 99 98 97 3 (97 to 45) 133 3 ZIF-8C@Pd@ZIF-8 ZIF-8 85 3 >99 98.9 >98 / 119 4 SOM-ZIF-8@ZIF-67 ZIF-8 180 8 / / 97.8 7 (97 to 97) 123 5 Cu@ZIF-8 HKUST-1/ZIF-8 130 10 99.9 99.9 99 / 130 6 Ni3Co@NC@C ZIF-67 170 0.5 99.7 100 99.7 4 (99.7 to 91) 136 7 HPCNi-ZIF-1 ZIF-67 120 18 91 99 91 7 (91 to 85) 118 8 Pd/UiO-66(Hf) UiO-66 R.T. 0.5 99 99.8 98.8 3 (98 to 97) 134 9 UIO-S0.6 UiO-66 150 6 91 99 90 5 (98.7 to 95.8) 126 10 Ni-ZrO2/NC UiO-66-NH2 140 4 94.6 99.9 94.5 5 (94.5 to 59.9) 139 11 Cu@NC-ZrO2–600 PCN-222(Cu) 60 3 95 99 94 5 (94 to 91) 137 12 Fe-Fe3C-LaOCl/CN-hmta La-salenFe@HMTA 85 6.5 98.7 >99.8 98.5 10 (98 to 90) 117 13 Pt/M-CeO2 Ce-MOFs 80 12 100 98 98 5 (98 to 98) 124 14 Ni@DC-0.06 Ni-MOF 100 8 95 97 92 5 (92 to 92) 138 15 Ni-S/C Ni-S-MOF 165 12 91 99 90 / 131 16 CoCu/C MOF-74 180 / / 89 / 3 125 17 C/Co@C Co-MOF-74 60 24 98 95 93 3 (95 to 95) 132 18 D4-NENU-3 HKUST-1 130 / 95.1 100 95 / 135 19 Raney nickel(14 wt %) Raney nickel 25 24 / / 99 16 (99 to 50) 140 20 Co3O4@SiO2–500oC Co3O4@SiO2 80 7 60 65 39 5 (39 to 37) 141 21 Pd-NMC NMC 30 3 100 93 93 6 (90 to 90) 142 22 Ni-N-C-700 Ni-N-C 120 8 / / 99 5 (99 to 88) 143 23 Pd/N-XC72R-6–300 N-XC72R 25 0.16 99 99 99 5 (99 to 88) 144 24 CuCo/MgO-0.04 sulfate 109.85 1 100 99.7 99.7 5 (99.7 to 56.2) 145 25 Ni2Co1AlO / 140 4 100 97.6 97.6 10 (97.6 to 85) 146 26 CaPdH2 / 110 / 100 85 85 / 147 27 0.06 wt.% Pd/rTiO2 NR Pd/rTiO2 30 2.16 100 90 93 6 (93 to 88) 148 Table 2 Summary of MOFs based and solid catalysts used for oxidation reactions. Table 2 Type of substrates Styrene Alcohol Cyclane Others Entry Catalyst Carrier/Precursor Temperature(℃) Time(h) Performance (%) Cycles and performance change Reference Conversion Selectivity Yield 1 Cu salen@NH2−MIL-101(Cr) NH2−MIL-101(Cr) 80 6 99 90 89 4 (89 to 81) 154 2 Co-HPA@UiO-66 UiO-66 40 9 96 82 77 10 (77 to 77) 155 3 Cu-TCPP Cu-TCPP 72 20 94 49.2 46 4 (46 to 46) 156 4 CuCl2-UiO-67-BPY UiO-67-BPY 20 12 99 99 98 10 (98 to 98) 162 5 CeO2@NC Ce-MOF 150 48 99 99 98 5 (98 to 98) 163 6 V-Zr-NU-1200 Zr-NU-1200 105 11 100 100 100 3 (100 to 38) 164 7 MIL140-BPDC-Fe MIL140-BDC 20 12 26.2 48 / 4 (26.2 to 26.2) 168 8 T(4-COOCH3)PPCo&Zn(AcO)2 T(4-COOCH3)PPCo 120 8 6.53 96.9 63.3 / 169 9 PMoV2@MIL-101 MIL-101 90 24 99 99 98 5 (99 to 79) 171 10 Fe@NH2−MIL-101-POM NH2−MIL-101 50 1 100 100 100 15 (100 to 95) 170 11 Ni-PBA-Th6 Th-MOFs 25 48 99 97 96 3 (96 to 86) 172 12 Co3O4–550 / 60 8 97 91 88 5 (88 to 86) 173 13 Co@NC CN sunlight 3 100 80 80 / 174 14 Mg0.5Pd0.2Al0.3(OH)2(CO3)0.15.mH2O / 70 4 67 55 37 5 (37 to 35) 175 15 [Cu((R,R)-BPBP)]+ / 25 6 100 50 56 / 176 16 Fe(ClO4)3xH2O / 25 0.5 61 64 39 / 177 Table 3 Summary of MOFs based and analogues solid catalysts used for condensation reactions. Table 3 Type of reaction Knoevenagel Aldol Friedlander Others Entry Catalyst Carrier/Precursor Temperature(℃) Time(h) Yield(%) Cycles and performance change Reference 1 ValZnCl Zn-MOFs 20 2 96 6 (96 to 80) 180 2 Fauj/Zn/L ZIF-8 20 16 90.6 5 (90 to 80) 189 3 NUC-82a NUC-82a 55 5 99 5 (99 to 95) 181 4 NUC-45a NUC-45 50 12 99 5 (99 to 96) 182 5 NUC-62 NUC-62 64.8 10 99 5 (99 to 98) 183 6 γ-Fe2O3-AA/Al-MOF-Asp-A MIL-101 80 4 / / 194 7 1′(activated UiO-66(Hf)) UiO-66(Hf) 80 3 86 / 192 8 1′(activated Hf-UiO-66) Hf-UiO-66 100 20 95 4 (95 to 93) 193 9 Zr/Hf-UiO-66 UiO-66 110 24 97.9 / 188 10 UiO-66-SO3H UiO-66 140 4 66 3 (66 to 58) 196 11 Ru@MFU-1 MFU-1 170 15.5 25 / 195 12 RuCo@MFU-1 MFU-1 170 15.5 23 197 13 DCCuBTC-0.6 DCMOF 48 25 66.5 3 (66.5 to 60.6) 187 14 Zr-UiO-67-NHCS-Pro Zr-UiO-66-NH2 25 24 85 5 (85 to 65) 186 15 MgO-R3 / 30 0.5 85 5 (85 to 85) 198 16 Anhydrous CuSO4 / 25 2 99 5 (99 to 98) 199 17 Cu-PMA / 70 0.5 99 5 (99 to 95) 200 18 CN/SBA-15–400 SBA-15 90 4 84.3 6 (80 to 40.5) 201 19 re-Ca4Al-LDH / 70 6 61.5 6 (61.5 to 36) 202 20 FeNPs/DETA@rGO DETA@GO 50 2 85.5 4 (80.2 to 69.6) 203 21 Ce–Al–MCM-41 MCM-41 99.85 24 95 6 (95 to 79) 204 22 Ni(glyme)Cl2 / 170 24 85 / 205 23 AlCl3 / 24 0.67 97 / 206 Table 4 Summary of MOFs based and solid catalysts used for cross-coupling reactions. Table 4 Type of reaction Suzuki Heck Sonogashira Others Entry Catalyst Carrier/Precursor Temperature(°C) Time(h) Yield(%) Cycles and performance change Reference 1 Pd@HfO2 Pd@NH2-UiO-66(Hf) 50 2 99 10 (99 to 99) 216 2 Pd0@UIO-66-SB-Im UiO-66-NH2 90 6 99 6 (99 to 99) 213 3 UiO-66-biguanidine/Cu UiO-66-NH2 100 10 96 8 (96 to 85) 234 4 Fe3O4@TEA@MOF Ni-MOF 120 0.12 100 4 (100 to 78) 232 5 [CuAPPA·2H2O]n [CuAPPA·2H2O]n 110 0.5 96 4 (96 to 91) 212 6 UMCM-1-NH2 -furfural/Pd UMCM-1-NH2 120 0.3 99 10 (99 to 80) 221 7 Pd(II)@BUT-11 BUT-11 120 2 95 5 (95 to 92) 222 8 Fe-MIL-101-isatin-Schiff-base-Co Fe-MIL-101-NH2 80 4 98 5 (98 to 94) 236 9 Pd/MIL-101-PPh3 MIL-101-NH2 80 3 92 5 (92 to 89) 224 10 Pd@MIL-101-DMF MIL-101 110 6 90 5 (90 to 90) 223 11 Pd-NHC-MIL-101(Cr) MIL-101(Cr) 110 12 94 6 (94 to 89) 230 12 Pd-MOF Pd-MOF 60 8 88 4 (88 to 70) 225 13 Pd@HKUST-1@Cu(II)/CMC HKUST-1 90 3 96 5 (96 to 88) 233 14 Pd@Fe-MOF-IL NH2−MIL-88B(Fe) 80 24 96 10 (96 to 81) 231 15 Pd@ZIF-8 ZIF-8 140 24 100 1(100 to 85) 235 16 Pd-LSK-15 LSK-15 90 44 65 3 (65 to 12) 214 17 MUV-22 MUV-22 90 24 58 4 215 18 Pd(dppf)Cl2 / 80 24 91 / 237 19 Fe/P500 (0.05) P500 132 0.08 30 / 238 20 Pd/PDA PDA 80 5 99 6 (99 to 60) 239 21 Pd0 / 160 15 90 / 240 22 Ni(cod)2 / 130 16 80 / 241 23 CuI / 100 24 94 / 242 24 PdCl2 / 100 24 99 / 243 25 Pd2(dba)3 / 130 12 85 / 244 Table 5 Summary of MOFs based and solid catalysts used for cascade reactions. Table 5 Entry Catalyst Carrier/Precursor Type ofcascade reactions Rate-determining step Temperature (oC) Time(h) Yield(%) Ref. 1 Pd/NH2−MIL-101(Fe)−2MI MIL-101(Fe) Hydrogenation- N-alkylation / 24 85 279 Alkylation 2 Cu-ZnO/NC-550 CuZn-MOFs Hydrogenation- N-alkylation 200 9 98.8 280 Alkylation 3 NiCo/MgOC Ni-Co-Mg@H2dhbdc Hydrogenation- N-alkylation 200 7 98.6 281 Alkylation 4 ZrO2/C@1.0Co-NC ZIF-67-on-UiO-66 Hydrogenation- Hydrogenation 60 24 99.8 282 Formylation 99.5 5 Co-C@Cu-C Co-MOF-74@Cu-MOF-74 Hydrogenation- Cross-coupling / 10 79 283 Cross-coupling 6 AuPd@NH2-UiO-66-(pro)−1 NH2-UiO-66 Oxidation- Oxidation 80 24 93 284 Condensation 25 120 85 7 PMoV2@DETA-MIL-101 MIL-101 Oxidation- Condensation 120 30 99 285 Condensation 20 6 99 8 Fe(INA)(H2N-BDC) Fe-MOF Oxidation- Oxidation 33 2 90 286 Condensation sunlight 3 87 9 Cu/ZIF-8 ZIF-8. Oxidation- Oxidation 70 24 66 287 Condensation 70 5 95 10 Hf-Ir-Co-PPA Hf-Ir Oxidation- Cross-coupling 40 78 75 288 Cross-coupling 11 ZnW-PYIs NH2-BPY Oxidation- Cycloaddition 50 120 92 289 Cycloaddition 50 96 99 12 ADD-Fe-Al Fe0.2Al0.8−MIL-101-NH2 Oxidation- Cycloaddition 70 / 87 290 Cycloaddition 13 NiBDC NS 2D MOF NSs Oxidation- Cycloaddition 80 12 95 291 Cycloaddition 80 12 87 14 Pd@NH2-UiO-66(pro)−2 Pd@NH2-UiO-66 Cross-coupling- Cross-coupling 80 0.16 99 292 Condensation −20 120 82 15 CuCo@UiO-67-Pd(II)-l-Pro UiO-67 Cross-coupling- Cross-coupling 80 10 96 293 Condensation −20 120 62 16 Pt/CN-ZrO2 UiO-66-NH2 Condensation- Condensation 80 6 99 294 Hydrogenation 17 YSS-2 Zr6-UiO-66, Ce6-UiO-66 Condensation- Condensation 60 6 93 295 Oxidation 18 MIL-101(Cr)@CS MIL-101(Cr) Deacetalization- Condensation 80 12 / 296 Condensation 80 12 99 19 UiO-66@SNW-1 UiO-66 Deacetalization- Condensation 80 12 / 297 Condensation 80 12 99.6 20 MOF-907 Fe-MOF Oxidation- Epoxidation 120 0.025 95 298 Epoxidation Review Paper Recent advance in metal-organic frameworks based catalysts for production of fine chemicals via thermal catalysis Rui Fu Writing – original draft Conceptualization Weizuo Li Writing – review & editing Writing – original draft ⁎ Guangyu He Conceptualization Dafang He Data curation Haiqun Chen Writing – review & editing Conceptualization ⁎ School of Petrochemical Engineering, Changzhou University, Changzhou, Jiangsu 213000, China School of Petrochemical Engineering Changzhou University Changzhou Jiangsu 213000 China School of Petrochemical Engineering, Changzhou University, Changzhou, Jiangsu 213000, China ⁎ Corresponding authors. MOFs have garnered considerable interest owing to their high porosity and precisely engineered molecular structures, making them crucial in gas storage, separation, and catalysis applications. Recently, MOFs based materials have been playing an increasingly significant role in thermal catalytic reactions due to their highly controllable structures and large pores. Therefore, we summarize recent advances in the design, synthesis, and functional applications of MOFs-based materials, including pristine MOFs, composite MOFs, and their derived catalysts through calcination and/or pyrolysis in thermal catalytic reactions (e.g. hydrogenation, oxidation, cascade reaction). Furthermore, we compare the results and summarize the performance differences of different types of MOFs-based catalysts in single organic reactions and cascade reactions, variations in catalytic activity, selectivity, and stability. This helps us gain a deeper understanding of the potential applications of MOFs in organic synthesis, and deduce the structure-performance relationships between MOFs materials synthesized from different organic ligands. This review could provide important references for designing and synthesizing efficient catalysts, promoting advancement in the field of thermal catalysis. Graphical abstract Image, graphical abstract Recent advance in metal-organic frameworks (MOFs) based catalysts (e.g. pristine MOFs, composite MOFs, and their derived catalysts) in thermal single and/or cascade reactions were summarized. Keywords Metal-organic frameworks Derivative catalysts Hydrogenation reaction Oxidation reaction Condensation reaction Cascade reaction Data availability No data was used for the research described in the article. Abbreviations of proper nouns metal organic frameworks, MOFs metal organic layers, MOLs Hong Kong University of Science and Technology-1, HKUST-1 isoreticular metal organic frameworks, IRMOFs, zeolitic imidazolate frameworks materials, ZIFs metarial sofistitute Lavoisier frameworks, MILs pocket channel frameworks, PCNs nanoparticles, NPs hexamethylenetetramine, hmta 4,4′,4′′-s-triazine-2,4,6-triyl-tribenzoic acid, H3TAB S-heptazine tribenzoate, HTB 5′-(4-carboxy-2-nitrophenyl)−2,2′,2′’,4′,6′-pentanitro-[1,1′:3′,1′’-terphenyl]−4,4′’dicarboxylic acid, H3TNBTB 2,4,6-tri(2,4-dicarboxyphenyl)pyridine, H6TDP 2,5-dihydroxyterephthalic acid, H2dhbdc 2,4,6-tri-arylpyridines, TAPs 4-dimethylaminopyridine, DMAP N,N-dimethylformamide, DMF 1,3-bis(3-(2-pyridyl)pyrazol-1-yl)propane, BPPP Tert-Butyl hydroperoxide, TBHP 2-hydroxy-1,1-bis(hydroxymethyl)ethyl)amino]−1-propanesulfonic acid, TAPs 2-aminoterephthalic acid, NH2BDC 1 Introduction With the continuous progress of the times, the design, preparation, and application of new materials play a vital role in promoting social development and are currently a hot topic of research. In 1995, Yaghi reported a coordination compound with a two-dimensional structure composed of transition metal Co and organic ligand trimellitic acid, and named it MOFs [1]. In recent years, MOFs have emerged as unique porous materials due to their remarkable physical and chemical properties [2]. Formed through the self-assembly of organic ligands and metal ions, MOFs feature highly controllable structures and pore sizes, combining the stability of inorganic materials with the versatility of organic compounds. Their surfaces can be selectively functionalized, enhancing reactivity and selectivity for applications in adsorption, separation, and catalysis. Additionally, MOFs are easy to synthesize, recyclable, and sustainable, offering extensive potential for customized designs and diverse applications [3–8]. MOFs-based catalytic materials are categorized into three types: pristine MOFs, composite MOFs, and derivative MOFs [9]. Comprising organic ligands and metal centers, MOFs exhibit diverse structures, pore sizes, and properties based on the variety of metal ions and ligands used, alongside adjustable synthetic parameters [10–13]. More than 20,000 distinct MOFs have been developed, with common metal centers including Fe, Co, Ni, Cu, Zn, and Cr [14], and typical ligands such as carboxylic acids, phosphoric acids, pyridines, and imidazoles. MOFs can be classified into four main categories: IRMOFs, ZIFs, MILs, and PCNs [15]. The integration of MOFs with other materials for high-performance catalytic materials is a significant research focus. MOFs' controllable structure enhances the catalytic effects when combined with materials like metal NPs and nanocarbon. Their large surface area and tunable pore structures improve catalyst dispersion, stability, selectivity, and reaction activity, expanding the catalysts' functional range for various reactions. This research is expected to advance the field of catalytic materials significantly. Additionally, porous carbon-based composites derived from self-templating and precursor-based MOFs maintain the advantages of high specific surface area, enabling the design of multifunctional materials [16–19]. Since 2008, when Xu et al. first prepared porous carbon from MOF-5, numerous metal/carbon catalysts have been developed [20]. These MOFs-derived materials, achieved through high-temperature thermal decomposition, hold great promise for applications in gas storage, catalysis, sensing, and energy storage, highlighting their substantial research value [21–23]. 2 Types of MOFs based materials Researchers are focusing on developing MOFs-based materials, including pristine MOFs, composite MOFs, and catalysts derived through calcination and pyrolysis. Pristine MOFs are pure and unmodified, while composite MOFs combine MOFs with other materials to enhance specific properties. Calcination and pyrolysis transform MOFs into metal-oxide or carbon-based materials with unique catalytic properties, showing promise in heterogeneous catalysis, electro-catalysis, and photo-catalysis due to their tailored structures and active sites. Ongoing research aims to optimize synthesis methods and applications to improve the catalytic performance of MOFs and their derived catalysts [24,25] (Fig. 1 ). 2.1 Pristine MOFs materials The main methods for synthesizing MOFs are solvothermal synthesis, microwave-assisted synthesis, and mechanochemical synthesis [26]. The selection of the synthetic method is typically contingent upon factors such as the desired properties of MOFs, scalability for larger production, reaction time required, energy efficiency, and environmental considerations. Researchers choose the most suitable method based on these criteria to effectively achieve the desired MOFs structures (Fig. 2 ). 2.1.1 IRMOFs IRMOFs consist of interconnected [Zn4O]6+ units and aromatic carboxylate ligands, creating a network with large pores and high volume. The clustering of carboxylate ligands with metal ions can hinder MOFs interpenetration. MOF-5, synthesized by Yaghi et al. in 1999, features a cubic structure with terephthalic acid ligands [27]. MOF-5 is a pivotal MOFs that significantly impacts the field due to its high specific surface area (approximately 2900 m2·g−1), large void fraction (55–61 %), and stability (∼300 °C). Its easy preparation has facilitated research in gas adsorption and energy storage. Recent studies have expanded pore sizes from 0.38 to 2.88 nm using terephthalic acid analogues, resulting in mesoporous MOFs. Additionally, high-temperature calcination can remove zinc to create more porous IRMOFs derivatives, further advancing the field. 2.1.2 ZIFs ZIFs are self-assembled structures made from transition metals (like Zn and Co) and tetrahedrally coordinated imidazole-based ligands. Their M-Im-M framework exhibits a bond angle (∼145°) similar to the Si-O-Si blocks in zeolites. ZIFs have pore structures akin to aluminosilicate zeolites, offering diverse structures and functionalization capabilities, as well as superior thermal and chemical stability compared to other MOFs. Notably, ZIF-8 and ZIF-67, synthesized easily at room temperature, are known for their high stability, combining inorganic zeolite durability with the porosity and organic functionality of MOFs, making them suitable for catalysis and gas separation applications [28]. 2.1.3 MILs MILs materials represent another unique subset of MOFs, using trivalent transition metal ions (such as Fe3+, Al3+, Cr3+) coordinating with carboxylic acid-based ligands (P-phthalic acid, trimesic acid, etc.). MILs also exhibit extremely high specific surface areas. Among these, MIL-100 [29], MIL-101 [30], and MIL-53 are common types. MIL-100 is coordinated with Fe3+ or Cr3+ ions and trimesic acid, maintaining good thermal stability even under high-temperature conditions, with a maximum specific surface area reaching up to 3100 m2·g−1 and a pore size of up to 2.9 nm. In comparison, MIL-101 coordinates transition metal ions with terephthalic acid, achieving a maximum specific surface area of 5900 m2·g−1. MIL-53 mainly consists of octahedral MO4(OH)2 (M usually Al3+, Cr3+, Ga3+, Fe3+, Sc3+) secondary structural units coordinated with terephthalic acid, forming a 3D framework material with 1D rhombic channels [31]. 2.1.4 PCNs The PCNs series of materials predominantly use porphyrins as ligands coordinating with transition metals to form porous coordination networks. Copper ions are common metal nodes coordinated with tricarboxylic acid ligands such as H3TAB or HTB. The PCNs materials contain both pore-type structures and three-dimensional orthogonal channels interconnected through small windows. Compared to IRMOFs, PCNs structures are more complex [32–34]. HKUST-1 is a typical PCNs material. Chui et al. first coordinated Cu2(COO)4 clusters with trimesic acid in 1999 to create HKUST-1. HKUST-1 features two pore structures, one being orthogonal pores, and the other a straight three-dimensional orthogonal channel [35]. Furthermore, these pores share some interconnectivity. From their discovery to the present, the PCNs series of MOFs have found extensive applications in areas such as photocatalysis, drug delivery, and immobilizing biocatalysts. PCNs can be pyrolyzed to form stable M-Nx (M = Cu, Co, Fe, Ni, Mn atoms) single-atom structures, expanding the applications of porphyrin MOFs in the construction of highly efficient single-atom catalysts [36–38] (Fig. 3 ). 2.2 Composite MOFs materials MOFs materials can be composited with silica NPs, zeolite, graphite, various porous materials, covalent organic frameworks, polyoxometalates, ionic liquids, polystyrene spheres, and carbon nanotubes. Currently, the main focus is on summarizing the composites of MOFs with NPs, polystyrene sphere, and Polyoxymethylene (POMs) materials [2,39]. 2.2.1 NPs@MOFs materials The composite MOFs materials with metal NPs leads to the creation of novel multifunctional composite materials. Metal NPs possess high surface energy and superior properties that larger materials cannot match [40]. However, the high surface energy and thermodynamic instability of small-sized metal NPs often lead to aggregation during preparation and reaction processes, leading to poor catalytic performance. Due to the strong coordination between metal and organic ligands and the confinement effect of MOFs structure, metal NPs derived from MOFs are restricted within a narrower range, effectively preventing the aggregation and growth of NPs. This method facilitates the synthesis of highly dispersed metal active NPs, and the catalysts prepared through this method differ from traditional supported metal catalysts as they not only enhance stability but also improve catalytic activity [41–43]. 2.2.2 PS@MOFs materials Polymer microspheres possess several advantageous characteristics, including small particle size, large specific surface area, strong adsorption capacity, good dispersion, and ease of modification, which contribute to their widespread use. Ongoing research has led to a transition in the diameter of polymer microspheres from small to large, as well as an evolution of their morphologies. Notably, monodisperse polystyrene microspheres, derived from styrene monomers, not only retain the benefits of conventional microspheres but also exhibit superior physical and chemical properties such as enhanced stability, strong hydrophobicity, low adhesion, and cost-effectiveness. Monodisperse polystyrene microspheres exhibit good adsorption capabilities, excellent optical/mechanical properties, and high surface activity. One synthetic method of MOFs involves a templating approach, template method is widely used in the preparation of nanomaterials, which can be further divided into soft and hard templating techniques. The key to prepare nanomaterials by template method is template agent Using PS spheres as hard templates, followed by chemical etching to remove the templates, effectively prevents aggregation of NPs on the surface of MOFs, and the potential damage to MOFs from the reducing agent when reducing metal precursors [44,45]. Additionally, in the presynthetic process, precise control over the size and morphology of the NPs can be achieved. By varying the size of the PS sphere template, MOFs structures with different pore diameters can be prepared, expanding the applications of hierarchical ordered porous materials in adsorption and catalysis fields. The highly ordered three-dimensional structure as a template can be applied to the preparation of various ordered large-pore single-crystal materials, resulting in MOFs materials with large pores, high order, tunable pore sizes, and stable monocrystalline structures. These ordered micropore MOFs materials have wide application potential in chemical adsorption or separation, large molecule catalytic conversion, or biomedical drug delivery [46–48]. 2.2.3 POMs@MOFs materials POMs serve as good acid catalysts, containing abundant active transition metal centers and having a unique three-dimensional compound with a special topological structure, making it an excellent transition metal source [49]. However, the limited surface area and poor stability of POMs restrain their development in catalysis. The porous structure and large pore size of MOFs ensure good access of polyanion molecules into the MOFs, while the high surface area and long-range ordered structure of MOFs ensure uniform distribution of POMs [50]. By encapsulating POMs within MOFs to form POMs@MOFs composite structures, the strengths of each party can be maintained, demonstrating strong synergy. The POMs@MOFs composite material combines the advantages of MOFs and POMs, showcasing high porosity, a large surface area, unique crystal and electronic structure. Consequently, they demonstrate outstanding catalytic performance in organic reactions. By dispersing active sites, optimizing nanostructures, synthesizing heterogeneous structures, and incorporating heteroatoms, the quantity of active sites and catalytic activity can be enhanced [51]. Constructing ordered large-pore POMs@MOFs to overcome inherent micropore limitations is important but challenging. On one hand, the introduction of POMs enhances the structural stability of MOFs and modifies their pores. However, the acidic nature of POMs has a substantial influence the nucleation and growth processes of POMs@MOFs composite materials. This strong acidity complicates the synthesis process and makes it challenging to precisely control the assembly. Therefore, researchers need to fully understand these acidic properties in order to better design and control the synthesis process of POMs@MOFs composite materials [52–54]. 2.3 MOFs-derived materials Since most MOFs materials have the characteristic of unstable framework structures, exposing them to acid, alkali, or heat conditions may lead to framework collapse, thereby limiting the prospects of MOFs applications [55]. Given the rich organic carbon and inorganic metal sources in MOFs, using MOFs as precursors or template agents is an effective preparation strategy that can prevent unexpected situations and improve the efficiency of material synthesis and the quality of products. Under pyrolysis in an inert gas atmosphere, MOFs materials can be transformed into stable carbon-based/carbon-nitrogen-based porous materials [56,57]. The materials prepared by this method could retain the high surface area of the original MOFs, as well as maintain the stability of the derived catalysts [58–62]. It is noteworthy that the pyrolysis temperature greatly impacts the final derived catalysts. 2.3.1 MOFs-derived carbon/carbon-nitrogen based materials Conventional nanoporous carbon materials often suffer from lower surface areas, disordered structures, and non-uniform pore sizes, limiting their practical use. However, using MOFs with low-boiling metal elements like zinc as sacrificial materials enables the synthesis of heteroatom-doped carbon-based catalysts through pyrolysis and acid treatment. This method preserves the original MOFs while converting organic linkers into carbon, yielding pure porous carbon without additional carbon carriers or pore-formers. There are two main approaches to preparing metal-free MOFs derived carbon: evaporating low-boiling metal ions during high-temperature pyrolysis or chemically etching metal ions post-pyrolysis. The resulting porous carbon matrix exhibits high surface area, uniform active site distribution, and excellent electrical conductivity, facilitating mass and electron transfer. By selecting suitable MOFs, in situ doping with heteroatoms (N, P, S, B) can be achieved, enhancing material properties. The structure and characteristics of MOFs derived carbon are influenced by factors such as composition, morphology, carbonization temperature, time, and atmosphere, all of which can be optimized to tailor the final material properties for specific applications [63–68]. 2.3.2 MOFs-derived metal, metal oxide, and/or metallic alloy incorporated carbon based catalysts Thermal decomposition of MOFs is an effective method for producing metal-carbon composite materials with uniform metal loading and strong metal-support interactions (SMSI) [69]. By calcining metal MOFs at high temperatures under inert atmospheres, various carbon-metal composites can be synthesized. During this process, metal ions can transform into NPs, metal oxides, or hybrid forms, while organic ligands convert into carbon matrices [70,71]. Heat-treated carbon composites maintain some of the original MOFs structure, exhibiting clear pores, high surface areas, and stability in chemical and thermal environments. MOFs made from metals like Al, Ti, and Mg typically yield metal oxide/carbon materials, whereas those with Co, Ni, and Fe produce metal-phase derivatives influenced by reduction potentials [72–75]. Low-temperature calcination in air can also generate metal/metal oxide carbon-based NPs [76–79]. Bimetallic MOFs, created from two different metal ions, enhance stability and catalytic performance due to strong metal-metal interactions. Researchers have explored several strategies to prepare multi-metal MOFs, including simultaneous mixing of metals and ligands, ion exchange reactions, and post-synthetic modifications, allowing for controlled chemical composition and improved functionality [80–84]. 2.3.3 MOFs-derived metal@CN, metal oxide, metal alloy@CN MOFs with controllable pore structures and adjustable compositions serve as excellent platforms for creating various functional nanomaterials. The incorporation of heteroatoms (such as N, P, B, and S) alters the electronic structure, enhancing catalytic activity [85,86]. This doping can introduce defects either directly by adding exogenous heteroatoms or by modifying functional groups to create intrinsic defects. Carbon atom defects can effectively adsorb and stabilize metal ions, resulting in improved dispersion and smaller metal particle sizes. Moreover, these defects modify charge distribution, influencing surface charge states and the adsorption of reactants [87–88]. During pyrolysis, nitrogen doping generates stable nitrogen positions within the carbon framework, such as pyrrole and graphitic nitrogen, leading to enhanced interactions with active components. This results in a larger surface area and increased chemical contact points. Nitrogen incorporation alters surface properties, enhancing electron interactions between the metal and the support, thus promoting electron transfer in catalytic systems. Specifically, nitrogen-rich carbon-supported metal catalysts (M/NC) are promising in heterogeneous catalysis, with ZIFs being ideal precursors for their design [89–95]. 3 Role of metals and ligands in MOFs for production of fine chemicals 3.1 Metals in MOFs for fine chemical production (1) Catalytic Activity Centers: Metals in MOFs often serve as the active sites for catalytic reactions. For example, in many MOFs, transition metals such as Zn, Cu, and Zr are used. In the production of fine chemicals, the metal nodes can act as Lewis acid (LA) sites. In the case of a Friedel-Crafts alkylation reaction, a metal-based MOFs with an appropriate metal center can activate the alkylating agent through coordination, facilitating the electrophilic substitution reaction on the aromatic ring. The metal center can polarize the bonds in the reactant molecules, making the reaction more favorable. Some metals in MOFs can also participate in redox reactions. For instance, in the catalytic oxidation of alcohols to aldehydes or ketones, a MOFs with a redox-active metal (like Mn or Fe) can provide the necessary electron - transfer pathway. The metal center can change its oxidation state during the reaction, accepting electrons from the alcohol and then transferring them to the oxidizing agent [96–98]. (2) Structural support and stability: Metals play a crucial role in maintaining the overall structure of MOFs. The coordination bonds between metals and ligands form the framework of MOFs. A well-coordinated metal-ligand network provides the MOFs with mechanical stability. For example, in a Zr-based MOFs, the zirconium ions form strong bonds with carboxylate ligands, creating a robust three-dimensional structure. This structural stability is essential for the MOFs to withstand the reaction conditions during the production of fine chemicals, such as high temperatures and pressures or the presence of solvents. The metal-ligand bonds also influence the porosity of MOFs. The size and shape of the pores in a MOFs are determined by the coordination geometry of the metals and ligands. In the synthesis of chiral fine chemicals, a MOFs with a specific pore size and shape can provide a chiral environment for the reaction, which is controlled by the metal-ligand architecture. The pores can selectively adsorb reactant molecules and guide the reaction stereochemistry [99,100]. 3.2 Ligands in MOFs for fine chemical production (1) Functional group introduction: Ligands in MOFs can introduce various functional groups that are directly involved in the production of fine chemicals. For example, ligands with carboxylic acid groups can participate in acid-base reactions. In esterification reactions, the carboxylic acid groups on the ligands can act as proton donors, catalyzing the reaction between alcohols and carboxylic acids to form esters. Ligands with amino groups can also play an important role. They can act as basic sites, for example, in the condensation reactions of aldehydes and amines to form imines. The amino groups on the ligands can interact with the carbonyl group of the aldehyde, promoting the nucleophilic addition reaction. (2) Modulating the chemical environment: Ligands can modulate the chemical environment around the metal centers. The electronic properties of ligands can affect the reactivity of the metal - based active sites. For example, ligands with electron-donating groups can increase the electron density around the metal center, making it more nucleophilic. In contrast, ligands with electron-withdrawing groups can make the metal center more electrophilic. This modulation of the metal center's reactivity can be exploited in the selective hydrogenation of unsaturated hydrocarbons. A MOFs with ligands that tune the metal center to have the appropriate electrophilicity can selectively hydrogenate double bonds over triple bonds, leading to the production of specific fine chemicals. Ligands also determine the hydrophobicity or hydrophilicity of the MOFs internal environment. In reactions involving water-sensitive reactants or products, a MOFs with hydrophobic ligands can protect the reaction from unwanted side reactions caused by water. On the other hand, in reactions that require aqueous media, hydrophilic ligands can facilitate the dissolution and transport of reactants in the MOFs pores [101–105]. 4 MOFs catalysts used for organocatalytic reactions and cascade organic reactions 4.1 Researches on a wide range of organic reactions and their cascade reactions Common organic reactions (e.g. hydrogenation, oxidation, condensation, as well as their cascade reactions) are of great significance in organic chemistry because they allow for the synthesis of a wide variety of compounds necessary for drug discovery, materials science, and many other applications. By understanding and utilizing these reactions, chemists can efficiently and selectively generate into complex molecules with specific properties and functions [106] (Fig. 4 ). 4.1.1 Applications of MOFs based catalysts in hydrogenation reactions MOFs based catalysts are increasingly being applied in the catalytic hydrogenation of various organic compounds, such as olefins, alkynes, alcohols, phenols, aldehydes, carboxylic acids, esters, and other compounds [107–109]. Currently, the main focus is on summarizing the hydrogenation of nitroarenes, furfural, alkynes, and phenol. 4.1.1.1 Hydrogenation of nitroarenes Aromatic amines, produced by reducing nitroarenes, serve as vital intermediates in fine chemicals, widely used in dyes, agrochemicals, and pharmaceuticals. They can be further hydrogenated to form heterocyclic amines, key raw materials for isocyanates and polyurethanes, enhancing their industrial value [110–115].Zhong et al. introduced a \"locking effect\" strategy for preparing locked MOFs. By modifying ZIF-90 with a long-chain diamine ligand through imine condensation, Au@L-ZIF-90 was created, where the imine chain stabilizes Au NP growth, preventing aggregation (Fig. 5 a). This optimized catalyst shows highly dispersed Au NPs (2.60 ± 0.81 nm, ∼22 wt% loading) and achieves excellent selectivity (99 %) and catalytic conversion (100 %) for nitroarene derivatives. The \"lock effect\" strategy is also applicable for other metal NPs (Ag, Co, etc.) (Fig. 5b) [116]. Li et al. advanced catalyst design by synthesizing an efficient LaOCl-supported Fe-Fe3C carbon-nitrogen catalyst, Fe-Fe3C-LaOCl/CN-hmta (Fig. 5c). The nitrogen-rich imine groups in La-salen MOFs facilitate the arrangement of metal ions, enhancing catalytic properties. After templated pyrolysis, this catalyst exhibited exceptional activity in nitroarene hydrogenation, achieving 99.8 % conversion and 98.5 % selectivity, outperforming other catalysts. The enhanced efficacy results from the synergistic effects of Fe-Fe3C active sites and LaOCl, which optimize electron transfer and stabilize intermediates [117]. Tang et al. developed a method to create \"defective MOFs\" precursors for crafting highly porous carbon (HPC)-supported catalysts with tunable secondary pore structures (Fig. 5d). By introducing Ni2+ ions into ZIF-67, which compete with Co2+ for coordination, they generated a coordination mismatch, leading to a \"defective structure.\" Adjusting the Ni2+ to Co2+ ratio allowed control over the HPC's secondary pore structure. The resulting HPCNi-ZIF catalyst features a hierarchical pore structure and exhibits exceptional performance in reducing aromatic nitro compounds, achieving 99.7 % conversion and 100 % selectivity [118]. Gao et al. developed a novel composite material, ZIF-8x@Pd@ZIF-8, which utilizes the unique crystalline facets of a ZIF-8 core to enhance the hydrogenation of halogenated nitrobenzene (Fig. 5e). These facets improve electron transfer between the ZIF-8 matrix and embedded Pd NPs, resulting in higher positive charge densities on the Pd compared to configurations like ZIF-8TRD@Pd@ZIF-8. This increased charge correlates with enhanced catalytic activity and selectivity for halogenated anilines by optimizing reactant orientation, effectively reducing -NO2 groups while minimizing side reactions [119]. 4.1.1.2 Hydrogenation of aldehydes The hydrogenation of furfural, derived from biomass, is crucial for biomass conversion and sustainable economy. This selective reaction produces furfuryl alcohol, vital for manufacturing crown ethers, adhesives, resins, and fuels. Its downstream product, 1,5-pentanediol, is also an important monomer for polyesters and pharmaceuticals [120–122].Yao et al. developed advanced nitrogen-doped carbon catalysts with a unique three-dimensional ordered macroporous hollow-wall structure, termed H-three-dimensional OM-Co/NC (Fig. 6 a). This innovative material is synthesized from a single-crystal ordered macropore precursor, ZIF-8@ZIF-67, preserving the interconnected macroporous structure through pyrolysis while transforming solid pore walls into hollow structures that host Co NPs. This architecture enhances mass transfer and accessibility of active sites, significantly improving catalytic activity for the selective hydrogenation of biomass-derived furfural to cyclopentanol (Fig. 6b). H-three-dimensional OM-Co/NC outperforms similar catalysts, showcasing its potential in biomass conversion and catalytic applications [123]. Yang et al. developed an efficient method for loading small Pt particles (<2 nm) onto various CeO2 types using atomic layer deposition (ALD). Utilizing MOFs-derived cerium dioxide (M-CeO2) enhanced the uniform deposition and interaction with Pt compared to C-CeO2. The resulting Pt/M-CeO2 exhibited superior catalytic performance, achieving 100 % furfural hydrogenation conversion and 98 % selectivity for furfuryl alcohol, demonstrating the advantages of this deposition approach for efficient hydrogenation processes (Fig. 6c) [124]. Golub et al. significantly advanced mixed-metal MOFs by introducing a one-step solvothermal synthesis for MOF-74. Their research focused on transforming metallic Co, Cu, and mixed compositions (CoxCu1-x) into carbon-supported metal catalysts. By adjusting pyrolysis temperatures and Co to Cu molar ratios (0.33 to 0.95 nm), they synthesized catalysts to optimize catalytic activity. Notably, catalysts pyrolyzed at ≥ 600 °C showed a more complete Cu shell, enhancing catalytic properties for selective hydrogenation. This optimization resulted in an impressive 89 % conversion rate in furfural hydrogenation to furfuryl alcohol [125]. Wu et al. have made significant advancements in catalytic chemistry by developing the modified material UIO-S0.6, which is derived from UIO-66 through the introduction of -SO3H (sulfonic acid) functional groups. This modification enhances the catalytic properties of UIO-66, allowing it to be effectively employed for the selective hydrogenation of furfural to furfuryl alcohol. The UIO-S0.6 catalyst demonstrates impressive catalytic performance, achieving a remarkable furfuryl alcohol yield of 94.7 % under mild reaction conditions. This high yield is accompanied by a low activation energy of 50.8 kJ·mol−1, indicating that the reaction can proceed efficiently with minimal energy input [126]. 4.1.1.3 Hydrogenation of alkynes The selective hydrogenation of alkynes to alkenes is crucial for the polymer, fine chemicals, and pharmaceutical industries. While homogeneous catalysts offer high conversion and selectivity, their irrecoverability limits use. Heterogeneous catalysts, advantageous for separation and recycling, are increasingly favored for this process [127–129].Ling et al. have advanced catalytic materials by introducing a strategy to merge lattice-mismatched MOFs, resulting in \"dual-MOFs\" that serve as precursors for metal nanoparticle@MOFs composites (MNPs@MOFs) with improved catalytic properties (Fig. 7 a). The HKUST1/ZIF-8 composite enables in situ generation of redox-active Cu NPs in ZIF-8′s hierarchical porous structure through controlled pyrolysis. This design not only supports Cu NP growth but also allows for size modulation, enhancing efficiency and specificity in converting alkynes to alkenes while preventing over-hydrogenation. The innovative Cu@ZIF-8 synthesis highlights the potential of MOFs in advanced catalysis and encourages exploration of other dual-MOFs systems [130].Li and colleagues have made significant advances in catalysis by developing a carbon-supported Ni catalyst with surface and subsurface sulfides, synthesized via a sacrificial MOFs method (Fig. 7b). This innovative approach introduces p-block S elements, enhancing catalyst characteristics and creating highly dispersed Ni sites (Niδ+). The Ni-S/C catalyst's unique composition significantly boosts catalytic performance, improving active site accessibility and electronic properties, leading to superior activity in alkyne hydrogenation. With a conversion rate of 91 % and olefin selectivity of 99 %, the catalyst benefits from structural Ni arrangement and sulfur's role in stabilizing intermediates and facilitating hydrogen transfer mechanisms [131]. Cai et al. contributed to catalyst development by synthesizing carbon-supported Co NPs (C/Co@C) through calcination of Co-MOF-74 at 1000 °C. This innovative catalyst features a protective carbon layer that enhances its selectivity for the semi-hydrogenation of aromatic compounds using sodium borohydride (NaBH4) as the hydrogen source. The graphite carbon acts as a \"one-way valve,\" allowing small borohydride anions to permeate while blocking larger aromatic molecules, thus preventing over-hydrogenation. This design maximizes productivity and highlights the importance of material design in developing selective catalysts, advancing hydrogenation chemistry and setting a foundation for future research [132]. Vasudeva investigated transfer hydrogenation in a non-aqueous medium using ammonia borane (NH3BH3) under both catalytic and non-catalytic conditions. To enhance this process, Pd NPs were immobilized on UiO-66(Hf) MOFs, positioning the μ3 OH groups close to the Pd sites. The synergistic interaction between the μ3 OH groups and the Pd active sites in the Pd/UiO-66(Hf) catalyst achieved over 98 % selectivity for styrene and complete conversion of phenylacetylene at room temperature, outperforming simple physical mixtures of Pd and UiO-66(Hf) or commercial Pd/C catalysts. Density functional theory (DFT) analysis revealed an asynchronous double-H-transfer mechanism from ammonia borane to phenylacetylene, identifying two six-membered cyclic transition states-TS1 (B–H⋯C/N–H⋯C*) and TS2 (B–H⋯C*/N–H⋯C) with free energy barriers of 32.6 kcal mol−1 and 33.4 kcal mol−1, respectively. The reaction is thermodynamically favorable by 43.6 kcal mol−1 (Fig. 7c) [133]. Li et al. developed the bimetallic nanoparticle composite CuPd@ZIF-8, featuring a cubic CuPd core within a porous ZIF-8 shell (Fig. 7d). This configuration stabilizes the core and enhances regioselectivity during catalytic reactions, significantly increasing hydrogenation efficiency when reacting with NH3BH3. The composite proved to be 5 to 105 times more efficient than existing catalysts, highlighting the potential of MOFs combined with bimetallic CuPd NPs for sustainable catalytic processes [134]. Separately, Liang et al. implemented coordination defect engineering in POMs based MOFs, creating three-dimensional frustrated Lewis pair (FLP) catalysts with enhanced performance in alkyne hydrogenation tests (Fig. 7e) [135]. 4.1.1.4 Other hydrogenation reactions Zhang and colleagues have made significant advances in catalyst development by synthesizing hierarchical flower-like nitrogen-doped carbon-coated bimetallic Ni-Co NPs (NixCo@NC@C) using ZIF-67 as a precursor (Fig. 8 a). This catalyst demonstrates superior performance compared to other Ni-Co variants, achieving 100 % selectivity for 2‑methoxy-4-methylphenol while completely converting vanillin, despite fewer exposed metal sites. This selectivity under mild conditions underscores the importance of metal composition and structural arrangement in catalysis [136]. Guo's team developed Cu@NC-ZrO2 catalysts from carbonizing the porphyrin MOFs PCN-222(Cu) at varied pyrolysis temperatures. Their findings show that the carbonization temperature critically influences the structure and catalytic properties. The standout Cu@NC-ZrO2–600 catalyst achieved a 95 % conversion rate in benzyl alcohol hydrogenation with 100 % selectivity, attributed to the synergistic interaction between Cu NPs and active Cu-Nx sites [137]. Yuan's work on Ni@C catalysts derived from defect-rich MOFs highlights the role of a thermally induced decarboxylation defect strategy (Fig. 8b). The Ni@DC-0.06 variant achieved a 95.2 % conversion rate and 97.2 % selectivity for aldehyde in the hydrogenation of nitrocyclohexane, demonstrating the significance of the interaction between defect-rich substrates and Ni NPs [138]. Ma's team synthesized multicomponent nanocatalysts by incorporating transition metals into ZrO2 frameworks via post-synthetic modification using Schiff base ligands (Fig. 8c). The Ni-ZrO2/NC catalyst achieved a remarkable 99.9 % conversion for methyl levulinic acid and 94.7 % selectivity for GVL, showcasing the synergistic relationship between Ni and ZrO2, which enhances the reaction pathway and facilitates intramolecular esterification. These innovative methodologies pave the way for designing highly efficient catalysts for various applications in organic transformations [139]. The catalytic performance comparison of various MOFs based catalysts for hydrogenation reactions has been conducted, as illustrated in Table 1 . Research indicates that ZIFs are more extensively studied, likely due to their straightforward preparation methods. ZIFs offer high surface areas and excellent porosity, enhancing ion transfer rates and improving catalytic efficiency. Among the catalysts examined, Au@La-ZIF-90 exhibits the best performance in hydrogenation reactions, characterized by low reaction temperatures and short reaction times, which can be attributed to the inclusion of the precious metal, gold. However, the scarcity and high cost of precious metals limit further research in this domain. In contrast, Ni and Co have been widely investigated as non-precious metal catalysts. Ni-based catalysts, recognized for their high intrinsic activity, low cost, and ease of generating active species, have been identified as optimal for numerous catalytic reactions. Some alloy catalysts demonstrate performance that rivals that of precious metals, highlighting the need to select efficient, abundant non-precious metal catalysts for selective hydrogenation. All MOFs based catalysts maintain good stability and recyclability during hydrogenation reactions. Notably, Au@La-ZIF-90 retains 89 % yield after 20 cycles, while others, such as CuPd@ZIF-8 and Ni-ZrO2/N-C, exhibit significant performance decline after just 3–5 cycles. This difference may be attributed to the inherent stability of ZIF-90 compared to ZIF-8 or the stronger polarity of the reaction medium, which can lead to the partial dissolution of some catalysts, thereby compromising their cycle performance. Additionally, comparisons with various solid catalysts reveal that while some achieve similar catalytic effects to MOFs based catalysts, others exhibit inferior recyclability. 4.1.2 Applications of MOFs based catalysts in oxidation reactions Organic oxidation reactions play a vital role in the synthesis of various organic compounds and is an important part in the field of organic chemistry. Organic oxidation reactions involve the transfer of electrons from the substrate molecule to the oxidizer, resulting in oxidation of the substrate [149,150]. 4.1.2.1 Oxidation of styrenes Aromatic organic compounds are common indoor air pollutants affecting human health. Styrene epoxidation is a key reaction that produces oxidized styrene, a vital intermediate used in various industries. Enhancing epoxystyrene selectivity in this reaction carries significant practical value [151–153]. Huang et al. integrated Ni and Cu salen into NH2−MIL-101(Cr) through a traditional solvent method (Fig. 9 a). The resultant Cu salen@NH2−MIL-101(Cr) displayed a well-defined porous structure and excellent catalytic activity in styrene oxidation, achieving a 99 % conversion rate and 90 % selectivity for phenylacetaldehyde; higher Cu salen content increased benzaldehyde production [154]. Hu et al. used a direct solvent thermal method to embed transition metal-single-substituted heteropolyacid compounds (TM-HPA) into UiO-66, resulting in TM-HPA@UiO-66 for styrene epoxidation with aldehydes. Notably, Co-HPA@UiO-66 exhibited remarkable catalytic activity, stability, and selectivity under mild conditions, with Co as the primary active site for aerobic epoxidation (Fig. 9b) [155]. Xiao et al. advanced heterogeneous catalysis by synthesizing ultra-thin 2D Cu-phthalocyanine MOFs-based nanosheets for styrene oxidation (Fig. 9c). The 2D Cu-TCPP nanosheets outperformed zinc-based counterparts and traditional crystalline forms, thanks to their high density of active sites and structural accessibility, facilitating efficient reactions. This study highlights the potential of 2D MOFs nanosheets for enhancing reaction efficiencies and selectivities across various catalytic applications [156]. 4.1.2.2 Oxidation of alcohols The conversion of alcohols to aldehydes and ketones is a critical transformation in organic synthesis. Aldehydes, which can be produced by oxidizing primary alcohols, occupy an intermediate oxidation state between alcohols and carboxylic acids. Therefore, selecting appropriate oxidants is essential to control the oxidation process and prevent over-oxidation to carboxylic acids. Secondary alcohols can yield ketones upon oxidation; however, excessive oxidation may lead to molecular cleavage. Additionally, while tertiary alcohol oxidation can result in the formation of ketones, it often involves cleavage and rearrangement reactions, limiting its practical application. Aldehydes and ketones are important compounds with widespread uses in daily life, industry, and scientific research. The rapid oxidation of alcohols serves as a convenient method for producing these valuable intermediates [157–161]. Li et al. have made significant advancements in catalyst development by creating the efficient Cu@UiO-67-BPY catalyst using a one-pot synthetic strategy. This method reduces both the time and solvent required, adhering to green chemistry principles. Their study focused on optimizing catalyst performance by testing different Cu precursors: CuCl2, Cu(OAc)2, and Cu(NO3)2. Notably, the catalyst synthesized from CuCl2 exhibited the best catalytic properties, achieving the highest conversion rates and selectivity for oxidizing alcohols to aldehydes and epoxidizing olefins. This emphasizes the importance of precursor selection in enhancing catalyst effectiveness and highlights the Cu@UiO-67-BPY framework's ability to facilitate selective oxidation processes. The implications of this work are significant for synthetic chemistry, particularly in the sustainable production of value-added compounds. Overall, this research lays the groundwork for developing catalysts that operate under milder conditions without compromising efficiency [162]. Hao et al. explored the innovative utilization of Ce-based MOFs as templates for synthesizing nitrogen-doped porous carbon-coated CeO2 (Fig. 10 a). This hierarchical architecture notably enhances catalytic activity for the selective oxidation of benzyl alcohol to benzaldehyde. Their studies, backed by DFT calculations, demonstrate that the nitrogen-doped carbon layers significantly improve benzyl alcohol adsorption on the CeO2 surface and reduce the activation energy for the catalytic reaction. The unique three-dimensional structure of the resulting CeO2@N-C ultrathin nanosheets increases accessible surface area and active sites, crucial for enhancing reaction rates and efficiency. Remarkably, this catalyst maintained its performance over five cycles, highlighting its cyclic stability. The findings suggest that engineered materials can be optimized for various catalytic applications, aligning with the ongoing pursuit of environmentally friendly synthetic methods [163]. Wang et al. contributed to the field of catalysis through their synthesis of isostructural mesoporous M-NU-1200 MOFs (where M denotes various metal cations: Zr, Hf, Ce, and Th), focusing on the oxidation of 4-methoxybenzyl alcohol using vanadium based catalysts (Fig. 10b). Their experimental results revealed a substantial difference in catalytic performance based on the choice of metal support, with V-Zr-NU-1200 exhibiting a 20-fold improvement in turnover frequency (TOF) over V-Ce-NU-1200. This study emphasizes the critical role of support material properties in catalytic efficiency. Furthermore, the research identified the electronegativity of metal supports as a crucial factor influencing catalytic activity, where higher electronegativity generally leads to improved interaction with active sites, affecting reactant adsorption and activation. The study's findings suggest that by strategically selecting support materials and optimizing their electronic properties, catalysts can be tailored for enhanced performance in specific reactions. This sets the stage for innovative approaches in catalyst engineering, promoting more efficient and selective processes in various chemical transformations (Fig. 10c) [164]. 4.1.2.3 Oxidation of cycloalkanes In chemical production, the catalytic oxidation of cycloalkanes is essential, generating compounds like cycloalkyl alcohols and ketones that act as crucial intermediates. For instance, the oxidation of cyclohexane yields cyclohexanol and cyclohexanone, which can be further oxidized to adipic acid, a precursor for Nylon-66 and Nylon-6. However, challenges such as low conversion rates and poor selectivity necessitate the optimization of cycloalkane oxidation processes to enhance catalytic efficiency [165–167]. Tang and colleagues conducted a comprehensive study on Zr-MOFs as supports for Fe3+ ions, aimed at enhancing catalytic properties for the photocatalytic oxidation of alkanes. They systematically explored various Zr-MOFs incorporating different secondary building units (SBUs) and pore sizes, characterizing their effectiveness in supporting iron ions (Fig. 11 a). Through post-synthetic metallation, Fe3+ ions were successfully integrated into distinct Zr-MOFs, each displaying a range of Zr-oxo structural units. The varying catalytic activities of the Fe3+-loaded MOFs stem from the interplay between the Zr-oxo units and the substrates and solvents, influencing alkane concentration within the MOF channels while pore size also affects catalytic efficiency. Notably, the MIL140-BPDC-Fe framework demonstrated exceptional photocatalytic performance for cyclohexane oxidation under visible light, achieving a turnover number (TON) of 6914, a conversion rate of 26.2 %, and an apparent quantum yield (AQY) of 5 %. This efficiency indicates the strong alkane oxidation activity of MIL140-BPDC-Fe and its potential in practical photocatalytic applications. The structural characteristics of these MOFs contribute insights into the relationship between molecular architecture and catalytic behavior, paving the way for designing more efficient photocatalysts for specific reactions and expanding the applicability of Zr-MOFs in catalysis [168]. In parallel, Shen and colleagues introduced a novel strategy utilizing catalytic oxidation with O2 to enhance selectivity and conversion rates of cycloalkanes into valuable alcohols and ketones. Employing metal porphyrins as effective catalysts and Zn(AcO)2 to facilitate the conversion of cycloalkyl hydroperoxides to cycloanols, this approach preserves selective outcomes while minimizing unwanted cycloanones (Fig. 11a). Through careful management of reaction conditions, the synthesis maximizes desired product yield and minimizes less useful byproducts. This methodology emphasizes the potential of metal-organic complexes for efficient chemical transformations under mild conditions, with implications for organic synthesis, pharmaceuticals, and industrial chemistry, ultimately contributing to greener and more sustainable processes [169]. 4.1.2.4 Other oxidation reactions Li et al. conducted a comparative study of MOFs, specifically MIL-101(Al) and MIL-101(Fe), for the immobilization of the active component H3PMo6W6O40. They incorporated Fe3O4 to impart magnetic properties, resulting in the catalyst Fe3O4@NH2−MIL-101-POM (Fig. 12 a). This catalyst was employed in the desulfurization of DBT using air as the oxidant. Notably, Fe@NH2−MIL-101(Fe)-POM achieved a remarkable conversion efficiency of 100 % within 60 mins, utilizing a smaller amount of catalyst and allowing for increased recycling cycles. This superior performance is attributed to the larger surface area of MIL-101(Fe), which facilitated the binding of more active components, enhancing their contact with DBT [170]. Sun and colleagues demonstrated a significant advancement in catalysis by using heterogeneous POMs integrated into MOFs for the direct aerobic iodination of arenes. The catalyst, PMoV2@MIL-101, was synthesized using a straightforward one-pot method, encapsulating POMs within the stable and highly porous MIL-101 framework. The PMoV2@MIL-101 catalyst achieved complete conversion of mesitylene to 2-iodomesitylene, with a reaction rate comparable to traditional homogeneous POMs systems (Fig. 12b). This illustrates the effectiveness of MOFs as supports for POMs in reactions typically requiring homogeneous catalysts. Notably, the iodination reactions occurred without the need for auxiliary catalysts or sacrificial agents, aligning with green chemistry principles to minimize waste and environmental impact [171]. Li and colleagues also synthesized symmetrical Th6−MOFs with various metal complex units and Th clusters for photocatalytic applications. Their research focused on the photocatalytic oxidation of methyl phenyl sulfide, revealing the enhanced control over conversion rates and selectivity provided by functional metal complexes (Fig. 12c-e). Among the synthesized frameworks, the Ni-PBA-Th6 catalyst exhibited an impressive conversion rate of approximately 99 % and a selectivity of 97 %, highlighting its practical value by favoring desired oxidative products. This work underscores the potential of Th6−MOFs in photocatalysis and paves the way for future studies in catalysis and related fields [172]. As shown in Table 2 , carboxylic acid-based oxidative MOFs based catalysts exhibit exceptional catalytic performance in organic oxidation reactions, thanks to their highly crystalline and tunable structures. The abundant active carboxyl groups on their surfaces serve as reactive sites that facilitate reaction progress. Notably, Zr-based MOF catalysts and MOFs encapsulating POMs have significantly enhanced catalytic oxidative performance. These catalysts demonstrate good activity, selectivity, and cyclic stability, leading to high efficiency in the oxidation of organic substrates. Furthermore, the tunable porous structure and surface functional groups of MOFs enable optimization of catalytic performance through structural adjustments, expanding their potential applications in organic oxidation reactions. In comparison to some solid catalysts, it is evident that most solid catalysts exhibit inferior cyclic stability when compared to MOFs based catalysts. MOFs based catalysts can maintain their performance after 4 to 15 cycles, while solid catalysts typically do not demonstrate comparable cyclic stability. This highlights the superior enduring nature of MOFs based catalysts in facilitating oxidation reactions over multiple cycles. 4.1.3 Applications of MOFs based catalysts in condensation reactions Condensation reaction (e.g. Knoevenagel, Adol, Friedlander) is the basic reaction of organic chemistry. With the demand for high-quality development in the field of chemistry and chemical engineering, the total synthesis of various fine chemicals, pharmaceutical products, functional polymers and various important drug intermediates can be prepared by condensation reaction [178]. 4.1.3.1 Knoevenagel condension reactions The Knoevenagel condensation reaction is a widely utilized method in organic synthesis, akin to the Aldol reaction, where a carbon atom accepts an alkyl group as a catalyst (Fig. 28). This reaction typically involves the direct interaction of an aldehyde with an active methylene compound, such as methanol or other methylating agents, under basic conditions, leading to the formation of unstable α,β-unsaturated carbonyl compounds. This reaction is crucial for synthesizing organic molecules that contain α,β-unsaturated carbonyl structures, which are important in drug and natural product synthesis [179,180]. Yang and colleagues synthesized several zinc-based MOFs through reactions between Zn2+ salts and amino acid derivatives, namely Val-X (where Val = N-(4-pyridylmethyl)-l-valine; X = Cl−, HCOO−, CH3COO−) and Ala-X (where Ala = N-(4-pyridylmethyl)-l-alanine; X = Cl−, HCOO−). The resulting pristine Zn-MOFs display a unique hexacoordinate structure, providing stable amine and carboxylic acid sites. These Zn-MOFs were employed as heterogeneous catalysts for Knoevenagel condensation reactions with a variety of aldehydes, exhibiting high catalytic activity under mild conditions (Fig. 13 a). Specifically, when utilizing a water-to-ethanol volume ratio of 1:1 at room temperature, five Zn-MOFs based on pyridine amino acid derivatives achieved high yields of up to 96 % in these reactions [180]. Zhang et al. contributed significantly to catalyst development by designing a nitro-functionalized organic ligand, H3TNBTB, which led to the synthesis of a robust cobalt MOFs, named (NUC-82a) (Fig. 13b). This framework features a tri-nuclear cobalt cluster as a secondary building unit, distinguished by a rich array of Lewis basic (LB) sites, essential for catalytic activity. NUC-82 demonstrates exceptional efficiency in catalyzing Knoevenagel condensation reactions, particularly between aldehydes and malononitrile, highlighting its potential for practical applications. Furthermore, NUC-82 exhibits high selectivity and outstanding recyclability, allowing for effective reuse without significant activity loss, making it practical for synthetic processes. Zhang et al.'s work emphasizes the potential of nitro-functionalized ligands in designing effective catalytic frameworks, marking NUC-82 as a promising candidate for sustainable catalysis in future applications [181]. Liu et al. unveiled a highly durable microporous framework, denoted as {(Me2NH2)2[Pb5K(TDP)2(μ2 OH)]·4DMF·6H2O}n (NUC-45). Synthesized by combining an S-shaped heterometallic cluster with the organic ligand H6TDP (1,3,5-tri(carboxy)benzene), NUC-45 is structured around unique lead-cluster and potassium cation-based secondary building units. This framework's well-defined porosity and LA sites, alongside basic sites introduced by μ2 OH groups, contribute to its reactivity and functional capability. NUC-45 has shown remarkable catalytic efficacy in two key reactions: the cycloaddition of epoxides with CO2 and the Knoevenagel condensation of aldehydes with malononitrile (Fig. 13c), indicating its potential application in CO2 conversion and organic synthesis, both critical for sustainable chemistry. The incorporation of K+ ions enhances the stability and catalytic performance of MOFs, reinforcing NUC-45′s effectiveness in these reactions [182]. Zhang et al. also explored the synthesis of a hybrid material, [Cu2(BPPP)2]{θ-[Mo8O26]} (NUC-62), using a self-assembly approach that merges electron-rich POMs with electron-deficient MOFs. This hybrid material exhibits significant physicochemical stability and ample coordination sites, contributing to its catalytic capabilities. NUC-62 displays outstanding activity in promoting Knoevenagel condensation reactions, highlighting the effectiveness of its open metal sites and abundant terminal oxygen atoms (Fig. 13d). The open metal sites facilitate substrate activation, enhancing the catalytic process of forming carbon-carbon (C-C) bonds. This research underlines the significant role of material design in advancing catalysis, furthering the potential applications of MOFs and hybrid materials in sustainable chemistry [183]. 4.1.3.2 Aldol condension reactions The aldol reaction, commonly known as aldol condensation or hydroxide aldehyde condensation, is vital in organic chemistry, particularly for synthesizing complex molecules. This reaction produces a new CC bond by linking two carbonyl compounds, yielding β‑hydroxy aldehydes or β‑hydroxy ketones. When subjected to heat, these compounds often dehydrate to form α-unsaturated carbonyl compounds. Aldol reactions can be categorized into self-condensation, where identical carbonyl compounds react, and crossed condensation, involving different carbonyl compounds. This versatility allows for diverse synthesis pathways for β‑hydroxy compounds, such as 1,3-propanediol and 1,3-butanediol, which are useful in producing fragrances, pharmaceuticals, and polymers. The condensation products derived from α,β-unsaturated aldehydes can be oxidized to yield carboxylic acids, key raw materials in the fine chemical industry. Selective hydrogenation of α,β-unsaturated aldehydes can also yield saturated aldehydes, widely used in solvents, detergents, and plasticizers. Thus, leveraging the aldol reaction enhances organic synthesis while facilitating the production of essential chemicals across various industries. In summary, the aldol reaction offers numerous pathways to construct complex molecules from smaller carbonyl precursors, serving as a fundamental reaction in both academic research and industrial applications [184,185]. Zhu et al. innovatively fabricated MOFs integrating amino acid-derived chiral moieties. Utilizing acidic modulators to control the cavity size of Zr-UiO-66-NH2, they anchored the amino acid-thiourea motif within these cavities, achieving high yields that significantly enhanced catalytic activity and enantioselectivity. The mild reaction conditions minimized the racemization risk during thiourea formation, preserving chirality integrity. The Zr-UiO-66-NHCS-Pro catalyst demonstrated exceptional performance in the asymmetric aldol reaction using 4-nitrobenzaldehyde and acetone, achieving notable enantioselectivities. Zhu et al. reinforced the need to tailor MOFs pore sizes to optimize catalytic environments, confirming that adjusted cavity dimensions enhance catalyst activity and selectivity. Their findings pave the way for future innovations in chiral catalysis by illustrating the relationship between MOFs structure, reaction conditions, and catalytic efficacy [186]. Chen et al. developed a mixed truncation method to synthesize defect-engineered chiral MOFs with hierarchical micro/mesoporous structures. This strategy produced defect chiral MOFs, specifically DCCuBTC-0.6, achieving the highest enantiomeric excess (ee) of 56.5 % in aldol condensation reactions (Fig. 14 a). Their results highlighted the significant impact of pore size on chiral MOFs efficacy; larger pore volumes enhance the flexibility of chiral active molecules, facilitating efficient chirality transfer to reactants and improving selectivity. Defect chiral MOFs exhibited superior enantioselectivity compared to conventional microporous MOFs, mainly due to their larger pore volumes providing greater spatial freedom for chiral configurations [187].Cesar et al. conducted a comprehensive study on monometallic and bimetallic UiO-66 nanocatalysts, utilizing solvothermal synthesis. These nanocatalysts were evaluated for their performance in aldol condensation reactions involving benzaldehyde and acetone (Fig. 14b). Bimetallic UiO-66 catalysts containing Zr and Hf displayed a synergistic effect that enhanced reaction rates, attributed to these metals' complementary electronic and structural properties, achieving yields of 97.9 % for benzalacetone. In contrast, bimetallic catalysts with Zr and Ce exhibited reduced activity due to free carboxylic acid formation during synthesis. Overall, these findings underscore the importance of metal selection and interactions in catalyst performance, highlighting Hf's beneficial role in Zr-UiO-66 for efficient cross-coupling condensation reactions [188]. Ghaedrahmat et al. explored the synthesis of composite materials by integrating Faujasite-type zeolite with ZIF-8 MOFs, enhancing ZIF-8′s chemical stability. They utilized environmentally friendly methods at room temperature to create Faujasite zeolite/ZIF-8 nanocomposites exhibiting high acidity and refined microstructures essential for catalytic applications. These composites demonstrated impressive stability and catalytic performance, achieving over 90 % yields in esterification and aldol condensation reactions under solvent-free conditions. Their findings indicate that these composites maintain catalytic activity over multiple cycles, positioning them as viable options for sustainable industrial processes [189]. 4.1.3.3 Friedlander condension reactions The Friedlander condensation, also known as Friedlander quinoline synthesis, is essential for synthesizing quinoline compounds, which are significant in developing anticancer drugs. Quinoline compounds exhibit therapeutic effects through mechanisms such as cell cycle arrest, apoptosis, angiogenesis inhibition, and regulation of growth inhibitors. They also find applications in dye production, photosensitive materials, rubber, solvents, and chemical reagents [190,191]. Subhrajyoti et al. reported on UiO-66(Hf)-(NHCOMe)2 (1) and its activated form (1′). This UiO-66 framework is formed by coordinating Hf4+ ions with 2,5-diacetamidoterephthalate linkers, creating a structure where the central Hf4+ ion coordinates with multiple µ3 O and µ3 OH sites. The activated catalyst 1′ was effective in the Friedlander condensation of phenacylamine and acetylacetone, achieving an 86 % yield of the product 1-(2,4-dimethylquinolin-3-yl)ethan-1-one. The purification process involved solvent exchange to remove impurities, ensuring the catalyst's effectiveness in yielding quinoline derivatives in quantitative yields under mild conditions [192]. Aniruddha et al. developed a hydrazine-functionalized Hf-UiO-66 (Hf-UiO-66-N2H3) using a solvent-thermal method, enhancing catalytic activity. The activated form 1′ exhibited a remarkable 95 % yield of 3-acetyl-2,4-dimethylquinoline in the Friedlander condensation at 100 °C with 2-aminoacetophenone and acetylacetone. Comparatively, hydrazine-functionalized MOFs (1′) outperformed other functionalized and non-functionalized MOFs due to additional Brønsted acidic sites, which facilitate proton transfer and increase substrate reactivity. This study highlights the significance of tailoring functional groups to enhance catalytic performance in organic transformations [193]. 4.1.3.4 Other condension reactions Fu et al. synthesized six distinct nanomaterials by combining MNPs with MOFs to create core-shell structures, subsequently introducing amino groups through post-synthesis modification (PSM). This study is notable for the first-time exploration of MNPs/MOFs core-shell structures as catalysts in the condensation reaction between benzaldehyde and 1-heptanal, where the amino functional groups significantly improved catalytic yield. The γ-Fe2O3-AA/Al-MOF-A catalyst demonstrated advantages over traditional homogeneous KOH catalysts, including shorter reaction times, environmental friendliness, and recyclability. Future work will involve further examination of MNPs/MOFs core-shell materials and comprehensive comparisons with various traditional catalysts [194]. Neumann et al. focused on the one-step synthesis of Guerbet alcohols from linear alcohol precursors using MOFs-derived RuCo alloys as catalysts (Fig. 15 a). Their research showcased significant turnover rates for the Guerbet reaction with 1-propanol, 1-butanol, and 1-pentanol, using a highly reactive catalyst produced in situ by impregnating MFU-1 MOFs with Ru. The study highlighted the selectivity of the MOFs-derived catalyst, with RuNi NPs favoring the production of linear alcohols, especially 1-butanol (Fig. 15b). The catalytic performance was enhanced by incorporating Na2O2 or K3PO4 as promoters, while infrared spectroscopy revealed modifications in the electronic environment of Ru in the MOFs matrix that may contribute to altered catalytic activity [195]. Pattraporn et al. advanced the synthesis of 5,7-dihydroxy-4-methyl-coumarin using sulfonic acid-functionalized MOFs (UiO-66-SO3H) as catalysts. Their findings indicated that UiO-66-SO3H markedly reduced the activation energy for the Pechmann condensation reaction to 12.6 kcal.mol−1, compared to 22.6 kcal.mol−1 for standard UiO-66, emphasizing the effectiveness of sulfonic acid groups in enhancing catalytic efficiency under milder conditions, beneficial for green chemistry [196].Neumann et al. also demonstrated the efficiency of a MOFs derived RuCo catalyst for converting 1-butanol into 2-ethylhexanol, an important plasticizer, by utilizing air-stable pre-catalysts and replacing NaOBu with K3PO4 to improve yields and minimize unwanted byproducts (Fig. 15c) [197]. MOFs as catalysts have shown promising prospects in various common condensation reactions. In this study, we compared the MOFs-based catalysts used in the condensation reactions (Table 3 ). It was observed that MOFs based catalysts with LA or LB sites are more effective in catalyzing Knoevenagel condensation reactions. NUC-82a, NUC-45a, NUC-62, and ValZnCl, which possess abundant LA and LB sites, maintained good catalytic activity. In the table, two sets of data showed lower yields, possibly due to current limitations in the exploration of Guerbet alcohols. Although the conversion rate in the reactions is good, selectivity is always accompanied by the production of other by-products. Dc-CuBTC-0.6, a chiral MOFs, achieved a conversion rate of only 66.5 % at low temperatures, but with an ee value as high as 56.5 %. 4.1.4 Applications of MOFs based catalysts in cross-coupling reactions The activation of C-X bonds in aryl halides (ArX) plays a crucial role in organic synthesis. Coupling reactions are essential pathways in organic chemistry for efficiently constructing C-C, C-N, and C-S bonds, facilitating key reactions such as the Suzuki reaction, the Wurtz reaction, and the Heck reaction. Coupling products like C-C and C-N bonds, along with their intermediates, dominate industrial production and hold significant application potential in various fields such as pharmaceuticals, fertilizers, and chemicals. Here, we primarily discuss the Suzuki-Miyaura coupling reactions, Heck coupling reactions, and Sonogashira coupling reactions [207–209]. 4.1.4.1 Suzuki-Miyaura cross-coupling reactions In 1979, A. Suzuki and N. Miyaura reported a pivotal reaction involving 1-alkenylboranes and aryl halides, catalyzed by a Pd catalyst, leading to the formation of aryl-substituted (E)-alkenes. This reaction, later termed the Suzuki coupling reaction, allows for the cross-coupling of aryl or alkenyl boron compounds, such as boronic acid esters, with halides or triflate esters under Pd catalysis. The Suzuki coupling reaction has solidified its position as one of the most effective methodologies for synthesizing diaryl compounds, demonstrating remarkable substrate adaptability. It is widely employed for the synthesis of polyenes, styrenes, and biphenyl derivatives, further extending its application to the synthesis of numerous natural products and organic materials [210,211]. Recent advancements in this field include Mohammadniai's development of a copper-based catalyst, wherein Cu is immobilized on the MOF 2-(5-aminopyrimidin-2-yl)pyrimidin-5-amine (CuAPPA·2H2O)n. This innovative catalyst offers several advantages such as straightforward preparation, easy separation, environmental friendliness, high yields, and good reversibility. When employed in Suzuki reactions for synthesizing aryl compounds, the (CuAPPA·2H2O)n catalyst delivered yields of up to 96 % of biphenyl under mild conditions, with a minor decline to 91 % after four cycles [212]. Liu and colleagues achieved notable progress by synthesizing novel Schiff base imidazole-functionalized MOFs using PSM methods (Fig. 16 a). They successfully anchored small Pd0 clusters (averaging 1.5 nm) onto the MOFs, resulting in the Pd0@UIO-66-SB-Im catalyst, which demonstrated exceptional catalytic performance in Suzuki coupling reactions between halobenzenes and phenylboronic acids, achieving yields exceeding 99 % under mild conditions. The small size of the Pd0 clusters enhanced catalytic activity by increasing their surface area, while the MOFs' tailored design facilitated the stabilization and distribution of these clusters, optimizing catalytic performance through controlled electronic properties. This catalyst showcased high substrate compatibility and maintained its yield across six cycles, where it consistently achieved 99 % yields. Liu's work exemplifies how functionalized MOFs can be strategically designed to improve catalytic efficacy and sustainability in Suzuki coupling reactions [213]. Daniele Cartagenova introduced the innovative Pd P-MOFs, a molecularly defined heterogeneous catalyst framework based on phosphine MOFs. This catalyst demonstrated remarkable performance in Suzuki reactions under mild conditions, exhibiting selectivity that surpassed that of traditional homogeneous catalysts like Pd(PPh3)4. The enhanced selectivity of Pd P-MOFs indicates potential for cleaner reaction profiles with reduced byproducts and yields around 65 %. Its versatility enabled effective catalysis across various substrates, facilitating coupling reactions involving diverse aryl and vinyl halides with boronic acids, thus broadening access to valuable biaryl and complex organic compounds. This work emphasizes the potential of leveraging unique materials for improved catalytic performance [214].Eugenia and her team contributed significantly to catalysis with the introduction of Pd2+ centers into the MOFs MUV-22 through a solvent-assisted reaction using a Pd-metalloligand. The ordered arrangement of Pd atoms within MUV-22 and its high chemical stability positions it as a promising catalyst for Suzuki-Miyaura alkylation reactions (Fig. 16b). The MUV-22 catalyst effectively facilitated C-C bond formation between a variety of boronates and allyl bromides, showcasing versatility and efficiency while maintaining activity over multiple cycles without losing crystallinity. This resilience is crucial in heterogeneous catalysis, where deactivation is a common issue. The potential for MUV-22 to open new avenues in heterogeneous catalysis aligns with the goals of sustainability and efficiency in synthetic chemistry [215]. Wu and colleagues developed an innovative catalyst featuring highly dispersed Pd nanoclusters anchored on nanostructured Pd@HfO2. This catalyst, synthesized through a two-step pyrolysis process with Hf-based MOFs, demonstrated exceptional efficiency in the Suzuki-Miyaura cross-coupling reaction, achieving over 99 % catalytic activity with bromobenzene and phenylboronic acid. The Pd@HfO2 catalyst exhibited remarkable stability, maintaining catalytic performance across at least ten cycles, benefiting from the formation of ultra-small Pd nanoclusters and optimal acidic sites in the HfO2 support. The reaction mechanism was detailed into four major steps involving oxidative addition, ions substitution, transmetalation, and reductive elimination, reaffirming the structural integrity of the catalyst as confirmed by XRD analysis (Fig. 16c-d). Wu's research highlights the advantages of nanostructured catalysts in achieving sustainable and efficient catalytic processes. These advancements collectively underscore the significant progress in utilizing functionalized MOFs and Pd-based catalysts to enhance the efficiency and sustainability of Suzuki coupling reactions, paving the way for future innovations in organic synthesis and catalysis [216]. 4.1.4.2 Heck cross-coupling reactions The Heck reaction is one of the most prominent methods for forming C-C bonds in organic chemistry. This reaction allows for the synthesis of substituted alkenes through the coupling of olefins with aryl or vinyl halides (or triflates) under basic conditions. It is characterized by high regioselectivity and stereospecificity, showcasing versatility in accommodating various substrates, including simple olefins, aryl-substituted olefins, electrophilic olefins, and N-allyl amides. Its significance extends across organic synthesis, pharmaceuticals, agrochemicals, and materials science, making it a valuable strategy for producing functionalized alkenes through transition metal catalysis, particularly utilizing Pd, Cu, and Ni [217–220]. Hassan Keypour and his team advanced the field by synthesizing functionalized MOFs embedded with Pd NPs, leading to the creation of UMCM-1-NH2-furfural-Pd. This innovative material was synthesized through a series of well-defined steps, which included the PSM of UMCM-1-NH2, an amino-functionalized MOFs. Furfural was grafted onto the MOFs framework via a Schiff base reaction, allowing for the stable complexation of Pd2+. The characterized UMCM-1-NH2-furfural-Pd demonstrated exceptional catalytic activity in both Suzuki and Heck coupling reactions, which are critical for forming C-C bonds. The high surface area of the MOFs provided ample active sites for Pd NPs, enhancing catalyst accessibility. Additionally, interactions between the LA sites generated by the Zn nodes of the MOFs and the Pd2+ ions stabilized the Pd NPs while increasing their reactivity. Keypour's research highlights the potential of combining MOFs chemistry with targeted functionalization to create high-performance catalysts for complex organic transformations, paving the way for future exploration of advanced catalytic systems [221]. Dang and colleagues synthesized a novel Pd-incorporated Zr-based MOFs, designated as Pd(II)@BUT-11, by dispersing sulfonyl-functionalized MOFs in a Pd(OAc)2 solution. This catalyst effectively facilitates Suzuki coupling reactions between styrene and iodobenzene-a common pairing in biaryl compound synthesis and pharmaceutical production. Notably, the use of a deep eutectic solvent (DES) derived from 1,4-diazabicyclooctane further enhanced the reaction's efficiency. DESs are viewed as environmentally friendly solvents, offering low toxicity and high solvating capacity while promoting reactions by increasing yield and efficiency. The Pd(II)@BUT-11 catalyst exemplified recyclability, maintaining performance over five cycles, which aligns with sustainable chemistry principles by reducing waste. The use of a DES also minimized reliance on traditional organic solvents, positioning Dang's work as a significant advance in sustainable catalytic processes within organic synthesis [222]. Zheng and colleagues focused on enhancing catalytic performance by creating a dipolar microenvironment within a MOFs structure by incorporating DMF fragments (Fig. 17 a). The modified MIL-101-DMF exhibited solvent characteristics similar to DMF, which has implications for catalytic applications. By embedding Pd NPs within this structured framework, referred to as Pd@MIL-101-DMF, the researchers effectively improved Heck reaction outcomes in low-polarity solvents. Traditional Heck reactions can struggle with efficiency in non-polar environments; however, the dipolar microenvironment stabilized transition states and intermediates, resulting in a catalytic efficiency increase. The yield of ethyl cinnamate reached 90 %, demonstrating the enhancements attributable to the specially engineered MOFs (Fig. 17b) [223]. Wu and colleagues developed the Pd/MIL-101-PPh3 catalyst by integrating MOFs technology with covalent ligand attachment. By anchoring PPh3 ligands to the MIL-101 framework-a MOFs recognized for its high surface area and tunable pore structure—they successfully immobilized Pd NPs onto the MOFs surface. Rigorous evaluations, including spectral analyses and DFT calculations, demonstrated that the PPh3 ligands increased the electron density of the Pd NPs, facilitating the activation of carbon-halogen bonds in aryl halides. The catalyst performed exceptionally well in multiple catalytic transformations, outperforming several benchmark catalysts in Suzuki-Miyaura and Heck reactions (Fig. 17c). This work underscores the potential of integrating MOFs with covalent ligand chemistry to create high-performance catalysts for essential organic transformations [224]. Srinivasulu and colleagues synthesized a novel Cu-MOFs, which was subsequently transformed into an efficient heterogeneous catalyst (Pd-MOF) through a post-synthesis method. The modified Pd-MOFs exhibited considerable catalytic activity in C-C bond formation by cleaving C-N bonds in arylhydrazines. Analysis revealed the presence of two distinct Pd2+ environments within the MOFs framework-a tetrahedral site coordinated by pypz ligands and a square planar site interacting with di-pyrazole nitrogen atoms and chloride ions (Fig. 17d). Investigating the porous characteristics of both Cu-MOFs and Pd-MOFs indicated promising adsorption capacities, marking advances in the development of effective solid-state catalysts for C-C couplings (Fig. 17e) [225]. These collective efforts illustrate the ongoing innovation in the design and application of MOFs in catalysis, particularly in enhancing efficiencies and sustainability in C-C coupling reactions. The integration of various modifications and strategies not only improves catalytic performance but also aligns with green chemistry principles, paving the way for the future potential of MOFs in diverse catalytic applications. 4.1.4.3 Sonogashira cross-coupling reactions The Sonogashira coupling reaction is a critical cross-coupling method involving organic halides and terminal alkynes, which are significant in synthesizing pharmaceuticals, natural products, and materials. This reaction, first demonstrated by Professor Sonogashira, effectively creates substituted alkynes from aryl, heteroaryl, and vinyl halides, with iodine and bromine-substituted hydrocarbons showing the highest reactivity. Typically catalyzed by Pd and Cu in a basic amine solvent, the Sonogashira reaction has become a fundamental tool in organic synthesis [226–229]. Recent advancements in this field include Esmaeil and colleagues' development of a heterogeneous Pd catalyst system, Pd-NHC-MIL-101(Cr), immobilized on MOFs modified with N-heterocyclic carbene. This catalyst demonstrated excellent performance in Cu-free Sonogashira reactions, achieving a 94 % yield of 1,2-diphenylethyne under mild conditions, with 89 % efficiency maintained over six cycles. The robust stability of this catalyst was confirmed by minimal Pd and Cr leaching [230]. Shirin Karimi and colleagues introduced supported noble metal catalysts, Au and Pd, on an iron-based MOFs modified with an ionic liquid. The Pd@Fe-MOF-IL catalyst achieved a remarkable 96 % yield of 1,2-diphenylethyne at low Pd loading, demonstrating the potential of this approach in the Sonogashira-Hagihara reaction [231]. Marzieh synthesized a novel magnetic Ni-based MOFs catalyst featuring a core-shell-triple-layer structure that provided high efficiency and low Ni leaching in Sonogashira reactions under solvent-free and microwave-assisted conditions [232]. Huang and colleagues developed a stable bimetallic Pd/Cu catalyst using a novel in situ method to form Pd@HKUST-1@Cu(II)/CMC composite microspheres. This catalyst displayed exceptional efficiency in typical and decarboxylated Sonogashira reactions, offering high yields and reusability, highlighting the synergy of MOFs and biocompatible materials for sustainable and economical catalytic processes [233]. 4.1.4.4 Other cross-coupling reactions MOFs have demonstrated remarkable potential as catalysts in significant coupling reactions such as Suzuki-Miyaura, Heck, Sonogashira, Ullmann, Buchwald-Hartwig, and Chan-Lam reactions. Their high surface areas, tunable pore sizes, and modifiable functionalities make them attractive for these applications. However, recent literature indicates a decline in reports focused on MOFs based catalysts, with a pivot toward other homogeneous and heterogeneous catalysts. This trend may be attributed to the growing appreciation for the efficiency and specificity of highly selective homogeneous catalysts, which often operate under milder conditions and are easier to optimize. Conversely, heterogeneous catalysts are preferred for their ease of separation, recyclability, and suitability for continuous processing, making them more appealing for industrial use. Both types of catalysts, however, present challenges. Homogeneous catalysts often face difficulties in separation and recycling, leading to higher costs and environmental concerns. Heterogeneous catalysts, while easier to reuse, can encounter issues such as mass transfer limitations and reduced active site accessibility. To address these drawbacks, the catalytic community is increasingly interested in developing novel systems that combine the strengths of both homogeneous and heterogeneous catalysis.Promising strategies include; 1. Hybrid catalysts: These utilize both homogeneous and heterogeneous components to leverage the selectivity of homogeneous reactions while maintaining the recyclability of heterogeneous systems. 2. Supported catalysts: MOFs can serve as supports for homogeneous catalysts, allowing for easier recovery without compromising performance. 3. Smart catalysts: Catalysts engineered with stimuli-responsive features can transition between homogeneous and heterogeneous states to optimize reaction conditions and efficiency. 4. Covalently immobilized catalysts: The covalent attachment of homogeneous catalysts to solid supports can enhance stability, longevity, and separation ease. Research exemplifying the innovative use of MOFs includes Hojat Veisi's work on a heterogeneous nanocomposite catalyst that integrates copper Cu NPs within biguanidine-modified Zr-UiO-66 MOFs. This approach utilized a covalent immobilization method via PSM, ensuring effective binding and stability. The resulting nanocatalyst facilitated critical cross-coupling reactions, such as the Buchwald-Hartwig and Ullmann-type C-O reactions, under mild conditions with high yields [234]. Additionally, Wang et al. examined Au and Pd NPs supported on ZIF-8 for Ullmann-type aryl iodide homocoupling reactions, identifying that Pd@ZIF-8 outperformed Au@ZIF-8, showcasing the effectiveness of the metal in facilitating biaryl compound synthesis [235]. Majid Rouzifar and colleagues developed a Co-based MOFs catalyst, Fe-MIL-101-isatin-Schiff-base-Co, demonstrating impressive catalytic efficiency in several cross-coupling reactions, including Ullmann-type and Hiyama reactions. This marks a pioneering effort to employ MOFs effectively in complex chemical transformations, highlighting their versatility as tunable catalysts [236]. Overall, the adaptation of MOFs for diverse catalytic processes showcases their significant prospects in advancing important chemical reactions while adhering to the principles of green chemistry and sustainable practices. As illustrated in Table 4 , a comparison of various catalysts for coupling reactions reveals that supported noble Pd catalysts have garnered significant attention. Pd is renowned for its high activity and stability, making it a central focus of research. In contrast, lead-based catalysts may also exhibit promising performance. By adjusting the types of ligands and the oxidation states of lead, a variety of catalysts can be designed, expanding their potential applications. Research on MIL-101 is particularly noteworthy due to its structural properties, which include active LA sites that contribute to its outstanding catalytic performance. The ongoing investigation into diverse catalysts holds great promise for uncovering more efficient options for coupling reactions, thereby advancing the field of organic synthesis. Table 4 summarizes the stability of various catalysts used in coupling reactions, indicating that most achieve cycle performances exceeding five times, signifying good stability. Notably, the Pd@ZIF-8 catalyst experiences a significant yield decrease from 100 % to 85 % after just one cycle, likely due to the low recovery rate of the ZIF-8-derived nanocatalyst. Additionally, Table 4 presents a range of solid catalysts utilized in coupling reactions, further highlighting the diversity and potential of these catalytic systems. 4.1.5 Other types of organic reactions 4.1.5.1 Cycloaddition of CO2 and epoxides reactions The catalytic fixation of CO2 into high-value chemicals presents a promising approach for reducing emissions and generating useful products. Among various strategies, the reaction of CO2 with epoxides is particularly valued due to its 100 % atom efficiency and the ability to produce industrially important cyclic carbonates. Numerous carbon-based catalysts featuring atomically dispersed metal sites (such as Zn, Al, Co, and Cu) have been extensively studied for CO2 cycloaddition reactions, aiming to enhance sustainability and reduce CO2 levels [245–252]. Qiao et al. introduced an innovative function-oriented synthesis (FOS) approach to create two new MOFs, JLU-MOF116 and JLU-MOF117. This method facilitated the incorporation of specific catalytic sites-LA sites, Brønsted basic sites, and hydrogen-bonding donors-by strategically assembling indium oxide clusters with amide-based ligands. The resulting MOFs exhibited exceptional catalytic activity for CO2 fixation with epoxides under mild conditions, underscoring the effectiveness of the FOS approach in optimizing catalytic performance by enhancing the structural features of MOFs for targeted applications [253]. Chen et al. proposed a novel pyrolysis-oxidation strategy to generate ordered mesoporous derivatives from MOFs, converting OM-Ce MOFs into an OM-CeO2@C composite (Fig. 18 a). By incorporating zirconium into OM-CeO2, the catalytic performance for CO2 fixation was significantly improved, achieving over 16 times higher activity compared to solid CeO2. This research demonstrates the ability to leverage MOFs' flexibility to create eco-friendly catalytic systems, enhancing CO2 conversion efficiency through a well-defined reaction mechanism that promotes the formation of cyclic carbonates. Overall, these studies highlight the potential of MOFs in advancing CO2 valorization and developing sustainable chemical processes (Fig. 18b) [254]. Duan et al. developed a one-step synthetic method to simultaneously functionalize and dope ZIF-8 with NH2 and Fe to enhance its Lewis acidic and basic properties for improved CO2 adsorption and cycloaddition reactions with epichlorohydrin under solvent-free, mild conditions (0.1 MPa and 80 °C) (Fig. 19 a). The resulting Fe-ZIF-8-NH2 exhibited a CO2 adsorption capacity of 63 mmol·g−1, significantly higher than the 18 mmol·g−1 of pristine ZIF-8. This enhancement is attributed to the introduction of -NH2 groups and iron doping, which increased the material's Lewis acidity and basicity. Additionally, Fe-ZIF-8-NH2 achieved a yield of 92 % in CO2 cycloaddition, outperforming Fe-ZIF-8 (80 %), ZIF-8-NH2 (62 %), and pristine ZIF-8 (40 %), while also demonstrating excellent chemical stability and recyclability [255]. Wang et al. synthesized isomorphic nanoporous frameworks, termed NUC-110, by combining [Ln2(COO)7(H2O)2] clusters with a multifunctional ligand under acidic solvothermal conditions (Fig. 19b). The NUC-110 series shows exceptional stability and a significant void volume with abundant LA -base sites, facilitating the addition of CO2 to epoxides with just 0.10 mol % of NUC-110Gd, achieving a TOF of 162 h−1 at 65 °C and 1 atm. This study also provides insights into the reaction mechanism involving the polarization of reactants and nucleophilic attacks, leading to the production of cyclic carbonates while maintaining catalyst efficacy (Fig. 19b) [256]. 4.1.5.2 N-alkylation reactions N-alkylation reactions are essential in chemical synthesis, facilitating the transfer of alkyl groups and forming CN bonds, which are crucial in the production of N-containing compounds for pharmaceuticals and industrial applications. Traditional methods for N-alkylation include the Hoffmann and Buchwald-Hartwig reactions, which are valuable tools in organic synthesis [257,258]. Antonio et al. explored the catalytic performance of mixed Zr-Ce-based MOFs with amino-functionalized linkers in two reactions: aerobic photooxidation of benzylic alcohols and direct microwave-activated N-alkylation of amines with alcohols. Their findings revealed that both Zr and ZrCe-MOFs acted as effective visible-light-driven photocatalysts, demonstrating exceptional stability and recyclability. These MOFs selectively produced either imines or secondary amines in the N-alkylation reaction [259]. Yuan et al. fabricated ultrathin Ni-Fe-MOFs nanosheets, significantly enhancing catalytic efficiency in N-alkylation reactions. Incorporating palladium NPs onto these nanosheets improved performance by leveraging the high surface area and catalytic properties of Pd. This visible-light-driven method contributes to more sustainable approaches in organic synthesis [260]. Li et al. developed a Ru@UiO-66-NH2 composite through a simple impregnation-reduction method, enhancing the stability and accessibility of Ru NPs for the precise N-alkylation of o-phenylenediamines with benzyl alcohols. This work underscores the potential of MOFs supported metal NPs as highly effective catalysts, offering pathways for advanced catalytic systems that minimize side product formation while enhancing efficiency in various synthetic applications [261]. 4.1.5.3 Hydroformylation reactions Hydroformylation is an atom-efficient reaction that produces aldehydes with elongated carbon chains through the reaction of olefins with syngas (CO/H2), achieving 100 % atom economy by directly generating aldehydes in a single step. The aldehydes obtained can subsequently serve as precursors for a range of chemical intermediates, including alcohols, amines, and carboxylic acids, all of which are essential in industries such as detergents, surfactants, and polymer plasticizers. While homogeneous catalytic hydroformylation has matured, challenges like complex ligand synthesis, poor thermal stability, and high energy costs for separation have driven the exploration of heterogeneous catalysis. Typically, Rh and Co are used as catalysts, with Rh being more developed; however, its scarcity and high cost are problematic. In contrast, cobalt, significantly cheaper, demonstrates strong CO activation and C-C coupling abilities, positioning it as a potential alternative to Rh [26–264]. Sun et al. synthesized Zr-MOFs with tunable pore sizes (6 to 18 Å), creating structures like Rh@UiO-66 and Rh@MOF-808 as supports for Rh catalysts. Their investigation into the catalytic performance of these Zr-MOFs in hydroformylation of n-alkenes revealed that variations in pore size and architecture significantly influenced catalytic activity and product selectivity. The results indicated that larger pores enhanced diffusion and accessibility for reactants, underlining the importance of optimizing MOFs characteristics for improved catalytic performance [265]. Samanta et al. innovatively integrated molecular catalysts into a heterogeneous system using carboxylate ligand substitution to introduce phosphine groups into the MOF-808 framework. This method preserved the sensitive phosphine functionalities and enabled the coordination of rhodium complexes, achieving the immobilization of organometallic P-Rh(CO) catalysts. Their findings demonstrated remarkable selectivity in the conversion of ethylene to propionaldehyde, crucial for industrial applications, and operated within a triphasic batch system, enhancing catalyst recovery and reusability. This approach combines the benefits of heterogeneous and homogeneous catalysis, showcasing the potential of MOFs to facilitate efficient and selective organic transformations [266]. Dou et al. advanced MOFs development by creating the Rh-PCM-18 model, incorporating phosphine ligands similar to traditional rhodium-phosphine catalysts. By modifying these ligands with various functional groups to alter their electronic properties, they aimed to enhance catalytic performance. Their study focused on five distinct models, evaluating the binding energies of reactants and their reaction pathways. They found a direct relationship between the ligands' electronic properties and catalytic performance; enhancing the electron-donating ability of ligands improved CO and H2 adsorption but increased the energy barrier for initial reaction steps. Conversely, reducing this capacity lowered adsorption but enhanced catalytic efficiency. The research elucidated how the electronic characteristics of phosphine ligands influence the catalytic activity, particularly in 1-butene hydroformylation. These insights provide a strategic direction for optimizing the performance of MOFs as catalysts in hydroformylation processes, advancing efficiency and selectivity in industrial applications [267]. 4.2 Progress of MOFs based materials used in cascade reactions Cascade catalysis presents both opportunities and challenges by enabling multiple independent reactions in a single process, which saves time and reduces waste. Researchers are increasingly focusing on \"one-pot\" cascade reactions that require catalysts with spatially distinct active sites, allowing them to function independently yet synergistically. Although theoretical adjustments can optimize these reactions, practical execution remains challenging due to the complexity of fine-tuning catalyst compositions and active site proportions [268–278] (Fig. 20 ). 4.2.1 Hydrogenation-alkylation cascade reaction Cheng et al. investigated the modification of ligand structures, employing 2-methylimidazole to adjust the crystal size, morphology, and structure of Fe-MOFs. Pd was introduced using double solvent impregnation, followed by calcination under nitrogen, yielding \"quasi-MOFs\" that maintained the original Fe-MOFs morphology (Fig. 21 a). These quasi-MOFs were utilized as photocatalysts, achieving one-step hydrogenation and N-alkylation of nitrobenzenes and benzonitriles with yields of N-benzylaniline up to 85 %. The photoreduction of Pd significantly enhanced catalytic activity, influenced by factors such as crystal dimensions, shapes, and modifications to the Fe-MOFs. This study emphasizes the critical role of structural modifications in boosting photocatalytic efficiency, presenting quasi-MOFs as a promising platform for sustainable synthetic methodologies [279]. She et al. synthesized Cu/Zn bimetallic MOFs using adenine as an organic linker through a straightforward solvent thermal method, facilitating the construction of complex structures for catalytic applications. They developed Cu catalysts supported on ZnO and nitrogen-doped carbon via a one-pot pyrolysis process, resulting in Cu-ZnO/NC-BMOFs. These catalysts were rigorously tested in hydrogenation-amination cascade reactions, achieving yields of N-benzylaniline up to 85 %. The study showcases the advantages of bimetallic MOFs in creating efficient catalysts, with adenine enhancing structural integrity and active site accessibility (Fig. 21b). The catalytic performance of Cu-ZnO/NC-BMOFs was compared to traditional Cu/ZnO/NC-IWI catalysts, revealing a remarkable 97.8 % conversion rate for nitrobenzene with 27.8 % selectivity for N-benzylaniline, in stark contrast to the 49.6 % conversion and 10.9 % selectivity of the conventional catalyst (Fig. 21c). This disparity underscores the efficacy of the one-pot pyrolysis technique in enhancing catalytic performance and selectivity for sequential transformations. XRD analysis confirmed the successful formation of the bimetallic composition, with distinct peaks for metallic Cu and zinc oxide, further establishing the structural attributes of the Cu-ZnO/NC-BMOFs as advantageous for catalytic applications (Fig. 21d) [280]. Li et al. developed a novel solid-solution confined NiCo alloy catalyst, named NiCo/MgOC, characterized by a unique banana-like morphology achieved through a self-templating method involving the controlled pyrolysis of Ni-Co-Mg tri-metallic MOFs (Fig. 21e). SEM analysis confirmed the catalyst's morphology, which features a rough surface with a high density of closely packed NPs, enhancing its performance in cascade reactions (Fig. 21f-h). This catalyst demonstrated a remarkable yield of N-benzylaniline reaching 98.6 %, maintaining performance over seven cycles (Fig. 21i-j). The rational design of the catalyst structure optimized active sites and stability, significantly improving catalytic efficacy. Overall, these studies highlight the effective use of advanced materials and methods in catalyst design, paving the way for more efficient and sustainable synthetic processes in organic chemistry [281]. 4.2.2 Hydrogenation-formylation cascade reaction Qin and colleagues developed a novel core-shell heterogeneous catalyst, ZIF-67-on-UiO-66, using a surfactant-assisted method. The process involved seeding ZIF-8 crystal nuclei onto UiO-66, followed by controllable growth of a ZIF-67 shell. Pyrolysis of this structure produced a mesoporous derivative, ZrO2/C@x-Co-NC, with a core-shell distribution of ZrO2 and Co NPs (Fig. 22 a). The optimal ZrO2/C@1.0-Co-NC catalyst achieved a remarkable yield of 99.5 % N-(4-methoxypheny)formamide in a one-pot cascade reaction of 4-nitroanisole and CO2, outperforming other catalysts (Fig. 22b). Notably, no by-products were detected, indicating high selectivity. The core-shell architecture enhances catalytic performance by improving the synergy between hydrogenation-active Co NPs and Lewis acidic ZrO2, optimizing electronic properties, and reducing diffusion distances for intermediates. This study advances catalysis and offers insights into efficient CO2 utilization in organic synthesis (Fig. 22c-d). The benefits of employing bifunctional ZrO2/C@x-Co-NC catalysts were contrasted against physically mixed counterparts, highlighting substantially improved performance due to the synergistic effects within the core-shell architecture (Fig. 22e). Based on these findings and insights from existing literature, the authors proposed a plausible catalytic mechanism for the one-pot cascade reaction involving nitroarenes and CO2 fixation. The unique core-shell structure, which integrates hydrogenation-active Co NPs and Lewis acidic ZrO2 NPs, plays a pivotal role in enhancing catalytic performance by reducing the diffusion distance of intermediates, optimizing the electronic properties of the catalytic sites, and significantly improving the synergy between these components during the hydrogenation and N-methylation reactions of nitroarenes (Fig. 22f) [282]. 4.2.3 Hydrogenation-crosscoupling cascade reaction Cai and colleagues achieved a significant advancement in catalysis through the in-situ synthesis of a bimetallic catalyst featuring a core-shell structure, termed Co-C@Cu-C. This innovative catalyst was created by pyrolyzing a composite of Co-MOF-74@Cu-MOF-74, which effectively integrated Co and Cu MOFs into a singular structure. The resulting bimetallic Co-C@Cu-C catalyst is characterized by Co NPs encased within carbon-supported Cu NPs, showcasing a unique core-shell configuration that enhances catalytic performance. The synergy between the Cu and Co NPs in the Co-C@Cu-C catalyst plays a crucial role in facilitating the sequential conversion of phenylacetylene to 1,4-diphenyl-1,3-butadiene. Specifically, the Cu NPs act as active sites for the alkyne coupling reaction, while the Co NPs are responsible for hydrogenation reactions. Furthermore, the study suggests that by modifying the reaction conditions and employing more effective reducing agents, the reaction rates for both coupling and hydrogenation may be significantly enhanced. This optimization could lead to a highly selective transformation of phenylacetylene into 1,4-diphenyl-1,3-butadiene, showcasing the potential of bimetallic catalysts in promoting efficient and selective organic reactions. Overall, this research highlights the promise of core-shell structured bimetallic catalysts in advancing synthetic methodologies in organic chemistry [283]. 4.2.4 Oxidation-condensation cascade reaction Cheng et al. made significant strides in catalysis by developing bifunctional catalysts that integrate dual metal alloy NPs into chiral MOFs. They utilized the stable NH2-UiO-66 framework, introducing chiral proline by coordinating it with Zn nodes (Fig. 23 a). The encapsulation of small AuPd alloy NPs, with Au-to-Pd ratios of 3:1 and 1:3, was achieved using the \"bottle-around-ship\" method, facilitating effective NP integration within the MOFs porous structure. The resulting bifunctional catalysts demonstrated impressive oxidation capabilities in cascade reactions, achieving yields of up to 93 % and enantiomeric excess values of 91 %. This work highlights the potential of combining chiral MOFs with metal alloy NPs for efficient organic transformations, marking a notable advancement in sustainable catalytic systems [284]. In parallel, Sun and colleagues developed the bifunctional heterogeneous catalyst PMoV2@DETA-MIL-101 using a novel double-solvent method, successfully encapsulating the heteropolyacid H5PMo10V2O40 (PMoV2) within the alkylamine-modified MIL-101 framework. PMoV2@DETA-MIL-101 exhibited exceptional catalytic performance, achieving 99 % conversion of alcohols in a selective aerobic oxidation-Knoevenagel one-pot reaction (Fig. 23b). This innovative approach eliminates the need for additional additives, promoting a sustainable and cost-effective catalytic process, and underscores the potential of noble-metal-free catalysts for efficient organic transformations [285]. Majid Rouzifar and colleagues have significantly advanced the field of MOFs by synthesizing a novel mixed-linker Fe-based MOFs, {Fe(INA)(H2N-BDC)}, using a hydrothermal method that directly combines isonicotinic acid (INA) and aminobenzoic acid (NH2-BDC). This multifunctional bio-photocatalyst excels in the synthesis of triphenylpyridine (TAPs) via cascade photo-oxidation condensation reactions carried out under sunlight and in an air atmosphere, utilizing ethanol as a solvent. The catalyst achieves a yield of 87 % under mild conditions, thanks to enhanced interactions between the two linkers that boost catalytic efficacy. This MOFs outperforms counterparts using single ligands due to the synergistic effects from the coexistence of both linkers and Fe-oxygen clusters, resulting in a more effective electronic structure and reduced band gap, advantageous for photocatalysis. These findings highlight the potential of mixed-linker strategies in tailoring MOF properties and enhancing their applicability in sustainable catalysis and green chemistry [286]. In parallel, Zan et al. explored surface-oxidized Cu NPs supported on ZIF-8 crystals, demonstrating remarkable catalytic activity for benzyl alcohol oxidation. The catalysts, {Cu/ZIF-8(H2)}, were created by impregnating ZIF-8 with Cu precursors, then reducing Cu2+ ions to Cu NPs, followed by oxidation under ambient conditions. The integration of Cu NPs within the ZIF-8′s microporous structure provided exceptional stability and allowed for selective catalysis based on substrate size. The catalytic sequence involved oxidizing benzyl alcohol to benzaldehyde, followed by its transformation into benzylidene malononitrile via a Knoevenagel condensation facilitated by DMAP and imidazolate linkers. This innovative approach not only showcases selective catalysis but also suggests promising applications in organic synthesis with minimal environmental impact [287]. 4.2.5 Oxidation-cross-coupling cascade reaction Fan and colleagues have made significant advancements in the field of photocatalysis through the molecular engineering of multifunctional MOLs. With a precise thickness of approximately 2 nm and a lateral width of 200 nm, these MOLs are designed to enhance sustainable cascade and synergistic photocatalytic reactions. The researchers achieved this by carefully selecting monocarboxylic acid modifiers to create three distinct photosensitizing MOLs. These initial MOLs were then further enhanced with two cobaloxime catalysts, culminating in a diverse portfolio of six distinct MOLs tailored for photoredox dual Co catalysis. This systematic approach allowed for the exploration of varying structural and functional characteristics. Through extensive screening of these MOLs, the team identified the Hf-Ir-Co-PPA catalyst as the most effective variant for facilitating both cascade dehydrogenative reactions and synergistic Heck-type coupling reactions. Its superior performance is attributed to its ability to facilitate cross-coupling reactions across a broad spectrum of substrates, showcasing its versatility and efficiency in promoting desired chemical transformations. The significance of this work lies in its contribution to the development of photocatalysts that enable sustainable and efficient chemical processes. The integration of multifunctional metal-organic layers with dual-catalytic properties not only enhances reaction efficiencies but also promotes the utilization of renewable resources, aligning with green chemistry principles. This research highlights the potential of meticulously engineered MOLs in expanding the toolkit for photocatalysis, paving the way for innovative applications in organic synthesis and beyond. The insights gained from this study could inspire further explorations into the design of multifunctional catalysts that harness light energy for various transformative chemical processes, ultimately leading to more sustainable industrial practices [288]. 4.2.6 Oxidation-cycloaddition cascade reaction Han et al. achieved remarkable progress in catalysis by developing a cascade catalytic system for converting CO2 into enantiomerically pure cyclic carbonates (Fig. 24 a). This innovative system utilizes a chiral pyrrolidine moiety as an organocatalyst, coupled with POMs, allowing for the effective immobilization and activation of CO2. The strategic arrangement of multiple catalytic sites within a single framework facilitates the interaction of CO2 with both pyrrolidine and amine groups, enhancing the overall catalytic activity through cooperative processes. This spatial coordination allows for a seamless transition between reaction steps, eliminating the need for multiple workup stages and streamlining the synthesis of cyclic carbonates with high enantioselectivity. The use of readily available and cost-effective reagents not only enhances the sustainability of the approach but also makes it suitable for industrial applications. Given the urgency of carbon capture and utilization technologies, this strategy holds promise for producing homochiral materials from CO2, addressing environmental concerns while advancing the field of organocatalysis and carbon dioxide valorization [289]. In a parallel development, Wang and colleagues introduced carbon-based catalysts featuring atomically dispersed dual-metal sites (ADD-Fe-Al) that dramatically enhance catalytic efficiency in cascade oxidative carboxylation reactions of olefins, such as styrene. The synergistic effects observed between the dispersed Fe and Al sites boosted catalytic performance to 99 %, exceeding the activity of monometallic catalysts (Fig. 24b). Kinetic studies reveal that the Al sites notably accelerate the consumption of styrene oxide, driving the overall oxidation rate and favorably shifting the reaction equilibrium towards olefin epoxidation. This dual-site mechanism is transformative, indicating that effective active site configuration plays a crucial role in improving selectivity and efficiency for producing valuable chemicals like cyclic carbonates [290]. Yu et al. also made significant contributions with a new methodology for synthesizing two-dimensional Ni-based MOFs nanosheets, specifically NiBDC NS and NiBDCNH2 NS, using a straightforward reflux approach (Fig. 24c). These nanosheets demonstrated excellent performance in the one-pot catalytic synthesis of cyclic carbonates from olefins and CO2 under mild conditions (80 °C, 1 bar, 12 h). The catalyst showed impressive stability over six cycles, with an 85 % conversion rate and 70 % selectivity for styrene carbonate. Enhanced catalytic efficiency is attributed to the high exposure of active sites and improved transport channels within the nanosheets that facilitate reactant movement. Interestingly, amino groups in NiBDCNH2 NS exhibit contrasting effects: they hinder epoxidation by promoting the adsorption of oxidized styrene, while aiding CO2 activation during cycloaddition. These results reveal a 95 % conversion rate of styrene and an 87 % yield of styrene carbonate, surpassing many previously reported catalysts (Fig. 24d). This highlights the complexity of catalyst design and the importance of optimizing structural features for enhanced catalytic performance. Collectively, these studies illustrate the potential of MOFs-based catalysts in green chemistry, emphasizing the need for further exploration to maximize their applications in sustainable processes [291]. 4.2.7 Cross-coupling condensation cascade reaction Cheng and colleagues made significant strides in asymmetric catalysis by developing two novel chiral bifunctional heterogeneous catalysts, Pd@NH2-UiO-66(pro)−1 and Pd@NH2-UiO-66(pro)−2, specifically engineered for asymmetric cascade reactions. These catalysts integrate Pd NPs and chiral proline into the NH2-UiO-66 framework using an innovative \"bottle-around-ship\" methodology, which effectively stabilizes the metal NPs while preserving the structural integrity of the MOFs. Chiral proline was incorporated through a process known as PSM that facilitates interactions with Zr nodes and organic linkers, resulting in bifunctional catalysts capable of promoting both reactivity and enantioselectivity. The catalysts exhibited remarkable efficiency in asymmetric aldol reactions, achieving yields of 94 to 99.9 % and enantioselectivity levels from 57 to 97 %. This represents the first successful application of a multifunctional catalyst combining metal NPs and chiral MOFs for asymmetric cascade reactions, highlighting the synergistic effect of the two components [292]. In another study, Cheng et al. developed a three-functional chiral catalyst featuring a CuCo alloy, PdCl2, and l-proline integrated within the stable UiO-67 structure. Utilizing the \"bottle-around-ship\" method, they encapsulated CuCo NPs, ensuring stability while manipulating PdCl2 to form a bipyridine-based ligand. l-proline was coordinated with zirconium clusters in UiO-67, providing chirality and enhancing selectivity in asymmetric reactions. This trifunctional catalyst facilitated a three-step sequential process for the asymmetric oxidation of aromatic alcohols, yielding 95, 96, and 72 % in the respective reactions, with an enantiomeric excess of 73 % in the aldol condensation. A notable discovery was the \"substance spillover\" phenomenon, enhancing the catalytic performance through efficient transfer of reactive species. These studies underscore the potential of multifunctional catalysts to enable complex reactions, paving the way for advanced chiral catalysts in organic synthesis, particularly within the pharmaceutical industry [293]. 4.2.8 Condensation-hydrogenation cascade reaction Huang and colleagues have made a remarkable contribution to the field of catalysis through the development of a dual-functional catalyst, Pt/CN-ZrO2, which facilitates the efficient one-step production of α-alkylated nitriles. This catalyst capitalizes on the synergistic integration of Pt NPs with a composite support made from nitrogen-doped carbon and ZrO2, derived from NH2-functionalized MOFs. The architecture of the Pt/CN-ZrO2 catalyst is strategically designed to cater to the requirements of a one-step cascade reaction that combines Knoevenagel condensation with hydrogenation. The basic sites provided by the N-doped carbon structure are essential for promoting the condensation reaction, while the noble metal sites from the Pt NPs facilitate the subsequent hydrogenation step. This dual functionality significantly enhances the efficiency of the overall reaction mechanism. Remarkably, the Pt/CN-ZrO2 catalyst achieved over 99 % conversion of benzaldehyde and maintained an impressive selectivity of over 99 % towards the desired product, 2-(phenylmethyl)-propanedinitrile, when tested at 80 °C under 1 MPa H2 for a duration of 6 h These results underscore the catalyst's exceptional performance, showcasing its ability to catalyze both reaction steps efficiently in a single operational setting. When compared with a range of control catalysts-including Pt supported on traditional carbon, nitrogen-doped carbon, Al2O3, SiO2, and ZrO2, the Pt/CN-ZrO2 composite demonstrated marked superiority. This enhancement in catalytic performance can be attributed to the unique properties of the N-doped carbon support, which not only provides additional active sites but also influences the electronic properties of the Pt NPs, ultimately contributing to more efficient reaction dynamics [294]. The implications of Huang and colleagues' work are significant, as it presents a powerful example of how hybrid catalyst systems can be engineered to meet the demands of complex synthetic pathways. The dual-functional nature of Pt/CN-ZrO2 not only streamlines the synthetic process but also represents a promising approach for the sustainable production of valuable organic compounds, particularly in the realm of fine chemicals and pharmaceuticals. This study highlights the potential for further innovations in catalyst design, with multi-functional materials paving the way for enhanced efficiencies in various chemical transformations. 4.2.9 Condensation-oxidation cascade reaction He and colleagues proposed a \"cluster instability\" strategy, where a yolk-shell Zr/Ce-UiO-66 structure (YSS) was initially prepared. Subsequently, the yolk-shell structure underwent acid treatment and heat treatment to obtain single-shell hollow structures (SSHS) and double-shell hollow structures (DSHS) respectively (Fig. 25 a). YSS, SSHS, and DSHS were individually utilized in the cascade reaction for quinoxalinone synthesis and photocatalytic oxidation of cyclohexane. In the cascade reaction for quinoxalinone synthesis, YSS exhibited a higher content of active species Ce4+, leading to the formation of the cyclized product dihydroquinoxalinone. SSHS, due to its lower content of Ce4+, could selectively produce the imine compound with high efficiency (Fig. 25b). In the cyclohexane oxidation reaction, the unique Ce2Zr2O7 in DSHS determined the high conversion rate and selectivity towards cyclohexanol (Fig. 25c), whereas YSS tended to form cyclohexanone as the product [295]. 4.2.10 Other cascade reactions Zhao and colleagues have advanced the field of catalytic materials by employing an in-situ growth method to synthesize chitosan (CS)-coated MOFs NPs. This innovative approach leverages the well-known properties of MIL-101(Cr), a type of MOFs, in conjunction with the natural biopolymer chitosan, resulting in a composite with exceptional characteristics such as chemical stability, thermal stability, and recyclability-maintaining strong catalytic performance even after five cycles. The structure of the CS-coated MOFs features a stable MIL-101(Cr) core, recognized for its LA sites, while the chitosan layer adds Brønsted acid sites and Lewis base sites. This unique configuration fosters synergistic interactions, effectively harnessing the catalytic properties of both components. The resulting MIL-101(Cr)@CS composite exhibited remarkable catalytic activity, achieving 99 % yield in a one-pot cascade reaction that includes deacetylation followed by Knoevenagel condensation. The complementary roles of the LA sites from the MIL-101(Cr) core and the dual functionalities of the CS shell significantly enhance the catalytic process by creating a versatile reaction environment. This research exemplifies the potential of hybrid materials in catalysis, highlighting how the integration of biopolymers with robust MOFs frameworks can yield stable and efficient catalysts, opening new avenues for biopolymer-MOFs composites in various catalytic and environmental applications [296]. Similarly, Qi and team achieved a significant milestone in dual-functional catalyst development with the creation of the core-shell UiO-66@SNW-1 hybrid material. This groundbreaking catalyst embodies both LA and Brønsted base sites, offering enhanced performance in a one-pot cascade reaction involving dealcoholization and Knoevenagel condensation, which is crucial for organic synthesis, achieving a yield of 99.6 % for 2-benzylidenemalononitrile. The core-shell structure facilitates spatial isolation of opposing acid-base sites, crucial for preventing unwanted side reactions while maximizing the efficiency of each site in the catalytic process. With its large surface area, the UiO-66@SNW-1 hybrid material effectively capitalizes on the versatility of its active sites, promoting efficient reactant interactions. The hybrid also displays impressive chemical and thermal stability, remaining intact after 48 h of solvent immersion, highlighting its durability for practical applications in heterogeneous catalysis. The efficiency of the UiO-66@SNW-1 in catalyzing dealcoholization and Knoevenagel condensation reactions underscores its potential in organic synthesis and broader applications in pharmaceuticals, agrochemicals, and materials science. This study emphasizes how strategic dual-functional catalyst design can enhance reaction efficiencies, paving the way for a new generation of sustainable catalytic systems [297].In another notable work, Dang and colleagues focused on Fe3+-based catalysts, designing MOFs that incorporate triangular Fe3+ clusters with various carboxylate-based organic linkers. Their efforts led to the development of efficient catalysts that align with green chemistry principles. A standout feature of these Fe3+ MOFs is their capability of facilitating solvent-free, one-pot reactions for synthesizing quinazolin-4-ones from 2-aminobenzamide and alcohols under microwave irradiation. This method significantly boosts catalytic efficiency by minimizing solvent use, reducing waste, and lowering the environmental impact of chemical synthesis. The synthesized Fe-MOFs exhibit a range of structural diversity, from microporous to mesoporous, improving insights into their catalytic behavior. Notably, MOF-907 emerged as a leader due to its spacious pores and one-dimensional channel structure, offering ample active sites for enhanced substrate accessibility. Remarkably, MOF-907 demonstrated consistent catalytic effectiveness across various substrates, allowing for multiple reuse cycles without significant activity loss, emphasizing its practicality for industrial applications focused on sustainability and efficiency [298]. As highlighted in recent studies, the application of MOFs based catalysts in organic cascade reactions greatly enhances reaction activity, selectivity, and efficiency. The tunable crystal structure and surface properties of MOFs enable precise control over catalytic performance by adjusting ligands, metal ions, pore structure, and surface functionalization. This flexibility in design allows for the optimization of MOFs based catalysts for specific organic cascade reactions while minimizing side reactions and maximizing efficiency. Despite the promising capabilities of MOFs based catalysts, research remains limited, requiring extensive exploration and technical expertise for suitable and efficient development. As research continues to progress, breakthroughs in MOFs based catalysts are anticipated, enhancing the field of organic synthesis. Overall, the potential of MOFs-based catalysts in organic cascade reactions is significant, contributing to effective and controllable synthetic processes (Table 5 ). 5 Conclusions and outlook This review provided a comprehensive summary of commonly used MOFs based materials and their applications in organic reactions, specifically discussing their role in cascade reactions. Different MOFs-based catalysts can be selected according to different types of reactions. On the one hand, pristine MOFs, composite MOFs, and their derived catalysts can be selected according to the characteristics of various organic reactions. For example, in nitrobenzene hydrogenation reaction, derived catalysts are generally selected, and the catalytic effect of metal Ni is better. In addition, it is also possible to determine which type of MOFs-based catalyst to choose according to reaction conditions and solubility. For example, derived catalysts are generally selected when the polarity of the reaction solvent or raw material is particularly strong, while the high solubility of pristine MOFs and composite MOFs is not suitable for such reactions. Composite MOFs and their derived catalysts are generally selected when the polarity of the reaction solvent or raw material is strong. When the polarity of the reaction solvent or raw material is generally strong, three MOFs-based catalysts can generally be selected. So far, MOFs have shown significant potential in catalyzing organic reactions due to their unique structure, which effectively combines the advantages of homogeneous and heterogeneous catalysts, high stability, and recyclability. Especially in organic cascade reactions, the advantages of MOFs catalysts are particularly prominent. Some potential advantages include: (1) Controllability: The structure of MOFs can be controlled through rational design and synthesis to meet the requirements of different organic cascade reactions. Optimization of reaction activity and selectivity can be achieved by adjusting the combination of metal centers and organic ligands; (2) High selectivity: Due to the controllable pore size and chemical environment of MOFs, selective adsorption and conversion of reactants can be achieved, thereby enhancing product selectivity, especially significant in complex molecule cascade reactions; (3) High catalytic activity: The active sites formed by the metal centers and organic ligands in the structure of MOFs can provide high catalytic activity, accelerating the progress of organic cascade reactions; (4) Reusability: MOFs catalysts typically exhibit good recyclability and thermal stability, allowing multiple uses without deactivation, thus reducing catalyst waste and costs. Nevertheless, MOFs-based catalysts also have certain limitations in organic catalytic reactions, specifically: (1) The complexity of designing active sites, as they require meticulous design for efficient catalysis, posing challenges in controlling catalyst structure and design; (2) limitations in reaction conditions, as certain MOFs only exhibit catalytic activity under specific conditions, imposing high requirements on condition selection and restricting their application in a wide range of catalytic reactions; (3) Constraints on molecular diffusion, as the dense structure of MOFs hinders molecular diffusion within them, potentially influencing reaction rates and catalytic efficiency; (4) The influence of organic compounds, as these substances may compete for adsorption with MOFs catalysts, affecting catalytic activity and stability. Despite these challenges, researchers continuously explore optimization strategies, such as synthesizing specific MOFs structures and introducing functional groups to regulate active sites, as well as adjust the pyrolysis conditions, to enhance performance in organic catalysis field. With ongoing advancements in science and technology and in-depth research, it is anticipated that MOFs catalysts will have broader applications and advancements in organic catalysis. 5.1 Future development directions of MOFs materials 5.1.1 Design and synthesis of new MOFs materials (1) Introduction of new metal ions: Continuously screening metal ions with unique electronic structures and coordination abilities for constructing MOFs. For example, some rare earth metal ions, with their special outer electron configurations, may endow MOFs with new optical and magnetic properties, which can further influence catalytic features, making them advantageous in processes such as photocatalytic organic tandem reactions. Additionally, the selection of different oxidation states of transition metal ions can modulate the nature of active sites, enabling adaptation for various types of organic reactions. (2) Adoption of new organic ligands: Designing and synthesizing organic ligands with specific functional groups, either rigid or flexible structures. Ligands containing reactive functional groups such as amino, carboxyl, and hydroxyl groups can directly participate as active sites in reactions or catalyze reactions through synergistic effects with metal ions. Moreover, ligands with large conjugated systems may alter the electronic transport properties of MOFs, facilitating catalysis in organic tandem reactions involving electron transfer. Furthermore, utilizing chiral ligands to construct chiral MOFs can achieve enantiomeric selectivity in organic tandem catalysis, offering substantial potential applications in chiral drug synthesis. (3) Novel synthesis strategies: Exploring unconventional synthesis methods such as microwave-assisted synthesis, ultrasonic synthesis, and electrochemical synthesis. Microwave-assisted synthesis provides uniform energy within a short time, accelerating reaction rates and resulting in more uniform crystal growth with reduced defects and enhanced stability. Ultrasonic synthesis utilizes the effects of ultrasonic cavitation to promote the mixing and dispersion of reactants, facilitating the formation of high-quality MOFs. Electrochemical synthesis allows precise control over the deposition rates of metal ions, enabling fine-tuning of the MOFs structure. 5.1.2 Construction of multifunctional MOFs catalysts (1) Integration of multiple active sites: For instance, combining acidic sites (e.g., sulfonic acid functional group-modified ligands) with metal catalytic active centers (coordination unsaturated metal sites at the metal nodes) can enhance the efficiency of converting complex organic molecules in tandem reactions. Acidic sites can catalyze hydrolysis and esterification steps, while metal sites can participate in oxidation–reduction reactions, thereby achieving efficient transformation of organic molecules. Additionally, integrating basic sites with LA sites can facilitate acid-base catalytic synergy, enhancing reaction selectivity and yield for different substrates. (2) Development of adsorption-separation-catalysis integrated MOFs: Rationally designing the pore size and surface properties of MOFs to selectively adsorb reactants can concentrate reactants within the MOFs' pore channels, increasing local concentrations and favoring catalytic reactions. After the reaction, the different interactions between the MOFs and the products can facilitate the in-situ separation of the products, avoiding complex separation and purification steps afterwards. This approach can significantly reduce the overall process costs and enhance the overall resource utilization efficiency, particularly suitable for scenarios involving the synthesis of fine chemicals. 5.1.3 Composite materials development (1) MOFs composed with NPs: Combining with MNPs (e.g., Au, Ag, Pd), which provide high catalytic surface activity, can enhance the catalytic activity of MOFs in organic tandem reactions, playing crucial roles in hydrogenation and coupling reactions. The presence of NPs may also improve the electronic conductivity of MOFs, accelerating electron transfer rates to facilitate reactions. Furthermore, the combination with quantum dots can leverage the optical properties of quantum dots to develop photocatalytic organic tandem reaction systems, expanding the applications of MOFs in photo-driven organic synthesis. (2) MOFs composed with carbon materials: Composites with carbon materials such as graphene or carbon nanotubes can benefit from the excellent conductivity, high specific surface area, and good thermal stability of these carbon materials. On one hand, this can stabilize the MOFs structure and prevent collapse during reactions; on the other hand, it can enhance mass transfer of reactants and products within MOFs pore channels, reducing diffusion resistance and facilitating complex organic reactions involving large molecular substrates. (3) MOFs composed with polymers: Combining MOFs with polymers can help protect MOFs structures, enabling them to maintain stability under harsher reaction environments (like organic solvents and varying pH conditions). Additionally, selecting polymers with specific functions, whether hydrophilic or hydrophobic, can regulate the affinity of the MOFs composites towards reactants, further optimizing the reaction systems and broadening the applicability of MOFs in various organic reaction contexts. 5.1.4 Combined computational simulation and experimental approaches (1) Relationship between structure and performance simulation: Using DFT calculations to assess the electronic structure and band structure of MOFs, analyzing adsorption energies and activation energies for different structures, and predicting which types of MOFs structures might exhibit superior catalytic performance for specific organic tandem reactions. For example, comparing MOFs models with varying pore sizes and distributions of active sites to calculate their degrees of substrate molecule adsorption and activation, thus offering theoretical guidance for targeted selection and design of MOFs materials in experimental synthesis. (2) Reaction mechanism simulation: Constructing theoretical models for organic tandem reactions occurring on MOFs to simulate key transition states and energy barriers for each elementary reaction along the reaction pathway. This helps to reveal the essence of the cooperative effects among different active sites and to detail the gradual conversion processes of substrate molecules within the MOFs pore channels. Based on simulation results, experimental verification and optimization of the reaction processes can be achieved by adjusting reaction conditions (e.g., temperature, pressure, solvent), thereby facilitating the mutual corroboration and promotion of computational simulations and experimental research, accelerating the translation of MOFs catalytic technologies from laboratory settings to practical applications. 5.1.5 Green and sustainable development (1) Green synthesis approaches: Prioritizing the use of non-toxic, renewable raw materials for fabricating MOFs, such as utilizing natural organic small molecules (e.g., amino acids, sugars) as sources of ligands or selecting biodegradable metal salts as sources of metal ions. In solvent selection, opting for greener solvents like water or supercritical carbon dioxide over traditional organic solvents minimizes the emission of volatile organic compounds (VOCs). Additionally, optimizing synthetic processes can reduce energy consumption during the synthesis phase by employing mild conditions (e.g., low temperature, ambient pressure), thereby diminishing environmental impact. (2) Exploration of green applications: Actively expanding the application of MOFs in the conversion of renewable resources, such as utilizing MOFs to catalyze the degradation and transformation of biomass (e.g., cellulose, lignin) into high-value-added chemicals (e.g., biofuels, bio-based plastics). In the realm of green organic synthesis, achieving synthesis of organic compounds through eco-friendly and atom-economical pathways can minimize the generation of substantial waste and by-products, driving the chemical industry towards a more sustainable direction. CRediT authorship contribution statement Rui Fu: Writing – original draft, Conceptualization. Weizuo Li: Writing – review & editing, Writing – original draft. Guangyu He: Conceptualization. Dafang He: Data curation. Haiqun Chen: Writing – review & editing, Conceptualization. Declaration of competing interest We declare that we have no financial and personal relationships with other people or organizations that can inappropriately influence our work, there is no professional or other personal interest of any nature or kind in any product, service and/or company that could be construed as influencing the position presented in the manuscript. Acknowledgements This work was financially supported by the Doctoral Fund of Ministry of Education of China (2017M621315), Heilongjiang Provincial Government Postdoctoral Science Foundation (LBH-Z17190). References [1] O.M. Yaghi G. Li H. Li Selective binding and removal of guests in a microporous metal-organic framework Nature 378 1995 703 706 O.M. Yaghi, G. Li, H. Li, Selective binding and removal of guests in a microporous metal-organic framework, Nature, 378 (1995) 703–706. [2] D. Chen Y.T. Zheng N.Y. Huang Q. Xu Metal-organic framework composites for photocatalysis EnergyChem 6 2023 100115 D. Chen, Y.T. Zheng, N.Y. Huang, Q. Xu, Metal-organic framework composites for photocatalysis, EnergyChem, 6 (2023) 100115. [3] S. Ren H. Yu L. Wang Z. Huang T. Lin Y. Huang J. Yang Y. Hong J. Liu State of the art and prospects in metal-organic framework-derived microwave absorption materials Nano-Micro Lett. 14 2022 68 S. Ren, H. Yu, L. Wang, Z. Huang, T. Lin, Y. Huang, J. Yang, Y. Hong, J. Liu, State of the art and prospects in metal-organic framework-derived microwave absorption materials, Nano-Micro Lett. 14 (2022) 68. [4] D. Yang B.C. Gates Catalysis by metal organic frameworks: perspective and suggestions for future research ACS Catal. 9 2019 177 D. Yang, B.C. Gates, Catalysis by metal organic frameworks: perspective and suggestions for future research, ACS Catal. 9 (2019) 177. [5] S. Begum Z. Hassan S. Bräse C. Wöll M. Tsotsalas Metal-organic framework-templated biomaterials: recent progress in synthesis, functionalization, and applications Acc. Chem. Res. 52 2019 1598 S. Begum, Z. Hassan, S. Bräse, C. Wöll, M. Tsotsalas, Metal-organic framework-templated biomaterials: recent progress in synthesis, functionalization, and applications, Acc. Chem. Res. 52 (2019) 1598. [6] L. Yang S. Qian X. Wang X. Cui B. Chen H. Xing Energy-efficient separation alternatives: metal-organic frameworks and membranes for hydrocarbon separation Chem. Soc. Rev. 49 2020 5359 L. Yang, S. Qian, X. Wang, X. Cui, B. Chen, H. Xing, Energy-efficient separation alternatives: metal-organic frameworks and membranes for hydrocarbon separation, Chem. Soc. Rev. 49 (2020) 5359. [7] L.S. Xie G. Skorupskii M. Dincă Electrically conductive metal-organic frameworks Chem. Rev. 120 2020 8536 L.S. Xie, G. Skorupskii, M. Dincă, Electrically conductive metal-organic frameworks, Chem. Rev. 120 (2020) 8536. [8] H.Y. Li S.N. Zhao S.Q. Zang J. Li Functional metal-organic frameworks as effective sensors of gases and volatile compounds Chem. Soc. Rev. 49 2020 6364 H.Y. Li, S.N. Zhao, S.Q. Zang, J. Li, Functional metal-organic frameworks as effective sensors of gases and volatile compounds, Chem. Soc. Rev. 49 (2020) 6364. [9] S. Yan W. Li D. He G. He H. Chen Recent research progress of metal-organic frameworks (MOFs) based catalysts for CO2 cycloaddition reaction Mol. Catal. 550 2023 113608 S. Yan, W. Li, D. He, G. He, H. Chen, Recent research progress of metal-organic frameworks (MOFs) based catalysts for CO2 cycloaddition reaction, Mol. Catal. 550 (2023) 113608. [10] M. Zeeshan M. Shahid State of the art developments and prospects of metal-organic frameworks for energy applications Dalton Trans. 51 2022 1675 M. Zeeshan, M. Shahid, State of the art developments and prospects of metal-organic frameworks for energy applications, Dalton Trans. 51 (2022) 1675. [11] X.M. Liu L.H. Xie Y. Wu Recent advances in the shaping of metal-organic frameworks Inorg. Chem. Front. 7 2020 2840 X.M. Liu, L.H. Xie, Y. Wu, Recent advances in the shaping of metal-organic frameworks, Inorg. Chem. Front. 7 (2020) 2840. [12] W. Lu Z. Wei Z.Y. Gu T.F. Liu J. Park J. Park J. Tian M. Zhang Q. Zhang T.Gentle Iii M. Bosch H.C. Zhou Tuning the structure and function of metal-organic frameworks via linker design Chem. Soc. Rev. 43 2014 5561 W. Lu, Z. Wei, Z.Y. Gu, T.F. Liu, J. Park, J. Park, J. Tian, M. Zhang, Q. Zhang, T.Gentle Iii, M. Bosch, H.C. Zhou, Tuning the structure and function of metal-organic frameworks via linker design, Chem. Soc. Rev. 43 (2014) 5561. [13] Z. Hu D. Zhao Metal-organic frameworks with Lewis acidity: synthesis, characterization, and catalytic applications CrystEngComm 19 2017 4066 Z. Hu, D. Zhao, Metal-organic frameworks with Lewis acidity: synthesis, characterization, and catalytic applications, CrystEngComm. 19 (2017) 4066. [14] S.A. Younis N. Bhardwaj S.K. Bhardwaj K.H. Kim A. Deep Rare earth metal-organic frameworks (RE-MOFs): synthesis, properties, and biomedical applications Coord. Chem. Rev. 429 2021 213620 S.A. Younis, N. Bhardwaj, S.K. Bhardwaj, K.H. Kim, A. Deep, Rare earth metal-organic frameworks (RE-MOFs): synthesis, properties, and biomedical applications, Coord. Chem. Rev. 429 (2021) 213620. [15] J. Ren X. Dyosiba N.M. Musyoka H.W. Langmi M. Mathe S. Liao Review on the current practices and efforts towards pilot-scale production of metal-organic frameworks (MOFs) Coord. Chem. Rev. 352 2017 187 J. Ren, X. Dyosiba, N.M. Musyoka, H.W. Langmi, M. Mathe, S. Liao, Review on the current practices and efforts towards pilot-scale production of metal-organic frameworks (MOFs), Coord. Chem. Rev. 352 (2017) 187. [16] D. Jampaiah D. Damma A. Chalkidis M. Singh Y.M. Sabri E.L.H. Mayes V. Bansal S.K. Bhargava MOF-derived noble-metal-free Cu/CeO2 with high porosity for the efficient water-gas shift reaction at low temperatures Catal. Sci. Technol. 9 2019 4226 D. Jampaiah, D. Damma, A. Chalkidis, M. Singh, Y.M. Sabri, E.L.H. Mayes, V. Bansal, S.K. Bhargava, MOF-derived noble-metal-free Cu/CeO2 with high porosity for the efficient water-gas shift reaction at low temperatures, Catal. Sci. Technol. 9 (2019) 4226. [17] K. Shen X. Chen J. Chen Y. Li Development of MOF-derived carbon-based nanomaterials for efficient catalysis ACS Catal. 6 2016 5887 K. Shen, X. Chen, J. Chen, Y. Li, Development of MOF-derived carbon-based nanomaterials for efficient catalysis, ACS Catal. 6 (2016) 5887. [18] H.F. Wang L. Chen H. Pang S. Kaskel Q. Xu MOF-derived electrocatalysts for oxygen reduction, oxygen evolution and hydrogen evolution reactions Chem. Soc. Rev. 49 2020 1414 H.F. Wang, L. Chen, H. Pang, S. Kaskel, Q. Xu, MOF-derived electrocatalysts for oxygen reduction, oxygen evolution and hydrogen evolution reactions, Chem. Soc. Rev. 49 (2020) 1414. [19] H.J. Lee W. Cho E. Lim M. Oh One-pot synthesis of magnetic particle-embedded porous carbon composites from metal-organic frameworks and their sorption properties Chem. Commun. 50 2014 5476 H.J. Lee, W. Cho, E. Lim, M. Oh, One-pot synthesis of magnetic particle-embedded porous carbon composites from metal-organic frameworks and their sorption properties, Chem. Commun. 50 (2014) 5476. [20] B. Liu H. Shioyama T. Akita Q. Xu Metal-organic framework as a template for porous carbon synthesis J. Am. Chem. Soc. 130 2008 5390 B. Liu, H. Shioyama, T. Akita, Q. Xu, Metal-organic framework as a template for porous carbon synthesis, J. Am. Chem. Soc. 130 (2008) 5390. [21] B.Y. Guan X.Y. Yu H.B. Wu X.W. Lou Complex nanostructures from materials based on metal-organic frameworks for electrochemical energy storage and conversion Adv. Mater. 29 2017 1703614 B.Y. Guan, X.Y. Yu, H.B. Wu, X.W. Lou, Complex nanostructures from materials based on metal-organic frameworks for electrochemical energy storage and conversion, Adv. Mater. 29 (2017) 1703614. [22] K.G. Liu Z. Sharifzadeh F. Rouhani M. Ghorbanloo A. Morsali Metal-organic framework composites as green/sustainable catalysts Coord. Chem. Rev. 436 2021 213827 K.G. Liu, Z. Sharifzadeh, F. Rouhani, M. Ghorbanloo, A. Morsali, Metal-organic framework composites as green/sustainable catalysts, Coord. Chem. Rev. 436 (2021) 213827. [23] R.R. Salunkhe Y.V. Kaneti Y. Yamauchi Metal-organic framework-derived nanoporous metal oxides toward supercapacitor applications: progress and prospects ACS Nano 11 2017 5293 R.R. Salunkhe, Y.V. Kaneti, Y. Yamauchi, Metal-organic framework-derived nanoporous metal oxides toward supercapacitor applications: progress and prospects, ACS Nano, 11 (2017) 5293. [24] Y.Z. Chen C. Wang Z.Y. Wu Y. Xiong Q. Xu S.H. Yu H.L. Jiang From bimetallic metal-organic framework to porous carbon: high surface area and multicomponent active dopants for excellent electrocatalysis Adv. Mater. 27 2015 5010 Y.Z. Chen, C. Wang, Z.Y. Wu, Y. Xiong, Q. Xu, S.H. Yu, H.L. Jiang, From bimetallic metal-organic framework to porous carbon: high surface area and multicomponent active dopants for excellent electrocatalysis, Adv. Mater. 27 (2015) 5010. [25] M. Zhao K. Yuan Y. Wang G. Li J. Guo L. Gu W. Hu H. Zhao Z. Tang Metal-organic frameworks as selectivity regulators for hydrogenation reactions Nature 539 2016 76 M. Zhao, K. Yuan, Y. Wang, G. Li, J. Guo, L. Gu, W. Hu, H. Zhao, Z. Tang, Metal-organic frameworks as selectivity regulators for hydrogenation reactions, Nature 539 (2016) 76. [26] U. Mueller M. Schubert F. Teich H. Puetter K. Schierle-Arndt J. Pastré Metal-organic frameworks—prospective industrial applications J. Mater. Chem. 16 2006 626 U. Mueller, M. Schubert, F. Teich, H. Puetter, K. Schierle-Arndt, J. Pastré, Metal-organic frameworks—prospective industrial applications, J. Mater. Chem. 16 (2006) 626. [27] H. Li M. Eddaoudi M. O'Keeffe O.M. Yaghi Design and synthesis of an exceptionally stable and highly porous metal-organic framework Nature 402 1999 276 H. Li, M. Eddaoudi, M. O'Keeffe, O.M. Yaghi, Design and synthesis of an exceptionally stable and highly porous metal-organic framework, Nature, 402 (1999) 276. [28] K.S. Park Z. Ni A.P. Côté J.Y. Choi R. Huang F.J. Uribe-Romo H.K. Chae M. O'Keeffe O.M. Yaghi Exceptional chemical and thermal stability of zeolitic imidazolate frameworks Proc. Natl. Acad. Sci. 103 2006 10186 K.S. Park, Z. Ni, A.P. Côté, J.Y. Choi, R. Huang, F.J. Uribe-Romo, H.K. Chae, M. O'Keeffe, O.M. Yaghi, Exceptional chemical and thermal stability of zeolitic imidazolate frameworks, Proc. Natl. Acad. Sci. 103 (2006) 10186. [29] G. Férey C. Serre C. Mellot-Draznieks F. Millange S. Surblé J. Dutour I. Margiolaki A hybrid solid with giant pores prepared by a combination of targeted chemistry, simulation, and powder diffraction Angew. Chem. Int. Ed. 43 2004 6296 G. Férey, C. Serre, C. Mellot-Draznieks, F. Millange, S. Surblé, J. Dutour, I. Margiolaki, A hybrid solid with giant pores prepared by a combination of targeted chemistry, simulation, and powder diffraction, Angew. Chem. Int. Ed. 43 (2004) 6296. [30] G. Férey C. Mellot-Draznieks C. Serre F. Millange J. Dutour S. Surblé I. Margiolaki A chromium terephthalate-based solid with unusually large pore volumes and surface area Science 309 2005 2040 (1979) G. Férey, C. Mellot-Draznieks, C. Serre, F. Millange, J. Dutour, S. Surblé, I. Margiolaki, A chromium terephthalate-based solid with unusually large pore volumes and surface area, Science (1979), 309 (2005) 2040. [31] L. Ai L. Li C. Zhang J. Fu J. Jiang MIL-53(Fe): a metal-organic framework with intrinsic peroxidase-like catalytic activity for colorimetric biosensing Appl. Catal. A Gen. 19 2013 15105 L. Ai, L. Li, C. Zhang, J. Fu, J. Jiang, MIL-53(Fe): a metal-organic framework with intrinsic peroxidase-like catalytic activity for colorimetric biosensing, Appl. Catal. A Gen. 19 (2013) 15105. [32] D. Feng Z.Y. Gu J.R. Li H.L. Jiang Z. Wei H.C. Zhou Zirconium-metalloporphyrin PCN-222: mesoporous metal-organic frameworks with ultrahigh stability as biomimetic catalysts Angew. Chem. Int. Ed. 51 2012 1030 D. Feng, Z.Y. Gu, J.R. Li, H.L. Jiang, Z. Wei, H.C. Zhou, Zirconium-metalloporphyrin PCN-222: mesoporous metal-organic frameworks with ultrahigh stability as biomimetic catalysts, Angew. Chem. Int. Ed. 51 (2012) 1030. [33] M. Zhang Y.P. Chen H.C. Zhou Structural design of porous coordination networks from tetrahedral building units CrystEngComm 15 2013 9544 M. Zhang, Y.P. Chen, H.C. Zhou, Structural design of porous coordination networks from tetrahedral building units, CrystEngComm, 15 (2013) 9544. [34] R. Shi D. Lv Y. Chen H. Wu B. Liu Q. Xia Z. Li Highly selective adsorption separation of light hydrocarbons with a porphyrinic zirconium metal-organic framework PCN-224 Sep. Purif. Technol. 207 2018 262 R. Shi, D. Lv, Y. Chen, H. Wu, B. Liu, Q. Xia, Z. Li, Highly selective adsorption separation of light hydrocarbons with a porphyrinic zirconium metal-organic framework PCN-224, Sep. Purif. Technol. 207 (2018) 262. [35] S.S.Y. Chui S.M.F. Lo J.P.H. Charmant A.G. Orpen I.D. Williams A chemically functionalizable nanoporous material [Cu3(TMA)2(H2O)3]n Science 283 1999 1148 (1979) S.S.Y. Chui, S.M.F. Lo, J.P.H. Charmant, A.G. Orpen, I.D. Williams, A chemically functionalizable nanoporous material [Cu3(TMA)2(H2O)3]n, Science (1979), 283 (1999) 1148. [36] S. Ma D. Sun J.M. Simmons C.D. Collier D. Yuan H.C. Zhou Metal-organic framework from an anthracene derivative containing nanoscopic cages exhibiting high methane uptake J. Am. Chem. Soc. 130 2008 1012 S. Ma, D. Sun, J.M. Simmons, C.D. Collier, D. Yuan, H.C. Zhou, Metal-organic framework from an anthracene derivative containing nanoscopic cages exhibiting high methane uptake, J. Am. Chem. Soc. 130 (2008) 1012. [37] F. Wu C. Pan C.T. He Y. Han W. Ma H. Wei W. Ji W. Chen J. Mao P. Yu D. Wang L. Mao Y. Li Single-atom Co-N4 electrocatalyst enabling four-electron oxygen reduction with enhanced hydrogen peroxide tolerance for selective sensing J. Am. Chem. Soc. 142 2020 16861 F. Wu, C. Pan, C.T. He, Y. Han, W. Ma, H. Wei, W. Ji, W. Chen, J. Mao, P. Yu, D. Wang, L. Mao, Y. Li, Single-atom Co-N4 electrocatalyst enabling four-electron oxygen reduction with enhanced hydrogen peroxide tolerance for selective sensing, J. Am. Chem. Soc. 142 (2020) 16861. [38] L. Jiao W. Yang G. Wan R. Zhang X. Zheng H. Zhou S.H. Yu H.L. Jiang Single-atom electrocatalysts from multivariate metal-organic frameworks for highly selective reduction of CO2 at low pressures Angew. Chem. Int. Ed. 59 2020 20589 L. Jiao, W. Yang, G. Wan, R. Zhang, X. Zheng, H. Zhou, S.H. Yu, H.L. Jiang, Single-atom electrocatalysts from multivariate metal-organic frameworks for highly selective reduction of CO2 at low pressures, Angew. Chem. Int. Ed. 59 (2020) 20589. [39] S. Dang Q.L. Zhu Q. Xu Nanomaterials derived from metal-organic frameworks Nat. Rev. Mater. 3 2017 17075 S. Dang, Q.L. Zhu, Q. Xu, Nanomaterials derived from metal-organic frameworks, Nat. Rev. Mater. 3 (2017) 17075. [40] Q. Yang Q. Xu H.L. Jiang Metal-organic frameworks meet metal nanoparticles: synergistic effect for enhanced catalysis Chem. Soc. Rev. 46 2017 4774 Q. Yang, Q. Xu, H.L. Jiang, Metal-organic frameworks meet metal nanoparticles: synergistic effect for enhanced catalysis, Chem. Soc. Rev. 46 (2017) 4774. [41] L. Bao Z. Yu T. Fei Z. Yan J. Li C. Sun S. Pang Palladium supported on metal–organic framework as a catalyst for the hydrogenation of nitroarenes under mild conditions Appl. Organomet. Chem. 34 2020 e5607 L. Bao, Z. Yu, T. Fei, Z. Yan, J. Li, C. Sun, S. Pang, Palladium supported on metal–organic framework as a catalyst for the hydrogenation of nitroarenes under mild conditions, Appl. Organomet. Chem. 34 (2020) e5607. [42] B. Li J.G. Ma P. Cheng Silica-protection-assisted encapsulation of Cu2O nanocubes into a metal-organic framework (ZIF-8) to provide a composite catalyst Angew. Chem. Int. Ed. 57 2018 6834 B. Li, J.G. Ma, P. Cheng, Silica-protection-assisted encapsulation of Cu2O nanocubes into a metal-organic framework (ZIF-8) to provide a composite catalyst, Angew. Chem. Int. Ed. 57 (2018) 6834. [43] J.L. Sun Y.Z. Chen B.D. Ge J.H. Li G.M. Wang Three-Shell Cu@Co@Ni nanoparticles stabilized with a metal-organic framework for enhanced tandem catalysis ACS Appl. Mater. Interfaces 11 2019 940 J.L. Sun, Y.Z. Chen, B.D. Ge, J.H. Li, G.M. Wang, Three-Shell Cu@Co@Ni nanoparticles stabilized with a metal-organic framework for enhanced tandem catalysis, ACS Appl. Mater. Interfaces, 11 (2019) 940. [44] W. Zhang Q. Tan T. Liu Y. He G. Chen K. Chen D. Han D. Qin L. Niu Fabrication of water-floating litchi-like polystyrene-sphere-supported TiO2/Bi2O3 s-scheme heterojunction for efficient photocatalytic degradation of tetracycline Mater. Horiz. 10 2023 5869 W. Zhang, Q. Tan, T. Liu, Y. He, G. Chen, K. Chen, D. Han, D. Qin, L. Niu, Fabrication of water-floating litchi-like polystyrene-sphere-supported TiO2/Bi2O3 s-scheme heterojunction for efficient photocatalytic degradation of tetracycline, Mater. Horiz. 10 (2023) 5869. [45] W. Yang H. Li Q. Wu Y. Ren D. Shi Y. Zhao Q. Jiao Functionalized core-shell polystyrene sphere-supported alkaline imidazolium ionic liquid: an efficient and recyclable catalyst for knoevenagel condensation ACS Sustaina. Chem. Eng. 8 2020 18126 W. Yang, H. Li, Q. Wu, Y. Ren, D. Shi, Y. Zhao, Q. Jiao, Functionalized core-shell polystyrene sphere-supported alkaline imidazolium ionic liquid: an efficient and recyclable catalyst for knoevenagel condensation, ACS Sustaina. Chem. Eng. 8 (2020) 18126. [46] K. Shen L. Zhang X. Chen L. Liu D. Zhang Y. Han J. Chen J. Long R. Luque Y. Li B. Chen Ordered macro-microporous metal-organic framework single crystals Science 359 2018 206 (1979) K. Shen, L. Zhang, X. Chen, L. Liu, D. Zhang, Y. Han, J. Chen, J. Long, R. Luque, Y. Li, B. Chen, Ordered macro-microporous metal-organic framework single crystals, Science (1979) 359 (2018) 206. [47] Z. Liu Z. Chen M. Li J. Li W. Zhuang X. Yang S. Wu J. Zhang Construction of single Ni atom-immobilized ZIF-8 with ordered hierarchical pore structures for selective CO2 photoreduction ACS Catal. 13 2023 6630 Z. Liu, Z. Chen, M. Li, J. Li, W. Zhuang, X. Yang, S. Wu, J. Zhang, Construction of single Ni atom-immobilized ZIF-8 with ordered hierarchical pore structures for selective CO2 photoreduction, ACS Catal. 13 (2023) 6630. [48] J.J. Liu Z.W. Jiang S.W. Hsu Investigation of the performance of heterogeneous MOF-Silver nanocube nanocomposites as CO2 reduction photocatalysts by in situ raman spectroscopy ACS Appl. Mater. Interfaces 15 2023 6716 J.J. Liu, Z.W. Jiang, S.W. Hsu, Investigation of the performance of heterogeneous MOF-Silver nanocube nanocomposites as CO2 reduction photocatalysts by in situ raman spectroscopy, ACS Appl. Mater. Interfaces, 15 (2023) 6716. [49] Z. Zhang Y. Liu H. Tian X. Ma Q. Yue Z. Sun Y. Lu S. Liu Hierarchically ordered macro-microporous polyoxometalate-based metal-organic framework single crystals ACS Nano 15 2021 16581 Z. Zhang, Y. Liu, H. Tian, X. Ma, Q. Yue, Z. Sun, Y. Lu, S. Liu, Hierarchically ordered macro-microporous polyoxometalate-based metal-organic framework single crystals, ACS Nano, 15 (2021) 16581. [50] X. Li L. Yang Q. Liu W. Bai H. Li M. Wang Q. Qian Q. Yang C. Xiao Y. Xie Directional shunting of photogenerated carriers in POM@MOF for promoting nitrogen adsorption and oxidation Adv. Mater. 35 2023 2304532 X. Li, L. Yang, Q. Liu, W. Bai, H. Li, M. Wang, Q. Qian, Q. Yang, C. Xiao, Y. Xie, Directional shunting of photogenerated carriers in POM@MOF for promoting nitrogen adsorption and oxidation, Adv. Mater. 35 (2023) 2304532. [51] Y. Liu C. Tang M. Cheng M. Chen S. Chen L. Lei Y. Chen H. Yi Y. Fu L. Li Polyoxometalate@Metal-organic framework composites as effective photocatalysts ACS Catal. 11 2021 13374 Y. Liu, C. Tang, M. Cheng, M. Chen, S. Chen, L. Lei, Y. Chen, H. Yi, Y. Fu, L. Li, Polyoxometalate@Metal-organic framework composites as effective photocatalysts, ACS Catal. 11 (2021) 13374. [52] J. Juan-Alcañiz J. Gascon F. Kapteijn Metal–organic frameworks as scaffolds for the encapsulation of active species: state of the art and future perspectives J. Mater. Chem. 22 2012 10102 J. Juan-Alcañiz, J. Gascon, F. Kapteijn, Metal–organic frameworks as scaffolds for the encapsulation of active species: state of the art and future perspectives, J. Mater. Chem. 22 (2012) 10102. [53] A. Dolbecq E. Dumas C.R. Mayer P. Mialane Hybrid organic-inorganic polyoxometalate compounds: from structural diversity to applications Chem. Rev. 110 2010 6009 A. Dolbecq, E. Dumas, C.R. Mayer, P. Mialane, Hybrid organic-inorganic polyoxometalate compounds: from structural diversity to applications, Chem. Rev. 110 (2010) 6009. [54] Y. Li J. Su Y. Zhao L. Feng L. Gao X. Xu Y. Yin Y. Liu P. Xiao L. Yuan J.S. Qin Y. Wang S. Yuan H. Zheng J.L. Zuo Dynamic bond-directed synthesis of stable mesoporous metal–organic frameworks under room temperature J. Am. Chem. Soc. 145 2023 10227 Y. Li, J. Su, Y. Zhao, L. Feng, L. Gao, X. Xu, Y. Yin, Y. Liu, P. Xiao, L. Yuan, J.S. Qin, Y. Wang, S. Yuan, H. Zheng, J.L. Zuo, Dynamic bond-directed synthesis of stable mesoporous metal–organic frameworks under room temperature, J. Am. Chem. Soc. 145 (2023) 10227. [55] W. Zhang Y. Hu J. Ge H.L. Jiang S.H. Yu A facile and general coating approach to moisture/water-resistant metal–organic frameworks with intact porosity J. Am. Chem. Soc. 136 2014 16978 W. Zhang, Y. Hu, J. Ge, H.L. Jiang, S.H. Yu, A facile and general coating approach to moisture/water-resistant metal–organic frameworks with intact porosity, J. Am. Chem. Soc. 136 (2014) 16978. [56] K.J. Lee J.H. Lee S. Jeoung H.R. Moon Transformation of metal–organic frameworks/coordination polymers into functional nanostructured materials: experimental approaches based on mechanistic insights Acc. Chem. Res. 50 2017 2684 K.J. Lee, J.H. Lee, S. Jeoung, H.R. Moon, Transformation of metal–organic frameworks/coordination polymers into functional nanostructured materials: experimental approaches based on mechanistic insights, Acc. Chem. Res. 50 (2017) 2684. [57] J. Li H. Luo B. Li J.G. Ma P. Cheng Application of MOF-derived materials as electrocatalysts for CO2 conversion Mater. Chem. Front. 7 2023 6107 J. Li, H. Luo, B. Li, J.G. Ma, P. Cheng, Application of MOF-derived materials as electrocatalysts for CO2 conversion, Mater. Chem. Front. 7 (2023) 6107. [58] F. Wang Y. Gao S.S. Liu X.H. Yi C.C. Wang H. Fu Fabrication strategies of metal–organic frameworks derivatives for catalytic aqueous pollutants elimination Chem. Eng. J. 463 2023 142466 F. Wang, Y. Gao, S.S. Liu, X.H. Yi, C.C. Wang, H. Fu, Fabrication strategies of metal–organic frameworks derivatives for catalytic aqueous pollutants elimination, Chem. Eng. J. 463 (2023) 142466. [59] I.S. Khan L. Garzon-Tovar D. Mateo J. Gascon Metal-organic-frameworks and their derived materials in photo-thermal catalysis Eur. J. Inorg. Chem. 2022 2022 e202200316 I.S. Khan, L. Garzon-Tovar, D. Mateo, J. Gascon, Metal-organic-frameworks and their derived materials in photo-thermal catalysis, Eur. J. Inorg. Chem. 2022 (2022) e202200316. [60] F. Zheng T. Lin K. Wang Y. Wang G. Li Recent advances in bimetallic metal-organic frameworks and their derivatives for thermal catalysis Nano Res. 16 2023 12919 F. Zheng, T. Lin, K. Wang, Y. Wang, G. Li, Recent advances in bimetallic metal-organic frameworks and their derivatives for thermal catalysis, Nano Res. 16 (2023) 12919. [61] H. Huang L. Jiang J. Yang S. Zhou X. Yuan J. Liang H. Wang H. Wang Y. Bu H. Li Synthesis and modification of ultrathin g-C3N4 for photocatalytic energy and environmental applications Renew. Sustain. Energy Rev. 173 2023 113110 H. Huang, L. Jiang, J. Yang, S. Zhou, X. Yuan, J. Liang, H. Wang, H. Wang, Y. Bu, H. Li, Synthesis and modification of ultrathin g-C3N4 for photocatalytic energy and environmental applications, Renew. Sustain. Energy Rev. 173 (2023) 113110. [62] L. Jiang J. Yang X. Yuan J. Guo J. Liang W. Tang Y. Chen X. Li H. Wang W. Chu Defect engineering in polymeric carbon nitride photocatalyst: synthesis, properties and characterizations Adv. Colloid Interface Sci. 296 2021 102523 L. Jiang, J. Yang, X. Yuan, J. Guo, J. Liang, W. Tang, Y. Chen, X. Li, H. Wang, W. Chu, Defect engineering in polymeric carbon nitride photocatalyst: synthesis, properties and characterizations, Adv. Colloid Interface Sci. 296 (2021) 102523. [63] C. Wang J. Kim J. Tang M. Kim H. Lim V. Malgras J. You Q. Xu J. Li Y. Yamauchi New strategies for novel MOF-derived carbon materials based on nanoarchitectures Chem 6 2020 19 C. Wang, J. Kim, J. Tang, M. Kim, H. Lim, V. Malgras, J. You, Q. Xu, J. Li, Y. Yamauchi, New strategies for novel MOF-derived carbon materials based on nanoarchitectures, Chem. 6 (2020) 19. [64] H. Konnerth B.M. Matsagar S.S. Chen M.H.G. Prechtl F.K. Shieh K.C.W. Wu Metal-organic framework (MOF)-derived catalysts for fine chemical production Coord. Chem. Rev. 416 2020 213319 H. Konnerth, B.M. Matsagar, S.S. Chen, M.H.G. Prechtl, F.K. Shieh, K.C.W. Wu, Metal-organic framework (MOF)-derived catalysts for fine chemical production, Coord. Chem. Rev. 416 (2020) 213319. [65] R. Abazari S. Sanati M.A. Bajaber M.S. Javed P.C. Junk A.K. Nanjundan J. Qian D.P. Dubal Design and advanced manufacturing of NU-1000 metal-organic frameworks with future perspectives for environmental and renewable energy applications Small 20 2024 2306353 R. Abazari, S. Sanati, M.A. Bajaber, M.S. Javed, P.C. Junk, A.K. Nanjundan, J. Qian, D.P. Dubal, Design and advanced manufacturing of NU-1000 metal-organic frameworks with future perspectives for environmental and renewable energy applications, Small, 20 (2024) 2306353. [66] R. Abazari S. Sanati W.K. Fan M. Tahir S. Nayak K. Parida M. El-Shahat R.M. Abdelhameed D.S. Nesterov A.M. Kirillov J. Qian Design and engineering of MOF/LDH hybrid nanocomposites and LDHs derived from mof templates for electrochemical energy conversion/storage and environmental remediation: mechanism and future perspectives Coord. Chem. Rev. 523 2025 216256 R. Abazari, S. Sanati, W.K. Fan, M. Tahir, S. Nayak, K. Parida, M. El-Shahat, R.M. Abdelhameed, D.S. Nesterov, A.M. Kirillov, J. Qian, Design and engineering of MOF/LDH hybrid nanocomposites and LDHs derived from mof templates for electrochemical energy conversion/storage and environmental remediation: mechanism and future perspectives, Coord. Chem. Rev. 523 (2025) 216256. [67] R. Abazari S. Sanati A.K. Nanjundan Q. Wang D.P. Dubal M. Liu Structure–property–performance relationship of vanadium- and manganese-based metal–organic frameworks and their derivatives for energy storage and conversion applications J. Mater. Chem. A 12 2024 11149 R. Abazari, S. Sanati, A.K. Nanjundan, Q. Wang, D.P. Dubal, M. Liu, Structure–property–performance relationship of vanadium- and manganese-based metal–organic frameworks and their derivatives for energy storage and conversion applications, J. Mater. Chem. A, 12 (2024) 11149. [68] L. Jiang X. Yuan Y. Pan J. Liang G. Zeng Z. Wu H. Wang Doping of graphitic carbon nitride for photocatalysis: a review Appl. Catal. B 217 2017 388 L. Jiang, X. Yuan, Y. Pan, J. Liang, G. Zeng, Z. Wu, H. Wang, Doping of graphitic carbon nitride for photocatalysis: a review, Appl. Catal. B, 217 (2017) 388. [69] P. Behera S. Subudhi S.P. Tripathy K. Parida MOF derived nano-materials: a recent progress in strategic fabrication, characterization and mechanistic insight towards divergent photocatalytic applications Coord. Chem. Rev. 456 2022 214392 P. Behera, S. Subudhi, S.P. Tripathy, K. Parida, MOF derived nano-materials: a recent progress in strategic fabrication, characterization and mechanistic insight towards divergent photocatalytic applications, Coord. Chem. Rev. 456 (2022) 214392. [70] Y.Z. Chen R. Zhang L. Jiao H.L. Jiang Metal-organic framework-derived porous materials for catalysis Coord. Chem. Rev. 362 2018 1 Y.Z. Chen, R. Zhang, L. Jiao, H.L. Jiang, Metal-organic framework-derived porous materials for catalysis, Coord. Chem. Rev. 362 (2018) 1. [71] L. Yang X. Zeng W. Wang D. Cao Recent progress in MOF-derived, heteroatom-doped porous carbons as highly efficient electrocatalysts for oxygen reduction reaction in fuel cells Adv. Funct. Mater. 28 2018 1704537 L. Yang, X. Zeng, W. Wang, D. Cao, Recent progress in MOF-derived, heteroatom-doped porous carbons as highly efficient electrocatalysts for oxygen reduction reaction in fuel cells, Adv. Funct. Mater. 28 (2018) 1704537. [72] Y. Wu L. Chen X. Yang Y. Li K. Shen Facet-selective growth of MOF-on-MOF heterostructures enables etching-free synthesis of highly-open Co/N-doped carbon nanoframes for efficient catalysis Sci. China Chem. 65 2022 2450 Y. Wu, L. Chen, X. Yang, Y. Li, K. Shen, Facet-selective growth of MOF-on-MOF heterostructures enables etching-free synthesis of highly-open Co/N-doped carbon nanoframes for efficient catalysis, Sci. China Chem. 65 (2022) 2450. [73] R. Das P. Pachfule R. Banerjee P. Poddar Metal and metal oxide nanoparticle synthesis from metal organic frameworks (MOFs): finding the border of metal and metal oxides Nanoscale 4 2012 591 R. Das, P. Pachfule, R. Banerjee, P. Poddar, Metal and metal oxide nanoparticle synthesis from metal organic frameworks (MOFs): finding the border of metal and metal oxides, Nanoscale, 4 (2012) 591. [74] L. Oar-Arteta T. Wezendonk X. Sun F. Kapteijn J. Gascon Metal organic frameworks as precursors for the manufacture of advanced catalytic materials Mater. Chem. Front. 1 2017 1709 L. Oar-Arteta, T. Wezendonk, X. Sun, F. Kapteijn, J. Gascon, Metal organic frameworks as precursors for the manufacture of advanced catalytic materials, Mater. Chem. Front. 1 (2017) 1709. [75] H. Chen K. Shen Q. Mao J. Chen Y. Li Nanoreactor of MOF-Derived Yolk–Shell Co@C-N: precisely controllable structure and enhanced catalytic activity ACS Catal. 8 2018 1417 H. Chen, K. Shen, Q. Mao, J. Chen, Y. Li, Nanoreactor of MOF-Derived Yolk–Shell Co@C-N: precisely controllable structure and enhanced catalytic activity, ACS Catal. 8 (2018) 1417. [76] X. Wang Y. Li Chemoselective hydrogenation of functionalized nitroarenes using MOF-derived co-based catalysts J. Mol. Catal. A Chem. 420 2016 56 X. Wang, Y. Li, Chemoselective hydrogenation of functionalized nitroarenes using MOF-derived co-based catalysts, J. Mol. Catal. A Chem. 420 (2016) 56. [77] J. Liu R. Li B. Yang Carbon dots: a new type of carbon-basednnanomaterial with wide applications ACS Cent. Sci. 6 2020 2179 J. Liu, R. Li, B. Yang, Carbon dots: a new type of carbon-basednnanomaterial with wide applications, ACS Cent. Sci. 6 (2020) 2179. [78] Y. Wang B. Li B. Zhang S. Tian X. Yang H. Ye Z. Xia G. Zheng Application of MOFs-derived mixed metal oxides in energy storage J. Electroanal. Chem. 878 2020 114576 Y. Wang, B. Li, B. Zhang, S. Tian, X. Yang, H. Ye, Z. Xia, G. Zheng, Application of MOFs-derived mixed metal oxides in energy storage, J. Electroanal. Chem. 878 (2020) 114576. [79] J. Yang H. Wang L. Jiang H. Yu Y. Zhao H. Chen X. Yuan J. Liang H. Li Z. Wu Defective polymeric carbon nitride: fabrications, photocatalytic applications and perspectives Chem. Eng. J. 427 2022 130991 J. Yang, H. Wang, L. Jiang, H. Yu, Y. Zhao, H. Chen, X. Yuan, J. Liang, H. Li, Z. Wu, Defective polymeric carbon nitride: fabrications, photocatalytic applications and perspectives, Chem. Eng. J. 427 (2022) 130991. [80] S. Rezaee S. Shahrokhian Facile synthesis of petal-like NiCo/Nio-CoO/nanoporous carbon composite based on mixed-metallic MOFs and their application for electrocatalytic oxidation of methanol Appl. Catal. B 244 2019 802 S. Rezaee, S. Shahrokhian, Facile synthesis of petal-like NiCo/Nio-CoO/nanoporous carbon composite based on mixed-metallic MOFs and their application for electrocatalytic oxidation of methanol, Appl. Catal. B, 244 (2019) 802. [81] T. Meng Y. Chen Z. Xing X. Yang Tuning phase structure of nickel-ruthenium alloys via MOFs in situ hydrolysis toward enhanced hydrogen evolution performance in alkaline Small Methods 6 2022 2101188 T. Meng, Y. Chen, Z. Xing, X. Yang, Tuning phase structure of nickel-ruthenium alloys via MOFs in situ hydrolysis toward enhanced hydrogen evolution performance in alkaline, Small Methods, 6 (2022) 2101188. [82] J. Chen H. Gao Z. Tao L. Wang R. Li G. Wang Recent progress in mixed rare earth metal-organic frameworks: from synthesis to application Coord. Chem. Rev. 485 2023 215121 J. Chen, H. Gao, Z. Tao, L. Wang, R. Li, G. Wang, Recent progress in mixed rare earth metal-organic frameworks: from synthesis to application, Coord. Chem. Rev. 485 (2023) 215121. [83] Y. Xie C. Feng Y. Guo S. Li C. Guo Y. Zhang J. Wang MOFs derived carbon nanotubes coated CoNi alloy nanocomposites with N-doped rich-defect and abundant cavity structure as efficient trifunctional electrocatalyst Appl. Surf. Sci. 536 2021 147786 Y. Xie, C. Feng, Y. Guo, S. Li, C. Guo, Y. Zhang, J. Wang, MOFs derived carbon nanotubes coated CoNi alloy nanocomposites with N-doped rich-defect and abundant cavity structure as efficient trifunctional electrocatalyst, Appl. Surf. Sci. 536 (2021) 147786. [84] M. Ahmed Recent advancement in bimetallic metal organic frameworks (M′MOFs): synthetic challenges and applications Inorg. Chem. Front. 9 2022 3003 M. Ahmed, Recent advancement in bimetallic metal organic frameworks (M′MOFs): synthetic challenges and applications, Inorg. Chem. Front. 9 (2022) 3003. [85] W. Wei H. Liang K. Parvez X. Zhuang X. Feng K. Müllen Nitrogen-doped carbon nanosheets with size-defined mesopores as highly efficient metal-free catalyst for the oxygen reduction reaction Angew. Chem. Int. Ed. 53 2014 1570 W. Wei, H. Liang, K. Parvez, X. Zhuang, X. Feng, K. Müllen, Nitrogen-doped carbon nanosheets with size-defined mesopores as highly efficient metal-free catalyst for the oxygen reduction reaction, Angew. Chem. Int. Ed. 53 (2014) 1570. [86] S. Chen J. Bi Y. Zhao L. Yang C. Zhang Y. Ma Q. Wu X. Wang Z. Hu Nitrogen-doped carbon nanocages as efficient metal-free electrocatalysts for oxygen reduction reaction Adv. Mater. 24 2012 5593 S. Chen, J. Bi, Y. Zhao, L. Yang, C. Zhang, Y. Ma, Q. Wu, X. Wang, Z. Hu, Nitrogen-doped carbon nanocages as efficient metal-free electrocatalysts for oxygen reduction reaction, Adv. Mater. 24 (2012) 5593. [87] C. Van Nguyen S. Lee Y.G. Chung W.H. Chiang K.C.W. Wu Synergistic effect of metal-organic framework-derived boron and nitrogen heteroatom-doped three-dimensional porous carbons for precious-metal-free catalytic reduction of nitroarenes Appl. Catal. B 257 2019 117888 C. Van Nguyen, S. Lee, Y.G. Chung, W.H. Chiang, K.C.W. Wu, Synergistic effect of metal-organic framework-derived boron and nitrogen heteroatom-doped three-dimensional porous carbons for precious-metal-free catalytic reduction of nitroarenes, Appl. Catal. B, 257 (2019) 117888. [88] M. Li X. Xu Y. Gong Z. Wei Z. Hou H. Li Y. Wang Ultrafinely dispersed Pd nanoparticles on a Cn@MgO hybrid as a bifunctional catalyst for upgrading bioderived compounds Green Chem. 16 2014 4371 M. Li, X. Xu, Y. Gong, Z. Wei, Z. Hou, H. Li, Y. Wang, Ultrafinely dispersed Pd nanoparticles on a Cn@MgO hybrid as a bifunctional catalyst for upgrading bioderived compounds, Green Chem. 16 (2014) 4371. [89] M. Inagaki M. Toyoda Y. Soneda T. Morishita Nitrogen-doped carbon materials Carbon 132 2018 104 N. Y. M. Inagaki, M. Toyoda, Y. Soneda, T. Morishita, Nitrogen-doped carbon materials, Carbon. N. Y. 132 (2018) 104. [90] B. Feng Q. Xu X. Wu C. Ye Y. Fu D.L. Chen F. Zhang W. Zhu MOF-derived N-doped carbon composites embedded with Fe/Fe3C nanoparticles as highly chemoselective and stable catalysts for catalytic transfer hydrogenation of nitroarenes Appl. Surf. Sci. 557 2021 149837 B. Feng, Q. Xu, X. Wu, C. Ye, Y. Fu, D.L. Chen, F. Zhang, W. Zhu, MOF-derived N-doped carbon composites embedded with Fe/Fe3C nanoparticles as highly chemoselective and stable catalysts for catalytic transfer hydrogenation of nitroarenes, Appl. Surf. Sci. 557 (2021) 149837. [91] Q. Xu B. Feng C. Ye Y. Fu D.L. Chen F. Zhang J. Zhang W. Zhu Atomically dispersed vanadium sites anchored on n-doped porous carbon for the efficient oxidative coupling of amines to imines ACS Appl. Mater. Interfaces 13 2021 15168 Q. Xu, B. Feng, C. Ye, Y. Fu, D.L. Chen, F. Zhang, J. Zhang, W. Zhu, Atomically dispersed vanadium sites anchored on n-doped porous carbon for the efficient oxidative coupling of amines to imines, ACS Appl. Mater. Interfaces, 13 (2021) 15168. [92] C. Ye X. Chen S. Li B. Feng Y. Fu F. Zhang D.L. Chen W. Zhu PdZn intermetallic compound stabilized on ZnO/nitrogen-decorated carbon hollow spheres for catalytic semihydrogenation of alkynols Nano Res. 15 2022 3090 C. Ye, X. Chen, S. Li, B. Feng, Y. Fu, F. Zhang, D.L. Chen, W. Zhu, PdZn intermetallic compound stabilized on ZnO/nitrogen-decorated carbon hollow spheres for catalytic semihydrogenation of alkynols, Nano Res. 15 (2022) 3090. [93] Y. Cao S. Mao M. Li Y. Chen Y. Wang Metal/porous carbon composites for heterogeneous catalysis: old catalysts with improved performance promoted by N-doping ACS Catal. 7 2017 8090 Y. Cao, S. Mao, M. Li, Y. Chen, Y. Wang, Metal/porous carbon composites for heterogeneous catalysis: old catalysts with improved performance promoted by N-doping, ACS Catal. 7 (2017) 8090. [94] Y. Bai Y. Zheng Z. Wang Q. Hong S. Liu Y. Shen Y. Zhang Metal-doped carbon nitrides: synthesis, structure and applications New J. Chem. 45 2021 11876 Y. Bai, Y. Zheng, Z. Wang, Q. Hong, S. Liu, Y. Shen, Y. Zhang, Metal-doped carbon nitrides: synthesis, structure and applications, New J. Chem. 45 (2021) 11876. [95] F. Zheng T. Lin K. Wang Y. Wang G. Li Recent advances in bimetallic metal-organic frameworks and their derivatives for thermal catalysis Nano Res. 16 2023 12919 F. Zheng, T. Lin, K. Wang, Y. Wang, G. Li, Recent advances in bimetallic metal-organic frameworks and their derivatives for thermal catalysis, Nano Res. 16 (2023) 12919. [96] J. Guo Y. Qin Y. Zhu X. Zhang C. Long M. Zhao Z. Tang Metal-organic frameworks as catalytic selectivity regulators for organic transformations Chem. Soc. Rev. 50 2021 5366 J. Guo, Y. Qin, Y. Zhu, X. Zhang, C. Long, M. Zhao, Z. Tang, Metal-organic frameworks as catalytic selectivity regulators for organic transformations, Chem. Soc. Rev. 50 (2021) 5366. [97] M.S. Alhumaimess Metal-organic frameworks and their catalytic applications J. Saudi Chem. Soc. 24 2020 461 M.S. Alhumaimess, Metal-organic frameworks and their catalytic applications, J. Saudi Chem. Soc. 24 (2020) 461. [98] R. Wei H. Wang L. Jiang J. Yang W. Li X. Yuan H. Wang J. Liang Y. Chen Y. Bu Molecular self-assembled synthesis of highly dispersed Co single-atom coordinated 2-methylimidazole modified carbon nitride for peroxymonosulfate activation Chem. Eng. J. 471 2023 144494 R. Wei, H. Wang, L. Jiang, J. Yang, W. Li, X. Yuan, H. Wang, J. Liang, Y. Chen, Y. Bu, Molecular self-assembled synthesis of highly dispersed Co single-atom coordinated 2-methylimidazole modified carbon nitride for peroxymonosulfate activation, Chem. Eng. J. 471 (2023) 144494. [99] L. Jiao J.Y.R. Seow W.S. Skinner Z.U. Wang H.L. Jiang Metal-organic frameworks: structures and functional applications Mater. Today 27 2019 43 L. Jiao, J.Y.R. Seow, W.S. Skinner, Z.U. Wang, H.L. Jiang, Metal-organic frameworks: structures and functional applications, Mater. Today, 27 (2019) 43. [100] L. Jiang D. Zhou J. Yang S. Zhou H. Wang X. Yuan J. Liang X. Li Y. Chen H. Li 2D single- and few-layered Mxenes: synthesis, applications and perspectives J. Mater. Chem. A 10 2022 13651 L. Jiang, D. Zhou, J. Yang, S. Zhou, H. Wang, X. Yuan, J. Liang, X. Li, Y. Chen, H. Li, 2D single- and few-layered Mxenes: synthesis, applications and perspectives, J. Mater. Chem. A, 10 (2022) 13651. [101] C. Yang J. Qin S. Sun D. Gao Y. Fang G. Chen C. Tian C. Bao S. Zhang Progress in developing methods for lignin depolymerization and elucidating the associated mechanisms Eur. Polym. J. 210 2024 112995 C. Yang, J. Qin, S. Sun, D. Gao, Y. Fang, G. Chen, C. Tian, C. Bao, S. Zhang, Progress in developing methods for lignin depolymerization and elucidating the associated mechanisms, Eur. Polym. J. 210 (2024) 112995. [102] A.M. Wright M.T. Kapelewski S. Marx O.K. Farha W. Morris Transitioning metal-organic frameworks from the laboratory to market through applied research Nat. Mater. 2024 A.M. Wright, M.T. Kapelewski, S. Marx, O.K. Farha, W. Morris, Transitioning metal-organic frameworks from the laboratory to market through applied research, Nat. Mater. (2024). [103] Z. Xu R. Teng L. Xu H. Zhang B. Lv G. Zhang Assembly of amorphizing porous bimetallic metal-organic frameworks spheres with Zn-O-Fe cluster and coordination deficiency via ligand competition for efficient electro-fenton catalysis Adv. Funct. Mater. 34 2024 2401248 Z. Xu, R. Teng, L. Xu, H. Zhang, B. Lv, G. Zhang, Assembly of amorphizing porous bimetallic metal-organic frameworks spheres with Zn-O-Fe cluster and coordination deficiency via ligand competition for efficient electro-fenton catalysis, Adv. Funct. Mater. 34 (2024) 2401248. [104] S. Sanati R. Abazari J. Albero A. Morsali H. García Z. Liang R. Zou Metal-organic framework derived bimetallic materials for electrochemical energy storage Angew. Chem. Int. Ed. 60 2021 11048 S. Sanati, R. Abazari, J. Albero, A. Morsali, H. García, Z. Liang, R. Zou, Metal-organic framework derived bimetallic materials for electrochemical energy storage, Angew. Chem. Int. Ed. 60 (2021) 11048. [105] Y. Pan S. Sanati R. Abazari A. Jankowska J. Goscianska V. Srivastava U. Lassi J. Gao Vanadium- and manganese-based metal-organic frameworks for potential environmental and catalysis applications Coord. Chem. Rev. 522 2025 216231 Y. Pan, S. Sanati, R. Abazari, A. Jankowska, J. Goscianska, V. Srivastava, U. Lassi, J. Gao, Vanadium- and manganese-based metal-organic frameworks for potential environmental and catalysis applications, Coord. Chem. Rev. 522 (2025) 216231. [106] V.B. Saptal V. Ruta M.A. Bajada G. Vilé Single-atom catalysis in organic synthesis Angew. Chem. Int. Ed. 62 2023 e202219306 V.B. Saptal, V. Ruta, M.A. Bajada, G. Vilé, Single-atom catalysis in organic synthesis, Angew. Chem. Int. Ed. 62 (2023) e202219306. [107] Z. Wu Y. Li C. Zhang X. Huang B. Peng G. Wang Recent advances in metal-organic-framework-based catalysts for thermocatalytic selective oxidation of organic substances Chem. Catal. 2 2022 1009 1045 Z. Wu, Y. Li, C. Zhang, X. Huang, B. Peng, G. Wang, Recent advances in metal-organic-framework-based catalysts for thermocatalytic selective oxidation of organic substances, Chem. Catal. 2 (2022) 1009–1045. [108] Q.Y. Guo Z. Wang X. Feng Y. Fan W. Lin Generation and stabilization of a dinickel catalyst in a metal-organic framework for selective hydrogenation reactions Angew. Chem. Int. Ed. 62 2023 e202306905 Q.Y. Guo, Z. Wang, X. Feng, Y. Fan, W. Lin, Generation and stabilization of a dinickel catalyst in a metal-organic framework for selective hydrogenation reactions, Angew. Chem. Int. Ed. 62 (2023) e202306905. [109] Q. Wang Y. Gong Y. Tan X. Zi R. Abazari H. Li C. Cai K. Liu J. Fu S. Chen T. Luo S. Zhang W. Li Y. Sheng J. Liu M. Liu Cooperative alkaline hydrogen evolution via inducing local electric field and electron localization Chin. J. Catal. 54 2023 229 Q. Wang, Y. Gong, Y. Tan, X. Zi, R. Abazari, H. Li, C. Cai, K. Liu, J. Fu, S. Chen, T. Luo, S. Zhang, W. Li, Y. Sheng, J. Liu, M. Liu, Cooperative alkaline hydrogen evolution via inducing local electric field and electron localization, Chin. J. Catal. 54 (2023) 229. [110] P. Serna A. Corma Transforming nano metal nonselective particulates into chemoselective catalysts for hydrogenation of substituted nitrobenzenes ACS Catal. 5 2015 7114 P. Serna, A. Corma, Transforming nano metal nonselective particulates into chemoselective catalysts for hydrogenation of substituted nitrobenzenes, ACS Catal. 5 (2015) 7114. [111] D. Formenti F. Ferretti F.K. Scharnagl M. Beller Reduction of nitro compounds using 3d-non-noble metal catalysts Chem. Rev. 119 2019 2611 D. Formenti, F. Ferretti, F.K. Scharnagl, M. Beller, Reduction of nitro compounds using 3d-non-noble metal catalysts, Chem. Rev. 119 (2019) 2611. [112] R.S. Downing P.J. Kunkeler H. van Bekkum Catalytic syntheses of aromatic amines Catal. Today 37 1997 121 R.S. Downing, P.J. Kunkeler, H. van Bekkum, Catalytic syntheses of aromatic amines, Catal. Today, 37 (1997) 121. [113] M. Shen H. Liu C. Yu Z. Yin M. Muzzio J. Li Z. Xi Y. Yu S. Sun Room-temperature chemoselective reduction of 3-nitrostyrene to 3-vinylaniline by ammonia borane over Cu nanoparticles J. Am. Chem. Soc. 140 2018 16460 M. Shen, H. Liu, C. Yu, Z. Yin, M. Muzzio, J. Li, Z. Xi, Y. Yu, S. Sun, Room-temperature chemoselective reduction of 3-nitrostyrene to 3-vinylaniline by ammonia borane over Cu nanoparticles, J. Am. Chem. Soc. 140 (2018) 16460. [114] W.S. A J.W. A X.L. A J.L. A G.M. A W.L.A. B G.L. A Highly chemoselective synthesis of imine over Co/Zn bimetallic MOFs derived Co3ZnC-ZnO embed in carbon nanosheet catalyst J. Catal. 401 2021 17 W.S. A, J.W. A, X.L. A, J.L. A, G.M. A, W.L.A. B, G.L. A, Highly chemoselective synthesis of imine over Co/Zn bimetallic MOFs derived Co3ZnC-ZnO embed in carbon nanosheet catalyst, J. Catal. 401 (2021) 17. [115] W. Li R. Fu X. Luo X. Wang A banana-like Ni-mgo solid solution catalyst derived from bimetallic Ni-Mg@MOFs for hydrogenation of nitroarenes Curr. Org. Chem. 27 2023 465 W. Li, R. Fu, X. Luo, X. Wang, A banana-like Ni-mgo solid solution catalyst derived from bimetallic Ni-Mg@MOFs for hydrogenation of nitroarenes, Curr. Org. Chem. 27 (2023) 465. [116] Y. Zhong P. Liao J. Kang Q. Liu S. Wang S. Li X. Liu G. Li Locking effect in Metal@MOF with superior stability for highly chemoselective catalysis J. Am. Chem. Soc. 145 2023 4659 Y. Zhong, P. Liao, J. Kang, Q. Liu, S. Wang, S. Li, X. Liu, G. Li, Locking effect in Metal@MOF with superior stability for highly chemoselective catalysis, J. Am. Chem. Soc. 145 (2023) 4659. [117] X. Li W. She J. Wang W. Li G. Li A highly efficient LaOCl supported Fe–Fe3C-based catalyst for hydrogenation of nitroarenes fabricated by coordination-assisted pyrolysis Catal. Sci. Technol. 11 2021 4627 X. Li, W. She, J. Wang, W. Li, G. Li, A highly efficient LaOCl supported Fe–Fe3C-based catalyst for hydrogenation of nitroarenes fabricated by coordination-assisted pyrolysis, Catal. Sci. Technol. 11 (2021) 4627. [118] F. Tang L. Wang G. Zhang M. Zhang Y.N. Liu Creating coordination mismatch in MOFs: tuning from pore structure of the derived supported catalysts to their catalytic performance Ind. Eng. Chem. Res. 58 2019 5543 F. Tang, L. Wang, G. Zhang, M. Zhang, Y.N. Liu, Creating coordination mismatch in MOFs: tuning from pore structure of the derived supported catalysts to their catalytic performance, Ind. Eng. Chem. Res. 58 (2019) 5543. [119] M.L. Gao L. Li Z.X. Sun J.R. Li H.L. Jiang Facet engineering of a metal-organic framework support modulates the microenvironment of palladium nanoparticles for selective hydrogenation Angew. Chem. Int. Ed. 61 2022 e202211216 M.L. Gao, L. Li, Z.X. Sun, J.R. Li, H.L. Jiang, Facet engineering of a metal-organic framework support modulates the microenvironment of palladium nanoparticles for selective hydrogenation, Angew. Chem. Int. Ed. 61 (2022) e202211216. [120] S. Lu L. Zhu L. Guo P. Li X. Xia C. Li F. Li Hydrogenation of furfural over Pd@ZIF-67 derived catalysts: direct hydrogenation and transfer hydrogenation New J. Chem. 46 2022 13715 S. Lu, L. Zhu, L. Guo, P. Li, X. Xia, C. Li, F. Li, Hydrogenation of furfural over Pd@ZIF-67 derived catalysts: direct hydrogenation and transfer hydrogenation, New J. Chem. 46 (2022) 13715. [121] X. Li Z.F. Jiao J.X. Zhao T.Y. Xu X.Y. Guo Catalytic performances of Ag/SiC catalysts for styrene epoxidation in O2 atmosphere Appl. Catal. A-Gen. 688 2024 X. Li, Z.F. Jiao, J.X. Zhao, T.Y. Xu, X.Y. Guo, Catalytic performances of Ag/SiC catalysts for styrene epoxidation in O2 atmosphere, Appl. Catal. A-Gen. 688 (2024). [122] Z.Y. Zheng Z.F. Jiao J.X. Zhao X.C. Liu C.D. Song J.H. Li X.Y. Guo Selective adsorption of SiC quantum dots to C=O bond promoting the catalytic hydrogenation of cinnamaldehyde Chem. Eng. J. 503 2025 158727 Z.Y. Zheng, Z.F. Jiao, J.X. Zhao, X.C. Liu, C.D. Song, J.H. Li, X.Y. Guo, Selective adsorption of SiC quantum dots to C=O bond promoting the catalytic hydrogenation of cinnamaldehyde, Chem. Eng. J. 503 (2025) 158727. [123] W. Yao J. Chen Y. Wang R. Fang Z. Qin X. Yang L. Chen Y. Li Nitrogen-doped carbon composites with ordered macropores and hollowwalls Angew. Chem. Int. Ed. 60 2021 23729 W. Yao, J. Chen, Y. Wang, R. Fang, Z. Qin, X. Yang, L. Chen, Y. Li, Nitrogen-doped carbon composites with ordered macropores and hollowwalls, Angew. Chem. Int. Ed. 60 (2021) 23729. [124] Q. Yang D. Gao C. Li S. Cao S. Li H. Zhao C. Li G. Zheng G. Chen Deposition of Pt clusters onto MOFs-derived CeO2 by ALD for selective hydrogenation of furfural Fuel 311 2022 122584 Q. Yang, D. Gao, C. Li, S. Cao, S. Li, H. Zhao, C. Li, G. Zheng, G. Chen, Deposition of Pt clusters onto MOFs-derived CeO2 by ALD for selective hydrogenation of furfural, Fuel, 311 (2022) 122584. [125] K.W. Golub T.P. Sulmonetti L.A. Darunte M.S. Shealy C.W. Jones Metal–organic-framework-derived Co/Cu–carbon nanoparticle catalysts for furfural hydrogenation ACS Appl. Nano Mater. 2 2019 6040 K.W. Golub, T.P. Sulmonetti, L.A. Darunte, M.S. Shealy, C.W. Jones, Metal–organic-framework-derived Co/Cu–carbon nanoparticle catalysts for furfural hydrogenation, ACS Appl. Nano Mater. 2 (2019) 6040. [126] J. Wu D. Liang X. Song T. Liu T. Xu S. Wang Y. Zou Sulfonic groups functionalized Zr-metal organic framework for highly catalytic transfer hydrogenation of furfural to furfuryl alcohol J. Energy Chem. 71 2022 411 J. Wu, D. Liang, X. Song, T. Liu, T. Xu, S. Wang, Y. Zou, Sulfonic groups functionalized Zr-metal organic framework for highly catalytic transfer hydrogenation of furfural to furfuryl alcohol, J. Energy Chem. 71 (2022) 411. [127] Z. Wang Q. Luo S. Mao C. Wang J. Xiong Z. Chen Y. Wang Fundamental aspects of alkyne semi-hydrogenation over heterogeneous catalysts Nano Res. 15 2022 10044 Z. Wang, Q. Luo, S. Mao, C. Wang, J. Xiong, Z. Chen, Y. Wang, Fundamental aspects of alkyne semi-hydrogenation over heterogeneous catalysts, Nano Res. 15 (2022) 10044. [128] X. Ge Y. Cao K. Yan Y. Li L. Zhou S. Dai J. Zhang X. Gong G. Qian X. Zhou W. Yuan X. Duan Increasing the distance of adjacent palladium atoms for configuration matching in selective hydrogenation Angew. Chem. Int. Ed. 61 2022 e202215225 X. Ge, Y. Cao, K. Yan, Y. Li, L. Zhou, S. Dai, J. Zhang, X. Gong, G. Qian, X. Zhou, W. Yuan, X. Duan, Increasing the distance of adjacent palladium atoms for configuration matching in selective hydrogenation, Angew. Chem. Int. Ed. 61 (2022) e202215225. [129] R. Bai G. He L. Li T. Zhang J. Li X. Wang X. Wang Y. Zou D. Mei A. Corma J. Yu Encapsulation of palladium carbide subnanometric species in zeolite boosts highly selective semihydrogenation of alkynes Angew. Chem. Int. Ed. 62 2023 e202313101 R. Bai, G. He, L. Li, T. Zhang, J. Li, X. Wang, X. Wang, Y. Zou, D. Mei, A. Corma, J. Yu, Encapsulation of palladium carbide subnanometric species in zeolite boosts highly selective semihydrogenation of alkynes, Angew. Chem. Int. Ed. 62 (2023) e202313101. [130] J.L. Ling K. Chen C.D. Wu Interwrapping distinct metal-organic frameworks in dualmofs for the creation of unique composite catalysts Research 2021 9835935 2021 J.L. Ling, K. Chen, C.D. Wu, Interwrapping distinct metal-organic frameworks in dualmofs for the creation of unique composite catalysts, Research 2021 (2021) 9835935. [131] N. Li S. Weng A.J. McCue Y. Song Y. He Y. Liu J. Feng D. Li Metal–organic framework-derived Ni–S/C catalysts for selective alkyne hydrogenation ACS Appl. Mater. Interfaces 15 2023 48135 N. Li, S. Weng, A.J. McCue, Y. Song, Y. He, Y. Liu, J. Feng, D. Li, Metal–organic framework-derived Ni–S/C catalysts for selective alkyne hydrogenation, ACS Appl. Mater. Interfaces, 15 (2023) 48135. [132] J. Cai Y. Chen H. Song L. Hou Z. Li MOF derived C/Co@C with a “one-way-valve”-like graphitic carbon layer for selective semi-hydrogenation of aromatic alkynes ChemCatChem 12 2020 6241 J. Cai, Y. Chen, H. Song, L. Hou, Z. Li, MOF derived C/Co@C with a “one-way-valve”-like graphitic carbon layer for selective semi-hydrogenation of aromatic alkynes, ChemCatChem, 12 (2020) 6241. [133] L. Li W. Yang Q. Yang Q. Guan J. Lu S.H. Yu H.L. Jiang Accelerating chemo- and regioselective hydrogenation of alkynes over bimetallic nanoparticles in a metal–organic framework ACS Catal. 10 2020 7753 L. Li, W. Yang, Q. Yang, Q. Guan, J. Lu, S.H. Yu, H.L. Jiang, Accelerating chemo- and regioselective hydrogenation of alkynes over bimetallic nanoparticles in a metal–organic framework, ACS Catal. 10 (2020) 7753. [134] V.R. Bakuru D. Samanta T.K. Maji S.B. Kalidindi Transfer hydrogenation of alkynes into alkenes by ammonia borane over pd-mof catalysts Dalton Trans. 49 2020 5024 V.R. Bakuru, D. Samanta, T.K. Maji, S.B. Kalidindi, Transfer hydrogenation of alkynes into alkenes by ammonia borane over pd-mof catalysts, Dalton Trans. 49 (2020) 5024. [135] Y. Liang Z. Zhang X. Su X. Feng S. Xing W. Liu R. Huang Y. Liu Coordination defect-induced frustrated lewis pairs in polyoxo-metalate-based metal-organic frameworks for efficient catalytic hydrogenation Angew. Chem. Int. Ed. 62 2023 e202309030 Y. Liang, Z. Zhang, X. Su, X. Feng, S. Xing, W. Liu, R. Huang, Y. Liu, Coordination defect-induced frustrated lewis pairs in polyoxo-metalate-based metal-organic frameworks for efficient catalytic hydrogenation, Angew. Chem. Int. Ed. 62 (2023) e202309030. [136] Y. Zhang J. Zhao G. Fan L. Yang F. Li Robust MOF-derived carbon-supported bimetallic Ni–Co catalysts for aqueous phase hydrodeoxygenation of vanillin Dalton Trans. 51 2022 2238 Y. Zhang, J. Zhao, G. Fan, L. Yang, F. Li, Robust MOF-derived carbon-supported bimetallic Ni–Co catalysts for aqueous phase hydrodeoxygenation of vanillin, Dalton Trans. 51 (2022) 2238. [137] R. Guo X. Zhang X. Li D. Niu H. Sun Porphyrin-MOF-derived carbon-encapsulated copper as a selective and leaching resistant catalyst for the hydrogenation of nitriles J. Taiwan Inst. Chem. Eng. 140 2022 104561 R. Guo, X. Zhang, X. Li, D. Niu, H. Sun, Porphyrin-MOF-derived carbon-encapsulated copper as a selective and leaching resistant catalyst for the hydrogenation of nitriles, J. Taiwan Inst. Chem. Eng. 140 (2022) 104561. [138] P. Yuan X. Liao H. Cui F. Hao W. Xiong H.a. Luo Y. Lv P. Liu Decarboxylation-induced defects in MOF-derived Ni@C catalysts for efficient chemoselective hydrogenation of nitrocyclohexane to cyclohexanone oxime ACS Catal. 13 2023 3224 P. Yuan, X. Liao, H. Cui, F. Hao, W. Xiong, H.a. Luo, Y. Lv, P. Liu, Decarboxylation-induced defects in MOF-derived Ni@C catalysts for efficient chemoselective hydrogenation of nitrocyclohexane to cyclohexanone oxime, ACS Catal. 13 (2023) 3224. [139] Y. Ma Z. Shan X. Wang W. Zhao M. Gao K. Wang L. Ning X. Liu H. Yu Coordination-driven self-assembly of schiff-base-tagged Ni–ZrO2/N–C nanocatalysts for selective transformation of renewable methyl levulinate ACS Appl. Nano Mater. 6 2023 11772 Y. Ma, Z. Shan, X. Wang, W. Zhao, M. Gao, K. Wang, L. Ning, X. Liu, H. Yu, Coordination-driven self-assembly of schiff-base-tagged Ni–ZrO2/N–C nanocatalysts for selective transformation of renewable methyl levulinate, ACS Appl. Nano Mater. 6 (2023) 11772. [140] P. Ding E. Fayad O.A. Abu Ali H.L. Qin A green, cheap and robust method for selective hydrogenation of nitroarenes Tetrahedron 167 2024 134269 P. Ding, E. Fayad, O.A. Abu Ali, H.L. Qin, A green, cheap and robust method for selective hydrogenation of nitroarenes, Tetrahedron 167 (2024) 134269. [141] T.M. Bustamante M.A. Fraga J.L.G. Fierro C.H. Campos G. Pecchi Cobalt SiO2 core-shell catalysts for chemoselective hydrogenation of cinnamaldehyde Catal. Today 356 2020 330 T.M. Bustamante, M.A. Fraga, J.L.G. Fierro, C.H. Campos, G. Pecchi, Cobalt SiO2 core-shell catalysts for chemoselective hydrogenation of cinnamaldehyde, Catal. Today, 356 (2020) 330. [142] A.S. Nagpure L. Gurrala P. Gogoi S.V. Chilukuri Hydrogenation of cinnamaldehyde to hydrocinnamaldehyde over Pd nanoparticles deposited on nitrogen-doped mesoporous carbon RSC Adv. 6 2016 44333 A.S. Nagpure, L. Gurrala, P. Gogoi, S.V. Chilukuri, Hydrogenation of cinnamaldehyde to hydrocinnamaldehyde over Pd nanoparticles deposited on nitrogen-doped mesoporous carbon, RSC Adv. 6 (2016) 44333. [143] F. Yang M. Wang W. Liu B. Yang Y. Wang J. Luo Y. Tang L. Hou Y. Li Z. Li B. Zhang W. Yang Y. Li Atomically dispersed Ni as the active site towards selective hydrogenation of nitroarenes Green Chem. 21 2019 704 F. Yang, M. Wang, W. Liu, B. Yang, Y. Wang, J. Luo, Y. Tang, L. Hou, Y. Li, Z. Li, B. Zhang, W. Yang, Y. Li, Atomically dispersed Ni as the active site towards selective hydrogenation of nitroarenes, Green Chem. 21 (2019) 704. [144] L. Zhang X. Liu X. Zhou S. Gao N. Shang C. Feng C. Wang Ultrafine Pd nanoparticles anchored on nitrogen-doping carbon for boosting catalytic transfer hydrogenation of nitroarenes ACS Omega 3 2018 10843 L. Zhang, X. Liu, X. Zhou, S. Gao, N. Shang, C. Feng, C. Wang, Ultrafine Pd nanoparticles anchored on nitrogen-doping carbon for boosting catalytic transfer hydrogenation of nitroarenes, ACS Omega, 3 (2018) 10843. [145] J. Zhang Y. Liu Z. Jia S.Liu ShitaoYu L. Li Q. Wu H. Yu Y. Liu X. Jiang Y. Liu C. Xu Selective hydrogenation of furfural to furfuryl alcohol over copper-cobalt bimetallic catalyst Chem. Eng. J. 490 2024 151677 J. Zhang, Y. Liu, Z. Jia, ShitaoYu, S.Liu, L. Li, Q. Wu, H. Yu, Y. Liu, X. Jiang, Y. Liu, C. Xu, Selective hydrogenation of furfural to furfuryl alcohol over copper-cobalt bimetallic catalyst, Chem. Eng. J. 490 (2024) 151677. [146] H. Zhang J. Yang T. Zhao F. Lan Y. Luo F. Han X. Qiao Q. Guan M. Qiu W. Li In-situ constructing ultrafine NiCo alloy confined in LDH nanoflower for efficient selective hydrogenation of furfural Chem. Eng. J. 494 2024 152881 H. Zhang, J. Yang, T. Zhao, F. Lan, Y. Luo, F. Han, X. Qiao, Q. Guan, M. Qiu, W. Li, In-situ constructing ultrafine NiCo alloy confined in LDH nanoflower for efficient selective hydrogenation of furfural, Chem. Eng. J. 494 (2024) 152881. [147] Q. Guo R. Chen J. Guo C. Qin Z. Xiong H. Yan W. Gao Q. Pei A. Wu P. Chen Enabling semihydrogenation of alkynes to alkenes by using a calcium palladium complex hydride J. Am. Chem. Soc. 143 2021 2089 Q. Guo, R. Chen, J. Guo, C. Qin, Z. Xiong, H. Yan, W. Gao, Q. Pei, A. Wu, P. Chen, Enabling semihydrogenation of alkynes to alkenes by using a calcium palladium complex hydride, J. Am. Chem. Soc.143 (2021) 2089. [148] Y. Wu X. Lu P. Cui W. Jia J. Zhou Y. Wang H. Zahid Y. Wu M.U. Rafique X. Yin B. Li L. Wang G. Xiang Enhancing alkyne semi-hydrogenation through engineering metal-support interactions of Pd on oxides Nano Res. 17 2024 370 Y. Wu, X. Lu, P. Cui, W. Jia, J. Zhou, Y. Wang, H. Zahid, Y. Wu, M.U. Rafique, X. Yin, B. Li, L. Wang, G. Xiang, Enhancing alkyne semi-hydrogenation through engineering metal-support interactions of Pd on oxides, Nano Res. 17 (2024) 370. [149] H. Wang S. Wang S. Liu Y. Dai Z. Jia X. Li S. Liu F. Dang K.J. Smith X. Nie S. Hou X. Guo Redox-induced controllable engineering of MnO2-MnxCo3-xO4 interface to boost catalytic oxidation of ethane Nat. Commun. 15 2024 4118 H. Wang, S. Wang, S. Liu, Y. Dai, Z. Jia, X. Li, S. Liu, F. Dang, K.J. Smith, X. Nie, S. Hou, X. Guo, Redox-induced controllable engineering of MnO2-MnxCo3-xO4 interface to boost catalytic oxidation of ethane, Nat. Commun. 15 (2024) 4118. [150] T. Feng S. Zhang C. Li T. Li One-step solvent-free aerobic oxidation of aliphatic alcohols to esters using a tandem Sc–Ru⊂MOF catalyst Green Chem. 24 2022 1474 T. Feng, S. Zhang, C. Li, T. Li, One-step solvent-free aerobic oxidation of aliphatic alcohols to esters using a tandem Sc–Ru⊂MOF catalyst, Green Chem. 24 (2022) 1474. [151] C. Ayed J. Yin K. Landfester K.A.I. Zhang Visible-light-promoted switchable selective oxidations of styrene over covalent triazine frameworks in water Angew. Chem. Int. Ed. 62 2023 e202216159 C. Ayed, J. Yin, K. Landfester, K.A.I. Zhang, Visible-light-promoted switchable selective oxidations of styrene over covalent triazine frameworks in water, Angew. Chem. Int. Ed. 62 (2023) e202216159. [152] D. Ma Y. Zhang H. Zhao K. Liu L. Wang Directing two copper porphyrin based polymers as highly efficient heterogeneous catalysts for styrene oxidation Appl. Surf. Sci. 571 2022 151363 D. Ma, Y. Zhang, H. Zhao, K. Liu, L. Wang, Directing two copper porphyrin based polymers as highly efficient heterogeneous catalysts for styrene oxidation, Appl. Surf. Sci. 571 (2022) 151363. [153] J. Dang W. Li B. Qin Y. Chai G. Wu L. Li Self-adjusted reaction pathway enables efficient oxidation of aromatic C–H bonds over zeolite-encaged single-site cobalt catalyst Chin. J. Catal. 57 2024 133 J. Dang, W. Li, B. Qin, Y. Chai, G. Wu, L. Li, Self-adjusted reaction pathway enables efficient oxidation of aromatic C–H bonds over zeolite-encaged single-site cobalt catalyst, Chin. J. Catal. 57 (2024) 133. [154] K. Huang L.L. Guo D.F. Wu Synthesis of metal Salen@MOFs and their catalytic performance for styrene oxidation Ind. Eng. Chem. Res. 58 2019 4744 K. Huang, L.L. Guo, D.F. Wu, Synthesis of metal Salen@MOFs and their catalytic performance for styrene oxidation, Ind. Eng. Chem. Res. 58 (2019) 4744. [155] D. Hu X. Song H. Zhang X. Chang C. Zhao M. Jia Aerobic epoxidation of styrene over Zr-based metal-organic framework encapsulated transition metal substituted phosphomolybdic acid Mol. Catal. 506 2021 111552 D. Hu, X. Song, H. Zhang, X. Chang, C. Zhao, M. Jia, Aerobic epoxidation of styrene over Zr-based metal-organic framework encapsulated transition metal substituted phosphomolybdic acid, Mol. Catal. 506 (2021) 111552. [156] Y. Xiao W. Guo H. Chen H. Li X. Xu P. Wu Y. Shen B. Zheng F. Huo W.D. Wei Ultrathin 2D Cu-porphyrin MOF nanosheets as a heterogeneous catalyst for styrene oxidation Mater. Chem. Front. 3 2019 1580 Y. Xiao, W. Guo, H. Chen, H. Li, X. Xu, P. Wu, Y. Shen, B. Zheng, F. Huo, W.D. Wei, Ultrathin 2D Cu-porphyrin MOF nanosheets as a heterogeneous catalyst for styrene oxidation, Mater. Chem. Front. 3 (2019) 1580. [157] Q. Hao Z. Li Y. Shi R. Li Y. Li L. Wang H. Yuan S. Ouyang T. Zhang Plasmon-induced radical-radical heterocoupling boosts photodriven oxidative esterification of benzyl alcohol over nitrogen-doped carbon-encapsulated cobalt nanoparticles Angew. Chem. Int. Ed. 62 2023 e202312808 Q. Hao, Z. Li, Y. Shi, R. Li, Y. Li, L. Wang, H. Yuan, S. Ouyang, T. Zhang, Plasmon-induced radical-radical heterocoupling boosts photodriven oxidative esterification of benzyl alcohol over nitrogen-doped carbon-encapsulated cobalt nanoparticles, Angew. Chem. Int. Ed. 62 (2023) e202312808. [158] D. Tang G. Lu Z. Shen Y. Hu L. Yao B. Li G. Zhao B. Peng X. Huang A review on photo-, electro- and photoelectro- catalytic strategies for selective oxidation of alcohols J. Energy Chem. 77 2023 80 D. Tang, G. Lu, Z. Shen, Y. Hu, L. Yao, B. Li, G. Zhao, B. Peng, X. Huang, A review on photo-, electro- and photoelectro- catalytic strategies for selective oxidation of alcohols, J. Energy Chem. 77 (2023) 80. [159] J. Shi S. Wang M. Wang X. Wang W. Li Robust salen-typed Ce-mofs supported Fe(III) catalyst fabricated by metalloligand strategy for catalytic epoxides with alcohols Mol. Catal. 533 2022 112764 J. Shi, S. Wang, M. Wang, X. Wang, W. Li, Robust salen-typed Ce-mofs supported Fe(III) catalyst fabricated by metalloligand strategy for catalytic epoxides with alcohols, Mol. Catal. 533 (2022) 112764. [160] J. Shi X. Wang W. Li Highly uniform Fe-based mofs fabricated by mixed-linker strategy for ring-opening of epoxides with alcohols Mater. Lett. 331 2023 133506 J. Shi, X. Wang, W. Li, Highly uniform Fe-based mofs fabricated by mixed-linker strategy for ring-opening of epoxides with alcohols, Mater. Lett. 331 (2023) 133506. [161] J. Wang W. She X. Li Z. Li J. Li G. Mao W. Li G. Li A highly efficient Co-based catalyst fabricated by coordination-assisted impregnation strategy towards tandem catalytic functionalization of nitroarenes with various alcohols J. Catal. 2021 404 J. Wang, W. She, X. Li, Z. Li, J. Li, G. Mao, W. Li, G. Li, A highly efficient Co-based catalyst fabricated by coordination-assisted impregnation strategy towards tandem catalytic functionalization of nitroarenes with various alcohols, J. Catal. (2021) 404. [162] R. Li X. Li D. Ramella Y. Zhao Y. Luan An efficient and recyclable Cu@UIO-67-bpy catalyst for the selective oxidation of alcohols and the epoxidation of olefins New J. Chem. 46 2022 5839 R. Li, X. Li, D. Ramella, Y. Zhao, Y. Luan, An efficient and recyclable Cu@UIO-67-bpy catalyst for the selective oxidation of alcohols and the epoxidation of olefins, New J. Chem. 46 (2022) 5839. [163] J. Hao Z. Long L. Sun W. Zhan X. Wang X. Han Hierarchical CeO2@N–C ultrathin nanosheets for efficient selective oxidation of benzylic alcohols in water Inorg. Chem. 60 2021 7732 J. Hao, Z. Long, L. Sun, W. Zhan, X. Wang, X. Han, Hierarchical CeO2@N–C ultrathin nanosheets for efficient selective oxidation of benzylic alcohols in water, Inorg. Chem. 60 (2021) 7732. [164] X. Wang X. Zhang P. Li K.i. Otake Y. Cui J. Lyu M.D. Krzyaniak Y. Zhang Z. Li J. Liu C.T. Buru T. Islamoglu M.R. Wasielewski Z. Li O.K. Farha Vanadium catalyst on isostructural transition metal, lanthanide, and actinide based metal–organic frameworks for alcohol oxidation J. Am. Chem. Soc. 141 2019 8306 X. Wang, X. Zhang, P. Li, K.i. Otake, Y. Cui, J. Lyu, M.D. Krzyaniak, Y. Zhang, Z. Li, J. Liu, C.T. Buru, T. Islamoglu, M.R. Wasielewski, Z. Li, O.K. Farha, Vanadium catalyst on isostructural transition metal, lanthanide, and actinide based metal–organic frameworks for alcohol oxidation, J. Am. Chem. Soc. 141 (2019) 8306. [165] J. Nikl K. Hofman S. Mossazghi I.C. Möller D. Mondeshki F. Weinelt F.E. Baumann S.R. Waldvogel Electrochemical oxo-functionalization of cyclic alkanes and alkenes using nitrate and oxygen Nat. Commun. 14 2023 4565 J. Nikl, K. Hofman, S. Mossazghi, I.C. Möller, D. Mondeshki, F. Weinelt, F.E. Baumann, S.R. Waldvogel, Electrochemical oxo-functionalization of cyclic alkanes and alkenes using nitrate and oxygen, Nat. Commun. 14 (2023) 4565. [166] H. Shen Y. Wang J. Deng L. Zhang Y. She Catalyst-free and solvent-free oxidation of cycloalkanes (C5-C8) with molecular oxygen: determination of autoxidation temperature and product distribution Chin. J. Chem. Eng. 26 2018 1064 H. Shen, Y. Wang, J. Deng, L. Zhang, Y. She, Catalyst-free and solvent-free oxidation of cycloalkanes (C5-C8) with molecular oxygen: determination of autoxidation temperature and product distribution, Chin. J. Chem. Eng. 26 (2018) 1064. [167] Z. Shi Y. Jiang J. Yu S. Chen J. Chen Z. Tang L. Zheng Developing the low-temperature oxidation mechanism of cyclopentane: an experimental and theoretical study Chem. Eur. J. 28 2022 e202103546 Z. Shi, Y. Jiang, J. Yu, S. Chen, J. Chen, Z. Tang, L. Zheng, Developing the low-temperature oxidation mechanism of cyclopentane: an experimental and theoretical study, Chem. Eur. J. 28 (2022) e202103546. [168] T. Tang Y. Dai J. Liu J. Chen B. Dai B. Zhao C. Wang Supported Fe ions on different Zr-based metal–organic frameworks for alkane oxidation ACS Appl. Eng. Mater. 1 2023 2368 T. Tang, Y. Dai, J. Liu, J. Chen, B. Dai, B. Zhao, C. Wang, Supported Fe ions on different Zr-based metal–organic frameworks for alkane oxidation, ACS Appl. Eng. Mater. 1 (2023) 2368. [169] H.M. Shen X. Wang L. Ning A.B. Guo J.H. Deng Y.B. She Efficient oxidation of cycloalkanes with simultaneously increased conversion and selectivity using O2 catalyzed by metalloporphyrins and boosted by Zn(AcO)2: a practical strategy to inhibit the formation of aliphatic diacids Appl. Catal. A-Gen. 609 2021 117904 H.M. Shen, X. Wang, L. Ning, A.B. Guo, J.H. Deng, Y.B. She, Efficient oxidation of cycloalkanes with simultaneously increased conversion and selectivity using O2 catalyzed by metalloporphyrins and boosted by Zn(AcO)2: a practical strategy to inhibit the formation of aliphatic diacids, Appl. Catal. A-Gen. 609 (2021) 117904. [170] S.W. Li W. Wang J.S. Zhao Effective and reusable oxidative desulfurization of dibenzothiophene via magnetic amino-MIL-101 supported H3PMo6W6O40 components: comparison influence on various Types of MIL-101 Energy Fuels 34 2020 4837 S.W. Li, W. Wang, J.S. Zhao, Effective and reusable oxidative desulfurization of dibenzothiophene via magnetic amino-MIL-101 supported H3PMo6W6O40 components: comparison influence on various Types of MIL-101, Energy Fuels, 34 (2020) 4837. [171] J. Sun H.S. Jena S. Abednatanzi Y.Y. Liu K. Leus P.V.D. Voort A green alternative for the direct aerobic iodination of arenes using molecular iodine and a POM@MOF catalyst ACS Appl. Mater. Interfaces 14 2022 37681 J. Sun, H.S. Jena, S. Abednatanzi, Y.Y. Liu, K. Leus, P.V.D. Voort, A green alternative for the direct aerobic iodination of arenes using molecular iodine and a POM@MOF catalyst, ACS Appl. Mater. Interfaces, 14 (2022) 37681. [172] X.F. Li P. Wu L. Kan Q. Niu S.N. Sun Q. Huang Y.Q. Lan Integrating metal complex units and redox sites into thorium-based metal-organic frameworks for selective photocatalytic oxidation ofsulfides Adv. Funct. Mater. 33 2023 2308534 X.F. Li, P. Wu, L. Kan, Q. Niu, S.N. Sun, Q. Huang, Y.Q. Lan, Integrating metal complex units and redox sites into thorium-based metal-organic frameworks for selective photocatalytic oxidation ofsulfides, Adv. Funct. Mater. 33 (2023) 2308534. [173] Z. Wang X. Hou J. Shen T. Li Supported cobalt oxide nanocrystals: morphology control and catalytic performance for styrene oxidation RSC Adv. 6 2016 89503 Z. Wang, X. Hou, J. Shen, T. Li, Supported cobalt oxide nanocrystals: morphology control and catalytic performance for styrene oxidation, RSC Adv. 6 (2016) 89503. [174] Q. Hao Z. Li Y. Shi R. Li Y. Li L. Wang H. Yuan S. Ouyang T. Zhang Plasmon-induced radical-radical heterocoupling boosts photodriven oxidative esterification of benzyl alcohol over nitrogen-doped carbon-encapsulated cobalt nanoparticles Angew. Chem. Int. Ed. 62 2023 e202312808 Q. Hao, Z. Li, Y. Shi, R. Li, Y. Li, L. Wang, H. Yuan, S. Ouyang, T. Zhang, Plasmon-induced radical-radical heterocoupling boosts photodriven oxidative esterification of benzyl alcohol over nitrogen-doped carbon-encapsulated cobalt nanoparticles, Angew. Chem. Int. Ed. 62 (2023) e202312808. [175] N.T. Thao L.T.K. Huyen A. Köckritz Catalytic role of Pd(II) ions in Mg-Al hydrotalcites for the oxidation of styrene Catal. Lett. 149 2019 3370 N.T. Thao, L.T.K. Huyen, A. Köckritz, Catalytic role of Pd(II) ions in Mg-Al hydrotalcites for the oxidation of styrene, Catal. Lett. 149 (2019) 3370. [176] I. Garcia-Bosch M.A. Siegler Copper-catalyzed oxidation of alkanes with H2O2 under a fenton-like regime Angew. Chem. Int. Ed. 55 2016 12873 I. Garcia-Bosch, M.A. Siegler, Copper-catalyzed oxidation of alkanes with H2O2 under a fenton-like regime, Angew. Chem. Int. Ed. 55 (2016) 12873. [177] S. Mao D. Verspeek X. Wen Y. Yang Y.W. Li K. Junge M. Beller Homogeneous iron-catalysed oxidation of non-activated alkanes with hydrogen peroxide ChemCatChem 15 2023 e202300735 S. Mao, D. Verspeek, X. Wen, Y. Yang, Y.W. Li, K. Junge, M. Beller, Homogeneous iron-catalysed oxidation of non-activated alkanes with hydrogen peroxide, ChemCatChem, 15 (2023) e202300735. [178] N. Yao P.Y. Wu B.K. Zheng L.Y. Hu Recent advances in catalytic condensation reactions applications of supported ionic liquids Curr. Org. Chem. 22 2018 462 N. Yao, P.Y. Wu, B.K. Zheng, L.Y. Hu, Recent advances in catalytic condensation reactions applications of supported ionic liquids, Curr. Org. Chem. 22 (2018) 462. [179] M. Kacem M. Dib An overview of the progress of MOFs-based hybrid materials as efficient catalysts for knoevenagel condensation Inorg. Chem. Commun. 158 2023 111561 M. Kacem, M. Dib, An overview of the progress of MOFs-based hybrid materials as efficient catalysts for knoevenagel condensation, Inorg. Chem. Commun. 158 (2023) 111561. [180] S. Yang A.L. Lu L.Y. Wang X.S. Yang W.Y. Zhou Y.P. Liu M.Y. He Q. Chen Z.H. Zhang Green and efficient Knoevenagel condensation catalyzed by pristine Zn-MOFs of amino acid derivatives Inorg. Chim. Acta 538 2022 120970 S. Yang, A.L. Lu, L.Y. Wang, X.S. Yang, W.Y. Zhou, Y.P. Liu, M.Y. He, Q. Chen, Z.H. Zhang, Green and efficient Knoevenagel condensation catalyzed by pristine Zn-MOFs of amino acid derivatives, Inorg. Chim. Acta, 538 (2022) 120970. [181] X. Zhang X. Wang C. Li T. Hu L. Fan Nanoporous {Co3}-organic framework for efficiently seperating gases and catalyzing cycloaddition of epoxides with Co2 and knoevenagel condensation J. Colloid Interface Sci. 656 2024 127 X. Zhang, X. Wang, C. Li, T. Hu, L. Fan, Nanoporous {Co3}-organic framework for efficiently seperating gases and catalyzing cycloaddition of epoxides with Co2 and knoevenagel condensation, J. Colloid Interface Sci. 656 (2024) 127. [182] S. Liu H. Chen X. Zhang Bifunctional {Pb10K2}–organic framework for high catalytic activity in cycloaddition of CO2 with epoxides and knoevenagel condensation ACS Catal. 12 2022 10373 S. Liu, H. Chen, X. Zhang, Bifunctional {Pb10K2}–organic framework for high catalytic activity in cycloaddition of CO2 with epoxides and knoevenagel condensation, ACS Catal. 12 (2022) 10373. [183] Z. Zhang H. Lv K. Yang X. Zhang Θ-[Mo8O26]4−-based multifunctional hybrid material for high catalytic performance on the cycloaddition of CO2, esterification and knoevenagel condensation Dalton Trans. 52 2023 7119 Z. Zhang, H. Lv, K. Yang, X. Zhang, Θ-[Mo8O26]4−-based multifunctional hybrid material for high catalytic performance on the cycloaddition of CO2, esterification and knoevenagel condensation, Dalton Trans. 52 (2023) 7119. [184] B. Biesemans J. De Clercq C.V. Stevens J.W. Thybaut J. Lauwaert Recent advances in amine catalyzed aldol condensations Catal. Rev. 66 2024 401 B. Biesemans, J. De Clercq, C.V. Stevens, J.W. Thybaut, J. Lauwaert, Recent advances in amine catalyzed aldol condensations, Catal. Rev. 66 (2024) 401. [185] A. Tampieri K. Föttinger N. Barrabés F. Medina Catalytic aldol condensation of bio-derived furanic aldehydes and acetone: challenges and opportunities Appl. Catal. B 319 2022 121889 A. Tampieri, K. Föttinger, N. Barrabés, F. Medina, Catalytic aldol condensation of bio-derived furanic aldehydes and acetone: challenges and opportunities, Appl. Catal. B, 319 (2022) 121889. [186] J. Zhu X. Meng W. Liu Y. Qi S. Jin S. Huo Regulated synthesis of Zr-metal–organic frameworks with variable hole size and its influence on the performance of novel MOF-based heterogeneous amino acid–thiourea catalysts RSC Adv. 12 2022 21574 J. Zhu, X. Meng, W. Liu, Y. Qi, S. Jin, S. Huo, Regulated synthesis of Zr-metal–organic frameworks with variable hole size and its influence on the performance of novel MOF-based heterogeneous amino acid–thiourea catalysts, RSC Adv. 12 (2022) 21574. [187] Z. Chen X. Yan M. Li S. Wang C. Chen Defect-engineered chiral metal–organic frameworks for efficient asymmetric aldol eeaction Inorg. Chem. 60 2021 4362 Z. Chen, X. Yan, M. Li, S. Wang, C. Chen, Defect-engineered chiral metal–organic frameworks for efficient asymmetric aldol eeaction, Inorg. Chem. 60 (2021) 4362. [188] C. Pazo-Carballo E. Blanco E. Camu A. Leiva Y. Hidalgo-Rosa X. Zarate A.B. Dongil E. Schott N. Escalona Theoretical and experimental study for cross-coupling aldol condensation over mono- and bimetallic UiO-66 nanocatalysts ACS Appl. Nano Mater. 6 2023 5422 C. Pazo-Carballo, E. Blanco, E. Camu, A. Leiva, Y. Hidalgo-Rosa, X. Zarate, A.B. Dongil, E. Schott, N. Escalona, Theoretical and experimental study for cross-coupling aldol condensation over mono- and bimetallic UiO-66 nanocatalysts, ACS Appl. Nano Mater. 6 (2023) 5422. [189] H. Ghaedrahmat M.Y. Masoomi M. Zendehdel Synthesis and characterization of Faujasite/ZIF-8 composite by one-pot method, used as a catalyst for esterification and aldol condensation reaction Catal. Surv. Asia 28 2023 58 H. Ghaedrahmat, M.Y. Masoomi, M. Zendehdel, Synthesis and characterization of Faujasite/ZIF-8 composite by one-pot method, used as a catalyst for esterification and aldol condensation reaction, Catal. Surv. Asia 28 (2023) 58. [190] R. Rubio-Presa S. Suárez-Pantiga M.R. Pedrosa R. Sanz Molybdenum-catalyzed sustainable friedländer synthesis of quinolines Adv. Synth. Catal. 360 2018 2216 R. Rubio-Presa, S. Suárez-Pantiga, M.R. Pedrosa, R. Sanz, Molybdenum-catalyzed sustainable friedländer synthesis of quinolines, Adv. Synth. Catal. 360 (2018) 2216. [191] A.V. Lunchev V.C. Hendrata A. Jaggi S.A. Morris R. Ganguly X. Chen H. Sun A.C. Grimsdale A Friedländer route to 5,7-Diazapentacenes J. Mater. Chem. C 6 2018 3715 A.V. Lunchev, V.C. Hendrata, A. Jaggi, S.A. Morris, R. Ganguly, X. Chen, H. Sun, A.C. Grimsdale, A Friedländer route to 5,7-Diazapentacenes, J. Mater. Chem. C 6 (2018) 3715. [192] S. Ghosh J. Krishnan V. Karthik A. Rana A. Dhakshinamoorthy S. Biswas Friedlander condensation reaction catalysed by hafnium-based metal-organic framework Mol. Catal. 533 2022 112748 S. Ghosh, J. Krishnan, V. Karthik, A. Rana, A. Dhakshinamoorthy, S. Biswas, Friedlander condensation reaction catalysed by hafnium-based metal-organic framework, Mol. Catal. 533 (2022) 112748. [193] A. Das N. Anbu P. Varalakshmi A. Dhakshinamoorthy S. Biswas A hydrazine functionalized UiO-66(Hf) metal–organic framework for the synthesis of quinolines via Friedländer condensation New J. Chem. 44 2020 10982 A. Das, N. Anbu, P. Varalakshmi, A. Dhakshinamoorthy, S. Biswas, A hydrazine functionalized UiO-66(Hf) metal–organic framework for the synthesis of quinolines via Friedländer condensation, New J. Chem. 44 (2020) 10982. [194] L. Fu Q. Diao Z. Zhang R. Zhao C. Li L. Yang Preparation of core-shell magnetic microspheres and its application in jasminaldehyde condensation reactions J. Inorg. Organomet. Polym. Mater. 34 2023 1272 L. Fu, Q. Diao, Z. Zhang, R. Zhao, C. Li, L. Yang, Preparation of core-shell magnetic microspheres and its application in jasminaldehyde condensation reactions, J. Inorg. Organomet. Polym. Mater. 34 (2023) 1272. [195] C.N. Neumann M.T. Payne S.J. Rozeveld Z. Wu G. Zhang R.J. Comito J.T. Miller M. Dincă Structural evolution of MOF-Derived RuCo, A general catalyst for the guerbet reaction ACS Appl. Mater. Interfaces 13 2021 52113 C.N. Neumann, M.T. Payne, S.J. Rozeveld, Z. Wu, G. Zhang, R.J. Comito, J.T. Miller, M. Dincă, Structural evolution of MOF-Derived RuCo, A general catalyst for the guerbet reaction, ACS Appl. Mater. Interfaces, 13 (2021) 52113. [196] P. Srirattanasakunsuk B. Boekfa P. Treesukol N. Jarussophon T. Maihom K. Kongpatpanich J. Limtrakul Combined experimental and theoretical study of the synthesis of 5,7-dihydroxy-4-methylcoumarin via a pechmann condensation in the presence of UiO-66-SO3H catalysts ACS Omega 8 2023 46904 P. Srirattanasakunsuk, B. Boekfa, P. Treesukol, N. Jarussophon, T. Maihom, K. Kongpatpanich, J. Limtrakul, Combined experimental and theoretical study of the synthesis of 5,7-dihydroxy-4-methylcoumarin via a pechmann condensation in the presence of UiO-66-SO3H catalysts, ACS Omega, 8 (2023) 46904. [197] C.N. Neumann S.J. Rozeveld M. Dincă MOF-Derived RuCo catalyzes the formation of a plasticizer alcohol from renewable precursors ACS Catal. 11 2021 8521 C.N. Neumann, S.J. Rozeveld, M. Dincă, MOF-Derived RuCo catalyzes the formation of a plasticizer alcohol from renewable precursors, ACS Catal. 11 (2021) 8521. [198] M.Hasnain Sayed A.L. Sadgar B.M. Bhanage R.V. Jayaram Particle shape anisotropy in pickering interfacial catalysis for Knoevenagel condensation J. Colloid Interface Sci. 659 2024 413 M.Hasnain Sayed, A.L. Sadgar, B.M. Bhanage, R.V. Jayaram, Particle shape anisotropy in pickering interfacial catalysis for Knoevenagel condensation, J. Colloid Interface Sci. 659 (2024) 413. [199] B.D. Dond R.P. Kale S.N. Thore Anhydrous copper sulfate-assisted Knoevenagel condensation under neutral conditions Chem. Pap. 77 2023 2717 B.D. Dond, R.P. Kale, S.N. Thore, Anhydrous copper sulfate-assisted Knoevenagel condensation under neutral conditions, Chem. Pap. 77 (2023) 2717. [200] B. Viswanadham J. Pedada H.B. Friedrich S. Singh The role of copper exchanged phosphomolybdic acid catalyst for knoevenagel condensation Catal. Lett. 146 2016 1470 B. Viswanadham, J. Pedada, H.B. Friedrich, S. Singh, The role of copper exchanged phosphomolybdic acid catalyst for knoevenagel condensation, Catal. Lett. 146 (2016) 1470. [201] N. Liu F. Wu J. Xu F. Wang B. Xue J. Luo Metal-free Knoevenagel condensation catalyzed by mesoporous and nitrogen-distribution-tunable supported carbon nitride Res. Chem. Intermed. 48 2022 1989 N. Liu, F. Wu, J. Xu, F. Wang, B. Xue, J. Luo, Metal-free Knoevenagel condensation catalyzed by mesoporous and nitrogen-distribution-tunable supported carbon nitride, Res. Chem. Intermed. 48 (2022) 1989. [202] W. Bing L. Zheng S. He D. Rao M. Xu L. Zheng B. Wang Y. Wang M. Wei Insights on active sites of caal-hydrotalcite as a high-performance solid base catalyst toward aldol condensation ACS Catal. 8 2018 656 W. Bing, L. Zheng, S. He, D. Rao, M. Xu, L. Zheng, B. Wang, Y. Wang, M. Wei, Insights on active sites of caal-hydrotalcite as a high-performance solid base catalyst toward aldol condensation, ACS Catal. 8 (2018) 656. [203] D. Patel K.A. Trivedi H. Srivastava S.R. Kane C.K. Modi Green sustainable approach for carbon–carbon bond-forming reactions using FeNPs/DETA@RGO nano-catalyst Inorg. Chem. Commun. 136 2022 109175 D. Patel, K.A. Trivedi, H. Srivastava, S.R. Kane, C.K. Modi, Green sustainable approach for carbon–carbon bond-forming reactions using FeNPs/DETA@RGO nano-catalyst, Inorg. Chem. Commun. 136 (2022) 109175. [204] P. Kalita N.M. Gupta R. Kumar Solvent-free Mukaiyama-aldol condensation catalyzed by Ce-Al-MCM-41 mesoporous materials Microporous Mesoporous Mater. 144 2011 82 P. Kalita, N.M. Gupta, R. Kumar, Solvent-free Mukaiyama-aldol condensation catalyzed by Ce-Al-MCM-41 mesoporous materials, Microporous Mesoporous Mater. 144 (2011) 82. [205] J. Chen M. Xu S. Yu Y. Xia S. Lee Nickel-catalyzed claisen condensation reaction between two different amides Org. Lett. 22 2020 2287 J. Chen, M. Xu, S. Yu, Y. Xia, S. Lee, Nickel-catalyzed claisen condensation reaction between two different amides, Org. Lett. 22 (2020) 2287. [206] Y. Miyahara Y.N. Ito AlCl3-mediated aldol cyclocondensation of 1,6- and 1,7-diones to cyclopentene and cyclohexene derivatives J. Org. Chem. 79 2014 6801 Y. Miyahara, Y.N. Ito, AlCl3-mediated aldol cyclocondensation of 1,6- and 1,7-diones to cyclopentene and cyclohexene derivatives, J. Org. Chem. 79 (2014) 6801. [207] N. Diyali S. Rasaily B. Biswas Metal–organic framework: an emergent catalyst in C–N Cross-Coupling reactions Coord. Chem. Rev. 469 2022 214667 N. Diyali, S. Rasaily, B. Biswas, Metal–organic framework: an emergent catalyst in C–N Cross-Coupling reactions, Coord. Chem. Rev. 469 (2022) 214667. [208] G. Clavé F. Pelissier S. Campidelli C. Grison Ecocatalyzed suzuki cross coupling of heteroaryl compounds Green Chem. 19 2017 4093 G. Clavé, F. Pelissier, S. Campidelli, C. Grison, Ecocatalyzed suzuki cross coupling of heteroaryl compounds, Green Chem. 19 (2017) 4093. [209] S. Lin Y. Chen H. Li W. Wang Y. Wang M. Wu Application of metal-organic frameworks and their derivates for thermal-catalytic C1 molecules conversion iScience 27 2024 109656 S. Lin, Y. Chen, H. Li, W. Wang, Y. Wang, M. Wu, Application of metal-organic frameworks and their derivates for thermal-catalytic C1 molecules conversion, iScience, 27 (2024) 109656. [210] S. Asghar S.B. Tailor D. Elorriaga R.B. Bedford Cobalt-catalyzed suzuki biaryl coupling of aryl halides Angew. Chem. Int. Ed. 56 2017 16367 S. Asghar, S.B. Tailor, D. Elorriaga, R.B. Bedford, Cobalt-catalyzed suzuki biaryl coupling of aryl halides, Angew. Chem. Int. Ed. 56 (2017) 16367. [211] É. Casey J.D. Holmes G. Collins PdAu nanosheets for visible-light-driven suzuki cross-coupling reactions ACS Appl. Nano Mater. 5 2022 16196 É. Casey, J.D. Holmes, G. Collins, PdAu nanosheets for visible-light-driven suzuki cross-coupling reactions, ACS Appl. Nano Mater. 5 (2022) 16196. [212] M. Mohammadnia Preparation and characterization of Cu based on 2-(5-aminopyrimidin-2-yl) pyrimidin-5-amine as novel recyclable metal–organic frameworks for suzuki reaction Inorg. Chem. Commun. 135 2022 109078 M. Mohammadnia, Preparation and characterization of Cu based on 2-(5-aminopyrimidin-2-yl) pyrimidin-5-amine as novel recyclable metal–organic frameworks for suzuki reaction, Inorg. Chem. Commun. 135 (2022) 109078. [213] Y. Liu J. Sun L. Fan Q. Xu Pd clusters on schiff base–imidazole-functionalized mofs for highly efficient catalytic suzuki coupling reactions Front. Chem. 10 2022 845274 Y. Liu, J. Sun, L. Fan, Q. Xu, Pd clusters on schiff base–imidazole-functionalized mofs for highly efficient catalytic suzuki coupling reactions, Front. Chem. 10 (2022) 845274. [214] D. Cartagenova S. Bachmann K. Püntener M. Scalone M.A. Newton F.A.P. Esteves T. Rohrbach P.P. Zimmermann J.A.v. Bokhoven M. Ranocchiari Highly selective suzuki reaction catalysed by a molecular Pd-P-MOF catalyst under mild conditions: role of ligands and palladium speciation Catal. Sci. Technol. 12 2022 954 D. Cartagenova, S. Bachmann, K. Püntener, M. Scalone, M.A. Newton, F.A.P. Esteves, T. Rohrbach, P.P. Zimmermann, J.A.v. Bokhoven, M. Ranocchiari, Highly selective suzuki reaction catalysed by a molecular Pd-P-MOF catalyst under mild conditions: role of ligands and palladium speciation, Catal. Sci. Technol. 12 (2022) 954. [215] E. Miguel-Casañ M.D. Darawsheh V. Fariña-Torres I.J. Vitórica-Yrezábal E. Andres-Garcia M. Fañanás-Mastral G.Mínguez Espallargas Heterometallic palladium–iron metal–organic framework as a highly active catalyst for Cross-coupling reactions Chem. Sci. 14 2023 179 E. Miguel-Casañ, M.D. Darawsheh, V. Fariña-Torres, I.J. Vitórica-Yrezábal, E. Andres-Garcia, M. Fañanás-Mastral, G.Mínguez Espallargas, Heterometallic palladium–iron metal–organic framework as a highly active catalyst for Cross-coupling reactions, Chem. Sci. 14 (2023) 179. [216] X. Wu W. Lin L. Wang N. Li G. Tu Y. Fu D.L. Chen W. Zhu G. Chen F. Zhang Highly dispersed palladium nanoclusters anchored on nanostructured hafnium(Iv) oxide as highly efficient catalysts for the Suzuki–Miyaura coupling reaction New J. Chem. 46 2022 8575 X. Wu, W. Lin, L. Wang, N. Li, G. Tu, Y. Fu, D.L. Chen, W. Zhu, G. Chen, F. Zhang, Highly dispersed palladium nanoclusters anchored on nanostructured hafnium(Iv) oxide as highly efficient catalysts for the Suzuki–Miyaura coupling reaction, New J. Chem. 46 (2022) 8575. [217] C. Xia J. Wu S.A. Delbari A.S. Namini Y. Yuan Q. Van Le D. Kim R.S. Varma A. T-Raissi H.W. Jang M. Shokouhimehr Metal-organic framework-based nanostructured catalysts: applications in efficient organic transformations Mol. Catal. 546 2023 113217 C. Xia, J. Wu, S.A. Delbari, A.S. Namini, Y. Yuan, Q. Van Le, D. Kim, R.S. Varma, A. T-Raissi, H.W. Jang, M. Shokouhimehr, Metal-organic framework-based nanostructured catalysts: applications in efficient organic transformations, Mol. Catal. 546 (2023) 113217. [218] R.X. Liang Y.X. Jia Aromatic π-components for enantioselective heck reactions and heck/anion-capture domino sequences Acc. Chem. Res. 55 2022 734 R.X. Liang, Y.X. Jia, Aromatic π-components for enantioselective heck reactions and heck/anion-capture domino sequences, Acc. Chem. Res. 55 (2022) 734. [219] V.W. Bhoyare E.D. Sosa Carrizo C.C. Chintawar V. Gandon N.T. Patil Gold-catalyzed heck reaction J. Am. Chem. Soc. 145 2023 8810 V.W. Bhoyare, E.D. Sosa Carrizo, C.C. Chintawar, V. Gandon, N.T. Patil, Gold-catalyzed heck reaction, J. Am. Chem. Soc. 145 (2023) 8810. [220] J.W. Zhu B. Zhou Z.Y. Cao R.X. Liang Y.X. Jia Stereoselective 1,2-dicarbofunctionalization of trisubstituted alkenes by palladium-catalyzed heck/suzuki or heck/sonogashira domino sequence CCS Chem. 3 2021 2340 J.W. Zhu, B. Zhou, Z.Y. Cao, R.X. Liang, Y.X. Jia, Stereoselective 1,2-dicarbofunctionalization of trisubstituted alkenes by palladium-catalyzed heck/suzuki or heck/sonogashira domino sequence, CCS Chem. 3 (2021) 2340. [221] H. Keypour J. Kouhdareh S. Alavinia K. Rabiei M. Mohammadi A. Maryamabadi S. Babaei Post-synthetic modification of dual-porous UMCM-1-NH2 with palladacycle complex as an effective heterogeneous catalyst in suzuki and heck coupling reactions J. Organomet. Chem. 989 2023 122646 H. Keypour, J. Kouhdareh, S. Alavinia, K. Rabiei, M. Mohammadi, A. Maryamabadi, S. Babaei, Post-synthetic modification of dual-porous UMCM-1-NH2 with palladacycle complex as an effective heterogeneous catalyst in suzuki and heck coupling reactions, J. Organomet. Chem. 989 (2023) 122646. [222] M.H.D. Dang T.T.T. Nguyen B.Q.G. Le L.H.T. Nguyen N.X.D. Mai M.V. Nguyen P.H. Tran T.L.H. Doan An effective combination of reusable Pd@MOF catalyst and deep eutectic solvents for high-performance C–C coupling reaction J. Ind. Eng. Chem. 115 2022 111 M.H.D. Dang, T.T.T. Nguyen, B.Q.G. Le, L.H.T. Nguyen, N.X.D. Mai, M.V. Nguyen, P.H. Tran, T.L.H. Doan, An effective combination of reusable Pd@MOF catalyst and deep eutectic solvents for high-performance C–C coupling reaction, J. Ind. Eng. Chem. 115 (2022) 111. [223] D.Y. Zheng R. Bai M. Li R. Wang Y. Gu Dipolar microenvironment enhanced catalytic activity of Pd nanoparticles in MOF channel ACS Sustain. Chem. Eng. 11 2023 10219 D.Y. Zheng, R. Bai, M. Li, R. Wang, Y. Gu, Dipolar microenvironment enhanced catalytic activity of Pd nanoparticles in MOF channel, ACS Sustain. Chem. Eng. 11 (2023) 10219. [224] Y. Wu X. Feng Q. Zhai H. Wang H. Jiang Y. Ren Metal–organic framework surface functionalization enhancing the activity and stability of palladium nanoparticles for carbon–halogen bond activation Inorg. Chem. 61 2022 6995 Y. Wu, X. Feng, Q. Zhai, H. Wang, H. Jiang, Y. Ren, Metal–organic framework surface functionalization enhancing the activity and stability of palladium nanoparticles for carbon–halogen bond activation, Inorg. Chem. 61 (2022) 6995. [225] S. Parshamoni R. Nasani A. Paul S. Konar Synthesis of a palladium based MOF via an effective post-synthetic modification approach and its catalytic activity towards Heck type coupling reactions Inorg. Chem. Front. 8 2021 693 S. Parshamoni, R. Nasani, A. Paul, S. Konar, Synthesis of a palladium based MOF via an effective post-synthetic modification approach and its catalytic activity towards Heck type coupling reactions, Inorg. Chem. Front. 8 (2021) 693. [226] Q. Chen F. Gao H. Tang M. Yao Q. Zhao Y. Shi Y. Dang C. Cao Sonogashira cross-coupling of aryltrimethylammonium salts ACS Catal. 9 2019 3730 Q. Chen, F. Gao, H. Tang, M. Yao, Q. Zhao, Y. Shi, Y. Dang, C. Cao, Sonogashira cross-coupling of aryltrimethylammonium salts, ACS Catal. 9 (2019) 3730. [227] F. Mohjer P. Mofatehnia Y. Rangraz M.M. Heravi Pd-free, Sonogashira Cross-Coupling reaction. An update J. Organomet. Chem. 936 2021 121712 F. Mohjer, P. Mofatehnia, Y. Rangraz, M.M. Heravi, Pd-free, Sonogashira Cross-Coupling reaction. An update, J. Organomet. Chem. 936 (2021) 121712. [228] Y. Yang C. Chen G.Y. Xu J. Yuan S.F. Ye L. Chen Q.L. Lv G. Luo J. Yang M.B. Li Z. Wu An efficient nanocluster catalyst for Sonogashira reaction J. Catal. 401 2021 206 Y. Yang, C. Chen, G.Y. Xu, J. Yuan, S.F. Ye, L. Chen, Q.L. Lv, G. Luo, J. Yang, M.B. Li, Z. Wu, An efficient nanocluster catalyst for Sonogashira reaction, J. Catal. 401 (2021) 206. [229] L. Zhang C. Wei J. Wu D. Liu Y. Yao Z. Chen J. Liu C.J. Yao D. Li R. Yang Z. Xia Photoinduced inverse Sonogashira coupling reaction Chem. Sci. 13 2022 7475 L. Zhang, C. Wei, J. Wu, D. Liu, Y. Yao, Z. Chen, J. Liu, C.J. Yao, D. Li, R. Yang, Z. Xia, Photoinduced inverse Sonogashira coupling reaction, Chem. Sci. 13 (2022) 7475. [230] E. Niknam F. Panahi A. Khalafi-Nezhad Immobilized Pd on a NHC-functionalized metal-organic frameworkMIL-101(Cr): an efficient heterogeneous catalyst in the heck and copper-free Sonogashira coupling reactions J. Organomet. Chem. 935 2021 121676 E. Niknam, F. Panahi, A. Khalafi-Nezhad, Immobilized Pd on a NHC-functionalized metal-organic frameworkMIL-101(Cr): an efficient heterogeneous catalyst in the heck and copper-free Sonogashira coupling reactions, J. Organomet. Chem. 935 (2021) 121676. [231] S. Karimi M. Gholinejad R. Khezri J.e.M. Sansano C. N´ajera M. Yus Gold and palladium supported on an ionic liquid modified Fe-based metal–organic framework (MOF) as highly efficient catalysts for the reduction of nitrophenols, dyes and Sonogashira–Hagihara reactions RSC Adv. 13 2023 8101 S. Karimi, M. Gholinejad, R. Khezri, J.e.M. Sansano, C. N´ajera, M. Yus, Gold and palladium supported on an ionic liquid modified Fe-based metal–organic framework (MOF) as highly efficient catalysts for the reduction of nitrophenols, dyes and Sonogashira–Hagihara reactions, RSC Adv. 13 (2023) 8101. [232] M. Tahmasbi N. Koukabi F. Seidi A novel core@double-shell three-layer structure with dendritic fibrous morphology based on Fe3O4@TEA@Ni–organic framework: a highly efficient magnetic catalyst in the microwave-assisted Sonogashira coupling reaction Nanoscale 14 2022 7189 M. Tahmasbi, N. Koukabi, F. Seidi, A novel core@double-shell three-layer structure with dendritic fibrous morphology based on Fe3O4@TEA@Ni–organic framework: a highly efficient magnetic catalyst in the microwave-assisted Sonogashira coupling reaction, Nanoscale, 14 (2022) 7189. [233] Y. Huang J. Huang Y. Zhou X. Fan Y. Li Pd@HKUST-1@Cu(II)/CMC composite bead as an efficient synergistic bimetallic catalyst for Sonogashira cross-coupling reactions Carbohydr. Polym. 324 2024 121351 Y. Huang, J. Huang, Y. Zhou, X. Fan, Y. Li, Pd@HKUST-1@Cu(II)/CMC composite bead as an efficient synergistic bimetallic catalyst for Sonogashira cross-coupling reactions, Carbohydr. Polym. 324 (2024) 121351. [234] H. Veisi N. Neyestani M. Pirhayati S.A. Kamangan S. Lotfi T. Tamoradi B. Karmakar Copper nanoparticle anchored biguanidine-modified Zr-UiO-66 MOFs: a competent heterogeneous and reusable nanocatalyst in Buchwald–Hartwig and Ullmann type coupling reactions RSC Adv. 11 2021 22278 H. Veisi, N. Neyestani, M. Pirhayati, S.A. Kamangan, S. Lotfi, T. Tamoradi, B. Karmakar, Copper nanoparticle anchored biguanidine-modified Zr-UiO-66 MOFs: a competent heterogeneous and reusable nanocatalyst in Buchwald–Hartwig and Ullmann type coupling reactions, RSC Adv. 11 (2021) 22278. [235] W. Wang S. Chen E.G. Cal M.M. Moro S. Moya E. Coy C. Wang J.R. Hamon D. Astruc ZIF-8-based vs. ZIF-8-derived au and Pd nanoparticles as efficient catalysts for the Ullmann homocoupling reaction Inorg. Chem. Front. 7 2020 3945 W. Wang, S. Chen, E.G. Cal, M.M. Moro, S. Moya, E. Coy, C. Wang, J.R. Hamon, D. Astruc, ZIF-8-based vs. ZIF-8-derived au and Pd nanoparticles as efficient catalysts for the Ullmann homocoupling reaction, Inorg. Chem. Front. 7 (2020) 3945. [236] M. Rouzifar S. Sobhani A. Farrokhi J.M. Sansano Fe-MIL-101 modified by isatin-Schiff-base-Co: a heterogeneous catalyst for C–C, C–O, C–N, and C–P cross coupling reactions New J. Chem. 45 2021 19963 M. Rouzifar, S. Sobhani, A. Farrokhi, J.M. Sansano, Fe-MIL-101 modified by isatin-Schiff-base-Co: a heterogeneous catalyst for C–C, C–O, C–N, and C–P cross coupling reactions, New J. Chem. 45 (2021) 19963. [237] L. Zhou Y. Shi X. Zhu P. Zhang Pd-catalyzed intramolecular Heck reaction for the synthesis of 2-methylbenzofurans Tetrahedron Lett. 60 2019 2005 L. Zhou, Y. Shi, X. Zhu, P. Zhang, Pd-catalyzed intramolecular Heck reaction for the synthesis of 2-methylbenzofurans, Tetrahedron Lett. 60 (2019) 2005. [238] F. Mangin P. Prinsen A. Yepez M.R.H.S. Gilani G. Xu C. Len R. Luque Microwave assisted benzyl alcohol oxidation using iron particles on furfuryl alcohol derived supports Catal. Commun. 104 2018 67 F. Mangin, P. Prinsen, A. Yepez, M.R.H.S. Gilani, G. Xu, C. Len, R. Luque, Microwave assisted benzyl alcohol oxidation using iron particles on furfuryl alcohol derived supports, Catal. Commun. 104 (2018) 67. [239] A. Kunfi Z. May P. Németh G. London Polydopamine supported palladium nanoparticles: highly efficient catalysts in Suzuki cross-coupling and tandem Suzuki cross-coupling/nitroarene reductions under green reaction conditions J. Catal. 361 2018 84 A. Kunfi, Z. May, P. Németh, G. London, Polydopamine supported palladium nanoparticles: highly efficient catalysts in Suzuki cross-coupling and tandem Suzuki cross-coupling/nitroarene reductions under green reaction conditions, J. Catal. 361 (2018) 84. [240] A. Cervantes-Reyes A.C. Smith G.M. Chinigo D.C. Blakemore M. Szostak Decarbonylative Pd-catalyzed suzuki cross-coupling for the synthesis of structurally diverse heterobiaryls Org. Lett. 24 2022 1678 A. Cervantes-Reyes, A.C. Smith, G.M. Chinigo, D.C. Blakemore, M. Szostak, Decarbonylative Pd-catalyzed suzuki cross-coupling for the synthesis of structurally diverse heterobiaryls, Org. Lett. 24 (2022) 1678. [241] S.C. Lee L. Guo M. Rueping Nickel-catalyzed exo-selective hydroacylation/Suzuki cross-coupling reaction Chem. Commun. 55 2019 14984 S.C. Lee, L. Guo, M. Rueping, Nickel-catalyzed exo-selective hydroacylation/Suzuki cross-coupling reaction, Chem. Commun. 55 (2019) 14984. [242] Y.N. Kotovshchikov A.A. Binyakovsky G.V. Latyshev N.V. Lukashev I.P. Beletskaya Copper-catalyzed deacetonative Sonogashira coupling Org. Biomol. Chem. 20 2022 7650 Y.N. Kotovshchikov, A.A. Binyakovsky, G.V. Latyshev, N.V. Lukashev, I.P. Beletskaya, Copper-catalyzed deacetonative Sonogashira coupling, Org. Biomol. Chem. 20 (2022) 7650. [243] S. Sangon N. Supanchaiyamat J. Sherwood D.J. Macquarrie P. Noppawan A.J. Hunt Application of hindered ether solvents for palladium catalyzed Suzuki-Miyaura, Sonogashira and cascade Sonogashira cross-coupling reactions Org. Biomol. Chem. 21 2023 2603 S. Sangon, N. Supanchaiyamat, J. Sherwood, D.J. Macquarrie, P. Noppawan, A.J. Hunt, Application of hindered ether solvents for palladium catalyzed Suzuki-Miyaura, Sonogashira and cascade Sonogashira cross-coupling reactions, Org. Biomol. Chem. 21 (2023) 2603. [244] X. Li L. Liu T. Huang Z. Tang C. Li W. Li T. Zhang Z. Li T. Chen Palladium-catalyzed decarbonylative sonogashira coupling of terminal alkynes with carboxylic acids Org. Lett. 23 2021 3304 X. Li, L. Liu, T. Huang, Z. Tang, C. Li, W. Li, T. Zhang, Z. Li, T. Chen, Palladium-catalyzed decarbonylative sonogashira coupling of terminal alkynes with carboxylic acids, Org. Lett. 23 (2021) 3304. [245] F. Chen K. Shen L. Chen Y. Li N-doped nanocarbon embedded in hierarchically porous metal-organic frameworks for highly efficient CO2 fixation Sci. China Chem. 65 2022 1411 F. Chen, K. Shen, L. Chen, Y. Li, N-doped nanocarbon embedded in hierarchically porous metal-organic frameworks for highly efficient CO2 fixation, Sci. China Chem. 65 (2022) 1411. [246] Y. Wang H. Liu Q. Shi Z. Miao H. Duan Y. Wang H. Rong J. Zhang Single-atom titanium on mesoporous nitrogen, oxygen-doped carbon for efficient photo-thermal catalytic CO2 cycloaddition by a radical mechanism Angew. Chem. Int. Ed. 63 2024 e202404911 Y. Wang, H. Liu, Q. Shi, Z. Miao, H. Duan, Y. Wang, H. Rong, J. Zhang, Single-atom titanium on mesoporous nitrogen, oxygen-doped carbon for efficient photo-thermal catalytic CO2 cycloaddition by a radical mechanism, Angew. Chem. Int. Ed. 63 (2024) e202404911. [247] T.K. Pal D. De P.K. Bharadwaj Metal–organic frameworks for the chemical fixation of CO2 into cyclic carbonates Coord. Chem. Rev. 408 2020 213173 T.K. Pal, D. De, P.K. Bharadwaj, Metal–organic frameworks for the chemical fixation of CO2 into cyclic carbonates, Coord. Chem. Rev. 408 (2020) 213173. [248] Y. Fei R. Abazari M. Ren X. Wang X. Zhang Defect engineering in a nanoporous thulium–organic framework in catalyzing knoevenagel condensation and chemical CO2 fixation Inorg. Chem. 63 2024 18914 Y. Fei, R. Abazari, M. Ren, X. Wang, X. Zhang, Defect engineering in a nanoporous thulium–organic framework in catalyzing knoevenagel condensation and chemical CO2 fixation, Inorg. Chem. 63 (2024) 18914. [249] Y. Hu R. Abazari S. Sanati M. Nadafan C.L. Carpenter-Warren A.M.Z. Slawin Y. Zhou A.M. Kirillov A dual-purpose Ce(III)–organic framework with amine groups and open metal sites: third-order nonlinear optical activity and catalytic CO2 fixation ACS Appl. Mater. Interfaces 15 2023 37300 Y. Hu, R. Abazari, S. Sanati, M. Nadafan, C.L. Carpenter-Warren, A.M.Z. Slawin, Y. Zhou, A.M. Kirillov, A dual-purpose Ce(III)–organic framework with amine groups and open metal sites: third-order nonlinear optical activity and catalytic CO2 fixation, ACS Appl. Mater. Interfaces, 15 (2023) 37300. [250] T.Q. A W.L. B H.L. A K.J. A S.C. A Y.Z. A Yttria-doped Cu/ZnO catalyst with excellent performance for CO2 hydrogenation to methanol - sciencedirect Mol. Catal. 509 2021 111641 T.Q. A, W.L. B, H.L. A, K.J. A, S.C. A, Y.Z. A, Yttria-doped Cu/ZnO catalyst with excellent performance for CO2 hydrogenation to methanol - sciencedirect, Mol. Catal. 509 (2021) 111641. [251] T. Qi Y. Zhao S. Chen W. Li X. Guo Y. Zhang C. Song Bimetallic metal organic framework-templated synthesis of a Cu-ZnO/Al2O3 catalyst with superior methanol selectivity for CO2 hydrogenation Mol. Catal. 2021 514 T. Qi, Y. Zhao, S. Chen, W. Li, X. Guo, Y. Zhang, C. Song, Bimetallic metal organic framework-templated synthesis of a Cu-ZnO/Al2O3 catalyst with superior methanol selectivity for CO2 hydrogenation, Mol. Catal. (2021) 514. [252] J. Wang T. Qi G. Li Y. Zhang H. Chen W. Li Elucidating the promoting mechanism of coordination-driven self-assembly MOFs/SiO2 composite derived catalyst for dry reforming of methane with CO2 Fuel 330 2022 125569 J. Wang, T. Qi, G. Li, Y. Zhang, H. Chen, W. Li, Elucidating the promoting mechanism of coordination-driven self-assembly MOFs/SiO2 composite derived catalyst for dry reforming of methane with CO2, Fuel, 330 (2022) 125569. [253] J. Qiao B. Zhang L. Zhang Y. Liu Practice of function-oriented synthesis: high-efficiency CO2 conversion and Knoevenagel condensation by two novel In3-based mofs with high-density active sites under mild conditions J. Mater. Chem. A 10 2022 17773 J. Qiao, B. Zhang, L. Zhang, Y. Liu, Practice of function-oriented synthesis: high-efficiency CO2 conversion and Knoevenagel condensation by two novel In3-based mofs with high-density active sites under mild conditions, J. Mater. Chem. A, 10 (2022) 17773. [254] Y. Chen L. Chen Y. Li K. Shen Metal-organic frameworks as a new platform to construct ordered mesoporous ce-based oxides for efficient CO2 fixation under ambient conditions Small 9 2023 2303235 Y. Chen, L. Chen, Y. Li, K. Shen, Metal-organic frameworks as a new platform to construct ordered mesoporous ce-based oxides for efficient CO2 fixation under ambient conditions, Small, 9 (2023) 2303235. [255] C. Duan Y. Feng Y. Xie M. Ding J. Yao Simultaneous amino-functionalization and Fe-doping modification of ZIF-8 for efficient CO2 adsorption and cycloaddition reaction Microporous Mesoporous Mater. 347 2023 112351 C. Duan, Y. Feng, Y. Xie, M. Ding, J. Yao, Simultaneous amino-functionalization and Fe-doping modification of ZIF-8 for efficient CO2 adsorption and cycloaddition reaction, Microporous Mesoporous Mater. 347 (2023) 112351. [256] Z.F. Wang C. Li Q.P. Qin S. Zhang X. Zhang Nanoporous lanthanide-based MOFs for catalyzing the cycloaddition of CO2 and the knoevenagel condensation ACS Appl. Nano Mater. 6 2023 23430 Z.F. Wang, C. Li, Q.P. Qin, S. Zhang, X. Zhang, Nanoporous lanthanide-based MOFs for catalyzing the cycloaddition of CO2 and the knoevenagel condensation, ACS Appl. Nano Mater. 6 (2023) 23430. [257] S. Stiniya P.V. Saranya G. Anilkumar An overview of iron-catalyzed N-alkylation reactions Appl. Organomet. Chem. 35 2021 e6444 S. Stiniya, P.V. Saranya, G. Anilkumar, An overview of iron-catalyzed N-alkylation reactions, Appl. Organomet. Chem. 35 (2021) e6444. [258] X. Li W. She J. Wang W. Li G. Li Highly efficient N-doped carbon supported FeSx-Fe2O3 catalyst for hydrogenation of nitroarenes via pyrolysis of sulfurized N,Fe-containing MOFs Appl. Organomet. Chem. 35 2021 e6294 X. Li, W. She, J. Wang, W. Li, G. Li, Highly efficient N-doped carbon supported FeSx-Fe2O3 catalyst for hydrogenation of nitroarenes via pyrolysis of sulfurized N,Fe-containing MOFs, Appl. Organomet. Chem. 35 (2021) e6294. [259] A. Valverde-Gonz´alez M. Pintado-Sierra A. Rasero-Almansa F.e. S´anchez M. Iglesias Amino-functionalized zirconium and cerium MOFs: catalysts for visible light induced aerobic oxidation of benzylic alcohols and microwaves assisted N-alkylation of amines Appl. Catal. A Gen. 623 2021 118287 A. Valverde-Gonz´alez, M. Pintado-Sierra, A. Rasero-Almansa, F.e. S´anchez, M. Iglesias, Amino-functionalized zirconium and cerium MOFs: catalysts for visible light induced aerobic oxidation of benzylic alcohols and microwaves assisted N-alkylation of amines, Appl. Catal. A Gen. 623 (2021) 118287. [260] Y. Yuan J. Wang H. Liu Z. Li Deposition of pd nanoparticles on 2D Ni–Fe-MOF ultrathin nanosheets for efficient N-alkylation of amines by alcohols under visible light J. Mater. Chem. A 11 2023 24127 Y. Yuan, J. Wang, H. Liu, Z. Li, Deposition of pd nanoparticles on 2D Ni–Fe-MOF ultrathin nanosheets for efficient N-alkylation of amines by alcohols under visible light, J. Mater. Chem. A, 11 (2023) 24127. [261] J. Li S. Ou X. Sang R. Chai D. Wang Highly dispersed ruthenium capsulated in UiO-66-NH2 for hydrogen-borrowing-mediated N-alkylation reactions Catal. Sci. Technol. 14 2024 1958 J. Li, S. Ou, X. Sang, R. Chai, D. Wang, Highly dispersed ruthenium capsulated in UiO-66-NH2 for hydrogen-borrowing-mediated N-alkylation reactions, Catal. Sci. Technol. 14 (2024) 1958. [262] P. Samanta J. Canivet MOF-supported heterogeneous catalysts for hydroformylation reactions: a minireview ChemCatChem 16 2023 e202301435 P. Samanta, J. Canivet, MOF-supported heterogeneous catalysts for hydroformylation reactions: a minireview, ChemCatChem, 16 (2023) e202301435. [263] H. Li J. Wu Z. Jiang J. Ma V.M. Zavala C.R. Landis M. Mavrikakis G.W. Huber Hydroformylation of pyrolysis oils to aldehydes and alcohols from polyolefin waste Science 381 2023 660 (1979) H. Li, J. Wu, Z. Jiang, J. Ma, V.M. Zavala, C.R. Landis, M. Mavrikakis, G.W. Huber, Hydroformylation of pyrolysis oils to aldehydes and alcohols from polyolefin waste, Science (1979), 381 (2023) 660. [264] Z. Yu S. Zhang L. Zhang X. Liu Z. Jia L. Li N. Ta A. Wang W. Liu A. Wang T. Zhang Suppressing metal leaching and sintering in hydroformylation reaction by modulating the coordination of rh single atoms with reactants J. Am. Chem. Soc. 146 2024 11955 Z. Yu, S. Zhang, L. Zhang, X. Liu, Z. Jia, L. Li, N. Ta, A. Wang, W. Liu, A. Wang, T. Zhang, Suppressing metal leaching and sintering in hydroformylation reaction by modulating the coordination of rh single atoms with reactants, J. Am. Chem. Soc. 146 (2024) 11955. [265] Y. Sun J. Harloff H. Kosslick A. Schulz C. Fischer S. Bartling M. Frank A. Springer Influence of the framework on the catalytic performance of Rh-supported Zr-MOFs in the hydroformylation of N-alkenes Mol. Catal. 517 2022 112005 Y. Sun, J. Harloff, H. Kosslick, A. Schulz, C. Fischer, S. Bartling, M. Frank, A. Springer, Influence of the framework on the catalytic performance of Rh-supported Zr-MOFs in the hydroformylation of N-alkenes, Mol. Catal. 517 (2022) 112005. [266] P. Samanta A. Solé-Daura R. Rajapaksha F.M. Wisser F. Meunier Y. Schuurman C. Sassoye C. Mellot-Draznieks J. Canivet Heterogenized molecular rhodium phosphine catalysts within metal–organic frameworks for alkene hydroformylation ACS Catal. 13 2023 4193 P. Samanta, A. Solé-Daura, R. Rajapaksha, F.M. Wisser, F. Meunier, Y. Schuurman, C. Sassoye, C. Mellot-Draznieks, J. Canivet, Heterogenized molecular rhodium phosphine catalysts within metal–organic frameworks for alkene hydroformylation, ACS Catal. 13 (2023) 4193. [267] H. Dou Y. Qi Y. Chen A DFT study on MOFs with rhodium-coordinated organic phosphine linkers modified by functional groups for catalytic hydroformylation of 1-butene Mater. Today 35 2023 105725 H. Dou, Y. Qi, Y. Chen, A DFT study on MOFs with rhodium-coordinated organic phosphine linkers modified by functional groups for catalytic hydroformylation of 1-butene, Mater. Today, 35 (2023) 105725. [268] J.C. Wasilke S.J. Obrey R.T. Baker G.C. Bazan Concurrent tandem catalysis Chem. Rev. 105 2005 1001 J.C. Wasilke, S.J. Obrey, R.T. Baker, G.C. Bazan, Concurrent tandem catalysis, Chem. Rev. 105 (2005) 1001. [269] Y. Yamada C.K. Tsung W. Huang Z. Huo S.E. Habas T. Soejima C.E. Aliaga G.A. Somorjai P. Yang Nanocrystal bilayer for tandem catalysis Nat. Chem. 3 2011 372 Y. Yamada, C.K. Tsung, W. Huang, Z. Huo, S.E. Habas, T. Soejima, C.E. Aliaga, G.A. Somorjai, P. Yang, Nanocrystal bilayer for tandem catalysis, Nat. Chem. 3 (2011) 372. [270] S. Sithambaram R. Kumar Y.C. Son S.L. Suib Tandem catalysis: direct catalytic synthesis of imines from alcohols using manganese octahedral molecular sieves J. Catal. 253 2008 269 S. Sithambaram, R. Kumar, Y.C. Son, S.L. Suib, Tandem catalysis: direct catalytic synthesis of imines from alcohols using manganese octahedral molecular sieves, J. Catal. 253 (2008) 269. [271] C. Arroniz G. Chaubet E.A. Anderson Dual oxidation state tandem catalysis in the palladium-catalyzed isomerization of alkynyl epoxides to furans ACS Catal. 8 2018 8290 C. Arroniz, G. Chaubet, E.A. Anderson, Dual oxidation state tandem catalysis in the palladium-catalyzed isomerization of alkynyl epoxides to furans, ACS Catal. 8 (2018) 8290. [272] Z. Wu Y. Li C. Zhang X. Huang B. Peng G. Wang Recent advances in metal-organicframework-based catalysts for thermocatalytic selective oxidation of organic substances Chem. Catal. 2 2022 1009 Z. Wu, Y. Li, C. Zhang, X. Huang, B. Peng, G. Wang, Recent advances in metal-organicframework-based catalysts for thermocatalytic selective oxidation of organic substances, Chem. Catal. 2 (2022) 1009. [273] D. Deng W. Song Q. Li W. Li X. Wang Role of “post-coordination interaction” boosted performance of rare-earth based MOFs derived catalyst for hydrogenation-alkylation cascade reaction Mol. Catal. 572 2025 114735 D. Deng, W. Song, Q. Li, W. Li, X. Wang, Role of “post-coordination interaction” boosted performance of rare-earth based MOFs derived catalyst for hydrogenation-alkylation cascade reaction, Mol. Catal. 572 (2025) 114735. [274] D. Deng W. Song W. Li Q. Li X. Wang One-dimensional rare-earth La-MOFs coordinated with hexamethylenetetramine-Co MOFs derived highly efficient catalyst for cascade reaction of nitroarenes with alcohols☆ J. Rare Earths 2024 10.1016/j.jre.2024.11.008 D. Deng, W. Song, W. Li, Q. Li, X. Wang, One-dimensional rare-earth La-MOFs coordinated with hexamethylenetetramine-Co MOFs derived highly efficient catalyst for cascade reaction of nitroarenes with alcohols☆, J. Rare Earths (2024) doi:10.1016/j.jre.2024.11.008. [275] W. Li J. Shi D. He H. Chen Cascade performance of nitroarenes with alcohols boosted by a hollow flying saucer-shaped Ni-Al2O3 Catalyst via a MOF-templated strategy induced by the kirkendall effect Inorg. Chem. 62 2023 21470 21478 W. Li, J. Shi, D. He, H. Chen, Cascade performance of nitroarenes with alcohols boosted by a hollow flying saucer-shaped Ni-Al2O3 Catalyst via a MOF-templated strategy induced by the kirkendall effect, Inorg. Chem. 62 (2023) 21470–21478. [276] C. Ren S. Chen Z. Yuan R. Fu Y. Cui Z. Ma W. Li X. Li Cobalt nanoparticles catalyzed N-heterocycles synthesis via acceptorless dehydrogenative coupling Chem. Eur. J. 30 2024 e202402168 C. Ren, S. Chen, Z. Yuan, R. Fu, Y. Cui, Z. Ma, W. Li, X. Li, Cobalt nanoparticles catalyzed N-heterocycles synthesis via acceptorless dehydrogenative coupling, Chem. Eur. J. 30 (2024) e202402168. [277] W. She J. Wang X. Li J. Li G. Mao W. Li G. Li Bimetallic CuZn-MOFs derived Cu-ZnO/C catalyst for reductive amination of nitroarenes with aromatic aldehydes tandem reaction Appl. Surf. Sci. 569 2021 151033 W. She, J. Wang, X. Li, J. Li, G. Mao, W. Li, G. Li, Bimetallic CuZn-MOFs derived Cu-ZnO/C catalyst for reductive amination of nitroarenes with aromatic aldehydes tandem reaction, Appl. Surf. Sci. 569 (2021) 151033. [278] J. Wang W. She X. Li J. Li Z. Li G. Mao W. Li G. Li Efficient tandem catalytic N-alkylation of nitroarenes with alcohols via a Co/CeO2-CN catalyst derived from a tri-metallic Co-Zn-Ce coordination polymer Appl. Surf. Sci. 592 2022 153250 J. Wang, W. She, X. Li, J. Li, Z. Li, G. Mao, W. Li, G. Li, Efficient tandem catalytic N-alkylation of nitroarenes with alcohols via a Co/CeO2-CN catalyst derived from a tri-metallic Co-Zn-Ce coordination polymer, Appl. Surf. Sci. 592 (2022) 153250. [279] H. Cheng X. Long F. Bian C. Yang X. Liu H. Jiang Efficient photocatalytic one-pot hydrogenation and N-alkylation of nitrobenzenes/benzonitriles with alcohols over Pd/mofs: effect of the crystal morphology & ‘‘quasi-MOF” structure J. Catal. 389 2020 121 H. Cheng, X. Long, F. Bian, C. Yang, X. Liu, H. Jiang, Efficient photocatalytic one-pot hydrogenation and N-alkylation of nitrobenzenes/benzonitriles with alcohols over Pd/mofs: effect of the crystal morphology & ‘‘quasi-MOF” structure, J. Catal. 389 (2020) 121. [280] W. She J. Wang X. Li J. Li G. Mao W. Li G. Li Bimetallic CuZn-MOFs derived Cu-ZnO/C catalyst for reductive amination of nitroarenes with aromatic aldehydes tandem reaction Appl. Surf. Sci. 569 2021 151033 W. She, J. Wang, X. Li, J. Li, G. Mao, W. Li, G. Li, Bimetallic CuZn-MOFs derived Cu-ZnO/C catalyst for reductive amination of nitroarenes with aromatic aldehydes tandem reaction, Appl. Surf. Sci. 569 (2021) 151033. [281] W. Li J. Wang D. He G. He H. Chen Boosting performance for hydrogenation-alkylation tandem reaction catalyzed by banana-like Mgo-based solid solution confined Ni-Co alloy catalyst: fabricated by a MTV-MOFs templated strategy Mol. Catal. 529 2022 112520 W. Li, J. Wang, D. He, G. He, H. Chen, Boosting performance for hydrogenation-alkylation tandem reaction catalyzed by banana-like Mgo-based solid solution confined Ni-Co alloy catalyst: fabricated by a MTV-MOFs templated strategy, Mol. Catal. 529 (2022) 112520. [282] Z. Qin L. Chen Y. Li K. Shen Bifunctional catalysts with core–shell distributed ZrO2 and Co nanoparticles derived from MOF-on-MOF heterostructures for economical one-pot tandem CO2 fixation ACS Catal. 13 2023 8372 Z. Qin, L. Chen, Y. Li, K. Shen, Bifunctional catalysts with core–shell distributed ZrO2 and Co nanoparticles derived from MOF-on-MOF heterostructures for economical one-pot tandem CO2 fixation, ACS Catal. 13 (2023) 8372. [283] J. Cai Y. Zhuang Y. Chen L. Xiao Y. Zhao X. Jiang L. Hou Z. Li Co-MOF-74@Cu-MOF-74 derived bifunctional Co-C@Cu-C for one-pot production of 1, 4-diphenyl-1, 3-butadiene from phenylacetylene ChemCatChem 12 2020 6241 J. Cai, Y. Zhuang, Y. Chen, L. Xiao, Y. Zhao, X. Jiang, L. Hou, Z. Li, Co-MOF-74@Cu-MOF-74 derived bifunctional Co-C@Cu-C for one-pot production of 1, 4-diphenyl-1, 3-butadiene from phenylacetylene, ChemCatChem, 12 (2020) 6241. [284] L. Cheng Q. Guo K. Zhao Y.M. Li H. Ren C.Y. Ji W. Li AuPd alloys and chiral proline dual-functionalized NH2-UiO-66 catalysts for tandem oxidation/asymmetric aldol reactions Catal. Lett. 153 2023 1024 L. Cheng, Q. Guo, K. Zhao, Y.M. Li, H. Ren, C.Y. Ji, W. Li, AuPd alloys and chiral proline dual-functionalized NH2-UiO-66 catalysts for tandem oxidation/asymmetric aldol reactions, Catal. Lett. 153 (2023) 1024. [285] J. Sun S. Abednatanzi H. Chen Y.Y. Liu K. Leus P.V.D. Voort Bifunctional noble-metal-free catalyst for the selective aerobic oxidation-knoevenagel one-pot reaction: encapsulation of polyoxometalates into an alkylamine-modified MIL-101 framework ACS Appl. Mater. Interfaces 13 2021 23558 J. Sun, S. Abednatanzi, H. Chen, Y.Y. Liu, K. Leus, P.V.D. Voort, Bifunctional noble-metal-free catalyst for the selective aerobic oxidation-knoevenagel one-pot reaction: encapsulation of polyoxometalates into an alkylamine-modified MIL-101 framework, ACS Appl. Mater. Interfaces, 13 (2021) 23558. [286] M. Rouzifar S. Sobhani A. Farrokhi J.e.M. Sansano A new mixed-linker Fe-MOF as a multifunctional bio-photocatalyst for tandem photo-oxidation condensation reaction J. Photochem. Photobiol. A 447 2024 M. Rouzifar, S. Sobhani, A. Farrokhi, J.e.M. Sansano, A new mixed-linker Fe-MOF as a multifunctional bio-photocatalyst for tandem photo-oxidation condensation reaction, J. Photochem. Photobiol. A, 447 (2024). [287] Y. Zan F.B. Romdhane A. Miche C. Méthivier J.M. Krafft C. Jolivalt J. Reboul Copper nanoparticles supported on ZIF-8: comparison of Cu(II) reduction processes and application as benzyl alcohol oxidation catalysts ACS Appl. Mater. Interfaces 15 2023 38716 Y. Zan, F.B. Romdhane, A. Miche, C. Méthivier, J.M. Krafft, C. Jolivalt, J. Reboul, Copper nanoparticles supported on ZIF-8: comparison of Cu(II) reduction processes and application as benzyl alcohol oxidation catalysts, ACS Appl. Mater. Interfaces, 15 (2023) 38716. [288] Y. Fan H. Zheng S. Labalme W. Lin Molecular engineering of metal–organic layers for sustainable tandem and synergistic photocatalysis J. Am. Chem. Soc. 145 2023 4158 Y. Fan, H. Zheng, S. Labalme, W. Lin, Molecular engineering of metal–organic layers for sustainable tandem and synergistic photocatalysis, J. Am. Chem. Soc. 145 (2023) 4158. [289] Q. Han B. Qi W. Ren C. He J. Niu C. Duan Polyoxometalate-based homochiral metal-organic frameworks for tandem asymmetric transformation of cyclic carbonates from olefins Nat. Commun. 6 2015 10007 Q. Han, B. Qi, W. Ren, C. He, J. Niu, C. Duan, Polyoxometalate-based homochiral metal-organic frameworks for tandem asymmetric transformation of cyclic carbonates from olefins, Nat. Commun. 6 (2015) 10007. [290] Y. Wang Z. Tian Q. Yang K. Tong X. Tang N. Zhang J. Zhou L. Zhang Q. Zhang S. Dai Y. Lin Z. Lu L. Chen Atomically dispersed dual metal sites boost the efficiency of olefins epoxidation in tandem with CO2 cycloaddition Nano Lett. 22 2022 838 Y. Wang, Z. Tian, Q. Yang, K. Tong, X. Tang, N. Zhang, J. Zhou, L. Zhang, Q. Zhang, S. Dai, Y. Lin, Z. Lu, L. Chen, Atomically dispersed dual metal sites boost the efficiency of olefins epoxidation in tandem with CO2 cycloaddition, Nano Lett. 22 (2022) 838. [291] Y. Yu X. Chen X. Wang X. Feng S. Liu C. Duan Y. Wu H. Xi Facile prepared 2D Ni-based metal-organic framework nanosheets for boosting one-pot catalytic synthesis of cyclic carbonates Chem. Eng. Sci. 278 2023 118898 Y. Yu, X. Chen, X. Wang, X. Feng, S. Liu, C. Duan, Y. Wu, H. Xi, Facile prepared 2D Ni-based metal-organic framework nanosheets for boosting one-pot catalytic synthesis of cyclic carbonates, Chem. Eng. Sci. 278 (2023) 118898. [292] L. Cheng C. Ji H. Ren Q. Guo W. Li Cuco nanoparticle Pd(II), and I-proline trifunctionalized UiO-67 catalyst for three-step sequential asymmetric reactions Inorg. Chem. 62 2023 5435 L. Cheng, C. Ji, H. Ren, Q. Guo, W. Li, Cuco nanoparticle, Pd(II), and I-proline trifunctionalized UiO-67 catalyst for three-step sequential asymmetric reactions, Inorg. Chem. 62 (2023) 5435. [293] L. Cheng K. Zhao Q. Zhang Y. Li Q. Zhai J. Chen Y. Lou Chiral proline-decorated bifunctional Pd@NH2-UiO-66 catalysts for efficient sequential suzuki coupling/asymmetric aldol reactions Inorg. Chem. 59 2020 7991 L. Cheng, K. Zhao, Q. Zhang, Y. Li, Q. Zhai, J. Chen, Y. Lou, Chiral proline-decorated bifunctional Pd@NH2-UiO-66 catalysts for efficient sequential suzuki coupling/asymmetric aldol reactions, Inorg. Chem. 59 (2020) 7991. [294] A. Huang R. Nie B. Zhang Y. Pei M. Chen R. Behera J. Yu X. Luan N.T. Hunter M. Ke W. Huang Tandem condensation-hydrogenation to produce alkylated nitriles using bifunctional catalysts: platinum nanoparticles supported on MOF-derived carbon ChemCatChem 12 2020 602 A. Huang, R. Nie, B. Zhang, Y. Pei, M. Chen, R. Behera, J. Yu, X. Luan, N.T. Hunter, M. Ke, W. Huang, Tandem condensation-hydrogenation to produce alkylated nitriles using bifunctional catalysts: platinum nanoparticles supported on MOF-derived carbon, ChemCatChem, 12 (2020) 602. [295] H.H. He J.P. Yuan P.Y. Cai K.Y. Wang L. Feng A. Kirchon J. Li L.L. Zhang H.C. Zhou Yolk–Shell and Hollow Zr/Ce-UiO-66 for manipulating selectivity in tandem reactions and photoreactions J. Am. Chem. Soc. 145 2023 17164 H.H. He, J.P. Yuan, P.Y. Cai, K.Y. Wang, L. Feng, A. Kirchon, J. Li, L.L. Zhang, H.C. Zhou, Y. Fang, Yolk–Shell and Hollow Zr/Ce-UiO-66 for manipulating selectivity in tandem reactions and photoreactions, J. Am. Chem. Soc. 145 (2023) 17164. [296] Z.S. Zhao Y. Zhang T. Fang Z.B. Han F.S. Liang Chitosan-coated metal–organic-framework nanoparticles as catalysts for tandem deacetalization–knoevenagel condensation reactions ACS Appl. Nano Mater. 3 2020 6316 Z.S. Zhao, Y. Zhang, T. Fang, Z.B. Han, F.S. Liang, Chitosan-coated metal–organic-framework nanoparticles as catalysts for tandem deacetalization–knoevenagel condensation reactions, ACS Appl. Nano Mater. 3 (2020) 6316. [297] M.H. Qi M.L. Gao L. Liu Z.B. Han Robust bifunctional core–Shell MOF@POP catalyst for one-pot tandem reaction Inorg. Chem. 57 2018 14467 M.H. Qi, M.L. Gao, L. Liu, Z.B. Han, Robust bifunctional core–Shell MOF@POP catalyst for one-pot tandem reaction, Inorg. Chem. 57 (2018) 14467. [298] M.H.D. Dang T.T.M. Nguyen L.H.T. Nguyen T.T.T. Nguyen T.B. Phan P.H. Tran T.L.H. Doan Effect of Fe(III)-based mofs on the catalytic efficiency of the tandem cyclooxidative reaction between 2-aminobenzamide and alcohols Catal. Sci. Technol. 44 2020 14529 M.H.D. Dang, T.T.M. Nguyen, L.H.T. Nguyen, T.T.T. Nguyen, T.B. Phan, P.H. Tran, T.L.H. Doan, Effect of Fe(III)-based mofs on the catalytic efficiency of the tandem cyclooxidative reaction between 2-aminobenzamide and alcohols, Catal. Sci. Technol. 44 (2020) 14529.",
      "scopus-id": "85214109398",
      "coredata": {
        "eid": "1-s2.0-S2468823124009933",
        "dc:description": "MOFs have garnered considerable interest owing to their high porosity and precisely engineered molecular structures, making them crucial in gas storage, separation, and catalysis applications. Recently, MOFs based materials have been playing an increasingly significant role in thermal catalytic reactions due to their highly controllable structures and large pores. Therefore, we summarize recent advances in the design, synthesis, and functional applications of MOFs-based materials, including pristine MOFs, composite MOFs, and their derived catalysts through calcination and/or pyrolysis in thermal catalytic reactions (e.g. hydrogenation, oxidation, cascade reaction). Furthermore, we compare the results and summarize the performance differences of different types of MOFs-based catalysts in single organic reactions and cascade reactions, variations in catalytic activity, selectivity, and stability. This helps us gain a deeper understanding of the potential applications of MOFs in organic synthesis, and deduce the structure-performance relationships between MOFs materials synthesized from different organic ligands. This review could provide important references for designing and synthesizing efficient catalysts, promoting advancement in the field of thermal catalysis.",
        "openArchiveArticle": "false",
        "prism:coverDate": "2025-02-15",
        "openaccessUserLicense": null,
        "prism:aggregationType": "Journal",
        "prism:url": "https://api.elsevier.com/content/article/pii/S2468823124009933",
        "dc:creator": [
          {
            "@_fa": "true",
            "$": "Fu, Rui"
          },
          {
            "@_fa": "true",
            "$": "Li, Weizuo"
          },
          {
            "@_fa": "true",
            "$": "He, Guangyu"
          },
          {
            "@_fa": "true",
            "$": "He, Dafang"
          },
          {
            "@_fa": "true",
            "$": "Chen, Haiqun"
          }
        ],
        "link": [
          {
            "@_fa": "true",
            "@rel": "self",
            "@href": "https://api.elsevier.com/content/article/pii/S2468823124009933"
          },
          {
            "@_fa": "true",
            "@rel": "scidir",
            "@href": "https://www.sciencedirect.com/science/article/pii/S2468823124009933"
          }
        ],
        "dc:format": "application/json",
        "openaccessType": null,
        "pii": "S2468-8231(24)00993-3",
        "prism:volume": "573",
        "articleNumber": "114811",
        "prism:publisher": "Elsevier B.V. All rights are reserved, including those for text and data mining, AI training, and similar technologies.",
        "dc:title": "Recent advance in metal-organic frameworks based catalysts for production of fine chemicals via thermal catalysis",
        "prism:copyright": "© 2024 Elsevier B.V. All rights are reserved, including those for text and data mining, AI training, and similar technologies.",
        "openaccess": "0",
        "prism:issn": "24688231",
        "dcterms:subject": [
          {
            "@_fa": "true",
            "$": "Metal-organic frameworks"
          },
          {
            "@_fa": "true",
            "$": "Derivative catalysts"
          },
          {
            "@_fa": "true",
            "$": "Hydrogenation reaction"
          },
          {
            "@_fa": "true",
            "$": "Oxidation reaction"
          },
          {
            "@_fa": "true",
            "$": "Condensation reaction"
          },
          {
            "@_fa": "true",
            "$": "Cascade reaction"
          }
        ],
        "openaccessArticle": "false",
        "prism:publicationName": "Molecular Catalysis",
        "openaccessSponsorType": null,
        "prism:pageRange": "114811",
        "pubType": "rev",
        "prism:coverDisplayDate": "15 February 2025",
        "prism:doi": "10.1016/j.mcat.2024.114811",
        "prism:startingPage": "114811",
        "dc:identifier": "doi:10.1016/j.mcat.2024.114811",
        "openaccessSponsorName": null
      },
      "objects": {
        "object": [
          {
            "@category": "standard",
            "@height": "244",
            "@width": "244",
            "@_fa": "true",
            "$": "https://api.elsevier.com/content/object/eid/1-s2.0-S2468823124009933-ga1.jpg?httpAccept=%2A%2F%2A",
            "@multimediatype": "JPEG image file",
            "@type": "IMAGE-DOWNSAMPLED",
            "@size": "34309",
            "@ref": "ga1",
            "@mimetype": "image/jpeg"
          },
          {
            "@category": "standard",
            "@height": "418",
            "@width": "753",
            "@_fa": "true",
            "$": "https://api.elsevier.com/content/object/eid/1-s2.0-S2468823124009933-gr21.jpg?httpAccept=%2A%2F%2A",
            "@multimediatype": "JPEG image file",
            "@type": "IMAGE-DOWNSAMPLED",
            "@size": "148318",
            "@ref": "gr21",
            "@mimetype": "image/jpeg"
          },
          {
            "@category": "standard",
            "@height": "239",
            "@width": "508",
            "@_fa": "true",
            "$": "https://api.elsevier.com/content/object/eid/1-s2.0-S2468823124009933-gr20.jpg?httpAccept=%2A%2F%2A",
            "@multimediatype": "JPEG image file",
            "@type": "IMAGE-DOWNSAMPLED",
            "@size": "58803",
            "@ref": "gr20",
            "@mimetype": "image/jpeg"
          },
          {
            "@category": "standard",
            "@height": "673",
            "@width": "753",
            "@_fa": "true",
            "$": "https://api.elsevier.com/content/object/eid/1-s2.0-S2468823124009933-gr25.jpg?httpAccept=%2A%2F%2A",
            "@multimediatype": "JPEG image file",
            "@type": "IMAGE-DOWNSAMPLED",
            "@size": "158803",
            "@ref": "gr25",
            "@mimetype": "image/jpeg"
          },
          {
            "@category": "standard",
            "@height": "792",
            "@width": "753",
            "@_fa": "true",
            "$": "https://api.elsevier.com/content/object/eid/1-s2.0-S2468823124009933-gr24.jpg?httpAccept=%2A%2F%2A",
            "@multimediatype": "JPEG image file",
            "@type": "IMAGE-DOWNSAMPLED",
            "@size": "197706",
            "@ref": "gr24",
            "@mimetype": "image/jpeg"
          },
          {
            "@category": "standard",
            "@height": "492",
            "@width": "565",
            "@_fa": "true",
            "$": "https://api.elsevier.com/content/object/eid/1-s2.0-S2468823124009933-gr23.jpg?httpAccept=%2A%2F%2A",
            "@multimediatype": "JPEG image file",
            "@type": "IMAGE-DOWNSAMPLED",
            "@size": "104120",
            "@ref": "gr23",
            "@mimetype": "image/jpeg"
          },
          {
            "@category": "standard",
            "@height": "927",
            "@width": "753",
            "@_fa": "true",
            "$": "https://api.elsevier.com/content/object/eid/1-s2.0-S2468823124009933-gr22.jpg?httpAccept=%2A%2F%2A",
            "@multimediatype": "JPEG image file",
            "@type": "IMAGE-DOWNSAMPLED",
            "@size": "227078",
            "@ref": "gr22",
            "@mimetype": "image/jpeg"
          },
          {
            "@category": "standard",
            "@height": "840",
            "@width": "753",
            "@_fa": "true",
            "$": "https://api.elsevier.com/content/object/eid/1-s2.0-S2468823124009933-gr9.jpg?httpAccept=%2A%2F%2A",
            "@multimediatype": "JPEG image file",
            "@type": "IMAGE-DOWNSAMPLED",
            "@size": "137507",
            "@ref": "gr9",
            "@mimetype": "image/jpeg"
          },
          {
            "@category": "standard",
            "@height": "740",
            "@width": "753",
            "@_fa": "true",
            "$": "https://api.elsevier.com/content/object/eid/1-s2.0-S2468823124009933-gr8.jpg?httpAccept=%2A%2F%2A",
            "@multimediatype": "JPEG image file",
            "@type": "IMAGE-DOWNSAMPLED",
            "@size": "217956",
            "@ref": "gr8",
            "@mimetype": "image/jpeg"
          },
          {
            "@category": "standard",
            "@height": "369",
            "@width": "753",
            "@_fa": "true",
            "$": "https://api.elsevier.com/content/object/eid/1-s2.0-S2468823124009933-gr5.jpg?httpAccept=%2A%2F%2A",
            "@multimediatype": "JPEG image file",
            "@type": "IMAGE-DOWNSAMPLED",
            "@size": "133177",
            "@ref": "gr5",
            "@mimetype": "image/jpeg"
          },
          {
            "@category": "standard",
            "@height": "281",
            "@width": "508",
            "@_fa": "true",
            "$": "https://api.elsevier.com/content/object/eid/1-s2.0-S2468823124009933-gr4.jpg?httpAccept=%2A%2F%2A",
            "@multimediatype": "JPEG image file",
            "@type": "IMAGE-DOWNSAMPLED",
            "@size": "65828",
            "@ref": "gr4",
            "@mimetype": "image/jpeg"
          },
          {
            "@category": "standard",
            "@height": "537",
            "@width": "753",
            "@_fa": "true",
            "$": "https://api.elsevier.com/content/object/eid/1-s2.0-S2468823124009933-gr7.jpg?httpAccept=%2A%2F%2A",
            "@multimediatype": "JPEG image file",
            "@type": "IMAGE-DOWNSAMPLED",
            "@size": "159214",
            "@ref": "gr7",
            "@mimetype": "image/jpeg"
          },
          {
            "@category": "standard",
            "@height": "304",
            "@width": "753",
            "@_fa": "true",
            "$": "https://api.elsevier.com/content/object/eid/1-s2.0-S2468823124009933-gr6.jpg?httpAccept=%2A%2F%2A",
            "@multimediatype": "JPEG image file",
            "@type": "IMAGE-DOWNSAMPLED",
            "@size": "91376",
            "@ref": "gr6",
            "@mimetype": "image/jpeg"
          },
          {
            "@category": "standard",
            "@height": "577",
            "@width": "753",
            "@_fa": "true",
            "$": "https://api.elsevier.com/content/object/eid/1-s2.0-S2468823124009933-gr10.jpg?httpAccept=%2A%2F%2A",
            "@multimediatype": "JPEG image file",
            "@type": "IMAGE-DOWNSAMPLED",
            "@size": "164976",
            "@ref": "gr10",
            "@mimetype": "image/jpeg"
          },
          {
            "@category": "standard",
            "@height": "559",
            "@width": "753",
            "@_fa": "true",
            "$": "https://api.elsevier.com/content/object/eid/1-s2.0-S2468823124009933-gr14.jpg?httpAccept=%2A%2F%2A",
            "@multimediatype": "JPEG image file",
            "@type": "IMAGE-DOWNSAMPLED",
            "@size": "127442",
            "@ref": "gr14",
            "@mimetype": "image/jpeg"
          },
          {
            "@category": "standard",
            "@height": "487",
            "@width": "753",
            "@_fa": "true",
            "$": "https://api.elsevier.com/content/object/eid/1-s2.0-S2468823124009933-gr13.jpg?httpAccept=%2A%2F%2A",
            "@multimediatype": "JPEG image file",
            "@type": "IMAGE-DOWNSAMPLED",
            "@size": "169389",
            "@ref": "gr13",
            "@mimetype": "image/jpeg"
          },
          {
            "@category": "standard",
            "@height": "366",
            "@width": "753",
            "@_fa": "true",
            "$": "https://api.elsevier.com/content/object/eid/1-s2.0-S2468823124009933-gr12.jpg?httpAccept=%2A%2F%2A",
            "@multimediatype": "JPEG image file",
            "@type": "IMAGE-DOWNSAMPLED",
            "@size": "110808",
            "@ref": "gr12",
            "@mimetype": "image/jpeg"
          },
          {
            "@category": "standard",
            "@height": "700",
            "@width": "753",
            "@_fa": "true",
            "$": "https://api.elsevier.com/content/object/eid/1-s2.0-S2468823124009933-gr11.jpg?httpAccept=%2A%2F%2A",
            "@multimediatype": "JPEG image file",
            "@type": "IMAGE-DOWNSAMPLED",
            "@size": "135352",
            "@ref": "gr11",
            "@mimetype": "image/jpeg"
          },
          {
            "@category": "standard",
            "@height": "229",
            "@width": "376",
            "@_fa": "true",
            "$": "https://api.elsevier.com/content/object/eid/1-s2.0-S2468823124009933-gr1.jpg?httpAccept=%2A%2F%2A",
            "@multimediatype": "JPEG image file",
            "@type": "IMAGE-DOWNSAMPLED",
            "@size": "46441",
            "@ref": "gr1",
            "@mimetype": "image/jpeg"
          },
          {
            "@category": "standard",
            "@height": "500",
            "@width": "508",
            "@_fa": "true",
            "$": "https://api.elsevier.com/content/object/eid/1-s2.0-S2468823124009933-gr18.jpg?httpAccept=%2A%2F%2A",
            "@multimediatype": "JPEG image file",
            "@type": "IMAGE-DOWNSAMPLED",
            "@size": "147076",
            "@ref": "gr18",
            "@mimetype": "image/jpeg"
          },
          {
            "@category": "standard",
            "@height": "796",
            "@width": "753",
            "@_fa": "true",
            "$": "https://api.elsevier.com/content/object/eid/1-s2.0-S2468823124009933-gr17.jpg?httpAccept=%2A%2F%2A",
            "@multimediatype": "JPEG image file",
            "@type": "IMAGE-DOWNSAMPLED",
            "@size": "163155",
            "@ref": "gr17",
            "@mimetype": "image/jpeg"
          },
          {
            "@category": "standard",
            "@height": "447",
            "@width": "753",
            "@_fa": "true",
            "$": "https://api.elsevier.com/content/object/eid/1-s2.0-S2468823124009933-gr3.jpg?httpAccept=%2A%2F%2A",
            "@multimediatype": "JPEG image file",
            "@type": "IMAGE-DOWNSAMPLED",
            "@size": "94676",
            "@ref": "gr3",
            "@mimetype": "image/jpeg"
          },
          {
            "@category": "standard",
            "@height": "580",
            "@width": "753",
            "@_fa": "true",
            "$": "https://api.elsevier.com/content/object/eid/1-s2.0-S2468823124009933-gr16.jpg?httpAccept=%2A%2F%2A",
            "@multimediatype": "JPEG image file",
            "@type": "IMAGE-DOWNSAMPLED",
            "@size": "162987",
            "@ref": "gr16",
            "@mimetype": "image/jpeg"
          },
          {
            "@category": "standard",
            "@height": "228",
            "@width": "508",
            "@_fa": "true",
            "$": "https://api.elsevier.com/content/object/eid/1-s2.0-S2468823124009933-gr2.jpg?httpAccept=%2A%2F%2A",
            "@multimediatype": "JPEG image file",
            "@type": "IMAGE-DOWNSAMPLED",
            "@size": "58853",
            "@ref": "gr2",
            "@mimetype": "image/jpeg"
          },
          {
            "@category": "standard",
            "@height": "570",
            "@width": "753",
            "@_fa": "true",
            "$": "https://api.elsevier.com/content/object/eid/1-s2.0-S2468823124009933-gr15.jpg?httpAccept=%2A%2F%2A",
            "@multimediatype": "JPEG image file",
            "@type": "IMAGE-DOWNSAMPLED",
            "@size": "143875",
            "@ref": "gr15",
            "@mimetype": "image/jpeg"
          },
          {
            "@category": "standard",
            "@height": "624",
            "@width": "753",
            "@_fa": "true",
            "$": "https://api.elsevier.com/content/object/eid/1-s2.0-S2468823124009933-gr19.jpg?httpAccept=%2A%2F%2A",
            "@multimediatype": "JPEG image file",
            "@type": "IMAGE-DOWNSAMPLED",
            "@size": "150762",
            "@ref": "gr19",
            "@mimetype": "image/jpeg"
          },
          {
            "@category": "thumbnail",
            "@height": "163",
            "@width": "163",
            "@_fa": "true",
            "$": "https://api.elsevier.com/content/object/eid/1-s2.0-S2468823124009933-ga1.sml?httpAccept=%2A%2F%2A",
            "@multimediatype": "GIF image file",
            "@type": "IMAGE-THUMBNAIL",
            "@size": "13474",
            "@ref": "ga1",
            "@mimetype": "image/gif"
          },
          {
            "@category": "thumbnail",
            "@height": "121",
            "@width": "219",
            "@_fa": "true",
            "$": "https://api.elsevier.com/content/object/eid/1-s2.0-S2468823124009933-gr21.sml?httpAccept=%2A%2F%2A",
            "@multimediatype": "GIF image file",
            "@type": "IMAGE-THUMBNAIL",
            "@size": "17806",
            "@ref": "gr21",
            "@mimetype": "image/gif"
          },
          {
            "@category": "thumbnail",
            "@height": "103",
            "@width": "219",
            "@_fa": "true",
            "$": "https://api.elsevier.com/content/object/eid/1-s2.0-S2468823124009933-gr20.sml?httpAccept=%2A%2F%2A",
            "@multimediatype": "GIF image file",
            "@type": "IMAGE-THUMBNAIL",
            "@size": "9738",
            "@ref": "gr20",
            "@mimetype": "image/gif"
          },
          {
            "@category": "thumbnail",
            "@height": "164",
            "@width": "183",
            "@_fa": "true",
            "$": "https://api.elsevier.com/content/object/eid/1-s2.0-S2468823124009933-gr25.sml?httpAccept=%2A%2F%2A",
            "@multimediatype": "GIF image file",
            "@type": "IMAGE-THUMBNAIL",
            "@size": "18276",
            "@ref": "gr25",
            "@mimetype": "image/gif"
          },
          {
            "@category": "thumbnail",
            "@height": "164",
            "@width": "156",
            "@_fa": "true",
            "$": "https://api.elsevier.com/content/object/eid/1-s2.0-S2468823124009933-gr24.sml?httpAccept=%2A%2F%2A",
            "@multimediatype": "GIF image file",
            "@type": "IMAGE-THUMBNAIL",
            "@size": "16011",
            "@ref": "gr24",
            "@mimetype": "image/gif"
          },
          {
            "@category": "thumbnail",
            "@height": "164",
            "@width": "188",
            "@_fa": "true",
            "$": "https://api.elsevier.com/content/object/eid/1-s2.0-S2468823124009933-gr23.sml?httpAccept=%2A%2F%2A",
            "@multimediatype": "GIF image file",
            "@type": "IMAGE-THUMBNAIL",
            "@size": "16785",
            "@ref": "gr23",
            "@mimetype": "image/gif"
          },
          {
            "@category": "thumbnail",
            "@height": "164",
            "@width": "133",
            "@_fa": "true",
            "$": "https://api.elsevier.com/content/object/eid/1-s2.0-S2468823124009933-gr22.sml?httpAccept=%2A%2F%2A",
            "@multimediatype": "GIF image file",
            "@type": "IMAGE-THUMBNAIL",
            "@size": "17041",
            "@ref": "gr22",
            "@mimetype": "image/gif"
          },
          {
            "@category": "thumbnail",
            "@height": "164",
            "@width": "147",
            "@_fa": "true",
            "$": "https://api.elsevier.com/content/object/eid/1-s2.0-S2468823124009933-gr9.sml?httpAccept=%2A%2F%2A",
            "@multimediatype": "GIF image file",
            "@type": "IMAGE-THUMBNAIL",
            "@size": "13131",
            "@ref": "gr9",
            "@mimetype": "image/gif"
          },
          {
            "@category": "thumbnail",
            "@height": "164",
            "@width": "167",
            "@_fa": "true",
            "$": "https://api.elsevier.com/content/object/eid/1-s2.0-S2468823124009933-gr8.sml?httpAccept=%2A%2F%2A",
            "@multimediatype": "GIF image file",
            "@type": "IMAGE-THUMBNAIL",
            "@size": "17757",
            "@ref": "gr8",
            "@mimetype": "image/gif"
          },
          {
            "@category": "thumbnail",
            "@height": "107",
            "@width": "219",
            "@_fa": "true",
            "$": "https://api.elsevier.com/content/object/eid/1-s2.0-S2468823124009933-gr5.sml?httpAccept=%2A%2F%2A",
            "@multimediatype": "GIF image file",
            "@type": "IMAGE-THUMBNAIL",
            "@size": "16593",
            "@ref": "gr5",
            "@mimetype": "image/gif"
          },
          {
            "@category": "thumbnail",
            "@height": "121",
            "@width": "219",
            "@_fa": "true",
            "$": "https://api.elsevier.com/content/object/eid/1-s2.0-S2468823124009933-gr4.sml?httpAccept=%2A%2F%2A",
            "@multimediatype": "GIF image file",
            "@type": "IMAGE-THUMBNAIL",
            "@size": "18633",
            "@ref": "gr4",
            "@mimetype": "image/gif"
          },
          {
            "@category": "thumbnail",
            "@height": "156",
            "@width": "219",
            "@_fa": "true",
            "$": "https://api.elsevier.com/content/object/eid/1-s2.0-S2468823124009933-gr7.sml?httpAccept=%2A%2F%2A",
            "@multimediatype": "GIF image file",
            "@type": "IMAGE-THUMBNAIL",
            "@size": "18589",
            "@ref": "gr7",
            "@mimetype": "image/gif"
          },
          {
            "@category": "thumbnail",
            "@height": "88",
            "@width": "219",
            "@_fa": "true",
            "$": "https://api.elsevier.com/content/object/eid/1-s2.0-S2468823124009933-gr6.sml?httpAccept=%2A%2F%2A",
            "@multimediatype": "GIF image file",
            "@type": "IMAGE-THUMBNAIL",
            "@size": "11771",
            "@ref": "gr6",
            "@mimetype": "image/gif"
          },
          {
            "@category": "thumbnail",
            "@height": "164",
            "@width": "214",
            "@_fa": "true",
            "$": "https://api.elsevier.com/content/object/eid/1-s2.0-S2468823124009933-gr10.sml?httpAccept=%2A%2F%2A",
            "@multimediatype": "GIF image file",
            "@type": "IMAGE-THUMBNAIL",
            "@size": "19634",
            "@ref": "gr10",
            "@mimetype": "image/gif"
          },
          {
            "@category": "thumbnail",
            "@height": "163",
            "@width": "219",
            "@_fa": "true",
            "$": "https://api.elsevier.com/content/object/eid/1-s2.0-S2468823124009933-gr14.sml?httpAccept=%2A%2F%2A",
            "@multimediatype": "GIF image file",
            "@type": "IMAGE-THUMBNAIL",
            "@size": "15627",
            "@ref": "gr14",
            "@mimetype": "image/gif"
          },
          {
            "@category": "thumbnail",
            "@height": "142",
            "@width": "219",
            "@_fa": "true",
            "$": "https://api.elsevier.com/content/object/eid/1-s2.0-S2468823124009933-gr13.sml?httpAccept=%2A%2F%2A",
            "@multimediatype": "GIF image file",
            "@type": "IMAGE-THUMBNAIL",
            "@size": "18999",
            "@ref": "gr13",
            "@mimetype": "image/gif"
          },
          {
            "@category": "thumbnail",
            "@height": "106",
            "@width": "219",
            "@_fa": "true",
            "$": "https://api.elsevier.com/content/object/eid/1-s2.0-S2468823124009933-gr12.sml?httpAccept=%2A%2F%2A",
            "@multimediatype": "GIF image file",
            "@type": "IMAGE-THUMBNAIL",
            "@size": "13673",
            "@ref": "gr12",
            "@mimetype": "image/gif"
          },
          {
            "@category": "thumbnail",
            "@height": "164",
            "@width": "176",
            "@_fa": "true",
            "$": "https://api.elsevier.com/content/object/eid/1-s2.0-S2468823124009933-gr11.sml?httpAccept=%2A%2F%2A",
            "@multimediatype": "GIF image file",
            "@type": "IMAGE-THUMBNAIL",
            "@size": "14230",
            "@ref": "gr11",
            "@mimetype": "image/gif"
          },
          {
            "@category": "thumbnail",
            "@height": "133",
            "@width": "219",
            "@_fa": "true",
            "$": "https://api.elsevier.com/content/object/eid/1-s2.0-S2468823124009933-gr1.sml?httpAccept=%2A%2F%2A",
            "@multimediatype": "GIF image file",
            "@type": "IMAGE-THUMBNAIL",
            "@size": "16348",
            "@ref": "gr1",
            "@mimetype": "image/gif"
          },
          {
            "@category": "thumbnail",
            "@height": "163",
            "@width": "166",
            "@_fa": "true",
            "$": "https://api.elsevier.com/content/object/eid/1-s2.0-S2468823124009933-gr18.sml?httpAccept=%2A%2F%2A",
            "@multimediatype": "GIF image file",
            "@type": "IMAGE-THUMBNAIL",
            "@size": "22896",
            "@ref": "gr18",
            "@mimetype": "image/gif"
          },
          {
            "@category": "thumbnail",
            "@height": "164",
            "@width": "155",
            "@_fa": "true",
            "$": "https://api.elsevier.com/content/object/eid/1-s2.0-S2468823124009933-gr17.sml?httpAccept=%2A%2F%2A",
            "@multimediatype": "GIF image file",
            "@type": "IMAGE-THUMBNAIL",
            "@size": "13275",
            "@ref": "gr17",
            "@mimetype": "image/gif"
          },
          {
            "@category": "thumbnail",
            "@height": "130",
            "@width": "219",
            "@_fa": "true",
            "$": "https://api.elsevier.com/content/object/eid/1-s2.0-S2468823124009933-gr3.sml?httpAccept=%2A%2F%2A",
            "@multimediatype": "GIF image file",
            "@type": "IMAGE-THUMBNAIL",
            "@size": "11554",
            "@ref": "gr3",
            "@mimetype": "image/gif"
          },
          {
            "@category": "thumbnail",
            "@height": "164",
            "@width": "213",
            "@_fa": "true",
            "$": "https://api.elsevier.com/content/object/eid/1-s2.0-S2468823124009933-gr16.sml?httpAccept=%2A%2F%2A",
            "@multimediatype": "GIF image file",
            "@type": "IMAGE-THUMBNAIL",
            "@size": "16941",
            "@ref": "gr16",
            "@mimetype": "image/gif"
          },
          {
            "@category": "thumbnail",
            "@height": "98",
            "@width": "219",
            "@_fa": "true",
            "$": "https://api.elsevier.com/content/object/eid/1-s2.0-S2468823124009933-gr2.sml?httpAccept=%2A%2F%2A",
            "@multimediatype": "GIF image file",
            "@type": "IMAGE-THUMBNAIL",
            "@size": "13079",
            "@ref": "gr2",
            "@mimetype": "image/gif"
          },
          {
            "@category": "thumbnail",
            "@height": "164",
            "@width": "217",
            "@_fa": "true",
            "$": "https://api.elsevier.com/content/object/eid/1-s2.0-S2468823124009933-gr15.sml?httpAccept=%2A%2F%2A",
            "@multimediatype": "GIF image file",
            "@type": "IMAGE-THUMBNAIL",
            "@size": "20769",
            "@ref": "gr15",
            "@mimetype": "image/gif"
          },
          {
            "@category": "thumbnail",
            "@height": "164",
            "@width": "198",
            "@_fa": "true",
            "$": "https://api.elsevier.com/content/object/eid/1-s2.0-S2468823124009933-gr19.sml?httpAccept=%2A%2F%2A",
            "@multimediatype": "GIF image file",
            "@type": "IMAGE-THUMBNAIL",
            "@size": "16199",
            "@ref": "gr19",
            "@mimetype": "image/gif"
          },
          {
            "@category": "high",
            "@height": "1085",
            "@width": "1083",
            "@_fa": "true",
            "$": "https://api.elsevier.com/content/object/eid/1-s2.0-S2468823124009933-ga1_lrg.jpg?httpAccept=%2A%2F%2A",
            "@multimediatype": "JPEG image file",
            "@type": "IMAGE-HIGH-RES",
            "@size": "238386",
            "@ref": "ga1",
            "@mimetype": "image/jpeg"
          },
          {
            "@category": "high",
            "@height": "1849",
            "@width": "3333",
            "@_fa": "true",
            "$": "https://api.elsevier.com/content/object/eid/1-s2.0-S2468823124009933-gr21_lrg.jpg?httpAccept=%2A%2F%2A",
            "@multimediatype": "JPEG image file",
            "@type": "IMAGE-HIGH-RES",
            "@size": "1057993",
            "@ref": "gr21",
            "@mimetype": "image/jpeg"
          },
          {
            "@category": "high",
            "@height": "1057",
            "@width": "2250",
            "@_fa": "true",
            "$": "https://api.elsevier.com/content/object/eid/1-s2.0-S2468823124009933-gr20_lrg.jpg?httpAccept=%2A%2F%2A",
            "@multimediatype": "JPEG image file",
            "@type": "IMAGE-HIGH-RES",
            "@size": "411195",
            "@ref": "gr20",
            "@mimetype": "image/jpeg"
          },
          {
            "@category": "high",
            "@height": "2980",
            "@width": "3333",
            "@_fa": "true",
            "$": "https://api.elsevier.com/content/object/eid/1-s2.0-S2468823124009933-gr25_lrg.jpg?httpAccept=%2A%2F%2A",
            "@multimediatype": "JPEG image file",
            "@type": "IMAGE-HIGH-RES",
            "@size": "1111035",
            "@ref": "gr25",
            "@mimetype": "image/jpeg"
          },
          {
            "@category": "high",
            "@height": "3505",
            "@width": "3333",
            "@_fa": "true",
            "$": "https://api.elsevier.com/content/object/eid/1-s2.0-S2468823124009933-gr24_lrg.jpg?httpAccept=%2A%2F%2A",
            "@multimediatype": "JPEG image file",
            "@type": "IMAGE-HIGH-RES",
            "@size": "1342395",
            "@ref": "gr24",
            "@mimetype": "image/jpeg"
          },
          {
            "@category": "high",
            "@height": "2176",
            "@width": "2500",
            "@_fa": "true",
            "$": "https://api.elsevier.com/content/object/eid/1-s2.0-S2468823124009933-gr23_lrg.jpg?httpAccept=%2A%2F%2A",
            "@multimediatype": "JPEG image file",
            "@type": "IMAGE-HIGH-RES",
            "@size": "695074",
            "@ref": "gr23",
            "@mimetype": "image/jpeg"
          },
          {
            "@category": "high",
            "@height": "4102",
            "@width": "3333",
            "@_fa": "true",
            "$": "https://api.elsevier.com/content/object/eid/1-s2.0-S2468823124009933-gr22_lrg.jpg?httpAccept=%2A%2F%2A",
            "@multimediatype": "JPEG image file",
            "@type": "IMAGE-HIGH-RES",
            "@size": "1692271",
            "@ref": "gr22",
            "@mimetype": "image/jpeg"
          },
          {
            "@category": "high",
            "@height": "3719",
            "@width": "3333",
            "@_fa": "true",
            "$": "https://api.elsevier.com/content/object/eid/1-s2.0-S2468823124009933-gr9_lrg.jpg?httpAccept=%2A%2F%2A",
            "@multimediatype": "JPEG image file",
            "@type": "IMAGE-HIGH-RES",
            "@size": "1015336",
            "@ref": "gr9",
            "@mimetype": "image/jpeg"
          },
          {
            "@category": "high",
            "@height": "3277",
            "@width": "3333",
            "@_fa": "true",
            "$": "https://api.elsevier.com/content/object/eid/1-s2.0-S2468823124009933-gr8_lrg.jpg?httpAccept=%2A%2F%2A",
            "@multimediatype": "JPEG image file",
            "@type": "IMAGE-HIGH-RES",
            "@size": "1529283",
            "@ref": "gr8",
            "@mimetype": "image/jpeg"
          },
          {
            "@category": "high",
            "@height": "1632",
            "@width": "3333",
            "@_fa": "true",
            "$": "https://api.elsevier.com/content/object/eid/1-s2.0-S2468823124009933-gr5_lrg.jpg?httpAccept=%2A%2F%2A",
            "@multimediatype": "JPEG image file",
            "@type": "IMAGE-HIGH-RES",
            "@size": "907431",
            "@ref": "gr5",
            "@mimetype": "image/jpeg"
          },
          {
            "@category": "high",
            "@height": "1243",
            "@width": "2250",
            "@_fa": "true",
            "$": "https://api.elsevier.com/content/object/eid/1-s2.0-S2468823124009933-gr4_lrg.jpg?httpAccept=%2A%2F%2A",
            "@multimediatype": "JPEG image file",
            "@type": "IMAGE-HIGH-RES",
            "@size": "474867",
            "@ref": "gr4",
            "@mimetype": "image/jpeg"
          },
          {
            "@category": "high",
            "@height": "2378",
            "@width": "3333",
            "@_fa": "true",
            "$": "https://api.elsevier.com/content/object/eid/1-s2.0-S2468823124009933-gr7_lrg.jpg?httpAccept=%2A%2F%2A",
            "@multimediatype": "JPEG image file",
            "@type": "IMAGE-HIGH-RES",
            "@size": "1048126",
            "@ref": "gr7",
            "@mimetype": "image/jpeg"
          },
          {
            "@category": "high",
            "@height": "1345",
            "@width": "3333",
            "@_fa": "true",
            "$": "https://api.elsevier.com/content/object/eid/1-s2.0-S2468823124009933-gr6_lrg.jpg?httpAccept=%2A%2F%2A",
            "@multimediatype": "JPEG image file",
            "@type": "IMAGE-HIGH-RES",
            "@size": "585934",
            "@ref": "gr6",
            "@mimetype": "image/jpeg"
          },
          {
            "@category": "high",
            "@height": "2552",
            "@width": "3333",
            "@_fa": "true",
            "$": "https://api.elsevier.com/content/object/eid/1-s2.0-S2468823124009933-gr10_lrg.jpg?httpAccept=%2A%2F%2A",
            "@multimediatype": "JPEG image file",
            "@type": "IMAGE-HIGH-RES",
            "@size": "1154722",
            "@ref": "gr10",
            "@mimetype": "image/jpeg"
          },
          {
            "@category": "high",
            "@height": "2475",
            "@width": "3333",
            "@_fa": "true",
            "$": "https://api.elsevier.com/content/object/eid/1-s2.0-S2468823124009933-gr14_lrg.jpg?httpAccept=%2A%2F%2A",
            "@multimediatype": "JPEG image file",
            "@type": "IMAGE-HIGH-RES",
            "@size": "890323",
            "@ref": "gr14",
            "@mimetype": "image/jpeg"
          },
          {
            "@category": "high",
            "@height": "2157",
            "@width": "3333",
            "@_fa": "true",
            "$": "https://api.elsevier.com/content/object/eid/1-s2.0-S2468823124009933-gr13_lrg.jpg?httpAccept=%2A%2F%2A",
            "@multimediatype": "JPEG image file",
            "@type": "IMAGE-HIGH-RES",
            "@size": "1103081",
            "@ref": "gr13",
            "@mimetype": "image/jpeg"
          },
          {
            "@category": "high",
            "@height": "1619",
            "@width": "3333",
            "@_fa": "true",
            "$": "https://api.elsevier.com/content/object/eid/1-s2.0-S2468823124009933-gr12_lrg.jpg?httpAccept=%2A%2F%2A",
            "@multimediatype": "JPEG image file",
            "@type": "IMAGE-HIGH-RES",
            "@size": "717716",
            "@ref": "gr12",
            "@mimetype": "image/jpeg"
          },
          {
            "@category": "high",
            "@height": "3099",
            "@width": "3333",
            "@_fa": "true",
            "$": "https://api.elsevier.com/content/object/eid/1-s2.0-S2468823124009933-gr11_lrg.jpg?httpAccept=%2A%2F%2A",
            "@multimediatype": "JPEG image file",
            "@type": "IMAGE-HIGH-RES",
            "@size": "1008505",
            "@ref": "gr11",
            "@mimetype": "image/jpeg"
          },
          {
            "@category": "high",
            "@height": "1015",
            "@width": "1667",
            "@_fa": "true",
            "$": "https://api.elsevier.com/content/object/eid/1-s2.0-S2468823124009933-gr1_lrg.jpg?httpAccept=%2A%2F%2A",
            "@multimediatype": "JPEG image file",
            "@type": "IMAGE-HIGH-RES",
            "@size": "350721",
            "@ref": "gr1",
            "@mimetype": "image/jpeg"
          },
          {
            "@category": "high",
            "@height": "2214",
            "@width": "2250",
            "@_fa": "true",
            "$": "https://api.elsevier.com/content/object/eid/1-s2.0-S2468823124009933-gr18_lrg.jpg?httpAccept=%2A%2F%2A",
            "@multimediatype": "JPEG image file",
            "@type": "IMAGE-HIGH-RES",
            "@size": "1146854",
            "@ref": "gr18",
            "@mimetype": "image/jpeg"
          },
          {
            "@category": "high",
            "@height": "3522",
            "@width": "3333",
            "@_fa": "true",
            "$": "https://api.elsevier.com/content/object/eid/1-s2.0-S2468823124009933-gr17_lrg.jpg?httpAccept=%2A%2F%2A",
            "@multimediatype": "JPEG image file",
            "@type": "IMAGE-HIGH-RES",
            "@size": "1134646",
            "@ref": "gr17",
            "@mimetype": "image/jpeg"
          },
          {
            "@category": "high",
            "@height": "1980",
            "@width": "3333",
            "@_fa": "true",
            "$": "https://api.elsevier.com/content/object/eid/1-s2.0-S2468823124009933-gr3_lrg.jpg?httpAccept=%2A%2F%2A",
            "@multimediatype": "JPEG image file",
            "@type": "IMAGE-HIGH-RES",
            "@size": "599311",
            "@ref": "gr3",
            "@mimetype": "image/jpeg"
          },
          {
            "@category": "high",
            "@height": "2567",
            "@width": "3333",
            "@_fa": "true",
            "$": "https://api.elsevier.com/content/object/eid/1-s2.0-S2468823124009933-gr16_lrg.jpg?httpAccept=%2A%2F%2A",
            "@multimediatype": "JPEG image file",
            "@type": "IMAGE-HIGH-RES",
            "@size": "993119",
            "@ref": "gr16",
            "@mimetype": "image/jpeg"
          },
          {
            "@category": "high",
            "@height": "1011",
            "@width": "2250",
            "@_fa": "true",
            "$": "https://api.elsevier.com/content/object/eid/1-s2.0-S2468823124009933-gr2_lrg.jpg?httpAccept=%2A%2F%2A",
            "@multimediatype": "JPEG image file",
            "@type": "IMAGE-HIGH-RES",
            "@size": "467379",
            "@ref": "gr2",
            "@mimetype": "image/jpeg"
          },
          {
            "@category": "high",
            "@height": "2522",
            "@width": "3333",
            "@_fa": "true",
            "$": "https://api.elsevier.com/content/object/eid/1-s2.0-S2468823124009933-gr15_lrg.jpg?httpAccept=%2A%2F%2A",
            "@multimediatype": "JPEG image file",
            "@type": "IMAGE-HIGH-RES",
            "@size": "986874",
            "@ref": "gr15",
            "@mimetype": "image/jpeg"
          },
          {
            "@category": "high",
            "@height": "2762",
            "@width": "3333",
            "@_fa": "true",
            "$": "https://api.elsevier.com/content/object/eid/1-s2.0-S2468823124009933-gr19_lrg.jpg?httpAccept=%2A%2F%2A",
            "@multimediatype": "JPEG image file",
            "@type": "IMAGE-HIGH-RES",
            "@size": "1015267",
            "@ref": "gr19",
            "@mimetype": "image/jpeg"
          }
        ]
      },
      "link": {
        "@rel": "abstract",
        "@href": "https://api.elsevier.com/content/abstract/scopus_id/85214109398"
      }
    }
  }
}