{
  "metadata": {
    "title": "Enhancement of Ru on furoic acid synthesis from furfural oxidation over Ru<ce:inf loc=post>x</ce:inf>/δ-MnO<ce:inf loc=post>2</ce:inf> catalysts",
    "authors": "; ; ",
    "journal": "Molecular Catalysis",
    "date": "2023-12-31",
    "doi": "10.1016/j.mcat.2023.113604",
    "abstract": "",
    "uri": "https://api.elsevier.com/content/article/pii/S2468823123006879",
    "pii": "S2468823123006879"
  },
  "fulltext": {
    "full-text-retrieval-response": {
      "scopus-eid": "2-s2.0-85174743920",
      "originalText": "serial JL 315758 291210 291744 291790 291809 31 Molecular Catalysis MOLECULARCATALYSIS 2023-10-18 2023-10-18 2023-10-18 2023-10-18 2023-11-15T19:32:27 1-s2.0-S2468823123006879 S2468-8231(23)00687-9 S2468823123006879 10.1016/j.mcat.2023.113604 S300 S300.1 FULL-TEXT 1-s2.0-S2468823123X00170 2023-11-15T21:08:15.17591Z 0 0 20231201 20231231 2023 2023-10-18T19:58:49.22345Z absattachment articleinfo articlenumber articletitlenorm authfirstinitialnorm authfirstsurnamenorm cid cids contenttype copyright crossmark dateloaded dateloadedtxt datesearch datesort dateupdated dco docsubtype doctype doi eid ewtransactionid hubeid indexeddate issn issnnorm itemstage itemtransactionid itemweight openaccess openarchive pg pgfirst pii piinorm pubdateend pubdatestart pubdatetxt pubyr sectiontitle sortorder srctitle srctitlenorm srctype ssids alllist content subj subheadings suppl tomb volfirst volissue volumelist webpdf webpdfpagecount yearnav figure table e-component body acknowledge affil appendices articletitle auth authfirstini authfull authkeywords authlast grantnumber grantsponsor grantsponsorid highlightsabst primabst ref specialabst 2468-8231 24688231 true 551 551 C Volume 551 3 113604 113604 113604 202312 December 2023 2023-12-01 2023-12-31 2023 Regular Papers article fla © 2023 Elsevier B.V. All rights reserved. ENHANCEMENTRUFUROICACIDSYNTHESISFURFURALOXIDATIONOVERRUXMNO2CATALYSTS WU X Introduction Experimental Preparation of mno2 with different crystalline forms Evaluation of catalysts Catalyst characterization Results and discussion Performance of furfural oxidation to furoic acid over Rux/δ-MnO2 Physical-chemical properties of Rux/δ-MnO2 catalysts Oxidation capacity of Rux/δ-MnO2 catalysts Discussion The structure evolution of Rux/δ-MnO2 with different ru loading The promoting effect of Ru on the oxidation of furfural to furoic acid Conclusions CRediT authorship contribution statement Acknowledgments Appendix Supplementary materials References YU 2022 112187 P MARISCAL 2016 1144 1189 R BANERJEE 2016 215 219 A JIANG 2020 761 767 L LE 2023 113017 T MITTAL 2023 113223 N FERRAZ 2018 16332 16340 C DOUTHWAITE 2017 5284 5293 M FERRAZ 2021 8453 8457 C PAPANIKOLAOU 2021 106234 G DANIEL 2021 15831 15841 S REN 2021 120290 Z GUPTA 2017 2760 2767 K ALRAWAS 2021 H TIAN 2008 Q ZHOU 2019 2923 2927 H VERDEGUER 1994 P WANG 2017 147 155 J XIANG 2022 112519 N ZHU 2019 117981 D WANG 2020 6299 6308 H YAMAGUCHI 2009 343 349 K GACAZAJAC 2018 44 54 K JIAN 2021 14699 14705 H YANG 2001 2589 2594 D YANG 2004 5581 5588 X LI 2021 111847 W GOKHALE 2022 112771 T ZHANG 2023 113468 X HOSOKAWA 2003 181 187 S DAI 2012 64 75 Q HUANG 2014 96 105 H AN 2018 4172 4181 J ZHU 2017 212 221 L LIU 2021 X XU 2022 121273 T CHEN 2021 6377 6381 D GU 2021 5422 H LI 2021 X WUX2023X113604 WUX2023X113604XX 2025-10-18T00:00:00.000Z 2025-10-18T00:00:00.000Z http://creativecommons.org/licenses/by-nc-nd/4.0/ © 2023 Elsevier B.V. All rights reserved. 2023-10-28T09:38:43.773Z http://vtw.elsevier.com/data/voc/AddOnTypes/50.7/aggregated-refined 202005D121002 Shanxi Province Science and Technology Department http://data.elsevier.com/vocabulary/SciValFunders/501100013318 http://sws.geonames.org/1814991 Institute of Coal Chemistry, Chinese Academy of Sciences SCJC–WRW-2023–19 ICC Institute of Coal Chemistry, Chinese Academy of Sciences http://data.elsevier.com/vocabulary/SciValFunders/501100018804 http://sws.geonames.org/1814991/ Shanxi Science and Technology Major Project Natural Science Foundation of Shanxi Province 20210302123007 Natural Science Foundation of Shanxi Province http://data.elsevier.com/vocabulary/SciValFunders/501100004480 http://sws.geonames.org/1814991/ The authors gratefully acknowledge financial support from Shanxi Science and Technology Major Project ( 202005D121002 ), The Natural Science Foundation of Shanxi Province ( 20210302123007 ), and The independent innovation project of Institute of Coal Chemistry, Chinese Academy of Sciences ( SCJC–WRW-2023–19 ). https://doi.org/10.15223/policy-017 https://doi.org/10.15223/policy-037 https://doi.org/10.15223/policy-012 https://doi.org/10.15223/policy-029 https://doi.org/10.15223/policy-004 item S2468-8231(23)00687-9 S2468823123006879 1-s2.0-S2468823123006879 10.1016/j.mcat.2023.113604 315758 2023-11-15T21:08:15.17591Z 2023-12-01 2023-12-31 1-s2.0-S2468823123006879-main.pdf https://s3-eu-west-1.amazonaws.com/prod-ucs-content-store-eu-west/content/pii:S2468823123006879/MAIN/application/pdf/8c915ad5ac09bd57af7cdd4c9f06542a/main.pdf main.pdf pdf true 8046218 MAIN 10 1-s2.0-S2468823123006879-main_1.png https://s3-eu-west-1.amazonaws.com/prod-ucs-content-store-eu-west/content/pii:S2468823123006879/PREVIEW/image/png/898ff58920cd1ff9e360eb7769198fcb/main_1.png main_1.png png 60413 849 656 IMAGE-WEB-PDF 1 1-s2.0-S2468823123006879-gr9.jpg https://s3-eu-west-1.amazonaws.com/prod-ucs-content-store-eu-west/content/pii:S2468823123006879/gr9/DOWNSAMPLED/image/jpeg/c59677bcc94d7d0edea822ac0187194b/gr9.jpg gr9 gr9.jpg jpg 53845 325 694 IMAGE-DOWNSAMPLED 1-s2.0-S2468823123006879-gr2.jpg https://s3-eu-west-1.amazonaws.com/prod-ucs-content-store-eu-west/content/pii:S2468823123006879/gr2/DOWNSAMPLED/image/jpeg/0f8fad299e92b914089c9fb758266782/gr2.jpg gr2 gr2.jpg jpg 72436 355 698 IMAGE-DOWNSAMPLED 1-s2.0-S2468823123006879-gr7.jpg https://s3-eu-west-1.amazonaws.com/prod-ucs-content-store-eu-west/content/pii:S2468823123006879/gr7/DOWNSAMPLED/image/jpeg/49d2b03f0d569b8ce948c6253a88ca08/gr7.jpg gr7 gr7.jpg jpg 63568 333 698 IMAGE-DOWNSAMPLED 1-s2.0-S2468823123006879-ga1.jpg https://s3-eu-west-1.amazonaws.com/prod-ucs-content-store-eu-west/content/pii:S2468823123006879/ga1/DOWNSAMPLED/image/jpeg/e277368f2dd53ba4420f557249e68405/ga1.jpg ga1 true ga1.jpg jpg 29386 200 258 IMAGE-DOWNSAMPLED 1-s2.0-S2468823123006879-gr4.jpg https://s3-eu-west-1.amazonaws.com/prod-ucs-content-store-eu-west/content/pii:S2468823123006879/gr4/DOWNSAMPLED/image/jpeg/77d349f0eeff7bb0f390f11b7a188881/gr4.jpg gr4 gr4.jpg jpg 66472 351 701 IMAGE-DOWNSAMPLED 1-s2.0-S2468823123006879-gr3.jpg https://s3-eu-west-1.amazonaws.com/prod-ucs-content-store-eu-west/content/pii:S2468823123006879/gr3/DOWNSAMPLED/image/jpeg/433078ba0789ae5cb30a946ea522e859/gr3.jpg gr3 gr3.jpg jpg 64277 432 702 IMAGE-DOWNSAMPLED 1-s2.0-S2468823123006879-gr1.jpg https://s3-eu-west-1.amazonaws.com/prod-ucs-content-store-eu-west/content/pii:S2468823123006879/gr1/DOWNSAMPLED/image/jpeg/94f272c3a15e2ed844e6d5d99d6e9ce3/gr1.jpg gr1 gr1.jpg jpg 54120 310 701 IMAGE-DOWNSAMPLED 1-s2.0-S2468823123006879-gr8.jpg https://s3-eu-west-1.amazonaws.com/prod-ucs-content-store-eu-west/content/pii:S2468823123006879/gr8/DOWNSAMPLED/image/jpeg/a0d5eee9a51195417c8ede97a8ad489a/gr8.jpg gr8 gr8.jpg jpg 80633 331 698 IMAGE-DOWNSAMPLED 1-s2.0-S2468823123006879-gr5.jpg https://s3-eu-west-1.amazonaws.com/prod-ucs-content-store-eu-west/content/pii:S2468823123006879/gr5/DOWNSAMPLED/image/jpeg/2321d1ce3143721a8d08a01a767ba477/gr5.jpg gr5 gr5.jpg jpg 89357 487 703 IMAGE-DOWNSAMPLED 1-s2.0-S2468823123006879-gr12.jpg https://s3-eu-west-1.amazonaws.com/prod-ucs-content-store-eu-west/content/pii:S2468823123006879/gr12/DOWNSAMPLED/image/jpeg/67225458b7414de964c4a34052c824a8/gr12.jpg gr12 gr12.jpg jpg 19004 341 342 IMAGE-DOWNSAMPLED 1-s2.0-S2468823123006879-gr10.jpg https://s3-eu-west-1.amazonaws.com/prod-ucs-content-store-eu-west/content/pii:S2468823123006879/gr10/DOWNSAMPLED/image/jpeg/edb5414f0db2a7802a2047f7f29dc769/gr10.jpg gr10 gr10.jpg jpg 84580 379 502 IMAGE-DOWNSAMPLED 1-s2.0-S2468823123006879-gr11.jpg https://s3-eu-west-1.amazonaws.com/prod-ucs-content-store-eu-west/content/pii:S2468823123006879/gr11/DOWNSAMPLED/image/jpeg/85eacdc8a6817903aed89fb97243bc53/gr11.jpg gr11 gr11.jpg jpg 36463 153 712 IMAGE-DOWNSAMPLED 1-s2.0-S2468823123006879-gr6.jpg https://s3-eu-west-1.amazonaws.com/prod-ucs-content-store-eu-west/content/pii:S2468823123006879/gr6/DOWNSAMPLED/image/jpeg/0d3c197428f2f386b7efa04dc7213773/gr6.jpg gr6 gr6.jpg jpg 57336 333 712 IMAGE-DOWNSAMPLED 1-s2.0-S2468823123006879-gr9.sml https://s3-eu-west-1.amazonaws.com/prod-ucs-content-store-eu-west/content/pii:S2468823123006879/gr9/THUMBNAIL/image/gif/07039b171261e8cc383fa876cf1a5c74/gr9.sml gr9 gr9.sml sml 9105 103 219 IMAGE-THUMBNAIL 1-s2.0-S2468823123006879-gr2.sml https://s3-eu-west-1.amazonaws.com/prod-ucs-content-store-eu-west/content/pii:S2468823123006879/gr2/THUMBNAIL/image/gif/a5e190bf6383d0574cb13d44a713fb41/gr2.sml gr2 gr2.sml sml 10586 111 219 IMAGE-THUMBNAIL 1-s2.0-S2468823123006879-gr7.sml https://s3-eu-west-1.amazonaws.com/prod-ucs-content-store-eu-west/content/pii:S2468823123006879/gr7/THUMBNAIL/image/gif/2cfd6eebb41a028eddd0fc87467cd784/gr7.sml gr7 gr7.sml sml 10806 105 219 IMAGE-THUMBNAIL 1-s2.0-S2468823123006879-ga1.sml https://s3-eu-west-1.amazonaws.com/prod-ucs-content-store-eu-west/content/pii:S2468823123006879/ga1/THUMBNAIL/image/gif/1242f427b16e21e973132ff5adc1772b/ga1.sml ga1 true ga1.sml sml 22072 164 212 IMAGE-THUMBNAIL 1-s2.0-S2468823123006879-gr4.sml https://s3-eu-west-1.amazonaws.com/prod-ucs-content-store-eu-west/content/pii:S2468823123006879/gr4/THUMBNAIL/image/gif/ac8a599710bf1986d8947deda6688a42/gr4.sml gr4 gr4.sml sml 10350 110 219 IMAGE-THUMBNAIL 1-s2.0-S2468823123006879-gr3.sml https://s3-eu-west-1.amazonaws.com/prod-ucs-content-store-eu-west/content/pii:S2468823123006879/gr3/THUMBNAIL/image/gif/0346ddfed0b03106e3f5f27b97bb52e5/gr3.sml gr3 gr3.sml sml 8755 135 219 IMAGE-THUMBNAIL 1-s2.0-S2468823123006879-gr1.sml https://s3-eu-west-1.amazonaws.com/prod-ucs-content-store-eu-west/content/pii:S2468823123006879/gr1/THUMBNAIL/image/gif/1616701293fa6a7f0f6c4daa60a4c792/gr1.sml gr1 gr1.sml sml 9102 97 219 IMAGE-THUMBNAIL 1-s2.0-S2468823123006879-gr8.sml https://s3-eu-west-1.amazonaws.com/prod-ucs-content-store-eu-west/content/pii:S2468823123006879/gr8/THUMBNAIL/image/gif/f4eda072ff9e524663f303a4cffcced0/gr8.sml gr8 gr8.sml sml 12190 104 219 IMAGE-THUMBNAIL 1-s2.0-S2468823123006879-gr5.sml https://s3-eu-west-1.amazonaws.com/prod-ucs-content-store-eu-west/content/pii:S2468823123006879/gr5/THUMBNAIL/image/gif/515e0d8923dee6bb1a26d28f0e3e5a81/gr5.sml gr5 gr5.sml sml 23442 152 219 IMAGE-THUMBNAIL 1-s2.0-S2468823123006879-gr12.sml https://s3-eu-west-1.amazonaws.com/prod-ucs-content-store-eu-west/content/pii:S2468823123006879/gr12/THUMBNAIL/image/gif/dc914409d5a844360d231403d51b4f5c/gr12.sml gr12 gr12.sml sml 6464 164 164 IMAGE-THUMBNAIL 1-s2.0-S2468823123006879-gr10.sml https://s3-eu-west-1.amazonaws.com/prod-ucs-content-store-eu-west/content/pii:S2468823123006879/gr10/THUMBNAIL/image/gif/77f90e2080cb9a22326f415cce2109af/gr10.sml gr10 gr10.sml sml 25180 164 217 IMAGE-THUMBNAIL 1-s2.0-S2468823123006879-gr11.sml https://s3-eu-west-1.amazonaws.com/prod-ucs-content-store-eu-west/content/pii:S2468823123006879/gr11/THUMBNAIL/image/gif/ed8c2ef9ccf7487dddfd365fde893891/gr11.sml gr11 gr11.sml sml 8476 47 219 IMAGE-THUMBNAIL 1-s2.0-S2468823123006879-gr6.sml https://s3-eu-west-1.amazonaws.com/prod-ucs-content-store-eu-west/content/pii:S2468823123006879/gr6/THUMBNAIL/image/gif/b5fd798ded1cd956c00ddfd9fff81525/gr6.sml gr6 gr6.sml sml 9414 102 219 IMAGE-THUMBNAIL 1-s2.0-S2468823123006879-gr9_lrg.jpg https://s3-eu-west-1.amazonaws.com/prod-ucs-content-store-eu-west/content/pii:S2468823123006879/HIGHRES/image/jpeg/396751e6c16ed73826e825e2e4880a84/gr9_lrg.jpg gr9 gr9_lrg.jpg jpg 357088 1441 3075 IMAGE-HIGH-RES 1-s2.0-S2468823123006879-gr2_lrg.jpg https://s3-eu-west-1.amazonaws.com/prod-ucs-content-store-eu-west/content/pii:S2468823123006879/HIGHRES/image/jpeg/99815c93ece8b93a3e4e5ac7bc683cdd/gr2_lrg.jpg gr2 gr2_lrg.jpg jpg 531966 1570 3090 IMAGE-HIGH-RES 1-s2.0-S2468823123006879-gr7_lrg.jpg https://s3-eu-west-1.amazonaws.com/prod-ucs-content-store-eu-west/content/pii:S2468823123006879/HIGHRES/image/jpeg/47f9a57b2b7b1dc2478ebcfe9b97ac29/gr7_lrg.jpg gr7 gr7_lrg.jpg jpg 548867 1475 3091 IMAGE-HIGH-RES 1-s2.0-S2468823123006879-ga1_lrg.jpg https://s3-eu-west-1.amazonaws.com/prod-ucs-content-store-eu-west/content/pii:S2468823123006879/HIGHRES/image/jpeg/901aa55143adb2337110133a3d6b17f4/ga1_lrg.jpg ga1 true ga1_lrg.jpg jpg 225043 886 1145 IMAGE-HIGH-RES 1-s2.0-S2468823123006879-gr4_lrg.jpg https://s3-eu-west-1.amazonaws.com/prod-ucs-content-store-eu-west/content/pii:S2468823123006879/HIGHRES/image/jpeg/9086bb7a499f633343a662e8c64e453c/gr4_lrg.jpg gr4 gr4_lrg.jpg jpg 536275 1552 3104 IMAGE-HIGH-RES 1-s2.0-S2468823123006879-gr3_lrg.jpg https://s3-eu-west-1.amazonaws.com/prod-ucs-content-store-eu-west/content/pii:S2468823123006879/HIGHRES/image/jpeg/9c53b92661e2a6eced6c4d2d2093cee8/gr3_lrg.jpg gr3 gr3_lrg.jpg jpg 477763 1914 3108 IMAGE-HIGH-RES 1-s2.0-S2468823123006879-gr1_lrg.jpg https://s3-eu-west-1.amazonaws.com/prod-ucs-content-store-eu-west/content/pii:S2468823123006879/HIGHRES/image/jpeg/7626f253201eb01255a2e1c3b69f2cc4/gr1_lrg.jpg gr1 gr1_lrg.jpg jpg 399551 1371 3102 IMAGE-HIGH-RES 1-s2.0-S2468823123006879-gr8_lrg.jpg https://s3-eu-west-1.amazonaws.com/prod-ucs-content-store-eu-west/content/pii:S2468823123006879/HIGHRES/image/jpeg/cb3bcd71219647db061e8d15633509ec/gr8_lrg.jpg gr8 gr8_lrg.jpg jpg 614635 1468 3092 IMAGE-HIGH-RES 1-s2.0-S2468823123006879-gr5_lrg.jpg https://s3-eu-west-1.amazonaws.com/prod-ucs-content-store-eu-west/content/pii:S2468823123006879/HIGHRES/image/jpeg/bda65690ce489b2d60813abc0068bbd8/gr5_lrg.jpg gr5 gr5_lrg.jpg jpg 949373 2157 3115 IMAGE-HIGH-RES 1-s2.0-S2468823123006879-gr12_lrg.jpg https://s3-eu-west-1.amazonaws.com/prod-ucs-content-store-eu-west/content/pii:S2468823123006879/HIGHRES/image/jpeg/1e2b1ed13cef66a97e73d2430d73371c/gr12_lrg.jpg gr12 gr12_lrg.jpg jpg 126704 1511 1515 IMAGE-HIGH-RES 1-s2.0-S2468823123006879-gr10_lrg.jpg https://s3-eu-west-1.amazonaws.com/prod-ucs-content-store-eu-west/content/pii:S2468823123006879/HIGHRES/image/jpeg/a4ae1dd337150695ebb917042e0640dd/gr10_lrg.jpg gr10 gr10_lrg.jpg jpg 822842 1682 2225 IMAGE-HIGH-RES 1-s2.0-S2468823123006879-gr11_lrg.jpg https://s3-eu-west-1.amazonaws.com/prod-ucs-content-store-eu-west/content/pii:S2468823123006879/HIGHRES/image/jpeg/461ee676c9c6c3b9f15093e4e7b7f31c/gr11_lrg.jpg gr11 gr11_lrg.jpg jpg 294821 678 3152 IMAGE-HIGH-RES 1-s2.0-S2468823123006879-gr6_lrg.jpg https://s3-eu-west-1.amazonaws.com/prod-ucs-content-store-eu-west/content/pii:S2468823123006879/HIGHRES/image/jpeg/3ec5b0bc24fae1ac0a94db30c16835e3/gr6_lrg.jpg gr6 gr6_lrg.jpg jpg 421382 1476 3154 IMAGE-HIGH-RES 1-s2.0-S2468823123006879-mmc1.docx https://s3-eu-west-1.amazonaws.com/prod-ucs-content-store-eu-west/content/pii:S2468823123006879/mmc1/MAIN/application/vnd.openxmlformats-officedocument.wordprocessingml.document/9702366c8ae5d1e9057432469f9d90f9/mmc1.docx mmc1 mmc1.docx docx 859413 APPLICATION 1-s2.0-S2468823123006879-am.pdf https://s3-eu-west-1.amazonaws.com/prod-ucs-content-store-eu-west/content/egi:107NPDTJ8BL/MAIN/application/pdf/f3b7b96aaef219c16f84579d66e327e3/am.pdf am am.pdf pdf false 1387925 AAM-PDF MCAT 113604 113604 S2468-8231(23)00687-9 10.1016/j.mcat.2023.113604 Fig. 1 (a) Furfural oxidation performance over Rux/δ-MnO2, (b) Ru's TOF in Rux/δ-MnO2. (Ru's TOF =nFF in * (Conver. [Rux/δ-MnO2] * Select. - Conver. [δ-MnO2] * Select.)/ nRu / t * 100 %, nFF in represents the furfural feed mole number, nRu represents the mole number of Ru, Conver. [Rux/δ-MnO2] represents the furfural conversion of Rux/δ-MnO2, Conver. [δ-MnO2] represents the furfural conversion of δ-MnO2, Select. represents the furoic acid selectivity, and t represents the reaction time. The above equation describes the magnitude of the gain from the addition of Ru per unit mass). Fig 1 Fig. 2 Furfural in-situ IR for (a) δ-MnO2; (b). Ru0.25/δ-MnO2. Fig 2 Fig. 3 (a). The analogy between geminal diol intermediate dehydrogenation and methanol dehydrogenation; (b). Hydrogen production rates of δ-MnO2, Ru0.25/δ-MnO2 and Ru1/δ-MnO2 catalysts in the methanol dehydrogenation reaction; (c). CO release rate in the methanol dehydrogenation reaction for δ-MnO2, Ru0.25/δ-MnO2 and Ru1/δ-MnO2 catalysts. Fig 3 Fig. 4 (a) XRD pattern of Rux/δ-MnO2, (b) Enlargement of XRD pattern in the 10–30° interval. Fig 4 Fig. 5 TEM images of δ-MnO2 with different Ru loadings. Fig 5 Fig. 6 (a) H2-TPR spectra of Rux/δ-MnO2, (b) Reduction peaks of RuOx in H2-TPR spectra. Fig 6 Fig. 7 (a). XPS Ru 3p spectra of Rux/δ-MnO2, (b) Average oxidation states of Ru in Rux/δ-MnO2. (AOS=4 × a + 6 × b, a, b are the percentages of +4 and +6 valence respectively). Fig 7 Fig. 8 (a). XPS Mn 3 s spectra of Rux/δ-MnO2 (b). XPS O 1 s spectra of Rux/δ-MnO2. Fig 8 Fig. 9 a) O2-TPD spectra of Rux/δ-MnO2; (a). M/Z = 32 (O2) signal, (b). M/Z = 18 (H2O) signal. Fig 9 Fig. 10 The structure evolution of Rux/δ-MnO2 with different Ru loading. Fig 10 Fig. 11 Schematic diagram of the promoting effect of Ru on furoic acid synthesis over Rux/δ-MnO2 catalyst. Fig 11 Fig. 12 Relationship between AOS of Ru and TOF of furfural oxidation. Fig 12 Table 1 Catalytic performance of furfural Oxidation to furoic acid over δ-MnO2 and Ru0.25/δ-MnO2. Table 1 Entry Catalyst Temper./( °C) React. time/(h) Cat. weight/(g) Conver. 1 /(%) Select. 2 /(%) Reaction rate 3 / (mmolFA/gcat/h) 1 δ-MnO2 100 1 0.2 50 100 1.42 2 δ-MnO2 120 1 0.2 70 100 1.81 3 δ-MnO2 120 6 0.3 100 100 0.29 4 Ru0.25/δ-MnO2 120 1 0.2 100 100 2.59 5 Ru0.25/δ-MnO2 120 0.5 0.2 99 100 5.18 1 Conver.= (nFF in - nFF out(by HPLC))/ nFF in*100 %, nFF in: Furfural feed molarity, nFF out: Molarity of furfural in the product detected by HPLC. 2 Select. =nFA (by HPLC)/ nproduct (by HPLC)*100 %, nFA represents the molar amount of furoic acid in the product detected by HPLC, and nproduct represents the sum of the molar amounts of all products detected by HPLC. 3 Reaction rate /(mmolFA/gcat/h) =nFF in * Conver. * Select./ mcat. / t * 100 %, nFF represents the furfural feed mole number, mcat. represents the mass of catalyst, and t represents the reaction time. Reaction conditions: The furfural feed is 50 mg, the reactor volume is 100 mL, the reaction atmosphere is 1 MPa O2, the stirring speed is 500 rpm. Enhancement of Ru on furoic acid synthesis from furfural oxidation over Rux/δ-MnO2 catalysts Xu Wu Methodology Investigation Writing – original draft a b Heqin Guo Formal analysis Writing – review & editing Data curation a ⁎ Litao Jia Supervision Project administration a c Yong Xiao Software Project administration a Bo Hou Supervision Project administration a Yongxiang Gao Supervision Project administration a Debao Li Formal analysis Writing – review & editing Resources a c a State Key Laboratory of Coal Conversion, Institute of Coal Chemistry, Chinese Academy of Sciences, Taiyuan, Shanxi 030001, China State Key Laboratory of Coal Conversion Institute of Coal Chemistry Chinese Academy of Sciences Taiyuan Shanxi 030001 China aState Key Laboratory of Coal Conversion, Institute of Coal Chemistry, Chinese Academy of Sciences, Taiyuan, Shanxi 030001, China b University of Chinese Academy of Sciences, Beijing 100049, China University of Chinese Academy of Sciences Beijing 100049 China bUniversity of Chinese Academy of Sciences, Beijing 100049, China c Dalian National Laboratory for Clean Energy, Chinese Academy of Science, Dalian 116023, China Dalian National Laboratory for Clean Energy Chinese Academy of Science Dalian 116023 China cDalian National Laboratory for Clean Energy, Chinese Academy of Science, Dalian 116023, China ⁎ Corresponding author at: State Key Laboratory of Coal Conversion, Institute of Coal Chemistry, Chinese Academy of Sciences, Taiyuan, Shanxi 030001, China. State Key Laboratory of Coal Conversion Institute of Coal Chemistry Chinese Academy of Sciences Taiyuan Shanxi 030001 China δ-MnO2 exhibits excellent activity for furfural oxidation to furoic acid under base-free conditions. However, its poor CH bond breaking capacity leads to lower conversion efficiency per unit mass catalyst than noble metal. Thus, a series of Ru-modified δ-MnO2 (Rux/δ-MnO2) have been made to enhance its CH bond breaking ability. The result showed that the furfural conversion was greatly enhanced on Rux/δ-MnO2 due to the enhanced capability for breaking the CH bond. Especially for Ru0.25/δ-MnO2, whose conversion rate per unit mass was 18 times higher than δ-MnO2. The characterization results showed that the Ru species mainly existed as single atoms or clusters on Ru0.25/δ-MnO2 and Ru0.5/δ-MnO2, while started to aggregate to RuO2 nanoparticles on Ru1/δ-MnO2 and Ru2/δ-MnO2. With the increase of Ru particles, the Ru's average oxidation state (AOS) decreased from +6 on Ru0.25/δ-MnO2 to +4.74 on Ru2/δ-MnO2. The Ru's TOF (intrinsic activity per Ru) was positively linearly related to the Ru's AOS. The electron-deficient Ru in Ru0.25/δ-MnO2 can strongly adsorb the H atom of the CH of geminal diol intermediate and accelerate the breakage of its CH bond. As a result, Ru in the Ru0.25/δ-MnO2 exhibited the highest TOF, which can even reach 29.85 mmolFF/mmolRu/h. Graphical abstract Image, graphical abstract Keywords Base-free Ru/δ-MnO2 C–H bond breaking Furfural oxidation to furoic acid Data availability No data was used for the research described in the article. Introduction Biomass is a green and renewable resource that is derived from a wide range of sources, making it a perfect renewable carbon feedstock for energy, chemicals, and materials. The widespread use of bio-chemicals and bio-materials derived from biomass is significant for achieving carbon neutrality. Furoic acid is a high value-added bio-chemical that is widely used in fragrances, pharmaceuticals and agrochemicals [1]. Most importantly, furoic acid can be used for the synthesis of polyester monomer furandicarboxylic acid (FDCA), which is a green alternative to the widely used terephthalic acid(PTA) [2–6]. Catalytic oxidation of furfural to prepare furoic acid is the greenest and most efficient route [7], noble metal and non-noble metal catalysts have been applied in this technology. The noble metal catalysts primarily consist of Au [8–12], Pt and Pd systems [13–15], which can efficiently convert furfural under low or base-free conditions. While the expensive cost of these catalysts made them inapplicable. The non-noble metal catalysis primarily involves active components such as copper oxide [16] and cobalt [17], which can convert furfural only under high alkali conditions. As a result, a significant amount of acid is needed to neutralize the excess alkali, which is environmentally unfriendly. Thus, it is urgent to develop non-noble and base-free catalysts for furfural oxidation. According to the mechanism of furfural oxidation [2,13,18], three steps are key to furoic acid synthesis: 1) The activation of furfural's aldehyde group to generate geminal diol intermediates; 2) The activation of O2 to generate active oxygen species; 3) The oxidative dehydrogenation of geminal diol through breaking CH bonds to produce furoic acid. Our previous research showed that δ-MnO2 has plentiful inherent hydroxyl groups, which can efficiently attack the aldehyde group of furfural to generate geminal diol intermediates. Moreover, the oxygen species arising from the oxygen activation and the inherent hydroxyl groups are helpful to break CH bond of geminal diol to produce furoic acid [19,20]. These properties of δ-MnO2 help it show similar catalytic performance to noble metals under base-free conditions. While the conversion efficiency per unit mass of the catalyst is still lower than noble metal due to its poor ability to break the CH bond of geminal diol. Thus, great efforts need to be made to increase the conversion efficiency per unit mass of the catalyst of δ-MnO2. For formaldehyde oxidation, it is reported that the breaking of the CH bond is a heat-absorbing process with the highest △E value in the radical reaction step, which is considered to be rate-determining [21]. Considering the similarity of furfural oxidation with formaldehyde oxidation, it is deduced that the breaking of the CH bond of furfural is important for furoic acid synthesis. Thus, it is urgent to enhance the ability to break the CH bond of δ-MnO2 to increase the reaction rate per unit mass of catalyst. Ru can well assist the dehydrogenation process because it has excellent CH bond-breaking ability. Xiao et al. [22]. found for benzyl alcohol oxidative cyanidation reaction, the addition of 0.1 wt% Ru to MnO2 can greatly enhance CH bond breaking ability of Ru/MnO2 catalyst and greatly enhance the generation of the intermediate benzaldehyde. Yamaguchi et al. [23]. found that CH bond breaking was the decisive step in the benzyl alcohol dehydrogenation reaction, and the addition of Ru could substantially improve the reaction activity by enhancing the CH bond breaking ability. In conclusion, the addition of Ru can improve the dehydrogenation activity by enhancing the CH bond-breaking ability. Considering the poor CH bond activation ability of δ-MnO2, it can be deduced that the addition of trace Ru to δ-MnO2 might strongly enhance the CH bond breaking ability of the catalyst, which is helpful for furoic acid synthesis. Based on the above analysis, a series of Rux/δ-MnO2 catalysts were prepared in this work. The catalysts were characterized by H2-TPR, O2-TPD, XPS and TEM, the CH bond breaking ability was demonstrated by methanol dehydrogenation probe reaction, and the enhancement of Ru on furfural oxidation to furoic acid was analyzed. Experimental Manganese sulfate monohydrate (MnSO4.H2O), ammonium sulfate ((NH4)2SO4), ruthenium trichloride (RuCl3), ammonium persulfate ((NH4)2S2O8), potassium permanganate (KMnO4), all of the above reagents were purchased at Aladdin. Preparation of mno2 with different crystalline forms The preparation details of δ-MnO2 are as follows: Dissolving 0.676 g MnSO4.H2O and 3.792 g KMnO4 in 140 g deionized water and then heated at 160 °C for 12 h in 200 ml of PTFE liner. The precursor obtained above was filtered and washed, then dried in an oven at 80 °C for 12 h. The obtained catalyst was identified as δ-MnO2. The preparation details of Ru/δ-MnO2 are as follows: The above step of drying δ-MnO2 was changed from drying at 80 °C for 12 h to drying at 80 °C for 6 h. Disperse 2 g of the above solid in water, add a certain amount of RuCl3 solution(the mass fraction of Ru is 0.25 wt%, 0.5 wt%, 1 wt%, 2 wt%) and sonicate for 5 min. RuCl3 was precipitated with a certain concentration of NaOH, stirred at 50 °C until completely dry, and finally dried in an oven at 80 °C for 6 h. The obtained catalysts were noted as Rux/δ-MnO2 (x is the mass percentage of Ru in the catalyst, x = 0.25, 0.5, 1, 2, respectively. In particular, x = 0 is noted as δ-MnO2). Evaluation of catalysts The experimental parameters are as follows. Reactor: stainless-steel magnetic stirring batch reactor (100 ml). MaterialS: 50 mg of furfural, 10 ml of deionized water, and 200 mg of catalyst powder. Reaction condition: 1 MPa O2, 100 °C, 1 h, 500 r/min. With further clarifications in the manuscript, the experimental parameters were altered. The products were analyzed by HPLC under the following conditions, detection wavelength=220 nm, mobile phase (acetonitrile: water=1:1), C18 columns. Catalyst characterization See Supporting Information for catalyst characterization details. Results and discussion Performance of furfural oxidation to furoic acid over Rux/δ-MnO2 The synthesized catalysts were tested in the reaction of furfural oxidation to furfural acid(see Fig. 1 a). The δ-MnO2 was able to achieve 50.07 % furfural conversion at 100 °C. While the furfural conversion was greatly enhanced on all Rux/δ-MnO2 catalysts. The furfural conversion sharply increased to 78.24 % on Ru0.25/δ-MnO2, which is 27.90 % higher than δ-MnO2. With the continued increase of Ru loading, the furfural conversion slightly increased to 89.34 % on Ru1/δ-MnO2, while decreasing to 81.41 % on Ru2/δ-MnO2. Moreover, the TOF values based on Ru were compared. The result showed that Ru's TOF values on Ru0.25/δ-MnO2 were found to be much higher than other catalysts (see Fig. 1b). The reaction condition was further optimized for δ-MnO2 and Ru0.25/δ-MnO2 catalysts, and the evaluation results are shown in Table 1 . As can be seen, a 69.68 % furfural conversion was obtained on δ-MnO2 at 120 °C, 0.2 g Catalyst, 1 h (Entry 2). While Ru0.25/δ-MnO2 can achieve 99.55 % furfural conversion under the same reaction condition (Entry 4). Even as the reaction time shorted to 0.5 h, a 99.46 % furfural conversion can still be obtained on Ru0.25/δ-MnO2 (Entry 5). While δ-MnO2 can not reach a similar furfural conversion unless the catalyst is increased to 0.3 g and the reaction time is increased to 6 h (Entry 3). That is to reach a similar furfural conversion(99 %), the reaction time and catalyst amount of Ru0.25/δ-MnO2 were only 1/12 and 2/3 compared to δ-MnO2, respectively (Entry 3 and Entry 5). In addition, Ru0.25/δ-MnO2 accomplishes the rapid conversion of furfural to furoic acid, avoiding the deep oxidation of furoic acid for a long time under high-temperature oxygen conditions. To verify the accelerating effect of Ru on the reaction process, δ-MnO2 and Ru0.25/δ-MnO2 were chosen as the representative catalysts to be characterized by the in-situ IR technique. After absorption of furfural, the δ-MnO2 showed the typical IR peaks of furan ring in furfural and geminal diol intermediate at 1390 cm−1 and 1022 cm−1, respectively [24,25] (see Fig. 2 a). After the introduction of O2, the IR peaks at 1022 cm−1 and 1390 cm−1 gradually weakened with time, while the peak at 1542 cm−1 gradually increased, indicating that the conversion of furfural and intermediates to furoic acid. While, after absorption of furfural, the Ru0.25/δ-MnO2 (see Fig. 2b) showed weaker peaks at 1390 cm−1 and 1022 cm−1 but strong peaks at 1542 cm−1, indicating the Ru greatly accelerated the conversion of furfural and geminal diol intermediate to furoic acid. Physical-chemical properties of Rux/δ-MnO2 catalysts A series of characterization techniques were carried out to explore the enhancement of Ru on furfural oxidation. The FTIR spectra showed that the Rux/δ-MnO2 exhibited similar hydroxyl groups at 3186 cm−1 and 3557 cm−1 to δ-MnO2(see Fig. s1). Methanol dehydrogenation was used as a probe reaction to characterize the CH bond-breaking capabilities of Rux/δ-MnO2 (see Fig. 3 a). For δ-MnO2, the hydrogen production rate was near zero with no cracking products detected, indicating that the CH bond breaking capacity of δ-MnO2 was weak (see Fig. 3b and 3c). After adding Ru, the hydrogen and CO were detected, which indicated the enhanced CH bond breaking capacity. Moreover, the H2 and CO producing rates on Ru0.25/δ-MnO2 can even reach 1100 ml/min/gRu and 900 ml/min/gRu, which is faster than those on Ru1/δ-MnO2. This result indicated that the CH bond-breaking ability of Ru0.25/δ-MnO2 was much stronger than Ru1/δ-MnO2. To explain the reason leading to enhanced CH bond breaking capacities over Rux/δ-MnO2, the catalysts were further characterized using XRD, SEM and XPS. Fig. 4 shows the XRD pattern of Rux/δ-MnO2. As shown in Fig. 4a, δ-MnO2 shows the typical diffraction peaks of δ-MnO2 at 2θ=12.6°, 2θ=25.1°and 2θ=37.3° [26–29]. After the addition of Ru, the typical diffraction peaks of δ-MnO2 remained, while the main diffraction peaks at 2θ=12.6° and 2θ=25.1° shift to a high angle (see Fig. 4b). This result indicated the strong interaction occurred between Ru species and δ-MnO2. With the increase of Ru loading to 1wt%, these diffraction peaks shift to the highest angle at 2θ=12.9° and 2θ=25.3° on Ru1/δ-MnO2, which indicated the enhanced interaction. While continuing to increase the Ru loading to 2 wt%, these diffraction peaks shifted to a lower angle at 2θ=12.7° and 2θ=25.2°, which indicated that the weakened interaction between Ru species and δ-MnO2. In addition, a typical diffraction peak of RuO2 at 2θ=28.8 appeared on Ru2/δ-MnO2, which indicates that RuO2 starts to agglomerate. To verify the above results, the existing state of Ru was further characterized by the TEM technique(see Fig. 5 ). The results showed that no significant RuO2 particles were observed on Ru0.25/δ-MnO2 and Ru0.5/δ-MnO2 catalysts, which indicates that the Ru is uniformly dispersed as clusters or single atoms. When the loading of Ru was 1 wt%, the nanoparticles of RuO2 started to appear with relatively uniform dispersion. Continuing to increase the loading of Ru to 2 wt%, the RuO2 nanoparticles on the Ru2/δ-MnO2 catalyst started to grow and agglomerate, which is consistent with the XRD results. Meanwhile, the H2-TPR spectra show that a main peak at 327 °C and a shoulder peak at 278 °C are present on δ-MnO2 (see Fig. 6 a). While, after the addition of Ru, the above two peaks both shifted to lower temperatures with the peak at 278 °C becoming the main peak and that at 327 °C becoming the shoulder peak. These results indicated the enhanced interaction between RuOx and δ-MnO2 [ 30]. As the Ru content increased to 1wt%, the peak at 278 °C and 327 °C shifted to lower temperatures at 229 °C and 279 °C, respectively. While as the loading of Ru continue to increase to 2 wt%, those peaks moved toward high temperatures at 245 °C and 291 °C. To deeply understand the changes in the reduction peaks of the Rux/δ-MnO2 catalysts, an enlarged view of the region (100–200 °C) has been analyzed (see Fig. 6b). As can be seen, no reduction peaks of RuO2 have been observed on Ru0.25/δ-MnO2 and Ru0.5/δ-MnO2 catalysts. While, the reduction peaks of RuO2 near 140 °C [31–33] started to appear on Ru1/δ-MnO2, and the peak becomes stronger on Ru2/δ-MnO2. These results indicated that the Ru began to aggregate to RuO2 as Ru content above 1wt%. From the above analysis, it can be concluded that as the Ru content is below 1wt%, the highly dispersed Ru species may interact strongly with δ-MnO2, leading to the reduction temperature shifting to a lower temperature. While, as the Ru content was above 1wt%, the interaction between δ-MnO2 and the aggregated RuO2 was weakened, leading to the reduction temperature shifting to a higher temperature. This result is consistent with the XRD, TEM and XPS results. The valence state of Ru was characterized by the XPS technique, and the Ru 3p spectra are shown in Fig. 7 . The binding energies near 281.9 eV and 283 eV are corresponding to Ru4+ and Ru6+, respectively [33,34]. As can be seen from Fig. 7a, the binding energies of Ru on Ru0.25/δ-MnO2 was 283 eV, indicating Ru existed as Ru6+. As the Ru loading increased to 0.5wt%, a shoulder peak at about 281.9 eV appeared, indicating the appearance of Ru4+. As the Ru loading continue to increase, the peak at 281.9 eV gradually shifted to lower energy with the enhanced peak intensity, which indicated the increased proportion of Ru4+. The average oxidation state (AOS) of Ru was calculated (see Fig. 7b). The AOS value of Ru on Ru0.25/δ-MnO2 was +6, which decreased to +4.74 on Ru2/δ-MnO2. The above results show that the Ru was highly dispersed as the Ru loading below 0.5wt%, and started to agglomerate into RuO2 (Ru4+) above 1wt%. This result is consistent with the TEM result. The distribution of active oxygen species and the average oxidation state (AOS) of Mn were also characterized by the XPS technique. It was reported that the lower AOS of Mn represents the more abundant oxygen vacancies in the catalyst [35,36]. Fig. 8 a shows the AOS value of Mn of δ-MnO2 was 3.52. While the AOS value of Mn was greatly enhanced on all Rux/δ-MnO2 catalysts. The AOS value of Mn increase to 3.82 on Ru1/δ-MnO2 and then decrease to 3.79 on Ru2/δ-MnO2 with increasing Ru loading, indicating that the oxygen vacancies in the catalyst first decrease and then increase. The above conclusion was then verified by XPS O 1 s spectra(see Fig. 8b). The O 1 s binding energy at 527–535 eV can be separated into three peaks, corresponding to lattice oxygen, active oxygen species, and water or oxygen adsorbed on the surface, at 530, 531.5, and 533 eV, respectively [37,38]. The results showed that the active oxygen species first decreased and then increased with increasing Ru loading. Oxidation capacity of Rux/δ-MnO2 catalysts The oxidation capacity of the catalysts was characterized by the O2-TPD technique. Fig. 9 shows the O2-TPD spectra of the catalysts. The δ-MnO2 shows O2 desorption peaks in three regions at 100–200 °C, 200–450 °C and 650–800 °C (see Fig. 9a). The peaks at 200–450 °C and 650–800 °C regions are attributed to the desorption of active oxygen species (Oads) and lattice oxygen (Olatt) [39,40], respectively. And oxygen desorption in the region of 100–200 °C is accompanied by the production of water (see Fig. 9b), indicating that this oxygen species(O OH) is generated by hydroxyl decomposition (2-OH→H2O+ O OH). The desorption temperature and amount of O OH remained almost constant after Ru addition, which is consistent with the hydroxyl characterization by IR. However, the peak intensity of Oads. decreased for all the Ru-added catalysts. As the Oads. are derived from the activation of oxygen by oxygen vacancies, and the peak intensity are corresponding to the number of oxygen vacancies. Thus, the above phenomenon shows that the amount of oxygen vacancies is lower on the Ru-added catalysts than δ-MnO2. As the Ru content increased, the Oads. first decreased to the minimum on Ru1/δ-MnO2 and then increased on Ru2/δ-MnO2, which indicated the amount of oxygen vacancies was lowest on Ru1/δ-MnO2. The changes trend of oxygen vacancies on Rux/δ-MnO2 was consistent with the XPS results. Discussion The structure evolution of Rux/δ-MnO2 with different ru loading Combined with the XRD, TEM, XPS and H2-TPR results, it can be deduced that Ru species on Ru0.25/δ-MnO2 mainly existed as single atoms or clusters exhibiting the highest Ru AOS (AOS=6) (see Fig. 10 ). And the small-sized Ru species may strongly interact with δ-MnO2 and occupy the oxygen vacancies of δ-MnO2, leading to a decreased amount of Oads.. As the Ru loading increased to 0.5 wt%, the increased amount of Ru single atoms or Ru cluster can occupy more oxygen vacancies, leading to a continued decrease of Oads.. Moreover, some of Ru single atoms may be transformed into the RuO2 sub-nano particles, leading to the decrease of Ru AOS. While, for Ru1/δ-MnO2, a few of Ru species aggraded to RuO2, leading to the Ru AOS decreasing to 4.9. While, the residual single atoms or Ru cluster on Ru1/δ-MnO2 can still occupy more oxygen vacancies, leading to the lowest Oads.. For Ru2/δ-MnO2, most of the Ru species aggregated to RuO2 nanoparticles (>10 nm), thus this catalyst showed the lowest Ru AOS (AOS=4.74). Moreover, the interaction between RuO2 nanoparticles and δ-MnO2 is weak, resulting in the release of oxygen vacancies and thus the increase of Oads.. The promoting effect of Ru on the oxidation of furfural to furoic acid Our previous study shows the activation of the aldehyde group by hydroxyl groups on δ-MnO2 and the O OH and Oads. were important for furoic synthesis [7]. While, the FTIR spectra show that the addition of Ru did not change the intensity of hydroxyl groups of δ-MnO2, but decreased the intensity of Oads.. Moreover, the probe reaction of methanol dehydrogenation showed that the addition of Ru to δ-MnO2 greatly enhanced the capacities for breaking CH bond of geminal diol intermediate. The In-situ FTIR result showed Ru greatly accelerated the conversion of furfural and geminal diol intermediate to furoic acid. Considering the last step of furoic acid synthesis is the oxidative dehydrogenation of geminal diol through breaking CH bonds, it is deduced that the promoting effect of Ru on furoic synthesis might be due to the enhanced capacities for breaking CH bond of geminal diol intermediate. The mechanism of promoting effect of Ru on furoic synthesis was showed in Fig. 11 . As the break of CH bonds of geminal diol is accelerated by Ru species, the electronic state of Ru species might influence the furfural conversion. The relationship between the Ru AOS and furfural oxidation activity was discussed. Fig. 12 depicts the results of a correlation between Ru AOS values and TOF (intrinsic activity per Ru). As can be seen, the TOF was positively linearly related to the AOS of Ru. The Ru0.25/δ-MnO2 has the highest TOF. The XPS results showed that the Ru0.25/δ-MnO2 has the highest Ru AOS, the electron-deficient Ru in Ru0.25/δ-MnO2 can strongly adsorb the H atom of the geminal diol intermediate's CH bond and hasten its breakdown, leading to the highest TOF. As the Ru loading increased, the decreasing Ru AOS weakened the ability for breaking the CH of intermediate and thus led to the decreased TOF. Conclusions In summary, the addition of trace Ru can enhance the ability for breaking the CH bond of geminal diol and promote furoic acid synthesis. The content of Ru on δ-MnO2 strongly influenced the particle size of Ru species, the Ru AOS, and the Oads. on δ-MnO2 as well as the catalytic performance for furfural oxidation to furoic acid. On Ru0.25/δ-MnO2 catalyst, the Ru species was highly dispersed as a single atom or cluster, which mainly exhibited as Ru6+ and can strongly interact with δ-MnO2. The electron-deficient Ru in Ru0.25/δ-MnO2 can strongly adsorb the H atom of the CH bond of geminal diol intermediate and accelerate the breakage of its CH bond, leading to the highest TOF. With the increase of Ru content, some of Ru species started to aggregate to sub-nano or nano RuO2 and the Ru AOS began to decrease, leading to a weakened ability for breaking the CH bond of intermediate and thus the decreased TOF. This study provides a new idea for the development of eco-friendly, high reaction rate and inexpensive catalysts for furfural oxidation. CRediT authorship contribution statement Xu Wu: Methodology, Investigation, Writing – original draft. Heqin Guo: Formal analysis, Writing – review & editing, Data curation. Litao Jia: Supervision, Project administration. Yong Xiao: Software, Project administration. Bo Hou: Supervision, Project administration. Yongxiang Gao: Supervision, Project administration. Debao Li: Formal analysis, Writing – review & editing, Resources. Declaration of Competing Interest The authors declare that they have no known competing financial interests or personal relationships that could have appeared to influence the work reported in this paper. Acknowledgments The authors gratefully acknowledge financial support from Shanxi Science and Technology Major Project (202005D121002), The Natural Science Foundation of Shanxi Province (20210302123007), and The independent innovation project of Institute of Coal Chemistry, Chinese Academy of Sciences (SCJC–WRW-2023–19). Supplementary materials Supplementary material associated with this article can be found, in the online version, at doi:10.1016/j.mcat.2023.113604. Appendix Supplementary materials Image, application 1 References [1] P. Yu G. Sun L. Xiong B. Zheng T. Li J. Jiang Y. Wang W. Yang Biomass to drugs: green production of salicylic acid from 2-furoic acid in two steps Mole. Catal. 521 2022 112187 10.1016/j.mcat.2022.112187 P. Yu, G. Sun, L. Xiong, B. Zheng, T. Li, J. Jiang, Y. Wang, W. Yang, Biomass to drugs: green production of salicylic acid from 2-furoic acid in two steps, Mole. Catal. 521 (2022) 112187, 10.1016/j.mcat.2022.112187. [2] R. Mariscal P. Maireles-Torres M. Ojeda I. Sádaba M.López Granados Furfural: a renewable and versatile platform molecule for the synthesis of chemicals and fuels Energy Environ. Sci. 9 2016 1144 1189 10.1039/C5EE02666K R. Mariscal, P. Maireles-Torres, M. Ojeda, I. Sádaba, M.López Granados, Furfural: a renewable and versatile platform molecule for the synthesis of chemicals and fuels, Energy Environ. Sci. 9 (2016) 1144–1189, 10.1039/C5EE02666K. [3] A. Banerjee G.R. Dick T. Yoshino M.W. Kanan Carbon dioxide utilization via carbonate-promoted C–H carboxylation NatureNature 531 2016 215 219 10.1038/nature17185 A. Banerjee, G.R. Dick, T. Yoshino, M.W. Kanan, Carbon dioxide utilization via carbonate-promoted C–H carboxylation, NatureNature 531 (2016) 215–219, 10.1038/nature17185. [4] L. Jiang A. Gonzalez-Diaz J. Ling-Chin A. Malik A.P. Roskilly A.J. Smallbone PEF plastic synthesized from industrial carbon dioxide and biowaste Nat. Sustain. 3 2020 761 767 10.1038/s41893-020-0549-y L. Jiang, A. Gonzalez-Diaz, J. Ling-Chin, A. Malik, A.P. Roskilly, A.J. Smallbone, PEF plastic synthesized from industrial carbon dioxide and biowaste, Nat. Sustain. 3 (2020) 761–767, 10.1038/s41893-020-0549-y. [5] T.K.T. Le S. Kongparakul H. Zhang J. Zhao G. Guan N. Chanlek T.T.V. Tran C. Samart Highly efficient liquid-phase oxidation of 5-hydroxymethylfurfural over Co-Cu/activated carbon catalysts Mole. Catal. 539 2023 113017 10.1016/j.mcat.2023.113017 T.K.T. Le, S. Kongparakul, H. Zhang, J. Zhao, G. Guan, N. Chanlek, T.T.V. Tran, C. Samart, Highly efficient liquid-phase oxidation of 5-hydroxymethylfurfural over Co-Cu/activated carbon catalysts, Mole. Catal. 539 (2023) 113017, 10.1016/j.mcat.2023.113017. [6] N. Mittal M. Kaur V. Singh Mild and selective catalytic oxidation of 5-HMF to 2,5-FDCA over metal loaded biomass derived graphene oxide using hydrogen peroxide in aqueous media Mole. Catal. 546 2023 113223 10.1016/j.mcat.2023.113223 N. Mittal, M. Kaur, V. Singh, Mild and selective catalytic oxidation of 5-HMF to 2,5-FDCA over metal loaded biomass derived graphene oxide using hydrogen peroxide in aqueous media, Mole. Catal. 546 (2023) 113223, 10.1016/j.mcat.2023.113223. [7] X. Wu, H. Guo, L. Jia, Y. Xiao, B. Hou, D. Li, Effect of MnO2 crystal type on the oxidation of furfural to furoic acid, catalysts, 2023, 13, 663. 10.3390/catal13040663. [8] C.P. Ferraz M. Zieliński M. Pietrowski S. Heyte F. Dumeignil L.M. Rossi R. Wojcieszak Influence of support basic sites in green oxidation of biobased substrates using au-promoted catalysts ACS Sustain. Chem. Eng. 6 2018 16332 16340 10.1021/acssuschemeng.8b03330 C.P. Ferraz, M. Zieliński, M. Pietrowski, S. Heyte, F. Dumeignil, L.M. Rossi, R. Wojcieszak, Influence of support basic sites in green oxidation of biobased substrates using au-promoted catalysts, ACS Sustain. Chem. Eng. 6 (2018) 16332–16340, 10.1021/acssuschemeng.8b03330. [9] M. Douthwaite X. Huang S. Iqbal P.J. Miedziak G.L. Brett S.A. Kondrat J.K. Edwards M. Sankar D.W. Knight D. Bethell G.J. Hutchings The controlled catalytic oxidation of furfural to furoic acid using AuPd/Mg(OH)2 Catal. Sci. Technol. 7 2017 5284 5293 10.1039/C7CY01025G M. Douthwaite, X. Huang, S. Iqbal, P.J. Miedziak, G.L. Brett, S.A. Kondrat, J.K. Edwards, M. Sankar, D.W. Knight, D. Bethell, G.J. Hutchings, The controlled catalytic oxidation of furfural to furoic acid using AuPd/Mg(OH)2, Catal. Sci. Technol. 7 (2017) 5284–5293, 10.1039/C7CY01025G. [10] C.P. Ferraz S. Navarro-Jaén L.M. Rossi F. Dumeignil M.N. Ghazzal R. Wojcieszak Enhancing the activity of gold supported catalysts by oxide coating: towards efficient oxidations Green Chem. 23 2021 8453 8457 10.1039/D1GC02889H C.P. Ferraz, S. Navarro-Jaén, L.M. Rossi, F. Dumeignil, M.N. Ghazzal, R. Wojcieszak, Enhancing the activity of gold supported catalysts by oxide coating: towards efficient oxidations, Green Chem. 23 (2021) 8453–8457, 10.1039/D1GC02889H. [11] G. Papanikolaou P. Lanzafame S. Perathoner G. Centi D. Cozza G. Giorgianni M. Migliori G. Giordano High performance of Au/ZTC based catalysts for the selective oxidation of bio-derivative furfural to 2-furoic acid11This paper in honor of Professor James G. Goodwin, Jr., in the occasion of his 75th birthday, to celebrate his outstanding contribution to catalysis sciences and technology Catal. Commun. 149 2021 106234 10.1016/j.catcom.2020.106234 G. Papanikolaou, P. Lanzafame, S. Perathoner, G. Centi, D. Cozza, G. Giorgianni, M. Migliori, G. Giordano, High performance of Au/ZTC based catalysts for the selective oxidation of bio-derivative furfural to 2-furoic acid11This paper in honor of Professor James G. Goodwin, Jr., in the occasion of his 75th birthday, to celebrate his outstanding contribution to catalysis sciences and technology, Catal. Commun. 149 (2021) 106234, 10.1016/j.catcom.2020.106234. [12] S. Daniel V.P. Subbiah B. Ramaganthan R. Kanthapazham R. Vanaraj Upgrading the strategy of multistage torrefaction liquid by the selective oxidation reaction route using a reusable MgO-based Au/Al2O3 catalyst Energy Fuel 35 2021 15831 15841 10.1021/acs.energyfuels.1c02362 S. Daniel, V.P. Subbiah, B. Ramaganthan, R. Kanthapazham, R. Vanaraj, Upgrading the strategy of multistage torrefaction liquid by the selective oxidation reaction route using a reusable MgO-based Au/Al2O3 catalyst, Energy Fuel 35 (2021) 15831–15841, 10.1021/acs.energyfuels.1c02362. [13] Z. Ren Y. Yang S. Wang X. Li H. Feng L. Wang Y. Li X. Zhang M. Wei Pt atomic clusters catalysts with local charge transfer towards selective oxidation of furfural Appl. Catal. B 295 2021 120290 10.1016/j.apcatb.2021.120290 Z. Ren, Y. Yang, S. Wang, X. Li, H. Feng, L. Wang, Y. Li, X. Zhang, M. Wei, Pt atomic clusters catalysts with local charge transfer towards selective oxidation of furfural, Appl. Catal. B 295 (2021) 120290, 10.1016/j.apcatb.2021.120290. [14] K. Gupta R.K. Rai A.D. Dwivedi S.K. Singh Catalytic aerial oxidation of biomass-derived furans to furan carboxylic acids in water over bimetallic nickel–palladium alloy nanoparticles ChemCatChem 9 2017 2760 2767 10.1002/cctc.201600942 K. Gupta, R.K. Rai, A.D. Dwivedi, S.K. Singh, Catalytic aerial oxidation of biomass-derived furans to furan carboxylic acids in water over bimetallic nickel–palladium alloy nanoparticles, ChemCatChem 9 (2017) 2760–2767, 10.1002/cctc.201600942. [15] H.K. Al Rawas C.P. Ferraz J. Thuriot-Roukos S. Heyte S. Paul R. Wojcieszak Influence of Pd and Pt promotion in gold based bimetallic catalysts on selectivity modulation in furfural base-free oxidation Catalysts 11 2021 10.3390/catal11101226 H.K. Al Rawas, C.P. Ferraz, J. Thuriot-Roukos, S. Heyte, S. Paul, R. Wojcieszak, Influence of Pd and Pt promotion in gold based bimetallic catalysts on selectivity modulation in furfural base-free oxidation, Catalysts 11 (2021), 10.3390/catal11101226. [16] Q. Tian D. Shi Y. Sha CuO and Ag2O/CuO catalyzed oxidation of aldehydes to the corresponding carboxylic acids by molecular oxygen Molecules 13 2008 10.3390/molecules13040948 Q. Tian, D. Shi, Y. Sha, CuO and Ag2O/CuO catalyzed oxidation of aldehydes to the corresponding carboxylic acids by molecular oxygen, Molecules 13 (2008), 10.3390/molecules13040948. [17] H. Zhou H. Xu X. Wang Y. Liu Convergent production of 2,5-furandicarboxylic acid from biomass and CO2 Green Chem. 21 2019 2923 2927 10.1039/C9GC00869A H. Zhou, H. Xu, X. Wang, Y. Liu, Convergent production of 2,5-furandicarboxylic acid from biomass and CO2, Green Chem. 21 (2019) 2923–2927, 10.1039/C9GC00869A. [18] P. Verdeguer N. Merat A. Gaset Lead/platinum on charcoal as catalyst for oxidation of furfural. Effect of main parameters Appl. Catal. A 112 1994 10.1016/0926-860X(94)80133-9 1-11 P. Verdeguer, N. Merat, A. Gaset, Lead/platinum on charcoal as catalyst for oxidation of furfural. Effect of main parameters, Appl. Catal. A 112 (1994) 1-11, 10.1016/0926-860X(94)80133-9. [19] J. Wang J. Li C. Jiang P. Zhou P. Zhang J. Yu The effect of manganese vacancy in birnessite-type MnO2 on room-temperature oxidation of formaldehyde in air Appl. Catal. B 204 2017 147 155 10.1016/j.apcatb.2016.11.036 J. Wang, J. Li, C. Jiang, P. Zhou, P. Zhang, J. Yu, The effect of manganese vacancy in birnessite-type MnO2 on room-temperature oxidation of formaldehyde in air, Appl. Catal. B 204 (2017) 147–155, 10.1016/j.apcatb.2016.11.036. [20] N. Xiang Y. Bai Q. Li X. Han J. Zheng Q. Zhao Y. Hou Z. Huang ZIF-67-derived hierarchical hollow Co3O4@CoMn2O4 nanocages for efficient catalytic oxidation of formaldehyde at low temperature Mole. Catal. 528 2022 112519 10.1016/j.mcat.2022.112519 N. Xiang, Y. Bai, Q. Li, X. Han, J. Zheng, Q. Zhao, Y. Hou, Z. Huang, ZIF-67-derived hierarchical hollow Co3O4@CoMn2O4 nanocages for efficient catalytic oxidation of formaldehyde at low temperature, Mole. Catal. 528 (2022) 112519, 10.1016/j.mcat.2022.112519. [21] D. Zhu Y. Huang J.J. Cao S.C. Lee M. Chen Z. Shen Cobalt nanoparticles encapsulated in porous nitrogen-doped carbon: oxygen activation and efficient catalytic removal of formaldehyde at room temperature Appl. Catal. B 258 2019 117981 10.1016/j.apcatb.2019.117981 D. Zhu, Y. Huang, J.J. Cao, S.C. Lee, M. Chen, Z. Shen, Cobalt nanoparticles encapsulated in porous nitrogen-doped carbon: oxygen activation and efficient catalytic removal of formaldehyde at room temperature, Appl. Catal. B 258 (2019) 117981, 10.1016/j.apcatb.2019.117981. [22] H. Wang D. Xu E. Guan L. Wang J. Zhang C. Wang S. Wang H. Xu X. Meng B. Yang B.C. Gates F..S. Xiao Atomically dispersed Ru on manganese oxide catalyst boosts oxidative cyanation ACS Catal 10 2020 6299 6308 10.1021/acscatal.0c00485 H. Wang, D. Xu, E. Guan, L. Wang, J. Zhang, C. Wang, S. Wang, H. Xu, X. Meng, B. Yang, B.C. Gates, F..S. Xiao, Atomically dispersed Ru on manganese oxide catalyst boosts oxidative cyanation, ACS Catal 10 (2020) 6299–6308, 10.1021/acscatal.0c00485. [23] K. Yamaguchi J.W. Kim J. He N. Mizuno Aerobic alcohol oxidation catalyzed by supported ruthenium hydroxides J Catal 268 2009 343 349 10.1016/j.jcat.2009.10.004 K. Yamaguchi, J.W. Kim, J. He, N. Mizuno, Aerobic alcohol oxidation catalyzed by supported ruthenium hydroxides, J Catal 268 (2009) 343–349, 10.1016/j.jcat.2009.10.004. [24] K.Z. Gaca-Zając B.R. Smith A. Nordon A.J. Fletcher K. Johnston J. Sefcik Investigation of IR and Raman spectra of species present in formaldehyde-water-methanol systems Vib Spectrosc 97 2018 44 54 10.1016/j.vibspec.2018.05.001 K.Z. Gaca-Zając, B.R. Smith, A. Nordon, A.J. Fletcher, K. Johnston, J. Sefcik, Investigation of IR and Raman spectra of species present in formaldehyde-water-methanol systems, Vib Spectrosc 97 (2018) 44–54, 10.1016/j.vibspec.2018.05.001. [25] H..Y. Jian C..T. Yang L..K. Chu Gaseous infrared spectra of the simplest geminal diol CH2(OH)2 and the isotopic analogues in the hydration of formaldehyde Phys. Chem. Chem. Phys. 23 2021 14699 14705 10.1039/D1CP01354H H..Y. Jian, C..T. Yang, L..K. Chu, Gaseous infrared spectra of the simplest geminal diol CH2(OH)2 and the isotopic analogues in the hydration of formaldehyde, Phys. Chem. Chem. Phys. 23 (2021) 14699–14705, 10.1039/D1CP01354H. [26] D.S. Yang M.K. Wang Syntheses and characterization of well-crystallized birnessite Chem. Mater. 13 2001 2589 2594 10.1021/cm010010e D.S. Yang, M.K. Wang, Syntheses and characterization of well-crystallized birnessite, Chem. Mater. 13 (2001) 2589–2594, 10.1021/cm010010e. [27] X. Yang Y. Makita Z.h. Liu K. Sakane K. Ooi Structural characterization of self-assembled MnO2 nanosheets from birnessite manganese oxide single crystals Chem. Mater. 16 2004 5581 5588 10.1021/cm049025d X. Yang, Y. Makita, Z.h. Liu, K. Sakane, K. Ooi, Structural characterization of self-assembled MnO2 nanosheets from birnessite manganese oxide single crystals, Chem. Mater. 16 (2004) 5581–5588, 10.1021/cm049025d. [28] W. Li X. Wen X. Wang J. Li E. Ren Z. Shi C. Liu D. Mo S. Mo Oriented growth of δ-MnO2 nanosheets over core-shell Mn2O3@δ-MnO2 catalysts: an interface-engineered effects for enhanced low-temperature methanol oxidation Mole. Catal. 514 2021 111847 10.1016/j.mcat.2021.111847 W. Li, X. Wen, X. Wang, J. Li, E. Ren, Z. Shi, C. Liu, D. Mo, S. Mo, Oriented growth of δ-MnO2 nanosheets over core-shell Mn2O3@δ-MnO2 catalysts: an interface-engineered effects for enhanced low-temperature methanol oxidation, Mole. Catal. 514 (2021) 111847, 10.1016/j.mcat.2021.111847. [29] T.A. Gokhale V.V. Phatake B.M. Bhanage MnO2 nanostructures as sustainable catalysts for selectivity tuning and syntheses of amine coupling products with bio-derived glycerol Mole. Catal. 533 2022 112771 10.1016/j.mcat.2022.112771 T.A. Gokhale, V.V. Phatake, B.M. Bhanage, MnO2 nanostructures as sustainable catalysts for selectivity tuning and syntheses of amine coupling products with bio-derived glycerol, Mole. Catal. 533 (2022) 112771, 10.1016/j.mcat.2022.112771. [30] X. Zhang L. Ren L. Sun Z. Huo B. Tan N. Feng H. Wan G. Guan Fe-doped MnO2 as an efficient catalyst for low temperature propane oxidation Mole. Catal. 549 2023 113468 10.1016/j.mcat.2023.113468 X. Zhang, L. Ren, L. Sun, Z. Huo, B. Tan, N. Feng, H. Wan, G. Guan, Fe-doped MnO2 as an efficient catalyst for low temperature propane oxidation, Mole. Catal. 549 (2023) 113468, 10.1016/j.mcat.2023.113468. [31] S. Hosokawa H. Kanai K. Utani Y.i. Taniguchi Y. Saito S. Imamura State of Ru on CeO2 and its catalytic activity in the wet oxidation of acetic acid Appl. Catal. B 45 2003 181 187 10.1016/S0926-3373(03)00129-2 S. Hosokawa, H. Kanai, K. Utani, Y.i. Taniguchi, Y. Saito, S. Imamura, State of Ru on CeO2 and its catalytic activity in the wet oxidation of acetic acid, Appl. Catal. B 45 (2003) 181–187, 10.1016/S0926-3373(03)00129-2. [32] Q. Dai S. Bai Z. Wang X. Wang G. Lu Catalytic combustion of chlorobenzene over Ru-doped ceria catalysts Appl. Catal. B 126 2012 64 75 10.1016/j.apcatb.2012.07.008 Q. Dai, S. Bai, Z. Wang, X. Wang, G. Lu, Catalytic combustion of chlorobenzene over Ru-doped ceria catalysts, Appl. Catal. B 126 (2012) 64–75, 10.1016/j.apcatb.2012.07.008. [33] H. Huang Q. Dai X. Wang Morphology effect of Ru/CeO2 catalysts for the catalytic combustion of chlorobenzene Appl. Catal. B 158-159 2014 96 105 10.1016/j.apcatb.2014.01.062 H. Huang, Q. Dai, X. Wang, Morphology effect of Ru/CeO2 catalysts for the catalytic combustion of chlorobenzene, Appl. Catal. B 158-159 (2014) 96–105, 10.1016/j.apcatb.2014.01.062. [34] J. An Y. Wang J. Lu J. Zhang Z. Zhang S. Xu X. Liu T. Zhang M. Gocyla M. Heggen R.E. Dunin-Borkowski P. Fornasiero F. Wang Acid-promoter-free ethylene methoxycarbonylation over Ru-clusters/ceria: the catalysis of interfacial lewis acid–base pair J. Am. Chem. Soc. 140 2018 4172 4181 10.1021/jacs.8b01742 J. An, Y. Wang, J. Lu, J. Zhang, Z. Zhang, S. Xu, X. Liu, T. Zhang, M. Gocyla, M. Heggen, R.E. Dunin-Borkowski, P. Fornasiero, F. Wang, Acid-promoter-free ethylene methoxycarbonylation over Ru-clusters/ceria: the catalysis of interfacial lewis acid–base pair, J. Am. Chem. Soc. 140 (2018) 4172–4181, 10.1021/jacs.8b01742. [35] L. Zhu J. Wang S. Rong H. Wang P. Zhang Cerium modified birnessite-type MnO2 for gaseous formaldehyde oxidation at low temperature Appl. Catal. B 211 2017 212 221 10.1016/j.apcatb.2017.04.025 L. Zhu, J. Wang, S. Rong, H. Wang, P. Zhang, Cerium modified birnessite-type MnO2 for gaseous formaldehyde oxidation at low temperature, Appl. Catal. B 211 (2017) 212–221, 10.1016/j.apcatb.2017.04.025. [36] X. Liu J. Mi L. Shi H. Liu J. Liu Y. Ding J. Shi M. He Z. Wang S. Xiong Q. Zhang Y. Liu Z..S. Wu J. Chen J. Li In situ modulation of A-site vacancies in LaMnO3.15 perovskite for surface lattice oxygen activation and boosted redox reactions Angew. Chem. Int. Ed. 2021 10.1002/anie.202111610 X. Liu, J. Mi, L. Shi, H. Liu, J. Liu, Y. Ding, J. Shi, M. He, Z. Wang, S. Xiong, Q. Zhang, Y. Liu, Z..S. Wu, J. Chen, J. Li, In situ modulation of A-site vacancies in LaMnO3.15 perovskite for surface lattice oxygen activation and boosted redox reactions, Angew. Chem. Int. Ed., (2021), 10.1002/anie.202111610. [37] T. Xu P. Zhang H. Zhang Ultrathin δ-MnO2 nanoribbons for highly efficient removal of a human-related low threshold odorant - acetic acid Appl. Catal. B 309 2022 121273 10.1016/j.apcatb.2022.121273 T. Xu, P. Zhang, H. Zhang, Ultrathin δ-MnO2 nanoribbons for highly efficient removal of a human-related low threshold odorant - acetic acid, Appl. Catal. B 309 (2022) 121273, 10.1016/j.apcatb.2022.121273. [38] D. Chen G. Zhang M. Wang N. Li Q. Xu H. Li J. He J. Lu Pt/MnO2 nanoflowers anchored to boron nitride aerogels for highly efficient enrichment and catalytic oxidation of formaldehyde at room temperature Angew. Chem. Int. Ed. 60 2021 6377 6381 10.1002/anie.202013667 D. Chen, G. Zhang, M. Wang, N. Li, Q. Xu, H. Li, J. He, J. Lu, Pt/MnO2 nanoflowers anchored to boron nitride aerogels for highly efficient enrichment and catalytic oxidation of formaldehyde at room temperature, Angew. Chem. Int. Ed. 60 (2021) 6377–6381, 10.1002/anie.202013667. [39] H. Gu X. Liu X. Liu C. Ling K. Wei G. Zhan Y. Guo L. Zhang Adjacent single-atom irons boosting molecular oxygen activation on MnO2 Nat. Commun. 12 2021 5422 10.1038/s41467-021-25726-w H. Gu, X. Liu, X. Liu, C. Ling, K. Wei, G. Zhan, Y. Guo, L. Zhang, Adjacent single-atom irons boosting molecular oxygen activation on MnO2, Nat. Commun. 12 (2021) 5422, 10.1038/s41467-021-25726-w. [40] X. Li Y. Wang D. Chen N. Li Q. Xu H. Li J. He J. Lu A highly dispersed Pt/copper modified-MnO2 catalyst for the complete oxidation of volatile organic compounds: the effect of oxygen species on the catalytic mechanism Green Energy Environ. 2021 10.1016/j.gee.2021.07.004 X. Li, Y. Wang, D. Chen, N. Li, Q. Xu, H. Li, J. He, J. Lu, A highly dispersed Pt/copper modified-MnO2 catalyst for the complete oxidation of volatile organic compounds: the effect of oxygen species on the catalytic mechanism, Green Energy Environ. (2021), 10.1016/j.gee.2021.07.004.",
      "scopus-id": "85174743920",
      "coredata": {
        "eid": "1-s2.0-S2468823123006879",
        "dc:description": "δ-MnO2 exhibits excellent activity for furfural oxidation to furoic acid under base-free conditions. However, its poor CH bond breaking capacity leads to lower conversion efficiency per unit mass catalyst than noble metal. Thus, a series of Ru-modified δ-MnO2 (Rux/δ-MnO2) have been made to enhance its CH bond breaking ability. The result showed that the furfural conversion was greatly enhanced on Rux/δ-MnO2 due to the enhanced capability for breaking the CH bond. Especially for Ru0.25/δ-MnO2, whose conversion rate per unit mass was 18 times higher than δ-MnO2. The characterization results showed that the Ru species mainly existed as single atoms or clusters on Ru0.25/δ-MnO2 and Ru0.5/δ-MnO2, while started to aggregate to RuO2 nanoparticles on Ru1/δ-MnO2 and Ru2/δ-MnO2. With the increase of Ru particles, the Ru's average oxidation state (AOS) decreased from +6 on Ru0.25/δ-MnO2 to +4.74 on Ru2/δ-MnO2. The Ru's TOF (intrinsic activity per Ru) was positively linearly related to the Ru's AOS. The electron-deficient Ru in Ru0.25/δ-MnO2 can strongly adsorb the H atom of the CH of geminal diol intermediate and accelerate the breakage of its CH bond. As a result, Ru in the Ru0.25/δ-MnO2 exhibited the highest TOF, which can even reach 29.85 mmolFF/mmolRu/h.",
        "openArchiveArticle": "false",
        "prism:coverDate": "2023-12-31",
        "openaccessUserLicense": null,
        "prism:aggregationType": "Journal",
        "prism:url": "https://api.elsevier.com/content/article/pii/S2468823123006879",
        "dc:creator": [
          {
            "@_fa": "true",
            "$": "Wu, Xu"
          },
          {
            "@_fa": "true",
            "$": "Guo, Heqin"
          },
          {
            "@_fa": "true",
            "$": "Jia, Litao"
          },
          {
            "@_fa": "true",
            "$": "Xiao, Yong"
          },
          {
            "@_fa": "true",
            "$": "Hou, Bo"
          },
          {
            "@_fa": "true",
            "$": "Gao, Yongxiang"
          },
          {
            "@_fa": "true",
            "$": "Li, Debao"
          }
        ],
        "link": [
          {
            "@_fa": "true",
            "@rel": "self",
            "@href": "https://api.elsevier.com/content/article/pii/S2468823123006879"
          },
          {
            "@_fa": "true",
            "@rel": "scidir",
            "@href": "https://www.sciencedirect.com/science/article/pii/S2468823123006879"
          }
        ],
        "dc:format": "application/json",
        "openaccessType": null,
        "pii": "S2468-8231(23)00687-9",
        "prism:volume": "551",
        "articleNumber": "113604",
        "prism:publisher": "Elsevier B.V.",
        "dc:title": "Enhancement of Ru on furoic acid synthesis from furfural oxidation over Rux/δ-MnO2 catalysts",
        "prism:copyright": "© 2023 Elsevier B.V. All rights reserved.",
        "openaccess": "0",
        "prism:issn": "24688231",
        "dcterms:subject": [
          {
            "@_fa": "true",
            "$": "Base-free"
          },
          {
            "@_fa": "true",
            "$": "Ru/δ-MnO2"
          },
          {
            "@_fa": "true",
            "$": "C–H bond breaking"
          },
          {
            "@_fa": "true",
            "$": "Furfural oxidation to furoic acid"
          }
        ],
        "openaccessArticle": "false",
        "prism:publicationName": "Molecular Catalysis",
        "openaccessSponsorType": null,
        "prism:pageRange": "113604",
        "pubType": "fla",
        "prism:coverDisplayDate": "December 2023",
        "prism:doi": "10.1016/j.mcat.2023.113604",
        "prism:startingPage": "113604",
        "dc:identifier": "doi:10.1016/j.mcat.2023.113604",
        "openaccessSponsorName": null
      },
      "objects": {
        "object": [
          {
            "@category": "standard",
            "@height": "325",
            "@width": "694",
            "@_fa": "true",
            "$": "https://api.elsevier.com/content/object/eid/1-s2.0-S2468823123006879-gr9.jpg?httpAccept=%2A%2F%2A",
            "@multimediatype": "JPEG image file",
            "@type": "IMAGE-DOWNSAMPLED",
            "@size": "53845",
            "@ref": "gr9",
            "@mimetype": "image/jpeg"
          },
          {
            "@category": "standard",
            "@height": "355",
            "@width": "698",
            "@_fa": "true",
            "$": "https://api.elsevier.com/content/object/eid/1-s2.0-S2468823123006879-gr2.jpg?httpAccept=%2A%2F%2A",
            "@multimediatype": "JPEG image file",
            "@type": "IMAGE-DOWNSAMPLED",
            "@size": "72436",
            "@ref": "gr2",
            "@mimetype": "image/jpeg"
          },
          {
            "@category": "standard",
            "@height": "333",
            "@width": "698",
            "@_fa": "true",
            "$": "https://api.elsevier.com/content/object/eid/1-s2.0-S2468823123006879-gr7.jpg?httpAccept=%2A%2F%2A",
            "@multimediatype": "JPEG image file",
            "@type": "IMAGE-DOWNSAMPLED",
            "@size": "63568",
            "@ref": "gr7",
            "@mimetype": "image/jpeg"
          },
          {
            "@category": "standard",
            "@height": "200",
            "@width": "258",
            "@_fa": "true",
            "$": "https://api.elsevier.com/content/object/eid/1-s2.0-S2468823123006879-ga1.jpg?httpAccept=%2A%2F%2A",
            "@multimediatype": "JPEG image file",
            "@type": "IMAGE-DOWNSAMPLED",
            "@size": "29386",
            "@ref": "ga1",
            "@mimetype": "image/jpeg"
          },
          {
            "@category": "standard",
            "@height": "351",
            "@width": "701",
            "@_fa": "true",
            "$": "https://api.elsevier.com/content/object/eid/1-s2.0-S2468823123006879-gr4.jpg?httpAccept=%2A%2F%2A",
            "@multimediatype": "JPEG image file",
            "@type": "IMAGE-DOWNSAMPLED",
            "@size": "66472",
            "@ref": "gr4",
            "@mimetype": "image/jpeg"
          },
          {
            "@category": "standard",
            "@height": "432",
            "@width": "702",
            "@_fa": "true",
            "$": "https://api.elsevier.com/content/object/eid/1-s2.0-S2468823123006879-gr3.jpg?httpAccept=%2A%2F%2A",
            "@multimediatype": "JPEG image file",
            "@type": "IMAGE-DOWNSAMPLED",
            "@size": "64277",
            "@ref": "gr3",
            "@mimetype": "image/jpeg"
          },
          {
            "@category": "standard",
            "@height": "310",
            "@width": "701",
            "@_fa": "true",
            "$": "https://api.elsevier.com/content/object/eid/1-s2.0-S2468823123006879-gr1.jpg?httpAccept=%2A%2F%2A",
            "@multimediatype": "JPEG image file",
            "@type": "IMAGE-DOWNSAMPLED",
            "@size": "54120",
            "@ref": "gr1",
            "@mimetype": "image/jpeg"
          },
          {
            "@category": "standard",
            "@height": "331",
            "@width": "698",
            "@_fa": "true",
            "$": "https://api.elsevier.com/content/object/eid/1-s2.0-S2468823123006879-gr8.jpg?httpAccept=%2A%2F%2A",
            "@multimediatype": "JPEG image file",
            "@type": "IMAGE-DOWNSAMPLED",
            "@size": "80633",
            "@ref": "gr8",
            "@mimetype": "image/jpeg"
          },
          {
            "@category": "standard",
            "@height": "487",
            "@width": "703",
            "@_fa": "true",
            "$": "https://api.elsevier.com/content/object/eid/1-s2.0-S2468823123006879-gr5.jpg?httpAccept=%2A%2F%2A",
            "@multimediatype": "JPEG image file",
            "@type": "IMAGE-DOWNSAMPLED",
            "@size": "89357",
            "@ref": "gr5",
            "@mimetype": "image/jpeg"
          },
          {
            "@category": "standard",
            "@height": "341",
            "@width": "342",
            "@_fa": "true",
            "$": "https://api.elsevier.com/content/object/eid/1-s2.0-S2468823123006879-gr12.jpg?httpAccept=%2A%2F%2A",
            "@multimediatype": "JPEG image file",
            "@type": "IMAGE-DOWNSAMPLED",
            "@size": "19004",
            "@ref": "gr12",
            "@mimetype": "image/jpeg"
          },
          {
            "@category": "standard",
            "@height": "379",
            "@width": "502",
            "@_fa": "true",
            "$": "https://api.elsevier.com/content/object/eid/1-s2.0-S2468823123006879-gr10.jpg?httpAccept=%2A%2F%2A",
            "@multimediatype": "JPEG image file",
            "@type": "IMAGE-DOWNSAMPLED",
            "@size": "84580",
            "@ref": "gr10",
            "@mimetype": "image/jpeg"
          },
          {
            "@category": "standard",
            "@height": "153",
            "@width": "712",
            "@_fa": "true",
            "$": "https://api.elsevier.com/content/object/eid/1-s2.0-S2468823123006879-gr11.jpg?httpAccept=%2A%2F%2A",
            "@multimediatype": "JPEG image file",
            "@type": "IMAGE-DOWNSAMPLED",
            "@size": "36463",
            "@ref": "gr11",
            "@mimetype": "image/jpeg"
          },
          {
            "@category": "standard",
            "@height": "333",
            "@width": "712",
            "@_fa": "true",
            "$": "https://api.elsevier.com/content/object/eid/1-s2.0-S2468823123006879-gr6.jpg?httpAccept=%2A%2F%2A",
            "@multimediatype": "JPEG image file",
            "@type": "IMAGE-DOWNSAMPLED",
            "@size": "57336",
            "@ref": "gr6",
            "@mimetype": "image/jpeg"
          },
          {
            "@category": "thumbnail",
            "@height": "103",
            "@width": "219",
            "@_fa": "true",
            "$": "https://api.elsevier.com/content/object/eid/1-s2.0-S2468823123006879-gr9.sml?httpAccept=%2A%2F%2A",
            "@multimediatype": "GIF image file",
            "@type": "IMAGE-THUMBNAIL",
            "@size": "9105",
            "@ref": "gr9",
            "@mimetype": "image/gif"
          },
          {
            "@category": "thumbnail",
            "@height": "111",
            "@width": "219",
            "@_fa": "true",
            "$": "https://api.elsevier.com/content/object/eid/1-s2.0-S2468823123006879-gr2.sml?httpAccept=%2A%2F%2A",
            "@multimediatype": "GIF image file",
            "@type": "IMAGE-THUMBNAIL",
            "@size": "10586",
            "@ref": "gr2",
            "@mimetype": "image/gif"
          },
          {
            "@category": "thumbnail",
            "@height": "105",
            "@width": "219",
            "@_fa": "true",
            "$": "https://api.elsevier.com/content/object/eid/1-s2.0-S2468823123006879-gr7.sml?httpAccept=%2A%2F%2A",
            "@multimediatype": "GIF image file",
            "@type": "IMAGE-THUMBNAIL",
            "@size": "10806",
            "@ref": "gr7",
            "@mimetype": "image/gif"
          },
          {
            "@category": "thumbnail",
            "@height": "164",
            "@width": "212",
            "@_fa": "true",
            "$": "https://api.elsevier.com/content/object/eid/1-s2.0-S2468823123006879-ga1.sml?httpAccept=%2A%2F%2A",
            "@multimediatype": "GIF image file",
            "@type": "IMAGE-THUMBNAIL",
            "@size": "22072",
            "@ref": "ga1",
            "@mimetype": "image/gif"
          },
          {
            "@category": "thumbnail",
            "@height": "110",
            "@width": "219",
            "@_fa": "true",
            "$": "https://api.elsevier.com/content/object/eid/1-s2.0-S2468823123006879-gr4.sml?httpAccept=%2A%2F%2A",
            "@multimediatype": "GIF image file",
            "@type": "IMAGE-THUMBNAIL",
            "@size": "10350",
            "@ref": "gr4",
            "@mimetype": "image/gif"
          },
          {
            "@category": "thumbnail",
            "@height": "135",
            "@width": "219",
            "@_fa": "true",
            "$": "https://api.elsevier.com/content/object/eid/1-s2.0-S2468823123006879-gr3.sml?httpAccept=%2A%2F%2A",
            "@multimediatype": "GIF image file",
            "@type": "IMAGE-THUMBNAIL",
            "@size": "8755",
            "@ref": "gr3",
            "@mimetype": "image/gif"
          },
          {
            "@category": "thumbnail",
            "@height": "97",
            "@width": "219",
            "@_fa": "true",
            "$": "https://api.elsevier.com/content/object/eid/1-s2.0-S2468823123006879-gr1.sml?httpAccept=%2A%2F%2A",
            "@multimediatype": "GIF image file",
            "@type": "IMAGE-THUMBNAIL",
            "@size": "9102",
            "@ref": "gr1",
            "@mimetype": "image/gif"
          },
          {
            "@category": "thumbnail",
            "@height": "104",
            "@width": "219",
            "@_fa": "true",
            "$": "https://api.elsevier.com/content/object/eid/1-s2.0-S2468823123006879-gr8.sml?httpAccept=%2A%2F%2A",
            "@multimediatype": "GIF image file",
            "@type": "IMAGE-THUMBNAIL",
            "@size": "12190",
            "@ref": "gr8",
            "@mimetype": "image/gif"
          },
          {
            "@category": "thumbnail",
            "@height": "152",
            "@width": "219",
            "@_fa": "true",
            "$": "https://api.elsevier.com/content/object/eid/1-s2.0-S2468823123006879-gr5.sml?httpAccept=%2A%2F%2A",
            "@multimediatype": "GIF image file",
            "@type": "IMAGE-THUMBNAIL",
            "@size": "23442",
            "@ref": "gr5",
            "@mimetype": "image/gif"
          },
          {
            "@category": "thumbnail",
            "@height": "164",
            "@width": "164",
            "@_fa": "true",
            "$": "https://api.elsevier.com/content/object/eid/1-s2.0-S2468823123006879-gr12.sml?httpAccept=%2A%2F%2A",
            "@multimediatype": "GIF image file",
            "@type": "IMAGE-THUMBNAIL",
            "@size": "6464",
            "@ref": "gr12",
            "@mimetype": "image/gif"
          },
          {
            "@category": "thumbnail",
            "@height": "164",
            "@width": "217",
            "@_fa": "true",
            "$": "https://api.elsevier.com/content/object/eid/1-s2.0-S2468823123006879-gr10.sml?httpAccept=%2A%2F%2A",
            "@multimediatype": "GIF image file",
            "@type": "IMAGE-THUMBNAIL",
            "@size": "25180",
            "@ref": "gr10",
            "@mimetype": "image/gif"
          },
          {
            "@category": "thumbnail",
            "@height": "47",
            "@width": "219",
            "@_fa": "true",
            "$": "https://api.elsevier.com/content/object/eid/1-s2.0-S2468823123006879-gr11.sml?httpAccept=%2A%2F%2A",
            "@multimediatype": "GIF image file",
            "@type": "IMAGE-THUMBNAIL",
            "@size": "8476",
            "@ref": "gr11",
            "@mimetype": "image/gif"
          },
          {
            "@category": "thumbnail",
            "@height": "102",
            "@width": "219",
            "@_fa": "true",
            "$": "https://api.elsevier.com/content/object/eid/1-s2.0-S2468823123006879-gr6.sml?httpAccept=%2A%2F%2A",
            "@multimediatype": "GIF image file",
            "@type": "IMAGE-THUMBNAIL",
            "@size": "9414",
            "@ref": "gr6",
            "@mimetype": "image/gif"
          },
          {
            "@category": "high",
            "@height": "1441",
            "@width": "3075",
            "@_fa": "true",
            "$": "https://api.elsevier.com/content/object/eid/1-s2.0-S2468823123006879-gr9_lrg.jpg?httpAccept=%2A%2F%2A",
            "@multimediatype": "JPEG image file",
            "@type": "IMAGE-HIGH-RES",
            "@size": "357088",
            "@ref": "gr9",
            "@mimetype": "image/jpeg"
          },
          {
            "@category": "high",
            "@height": "1570",
            "@width": "3090",
            "@_fa": "true",
            "$": "https://api.elsevier.com/content/object/eid/1-s2.0-S2468823123006879-gr2_lrg.jpg?httpAccept=%2A%2F%2A",
            "@multimediatype": "JPEG image file",
            "@type": "IMAGE-HIGH-RES",
            "@size": "531966",
            "@ref": "gr2",
            "@mimetype": "image/jpeg"
          },
          {
            "@category": "high",
            "@height": "1475",
            "@width": "3091",
            "@_fa": "true",
            "$": "https://api.elsevier.com/content/object/eid/1-s2.0-S2468823123006879-gr7_lrg.jpg?httpAccept=%2A%2F%2A",
            "@multimediatype": "JPEG image file",
            "@type": "IMAGE-HIGH-RES",
            "@size": "548867",
            "@ref": "gr7",
            "@mimetype": "image/jpeg"
          },
          {
            "@category": "high",
            "@height": "886",
            "@width": "1145",
            "@_fa": "true",
            "$": "https://api.elsevier.com/content/object/eid/1-s2.0-S2468823123006879-ga1_lrg.jpg?httpAccept=%2A%2F%2A",
            "@multimediatype": "JPEG image file",
            "@type": "IMAGE-HIGH-RES",
            "@size": "225043",
            "@ref": "ga1",
            "@mimetype": "image/jpeg"
          },
          {
            "@category": "high",
            "@height": "1552",
            "@width": "3104",
            "@_fa": "true",
            "$": "https://api.elsevier.com/content/object/eid/1-s2.0-S2468823123006879-gr4_lrg.jpg?httpAccept=%2A%2F%2A",
            "@multimediatype": "JPEG image file",
            "@type": "IMAGE-HIGH-RES",
            "@size": "536275",
            "@ref": "gr4",
            "@mimetype": "image/jpeg"
          },
          {
            "@category": "high",
            "@height": "1914",
            "@width": "3108",
            "@_fa": "true",
            "$": "https://api.elsevier.com/content/object/eid/1-s2.0-S2468823123006879-gr3_lrg.jpg?httpAccept=%2A%2F%2A",
            "@multimediatype": "JPEG image file",
            "@type": "IMAGE-HIGH-RES",
            "@size": "477763",
            "@ref": "gr3",
            "@mimetype": "image/jpeg"
          },
          {
            "@category": "high",
            "@height": "1371",
            "@width": "3102",
            "@_fa": "true",
            "$": "https://api.elsevier.com/content/object/eid/1-s2.0-S2468823123006879-gr1_lrg.jpg?httpAccept=%2A%2F%2A",
            "@multimediatype": "JPEG image file",
            "@type": "IMAGE-HIGH-RES",
            "@size": "399551",
            "@ref": "gr1",
            "@mimetype": "image/jpeg"
          },
          {
            "@category": "high",
            "@height": "1468",
            "@width": "3092",
            "@_fa": "true",
            "$": "https://api.elsevier.com/content/object/eid/1-s2.0-S2468823123006879-gr8_lrg.jpg?httpAccept=%2A%2F%2A",
            "@multimediatype": "JPEG image file",
            "@type": "IMAGE-HIGH-RES",
            "@size": "614635",
            "@ref": "gr8",
            "@mimetype": "image/jpeg"
          },
          {
            "@category": "high",
            "@height": "2157",
            "@width": "3115",
            "@_fa": "true",
            "$": "https://api.elsevier.com/content/object/eid/1-s2.0-S2468823123006879-gr5_lrg.jpg?httpAccept=%2A%2F%2A",
            "@multimediatype": "JPEG image file",
            "@type": "IMAGE-HIGH-RES",
            "@size": "949373",
            "@ref": "gr5",
            "@mimetype": "image/jpeg"
          },
          {
            "@category": "high",
            "@height": "1511",
            "@width": "1515",
            "@_fa": "true",
            "$": "https://api.elsevier.com/content/object/eid/1-s2.0-S2468823123006879-gr12_lrg.jpg?httpAccept=%2A%2F%2A",
            "@multimediatype": "JPEG image file",
            "@type": "IMAGE-HIGH-RES",
            "@size": "126704",
            "@ref": "gr12",
            "@mimetype": "image/jpeg"
          },
          {
            "@category": "high",
            "@height": "1682",
            "@width": "2225",
            "@_fa": "true",
            "$": "https://api.elsevier.com/content/object/eid/1-s2.0-S2468823123006879-gr10_lrg.jpg?httpAccept=%2A%2F%2A",
            "@multimediatype": "JPEG image file",
            "@type": "IMAGE-HIGH-RES",
            "@size": "822842",
            "@ref": "gr10",
            "@mimetype": "image/jpeg"
          },
          {
            "@category": "high",
            "@height": "678",
            "@width": "3152",
            "@_fa": "true",
            "$": "https://api.elsevier.com/content/object/eid/1-s2.0-S2468823123006879-gr11_lrg.jpg?httpAccept=%2A%2F%2A",
            "@multimediatype": "JPEG image file",
            "@type": "IMAGE-HIGH-RES",
            "@size": "294821",
            "@ref": "gr11",
            "@mimetype": "image/jpeg"
          },
          {
            "@category": "high",
            "@height": "1476",
            "@width": "3154",
            "@_fa": "true",
            "$": "https://api.elsevier.com/content/object/eid/1-s2.0-S2468823123006879-gr6_lrg.jpg?httpAccept=%2A%2F%2A",
            "@multimediatype": "JPEG image file",
            "@type": "IMAGE-HIGH-RES",
            "@size": "421382",
            "@ref": "gr6",
            "@mimetype": "image/jpeg"
          },
          {
            "@category": "standard",
            "@_fa": "true",
            "$": "https://api.elsevier.com/content/object/eid/1-s2.0-S2468823123006879-mmc1.docx?httpAccept=%2A%2F%2A",
            "@multimediatype": "Microsoft Word file",
            "@type": "APPLICATION",
            "@size": "859413",
            "@ref": "mmc1",
            "@mimetype": "application/word"
          },
          {
            "@category": "standard",
            "@_fa": "true",
            "$": "https://api.elsevier.com/content/object/eid/1-s2.0-S2468823123006879-am.pdf?httpAccept=%2A%2F%2A",
            "@multimediatype": "Acrobat PDF file",
            "@type": "AAM-PDF",
            "@size": "1387925",
            "@ref": "am",
            "@mimetype": "application/pdf"
          }
        ]
      },
      "link": {
        "@rel": "abstract",
        "@href": "https://api.elsevier.com/content/abstract/scopus_id/85174743920"
      }
    }
  }
}