{
  "metadata": {
    "title": "Recyclable Pd-contained perovskite catalyst synthesized by a low temperature hydrothermal method for aerobic alcohol oxidation",
    "authors": "; ; ",
    "journal": "Molecular Catalysis",
    "date": "2018-07-31",
    "doi": "10.1016/j.mcat.2018.04.023",
    "abstract": "",
    "uri": "https://api.elsevier.com/content/article/pii/S2468823118301652",
    "pii": "S2468823118301652"
  },
  "fulltext": {
    "full-text-retrieval-response": {
      "scopus-eid": "2-s2.0-85046790529",
      "originalText": "serial JL 315758 291210 291744 291790 291809 31 Molecular Catalysis MOLECULARCATALYSIS 2018-05-24 2018-05-24 2018-05-24 2018-05-24 2018-05-24T20:00:14 1-s2.0-S2468823118301652 S2468-8231(18)30165-2 S2468823118301652 10.1016/j.mcat.2018.04.023 S300 S300.1 FULL-TEXT 1-s2.0-S2468823118X0008X 2018-05-24T22:47:55.457235Z 0 0 20180701 20180731 2018 2018-05-24T23:03:31.577801Z absattachment articleinfo articletitlenorm authfirstinitialnorm authfirstsurnamenorm cid cids contenttype copyright crossmark dateloaded dateloadedtxt datesearch datesort dateupdated dco docsubtype doctype doi eid ewtransactionid hubeid indexeddate issn issnnorm itemstage itemtransactionid itemweight openaccess openarchive pg pgfirst pglast pii piinorm pubdateend pubdatestart pubdatetxt pubyr sectiontitle sortorder srctitle srctitlenorm srctype ssids alllist content subj subheadings suppl tomb volfirst volissue volumelist webpdf webpdfpagecount yearnav figure table e-component body acknowledge affil appendices articletitle auth authfirstini authfull authkeywords authlast grantnumber grantsponsor highlightsabst orcid primabst ref specialabst 2468-8231 24688231 true 453 453 C Volume 453 16 132 138 132 138 201807 July 2018 2018-07-01 2018-07-31 2018 Regular Papers article fla © 2018 Elsevier B.V. All rights reserved. RECYCLABLEPDCONTAINEDPEROVSKITECATALYSTSYNTHESIZEDBYALOWTEMPERATUREHYDROTHERMALMETHODFORAEROBICALCOHOLOXIDATION SAPUTRA L 1 Introduction 2 Experimental 2.1 Chemicals 2.2 Preparation of the Pd-STO perovskite 2.3 Catalyst characterization 2.4 Catalytic test 3 Results and discussion 3.1 Characterization of the Pd-STO catalysts 3.2 Catalytic test 3.2.1 Solvent screening, reaction temperature and atmosphere 3.2.2 Time profile and hot filtration test 3.2.3 Substrate scopes 3.2.4 Recyclability test 3.2.5 Plausible mechanism 4 Conclusion Acknowledgements Appendix A Supplementary data References SCREEN 2007 87 T KAKIUCHI 2001 165 N WU 2016 4749 G FOTOUHIFAR 2017 213 F TANAKA 2006 H TANAKA 2006 1071 H ZHU 2014 2917 J MISHRA 2014 57 A ROYER 2014 10292 S ZHU 2015 6370 H KIM 2010 1624 C ALBALADEJOFUENTES 2014 189 V MEFFORD 2014 726 J MEGARAJAN 2015 301 S STAYKOV 2015 8273 A NISHIHATA 2002 164 Y EYSSLER 2010 4584 A HAMADA 2011 18506 I KATZ 2011 18090 M ESSOUMHI 2014 2012 A SINGH 2007 349 U SHIRO 2013 1604 K KIMURA 2013 246 M ZHOU 2002 225 K PETROVIC 2005 133 S RODRIGUEZ 2010 173 G KUCHARCZYK 2015 1237 B TZIMPILIS 2008 607 E TZIMPILIS 2009 9 E WATANABE 2010 621 R ZHANG 2012 118 X SAY 2014 51 Z YOON 2015 71 D ZENOU 2016 90 V ADILINA 2013 146 I NIKAM 2015 104 S ATHAYDE 2016 6555 D GRABOWSKA 2016 97 E SUGIMOTO 2008 18437 T KOJIMA 2008 18445 T SUGIMOTO 2008 18760 T KOJIMA 2016 1226 T BAYLET 2011 4607 A BESSON 2014 1827 M STEINHOFF 2006 1861 B GRUNWALDT 2003 291 J GRUNWALDT 2006 25586 J JURGENSEN 2015 7848 A YI 2014 852 J KERESSZEGI 2002 244 C SAVARA 2014 3464 A SAVARA 2016 2482 A BURGI 2004 13364 T BURGI 2005 55 T MATSUMOTO 2008 196 T PARMEGGIANI 2012 547 C SAPUTRAX2018X132 SAPUTRAX2018X132X138 SAPUTRAX2018X132XL SAPUTRAX2018X132X138XL http://creativecommons.org/licenses/by-nc-nd/4.0 2020-05-24T00:00:00.000Z UnderEmbargo © 2018 Elsevier B.V. All rights reserved. item S2468-8231(18)30165-2 S2468823118301652 1-s2.0-S2468823118301652 10.1016/j.mcat.2018.04.023 315758 2018-05-24T22:03:31.577801Z 2018-07-01 2018-07-31 1-s2.0-S2468823118301652-main.pdf https://s3-eu-west-1.amazonaws.com/prod-ucs-content-store-eu-west/content/pii:S2468823118301652/MAIN/application/pdf/b3e7fa05d47c703c999f244b2bf2229e/main.pdf https://s3.amazonaws.com/prod-ucs-content-store-us-east/content/pii:S2468823118301652/MAIN/application/pdf/b3e7fa05d47c703c999f244b2bf2229e/main.pdf main.pdf pdf true 1976933 MAIN 7 1-s2.0-S2468823118301652-main_1.png https://s3-eu-west-1.amazonaws.com/prod-ucs-content-store-eu-west/content/pii:S2468823118301652/PREVIEW/image/png/937ade9f159c331c4e816ab7b25f520c/main_1.png https://s3.amazonaws.com/prod-ucs-content-store-us-east/content/pii:S2468823118301652/PREVIEW/image/png/937ade9f159c331c4e816ab7b25f520c/main_1.png main_1.png png 54491 849 656 IMAGE-WEB-PDF 1 1-s2.0-S2468823118301652-fx1.sml https://s3-eu-west-1.amazonaws.com/prod-ucs-content-store-eu-west/content/pii:S2468823118301652/fx1/THUMBNAIL/image/gif/14e3ca0409760b10ab074de122ccd753/fx1.sml https://s3.amazonaws.com/prod-ucs-content-store-us-east/content/pii:S2468823118301652/fx1/THUMBNAIL/image/gif/14e3ca0409760b10ab074de122ccd753/fx1.sml fx1 true fx1.sml sml 10702 149 219 IMAGE-THUMBNAIL 1-s2.0-S2468823118301652-fx10.sml https://s3-eu-west-1.amazonaws.com/prod-ucs-content-store-eu-west/content/pii:S2468823118301652/fx10/THUMBNAIL/image/gif/251717eddf8e70c65ab7f324b0374b83/fx10.sml https://s3.amazonaws.com/prod-ucs-content-store-us-east/content/pii:S2468823118301652/fx10/THUMBNAIL/image/gif/251717eddf8e70c65ab7f324b0374b83/fx10.sml fx10 fx10.sml sml 5457 210 216 IMAGE-THUMBNAIL 1-s2.0-S2468823118301652-fx11.sml https://s3-eu-west-1.amazonaws.com/prod-ucs-content-store-eu-west/content/pii:S2468823118301652/fx11/THUMBNAIL/image/gif/3cc557786bc05b08c9cd4f40f6fd8295/fx11.sml https://s3.amazonaws.com/prod-ucs-content-store-us-east/content/pii:S2468823118301652/fx11/THUMBNAIL/image/gif/3cc557786bc05b08c9cd4f40f6fd8295/fx11.sml fx11 fx11.sml sml 5566 123 210 IMAGE-THUMBNAIL 1-s2.0-S2468823118301652-fx12.sml https://s3-eu-west-1.amazonaws.com/prod-ucs-content-store-eu-west/content/pii:S2468823118301652/fx12/THUMBNAIL/image/gif/7461055ebba17cc8a12fcc72323a54a3/fx12.sml https://s3.amazonaws.com/prod-ucs-content-store-us-east/content/pii:S2468823118301652/fx12/THUMBNAIL/image/gif/7461055ebba17cc8a12fcc72323a54a3/fx12.sml fx12 fx12.sml sml 5087 121 179 IMAGE-THUMBNAIL 1-s2.0-S2468823118301652-fx13.sml https://s3-eu-west-1.amazonaws.com/prod-ucs-content-store-eu-west/content/pii:S2468823118301652/fx13/THUMBNAIL/image/gif/e433210974e3ad4ed3a29b1856dc15c0/fx13.sml https://s3.amazonaws.com/prod-ucs-content-store-us-east/content/pii:S2468823118301652/fx13/THUMBNAIL/image/gif/e433210974e3ad4ed3a29b1856dc15c0/fx13.sml fx13 fx13.sml sml 3557 105 219 IMAGE-THUMBNAIL 1-s2.0-S2468823118301652-fx14.sml https://s3-eu-west-1.amazonaws.com/prod-ucs-content-store-eu-west/content/pii:S2468823118301652/fx14/THUMBNAIL/image/gif/f2354832832c340e1cf261eb907458ed/fx14.sml https://s3.amazonaws.com/prod-ucs-content-store-us-east/content/pii:S2468823118301652/fx14/THUMBNAIL/image/gif/f2354832832c340e1cf261eb907458ed/fx14.sml fx14 fx14.sml sml 4072 122 219 IMAGE-THUMBNAIL 1-s2.0-S2468823118301652-fx15.sml https://s3-eu-west-1.amazonaws.com/prod-ucs-content-store-eu-west/content/pii:S2468823118301652/fx15/THUMBNAIL/image/gif/1bc6744591e63895f756e0136d1efa8a/fx15.sml https://s3.amazonaws.com/prod-ucs-content-store-us-east/content/pii:S2468823118301652/fx15/THUMBNAIL/image/gif/1bc6744591e63895f756e0136d1efa8a/fx15.sml fx15 fx15.sml sml 5125 143 219 IMAGE-THUMBNAIL 1-s2.0-S2468823118301652-fx16.sml https://s3-eu-west-1.amazonaws.com/prod-ucs-content-store-eu-west/content/pii:S2468823118301652/fx16/THUMBNAIL/image/gif/ef1e6236ada0b82c396e96ddbc9c529e/fx16.sml https://s3.amazonaws.com/prod-ucs-content-store-us-east/content/pii:S2468823118301652/fx16/THUMBNAIL/image/gif/ef1e6236ada0b82c396e96ddbc9c529e/fx16.sml fx16 fx16.sml sml 3885 162 219 IMAGE-THUMBNAIL 1-s2.0-S2468823118301652-fx17.sml https://s3-eu-west-1.amazonaws.com/prod-ucs-content-store-eu-west/content/pii:S2468823118301652/fx17/THUMBNAIL/image/gif/f63d1967f35e91dc5dc0f7955758cc3d/fx17.sml https://s3.amazonaws.com/prod-ucs-content-store-us-east/content/pii:S2468823118301652/fx17/THUMBNAIL/image/gif/f63d1967f35e91dc5dc0f7955758cc3d/fx17.sml fx17 fx17.sml sml 5113 117 208 IMAGE-THUMBNAIL 1-s2.0-S2468823118301652-fx18.sml https://s3-eu-west-1.amazonaws.com/prod-ucs-content-store-eu-west/content/pii:S2468823118301652/fx18/THUMBNAIL/image/gif/277b108b105c645f2ff33a49dc06fa58/fx18.sml https://s3.amazonaws.com/prod-ucs-content-store-us-east/content/pii:S2468823118301652/fx18/THUMBNAIL/image/gif/277b108b105c645f2ff33a49dc06fa58/fx18.sml fx18 fx18.sml sml 5021 120 185 IMAGE-THUMBNAIL 1-s2.0-S2468823118301652-fx19.sml https://s3-eu-west-1.amazonaws.com/prod-ucs-content-store-eu-west/content/pii:S2468823118301652/fx19/THUMBNAIL/image/gif/ad66a1340725a3487c592ac4b3b683ec/fx19.sml https://s3.amazonaws.com/prod-ucs-content-store-us-east/content/pii:S2468823118301652/fx19/THUMBNAIL/image/gif/ad66a1340725a3487c592ac4b3b683ec/fx19.sml fx19 fx19.sml sml 1898 52 212 IMAGE-THUMBNAIL 1-s2.0-S2468823118301652-fx2.sml https://s3-eu-west-1.amazonaws.com/prod-ucs-content-store-eu-west/content/pii:S2468823118301652/fx2/THUMBNAIL/image/gif/c9100115f2bc4ff3257a90b58f35d1ad/fx2.sml https://s3.amazonaws.com/prod-ucs-content-store-us-east/content/pii:S2468823118301652/fx2/THUMBNAIL/image/gif/c9100115f2bc4ff3257a90b58f35d1ad/fx2.sml fx2 fx2.sml sml 2965 55 219 IMAGE-THUMBNAIL 1-s2.0-S2468823118301652-fx20.sml https://s3-eu-west-1.amazonaws.com/prod-ucs-content-store-eu-west/content/pii:S2468823118301652/fx20/THUMBNAIL/image/gif/99e8e0c9b9dc08813ae67b0be24cfbe9/fx20.sml https://s3.amazonaws.com/prod-ucs-content-store-us-east/content/pii:S2468823118301652/fx20/THUMBNAIL/image/gif/99e8e0c9b9dc08813ae67b0be24cfbe9/fx20.sml fx20 fx20.sml sml 1867 59 179 IMAGE-THUMBNAIL 1-s2.0-S2468823118301652-fx21.sml https://s3-eu-west-1.amazonaws.com/prod-ucs-content-store-eu-west/content/pii:S2468823118301652/fx21/THUMBNAIL/image/gif/c307620410997026ddfdc6f82ef53d37/fx21.sml https://s3.amazonaws.com/prod-ucs-content-store-us-east/content/pii:S2468823118301652/fx21/THUMBNAIL/image/gif/c307620410997026ddfdc6f82ef53d37/fx21.sml fx21 fx21.sml sml 2956 58 219 IMAGE-THUMBNAIL 1-s2.0-S2468823118301652-fx22.sml https://s3-eu-west-1.amazonaws.com/prod-ucs-content-store-eu-west/content/pii:S2468823118301652/fx22/THUMBNAIL/image/gif/8f3004cb0f9cecccbf8586dc74069f9f/fx22.sml https://s3.amazonaws.com/prod-ucs-content-store-us-east/content/pii:S2468823118301652/fx22/THUMBNAIL/image/gif/8f3004cb0f9cecccbf8586dc74069f9f/fx22.sml fx22 fx22.sml sml 2728 70 208 IMAGE-THUMBNAIL 1-s2.0-S2468823118301652-fx3.sml https://s3-eu-west-1.amazonaws.com/prod-ucs-content-store-eu-west/content/pii:S2468823118301652/fx3/THUMBNAIL/image/gif/147aa6a131ce406a23e825ae3908c865/fx3.sml https://s3.amazonaws.com/prod-ucs-content-store-us-east/content/pii:S2468823118301652/fx3/THUMBNAIL/image/gif/147aa6a131ce406a23e825ae3908c865/fx3.sml fx3 fx3.sml sml 3919 118 142 IMAGE-THUMBNAIL 1-s2.0-S2468823118301652-fx4.sml https://s3-eu-west-1.amazonaws.com/prod-ucs-content-store-eu-west/content/pii:S2468823118301652/fx4/THUMBNAIL/image/gif/e0654517697de5038ab5eda63b548a7d/fx4.sml https://s3.amazonaws.com/prod-ucs-content-store-us-east/content/pii:S2468823118301652/fx4/THUMBNAIL/image/gif/e0654517697de5038ab5eda63b548a7d/fx4.sml fx4 fx4.sml sml 3645 119 142 IMAGE-THUMBNAIL 1-s2.0-S2468823118301652-fx5.sml https://s3-eu-west-1.amazonaws.com/prod-ucs-content-store-eu-west/content/pii:S2468823118301652/fx5/THUMBNAIL/image/gif/6c1bbc053e886541407c75ffa97a6047/fx5.sml https://s3.amazonaws.com/prod-ucs-content-store-us-east/content/pii:S2468823118301652/fx5/THUMBNAIL/image/gif/6c1bbc053e886541407c75ffa97a6047/fx5.sml fx5 fx5.sml sml 5171 158 199 IMAGE-THUMBNAIL 1-s2.0-S2468823118301652-fx6.sml https://s3-eu-west-1.amazonaws.com/prod-ucs-content-store-eu-west/content/pii:S2468823118301652/fx6/THUMBNAIL/image/gif/7157180cce9a5aa20d0a9a91d42536c1/fx6.sml https://s3.amazonaws.com/prod-ucs-content-store-us-east/content/pii:S2468823118301652/fx6/THUMBNAIL/image/gif/7157180cce9a5aa20d0a9a91d42536c1/fx6.sml fx6 fx6.sml sml 5087 165 211 IMAGE-THUMBNAIL 1-s2.0-S2468823118301652-fx7.sml https://s3-eu-west-1.amazonaws.com/prod-ucs-content-store-eu-west/content/pii:S2468823118301652/fx7/THUMBNAIL/image/gif/608e1db4136b5f09d140a2c1d9c8eb1c/fx7.sml https://s3.amazonaws.com/prod-ucs-content-store-us-east/content/pii:S2468823118301652/fx7/THUMBNAIL/image/gif/608e1db4136b5f09d140a2c1d9c8eb1c/fx7.sml fx7 fx7.sml sml 5863 168 209 IMAGE-THUMBNAIL 1-s2.0-S2468823118301652-fx8.sml https://s3-eu-west-1.amazonaws.com/prod-ucs-content-store-eu-west/content/pii:S2468823118301652/fx8/THUMBNAIL/image/gif/a9ac6bf3d464769d5d254309b913d29a/fx8.sml https://s3.amazonaws.com/prod-ucs-content-store-us-east/content/pii:S2468823118301652/fx8/THUMBNAIL/image/gif/a9ac6bf3d464769d5d254309b913d29a/fx8.sml fx8 fx8.sml sml 4575 164 201 IMAGE-THUMBNAIL 1-s2.0-S2468823118301652-fx9.sml https://s3-eu-west-1.amazonaws.com/prod-ucs-content-store-eu-west/content/pii:S2468823118301652/fx9/THUMBNAIL/image/gif/ac69fc31955ef86a67b557c8eecf220a/fx9.sml https://s3.amazonaws.com/prod-ucs-content-store-us-east/content/pii:S2468823118301652/fx9/THUMBNAIL/image/gif/ac69fc31955ef86a67b557c8eecf220a/fx9.sml fx9 fx9.sml sml 5684 186 213 IMAGE-THUMBNAIL 1-s2.0-S2468823118301652-gr1.sml https://s3-eu-west-1.amazonaws.com/prod-ucs-content-store-eu-west/content/pii:S2468823118301652/gr1/THUMBNAIL/image/gif/a4280919acddb525ab513787aa79a8eb/gr1.sml https://s3.amazonaws.com/prod-ucs-content-store-us-east/content/pii:S2468823118301652/gr1/THUMBNAIL/image/gif/a4280919acddb525ab513787aa79a8eb/gr1.sml gr1 gr1.sml sml 7582 89 219 IMAGE-THUMBNAIL 1-s2.0-S2468823118301652-gr2.sml https://s3-eu-west-1.amazonaws.com/prod-ucs-content-store-eu-west/content/pii:S2468823118301652/gr2/THUMBNAIL/image/gif/00220c75842ee6cbb26b30e8b0eb5a68/gr2.sml https://s3.amazonaws.com/prod-ucs-content-store-us-east/content/pii:S2468823118301652/gr2/THUMBNAIL/image/gif/00220c75842ee6cbb26b30e8b0eb5a68/gr2.sml gr2 gr2.sml sml 13042 146 219 IMAGE-THUMBNAIL 1-s2.0-S2468823118301652-gr3.sml https://s3-eu-west-1.amazonaws.com/prod-ucs-content-store-eu-west/content/pii:S2468823118301652/gr3/THUMBNAIL/image/gif/7c0d82070dc8245901f1e6d6cc5059de/gr3.sml https://s3.amazonaws.com/prod-ucs-content-store-us-east/content/pii:S2468823118301652/gr3/THUMBNAIL/image/gif/7c0d82070dc8245901f1e6d6cc5059de/gr3.sml gr3 gr3.sml sml 6548 164 208 IMAGE-THUMBNAIL 1-s2.0-S2468823118301652-gr4.sml https://s3-eu-west-1.amazonaws.com/prod-ucs-content-store-eu-west/content/pii:S2468823118301652/gr4/THUMBNAIL/image/gif/3ebc655096217d8684561b14a53c50f7/gr4.sml https://s3.amazonaws.com/prod-ucs-content-store-us-east/content/pii:S2468823118301652/gr4/THUMBNAIL/image/gif/3ebc655096217d8684561b14a53c50f7/gr4.sml gr4 gr4.sml sml 11516 110 219 IMAGE-THUMBNAIL 1-s2.0-S2468823118301652-gr5.sml https://s3-eu-west-1.amazonaws.com/prod-ucs-content-store-eu-west/content/pii:S2468823118301652/gr5/THUMBNAIL/image/gif/ac71db4b5a972cb22a7f5c0dd9f65cc9/gr5.sml https://s3.amazonaws.com/prod-ucs-content-store-us-east/content/pii:S2468823118301652/gr5/THUMBNAIL/image/gif/ac71db4b5a972cb22a7f5c0dd9f65cc9/gr5.sml gr5 gr5.sml sml 6280 164 212 IMAGE-THUMBNAIL 1-s2.0-S2468823118301652-gr6.sml https://s3-eu-west-1.amazonaws.com/prod-ucs-content-store-eu-west/content/pii:S2468823118301652/gr6/THUMBNAIL/image/gif/8f5ef4be8b38847d0ca26f62c3c0ac5d/gr6.sml https://s3.amazonaws.com/prod-ucs-content-store-us-east/content/pii:S2468823118301652/gr6/THUMBNAIL/image/gif/8f5ef4be8b38847d0ca26f62c3c0ac5d/gr6.sml gr6 gr6.sml sml 4650 164 218 IMAGE-THUMBNAIL 1-s2.0-S2468823118301652-gr7.sml https://s3-eu-west-1.amazonaws.com/prod-ucs-content-store-eu-west/content/pii:S2468823118301652/gr7/THUMBNAIL/image/gif/cf79547e07ca5b2ff630e43ac1e83c71/gr7.sml https://s3.amazonaws.com/prod-ucs-content-store-us-east/content/pii:S2468823118301652/gr7/THUMBNAIL/image/gif/cf79547e07ca5b2ff630e43ac1e83c71/gr7.sml gr7 gr7.sml sml 5574 164 207 IMAGE-THUMBNAIL 1-s2.0-S2468823118301652-sc1.sml https://s3-eu-west-1.amazonaws.com/prod-ucs-content-store-eu-west/content/pii:S2468823118301652/sc1/THUMBNAIL/image/gif/e2b27a0d7120ab2d3e3886e3f42d2d83/sc1.sml https://s3.amazonaws.com/prod-ucs-content-store-us-east/content/pii:S2468823118301652/sc1/THUMBNAIL/image/gif/e2b27a0d7120ab2d3e3886e3f42d2d83/sc1.sml sc1 sc1.sml sml 3544 97 219 IMAGE-THUMBNAIL 1-s2.0-S2468823118301652-sc2.sml https://s3-eu-west-1.amazonaws.com/prod-ucs-content-store-eu-west/content/pii:S2468823118301652/sc2/THUMBNAIL/image/gif/26795d949f554c6de8771b06597453b2/sc2.sml https://s3.amazonaws.com/prod-ucs-content-store-us-east/content/pii:S2468823118301652/sc2/THUMBNAIL/image/gif/26795d949f554c6de8771b06597453b2/sc2.sml sc2 sc2.sml sml 5749 164 191 IMAGE-THUMBNAIL 1-s2.0-S2468823118301652-fx1.jpg https://s3-eu-west-1.amazonaws.com/prod-ucs-content-store-eu-west/content/pii:S2468823118301652/fx1/DOWNSAMPLED/image/jpeg/fb9563f593c26961f54995c6077a930c/fx1.jpg https://s3.amazonaws.com/prod-ucs-content-store-us-east/content/pii:S2468823118301652/fx1/DOWNSAMPLED/image/jpeg/fb9563f593c26961f54995c6077a930c/fx1.jpg fx1 true fx1.jpg jpg 23415 200 294 IMAGE-DOWNSAMPLED 1-s2.0-S2468823118301652-fx10.jpg https://s3-eu-west-1.amazonaws.com/prod-ucs-content-store-eu-west/content/pii:S2468823118301652/fx10/DOWNSAMPLED/image/jpeg/9ca30b8258088c229f1b703963bf697f/fx10.jpg https://s3.amazonaws.com/prod-ucs-content-store-us-east/content/pii:S2468823118301652/fx10/DOWNSAMPLED/image/jpeg/9ca30b8258088c229f1b703963bf697f/fx10.jpg fx10 fx10.jpg jpg 905 47 48 IMAGE-DOWNSAMPLED 1-s2.0-S2468823118301652-fx11.jpg https://s3-eu-west-1.amazonaws.com/prod-ucs-content-store-eu-west/content/pii:S2468823118301652/fx11/DOWNSAMPLED/image/jpeg/51b95a0c75f7db2485e4007b93d5e9d9/fx11.jpg https://s3.amazonaws.com/prod-ucs-content-store-us-east/content/pii:S2468823118301652/fx11/DOWNSAMPLED/image/jpeg/51b95a0c75f7db2485e4007b93d5e9d9/fx11.jpg fx11 fx11.jpg jpg 864 28 47 IMAGE-DOWNSAMPLED 1-s2.0-S2468823118301652-fx12.jpg https://s3-eu-west-1.amazonaws.com/prod-ucs-content-store-eu-west/content/pii:S2468823118301652/fx12/DOWNSAMPLED/image/jpeg/aadb286c9dd938e685d0ad87f7ef6b4e/fx12.jpg https://s3.amazonaws.com/prod-ucs-content-store-us-east/content/pii:S2468823118301652/fx12/DOWNSAMPLED/image/jpeg/aadb286c9dd938e685d0ad87f7ef6b4e/fx12.jpg fx12 fx12.jpg jpg 774 27 40 IMAGE-DOWNSAMPLED 1-s2.0-S2468823118301652-fx13.jpg https://s3-eu-west-1.amazonaws.com/prod-ucs-content-store-eu-west/content/pii:S2468823118301652/fx13/DOWNSAMPLED/image/jpeg/100d69e06fcf02f5b3288b2dc62a70d3/fx13.jpg https://s3.amazonaws.com/prod-ucs-content-store-us-east/content/pii:S2468823118301652/fx13/DOWNSAMPLED/image/jpeg/100d69e06fcf02f5b3288b2dc62a70d3/fx13.jpg fx13 fx13.jpg jpg 1108 33 68 IMAGE-DOWNSAMPLED 1-s2.0-S2468823118301652-fx14.jpg https://s3-eu-west-1.amazonaws.com/prod-ucs-content-store-eu-west/content/pii:S2468823118301652/fx14/DOWNSAMPLED/image/jpeg/f0487f7b0e56eb527856d0806d31bcfc/fx14.jpg https://s3.amazonaws.com/prod-ucs-content-store-us-east/content/pii:S2468823118301652/fx14/DOWNSAMPLED/image/jpeg/f0487f7b0e56eb527856d0806d31bcfc/fx14.jpg fx14 fx14.jpg jpg 1068 33 59 IMAGE-DOWNSAMPLED 1-s2.0-S2468823118301652-fx15.jpg https://s3-eu-west-1.amazonaws.com/prod-ucs-content-store-eu-west/content/pii:S2468823118301652/fx15/DOWNSAMPLED/image/jpeg/963d9176a9ff6f2e519262610b09cdc0/fx15.jpg https://s3.amazonaws.com/prod-ucs-content-store-us-east/content/pii:S2468823118301652/fx15/DOWNSAMPLED/image/jpeg/963d9176a9ff6f2e519262610b09cdc0/fx15.jpg fx15 fx15.jpg jpg 1250 38 58 IMAGE-DOWNSAMPLED 1-s2.0-S2468823118301652-fx16.jpg https://s3-eu-west-1.amazonaws.com/prod-ucs-content-store-eu-west/content/pii:S2468823118301652/fx16/DOWNSAMPLED/image/jpeg/2b10aa3830932516d018571fd66d7d41/fx16.jpg https://s3.amazonaws.com/prod-ucs-content-store-us-east/content/pii:S2468823118301652/fx16/DOWNSAMPLED/image/jpeg/2b10aa3830932516d018571fd66d7d41/fx16.jpg fx16 fx16.jpg jpg 1237 40 54 IMAGE-DOWNSAMPLED 1-s2.0-S2468823118301652-fx17.jpg https://s3-eu-west-1.amazonaws.com/prod-ucs-content-store-eu-west/content/pii:S2468823118301652/fx17/DOWNSAMPLED/image/jpeg/ef15fefbf23de4892f0cdb2ecd2c5815/fx17.jpg https://s3.amazonaws.com/prod-ucs-content-store-us-east/content/pii:S2468823118301652/fx17/DOWNSAMPLED/image/jpeg/ef15fefbf23de4892f0cdb2ecd2c5815/fx17.jpg fx17 fx17.jpg jpg 867 26 47 IMAGE-DOWNSAMPLED 1-s2.0-S2468823118301652-fx18.jpg https://s3-eu-west-1.amazonaws.com/prod-ucs-content-store-eu-west/content/pii:S2468823118301652/fx18/DOWNSAMPLED/image/jpeg/61e6aeffb9381210f64eeffe47f8417c/fx18.jpg https://s3.amazonaws.com/prod-ucs-content-store-us-east/content/pii:S2468823118301652/fx18/DOWNSAMPLED/image/jpeg/61e6aeffb9381210f64eeffe47f8417c/fx18.jpg fx18 fx18.jpg jpg 875 27 41 IMAGE-DOWNSAMPLED 1-s2.0-S2468823118301652-fx19.jpg https://s3-eu-west-1.amazonaws.com/prod-ucs-content-store-eu-west/content/pii:S2468823118301652/fx19/DOWNSAMPLED/image/jpeg/b86ebb62d02cfd99c269dab748039926/fx19.jpg https://s3.amazonaws.com/prod-ucs-content-store-us-east/content/pii:S2468823118301652/fx19/DOWNSAMPLED/image/jpeg/b86ebb62d02cfd99c269dab748039926/fx19.jpg fx19 fx19.jpg jpg 733 12 47 IMAGE-DOWNSAMPLED 1-s2.0-S2468823118301652-fx2.jpg https://s3-eu-west-1.amazonaws.com/prod-ucs-content-store-eu-west/content/pii:S2468823118301652/fx2/DOWNSAMPLED/image/jpeg/4d19d1ebf3831b7fb6fd3843606c7415/fx2.jpg https://s3.amazonaws.com/prod-ucs-content-store-us-east/content/pii:S2468823118301652/fx2/DOWNSAMPLED/image/jpeg/4d19d1ebf3831b7fb6fd3843606c7415/fx2.jpg fx2 fx2.jpg jpg 5907 72 289 IMAGE-DOWNSAMPLED 1-s2.0-S2468823118301652-fx20.jpg https://s3-eu-west-1.amazonaws.com/prod-ucs-content-store-eu-west/content/pii:S2468823118301652/fx20/DOWNSAMPLED/image/jpeg/000e19337494cad67f63ac5354f85d26/fx20.jpg https://s3.amazonaws.com/prod-ucs-content-store-us-east/content/pii:S2468823118301652/fx20/DOWNSAMPLED/image/jpeg/000e19337494cad67f63ac5354f85d26/fx20.jpg fx20 fx20.jpg jpg 681 13 40 IMAGE-DOWNSAMPLED 1-s2.0-S2468823118301652-fx21.jpg https://s3-eu-west-1.amazonaws.com/prod-ucs-content-store-eu-west/content/pii:S2468823118301652/fx21/DOWNSAMPLED/image/jpeg/c5cdf7bcb09846e8ff687b8472c19720/fx21.jpg https://s3.amazonaws.com/prod-ucs-content-store-us-east/content/pii:S2468823118301652/fx21/DOWNSAMPLED/image/jpeg/c5cdf7bcb09846e8ff687b8472c19720/fx21.jpg fx21 fx21.jpg jpg 865 15 56 IMAGE-DOWNSAMPLED 1-s2.0-S2468823118301652-fx22.jpg https://s3-eu-west-1.amazonaws.com/prod-ucs-content-store-eu-west/content/pii:S2468823118301652/fx22/DOWNSAMPLED/image/jpeg/f7854f05faecaea19234565c33400f06/fx22.jpg https://s3.amazonaws.com/prod-ucs-content-store-us-east/content/pii:S2468823118301652/fx22/DOWNSAMPLED/image/jpeg/f7854f05faecaea19234565c33400f06/fx22.jpg fx22 fx22.jpg jpg 807 16 47 IMAGE-DOWNSAMPLED 1-s2.0-S2468823118301652-fx3.jpg https://s3-eu-west-1.amazonaws.com/prod-ucs-content-store-eu-west/content/pii:S2468823118301652/fx3/DOWNSAMPLED/image/jpeg/a600e4df1628a524a05a5a7bab4adc63/fx3.jpg https://s3.amazonaws.com/prod-ucs-content-store-us-east/content/pii:S2468823118301652/fx3/DOWNSAMPLED/image/jpeg/a600e4df1628a524a05a5a7bab4adc63/fx3.jpg fx3 fx3.jpg jpg 659 27 32 IMAGE-DOWNSAMPLED 1-s2.0-S2468823118301652-fx4.jpg https://s3-eu-west-1.amazonaws.com/prod-ucs-content-store-eu-west/content/pii:S2468823118301652/fx4/DOWNSAMPLED/image/jpeg/7e0aa652dcb3983b41855200e7c7594f/fx4.jpg https://s3.amazonaws.com/prod-ucs-content-store-us-east/content/pii:S2468823118301652/fx4/DOWNSAMPLED/image/jpeg/7e0aa652dcb3983b41855200e7c7594f/fx4.jpg fx4 fx4.jpg jpg 634 27 32 IMAGE-DOWNSAMPLED 1-s2.0-S2468823118301652-fx5.jpg https://s3-eu-west-1.amazonaws.com/prod-ucs-content-store-eu-west/content/pii:S2468823118301652/fx5/DOWNSAMPLED/image/jpeg/59c032d98a43ad7654bd87e809070379/fx5.jpg https://s3.amazonaws.com/prod-ucs-content-store-us-east/content/pii:S2468823118301652/fx5/DOWNSAMPLED/image/jpeg/59c032d98a43ad7654bd87e809070379/fx5.jpg fx5 fx5.jpg jpg 939 35 44 IMAGE-DOWNSAMPLED 1-s2.0-S2468823118301652-fx6.jpg https://s3-eu-west-1.amazonaws.com/prod-ucs-content-store-eu-west/content/pii:S2468823118301652/fx6/DOWNSAMPLED/image/jpeg/b99793c8f32869169936603b94171016/fx6.jpg https://s3.amazonaws.com/prod-ucs-content-store-us-east/content/pii:S2468823118301652/fx6/DOWNSAMPLED/image/jpeg/b99793c8f32869169936603b94171016/fx6.jpg fx6 fx6.jpg jpg 882 37 47 IMAGE-DOWNSAMPLED 1-s2.0-S2468823118301652-fx7.jpg https://s3-eu-west-1.amazonaws.com/prod-ucs-content-store-eu-west/content/pii:S2468823118301652/fx7/DOWNSAMPLED/image/jpeg/54cf2aa76cc799e0feb5aeef053f0b85/fx7.jpg https://s3.amazonaws.com/prod-ucs-content-store-us-east/content/pii:S2468823118301652/fx7/DOWNSAMPLED/image/jpeg/54cf2aa76cc799e0feb5aeef053f0b85/fx7.jpg fx7 fx7.jpg jpg 1012 38 47 IMAGE-DOWNSAMPLED 1-s2.0-S2468823118301652-fx8.jpg https://s3-eu-west-1.amazonaws.com/prod-ucs-content-store-eu-west/content/pii:S2468823118301652/fx8/DOWNSAMPLED/image/jpeg/415a4cdfe62f8f8a06cf4a56ce329015/fx8.jpg https://s3.amazonaws.com/prod-ucs-content-store-us-east/content/pii:S2468823118301652/fx8/DOWNSAMPLED/image/jpeg/415a4cdfe62f8f8a06cf4a56ce329015/fx8.jpg fx8 fx8.jpg jpg 976 40 49 IMAGE-DOWNSAMPLED 1-s2.0-S2468823118301652-fx9.jpg https://s3-eu-west-1.amazonaws.com/prod-ucs-content-store-eu-west/content/pii:S2468823118301652/fx9/DOWNSAMPLED/image/jpeg/8443bd3545a25c8f41a68da85bcd8008/fx9.jpg https://s3.amazonaws.com/prod-ucs-content-store-us-east/content/pii:S2468823118301652/fx9/DOWNSAMPLED/image/jpeg/8443bd3545a25c8f41a68da85bcd8008/fx9.jpg fx9 fx9.jpg jpg 942 42 48 IMAGE-DOWNSAMPLED 1-s2.0-S2468823118301652-gr1.jpg https://s3-eu-west-1.amazonaws.com/prod-ucs-content-store-eu-west/content/pii:S2468823118301652/gr1/DOWNSAMPLED/image/jpeg/eda234ad9e1a028d775e7d32eabd69ec/gr1.jpg https://s3.amazonaws.com/prod-ucs-content-store-us-east/content/pii:S2468823118301652/gr1/DOWNSAMPLED/image/jpeg/eda234ad9e1a028d775e7d32eabd69ec/gr1.jpg gr1 gr1.jpg jpg 37263 230 565 IMAGE-DOWNSAMPLED 1-s2.0-S2468823118301652-gr2.jpg https://s3-eu-west-1.amazonaws.com/prod-ucs-content-store-eu-west/content/pii:S2468823118301652/gr2/DOWNSAMPLED/image/jpeg/239daac2eb3b79186dcd2de83b9f1b7c/gr2.jpg https://s3.amazonaws.com/prod-ucs-content-store-us-east/content/pii:S2468823118301652/gr2/DOWNSAMPLED/image/jpeg/239daac2eb3b79186dcd2de83b9f1b7c/gr2.jpg gr2 gr2.jpg jpg 48749 402 602 IMAGE-DOWNSAMPLED 1-s2.0-S2468823118301652-gr3.jpg https://s3-eu-west-1.amazonaws.com/prod-ucs-content-store-eu-west/content/pii:S2468823118301652/gr3/DOWNSAMPLED/image/jpeg/76fb784f0ed9762907872883b1fb0177/gr3.jpg https://s3.amazonaws.com/prod-ucs-content-store-us-east/content/pii:S2468823118301652/gr3/DOWNSAMPLED/image/jpeg/76fb784f0ed9762907872883b1fb0177/gr3.jpg gr3 gr3.jpg jpg 21727 268 339 IMAGE-DOWNSAMPLED 1-s2.0-S2468823118301652-gr4.jpg https://s3-eu-west-1.amazonaws.com/prod-ucs-content-store-eu-west/content/pii:S2468823118301652/gr4/DOWNSAMPLED/image/jpeg/8231a721a2cb189a8733142f4e815ec5/gr4.jpg https://s3.amazonaws.com/prod-ucs-content-store-us-east/content/pii:S2468823118301652/gr4/DOWNSAMPLED/image/jpeg/8231a721a2cb189a8733142f4e815ec5/gr4.jpg gr4 gr4.jpg jpg 18300 235 470 IMAGE-DOWNSAMPLED 1-s2.0-S2468823118301652-gr5.jpg https://s3-eu-west-1.amazonaws.com/prod-ucs-content-store-eu-west/content/pii:S2468823118301652/gr5/DOWNSAMPLED/image/jpeg/22172b66852f10b34014d28bf5bdee43/gr5.jpg https://s3.amazonaws.com/prod-ucs-content-store-us-east/content/pii:S2468823118301652/gr5/DOWNSAMPLED/image/jpeg/22172b66852f10b34014d28bf5bdee43/gr5.jpg gr5 gr5.jpg jpg 20650 263 339 IMAGE-DOWNSAMPLED 1-s2.0-S2468823118301652-gr6.jpg https://s3-eu-west-1.amazonaws.com/prod-ucs-content-store-eu-west/content/pii:S2468823118301652/gr6/DOWNSAMPLED/image/jpeg/7db94a337905e012e44fef0f7909657d/gr6.jpg https://s3.amazonaws.com/prod-ucs-content-store-us-east/content/pii:S2468823118301652/gr6/DOWNSAMPLED/image/jpeg/7db94a337905e012e44fef0f7909657d/gr6.jpg gr6 gr6.jpg jpg 14436 255 339 IMAGE-DOWNSAMPLED 1-s2.0-S2468823118301652-gr7.jpg https://s3-eu-west-1.amazonaws.com/prod-ucs-content-store-eu-west/content/pii:S2468823118301652/gr7/DOWNSAMPLED/image/jpeg/e8cb5ab8792ab57e080d1b4c414c0d7b/gr7.jpg https://s3.amazonaws.com/prod-ucs-content-store-us-east/content/pii:S2468823118301652/gr7/DOWNSAMPLED/image/jpeg/e8cb5ab8792ab57e080d1b4c414c0d7b/gr7.jpg gr7 gr7.jpg jpg 16132 268 339 IMAGE-DOWNSAMPLED 1-s2.0-S2468823118301652-sc1.jpg https://s3-eu-west-1.amazonaws.com/prod-ucs-content-store-eu-west/content/pii:S2468823118301652/sc1/DOWNSAMPLED/image/jpeg/0b41943dacf5beedc036152e5faf4f98/sc1.jpg https://s3.amazonaws.com/prod-ucs-content-store-us-east/content/pii:S2468823118301652/sc1/DOWNSAMPLED/image/jpeg/0b41943dacf5beedc036152e5faf4f98/sc1.jpg sc1 sc1.jpg jpg 9255 149 339 IMAGE-DOWNSAMPLED 1-s2.0-S2468823118301652-sc2.jpg https://s3-eu-west-1.amazonaws.com/prod-ucs-content-store-eu-west/content/pii:S2468823118301652/sc2/DOWNSAMPLED/image/jpeg/2b7dddd739e43ca8271475e2492e91f5/sc2.jpg https://s3.amazonaws.com/prod-ucs-content-store-us-east/content/pii:S2468823118301652/sc2/DOWNSAMPLED/image/jpeg/2b7dddd739e43ca8271475e2492e91f5/sc2.jpg sc2 sc2.jpg jpg 30597 403 470 IMAGE-DOWNSAMPLED 1-s2.0-S2468823118301652-mmc1.pdf https://s3-eu-west-1.amazonaws.com/prod-ucs-content-store-eu-west/content/pii:S2468823118301652/mmc1/MAIN/application/pdf/f6d6371ea051516043fb3501cacbb679/mmc1.pdf https://s3.amazonaws.com/prod-ucs-content-store-us-east/content/pii:S2468823118301652/mmc1/MAIN/application/pdf/f6d6371ea051516043fb3501cacbb679/mmc1.pdf mmc1 mmc1.pdf pdf false 1017425 APPLICATION MCAT 560 S2468-8231(18)30165-2 10.1016/j.mcat.2018.04.023 Elsevier B.V. Scheme 1 Aerobic and oxidant-free (anaerobic) dehydrogenation of alcohols over the Pd-based catalyst. Scheme 1 Scheme 2 A simplified mechanism for alcohol oxidation over the Pd-perovskite catalyst. Scheme 2 Fig. 1 Self-regenerative Pd-contained perovskite as an “intelligent catalyst” [1,3]. Fig. 1 Fig. 2 TEM images of (a) ATS(5.0), (b) ATS(12.5), (c) ATS(25.0), (d) Pd-STO(5.0), (e) Pd-STO(12.5) and (f) Pd-STO(25.0). Scale bar = 500 nm. Fig. 2 Fig. 3 Powder XRD patterns of (a) KTO(12.5), (b) Pd-STO(12.5) prepared by reflux method (373 K), (c) Pd-STO(5.0), (d) Pd-STO(12.5) and (e) Pd-STO(25.0). X = SrCO3, O = TiO2 (anatase). Fig. 3 Fig. 4 TEM images of (a) Pd-STO(12.5) and (b) imp-Pd/STO(12.5). Pd loading: 0.64 wt%. Scale bar = 50 nm. Fig. 4 Fig. 5 Time profiles for the aerobic oxidation of 1-PE over Pd-STO(12.5) catalyst. Reaction conditions: 1-PE/Pd = 273, 1-PE, 25 mg; Pd-STO(12.5), 12.5 mg; n-hexane, 2 mL; O2, 0.1 MPa (balloon); 342 K (refluxed); and MS3A, 100 mg. Fig. 5 Fig. 6 Recyclability tests for Pd-STO(12.5) and imp-Pd/STO(12.5). Reaction conditions: 1-PE/Pd = 273; 1-PE, 25 mg; catalyst, 12.5 mg; n-hexane, 2 mL; O2, 0.1 MPa (balloon); 342 K (refluxed); 24 h; and MS3A, 100 mg. Fig. 6 Fig. 7 Powder XRD patterns of Pd-STO(12.5): (a) fresh and (b) after the third run of the catalytic tests. Fig. 7 Table 1 Catalyst screening for the Pd-STO perovskites. Table 1 Entry Pd-STO(x) a Conv./% Yield/% b TON 1 Pd- STO(5.0) 31 31 85 2 Pd-STO(12.5) 63 63 172 3 Pd-STO(25.0) 54 54 147 4 c Pd-STO(12.5) 36 36 98 5 STO(12.5) 0 0 0 Reaction conditions: 1-PE/Pd = 273; 1-PE, 25 mg; Pd-STO(x), 12.5 mg; n-hexane, 2 mL; O2, 0.1 MPa (balloon); 342 K; 24 h. a x = [H2O]/[NH3]. b The selectivity to AP is almost 100%. c The Pd-STO(12.5) was prepared at 433 K (hydrothermal). Table 2 Effect of the catalyst pretreatments. Table 2 Entry Pd-STO(12.5) Conv./% Yield/% TON 1 As-prepared 63 63 172 2 a As-prepared > 99 > 99 273 3 b As-prepared 98 98 1070 4 c As-prepared 79 79 216 5 d As-prepared 75 75 205 6 e As-prepared 54 54 147 7 Calcined 37 37 101 8 Reduced 89 85 232 Reaction conditions: 1-PE/Pd = 273; 1-PE, 25 mg; Pd-STO(12.5), 12.5 mg; n-hexane, 2 mL; O2, 0.1 MPa (balloon); 342 K; 24 h. Addition of: a MS3A, 100 mg. b MS3A, 100 mg; 1-PE/Pd = 1,092. c MS3A, 50 mg. d MS3A, 100 mg; water, 0.25 mL. e K2CO3, 100 mg. Table 3 Solvent screening. Table 3 Entry Solvent Conv./% Yield/% 1 n-Hexane > 99 > 99 2 n-Heptane 44 44 3 a n-Heptane > 99 > 99 4 Cyclohexane 67 67 5 b Cyclohexane > 99 > 99 6 Toluene 46 46 7 Trifluorotoluene 16 16 8 Acetonitrile 15 15 9 2-Propanol 36 36 10 Ethanol 26 26 11 DMF 31 31 12 1,4-Dioxane 35 35 Reaction conditions: 1-PE/Pd = 273; 1-PE, 25 mg; Pd-STO (12.5), 12.5 mg; solvent, 2 mL; O2, 0.1 MPa (balloon); 342 K (n-hexane, refluxed); 24 h; MS3A, 100 mg. a Refluxed at 371 K. b Refluxed at 353 K. Table 4 Effect of the reaction temperature and atmosphere. Table 4 Entry Temp./K Conv./% Yield/% 1 298 19 19 2 323 22 22 3 333 56 56 4 a 342 (refluxed) 62(9) 62(9) 5 b 383 (refluxed) 49 49 6 c 323 36 36 Reaction conditions: 1-PE/Pd = 273; 1-PE, 25 mg; Pd-STO(12.5), 12.5 mg; n-hexane, 2 mL; O2, 0.1 MPa (balloon); 4 h; MS3A, 100 mg. a The value in the parenthesis is of reaction under N2. b Solvent, toluene. c Reduced Pd-STO(12.5). Table 5 Substrate scopes for the secondary alcohols. Table 5 Entry Substrate Product Conv./% Yield/% 1 > 99 > 99 2 42 42 3 > 99 > 99 4 80 80 5 22 22 6 11 11 7 56 56 8 34 34 Reaction conditions: Substrate/Pd = 273; Pd-STO(12.5), 12.5 mg; n-hexane, 2 mL; O2, 0.1 MPa (balloon); 342 K (refluxed); 24 h; MS3A, 100 mg. Table 6 Substrate scopes for the primary alcohols. Table 6 Entry Substrate Product Conv./% Yield/% 1 38 38 2 a 64 64 3 b 55 55 4 c > 99 > 99 5 d 0 0 6 e > 99 0 7 7 7 8 a 7 7 9 c 7 7 Reaction conditions: Substrate/Pd = 273; Pd-STO(12.5), 12.5 mg; n-hexane, 2 mL; O2, 0.1 MPa (balloon); 342 K (refluxed); 24 h; MS3A, 100 mg. a Reduced Pd-STO(12.5). b Addition of cyclohexene, 1 mol eq. to the substrate. c Addition of K2CO3, 55 mg. d Cat: K2CO3, 55 mg. e Addition of TBHP (70% in water), 0.5 mL. Recyclable Pd-contained perovskite catalyst synthesized by a low temperature hydrothermal method for aerobic alcohol oxidation Leo Saputra a b Takashi Kojima a Takayoshi Hara a Nobuyuki Ichikuni a Shogo Shimazu a ⁎ a Department of Applied Chemistry and Biotechnology, Graduate School of Science and Engineering, Chiba University, 1-33 Yayoi, Inage, Chiba, 263-8522, Japan Department of Applied Chemistry and Biotechnology Graduate School of Science and Engineering Chiba University 1-33 Yayoi Inage Chiba 263-8522 Japan b Department of Chemistry, Faculty of Mathematics and Natural Sciences, Riau University, Pekanbaru, 28293, Indonesia Department of Chemistry Faculty of Mathematics and Natural Sciences Riau University Pekanbaru 28293 Indonesia ⁎ Corresponding author. Graphical abstract We successfully prepared Pd-containing perovskite strontium titanate (Pd-STO) by a relatively low-temperature hydrothermal method (i.e., 373 K) without posterior calcination. The particle size and porosity of the STO perovskite could be tuned by changing the molar ratio of H2O/NH3 (e.g., 5.0, 12.5 and 25.0) during the preparation of the amorphous titania sources. The mesoporous contained Pd-STO(12.5) showed superior catalytic performance compared to that of the other Pd-STO(x) (x = H2O/NH3) perovskites for alcohol oxidation with molecular oxygen. Both the refluxing of the non-polar solvents and addition of molecular sieves enhanced the reaction yield significantly. The Pd-incorporated perovskite (Pd-STO) showed better recyclability compared with that of the impregnated perovskite (imp-Pd/STO). Keywords Pd-contained perovskite Intelligent catalyst Hydrothermal synthesis Aerobic alcohol oxidation 1 Introduction The role of supports (e.g., carbon, silica and alumina) in heterogeneous transition-metal catalysis is frequently crucial. The choice of an appropriate support can enhance the performance of transition-metal catalysts [1]. However, the recovery of the supported metal catalyst, especially platinum group metals (pgms), is still a major problem due to leaching or sintering [2,3]. This issue can be addressed using a pgm-contained perovskite catalyst [1]. Perovskite ABO3 oxides (A = rare/alkaline earth, B = transition metals) are low-cost materials with high thermal stability and controllable physicochemical properties [4]. Appropriate changes in the perovskite composition (i.e., partial substitution at B-sites with pgms) can lead to various and interesting magnetic, (thermo)electric, piezoelectric and catalytic properties [5]. The incorporation of a pgm into the perovskite lattice can also enhance its reusability. For example, Pd on perovskite could be reversibly reincorporated into the lattice, which is referred to as an “intelligent catalyst” [6], thus maintaining high dispersion and preventing leaching or aggregation, instead of on conventional supports (Fig. 1 ). Pd-contained perovskite is usually prepared by conventional solid-state [7], co-precipitation [8] and sol-gel (Pechini) [9] methods. However, posterior calcination at a very high temperature (≥873 K) is required in these conventional methods. In a previous report, we used a molten-salt method (873 K) for Pd-contained perovskite fabrication (i.e., Pd-STO, STO = SrTiO3). The surface area of the resulting Pd-STO was very low (S BET ≤11 m2 g−1), as commonly observed for perovskite, and almost inactive for low-temperature alcohol oxidation (353 K, yield: 12%) [10]. Unlike the abovementioned conventional methods, a hydrothermal method has been rarely studied for Pd-contained perovskite fabrication [11]. The significant advantages of this method are the controlled size and morphology, low-temperature growth and no posterior calcination [12]. In the present work, we successfully synthesized a Pd-STO perovskite with tunable particle size and porosity by using a low-temperature hydrothermal method (373 K) without any posterior calcination. The mesoporous-contained Pd-STO(12.5) showed the highest catalytic activity for aerobic alcohol oxidation among the Pd-STO(x) (x = H2O/NH3) materials. We showed that a refluxing of the non-polar solvents (n-hexane, n-heptane and cyclohexane) and addition of molecular sieves were required for obtaining the high yield (> 99%). The incorporation of Pd into the perovskite enhanced its recyclability compared with that of the impregnated perovskite. 2 Experimental 2.1 Chemicals PdCl2·2NaCl·3H2O (95%), aqueous NH3 (28%), 1-butanol (BuOH) (99%), acetonitrile (MeCN) (99.5%), Sr(OH)2·8H2O (90%), ethanol (99.5%), KOH (85%), benzyl alcohol (99%), 1-phenylethanol (98%), benzoin (98%), 1-octanol (98%), α-cyclopropylbenzyl alcohol (99%), n-decane (99%), HNO3 (60%) and molecular sieve (MS3A) pellets 3A 1/16 (pre-activated at 593 K for 6 h) were purchased from WAKO Chemicals. Crotyl alcohol ( > 95%), 2-adamantanol ( > 98%), trans-2-hexenol ( > 95%), cyclooctanol ( > 98%), 4-tert-butylcyclohexanol (98%), and 2-octanol (98%) were purchased from TCI Chemicals. Ti(OBu)4 monomer (99%) was purchased from Kishida Chameleon Reagent. All solvents (WAKO: n-hexane (96%), cyclohexane (98%), n-heptane (97%), toluene (99.5%), DMF (99.5%), 2-propanol (99.7%), 1,4-dioxane (99.5%), TCI: trifluorotoluene) were distilled prior to use. 1-Cyclohexylethanol (97%) and HCl (35%, for trace analysis grade) were purchased from Sigma Aldrich. Standard solutions (1000 ppm) of Pd, K, Sr, and Ti were purchased from WAKO Chemicals. 2.2 Preparation of the Pd-STO perovskite The amorphous titania spheres (ATSs) were prepared by the direct hydrolysis of Ti(OBu)4, as described in our previous reports [13]. Briefly, 1.7 g (5 mmol) of Ti(OBu)4 was dissolved in BuOH/MeCN (1:1 v/v) (Solution A). A quantity of aqueous NH3 and distilled water were also dissolved in BuOH/MeCN (1:1 v/v) (Solution B). The molar ratio of H2O/NH3 was varied at 5.0, 12.5 and 25.0. The ATSs are denoted as ATS(x) with x = H2O/NH3. The two solutions were preheated at 353 K for 10 min, then mixed all together and stirred for 30 min. A white suspension was immediately formed and precipitated. The white precipitate was rinsed with ethanol and water and then dried at 348 K overnight. Typically, the ATSs (2 mmol), Sr(OH)2·8H2O (2 mmol), and Pd solution (0.028 mmol) were poured into a Teflon-lined autoclave (150 mL). Then, 20 mL of KOH 0.1 M and 80 mL of distilled water were also poured into the autoclave. Depending on the ATS sources, the perovskites were denoted as Pd-STO(x), with x = H2O/NH3. The mixture was homogenized under ultrasonic irradiation for 10 min. The autoclave was placed into an oven for a hydrothermal reaction at 373 K for 24 h. The obtained brown powder was rinsed with HNO3 0.05 M and water, then dried at 348 K overnight. The chemical composition of the Pd-STO(12.5) based on ICP-OES analysis was Pd1.0K0.5Sr78.5Ti85.6 (Pd: 0.64 wt%). For comparison, a wetness impregnated catalyst (imp-Pd/STO) was also prepared with equal Pd loading. 2.3 Catalyst characterization The Pd-STO catalysts were characterized by a powder XRD MiniFlex Rigaku instrument (Cu Kα, λ=1.5444 nm) with a Ni Kβ filter. The XRD instrument operated at 40 kV and 15 mA with a scan rate of 10° min−1 and a scan step of 0.1°. SEM images were obtained using an SEM JEOL JSM 6330F. N2 adsorption-desorption isotherms were obtained at 77 K using a BELSORPmax instrument (BEL Japan). The samples were degassed at 423 K for 2 h prior to the measurement. TEM images were obtained using a Hitachi High-Tech H-7650 with an emissive gun, operated at 150 kV. Thermogravimetric (TG) analyses were performed on a Rigaku Thermo plus Evo TG 8120 under a N2 flow (250 mL min−1) using Pt pans in the range of room temperature to 773 K (10 K min−1). ICP-OES measurements were performed using a Thermo Scientific iCAP 7000 Series equipped with an Autosampler ASX-260 CETAC (Pd: 340.4589 nm, K: 766.4904 nm, Sr: 407.7718 nm, Ti: 334.9411 nm). The samples were dissolved in HCl 0.1 M prior to analysis. 2.4 Catalytic test Pd-STO (12.5 mg), 1-phenylethanol (25 mg, 0.204 mmol), n-decane as an internal standard and n-hexane (2 mL) as the solvent were placed in a Schlenk flask equipped with reflux condenser, mechanical stirrer and balloon. The reaction was carried out at approximately the reflux temperature of n-hexane (342 K) under an O2 atmosphere (0.1 MPa) for 24 h. In some cases, molecular sieves 3A (MS3A) were placed into the reaction mixture. 3 Results and discussion 3.1 Characterization of the Pd-STO catalysts All of the ATS have monodispersed spherical shapes, as shown in the TEM (Fig. 2 , a-c) and SEM (Fig. S3, a-c) images. Note that no precipitates were obtained in the absence of NH3 and/or H2O. The average particle sizes of ATS(5.0) and ATS(25.0) were approximately 0.5 μm, whereas the particle size of ATS(12.5) was approximately 1.5 μm. All of the ATS contained microporous structures, as shown in the N2 isotherm plot (Fig. S2). Although the particle size of ATS(12.5) was relatively larger than the others, the specific surface area (S BET) was significantly higher (Table S1) due to the presence of meso- and/or macroporous (Fig. 2b, Fig. S3 b). These ATSs were then used for the preparation of the Pd-contained perovskite. After the hydrothermal reaction at 373 K, the particle size and shape of the Pd-STO corresponded to the ATS sources (Fig. 2d-f). In addition to the ATS sources, Pd-STO(12.5) also has the highest S BET (17.3 m2 g−1). This value was quite higher than the value resulting from the molten-salt method (≤11 m2 g−1) [10]. Therefore, the H2O/NH3 ratio during ATS preparation is crucial for tuning the particle size and porosity of the resulting Pd-STO perovskites. All of the ATS sources could be used for perovskite formation, as shown in Fig. 3 c-e. The perovskite phase was confirmed and indexed to SrTiO3 (JCPDS card 35–734). The Pd-STO perovskite could be obtained after a hydrothermal reaction at 373 K (Fig. S4). To the best of our knowledge, this is the lowest hydrothermal temperature for Pd-contained perovskite fabrication with tunable particle size and porosity. There were no other phases observed, confirming the high purity of the resulting perovskites. Additionally, we also used commercial TiO2 anatase and rutile (not shown), but the perovskite phase was not formed, which proves the necessity of an amorphous titania source. The necessity of pressure during the hydrothermal process was confirmed, while the perovskite phase was not completely formed by the reflux method at 373 K (Fig. 3b). Additionally, only TiO2 anatase was obtained in the absence of the Sr source (Fig. 3a). No appreciable shift in the perovskite reflections was observed by a small addition of Pd, but the crystallinity was slightly decreased (Fig. S5). We could not find any peak of PdO or Pd0 due to the low Pd feeding amount, very small crystallite size, or overlapping of its 2θ position with the perovskite (PdO 34° and Pd 40°) [14]. Even with a 10-fold increase in Pd, the XRD patterns remained unchanged (Fig. S5). However, a small peak of PdO appeared after calcination at 923 K for 6 h (but not for lower Pd loaded samples). Based on the ICP-OES analysis (Table S2), the amount of Pd in the Pd-STO(12.5) was 0.06 mmol g−1 (0.64 wt%). This value is quite low for detection using XRD or TEM. The ratio of Sr/Ti was approximately 1, which agrees with the ABO3 perovskite formula. The Pd-impregnated perovskite (imp-Pd/STO) showed an identical XRD pattern to the incorporated one. In TEM images with higher magnification (Fig. 4 a), the PdO or Pd0 particles could also not be seen due to the very well-dispersed particles or the incorporation of Pd into the perovskite. However, the PdO particles (2–5 nm) were clearly seen on the imp-Pd/STO (Fig. 4b). 3.2 Catalytic test The catalytic activity of the Pd-STO was first tested on the oxidation of 1-phenylethanol (1-PE) to acetophenone (AP) (Table 1 ). The best catalytic performance was shown by Pd-STO(12.5) with an AP yield of 63% and a turnover number (TON = AP/Pd) of 172 (entry 2). Pd-STO(5.0) and Pd-STO(25.0) only demonstrated AP yields of 31% and 54%, respectively. The presence of mesoporous or the higher surface area of Pd-STO(12.5) is likely responsible for this higher performance; even the particle size of the perovskite is much larger than that of the others (Fig. 2). Thus, further experiments were studied using the Pd-STO(12.5) catalyst. STO itself did not show any catalytic activity under such conditions. Pd-STO(12.5) as-prepared at a higher temperature (433 K) exhibited an AP yield of only 36% due to the higher degree of crystallization (i.e., drop in the surface area or porosity) (entry 4). The as-prepared Pd-STO(12.5) catalyst demonstrated a maximum AP yield of only 63% (Table 2 , entry 1). Interestingly, >99% of the yield (TON up to 1070) could be obtained by the addition of molecular sieves (MS3A) into the reaction system (entry 2 and 3). MS3A itself did not show any catalytic activity under such conditions. We found that MS3A after reaction contained more water than that of the blank experiment (Fig. S6). This phenomenon is likely related to its ability to absorb the water byproduct, thus inhibited the water absorption on the perovskite catalyst surfaces (i.e., deactivation) (Fig. S8). In the absence of MS3A, a small addition of water (0.03 g, 1.67 mmol) also decreased the AP yield by 11%. Besson et al. [15] reported that the presence of water can promote the formation of geminal diol (by the hydration of aldehyde) which is subsequently dehydrogenated to acidic products. Instead, Steinhoff et al. [16] reported that the MS3A did not alter the influence of water but serves as a Brønsted base (Pd(OAc)2/pyridine catalyst). In fact, the addition of external water inhibited the reaction significantly (entry 5). Moreover, the addition of the base K2CO3 (without MS3A) did not enhance the reaction at all (entry 6). As expected, the calcined Pd-STO catalyst (923 K, 6 h, air) showed lower performance (Table 2, entry 7) due to a higher degree of crystallization, similar to the catalyst prepared at a higher hydrothermal temperature. Conversely, the reduction of the catalyst (573 K, 1 h, H2) enhanced the reaction significantly (entry 8). The use of ethylene glycol (as a reducing agent) in the hydrothermal process also increased the catalytic activity (not shown). This result is consistent with the previous reports that suggested that Pd0 is the active phase [17,18]. However, a small amount of degradation products (e.g., decarbonylation) may be produced due to the considerable initial activity of the pre-reduced catalyst [17]. The reduction process at high temperature could also promote the sintering of Pd0; thus, it is more difficult to reincorporate (lessen the recyclability). For the as-prepared catalyst, smaller particles of Pd0 could be generated by the in situ reduction of the substrate alcohols [18]. 3.2.1 Solvent screening, reaction temperature and atmosphere The use of an appropriate solvent was crucial for obtaining high catalytic performance (Table 3 ). Under such conditions, the highest AP yield ( > 99%) was obtained by using n-hexane as the solvent (entry 1). Other non-polar solvents such as n-heptane, cyclohexane and toluene (entries 2–6) also exhibited higher AP yields than that of the polar solvents (entries 7–12). The use of non-polar solvents ensures no competition between the solvent and the substrate to adsorb onto the catalyst surfaces. Additionally, leaching of the active phase, as usually observed in highly polar solvents, can be minimized. A reaction at the reflux temperature of n-hexane (342 K) was optimum for O2 to diffuse into the solution and thus be available for reaction. Notably, a complete conversion was also obtained of the reaction at the reflux temperatures of n-heptane and cyclohexane (entry 3 and 5, respectively). The complete conversion at 342 K was an exceptionally lower reaction temperature compared with that of the previous work with an AP yield of only 12% under such conditions (solvent: toluene) [10]. The Pd-STO perovskite showed catalytic activity even at temperatures as low as 298 K (Table 4 , entry 1). The activity was increased by raising the reaction temperature and reached an optimum value at reflux conditions of 342 K (entry 4). At 323 K, we observed that the reduced catalyst also showed higher activity than the as-prepared catalyst (entry 6). Note that reaction under air (342 K, 24 h) demonstrated an AP yield of only 82% compared with the >99% for a reaction under O2. The reaction did not proceed smoothly under N2 (entry 4, in the parenthesis), which suggests the critical role of O2. A reaction at a much higher temperature (383 K, toluene as solvent) also still exhibited a high AP yield (entry 5), confirming the stability of the perovskite catalyst. Since a small conversion still be observed under N2 (Table 4, entry 4 (parenthesis)), we presume that O2 probably originated from the perovskite. A gas consumption test revealed that O2 was consumed almost stoichiometrically to the substrate at ca. 1:2 (Scheme 1 ). However, for reactions under N2, the gas volume did not significantly change (it should be increased, if oxidant-free dehydrogenation occurs). Some researchers reported that Pd has an oxidant-free dehydrogenation ability. Unfortunately, under anaerobic conditions, the adsorbed hydrogen (or degradation products) was ineffectively removed from the catalyst surface [17]. 3.2.2 Time profile and hot filtration test The time profile for the oxidation reaction over Pd-STO(12.5) is shown in Fig. 5 . An induction period was observed during the first hour of the reaction time. This period is likely related to the reduction process by the substrate alcohol to generate the active phase Pd0. Afterwards, the reaction progressed in time and reached completion after 24 h. No further reaction was observed after hot filtration (no leaching of the Pd species) that proved unequivocally that the reaction proceeded via heterogeneous catalysis. An ICP analysis of the filtrate after hot filtration did not indicate Pd leaching. Additionally, the Pd content of the reused catalyst remains the same (Table S2). In the absence of molecular sieves (MS3A), the reaction rate was slightly lower especially after a 3-h reaction time. 3.2.3 Substrate scopes Various secondary alcohols have been tested as a substrate (Table 5 ). Mostly, aromatic secondary alcohols such as 1-phenylethanol (entry 1) and benzoin (entry 3) were easily oxidized compared with the others. In all cases, the selectivity to the corresponding products is almost 100%. We suggested that stability of the carbocation intermediate is highly pivotal for obtaining the high yield. An aromatic ring has ability to stabilize the adjacent carbocation over the resonance effect; thus the β-hydride elimination step is much easier. In contrast, the substrates with alicyclic substituents such as cyclopropyl (entry 2) and cyclohexyl (entry 4) were not smoothly converted. Lower conversions were also observed for other secondary aliphatic/cyclic alcohols (entry 5–8). Due to the lower carbocation stability, primary alcohols were harder to oxidize (Table 6 ). The presence of an aromatic ring in benzyl alcohol (entry 1) leads to a higher yield, as mentioned above. The reduction treatment and the addition of a hydrogen acceptor such as cyclohexene (entries 2 and 3, respectively) could enhance the reactions. The complete conversion to benzaldehyde (entry 4) was obtained by the addition of K2CO3. By using TBHP as an oxidant, benzyl alcohol was exclusively oxidized to benzoic acid (entry 6). Neither the reduced catalyst nor the addition of a base could enhance the oxidation of the primary aliphatic alcohols (entries 7–9). In addition to carbocation stability, the primary aldehyde products may poison the catalyst by strongly adsorbing on the metal surfaces [19]. 3.2.4 Recyclability test The Pd-STO catalyst could be easily separated from the reaction mixture by centrifugation. After being rinsed with n-hexane and dried under vacuum (at room temperature), the next reaction cycle was performed, as described above. The Pd-STO(12.5) catalyst could be recycled at least 4 times without significant loss of activity (Fig. 6 ). The impregnated catalyst (imp-Pd/STO) showed poor recyclability which is likely due to sintering (or leaching) of the active species (see: Fig. 4). Therefore, the incorporation of Pd into the perovskite was critical to maintaining its performance. The perovskite phase remained unchanged, even after the third run (Fig. 7 ). In fact, perovskite is well known for its durability, especially at high temperature, which is thus more applicable for industry [4]. The high recyclability of the catalyst is likely due to the incorporation of Pd into the perovskite, which prevents leaching or Pd aggregation (which is commonly observed for supported Pd on conventional supports). This reversible process occurs easily because small Pd particles could be reduced or oxidized even at room temperature [14,18]. 3.2.5 Plausible mechanism Based on the results and discussion above, we proposed a plausible mechanism as shown in Scheme 2 . The incorporated Pd is first reduced by the alcohols and then moved onto the perovskite face. This process produced aldehydes/ketones (Scheme S1); thus, under an oxygen-free condition, a small amount of product could be detected (Table 4, entry 4). Meanwhile, Pd could promote oxidant-free dehydrogenation; however, the adsorbed byproducts could not be effectively removed in the absence of oxygen [17]. This phenomenon was also observed by Keresszegi et al. [20] with 10.7% of conversion (Ar, Pd/Al2O3) and by Savara et al. [21] (N2, Pd/C). Grunwaldt et al. [17] proved by using in situ XAS (X-ray absorption spectroscopy) that “Pd0 is the active phase for aerobic dehydrogenation”. Interestingly, after being reoxidized by O2, the Pd0 on the surface could be reversibly reincorporated into the perovskite lattice, which will thus prevent leaching or sintering [6]. The lack of a significant inhibition effect of a radical scavenger (TEMPO, 1 mol eq. to Pd) suggests that the reaction did not proceeded via a radical mechanism. Bürgi et al. [22] reported the formation of a Pd-alkoxide intermediate by in situ ATR spectroscopy analysis. Hydrogen abstraction from the alcohol will produce adsorbed hydrogen while the oxidation state of Pd was increased. The adsorbed hydrogen could also be used for alkenes hydrogenation. We proved that aerobic dehydrogenation occurs by gas consumption testing as discussed above. The use of O2 as an oxidant is highly desirable in green chemistry [23]. Some researchers proposed that the adsorbed hydrogen could be oxidized by O2 to produce water. Oxygen could also remove the adsorbed decomposition byproducts, i.e., CO [17]. A considerable increase in the reaction by the addition of molecular sieves suggests its role to absorb the water byproduct. Finally, Pd could be reversibly reincorporated into the lattice, thus maintaining its high recyclability. 4 Conclusion Pd-STO perovskites with a tunable particle size and porosity have been successfully synthesized via low-temperature hydrothermal method (373 K) without any posterior calcination. Porosity of the Pd-STO perovskites play an important role for obtaining the high yield on alcohol oxidation with molecular oxygen. Both refluxing of the non-polar solvents and addition of molecular sieves enhanced the reaction yield significantly. We demonstrated that the recyclability could be maintained by the incorporation of Pd into the perovskites. We believe this facile method could also be applied for the fabrication of other transition metal-contained perovskite catalysts. Acknowledgements This study was financially supported in part by JSPS KAKENHI Grant Number 15K06565 and the JSPS Bilateral Joint Research Project (2014-2017). Appendix A Supplementary data Supplementary data associated with this article can be found, in the online version, at http://dx.doi.org/10.1016/j.mcat.2018.04.023. Appendix A Supplementary data The following is Supplementary data to this article: References [1] T. Screen Platin. Met. Rev. 51 2007 87 [2] (a) N. Kakiuchi T. Nishimura M. Inoue S. Uemura Bull. Chem. Soc. Jpn. 74 2001 165 (b) G. Wu G.L. Brett E. Cao A. Constantinou P. Ellis S. Kuhn G.J. Hutchings D. Bethell A. Gavriilidis Catal. Sci. Technol. 6 2016 4749 (c) F. Fotouhi-Far H. Bashiri M. Hamadanian Propellants Explos. Pyrotech. 42 2017 213 [3] (a) H. Tanaka M. Uenishi M. Taniguchi I. Tan K. Narita M. Kimura K. Kaneko Y. Nishihata J. Mizuki Catal. Today 117 321 2006 (b) H. Tanaka I. Tan M. Uenishi M. Taniguchi M. Kimura Y. Nishihata J. Mizuki J. Alloys Compd. 408–412 2006 1071 [4] (a) J. Zhu H. Li L. Zhong P. Xiao X. Xu X. Yang Z. Zhao J. Li ACS Catal. 4 2014 2917 (b) A. Mishra R. Prasad Catal. Rev. Sci. Eng. 56 2014 57 (c) S. Royer D. Duprez F. Can X. Courtois C. Batiot-Dupeyrat S. Laassiri H. Alamdari Chem. Rev. 114 2014 10292 (d) H. Zhu P. Zhang S. Dai ACS Catal. 5 2015 6370 [5] (a) C.H. Kim G. Qi K. Dahlberg W. Li Science 327 2010 1624 (b) V. Albaladejo-Fuentes F.E. López-Suárez M.S. Sánchez-Adsuar M.J. Illán-Gómez Appl. Catal. A 488 2014 189 (c) J.T. Mefford W.G. Hardin S. Dai K.P. Johnston K.J. Stevenson Nature Mater. 13 2014 726 (d) S.K. Megarajan S. Rayalu M. Nishibori Y. Teraoka N. Labhsetwar ACS Catal. 5 2015 301 (e) A. Staykov H. Téllez T. Akbay J. Druce T. Ishihara J. Kilner Chem. Mater. 27 2015 8273 [6] (a) Y. Nishihata J. Mizuki T. Akao H. Tanaka M. Uenishi M. Kimura T. Okamoto N. Hamada Nature 418 2002 164 (b) A. Eyssler P. Mandaliev A. Winkler P. Hug O. Safonova R. Figi A. Weidenkaff D. Ferri J. Phys. Chem. C 114 2010 4584 (c) I. Hamada A. Uozumi Y. Morikawa A. Yanase H. Katayama-Yoshida J. Am. Chem. Soc. 133 2011 18506 (d) M.B. Katz G.W. Graham Y. Duan H. Liu C. Adamo D.G. Schlom X. Pan J. Am. Chem. Soc. 133 2011 18090 (e) A. Essoumhi S.E. Kazzouli M. Bousmina J. Nanosci. Nanotechnol. 14 2014 2012 [7] (a) U.G. Singh J. Li J.W. Bennett A.M. Rappe R. Seshadri S.L. Scott J. Catal. 249 2007 349 (b) K. Shiro I. Yamada N. Ikeda K. Ohgushi M. Mizumaki R. Takahashi N. Nishiyama T. Inoue T. Irifune Inorg. Chem. 52 2013 1604 (c) M. Kimura Y. Niwa K. Uemura T. Nagai Y. Inada M. Nomura Mater. Trans. 54 2013 246 [8] (a) K. Zhou H. Chen Q. Tian Z. Hao D. Shen X. Xu J. Mol. Catal. A Chem. 189 2002 225 (b) S. Petrović L. Karanović P.K. Stefanov M. Zdujić A. Terlecki-Baričević Appl. Catal. B Environ. 58 2005 133 (c) G.C.M. Rodríguez K. Kelm B. Saruhan Appl. Catal. A Gen. 387 2010 173 (d) B. Kucharczyk Catal. Lett. 145 2015 1237 [9] (a) E. Tzimpilis N. Moschoudis M. Stoukides P. Bekiaroglou Appl. Catal. B Environ. 84 2008 607 (b) E. Tzimpilis N. Moschoudis M. Stoukides P. Bekiaroglou Appl. Catal. B Environ. 87 2009 9 (c) R. Watanabe Y. Sekine H. Takamatsu Y. Sakamoto S. Aramaki M. Matsukata E. Kikuchi Top. Catal. 53 2010 621 (d) X. Zhang H. Li Y. Li W. Shen Catal. Lett. 142 2012 118 (e) Z. Say M. Dogac E.I. Vovk Y.E. Kalay C.H. Kim W. Li E. Ozensoy Appl. Catal. B Environ. 154–155 2014 51 (f) D.Y. Yoon Y.J. Kim J.H. Lim B.K. Cho S.B. Hong I.S. Nam J.W. Choung J. Catal. 330 2015 71 (g) V.Y. Zenou D.E. Fowler R. Gautier S.A. Barnett K.R. Poeppelmeier L.D. Marks Solid State Ionics 296 2016 90 [10] I.B. Adilina T. Hara N. Ichikuni N. Kumada S. Shimazu Bull. Chem. Soc. Jpn. 86 2013 146 [11] (a) S.K. Nikam A.A. Athawale Mater. Chem. Phys. 155 2015 104 (b) D.D. Athayde D.F. Souza A.M.A. Silva D. Vasconcelos E.H.M. Nunes J.C. Diniz da Costa W.L. Vasconcelos Ceram. Int. 42 2016 6555 [12] E. Grabowska Appl. Catal. B Environ. 186 2016 97 [13] (a) T. Sugimoto T. Kojima J. Phys. Chem. C 112 2008 18437 (b) T. Kojima T. Sugimoto J. Phys. Chem. C 112 2008 18445 (c) T. Sugimoto T. Kojima J. Phys. Chem. C 112 2008 18760 (d) T. Kojima T. Baba K. Ota C. Yukita K. Inamoto N. Uekawa J. Ceram. Soc. Jpn. 124 2016 1226 [14] A. Baylet P. Marécot D. Duprez P. Castellazzi G. Groppi P. Forzatti Phys. Chem. Chem. Phys. 13 2011 4607 [15] M. Besson P. Gallezot C. Pinel Chem. Rev. 114 2014 1827 [16] B.A. Steinhoff A.E. King S.S. Stahl J. Org. Chem. 71 2006 1861 [17] (a) J. Grunwaldt C. Keresszegi T. Malat A. Baiker J. Catal. 213 2003 291 (b) J. Grunwaldt M. Caravati A. Baiker J. Phys. Chem. B. 110 2006 25586 [18] A. Jürgensen N. Heutz H. Raschke K. Merz R. Hegenröder Anal. Chem. 87 2015 7848 [19] J. Yi J.T. Miller D.Y. Zemlyanov R. Zhang P.J. Dietrich F.H. Ribeiro S. Suslov M.M. Abu-Omar Angew. Chem. 126 2014 852 [20] C. Keresszegi T. Bürgi T. Mallat A. Baiker J. Catal. 211 2002 244 [21] (a) A. Savara C.E. Chan-Thaw I. Rossetti A. Villa L. Prati ChemCatChem 6 2014 3464 (b) A. Savara I. Rossetti C.E. Chan-Thaw L. Prati A. Villa ChemCatChem 8 2016 2482 [22] (a) T. Bürgi M. Bieri J. Phys. Chem. B 108 2004 13364 (b) T. Bürgi J. Catal. 229 2005 55 [23] (a) T. Matsumoto M. Ueno N. Wang S. Kobayashi Chem. Asian J. 3 2008 196 (b) C. Parmeggiani F. Cardona Green Chem. 14 2012 547",
      "scopus-id": "85046790529",
      "coredata": {
        "eid": "1-s2.0-S2468823118301652",
        "dc:description": "We successfully prepared Pd-containing perovskite strontium titanate (Pd-STO) by a relatively low-temperature hydrothermal method (i.e., 373 K) without posterior calcination. The particle size and porosity of the STO perovskite could be tuned by changing the molar ratio of H2O/NH3 (e.g., 5.0, 12.5 and 25.0) during the preparation of the amorphous titania sources. The mesoporous contained Pd-STO(12.5) showed superior catalytic performance compared to that of the other Pd-STO(x) (x = H2O/NH3) perovskites for alcohol oxidation with molecular oxygen. Both the refluxing of the non-polar solvents and addition of molecular sieves enhanced the reaction yield significantly. The Pd-incorporated perovskite (Pd-STO) showed better recyclability compared with that of the impregnated perovskite (imp-Pd/STO).",
        "openArchiveArticle": "false",
        "prism:coverDate": "2018-07-31",
        "openaccessUserLicense": null,
        "prism:aggregationType": "Journal",
        "prism:url": "https://api.elsevier.com/content/article/pii/S2468823118301652",
        "dc:creator": [
          {
            "@_fa": "true",
            "$": "Saputra, Leo"
          },
          {
            "@_fa": "true",
            "$": "Kojima, Takashi"
          },
          {
            "@_fa": "true",
            "$": "Hara, Takayoshi"
          },
          {
            "@_fa": "true",
            "$": "Ichikuni, Nobuyuki"
          },
          {
            "@_fa": "true",
            "$": "Shimazu, Shogo"
          }
        ],
        "link": [
          {
            "@_fa": "true",
            "@rel": "self",
            "@href": "https://api.elsevier.com/content/article/pii/S2468823118301652"
          },
          {
            "@_fa": "true",
            "@rel": "scidir",
            "@href": "https://www.sciencedirect.com/science/article/pii/S2468823118301652"
          }
        ],
        "dc:format": "application/json",
        "openaccessType": null,
        "pii": "S2468-8231(18)30165-2",
        "prism:volume": "453",
        "prism:publisher": "Elsevier B.V.",
        "dc:title": "Recyclable Pd-contained perovskite catalyst synthesized by a low temperature hydrothermal method for aerobic alcohol oxidation",
        "prism:copyright": "© 2018 Elsevier B.V. All rights reserved.",
        "openaccess": "0",
        "prism:issn": "24688231",
        "dcterms:subject": [
          {
            "@_fa": "true",
            "$": "Pd-contained perovskite"
          },
          {
            "@_fa": "true",
            "$": "Intelligent catalyst"
          },
          {
            "@_fa": "true",
            "$": "Hydrothermal synthesis"
          },
          {
            "@_fa": "true",
            "$": "Aerobic alcohol oxidation"
          }
        ],
        "openaccessArticle": "false",
        "prism:publicationName": "Molecular Catalysis",
        "openaccessSponsorType": null,
        "prism:pageRange": "132-138",
        "prism:endingPage": "138",
        "pubType": "fla",
        "prism:coverDisplayDate": "July 2018",
        "prism:doi": "10.1016/j.mcat.2018.04.023",
        "prism:startingPage": "132",
        "dc:identifier": "doi:10.1016/j.mcat.2018.04.023",
        "openaccessSponsorName": null
      },
      "objects": {
        "object": [
          {
            "@category": "thumbnail",
            "@height": "149",
            "@width": "219",
            "@_fa": "true",
            "$": "https://api.elsevier.com/content/object/eid/1-s2.0-S2468823118301652-fx1.sml?httpAccept=%2A%2F%2A",
            "@multimediatype": "GIF image file",
            "@type": "IMAGE-THUMBNAIL",
            "@size": "10702",
            "@ref": "fx1",
            "@mimetype": "image/gif"
          },
          {
            "@category": "thumbnail",
            "@height": "210",
            "@width": "216",
            "@_fa": "true",
            "$": "https://api.elsevier.com/content/object/eid/1-s2.0-S2468823118301652-fx10.sml?httpAccept=%2A%2F%2A",
            "@multimediatype": "GIF image file",
            "@type": "IMAGE-THUMBNAIL",
            "@size": "5457",
            "@ref": "fx10",
            "@mimetype": "image/gif"
          },
          {
            "@category": "thumbnail",
            "@height": "123",
            "@width": "210",
            "@_fa": "true",
            "$": "https://api.elsevier.com/content/object/eid/1-s2.0-S2468823118301652-fx11.sml?httpAccept=%2A%2F%2A",
            "@multimediatype": "GIF image file",
            "@type": "IMAGE-THUMBNAIL",
            "@size": "5566",
            "@ref": "fx11",
            "@mimetype": "image/gif"
          },
          {
            "@category": "thumbnail",
            "@height": "121",
            "@width": "179",
            "@_fa": "true",
            "$": "https://api.elsevier.com/content/object/eid/1-s2.0-S2468823118301652-fx12.sml?httpAccept=%2A%2F%2A",
            "@multimediatype": "GIF image file",
            "@type": "IMAGE-THUMBNAIL",
            "@size": "5087",
            "@ref": "fx12",
            "@mimetype": "image/gif"
          },
          {
            "@category": "thumbnail",
            "@height": "105",
            "@width": "219",
            "@_fa": "true",
            "$": "https://api.elsevier.com/content/object/eid/1-s2.0-S2468823118301652-fx13.sml?httpAccept=%2A%2F%2A",
            "@multimediatype": "GIF image file",
            "@type": "IMAGE-THUMBNAIL",
            "@size": "3557",
            "@ref": "fx13",
            "@mimetype": "image/gif"
          },
          {
            "@category": "thumbnail",
            "@height": "122",
            "@width": "219",
            "@_fa": "true",
            "$": "https://api.elsevier.com/content/object/eid/1-s2.0-S2468823118301652-fx14.sml?httpAccept=%2A%2F%2A",
            "@multimediatype": "GIF image file",
            "@type": "IMAGE-THUMBNAIL",
            "@size": "4072",
            "@ref": "fx14",
            "@mimetype": "image/gif"
          },
          {
            "@category": "thumbnail",
            "@height": "143",
            "@width": "219",
            "@_fa": "true",
            "$": "https://api.elsevier.com/content/object/eid/1-s2.0-S2468823118301652-fx15.sml?httpAccept=%2A%2F%2A",
            "@multimediatype": "GIF image file",
            "@type": "IMAGE-THUMBNAIL",
            "@size": "5125",
            "@ref": "fx15",
            "@mimetype": "image/gif"
          },
          {
            "@category": "thumbnail",
            "@height": "162",
            "@width": "219",
            "@_fa": "true",
            "$": "https://api.elsevier.com/content/object/eid/1-s2.0-S2468823118301652-fx16.sml?httpAccept=%2A%2F%2A",
            "@multimediatype": "GIF image file",
            "@type": "IMAGE-THUMBNAIL",
            "@size": "3885",
            "@ref": "fx16",
            "@mimetype": "image/gif"
          },
          {
            "@category": "thumbnail",
            "@height": "117",
            "@width": "208",
            "@_fa": "true",
            "$": "https://api.elsevier.com/content/object/eid/1-s2.0-S2468823118301652-fx17.sml?httpAccept=%2A%2F%2A",
            "@multimediatype": "GIF image file",
            "@type": "IMAGE-THUMBNAIL",
            "@size": "5113",
            "@ref": "fx17",
            "@mimetype": "image/gif"
          },
          {
            "@category": "thumbnail",
            "@height": "120",
            "@width": "185",
            "@_fa": "true",
            "$": "https://api.elsevier.com/content/object/eid/1-s2.0-S2468823118301652-fx18.sml?httpAccept=%2A%2F%2A",
            "@multimediatype": "GIF image file",
            "@type": "IMAGE-THUMBNAIL",
            "@size": "5021",
            "@ref": "fx18",
            "@mimetype": "image/gif"
          },
          {
            "@category": "thumbnail",
            "@height": "52",
            "@width": "212",
            "@_fa": "true",
            "$": "https://api.elsevier.com/content/object/eid/1-s2.0-S2468823118301652-fx19.sml?httpAccept=%2A%2F%2A",
            "@multimediatype": "GIF image file",
            "@type": "IMAGE-THUMBNAIL",
            "@size": "1898",
            "@ref": "fx19",
            "@mimetype": "image/gif"
          },
          {
            "@category": "thumbnail",
            "@height": "55",
            "@width": "219",
            "@_fa": "true",
            "$": "https://api.elsevier.com/content/object/eid/1-s2.0-S2468823118301652-fx2.sml?httpAccept=%2A%2F%2A",
            "@multimediatype": "GIF image file",
            "@type": "IMAGE-THUMBNAIL",
            "@size": "2965",
            "@ref": "fx2",
            "@mimetype": "image/gif"
          },
          {
            "@category": "thumbnail",
            "@height": "59",
            "@width": "179",
            "@_fa": "true",
            "$": "https://api.elsevier.com/content/object/eid/1-s2.0-S2468823118301652-fx20.sml?httpAccept=%2A%2F%2A",
            "@multimediatype": "GIF image file",
            "@type": "IMAGE-THUMBNAIL",
            "@size": "1867",
            "@ref": "fx20",
            "@mimetype": "image/gif"
          },
          {
            "@category": "thumbnail",
            "@height": "58",
            "@width": "219",
            "@_fa": "true",
            "$": "https://api.elsevier.com/content/object/eid/1-s2.0-S2468823118301652-fx21.sml?httpAccept=%2A%2F%2A",
            "@multimediatype": "GIF image file",
            "@type": "IMAGE-THUMBNAIL",
            "@size": "2956",
            "@ref": "fx21",
            "@mimetype": "image/gif"
          },
          {
            "@category": "thumbnail",
            "@height": "70",
            "@width": "208",
            "@_fa": "true",
            "$": "https://api.elsevier.com/content/object/eid/1-s2.0-S2468823118301652-fx22.sml?httpAccept=%2A%2F%2A",
            "@multimediatype": "GIF image file",
            "@type": "IMAGE-THUMBNAIL",
            "@size": "2728",
            "@ref": "fx22",
            "@mimetype": "image/gif"
          },
          {
            "@category": "thumbnail",
            "@height": "118",
            "@width": "142",
            "@_fa": "true",
            "$": "https://api.elsevier.com/content/object/eid/1-s2.0-S2468823118301652-fx3.sml?httpAccept=%2A%2F%2A",
            "@multimediatype": "GIF image file",
            "@type": "IMAGE-THUMBNAIL",
            "@size": "3919",
            "@ref": "fx3",
            "@mimetype": "image/gif"
          },
          {
            "@category": "thumbnail",
            "@height": "119",
            "@width": "142",
            "@_fa": "true",
            "$": "https://api.elsevier.com/content/object/eid/1-s2.0-S2468823118301652-fx4.sml?httpAccept=%2A%2F%2A",
            "@multimediatype": "GIF image file",
            "@type": "IMAGE-THUMBNAIL",
            "@size": "3645",
            "@ref": "fx4",
            "@mimetype": "image/gif"
          },
          {
            "@category": "thumbnail",
            "@height": "158",
            "@width": "199",
            "@_fa": "true",
            "$": "https://api.elsevier.com/content/object/eid/1-s2.0-S2468823118301652-fx5.sml?httpAccept=%2A%2F%2A",
            "@multimediatype": "GIF image file",
            "@type": "IMAGE-THUMBNAIL",
            "@size": "5171",
            "@ref": "fx5",
            "@mimetype": "image/gif"
          },
          {
            "@category": "thumbnail",
            "@height": "165",
            "@width": "211",
            "@_fa": "true",
            "$": "https://api.elsevier.com/content/object/eid/1-s2.0-S2468823118301652-fx6.sml?httpAccept=%2A%2F%2A",
            "@multimediatype": "GIF image file",
            "@type": "IMAGE-THUMBNAIL",
            "@size": "5087",
            "@ref": "fx6",
            "@mimetype": "image/gif"
          },
          {
            "@category": "thumbnail",
            "@height": "168",
            "@width": "209",
            "@_fa": "true",
            "$": "https://api.elsevier.com/content/object/eid/1-s2.0-S2468823118301652-fx7.sml?httpAccept=%2A%2F%2A",
            "@multimediatype": "GIF image file",
            "@type": "IMAGE-THUMBNAIL",
            "@size": "5863",
            "@ref": "fx7",
            "@mimetype": "image/gif"
          },
          {
            "@category": "thumbnail",
            "@height": "164",
            "@width": "201",
            "@_fa": "true",
            "$": "https://api.elsevier.com/content/object/eid/1-s2.0-S2468823118301652-fx8.sml?httpAccept=%2A%2F%2A",
            "@multimediatype": "GIF image file",
            "@type": "IMAGE-THUMBNAIL",
            "@size": "4575",
            "@ref": "fx8",
            "@mimetype": "image/gif"
          },
          {
            "@category": "thumbnail",
            "@height": "186",
            "@width": "213",
            "@_fa": "true",
            "$": "https://api.elsevier.com/content/object/eid/1-s2.0-S2468823118301652-fx9.sml?httpAccept=%2A%2F%2A",
            "@multimediatype": "GIF image file",
            "@type": "IMAGE-THUMBNAIL",
            "@size": "5684",
            "@ref": "fx9",
            "@mimetype": "image/gif"
          },
          {
            "@category": "thumbnail",
            "@height": "89",
            "@width": "219",
            "@_fa": "true",
            "$": "https://api.elsevier.com/content/object/eid/1-s2.0-S2468823118301652-gr1.sml?httpAccept=%2A%2F%2A",
            "@multimediatype": "GIF image file",
            "@type": "IMAGE-THUMBNAIL",
            "@size": "7582",
            "@ref": "gr1",
            "@mimetype": "image/gif"
          },
          {
            "@category": "thumbnail",
            "@height": "146",
            "@width": "219",
            "@_fa": "true",
            "$": "https://api.elsevier.com/content/object/eid/1-s2.0-S2468823118301652-gr2.sml?httpAccept=%2A%2F%2A",
            "@multimediatype": "GIF image file",
            "@type": "IMAGE-THUMBNAIL",
            "@size": "13042",
            "@ref": "gr2",
            "@mimetype": "image/gif"
          },
          {
            "@category": "thumbnail",
            "@height": "164",
            "@width": "208",
            "@_fa": "true",
            "$": "https://api.elsevier.com/content/object/eid/1-s2.0-S2468823118301652-gr3.sml?httpAccept=%2A%2F%2A",
            "@multimediatype": "GIF image file",
            "@type": "IMAGE-THUMBNAIL",
            "@size": "6548",
            "@ref": "gr3",
            "@mimetype": "image/gif"
          },
          {
            "@category": "thumbnail",
            "@height": "110",
            "@width": "219",
            "@_fa": "true",
            "$": "https://api.elsevier.com/content/object/eid/1-s2.0-S2468823118301652-gr4.sml?httpAccept=%2A%2F%2A",
            "@multimediatype": "GIF image file",
            "@type": "IMAGE-THUMBNAIL",
            "@size": "11516",
            "@ref": "gr4",
            "@mimetype": "image/gif"
          },
          {
            "@category": "thumbnail",
            "@height": "164",
            "@width": "212",
            "@_fa": "true",
            "$": "https://api.elsevier.com/content/object/eid/1-s2.0-S2468823118301652-gr5.sml?httpAccept=%2A%2F%2A",
            "@multimediatype": "GIF image file",
            "@type": "IMAGE-THUMBNAIL",
            "@size": "6280",
            "@ref": "gr5",
            "@mimetype": "image/gif"
          },
          {
            "@category": "thumbnail",
            "@height": "164",
            "@width": "218",
            "@_fa": "true",
            "$": "https://api.elsevier.com/content/object/eid/1-s2.0-S2468823118301652-gr6.sml?httpAccept=%2A%2F%2A",
            "@multimediatype": "GIF image file",
            "@type": "IMAGE-THUMBNAIL",
            "@size": "4650",
            "@ref": "gr6",
            "@mimetype": "image/gif"
          },
          {
            "@category": "thumbnail",
            "@height": "164",
            "@width": "207",
            "@_fa": "true",
            "$": "https://api.elsevier.com/content/object/eid/1-s2.0-S2468823118301652-gr7.sml?httpAccept=%2A%2F%2A",
            "@multimediatype": "GIF image file",
            "@type": "IMAGE-THUMBNAIL",
            "@size": "5574",
            "@ref": "gr7",
            "@mimetype": "image/gif"
          },
          {
            "@category": "thumbnail",
            "@height": "97",
            "@width": "219",
            "@_fa": "true",
            "$": "https://api.elsevier.com/content/object/eid/1-s2.0-S2468823118301652-sc1.sml?httpAccept=%2A%2F%2A",
            "@multimediatype": "GIF image file",
            "@type": "IMAGE-THUMBNAIL",
            "@size": "3544",
            "@ref": "sc1",
            "@mimetype": "image/gif"
          },
          {
            "@category": "thumbnail",
            "@height": "164",
            "@width": "191",
            "@_fa": "true",
            "$": "https://api.elsevier.com/content/object/eid/1-s2.0-S2468823118301652-sc2.sml?httpAccept=%2A%2F%2A",
            "@multimediatype": "GIF image file",
            "@type": "IMAGE-THUMBNAIL",
            "@size": "5749",
            "@ref": "sc2",
            "@mimetype": "image/gif"
          },
          {
            "@category": "standard",
            "@height": "200",
            "@width": "294",
            "@_fa": "true",
            "$": "https://api.elsevier.com/content/object/eid/1-s2.0-S2468823118301652-fx1.jpg?httpAccept=%2A%2F%2A",
            "@multimediatype": "JPEG image file",
            "@type": "IMAGE-DOWNSAMPLED",
            "@size": "23415",
            "@ref": "fx1",
            "@mimetype": "image/jpeg"
          },
          {
            "@category": "standard",
            "@height": "47",
            "@width": "48",
            "@_fa": "true",
            "$": "https://api.elsevier.com/content/object/eid/1-s2.0-S2468823118301652-fx10.jpg?httpAccept=%2A%2F%2A",
            "@multimediatype": "JPEG image file",
            "@type": "IMAGE-DOWNSAMPLED",
            "@size": "905",
            "@ref": "fx10",
            "@mimetype": "image/jpeg"
          },
          {
            "@category": "standard",
            "@height": "28",
            "@width": "47",
            "@_fa": "true",
            "$": "https://api.elsevier.com/content/object/eid/1-s2.0-S2468823118301652-fx11.jpg?httpAccept=%2A%2F%2A",
            "@multimediatype": "JPEG image file",
            "@type": "IMAGE-DOWNSAMPLED",
            "@size": "864",
            "@ref": "fx11",
            "@mimetype": "image/jpeg"
          },
          {
            "@category": "standard",
            "@height": "27",
            "@width": "40",
            "@_fa": "true",
            "$": "https://api.elsevier.com/content/object/eid/1-s2.0-S2468823118301652-fx12.jpg?httpAccept=%2A%2F%2A",
            "@multimediatype": "JPEG image file",
            "@type": "IMAGE-DOWNSAMPLED",
            "@size": "774",
            "@ref": "fx12",
            "@mimetype": "image/jpeg"
          },
          {
            "@category": "standard",
            "@height": "33",
            "@width": "68",
            "@_fa": "true",
            "$": "https://api.elsevier.com/content/object/eid/1-s2.0-S2468823118301652-fx13.jpg?httpAccept=%2A%2F%2A",
            "@multimediatype": "JPEG image file",
            "@type": "IMAGE-DOWNSAMPLED",
            "@size": "1108",
            "@ref": "fx13",
            "@mimetype": "image/jpeg"
          },
          {
            "@category": "standard",
            "@height": "33",
            "@width": "59",
            "@_fa": "true",
            "$": "https://api.elsevier.com/content/object/eid/1-s2.0-S2468823118301652-fx14.jpg?httpAccept=%2A%2F%2A",
            "@multimediatype": "JPEG image file",
            "@type": "IMAGE-DOWNSAMPLED",
            "@size": "1068",
            "@ref": "fx14",
            "@mimetype": "image/jpeg"
          },
          {
            "@category": "standard",
            "@height": "38",
            "@width": "58",
            "@_fa": "true",
            "$": "https://api.elsevier.com/content/object/eid/1-s2.0-S2468823118301652-fx15.jpg?httpAccept=%2A%2F%2A",
            "@multimediatype": "JPEG image file",
            "@type": "IMAGE-DOWNSAMPLED",
            "@size": "1250",
            "@ref": "fx15",
            "@mimetype": "image/jpeg"
          },
          {
            "@category": "standard",
            "@height": "40",
            "@width": "54",
            "@_fa": "true",
            "$": "https://api.elsevier.com/content/object/eid/1-s2.0-S2468823118301652-fx16.jpg?httpAccept=%2A%2F%2A",
            "@multimediatype": "JPEG image file",
            "@type": "IMAGE-DOWNSAMPLED",
            "@size": "1237",
            "@ref": "fx16",
            "@mimetype": "image/jpeg"
          },
          {
            "@category": "standard",
            "@height": "26",
            "@width": "47",
            "@_fa": "true",
            "$": "https://api.elsevier.com/content/object/eid/1-s2.0-S2468823118301652-fx17.jpg?httpAccept=%2A%2F%2A",
            "@multimediatype": "JPEG image file",
            "@type": "IMAGE-DOWNSAMPLED",
            "@size": "867",
            "@ref": "fx17",
            "@mimetype": "image/jpeg"
          },
          {
            "@category": "standard",
            "@height": "27",
            "@width": "41",
            "@_fa": "true",
            "$": "https://api.elsevier.com/content/object/eid/1-s2.0-S2468823118301652-fx18.jpg?httpAccept=%2A%2F%2A",
            "@multimediatype": "JPEG image file",
            "@type": "IMAGE-DOWNSAMPLED",
            "@size": "875",
            "@ref": "fx18",
            "@mimetype": "image/jpeg"
          },
          {
            "@category": "standard",
            "@height": "12",
            "@width": "47",
            "@_fa": "true",
            "$": "https://api.elsevier.com/content/object/eid/1-s2.0-S2468823118301652-fx19.jpg?httpAccept=%2A%2F%2A",
            "@multimediatype": "JPEG image file",
            "@type": "IMAGE-DOWNSAMPLED",
            "@size": "733",
            "@ref": "fx19",
            "@mimetype": "image/jpeg"
          },
          {
            "@category": "standard",
            "@height": "72",
            "@width": "289",
            "@_fa": "true",
            "$": "https://api.elsevier.com/content/object/eid/1-s2.0-S2468823118301652-fx2.jpg?httpAccept=%2A%2F%2A",
            "@multimediatype": "JPEG image file",
            "@type": "IMAGE-DOWNSAMPLED",
            "@size": "5907",
            "@ref": "fx2",
            "@mimetype": "image/jpeg"
          },
          {
            "@category": "standard",
            "@height": "13",
            "@width": "40",
            "@_fa": "true",
            "$": "https://api.elsevier.com/content/object/eid/1-s2.0-S2468823118301652-fx20.jpg?httpAccept=%2A%2F%2A",
            "@multimediatype": "JPEG image file",
            "@type": "IMAGE-DOWNSAMPLED",
            "@size": "681",
            "@ref": "fx20",
            "@mimetype": "image/jpeg"
          },
          {
            "@category": "standard",
            "@height": "15",
            "@width": "56",
            "@_fa": "true",
            "$": "https://api.elsevier.com/content/object/eid/1-s2.0-S2468823118301652-fx21.jpg?httpAccept=%2A%2F%2A",
            "@multimediatype": "JPEG image file",
            "@type": "IMAGE-DOWNSAMPLED",
            "@size": "865",
            "@ref": "fx21",
            "@mimetype": "image/jpeg"
          },
          {
            "@category": "standard",
            "@height": "16",
            "@width": "47",
            "@_fa": "true",
            "$": "https://api.elsevier.com/content/object/eid/1-s2.0-S2468823118301652-fx22.jpg?httpAccept=%2A%2F%2A",
            "@multimediatype": "JPEG image file",
            "@type": "IMAGE-DOWNSAMPLED",
            "@size": "807",
            "@ref": "fx22",
            "@mimetype": "image/jpeg"
          },
          {
            "@category": "standard",
            "@height": "27",
            "@width": "32",
            "@_fa": "true",
            "$": "https://api.elsevier.com/content/object/eid/1-s2.0-S2468823118301652-fx3.jpg?httpAccept=%2A%2F%2A",
            "@multimediatype": "JPEG image file",
            "@type": "IMAGE-DOWNSAMPLED",
            "@size": "659",
            "@ref": "fx3",
            "@mimetype": "image/jpeg"
          },
          {
            "@category": "standard",
            "@height": "27",
            "@width": "32",
            "@_fa": "true",
            "$": "https://api.elsevier.com/content/object/eid/1-s2.0-S2468823118301652-fx4.jpg?httpAccept=%2A%2F%2A",
            "@multimediatype": "JPEG image file",
            "@type": "IMAGE-DOWNSAMPLED",
            "@size": "634",
            "@ref": "fx4",
            "@mimetype": "image/jpeg"
          },
          {
            "@category": "standard",
            "@height": "35",
            "@width": "44",
            "@_fa": "true",
            "$": "https://api.elsevier.com/content/object/eid/1-s2.0-S2468823118301652-fx5.jpg?httpAccept=%2A%2F%2A",
            "@multimediatype": "JPEG image file",
            "@type": "IMAGE-DOWNSAMPLED",
            "@size": "939",
            "@ref": "fx5",
            "@mimetype": "image/jpeg"
          },
          {
            "@category": "standard",
            "@height": "37",
            "@width": "47",
            "@_fa": "true",
            "$": "https://api.elsevier.com/content/object/eid/1-s2.0-S2468823118301652-fx6.jpg?httpAccept=%2A%2F%2A",
            "@multimediatype": "JPEG image file",
            "@type": "IMAGE-DOWNSAMPLED",
            "@size": "882",
            "@ref": "fx6",
            "@mimetype": "image/jpeg"
          },
          {
            "@category": "standard",
            "@height": "38",
            "@width": "47",
            "@_fa": "true",
            "$": "https://api.elsevier.com/content/object/eid/1-s2.0-S2468823118301652-fx7.jpg?httpAccept=%2A%2F%2A",
            "@multimediatype": "JPEG image file",
            "@type": "IMAGE-DOWNSAMPLED",
            "@size": "1012",
            "@ref": "fx7",
            "@mimetype": "image/jpeg"
          },
          {
            "@category": "standard",
            "@height": "40",
            "@width": "49",
            "@_fa": "true",
            "$": "https://api.elsevier.com/content/object/eid/1-s2.0-S2468823118301652-fx8.jpg?httpAccept=%2A%2F%2A",
            "@multimediatype": "JPEG image file",
            "@type": "IMAGE-DOWNSAMPLED",
            "@size": "976",
            "@ref": "fx8",
            "@mimetype": "image/jpeg"
          },
          {
            "@category": "standard",
            "@height": "42",
            "@width": "48",
            "@_fa": "true",
            "$": "https://api.elsevier.com/content/object/eid/1-s2.0-S2468823118301652-fx9.jpg?httpAccept=%2A%2F%2A",
            "@multimediatype": "JPEG image file",
            "@type": "IMAGE-DOWNSAMPLED",
            "@size": "942",
            "@ref": "fx9",
            "@mimetype": "image/jpeg"
          },
          {
            "@category": "standard",
            "@height": "230",
            "@width": "565",
            "@_fa": "true",
            "$": "https://api.elsevier.com/content/object/eid/1-s2.0-S2468823118301652-gr1.jpg?httpAccept=%2A%2F%2A",
            "@multimediatype": "JPEG image file",
            "@type": "IMAGE-DOWNSAMPLED",
            "@size": "37263",
            "@ref": "gr1",
            "@mimetype": "image/jpeg"
          },
          {
            "@category": "standard",
            "@height": "402",
            "@width": "602",
            "@_fa": "true",
            "$": "https://api.elsevier.com/content/object/eid/1-s2.0-S2468823118301652-gr2.jpg?httpAccept=%2A%2F%2A",
            "@multimediatype": "JPEG image file",
            "@type": "IMAGE-DOWNSAMPLED",
            "@size": "48749",
            "@ref": "gr2",
            "@mimetype": "image/jpeg"
          },
          {
            "@category": "standard",
            "@height": "268",
            "@width": "339",
            "@_fa": "true",
            "$": "https://api.elsevier.com/content/object/eid/1-s2.0-S2468823118301652-gr3.jpg?httpAccept=%2A%2F%2A",
            "@multimediatype": "JPEG image file",
            "@type": "IMAGE-DOWNSAMPLED",
            "@size": "21727",
            "@ref": "gr3",
            "@mimetype": "image/jpeg"
          },
          {
            "@category": "standard",
            "@height": "235",
            "@width": "470",
            "@_fa": "true",
            "$": "https://api.elsevier.com/content/object/eid/1-s2.0-S2468823118301652-gr4.jpg?httpAccept=%2A%2F%2A",
            "@multimediatype": "JPEG image file",
            "@type": "IMAGE-DOWNSAMPLED",
            "@size": "18300",
            "@ref": "gr4",
            "@mimetype": "image/jpeg"
          },
          {
            "@category": "standard",
            "@height": "263",
            "@width": "339",
            "@_fa": "true",
            "$": "https://api.elsevier.com/content/object/eid/1-s2.0-S2468823118301652-gr5.jpg?httpAccept=%2A%2F%2A",
            "@multimediatype": "JPEG image file",
            "@type": "IMAGE-DOWNSAMPLED",
            "@size": "20650",
            "@ref": "gr5",
            "@mimetype": "image/jpeg"
          },
          {
            "@category": "standard",
            "@height": "255",
            "@width": "339",
            "@_fa": "true",
            "$": "https://api.elsevier.com/content/object/eid/1-s2.0-S2468823118301652-gr6.jpg?httpAccept=%2A%2F%2A",
            "@multimediatype": "JPEG image file",
            "@type": "IMAGE-DOWNSAMPLED",
            "@size": "14436",
            "@ref": "gr6",
            "@mimetype": "image/jpeg"
          },
          {
            "@category": "standard",
            "@height": "268",
            "@width": "339",
            "@_fa": "true",
            "$": "https://api.elsevier.com/content/object/eid/1-s2.0-S2468823118301652-gr7.jpg?httpAccept=%2A%2F%2A",
            "@multimediatype": "JPEG image file",
            "@type": "IMAGE-DOWNSAMPLED",
            "@size": "16132",
            "@ref": "gr7",
            "@mimetype": "image/jpeg"
          },
          {
            "@category": "standard",
            "@height": "149",
            "@width": "339",
            "@_fa": "true",
            "$": "https://api.elsevier.com/content/object/eid/1-s2.0-S2468823118301652-sc1.jpg?httpAccept=%2A%2F%2A",
            "@multimediatype": "JPEG image file",
            "@type": "IMAGE-DOWNSAMPLED",
            "@size": "9255",
            "@ref": "sc1",
            "@mimetype": "image/jpeg"
          },
          {
            "@category": "standard",
            "@height": "403",
            "@width": "470",
            "@_fa": "true",
            "$": "https://api.elsevier.com/content/object/eid/1-s2.0-S2468823118301652-sc2.jpg?httpAccept=%2A%2F%2A",
            "@multimediatype": "JPEG image file",
            "@type": "IMAGE-DOWNSAMPLED",
            "@size": "30597",
            "@ref": "sc2",
            "@mimetype": "image/jpeg"
          },
          {
            "@category": "standard",
            "@_fa": "true",
            "$": "https://api.elsevier.com/content/object/eid/1-s2.0-S2468823118301652-mmc1.pdf?httpAccept=%2A%2F%2A",
            "@multimediatype": "Acrobat PDF file",
            "@type": "APPLICATION",
            "@size": "1017425",
            "@ref": "mmc1",
            "@mimetype": "application/pdf"
          }
        ]
      },
      "link": {
        "@rel": "abstract",
        "@href": "https://api.elsevier.com/content/abstract/scopus_id/85046790529"
      }
    }
  }
}