{
  "metadata": {
    "title": "Mesoporous covalent organic framework: An active photo-catalyst for formic acid synthesis through carbon dioxide reduction under visible light",
    "authors": "; ; ",
    "journal": "Molecular Catalysis",
    "date": "2020-03-31",
    "doi": "10.1016/j.mcat.2019.110730",
    "abstract": "",
    "uri": "https://api.elsevier.com/content/article/pii/S2468823119305929",
    "pii": "S2468823119305929"
  },
  "fulltext": {
    "full-text-retrieval-response": {
      "scopus-eid": "2-s2.0-85077929404",
      "originalText": "serial JL 315758 291210 291744 291790 291809 31 Molecular Catalysis MOLECULARCATALYSIS 2020-01-14 2020-01-14 2020-02-11 2020-02-11 2020-02-11T19:55:48 1-s2.0-S2468823119305929 S2468-8231(19)30592-9 S2468823119305929 10.1016/j.mcat.2019.110730 S300 S300.1 FULL-TEXT 1-s2.0-S2468823120X00034 2020-03-13T05:23:36.209797Z 0 0 20200301 20200331 2020 2020-01-14T19:41:21.410796Z absattachment articleinfo articlenumber articletitlenorm authfirstinitialnorm authfirstsurnamenorm cid cids contenttype copyright crossmark dateloaded dateloadedtxt datesearch datesort dateupdated dco docsubtype doctype doi eid ewtransactionid hubeid indexeddate issn issnnorm itemstage itemtransactionid itemweight openaccess openarchive pg pgfirst pii piinorm pubdateend pubdatestart pubdatetxt pubyr sectiontitle sortorder srctitle srctitlenorm srctype ssids alllist content subj subheadings suppl tomb volfirst volissue volumelist webpdf webpdfpagecount yearnav figure table e-component body acknowledge affil appendices articletitle auth authfirstini authfull authkeywords authlast footnotes grantnumber grantsponsor grantsponsorid highlightsabst orcid primabst ref specialabst 2468-8231 24688231 true 484 484 C Volume 484 26 110730 110730 110730 202003 March 2020 2020-03-01 2020-03-31 2020 Regular Papers article fla © 2019 Elsevier B.V. All rights reserved. MESOPOROUSCOVALENTORGANICFRAMEWORKACTIVEPHOTOCATALYSTFORFORMICACIDSYNTHESISTHROUGHCARBONDIOXIDEREDUCTIONUNDERVISIBLELIGHT SARKAR P 1 Introduction 2 Experimental 2.1 Materials and methods 2.2 Synthesis of mesoporous covalent organic framework (TFPG- DAAQ) 2.3 Procedure of formation of Formic acid using porous TFPG-DAAQ COF Photocatalyst 3 Results and discussion 3.1 Characterisation 3.1.1 Powder X-ray diffraction (PXRD) Analysis 3.1.2 FTIR analysis 3.1.3 UV-vis analysis 3.1.4 TGA analysis 3.1.5 Surface area measurement 3.1.6 Microscopic Analysis 3.2 Catalytic studies 3.3 Recyclability of TFPG- DAAQ COF catalyst 3.4 Heterogeneity test 4 Conclusion Declaration of Competing Interest Author statement Acknowledgements Appendix A Supplementary data References KUMAR 2012 541 569 B LEWIS 2006 15729 15735 N ARMAROLI 2007 52 66 N SONG 2011 749 768 W QUADRELLI 2007 5938 5952 R DMD 2010 6058 6082 A COKOJA 2011 8 5108537 M HE 2013 9620 9633 M KONDRATENKO 2013 3112 3135 E KLANKERMAYER 2016 7296 7343 J KLEIJ 2017 1036 1038 A BANERJEE 2016 215 219 A KATTEL 2017 1296 1299 S JULIAHERNANDEZ 2017 84 88 F RAO 2017 74 77 H BHANJA 2018 7278 7297 P MOTA 2019 205 F WALTER 2010 6446 M BI 2019 2069 2072 J JOYA 2013 10426 K KUDO 2009 253 A LI 2016 7485 7527 K CHANG 2016 2177 X LINGAMPALLI 2017 2740 2748 S LOGAN 2017 11854 11863 M KARAMIAN 2016 194 203 E GHOSH 2019 2648 2657 D NEATU 2014 5246 5262 S SHI 2019 641 649 Q INOUE 1979 637 T YADAV 2018 11 21 R DHAKSHINAMOORTHY 2012 9217 A TAN 2007 89 S ZHANG 2014 578 585 Q ZHANG 2019 110461 Z MARU 2018 23 30 M ZHI 2017 22933 Y YADAV 2016 9413 R LIN 2015 1208 1213 S CHENG 2018 185 194 M LIU 2017 9 19 H DING 2013 548 568 S BISBEY 2017 533 543 R BANERJEE 2018 400 409 T DING 2011 1289 1293 X BUTCHOSA 2014 4314 4324 C GHOSH 2019 4657 4666 S HALDER 2018 10941 10945 A CHONG 2003 3823 3826 J KARAK 2017 1856 1862 S FAN 2014 17 24 G SARKARX2020X110730 SARKARX2020X110730XP 2022-02-11T00:00:00.000Z 2022-02-11T00:00:00.000Z http://creativecommons.org/licenses/by-nc-nd/4.0/ © 2019 Elsevier B.V. All rights reserved. 2020-01-16T22:39:30.076Z http://vtw.elsevier.com/data/voc/AddOnTypes/50.7/nlp S2468823119305929 of India and Council of Scientific and Industrial and Research CSIR Council of Scientific and Industrial Research, India http://data.elsevier.com/vocabulary/SciValFunders/501100001412 http://sws.geonames.org/1269750/ CSIR 06/12/2016 CSIR Council of Scientific and Industrial Research, India http://data.elsevier.com/vocabulary/SciValFunders/501100001412 http://sws.geonames.org/1269750/ University Grants Commission UGC University Grants Commission http://data.elsevier.com/vocabulary/SciValFunders/501100001501 http://sws.geonames.org/1269750/ SMI thankfully acknowledges Department of Science and Technology, DST-SERB (project reference no. EMR/2016/004956), New Delhi, Govt. of India, Board of Research in Nuclear Sciences (BRNS), Project reference No: 37(2)/14/03/2018-BRNS/37003, Govt. of India and Council of Scientific and Industrial and Research, CSIR (project reference no 02(0284)2016/EMR-II dated 06/12/2016), New Delhi, Govt. of India for providing financial support. P. Sarkar is thankful to CSIR-JRF (File no: 09/106(0178)/2018-EMR-I). A. H. Chowdhury is thankful to URS, University of Kalyani . A. Das is grateful to University Grants Commission for D.S. Kothari postdoctoral Fellowship (Award letter no. F.4-2/2006(BSR)/CH/18-19/0010 ). Appendix A item S2468-8231(19)30592-9 S2468823119305929 1-s2.0-S2468823119305929 10.1016/j.mcat.2019.110730 315758 2020-03-13T05:23:36.209797Z 2020-03-01 2020-03-31 1-s2.0-S2468823119305929-main.pdf https://s3-eu-west-1.amazonaws.com/prod-ucs-content-store-eu-west/content/pii:S2468823119305929/MAIN/application/pdf/ab8532efde79a8d9745a9c217c1fe667/main.pdf main.pdf pdf true 7735341 MAIN 9 1-s2.0-S2468823119305929-main_1.png https://s3-eu-west-1.amazonaws.com/prod-ucs-content-store-eu-west/content/pii:S2468823119305929/PREVIEW/image/png/af181494874be3c53a50ef9ff3d8dfa0/main_1.png main_1.png png 54510 849 656 IMAGE-WEB-PDF 1 1-s2.0-S2468823119305929-ga1.jpg https://s3-eu-west-1.amazonaws.com/prod-ucs-content-store-eu-west/content/pii:S2468823119305929/ga1/DOWNSAMPLED/image/jpeg/6c8a864797a3619e85b95fec1337a43d/ga1.jpg ga1 true ga1.jpg jpg 24490 200 368 IMAGE-DOWNSAMPLED 1-s2.0-S2468823119305929-gr1.jpg https://s3-eu-west-1.amazonaws.com/prod-ucs-content-store-eu-west/content/pii:S2468823119305929/gr1/DOWNSAMPLED/image/jpeg/11156f6e40ca9b494f76bb78bed630f9/gr1.jpg gr1 gr1.jpg jpg 44302 397 489 IMAGE-DOWNSAMPLED 1-s2.0-S2468823119305929-gr10.jpg https://s3-eu-west-1.amazonaws.com/prod-ucs-content-store-eu-west/content/pii:S2468823119305929/gr10/DOWNSAMPLED/image/jpeg/d7c727b36db500d7b0d70d236170ffa3/gr10.jpg gr10 gr10.jpg jpg 12471 328 376 IMAGE-DOWNSAMPLED 1-s2.0-S2468823119305929-gr11.jpg https://s3-eu-west-1.amazonaws.com/prod-ucs-content-store-eu-west/content/pii:S2468823119305929/gr11/DOWNSAMPLED/image/jpeg/dfed16db43da70d163b8a2d283c8cb56/gr11.jpg gr11 gr11.jpg jpg 17884 270 565 IMAGE-DOWNSAMPLED 1-s2.0-S2468823119305929-gr12.jpg https://s3-eu-west-1.amazonaws.com/prod-ucs-content-store-eu-west/content/pii:S2468823119305929/gr12/DOWNSAMPLED/image/jpeg/8385a32367ad91281d641f4848ebea3d/gr12.jpg gr12 gr12.jpg jpg 16310 320 376 IMAGE-DOWNSAMPLED 1-s2.0-S2468823119305929-gr13.jpg https://s3-eu-west-1.amazonaws.com/prod-ucs-content-store-eu-west/content/pii:S2468823119305929/gr13/DOWNSAMPLED/image/jpeg/04399ecc92224704387de9bf9852a6d1/gr13.jpg gr13 gr13.jpg jpg 25365 279 376 IMAGE-DOWNSAMPLED 1-s2.0-S2468823119305929-gr14.jpg https://s3-eu-west-1.amazonaws.com/prod-ucs-content-store-eu-west/content/pii:S2468823119305929/gr14/DOWNSAMPLED/image/jpeg/540e31574f2d5da5d0b7c221c1bb95ae/gr14.jpg gr14 gr14.jpg jpg 20195 282 491 IMAGE-DOWNSAMPLED 1-s2.0-S2468823119305929-gr15.jpg https://s3-eu-west-1.amazonaws.com/prod-ucs-content-store-eu-west/content/pii:S2468823119305929/gr15/DOWNSAMPLED/image/jpeg/5b83406bde9150534d4a6840bc0acd84/gr15.jpg gr15 gr15.jpg jpg 15767 253 378 IMAGE-DOWNSAMPLED 1-s2.0-S2468823119305929-gr2.jpg https://s3-eu-west-1.amazonaws.com/prod-ucs-content-store-eu-west/content/pii:S2468823119305929/gr2/DOWNSAMPLED/image/jpeg/30bb348e9143bf64a702f1e573aff6d9/gr2.jpg gr2 gr2.jpg jpg 14457 320 376 IMAGE-DOWNSAMPLED 1-s2.0-S2468823119305929-gr3.jpg https://s3-eu-west-1.amazonaws.com/prod-ucs-content-store-eu-west/content/pii:S2468823119305929/gr3/DOWNSAMPLED/image/jpeg/d1dc5ca763c5f2fe9e74d667decfa9b4/gr3.jpg gr3 gr3.jpg jpg 33226 334 376 IMAGE-DOWNSAMPLED 1-s2.0-S2468823119305929-gr4.jpg https://s3-eu-west-1.amazonaws.com/prod-ucs-content-store-eu-west/content/pii:S2468823119305929/gr4/DOWNSAMPLED/image/jpeg/13327f49e76d9d6f8f45ad47d4fe2007/gr4.jpg gr4 gr4.jpg jpg 16423 323 376 IMAGE-DOWNSAMPLED 1-s2.0-S2468823119305929-gr5.jpg https://s3-eu-west-1.amazonaws.com/prod-ucs-content-store-eu-west/content/pii:S2468823119305929/gr5/DOWNSAMPLED/image/jpeg/ebfc0f04049ed56970b28cfcc3dad622/gr5.jpg gr5 gr5.jpg jpg 17521 317 376 IMAGE-DOWNSAMPLED 1-s2.0-S2468823119305929-gr6.jpg https://s3-eu-west-1.amazonaws.com/prod-ucs-content-store-eu-west/content/pii:S2468823119305929/gr6/DOWNSAMPLED/image/jpeg/e03184eb01b133a95f45451e260d5eee/gr6.jpg gr6 gr6.jpg jpg 25984 307 376 IMAGE-DOWNSAMPLED 1-s2.0-S2468823119305929-gr7.jpg https://s3-eu-west-1.amazonaws.com/prod-ucs-content-store-eu-west/content/pii:S2468823119305929/gr7/DOWNSAMPLED/image/jpeg/d2793e6ae6f2ac933a48d82a37ffe350/gr7.jpg gr7 gr7.jpg jpg 97326 271 678 IMAGE-DOWNSAMPLED 1-s2.0-S2468823119305929-gr8.jpg https://s3-eu-west-1.amazonaws.com/prod-ucs-content-store-eu-west/content/pii:S2468823119305929/gr8/DOWNSAMPLED/image/jpeg/c5925577716f223462df0c2a317bf07b/gr8.jpg gr8 gr8.jpg jpg 119373 509 678 IMAGE-DOWNSAMPLED 1-s2.0-S2468823119305929-gr9.jpg https://s3-eu-west-1.amazonaws.com/prod-ucs-content-store-eu-west/content/pii:S2468823119305929/gr9/DOWNSAMPLED/image/jpeg/292a8f130f09a4b79269b1c409196516/gr9.jpg gr9 gr9.jpg jpg 120852 586 565 IMAGE-DOWNSAMPLED 1-s2.0-S2468823119305929-sc1.jpg https://s3-eu-west-1.amazonaws.com/prod-ucs-content-store-eu-west/content/pii:S2468823119305929/sc1/DOWNSAMPLED/image/jpeg/4c7aa8b3b9b3db82532fb797c6d6379e/sc1.jpg sc1 sc1.jpg jpg 82085 661 753 IMAGE-DOWNSAMPLED 1-s2.0-S2468823119305929-ga1.sml https://s3-eu-west-1.amazonaws.com/prod-ucs-content-store-eu-west/content/pii:S2468823119305929/ga1/THUMBNAIL/image/gif/44a7b61d0697d78d759ec50666d5eea3/ga1.sml ga1 true ga1.sml sml 14635 119 219 IMAGE-THUMBNAIL 1-s2.0-S2468823119305929-gr1.sml https://s3-eu-west-1.amazonaws.com/prod-ucs-content-store-eu-west/content/pii:S2468823119305929/gr1/THUMBNAIL/image/gif/adcd8d2570a54917996dece1d3e07c1e/gr1.sml gr1 gr1.sml sml 8097 164 202 IMAGE-THUMBNAIL 1-s2.0-S2468823119305929-gr10.sml https://s3-eu-west-1.amazonaws.com/prod-ucs-content-store-eu-west/content/pii:S2468823119305929/gr10/THUMBNAIL/image/gif/7e2be4a873574faf0820ded047bb6515/gr10.sml gr10 gr10.sml sml 3315 164 188 IMAGE-THUMBNAIL 1-s2.0-S2468823119305929-gr11.sml https://s3-eu-west-1.amazonaws.com/prod-ucs-content-store-eu-west/content/pii:S2468823119305929/gr11/THUMBNAIL/image/gif/e35c41fb7fc9f22c2e779507c1833ba0/gr11.sml gr11 gr11.sml sml 3377 105 219 IMAGE-THUMBNAIL 1-s2.0-S2468823119305929-gr12.sml https://s3-eu-west-1.amazonaws.com/prod-ucs-content-store-eu-west/content/pii:S2468823119305929/gr12/THUMBNAIL/image/gif/fbbd6a8065cb20d7be7a664b2a1172a0/gr12.sml gr12 gr12.sml sml 3755 164 193 IMAGE-THUMBNAIL 1-s2.0-S2468823119305929-gr13.sml https://s3-eu-west-1.amazonaws.com/prod-ucs-content-store-eu-west/content/pii:S2468823119305929/gr13/THUMBNAIL/image/gif/a4ae48ff6fa959311af3eb8ca64ac4a9/gr13.sml gr13 gr13.sml sml 7018 162 219 IMAGE-THUMBNAIL 1-s2.0-S2468823119305929-gr14.sml https://s3-eu-west-1.amazonaws.com/prod-ucs-content-store-eu-west/content/pii:S2468823119305929/gr14/THUMBNAIL/image/gif/336f73b00f57e7f0af15d48bcc5f90f8/gr14.sml gr14 gr14.sml sml 4283 126 219 IMAGE-THUMBNAIL 1-s2.0-S2468823119305929-gr15.sml https://s3-eu-west-1.amazonaws.com/prod-ucs-content-store-eu-west/content/pii:S2468823119305929/gr15/THUMBNAIL/image/gif/618624e09c2e27e77de2c03acda19c2c/gr15.sml gr15 gr15.sml sml 8009 147 219 IMAGE-THUMBNAIL 1-s2.0-S2468823119305929-gr2.sml https://s3-eu-west-1.amazonaws.com/prod-ucs-content-store-eu-west/content/pii:S2468823119305929/gr2/THUMBNAIL/image/gif/6109c971475a115c106fd367021bd9bb/gr2.sml gr2 gr2.sml sml 4019 164 192 IMAGE-THUMBNAIL 1-s2.0-S2468823119305929-gr3.sml https://s3-eu-west-1.amazonaws.com/prod-ucs-content-store-eu-west/content/pii:S2468823119305929/gr3/THUMBNAIL/image/gif/a411f7af84a6b2b314455c9ab8e9287d/gr3.sml gr3 gr3.sml sml 7753 164 185 IMAGE-THUMBNAIL 1-s2.0-S2468823119305929-gr4.sml https://s3-eu-west-1.amazonaws.com/prod-ucs-content-store-eu-west/content/pii:S2468823119305929/gr4/THUMBNAIL/image/gif/8582fea3d85ab59022488c81eaa5f32a/gr4.sml gr4 gr4.sml sml 4646 164 191 IMAGE-THUMBNAIL 1-s2.0-S2468823119305929-gr5.sml https://s3-eu-west-1.amazonaws.com/prod-ucs-content-store-eu-west/content/pii:S2468823119305929/gr5/THUMBNAIL/image/gif/f1507d4e8ef0b81f3e4dbf9be4e55c22/gr5.sml gr5 gr5.sml sml 3773 164 194 IMAGE-THUMBNAIL 1-s2.0-S2468823119305929-gr6.sml https://s3-eu-west-1.amazonaws.com/prod-ucs-content-store-eu-west/content/pii:S2468823119305929/gr6/THUMBNAIL/image/gif/0fa76a956db3e2602b0056adfe89f3e4/gr6.sml gr6 gr6.sml sml 7259 164 200 IMAGE-THUMBNAIL 1-s2.0-S2468823119305929-gr7.sml https://s3-eu-west-1.amazonaws.com/prod-ucs-content-store-eu-west/content/pii:S2468823119305929/gr7/THUMBNAIL/image/gif/8f92265ceee0363e8f12e23e059c2565/gr7.sml gr7 gr7.sml sml 15095 87 219 IMAGE-THUMBNAIL 1-s2.0-S2468823119305929-gr8.sml https://s3-eu-west-1.amazonaws.com/prod-ucs-content-store-eu-west/content/pii:S2468823119305929/gr8/THUMBNAIL/image/gif/586c4b2e6378df8c514e24d5ede76c90/gr8.sml gr8 gr8.sml sml 27163 164 219 IMAGE-THUMBNAIL 1-s2.0-S2468823119305929-gr9.sml https://s3-eu-west-1.amazonaws.com/prod-ucs-content-store-eu-west/content/pii:S2468823119305929/gr9/THUMBNAIL/image/gif/6ab6e58234878589b8908e97dfe44ae8/gr9.sml gr9 gr9.sml sml 13729 164 158 IMAGE-THUMBNAIL 1-s2.0-S2468823119305929-sc1.sml https://s3-eu-west-1.amazonaws.com/prod-ucs-content-store-eu-west/content/pii:S2468823119305929/sc1/THUMBNAIL/image/gif/a5cff1549875aa7ce5f96f335aaaaa31/sc1.sml sc1 sc1.sml sml 8031 164 187 IMAGE-THUMBNAIL 1-s2.0-S2468823119305929-mmc1.docx https://s3-eu-west-1.amazonaws.com/prod-ucs-content-store-eu-west/content/pii:S2468823119305929/mmc1/MAIN/application/vnd.openxmlformats-officedocument.wordprocessingml.document/cca46a07ae31cbf224d9b75ea1d07c32/mmc1.docx mmc1 mmc1.docx docx 15313468 APPLICATION 1-s2.0-S2468823119305929-am.pdf am am.pdf pdf 1486064 AAM-PDF https://s3-eu-west-1.amazonaws.com/prod-ucs-content-store-eu-west/content/egi:10PQTBRF252/MAIN/application/pdf/74466287c825ee5c6d7406508d7a7018/am.pdf MCAT 110730 110730 S2468-8231(19)30592-9 10.1016/j.mcat.2019.110730 Elsevier B.V. Fig. 1 Proposed reaction cycle for the photocatalytic CO2 reduction using COF and Co-(dmg)2 as co-catalyst. Fig. 1 Fig. 2 Powder XRD patterns of the TFPG-DAAQ COF. Fig. 2 Fig. 3 FTIR spectra of the TFPG, DAAQ, TFPG-DAAQ COF. Fig. 3 Fig. 4 Solid state UV-vis spectra of TFPG-DAAQ COF. Fig. 4 Fig. 5 TGA plot of TFPG-DAAQ COF. Fig. 5 Fig. 6 N2 adsorption-desorption isotherm of the TFPG-DAAQ COF catalyst at 77 K (pore size distribution is shown in the inset). Fig. 6 Fig. 7 FESEM images of TFPG-DAAQ COF. Fig. 7 Fig. 8 EDS mapping of images of TFPG-DAAQ COF (a) electron microscopic image, C (b), N (c), O(d) element EDS mapping. Fig. 8 Fig. 9 TEM images of TFPG-DAAQ COF catalyst. Fig. 9 Fig. 10 EDAX pattern of TFPG-DAAQ COF sample. Fig. 10 Fig. 11 1H NMR and 13C NMR of reaction mass at 0 and 4 h of irridiation in D2O. Fig. 11 Fig. 12 TON of formic acid formed with respect to time while modulating between light (white circle) and dark (red circle) under optimum reaction conditions. Fig. 12 Fig. 13 TON of formic acid produced with respect to time during the change of intensity of light source from 3 W to 12 W keeping other reaction conditions unchanged. Fig. 13 Fig. 14 Proposed reaction cycle for the photo-catalytic reduction of CO2 into HCOOH. Fig. 14 Fig. 15 Heterogeneity test indicating no leaching into the filtrate solution. Fig. 15 Scheme 1 Synthetic procedure of TFPG-DAAQ COF. Scheme 1 Table 1 Reaction conditions for the reduction of CO2 into formic acid. a Table 1 Entry TFPG-DAAQ(mg) Co-Catalyst(mmol) hv (nm) Temp(°C) TON b 1 10 – – 65 0 2 – 0.1 – 65 0 3 10 0.1 – 65 0 4 10 0.1 445 40 0 5 10 0.1 445 50 0 6 – 0.1 445 25 0 7 d 10 – 445 25 0 8 10 0.1 445 c 25 15 9 10 0.1 Sunlight 25 36 10 e 10 0.1 445 25 0 11 10 0.1 445 25 125 12 10 0.1 f 445 25 50 a Reactions were carried out for 4 h with 1 atm CO2 balloon in 5 mL acetonitrile, 0.133 mL TEOA unless otherwise noted. b Calculated by using a calibration plot (with known concentration of HCOOH) in UV–vis spectrometer. c Irradiation for 4 h in absence of TEOA. d Reaction was carried out for 6 h. e Irradiated under open atmosphere for 4 h. f Co(oxim)2 was used instead of Co(dmg)2. Table 2 Catalytic activity study for the recycled catalyst. a Table 2 Entry No. of Cycles TON b 1 1st 125 2 2nd 125 3 3rd 124 4 4th 122 5 5th 121 a Reactions were carried out for 4 h with 1 atm CO2 balloon in 5 mL acetonitrile, 0.133 mL TEOA unless otherwise noted. b Calculated by using a calibration plot in UV–vis spectrometer. Mesoporous covalent organic framework: An active photo-catalyst for formic acid synthesis through carbon dioxide reduction under visible light Priyanka Sarkar a Sk. Riyajuddin b 1 Anjan Das a 1 Arpita Hazra Chowdhury a Kaushik Ghosh b Sk. Manirul Islam a * a Department of Chemistry, University of Kalyani, Kalyani, Nadia, West Bengal, India Department of Chemistry University of Kalyani Nadia Kalyani West Bengal India Department of Chemistry, University of Kalyani, Kalyani, Nadia, West Bengal, India b Institute of Nano Science and Technology, Mohali, 160062 India Institute of Nano Science and Technology Mohali 160062 India Institute of Nano Science and Technology, Mohali, 160062 India ⁎ Corresponding author. 1 authors contributed equally Graphical abstract We demonstrate the photocatalytic reduction of CO2 into HCOOH using mesoporous Covalent Organic Framework (COF) as the active photocatalyst, Co(dmg)2 as co-catalyst with Triethanolamine (TEOA) as sacrificial electron source under atmospheric pressure. Greater than 125 TON is achieved with 10 mg catalyst. The reaction cycle is dependent on the use of co-catalyst, Co(dmg)2 and sacrificial electron donor (TEOA). The reaction does not occur in the absence of light (445 nm) and can readily be controlled by light intensity alternation. We also demonstrate that a TON of 36 can be obtained with use of sunlight using the catalytic cycle. These results open the door to an entirely new class of protocol for photocatalytic reduction of CO2 using COF and Co(dmg)2 as co-catalyst under visible light. Keywords Photocatalysis Covalent organic framework Carbon dioxide Formic acid Photoreductions 1 Introduction Increasing environmental concerns in recent years for global warming, climate change, and ocean acidification are motivating researchers around the world for developing efficient and green strategies to capture, store, and utilize CO2 [1–5]. Again, in the viewpoint of chemistry, CO2 is one of most abundant, inexpensive and renewable carbon feedstock for producing value-added organic compounds and fuels [6–17]. So, the research on chemical transformations of CO2 into fuels and essential chemicals are increasing day by day to reduce the CO2 concentration in the atmosphere. Driving reactions by using a sustainable, green and eco-friendly process is a great challenge for modern scientific community [18–20]. Consequently, it has become imperative for chemists to find new technologies capable of transforming undesirable CO2 to useful chemicals, which are energetically efficient. One of the best means is the use of solar energy for the photochemical reduction of CO2 in terms of abundant and sustainable source of energy [21–30]. There are reports available for the photo reduction of CO2 using metal oxide, such as TiO2 under UV radiation [31–35] and also chemical reduction of CO2 to formic acid [36,37]. However, the majority of the sun's rays fall under the visible-IR range, which is not enough to photoreduce CO2 with these materials limiting their applicability and scalability. Thus, photoactive materials that are able to reduce CO2 under visible light are an imminent and currently unavoidable need. In this context, covalent organic frameworks (COFs) have recently emerged as a new class of photoactive materials for light-induced CO2 reduction [38–42]. Although, COFs are similar to related polymeric carbon nitrides, they modular, versatile and have easy tunable electronic properties, structure, crystallinity and porosity. Additionally COFs are completely composed of light elements, which are earth-abundant leading to synthetically versatile heterogeneous photocatalysis [43–45]. The highly efficient light harvesting and charge transport capability of COFs presumably arises from the π-electron conjugation in plane together along with the possibility of axial charge transport in the stacking direction by the overlap of π-orbitals [46–49]. However, it is highly surprising that despite their enormous potential, COFs have hardly been explored as visible light active photocatalysts for the production of solar fuels. Recently some work on photocatalytic reduction of CO2 to fuels and various chemicals using COFs as active photocatalysts have been reported [39]. Herein, we report a novel mesoporous COF with high surface area (600 m²/g), strong crystallinity and robust stability, and along with Cobalt-(dmg)2 Co-catalysts it exhibits excellent heterogeneous photocatalytic performances for CO2 reduction under visible-light irradiation. The efficiency of the photocatalytic protocol is seen very high in terms of formation of formic acid from CO2 reduction with 445 nm blue LED. According to our best knowledge, it will be the first report in the production of formic acid in combination with COF and Cobalt-DMG Co-catalysts under the visible light. The proposed catalytic cycle is in Fig. 1 . 2 Experimental 2.1 Materials and methods Phloroglucinol, Hexamethylenetetramine (HMTA), p-toluenesulfonic acid (PTSA) were received from sigma Aldrich, India.Trifluoroacetic acid and Triethanolamine (TEOA) were purchased from E-Merk, India. 1,3,5-Triformylphloroglucinol (TFPG) was prepared from hexamethylenetetramine, dried phloroglucinol and trifluoroacetic acid following the previously reported literature procedure [50].The used ammine 2,6-diaminoanthraquinone (DAAQ) was obtained from sigma Aldrich, India and used without further purification. Cobalt-acetate and Dimethylglyoxime (DMG) were received from TCI chemicals, India. All other reagents such as Acetone and Acetonitrile used as solvents were bought from E-Merk, India and were used as received. All the reactions were performed using oven-dried glassware under ambient atmosphere unless otherwise mentioned. 2.2 Synthesis of mesoporous covalent organic framework (TFPG- DAAQ) Synthesis of TFPG-DAAQ COF was carried out by reacting 1,3,5-triformylphloroglucinol (TFPG) (189 mg, 0.9 mmol) and DAAQ (0.321 mg,1.35 mmol) using 7.5 mmol (1426.5 mg) of p-toluenesulfonic acid (PTSA) (Scheme 1 ). PTSA and DAAQ were uniformly mixed in a mortar-pestle and homogeneously grinded for 10 min to obtain a sticky salt. Then TFP (0.9 mmol, 189 mg) was added to the reaction mixture followed by further properly grinding for 15 min until it turned into dough like material. Few drops of deionized water based on requirement (100−200 μL) were added to make the mixture viscous. Then the COF precursors was taken in a Teflon-lined steel autoclave and heated at 60 0C for first 6 h followed by 90 °C for another 10 h in static condition. The resulting TFPG- DAAQ COF was washed for 4–5 times using N,N-dimethylacetamide (DMAc) and then with excess acetone to remove the residues of the starting materials. The material was desiccated under vacuum for 24 h at room temperature to get the as-synthesized deep orange colored TFPG-DAAQ COF (80% isolated yield). 2.3 Procedure of formation of Formic acid using porous TFPG-DAAQ COF Photocatalyst The photocatalytic reduction of CO2 into Formic acid was performed by mixing of Triethanolamine (TEOA, 1 mmol, 0.133 mL), Cobalt-acetate (0.1 mmol, 25 mg), Dimethylglyoxime (0.2 mmol, 23 mg) in 5 mL Acetonitrile in presence of 10 mg of TFPG - DAAQ COF in a 25 mL round bottom flask. The reaction was allowed to run under irradiation of the blue LED light (445 nm) at room temperature for 4 h under continuous stirring (Figure S1). After completion of the reaction, TFPG - DAAQ COF was separated by filtration and the filtrate was analyzed by 1H and 13C NMR Spectra which confirms the formation of HCOOH. The yield of formic acid produced was detected by using UV-Visible spectrophotometer. 3 Results and discussion 3.1 Characterisation 3.1.1 Powder X-ray diffraction (PXRD) Analysis The production of TFPG- DAAQ COF was established by PXRD analysis depicted in Fig. 2 . The characteristic peaks present at 3.5 and 27.1 correspond to the diffraction planes (100) and (001) respectively. The peak at 27.10 arises from the π-π stacking of (001) planes [51]. 3.1.2 FTIR analysis The FTIR spectra of TFPG, DAAQ, TFPG-DAAQ COF and catalyst are shown in Fig. 3 . The peaks at ∼1266 cm-1 and ∼1554 cm-1 are due to –(CN) and –(CC) bonds. The peaks in the FTIR spectra of DAAQ in the range of 3418-3200 cm-1 corresponds to –(NH) bonds, which are completely disappear in the FTIR spectra of TFPG-DAAQ COF confirming the complex formation between TFPG and DAAQ. The sharp peak at 1609 cm-1 in the spectra of TFPG-DAAQ COF is due to the –(CO) bonds. 3.1.3 UV-vis analysis Fig. 4 illustrates the solid state UV-visible absorbance spectra of the TFPG- DAAQ COF catalyst. The material showed broad absorption spectra in the range from 200 to 460 nm with a shoulder band at 493 nm. The absorption spectra include many transitions in the highly ordered conjugation systems [52]. 3.1.4 TGA analysis Fig. 5 illustrates the Thermogravimetric Analysis (TGA) curve of the TFPG- DAAQ COF catalyst. The plot suggests that the catalyst material is stable upto 4250C temperature. The small weight loss before 425 °C may be due to the elimination of surface adsorbed water and also due to the removal of other adsorbed gases from the porous framework. 3.1.5 Surface area measurement The N2 adsorption–desorption isotherm of the TFPG-DAAQ COF catalystis depicted in Fig. 6 .The subsequent pore size distributions (PSD) resulting from the respective desorption data is given in the index of the isotherm plot. The TFPG-DAAQ COF sample has narrow and uniform pore size distribution with pore diameter 3.8 nm, which falls in the mesoporous region (2−50 nm). The estimated BET surface area and total pore volume of the TFPG-DAAQ COF are observed to be 600 m²/g and 0.81 cm3 g-1, respectively. 3.1.6 Microscopic Analysis The FESEM images (Fig. 7 of the TFPG-DAAQ COF showed disordered morphology of the sample. The elemental mapping analysis from the FESEM images of TFPG-DAAQ COF is shown in Fig. 8 a-d. Fig. 8b-d indicates the mapping images of carbon, nitrogen and oxygen, respectively. The interparticle porosity of the mesoporous COF material is confirmed by the TEM images (Fig. 9 ). Fig. 9a indicates the presence one dimensional fibrous structure of the material. These COF fibres are agglomerated and produce the disordered morphology, shown in Fig. 7. Additionally, the elemental composition is confirmed by the EDAX pattern of the sample, which goes well with the elemental mapping analysis (Fig. 10 ). 3.2 Catalytic studies For the initial study of photoreduction of CO2, the azine-based TFPG-DAAQ was chosen as the photo absorber, owing to their robustness and photoredox property. The ground state redox potential (E1/2 = 0.043 V vs Ag/AgCl) was determined from Cyclic Voltammetry (Figure S4(a), in SI) and using the emission maxima (Figure S6, in SI) of COF, we have calculated excited state redox potential value (EPS .+ /PS* = -2.157 V).The band gap, determined from CV analysis (Figure S4 in SI) and emission spectra (Figure S6) is 2.114 V along with conduction band potential 0.043 V and Valence band potential 2.157 V.We made an assumption based on the literatures, that introduction of Co based co-catalyst(E01/2 = -0.125 V vs Ag/AgCl, Figure S4(b) in SI), our catalytic system will work for the CO2 reduction under visible light (445 nm blue LED) at 25 °C [6b]. Various conditions for the reduction of CO2 to formic acid were examined and the results are summarized in Table 1 . The reaction was monitored by UV–vis spectroscopy with a calibration plot (See SI, figure S2). Irradiation (445 nm, 12 W/cm2) of a acetonitrile solution containing TFPG-DAAQ (10 mg), Co(dmg)2 (0.01 mol%) and TEOA (1 mmol) at room temperature produced formic acid with 125 TON (entry 11 in Table 1). The wavelength of irradiation was chosen as to selectively excite the TFPG-DAAQ but not Co(dmg)2 or product (formic acid) (Figure S5 in supporting information). Assuming the mechanism proposed in Fig. 1, the catalytic system produces formic acid with TON 125 per catalyst. It is worth note that the reaction proceeds, even under ambient sunlight, albeit at a much slower rate with approximately TON 36 after 6 h of exposure (entry 9 in Table 1). However, there was no such progress in the reaction without CO2 balloon, under open atmosphere (entry 10 in Table 1). Decreasing the catalyst and Co-catalyst loading by half, there was no significant drop in the TON (125) but switching the Co-catalyst from Co(dmg)2 to Co(oxim)2, a significantly reduced TON (50) was obtained. Therefore, all subsequent experiments were performed with 10 mg of catalyst, 0.1 mmol of Co(dmg)2 and 1 mmol of TEOA. Formation of formate was again confirmed with 1H and 13C NMR spectra in D2O monitoring at 0 h and at 4 h (Fig. 11 ). Without the light neither COF catalyst, TFPG-DAAQ nor Co(dmg)2 alone, nor a mixture of the two, were able to reduce CO2 into formate even at higher temperatures (entries 1–5 in Table 1). Similarly, irradiation of Co(dmg)2 along with CO2 did not result in product formation (entry 6 in Table 1). However, It is important to note that photoexcitation of TFPG-DAAQ in the presence of Co(dmg)2 but without TEOA (sacrificial electron source), the formation of formate was limited to approximately stoichiometric amounts with TON 15 (entry 8 in Table 1). All these control experiments demonstrate that the reaction is driven by photo-induced excitation of TFPG-DAAQ followed by electron transfer to Co(dmg)2 and regeneration of TFPG-DAAQ by sacrificial electron source TEOA. The reduction of CO2 to HCOOH with this catalytic system is solely dependent on light as demonstrated by monitoring HCOOH formation while modulating between light and dark reaction conditions at 30 min intervals (Fig. 12 ). In course of the 4 h experiment the formation of product increases during irradiation but remains almost constant in the dark. Additionally, while this reduction carried out with variable intensity of the light (3 W to 12 W), we found directly dependence of the amount of photo-flux on the reaction rate (Fig. 13 ). This light-modulated reduction of CO2 provides an extraordinary degree of control in formation of HCOOH as compared to traditional other catalytic reduction methodologies. The above result is in agreement with the proposed catalytic cycle depicted in Fig. 14 . Upon photo-excitation TFPG-DAAQ goes in the photo-excited state (EPS .+ /PS* = -2.157 V) and reduces Co(III) into Co(II) (E1/2 = -0.125 V vs Ag/AgCl)come back to ground state by SET by a oxidative quenching. After relaxation, accepting a single electron from sacrificial electron donor TEOA(E1/2 = 0.045 V vs Ag/AgCl), it generates TFPG-DAAQ which can then, upon excitation, undergoes additional reaction cycles reduces CO2 to HCOOH and itself gets oxidised into Co(III) which can go back to Co(II) by getting reduced by photo-excited TFPG-DAAQ. 3.3 Recyclability of TFPG- DAAQ COF catalyst After the catalytic run, the COF, TFPG-DAAQ was filtered and washed several times with acetonitrile. After drying, it was further used as the photocatalyst for next cycle and we found no prominent change in its activity in terms of TON. So, this recycling study was repeated upto 5 times without significant decrease in the activity (Table 2 ). This study indicates the industrial applicability and scalability of the COF, TFPG-DAAQ as the photocatalyst in the reduction of CO2 in formate. There were not prominent changes in the IR spectra of fresh and reused TFPG-DAAQ (Figure S8 in SI). There was also no significant change in the PXRD pattern of reused catalyst (Figure S9 in SI). The pore size distribution plot of the reused catalyst (Figure S10) suggested that there was small decrease in peak pore diameter (3.24 nm), which was may be due to blocking of pores by product material. This blocking of pores may cause the decrease in TON values for reused catalyst. 3.4 Heterogeneity test To know about the heterogeneous nature of the TFPG-DAAQ catalyst, a hot filtration test was carried out on the reduction of CO2 in formate. After 2 h of reaction TON = 100 was obtained. The catalyst was then filtered out from the reaction mixture and after that the reaction was performed for further 4 h in absence of the catalyst. It can be observed from Fig. 15 that the reaction was stopped at approximately TON = 100. Therefore no further reaction was happened after filtering out the catalyst. These observations strongly suggested that there was approximately no leaching out of composition elements from the TFPG-DAAQ catalyst during the reaction and the TFPG-DAAQ catalyst is completely heterogeneous in nature. 4 Conclusion In summary, we have demonstrated the photocatalytic reduction of CO2 in to formate by using COF as active photocatalyst along with Co(dmg)2 as the co-catalyst. The reaction goes with excellent TON under visible light and 1 atm CO2 pressure. Control experiments suggest that the reaction can’t proceed without the co-catalyst. The reaction does not occur in the absence of light even at elevated temperature and thus the reaction could readily be controlled by light alteration. Additionally, the photocatalyst is readily recoverable and reusable after completion of reaction without significant change in the catalytic activity. Declaration of Competing Interest We do hereby declare that there is no conflict of interest for the publication of this manuscript. Author statement Priyanka Sarkar: Conceptualization, Methodology, Software. Anjan Das: Data curation, Writing- Original draft preparation. Arpita Hazra Chowdhury: Visualization, Investigation. Sk. Riyajuddin: Sample characterization and Data Curation. Kaushik Ghosh: Software, Validation. Sk. Manirul Islam: Supervision, Writing- Reviewing and Editing Acknowledgements SMI thankfully acknowledges Department of Science and Technology, DST-SERB (project reference no. EMR/2016/004956), New Delhi, Govt. of India, Board of Research in Nuclear Sciences (BRNS), Project reference No: 37(2)/14/03/2018-BRNS/37003, Govt. of India and Council of Scientific and Industrial and Research, CSIR (project reference no 02(0284)2016/EMR-II dated 06/12/2016), New Delhi, Govt. of India for providing financial support. P. Sarkar is thankful to CSIR-JRF (File no: 09/106(0178)/2018-EMR-I). A. H. Chowdhury is thankful to URS, University of Kalyani. A. Das is grateful to University Grants Commission for D.S. Kothari postdoctoral Fellowship (Award letter no. F.4-2/2006(BSR)/CH/18-19/0010). Appendix A Supplementary data Supplementary material related to this article can be found, in the online version, at doi:https://doi.org/10.1016/j.mcat.2019.110730. Appendix A Supplementary data The following is Supplementary data to this article: References [1] B. Kumar M. Llorente J. Froehlich T. Dang A. Sathrum C.P. Kubiak Annu. Rev. Phys. Chem. 63 2012 541 569 B. Kumar, M. Llorente, J. Froehlich, T. Dang, A. Sathrum, C.P. Kubiak, Annu. Rev. Phys. Chem. 63 (2012) 541−569. [2] N.S. Lewis D.G. Nocera Proc. Natl. Acad. Sci. U.S.A. 103 2006 15729 15735 N.S. Lewis, D.G. Nocera, Proc. Natl. Acad. Sci. U.S.A. 103 (2006) 15729−15735. [3] N. Armaroli V. Balzani Angew. Chem. Int. Ed. 46 2007 52 66 N. Armaroli, V. Balzani, Angew. Chem. Int. Ed. 46 (2007) 52−66. [4] W. Song Z. Chen M.K. Brennaman J.J. Concepcion A.O.T. Patrocinio N.Y.M. Iha T.J. Meyer Pure Appl. Chem. 83 2011 749 768 W. Song, Z. Chen, M. K. Brennaman, J. J. Concepcion, A.O.T. Patrocinio, N.Y.M. Iha, T. J. Meyer, Pure Appl. Chem. 83 (2011) 749−768. [5] R. Quadrelli S. Peterson Energy Policy 35 2007 5938 5952 R. Quadrelli, S. Peterson,Energy Policy 35 (2007) 5938–5952. [6] Alessandro D.M.D’ B. Smit J.R. Long Angew. Chem. Int. Ed. 49 2010 6058 6082 D.M.D’Alessandro, B. Smit, J.R. Long, Angew. Chem. Int. Ed. 49 (2010) 6058−6082. [7] M. Cokoja C. Bruckmeier B. Rieger W.A. Herrmann F.E. Kühn Angew. Chem. Int. Ed. 50 2011 8 5108537 M. Cokoja, C. Bruckmeier, B. Rieger, W.A. Herrmann, F.E. Kühn, Angew. Chem. Int. Ed.50 (2011) 8− 5108537. [8] M. He Y. Sun B. Han Angew. Chem. Int. Ed. 52 2013 9620 9633 M. He, Y. Sun, B. Han, Angew. Chem. Int. Ed. 52 (2013) 9620−9633. [9] E.V. Kondratenko G. Mul J. Baltrusaitis G.O. Larrazábal J. Peŕez-Ramírez Energy Environ. Sci. 6 2013 3112 3135 E.V. Kondratenko, G. Mul, J. Baltrusaitis, G.O. Larrazábal, J. Peŕez-Ramírez, Energy Environ. Sci. 6 (2013) 3112−3135. [10] M. Aresta, A. Dibenedetto, A. Angelini, 114 (2014) 1709−1742. [11] J. Klankermayer S. Wesselbaum K. Beydoun W. Leitner Angew. Chem. Int. Ed. 55 2016 7296 7343 J. Klankermayer, S. Wesselbaum, K. Beydoun, W. Leitner, Angew. Chem. Int. Ed. 55 (2016) 7296−7343 [12] A.W. Kleij M. North A. Urakawa ChemSusChem 10 2017 1036 1038 A.W. Kleij, M. North, A. Urakawa, ChemSusChem 10 (2017) 1036−1038 [13] A. Banerjee G.R. Dick T. Yoshino M.W. Kanan Nature 531 2016 215 219 A. Banerjee, G.R. Dick, T. Yoshino, M.W. Kanan, Nature 531 (2016). [14] S. Kattel P.J. Ramírez J.G. Chen J.A. Rodriguez P. Liu Science 355 2017 1296 1299 S. Kattel, P.J. Ramírez, J.G. Chen, J.A. Rodriguez, P. Liu, Science 355 (2017) 1296−1299. [15] F. Julia-Hernańdez T. Moragas J. Cornella R. Martin Nature 545 2017 84 88 F. Julia-Hernańdez, T. Moragas, J. Cornella, R. Martin, Nature 545 (2017) 84−88. [16] H. Rao L.C. Schmidt J. Bonin M. Robert Nature 548 2017 74 77 H. Rao, L.C. Schmidt, J. Bonin, M. Robert, Nature 548 (2017) 74−77. [17] P. Bhanja A. Modak A. Bhaumik Chem. Eur. J. 24 2018 7278 7297 P. Bhanja, A. Modak, A. Bhaumik, Chemistry–A European Journal 24 (2018) 7278-7297. [18] F.M. Mota D.H. Kim Chem. Soc. Rev. 48 2019 205 F.M. Mota, D.H. Kim, Chem. Soc. Rev. 48 (2019) 205. [19] M.G. Walter E.L. Warren J.R. McKone S.W. Boettcher Q. Mi E.A. Santori N.S. Lewis Chem. Rev. 110 2010 6446 M.G. Walter, E.L. Warren, J.R. McKone, S.W. Boettcher, Q. Mi, E.A. Santori, N.S. Lewis, Chem. Rev. 110 (2010) 6446. [20] J. Bi P. Hou P. Kang ChemCatChem 11 2019 2069 2072 J. Bi, P. Hou, P. Kang, ChemCatChem 11 (2019) 2069-2072. [21] K.S. Joya Y.F. Joya K. Ocakoglu R. van de Krol Angew. Chem. Int. Ed. 52 2013 10426 K.S. Joya, Y.F. Joya, K. Ocakoglu, R. van de Krol, Angew. Chem. Int. Ed. 52 (2013) 10426. [22] A. Kudo Y. Miseki Chem. Soc. Rev. 38 2009 253 A. Kudo, Y. Miseki, Chem. Soc. Rev. 38 (2009) 253. [23] K. Li B. Peng T. Peng ACS Catal. 6 2016 7485 7527 K. Li, B. Peng, T. Peng, ACS Catal. 6 (2016) 7485−7527. [24] X. Chang T. Wang J. Gong Energy Environ. Sci. 9 2016 2177 X. Chang, T. Wang, J. Gong, Energy Environ. Sci. 9 (2016) 2177. [25] S.R. Lingampalli M.M. Ayyuband C.N.R. Rao ACS Omega 2 2017 2740 2748 S.R. Lingampalli, M.M. Ayyuband, C.N.R. Rao, ACS Omega 2 (2017) 2740-2748. [26] M.W. Logan S. Ayad J.D. Adamson T. Dilbeck K. Hanson F.J. Uribe-Romo J. Mater. Chem. A 5 2017 11854 11863 M.W. Logan, S. Ayad, J.D. Adamson, T. Dilbeck, K. Hanson, F.J. Uribe-Romo, J. Mater. Chem. A 5 (2017) 11854–11863. [27] E. Karamian S. Sharifnia J. Co2 Util. 16 2016 194 203 E. Karamian, S. Sharifnia, Journal of CO2 Utilization 16 (2016) 194–203. [28] D. Ghosh H. Takeda D.C. Fabry Y. Tamaki O. Ishitani ACS Sustainable Chem. Eng. 7 2019 2648 2657 D. Ghosh, H. Takeda, D.C. Fabry, Y. Tamaki, O. Ishitani, ACS Sustainable Chem. Eng. 7 (2019) 2648–2657. [29] S. Neatu J.A. Macia-Agullo H. Garcia Int. J. Mol. Sci. 15 2014 5246 5262 S. Neatu, J.A. Macia-Agullo, H. Garcia, Int. J. Mol. Sci. 15 (2014) 5246-5262. [30] Q. Shi Z. Li L. Chen X. Zhang W. Han M. Xie J. Yang L. Jing Appl. Catal. B 244 2019 641 649 Q. Shi, Z. Li, L. Chen, X. Zhang, W. Han, M. Xie, J. Yang, L. Jing, Applied Catalysis B: Environmental 244 (2019) 641-649. [31] T. Inoue A. Fujishima S. Konishi K. Honda Nature 277 1979 637 T. Inoue, A. Fujishima, S. Konishi, K. Honda, Nature 277 (1979) 637. [32] R. Yadav V. Amoli J. Singh M.K. Tripathi P. Bhanja A. Bhaumik A.K. Sinha J. Co2 Util. 27 2018 11 21 R. Yadav, V. Amoli, J. Singh, M. K. Tripathi, P. Bhanja, A. Bhaumik, A. K. Sinha, Journal of CO2 Utilization 27 (2018) 11-21. [33] A. Dhakshinamoorthy S. Navalon A. Corma H. Garcia Energy Environ. Sci. 5 2012 9217 A. Dhakshinamoorthy, S. Navalon, A. Corma, H. Garcia, Energy Environ. Sci. 5 (2012) 9217. [34] S.S. Tan L. Zou E. Hu Sci. Technol. Adv. Mater. 8 2007 89 S.S. Tan, L. Zou, E. Hu, Sci. Technol. Adv. Mater. 8 (2007) 89. [35] Q. Zhang C.–F. Lin Y.H. Jing C.–T. Chang J. Air Waste Manage. Assoc. 64 2014 578 585 Q. Zhang, C.–F. Lin, Y.H. Jing, C.–T. Chang, Journal of the Air & Waste Management Association 64 (2014) 578–585. [36] Z. Zhang L. Zhang M.J. Hülsey N. Yan Mol. Catal. 475 2019 110461 Z. Zhang, L. Zhang, M.J. Hülsey, N. Yan, Molecular Catalysis 475 (2019) 110461. [37] M.S. Maru S. Ram R.S. Shukla H.K. Noor-ul Mol. Catal. 446 2018 23 30 M. S. Maru, S. Ram, R. S. Shukla, H. K. Noor-ul, Molecular Catalysis 446(2018) 23-30. [38] Y. Zhi Z. Li X. Feng H. Xia Y. Zhang Z. Shi Y. Muand X. Liu J. Mater. Chem. A Mater. Energy Sustain. 5 2017 22933 Y. Zhi, Z. Li, X. Feng, H. Xia,Y. Zhang, Z. Shi,Y. Muand, X. Liu, J. Mater. Chem. A 5 (2017) 22933. [39] R.K. Yadav A. Kumar N.-J. Park K.–J. Kong J.–O. Baeg J. Mater. Chem. A Mater. Energy Sustain. 4 2016 9413 R.K. Yadav, A. Kumar, N.-J. Park, K.–J. Kong, J.–O. Baeg, J. Mater. Chem. A 4 (2016) 9413. [40] S. Lin C.S. Diercks Y.–B. Zhang N. Kornienko E.M. Nichols Y. Zhao A.R. Paris D. Kim P. Yang O.M. Yaghi C.J. Chang Science 349 2015 1208 1213 S. Lin, C.S. Diercks, Y.–B. Zhang, N. Kornienko, E.M. Nichols, Y. Zhao, A.R. Paris, D. Kim, P. Yang, O.M. Yaghi, C.J. Chang, Science 349 (2015) 1208-1213. [41] M. Cheng S. Yang R. Chen X. Zhu Q. Liao Y. Huang Mol. Catal. 448 2018 185 194 M.Cheng, S. Yang, R. Chen, X. Zhu, Q. Liao, Y. Huang, Molecular Catalysis 448(2018)185-194. [42] H. Liu Z. Zhang J. Meng J. Zhang Mol. Catal. 430 2017 9 19 H.Liu, Z. Zhang, J. Meng, J. Zhang, Molecular Catalysis430 (2017) 9-19. [43] S.-Y. Ding W. Wang Chem. Soc. Rev. 42 2013 548 568 S.-Y. Ding, W. Wang, Chem. Soc. Rev. 42 (2013) 548-568. [44] R.P. Bisbey W.R. Dichtel ACS Cent. Sci. 3 2017 533 543 R.P. Bisbey, W.R. Dichtel, ACS Cent. Sci 3 (2017) 533-543. [45] T. Banerjee K. Gottschling G. Savasci C. Ochsenfeld B.V. Lotsch ACS Energy Lett. 3 2018 400 409 T. Banerjee, K. Gottschling, G. Savasci, C. Ochsenfeld, B.V. Lotsch, ACS Energy Lett. 3 (2018) 400−409. [46] X. Ding J. Guo X. Feng Y. Honsho J. Guo S. Seki P. Maitarad A. Saeki S. Nagase D. Jiang Angew. Chem. Int. Ed. 50 2011 1289 1293 X. Ding, J. Guo, X. Feng, Y. Honsho, J. Guo, S. Seki, P. Maitarad, A. Saeki, S. Nagase, D. Jiang, Angew. Chem. Int. Ed. 50 (2011) 1289-1293. [47] C. Butchosa T.O. McDonald A.I. Cooper D.J. Adams M. Zwijnenburg A. J. Phys. Chem. C 118 2014 4314 4324 C. Butchosa, T.O. McDonald, A.I. Cooper, D.J. Adams, M. Zwijnenburg, A. J. Phys. Chem. C 118 (2014) 4314-4324. [48] S. Ghosh R.A. Molla U. Kayal A. Bhaumik S.M. Islam Dalton Trans. 48 2019 4657 4666 S. Ghosh, R.A. Molla, U. Kayal, A. Bhaumik, S.M. Islam, Dalton Trans. 48 (2019) 4657-4666. [49] A. Halder M. Ghosh A. Khayum M S. Bera M. Addicoat H.S. Sasmal S. Karak S. Kurungot R. Banerjee J. Am. Chem. Soc. 140 2018 10941 10945 A. Halder, M. Ghosh, A. Khayum M, S. Bera, M. Addicoat, H.S. Sasmal, S. Karak, S. Kurungot, R. Banerjee, J. Am. Chem. Soc. 140 (2018) 10941−10945. [50] J.H. Chong M. Sauer B.O. Patrick M.J. MacLachlan Org. Lett. 5 2003 3823 3826 J.H. Chong, M. Sauer, B.O. Patrick, M.J. MacLachlan, Org. Lett. 5 (2003) 3823–3826. [51] S. Karak S. Kandambeth B.P. Biswal H.S. Sasmal S. Kumar P. Pachfule R. Banerjee J. Am. Chem. Soc. 139 2017 1856 1862 S. Karak,S. Kandambeth,B.P. Biswal,H.S. Sasmal,S. Kumar,P. Pachfule, R. Banerjee, J. Am. Chem. Soc.139 (2017) 1856-1862. [52] G.-H. Fan X. Li J.-Y. Liu G.-Z. He Comput. Theor. Chem. 1030 2014 17 24 G.-H. Fan, X. Li, J.-Y. Liu, G.-Z. He, Computational and Theoretical Chemistry 1030 (2014) 17–24.",
      "scopus-id": "85077929404",
      "coredata": {
        "eid": "1-s2.0-S2468823119305929",
        "dc:description": "We demonstrate the photocatalytic reduction of CO2 into HCOOH using mesoporous Covalent Organic Framework (COF) as the active photocatalyst, Co(dmg)2 as co-catalyst with Triethanolamine (TEOA) as sacrificial electron source under atmospheric pressure. Greater than 125 TON is achieved with 10 mg catalyst. The reaction cycle is dependent on the use of co-catalyst, Co(dmg)2 and sacrificial electron donor (TEOA). The reaction does not occur in the absence of light (445 nm) and can readily be controlled by light intensity alternation. We also demonstrate that a TON of 36 can be obtained with use of sunlight using the catalytic cycle. These results open the door to an entirely new class of protocol for photocatalytic reduction of CO2 using COF and Co(dmg)2 as co-catalyst under visible light.",
        "openArchiveArticle": "false",
        "prism:coverDate": "2020-03-31",
        "openaccessUserLicense": null,
        "prism:aggregationType": "Journal",
        "prism:url": "https://api.elsevier.com/content/article/pii/S2468823119305929",
        "dc:creator": [
          {
            "@_fa": "true",
            "$": "Sarkar, Priyanka"
          },
          {
            "@_fa": "true",
            "$": "Riyajuddin, Sk."
          },
          {
            "@_fa": "true",
            "$": "Das, Anjan"
          },
          {
            "@_fa": "true",
            "$": "Hazra Chowdhury, Arpita"
          },
          {
            "@_fa": "true",
            "$": "Ghosh, Kaushik"
          },
          {
            "@_fa": "true",
            "$": "Islam, Sk. Manirul"
          }
        ],
        "link": [
          {
            "@_fa": "true",
            "@rel": "self",
            "@href": "https://api.elsevier.com/content/article/pii/S2468823119305929"
          },
          {
            "@_fa": "true",
            "@rel": "scidir",
            "@href": "https://www.sciencedirect.com/science/article/pii/S2468823119305929"
          }
        ],
        "dc:format": "application/json",
        "openaccessType": null,
        "pii": "S2468-8231(19)30592-9",
        "prism:volume": "484",
        "articleNumber": "110730",
        "prism:publisher": "Elsevier B.V.",
        "dc:title": "Mesoporous covalent organic framework: An active photo-catalyst for formic acid synthesis through carbon dioxide reduction under visible light",
        "prism:copyright": "© 2019 Elsevier B.V. All rights reserved.",
        "openaccess": "0",
        "prism:issn": "24688231",
        "dcterms:subject": [
          {
            "@_fa": "true",
            "$": "Photocatalysis"
          },
          {
            "@_fa": "true",
            "$": "Covalent organic framework"
          },
          {
            "@_fa": "true",
            "$": "Carbon dioxide"
          },
          {
            "@_fa": "true",
            "$": "Formic acid"
          },
          {
            "@_fa": "true",
            "$": "Photoreductions"
          }
        ],
        "openaccessArticle": "false",
        "prism:publicationName": "Molecular Catalysis",
        "openaccessSponsorType": null,
        "prism:pageRange": "110730",
        "pubType": "fla",
        "prism:coverDisplayDate": "March 2020",
        "prism:doi": "10.1016/j.mcat.2019.110730",
        "prism:startingPage": "110730",
        "dc:identifier": "doi:10.1016/j.mcat.2019.110730",
        "openaccessSponsorName": null
      },
      "objects": {
        "object": [
          {
            "@category": "standard",
            "@height": "200",
            "@width": "368",
            "@_fa": "true",
            "$": "https://api.elsevier.com/content/object/eid/1-s2.0-S2468823119305929-ga1.jpg?httpAccept=%2A%2F%2A",
            "@multimediatype": "JPEG image file",
            "@type": "IMAGE-DOWNSAMPLED",
            "@size": "24490",
            "@ref": "ga1",
            "@mimetype": "image/jpeg"
          },
          {
            "@category": "standard",
            "@height": "397",
            "@width": "489",
            "@_fa": "true",
            "$": "https://api.elsevier.com/content/object/eid/1-s2.0-S2468823119305929-gr1.jpg?httpAccept=%2A%2F%2A",
            "@multimediatype": "JPEG image file",
            "@type": "IMAGE-DOWNSAMPLED",
            "@size": "44302",
            "@ref": "gr1",
            "@mimetype": "image/jpeg"
          },
          {
            "@category": "standard",
            "@height": "328",
            "@width": "376",
            "@_fa": "true",
            "$": "https://api.elsevier.com/content/object/eid/1-s2.0-S2468823119305929-gr10.jpg?httpAccept=%2A%2F%2A",
            "@multimediatype": "JPEG image file",
            "@type": "IMAGE-DOWNSAMPLED",
            "@size": "12471",
            "@ref": "gr10",
            "@mimetype": "image/jpeg"
          },
          {
            "@category": "standard",
            "@height": "270",
            "@width": "565",
            "@_fa": "true",
            "$": "https://api.elsevier.com/content/object/eid/1-s2.0-S2468823119305929-gr11.jpg?httpAccept=%2A%2F%2A",
            "@multimediatype": "JPEG image file",
            "@type": "IMAGE-DOWNSAMPLED",
            "@size": "17884",
            "@ref": "gr11",
            "@mimetype": "image/jpeg"
          },
          {
            "@category": "standard",
            "@height": "320",
            "@width": "376",
            "@_fa": "true",
            "$": "https://api.elsevier.com/content/object/eid/1-s2.0-S2468823119305929-gr12.jpg?httpAccept=%2A%2F%2A",
            "@multimediatype": "JPEG image file",
            "@type": "IMAGE-DOWNSAMPLED",
            "@size": "16310",
            "@ref": "gr12",
            "@mimetype": "image/jpeg"
          },
          {
            "@category": "standard",
            "@height": "279",
            "@width": "376",
            "@_fa": "true",
            "$": "https://api.elsevier.com/content/object/eid/1-s2.0-S2468823119305929-gr13.jpg?httpAccept=%2A%2F%2A",
            "@multimediatype": "JPEG image file",
            "@type": "IMAGE-DOWNSAMPLED",
            "@size": "25365",
            "@ref": "gr13",
            "@mimetype": "image/jpeg"
          },
          {
            "@category": "standard",
            "@height": "282",
            "@width": "491",
            "@_fa": "true",
            "$": "https://api.elsevier.com/content/object/eid/1-s2.0-S2468823119305929-gr14.jpg?httpAccept=%2A%2F%2A",
            "@multimediatype": "JPEG image file",
            "@type": "IMAGE-DOWNSAMPLED",
            "@size": "20195",
            "@ref": "gr14",
            "@mimetype": "image/jpeg"
          },
          {
            "@category": "standard",
            "@height": "253",
            "@width": "378",
            "@_fa": "true",
            "$": "https://api.elsevier.com/content/object/eid/1-s2.0-S2468823119305929-gr15.jpg?httpAccept=%2A%2F%2A",
            "@multimediatype": "JPEG image file",
            "@type": "IMAGE-DOWNSAMPLED",
            "@size": "15767",
            "@ref": "gr15",
            "@mimetype": "image/jpeg"
          },
          {
            "@category": "standard",
            "@height": "320",
            "@width": "376",
            "@_fa": "true",
            "$": "https://api.elsevier.com/content/object/eid/1-s2.0-S2468823119305929-gr2.jpg?httpAccept=%2A%2F%2A",
            "@multimediatype": "JPEG image file",
            "@type": "IMAGE-DOWNSAMPLED",
            "@size": "14457",
            "@ref": "gr2",
            "@mimetype": "image/jpeg"
          },
          {
            "@category": "standard",
            "@height": "334",
            "@width": "376",
            "@_fa": "true",
            "$": "https://api.elsevier.com/content/object/eid/1-s2.0-S2468823119305929-gr3.jpg?httpAccept=%2A%2F%2A",
            "@multimediatype": "JPEG image file",
            "@type": "IMAGE-DOWNSAMPLED",
            "@size": "33226",
            "@ref": "gr3",
            "@mimetype": "image/jpeg"
          },
          {
            "@category": "standard",
            "@height": "323",
            "@width": "376",
            "@_fa": "true",
            "$": "https://api.elsevier.com/content/object/eid/1-s2.0-S2468823119305929-gr4.jpg?httpAccept=%2A%2F%2A",
            "@multimediatype": "JPEG image file",
            "@type": "IMAGE-DOWNSAMPLED",
            "@size": "16423",
            "@ref": "gr4",
            "@mimetype": "image/jpeg"
          },
          {
            "@category": "standard",
            "@height": "317",
            "@width": "376",
            "@_fa": "true",
            "$": "https://api.elsevier.com/content/object/eid/1-s2.0-S2468823119305929-gr5.jpg?httpAccept=%2A%2F%2A",
            "@multimediatype": "JPEG image file",
            "@type": "IMAGE-DOWNSAMPLED",
            "@size": "17521",
            "@ref": "gr5",
            "@mimetype": "image/jpeg"
          },
          {
            "@category": "standard",
            "@height": "307",
            "@width": "376",
            "@_fa": "true",
            "$": "https://api.elsevier.com/content/object/eid/1-s2.0-S2468823119305929-gr6.jpg?httpAccept=%2A%2F%2A",
            "@multimediatype": "JPEG image file",
            "@type": "IMAGE-DOWNSAMPLED",
            "@size": "25984",
            "@ref": "gr6",
            "@mimetype": "image/jpeg"
          },
          {
            "@category": "standard",
            "@height": "271",
            "@width": "678",
            "@_fa": "true",
            "$": "https://api.elsevier.com/content/object/eid/1-s2.0-S2468823119305929-gr7.jpg?httpAccept=%2A%2F%2A",
            "@multimediatype": "JPEG image file",
            "@type": "IMAGE-DOWNSAMPLED",
            "@size": "97326",
            "@ref": "gr7",
            "@mimetype": "image/jpeg"
          },
          {
            "@category": "standard",
            "@height": "509",
            "@width": "678",
            "@_fa": "true",
            "$": "https://api.elsevier.com/content/object/eid/1-s2.0-S2468823119305929-gr8.jpg?httpAccept=%2A%2F%2A",
            "@multimediatype": "JPEG image file",
            "@type": "IMAGE-DOWNSAMPLED",
            "@size": "119373",
            "@ref": "gr8",
            "@mimetype": "image/jpeg"
          },
          {
            "@category": "standard",
            "@height": "586",
            "@width": "565",
            "@_fa": "true",
            "$": "https://api.elsevier.com/content/object/eid/1-s2.0-S2468823119305929-gr9.jpg?httpAccept=%2A%2F%2A",
            "@multimediatype": "JPEG image file",
            "@type": "IMAGE-DOWNSAMPLED",
            "@size": "120852",
            "@ref": "gr9",
            "@mimetype": "image/jpeg"
          },
          {
            "@category": "standard",
            "@height": "661",
            "@width": "753",
            "@_fa": "true",
            "$": "https://api.elsevier.com/content/object/eid/1-s2.0-S2468823119305929-sc1.jpg?httpAccept=%2A%2F%2A",
            "@multimediatype": "JPEG image file",
            "@type": "IMAGE-DOWNSAMPLED",
            "@size": "82085",
            "@ref": "sc1",
            "@mimetype": "image/jpeg"
          },
          {
            "@category": "thumbnail",
            "@height": "119",
            "@width": "219",
            "@_fa": "true",
            "$": "https://api.elsevier.com/content/object/eid/1-s2.0-S2468823119305929-ga1.sml?httpAccept=%2A%2F%2A",
            "@multimediatype": "GIF image file",
            "@type": "IMAGE-THUMBNAIL",
            "@size": "14635",
            "@ref": "ga1",
            "@mimetype": "image/gif"
          },
          {
            "@category": "thumbnail",
            "@height": "164",
            "@width": "202",
            "@_fa": "true",
            "$": "https://api.elsevier.com/content/object/eid/1-s2.0-S2468823119305929-gr1.sml?httpAccept=%2A%2F%2A",
            "@multimediatype": "GIF image file",
            "@type": "IMAGE-THUMBNAIL",
            "@size": "8097",
            "@ref": "gr1",
            "@mimetype": "image/gif"
          },
          {
            "@category": "thumbnail",
            "@height": "164",
            "@width": "188",
            "@_fa": "true",
            "$": "https://api.elsevier.com/content/object/eid/1-s2.0-S2468823119305929-gr10.sml?httpAccept=%2A%2F%2A",
            "@multimediatype": "GIF image file",
            "@type": "IMAGE-THUMBNAIL",
            "@size": "3315",
            "@ref": "gr10",
            "@mimetype": "image/gif"
          },
          {
            "@category": "thumbnail",
            "@height": "105",
            "@width": "219",
            "@_fa": "true",
            "$": "https://api.elsevier.com/content/object/eid/1-s2.0-S2468823119305929-gr11.sml?httpAccept=%2A%2F%2A",
            "@multimediatype": "GIF image file",
            "@type": "IMAGE-THUMBNAIL",
            "@size": "3377",
            "@ref": "gr11",
            "@mimetype": "image/gif"
          },
          {
            "@category": "thumbnail",
            "@height": "164",
            "@width": "193",
            "@_fa": "true",
            "$": "https://api.elsevier.com/content/object/eid/1-s2.0-S2468823119305929-gr12.sml?httpAccept=%2A%2F%2A",
            "@multimediatype": "GIF image file",
            "@type": "IMAGE-THUMBNAIL",
            "@size": "3755",
            "@ref": "gr12",
            "@mimetype": "image/gif"
          },
          {
            "@category": "thumbnail",
            "@height": "162",
            "@width": "219",
            "@_fa": "true",
            "$": "https://api.elsevier.com/content/object/eid/1-s2.0-S2468823119305929-gr13.sml?httpAccept=%2A%2F%2A",
            "@multimediatype": "GIF image file",
            "@type": "IMAGE-THUMBNAIL",
            "@size": "7018",
            "@ref": "gr13",
            "@mimetype": "image/gif"
          },
          {
            "@category": "thumbnail",
            "@height": "126",
            "@width": "219",
            "@_fa": "true",
            "$": "https://api.elsevier.com/content/object/eid/1-s2.0-S2468823119305929-gr14.sml?httpAccept=%2A%2F%2A",
            "@multimediatype": "GIF image file",
            "@type": "IMAGE-THUMBNAIL",
            "@size": "4283",
            "@ref": "gr14",
            "@mimetype": "image/gif"
          },
          {
            "@category": "thumbnail",
            "@height": "147",
            "@width": "219",
            "@_fa": "true",
            "$": "https://api.elsevier.com/content/object/eid/1-s2.0-S2468823119305929-gr15.sml?httpAccept=%2A%2F%2A",
            "@multimediatype": "GIF image file",
            "@type": "IMAGE-THUMBNAIL",
            "@size": "8009",
            "@ref": "gr15",
            "@mimetype": "image/gif"
          },
          {
            "@category": "thumbnail",
            "@height": "164",
            "@width": "192",
            "@_fa": "true",
            "$": "https://api.elsevier.com/content/object/eid/1-s2.0-S2468823119305929-gr2.sml?httpAccept=%2A%2F%2A",
            "@multimediatype": "GIF image file",
            "@type": "IMAGE-THUMBNAIL",
            "@size": "4019",
            "@ref": "gr2",
            "@mimetype": "image/gif"
          },
          {
            "@category": "thumbnail",
            "@height": "164",
            "@width": "185",
            "@_fa": "true",
            "$": "https://api.elsevier.com/content/object/eid/1-s2.0-S2468823119305929-gr3.sml?httpAccept=%2A%2F%2A",
            "@multimediatype": "GIF image file",
            "@type": "IMAGE-THUMBNAIL",
            "@size": "7753",
            "@ref": "gr3",
            "@mimetype": "image/gif"
          },
          {
            "@category": "thumbnail",
            "@height": "164",
            "@width": "191",
            "@_fa": "true",
            "$": "https://api.elsevier.com/content/object/eid/1-s2.0-S2468823119305929-gr4.sml?httpAccept=%2A%2F%2A",
            "@multimediatype": "GIF image file",
            "@type": "IMAGE-THUMBNAIL",
            "@size": "4646",
            "@ref": "gr4",
            "@mimetype": "image/gif"
          },
          {
            "@category": "thumbnail",
            "@height": "164",
            "@width": "194",
            "@_fa": "true",
            "$": "https://api.elsevier.com/content/object/eid/1-s2.0-S2468823119305929-gr5.sml?httpAccept=%2A%2F%2A",
            "@multimediatype": "GIF image file",
            "@type": "IMAGE-THUMBNAIL",
            "@size": "3773",
            "@ref": "gr5",
            "@mimetype": "image/gif"
          },
          {
            "@category": "thumbnail",
            "@height": "164",
            "@width": "200",
            "@_fa": "true",
            "$": "https://api.elsevier.com/content/object/eid/1-s2.0-S2468823119305929-gr6.sml?httpAccept=%2A%2F%2A",
            "@multimediatype": "GIF image file",
            "@type": "IMAGE-THUMBNAIL",
            "@size": "7259",
            "@ref": "gr6",
            "@mimetype": "image/gif"
          },
          {
            "@category": "thumbnail",
            "@height": "87",
            "@width": "219",
            "@_fa": "true",
            "$": "https://api.elsevier.com/content/object/eid/1-s2.0-S2468823119305929-gr7.sml?httpAccept=%2A%2F%2A",
            "@multimediatype": "GIF image file",
            "@type": "IMAGE-THUMBNAIL",
            "@size": "15095",
            "@ref": "gr7",
            "@mimetype": "image/gif"
          },
          {
            "@category": "thumbnail",
            "@height": "164",
            "@width": "219",
            "@_fa": "true",
            "$": "https://api.elsevier.com/content/object/eid/1-s2.0-S2468823119305929-gr8.sml?httpAccept=%2A%2F%2A",
            "@multimediatype": "GIF image file",
            "@type": "IMAGE-THUMBNAIL",
            "@size": "27163",
            "@ref": "gr8",
            "@mimetype": "image/gif"
          },
          {
            "@category": "thumbnail",
            "@height": "164",
            "@width": "158",
            "@_fa": "true",
            "$": "https://api.elsevier.com/content/object/eid/1-s2.0-S2468823119305929-gr9.sml?httpAccept=%2A%2F%2A",
            "@multimediatype": "GIF image file",
            "@type": "IMAGE-THUMBNAIL",
            "@size": "13729",
            "@ref": "gr9",
            "@mimetype": "image/gif"
          },
          {
            "@category": "thumbnail",
            "@height": "164",
            "@width": "187",
            "@_fa": "true",
            "$": "https://api.elsevier.com/content/object/eid/1-s2.0-S2468823119305929-sc1.sml?httpAccept=%2A%2F%2A",
            "@multimediatype": "GIF image file",
            "@type": "IMAGE-THUMBNAIL",
            "@size": "8031",
            "@ref": "sc1",
            "@mimetype": "image/gif"
          },
          {
            "@category": "standard",
            "@_fa": "true",
            "$": "https://api.elsevier.com/content/object/eid/1-s2.0-S2468823119305929-mmc1.docx?httpAccept=%2A%2F%2A",
            "@multimediatype": "Microsoft Word file",
            "@type": "APPLICATION",
            "@size": "15313468",
            "@ref": "mmc1",
            "@mimetype": "application/word"
          },
          {
            "@category": "standard",
            "@_fa": "true",
            "$": "https://api.elsevier.com/content/object/eid/1-s2.0-S2468823119305929-am.pdf?httpAccept=%2A%2F%2A",
            "@multimediatype": "Acrobat PDF file",
            "@type": "AAM-PDF",
            "@size": "1486064",
            "@ref": "am",
            "@mimetype": "application/pdf"
          }
        ]
      },
      "link": {
        "@rel": "abstract",
        "@href": "https://api.elsevier.com/content/abstract/scopus_id/85077929404"
      }
    }
  }
}