{
  "metadata": {
    "title": "Hydrogen production from ethanol: Synthesis of Ni catalysts assisted by chelating agents",
    "authors": "; ; ",
    "journal": "Molecular Catalysis",
    "date": "2020-02-29",
    "doi": "10.1016/j.mcat.2018.08.006",
    "abstract": "",
    "uri": "https://api.elsevier.com/content/article/pii/S2468823118303109",
    "pii": "S2468823118303109"
  },
  "fulltext": {
    "full-text-retrieval-response": {
      "scopus-eid": "2-s2.0-85051785853",
      "originalText": "serial JL 315758 291210 291744 291790 291809 31 Molecular Catalysis MOLECULARCATALYSIS 2018-08-21 2018-08-21 2020-01-31 2020-01-31 2020-01-31T15:58:52 1-s2.0-S2468823118303109 S2468-8231(18)30310-9 S2468823118303109 10.1016/j.mcat.2018.08.006 S300 S300.1 FULL-TEXT 1-s2.0-S2468823119X00176 2020-03-12T06:51:23.004351Z 0 0 20200201 20200229 2020 2018-08-21T06:30:55.251396Z absattachment articleinfo articlenumber articletitlenorm authfirstinitialnorm authfirstsurnamenorm cid cids confeditor contenttype copyright crossmark dateloaded dateloadedtxt datesearch datesort dateupdated dco docsubtype doctype doi eid ewtransactionid hubeid indexeddate issn issnnorm itemstage itemtransactionid itemweight openaccess openarchive pg pgfirst pii piinorm pubdateend pubdatestart pubdatetxt pubyr sortorder srctitle srctitlenorm srctype ssids alllist content subj subheadings suppl tomb vol volfirst volissue volumelist webpdf webpdfpagecount yearnav figure table body mmlmath acknowledge affil articletitle auth authfirstini authfull authkeywords authlast grantnumber grantsponsor grantsponsorid highlightsabst orcid primabst ref specialabst 2468-8231 24688231 true 481 481 C Volume 481 20 110164 110164 110164 202002 February 2020 2020-02-01 2020-02-29 2020 SI: Nanostructured Materials Dr. Mónica Crivello Dr. Sandra Casuscelli Dr. Griselda Eimer article fla © 2018 Published by Elsevier B.V. HYDROGENPRODUCTIONETHANOLSYNTHESISNICATALYSTSASSISTEDBYCHELATINGAGENTS VILLAGRANOLIVARES A 1 Introduction 2 Experimental 2.1 Catalyst preparation 2.2 Characterisation of samples 2.3 Catalytic experiments in ethanol steam reforming 3 Results and discussion 4 Conclusions Acknowledgements References ROSTRUPNIELSEN 2002 65 139 J MATTOS 2012 4094 4123 L VANDILLEN 2003 257 264 A ALDALAMA 2005 49 53 K RYCZKOWSKI 1995 341 349 J SUAREZTORIELLO 2015 36 46 V ESCOBAR 2008 33 40 J PENA 2014 879 887 L CASTILLOVILLALON 2014 127 136 P GIRARDON 2007 143 157 J MOCHIZUKI 2007 97 104 T KOIZUMI 2009 34 42 N KOIZUMI 2012 151 163 N DAZA 2010 592 603 C KARNJANAKOM 2015 359 368 S LU 2012 6 11 X BANG 2016 179 188 Y ZHANG 2017 14103 14114 Q ORTEGADOMINGUEZ 2013 39 44 R ORTEGADOMINGUEZ 2017 110 122 R SANTOLALLAVARGAS 2015 105 115 C GALETTI 2012 1461 1469 A VILLAGRANOLIVARES 2018 61 73 A MAHMOOD 2011 10017 10023 T PUIGDOMENECH 2013 2 I CHEMICALEQUILIBRIUMDIAGRAMS TARDITI 2014 521 529 A BARROSO 2011 124 131 M LING 2008 329 341 J GANESH 2009 350 357 I GULICOVSKI 2014 868 873 J KOO 2014 151 157 K LUISETTO 2015 12 22 I LOFBERG 2017 159 174 A LI 2018 937 943 L CHEN 2018 32 46 M SANTANDER 2017 9482 9492 J WURZLER 2016 115 128 G YAAKOB 2013 2229 2239 Z HONG 2012 670 675 W ROS 2002 1151 1161 T VILLAGRANOLIVARESX2020X110164 VILLAGRANOLIVARESX2020X110164XA 2022-01-31T00:00:00.000Z 2022-01-31T00:00:00.000Z http://creativecommons.org/licenses/by-nc-nd/4.0/ © 2018 Published by Elsevier B.V. 2019-03-30T23:12:30.936Z http://vtw.elsevier.com/data/voc/AddOnTypes/50.7/nlp item S2468-8231(18)30310-9 S2468823118303109 1-s2.0-S2468823118303109 10.1016/j.mcat.2018.08.006 315758 2020-03-12T06:51:23.004351Z 2020-02-01 2020-02-29 1-s2.0-S2468823118303109-main.pdf https://s3-eu-west-1.amazonaws.com/prod-ucs-content-store-eu-west/content/pii:S2468823118303109/MAIN/application/pdf/810fb48089395c5a9f1e5086a50faf30/main.pdf main.pdf pdf true 3576323 MAIN 8 1-s2.0-S2468823118303109-main_1.png https://s3-eu-west-1.amazonaws.com/prod-ucs-content-store-eu-west/content/pii:S2468823118303109/PREVIEW/image/png/349945dd927cfd98f500ffec650ea2f3/main_1.png main_1.png png 55121 849 656 IMAGE-WEB-PDF 1 1-s2.0-S2468823118303109-fx1.jpg https://s3-eu-west-1.amazonaws.com/prod-ucs-content-store-eu-west/content/pii:S2468823118303109/fx1/DOWNSAMPLED/image/jpeg/50b932182da6c178a20c5c1271f111d1/fx1.jpg fx1 fx1.jpg jpg 407 9 9 IMAGE-DOWNSAMPLED 1-s2.0-S2468823118303109-fx10.jpg https://s3-eu-west-1.amazonaws.com/prod-ucs-content-store-eu-west/content/pii:S2468823118303109/fx10/DOWNSAMPLED/image/jpeg/60707301292077c3ea29c06a9025d363/fx10.jpg fx10 fx10.jpg jpg 345 4 4 IMAGE-DOWNSAMPLED 1-s2.0-S2468823118303109-fx11.jpg https://s3-eu-west-1.amazonaws.com/prod-ucs-content-store-eu-west/content/pii:S2468823118303109/fx11/DOWNSAMPLED/image/jpeg/0ac24905ee22440c4ced283fb5a9f05a/fx11.jpg fx11 fx11.jpg jpg 367 8 6 IMAGE-DOWNSAMPLED 1-s2.0-S2468823118303109-fx12.jpg https://s3-eu-west-1.amazonaws.com/prod-ucs-content-store-eu-west/content/pii:S2468823118303109/fx12/DOWNSAMPLED/image/jpeg/7f6f0999929c5f93c8e03291af00a1e6/fx12.jpg fx12 fx12.jpg jpg 392 9 9 IMAGE-DOWNSAMPLED 1-s2.0-S2468823118303109-fx13.jpg https://s3-eu-west-1.amazonaws.com/prod-ucs-content-store-eu-west/content/pii:S2468823118303109/fx13/DOWNSAMPLED/image/jpeg/da684fe03150adab6bad76cb2b6b90dc/fx13.jpg fx13 fx13.jpg jpg 385 9 9 IMAGE-DOWNSAMPLED 1-s2.0-S2468823118303109-fx14.jpg https://s3-eu-west-1.amazonaws.com/prod-ucs-content-store-eu-west/content/pii:S2468823118303109/fx14/DOWNSAMPLED/image/jpeg/609a9dfbdf8916cda80f55a6db4c98fc/fx14.jpg fx14 fx14.jpg jpg 398 10 7 IMAGE-DOWNSAMPLED 1-s2.0-S2468823118303109-fx15.jpg https://s3-eu-west-1.amazonaws.com/prod-ucs-content-store-eu-west/content/pii:S2468823118303109/fx15/DOWNSAMPLED/image/jpeg/599b590254b3d56694be63ea690c2cf6/fx15.jpg fx15 fx15.jpg jpg 402 9 9 IMAGE-DOWNSAMPLED 1-s2.0-S2468823118303109-fx16.jpg https://s3-eu-west-1.amazonaws.com/prod-ucs-content-store-eu-west/content/pii:S2468823118303109/fx16/DOWNSAMPLED/image/jpeg/21054c4d1aff9c0cb61e50ccada1ed35/fx16.jpg fx16 fx16.jpg jpg 379 7 7 IMAGE-DOWNSAMPLED 1-s2.0-S2468823118303109-fx2.jpg https://s3-eu-west-1.amazonaws.com/prod-ucs-content-store-eu-west/content/pii:S2468823118303109/fx2/DOWNSAMPLED/image/jpeg/1cbbf322d588b37ef7311c9326ed6eaf/fx2.jpg fx2 fx2.jpg jpg 363 5 5 IMAGE-DOWNSAMPLED 1-s2.0-S2468823118303109-fx3.jpg https://s3-eu-west-1.amazonaws.com/prod-ucs-content-store-eu-west/content/pii:S2468823118303109/fx3/DOWNSAMPLED/image/jpeg/03a536dfc5ebe4743e28aa65d5b1c090/fx3.jpg fx3 fx3.jpg jpg 382 9 9 IMAGE-DOWNSAMPLED 1-s2.0-S2468823118303109-fx4.jpg https://s3-eu-west-1.amazonaws.com/prod-ucs-content-store-eu-west/content/pii:S2468823118303109/fx4/DOWNSAMPLED/image/jpeg/780d4c78906aa61301a15e79496800ed/fx4.jpg fx4 fx4.jpg jpg 395 10 7 IMAGE-DOWNSAMPLED 1-s2.0-S2468823118303109-fx5.jpg https://s3-eu-west-1.amazonaws.com/prod-ucs-content-store-eu-west/content/pii:S2468823118303109/fx5/DOWNSAMPLED/image/jpeg/9371c96bb4a617404580bb817ef02f65/fx5.jpg fx5 fx5.jpg jpg 383 7 7 IMAGE-DOWNSAMPLED 1-s2.0-S2468823118303109-fx6.jpg https://s3-eu-west-1.amazonaws.com/prod-ucs-content-store-eu-west/content/pii:S2468823118303109/fx6/DOWNSAMPLED/image/jpeg/05fedcb92adf9c51df93ce55eb0b7d27/fx6.jpg fx6 fx6.jpg jpg 387 8 9 IMAGE-DOWNSAMPLED 1-s2.0-S2468823118303109-fx7.jpg https://s3-eu-west-1.amazonaws.com/prod-ucs-content-store-eu-west/content/pii:S2468823118303109/fx7/DOWNSAMPLED/image/jpeg/92894f2915ecda21c793d5209adec5ea/fx7.jpg fx7 fx7.jpg jpg 376 9 9 IMAGE-DOWNSAMPLED 1-s2.0-S2468823118303109-fx8.jpg https://s3-eu-west-1.amazonaws.com/prod-ucs-content-store-eu-west/content/pii:S2468823118303109/fx8/DOWNSAMPLED/image/jpeg/46ac06507d77c1037188bdf7df115d2e/fx8.jpg fx8 fx8.jpg jpg 413 9 9 IMAGE-DOWNSAMPLED 1-s2.0-S2468823118303109-fx9.jpg https://s3-eu-west-1.amazonaws.com/prod-ucs-content-store-eu-west/content/pii:S2468823118303109/fx9/DOWNSAMPLED/image/jpeg/2a676dac423f243e4badf71660410809/fx9.jpg fx9 fx9.jpg jpg 328 6 6 IMAGE-DOWNSAMPLED 1-s2.0-S2468823118303109-ga1.jpg https://s3-eu-west-1.amazonaws.com/prod-ucs-content-store-eu-west/content/pii:S2468823118303109/ga1/DOWNSAMPLED/image/jpeg/44884e352cd391f2f6568f47c98f2e27/ga1.jpg ga1 true ga1.jpg jpg 15285 200 266 IMAGE-DOWNSAMPLED 1-s2.0-S2468823118303109-gr1.jpg https://s3-eu-west-1.amazonaws.com/prod-ucs-content-store-eu-west/content/pii:S2468823118303109/gr1/DOWNSAMPLED/image/jpeg/2592623f93ac4ab7361d8fccb8aa419b/gr1.jpg gr1 gr1.jpg jpg 15089 270 340 IMAGE-DOWNSAMPLED 1-s2.0-S2468823118303109-gr2.jpg https://s3-eu-west-1.amazonaws.com/prod-ucs-content-store-eu-west/content/pii:S2468823118303109/gr2/DOWNSAMPLED/image/jpeg/f83d39f08743d0e26cc189f06f092c1c/gr2.jpg gr2 gr2.jpg jpg 26057 218 378 IMAGE-DOWNSAMPLED 1-s2.0-S2468823118303109-gr3.jpg https://s3-eu-west-1.amazonaws.com/prod-ucs-content-store-eu-west/content/pii:S2468823118303109/gr3/DOWNSAMPLED/image/jpeg/aee3212db4a72d7e94004ca926cc8525/gr3.jpg gr3 gr3.jpg jpg 24561 291 340 IMAGE-DOWNSAMPLED 1-s2.0-S2468823118303109-gr4.jpg https://s3-eu-west-1.amazonaws.com/prod-ucs-content-store-eu-west/content/pii:S2468823118303109/gr4/DOWNSAMPLED/image/jpeg/acd042f6a2a536629e88e42992b38c76/gr4.jpg gr4 gr4.jpg jpg 42367 358 604 IMAGE-DOWNSAMPLED 1-s2.0-S2468823118303109-gr5.jpg https://s3-eu-west-1.amazonaws.com/prod-ucs-content-store-eu-west/content/pii:S2468823118303109/gr5/DOWNSAMPLED/image/jpeg/813411f47d6db4f961e4fad240c89b1a/gr5.jpg gr5 gr5.jpg jpg 50450 608 340 IMAGE-DOWNSAMPLED 1-s2.0-S2468823118303109-gr6.jpg https://s3-eu-west-1.amazonaws.com/prod-ucs-content-store-eu-west/content/pii:S2468823118303109/gr6/DOWNSAMPLED/image/jpeg/5e8ec711b293c157af51f1878da70934/gr6.jpg gr6 gr6.jpg jpg 8998 253 340 IMAGE-DOWNSAMPLED 1-s2.0-S2468823118303109-gr7.jpg https://s3-eu-west-1.amazonaws.com/prod-ucs-content-store-eu-west/content/pii:S2468823118303109/gr7/DOWNSAMPLED/image/jpeg/0b92901c556023a5a4f3702a72ca6667/gr7.jpg gr7 gr7.jpg jpg 80168 519 679 IMAGE-DOWNSAMPLED 1-s2.0-S2468823118303109-gr8.jpg https://s3-eu-west-1.amazonaws.com/prod-ucs-content-store-eu-west/content/pii:S2468823118303109/gr8/DOWNSAMPLED/image/jpeg/a0e491e9492ba7af1537f9cadf02994a/gr8.jpg gr8 gr8.jpg jpg 27846 261 340 IMAGE-DOWNSAMPLED 1-s2.0-S2468823118303109-gr9.jpg https://s3-eu-west-1.amazonaws.com/prod-ucs-content-store-eu-west/content/pii:S2468823118303109/gr9/DOWNSAMPLED/image/jpeg/4e9157315581a2f74a1fef26af9940ea/gr9.jpg gr9 gr9.jpg jpg 20931 218 340 IMAGE-DOWNSAMPLED 1-s2.0-S2468823118303109-fx1.sml https://s3-eu-west-1.amazonaws.com/prod-ucs-content-store-eu-west/content/pii:S2468823118303109/fx1/THUMBNAIL/image/gif/3b65da7f57299bedc00d97f3943c6610/fx1.sml fx1 fx1.sml sml 1119 43 43 IMAGE-THUMBNAIL 1-s2.0-S2468823118303109-fx10.sml https://s3-eu-west-1.amazonaws.com/prod-ucs-content-store-eu-west/content/pii:S2468823118303109/fx10/THUMBNAIL/image/gif/6515337c8b746f03a451dd89f94a2078/fx10.sml fx10 fx10.sml sml 699 20 21 IMAGE-THUMBNAIL 1-s2.0-S2468823118303109-fx11.sml https://s3-eu-west-1.amazonaws.com/prod-ucs-content-store-eu-west/content/pii:S2468823118303109/fx11/THUMBNAIL/image/gif/87feb42e44df94d681d81f84d744227f/fx11.sml fx11 fx11.sml sml 898 37 28 IMAGE-THUMBNAIL 1-s2.0-S2468823118303109-fx12.sml https://s3-eu-west-1.amazonaws.com/prod-ucs-content-store-eu-west/content/pii:S2468823118303109/fx12/THUMBNAIL/image/gif/4544695cde2cf2463ffd9c368ca2304f/fx12.sml fx12 fx12.sml sml 1216 44 44 IMAGE-THUMBNAIL 1-s2.0-S2468823118303109-fx13.sml https://s3-eu-west-1.amazonaws.com/prod-ucs-content-store-eu-west/content/pii:S2468823118303109/fx13/THUMBNAIL/image/gif/05b29bdc8ba75fac76c1b9128018e1a4/fx13.sml fx13 fx13.sml sml 1254 43 43 IMAGE-THUMBNAIL 1-s2.0-S2468823118303109-fx14.sml https://s3-eu-west-1.amazonaws.com/prod-ucs-content-store-eu-west/content/pii:S2468823118303109/fx14/THUMBNAIL/image/gif/a0e433678539cef3bb76d3c5e05ed6d6/fx14.sml fx14 fx14.sml sml 1215 49 35 IMAGE-THUMBNAIL 1-s2.0-S2468823118303109-fx15.sml https://s3-eu-west-1.amazonaws.com/prod-ucs-content-store-eu-west/content/pii:S2468823118303109/fx15/THUMBNAIL/image/gif/44c6905283eafa535ce5959091cef691/fx15.sml fx15 fx15.sml sml 1896 42 44 IMAGE-THUMBNAIL 1-s2.0-S2468823118303109-fx16.sml https://s3-eu-west-1.amazonaws.com/prod-ucs-content-store-eu-west/content/pii:S2468823118303109/fx16/THUMBNAIL/image/gif/0dbdc533be3a7a8f1b3cb74cb67b3be9/fx16.sml fx16 fx16.sml sml 1607 35 35 IMAGE-THUMBNAIL 1-s2.0-S2468823118303109-fx2.sml https://s3-eu-west-1.amazonaws.com/prod-ucs-content-store-eu-west/content/pii:S2468823118303109/fx2/THUMBNAIL/image/gif/d4ce900e44e28f380cf48546f093c9a3/fx2.sml fx2 fx2.sml sml 896 25 26 IMAGE-THUMBNAIL 1-s2.0-S2468823118303109-fx3.sml https://s3-eu-west-1.amazonaws.com/prod-ucs-content-store-eu-west/content/pii:S2468823118303109/fx3/THUMBNAIL/image/gif/ed19f88d8a7ab6ef11a596f7a52e0660/fx3.sml fx3 fx3.sml sml 1229 43 43 IMAGE-THUMBNAIL 1-s2.0-S2468823118303109-fx4.sml https://s3-eu-west-1.amazonaws.com/prod-ucs-content-store-eu-west/content/pii:S2468823118303109/fx4/THUMBNAIL/image/gif/ca0dfaa45c0b3231f1c48daea616cc81/fx4.sml fx4 fx4.sml sml 1172 49 35 IMAGE-THUMBNAIL 1-s2.0-S2468823118303109-fx5.sml https://s3-eu-west-1.amazonaws.com/prod-ucs-content-store-eu-west/content/pii:S2468823118303109/fx5/THUMBNAIL/image/gif/b0690d0e91d0c489a340786a26e91c4a/fx5.sml fx5 fx5.sml sml 1160 35 35 IMAGE-THUMBNAIL 1-s2.0-S2468823118303109-fx6.sml https://s3-eu-west-1.amazonaws.com/prod-ucs-content-store-eu-west/content/pii:S2468823118303109/fx6/THUMBNAIL/image/gif/c864ed5dc183d5c7b19c392f868fe56c/fx6.sml fx6 fx6.sml sml 1891 41 44 IMAGE-THUMBNAIL 1-s2.0-S2468823118303109-fx7.sml https://s3-eu-west-1.amazonaws.com/prod-ucs-content-store-eu-west/content/pii:S2468823118303109/fx7/THUMBNAIL/image/gif/56e6825f0f903ba49dac6ba281d2b069/fx7.sml fx7 fx7.sml sml 1170 43 43 IMAGE-THUMBNAIL 1-s2.0-S2468823118303109-fx8.sml https://s3-eu-west-1.amazonaws.com/prod-ucs-content-store-eu-west/content/pii:S2468823118303109/fx8/THUMBNAIL/image/gif/e97072e7369ec30f4f580bbed8d88f21/fx8.sml fx8 fx8.sml sml 1050 42 43 IMAGE-THUMBNAIL 1-s2.0-S2468823118303109-fx9.sml https://s3-eu-west-1.amazonaws.com/prod-ucs-content-store-eu-west/content/pii:S2468823118303109/fx9/THUMBNAIL/image/gif/007ae735e0717ce3db9a6faac9b7dfe6/fx9.sml fx9 fx9.sml sml 1245 28 28 IMAGE-THUMBNAIL 1-s2.0-S2468823118303109-ga1.sml https://s3-eu-west-1.amazonaws.com/prod-ucs-content-store-eu-west/content/pii:S2468823118303109/ga1/THUMBNAIL/image/gif/7ff9814b5c047167129c6b0b6bee5d0a/ga1.sml ga1 true ga1.sml sml 10764 164 218 IMAGE-THUMBNAIL 1-s2.0-S2468823118303109-gr1.sml https://s3-eu-west-1.amazonaws.com/prod-ucs-content-store-eu-west/content/pii:S2468823118303109/gr1/THUMBNAIL/image/gif/76b365c0522942ee7223f4ed3b2bfc11/gr1.sml gr1 gr1.sml sml 4581 164 206 IMAGE-THUMBNAIL 1-s2.0-S2468823118303109-gr2.sml https://s3-eu-west-1.amazonaws.com/prod-ucs-content-store-eu-west/content/pii:S2468823118303109/gr2/THUMBNAIL/image/gif/c9571a651efb72f730a50884df3f9e57/gr2.sml gr2 gr2.sml sml 8604 126 219 IMAGE-THUMBNAIL 1-s2.0-S2468823118303109-gr3.sml https://s3-eu-west-1.amazonaws.com/prod-ucs-content-store-eu-west/content/pii:S2468823118303109/gr3/THUMBNAIL/image/gif/64020388ad72e38e5b5321e189f15c7e/gr3.sml gr3 gr3.sml sml 6639 164 192 IMAGE-THUMBNAIL 1-s2.0-S2468823118303109-gr4.sml https://s3-eu-west-1.amazonaws.com/prod-ucs-content-store-eu-west/content/pii:S2468823118303109/gr4/THUMBNAIL/image/gif/d7cf3801ffeac788d6f745c87b972bd7/gr4.sml gr4 gr4.sml sml 6873 130 219 IMAGE-THUMBNAIL 1-s2.0-S2468823118303109-gr5.sml https://s3-eu-west-1.amazonaws.com/prod-ucs-content-store-eu-west/content/pii:S2468823118303109/gr5/THUMBNAIL/image/gif/1b9170d75f567fdf18380f124d5efe0a/gr5.sml gr5 gr5.sml sml 4622 163 91 IMAGE-THUMBNAIL 1-s2.0-S2468823118303109-gr6.sml https://s3-eu-west-1.amazonaws.com/prod-ucs-content-store-eu-west/content/pii:S2468823118303109/gr6/THUMBNAIL/image/gif/61fa30dc575957ea4bce7b87354c39e5/gr6.sml gr6 gr6.sml sml 3215 163 219 IMAGE-THUMBNAIL 1-s2.0-S2468823118303109-gr7.sml https://s3-eu-west-1.amazonaws.com/prod-ucs-content-store-eu-west/content/pii:S2468823118303109/gr7/THUMBNAIL/image/gif/abe5dc287716ddd72bd345c1e4ec78f7/gr7.sml gr7 gr7.sml sml 8065 164 215 IMAGE-THUMBNAIL 1-s2.0-S2468823118303109-gr8.sml https://s3-eu-west-1.amazonaws.com/prod-ucs-content-store-eu-west/content/pii:S2468823118303109/gr8/THUMBNAIL/image/gif/a50d74c03c8e98d3e115a49924c80c2d/gr8.sml gr8 gr8.sml sml 11795 164 214 IMAGE-THUMBNAIL 1-s2.0-S2468823118303109-gr9.sml https://s3-eu-west-1.amazonaws.com/prod-ucs-content-store-eu-west/content/pii:S2468823118303109/gr9/THUMBNAIL/image/gif/e1683ad68917320dc2edaa503b827359/gr9.sml gr9 gr9.sml sml 7633 140 219 IMAGE-THUMBNAIL 1-s2.0-S2468823118303109-si1.gif https://s3-eu-west-1.amazonaws.com/prod-ucs-content-store-eu-west/content/pii:S2468823118303109/STRIPIN/image/gif/b178d4835313b19082c785271818732a/si1.gif si1 si1.gif gif 629 37 203 ALTIMG 1-s2.0-S2468823118303109-si2.gif https://s3-eu-west-1.amazonaws.com/prod-ucs-content-store-eu-west/content/pii:S2468823118303109/STRIPIN/image/gif/8d053f6126f184d6652852900c5cef66/si2.gif si2 si2.gif gif 343 36 58 ALTIMG 1-s2.0-S2468823118303109-si3.gif https://s3-eu-west-1.amazonaws.com/prod-ucs-content-store-eu-west/content/pii:S2468823118303109/STRIPIN/image/gif/b9118ea0ec14628838f28a124f252dcb/si3.gif si3 si3.gif gif 359 39 58 ALTIMG 1-s2.0-S2468823118303109-si4.gif https://s3-eu-west-1.amazonaws.com/prod-ucs-content-store-eu-west/content/pii:S2468823118303109/STRIPIN/image/gif/64ff80c07a466274c76c2691149c4052/si4.gif si4 si4.gif gif 346 33 84 ALTIMG 1-s2.0-S2468823118303109-si5.gif https://s3-eu-west-1.amazonaws.com/prod-ucs-content-store-eu-west/content/pii:S2468823118303109/STRIPIN/image/gif/69aa19304abccc64c32390c9d405a42a/si5.gif si5 si5.gif gif 282 36 57 ALTIMG 1-s2.0-S2468823118303109-si6.gif https://s3-eu-west-1.amazonaws.com/prod-ucs-content-store-eu-west/content/pii:S2468823118303109/STRIPIN/image/gif/54f564a7ebe47e5b3ea5f28d53774781/si6.gif si6 si6.gif gif 261 36 49 ALTIMG 1-s2.0-S2468823118303109-si7.gif https://s3-eu-west-1.amazonaws.com/prod-ucs-content-store-eu-west/content/pii:S2468823118303109/STRIPIN/image/gif/63f6491a45b0c6146c2c0fa62f3c5838/si7.gif si7 si7.gif gif 485 36 136 ALTIMG 1-s2.0-S2468823118303109-si8.gif https://s3-eu-west-1.amazonaws.com/prod-ucs-content-store-eu-west/content/pii:S2468823118303109/STRIPIN/image/gif/f6a5e9b697f1d61cbc6895dbec859928/si8.gif si8 si8.gif gif 279 30 79 ALTIMG 1-s2.0-S2468823118303109-si9.gif https://s3-eu-west-1.amazonaws.com/prod-ucs-content-store-eu-west/content/pii:S2468823118303109/STRIPIN/image/gif/a3c03cf34a81e8af650319fd0315800e/si9.gif si9 si9.gif gif 387 36 94 ALTIMG 1-s2.0-S2468823118303109-am.pdf am am.pdf pdf 756114 AAM-PDF https://s3-eu-west-1.amazonaws.com/prod-ucs-content-store-eu-west/content/egi:10VFTT77GG6/MAIN/application/pdf/455919ac6671b2ef1dc4b32bfbd56133/am.pdf MCAT 10164 110164 S2468-8231(18)30310-9 10.1016/j.mcat.2018.08.006 Fig. 1 ΔpH as a function of pHinitial for PZC determination. : MgAl2O4; : MgAl2O4 - CeO2 and ■: CeO2. Fig. 1 Fig. 2 Diffraction patterns of fresh catalysts: a) Ninitrate, b) NiEDTA, c) NiNTA and d) NiCA. : MgAl2O4; : CeO2 and : NiO. Fig. 2 Fig. 3 Profiles of temperature programmed reduction of fresh catalysts: a) Ninitrate, b) NiEDTA, c) NiNTA and d) NiCA. Fig. 3 Fig. 4 Diffraction patterns of reduced catalysts: a) Ninitrate, b) NiEDTA, c) NiNTA and d) NiCA. : MgAl2O4; : CeO2; : NiO and : Ni. XRD patterns recorded in the step mode, step scan = 0.02 °; time step: 5 s. Fig. 4 Fig. 5 X-ray photoelectron spectra of: a) Ninitrate, b) NiEDTA, c) NiNTA and d) NiCA for Ni 2p region and Ce 3d region. Fig. 5 Fig. 6 Relationship between (Ce/Ni0)XPS and NiO particle size. Fig. 6 Fig. 7 Ethanol conversion and products distribution over: a) Ninitrate, b) NiEDTA, c) NiNTA and d) NiCA, as a function of time on stream. : ethanol conversion; o: mol H2/mol C2H5OH; selectivity to CO2, CO, CH4, C2H4O and C2. Initial ethanol concentration: 9.4%, W/F = 49 g min m o l C 2 H 5 O H − 1 , reaction temperature: 650 °C. Fig. 7 Fig. 8 Diffraction patterns of used catalysts in ESR reaction: a) Ninitrate, b) NiEDTA, c) NiNTA and d) NiCA. : MgAl2O4 ; : CeO2 ; : Ni ; : NiO and ▾: C. Fig. 8 Fig. 9 Weight loss and d(weight)/dt against temperature for all used catalysts in ESR reaction: a) Ninitrate, b) NiEDTA, c) NiNTA and d) NiCA. Fig. 9 Table 1 Preparation conditions of catalysts. Table 1 Sample pHimpreg μ Predominant nickel species Log K Ninitrate 5.9 0.4 [Ni(H2O)6] 2+ – NiEDTA 6.8 2.4 [Ni(EDTA)]2− 20.2 NiNTA 6.7 1.9 [Ni(NTA)]− 12.8 NiCA 6.5 1.6 [Ni(CA)2]4− [Ni(CA)]− [Ni(NH3)]2+ 9.26.92.7 μ: ionic strength; Equilibrium constant values (K) obtained by Medusa software [25]. Table 2 Some characteristics of fresh catalysts. Table 2 Sample Ni(wt.%) CeO2 (wt.%) SBET (m2 g−1) d N i O X R D (nm) d C e O 2 X R D (nm) Ninitrate 5.8 4.4 88 18.0 5.3 (6.6) NiEDTA 6.7 4.4 97 6.2 ∼4 (4.2) NiNTA 6.3 5.4 92 9.3 ∼4 (3.7) NiCA 5.9 4.5 80 12.4 6.3 (5.0) dXRD: determined by Scherrer: NiO peak at a 2θ = 43.3° and CeO2 peak at 2θ = 28.5°. Values between parentheses were determined over reduced samples by the Rietveld refinement. Table 3 XPS binding energy of reduced catalysts. Table 3 Catalyst Ni2p3/2(eV) Ce 3d5/2(eV) Ni° NiO Ni°Sat NiOSat v° v´ v v´´ v´´´ Ninitrate 852.2 855.2 857.7 861.8 880.9 884.9 881.7 886.4 898.8 NiEDTA 851.9 854.8 857.9 861.5 880.8 885.0 882.0 886.4 898.1 NiNTA 851.9 854.7 857.4 861.3 880.6 884.8 882.0 886.3 898.0 NiCA 851.8 854.7 856.8 861.0 880.7 885.0 881.9 886.0 897.8 Table 4 Surface composition of reduced catalysts from XPS. Table 4 Catalyst Ce3+/Ce4+ Ni/(Ni + Ce + Al + Mg) Ce/(Ni + Ce + Al + Mg) Ce/Ni0 Ni0/Ni Ninitrate 0.7 0.094 0.04 1.26 0.33 NiEDTA 1.4 0.062 0.06 3.40 0.27 NiNTA 1.5 0.066 0.06 2.80 0.34 NiCA 1.0 0.058 0.04 2.27 0.32 Table 5 Catalytic results the in the ethanol steam reforming reaction over Ni catalysts. Table 5 Catalytic system ESR Operating condition X C 2 H 5 O H Main products Carbon deposition Ref. (A) Ni(10%)-1Ce/MMT(B) Ni(10%)-0.5Ce/MMTMMT: Na-montmorillonite Catalyst weight = n.d.TR = 650 °CLiquid feed flow = 0.07 mL/minR = 8TOS: 4 h (A) 97.3%(B) 93.2 % Selectivity(A) H2: 88.5%CO: 27.5%; CO2: 63.8%CH4: <10%; CH3CHO: <5%(B) H2: 82.4%,CO: ∼30%; CO2:∼ 55%CH4: <10%; CH3CHO: <5% Negligiblegraphitic carbon deposition on Ni-Ce/MMT (by XRD of used catalyst) [34] (A) Ni(20%)/5Mg-ATP(B) Ni(20%)/10Mg-ATPATP: Attapulgite clay Catalyst weight = 1 gTR = 700 °CFeed of the mixture of H2O andC2H5OH with inert gas of N2:0.16 L/minR = 3GHSV = 19.200–19.400 h−1.TOS: 4 h (A) ∼100%(B) 100% (A) H2: ∼5.5 molH2/molC2H5OHCO: ∼35%; CO2: ∼55%CH4: ∼5%; CH3CHO: <5%C2H4: <5%(B) H2: ∼5.7 molH2/molC2H5OH,CO: ∼25%; CO2: ∼65%CH4: <5%; CH3CHO: <5%C2H4: <5% (A) 29.8mgC g c a t - 1 h−1.(B) 6.1mgC g c a t - 1 h−1. [35] Ni(7%)/MgO–CeO2 Catalyst weight = 30 mgTR = 600 °CR = 6Inlet ethanol concentration: 9%Liquid feed flow = 1-15 mL/hGHSV = 4895 mL g c a t - 1 h−1 W/F = 0.735 g s/mLTOS:18 h ∼100% SelectivityH2: ∼ 70%CO2: ∼ 20%; CO: ∼ 10%CH4: < 5% 13.9mgC g c a t - 1 h−1. [36] Ni(5%)/MgOMgO obtained by precipitation with NaOH Catalyst weight = 20 mg diluted with SiC (SiC mass/catalyst mass = 3.0)TR = 500 °CR = 3TOS: 28 h 95 to 60% SelectivityH2: ∼65%CO: ∼10%; CO2: ∼20%CH4: ∼5%; CH3CHO: 0% 6.2mgC g c a t - 1 h−1 [37] Ni(6%)/Al2O3 Al2O3 obtained by sol gel calcination at 800 °C Catalyst weight = 0.5 g ReactionTR = 400 °CFlow rate = 0.1 mL/minR = 6TOS: 8 h ∼99% H2: ∼4 molH2/molC2H5OH 17.5mgC g c a t - 1 h−1. [38] NiO(15 %)/Ce0.7Pr0.3O2 Catalyst weight = 75 mgTR = 650 °CR = 3Space velocity = 80,000 mL/h·gcat 100% SelectivityH2: ∼60%CO: ∼40%; CO2: ∼15%CH4: <5%; CH3CHO: <5% Carbon was not detected over used catalyst by TG-DTA analysis [39] (A) Ni(8%)/Ce(5%)-MgAl2O4 (nickel acetate as precursor)(B) Ni(8%)/CeO2(5%)-MgAl2O4 (nickel nitrate as precursor)Decomposition in reductive atmosphere Catalyst weight = 50 mgTR = 650 °CR = 4.9Ethanol flow 1.02 × 10−3 mol/min.Inlet Ethanol concentration: 7.8%TOS: 10 h (A) 97.1%(B) 95.8% Selectivity(A) H2: ∼75%CO: ∼25%; CO2: ∼30%CH4: ∼10%; CH3CHO: 2.9%(B) H2: 74%CO: ∼25%; CO2: ∼30%CH4: <5% ; CH3CHO: 5.1% (A) 24.1mgC g c a t - 1 h−1.(B) 0.4mgC g c a t - 1 h−1. [22] TR: reaction temperatura; R: H2O:C2H5OH molar ratio; TOS: time on stream. Table 6 TG-TPO results for used catalysts in ethanol steam reforming reaction for 7 h. Table 6 Catalyst Tmax, °C %C mgC g c a t - 1 h−1 Ninitrate 702 22 30.6 NiEDTA 550 ∼2 ∼1.4 NiNTA 537 ∼2 ∼1.4 NiCA 639 29 37.4 Hydrogen production from ethanol: Synthesis of Ni catalysts assisted by chelating agents A.C. Villagrán-Olivares M.F. Gomez M.N. Barroso M.C. Abello ⁎ Instituto de Investigaciones en Tecnología Química (INTEQUI-CONICET-UNSL), Almirante Brown 1455, 5700, San Luis, Argentina Instituto de Investigaciones en Tecnología Química (INTEQUI-CONICET-UNSL) Almirante Brown 1455 San Luis 5700 Argentina ⁎ Corresponding author. Graphical abstract The steam reforming of ethanol was studied over supported Ni catalysts. The catalysts were prepared by the wet impregnation method, using chelating solutions (ethylendiaminetetraacetic acid, EDTA; nitrilotriacetic acid, NTA; and citric acid, CA). The solids were characterised by means of X-ray diffraction, BET specific surface area, temperature programmed reduction, X-ray photoelectron spectroscopy and thermogravimetry analysis. The catalyst prepared from EDTA solution was the most active and selective, with a low amount of carbon deposited after 7 h in reaction. This behaviour was associated with an improvement in the Ni-CeO2 interaction induced by the small NiO particle size obtained from the use of a chelating agent. This sample also showed a high Ce3+/Ce4+ ratio and the smallest particle size of metallic nickel. Keywords Hydrogen production Ni/MgAl2O4-CeO2 Chelating agents Ethanol reforming 1 Introduction Ni catalysts used in ethanol steam reforming reaction are less expensive and have greater availability in comparison to noble metal catalysts. However, their main drawback is the high level of deactivation observed in reaction, due mainly to carbon deposition, sintering and/or inactive phase formation. One strategy for minimising these deactivation phenomena is to control the metallic ensemble. Small particles decrease the carbonaceous deposition rate, since this reaction is sensitive to the structure [1], although small particles are more susceptible to sintering and oxidation. The method used to synthesise the catalyst plays a significant role in controlling the size of the Ni particles [2]. In the literature, the use of aqueous solutions of chelated metal complexes within the wet impregnation method has been reported. This strategy is very interesting, as it maintains the simplicity of the technique; it allows a high level of reproducibility of synthesis, uniform distributions of the active phase and higher metallic dispersions. One characteristic of these solutions is the increase in viscosity during solvent removal in the drying step, inhibiting the distribution of surface species and forming poorly crystallised compounds with high dispersion [3]. Several factors should be considered when using a preparation with chelating ligands, which control the electrostatic interactions between the complex and the support, for instance the pH of the solution and the point of zero charge (PZC) of the support [4,5], the characteristics of the ligand structure, the thermal precursor decomposition, and the drying procedure. The pH of the solution plays a significant role in the formation of the complex compound, in the surface speciation of the support, and in the control of metal-support interactions [6]. The chelating agents most widely used in supported catalysts preparation are ethylendiaminetetraacetic acid (EDTA), nitrilotriacetic acid (NTA) and citric acid (CA). It is well known that this class of ligands forms soluble and very stable complexes with a wide range of metals. In addition, the obtained precursors contain no elements other than C, H, N or O, thereby avoiding any contamination. The thermal decomposition of the complexes is completed at moderate temperatures, and the residual carbon contamination on the support surface left by the organic part of the precursor is close to that of other methods. Chelating agents have successfully been used in the preparation of hydrodesulphurisation (HDS) catalysts [6–9], for the Fischer-Tropsch synthesis [10–13] and more recently in catalysts for reforming reactions [14–18]. The group of Yamada have reported the use of organic ligands in preparation of highly active cobalt catalysts for Fischer- Tropsch synthesis. They found an increase of Co dispersion when the NTA chelating agent was employed. The NTA formed Co complexes with a moderate formation constant and a ligand:Co molar ratio equal 1:1. They reported that the presence of chelating agent hindered the sintering of Co during the thermal treatment, due to the bulky structure of the complex and the NTA encapsulation effect with the metal. The [CoL]− complex formed in solution was preserved over the dried catalysts. In addition, they confirmed from a XAFS study that the decrease in particle sizes of Co was due to the interaction of CoOx groups with chelate during calcination [11,11,12,13]. Ortega-Domínguez et al. have studied the effect of chelating agents in the preparation of hydrogenation Ni catalysts. They have also found that the use of EDTA improved the Ni and NiO dispersions, increased the Ni-support interactions and the hydrogenation activity of naphthalene. On the contrary, the catalysts prepared by the addition of CA showed larger particle of Ni (observed by HRTEM) and lower catalytic activity. The molar ratios used in preparation corresponded to the stoichiometric ratios for a complete complexing and the decomposition temperature was low (400 °C). However, the pH of impregnation solutions was missing and probably it could explain the differences observed in particle sizes [19,20]. The role of solution pH in the presence of chelating agents was studied in NiW/γ-Al2O3 HDS catalysts. Santolalla-Vargas et al. have determined that the higher stability of [Ni(CyDTA)]2-complex and an increase of NiWS species were reached at pH = 4 [21]. Bang et al. studied Al2O3-supported Ni catalysts prepared from EDTA solutions in the liquefied natural gas reforming reaction for hydrogen production. They reported smaller metallic Ni particles and a higher Ni dispersion with higher methane adsorption. These authors also found an increase in metal-support interaction due to the Coulombic interaction between positively charged hydroxyl groups of alumina and Ni(EDTA)2− complex. The catalyst prepared with EDTA showed a better catalytic performance and a high sintering resistance during the reforming reaction at 800 °C [17]. Recently, the catalytic performance in methane dry reforming over Ni/SBA-15 catalysts was increased by using chelates. The formation of Ni-O(H)-Si bond assisted by the organic ligand increased the interaction with support and the tolerance to sintering and to carbon deposition. In addition, the electron-pair donor atoms and the high viscosity of chelating solution inhibited the nickel species aggregation and contributed to the formation of Ni particles with size lower than 6 nm [18]. In a previous work, Ni catalysts supported on MgAl2O4 doped by PrO2 or CeO2 were studied in the ethanol steam reforming (ESR) reaction under mild conditions (inlet ethanol concentration = 7.8%, feed molar ratio H2O:C2H5OH = 4.9, reaction temperature = 650 °C, and W/FC2H5OH = 49 g min mol C 2 H 5 OH - 1 ) . The catalyst with CeO2 decomposed under reductive atmosphere showed the best results in ESR [22] with a loss conversion of 6.6% during 10 h in time on stream. The influence of impregnation medium was also studied [23]. The catalyst prepared from an ethanolic solution of Ni(NO3)2 showed a high Ce3+/Ce4+ ratio and an average Ni diameter around 28 nm. The catalytic results in ESR were also promising, although carbon deposition and sintering were observed after 40 h in reaction. In this work with the aim of improving the catalytic performance, Ni catalysts supported over MgAl2O4-CeO2 were prepared using various chelating agents. Their influence on the sizes of Ni particles, the catalytic behaviour under ESR conditions and the deactivation were investigated. 2 Experimental 2.1 Catalyst preparation The MgAl2O4 used as support was prepared using the citrate method, under similar experimental conditions described in [22]. The spinel precursor was calcined in two steps: (i) in a N2 flow (180 mL min−1) at 500 °C for 2 h, and (ii) in static air at 700 °C for 1 h. The addition of Ce (CeO2 nominal loading 5 wt.%) was carried out using the wet impregnation method from an aqueous solution of Ce(NO3)3.6H2O (Aldrich, 99%). The modified support was dried at 100 °C in a vacuum for 20 h and was used without calcination. Aqueous solutions of Ni(NO3)2 (Ni nominal loading of 8 wt.%) and a chelating agent (L) of EDTA (Sigma-Aldrich, 99%), NTA (Sigma-Aldrich, 99%) or CA (Sigma-Aldrich, 99.5%) were prepared. The molar ratio of the metal to the ligand was always 1:1. First, the chelating agent was dissolved in a 1 M NH4OH solution to pH 10, to assure its complete solubility and the formation of anionic species. The nitrate aqueous solution was slowly added to the ligand solution, and the pH was maintained by the addition of NH4OH drops. Following this, the complex aqueous solutions were adjusted at a pH (around 6) that was lower than the PZC value of the modified support using an HNO3 solution. They were then aged under stirring at room temperature for 2 h. Then, 1 g of the modified support was added and stirred for 1 h. The solvent was slowly removed under vacuum at 80 °C for 1 h. The dried samples were calcined in static air between room temperature and 650 °C at 10 °C min−1, and then for 3 h at 650 °C. The catalysts are referred to here as NiL. As a reference, a sample without chelating agent was prepared following the same procedure and is designated here as Ninitrate. 2.2 Characterisation of samples The PZC of the support was determined using the salt addition method [24]. The pH of 25 mL KNO3 0.1 M solutions was adjusted using KOH and HNO3 in a pH range between 2 and 12. The pH of each solution (pHinitial) was measured using a pHmeter (Lutron PH-230 SD with a Van London glass electrode). A suspension of 25 mg of powder modified support was formed in each solution under vigorous stirring at 175 rpm for 24 h in an universal stirrer (Edmund Buhler KL-2). Following this, the pH of each suspension was carefully measured (pHend), and ΔpH (estimated as the difference between pHend and pHinitial) plotted as a function of pHinitial. The value of pHinitial at ΔpH = 0 was taken as the PZC. The distinct species present in the impregnation solutions were determined using Medusa software [25]. The equilibrium diagrams were obtained at 25 °C, taking into consideration all the ions present in the solutions. Nickel and cerium chemical compositions were determined by inductively coupled plasma-atomic emission spectroscopy (ICP) by using a sequential ICP spectrometer Baird ICP 2070 (BEDFORD) with a Czerny Turner monochromator (1 m optical path). The solid samples were brought into solution by an alkali fusion with KHSO4 and subsequent dissolution with an aqueous HCl. Textural properties were recorded using a Micromeritics Gemini V. The N2 adsorption–desorption isotherms and the specific surface areas of samples (SBET) determined by the BET method were obtained from adsorption–desorption measurements of N2 at −196 °C. The samples were previously degassed at 250 °C for 16 h in a N2 flow. Diffraction patterns of samples, XRD, were obtained using a Rigaku D-Max III C diffractometer operated at 30 kV and 20 mA. A radiation CuK α (λ = 0.15418 nm) with an Ni filter and a horizontal goniometer were employed. Step scans were taken over a range of 2θ from 10° to 70° in steps of 3° min−1, and data were collected every 0.05°. Identification of the crystalline phase was made by matching with JCPDS files. The crystallite sizes of NiO and CeO2 were determined using the Scherrer equation. The redox properties of samples were examined using temperature-programmed reduction (TPR) measurements, and the experiments were carried out using a conventional equipment described in [22]. Before the TPR experiments were undertaken, the samples were treated first under an O2 (17%)/He flow (36 mL min−1) at 300 °C for 1 h and then in He flow (30 mL min−1) for 30 min. After cooling in a He flow to room temperature, the samples were reduced in a H2(5 vol.%)/N2 flow (50 mL min −1) from room temperature to 950 °C at 10 °C min―1 and kept at 950 °C for 1 h. The H2 consumption was determined after a previous calibration. X-ray photoelectron analyses (XPS) were performed using a multi-technique system (SPECS). The residual pressure inside the analysis chamber was kept below 2 × 10−8mbar. Ni 2p, Ce 3d and Al 2p spectra were recorded for each fresh sample. All binding energies (BE) were referred to the C 1s peak at 284.6 eV, and the BE for the Al 2p was therefore about 74.1 eV. The samples were ex situ reduced to 650 °C in an H2(5%)/N2 flow for 45 min. In addition, they were treated inside the pre-chamber in a reductive flow of H2(5%)/Ar at 400 °C for 10 min and atmospheric pressure before the XPS measurements were taken, since a reduction at 650 °C could not be carried out in the XPS equipment used in this work. The experimental conditions and data treatment were the same as those described in [26]. The TG-TPO analyses were carried out in a DTG-60 Shimadzu instrument. The samples were heated from room temperature to 1000 °C at 10 °C min−1 under an air flow (50 mL min−1). The carbon amount was expressed as %C and mgC g c a t - 1 h−1. 2.3 Catalytic experiments in ethanol steam reforming The reaction was studied using an experimental setup described elsewhere [27]. In brief, the reactor was operated at 650 °C and atmospheric pressure. The feed to the reactor was a gas mixture of ethanol, water and inert gas. The H2O:C2H5OH molar ratio in the feed was 4.9, and the initial ethanol concentration was around 9.4%. In all experiments, the W/ F C2H5OH was 49 g min m o l C2H5OH - 1 . The amount of catalyst was 50 mg without dilution. Before the catalytic experiments were carried out, the catalyst was in situ reduced in a H2(5%)/N2 flow at 650 °C for 45 min. The reactants and reaction products were analysed online using gas chromatography. The ethanol conversion (XC2H5OH), selectivity to carbon products (Si) and hydrogen yield (YH2) were estimated as described elsewhere [27]. 3 Results and discussion Adequate interaction between the impregnation species and the oxide used as support requires control over the pH of the impregnation solution. Oxides immersed in solutions at pH values below their PZC would adsorb anionic species, whereas at pH values above their PZC, these would adsorb cations [28]. In view of these constraints on the adsorption process involved in catalyst preparation using the impregnation method, the PZC of the support was determined by the “salt addition” method. Fig. 1 presents the curves used to determine the PZC values of the modified support MgAl2O4-CeO2, MgAl2O4 and pure CeO2. The PZC values determined for pure compounds (PZCMgAl2O4 = 9.4 and PZCCeO2 = 7.4) agree with other values in the literature [29,30]. The PZC value of MgAl2O4-CeO2 was 9.6, very close to that of pure spinel; this is reasonable due to the low CeO2 loading. The equilibrium Ni species in the different preparation solutions were obtained from equilibrium diagrams (not shown). The main species in the pH range of the solutions and the equilibrium constants of the complexes formed are summarised in Table 1 . The stability of the complexes could be inferred from the high K values. Hexahydrate nickel [Ni(H2O)6]2+ was the only species in the Ni(NO3)2 aqueous solution at pH = 5.9. In the presence of chelating agents, the main Ni species are anionic. In the case of citric acid, two anionic species, [Ni(CA)2]4− and [Ni(CA)]−, and a cationic species containing an ammonium ligand, [Ni(NH3)]2+, were predicted. The explanation for this is that the CA:Ni molar ratio used in the preparation was lower than that required for the maximum stoichiometry for complexation (CA:Ni = 2). These results indicate that the pH of the impregnating solutions used in preparation was lower than the PZC of the support (Table 1). The average Ni and Ce compositions were 6.2 and 4.7 wt.%, respectively, lower than the nominal ones, Table 2 . The precursor salts used in preparation were in hydrated forms and they would explain the lower values. The adsorption–desorption isotherms of N2 for all the catalysts were of type IV with an H1 hysteresis loop, which is characteristic of mesoporous materials. The specific surface values obtained by the BET method are shown in Table 2. The SBET value of the modified support was 102 m2 g−1. A decrease in SBET from 5% to 22% was observed after impregnation. The X-ray diffraction patterns of the fresh catalysts are shown in Fig. 2 . They reveal the presence of MgAl2O4, CeO2 and NiO. The particle sizes of NiO and CeO2 were determined by deconvolution in the 2θ range of interest, using the Scherrer equation. The use of chelating agents in the preparation decreased the particle size of NiO. The dNiO followed the order of 6.2 nm (NiEDTA) < 9.3 nm (NiNTA) < 12.4 nm (NiCA) < 18 nm (Ninitrate), as shown in Table 2. Changes in the CeO2 particle sizes could be also observed. The modified support was used in its dried form, and consequently a surface re-dissolution of CeO2 could occur during the impregnation of complexes with Ni2+, affecting the final dispersion and/or their interaction with Ni. Complementary analyses verified the dissolution of cerium. The impregnation solutions were filtered before the solvent removal and they were analysed by ICP. The results clearly indicated the presence of Ce in the solution. The extent of dissolution was around of 16% in all the samples TPR experiments were carried out to study the metal–support interaction and the influence of the nature of the ligand in the reducibility of Ni and CeO2. The TPR profiles are illustrated in Fig. 3 . All catalysts showed broad TPR profiles with several overlapped peaks. Peaks at low temperature were assigned to the reduction of Ni2+ species weakly interacting with the MgAl2O4; Ni2+ interacting with CeO2 particles; and Ce4+ at the CeO2 surface [31–33]. Peaks I and II at low temperature were observed: at 260 and 338 °C for NiEDTA; 308 and 414 °C for NiNTA; 314 and 497 °C for NiCA; and at 310 and 600 °C for Ninitrate. These differences in reduction temperatures suggest changes in NiO-CeO2 interactions and in Ni reducibility. In addition, this behaviour indicates the presence of species in different environment and needs complementary studies for a correct assignation of species being reduced. The broad peak at high temperature (peak III) was ascribed to the reduction of Ni2+ species interacting more with the support and to the reduction of CeO2 to Ce2O3. The reduction experiments were carried out until 950 °C and bulk CeO2 was also reduced. XRD of samples after TPR (not shown) revealed the presence of Ce2O3. The more intense diffraction peak of CeO2 at 2θ = 28.5° is still observed indicating its partial reduction. The hydrogen consumptions were estimated by the integration of the H2–TPR profile and considering the catalyst composition. They followed the order of Ninitrate (1.11 mol H2/mol Ni) < NiEDTA (1.15) < NiCA (1.22) ≈ NiNTA (1.25). These consumptions were higher than the theoretical ones to the complete reduction of Ni2+ to Ni° in agreement with the surface reduction of Ce4+ and the presence of Ce2O3. In Fig. 4 , XRD patterns are shown for samples reduced under the same conditions as before the reforming runs. In comparison with the XRD of fresh samples, no significant differences were observed except for the presence of Ni0 at 2θ = 51.8°. The peak at 2θ = 43.3° was assigned to NiO. The intensity of this peak was substantially decreased, and its presence implies that the reduction at 650 °C for 45 min was incomplete. This peak was also observed in the XRD of the samples used in the ESR reaction (see below). The particles sizes of Ni and residual NiO were determined using Rietveld refinement over XRD patterns recorded between 2θ = 10°–90° in the step mode (step scan = 0.02°; time step: 5 s). The dNi values followed the order of 2.7 nm (NiEDTA) < 3.7 nm (NiCA) < 4.3 nm (NiNTA) < 4.8 nm (Ninitrate); and dNiO was 4.4 nm (NiEDTA), 12.1 nm (NiCA), 12.6 nm (NiNTA) and 21.1 nm (Ninitrate). A higher Ni dispersion over the reduced NiEDTA could be inferred. The CeO2 particle sizes were preserved after reduction, Table 2. XPS was employed to determine the chemical state and surface composition of Ni and Ce over the reduced samples. The XP spectrum of Ni 2p presented peaks at binding energies corresponding to Ni0 and Ni2+, as shown in Fig. 5 and Table 3 . The presence of Ni2+ indicates that the reduction at 650 °C for 45 min was incomplete; this agrees with the XRD results for the reduced samples (Fig. 4). The additional in situ reduction at 400 °C for 10 min in the pre-chamber was insufficient to complete the NiO reduction. The XP spectrum for Ce 3d exhibited peaks at 880.6–880.9, 881.7–882.0, 884.8–885.0, 886.4–886.0 and 897.8–898.2 eV, corresponding to Ce 3d5/2, and these could be assigned to Ce4+ (v, v´´, v´´´) and Ce3+ (v°, v´) [26] (Fig. 5 and Table 3). The Ni0/Ni surface ratios considered as dispersion measurements are shown in Table 4 . They varied between 0.27 and 0.34, indicating that the dispersion did not change in a meaningful way and is independent of the metallic precursor. These values were unexpected, and could be explained by sintering under reduction conditions, since it is known that smaller particles are easy to sinter. However, the use of chelating agents induced significant changes in the Ce/Ni0 and Ce3+/Ce4+ surface values. These results may be associated with the initial presence of smaller NiO particles in catalysts prepared by the complexing method, improving the Ni-CeO2 interactions and facilitating the CeO2 reduction. The Ce/Ni° surface ratio follows the order NiEDTA > NiNTA > NiCA > Ninitrate. A correlation between the amount of Ce atoms per metallic Ni (Ce/Ni0 ratio by XPS) and NiO particle size, considered as an indirect measure of Ni-CeO2 interaction (the bigger the NiO particle size is, the weaker the interaction), was observed, Fig. 6 . The strong relationship between these two parameters is an evidence of the role of NiO particle size. The bigger NiO particle size is, the lower the amount of Ce atoms per Ni. Differences in Ce3+/Ce4+ values were also determined and were higher for NiEDTA and NiNTA. The presence of the Ce3+- Ce4+ couple increases the carbon resistance [26], since CeO2 can reversibly change its oxidation states, Ce3+- Ce4+, store and release oxygen and mediate in the carbon removal reactions. Catalytic performance of all catalysts at the same reforming conditions is shown in Fig. 7 . A complete initial conversion of ethanol was found for all the catalysts with a H2 yield around 5 mol H2/mol C2H5OH. A slight conversion decay over 7 h in reaction was observed, except for NiEDTA. The main products were H2, CO2, CO and CH4. Except for NiEDTA, C2H4O and C2H4 were also detected in all systems. The selectivities for minority products (CH4, C2H4O and C2H4) over Ninitrate were stable, and were lower than 4%. In the case of NiNTA and NiCA, a slight increase in the C2H4O formation was observed although the H2 yield was almost constant. This behaviour could be attributed to the WGS reaction (CO +H2O ↔ CO2 + H2). From TPR profiles for NiNTA and NiCA could be inferred the presence of Ni species in different environmental which likely were the responsible of this catalytic behaviour. The modified support was also studied under the same reforming conditions and it showed a low reforming capacity. The ethanol conversion decreased from 100% to 66% after 7 h, and simultaneously the selectivity to C2H4O increased from 2 to 47%. The formation of C2 (C2H4+C2H6), C3H6O and CO2 was significant with small amount of H2. As it was expected, these results put in evidence the role of nickel as an active site. In Table 5 , recent results in ESR reaction over Ni catalysts are shown. It must be noted that a direct comparison between results is not possible due to differences in reaction experimental conditions. Reaction temperature, feed composition, residence time, etc. strongly influence the catalytic performance. If the carbon deposition rate is considered as a parameter of stability (see further), the NiEDTA and NiNTA show the best behaviours. However, the performance in ESR reaction on NiEDTA is better since C2H4O and C2 are not observed during 7 h in time on stream. From the catalytic results, no significant deactivation was observed, but the post-reaction characterisation of samples revealed changes that indicate that this phenomenon may appear over a long reaction time. The XRD results for the samples used are shown in Fig. 8 . The MgAl2O4 support was stable under reaction [27], and the Ni0 phase is clearly observed at 2θ = 51.8° in all the samples. A weak peak assigned to NiO is observed in XRD for Ninitrate and NiCA. In comparison with the XRD results for the reduced samples, a degree of sintering could be inferred. The Ni particle sizes after reaction were between 15–20 nm. In addition, a peak at 2θ = 26° assigned to graphitic carbon was detected; its intensity was high for NiCA and Ninitrate and substantially lower for NiNTA and NiEDTA. These differences can be associated with CeO2 dispersion and the high Ce3+/Ce4+ ratio determined for these samples. These results agree with those from TG-TPO analysis for the catalysts used (Fig. 9 ). Weight losses took place between 530 °C and 700 °C due to carbon combustion, and the temperatures at maximum weight loss are shown in Table 6 . The amounts of carbon were lower for NiEDTA and NiNTA, and their low combustion temperatures indicate a lower extent of graphitisation [40]. An analysis of the results shows that NiEDTA gave the best performance in the ethanol steam reforming reaction. This behaviour, as compared with the results for NiNTA, can be assigned to the improvement in Ni-CeO2 interactions (highest Ce/Ni0 value) induced by the low size of NiO particles. 4 Conclusions Ni catalysts supported over MgAl2O4-CeO2 were prepared by wet impregnation, using three different chelating agents, EDTA, NTA and CA, in the impregnation solution. The use of an organic ligand allowed NiO nanoparticles to be obtained with smaller sizes than those obtained in the absence of a chelating agent. A redistribution of CeO2 was also observed. The systems prepared using EDTA and NTA showed smaller NiO and CeO2 particle sizes and the highest Ce3+/Ce4+ values. All catalysts were active in the ethanol steam reforming reaction, with the main products being H2, CO2 and CO. Under the reforming conditions used in this work, the best catalytic performance was obtained over the NiEDTA catalyst. C2H4 and C2H4O were not detected on this catalyst during 7 h of reaction, and the carbon deposition was low. This behaviour was associated with an improvement in the Ni-CeO2 interaction, induced by the small NiO particle size obtained from the use of chelating agent. This sample also showed a high Ce3+/Ce4+ ratio and the smallest particle size of metallic nickel. The use of complex precursors is an interesting strategy for obtaining improved properties for Ni reforming catalysts. Acknowledgements This work wassupported by CONICET [PIP 00327], San Luis National University-Argentina [Project PROICO 2-0116], and the ANPCyT [PICT 1470-2014]. The authors thank Dr. Carlos Lopez for his assistance in the Rietveld refinement. References [1] J.R. Rostrup-Nielsen J. Sehested J. Norskov Hydrogen and synthesis gas by steam and CO2 reforming J. Adv. Catal. Sci. Technol. 47 2002 65 139 [2] L. Mattos G. Jacobs B. Davis F. Noronha Production of hydrogen from ethanol: Review of reaction mechanism and catalyst deactivation Chem. Rev. 112 2012 4094 4123 [3] A.J. van Dillen R.J.A.M. Terorde D.J. Lensveld J.W. Geus K.P. de Jong Synthesis of supported catalysts by impregnation and drying using aqueous chelated metal complexes J. Catal. 216 2003 257 264 [4] K. Al-Dalama B. Aravind A. Stanislaus Influence of complexing agents on the adsorption of molybdate and nickel ions on alumina Appl. Catal. A Gen. 296 2005 49 53 [5] J. Ryczkowski W. Grzegorczyk D. Nazimek Support modification with organic reagents and its influence on the development of metal active surface areas in Ni/Al2O3 catalysts Appl. Catal. A Gen. 126 1995 341 349 [6] V.A. Suarez Toriello C.E. Santolalla Vargas J.A. de los Reyes A. Vazques Zavala M. Vrinat C. Geantet Influence of the solution pH in impregnation with citric acid and activity of Ni/W/Al2O3 catalysts J. Mol. Catal. A Chem. 404-405 2015 36 46 [7] J. Escobar M.C. Barrera J.A. de los Reyes J.A. Toledo V. Santes J.A. Colin Effect of chelating ligands on Ni–Mo impregnation over wide-pore ZrO2–TiO2 J. Mol. Catal. A Chem. 287 2008 33 40 [8] L. Peña D. Valencia T. Klimova CoMo/SBA-15 catalysts prepared with EDTA and citric acid and their performance in hydrodesulfurization of dibenzothiophene Appl. Catal. B 147 2014 879 887 [9] P. Castillo-Villalón J. Ramirez J.A. Vargas-Luciano Analysis of the role of citric acid in the preparation of highly active HDS catalysts J. Catal. 320 2014 127 136 [10] J.S. Girardon E. Quinet A. Griboval-Constant P.A. Chernavskii L. Gengembre A.Y. Khodakov Cobalt dispersion, reducibility, and surface sites in promoted silica-supported Fischer–Tropsch catalysts J. Catal. 248 2007 143 157 [11] T. Mochizuki T. Hara N. Koizumi M. Yamada Surface structure and Fischer–Tropsch synthesis activity of highly active Co/SiO2 catalysts prepared from the impregnating solution modified with some chelating agents Appl. Catal. A Gen. 317 2007 97 104 [12] N. Koizumi T. Mochizuki M. Yamada Preparation of highly active catalysts for ultra-clean fuels Catal. Today 141 2009 34 42 [13] N. Koizumi Y. Ibi D. Hongo Y. Hamabe S. Suzuki Y. Hayasaka T. Shindo M. Yamada Mechanistic aspects of the role of chelating agents in enhancing Fischer-Tropsch synthesis activity of Co/SiO2 catalyst: Importance of specific interaction of Co with chelate complex during calcination J. Catal. 289 2012 151 163 [14] C.E. Daza J. Gallego F. Mondragón S. Moreno R. Molina High stability of Ce-promoted Ni/Mg–Al catalysts derived from hydrotalcites in dry reforming of methane Fuel 89 2010 592 603 [15] S. Karnjanakom G. Guan B. Asep X. Dua X. Hao C. Samart A. Abudula Catalytic steam reforming of tar derived from steam gasification of sunflower stalk over ethylene glycol assisting prepared Ni/MCM-41 Energy Convers. Manag. 98 2015 359 368 [16] X. Lu J.F. Chen Y. Tan Y. Zhang A highly dispersed nickel supported catalyst for dry reforming of methane Catal. Comm. 20 2012 6 11 [17] Y. Bang S. Park S.J. Han J. Yoo J.H. Song J.H. Choi K.H. Kang I.K. Song Hydrogen production by steam reforming of liquefied natural gas (LNG) over mesoporous Ni/Al2O3 catalyst prepared by an EDTA-assisted impregnation method Appl. Catal. B 180 2016 179 188 [18] Q. Zhang K. Long J. Wang T. Zhang Z. Song Q. Lin A novel promoting effect of chelating ligand on the dispersion of Ni species over Ni/SBA-15 catalyst for dry reforming of methane Int. J. Hydrogen Energy 42 2017 14103 14114 [19] R.A. Ortega-Domínguez C. Peñaloza-Orta L.I. Puente L.C. Salcedo T.E. Klimova Effect of ligands on the dispersion of Ni nanoparticles in Ni/SBA-15 hydrogenation catalysts Mater. Res. Soc. Symp. Proc. 1479 2013 39 44 [20] R.A. Ortega-Domínguez H. Vargas-Villagrán C. Peñaloza-Orta K. Saavedra-Rubio X. Bokhimi T.E. Klimova A facile method to increase metal dispersion and hydrogenation activity of Ni/SBA-15 catalysts Fuel 198 2017 110 122 [21] C.E. Santolalla-Vargas V.A. Suárez Toriello J.A. de los Reyes D.K. Cromwell B. Pawelec J.L.G. Fierro Effect of pH and chelating agent on the NiWS phase formation in NiW/γ-Al2O3 HDS catalysts Mater. Chem. Phys. 166 2015 105 115 [22] A.E. Galetti M.N. Barroso M.F. Gomez L.A. Arrua A. Monzón M.C. Abello Promotion of Ni/MgAl2O4 catalysts with rare earths for the ethanol steam reforming reaction Catal. Lett. 142 2012 1461 1469 [23] A.C. Villagrán-Olivares M.F. Gomez M.N. Barroso M.C. Abello Ni-supported catalysts for ethanol steam reforming: effect of the solvent and metallic precursor in catalyst preparation IJIC 9 2018 61 73 [24] T. Mahmood M.T. Saddique A. Naeem P. Westerhoff S. Mustafa A. Alum Comparison of different methods for the point of zero charge determination of NiO Ind. Eng. Chem. Res. 50 2011 10017 10023 [25] I. Puigdomenech Chemical Equilibrium Diagrams 2013 Medusa Software 2 https://www.kth.se/en/che/medusa/downloads-1.386254 [26] A. Tarditi M.N. Barroso A.E. Galetti L.A. Arrúa L. Cornaglia M.C. Abello XPS Study of the surface properties and Ni particle size determination of Ni supported catalysts Surf. Interface Anal. 46 2014 521 529 [27] M.N. Barroso A.E. Galetti M.C. Abello Ni catalysts supported over MgAl2O4 modified with Pr for hydrogen production from ethanol steam reforming Appl. Catal. A Gen. 394 2011 124 131 [28] J. Ling J.R. Regalbuto The synthesis of highly dispersed noble and base metals on silica via strong electrostatic adsorption: I. Amorphous silica J. Catal. 260 2008 329 341 [29] I. Ganesh S. Olhero P. Torres J. Ferreira Gelcasting of magnesium aluminate spinel powder J. Am. Ceram. Soc. 92 2009 350 357 [30] J. Gulicovski I. Bračko S. Milonjić Morphology and the isoelectric point of nanosized aqueous ceria sols Mater. Chem. Phys. 148 2014 868 873 [31] K.Y. Koo S.H. Lee U.H. Jung H.S. Roh W.L. Yoon Syngas production via combined steam and carbon dioxide reforming of methane over Ni-Ce/MgAl2O4 catalysts with enhanced coke resistance Fuel Procces. Technol. 119 2014 151 157 [32] I. Luisetto S. Tuti C. Battocchio S. Lo Mastro A. Sodo Ni/CeO2–Al2O3 catalysts for the dry reforming of methane: the effect of CeAlO3 content and nickel crystallite size on catalytic activity and coke resistance Appl. Catal. A Gen. 500 2015 12 22 [33] A. Löfberg J. Guerrero-Cavallero T. Kane A. Rubbens L. Jalowiecki-Duhamel Ni/CeO2 based catalysts as oxygen vectors for the chemical looping dry reforming of methane for syngas production Appl. Catal. B 212 2017 159 174 [34] L. Li D. Tang Y. Song B. Jiang Q. Zhang Hydrogen production from ethanol steam reforming on Ni-Ce/MMT, Catalysts Energy 149 2018 937 943 [35] M. Chen Y. Wang Z. Yang T. Liang S. Liu Z. Zhou X. Li Effect of Mg-modified mesoporous Ni/Attapulgite catalysts on catalytic performance and resistance to carbon deposition for ethanol steam reforming Fuel 220 2018 32 46 [36] J.A. Santander G.M. Tonetto M.N. Pedernera E. Lopez Ni/CeO2–MgO catalysts supported on stainless steel plates for ethanol steam reforming Int. J. Hydrogen Energy 42 2017 9482 9492 [37] G.T. Wurzler R.C. Rabelo-Neto L.V. Mattos M.A. Fraga F.B. Noronha Steam reforming of ethanol for hydrogen production over MgO-supported Ni-based catalysts Appl. Catal. A Gen. 518 2016 115 128 [38] Z. Yaakob A. Bshish A. Ebshish S.M. Tasirin F.H. Alhasan Hydrogen production by steam reforming of ethanol over nickel catalysts supported on sol gel made alumina: influence of calcination temperature on supports Materials 6 2013 2229 2239 [39] W. Hong Z. Lijuan Y. Muzhaozi X. Tingyu L. Yuan Steam reforming of ethanol over Ni/Ce0.7Pr0.3O2 catalyst J. Rare Earths 30 2012 670 675 [40] T.G. Ros A.J. van Dillen J.W. Geus D.C. Koningsberger Surface oxidation of carbon nanofibers Chem. Eur. J. 8 2002 1151 1161",
      "scopus-id": "85051785853",
      "coredata": {
        "eid": "1-s2.0-S2468823118303109",
        "dc:description": "The steam reforming of ethanol was studied over supported Ni catalysts. The catalysts were prepared by the wet impregnation method, using chelating solutions (ethylendiaminetetraacetic acid, EDTA; nitrilotriacetic acid, NTA; and citric acid, CA). The solids were characterised by means of X-ray diffraction, BET specific surface area, temperature programmed reduction, X-ray photoelectron spectroscopy and thermogravimetry analysis. The catalyst prepared from EDTA solution was the most active and selective, with a low amount of carbon deposited after 7 h in reaction. This behaviour was associated with an improvement in the Ni-CeO2 interaction induced by the small NiO particle size obtained from the use of a chelating agent. This sample also showed a high Ce3+/Ce4+ ratio and the smallest particle size of metallic nickel.",
        "openArchiveArticle": "false",
        "prism:coverDate": "2020-02-29",
        "openaccessUserLicense": null,
        "prism:aggregationType": "Journal",
        "prism:url": "https://api.elsevier.com/content/article/pii/S2468823118303109",
        "dc:creator": [
          {
            "@_fa": "true",
            "$": "Villagrán-Olivares, A.C."
          },
          {
            "@_fa": "true",
            "$": "Gomez, M.F."
          },
          {
            "@_fa": "true",
            "$": "Barroso, M.N."
          },
          {
            "@_fa": "true",
            "$": "Abello, M.C."
          }
        ],
        "link": [
          {
            "@_fa": "true",
            "@rel": "self",
            "@href": "https://api.elsevier.com/content/article/pii/S2468823118303109"
          },
          {
            "@_fa": "true",
            "@rel": "scidir",
            "@href": "https://www.sciencedirect.com/science/article/pii/S2468823118303109"
          }
        ],
        "dc:format": "application/json",
        "openaccessType": null,
        "pii": "S2468-8231(18)30310-9",
        "prism:volume": "481",
        "articleNumber": "110164",
        "prism:publisher": "Published by Elsevier B.V.",
        "dc:title": "Hydrogen production from ethanol: Synthesis of Ni catalysts assisted by chelating agents",
        "prism:copyright": "© 2018 Published by Elsevier B.V.",
        "prism:issueName": "SI: Nanostructured Materials",
        "openaccess": "0",
        "prism:issn": "24688231",
        "dcterms:subject": [
          {
            "@_fa": "true",
            "$": "Hydrogen production"
          },
          {
            "@_fa": "true",
            "$": "Ni/MgAl2O4-CeO2"
          },
          {
            "@_fa": "true",
            "$": "Chelating agents"
          },
          {
            "@_fa": "true",
            "$": "Ethanol reforming"
          }
        ],
        "openaccessArticle": "false",
        "prism:publicationName": "Molecular Catalysis",
        "openaccessSponsorType": null,
        "prism:pageRange": "110164",
        "pubType": "fla",
        "prism:coverDisplayDate": "February 2020",
        "prism:doi": "10.1016/j.mcat.2018.08.006",
        "prism:startingPage": "110164",
        "dc:identifier": "doi:10.1016/j.mcat.2018.08.006",
        "openaccessSponsorName": null
      },
      "objects": {
        "object": [
          {
            "@category": "standard",
            "@height": "9",
            "@width": "9",
            "@_fa": "true",
            "$": "https://api.elsevier.com/content/object/eid/1-s2.0-S2468823118303109-fx1.jpg?httpAccept=%2A%2F%2A",
            "@multimediatype": "JPEG image file",
            "@type": "IMAGE-DOWNSAMPLED",
            "@size": "407",
            "@ref": "fx1",
            "@mimetype": "image/jpeg"
          },
          {
            "@category": "standard",
            "@height": "4",
            "@width": "4",
            "@_fa": "true",
            "$": "https://api.elsevier.com/content/object/eid/1-s2.0-S2468823118303109-fx10.jpg?httpAccept=%2A%2F%2A",
            "@multimediatype": "JPEG image file",
            "@type": "IMAGE-DOWNSAMPLED",
            "@size": "345",
            "@ref": "fx10",
            "@mimetype": "image/jpeg"
          },
          {
            "@category": "standard",
            "@height": "8",
            "@width": "6",
            "@_fa": "true",
            "$": "https://api.elsevier.com/content/object/eid/1-s2.0-S2468823118303109-fx11.jpg?httpAccept=%2A%2F%2A",
            "@multimediatype": "JPEG image file",
            "@type": "IMAGE-DOWNSAMPLED",
            "@size": "367",
            "@ref": "fx11",
            "@mimetype": "image/jpeg"
          },
          {
            "@category": "standard",
            "@height": "9",
            "@width": "9",
            "@_fa": "true",
            "$": "https://api.elsevier.com/content/object/eid/1-s2.0-S2468823118303109-fx12.jpg?httpAccept=%2A%2F%2A",
            "@multimediatype": "JPEG image file",
            "@type": "IMAGE-DOWNSAMPLED",
            "@size": "392",
            "@ref": "fx12",
            "@mimetype": "image/jpeg"
          },
          {
            "@category": "standard",
            "@height": "9",
            "@width": "9",
            "@_fa": "true",
            "$": "https://api.elsevier.com/content/object/eid/1-s2.0-S2468823118303109-fx13.jpg?httpAccept=%2A%2F%2A",
            "@multimediatype": "JPEG image file",
            "@type": "IMAGE-DOWNSAMPLED",
            "@size": "385",
            "@ref": "fx13",
            "@mimetype": "image/jpeg"
          },
          {
            "@category": "standard",
            "@height": "10",
            "@width": "7",
            "@_fa": "true",
            "$": "https://api.elsevier.com/content/object/eid/1-s2.0-S2468823118303109-fx14.jpg?httpAccept=%2A%2F%2A",
            "@multimediatype": "JPEG image file",
            "@type": "IMAGE-DOWNSAMPLED",
            "@size": "398",
            "@ref": "fx14",
            "@mimetype": "image/jpeg"
          },
          {
            "@category": "standard",
            "@height": "9",
            "@width": "9",
            "@_fa": "true",
            "$": "https://api.elsevier.com/content/object/eid/1-s2.0-S2468823118303109-fx15.jpg?httpAccept=%2A%2F%2A",
            "@multimediatype": "JPEG image file",
            "@type": "IMAGE-DOWNSAMPLED",
            "@size": "402",
            "@ref": "fx15",
            "@mimetype": "image/jpeg"
          },
          {
            "@category": "standard",
            "@height": "7",
            "@width": "7",
            "@_fa": "true",
            "$": "https://api.elsevier.com/content/object/eid/1-s2.0-S2468823118303109-fx16.jpg?httpAccept=%2A%2F%2A",
            "@multimediatype": "JPEG image file",
            "@type": "IMAGE-DOWNSAMPLED",
            "@size": "379",
            "@ref": "fx16",
            "@mimetype": "image/jpeg"
          },
          {
            "@category": "standard",
            "@height": "5",
            "@width": "5",
            "@_fa": "true",
            "$": "https://api.elsevier.com/content/object/eid/1-s2.0-S2468823118303109-fx2.jpg?httpAccept=%2A%2F%2A",
            "@multimediatype": "JPEG image file",
            "@type": "IMAGE-DOWNSAMPLED",
            "@size": "363",
            "@ref": "fx2",
            "@mimetype": "image/jpeg"
          },
          {
            "@category": "standard",
            "@height": "9",
            "@width": "9",
            "@_fa": "true",
            "$": "https://api.elsevier.com/content/object/eid/1-s2.0-S2468823118303109-fx3.jpg?httpAccept=%2A%2F%2A",
            "@multimediatype": "JPEG image file",
            "@type": "IMAGE-DOWNSAMPLED",
            "@size": "382",
            "@ref": "fx3",
            "@mimetype": "image/jpeg"
          },
          {
            "@category": "standard",
            "@height": "10",
            "@width": "7",
            "@_fa": "true",
            "$": "https://api.elsevier.com/content/object/eid/1-s2.0-S2468823118303109-fx4.jpg?httpAccept=%2A%2F%2A",
            "@multimediatype": "JPEG image file",
            "@type": "IMAGE-DOWNSAMPLED",
            "@size": "395",
            "@ref": "fx4",
            "@mimetype": "image/jpeg"
          },
          {
            "@category": "standard",
            "@height": "7",
            "@width": "7",
            "@_fa": "true",
            "$": "https://api.elsevier.com/content/object/eid/1-s2.0-S2468823118303109-fx5.jpg?httpAccept=%2A%2F%2A",
            "@multimediatype": "JPEG image file",
            "@type": "IMAGE-DOWNSAMPLED",
            "@size": "383",
            "@ref": "fx5",
            "@mimetype": "image/jpeg"
          },
          {
            "@category": "standard",
            "@height": "8",
            "@width": "9",
            "@_fa": "true",
            "$": "https://api.elsevier.com/content/object/eid/1-s2.0-S2468823118303109-fx6.jpg?httpAccept=%2A%2F%2A",
            "@multimediatype": "JPEG image file",
            "@type": "IMAGE-DOWNSAMPLED",
            "@size": "387",
            "@ref": "fx6",
            "@mimetype": "image/jpeg"
          },
          {
            "@category": "standard",
            "@height": "9",
            "@width": "9",
            "@_fa": "true",
            "$": "https://api.elsevier.com/content/object/eid/1-s2.0-S2468823118303109-fx7.jpg?httpAccept=%2A%2F%2A",
            "@multimediatype": "JPEG image file",
            "@type": "IMAGE-DOWNSAMPLED",
            "@size": "376",
            "@ref": "fx7",
            "@mimetype": "image/jpeg"
          },
          {
            "@category": "standard",
            "@height": "9",
            "@width": "9",
            "@_fa": "true",
            "$": "https://api.elsevier.com/content/object/eid/1-s2.0-S2468823118303109-fx8.jpg?httpAccept=%2A%2F%2A",
            "@multimediatype": "JPEG image file",
            "@type": "IMAGE-DOWNSAMPLED",
            "@size": "413",
            "@ref": "fx8",
            "@mimetype": "image/jpeg"
          },
          {
            "@category": "standard",
            "@height": "6",
            "@width": "6",
            "@_fa": "true",
            "$": "https://api.elsevier.com/content/object/eid/1-s2.0-S2468823118303109-fx9.jpg?httpAccept=%2A%2F%2A",
            "@multimediatype": "JPEG image file",
            "@type": "IMAGE-DOWNSAMPLED",
            "@size": "328",
            "@ref": "fx9",
            "@mimetype": "image/jpeg"
          },
          {
            "@category": "standard",
            "@height": "200",
            "@width": "266",
            "@_fa": "true",
            "$": "https://api.elsevier.com/content/object/eid/1-s2.0-S2468823118303109-ga1.jpg?httpAccept=%2A%2F%2A",
            "@multimediatype": "JPEG image file",
            "@type": "IMAGE-DOWNSAMPLED",
            "@size": "15285",
            "@ref": "ga1",
            "@mimetype": "image/jpeg"
          },
          {
            "@category": "standard",
            "@height": "270",
            "@width": "340",
            "@_fa": "true",
            "$": "https://api.elsevier.com/content/object/eid/1-s2.0-S2468823118303109-gr1.jpg?httpAccept=%2A%2F%2A",
            "@multimediatype": "JPEG image file",
            "@type": "IMAGE-DOWNSAMPLED",
            "@size": "15089",
            "@ref": "gr1",
            "@mimetype": "image/jpeg"
          },
          {
            "@category": "standard",
            "@height": "218",
            "@width": "378",
            "@_fa": "true",
            "$": "https://api.elsevier.com/content/object/eid/1-s2.0-S2468823118303109-gr2.jpg?httpAccept=%2A%2F%2A",
            "@multimediatype": "JPEG image file",
            "@type": "IMAGE-DOWNSAMPLED",
            "@size": "26057",
            "@ref": "gr2",
            "@mimetype": "image/jpeg"
          },
          {
            "@category": "standard",
            "@height": "291",
            "@width": "340",
            "@_fa": "true",
            "$": "https://api.elsevier.com/content/object/eid/1-s2.0-S2468823118303109-gr3.jpg?httpAccept=%2A%2F%2A",
            "@multimediatype": "JPEG image file",
            "@type": "IMAGE-DOWNSAMPLED",
            "@size": "24561",
            "@ref": "gr3",
            "@mimetype": "image/jpeg"
          },
          {
            "@category": "standard",
            "@height": "358",
            "@width": "604",
            "@_fa": "true",
            "$": "https://api.elsevier.com/content/object/eid/1-s2.0-S2468823118303109-gr4.jpg?httpAccept=%2A%2F%2A",
            "@multimediatype": "JPEG image file",
            "@type": "IMAGE-DOWNSAMPLED",
            "@size": "42367",
            "@ref": "gr4",
            "@mimetype": "image/jpeg"
          },
          {
            "@category": "standard",
            "@height": "608",
            "@width": "340",
            "@_fa": "true",
            "$": "https://api.elsevier.com/content/object/eid/1-s2.0-S2468823118303109-gr5.jpg?httpAccept=%2A%2F%2A",
            "@multimediatype": "JPEG image file",
            "@type": "IMAGE-DOWNSAMPLED",
            "@size": "50450",
            "@ref": "gr5",
            "@mimetype": "image/jpeg"
          },
          {
            "@category": "standard",
            "@height": "253",
            "@width": "340",
            "@_fa": "true",
            "$": "https://api.elsevier.com/content/object/eid/1-s2.0-S2468823118303109-gr6.jpg?httpAccept=%2A%2F%2A",
            "@multimediatype": "JPEG image file",
            "@type": "IMAGE-DOWNSAMPLED",
            "@size": "8998",
            "@ref": "gr6",
            "@mimetype": "image/jpeg"
          },
          {
            "@category": "standard",
            "@height": "519",
            "@width": "679",
            "@_fa": "true",
            "$": "https://api.elsevier.com/content/object/eid/1-s2.0-S2468823118303109-gr7.jpg?httpAccept=%2A%2F%2A",
            "@multimediatype": "JPEG image file",
            "@type": "IMAGE-DOWNSAMPLED",
            "@size": "80168",
            "@ref": "gr7",
            "@mimetype": "image/jpeg"
          },
          {
            "@category": "standard",
            "@height": "261",
            "@width": "340",
            "@_fa": "true",
            "$": "https://api.elsevier.com/content/object/eid/1-s2.0-S2468823118303109-gr8.jpg?httpAccept=%2A%2F%2A",
            "@multimediatype": "JPEG image file",
            "@type": "IMAGE-DOWNSAMPLED",
            "@size": "27846",
            "@ref": "gr8",
            "@mimetype": "image/jpeg"
          },
          {
            "@category": "standard",
            "@height": "218",
            "@width": "340",
            "@_fa": "true",
            "$": "https://api.elsevier.com/content/object/eid/1-s2.0-S2468823118303109-gr9.jpg?httpAccept=%2A%2F%2A",
            "@multimediatype": "JPEG image file",
            "@type": "IMAGE-DOWNSAMPLED",
            "@size": "20931",
            "@ref": "gr9",
            "@mimetype": "image/jpeg"
          },
          {
            "@category": "thumbnail",
            "@height": "43",
            "@width": "43",
            "@_fa": "true",
            "$": "https://api.elsevier.com/content/object/eid/1-s2.0-S2468823118303109-fx1.sml?httpAccept=%2A%2F%2A",
            "@multimediatype": "GIF image file",
            "@type": "IMAGE-THUMBNAIL",
            "@size": "1119",
            "@ref": "fx1",
            "@mimetype": "image/gif"
          },
          {
            "@category": "thumbnail",
            "@height": "20",
            "@width": "21",
            "@_fa": "true",
            "$": "https://api.elsevier.com/content/object/eid/1-s2.0-S2468823118303109-fx10.sml?httpAccept=%2A%2F%2A",
            "@multimediatype": "GIF image file",
            "@type": "IMAGE-THUMBNAIL",
            "@size": "699",
            "@ref": "fx10",
            "@mimetype": "image/gif"
          },
          {
            "@category": "thumbnail",
            "@height": "37",
            "@width": "28",
            "@_fa": "true",
            "$": "https://api.elsevier.com/content/object/eid/1-s2.0-S2468823118303109-fx11.sml?httpAccept=%2A%2F%2A",
            "@multimediatype": "GIF image file",
            "@type": "IMAGE-THUMBNAIL",
            "@size": "898",
            "@ref": "fx11",
            "@mimetype": "image/gif"
          },
          {
            "@category": "thumbnail",
            "@height": "44",
            "@width": "44",
            "@_fa": "true",
            "$": "https://api.elsevier.com/content/object/eid/1-s2.0-S2468823118303109-fx12.sml?httpAccept=%2A%2F%2A",
            "@multimediatype": "GIF image file",
            "@type": "IMAGE-THUMBNAIL",
            "@size": "1216",
            "@ref": "fx12",
            "@mimetype": "image/gif"
          },
          {
            "@category": "thumbnail",
            "@height": "43",
            "@width": "43",
            "@_fa": "true",
            "$": "https://api.elsevier.com/content/object/eid/1-s2.0-S2468823118303109-fx13.sml?httpAccept=%2A%2F%2A",
            "@multimediatype": "GIF image file",
            "@type": "IMAGE-THUMBNAIL",
            "@size": "1254",
            "@ref": "fx13",
            "@mimetype": "image/gif"
          },
          {
            "@category": "thumbnail",
            "@height": "49",
            "@width": "35",
            "@_fa": "true",
            "$": "https://api.elsevier.com/content/object/eid/1-s2.0-S2468823118303109-fx14.sml?httpAccept=%2A%2F%2A",
            "@multimediatype": "GIF image file",
            "@type": "IMAGE-THUMBNAIL",
            "@size": "1215",
            "@ref": "fx14",
            "@mimetype": "image/gif"
          },
          {
            "@category": "thumbnail",
            "@height": "42",
            "@width": "44",
            "@_fa": "true",
            "$": "https://api.elsevier.com/content/object/eid/1-s2.0-S2468823118303109-fx15.sml?httpAccept=%2A%2F%2A",
            "@multimediatype": "GIF image file",
            "@type": "IMAGE-THUMBNAIL",
            "@size": "1896",
            "@ref": "fx15",
            "@mimetype": "image/gif"
          },
          {
            "@category": "thumbnail",
            "@height": "35",
            "@width": "35",
            "@_fa": "true",
            "$": "https://api.elsevier.com/content/object/eid/1-s2.0-S2468823118303109-fx16.sml?httpAccept=%2A%2F%2A",
            "@multimediatype": "GIF image file",
            "@type": "IMAGE-THUMBNAIL",
            "@size": "1607",
            "@ref": "fx16",
            "@mimetype": "image/gif"
          },
          {
            "@category": "thumbnail",
            "@height": "25",
            "@width": "26",
            "@_fa": "true",
            "$": "https://api.elsevier.com/content/object/eid/1-s2.0-S2468823118303109-fx2.sml?httpAccept=%2A%2F%2A",
            "@multimediatype": "GIF image file",
            "@type": "IMAGE-THUMBNAIL",
            "@size": "896",
            "@ref": "fx2",
            "@mimetype": "image/gif"
          },
          {
            "@category": "thumbnail",
            "@height": "43",
            "@width": "43",
            "@_fa": "true",
            "$": "https://api.elsevier.com/content/object/eid/1-s2.0-S2468823118303109-fx3.sml?httpAccept=%2A%2F%2A",
            "@multimediatype": "GIF image file",
            "@type": "IMAGE-THUMBNAIL",
            "@size": "1229",
            "@ref": "fx3",
            "@mimetype": "image/gif"
          },
          {
            "@category": "thumbnail",
            "@height": "49",
            "@width": "35",
            "@_fa": "true",
            "$": "https://api.elsevier.com/content/object/eid/1-s2.0-S2468823118303109-fx4.sml?httpAccept=%2A%2F%2A",
            "@multimediatype": "GIF image file",
            "@type": "IMAGE-THUMBNAIL",
            "@size": "1172",
            "@ref": "fx4",
            "@mimetype": "image/gif"
          },
          {
            "@category": "thumbnail",
            "@height": "35",
            "@width": "35",
            "@_fa": "true",
            "$": "https://api.elsevier.com/content/object/eid/1-s2.0-S2468823118303109-fx5.sml?httpAccept=%2A%2F%2A",
            "@multimediatype": "GIF image file",
            "@type": "IMAGE-THUMBNAIL",
            "@size": "1160",
            "@ref": "fx5",
            "@mimetype": "image/gif"
          },
          {
            "@category": "thumbnail",
            "@height": "41",
            "@width": "44",
            "@_fa": "true",
            "$": "https://api.elsevier.com/content/object/eid/1-s2.0-S2468823118303109-fx6.sml?httpAccept=%2A%2F%2A",
            "@multimediatype": "GIF image file",
            "@type": "IMAGE-THUMBNAIL",
            "@size": "1891",
            "@ref": "fx6",
            "@mimetype": "image/gif"
          },
          {
            "@category": "thumbnail",
            "@height": "43",
            "@width": "43",
            "@_fa": "true",
            "$": "https://api.elsevier.com/content/object/eid/1-s2.0-S2468823118303109-fx7.sml?httpAccept=%2A%2F%2A",
            "@multimediatype": "GIF image file",
            "@type": "IMAGE-THUMBNAIL",
            "@size": "1170",
            "@ref": "fx7",
            "@mimetype": "image/gif"
          },
          {
            "@category": "thumbnail",
            "@height": "42",
            "@width": "43",
            "@_fa": "true",
            "$": "https://api.elsevier.com/content/object/eid/1-s2.0-S2468823118303109-fx8.sml?httpAccept=%2A%2F%2A",
            "@multimediatype": "GIF image file",
            "@type": "IMAGE-THUMBNAIL",
            "@size": "1050",
            "@ref": "fx8",
            "@mimetype": "image/gif"
          },
          {
            "@category": "thumbnail",
            "@height": "28",
            "@width": "28",
            "@_fa": "true",
            "$": "https://api.elsevier.com/content/object/eid/1-s2.0-S2468823118303109-fx9.sml?httpAccept=%2A%2F%2A",
            "@multimediatype": "GIF image file",
            "@type": "IMAGE-THUMBNAIL",
            "@size": "1245",
            "@ref": "fx9",
            "@mimetype": "image/gif"
          },
          {
            "@category": "thumbnail",
            "@height": "164",
            "@width": "218",
            "@_fa": "true",
            "$": "https://api.elsevier.com/content/object/eid/1-s2.0-S2468823118303109-ga1.sml?httpAccept=%2A%2F%2A",
            "@multimediatype": "GIF image file",
            "@type": "IMAGE-THUMBNAIL",
            "@size": "10764",
            "@ref": "ga1",
            "@mimetype": "image/gif"
          },
          {
            "@category": "thumbnail",
            "@height": "164",
            "@width": "206",
            "@_fa": "true",
            "$": "https://api.elsevier.com/content/object/eid/1-s2.0-S2468823118303109-gr1.sml?httpAccept=%2A%2F%2A",
            "@multimediatype": "GIF image file",
            "@type": "IMAGE-THUMBNAIL",
            "@size": "4581",
            "@ref": "gr1",
            "@mimetype": "image/gif"
          },
          {
            "@category": "thumbnail",
            "@height": "126",
            "@width": "219",
            "@_fa": "true",
            "$": "https://api.elsevier.com/content/object/eid/1-s2.0-S2468823118303109-gr2.sml?httpAccept=%2A%2F%2A",
            "@multimediatype": "GIF image file",
            "@type": "IMAGE-THUMBNAIL",
            "@size": "8604",
            "@ref": "gr2",
            "@mimetype": "image/gif"
          },
          {
            "@category": "thumbnail",
            "@height": "164",
            "@width": "192",
            "@_fa": "true",
            "$": "https://api.elsevier.com/content/object/eid/1-s2.0-S2468823118303109-gr3.sml?httpAccept=%2A%2F%2A",
            "@multimediatype": "GIF image file",
            "@type": "IMAGE-THUMBNAIL",
            "@size": "6639",
            "@ref": "gr3",
            "@mimetype": "image/gif"
          },
          {
            "@category": "thumbnail",
            "@height": "130",
            "@width": "219",
            "@_fa": "true",
            "$": "https://api.elsevier.com/content/object/eid/1-s2.0-S2468823118303109-gr4.sml?httpAccept=%2A%2F%2A",
            "@multimediatype": "GIF image file",
            "@type": "IMAGE-THUMBNAIL",
            "@size": "6873",
            "@ref": "gr4",
            "@mimetype": "image/gif"
          },
          {
            "@category": "thumbnail",
            "@height": "163",
            "@width": "91",
            "@_fa": "true",
            "$": "https://api.elsevier.com/content/object/eid/1-s2.0-S2468823118303109-gr5.sml?httpAccept=%2A%2F%2A",
            "@multimediatype": "GIF image file",
            "@type": "IMAGE-THUMBNAIL",
            "@size": "4622",
            "@ref": "gr5",
            "@mimetype": "image/gif"
          },
          {
            "@category": "thumbnail",
            "@height": "163",
            "@width": "219",
            "@_fa": "true",
            "$": "https://api.elsevier.com/content/object/eid/1-s2.0-S2468823118303109-gr6.sml?httpAccept=%2A%2F%2A",
            "@multimediatype": "GIF image file",
            "@type": "IMAGE-THUMBNAIL",
            "@size": "3215",
            "@ref": "gr6",
            "@mimetype": "image/gif"
          },
          {
            "@category": "thumbnail",
            "@height": "164",
            "@width": "215",
            "@_fa": "true",
            "$": "https://api.elsevier.com/content/object/eid/1-s2.0-S2468823118303109-gr7.sml?httpAccept=%2A%2F%2A",
            "@multimediatype": "GIF image file",
            "@type": "IMAGE-THUMBNAIL",
            "@size": "8065",
            "@ref": "gr7",
            "@mimetype": "image/gif"
          },
          {
            "@category": "thumbnail",
            "@height": "164",
            "@width": "214",
            "@_fa": "true",
            "$": "https://api.elsevier.com/content/object/eid/1-s2.0-S2468823118303109-gr8.sml?httpAccept=%2A%2F%2A",
            "@multimediatype": "GIF image file",
            "@type": "IMAGE-THUMBNAIL",
            "@size": "11795",
            "@ref": "gr8",
            "@mimetype": "image/gif"
          },
          {
            "@category": "thumbnail",
            "@height": "140",
            "@width": "219",
            "@_fa": "true",
            "$": "https://api.elsevier.com/content/object/eid/1-s2.0-S2468823118303109-gr9.sml?httpAccept=%2A%2F%2A",
            "@multimediatype": "GIF image file",
            "@type": "IMAGE-THUMBNAIL",
            "@size": "7633",
            "@ref": "gr9",
            "@mimetype": "image/gif"
          },
          {
            "@category": "thumbnail",
            "@height": "37",
            "@width": "203",
            "@_fa": "true",
            "$": "https://api.elsevier.com/content/object/eid/1-s2.0-S2468823118303109-si1.gif?httpAccept=%2A%2F%2A",
            "@multimediatype": "GIF image file",
            "@type": "ALTIMG",
            "@size": "629",
            "@ref": "si1",
            "@mimetype": "image/gif"
          },
          {
            "@category": "thumbnail",
            "@height": "36",
            "@width": "58",
            "@_fa": "true",
            "$": "https://api.elsevier.com/content/object/eid/1-s2.0-S2468823118303109-si2.gif?httpAccept=%2A%2F%2A",
            "@multimediatype": "GIF image file",
            "@type": "ALTIMG",
            "@size": "343",
            "@ref": "si2",
            "@mimetype": "image/gif"
          },
          {
            "@category": "thumbnail",
            "@height": "39",
            "@width": "58",
            "@_fa": "true",
            "$": "https://api.elsevier.com/content/object/eid/1-s2.0-S2468823118303109-si3.gif?httpAccept=%2A%2F%2A",
            "@multimediatype": "GIF image file",
            "@type": "ALTIMG",
            "@size": "359",
            "@ref": "si3",
            "@mimetype": "image/gif"
          },
          {
            "@category": "thumbnail",
            "@height": "33",
            "@width": "84",
            "@_fa": "true",
            "$": "https://api.elsevier.com/content/object/eid/1-s2.0-S2468823118303109-si4.gif?httpAccept=%2A%2F%2A",
            "@multimediatype": "GIF image file",
            "@type": "ALTIMG",
            "@size": "346",
            "@ref": "si4",
            "@mimetype": "image/gif"
          },
          {
            "@category": "thumbnail",
            "@height": "36",
            "@width": "57",
            "@_fa": "true",
            "$": "https://api.elsevier.com/content/object/eid/1-s2.0-S2468823118303109-si5.gif?httpAccept=%2A%2F%2A",
            "@multimediatype": "GIF image file",
            "@type": "ALTIMG",
            "@size": "282",
            "@ref": "si5",
            "@mimetype": "image/gif"
          },
          {
            "@category": "thumbnail",
            "@height": "36",
            "@width": "49",
            "@_fa": "true",
            "$": "https://api.elsevier.com/content/object/eid/1-s2.0-S2468823118303109-si6.gif?httpAccept=%2A%2F%2A",
            "@multimediatype": "GIF image file",
            "@type": "ALTIMG",
            "@size": "261",
            "@ref": "si6",
            "@mimetype": "image/gif"
          },
          {
            "@category": "thumbnail",
            "@height": "36",
            "@width": "136",
            "@_fa": "true",
            "$": "https://api.elsevier.com/content/object/eid/1-s2.0-S2468823118303109-si7.gif?httpAccept=%2A%2F%2A",
            "@multimediatype": "GIF image file",
            "@type": "ALTIMG",
            "@size": "485",
            "@ref": "si7",
            "@mimetype": "image/gif"
          },
          {
            "@category": "thumbnail",
            "@height": "30",
            "@width": "79",
            "@_fa": "true",
            "$": "https://api.elsevier.com/content/object/eid/1-s2.0-S2468823118303109-si8.gif?httpAccept=%2A%2F%2A",
            "@multimediatype": "GIF image file",
            "@type": "ALTIMG",
            "@size": "279",
            "@ref": "si8",
            "@mimetype": "image/gif"
          },
          {
            "@category": "thumbnail",
            "@height": "36",
            "@width": "94",
            "@_fa": "true",
            "$": "https://api.elsevier.com/content/object/eid/1-s2.0-S2468823118303109-si9.gif?httpAccept=%2A%2F%2A",
            "@multimediatype": "GIF image file",
            "@type": "ALTIMG",
            "@size": "387",
            "@ref": "si9",
            "@mimetype": "image/gif"
          },
          {
            "@category": "standard",
            "@_fa": "true",
            "$": "https://api.elsevier.com/content/object/eid/1-s2.0-S2468823118303109-am.pdf?httpAccept=%2A%2F%2A",
            "@multimediatype": "Acrobat PDF file",
            "@type": "AAM-PDF",
            "@size": "756114",
            "@ref": "am",
            "@mimetype": "application/pdf"
          }
        ]
      },
      "link": {
        "@rel": "abstract",
        "@href": "https://api.elsevier.com/content/abstract/scopus_id/85051785853"
      }
    }
  }
}