{
  "metadata": {
    "title": "Investigation into the roles of different oxygen species in toluene oxidation over manganese-supported platinum catalysts",
    "authors": "; ; ",
    "journal": "Molecular Catalysis",
    "date": "2021-05-31",
    "doi": "10.1016/j.mcat.2021.111569",
    "abstract": "",
    "uri": "https://api.elsevier.com/content/article/pii/S2468823121001863",
    "pii": "S2468823121001863"
  },
  "fulltext": {
    "full-text-retrieval-response": {
      "scopus-eid": "2-s2.0-85104088414",
      "originalText": "serial JL 315758 291210 291744 291790 291809 31 Molecular Catalysis MOLECULARCATALYSIS 2021-04-12 2021-04-12 2021-04-12 2021-04-12 2021-05-10T11:55:35 1-s2.0-S2468823121001863 S2468-8231(21)00186-3 S2468823121001863 10.1016/j.mcat.2021.111569 S300 S300.1 FULL-TEXT 1-s2.0-S2468823121X00077 2022-12-12T23:36:12.42485Z 0 0 20210501 20210531 2021 2021-04-12T23:06:03.996839Z absattachment articleinfo articlenumber articletitlenorm authfirstinitialnorm authfirstsurnamenorm cid cids contenttype copyright crossmark dateloaded dateloadedtxt datesearch datesort dateupdated dco docsubtype doctype doi eid ewtransactionid hubeid indexeddate issn issnnorm itemstage itemtransactionid itemweight openaccess openarchive pg pgfirst pii piinorm pubdateend pubdatestart pubdatetxt pubyr sectiontitle sortorder srctitle srctitlenorm srctype ssids alllist content subj subheadings suppl tomb volfirst volissue volumelist webpdf webpdfpagecount yearnav figure table e-component body mmlmath acknowledge affil appendices articletitle auth authfirstini authfull authkeywords authlast grantnumber grantsponsor grantsponsorid highlightsabst orcid primabst ref specialabst 2468-8231 24688231 true 507 507 C Volume 507 6 111569 111569 111569 202105 May 2021 2021-05-01 2021-05-31 2021 Regular Papers article fla © 2021 Elsevier B.V. All rights reserved. INVESTIGATIONROLESDIFFERENTOXYGENSPECIESINTOLUENEOXIDATIONOVERMANGANESESUPPORTEDPLATINUMCATALYSTS SUN Y 1 Introduction 2 Experiment 2.1 Catalyst preparation 2.2 Catalyst characterization 2.3 Catalytic performance tests 3 Results and discussion 3.1 Crystal structure and textural properties 3.2 Surface chemical states and redox properties 3.3 Catalytic activity and investigation into active site 3.4 Mechanistic investigation of toluene oxidation 3.4.1 Mechanistic investigation by toluene-TPD and toluene-TPSR 3.4.2 Mechanistic investigation by in-situ DRIFTS 4 Conclusions Credit author statement Acknowledgments Appendix A Supplementary data References AVERY 2006 4845 4850 R TANG 2012 2757 2776 G CHENG 2020 122298 H ZHANG 2019 7632 7640 W WANG 2017 793 804 T ALMOMANI 2020 126878 F WU 2019 203 213 M REN 2018 498 509 Q ZHONG 2020 121957 J FAN 2020 1046 1054 J GARCIA 2019 T LU 2019 7431 7442 A ZHAO 2016 3433 3441 S CHEN 2018 768 779 X CHEN 2015 5936 5938 C PENG 2018 462 470 R WANG 2020 118963 Z COMOTTI 2006 917 924 M HUANG 2011 60 67 H WANG 2017 14809 14815 M YU 2011 851 860 X PEI 2019 W PENG 2019 117807 H MO 2019 1425 1433 S DUAN 2020 X ZHANG 2019 H PENG 2016 1234 1246 R WANG 2015 177 186 F MO 2020 S DONG 2019 6698 6710 C CHEN 2017 281 293 J ZHAO 2019 502 512 L HAN 2008 261 268 Y JI 2020 118210 J ELMALLAWANY 1989 781 785 R CHEN 2020 6176 6187 B YANG 2020 W JI 2019 227 237 F ZHANG 2018 12 20 Q DONG 2021 102 112 C CHEN 2018 2971 2981 X YANG 2019 730 739 X DENG 2010 2618 2623 J LUO 2018 119 127 Y WANG 2015 23119 23126 C ZHU 2017 729 737 G DONG 2020 Y LI 2018 12685 12696 X YANG 2015 4473 4480 Y WAN 2015 67 74 J CHANG 2018 15 25 T MEHER 2013 121 131 S TA 2012 20585 20588 N KIM 2012 1560 1570 H DONG 2021 100897 C LIOTTA 2010 403 412 L WANG 2018 3429 3434 Y GAO 2007 620 625 J MA 2018 44 58 L SUNX2021X111569 SUNX2021X111569XY 2023-04-12T00:00:00.000Z 2023-04-12T00:00:00.000Z http://creativecommons.org/licenses/by-nc-nd/4.0/ © 2021 Elsevier B.V. All rights reserved. 2021-04-08T05:58:05.210Z http://vtw.elsevier.com/data/voc/AddOnTypes/50.7/eoas SCUT South China University of Technology http://data.elsevier.com/vocabulary/SciValFunders/501100005015 http://sws.geonames.org/1814991 https://doi.org/10.15223/policy-017 https://doi.org/10.15223/policy-037 https://doi.org/10.15223/policy-012 https://doi.org/10.15223/policy-029 https://doi.org/10.15223/policy-004 item S2468-8231(21)00186-3 S2468823121001863 1-s2.0-S2468823121001863 10.1016/j.mcat.2021.111569 315758 2021-05-25T23:44:49.860601Z 2021-05-01 2021-05-31 1-s2.0-S2468823121001863-main.pdf https://s3-eu-west-1.amazonaws.com/prod-ucs-content-store-eu-west/content/pii:S2468823121001863/MAIN/application/pdf/6c89e208c2cbce37776e45e69a21b430/main.pdf main.pdf pdf true 10057594 MAIN 12 1-s2.0-S2468823121001863-main_1.png https://s3-eu-west-1.amazonaws.com/prod-ucs-content-store-eu-west/content/pii:S2468823121001863/PREVIEW/image/png/ef61bb65f44720ec57dae948c59b1fbf/main_1.png main_1.png png 59875 849 656 IMAGE-WEB-PDF 1 1-s2.0-S2468823121001863-gr2.jpg https://s3-eu-west-1.amazonaws.com/prod-ucs-content-store-eu-west/content/pii:S2468823121001863/gr2/DOWNSAMPLED/image/jpeg/a7d2a04045c0a2612ba8fc54123e92b7/gr2.jpg gr2 gr2.jpg jpg 206128 883 679 IMAGE-DOWNSAMPLED 1-s2.0-S2468823121001863-ga1.jpg https://s3-eu-west-1.amazonaws.com/prod-ucs-content-store-eu-west/content/pii:S2468823121001863/ga1/DOWNSAMPLED/image/jpeg/d921cd41c0c9358dbb48c2842e8d2aa6/ga1.jpg ga1 true ga1.jpg jpg 19068 200 291 IMAGE-DOWNSAMPLED 1-s2.0-S2468823121001863-gr1.jpg https://s3-eu-west-1.amazonaws.com/prod-ucs-content-store-eu-west/content/pii:S2468823121001863/gr1/DOWNSAMPLED/image/jpeg/145568b5c5a5b5068390ed9be05a7205/gr1.jpg gr1 gr1.jpg jpg 83878 521 679 IMAGE-DOWNSAMPLED 1-s2.0-S2468823121001863-gr9.jpg https://s3-eu-west-1.amazonaws.com/prod-ucs-content-store-eu-west/content/pii:S2468823121001863/gr9/DOWNSAMPLED/image/jpeg/c7f10d5fabdab0eb066bd48ed13b792f/gr9.jpg gr9 gr9.jpg jpg 158817 824 717 IMAGE-DOWNSAMPLED 1-s2.0-S2468823121001863-gr8.jpg https://s3-eu-west-1.amazonaws.com/prod-ucs-content-store-eu-west/content/pii:S2468823121001863/gr8/DOWNSAMPLED/image/jpeg/12bbcc18626ac356907c925c0f89c6d4/gr8.jpg gr8 gr8.jpg jpg 40414 557 340 IMAGE-DOWNSAMPLED 1-s2.0-S2468823121001863-gr10.jpg https://s3-eu-west-1.amazonaws.com/prod-ucs-content-store-eu-west/content/pii:S2468823121001863/gr10/DOWNSAMPLED/image/jpeg/4406c92e27a7176c596202e33c0bec8d/gr10.jpg gr10 gr10.jpg jpg 89373 551 717 IMAGE-DOWNSAMPLED 1-s2.0-S2468823121001863-gr7.jpg https://s3-eu-west-1.amazonaws.com/prod-ucs-content-store-eu-west/content/pii:S2468823121001863/gr7/DOWNSAMPLED/image/jpeg/e43912fd7145d6ce8968ba1e26db9f67/gr7.jpg gr7 gr7.jpg jpg 75110 511 679 IMAGE-DOWNSAMPLED 1-s2.0-S2468823121001863-gr6.jpg https://s3-eu-west-1.amazonaws.com/prod-ucs-content-store-eu-west/content/pii:S2468823121001863/gr6/DOWNSAMPLED/image/jpeg/e64c847816543ce4be44b9554b54f876/gr6.jpg gr6 gr6.jpg jpg 49291 451 566 IMAGE-DOWNSAMPLED 1-s2.0-S2468823121001863-gr5.jpg https://s3-eu-west-1.amazonaws.com/prod-ucs-content-store-eu-west/content/pii:S2468823121001863/gr5/DOWNSAMPLED/image/jpeg/e9fe97cf32567ab78cbccaef12c65e92/gr5.jpg gr5 gr5.jpg jpg 23242 269 340 IMAGE-DOWNSAMPLED 1-s2.0-S2468823121001863-gr4.jpg https://s3-eu-west-1.amazonaws.com/prod-ucs-content-store-eu-west/content/pii:S2468823121001863/gr4/DOWNSAMPLED/image/jpeg/bd2012cb0ab64ef1378c95ee95023f93/gr4.jpg gr4 gr4.jpg jpg 22651 268 340 IMAGE-DOWNSAMPLED 1-s2.0-S2468823121001863-gr3.jpg https://s3-eu-west-1.amazonaws.com/prod-ucs-content-store-eu-west/content/pii:S2468823121001863/gr3/DOWNSAMPLED/image/jpeg/82dc5bca1e988f2321c916f7d6b192d5/gr3.jpg gr3 gr3.jpg jpg 17635 264 340 IMAGE-DOWNSAMPLED 1-s2.0-S2468823121001863-gr2.sml https://s3-eu-west-1.amazonaws.com/prod-ucs-content-store-eu-west/content/pii:S2468823121001863/gr2/THUMBNAIL/image/gif/6d7892f542c12db2cef52e7bfb60c487/gr2.sml gr2 gr2.sml sml 11329 164 126 IMAGE-THUMBNAIL 1-s2.0-S2468823121001863-ga1.sml https://s3-eu-west-1.amazonaws.com/prod-ucs-content-store-eu-west/content/pii:S2468823121001863/ga1/THUMBNAIL/image/gif/6c8b1c26ac36c653c5864ed5dbf3c43f/ga1.sml ga1 true ga1.sml sml 14543 151 219 IMAGE-THUMBNAIL 1-s2.0-S2468823121001863-gr1.sml https://s3-eu-west-1.amazonaws.com/prod-ucs-content-store-eu-west/content/pii:S2468823121001863/gr1/THUMBNAIL/image/gif/14ea3f0394a530eb3243e117c9a169de/gr1.sml gr1 gr1.sml sml 11224 164 214 IMAGE-THUMBNAIL 1-s2.0-S2468823121001863-gr9.sml https://s3-eu-west-1.amazonaws.com/prod-ucs-content-store-eu-west/content/pii:S2468823121001863/gr9/THUMBNAIL/image/gif/be5532dc0c2c309c289fa29f3313de67/gr9.sml gr9 gr9.sml sml 11858 163 142 IMAGE-THUMBNAIL 1-s2.0-S2468823121001863-gr8.sml https://s3-eu-west-1.amazonaws.com/prod-ucs-content-store-eu-west/content/pii:S2468823121001863/gr8/THUMBNAIL/image/gif/8ab28e8bc0ef7f8e5678532984857d0d/gr8.sml gr8 gr8.sml sml 4980 164 100 IMAGE-THUMBNAIL 1-s2.0-S2468823121001863-gr10.sml https://s3-eu-west-1.amazonaws.com/prod-ucs-content-store-eu-west/content/pii:S2468823121001863/gr10/THUMBNAIL/image/gif/98a4aeb5e6ac22920f823c3e89da5703/gr10.sml gr10 gr10.sml sml 12399 164 213 IMAGE-THUMBNAIL 1-s2.0-S2468823121001863-gr7.sml https://s3-eu-west-1.amazonaws.com/prod-ucs-content-store-eu-west/content/pii:S2468823121001863/gr7/THUMBNAIL/image/gif/67b7d6359d7bfadac4dae2659ee0a350/gr7.sml gr7 gr7.sml sml 10372 164 218 IMAGE-THUMBNAIL 1-s2.0-S2468823121001863-gr6.sml https://s3-eu-west-1.amazonaws.com/prod-ucs-content-store-eu-west/content/pii:S2468823121001863/gr6/THUMBNAIL/image/gif/bee4b7575a6733730bae54021ef5c661/gr6.sml gr6 gr6.sml sml 11012 164 206 IMAGE-THUMBNAIL 1-s2.0-S2468823121001863-gr5.sml https://s3-eu-west-1.amazonaws.com/prod-ucs-content-store-eu-west/content/pii:S2468823121001863/gr5/THUMBNAIL/image/gif/6faef08e7ade7da000103e1af1b718c0/gr5.sml gr5 gr5.sml sml 11775 164 207 IMAGE-THUMBNAIL 1-s2.0-S2468823121001863-gr4.sml https://s3-eu-west-1.amazonaws.com/prod-ucs-content-store-eu-west/content/pii:S2468823121001863/gr4/THUMBNAIL/image/gif/a5abc03b1ef91f6d875c469869d02477/gr4.sml gr4 gr4.sml sml 9832 164 208 IMAGE-THUMBNAIL 1-s2.0-S2468823121001863-gr3.sml https://s3-eu-west-1.amazonaws.com/prod-ucs-content-store-eu-west/content/pii:S2468823121001863/gr3/THUMBNAIL/image/gif/05b9bf1aa80a840185c447d13babddf6/gr3.sml gr3 gr3.sml sml 7241 164 211 IMAGE-THUMBNAIL 1-s2.0-S2468823121001863-mmc1.docx https://s3-eu-west-1.amazonaws.com/prod-ucs-content-store-eu-west/content/pii:S2468823121001863/mmc1/MAIN/application/vnd.openxmlformats-officedocument.wordprocessingml.document/6e6551fdee23fde9249968ecd18b1693/mmc1.docx mmc1 mmc1.docx docx 367489 APPLICATION 1-s2.0-S2468823121001863-si1.svg https://s3-eu-west-1.amazonaws.com/prod-ucs-content-store-eu-west/content/pii:S2468823121001863/STRIPIN/image/svg+xml/cb0763a36eda2996ca0410c16453e5fa/si1.svg si1 si1.svg svg 15335 ALTIMG 1-s2.0-S2468823121001863-si2.svg https://s3-eu-west-1.amazonaws.com/prod-ucs-content-store-eu-west/content/pii:S2468823121001863/STRIPIN/image/svg+xml/57a8b3b35c5eefb77a94602f6a5b6ffb/si2.svg si2 si2.svg svg 28659 ALTIMG 1-s2.0-S2468823121001863-si3.svg https://s3-eu-west-1.amazonaws.com/prod-ucs-content-store-eu-west/content/pii:S2468823121001863/STRIPIN/image/svg+xml/288874b05aaab4c6818b93a28f7a15b7/si3.svg si3 si3.svg svg 44939 ALTIMG 1-s2.0-S2468823121001863-si4.svg https://s3-eu-west-1.amazonaws.com/prod-ucs-content-store-eu-west/content/pii:S2468823121001863/STRIPIN/image/svg+xml/f6ea2ae613da35dea7f356e6301f67e2/si4.svg si4 si4.svg svg 34172 ALTIMG 1-s2.0-S2468823121001863-si5.svg https://s3-eu-west-1.amazonaws.com/prod-ucs-content-store-eu-west/content/pii:S2468823121001863/STRIPIN/image/svg+xml/5c5b5ced7b1a86ed87036d40e093ecbd/si5.svg si5 si5.svg svg 37564 ALTIMG 1-s2.0-S2468823121001863-si6.svg https://s3-eu-west-1.amazonaws.com/prod-ucs-content-store-eu-west/content/pii:S2468823121001863/STRIPIN/image/svg+xml/269b3b9690418afc4ce1e0d100c016a3/si6.svg si6 si6.svg svg 7557 ALTIMG 1-s2.0-S2468823121001863-am.pdf am am.pdf pdf 1941121 AAM-PDF https://s3-eu-west-1.amazonaws.com/prod-ucs-content-store-eu-west/content/egi:10T1R26WL72/MAIN/application/pdf/508cdb3f3daab4fca30e94610f7b1485/am.pdf MCAT 111569 111569 S2468-8231(21)00186-3 10.1016/j.mcat.2021.111569 Elsevier B.V. Fig. 1 (A) XRD, (B) nitrogen adsorption-desorption, (C)pore size distribution and (D) Raman curves of Pt/Mn3O4-R, Pt/Mn3O4-C, Mn3O4-R, Mn3O4-C. Fig. 1 Fig. 2 FESEM images of Pt/Mn3O4-R (A), Pt/Mn3O4-C (B), Mn3O4-R (C), Mn3O4-C (D). and HRTEM images of Pt/Mn3O4-R (E), Pt/Mn3O4-C (F). Fig. 2 Fig. 3 H2-TPR profiles of different samples. Fig. 3 Fig. 4 O2-TPD profiles of Pt/Mn3O4-R (a), Mn3O4-R (b), Pt/Mn3O4-C (c), Mn3O4-C (d). Fig. 4 Fig. 5 Pt 4f XPS spectra of different catalysts. Fig. 5 Fig. 6 O 1s XPS spectra of different catalysts. Fig. 6 Fig. 7 Catalytic activity test of toluene for Pt/Mn3O4-R, Pt/Mn3O4-C, Mn3O4-R, Mn3O4-C under a space velocity of 48,000 mL·g−1 h−1 (A), catalytic activity test for Pt/Mn3O4-R catalysts with different platinum loading (B), toluene oxidation cycling test (C) and long-time toluene oxidation test under different space velocity (D) over Pt/Mn3O4-R. Fig. 7 Fig. 8 Toluene-TPD and Toluene-TPSR profiles of different catalysts: (A)Toluene mass signal in Toluene-TPD test (B) CO2 mass signal in Toluene-TPD and Toluene-TPSR test. Fig. 8 Fig. 9 In-situ DRIFTS spectra of toluene adsorption as a function of time exposed to 500 ppm toluene/air over Pt/Mn3O4-R (A), 500 ppm toluene/N2 over Pt/Mn3O4-R (B), 500 ppm toluene/air over Pt/Mn3O4-C (C), 500 ppm toluene/N2 over Pt/Mn3O4-C (D) and 500 ppm toluene/air over Mn3O4-R at 180 ℃(F), in-situ DRIFTS spectra of toluene oxidation as a function of temperature exposed to 500 ppm toluene/air over Pt/Mn3O4-C (E). Fig. 9 Fig. 10 In-situ DRIFTS spectra of toluene oxidation as a function of temperature during Pt/Mn3O4-R exposed to 500 ppm toluene/air, (A) reaction of O2 with preadsorbed toluene over Pt/Mn3O4-R at various temperatures; (C) characteristic IR peak intensity of surface benzyl alcohol, benzaldehyde, benzoate, and carbonate species versus temperature during Pt/Mn3O4-R exposed to 500 ppm toluene/air (B), reaction of O2 with preadsorbed toluene over Pt/Mn3O4-R (D). Fig. 10 Table 1 H2-TPR, XPS, O2 pulse adsorption data of four catalysts. Table 1 Sample H2 consumption below 250 ℃ (mmol/g) Pt0/(Pt2++Pt0) (%) AOS of Mn Oads/(Olatt+Oads+Oh) (%) OSCsurface (mmol/g) OSCcatalyst (mmol/g) OSCPt (mmol/g) Pt/Mn3O4-R 4.62 81.4 2.63 28.1 0.076 0.095 0.019 Pt/Mn3O4-C 2.29 80.3 2.66 25.5 0.045 0.053 0.008 Mn3O4-R 1.58 – 2.69 23.9 – – – Mn3O4-C 0.07 – 2.71 23.6 – – – Table 2 Catalytic performance and TOFs results of four catalysts. Table 2 Sample T50 (℃) T90 (℃) TOFPt (×10−4s-1) TOFOV (×10−8s-1) Pt/Mn3O4-R 172 183 5.87 7.56 Pt/Mn3O4-C 201 226 4.18 7.62 Mn3O4-R 261 279 – – Mn3O4-C 309 345 – – Table 3 Assignment of absorption bands appearing during the in-situ DRIFTS tests. Table 3 Position/ cm−1 Assignment Characteristic of Reference Ca.1513, 1448 skeletal υ(C = C) stretching vibration aromatic ring [39] Ca.1593, 1529, 1492 γ&β(C–H) out-of-plane and in-plane vibration bending vibration aromatic ring [32,59] Ca.1178, 1025 υ(C-O) stretching vibration alkoxide [32] Ca.1652,1473 υ(C = O) stretching vibration aldehyde [32] Ca.1562, 1546, 1413 asymmetric and symmetric υ(C = O) stretching vibration carboxylate [10] Ca.1402 υ(COO) stretching vibration carbonate [33,60,61] Investigation into the roles of different oxygen species in toluene oxidation over manganese-supported platinum catalysts Yuhang Sun a Jie Fan a Hairong Cheng a Shengpeng Mo a Yunting Ke a Quanming Ren a Mingli Fu a b c Peirong Chen a b c Junliang Wu a b c Daiqi Ye a b c * a School of Environment and Energy, South China University of Technology, Guangzhou, 510006, China School of Environment and Energy South China University of Technology Guangzhou 510006 China School of Environment and Energy, South China University of Technology, Guangzhou, 510006, China b Guangdong Provincial Key Laboratory of Atmospheric Environment and Pollution Control (SCUT), Guangzhou, 510006, China Guangdong Provincial Key Laboratory of Atmospheric Environment and Pollution Control (SCUT) Guangzhou 510006 China Guangdong Provincial Key Laboratory of Atmospheric Environment and Pollution Control (SCUT), Guangzhou, 510006, China c National Engineering Laboratory for VOCs Pollution Control Technology and Equipment, Guangzhou, 510006, China National Engineering Laboratory for VOCs Pollution Control Technology and Equipment Guangzhou 510006 China National Engineering Laboratory for VOCs Pollution Control Technology and Equipment, Guangzhou, 510006, China ⁎ Corresponding author at: School of Environment and Energy, South China University of Technology, Guangzhou, 510006, China. School of Environment and Energy South China University of Technology Guangzhou 510006 China Graphical abstract A series of Pt/Mn3O4 catalysts were synthesized and applied for the catalytic oxidation of toluene. Toluene-TPD, toluene-TPSR and in-situ DRIFTS manifested that toluene oxidation over Pt/Mn3O4-R catalyst might follow the Mars–van Krevelen mechanism and the pathway of toluene oxidation over Pt/Mn3O4-R was possible toluene → benzoate → carbonate → CO2. The lattice oxygen species on the surface of catalysts was directly involved in the oxidation of toluene and played an important role in the formation of key intermediate such as carbonate, resulting in the difference of the reaction mechanism and pathway between Pt/Mn3O4-R and Pt/Mn3O4-C. In addition, the degradation of the surface carbonate was demonstrated to be the rate-controlling step at 180℃ to 200℃. With the aim to elucidate the roles of different oxygen species, the catalytic oxidation of toluene over Pt/Mn3O4 synthesized by a facile reduction method was investigated. Compared with the Pt/Mn3O4-C using the commercial Mn3O4 as the support, Pt/Mn3O4-R was found to possess more surface oxygen vacancies, exhibit better redox properties and dispersion of platinum particles, leading to its higher activity for toluene oxidation (T90 = 183 ℃). Through toluene-TPD, toluene-TPSR and in-situ DRIFTS, it was found that toluene oxidation over Pt/Mn3O4-R catalyst might follow the Mars–van Krevelen (MVK) mechanism and the pathway of toluene oxidation over Pt/Mn3O4-R was possible toluene → benzoate → carbonate → CO2. The lattice oxygen species on the surface of catalysts was directly involved in the oxidation of toluene and played an important role in the formation of key intermediate such as carbonate, resulting in the difference of the reaction mechanism and pathway between Pt/Mn3O4-R and Pt/Mn3O4-C. In addition, the degradation of the surface carbonate was demonstrated to be the rate-controlling step at 180℃ to 200℃. Keywords Toluene Catalytic oxidation In-situ DRIFTS Toluene-TPSR Surface lattice oxygen 1 Introduction Since 2015, air quality has shown a trend of continuous improvement in China, but the ozone problem is still severe [1]. A large number of studies have revealed that reducing VOCs (volatile organic compounds) emissions is one of the most efficient strategies to control tropospheric ozone [2,3]. Numerous methods have been applied for degradation of VOCs, including physical adsorption [4,5], plasma technology [6], photocatalysis [7,8], and catalytic oxidation [9,10]. Among them, catalytic combustion is regarded as one of the most promising means for VOCs removal due to its high efficiency and less harmful byproducts [11,12]. The efficient catalyst at low temperature have become the key to the catalytic oxidation of VOCs. Noble-metal-based catalysts have always been widely used in the field of VOCs catalytic oxidation because of their excellent low-temperature catalytic efficiency [13,14]. Among them, supported Pt catalysts have received extensive attention due to their outstanding catalytic activity [15]. Numerous studies have been reported on controlling the particle size of Pt nanoparticles (NPs) and the proportion of Pt° species to enhance the catalytic properties and reduce the usage of Pt [16–18]. Furthermore, it is found that the support would also play significant roles in the catalytic performance. Therefore, much attention has been paid to designing and synthesizing supports of different types and structures [19,20]. Generally, the supports can be summarized into two types according to their reaction activity: inert supports (including zeolites and molecular sieves, etc.) and active supports (including CeO2, CuO, MnOx, etc.). Compared with the inert supports, active supports can not only realize the dispersion of Pt, but also play a role in the oxidation of VOCs. It has been reported that synergetic effect or the strong metal-support interaction between Pt NPs and the active support contributes to catalytic activity and stability in VOCs oxidation [21–24]. As an active component, MnOx is widely used in catalytic oxidation, and more and more researches have begun to focus on Pt-MnOx for catalytic oxidation of VOCs [23,25]. Duan et al. synthesized bi-component MnO2 and Mn3O4 supported Pt catalysts, and found that the superior catalytic activity and stability of the catalyst resulted from the high proportions of Pt° and fine interaction between Pt and MnO2@Mn3O4 at the interface [26]. Zhang et al. reported that strong oxidative hydroxyl radicals in Pt/MnO2 contributed to its excellent performance, achieving 100 % conversion of 0.42 ppm toluene at 28 °C under the gas-hourly-space-velocity of 300 L g−1 h−1 [27]. However, the studies on the reaction mechanism of toluene oxidation over Pt-MnOx catalysts are still not complete, especially how different oxygen species participate in the reaction, and the active site of the reaction is still unclear. Herein, we first synthesized Mn3O4-R by a facile reduction method, and then Pt/Mn3O4-R and Pt/Mn3O4-C were prepared by using Mn3O4-R and commercial Mn3O4 as the supports. Their catalytic performance in toluene oxidation were evaluated and it was found that the Pt/Mn3O4-R sample exhibited the highest activity for toluene oxidation. Then XRD, FESEM, HRTEM and CO pulse adsorption tests, etc. were performed to probe the crystal structure and textural properties, and H2-TPR, O2-TPD, XPS and O2 pulse adsorption tests were to measure the surface chemical states and redox properties. According to the characterization results above, TOFs based on possible active sites were calculated to clarify the active site controlling the reaction rate. Moreover, with the assistance of toluene-TPD, toluene-TPSR and in-situ DRIFTS, the participation of different oxygen species and the reaction pathway of toluene oxidation over Pt/Mn3O4 were illustrated in the present paper. 2 Experiment 2.1 Catalyst preparation All chemicals were of analytical grade, purchased from Shanghai Macklin Biochemical Co., Ltd and used as received without further purification. The sample denoted as Mn3O4-R was synthesized via a two-step reduction process. Briefly, 100 mL solution of KMnO4 (31.6 g/L) was dropped in the aqueous solution of oxalic acid (200 mL, 22.8 g/L) and the mixture was magnetically stirred for 3 h. Then the precipitates were collected by centrifugation. Subsequently, the solid product was reduced by aqueous solution of NaBH4 (10 mL, 8 g/L). Finally, the product was centrifuged, washed with deionized water, dried overnight and calcined at 400 ℃ for 2 h. And the other support denoted as Mn3O4-C was commercial. Pt/Mn3O4 was prepared by liquid-phase reduction method using NaBH4 as a reducing agent. Typically, 1 g Mn3O4 was dispersed in 20 mL solution of H2PtCl6 (1.07 mg/L) to reach a theoretical platinum load of 1% and the mixture was stirred for 3 h. Then, 10 mL of NaBH4 solution (8 g/L) was added dropwise into the foregoing mixture. After stirring for another three hours, the precipitates were centrifuged, washed with deionized water and dried overnight. The samples using Mn3O4-R and Mn3O4-C as precursors were denoted as Pt/Mn3O4-R and Pt/Mn3O4-C, respectively. 2.2 Catalyst characterization Power X-ray diffraction (XRD) patterns of the catalysts were collected on a D8 advance diffractometer equipped with a Cu Ka radiation (λ = 1.5418 Å) at 40 kV and 40 mA from 2θ range of 10° to 80°. Inductively coupled plasma optical emission spectrometer (ICP-OES) was performed to examine the Pt loading on an Agilent ICP-OES730 instrument and a Meinhard nebulizer coupled to a cyclonic spray chamber were utilized to increase the analytical sensitivity. N2 adsorption-desorption isotherms were recorded on an ASAP 2020 automated gas sorption system at −196 ℃. The specific surface areas (SBET) were calculated according to Brunauer-Emmett-Teller (BET) method from the adsorption. Raman spectra were collected on a LabRAM HR Evolution Laser Raman Spectrometer with the argon ion excitation source at 532 nm. The field-emission scanning electron microscopy (FESEM) images were recorded by using a Zeiss Ultra at an accelerating voltage of 3 kV while those of high-resolution transmission electron microscope (HRTEM) were on JEM-2100HR (JEOL, Japan). X-ray photoelectron spectroscopy (XPS) data were collected on a Thermo ESCALAB 250 with Al Kα (hυ = 1486.8 eV) as the excitation source. By using the C 1s peak at 284.8 eV as an internal standard, the binding energy of all chemical species was calibrated. H2 temperature-programmed reduction (H2-TPR) experiments were performed on a Micromeritics Chemisorb 2920II chemisorption analyzer. 50 mg sample was pretreated at 300 ℃ for 1 h within a flow of O2/He (30 mL/min), then cooled down to 60 ℃ in an Argon flow (30 mL/min) and finally it was heated at a rate of 10 ℃/min from 60 to 600 ℃ in a flow of 5% H2/Ar (30 mL/min). The H2 consumption of all the catalysts was calculated by using CuO as a calibration reference. Oxygen temperature-programmed desorption (O2-TPD) experiments were also carried out on a Micromeritics Chemisorb 2920II chemisorption analyzer. 100 mg sample was pre-heated in 5% O2/He flow from room temperature to 300 ℃ and held for 1 h (30 mL/min), then cooled down to 60 ℃ in a pure helium flow (30 mL/min) and finally it was heated at a rate of 10 ℃/min from 60 to 800 ℃ in helium flow. The experiments of toluene temperature-programmed desorption (toluene-TPD) and toluene temperature programmed surface reaction (toluene-TPSR) were both performed on a ﬁxed-bed quartz reactor connected to a Hiden HPR-20 mass spectrometer. Typically, the samples were pretreated in the N2 flow at 300 ℃ for 1 h. After adsorption of toluene/N2 (1000 ppm) gas mixture for 1 h under ambient conditions, the gas flow was shifted to pure nitrogen and maintained for about 1 h. Then the reactor was heated to 500 ℃ with a linear step of 5 ℃/min. The experiments of toluene-TPSR were the same as that of toluene-TPD, except for mixing 1% of oxygen into the nitrogen flow while the reactor was heating to 500 ℃. During the aforementioned TPD and TPSR processes, toluene and CO2 were monitored with the m/z ratio of 92 and 44, respectively. The CO pulse adsorption test of the Pt supported samples were performed to determine the dispersion of platinum by using a Micromeritics Chemisorb 2920II chemisorption analyzer. Typically, 0.1 g of the sample was pre-treated in a pure He flow (20 mL/min) at 200 ℃ for 2 h and then cooled down to room temperature. Then the pulse adsorption measurements were performed at this temperature with 10 % CO/He (20 mL/min). Oxygen pulse adsorption experiment was carried out on a Micromeritics Chemisorb 2920II chemisorption analyzer to determine the value of oxygen storage capacity and to further calculate the surface oxygen vacancies. 100 mg sample was first reduced by 10 % H2/Ar at 200 ℃ for 2 h followed by cooling down to ambient temperature under helium flow. Subsequently a mixture gas flow of 10 % O2/He was periodically injected into the U-tube until absorption saturation. The oxygen consumption of the catalyst and the Pt species were defined as OSCcatalyst and OSCPt. The value of surface oxygen vacancies (OSCsurface) was calculated based on the following equation [28,29]: O S C P t = 2 D P t X P t M P t O S C s u r f a c e = O S C c a t a l y s t - O S C P t where DPt is the dispersion of Pt, determined by the result of CO pulse adsorption; XPt is the Pt loading of the catalyst; the stoichiometric factor between oxygen and Pt atom is set as 2:1, MPt denotes the molar weight of Pt (195.08 g mol−1). In-situ diffuse reflectance infrared Fourier transform spectrometry (in-situ DRIFTS) was recorded on a Nicolet 6700 FTIR spectrometer (Thermo Fisher, USA) equipped with an in-situ cell to detect the surface intermediate formed during toluene oxidation. The samples were pretreated by N2 (30 mL min−1) at the 300 ℃ for 1 h, followed by cooling down to room temperature, then designed gas flow was injected at a flow rate of 30 mL/min. The background spectrum was collected in ﬂowing N2 and automatically subtracted from the sample spectrum at the corresponding temperature. In addition, in-situ DRIFTS spectra of toluene oxidation under different temperatures were recorded after 1 h balance at each temperature to ensure the adsorption-reaction equilibrium. 2.3 Catalytic performance tests Toluene oxidation reactions were performed on a ﬁxed-bed quartz reactor (6 mm i.d.). A mixture of air stream with a flow rate of 80 mL/min and toluene concentration of 1000 ppm was put in the reactor and passed over 100 mg of as prepared catalyst, resulting a weight hourly space velocity (WHSV) at 48,000 mL g−1 h-1. All products were analyzed via an online gas chromatography (GC) (GC-2014C, Shimadzu) equipped with two flame ionization detectors (FID). Catalytic activities were evaluated using the temperatures (T50, and T90) required for achieving toluene conversions (Xtoluene) of 50, and 90 %, respectively, and the toluene conversion was calculated according to the following equations: X t o l u e n e = c t o l u e n e , i n - c t o l u e n e , o u t c t o l u e n e , i n × 100 % where ctoluene,out represented the outlet concentration of toluene at steady state, ctoluene,in was the inlet concentration of toluene. Two types of turnover frequencies (TOFs) were calculated based on the following equation [28]: T O F P t = X t o l u e n e F t o l u e n e M P t m c a t X P t D P t T O F O V = X t o l u e n e F t o l u e n e 1 m c a t O S C s u r f a c e where Xtoluene is the toluene conversion at a certain temperature; Ftoluene is the flow rate of toluene in unit of mol s−1; mcat is the mass of catalyst. TOFPt is the conventional calculation of turnover frequency based on the metal dispersion; TOFOV reflects the turnover frequency based on the concentration of oxygen vacancy on the surface of manganese oxide. In addition, the long-time stability test of the Pt/Mn3O4-R sample under different space velocity was performed by changing the flow rate of the gas mixture. 3 Results and discussion 3.1 Crystal structure and textural properties Fig. 1 A shows the XRD patterns of as-prepared Mn3O4-based samples. The peaks of all catalysts could be indexed to the hausmannite Mn3O4 crystalline phase (JCPDS card No. 01-1127) and no obvious diffraction peak corresponding to Pt or PtOx phases was observed (as indicated in Fig. S1). Given the ICP-OES results that the actual platinum loading of Pt/Mn3O4-R and Pt/Mn3O4-C was 1.02 % and 0.95 % (very close to the theoretical loading), respectively, the absence of platinum peaks may be due to the low loading and high dispersion of platinum species. In addition, the diffraction peak intensities of Pt/Mn3O4-C were weaker than those of Mn3O4-C, indicating that the crystallinity of commercial manganese oxide became poorer during the loading process of platinum. The nitrogen adsorption–desorption tests were carried out and the results of different catalysts are presented in Fig. 1B and C. As shown in Fig. 1B, all samples exhibited typical IV isotherm with a H3 type hysteresis loops, suggesting the existence of mesopores. Combined with the pore size distribution in Fig. 1C, it could be inferred that the pores of all samples are mainly distributed in micropores and mesopores [9,30]. As listed in Table S1, the specific surface area of Pt/Mn3O4-R (90.0 m2/g) was much larger than that of Pt/Mn3O4-C (16.3 m2/g). Less crystallinity and larger specific surface area of Pt/Mn3O4-R are in favor to form more lattice defects and oxygen vacancies and introduce more active sites for toluene oxidation [32,33]. Comparing the specific surface area before and after loading of Pt, it was found that the specific surface area of the Mn3O4-R catalyst prepared by the reduction method decreased from 138.2 to 90.0 m2/g, while that of the commercial one slightly increased from 11.7 to 16.3 m2/g. Fig. 1D shows Raman spectra of four catalysts. Flat peaks could be observed at ca. 365 cm−1 and prominent peaks at ca. 640 cm−1 for Pt/Mn3O4 and Mn3O4 catalysts. The peaks at ca. 365 cm−1 were ascribed to the out-of-plane bending modes and those at ca. 640 cm−1 were attributed to symmetric stretch of Mn3O4, respectively [34,35]. It can be found that the intensity of the peaks at 640 cm−1 was in the order of Mn3O4-C > Pt/Mn3O4-C > Pt/Mn3O4-R > Mn3O4-R, which reflected the crystallinity and was in good agreement with the XRD results. In addition, the Mn-O force constant (k) can be calculated by the following formula [36,37]: ν = 1 2 π c k μ where ν is the wavenumber (cm−1), c is light velocity, and μ is the effective mass of the bond. The calculated force constant was in the order of Mn3O4-C (298.9 N/m) > Pt/Mn3O4-C (298.4 N/m) > Mn3O4-R (286.0 N/m) > Pt/Mn3O4-R (284.3 N/m). The force constant was related to the average Mn-O bond length by the equation k = 17/r3, so it can be deduced that Pt/Mn3O4-R exhibits the weakest Mn-O bonds among four catalysts. It has been reported that surface oxygen atoms in weak Mn-O bonds are more likely to be released to participate in oxidation, suggesting that the surface oxygen species of Pt/Mn3O4-R may perform the best mobility among as-prepared catalysts [38,39]. The FESEM and HRTEM images of different catalysts are presented in Fig. 2 . The ordered block morphology of the Pt/Mn3O4-R is basically observed in Fig. 2A. Compared with the pure manganese oxide shown in Fig. 2C, the morphology of the Pt/Mn3O4-R catalyst was similar. Fig. 2B and D show that Pt/Mn3O4-C and Mn3O4-C both possess a square-pillow like morphology. While compared to Mn3O4-C, the crystal surface of Pt/Mn3O4-C was rougher and unevener, which may explain the decrease in crystallinity during the introduction of platinum to Mn3O4-C, in line with the results of XRD. The microscopic structures of Pt/Mn3O4 catalysts were probed by using the HRTEM, as shown in Fig. 2E and F. The lattice fringes of 0.275, 0.492 and 0.227 nm observed on Pt/Mn3O4-R in Fig. 2E were corresponded to the (103) and (101) crystal planes of Mn3O4 and (111) crystal planes of Pt, respectively. Correspondingly, the lattice fringes of 0.236 nm in Fig. 2F were assigned to the (004) crystal planes of Mn3O4 of Pt/Mn3O4-C catalyst. Moreover, CO pulse adsorption experiments were carried out to determine the dispersion of Pt. The dispersion of Pt for Pt/Mn3O4-R was 18.6 % and 8.4 % for Pt/Mn3O4-C, as listed in Table S1. The above results indicated that Pt on the surface of Pt/Mn3O4-R was better dispersed than that of Pt/Mn3O4-C. 3.2 Surface chemical states and redox properties For the purpose of investigating the redox properties of the as-synthesized catalysts, we performed the H2-TPR experiments, as shown in Fig. 3 . The small peaks of H2 consumption below 100 ℃ were associated with the reduction of PtOx species [17], and the broad peaks in the range from 150 to 500 ℃ were attributed to the stepwise reduction of Mn4+→Mn3+→Mn2+ under H2 flow [40]. Obviously, the H2-TPR profiles of Mn3O4-R and Mn3O4-C were similar in shape with Pt/Mn3O4-R and Pt/Mn3O4-C, respectively, but after the introduction of Pt species, all the reduction peaks shifted to lower temperature regions. This may indicated the existence of a strong interaction between the Pt species and the MnOx support [14,23], which could result in weaker Mn-O bands thus promoting the oxygen mobility and forming more active oxygen species of supported platinum catalysts [25]. Furthermore, the main H2 consumption peak of Pt/Mn3O4-R was located in 198 ℃ and 272 ℃, lower than that of Pt/Mn3O4-C (270 ℃), suggesting that Pt/Mn3O4-R possessed the better low-temperature reducibility. By calculating the fitted area of spectrogram, it was found that Pt/Mn3O4-R consumed 4.62 mmol/g H2 below 250 ℃ in H2-TPR experiments, much more than that of Pt/Mn3O4-C (2.29 mmol/g), Mn3O4-R (1.58 mmol/g), and Mn3O4-C (0.07 mmol/g), suggesting the largest amount of reducible oxygen species, further indicating the best reducibility at relatively low temperature of Pt/Mn3O4-R [41,42]. The order of H2 consumption below 250 ℃ was in good consistency with catalytic performance (shown below), indicating catalytic activity is positively correlated with low temperature reducibility. O2-TPD profiles are shown in Fig. 4 . The spectrum of O2-TPD was divided into three regions in the temperature range from 60 to 800 ℃, that is, α, β, γ, corresponding to the desorption peaks at below 300, 300–460, and above 460 ℃ respectively. In general, the region α was attributed to the physically absorbed oxygen and weakly chemisorbed oxygen (O2−, O2 2−, or O-) that can easily desorb at low temperature, and regions β and γ corresponded to the desorption of surface lattice oxygen and bulk lattice oxygen [38,43,44]. Obviously, the amount of desorption in the α region exhibited a sequence of Mn3O4-R > Pt/Mn3O4-R > Pt/Mn3O4-C > Mn3O4-C and this was consistent with the result of specific surface area, illustrating the positive correlation between physical adsorption and specific surface area. In the region β, the desorption peak representing the surface lattice oxygen of Pt/Mn3O4-R and Mn3O4-R appeared at 327 and 356 ℃. Compared with the commercial samples, the intensities of the desorption peak in the region β of Pt/Mn3O4-R and Mn3O4-R was much greater. Besides, the peak positions of Pt/Mn3O4-R and Mn3O4-R were at lower temperature than those of Pt/Mn3O4-C and Mn3O4-C. Greater intensity and lower desorption temperature of the surface lattice oxygen species indicated that Pt/Mn3O4-R and Mn3O4-R possessed larger amount of surface lattice oxygen species of higher activity, which was beneficial for oxidation reaction [45,46]. In addition, the desorption peaks in the region β of Pt/Mn3O4-R and Pt/Mn3O4-C catalysts both shifted to lower temperature compare to pure manganese oxides catalysts, suggesting the introduction of Pt activated the surface lattice oxygen and improved its mobility. Surface chemical states of different samples were probed by X-ray photoelectron spectroscopy (XPS) technology. The XPS spectra of Pt 4f, Mn 3s, and O 1s of different samples are shown in Figs. 5, 6 and S2, respectively. The Pt 4f spectra in the range of 69–77 eV were divided into four peaks at 70.9, 73.9, 71.53 and 74.53 eV. The first two peaks were ascribed to the Pt° species and the latter two to Pt2+ species, respectively [13]. Obviously, the fitting peak area of Pt° was much larger than that of Pt2+, indicating that the platinum on the catalyst surface mainly existed in the form of Pt°. By calculating the area of each fitting peak, the ratio of Pt°/ (Pt°+Pt2+) was 81.4 % for Pt/Mn3O4-R and 80.3 % for Pt/Mn3O4-C. Although it has been revealed that the proportion of Pt° species have an impact on catalytic activity [16,17], the slight difference of Pt°/ (Pt°+Pt2+) ratio between Pt/Mn3O4-R and Pt/Mn3O4-C are within the analysis error. The average oxidation state (AOS) of the surface manganese was calculated based on the equation [47]: AOS = 8.956–1.126ΔEs, in which ΔEs represents the splitting width between two Mn 3 s peaks (Fig. S2). The corresponding AOS values were determined to be 2.63 for Pt/Mn3O4-R and 2.66 for Pt/Mn3O4-C. As discussed in the literatures, lower AOS meant the existence of more low-valent manganese ions, and more oxygen vacancies would be generated to maintain electrostatic balance [44,48], suggesting more surface oxygen vacancies on Pt/Mn3O4-R. To further obtain the concentration of surface oxygen vacancy quantificationally, oxygen pulse adsorption test was carried out. The value of oxygen vacancies was obtained after deducting the OSCPt value from OSCcatalyst. The surface oxygen vacancies of Pt/Mn3O4-R was determined to be 0.076 mmol/g, much larger than that of Pt/Mn3O4-C (0.045 mmol/g), illustrating more oxygen vacancies on the surface of Pt/Mn3O4-R and more oxygen adsorption sites for toluene oxidation. Oxygen vacancies were reported to be conducive to the adsorption and activation of molecular oxygen, remarkably influencing the catalytic activity of toluene oxidation [21,49]. In addition, the O 1s XPS spectra were displayed in Fig. 6, and three kinds of oxygen species could be clearly found from deconvolution. These bands can be ascribed to surface lattice oxygen (Olatt at ca. 529.6 eV), surface adsorbed oxygen (Oads at ca. 531 eV), and hydroxyl oxygen or oxygen from water (OH2O+OH at ca. 532 eV), respectively [50,51]. It has been revealed that the Oads species play a crucial role in the catalytic oxidation reaction. The percentage of Oads was calculated to be 28.1 % for Pt/Mn3O4-R and 25.5 % for Pt/Mn3O4-C (Table 1 ), suggesting the better catalytic prosperity of Pt/Mn3O4-R than Pt/Mn3O4-C [52,53]. 3.3 Catalytic activity and investigation into active site The catalytic performance of toluene oxidation over Pt/Mn3O4-R, Pt/Mn3O4-C, Mn3O4-R and Mn3O4-C were estimated under a weight hourly space velocity of 48,000 mL g−1 h−1, as shown in Fig. 7 A. The toluene conversion increased with temperature rising. As for Mn3O4-R and Mn3O4-C samples, Mn3O4-R catalyst had higher activity for toluene oxidation, achieving T50 and T90 at 261 and 279 ℃. After Pt species was loaded on the support, the activity performance of the catalyst significantly improved. Pt/Mn3O4-R sample reached 50 % conversion at 172 ℃ and 90 % conversion at 183 ℃. It exhibited much higher catalytic activity than Pt/Mn3O4-C, which converted 50 % toluene at 201 ℃ and 90 % toluene at 226 ℃. Obviously, the introduction of Pt was one of the reasons why toluene catalytic performance of Pt/Mn3O4-R is better than three other catalysts. Therefore, Pt/Mn3O4-R catalyst with different Pt loadings were prepared and their catalytic evaluation curves are shown in Fig. 7B. As the Pt content increased, the temperature catalyst achieving complete degradation of toluene decreased from 210 to 180 ℃. However, it had been reported that in the toluene oxidation over catalysts where Pt was loaded on active supports, the active sites that control the reaction rate are surface oxygen vacancies instead of exposed Pt atoms [17,28]. In the present work, the main factors leading to the difference in reactivity was probable the proportion of Pt° species, the dispersion of Pt, and the concentration of oxygen vacancies. Since the proportion of Pt° species between Pt/Mn3O4- R and Pt/Mn3O4-C was not much different, it cannot explain the huge difference in activity between Pt/Mn3O4-R and Pt/Mn3O4-C. In order to further explore the active sites, the TOFs based on Pt dispersion and surface oxygen vacancies were calculated at 150 ℃, and the results are listed in Table 2 . The value of TOFOV is 7.56 × 10−8 s−1 for Pt/Mn3O4-R and 7.62 × 10−8 s−1 for Pt/Mn3O4-C, which was quite close. While the TOFPt between Pt/Mn3O4-R and Pt/Mn3O4-C at 150 ℃ were different. That meant the surface oxygen vacancies were the main active sites controlling the reaction rate at 150 ℃. It has been reported that for the VOCs oxidation reaction over catalysts where noble metals are loaded on active supports, the reaction follows a dual site mechanism. Specifically, the reaction rate is controlled by two steps: the oxygen chemisorption process on the surface vacancies and reaction between oxidized VOCs intermediate and adsorbed oxygen controlled by noble metals [17,54–56]. O2-TPD results in Fig. 4 have shown that the desorption of physically absorbed oxygen and weakly chemisorbed oxygen was at the temperature of ca. 100 ℃. The temperature of 150 ℃ was not conducive to the progress of chemical adsorption and activation on oxygen vacancies, so oxygen vacancies were possible the active sites that controlled the reaction rate at 150 ℃. In addition, stability tests of the catalyst with the best performance were carried out. The cycling test and XRD results of used catalyst are shown in Fig. 7C and Fig. S3, respectively. It was found that the catalytic activity and crystal phase of Pt/Mn3O4-R was basically maintained during the reuse tests, indicating its good stability in repeated utilization. The long-term test under different space velocity shown in Fig. 7D demonstrated that the catalyst was stable over a long period of time, and it could still maintain a conversion rate of 60 % at a high space velocity of 80,000 mL g−1 h−1. 3.4 Mechanistic investigation of toluene oxidation 3.4.1 Mechanistic investigation by toluene-TPD and toluene-TPSR In order to determine the participation of gaseous oxygen and lattice oxygen in the catalytic oxidation of toluene over Pt/Mn3O4 and Mn3O4, toluene-TPD and toluene-TPSR tests were carried out. Fragments of m/z = 92 and m/z = 44 were used to identify toluene and the formed CO2, respectively. The mass signal of toluene in toluene-TPD test is shown in Fig. 8 A, obvious peaks were observed in the range of 50–150 ℃ on Pt/Mn3O4-R, Pt/Mn3O4-C and Mn3O4-R, which can be attributed to the desorption of physically adsorbed toluene [39,57]. The desorption amount of toluene followed the sequence of Mn3O4-R > Pt/Mn3O4-R>> Pt/Mn3O4-C > Mn3O4-C, confirming that Pt/Mn3O4-R and Mn3O4-R exhibited stronger ability to adsorb toluene than Pt/Mn3O4-C and Mn3O4-C. Meanwhile, CO2 was also formed over some catalysts during toluene-TPD experiments (Fig. 8B). It was worth mentioning that the catalyst was heated in nitrogen atmosphere at 300 ℃ for one hour to remove the gas-phase oxygen adsorbed on the surface in the pretreatment, so the CO2 produced during toluene-TPD experiments originated from the reaction between the lattice oxygen species of manganese oxides and chemically adsorbed toluene [39]. As showed in Fig. 8B, dotted lines and solid lines represented the mass signal of CO2 (m/z = 44) that toluene was oxidized over the catalyst in the absence and presence of gaseous oxygen, respectively. The CO2 peaks of Pt/Mn3O4-R and Mn3O4-R were centered on 279 and 317 ℃ in toluene-TPD tests. Compared with Mn3O4-R, the peak position of Pt/Mn3O4-R shifted to a lower temperature. This result illustrated that the lattice oxygen in Pt/Mn3O4-R could oxidize toluene at lower temperature, suggesting in addition to the activation of toluene by Pt species, the introduction of Pt could promote the activity of surface/subsurface lattice oxygen, which was in agreement with the result of O2-TPD. In the absence of gaseous oxygen, the starting temperature of CO2 peak of Pt/Mn3O4-R is 202 ℃, while in the presence of gaseous oxygen, the starting temperature was shifted to 180 ℃. This indicated that gas phase oxygen could replenish the lattice oxygen by the oxygen vacancies, facilitate the circulation of oxygen and promote the reaction of ad-toluene with the oxygen species of Mn3O4 [26,58]. It was reasonable to deduce that toluene oxidation over Pt/Mn3O4-R catalyst in the presence of gaseous oxygen followed the Mars–van Krevelen (MVK) mechanism. And for toluene over Pt/Mn3O4-C catalyst, almost no distinct peak of CO2 was detected on Pt/Mn3O4-C in the absence of gaseous oxygen although their CO2 signal was amplified by 5 times. However, the sharp peak of CO2 was observed to start at 189 ℃ and center on 201 ℃ over Pt/Mn3O4-C in toluene-TPSR, indicating that the absence of CO2 production in toluene-TPD over Pt/Mn3O4-C was due to the poor lattice oxygen species instead of too little chemisorbed toluene. The above results of toluene-TPD and toluene-TPSR demonstrated that the amount and mobility of lattice oxygen had a great influence on the reaction mechanism, and the lattice oxygen with high activity and strong mobility is the premise of MVK mechanism. 3.4.2 Mechanistic investigation by in-situ DRIFTS The in-situ DRIFTS experiments were conducted to further investigate the mechanism and to determine the adsorption intermediates during toluene oxidation over Pt/Mn3O4-R, Pt/Mn3O4-C and Mn3O4-R. The results of in-situ DRIFTS under different situation are depicted in Fig. 9 and the details about assignment of infrared bands are listed in Table 3 . Fig. 9A shows the in-situ DRIFTS spectra of toluene adsorption over Pt/Mn3O4-R at 180 ℃ under 500 ppm toluene/air for 0, 20, 40, 60, 80 and 100 min. The peak intensity of these peaks gradually became stronger with time and stabilized at about 100 min, indicating that the toluene oxidation reaction reached dynamic equilibrium at this time. The strong bands at 1593, 1529, and 1492 cm−1 could be assigned to out-of-plane and in-plane vibrations of aromatic ring [32,59], and those at 1513 and 1448 cm-1 was attributed to skeletal CC stretching vibration of aromatic ring [39], suggesting the significant existence of adsorbed original toluene and other intermediate before the aromatic ring opening. The peaks located at 1562, 1546 and 1413 cm−1 could be assigned to carboxylate species, indicating the existence of benzoate species [10]. Notably, the bands at around 1402 cm−1 were mainly attributed to ν (COO) vibrations, indicating the accumulation of surface manganese carbonate species [33,60,61]. Combining the species above, it could be inferred that toluene oxidation over Pt/Mn3O4-R probably followed the pathway of toluene → benzoate → carbonate → CO2 in the presence of gaseous oxygen. In-situ DRIFTS of toluene adsorption over Pt/Mn3O4-R under 500 ppm toluene/N2 at 180 ℃ for different time was performed, as shown in Fig. 9B. The benzoic acid and carbonate species were still detected in Fig. 9B, illustrating that in the absence of gas phase oxygen, the surface lattice oxygen could deeply oxide toluene over Pt/Mn3O4-R at 180 ℃, which was in good agreement with the results of toluene-TPD. In addition to the absorption peaks that have appeared in Fig. 9A, several new peaks was also detected, that was the bands located at 1178 and 1025 cm−1(characteristic of CO stretching vibration of alkoxide species), and the bands at 1652 and 1473 cm−1(characteristic of CO stretching vibration of aldehydes), suggesting a small differences in toluene oxidation path from that in Fig. 9A [32]. This showed that gas phase oxygen was a key factor in promoting the conversion of benzaldehyde and benzyl alcohol to benzoic acid. The absorption peak intensity in Fig. 9A was much stronger than that in Fig. 9B, which meant that the reaction rate of toluene oxidation in the presence of gaseous oxygen was much higher than that in the absence of gaseous oxygen. This might be because gas phase oxygen supplemented lattice oxygen and facilitate the circulation of oxygen, thus greatly increasing the oxidation rate of toluene. To realize the participation of lattice oxygen, the in-situ DRIFTS over Pt/Mn3O4-C which exhibited worse mobility of lattice oxygen were performed and the results are shown in Fig. 9C, D, and E. Similar to the spectra in Fig. 9A and B, benzoate species (1564, 1537 and 1427 cm−1) and benzaldehyde species (1652 and 1473 cm−1) were detected over the surface of Pt/Mn3O4-C sample. Obviously, there was no IR absorption peak of carbonate in any of Fig. 9C, D, and E, even if the temperature was elevated to 220 ℃ shown in Fig. 9E. This illustrated that the oxidation of toluene over Pt/Mn3O4-C might follow a reaction path of toluene → benzyl alcohol → benzaldehyde → benzoic acid → CO2, which was different from that over Pt/Mn3O4-R. On the other hand, it also demonstrated that the active lattice oxygen species could be the prerequisite for the conversion of intermediate products such as benzoic acid to carbonate. Compared to 10B, the peak intensity in 10D was lower and the peak area was smaller, indicating that lattice oxygen could still play a significant role on toluene oxide in the absence of gas phase oxygen. This was consistent with the results of toluene-TPD. Platinum was a crucial factor in the catalytic oxidation of toluene, and to understand the role of platinum, in-situ DRIFTS experiment of toluene oxidation reaction over Mn3O4-R at 180 ℃ under 500 ppm toluene/air for different time was carried out. As depicted in Fig. 9F, benzoate species (1558, 1540 and 1417 cm−1), benzyl alcohol species (1178 and 1025 cm−1), benzaldehyde species (1652 and 1473 cm−1) and carbonate species (1396 cm−1) were detected over the surface of Mn3O4-R sample. Compared with Fig. 9A, benzoic acid and carbonate species were observed, as well as aldehyde species and alcohol species that were not in Fig. 9A. This was because the loading process of Pt improved the mobility of lattice oxygen, which has been confirmed by the result of O2-TPD, so increasing the supply of surface lattice oxygen, so that toluene could be directly oxidized into benzoic acid species in one step. Moreover, similar intermediate products indicated that toluene oxidation reaction over Pt/Mn3O4-R and Mn3O4-R might share a similar reaction pathway. The intensity of peaks in Fig. 9F was weaker than that in Fig. 9A and C, indicating that the oxidation rate of toluene on the surface of the platinum-supported catalyst was significantly increased. Fig. 9F depicted significantly stronger absorption peaks of benzoic acid species and fewer carbonate species, showing that toluene on Pt/Mn3O4-R is oxidized to a deeper degree than that on Mn3O4-R. This may be due to the active surface lattice oxygen brought by the introduction of Pt, which promoted the conversion of further degradation of benzoic acid. Based on the above DRIFTS spectra analyses, it can be concluded that the mobility of lattice oxygen on catalyst and gaseous oxygen both affected the reaction path of toluene oxidation, while gas phase oxygen and the introduction of Pt have a great influence on the reaction rate and depth of toluene reaction. It has been put forward by Yang et al. [39] that the decomposition of carbonate was the possible rate-controlling step of toluene oxidation over MnOx. In this study, the absorption peak of carbonate species exhibited great intensity in Fig. 9A, and we assumed that the decomposition of carbonate was the rate-controlling step of toluene oxidation over the Pt/Mn3O4-R. Hence, in-situ DRIFTS experiments of toluene oxidation over Pt/Mn3O4-R exposed to 500 ppm toluene/air under different temperatures (Fig. 10 A) and the test of oxidation process of pre-adsorbed toluene at 180 ℃ for 100 min under nitrogen atmosphere over Pt/Mn3O4-R (Fig. 10C) were performed. It can be seen from Fig. 10A that as the temperature increased, the absorption peaks of each intermediate products became enhanced, indicating the increase of oxidation rate. The characteristic peak intensities of the four substances were sorted in Fig. 10B. It could be seen that the signal values of alcohol (1178 cm−1), aldehyde (1479 cm−1), and benzoic acid (1546 cm−1) gradually increased, and that of carbonate (1402 cm−1) reached the peak value at 180 ℃ and then weakened, indicating that the consumption rate of carbonate was low at low temperature and increased greatly after 180 ℃. Furthermore, Fig. 10C and D show the gradual oxidation process of pre-adsorbed toluene and other intermediates. The characteristic peak intensities of alcohol, aldehyde, and benzoic acid all gradually decreased while that of carbonate has experienced a process of increasing first and then decreasing, indicating that the decomposition rate of carbonate at low temperature was lower than the rate that new carbonate was formed by upstream products, thus leading to the accumulation of carbonate. The above results indicated that the decomposition of carbonate species to CO2 might be the rate-controlling step of toluene oxidation over Pt/Mn3O4-R at 180–200 ℃. 4 Conclusions In summary, the Pt/Mn3O4-R was synthesized by a facile approach and exhibited high catalytic performance (T90 = 183 ℃) as well as good stability in cycling and high space velocity tests. H2-TPR, O2-TPD, XPS, O2 pulse adsorption demonstrated that compared with the Pt/Mn3O4-C using the commercial Mn3O4, Pt/Mn3O4-R had much more surface oxygen vacancies and exhibited better dispersion of platinum particles, resulting in its excellent activity for toluene oxidation. Through toluene-TPD, toluene-TPSR and in-situ DRIFTS, it was reasonable to predict that toluene oxidation over Pt/Mn3O4-R catalyst in the presence of gaseous oxygen followed the Mars–van Krevelen (MVK) mechanism and the pathway of toluene oxidation over Pt/Mn3O4-R might be toluene → benzoate → carbonate → CO2. The introduction of Pt improved the activity of lattice oxygen and the redox prosperity of the catalyst, which are in favor to reduce the temperature of surface lattice oxygen being utilized, increase the reaction rate of toluene oxidation, and promote the deep oxidation of toluene. The amount and mobility of lattice oxygen species on the surface of catalysts was found to greatly affected the reaction mechanism and pathway. The gaseous oxygen could replenish the lattice oxygen by adsorbing on the oxygen vacancies, facilitate the circulation of oxygen and promote the reaction of ad-toluene with the oxygen species of Mn3O4. In addition, the decomposition of carbonate was confirmed to be the controlling step of toluene oxidation over Pt/Mn3O4-R at 180–200 ℃. Credit author statement Yuhang Sun: Investigation, Writing - Original Draft. Jie Fan: Investigation, Writing - Review & Editing. Hairong Cheng: Data Curation. Shengpeng Mo: Methodology, Writing - Review & Editing. Yunting Ke: Data Curation. Quanming Ren: Writing - Review & Editing, Funding acquisition. Mingli Fu: Writing - Funding acquisition. Peirong Chen: Writing - Funding acquisition. Junliang Wu: Writing - Funding acquisition. Daiqi Ye: Funding acquisition, Conceptualization, Writing - Review & Editing. Declaration of Competing Interest The authors report no declarations of interest. Acknowledgments This research described above was financially supported by the Science and Technology Planning Project of Guangdong Province China (No. 2015B0202236002), the National Natural Science Foundation of China (No.51878292, 51108187, 51672273, B5151050), the National Key Research and development Project of Research (No. 2017YFC0212805), the Guangdong Natural Science Foundation (No.2016A030311003), and the China Postdoctoral Science Foundation (No.2020M682715). Appendix A Supplementary data Supplementary material related to this article can be found, in the online version, at doi:https://doi.org/10.1016/j.mcat.2021.111569. Appendix A Supplementary data The following is Supplementary data to this article: References [1] CNEMC (China National Environmental Monitoring Centre), 2015-2019. Report on air quality in China in 2015-2019. Available: http://www.cnemc.cn/jcbg/kqzlzkbg/ (Accessed 28 December 2020). [2] R.J. Avery Reactivity-based VOC control for solvent products: more efficient ozone reduction strategies Environ. Sci. Technol. 40 2006 4845 4850 R.J. Avery, Reactivity-Based VOC Control for Solvent Products: More Efficient Ozone Reduction Strategies, Environmental Science & Technology, 40 (2006) 4845-4850. [3] G. Tang Y. Wang X. Li D. Ji S. Hsu X. Gao Spatial-temporal variations in surface ozone in Northern China as observed during 2009–2010 and possible implications for future air quality control strategies Atmos. Chem. Phys. 12 2012 2757 2776 G. Tang, Y. Wang, X. Li, D. Ji, S. Hsu, X. Gao, Spatial-temporal variations in surface ozone in Northern China as observed during 2009–2010 and possible implications for future air quality control strategies, Atmospheric Chemistry and Physics, 12 (2012) 2757-2776. [4] H. Cheng Y. Sun X. Wang S. Zou G. Ye H. Huang D. Ye Hierarchical porous carbon fabricated from cellulose-degrading fungus modified rice husks: ultrahigh surface area and impressive improvement in toluene adsorption J. Hazard. Mater. 392 2020 122298 H. Cheng, Y. Sun, X. Wang, S. Zou, G. Ye, H. Huang, D. Ye, Hierarchical porous carbon fabricated from cellulose-degrading fungus modified rice husks: Ultrahigh surface area and impressive improvement in toluene adsorption, J Hazard Mater, 392 (2020) 122298. [5] W. Zhang H. Cheng Q. Niu M. Fu H. Huang D. Ye Microbial targeted degradation pretreatment: a novel approach to preparation of activated carbon with specific hierarchical porous structures, high surface areas, and satisfactory toluene adsorption performance Environ. Sci. Technol. 53 2019 7632 7640 W. Zhang, H. Cheng, Q. Niu, M. Fu, H. Huang, D. Ye, Microbial Targeted Degradation Pretreatment: A Novel Approach to Preparation of Activated Carbon with Specific Hierarchical Porous Structures, High Surface Areas, and Satisfactory Toluene Adsorption Performance, Environmental Science & Technology, 53 (2019) 7632-7640. [6] T. Wang S. Chen H.G. Wang Z. Liu Z.B. Wu In-plasma catalytic degradation of toluene over different MnO2 polymorphs study of reaction mechanism Chin. J. Catal. 38 2017 793 804 T. Wang, S. Chen, H.G. Wang, Z. Liu, Z.B. Wu, In-plasma catalytic degradation of toluene over different MnO2 polymorphs study of reaction mechanism, Chin. J. Catal., 38 (2017) 793-804. [7] F. Almomani R. Bhosale M. Shawaqfah Solar oxidation of toluene over Co doped nano-catalyst Chemosphere 255 2020 126878 F. Almomani, R. Bhosale, M. Shawaqfah, Solar oxidation of toluene over Co doped nano-catalyst, Chemosphere, 255 (2020) 126878. [8] M. Wu Y. Zhang W. Szeto W. Pan H. Huang D.Y.C. Leung Vacuum ultraviolet (VUV)-based photocatalytic oxidation for toluene degradation over pure CeO2 Chem. Eng. Sci. 200 2019 203 213 M. Wu, Y. Zhang, W. Szeto, W. Pan, H. Huang, D.Y.C. Leung, Vacuum ultraviolet (VUV)-based photocatalytic oxidation for toluene degradation over pure CeO2, Chemical Engineering Science, 200 (2019) 203-213. [9] Q. Ren S. Mo R. Peng Z. Feng M. Zhang L. Chen M. Fu J. Wu D. Ye Controllable synthesis of 3D hierarchical Co3O4 nanocatalysts with various morphologies for the catalytic oxidation of toluene J. Mater. Chem. A 6 2018 498 509 Q. Ren, S. Mo, R. Peng, Z. Feng, M. Zhang, L. Chen, M. Fu, J. Wu, D. Ye, Controllable synthesis of 3D hierarchical Co3O4 nanocatalysts with various morphologies for the catalytic oxidation of toluene, Journal of Materials Chemistry A, 6 (2018) 498-509. [10] J. Zhong Y. Zeng D. Chen S. Mo M. Zhang M. Fu J. Wu Z. Su P. Chen D. Ye Toluene oxidation over Co(3+)-rich spinel Co3O4: evaluation of chemical and by-product species identified by in situ DRIFTS combined with PTR-TOF-MS J. Hazard. Mater. 386 2020 121957 J. Zhong, Y. Zeng, D. Chen, S. Mo, M. Zhang, M. Fu, J. Wu, Z. Su, P. Chen, D. Ye, Toluene oxidation over Co(3+)-rich spinel Co3O4: Evaluation of chemical and by-product species identified by in situ DRIFTS combined with PTR-TOF-MS, J Hazard Mater, 386 (2020) 121957. [11] J. Fan Q. Ren S. Mo Y. Sun M. Fu J. Wu L. Chen P. Chen D. Ye Transient in‐situ DRIFTS Investigation of catalytic oxidation of toluene over α‐, γ‐ and β‐ MnOChemCatChem 12 2020 1046 1054 J. Fan, Q. Ren, S. Mo, Y. Sun, M. Fu, J. Wu, L. Chen, P. Chen, D. Ye, Transient in‐situ DRIFTS Investigation of Catalytic Oxidation of Toluene over α‐, γ‐ and β‐MnO ChemCatChem, 12 (2020) 1046-1054. [12] T. García J.M. López Á. Mayoral Y. Zhang R. Arenal D. Alonso-Domínguez M.P. Pico M.L. López A. Dejoz I. Álvarez-Serrano R. Sanchis B. Solsona Green synthesis of cavity-containing manganese oxides with superior catalytic performance in toluene oxidation Appl. Catal. A Gen. 582 2019 T. García, J.M. López, Á. Mayoral, Y. Zhang, R. Arenal, D. Alonso-Domínguez, M.P. Pico, M.L. López, A. Dejoz, I. Álvarez-Serrano, R. Sanchis, B. Solsona, Green synthesis of cavity-containing manganese oxides with superior catalytic performance in toluene oxidation, Applied Catalysis A: General, 582 (2019). [13] A. Lu H. Sun N. Zhang L. Che S. Shan J. Luo J. Zheng L. Yang D.-L. Peng C.-J. Zhong B. Chen Surface partial-charge-Tuned enhancement of catalytic activity of platinum nanocatalysts for toluene oxidation ACS Catal. 9 2019 7431 7442 A. Lu, H. Sun, N. Zhang, L. Che, S. Shan, J. Luo, J. Zheng, L. Yang, D.-L. Peng, C.-J. Zhong, B. Chen, Surface Partial-Charge-Tuned Enhancement of Catalytic Activity of Platinum Nanocatalysts for Toluene Oxidation, ACS Catalysis, 9 (2019) 7431-7442. [14] S. Zhao F. Hu J. Li Hierarchical core–Shell Al2O3@Pd-CoAlO microspheres for low-temperature toluene combustion ACS Catal. 6 2016 3433 3441 S. Zhao, F. Hu, J. Li, Hierarchical Core–Shell Al2O3@Pd-CoAlO Microspheres for Low-Temperature Toluene Combustion, ACS Catalysis, 6 (2016) 3433-3441. [15] X. Chen X. Chen S. Cai J. Chen W. Xu H. Jia J. Chen Catalytic combustion of toluene over mesoporous Cr2O3-supported platinum catalysts prepared by in situ pyrolysis of MOFs Chem. Eng. J. 334 2018 768 779 X. Chen, X. Chen, S. Cai, J. Chen, W. Xu, H. Jia, J. Chen, Catalytic combustion of toluene over mesoporous Cr2O3-supported platinum catalysts prepared by in situ pyrolysis of MOFs, Chemical Engineering Journal, 334 (2018) 768-779. [16] C. Chen F. Chen L. Zhang S. Pan C. Bian X. Zheng X. Meng F.S. Xiao Importance of platinum particle size for complete oxidation of toluene over Pt/ZSM-5 catalysts Chem. Commun. (Camb.) 51 2015 5936 5938 C. Chen, F. Chen, L. Zhang, S. Pan, C. Bian, X. Zheng, X. Meng, F.S. Xiao, Importance of platinum particle size for complete oxidation of toluene over Pt/ZSM-5 catalysts, Chem Commun (Camb), 51 (2015) 5936-5938. [17] R. Peng S. Li X. Sun Q. Ren L. Chen M. Fu J. Wu D. Ye Size effect of Pt nanoparticles on the catalytic oxidation of toluene over Pt/CeO2 catalysts Appl. Catal. B 220 2018 462 470 R. Peng, S. Li, X. Sun, Q. Ren, L. Chen, M. Fu, J. Wu, D. Ye, Size effect of Pt nanoparticles on the catalytic oxidation of toluene over Pt/CeO2 catalysts, Applied Catalysis B: Environmental, 220 (2018) 462-470. [18] Z. Wang P. Ma K. Zheng C. Wang Y. Liu H. Dai C. Wang H.-C. Hsi J. Deng Size effect, mutual inhibition and oxidation mechanism of the catalytic removal of a toluene and acetone mixture over TiO2 nanosheet-supported Pt nanocatalysts Appl. Catal. B 274 2020 118963 Z. Wang, P. Ma, K. Zheng, C. Wang, Y. Liu, H. Dai, C. Wang, H.-C. Hsi, J. Deng, Size effect, mutual inhibition and oxidation mechanism of the catalytic removal of a toluene and acetone mixture over TiO2 nanosheet-supported Pt nanocatalysts, Applied Catalysis B: Environmental, 274 (2020) 118963. [19] M. Comotti W.-C. Li B. Spliethoff F. Schüth Support effect in high activity gold catalysts for CO oxidation J. Am. Chem. Soc. 128 2006 917 924 M. Comotti, W.-C. Li, B. Spliethoff, F. Schüth, Support Effect in High Activity Gold Catalysts for CO Oxidation, Journal of the American Chemical Society, 128 (2006) 917-924. [20] H. Huang D.Y.C. Leung Complete elimination of indoor formaldehyde over supported Pt catalysts with extremely low Pt content at ambient temperature J. Catal. 280 2011 60 67 H. Huang, D.Y.C. Leung, Complete elimination of indoor formaldehyde over supported Pt catalysts with extremely low Pt content at ambient temperature, Journal of Catalysis, 280 (2011) 60-67. [21] M. Wang L. Zhang W. Huang Y. Zhou H. Zhao J. Lv J. Tian X. Kan J. Shi Pt/MnO2nanosheets: facile synthesis and highly efficient catalyst for ethylene oxidation at low temperature RSC Adv. 7 2017 14809 14815 M. Wang, L. Zhang, W. Huang, Y. Zhou, H. Zhao, J. Lv, J. Tian, X. Kan, J. Shi, Pt/MnO2nanosheets: facile synthesis and highly efficient catalyst for ethylene oxidation at low temperature, RSC Advances, 7 (2017) 14809-14815. [22] X. Yu J. He D. Wang Y. Hu H. Tian Z. He Facile controlled synthesis of Pt/MnO2Nanostructured catalysts and their catalytic performance for oxidative decomposition of formaldehyde J. Phys. Chem. C 116 2011 851 860 X. Yu, J. He, D. Wang, Y. Hu, H. Tian, Z. He, Facile Controlled Synthesis of Pt/MnO2Nanostructured Catalysts and Their Catalytic Performance for Oxidative Decomposition of Formaldehyde, The Journal of Physical Chemistry C, 116 (2011) 851-860. [23] W. Pei Y. Liu J. Deng K. Zhang Z. Hou X. Zhao H. Dai Partially embedding Pt nanoparticles in the skeleton of 3DOM Mn2O3: an effective strategy for enhancing catalytic stability in toluene combustion Appl. Catal. B 256 2019 W. Pei, Y. Liu, J. Deng, K. Zhang, Z. Hou, X. Zhao, H. Dai, Partially embedding Pt nanoparticles in the skeleton of 3DOM Mn2O3: An effective strategy for enhancing catalytic stability in toluene combustion, Applied Catalysis B: Environmental, 256 (2019). [24] H. Peng T. Dong L. Zhang C. Wang W. Liu J. Bao X. Wang N. Zhang Z. Wang P. Wu P. Zhang S. Dai Active and stable Pt-Ceria nanowires@silica shell catalyst: design, formation mechanism and total oxidation of CO and toluene Appl. Catal. B: Environ. 256 2019 117807 H. Peng, T. Dong, L. Zhang, C. Wang, W. Liu, J. Bao, X. Wang, N. Zhang, Z. Wang, P. Wu, P. Zhang, S. Dai, Active and stable Pt-Ceria nanowires@silica shell catalyst: Design, formation mechanism and total oxidation of CO and toluene, Applied Catalysis B: Environmental, 256 (2019) 117807. [25] S. Mo Q. Zhang M. Zhang Q. Zhang J. Li M. Fu J. Wu P. Chen D. Ye Elucidating the special role of strong metal–support interactions in Pt/MnO2 catalysts for total toluene oxidation Nanoscale Horiz. 4 2019 1425 1433 S. Mo, Q. Zhang, M. Zhang, Q. Zhang, J. Li, M. Fu, J. Wu, P. Chen, D. Ye, Elucidating the special role of strong metal–support interactions in Pt/MnO2 catalysts for total toluene oxidation, Nanoscale Horizons, 4 (2019) 1425-1433. [26] X. Duan Z. Qu C. Dong Y. Qin Enhancement of toluene oxidation performance over Pt/MnO2@Mn3O4 catalyst with unique interfacial structure Appl. Surf. Sci. 503 2020 X. Duan, Z. Qu, C. Dong, Y. Qin, Enhancement of toluene oxidation performance over Pt/MnO2@Mn3O4 catalyst with unique interfacial structure, Applied Surface Science, 503 (2020). [27] H. Zhang S. Sui X. Zheng R. Cao P. Zhang One-pot synthesis of atomically dispersed Pt on MnO2 for efficient catalytic decomposition of toluene at low temperatures Appl. Catal. B: Environ. 257 2019 H. Zhang, S. Sui, X. Zheng, R. Cao, P. Zhang, One-pot synthesis of atomically dispersed Pt on MnO2 for efficient catalytic decomposition of toluene at low temperatures, Applied Catalysis B: Environmental, 257 (2019). [28] R. Peng X. Sun S. Li L. Chen M. Fu J. Wu D. Ye Shape effect of Pt/CeO 2 catalysts on the catalytic oxidation of toluene Chem. Eng. J. 306 2016 1234 1246 R. Peng, X. Sun, S. Li, L. Chen, M. Fu, J. Wu, D. Ye, Shape effect of Pt/CeO 2 catalysts on the catalytic oxidation of toluene, Chemical Engineering Journal, 306 (2016) 1234-1246. [29] F. Wang C. Li X. Zhang M. Wei D.G. Evans X. Duan Catalytic behavior of supported Ru nanoparticles on the {1 0 0}, {1 1 0}, and {1 1 1} facet of CeO2 J. Catal. 329 2015 177 186 F. Wang, C. Li, X. Zhang, M. Wei, D.G. Evans, X. Duan, Catalytic behavior of supported Ru nanoparticles on the {1 0 0}, {1 1 0}, and {1 1 1} facet of CeO2, Journal of Catalysis, 329 (2015) 177-186. [30] S. Mo Q. Zhang J. Li Y. Sun Q. Ren S. Zou Q. Zhang J. Lu M. Fu D. Mo J. Wu H. Huang D. Ye Highly efficient mesoporous MnO2 catalysts for the total toluene oxidation: oxygen-Vacancy defect engineering and involved intermediates using in situ DRIFTS Appl. Catal. B: Environ. 264 2020 S. Mo, Q. Zhang, J. Li, Y. Sun, Q. Ren, S. Zou, Q. Zhang, J. Lu, M. Fu, D. Mo, J. Wu, H. Huang, D. Ye, Highly efficient mesoporous MnO2 catalysts for the total toluene oxidation: Oxygen-Vacancy defect engineering and involved intermediates using in situ DRIFTS, Applied Catalysis B: Environmental, 264 (2020). [32] C. Dong Z. Qu Y. Qin Q. Fu H. Sun X. Duan Revealing the highly catalytic performance of spinel CoMn2O4 for toluene oxidation: involvement and replenishment of oxygen species using in situ Designed-TP techniques ACS Catal. 9 2019 6698 6710 C. Dong, Z. Qu, Y. Qin, Q. Fu, H. Sun, X. Duan, Revealing the Highly Catalytic Performance of Spinel CoMn2O4 for Toluene Oxidation: Involvement and Replenishment of Oxygen Species Using In Situ Designed-TP Techniques, ACS Catalysis, 9 (2019) 6698-6710. [33] J. Chen X. Chen W. Xu Z. Xu J. Chen H. Jia J. Chen Hydrolysis driving redox reaction to synthesize Mn-Fe binary oxides as highly active catalysts for the removal of toluene Chem. Eng. J. 330 2017 281 293 J. Chen, X. Chen, W. Xu, Z. Xu, J. Chen, H. Jia, J. Chen, Hydrolysis driving redox reaction to synthesize Mn-Fe binary oxides as highly active catalysts for the removal of toluene, Chemical Engineering Journal, 330 (2017) 281-293. [34] L. Zhao Z. Zhang Y. Li X. Leng T. Zhang F. Yuan X. Niu Y. Zhu Synthesis of CeaMnOx hollow microsphere with hierarchical structure and its excellent catalytic performance for toluene combustion Appl. Catal. B: Environ. 245 2019 502 512 L. Zhao, Z. Zhang, Y. Li, X. Leng, T. Zhang, F. Yuan, X. Niu, Y. Zhu, Synthesis of CeaMnOx hollow microsphere with hierarchical structure and its excellent catalytic performance for toluene combustion, Applied Catalysis B: Environmental, 245 (2019) 502-512. [35] Y.-F. Han L. Chen K. Ramesh E. Widjaja S. Chilukoti I. Kesumawinata Surjami J. Chen Kinetic and spectroscopic study of methane combustion over α-Mn2O3 nanocrystal catalysts J. Catal. 253 2008 261 268 Y.-F. Han, L. Chen, K. Ramesh, E. Widjaja, S. Chilukoti, I. Kesumawinata Surjami, J. Chen, Kinetic and spectroscopic study of methane combustion over α-Mn2O3 nanocrystal catalysts, Journal of Catalysis, 253 (2008) 261-268. [36] J. Ji X. Lu C. Chen M. He H. Huang Potassium-modulated δ-MnO2 as robust catalysts for formaldehyde oxidation at room temperature Appl. Catal. B: Environ. 260 2020 118210 J. Ji, X. Lu, C. Chen, M. He, H. Huang, Potassium-modulated δ-MnO2 as robust catalysts for formaldehyde oxidation at room temperature, Applied Catalysis B: Environmental, 260 (2020) 118210. [37] R.A. El-Mallawany Theoretical and experimental IR spectra of binary rare earth tellurite glasses—1 Infrared Phys. 29 1989 781 785 R.A. El-Mallawany, Theoretical and experimental IR spectra of binary rare earth tellurite glasses—1, Infrared Physics, 29 (1989) 781-785. [38] B. Chen B. Wu L. Yu M. Crocker C. Shi Investigation into the catalytic roles of various oxygen species over different crystal phases of MnO2 for C6H6 and HCHO oxidation ACS Catal. 10 2020 6176 6187 B. Chen, B. Wu, L. Yu, M. Crocker, C. Shi, Investigation into the Catalytic Roles of Various Oxygen Species over Different Crystal Phases of MnO2 for C6H6 and HCHO Oxidation, ACS Catalysis, 10 (2020) 6176-6187. [39] W. Yang Za. Su Z. Xu W. Yang Y. Peng J. Li Comparative study of α-, β-, γ- and δ-MnO2 on toluene oxidation: oxygen vacancies and reaction intermediates Appl. Catal. B: Environ. 260 2020 W. Yang, Z.a. Su, Z. Xu, W. Yang, Y. Peng, J. Li, Comparative study of α-, β-, γ- and δ-MnO2 on toluene oxidation: Oxygen vacancies and reaction intermediates, Applied Catalysis B: Environmental, 260 (2020). [40] F. Ji Y. Men J. Wang Y. Sun Z. Wang B. Zhao X. Tao G. Xu Promoting diesel soot combustion efficiency by tailoring the shapes and crystal facets of nanoscale Mn3O4 Appl. Catal. B: Environ. 242 2019 227 237 F. Ji, Y. Men, J. Wang, Y. Sun, Z. Wang, B. Zhao, X. Tao, G. Xu, Promoting diesel soot combustion efficiency by tailoring the shapes and crystal facets of nanoscale Mn3O4, Applied Catalysis B: Environmental, 242 (2019) 227-237. [41] Q. Zhang S. Mo B. Chen W. Zhang C. Huang D. Ye Hierarchical Co 3 O 4 nanostructures in-situ grown on 3D nickel foam towards toluene oxidation Mol. Catal. 454 2018 12 20 Q. Zhang, S. Mo, B. Chen, W. Zhang, C. Huang, D. Ye, Hierarchical Co 3 O 4 nanostructures in-situ grown on 3D nickel foam towards toluene oxidation, Molecular Catalysis, 454 (2018) 12-20. [42] C. Dong H. Wang Y. Ren Z. Qu Effect of alkaline earth metal promoter on catalytic activity of MnO2 for the complete oxidation of toluene J. Environ. Sci. 104 2021 102 112 C. Dong, H. Wang, Y. Ren, Z. Qu, Effect of alkaline earth metal promoter on catalytic activity of MnO2 for the complete oxidation of toluene, Journal of Environmental Sciences, 104 (2021) 102-112. [43] X. Chen J.-J. Li X. Chen S.-C. Cai E.-Q. Yu J. Chen H. Jia MOF-templated approach for hollow NiOx/Co3O4 catalysts: enhanced light-driven thermocatalytic degradation of toluene Acs Appl. Nano Mater. 1 2018 2971 2981 X. Chen, J.-J. Li, X. Chen, S.-C. Cai, E.-Q. Yu, J. Chen, H. Jia, MOF-Templated Approach for Hollow NiOx/Co3O4 Catalysts: Enhanced Light-Driven Thermocatalytic Degradation of Toluene, ACS Applied Nano Materials, 1 (2018) 2971-2981. [44] X. Yang X. Yu M. Jing W. Song J. Liu M. Ge Defective Mn xZr1- xO2 solid solution for the catalytic oxidation of toluene: insights into the oxygen vacancy contribution ACS Appl. Mater. Interfaces 11 2019 730 739 X. Yang, X. Yu, M. Jing, W. Song, J. Liu, M. Ge, Defective Mn xZr1- xO2 Solid Solution for the Catalytic Oxidation of Toluene: Insights into the Oxygen Vacancy Contribution, ACS Appl Mater Interfaces, 11 (2019) 730-739. [45] J. Deng H. Dai H. Jiang L. Zhang G. Wang H. He C.T. Au Hydrothermal fabrication and catalytic properties of La1-xSrxM1-yFeyO3 (M = Mn, Co) that are highly active for the removal of toluene Environ. Sci. Technol. 44 2010 2618 2623 J. Deng, H. Dai, H. Jiang, L. Zhang, G. Wang, H. He, C.T. Au, Hydrothermal Fabrication and Catalytic Properties of La1-xSrxM1-yFeyO3 (M = Mn, Co) That Are Highly Active for the Removal of Toluene, Environmental Science & Technology, 44 (2010) 2618-2623. [46] Y. Luo Y. Zheng J. Zuo X. Feng X. Wang T. Zhang K. Zhang L. Jiang Insights into the high performance of Mn-Co oxides derived from metal-organic frameworks for total toluene oxidation J. Hazard. Mater. 349 2018 119 127 Y. Luo, Y. Zheng, J. Zuo, X. Feng, X. Wang, T. Zhang, K. Zhang, L. Jiang, Insights into the high performance of Mn-Co oxides derived from metal-organic frameworks for total toluene oxidation, J Hazard Mater, 349 (2018) 119-127. [47] C. Wang J. Ma F. Liu H. He R. Zhang The effects of Mn2+ precursors on the structure and ozone decomposition activity of cryptomelane-type manganese oxide (OMS-2) catalysts J. Phys. Chem. C 119 2015 23119 23126 C. Wang, J. Ma, F. Liu, H. He, R. Zhang, The Effects of Mn2+ Precursors on the Structure and Ozone Decomposition Activity of Cryptomelane-Type Manganese Oxide (OMS-2) Catalysts, The Journal of Physical Chemistry C, 119 (2015) 23119-23126. [48] G. Zhu J. Zhu W. Jiang Z. Zhang J. Wang Y. Zhu Q. Zhang Surface oxygen vacancy induced α-MnO 2 nanofiber for highly efficient ozone elimination Appl. Catal. B: Environ. 209 2017 729 737 G. Zhu, J. Zhu, W. Jiang, Z. Zhang, J. Wang, Y. Zhu, Q. Zhang, Surface oxygen vacancy induced α-MnO 2 nanofiber for highly efficient ozone elimination, Applied Catalysis B: Environmental, 209 (2017) 729-737. [49] Y. Dong J. Zhao J.-Y. Zhang Y. Chen X. Yang W. Song L. Wei W. Li Synergy of Mn and Ni enhanced catalytic performance for toluene combustion over Ni-doped α-MnO2 catalysts Chem. Eng. J. 388 2020 Y. Dong, J. Zhao, J.-Y. Zhang, Y. Chen, X. Yang, W. Song, L. Wei, W. Li, Synergy of Mn and Ni enhanced catalytic performance for toluene combustion over Ni-doped α-MnO2 catalysts, Chemical Engineering Journal, 388 (2020). [50] X. Li J. Ma L. Yang G. He C. Zhang R. Zhang H. He Oxygen vacancies induced by transition metal doping in gamma-MnO2 for highly efficient ozone decomposition Environ. Sci. Technol. 52 2018 12685 12696 X. Li, J. Ma, L. Yang, G. He, C. Zhang, R. Zhang, H. He, Oxygen Vacancies Induced by Transition Metal Doping in gamma-MnO2 for Highly Efficient Ozone Decomposition, Environ Sci Technol, 52 (2018) 12685-12696. [51] Y. Yang S. Zhang S. Wang K. Zhang H. Wang J. Huang S. Deng B. Wang Y. Wang G. Yu Ball milling synthesized MnOx as highly active catalyst for gaseous POPs removal: significance of mechanochemically induced oxygen vacancies Environ. Sci. Technol. 49 2015 4473 4480 Y. Yang, S. Zhang, S. Wang, K. Zhang, H. Wang, J. Huang, S. Deng, B. Wang, Y. Wang, G. Yu, Ball milling synthesized MnOx as highly active catalyst for gaseous POPs removal: significance of mechanochemically induced oxygen vacancies, Environ Sci Technol, 49 (2015) 4473-4480. [52] J. Wan L. Zhou H. Deng F. Zhan R. Zhang Oxidative degradation of sulfamethoxazole by different MnO2 nanocrystals in aqueous solution J. Mol. Catal. A Chem. 407 2015 67 74 J. Wan, L. Zhou, H. Deng, F. Zhan, R. Zhang, Oxidative degradation of sulfamethoxazole by different MnO2 nanocrystals in aqueous solution, Journal of Molecular Catalysis A: Chemical, 407 (2015) 67-74. [53] T. Chang Z. Shen Y. Huang J. Lu D. Ren J. Sun J. Cao H. Liu Post-plasma-catalytic removal of toluene using MnO2–Co3O4 catalysts and their synergistic mechanism Chem. Eng. J. 348 2018 15 25 T. Chang, Z. Shen, Y. Huang, J. Lu, D. Ren, J. Sun, J. Cao, H. Liu, Post-plasma-catalytic removal of toluene using MnO2–Co3O4 catalysts and their synergistic mechanism, Chemical Engineering Journal, 348 (2018) 15-25. [54] S.K. Meher M. Cargnello H. Troiani T. Montini G.R. Rao P. Fornasiero Alcohol induced ultra-fine dispersion of Pt on tuned morphologies of CeO2 for CO oxidation Appl. Catal. B: Environ. 130-131 2013 121 131 S.K. Meher, M. Cargnello, H. Troiani, T. Montini, G.R. Rao, P. Fornasiero, Alcohol induced ultra-fine dispersion of Pt on tuned morphologies of CeO2 for CO oxidation, Applied Catalysis B: Environmental, 130-131 (2013) 121-131. [55] N. Ta J. Liu S. Chenna P.A. Crozier Y. Li A. Chen W. Shen Stabilized gold nanoparticles on Ceria nanorods by strong interfacial anchoring J. Am. Chem. Soc. 134 2012 20585 20588 N. Ta, J. Liu, S. Chenna, P.A. Crozier, Y. Li, A. Chen, W. Shen, Stabilized Gold Nanoparticles on Ceria Nanorods by Strong Interfacial Anchoring, Journal of the American Chemical Society, 134 (2012) 20585-20588. [56] H.Y. Kim H.M. Lee G. Henkelman CO oxidation mechanism on CeO2-Supported Au nanoparticles J. Am. Chem. Soc. 134 2012 1560 1570 H.Y. Kim, H.M. Lee, G. Henkelman, CO Oxidation Mechanism on CeO2-Supported Au Nanoparticles, Journal of the American Chemical Society, 134 (2012) 1560-1570. [57] C. Dong H. Wang Y. Ren Z. Qu Layer MnO2 with oxygen vacancy for improved toluene oxidation activity Surf. Interfaces 22 2021 100897 C. Dong, H. Wang, Y. Ren, Z. Qu, Layer MnO2 with oxygen vacancy for improved toluene oxidation activity, Surfaces and Interfaces, 22 (2021) 100897. [58] L.F. Liotta Catalytic oxidation of volatile organic compounds on supported noble metals Appl. Catal. B: Environ. 100 2010 403 412 L.F. Liotta, Catalytic oxidation of volatile organic compounds on supported noble metals, Applied Catalysis B: Environmental, 100 (2010) 403-412. [59] Y. Wang H. Arandiyan Y. Liu Y. Liang Y. Peng S. Bartlett H. Dai S. Rostamnia J. Li Template-free scalable synthesis of flower-like Co3-xMnxO4 spinel catalysts for toluene oxidation ChemCatChem 10 2018 3429 3434 Y. Wang, H. Arandiyan, Y. Liu, Y. Liang, Y. Peng, S. Bartlett, H. Dai, S. Rostamnia, J. Li, Template-free Scalable Synthesis of Flower-like Co3-xMnxO4 Spinel Catalysts for Toluene Oxidation, ChemCatChem, 10 (2018) 3429-3434. [60] J. Gao X. Tong X. Li H. Miao J. Xu The efficient liquid-phase oxidation of aromatic hydrocarbons by molecular oxygen in the presence of MnCO3 J. Chem. Technol. Biotechnol. 82 2007 620 625 J. Gao, X. Tong, X. Li, H. Miao, J. Xu, The efficient liquid-phase oxidation of aromatic hydrocarbons by molecular oxygen in the presence of MnCO3, Journal of Chemical Technology & Biotechnology, 82 (2007) 620-625. [61] L. Ma C.Y. Seo X. Chen K. Sun J.W. Schwank Indium-doped Co 3 O 4 nanorods for catalytic oxidation of CO and C 3 H 6 towards diesel exhaust Appl. Catal. B: Environ. 222 2018 44 58 L. Ma, C.Y. Seo, X. Chen, K. Sun, J.W. Schwank, Indium-doped Co 3 O 4 nanorods for catalytic oxidation of CO and C 3 H 6 towards diesel exhaust, Applied Catalysis B: Environmental, 222 (2018) 44-58.",
      "scopus-id": "85104088414",
      "coredata": {
        "eid": "1-s2.0-S2468823121001863",
        "dc:description": "With the aim to elucidate the roles of different oxygen species, the catalytic oxidation of toluene over Pt/Mn3O4 synthesized by a facile reduction method was investigated. Compared with the Pt/Mn3O4-C using the commercial Mn3O4 as the support, Pt/Mn3O4-R was found to possess more surface oxygen vacancies, exhibit better redox properties and dispersion of platinum particles, leading to its higher activity for toluene oxidation (T90 = 183 ℃). Through toluene-TPD, toluene-TPSR and in-situ DRIFTS, it was found that toluene oxidation over Pt/Mn3O4-R catalyst might follow the Mars–van Krevelen (MVK) mechanism and the pathway of toluene oxidation over Pt/Mn3O4-R was possible toluene → benzoate → carbonate → CO2. The lattice oxygen species on the surface of catalysts was directly involved in the oxidation of toluene and played an important role in the formation of key intermediate such as carbonate, resulting in the difference of the reaction mechanism and pathway between Pt/Mn3O4-R and Pt/Mn3O4-C. In addition, the degradation of the surface carbonate was demonstrated to be the rate-controlling step at 180℃ to 200℃.",
        "openArchiveArticle": "false",
        "prism:coverDate": "2021-05-31",
        "openaccessUserLicense": null,
        "prism:aggregationType": "Journal",
        "prism:url": "https://api.elsevier.com/content/article/pii/S2468823121001863",
        "dc:creator": [
          {
            "@_fa": "true",
            "$": "Sun, Yuhang"
          },
          {
            "@_fa": "true",
            "$": "Fan, Jie"
          },
          {
            "@_fa": "true",
            "$": "Cheng, Hairong"
          },
          {
            "@_fa": "true",
            "$": "Mo, Shengpeng"
          },
          {
            "@_fa": "true",
            "$": "Ke, Yunting"
          },
          {
            "@_fa": "true",
            "$": "Ren, Quanming"
          },
          {
            "@_fa": "true",
            "$": "Fu, Mingli"
          },
          {
            "@_fa": "true",
            "$": "Chen, Peirong"
          },
          {
            "@_fa": "true",
            "$": "Wu, Junliang"
          },
          {
            "@_fa": "true",
            "$": "Ye, Daiqi"
          }
        ],
        "link": [
          {
            "@_fa": "true",
            "@rel": "self",
            "@href": "https://api.elsevier.com/content/article/pii/S2468823121001863"
          },
          {
            "@_fa": "true",
            "@rel": "scidir",
            "@href": "https://www.sciencedirect.com/science/article/pii/S2468823121001863"
          }
        ],
        "dc:format": "application/json",
        "openaccessType": null,
        "pii": "S2468-8231(21)00186-3",
        "prism:volume": "507",
        "articleNumber": "111569",
        "prism:publisher": "Elsevier B.V.",
        "dc:title": "Investigation into the roles of different oxygen species in toluene oxidation over manganese-supported platinum catalysts",
        "prism:copyright": "© 2021 Elsevier B.V. All rights reserved.",
        "openaccess": "0",
        "prism:issn": "24688231",
        "dcterms:subject": [
          {
            "@_fa": "true",
            "$": "Toluene"
          },
          {
            "@_fa": "true",
            "$": "Catalytic oxidation"
          },
          {
            "@_fa": "true",
            "$": "In-situ DRIFTS"
          },
          {
            "@_fa": "true",
            "$": "Toluene-TPSR"
          },
          {
            "@_fa": "true",
            "$": "Surface lattice oxygen"
          }
        ],
        "openaccessArticle": "false",
        "prism:publicationName": "Molecular Catalysis",
        "openaccessSponsorType": null,
        "prism:pageRange": "111569",
        "pubType": "fla",
        "prism:coverDisplayDate": "May 2021",
        "prism:doi": "10.1016/j.mcat.2021.111569",
        "prism:startingPage": "111569",
        "dc:identifier": "doi:10.1016/j.mcat.2021.111569",
        "openaccessSponsorName": null
      },
      "objects": {
        "object": [
          {
            "@category": "standard",
            "@height": "883",
            "@width": "679",
            "@_fa": "true",
            "$": "https://api.elsevier.com/content/object/eid/1-s2.0-S2468823121001863-gr2.jpg?httpAccept=%2A%2F%2A",
            "@multimediatype": "JPEG image file",
            "@type": "IMAGE-DOWNSAMPLED",
            "@size": "206128",
            "@ref": "gr2",
            "@mimetype": "image/jpeg"
          },
          {
            "@category": "standard",
            "@height": "200",
            "@width": "291",
            "@_fa": "true",
            "$": "https://api.elsevier.com/content/object/eid/1-s2.0-S2468823121001863-ga1.jpg?httpAccept=%2A%2F%2A",
            "@multimediatype": "JPEG image file",
            "@type": "IMAGE-DOWNSAMPLED",
            "@size": "19068",
            "@ref": "ga1",
            "@mimetype": "image/jpeg"
          },
          {
            "@category": "standard",
            "@height": "521",
            "@width": "679",
            "@_fa": "true",
            "$": "https://api.elsevier.com/content/object/eid/1-s2.0-S2468823121001863-gr1.jpg?httpAccept=%2A%2F%2A",
            "@multimediatype": "JPEG image file",
            "@type": "IMAGE-DOWNSAMPLED",
            "@size": "83878",
            "@ref": "gr1",
            "@mimetype": "image/jpeg"
          },
          {
            "@category": "standard",
            "@height": "824",
            "@width": "717",
            "@_fa": "true",
            "$": "https://api.elsevier.com/content/object/eid/1-s2.0-S2468823121001863-gr9.jpg?httpAccept=%2A%2F%2A",
            "@multimediatype": "JPEG image file",
            "@type": "IMAGE-DOWNSAMPLED",
            "@size": "158817",
            "@ref": "gr9",
            "@mimetype": "image/jpeg"
          },
          {
            "@category": "standard",
            "@height": "557",
            "@width": "340",
            "@_fa": "true",
            "$": "https://api.elsevier.com/content/object/eid/1-s2.0-S2468823121001863-gr8.jpg?httpAccept=%2A%2F%2A",
            "@multimediatype": "JPEG image file",
            "@type": "IMAGE-DOWNSAMPLED",
            "@size": "40414",
            "@ref": "gr8",
            "@mimetype": "image/jpeg"
          },
          {
            "@category": "standard",
            "@height": "551",
            "@width": "717",
            "@_fa": "true",
            "$": "https://api.elsevier.com/content/object/eid/1-s2.0-S2468823121001863-gr10.jpg?httpAccept=%2A%2F%2A",
            "@multimediatype": "JPEG image file",
            "@type": "IMAGE-DOWNSAMPLED",
            "@size": "89373",
            "@ref": "gr10",
            "@mimetype": "image/jpeg"
          },
          {
            "@category": "standard",
            "@height": "511",
            "@width": "679",
            "@_fa": "true",
            "$": "https://api.elsevier.com/content/object/eid/1-s2.0-S2468823121001863-gr7.jpg?httpAccept=%2A%2F%2A",
            "@multimediatype": "JPEG image file",
            "@type": "IMAGE-DOWNSAMPLED",
            "@size": "75110",
            "@ref": "gr7",
            "@mimetype": "image/jpeg"
          },
          {
            "@category": "standard",
            "@height": "451",
            "@width": "566",
            "@_fa": "true",
            "$": "https://api.elsevier.com/content/object/eid/1-s2.0-S2468823121001863-gr6.jpg?httpAccept=%2A%2F%2A",
            "@multimediatype": "JPEG image file",
            "@type": "IMAGE-DOWNSAMPLED",
            "@size": "49291",
            "@ref": "gr6",
            "@mimetype": "image/jpeg"
          },
          {
            "@category": "standard",
            "@height": "269",
            "@width": "340",
            "@_fa": "true",
            "$": "https://api.elsevier.com/content/object/eid/1-s2.0-S2468823121001863-gr5.jpg?httpAccept=%2A%2F%2A",
            "@multimediatype": "JPEG image file",
            "@type": "IMAGE-DOWNSAMPLED",
            "@size": "23242",
            "@ref": "gr5",
            "@mimetype": "image/jpeg"
          },
          {
            "@category": "standard",
            "@height": "268",
            "@width": "340",
            "@_fa": "true",
            "$": "https://api.elsevier.com/content/object/eid/1-s2.0-S2468823121001863-gr4.jpg?httpAccept=%2A%2F%2A",
            "@multimediatype": "JPEG image file",
            "@type": "IMAGE-DOWNSAMPLED",
            "@size": "22651",
            "@ref": "gr4",
            "@mimetype": "image/jpeg"
          },
          {
            "@category": "standard",
            "@height": "264",
            "@width": "340",
            "@_fa": "true",
            "$": "https://api.elsevier.com/content/object/eid/1-s2.0-S2468823121001863-gr3.jpg?httpAccept=%2A%2F%2A",
            "@multimediatype": "JPEG image file",
            "@type": "IMAGE-DOWNSAMPLED",
            "@size": "17635",
            "@ref": "gr3",
            "@mimetype": "image/jpeg"
          },
          {
            "@category": "thumbnail",
            "@height": "164",
            "@width": "126",
            "@_fa": "true",
            "$": "https://api.elsevier.com/content/object/eid/1-s2.0-S2468823121001863-gr2.sml?httpAccept=%2A%2F%2A",
            "@multimediatype": "GIF image file",
            "@type": "IMAGE-THUMBNAIL",
            "@size": "11329",
            "@ref": "gr2",
            "@mimetype": "image/gif"
          },
          {
            "@category": "thumbnail",
            "@height": "151",
            "@width": "219",
            "@_fa": "true",
            "$": "https://api.elsevier.com/content/object/eid/1-s2.0-S2468823121001863-ga1.sml?httpAccept=%2A%2F%2A",
            "@multimediatype": "GIF image file",
            "@type": "IMAGE-THUMBNAIL",
            "@size": "14543",
            "@ref": "ga1",
            "@mimetype": "image/gif"
          },
          {
            "@category": "thumbnail",
            "@height": "164",
            "@width": "214",
            "@_fa": "true",
            "$": "https://api.elsevier.com/content/object/eid/1-s2.0-S2468823121001863-gr1.sml?httpAccept=%2A%2F%2A",
            "@multimediatype": "GIF image file",
            "@type": "IMAGE-THUMBNAIL",
            "@size": "11224",
            "@ref": "gr1",
            "@mimetype": "image/gif"
          },
          {
            "@category": "thumbnail",
            "@height": "163",
            "@width": "142",
            "@_fa": "true",
            "$": "https://api.elsevier.com/content/object/eid/1-s2.0-S2468823121001863-gr9.sml?httpAccept=%2A%2F%2A",
            "@multimediatype": "GIF image file",
            "@type": "IMAGE-THUMBNAIL",
            "@size": "11858",
            "@ref": "gr9",
            "@mimetype": "image/gif"
          },
          {
            "@category": "thumbnail",
            "@height": "164",
            "@width": "100",
            "@_fa": "true",
            "$": "https://api.elsevier.com/content/object/eid/1-s2.0-S2468823121001863-gr8.sml?httpAccept=%2A%2F%2A",
            "@multimediatype": "GIF image file",
            "@type": "IMAGE-THUMBNAIL",
            "@size": "4980",
            "@ref": "gr8",
            "@mimetype": "image/gif"
          },
          {
            "@category": "thumbnail",
            "@height": "164",
            "@width": "213",
            "@_fa": "true",
            "$": "https://api.elsevier.com/content/object/eid/1-s2.0-S2468823121001863-gr10.sml?httpAccept=%2A%2F%2A",
            "@multimediatype": "GIF image file",
            "@type": "IMAGE-THUMBNAIL",
            "@size": "12399",
            "@ref": "gr10",
            "@mimetype": "image/gif"
          },
          {
            "@category": "thumbnail",
            "@height": "164",
            "@width": "218",
            "@_fa": "true",
            "$": "https://api.elsevier.com/content/object/eid/1-s2.0-S2468823121001863-gr7.sml?httpAccept=%2A%2F%2A",
            "@multimediatype": "GIF image file",
            "@type": "IMAGE-THUMBNAIL",
            "@size": "10372",
            "@ref": "gr7",
            "@mimetype": "image/gif"
          },
          {
            "@category": "thumbnail",
            "@height": "164",
            "@width": "206",
            "@_fa": "true",
            "$": "https://api.elsevier.com/content/object/eid/1-s2.0-S2468823121001863-gr6.sml?httpAccept=%2A%2F%2A",
            "@multimediatype": "GIF image file",
            "@type": "IMAGE-THUMBNAIL",
            "@size": "11012",
            "@ref": "gr6",
            "@mimetype": "image/gif"
          },
          {
            "@category": "thumbnail",
            "@height": "164",
            "@width": "207",
            "@_fa": "true",
            "$": "https://api.elsevier.com/content/object/eid/1-s2.0-S2468823121001863-gr5.sml?httpAccept=%2A%2F%2A",
            "@multimediatype": "GIF image file",
            "@type": "IMAGE-THUMBNAIL",
            "@size": "11775",
            "@ref": "gr5",
            "@mimetype": "image/gif"
          },
          {
            "@category": "thumbnail",
            "@height": "164",
            "@width": "208",
            "@_fa": "true",
            "$": "https://api.elsevier.com/content/object/eid/1-s2.0-S2468823121001863-gr4.sml?httpAccept=%2A%2F%2A",
            "@multimediatype": "GIF image file",
            "@type": "IMAGE-THUMBNAIL",
            "@size": "9832",
            "@ref": "gr4",
            "@mimetype": "image/gif"
          },
          {
            "@category": "thumbnail",
            "@height": "164",
            "@width": "211",
            "@_fa": "true",
            "$": "https://api.elsevier.com/content/object/eid/1-s2.0-S2468823121001863-gr3.sml?httpAccept=%2A%2F%2A",
            "@multimediatype": "GIF image file",
            "@type": "IMAGE-THUMBNAIL",
            "@size": "7241",
            "@ref": "gr3",
            "@mimetype": "image/gif"
          },
          {
            "@category": "standard",
            "@_fa": "true",
            "$": "https://api.elsevier.com/content/object/eid/1-s2.0-S2468823121001863-mmc1.docx?httpAccept=%2A%2F%2A",
            "@multimediatype": "Microsoft Word file",
            "@type": "APPLICATION",
            "@size": "367489",
            "@ref": "mmc1",
            "@mimetype": "application/word"
          },
          {
            "@category": "thumbnail",
            "@_fa": "true",
            "$": "https://api.elsevier.com/content/object/eid/1-s2.0-S2468823121001863-si1.svg?httpAccept=%2A%2F%2A",
            "@multimediatype": "Scalable Vector Graphics file",
            "@type": "ALTIMG",
            "@size": "15335",
            "@ref": "si1",
            "@mimetype": "image/svg+xml"
          },
          {
            "@category": "thumbnail",
            "@_fa": "true",
            "$": "https://api.elsevier.com/content/object/eid/1-s2.0-S2468823121001863-si2.svg?httpAccept=%2A%2F%2A",
            "@multimediatype": "Scalable Vector Graphics file",
            "@type": "ALTIMG",
            "@size": "28659",
            "@ref": "si2",
            "@mimetype": "image/svg+xml"
          },
          {
            "@category": "thumbnail",
            "@_fa": "true",
            "$": "https://api.elsevier.com/content/object/eid/1-s2.0-S2468823121001863-si3.svg?httpAccept=%2A%2F%2A",
            "@multimediatype": "Scalable Vector Graphics file",
            "@type": "ALTIMG",
            "@size": "44939",
            "@ref": "si3",
            "@mimetype": "image/svg+xml"
          },
          {
            "@category": "thumbnail",
            "@_fa": "true",
            "$": "https://api.elsevier.com/content/object/eid/1-s2.0-S2468823121001863-si4.svg?httpAccept=%2A%2F%2A",
            "@multimediatype": "Scalable Vector Graphics file",
            "@type": "ALTIMG",
            "@size": "34172",
            "@ref": "si4",
            "@mimetype": "image/svg+xml"
          },
          {
            "@category": "thumbnail",
            "@_fa": "true",
            "$": "https://api.elsevier.com/content/object/eid/1-s2.0-S2468823121001863-si5.svg?httpAccept=%2A%2F%2A",
            "@multimediatype": "Scalable Vector Graphics file",
            "@type": "ALTIMG",
            "@size": "37564",
            "@ref": "si5",
            "@mimetype": "image/svg+xml"
          },
          {
            "@category": "thumbnail",
            "@_fa": "true",
            "$": "https://api.elsevier.com/content/object/eid/1-s2.0-S2468823121001863-si6.svg?httpAccept=%2A%2F%2A",
            "@multimediatype": "Scalable Vector Graphics file",
            "@type": "ALTIMG",
            "@size": "7557",
            "@ref": "si6",
            "@mimetype": "image/svg+xml"
          },
          {
            "@category": "standard",
            "@_fa": "true",
            "$": "https://api.elsevier.com/content/object/eid/1-s2.0-S2468823121001863-am.pdf?httpAccept=%2A%2F%2A",
            "@multimediatype": "Acrobat PDF file",
            "@type": "AAM-PDF",
            "@size": "1941121",
            "@ref": "am",
            "@mimetype": "application/pdf"
          }
        ]
      },
      "link": {
        "@rel": "abstract",
        "@href": "https://api.elsevier.com/content/abstract/scopus_id/85104088414"
      }
    }
  }
}