{
  "metadata": {
    "title": "Higher alcohol synthesis from syngas over xerogel-derived Co-Cu-Al<ce:inf loc=post>2</ce:inf>O<ce:inf loc=post>3</ce:inf> catalyst with an enhanced metal proximity",
    "authors": "; ; ",
    "journal": "Molecular Catalysis",
    "date": "2019-10-31",
    "doi": "10.1016/j.mcat.2019.110481",
    "abstract": "",
    "uri": "https://api.elsevier.com/content/article/pii/S2468823119303165",
    "pii": "S2468823119303165"
  },
  "fulltext": {
    "full-text-retrieval-response": {
      "scopus-eid": "2-s2.0-85068171920",
      "originalText": "serial JL 315758 291210 291744 291790 291809 31 Molecular Catalysis MOLECULARCATALYSIS 2019-07-02 2019-07-02 2019-07-02 2019-07-02 2019-08-06T07:55:47 1-s2.0-S2468823119303165 S2468-8231(19)30316-5 S2468823119303165 10.1016/j.mcat.2019.110481 S300 S300.1 FULL-TEXT 1-s2.0-S2468823119X00115 2020-07-20T16:28:26.386574Z 0 0 20191001 20191031 2019 2019-07-02T20:37:15.512076Z absattachment articleinfo articlenumber articletitlenorm authfirstinitialnorm authfirstsurnamenorm cid cids contenttype copyright crossmark dateloaded dateloadedtxt datesearch datesort dateupdated dco docsubtype doctype doi eid ewtransactionid hubeid indexeddate issn issnnorm itemstage itemtransactionid itemweight openaccess openarchive pg pgfirst pii piinorm pubdateend pubdatestart pubdatetxt pubyr sectiontitle sortorder srctitle srctitlenorm srctype ssids alllist content subj subheadings suppl tomb volfirst volissue volumelist webpdf webpdfpagecount yearnav figure table e-component body mmlmath acknowledge affil appendices articletitle auth authfirstini authfull authkeywords authlast grantnumber grantsponsor highlightsabst orcid primabst ref specialabst 2468-8231 24688231 true 475 475 C Volume 475 27 110481 110481 110481 201910 October 2019 2019-10-01 2019-10-31 2019 Regular Papers article fla © 2019 Elsevier B.V. All rights reserved. HIGHERALCOHOLSYNTHESISSYNGASOVERXEROGELDERIVEDCOCUAL2O3CATALYSTENHANCEDMETALPROXIMITY HAN S 1 Introduction 2 Experimental 2.1 Preparation of mesoporous Co-Cu-Al2O3 catalysts 2.2 Characterization 2.3 Higher alcohol synthesis from syngas 2.4 Computational details 3 Results and discussion 3.1 Textural properties of catalysts 3.2 Crystalline structure and reducibility of calcined catalysts 3.3 STEM-EDX mapping images of calcined catalysts 3.4 XPS and XAS study of calcined catalysts 3.5 XRD and CO-TPD measurements of reduced catalysts 3.6 STEM-EDX mapping images of reduced catalysts 3.7 Higher alcohol synthesis from syngas 3.8 Computational study 4 Conclusion Acknowledgements Appendix A Supplementary data References GUPTA 2011 641 656 M SUN 2016 5771 5785 J LUK 2017 1358 1426 H YORK 2003 345 358 A WILHELM 2001 139 148 D YU 2013 344 349 J FAN 2009 86 93 Z WU 2013 162 168 Q SHOU 2013 91 99 H XU 2004 51 58 R WANG 2013 190 196 F FORZATTI 1991 109 168 P GAO 2013 1324 1332 W DING 2013 21 27 M ISHIDA 2013 145 154 T XIAO 2013 319 325 K SU 2016 94 106 J XIAODING 1987 125 170 X XIAO 2013 116 129 K NING 2016 236 247 X PRIETO 2014 6397 6401 G XU 2015 216 227 X ZABIHI 2015 5107 5122 M SUBRAMANIAN 2009 100 106 N LIU 2014 10 18 G NIU 2014 72 83 Z KHODAKOV 2003 273 288 A SHI 2011 48 52 L WANG 2016 77 85 L CAO 2016 5216 5231 A TIENTHAO 2007 348 357 N TIENTHAO 2006 204 212 N ZHAO 2016 17414 17424 L RAVEL 2005 537 541 B TAVAKOLI 2008 358 363 A KRESSE 1994 14251 14269 G KRESSE 1996 15 50 G HAMMER 1999 7413 7421 B DION 2004 22 25 M KLIME 2011 1 13 J ROMANPEREZ 2009 1 4 G LEE 2010 3 6 K CRAMER 2004 C ESSENTIALSCOMPUTATIONALCHEMISTRYTHEORIESMODELS PETERSON 2010 1311 1315 A STUDT 2015 1105 1111 F CHRISTENSEN 2015 4946 4949 R LEOFANTI 1998 207 219 G CELERIER 2006 615 618 S HENCH 1990 33 72 L CUI 2005 175 181 H VANSTEEN 1996 220 229 E WANG 2015 75 81 Z FAYAZ 2016 646 653 F CAO 2015 58801 58812 A CHEN 2015 1787 1793 L LUO 2005 243 248 M LEE 2014 128 133 J ZHOU 2015 4485 4491 M SA 2013 9992 10001 Y ROSEN 2014 2 9 J WANG 2012 51 61 J ZHAO 2018 14957 14966 L OEZASLAN 2011 2159 2165 M XIANG 2016 895 906 Y HU 2007 90 95 J MAHDAVI 2005 259 265 V YAN 2009 196 200 Z HUANG 2003 81 99 X JACOBS 2002 215 226 G NIE 2017 13164 13174 X HANX2019X110481 HANX2019X110481XS 2021-07-02T00:00:00.000Z 2021-07-02T00:00:00.000Z http://creativecommons.org/licenses/by-nc-nd/4.0/ © 2019 Elsevier B.V. All rights reserved. 2019-06-21T05:24:57.591Z http://vtw.elsevier.com/data/voc/AddOnTypes/50.7/eoas MOE Ministry of Environment http://data.elsevier.com/vocabulary/SciValFunders/501100003562 http://sws.geonames.org/1835841 KRICT Korea Research Institute of Chemical Technology http://data.elsevier.com/vocabulary/SciValFunders/501100003704 http://sws.geonames.org/1835841 item S2468-8231(19)30316-5 S2468823119303165 1-s2.0-S2468823119303165 10.1016/j.mcat.2019.110481 315758 2020-07-20T16:28:26.386574Z 2019-10-01 2019-10-31 1-s2.0-S2468823119303165-main.pdf https://s3.amazonaws.com/prod-ucs-content-store-us-east/content/pii:S2468823119303165/MAIN/application/pdf/95e1f1a199db607bc2523d0b4756a74c/main.pdf main.pdf pdf true 8046751 MAIN 12 1-s2.0-S2468823119303165-main_1.png https://s3.amazonaws.com/prod-ucs-content-store-us-east/content/pii:S2468823119303165/PREVIEW/image/png/e145c9d97ec1134086a9f36640ae6f55/main_1.png main_1.png png 55454 849 656 IMAGE-WEB-PDF 1 1-s2.0-S2468823119303165-ga1.sml https://s3.amazonaws.com/prod-ucs-content-store-us-east/content/pii:S2468823119303165/ga1/THUMBNAIL/image/gif/124fabd87da38e6c5323cf4a579ed2b2/ga1.sml ga1 true ga1.sml sml 10741 75 219 IMAGE-THUMBNAIL 1-s2.0-S2468823119303165-gr1.sml https://s3.amazonaws.com/prod-ucs-content-store-us-east/content/pii:S2468823119303165/gr1/THUMBNAIL/image/gif/1ca8c065c8cf087cbab263ceeaa67efd/gr1.sml gr1 gr1.sml sml 6695 97 219 IMAGE-THUMBNAIL 1-s2.0-S2468823119303165-gr10.sml https://s3.amazonaws.com/prod-ucs-content-store-us-east/content/pii:S2468823119303165/gr10/THUMBNAIL/image/gif/24a0eb781abacbfa76802abae9baf3c8/gr10.sml gr10 gr10.sml sml 7750 146 219 IMAGE-THUMBNAIL 1-s2.0-S2468823119303165-gr11.sml https://s3.amazonaws.com/prod-ucs-content-store-us-east/content/pii:S2468823119303165/gr11/THUMBNAIL/image/gif/f43ad00fbf2059a52f47b4eb4accddda/gr11.sml gr11 gr11.sml sml 8916 156 219 IMAGE-THUMBNAIL 1-s2.0-S2468823119303165-gr12.sml https://s3.amazonaws.com/prod-ucs-content-store-us-east/content/pii:S2468823119303165/gr12/THUMBNAIL/image/gif/9c6deb33c18594c3170afbd2328f835c/gr12.sml gr12 gr12.sml sml 5614 92 219 IMAGE-THUMBNAIL 1-s2.0-S2468823119303165-gr2.sml https://s3.amazonaws.com/prod-ucs-content-store-us-east/content/pii:S2468823119303165/gr2/THUMBNAIL/image/gif/b89bd467650ec900300fce117dbed435/gr2.sml gr2 gr2.sml sml 7551 93 219 IMAGE-THUMBNAIL 1-s2.0-S2468823119303165-gr3.sml https://s3.amazonaws.com/prod-ucs-content-store-us-east/content/pii:S2468823119303165/gr3/THUMBNAIL/image/gif/6a030e22372a131ec142e0ab2be80132/gr3.sml gr3 gr3.sml sml 13967 107 219 IMAGE-THUMBNAIL 1-s2.0-S2468823119303165-gr4.sml https://s3.amazonaws.com/prod-ucs-content-store-us-east/content/pii:S2468823119303165/gr4/THUMBNAIL/image/gif/520791765f60890a972de99fef160568/gr4.sml gr4 gr4.sml sml 7895 116 219 IMAGE-THUMBNAIL 1-s2.0-S2468823119303165-gr5.sml https://s3.amazonaws.com/prod-ucs-content-store-us-east/content/pii:S2468823119303165/gr5/THUMBNAIL/image/gif/0788997ded4d0435901973ae5ea255a2/gr5.sml gr5 gr5.sml sml 5657 115 219 IMAGE-THUMBNAIL 1-s2.0-S2468823119303165-gr6.sml https://s3.amazonaws.com/prod-ucs-content-store-us-east/content/pii:S2468823119303165/gr6/THUMBNAIL/image/gif/e6497be0ef9293e2fd9c1b15b41e3f78/gr6.sml gr6 gr6.sml sml 6520 93 219 IMAGE-THUMBNAIL 1-s2.0-S2468823119303165-gr7.sml https://s3.amazonaws.com/prod-ucs-content-store-us-east/content/pii:S2468823119303165/gr7/THUMBNAIL/image/gif/76de41f783ef71e51be3402ebe169696/gr7.sml gr7 gr7.sml sml 5385 164 190 IMAGE-THUMBNAIL 1-s2.0-S2468823119303165-gr8.sml https://s3.amazonaws.com/prod-ucs-content-store-us-east/content/pii:S2468823119303165/gr8/THUMBNAIL/image/gif/80e4c060735015ddf5918a7efd20b87c/gr8.sml gr8 gr8.sml sml 15850 107 219 IMAGE-THUMBNAIL 1-s2.0-S2468823119303165-gr9.sml https://s3.amazonaws.com/prod-ucs-content-store-us-east/content/pii:S2468823119303165/gr9/THUMBNAIL/image/gif/f4cfde86dc92eb069b203a79ce70be60/gr9.sml gr9 gr9.sml sml 4605 70 219 IMAGE-THUMBNAIL 1-s2.0-S2468823119303165-ga1.jpg https://s3.amazonaws.com/prod-ucs-content-store-us-east/content/pii:S2468823119303165/ga1/DOWNSAMPLED/image/jpeg/939cd56fd041062c0ba97e4c13fd81e0/ga1.jpg ga1 true ga1.jpg jpg 31264 170 500 IMAGE-DOWNSAMPLED 1-s2.0-S2468823119303165-gr1.jpg https://s3.amazonaws.com/prod-ucs-content-store-us-east/content/pii:S2468823119303165/gr1/DOWNSAMPLED/image/jpeg/348204272ef63f61de8dca3f57a2d01b/gr1.jpg gr1 gr1.jpg jpg 53697 300 678 IMAGE-DOWNSAMPLED 1-s2.0-S2468823119303165-gr10.jpg https://s3.amazonaws.com/prod-ucs-content-store-us-east/content/pii:S2468823119303165/gr10/DOWNSAMPLED/image/jpeg/7099a327aa43685353a7c24c32c1b6de/gr10.jpg gr10 gr10.jpg jpg 74785 503 753 IMAGE-DOWNSAMPLED 1-s2.0-S2468823119303165-gr11.jpg https://s3.amazonaws.com/prod-ucs-content-store-us-east/content/pii:S2468823119303165/gr11/DOWNSAMPLED/image/jpeg/95af1b8b280aef7fb67af82670165006/gr11.jpg gr11 gr11.jpg jpg 65440 483 678 IMAGE-DOWNSAMPLED 1-s2.0-S2468823119303165-gr12.jpg https://s3.amazonaws.com/prod-ucs-content-store-us-east/content/pii:S2468823119303165/gr12/DOWNSAMPLED/image/jpeg/db4770f98b3ebef0f4f172ec32965035/gr12.jpg gr12 gr12.jpg jpg 37887 283 678 IMAGE-DOWNSAMPLED 1-s2.0-S2468823119303165-gr2.jpg https://s3.amazonaws.com/prod-ucs-content-store-us-east/content/pii:S2468823119303165/gr2/DOWNSAMPLED/image/jpeg/57bdc063e12cdd56cc0f360d19690aa8/gr2.jpg gr2 gr2.jpg jpg 57002 289 678 IMAGE-DOWNSAMPLED 1-s2.0-S2468823119303165-gr3.jpg https://s3.amazonaws.com/prod-ucs-content-store-us-east/content/pii:S2468823119303165/gr3/DOWNSAMPLED/image/jpeg/1bf5f4eba2609748bf590a79a26798b4/gr3.jpg gr3 gr3.jpg jpg 63353 331 678 IMAGE-DOWNSAMPLED 1-s2.0-S2468823119303165-gr4.jpg https://s3.amazonaws.com/prod-ucs-content-store-us-east/content/pii:S2468823119303165/gr4/DOWNSAMPLED/image/jpeg/12920f1f06d89bd713456817c1b30c1b/gr4.jpg gr4 gr4.jpg jpg 64460 359 678 IMAGE-DOWNSAMPLED 1-s2.0-S2468823119303165-gr5.jpg https://s3.amazonaws.com/prod-ucs-content-store-us-east/content/pii:S2468823119303165/gr5/DOWNSAMPLED/image/jpeg/46ea9a85a4b2bbc6a13a5962f4f10c81/gr5.jpg gr5 gr5.jpg jpg 47678 356 678 IMAGE-DOWNSAMPLED 1-s2.0-S2468823119303165-gr6.jpg https://s3.amazonaws.com/prod-ucs-content-store-us-east/content/pii:S2468823119303165/gr6/DOWNSAMPLED/image/jpeg/f7de63de1462e4808be1065c804279fe/gr6.jpg gr6 gr6.jpg jpg 52246 289 678 IMAGE-DOWNSAMPLED 1-s2.0-S2468823119303165-gr7.jpg https://s3.amazonaws.com/prod-ucs-content-store-us-east/content/pii:S2468823119303165/gr7/DOWNSAMPLED/image/jpeg/a83d9a2290953a0013498a5d717e5c6a/gr7.jpg gr7 gr7.jpg jpg 20460 324 376 IMAGE-DOWNSAMPLED 1-s2.0-S2468823119303165-gr8.jpg https://s3.amazonaws.com/prod-ucs-content-store-us-east/content/pii:S2468823119303165/gr8/DOWNSAMPLED/image/jpeg/63dab4c039f279851ceb304b1f9ff150/gr8.jpg gr8 gr8.jpg jpg 65114 332 678 IMAGE-DOWNSAMPLED 1-s2.0-S2468823119303165-gr9.jpg https://s3.amazonaws.com/prod-ucs-content-store-us-east/content/pii:S2468823119303165/gr9/DOWNSAMPLED/image/jpeg/b58d67b9621e718a85e1c147b9ff5fd2/gr9.jpg gr9 gr9.jpg jpg 40744 239 753 IMAGE-DOWNSAMPLED 1-s2.0-S2468823119303165-mmc1.doc https://s3.amazonaws.com/prod-ucs-content-store-us-east/content/pii:S2468823119303165/mmc1/MAIN/application/msword/5e286bed07e00bc780ae826dc541addc/mmc1.doc mmc1 mmc1.doc doc 616960 APPLICATION 1-s2.0-S2468823119303165-si1.gif https://s3.amazonaws.com/prod-ucs-content-store-us-east/content/pii:S2468823119303165/STRIPIN/image/gif/964bb9aa4f83171eeea5b9d8a77845fd/si1.gif si1 si1.gif gif 840 43 250 ALTIMG 1-s2.0-S2468823119303165-si2.gif https://s3.amazonaws.com/prod-ucs-content-store-us-east/content/pii:S2468823119303165/STRIPIN/image/gif/99450d7bb826cb240cb8a50380d9c30d/si2.gif si2 si2.gif gif 886 47 268 ALTIMG 1-s2.0-S2468823119303165-si3.gif https://s3.amazonaws.com/prod-ucs-content-store-us-east/content/pii:S2468823119303165/STRIPIN/image/gif/203f699da3de7e1cb5f92c9287d911ff/si3.gif si3 si3.gif gif 869 46 262 ALTIMG 1-s2.0-S2468823119303165-si4.gif https://s3.amazonaws.com/prod-ucs-content-store-us-east/content/pii:S2468823119303165/STRIPIN/image/gif/b4a17d414b9f38b2b433bc810613bf9a/si4.gif si4 si4.gif gif 754 46 225 ALTIMG 1-s2.0-S2468823119303165-am.pdf am am.pdf pdf 1167836 AAM-PDF https://s3-eu-west-1.amazonaws.com/prod-ucs-content-store-eu-west/content/egi:10B203HBQCN/MAIN/application/pdf/3aa4aee37e421febbd3918c9261f7cb0/am.pdf MCAT 110481 110481 S2468-8231(19)30316-5 10.1016/j.mcat.2019.110481 Elsevier B.V. Fig. 1 Nitrogen adsorption-desorption isotherms of (a) Al2O3 supports, 2Co1Cu/Al, 2Co1CuAl-Xe catalyst and (b) CoCuAl-Xe catalysts. Fig. 1 Fig. 2 (a) XRD patterns and (b) TPR profiles of calcined CoCuAl-Xe and 2Co1Cu/Al catalysts. Fig. 2 Fig. 3 STEM-EDX elemental mapping images of calcined (a) 2Co1Cu/Al and (b) 2Co1CuAl-Xe catalyst. Fig. 3 Fig. 4 XPS spectra in the (a) Co 2p level and (b) Cu 2p level of calcined CoCuAl-Xe and 2Co1Cu/Al catalysts. Fig. 4 Fig. 5 (a) Co K-edge near-edge spectra and (b) k2-weighted EXAFS Fourier transform magnitude spectra of calcined 2Co1CuAl-Xe and 2Co1Cu/Al catalysts. Fig. 5 Fig. 6 (a) XRD patterns and (b) CO-TPD profiles of CoCuAl-Xe and 2Co1Cu/Al catalysts after reduction at 400 °C for 4 h. Fig. 6 Fig. 7 Lattice constant of (200) plane of Co-Cu alloy plotted as a function of Cu concentration. Fig. 7 Fig. 8 STEM-EDX elemental mapping images of (a) 2Co1Cu/Al and (b) 2Co1CuAl-Xe catalyst after reduction at 400 °C for 4 h. Fig. 8 Fig. 9 Quasi-ASF plots of produced hydrocarbon and alcohol over (a) 2Co1Cu/Al, (b) 2Co1CuAl-Xe, and (c) 2Co1Cu/Al-Xe catalyst (Reaction conditions: Temperature = 250 °C, P total =50 bar, catalyst =0.4 g, weight hourly space velocity (WHSV) =1800 ml/gcat⋅h). Fig. 9 Fig. 10 Quasi-ASF plots of produced hydrocarbon and alcohol over (a) 3Co1CuAl-Xe, (b) 2Co1CuAl-Xe, (c) 1Co1CuAl-Xe, (d) 1Co2CuAl-Xe, and (e) 1Co3CuAl-Xe catalyst. (Reaction conditions: Temperature = 250 °C, P total =30 bar, catalyst =0.4 g, weight hourly space velocity (WHSV) =1800 ml/gcat⋅h). Fig. 10 Fig. 11 (a) Reaction pathway of higher alcohol synthesis from syngas. * denotes a molecule adsorbed on a surface. Relative energy diagram for CO hydrogenation mechanism over Co-Cu intimate and Co-Cu alloy surface via (b) direct CO dissociation and (c) CHOH* intermediate formation. Fig. 11 Fig. 12 Effect of metal proximity on (a) chain growth and (b) CO insertion reaction. Fig. 12 Table 1 Detailed physicochemical properties of calcined catalyst. Table 1 Catalyst Co/Cu molar ratio a Surface area (m2/g) b Total pore volume (cm3/g) c Average pore diameter (nm) Commercial Al2O3 – 171.3 0.47 9.3 Al2O3-Xe – 274.0 0.30 4.0 3Co1CuAl-Xe 3.63 126.9 0.34 8.1 2Co1CuAl-Xe 2.34 121.6 0.30 7.7 1Co1CuAl-Xe 1.17 121.9 0.32 8.0 1Co2CuAl-Xe 0.56 122.8 0.29 7.4 1Co3CuAl-Xe 0.40 115.2 0.29 8.4 2Co1Cu/Al 1.50 37.6 0.11 11.4 a Determined by ICP-AES measurement. b Calculated by the BET equation. c Total pore volume at P/P0 ˜ 0.995. Table 2 Crystallite size in the calcined catalyst. Table 2 Catalyst Crystallite size of CoxMyO4 spinel (nm) a Crystallite size of CuO (nm) b 3Co1CuAl-Xe 8.4 15.6 2Co1CuAl-Xe 8.2 15.9 1Co1CuAl-Xe 8.0 15.6 1Co2CuAl-Xe 7.7 17.2 1Co3CuAl-Xe 7.4 17.2 2Co1Cu/Al 15.3 22.9 a Calculated according to the (3 1 1) diffraction peak of CoxMyO4 spinel (M = Co2+, Cu2+, or Al3+) at 2θ = 36.7° from XRD patterns in Fig. 2(a). b Calculated according to the (1 1 1) diffraction peak of CuO at 2θ = 35.5° from XRD patterns in Fig. 2(a). Table 3 Surface atomic composition of calcined catalyst. Table 3 Catalyst Surface Co2+/Co3+ atomic ratio a Surface Co/Cu atomic ratio a Bulk Co/Cu atomic ratio b 3Co1CuAl-Xe 0.494 1.64 3.63 2Co1CuAl-Xe 0.481 0.98 2.34 1Co1CuAl-Xe 0.523 0.54 1.17 1Co2CuAl-Xe 0.531 0.24 0.56 1Co3CuAl-Xe 0.602 0.19 0.40 2Co1Cu/Al 0.461 0.55 1.50 a Determined from XPS spectra in Fig. 4. b Determined from ICP-AES. Table 4 Catalytic performance of 2Co1CuAl-Xe, 2Co1Cu/Al, and 2Co1Cu/Al-Xe catalyst for higher alcohol synthesis from syngas. Table 4 Catalyst CO conversion (%)a Selectivity (C mol%)a Alcohol distribution (C mol%) a Higher alcohol yield (%) a CO2 CH4 C2+H ROH MeOH EtOH C3+OH 2Co1CuAl-Xe 55.6 6.9 15.6 57.1 20.4 5.4 22.2 72.4 10.7 2Co1Cu/Al 36.6 1.9 26.6 61.0 10.5 24.8 31.9 43.4 2.9 2Co1Cu/Al-Xe 30.8 5.9 21.1 62.7 10.4 6.9 28.0 65.1 3.0 a Average value for 48 h-reaction at 250 °C, 50 bar (WHSV =1800 ml/gcat⋅h). Table 5 Catalytic performance of CoCuAl-Xe catalyst for higher alcohol synthesis from syngas. Table 5 Catalyst CO conversion (%)a Selectivity (C mol%) a Alcohol distribution (C mol%) a Higher alcohol yield (%) a CO2 CH4 C2+H ROH MeOH EtOH C3+OH 3Co1CuAl-Xe 68.5 8.6 15.8 68.1 7.5 6.0 35.8 58.2 4.8 2Co1CuAl-Xe 71.9 11.0 15.0 65.9 8.1 5.0 40.0 55.0 5.5 1Co1CuAl-Xe 54.1 5.1 17.7 66.4 10.8 7.4 43.9 48.7 5.3 1Co2CuAl-Xe 41.6 3.3 20.8 63.6 12.3 12.8 47.1 40.1 4.5 1Co3CuAl-Xe 22.5 3.2 24.1 54.9 17.8 17.7 47.9 34.4 3.3 a Average value for 48 h-reaction at 250 °C, 30 bar (WHSV =1800 ml/gcat⋅h). Higher alcohol synthesis from syngas over xerogel-derived Co-Cu-Al2O3 catalyst with an enhanced metal proximity Seung Ju Han a ⁎ Gyungah Park a Yun-Jo Lee a Ki-Won Jun a b Seok Ki Kim a b Yong Tae Kim a b Geunjae Kwak a b ⁎ a Carbon Resources Institute, Korea Research Institute of Chemical Technology, Daejeon, 34114, Republic of Korea Carbon Resources Institute Korea Research Institute of Chemical Technology Daejeon 34114 Republic of Korea b Advanced Materials and Chemical Engineering, University of Science & Technology, Daejeon, 34113, Republic of Korea Advanced Materials and Chemical Engineering University of Science & Technology Daejeon 34113 Republic of Korea ⁎ Corresponding authors at: Carbon Resources Institute, Korea Research Institute of Chemical Technology, Daejeon, 34114, Republic of Korea. Carbon Resources Institute Korea Research Institute of Chemical Technology Daejeon 34114 Republic of Korea Graphical abstract To improve metal proximity of Co-Cu-Al2O3 catalyst, xerogel-derived mesoporous Co-Cu-Al2O3 catalysts (CoCuAl-Xe) with various Co:Cu molar ratios (3:1, 2:1, 1:1, 1:2, and 1:3) were prepared by an epoxide-driven sol-gel method and applied to higher alcohol synthesis from syngas. The CoCuAl-Xe catalyst induced the formation of a composite spinel structure containing Co, Cu, and Al. At the optimal Co/Cu ratio, the Cu atoms efficiently substituted the Co2+ ions in Co3O4 to form the CuCo2O4 spinel structure. However, an excess amount of Cu induced segregation of CuO, leading to decreasing Co-Cu proximity. In higher alcohol synthesis from syngas, all the catalysts showed the linear quasi-Anderson Schulz Flory plot of carbon-containing products, which was attributed to the CO insertion mechanism in higher alcohol synthesis. Among the xerogel catalysts, 2Co1CuAl-Xe exhibited the highest CO conversion and higher alcohol yield. The Co-rich CoCuAl-Xe catalyst was disadvantageous in terms of alcohol selectivity because of a lack of CO insertion sites, and the Cu-rich one was disadvantageous in CO dissociation and led to methanol formation. The computational study suggests that high Co-Cu proximity favors CHOH* mechanism for CH* formation and promotes CO insertion reaction. Consequently, it was found that the optimal Co/Cu ratio and high Co-Cu proximity is required for high catalytic activity in higher alcohol synthesis. Keywords Higher alcohol synthesis Co-Cu-Al2O3 catalyst Xerogel catalyst Co-Cu proximity 1 Introduction Higher alcohol has attracted considerable attention because of its applicability as a fuel additive, hydrogen carrier, and resource for value-added chemicals [1,2]. As most of the supply of higher alcohol is currently based on sugar fermentation or alkene hydration process, diversification of resources for higher alcohol synthesis is needed to meet the future demand [3]. As a higher alcohol resource, syngas was considered favorably because of its high applicability. Also, because syngas can be produced from methane by reforming and partial oxidation process [4,5], higher alcohol synthesis from syngas is a promising technology that is also sustainable and environment-friendly. For the direct conversion of syngas to higher alcohol, catalyst systems that combine the CC coupling and CO hydrogenation reactions have been proposed. The catalyst system for higher alcohol synthesis can be classified into Rh- [6,7] and Mo-based [8–10] catalysts, modified methanol synthesis catalyst [11], and modified Fischer-Tropsch catalyst [3,12–16]. Among them, the modified Fischer-Tropsch catalyst containing Co and Cu as the active phase has been investigated extensively because of its high cost efficiency and high higher alcohol yield [3]. In this catalyst system, CO insertion mechanism is generally accepted; dissociative adsorption of CO occurs on Co sites and non-dissociative adsorption of CO occurs on Cu sites [17]. As the CO insertion mechanism is a combination of Fischer-Tropsch synthesis and methanol synthesis, the distribution of hydrocarbon and alcohol obeys Anderson-Schulz-Flory (ASF) distribution [18–20]. Because higher alcohol synthesis requires both reactions to occur simultaneously, the composition and proximity of active metals are crucial for enhancing the catalytic performances [3]. In a recent study [21], the optimal Co/Cu ratio for obtaining higher alcohol yield was found to be 0.35 (Cu/Co ≈ 0.5) with a maximum occurrence of the CoCu alloy phase. However, phase segregation of Cu was unavoidable in the optimal Co-Cu composition because Co and Cu have low miscibility (maximum Cu solubility in Co is 9%) [22]. Furthermore, Cu tends to segregate on the surface during the reaction because of its low surface energy [23]. Therefore, many attempts have been made to increase Co-Cu proximity in an optimal Co-Cu composition. As it is known that cobalt and copper form alloys in the nanoscale, size-controlled Co-Cu alloy nanoparticles have been prepared and applied to higher alcohol synthesis from syngas [24,25]. However, the synthesis of alloy nanoparticles is difficult for obtaining high load metal catalysts and requires the removal of surfactants because the catalytically active sites may be encapsulated and blocked by the surfactant [26]. In the Fischer-Tropsch synthesis catalyst, mesoporosity of the catalyst enhances metal dispersion by high surface area and confinement effect [27]. In this regard, a mesoporous carbon supported Co-Cu catalyst has been applied to higher alcohol synthesis from syngas. This catalyst exhibited high catalytic activity because of its improved metal dispersion [28]. In order to achieve a uniformly distributed Co-Cu alloy at high loading, mixed Co-Cu oxide precursor with a specific structure has been suggested. Wang et al. prepared a Cu-Co alloy nanocatalyst derived from layered double hydroxide (LDH) structure ([M1-x 2+Mx 3+(OH)2]x+(An−)x/n.mH2O), which showed high selectivity to C2+ alcohols in higher alcohol synthesis from syngas [29]. Carbon nanotube (CNT) supported Cu-Co LDH was also suggested as a precursor of Co-Cu alloy catalyst. It was demonstrated that the formation of uniformly mixed CuCo2O4 in the LDH structure was favorable for the formation of the Co-Cu alloy catalyst [30]. Tien-Thao et al. prepared LaCo1-xCuxO3- δ perovskites as precursors and investigated the effect of alkali additives on the perovskite-derived Co-Cu catalyst [31,32]. The citric acid sol-gel method was also shown to be an effective mean to prepare a uniformly mixed CuCo2O4 phase, which exhibited high catalytic activity in higher alcohol synthesis from syngas [33]. Since the formation of structure-derived mixed oxides with high dispersion is required for an efficient Co-Cu catalyst, the introduction of mesoporous xerogel structure is expected to enhance the catalytic activity in higher alcohol synthesis. In this work, xerogel-derived Co-Cu-Al2O3 catalysts were prepared by an epoxide-driven sol-gel method and their promising catalytic activity was applied to higher alcohol synthesis from syngas. Various characterizations and computational study were performed to elucidate the effect of Co/Cu molar ratio and metal proximity. 2 Experimental 2.1 Preparation of mesoporous Co-Cu-Al2O3 catalysts Mesoporous Co-Cu-Al2O3 catalysts with various Co/Cu atomic ratios were prepared by the epoxide-driven sol-gel method. Because the Co-Cu-Al2O3 catalyst derived from the LDH structure with the (Co + Cu)/Al molar ratio of 2 exhibited high activity in higher alcohol synthesis [29,30], the same atomic ratio of (Co + Cu)/Al was used in this study. Appropriate amounts of cobalt (cobalt nitrate hexahydrate, Samchun, 97.0%), copper (copper nitrate hydrate, Samchun, 77.0–80.0%), and aluminum (aluminum nitrate nonahydrate, Samchun, 98.0%) precursors were dissolved in ethanol (Samchun, 99.9%) by vigorous stirring. The (Co + Cu)/Al molar ratio was fixed at 2 and the ethanol/total metal precursor molar ratio was fixed at 30. After obtaining a transparent solution, propylene oxide was added for gelation. This led to the condensation of hydrolyzed metal ions and eventually, the Co-Cu-Al2O3 composite gel was obtained. The obtained gel was aged at room temperature overnight and dried at 80 °C. It was then calcined at 400 °C with a ramping rate of 2 °C/min for 5 h under ambient conditions. The prepared Co-Cu-Al2O3 xerogel catalyst was denoted as xCoyCuAl-Xe catalyst, where x:y represents the molar ratio of Co:Cu in the catalyst. Co-Cu/Al2O3 xerogel catalyst was also prepared by 2 step epoxide-driven sol-gel method. At first, alumina xerogel support was prepared by the epoxide-driven sol-gel method described above and it was denoted as Al2O3-Xe. Then aqueous solutions of cobalt (cobalt nitrate hexahydrate, Samchun, 97.0%) and copper (copper nitrate hydrate, Samchun, 77.0–80.0%) precursors with the (Co + Cu)/Al molar ratio of 2 were added into Al2O3-Xe. After aging and drying process, the resultant was calcined at 400 °C for 5 h with a ramping rate of 2 °C/min. The prepared Co-Cu/Al2O3 xerogel was denoted as 2Co1Cu/Al-Xe. For comparison, the Co-Cu/Al2O3 catalyst was prepared by the co-impregnation method. Commercial gamma-Al2O3 (Puralox, Sasol) was calcined under an air flow at 400 °C for 5 h. Aqueous solutions of the cobalt (cobalt nitrate hexahydrate, Samchun, 97.0%) and copper (copper nitrate hydrate, Samchun, 77.0–80.0%) precursors with the (Co + Cu)/Al molar ratio of 2 were added into gamma-Al2O3. After aging for 2 h, the solution was dried at 110 °C overnight, followed by calcination at 400 °C for 5 h with a ramping rate of 2 °C/min. The resultant catalyst was denoted as 2Co1Cu/Al. 2.2 Characterization The textural properties of the catalysts were studied by N2 adsorption-desorption measurements at −196 °C using an ASAP 2020 system (Micromeritics). Prior to the measurements, the sample was pretreated under vacuum at 300 °C for 12 h. The surface area was calculated by the Brunauer-Emmet-Teller (BET) equation and average pore diameter was calculated by the Barrett-Joyner-Halenda (BJH) desorption method. Total pore volume was determined at the relative pressure (P/P0) of 0.99. Crystal structures of the catalysts were investigated by X-ray diffraction (XRD) analysis with Ultima (Rigaku) diffractometer using Cu-Kα radiation (λ =1.5418 Å). The XRD patterns were recorded by a scintillation counter detector in the 2θ range of 10-80° under 40 kV/40 mA X-ray conditions. The bulk metal compositions of the catalysts were determined by inductively coupled plasma atomic emission spectroscopy (ICP-AES) analysis using iCAP 7400 (Thermo Scientific). Temperature-programmed reduction (TPR) experiments were conducted to investigate the reducibility of the catalysts. For analysis, 100 mg of the calcined catalyst was loaded and pretreated with He for 1 h at 300 °C. The furnace temperature was then increased to 800 °C at a ramping rate of 10 °C/min under a flow of 5% H2/He mixed gas (50 mL/min). The hydrogen consumption was detected by a thermal conductivity detector (TCD). CO temperature programmed desorption (CO-TPD) experiments were performed to investigate the CO adsorption sites of the catalysts. Prior to the analysis, 100 mg of the catalyst was reduced under H2 gas at 400 °C for 4 h. The reduced catalyst was then saturated with CO at room temperature for 30 min. The physisorbed CO was removed by purging the sample with He flow at 100 °C for 1 h. The furnace temperature was increased to 900 °C at a ramping rate of 10 °C/min under a flow of He. The desorbed CO was detected by TCD. The oxidation states and chemical compositions of the catalysts were determined by X-ray photoelectron spectroscopy (XPS) analysis using AXIS NOVA (Kratos). The obtained XPS peaks were deconvoluted using Shirley background and the Gaussian-Lorentzian peak. The surface atomic compositions were calculated using the relative sensitivity factor (RSF) of each component. Scanning transmission electron microscopy (STEM) mapping by energy dispersive X-ray (EDX) was conducted to determine the atomic distributions and morphologies of the prepared catalyst. The STEM-EDX mapping images were obtained using FEG S/TEM (Talos F200S) at 200 kV. X-ray absorption spectroscopy (XAS) was conducted using beamline 8C (Nano XAFS) at the Pohang Accelerator Laboratory (PAL). The spectroscopic data was collected in the transmittance mode with an electron energy of 3.0 GeV and a ring current of 70–100 mA. Data calibration was performed using the K-edge energy position of Co foil (7709 eV). The collected X-ray absorption near edge structure (XANES) and extended X-ray absorption fine structure (EXAFS) data were analyzed using the Athena software package [34]. 2.3 Higher alcohol synthesis from syngas Higher alcohol (C2+OH) synthesis from syngas was carried out in a fixed-bed steel reactor with an inner diameter of 7.25 mm. The catalyst (0.4 g) was loaded in the reactor with 2 g of alpha alumina as a diluent. Prior to the reaction, the catalyst was reduced at 400 °C under H2 gas for 4 h. After cooling the reactor to the room temperature, premixed syngas (CO/H2 = 1) containing 7% Ar was used as the feed gas. The reaction was conducted at 250 °C and the gas hourly space velocity (WHSV) was fixed at 1800 mL/gcat⋅h. Gaseous products were analyzed online using YL6100 gas chromatography (GC) equipped with a TCD and a flame ionization detector (FID). H2, CO, CO2, and CH4 were analyzed by TCD fitted with a Carboxene 1000 column and the gaseous C1-C8 hydrocarbons were analyzed by FID fitted with an HP-PLOT Q column under He flow. After reaction for 48 h, the liquid products were collected in a cold trap and analyzed offline by YL6100 gas chromatography (GC) and Shimadzu gas chromatography-mass spectrometry (GCMS). The aqueous products were analyzed by GCMS with the Rtx-VMS column and the liquid oil products were analyzed by GC equipped with a FID with HP-1 column and GCMS with Rtx-VMS column. As some C6-C8 hydrocarbons in the liquid oil product can be lost, the amounts of C6-C8 hydrocarbons were corrected using the α value obtained from quasi-Anderson-Schulz-Flory (ASF) plots. Quasi-ASF plots for hydrocarbons and alcohols were obtained according to the following equation (Eq. (1) [35]. CO conversion, selectivity and yield for products were calculated by the following equations (Eqs. (2–4)). (1) ln C m o l % n = n l n α + c o n s t a n t (2) X c o % = F C O , i n - F C O , o u t F C O , i n × 100 (3) S i % = n i × F i F C O , i n - F C O , o u t × 100 (4) Y i % = n i × F i F C O , i n × 100 2.4 Computational details The density functional theory (DFT) calculation was conducted by using the Vienna Ab-Initio Simulation Package (VASP) with the revised Perdew-Burke-Ernzerhof (rPBE) exchange-correlation functional in the generalized gradient approximation [36–38]. The vdw-DF2 functional was used to consider van der Waals interaction on metal surfaces [39–42]. The kinetic energy cutoff was set to 450 eV. A Monkhorst-Pack k-points mesh grid was set to 4 × 4 × 1 for Brillouin zone sampling. The ideal gas assumption, which takes into account translational and rotational degree of freedom, was used for calculating the Gibbs free energy of gas molecules [43]. While, the harmonic limit, which treats only vibrations harmonically, was used for Gibbs free energy of adsorbents [43]. The slab models for Co-Cu intimate and alloy surfaces are constructed based on 4 × 4 × 3 unit cell with 15 Å of vacuum thickness (Fig. S4). In Co hcp (001) surfaces, 1/2 monolayer (ML) surface Co atoms are substituted by Cu atoms to simulate Co-Cu surfaces. In the intimate structure (Fig. S4(a)), the Cu atoms were isolated from the Co atoms, and the alloy structure (Fig. S4(b)) was simulated as a uniform mixture of the Cu and Co atoms. The electronic energies of gas-phase CO, H2, H2O and adsorbed CO* were corrected by −0.18, +0.09, −0.21 eV, and +0.25 eV to accurately describe the overall reaction energies [44–46]. 3 Results and discussion 3.1 Textural properties of catalysts N2 adsorption-desorption measurements were carried out to investigate the textural properties of the catalysts. Fig. 1 (a) compares the N2 adsorption-desorption isotherms of Al2O3 and calcined catalysts; commercial gamma-Al2O3 (Puralox, Sasol) as a support for 2Co1Cu/Al. All the samples displayed type-IV isotherms with H2 type hysteresis, which is indicative of mesoporous structures [47]. It is worth noting that the hysteresis loops of alumina supported catalyst were well maintained in the xerogel catalyst (2Co1CuAl-Xe) compared to the impregnated catalyst (2Co1Cu/Al). This might be because pore blockage of Al2O3 support occurred during the additional impregnation of an active metal in the 2Co1Cu/Al catalyst. Fig. 1(b) shows the N2 adsorption-desorption isotherms of the CoCuAl-Xe catalysts with various Co:Cu molar ratios (3:1, 2:1, 1:1, 1:2, and 1:3). All the CoCuAl-Xe catalysts exhibited type-IV isotherms with H2 type hysteresis, which indicated mesoporous xerogel structure. The detailed textural properties of the support and calcined catalyst are summarized in Table 1 . Al2O3-Xe had a higher surface area and lower pore volume compared to commercial Al2O3. Interestingly, the decrease in surface area and pore volume was prominent in 2Co1Cu/Al after introducing Co and Cu. On the other hand, Al2O3-Xe and 2Co1CuAl-Xe exhibited similar pore volumes. This was attributed to drastic pore blockage during the co-impregnation of metal precursors in 2Co1Cu/Al, whereas Co and Cu ions were involved in forming a gel structure with Al ion during the sol-gel process in 2Co1CuAl-Xe [48,49]. In addition, all the CoCuAl-Xe catalysts showed similar textural properties. This indicates that homogeneous xerogel structures were formed at various Co/Cu molar ratios because of the similar hydrolysis and condensation rates of Co2+ and Cu2+ [50]. Thus, the epoxide-driven sol-gel method proved to be an efficient way to prepare catalysts with high active metal loading, while maintaining the well-developed mesoporosity. 3.2 Crystalline structure and reducibility of calcined catalysts Fig. 2 (a) shows the X-ray diffraction (XRD) patterns of the calcined catalyst. In the CoCuAl-Xe catalyst with a high cobalt ratio (3Co1CuAl-Xe and 2Co1CuAl-Xe), the peaks for the spinel structure were dominant. On the other hand, sharp peaks for CuO (ICDD PDF Card No. 1-1117) appeared at 2θ = 35.8° and 39.0° in the CoCuAl-Xe catalyst with a high copper ratio (1Co1CuAl-Xe, 1Co2CuAl-Xe, and 1Co3CuAl-Xe). This indicates that segregation of CuO occurred in the CoCuAl-Xe catalysts with excess Cu. In Fig. S5, the detailed peak positions of the spinel structure in the calcined catalysts are compared. Because ionic radius decreases in the order of Co > Al > Cu, the peak positions of the spinel structure shift to higher diffraction angle in the order of Co3O4<CoAl2O4<CuCo2O4. The CoCuAl-Xe catalyst showed composite peaks of spinel structures while the 2Co1Cu/Al catalyst exhibited a prominent diffraction peak for Co3O4. This indicates that the xerogel-derived composite structure induced the formation of a composite spinel structure containing Co, Cu, Al. In the 3Co1CuAl-Xe catalyst, peaks for Co3O4 (ICDD PDF Card No. 1-1152, 2θ = 65.2°) and CoAl2O4 (ICDD PDF Card No. 2-1410, 2θ = 65.3°) were observed. With increasing Cu/Co ratio, the peak intensity for CuCo2O4 (ICDD PDF Card No. 1-1155, 2θ = 65.8°) increased and the peak position of the spinel structure shifted to a higher angle. This demonstrates that Co2+ ions in Co3O4 were substituted by Cu2+ to form the CuCo2O4 spinel structure. The crystallite sizes of spinel (Co3O4, CoAl2O4 or CuCo2O4) and CuO were calculated by using the Scherrer equation as summarized in Table 2 . 2Co1Cu/Al catalyst retained relatively high crystallite sizes of spinel and CuO compared to xerogel catalysts. This implies that xerogel-derived Co-Cu-Al mixed oxide is favorable for dispersion of spinel structure. Therefore, it is inferred that aluminum in the CoCuAl-Xe catalysts seems to increase Co dispersion by forming a spinel structure. It was also observed that crystallite size of spinel decreased from 8.4 nm to 7.4 nm with increasing Cu molar ratio. While, 1Co2CuAl-Xe and 1Co3CuAl-Xe catalysts retained large crystallite size of CuO, which is indicative of CuO segregation. The reducibility of the catalysts was determined by temperature programmed reduction (TPR) analysis as presented in Fig. 2(b). As the reduction of cobalt oxide occurs in two steps (Co3+ → Co2+ and Co2+ → Co0) [51], 3Co1CuAl-Xe catalyst exhibited three reduction peaks at low temperatures (<300 °C). The reduction peak at the lowest temperature (153 °C) was attributed to the reduction of Cu2+ to Cu0 and the others were attributed to reduction of Co3+ to Co2+ and Co2+ to Co0 [52]. Considering the XRD results (Fig. S5), the broad reduction peak at high temperature (>300 °C) might be attributed to reduction of CoAl2O4 [53]. Interestingly, the reduction peak position of Cu2+ and Co3+ in 2Co1CuAl-Xe catalyst overlapped, which implies the formation of CuCo2O4 mixed spinel [28,54]. Because the reduced Cu0 species facilitates the reduction of cobalt species by hydrogen transfer [55], catalysts with low Co/Cu ratio (1Co2CuAl-Xe and 1Co3CuAl-Xe) exhibited reduction peak of CoAl2O4 at low temperature. On the other hand, the reducibility of Cu2+ decreased in 1Co2CuAl-Xe and 1Co3CuAl-Xe catalysts. Based on the XRD results (Fig. 2(a)), this was due to the formation of bulk CuO structures by excess Cu ratio [56,57]. Unlike 2Co1CuAl-Xe catalyst, 2Co1Cu/Al catalyst exhibited only two reduction peaks; the reduction peak at the lower temperature corresponded to the reduction of Cu2+ and that at higher temperature was corresponded to the reduction of Co3+ and Co2+. The absence of a reduction peak at high temperature (>400 °C) indicates the absence of CoAl2O4 spinel, which is in accordance with the XRD result (Fig. S5). 3.3 STEM-EDX mapping images of calcined catalysts Scanning transmission electron microscopy-energy dispersive X-ray (STEM-EDX) mapping analyses of calcined 2Co1Cu/Al (Fig. 3 (a)) and 2Co1CuAl-Xe catalysts (Fig. 3(b)) were conducted to investigate their morphology and metal distribution. The individual maps of cobalt, copper, and aluminum are represented. The cobalt species were uniformly distributed in both 2Co1Cu/Al and 2Co1CuAl-Xe catalysts. However, aggregation of Cu was observed only in the 2Co1Cu/Al catalyst. The 2Co1CuAl-Xe catalyst exhibited a uniform distribution of Cu; the high surface area and mesoporosity of the 2Co1CuAl-Xe catalyst induced high metal dispersion, preventing CuO segregation. 3.4 XPS and XAS study of calcined catalysts The oxidation states of cobalt and copper in the calcined catalysts were investigated by X-ray photoelectron spectroscopy (XPS) analysis (Fig. 4 ). Fig. 4(a) shows the XPS spectra of the Co 2p3/2 peak of the calcined catalysts. To calculate the Co2+/Co3+ surface ratio, XPS spectra were deconvoluted into peaks for Co3+ (˜ 779.6 eV) and Co2+ (˜ 781.0 eV) [58]. Fig. 4(b) shows the XPS spectra of the Cu 2p3/2 peak, which was deconvoluted into a shake-up peak (˜ 942.0 eV) and a Cu 2p3/2 peak (˜ 934.0 eV) [58]. The surface atomic composition was calculated from each deconvoluted area from XPS spectra and the results are summarized in Table 3 . Although CuCo2O4 was not successfully formed in the 2Co1Cu/Al catalyst, a lower surface Co2+/Co3+ atomic ratio was obtained compared to 2Co1CuAl-Xe catalyst. Considering the XRD results (Fig. 2(a) and Fig. S5), a high Co2+ ratio in 2Co1CuAl-Xe was attributed to CoAl2O4 formation. On the other hand, Co3O4 was predominantly formed in the 2Co1Cu/Al catalyst, resulting in a low Co2+ ratio. Among the xerogel catalysts, 2Co1CuAl-Xe had the lowest surface Co2+/Co3+ atomic ratio. As shown in the XRD results (Fig. 2(a) and Fig. S5), it was evident that the Co2+ ion was substituted by Cu2+ and the CuCo2O4 spinel structure was formed. However, the Co2+/Co3+ atomic ratio increased drastically with the increasing Cu ratio in 1Co1CuAl-Xe, 1Co2CuAl-Xe, and 1Co3CuAl-Xe catalyst. Therefore, it was inferred that the 2Co1CuAl-Xe catalyst was optimal for CuCo2O4 formation while excess Cu inhibited CuCo2O4 formation by forming bulk CuO. It was also noted that the surface Cu ratio calculated by XPS was much higher than the bulk Cu ratio because of the high tendency of Cu to move to the surface [23]. Fig. 5 (a) shows the Co K-edge near-edge spectra of the calcined catalysts, obtained by X-ray absorption spectroscopy (XAS). Both 2Co1CuAl-Xe and 2Co1Cu/Al catalysts exhibited pre-edge peak of 1 s to 3d transition of Co2+ and a white line similar to Co3O4 [59]. It is noteworthy that the white line position of 2Co1CuAl-Xe and 2Co1Cu/Al catalysts were slightly shifted to higher energy as compared to Co3O4. This implied that the average oxidation state of cobalt was increased by the substitution of Co2+ with Cu2+ forming CuCo2O4 [60,61]. The Fourier-transformed k2-weight Co K-edge EXAFS spectra of calcined catalysts are presented in Fig. 5(b). All catalysts exhibited peaks at 1.50, 2.48, and 3.00 Å. Based on the previous reports [17,61], these peaks were assigned to Co3+/Co2+−O, Co3+−Co3+, and Co3+/Co2+−Co3+ coordination, respectively. The relatively high intensity of the Co3+-Co3+ coordination peak in 2Co1CuAl-Xe and 2Co1Cu/Al catalysts was indicative of Co2+ substitution by Cu2+ forming CuCo2O4. In particular, the 2Co1Cu/Al catalyst retained the prominent peak of Co3+-Co3+ coordination, which was in good agreement with the XPS results (Fig. 4). 3.5 XRD and CO-TPD measurements of reduced catalysts The crystalline phase of the reduced catalyst was measured by XRD analysis (Fig. 6 (a)). All the catalysts exhibited diffraction peaks of metallic Cu (ICDD PDF Card No. 1-1241, 2θ = 43.5°, 50.4°) and Co (ICDD PDF Card No. 15-806, 2θ = 44.3°, 51.6°). It was observed that the sharpness of the metallic Cu peak is higher than that of Co peak, indicating that Cu was more prone to aggregation. In particular, 2Co1Cu/Al exhibited sharp diffraction peaks of Co and Cu compared to the 2Co1CuAl-Xe catalyst. This indicates that the high surface area and uniform distribution of metal oxide in the 2Co1CuAl-Xe catalyst was more favorable for metal dispersion. In the XRD patterns of the CoCuAl-Xe catalysts, the intensity of Cu peaks increased drastically with the increasing Cu/Co molar ratio, which was in accordance with the high intensity of XRD peaks for CuO in the calcined catalysts (Fig. 2(a)). This implies that the highly crystalline metallic Cu was derived from segregated CuO in the calcined catalysts. Therefore, it is inferred that the spinel structure-derived Co-rich surface in CoCuAl-Xe prevented Cu segregation during the reduction process. The CO desorption behavior of the reduced catalysts was studied by CO-temperature programmed desorption (CO-TPD) measurements (Fig. 6(b)). A considerably larger amount of CO was desorbed from the 2Co1CuAl-Xe catalyst compared to 2Co1Cu/Al, which was attributed to its high surface area and high metal dispersion. Based on a previous study [28], the medium and strong CO adsorption sites (>400 °C) are the active sites for higher alcohol synthesis. In the CoCuAl-Xe catalysts, desorption peak intensity at high temperature decreased with increasing Cu/Co molar ratio. This indicates that strong CO adsorption site is mainly attributed to dissociative CO adsorption site on cobalt. The drastic decrease of CO-desorption peak was obtained in 1Co2CuAl-Xe and 1Co3CuAl-Xe catalyst with a higher Cu ratio. Considering the XRD results of the reduced catalysts in Fig. 6(a), this could be explained by the severe segregation of Cu0 that induced low Cu dispersion in the reduced catalyst. In order to estimate the Co-Cu proximity of the reduced catalyst, the concentration of Cu contained in the Co-Cu alloy was calculated using Vegard’s law (Fig. 7 ) [62,63]. Because Co (111) (2θ = 44.3°) and Cu (111) peak (2θ = 43.5°) might be overlapped with the Al2O3 (113) peak (ICDD PDF Card No. 1-1243, 2θ = 43.5°), Co (200) (2θ = 51.6°) and Cu (200) peak (2θ = 50.4°) were considered. In CoCuAl-Xe catalyst, Cu concentration increased with increasing bulk Cu/Co molar ratio. This demonstrates that increase of bulk Cu/Co molar ratio induced Cu segregation from Co-Cu alloy. 2Co1CuAl-Xe showed relatively low Cu concentration compared to 2Co1Cu/Al. This shows that higher Co content forms solid solution with Cu in 2Co1CuAl-Xe, which is indicative of higher Co-Cu proximity. 3.6 STEM-EDX mapping images of reduced catalysts Fig. 8 shows the STEM-EDX mapping images of the reduced 2Co1Cu/Al (Fig. 8(a)) and 2Co1CuAl-Xe catalysts (Fig. 8(b)). The individual maps of cobalt, copper, and aluminum are represented. Similar to the STEM-EDX images of calcined 2Co1Cu/Al catalyst (Fig. 3(a)), the reduced 2Co1Cu/Al catalyst exhibited segregated Cu particles. This indicates that the segregated copper oxide species in 2Co1Cu/Al were converted to isolated Cu particles by reduction, which was in accordance with the XRD results (Fig. 6(a)). On the other hand, a uniform distribution of Co and Cu was observed in the reduced 2Co1CuAl-Xe catalyst, indicating that the high dispersion of Co and Cu were well-maintained during the reduction process. 3.7 Higher alcohol synthesis from syngas Higher alcohol synthesis from syngas over 2Co1Cu/Al, 2Co1CuAl-Xe, and 2Co1Cu/Al-Xe catalyst was performed at 250 °C, 50 bar. All the catalysts exhibited stable catalytic performances for a 48 h-reaction and the detailed catalytic performance is summarized in Table 4 . It was observed that the CO conversion and selectivities for alcohol and higher alcohol in the case of 2Co1CuAl-Xe were higher than those of 2Co1Cu/Al and 2Co1Cu/Al-Xe. This indicates that the mesoporous structure in 2Co1CuAl-Xe enhanced the dispersion and proximity of Co-Cu, facilitating the CO insertion reaction. The superior activity of 2Co1CuAl-Xe compared to 2Co1Cu/Al-Xe can be explained by the fact that aluminum in 2Co1CuAl-Xe catalyst participates in formation of spinel structure during gelation process, which increases metal dispersion. In particular, relatively high selectivity of methanol in 2Co1Cu/Al catalyst might be due to the isolated Cu sites. The quasi-ASF plots for alcohol and hydrocarbon are shown in Fig. 9 . The natural log of the carbon molar fraction of the product (Ln(Cmol%/n)) and carbon number (n) showed a linear relationship in both hydrocarbon and alcohol. This demonstrates that higher alcohol was synthesized via a CO insertion mechanism, which is a combination of Fischer-Tropsch synthesis (FTS) and methanol synthesis mechanism [19]. Chain growth probabilities of alcohol and hydrocarbon were calculated from the slope of the quasi-ASF plot [35]. In the case of the 2Co1Cu/Al catalyst, chain growth probability of hydrocarbon (0.452) was higher than that of alcohol (0.365), which was in agreement with the results of previous studies [20,64]. It is generally accepted that an intimate contact site of cobalt and copper is the active site for higher alcohol synthesis [21]. Therefore, the chain growth probability for hydrocarbon at the Co site adjacent to the Cu site would correspond to the chain growth probability for alcohol. As the chain growth probability on an isolated Co site would be higher, chain growth probability for hydrocarbon was higher than that for alcohol. Accordingly, the similarity of chain growth probabilities for hydrocarbon and alcohol represents the proximity of cobalt and copper sites. For the 2Co1CuAl-Xe catalyst, the chain growth probabilities of both hydrocarbon (0.689) and alcohol (0.650) are higher than those in the case of the 2Co1Cu/Al. This is attributed to the large amount of medium and strong CO adsorption sites (Fig. 6(b)) where chain growth reaction occurs. Also, the chain growth probability for hydrocarbon and alcohol of the 2Co1CuAl-Xe catalyst are more similar than those of the 2Co1Cu/Al catalyst. This indicates that the cobalt sites in contact with the copper sites are predominant in the 2Co1CuAl-Xe catalyst instead of isolated cobalt sites. In order to investigate the effect of Co/Cu molar ratio, higher alcohol synthesis from syngas over CoCuAl-Xe catalysts with various Co:Cu molar ratio (3:1, 2:1, 1:1, 1:2, 1:3) was conducted at 250 °C, 30 bar. All the catalysts exhibited stable catalytic activity for 48 h and the detailed catalytic performances of CoCuAl-Xe catalyst are summarized in Table 5 . In higher alcohol synthesis, CO2, CH4, C2+H, and methanol were produced as byproducts. Comparing the reaction at 250 °C, 50 bar (Table 4), 2Co1CuAl-Xe gave lower yields of higher alcohol at 250 °C, 30 bar. This is because high reaction pressure favors CO insertion into adsorbed CHx species to form alcohol [65,66]. Although it is generally known that CO conversion in Fischer Tropsch synthesis increases with increasing pressure [67], 2Co1CuAl-Xe exhibited higher CO conversion at 250 °C, 30 bar. This might be due to the decrease of bulk diffusivity or reoxidation of cobalt species at higher reaction pressure above optimal point [68,69]. CO conversion of the CoCuAl-Xe catalysts decreased in the order of 2Co1CuAl-Xe (71.9%) >3Co1CuAl-Xe (68.5%) >1Co1CuAl-Xe (54.1%) >1Co2CuAl-Xe (41.6%) >1Co3CuAl-Xe (22.5%). Although Co sites is mainly related to CO conversion, 2Co1CuAl-Xe retained higher CO conversion than 3Co1CuAl-Xe catalyst. This is because efficient Cu2+ insertion in the CuCo2O4 spinel structure occurred in the 2Co1CuAl-Xe catalyst (Table 3), and this increased the cobalt surface area for CO dissociation. Meanwhile, CO conversion decreased rapidly in the CoCuAl-Xe catalysts with the high Cu ratio (1Co1CuAl-Xe, 1Co2CuAl-Xe, and 1Co3CuAl-Xe) because of a lack of Co sites for CO activation. The selectivity for CO2 also follows the trend of CO conversion. This might be because water formation is accompanied by CO dissociation and CO2 is mainly produced by in the water gas shift reaction (CO + H2O → CO2 + H2). On the other hand, the selectivity toward alcohol increased with the increasing Cu ratio, indicating that non-dissociative adsorption of CO on Cu sites was related to alcohol formation. The rapid increase of methanol selectivity in 1Co2CuAl-Xe and 1Co3CuAl-Xe might be attributed to the increase in the number of isolated Cu sites (Fig. 6). The quasi-ASF plots for hydrocarbon and alcohol over CoCuAl-Xe catalyst are shown in Fig. 10 . The chain growth probabilities (α) of hydrocarbon and alcohol were estimated by the slope of ln(Cmol%/n) for carbon number. Similar to the results of the previous reaction (Fig. 9), chain growth probability of hydrocarbon was higher than that of alcohol over all the catalysts. The 2Co1CuAl-Xe catalyst exhibited lower chain growth probability of alcohol at 30 bar (0.570) compared to the reaction at 50 bar (0.650), demonstrating that chain growth reaction is more favorable at higher reaction pressures [67]. It was also observed that the chain growth probability of alcohol decreased with increasing copper ratio. This might be because of the reduced number of Co sites for the chain growth reaction. The drastic decrease in the α value for alcohol in the 1Co2CuAl-Xe and 1Co3CuAl-Xe catalysts was indicative of the reduced number of Cu sites adjacent to Co sites because of Cu segregation. 3.8 Computational study To understand the reaction chemistry on Co-Cu surface, DFT calculation was performed. Two surface slab models of CoCu surface (Fig. S4(a) Co-Cu intimate surface and Fig. S4(b) Co-Cu alloy surface) were simulated to investigate the effect of metal proximity. Fig. 11 (a) shows reaction pathway of higher alcohol synthesis from syngas. It includes carbide mechanism with direct dissociation of CO and CHOH* mechanism with CHOH* as the intermediate. According to the literature [17], it is known that the FTS reaction occurs on Co sites in CoCu catalyst. Therefore, the free energy diagram for CH* formation on Co sites with different CoCu structures were compared. Fig. 11(b) shows free energy diagram for CH* formation via direct dissociation at 523 K, 30 bar. The most endergonic step in this pathway was C–O bond dissociation and is more endergonic on Co-Cu alloy surface (ΔG =0.956 eV) than Co-Cu intimate surface (ΔG =0.825 eV). This might be because the Co sites of the Co-Cu alloy surface contacts more Cu atoms, which decreases binding energy of C* and O* on Co. In case of CHOH* mechanism (Fig. 11(c)), CO* hydrogenation to CHO* is the most endergonic step and is much more endergonic on Co-Cu intimate surface (ΔG =1.219 eV) than Co-Cu alloy surface (ΔG =0.733 eV). This means that the Cu addition makes the CH* formation mechanism via CHOH* favorable, which is similar with the DFT study in Fe-Cu alloy surface [70]. Also, this implies the possibility of ethanol formation via CHOH* intermediate mechanism (CHOH* + CH* → CHCHOH*). The effect of metal proximity on chain growth and CO insertion reaction was investigated in Fig. 12 . Fig. 12(a) compares the free energy difference between the chain growth reaction (2CH* → CHCH*) and the CH* hydrogenation reaction (2CH* + 2H* → 2CH2*). It is noteworthy that the Co-Cu intimate surface exhibits broader energy gap (0.79 eV) compared to Co-Cu alloy surface (0.53 eV). This demonstrates that Co-Cu intimate surface with smaller Cu contact is more favorable for chain growth reaction. This result explains why the chain growth probability of alcohol is lower than that of hydrocarbon, demonstrating that the similarity of the chain growth probability can be a measure for metal proximity. Fig. 12(b) shows the free energies of CO insertion reaction on Co-Cu intimate and Co-Cu alloy surfaces. Both CHCO* formation and CHCHOH* formation reactions on Co-Cu alloy surface were calculated to be more exergonic than those on Co-Cu intimate surface. Therefore, it is inferred that high Co-Cu proximity promotes CO insertion reaction, resulting in higher alcohol formation. 4 Conclusion The effect of metal composition and proximity on higher alcohol synthesis from syngas was investigated. Xerogel-derived mesoporous Co-Cu-Al2O3 catalysts (CoCuAl-Xe) with various Co:Cu molar ratios (3:1, 2:1, 1:1, 1:2, and 1:3) were prepared by an epoxide-driven sol-gel method and applied to higher alcohol synthesis from syngas. The XRD results revealed that Cu addition induced the formation of the CuCo2O4 spinel structure and an excess amount of Cu induced the segregation of CuO. XPS results showed that the Co/Cu molar ratio of 2 was optimal for the substitution of Co2+ by Cu2+ in the spinel structure. It was observed that spinel structure-derived Co-rich surface in CoCuAl-Xe favored high metal dispersion and proximity. The linear relationship in the quasi-ASF plot suggested that higher alcohol synthesis was mainly governed by the CO insertion mechanism. Among the CoCuAl-Xe catalysts, 2Co1CuAl-Xe catalyst showed the highest CO conversion and higher alcohol yield. This is because the optimal Co/Cu ratio efficiently formed CuCo2O4 spinel structure and increased cobalt dispersion. Meanwhile, CoCuAl-Xe catalysts with an excess Cu ratio was unfavorable for chain growth reaction, resulting in high methanol selectivity. The computational study revealed that high Co-Cu proximity favors CO hydrogenation via CHOH* mechanism and CO insertion reaction. In conclusion, optimal Co/Cu ratio with high Co-Cu proximity is required for efficient higher alcohol synthesis from syngas. Acknowledgements This research was financially supported by the KRICT big project (SI1911-60) of the Korea Research Institute of Chemical Technology and the National Strategic Project-Carbon Reuse of the National Research Foundation of Korea funded by the Ministry of Science and ICT, Ministry of Environment and Ministry of Trade, Industry and Energy. (2017M3D8A2084041). Appendix A Supplementary data Supplementary material related to this article can be found, in the online version, at doi:https://doi.org/10.1016/j.mcat.2019.110481. Appendix A Supplementary data The following is Supplementary data to this article: References [1] M. Gupta M.L. Smith J.J. Spivey Heterogeneous catalytic conversion of dry syngas to ethanol and higher alcohols on Cu-based catalysts ACS Catal. 1 2011 641 656 [2] J. Sun Q. Cai Y. Wan S. Wan L. Wang J. Lin D. Mei Y. Wang Promotional effects of cesium promoter on higher alcohol synthesis from syngas over cesium-promoted Cu/ZnO/Al2O3 catalysts ACS Catal. 6 2016 5771 5785 [3] H.T. Luk C. Mondelli D.C. Ferré J.A. Stewart J. Pérez-Ramírez Status and prospects in higher alcohols synthesis from syngas Chem. Soc. Rev. 46 2017 1358 1426 [4] A.P.E. York T. Xiao M.L.H. Green Brief overview of the partial oxidation of methane to synthesis gas Top. Catal. 22 2003 345 358 [5] D.J. Wilhelm D.R. Simbeck A.D. Karp R.L. Dickenson Syngas production for gas-to-liquids applications: technologies, issues and outlook Fuel Process. Technol. 71 2001 139 148 [6] J. Yu D. Mao L. Han Q. Guo G. Lu Synthesis of C2 oxygenates from syngas over monodispersed SiO2 supported Rh-based catalysts: effect of calcination temperature of SiO2 Fuel Process. Technol. 106 2013 344 349 [7] Z. Fan W. Chen X. Pan X. Bao Catalytic conversion of syngas into C2 oxygenates over Rh-based catalysts-Effect of carbon supports Catal. Today 147 2009 86 93 [8] Q. Wu J.M. Christensen G.L. Chiarello L.D.L. Duchstein J.B. Wagner B. Temel J.D. Grunwaldt A.D. Jensen Supported molybdenum carbide for higher alcohol synthesis from syngas Catal. Today 215 2013 162 168 [9] H. Shou R.J. Davis Multi-product steady-state isotopic transient kinetic analysis of CO hydrogenation over supported molybdenum carbide J. Catal. 306 2013 91 99 [10] R. Xu C. Yang W. Wei W.-h. Li Y.-h. Sun T.-d. Hu Fe-modified CuMnZrO2 catalysts for higher alcohols synthesis from syngas J. Mol. Catal. A Chem. 221 2004 51 58 [11] F. Wang Y. Liu Y. Gan W. Ding W. Fang Y. Yang Study on the modification of Cu-based catalysts with cupric silicate for methanol synthesis from synthesis gas Fuel Process. Technol. 110 2013 190 196 [12] P. Forzatti E. Tronconi I. Pasquon Higher alcohol synthesis Catal. Rev. 33 1991 109 168 [13] W. Gao Y. Zhao J. Liu Q. Huang S. He C. Li J. Zhao M. Wei Catalytic conversion of syngas to mixed alcohols over CuFe-based catalysts derived from layered double hydroxides Catal. Sci. Technol. 3 2013 1324 1332 [14] M. Ding M. Qiu J. Liu Y. Li T. Wang L. Ma C. Wu Influence of manganese promoter on co-precipitated Fe-Cu based catalysts for higher alcohols synthesis Fuel 109 2013 21 27 [15] T. Ishida T. Yanagihara X. Liu H. Ohashi A. Hamasaki T. Honma H. Oji T. Yokoyama M. Tokunaga Synthesis of higher alcohols by Fischer-Tropsch synthesis over alkali metal-modified cobalt catalysts Appl. Catal. A Gen. 458 2013 145 154 [16] K. Xiao Z. Bao X. Qi X. Wang L. Zhong K. Fang M. Lin Y. Sun Structural evolution of CuFe bimetallic nanoparticles for higher alcohol synthesis J. Mol. Catal. A Chem. 378 2013 319 325 [17] J. Su Z. Zhang D. Fu D. Liu X.C. Xu B. Shi X. Wang R. Si Z. Jiang J. Xu Y.F. Han Higher alcohols synthesis from syngas over CoCu/SiO2 catalysts: dynamic structure and the role of Cu J. Catal. 336 2016 94 106 [18] X. Xiaoding E.B.M. Doesburg J.J.F. Scholten Synthesis of higher alcohols from syngas - recently patented catalysts and tentative ideas on the mechanism Catal. Today 2 1987 125 170 [19] K. Xiao Z. Bao X. Qi X. Wang L. Zhong K. Fang M. Lin Y. Sun Advances in bifunctional catalysis for higher alcohol synthesis from syngas Chin. J. Catal. 34 2013 116 129 [20] X. Ning Z. An J. He Remarkably efficient CoGa catalyst with uniformly dispersed and trapped structure for ethanol and higher alcohol synthesis from syngas J. Catal. 340 2016 236 247 [21] G. Prieto S. Beijer M.L. Smith M. He Y. Au Z. Wang D.A. Bruce K.P. De Jong J.J. Spivey P.E. De Jongh Design and synthesis of copper-cobalt catalysts for the selective conversion of synthesis gas to ethanol and higher alcohols Angew. Chem., Int. Ed. 53 2014 6397 6401 [22] X.C. Xu J. Su P. Tian D. Fu W. Dai W. Mao W.K. Yuan J. Xu Y.F. Han First-principles study of C2 oxygenates synthesis directly from syngas over CoCu bimetallic catalysts J. Phy. Chem. C 119 2015 216 227 [23] M. Zabihi F. Khorasheh J. Shayegan Supported copper and cobalt oxides on activated carbon for simultaneous oxidation of toluene and cyclohexane in air RSC Adv. 5 2015 5107 5122 [24] N.D. Subramanian G. Balaji C.S.S.R. Kumar J.J. Spivey Development of cobalt-copper nanoparticles as catalysts for higher alcohol synthesis from syngas Catal. Today 147 2009 100 106 [25] G. Liu T. Niu D. Pan F. Liu Y. Liu Preparation of bimetal Cu-Co nanoparticles supported on meso-macroporous SiO2 and their application to higher alcohols synthesis from syngas Appl. Catal. A Gen. 483 2014 10 18 [26] Z. Niu Y. Li Removal and utilization of capping agents in nanocatalysis Chem. Mater. 26 2014 72 83 [27] A.Y. Khodakov R. Bechara A. Griboval-Constant Fischer-Tropsch synthesis over silica supported cobalt catalysts: mesoporous structure versus cobalt surface density Appl. Catal. A Gen. 254 2003 273 288 [28] L. Shi W. Chu S. Deng Catalytic properties of Cu-Co catalysts supported on HNO3-pretreated CNTs for higher-alcohol synthesis J. Nat. Gas Chem. 20 2011 48 52 [29] L. Wang A. Cao G. Liu L. Zhang Y. Liu Bimetallic CuCo nanoparticles derived from hydrotalcite supported on carbon fibers for higher alcohols synthesis from syngas Appl. Surf. Sci. 360 2016 77 85 [30] A. Cao G. Liu L. Wang J. Liu Y. Yue L. Zhang Y. Liu Growing layered double hydroxides on CNTs and their catalytic performance for higher alcohol synthesis from syngas J. Mater. Sci. 51 2016 5216 5231 [31] N. Tien-Thao M. Hassan Zahedi-Niaki H. Alamdari S. Kaliaguine Effect of alkali additives over nanocrystalline Co-Cu-based perovskites as catalysts for higher-alcohol synthesis J. Catal. 245 2007 348 357 [32] N. Tien-Thao H. Alamdari M.H. Zahedi-Niaki S. Kaliaguine LaCo1-xCuxO3-δ perovskite catalysts for higher alcohol synthesis Appl. Catal. A Gen. 311 2006 204 212 [33] L. Zhao W. Li J. Zhou X. Mu K. Fang One-step synthesis of CuCo alloy/Mn2O3Al2O3 composites and their application in higher alcohol synthesis from syngas Int. J. Hydrogen Energy 42 2016 17414 17424 [34] B. Ravel M. Newville A.rtemis Athena HEPHAESTUS: data analysis for X-ray absorption spectroscopy using IFEFFIT J. Synchrotron Radiat. 12 2005 537 541 [35] A. Tavakoli M. Sohrabi A. Kargari Application of Anderson-Schulz-Flory (ASF) equation in the product distribution of slurry phase FT synthesis with nanosized iron catalysts Chem. Eng. J. 136 2008 358 363 [36] G. Kresse J. Hafner Ab initio molecular-dynamics simulation of the liquid-metal–amorphous-semiconductor transition in germanium Phys. Rev. B 49 1994 14251 14269 [37] G. Kresse J. Furthmüller Efficiency of ab-initio total energy calculations for metals and semiconductors using a plane-wave basis set Comput. Mater. Sci. 6 1996 15 50 [38] B. Hammer L.B. Hansen J.K. Nørskov Improved adsorption energetics within density-functional theory using revised Perdew-Burke-Ernzerhof functionals Phys. Rev. B 59 1999 7413 7421 [39] M. Dion H. Rydberg E. Schröder D.C. Langreth B.I. Lundqvist Van der Waals density functional for general geometries Phys. Rev. Lett. 92 2004 22 25 [40] J. Klime D.R. Bowler A. Michaelides Van der Waals density functionals applied to solids Phys. Rev. B Condens. Matter Mater. Phys. 83 2011 1 13 [41] G. Román-Pérez J.M. Soler Efficient implementation of a van der waals density functional: application to double-wall carbon nanotubes Phys. Rev. Lett. 103 2009 1 4 [42] K. Lee É.D. Murray L. Kong B.I. Lundqvist D.C. Langreth Higher-accuracy van der Waals density functional Phys. Rev. B Condens. Matter Mater. Phys. 82 2010 3 6 [43] C.J. Cramer Essentials of Computational Chemistry: Theories and Models 2nd ed. 2004 John Wiley & Sons [44] A.A. Peterson F. Abild-Pedersen F. Studt J. Rossmeisl J.K. Norskov How copper catalyzes the electroreduction of carbon dioxide into hydrocarbon fuels Energy Environ. Sci. 3 2010 1311 1315 [45] F. Studt M. Behrens E.L. Kunkes N. Thomas S. Zander A. Tarasov J. Schumann E. Frei J.B. Varley F. Abild-Pedersen J.K. Nørskov R. Schlögl The mechanism of CO and CO2 hydrogenation to methanol over Cu-based catalysts ChemCatChem 7 2015 1105 1111 [46] R. Christensen H.A. Hansen T. Vegge Identifying systematic DFT errors in catalytic reactions Catal. Sci. Technol. 5 2015 4946 4949 [47] G. Leofanti M. Padovan G. Tozzola B. Venturelli Surface area and pore texture of catalysts Catal. Today 41 1998 207 219 [48] S. Célérier C. Laberty-Robert J.W. Long K.A. Pettigrew R.M. Stroud D.R. Rolison F. Ansart P. Stevens Synthesis of La9.33Si6O26 pore-solid nanoarchitectures via epoxide-driven sol-gel chemistry Adv. Mater. 18 2006 615 618 [49] L.L. Hench J.K. West The sol-gel process Chem. Rev. 90 1990 33 72 [50] H. Cui M. Zayat D. Levy Sol-gel synthesis of nanoscaled spinels using propylene oxide as a gelation agent J. Solgel Sci. Technol. 35 2005 175 181 [51] E. van Steen G.S. Sewell R.A. Makhothe C. Micklethwaite H. Manstein M. de Lange C.T. O’Connor TPR study on the preparation of impregnated Co/SiO2 catalysts J. Catal. 229 1996 220 229 [52] Z. Wang J.J. Spivey Effect of ZrO2, Al2O3 and La2O3 on cobalt-copper catalysts for higher alcohols synthesis Appl. Catal. A Gen. 507 2015 75 81 [53] F. Fayaz H.T. Danh C. Nguyen-Huy K.B. Vu B. Abdullah D.V.N. Vo Promotional effect of Ce-dopant on Al2O3-supported Co catalysts for syngas production via CO2 reforming of ethanol Procedia. Eng. 148 2016 646 653 [54] A. Cao G. Liu Y. Yue L. Zhang Y. Liu Nanoparticles of Cu-Co alloy derived from layered double hydroxides and their catalytic performance for higher alcohol synthesis from syngas RSC Adv. 5 2015 58801 58812 [55] L.-C. Chen H. Cheng C.-W. Chiang S.D. Lin Sustainable hydrogen production by ethanol steam reforming using a partially reduced copper-nickel oxide catalyst ChemSusChem 8 2015 1787 1793 [56] M.F. Luo P. Fang M. He Y.L. Xie In situ XRD, Raman, and TPR studies of CuO/Al2O3 catalysts for CO oxidation J. Mol. Catal. A Chem. 239 2005 243 248 [57] J.H. Lee K.H. Reddy J.S. Jung E.H. Yang D.J. Moon Role of support on higher alcohol synthesis from syngas Appl. Catal. A Gen. 480 2014 128 133 [58] M. Zhou L. Cai M. Bajdich M. García-Melchor H. Li J. He J. Wilcox W. Wu A. Vojvodic X. Zheng Enhancing catalytic CO oxidation over Co3O4 nanowires by substituting Co2+ with Cu2+ ACS Catal. 5 2015 4485 4491 [59] Y.J. Sa K. Kwon J.Y. Cheon F. Kleitz S.H. Joo Ordered mesoporous Co3O4 spinels as stable, bifunctional, noble metal-free oxygen electrocatalysts J. Mater. Chem. A Mater. Energy Sustain. 1 2013 9992 10001 [60] J. Rosen G.S. Hutchings F. Jiao Synthesis, structure, and photocatalytic properties of ordered mesoporous metal-doped Co3O4 J. Catal. 310 2014 2 9 [61] J. Wang P.A. Chernavskii A.Y. Khodakov Y. Wang Structure and catalytic performance of alumina-supported copper-cobalt catalysts for carbon monoxide hydrogenation J. Catal. 286 2012 51 61 [62] L. Zhao J. Duan Q. Zhang Y. Li K. Fang Preparation, structural characteristics, and catalytic performance of Cu-Co alloy supported on Mn-Al oxide for higher alcohol synthesis via syngas Ind. Eng. Chem. Res. 57 2018 14957 14966 [63] M. Oezaslan F. Hasché P. Strasser In situ observation of bimetallic alloy nanoparticle formation and growth using high-temperature XRD Chem. Mater. 23 2011 2159 2165 [64] Y. Xiang N. Kruse Cobalt-copper based catalysts for higher terminal alcohols synthesis via Fischer-Tropsch reaction J. Energy Chem. 25 2016 895 906 [65] J. Hu Y. Wang C. Cao D.C. Elliott D.J. Stevens J.F. White Conversion of biomass-derived syngas to alcohols and C2 oxygenates using supported Rh catalysts in a microchannel reactor Catal. Today 120 2007 90 95 [66] V. Mahdavi M.H. Peyrovi M. Islami J.Y. Mehr Synthesis of higher alcohols from syngas over Cu-Co2O3/ZnO, Al2O3 catalyst Appl. Catal. A Gen. 281 2005 259 265 [67] Z. Yan Z. Wang D.B. Bukur D.W. Goodman Fischer-Tropsch synthesis on a model Co/SiO2 catalyst J. Catal. 268 2009 196 200 [68] X. Huang C.B. Roberts Selective Fischer-Tropsch synthesis over an Al2O3 supported cobalt catalyst in supercritical hexane Fuel Process. Technol. 83 2003 81 99 [69] G. Jacobs P.M. Patterson Y. Zhang T. Das J. Li B.H. Davis Fischer-Tropsch synthesis: deactivation of noble metal-promoted Co/Al2O3 catalysts Appl. Catal. A Gen. 233 2002 215 226 [70] X. Nie H. Wang M.J. Janik Y. Chen X. Guo C. Song Mechanistic insight into C–C coupling over Fe–Cu bimetallic catalysts in CO2 hydrogenation J. Phys. Chem. C 121 2017 13164 13174",
      "scopus-id": "85068171920",
      "coredata": {
        "eid": "1-s2.0-S2468823119303165",
        "dc:description": "To improve metal proximity of Co-Cu-Al2O3 catalyst, xerogel-derived mesoporous Co-Cu-Al2O3 catalysts (CoCuAl-Xe) with various Co:Cu molar ratios (3:1, 2:1, 1:1, 1:2, and 1:3) were prepared by an epoxide-driven sol-gel method and applied to higher alcohol synthesis from syngas. The CoCuAl-Xe catalyst induced the formation of a composite spinel structure containing Co, Cu, and Al. At the optimal Co/Cu ratio, the Cu atoms efficiently substituted the Co2+ ions in Co3O4 to form the CuCo2O4 spinel structure. However, an excess amount of Cu induced segregation of CuO, leading to decreasing Co-Cu proximity. In higher alcohol synthesis from syngas, all the catalysts showed the linear quasi-Anderson Schulz Flory plot of carbon-containing products, which was attributed to the CO insertion mechanism in higher alcohol synthesis. Among the xerogel catalysts, 2Co1CuAl-Xe exhibited the highest CO conversion and higher alcohol yield. The Co-rich CoCuAl-Xe catalyst was disadvantageous in terms of alcohol selectivity because of a lack of CO insertion sites, and the Cu-rich one was disadvantageous in CO dissociation and led to methanol formation. The computational study suggests that high Co-Cu proximity favors CHOH* mechanism for CH* formation and promotes CO insertion reaction. Consequently, it was found that the optimal Co/Cu ratio and high Co-Cu proximity is required for high catalytic activity in higher alcohol synthesis.",
        "openArchiveArticle": "false",
        "prism:coverDate": "2019-10-31",
        "openaccessUserLicense": null,
        "prism:aggregationType": "Journal",
        "prism:url": "https://api.elsevier.com/content/article/pii/S2468823119303165",
        "dc:creator": [
          {
            "@_fa": "true",
            "$": "Han, Seung Ju"
          },
          {
            "@_fa": "true",
            "$": "Park, Gyungah"
          },
          {
            "@_fa": "true",
            "$": "Lee, Yun-Jo"
          },
          {
            "@_fa": "true",
            "$": "Jun, Ki-Won"
          },
          {
            "@_fa": "true",
            "$": "Kim, Seok Ki"
          },
          {
            "@_fa": "true",
            "$": "Kim, Yong Tae"
          },
          {
            "@_fa": "true",
            "$": "Kwak, Geunjae"
          }
        ],
        "link": [
          {
            "@_fa": "true",
            "@rel": "self",
            "@href": "https://api.elsevier.com/content/article/pii/S2468823119303165"
          },
          {
            "@_fa": "true",
            "@rel": "scidir",
            "@href": "https://www.sciencedirect.com/science/article/pii/S2468823119303165"
          }
        ],
        "dc:format": "application/json",
        "openaccessType": null,
        "pii": "S2468-8231(19)30316-5",
        "prism:volume": "475",
        "articleNumber": "110481",
        "prism:publisher": "Elsevier B.V.",
        "dc:title": "Higher alcohol synthesis from syngas over xerogel-derived Co-Cu-Al2O3 catalyst with an enhanced metal proximity",
        "prism:copyright": "© 2019 Elsevier B.V. All rights reserved.",
        "openaccess": "0",
        "prism:issn": "24688231",
        "dcterms:subject": [
          {
            "@_fa": "true",
            "$": "Higher alcohol synthesis"
          },
          {
            "@_fa": "true",
            "$": "Co-Cu-Al2O3 catalyst"
          },
          {
            "@_fa": "true",
            "$": "Xerogel catalyst"
          },
          {
            "@_fa": "true",
            "$": "Co-Cu proximity"
          }
        ],
        "openaccessArticle": "false",
        "prism:publicationName": "Molecular Catalysis",
        "openaccessSponsorType": null,
        "prism:pageRange": "110481",
        "pubType": "fla",
        "prism:coverDisplayDate": "October 2019",
        "prism:doi": "10.1016/j.mcat.2019.110481",
        "prism:startingPage": "110481",
        "dc:identifier": "doi:10.1016/j.mcat.2019.110481",
        "openaccessSponsorName": null
      },
      "objects": {
        "object": [
          {
            "@category": "thumbnail",
            "@height": "75",
            "@width": "219",
            "@_fa": "true",
            "$": "https://api.elsevier.com/content/object/eid/1-s2.0-S2468823119303165-ga1.sml?httpAccept=%2A%2F%2A",
            "@multimediatype": "GIF image file",
            "@type": "IMAGE-THUMBNAIL",
            "@size": "10741",
            "@ref": "ga1",
            "@mimetype": "image/gif"
          },
          {
            "@category": "thumbnail",
            "@height": "97",
            "@width": "219",
            "@_fa": "true",
            "$": "https://api.elsevier.com/content/object/eid/1-s2.0-S2468823119303165-gr1.sml?httpAccept=%2A%2F%2A",
            "@multimediatype": "GIF image file",
            "@type": "IMAGE-THUMBNAIL",
            "@size": "6695",
            "@ref": "gr1",
            "@mimetype": "image/gif"
          },
          {
            "@category": "thumbnail",
            "@height": "146",
            "@width": "219",
            "@_fa": "true",
            "$": "https://api.elsevier.com/content/object/eid/1-s2.0-S2468823119303165-gr10.sml?httpAccept=%2A%2F%2A",
            "@multimediatype": "GIF image file",
            "@type": "IMAGE-THUMBNAIL",
            "@size": "7750",
            "@ref": "gr10",
            "@mimetype": "image/gif"
          },
          {
            "@category": "thumbnail",
            "@height": "156",
            "@width": "219",
            "@_fa": "true",
            "$": "https://api.elsevier.com/content/object/eid/1-s2.0-S2468823119303165-gr11.sml?httpAccept=%2A%2F%2A",
            "@multimediatype": "GIF image file",
            "@type": "IMAGE-THUMBNAIL",
            "@size": "8916",
            "@ref": "gr11",
            "@mimetype": "image/gif"
          },
          {
            "@category": "thumbnail",
            "@height": "92",
            "@width": "219",
            "@_fa": "true",
            "$": "https://api.elsevier.com/content/object/eid/1-s2.0-S2468823119303165-gr12.sml?httpAccept=%2A%2F%2A",
            "@multimediatype": "GIF image file",
            "@type": "IMAGE-THUMBNAIL",
            "@size": "5614",
            "@ref": "gr12",
            "@mimetype": "image/gif"
          },
          {
            "@category": "thumbnail",
            "@height": "93",
            "@width": "219",
            "@_fa": "true",
            "$": "https://api.elsevier.com/content/object/eid/1-s2.0-S2468823119303165-gr2.sml?httpAccept=%2A%2F%2A",
            "@multimediatype": "GIF image file",
            "@type": "IMAGE-THUMBNAIL",
            "@size": "7551",
            "@ref": "gr2",
            "@mimetype": "image/gif"
          },
          {
            "@category": "thumbnail",
            "@height": "107",
            "@width": "219",
            "@_fa": "true",
            "$": "https://api.elsevier.com/content/object/eid/1-s2.0-S2468823119303165-gr3.sml?httpAccept=%2A%2F%2A",
            "@multimediatype": "GIF image file",
            "@type": "IMAGE-THUMBNAIL",
            "@size": "13967",
            "@ref": "gr3",
            "@mimetype": "image/gif"
          },
          {
            "@category": "thumbnail",
            "@height": "116",
            "@width": "219",
            "@_fa": "true",
            "$": "https://api.elsevier.com/content/object/eid/1-s2.0-S2468823119303165-gr4.sml?httpAccept=%2A%2F%2A",
            "@multimediatype": "GIF image file",
            "@type": "IMAGE-THUMBNAIL",
            "@size": "7895",
            "@ref": "gr4",
            "@mimetype": "image/gif"
          },
          {
            "@category": "thumbnail",
            "@height": "115",
            "@width": "219",
            "@_fa": "true",
            "$": "https://api.elsevier.com/content/object/eid/1-s2.0-S2468823119303165-gr5.sml?httpAccept=%2A%2F%2A",
            "@multimediatype": "GIF image file",
            "@type": "IMAGE-THUMBNAIL",
            "@size": "5657",
            "@ref": "gr5",
            "@mimetype": "image/gif"
          },
          {
            "@category": "thumbnail",
            "@height": "93",
            "@width": "219",
            "@_fa": "true",
            "$": "https://api.elsevier.com/content/object/eid/1-s2.0-S2468823119303165-gr6.sml?httpAccept=%2A%2F%2A",
            "@multimediatype": "GIF image file",
            "@type": "IMAGE-THUMBNAIL",
            "@size": "6520",
            "@ref": "gr6",
            "@mimetype": "image/gif"
          },
          {
            "@category": "thumbnail",
            "@height": "164",
            "@width": "190",
            "@_fa": "true",
            "$": "https://api.elsevier.com/content/object/eid/1-s2.0-S2468823119303165-gr7.sml?httpAccept=%2A%2F%2A",
            "@multimediatype": "GIF image file",
            "@type": "IMAGE-THUMBNAIL",
            "@size": "5385",
            "@ref": "gr7",
            "@mimetype": "image/gif"
          },
          {
            "@category": "thumbnail",
            "@height": "107",
            "@width": "219",
            "@_fa": "true",
            "$": "https://api.elsevier.com/content/object/eid/1-s2.0-S2468823119303165-gr8.sml?httpAccept=%2A%2F%2A",
            "@multimediatype": "GIF image file",
            "@type": "IMAGE-THUMBNAIL",
            "@size": "15850",
            "@ref": "gr8",
            "@mimetype": "image/gif"
          },
          {
            "@category": "thumbnail",
            "@height": "70",
            "@width": "219",
            "@_fa": "true",
            "$": "https://api.elsevier.com/content/object/eid/1-s2.0-S2468823119303165-gr9.sml?httpAccept=%2A%2F%2A",
            "@multimediatype": "GIF image file",
            "@type": "IMAGE-THUMBNAIL",
            "@size": "4605",
            "@ref": "gr9",
            "@mimetype": "image/gif"
          },
          {
            "@category": "standard",
            "@height": "170",
            "@width": "500",
            "@_fa": "true",
            "$": "https://api.elsevier.com/content/object/eid/1-s2.0-S2468823119303165-ga1.jpg?httpAccept=%2A%2F%2A",
            "@multimediatype": "JPEG image file",
            "@type": "IMAGE-DOWNSAMPLED",
            "@size": "31264",
            "@ref": "ga1",
            "@mimetype": "image/jpeg"
          },
          {
            "@category": "standard",
            "@height": "300",
            "@width": "678",
            "@_fa": "true",
            "$": "https://api.elsevier.com/content/object/eid/1-s2.0-S2468823119303165-gr1.jpg?httpAccept=%2A%2F%2A",
            "@multimediatype": "JPEG image file",
            "@type": "IMAGE-DOWNSAMPLED",
            "@size": "53697",
            "@ref": "gr1",
            "@mimetype": "image/jpeg"
          },
          {
            "@category": "standard",
            "@height": "503",
            "@width": "753",
            "@_fa": "true",
            "$": "https://api.elsevier.com/content/object/eid/1-s2.0-S2468823119303165-gr10.jpg?httpAccept=%2A%2F%2A",
            "@multimediatype": "JPEG image file",
            "@type": "IMAGE-DOWNSAMPLED",
            "@size": "74785",
            "@ref": "gr10",
            "@mimetype": "image/jpeg"
          },
          {
            "@category": "standard",
            "@height": "483",
            "@width": "678",
            "@_fa": "true",
            "$": "https://api.elsevier.com/content/object/eid/1-s2.0-S2468823119303165-gr11.jpg?httpAccept=%2A%2F%2A",
            "@multimediatype": "JPEG image file",
            "@type": "IMAGE-DOWNSAMPLED",
            "@size": "65440",
            "@ref": "gr11",
            "@mimetype": "image/jpeg"
          },
          {
            "@category": "standard",
            "@height": "283",
            "@width": "678",
            "@_fa": "true",
            "$": "https://api.elsevier.com/content/object/eid/1-s2.0-S2468823119303165-gr12.jpg?httpAccept=%2A%2F%2A",
            "@multimediatype": "JPEG image file",
            "@type": "IMAGE-DOWNSAMPLED",
            "@size": "37887",
            "@ref": "gr12",
            "@mimetype": "image/jpeg"
          },
          {
            "@category": "standard",
            "@height": "289",
            "@width": "678",
            "@_fa": "true",
            "$": "https://api.elsevier.com/content/object/eid/1-s2.0-S2468823119303165-gr2.jpg?httpAccept=%2A%2F%2A",
            "@multimediatype": "JPEG image file",
            "@type": "IMAGE-DOWNSAMPLED",
            "@size": "57002",
            "@ref": "gr2",
            "@mimetype": "image/jpeg"
          },
          {
            "@category": "standard",
            "@height": "331",
            "@width": "678",
            "@_fa": "true",
            "$": "https://api.elsevier.com/content/object/eid/1-s2.0-S2468823119303165-gr3.jpg?httpAccept=%2A%2F%2A",
            "@multimediatype": "JPEG image file",
            "@type": "IMAGE-DOWNSAMPLED",
            "@size": "63353",
            "@ref": "gr3",
            "@mimetype": "image/jpeg"
          },
          {
            "@category": "standard",
            "@height": "359",
            "@width": "678",
            "@_fa": "true",
            "$": "https://api.elsevier.com/content/object/eid/1-s2.0-S2468823119303165-gr4.jpg?httpAccept=%2A%2F%2A",
            "@multimediatype": "JPEG image file",
            "@type": "IMAGE-DOWNSAMPLED",
            "@size": "64460",
            "@ref": "gr4",
            "@mimetype": "image/jpeg"
          },
          {
            "@category": "standard",
            "@height": "356",
            "@width": "678",
            "@_fa": "true",
            "$": "https://api.elsevier.com/content/object/eid/1-s2.0-S2468823119303165-gr5.jpg?httpAccept=%2A%2F%2A",
            "@multimediatype": "JPEG image file",
            "@type": "IMAGE-DOWNSAMPLED",
            "@size": "47678",
            "@ref": "gr5",
            "@mimetype": "image/jpeg"
          },
          {
            "@category": "standard",
            "@height": "289",
            "@width": "678",
            "@_fa": "true",
            "$": "https://api.elsevier.com/content/object/eid/1-s2.0-S2468823119303165-gr6.jpg?httpAccept=%2A%2F%2A",
            "@multimediatype": "JPEG image file",
            "@type": "IMAGE-DOWNSAMPLED",
            "@size": "52246",
            "@ref": "gr6",
            "@mimetype": "image/jpeg"
          },
          {
            "@category": "standard",
            "@height": "324",
            "@width": "376",
            "@_fa": "true",
            "$": "https://api.elsevier.com/content/object/eid/1-s2.0-S2468823119303165-gr7.jpg?httpAccept=%2A%2F%2A",
            "@multimediatype": "JPEG image file",
            "@type": "IMAGE-DOWNSAMPLED",
            "@size": "20460",
            "@ref": "gr7",
            "@mimetype": "image/jpeg"
          },
          {
            "@category": "standard",
            "@height": "332",
            "@width": "678",
            "@_fa": "true",
            "$": "https://api.elsevier.com/content/object/eid/1-s2.0-S2468823119303165-gr8.jpg?httpAccept=%2A%2F%2A",
            "@multimediatype": "JPEG image file",
            "@type": "IMAGE-DOWNSAMPLED",
            "@size": "65114",
            "@ref": "gr8",
            "@mimetype": "image/jpeg"
          },
          {
            "@category": "standard",
            "@height": "239",
            "@width": "753",
            "@_fa": "true",
            "$": "https://api.elsevier.com/content/object/eid/1-s2.0-S2468823119303165-gr9.jpg?httpAccept=%2A%2F%2A",
            "@multimediatype": "JPEG image file",
            "@type": "IMAGE-DOWNSAMPLED",
            "@size": "40744",
            "@ref": "gr9",
            "@mimetype": "image/jpeg"
          },
          {
            "@category": "standard",
            "@_fa": "true",
            "$": "https://api.elsevier.com/content/object/eid/1-s2.0-S2468823119303165-mmc1.doc?httpAccept=%2A%2F%2A",
            "@multimediatype": "Microsoft Word file",
            "@type": "APPLICATION",
            "@size": "616960",
            "@ref": "mmc1",
            "@mimetype": "application/word"
          },
          {
            "@category": "thumbnail",
            "@height": "43",
            "@width": "250",
            "@_fa": "true",
            "$": "https://api.elsevier.com/content/object/eid/1-s2.0-S2468823119303165-si1.gif?httpAccept=%2A%2F%2A",
            "@multimediatype": "GIF image file",
            "@type": "ALTIMG",
            "@size": "840",
            "@ref": "si1",
            "@mimetype": "image/gif"
          },
          {
            "@category": "thumbnail",
            "@height": "47",
            "@width": "268",
            "@_fa": "true",
            "$": "https://api.elsevier.com/content/object/eid/1-s2.0-S2468823119303165-si2.gif?httpAccept=%2A%2F%2A",
            "@multimediatype": "GIF image file",
            "@type": "ALTIMG",
            "@size": "886",
            "@ref": "si2",
            "@mimetype": "image/gif"
          },
          {
            "@category": "thumbnail",
            "@height": "46",
            "@width": "262",
            "@_fa": "true",
            "$": "https://api.elsevier.com/content/object/eid/1-s2.0-S2468823119303165-si3.gif?httpAccept=%2A%2F%2A",
            "@multimediatype": "GIF image file",
            "@type": "ALTIMG",
            "@size": "869",
            "@ref": "si3",
            "@mimetype": "image/gif"
          },
          {
            "@category": "thumbnail",
            "@height": "46",
            "@width": "225",
            "@_fa": "true",
            "$": "https://api.elsevier.com/content/object/eid/1-s2.0-S2468823119303165-si4.gif?httpAccept=%2A%2F%2A",
            "@multimediatype": "GIF image file",
            "@type": "ALTIMG",
            "@size": "754",
            "@ref": "si4",
            "@mimetype": "image/gif"
          },
          {
            "@category": "standard",
            "@_fa": "true",
            "$": "https://api.elsevier.com/content/object/eid/1-s2.0-S2468823119303165-am.pdf?httpAccept=%2A%2F%2A",
            "@multimediatype": "Acrobat PDF file",
            "@type": "AAM-PDF",
            "@size": "1167836",
            "@ref": "am",
            "@mimetype": "application/pdf"
          }
        ]
      },
      "link": {
        "@rel": "abstract",
        "@href": "https://api.elsevier.com/content/abstract/scopus_id/85068171920"
      }
    }
  }
}