{
  "metadata": {
    "title": "The effect of syngas composition on the Fischer Tropsch synthesis over three-dimensionally ordered macro-porous iron based catalyst",
    "authors": "; ; ",
    "journal": "Molecular Catalysis",
    "date": "2017-10-31",
    "doi": "10.1016/j.mcat.2017.07.025",
    "abstract": "",
    "uri": "https://api.elsevier.com/content/article/pii/S2468823117304340",
    "pii": "S2468823117304340"
  },
  "fulltext": {
    "full-text-retrieval-response": {
      "scopus-eid": "2-s2.0-85029596639",
      "originalText": "serial JL 315758 291210 291744 291790 291809 31 Molecular Catalysis MOLECULARCATALYSIS 2017-08-08 2017-08-08 2017-08-08 2017-08-08 2018-07-09T20:04:52 1-s2.0-S2468823117304340 S2468-8231(17)30434-0 S2468823117304340 10.1016/j.mcat.2017.07.025 S300 S300.2 FULL-TEXT 1-s2.0-S2468823117X0014X 2021-03-09T13:39:01.668246Z 0 0 20171001 20171031 2017 2017-08-08T03:59:04.8418Z absattachment articleinfo articletitlenorm authfirstinitialnorm authfirstsurnamenorm cid cids contenttype copyright crossmark dateloaded dateloadedtxt datesearch datesort dateupdated dco docsubtype doctype doi eid ewtransactionid hubeid indexeddate issn issnnorm itemstage itemtransactionid itemweight openaccess openarchive pg pgfirst pglast pii piinorm pubdateend pubdatestart pubdatetxt pubyr sectiontitle sortorder srctitle srctitlenorm srctype ssids alllist content subj subheadings suppl tomb volfirst volissue volumelist webpdf webpdfpagecount yearnav figure table e-component body mmlmath acknowledge affil appendices articletitle auth authfirstini authfull authkeywords authlast grantnumber grantsponsor grantsponsorid highlightsabst primabst pubtype ref specialabst 2468-8231 24688231 true 440 440 C Volume 440 22 175 183 175 183 201710 October 2017 2017-10-01 2017-10-31 2017 Regular Papers article fla © 2017 Elsevier B.V. All rights reserved. EFFECTSYNGASCOMPOSITIONFISCHERTROPSCHSYNTHESISOVERTHREEDIMENSIONALLYORDEREDMACROPOROUSIRONBASEDCATALYST HAN J 1 Introduction 2 Experimental 2.1 Catalyst preparation 2.2 Catalyst characterization 2.3 Reactor system and operation procedure 3 Results and discussion 3.1 Morphology and structure of 3DOM Fe catalyst 3.2 BET characterization 3.3 HRTEM characterization 3.4 XRD characterization 3.5 XPS characterization 3.6 DRIFTS characterization 3.7 FT performance of the 3DOM Fe catalyst 3.7.1 The activity 3.7.2 Product selectivity 3.7.3 Liquid hydrocarbon quality 4 Conclusions Acknowledgements Appendix A Supplementary data References JI 2017 224 229 L KIM 2016 301 312 Y GORIMBO 2017 1 11 J LU 2017 369 384 Y RICHARDSON 2015 213 250 Y RECENTADVANCESINTHERMOCHEMICALCONVERSIONBIOMASS CHAPTER8BIOMASSGASIFICATIONPRODUCESYNGASA2PANDEYASHOK AHMAD 2016 1333 1347 A POUR 2010 1025 1032 A LI 2014 130 135 Y GAO 2016 510 516 X DUAN 2016 311 317 X XIONG 2015 687 696 H ALDOSSARY 2015 109 117 M GUO 2015 51 61 H CRUZ 2015 72 83 M HOU 2015 878 890 H ZHANG 2012 16 25 X JUNG 2016 104280 104293 J WEI 2015 37 45 Y XIE 2016 17 26 S LU 2012 48 58 Y XU 2010 136 142 J RYTTER 2015 478 499 E PATRA 2016 365 377 A CHEN 2015 10389 M SUN 2016 138 145 R YAN 2015 170 175 M BUKUR 1995 353 365 D DING 2015 982 989 M KEYVANLOO 2015 33 47 K DAD 2015 101 109 M WANG 2013 578 584 H PAREDESNUNEZ 2015 178 183 A LORITO 2016 56 61 D MAO 2013 314 321 W SARKARI 2014 163 170 M BRUNNER 2015 1972 1977 K TODIC 2016 28 39 B ORDOMSKY 2016 V MAI 2015 76 80 K CHEW 2016 85 92 L OKESON 2016 67 74 T VISCONTI 2017 530 542 C XING 2015 41 46 C PENDYALA 2015 45 53 V HANX2017X175 HANX2017X175X183 HANX2017X175XJ HANX2017X175X183XJ https://vtw.elsevier.com/content/oragreement/10131 CHU_DOE publishAcceptedManuscriptIndexable 2018-08-08T00:00:00Z http://www.elsevier.com/open-access/userlicense/1.0/ 2018-08-08T00:00:00Z http://creativecommons.org/licenses/by-nc-nd/4.0/ © 2017 Elsevier B.V. All rights reserved. item S2468-8231(17)30434-0 S2468823117304340 1-s2.0-S2468823117304340 10.1016/j.mcat.2017.07.025 315758 2020-08-17T02:46:43.656654Z 2017-10-01 2017-10-31 1-s2.0-S2468823117304340-main.pdf https://s3-eu-west-1.amazonaws.com/prod-ucs-content-store-eu-west/content/pii:S2468823117304340/MAIN/application/pdf/bd8adffe2ba7fad6d4e63834c808ea2c/main.pdf https://s3.amazonaws.com/prod-ucs-content-store-us-east/content/pii:S2468823117304340/MAIN/application/pdf/bd8adffe2ba7fad6d4e63834c808ea2c/main.pdf main.pdf pdf true 2304263 MAIN 9 1-s2.0-S2468823117304340-main_1.png https://s3-eu-west-1.amazonaws.com/prod-ucs-content-store-eu-west/content/pii:S2468823117304340/PREVIEW/image/png/f1728f917e6c9774de7cdf9aae5a7dab/main_1.png https://s3.amazonaws.com/prod-ucs-content-store-us-east/content/pii:S2468823117304340/PREVIEW/image/png/f1728f917e6c9774de7cdf9aae5a7dab/main_1.png main_1.png png 55280 849 656 IMAGE-WEB-PDF 1 1-s2.0-S2468823117304340-fx1.sml https://s3-eu-west-1.amazonaws.com/prod-ucs-content-store-eu-west/content/pii:S2468823117304340/fx1/THUMBNAIL/image/gif/534e51dce8407f42f439512f40f0b07c/fx1.sml https://s3.amazonaws.com/prod-ucs-content-store-us-east/content/pii:S2468823117304340/fx1/THUMBNAIL/image/gif/534e51dce8407f42f439512f40f0b07c/fx1.sml fx1 true fx1.sml sml 9367 88 219 IMAGE-THUMBNAIL 1-s2.0-S2468823117304340-gr1.sml https://s3-eu-west-1.amazonaws.com/prod-ucs-content-store-eu-west/content/pii:S2468823117304340/gr1/THUMBNAIL/image/gif/dc4f3d9cecc9cfcf0281c557ad4105fc/gr1.sml https://s3.amazonaws.com/prod-ucs-content-store-us-east/content/pii:S2468823117304340/gr1/THUMBNAIL/image/gif/dc4f3d9cecc9cfcf0281c557ad4105fc/gr1.sml gr1 gr1.sml sml 12417 87 219 IMAGE-THUMBNAIL 1-s2.0-S2468823117304340-gr2.sml https://s3-eu-west-1.amazonaws.com/prod-ucs-content-store-eu-west/content/pii:S2468823117304340/gr2/THUMBNAIL/image/gif/44489d3d8cc1cf17c8674cf5e3b9232e/gr2.sml https://s3.amazonaws.com/prod-ucs-content-store-us-east/content/pii:S2468823117304340/gr2/THUMBNAIL/image/gif/44489d3d8cc1cf17c8674cf5e3b9232e/gr2.sml gr2 gr2.sml sml 16289 145 219 IMAGE-THUMBNAIL 1-s2.0-S2468823117304340-gr3.sml https://s3-eu-west-1.amazonaws.com/prod-ucs-content-store-eu-west/content/pii:S2468823117304340/gr3/THUMBNAIL/image/gif/acf5710aab866ecfa1d1312c172d7c04/gr3.sml https://s3.amazonaws.com/prod-ucs-content-store-us-east/content/pii:S2468823117304340/gr3/THUMBNAIL/image/gif/acf5710aab866ecfa1d1312c172d7c04/gr3.sml gr3 gr3.sml sml 6638 164 142 IMAGE-THUMBNAIL 1-s2.0-S2468823117304340-gr4.sml https://s3-eu-west-1.amazonaws.com/prod-ucs-content-store-eu-west/content/pii:S2468823117304340/gr4/THUMBNAIL/image/gif/800b3a3f279405246276b147ffa84025/gr4.sml https://s3.amazonaws.com/prod-ucs-content-store-us-east/content/pii:S2468823117304340/gr4/THUMBNAIL/image/gif/800b3a3f279405246276b147ffa84025/gr4.sml gr4 gr4.sml sml 7418 164 212 IMAGE-THUMBNAIL 1-s2.0-S2468823117304340-gr5.sml https://s3-eu-west-1.amazonaws.com/prod-ucs-content-store-eu-west/content/pii:S2468823117304340/gr5/THUMBNAIL/image/gif/cb005f9a597c8b7b4604ecea26b244b0/gr5.sml https://s3.amazonaws.com/prod-ucs-content-store-us-east/content/pii:S2468823117304340/gr5/THUMBNAIL/image/gif/cb005f9a597c8b7b4604ecea26b244b0/gr5.sml gr5 gr5.sml sml 6564 164 212 IMAGE-THUMBNAIL 1-s2.0-S2468823117304340-gr6.sml https://s3-eu-west-1.amazonaws.com/prod-ucs-content-store-eu-west/content/pii:S2468823117304340/gr6/THUMBNAIL/image/gif/1ead8b0b3425d7897b02071b7846d54c/gr6.sml https://s3.amazonaws.com/prod-ucs-content-store-us-east/content/pii:S2468823117304340/gr6/THUMBNAIL/image/gif/1ead8b0b3425d7897b02071b7846d54c/gr6.sml gr6 gr6.sml sml 8448 164 213 IMAGE-THUMBNAIL 1-s2.0-S2468823117304340-gr7.sml https://s3-eu-west-1.amazonaws.com/prod-ucs-content-store-eu-west/content/pii:S2468823117304340/gr7/THUMBNAIL/image/gif/f0d2666cd0c3051dd9c9ef0e5926036d/gr7.sml https://s3.amazonaws.com/prod-ucs-content-store-us-east/content/pii:S2468823117304340/gr7/THUMBNAIL/image/gif/f0d2666cd0c3051dd9c9ef0e5926036d/gr7.sml gr7 gr7.sml sml 6463 164 194 IMAGE-THUMBNAIL 1-s2.0-S2468823117304340-fx1.jpg https://s3-eu-west-1.amazonaws.com/prod-ucs-content-store-eu-west/content/pii:S2468823117304340/fx1/DOWNSAMPLED/image/jpeg/f66907ef6b8c886034eef51c7b3e0ce2/fx1.jpg https://s3.amazonaws.com/prod-ucs-content-store-us-east/content/pii:S2468823117304340/fx1/DOWNSAMPLED/image/jpeg/f66907ef6b8c886034eef51c7b3e0ce2/fx1.jpg fx1 true fx1.jpg jpg 32585 200 500 IMAGE-DOWNSAMPLED 1-s2.0-S2468823117304340-gr1.jpg https://s3-eu-west-1.amazonaws.com/prod-ucs-content-store-eu-west/content/pii:S2468823117304340/gr1/DOWNSAMPLED/image/jpeg/08b69827cc65c5a0a137cb8cbb7762a0/gr1.jpg https://s3.amazonaws.com/prod-ucs-content-store-us-east/content/pii:S2468823117304340/gr1/DOWNSAMPLED/image/jpeg/08b69827cc65c5a0a137cb8cbb7762a0/gr1.jpg gr1 gr1.jpg jpg 45922 225 565 IMAGE-DOWNSAMPLED 1-s2.0-S2468823117304340-gr2.jpg https://s3-eu-west-1.amazonaws.com/prod-ucs-content-store-eu-west/content/pii:S2468823117304340/gr2/DOWNSAMPLED/image/jpeg/aee59842d4aff96261e7f296b85bc66c/gr2.jpg https://s3.amazonaws.com/prod-ucs-content-store-us-east/content/pii:S2468823117304340/gr2/DOWNSAMPLED/image/jpeg/aee59842d4aff96261e7f296b85bc66c/gr2.jpg gr2 gr2.jpg jpg 69477 374 565 IMAGE-DOWNSAMPLED 1-s2.0-S2468823117304340-gr3.jpg https://s3-eu-west-1.amazonaws.com/prod-ucs-content-store-eu-west/content/pii:S2468823117304340/gr3/DOWNSAMPLED/image/jpeg/ee5c4fa9bd68cb952e7c4437a7f9aab2/gr3.jpg https://s3.amazonaws.com/prod-ucs-content-store-us-east/content/pii:S2468823117304340/gr3/DOWNSAMPLED/image/jpeg/ee5c4fa9bd68cb952e7c4437a7f9aab2/gr3.jpg gr3 gr3.jpg jpg 114813 868 753 IMAGE-DOWNSAMPLED 1-s2.0-S2468823117304340-gr4.jpg https://s3-eu-west-1.amazonaws.com/prod-ucs-content-store-eu-west/content/pii:S2468823117304340/gr4/DOWNSAMPLED/image/jpeg/af5bbb8387e1401802c9ff568a8525b3/gr4.jpg https://s3.amazonaws.com/prod-ucs-content-store-us-east/content/pii:S2468823117304340/gr4/DOWNSAMPLED/image/jpeg/af5bbb8387e1401802c9ff568a8525b3/gr4.jpg gr4 gr4.jpg jpg 26763 290 376 IMAGE-DOWNSAMPLED 1-s2.0-S2468823117304340-gr5.jpg https://s3-eu-west-1.amazonaws.com/prod-ucs-content-store-eu-west/content/pii:S2468823117304340/gr5/DOWNSAMPLED/image/jpeg/5d31030db7a0483803d6f8b76a7cb766/gr5.jpg https://s3.amazonaws.com/prod-ucs-content-store-us-east/content/pii:S2468823117304340/gr5/DOWNSAMPLED/image/jpeg/5d31030db7a0483803d6f8b76a7cb766/gr5.jpg gr5 gr5.jpg jpg 22648 290 376 IMAGE-DOWNSAMPLED 1-s2.0-S2468823117304340-gr6.jpg https://s3-eu-west-1.amazonaws.com/prod-ucs-content-store-eu-west/content/pii:S2468823117304340/gr6/DOWNSAMPLED/image/jpeg/7f2fc71cd3ec3ccedb51131ad04c68e0/gr6.jpg https://s3.amazonaws.com/prod-ucs-content-store-us-east/content/pii:S2468823117304340/gr6/DOWNSAMPLED/image/jpeg/7f2fc71cd3ec3ccedb51131ad04c68e0/gr6.jpg gr6 gr6.jpg jpg 27973 290 376 IMAGE-DOWNSAMPLED 1-s2.0-S2468823117304340-gr7.jpg https://s3-eu-west-1.amazonaws.com/prod-ucs-content-store-eu-west/content/pii:S2468823117304340/gr7/DOWNSAMPLED/image/jpeg/4dca5826f1442c4fb55edd4043525bd6/gr7.jpg https://s3.amazonaws.com/prod-ucs-content-store-us-east/content/pii:S2468823117304340/gr7/DOWNSAMPLED/image/jpeg/4dca5826f1442c4fb55edd4043525bd6/gr7.jpg gr7 gr7.jpg jpg 18578 255 301 IMAGE-DOWNSAMPLED 1-s2.0-S2468823117304340-mmc1.docx https://s3-eu-west-1.amazonaws.com/prod-ucs-content-store-eu-west/content/pii:S2468823117304340/mmc1/MAIN/application/vnd.openxmlformats-officedocument.wordprocessingml.document/f519722fbeb5187b5f609e0298838140/mmc1.docx https://s3.amazonaws.com/prod-ucs-content-store-us-east/content/pii:S2468823117304340/mmc1/MAIN/application/vnd.openxmlformats-officedocument.wordprocessingml.document/f519722fbeb5187b5f609e0298838140/mmc1.docx mmc1 mmc1.docx docx 554638 APPLICATION 1-s2.0-S2468823117304340-si1.gif https://s3-eu-west-1.amazonaws.com/prod-ucs-content-store-eu-west/content/pii:S2468823117304340/STRIPIN/image/gif/9645561134d1c24ba0d0ecbb351c2749/si1.gif https://s3.amazonaws.com/prod-ucs-content-store-us-east/content/pii:S2468823117304340/STRIPIN/image/gif/9645561134d1c24ba0d0ecbb351c2749/si1.gif si1 si1.gif gif 931 15 260 ALTIMG 1-s2.0-S2468823117304340-si2.gif https://s3-eu-west-1.amazonaws.com/prod-ucs-content-store-eu-west/content/pii:S2468823117304340/STRIPIN/image/gif/e3a9c9ce63e6811b33c756586e7a51e4/si2.gif https://s3.amazonaws.com/prod-ucs-content-store-us-east/content/pii:S2468823117304340/STRIPIN/image/gif/e3a9c9ce63e6811b33c756586e7a51e4/si2.gif si2 si2.gif gif 691 14 199 ALTIMG 1-s2.0-S2468823117304340-si3.gif https://s3-eu-west-1.amazonaws.com/prod-ucs-content-store-eu-west/content/pii:S2468823117304340/STRIPIN/image/gif/f649011c563942b45ab098dc69dc5d6d/si3.gif https://s3.amazonaws.com/prod-ucs-content-store-us-east/content/pii:S2468823117304340/STRIPIN/image/gif/f649011c563942b45ab098dc69dc5d6d/si3.gif si3 si3.gif gif 919 15 270 ALTIMG 1-s2.0-S2468823117304340-si4.gif https://s3-eu-west-1.amazonaws.com/prod-ucs-content-store-eu-west/content/pii:S2468823117304340/STRIPIN/image/gif/b8719ef9d68e23dbc19b4ade9de963ab/si4.gif https://s3.amazonaws.com/prod-ucs-content-store-us-east/content/pii:S2468823117304340/STRIPIN/image/gif/b8719ef9d68e23dbc19b4ade9de963ab/si4.gif si4 si4.gif gif 1288 34 331 ALTIMG 1-s2.0-S2468823117304340-si5.gif https://s3-eu-west-1.amazonaws.com/prod-ucs-content-store-eu-west/content/pii:S2468823117304340/STRIPIN/image/gif/d6dcce222e076e9b4c2ce9b1ce04b652/si5.gif https://s3.amazonaws.com/prod-ucs-content-store-us-east/content/pii:S2468823117304340/STRIPIN/image/gif/d6dcce222e076e9b4c2ce9b1ce04b652/si5.gif si5 si5.gif gif 1401 25 385 ALTIMG 1-s2.0-S2468823117304340-si6.gif https://s3-eu-west-1.amazonaws.com/prod-ucs-content-store-eu-west/content/pii:S2468823117304340/STRIPIN/image/gif/bde77add057dd1dd8b0443765815a6ec/si6.gif https://s3.amazonaws.com/prod-ucs-content-store-us-east/content/pii:S2468823117304340/STRIPIN/image/gif/bde77add057dd1dd8b0443765815a6ec/si6.gif si6 si6.gif gif 2299 35 436 ALTIMG 1-s2.0-S2468823117304340-si7.gif https://s3-eu-west-1.amazonaws.com/prod-ucs-content-store-eu-west/content/pii:S2468823117304340/STRIPIN/image/gif/d0348daa12e66c7b6a92a2d3884368fe/si7.gif https://s3.amazonaws.com/prod-ucs-content-store-us-east/content/pii:S2468823117304340/STRIPIN/image/gif/d0348daa12e66c7b6a92a2d3884368fe/si7.gif si7 si7.gif gif 1398 25 337 ALTIMG 1-s2.0-S2468823117304340-si8.gif https://s3-eu-west-1.amazonaws.com/prod-ucs-content-store-eu-west/content/pii:S2468823117304340/STRIPIN/image/gif/27bd5db4c9b00c7f3cbbdb4093d16986/si8.gif https://s3.amazonaws.com/prod-ucs-content-store-us-east/content/pii:S2468823117304340/STRIPIN/image/gif/27bd5db4c9b00c7f3cbbdb4093d16986/si8.gif si8 si8.gif gif 1409 16 408 ALTIMG 1-s2.0-S2468823117304340-Jun_Han_Iron_catalyst_2017_P05.jpg https://s3-eu-west-1.amazonaws.com/prod-ucs-content-store-eu-west/content/egi:10Q49NC1JH9/PAGE-IMAGE/image/jpg/3c53fb86a76eaea5f64cfbbc042da0bd/Jun_Han_Iron_catalyst_2017_P05.jpg https://s3.amazonaws.com/prod-ucs-content-store-us-east/content/egi:10Q49NC1JH9/PAGE-IMAGE/image/jpg/3c53fb86a76eaea5f64cfbbc042da0bd/Jun_Han_Iron_catalyst_2017_P05.jpg Jun_Han_Iron_catalyst_2017_P05 Jun_Han_Iron_catalyst_2017_P05.jpg jpg 540844 05 AAM-PAGE-IMAGE 1-s2.0-S2468823117304340-Jun_Han_Iron_catalyst_2017_P09.jpg https://s3-eu-west-1.amazonaws.com/prod-ucs-content-store-eu-west/content/egi:10Q49NC1JH9/PAGE-IMAGE/image/jpg/8158ef7cdbe27ff511601fdec828d65a/Jun_Han_Iron_catalyst_2017_P09.jpg https://s3.amazonaws.com/prod-ucs-content-store-us-east/content/egi:10Q49NC1JH9/PAGE-IMAGE/image/jpg/8158ef7cdbe27ff511601fdec828d65a/Jun_Han_Iron_catalyst_2017_P09.jpg Jun_Han_Iron_catalyst_2017_P09 Jun_Han_Iron_catalyst_2017_P09.jpg jpg 549337 09 AAM-PAGE-IMAGE 1-s2.0-S2468823117304340-Jun_Han_Iron_catalyst_2017_P16.jpg https://s3-eu-west-1.amazonaws.com/prod-ucs-content-store-eu-west/content/egi:10Q49NC1JH9/PAGE-IMAGE/image/jpg/b6a1722886a76b6db32e8c042cf9866e/Jun_Han_Iron_catalyst_2017_P16.jpg https://s3.amazonaws.com/prod-ucs-content-store-us-east/content/egi:10Q49NC1JH9/PAGE-IMAGE/image/jpg/b6a1722886a76b6db32e8c042cf9866e/Jun_Han_Iron_catalyst_2017_P16.jpg Jun_Han_Iron_catalyst_2017_P16 Jun_Han_Iron_catalyst_2017_P16.jpg jpg 576216 16 AAM-PAGE-IMAGE 1-s2.0-S2468823117304340-Jun_Han_Iron_catalyst_2017_P22.jpg https://s3-eu-west-1.amazonaws.com/prod-ucs-content-store-eu-west/content/egi:10Q49NC1JH9/PAGE-IMAGE/image/jpg/cba8dcc12faf47a1e61b9c1362051f86/Jun_Han_Iron_catalyst_2017_P22.jpg https://s3.amazonaws.com/prod-ucs-content-store-us-east/content/egi:10Q49NC1JH9/PAGE-IMAGE/image/jpg/cba8dcc12faf47a1e61b9c1362051f86/Jun_Han_Iron_catalyst_2017_P22.jpg Jun_Han_Iron_catalyst_2017_P22 Jun_Han_Iron_catalyst_2017_P22.jpg jpg 243239 22 AAM-PAGE-IMAGE 1-s2.0-S2468823117304340-Jun_Han_Iron_catalyst_2017_P03.jpg https://s3-eu-west-1.amazonaws.com/prod-ucs-content-store-eu-west/content/egi:10Q49NC1JH9/PAGE-IMAGE/image/jpg/65329543dc7f83f676289b8ce669e816/Jun_Han_Iron_catalyst_2017_P03.jpg https://s3.amazonaws.com/prod-ucs-content-store-us-east/content/egi:10Q49NC1JH9/PAGE-IMAGE/image/jpg/65329543dc7f83f676289b8ce669e816/Jun_Han_Iron_catalyst_2017_P03.jpg Jun_Han_Iron_catalyst_2017_P03 Jun_Han_Iron_catalyst_2017_P03.jpg jpg 501941 03 AAM-PAGE-IMAGE 1-s2.0-S2468823117304340-Jun_Han_Iron_catalyst_2017_P12.jpg https://s3-eu-west-1.amazonaws.com/prod-ucs-content-store-eu-west/content/egi:10Q49NC1JH9/PAGE-IMAGE/image/jpg/3a69eb4c3ee363d9129bf22730d145a2/Jun_Han_Iron_catalyst_2017_P12.jpg https://s3.amazonaws.com/prod-ucs-content-store-us-east/content/egi:10Q49NC1JH9/PAGE-IMAGE/image/jpg/3a69eb4c3ee363d9129bf22730d145a2/Jun_Han_Iron_catalyst_2017_P12.jpg Jun_Han_Iron_catalyst_2017_P12 Jun_Han_Iron_catalyst_2017_P12.jpg jpg 466728 12 AAM-PAGE-IMAGE 1-s2.0-S2468823117304340-Jun_Han_Iron_catalyst_2017_P10.jpg https://s3-eu-west-1.amazonaws.com/prod-ucs-content-store-eu-west/content/egi:10Q49NC1JH9/PAGE-IMAGE/image/jpg/bf888ab34998a50ef1476dec90856b64/Jun_Han_Iron_catalyst_2017_P10.jpg https://s3.amazonaws.com/prod-ucs-content-store-us-east/content/egi:10Q49NC1JH9/PAGE-IMAGE/image/jpg/bf888ab34998a50ef1476dec90856b64/Jun_Han_Iron_catalyst_2017_P10.jpg Jun_Han_Iron_catalyst_2017_P10 Jun_Han_Iron_catalyst_2017_P10.jpg jpg 503423 10 AAM-PAGE-IMAGE 1-s2.0-S2468823117304340-Jun_Han_Iron_catalyst_2017_P18.jpg https://s3-eu-west-1.amazonaws.com/prod-ucs-content-store-eu-west/content/egi:10Q49NC1JH9/PAGE-IMAGE/image/jpg/70614530a101e2df4887275b1ab09552/Jun_Han_Iron_catalyst_2017_P18.jpg https://s3.amazonaws.com/prod-ucs-content-store-us-east/content/egi:10Q49NC1JH9/PAGE-IMAGE/image/jpg/70614530a101e2df4887275b1ab09552/Jun_Han_Iron_catalyst_2017_P18.jpg Jun_Han_Iron_catalyst_2017_P18 Jun_Han_Iron_catalyst_2017_P18.jpg jpg 521227 18 AAM-PAGE-IMAGE 1-s2.0-S2468823117304340-Jun_Han_Iron_catalyst_2017_P11.jpg https://s3-eu-west-1.amazonaws.com/prod-ucs-content-store-eu-west/content/egi:10Q49NC1JH9/PAGE-IMAGE/image/jpg/b5314895870dbf79b7b7242f4c13598c/Jun_Han_Iron_catalyst_2017_P11.jpg https://s3.amazonaws.com/prod-ucs-content-store-us-east/content/egi:10Q49NC1JH9/PAGE-IMAGE/image/jpg/b5314895870dbf79b7b7242f4c13598c/Jun_Han_Iron_catalyst_2017_P11.jpg Jun_Han_Iron_catalyst_2017_P11 Jun_Han_Iron_catalyst_2017_P11.jpg jpg 408571 11 AAM-PAGE-IMAGE 1-s2.0-S2468823117304340-Jun_Han_Iron_catalyst_2017_P08.jpg https://s3-eu-west-1.amazonaws.com/prod-ucs-content-store-eu-west/content/egi:10Q49NC1JH9/PAGE-IMAGE/image/jpg/bbc0398c828ebe9e0e1eca8a1996d23b/Jun_Han_Iron_catalyst_2017_P08.jpg https://s3.amazonaws.com/prod-ucs-content-store-us-east/content/egi:10Q49NC1JH9/PAGE-IMAGE/image/jpg/bbc0398c828ebe9e0e1eca8a1996d23b/Jun_Han_Iron_catalyst_2017_P08.jpg Jun_Han_Iron_catalyst_2017_P08 Jun_Han_Iron_catalyst_2017_P08.jpg jpg 517785 08 AAM-PAGE-IMAGE 1-s2.0-S2468823117304340-Jun_Han_Iron_catalyst_2017_P31.jpg https://s3-eu-west-1.amazonaws.com/prod-ucs-content-store-eu-west/content/egi:10Q49NC1JH9/PAGE-IMAGE/image/jpg/c43414ff0897c0bba2b221594e98a238/Jun_Han_Iron_catalyst_2017_P31.jpg https://s3.amazonaws.com/prod-ucs-content-store-us-east/content/egi:10Q49NC1JH9/PAGE-IMAGE/image/jpg/c43414ff0897c0bba2b221594e98a238/Jun_Han_Iron_catalyst_2017_P31.jpg Jun_Han_Iron_catalyst_2017_P31 Jun_Han_Iron_catalyst_2017_P31.jpg jpg 202758 31 AAM-PAGE-IMAGE 1-s2.0-S2468823117304340-Jun_Han_Iron_catalyst_2017_P02.jpg https://s3-eu-west-1.amazonaws.com/prod-ucs-content-store-eu-west/content/egi:10Q49NC1JH9/PAGE-IMAGE/image/jpg/7beb6439c1654813b888815459b3b1b0/Jun_Han_Iron_catalyst_2017_P02.jpg https://s3.amazonaws.com/prod-ucs-content-store-us-east/content/egi:10Q49NC1JH9/PAGE-IMAGE/image/jpg/7beb6439c1654813b888815459b3b1b0/Jun_Han_Iron_catalyst_2017_P02.jpg Jun_Han_Iron_catalyst_2017_P02 Jun_Han_Iron_catalyst_2017_P02.jpg jpg 245825 02 AAM-PAGE-IMAGE 1-s2.0-S2468823117304340-Jun_Han_Iron_catalyst_2017_P23.jpg https://s3-eu-west-1.amazonaws.com/prod-ucs-content-store-eu-west/content/egi:10Q49NC1JH9/PAGE-IMAGE/image/jpg/d771d4ca0b6a1f76dd081ace46ac64c0/Jun_Han_Iron_catalyst_2017_P23.jpg https://s3.amazonaws.com/prod-ucs-content-store-us-east/content/egi:10Q49NC1JH9/PAGE-IMAGE/image/jpg/d771d4ca0b6a1f76dd081ace46ac64c0/Jun_Han_Iron_catalyst_2017_P23.jpg Jun_Han_Iron_catalyst_2017_P23 Jun_Han_Iron_catalyst_2017_P23.jpg jpg 481892 23 AAM-PAGE-IMAGE 1-s2.0-S2468823117304340-Jun_Han_Iron_catalyst_2017_P06.jpg https://s3-eu-west-1.amazonaws.com/prod-ucs-content-store-eu-west/content/egi:10Q49NC1JH9/PAGE-IMAGE/image/jpg/b6e9e43ddd0e790be341255229d7008f/Jun_Han_Iron_catalyst_2017_P06.jpg https://s3.amazonaws.com/prod-ucs-content-store-us-east/content/egi:10Q49NC1JH9/PAGE-IMAGE/image/jpg/b6e9e43ddd0e790be341255229d7008f/Jun_Han_Iron_catalyst_2017_P06.jpg Jun_Han_Iron_catalyst_2017_P06 Jun_Han_Iron_catalyst_2017_P06.jpg jpg 509535 06 AAM-PAGE-IMAGE 1-s2.0-S2468823117304340-Jun_Han_Iron_catalyst_2017_P19.jpg https://s3-eu-west-1.amazonaws.com/prod-ucs-content-store-eu-west/content/egi:10Q49NC1JH9/PAGE-IMAGE/image/jpg/a22c96564b7ce96e2ed24dd6f5b3fb0c/Jun_Han_Iron_catalyst_2017_P19.jpg https://s3.amazonaws.com/prod-ucs-content-store-us-east/content/egi:10Q49NC1JH9/PAGE-IMAGE/image/jpg/a22c96564b7ce96e2ed24dd6f5b3fb0c/Jun_Han_Iron_catalyst_2017_P19.jpg Jun_Han_Iron_catalyst_2017_P19 Jun_Han_Iron_catalyst_2017_P19.jpg jpg 398510 19 AAM-PAGE-IMAGE 1-s2.0-S2468823117304340-Jun_Han_Iron_catalyst_2017_P25.jpg https://s3-eu-west-1.amazonaws.com/prod-ucs-content-store-eu-west/content/egi:10Q49NC1JH9/PAGE-IMAGE/image/jpg/cd4b2e8affeab8b57a6d436ca5264d51/Jun_Han_Iron_catalyst_2017_P25.jpg https://s3.amazonaws.com/prod-ucs-content-store-us-east/content/egi:10Q49NC1JH9/PAGE-IMAGE/image/jpg/cd4b2e8affeab8b57a6d436ca5264d51/Jun_Han_Iron_catalyst_2017_P25.jpg Jun_Han_Iron_catalyst_2017_P25 Jun_Han_Iron_catalyst_2017_P25.jpg jpg 197594 25 AAM-PAGE-IMAGE 1-s2.0-S2468823117304340-Jun_Han_Iron_catalyst_2017_P17.jpg https://s3-eu-west-1.amazonaws.com/prod-ucs-content-store-eu-west/content/egi:10Q49NC1JH9/PAGE-IMAGE/image/jpg/1e643bb620f8858f3f3f6275112393be/Jun_Han_Iron_catalyst_2017_P17.jpg https://s3.amazonaws.com/prod-ucs-content-store-us-east/content/egi:10Q49NC1JH9/PAGE-IMAGE/image/jpg/1e643bb620f8858f3f3f6275112393be/Jun_Han_Iron_catalyst_2017_P17.jpg Jun_Han_Iron_catalyst_2017_P17 Jun_Han_Iron_catalyst_2017_P17.jpg jpg 504161 17 AAM-PAGE-IMAGE 1-s2.0-S2468823117304340-Jun_Han_Iron_catalyst_2017_P24.jpg https://s3-eu-west-1.amazonaws.com/prod-ucs-content-store-eu-west/content/egi:10Q49NC1JH9/PAGE-IMAGE/image/jpg/806b963ff4ba2a8af012663f12d12f1a/Jun_Han_Iron_catalyst_2017_P24.jpg https://s3.amazonaws.com/prod-ucs-content-store-us-east/content/egi:10Q49NC1JH9/PAGE-IMAGE/image/jpg/806b963ff4ba2a8af012663f12d12f1a/Jun_Han_Iron_catalyst_2017_P24.jpg Jun_Han_Iron_catalyst_2017_P24 Jun_Han_Iron_catalyst_2017_P24.jpg jpg 337156 24 AAM-PAGE-IMAGE 1-s2.0-S2468823117304340-Jun_Han_Iron_catalyst_2017_P07.jpg https://s3-eu-west-1.amazonaws.com/prod-ucs-content-store-eu-west/content/egi:10Q49NC1JH9/PAGE-IMAGE/image/jpg/70c3771b5fbab69dd7aa53dbb421bc2a/Jun_Han_Iron_catalyst_2017_P07.jpg https://s3.amazonaws.com/prod-ucs-content-store-us-east/content/egi:10Q49NC1JH9/PAGE-IMAGE/image/jpg/70c3771b5fbab69dd7aa53dbb421bc2a/Jun_Han_Iron_catalyst_2017_P07.jpg Jun_Han_Iron_catalyst_2017_P07 Jun_Han_Iron_catalyst_2017_P07.jpg jpg 440051 07 AAM-PAGE-IMAGE 1-s2.0-S2468823117304340-Jun_Han_Iron_catalyst_2017_P13.jpg https://s3-eu-west-1.amazonaws.com/prod-ucs-content-store-eu-west/content/egi:10Q49NC1JH9/PAGE-IMAGE/image/jpg/5dca1fe77eb4e080bca4a169f0177da4/Jun_Han_Iron_catalyst_2017_P13.jpg https://s3.amazonaws.com/prod-ucs-content-store-us-east/content/egi:10Q49NC1JH9/PAGE-IMAGE/image/jpg/5dca1fe77eb4e080bca4a169f0177da4/Jun_Han_Iron_catalyst_2017_P13.jpg Jun_Han_Iron_catalyst_2017_P13 Jun_Han_Iron_catalyst_2017_P13.jpg jpg 512223 13 AAM-PAGE-IMAGE 1-s2.0-S2468823117304340-Jun_Han_Iron_catalyst_2017_P15.jpg https://s3-eu-west-1.amazonaws.com/prod-ucs-content-store-eu-west/content/egi:10Q49NC1JH9/PAGE-IMAGE/image/jpg/6cea3adc19350802978111de3a6c566d/Jun_Han_Iron_catalyst_2017_P15.jpg https://s3.amazonaws.com/prod-ucs-content-store-us-east/content/egi:10Q49NC1JH9/PAGE-IMAGE/image/jpg/6cea3adc19350802978111de3a6c566d/Jun_Han_Iron_catalyst_2017_P15.jpg Jun_Han_Iron_catalyst_2017_P15 Jun_Han_Iron_catalyst_2017_P15.jpg jpg 559606 15 AAM-PAGE-IMAGE 1-s2.0-S2468823117304340-Jun_Han_Iron_catalyst_2017_P30.jpg https://s3-eu-west-1.amazonaws.com/prod-ucs-content-store-eu-west/content/egi:10Q49NC1JH9/PAGE-IMAGE/image/jpg/701d510cf492b8eded07010f9112cf3d/Jun_Han_Iron_catalyst_2017_P30.jpg https://s3.amazonaws.com/prod-ucs-content-store-us-east/content/egi:10Q49NC1JH9/PAGE-IMAGE/image/jpg/701d510cf492b8eded07010f9112cf3d/Jun_Han_Iron_catalyst_2017_P30.jpg Jun_Han_Iron_catalyst_2017_P30 Jun_Han_Iron_catalyst_2017_P30.jpg jpg 527795 30 AAM-PAGE-IMAGE 1-s2.0-S2468823117304340-Jun_Han_Iron_catalyst_2017_P28.jpg https://s3-eu-west-1.amazonaws.com/prod-ucs-content-store-eu-west/content/egi:10Q49NC1JH9/PAGE-IMAGE/image/jpg/bb61665bf18e4ecc04e7f81dc59d78ba/Jun_Han_Iron_catalyst_2017_P28.jpg https://s3.amazonaws.com/prod-ucs-content-store-us-east/content/egi:10Q49NC1JH9/PAGE-IMAGE/image/jpg/bb61665bf18e4ecc04e7f81dc59d78ba/Jun_Han_Iron_catalyst_2017_P28.jpg Jun_Han_Iron_catalyst_2017_P28 Jun_Han_Iron_catalyst_2017_P28.jpg jpg 139552 28 AAM-PAGE-IMAGE 1-s2.0-S2468823117304340-Jun_Han_Iron_catalyst_2017_P14.jpg https://s3-eu-west-1.amazonaws.com/prod-ucs-content-store-eu-west/content/egi:10Q49NC1JH9/PAGE-IMAGE/image/jpg/08a8cca0ee08964ed427d7f12e56f326/Jun_Han_Iron_catalyst_2017_P14.jpg https://s3.amazonaws.com/prod-ucs-content-store-us-east/content/egi:10Q49NC1JH9/PAGE-IMAGE/image/jpg/08a8cca0ee08964ed427d7f12e56f326/Jun_Han_Iron_catalyst_2017_P14.jpg Jun_Han_Iron_catalyst_2017_P14 Jun_Han_Iron_catalyst_2017_P14.jpg jpg 594896 14 AAM-PAGE-IMAGE 1-s2.0-S2468823117304340-Jun_Han_Iron_catalyst_2017_P20.jpg https://s3-eu-west-1.amazonaws.com/prod-ucs-content-store-eu-west/content/egi:10Q49NC1JH9/PAGE-IMAGE/image/jpg/96d3862513dd14c3878f7b2f3405ee34/Jun_Han_Iron_catalyst_2017_P20.jpg https://s3.amazonaws.com/prod-ucs-content-store-us-east/content/egi:10Q49NC1JH9/PAGE-IMAGE/image/jpg/96d3862513dd14c3878f7b2f3405ee34/Jun_Han_Iron_catalyst_2017_P20.jpg Jun_Han_Iron_catalyst_2017_P20 Jun_Han_Iron_catalyst_2017_P20.jpg jpg 457360 20 AAM-PAGE-IMAGE 1-s2.0-S2468823117304340-Jun_Han_Iron_catalyst_2017_P04.jpg https://s3-eu-west-1.amazonaws.com/prod-ucs-content-store-eu-west/content/egi:10Q49NC1JH9/PAGE-IMAGE/image/jpg/1bc439ba289265685785fae1dd6b4061/Jun_Han_Iron_catalyst_2017_P04.jpg https://s3.amazonaws.com/prod-ucs-content-store-us-east/content/egi:10Q49NC1JH9/PAGE-IMAGE/image/jpg/1bc439ba289265685785fae1dd6b4061/Jun_Han_Iron_catalyst_2017_P04.jpg Jun_Han_Iron_catalyst_2017_P04 Jun_Han_Iron_catalyst_2017_P04.jpg jpg 527429 04 AAM-PAGE-IMAGE 1-s2.0-S2468823117304340-Jun_Han_Iron_catalyst_2017_P26.jpg https://s3-eu-west-1.amazonaws.com/prod-ucs-content-store-eu-west/content/egi:10Q49NC1JH9/PAGE-IMAGE/image/jpg/551bea3d5f46c6ba21f60616f56a0392/Jun_Han_Iron_catalyst_2017_P26.jpg https://s3.amazonaws.com/prod-ucs-content-store-us-east/content/egi:10Q49NC1JH9/PAGE-IMAGE/image/jpg/551bea3d5f46c6ba21f60616f56a0392/Jun_Han_Iron_catalyst_2017_P26.jpg Jun_Han_Iron_catalyst_2017_P26 Jun_Han_Iron_catalyst_2017_P26.jpg jpg 195534 26 AAM-PAGE-IMAGE 1-s2.0-S2468823117304340-Jun_Han_Iron_catalyst_2017_P01.jpg https://s3-eu-west-1.amazonaws.com/prod-ucs-content-store-eu-west/content/egi:10Q49NC1JH9/PAGE-IMAGE/image/jpg/2956128ea8f434aa34112089f2e21fbf/Jun_Han_Iron_catalyst_2017_P01.jpg https://s3.amazonaws.com/prod-ucs-content-store-us-east/content/egi:10Q49NC1JH9/PAGE-IMAGE/image/jpg/2956128ea8f434aa34112089f2e21fbf/Jun_Han_Iron_catalyst_2017_P01.jpg Jun_Han_Iron_catalyst_2017_P01 Jun_Han_Iron_catalyst_2017_P01.jpg jpg 462222 01 AAM-PAGE-IMAGE 1-s2.0-S2468823117304340-Jun_Han_Iron_catalyst_2017_P21.jpg https://s3-eu-west-1.amazonaws.com/prod-ucs-content-store-eu-west/content/egi:10Q49NC1JH9/PAGE-IMAGE/image/jpg/fbb2edd8da24ac2de1d275b250409350/Jun_Han_Iron_catalyst_2017_P21.jpg https://s3.amazonaws.com/prod-ucs-content-store-us-east/content/egi:10Q49NC1JH9/PAGE-IMAGE/image/jpg/fbb2edd8da24ac2de1d275b250409350/Jun_Han_Iron_catalyst_2017_P21.jpg Jun_Han_Iron_catalyst_2017_P21 Jun_Han_Iron_catalyst_2017_P21.jpg jpg 436741 21 AAM-PAGE-IMAGE 1-s2.0-S2468823117304340-Jun_Han_Iron_catalyst_2017_P29.jpg https://s3-eu-west-1.amazonaws.com/prod-ucs-content-store-eu-west/content/egi:10Q49NC1JH9/PAGE-IMAGE/image/jpg/3bdeab53cc4c522ce32dfbbcb094c362/Jun_Han_Iron_catalyst_2017_P29.jpg https://s3.amazonaws.com/prod-ucs-content-store-us-east/content/egi:10Q49NC1JH9/PAGE-IMAGE/image/jpg/3bdeab53cc4c522ce32dfbbcb094c362/Jun_Han_Iron_catalyst_2017_P29.jpg Jun_Han_Iron_catalyst_2017_P29 Jun_Han_Iron_catalyst_2017_P29.jpg jpg 169859 29 AAM-PAGE-IMAGE 1-s2.0-S2468823117304340-Jun_Han_Iron_catalyst_2017_P27.jpg https://s3-eu-west-1.amazonaws.com/prod-ucs-content-store-eu-west/content/egi:10Q49NC1JH9/PAGE-IMAGE/image/jpg/92e88fd05c7911573619d883a4b2d5fe/Jun_Han_Iron_catalyst_2017_P27.jpg https://s3.amazonaws.com/prod-ucs-content-store-us-east/content/egi:10Q49NC1JH9/PAGE-IMAGE/image/jpg/92e88fd05c7911573619d883a4b2d5fe/Jun_Han_Iron_catalyst_2017_P27.jpg Jun_Han_Iron_catalyst_2017_P27 Jun_Han_Iron_catalyst_2017_P27.jpg jpg 206805 27 AAM-PAGE-IMAGE 1-s2.0-S2468823117304340-am.pdf am am.pdf pdf 674308 AAM-PDF https://s3-eu-west-1.amazonaws.com/prod-ucs-content-store-eu-west/content/egi:10Q49NC1JH9/MAIN/application/pdf/507d4aa699fd80fdba54574ec1bc1555/am.pdf MCAT 268 S2468-8231(17)30434-0 10.1016/j.mcat.2017.07.025 Elsevier B.V. Fig. 1 The SEM images of (a) the Colloidal Crystal Templates;(b) 3DOM Fe based catalyst. Fig. 1 Fig. 2 HRTEM images of (a) Fresh 3DOM iron based FTS catalyst. (b) With inset FFT. (c) Reduced 3DOM iron based FTS catalyst. Fig. 2 Fig. 3 XRD patterns of (a). Fresh 3DOM Fe catalyst; (b). Reduced 3DOM Fe catalyst; (c). Spent 3DOM Fe catalyst (SG21); (d). Spent 3DOM Fe catalyst (SG11); (e). Spent 3DOM Fe catalyst (SB). Fig. 3 Fig. 4 High resolution spectra in Fe 2p region of a. fresh 3DOM Fe catalyst; b. reduced 3DOM Fe catalyst; c. spent 3DOM Fe catalyst (SG21); d. spent 3DOM Fe catalyst (SG11); e. spent 3DOM Fe catalyst (SB). Fig. 4 Fig. 5 High resolution spectra in C 1s region of a. fresh 3DOM Fe catalyst; b. reduced 3DOM Fe catalyst; c. spent 3DOM Fe catalyst (SG21); d. spent 3DOM Fe catalyst (SG11); e. spent 3DOM Fe catalyst (SB). Fig. 5 Fig. 6 DRIFTS spectra of a. fresh 3DOM Fe catalyst; b. reduced 3DOM Fe catalyst; c. spent 3DOM Fe catalyst (SG21); d. spent 3DOM Fe catalyst (SG11); e. spent 3DOM Fe catalyst (SB). Fig. 6 Fig. 7 CO conversion rate and CO2/C5+ selectivity with time on stream. Fig. 7 Table 1 Three types of syngas used in the tests. Table 1 Gas Composition H2 (%) CO (%) CO2 (%) CH4 (%) N2 (%) SG21 64 32 0 0 4 SG11 48 48 0 0 4 SB 19 20 12 2 47 Table 2 Textural property of 3DOM Fe catalyst at different stages. Table 2 3DOM Fe catalyst BET surface area (m2/g) Pore volume (cm3/g) Average pore diameter (nm) Fresh 33 0.20 25 Reduced 116 0.67 23 Spent (SG21) 92 0.44 19 Spent (SG11) 15 0.04 14 Spent (SB) 17 0.07 11 Table 3 Effects of syngas composition on Fischer Tropsch synthesis performances. Table 3 Feed Gas Composition SG21 SG11 SB Temperature (°C) 270 280 290 270 280 290 295 310 310 Pressure (MPa) 2.14 2.14 2.14 2.14 2.14 2.14 2.96 2.96 3.79 GHSV (h−1) 3600 3600 3600 3600 3600 3600 3600 3600 3600 Conversion Rate (mol%) CO 94.20 99.99 99.77 43.93 87.22 98.02 59.38 68.23 89.35 H2 69.91 76.46 75.19 53.03 79.92 88.78 69.21 73.53 88.77 Product Selectivity (mol%) CO2 12.08 13.91 14.77 19.28 18.56 18.81 26.00 26.31 26.20 C1-C4 3.00 3.63 4.17 5.55 4.59 5.50 2.80 3.25 2.67 C5+ 84.92 82.46 81.06 75.17 76.85 75.69 71.20 70.44 71.13 Liquid Hydrocarbon Distribution (mol%) Paraffins 26.24 30.04 31.27 20.02 22.03 24.82 6.45 6.75 5.52 I-Paraffins 12.47 10.79 10.67 16.91 15.73 19.07 20.88 20.36 20.68 Aromatics 10.40 11.71 12.48 9.62 7.76 6.17 8.25 11.79 9.74 Naphthenes 25.95 15.98 14.64 25.45 20.23 14.00 19.27 20.15 19.32 Olefins 24.93 31.49 30.74 28.00 34.26 35.95 45.15 40.95 44.74 Liquid Hydrocarbon Quality O/P a 0.64 0.77 0.73 0.76 0.91 0.82 1.65 1.51 1.71 Octane Number 54.80 55.70 54.70 44.80 48.20 57.10 58.30 56.80 59.70 Bromine Number 36.32 33.15 34.84 18.82 28.13 38.84 36.82 32.16 37.98 Reid Vapor Press. 2.46 3.75 3.64 0.95 1.72 4.24 1.86 1.78 1.06 Reduction conditions: 350°C, 0.35MPa, and 1000h−1 for 24h. All reaction data were collected over 48h steady state runs. a O/P=Olefins/(Paraffins+I-Paraffins). Table 4 Comparison of catalytic performances of Fe based catalysts in FTS reaction. Table 4 Catalysts Feed gas Composition T (°C) P (MPa) GHSV (h−1) CO con. (mol%) Sel. (C5+, mol%) Sel. (CO2, mol.%) Sel. (CH4, C-atom%) References 3DOM Fe H2/CO=1 280 2.14 3600 87.22 76.85 18.56 4.59 This work 3DOM Fe H2/CO=1 295 2.96 3600 59.38 71.20 26.0 2.8 This work Fe/Carbon H2/CO=1 250 3.0 4000 b 51.0 65.2 na a na a [37] Fe/CNT H2/CO=1 340 2.5 5000 b 56.5 na a 39.3 20.3 [14] Fe/Cu/Zn H2/CO=0.77 280 2.5 1500 14.4 60.1 na a 12.7 [38] Fe/Cu/SiO2 H2/CO=0.67 250 1.5 4000 b 14–84 51–83 29–40 3–4 [39] FeCuK/AlSi H2/CO=1.0 250 2.0 na a 17–21 na a na a na a [41] Fe/K H2/CO=1.0 300 5.0 2700 26 25 na a 12–15 [42] Fe/SBA-15 H2/CO=1.0 300 1.0 na a 68.5 51.0 37 12.8 [43] Fe/Si/K H2/CO=0.7 270 1.3 3000 b 86.6 65.2 46 4.1–7.7 [44] a Not available. b ml−1 g−1 h−1. Editor’s choice paper The effect of syngas composition on the Fischer Tropsch synthesis over three-dimensionally ordered macro-porous iron based catalyst Jun Han a Li Zhang a Yongwu Lu b Jin Hu b Baobao Cao c Fei Yu b ⁎ a College of Resources and Environment Engineering, Wuhan University of Science and Technology, Wuhan, Hubei 430081, China College of Resources and Environment Engineering Wuhan University of Science and Technology Wuhan Hubei 430081 China b Department of Agricultural and Biological Engineering, Mississippi State University, MS 39762, USA Department of Agricultural and Biological Engineering Mississippi State University, MS 39762 USA c Key Lab of Advanced Technology of Materials, Southwest Jiaotong University, Chengdu, Sichuan 610031, China Key Lab of Advanced Technology of Materials Southwest Jiaotong University Chengdu Sichuan 610031 China ⁎ Corresponding author at: Department of Agricultural and Biological Engineering, Mississippi State University, 130 Creelman Street, MS, 39762, USA. Graphical abstract Three-Dimensionally Ordered Macro-porous (3DOM) Fe based catalysts were synthesized via a facile “glyoxylate route” poly (methyl methacrylate) (PMMA) colloidal crystal template (CCT) method. Fischer Tropsch Synthesis (FT) using different biosyngasses over the 3DOM Fe based catalyst for producing the liquid hydrocarbon was studied. The morphology, structure and microstructures of 3DOM Fe based catalysts were characterized by SEM, BET, TPR, HRTEM, XRD, XPS and DRIFTS. The experimental results demonstrated that the hydrogen lean syngas decreased the partial pressure of H2/CO, which caused the decrease of the CO conversion rate during FT reaction. Moreover, the addition of CO2 and CH4 in the hydrogen lean syngas could well preserve the iron carbide phase in the catalyst, and the CO conversion rate was improved. Lower H2/CO ratio syngas would shift the liquid hydrocarbon distribution to higher molecular weight hydrocarbons, and the addition of CO2 and CH4 into the syngas further facilitated the shift. Meanwhile, it was also found that the CO conversion rate and C5+ selectivity were 68.23% and 70.44% respectively during the simulated biosyngas from biomass gasification (the hydrogen lean syngas contained CO2 and CH4) FT over the 3DOM Fe based catalyst, and CO2 and CH4 selectivity were 12–26% and 2.67–5.5% respectively. Keywords Three-dimensionally ordered macro-porous (3DOM) Iron catalyst Fischer–Tropsch synthesis Syngas 1 Introduction With the challenges of diminishing the traditional petroleum reserves and increasing the environmental concerns, the thermo-chemical conversion of biomass to liquid fuels (BTL) has been regarded as one of the promising routes of producing tomorrow's liquid transportation fuels [1]. Fischer Tropsch (FT) synthesis, as one of the key technologies in the BTL process, has been attracted to more attention in recent years [2]. The syngas is mainly converted into a range of hydrocarbons of various molecular weights according to the following reactions [3]: (1) n C O + ( 2 n + 1 ) H 2 → C n H 2 n + 2 + n H 2 O (2) n C O + 2 n H 2 → C n H 2 n + n H 2 O (3) n C O + 2 n H 2 → C n H 2 n + 2 O + ( n − 1 ) H 2 O Unfortunately, the biomass-derived syngas is not optimal for the commercial catalysts (Fe and Co based catalysts) because of the low H2/CO ratio (0.45–1.03) [4]. Biomass steam-oxygen gasification usually produces the hydrogen lean biosyngas which contains 25–30% H2 and 43–47% CO [5], and the hydrogen lean biosyngas from the biomass ambient air gasification usually contains 18–20% H2, 20–24% CO, 9–12% CO2, 1–4% CH4 and nitrogen as the balance [6]. The relative high level of CO2 lowered the partial pressures of CO+H2 and the rate of hydrocarbon formation. Moreover, the active iron carbide phase of catalyst would be oxidized by CO2 [7]. Hence, enormous efforts have been made to improve the gas utilization efficiency of these H2-lean biosyngasses. The activity and selectivity of catalysts could be promoted by adding promoters such as alkali metals, Cu, and the noble metals (Ru, Rh, Pt, etc.) or metal oxides (ZrO2, La2O3, MnO) [8–12]. The improvement of the structure, textural and morphology of catalysts supports was an alternative method of enhancing the selectivity and activity of catalysts [13,14]. Hou et al. reported that three dimensionally ordered (3DOM) catalysts could significantly improve the catalytic performance for CO oxidation because 3DOM catalysts were beneficial for the reactant species diffusion. At the same time, the existence of the meso-porous and macro-porous may simultaneously provide the high surface areas and more active sites [15]. Zhang et al. also found that the cobalt catalyst supported on a meso-porous support with larger pore diameter had achieved better activity and C5+ selectivity [16]. Jung et al. stated that the catalyst supported on a meso–macro pore structure support showed a more stabilized catalytic activity and better heavy hydrocarbon selectivity in the FT reaction compared to other catalysts [17]. However, the syngas from biomass gasification contains 9–12% CO2, and the previous researches did not concern FT synthesis using the model biosyngas with CO2. The present work focuses on developing a novel 3DOM Fe based catalyst using PMMA microspheres as templates (no rare-earth metal addition), and coverts the model syngas (contain CO2 and CH4) from biomass gasification into the liquid hydrocarbons. The effects of the syngas compositions on the surface carbonaceous species formation, phase transformations and catalytic performance over the 3DOM Fe based catalyst will also be discussed. 2 Experimental 2.1 Catalyst preparation In this study, the mono-dispersed PMMA microspheres were synthesized by a modified dual-phase emulsifier-free emulsion polymerization method [18,19]. The batch polymerization reactor for synthesizing Poly(methyl methacrylate) (PMMA) microspheres was shown in SFig. 1. For synthesizing 3DOM Fe based FTS catalyst, 44ml Ethylene Glycol (EG) and 6ml methanol were mixed in a 100ml beaker, then 40.g iron nitrate was added into the EG-methanol mixture. The solution was stirred with a speed of 50 r/min at room temperature for 2.5h, and the precursor solution was formed. The dried PMMA template was then added into the well-mixed precursor solution for 3h. The excess precursor was removed by a vacuum filtration, and an impregnated PMMA template was obtained. After drying, the impregnated PMMA template-precursor sample was finally mixed with quartz sand and calcined in a quartz tube reactor at the ramping rate of 1°C/min from room temperature to 650°C, and maintained at 650°C for 3h. Thus, the 3DOM Fe based FT catalyst was prepared. 2.2 Catalyst characterization The morphology of PMMA was characterized by Field Emission Scanning Electron Microscope (JEOL JSM-6500F, JEOL USA, Inc., Waterford, VA) with an operating voltage of 5kV. The morphology of 3DOM iron based catalyst was also characterized by Zeiss SUPRA 40 FEG-SEM system (Thornwood, NY) with an operating voltage of 10kV. Moreover, High Resolution Transmission Electron Microscopy (HRTEM) images were obtained through JEOL 2100 electron microscope (JEOL, Japan). The structure properties (the specific surface area, average pore diameter, and pore volume) of 3DOM Fe based catalysts were determined using Quantachrome Autosorb-1C instrument (Boynton Beach, FL).Temperature Programmed Reduction (TPR) profile of the fresh catalyst was recorded using a Quantachrome ChemBET PULSAR apparatus (Boynton Beach, FL) equipped with a thermal conductivity detector (TCD). The phase composition and crystalline structure of the catalysts were determined using an Ultima III X-ray diffractometer (Rigaku Americas, The Woodlands, TX). X-ray Photoelectron Spectroscopy (XPS) spectra were taken by a PHI 1600 XPS surface Analysis System (Physical Electronics, Eden Prairie, MN). DRIFTS spectra were obtained using a Bruker FTIR Tensor 27 with a MCT detector in conjunction with Praying Mantis™ Diffuse Reflection Accessory (Billerica, MA). 2.3 Reactor system and operation procedure The catalytic performance tests were carried out in a micro tubular fixed bed reactor system. The detailed configuration and description of the reactor system can be found in our previous paper [20]. Before each run, 0.125g 3DOM Fe based FT catalyst was uniformly mixed with the glass beads (the diameter was about 2mm) to form 10 vol.% catalyst mixture, then 3DOM Fe based FTS catalyst mixture was loaded into the reactor tube and reduced by the syngas (50% H2 and 50% CO) at 350°C, 0.35MPa, and 1000h−1 of Gas Hourly Space Velocity (GHSV) for 24h. After the reduction, the feed gas was switched to the predetermined reactant gas, and the operation parameters were gradually increased to the predetermined parameters (List in Table 3 ) for FT reaction. GHSV was fixed at 3600h−1 in all the tests, while other parameters such as the temperature (270–310°C) and pressure (2.14–3.79MPa) were varied. Three types of syngas were used in the tests, as summarized in Table 1 (SG21 mean the syngas with 2.0H2/CO ratio; SG11 mean the syngas with 1.0H2/CO ratio; SB mean the simulated biosyngas from biomass gasification, which contains 12% CO2 and 2% CH4). The gas at the outlet of the reactor was analyzed using an online Agilent 7890 Gas Chromatography (Santa Clara, CA) with helium and nitrogen as carrier gases. A HP Plot capillary column was used to analyze the gaseous hydrocarbons (C1-C4 ranged alkanes and alkenes) with a Flame Ionization Detector (FID) and a molecular sieve-packed column was used to analyze CO, CO2, CH4, and N2 with a Thermal Conductivity Detector (TCD). The liquid hydrocarbons collected from the condenser were analyzed via a Detailed Hydrocarbon Analyzer (NARL 6560 MODEL 4060,Waltham, MA), which was composed of a Perkin Elmer Clarus 680 GC with a FID detector. Nitrogen in the syngas was assumed as inert during the reaction. CO and H2 conversion rates were defined as the mole percentage of carbon monoxide and hydrogen reacted during FT reaction, as shown in Eqs. (4) and (5), respectively. Product selectivity was defined as the mole percentage of CO converted into the specific product during FT reaction, as shown in Esq. (6)–(8): (4) C O c o n v e r s i o n r a t e ( m o l % ) = C O i n − C O o u t C O i n × 100 (5) H 2 c o n v e r s i o n r a t e ( m o l % ) = H 2 i n − H 2 o u t H 2 i n × 100 (6) C O 2 s e l e c t i v i t y ( m o l % ) = n u m b e r o f C O c o n v e r t e d t o C O 2 t o t a l n u m b e r o f C O c o n v e r t e d × 100 (7) C 1 − 4 s e l e c t i v i t y ( m o l % ) = n u m b e r o f C O c o n v e r t e d t o C 1 − C 4 t o t a l n u m b e r o f C O c o n v e r t e d × 100 (8) C 5 + s e l e c t i v i t y ( m o l % ) = 100 - C O 2 s e l e c t i v i t y - C 1 − 4 s e l e c t i v i t y The detailed FTS performance data, regarding the catalyst activity, selectivity and liquid hydrocarbon quality, are summarized in Table 3. 3 Results and discussion 3.1 Morphology and structure of 3DOM Fe catalyst Fig. 1 (a) showed SEM images of the assembled colloidal crystal PMMA template synthesized from the emulsifier-free emulsion polymerization reaction and centrifugal assembly. It was observed from the images that the particle size distribution of PMMA microspheres was very narrow with an average diameter of 335nm. The shape of the microsphere was highly uniform and spherical was formed. The Face-Centered Cubic (FCC) crystal structure was observed in the template, which was the most thermodynamically stable compared with other structures, such as Body-Centered Cubic (BCC) and Hexagonal Close-Packed (HCP) [21]. At the same time, the template was highly uniform and ordered in the three- dimensional scale. An obvious color change could be observed from the prepared template, which indicated that the Bragg diffraction occurred in the visible wave length light and further demonstrated the three-dimensional ordered structure of the obtained template [21]. SEM images of the 3DOM iron based catalyst were shown in Fig. 1(b). It could be observed that the catalyst had the highly ordered three-dimensional structure derived from the PMMA template. The hierarchical structure contained the spherical macro-pores with an average diameter of 210nm. The macro-pores were inter-connected with each other through the small windows on the wall with an average thickness of 15nm. The shrinkage of macro-pores from the initial sizes of the PMMA template was due to the melting of the polymer microspheres during the template removing process and condensation of the intermediate compounds. 3.2 BET characterization The detailed structure properties including BET surface area, pore volume and average pore diameter, were summarized in Table 2. The surface area of the fresh 3DOM Fe catalyst was 33.07m2/g, while the surface area of the reduced catalyst was increased sharply to 115.8m2/g. After FT reaction, the surface areas were decreased to 92.45m2/g (SG21), 15.1m2/g (SG11), and 17.44m2/g (SB), respectively. The pore volume of the fresh catalyst was 0.20cm3/g, while the pore volume increased to 0.67cm3/g for the reduced catalyst. The pore volume of the spent catalysts decreased to 0.44cm3/g(SG21), 0.04cm3/g(SG11), and 0.07cm3/g(SB), respectively. This tendency was agreed with the observation from the changes of hysteresis loop in SFig. 2 (Supplementary data). The increase of surface area and pore volume on the reduced catalyst was majorly attributed to the reduction of iron oxide and generation of meso-pores on the macro-porous walls. During FT reaction, the carbonaceous species would gradually deposit on the catalyst surface and block the pores, so that the surface area and pore volume were decreased [22]. Compared with the fresh catalyst, the BET surface area and pore volume of the spent catalysts were significantly decreased, and the BET surface used in SG21, SG11 and SB were 92, 15 and 17m2/g, respectively. This was consistent with the average pore diameter, the average pore diameter of reduced catalyst was 25nm, while he catalyst spent in hydrogen rich syngas (SG21) had 18.95nm pore diameter, the catalysts spent in hydrogen lean syngas had much smaller pore diameters of 14.44nm (SG11) and 10.68nm (SB), respectively. 3.3 HRTEM characterization HRTEM images of the catalysts were shown in Fig. 2 . The diffraction spacing at 2.20Å was observed in Fig. 2(a), corresponding to the lattice plane (113) of hematite [23], which was consistent with the result of TPR profile (S Fig. 3). Fig. 2(b) showed Fast Fourier Transform (FFT) of the fresh catalyst, which suggested that α-Fe2O3 was aligned along the [12-1] zone axis. The HRTEM image of the reduced catalyst was shown in Fig. 2(c). The diffraction spacing at 2.08Å was attributed to FexC formation. It was also observed that the reduced catalyst was well carburized and majorly composed of iron carbide species in the bulk of catalyst. A small grain area with a diffraction spacing at 2.53Å was observed in the near surface of the reduced catalyst, which was attributed to the lattice plane (311) of magnetite. The diffraction spacing at 3.35Å was attributed to the lattice plane (003) of graphite, which means that the catalyst surface was covered by carbonaceous species. 3.4 XRD characterization Fig. 3 (a) demonstrated that there was only α-Fe2O3 in the fresh catalyst, which was consistent with the results of TPR and HRTEM. After the reduction, the diffraction peaks corresponding to the crystal planes (111), (200), (220) and (311) at the two theta of 43.278, 50.403, 74.052 and 89.839, respectively, confirmed the formation of Austenite-phase iron carbide (CFe15.1) in the reduced catalyst, it was also consistent with JCPDS PDF#52-0512 [24–26]. Moreover, the diffraction peaks of Hägg carbide (Fe5C2), Eckstrom-Adcock iron carbide (Fe7C3) and magnetite (Fe3O4) were also found in Fig. 3(b). At the same time, there was also graphite in the reduced catalyst. The results indicated that the reduction of 3DOM Fe based catalyst by the syngas could transform hematite in the fresh catalyst into iron carbide mixtures (Fe5C2, Fe7C3, and CFe15.1) and magnetite (Fe3O4). After FT reaction in the hydrogen rich syngas (SG21), the peak intensities of iron carbide species decreased, while the relative peak intensities of magnetite increased. Meanwhile, the concentration of graphite was drastically decreased, as shown in Fig. 3(c). However, the peaks of the iron carbide species almost disappeared, only a small amount of Fe5C2 existed when the 3DOM Fe based catalyst was used in the hydrogen lean syngas (SG11), as shown in Fig. 3(d). This might be the result of the outward diffusion of carbidic carbon and the oxidation of iron carbides with water to form magnetite [27]. Fig. 3(e) presented that Fe5C2 concentration in the catalyst used in SB was higher than that of SG11. The dissociative adsorption of methane on the iron catalyst surface and carburization of the iron phase through methane prevented the decarburization of iron carbide phase. 3.5 XPS characterization XPS was also used to investigate the property and composition of surface layers on the 3DOM Fe based catalyst. Fig. 4 presented the high resolution XPS spectra in Fe 2p region of the catalysts. As shown in Fig. 4(a), there was the peak at 710.6eV and its shoulder peak at 718.7eV, which was attributed to Fe2O3. After the reduction, Fe 2P peak at 710.6eV and its shoulder peak at 718.7eV disappeared, as Fig. 4(b). However, two weak peaks at 715.4eV and 706.9eV were observed, which attributed to the formation of Fe3O4 and Fe in the surface of the reduced catalyst [28]. The characteristic peaks of the catalyst after FT reaction were similar with those of the reduced catalyst. Fig. 5 demonstrated the high resolution XPS spectra in C 1s region of the catalysts, as shown in Fig. 5(a), a peak at 284.6eV appeared in C 1s region, which was the residue during the PMMA template removal process [29]. The reduction by the syngas resulted in the formation of iron carbide, as indicated by the peak at 283.5eV (Fig. 5(b)) [30]. In the spectra of the spent catalysts, C 1s peaks shifted to much lower binding energies at 281.0eV, which attributed to the shielding effect of the carbonaceous deposits on the catalysts surface during the FT reaction [31]. 3.6 DRIFTS characterization The in situ DRIFT spectra of the adsorbed species on the catalysts were compared in Fig. 6 . Fig. 6(a) presented that there were the bands at 1635, 1538, 1403, 1328, 1186, and 1122cm−1in the fresh catalyst, which was assigned to carbonates originated from PMMA template [28]. The band at 2970 and 2926cm−1appeared on the reduced catalyst (Fig. 6(b)) corresponded to asymmetric CH stretching vibrations of CH2- species, which suggested that FT active sites had appeared on the surface layer, and promoted the formation of hydrocarbon species [32]. For the spent catalysts, the catalyst spent in hydrogen rich syngas SG21 (Fig. 6c) had the similar spectra with the reduced catalyst on Fig. 6(b), except that a weak band at 1581cm−1 corresponded to formate species on the catalyst [33]. More bands (1451 and 1328cm−1) were observed in the spectra of the spent catalysts in the hydrogen lean syngas of SG11 and SB, as shown in Fig. 6(d) and Fig. 6(e), which indicated more complex carbonaceous species were formed on the surfaces of catalysts reacted in the hydrogen lean syngas environment. Mao et al. also stated that the band around 1451cm−1 was surface methoxy species, which might arise from formate reduction in the presence of hydrogen [34]. The band at 1328cm−1 was also assigned to formate species [33]. However, the intensities of the bands were lower when CO2 and CH4 were introduced into the syngas, which indicated the incorporation of CO2 and CH4 into the syngas would produce less concentration of the carbonaceous species. 3.7 FT performance of the 3DOM Fe catalyst 3.7.1 The activity In SG21 FT reaction, the CO conversion rate was increased from 94.2% to 99.77% when the reaction temperature was raised from 270 to 290°C. When in the SG11 FT reaction the temperature was raised from 270 to 290°C, the CO conversion rate increased from 43.93% to 98.02%. The above results indicated that the activity of the catalysts decreased when H2/CO was decreased. The decreasing H2/CO ratio improved the CO partial pressure and associated adsorbed CO concentration, which resulted in a lower adsorption and dissociation of H2 and decreases the hydrogenation reaction rate. Therefore, the scarcity of surface H caused the low activity of FT catalyst [35]. In the SB (contain CO2 and CH4), CO concentration or partial pressure was lower than that in SG11. Hence, the reaction temperature was increased to 295–310°C. The CO conversion rate was 59.38% at 295°C, which was slightly lower than that in SG11 at 270°C. When the reaction temperature was increased to 310°C, the CO conversion rate was similar with that of SG11 at 290°C. Moreover, the iron carbides were regarded as the active phase during FT reaction, and the content of iron carbides in the catalyst spent in SG11 was the lowest (Fig. 3). Hence, the activity of SG11 FT was the lowest. In addition, the effect of pressure was also tested for SB. It was shown that both H2 and CO conversions were increased with increasing pressure, the CO conversion rates were 68.23% and 89.35% under 2.96 and 3.79MPa pressure respectively (See Table 3). At a similar CO conversion level, the CO2 selectivity indicates the Water-Gas Shift (WGS) activity [36]. The CO2selectivity during SG21, SG11 and SB FT synthesis over 3DOM Fe catalyst was 26%, 18–19% and 12–14% (Table 3), which were lower than that of other catalysts (Table 4 ). 3.7.2 Product selectivity The FT product selectivity was calculated based on the carbon conversion, as Eqs. (3)–(5). In the hydrogen rich syngas SG21, the selectivity of carbon dioxide varied from 12.08% to 14.77%. The selectivity of light hydrocarbons (C1-C4) varied from 3.00% to 4.17%, and the selectivity of heavy hydrocarbons (C5+) varied from 81.06% to 84.92%. In the hydrogen lean syngas SG11, the catalyst had a higher selectivity of carbon dioxide, which varied from 18.56% to 19.28%. The selectivity of light hydrocarbons varied from 4.59% to 5.55%, and the selectivity of heavy hydrocarbons varied from 75.17% to 76.85% in the temperature range of 270–290°C. In the hydrogen lean syngas contained CO2 and CH4 added (SB), with the change of temperature, the selectivity of carbon dioxide varied from 26.00% to 26.31%, the selectivity of light hydrocarbons varied from 2.8% to 3.25%, and the selectivity of heavy hydrocarbons varied from 71.2% to 70.66% though the partial pressure of CO and H2 was the lowest. The methane and carbon dioxide selectivity of 3DOM Fe catalyst was lower compared to the published catalysts. Todic et al. reported that the increasing temperature promoted the amount of light products while that of heavy products decreased, which was linked to a decrease in chain growth probability [37]. With the change of pressure, the selectivity of carbon dioxide varied from 26.20% to 26.96%, the selectivity of light hydrocarbons varied from 3.25% to 2.67%, and the selectivity of heavy hydrocarbons varied from 70.44% to 71.13%. Apparently, with the decreasing of H2/CO ratio, the selectivity of catalyst was gradually shifted to CO2 and light hydrocarbons. It might be attributed to more active water gas shift reaction and methanation capability within the hydrogen lean syngas environment. The introduction of CO2 and CH4 into the hydrogen lean syngas facilitated the generation of CO2 while it suppressed the formation of light hydrocarbons. The liquid hydrocarbon distribution was also summarized in Table 3. It was shown that the liquid hydrocarbons were majorly composed of straight-chain paraffins (Paraffins), branched-chain paraffins (I-Paraffins), Olefins, Naphthenes, and less percentage of Aromatics. In SG21, it was shown that the distribution of Paraffins, Olefins, and Aromatics increased from 26.24% to 31.27%, 24.93% to 30.74%, 10.40% to 12.48% respectively when the reaction temperature was increased from 270 to 290°C. While the distribution of I-Paraffins, and Naphthenes decreased from 12.47% to 10.67%, 25.95% to 14.64% with the increase of the reaction temperature. In SG11, the liquid hydrocarbon distribution displayed a different tendency. When the reaction temperature varied from 270 to 290°C, the distribution of Paraffins, I-Paraffins and Olefins increased from 20.02% to 24.82%, 16.91% to 19.07%, 28.00% to 35.95%. However, the distribution of Naphthenes and Aromatics dropped from 25.45% to 14%, 9.62% to 6.17%. Obviously, the hydrogen lean syngas SG11 produced more I-Paraffins and Olefins, less Paraffins and Aromatics than those of the hydrogen rich syngas SG21, while the distribution of aromatics was at a similar level for the two syngasses. Compared with SG11, the liquid hydrocarbons from the hydrogen lean syngas contained CO2 and CH4 displayed the distinctly different hydrocarbon distribution. It was shown that the distribution of Paraffins in SB varied from 5.52% to 6.75%, which was much less than the Paraffins distribution in SG11. The distribution of I-Paraffins was slightly higher than that of SG11, which varied from 20.36% to 20.88%. The distribution of Olefins varied from 40.95% to 45.15%, which was much higher than the Olefins distribution in SG11. The distribution of both Naphthenes and Aromatics were similar with those in SG11. 3.7.3 Liquid hydrocarbon quality Comparing the O/P (olefins/(paraffins+I-paraffins)) ratios of liquid hydrocarbons, it was found that the liquid hydrocarbons produced from SG21 had the least O/P ratio, and O/P varied from 0.64 to 0.77. The liquid hydrocarbons from SG11 had an O/P range of 0.76–0.91, and the O/P of liquid hydrocarbon from SB had a range of 1.51–1.71. It was obvious that more hydrogen in the feed syngas would lead to more paraffin products, which was consistent with the study of Ordomsky and Khodakov [38], who reported that the increasing H2 partial pressure and decreasing CO partial pressure would result in the termination of the surface species to paraffins. Additionally, Table 3 also showed that the appearance of carbon dioxide and methane in the feed gas would result in the double yield of olefins in the final liquid products though the partial pressure of CO and H2 was decreased. The carbon and hydrogen mass percent in the liquid hydrocarbons had the similar values in spite of the different gas compositions used in the tests. To further understand liquid hydrocarbon quality, the octane number and bromine number were determined at Mississippi state chemical laboratory according to ASTM D 2699 and ASTM D 2710. The average octane number of the liquid hydrocarbons from the three different syngasses were 55.00, 50.00, and 58.27, respectively. The average bromine number of the liquid hydrocarbons were 34.77, 28.60, and 35.65, respectively. Obviously, the hydrogen rich syngas produced higher octane number and bromine number hydrocarbons than those of the hydrogen lean syngas. However, the existence of other carbon sources in the hydrogen lean syngas greatly improved the octane number of the final liquid products. The average relative density of the liquid hydrocarbons from the syngas was 0.71, 0.71, and 0.74, respectively. The average molecular weight of the liquid hydrocarbons was 109.46, 120.00, and 126.47, respectively. The average Reid vapor pressure of the liquid hydrocarbons was 3.28, 2.30, and 1.57, respectively. Apparently, the decreasing hydrogen concentration in the feed syngas would shift the liquid products into higher molecular weight hydrocarbons, the addition of CO2 and CH4 would further facilitate the shift. Moreover, the decreases of CO and H2 partial pressure in SB were also attributed to the above phenomena. A comparison of the catalytic performances of the 3DOM Fe based catalysts with other types of Fe catalysts in FT reaction was summarized in Table 4 [14,37,39–44]. The 3DOM Fe based catalysts had a higher active CO conversion rate and selectivity of C5+ liquid hydrocarbons than those precipitated, or porous materials supported Fe based catalysts. Because 1-olefins were the intermediates of FTS, and small pores of catalyst could limit the mass transfer efficiency of 1-olefins, enhancing the methane selectivity. While the 3DOM catalysts simultaneously had the meso-porous and macro-porous, which could overcome the mass transfer limitation, and the reactants/products diffused in and out of the pores of catalyst more easily, resulting in higher chain growth probability and higher C5+ selectivity [16]. The stability of 3DOM catalyst was tested at 310°C, 279Mpa, GHSV of 3600h−1 with SB syngas. Fig. 7 showed CO and H2 conversions decreased in the first 3h and then increased steadily during the first 10 h, and then stabilized at 89.35% and 88.77%, respectively. After achieving the steady state, the total hydrocarbons selectivity was 88.3%, 65% of which was C5+ hydrocarbons. In the reduction process, the temperature was 350°C and the pressure was 0.35Mpa. After the shift to Fishcher-Tropsch synthesis process, the temperature was decreased from 350to 310°C, which caused the CO conversion rate to decrease(in the first 3h). Then, the CO conversion rate was increased with the pressure under 310°C, and reached the equilibrium at 10h. 4 Conclusions In this paper, the 3DOM Fe based catalysts were prepared. The freshly synthesized 3DOM Fe based catalyst was majorly composed of Fe2O3 with the highly organized hierarchical structure, and the average diameter of the macro-pores was 210nm. The macro-pores were inter-connected with each other through the small windows on the wall with an average thickness of 15nm. After the reduction, the hematite in the fresh 3DOM Fe catalyst was converted to a large amount of iron carbides (χ-Fe5C2, Fe7C3, and CFe15.1) and a small amount of magnetite. At the same time, the reduced catalyst was covered with graphite and amorphous carbon. When reacting in the hydrogen rich syngas, parts of iron carbides were gradually transformed into magnetite due to the oxidation of iron carbides with water, and graphite was gradually removed from the catalyst surface. With decreasing hydrogen content in the syngas, iron carbides almost disappeared and only a small amount of χ-Fe5C2 could be found in the catalyst. After introduction of CO2 and CH4 into the hydrogen lean syngas, iron carbide phase (majorly χ-Fe5C2) was well-preserved in the catalyst. In both types of the hydrogen lean syngas, carbonaceous species on the catalyst surface were transformed into chaoite (also known as carbyne species). 3DOM Fe based catalyst demonstrated an excellent activity in converting three types of syngas with different H2/CO ratios into the liquid hydrocarbons, and its activity was not significantly affected by introducing CO2 and CH4 into the syngas except for the increase of the optimum reaction temperature (about 25°C). At the same time, CO2 and CH4 in the feeding syngas apparently resulted in the double yield of olefins. Lower H2/CO ratios syngas would shift the liquid hydrocarbon distribution to higher molecular weight hydrocarbons, and the addition of CO2 and CH4 in the syngas further facilitated the shift. The methane and carbon dioxide selectivity of 3DOM Fe catalyst was lower compared to the published catalysts. Acknowledgements The present work is supported US Department of Energy under Awards (DE-FG3606GO86025, DE-FC2608NT01923) and Natural Science Foundation of Hubei Province (2014CFA030&2016AHB025). Appendix A Supplementary data Supplementary data associated with this article can be found, in the online version, at http://dx.doi.org/10.1016/j.mcat.2017.07.025. Appendix A Supplementary data The following are Supplementary data to this article: References [1] L.-Q. Ji C. Zhang J.-Q. Fang Renew. Sustain. Energy Rev. 70 2017 224 229 [2] Y.-D. Kim C.-W. Yang B.-J. Kim J.-H. Moon J.-Y. Jeong S.-H. Jeong S.-H. Lee J.-H. Kim M.-W. Seo S.-B. Lee J.-K. Kim U.-D. Lee Appl. Energy 180 2016 301 312 [3] J. Gorimbo X. Lu X. Liu D. Hildebrandt D. Glasser Appl. Catal. A: Gen. 534 2017 1 11 [4] Y. Lu Q. Yan J. Han B. Cao J. Street F. Yu Fuel 193 2017 369 384 [5] Y. Richardson M. Drobek A. Julbe J. Blin F. Pinta Chapter 8 – biomass gasification to produce syngas A2 – Pandey, Ashok T. Bhaskar M. Stöcker R.K. Sukumaran Recent Advances in Thermo-Chemical Conversion of Biomass 2015 Elsevier Boston 213 250 [6] A.A. Ahmad N.A. Zawawi F.H. Kasim A. Inayat A. Khasri Renew. Sustain. Energy Rev. 53 2016 1333 1347 [7] A.N. Pour M.R. Housaindokht J. Zarkesh S.F. Tayyari J. Ind. Eng. Chem. 16 2010 1025 1032 [8] Y. Li X. Qin T. Wang L. Ma L. Chen N. Tsubaki Fuel 136 2014 130 135 [9] X. Gao J. Zhang N. Chen Q. Ma S. Fan T. Zhao N. Tsubaki Chin. J. Catal. 37 2016 510 516 [10] X. Duan D. Wang G. Qian J.C. Walmsley A. Holmen D. Chen X. Zhou J. Energy Chem. 25 2016 311 317 [11] H. Xiong M.A. Motchelaho M. Moyo L.L. Jewell N.J. Coville Fuel 150 2015 687 696 [12] M. Al-Dossary J.L.G. Fierro Appl. Catal. A: Gen. 499 2015 109 117 [13] H. Guo H. Zhang F. Peng H. Yang L. Xiong C. Wang C. Huang X. Chen L. Ma Appl. Catal. A: Gen. 503 2015 51 61 [14] M.G.A. Cruz M. Bastos-Neto A.C. Oliveira J.M. Filho J.M. Soares E. Rodríguez-Castellón F.A.N. Fernandes Appl. Catal. A: Gen. 495 2015 72 83 [15] H. Hou Y. Liu B. Liu P. Jing Y. Gao L. Zhang P. Niu Q. Wang J. Zhang Int. J. Hydrogen Energy 40 2015 878 890 [16] X. Zhang H. Su X. Yang J. Mol. Catal. A: Chem. 360 2012 16 25 [17] J.-S. Jung G.H. Hong J.I. Park E.-H. Yang J.L. Hodala D.J. Moon RSC Adv. 6 2016 104280 104293 [18] Y. Wei Z. Zhao J. Jiao J. Liu A. Duan G. Jiang Catal. Today 245 2015 37 45 [19] S. Xie Y. Liu J. Deng X. Zhao J. Yang K. Zhang Z. Han H. Dai J. Catal. 342 2016 17 26 [20] Y. Lu F. Yu J. Hu J. Liu Appl. Catal. A: Gen. 429–430 2012 48 58 [21] J. Xu J. Liu Z. Zhao J. Zheng G. Zhang A. Duan G. Jiang Catal. Today 153 2010 136 142 [22] E. Rytter A. Holmen Catalysts 5 2015 478 499 [23] A.K. Patra S.K. Kundu A. Bhaumik D. Kim Nanoscale 8 2016 365 377 [24] M. Chen J. Liu W. Zhou J. Lin Z. Shen Sci. Rep. 5 2015 10389 [25] R. Sun H.-B. Zhang J. Yao D. Yang Y.-W. Mai Z.-Z. Yu Carbon 107 2016 138 145 [26] M. Yan Y. Yao J. Wen W. Fu L. Long M. Wang X. Liao G. Yin Z. Huang X. Chen J. Alloys Compd. 641 2015 170 175 [27] D.B. Bukur K. Okabe M.P. Rosynek C.P. Li D.J. Wang K.R.P.M. Rao G.P. Huffman J. Catal. 155 1995 353 365 [28] M. Ding Y. Yang B. Wu Y. Li T. Wang L. Ma Appl. Energy 160 2015 982 989 [29] K. Keyvanloo M.J. Fisher W.C. Hecker R.J. Lancee G. Jacobs C.H. Bartholomew J. Catal. 327 2015 33 47 [30] M. Dad H.O.A. Fredriksson J. Van de Loosdrecht P.C. Thüne J.W. Niemantsverdriet Struct. Catal. React. 1 2015 101 109 [31] H. Wang L. Bian P. Zhou J. Tang W. Tang J. Mater. Chem. A 1 2013 578 584 [32] A. Paredes-Nunez D. Lorito N. Guilhaume C. Mirodatos Y. Schuurman F.C. Meunier Catal. Today 242 2015 178 183 Part A [33] D. Lorito C. Ruocco V. Palma A. Giroir-Fendler F.C. Meunier Appl. Catal. B: Environ. 197 2016 56 61 [34] W.-y. Mao Q.-w. Sun W.-y. Ying D.-y. Fang J. Fuel Chem. Technol. 41 2013 314 321 [35] M. Sarkari F. Fazlollahi H. Ajamein H. Atashi W.C. Hecker L.L. Baxter Fuel Process. Technol. 127 2014 163 170 [36] K.M. Brunner G.E. Harper K. Keyvanloo B.F. Woodfield C.H. Bartholomew W.C. Hecker Hecker Energy Fuels 29 2015 1972 1977 [37] B. Todic L. Nowicki N. Nikacevic D.B. Bukur Catal. Today 261 2016 28 39 [38] V. Ordomsky A. Khodakov ChemCatChem 2016 10.1002/cctc.201601508 [39] K. Mai T. Elder L.H. Groom J.J. Spivey Catal. Commun. 65 2015 76 80 [40] L.M. Chew W. Xia H. Düdder P. Weide H. Ruland M. Muhler Catal. Today 270 2016 85 92 [41] T.J. Okeson K. Keyvanloo J.S. Lawson M.D. Argyle W.C. Hecker Catal. Today 261 2016 67 74 [42] C.G. Visconti M. Martinelli L. Falbo A. Infantes-Molina L. Lietti P. Forzatti G. Iaquaniello E. Palo B. Picutti F. Brignoli Appl. Catal. B: Environ. 200 2017 530 542 [43] C. Xing J. Sun Q. Chen G. Yang N. Muranaka P. Lu W. Shen P. Zhu Q. Wei J. Li J. Mao R. Yang N. Tsubaki Catal. Today 251 2015 41 46 [44] V.R.R. Pendyala G. Jacobs M.K. Gnanamani Y. Hu A. MacLennan B.H. Davis Appl. Catal. A: Gen. 495 2015 45 53",
      "scopus-id": "85029596639",
      "coredata": {
        "eid": "1-s2.0-S2468823117304340",
        "dc:description": "Three-Dimensionally Ordered Macro-porous (3DOM) Fe based catalysts were synthesized via a facile “glyoxylate route” poly (methyl methacrylate) (PMMA) colloidal crystal template (CCT) method. Fischer Tropsch Synthesis (FT) using different biosyngasses over the 3DOM Fe based catalyst for producing the liquid hydrocarbon was studied. The morphology, structure and microstructures of 3DOM Fe based catalysts were characterized by SEM, BET, TPR, HRTEM, XRD, XPS and DRIFTS. The experimental results demonstrated that the hydrogen lean syngas decreased the partial pressure of H2/CO, which caused the decrease of the CO conversion rate during FT reaction. Moreover, the addition of CO2 and CH4 in the hydrogen lean syngas could well preserve the iron carbide phase in the catalyst, and the CO conversion rate was improved. Lower H2/CO ratio syngas would shift the liquid hydrocarbon distribution to higher molecular weight hydrocarbons, and the addition of CO2 and CH4 into the syngas further facilitated the shift. Meanwhile, it was also found that the CO conversion rate and C5+ selectivity were 68.23% and 70.44% respectively during the simulated biosyngas from biomass gasification (the hydrogen lean syngas contained CO2 and CH4) FT over the 3DOM Fe based catalyst, and CO2 and CH4 selectivity were 12–26% and 2.67–5.5% respectively.",
        "openArchiveArticle": "false",
        "prism:coverDate": "2017-10-31",
        "openaccessUserLicense": null,
        "prism:aggregationType": "Journal",
        "prism:url": "https://api.elsevier.com/content/article/pii/S2468823117304340",
        "dc:creator": [
          {
            "@_fa": "true",
            "$": "Han, Jun"
          },
          {
            "@_fa": "true",
            "$": "Zhang, Li"
          },
          {
            "@_fa": "true",
            "$": "Lu, Yongwu"
          },
          {
            "@_fa": "true",
            "$": "Hu, Jin"
          },
          {
            "@_fa": "true",
            "$": "Cao, Baobao"
          },
          {
            "@_fa": "true",
            "$": "Yu, Fei"
          }
        ],
        "link": [
          {
            "@_fa": "true",
            "@rel": "self",
            "@href": "https://api.elsevier.com/content/article/pii/S2468823117304340"
          },
          {
            "@_fa": "true",
            "@rel": "scidir",
            "@href": "https://www.sciencedirect.com/science/article/pii/S2468823117304340"
          }
        ],
        "dc:format": "application/json",
        "openaccessType": null,
        "pii": "S2468-8231(17)30434-0",
        "prism:volume": "440",
        "prism:publisher": "Elsevier B.V.",
        "dc:title": "The effect of syngas composition on the Fischer Tropsch synthesis over three-dimensionally ordered macro-porous iron based catalyst",
        "prism:copyright": "© 2017 Elsevier B.V. All rights reserved.",
        "openaccess": "0",
        "prism:issn": "24688231",
        "dcterms:subject": [
          {
            "@_fa": "true",
            "$": "Three-dimensionally ordered macro-porous (3DOM)"
          },
          {
            "@_fa": "true",
            "$": "Iron catalyst"
          },
          {
            "@_fa": "true",
            "$": "Fischer–Tropsch synthesis"
          },
          {
            "@_fa": "true",
            "$": "Syngas"
          }
        ],
        "openaccessArticle": "false",
        "prism:publicationName": "Molecular Catalysis",
        "openaccessSponsorType": null,
        "prism:pageRange": "175-183",
        "prism:endingPage": "183",
        "pubType": "fla",
        "prism:coverDisplayDate": "October 2017",
        "prism:doi": "10.1016/j.mcat.2017.07.025",
        "prism:startingPage": "175",
        "dc:identifier": "doi:10.1016/j.mcat.2017.07.025",
        "openaccessSponsorName": null
      },
      "objects": {
        "object": [
          {
            "@category": "thumbnail",
            "@height": "88",
            "@width": "219",
            "@_fa": "true",
            "$": "https://api.elsevier.com/content/object/eid/1-s2.0-S2468823117304340-fx1.sml?httpAccept=%2A%2F%2A",
            "@multimediatype": "GIF image file",
            "@type": "IMAGE-THUMBNAIL",
            "@size": "9367",
            "@ref": "fx1",
            "@mimetype": "image/gif"
          },
          {
            "@category": "thumbnail",
            "@height": "87",
            "@width": "219",
            "@_fa": "true",
            "$": "https://api.elsevier.com/content/object/eid/1-s2.0-S2468823117304340-gr1.sml?httpAccept=%2A%2F%2A",
            "@multimediatype": "GIF image file",
            "@type": "IMAGE-THUMBNAIL",
            "@size": "12417",
            "@ref": "gr1",
            "@mimetype": "image/gif"
          },
          {
            "@category": "thumbnail",
            "@height": "145",
            "@width": "219",
            "@_fa": "true",
            "$": "https://api.elsevier.com/content/object/eid/1-s2.0-S2468823117304340-gr2.sml?httpAccept=%2A%2F%2A",
            "@multimediatype": "GIF image file",
            "@type": "IMAGE-THUMBNAIL",
            "@size": "16289",
            "@ref": "gr2",
            "@mimetype": "image/gif"
          },
          {
            "@category": "thumbnail",
            "@height": "164",
            "@width": "142",
            "@_fa": "true",
            "$": "https://api.elsevier.com/content/object/eid/1-s2.0-S2468823117304340-gr3.sml?httpAccept=%2A%2F%2A",
            "@multimediatype": "GIF image file",
            "@type": "IMAGE-THUMBNAIL",
            "@size": "6638",
            "@ref": "gr3",
            "@mimetype": "image/gif"
          },
          {
            "@category": "thumbnail",
            "@height": "164",
            "@width": "212",
            "@_fa": "true",
            "$": "https://api.elsevier.com/content/object/eid/1-s2.0-S2468823117304340-gr4.sml?httpAccept=%2A%2F%2A",
            "@multimediatype": "GIF image file",
            "@type": "IMAGE-THUMBNAIL",
            "@size": "7418",
            "@ref": "gr4",
            "@mimetype": "image/gif"
          },
          {
            "@category": "thumbnail",
            "@height": "164",
            "@width": "212",
            "@_fa": "true",
            "$": "https://api.elsevier.com/content/object/eid/1-s2.0-S2468823117304340-gr5.sml?httpAccept=%2A%2F%2A",
            "@multimediatype": "GIF image file",
            "@type": "IMAGE-THUMBNAIL",
            "@size": "6564",
            "@ref": "gr5",
            "@mimetype": "image/gif"
          },
          {
            "@category": "thumbnail",
            "@height": "164",
            "@width": "213",
            "@_fa": "true",
            "$": "https://api.elsevier.com/content/object/eid/1-s2.0-S2468823117304340-gr6.sml?httpAccept=%2A%2F%2A",
            "@multimediatype": "GIF image file",
            "@type": "IMAGE-THUMBNAIL",
            "@size": "8448",
            "@ref": "gr6",
            "@mimetype": "image/gif"
          },
          {
            "@category": "thumbnail",
            "@height": "164",
            "@width": "194",
            "@_fa": "true",
            "$": "https://api.elsevier.com/content/object/eid/1-s2.0-S2468823117304340-gr7.sml?httpAccept=%2A%2F%2A",
            "@multimediatype": "GIF image file",
            "@type": "IMAGE-THUMBNAIL",
            "@size": "6463",
            "@ref": "gr7",
            "@mimetype": "image/gif"
          },
          {
            "@category": "standard",
            "@height": "200",
            "@width": "500",
            "@_fa": "true",
            "$": "https://api.elsevier.com/content/object/eid/1-s2.0-S2468823117304340-fx1.jpg?httpAccept=%2A%2F%2A",
            "@multimediatype": "JPEG image file",
            "@type": "IMAGE-DOWNSAMPLED",
            "@size": "32585",
            "@ref": "fx1",
            "@mimetype": "image/jpeg"
          },
          {
            "@category": "standard",
            "@height": "225",
            "@width": "565",
            "@_fa": "true",
            "$": "https://api.elsevier.com/content/object/eid/1-s2.0-S2468823117304340-gr1.jpg?httpAccept=%2A%2F%2A",
            "@multimediatype": "JPEG image file",
            "@type": "IMAGE-DOWNSAMPLED",
            "@size": "45922",
            "@ref": "gr1",
            "@mimetype": "image/jpeg"
          },
          {
            "@category": "standard",
            "@height": "374",
            "@width": "565",
            "@_fa": "true",
            "$": "https://api.elsevier.com/content/object/eid/1-s2.0-S2468823117304340-gr2.jpg?httpAccept=%2A%2F%2A",
            "@multimediatype": "JPEG image file",
            "@type": "IMAGE-DOWNSAMPLED",
            "@size": "69477",
            "@ref": "gr2",
            "@mimetype": "image/jpeg"
          },
          {
            "@category": "standard",
            "@height": "868",
            "@width": "753",
            "@_fa": "true",
            "$": "https://api.elsevier.com/content/object/eid/1-s2.0-S2468823117304340-gr3.jpg?httpAccept=%2A%2F%2A",
            "@multimediatype": "JPEG image file",
            "@type": "IMAGE-DOWNSAMPLED",
            "@size": "114813",
            "@ref": "gr3",
            "@mimetype": "image/jpeg"
          },
          {
            "@category": "standard",
            "@height": "290",
            "@width": "376",
            "@_fa": "true",
            "$": "https://api.elsevier.com/content/object/eid/1-s2.0-S2468823117304340-gr4.jpg?httpAccept=%2A%2F%2A",
            "@multimediatype": "JPEG image file",
            "@type": "IMAGE-DOWNSAMPLED",
            "@size": "26763",
            "@ref": "gr4",
            "@mimetype": "image/jpeg"
          },
          {
            "@category": "standard",
            "@height": "290",
            "@width": "376",
            "@_fa": "true",
            "$": "https://api.elsevier.com/content/object/eid/1-s2.0-S2468823117304340-gr5.jpg?httpAccept=%2A%2F%2A",
            "@multimediatype": "JPEG image file",
            "@type": "IMAGE-DOWNSAMPLED",
            "@size": "22648",
            "@ref": "gr5",
            "@mimetype": "image/jpeg"
          },
          {
            "@category": "standard",
            "@height": "290",
            "@width": "376",
            "@_fa": "true",
            "$": "https://api.elsevier.com/content/object/eid/1-s2.0-S2468823117304340-gr6.jpg?httpAccept=%2A%2F%2A",
            "@multimediatype": "JPEG image file",
            "@type": "IMAGE-DOWNSAMPLED",
            "@size": "27973",
            "@ref": "gr6",
            "@mimetype": "image/jpeg"
          },
          {
            "@category": "standard",
            "@height": "255",
            "@width": "301",
            "@_fa": "true",
            "$": "https://api.elsevier.com/content/object/eid/1-s2.0-S2468823117304340-gr7.jpg?httpAccept=%2A%2F%2A",
            "@multimediatype": "JPEG image file",
            "@type": "IMAGE-DOWNSAMPLED",
            "@size": "18578",
            "@ref": "gr7",
            "@mimetype": "image/jpeg"
          },
          {
            "@category": "standard",
            "@_fa": "true",
            "$": "https://api.elsevier.com/content/object/eid/1-s2.0-S2468823117304340-mmc1.docx?httpAccept=%2A%2F%2A",
            "@multimediatype": "Microsoft Word file",
            "@type": "APPLICATION",
            "@size": "554638",
            "@ref": "mmc1",
            "@mimetype": "application/word"
          },
          {
            "@category": "thumbnail",
            "@height": "15",
            "@width": "260",
            "@_fa": "true",
            "$": "https://api.elsevier.com/content/object/eid/1-s2.0-S2468823117304340-si1.gif?httpAccept=%2A%2F%2A",
            "@multimediatype": "GIF image file",
            "@type": "ALTIMG",
            "@size": "931",
            "@ref": "si1",
            "@mimetype": "image/gif"
          },
          {
            "@category": "thumbnail",
            "@height": "14",
            "@width": "199",
            "@_fa": "true",
            "$": "https://api.elsevier.com/content/object/eid/1-s2.0-S2468823117304340-si2.gif?httpAccept=%2A%2F%2A",
            "@multimediatype": "GIF image file",
            "@type": "ALTIMG",
            "@size": "691",
            "@ref": "si2",
            "@mimetype": "image/gif"
          },
          {
            "@category": "thumbnail",
            "@height": "15",
            "@width": "270",
            "@_fa": "true",
            "$": "https://api.elsevier.com/content/object/eid/1-s2.0-S2468823117304340-si3.gif?httpAccept=%2A%2F%2A",
            "@multimediatype": "GIF image file",
            "@type": "ALTIMG",
            "@size": "919",
            "@ref": "si3",
            "@mimetype": "image/gif"
          },
          {
            "@category": "thumbnail",
            "@height": "34",
            "@width": "331",
            "@_fa": "true",
            "$": "https://api.elsevier.com/content/object/eid/1-s2.0-S2468823117304340-si4.gif?httpAccept=%2A%2F%2A",
            "@multimediatype": "GIF image file",
            "@type": "ALTIMG",
            "@size": "1288",
            "@ref": "si4",
            "@mimetype": "image/gif"
          },
          {
            "@category": "thumbnail",
            "@height": "25",
            "@width": "385",
            "@_fa": "true",
            "$": "https://api.elsevier.com/content/object/eid/1-s2.0-S2468823117304340-si5.gif?httpAccept=%2A%2F%2A",
            "@multimediatype": "GIF image file",
            "@type": "ALTIMG",
            "@size": "1401",
            "@ref": "si5",
            "@mimetype": "image/gif"
          },
          {
            "@category": "thumbnail",
            "@height": "35",
            "@width": "436",
            "@_fa": "true",
            "$": "https://api.elsevier.com/content/object/eid/1-s2.0-S2468823117304340-si6.gif?httpAccept=%2A%2F%2A",
            "@multimediatype": "GIF image file",
            "@type": "ALTIMG",
            "@size": "2299",
            "@ref": "si6",
            "@mimetype": "image/gif"
          },
          {
            "@category": "thumbnail",
            "@height": "25",
            "@width": "337",
            "@_fa": "true",
            "$": "https://api.elsevier.com/content/object/eid/1-s2.0-S2468823117304340-si7.gif?httpAccept=%2A%2F%2A",
            "@multimediatype": "GIF image file",
            "@type": "ALTIMG",
            "@size": "1398",
            "@ref": "si7",
            "@mimetype": "image/gif"
          },
          {
            "@category": "thumbnail",
            "@height": "16",
            "@width": "408",
            "@_fa": "true",
            "$": "https://api.elsevier.com/content/object/eid/1-s2.0-S2468823117304340-si8.gif?httpAccept=%2A%2F%2A",
            "@multimediatype": "GIF image file",
            "@type": "ALTIMG",
            "@size": "1409",
            "@ref": "si8",
            "@mimetype": "image/gif"
          },
          {
            "@category": "standard",
            "@_fa": "true",
            "$": "https://api.elsevier.com/content/object/eid/1-s2.0-S2468823117304340-Jun_Han_Iron_catalyst_2017_P05.jpg?httpAccept=%2A%2F%2A",
            "@multimediatype": "JPEG image file",
            "@type": "AAM-PAGE-IMAGE",
            "@size": "540844",
            "@ref": "Jun_Han_Iron_catalyst_2017_P05",
            "@mimetype": "image/jpeg"
          },
          {
            "@category": "standard",
            "@_fa": "true",
            "$": "https://api.elsevier.com/content/object/eid/1-s2.0-S2468823117304340-Jun_Han_Iron_catalyst_2017_P09.jpg?httpAccept=%2A%2F%2A",
            "@multimediatype": "JPEG image file",
            "@type": "AAM-PAGE-IMAGE",
            "@size": "549337",
            "@ref": "Jun_Han_Iron_catalyst_2017_P09",
            "@mimetype": "image/jpeg"
          },
          {
            "@category": "standard",
            "@_fa": "true",
            "$": "https://api.elsevier.com/content/object/eid/1-s2.0-S2468823117304340-Jun_Han_Iron_catalyst_2017_P16.jpg?httpAccept=%2A%2F%2A",
            "@multimediatype": "JPEG image file",
            "@type": "AAM-PAGE-IMAGE",
            "@size": "576216",
            "@ref": "Jun_Han_Iron_catalyst_2017_P16",
            "@mimetype": "image/jpeg"
          },
          {
            "@category": "standard",
            "@_fa": "true",
            "$": "https://api.elsevier.com/content/object/eid/1-s2.0-S2468823117304340-Jun_Han_Iron_catalyst_2017_P22.jpg?httpAccept=%2A%2F%2A",
            "@multimediatype": "JPEG image file",
            "@type": "AAM-PAGE-IMAGE",
            "@size": "243239",
            "@ref": "Jun_Han_Iron_catalyst_2017_P22",
            "@mimetype": "image/jpeg"
          },
          {
            "@category": "standard",
            "@_fa": "true",
            "$": "https://api.elsevier.com/content/object/eid/1-s2.0-S2468823117304340-Jun_Han_Iron_catalyst_2017_P03.jpg?httpAccept=%2A%2F%2A",
            "@multimediatype": "JPEG image file",
            "@type": "AAM-PAGE-IMAGE",
            "@size": "501941",
            "@ref": "Jun_Han_Iron_catalyst_2017_P03",
            "@mimetype": "image/jpeg"
          },
          {
            "@category": "standard",
            "@_fa": "true",
            "$": "https://api.elsevier.com/content/object/eid/1-s2.0-S2468823117304340-Jun_Han_Iron_catalyst_2017_P12.jpg?httpAccept=%2A%2F%2A",
            "@multimediatype": "JPEG image file",
            "@type": "AAM-PAGE-IMAGE",
            "@size": "466728",
            "@ref": "Jun_Han_Iron_catalyst_2017_P12",
            "@mimetype": "image/jpeg"
          },
          {
            "@category": "standard",
            "@_fa": "true",
            "$": "https://api.elsevier.com/content/object/eid/1-s2.0-S2468823117304340-Jun_Han_Iron_catalyst_2017_P10.jpg?httpAccept=%2A%2F%2A",
            "@multimediatype": "JPEG image file",
            "@type": "AAM-PAGE-IMAGE",
            "@size": "503423",
            "@ref": "Jun_Han_Iron_catalyst_2017_P10",
            "@mimetype": "image/jpeg"
          },
          {
            "@category": "standard",
            "@_fa": "true",
            "$": "https://api.elsevier.com/content/object/eid/1-s2.0-S2468823117304340-Jun_Han_Iron_catalyst_2017_P18.jpg?httpAccept=%2A%2F%2A",
            "@multimediatype": "JPEG image file",
            "@type": "AAM-PAGE-IMAGE",
            "@size": "521227",
            "@ref": "Jun_Han_Iron_catalyst_2017_P18",
            "@mimetype": "image/jpeg"
          },
          {
            "@category": "standard",
            "@_fa": "true",
            "$": "https://api.elsevier.com/content/object/eid/1-s2.0-S2468823117304340-Jun_Han_Iron_catalyst_2017_P11.jpg?httpAccept=%2A%2F%2A",
            "@multimediatype": "JPEG image file",
            "@type": "AAM-PAGE-IMAGE",
            "@size": "408571",
            "@ref": "Jun_Han_Iron_catalyst_2017_P11",
            "@mimetype": "image/jpeg"
          },
          {
            "@category": "standard",
            "@_fa": "true",
            "$": "https://api.elsevier.com/content/object/eid/1-s2.0-S2468823117304340-Jun_Han_Iron_catalyst_2017_P08.jpg?httpAccept=%2A%2F%2A",
            "@multimediatype": "JPEG image file",
            "@type": "AAM-PAGE-IMAGE",
            "@size": "517785",
            "@ref": "Jun_Han_Iron_catalyst_2017_P08",
            "@mimetype": "image/jpeg"
          },
          {
            "@category": "standard",
            "@_fa": "true",
            "$": "https://api.elsevier.com/content/object/eid/1-s2.0-S2468823117304340-Jun_Han_Iron_catalyst_2017_P31.jpg?httpAccept=%2A%2F%2A",
            "@multimediatype": "JPEG image file",
            "@type": "AAM-PAGE-IMAGE",
            "@size": "202758",
            "@ref": "Jun_Han_Iron_catalyst_2017_P31",
            "@mimetype": "image/jpeg"
          },
          {
            "@category": "standard",
            "@_fa": "true",
            "$": "https://api.elsevier.com/content/object/eid/1-s2.0-S2468823117304340-Jun_Han_Iron_catalyst_2017_P02.jpg?httpAccept=%2A%2F%2A",
            "@multimediatype": "JPEG image file",
            "@type": "AAM-PAGE-IMAGE",
            "@size": "245825",
            "@ref": "Jun_Han_Iron_catalyst_2017_P02",
            "@mimetype": "image/jpeg"
          },
          {
            "@category": "standard",
            "@_fa": "true",
            "$": "https://api.elsevier.com/content/object/eid/1-s2.0-S2468823117304340-Jun_Han_Iron_catalyst_2017_P23.jpg?httpAccept=%2A%2F%2A",
            "@multimediatype": "JPEG image file",
            "@type": "AAM-PAGE-IMAGE",
            "@size": "481892",
            "@ref": "Jun_Han_Iron_catalyst_2017_P23",
            "@mimetype": "image/jpeg"
          },
          {
            "@category": "standard",
            "@_fa": "true",
            "$": "https://api.elsevier.com/content/object/eid/1-s2.0-S2468823117304340-Jun_Han_Iron_catalyst_2017_P06.jpg?httpAccept=%2A%2F%2A",
            "@multimediatype": "JPEG image file",
            "@type": "AAM-PAGE-IMAGE",
            "@size": "509535",
            "@ref": "Jun_Han_Iron_catalyst_2017_P06",
            "@mimetype": "image/jpeg"
          },
          {
            "@category": "standard",
            "@_fa": "true",
            "$": "https://api.elsevier.com/content/object/eid/1-s2.0-S2468823117304340-Jun_Han_Iron_catalyst_2017_P19.jpg?httpAccept=%2A%2F%2A",
            "@multimediatype": "JPEG image file",
            "@type": "AAM-PAGE-IMAGE",
            "@size": "398510",
            "@ref": "Jun_Han_Iron_catalyst_2017_P19",
            "@mimetype": "image/jpeg"
          },
          {
            "@category": "standard",
            "@_fa": "true",
            "$": "https://api.elsevier.com/content/object/eid/1-s2.0-S2468823117304340-Jun_Han_Iron_catalyst_2017_P25.jpg?httpAccept=%2A%2F%2A",
            "@multimediatype": "JPEG image file",
            "@type": "AAM-PAGE-IMAGE",
            "@size": "197594",
            "@ref": "Jun_Han_Iron_catalyst_2017_P25",
            "@mimetype": "image/jpeg"
          },
          {
            "@category": "standard",
            "@_fa": "true",
            "$": "https://api.elsevier.com/content/object/eid/1-s2.0-S2468823117304340-Jun_Han_Iron_catalyst_2017_P17.jpg?httpAccept=%2A%2F%2A",
            "@multimediatype": "JPEG image file",
            "@type": "AAM-PAGE-IMAGE",
            "@size": "504161",
            "@ref": "Jun_Han_Iron_catalyst_2017_P17",
            "@mimetype": "image/jpeg"
          },
          {
            "@category": "standard",
            "@_fa": "true",
            "$": "https://api.elsevier.com/content/object/eid/1-s2.0-S2468823117304340-Jun_Han_Iron_catalyst_2017_P24.jpg?httpAccept=%2A%2F%2A",
            "@multimediatype": "JPEG image file",
            "@type": "AAM-PAGE-IMAGE",
            "@size": "337156",
            "@ref": "Jun_Han_Iron_catalyst_2017_P24",
            "@mimetype": "image/jpeg"
          },
          {
            "@category": "standard",
            "@_fa": "true",
            "$": "https://api.elsevier.com/content/object/eid/1-s2.0-S2468823117304340-Jun_Han_Iron_catalyst_2017_P07.jpg?httpAccept=%2A%2F%2A",
            "@multimediatype": "JPEG image file",
            "@type": "AAM-PAGE-IMAGE",
            "@size": "440051",
            "@ref": "Jun_Han_Iron_catalyst_2017_P07",
            "@mimetype": "image/jpeg"
          },
          {
            "@category": "standard",
            "@_fa": "true",
            "$": "https://api.elsevier.com/content/object/eid/1-s2.0-S2468823117304340-Jun_Han_Iron_catalyst_2017_P13.jpg?httpAccept=%2A%2F%2A",
            "@multimediatype": "JPEG image file",
            "@type": "AAM-PAGE-IMAGE",
            "@size": "512223",
            "@ref": "Jun_Han_Iron_catalyst_2017_P13",
            "@mimetype": "image/jpeg"
          },
          {
            "@category": "standard",
            "@_fa": "true",
            "$": "https://api.elsevier.com/content/object/eid/1-s2.0-S2468823117304340-Jun_Han_Iron_catalyst_2017_P15.jpg?httpAccept=%2A%2F%2A",
            "@multimediatype": "JPEG image file",
            "@type": "AAM-PAGE-IMAGE",
            "@size": "559606",
            "@ref": "Jun_Han_Iron_catalyst_2017_P15",
            "@mimetype": "image/jpeg"
          },
          {
            "@category": "standard",
            "@_fa": "true",
            "$": "https://api.elsevier.com/content/object/eid/1-s2.0-S2468823117304340-Jun_Han_Iron_catalyst_2017_P30.jpg?httpAccept=%2A%2F%2A",
            "@multimediatype": "JPEG image file",
            "@type": "AAM-PAGE-IMAGE",
            "@size": "527795",
            "@ref": "Jun_Han_Iron_catalyst_2017_P30",
            "@mimetype": "image/jpeg"
          },
          {
            "@category": "standard",
            "@_fa": "true",
            "$": "https://api.elsevier.com/content/object/eid/1-s2.0-S2468823117304340-Jun_Han_Iron_catalyst_2017_P28.jpg?httpAccept=%2A%2F%2A",
            "@multimediatype": "JPEG image file",
            "@type": "AAM-PAGE-IMAGE",
            "@size": "139552",
            "@ref": "Jun_Han_Iron_catalyst_2017_P28",
            "@mimetype": "image/jpeg"
          },
          {
            "@category": "standard",
            "@_fa": "true",
            "$": "https://api.elsevier.com/content/object/eid/1-s2.0-S2468823117304340-Jun_Han_Iron_catalyst_2017_P14.jpg?httpAccept=%2A%2F%2A",
            "@multimediatype": "JPEG image file",
            "@type": "AAM-PAGE-IMAGE",
            "@size": "594896",
            "@ref": "Jun_Han_Iron_catalyst_2017_P14",
            "@mimetype": "image/jpeg"
          },
          {
            "@category": "standard",
            "@_fa": "true",
            "$": "https://api.elsevier.com/content/object/eid/1-s2.0-S2468823117304340-Jun_Han_Iron_catalyst_2017_P20.jpg?httpAccept=%2A%2F%2A",
            "@multimediatype": "JPEG image file",
            "@type": "AAM-PAGE-IMAGE",
            "@size": "457360",
            "@ref": "Jun_Han_Iron_catalyst_2017_P20",
            "@mimetype": "image/jpeg"
          },
          {
            "@category": "standard",
            "@_fa": "true",
            "$": "https://api.elsevier.com/content/object/eid/1-s2.0-S2468823117304340-Jun_Han_Iron_catalyst_2017_P04.jpg?httpAccept=%2A%2F%2A",
            "@multimediatype": "JPEG image file",
            "@type": "AAM-PAGE-IMAGE",
            "@size": "527429",
            "@ref": "Jun_Han_Iron_catalyst_2017_P04",
            "@mimetype": "image/jpeg"
          },
          {
            "@category": "standard",
            "@_fa": "true",
            "$": "https://api.elsevier.com/content/object/eid/1-s2.0-S2468823117304340-Jun_Han_Iron_catalyst_2017_P26.jpg?httpAccept=%2A%2F%2A",
            "@multimediatype": "JPEG image file",
            "@type": "AAM-PAGE-IMAGE",
            "@size": "195534",
            "@ref": "Jun_Han_Iron_catalyst_2017_P26",
            "@mimetype": "image/jpeg"
          },
          {
            "@category": "standard",
            "@_fa": "true",
            "$": "https://api.elsevier.com/content/object/eid/1-s2.0-S2468823117304340-Jun_Han_Iron_catalyst_2017_P01.jpg?httpAccept=%2A%2F%2A",
            "@multimediatype": "JPEG image file",
            "@type": "AAM-PAGE-IMAGE",
            "@size": "462222",
            "@ref": "Jun_Han_Iron_catalyst_2017_P01",
            "@mimetype": "image/jpeg"
          },
          {
            "@category": "standard",
            "@_fa": "true",
            "$": "https://api.elsevier.com/content/object/eid/1-s2.0-S2468823117304340-Jun_Han_Iron_catalyst_2017_P21.jpg?httpAccept=%2A%2F%2A",
            "@multimediatype": "JPEG image file",
            "@type": "AAM-PAGE-IMAGE",
            "@size": "436741",
            "@ref": "Jun_Han_Iron_catalyst_2017_P21",
            "@mimetype": "image/jpeg"
          },
          {
            "@category": "standard",
            "@_fa": "true",
            "$": "https://api.elsevier.com/content/object/eid/1-s2.0-S2468823117304340-Jun_Han_Iron_catalyst_2017_P29.jpg?httpAccept=%2A%2F%2A",
            "@multimediatype": "JPEG image file",
            "@type": "AAM-PAGE-IMAGE",
            "@size": "169859",
            "@ref": "Jun_Han_Iron_catalyst_2017_P29",
            "@mimetype": "image/jpeg"
          },
          {
            "@category": "standard",
            "@_fa": "true",
            "$": "https://api.elsevier.com/content/object/eid/1-s2.0-S2468823117304340-Jun_Han_Iron_catalyst_2017_P27.jpg?httpAccept=%2A%2F%2A",
            "@multimediatype": "JPEG image file",
            "@type": "AAM-PAGE-IMAGE",
            "@size": "206805",
            "@ref": "Jun_Han_Iron_catalyst_2017_P27",
            "@mimetype": "image/jpeg"
          },
          {
            "@category": "standard",
            "@_fa": "true",
            "$": "https://api.elsevier.com/content/object/eid/1-s2.0-S2468823117304340-am.pdf?httpAccept=%2A%2F%2A",
            "@multimediatype": "Acrobat PDF file",
            "@type": "AAM-PDF",
            "@size": "674308",
            "@ref": "am",
            "@mimetype": "application/pdf"
          }
        ]
      },
      "link": {
        "@rel": "abstract",
        "@href": "https://api.elsevier.com/content/abstract/scopus_id/85029596639"
      }
    }
  }
}