{
  "metadata": {
    "title": "Al-free Zr-beta zeolite as a selective catalyst for the ketalization of glycerol",
    "authors": "; ; ",
    "journal": "Molecular Catalysis",
    "date": "2022-08-31",
    "doi": "10.1016/j.mcat.2022.112497",
    "abstract": "",
    "uri": "https://api.elsevier.com/content/article/pii/S2468823122003832",
    "pii": "S2468823122003832"
  },
  "fulltext": {
    "full-text-retrieval-response": {
      "scopus-eid": "2-s2.0-85133905305",
      "originalText": "serial JL 315758 291210 291744 291790 291809 31 Molecular Catalysis MOLECULARCATALYSIS 2022-07-10 2022-07-10 2022-07-10 2022-07-10 2023-04-22T07:57:07 1-s2.0-S2468823122003832 S2468-8231(22)00383-2 S2468823122003832 10.1016/j.mcat.2022.112497 S300 S300.1 FULL-TEXT 1-s2.0-S2468823122X00114 2024-06-26T17:47:42.372199Z 0 0 20220801 20220831 2022 2022-07-10T22:24:20.397389Z absattachment articleinfo articlenumber articletitlenorm authfirstinitialnorm authfirstsurnamenorm cid cids contenttype copyright crossmark dateloaded dateloadedtxt datesearch datesort dateupdated dco docsubtype doctype doi eid ewtransactionid hubeid indexeddate issn issnnorm itemstage itemtransactionid itemweight openaccess openarchive pg pgfirst pii piinorm pubdateend pubdatestart pubdatetxt pubyr sectiontitle sortorder srctitle srctitlenorm srctype ssids alllist content subj subheadings suppl tomb volfirst volissue volumelist webpdf webpdfpagecount yearnav figure table e-component body mmlmath acknowledge affil appendices articletitle auth authfirstini authfull authkeywords authlast grantnumber grantsponsor highlightsabst orcid primabst ref specialabst 2468-8231 24688231 true 528 528 C Volume 528 54 112497 112497 112497 202208 August 2022 2022-08-01 2022-08-31 2022 Regular Papers article fla © 2022 Elsevier B.V. All rights reserved. ALFREEZRBETAZEOLITEASELECTIVECATALYSTFORKETALIZATIONGLYCEROL VANNUCCI J 1 Introduction 2 Experimental 2.1 Materials 2.2 Synthesis of catalysts 2.2.1 Sulfonic SBA-15 2.2.2 Zr-zeolite beta Synthesis of dealuminated zeolite beta seeds Synthesis of dealuminated Zr-zeolite beta from the prepared seed (Method 1) Synthesis of dealuminated Zr-zeolite beta (Method 2) 2.3 Characterization of catalyst 2.4 Catalytic test 3 Results 3.1 Catalyst characterization 3.2 Catalytic activity 3.3 Catalytic stability 4 Conclusion CRediT authorship contribution statement Acknowledgments Appendix Supplementary materials References LIN 2020 325 340 Q ANUAR 2016 208 223 M ALPTEKIN 2017 504 509 E SABNIS 2007 196 202 S ESTEBAN 2017 79 89 J FERREIRA 2010 94 99 P TIMOFEEVA 2017 65 69 M VICENTE 2010 899 907 G LI 2015 289 296 L LI 2018 377 387 Z SERAFIM 2011 291 296 H PRIYA 2017 184 193 S VIEIRA 2018 161 170 L DASILVA 2020 118724 M KAO 2020 80 87 L JOSEDASILVA 2020 9664 9673 M CORMA 1997 2373 2420 A DASILVA 2009 38 41 C POLY 2019 110608 S KOWALSKAKUS 2020 510 519 J WANG 2015 112 120 J GAO 2020 623 630 L KOEHLE 2016 3018 3026 M GONELL 2017 2865 2873 F LI 2020 105845 W LUO 2014 198 207 H SUSHKEVICH 2015 17633 17639 V PANIAGUA 2021 228 238 M LI 2012 1611 1619 L ZHU 2004 1 10 Y CORMA 2003 294 304 A BOSSAERT 1999 156 164 W CAMBLOR 1993 82 87 M BRUNAUER 1938 309 319 S MIRANDAM 2015 325 335 C ZHANG 2019 56 67 H LI 2019 4055 4065 G THOMMES 2022 1051 1069 M LOWELL 2004 S CHARACTERIZATIONPOROUSSOLIDSPOWDERSSURFACEAREAPORESIZEDENSITY IZQUIERDOBARBA 2010 442 452 I SARTORI 2004 410 418 G CATTANEO 2016 219 229 A GRZECHNIK 2012 96 102 K YANG 2005 17842 17847 C STUART 2004 B INFRAREDSPECTROSCOPYFUNDAMENTALSAPPLICATIONS WANG 2005 1763 1769 X JENTYS 1989 585 594 A ZEOLITESCATALSORBENTSDETERGBUILD IRSTUDYADSORPTIONBENZENEHZSM5 SAZAMA 2011 87 96 P SUSHKEVICH 2014 121 129 V CID 1985 15 21 R YU 2021 7982 7992 Q SCHULER 2013 F IMPACTLACATIONSINFAUTYPEZEOLITESHYDRIDETRANSFERREACTIONS DASILVA 2020 118164 M MANJUNATHAN 2015 47 54 P NANDA 2016 1022 1031 M FOSTER 1965 3388 3394 A SURIYAPRAPADILOK 2011 63 69 N MAHRENI 2019 12004 SOCRATES 2004 G INFRAREDRAMANCHARACTERISTICGROUPFREQUENCIESTABLESCHARTS SANDESH 2015 73 80 S VANNUCCIX2022X112497 VANNUCCIX2022X112497XJ 2024-07-10T00:00:00.000Z 2024-07-10T00:00:00.000Z http://creativecommons.org/licenses/by-nc-nd/4.0/ © 2022 Elsevier B.V. All rights reserved. 2022-07-17T05:31:19.243Z http://vtw.elsevier.com/data/voc/AddOnTypes/50.7/aggregated-refined ANPCyT PME8-2003 ANPCyT Agencia Nacional de Promoción Científica y Tecnológica http://data.elsevier.com/vocabulary/SciValFunders/501100003074 http://sws.geonames.org/3865483/ Universidad Nacional de La Plata UNLP-I248 UNLP Universidad Nacional de La Plata http://data.elsevier.com/vocabulary/SciValFunders/501100003947 http://sws.geonames.org/3865483/ FONCyT PICT-2017-2931 FonCyT Fondo para la Investigación Científica y Tecnológica http://data.elsevier.com/vocabulary/SciValFunders/501100006668 http://sws.geonames.org/3865483/ CONICET PIP 065 CONICET Consejo Nacional de Investigaciones Científicas y Técnicas http://data.elsevier.com/vocabulary/SciValFunders/501100002923 http://sws.geonames.org/3865483/ This research work was possible due to the funds received from “Consejo Nacional de Investigaciones Científicas y Tecnicas” (CONICET PIP 065), “Universidad Nacional de La Plata” (UNLP-I248) and FONCyT (PICT-2017-2931). The doctoral fellowship granted by CONICET to Julian A. Vannucci is gratefully acknowledged. The authors wish to thank the Secegrin Laboratory from CCT-CONICET Santa Fe for TEM measures and to ANPCyT for the purchase of the SPECS multitechnique analysis instrument (PME8-2003). This research work was possible due to the funds received from “ Consejo Nacional de Investigaciones Científicas y Tecnicas ” ( CONICET PIP 065 ), “ Universidad Nacional de La Plata ” ( UNLP-I248 ) and FONCyT ( PICT-2017-2931 ). The doctoral fellowship granted by CONICET to Julian A. Vannucci is gratefully acknowledged. The authors wish to thank the Secegrin Laboratory from CCT-CONICET Santa Fe for TEM measures and to ANPCyT for the purchase of the SPECS multitechnique analysis instrument ( PME8-2003 ). https://doi.org/10.15223/policy-017 https://doi.org/10.15223/policy-037 https://doi.org/10.15223/policy-012 https://doi.org/10.15223/policy-029 https://doi.org/10.15223/policy-004 item S2468-8231(22)00383-2 S2468823122003832 1-s2.0-S2468823122003832 10.1016/j.mcat.2022.112497 315758 2023-04-22T20:35:22.633552Z 2022-08-01 2022-08-31 1-s2.0-S2468823122003832-main.pdf https://s3-eu-west-1.amazonaws.com/prod-ucs-content-store-eu-west/content/pii:S2468823122003832/MAIN/application/pdf/d47fe9ffafeb2c081a1ab7991270207b/main.pdf main.pdf pdf true 2258512 MAIN 10 1-s2.0-S2468823122003832-main_1.png https://s3-eu-west-1.amazonaws.com/prod-ucs-content-store-eu-west/content/pii:S2468823122003832/PREVIEW/image/png/e3d4163400eac56a9725f1e616885ee0/main_1.png main_1.png png 58821 849 656 IMAGE-WEB-PDF 1 1-s2.0-S2468823122003832-gr1.jpg https://s3-eu-west-1.amazonaws.com/prod-ucs-content-store-eu-west/content/pii:S2468823122003832/gr1/DOWNSAMPLED/image/jpeg/2bfe14b4bf746e61c43429741b7e3907/gr1.jpg gr1 gr1.jpg jpg 25618 327 386 IMAGE-DOWNSAMPLED 1-s2.0-S2468823122003832-sc1.jpg https://s3-eu-west-1.amazonaws.com/prod-ucs-content-store-eu-west/content/pii:S2468823122003832/sc1/DOWNSAMPLED/image/jpeg/b2c2b6e80cd47c4db44bbf5874409feb/sc1.jpg sc1 sc1.jpg jpg 12770 142 565 IMAGE-DOWNSAMPLED 1-s2.0-S2468823122003832-ga1.jpg https://s3-eu-west-1.amazonaws.com/prod-ucs-content-store-eu-west/content/pii:S2468823122003832/ga1/DOWNSAMPLED/image/jpeg/a333e8f0142dff00d8dabc8888555a8b/ga1.jpg ga1 true ga1.jpg jpg 19416 128 301 IMAGE-DOWNSAMPLED 1-s2.0-S2468823122003832-gr10.jpg https://s3-eu-west-1.amazonaws.com/prod-ucs-content-store-eu-west/content/pii:S2468823122003832/gr10/DOWNSAMPLED/image/jpeg/d1f0aa20eaff3ad80ac65f930ec032d9/gr10.jpg gr10 gr10.jpg jpg 20078 280 390 IMAGE-DOWNSAMPLED 1-s2.0-S2468823122003832-gr12.jpg https://s3-eu-west-1.amazonaws.com/prod-ucs-content-store-eu-west/content/pii:S2468823122003832/gr12/DOWNSAMPLED/image/jpeg/04b6f3272548e9f69533d17775aeab87/gr12.jpg gr12 gr12.jpg jpg 64805 637 389 IMAGE-DOWNSAMPLED 1-s2.0-S2468823122003832-gr11.jpg https://s3-eu-west-1.amazonaws.com/prod-ucs-content-store-eu-west/content/pii:S2468823122003832/gr11/DOWNSAMPLED/image/jpeg/8fb1c2b29d1f1b6a7efd144c419ba879/gr11.jpg gr11 gr11.jpg jpg 26242 313 389 IMAGE-DOWNSAMPLED 1-s2.0-S2468823122003832-gr5.jpg https://s3-eu-west-1.amazonaws.com/prod-ucs-content-store-eu-west/content/pii:S2468823122003832/gr5/DOWNSAMPLED/image/jpeg/7836cf2cf45d0ceb72e7317d74779728/gr5.jpg gr5 gr5.jpg jpg 39946 335 388 IMAGE-DOWNSAMPLED 1-s2.0-S2468823122003832-gr4.jpg https://s3-eu-west-1.amazonaws.com/prod-ucs-content-store-eu-west/content/pii:S2468823122003832/gr4/DOWNSAMPLED/image/jpeg/b9b108eb5c432c48486193c5168e01e8/gr4.jpg gr4 gr4.jpg jpg 28342 325 388 IMAGE-DOWNSAMPLED 1-s2.0-S2468823122003832-gr3.jpg https://s3-eu-west-1.amazonaws.com/prod-ucs-content-store-eu-west/content/pii:S2468823122003832/gr3/DOWNSAMPLED/image/jpeg/1d9c816b51727e2528ef0697671fc14b/gr3.jpg gr3 gr3.jpg jpg 61299 463 632 IMAGE-DOWNSAMPLED 1-s2.0-S2468823122003832-gr2.jpg https://s3-eu-west-1.amazonaws.com/prod-ucs-content-store-eu-west/content/pii:S2468823122003832/gr2/DOWNSAMPLED/image/jpeg/5a83f08154c87fafba7b01e63f7b3003/gr2.jpg gr2 gr2.jpg jpg 27378 334 386 IMAGE-DOWNSAMPLED 1-s2.0-S2468823122003832-gr9.jpg https://s3-eu-west-1.amazonaws.com/prod-ucs-content-store-eu-west/content/pii:S2468823122003832/gr9/DOWNSAMPLED/image/jpeg/d14803fffd7a3663a10de1936b1a6a74/gr9.jpg gr9 gr9.jpg jpg 22163 297 390 IMAGE-DOWNSAMPLED 1-s2.0-S2468823122003832-gr8.jpg https://s3-eu-west-1.amazonaws.com/prod-ucs-content-store-eu-west/content/pii:S2468823122003832/gr8/DOWNSAMPLED/image/jpeg/877288572381a5641daf1064a102ba7f/gr8.jpg gr8 gr8.jpg jpg 55263 529 389 IMAGE-DOWNSAMPLED 1-s2.0-S2468823122003832-gr7.jpg https://s3-eu-west-1.amazonaws.com/prod-ucs-content-store-eu-west/content/pii:S2468823122003832/gr7/DOWNSAMPLED/image/jpeg/81716e51f8732247ff65891d01107222/gr7.jpg gr7 gr7.jpg jpg 28151 286 389 IMAGE-DOWNSAMPLED 1-s2.0-S2468823122003832-gr6.jpg https://s3-eu-west-1.amazonaws.com/prod-ucs-content-store-eu-west/content/pii:S2468823122003832/gr6/DOWNSAMPLED/image/jpeg/7a43eabed542fb9b398ea59f37886b91/gr6.jpg gr6 gr6.jpg jpg 36931 314 390 IMAGE-DOWNSAMPLED 1-s2.0-S2468823122003832-gr1.sml https://s3-eu-west-1.amazonaws.com/prod-ucs-content-store-eu-west/content/pii:S2468823122003832/gr1/THUMBNAIL/image/gif/a4f16fd94c9a377db705591ea61a9e3d/gr1.sml gr1 gr1.sml sml 6506 164 193 IMAGE-THUMBNAIL 1-s2.0-S2468823122003832-sc1.sml https://s3-eu-west-1.amazonaws.com/prod-ucs-content-store-eu-west/content/pii:S2468823122003832/sc1/THUMBNAIL/image/gif/580fe3e75d33086262ffc5d8be1bedc7/sc1.sml sc1 sc1.sml sml 2588 55 219 IMAGE-THUMBNAIL 1-s2.0-S2468823122003832-ga1.sml https://s3-eu-west-1.amazonaws.com/prod-ucs-content-store-eu-west/content/pii:S2468823122003832/ga1/THUMBNAIL/image/gif/561743affabeb2b966d70fa0757aadd3/ga1.sml ga1 true ga1.sml sml 10964 93 219 IMAGE-THUMBNAIL 1-s2.0-S2468823122003832-gr10.sml https://s3-eu-west-1.amazonaws.com/prod-ucs-content-store-eu-west/content/pii:S2468823122003832/gr10/THUMBNAIL/image/gif/d4d6a93547b1c469ea635f843b82c8c9/gr10.sml gr10 gr10.sml sml 6536 157 219 IMAGE-THUMBNAIL 1-s2.0-S2468823122003832-gr12.sml https://s3-eu-west-1.amazonaws.com/prod-ucs-content-store-eu-west/content/pii:S2468823122003832/gr12/THUMBNAIL/image/gif/23edb143d5b119d66013dd7af2314910/gr12.sml gr12 gr12.sml sml 7325 164 100 IMAGE-THUMBNAIL 1-s2.0-S2468823122003832-gr11.sml https://s3-eu-west-1.amazonaws.com/prod-ucs-content-store-eu-west/content/pii:S2468823122003832/gr11/THUMBNAIL/image/gif/cab80cd587ab14f9340d9e46540b430b/gr11.sml gr11 gr11.sml sml 7921 164 204 IMAGE-THUMBNAIL 1-s2.0-S2468823122003832-gr5.sml https://s3-eu-west-1.amazonaws.com/prod-ucs-content-store-eu-west/content/pii:S2468823122003832/gr5/THUMBNAIL/image/gif/9fbbc12316ec6a4fa9e09297232cc00f/gr5.sml gr5 gr5.sml sml 8903 164 190 IMAGE-THUMBNAIL 1-s2.0-S2468823122003832-gr4.sml https://s3-eu-west-1.amazonaws.com/prod-ucs-content-store-eu-west/content/pii:S2468823122003832/gr4/THUMBNAIL/image/gif/06422d909d1168b6ac34dc11fe1ebe60/gr4.sml gr4 gr4.sml sml 7867 164 196 IMAGE-THUMBNAIL 1-s2.0-S2468823122003832-gr3.sml https://s3-eu-west-1.amazonaws.com/prod-ucs-content-store-eu-west/content/pii:S2468823122003832/gr3/THUMBNAIL/image/gif/d0f143c0d33746633b719f32ce569daa/gr3.sml gr3 gr3.sml sml 14467 160 219 IMAGE-THUMBNAIL 1-s2.0-S2468823122003832-gr2.sml https://s3-eu-west-1.amazonaws.com/prod-ucs-content-store-eu-west/content/pii:S2468823122003832/gr2/THUMBNAIL/image/gif/2cb7c0b7874f92707df5791c09eb0df6/gr2.sml gr2 gr2.sml sml 6492 163 189 IMAGE-THUMBNAIL 1-s2.0-S2468823122003832-gr9.sml https://s3-eu-west-1.amazonaws.com/prod-ucs-content-store-eu-west/content/pii:S2468823122003832/gr9/THUMBNAIL/image/gif/4879529d505d79c41da10d42b165c76e/gr9.sml gr9 gr9.sml sml 6904 164 215 IMAGE-THUMBNAIL 1-s2.0-S2468823122003832-gr8.sml https://s3-eu-west-1.amazonaws.com/prod-ucs-content-store-eu-west/content/pii:S2468823122003832/gr8/THUMBNAIL/image/gif/ccaa2e929a4bf4534e90e19d32dc02c0/gr8.sml gr8 gr8.sml sml 7919 163 120 IMAGE-THUMBNAIL 1-s2.0-S2468823122003832-gr7.sml https://s3-eu-west-1.amazonaws.com/prod-ucs-content-store-eu-west/content/pii:S2468823122003832/gr7/THUMBNAIL/image/gif/c325eb09032117d5cfca5498f180668d/gr7.sml gr7 gr7.sml sml 8049 161 219 IMAGE-THUMBNAIL 1-s2.0-S2468823122003832-gr6.sml https://s3-eu-west-1.amazonaws.com/prod-ucs-content-store-eu-west/content/pii:S2468823122003832/gr6/THUMBNAIL/image/gif/05faeb38c47ce9d858fa1d2f9872724f/gr6.sml gr6 gr6.sml sml 9493 164 203 IMAGE-THUMBNAIL 1-s2.0-S2468823122003832-gr1_lrg.jpg https://s3-eu-west-1.amazonaws.com/prod-ucs-content-store-eu-west/content/pii:S2468823122003832/gr1/HIGHRES/image/jpeg/9f1e17ad896935a701c2b7c0da5ddc08/gr1_lrg.jpg gr1 gr1_lrg.jpg jpg 186765 1447 1708 IMAGE-HIGH-RES 1-s2.0-S2468823122003832-sc1_lrg.jpg https://s3-eu-west-1.amazonaws.com/prod-ucs-content-store-eu-west/content/pii:S2468823122003832/sc1/HIGHRES/image/jpeg/412aaf7b1c33876e0664e7b19eadbdda/sc1_lrg.jpg sc1 sc1_lrg.jpg jpg 95362 628 2500 IMAGE-HIGH-RES 1-s2.0-S2468823122003832-ga1_lrg.jpg https://s3-eu-west-1.amazonaws.com/prod-ucs-content-store-eu-west/content/pii:S2468823122003832/ga1/HIGHRES/image/jpeg/6d419d389acf38da0e5ae592d5b06b7e/ga1_lrg.jpg ga1 true ga1_lrg.jpg jpg 159783 566 1333 IMAGE-HIGH-RES 1-s2.0-S2468823122003832-gr10_lrg.jpg https://s3-eu-west-1.amazonaws.com/prod-ucs-content-store-eu-west/content/pii:S2468823122003832/gr10/HIGHRES/image/jpeg/32f2193f3c0f51c81e51c8ed0ea244fc/gr10_lrg.jpg gr10 gr10_lrg.jpg jpg 118352 1238 1727 IMAGE-HIGH-RES 1-s2.0-S2468823122003832-gr12_lrg.jpg https://s3-eu-west-1.amazonaws.com/prod-ucs-content-store-eu-west/content/pii:S2468823122003832/gr12/HIGHRES/image/jpeg/71a47fe1921d7dc9458a3bea9552f598/gr12_lrg.jpg gr12 gr12_lrg.jpg jpg 488902 2824 1725 IMAGE-HIGH-RES 1-s2.0-S2468823122003832-gr11_lrg.jpg https://s3-eu-west-1.amazonaws.com/prod-ucs-content-store-eu-west/content/pii:S2468823122003832/gr11/HIGHRES/image/jpeg/11e2b5ad1052d97f00901e6ca7088efb/gr11_lrg.jpg gr11 gr11_lrg.jpg jpg 189206 1387 1725 IMAGE-HIGH-RES 1-s2.0-S2468823122003832-gr5_lrg.jpg https://s3-eu-west-1.amazonaws.com/prod-ucs-content-store-eu-west/content/pii:S2468823122003832/gr5/HIGHRES/image/jpeg/4fb226ab1d2172d2671bddb6b8e44d74/gr5_lrg.jpg gr5 gr5_lrg.jpg jpg 265322 1485 1719 IMAGE-HIGH-RES 1-s2.0-S2468823122003832-gr4_lrg.jpg https://s3-eu-west-1.amazonaws.com/prod-ucs-content-store-eu-west/content/pii:S2468823122003832/gr4/HIGHRES/image/jpeg/69dc5dd9b51fc99ee25c328bb9a7e1a4/gr4_lrg.jpg gr4 gr4_lrg.jpg jpg 200692 1436 1717 IMAGE-HIGH-RES 1-s2.0-S2468823122003832-gr3_lrg.jpg https://s3-eu-west-1.amazonaws.com/prod-ucs-content-store-eu-west/content/pii:S2468823122003832/gr3/HIGHRES/image/jpeg/95b6ddcbe07239a5dd47ed539eb0dccc/gr3_lrg.jpg gr3 gr3_lrg.jpg jpg 547456 2049 2799 IMAGE-HIGH-RES 1-s2.0-S2468823122003832-gr2_lrg.jpg https://s3-eu-west-1.amazonaws.com/prod-ucs-content-store-eu-west/content/pii:S2468823122003832/gr2/HIGHRES/image/jpeg/c6aa7555f7a6b13526f5151eadf61e0b/gr2_lrg.jpg gr2 gr2_lrg.jpg jpg 183818 1477 1708 IMAGE-HIGH-RES 1-s2.0-S2468823122003832-gr9_lrg.jpg https://s3-eu-west-1.amazonaws.com/prod-ucs-content-store-eu-west/content/pii:S2468823122003832/gr9/HIGHRES/image/jpeg/7f8ced79717858cc440a3dbfe5756eb3/gr9_lrg.jpg gr9 gr9_lrg.jpg jpg 145647 1314 1727 IMAGE-HIGH-RES 1-s2.0-S2468823122003832-gr8_lrg.jpg https://s3-eu-west-1.amazonaws.com/prod-ucs-content-store-eu-west/content/pii:S2468823122003832/gr8/HIGHRES/image/jpeg/bb49dd313c53854bebb7ee5c78e8400b/gr8_lrg.jpg gr8 gr8_lrg.jpg jpg 424208 2348 1725 IMAGE-HIGH-RES 1-s2.0-S2468823122003832-gr7_lrg.jpg https://s3-eu-west-1.amazonaws.com/prod-ucs-content-store-eu-west/content/pii:S2468823122003832/gr7/HIGHRES/image/jpeg/c27b6a441b13ee0ec409e20b359a3a34/gr7_lrg.jpg gr7 gr7_lrg.jpg jpg 186228 1268 1725 IMAGE-HIGH-RES 1-s2.0-S2468823122003832-gr6_lrg.jpg https://s3-eu-west-1.amazonaws.com/prod-ucs-content-store-eu-west/content/pii:S2468823122003832/gr6/HIGHRES/image/jpeg/7a7eaa5e975dbf285fd28e8563c7cb50/gr6_lrg.jpg gr6 gr6_lrg.jpg jpg 261135 1392 1727 IMAGE-HIGH-RES 1-s2.0-S2468823122003832-mmc1.docx https://s3-eu-west-1.amazonaws.com/prod-ucs-content-store-eu-west/content/pii:S2468823122003832/mmc1/MAIN/application/vnd.openxmlformats-officedocument.wordprocessingml.document/1a53cb397aaa2fd66a501e2a566e6b0e/mmc1.docx mmc1 mmc1.docx docx 1819153 APPLICATION 1-s2.0-S2468823122003832-si1.svg https://s3-eu-west-1.amazonaws.com/prod-ucs-content-store-eu-west/content/pii:S2468823122003832/STRIPIN/image/svg+xml/3d9017d8790135600d8504d919d4b4af/si1.svg si1 si1.svg svg 17924 ALTIMG 1-s2.0-S2468823122003832-si2.svg https://s3-eu-west-1.amazonaws.com/prod-ucs-content-store-eu-west/content/pii:S2468823122003832/STRIPIN/image/svg+xml/160eb04bd34b22384840ed3d1b64d637/si2.svg si2 si2.svg svg 18343 ALTIMG 1-s2.0-S2468823122003832-am.pdf https://s3-eu-west-1.amazonaws.com/prod-ucs-content-store-eu-west/content/egi:10VX7LZZJV6/MAIN/application/pdf/c864d2a9388bc0d1a68e294614c6bff2/am.pdf am am.pdf pdf false 870570 AAM-PDF MCAT 112497 112497 S2468-8231(22)00383-2 10.1016/j.mcat.2022.112497 Elsevier B.V. Scheme 1 Ketalization reaction of glycerol with acetone. Scheme 1 Fig. 1 XRD patterns corresponding to samples ZBseed, ZBZr1 and ZBZr2. Fig 1 Fig. 2 Zr 3d5/2 XPS spectra of ZBZr1 and ZBZr2. Fig 2 Fig. 3 HAADF-STEM image and EDS elemental mapping analyses of ZBZr1 Fig 3 Fig. 4 N2 adsorption-desorption isotherms of ZBZr1, ZBZr2 and SBAsulf. Fig 4 Fig. 5 FTIR spectra of SBAsulf and SBA-15. Fig 5 Fig. 6 FTIR spectra of ZBZr1 and ZBZr2. Fig 6 Fig. 7 Potentiometric titration with n-butylamine of the studied catalyst. Fig 7 Fig. 8 Pyridine-TPD corresponding to A: ZBZr1 and B: ZBZr2. Red peak: weak acid site; Pink peak: middle acid site; Blue peak: strong acid site Fig 8 Fig. 9 Glycerol conversion as a function of time. Experimental conditions: 40°C; 0.2 MPa; glycerol to acetone molar ratio = 1:6, catalyst: ZBZr1 = 1.2% wt%, ZBZr2 = 1.2 wt%, SBAsulf = 1.2 wt% (catalyst/glycerol). Fig 9 Fig. 10 Catalyst stability. Experimental conditions: 40°C, 0.2 MPa, glycerol to acetone mol ratio = 1:6, % catalyst = 2.5 wt%, reaction time: SBAsulf = 30 min, ZBZr1 = 60 min. Fig 10 Fig. 11 FTIR spectra of the fresh and post-reaction SBAsulf catalyst. Fig 11 Fig. 12 FTIR spectra of the fresh, post-reaction and treated at 300°C for 12 h ZBZr1 catalyst. Fig 12 Table 1 Textural and acidic properties. Table 1: Textural properties Potentiometric titration XPS Py-FTIR Sample Surface area (m2.g−1) Pore vol. (cm3.g−1) E0 (mV) Meq n-butylamine.g−1 Si/Zr B/L SBET Smicro Vtot Vmicro ZBZr1 277 68 0.50 0.04 440 0.31 102.6 1.9 ZBZr2 494 154 0.35 0.07 175 0.30 86.4 0.7 SBAsulf 470 140 0.36 0.06 550 0.54 - - Table 2 Initial reaction rate and TOF. Experimental conditions: 10 min, 40°C, 0.2 MPa N2, glycerol to acetone molar ratio = 1:6. Table 2: Sample Initial rate of reaction (mol.min−1.g−1) TOF (min−1) SBAsulf 0.0326 60.37 ZBZr1 0.0139 44.84 Al-free Zr-beta zeolite as a selective catalyst for the ketalization of glycerol Julián A. Vannucci Methodology Formal analysis Investigation Data curation Writing – original draft Visualization Validation a b María S. Legnoverde Investigation Formal analysis Writing – review & editing a Bruno O. Dalla Costa Investigation Formal analysis Writing – review & editing c Elena I. Basaldella Conceptualization Funding acquisition Resources a Nora N. Nichio Conceptualization Funding acquisition Resources a b Francisco Pompeo Conceptualization Methodology Supervision Validation Writing – review & editing a b ⁎ a Centro de Investigación y Desarrollo en Ciencias Aplicadas (CINDECA), Facultad de Ciencias Exactas, Universidad Nacional de La Plata (UNLP)–CONICET, Calle 47, 257, CP 1900, La Plata, Argentina Centro de Investigación y Desarrollo en Ciencias Aplicadas (CINDECA) Facultad de Ciencias Exactas Universidad Nacional de La Plata (UNLP)–CONICET Calle 47, 257 La Plata CP 1900 Argentina aCentro de Investigación y Desarrollo en Ciencias Aplicadas (CINDECA), Facultad de Ciencias Exactas, Universidad Nacional de La Plata (UNLP)–CONICET, Calle 47, 257, CP 1900, La Plata, Argentina b Facultad de Ingeniería, Universidad Nacional de La Plata (UNLP), Calle 1 esq. 47, CP 1900, La Plata, Argentina Facultad de Ingeniería Universidad Nacional de La Plata (UNLP) Calle 1 esq. 47 La Plata CP 1900 Argentina bFacultad de Ingeniería, Universidad Nacional de La Plata (UNLP), Calle 1 esq. 47, CP 1900, La Plata, Argentina c Instituto de Investigaciones en Catálisis y Petroquímica (INCAPE)−FIQ−UNL− CONICET, Santiago del Estero 2654, Santa Fe S3000AOJ, Argentina Instituto de Investigaciones en Catálisis y Petroquímica (INCAPE)−FIQ−UNL− CONICET Santiago del Estero 2654 Santa Fe S3000AOJ Argentina cInstituto de Investigaciones en Catálisis y Petroquímica (INCAPE)−FIQ−UNL− CONICET, Santiago del Estero 2654, Santa Fe S3000AOJ, Argentina ⁎ Corresponding author at: Centro de Investigación y Desarrollo en Ciencias Aplicadas (CINDECA), Facultad de Ciencias Exactas, Universidad Nacional de La Plata (UNLP)-CONICET, Calle 47, 257, CP 1900, La Plata, Argentina. Centro de Investigación y Desarrollo en Ciencias Aplicadas (CINDECA) Facultad de Ciencias Exactas Universidad Nacional de La Plata (UNLP)-CONICET Calle 47, 257 La Plata CP 1900 Argentina Two Zr-beta zeolites were synthesized using different methods. Method 1 consisted in the formation of a dealuminated zeolite beta seed followed by Zr incorporation and thermal treatment (ZBZr1). In Method 2, zeolite beta was prepared and then, the dealumination and subsequent Zr incorporation were performed (ZBZr2). These materials were tested in the ketalization of glycerol with acetone and compared with a SBAsulf. Both preparation methods incorporate Zr in the zeolitic framework, and no ZrO2 is detected. Method 1 developed crystallites with an average size of 260 nm, Si/Zr ratio ∼100, total amount of acid sites of 0.375 mmol.g−1 and a ratio of Brönsted to Lewis acid sites of 1.9. In the case of Method 2, values of 1500 nm, ∼86, 0.32 mmol.g−1 and 0.7 were obtained, respectively. The ZBZr2 sample presented low catalytic activity, possibly due to diffusion limitations. The turnover frequency (TOF) was calculated as 44.84 and 60.37 min−1 for ZBZr1 and SBAsulf , respectively. After one cycle of reaction, both ZBZr1 and SBAsulf showed a decrease in the glycerol conversion, however, the selectivity remained constant in the ZBZr1 material after the reaction cycle and the catalytic activity could be reestablished after a thermal treatment. Graphical abstract Image, graphical abstract Keywords Zr-zeolite beta Ordered mesoporous silica Sulfonic SBA-15 Solketal Glycerol Data availability Data will be made available on request. 1 Introduction Biomass is one of the most abundant renewable resources. The efficient development of processes and technologies using this resource as raw material is vital to solve today's ecological and energy problems [1]. Glycerol is a platform molecule with several applications in industry, and is coproduced in the productive process of biodiesel [2]. Nowadays, the development of new technologies capable of adding value to glycerol has become of great interest for the biodiesel industry. In the literature, several studies focus in glycerol valorization by catalytic processes such as ketalization, dehydration, oxidation, and reforming. In particular, the ketalization of glycerol to produce oxygenated compounds, like solketal, has become attractive for diverse applications. Solketal is a cyclic ketal used as an anti-knock agent in naphtha formulations [3], as a solvent in pesticide formulations [4] and pharmaceutical formulations [5], and is also used in the synthesis of polyester resins [6], polyglycerols [7] and plasticizers [8]. In literature reports, the ketalization of glycerol with acetone (Scheme 1 ) is carried out using heterogeneous catalysts like ionic exchange resins [9], heteropolyacids [10], acidified clays [11], mesostructured silicas [12–14] and zeolites [15–17]. Several authors have recently studied this reaction using catalysts with Lewis acid sites [18–20]. Da Silva et al. synthetized Sn(II) salts and silicotungstic acid (Sn2SiW12O40) and compared them with other heteropolyacid salts and homogeneous catalysts. The results showed that the primary structure was not affected by the exchange of protons with tin cations, and the catalytic activity of the Sn2SiW12O40 material could achieve a conversion near 99% with a selectivity of 97%, showing a better performance than other heteropolyacid salts. This material presented a stability of 4 reaction cycles, without any appreciable loss in the catalytic performance, or changes in the IR spectra in the Keggin anion [18]. Kao et al. prepared a series of SiO2 with supported niobium oxide, using the chemical vapor deposition method to remove Cl from the surface of the sample. The catalytic tests showed that the glycerol conversion was improved with the addition of niobium in the catalyst until a Nb to Si ratio of 15% wt%, reaching a conversion of 45% with an 80% selectivity towards solketal [19]. Among the catalysts studied in this reaction, zeolites represent one of the most promising materials for a technological application. Zeolites are widely used as heterogeneous catalysts in the petrochemical industry, petroleum refining, and organic synthesis [21]. The use of zeolites, under their protonated form, in the ketalization of glycerol has been previously studied. Da Silva et al. studied zeolites with structures BEA, ZSM-5 and USY, observing a better performance in the zeolite beta compared with the USY, achieving conversions of 85% and 55%, respectively in 30 min of reaction, while zeolite ZSM-5 only converted 25% glycerol in 30 min. The lower activity of zeolite ZSM-5 was attributed to the smaller size of its pores, which impeded the formation of solketal into the pores [22]. Poly et al. studied the influence of the Si/Al ratio of protonated beta zeolites and determined that the hydrophobicity of the material increased with the Si/Al ratio while the density of acid sites decreased. In the performance of these materials in different glycerol acetalization reactions, the authors observed that the material with a Si/Al ratio of 75 was the most effective one with an initial reaction rate of 11.3 mmol.h−1.gcat −1 in the acetalization of glycerol with 2-pentanone [23]. Kowalska-Kus et al. improved the activity of zeolites ZSM-5 and beta with a desalinization and a subsequent acid treatment, which allowed obtaining conversions of 90% in the zeolite ZSM-5, and improved the stability of the zeolite beta in a 24 h online reaction [24]. Recently, the incorporation of transition metals in BEA structures has attracted the attention of diverse researchers due to their capacity to activate a carbonyl group [25,26]. In particular, beta zeolites with incorporated Zr in their structure have been used in reactions with the Meerwein-Ponndorf-Verley mechanism, as the reduction of furfural [26,27], cyclohexanone [28,29], 1,4-cyclohexanedione [25] and methyl-levulinate [30]. In general, Zr-Beta zeolites have two types of Lewis acid sites: Zr atoms tetra coordinated in structural positions (closed sites) and Zr atoms tetra coordinated with a Zr-OH group (open sites). Sushkevich et al. have proved that the acid strength of the Lewis acid sites associated with open Zr (IV) sites is stronger than those associated with closed sites [31]. Paniagua et al. synthesized Zr-Al-Beta zeolites as a bifunctional catalyst with Brönsted and Lewis acid sites for the one-pot production of γ-valerolactone (GVL) from glucose. The authors determined that the Al/Zr ratio has a strong impact on the product distribution as higher content of Zr produces a higher amount of GVL, obtaining a maximum at a ratio Al/Zr = 0.2 [32]. Li et al. doped Zr-Beta zeolites with La in order to enhance the ratio of Lewis to Brönsted (L/B ratio) acid sites of the material for the reduction of cyclohexanone. Despite the increase in the L/B ratio, the catalytic activity of the materials with higher incorporation of La showed a decrease in the catalytic activity due to the blockage of micropores by excess La [32]. Gao et al. synthesized an alkali promoted Zr-Al-Beta zeolite to regulate their active sites. The characterization results showed that, through the simple alkaline treatment, the Brønsted acidic sites and Lewis acidic sites of Zr-Al-Beta were transformed and weakened significantly by alkali-metal cations, which greatly promoted its catalytic performance and coking resistance ability in the conversion of furfural to furfural alcohol [26]. Taking into account that in the presence of Lewis acid sites, the ketalization of glycerol proceeds with a mechanism similar to the one mentioned above [33], the use of this material in the solketal synthesis looks promising. The objective of this work is to study the influence of the synthesis methodology of Zr-beta zeolites on its acid, its morphological and textural properties. For this purpose, two Zr-beta zeolites were synthesized by two different methods, i.e. Method 1 in which a seed of zeolite beta was introduced into a solution containing a source of Zr and Si and then subjected to a thermal treatment [34], while Method 2 consisted in the dealumination of a crystallized zeolite beta, and the subsequent incorporation of Zr in its structure [35]. The work also studied the stability of these materials and compared their performance with an SBA-15 catalyst functionalized with sulfonic groups, which had a similar acid strength but different textural properties. 2 Experimental 2.1 Materials The chemicals used in this study were Poly(ethyleneglycol)-block-poly(propyleneglycol)-block-poly(-ethyleneglycol) (PE-PP-PE Pluronic P123, Aldrich), tetraethylorthosilicate (TEOS, 98%, Aldrich), hydrochloric acid (HCl, Baker), 3-Mercaptopropyl-trimethoxysilane (MPTMS, 95%, Aldrich), hydrogen peroxide (H2O230 vol%, Panreac), metallic aluminum (Mallinckrodt chemical works), tetraethylammonium hydroxide (TEAOH, Aldrich), fumed silica (Degussa), nitric acid (HNO3, Anedra), Zirconyl chloride octahydrate (ZrOCl2.8H2O, Aldrich), hydrofluoric acid (HF, Cicarelli). Glycerol (99.5%, Cicarelli), solketal (98.2, TCI Chemicals, used as standard for GC analysis), acetone (99.5%, Anedra), n-propanol (99.3%, Anedra, used as external standard for GC analysis), 2.2 Synthesis of catalysts 2.2.1 Sulfonic SBA-15 SBA-15 mesoporous silica was functionalized with organosulfonic groups using 3-mercaptopropyl trimethoxysilane as a precursor. The procedure was carried out using the sol-gel technique, by co-condensation of MPTS and TEOS in the presence of Pluronic 123, in an acid medium of HCl. The solid product was recovered by filtration and air-dried at room-temperature overnight. The template was removed from the as-synthesized material by washing with ethanol under reflux for 24 h. The oxidation stage of the mercaptopropyl groups was carried out by immersing the obtained solid in an aqueous solution of hydrogen peroxide (H2O2 30% in vol) following the methodology described by Bossaert et al. [36]. After the oxidation treatment, the solution was filtered and the solid was washed with ethanol. The wet material was suspended (1 wt%) in a H2SO4 solution (1 M) for 2 h. The powder was then washed with water and ethanol and dried for 2 h at 120 °C. The molar composition was: 1 TEOS: 0.11MPTMS: 0.018PEO: 6.5HCl: 27.1H2O. The sample was named SBAsulf. 2.2.2 Zr-zeolite beta Synthesis of dealuminated zeolite beta seeds Nanocrystalline zeolite beta seeds were prepared following the methodology described by Zhu et al. and Camblor et al. [34,37]. The appropriate amount of metallic Al was dissolved in tetraethylammonium hydroxide (TEAOH) (40 wt% aqueous solution). This solution was then added to a mixture made by dispersing fumed silica in deionized water and the mixture was homogenized by stirring 2 h (molar composition of final gel: 1.0 SiO2:0.56 TEAOH:0.02 Al2O3:15 H2O). The mixture was treated at 140 °C for 72 h under autogenous pressure in a teflon-lined stainless-steel autoclave. After the thermal treatment, the solid was separated by centrifugation (10,000 rpm, 90 min), washed with deionized water until pH < 9 and dried at 100 °C. Dealuminated zeolite beta seeds were prepared by treatment of 1 g of zeolite with 50 ml of 6 M HNO3 at 80 °C for 24 h. The solid was recovered by centrifugation, washed with deionized water, and dried at 10 °C. The sample was named ZBseed. Synthesis of dealuminated Zr-zeolite beta from the prepared seed (Method 1) After hydrolyzing tetraethyl orthosilicate (TEOS) with tetraethylammonium hydroxide (TEAOH), a solution of ZrOCl2·8H2O in water was added, and the mixture was stirred until all the ethanol formed by the hydrolysis of TEOS was evaporated. HF and dealuminated zeolite beta seed crystals were added. The final gel composition was 1.0 SiO2:0.02 ZrO2:0.56 TEAOH:10 H2O:0.56 HF. The crystallization was carried out in a teflon-lined stainless-steel autoclave at 140 °C for 20 days. The solid product obtained was filtered, washed with deionized water, dried at 100 °C, and calcined at 580°C for 4 h. The sample was named ZBZr1. Synthesis of dealuminated Zr-zeolite beta (Method 2) Al-zeolite beta was prepared in a fluoride medium following the procedure reported by Corma et al. [35]. The sample was treated with 12 M HNO3 at 80 °C for 20 h to remove the aluminum. After that, the dealuminated zeolite beta was added to a solution of ZrOCl2.8H2O and the mixture was dried at 80 °C for 15 h. Zr-zeolite beta was obtained by calcining at 600 °C for 8 h. The sample was named ZBZr2. 2.3 Characterization of catalyst The crystalline phase of zeolites was determined by powder X-ray diffraction. The powder patterns were collected in an X-pert Pro Panalytical diffractometer using the CuKα radiation in the 2θ angle range from 5° to 60° (step size of 0.04°). The JCPDS database was used to identify the crystalline phases. SEM Particle size and morphology were observed by SEM by means of a Philips 505 microscope. For preparation of samples, a small amount of sample was places on carbon tape and sputter coated with gold. TEM images were acquired in a JEOL JEM-2100 Plus transmission electron microscope equipped with an EDS Oxford X-MAX 65T. The observations were performed in HRTEM and HAADF mode, obtaining images and X-ray spectra at an acceleration of 200 kV. The samples were dispersed in ethanol using an ultrasonic bath and placed on a micro grid. The X-ray photoelectron spectroscopy (XPS) measurements were performed using a dual monochromatic Ag/Al source and a hemispherical electron energy analyzer (PHOIBOS 150). Spectra were collected with monochromatic radiation Al Kα. O 1s, Zr 3d, Si 2p, and C 1s lines were monitored. C 1s at 284.6 eV was used as a charging reference. Spectra were analyzed with CasaXPS software. Textural properties of the catalysts were calculated from nitrogen adsorption–desorption isotherms, which were recorded at the temperature of liquid nitrogen (-196 °C) using a Micrometrics ASAP 2020 Plus 2.00 instrument. Before adsorption, the zeolites and the mesoporous silica were outgassed by heating at 300 °C and 100 °C, respectively, with a pressure lower than 4 × 10−2mbar during 12 h. The surface area was calculated according to the Brunauer-Emmett-Teller (BET) equation [38]. The total pore volume was taken at the P.P0 −1 0.989 single point. Micropore surface (Smicro) and micropore volume (Vmicro) were estimated using the t-plot method. FT-IR spectra were collected by means of a Bruker IFS 66 Fourier transform infrared equipment, using KBr in the frequency range of 4000–400 cm−1. The amount and strength of acid sites in all samples were determined by potentiometric titration. A known mass of the solid to be analyzed was suspended in acetonitrile. The suspension was titrated using a solution of n-butylamine (0.1 mol L−1) in acetonitrile at 0.05 ml.min−1. The electrode potential variation was recorded in a digital pH meter (Metrohm 794 Basic Titrino apparatus with a double junction electrode). The amount and strength of acid sites in the zeolites were also evaluated by Pyridine temperature-programmed desorption (TPD). Approximately 10 mg of catalysts, sandwiched by quartz wool, was loaded in a quartz tube. The catalysts were pretreated in-situ in N2 flow (30 ml min−1) at 350 °C for 1 h. After cooling down to room temperature, the sample was saturated with pyridine. Then, pure nitrogen was flowed, and the temperature was increased up to 150 °C, maintaining this temperature until no physically adsorbed pyridine was detected. The TPD experiment was carried out heating at 12 °C min−1 in nitrogen flow from 150 °C to 750 °C. Pyridine coming out of the sample cell passed through a methanation reactor. A H2 stream was also fed to this reactor, quantitatively converting Pyridine to CH4, using a Ni catalyst. The CH4 was continuously measured by a FID detector. The calibration of the system was carried out with pulses of 1.26% CO2/N2. The nature of the acid sites was studied by infrared spectroscopy (FTIR), employing pyridine as a probe molecule. Typically, a self-supporting wafer of the zeolite was activated in vacuum at 723 K for 1 h (10 K min−1). The activated sample was cooled down to 298 K to collect the spectrum. Then, it was heated to 423 K (10 K min−1) and exposed to pyridine vapor during 1 h, followed by a purge of 1 h under vacuum at the same temperature to eliminate the physisorbed base. The saturated sample was cooled down again to 298 K for the collection of the spectra. The experiments were carried out in a Shimadzu IR Prestige 21 equipment equipped with a high-energy ceramic source and a LiTaO3 high-sensitivity pyroelectric detector. 2.4 Catalytic test The glycerol ketalization with acetone was carried out in a 200 ml Büchi glass reactor equipped with a manometer, magnetic stirring, thermostatic bath, and gas inlet and release valves. Before the catalytic evaluation, experiments were performed to verify the negligible contribution of the reaction in the absence of a catalyst. The Mears criterion values were below 10−5, and the Weisz-Prater criterion values below 10−8, confirming that both external and internal diffusion limitations are negligible on the operation conditions. As in a typical experiment, the reactor was loaded with a 1:6 molar ratio of glycerol to acetone, and an adequate quantity of the catalyst. Then, the reactor was pressurized to 0.2 MPa with N2 and heated to the desired temperature. Once the experiment was over, the reactor was cooled to 20 °C, and the catalyst was separated by centrifugation and filtration. The reactants and products were analyzed by gas chromatography with a Shimadzu GCMS-QP505A, equipped with a PE-Elite-Wax capillary column, and a FID detector, using n-propanol as an external standard. The conversion was determined with the following equation: X % = ( i n i t i a l g l y c e r o l m o l e s − f i n a l g l y c e r o l m o l e s ) i n i t i a l g l y c e r o l m o l e s and the selectivity to solketal with: S % = s o l k e t a l m o l e s ( i n i t i a l g l y c e r o l m o l e s − f i n a l g l y c e r o l m o l e s ) 3 Results 3.1 Catalyst characterization Fig. 1 shows the X-ray diffraction pattern obtained for samples ZBseed, ZBZr1 and ZBZr2. In all samples, the characteristic peaks of the beta zeolite structure are observed for 2θ =5–9° and 2θ =20–24°, discarding the collapse of the zeolitic structure caused by the dealumination and incorporation of Zr [39]. However, a loss of crystallinity with Zr substitution can be detected. It is worthwhile noting that peaks corresponding to bulky ZrO2 are not detected in these samples, this result indicates an insertion of Zr in the structure of zeolite beta. The superficial coverage of zirconia species was explored by XPS. The results of the XPS measures show a Si/Zr atomic ratio of 102.6 and 86.4 for samples ZBZr1 and ZBZr2, respectively (Table 1 ). No traces of Al were detected on the external surface of both materials. The binding energies for the Zr 3d5/2 photoelectrons in both samples (Fig. 2 ) appear to be shifted to higher energies (∼183,8 and ∼186,2 eV), compared with the binding energies of bulk ZrO2 (182.0 and 184.5 eV) [40]. This shift is due to a more electron-deficient Zr present in Zr-O-Si bonds and it is consistent with the formation of intra-framework Zr species in Zr-Beta zeolite [29,41,42]. SEM analysis of zeolites ZBZr1 and ZBZr2 (Fig. S1) were performed to determine the crystallite size and morphology. Results show that crystallite size of zeolite ZBZr1 varied from 50 to 400 nm with an average size of 260 nm. For zeolite ZBZr2, the crystallite size was in the range of 750–2200 nm with an average size of 1500 nm. Both solids have a spherical morphology. Fig. 3 show the HAADF-STEM image with elemental mapping of the material ZBZr1. A homogeneous dispersion of Zr and the presence of Al in a Si/Al atomic ratio of ∼180 on ZBZr1 was observed. On the other hand, in ZBZr2 (Fig. S2) the amount of Al detected was negligible. The difference with the results observed by XPS revealed that the small quantity of residual Al is located in the bulk of the zeolitic structure in ZBZr1. The N2 adsorption-desorption isotherms of all materials are shown in Fig. 4 and the values of the textural properties are presented in Table 1. According to the IUPAC classification for the isotherm shapes [43], the ZBZr1 sample exhibits a type I isotherm, typical of microporous structures, while ZBZr2 and SBAsulf exhibit type IV isotherms, characterized by the presence of a hysteresis loop. For zeolites, the presence of the hysteresis loop in the pressure range corresponding to capillary condensation indicates the structural modification of the original ordered microporous arrangement towards a more disordered micro-mesoporous material, induced by the dealumination treatment and the subsequent incorporation of zirconium. In the case of the mesoporous silica, the presence of the sulfonic functional groups changes the pressure range where the hysteresis loop was positioned. In fact, the expected value for the hysteresis loop closure at P.P0 −1>0.42, typical of the non-funcionalized SBA-15, was observed closing down at P.P0 −1<0.4 for SBAsulf, indicating the occurrence of pore blockage as a drawback of the functionalization [44]. Fig. 5 shows the infrared spectra corresponding to the original SBA-15 sample and after functionalization (SBAsulf). In both materials, the spectra show the bands around 1200, 1070, 794 and 470 cm−1 assigned to the typical Si–O–Si stretching and bending vibrations of condensed silica network, and the peaks around 960 cm−1 corresponding to non-condensed Si–OH groups. The broad band around 3400 cm−1 and the peak around 1630 cm−1 are due to the stretching and bending vibrations of adsorbed H2O [45,46]. In the spectrum corresponding to sample SBAsulf, the Si–O stretching band at 1200 cm−1 broadens towards higher wavenumbers and increases in intensity, due to the S=O stretching vibration mode associated with the absorption bands observed at 1201 and 1121 cm−1 [47]. The signal corresponding to the SH group is not observed at 2600 cm−1, indicating that the presence of non-oxidized groups is not detected by this technique [48,49]. Additionally, the bands at 2940 and 600 cm−1 are due to C–H and C–S stretching vibrations [47,50]. The FTIR spectra of materials ZBZr1 and ZBZr2 (Fig. 6 ) show the characteristic bands of the structural vibrations corresponding to beta zeolites (527, 578 and 626 cm−1), Si-O-Si vibrations (470 cm−1), Si-O vibrations associated with uncoupled SiO4 (986 cm−1), vibrations associated with external symmetry and asymmetries (803, 1256 cm−1) and internal symmetries (1090 cm−1) of O-T-O links (T = Zr, Al or Si), vibrations associated with adsorbed H2O (1630 cm−1) [51], vibrations of internal Si-OH groups (3438 cm−1) [52,53] and OH groups bound to Zr (3634 cm−1) [54]. When comparing both samples, a lower intensity in the band located at 986 cm−1 in the ZBZr1 sample is observed. Additionally, an increase in the intensity of the bands located at 803 and 1256 cm−1 is also noted. This phenomenon suggests that in the zeolite synthetized by Method 1, the amount of Zr and Al in the structure is higher than the zeolite synthetized by Method 2. By means of potentiometric titration with n-butylamine, it is possible to estimate the strength and the number of acid sites present in a solid. It is considered that the initial potential (E0) indicates the maximum strength of the acid sites present in a solid. The acidic strength of surface sites can be assigned according to the following ranges: very strong site, E0 > 100 mV; strong site, 0 < E0 < 100 mV; weak site, −100 <E0 < 0 mV and very weak site, E0 < −100 mV. If the titration curve changes the concavity, it is considered that the point of inflection indicates the presence of more than one type of acid site [55]. Fig. 7 shows the potentiometric titration curves for all materials. The initial potentials and the number of acid sites estimated by this technique are summarized in Table 1. All the materials present very strong acid sites (E0 > 100 mV), according to the initial potentials (E0) obtained, following the order: SBAsulf> ZBZr1> ZBZr2. A higher value of E0 of the SBAsulf sample indicates a significant strength of the sulfonic acid groups and a total amount of acid sites of 0.54 meq n-butylamine.g−1 is detected for this sample. For the synthesized zeolites, the amount of acid sites is similar in both samples (∼ 0.30 meq n-butylamine.g−1), while the strength of the acid sites in the Zr-zeolite beta synthesized by Method 1 is considerably higher than that in the zeolite synthesized by Method 2. Fig. 8. A shows the pyridine TPD profile for sample ZBZr1. By means of this technique, it was possible to quantify a total amount of acid sites of 0.375 mmol.g−1 in this material. In order to infer about the acid strength of the active sites in the catalyst, the deconvolution of the profile is also shown in the figure in order to allow identifying and quantifying acid sites of weak, moderate and strong strength, according to the temperature of pyridine desorption. In this material, 61% of the acid sites are very strong, with a maximum desorption temperature at approximately 660 °C. Then 33% of sites can be considered of moderate strength, with a maximum located at 480 °C. The amount of weak acid sites in this material is very low (6%), detected by the presence of a peak at approximately 360 °C. Therefore, it can be concluded that sample ZBZr1 is a material that in average presents high strength acidity (in agreement with the initial electric potential detected during the titration). In the case of the ZBZr2 catalyst, the total acidity detected was 0.32 mmol.g−1, resulting slightly less than that of the previous sample. In this case, the TPD profile can be deconvolved mainly into two main types of acidic sites (Fig. 8B). First, a high temperature region, where a maximum with desorption at 660 °C can also be observed in this catalyst, in agreement with the stronger acid sites detected in sample ZBZr1. For sample ZBZr2, this area of the TPD profile represents about 70% of the total acidity, although a small contribution from acid sites of intermediate strength could be considered. However, it is important to note that this material has a significant proportion of weak acid sites, representing 30% of the total acidity, with a maximum desorption at 400 °C. This difference compared with the ZBZr1 material is attributed to the absence of Al in the zeolitic structure of ZBZr2. In the case of SBAsulf, potentiometric titration with n-butylamine was the only technique selected to study the acid sites since Pyridine TPD experiments involve heating the sample, added to the fact that the presence of carbon in the functional groups interferes with the FID detection. The nature of the acid sites in both Zr-zeolites was determined by an FTIR analysis of adsorbed pyridine (Fig. S3). Two characteristic bands at 1545 cm−1 and 1455 cm−1 related with pyridine adsorbed over Brönsted (B) and Lewis (L) acid sites respectively are present in both materials [56]. For quantification, the molar extinction coefficients determined by a combination of microgravimetric and FTIR spectroscopic analysis of adsorbed pyridine were used [57]. The ratio of Brönsted to Lewis acid sites was estimated as 1.9 and 0.7 for ZBZr1 and ZBZr2, respectively (Table 1). The higher ratio of B/L acid sites observed in ZBZr1 is in concordance with the presence of Al in the zeolitic structure. 3.2 Catalytic activity Fig. 9 shows the glycerol conversion in the ketalization reaction for the catalysts under study. The ZBZr2 material showed a very small catalytic activity (∼5% after 100 min of reaction) revealing that a higher proportion of weak acid sites not only impacted in the total acid strength of the material (observed by the lower initial electric potential in the titration experiment), but also reduced the catalytic performance in the ketalization reaction. In the literature it was reported that zeolites with high Si/Al ratios show better glycerol acetalization performance in comparison with zeolites with low Si/Al ratios due to high hydrophobicity. In our work, ZBZr2 has a Si/Al ratio higher than the sample ZBZr1, although its catalytic performance is poor. The lower catalytic activity of the zeolite could also be related to the different nature of the acid site. However, in the literature, Li et al. [33] reported the catalytic activity of a rage of materials with different ratios of Lewis and Brönsted acid sites like Zr-TUD-1 (B/L = 0.24), Hf-TUD-1 (B/L = 0.23), and Sn-MCM-41 (B/L = 0.13), observing TOF of ∼5.4 min−1 for all materials. On the contrary, when using a catalyst with a higher density of strong acid sites, but with a lower micropore size like the ultrastable zeolite Y and higher B/L ratio (B/L = 1.96), a TOF of 0.9 min-1 was observed. Silva et al. [58] also studied the catalytic activity of a catalyst with Lewis and Brönsted acid sites. In their study, they determined that the Lewis acid sites of a homogeneous catalyst like Fe(NO3)3 were more effective in the reaction than homogeneous catalysts with Brönsted acid sites, such as H2SO4 or p-toluenesulfonic acid (PTSA). In addition, we have tested the activity of the Al-zeolite beta prepared in Method 2, and we have observed a similar catalytic performance to ZBZr2. Therefore, we can conclude that the major proportion of Lewis acid sites could not be responsible for the lower catalytic activity of ZBZr2. Manjunathan et al. [59] reported the effect of the crystallite size in the catalytic activity in the solketal synthesis using beta zeolites as catalyst. The authors observed that the material with an average size of 135 nm could reach an 86% glycerol conversion, while the material with a larger crystallite size (450 nm) could reach a 38% conversion even presenting a higher acid density. In this work, the catalyst ZBZr2 has a larger crystallite size and a smaller acid strength, therefore it is expected that the material ZBZr2 has a lower catalytic activity than material ZBZr1 due to diffusive effects. For all active catalysts, only solketal and the isomer 2,2-dimethyl-1,3-dioxan-5-ol were identified as products, with a selectivity higher than 85% towards solketal, and reaching a 98% selectivity towards solketal near the equilibrium conversion. This behavior was expected due to a lower thermodynamic stability of the isomer compared to solketal [60,61]. SBAsulf catalyst showed a high reaction rate in the first stage of the reaction, making it possible to achieve a conversion near the chemical equilibrium in 1 h of reaction using a catalyst to glycerol ratio of 1,2 wt%, showing a direct relation between the acid site density from SBAsulf and ZBZr1 and the glycerol conversion. The null activity of ZBZr2, despite having a similar density of acid sites than ZBZr1, is explained by the influence of the diffusion effects in ZBZr2. Table 2 shows the initial reaction rate (estimated in the first 10 min) and the turnover frequency (TOF) calculated from the density of acid sites (estimated by potentiometric titration). The lower catalytic activity of the acid sites of the zeolite could be related with a lower proportion of strong acid sites. Studies of the ketalization of glycerol using H-Beta zeolites as a catalyst have observed TOF of 7.89 min-1 [62] and 26.79 min-1 [59] over commercial zeolites with Si/Al ratios of ∼8 and ∼25, respectively. These results show that the Brönsted and Lewis acid sites produced by the combination of intra framework Zr and Al are more effective in the synthesis of solketal than the acid sites of commercial beta zeolites. 3.3 Catalytic stability With the purpose of studying the stability of the catalysts, after a reaction cycle, the materials were recovered from the reaction mixture and dried at 200 °C (SBAsulf) and 300 °C (ZBZr1) before being subjected to another cycle (post-reaction). After one reaction cycle (Fig. 10 ), the observed conversion dropped from 78% to 38% in SBAsulf and from 78% to 40% in ZBZr1. In the case of selectivity, a drop from 97% to 81% was observed in SBAsulf, while in the case of ZBZr1, the selectivity dropped from 98% to 96%, only. The smaller drop in the selectivity of ZBZr1 could be related to a steric effect occurring in the micropores of the material, hindering the formation of the bulkier 6-membered ring isomer. The decay of the catalytic activity observed in both materials in this work could be related to a strong adsorption of the products or reactants on the surface, which could deactivate some active sites, or produce a blockage of the pores, hindering the access of the reactants to the active sites. To study this effect, catalyst ZBZr1 was subjected to a thermal treatment at 580 °C for 1 h, and the SBAsulf material to a lavage with ethanol (Treated). After these treatments, both materials were subjected to another cycle, observing a better performance in ZBZr1 than in the catalyst without any treatment. On the contrary, the SBAsulf catalyst did not show any improvement after treatment with ethanol. Based on those previous results, the FTIR analysis of the samples post reaction was performed. Fig. 11 shows the FTIR spectra of the fresh and post-reaction SBAsulf catalyst. It can be observed that for both samples the ratio between Si-O-Si, Si-OH and SO3 is similar. Therefore, the material does not suffer any change in the structure or loss of functional groups. New bands on 1415 (methyl group), 1466 (C-H associated with a ring), 2307, 2369, 2900 and 2950 cm−1 (alkyl group) appear on the spent catalyst, with an increase in the band of the OH groups (3000–3700 cm−1), which are associated with the presence of hydroxyl groups, possibly from unreacted glycerol adsorbed on the material (∼3300 cm−1) [63,64]. In the ZBZr1 material (Fig. 12 ), an increase of the bands located at 625 cm−1, 520 cm−1, and 470 cm−1 is observed, which is associated with the characteristic vibrations of C-O-C-O bonds of acetals, and an increase of the band located at 1215 cm−1 associated with C-O bonds of alcohol groups [65], indicating that solketal is adsorbed on the spent catalyst. The new band located at 3230 cm−1 in the spent catalyst is associated with intramolecular hydrogen bonds [65], indicating the presence of adsorbed glycerol on the sample. After a thermal treatment at 300 °C, the bands associated with C-O-C-O bonds in ZBZr1 decrease, reaching an intensity similar to that of the fresh sample. Therefore, the adsorbed solketal could be easily desorbed with a thermal treatment at 300°C. On the contrary, the partial decrease of the band located at 3230 cm−1 indicates that there are still adsorbed species on the catalyst which explain the decreased activity in the second cycle. With this analysis, it is observed that the blockage of the pores produced by the adsorption of glycerol or solketal is one of the most important deactivation mechanisms of the solid [17,66]. 4 Conclusion The influence of the incorporation methodology of Zr on beta zeolites in the glycerol ketalization has been studied over two Zr-zeolite beta, and a SBA-15 catalyst functionalized with sulfonic groups (SBAsulf) was used for comparison purpose. The characterization results showed us that a well-crystallized Zr-zeolite beta with different acidic and textural properties can be obtained by the immersion and subsequent thermal treatment of dealuminated zeolite beta seeds in a solution containing Si and Zr (ZBZr1, Method 1) and by the dealumination of a crystalline beta zeolite, and the next incorporation of Zr in its structure (ZBZr2, Method 2). SEM analysis show that the crystallite size of zeolite ZBZr1 has an average size of 260 nm and the zeolite ZBZr2 has an average crystallite size of 1500 nm. The ZBZr1 material (E0= 440 mV) showed an acid strength similar to SBAsulf (E0= 550 mV) with a smaller density of acid sites and a B/L ratio of 1.9. The material ZBZr2 shows a weaker acid strength (E0=175 mV) and a density of acid sites similar to ZBZr1 and a B/L of 0.7. ZBZr1 and SBAsulf achieved the equilibrium conversion at 40 °C after 180 and 60 min of reaction respectively, while ZBZr2 shows a low catalytic activity (conversion of 5% after 300 min of reaction). The higher catalytic activity of material ZBZr1 could be related with a smaller crystallite size (260 nm for ZBZr1 and 1500 nm for ZBZr2) which induces a faster diffusion of the reactive molecules in the zeolite channels. Regarding the stability of the materials, after one cycle of reaction, both ZBZr1 and SBAsulf, showed a decay of the glycerol conversion. However, the selectivity remained constant in ZBZr1 (∼96%), possibly because the formation of the isomer on the active sites located in the micropores is hindered by a steric effect. A further study with IR over the spent catalysts revealed that the adsorption of solketal and glycerol is one of the most important factors in the decay of the catalytic activity post-reaction. The catalytic activity of the ZBZr1 material could be reestablished after a thermal treatment at 580 °C. CRediT authorship contribution statement Julián A. Vannucci: Methodology, Formal analysis, Investigation, Data curation, Writing – original draft, Visualization, Validation. María S. Legnoverde: Investigation, Formal analysis, Writing – review & editing. Bruno O. Dalla Costa: Investigation, Formal analysis, Writing – review & editing. Elena I. Basaldella: Conceptualization, Funding acquisition, Resources. Nora N. Nichio: Conceptualization, Funding acquisition, Resources. Francisco Pompeo: Conceptualization, Methodology, Supervision, Validation, Writing – review & editing. Declaration of Competing Interest The authors declare that they have no known competing financial interests or personal relationships that could have appeared to influence the work reported in this paper. Acknowledgments This research work was possible due to the funds received from “Consejo Nacional de Investigaciones Científicas y Tecnicas” (CONICET PIP 065), “Universidad Nacional de La Plata” (UNLP-I248) and FONCyT (PICT-2017-2931). The doctoral fellowship granted by CONICET to Julian A. Vannucci is gratefully acknowledged. The authors wish to thank the Secegrin Laboratory from CCT-CONICET Santa Fe for TEM measures and to ANPCyT for the purchase of the SPECS multitechnique analysis instrument (PME8-2003). Supplementary materials Supplementary material associated with this article can be found, in the online version, at doi:10.1016/j.mcat.2022.112497. Appendix Supplementary materials Image, application 1 References [1] Q. Lin Y.H. Li Z.R. Tang Y.J. Xu Valorization of biomass-derived platform molecules via photoredox sustainable catalysis Trans. Tianjin Univ. 26 2020 325 340 10.1007/s12209-020-00271-7 Q. Lin, Y.H. Li, Z.R. Tang, Y.J. Xu, Valorization of biomass-derived platform molecules via photoredox sustainable catalysis, Trans. Tianjin Univ.26 (2020) 325–340. 10.1007/s12209-020-00271-7. [2] M.R. Anuar A.Z. Abdullah Challenges in biodiesel industry with regards to feedstock, environmental, social and sustainability issues: a critical review Renew. Sustain. Energy Rev. 58 2016 208 223 10.1016/j.rser.2015.12.296 M.R. Anuar, A.Z. Abdullah, Challenges in biodiesel industry with regards to feedstock, environmental, social and sustainability issues: a critical review, Renew. Sustain. Energy Rev.58 (2016) 208–223. 10.1016/j.rser.2015.12.296. [3] E. Alptekin M. Canakci Performance and emission characteristics of solketal-gasoline fuel blend in a vehicle with spark ignition engine Appl. Therm. Eng. 124 2017 504 509 10.1016/j.applthermaleng.2017.06.064 E. Alptekin, M. Canakci, Performance and emission characteristics of solketal-gasoline fuel blend in a vehicle with spark ignition engine, Appl. Therm. Eng.124 (2017) 504–509.10.1016/j.applthermaleng.2017.06.064. [4] S. Sabnis J. Zupan M. Gliddon Topical formulations of metaflumizone plus amitraz to treat flea and tick infestations on dogs Vet. Parasitol. 150 2007 196 202 10.1016/j.vetpar.2007.08.044 S. Sabnis, J. Zupan, M. Gliddon, Topical formulations of metaflumizone plus amitraz to treat flea and tick infestations on dogs, Vet. Parasitol.150 (2007) 196–202. 10.1016/j.vetpar.2007.08.044. [5] J. Castillo, J.B. Iturraspe, J.L. Nuñez, Injectable pharmaceutical formulation of melphalan, US20130131174A1, 2013. [6] H. Azeta, H. Masuda, K. Shibata, M. Takahiro, Method for synthesizing polyester resin, JP2006083226A, 2006. [7] J. Eshuis, J.A. Laan, G. Roberts, Polyglycerol production, WO9516723A1, 1995. [8] G. Chiaradia, Plasticizers for polymers, WO2015067814A2, 2015. [9] J. Esteban F. García-Ochoa M. Ladero Solventless synthesis of solketal with commercially available sulfonic acid based ion exchange resins and their catalytic performance Green Process. Synth. 6 2017 79 89 10.1515/gps-2016-0105 J. Esteban, F. García-Ochoa, M. Ladero, Solventless synthesis of solketal with commercially available sulfonic acid based ion exchange resins and their catalytic performance, Green Process. Synth.6 (2017) 79–89. 10.1515/gps-2016-0105. [10] P. Ferreira I.M. Fonseca A.M. Ramos J. Vital J.E. Castanheiro Valorisation of glycerol by condensation with acetone over silica-included heteropolyacids Appl. Catal. B Environ. 98 2010 94 99 10.1016/j.apcatb.2010.05.018 P. Ferreira, I.M. Fonseca, A.M. Ramos, J. Vital, J.E. Castanheiro, Valorisation of glycerol by condensation with acetone over silica-included heteropolyacids, Appl. Catal. B Environ.98 (2010) 94–99. 10.1016/j.apcatb.2010.05.018. [11] M.N. Timofeeva V.N. Panchenko V.V Krupskaya A. Gil M.A. Vicente Effect of nitric acid modification of montmorillonite clay on synthesis of solketal from glycerol and acetone Catal. Commun. 90 2017 65 69 10.1016/j.catcom.2016.11.020 M.N. Timofeeva, V.N. Panchenko, V. V Krupskaya, A. Gil, M.A. Vicente, Effect of nitric acid modification of montmorillonite clay on synthesis of solketal from glycerol and acetone, Catal. Commun.90 (2017) 65–69. 10.1016/j.catcom.2016.11.020. [12] G. Vicente J.A. Melero G. Morales M. Paniagua E. Martín Acetalisation of bio-glycerol with acetone to produce solketal over sulfonic mesostructured silicas Green Chem. 12 2010 899 907 10.1039/B923681C G. Vicente, J.A. Melero, G. Morales, M. Paniagua, E. Martín, Acetalisation of bio-glycerol with acetone to produce solketal over sulfonic mesostructured silicas, Green Chem.12 (2010) 899–907. 10.1039/B923681C. [13] L. Li D. Cani P.P. Pescarmona Metal-containing TUD-1 mesoporous silicates as versatile solid acid catalysts for the conversion of bio-based compounds into valuable chemicals Inorg. Chim. Acta 431 2015 289 296 10.1016/j.ica.2015.04.011 L. Li, D. Cani, P.P. Pescarmona, Metal-containing TUD-1 mesoporous silicates as versatile solid acid catalysts for the conversion of bio-based compounds into valuable chemicals, Inorg. Chim. Acta431 (2015) 289–296. 10.1016/j.ica.2015.04.011. [14] Z. Li Z. Miao X. Wang J. Zhao J. Zhou W. Si S. Zhuo One-pot synthesis of ZrMo-KIT-6 solid acid catalyst for solvent-free conversion of glycerol to solketal Fuel 233 2018 377 387 10.1016/j.fuel.2018.06.081 Z. Li, Z. Miao, X. Wang, J. Zhao, J. Zhou, W. Si, S. Zhuo, One-pot synthesis of ZrMo-KIT-6 solid acid catalyst for solvent-free conversion of glycerol to solketal, Fuel. 233 (2018) 377–387. 10.1016/j.fuel.2018.06.081. [15] H. Serafim I.M. Fonseca A.M. Ramos J. Vital J.E. Castanheiro Valorization of glycerol into fuel additives over zeolites as catalysts Chem. Eng. J. 178 2011 291 296 10.1016/j.cej.2011.10.004 H. Serafim, I.M. Fonseca, A.M. Ramos, J. Vital, J.E. Castanheiro, Valorization of glycerol into fuel additives over zeolites as catalysts, Chem. Eng. J.178 (2011) 291–296. 10.1016/j.cej.2011.10.004. [16] S.S. Priya P.R. Selvakannan K.V.R. Chary M.L. Kantam S.K. Bhargava Solvent-free microwave-assisted synthesis of solketal from glycerol using transition metal ions promoted mordenite solid acid catalysts Mol. Catal. 434 2017 184 193 10.1016/j.mcat.2017.03.001 S.S. Priya, P.R. Selvakannan, K.V.R. Chary, M.L. Kantam, S.K. Bhargava, Solvent-free microwave-assisted synthesis of solketal from glycerol using transition metal ions promoted mordenite solid acid catalysts, Mol. Catal.434 (2017) 184–193. 10.1016/j.mcat.2017.03.001. [17] L.H. Vieira L.G. Possato T.F. Chaves S.H. Pulcinelli C.V Santilli L. Martins Studies on dispersion and reactivity of vanadium oxides deposited on lamellar ferrierite zeolites for condensation of glycerol into bulky products Mol. Catal. 458 2018 161 170 10.1016/j.mcat.2017.11.027 L.H. Vieira, L.G. Possato, T.F. Chaves, S.H. Pulcinelli, C. V Santilli, L. Martins, Studies on dispersion and reactivity of vanadium oxides deposited on lamellar ferrierite zeolites for condensation of glycerol into bulky products, Mol. Catal.458 (2018) 161–170. 10.1016/j.mcat.2017.11.027. [18] M.J. da Silva M.G. Teixeira D.M. Chaves L. Siqueira An efficient process to synthesize solketal from glycerol over tin (II) silicotungstate catalyst Fuel 281 2020 118724 10.1016/j.fuel.2020.118724 M.J. da Silva, M.G. Teixeira, D.M. Chaves, L. Siqueira, An efficient process to synthesize solketal from glycerol over tin (II) silicotungstate catalyst, Fuel. 281 (2020) 118724. 10.1016/j.fuel.2020.118724. [19] L.C. Kao W.C. Kan R.M. Martin-Aranda M.O. Guerrero-Perez M.Á. Bañares S.Y.H. Liou SiO2 supported niobium oxides with active acid sites for the catalytic acetalization of glycerol Catal. Today 356 2020 80 87 10.1016/j.cattod.2019.08.007 L.C. Kao, W.C. Kan, R.M. Martin-Aranda, M.O. Guerrero-Perez, M.Á. Bañares, S.Y.H. Liou, SiO2 supported niobium oxides with active acid sites for the catalytic acetalization of glycerol, Catal. Today. 356 (2020) 80–87. 10.1016/j.cattod.2019.08.007. [20] M. Jose Da Silva A. Alves Rodrigues M. Galdino Teixeira Iron (III) silicotungstate: an efficient and recyclable catalyst for converting glycerol to solketal Energy Fuels 34 2020 9664 9673 10.1021/acs.energyfuels.0c01446 M. Jose Da Silva, A. Alves Rodrigues, M. Galdino Teixeira, Iron (III) silicotungstate: an efficient and recyclable catalyst for converting glycerol to solketal, Energy Fuels. 34 (2020) 9664–9673. 10.1021/acs.energyfuels.0c01446. [21] A. Corma From microporous to mesoporous molecular sieve materials and their use in catalysis Chem. Rev. 97 1997 2373 2420 10.1021/cr960406n A. Corma, From microporous to mesoporous molecular sieve materials and their use in catalysis, Chem. Rev.97 (1997) 2373–2420. 10.1021/cr960406n. [22] C.X.A. da Silva V.L.C. Gonçalves C.J.A. Mota Water-tolerant zeolite catalyst for the acetalisation of glycerol Green Chem. 11 2009 38 41 10.1039/B813564A C.X.A. da Silva, V.L.C. Gonçalves, C.J.A. Mota, Water-tolerant zeolite catalyst for the acetalisation of glycerol, Green Chem.11 (2009) 38–41. 10.1039/B813564A. [23] S.S. Poly M.A.R. Jamil A.S. Touchy S. Yasumura S.M.A.H. Siddiki T. Toyao Z. Maeno K. Shimizu Acetalization of glycerol with ketones and aldehydes catalyzed by high silica Hβ zeolite Mol. Catal. 479 2019 110608 10.1016/j.mcat.2019.110608 S.S. Poly, M.A.R. Jamil, A.S. Touchy, S. Yasumura, S.M.A.H. Siddiki, T. Toyao, Z. Maeno, K. Shimizu, Acetalization of glycerol with ketones and aldehydes catalyzed by high silica Hβ zeolite, Mol. Catal.479 (2019) 110608. 10.1016/j.mcat.2019.110608. [24] J. Kowalska-Kuś A. Held K. Nowińska Solketal formation in a continuous flow process over hierarchical zeolites ChemCatChem 12 2020 510 519 10.1002/cctc.201901270 J. Kowalska-Kuś, A. Held, K. Nowińska, Solketal formation in a continuous flow process over hierarchical zeolites, ChemCatChem. 12 (2020) 510–519. 10.1002/cctc.201901270. [25] J. Wang K. Okumura S. Jaenicke G.-K. Chuah Post-synthesized zirconium-containing Beta zeolite in Meerwein–Ponndorf–Verley reduction: pros and cons Appl. Catal. A Gen. 493 2015 112 120 10.1016/j.apcata.2015.01.001 J. Wang, K. Okumura, S. Jaenicke, G.-K. Chuah, Post-synthesized zirconium-containing Beta zeolite in Meerwein–Ponndorf–Verley reduction: pros and cons, Appl. Catal. A Gen.493 (2015) 112–120. 10.1016/j.apcata.2015.01.001. [26] L. Gao G. Li Z. Sheng Y. Tang Y. Zhang Alkali-metal-ions promoted Zr-Al-Beta zeolite with high selectivity and resistance to coking in the conversion of furfural toward furfural alcohol J. Catal. 389 2020 623 630 10.1016/j.jcat.2020.07.002 L. Gao, G. Li, Z. Sheng, Y. Tang, Y. Zhang, Alkali-metal-ions promoted Zr-Al-Beta zeolite with high selectivity and resistance to coking in the conversion of furfural toward furfural alcohol, J. Catal.389 (2020) 623–630. 10.1016/j.jcat.2020.07.002. [27] M. Koehle R.F. Lobo Lewis acidic zeolite Beta catalyst for the Meerwein–Ponndorf–Verley reduction of furfural Catal. Sci. Technol. 6 2016 3018 3026 10.1039/C5CY01501D M. Koehle, R.F. Lobo, Lewis acidic zeolite Beta catalyst for the Meerwein–Ponndorf–Verley reduction of furfural, Catal. Sci. Technol.6 (2016) 3018–3026. 10.1039/C5CY01501D. [28] F. Gonell M. Boronat A. Corma Structure–reactivity relationship in isolated Zr sites present in Zr-zeolite and ZrO2 for the Meerwein–Ponndorf–Verley reaction Catal. Sci. Technol. 7 2017 2865 2873 10.1039/C7CY00567A F. Gonell, M. Boronat, A. Corma, Structure–reactivity relationship in isolated Zr sites present in Zr-zeolite and ZrO2 for the Meerwein–Ponndorf–Verley reaction, Catal. Sci. Technol.7 (2017) 2865–2873. 10.1039/C7CY00567A. [29] W. Li S. Liu H. Wang B. Gao C. Tu Y. Luo La-doped Zr-Beta zeolite as efficient catalyst for reduction of cyclohexanone to cyclohexanol via the MPV process Catal. Commun. 133 2020 105845 10.1016/j.catcom.2019.105845 W. Li, S. Liu, H. Wang, B. Gao, C. Tu, Y. Luo, La-doped Zr-Beta zeolite as efficient catalyst for reduction of cyclohexanone to cyclohexanol via the MPV process, Catal. Commun.133 (2020) 105845. 10.1016/j.catcom.2019.105845. [30] H.Y. Luo D.F. Consoli W.R. Gunther Y. Román-Leshkov Investigation of the reaction kinetics of isolated Lewis acid sites in Beta zeolites for the Meerwein–Ponndorf–Verley reduction of methyl levulinate to γ-valerolactone J. Catal. 320 2014 198 207 10.1016/j.jcat.2014.10.010 H.Y. Luo, D.F. Consoli, W.R. Gunther, Y. Román-Leshkov, Investigation of the reaction kinetics of isolated Lewis acid sites in Beta zeolites for the Meerwein–Ponndorf–Verley reduction of methyl levulinate to γ-valerolactone, J. Catal.320 (2014) 198–207. 10.1016/j.jcat.2014.10.010. [31] V.L. Sushkevich A. Vimont A. Travert I.I. Ivanova Spectroscopic evidence for open and closed Lewis acid sites in ZrBEA zeolites J. Phys. Chem. C. 119 2015 17633 17639 10.1021/acs.jpcc.5b02745 V.L. Sushkevich, A. Vimont, A. Travert, I.I. Ivanova, Spectroscopic evidence for open and closed Lewis acid sites in ZrBEA zeolites, J. Phys. Chem. C.119 (2015) 17633–17639. 10.1021/acs.jpcc.5b02745. [32] M. Paniagua G. Morales J.A. Melero J. Iglesias C. López-Aguado N. Vidal R. Mariscal M. López-Granados I. Martínez-Salazar Understanding the role of Al/Zr ratio in Zr-Al-Beta zeolite: towards the one-pot production of GVL from glucose Catal. Today. 367 2021 228 238 10.1016/j.cattod.2020.04.025 M. Paniagua, G. Morales, J.A. Melero, J. Iglesias, C. López-Aguado, N. Vidal, R. Mariscal, M. López-Granados, I. Martínez-Salazar, Understanding the role of Al/Zr ratio in Zr-Al-Beta zeolite: towards the one-pot production of GVL from glucose, Catal. Today.367 (2021) 228–238. 10.1016/j.cattod.2020.04.025. [33] L. Li T.I. Korányi B.F. Sels P.P. Pescarmona Highly-efficient conversion of glycerol to solketal over heterogeneous Lewis acid catalysts Green Chem 14 2012 1611 1619 10.1039/C2GC16619D L. Li, T.I. Korányi, B.F. Sels, P.P. Pescarmona, Highly-efficient conversion of glycerol to solketal over heterogeneous Lewis acid catalysts, Green Chem. 14 (2012) 1611–1619. 10.1039/C2GC16619D. [34] Y. Zhu G. Chuah S. Jaenicke Chemo- and regioselective Meerwein–Ponndorf–Verley and Oppenauer reactions catalyzed by Al-free Zr-zeolite beta J. Catal. 227 2004 1 10 10.1016/j.jcat.2004.05.037 Y. Zhu, G. Chuah, S. Jaenicke, Chemo- and regioselective Meerwein–Ponndorf–Verley and Oppenauer reactions catalyzed by Al-free Zr-zeolite beta, J. Catal.227 (2004) 1–10. 10.1016/j.jcat.2004.05.037. [35] A. Corma M.E. Domine S. Valencia Water-resistant solid Lewis acid catalysts: Meerwein–Ponndorf–Verley and Oppenauer reactions catalyzed by tin-beta zeolite J. Catal. 215 2003 294 304 10.1016/S0021-9517(03)00014-9 A. Corma, M.E. Domine, S. Valencia, Water-resistant solid Lewis acid catalysts: Meerwein–Ponndorf–Verley and Oppenauer reactions catalyzed by tin-beta zeolite, J. Catal.215 (2003) 294–304. 10.1016/S0021-9517(03)00014-9. [36] W.D. Bossaert D.E. De Vos W.M. Van Rhijn J. Bullen P.J. Grobet P.A. Jacobs Mesoporous sulfonic acids as selective heterogeneous catalysts for the synthesis of monoglycerides J. Catal. 182 1999 156 164 10.1006/jcat.1998.2353 W.D. Bossaert, D.E. De Vos, W.M. Van Rhijn, J. Bullen, P.J. Grobet, P.A. Jacobs, Mesoporous sulfonic acids as selective heterogeneous catalysts for the synthesis of monoglycerides, J. Catal.182 (1999) 156–164. 10.1006/jcat.1998.2353. [37] M.A. Camblor A. Corma J. Pérez-Pariente Synthesis of titanoaluminosilicates isomorphous to zeolite Beta, active as oxidation catalysts Zeolites 13 1993 82 87 10.1016/0144-2449(93)90064-A M.A. Camblor, A. Corma, J. Pérez-Pariente, Synthesis of titanoaluminosilicates isomorphous to zeolite Beta, active as oxidation catalysts, Zeolites. 13 (1993) 82–87. 10.1016/0144-2449(93)90064-A. [38] S. Brunauer P.H. Emmett E. Teller Adsorption of gases in multimolecular layers J. Am. Chem. Soc. 60 1938 309 319 10.1021/ja01269a023 S. Brunauer, P.H. Emmett, E. Teller, Adsorption of gases in multimolecular layers, J. Am. Chem. Soc.60 (1938) 309–319. 10.1021/ja01269a023. [39] M. Sahooli, M. Rahimpour, M. Khorram, Fine-tuning synthesis and characterization of mono-sized H-Beta zeolite-supported palladium-iridium nanoparticles and application in the selective hydrogenation of acetylene, Catalysts. 7 (2017) 343. 10.3390/catal7110343. [40] C.D. Miranda M A.E. Ramírez S S.G. Jurado C.R. Vera Superficial effects and catalytic activity of ZrO2–SO4 2− as a function of the crystal structure J. Mol. Catal. A Chem. 398 2015 325 335 10.1016/j.molcata.2014.12.015 C.D. Miranda M, A.E. Ramírez S, S.G. Jurado, C.R. Vera, Superficial effects and catalytic activity of ZrO2–SO42− as a function of the crystal structure, J. Mol. Catal. A Chem.398 (2015) 325–335. 10.1016/j.molcata.2014.12.015. [41] H. Zhang W. Yang I.I. Roslan S. Jaenicke G.-K. Chuah A combo Zr-HY and Al-HY zeolite catalysts for the one-pot cascade transformation of biomass-derived furfural to γ-valerolactone J. Catal. 375 2019 56 67 10.1016/j.jcat.2019.05.020 H. Zhang, W. Yang, I.I. Roslan, S. Jaenicke, G.-K. Chuah, A combo Zr-HY and Al-HY zeolite catalysts for the one-pot cascade transformation of biomass-derived furfural to γ-valerolactone, J. Catal.375 (2019) 56–67. 10.1016/j.jcat.2019.05.020. [42] G. Li L. Gao Z. Sheng Y. Zhan C. Zhang J. Ju Y. Zhang Y. Tang A Zr-Al-Beta zeolite with open Zr(iv) sites: an efficient bifunctional Lewis–Brønsted acid catalyst for a cascade reaction Catal. Sci. Technol. 9 2019 4055 4065 10.1039/C9CY00853E G. Li, L. Gao, Z. Sheng, Y. Zhan, C. Zhang, J. Ju, Y. Zhang, Y. Tang, A Zr-Al-Beta zeolite with open Zr(iv) sites: an efficient bifunctional Lewis–Brønsted acid catalyst for a cascade reaction, Catal. Sci. Technol.9 (2019) 4055–4065. 10.1039/C9CY00853E. [43] M. Thommes K. Kaneko A.V Neimark J.P. Olivier F. Rodriguez-Reinoso J. Rouquerol K.S.W. Sing Physisorption of gases, with special reference to the evaluation of surface area and pore size distribution (IUPAC technical report) Pure Appl. Chem. 87 2022 1051 1069 10.1515/pac-2014-1117 n.d. M. Thommes, K. Kaneko, A. V Neimark, J.P. Olivier, F. Rodriguez-Reinoso, J. Rouquerol, K.S.W. Sing, Physisorption of gases, with special reference to the evaluation of surface area and pore size distribution (IUPAC technical report), Pure Appl. Chem.87 (n.d.) 1051–1069. 10.1515/pac-2014-1117. 2022 [44] S. Lowell J.E. Shields M.A. Thomas M. Thommes Characterization of Porous Solids and Powders: Surface Area, Pore Size and Density 2004 Springer Netherlands, Dordrecht 10.1007/978-1-4020-2303-3 S. Lowell, J.E. Shields, M.A. Thomas, M. Thommes, Characterization of Porous Solids and Powders: Surface Area, Pore Size and Density, SpringerNetherlands, Dordrecht, 2004. 10.1007/978-1-4020-2303-3. [45] I. Izquierdo-Barba M. Colilla M. Manzano M. Vallet-Regí In vitro stability of SBA-15 under physiological conditions Microporous Mesoporous Mater. 132 2010 442 452 10.1016/j.micromeso.2010.03.025 I. Izquierdo-Barba, M. Colilla, M. Manzano, M. Vallet-Regí, In vitro stability of SBA-15 under physiological conditions, Microporous Mesoporous Mater.132 (2010) 442–452. 10.1016/j.micromeso.2010.03.025. [46] G. Sartori F. Bigi R. Maggi R. Sartorio D.J. Macquarrie M. Lenarda L. Storaro S. Coluccia G. Martra Catalytic activity of aminopropyl xerogels in the selective synthesis of (E)-nitrostyrenes from nitroalkanes and aromatic aldehydes J. Catal. 222 2004 410 418 10.1016/j.jcat.2003.11.016 G. Sartori, F. Bigi, R. Maggi, R. Sartorio, D.J. Macquarrie, M. Lenarda, L. Storaro, S. Coluccia, G. Martra, Catalytic activity of aminopropyl xerogels in the selective synthesis of (E)-nitrostyrenes from nitroalkanes and aromatic aldehydes, J. Catal.222 (2004) 410–418. 10.1016/j.jcat.2003.11.016. [47] A.S. Cattaneo C. Ferrara D.C. Villa S. Angioni C. Milanese D. Capsoni S. Grandi P. Mustarelli V. Allodi G. Mariotto S. Brutti E. Quartarone SBA-15 mesoporous silica highly functionalized with propylsulfonic pendants: a thorough physico-chemical characterization Microporous Mesoporous Mater. 219 2016 219 229 10.1016/j.micromeso.2015.08.011 A.S. Cattaneo, C. Ferrara, D.C. Villa, S. Angioni, C. Milanese, D. Capsoni, S. Grandi, P. Mustarelli, V. Allodi, G. Mariotto, S. Brutti, E. Quartarone, SBA-15 mesoporous silica highly functionalized with propylsulfonic pendants: a thorough physico-chemical characterization, Microporous Mesoporous Mater.219 (2016) 219–229. 10.1016/j.micromeso.2015.08.011. [48] K. Grzechnik K. Rutkowski Z. Mielke The S–H⋯N versus O–H⋯N hydrogen bonding in the ammonia complexes with CH3OH and CH3SH J. Mol. Struct. 1009 2012 96 102 10.1016/j.molstruc.2011.10.015 K. Grzechnik, K. Rutkowski, Z. Mielke, The S–H⋯N versus O–H⋯N hydrogen bonding in the ammonia complexes with CH3OH and CH3SH, J. Mol. Struct.1009 (2012) 96–102. 10.1016/j.molstruc.2011.10.015. [49] C.-T. Yang M.H. Huang Formation of arrays of gallium nitride nanorods within mesoporous silica SBA-15 J. Phys. Chem. B. 109 2005 17842 17847 10.1021/jp052228k C.-T. Yang, M.H. Huang, Formation of arrays of gallium nitride nanorods within mesoporous silica SBA-15, J. Phys. Chem. B.109 (2005) 17842–17847. 10.1021/jp052228k. [50] B.H. Stuart Infrared Spectroscopy: Fundamentals and Applications 2004 John Wiley & Sons B.H. Stuart, Infrared Spectroscopy: Fundamentals and Applications, John Wiley & Sons, 2004. [51] X. Wang K.S.K. Lin J.C.C. Chan S. Cheng Direct synthesis and catalytic applications of ordered large pore aminopropyl-functionalized SBA-15 mesoporous materials J. Phys. Chem. B. 109 2005 1763 1769 10.1021/jp045798d X. Wang, K. S. K. Lin, J. C. C. Chan, S. Cheng, Direct synthesis and catalytic applications of ordered large pore aminopropyl-functionalized SBA-15 mesoporous materials, J. Phys. Chem. B.109 (2005) 1763–1769. 10.1021/jp045798d. [52] A. Jentys J.A. Lercher J.B.T.-S. in S.S. IR study of the adsorption of benzene on HZSM5 Karge H.G. Weitkamp C. Zeolites as Catal. Sorbents Deterg. Build 1989 Elsevier 585 594 10.1016/S0167-2991(08)61013-7 A. Jentys, J.A. Lercher, IR study of the adsorption of benzene on HZSM5, in: H.G. Karge, J.B.T.-S. in S.S. and C. Weitkamp (Eds.), Zeolites as Catal. Sorbents Deterg. Build., Elsevier, 1989: pp. 585–594. 10.1016/S0167-2991(08)61013-7. [53] P. Sazama B. Wichterlova J. Dedecek Z. Tvaruzkova Z. Musilova L. Palumbo S. Sklenak O. Gonsiorova FTIR and 27Al MAS NMR analysis of the effect of framework Al- and Si-defects in micro- and micro-mesoporous H-ZSM-5 on conversion of methanol to hydrocarbons Microporous Mesoporous Mater. 143 2011 87 96 10.1016/j.micromeso.2011.02.013 P. Sazama, B. Wichterlova, J. Dedecek, Z. Tvaruzkova, Z. Musilova, L. Palumbo, S. Sklenak, O. Gonsiorova, FTIR and 27Al MAS NMR analysis of the effect of framework Al- and Si-defects in micro- and micro-mesoporous H-ZSM-5 on conversion of methanol to hydrocarbons, Microporous Mesoporous Mater.143 (2011) 87–96. 10.1016/j.micromeso.2011.02.013. [54] V.L. Sushkevich I.I. Ivanova S. Tolborg E. Taarning Meerwein–Ponndorf–Verley–Oppenauer reaction of crotonaldehyde with ethanol over Zr-containing catalysts J. Catal. 316 2014 121 129 10.1016/j.jcat.2014.04.019 V.L. Sushkevich, I.I. Ivanova, S. Tolborg, E. Taarning, Meerwein–Ponndorf–Verley–Oppenauer reaction of crotonaldehyde with ethanol over Zr-containing catalysts, J. Catal.316 (2014) 121–129. 10.1016/j.jcat.2014.04.019. [55] R. Cid G. Pecchi Potentiometric method for determining the number and relative strength of acid sites in colored catalysts Appl. Catal. 14 1985 15 21 10.1016/S0166-9834(00)84340-7 R. Cid, G. Pecchi, Potentiometric method for determining the number and relative strength of acid sites in colored catalysts, Appl. Catal.14 (1985) 15–21. 10.1016/S0166-9834(00)84340-7 [56] Q. Yu Y. Guo X. Wu Z. Yang H. Wang Q. Ge X. Zhu Ketonization of propionic acid on Lewis acidic Zr-Beta zeolite with improved stability and selectivity ACS Sustain. Chem. Eng. 9 2021 7982 7992 10.1021/acssuschemeng.1c02290 Q. Yu, Y. Guo, X. Wu, Z. Yang, H. Wang, Q. Ge, X. Zhu, Ketonization of propionic acid on Lewis acidic Zr-Beta zeolite with improved stability and selectivity, ACS Sustain. Chem. Eng.9 (2021) 7982–7992. 10.1021/acssuschemeng.1c02290. [57] F. Schüßler Impact of La Cations In FAU Type Zeolites to Hydride Transfer Reactions 2013 Technischen Universität München F. Schüßler, Impact of La Cations In FAU Type Zeolites to Hydride Transfer Reactions, Technischen Universität München, 2013. [58] M.J. da Silva A.A. Rodrigues P.F. Pinheiro Solketal synthesis from glycerol and acetone in the presence of metal salts: a Lewis or Brønsted acid catalyzed reaction? Fuel 276 2020 118164 10.1016/j.fuel.2020.118164 M.J. da Silva, A.A. Rodrigues, P.F. Pinheiro, Solketal synthesis from glycerol and acetone in the presence of metal salts: a Lewis or Brønsted acid catalyzed reaction?, Fuel. 276 (2020) 118164. 10.1016/j.fuel.2020.118164. [59] P. Manjunathan S.P. Maradur A.B. Halgeri G.V Shanbhag Room temperature synthesis of solketal from acetalization of glycerol with acetone: effect of crystallite size and the role of acidity of beta zeolite J. Mol. Catal. A Chem. 396 2015 47 54 10.1016/j.molcata.2014.09.028 P. Manjunathan, S.P. Maradur, A.B. Halgeri, G. V Shanbhag, Room temperature synthesis of solketal from acetalization of glycerol with acetone: effect of crystallite size and the role of acidity of beta zeolite, J. Mol. Catal. A Chem.396 (2015) 47–54. 10.1016/j.molcata.2014.09.028. [60] M.R. Nanda Y. Zhang Z. Yuan W. Qin H.S. Ghaziaskar C. (Charles) Xu Catalytic conversion of glycerol for sustainable production of solketal as a fuel additive: A review Renew. Sustain. Energy Rev. 56 2016 1022 1031 10.1016/j.rser.2015.12.008 M.R. Nanda, Y. Zhang, Z. Yuan, W. Qin, H.S. Ghaziaskar, C. (Charles) Xu, Catalytic conversion of glycerol for sustainable production of solketal as a fuel additive: A review, Renew. Sustain. Energy Rev.56 (2016) 1022–1031. 10.1016/j.rser.2015.12.008. [61] A.B. Foster M.H. Randall J.M. Webber 615. Aspects of stereochemistry. Part XX. Reaction of 3-O-methyl-D-glucitol with acetone and benzaldehyde J. Chem. Soc. 1965 3388 3394 10.1039/JR9650003388 A.B. Foster, M.H. Randall, J.M. Webber, 615. Aspects of stereochemistry. Part XX. Reaction of 3-O-methyl-D-glucitol with acetone and benzaldehyde, J. Chem. Soc. (1965) 3388–3394. 10.1039/JR9650003388. [62] V. Rossa, Production of Solketal Using Acid Zeolites as Catalysts, in: G.C. Díaz (Ed.), IntechOpen, Rijeka, 2019: p. Ch. 3. 10.5772/intechopen.85817. [63] N. Suriyaprapadilok B. Kitiyanan Synthesis of solketal from glycerol and its reaction with benzyl alcohol Energy Procedia 9 2011 63 69 10.1016/j.egypro.2011.09.008 N. Suriyaprapadilok, B. Kitiyanan, Synthesis of solketal from glycerol and its reaction with benzyl alcohol, Energy Procedia. 9 (2011) 63–69. 10.1016/j.egypro.2011.09.008. [64] Mahreni T. Marnoto M.M.A. Nur Production of solketal (2,2-Dimethyl-1,3-dioxolane-4-methanol) from glycerol and acetone by using homogenous acidic catalyst at the boiling temperature (preliminarry study) J. Phys. Conf. Ser. 1295 2019 12004 10.1088/1742-6596/1295/1/012004 Mahreni, T. Marnoto, M.M.A. Nur, Production of solketal (2,2-Dimethyl-1,3-dioxolane-4-methanol) from glycerol and acetone by using homogenous acidic catalyst at the boiling temperature (preliminarry study), J. Phys. Conf. Ser.1295 (2019) 12004. 10.1088/1742-6596/1295/1/012004. [65] G. Socrates Infrared and Raman Characteristic Group Frequencies: Tables and Charts 2004 John Wiley & Sons G. Socrates, Infrared and Raman Characteristic Group Frequencies: Tables and Charts, John Wiley & Sons, 2004. [66] S. Sandesh A.B. Halgeri G.V Shanbhag Utilization of renewable resources: condensation of glycerol with acetone at room temperature catalyzed by organic–inorganic hybrid catalyst J. Mol. Catal. A Chem. 401 2015 73 80 10.1016/j.molcata.2015.02.015 S. Sandesh, A.B. Halgeri, G. V Shanbhag, Utilization of renewable resources: condensation of glycerol with acetone at room temperature catalyzed by organic–inorganic hybrid catalyst, J. Mol. Catal. A Chem.401 (2015) 73–80. 10.1016/j.molcata.2015.02.015.",
      "scopus-id": "85133905305",
      "coredata": {
        "eid": "1-s2.0-S2468823122003832",
        "dc:description": "Two Zr-beta zeolites were synthesized using different methods. Method 1 consisted in the formation of a dealuminated zeolite beta seed followed by Zr incorporation and thermal treatment (ZBZr1). In Method 2, zeolite beta was prepared and then, the dealumination and subsequent Zr incorporation were performed (ZBZr2). These materials were tested in the ketalization of glycerol with acetone and compared with a SBAsulf. Both preparation methods incorporate Zr in the zeolitic framework, and no ZrO2 is detected. Method 1 developed crystallites with an average size of 260 nm, Si/Zr ratio ∼100, total amount of acid sites of 0.375 mmol.g−1 and a ratio of Brönsted to Lewis acid sites of 1.9. In the case of Method 2, values of 1500 nm, ∼86, 0.32 mmol.g−1 and 0.7 were obtained, respectively. The ZBZr2 sample presented low catalytic activity, possibly due to diffusion limitations. The turnover frequency (TOF) was calculated as 44.84 and 60.37 min−1 for ZBZr1 and SBAsulf , respectively. After one cycle of reaction, both ZBZr1 and SBAsulf showed a decrease in the glycerol conversion, however, the selectivity remained constant in the ZBZr1 material after the reaction cycle and the catalytic activity could be reestablished after a thermal treatment.",
        "openArchiveArticle": "false",
        "prism:coverDate": "2022-08-31",
        "openaccessUserLicense": null,
        "prism:aggregationType": "Journal",
        "prism:url": "https://api.elsevier.com/content/article/pii/S2468823122003832",
        "dc:creator": [
          {
            "@_fa": "true",
            "$": "Vannucci, Julián A."
          },
          {
            "@_fa": "true",
            "$": "Legnoverde, María S."
          },
          {
            "@_fa": "true",
            "$": "Dalla Costa, Bruno O."
          },
          {
            "@_fa": "true",
            "$": "Basaldella, Elena I."
          },
          {
            "@_fa": "true",
            "$": "Nichio, Nora N."
          },
          {
            "@_fa": "true",
            "$": "Pompeo, Francisco"
          }
        ],
        "link": [
          {
            "@_fa": "true",
            "@rel": "self",
            "@href": "https://api.elsevier.com/content/article/pii/S2468823122003832"
          },
          {
            "@_fa": "true",
            "@rel": "scidir",
            "@href": "https://www.sciencedirect.com/science/article/pii/S2468823122003832"
          }
        ],
        "dc:format": "application/json",
        "openaccessType": null,
        "pii": "S2468-8231(22)00383-2",
        "prism:volume": "528",
        "articleNumber": "112497",
        "prism:publisher": "Elsevier B.V.",
        "dc:title": "Al-free Zr-beta zeolite as a selective catalyst for the ketalization of glycerol",
        "prism:copyright": "© 2022 Elsevier B.V. All rights reserved.",
        "openaccess": "0",
        "prism:issn": "24688231",
        "dcterms:subject": [
          {
            "@_fa": "true",
            "$": "Zr-zeolite beta"
          },
          {
            "@_fa": "true",
            "$": "Ordered mesoporous silica"
          },
          {
            "@_fa": "true",
            "$": "Sulfonic SBA-15"
          },
          {
            "@_fa": "true",
            "$": "Solketal"
          },
          {
            "@_fa": "true",
            "$": "Glycerol"
          }
        ],
        "openaccessArticle": "false",
        "prism:publicationName": "Molecular Catalysis",
        "openaccessSponsorType": null,
        "prism:pageRange": "112497",
        "pubType": "fla",
        "prism:coverDisplayDate": "August 2022",
        "prism:doi": "10.1016/j.mcat.2022.112497",
        "prism:startingPage": "112497",
        "dc:identifier": "doi:10.1016/j.mcat.2022.112497",
        "openaccessSponsorName": null
      },
      "objects": {
        "object": [
          {
            "@category": "standard",
            "@height": "327",
            "@width": "386",
            "@_fa": "true",
            "$": "https://api.elsevier.com/content/object/eid/1-s2.0-S2468823122003832-gr1.jpg?httpAccept=%2A%2F%2A",
            "@multimediatype": "JPEG image file",
            "@type": "IMAGE-DOWNSAMPLED",
            "@size": "25618",
            "@ref": "gr1",
            "@mimetype": "image/jpeg"
          },
          {
            "@category": "standard",
            "@height": "142",
            "@width": "565",
            "@_fa": "true",
            "$": "https://api.elsevier.com/content/object/eid/1-s2.0-S2468823122003832-sc1.jpg?httpAccept=%2A%2F%2A",
            "@multimediatype": "JPEG image file",
            "@type": "IMAGE-DOWNSAMPLED",
            "@size": "12770",
            "@ref": "sc1",
            "@mimetype": "image/jpeg"
          },
          {
            "@category": "standard",
            "@height": "128",
            "@width": "301",
            "@_fa": "true",
            "$": "https://api.elsevier.com/content/object/eid/1-s2.0-S2468823122003832-ga1.jpg?httpAccept=%2A%2F%2A",
            "@multimediatype": "JPEG image file",
            "@type": "IMAGE-DOWNSAMPLED",
            "@size": "19416",
            "@ref": "ga1",
            "@mimetype": "image/jpeg"
          },
          {
            "@category": "standard",
            "@height": "280",
            "@width": "390",
            "@_fa": "true",
            "$": "https://api.elsevier.com/content/object/eid/1-s2.0-S2468823122003832-gr10.jpg?httpAccept=%2A%2F%2A",
            "@multimediatype": "JPEG image file",
            "@type": "IMAGE-DOWNSAMPLED",
            "@size": "20078",
            "@ref": "gr10",
            "@mimetype": "image/jpeg"
          },
          {
            "@category": "standard",
            "@height": "637",
            "@width": "389",
            "@_fa": "true",
            "$": "https://api.elsevier.com/content/object/eid/1-s2.0-S2468823122003832-gr12.jpg?httpAccept=%2A%2F%2A",
            "@multimediatype": "JPEG image file",
            "@type": "IMAGE-DOWNSAMPLED",
            "@size": "64805",
            "@ref": "gr12",
            "@mimetype": "image/jpeg"
          },
          {
            "@category": "standard",
            "@height": "313",
            "@width": "389",
            "@_fa": "true",
            "$": "https://api.elsevier.com/content/object/eid/1-s2.0-S2468823122003832-gr11.jpg?httpAccept=%2A%2F%2A",
            "@multimediatype": "JPEG image file",
            "@type": "IMAGE-DOWNSAMPLED",
            "@size": "26242",
            "@ref": "gr11",
            "@mimetype": "image/jpeg"
          },
          {
            "@category": "standard",
            "@height": "335",
            "@width": "388",
            "@_fa": "true",
            "$": "https://api.elsevier.com/content/object/eid/1-s2.0-S2468823122003832-gr5.jpg?httpAccept=%2A%2F%2A",
            "@multimediatype": "JPEG image file",
            "@type": "IMAGE-DOWNSAMPLED",
            "@size": "39946",
            "@ref": "gr5",
            "@mimetype": "image/jpeg"
          },
          {
            "@category": "standard",
            "@height": "325",
            "@width": "388",
            "@_fa": "true",
            "$": "https://api.elsevier.com/content/object/eid/1-s2.0-S2468823122003832-gr4.jpg?httpAccept=%2A%2F%2A",
            "@multimediatype": "JPEG image file",
            "@type": "IMAGE-DOWNSAMPLED",
            "@size": "28342",
            "@ref": "gr4",
            "@mimetype": "image/jpeg"
          },
          {
            "@category": "standard",
            "@height": "463",
            "@width": "632",
            "@_fa": "true",
            "$": "https://api.elsevier.com/content/object/eid/1-s2.0-S2468823122003832-gr3.jpg?httpAccept=%2A%2F%2A",
            "@multimediatype": "JPEG image file",
            "@type": "IMAGE-DOWNSAMPLED",
            "@size": "61299",
            "@ref": "gr3",
            "@mimetype": "image/jpeg"
          },
          {
            "@category": "standard",
            "@height": "334",
            "@width": "386",
            "@_fa": "true",
            "$": "https://api.elsevier.com/content/object/eid/1-s2.0-S2468823122003832-gr2.jpg?httpAccept=%2A%2F%2A",
            "@multimediatype": "JPEG image file",
            "@type": "IMAGE-DOWNSAMPLED",
            "@size": "27378",
            "@ref": "gr2",
            "@mimetype": "image/jpeg"
          },
          {
            "@category": "standard",
            "@height": "297",
            "@width": "390",
            "@_fa": "true",
            "$": "https://api.elsevier.com/content/object/eid/1-s2.0-S2468823122003832-gr9.jpg?httpAccept=%2A%2F%2A",
            "@multimediatype": "JPEG image file",
            "@type": "IMAGE-DOWNSAMPLED",
            "@size": "22163",
            "@ref": "gr9",
            "@mimetype": "image/jpeg"
          },
          {
            "@category": "standard",
            "@height": "529",
            "@width": "389",
            "@_fa": "true",
            "$": "https://api.elsevier.com/content/object/eid/1-s2.0-S2468823122003832-gr8.jpg?httpAccept=%2A%2F%2A",
            "@multimediatype": "JPEG image file",
            "@type": "IMAGE-DOWNSAMPLED",
            "@size": "55263",
            "@ref": "gr8",
            "@mimetype": "image/jpeg"
          },
          {
            "@category": "standard",
            "@height": "286",
            "@width": "389",
            "@_fa": "true",
            "$": "https://api.elsevier.com/content/object/eid/1-s2.0-S2468823122003832-gr7.jpg?httpAccept=%2A%2F%2A",
            "@multimediatype": "JPEG image file",
            "@type": "IMAGE-DOWNSAMPLED",
            "@size": "28151",
            "@ref": "gr7",
            "@mimetype": "image/jpeg"
          },
          {
            "@category": "standard",
            "@height": "314",
            "@width": "390",
            "@_fa": "true",
            "$": "https://api.elsevier.com/content/object/eid/1-s2.0-S2468823122003832-gr6.jpg?httpAccept=%2A%2F%2A",
            "@multimediatype": "JPEG image file",
            "@type": "IMAGE-DOWNSAMPLED",
            "@size": "36931",
            "@ref": "gr6",
            "@mimetype": "image/jpeg"
          },
          {
            "@category": "thumbnail",
            "@height": "164",
            "@width": "193",
            "@_fa": "true",
            "$": "https://api.elsevier.com/content/object/eid/1-s2.0-S2468823122003832-gr1.sml?httpAccept=%2A%2F%2A",
            "@multimediatype": "GIF image file",
            "@type": "IMAGE-THUMBNAIL",
            "@size": "6506",
            "@ref": "gr1",
            "@mimetype": "image/gif"
          },
          {
            "@category": "thumbnail",
            "@height": "55",
            "@width": "219",
            "@_fa": "true",
            "$": "https://api.elsevier.com/content/object/eid/1-s2.0-S2468823122003832-sc1.sml?httpAccept=%2A%2F%2A",
            "@multimediatype": "GIF image file",
            "@type": "IMAGE-THUMBNAIL",
            "@size": "2588",
            "@ref": "sc1",
            "@mimetype": "image/gif"
          },
          {
            "@category": "thumbnail",
            "@height": "93",
            "@width": "219",
            "@_fa": "true",
            "$": "https://api.elsevier.com/content/object/eid/1-s2.0-S2468823122003832-ga1.sml?httpAccept=%2A%2F%2A",
            "@multimediatype": "GIF image file",
            "@type": "IMAGE-THUMBNAIL",
            "@size": "10964",
            "@ref": "ga1",
            "@mimetype": "image/gif"
          },
          {
            "@category": "thumbnail",
            "@height": "157",
            "@width": "219",
            "@_fa": "true",
            "$": "https://api.elsevier.com/content/object/eid/1-s2.0-S2468823122003832-gr10.sml?httpAccept=%2A%2F%2A",
            "@multimediatype": "GIF image file",
            "@type": "IMAGE-THUMBNAIL",
            "@size": "6536",
            "@ref": "gr10",
            "@mimetype": "image/gif"
          },
          {
            "@category": "thumbnail",
            "@height": "164",
            "@width": "100",
            "@_fa": "true",
            "$": "https://api.elsevier.com/content/object/eid/1-s2.0-S2468823122003832-gr12.sml?httpAccept=%2A%2F%2A",
            "@multimediatype": "GIF image file",
            "@type": "IMAGE-THUMBNAIL",
            "@size": "7325",
            "@ref": "gr12",
            "@mimetype": "image/gif"
          },
          {
            "@category": "thumbnail",
            "@height": "164",
            "@width": "204",
            "@_fa": "true",
            "$": "https://api.elsevier.com/content/object/eid/1-s2.0-S2468823122003832-gr11.sml?httpAccept=%2A%2F%2A",
            "@multimediatype": "GIF image file",
            "@type": "IMAGE-THUMBNAIL",
            "@size": "7921",
            "@ref": "gr11",
            "@mimetype": "image/gif"
          },
          {
            "@category": "thumbnail",
            "@height": "164",
            "@width": "190",
            "@_fa": "true",
            "$": "https://api.elsevier.com/content/object/eid/1-s2.0-S2468823122003832-gr5.sml?httpAccept=%2A%2F%2A",
            "@multimediatype": "GIF image file",
            "@type": "IMAGE-THUMBNAIL",
            "@size": "8903",
            "@ref": "gr5",
            "@mimetype": "image/gif"
          },
          {
            "@category": "thumbnail",
            "@height": "164",
            "@width": "196",
            "@_fa": "true",
            "$": "https://api.elsevier.com/content/object/eid/1-s2.0-S2468823122003832-gr4.sml?httpAccept=%2A%2F%2A",
            "@multimediatype": "GIF image file",
            "@type": "IMAGE-THUMBNAIL",
            "@size": "7867",
            "@ref": "gr4",
            "@mimetype": "image/gif"
          },
          {
            "@category": "thumbnail",
            "@height": "160",
            "@width": "219",
            "@_fa": "true",
            "$": "https://api.elsevier.com/content/object/eid/1-s2.0-S2468823122003832-gr3.sml?httpAccept=%2A%2F%2A",
            "@multimediatype": "GIF image file",
            "@type": "IMAGE-THUMBNAIL",
            "@size": "14467",
            "@ref": "gr3",
            "@mimetype": "image/gif"
          },
          {
            "@category": "thumbnail",
            "@height": "163",
            "@width": "189",
            "@_fa": "true",
            "$": "https://api.elsevier.com/content/object/eid/1-s2.0-S2468823122003832-gr2.sml?httpAccept=%2A%2F%2A",
            "@multimediatype": "GIF image file",
            "@type": "IMAGE-THUMBNAIL",
            "@size": "6492",
            "@ref": "gr2",
            "@mimetype": "image/gif"
          },
          {
            "@category": "thumbnail",
            "@height": "164",
            "@width": "215",
            "@_fa": "true",
            "$": "https://api.elsevier.com/content/object/eid/1-s2.0-S2468823122003832-gr9.sml?httpAccept=%2A%2F%2A",
            "@multimediatype": "GIF image file",
            "@type": "IMAGE-THUMBNAIL",
            "@size": "6904",
            "@ref": "gr9",
            "@mimetype": "image/gif"
          },
          {
            "@category": "thumbnail",
            "@height": "163",
            "@width": "120",
            "@_fa": "true",
            "$": "https://api.elsevier.com/content/object/eid/1-s2.0-S2468823122003832-gr8.sml?httpAccept=%2A%2F%2A",
            "@multimediatype": "GIF image file",
            "@type": "IMAGE-THUMBNAIL",
            "@size": "7919",
            "@ref": "gr8",
            "@mimetype": "image/gif"
          },
          {
            "@category": "thumbnail",
            "@height": "161",
            "@width": "219",
            "@_fa": "true",
            "$": "https://api.elsevier.com/content/object/eid/1-s2.0-S2468823122003832-gr7.sml?httpAccept=%2A%2F%2A",
            "@multimediatype": "GIF image file",
            "@type": "IMAGE-THUMBNAIL",
            "@size": "8049",
            "@ref": "gr7",
            "@mimetype": "image/gif"
          },
          {
            "@category": "thumbnail",
            "@height": "164",
            "@width": "203",
            "@_fa": "true",
            "$": "https://api.elsevier.com/content/object/eid/1-s2.0-S2468823122003832-gr6.sml?httpAccept=%2A%2F%2A",
            "@multimediatype": "GIF image file",
            "@type": "IMAGE-THUMBNAIL",
            "@size": "9493",
            "@ref": "gr6",
            "@mimetype": "image/gif"
          },
          {
            "@category": "high",
            "@height": "1447",
            "@width": "1708",
            "@_fa": "true",
            "$": "https://api.elsevier.com/content/object/eid/1-s2.0-S2468823122003832-gr1_lrg.jpg?httpAccept=%2A%2F%2A",
            "@multimediatype": "JPEG image file",
            "@type": "IMAGE-HIGH-RES",
            "@size": "186765",
            "@ref": "gr1",
            "@mimetype": "image/jpeg"
          },
          {
            "@category": "high",
            "@height": "628",
            "@width": "2500",
            "@_fa": "true",
            "$": "https://api.elsevier.com/content/object/eid/1-s2.0-S2468823122003832-sc1_lrg.jpg?httpAccept=%2A%2F%2A",
            "@multimediatype": "JPEG image file",
            "@type": "IMAGE-HIGH-RES",
            "@size": "95362",
            "@ref": "sc1",
            "@mimetype": "image/jpeg"
          },
          {
            "@category": "high",
            "@height": "566",
            "@width": "1333",
            "@_fa": "true",
            "$": "https://api.elsevier.com/content/object/eid/1-s2.0-S2468823122003832-ga1_lrg.jpg?httpAccept=%2A%2F%2A",
            "@multimediatype": "JPEG image file",
            "@type": "IMAGE-HIGH-RES",
            "@size": "159783",
            "@ref": "ga1",
            "@mimetype": "image/jpeg"
          },
          {
            "@category": "high",
            "@height": "1238",
            "@width": "1727",
            "@_fa": "true",
            "$": "https://api.elsevier.com/content/object/eid/1-s2.0-S2468823122003832-gr10_lrg.jpg?httpAccept=%2A%2F%2A",
            "@multimediatype": "JPEG image file",
            "@type": "IMAGE-HIGH-RES",
            "@size": "118352",
            "@ref": "gr10",
            "@mimetype": "image/jpeg"
          },
          {
            "@category": "high",
            "@height": "2824",
            "@width": "1725",
            "@_fa": "true",
            "$": "https://api.elsevier.com/content/object/eid/1-s2.0-S2468823122003832-gr12_lrg.jpg?httpAccept=%2A%2F%2A",
            "@multimediatype": "JPEG image file",
            "@type": "IMAGE-HIGH-RES",
            "@size": "488902",
            "@ref": "gr12",
            "@mimetype": "image/jpeg"
          },
          {
            "@category": "high",
            "@height": "1387",
            "@width": "1725",
            "@_fa": "true",
            "$": "https://api.elsevier.com/content/object/eid/1-s2.0-S2468823122003832-gr11_lrg.jpg?httpAccept=%2A%2F%2A",
            "@multimediatype": "JPEG image file",
            "@type": "IMAGE-HIGH-RES",
            "@size": "189206",
            "@ref": "gr11",
            "@mimetype": "image/jpeg"
          },
          {
            "@category": "high",
            "@height": "1485",
            "@width": "1719",
            "@_fa": "true",
            "$": "https://api.elsevier.com/content/object/eid/1-s2.0-S2468823122003832-gr5_lrg.jpg?httpAccept=%2A%2F%2A",
            "@multimediatype": "JPEG image file",
            "@type": "IMAGE-HIGH-RES",
            "@size": "265322",
            "@ref": "gr5",
            "@mimetype": "image/jpeg"
          },
          {
            "@category": "high",
            "@height": "1436",
            "@width": "1717",
            "@_fa": "true",
            "$": "https://api.elsevier.com/content/object/eid/1-s2.0-S2468823122003832-gr4_lrg.jpg?httpAccept=%2A%2F%2A",
            "@multimediatype": "JPEG image file",
            "@type": "IMAGE-HIGH-RES",
            "@size": "200692",
            "@ref": "gr4",
            "@mimetype": "image/jpeg"
          },
          {
            "@category": "high",
            "@height": "2049",
            "@width": "2799",
            "@_fa": "true",
            "$": "https://api.elsevier.com/content/object/eid/1-s2.0-S2468823122003832-gr3_lrg.jpg?httpAccept=%2A%2F%2A",
            "@multimediatype": "JPEG image file",
            "@type": "IMAGE-HIGH-RES",
            "@size": "547456",
            "@ref": "gr3",
            "@mimetype": "image/jpeg"
          },
          {
            "@category": "high",
            "@height": "1477",
            "@width": "1708",
            "@_fa": "true",
            "$": "https://api.elsevier.com/content/object/eid/1-s2.0-S2468823122003832-gr2_lrg.jpg?httpAccept=%2A%2F%2A",
            "@multimediatype": "JPEG image file",
            "@type": "IMAGE-HIGH-RES",
            "@size": "183818",
            "@ref": "gr2",
            "@mimetype": "image/jpeg"
          },
          {
            "@category": "high",
            "@height": "1314",
            "@width": "1727",
            "@_fa": "true",
            "$": "https://api.elsevier.com/content/object/eid/1-s2.0-S2468823122003832-gr9_lrg.jpg?httpAccept=%2A%2F%2A",
            "@multimediatype": "JPEG image file",
            "@type": "IMAGE-HIGH-RES",
            "@size": "145647",
            "@ref": "gr9",
            "@mimetype": "image/jpeg"
          },
          {
            "@category": "high",
            "@height": "2348",
            "@width": "1725",
            "@_fa": "true",
            "$": "https://api.elsevier.com/content/object/eid/1-s2.0-S2468823122003832-gr8_lrg.jpg?httpAccept=%2A%2F%2A",
            "@multimediatype": "JPEG image file",
            "@type": "IMAGE-HIGH-RES",
            "@size": "424208",
            "@ref": "gr8",
            "@mimetype": "image/jpeg"
          },
          {
            "@category": "high",
            "@height": "1268",
            "@width": "1725",
            "@_fa": "true",
            "$": "https://api.elsevier.com/content/object/eid/1-s2.0-S2468823122003832-gr7_lrg.jpg?httpAccept=%2A%2F%2A",
            "@multimediatype": "JPEG image file",
            "@type": "IMAGE-HIGH-RES",
            "@size": "186228",
            "@ref": "gr7",
            "@mimetype": "image/jpeg"
          },
          {
            "@category": "high",
            "@height": "1392",
            "@width": "1727",
            "@_fa": "true",
            "$": "https://api.elsevier.com/content/object/eid/1-s2.0-S2468823122003832-gr6_lrg.jpg?httpAccept=%2A%2F%2A",
            "@multimediatype": "JPEG image file",
            "@type": "IMAGE-HIGH-RES",
            "@size": "261135",
            "@ref": "gr6",
            "@mimetype": "image/jpeg"
          },
          {
            "@category": "standard",
            "@_fa": "true",
            "$": "https://api.elsevier.com/content/object/eid/1-s2.0-S2468823122003832-mmc1.docx?httpAccept=%2A%2F%2A",
            "@multimediatype": "Microsoft Word file",
            "@type": "APPLICATION",
            "@size": "1819153",
            "@ref": "mmc1",
            "@mimetype": "application/word"
          },
          {
            "@category": "thumbnail",
            "@_fa": "true",
            "$": "https://api.elsevier.com/content/object/eid/1-s2.0-S2468823122003832-si1.svg?httpAccept=%2A%2F%2A",
            "@multimediatype": "Scalable Vector Graphics file",
            "@type": "ALTIMG",
            "@size": "17924",
            "@ref": "si1",
            "@mimetype": "image/svg+xml"
          },
          {
            "@category": "thumbnail",
            "@_fa": "true",
            "$": "https://api.elsevier.com/content/object/eid/1-s2.0-S2468823122003832-si2.svg?httpAccept=%2A%2F%2A",
            "@multimediatype": "Scalable Vector Graphics file",
            "@type": "ALTIMG",
            "@size": "18343",
            "@ref": "si2",
            "@mimetype": "image/svg+xml"
          },
          {
            "@category": "standard",
            "@_fa": "true",
            "$": "https://api.elsevier.com/content/object/eid/1-s2.0-S2468823122003832-am.pdf?httpAccept=%2A%2F%2A",
            "@multimediatype": "Acrobat PDF file",
            "@type": "AAM-PDF",
            "@size": "870570",
            "@ref": "am",
            "@mimetype": "application/pdf"
          }
        ]
      },
      "link": {
        "@rel": "abstract",
        "@href": "https://api.elsevier.com/content/abstract/scopus_id/85133905305"
      }
    }
  }
}