{
  "metadata": {
    "title": "ZnGA/DMC catalysts for the synthesis of high molecular weight poly(propylene carbonate): The crucial role of water treatment",
    "authors": "; ; ",
    "journal": "Molecular Catalysis",
    "date": "2024-07-15",
    "doi": "10.1016/j.mcat.2024.114267",
    "abstract": "",
    "uri": "https://api.elsevier.com/content/article/pii/S2468823124004504",
    "pii": "S2468823124004504"
  },
  "fulltext": {
    "full-text-retrieval-response": {
      "scopus-eid": "2-s2.0-85195293819",
      "originalText": "serial JL 315758 291210 291744 291790 291809 31 Molecular Catalysis MOLECULARCATALYSIS 2024-06-08 2024-06-08 2024-06-08 2024-06-08 2024-07-04T11:58:04 1-s2.0-S2468823124004504 S2468-8231(24)00450-4 S2468823124004504 10.1016/j.mcat.2024.114267 S300 S300.1 FULL-TEXT 1-s2.0-S2468823124X00103 2024-08-12T17:04:10.122887Z 0 0 20240715 2024 2024-06-08T15:34:13.492122Z absattachment articleinfo articlenumber articletitlenorm authfirstinitialnorm authfirstsurnamenorm cid cids contenttype copyright crossmark dateloaded dateloadedtxt datesearch datesort dateupdated dco docsubtype doctype doi eid ewtransactionid hubeid indexeddate issn issnnorm itemstage itemtransactionid itemweight openaccess openarchive pg pgfirst pii piinorm pubdatestart pubdatetxt pubyr sectiontitle sortorder srctitle srctitlenorm srctype ssids alllist content subj subheadings suppl tomb volfirst volissue volumelist webpdf webpdfpagecount yearnav figure table e-component body mmlmath acknowledge affil appendices articletitle auth authfirstini authfull authkeywords authlast grantnumber grantsponsor highlightsabst orcid primabst ref specialabst 2468-8231 24688231 true 564 564 C Volume 564 11 114267 114267 114267 20240715 15 July 2024 2024-07-15 2024 Regular Papers article fla © 2024 Elsevier B.V. All rights are reserved, including those for text and data mining, AI training, and similar technologies. ZNGADMCCATALYSTSFORSYNTHESISHIGHMOLECULARWEIGHTPOLYPROPYLENECARBONATECRUCIALROLEWATERTREATMENT WU Y 1 Introduction 2 Experimental 2.1 Materials 2.2 Preparation of Cat 1 and Cat 3 2.3 Preparation of Cat 2 and Cat 4 2.4 Preparation of double metal cyanide 2.5 Preparation of m-Cat 2 and m-Cat 4 2.6 Copolymerization of CO2 and PO 2.7 Polymer characterizations 2.8 Catalyst characterizations 3 Results and discussion 3.1 Effect of H2O in the preparation of ZnGA catalyst 3.2 XRD characterization 3.3 SEM and EDS characterization 3.4 FTIR characterization 3.5 XPS characterization 3.6 The effect of H2O in ZnGA catalyzed CO2/PO copolymerization 3.7 Copolymerization of CO2/PO catalyzed by modified ZnGA catalysts 3.8 Characteristics and properties of PPC 4 Conclusions CRediT authorship contribution statement Acknowledgements Appendix Supplementary materials References SLATER 2022 853 856 S LIU 2022 112597 112619 Y ROY 2023 113053 113066 S LIANG 2021 3 27 J INOUE 1969 287 292 S ZHANG 2022 102173 102184 Y REE 1999 1863 1876 M K 1981 407 410 S DARENSBOURG 1995 L1 L4 D REE 2006 134 145 M CHEN 2004 5284 5291 S LI 2011 2152 2157 Z KIM 2005 4079 4088 J KIM 2004 2981 2983 J KLAUS 2011 13151 13161 S KIM 2003 386 395 J CHISHOLM 2002 6494 6504 M WANG 2002 2327 2334 S WANG 2005 1108 1114 J EBERHARDT 2004 42 47 R PADMANABAN 2019 336 344 S PADMANABAN 2019 892 S YANG 2022 16620 16627 Y TRAN 2019 86 102 C DONG 2012 362 370 Y XU 2018 163 182 Y MENG 2002 3579 3591 Y ANG 2017 120 127 R REE 2000 1542 1552 M VINEETHA 2020 030004 V DAKE 1989 71 75 L HAFIZOVIC 2007 3612 3620 J CANIVET 2016 4090 4099 J LLABRESIXAMENA 2012 112 117 F LOW 2009 15834 15842 J LIANG 2021 101558 J YE 2020 17860 17867 S YE 2020 17860 17867 S TRAN 2021 429 440 C DUAN 2010 366 371 J AN 2019 e4999 N WUX2024X114267 WUX2024X114267XY 2026-06-08T00:00:00.000Z 2026-06-08T00:00:00.000Z http://creativecommons.org/licenses/by-nc-nd/4.0/ © 2024 Elsevier B.V. All rights are reserved, including those for text and data mining, AI training, and similar technologies. 2024-06-11T04:26:48.524Z http://vtw.elsevier.com/data/voc/AddOnTypes/50.7/aggregated-refined SKL-ChE-18C01 ECUST East China University of Science and Technology http://data.elsevier.com/vocabulary/SciValFunders/501100003021 http://sws.geonames.org/1814991 Shanghai Pujiang Program State Key Laboratory of Chemical Engineering State Key Laboratory of Chemical Engineering http://data.elsevier.com/vocabulary/SciValFunders/501100011308 http://sws.geonames.org/1814991/ 18PJ1402500 STCSM Shanghai Municipality Science and Technology Commission http://data.elsevier.com/vocabulary/SciValFunders/501100003399 http://sws.geonames.org/1814991 We thank the financial support by Shanghai Pujiang Program (18PJ1402500), and the Open Project of State Key Laboratory of Chemical Engineering (SKL-ChE-18C01) at the East China University of Science and Technology. We thank thank the financial support by Shanghai Pujiang Program ( 18PJ1402500 ), and the Open Project of State Key Laboratory of Chemical Engineering ( SKL-ChE-18C01 ) at the East China University of Science and Technology. We acknowledge the supercomputer at East China University of Science and Technology for generous computing resources. https://doi.org/10.15223/policy-017 https://doi.org/10.15223/policy-037 https://doi.org/10.15223/policy-012 https://doi.org/10.15223/policy-029 https://doi.org/10.15223/policy-004 item S2468-8231(24)00450-4 S2468823124004504 1-s2.0-S2468823124004504 10.1016/j.mcat.2024.114267 315758 2024-08-12T17:04:10.122887Z 2024-07-15 1-s2.0-S2468823124004504-main.pdf https://s3-eu-west-1.amazonaws.com/prod-ucs-content-store-eu-west/content/pii:S2468823124004504/MAIN/application/pdf/5702947b9d64106973c19d77d52fa7d0/main.pdf main.pdf pdf true 4392457 MAIN 9 1-s2.0-S2468823124004504-main_1.png https://s3-eu-west-1.amazonaws.com/prod-ucs-content-store-eu-west/content/pii:S2468823124004504/PREVIEW/image/png/5ea14ea6973de42a9f79d63f201ed724/main_1.png main_1.png png 61542 849 656 IMAGE-WEB-PDF 1 1-s2.0-S2468823124004504-gr6.jpg https://s3-eu-west-1.amazonaws.com/prod-ucs-content-store-eu-west/content/pii:S2468823124004504/gr6/DOWNSAMPLED/image/jpeg/2e3fef09a5c26e1d659b2b5163a35729/gr6.jpg gr6 gr6.jpg jpg 27255 234 338 IMAGE-DOWNSAMPLED 1-s2.0-S2468823124004504-gr5.jpg https://s3-eu-west-1.amazonaws.com/prod-ucs-content-store-eu-west/content/pii:S2468823124004504/gr5/DOWNSAMPLED/image/jpeg/8563effe3a522a1323f3c7f38eef0b5d/gr5.jpg gr5 gr5.jpg jpg 18004 280 335 IMAGE-DOWNSAMPLED 1-s2.0-S2468823124004504-gr4.jpg https://s3-eu-west-1.amazonaws.com/prod-ucs-content-store-eu-west/content/pii:S2468823124004504/gr4/DOWNSAMPLED/image/jpeg/fc8ab2abe770eaebcebe59a04da44f2b/gr4.jpg gr4 gr4.jpg jpg 80429 614 345 IMAGE-DOWNSAMPLED 1-s2.0-S2468823124004504-gr3.jpg https://s3-eu-west-1.amazonaws.com/prod-ucs-content-store-eu-west/content/pii:S2468823124004504/gr3/DOWNSAMPLED/image/jpeg/4a0a76c861d0b08297fbc13308f53936/gr3.jpg gr3 gr3.jpg jpg 49961 301 346 IMAGE-DOWNSAMPLED 1-s2.0-S2468823124004504-gr2.jpg https://s3-eu-west-1.amazonaws.com/prod-ucs-content-store-eu-west/content/pii:S2468823124004504/gr2/DOWNSAMPLED/image/jpeg/35c7f8cf3fddbc5bf456580adcc9c552/gr2.jpg gr2 gr2.jpg jpg 49341 313 377 IMAGE-DOWNSAMPLED 1-s2.0-S2468823124004504-ga1.jpg https://s3-eu-west-1.amazonaws.com/prod-ucs-content-store-eu-west/content/pii:S2468823124004504/ga1/DOWNSAMPLED/image/jpeg/d542397976d2fca32fdfd226e504b93b/ga1.jpg ga1 true ga1.jpg jpg 33457 200 383 IMAGE-DOWNSAMPLED 1-s2.0-S2468823124004504-gr1.jpg https://s3-eu-west-1.amazonaws.com/prod-ucs-content-store-eu-west/content/pii:S2468823124004504/gr1/DOWNSAMPLED/image/jpeg/05de81630bb567a11d80638aa6cfa9a3/gr1.jpg gr1 gr1.jpg jpg 34934 217 350 IMAGE-DOWNSAMPLED 1-s2.0-S2468823124004504-sc1.jpg https://s3-eu-west-1.amazonaws.com/prod-ucs-content-store-eu-west/content/pii:S2468823124004504/sc1/DOWNSAMPLED/image/jpeg/6216b8c046679b1805d038ba6c574ada/sc1.jpg sc1 sc1.jpg jpg 30412 198 378 IMAGE-DOWNSAMPLED 1-s2.0-S2468823124004504-gr9.jpg https://s3-eu-west-1.amazonaws.com/prod-ucs-content-store-eu-west/content/pii:S2468823124004504/gr9/DOWNSAMPLED/image/jpeg/5e5fca9108103eaa3407add8a090d0f5/gr9.jpg gr9 gr9.jpg jpg 26310 285 344 IMAGE-DOWNSAMPLED 1-s2.0-S2468823124004504-gr8.jpg https://s3-eu-west-1.amazonaws.com/prod-ucs-content-store-eu-west/content/pii:S2468823124004504/gr8/DOWNSAMPLED/image/jpeg/42cd814461b867b3140618cd21f15a42/gr8.jpg gr8 gr8.jpg jpg 25219 301 344 IMAGE-DOWNSAMPLED 1-s2.0-S2468823124004504-gr7.jpg https://s3-eu-west-1.amazonaws.com/prod-ucs-content-store-eu-west/content/pii:S2468823124004504/gr7/DOWNSAMPLED/image/jpeg/8e1e0e82e780dc75a274ae3943a4cbbf/gr7.jpg gr7 gr7.jpg jpg 28543 283 338 IMAGE-DOWNSAMPLED 1-s2.0-S2468823124004504-gr6.sml https://s3-eu-west-1.amazonaws.com/prod-ucs-content-store-eu-west/content/pii:S2468823124004504/gr6/THUMBNAIL/image/gif/e58d9b4f4d7d0bc831b51678212d40e4/gr6.sml gr6 gr6.sml sml 13792 152 219 IMAGE-THUMBNAIL 1-s2.0-S2468823124004504-gr5.sml https://s3-eu-west-1.amazonaws.com/prod-ucs-content-store-eu-west/content/pii:S2468823124004504/gr5/THUMBNAIL/image/gif/cdf9bd12199376b8a6550ea7c26227f2/gr5.sml gr5 gr5.sml sml 7978 164 196 IMAGE-THUMBNAIL 1-s2.0-S2468823124004504-gr4.sml https://s3-eu-west-1.amazonaws.com/prod-ucs-content-store-eu-west/content/pii:S2468823124004504/gr4/THUMBNAIL/image/gif/cdcee801e07507b18935ad278a1af477/gr4.sml gr4 gr4.sml sml 9532 164 92 IMAGE-THUMBNAIL 1-s2.0-S2468823124004504-gr3.sml https://s3-eu-west-1.amazonaws.com/prod-ucs-content-store-eu-west/content/pii:S2468823124004504/gr3/THUMBNAIL/image/gif/39cd8b07c8f68d85c90058c5d731616f/gr3.sml gr3 gr3.sml sml 17606 163 188 IMAGE-THUMBNAIL 1-s2.0-S2468823124004504-gr2.sml https://s3-eu-west-1.amazonaws.com/prod-ucs-content-store-eu-west/content/pii:S2468823124004504/gr2/THUMBNAIL/image/gif/d098659467e119ec78786fb294d1ee64/gr2.sml gr2 gr2.sml sml 25754 164 197 IMAGE-THUMBNAIL 1-s2.0-S2468823124004504-ga1.sml https://s3-eu-west-1.amazonaws.com/prod-ucs-content-store-eu-west/content/pii:S2468823124004504/ga1/THUMBNAIL/image/gif/119998b1ca9687d37c26ada25d13a6f6/ga1.sml ga1 true ga1.sml sml 10092 114 219 IMAGE-THUMBNAIL 1-s2.0-S2468823124004504-gr1.sml https://s3-eu-west-1.amazonaws.com/prod-ucs-content-store-eu-west/content/pii:S2468823124004504/gr1/THUMBNAIL/image/gif/62c46e3cedc64ba69986337750d3468c/gr1.sml gr1 gr1.sml sml 12916 136 219 IMAGE-THUMBNAIL 1-s2.0-S2468823124004504-sc1.sml https://s3-eu-west-1.amazonaws.com/prod-ucs-content-store-eu-west/content/pii:S2468823124004504/sc1/THUMBNAIL/image/gif/bde37470ce50b7b3d5971a84d4fba8ee/sc1.sml sc1 sc1.sml sml 11717 115 219 IMAGE-THUMBNAIL 1-s2.0-S2468823124004504-gr9.sml https://s3-eu-west-1.amazonaws.com/prod-ucs-content-store-eu-west/content/pii:S2468823124004504/gr9/THUMBNAIL/image/gif/d7231be201ef37a1c8928756ec3b981f/gr9.sml gr9 gr9.sml sml 9866 163 197 IMAGE-THUMBNAIL 1-s2.0-S2468823124004504-gr8.sml https://s3-eu-west-1.amazonaws.com/prod-ucs-content-store-eu-west/content/pii:S2468823124004504/gr8/THUMBNAIL/image/gif/60bca9de5d10c927e7bdbabe645d891b/gr8.sml gr8 gr8.sml sml 8127 163 187 IMAGE-THUMBNAIL 1-s2.0-S2468823124004504-gr7.sml https://s3-eu-west-1.amazonaws.com/prod-ucs-content-store-eu-west/content/pii:S2296264623002923/gr7/THUMBNAIL/image/gif/c3ac997fa855819c6ad1ef370c65f22e/gr7.sml gr7 gr7.sml sml 11678 164 196 IMAGE-THUMBNAIL 1-s2.0-S2468823124004504-gr6_lrg.jpg https://s3-eu-west-1.amazonaws.com/prod-ucs-content-store-eu-west/content/pii:S2468823124004504/HIGHRES/image/jpeg/705a3cb971bd35a2e827c3c69d75b0ba/gr6_lrg.jpg gr6 gr6_lrg.jpg jpg 231272 1039 1498 IMAGE-HIGH-RES 1-s2.0-S2468823124004504-gr5_lrg.jpg https://s3-eu-west-1.amazonaws.com/prod-ucs-content-store-eu-west/content/pii:S2468823124004504/HIGHRES/image/jpeg/3670549fac42a22b31d65cb4299b2b39/gr5_lrg.jpg gr5 gr5_lrg.jpg jpg 129010 1243 1485 IMAGE-HIGH-RES 1-s2.0-S2468823124004504-gr4_lrg.jpg https://s3-eu-west-1.amazonaws.com/prod-ucs-content-store-eu-west/content/pii:S2468823124004504/HIGHRES/image/jpeg/e640a54478417468bcfdd90310e3f666/gr4_lrg.jpg gr4 gr4_lrg.jpg jpg 665727 2719 1528 IMAGE-HIGH-RES 1-s2.0-S2468823124004504-gr3_lrg.jpg https://s3-eu-west-1.amazonaws.com/prod-ucs-content-store-eu-west/content/pii:S2468823124004504/HIGHRES/image/jpeg/bb98e002f05c276fcffb51f81411757b/gr3_lrg.jpg gr3 gr3_lrg.jpg jpg 394441 1333 1533 IMAGE-HIGH-RES 1-s2.0-S2468823124004504-gr2_lrg.jpg https://s3-eu-west-1.amazonaws.com/prod-ucs-content-store-eu-west/content/pii:S2468823124004504/HIGHRES/image/jpeg/af0517768716765aa8a73e995104180f/gr2_lrg.jpg gr2 gr2_lrg.jpg jpg 453297 1388 1672 IMAGE-HIGH-RES 1-s2.0-S2468823124004504-ga1_lrg.jpg https://s3-eu-west-1.amazonaws.com/prod-ucs-content-store-eu-west/content/pii:S2468823124004504/HIGHRES/image/jpeg/e257dd9038344fc17c7ee9a6b4139be9/ga1_lrg.jpg ga1 true ga1_lrg.jpg jpg 190861 886 1697 IMAGE-HIGH-RES 1-s2.0-S2468823124004504-gr1_lrg.jpg https://s3-eu-west-1.amazonaws.com/prod-ucs-content-store-eu-west/content/pii:S2468823124004504/HIGHRES/image/jpeg/756bcada64ade0e5acbdad2cb41ba523/gr1_lrg.jpg gr1 gr1_lrg.jpg jpg 273263 963 1553 IMAGE-HIGH-RES 1-s2.0-S2468823124004504-sc1_lrg.jpg https://s3-eu-west-1.amazonaws.com/prod-ucs-content-store-eu-west/content/pii:S2468823124004504/HIGHRES/image/jpeg/de289f50b28963eac02e562649c6354f/sc1_lrg.jpg sc1 sc1_lrg.jpg jpg 212465 875 1673 IMAGE-HIGH-RES 1-s2.0-S2468823124004504-gr9_lrg.jpg https://s3-eu-west-1.amazonaws.com/prod-ucs-content-store-eu-west/content/pii:S2296264623002923/HIGHRES/image/jpeg/1bff9cf87d36dbb076de54d0feaa6bdb/gr9_lrg.jpg gr9 gr9_lrg.jpg jpg 196392 1264 1523 IMAGE-HIGH-RES 1-s2.0-S2468823124004504-gr8_lrg.jpg https://s3-eu-west-1.amazonaws.com/prod-ucs-content-store-eu-west/content/pii:S2468823124004504/HIGHRES/image/jpeg/5858a9db47919e3a8cd4ffb456477315/gr8_lrg.jpg gr8 gr8_lrg.jpg jpg 168235 1331 1523 IMAGE-HIGH-RES 1-s2.0-S2468823124004504-gr7_lrg.jpg https://s3-eu-west-1.amazonaws.com/prod-ucs-content-store-eu-west/content/pii:S2296264623002923/HIGHRES/image/jpeg/edc63a702303be49446c99f8b4bd9336/gr7_lrg.jpg gr7 gr7_lrg.jpg jpg 220189 1255 1498 IMAGE-HIGH-RES 1-s2.0-S2468823124004504-mmc1.docx https://s3-eu-west-1.amazonaws.com/prod-ucs-content-store-eu-west/content/pii:S2468823124004504/mmc1/MAIN/application/vnd.openxmlformats-officedocument.wordprocessingml.document/07a5962bf5033f99ada6fb13880b1f75/mmc1.docx mmc1 mmc1.docx docx 4327058 APPLICATION 1-s2.0-S2468823124004504-si1.svg https://s3-eu-west-1.amazonaws.com/prod-ucs-content-store-eu-west/content/pii:S2468823124004504/image/svg+xml/28dbb4132d281f3deca5f2407cd24bfc/si1.svg si1 si1.svg svg 7201 ALTIMG 1-s2.0-S2468823124004504-si2.svg https://s3-eu-west-1.amazonaws.com/prod-ucs-content-store-eu-west/content/pii:S2468823124004504/image/svg+xml/60ca3be888ae17768f03e4efa6050211/si2.svg si2 si2.svg svg 7201 ALTIMG 1-s2.0-S2468823124004504-am.pdf am am.pdf pdf 1176491 AAM-PDF https://s3-eu-west-1.amazonaws.com/prod-ucs-content-store-eu-west/content/egi:10HK51W1FQL/MAIN/application/pdf/3441fe0092b098b7850e18896fd4c4d3/am.pdf MCAT 114267 114267 S2468-8231(24)00450-4 10.1016/j.mcat.2024.114267 Elsevier B.V. Fig. 1 XRD patterns of Cat 1, Cat 2, Cat 3, and Cat 4. Fig 1 Fig. 2 SEM micrographs of (a) Cat 1, (b) Cat 2, (c) Cat 3, and (d) Cat 4. Fig 2 Fig. 3 FTIR spectra of the prepared ZnGA catalysts. Fig 3 Fig. 4 (a) Zn 2p photoelectron spectra for Cat 3 and Cat 4; (b) O 1s photoelectron spectra for Cat 3 and Cat 4. Fig 4 Fig. 5 1H NMR spectrum of the PPC by using Cat 4 at 25 °C (Table 3, entry 4) (CDCl3, 400 MHz, 25 °C). Fig 5 Fig. 6 XRD patterns of Cat 4, DMC, and m-Cat 4b catalyst. Fig 6 Fig. 7 FTIR spectra of Cat 4, DMC, and m-Cat 4b catalyst. Fig 7 Fig. 8 FTIR spectrum of copolymer PPC synthesized by using m-ZnGA catalyst. (Table 4, entry 8). Fig 8 Fig. 9 GPC curves of PPCs in Table 4 (black line, entry 1; blue line, entry 2; red line, entry 8). Fig 9 Scheme 1 Schematic representation of the Zn-based catalysts for the synthesis of high molecular weight poly(propylene carbonate). Scheme 1 Table 1 Particle size and external surface area of ZnGA prepared under different conditions and zinc source. Table 1 Catalyst Mean volume diameter a /[μm] Mean area diameter b /[μm] Mean number diameter c /[μm] External surface area d /[m2/cc] e Mz f /[μm] Cat 1 52.4 12.3 2.8 0.5 45.1 Cat 2 11.4 2.2 0.2 2.6 2.5 Cat 3 55.3 15.8 2.9 0.4 61.8 Cat 4 2.4 1.5 0.9 3.9 2.8 a Mean Volume Diameter—Mean Diameter of the Volume distribution represents the center of gravity of the distribution, which is weighted (strongly influenced) by coarse particles and is a type of average particle size. b Mean Area Diameter—Mean Diameter of the Area distribution, which is less weighted than Mean Volume Diameter by the presence of coarse particles, and represents a particle surface measurement. c Mean Number Diameter—Mean Diameter of the Number distribution, which is calculated using the volume distribution data and is weighted to the small particles. d External surface area. e Square meter per cubic centimeter. f Mean particle size. Table 2 TEM-EDS of ZnGA. (Line type: K series). Table 2 Catalyst Element Atomic Fraction (%) Mass Fraction (%) The ratio of O to Zn (O/Zn) Cat 1 C 25.2 10.0 O 43.8 23.1 1.4 Zn 31.0 66.9 Cat 2 C 36.8 19.3 O 46.3 32.4 2.7 Zn 16.9 48.3 Cat 3 C 31.7 14.0 O 43.0 25.3 1.7 Zn 25.3 60.7 Cat 4 C 37.1 19.6 O 46.2 32.5 2.8 Zn 16.7 47.9 Table 3 Copolymerization of CO2 and PO over various ZnGA catalysts a . Table 3 Entry Catalyst Yield[g poly/g cat] CU b [%] Mn c [× 105] PDI c Tg d [ °C] 1 Cat 1 4 90.8 0.6 2.6 37 2 Cat 2 10 92.0 1.0 2.2 39 3 Cat 3 Trace — — — — 4 Cat 4 31 92.5 1.4 3.4 40 a Reaction pressure: 5.0 MPa, reaction temperature: 70.0 °C, reaction time: 40 h, PO: 50 mL. ZnGA catalyst 125 mg. b Calculated by integration of methine resonances in 1H NMR of crude product (CDCl3, 400 MHz). c Mn and PDI were determined by GPC in THF with polystyrene standards. d Tg were determined by DSC. Table 4 Copolymerization of CO2 and PO over DMC, ZnGA-H2O, and m-ZnGA catalysts. a . Table 4 Entry Catalyst Time[h] Temp.[ °C] CO2 [MPa] Cat.[mg] Yield b CU c [%] Sel c [%] Mn d [× 105] PDI d Tg e [ °C] 1 DMC 8 70 4 3 4667 21.5 96.5 0.7 1.9 4 2 Cat 4 f 40 70 4 125 31 92.5 97.2 1.4 3.4 40 3 m-Cat 2a 24 70 4 15 482 54.4 96.4 0.9 2.9 19 4 m-Cat 2b 24 70 4 15 857 55.1 96.9 1.1 3.1 22 5 m-Cat 2c 24 70 4 15 1269 55.3 96.3 0.7 3.1 25 6 m-Cat 2d 24 70 4 15 1836 56.1 93.4 1.3 2.6 26 7 m-Cat 4a 24 70 4 15 290 42.0 95.9 0.6 1.8 13 8 m-Cat 4b 24 70 4 15 1729 61.2 98.7 2.3 2.4 31 9 m-Cat 4c 24 70 4 15 1475 54.7 96.1 1.0 2.6 22 10 m-Cat 4d 24 70 4 15 1567 46.5 94.5 1.1 2.5 17 11 m-Cat 4b 24 70 4 30 1466 46.4 98.5 1.6 2.4 18 12 m-Cat 4b 24 70 4 8 2851 61.6 98.7 1.2 2.6 30 13 m-Cat 4b 24 80 4 15 1292 53.8 98.2 0.7 2.5 18 14 m-Cat 4b 24 70 3 8 3142 53.2 98.8 1.1 2.7 18 15 m-Cat 4b 24 70 5 8 2521 58.8 98.7 1.2 2.7 25 16 m-Cat 4b 12 70 4 8 696 53.1 98.2 1.4 2.2 22 17 m-Cat 4b 36 70 4 8 1733 58.3 97.5 0.9 3.5 26 a PO: 15 mL. b g poly/g cat. c Calculated by integration of methine resonances in 1H NMR of crude product (CDCl3, 400 MHz). d Mn and PDI were determined by GPC in THF with polystyrene standards. e Tg were determined by DSC. f PO: 50 mL. ZnGA/DMC catalysts for the synthesis of high molecular weight poly(propylene carbonate): The crucial role of water treatment Yulong Wu Writing – original draft Investigation Formal analysis Conceptualization Yingfang Nie Methodology Li Sun Validation ZhenHao Xi Writing – review & editing Resources ⁎ Zhen Liu Writing – review & editing Supervision Project administration ⁎ State Key Laboratory of Chemical Engineering, East China University of Science and Technology, Shanghai, 200237, China State Key Laboratory of Chemical Engineering East China University of Science and Technology Shanghai 200237 China State Key Laboratory of Chemical Engineering, East China University of Science and Technology, Shanghai, 200237, China ⁎ Corresponding authors. Zinc glutarate (ZnGA) is a prominent catalyst for the production of CO2-based poly(propylene carbonate). The original catalysts, ZnO-GA (Cat 1) and ZnAc2-GA (Cat 3), were prepared using ZnO and ZnAc2 as Zn sources, respectively. ZnO-GA-H2O (Cat 2) and ZnAc2-GA-H2O (Cat 4) were prepared by water treatment of Cat 1 and Cat 3, respectively. After water treatment, both Cat 2 and Cat 4 showed enhanced performance for copolymerization of CO2 and propylene oxide. The characterizations demonstrated that H2O is a critical component that not only improves the crystallinity and external surface area of ZnGA, but also increases the number of surface Zn-OH groups. By adding a portion of cyanide, further modification on Cat 4 resulted in a group of ZnAc2-GA-H2O/DMC catalysts (m-Cat 4). The polymerization reached a high yield of 1729 g poly/g Cat and a selectivity of 98.7 % at molar ratio of DMC/ZnGA = 1: 10 (t = 24 h; T = 70 °C; P = 4 MPa). The modified ZnGA/DMC catalyst exhibited remarkable yield and selectivity for the copolymerization of CO2 and propylene oxide to produce high molecular weight alternating copolymers (2.3 × 105 g/mol). Graphical abstract Image, graphical abstract Keywords CO2 Zinc glutarate Copolymerization Poly(propylene carbonate) Propylene oxide Data availability Data will be made available on request. 1 Introduction CO2 emissions from the combustion of fossil fuels are the primary cause of global warming and climate change [1]. Meanwhile, CO2 is a nontoxic, stable, inexpensive, abundant, and non-flammable C1 feedstock. As such, there is interest in utilizing CO2 to make commercial products [2,3]. Poly(propylene carbonate) (PPC) can be produced by the ring-opening copolymerization (ROCOP) of CO2 and propylene oxide. It has superior properties, such as high strength, durability, transparency, and electrical insulation, etc. Currently, CO2-based PPC has already been used in various applications, including electronics, optical media, the automotive industry, and the medical industry, etc. [4]. The first ROCOP of CO2 and propylene oxide (PO) was carried out by Inoue in 1969 [5]. Since then, numerous heterogeneous catalyst systems, such as zinc dicarboxylates, double metal cyanides, and rare earth ternary catalysts, and homogeneous catalyst systems, such as Salen-metal complexes and zinc phenoxides, have been developed. Inevitably, most of the catalysts have failed to meet the following two characteristics: i) to produce a perfect alternating copolymer with a high catalytic performance, and ii) to achieve high yield and selectivity with a lower content of ether linkages in the polymer chain and a lower ratio of cyclic carbonate by-product [6]. The current challenge is to develop catalysts that not only exhibit high yield and selectivity but also produce high molecular weight alternating copolymers. ZnGA is a typical heterogeneous catalyst for CO2 and PO copolymerization. It is a widely used catalyst due to its simple synthesis process, and produces PPC with high molecular weight, and high carbonate linkage content [7]. However, the performance of the catalyst synthesized using different Zn and acid sources has not been satisfactory. In 1981, Soga et al. investigated a series of zinc-based catalysts prepared from various aliphatic dicarboxylic acids and Zn(OH)2, and concluded that the best combination for the synthesis of the catalyst is Zn(OH)2 with glutaric acid (GA) [8]. Darensbourg et al. reported the white precipitate of ZnGA with a low yield by adding dicarboxylic acid to a heated toluene solution of zinc oxide [9]. Ree et al. synthesized ZnGA catalysts using different zinc sources. [7] The ZnGA synthesized with zinc oxide (ZnO) and GA was found to have a high catalytic performance, which was mainly attributed to the morphological structure of ZnGA. The effects of crystallinity, crystallization quality, and external surface area have been discussed in detail [10]. Although ZnO is most suitable for the synthesis of ZnGA, several studies have reported that ZnGA synthesized from ZnAc2–2H2O showed satisfactory yield and product properties [10–13]. However, ZnGA synthesized from anhydrous zinc acid (ZnAc2) and GA showed almost no production. The molecular structure of zinc glutarate has been identified as having a unique conformation in which the Zn ion centers coordinate with four carboxyl oxygen atoms from different glutarate ligands, forming a distorted tetrahedral geometry [14]. There is a close relationship between the structure and the performance of the catalyst. Experimental and theoretical studies have shown that the intrinsic structure of Zn-dicarboxylic acid is the main reason why its performance cannot be substantially increased, and the optimum distance between Zn-Zn is 4.3 – 5.0 Å [15]. Compared with CO2, PO was found to be more readily adsorbed onto the ZnGA catalyst and inserted into the Zn-O bond, suggesting that the ZnGA-catalyzed CO2/PO ROCOP was initiated by PO rather than CO2 [16]. The catalytic performance of ZnGA was enhanced by increasing the content of the Zn-OH groups, which can act as active initiating species [17]. Although modifications focus on improving catalytic performance and producing alternating copolymers with high molecular weight, high glass transition temperature, and excellent thermal stability, these attempts have not been satisfactory so far. The low catalytic performance has limited the use of ZnGA in industry [13]. Various attempts have been made to improve the catalytic performance of ZnGA. A number of operations failed to improve the catalyst performance, such as changing the stirring method [18], using montmorillonite as a support in ZnGA catalyst [19], introducing ethyl sulfinate by SO2 [20], HCl carving the surface of ZnGA [21], Lewis acid (MCln) treatment [22], etc. These studies suggest that the slight increase in catalyst performance may be due to an increase in the number of active centers. However, the surface composition and internal structure of such heterogeneous catalysts are typically unknown, making it challenging to determine the active site of the heterogeneous catalysts and make significant improvements. It has been found that cyanide is effective in increasing the catalytic performance of ZnGA. Recently, Yang et al. reported a high yield of 855 g poly/g cat for CO2/PO copolymerization using 2D-ZnGA treated with H3[Co(CN)6] [23]. Similar structures and compositions exist between DMC catalysts and H3[Co(CN)6]. The Zn-Co DMC catalyst has the advantages of low cost and easy product separation. DMC has been widely used in the synthesis of polyols/polyether, suggesting that DMC can facilitate the ring opening of PO [24]. The catalytic yield of Zn-Co DMC reached as high as 60,600 g poly/g cat after 10 h when the low-molecular-weight polyether polyol initiator was not used [12]. Wang et al. used a combination of DMC and rare earth ternary catalysts to obtain polycarbonate with a carbonate unit (CU) content ranging from 57.8 % to 97.1 % and Mn = 1 × 105 g/mol [25]. It is possible that the incorporation of a portion of DMC into ZnGA could increase the rate of PO ring opening and further improve the efficiency of the copolymerization reaction. Herein, effect of the different zinc sources and effect of the amount of DMC on catalytic process were systematically investigated. First, ZnGA and H2O-activated ZnGA were prepared from two different zinc sources (ZnO and ZnAc2). Then, the effect of H2O on the ZnGA catalyst was investigated by XRD, SEM, EDS, FTIR, and XPS characterizations. The catalytic performance between ZnGA and H2O-activated ZnGA was compared. Finally, the DMC-modified ZnGA heterogeneous catalyst was studied and the optimal reaction conditions for CO2/PO copolymerization was revealed (Scheme 1 ). 2 Experimental 2.1 Materials ZnO (≥ 99.8 %, anhydrous) was purchased from Sigma-Aldrich (China) Co., Ltd.; ZnAc2 (≥ 99 %, anhydrous) was purchased from Shanghai Mayer Chemical Technology Co., Ltd.; GA (≥ 99 %, anhydrous) was purchased from Shanghai Titan Technology Co., Ltd.; Zinc chloride (ZnCl2, ≥ 99 %, anhydrous) was purchased from Shanghai Aladdin Biochemical Technology Co., Ltd.; Potassium hexacyanocobaltate (K3[Co(CN)6]) (≥ 98 %), toluene, tert‑butyl alcohol (t-BuOH), acetone, analytical grade dichloromethane (CH2Cl2), and deuterated chloroform (CDCl3) (≥ 99.8 %) were purchased from Shanghai Aladdin Biochemical Technology Co., Ltd.; Nitrogen (N2) (≥ 99.999 %) and CO2 (≥ 99.995 %) were purchased from Air Liquide Co., Ltd. Liquid PO was distilled over calcium hydride (CaH2) and stored under nitrogen (N2). CO2 was used directly without further purification. 2.2 Preparation of Cat 1 and Cat 3 In a 250 mL Schlenk-vessel equipped with a reflux condenser and dean-stark trap, 98.0 mmol of GA and 100.0 mmol of ZnO (ZnO-GA, Cat 1) were suspended in 150 mL of toluene under an inert argon atmosphere. The mixture was heated at 70 °C for 9 h and then allowed to cool to room temperature. The resulting precipitate was filtered, washed with excess acetone, and centrifuged at a speed of 5000 rpm. Finally, the product was dried at 80 °C in a vacuum oven. The prepared material was characterized by XRD, IR, and SEM. The same procedure was followed to prepare Cat 3 (ZnAc2-GA) by using anhydrous zinc acetate as the zinc source. 2.3 Preparation of Cat 2 and Cat 4 Cat 2 (ZnO-GA-H2O) was prepared by activation of 50 mmol of Cat 1 in 5 mL mili-Q water overnight in a glass petri dish and thoroughly dried in a vacuum oven at 130 °C for 12 h. The same procedure was followed to prepare Cat 4 (ZnAc2-GA-H2O) by water treatment of Cat 3. 2.4 Preparation of double metal cyanide The double metal cyanide (DMC) catalyst was prepared according to the following procedure. Solution 1 consisted of 6.6 g of K3[Co(CN)6] dissolved in 50 mL of mili-Q water. Solution 2 was obtained by dissolving 40 g of ZnCl2 in a mixture of 100 mL mili-Q water and 100 mL t-BuOH. Solution 1 was slowly added to solution 2 at 35 °C with vigorous stirring, maintaining a drop for 10 s. After the dripping was completed, the reaction was maintained at 35 °C for 2 h under vigorous stirring. The resulting white suspension was redispersed in a solution of t-BuOH and mili-Q water (1: 1 v/v) under vigorous stirring. The precipitate was separated by centrifugation and then washed repeatedly with a mixture of increasing volume ratios of t-BuOH and mili-Q water (6: 4, 7: 3, 8: 2, and 9: 1, respectively). Finally, the precipitate was washed in pure t-BuOH, then filtered and dried under vacuum at 80 °C overnight. The milky DMC powder was obtained with a high yield of over 96 %. 2.5 Preparation of m-Cat 2 and m-Cat 4 m-Cat 2 (ZnO-GA-H2O/DMC) and m-Cat 4 (ZnAc2-GA-H2O/DMC) were prepared by addition of a portion of DMC into Cat 2 and Cat 4, respectively. 5 mmol of DMC and 100 mmol Cat 2 in a given molar ratio were introduced in 150 mL of toluene in a 250 mL round-bottom flask under vigorous stirring at 60 °C for 12 h. The chemical precipitate was then centrifuged and washed several times with 100 mL of acetone. The resulting white suspension was dried in a vacuum oven at 100 °C for 24 h. A fine white powder m-Cat 2a was obtained with a molar ratio of DMC/Cat 2 = 1: 20. The same procedure was followed to prepare m-Cat 2b, m-Cat 2c, m-Cat 2d with a molar ratio of DMC to ZnGA = 1: 10, 1: 5, 1: 1, respectively. By mixing DMC and Cat 4, the same procedure was followed to prepare m-Cat 4a, m-Cat 4b, m-Cat 4c, m-Cat 4d with a molar ratio of DMC to ZnGA = 1: 20, 1: 10, 1: 5, 1: 1, respectively. 2.6 Copolymerization of CO2 and PO Copolymerization experiments were carried out using a 100 mL steel autoclave equipped with mechanical stirring and oil bath heating. A specified amount of catalyst was introduced into the autoclave and sealed. CO2 was then introduced at a controlled rate, followed by opening the carbon dioxide vent valve to purge the vessel. The autoclave was gradually heated to 110 °C over a period of 3 h. Then, the autoclave was cooled to ambient temperature and the CO2 vent valve was closed. The reactor was further evacuated with a vacuum pump (−0.1 MPa) for 1 hour. Next, a certain amount of propylene oxide was injected into the autoclave, and the vessel was heated to the reaction temperature. Subsequently, the reaction started by opening the CO2 inlet valve to achieve the reaction pressure. Upon completion of the reaction, the reactor was cooled to 0 °C and the vent valve was opened again to gradually release the unreacted CO2 from the reactor. The viscous reaction mixture was purified by precipitation in a mixture of 200 mL CH2Cl2 and 200 mL methanol (v/v = 1:1). The final product was then dried under vacuum at 50 °C for 12 h for further characterization. 2.7 Polymer characterizations 1H NMR spectra of the polymers were acquired on a Bruker AVANCE III 400 spectrometer (400 MHz) at 25 °C. The solvent used was chloroform-d (CDCl3). Gel permeation chromatography (GPC) (Waters GPC 1515) with polystyrene as the calibration standard was used to determine the molecular weight and molecular weight distributions (PDI) of the polymers. The glass transition temperature (Tg) of the polymers was determined using a Waters Q200 differential scanning calorimeter (DSC). Under a nitrogen atmosphere, the temperature range of the Waters Q200 DSC was set to −20–100 °C with a heating rate of 10 °C/min. Thermo gravimetric analysis (TGA) of the polymers was performed using a TGA Q50 analyzer from 20 °C to 600 °C at a heating rate of 10 °C min−1. The Fourier transform infrared spectroscopy (FTIR) of the polymers with potassium bromide tablets was conducted with attenuated total reflection accessories. The number of scans was 32 with scanning resolution of 4 cm−1 and scanning rate of 10,000 Hz. 2.8 Catalyst characterizations Wide-angle X-ray diffraction (XRD) of catalysts were performed using an Ultima IV from Rigaku Corporation. The mean volume diameter, mean area diameter, mean number diameter and external surface area of ZnGA were tested by laser scattering particle size and shape analyzer. Acetone is used to disperse the catalyst particles. The FTIR characterization of the catalysts with potassium bromide tablets was conducted with attenuated total reflection accessories. The number of scans was 32 with scanning resolution of 4 cm−1 and scanning rate of 10,000 Hz. X-ray photoelectron spectroscopy (XPS) manufactured by Thermo Fisher, UK, ESCALAB 250Xi, resolution > 3 μm, was characterized the chemical state of the surface Zn and O species in the prepared catalysts. A monochromatic Al Kα was used as the X-ray source and the vacuum level was kept in the range of 10−9–10−8 torr. The binding energies of the catalyst samples were corrected based on the reference binding energy of C 1s at 284.8 eV. Scanning electron micrographs (SEM) of the catalyst samples were collected on NOVA Nano SEM450 FEI, America microscopy instrument to verify the change in catalyst morphology. Moreover, EDS mapping was also implemented to confirm the location of Zn, C, and O in the ZnGA. 3 Results and discussion 3.1 Effect of H2O in the preparation of ZnGA catalyst The efficiency of ZnGA is mainly dominated by the crystallinity, external surface area, and the number of active sites of the ZnGA surface [7,15,26]. Particle size analysis shows that the incorporation of H2O increases the external surface area to 3.9 m2/cc (Table 1 ). In the preparation of ZnGA in toluene, it was observed that the resulting particles exhibited a larger particle size and lower external surface area, indicative of potential agglomeration within the solvent medium. However, upon re-dispersion of the ZnGA particles in water, a notable reduction in particle size and concurrent increase in external surface area were observed. This phenomenon suggests that water treatment effectively mitigated the agglomeration of particles, leading to enhanced surface characteristics. 3.2 XRD characterization The morphological structure of ZnGA including crystallinity, crystal size, and the surface Zn-OH groups [10,13,15,16,18,27]. The higher the crystallinity and crystalline quality, the narrower and sharper the peaks exhibit in XRD. To investigate the structure of ZnGA, XRD patterns of Cat 1, Cat 2, Cat 3, and Cat 4 are compared (Fig. 1 ). The ZnGA XRD data matches with CCDC card No. 166,386. The results indicate that the obtained ZnGA powder has high crystallinity and excellent crystalline quality, which is in good agreement with the experiments by Ree [10], Kim [13], and Ang [28]. These results suggest that the obtained ZnGA is a crystal composed of a monoclinic lattice unit cell, in which all Zn atomic centers are coordinated with the four carboxyl oxygen atoms through four synergistic anti-bridges to form a distorted tetrahedral geometry, resulting in channels. However, the size of the channels is not favorable for diffusion of CO2 or propylene oxide monomer through the channels [10,14]. The catalyst performance is therefore only reflected on the outer surface of the ZnGA particle [16]. Distinct peaks are observed in the θ=10–12 region of Cat 3 and Cat 4, which are related to the presence of residual traces of ZnAc2 or the formation of new crystal planes. Notably, the characteristic peaks associated with ZnAc2, which are typically found in the 1400–1600 cm−1, 600–700 cm−1, and 900–1000 cm−1 regions of infrared spectra (Fig. S2), were not discernible in the spectra of Cat 3 and Cat 4 (Fig. 3). This absence suggests possible changes or interactions within the molecular structure of Cat 3 and Cat 4 that warrant further investigation of the effect of H2O. The crystallinity and crystalline quality of Cat 3 and Cat 4 are improved after water treatment (Table S1). This improvement can be attributed to the fact that ZnGA crystal nucleus-bound H2O molecules grow with a specific shape in H2O, which improves the crystallinity and crystalline quality of ZnGA. In addition, the XRD spectra of Cat 1 and Cat 2 exhibited dissimilarities in comparison to those of Cat 3 and Cat 4. This observation suggests that the origin of zinc introduces an impact on the structural characteristics of the catalyst crystals. 3.3 SEM and EDS characterization SEM images of ZnGA samples prepared under different conditions are shown in Fig. 2 . Compared to the SEM images of ZnGA and H2O-activated ZnGA, the morphological structure of H2O-activated-ZnGA is altered. The incorporation of H2O leads to a remarkable decrease in the dimensions of Cat 1 particles and the number of flaky particles. Furthermore, the flaky particles break up and transform into rod-shaped particles. Cat 3 is composed of oriented, remarkably flat flake particles. The catalyst particles are broken up and transformed into more irregular, finely fragmented particles, improving the catalytic external surface area (Table 1). In addition, energy-dispersive X-ray spectroscopy (EDS) mapping was utilized to verify the content and distribution of Zn and O in the ZnGA crystals. The EDS mapping results (Fig. S1) show that the O and Zn species are well dispersed in the whole catalyst particle. Compared to Cat 3, Cat 4 with smaller particle size exposed more Zn and O to the surface, which is consistent with the result of the EDS elemental mapping of ZnGA (Table 2 ). The oxygen and zinc ratios of ZnGA after H2O activation increased from 1.4 to 2.7 and from 1.7 to 2.8, respectively, providing reliable evidence for the increase in the number of Zn-OH groups. The original structure of the ZnGA catalyst is not compromised by H2O and shows a more uniform structure. The incorporation of H2O leads to an increased external surface area and the oxygen-to-zinc ratio of the ZnGA catalyst. 3.4 FTIR characterization The characteristic absorption peaks of ZnGA are recognized by using FTIR analysis (Fig. 3 ) [26]. The FTIR spectra of ZnO, ZnAc2, and GA are shown in Fig S2. The COO− antisymmetric stretching at 1405 cm−1 and 1585 cm−1, symmetric stretching at 1537 cm−1 and the absence of peak f at 1699 cm−1 indicate that the carbonyl group (C = O) of GA has been transformed into the zinc carboxylate bond (COO−). In addition, the CH2 scissoring and CH stretching bands are detected at 1447 cm−1 and 2956 cm−1, indicating that GA and ZnO or ZnAc2 are successfully incorporated into ZnGA. The absence of Zn-O stretching vibrations at around 470 cm−1 and the peak of GA at 1699 cm−1 confirms that residual ZnO has been effectively removed after several washes with acetone. This is consistent with the results of Ree [29] and Ang [28]. In contrast to Cat 1 and Cat 3, Cat 2 and Cat 4 exhibited heightened intensity of the peak at 685 cm−1, which suggests a potential increase in the abundance of associated functional groups after water treatment. Such enhancement hints at potential improvements in catalytic performance following the treatment process. The FTIR spectrum shows a broad absorption peak in the range of 3200–3500 cm−1, which serves as evidence for the existence of OH groups at the surface of the catalyst crystals (Fig 3). In addition, no mass loss was found below 390 °C in the TGA analysis of ZnGA, indicating that H2O molecules are present in the catalyst crystals both as bound H2O and as a component of the catalyst crystals (Fig. S3) [30]. 3.5 XPS characterization To further determine the changes of the surface composition of the catalyst, Cat 3 and Cat 4 were investigated by X-ray photoelectron spectroscopy (XPS). As shown in Fig. 4 , after the deconvolution of the XPS spectrum, different types of Zn species were identified on the surface of the ZnGA, as evidenced by showing several characteristic binding energy peaks. The pure ZnX2 (X = F, Cl, Br, and I) shows peaks at 1022.8 eV, 1023.1 eV, 1023.4 eV, and 1023.0 eV and the pure Zn(OH)2 shows peaks at 1022.7 eV, and 531.7 eV, respectively [31]. The peak at ∼1022.1 eV (Fig. 4a) and ∼531.8 eV (Fig. 4b) of the ZnGA catalyst are reasonably attributed to the Zn-OH surface species. This is due to the coordination of the zinc atom of ZnGA with the OH species following the incorporation of H2O into ZnGA. The presence of uncoordinated carboxyl groups on the catalyst surface was detected. Unsaturated zinc metal ions and more hydrocarbon units are present on the outermost surface of the ZnGA catalyst [15]. The Cat 3 and Cat 4 ratios of Zn-OH state species to Zn2+ are 5.3 and 12.6 (Fig. 4a), respectively, indicating that several Zn2+ species have been converted to Zn-OH surface species. The encouraging XPS results indicate that Zn-OH species and the unsaturated zinc metal ions are present on the outermost surface of the ZnGA catalyst [16,17]. The Zn-OH species located at the surface termination of ZnGA catalysts are important in various catalytic systems [32,33]. Xamena et al. [34] had reported that Zn-OH and Zn-O can act as the active species and contribute to the catalytic performance of the reaction. Zn-OH species can activate both CO2 and oxygenated substrates. Two main mechanisms for the formation of the surface active sites have been reported by Low and coworkers [35], including ligand displacement and hydrolysis, as shown in Eqs. (1) and (2): (1) M n + − L n − + H 2 O → M n + − ( O H 2 ) · · · · · · L n − (2) M n + − L n − + H 2 O → M n + − ( OH ) · · · · · · H L n − Under water-saturated conditions, unsaturated Zn2+ acts as a Lewis center coordinating with H2O molecules, leading to the formation of Zn-OH species. The case of CO2 insertion into metal-oxygen bonds [M-OR (R: alkyl or aryl groups)] has been reported elsewhere [16,36,37]. General research and views are that the insertion of CO2 into Zn-OR complexes (R: alkyl or aryl) reacts readily. The active site is the Zn-O moiety, which consists of unsaturated Zn2+ and O resonances of the carboxyl group of GA. The formation of carbonate bonds can be explained in detail as follows: CO2 insertion into the Zn-O bond, and bidentate coordination with Zn2+. It is noteworthy that the mentioned CO2 insertion occurs during the ZnGA-catalyzed CO2/PO copolymerization reaction and not at the initiation stage [16]. Combined with our study, the active species in the starting phase is the Zn-OH group, and this result is confirmed by the experimental data in Table 3 . The OH in the Zn-OH group of the starting species originates from H2O, or other possible polar protonic solvents, such as amines, alcohols, etc. Polar protonic solvents are used to polarize the Zn-O bond, promote the insertion of CO2 and PO, and further improve the efficiency of copolymerization [15]. H2O generated during the preparation of ZnGA from ZnO and GA in toluene promoted the formation of Zn-OH groups. Moreover, the type and amount of polar protonic solvents employed affect the catalytic performance for the preparation of ZnGA. Consequently, the presence of H2O alters the catalyst surface and crystallinity and increases the content of Zn-OH. The difference in performance between Cat 3 and Cat 4 can be attributed to the increase in crystallinity, external surface area, and the increased content of Zn-OH resulting from the incorporation of H2O. In other words, the synergistic effect of the improved catalyst surface, crystallinity, and Zn-OH content played an important role in improving the performance of the ZnGA catalyst by the treatment with H2O. 3.6 The effect of H2O in ZnGA catalyzed CO2/PO copolymerization As shown in Table 3, the increased external surface area of the catalyst results in an increased number of active centers exposed on the outer surface of the ZnGA, thereby further increasing the catalytic yield. Following an experimental condition, the resulting product PPC has a high carbonate unit content (> 92 %), molecular weight (> 1.4 × 105 g/mol), and Tg (> 37 °C). In contrast, there is almost no yield with Cat 3 (Table 3, entry 3), which is prepared under anhydrous and oxygen-free conditions. The ZnGA treated with mili-Q water shows good catalytic yield and product properties, and its catalytic yield is increased to 31 g poly/g cat over a reaction time of 40 h (Table 3, entry 4). These results indicated that the performance of the ZnGA catalyst is closely related to water treatment [15]. Compared to Cat 3, Cat 4 showed increased catalyst performance (trace vs. 31 g poly/g cat), and the molecular weight of PPC increased to 1.4 × 105 g/mol with 92.5 % of the carbonate linkages in the polymer chain. The 1H NMR spectrum of the PPC shows characteristic peaks at 5.0, 4.2, and 1.3 ppm, attributed to the carbonate units, and peaks at 3.2 – 3.8 and 1.2 ppm, attributed to the ether units in the polymer chain (Fig. 5 ). The detailed peak positions are listed in Table S2. These studies will benefit the development of highly reactive catalysts for the production of high molecular weight PPCs with high carbonate linkage content. 3.7 Copolymerization of CO2/PO catalyzed by modified ZnGA catalysts The m-Cat 4b was successfully prepared by adding a portion of Zn-Co DMC into Cat 4, which showed a remarkable performance in producing PPC with a high molecular weight and a high carbonate linkage content. The XRD patterns of Cat 4, DMC, and m-Cat 4b are shown in Fig. 6 . The m-Cat 4b exhibits separate crystalline structure and remarkable characteristic peaks (at 2θ= 12.7, 22.5, 23.0, 13.3, 18.1, etc.), and no effect of the crystallinity and integrality of the composite catalyst is expected, indicating that DMC is well mixed with ZnGA and the crystallographic information of ZnGA is largely inherited by m-Cat 4b. Furthermore, m-Cat 4b exhibited distinctive characteristic peaks at specific positions, notably 466 cm−1, 638 cm−1, 704 cm−1, 835 cm−1, 1405 cm−1, 1447 cm−1, 1537 cm−1, 1585 cm−1, 2193 cm−1, among others. (Fig. 7 ) This observation suggests that m-Cat 4b inherits functional groups from both Cat 4 and DMC, thereby manifesting an independent structural composition. The copolymerization of CO2 and PO over DMC, ZnGA-H2O, and m-ZnGA catalysts is summarized in Table 4 . The use of a Zn-Co DMC catalyst at 70 °C for 8 h showed a catalytic yield up to 4667 g poly/g cat with 21.5 % of carbonate linkages content, 0.7 × 105 g/mol of molecular weight, and a product with a Tg of 4 °C (Table 4, entry 1). In contrast, Cat 4 shows relatively low yield towards PPC with 92.5 % of carbonate linkages content after a reaction time of 40 h (Table 4, entry 2). Interestingly, m-Cat 4b produced PPC with a yield of 1729 g poly/g cat within 24 h at 70 °C and 4 MPa of CO2 (Mn = 2.3 × 105 g /mol, Table 4, entry 8), which is higher than that of the level reported in the literature [7,23,38]. The addition of DMC, which is known for its superior catalytic performance in PO homopolymerization [24,39], was found to significantly enhance the rate of PO activation. Consequently, the higher reactivity of PO facilitated its insertion ahead of CO2 during the copolymerization process, leading to the production of higher molecular weight products. The ether linkages in the PPC copolymers were inevitable when the copolymerization was mediated by m-ZnGA catalysts [23]. Optimizing the ratio of DMC to ZnGA can lead to the formation of highly active catalysts that is suitable for making high molecular weight PPC, while concurrently reducing the content of polyether. As the temperature increased from 70 °C to 80 °C, the yield, carbonate unit, and Mn each decreased, respectively (Table 4, entry 13), indicating that high temperature is unfavorable for CO2 insertion. Excessive or insufficient amount of catalysts can negatively impact the polymerization process and the resulting product (Table 4, entries 8, 11, and 12). The variation of CO2 pressure from 3 to 5 MPa has little effect on yield (Table 4, entries 12, 14, and 15) [40]. The observed decrease in Mn over time accompanied by an increase in PDI suggests the occurrence of a backbiting reaction to yield more cyclic byproduct (Table 4, entries 12, 16, and 17). The m-ZnGA catalysts are obtained by adding a portion of DMC into ZnGA, which showed higher reaction efficiency and good selectivity to carbonate linkages in CO2/PO copolymerization, combining the merits of both ZnGA and DMC catalysts. The reaction time was significantly reduced after the addition of DMC to ZnGA, from 40 h to 24 h. The thermal stability of the polymer was estimated by thermogravimetric analysis (TGA) (Fig. S4-S15) and differential scanning calorimeter (DSC) (Fig. S16). These results of copolymerization revealed consistent catalyst performance and product properties in agreement with previous studies [40]. In general, the incorporation of DMC increased the catalytic performance, carbonate linkages content, and PPC molecular weight while showing a slight decrease in conversion. Appropriate incorporation of DMC is beneficial for the production of high molecular weight polymers [41]. Specifically, at a molar ratio of DMC:Cat 4 = 1:20, the catalyst yield was comparatively lower than at other ratios (Table 4, entries 7, 8, 9, and 10). This disparity can be attributed to either the limited amount of DMC or the uneven dispersion of the catalyst within the reaction system as the reaction progressed. The catalyst m-Cat 4b produced PPC with a high carbonate content of 61.2 % (entry 8, Table 4). This catalyst system stands out with respect to the CO2/PO copolymerization systems studied, with respectable Mn values and yield values. 3.8 Characteristics and properties of PPC Fig. 8 shows typical FTIR spectrum of the PPC copolymer, where the characteristic peaks at 1750 cm−1 (C = O), 1250 cm−1 (CO), 1074 cm−1, and 790 cm−1 (the stretching peaks of C-O-C) confirm the alternating copolymerization structure of PPC. The 1H NMR spectra of the PPC produced by the m-ZnGA catalysts are shown in Fig. S17-S35. The distribution of the characteristic peaks in the spectrum is as follows: 1H NMR (CDCl3), δ (ppm) 1.31 (d, 3H; -CH3), 4.17 (m, 2H; -CH2-), 4.97 (m, 1H; -CH-). The ZnGA catalyst has a lower yield in comparison to that of the DMC catalyst. However, it produces PPC with a molecular weight of 1.4 × 105 g/mol PPC, and a carbonate linkage content of 92.5 %. The DMC catalyst is able to produce PPC with a remarkable yield of 4667 g poly/g cat, but the PPC product has a very low Tg due to the increase of polyether unit in the polymer chain. The m-ZnGA catalyst, prepared by adding a portion of DMC catalyst into ZnGA, produced PPC with a high molecular weight of 2.3 × 105 g/mol and a relatively high carbonate linkages of 61.2 %, which retained the characteristics of the PPC products by the ZnGA catalyst and the high yield of the DMC catalyst. In Fig. 9 , the GPC curves show monomodal distributions. The polydispersity indexes (PDI) of the PPC produced by m-Cat 4b are slightly higher than that produced by the DMC catalyst, which is attributed to the characteristic of multicentric copolymerization. The GPC curves of the other samples are shown in Fig. S36-S47. These results show that a portion of DMC (molar ratio= 1: 10) improves the performance of ZnGA and increases the molecular weight of PPC. The PPC product has excellent properties with a high molecular weight (Mn = 2.3 × 105 g/mol) and a reasonably high Tg = 31 °C. The thermal properties of PPC are strongly dependent on the molecular structure and molecular weight of the alternating copolymers. As a result, the m-ZnGA catalyst showed a remarkable performance for the copolymerization of CO2 and PO, which can be attributed to the synergistic effects of the ZnGA catalyst and the DMC catalyst. 4 Conclusions The introduction of H2O improved the external surface area, crystallinity, and the number of active centers of the ZnGA catalyst. XRD, FTIR, SEM, and XPS characterizations confirmed the necessity of H2O in preparation of ZnGA and revealed an increased content of surface Zn-OH species of ZnGA after water treatment. By adding a portion of cyanide into Cat 4, the modified ZnGA (m-Cat 4b) showed an enhanced performance for CO2/PO copolymerization in producing PPC with high yield, high selectivity, and shorter reaction time. Under the specified reaction conditions, the PPC product with a molecular weight of 2.3 × 105 g/mol and a carbonate unit of 61.2 % was obtained with a high yield of 1729 g poly/g cat. The thermal properties of PPC measured by DSC and TGA showed that the alternating copolymer PPC exhibited good thermal stability. CRediT authorship contribution statement Yulong Wu: Writing – original draft, Investigation, Formal analysis, Conceptualization. Yingfang Nie: Methodology. Li Sun: Validation. ZhenHao Xi: Writing – review & editing, Resources. Zhen Liu: Writing – review & editing, Supervision, Project administration. Declaration of competing interest The authors declare that they have no known competing financial interests or personal relationships that could have appeared to influence the work reported in this paper. Acknowledgements We thank the financial support by Shanghai Pujiang Program (18PJ1402500), and the Open Project of State Key Laboratory of Chemical Engineering (SKL-ChE-18C01) at the East China University of Science and Technology. Supplementary materials Supplementary material associated with this article can be found, in the online version, at doi:10.1016/j.mcat.2024.114267. Appendix Supplementary materials Image, application 1 References [1] S.M. Slater P. Bown R.J. Twitchett S. Danise V. Vajda Global record of “ghost” nannofossils reveals plankton resilience to high CO2 and warming Science 376 2022 853 856 S.M. Slater, P. Bown, R.J. Twitchett, S. Danise, V. Vajda, Global record of “ghost” nannofossils reveals plankton resilience to high CO2 and warming, Science 376 (2022) 853–856. [2] Y. Liu L. Dong Y. Wang Q. Su X. Meng W. Cheng Polymeric ionic liquid membranes for the absorption-conversion of CO2 and epoxides into cyclic carbonates Mol. Catal. 530 2022 112597 112619 Y. Liu, L. Dong, Y. Wang, Q. Su, X. Meng, W. Cheng, Polymeric ionic liquid membranes for the absorption-conversion of CO2 and epoxides into cyclic carbonates, Mol. Catal. 530 (2022) 112597–112619. [3] S.S. Roy S. Sarkar P.K.S. Antharjanam D. Chakraborty Ring-opening copolymerization of CO2 with epoxides catalyzed by binary catalysts containing half salen aluminum compounds and quaternary phosphonium salt Mol. Catal 540 2023 113053 113066 S.S. Roy, S. Sarkar, P.K.S. Antharjanam, D. Chakraborty, Ring-opening copolymerization of CO2 with epoxides catalyzed by binary catalysts containing half salen aluminum compounds and quaternary phosphonium salt, Mol. Catal 540 (2023) 113053–113066. [4] J. Liang S. Ye S. Wang M. Xiao Y. Meng Design and structure of catalysts: syntheses of carbon dioxide-based copolymers with cyclic anhydrides and/or cyclic esters Polym. J. 53 2021 3 27 J. Liang, S. Ye, S. Wang, M. Xiao, Y. Meng, Design and structure of catalysts: syntheses of carbon dioxide-based copolymers with cyclic anhydrides and/or cyclic esters, Polym. J. 53 (2021) 3–27. [5] S.K. Inoue H T. Tsuruta Copolymerization of carbon dioxide and epoxide J. Polym. Sci. B 7 1969 287 292 S.K. Inoue, H.; Tsuruta, T., Copolymerization of carbon dioxide and epoxide, J. Polym. Sci. B 7 (1969) 287–292. [6] Y. Zhang H. Liang X. Li Q. Li J. Wang Melem based mesoporous metal-free catalyst for cycloaddition of CO2 to cyclic carbonate J. CO2 Util. 64 2022 102173 102184 Y. Zhang, H. Liang, X. Li, Q. Li, J. Wang, Melem based mesoporous metal-free catalyst for cycloaddition of CO2 to cyclic carbonate, J. CO2 Util. 64 (2022) 102173–102184. [7] M. Ree J.Y. Bae J.H. Jung T.J. Shin A new copolymerization process leading to poly(propylene carbonate) with a highly enhanced yield from carbon dioxide and propylene oxide J. Polym. Sci., Part A: Polym. Chem. 1999 1863 1876 M. Ree, J.Y. Bae, J.H. Jung, T.J. Shin, A new copolymerization process leading to poly(propylene carbonate) with a highly enhanced yield from carbon dioxide and propylene oxide, J. Polym. Sci., Part A: Polym. Chem. (1999) 1863–1876. [8] S. K I. E H. I Alternating copolymerization of CO2 and propylene oxide with the catalysts prepared from Zn(OH)2 and various dicarboxylic acids Polym. J. 13 1981 407 410 S. K, I. E, H. I, Alternating copolymerization of CO2 and propylene oxide with the catalysts prepared from Zn(OH)2 and various dicarboxylic acids, Polym. J. 13 (1981) 407–410. [9] D.J. Darensbourg N.W. Stafford T. Katsurao Supercritical carbon dioxide as solvent for the copolymerization of carbon dioxide and propylene oxide using a heterogeneous zinc carboxylate catalyst J. Mol. Catal. A: Chem. 104 1995 L1 L4 D.J. Darensbourg, N.W. Stafford, T. Katsurao, Supercritical carbon dioxide as solvent for the copolymerization of carbon dioxide and propylene oxide using a heterogeneous zinc carboxylate catalyst, J. Mol. Catal. A: Chem. 104 (1995) L1–L4. [10] M. Ree Y. Hwang J.-S. Kim H. Kim G. Kim H. Kim New findings in the catalytic activity of zinc glutarate and its application in the chemical fixation of CO2 into polycarbonates and their derivatives Catal. Today 115 2006 134 145 M. Ree, Y. Hwang, J.-S. Kim, H. Kim, G. Kim, H. Kim, New findings in the catalytic activity of zinc glutarate and its application in the chemical fixation of CO2 into polycarbonates and their derivatives, Catal. Today 115 (2006) 134–145. [11] S. Chen G.-R. Qi Z.-J. Hua H.-Q. Yan Double metal cyanide complex based on Zn3[Co(CN)6]2 as highly active catalyst for copolymerization of carbon dioxide and cyclohexene oxide J. Polym. Sci., Part A: Polym. Chem. 42 2004 5284 5291 S. Chen, G.-R. Qi, Z.-J. Hua, H.-Q. Yan, Double metal cyanide complex based on Zn3[Co(CN)6]2 as highly active catalyst for copolymerization of carbon dioxide and cyclohexene oxide, J. Polym. Sci., Part A: Polym. Chem. 42 (2004) 5284–5291. [12] Z. Li Y. Qin X. Zhao F. Wang S. Zhang X. Wang Synthesis and stabilization of high-molecular-weight poly(propylene carbonate) from Zn-Co-based double metal cyanide catalyst Eur. Polym. J. 47 2011 2152 2157 Z. Li, Y. Qin, X. Zhao, F. Wang, S. Zhang, X. Wang, Synthesis and stabilization of high-molecular-weight poly(propylene carbonate) from Zn-Co-based double metal cyanide catalyst, Eur. Polym. J. 47 (2011) 2152–2157. [13] J.-S. Kim H. Kim J. Yoon K. Heo M. Ree Synthesis of zinc glutarates with various morphologies using an amphiphilic template and their catalytic activities in the copolymerization of carbon dioxide and propylene oxide J. Polym. Sci., Part A: Polym. Chem. 43 2005 4079 4088 J.-S. Kim, H. Kim, J. Yoon, K. Heo, M. Ree, Synthesis of zinc glutarates with various morphologies using an amphiphilic template and their catalytic activities in the copolymerization of carbon dioxide and propylene oxide, J. Polym. Sci., Part A: Polym. Chem. 43 (2005) 4079–4088. [14] J.-S. Kim H. Kim M. Ree Hydrothermal synthesis of single-crystalline zinc glutarate and its structural determination Chem. Mater. 16 2004 2981 2983 J.-S. Kim, H. Kim, M. Ree, Hydrothermal synthesis of single-crystalline zinc glutarate and its structural determination, Chem. Mater. 16 (2004) 2981–2983. [15] S. Klaus M.W. Lehenmeier E. Herdtweck P. Deglmann A.K. Ott B. Rieger Mechanistic insights into heterogeneous zinc dicarboxylates and theoretical considerations for CO2-epoxide copolymerization J. Am. Chem. Soc. 133 2011 13151 13161 S. Klaus, M.W. Lehenmeier, E. Herdtweck, P. Deglmann, A.K. Ott, B. Rieger, Mechanistic insights into heterogeneous zinc dicarboxylates and theoretical considerations for CO2-epoxide copolymerization, J. Am. Chem. Soc. 133 (2011) 13151–13161. [16] J.S. Kim M. Ree S.W. Lee W. Oh S. Baek B. Lee T.J. Shin K.J. Kim B. Kim J. Luning NEXAFS spectroscopy study of the surface properties of zinc glutarate and its reactivity with carbon dioxide and propylene oxide J. Catal. 218 2003 386 395 J.S. Kim, M. Ree, S.W. Lee, W. Oh, S. Baek, B. Lee, T.J. Shin, K.J. Kim, B. Kim, J. Luning, NEXAFS spectroscopy study of the surface properties of zinc glutarate and its reactivity with carbon dioxide and propylene oxide, J. Catal. 218 (2003) 386–395. [17] M.H. Chisholm D. Navarro-Llobet Z. Zhou Poly(propylene carbonate). 1. More about poly(propylene carbonate) formed from the copolymerization of propylene oxide and carbon dioxide employing a zinc glutarate catalyst Macromolecules 35 2002 6494 6504 M.H. Chisholm, D. Navarro-Llobet, Z. Zhou, Poly(propylene carbonate). 1. More about poly(propylene carbonate) formed from the copolymerization of propylene oxide and carbon dioxide employing a zinc glutarate catalyst, Macromolecules 35 (2002) 6494–6504. [18] S.J. Wang L.C. Du X.S. Zhao Y.Z. Meng S.C. Tjong Synthesis and characterization of alternating copolymer from carbon dioxide and propylene oxide J. Appl. Polym. Sci. 85 2002 2327 2334 S.J. Wang, L.C. Du, X.S. Zhao, Y.Z. Meng, S.C. Tjong, Synthesis and characterization of alternating copolymer from carbon dioxide and propylene oxide, J. Appl. Polym. Sci. 85 (2002) 2327–2334. [19] J.T. Wang Q. Zhu X.L. Lu Y.Z. Meng ZnGA-MMT catalyzed the copolymerization of carbon dioxide with propylene oxide Eur. Polym. J. 41 5 2005 1108 1114 J.T. Wang, Q. Zhu, X.L. Lu, Y.Z. Meng, ZnGA-MMT catalyzed the copolymerization of carbon dioxide with propylene oxide, Eur. Polym. J. 41(5) (2005) 1108–1114. [20] R. Eberhardt M. Allmendinger M. Zintl C. Troll G.A. Luinstra B. Rieger New zinc dicarboxylate catalysts for the CO2/propylene oxide copolymerization reaction: activity enhancement through Zn(II)-ethylsulfinate initiating groups Macromol. Chem. Phys. 205 2004 42 47 R. Eberhardt, M. Allmendinger, M. Zintl, C. Troll, G.A. Luinstra, B. Rieger, New zinc dicarboxylate catalysts for the CO2/propylene oxide copolymerization reaction: activity enhancement through Zn(II)-ethylsulfinate initiating groups, Macromol. Chem. Phys. 205 (2004) 42–47. [21] S. Padmanaban M. Kim S. Yoon Acid-mediated surface etching of a nano-sized metal-organic framework for improved reactivity in the fixation of CO2 into polymers J. Ind. Eng. Chem. 71 2019 336 344 S. Padmanaban, M. Kim, S. Yoon, Acid-mediated surface etching of a nano-sized metal-organic framework for improved reactivity in the fixation of CO2 into polymers, J. Ind. Eng. Chem. 71 (2019) 336–344. [22] S. Padmanaban S. Yoon Surface modification of a MOF-based catalyst with Lewis metal salts for improved catalytic activity in the fixation of CO2 into polymers Catalysts 9 2019 892 S. Padmanaban, S. Yoon, Surface modification of a MOF-based catalyst with Lewis metal salts for improved catalytic activity in the fixation of CO2 into polymers, Catalysts 9 (2019) 892. [23] Y. Yang J.D. Lee Y.H. Seo J.H. Chae S. Bang Y.J. Cheong B.Y. Lee I.H. Lee S.U. Son H.Y. Jang Surface activated zinc-glutarate for the copolymerization of CO2 and epoxides Dalton. Trans. 51 2022 16620 16627 Y. Yang, J.D. Lee, Y.H. Seo, J.H. Chae, S. Bang, Y.J. Cheong, B.Y. Lee, I.H. Lee, S.U. Son, H.Y. Jang, Surface activated zinc-glutarate for the copolymerization of CO2 and epoxides, Dalton. Trans. 51 (2022) 16620–16627. [24] C.H. Tran L.T.T. Pham Y. Lee H.B. Jang S. Kim I. Kim Mechanistic insights on Zn(II)-Co(III) double metal cyanide-catalyzed ring-opening polymerization of epoxides J. Catal. 372 2019 86 102 C.H. Tran, L.T.T. Pham, Y. Lee, H.B. Jang, S. Kim, I. Kim, Mechanistic insights on Zn(II)-Co(III) double metal cyanide-catalyzed ring-opening polymerization of epoxides, J. Catal. 372 (2019) 86–102. [25] Y. Dong X. Wang X. Zhao F. Wang Facile synthesis of poly(ether carbonate)s via copolymerization of CO2 and propylene oxide under combinatorial catalyst of rare earth ternary complex and double metal cyanide complex J. Polym. Sci., Part A: Polym. Chem. 50 2012 362 370 Y. Dong, X. Wang, X. Zhao, F. Wang, Facile synthesis of poly(ether carbonate)s via copolymerization of CO2 and propylene oxide under combinatorial catalyst of rare earth ternary complex and double metal cyanide complex, J. Polym. Sci., Part A: Polym. Chem. 50 (2012) 362–370. [26] Y. Xu L. Lin M. Xiao S. Wang A.T. Smith L. Sun Y. Meng Synthesis and properties of CO2-based plastics: environmentally-friendly, energy-saving and biomedical polymeric materials Prog. Poly. Sci. 80 2018 163 182 Y. Xu, L. Lin, M. Xiao, S. Wang, A.T. Smith, L. Sun, Y. Meng, Synthesis and properties of CO2-based plastics: environmentally-friendly, energy-saving and biomedical polymeric materials, Prog. Poly. Sci. 80 (2018) 163–182. [27] Y.Z. Meng L.C. Du S.C. Tjong Q. Zhu A.S. Hay Effects of the structure and morphology of zinc glutarate on the fixation of carbon dioxide into polymer J. Polym. Sci., Part A: Polym. Chem. 40 21 2002 3579 3591 Y.Z. Meng, L.C. Du, S.C. Tjong, Q. Zhu, A.S. Hay, Effects of the structure and morphology of zinc glutarate on the fixation of carbon dioxide into polymer, J. Polym. Sci., Part A: Polym. Chem. 40(21) (2002) 3579–3591. [28] R.-R. Ang L.T. Sin S.-T. Bee T.-T. Tee A.A.H. Kadhum A.R. Rahmat B.A. Wasmi Determination of zinc glutarate complexes synthesis factors affecting production of propylene carbonate from carbon dioxide and propylene oxide Chem. Eng. J. 327 2017 120 127 R.-R. Ang, L.T. Sin, S.-T. Bee, T.-T. Tee, A.A.H. Kadhum, A.R. Rahmat, B.A. Wasmi, Determination of zinc glutarate complexes synthesis factors affecting production of propylene carbonate from carbon dioxide and propylene oxide, Chem. Eng. J. 327 (2017) 120–127. [29] M. Ree J.Y. Bae J.H. Jung T.J. Shin Y.T. Hwang T. Chang Copolymerization of carbon dioxide and propylene oxide using various zinc glutarate derivatives as catalysts Polym. Eng. Sci. 40 7 2000 1542 1552 M. Ree, J.Y. Bae, J.H. Jung, T.J. Shin, Y.T. Hwang, T. Chang, Copolymerization of carbon dioxide and propylene oxide using various zinc glutarate derivatives as catalysts, Polym. Eng. Sci. 40(7) (2000) 1542–1552. [30] V.S. Vineetha P.P. Pradyumnan Growth and characterization of zinc glutarate crystals AIP Conf. Proc. 2244 1 2020 030004 V.S. Vineetha, P.P. Pradyumnan, Growth and characterization of zinc glutarate crystals, AIP Conf. Proc. 2020; 2244 (1): 030004. [31] L.S. Dake D.R. Baer J.M. Zachara Auger parameter measurements of zinc compounds relevant to zinc transport in the environment Surf. Interface Anal. 14 1989 71 75 L.S. Dake, D.R. Baer, J.M. Zachara, Auger parameter measurements of zinc compounds relevant to zinc transport in the environment, Surf. Interface Anal. 14 (1989) 71–75. [32] J. Hafizovic M. Bjørgen U. Olsbye P.D.C. Dietzel S. Bordiga C. Prestipino C. Lamberti K.P. Lillerud The inconsistency in adsorption properties and powder XRD data of MOF-5 is rationalized by framework interpenetration and the presence of organic and inorganic species in the nanocavities J. Am. Chem. Soc. 129 2007 3612 3620 J. Hafizovic, M. Bjørgen, U. Olsbye, P.D.C. Dietzel, S. Bordiga, C. Prestipino, C. Lamberti, K.P. Lillerud, The inconsistency in adsorption properties and powder XRD data of MOF-5 is rationalized by framework interpenetration and the presence of organic and inorganic species in the nanocavities, J. Am. Chem. Soc. 129 (2007) 3612–3620. [33] J. Canivet M. Vandichel D. Farrusseng Origin of highly active metal-organic framework catalysts: defects? Defects! Dalton. Trans. 45 2016 4090 4099 J. Canivet, M. Vandichel, D. Farrusseng, Origin of highly active metal-organic framework catalysts: defects? Defects!, Dalton. Trans. 45 (2016) 4090–9. [34] F.X. Llabrés i Xamena F.G. Cirujano A. Corma An unexpected bifunctional acid base catalysis in IRMOF-3 for Knoevenagel condensation reactions Microporous Mesoporous Mater. 157 2012 112 117 F.X. Llabrés i Xamena, F.G. Cirujano, A. Corma, An unexpected bifunctional acid base catalysis in IRMOF-3 for Knoevenagel condensation reactions, Microporous Mesoporous Mater.. 157 (2012) 112–117. [35] John J. Low Annabelle I. Benin Paulina Jakubczak Jennifer F. Abrahamian Syed A. Faheem R.R. Willis Virtual high throughput screening confirmed experimentally: porous coordination polymer hydration J. Am. Chem. Soc. 131 2009 15834 15842 John J. Low, Annabelle I. Benin, Paulina Jakubczak, Jennifer F. Abrahamian, Syed A. Faheem, R.R. Willis, Virtual high throughput screening confirmed experimentally: porous coordination polymer hydration, J. Am. Chem. Soc. 131 (2009) 15834–15842. [36] J. Liang S. Ye W. Wang C. Fan S. Wang D. Han W. Liu Y. Cui L. Hao M. Xiao Y. Meng Performance tailorable terpolymers synthesized from carbon dioxide, phthalic anhydride and propylene oxide using Lewis acid-base dual catalysts J. CO2 Util. 49 2021 101558 J. Liang, S. Ye, W. Wang, C. Fan, S. Wang, D. Han, W. Liu, Y. Cui, L. Hao, M. Xiao, Y. Meng, Performance tailorable terpolymers synthesized from carbon dioxide, phthalic anhydride and propylene oxide using Lewis acid-base dual catalysts, J. CO2 Util. 49 (2021) 101558. [37] S. Ye W. Wang J. Liang S. Wang M. Xiao Y. Meng Metal-Free Approach for a One-Pot Construction of Biodegradable Block Copolymers from Epoxides, Phthalic Anhydride, and CO2 ACS Sustainable Chem. Eng. 8 48 2020 17860 17867 S. Ye, W. Wang, J. Liang, S. Wang, M. Xiao, Y. Meng, Metal-Free Approach for a One-Pot Construction of Biodegradable Block Copolymers from Epoxides, Phthalic Anhydride, and CO2, ACS Sustainable Chem. Eng. 8(48) (2020) 17860–17867. [38] S. Ye W. Wang J. Liang S. Wang M. Xiao Y. Meng Metal-free approach for a one-pot construction of biodegradable block copolymers from epoxides, phthalic anhydride, and CO2 ACS Sustainable Chem. Eng. 8 2020 17860 17867 S. Ye, W. Wang, J. Liang, S. Wang, M. Xiao, Y. Meng, Metal-free approach for a one-pot construction of biodegradable block copolymers from epoxides, phthalic anhydride, and CO2, ACS Sustainable Chem. Eng. 8 (2020) 17860–17867. [39] C.H. Tran L.T.T. Pham H.B. Jang S.A. Kim I. Kim Effect of α-, β-, γ-, and δ-dicarbonyl complexing agents on the double metal cyanide-catalyzed ring-opening polymerization of propylene oxide Catal. Today 375 2021 429 440 C.H. Tran, L.T.T. Pham, H.B. Jang, S.A. Kim, I. Kim, Effect of α-, β-, γ-, and δ-dicarbonyl complexing agents on the double metal cyanide-catalyzed ring-opening polymerization of propylene oxide, Catal. Today 375 (2021) 429–440. [40] J. Duan J. Wang L. Feng L. Wang X. Gu Pressure dependence of the CO2/propylene oxide copolymerization catalyzed by zinc glutarate J. Appl. Polym. Sci. 118 2010 366 371 J. Duan, J. Wang, L. Feng, L. Wang, X. Gu, Pressure dependence of the CO2/propylene oxide copolymerization catalyzed by zinc glutarate, J. Appl. Polym. Sci. 118 (2010) 366–371. [41] N. An Q. Li N. Yin M. Kang J. Wang Facile preparation and synergy study of DMC/ZnGA composite catalyst for the synthesis of oligo (propylene-carbonate) diols Appl. Organomet. Chem. 33 2019 e4999 N. An, Q. Li, N. Yin, M. Kang, J. Wang, Facile preparation and synergy study of DMC/ZnGA composite catalyst for the synthesis of oligo (propylene-carbonate) diols, Appl. Organomet. Chem. 33 (2019) e4999.",
      "scopus-id": "85195293819",
      "coredata": {
        "eid": "1-s2.0-S2468823124004504",
        "dc:description": "Zinc glutarate (ZnGA) is a prominent catalyst for the production of CO2-based poly(propylene carbonate). The original catalysts, ZnO-GA (Cat 1) and ZnAc2-GA (Cat 3), were prepared using ZnO and ZnAc2 as Zn sources, respectively. ZnO-GA-H2O (Cat 2) and ZnAc2-GA-H2O (Cat 4) were prepared by water treatment of Cat 1 and Cat 3, respectively. After water treatment, both Cat 2 and Cat 4 showed enhanced performance for copolymerization of CO2 and propylene oxide. The characterizations demonstrated that H2O is a critical component that not only improves the crystallinity and external surface area of ZnGA, but also increases the number of surface Zn-OH groups. By adding a portion of cyanide, further modification on Cat 4 resulted in a group of ZnAc2-GA-H2O/DMC catalysts (m-Cat 4). The polymerization reached a high yield of 1729 g poly/g Cat and a selectivity of 98.7 % at molar ratio of DMC/ZnGA = 1: 10 (t = 24 h; T = 70 °C; P = 4 MPa). The modified ZnGA/DMC catalyst exhibited remarkable yield and selectivity for the copolymerization of CO2 and propylene oxide to produce high molecular weight alternating copolymers (2.3 × 105 g/mol).",
        "openArchiveArticle": "false",
        "prism:coverDate": "2024-07-15",
        "openaccessUserLicense": null,
        "prism:aggregationType": "Journal",
        "prism:url": "https://api.elsevier.com/content/article/pii/S2468823124004504",
        "dc:creator": [
          {
            "@_fa": "true",
            "$": "Wu, Yulong"
          },
          {
            "@_fa": "true",
            "$": "Nie, Yingfang"
          },
          {
            "@_fa": "true",
            "$": "Sun, Li"
          },
          {
            "@_fa": "true",
            "$": "Xi, ZhenHao"
          },
          {
            "@_fa": "true",
            "$": "Liu, Zhen"
          }
        ],
        "link": [
          {
            "@_fa": "true",
            "@rel": "self",
            "@href": "https://api.elsevier.com/content/article/pii/S2468823124004504"
          },
          {
            "@_fa": "true",
            "@rel": "scidir",
            "@href": "https://www.sciencedirect.com/science/article/pii/S2468823124004504"
          }
        ],
        "dc:format": "application/json",
        "openaccessType": null,
        "pii": "S2468-8231(24)00450-4",
        "prism:volume": "564",
        "articleNumber": "114267",
        "prism:publisher": "Elsevier B.V. All rights are reserved, including those for text and data mining, AI training, and similar technologies.",
        "dc:title": "ZnGA/DMC catalysts for the synthesis of high molecular weight poly(propylene carbonate): The crucial role of water treatment",
        "prism:copyright": "© 2024 Elsevier B.V. All rights are reserved, including those for text and data mining, AI training, and similar technologies.",
        "openaccess": "0",
        "prism:issn": "24688231",
        "dcterms:subject": [
          {
            "@_fa": "true",
            "$": "CO2"
          },
          {
            "@_fa": "true",
            "$": "Zinc glutarate"
          },
          {
            "@_fa": "true",
            "$": "Copolymerization"
          },
          {
            "@_fa": "true",
            "$": "Poly(propylene carbonate)"
          },
          {
            "@_fa": "true",
            "$": "Propylene oxide"
          }
        ],
        "openaccessArticle": "false",
        "prism:publicationName": "Molecular Catalysis",
        "openaccessSponsorType": null,
        "prism:pageRange": "114267",
        "pubType": "fla",
        "prism:coverDisplayDate": "15 July 2024",
        "prism:doi": "10.1016/j.mcat.2024.114267",
        "prism:startingPage": "114267",
        "dc:identifier": "doi:10.1016/j.mcat.2024.114267",
        "openaccessSponsorName": null
      },
      "objects": {
        "object": [
          {
            "@category": "standard",
            "@height": "234",
            "@width": "338",
            "@_fa": "true",
            "$": "https://api.elsevier.com/content/object/eid/1-s2.0-S2468823124004504-gr6.jpg?httpAccept=%2A%2F%2A",
            "@multimediatype": "JPEG image file",
            "@type": "IMAGE-DOWNSAMPLED",
            "@size": "27255",
            "@ref": "gr6",
            "@mimetype": "image/jpeg"
          },
          {
            "@category": "standard",
            "@height": "280",
            "@width": "335",
            "@_fa": "true",
            "$": "https://api.elsevier.com/content/object/eid/1-s2.0-S2468823124004504-gr5.jpg?httpAccept=%2A%2F%2A",
            "@multimediatype": "JPEG image file",
            "@type": "IMAGE-DOWNSAMPLED",
            "@size": "18004",
            "@ref": "gr5",
            "@mimetype": "image/jpeg"
          },
          {
            "@category": "standard",
            "@height": "614",
            "@width": "345",
            "@_fa": "true",
            "$": "https://api.elsevier.com/content/object/eid/1-s2.0-S2468823124004504-gr4.jpg?httpAccept=%2A%2F%2A",
            "@multimediatype": "JPEG image file",
            "@type": "IMAGE-DOWNSAMPLED",
            "@size": "80429",
            "@ref": "gr4",
            "@mimetype": "image/jpeg"
          },
          {
            "@category": "standard",
            "@height": "301",
            "@width": "346",
            "@_fa": "true",
            "$": "https://api.elsevier.com/content/object/eid/1-s2.0-S2468823124004504-gr3.jpg?httpAccept=%2A%2F%2A",
            "@multimediatype": "JPEG image file",
            "@type": "IMAGE-DOWNSAMPLED",
            "@size": "49961",
            "@ref": "gr3",
            "@mimetype": "image/jpeg"
          },
          {
            "@category": "standard",
            "@height": "313",
            "@width": "377",
            "@_fa": "true",
            "$": "https://api.elsevier.com/content/object/eid/1-s2.0-S2468823124004504-gr2.jpg?httpAccept=%2A%2F%2A",
            "@multimediatype": "JPEG image file",
            "@type": "IMAGE-DOWNSAMPLED",
            "@size": "49341",
            "@ref": "gr2",
            "@mimetype": "image/jpeg"
          },
          {
            "@category": "standard",
            "@height": "200",
            "@width": "383",
            "@_fa": "true",
            "$": "https://api.elsevier.com/content/object/eid/1-s2.0-S2468823124004504-ga1.jpg?httpAccept=%2A%2F%2A",
            "@multimediatype": "JPEG image file",
            "@type": "IMAGE-DOWNSAMPLED",
            "@size": "33457",
            "@ref": "ga1",
            "@mimetype": "image/jpeg"
          },
          {
            "@category": "standard",
            "@height": "217",
            "@width": "350",
            "@_fa": "true",
            "$": "https://api.elsevier.com/content/object/eid/1-s2.0-S2468823124004504-gr1.jpg?httpAccept=%2A%2F%2A",
            "@multimediatype": "JPEG image file",
            "@type": "IMAGE-DOWNSAMPLED",
            "@size": "34934",
            "@ref": "gr1",
            "@mimetype": "image/jpeg"
          },
          {
            "@category": "standard",
            "@height": "198",
            "@width": "378",
            "@_fa": "true",
            "$": "https://api.elsevier.com/content/object/eid/1-s2.0-S2468823124004504-sc1.jpg?httpAccept=%2A%2F%2A",
            "@multimediatype": "JPEG image file",
            "@type": "IMAGE-DOWNSAMPLED",
            "@size": "30412",
            "@ref": "sc1",
            "@mimetype": "image/jpeg"
          },
          {
            "@category": "standard",
            "@height": "285",
            "@width": "344",
            "@_fa": "true",
            "$": "https://api.elsevier.com/content/object/eid/1-s2.0-S2468823124004504-gr9.jpg?httpAccept=%2A%2F%2A",
            "@multimediatype": "JPEG image file",
            "@type": "IMAGE-DOWNSAMPLED",
            "@size": "26310",
            "@ref": "gr9",
            "@mimetype": "image/jpeg"
          },
          {
            "@category": "standard",
            "@height": "301",
            "@width": "344",
            "@_fa": "true",
            "$": "https://api.elsevier.com/content/object/eid/1-s2.0-S2468823124004504-gr8.jpg?httpAccept=%2A%2F%2A",
            "@multimediatype": "JPEG image file",
            "@type": "IMAGE-DOWNSAMPLED",
            "@size": "25219",
            "@ref": "gr8",
            "@mimetype": "image/jpeg"
          },
          {
            "@category": "standard",
            "@height": "283",
            "@width": "338",
            "@_fa": "true",
            "$": "https://api.elsevier.com/content/object/eid/1-s2.0-S2468823124004504-gr7.jpg?httpAccept=%2A%2F%2A",
            "@multimediatype": "JPEG image file",
            "@type": "IMAGE-DOWNSAMPLED",
            "@size": "28543",
            "@ref": "gr7",
            "@mimetype": "image/jpeg"
          },
          {
            "@category": "thumbnail",
            "@height": "152",
            "@width": "219",
            "@_fa": "true",
            "$": "https://api.elsevier.com/content/object/eid/1-s2.0-S2468823124004504-gr6.sml?httpAccept=%2A%2F%2A",
            "@multimediatype": "GIF image file",
            "@type": "IMAGE-THUMBNAIL",
            "@size": "13792",
            "@ref": "gr6",
            "@mimetype": "image/gif"
          },
          {
            "@category": "thumbnail",
            "@height": "164",
            "@width": "196",
            "@_fa": "true",
            "$": "https://api.elsevier.com/content/object/eid/1-s2.0-S2468823124004504-gr5.sml?httpAccept=%2A%2F%2A",
            "@multimediatype": "GIF image file",
            "@type": "IMAGE-THUMBNAIL",
            "@size": "7978",
            "@ref": "gr5",
            "@mimetype": "image/gif"
          },
          {
            "@category": "thumbnail",
            "@height": "164",
            "@width": "92",
            "@_fa": "true",
            "$": "https://api.elsevier.com/content/object/eid/1-s2.0-S2468823124004504-gr4.sml?httpAccept=%2A%2F%2A",
            "@multimediatype": "GIF image file",
            "@type": "IMAGE-THUMBNAIL",
            "@size": "9532",
            "@ref": "gr4",
            "@mimetype": "image/gif"
          },
          {
            "@category": "thumbnail",
            "@height": "163",
            "@width": "188",
            "@_fa": "true",
            "$": "https://api.elsevier.com/content/object/eid/1-s2.0-S2468823124004504-gr3.sml?httpAccept=%2A%2F%2A",
            "@multimediatype": "GIF image file",
            "@type": "IMAGE-THUMBNAIL",
            "@size": "17606",
            "@ref": "gr3",
            "@mimetype": "image/gif"
          },
          {
            "@category": "thumbnail",
            "@height": "164",
            "@width": "197",
            "@_fa": "true",
            "$": "https://api.elsevier.com/content/object/eid/1-s2.0-S2468823124004504-gr2.sml?httpAccept=%2A%2F%2A",
            "@multimediatype": "GIF image file",
            "@type": "IMAGE-THUMBNAIL",
            "@size": "25754",
            "@ref": "gr2",
            "@mimetype": "image/gif"
          },
          {
            "@category": "thumbnail",
            "@height": "114",
            "@width": "219",
            "@_fa": "true",
            "$": "https://api.elsevier.com/content/object/eid/1-s2.0-S2468823124004504-ga1.sml?httpAccept=%2A%2F%2A",
            "@multimediatype": "GIF image file",
            "@type": "IMAGE-THUMBNAIL",
            "@size": "10092",
            "@ref": "ga1",
            "@mimetype": "image/gif"
          },
          {
            "@category": "thumbnail",
            "@height": "136",
            "@width": "219",
            "@_fa": "true",
            "$": "https://api.elsevier.com/content/object/eid/1-s2.0-S2468823124004504-gr1.sml?httpAccept=%2A%2F%2A",
            "@multimediatype": "GIF image file",
            "@type": "IMAGE-THUMBNAIL",
            "@size": "12916",
            "@ref": "gr1",
            "@mimetype": "image/gif"
          },
          {
            "@category": "thumbnail",
            "@height": "115",
            "@width": "219",
            "@_fa": "true",
            "$": "https://api.elsevier.com/content/object/eid/1-s2.0-S2468823124004504-sc1.sml?httpAccept=%2A%2F%2A",
            "@multimediatype": "GIF image file",
            "@type": "IMAGE-THUMBNAIL",
            "@size": "11717",
            "@ref": "sc1",
            "@mimetype": "image/gif"
          },
          {
            "@category": "thumbnail",
            "@height": "163",
            "@width": "197",
            "@_fa": "true",
            "$": "https://api.elsevier.com/content/object/eid/1-s2.0-S2468823124004504-gr9.sml?httpAccept=%2A%2F%2A",
            "@multimediatype": "GIF image file",
            "@type": "IMAGE-THUMBNAIL",
            "@size": "9866",
            "@ref": "gr9",
            "@mimetype": "image/gif"
          },
          {
            "@category": "thumbnail",
            "@height": "163",
            "@width": "187",
            "@_fa": "true",
            "$": "https://api.elsevier.com/content/object/eid/1-s2.0-S2468823124004504-gr8.sml?httpAccept=%2A%2F%2A",
            "@multimediatype": "GIF image file",
            "@type": "IMAGE-THUMBNAIL",
            "@size": "8127",
            "@ref": "gr8",
            "@mimetype": "image/gif"
          },
          {
            "@category": "thumbnail",
            "@height": "164",
            "@width": "196",
            "@_fa": "true",
            "$": "https://api.elsevier.com/content/object/eid/1-s2.0-S2468823124004504-gr7.sml?httpAccept=%2A%2F%2A",
            "@multimediatype": "GIF image file",
            "@type": "IMAGE-THUMBNAIL",
            "@size": "11678",
            "@ref": "gr7",
            "@mimetype": "image/gif"
          },
          {
            "@category": "high",
            "@height": "1039",
            "@width": "1498",
            "@_fa": "true",
            "$": "https://api.elsevier.com/content/object/eid/1-s2.0-S2468823124004504-gr6_lrg.jpg?httpAccept=%2A%2F%2A",
            "@multimediatype": "JPEG image file",
            "@type": "IMAGE-HIGH-RES",
            "@size": "231272",
            "@ref": "gr6",
            "@mimetype": "image/jpeg"
          },
          {
            "@category": "high",
            "@height": "1243",
            "@width": "1485",
            "@_fa": "true",
            "$": "https://api.elsevier.com/content/object/eid/1-s2.0-S2468823124004504-gr5_lrg.jpg?httpAccept=%2A%2F%2A",
            "@multimediatype": "JPEG image file",
            "@type": "IMAGE-HIGH-RES",
            "@size": "129010",
            "@ref": "gr5",
            "@mimetype": "image/jpeg"
          },
          {
            "@category": "high",
            "@height": "2719",
            "@width": "1528",
            "@_fa": "true",
            "$": "https://api.elsevier.com/content/object/eid/1-s2.0-S2468823124004504-gr4_lrg.jpg?httpAccept=%2A%2F%2A",
            "@multimediatype": "JPEG image file",
            "@type": "IMAGE-HIGH-RES",
            "@size": "665727",
            "@ref": "gr4",
            "@mimetype": "image/jpeg"
          },
          {
            "@category": "high",
            "@height": "1333",
            "@width": "1533",
            "@_fa": "true",
            "$": "https://api.elsevier.com/content/object/eid/1-s2.0-S2468823124004504-gr3_lrg.jpg?httpAccept=%2A%2F%2A",
            "@multimediatype": "JPEG image file",
            "@type": "IMAGE-HIGH-RES",
            "@size": "394441",
            "@ref": "gr3",
            "@mimetype": "image/jpeg"
          },
          {
            "@category": "high",
            "@height": "1388",
            "@width": "1672",
            "@_fa": "true",
            "$": "https://api.elsevier.com/content/object/eid/1-s2.0-S2468823124004504-gr2_lrg.jpg?httpAccept=%2A%2F%2A",
            "@multimediatype": "JPEG image file",
            "@type": "IMAGE-HIGH-RES",
            "@size": "453297",
            "@ref": "gr2",
            "@mimetype": "image/jpeg"
          },
          {
            "@category": "high",
            "@height": "886",
            "@width": "1697",
            "@_fa": "true",
            "$": "https://api.elsevier.com/content/object/eid/1-s2.0-S2468823124004504-ga1_lrg.jpg?httpAccept=%2A%2F%2A",
            "@multimediatype": "JPEG image file",
            "@type": "IMAGE-HIGH-RES",
            "@size": "190861",
            "@ref": "ga1",
            "@mimetype": "image/jpeg"
          },
          {
            "@category": "high",
            "@height": "963",
            "@width": "1553",
            "@_fa": "true",
            "$": "https://api.elsevier.com/content/object/eid/1-s2.0-S2468823124004504-gr1_lrg.jpg?httpAccept=%2A%2F%2A",
            "@multimediatype": "JPEG image file",
            "@type": "IMAGE-HIGH-RES",
            "@size": "273263",
            "@ref": "gr1",
            "@mimetype": "image/jpeg"
          },
          {
            "@category": "high",
            "@height": "875",
            "@width": "1673",
            "@_fa": "true",
            "$": "https://api.elsevier.com/content/object/eid/1-s2.0-S2468823124004504-sc1_lrg.jpg?httpAccept=%2A%2F%2A",
            "@multimediatype": "JPEG image file",
            "@type": "IMAGE-HIGH-RES",
            "@size": "212465",
            "@ref": "sc1",
            "@mimetype": "image/jpeg"
          },
          {
            "@category": "high",
            "@height": "1264",
            "@width": "1523",
            "@_fa": "true",
            "$": "https://api.elsevier.com/content/object/eid/1-s2.0-S2468823124004504-gr9_lrg.jpg?httpAccept=%2A%2F%2A",
            "@multimediatype": "JPEG image file",
            "@type": "IMAGE-HIGH-RES",
            "@size": "196392",
            "@ref": "gr9",
            "@mimetype": "image/jpeg"
          },
          {
            "@category": "high",
            "@height": "1331",
            "@width": "1523",
            "@_fa": "true",
            "$": "https://api.elsevier.com/content/object/eid/1-s2.0-S2468823124004504-gr8_lrg.jpg?httpAccept=%2A%2F%2A",
            "@multimediatype": "JPEG image file",
            "@type": "IMAGE-HIGH-RES",
            "@size": "168235",
            "@ref": "gr8",
            "@mimetype": "image/jpeg"
          },
          {
            "@category": "high",
            "@height": "1255",
            "@width": "1498",
            "@_fa": "true",
            "$": "https://api.elsevier.com/content/object/eid/1-s2.0-S2468823124004504-gr7_lrg.jpg?httpAccept=%2A%2F%2A",
            "@multimediatype": "JPEG image file",
            "@type": "IMAGE-HIGH-RES",
            "@size": "220189",
            "@ref": "gr7",
            "@mimetype": "image/jpeg"
          },
          {
            "@category": "standard",
            "@_fa": "true",
            "$": "https://api.elsevier.com/content/object/eid/1-s2.0-S2468823124004504-mmc1.docx?httpAccept=%2A%2F%2A",
            "@multimediatype": "Microsoft Word file",
            "@type": "APPLICATION",
            "@size": "4327058",
            "@ref": "mmc1",
            "@mimetype": "application/word"
          },
          {
            "@category": "thumbnail",
            "@_fa": "true",
            "$": "https://api.elsevier.com/content/object/eid/1-s2.0-S2468823124004504-si1.svg?httpAccept=%2A%2F%2A",
            "@multimediatype": "Scalable Vector Graphics file",
            "@type": "ALTIMG",
            "@size": "7201",
            "@ref": "si1",
            "@mimetype": "image/svg+xml"
          },
          {
            "@category": "thumbnail",
            "@_fa": "true",
            "$": "https://api.elsevier.com/content/object/eid/1-s2.0-S2468823124004504-si2.svg?httpAccept=%2A%2F%2A",
            "@multimediatype": "Scalable Vector Graphics file",
            "@type": "ALTIMG",
            "@size": "7201",
            "@ref": "si2",
            "@mimetype": "image/svg+xml"
          },
          {
            "@category": "standard",
            "@_fa": "true",
            "$": "https://api.elsevier.com/content/object/eid/1-s2.0-S2468823124004504-am.pdf?httpAccept=%2A%2F%2A",
            "@multimediatype": "Acrobat PDF file",
            "@type": "AAM-PDF",
            "@size": "1176491",
            "@ref": "am",
            "@mimetype": "application/pdf"
          }
        ]
      },
      "link": {
        "@rel": "abstract",
        "@href": "https://api.elsevier.com/content/abstract/scopus_id/85195293819"
      }
    }
  }
}