{
  "metadata": {
    "title": "A highly accessible and robust carbon-coated cobalt nanoparticle catalyst for furfural hydrogenative valorization at mild reaction",
    "authors": "; ; ",
    "journal": "Molecular Catalysis",
    "date": "2023-12-31",
    "doi": "10.1016/j.mcat.2023.113647",
    "abstract": "",
    "uri": "https://api.elsevier.com/content/article/pii/S2468823123007307",
    "pii": "S2468823123007307"
  },
  "fulltext": {
    "full-text-retrieval-response": {
      "scopus-eid": "2-s2.0-85175027499",
      "originalText": "serial JL 315758 291210 291744 291790 291809 31 Molecular Catalysis MOLECULARCATALYSIS 2023-10-27 2023-10-27 2023-10-27 2023-10-27 2023-11-15T19:32:27 1-s2.0-S2468823123007307 S2468-8231(23)00730-7 S2468823123007307 10.1016/j.mcat.2023.113647 S300 S300.1 FULL-TEXT 1-s2.0-S2468823123X00170 2023-11-15T21:08:15.155199Z 0 0 20231201 20231231 2023 2023-10-27T12:05:54.281487Z absattachment articleinfo articlenumber articletitlenorm authfirstinitialnorm authfirstsurnamenorm cid cids contenttype copyright crossmark dateloaded dateloadedtxt datesearch datesort dateupdated dco docsubtype doctype doi eid ewtransactionid hubeid indexeddate issn issnnorm itemstage itemtransactionid itemweight openaccess openarchive pg pgfirst pii piinorm pubdateend pubdatestart pubdatetxt pubyr sectiontitle sortorder srctitle srctitlenorm srctype ssids alllist content subj subheadings suppl tomb volfirst volissue volumelist webpdf webpdfpagecount yearnav figure e-component body mmlmath acknowledge affil appendices articletitle auth authfirstini authfull authkeywords authlast grantnumber grantsponsor highlightsabst orcid primabst ref specialabst 2468-8231 24688231 true 551 551 C Volume 551 21 113647 113647 113647 202312 December 2023 2023-12-01 2023-12-31 2023 Regular Papers article fla © 2023 Elsevier B.V. All rights reserved. AHIGHLYACCESSIBLEROBUSTCARBONCOATEDCOBALTNANOPARTICLECATALYSTFORFURFURALHYDROGENATIVEVALORIZATIONMILDREACTION LIU W Introduction Experiment Catalyst preparation Structure characterization Catalyst evaluation Result and discussion Synthesis of Co-MOF by coordinating cobalt ions with H2-BDC ligands Pyrolysis of Co-MOF to in situ generate carbon-coated cobalt catalysts Co@C Selective hydrogenation of FUR toward FOL Reusability evaluation Conclusion CRediT authorship contribution statement Acknowledgments Appendix Supplementary materials References MANIKANDAN 2022 122757 S ZHANG 2022 107097 L ZHAO 2023 5170 5193 Z ZHANG 2022 107097 L KUMAR 2022 385 441 A HUANG 2023 415 424 Z GUO 2020 D ZHAO 2023 116 131 W KUMAR 2018 153 161 B HU 2019 27 36 A SAID 2018 213 222 S TRAN 2022 N SHEN 2023 65 76 Y SAGAR 2023 113238 T LEE 2020 302 312 J SUDARSANAM 2019 2366 2421 P CHATTERJEE 2015 40 71 C LIU 2020 P RAIKWAR 2021 D GONG 2022 X CHANG 2017 77 83 L WANG 2023 eadg0167 M WANG 2020 34021 34031 H JIANG 2023 J HAMMI 2022 N ZHAI 2022 44439 44449 Z ZHAO 2022 W ZENG 2023 455 464 Z YANG 2023 Z ZHANG 2023 L LI 2021 8507 8517 S YANG 2023 107507 Z MURUGESAN 2018 8553 8560 K CHANDRASHEKHAR 2021 V MILES 2013 9 13 D KIM 2023 22903 22914 D WANG 2022 1714 1726 G HU 2016 71 76 X YANG 2017 631 636 J CAO 2023 131274 J MIAO 2022 123306 P PHAN 2010 246 253 N HUANG 2000 2805 2812 Z KURIHARA 2000 9 12 S JIANG 2020 9883 9892 S NGUYENHUY 2019 117125 C LI 2023 126057 H ZHANG 2023 Z RANAWARE 2022 121838 V LONG 2015 2331 2334 J ZHANG 2022 16643 16652 Z WANG 2019 399 410 G SHEN 2021 16834 16839 Z JIANG 2020 9883 9892 S ZHAO 2022 W HUANG 2021 L LI 2020 Z QIN 2016 1240 1247 H LIU 2016 1 9 L CHEN 2023 119182 J CHEN 2020 5730 5741 S LIUX2023X113647 LIUX2023X113647XW 2025-10-27T00:00:00.000Z 2025-10-27T00:00:00.000Z http://creativecommons.org/licenses/by-nc-nd/4.0/ © 2023 Elsevier B.V. All rights reserved. 2023-11-01T08:58:05.139Z http://vtw.elsevier.com/data/voc/AddOnTypes/50.7/aggregated-refined Guangdong Provincial Key Laboratory of Plant Resources Biorefinery 2021GDKLPRB10 Guangdong University of Technology GDUT Guangdong University of Technology http://data.elsevier.com/vocabulary/SciValFunders/501100008326 http://sws.geonames.org/1814991/ 100 Young Talents Program Key Laboratory of Fuel Cell Technology of Guangdong Province Guangdong Key Laboratory of Fuel Cell Technology http://data.elsevier.com/vocabulary/SciValFunders/501100011507 http://sws.geonames.org/1814991/ This work was supported by the Guangdong Provincial Key Laboratory of Plant Resources Biorefinery (No. 2021GDKLPRB10 ) and the Key Laboratory of Fuel Cell Technology of Guangdong Province. Dr. X. Yang thanks the 100 Young Talents Program of the Guangdong University of Technology for financial support. https://doi.org/10.15223/policy-017 https://doi.org/10.15223/policy-037 https://doi.org/10.15223/policy-012 https://doi.org/10.15223/policy-029 https://doi.org/10.15223/policy-004 item S2468-8231(23)00730-7 S2468823123007307 1-s2.0-S2468823123007307 10.1016/j.mcat.2023.113647 315758 2023-11-15T21:08:15.155199Z 2023-12-01 2023-12-31 1-s2.0-S2468823123007307-main.pdf https://s3-eu-west-1.amazonaws.com/prod-ucs-content-store-eu-west/content/pii:S2468823123007307/MAIN/application/pdf/07b52701eb63499c618e8eb30abdaac8/main.pdf main.pdf pdf true 10938500 MAIN 11 1-s2.0-S2468823123007307-main_1.png https://s3-eu-west-1.amazonaws.com/prod-ucs-content-store-eu-west/content/pii:S2468823123007307/PREVIEW/image/png/c463de2f4249b42d86d1e4e44f1f7a46/main_1.png main_1.png png 59671 849 656 IMAGE-WEB-PDF 1 1-s2.0-S2468823123007307-gr4.jpg https://s3-eu-west-1.amazonaws.com/prod-ucs-content-store-eu-west/content/pii:S2468823123007307/gr4/DOWNSAMPLED/image/jpeg/488aecaf42f6143623c7ecc3fe57b292/gr4.jpg gr4 gr4.jpg jpg 71506 282 715 IMAGE-DOWNSAMPLED 1-s2.0-S2468823123007307-gr2.jpg https://s3-eu-west-1.amazonaws.com/prod-ucs-content-store-eu-west/content/pii:S2468823123007307/gr2/DOWNSAMPLED/image/jpeg/e7c3bc3992a45bee4bff19f94578111b/gr2.jpg gr2 gr2.jpg jpg 141651 660 715 IMAGE-DOWNSAMPLED 1-s2.0-S2468823123007307-gr10.jpg https://s3-eu-west-1.amazonaws.com/prod-ucs-content-store-eu-west/content/pii:S2468823123007307/gr10/DOWNSAMPLED/image/jpeg/9991e06ddc53da0ba5187fce5afd6f58/gr10.jpg gr10 gr10.jpg jpg 48039 258 698 IMAGE-DOWNSAMPLED 1-s2.0-S2468823123007307-gr6.jpg https://s3-eu-west-1.amazonaws.com/prod-ucs-content-store-eu-west/content/pii:S2468823123007307/gr6/DOWNSAMPLED/image/jpeg/e5847d5394781aa947e53260837fa593/gr6.jpg gr6 gr6.jpg jpg 93014 316 734 IMAGE-DOWNSAMPLED 1-s2.0-S2468823123007307-gr7.jpg https://s3-eu-west-1.amazonaws.com/prod-ucs-content-store-eu-west/content/pii:S2468823123007307/gr7/DOWNSAMPLED/image/jpeg/a8f4b48244c8ed0ce68e90a4fd463a95/gr7.jpg gr7 gr7.jpg jpg 106782 333 733 IMAGE-DOWNSAMPLED 1-s2.0-S2468823123007307-sc2.jpg https://s3-eu-west-1.amazonaws.com/prod-ucs-content-store-eu-west/content/pii:S2468823123007307/sc2/DOWNSAMPLED/image/jpeg/18b2eca4a4df060a8be5577497653581/sc2.jpg sc2 sc2.jpg jpg 14851 151 376 IMAGE-DOWNSAMPLED 1-s2.0-S2468823123007307-ga1.jpg https://s3-eu-west-1.amazonaws.com/prod-ucs-content-store-eu-west/content/pii:S2468823123007307/ga1/DOWNSAMPLED/image/jpeg/f44b2e94a1c85e5f7309810f790fea94/ga1.jpg ga1 true ga1.jpg jpg 31042 200 399 IMAGE-DOWNSAMPLED 1-s2.0-S2468823123007307-gr1.jpg https://s3-eu-west-1.amazonaws.com/prod-ucs-content-store-eu-west/content/pii:S2468823123007307/gr1/DOWNSAMPLED/image/jpeg/5783bd85cdbbb016b88c62220aa79356/gr1.jpg gr1 gr1.jpg jpg 155453 488 715 IMAGE-DOWNSAMPLED 1-s2.0-S2468823123007307-gr12.jpg https://s3-eu-west-1.amazonaws.com/prod-ucs-content-store-eu-west/content/pii:S2468823123007307/gr12/DOWNSAMPLED/image/jpeg/e41328fceb4f3e4e99ba3db0567b0413/gr12.jpg gr12 gr12.jpg jpg 132797 645 734 IMAGE-DOWNSAMPLED 1-s2.0-S2468823123007307-gr5.jpg https://s3-eu-west-1.amazonaws.com/prod-ucs-content-store-eu-west/content/pii:S2468823123007307/gr5/DOWNSAMPLED/image/jpeg/3215faa06ed39e847a15ccb11a88bc75/gr5.jpg gr5 gr5.jpg jpg 74137 262 715 IMAGE-DOWNSAMPLED 1-s2.0-S2468823123007307-gr11.jpg https://s3-eu-west-1.amazonaws.com/prod-ucs-content-store-eu-west/content/pii:S2468823123007307/gr11/DOWNSAMPLED/image/jpeg/c0b0e17c0c6ff811f4449a32a3f6780c/gr11.jpg gr11 gr11.jpg jpg 53344 285 734 IMAGE-DOWNSAMPLED 1-s2.0-S2468823123007307-gr3.jpg https://s3-eu-west-1.amazonaws.com/prod-ucs-content-store-eu-west/content/pii:S2468823123007307/gr3/DOWNSAMPLED/image/jpeg/6c33cbe9833c9a1a6a9172bbea04530d/gr3.jpg gr3 gr3.jpg jpg 62831 274 711 IMAGE-DOWNSAMPLED 1-s2.0-S2468823123007307-gr8.jpg https://s3-eu-west-1.amazonaws.com/prod-ucs-content-store-eu-west/content/pii:S2468823123007307/gr8/DOWNSAMPLED/image/jpeg/11fa601d1acd978324f3b89c9eacfb63/gr8.jpg gr8 gr8.jpg jpg 137675 365 715 IMAGE-DOWNSAMPLED 1-s2.0-S2468823123007307-gr9.jpg https://s3-eu-west-1.amazonaws.com/prod-ucs-content-store-eu-west/content/pii:S2468823123007307/gr9/DOWNSAMPLED/image/jpeg/5d2d06bba1ebf30e0e6a2c157c1c5b97/gr9.jpg gr9 gr9.jpg jpg 33622 258 730 IMAGE-DOWNSAMPLED 1-s2.0-S2468823123007307-sc1.jpg https://s3-eu-west-1.amazonaws.com/prod-ucs-content-store-eu-west/content/pii:S2468823123007307/sc1/DOWNSAMPLED/image/jpeg/3dae5aebda1be8dcae008e04b0fbd9ed/sc1.jpg sc1 sc1.jpg jpg 36986 215 565 IMAGE-DOWNSAMPLED 1-s2.0-S2468823123007307-gr4.sml https://s3-eu-west-1.amazonaws.com/prod-ucs-content-store-eu-west/content/pii:S2468823123007307/gr4/THUMBNAIL/image/gif/21950787078ac1e62f1b8183465d2427/gr4.sml gr4 gr4.sml sml 9869 86 219 IMAGE-THUMBNAIL 1-s2.0-S2468823123007307-gr2.sml https://s3-eu-west-1.amazonaws.com/prod-ucs-content-store-eu-west/content/pii:S2468823123007307/gr2/THUMBNAIL/image/gif/76b8ccaa5524d81b4e235daf43f3e8f8/gr2.sml gr2 gr2.sml sml 13110 163 177 IMAGE-THUMBNAIL 1-s2.0-S2468823123007307-gr10.sml https://s3-eu-west-1.amazonaws.com/prod-ucs-content-store-eu-west/content/pii:S2468823123007307/gr10/THUMBNAIL/image/gif/f447ff35049436d626b85e777f8a51ff/gr10.sml gr10 gr10.sml sml 7470 81 219 IMAGE-THUMBNAIL 1-s2.0-S2468823123007307-gr6.sml https://s3-eu-west-1.amazonaws.com/prod-ucs-content-store-eu-west/content/pii:S2468823123007307/gr6/THUMBNAIL/image/gif/437ef28efc240c5a233febf1f92eedbb/gr6.sml gr6 gr6.sml sml 12253 94 219 IMAGE-THUMBNAIL 1-s2.0-S2468823123007307-gr7.sml https://s3-eu-west-1.amazonaws.com/prod-ucs-content-store-eu-west/content/pii:S2468823123007307/gr7/THUMBNAIL/image/gif/d40f5b66f3940d6d02c10e442ddde3d2/gr7.sml gr7 gr7.sml sml 17026 99 219 IMAGE-THUMBNAIL 1-s2.0-S2468823123007307-sc2.sml https://s3-eu-west-1.amazonaws.com/prod-ucs-content-store-eu-west/content/pii:S2468823123007307/sc2/THUMBNAIL/image/gif/99cca0ae9ab52479eab0929332208c6b/sc2.sml sc2 sc2.sml sml 6175 88 219 IMAGE-THUMBNAIL 1-s2.0-S2468823123007307-ga1.sml https://s3-eu-west-1.amazonaws.com/prod-ucs-content-store-eu-west/content/pii:S2468823123007307/ga1/THUMBNAIL/image/gif/fe8e59dd030d5ca6fb890bc8e38dff76/ga1.sml ga1 true ga1.sml sml 11308 110 219 IMAGE-THUMBNAIL 1-s2.0-S2468823123007307-gr1.sml https://s3-eu-west-1.amazonaws.com/prod-ucs-content-store-eu-west/content/pii:S2468823123007307/gr1/THUMBNAIL/image/gif/b843c0e5fd83522c0a78b14647363c4e/gr1.sml gr1 gr1.sml sml 27742 149 219 IMAGE-THUMBNAIL 1-s2.0-S2468823123007307-gr12.sml https://s3-eu-west-1.amazonaws.com/prod-ucs-content-store-eu-west/content/pii:S2468823123007307/gr12/THUMBNAIL/image/gif/c2e00fdfb97d36c723884e7b7b643b9f/gr12.sml gr12 gr12.sml sml 13211 163 186 IMAGE-THUMBNAIL 1-s2.0-S2468823123007307-gr5.sml https://s3-eu-west-1.amazonaws.com/prod-ucs-content-store-eu-west/content/pii:S2468823123007307/gr5/THUMBNAIL/image/gif/5c653a282f41fbc4ab9e0c7e2867718b/gr5.sml gr5 gr5.sml sml 9435 80 219 IMAGE-THUMBNAIL 1-s2.0-S2468823123007307-gr11.sml https://s3-eu-west-1.amazonaws.com/prod-ucs-content-store-eu-west/content/pii:S2468823123007307/gr11/THUMBNAIL/image/gif/4bf47038e178c42ddc95545da8dbd414/gr11.sml gr11 gr11.sml sml 7853 85 219 IMAGE-THUMBNAIL 1-s2.0-S2468823123007307-gr3.sml https://s3-eu-west-1.amazonaws.com/prod-ucs-content-store-eu-west/content/pii:S2468823123007307/gr3/THUMBNAIL/image/gif/cffd7e83d10264d56ecf068c9e346dea/gr3.sml gr3 gr3.sml sml 9759 85 219 IMAGE-THUMBNAIL 1-s2.0-S2468823123007307-gr8.sml https://s3-eu-west-1.amazonaws.com/prod-ucs-content-store-eu-west/content/pii:S2468823123007307/gr8/THUMBNAIL/image/gif/d56682589d90272f5b2af4f24f6e6efa/gr8.sml gr8 gr8.sml sml 19844 112 219 IMAGE-THUMBNAIL 1-s2.0-S2468823123007307-gr9.sml https://s3-eu-west-1.amazonaws.com/prod-ucs-content-store-eu-west/content/pii:S2468823123007307/gr9/THUMBNAIL/image/gif/dadcfb305dbde6a9f2602630b78f90fb/gr9.sml gr9 gr9.sml sml 6184 77 219 IMAGE-THUMBNAIL 1-s2.0-S2468823123007307-sc1.sml https://s3-eu-west-1.amazonaws.com/prod-ucs-content-store-eu-west/content/pii:S2468823123007307/sc1/THUMBNAIL/image/gif/02783d618e3b065cde32e8b667f9af45/sc1.sml sc1 sc1.sml sml 9119 83 219 IMAGE-THUMBNAIL 1-s2.0-S2468823123007307-gr4_lrg.jpg https://s3-eu-west-1.amazonaws.com/prod-ucs-content-store-eu-west/content/pii:S2468823123007307/HIGHRES/image/jpeg/01cb16930c907abfc51edcd1d13ede23/gr4_lrg.jpg gr4 gr4_lrg.jpg jpg 586796 1248 3167 IMAGE-HIGH-RES 1-s2.0-S2468823123007307-gr2_lrg.jpg https://s3-eu-west-1.amazonaws.com/prod-ucs-content-store-eu-west/content/pii:S2468823123007307/HIGHRES/image/jpeg/ac699d1102f0cf6cb059b3ee65726f65/gr2_lrg.jpg gr2 gr2_lrg.jpg jpg 1138004 2925 3167 IMAGE-HIGH-RES 1-s2.0-S2468823123007307-gr10_lrg.jpg https://s3-eu-west-1.amazonaws.com/prod-ucs-content-store-eu-west/content/pii:S2468823123007307/HIGHRES/image/jpeg/f56569768719b7fd7b417e63ae0d46eb/gr10_lrg.jpg gr10 gr10_lrg.jpg jpg 397697 1141 3092 IMAGE-HIGH-RES 1-s2.0-S2468823123007307-gr6_lrg.jpg https://s3-eu-west-1.amazonaws.com/prod-ucs-content-store-eu-west/content/pii:S2468823123007307/HIGHRES/image/jpeg/b94fbdee9ea0fd23858dc7fde5373378/gr6_lrg.jpg gr6 gr6_lrg.jpg jpg 835319 1398 3250 IMAGE-HIGH-RES 1-s2.0-S2468823123007307-gr7_lrg.jpg https://s3-eu-west-1.amazonaws.com/prod-ucs-content-store-eu-west/content/pii:S2468823123007307/HIGHRES/image/jpeg/86b371c57c7b8f284d687919385533e8/gr7_lrg.jpg gr7 gr7_lrg.jpg jpg 887934 1473 3244 IMAGE-HIGH-RES 1-s2.0-S2468823123007307-sc2_lrg.jpg https://s3-eu-west-1.amazonaws.com/prod-ucs-content-store-eu-west/content/pii:S2468823123007307/HIGHRES/image/jpeg/dfc16ea9744afa4447f43c94d52eb947/sc2_lrg.jpg sc2 sc2_lrg.jpg jpg 92530 669 1667 IMAGE-HIGH-RES 1-s2.0-S2468823123007307-ga1_lrg.jpg https://s3-eu-west-1.amazonaws.com/prod-ucs-content-store-eu-west/content/pii:S2468823123007307/HIGHRES/image/jpeg/8979a98dc5749f541d4e39aadd94e6e0/ga1_lrg.jpg ga1 true ga1_lrg.jpg jpg 219624 886 1766 IMAGE-HIGH-RES 1-s2.0-S2468823123007307-gr1_lrg.jpg https://s3-eu-west-1.amazonaws.com/prod-ucs-content-store-eu-west/content/pii:S2468823123007307/HIGHRES/image/jpeg/c42d94cf8abf01fffec9e15939f72bdf/gr1_lrg.jpg gr1 gr1_lrg.jpg jpg 1943306 2160 3167 IMAGE-HIGH-RES 1-s2.0-S2468823123007307-gr12_lrg.jpg https://s3-eu-west-1.amazonaws.com/prod-ucs-content-store-eu-west/content/pii:S2468823123007307/HIGHRES/image/jpeg/d0183bd03ece9468f1665642443ec783/gr12_lrg.jpg gr12 gr12_lrg.jpg jpg 1056023 2855 3250 IMAGE-HIGH-RES 1-s2.0-S2468823123007307-gr5_lrg.jpg https://s3-eu-west-1.amazonaws.com/prod-ucs-content-store-eu-west/content/pii:S2468823123007307/HIGHRES/image/jpeg/2293810493be9a1a80499a99a38a232c/gr5_lrg.jpg gr5 gr5_lrg.jpg jpg 656927 1160 3167 IMAGE-HIGH-RES 1-s2.0-S2468823123007307-gr11_lrg.jpg https://s3-eu-west-1.amazonaws.com/prod-ucs-content-store-eu-west/content/pii:S2468823123007307/HIGHRES/image/jpeg/e8c77c9e7cf27c5147dc8ed6308616b7/gr11_lrg.jpg gr11 gr11_lrg.jpg jpg 359375 1260 3250 IMAGE-HIGH-RES 1-s2.0-S2468823123007307-gr3_lrg.jpg https://s3-eu-west-1.amazonaws.com/prod-ucs-content-store-eu-west/content/pii:S2468823123007307/HIGHRES/image/jpeg/c8b76eaf90c50e710688705a7397449c/gr3_lrg.jpg gr3 gr3_lrg.jpg jpg 450076 1215 3148 IMAGE-HIGH-RES 1-s2.0-S2468823123007307-gr8_lrg.jpg https://s3-eu-west-1.amazonaws.com/prod-ucs-content-store-eu-west/content/pii:S2468823123007307/HIGHRES/image/jpeg/02ed2e51a76e5b2d95a74e0946f6727e/gr8_lrg.jpg gr8 gr8_lrg.jpg jpg 1008651 1614 3166 IMAGE-HIGH-RES 1-s2.0-S2468823123007307-gr9_lrg.jpg https://s3-eu-west-1.amazonaws.com/prod-ucs-content-store-eu-west/content/pii:S2468823123007307/HIGHRES/image/jpeg/e468f3daa44bdde8962c103f05d7f388/gr9_lrg.jpg gr9 gr9_lrg.jpg jpg 255692 1143 3231 IMAGE-HIGH-RES 1-s2.0-S2468823123007307-sc1_lrg.jpg https://s3-eu-west-1.amazonaws.com/prod-ucs-content-store-eu-west/content/pii:S2468823123007307/HIGHRES/image/jpeg/07e0ad467bbc2a82c9b3416a4a39eaa5/sc1_lrg.jpg sc1 sc1_lrg.jpg jpg 243362 951 2500 IMAGE-HIGH-RES 1-s2.0-S2468823123007307-mmc1.docx https://s3-eu-west-1.amazonaws.com/prod-ucs-content-store-eu-west/content/pii:S2468823123007307/mmc1/MAIN/application/vnd.openxmlformats-officedocument.wordprocessingml.document/e377d875d74e715f6e26197512ee3b84/mmc1.docx mmc1 mmc1.docx docx 12443235 APPLICATION 1-s2.0-S2468823123007307-si1.svg https://s3-eu-west-1.amazonaws.com/prod-ucs-content-store-eu-west/content/pii:S2468823123007307/image/svg+xml/7864a6c80be32de475e2b44976f937d2/si1.svg si1 si1.svg svg 26072 ALTIMG 1-s2.0-S2468823123007307-si2.svg https://s3-eu-west-1.amazonaws.com/prod-ucs-content-store-eu-west/content/pii:S2468823123007307/image/svg+xml/3d9522ea8d1e9ced0f9a4fabb8d9731f/si2.svg si2 si2.svg svg 25480 ALTIMG 1-s2.0-S2468823123007307-si3.svg https://s3-eu-west-1.amazonaws.com/prod-ucs-content-store-eu-west/content/pii:S2468823123007307/image/svg+xml/180873f4196ea399e3db33a0a9d62d97/si3.svg si3 si3.svg svg 31221 ALTIMG 1-s2.0-S2468823123007307-am.pdf https://s3-eu-west-1.amazonaws.com/prod-ucs-content-store-eu-west/content/egi:10QVSJZ0W6M/MAIN/application/pdf/da08979dd515092d9681151929368367/am.pdf am am.pdf pdf false 3495901 AAM-PDF MCAT 113647 113647 S2468-8231(23)00730-7 10.1016/j.mcat.2023.113647 Elsevier B.V. Fig. 1 SEM images of Co-MOF with various magnifications. Fig. 1 Fig. 2 (a) XRD pattern, (b) nitrogen sorption plot with pore size distribution (inset), (c) FTIR spectra and d) view of the structure of as-synthesized Co-MOF. The standard pattern of CCDC-153,067 was provided free of charge by the Cambridge Crystallographic Data centre (CCDC). Fig. 2 Fig. 3 (a) TG-DTG-DSC curves of Co-MOF, the black dotted line refers to the TG curve of pristine H2-BDC ligand, and (b) FTIR spectra of various Co@C-T-n. The denotation T-n stands for the pyrolysis temperatures. Fig. 3 Fig. 4 (a) XRD patterns of various Co@C-T-n, where the denotation T-n stands for the pyrolysis temperatures. (b) Percentage of cobalt phase (CoO and metallic Co) and crystallite size as a function of pyrolysis temperature. Fig. 4 Fig. 5 (a) Isothermal ads-desorption plot, (b) corresponding pore size distribution, and (c) evolution of surface area and microporosity for the various Co@C-T-n, where the denotation T-n stands for the pyrolysis temperatures. Fig. 5 Fig. 6 XPS spectra of various Co@C-T-n: (a) Co 2p and (b) C 1 s. The denotation T-n stands for the pyrolysis temperatures. Fig. 6 Fig. 7 SEM images of Co@C-T-n, where the denotation T-n stands for the pyrolysis temperatures. Fig. 7 Fig. 8 (a-b) HRTEM images with various magnifications of Co@C-T550. The partial regions selected in Figure b are further magnified in Figure b-1 and b-2, respectively. (c-f) Element mapping of Co@C-T550. Fig. 8 Fig. 9 (a) Hydrogenation of furfural over various catalysts, reaction: 0.3 g FUR, 30 mg catalyst, 10 mL ethanol as solvent, reacted at 80 °C and 1 MPa of pH2 for 2 h. (b) Correlation between the number of surface cobalt sites (NCo ) and furfural conversion. The calculation of NCo can be referred to the Table S2 in Supporting information. Fig. 9 Fig. 10 (a) Hydrogenation of FUR over the Co@C-T550 as a function of reaction time, reaction: 0.15 g FUR, 30 mg catalyst, 10 mL ethanol as solvent, reacted at 80 °C and 1 MPa of pH2 ; (b) Catalysts screening for the FUR hydrogenation reported in recent literature, seeing Table S1 in Supporting information for catalyst details. Fig. 10 Fig. 11 (a) Hydrogenation of FUR over the Co@C-T550 under various reaction temperatures and pH2, inset was Arrhenius plot; (b) Production distribution over the Co@C-T550 under various reaction temperatures. Fig. 11 Fig. 12 (a) Recycling run of Co@C-T550, and structure characterizations of the spent Co@C-T550: (b) XRD pattern, (c) XPS spectra, and (d) Nitrogen sorption. Fig. 12 Scheme 1 Fabrication route to the carbon-coated cobalt nanoparticles (Co@C) via pyrolysis of sheet-like Co-MOFs. Scheme 1 Scheme 2 Reaction pathway for the hydrogenation of FUR over the cobalt-based catalysts. FUR: furfural, FOL: furfuryl alcohol, THFOL: tetrahydro furfuryl alcohol, 2-MF: 2-methyl furan. Scheme 2 A highly accessible and robust carbon-coated cobalt nanoparticle catalyst for furfural hydrogenative valorization at mild reaction Wu Liu Investigation Validation Data curation a Jieying Hua Investigation Methodology a Shuyi Su Formal analysis a Xu Yang Conceptualization Methodology Writing – original draft Formal analysis Resources a b ⁎ a School of Chemical Engineering and Light Industry, Guangdong University of Technology, Guangzhou, 510006, China School of Chemical Engineering and Light Industry Guangdong University of Technology Guangzhou 510006 China aSchool of Chemical Engineering and Light Industry, Guangdong University of Technology, Guangzhou, 510006, China b Jieyang Branch of Chemistry and Chemical Engineering, Guangdong Laboratory (Rongjiang Laboratory), Jieyang 515200, China Jieyang Branch of Chemistry and Chemical Engineering Guangdong Laboratory (Rongjiang Laboratory) Jieyang 515200 China bJieyang Branch of Chemistry and Chemical Engineering, Guangdong Laboratory (Rongjiang Laboratory), Jieyang 515200, China ⁎ Corresponding author. The hydrogenative upgrading of furfural into valuable chemical intermediates has currently caught intensive research interest, with robust and efficient catalysts that can operate under mild reaction conditions remaining challenging. In this study, we presented a high-performance carbon-coated cobalt catalyst (Co@C) through pyrolysis of sheet-like Co-MOF. The optimized Co@C-T550 exhibited an intriguing furfural conversion rate under a very mild reaction condition of 80 °C and 1 MPa. The catalyst's enhanced activity at low-temperature effectively suppressed side reactions, resulting in an excellent furfuryl alcohol productivity of 4.8 gFOL·gCo −1·h−1, surpassing most cobalt-based catalysts reported in recent literature. Furthermore, the high performance of Co@C-T550 can be sustained with slight decay even after undergoing 10 recycling runs, underscoring the reliable stability of the catalyst. Structure characterizations have revealed that this novel Co@C-T550 had highly dispersed cobalt nanoparticles with a microporous carbon coating, affording a high number of metallic cobalt sites with an excellent ability to resist cobalt sintering/leaching and re-oxidation. The insights gained from this study provide a solid foundation for the rational design of advanced carbon-coated cobalt catalysts for low-temperature hydrogenative biomass upgrading. Graphical abstract Image, graphical abstract Keywords Co-MOF Carbon coating Furfuryl alcohol Cobalt nanoparticles Mild hydrogenation Data availability Data will be made available on request. Introduction Production of chemical intermediates from renewable biomass has currently attracted unprecedented attention; it can significantly mitigate carbon emissions caused by human activities owing to the establishment of a closed loop of carbon footprint between human society and nature [1–3]. In biomass refining, the hydrogenation process plays a pivotal role due to the abundant oxygen content present in these biomass-derived platform molecules. However, the utilization of high-efficacy metal catalysts in hydrogenation is recognized as one of the key bottlenecks impeding its further development [4–8]. Cobalt is a widely used metal catalyst in hydrogenation due to its efficient ability to dissociate hydrogen molecules. The Co0 species are the active centers responsible for catalytic activity, and therefore, the cobalt catalyst necessitates an activation process to retain a high content of metallic state [9,10]. This activation is typically achieved by in situ hydrogen-reduction at 400–600 °C in the fix-bed reactor[11,12]. Nevertheless, this method is not readily available for use in batch reactors where a large part of biomass refineries proceed [13,14]. Consequently, surface re-oxidation of cobalt is inevitable, leading to a decrease in the number of active sites on the catalyst surface [15]. As such, the existing cobalt catalysts often require high reaction temperatures (>150 °C) to attain a comparable conversion rate. Thereby, two unfavorable issues arise from the high-temperature reaction: one is the loss of active sites by metal sintering/leaching [16,17], and the other is the declined selectivity caused by the side reactions (hydrodeoxygenation, ring hydrogenation, etc.)[18]. To overcome these drawbacks, numerous methods have been reported in designing cobalt catalysts with a high number of active sites, such as alloying second metal [19–21], adding a promoter [22], constructing single atom catalyst [23], encapsulating a protective shell [24,25], etc. In particular, encapsulating the cobalt nanoparticles with a porous carbon shell has emerged as a viable and appealing strategy. The presence of a carbon coating provides numerous advantages, including effective isolation of highly dispersed cobalt nanoparticles, substantial resistance to particle aggregation, metal leaching and surface re-oxidation. The carbon shell can be sourced from diverse carbon-containing molecules or compounds [10,21]. For instance, Wang et al. presented a modified approach by utilizing fumaric and glycerol as co-templates to synthesize a novel Co@CN-G-600 catalyst, achieving an exceptional performance toward furfural hydrogenation at 80 °C and 2 MPa [26]. Furthermore, various representative Co-containing metal-organic frameworks (MOFs), such as ZIF-67, ZIF-8 UIO-66, ZIF-67, etc., have also been employed to in situ generate carbon-coated cobalt catalysts [27,28,29,30]. Moon's group recently reported that a ZIF-67 derived Co/NC-400–6 achieved a remarkable productivity of 2-methyl furan at 180 °C [15]. Upon carefully reviewing the literature, we found that the catalytic performance of the as-obtained Co@C composites strongly relies on the kind of carbon template selected and the pyrolysis process (temperature, time, atmosphere, etc.); realizing an excellent performance under mild reaction temperatures (<100 °C) remains a challenging target[31–33]. A detailed summary of the reported catalytic performances is provided in Table S1 of the Supporting Information (SI). Encouraged by the above consideration, herein we have chosen to adopt sheet-like Co-MOF, where the terephthalic acid (H2-BDC) is used as an organic ligand, as the template for synthesizing a carbon-coated cobalt catalyst for liquid-phase furfural hydrogenation. To the best of our knowledge, using this Co-MOF-derived Co@C for furfural hydrogenation has been rarely reported[34,35]. By optimizing the pyrolysis process, we acquired a core-shell structured Co@C composited catalyst with a uniform particle size of 15∼20 nm and good oxidation-resist properties. The resulting Co@C can accomplish an outstanding yield of furfuryl alcohol at a very mild reaction of 80 °C and 1 MPa. Systematic structure characterizations and controlled experimental runs were performed to elucidate the relationship between the pyrolysis temperature, the structural properties (porosity, cobalt phase, morphology, etc.), and the activity. Experiment Catalyst preparation All the agents were used as received. Synthesis of Co-MOF: Co-MOF was synthesized using a simple solvothermal method with slight modification[34,36], as shown in Scheme 1 . First of all, 21 mL of deionized water (DI water), ethanol and dimethylformamide (DMF) were mixed and kept stirring. Then, 0.25 g cobalt acetate hydrate (C4H6CoO4·4H2O), and 0.17 g 2,5-Dihydroxyterephthalic acid (H2-BDC) was added into the above mixed solution. After stirring for 30 min, the mixed solution was transferred to a 100 mL polytetrafluoroethylene autoclave and heated to 120 °C for 12 h. After the reaction was completed and cooled to room temperature, the sample was obtained by centrifugation, washing and drying. Preparation of carbon-coated cobalt composited catalyst, Co@C: The as-prepared Co-MOF was annealed at 550 °C for 2 h in Ar with a heating rate of 5 °C min−1 to obtain the carbon-coated cobalt composited catalyst. To investigate the effect of pyrolysis temperature on the resulting structural properties, we prepared a series of samples by the same procedure but varying the pyrolysis temperature from 300 to 600 °C; this series of samples were denoted as Co@C-T-n, where the T-n refers to the pyrolysis temperatures. Structure characterization X-ray diffraction (XRD) patterns were obtained with a D/Max-IIIA X-ray diffractometer (Rigaku, Japan) using Cu Kα radiation. Thermogravimetric analyses (TGA) were carried out with a STA409PC thermogravimetric analyzer (Netzsch, German). The temperature range was 30 to 1000 °C with a heating rate of 10 °C/min in a nitrogen or air atmosphere (25 mL/min). Fourier Transform Infrared Spectrometer (FTIR) was conducted on a Tensor 27 spectrometer (Bruker, USA) in the range of 400–4000 cm−1 with a resolution of 4 cm−1 to obtain the IR spectra of the sample. Scanning electron microscope (SEM) was done using a Sigma 300 FESEM (ZEISS, German) to observe morphological and structural analysis. Transmission electron microscopy (TEM) was carried out on a JEM-2010 microscope (JEOL, Japan) using an accelerating voltage of 200 kV. N2 adsorption-desorption isotherms were measured with a Tristar 3010 isothermal nitrogen sorption analyzer (Micromeritics, USA) using a continuous adsorption procedure. X-ray photoelectron spectroscopy (XPS) was performed with an AXIS Ultra DLD (Kratos, Britain) to examine the electronic properties of catalysts. Catalyst evaluation Selective hydrogenation of furfural (FUR) was performed to evaluate the catalyst performance. In a typical experiment, 3 mmol furfural and 30 mg catalyst were dispersed in 10 mL ethanol. The mixture was transferred into a 25 ml autoclave (CF-0.05, HONGYI Instrument) equipped with a pressure gage. The autoclave was sealed, purged with H2 five times, and then filled with pressurized H2 to the required pressure. The autoclave was heated to the required temperature and the reaction was left for the required time. The products after reaction were analyzed by GC (Shimadzu GC-2–14C, FID) with a DM-WAX column (30 m × 0.32 mm × 0.25 µm) and GC–MS (Thermal Trace GC Ultra with a Polaris Q ion trap mass spectrometer equipped with a TR-5MS capillary column). The calculation of FUR conversion, product selectivity, and productivity was based on the following equations. The carbon balance was well than 95 %. (1) FUR conversion ( % ) = 100 − m o l e s o f s u b s t r a t e r e s i d u a l m o l e s o f s u b s t r a t e i n i t i a l l y × 100 (2) Selectivity ( % ) = m o l e s o f s p e c i f i c p r o d u c t s u m o f m o l e s o f d e t e c t e d o r g a n i c c o m p o u n d s × 100 (3) Productivity ( gFOL · gCo − 1 · h − 1 ) = m a s s o f F O L p r o d u c e d m a s s o f c o b a l t u s e d × h o u r s o f r e a c t i o n Result and discussion Synthesis of Co-MOF by coordinating cobalt ions with H2-BDC ligands Upon mixing cobalt ions with a mixed solvent, a transparent purple solution was obtained, which can remain unchanged even after undergoing hydrothermal treatment. As the ligands H2-BDC were mixed with the cobalt ions, pink precipitation was formed (seeing Figure S1 in SI), indicating strong coordination between the H2-BDC and cobalt ions that resulted in the production of Co-MOF. SEM images showcasing the as-synthesized Co-MOF is presented in Fig. 1 , where we can see a nest-like aggregation of 5–6 μm. This aggregated morphology can be interpreted as an assembly of short nanosheets with a size range of 500–800 nm. Other researchers have also reported the usage of H2-BDC as ligands to obtain nanosheet-like morphology[37,38]. The crystallinity of the resulting Co-MOF was assessed and characterized in Fig. 2a . The peaks in the XRD pattern are in agreement with those Co-MOF reported in the literature[39,40]. Specifically, the peaks at 8.9 and 18.1 o of 2θ correspond to the lamellar matrix of Co-MOF, which is often recognized as one of the reasons for the formation of sheet-like morphology. The nitrogen sorption plot, as depicted in Fig. 2b , indicates that the adsorption behavior of Co-MOF follows an III-type model based on Bunauer's classification. Notably, a bimodal porosity spanning the range of 5–20 nm and 30–200 nm is observed. This dual porosity can be attributed to the intertexture of nanosheets or the aggregation of particles. In the Fourier-transform infrared (FTIR) spectra of Fig. 2c, the Co-MOF held most of the peaks attributed to the H2-BDC ligands. Specifically, the asymmetric stretching of carboxyl groups is observed at 1630–1680 cm−1, symmetric stretching of C = O groups occurs at 1402 cm−1, CH stretching in the benzene ring is identified at 1140, 1100 cm−1, etc.[40–42]. Notably, a prominent blue shift from 1680 to 1630 − 1 upon the Co-MOF coordination suggests the formation of coordination bonds between the cobalt ions and H2-BDC ligands[43]. Fig. 2d shows the view of the Co-MOF along the b-axis, in which the H2-BDC ligands serve as a bridge to link the CoO6 octahedral units, constructing a layered three-dimensional structure[40]. Pyrolysis of Co-MOF to in situ generate carbon-coated cobalt catalysts Co@C A well-designed pyrolysis process could strongly affect the cobalt phase and carbon porosity, which is the key to access a carbon-supported cobalt catalyst; thus, we prepared a series of Co@C-T-n with various pyrolysis temperatures, where the T-n refers to the pyrolysis temperature. We initially examined the TG-DTG-DSC curves to explore the thermal properties of Co-MOF during pyrolysis. The TG curve (Fig. 3a ) exhibits three distinct regions corresponding to different pyrolysis kinetic. In the first region (50∼370 °C), an initial weight loss of ca. 5 % occurs due to the elimination of adsorbed water. This is followed by a subsequent weight loss of ca. 55 % in the range of 370∼550 °C, attributed to the pyrolysis of organic ligands. Beyond 550 °C, the system enters a thermally stable region [44]. Notably, the second region shows three prominent DTG peaks, indicating rapid pyrolysis kinetics. Consistent with this observation, three small DSC peaks are observed, indicating exothermic processes during this stage [40,45]. Comparing the TG curve of pure H2-BDC, seeing the dotted gray line and Fig. 3, we found that the coordination between the cobalt and H2-BDC renders the onset of pyrolysis temperature shifting toward high temperature (∼50 °C), suggesting the strong interaction between the ligands and cobalt ions. Correspondingly, the FTIR spectra in Fig. 3b demonstrate the change in the stretching of carbonyl group, as indicated by the characteristic bands at 1580 and 1500 cm−1, upon the pyrolysis. These distinct peaks persist in Co@C-T350, where the crystal structure of the Co-MOF crystal remains intact. Then they start to weaken in Co@C-T400, indicating the reduction of cobalt ions into CoOx. Finally, these peaks disappear in Co@C-T450, implying the dominance of CoOx in the cobalt phase. Fig. 4a shows the XRD pattern, revealing the crystallite phase for the Co@C-T-n. In Fig. 4b, the percentage of cobalt phase (CoO and metallic Co) and crystallite size are plotted against the pyrolysis temperature. Likewise, the crystallite phase undergoes changes corresponding to the carbonization temperature. The Co@C-T350 maintains its Co-MOF crystalline structure. The CoO phase (characterized by 36°, 42°, 62° and 73° of 2θ) [46,47] emerges on the Co@C-T400 alongside a reduction in the Co-MOF phase, and dominates the crystal phase on the Co@C-T450. Further elevate the temperature, the metallic cobalt (44°, 52° and 76° of 2θ) almost wholly substitutes the CoO phase on the Co@C-T500 [28,29,48,49]. The crystallite size of cobalt nanoparticles maintains a relatively narrow size range of 15–20 nm as the pyrolysis temperature increases. This indicates their excellent resistance to metal-sintering. The small particle size facilitates the accessibility of cobalt species, thus suggesting high catalytic activity. Besides the crystal phase of cobalt, the pyrolysis temperature can tune the carbon porosity. These Co@C-T-n catalysts exhibit similar profiles as those of Co-MOF, except for an emerging sorption step near the p/p0 =0, which increases with the pyrolysis temperature elevation (Fig. 5a ). As a result, besides the original bimodal porosity, a new micropore of 1–2 nm arises and increases to some extent upon the pyrolysis temperature, as shown in Fig. 5b. Combining the TG results (Fig. 3a), these newly emerged micropores should be ascribed to the removal of organic constituents within the sheet-like Co-MOF, which occurs in the corresponding temperature range of 400–550 °C. Fig. 5c plots the capacity evolution for the surface area and micropores as a function of pyrolysis temperature. High pyrolysis temperature results in increased surface area and microporosity, reaching the maximum values at around 550–575 °C. To offer more detailed information about the surface composition of catalysts, we conducted the X-ray photoelectron spectroscopy (XPS) characterization, as presented in Fig. 6 . The Co 2p3/2 spectra are analyzed and fitted with three individual peaks, attributable to the satellite shake-up peak (∼787 eV), Co2+ (∼782.5 eV), Co3+ (∼780.5 eV) and Co0 (∼779.3 eV) species, respectively[28,29,33,50,51]. With the increase in temperature, the intensity of the satellite peak weakens, and the population of the oxidized cobalt species (Co2+ and Co3+) gradually decreases—an observation akin to that of copper catalysts [52]. Consistent with this trend, the binding energies shift towards lower values and the amount of metallic cobalt species increases. Such an energy shift can be ascribed to the presence of metallic cobalt, and, potentially, to the charge transfer from the carbon to the cobalt[53,54]. However, it should be noted that even when subjected to high pyrolysis temperatures (500–600 °C), the Co@C sample still retains a certain proportion of oxidized cobalt species due to the inevitable passivation of surface cobalt during the sample preparation process. The increased number of surface metallic cobalt in Co@C-T500 and Co@C-T550, seeing Table S2 in SI, suggests that high pyrolysis temperatures could somewhat resist surface oxidation, which could also be seen as the result of strong interaction between the carbon and cobalt, as is indicated by the prominent charge transfer binding energy shift (seeing the dotted line in Fig. 6a). In the C 1 s spectra, the 284.8, 286 and 289 eV peaks are assigned to the C=C/C-C, C-O and O-C=O species[55,56]. The appearance of the O-C=O peak originates from residual carbon in organic ligands, which diminishes at higher pyrolysis temperatures. The morphology evolution upon the pyrolysis temperature is observed by the SEM images in Fig. 7 . The sheet-like morphology can be maintained intact as the Co-MOF crystallite is preserved. Upon pyrolysis, a portion of the Co-MOF underwent reduction of cobalt ions, leading to the formation of either CoO or metallic cobalt species. As a result, the nano-sheets exhibited shrinkage and folding, transforming into mono-dispersed nanoparticles within a size range of 50–100 nm, as shown in Co@C-T450. Interestingly, mono-dispersed microspheres of 1 μm are produced for the Co@C-T550, which can be seen as a spontaneous aggregation of these preformed cobalt nanoparticles (average size of 62 nm, Figure S3 in SI) undergoing pyrolysis. This unique nanoparticle-aggregate-microsphere may be associated with the sheet-like morphology of Co-MOF, and afford both highly-dispersed cobalt nanoparticles and mass-transfer channels, which may differentiate our Co@C from others[26,32,57,58]. Fig. 8 illustrates the high-resolution transmission electron microscopy (HRTEM) images of the Co@C-T550 sample. In Fig. 8b, the presence of a carbon coating with an approximate thickness of 5 nm is evident. The underlying carbon shell reveals lattice fringes measuring 0.20 nm and 0.24 nm, corresponding to the metal cobalt (111) and CoOx (220) inter-planes, respectively, as supported by previous studies[26,28,29,59]. The element mapping in Fig. 8c -f provides a visual representation of the distribution of each element, thereby confirming the core-shell structure by comparing the respective coverage regions. The presence of oxygen may originate from the passivation during sample preparation, according to our XPS analysis above. Based on the aforementioned findings and discussions, we depict the fabrication route for the Co@C, as shown in Scheme 1 above. The selected H2-BDC ligands and cobalt ions were dissolved simultaneously with a mixed solution (DMF+water+ethanol) in an autoclave, in which they coordinate simultaneously and form nanosheets via solvothermal synthesis. Underwent pyrolysis, these nanosheets are carbonized into carbon-coated cobalt nanoparticles, which are assembled into microspheres occasionally. Selective hydrogenation of FUR toward FOL Hydrogenative upgrading of furfural over the cobalt catalyst follows the reaction path shown in Scheme 2 , whereby the furfuryl alcohol (FOL) serves as a crucial intermediate leading to the production of 2-methyl furan (2-MF) or tetrahydro-furfuryl alcohol (THFOL), depending on specific catalysts and reaction parameters employed. In general, low temperature favors a high yield of FOL, while high temperature promotes the production of THFOL and 2-MF. Achieving a high FOL yield necessitates the utilization of a catalyst that exhibits exceptional activity under mild temperature conditions. The cobalt could activate the hydrogenation dissociation even at room temperature [60], which may allow a high FOL yield at a mild reaction. In a previous study[61], we reported a CoOx#TiO2 catalyst for furfural hydrogenation, which presented a high FOL productivity (31 gFOL·gCo −1·h − 1) at 140 °C, but rapidly decreased as the temperature declined. Herein, given a very mild reaction condition of 80 °C and 1 MPa of pH2, we evaluated the catalyst performance for our newly advanced Co@C catalyst. The blank tests ran without any catalyst or with pristine carbon suggest negligible FUR conversion (Entry 1–2, Table S3 in SI), while the pristine Co-MOF demonstrates trivial activity (Entry 3 in Table S3). As the metallic cobalt is introduced, the FUR conversion is observable on those tested catalysts. Both Co NPs and CoOx#TiO2 show low activity (<5 %), whereas the Co@C-T-n series display a FUR conversion following a volcano-type trend. Specifically, the Co@C-T-n carbonized at a temperature ≤ 450 oC has a very low FUR conversion (<10 %). When the metallic cobalt dictates the cobalt phase, the conversion rises gradually and reaches the highest value (63 %) for the Co@C-T550. These results suggest that the metallic cobalt sites, rather than the pristine Co-MOF or CoO, are the active centers for hydrogenation. Hence, we estimated the surface metallic cobalt sites based on the particle size and XPS-derived surface composition to justify the activity evolution trend, seeing Fig. 9b and Table S2 in SI. The FUR conversion correlates well with the surface metallic cobalt sites, suggesting the improved surface active sites responsible for the enhanced hydrogenation activity. Optimizing the pyrolysis conditions is crucial for achieving the desired catalytic performance. Previous studies by other scientists have reported that the optimized pyrolysis temperature ranged from 500 to 700 °C [29,30,62], which strongly relied on the synthesized strategies and kinds of reaction. In our case, considering the structural characterization results and reaction outcomes, the activity evolution with the pyrolysis temperature can be elucidated as follows: i) insufficient reduction degree is responsible for the low activity of Co@C pyrolyzed at low temperature (< 550 °C), and ii) particle growth and surface shrink lead to the activity decline on Co@C at high temperature, for example, Co@C-T600. Furthermore, under the given reaction conditions, it is noteworthy that furfuryl alcohol is the sole product obtained over the Co@C catalysts, in line with the finding that low temperature favors the production of FOL. To validate the reaction pathway mentioned in Scheme 2 and acquire a completed conversion of FUR on the optimized Co@C, we plotted the FUR conversion and product selectivity as a function of reaction time, seeing Fig. 10a . The Co@C-T550 converts the FUR linearly in the initial 60 min with the FOL being the exclusive product. Beyond 60 % conversion of the FUR, the FOL selectivity starts to decline, accompanied by a negligible amount (∼1 %) of the side products, such as tetrahydro furfuryl alcohol (THFOL) and 2-methyl furan (2-MF). The high FOL selectivity (>95 %) is sustained until the reaction proceeds 180 min, where the FUR is almost completely converted. Notably, when the FOL is used as the substrate, only a limited conversion (<5 %) is observed. These results indicate that, under the given conditions, the Co@C-T550 has a high activity of FUR hydrogenation to FOL, but low activity for further converting the FOL. Therefore, by selecting an appropriate reaction time, it is possible to achieve an excellent yield of FOL from FUR hydrogenation using the Co@C catalyst. It is noteworthy that conducting reactions at such low temperatures (∼80 °C) over the carbon-supported cobalt catalysts has been reported in some studies [54,62]. However, reports demonstrating high furfuryl alcohol (FOL) productivity under these conditions are relatively scarce. We compiled data on several representative carbon-supported cobalt catalysts in Fig. 10b and Table S1. Our Co@C-T550 exhibits an outstanding FOL productivity of 4.8 gFOL·gCo −1·h − 1 at 80 °C, surpassing the majority of catalysts reported by other research groups. This intriguing catalytic performance can primarily attributed to the abundant surface metallic cobalt sites, as confirmed by the XPS, XRD and HRTEM analysis. These catalytic sites benefit from the highly dispersed cobalt nanoparticles, sound resist-oxidation properties, aggregated-microsphere morphology and carbon-coated construction. Subsequently, we investigate and evaluate the performance of Co@C-T550 across a range of reaction temperatures and hydrogen pressure. The hydrogenation activity is strongly influenced by both the hydrogen pressure and temperature, as depicted in Fig. 11a . Analysis of the data obtained at various reaction temperatures enabled us to construct the Arrhenius curve for the Co@C-T550 catalyst (inset Fig. 11a), revealing an apparent activation energy (Ea) of approximately 40.7 kJ/mol. This value is comparable with the ones of several cobalt catalysts reported for mild furfural hydrogenation (50∼90 °C), as summarized in Table S4 in SI. Also, the decreased Ea suggests the lowered energy barrier for the Co@C-T550, which aligns well with its impressive activity compared to that of the Co NPs and CoOx#TiO2. In terms of product selectivity, the FOL is the dominant product within the given temperature range (80∼130 °C), particularly at low temperatures. When the reaction temperature rises, side products such as THFOL and 2-MF produced from the furan-ring hydrogenation and dehydroxylation become more prevalent, as shown in Fig. 11b. These results demonstrate the pivotal role of high activity under mild conditions in achieving a high yield of FOL. Reusability evaluation Besides the low-temperature activity, stability is another important consideration in practical usage for the supported catalysts. One widely recognized advantage of carbon-coating is its remarkable resistance to sintering and leaching during recycling operations. As expected, the Co@C-T550 demonstrates robust stability with limited activity and selectivity decline (<1 %) after 10 times consecutive runs (Fig. 12a ). To assess if the catalyst structure and composition are altered, we characterized the spent Co@C-T550 after 10 times runs, as presented in Fig. 12b -d. Compared with the fresh one, the spent Co@C-T550 shows a limited change in the cobalt crystalline phase, surface composition and surface area, as justified by the XRD, XPS and nitrogen sorption, etc. Encouragingly, ICP analysis confirms that the cobalt content remains nearly unchanged after repeated runs (Table S5 in SI). In a word, these findings validate the merit of the carbon-coating structure in effectively mitigating metal sintering and leaching phenomena. Conclusion In summary, based on the synthesis of sheet-like Co-MOF utilizing H2-BDC as organic ligands, we have successfully synthesized a novel and highly efficient catalyst comprising carbon-coated cobalt nanoparticles catalyst, Co@C, for the mild furfural hydrogenation. Beneficial to the carbon-coating and monodispersed particle size distribution, the optimized Co@C-T550 (pyrolysis temperature of 550 °C) had highly dispersed particle size and sound ability to resist sintering and reoxidation, affording a high number of active metallic cobalt sites. Consequently, this catalyst exhibits an outstanding productivity of FOL (4.8 gFOL·gCo −1·h−1) during mild furfural hydrogenation (80 °C and 1 MPa), surpassing the performance of most recently reported cobalt-based catalysts. Furthermore, the Co@C-T550 catalyst demonstrates reliable stability, exhibiting only marginal activity decay even after being subjected to ten cycles of recycling. This study expands the potential application of carbon-coated cobalt catalysts in the realm of low-temperature hydrogenation for biomass valorization. CRediT authorship contribution statement Wu Liu: Investigation, Validation, Data curation. Jieying Hua: Investigation, Methodology. Shuyi Su: Formal analysis. Xu Yang: Conceptualization, Methodology, Writing – original draft, Formal analysis, Resources. Declaration of Competing Interest The manuscript has been reviewed and approved by all authors. It is the first manuscript on this topic, submitted by us for publication in scientific Journals. No any other manuscript related to this topic will be submitted to other journals. Therefore, there is no any conflict of interest for this manuscript. Acknowledgments This work was supported by the Guangdong Provincial Key Laboratory of Plant Resources Biorefinery (No.2021GDKLPRB10) and the Key Laboratory of Fuel Cell Technology of Guangdong Province. Dr. X. Yang thanks the 100 Young Talents Program of the Guangdong University of Technology for financial support. Supplementary materials Supplementary material associated with this article can be found, in the online version, at doi:10.1016/j.mcat.2023.113647. Appendix Supplementary materials Image, application 1 References [1] S. Manikandan R. Subbaiya M. Biruntha R.Y. Krishnan G. Muthusamy N. Karmegam Recent development patterns, utilization and prospective of biofuel production: emerging nanotechnological intervention for environmental sustainability-a review Fuel 314 2022 122757 10.1016/j.fuel.2021.122757 S. Manikandan, R. Subbaiya, M. Biruntha, R.Y. Krishnan, G. Muthusamy, N. Karmegam, Recent development patterns, utilization and prospective of biofuel production: emerging nanotechnological intervention for environmental sustainability-a review, Fuel, 314 (2022) 122757, https://doi.org/10.1016/j.fuel.2021.122757. [2] L. Zhang T.U. Rao J. Wang D. Ren S. Sirisommboonchai C. Choi H. Machida Z. Huo K. Norinaga A review of thermal catalytic and electrochemical hydrogenation approaches for converting biomass-derived compounds to high-value chemicals and fuels Fuel Process. Technol. 226 2022 107097 10.1016/j.fuproc.2021.107097 L. Zhang, T.U. Rao, J. Wang, D. Ren, S. Sirisommboonchai, C. Choi, H. Machida, Z. Huo, K. Norinaga, A review of thermal catalytic and electrochemical hydrogenation approaches for converting biomass-derived compounds to high-value chemicals and fuels, Fuel Process. Technol., 226 (2022) 107097, https://doi.org/10.1016/j.fuproc.2021.107097. [3] Z. Zhao C. Yang P. Sun G. Gao Q. Liu Z. Huang F. Li Synergistic catalysis for promoting ring-opening hydrogenation of biomass-derived cyclic oxygenates ACS Catal. 13 2023 5170 5193 10.1021/acscatal.3c00317 Z. Zhao, C. Yang, P. Sun, G. Gao, Q. Liu, Z. Huang, F. Li, Synergistic catalysis for promoting ring-opening hydrogenation of biomass-derived cyclic oxygenates, ACS Catal., 13 (2023) 5170–5193, https://doi.org/10.1021/acscatal.3c00317. [4] L.J. Zhang T.U. Rao J.Y. Wang D.Z. Ren S. Sirisommboonchai C. Choi H. Machida Z.B. Huo K. Norinaga A review of thermal catalytic and electrochemical hydrogenation approaches for converting biomass-derived compounds to high-value chemicals and fuels Fuel Process. Technol. 226 2022 107097 10.1016/j.fuproc.2021.107097 L.J. Zhang, T.U. Rao, J.Y. Wang, D.Z. Ren, S. Sirisommboonchai, C. Choi, H. Machida, Z.B. Huo, K. Norinaga, A review of thermal catalytic and electrochemical hydrogenation approaches for converting biomass-derived compounds to high-value chemicals and fuels, Fuel Process. Technol., 226 (2022) 107097, https://doi.org/10.1016/j.fuproc.2021.107097. [5] A. Kumar P. Daw D. Milstein Homogeneous catalysis for sustainable energy: hydrogen and methanol economies, fuels from biomass, and related topics Chem. Rev. 122 2022 385 441 10.1021/acs.chemrev.1c00412 A. Kumar, P. Daw, D. Milstein, Homogeneous catalysis for sustainable energy: hydrogen and methanol economies, fuels from biomass, and related topics, Chem. Rev., 122 (2022) 385–441, https://doi.org/10.1021/acs.chemrev.1c00412. [6] Z. Huang Z. Zeng X. Zhu W. Zhao J. Lei Q. Xu Y. Yang X. Liu Boehmite-supported CuO as a catalyst for catalytic transfer hydrogenation of 5-hydroxymethylfurfural to 2,5-bis(hydroxymethyl)furan, Front Chem. Sci. Eng. 17 2023 415 424 10.1007/s11705-022-2225-4 Z. Huang, Z. Zeng, X. Zhu, W. Zhao, J. Lei, Q. Xu, Y. Yang, X. Liu, Boehmite-supported CuO as a catalyst for catalytic transfer hydrogenation of 5-hydroxymethylfurfural to 2,5-bis(hydroxymethyl)furan, Front. Chem. Sci. Eng., 17 (2023) 415–424, https://doi.org/10.1007/s11705-022-2225-4. [7] D. Guo X. Liu F. Cheng W. Zhao S. Wen Y. Xiang Q. Xu N. Yu D. Yin Selective hydrogenolysis of 5-hydroxymethylfurfural to produce biofuel 2, 5-dimethylfuran over Ni/ZSM-5 catalysts Fuel 274 2020 10.1016/j.fuel.2020.117853 D. Guo, X. Liu, F. Cheng, W. Zhao, S. Wen, Y. Xiang, Q. Xu, N. Yu, D. Yin, Selective hydrogenolysis of 5-hydroxymethylfurfural to produce biofuel 2, 5-dimethylfuran over Ni/ZSM-5 catalysts, Fuel, 274 (2020), https://doi.org/10.1016/j.fuel.2020.117853. [8] W. Zhao F. Wang K. Zhao X. Liu X. Zhu L. Yan Y. Yin Q. Xu D. Yin Recent advances in the catalytic production of bio-based diol 2,5-bis(hydroxymethyl)furan Carbon Resour. Convers 6 2023 116 131 10.1016/j.crcon.2023.01.001 W. Zhao, F. Wang, K. Zhao, X. Liu, X. Zhu, L. Yan, Y. Yin, Q. Xu, D. Yin, Recent advances in the catalytic production of bio-based diol 2,5-bis(hydroxymethyl)furan, Carbon Resour. Convers., 6 (2023) 116–131, https://doi.org/10.1016/j.crcon.2023.01.001. [9] B.S. Kumar A.J. Amali K. Pitchumani Heterogenization of cobalt nanoparticles on hollow carbon capsules: lab-in-capsule for catalytic transfer hydrogenation of carbonyl compounds Mol. Catal. 448 2018 153 161 10.1016/j.mcat.2018.01.036 B.S. Kumar, A.J. Amali, K. Pitchumani, Heterogenization of cobalt nanoparticles on hollow carbon capsules: lab-in-capsule for catalytic transfer hydrogenation of carbonyl compounds, Mol. Catal., 448 (2018) 153–161, https://doi.org/10.1016/j.mcat.2018.01.036. [10] A. Hu X. Lu D. Cai H. Pan R. Jing Q. Xia D. Zhou Y. Xia Selective hydrogenation of nitroarenes over MOF-derived Co@CN catalysts at mild conditions Mol. Catal. 472 2019 27 36 10.1016/j.mcat.2019.04.008 A. Hu, X. Lu, D. Cai, H. Pan, R. Jing, Q. Xia, D. Zhou, Y. Xia, Selective hydrogenation of nitroarenes over MOF-derived Co@CN catalysts at mild conditions, Mol. Catal., 472 (2019) 27–36, https://doi.org/10.1016/j.mcat.2019.04.008. [11] S. Said M. Elhossieny M. Riad S. Mikhail Pristine Cu (Co)/Fe layered double hydroxides (Co(Cu)/Fe-LDH) as active catalysts for the transalkylation of toluene to trimethylbenzenes Mol. Catal. 445 2018 213 222 10.1016/j.mcat.2017.11.038 S. Said, M. Elhossieny, M. Riad, S. Mikhail, Pristine Cu (Co)/Fe layered double hydroxides (Co(Cu)/Fe-LDH) as active catalysts for the transalkylation of toluene to trimethylbenzenes, Mol. Catal., 445 (2018) 213–222, https://doi.org/10.1016/j.mcat.2017.11.038. [12] N.T.T. Tran Y. Uemura A. Ramli T.H. Trinh Vapor-phase hydrodeoxygenation of lignin-derived bio-oil over Al-MCM-41 supported Pd-Co and Pd-Fe catalysts Mol. Catal. 523 2022 10.1016/j.mcat.2021.111435 N.T.T. Tran, Y. Uemura, A. Ramli, T.H. Trinh, Vapor-phase hydrodeoxygenation of lignin-derived bio-oil over Al-MCM-41 supported Pd-Co and Pd-Fe catalysts, Mol. Catal., 523 (2022), https://doi.org/10.1016/j.mcat.2021.111435. [13] Y. Shen C. Chen Z. Zou Z. Hu Z. Fu W. Li S. Pan Y. Zhang H. Zhang Z. Yu H. Zhao G. Wang Geometric and electronic effects of Co@NPC catalyst in chemoselective hydrogenation: tunable activity and selectivity via N,P co-doping J. Catal. 421 2023 65 76 10.1016/j.jcat.2023.03.013 Y. Shen, C. Chen, Z. Zou, Z. Hu, Z. Fu, W. Li, S. Pan, Y. Zhang, H. Zhang, Z. Yu, H. Zhao, G. Wang, Geometric and electronic effects of Co@NPC catalyst in chemoselective hydrogenation: tunable activity and selectivity via N,P co-doping, J. Catal., 421 (2023) 65–76, https://doi.org/10.1016/j.jcat.2023.03.013. [14] T.V. Sagar P. Kumar B. Žener A. Šuligoj K. Kočí U.L. Štangar Effective production of formic and acetic acid via CO2 hydrogenation with hydrazine by using ZrO2 catalysts Mol. Catal. 545 2023 113238 10.1016/j.mcat.2023.113238 T.V. Sagar, P. Kumar, B. Žener, A. Šuligoj, K. Kočí, U.L. Štangar, Effective production of formic and acetic acid via CO2 hydrogenation with hydrazine by using ZrO2 catalysts, Mol. Catal., 545 (2023) 113238, https://doi.org/10.1016/j.mcat.2023.113238. [15] J.G. Lee S. Yoon E. Yang J.H. Lee K. Song H.R. Moon K. An Structural evolution of ZIF-67-derived catalysts for furfural hydrogenation J. Catal. 392 2020 302 312 10.1016/j.jcat.2020.10.014 J.G. Lee, S. Yoon, E. Yang, J.H. Lee, K. Song, H.R. Moon, K. An, Structural evolution of ZIF-67-derived catalysts for furfural hydrogenation, J. Catal., 392 (2020) 302–312, https://doi.org/10.1016/j.jcat.2020.10.014. [16] P. Sudarsanam E. Peeters E.V. Makshina V.I. Parvulescu B.F. Sels Advances in porous and nanoscale catalysts for viable biomass conversion Chem. Soc. Rev. 48 2019 2366 2421 10.1039/c8cs00452h P. Sudarsanam, E. Peeters, E.V. Makshina, V.I. Parvulescu, B.F. Sels, Advances in porous and nanoscale catalysts for viable biomass conversion, Chem. Soc. Rev., 48 (2019) 2366–2421, https://doi.org/10.1039/c8cs00452h. [17] C. Chatterjee F. Pong A. Sen Chemical conversion pathways for carbohydrates Green Chem 17 2015 40 71 10.1039/C4GC01062K C. Chatterjee, F. Pong, A. Sen, Chemical conversion pathways for carbohydrates, Green Chem., 17 (2015) 40–71, https://doi.org/10.1039/C4GC01062K. [18] P. Liu L. Sun X. Jia C. Zhang W. Zhang Y. Song H. Wang C. Li Efficient one-pot conversion of furfural into 2-methyltetrahydrofuran using non-precious metal catalysts Mol. Catal. 490 2020 10.1016/j.mcat.2020.110951 P. Liu, L. Sun, X. Jia, C. Zhang, W. Zhang, Y. Song, H. Wang, C. Li, Efficient one-pot conversion of furfural into 2-methyltetrahydrofuran using non-precious metal catalysts, Mol. Catal., 490 (2020), https://doi.org/10.1016/j.mcat.2020.110951. [19] D. Raikwar S. Majumdar D. Shee Synergistic effect of Ni-Co alloying on hydrodeoxygenation of guaiacol over Ni-Co/Al2O3 catalysts Mol. Catal. 499 2021 10.1016/j.mcat.2020.111290 D. Raikwar, S. Majumdar, D. Shee, Synergistic effect of Ni-Co alloying on hydrodeoxygenation of guaiacol over Ni-Co/Al2O3 catalysts, Mol. Catal., 499 (2021), https://doi.org/10.1016/j.mcat.2020.111290. [20] X. Gong N. Li Y. Li R. Hu The catalytic hydrogenation of furfural to 2-methylfuran over the Mg-Al oxides supported Co-Ni bimetallic catalysts Mol. Catal. 531 2022 10.1016/j.mcat.2022.112651 X. Gong, N. Li, Y. Li, R. Hu, The catalytic hydrogenation of furfural to 2-methylfuran over the Mg-Al oxides supported Co-Ni bimetallic catalysts, Mol. Catal., 531 (2022), https://doi.org/10.1016/j.mcat.2022.112651. [21] L. Chang Y. Li One-step encapsulation of Pt-Co bimetallic nanoparticles within MOFs for advanced room temperature nanocatalysis Mol. Catal. 433 2017 77 83 10.1016/j.mcat.2017.01.009 L. Chang, Y. Li, One-step encapsulation of Pt-Co bimetallic nanoparticles within MOFs for advanced room temperature nanocatalysis, Mol. Catal., 433 (2017) 77–83, https://doi.org/10.1016/j.mcat.2017.01.009. [22] M. Wang P. Wang G. Zhang Z. Cheng M. Zhang Y. Liu R. Li J. Zhu J. Wang K. Bian Y. Liu F. Ding T.P. Senftle X. Nie Q. Fu C. Song X. Guo Stabilizing Co2C with H2O and K promoter for CO2 hydrogenation to C2+ hydrocarbons Sci. Adv. 9 2023 eadg0167 10.1126/sciadv.adg0167 M. Wang, P. Wang, G. Zhang, Z. Cheng, M. Zhang, Y. Liu, R. Li, J. Zhu, J. Wang, K. Bian, Y. Liu, F. Ding, T.P. Senftle, X. Nie, Q. Fu, C. Song, X. Guo, Stabilizing Co2C with H2O and K promoter for CO2 hydrogenation to C2+ hydrocarbons, Sci. Adv., 9 (2023) eadg0167, https://doi.org/10.1126/sciadv.adg0167. [23] H. Wang Y. Wang Y. Li X. Lan B. Ali T. Wang Highly efficient hydrogenation of nitroarenes by N-doped carbon-supported cobalt single-atom catalyst in ethanol/water mixed solvent ACS Appl. Mater. Inter. 12 2020 34021 34031 10.1021/acsami.0c06632 H. Wang, Y. Wang, Y. Li, X. Lan, B. Ali, T. Wang, Highly efficient hydrogenation of nitroarenes by N-doped carbon-supported cobalt single-atom catalyst in ethanol/water mixed solvent, ACS Appl. Mater. Inter., 12 (2020) 34021–34031, https://doi.org/10.1021/acsami.0c06632. [24] J. Jiang Y. Fang Y. Zhao L. Zhao B. Jin One-step annealing synthesis of Co core-PdZn intermetallic shell composite as a bifunctional oxygen electrocatalyst for zinc-air batteries Mol. Catal. 547 2023 10.1016/j.mcat.2023.113313 J. Jiang, Y. Fang, Y. Zhao, L. Zhao, B. Jin, One-step annealing synthesis of Co core-PdZn intermetallic shell composite as a bifunctional oxygen electrocatalyst for zinc-air batteries, Mol. Catal., 547 (2023), https://doi.org/10.1016/j.mcat.2023.113313. [25] N. Hammi S. Chen C. Michon S. Royer A. El Kadib Cu nanoparticles embedded on reticular chitosan-derived N-doped carbon: application to the catalytic hydrogenation of alkenes, alkynes and N-heteroarenes Mol. Catal. 519 2022 10.1016/j.mcat.2021.112104 N. Hammi, S. Chen, C. Michon, S. Royer, A. El Kadib, Cu nanoparticles embedded on reticular chitosan-derived N-doped carbon: application to the catalytic hydrogenation of alkenes, alkynes and N-heteroarenes, Mol. Catal., 519 (2022), https://doi.org/10.1016/j.mcat.2021.112104. [26] Z.X. Zhai J. Chu L. Sun X. Zhao D.J. Huang X.Q. Yang C.F. Zhuang C.A. Min Y. Wang Ultrahigh metal content carbon-based catalyst for efficient hydrogenation of furfural: the regulatory effect of glycerol ACS Appl. Mater. Inter. 14 2022 44439 44449 10.1021/acsami.2c12874 Z.X. Zhai, J. Chu, L. Sun, X. Zhao, D.J. Huang, X.Q. Yang, C.F. Zhuang, C.A. Min, Y. Wang, Ultrahigh metal content carbon-based catalyst for efficient hydrogenation of furfural: the regulatory effect of glycerol, ACS Appl. Mater. Inter., 14 (2022) 44439–44449, https://doi.org/10.1021/acsami.2c12874. [27] V.I. Isaeva, O.M. Nefedov, L.M. Kustov, Metal–organic frameworks-based catalysts for biomass processing, catalysts, 8 (2018) 368, doi:10.3390/catal8090368. [28] W. Zhao X. Zhu Z. Zeng J. Lei Z. Huang Q. Xu X. Liu Y. Yang Cu-Co nanoparticles supported on nitrogen-doped carbon: an efficient catalyst for hydrogenation of 5-hydroxymethylfurfural into 2,5-bis(hydroxymethyl)furan Mol. Catal. 524 2022 10.1016/j.mcat.2022.112304 W. Zhao, X. Zhu, Z. Zeng, J. Lei, Z. Huang, Q. Xu, X. Liu, Y. Yang, Cu-Co nanoparticles supported on nitrogen-doped carbon: an efficient catalyst for hydrogenation of 5-hydroxymethylfurfural into 2,5-bis(hydroxymethyl)furan, Mol. Catal., 524 (2022), https://doi.org/10.1016/j.mcat.2022.112304. [29] Z. Zeng L. Yang X. Zhu W. Zhao X. Liu Z. Huang Q. Xu W. Zhong Highly selective production of the biofuel 2,5-dimethylfuran from 5-hydroxymethylfurfural over Co/N–C catalysts React. Chem. Eng. 8 2023 455 464 10.1039/d2re00339b Z. Zeng, L. Yang, X. Zhu, W. Zhao, X. Liu, Z. Huang, Q. Xu, W. Zhong, Highly selective production of the biofuel 2,5-dimethylfuran from 5-hydroxymethylfurfural over Co/N–C catalysts, React. Chem. Eng., 8 (2023) 455–464, https://doi.org/10.1039/d2re00339b. [30] Z. Yang X.-S. Cong D.-G. Teng X.-Y. Wei Z.-X. Li H.-S. Xie Facile selective hydrogenation of bio-based furfural to furfuryl alcohol via a ZIF-67-derived Co-based catalyst Fuel Process. Technol. 239 2023 10.1016/j.fuproc.2022.107507 Z. Yang, X.-.S. Cong, D.-.G. Teng, X.-.Y. Wei, Z.-.X. Li, H.-.S. Xie, Facile selective hydrogenation of bio-based furfural to furfuryl alcohol via a ZIF-67-derived Co-based catalyst, Fuel Process. Technol., 239 (2023), https://doi.org/10.1016/j.fuproc.2022.107507. [31] L. Zhang L.L. Cheng Y.C. Hu Q.G. Xiao X.F. Chen W.Y. Lu Robust Co3O4 nanocatalysts supported on biomass-derived porous N-doped carbon toward low-pressure hydrogenation of furfural Front. Mater. Sci. 17 2023 10.1007/s11706-023-0645-9 L. Zhang, L.L. Cheng, Y.C. Hu, Q.G. Xiao, X.F. Chen, W.Y. Lu, Robust Co3O4 nanocatalysts supported on biomass-derived porous N-doped carbon toward low-pressure hydrogenation of furfural, Front. Mater. Sci., 17 (2023), https://doi.org/10.1007/s11706-023-0645-9. [32] S.J. Li Y.F. Fan C.H. Wu C.F. Zhuang Y. Wang X.M. Li J. Zhao Z.F. Zheng Selective hydrogenation of furfural over the Co-based catalyst: a subtle synergy with Ni and Zn dopants ACS Appl. Mater. Inter. 13 2021 8507 8517 10.1021/acsami.1c01436 S.J. Li, Y.F. Fan, C.H. Wu, C.F. Zhuang, Y. Wang, X.M. Li, J. Zhao, Z.F. Zheng, Selective hydrogenation of furfural over the Co-based catalyst: a subtle synergy with Ni and Zn dopants, ACS Appl. Mater. Inter., 13 (2021) 8507–8517, https://doi.org/10.1021/acsami.1c01436. [33] Z. Yang X.S. Cong D.G. Teng X.Y. Wei Z.X. Li H.S. Xie Facile selective hydrogenation of bio-based furfural to furfuryl alcohol via a ZIF-67-derived Co-based catalyst Fuel Process. Technol. 239 2023 107507 10.1016/j.fuproc.2022.107507 Z. Yang, X.S. Cong, D.G. Teng, X.Y. Wei, Z.X. Li, H.S. Xie, Facile selective hydrogenation of bio-based furfural to furfuryl alcohol via a ZIF-67-derived Co-based catalyst, Fuel Process. Technol., 239 (2023) 107507, https://doi.org/10.1016/j.fuproc.2022.107507. [34] K. Murugesan T. Senthamarai M. Sohail A.S. Alshammari M.-M. Pohl M. Beller R.V. Jagadeesh Cobalt-based nanoparticles prepared from MOF-carbon templates as efficient hydrogenation catalysts Chem. Sci. 9 2018 8553 8560 10.1039/c8sc02807a K. Murugesan, T. Senthamarai, M. Sohail, A.S. Alshammari, M.-.M. Pohl, M. Beller, R.V. Jagadeesh, Cobalt-based nanoparticles prepared from MOF-carbon templates as efficient hydrogenation catalysts, Chem. Sci., 9 (2018) 8553–8560, https://doi.org/10.1039/c8sc02807a. [35] V.G. Chandrashekhar K. Natte A.M. Alenad A.S. Alshammari C. Kreyenschulte R.V. Jagadeesh Reductive amination, hydrogenation and hydrodeoxygenation of 5-Hydroxymethylfurfural using Silica-supported Cobalt- Nanoparticles ChemCatChem 14 2021 10.1002/cctc.202101234 V.G. Chandrashekhar, K. Natte, A.M. Alenad, A.S. Alshammari, C. Kreyenschulte, R.V. Jagadeesh, Reductive amination, hydrogenation and hydrodeoxygenation of 5-Hydroxymethylfurfural using Silica-supported Cobalt- Nanoparticles, ChemCatChem, 14 (2021), https://doi.org/10.1002/cctc.202101234. [36] D.O. Miles D. Jiang A.D. Burrows J.E. Halls F. Marken Conformal transformation of [Co(bdc)(DMF)] (Co-MOF-71, bdc = 1,4-benzenedicarboxylate, DMF = N,N-dimethylformamide) into porous electrochemically active cobalt hydroxide Electrochem. Commun. 27 2013 9 13 10.1016/j.elecom.2012.10.039 D.O. Miles, D. Jiang, A.D. Burrows, J.E. Halls, F. Marken, Conformal transformation of [Co(bdc)(DMF)] (Co-MOF-71, bdc = 1,4-benzenedicarboxylate, DMF = N,N-dimethylformamide) into porous electrochemically active cobalt hydroxide, Electrochem. Commun., 27 (2013) 9–13, https://doi.org/10.1016/j.elecom.2012.10.039. [37] D. Kim K.W. Park J.T. Park I. Choi Photoactive MOF-derived bimetallic silver and cobalt nanocomposite with enhanced antibacterial activity ACS Appl. Mater. Inter. 15 2023 22903 22914 10.1021/acsami.3c01529 D. Kim, K.W. Park, J.T. Park, I. Choi, Photoactive MOF-derived bimetallic silver and cobalt nanocomposite with enhanced antibacterial activity, ACS Appl. Mater. Inter., 15 (2023) 22903–22914, https://doi.org/10.1021/acsami.3c01529. [38] G. Wang Z. Yan N. Wang M. Xiang Z. Xu H. Zhu Bulk doping nickel–cobalt metal organic framework nanosheet arrays for performance-boosted hybrid supercapacitors J. Mater. Res. 37 2022 1714 1726 10.1557/s43578-022-00567-5 G. Wang, Z. Yan, N. Wang, M. Xiang, Z. Xu, H. Zhu, Bulk doping nickel–cobalt metal organic framework nanosheet arrays for performance-boosted hybrid supercapacitors, J. Mater. Res., 37 (2022) 1714–1726, https://doi.org/10.1557/s43578-022-00567-5. [39] X. Hu H. Hu C. Li T. Li X. Lou Q. Chen B. Hu Cobalt-based metal organic framework with superior lithium anodic performance J. Solid State Chem. 242 2016 71 76 10.1016/j.jssc.2016.07.021 X. Hu, H. Hu, C. Li, T. Li, X. Lou, Q. Chen, B. Hu, Cobalt-based metal organic framework with superior lithium anodic performance, J. Solid State Chem., 242 (2016) 71–76, https://doi.org/10.1016/j.jssc.2016.07.021. [40] J. Yang Z. Ma W. Gao M. Wei Layered structural Co-based MOF with conductive network frames as a new supercapacitor electrode Chemistry (Easton) 23 2017 631 636 10.1002/chem.201604071 J. Yang, Z. Ma, W. Gao, M. Wei, Layered structural Co-based MOF with conductive network frames as a new supercapacitor electrode, Chemistry (Easton), 23 (2017) 631–636, https://doi.org/10.1002/chem.201604071. [41] J. Cao C. Guo Z. Chen Loading and release mechanisms of MOF-5@BTA-X (X = -CH3/-NH2/-CO(CH2)6CH3): experimental and theoretical investigations Colloids Surf., A 666 2023 131274 10.1016/j.colsurfa.2023.131274 J. Cao, C. Guo, Z. Chen, Loading and release mechanisms of MOF-5@BTA-X (X = -CH3/-NH2/-CO(CH2)6CH3): experimental and theoretical investigations, Colloids Surf., A, 666 (2023) 131274, https://doi.org/10.1016/j.colsurfa.2023.131274. [42] P. Miao L. Zhang J. Zhang M. Ma Y. Du J. Gan J. Yang Metal organic framework- modified monolithic column immobilized with pepsin for enantioseparation in capillary electrochromatography J. Chromatogr. B 1203 2022 123306 10.1016/j.jchromb.2022.123306 P. Miao, L. Zhang, J. Zhang, M. Ma, Y. Du, J. Gan, J. Yang, Metal organic framework- modified monolithic column immobilized with pepsin for enantioseparation in capillary electrochromatography, J. Chromatogr. B, 1203 (2022) 123306, https://doi.org/10.1016/j.jchromb.2022.123306. [43] N.T.S. Phan K.K.A. Le T.D. Phan MOF-5 as an efficient heterogeneous catalyst for friedel–crafts alkylation reactions Appl. Catal., A 382 2010 246 253 10.1016/j.apcata.2010.04.053 N.T.S. Phan, K.K.A. Le, T.D. Phan, MOF-5 as an efficient heterogeneous catalyst for friedel–crafts alkylation reactions, Appl. Catal., A, 382 (2010) 246–253, https://doi.org/10.1016/j.apcata.2010.04.053. [44] Z.-L. Huang M. Drillon N. Masciocchi A. Sironi J.-T. Zhao P. Rabu P. Panissod Ab-Initio XRPD crystal structure and giant hysteretic effect (Hc = 5.9 T) of a new hybrid terephthalate-based cobalt(II) magnet Chem. Mater. 12 2000 2805 2812 10.1021/cm000386c Z.-.L. Huang, M. Drillon, N. Masciocchi, A. Sironi, J.-.T. Zhao, P. Rabu, P. Panissod, Ab-Initio XRPD crystal structure and giant hysteretic effect (Hc = 5.9 T) of a new hybrid terephthalate-based cobalt(II) magnet, Chem. Mater., 12 (2000) 2805–2812, https://doi.org/10.1021/cm000386c. [45] S. Kurihara S. Nomiyama T. Nonaka Photochemical switching between a compensated nematic phase and a twisted nematic phase by photoisomerization of chiral azobenzene molecules Chem. Mater. 12 2000 9 12 10.1021/cm9901616 S. Kurihara, S. Nomiyama, T. Nonaka, Photochemical switching between a compensated nematic phase and a twisted nematic phase by photoisomerization of chiral azobenzene molecules, Chem. Mater., 12 (2000) 9–12, https://doi.org/10.1021/cm9901616. [46] S.S. Jiang F. Li J. Huang Y. Wang S.Y. Lu P. Li C.Q. Li Catalytic transfer hydrogenation of furfural over magnetic carbon-encapsulated CoO@C catalyst ChemistrySelect 5 2020 9883 9892 10.1002/slct.202002269 S.S. Jiang, F. Li, J. Huang, Y. Wang, S.Y. Lu, P. Li, C.Q. Li, Catalytic transfer hydrogenation of furfural over magnetic carbon-encapsulated CoO@C catalyst, ChemistrySelect, 5 (2020) 9883–9892, https://doi.org/10.1002/slct.202002269. [47] C. Nguyen-Huy J. Lee J.H. Seo E. Yang J. Lee K. Choi H. Lee J.H. Kim M.S. Lee S.H. Joo J.H. Kwak J.H. Lee K. An Structure-dependent catalytic properties of mesoporous cobalt oxides in furfural hydrogenation Appl. Catal., A 583 2019 117125 10.1016/j.apcata.2019.117125 C. Nguyen-Huy, J. Lee, J.H. Seo, E. Yang, J. Lee, K. Choi, H. Lee, J.H. Kim, M.S. Lee, S.H. Joo, J.H. Kwak, J.H. Lee, K. An, Structure-dependent catalytic properties of mesoporous cobalt oxides in furfural hydrogenation, Appl. Catal., A, 583 (2019) 117125, https://doi.org/10.1016/j.apcata.2019.117125. [48] H. Li J. Liu C. Cai H. Wang Y. Huang C. Wang L. Ma Selectivity catalytic transfer hydrogenation of biomass-based furfural to cyclopentanone Fuel 332 2023 126057 10.1016/j.fuel.2022.126057 H. Li, J. Liu, C. Cai, H. Wang, Y. Huang, C. Wang, L. Ma, Selectivity catalytic transfer hydrogenation of biomass-based furfural to cyclopentanone, Fuel, 332 (2023) 126057, https://doi.org/10.1016/j.fuel.2022.126057. [49] Z. Zhang Z. Zhang X. Zhang F. Wang Z. Wang Y. Li X. Wang R. Ahishakiye X. Zhang Single pot selective conversion of furfural into 2-methylfuran over a Co-CoOx/AC bifunctional catalyst Appl. Surf. Sci. 612 2023 10.1016/j.apsusc.2022.155871 Z. Zhang, Z. Zhang, X. Zhang, F. Wang, Z. Wang, Y. Li, X. Wang, R. Ahishakiye, X. Zhang, Single pot selective conversion of furfural into 2-methylfuran over a Co-CoOx/AC bifunctional catalyst, Appl. Surf. Sci., 612 (2023), https://doi.org/10.1016/j.apsusc.2022.155871. [50] V. Ranaware R.G. Kurniawan D. Verma S.K. Kwak B.C. Ryu J.W. Kang J. Kim Solvent-mediated selectivity control of furfural hydrogenation over a N-doped carbon-nanotube-supported Co/CoOx catalyst Appl. Catal., B 318 2022 121838 10.1016/j.apcatb.2022.121838 V. Ranaware, R.G. Kurniawan, D. Verma, S.K. Kwak, B.C. Ryu, J.W. Kang, J. Kim, Solvent-mediated selectivity control of furfural hydrogenation over a N-doped carbon-nanotube-supported Co/CoOx catalyst, Appl. Catal., B, 318 (2022) 121838, https://doi.org/10.1016/j.apcatb.2022.121838. [51] J. Long Y. Zhou Y. Li Transfer hydrogenation of unsaturated bonds in the absence of base additives catalyzed by a cobalt-based heterogeneous catalyst Chem. Commun. 51 2015 2331 2334 10.1039/c4cc08946d J. Long, Y. Zhou, Y. Li, Transfer hydrogenation of unsaturated bonds in the absence of base additives catalyzed by a cobalt-based heterogeneous catalyst, Chem. Commun., 51 (2015) 2331–2334, https://doi.org/10.1039/c4cc08946d. [52] Z. Zhang R. Guo X. Yang Y.-X. Fang Potassium carbonate (K2CO3)-assisted copper-catalyzed liquid-phase hydrogenation of furfural: striking promotion synergy enables a superior high furfuryl alcohol yield at mild reaction conditions Ind. Eng. Chem. Res. 61 2022 16643 16652 10.1021/acs.iecr.2c02209 Z. Zhang, R. Guo, X. Yang, Y.-.X. Fang, Potassium carbonate (K2CO3)-assisted copper-catalyzed liquid-phase hydrogenation of furfural: striking promotion synergy enables a superior high furfuryl alcohol yield at mild reaction conditions, Ind. Eng. Chem. Res., 61 (2022) 16643–16652, https://doi.org/10.1021/acs.iecr.2c02209. [53] G. Wang X. Nie X. Ji X. Quan S. Chen H. Wang H. Yu X. Guo Enhanced heterogeneous activation of peroxymonosulfate by Co and N codoped porous carbon for degradation of organic pollutants: the synergism between Co and N Environ. Sci.: Nano 6 2019 399 410 10.1039/C8EN01231H G. Wang, X. Nie, X. Ji, X. Quan, S. Chen, H. Wang, H. Yu, X. Guo, Enhanced heterogeneous activation of peroxymonosulfate by Co and N codoped porous carbon for degradation of organic pollutants: the synergism between Co and N, Environ. Sci.: Nano, 6 (2019) 399–410, https://doi.org/10.1039/C8EN01231H. [54] Z. Shen L. Hong B. Zheng G. Wang B. Zhang Z. Wang F. Zhan S. Shen R. Yun Highly efficient and chemoselective hydrogenation of nitro compounds into amines by nitrogen-doped porous carbon-supported Co/Ni bimetallic nanoparticles Inorg. Chem. 60 2021 16834 16839 10.1021/acs.inorgchem.1c02740 Z. Shen, L. Hong, B. Zheng, G. Wang, B. Zhang, Z. Wang, F. Zhan, S. Shen, R. Yun, Highly efficient and chemoselective hydrogenation of nitro compounds into amines by nitrogen-doped porous carbon-supported Co/Ni bimetallic nanoparticles, Inorg. Chem., 60 (2021) 16834–16839, https://doi.org/10.1021/acs.inorgchem.1c02740. [55] S. Jiang F. Li J. Huang Y. Wang S. Lu P. Li C. Li Catalytic transfer hydrogenation of furfural over magnetic carbon-encapsulated CoO@C catalyst ChemistrySelect 5 2020 9883 9892 10.1002/slct.202002269 S. Jiang, F. Li, J. Huang, Y. Wang, S. Lu, P. Li, C. Li, Catalytic transfer hydrogenation of furfural over magnetic carbon-encapsulated CoO@C catalyst, ChemistrySelect, 5 (2020) 9883–9892, https://doi.org/10.1002/slct.202002269. [56] W. Zhao Z. Huang L. Yang X. Liu H. Xie Z. Liu Highly efficient syntheses of 2,5-bis(hydroxymethyl)furan and 2,5-dimethylfuran via the hydrogenation of biomass-derived 5-hydroxymethylfurfural over a nickel–cobalt bimetallic catalyst Appl. Surf. Sci. 577 2022 10.1016/j.apsusc.2021.151869 W. Zhao, Z. Huang, L. Yang, X. Liu, H. Xie, Z. Liu, Highly efficient syntheses of 2,5-bis(hydroxymethyl)furan and 2,5-dimethylfuran via the hydrogenation of biomass-derived 5-hydroxymethylfurfural over a nickel–cobalt bimetallic catalyst, Appl. Surf. Sci., 577 (2022), https://doi.org/10.1016/j.apsusc.2021.151869. [57] L. Huang F. Hao Y. Lv Y. Liu P.L. Liu W. Xiong H.A. Luo MOF-derived well-structured bimetallic catalyst for highly selective conversion of furfural Fuel 289 2021 10.1016/j.fuel.2020.119910 L. Huang, F. Hao, Y. Lv, Y. Liu, P.L. Liu, W. Xiong, H.A. Luo, MOF-derived well-structured bimetallic catalyst for highly selective conversion of furfural, Fuel, 289 (2021), https://doi.org/10.1016/j.fuel.2020.119910. [58] Z.X. Li X.Y. Wei Z. Yang J. Li W.W. Yan L.L. Bie Y.Y. Zhang S. Li Z.M. Zong Selective hydrogenation of bio-based furfural over Co-based catalysts derived from zeolitic imidazolate frame materials Mol. Catal. 492 2020 10.1016/j.mcat.2020.111007 Z.X. Li, X.Y. Wei, Z. Yang, J. Li, W.W. Yan, L.L. Bie, Y.Y. Zhang, S. Li, Z.M. Zong, Selective hydrogenation of bio-based furfural over Co-based catalysts derived from zeolitic imidazolate frame materials, Mol. Catal., 492 (2020), https://doi.org/10.1016/j.mcat.2020.111007. [59] H. Qin S. Kang Y. Wang H. Liu Z. Ni Y. Huang Y. Li X. Li Lignin-based fabrication of Co@C core–shell nanoparticles as efficient catalyst for selective fischer–tropsch synthesis of C5+ compounds ACS Sustain. Chem. Eng. 4 2016 1240 1247 10.1021/acssuschemeng.5b01269 H. Qin, S. Kang, Y. Wang, H. Liu, Z. Ni, Y. Huang, Y. Li, X. Li, Lignin-based fabrication of Co@C core–shell nanoparticles as efficient catalyst for selective fischer–tropsch synthesis of C5+ compounds, ACS Sustain. Chem. Eng., 4 (2016) 1240–1247, https://doi.org/10.1021/acssuschemeng.5b01269. [60] L. Liu P. Concepción A. Corma Non-noble metal catalysts for hydrogenation: a facile method for preparing Co nanoparticles covered with thin layered carbon J. Catal. 340 2016 1 9 10.1016/j.jcat.2016.04.006 L. Liu, P. Concepción, A. Corma, Non-noble metal catalysts for hydrogenation: a facile method for preparing Co nanoparticles covered with thin layered carbon, J. Catal., 340 (2016) 1–9, https://doi.org/10.1016/j.jcat.2016.04.006. [61] J. Chen X. Luo X. Wang X. Yang Role of benzene tricarboxylic acid in regulating cobalt-titania interface-interaction to access highly dispersed cobalt nanoparticles catalyst Appl. Catal., A 659 2023 119182 10.1016/j.apcata.2023.119182 J. Chen, X. Luo, X. Wang, X. Yang, Role of benzene tricarboxylic acid in regulating cobalt-titania interface-interaction to access highly dispersed cobalt nanoparticles catalyst, Appl. Catal., A, 659 (2023) 119182, https://doi.org/10.1016/j.apcata.2023.119182. [62] S. Chen L.-L. Ling S.-F. Jiang H. Jiang Selective hydrogenation of nitroarenes under mild conditions by the optimization of active sites in a well defined Co@NC catalyst Green Chem 22 2020 5730 5741 10.1039/D0GC01835J S. Chen, L.-.L. Ling, S.-.F. Jiang, H. Jiang, Selective hydrogenation of nitroarenes under mild conditions by the optimization of active sites in a well defined Co@NC catalyst, Green Chem., 22 (2020) 5730–5741, https://doi.org/10.1039/D0GC01835J.",
      "scopus-id": "85175027499",
      "coredata": {
        "eid": "1-s2.0-S2468823123007307",
        "dc:description": "The hydrogenative upgrading of furfural into valuable chemical intermediates has currently caught intensive research interest, with robust and efficient catalysts that can operate under mild reaction conditions remaining challenging. In this study, we presented a high-performance carbon-coated cobalt catalyst (Co@C) through pyrolysis of sheet-like Co-MOF. The optimized Co@C-T550 exhibited an intriguing furfural conversion rate under a very mild reaction condition of 80 °C and 1 MPa. The catalyst's enhanced activity at low-temperature effectively suppressed side reactions, resulting in an excellent furfuryl alcohol productivity of 4.8 gFOL·gCo −1·h−1, surpassing most cobalt-based catalysts reported in recent literature. Furthermore, the high performance of Co@C-T550 can be sustained with slight decay even after undergoing 10 recycling runs, underscoring the reliable stability of the catalyst. Structure characterizations have revealed that this novel Co@C-T550 had highly dispersed cobalt nanoparticles with a microporous carbon coating, affording a high number of metallic cobalt sites with an excellent ability to resist cobalt sintering/leaching and re-oxidation. The insights gained from this study provide a solid foundation for the rational design of advanced carbon-coated cobalt catalysts for low-temperature hydrogenative biomass upgrading.",
        "openArchiveArticle": "false",
        "prism:coverDate": "2023-12-31",
        "openaccessUserLicense": null,
        "prism:aggregationType": "Journal",
        "prism:url": "https://api.elsevier.com/content/article/pii/S2468823123007307",
        "dc:creator": [
          {
            "@_fa": "true",
            "$": "Liu, Wu"
          },
          {
            "@_fa": "true",
            "$": "Hua, Jieying"
          },
          {
            "@_fa": "true",
            "$": "Su, Shuyi"
          },
          {
            "@_fa": "true",
            "$": "Yang, Xu"
          }
        ],
        "link": [
          {
            "@_fa": "true",
            "@rel": "self",
            "@href": "https://api.elsevier.com/content/article/pii/S2468823123007307"
          },
          {
            "@_fa": "true",
            "@rel": "scidir",
            "@href": "https://www.sciencedirect.com/science/article/pii/S2468823123007307"
          }
        ],
        "dc:format": "application/json",
        "openaccessType": null,
        "pii": "S2468-8231(23)00730-7",
        "prism:volume": "551",
        "articleNumber": "113647",
        "prism:publisher": "Elsevier B.V.",
        "dc:title": "A highly accessible and robust carbon-coated cobalt nanoparticle catalyst for furfural hydrogenative valorization at mild reaction",
        "prism:copyright": "© 2023 Elsevier B.V. All rights reserved.",
        "openaccess": "0",
        "prism:issn": "24688231",
        "dcterms:subject": [
          {
            "@_fa": "true",
            "$": "Co-MOF"
          },
          {
            "@_fa": "true",
            "$": "Carbon coating"
          },
          {
            "@_fa": "true",
            "$": "Furfuryl alcohol"
          },
          {
            "@_fa": "true",
            "$": "Cobalt nanoparticles"
          },
          {
            "@_fa": "true",
            "$": "Mild hydrogenation"
          }
        ],
        "openaccessArticle": "false",
        "prism:publicationName": "Molecular Catalysis",
        "openaccessSponsorType": null,
        "prism:pageRange": "113647",
        "pubType": "fla",
        "prism:coverDisplayDate": "December 2023",
        "prism:doi": "10.1016/j.mcat.2023.113647",
        "prism:startingPage": "113647",
        "dc:identifier": "doi:10.1016/j.mcat.2023.113647",
        "openaccessSponsorName": null
      },
      "objects": {
        "object": [
          {
            "@category": "standard",
            "@height": "282",
            "@width": "715",
            "@_fa": "true",
            "$": "https://api.elsevier.com/content/object/eid/1-s2.0-S2468823123007307-gr4.jpg?httpAccept=%2A%2F%2A",
            "@multimediatype": "JPEG image file",
            "@type": "IMAGE-DOWNSAMPLED",
            "@size": "71506",
            "@ref": "gr4",
            "@mimetype": "image/jpeg"
          },
          {
            "@category": "standard",
            "@height": "660",
            "@width": "715",
            "@_fa": "true",
            "$": "https://api.elsevier.com/content/object/eid/1-s2.0-S2468823123007307-gr2.jpg?httpAccept=%2A%2F%2A",
            "@multimediatype": "JPEG image file",
            "@type": "IMAGE-DOWNSAMPLED",
            "@size": "141651",
            "@ref": "gr2",
            "@mimetype": "image/jpeg"
          },
          {
            "@category": "standard",
            "@height": "258",
            "@width": "698",
            "@_fa": "true",
            "$": "https://api.elsevier.com/content/object/eid/1-s2.0-S2468823123007307-gr10.jpg?httpAccept=%2A%2F%2A",
            "@multimediatype": "JPEG image file",
            "@type": "IMAGE-DOWNSAMPLED",
            "@size": "48039",
            "@ref": "gr10",
            "@mimetype": "image/jpeg"
          },
          {
            "@category": "standard",
            "@height": "316",
            "@width": "734",
            "@_fa": "true",
            "$": "https://api.elsevier.com/content/object/eid/1-s2.0-S2468823123007307-gr6.jpg?httpAccept=%2A%2F%2A",
            "@multimediatype": "JPEG image file",
            "@type": "IMAGE-DOWNSAMPLED",
            "@size": "93014",
            "@ref": "gr6",
            "@mimetype": "image/jpeg"
          },
          {
            "@category": "standard",
            "@height": "333",
            "@width": "733",
            "@_fa": "true",
            "$": "https://api.elsevier.com/content/object/eid/1-s2.0-S2468823123007307-gr7.jpg?httpAccept=%2A%2F%2A",
            "@multimediatype": "JPEG image file",
            "@type": "IMAGE-DOWNSAMPLED",
            "@size": "106782",
            "@ref": "gr7",
            "@mimetype": "image/jpeg"
          },
          {
            "@category": "standard",
            "@height": "151",
            "@width": "376",
            "@_fa": "true",
            "$": "https://api.elsevier.com/content/object/eid/1-s2.0-S2468823123007307-sc2.jpg?httpAccept=%2A%2F%2A",
            "@multimediatype": "JPEG image file",
            "@type": "IMAGE-DOWNSAMPLED",
            "@size": "14851",
            "@ref": "sc2",
            "@mimetype": "image/jpeg"
          },
          {
            "@category": "standard",
            "@height": "200",
            "@width": "399",
            "@_fa": "true",
            "$": "https://api.elsevier.com/content/object/eid/1-s2.0-S2468823123007307-ga1.jpg?httpAccept=%2A%2F%2A",
            "@multimediatype": "JPEG image file",
            "@type": "IMAGE-DOWNSAMPLED",
            "@size": "31042",
            "@ref": "ga1",
            "@mimetype": "image/jpeg"
          },
          {
            "@category": "standard",
            "@height": "488",
            "@width": "715",
            "@_fa": "true",
            "$": "https://api.elsevier.com/content/object/eid/1-s2.0-S2468823123007307-gr1.jpg?httpAccept=%2A%2F%2A",
            "@multimediatype": "JPEG image file",
            "@type": "IMAGE-DOWNSAMPLED",
            "@size": "155453",
            "@ref": "gr1",
            "@mimetype": "image/jpeg"
          },
          {
            "@category": "standard",
            "@height": "645",
            "@width": "734",
            "@_fa": "true",
            "$": "https://api.elsevier.com/content/object/eid/1-s2.0-S2468823123007307-gr12.jpg?httpAccept=%2A%2F%2A",
            "@multimediatype": "JPEG image file",
            "@type": "IMAGE-DOWNSAMPLED",
            "@size": "132797",
            "@ref": "gr12",
            "@mimetype": "image/jpeg"
          },
          {
            "@category": "standard",
            "@height": "262",
            "@width": "715",
            "@_fa": "true",
            "$": "https://api.elsevier.com/content/object/eid/1-s2.0-S2468823123007307-gr5.jpg?httpAccept=%2A%2F%2A",
            "@multimediatype": "JPEG image file",
            "@type": "IMAGE-DOWNSAMPLED",
            "@size": "74137",
            "@ref": "gr5",
            "@mimetype": "image/jpeg"
          },
          {
            "@category": "standard",
            "@height": "285",
            "@width": "734",
            "@_fa": "true",
            "$": "https://api.elsevier.com/content/object/eid/1-s2.0-S2468823123007307-gr11.jpg?httpAccept=%2A%2F%2A",
            "@multimediatype": "JPEG image file",
            "@type": "IMAGE-DOWNSAMPLED",
            "@size": "53344",
            "@ref": "gr11",
            "@mimetype": "image/jpeg"
          },
          {
            "@category": "standard",
            "@height": "274",
            "@width": "711",
            "@_fa": "true",
            "$": "https://api.elsevier.com/content/object/eid/1-s2.0-S2468823123007307-gr3.jpg?httpAccept=%2A%2F%2A",
            "@multimediatype": "JPEG image file",
            "@type": "IMAGE-DOWNSAMPLED",
            "@size": "62831",
            "@ref": "gr3",
            "@mimetype": "image/jpeg"
          },
          {
            "@category": "standard",
            "@height": "365",
            "@width": "715",
            "@_fa": "true",
            "$": "https://api.elsevier.com/content/object/eid/1-s2.0-S2468823123007307-gr8.jpg?httpAccept=%2A%2F%2A",
            "@multimediatype": "JPEG image file",
            "@type": "IMAGE-DOWNSAMPLED",
            "@size": "137675",
            "@ref": "gr8",
            "@mimetype": "image/jpeg"
          },
          {
            "@category": "standard",
            "@height": "258",
            "@width": "730",
            "@_fa": "true",
            "$": "https://api.elsevier.com/content/object/eid/1-s2.0-S2468823123007307-gr9.jpg?httpAccept=%2A%2F%2A",
            "@multimediatype": "JPEG image file",
            "@type": "IMAGE-DOWNSAMPLED",
            "@size": "33622",
            "@ref": "gr9",
            "@mimetype": "image/jpeg"
          },
          {
            "@category": "standard",
            "@height": "215",
            "@width": "565",
            "@_fa": "true",
            "$": "https://api.elsevier.com/content/object/eid/1-s2.0-S2468823123007307-sc1.jpg?httpAccept=%2A%2F%2A",
            "@multimediatype": "JPEG image file",
            "@type": "IMAGE-DOWNSAMPLED",
            "@size": "36986",
            "@ref": "sc1",
            "@mimetype": "image/jpeg"
          },
          {
            "@category": "thumbnail",
            "@height": "86",
            "@width": "219",
            "@_fa": "true",
            "$": "https://api.elsevier.com/content/object/eid/1-s2.0-S2468823123007307-gr4.sml?httpAccept=%2A%2F%2A",
            "@multimediatype": "GIF image file",
            "@type": "IMAGE-THUMBNAIL",
            "@size": "9869",
            "@ref": "gr4",
            "@mimetype": "image/gif"
          },
          {
            "@category": "thumbnail",
            "@height": "163",
            "@width": "177",
            "@_fa": "true",
            "$": "https://api.elsevier.com/content/object/eid/1-s2.0-S2468823123007307-gr2.sml?httpAccept=%2A%2F%2A",
            "@multimediatype": "GIF image file",
            "@type": "IMAGE-THUMBNAIL",
            "@size": "13110",
            "@ref": "gr2",
            "@mimetype": "image/gif"
          },
          {
            "@category": "thumbnail",
            "@height": "81",
            "@width": "219",
            "@_fa": "true",
            "$": "https://api.elsevier.com/content/object/eid/1-s2.0-S2468823123007307-gr10.sml?httpAccept=%2A%2F%2A",
            "@multimediatype": "GIF image file",
            "@type": "IMAGE-THUMBNAIL",
            "@size": "7470",
            "@ref": "gr10",
            "@mimetype": "image/gif"
          },
          {
            "@category": "thumbnail",
            "@height": "94",
            "@width": "219",
            "@_fa": "true",
            "$": "https://api.elsevier.com/content/object/eid/1-s2.0-S2468823123007307-gr6.sml?httpAccept=%2A%2F%2A",
            "@multimediatype": "GIF image file",
            "@type": "IMAGE-THUMBNAIL",
            "@size": "12253",
            "@ref": "gr6",
            "@mimetype": "image/gif"
          },
          {
            "@category": "thumbnail",
            "@height": "99",
            "@width": "219",
            "@_fa": "true",
            "$": "https://api.elsevier.com/content/object/eid/1-s2.0-S2468823123007307-gr7.sml?httpAccept=%2A%2F%2A",
            "@multimediatype": "GIF image file",
            "@type": "IMAGE-THUMBNAIL",
            "@size": "17026",
            "@ref": "gr7",
            "@mimetype": "image/gif"
          },
          {
            "@category": "thumbnail",
            "@height": "88",
            "@width": "219",
            "@_fa": "true",
            "$": "https://api.elsevier.com/content/object/eid/1-s2.0-S2468823123007307-sc2.sml?httpAccept=%2A%2F%2A",
            "@multimediatype": "GIF image file",
            "@type": "IMAGE-THUMBNAIL",
            "@size": "6175",
            "@ref": "sc2",
            "@mimetype": "image/gif"
          },
          {
            "@category": "thumbnail",
            "@height": "110",
            "@width": "219",
            "@_fa": "true",
            "$": "https://api.elsevier.com/content/object/eid/1-s2.0-S2468823123007307-ga1.sml?httpAccept=%2A%2F%2A",
            "@multimediatype": "GIF image file",
            "@type": "IMAGE-THUMBNAIL",
            "@size": "11308",
            "@ref": "ga1",
            "@mimetype": "image/gif"
          },
          {
            "@category": "thumbnail",
            "@height": "149",
            "@width": "219",
            "@_fa": "true",
            "$": "https://api.elsevier.com/content/object/eid/1-s2.0-S2468823123007307-gr1.sml?httpAccept=%2A%2F%2A",
            "@multimediatype": "GIF image file",
            "@type": "IMAGE-THUMBNAIL",
            "@size": "27742",
            "@ref": "gr1",
            "@mimetype": "image/gif"
          },
          {
            "@category": "thumbnail",
            "@height": "163",
            "@width": "186",
            "@_fa": "true",
            "$": "https://api.elsevier.com/content/object/eid/1-s2.0-S2468823123007307-gr12.sml?httpAccept=%2A%2F%2A",
            "@multimediatype": "GIF image file",
            "@type": "IMAGE-THUMBNAIL",
            "@size": "13211",
            "@ref": "gr12",
            "@mimetype": "image/gif"
          },
          {
            "@category": "thumbnail",
            "@height": "80",
            "@width": "219",
            "@_fa": "true",
            "$": "https://api.elsevier.com/content/object/eid/1-s2.0-S2468823123007307-gr5.sml?httpAccept=%2A%2F%2A",
            "@multimediatype": "GIF image file",
            "@type": "IMAGE-THUMBNAIL",
            "@size": "9435",
            "@ref": "gr5",
            "@mimetype": "image/gif"
          },
          {
            "@category": "thumbnail",
            "@height": "85",
            "@width": "219",
            "@_fa": "true",
            "$": "https://api.elsevier.com/content/object/eid/1-s2.0-S2468823123007307-gr11.sml?httpAccept=%2A%2F%2A",
            "@multimediatype": "GIF image file",
            "@type": "IMAGE-THUMBNAIL",
            "@size": "7853",
            "@ref": "gr11",
            "@mimetype": "image/gif"
          },
          {
            "@category": "thumbnail",
            "@height": "85",
            "@width": "219",
            "@_fa": "true",
            "$": "https://api.elsevier.com/content/object/eid/1-s2.0-S2468823123007307-gr3.sml?httpAccept=%2A%2F%2A",
            "@multimediatype": "GIF image file",
            "@type": "IMAGE-THUMBNAIL",
            "@size": "9759",
            "@ref": "gr3",
            "@mimetype": "image/gif"
          },
          {
            "@category": "thumbnail",
            "@height": "112",
            "@width": "219",
            "@_fa": "true",
            "$": "https://api.elsevier.com/content/object/eid/1-s2.0-S2468823123007307-gr8.sml?httpAccept=%2A%2F%2A",
            "@multimediatype": "GIF image file",
            "@type": "IMAGE-THUMBNAIL",
            "@size": "19844",
            "@ref": "gr8",
            "@mimetype": "image/gif"
          },
          {
            "@category": "thumbnail",
            "@height": "77",
            "@width": "219",
            "@_fa": "true",
            "$": "https://api.elsevier.com/content/object/eid/1-s2.0-S2468823123007307-gr9.sml?httpAccept=%2A%2F%2A",
            "@multimediatype": "GIF image file",
            "@type": "IMAGE-THUMBNAIL",
            "@size": "6184",
            "@ref": "gr9",
            "@mimetype": "image/gif"
          },
          {
            "@category": "thumbnail",
            "@height": "83",
            "@width": "219",
            "@_fa": "true",
            "$": "https://api.elsevier.com/content/object/eid/1-s2.0-S2468823123007307-sc1.sml?httpAccept=%2A%2F%2A",
            "@multimediatype": "GIF image file",
            "@type": "IMAGE-THUMBNAIL",
            "@size": "9119",
            "@ref": "sc1",
            "@mimetype": "image/gif"
          },
          {
            "@category": "high",
            "@height": "1248",
            "@width": "3167",
            "@_fa": "true",
            "$": "https://api.elsevier.com/content/object/eid/1-s2.0-S2468823123007307-gr4_lrg.jpg?httpAccept=%2A%2F%2A",
            "@multimediatype": "JPEG image file",
            "@type": "IMAGE-HIGH-RES",
            "@size": "586796",
            "@ref": "gr4",
            "@mimetype": "image/jpeg"
          },
          {
            "@category": "high",
            "@height": "2925",
            "@width": "3167",
            "@_fa": "true",
            "$": "https://api.elsevier.com/content/object/eid/1-s2.0-S2468823123007307-gr2_lrg.jpg?httpAccept=%2A%2F%2A",
            "@multimediatype": "JPEG image file",
            "@type": "IMAGE-HIGH-RES",
            "@size": "1138004",
            "@ref": "gr2",
            "@mimetype": "image/jpeg"
          },
          {
            "@category": "high",
            "@height": "1141",
            "@width": "3092",
            "@_fa": "true",
            "$": "https://api.elsevier.com/content/object/eid/1-s2.0-S2468823123007307-gr10_lrg.jpg?httpAccept=%2A%2F%2A",
            "@multimediatype": "JPEG image file",
            "@type": "IMAGE-HIGH-RES",
            "@size": "397697",
            "@ref": "gr10",
            "@mimetype": "image/jpeg"
          },
          {
            "@category": "high",
            "@height": "1398",
            "@width": "3250",
            "@_fa": "true",
            "$": "https://api.elsevier.com/content/object/eid/1-s2.0-S2468823123007307-gr6_lrg.jpg?httpAccept=%2A%2F%2A",
            "@multimediatype": "JPEG image file",
            "@type": "IMAGE-HIGH-RES",
            "@size": "835319",
            "@ref": "gr6",
            "@mimetype": "image/jpeg"
          },
          {
            "@category": "high",
            "@height": "1473",
            "@width": "3244",
            "@_fa": "true",
            "$": "https://api.elsevier.com/content/object/eid/1-s2.0-S2468823123007307-gr7_lrg.jpg?httpAccept=%2A%2F%2A",
            "@multimediatype": "JPEG image file",
            "@type": "IMAGE-HIGH-RES",
            "@size": "887934",
            "@ref": "gr7",
            "@mimetype": "image/jpeg"
          },
          {
            "@category": "high",
            "@height": "669",
            "@width": "1667",
            "@_fa": "true",
            "$": "https://api.elsevier.com/content/object/eid/1-s2.0-S2468823123007307-sc2_lrg.jpg?httpAccept=%2A%2F%2A",
            "@multimediatype": "JPEG image file",
            "@type": "IMAGE-HIGH-RES",
            "@size": "92530",
            "@ref": "sc2",
            "@mimetype": "image/jpeg"
          },
          {
            "@category": "high",
            "@height": "886",
            "@width": "1766",
            "@_fa": "true",
            "$": "https://api.elsevier.com/content/object/eid/1-s2.0-S2468823123007307-ga1_lrg.jpg?httpAccept=%2A%2F%2A",
            "@multimediatype": "JPEG image file",
            "@type": "IMAGE-HIGH-RES",
            "@size": "219624",
            "@ref": "ga1",
            "@mimetype": "image/jpeg"
          },
          {
            "@category": "high",
            "@height": "2160",
            "@width": "3167",
            "@_fa": "true",
            "$": "https://api.elsevier.com/content/object/eid/1-s2.0-S2468823123007307-gr1_lrg.jpg?httpAccept=%2A%2F%2A",
            "@multimediatype": "JPEG image file",
            "@type": "IMAGE-HIGH-RES",
            "@size": "1943306",
            "@ref": "gr1",
            "@mimetype": "image/jpeg"
          },
          {
            "@category": "high",
            "@height": "2855",
            "@width": "3250",
            "@_fa": "true",
            "$": "https://api.elsevier.com/content/object/eid/1-s2.0-S2468823123007307-gr12_lrg.jpg?httpAccept=%2A%2F%2A",
            "@multimediatype": "JPEG image file",
            "@type": "IMAGE-HIGH-RES",
            "@size": "1056023",
            "@ref": "gr12",
            "@mimetype": "image/jpeg"
          },
          {
            "@category": "high",
            "@height": "1160",
            "@width": "3167",
            "@_fa": "true",
            "$": "https://api.elsevier.com/content/object/eid/1-s2.0-S2468823123007307-gr5_lrg.jpg?httpAccept=%2A%2F%2A",
            "@multimediatype": "JPEG image file",
            "@type": "IMAGE-HIGH-RES",
            "@size": "656927",
            "@ref": "gr5",
            "@mimetype": "image/jpeg"
          },
          {
            "@category": "high",
            "@height": "1260",
            "@width": "3250",
            "@_fa": "true",
            "$": "https://api.elsevier.com/content/object/eid/1-s2.0-S2468823123007307-gr11_lrg.jpg?httpAccept=%2A%2F%2A",
            "@multimediatype": "JPEG image file",
            "@type": "IMAGE-HIGH-RES",
            "@size": "359375",
            "@ref": "gr11",
            "@mimetype": "image/jpeg"
          },
          {
            "@category": "high",
            "@height": "1215",
            "@width": "3148",
            "@_fa": "true",
            "$": "https://api.elsevier.com/content/object/eid/1-s2.0-S2468823123007307-gr3_lrg.jpg?httpAccept=%2A%2F%2A",
            "@multimediatype": "JPEG image file",
            "@type": "IMAGE-HIGH-RES",
            "@size": "450076",
            "@ref": "gr3",
            "@mimetype": "image/jpeg"
          },
          {
            "@category": "high",
            "@height": "1614",
            "@width": "3166",
            "@_fa": "true",
            "$": "https://api.elsevier.com/content/object/eid/1-s2.0-S2468823123007307-gr8_lrg.jpg?httpAccept=%2A%2F%2A",
            "@multimediatype": "JPEG image file",
            "@type": "IMAGE-HIGH-RES",
            "@size": "1008651",
            "@ref": "gr8",
            "@mimetype": "image/jpeg"
          },
          {
            "@category": "high",
            "@height": "1143",
            "@width": "3231",
            "@_fa": "true",
            "$": "https://api.elsevier.com/content/object/eid/1-s2.0-S2468823123007307-gr9_lrg.jpg?httpAccept=%2A%2F%2A",
            "@multimediatype": "JPEG image file",
            "@type": "IMAGE-HIGH-RES",
            "@size": "255692",
            "@ref": "gr9",
            "@mimetype": "image/jpeg"
          },
          {
            "@category": "high",
            "@height": "951",
            "@width": "2500",
            "@_fa": "true",
            "$": "https://api.elsevier.com/content/object/eid/1-s2.0-S2468823123007307-sc1_lrg.jpg?httpAccept=%2A%2F%2A",
            "@multimediatype": "JPEG image file",
            "@type": "IMAGE-HIGH-RES",
            "@size": "243362",
            "@ref": "sc1",
            "@mimetype": "image/jpeg"
          },
          {
            "@category": "standard",
            "@_fa": "true",
            "$": "https://api.elsevier.com/content/object/eid/1-s2.0-S2468823123007307-mmc1.docx?httpAccept=%2A%2F%2A",
            "@multimediatype": "Microsoft Word file",
            "@type": "APPLICATION",
            "@size": "12443235",
            "@ref": "mmc1",
            "@mimetype": "application/word"
          },
          {
            "@category": "thumbnail",
            "@_fa": "true",
            "$": "https://api.elsevier.com/content/object/eid/1-s2.0-S2468823123007307-si1.svg?httpAccept=%2A%2F%2A",
            "@multimediatype": "Scalable Vector Graphics file",
            "@type": "ALTIMG",
            "@size": "26072",
            "@ref": "si1",
            "@mimetype": "image/svg+xml"
          },
          {
            "@category": "thumbnail",
            "@_fa": "true",
            "$": "https://api.elsevier.com/content/object/eid/1-s2.0-S2468823123007307-si2.svg?httpAccept=%2A%2F%2A",
            "@multimediatype": "Scalable Vector Graphics file",
            "@type": "ALTIMG",
            "@size": "25480",
            "@ref": "si2",
            "@mimetype": "image/svg+xml"
          },
          {
            "@category": "thumbnail",
            "@_fa": "true",
            "$": "https://api.elsevier.com/content/object/eid/1-s2.0-S2468823123007307-si3.svg?httpAccept=%2A%2F%2A",
            "@multimediatype": "Scalable Vector Graphics file",
            "@type": "ALTIMG",
            "@size": "31221",
            "@ref": "si3",
            "@mimetype": "image/svg+xml"
          },
          {
            "@category": "standard",
            "@_fa": "true",
            "$": "https://api.elsevier.com/content/object/eid/1-s2.0-S2468823123007307-am.pdf?httpAccept=%2A%2F%2A",
            "@multimediatype": "Acrobat PDF file",
            "@type": "AAM-PDF",
            "@size": "3495901",
            "@ref": "am",
            "@mimetype": "application/pdf"
          }
        ]
      },
      "link": {
        "@rel": "abstract",
        "@href": "https://api.elsevier.com/content/abstract/scopus_id/85175027499"
      }
    }
  }
}