{
  "metadata": {
    "title": "Effect of physicochemical properties of carbons on the performance of bead-type Pd/C catalysts for furfural hydrogenation",
    "authors": "; ; ",
    "journal": "Molecular Catalysis",
    "date": "2024-04-01",
    "doi": "10.1016/j.mcat.2024.114025",
    "abstract": "",
    "uri": "https://api.elsevier.com/content/article/pii/S2468823124002086",
    "pii": "S2468823124002086"
  },
  "fulltext": {
    "full-text-retrieval-response": {
      "scopus-eid": "2-s2.0-85187205848",
      "originalText": "serial JL 315758 291210 291744 291790 291809 31 Molecular Catalysis MOLECULARCATALYSIS 2024-03-11 2024-03-11 2024-03-11 2024-03-11 2024-04-17T00:02:53 1-s2.0-S2468823124002086 S2468-8231(24)00208-6 S2468823124002086 10.1016/j.mcat.2024.114025 S300 S300.1 FULL-TEXT 1-s2.0-S2468823124X00048 2024-04-23T22:35:11.704957Z 0 0 20240401 2024 2024-03-11T20:27:00.548908Z absattachment articleinfo articlenumber articletitlenorm authfirstinitialnorm authfirstsurnamenorm cid cids contenttype copyright crossmark dateloaded dateloadedtxt datesearch datesort dateupdated dco docsubtype doctype doi eid ewtransactionid hubeid indexeddate issn issnnorm itemstage itemtransactionid itemweight openaccess openarchive pg pgfirst pii piinorm pubdatestart pubdatetxt pubyr sectiontitle sortorder srctitle srctitlenorm srctype ssids alllist content subj subheadings suppl tomb volfirst volissue volumelist webpdf webpdfpagecount yearnav figure table e-component body mmlmath acknowledge affil appendices articletitle auth authfirstini authfull authkeywords authlast grantnumber grantsponsor grantsponsorid highlightsabst orcid primabst ref specialabst 2468-8231 24688231 true 558 558 C Volume 558 16 114025 114025 114025 20240401 1 April 2024 2024-04-01 2024 Regular Papers article fla © 2024 Elsevier B.V. All rights reserved. EFFECTPHYSICOCHEMICALPROPERTIESCARBONSPERFORMANCEBEADTYPEPDCCATALYSTSFORFURFURALHYDROGENATION KIM G 1 Introduction 2 Experimental 2.1 Materials 2.2 Preparation of carbon-alginate bead support 2.3 Preparation of Pd/carbon-alginate bead catalysts 2.4 Characterization 2.5 Catalytic hydrogenation over bead-type Pd/C catalysts 3 Results and discussion 3.1 Characterization of catalysts 3.2 Furfural hydrogenation over bead-type Pd/C catalysts 4 Conclusion CRediT authorship contribution statement Acknowledgments Appendix Supplementary materials References BYUN 2022 860 868 M KIM 2015 290 294 J CIRTIU 2011 288 291 C LI 2017 8843 8849 C MITCHELL 2013 6094 6112 S KINSIZ 2021 B ZHU 2021 283 290 H SHAABANI 2016 772 776 A LASKAR 2019 K CHUTIMASAKUL 2020 21009 21018 T MASLAMANI 2021 101 116 N XIA 2019 306 315 M HE 2022 1058 1066 X KLEIN 1983 86 91 J ATES 2020 9304 9362 B WANG 2020 6995 7008 B KHAN 2020 1087 1098 S ZHOU 2021 C BENHOURIA 2015 621 630 A ALAMIN 2021 233 243 N PARK 2007 1371 1377 H ULLAH 2022 887 901 K MA 2019 Y CHAKHTOUNA 2022 H PHAM 2016 1165 1177 T MCKENDRY 2002 47 54 P LIU 2016 700 710 H KOSO 2009 2035 2037 S WANG 2018 1047 1054 C KIM 2024 Y JODDAR 2016 B KIM 2015 575 580 J EJSMONT 2023 5148 5160 A THOMMES 2015 1051 1069 M HASSAN 2014 192 198 A ELBAYOMI 2021 13 S BAHSIS 2020 32821 32832 L SARKER 2014 1470 1482 B YANG 2021 S HUO 2022 12779 12786 H CABIAC 2008 229 235 A TAMAI 2009 10 13 H AGOSTINI 2010 11204 11211 G PELLEGRINI 2011 150 160 R LAMME 2019 448 455 W CHEN 2021 30455 30466 D LEE 2020 W HRONEC 2012 100 104 M STAKHEEV 2010 618 629 A YU 2020 2720 2728 Z BYUN 2021 406 415 M RAJESH 2015 7 15 R KIMX2024X114025 KIMX2024X114025XG 2026-03-11T00:00:00.000Z 2026-03-11T00:00:00.000Z http://creativecommons.org/licenses/by-nc-nd/4.0/ © 2024 Elsevier B.V. All rights reserved. 2024-04-03T10:07:36.926Z http://vtw.elsevier.com/data/voc/AddOnTypes/50.7/aggregated-refined KITECH Korea Institute of Industrial Technology http://data.elsevier.com/vocabulary/SciValFunders/501100003695 http://sws.geonames.org/1835841 Ulsan Metropolitan City IZ230061 Ulsan Metropolitan City http://data.elsevier.com/vocabulary/SciValFunders/501100018793 http://sws.geonames.org/1835841/ Research and Development JF230004 EH230002 Research and Development http://data.elsevier.com/vocabulary/SciValFunders/100006190 http://sws.geonames.org/6252001/ This work was supported by the Korea Institute of Industrial Technology (KITECH) through Research and Development ( EH230002 and JF230004 ), Ulsan Metropolitan City ( IZ230061 ) grants. https://doi.org/10.15223/policy-017 https://doi.org/10.15223/policy-037 https://doi.org/10.15223/policy-012 https://doi.org/10.15223/policy-029 https://doi.org/10.15223/policy-004 item S2468-8231(24)00208-6 S2468823124002086 1-s2.0-S2468823124002086 10.1016/j.mcat.2024.114025 315758 2024-04-23T22:35:11.704957Z 2024-04-01 1-s2.0-S2468823124002086-main.pdf https://s3-eu-west-1.amazonaws.com/prod-ucs-content-store-eu-west/content/pii:S2468823124002086/MAIN/application/pdf/fea31fe5be935f7a395610ea5cd052b4/main.pdf main.pdf pdf true 10008112 MAIN 9 1-s2.0-S2468823124002086-main_1.png https://s3-eu-west-1.amazonaws.com/prod-ucs-content-store-eu-west/content/pii:S2468823124002086/PREVIEW/image/png/6b93b68395dc6cc1581020bbe8421332/main_1.png main_1.png png 59927 849 656 IMAGE-WEB-PDF 1 1-s2.0-S2468823124002086-sc1.jpg https://s3-eu-west-1.amazonaws.com/prod-ucs-content-store-eu-west/content/pii:S2468823124002086/sc1/DOWNSAMPLED/image/jpeg/bd08df65d9bf7d43e4f4b5988658f75b/sc1.jpg sc1 sc1.jpg jpg 18663 252 602 IMAGE-DOWNSAMPLED 1-s2.0-S2468823124002086-gr9.jpg https://s3-eu-west-1.amazonaws.com/prod-ucs-content-store-eu-west/content/pii:S2468823124002086/gr9/DOWNSAMPLED/image/jpeg/2826a4ff27e874a84abde19f929637d7/gr9.jpg gr9 gr9.jpg jpg 54349 297 715 IMAGE-DOWNSAMPLED 1-s2.0-S2468823124002086-gr8.jpg https://s3-eu-west-1.amazonaws.com/prod-ucs-content-store-eu-west/content/pii:S2468823124002086/gr8/DOWNSAMPLED/image/jpeg/c253d6721351383e5ea6436ab9393afc/gr8.jpg gr8 gr8.jpg jpg 30776 266 361 IMAGE-DOWNSAMPLED 1-s2.0-S2468823124002086-gr3.jpg https://s3-eu-west-1.amazonaws.com/prod-ucs-content-store-eu-west/content/pii:S2468823124002086/gr3/DOWNSAMPLED/image/jpeg/027d29b49f9f07ed82611dd07ee40ac3/gr3.jpg gr3 gr3.jpg jpg 75080 256 640 IMAGE-DOWNSAMPLED 1-s2.0-S2468823124002086-gr2.jpg https://s3-eu-west-1.amazonaws.com/prod-ucs-content-store-eu-west/content/pii:S2468823124002086/gr2/DOWNSAMPLED/image/jpeg/30276933497ba751543aac13061c243d/gr2.jpg gr2 gr2.jpg jpg 152204 705 715 IMAGE-DOWNSAMPLED 1-s2.0-S2468823124002086-ga1.jpg https://s3-eu-west-1.amazonaws.com/prod-ucs-content-store-eu-west/content/pii:S2468823124002086/ga1/DOWNSAMPLED/image/jpeg/d635a9e1b33508cd7de9117fcbf05429/ga1.jpg ga1 true ga1.jpg jpg 33226 153 500 IMAGE-DOWNSAMPLED 1-s2.0-S2468823124002086-gr1.jpg https://s3-eu-west-1.amazonaws.com/prod-ucs-content-store-eu-west/content/pii:S2468823124002086/gr1/DOWNSAMPLED/image/jpeg/72610ad56027659f876b1c4ef331c93c/gr1.jpg gr1 gr1.jpg jpg 64079 661 634 IMAGE-DOWNSAMPLED 1-s2.0-S2468823124002086-gr7.jpg https://s3-eu-west-1.amazonaws.com/prod-ucs-content-store-eu-west/content/pii:S2468823124002086/gr7/DOWNSAMPLED/image/jpeg/47ad3a858899a0109c4c55ab08d84487/gr7.jpg gr7 gr7.jpg jpg 23571 287 348 IMAGE-DOWNSAMPLED 1-s2.0-S2468823124002086-gr6.jpg https://s3-eu-west-1.amazonaws.com/prod-ucs-content-store-eu-west/content/pii:S2468823124002086/gr6/DOWNSAMPLED/image/jpeg/e9d2d327224ef27c547992c7f9f8ff1a/gr6.jpg gr6 gr6.jpg jpg 137049 603 602 IMAGE-DOWNSAMPLED 1-s2.0-S2468823124002086-gr5.jpg https://s3-eu-west-1.amazonaws.com/prod-ucs-content-store-eu-west/content/pii:S2468823124002086/gr5/DOWNSAMPLED/image/jpeg/0054aed77d6caa0dc705d1ea0828d998/gr5.jpg gr5 gr5.jpg jpg 44510 294 380 IMAGE-DOWNSAMPLED 1-s2.0-S2468823124002086-gr4.jpg https://s3-eu-west-1.amazonaws.com/prod-ucs-content-store-eu-west/content/pii:S2468823124002086/gr4/DOWNSAMPLED/image/jpeg/241aaf2725d6ccd0a153e56c5e8e5ca5/gr4.jpg gr4 gr4.jpg jpg 32673 291 361 IMAGE-DOWNSAMPLED 1-s2.0-S2468823124002086-sc1.sml https://s3-eu-west-1.amazonaws.com/prod-ucs-content-store-eu-west/content/pii:S2468823124002086/sc1/THUMBNAIL/image/gif/66c0a9b125d89080f8eb185bdd382027/sc1.sml sc1 sc1.sml sml 3805 92 219 IMAGE-THUMBNAIL 1-s2.0-S2468823124002086-gr9.sml https://s3-eu-west-1.amazonaws.com/prod-ucs-content-store-eu-west/content/pii:S2468823124002086/gr9/THUMBNAIL/image/gif/fe7b89c952c3bc66013f0bf2d7e2f928/gr9.sml gr9 gr9.sml sml 9629 91 219 IMAGE-THUMBNAIL 1-s2.0-S2468823124002086-gr8.sml https://s3-eu-west-1.amazonaws.com/prod-ucs-content-store-eu-west/content/pii:S2468823124002086/gr8/THUMBNAIL/image/gif/e0e1540b26cd59654e94c8778966050d/gr8.sml gr8 gr8.sml sml 9181 162 219 IMAGE-THUMBNAIL 1-s2.0-S2468823124002086-gr3.sml https://s3-eu-west-1.amazonaws.com/prod-ucs-content-store-eu-west/content/pii:S2468823124002086/gr3/THUMBNAIL/image/gif/d19e3d0367079fb119ac90ff1ab3cf85/gr3.sml gr3 gr3.sml sml 10892 88 219 IMAGE-THUMBNAIL 1-s2.0-S2468823124002086-gr2.sml https://s3-eu-west-1.amazonaws.com/prod-ucs-content-store-eu-west/content/pii:S2468823124002086/gr2/THUMBNAIL/image/gif/186e342df94a051ed2cad203032db39f/gr2.sml gr2 gr2.sml sml 21650 164 166 IMAGE-THUMBNAIL 1-s2.0-S2468823124002086-ga1.sml https://s3-eu-west-1.amazonaws.com/prod-ucs-content-store-eu-west/content/pii:S2468823124002086/ga1/THUMBNAIL/image/gif/d27a990f5adf55ec70ea516f944a8310/ga1.sml ga1 true ga1.sml sml 10295 67 219 IMAGE-THUMBNAIL 1-s2.0-S2468823124002086-gr1.sml https://s3-eu-west-1.amazonaws.com/prod-ucs-content-store-eu-west/content/pii:S2468823124002086/gr1/THUMBNAIL/image/gif/e77fc1b259a18372b06ea9a5c1ae3ba9/gr1.sml gr1 gr1.sml sml 9522 164 157 IMAGE-THUMBNAIL 1-s2.0-S2468823124002086-gr7.sml https://s3-eu-west-1.amazonaws.com/prod-ucs-content-store-eu-west/content/pii:S2468823124002086/gr7/THUMBNAIL/image/gif/83ad8ad1c76d46fbbafc3eebee54db1e/gr7.sml gr7 gr7.sml sml 7771 164 199 IMAGE-THUMBNAIL 1-s2.0-S2468823124002086-gr6.sml https://s3-eu-west-1.amazonaws.com/prod-ucs-content-store-eu-west/content/pii:S2468823124002086/gr6/THUMBNAIL/image/gif/49193401ada18b5902fd20014bacf908/gr6.sml gr6 gr6.sml sml 19019 163 163 IMAGE-THUMBNAIL 1-s2.0-S2468823124002086-gr5.sml https://s3-eu-west-1.amazonaws.com/prod-ucs-content-store-eu-west/content/pii:S2468823124002086/gr5/THUMBNAIL/image/gif/80fd28f429b7375ebd4c6c9a681abf0c/gr5.sml gr5 gr5.sml sml 11473 163 211 IMAGE-THUMBNAIL 1-s2.0-S2468823124002086-gr4.sml https://s3-eu-west-1.amazonaws.com/prod-ucs-content-store-eu-west/content/pii:S2468823124002086/gr4/THUMBNAIL/image/gif/a80210c74ea23b27b769b050a38b7ada/gr4.sml gr4 gr4.sml sml 9359 164 203 IMAGE-THUMBNAIL 1-s2.0-S2468823124002086-sc1_lrg.jpg https://s3-eu-west-1.amazonaws.com/prod-ucs-content-store-eu-west/content/pii:S2468823124002086/HIGHRES/image/jpeg/e91a737ac1f465372de8a00afa7c5d34/sc1_lrg.jpg sc1 sc1_lrg.jpg jpg 165211 1115 2667 IMAGE-HIGH-RES 1-s2.0-S2468823124002086-gr9_lrg.jpg https://s3-eu-west-1.amazonaws.com/prod-ucs-content-store-eu-west/content/pii:S2468823124002086/HIGHRES/image/jpeg/931c9f64cd1f7633c2e0a88a340cdd48/gr9_lrg.jpg gr9 gr9_lrg.jpg jpg 527704 1317 3167 IMAGE-HIGH-RES 1-s2.0-S2468823124002086-gr8_lrg.jpg https://s3-eu-west-1.amazonaws.com/prod-ucs-content-store-eu-west/content/pii:S2468823124002086/HIGHRES/image/jpeg/7adbfdb6c4e34a1e08775f5e6b80ff58/gr8_lrg.jpg gr8 gr8_lrg.jpg jpg 216281 1181 1600 IMAGE-HIGH-RES 1-s2.0-S2468823124002086-gr3_lrg.jpg https://s3-eu-west-1.amazonaws.com/prod-ucs-content-store-eu-west/content/pii:S2468823124002086/HIGHRES/image/jpeg/ef4face462dd8a94285fdb35d90eeacd/gr3_lrg.jpg gr3 gr3_lrg.jpg jpg 547850 1133 2833 IMAGE-HIGH-RES 1-s2.0-S2468823124002086-gr2_lrg.jpg https://s3-eu-west-1.amazonaws.com/prod-ucs-content-store-eu-west/content/pii:S2468823124002086/HIGHRES/image/jpeg/f7ac45066a98c58f7be5010dbc8aed69/gr2_lrg.jpg gr2 gr2_lrg.jpg jpg 1205118 3121 3167 IMAGE-HIGH-RES 1-s2.0-S2468823124002086-ga1_lrg.jpg https://s3-eu-west-1.amazonaws.com/prod-ucs-content-store-eu-west/content/pii:S2468823124002086/HIGHRES/image/jpeg/6a0a4b6096ddd951e7e59f527ecd439e/ga1_lrg.jpg ga1 true ga1_lrg.jpg jpg 203080 679 2213 IMAGE-HIGH-RES 1-s2.0-S2468823124002086-gr1_lrg.jpg https://s3-eu-west-1.amazonaws.com/prod-ucs-content-store-eu-west/content/pii:S2468823124002086/HIGHRES/image/jpeg/4e1bd75d41b97d7b3fcb795b3395d669/gr1_lrg.jpg gr1 gr1_lrg.jpg jpg 490337 2925 2806 IMAGE-HIGH-RES 1-s2.0-S2468823124002086-gr7_lrg.jpg https://s3-eu-west-1.amazonaws.com/prod-ucs-content-store-eu-west/content/pii:S2468823124002086/HIGHRES/image/jpeg/3b3ad3deaafc66b4d2622503fd07d952/gr7_lrg.jpg gr7 gr7_lrg.jpg jpg 152227 1272 1542 IMAGE-HIGH-RES 1-s2.0-S2468823124002086-gr6_lrg.jpg https://s3-eu-west-1.amazonaws.com/prod-ucs-content-store-eu-west/content/pii:S2468823124002086/HIGHRES/image/jpeg/1cf3836f02ffab676941f645947470c5/gr6_lrg.jpg gr6 gr6_lrg.jpg jpg 1272177 2673 2667 IMAGE-HIGH-RES 1-s2.0-S2468823124002086-gr5_lrg.jpg https://s3-eu-west-1.amazonaws.com/prod-ucs-content-store-eu-west/content/pii:S2468823124002086/HIGHRES/image/jpeg/a5fd079c83472e762514a8a798edb40c/gr5_lrg.jpg gr5 gr5_lrg.jpg jpg 288443 1304 1683 IMAGE-HIGH-RES 1-s2.0-S2468823124002086-gr4_lrg.jpg https://s3-eu-west-1.amazonaws.com/prod-ucs-content-store-eu-west/content/pii:S2468823124002086/HIGHRES/image/jpeg/622be6627d037bef35a3226e80ee46ae/gr4_lrg.jpg gr4 gr4_lrg.jpg jpg 241967 1290 1600 IMAGE-HIGH-RES 1-s2.0-S2468823124002086-mmc1.docx https://s3-eu-west-1.amazonaws.com/prod-ucs-content-store-eu-west/content/pii:S2468823124002086/mmc1/MAIN/application/vnd.openxmlformats-officedocument.wordprocessingml.document/71de5f43d476961845210eefc92ec6ef/mmc1.docx mmc1 mmc1.docx docx 598906 APPLICATION 1-s2.0-S2468823124002086-si1.svg https://s3-eu-west-1.amazonaws.com/prod-ucs-content-store-eu-west/content/pii:S2468823124002086/image/svg+xml/499c2ee1d0df7d910719306196461b96/si1.svg si1 si1.svg svg 19972 ALTIMG 1-s2.0-S2468823124002086-si2.svg https://s3-eu-west-1.amazonaws.com/prod-ucs-content-store-eu-west/content/pii:S2468823124002086/image/svg+xml/d10f2fd4a1cf3a5f4a3cf85953733dc8/si2.svg si2 si2.svg svg 20894 ALTIMG 1-s2.0-S2468823124002086-am.pdf am am.pdf pdf 898096 AAM-PDF https://s3-eu-west-1.amazonaws.com/prod-ucs-content-store-eu-west/content/egi:10B11560BP7/MAIN/application/pdf/5e295732ef85016f7c2c14d00346bb2a/am.pdf MCAT 114025 114025 S2468-8231(24)00208-6 10.1016/j.mcat.2024.114025 Elsevier B.V. Fig. 1 Conceptual diagram of carbon incorporation into alginate hydrogel. Structure of alginate (a), acid functionalization of carbon surface (b), and schematic of alginate binding with calcium alginate hydrogel (c). Fig 1 Fig. 2 Digital images, bead size distribution, and FESEM images of Pd/AC-AB (a1, a2 and a3), Pd/CB-AB (b1, b2 and b3), Pd/CNT-AB (c1, c2 and c3), and Pd/CNF-AB (d1, d2 and d3) catalysts. Fig 2 Fig. 3 N2 isotherms and pore size distributions of carbon supports (a) and, bead-type Pd/C catalysts (b). Fig 3 Fig. 4 TGA curves of bead-type Pd/C catalysts. Fig 4 Fig. 5 XRD patterns of bead-type Pd/C catalysts. Fig 5 Fig. 6 FE-TEM images and particle size distributions of bead-type Pd/C catalysts. Fig 6 Fig. 7 Correlation of FF conversion with Pd dispersion. Fig 7 Fig. 8 Effect of reaction time on FF hydrogenation over Pd/CB-AB. Fig 8 Fig. 9 Reusability of Pd/CB-AB catalyst (a) and TGA curve of the fresh Pd/CB-AB and used Pd/CB-AB (b). Fig 9 Scheme 1 Possible reaction pathways of FF hydrogenation. Scheme 1 Table 1 Physical properties of the carbon supports. Table 1 Supports SBET (m2/g) a Pore volume (cm3/g) Particle size Vmeso b Vmicro c Vtotal AC 937.78 0.06 0.40 0.46 16.08 μm d CB 1342.29 1.22 0.26 1.48 30.40 nm e CNT 180.40 0.65 0.01 0.66 Diameter: 5–20 nm f Length: −10 μm CNF 107.64 0.25 0.01 0.26 Diameter: 50–300 nm f Length: 10–30 μm aSpecific surface area measured by BET. bPore volume calculated using BJH method. cMicropore volume measured by T-plot method. dParticle size and diameter of carbons measured by SEM. eParticle size and diameter of carbons measured by TEM. fValues obtained from the manufacturer. Table 2 Physical and chemical properties of bead-type Pd/C catalysts. Table 2 Catalysts Specific surface area (m2/g) a Pore volume (cm3/g) Pd dispersion (%) d Pd particle size (nm) e Vmeso b Vmicro c Vtotal Pd/AC-AB 295.02 0.03 0.12 0.15 3.3 14.9 Pd/CB-AB 447.26 0.79 0.07 0.86 23.4 2.9 Pd/CNT-AB 69.81 0.35 0.01 0.36 15.8 3.4 Pd/CNF-AB 31.12 0.09 0.01 0.10 4.2 4.9 a Specific surface area measured by BET. b Pore volume calculated using BJH method. c Micropore volume measured by T-plot method. d Pd dispersion and metallic surface area measured by CO-chemisorption. e Average Pd particle size measured by TEM. Table 3 Hydrogenation of FF over bead-type Pd/C catalysts. Table 3 Catalyst Conversion (%) Selectivity (%) FAL THFAL THFF 2-MF Pd/AC-AB 44.4 77.8 17.8 2.5 1.9 Pd/CB-AB 99.8 4.0 92.7 1.4 1.8 Pd/CNT-AB 86.0 29.3 66.3 3.0 1.3 Pd/CNF-AB 64.0 40.3 56.1 2.9 0.5 Reaction conditions: reaction temperature = 35 ℃, hydrogen pressure = 20 bar, and reaction time = 4 h. Effect of physicochemical properties of carbons on the performance of bead-type Pd/C catalysts for furfural hydrogenation Gangmin Kim Writing – original draft Formal analysis Data curation a b Ye Eun Kim Writing – review & editing Conceptualization a c Jungho Jae Writing – review & editing b ⁎ Man Sig Lee Writing – review & editing Supervision Conceptualization a ⁎ a Ulsan Division, Korea Institute of Industrial Technology (KITECH), Ulsan 44413, South Korea Ulsan Division Korea Institute of Industrial Technology (KITECH) Ulsan 44413 South Korea aUlsan Division, Korea Institute of Industrial Technology (KITECH), Ulsan 44413, South Korea b School of Chemical Engineering, Pusan National University, Busan 46241, South Korea School of Chemical Engineering Pusan National University Busan 46241 South Korea bSchool of Chemical Engineering, Pusan National University, Busan 46241, South Korea c Department of Chemical and Biological Engineering, Korea University, Seoul 02841, South Korea Department of Chemical and Biological Engineering Korea University Seoul 02841 South Korea cDepartment of Chemical and Biological Engineering, Korea University, Seoul 02841, South Korea ⁎ Corresponding authors. In green heterogeneous catalytic systems, alginate has emerged as a promising material for transforming powder catalysts into solid forms because of its sustainability and non-toxicity. Herein, the effect of carbon supports, including activated carbon (AC), carbon black (CB), carbon nanotubes (CNT), and carbon nanofibers (CNF), on a bead-type Pd/alginate-carbon catalyst was studied. Bead-type supports were synthesized by alginate gelation, and Pd-supported bead-type catalysts were prepared by a chemical reduction method. The catalytic activity in the hydrogenation of furfural was evaluated. Physical properties such as the specific surface area and pore volume of the carbon support greatly influenced the properties of the bead-type Pd/C catalyst. Pd/CB-alginate bead (AB), which had the highest specific surface area and pore volume, exhibited the smallest Pd particle size and dispersion, resulting in the highest catalytic performance. Additionally, the catalyst exhibited the highest FF conversion of 99 % and tetrahydrofurfuryl alcohol selectivity of 92 % under 20 bar of H2 at 35 ℃ for 4 h. Graphical abstract Image, graphical abstract Keywords Alginate Bead-type Pd/C catalyst Carbon support Furfural Hydrogenation Data availability Data will be made available on request. 1 Introduction Metal-nanoparticle catalysts are widely used in hydrogenation reactions [1]. Among these, palladium has received considerable attention in the field of catalysis because of its high performance in catalytic reactions and its ability to dissociate hydrogen under mild conditions [2–4]. Owing to the high cost and aggregation of palladium in reaction mixtures, palladium must be dispersed on supports such as carbon and metal oxides. To use Pd in industrial catalysis applications, shaping of the catalyst is essential for facilitating its recovery, reusability, handling, and separation. Catalyst shaping has been utilized to improve the scale-up of processes and reduce the ratio of the catalyst mass to reactor volume [5]. Bead catalysts have a unique spherical morphology, unlike granules or pellets, that is exposed to less mechanical damage and has a higher packing density [6,7]. Conventional methods of fabricating bead-type catalysts, such as spray drying and dropping particles into an oil-bath, require high temperatures for drying, and the manufacturing facility is expensive and complicated. Developing green heterogeneous catalysts has been the focus of many studies owing to the sustainability, recyclability, and minimal waste associated with such catalysts [8,9]. Biopolymers such as alginate, chitosan, and pectin have received considerable attention in the field of green catalyst supports owing to their low cost, biodegradability, and non-toxicity [10–12]. Alginate is a prominent biopolymer that can form spherical hydrogel beads via ionotropic gelation when dropped into a solution containing bivalent cations. Alginate is a natural polysaccharide extracted from the cell walls of brown algae. Alginate contains abundant carboxylate (-COO-) and hydroxyl functional groups (-OH) that stabilize metal particles. The chemical stability and porous structure of alginate hydrogels render them potential materials for use as catalyst supports [12–14]. However, alginate as a catalyst support still has some drawbacks, such as low mechanical strength and a low saturated metal loading content [13,15]. One technique for improving the stability of alginate catalysts is the incorporation of polymers or carbon into the alginate[16–18]. Most studies have focused on incorporating alginate into carbon, which is used as an adsorbent [19–21] or catalyst support [22,23], whereas no studies have reported the effect of the properties of carbon on carbon-alginate beads. With the increasing demand for eco-friendly products and efforts to replace petroleum-based materials, upgrading biomass is a promising way to produce renewable fuels and chemicals [24–26]. Furfural (FF) is an important platform material derived from lignocellulose biomass feedstock. FF can be transformed into valuable chemicals such as furan, furfuryl alcohol (FAL), tetrahydrofurfuryl alcohol (THFAL), 2-methylfuran, tetrahydrofurfural (THFF), and cyclopentanone through hydrogenation reactions. THFAL is a degradable, less-toxic, and stable saturated furan compound commonly used in green solvents. It can also be used as a chemical intermediate between 1,5-petanediol and 1,2-petanediol, which are key chemicals in the plastic industry [27–30]. In this study, we investigate the effects of the carbon structure on the properties of bead-type Pd/C catalysts. Carbon beads are prepared by ionotropic gelation, and various carbons with different structures, including carbon black (CB), activated carbon (AC), carbon nanotubes (CNT), and carbon nanofibers (CNF), are used as supports. For preparing the bead-type Pd/C catalysts, sodium alginate is dropped into a CaCl2 solution to form a spherical bead support, which acts as a biopolymer template. The bead-type Pd/C catalysts are prepared using a chemical reduction method. The prepared bead-type Pd/C catalysts are investigated using N2 adsorption and desorption, X-ray diffraction (XRD), thermogravimetric analysis (TGA), Raman spectroscopy, X-ray photoelectron spectroscopy (XPS), CO chemisorption, and field-emission scanning (and transmission) electron microscopy (FE-SEM and FE-TEM). The catalytic performance is evaluated in FF hydrogenation. 2 Experimental 2.1 Materials Pristine carbon black (CB) (Black Pearl 2000) was purchased from Cabot Co., Ltd Carbon nanotubes (CNT) was purchased from Applied Carbon Nanotechnology and carbon nanofibers (CNF) was purchased from Carbon Nanomaterial Technology. The carbons were pretreated with 4 M sulfuric acid and nitric acid (1:1 v/v) by sonication at room temperature for 2 h for surface functionalization. Activated carbon (AC), calcium chloride, sodium alginate, trisodium alginate, and sodium borohydride were purchased from Sigma-Aldrich. All chemicals were used without further purification. 2.2 Preparation of carbon-alginate bead support An alginate solution (2 %, w/v) was prepared by pouring sodium alginate (3.0 g) into 150 mL of deionized water and stirring for 2 h to obtain a homogeneous solution. Thereafter, 4 g of carbon was added to the mixture and mixed using a homogenizer at 4000 rpm for 2 h [19]. To form the carbon-alginate hydrogel beads, a homogeneous alginate-carbon solution was added dropwise to a solution of 4% (w/v) calcium chloride with slow stirring for 2 h. The beads were then washed thrice with deionized water to remove excess sodium and calcium ions. The washed beads were stored in water until further use. 2.3 Preparation of Pd/carbon-alginate bead catalysts Spherical Pd/C-AB catalysts were synthesized using a chemical reduction method and reduced with sodium borohydride. H2PdCl4 (0.1 M) was dissolved in 100 ml of a 0.526 mM trisodium tartrate solution under stirring at 200 rpm at 5 ℃. Thereafter, 19 g of the wet C-AB support was added to the Pd precursor solution and stirred continuously for 24 h. After continuous stirring, 100 ml of 0.3 M sodium borohydride solution was added dropwise to the solution and stirred for 2 h to reduce the Pd2+ ions. Finally, the resulting black spherical beads were washed, filtered, and then dried using a freeze dryer. Through this process, Pd-supported bead-type catalysts, Pd/AC-AB (alginate beads), Pd/CB-AB, Pd/CNT-AB, and Pd/CNF-AB, were prepared. 2.4 Characterization Field-emission scanning electron microscopy (FE-SEM) images were obtained using a low-vacuum scanning electron microscope (JEOL, JSM-6490LV). The Brunauer–Emmett–Teller (BET) surface areas and pore volumes were determined using a Micromeritics ASAP 2020 instrument. X-ray diffraction (XRD) patterns were acquired using a Rigaku D/MAX 2500-V/PC instrument at 50 kV/50 mA, with a Cu-Kα radiation source (λ = 1.5406 Å). The Raman spectra were obtained using a Thermo Scientific DXR Raman microscope equipped with a 532 nm excitation laser. Field-emission transmission electron microscopy (FE-TEM) images were obtained using a JEM-2100 F (JEOL) instrument, at an accelerating voltage of 200 kV. The average Pd particle size distributions were obtained using ImageJ software by counting 100 spherical Pd particles. Thermogravimetric analysis (TGA) was performed using a TGA-DSC2 instrument (Mettler Toledo), under nitrogen atmosphere, at a heating rate of 10 ℃ min−1. To determine the dispersion and metallic surface area of Pd, CO chemisorption analysis was performed using a Micromeritics ASAP 2020 instrument. 2.5 Catalytic hydrogenation over bead-type Pd/C catalysts The liquid-phase hydrogenation of FF was performed in a 100 ml stainless autoclave reactor using 1.56 mmol of FF and 20 mL of 2-propanol as the solvent. First, 0.05 g of catalyst was added to the reactor. The autoclave reactor was purged twice with nitrogen and hydrogen gas twice, respectively, to eliminate air inside the autoclave. The reactor was then heated to 35 ℃ with magnetic stirring at rate of 700 rpm to conduct the hydrogenation reaction. After the reaction, the mixtures were analyzed using a gas chromatograph (GC, Agilent 7820 A, FID) equipped with an Agilent DB-WAX column. The conversion and selectivity were calculated using the following equations: C o n v e r s i o n ( % ) = m o l e FF , initial − m o l e FF , final m o l e FF , initial × 100 % S e l e c i t v i t y ( % ) = m o l e s p e c i f i c p r o d u c t m o l e t o t a l p r o d u c t × 100 % 3 Results and discussion 3.1 Characterization of catalysts Bead-type carbon-alginate supports were synthesized by the ionic crosslinking method, and bead-type Pd/C catalysts were prepared by a chemical reduction method using NaBH4 as the reducing agent. As shown in Fig. 1 , the acid treatment of carbon introduced carboxyl (-COOH) and hydroxyl (-OH) groups onto the carbon surface and functionalized the oxygen-containing functional groups of carbon bonded to the alginate chain by covalent bonding [31,32]. The Pd nanoparticles were stabilized by the abundant oxygen functional groups of the alginate and the carbon surface [33]. Freeze drying maintained the porosity of the carbon-alginate hydrogel during the drying process. SEM images of the bead-type Pd/C catalyst showed black, macroscopic beads with diameters of 4–7 mm, and it was confirmed that the surface morphology and size of the catalysts depended on the carbon structure (Fig. 2 ). The average diameter of the Pd/AC-AB, Pd/CB-AB, Pd/CNT-AB, and Pd/CNF-AB catalysts was 4.93, 5.84, 6.70, and 6.21 mm, respectively. The SEM images showed different structures of various carbons in the form of AC, CB, CNT, and CNF encapsulated in alginate (Fig. S1). The Pd/AC-AB and Pd/CNF-AB catalysts had a relatively smooth surface surrounded by alginate because of the large particle size of carbon, whereas the Pd/CB-AB and Pd/CNT-AB catalysts had rough alginate surfaces. These results demonstrate that macroscale beads with carbon on alginate can be obtained using a simple preparation method. Fig.3 shows the N2 adsorption isotherms and pore size distributions of the carbon supports and the Table 1 summarizes the physical properties of the carbon supports. CB, CNT, and CNF showed type-IV isotherms with an H2(b) hysteresis loop (Fig. 3a) representing mesoporous structure with large neck-widths pores. On the contrary, AC exhibited type-IV isotherms with an H4 hysteresis loop, indicating the existence of micropores and the formation of slit-shaped pores [34]. Furthermore, the pore size distributions of the carbon supports exhibited in Fig. 3(a). According to the IUPAC classification, pores were divided in to their size with micropores (<2 nm), mesopores (2–50 nm), and macropores (>50 nm). CNT and CNF showed mesoporous structure, while CB showed the combination with the mesopores and micropores. On the other hand, AC showed microporous structure with the lowest pore volume. The specific surface areas of the carbon supports decreased in the following order: CB > AC > CNT > CNF. Compared to the other pristine carbons, CB had the excellent physical properties of specific surface area (1342.3 m2/g) and pore volume (1.5 cm3/g) than other carbon supports. As depicted in the Fig. 3(b), the N2 isotherms of all bead-type Pd/C catalysts were similar to the isotherms of the carbon support, indicating that the incorporation of alginate and the deposition of Pd did not induce significant change in the pore structure of the pristine carbons. Table 2 listed the textural properties of the bead-type Pd/C catalysts. The physical properties of bead-type catalysts are highly influenced by the nature of the carbon. The specific surface area and pore volume of all the bead-type Pd/C catalysts significantly decreased compared to those of the carbon supports owing to pore blocking by alginate, which is in accordance with the literature [35]. As can be seen in the decreasing total pore volume ratio between the carbon support and the bead-type Pd/C catalyst, AC (67 %), CB (41 %), CNT (45 %), and CNF (61 %) were shown. In the case of AC and CB, micropore volume showed a significant decrease (70 %) than mesopores (35–40 %), indicating alginate blocks more micropores than mesopores. To evaluate the thermal stability of the bead-type Pd/C catalyst, TGA curves of the bead-type Pd/C catalyst and Pd/alginate beads (AB) were acquired under a flow of nitrogen gas (Fig. 4 ). The TGA curves of the bead-type Pd/C catalysts were above those of Pd/AB, indicating that the former exhibited less thermal degradation, demonstrating better thermal stability than alginate alone. All the catalysts exhibited three steps of weight loss in the range of 25‒800 ℃. In the first stage at temperatures below 200 ℃, the Pd/C-AB catalysts underwent approximately 10 % weight loss, compared with 18 % in the Pd/AB catalyst, due to the evaporation of residual water from the catalysts. Thus, it can be inferred that Pd/C-AB absorbed less water than Pd/AB, indicating that the incorporated carbon reduced the hygroscopicity of the catalyst. In the range of 200‒350 ℃, the saccharide rings and oxygen functional groups degraded more rapidly [36]. Above 350 ℃, the carbonaceous materials decomposed, as the final steps [37]. Pd/AB exhibited an approximately 70 % weight loss, whereas the weight loss of the bead-type Pd/C catalyst was 40 %. The catalysts that incorporated carbon exhibited enhanced thermal stability compared with alginate alone. The crystal structures and phase compositions of the bead-type Pd/C catalysts were confirmed by XRD analysis (Fig. 5 ). The XRD pattern of alginate consisted of two diffraction peaks at 2θ = 13.4° and 22.7°[38] (Fig. S2). All the prepared bead-type Pd/C catalysts showed the characteristic diffraction peaks of Pd at 2θ values of 40.5°, 46.8°, 68.4° and 82.1°, corresponding to the (111), (200), (220), and (311) planes of the fcc crystal lattice structure. For the AC- and CB-supported Pd catalysts, the broad peaks in the range of 17‒25° suggest an amorphous carbon structure. For the CNT- and CNF-supported Pd catalysts, the broad peak at 17‒25° was observed, along with a sharp peak at 25° The catalysts both displayed a characteristic peak of the C (002) plane, along with a mixture of disordered and ordered carbon with an amorphous structure [39]. FE-TEM was used to study the Pd dispersion and the average particle size of Pd (Fig. 6 ). The average size was determined from 100 Pd nanoparticles. The sizes of the deposited Pd particles in the Pd/AC-AB, Pd/CB-AB, Pd/CNT-AB and Pd/CNF-AB were 14.9, 2.9, 3.4, and 4.9 nm, respectively. Compared to the other catalysts, Pd/AC-AB had the largest average Pd particle size (14.9 nm). The larger Pd particle size observed in Pd/AC-AB can be attributed to two factors: 1) lack of mesopores, and 2) weak interaction between Pd and activated carbon. Mesoporous carbon materials could enhance the drawbacks of microporous structure of AC, such as insufficient anchor sites and the aggregation of metal nanoparticles [40]. Furthermore, the primary factor influencing the Pd particle size on AC is the surface extent within meso- and macropores [41,42]. The weak interaction between Pd and support can arise the mobility of Pd nanoparticles on the carbon surface [43,44]. For Pd/AC-AB embedded in alginate, the decreased mesopore volume of Pd/AC-AB resulted in a comparatively larger Pd particle size. In contrast, in the case of Pd/CB-AB with relatively the highest mesopore volume, the catalyst had the smallest particle size, with a narrow Pd particle size distribution, resulting in strong interactions between the Pd particles and the CB surface [45–47]. Agglomeration of the Pd nanoparticles was observed in Pd/CNF-AB and Pd/CNT-AB. Table 1 presents the Pd dispersion in the bead-type Pd/C catalysts, determined by the pulsed chemisorption of CO. For all of the catalysts, the Pd dispersion ranged from 3.3 % to 23 %, with different carbons significantly influencing the Pd dispersion. Among the bead-type Pd/C catalysts, the Pd/CB-AB catalyst exhibited the highest Pd dispersion (23 %), whereas the lowest dispersion was observed for the Pd/AC-AB (3.3 %) catalyst. We suggest that Pd dispersion is associated with the Pd particle size and Pd size distribution, influenced by the high mesopore volume indicative of small Pd particle sizes in bead-type catalysts. The small and uniformly distributed Pd particles with the highest mesoporous structure in Pd/CB-AB contribute to the formation of highly dispersed catalyst. 3.2 Furfural hydrogenation over bead-type Pd/C catalysts The catalytic performance of the prepared bead-type Pd/C catalysts was evaluated by liquid-phase FF hydrogenation to investigate the effect of the carbon support. The experiments were performed under 20 bar of H2 at 35 ℃ for 4 h; the FF conversion and product selectivity are summarized in Table 3 . FF can be converted into four major products: FAL, THFAL, THFF, and 2-MF. FAL is produced by hydrogenation of the carbonyl group of FF, whereas THF is formed via hydrogenation of the furan ring of FF. THFAL is generated by the over-hydrogenation of FAL, and 2-MF is generated by the hydrogenolysis of FA. The major products of the reaction were FAL and THFAL. It has been reported that the use of an alcohol solvent reduces the C = O group or the furan ring during the hydrogenation of FF [48]. The FF conversion decreased in the following order: Pd/CB-AB (99.8 %) > Pd/CNT-AB (86.0 %) > Pd/CNF-AB (64.0 %) > Pd/AC-AB (44.4 %). The Pd/CB-AB catalyst exhibited the highest FF conversion (99.9 %) and THFAL selectivity (92 %) owing to its large specific surface area and high pore volume. Selective adsorption on fine particles primarily targets the C=C bond, thereby enhancing the selectivity for saturated compounds [49]. Thus, the lack of FF conversion and THFAL selectivity for the Pd/AC-AB catalysts may be due to their larger Pd particle size and lower Pd dispersion compared to those of the other catalysts. The catalytic performance is affected by several factors. The major factor contributing to the high performance of bead-type Pd/C catalysts is the large exposed Pd surface area due to the high dispersion of Pd. Moreover, the large pore volumes of the catalysts facilitated transfer of the FF molecules inside the catalyst pores, which minimized steric hindrance [50,51]. The high mesoporosity of the catalyst structure provided active sites for the Pd nanoparticles, allowing for the Pd to be deposited and stabilized in the mesopores of the catalyst, resulting in high dispersion. The Pd dispersion in the bead-type Pd/C catalysts differed owing to the different structures of the carbon supports. The correlation between the Pd dispersion and FF conversion is shown in Fig. 7 . To investigate the reaction pathway and product selectivity, the effect of the reaction time on FF hydrogenation over the Pd/CB-AB catalyst was evaluated at 35 ℃ under 20 bar of H2 over the course of 15 to 240 min (Fig. 8 ). The FF conversion increased with the reaction time, and reached 100 % after 2 h. A possible reaction pathway for the hydrogenation of FF is shown in Scheme 1 . There are two reaction pathways for the production of FF to THFAL: the ring hydrogenation of the furan ring yielding THFF and the C=O hydrogenation resulting in FAL. The selectivity for THFAL decreased after 1 h and then increased. The selectivity for THFF was lower and remained constant over time, indicating that most of the FF was converted to FAL, and THFAL was formed by the over-hydrogenation of FAL. The Pd/CB-AB catalyst afforded the optimal catalytic activity, with 99.9 % FF conversion and 92 % THFAL selectivity at a reaction time of 4 h. The reusability of Pd/CB-AB was evaluated under 20 bar of H2 at 35 ℃ over the course of 4 h (Fig. 9 ). Excellent catalytic stability is an important factor for industrial applications. After the reaction, the bead-type Pd/C catalyst was easily separated by filtration, followed by washing with distilled water [17]. The freshly washed, bead-type catalysts were dried and reused for three consecutive cycles. A comparative analysis between the used and fresh catalysts was conducted using TGA (Fig. 9(b)) to observe the amount of coke formation. The results revealed an approximately 10 % lower weight loss in the used catalyst compared to the fresh catalyst, which can be indicated of coke formation [52]. The FF conversion obtained with the recycled bead-type Pd/C catalyst decreased minimally after three cycles and the selectivity for THFAL decreased slightly 88.9 % to 81.2 %, whereas those for the other compounds increased. Deactivation of the catalyst is attributed to the formation of the coke on the catalyst. Bead-type Pd/C catalysts showed a decreasing FF conversion and THFAL selectivity compared to powder catalyst (Fig. S3). Shaping of the catalyst resulted in deactivation of catalytic performance due to decreased specific surface area and the addition of a binder [10]. Despite the excellent catalytic performance of the powder catalyst, homogeneous catalysts present challenges in terms of separation from the mixture and possessed the potential for environmental contamination. The reaction mixture of Pd/CB and Pd/CB-AB is shown in Fig. S4. Many studies have focused on alginate as a catalyst support, aiming to develop in eco-friendly method while achieving high catalytic performance. Xia et al. demonstrated that a small amount of Ba2+ ions, used as the alginate crosslinking agent, maintained excellent catalytic activity and reusability of alginate hydrogels, making them suitable as a catalyst support [12]. Wang et al. reported that Pd-loaded cationic nanocellulose alginate hydrogel bead catalyst exhibited excellent performance in the Suzuki cross-coupling reaction, showing reusability and verifying the concept of green/sustainable polymers, including nanocellulose and alginate [16]. Ma et al. observed that incorporating CNT with alginate showed excellent catalytic activity in cinnamaldehyde hydrogenation, where Ca ions in the alginate bead acted as promoters [23]. Previous investigations have suggested that alginate is a promising material for catalyst supports, and many studies have aimed to incorporate reinforcing agents with alginate to enhance catalytic activity and stability, facilitating easy separation and reusability of the catalyst. 4 Conclusion Bead-type supports were successfully synthesized using alginate by employing various carbon materials during the gelation process, and bead-type Pd/C catalysts were prepared by a chemical reduction method. The carbon structures affected the morphologies of the catalyst surface, and larger carbon particles resulted in a smooth catalyst surface. The physical properties of the carbon, such as the pore volume and specific surface area, significantly influenced the physical properties of the catalysts. Pd/CB-AB, which had the highest specific surface area and pore volume, exhibited the smallest Pd particle size with high dispersion. The morphology is attributed to the anchoring sites for Pd provided by the mesoporous carbon structure. A comparative investigation of the catalytic performance for FF hydrogenation was conducted in the liquid phase. Pd/CB-AB afforded the highest FF conversion of 99 %, with a selectivity of 92 %. The large pore volume and specific surface area of Pd/CB-AB facilitated rapid adsorption/diffusion during Pd-catalyzed FF hydrogenation, and the highly dispersed Pd on the catalyst surface contributed to the increased catalytic efficiency. The macroscale size of the bead-type catalyst facilitates easy handling during both the reaction and recovery processes in liquid-phase reactions. The proper selection of a carbon support composed of CB can facilitate the development of high-performance catalysts with potential practical applications in industry. CRediT authorship contribution statement Gangmin Kim: Writing – original draft, Formal analysis, Data curation. Ye Eun Kim: Writing – review & editing, Conceptualization. Jungho Jae: Writing – review & editing. Man Sig Lee: Writing – review & editing, Supervision, Conceptualization. Declaration of competing interest The authors declare the following financial interests/personal relationships which may be considered as potential competing interests: Acknowledgments This work was supported by the Korea Institute of Industrial Technology (KITECH) through Research and Development (EH230002 and JF230004), Ulsan Metropolitan City (IZ230061) grants. Supplementary materials Supplementary material associated with this article can be found, in the online version, at doi:10.1016/j.mcat.2024.114025. Appendix Supplementary materials Image, application 1 References [1] M.Y. Byun Y.E. Kim J.H. Baek J. Jae M.S. Lee Effect of surface properties of TiO2on the performance of Pt/TiO2catalysts for furfural hydrogenation RSC Adv. 12 2022 860 868 10.1039/d1ra07220j M.Y. Byun, Y.E. Kim, J.H. Baek, J. Jae, M.S. Lee, Effect of surface properties of TiO2on the performance of Pt/TiO2catalysts for furfural hydrogenation, RSC Adv. 12 (2022) 860–868. 10.1039/d1ra07220j. [2] J.S. Kim J.H. Baek Y.B. Ryu S.S. Hong M.S. Lee Liquid hydrogenation of maleic anhydride with Pd/C catalyst at low pressure and temperature in batch reactor J. Nanosci. Nanotechnol. 15 2015 290 294 10.1166/jnn.2015.8349 J.S. Kim, J.H. Baek, Y.B. Ryu, S.S. Hong, M.S. Lee, Liquid hydrogenation of maleic anhydride with Pd/C catalyst at low pressure and temperature in batch reactor, J. Nanosci. Nanotechnol. 15 (2015) 290–294. 10.1166/jnn.2015.8349. [3] C.M. Cirtiu A.F. Dunlop-Brière A. Moores Cellulose nanocrystallites as an efficient support for nanoparticles of palladium: application for catalytic hydrogenation and Heck coupling under mild conditions Green Chem. 13 2011 288 291 10.1039/c0gc00326c C.M. Cirtiu, A.F. Dunlop-Brière, A. Moores, Cellulose nanocrystallites as an efficient support for nanoparticles of palladium: application for catalytic hydrogenation and Heck coupling under mild conditions, Green Chem. 13 (2011) 288–291. 10.1039/c0gc00326c. [4] C. Li G. Xu X. Liu Y. Zhang Y. Fu Hydrogenation of biomass-derived furfural to tetrahydrofurfuryl alcohol over hydroxyapatite-supported Pd catalyst under mild conditions Ind. Eng. Chem. Res. 56 2017 8843 8849 10.1021/acs.iecr.7b02046 C. Li, G. Xu, X. Liu, Y. Zhang, Y. Fu, Hydrogenation of biomass-derived furfural to tetrahydrofurfuryl alcohol over hydroxyapatite-supported Pd catalyst under mild conditions, Ind. Eng. Chem. Res. 56 (2017) 8843–8849. 10.1021/acs.iecr.7b02046. [5] S. Mitchell N.L. Michels J. Pérez-Ramírez From powder to technical body: the undervalued science of catalyst scale up Chem. Soc. Rev. 42 2013 6094 6112 10.1039/c3cs60076a S. Mitchell, N.L. Michels, J. Pérez-Ramírez, From powder to technical body: the undervalued science of catalyst scale up, Chem. Soc. Rev. 42 (2013) 6094–6112. 10.1039/c3cs60076a. [6] B.N. Kinsiz B. Coşkuner Filiz S. Kılıç Depren A. Kantürk Figen Nano-casting procedure for catalytic cobalt oxide bead preparation from calcium-alginate capsules: activity in ammonia borane hydrolysis reaction Appl. Mater. Today 22 2021 10.1016/j.apmt.2021.100952 B.N. Kinsiz, B. Coşkuner Filiz, S. Kılıç Depren, A. Kantürk Figen, Nano-casting procedure for catalytic cobalt oxide bead preparation from calcium-alginate capsules: activity in ammonia borane hydrolysis reaction, Appl. Mater. Today 22 (2021). 10.1016/j.apmt.2021.100952. [7] H. Zhu Z. Mao B. Liu T. Yang X. Feng H. Jin C. Peng C. Yang J. Wang X. Fang Regulating catalyst morphology to boost the stability of Ni–Mo/Al2O3 catalyst for ebullated-bed residue hydrotreating Green Energy Environ. 6 2021 283 290 10.1016/j.gee.2020.05.001 H. Zhu, Z. Mao, B. Liu, T. Yang, X. Feng, H. Jin, C. Peng, C. Yang, J. Wang, X. Fang, Regulating catalyst morphology to boost the stability of Ni–Mo/Al2O3 catalyst for ebullated-bed residue hydrotreating, Green Energy Environ. 6 (2021) 283–290. 10.1016/j.gee.2020.05.001. [8] A. Shaabani H. Afaridoun S. Shaabani Natural hydroxyapatite-supported MnO2: a green heterogeneous catalyst for selective aerobic oxidation of alkylarenes and alcohols Appl. Organomet. Chem. 30 2016 772 776 10.1002/aoc.3505 A. Shaabani, H. Afaridoun, S. Shaabani, Natural hydroxyapatite-supported MnO2: a green heterogeneous catalyst for selective aerobic oxidation of alkylarenes and alcohols, Appl. Organomet. Chem. 30 (2016) 772–776. 10.1002/aoc.3505. [9] K. Laskar P. Bhattacharjee M. Gohain D. Deka U. Bora Application of bio-based green heterogeneous catalyst for the synthesis of arylidinemalononitriles Sustain. Chem. Pharm. 14 2019 10.1016/j.scp.2019.100181 K. Laskar, P. Bhattacharjee, M. Gohain, D. Deka, U. Bora, Application of bio-based green heterogeneous catalyst for the synthesis of arylidinemalononitriles, Sustain. Chem. Pharm. 14 (2019). 10.1016/j.scp.2019.100181. [10] T. Chutimasakul P.Na Nakhonpanom W. Tirdtrakool A. Intanin T. Bunchuay R. Chantiwas J. Tantirungrotechai Uniform Cu/chitosan beads as a green and reusable catalyst for facile synthesis of iminesviaoxidative coupling reaction RSC Adv. 10 2020 21009 21018 10.1039/d0ra03884a T. Chutimasakul, P.Na Nakhonpanom, W. Tirdtrakool, A. Intanin, T. Bunchuay, R. Chantiwas, J. Tantirungrotechai, Uniform Cu/chitosan beads as a green and reusable catalyst for facile synthesis of iminesviaoxidative coupling reaction, RSC Adv. 10 (2020) 21009–21018. 10.1039/d0ra03884a. [11] N. Maslamani S.B. Khan E.Y. Danish E.M. Bakhsh S.M. Zakeeruddin A.M. Asiri Carboxymethyl cellulose nanocomposite beads as super-efficient catalyst for the reduction of organic and inorganic pollutants Int. J. Biol. Macromol. 167 2021 101 116 10.1016/j.ijbiomac.2020.11.074 N. Maslamani, S.B. Khan, E.Y. Danish, E.M. Bakhsh, S.M. Zakeeruddin, A.M. Asiri, Carboxymethyl cellulose nanocomposite beads as super-efficient catalyst for the reduction of organic and inorganic pollutants, Int. J. Biol. Macromol. 167 (2021) 101–116. 10.1016/j.ijbiomac.2020.11.074. [12] M. Xia S.M. Kang G.W. Lee Y.S. Huh B.J. Park The recyclability of alginate hydrogel particles used as a palladium catalyst support J. Ind. Eng. Chem. 73 2019 306 315 10.1016/j.jiec.2019.01.042 M. Xia, S.M. Kang, G.W. Lee, Y.S. Huh, B.J. Park, The recyclability of alginate hydrogel particles used as a palladium catalyst support, J. Ind. Eng. Chem. 73 (2019) 306–315. 10.1016/j.jiec.2019.01.042. [13] X. He X. Li J. Zhao C. Mu H. Mi J. Hu F. Shi Improving the catalytic and mechanical performance of alginate catalyst through functionalization by aminopolycarboxylic acids J. Colloid Interface Sci. 628 2022 1058 1066 10.1016/j.jcis.2022.07.181 X. He, X. Li, J. Zhao, C. Mu, H. Mi, J. Hu, F. Shi, Improving the catalytic and mechanical performance of alginate catalyst through functionalization by aminopolycarboxylic acids, J. Colloid Interface Sci. 628 (2022) 1058–1066. 10.1016/j.jcis.2022.07.181. [14] J. Klein J. Stock K.D. Vorlop Pore size and properties of spherical Ca-alginate biocatalysts Eur. J. Appl. Microbiol. Biotechnol. 18 1983 86 91 10.1007/BF00500829 J. Klein, J. Stock, K.D. Vorlop, Pore size and properties of spherical Ca-alginate biocatalysts, Eur. J. Appl. Microbiol. Biotechnol. 18 (1983) 86–91. 10.1007/BF00500829. [15] B. Ates S. Koytepe A. Ulu C. Gurses V.K. Thakur Chemistry, structures, and advanced applications of nanocomposites from biorenewable resources Chem. Rev. 120 2020 9304 9362 10.1021/acs.chemrev.9b00553 B. Ates, S. Koytepe, A. Ulu, C. Gurses, V.K. Thakur, Chemistry, structures, and advanced applications of nanocomposites from biorenewable resources, Chem. Rev. 120 (2020) 9304–9362. 10.1021/acs.chemrev.9b00553. [16] B. Wang M. Ran G. Fang T. Wu Q. Tian L. Zheng L. Romero-Zerón Y. Ni Palladium nano-catalyst supported on cationic nanocellulose–alginate hydrogel for effective catalytic reactions Cellulose 27 2020 6995 7008 10.1007/s10570-020-03127-4 B. Wang, M. Ran, G. Fang, T. Wu, Q. Tian, L. Zheng, L. Romero-Zerón, Y. Ni, Palladium nano-catalyst supported on cationic nanocellulose–alginate hydrogel for effective catalytic reactions, Cellulose 27 (2020) 6995–7008. 10.1007/s10570-020-03127-4. [17] S.B. Khan S. Ahmad T. Kamal A.M. Asiri E.M. Bakhsh Metal nanoparticles decorated sodium alginatecarbon nitride composite beads as effective catalyst for the reduction of organic pollutants Int. J. Biol. Macromol. 164 2020 1087 1098 10.1016/j.ijbiomac.2020.07.091 S.B. Khan, S. Ahmad, T. Kamal, A.M. Asiri, E.M. Bakhsh, Metal nanoparticles decorated sodium alginatecarbon nitride composite beads as effective catalyst for the reduction of organic pollutants, Int. J. Biol. Macromol. 164 (2020) 1087–1098. 10.1016/j.ijbiomac.2020.07.091. [18] C. Zhou X. He Y. Hou L. Zhang F. Shi J. Hu Alginate/r-GO/SiO2 aerogels with double catalytic activity sites and high mechanical performance Mater. Lett. 288 2021 10.1016/j.matlet.2021.129394 C. Zhou, X. He, Y. Hou, L. Zhang, F. Shi, J. Hu, Alginate/r-GO/SiO2 aerogels with double catalytic activity sites and high mechanical performance, Mater. Lett. 288 (2021). 10.1016/j.matlet.2021.129394. [19] A. Benhouria M.A. Islam H. Zaghouane-Boudiaf M. Boutahala B.H. Hameed Calcium alginate-bentonite-activated carbon composite beads as highly effective adsorbent for methylene blue Chem. Eng. J. 270 2015 621 630 10.1016/j.cej.2015.02.030 A. Benhouria, M.A. Islam, H. Zaghouane-Boudiaf, M. Boutahala, B.H. Hameed, Calcium alginate-bentonite-activated carbon composite beads as highly effective adsorbent for methylene blue, Chem. Eng. J. 270 (2015) 621–630. 10.1016/j.cej.2015.02.030. [20] N.U. Alamin A.S. Khan A. Nasrullah J. Iqbal Z. Ullah I.U. Din N. Muhammad S.Z. Khan Activated carbon-alginate beads impregnated with surfactant as sustainable adsorbent for efficient removal of methylene blue Int. J. Biol. Macromol. 176 2021 233 243 10.1016/j.ijbiomac.2021.02.017 N.U. Alamin, A.S. Khan, A. Nasrullah, J. Iqbal, Z. Ullah, I.U. Din, N. Muhammad, S.Z. Khan, Activated carbon-alginate beads impregnated with surfactant as sustainable adsorbent for efficient removal of methylene blue, Int. J. Biol. Macromol. 176 (2021) 233–243. 10.1016/j.ijbiomac.2021.02.017. [21] H.G. Park T.W. Kim M.Y. Chae I.K. Yoo Activated carbon-containing alginate adsorbent for the simultaneous removal of heavy metals and toxic organics Process Biochem. 42 2007 1371 1377 10.1016/j.procbio.2007.06.016 H.G. Park, T.W. Kim, M.Y. Chae, I.K. Yoo, Activated carbon-containing alginate adsorbent for the simultaneous removal of heavy metals and toxic organics, Process Biochem. 42 (2007) 1371–1377. 10.1016/j.procbio.2007.06.016. [22] K. Ullah S. Khan M. Khan Z.U. Rahman Y.O. Al-Ghamdi A. Mahmood S. Hussain S.B. Khan S.A. Khan A bioresource catalyst system of alginate-starch-activated carbon microsphere templated Cu nanoparticles: potentials in nitroarenes hydrogenation and dyes discoloration Int. J. Biol. Macromol. 222 2022 887 901 10.1016/j.ijbiomac.2022.09.226 K. Ullah, S. Khan, M. Khan, Z.U. Rahman, Y.O. Al-Ghamdi, A. Mahmood, S. Hussain, S.B. Khan, S.A. Khan, A bioresource catalyst system of alginate-starch-activated carbon microsphere templated Cu nanoparticles: potentials in nitroarenes hydrogenation and dyes discoloration, Int. J. Biol. Macromol. 222 (2022) 887–901. 10.1016/j.ijbiomac.2022.09.226. [23] Y. Ma L. Feng Z. Guo J. Deng C. Pham-Huu Y. Liu Palladium supported on calcium decorated carbon nanotube hybrids for chemoselective hydrogenation of cinnamaldehyde Front. Chem. 7 2019 10.3389/fchem.2019.00751 Y. Ma, L. Feng, Z. Guo, J. Deng, C. Pham-Huu, Y. Liu, Palladium supported on calcium decorated carbon nanotube hybrids for chemoselective hydrogenation of cinnamaldehyde, Front. Chem. 7 (2019). 10.3389/fchem.2019.00751. [24] H. Chakhtouna H. Benzeid N. Zari A. el kacem Qaiss R. Bouhfid Recent advances in eco-friendly composites derived from lignocellulosic biomass for wastewater treatment BioMass Convers. Biorefin. 2022 10.1007/s13399-022-03159-9 H. Chakhtouna, H. Benzeid, N. Zari, A. el kacem Qaiss, R. Bouhfid, Recent advances in eco-friendly composites derived from lignocellulosic biomass for wastewater treatment, BioMass Convers. Biorefin. (2022). 10.1007/s13399-022-03159-9. [25] T.N. Pham A. Samikannu A.R. Rautio K.L. Juhasz Z. Konya J. Wärnå K. Kordas J.P. Mikkola Catalytic hydrogenation of D-xylose over Ru decorated carbon foam catalyst in a spinchem® rotating bed reactor Top. Catal. 59 2016 1165 1177 10.1007/s11244-016-0637-4 T.N. Pham, A. Samikannu, A.R. Rautio, K.L. Juhasz, Z. Konya, J. Wärnå, K. Kordas, J.P. Mikkola, Catalytic hydrogenation of D-xylose over Ru decorated carbon foam catalyst in a spinchem® rotating bed reactor, Top. Catal. 59 (2016) 1165–1177. 10.1007/s11244-016-0637-4. [26] P. Mckendry Energy production from biomass (part 2): conversion technologies Bioresour. Technol. 83 2002 47 54 10.1016/S0960-8524(01)00119-5 P. Mckendry, Energy production from biomass (part 2): conversion technologies, Bioresour. Technol. 83 (2002) 47-54, doi:10.1016/S0960-8524(01)00119-5. [27] H. Liu Z. Huang H. Kang C. Xia J. Chen Selective hydrogenolysis of biomass-derived furfuryl alcohol into 1,2- and 1,5-pentanediol over highly dispersed Cu-Al2O3 catalysts Cuihua Xuebao/ Chin. J. Catal. 37 2016 700 710 10.1016/S1872-2067(15)61080-4 H. Liu, Z. Huang, H. Kang, C. Xia, J. Chen, Selective hydrogenolysis of biomass-derived furfuryl alcohol into 1,2- and 1,5-pentanediol over highly dispersed Cu-Al2O3 catalysts, Cuihua Xuebao/Chin. J. Catal. 37 (2016) 700–710. 10.1016/S1872-2067(15)61080-4. [28] S. Koso I. Furikado A. Shimao T. Miyazawa K. Kunimori K. Tomishige Chemoselective hydrogenolysis of tetrahydrofurfuryl alcohol to 1,5-pentanediol Chem.l Commun. 2009 2035 2037 10.1039/b822942b S. Koso, I. Furikado, A. Shimao, T. Miyazawa, K. Kunimori, K. Tomishige, Chemoselective hydrogenolysis of tetrahydrofurfuryl alcohol to 1,5-pentanediol, Chem.l Commun. (2009) 2035–2037. 10.1039/b822942b. [29] C. Wang J.D. Lee Y. Ji T.M. Onn J. Luo C.B. Murray R.J. Gorte A Study of Tetrahydrofurfuryl Alcohol to 1,5-Pentanediol Over Pt–WOx/C Catal. Lett. 148 2018 1047 1054 10.1007/s10562-018-2323-6 C. Wang, J.D. Lee, Y. Ji, T.M. Onn, J. Luo, C.B. Murray, R.J. Gorte, A Study of Tetrahydrofurfuryl Alcohol to 1,5-Pentanediol Over Pt–WOx/C, Catal. Lett. 148 (2018) 1047–1054. 10.1007/s10562-018-2323-6. [30] Y.E. Kim K.Y. Lee M.S. Lee Morphology-dependent wrinkled silica-supported Pd catalysts for hydrogenation of furfural under mild conditions Catal. Today 426 2024 10.1016/j.cattod.2023.114392 Y.E. Kim, K.Y. Lee, M.S. Lee, Morphology-dependent wrinkled silica-supported Pd catalysts for hydrogenation of furfural under mild conditions, Catal. Today 426 (2024). 10.1016/j.cattod.2023.114392. [31] B. Joddar E. Garcia A. Casas C.M. Stewart Development of functionalized multi-walled carbon-nanotube-based alginate hydrogels for enabling biomimetic technologies Sci. Rep. 6 2016 10.1038/srep32456 B. Joddar, E. Garcia, A. Casas, C.M. Stewart, Development of functionalized multi-walled carbon-nanotube-based alginate hydrogels for enabling biomimetic technologies, Sci. Rep. 6 (2016). 10.1038/srep32456. [32] J.S. Kim S.S. Hong J.H. Kim M.S. Lee Effect of preparation method for Pd/C catalysts on Pd characterization and their catalytic activity Appl. Chem. Eng. 26 2015 575 580 10.14478/ace.2015.1080 J.S. Kim, S.S. Hong, J.H. Kim, M.S. Lee, Effect of preparation method for Pd/C catalysts on Pd characterization and their catalytic activity, Appl. Chem. Eng. 26 (2015) 575–580. 10.14478/ace.2015.1080. [33] A. Ejsmont K. Kadela G. Grzybek T. Darvishzad G. Słowik M. Lofek J. Goscianska A. Kotarba P. Stelmachowski Speciation of oxygen functional groups on the carbon support controls the electrocatalytic activity of cobalt oxide nanoparticles in the oxygen evolution reaction ACS Appl. Mater. Interfaces 15 2023 5148 5160 10.1021/acsami.2c18403 A. Ejsmont, K. Kadela, G. Grzybek, T. Darvishzad, G. Słowik, M. Lofek, J. Goscianska, A. Kotarba, P. Stelmachowski, Speciation of oxygen functional groups on the carbon support controls the electrocatalytic activity of cobalt oxide nanoparticles in the oxygen evolution reaction, ACS Appl. Mater. Interfaces. 15 (2023) 5148–5160. 10.1021/acsami.2c18403. [34] M. Thommes K. Kaneko A.V. Neimark J.P. Olivier F. Rodriguez-Reinoso J. Rouquerol K.S.W. Sing Physisorption of gases, with special reference to the evaluation of surface area and pore size distribution (IUPAC Technical Report) Pure Appl. Chem. 87 2015 1051 1069 10.1515/pac-2014-1117 M. Thommes, K. Kaneko, A.V. Neimark, J.P. Olivier, F. Rodriguez-Reinoso, J. Rouquerol, K.S.W. Sing, Physisorption of gases, with special reference to the evaluation of surface area and pore size distribution (IUPAC Technical Report), Pure Appl. Chem. 87 (2015) 1051–1069. 10.1515/pac-2014-1117. [35] A.F. Hassan A.M. Abdel-Mohsen M.M.G. Fouda Comparative study of calcium alginate, activated carbon, and their composite beads on methylene blue adsorption Carbohydr. Polym. 102 2014 192 198 10.1016/j.carbpol.2013.10.104 A.F. Hassan, A.M. Abdel-Mohsen, M.M.G. Fouda, Comparative study of calcium alginate, activated carbon, and their composite beads on methylene blue adsorption, Carbohydr. Polym. 102 (2014) 192–198. 10.1016/j.carbpol.2013.10.104. [36] S.M. Elbayomi H. Wang T.M. Tamer Y. You Enhancement of antioxidant and hydrophobic properties of alginate via aromatic derivatization: preparation, characterization, and evaluation Polymers 2021 13 10.3390/polym13152575 . (Basel) S.M. Elbayomi, H. Wang, T.M. Tamer, Y. You, Enhancement of antioxidant and hydrophobic properties of alginate via aromatic derivatization: preparation, characterization, and evaluation, Polymers. (Basel) 13 (2021). 10.3390/polym13152575. [37] L. Bahsis E.H. Ablouh H. Anane M. Taourirte M. Julve S.E. Stiriba Cu(ii)-alginate-based superporous hydrogel catalyst for click chemistry azide-alkyne cycloaddition type reactions in water RSC Adv. 10 2020 32821 32832 10.1039/d0ra06410f L. Bahsis, E.H. Ablouh, H. Anane, M. Taourirte, M. Julve, S.E. Stiriba, Cu(ii)-alginate-based superporous hydrogel catalyst for click chemistry azide-alkyne cycloaddition type reactions in water, RSC Adv. 10 (2020) 32821–32832. 10.1039/d0ra06410f. [38] B. Sarker D.G. Papageorgiou R. Silva T. Zehnder F. Gul-E-Noor M. Bertmer J. Kaschta K. Chrissafis R. Detsch A.R. Boccaccini Fabrication of alginate-gelatin crosslinked hydrogel microcapsules and evaluation of the microstructure and physico-chemical properties J. Mater. Chem. B 2 2014 1470 1482 10.1039/c3tb21509a B. Sarker, D.G. Papageorgiou, R. Silva, T. Zehnder, F. Gul-E-Noor, M. Bertmer, J. Kaschta, K. Chrissafis, R. Detsch, A.R. Boccaccini, Fabrication of alginate-gelatin crosslinked hydrogel microcapsules and evaluation of the microstructure and physico-chemical properties, J. Mater. Chem. B 2 (2014) 1470–1482. 10.1039/c3tb21509a. [39] S. Yang Y. Chen S. Huang L. Deng Y. Wu X. Zheng S. Omonov M. Zeng Gelatin-pyrolyzed mesoporous N-doped carbon supported Pd as high-performance catalysts for aqueous Heck reactions Appl. Organomet. Chem. 35 2021 10.1002/aoc.6285 S. Yang, Y. Chen, S. Huang, L. Deng, Y. Wu, X. Zheng, S. Omonov, M. Zeng, Gelatin-pyrolyzed mesoporous N-doped carbon supported Pd as high-performance catalysts for aqueous Heck reactions, Appl. Organomet. Chem. 35 (2021). 10.1002/aoc.6285. [40] H.F. Huo D. Liu A. Bao T. Muschin C. Bai Y.S. Bao Mesoporous carbon-supported Pd nanoparticles in the metallic state-catalyzed acylation of amides with aryl esters via C-O activation ACS Omega 7 2022 12779 12786 10.1021/acsomega.1c07342 H.F. Huo, D. Liu, A. Bao, T. Muschin, C. Bai, Y.S. Bao, Mesoporous carbon-supported Pd nanoparticles in the metallic state-catalyzed acylation of amides with aryl esters via C-O activation, ACS Omega 7 (2022) 12779–12786. 10.1021/acsomega.1c07342. [41] A. Cabiac T. Cacciaguerra P. Trens R. Durand G. Delahay A. Medevielle D. Plée B. Coq Influence of textural properties of activated carbons on Pd/carbon catalysts synthesis for cinnamaldehyde hydrogenation Appl. Catal. A Gen. 340 2008 229 235 10.1016/j.apcata.2008.02.018 A. Cabiac, T. Cacciaguerra, P. Trens, R. Durand, G. Delahay, A. Medevielle, D. Plée, B. Coq, Influence of textural properties of activated carbons on Pd/carbon catalysts synthesis for cinnamaldehyde hydrogenation, Appl. Catal. A Gen. 340 (2008) 229–235. 10.1016/j.apcata.2008.02.018. [42] H. Tamai U. Nobuaki H. Yasuda Preparation of Pd supported mesoporous activated carbons and their catalytic activity Mater. Chem. Phys. 114 2009 10 13 10.1016/j.matchemphys.2008.09.049 H. Tamai, U. Nobuaki, H. Yasuda, Preparation of Pd supported mesoporous activated carbons and their catalytic activity, Mater. Chem. Phys. 114 (2009) 10–13. 10.1016/j.matchemphys.2008.09.049. [43] G. Agostini E. Groppo A. Piovano R. Pellegrini G. Leofanti C. Lamberti Preparation of supported Pd catalysts: from the Pd precursor solution to the deposited Pd2+ phase Langmuir 26 2010 11204 11211 10.1021/la1005117 G. Agostini, E. Groppo, A. Piovano, R. Pellegrini, G. Leofanti, C. Lamberti, Preparation of supported Pd catalysts: from the Pd precursor solution to the deposited Pd2+ phase, Langmuir. 26 (2010) 11204–11211. 10.1021/la1005117. [44] R. Pellegrini G. Agostini E. Groppo A. Piovano G. Leofanti C. Lamberti 0.5wt.% Pd/C catalyst for purification of terephthalic acid: irreversible deactivation in industrial plants J. Catal. 280 2011 150 160 10.1016/j.jcat.2011.03.012 R. Pellegrini, G. Agostini, E. Groppo, A. Piovano, G. Leofanti, C. Lamberti, 0.5wt.% Pd/C catalyst for purification of terephthalic acid: irreversible deactivation in industrial plants, J. Catal. 280 (2011) 150–160. 10.1016/j.jcat.2011.03.012. [45] W.S. Lamme O. van der Heijden N.A. Krans E. Nöllen N. Mager S. Hermans J. Zečević K.P. de Jong Origin and prevention of broad particle size distributions in carbon-supported palladium catalysts prepared by liquid-phase reduction J. Catal. 375 2019 448 455 10.1016/j.jcat.2019.06.034 W.S. Lamme, O. van der Heijden, N.A. Krans, E. Nöllen, N. Mager, S. Hermans, J. Zečević, K.P. de Jong, Origin and prevention of broad particle size distributions in carbon-supported palladium catalysts prepared by liquid-phase reduction, J. Catal. 375 (2019) 448–455. 10.1016/j.jcat.2019.06.034. [46] D.P. Chen X.C. Liu X.D. Liu L. Yuan M.L. Zhong C.Y. Wang Pd nanoparticles on self-doping-defects mesoporous carbon supports for highly active ethanol oxidation and ethylene glycol oxidation Int. J. Hydrog. Energy 46 2021 30455 30466 10.1016/j.ijhydene.2021.06.167 D.P. Chen, X.C. Liu, X.D. Liu, L. Yuan, M.L. Zhong, C.Y. Wang, Pd nanoparticles on self-doping-defects mesoporous carbon supports for highly active ethanol oxidation and ethylene glycol oxidation, Int. J. Hydrog. Energy 46 (2021) 30455–30466. 10.1016/j.ijhydene.2021.06.167. [47] W.J. Lee S. Bera C.M. Kim E.K. Koh W.P. Hong S.J. Oh E.A. Cho S.H. Kwon Synthesis of highly dispersed Pt nanoparticles into carbon supports by fluidized bed reactor atomic layer deposition to boost PEMFC performance NPG Asia Mater. 12 2020 10.1038/s41427-020-0223-x W.J. Lee, S. Bera, C.M. Kim, E.K. Koh, W.P. Hong, S.J. Oh, E.A. Cho, S.H. Kwon, Synthesis of highly dispersed Pt nanoparticles into carbon supports by fluidized bed reactor atomic layer deposition to boost PEMFC performance, NPG Asia Mater. 12 (2020). 10.1038/s41427-020-0223-x. [48] M. Hronec K. Fulajtarová Selective transformation of furfural to cyclopentanone Catal. Commun. 24 2012 100 104 10.1016/j.catcom.2012.03.020 M. Hronec, K. Fulajtarová, Selective transformation of furfural to cyclopentanone, Catal. Commun. 24 (2012) 100–104. 10.1016/j.catcom.2012.03.020. [49] A.Y. Stakheev I.S. Mashkovskii G.N. Baeva N.S. Telegina Specific features of the catalytic behavior of supported palladium nanoparticles in heterogeneous catalytic reactions Russ. J. Gen. Chem. 80 2010 618 629 10.1134/S1070363210030424 A.Y. Stakheev, I.S. Mashkovskii, G.N. Baeva, N.S. Telegina, Specific features of the catalytic behavior of supported palladium nanoparticles in heterogeneous catalytic reactions, Russ. J. Gen. Chem. 80 (2010) 618–629. 10.1134/S1070363210030424. [50] Z. Yu L. Zhang Z. Zhang S. Zhang S. Hu J. Xiang Y. Wang Q. Liu Q. Liu X. Hu Silica of varied pore sizes as supports of copper catalysts for hydrogenation of furfural and phenolics: impacts of steric hindrance Int. J. Hydrog. Energy 45 2020 2720 2728 10.1016/j.ijhydene.2019.11.145 Z. Yu, L. Zhang, Z. Zhang, S. Zhang, S. Hu, J. Xiang, Y. Wang, Q. Liu, Q. Liu, X. Hu, Silica of varied pore sizes as supports of copper catalysts for hydrogenation of furfural and phenolics: impacts of steric hindrance, Int. J. Hydrog. Energy 45 (2020) 2720–2728. 10.1016/j.ijhydene.2019.11.145. [51] M.Y. Byun M.S. Lee Pt supported on hierarchical porous carbon for furfural hydrogenation J. Ind. Eng. Chem. 104 2021 406 415 10.1016/j.jiec.2021.08.038 M.Y. Byun, M.S. Lee, Pt supported on hierarchical porous carbon for furfural hydrogenation, J. Ind. Eng. Chem. 104 (2021) 406–415. 10.1016/j.jiec.2021.08.038. [52] R. Rajesh Y.Dominic Ravichandran Development of a new carbon nanotube- alginate-hydroxyapatite tricomponent composite scaffold for application in bone tissue engineering Int. J. Nanomed. 10 2015 7 15 10.2147/IJN.S79971 R. Rajesh, Y.Dominic Ravichandran, Development of a new carbon nanotube- alginate-hydroxyapatite tricomponent composite scaffold for application in bone tissue engineering, Int. J. Nanomed. 10 (2015) 7–15. 10.2147/IJN.S79971.",
      "scopus-id": "85187205848",
      "coredata": {
        "eid": "1-s2.0-S2468823124002086",
        "dc:description": "In green heterogeneous catalytic systems, alginate has emerged as a promising material for transforming powder catalysts into solid forms because of its sustainability and non-toxicity. Herein, the effect of carbon supports, including activated carbon (AC), carbon black (CB), carbon nanotubes (CNT), and carbon nanofibers (CNF), on a bead-type Pd/alginate-carbon catalyst was studied. Bead-type supports were synthesized by alginate gelation, and Pd-supported bead-type catalysts were prepared by a chemical reduction method. The catalytic activity in the hydrogenation of furfural was evaluated. Physical properties such as the specific surface area and pore volume of the carbon support greatly influenced the properties of the bead-type Pd/C catalyst. Pd/CB-alginate bead (AB), which had the highest specific surface area and pore volume, exhibited the smallest Pd particle size and dispersion, resulting in the highest catalytic performance. Additionally, the catalyst exhibited the highest FF conversion of 99 % and tetrahydrofurfuryl alcohol selectivity of 92 % under 20 bar of H2 at 35 ℃ for 4 h.",
        "openArchiveArticle": "false",
        "prism:coverDate": "2024-04-01",
        "openaccessUserLicense": null,
        "prism:aggregationType": "Journal",
        "prism:url": "https://api.elsevier.com/content/article/pii/S2468823124002086",
        "dc:creator": [
          {
            "@_fa": "true",
            "$": "Kim, Gangmin"
          },
          {
            "@_fa": "true",
            "$": "Kim, Ye Eun"
          },
          {
            "@_fa": "true",
            "$": "Jae, Jungho"
          },
          {
            "@_fa": "true",
            "$": "Lee, Man Sig"
          }
        ],
        "link": [
          {
            "@_fa": "true",
            "@rel": "self",
            "@href": "https://api.elsevier.com/content/article/pii/S2468823124002086"
          },
          {
            "@_fa": "true",
            "@rel": "scidir",
            "@href": "https://www.sciencedirect.com/science/article/pii/S2468823124002086"
          }
        ],
        "dc:format": "application/json",
        "openaccessType": null,
        "pii": "S2468-8231(24)00208-6",
        "prism:volume": "558",
        "articleNumber": "114025",
        "prism:publisher": "Elsevier B.V.",
        "dc:title": "Effect of physicochemical properties of carbons on the performance of bead-type Pd/C catalysts for furfural hydrogenation",
        "prism:copyright": "© 2024 Elsevier B.V. All rights reserved.",
        "openaccess": "0",
        "prism:issn": "24688231",
        "dcterms:subject": [
          {
            "@_fa": "true",
            "$": "Alginate"
          },
          {
            "@_fa": "true",
            "$": "Bead-type Pd/C catalyst"
          },
          {
            "@_fa": "true",
            "$": "Carbon support"
          },
          {
            "@_fa": "true",
            "$": "Furfural"
          },
          {
            "@_fa": "true",
            "$": "Hydrogenation"
          }
        ],
        "openaccessArticle": "false",
        "prism:publicationName": "Molecular Catalysis",
        "openaccessSponsorType": null,
        "prism:pageRange": "114025",
        "pubType": "fla",
        "prism:coverDisplayDate": "1 April 2024",
        "prism:doi": "10.1016/j.mcat.2024.114025",
        "prism:startingPage": "114025",
        "dc:identifier": "doi:10.1016/j.mcat.2024.114025",
        "openaccessSponsorName": null
      },
      "objects": {
        "object": [
          {
            "@category": "standard",
            "@height": "252",
            "@width": "602",
            "@_fa": "true",
            "$": "https://api.elsevier.com/content/object/eid/1-s2.0-S2468823124002086-sc1.jpg?httpAccept=%2A%2F%2A",
            "@multimediatype": "JPEG image file",
            "@type": "IMAGE-DOWNSAMPLED",
            "@size": "18663",
            "@ref": "sc1",
            "@mimetype": "image/jpeg"
          },
          {
            "@category": "standard",
            "@height": "297",
            "@width": "715",
            "@_fa": "true",
            "$": "https://api.elsevier.com/content/object/eid/1-s2.0-S2468823124002086-gr9.jpg?httpAccept=%2A%2F%2A",
            "@multimediatype": "JPEG image file",
            "@type": "IMAGE-DOWNSAMPLED",
            "@size": "54349",
            "@ref": "gr9",
            "@mimetype": "image/jpeg"
          },
          {
            "@category": "standard",
            "@height": "266",
            "@width": "361",
            "@_fa": "true",
            "$": "https://api.elsevier.com/content/object/eid/1-s2.0-S2468823124002086-gr8.jpg?httpAccept=%2A%2F%2A",
            "@multimediatype": "JPEG image file",
            "@type": "IMAGE-DOWNSAMPLED",
            "@size": "30776",
            "@ref": "gr8",
            "@mimetype": "image/jpeg"
          },
          {
            "@category": "standard",
            "@height": "256",
            "@width": "640",
            "@_fa": "true",
            "$": "https://api.elsevier.com/content/object/eid/1-s2.0-S2468823124002086-gr3.jpg?httpAccept=%2A%2F%2A",
            "@multimediatype": "JPEG image file",
            "@type": "IMAGE-DOWNSAMPLED",
            "@size": "75080",
            "@ref": "gr3",
            "@mimetype": "image/jpeg"
          },
          {
            "@category": "standard",
            "@height": "705",
            "@width": "715",
            "@_fa": "true",
            "$": "https://api.elsevier.com/content/object/eid/1-s2.0-S2468823124002086-gr2.jpg?httpAccept=%2A%2F%2A",
            "@multimediatype": "JPEG image file",
            "@type": "IMAGE-DOWNSAMPLED",
            "@size": "152204",
            "@ref": "gr2",
            "@mimetype": "image/jpeg"
          },
          {
            "@category": "standard",
            "@height": "153",
            "@width": "500",
            "@_fa": "true",
            "$": "https://api.elsevier.com/content/object/eid/1-s2.0-S2468823124002086-ga1.jpg?httpAccept=%2A%2F%2A",
            "@multimediatype": "JPEG image file",
            "@type": "IMAGE-DOWNSAMPLED",
            "@size": "33226",
            "@ref": "ga1",
            "@mimetype": "image/jpeg"
          },
          {
            "@category": "standard",
            "@height": "661",
            "@width": "634",
            "@_fa": "true",
            "$": "https://api.elsevier.com/content/object/eid/1-s2.0-S2468823124002086-gr1.jpg?httpAccept=%2A%2F%2A",
            "@multimediatype": "JPEG image file",
            "@type": "IMAGE-DOWNSAMPLED",
            "@size": "64079",
            "@ref": "gr1",
            "@mimetype": "image/jpeg"
          },
          {
            "@category": "standard",
            "@height": "287",
            "@width": "348",
            "@_fa": "true",
            "$": "https://api.elsevier.com/content/object/eid/1-s2.0-S2468823124002086-gr7.jpg?httpAccept=%2A%2F%2A",
            "@multimediatype": "JPEG image file",
            "@type": "IMAGE-DOWNSAMPLED",
            "@size": "23571",
            "@ref": "gr7",
            "@mimetype": "image/jpeg"
          },
          {
            "@category": "standard",
            "@height": "603",
            "@width": "602",
            "@_fa": "true",
            "$": "https://api.elsevier.com/content/object/eid/1-s2.0-S2468823124002086-gr6.jpg?httpAccept=%2A%2F%2A",
            "@multimediatype": "JPEG image file",
            "@type": "IMAGE-DOWNSAMPLED",
            "@size": "137049",
            "@ref": "gr6",
            "@mimetype": "image/jpeg"
          },
          {
            "@category": "standard",
            "@height": "294",
            "@width": "380",
            "@_fa": "true",
            "$": "https://api.elsevier.com/content/object/eid/1-s2.0-S2468823124002086-gr5.jpg?httpAccept=%2A%2F%2A",
            "@multimediatype": "JPEG image file",
            "@type": "IMAGE-DOWNSAMPLED",
            "@size": "44510",
            "@ref": "gr5",
            "@mimetype": "image/jpeg"
          },
          {
            "@category": "standard",
            "@height": "291",
            "@width": "361",
            "@_fa": "true",
            "$": "https://api.elsevier.com/content/object/eid/1-s2.0-S2468823124002086-gr4.jpg?httpAccept=%2A%2F%2A",
            "@multimediatype": "JPEG image file",
            "@type": "IMAGE-DOWNSAMPLED",
            "@size": "32673",
            "@ref": "gr4",
            "@mimetype": "image/jpeg"
          },
          {
            "@category": "thumbnail",
            "@height": "92",
            "@width": "219",
            "@_fa": "true",
            "$": "https://api.elsevier.com/content/object/eid/1-s2.0-S2468823124002086-sc1.sml?httpAccept=%2A%2F%2A",
            "@multimediatype": "GIF image file",
            "@type": "IMAGE-THUMBNAIL",
            "@size": "3805",
            "@ref": "sc1",
            "@mimetype": "image/gif"
          },
          {
            "@category": "thumbnail",
            "@height": "91",
            "@width": "219",
            "@_fa": "true",
            "$": "https://api.elsevier.com/content/object/eid/1-s2.0-S2468823124002086-gr9.sml?httpAccept=%2A%2F%2A",
            "@multimediatype": "GIF image file",
            "@type": "IMAGE-THUMBNAIL",
            "@size": "9629",
            "@ref": "gr9",
            "@mimetype": "image/gif"
          },
          {
            "@category": "thumbnail",
            "@height": "162",
            "@width": "219",
            "@_fa": "true",
            "$": "https://api.elsevier.com/content/object/eid/1-s2.0-S2468823124002086-gr8.sml?httpAccept=%2A%2F%2A",
            "@multimediatype": "GIF image file",
            "@type": "IMAGE-THUMBNAIL",
            "@size": "9181",
            "@ref": "gr8",
            "@mimetype": "image/gif"
          },
          {
            "@category": "thumbnail",
            "@height": "88",
            "@width": "219",
            "@_fa": "true",
            "$": "https://api.elsevier.com/content/object/eid/1-s2.0-S2468823124002086-gr3.sml?httpAccept=%2A%2F%2A",
            "@multimediatype": "GIF image file",
            "@type": "IMAGE-THUMBNAIL",
            "@size": "10892",
            "@ref": "gr3",
            "@mimetype": "image/gif"
          },
          {
            "@category": "thumbnail",
            "@height": "164",
            "@width": "166",
            "@_fa": "true",
            "$": "https://api.elsevier.com/content/object/eid/1-s2.0-S2468823124002086-gr2.sml?httpAccept=%2A%2F%2A",
            "@multimediatype": "GIF image file",
            "@type": "IMAGE-THUMBNAIL",
            "@size": "21650",
            "@ref": "gr2",
            "@mimetype": "image/gif"
          },
          {
            "@category": "thumbnail",
            "@height": "67",
            "@width": "219",
            "@_fa": "true",
            "$": "https://api.elsevier.com/content/object/eid/1-s2.0-S2468823124002086-ga1.sml?httpAccept=%2A%2F%2A",
            "@multimediatype": "GIF image file",
            "@type": "IMAGE-THUMBNAIL",
            "@size": "10295",
            "@ref": "ga1",
            "@mimetype": "image/gif"
          },
          {
            "@category": "thumbnail",
            "@height": "164",
            "@width": "157",
            "@_fa": "true",
            "$": "https://api.elsevier.com/content/object/eid/1-s2.0-S2468823124002086-gr1.sml?httpAccept=%2A%2F%2A",
            "@multimediatype": "GIF image file",
            "@type": "IMAGE-THUMBNAIL",
            "@size": "9522",
            "@ref": "gr1",
            "@mimetype": "image/gif"
          },
          {
            "@category": "thumbnail",
            "@height": "164",
            "@width": "199",
            "@_fa": "true",
            "$": "https://api.elsevier.com/content/object/eid/1-s2.0-S2468823124002086-gr7.sml?httpAccept=%2A%2F%2A",
            "@multimediatype": "GIF image file",
            "@type": "IMAGE-THUMBNAIL",
            "@size": "7771",
            "@ref": "gr7",
            "@mimetype": "image/gif"
          },
          {
            "@category": "thumbnail",
            "@height": "163",
            "@width": "163",
            "@_fa": "true",
            "$": "https://api.elsevier.com/content/object/eid/1-s2.0-S2468823124002086-gr6.sml?httpAccept=%2A%2F%2A",
            "@multimediatype": "GIF image file",
            "@type": "IMAGE-THUMBNAIL",
            "@size": "19019",
            "@ref": "gr6",
            "@mimetype": "image/gif"
          },
          {
            "@category": "thumbnail",
            "@height": "163",
            "@width": "211",
            "@_fa": "true",
            "$": "https://api.elsevier.com/content/object/eid/1-s2.0-S2468823124002086-gr5.sml?httpAccept=%2A%2F%2A",
            "@multimediatype": "GIF image file",
            "@type": "IMAGE-THUMBNAIL",
            "@size": "11473",
            "@ref": "gr5",
            "@mimetype": "image/gif"
          },
          {
            "@category": "thumbnail",
            "@height": "164",
            "@width": "203",
            "@_fa": "true",
            "$": "https://api.elsevier.com/content/object/eid/1-s2.0-S2468823124002086-gr4.sml?httpAccept=%2A%2F%2A",
            "@multimediatype": "GIF image file",
            "@type": "IMAGE-THUMBNAIL",
            "@size": "9359",
            "@ref": "gr4",
            "@mimetype": "image/gif"
          },
          {
            "@category": "high",
            "@height": "1115",
            "@width": "2667",
            "@_fa": "true",
            "$": "https://api.elsevier.com/content/object/eid/1-s2.0-S2468823124002086-sc1_lrg.jpg?httpAccept=%2A%2F%2A",
            "@multimediatype": "JPEG image file",
            "@type": "IMAGE-HIGH-RES",
            "@size": "165211",
            "@ref": "sc1",
            "@mimetype": "image/jpeg"
          },
          {
            "@category": "high",
            "@height": "1317",
            "@width": "3167",
            "@_fa": "true",
            "$": "https://api.elsevier.com/content/object/eid/1-s2.0-S2468823124002086-gr9_lrg.jpg?httpAccept=%2A%2F%2A",
            "@multimediatype": "JPEG image file",
            "@type": "IMAGE-HIGH-RES",
            "@size": "527704",
            "@ref": "gr9",
            "@mimetype": "image/jpeg"
          },
          {
            "@category": "high",
            "@height": "1181",
            "@width": "1600",
            "@_fa": "true",
            "$": "https://api.elsevier.com/content/object/eid/1-s2.0-S2468823124002086-gr8_lrg.jpg?httpAccept=%2A%2F%2A",
            "@multimediatype": "JPEG image file",
            "@type": "IMAGE-HIGH-RES",
            "@size": "216281",
            "@ref": "gr8",
            "@mimetype": "image/jpeg"
          },
          {
            "@category": "high",
            "@height": "1133",
            "@width": "2833",
            "@_fa": "true",
            "$": "https://api.elsevier.com/content/object/eid/1-s2.0-S2468823124002086-gr3_lrg.jpg?httpAccept=%2A%2F%2A",
            "@multimediatype": "JPEG image file",
            "@type": "IMAGE-HIGH-RES",
            "@size": "547850",
            "@ref": "gr3",
            "@mimetype": "image/jpeg"
          },
          {
            "@category": "high",
            "@height": "3121",
            "@width": "3167",
            "@_fa": "true",
            "$": "https://api.elsevier.com/content/object/eid/1-s2.0-S2468823124002086-gr2_lrg.jpg?httpAccept=%2A%2F%2A",
            "@multimediatype": "JPEG image file",
            "@type": "IMAGE-HIGH-RES",
            "@size": "1205118",
            "@ref": "gr2",
            "@mimetype": "image/jpeg"
          },
          {
            "@category": "high",
            "@height": "679",
            "@width": "2213",
            "@_fa": "true",
            "$": "https://api.elsevier.com/content/object/eid/1-s2.0-S2468823124002086-ga1_lrg.jpg?httpAccept=%2A%2F%2A",
            "@multimediatype": "JPEG image file",
            "@type": "IMAGE-HIGH-RES",
            "@size": "203080",
            "@ref": "ga1",
            "@mimetype": "image/jpeg"
          },
          {
            "@category": "high",
            "@height": "2925",
            "@width": "2806",
            "@_fa": "true",
            "$": "https://api.elsevier.com/content/object/eid/1-s2.0-S2468823124002086-gr1_lrg.jpg?httpAccept=%2A%2F%2A",
            "@multimediatype": "JPEG image file",
            "@type": "IMAGE-HIGH-RES",
            "@size": "490337",
            "@ref": "gr1",
            "@mimetype": "image/jpeg"
          },
          {
            "@category": "high",
            "@height": "1272",
            "@width": "1542",
            "@_fa": "true",
            "$": "https://api.elsevier.com/content/object/eid/1-s2.0-S2468823124002086-gr7_lrg.jpg?httpAccept=%2A%2F%2A",
            "@multimediatype": "JPEG image file",
            "@type": "IMAGE-HIGH-RES",
            "@size": "152227",
            "@ref": "gr7",
            "@mimetype": "image/jpeg"
          },
          {
            "@category": "high",
            "@height": "2673",
            "@width": "2667",
            "@_fa": "true",
            "$": "https://api.elsevier.com/content/object/eid/1-s2.0-S2468823124002086-gr6_lrg.jpg?httpAccept=%2A%2F%2A",
            "@multimediatype": "JPEG image file",
            "@type": "IMAGE-HIGH-RES",
            "@size": "1272177",
            "@ref": "gr6",
            "@mimetype": "image/jpeg"
          },
          {
            "@category": "high",
            "@height": "1304",
            "@width": "1683",
            "@_fa": "true",
            "$": "https://api.elsevier.com/content/object/eid/1-s2.0-S2468823124002086-gr5_lrg.jpg?httpAccept=%2A%2F%2A",
            "@multimediatype": "JPEG image file",
            "@type": "IMAGE-HIGH-RES",
            "@size": "288443",
            "@ref": "gr5",
            "@mimetype": "image/jpeg"
          },
          {
            "@category": "high",
            "@height": "1290",
            "@width": "1600",
            "@_fa": "true",
            "$": "https://api.elsevier.com/content/object/eid/1-s2.0-S2468823124002086-gr4_lrg.jpg?httpAccept=%2A%2F%2A",
            "@multimediatype": "JPEG image file",
            "@type": "IMAGE-HIGH-RES",
            "@size": "241967",
            "@ref": "gr4",
            "@mimetype": "image/jpeg"
          },
          {
            "@category": "standard",
            "@_fa": "true",
            "$": "https://api.elsevier.com/content/object/eid/1-s2.0-S2468823124002086-mmc1.docx?httpAccept=%2A%2F%2A",
            "@multimediatype": "Microsoft Word file",
            "@type": "APPLICATION",
            "@size": "598906",
            "@ref": "mmc1",
            "@mimetype": "application/word"
          },
          {
            "@category": "thumbnail",
            "@_fa": "true",
            "$": "https://api.elsevier.com/content/object/eid/1-s2.0-S2468823124002086-si1.svg?httpAccept=%2A%2F%2A",
            "@multimediatype": "Scalable Vector Graphics file",
            "@type": "ALTIMG",
            "@size": "19972",
            "@ref": "si1",
            "@mimetype": "image/svg+xml"
          },
          {
            "@category": "thumbnail",
            "@_fa": "true",
            "$": "https://api.elsevier.com/content/object/eid/1-s2.0-S2468823124002086-si2.svg?httpAccept=%2A%2F%2A",
            "@multimediatype": "Scalable Vector Graphics file",
            "@type": "ALTIMG",
            "@size": "20894",
            "@ref": "si2",
            "@mimetype": "image/svg+xml"
          },
          {
            "@category": "standard",
            "@_fa": "true",
            "$": "https://api.elsevier.com/content/object/eid/1-s2.0-S2468823124002086-am.pdf?httpAccept=%2A%2F%2A",
            "@multimediatype": "Acrobat PDF file",
            "@type": "AAM-PDF",
            "@size": "898096",
            "@ref": "am",
            "@mimetype": "application/pdf"
          }
        ]
      },
      "link": {
        "@rel": "abstract",
        "@href": "https://api.elsevier.com/content/abstract/scopus_id/85187205848"
      }
    }
  }
}