{
  "metadata": {
    "title": "Zinc and magnesium catalysts for the synthesis for PLA and its degradation: Clues for catalyst design",
    "authors": "; ; ",
    "journal": "Molecular Catalysis",
    "date": "2022-08-31",
    "doi": "10.1016/j.mcat.2022.112480",
    "abstract": "",
    "uri": "https://api.elsevier.com/content/article/pii/S2468823122003662",
    "pii": "S2468823122003662"
  },
  "fulltext": {
    "full-text-retrieval-response": {
      "scopus-eid": "2-s2.0-85133531630",
      "originalText": "serial JL 315758 291210 291744 291790 291809 31 Molecular Catalysis MOLECULARCATALYSIS 2022-07-06 2022-07-06 2022-07-06 2022-07-06 2023-04-22T07:57:07 1-s2.0-S2468823122003662 S2468-8231(22)00366-2 S2468823122003662 10.1016/j.mcat.2022.112480 S300 S300.1 FULL-TEXT 1-s2.0-S2468823122X00114 2024-06-26T17:47:42.372199Z 0 0 20220801 20220831 2022 2022-07-06T17:24:26.693556Z absattachment articleinfo articlenumber articletitlenorm authfirstinitialnorm authfirstsurnamenorm cid cids contenttype copyright crossmark dateloaded dateloadedtxt datesearch datesort dateupdated dco docsubtype doctype doi eid ewtransactionid hubeid indexeddate issn issnnorm itemstage itemtransactionid itemweight openaccess openarchive pg pgfirst pii piinorm pubdateend pubdatestart pubdatetxt pubyr sectiontitle sortorder srctitle srctitlenorm srctype ssids alllist content subj subheadings suppl tomb volfirst volissue volumelist webpdf webpdfpagecount yearnav figure table e-component body acknowledge affil appendices articletitle auth authfirstini authfull authkeywords authlast highlightsabst orcid primabst ref specialabst 2468-8231 24688231 true 528 528 C Volume 528 46 112480 112480 112480 202208 August 2022 2022-08-01 2022-08-31 2022 Regular Papers article fla © 2022 Elsevier B.V. All rights reserved. ZINCMAGNESIUMCATALYSTSFORSYNTHESISFORPLADEGRADATIONCLUESFORCATALYSTDESIGN SANTULLI F 1 Introduction 2 Results and discussion 2.1 Synthesis of complexes 2.2 Polymerization of L-lactide 2.3 Mechanistic studies 2.4 Degradation studies of PLA Conclusions Experimental section CRediT authorship contribution statement Acknowledgment Appendix Supplementary materials References GEYER 2017 R JAMBECK 2015 768 771 J TSCHAN 2012 836 851 M ZHANG 2018 839 885 X COATES 2020 501 G SHELDON 2020 6310 6322 R RAHIMI 2017 0046 A VINK 2004 551 564 E LUNT 1998 145 152 J AURAS 2004 835 864 R MCKEOWN 2020 1 22 P PAYNE 2021 4041 4070 J FAN 2009 293 324 Y PEREIRA 2011 2658 C LACKMANN 2021 125889 C THEVENON 2016 8680 8685 A DAURIA 2012 2349 2360 I ZHENG 2008 2279 2291 Z DAURIA 2017 12217 12225 I PILONE 2013 13036 13047 A ROSEN 2020 17183 17189 T ROSEN 2018 7191 7195 T SANTULLI 2020 1213 1220 F ISNARD 2018 5034 5043 F STRIANESE 2020 16533 16550 M ROBERT 2017 6217 6225 C PILONE 2014 2940 2943 A HADOR 2019 14679 14685 R MARIN 2019 12585 12589 P THOMAS 2010 165 173 C TSCHAN 2021 13587 13608 M HERRESPAWLIS 2022 e202112853 S GUILLAUME 2015 7988 8003 S STRIANESE 2020 16533 16550 M GESSLBAUER 2019 7912 7920 S LUKE 2020 1809 1818 A DALTERIO 2020 2221 2225 M DALTERIO 2021 1611 1614 M PAYNE 2019 170 181 J NUNES 2020 2419 B FERNANDES 2021 4228 4233 A LIU 2015 135 H YANG 2020 18347 18353 R FLIEDEL 2014 1357 1367 C WHITELAW 2011 10004 10006 E DALTERIO 2022 5115 5122 M PAYNE 2020 2381 2389 J STEWART 2022 1416 1424 J PAYNE 2021 8453 8469 J PAYNE 2021 1086 1096 J SANTULLI 2021 5470 5475 F MCKEOWN 2018 5339 5347 P MCKEOWN 2019 5233 5238 P SCHAEFER 2019 1020 1026 P RITTINGHAUS 2019 2161 2165 R HERMANN 2020 21778 21784 A ROMANRAMIREZ 2019 409 416 L SANTULLIX2022X112480 SANTULLIX2022X112480XF 2024-07-06T00:00:00.000Z 2024-07-06T00:00:00.000Z http://creativecommons.org/licenses/by-nc-nd/4.0/ © 2022 Elsevier B.V. All rights reserved. 2022-07-09T21:43:27.634Z http://vtw.elsevier.com/data/voc/AddOnTypes/50.7/aggregated-refined School of Chemistry of Tel Aviv University The authors thank The School of Chemistry of Tel Aviv University (Israel) for GPC analysis, Dr Patrizia Oliva for NMR assistance and Dr Patrizia Iannece for Maldi ToF analysis. https://doi.org/10.15223/policy-017 https://doi.org/10.15223/policy-037 https://doi.org/10.15223/policy-012 https://doi.org/10.15223/policy-029 https://doi.org/10.15223/policy-004 item S2468-8231(22)00366-2 S2468823122003662 1-s2.0-S2468823122003662 10.1016/j.mcat.2022.112480 315758 2023-04-22T20:35:22.661452Z 2022-08-01 2022-08-31 1-s2.0-S2468823122003662-main.pdf https://s3-eu-west-1.amazonaws.com/prod-ucs-content-store-eu-west/content/pii:S2468823122003662/MAIN/application/pdf/8709064d6c23fed038ae5241a7c01765/main.pdf main.pdf pdf true 2111795 MAIN 8 1-s2.0-S2468823122003662-main_1.png https://s3-eu-west-1.amazonaws.com/prod-ucs-content-store-eu-west/content/pii:S2468823122003662/PREVIEW/image/png/12f5df9d3bedde55dc7d34c233759991/main_1.png main_1.png png 59112 849 656 IMAGE-WEB-PDF 1 1-s2.0-S2468823122003662-sc2.jpg https://s3-eu-west-1.amazonaws.com/prod-ucs-content-store-eu-west/content/pii:S2468823122003662/sc2/DOWNSAMPLED/image/jpeg/44392091da62aadf8506951d838243c9/sc2.jpg sc2 sc2.jpg jpg 17831 282 489 IMAGE-DOWNSAMPLED 1-s2.0-S2468823122003662-sc3.jpg https://s3-eu-west-1.amazonaws.com/prod-ucs-content-store-eu-west/content/pii:S2468823122003662/sc3/DOWNSAMPLED/image/jpeg/2f4b69b0433aa089939204ce3480f631/sc3.jpg sc3 sc3.jpg jpg 7490 227 188 IMAGE-DOWNSAMPLED 1-s2.0-S2468823122003662-sc1.jpg https://s3-eu-west-1.amazonaws.com/prod-ucs-content-store-eu-west/content/pii:S2468823122003662/sc1/DOWNSAMPLED/image/jpeg/f00f039ab4057921df3b1d99628c7006/sc1.jpg sc1 sc1.jpg jpg 8342 81 489 IMAGE-DOWNSAMPLED 1-s2.0-S2468823122003662-gr3.jpg https://s3-eu-west-1.amazonaws.com/prod-ucs-content-store-eu-west/content/pii:S2468823122003662/gr3/DOWNSAMPLED/image/jpeg/8aab36a0db69b9f07bbe755dc5710140/gr3.jpg gr3 gr3.jpg jpg 27680 350 659 IMAGE-DOWNSAMPLED 1-s2.0-S2468823122003662-gr4.jpg https://s3-eu-west-1.amazonaws.com/prod-ucs-content-store-eu-west/content/pii:S2468823122003662/gr4/DOWNSAMPLED/image/jpeg/298cdfec2f132c35997e3e6074e9172c/gr4.jpg gr4 gr4.jpg jpg 29543 388 565 IMAGE-DOWNSAMPLED 1-s2.0-S2468823122003662-gr1.jpg https://s3-eu-west-1.amazonaws.com/prod-ucs-content-store-eu-west/content/pii:S2468823122003662/gr1/DOWNSAMPLED/image/jpeg/44239aa8454d772a188d80c766f025ed/gr1.jpg gr1 gr1.jpg jpg 29690 244 339 IMAGE-DOWNSAMPLED 1-s2.0-S2468823122003662-sc6.jpg https://s3-eu-west-1.amazonaws.com/prod-ucs-content-store-eu-west/content/pii:S2468823122003662/sc6/DOWNSAMPLED/image/jpeg/3c9ccc84481434514f7b140ab3e2f02e/sc6.jpg sc6 sc6.jpg jpg 22759 281 339 IMAGE-DOWNSAMPLED 1-s2.0-S2468823122003662-gr2.jpg https://s3-eu-west-1.amazonaws.com/prod-ucs-content-store-eu-west/content/pii:S2468823122003662/gr2/DOWNSAMPLED/image/jpeg/f8f1cd2325f60b99324c78636c30dfe0/gr2.jpg gr2 gr2.jpg jpg 17021 254 339 IMAGE-DOWNSAMPLED 1-s2.0-S2468823122003662-ga1.jpg https://s3-eu-west-1.amazonaws.com/prod-ucs-content-store-eu-west/content/pii:S2468823122003662/ga1/DOWNSAMPLED/image/jpeg/6280427f975bf215d3c3c9b5d85e5ea3/ga1.jpg ga1 true ga1.jpg jpg 40897 245 242 IMAGE-DOWNSAMPLED 1-s2.0-S2468823122003662-sc4.jpg https://s3-eu-west-1.amazonaws.com/prod-ucs-content-store-eu-west/content/pii:S2468823122003662/sc4/DOWNSAMPLED/image/jpeg/f1b51b289d143e0c5c18b68b09ecfef9/sc4.jpg sc4 sc4.jpg jpg 31969 299 659 IMAGE-DOWNSAMPLED 1-s2.0-S2468823122003662-sc5.jpg https://s3-eu-west-1.amazonaws.com/prod-ucs-content-store-eu-west/content/pii:S2468823122003662/sc5/DOWNSAMPLED/image/jpeg/7553b52a5681c14eb78fa61ca035c0c1/sc5.jpg sc5 sc5.jpg jpg 15408 104 659 IMAGE-DOWNSAMPLED 1-s2.0-S2468823122003662-sc2.sml https://s3-eu-west-1.amazonaws.com/prod-ucs-content-store-eu-west/content/pii:S2468823122003662/sc2/THUMBNAIL/image/gif/90e68264bdc04f7b1b7b371df355ccba/sc2.sml sc2 sc2.sml sml 3664 126 219 IMAGE-THUMBNAIL 1-s2.0-S2468823122003662-sc3.sml https://s3-eu-west-1.amazonaws.com/prod-ucs-content-store-eu-west/content/pii:S2468823122003662/sc3/THUMBNAIL/image/gif/557be1cc7d3ddfb6c25652271c43bbdd/sc3.sml sc3 sc3.sml sml 3530 163 135 IMAGE-THUMBNAIL 1-s2.0-S2468823122003662-sc1.sml https://s3-eu-west-1.amazonaws.com/prod-ucs-content-store-eu-west/content/pii:S2468823122003662/sc1/THUMBNAIL/image/gif/4f6f2740188c45b7a0cf9b23e239ae40/sc1.sml sc1 sc1.sml sml 2213 36 219 IMAGE-THUMBNAIL 1-s2.0-S2468823122003662-gr3.sml https://s3-eu-west-1.amazonaws.com/prod-ucs-content-store-eu-west/content/pii:S2468823122003662/gr3/THUMBNAIL/image/gif/99a7451a19091ab33f1664dea67d5ba7/gr3.sml gr3 gr3.sml sml 6416 116 219 IMAGE-THUMBNAIL 1-s2.0-S2468823122003662-gr4.sml https://s3-eu-west-1.amazonaws.com/prod-ucs-content-store-eu-west/content/pii:S2468823122003662/gr4/THUMBNAIL/image/gif/ad35e15527a86ebe0802b9326421b5d8/gr4.sml gr4 gr4.sml sml 6292 150 219 IMAGE-THUMBNAIL 1-s2.0-S2468823122003662-gr1.sml https://s3-eu-west-1.amazonaws.com/prod-ucs-content-store-eu-west/content/pii:S2468823122003662/gr1/THUMBNAIL/image/gif/8909b7c83e63c0820c0682f2ea803462/gr1.sml gr1 gr1.sml sml 15173 158 219 IMAGE-THUMBNAIL 1-s2.0-S2468823122003662-sc6.sml https://s3-eu-west-1.amazonaws.com/prod-ucs-content-store-eu-west/content/pii:S2468823122003662/sc6/THUMBNAIL/image/gif/93fe54ab092f917c4a46f9610e89d8de/sc6.sml sc6 sc6.sml sml 7256 164 197 IMAGE-THUMBNAIL 1-s2.0-S2468823122003662-gr2.sml https://s3-eu-west-1.amazonaws.com/prod-ucs-content-store-eu-west/content/pii:S2468823122003662/gr2/THUMBNAIL/image/gif/67cf4c3bff1947e50f38deb7061764e8/gr2.sml gr2 gr2.sml sml 9088 164 219 IMAGE-THUMBNAIL 1-s2.0-S2468823122003662-ga1.sml https://s3-eu-west-1.amazonaws.com/prod-ucs-content-store-eu-west/content/pii:S2468823122003662/ga1/THUMBNAIL/image/gif/c5a68faa278abd0c2807ab517646c39f/ga1.sml ga1 true ga1.sml sml 16273 164 162 IMAGE-THUMBNAIL 1-s2.0-S2468823122003662-sc4.sml https://s3-eu-west-1.amazonaws.com/prod-ucs-content-store-eu-west/content/pii:S2468823122003662/sc4/THUMBNAIL/image/gif/cc30dbfedfd40c039d35a0859d3b7dce/sc4.sml sc4 sc4.sml sml 5931 99 219 IMAGE-THUMBNAIL 1-s2.0-S2468823122003662-sc5.sml https://s3-eu-west-1.amazonaws.com/prod-ucs-content-store-eu-west/content/pii:S2468823122003662/sc5/THUMBNAIL/image/gif/dee95e31259d96748777e25c38c3b594/sc5.sml sc5 sc5.sml sml 4023 34 219 IMAGE-THUMBNAIL 1-s2.0-S2468823122003662-sc2_lrg.jpg https://s3-eu-west-1.amazonaws.com/prod-ucs-content-store-eu-west/content/pii:S2468823122003662/sc2/HIGHRES/image/jpeg/4c52e64fc46c19bc9d0f93a1f54290ea/sc2_lrg.jpg sc2 sc2_lrg.jpg jpg 139420 1251 2167 IMAGE-HIGH-RES 1-s2.0-S2468823122003662-sc3_lrg.jpg https://s3-eu-west-1.amazonaws.com/prod-ucs-content-store-eu-west/content/pii:S2468823122003662/sc3/HIGHRES/image/jpeg/8238ba731239b3e27174332f43eb9358/sc3_lrg.jpg sc3 sc3_lrg.jpg jpg 48256 1007 833 IMAGE-HIGH-RES 1-s2.0-S2468823122003662-sc1_lrg.jpg https://s3-eu-west-1.amazonaws.com/prod-ucs-content-store-eu-west/content/pii:S2468823122003662/sc1/HIGHRES/image/jpeg/59953f322486fd6ee5cc5e71722d52c0/sc1_lrg.jpg sc1 sc1_lrg.jpg jpg 59008 360 2167 IMAGE-HIGH-RES 1-s2.0-S2468823122003662-gr3_lrg.jpg https://s3-eu-west-1.amazonaws.com/prod-ucs-content-store-eu-west/content/pii:S2468823122003662/gr3/HIGHRES/image/jpeg/1b7d6e73e33dd49ea494b0dfbf4fbf9e/gr3_lrg.jpg gr3 gr3_lrg.jpg jpg 212462 1548 2917 IMAGE-HIGH-RES 1-s2.0-S2468823122003662-gr4_lrg.jpg https://s3-eu-west-1.amazonaws.com/prod-ucs-content-store-eu-west/content/pii:S2468823122003662/gr4/HIGHRES/image/jpeg/9cbf575692825025282bc67c187d0bdd/gr4_lrg.jpg gr4 gr4_lrg.jpg jpg 177967 1717 2500 IMAGE-HIGH-RES 1-s2.0-S2468823122003662-gr1_lrg.jpg https://s3-eu-west-1.amazonaws.com/prod-ucs-content-store-eu-west/content/pii:S2468823122003662/gr1/HIGHRES/image/jpeg/b178d4a93585b0b46f1cf7c5c5368b70/gr1_lrg.jpg gr1 gr1_lrg.jpg jpg 235638 1079 1500 IMAGE-HIGH-RES 1-s2.0-S2468823122003662-sc6_lrg.jpg https://s3-eu-west-1.amazonaws.com/prod-ucs-content-store-eu-west/content/pii:S2468823122003662/sc6/HIGHRES/image/jpeg/336617ffe1de1a3e36384a4581490656/sc6_lrg.jpg sc6 sc6_lrg.jpg jpg 123237 1245 1500 IMAGE-HIGH-RES 1-s2.0-S2468823122003662-gr2_lrg.jpg https://s3-eu-west-1.amazonaws.com/prod-ucs-content-store-eu-west/content/pii:S2468823122003662/gr2/HIGHRES/image/jpeg/0c0aa75f15ff5b973f868a7b77f86c36/gr2_lrg.jpg gr2 gr2_lrg.jpg jpg 120625 1125 1500 IMAGE-HIGH-RES 1-s2.0-S2468823122003662-ga1_lrg.jpg https://s3-eu-west-1.amazonaws.com/prod-ucs-content-store-eu-west/content/pii:S2468823122003662/ga1/HIGHRES/image/jpeg/8e2bf198bd4916bd9043671cb4be0756/ga1_lrg.jpg ga1 true ga1_lrg.jpg jpg 242713 1085 1073 IMAGE-HIGH-RES 1-s2.0-S2468823122003662-sc4_lrg.jpg https://s3-eu-west-1.amazonaws.com/prod-ucs-content-store-eu-west/content/pii:S2468823122003662/sc4/HIGHRES/image/jpeg/fdfcdc7b4a053872a025642822eb3308/sc4_lrg.jpg sc4 sc4_lrg.jpg jpg 210698 1325 2917 IMAGE-HIGH-RES 1-s2.0-S2468823122003662-sc5_lrg.jpg https://s3-eu-west-1.amazonaws.com/prod-ucs-content-store-eu-west/content/pii:S2468823122003662/sc5/HIGHRES/image/jpeg/07280e568dbed8c3cdfd8789357f1e7f/sc5_lrg.jpg sc5 sc5_lrg.jpg jpg 93097 459 2917 IMAGE-HIGH-RES 1-s2.0-S2468823122003662-mmc1.docx https://s3-eu-west-1.amazonaws.com/prod-ucs-content-store-eu-west/content/pii:S2468823122003662/mmc1/MAIN/application/vnd.openxmlformats-officedocument.wordprocessingml.document/b533cfd04d82fc889f2339481120f096/mmc1.docx mmc1 mmc1.docx docx 3396938 APPLICATION 1-s2.0-S2468823122003662-am.pdf https://s3-eu-west-1.amazonaws.com/prod-ucs-content-store-eu-west/content/egi:10T0L3CHXSK/MAIN/application/pdf/3251be968c999426f8a0a9c9a324ba96/am.pdf am am.pdf pdf false 784135 AAM-PDF MCAT 112480 112480 S2468-8231(22)00366-2 10.1016/j.mcat.2022.112480 Fig. 1 X-ray molecular structure (ORTEP) of compound 2. Ellipsoids were drawn at 20% probability level. Hydrogen atoms were omitted for clarity. Fig 1 Fig. 2 Selected region of variable-temperature 1H NMR spectra of complex 2. Fig 2 Fig. 3 MALDI-ToF-MS spectrum of PLA synthesized by 1 ([L-LA]/[ Zn]= 20, RT, CH2Cl2). Fig 3 Fig. 4 1H NMR spectrum (600 MHz, C6D6, 298 K) of complex 1 with iPrOH and 5eq of L-lactide. Fig 4 Scheme 1 Synthesis of the proligand LH. Scheme 1 Scheme 2 Synthesis of homoleptic and heteroleptic Zn(II) and Mg(II) complexes 1–4. Scheme 2 Scheme 3 Homoleptic Zn(II) complex 5. Scheme 3 Scheme 4 Possible mechanism of polymerization of lactide with complex 1. Scheme 4 Scheme 5 Possible mechanism of polymerization of lactide with complex 2. Scheme 5 Scheme 6 Mechanism of degradation of PLA: role of the pyridine pendant arm. Scheme 6 Table 1 Polymerization of L-LA promoted by 1–5. Table 1 Run a cat Time(min) T(°C) Solvent Conv(%) TOF(h−1) MnGPC b (KDa) Ð b M nth c (KDa) 1 1 10 25 CH2Cl2 64 384 9.6 1.3 9.2 2 2 360 25 CH2Cl2 66 11 7.3 1.3 9.5 3 3 2 25 CH2Cl2 56 1700 8.7 1.2 8.1 4 4 360 25 CH2Cl2 33 5 5.3 1.3 4.7 5 5 1200 25 CH2Cl2 – – – – – 6 1 4 80 toluene 96 1440 10.3 1.8 13.8 7 2 4 80 toluene 60 900 11.1 1.2 8.6 8 3 2 80 toluene 100 3000 2.2 1.8 14.4 9 4 2 80 toluene 64 1920 2.1 1.2 9.2 10 5 2 80 toluene – – – – – 11 d 1 1 130 – 73 21,900 23.4 1.1 52.6 12 d 3 1 130 – 81 24,300 21.5 1.5 58.4 13 e 1 180 150 – 31 1033 3.8 n.d 4.5 a All reactions were carried out by using 5 µmol of catalyst in 2 mL of solvent, with 1 equ. of ROH (iPrOH for runs at 25 °C and BnOH for runs at 80 °C) and 100 eq. of L-LA. b Experimental M n (corrected using factor of 0.58) and Ð values were determined by GPC analysis in THF using polystyrene standards. c Calculated Mth (KDa) =144.14 x ([LA]/[ROH]) x conversion of LA. d 10 µmol of catalyst and 500 eq. of not purified LA (Aldrich). e 10 µmol of catalyst technical grade L-LA: BnOH = 10 000: 100, 3 h. Table 2 Methanolysis of PLAs by 1–5. Table 2 Run a Cat Solv T(°C) Time(h) XInt b Sme-La b YMe-La b 1 1 THF 25 7 86 34 29 2 2 THF 25 7 83 26 21 3 3 THF 25 2 100 74 74 4 4 THF 25 24 0 0 0 5 5 THF 25 24 0 0 0 6 c 1 – 65 0.25 61 100 59 7 c 2 – 65 1 39 100 39 8 c 3 – 65 0.25 67 100 67 9 c 4 – 65 1 15 100 15 a All reactions were carried out by using 5 µmol of Zn catalyst (0.6 mol % relative to ester linkages) in 1.8 mL of THF, with 0.2 mL of MeOH at room temperature. b Determinated by 1H NMR. c 2 mL of MeOH. Zinc and magnesium catalysts for the synthesis for PLA and its degradation: Clues for catalyst design Federica Santulli Data curation Giuseppe Gravina Data curation Marina Lamberti Formal analysis Consiglia Tedesco Data curation Mina Mazzeo Conceptualization Visualization Formal analysis Writing – original draft Writing – review & editing ⁎ Dipartimento di Chimica e Biologia \"Adolfo Zambelli\", Università di Salerno, via Giovanni Paolo II, 132, Fisciano, SA 84084, Italy Dipartimento di Chimica e Biologia \"Adolfo Zambelli\" Università di Salerno via Giovanni Paolo II, 132 Fisciano SA 84084 Italy Dipartimento di Chimica e Biologia \"Adolfo Zambelli\", Università di Salerno, via Giovanni Paolo II, 132, Fisciano, SA 84084, Italy ⁎ Corresponding author. Homoleptic and heteroleptic zinc and magnesium complexes bearing phenoxy-imine pyridine ligands were synthetized and characterized. Several structural parameters such as the structure of the ancillary ligand, the nature of the metal centre and the coordination geometry were investigated for identifying design elements purposeful to improve the catalytic activity in the ring opening polymerization (ROP) of lactide and in the reverse reaction of degradation of polylactide by alcoholysis. High efficiency and control degree were reached with zinc catalysts while magnesium ones showed lower activity and a weak control degree. NMR studies demonstrated that, for the homoleptic zinc complex, an activated-monomer mechanism was active. Differently, a coordination/insertion mechanism was observed for the related homoleptic zinc complex. Significantly, the complexes that showed the best activity in the ROP of lactide revealed to be the most efficient also in the degradation reaction. Graphical abstract Image, graphical abstract Keywords Polylactide Ring Opening Polymerization Zinc catalysts Depolymerization Methyl lactate Data availability No data was used for the research described in the article. 1 Introduction In the contemporary economy plastics fill a dominant position. Because of their excellent mechanical properties and their high strength and durability, they have found large application in almost all industrial sectors and households [1]. On the other hand, the longevity of synthetic plastics, in combination with the absence of a correct strategy for their end-of-life management, caused grave environmental pollution. It has been estimated that around 60% of all plastics ever produced is accumulated in waste deposits or dispersed in the environment [1,2]. Since the plastic demand is predicted to increase, new strategies must be implemented to contrast this emergency. In this context, coherently with new concept of circular economy, the development of both new environmentally friendly materials [3,4] and efficient technologies for plastic recycling are strategic actions [5–7]. Poly(lactic acid) or polylactide (PLA) is a biodegradable plastic derived for renewable resources. Thanks to its good mechanical and gas barrier properties, it may express its potentiality as alternative to the traditional oil derived plastics for short single use food packaging [8–10]. However, despite its potential sustainability, criticisms about its life cycle must be still addressed. Currently, PLA is industrially produced by ring opening polymerization of lactide promoted by the highly toxic tin catalysts. Moreover, although PLA is a biodegradable material, currently its waste management plan is not well planned. PLA is a compostable material but industrial conditions, such as high temperature and humidity, are required. At the same time, the mechanical recycling is not very efficient because residual contaminants cause a significant loss of the mechanical properties of the recycled material. Recently, chemical depolymerization is emerging as a powerful method for recycling of PLA [11]. The implementation of efficient plastic recycling processes, in which waste materials are reconverted into the starting monomers or small molecules of added values, may represent a fruitful approach [6,12]. Specifically, from chemical recycling of PLA, lactate esters and lactic acid can be obtained wherein lactic acid has been identified as a platform chemical [13], whilst lactate esters are used as green solvents [14]. Motivated by the interest to discover new low-toxicity catalytic systems that could compete with the industrially employed catalysts for the synthesis of PLA [15], numerous catalytic systems based on non-toxic metals such as zinc [16–18], magnesium [19–22] and aluminium [23–26] have been developed which revealed high efficiency or unexpected abilities in controlling the microstructure [27–33] of the polymer or high efficiency [34]. At the same time, suitable models to rationalize the stereoselective lactide polymerization have been developed [35–38]. Differently, the examples of catalysts for the depolymerization of PLA by alcoholysis are rare [39]. Commercially available metal salts [40–42] and simple metal precursors such as Zn(HMDS)2 [43] have been explored as catalysts for alcoholysis of PLA to produce methyl lactate (Me-LA). Regarding metal complexes with well-defined structure, the first remarkable examples are the dinuclear alkoxide Zn–N-heterocyclic carbene complexes described by Dagorne that revealed to be efficient initiators for the ring-opening polymerization of lactide and for the controlled depolymerization of PLA by alcoholysis [44] and the salalen-based hafnium complexes reported by Whitelaw et al. [45]. More recently, several families of homoleptic Zn (II) and Mg(II) complexes bearing tridentate NNO [46,47] and ONS [48] ligands have been described for the transesterification of PLA. In these studies, the authors highlighted the importance of the structure of the ancillary ligand and the role of the additional amine donor [49,50]. Inspired by these studies, we recently introduced a new catalyst, a phenoxy-imine pyridine zinc amide complex that revealed to be a highly efficient catalyst in the ROP of LA and in the depolymerization of PLA under very mild reaction conditions [51]. Herein we extended these studies to homoleptic and heteroleptic magnesium and zinc complexes stabilized by phenoxy-imine ligands bearing an additional pyridine moiety that is a weaker base than amine and moreover it may behave as a hemilabile donor, offering the chance of a flexible coordination geometry, with the aim to elucidate the role of structural parameters advantageous for the catalytic activity. 2 Results and discussion 2.1 Synthesis of complexes The proligand LH (Scheme 1 ) was obtained in high yield via a simple condensation reaction and characterized by 1H and 13C NMR spectroscopy. In the 1H NMR spectrum, a singlet at ca. δ = 7.75 ppm revealed the formation of the imine functionality. Two distinct triplets were observed at δ = 3.75 and 2.92 ppm for the methylene protons of the pyridine pendant arm. The heteroleptic Zn(II) and Mg(II) complexes were obtained by direct reaction of the proligand with one equivalent of the opportune trimethylsilylamide metal precursor M(N(TMS)2)2 in benzene or toluene solution at room temperature (Scheme 2 ). The corresponding homoleptic complexes were synthetized by using 0.5 equivalents of the alkyl metal precursors Zn (Et)2 and Mg(n-Bu)2. To elucidate the role of the neutral additional donor on the imine fragment, the homoleptic Zn(II) complex 5 was also synthetized (Scheme 3 ). This complex was previously reported by Jones in recent studies [52,53]. Complexes 1–5 were characterized by mono- and bi-dimensional NMR spectroscopy and elemental analysis (Figs. S1–S17). In the 1H NMR spectrum of complex 1, for the signal of the imine proton a high field shift was observed (from δ = 7.75 for the ligand to 7.67 ppm for complex) indicative of the coordination to the metal centre. Two triplets were observed at δ = 3.01 and δ=3.77 ppm for the methylene protons of the pyridine pendant arms whose multiplicity was indicative of a high conformational freedom of the moieties. Coherently the absence of correlations among the protons of the pyridyl rings and other fragments of the ligand skeleton in the NOESY spectrum showed that pyridine nitrogen atoms were not coordinated at zinc (Fig. S6). The symmetrical structure observed for complex 1 in solution was similar to those observed by Jones for the homoleptic phenoxy-imine amine complexes in which the metal centres were tetracoordinated to the oxygen and imine nitrogen atoms and fully coherent with that observed in the solid state of an analogous homoleptic zinc in which the pyridine pendant arms were rotated away from the metal centre [54]. For the analogous homoleptic magnesium complex 2, a different coordination geometry was established by single-crystal X-ray diffraction studies (Fig. 1 , CCDC: 2,152,705). Single crystals were obtained by slow diffusion of pentane into a benzene solution of 2 at room temperature. Selected bond lengths and angles are listed in Table S1 of the SI. A distorted octahedral geometry was observed with the ligands wrapped around the magnesium in a mer–mer manner (Fig. 1). The imine groups of both ligands are in the equatorial plane, while the pyridine nitrogen atoms and the phenoxy groups are opposite to each other; the imine N1 and N3 atoms are at a shorter distance from the Mg atom (2.145(7) Å and 2.159(7) Å) than the pyridine N2 and N4 atoms (2.366(8) Å and 2.274(8) Å). The NMR spectra of the complexes 1 and 2 revealed that the different coordination geometries observed in the solid-state structures were retained in solution. In the 1H NMR spectrum of complex 2 performed at 25 °C, four broad resonances were observed at δ = 2.41, 2.68, 3.38, 4.28 ppm, each attributable to the four diasterotopic protons of the methylene groups of the two equivalent ligands. The spectra obtained at higher temperatures showed only two peaks with defined multiplicities, like those observed for the complex 1 in which the pyridine is dissociated (Fig. 2 ). Thus, at higher temperatures, a fluxional phenomenon in which a tetracoordinate complex is formed by reversible dechelation of the pyridine pendants is plausible. The 1H and 13C NMR spectra of the heteroleptic complexes 3 and 4 (Figs. S12–S16) showed sharp and well resolved resonances for the pyridyl imino-phenolate ligand and the bis-(trimethylsilyl)amide group. For zinc complex 3, a light high-field 1H NMR shift of the proton in the ortho position of the pyridyl ring (8.35 ppm) in comparison to the same resonance for the free ligand (8.45 ppm) was observed. Differently, for the magnesium complex the same proton showed a low-field 1H NMR shift (8.56 ppm). This difference could be a consequence of the diverse hard-soft character of the metals: for zinc complex a metal-to-ligand charge-transfer from its d10 closed shell to the π system of the pyridine ring could be responsible of observed high-field shift, while for magnesium a ligand-to-metal charge-transfer is a plausible explanation for the deshielding of the cited proton. Clear evidence of coordination of the pyridine moiety to the two metal centres in heteroleptic complexes 3 and 4 was shown by the strong correlations of the bis-(trimethylsilyl)amide groups with the ortho protons of the pyridyl fragment, the imine protons and the methylene protons of the ligand in the NOESY spectra (Fig. S14). 2.2 Polymerization of L-lactide Initially, all complexes were tested out under solution conditions (in CH2Cl2 at room temperature and in toluene at 80 °C), and in the presence of one equivalent of alcohol (iPrOH or BnOH, respectively) as a co-initiator (Table 1 ). Representative results are summarized in Table 1. In all polymerization tests, lactide purified by a single recrystallization from anhydrous toluene was used. From the polymerization tests performed at room temperature, a drastic difference in terms of activity emerged between zinc and magnesium complexes. With the homoleptic complex 1, the conversion of 60 equivalents of L-LA was achieved after 10 min (run 1, Table 1), while with related magnesium catalyst 2 the same conversion was reached only after 6 h (run 2, Table 1). The heteroleptic zinc complex 3 revealed to be the most active catalyst reaching a turnover frequency of 1700 h−1 (run 3, Table 1); this value is among the highest reported in the literature for polymerization of LA performed at room temperature, although it is significantly lower than that reported for bimetallic zinc catalysts developed by Williams and co-workers (TOF up to 60,000 h−1 in THF) [16]. The heteroleptic magnesium complex 4 showed a low activity, about half of that of the related homoleptic species 2 (compare runs 2 and 4, Table 1). No activity was observed with complex 5 even after prolonged reaction times (run 5, Table 1). A similar trend of activities was observed for the polymerization tests performed at 80 °C (runs 6–10, Table 1) and the best performances were obtained with the heteroleptic zinc complex 3. Also at higher temperature, complex 1 revealed to be more efficient than an analogous bis(phenoxy-imine) zinc complex bearing tBu substituents (100 equiv were converted in 2 h) confirming the crucial role of the neutral donor of the pendant arm in the catalytic process [47]. The strong increase of activity observed for both magnesium complexes could be due to the hemiliability of the pyridine nitrogen donors in the coordination at magnesium observed at high temperature, thus the reactive centre may be more readily available for the coordination of the monomer. Subsequently, the Zn(II) complexes were tested at higher temperature (130 °C) under melt conditions, in alignment with industrial practices (runs 11 and 12, Table 1). These conditions offer the advantage to eliminate solvents that are considerable source of waste, unfortunately very few metal catalysts can sustain these so drastic conditions [52,55–57]. On the contrary, in this case very high TOF were achieved with both zinc catalysts which showed the same trend of activity already observed at 80 °C. In agreement with industrial procedures, catalyst 1 was also tested in the ROP of a large amount of monomer of technical grade purity with BnOH as chain transfer agent (L-LA: Zn: BnOH = 10 000: 1: 100) at 150 °C and in the absence of solvent. Also in these conditions, the catalyst preserved its high activity and the conversion of 3000 equivalents of monomer was achieved after 3 h (runs 13, Table 1). Kinetic studies for zinc complexes in methylene chloride at 25 °C (Figs. S32 and S33) showed linear relationships of ln( [LA]0/ [LA]t versus time for both zinc complexes, in agreement with pseudo-first order reactions with respect to monomer consumption. The kobs were 0.028 min−1 for complex 1 and 0.975 min−1 for complex 3. For the polymerizations performed at room temperature (runs 1–4, Table 1), the molecular weights of the PLA samples obtained were in moderate agreement with the values theoretically expected (difference less than 23%) and the disperisities were always lower than 1.3. To evaluate the control degree of the different catalysts over the polymerization processes, Matrix-Assisted Laser Desorption Ionization-Time of Flight (MALDI-ToF) analysis of low molecular weight PLAs purposely prepared were performed. The MALDI-ToF spectra of PLA samples obtained from zinc catalysts 1 and 3 revealed symmetrical distributions of peaks with a spacing of 144 gmol−1 bearing the BnO/OH end groups demonstrating the absence of undesired transesterification reactions (Fig. 3 ). However, when the reaction time was extended over the complete conversion of the monomer without quenching, the molecular masses dispersity increased as consequence of transesterification reactions (Fig. S24). When unpurified or technical grade monomer was used, molecular masses were significantly lower than the expected values as consequence of the presence of protic impurities that act as chain transfer agents (runs 11–12, Table 1), but in the presence of alcohol the control over molecular masses was repristinated (run 13, Table 1). Differently, the control degree over the molecular masses by the magnesium catalyst 4 was very poor. In the MALDI-ToF spectra of a PLAs obtained with 4 (Fig. S23) multiple distributions were evident with a peak separation of 144 g mol−1, this could be a consequence of the presence of more than one active species in polymerization medium. For all samples, the homonuclear decoupled 1H NMR spectra demonstrated the absence of racemization phenomena. 2.3 Mechanistic studies To clarify the different behavior of the investigated complexes in the ROP of lactide, mechanistic studies were performed by NMR analysis to elucidate the structure of the active species. Initially, the reaction between complex 1 and isopropanol was performed at room temperature, in benzene-d6 solution and was monitored by 1H NMR analysis. All signals of the metal complex 1 and the alcohol remained unchanged (Fig. S18 of SI), and no interaction was established between the two species, as confirmed by the DOSY experiment. Subsequently, five equivalents of lactide were added and after 10 min at room temperature, no significant variation to the resonances of metal complex was observed while a weak upfield shift of methine resonances of lactide was evident as consequence of its coordination at the metal centre. At the same time, the resonances of the free isopropyl alcohol disappeared and additional resonances corresponding to the formation of PLA sequences were observed (Fig. 4 ). All these observations were consistent with the hypothesis that an activated monomer mechanism is operative for the homoleptic complex 1 (Scheme 4 ) in which the metal centre acts as a Lewis acid toward monomer and pyridine moieties do not compete significantly for the coordination at the metal centre. As already discussed by Jones, the additional N donor in the ancillary ligands could have an active role during polymerization process potentially assisting in the proton-transfer steps by activating the external nucleophile [53]. This could explain the great difference in terms of activity with complex 5 and with analogous complexes devoid of an additional donor. Differently, the addition of one equivalent of iPrOH to a benzene-d6 solution of the related heteroleptic complex 3, showed the formation of a related alkoxide derivative (82%) and a small percentage of the homoleptic complex 1 (18%) (Fig. S19). The ratio between these two species did not change increasing the temperature up to 65 °C. After the addition of five equivalents of lactide, the signals of the homoleptic species did not change while the resonances related to the alkoxide derivative changed significantly and the simultaneous formation of oligolactic sequences were detected. Considering that also in this case the added alcohol was exhaustively consumed and the MALDI-ToF analysis of the obtained polymer described exclusively the presence of iPrO end groups, we can conclude that the alkoxide zinc derivative was responsible for the polymerization and a coordination /insertion mechanism was operative. Subsequently the same experiments were performed with the homoleptic and heteroleptic magnesium complexes 2 and 4. When one equivalent of isopropanol was added to a benzene-d6 solution of complex 2, the resonances of the methylene protons of the pyridine pendants resolved into two broad resonances suggesting a fluxional coordination of the pyridine nitrogen atoms because of the competitive coordination of the alcohol at the magnesium centre or to the pyridine moiety (Fig. S20). No significative differences were observed in other regions of the NMR spectrum. After the addition of five equivalents of lactide, the alcoholysis of the complex occurred, the alcohol was exhaustively consumed with the formation of the heteroleptic alkoxide magnesium complex and one equivalent of free ligand. This process could be favored by the coordination of the monomer at magnesium. At the same time, additional resonances for PLA sequences bearing isopropoxy chain end groups were observed (Fig. S21). These observations suggest the active species is the heteroleptic alkoxide derivative for which a coordination insertion mechanism can be supposed, considering the lesser coordination of the magnesium and the presence of the isopropoxide labile group (Scheme 5 ). When the same experiment was performed with complex 4, the homoleptic complex 2 was quantitatively produced, reasonably by a Schlenk equilibrium (Fig. S22). After the addition of lactide a mixture of species was formed. Reasonably the presence of the monomer as coordinating species stabilizes the heteroleptic species. The NMR experiments performed with magnesium complexes 2 and 4 are indicative of the occurrence of several reactions under the reaction conditions used for the polymerization, which could be responsible of the low control demonstrated during polymerization. 2.4 Degradation studies of PLA Considering the high tendence of the synthetized complexes to promote transesterification reactions, they were investigated as catalysts for the depolymerization of PLLA, by alcoholysis. In the last five years, several homoleptic zinc complexes with phenoxy-imine or phenoxy-amine ligands bearing additional neutral donors (from primary to tertiary amine) have been investigated as catalysts for the chemical degradation of PLLA [53,58]. The best performances were achieved with homoleptic complexes of Zn(II) and Mg(II) with tridentate (NNO) ligand in which the phenoxy fragment is integrated with two amine functionalities [49]. Initially, samples of a commercially available PLLA (M n = 50,000 g mol−1 Ð = 1.2) were dissolved in THF/ MeOH solution at room temperature. All parameters for monitoring of the reaction, namely conversion, selectivity, and yield of methyl lactate (XInt, Sme-La, YMe-La, respectively) were evaluated by 1H NMR analysis of the methine region. In these conditions, the heteroleptic zinc complex 3 revealed to be the most active, the homoleptic zinc and magnesium complexes (1 and 2, respectively) showed the same activity while complex 4 was completely inactive because of its susceptivity to the presence of protic species(runs1–4, Table 2 ). No activity was achieved with the magnesium complex 5 confirming the key role of the pyridine additional donor also in the depolymerization reactions (run 5, Table 2). As already discussed by Jones, in the case of homoleptic complexes, the pendant amine groups in the ancillary ligands could have an active role during both the polymerization reactions and PLA degradation process. In particular, during the degradation by metanolysis, the pendant arm could potentially assist the proton-transfer steps by activating the external nucleophile (Scheme 6 ) [53]. Despite the insolubility of the polymer in absolute MeOH, the heteroleptic zinc complex 3, preserved its high activity also in solvent free conditions reaching a good conversion after only 45 min. All other complexes showed very low or absent activities. To overcome this limit, additional experiments were performed in methanol at reflux demonstrating the best results for zinc catalysts 1 and 3 (runs 6–9, Table 2). All complexes were selective in the formation of methylactate when the reactions were performed in absolute methanol, as consequence of a degradation mechanism that proceeds by a progressive erosion of the polymeric chain starting from chain end groups [51]. The selective degradation of more than 60% of the PLLA sample to methylactate was obtained with the zinc complexes 1 and 3 after only 15 min by using a low catalyst loading (0.6% mol) and without dissolving the polymer in any solvent. These performances were superiors to those obtained with homoleptic zinc complexes based on propylenediamine Schiff bases for which a yield of 81% in Me-LA was achieved after 0.5 h at 50 °C in THF/ MeOH [49]. Conclusions The chemical recycling of plastics may represent a strategic action to limit the dramatic consequences of environmental pollution caused by these materials and to contain the consume of not renewable resources, coherently with the model of a sustainable circular economy. In this paper we describe simple zinc and magnesium complexes supported by phenoxy-imine pyridine ligands characterized by different coordination geometries. All complexes were active both in the ROP of lactide and in the degradation of PLA by methanolysis showing different activities depending on their structural parameters. In the ROP of L-LA, both under mild and industrially relevant conditions, high activity and efficient control were observed for zinc catalysts. NMR investigations of active species demonstrate the formation of species with defined identities for zinc complexes, differently, magnesium complexes are interested by several equilibria thus a mixture of active species are formed in the polymerization medium resulting in an uncontrolled process. The zinc complexes were also found to be the best systems to mediate the controlled depolymerization of polylactide by methanolysis. From these data emerged that the metal nature has a crucial role on catalyst activity and polymerization control, although these differences were less significant at higher temperature. These studies furnished useful indication about a functional design of the catalytic species in terms of structure of the ancillary ligand, nature of the metal centre and coordination geometry for promoting the synthesis and degradation of PLA Experimental section All experimental procedures are reported in the Supporting Information. CRediT authorship contribution statement Federica Santulli: Data curation. Giuseppe Gravina: Data curation. Marina Lamberti: Formal analysis. Consiglia Tedesco: Data curation. Mina Mazzeo: Conceptualization, Visualization, Formal analysis, Writing – original draft, Writing – review & editing. Declaration of Competing Interest The authors declare that they have no known competing financial interests or personal relationships that could have appeared to influence the work reported in this paper. Acknowledgment The authors thank The School of Chemistry of Tel Aviv University (Israel) for GPC analysis, Dr Patrizia Oliva for NMR assistance and Dr Patrizia Iannece for Maldi ToF analysis. Supplementary materials Supplementary material associated with this article can be found, in the online version, at doi:10.1016/j.mcat.2022.112480. Appendix Supplementary materials Image, application 1 References [1] R. Geyer J.R. Jambeck K.L. Law Production, use, and fate of all plastics ever made Sci. Adv. 3 2017 e1700782/1700781-e1700782/1700785 R. Geyer, J.R. Jambeck, K.L. Law, Production, use, and fate of all plastics ever made, Sci. Adv., 3 (2017) e1700782/1700781-e1700782/1700785. [2] J.R. Jambeck R. Geyer C. Wilcox T.R. Siegler M. Perryman A. Andrady R. Narayan K.L. Law Plastic waste inputs from land into the ocean Science 347 2015 768 771 J.R. Jambeck, R. Geyer, C. Wilcox, T.R. Siegler, M. Perryman, A. Andrady, R. Narayan, K.L. Law, Plastic waste inputs from land into the ocean, Science347 (2015) 768–771. [3] M.J.L. Tschan E. Brulé P. Haquette C.M. Thomas Synthesis of biodegradable polymers from renewable resources Polym. Chem. 3 2012 836 851 M.J.L. Tschan, E. Brulé, P. Haquette, C.M. Thomas, Synthesis of biodegradable polymers from renewable resources, Polym. Chem., 3 (2012) 836–851. [4] X. Zhang M. Fevre G.O. Jones R.M. Waymouth Catalysis as an enabling science for sustainable polymers Chem. Rev. 118 2018 839 885 X. Zhang, M. Fevre, G.O. Jones, R.M. Waymouth, Catalysis as an enabling science for sustainable polymers, Chem. Rev., 118 (2018) 839–885. [5] G.W. Coates Y.D.Y.L. Getzler Chemical recycling to monomer for an ideal, circular polymer economy Nat. Rev. Mater. 5 2020 501 G.W. Coates, Y.D.Y.L. Getzler, Chemical recycling to monomer for an ideal, circular polymer economy, Nat. Rev. Mater., 5 (2020) 501. [6] R.A. Sheldon M. Norton Green chemistry and the plastic pollution challenge: towards a circular economy Green Chem. 22 2020 6310 6322 R.A. Sheldon, M. Norton, Green chemistry and the plastic pollution challenge: towards a circular economy, Green Chem., 22 (2020) 6310–6322. [7] A. Rahimi J.M. García Chemical recycling of waste plastics for new materials production Nat. Rev. Chem. 1 2017 0046 A. Rahimi, J.M. García, Chemical recycling of waste plastics for new materials production, Nat. Rev. Chem., 1 (2017) 0046. [8] E.T.H. Vink R. Rabago D.A. Glassner B. Springs R.P. O'Connor J. Kolstad P.R. Gruber The sustainability of nature works polylactide polymers and Ingeo polylactide fibers: an update of the future Macromol. Biosci. 4 2004 551 564 E.T.H. Vink, R. Rabago, D.A. Glassner, B. Springs, R.P. O'Connor, J. Kolstad, P.R. Gruber, The sustainability of nature works polylactide polymers and Ingeo polylactide fibers: an update of the future, Macromol. Biosci., 4 (2004) 551–564. [9] J. Lunt Large-scale production, properties and commercial applications of polylactic acid polymers Polym. Degrad. Stab. 59 1998 145 152 J. Lunt, Large-scale production, properties and commercial applications of polylactic acid polymers, Polym. Degrad. Stab., 59 (1998) 145–152. [10] R. Auras B. Harte S. Selke An overview of polylactides as packaging materials Macromol. Biosci. 4 2004 835 864 R. Auras, B. Harte, S. Selke, An overview of polylactides as packaging materials, Macromol. Biosci., 4 (2004) 835–864. [11] P. McKeown M.D. Jones The chemical recycling of PLA: a review Sustain. Chem. 1 1 2020 1 22 P. McKeown, M.D. Jones, The chemical recycling of PLA: a review, Sustain. Chem., 1 (2020) 1. [12] J. Payne M.D. Jones The chemical recycling of polyesters for a circular plastics economy: challenges and emerging opportunities ChemSusChem 14 2021 4041 4070 J. Payne, M.D. Jones, The chemical recycling of polyesters for a circular plastics economy: challenges and emerging opportunities, ChemSusChem, 14 (2021). [13] Y. Fan C. Zhou X. Zhu Selective catalysis of lactic acid to produce commodity chemicals Catal. Rev. Sci. Eng. 51 2009 293 324 Y. Fan, C. Zhou, X. Zhu, Selective catalysis of lactic acid to produce commodity chemicals, Catal. Rev. Sci. Eng., 51 (2009) 293–324. [14] C.S.M. Pereira V.M.T.M. Silva A.E. Rodrigues Ethyl lactate as a solvent: properties, applications and production processes – a review Green Chem. 13 2011 2658 C.S.M. Pereira, V.M.T.M. Silva, A.E. Rodrigues, Ethyl lactate as a solvent: properties, applications and production processes – a review, Green Chem., 13 (2011) 2658. [15] C. Lackmann J. Brendt T.B. Seiler A. Hermann A. Metz P.M. Schaefer S. Herres-Pawlis H. Hollert The Green toxicology approach: insight towards the eco-toxicologically safe development of benign catalysts J. Hazard. Mater. 416 2021 125889 C. Lackmann, J. Brendt, T.B. Seiler, A. Hermann, A. Metz, P.M. Schaefer, S. Herres-Pawlis, H. Hollert, The Green toxicology approach: insight towards the eco-toxicologically safe development of benign catalysts, J. Hazard. Mater., 416 (2021) 125889. [16] A. Thevenon C. Romain M.S. Bennington A.J.P. White H.J. Davidson S. Brooker C.K. Williams Dizinc lactide polymerization catalysts: hyperactivity by control of ligand conformation and metallic cooperativity Angew. Chem. Int. Ed. 55 2016 8680 8685 A. Thevenon, C. Romain, M.S. Bennington, A.J.P. White, H.J. Davidson, S. Brooker, C.K. Williams, Dizinc lactide polymerization catalysts: hyperactivity by control of ligand conformation and metallic cooperativity, Angew. Chem. Int. Ed., 55 (2016) 8680–8685. [17] I. D'Auria M. Lamberti M. Mazzeo S. Milione G. Roviello C. Pellecchia Coordination chemistry and reactivity of zinc complexes supported by a phosphido pincer ligand Chem. Eur. J. 18 2012 2349 2360 S2349/2341-S2349/2313 I. D'Auria, M. Lamberti, M. Mazzeo, S. Milione, G. Roviello, C. Pellecchia, Coordination chemistry and reactivity of zinc complexes supported by a phosphido pincer ligand, Chem. Eur. J., 18 (2012) 2349–2360, S2349/2341-S2349/2313. [18] Z. Zheng G. Zhao R. Fablet M. Bouyahyi C.M. Thomas T. Roisnel O. Casagrande J.F. Carpentier Zinc and enolato-magnesium complexes based on bi-, tri- and tetradentate aminophenolate ligands New J. Chem. 32 2008 2279 2291 Z. Zheng, G. Zhao, R. Fablet, M. Bouyahyi, C.M. Thomas, T. Roisnel, O. Casagrande., J.F. Carpentier, Zinc and enolato-magnesium complexes based on bi-, tri- and tetradentate aminophenolate ligands, New J. Chem., 32 (2008) 2279–2291. [19] I. D'Auria C. Tedesco M. Mazzeo C. Pellecchia New homoleptic bis(pyrrolylpyridiylimino) Mg(II) and Zn(II) complexes as catalysts for the ring opening polymerization of cyclic esters via an \"activated monomer\" mechanism Dalton. Trans. 46 2017 12217 12225 I. D'Auria, C. Tedesco, M. Mazzeo, C. Pellecchia, New homoleptic bis(pyrrolylpyridiylimino) Mg(II) and Zn(II) complexes as catalysts for the ring opening polymerization of cyclic esters via an \"activated monomer\" mechanism, Dalton. Trans., 46 (2017) 12217–12225. [20] A. Pilone M. Lamberti M. Mazzeo S. Milione C. Pellecchia Ring-opening polymerization of cyclic esters by phenoxy-thioether complexes derived from biocompatible metals Dalton. Trans. 42 2013 13036 13047 A. Pilone, M. Lamberti, M. Mazzeo, S. Milione, C. Pellecchia, Ring-opening polymerization of cyclic esters by phenoxy-thioether complexes derived from biocompatible metals, Dalton. Trans., 42 (2013) 13036–13047. [21] T. Rosen J. Rajpurohit S. Lipstman V. Venditto M. Kol Isoselective polymerization of rac-lactide by highly active sequential {ONNN} magnesium complexes Chem. Eur. J. 26 2020 17183 17189 T. Rosen, J. Rajpurohit, S. Lipstman, V. Venditto, M. Kol, Isoselective polymerization of rac-lactide by highly active sequential {ONNN} magnesium complexes, Chem. Eur. J., 26 (2020) 17183–17189. [22] T. Rosen I. Goldberg W. Navarra V. Venditto M. Kol Block-stereoblock copolymers of poly(ε-Caprolactone) and poly(Lactic Acid) Angew. Chem. Int. Ed. 57 2018 7191 7195 T. Rosen, I. Goldberg, W. Navarra, V. Venditto, M. Kol, Block-stereoblock copolymers of poly(ε-Caprolactone) and poly(Lactic Acid), Angew. Chem. Int. Ed., 57 (2018) 7191–7195. [23] F. Santulli I. D'Auria L. Boggioni S. Losio M. Proverbio C. Costabile M. Mazzeo Bimetallic aluminum complexes bearing binaphthyl-based iminophenolate ligands as catalysts for the synthesis of polyesters Organometallics 39 2020 1213 1220 F. Santulli, I. D'Auria, L. Boggioni, S. Losio, M. Proverbio, C. Costabile, M. Mazzeo, Bimetallic aluminum complexes bearing binaphthyl-based iminophenolate ligands as catalysts for the synthesis of polyesters, Organometallics, 39 (2020) 1213–1220. [24] F. Isnard M. Carratu M. Lamberti V. Venditto M. Mazzeo Copolymerization of cyclic esters, epoxides and anhydrides: evidence of the dual role of the monomers in the reaction mixture Catal. Sci. Technol. 8 2018 5034 5043 F. Isnard, M. Carratu, M. Lamberti, V. Venditto, M. Mazzeo, Copolymerization of cyclic esters, epoxides and anhydrides: evidence of the dual role of the monomers in the reaction mixture, Catal. Sci. Technol., 8 (2018) 5034–5043. [25] M. Strianese D. Pappalardo M. Mazzeo M. Lamberti C. Pellecchia Salen-type aluminum and zinc complexes as two-faced Janus compounds: contribution to molecular sensing and polymerization catalysis Dalton. Trans. 49 2020 16533 16550 M. Strianese, D. Pappalardo, M. Mazzeo, M. Lamberti, C. Pellecchia, Salen-type aluminum and zinc complexes as two-faced Janus compounds: contribution to molecular sensing and polymerization catalysis, Dalton. Trans., 49 (2020) 16533–16550. [26] C. Robert T.E. Schmid V. Richard P. Haquette S.K. Raman M.N. Rager R.M. Gauvin Y. Morin X. Trivelli V. Guerineau I. del Rosal L. Maron C.M. Thomas Mechanistic aspects of the polymerization of lactide using a highly efficient aluminum(III) catalytic system J. Am. Chem. Soc. 139 2017 6217 6225 C. Robert, T.E. Schmid, V. Richard, P. Haquette, S.K. Raman, M.N. Rager, R.M. Gauvin, Y. Morin, X. Trivelli, V. Guerineau, I. del Rosal, L. Maron, C.M. Thomas, Mechanistic aspects of the polymerization of lactide using a highly efficient aluminum(III) catalytic system, J. Am. Chem. Soc., 139 (2017) 6217–6225. [27] A. Pilone K. Press I. Goldberg M. Kol M. Mazzeo M. Lamberti Gradient isotactic multiblock polylactides from aluminum complexes of chiral salalen ligands J. Am. Chem. Soc. 136 2014 2940 2943 A. Pilone, K. Press, I. Goldberg, M. Kol, M. Mazzeo, M. Lamberti, Gradient isotactic multiblock polylactides from aluminum complexes of chiral salalen ligands, J. Am. Chem. Soc., 136 (2014) 2940–2943. [28] R. Hador A. Botta V. Venditto S. Lipstman I. Goldberg M. Kol The dual-stereocontrol mechanism: heteroselective polymerization of rac-lactide and syndioselective polymerization of meso-lactide by chiral aluminum salan catalysts Angew. Chem. Int. Ed. 58 2019 14679 14685 R. Hador, A. Botta, V. Venditto, S. Lipstman, I. Goldberg, M. Kol, The dual-stereocontrol mechanism: heteroselective polymerization of rac-lactide and syndioselective polymerization of meso-lactide by chiral aluminum salan catalysts, Angew. Chem. Int. Ed., 58 (2019) 14679–14685. [29] P. Marin M.J.L. Tschan F. Isnard C. Robert P. Haquette X. Trivelli L.M. Chamoreau V. Guerineau I. del Rosal L. Maron V. Venditto C.M. Thomas Polymerization of rac-lactide using achiral iron complexes: access to thermally stable stereocomplexes Angew. Chem. Int. Ed 58 2019 12585 12589 P. Marin, M.J.L. Tschan, F. Isnard, C. Robert, P. Haquette, X. Trivelli, L.M. Chamoreau, V. Guerineau, I. del Rosal, L. Maron, V. Venditto, C.M. Thomas, Polymerization of rac-lactide using achiral iron complexes: access to thermally stable stereocomplexes, Angew. Chem. Int. Ed., 58 (2019) 12585–12589. [30] C.M. Thomas Stereocontrolled ring-opening polymerization of cyclic esters: synthesis of new polyester microstructures Chem. Soc. Rev. 39 2010 165 173 C.M. Thomas, Stereocontrolled ring-opening polymerization of cyclic esters: synthesis of new polyester microstructures, Chem. Soc. Rev., 39 (2010) 165–173. [31] M.J.L. Tschan R.M. Gauvin C.M. Thomas Controlling polymer stereochemistry in ring-opening polymerization: a decade of advances shaping the future of biodegradable polyesters Chem. Soc. Rev. 50 2021 13587 13608 M.J.L. Tschan, R.M. Gauvin, C.M. Thomas, Controlling polymer stereochemistry in ring-opening polymerization: a decade of advances shaping the future of biodegradable polyesters, Chem. Soc. Rev., 50 (2021) 13587–13608. [32] S. Herres-Pawlis R.D. Rittinghaus J. Zenner A. Pich M. Kol Master of chaos and order: opposite microstructures of PCL-co-PGA-co-PLA accessible by a single catalyst Angew. Chem. Int. Ed. 61 2022 e202112853 Ahead of Print S. Herres-Pawlis, R.D. Rittinghaus, J. Zenner, A. Pich, M. Kol, Master of chaos and order: opposite microstructures of PCL-co-PGA-co-PLA accessible by a single catalyst, Angew. Chem. Int. Ed., (2022) Ahead of Print. [33] S.M. Guillaume E. Kirillov Y. Sarazin J.F. Carpentier Beyond Stereoselectivity Switchable catalysis: some of the last frontier challenges in ring-opening polymerization of cyclic esters Chem. A Eur. J. 21 2015 7988 8003 S.M. Guillaume, E. Kirillov, Y. Sarazin, J.F. Carpentier, Beyond Stereoselectivity, Switchable catalysis: some of the last frontier challenges in ring-opening polymerization of cyclic esters, Chem. A Eur. J., 21 (2015) 7988–8003. [34] M. Strianese D. Pappalardo M. Mazzeo M. Lamberti C. Pellecchia Salen-type aluminum and zinc complexes as two-faced Janus compounds: contribution to molecular sensing and polymerization catalysis Dalton. Trans. 49 2020 16533 16550 M. Strianese, D. Pappalardo, M. Mazzeo, M. Lamberti, C. Pellecchia, Salen-type aluminum and zinc complexes as two-faced Janus compounds: contribution to molecular sensing and polymerization catalysis, Dalton. Trans., 49 (2020) 16533–16550. [35] S. Gesslbauer R. Savela Y. Chen A.J.P. White C. Romain Exploiting noncovalent interactions for room-temperature heteroselective rac-lactide polymerization using aluminum catalysts ACS Catal. 9 2019 7912 7920 S. Gesslbauer, R. Savela, Y. Chen, A.J.P. White, C. Romain, Exploiting noncovalent interactions for room-temperature heteroselective rac-lactide polymerization using aluminum catalysts, ACS Catal., 9 (2019) 7912–7920. [36] A.M. Luke A. Peterson S. Chiniforoush M. Mandal Y. Popowski H. Sajjad C.J. Bouchey D.Y. Shopov B.J. Graziano L.J. Yao C.J. Cramer T.M. Reineke W.B. Tolman Mechanism of initiation stereocontrol in polymerization of rac-lactide by aluminum complexes supported by indolide–imine ligands Macromolecules 53 2020 1809 1818 A.M. Luke, A. Peterson, S. Chiniforoush, M. Mandal, Y. Popowski, H. Sajjad, C.J. Bouchey, D.Y. Shopov, B.J. Graziano, L.J. Yao, C.J. Cramer, T.M. Reineke, W.B. Tolman, Mechanism of initiation stereocontrol in polymerization of rac-lactide by aluminum complexes supported by indolide–imine ligands, Macromolecules, 53 (2020) 1809–1818. [37] M.C. D'Alterio C. De Rosa G. Talarico Stereoselective lactide polymerization: the challenge of chiral catalyst recognition ACS Catal. 10 2020 2221 2225 M.C. D'Alterio, C. De Rosa, G. Talarico, Stereoselective lactide polymerization: the challenge of chiral catalyst recognition, ACS Catal., 10 (2020) 2221–2225. [38] M.C. D'Alterio C. De Rosa G. Talarico Syndiotactic PLA from meso-LA polymerization at the Al-chiral complex: a probe of DFT mechanistic insights Chem. Commun. 57 2021 1611 1614 M.C. D'Alterio, C. De Rosa, G. Talarico, Syndiotactic PLA from meso-LA polymerization at the Al-chiral complex: a probe of DFT mechanistic insights, Chem. Commun., 57 (2021) 1611–1614. [39] J. Payne P. McKeown M.D. Jones A circular economy approach to plastic waste Polym. Degrad. Stab. 165 2019 170 181 J. Payne, P. McKeown, M.D. Jones, A circular economy approach to plastic waste, Polym. Degrad. Stab., 165 (2019) 170–181. [40] B.F.S. Nunes M. Conceição Oliveira A.C. Fernandes Dioxomolybdenum complex as an efficient and cheap catalyst for the reductive depolymerization of plastic waste into value-added compounds and fuels Green Chem. 22 2020 2419 B.F.S. Nunes, M. Conceição Oliveira, A.C. Fernandes, Dioxomolybdenum complex as an efficient and cheap catalyst for the reductive depolymerization of plastic waste into value-added compounds and fuels, Green Chem., 22 (2020) 2419. [41] A.C. Fernandes Reductive depolymerization of plastic waste catalyzed by Zn(OAc)2 2H2O ChemSusChem 14 2021 4228 4233 1 A.C. Fernandes, Reductive depolymerization of plastic waste catalyzed by Zn(OAc)2 2H2O, ChemSusChem, 14 (2021) 1. [42] H. Liu X. Song F. Liu S. Liu S. Yu Ferric chloride as an efficient and reusable catalyst for methanolysis of poly(lactic acid) waste J. Polym. Res. 22 2015 135 H. Liu, X. Song, F. Liu, S. Liu, S. Yu, Ferric chloride as an efficient and reusable catalyst for methanolysis of poly(lactic acid) waste, J. Polym. Res., 22 (2015) 135. [43] R. Yang G. Xu C. Lv B. Dong L. Zhou Q. Wang Zn(HMDS)2 as a versatile transesterification catalyst for polyesters synthesis and degradation toward a circular materials economy approach ACS Sustain. Chem. Eng. 8 2020 18347 18353 R. Yang, G. Xu, C. Lv, B. Dong, L. Zhou, Q. Wang, Zn(HMDS)2 as a versatile transesterification catalyst for polyesters synthesis and degradation toward a circular materials economy approach, ACS Sustain. Chem. Eng., 8 (2020) 18347–18353. [44] C. Fliedel D. Vila-Vicosa M.J. Calhorda S. Dagorne T. Aviles Dinuclear Zinc-N-heterocyclic carbene complexes for either the controlled ring-opening polymerization of lactide or the controlled degradation of polylactide under mild conditions ChemCatChem 6 2014 1357 1367 C. Fliedel, D. Vila-Vicosa, M.J. Calhorda, S. Dagorne, T. Aviles, Dinuclear Zinc-N-heterocyclic carbene complexes for either the controlled ring-opening polymerization of lactide or the controlled degradation of polylactide under mild conditions, ChemCatChem, 6 (2014) 1357–1367. [45] E.L. Whitelaw M.G. Davidson M.D. Jones Group 4 salalen complexes for the production and degradation of polylactide Chem. Commun. (Cambridge, U. K.) 47 2011 10004 10006 E.L. Whitelaw, M.G. Davidson, M.D. Jones, Group 4 salalen complexes for the production and degradation of polylactide, Chem. Commun. (Cambridge, U. K.), 47 (2011) 10004–10006. [46] M.C. D’Alterio I. D’Auria L. Gaeta C. Tedesco S. Brenna C. Pellecchia Are well performing catalysts for the ring opening polymerization of l-Lactide under Mild Laboratory conditions suitable for the industrial process? The case of new highly active Zn(II) catalysts Macromolecules 55 2022 5115 5122 M.C. D'Alterio, I. D'Auria, L. Gaeta, C. Tedesco, S. Brenna, C. Pellecchia, Are well performing catalysts for the ring opening polymerization of l-Lactide under Mild Laboratory conditions suitable for the industrial process? The case of new highly active Zn(II) catalysts, Macromolecules, (2022). [47] J. Payne P. McKeown M.F. Mahon E.A.C. Emanuelsson M.D. Jones Mono- and dimeric zinc(II) complexes for PLA production and degradation into methyl lactate - a chemical recycling method Polym. Chem. 11 2020 2381 2389 J. Payne, P. McKeown, M.F. Mahon, E.A.C. Emanuelsson, M.D. Jones, Mono- and dimeric zinc(II) complexes for PLA production and degradation into methyl lactate - a chemical recycling method, Polym. Chem., 11 (2020) 2381–2389. [48] J. Stewart M. Fuchs J. Payne O. Driscoll G. Kociok-Kohn B.D. Ward S. Herres-Pawlis M.D. Jones Simple Zn(II) complexes for the production and degradation of polyesters RSC Adv. 12 2022 1416 1424 J. Stewart, M. Fuchs, J. Payne, O. Driscoll, G. Kociok-Kohn, B.D. Ward, S. Herres-Pawlis, M.D. Jones, Simple Zn(II) complexes for the production and degradation of polyesters, RSC Adv., 12 (2022) 1416–1424. [49] J.M. Payne G. Kociok-Köhn E.A.C. Emanuelsson M.D. Jones Zn(II)- and Mg(II)-complexes of a tridentate {ONN} ligand: application to poly(lactic acid) production and chemical upcycling of polyesters Macromolecules 54 2021 8453 8469 J.M. Payne, G. Kociok-Köhn, E.A.C. Emanuelsson, M.D. Jones, Zn(II)- and Mg(II)-complexes of a tridentate {ONN} ligand: application to poly(lactic acid) production and chemical upcycling of polyesters, Macromolecules, 54 (2021) 8453–8469. [50] J. Payne P. McKeown O. Driscoll G. Kociok-Kohn E.A.C. Emanuelsson M.D. Jones Make or break: mg(II)- and Zn(II)-catalen complexes for PLA production and recycling of commodity polyesters Polym. Chem. 12 2021 1086 1096 J. Payne, P. McKeown, O. Driscoll, G. Kociok-Kohn, E.A.C. Emanuelsson, M.D. Jones, Make or break: mg(II)- and Zn(II)-catalen complexes for PLA production and recycling of commodity polyesters, Polym. Chem., 12 (2021) 1086–1096. [51] F. Santulli M. Lamberti M. Mazzeo A single catalyst for promoting reverse processes: synthesis and chemical degradation of polylactide ChemSusChem 14 2021 5470 5475 F. Santulli, M. Lamberti, M. Mazzeo, A single catalyst for promoting reverse processes: synthesis and chemical degradation of polylactide, ChemSusChem, 14 (2021) 5470–5475. [52] P. McKeown S.N. McCormick M.F. Mahon M.D. Jones Highly active Mg(II) and Zn(II) complexes for the ring opening polymerisation of lactide Polym. Chem. 9 2018 5339 5347 P. McKeown, S.N. McCormick, M.F. Mahon, M.D. Jones, Highly active Mg(II) and Zn(II) complexes for the ring opening polymerisation of lactide, Polym. Chem., 9 (2018) 5339–5347. [53] P. McKeown L.A. Roman-Ramirez S. Bates J. Wood M.D. Jones Zinc complexes for PLA formation and chemical recycling: towards a circular economy ChemSusChem 12 2019 5233 5238 P. McKeown, L.A. Roman-Ramirez, S. Bates, J. Wood, M.D. Jones, Zinc complexes for PLA formation and chemical recycling: towards a circular economy, ChemSusChem, 12 (2019) 5233–5238. [54] Crystal structures reported in a submitted paper. [55] P.M. Schaefer K. Dankhoff M. Rothemund A.N. Ksiazkiewicz A. Pich R. Schobert B. Weber S. Herres-Pawlis Towards new robust Zn(II) complexes for the ring-opening polymerization of lactide under industrially relevant conditions ChemistryOpen 8 2019 1020 1026 P.M. Schaefer, K. Dankhoff, M. Rothemund, A.N. Ksiazkiewicz, A. Pich, R. Schobert, B. Weber, S. Herres-Pawlis, Towards new robust Zn(II) complexes for the ring-opening polymerization of lactide under industrially relevant conditions, ChemistryOpen, 8 (2019) 1020–1026. [56] R.D. Rittinghaus P.M. Schaefer P. Albrecht C. Conrads A. Hoffmann A.N. Ksiazkiewicz O. Bienemann A. Pich S. Herres-Pawlis New kids in lactide polymerization: highly active and robust iron guanidine complexes as superior catalysts ChemSusChem 12 2019 2161 2165 R.D. Rittinghaus, P.M. Schaefer, P. Albrecht, C. Conrads, A. Hoffmann, A.N. Ksiazkiewicz, O. Bienemann, A. Pich, S. Herres-Pawlis, New kids in lactide polymerization: highly active and robust iron guanidine complexes as superior catalysts, ChemSusChem, 12 (2019) 2161–2165. [57] A. Hermann S. Hill A. Metz J. Heck A. Hoffmann L. Hartmann S. Herres-Pawlis Next generation of zinc bisguanidine polymerization catalysts towards highly crystalline, biodegradable polyesters Angew. Chem. Int. Ed. 59 2020 21778 21784 A. Hermann, S. Hill, A. Metz, J. Heck, A. Hoffmann, L. Hartmann, S. Herres-Pawlis, Next generation of zinc bisguanidine polymerization catalysts towards highly crystalline, biodegradable polyesters, Angew. Chem. Int. Ed., 59 (2020) 21778–21784. [58] L.A. Roman-Ramirez P. McKeown M.D. Jones J. Wood Poly(lactic acid) degradation into methyl lactate catalyzed by a well-defined Zn(II) complex ACS Catal. 9 2019 409 416 L.A. Roman-Ramirez, P. McKeown, M.D. Jones, J. Wood, Poly(lactic acid) degradation into methyl lactate catalyzed by a well-defined Zn(II) complex, ACS Catal., 9 (2019) 409–416.",
      "scopus-id": "85133531630",
      "coredata": {
        "eid": "1-s2.0-S2468823122003662",
        "dc:description": "Homoleptic and heteroleptic zinc and magnesium complexes bearing phenoxy-imine pyridine ligands were synthetized and characterized. Several structural parameters such as the structure of the ancillary ligand, the nature of the metal centre and the coordination geometry were investigated for identifying design elements purposeful to improve the catalytic activity in the ring opening polymerization (ROP) of lactide and in the reverse reaction of degradation of polylactide by alcoholysis. High efficiency and control degree were reached with zinc catalysts while magnesium ones showed lower activity and a weak control degree. NMR studies demonstrated that, for the homoleptic zinc complex, an activated-monomer mechanism was active. Differently, a coordination/insertion mechanism was observed for the related homoleptic zinc complex. Significantly, the complexes that showed the best activity in the ROP of lactide revealed to be the most efficient also in the degradation reaction.",
        "openArchiveArticle": "false",
        "prism:coverDate": "2022-08-31",
        "openaccessUserLicense": null,
        "prism:aggregationType": "Journal",
        "prism:url": "https://api.elsevier.com/content/article/pii/S2468823122003662",
        "dc:creator": [
          {
            "@_fa": "true",
            "$": "Santulli, Federica"
          },
          {
            "@_fa": "true",
            "$": "Gravina, Giuseppe"
          },
          {
            "@_fa": "true",
            "$": "Lamberti, Marina"
          },
          {
            "@_fa": "true",
            "$": "Tedesco, Consiglia"
          },
          {
            "@_fa": "true",
            "$": "Mazzeo, Mina"
          }
        ],
        "link": [
          {
            "@_fa": "true",
            "@rel": "self",
            "@href": "https://api.elsevier.com/content/article/pii/S2468823122003662"
          },
          {
            "@_fa": "true",
            "@rel": "scidir",
            "@href": "https://www.sciencedirect.com/science/article/pii/S2468823122003662"
          }
        ],
        "dc:format": "application/json",
        "openaccessType": null,
        "pii": "S2468-8231(22)00366-2",
        "prism:volume": "528",
        "articleNumber": "112480",
        "prism:publisher": "Elsevier B.V.",
        "dc:title": "Zinc and magnesium catalysts for the synthesis for PLA and its degradation: Clues for catalyst design",
        "prism:copyright": "© 2022 Elsevier B.V. All rights reserved.",
        "openaccess": "0",
        "prism:issn": "24688231",
        "dcterms:subject": [
          {
            "@_fa": "true",
            "$": "Polylactide"
          },
          {
            "@_fa": "true",
            "$": "Ring Opening Polymerization"
          },
          {
            "@_fa": "true",
            "$": "Zinc catalysts"
          },
          {
            "@_fa": "true",
            "$": "Depolymerization"
          },
          {
            "@_fa": "true",
            "$": "Methyl lactate"
          }
        ],
        "openaccessArticle": "false",
        "prism:publicationName": "Molecular Catalysis",
        "openaccessSponsorType": null,
        "prism:pageRange": "112480",
        "pubType": "fla",
        "prism:coverDisplayDate": "August 2022",
        "prism:doi": "10.1016/j.mcat.2022.112480",
        "prism:startingPage": "112480",
        "dc:identifier": "doi:10.1016/j.mcat.2022.112480",
        "openaccessSponsorName": null
      },
      "objects": {
        "object": [
          {
            "@category": "standard",
            "@height": "282",
            "@width": "489",
            "@_fa": "true",
            "$": "https://api.elsevier.com/content/object/eid/1-s2.0-S2468823122003662-sc2.jpg?httpAccept=%2A%2F%2A",
            "@multimediatype": "JPEG image file",
            "@type": "IMAGE-DOWNSAMPLED",
            "@size": "17831",
            "@ref": "sc2",
            "@mimetype": "image/jpeg"
          },
          {
            "@category": "standard",
            "@height": "227",
            "@width": "188",
            "@_fa": "true",
            "$": "https://api.elsevier.com/content/object/eid/1-s2.0-S2468823122003662-sc3.jpg?httpAccept=%2A%2F%2A",
            "@multimediatype": "JPEG image file",
            "@type": "IMAGE-DOWNSAMPLED",
            "@size": "7490",
            "@ref": "sc3",
            "@mimetype": "image/jpeg"
          },
          {
            "@category": "standard",
            "@height": "81",
            "@width": "489",
            "@_fa": "true",
            "$": "https://api.elsevier.com/content/object/eid/1-s2.0-S2468823122003662-sc1.jpg?httpAccept=%2A%2F%2A",
            "@multimediatype": "JPEG image file",
            "@type": "IMAGE-DOWNSAMPLED",
            "@size": "8342",
            "@ref": "sc1",
            "@mimetype": "image/jpeg"
          },
          {
            "@category": "standard",
            "@height": "350",
            "@width": "659",
            "@_fa": "true",
            "$": "https://api.elsevier.com/content/object/eid/1-s2.0-S2468823122003662-gr3.jpg?httpAccept=%2A%2F%2A",
            "@multimediatype": "JPEG image file",
            "@type": "IMAGE-DOWNSAMPLED",
            "@size": "27680",
            "@ref": "gr3",
            "@mimetype": "image/jpeg"
          },
          {
            "@category": "standard",
            "@height": "388",
            "@width": "565",
            "@_fa": "true",
            "$": "https://api.elsevier.com/content/object/eid/1-s2.0-S2468823122003662-gr4.jpg?httpAccept=%2A%2F%2A",
            "@multimediatype": "JPEG image file",
            "@type": "IMAGE-DOWNSAMPLED",
            "@size": "29543",
            "@ref": "gr4",
            "@mimetype": "image/jpeg"
          },
          {
            "@category": "standard",
            "@height": "244",
            "@width": "339",
            "@_fa": "true",
            "$": "https://api.elsevier.com/content/object/eid/1-s2.0-S2468823122003662-gr1.jpg?httpAccept=%2A%2F%2A",
            "@multimediatype": "JPEG image file",
            "@type": "IMAGE-DOWNSAMPLED",
            "@size": "29690",
            "@ref": "gr1",
            "@mimetype": "image/jpeg"
          },
          {
            "@category": "standard",
            "@height": "281",
            "@width": "339",
            "@_fa": "true",
            "$": "https://api.elsevier.com/content/object/eid/1-s2.0-S2468823122003662-sc6.jpg?httpAccept=%2A%2F%2A",
            "@multimediatype": "JPEG image file",
            "@type": "IMAGE-DOWNSAMPLED",
            "@size": "22759",
            "@ref": "sc6",
            "@mimetype": "image/jpeg"
          },
          {
            "@category": "standard",
            "@height": "254",
            "@width": "339",
            "@_fa": "true",
            "$": "https://api.elsevier.com/content/object/eid/1-s2.0-S2468823122003662-gr2.jpg?httpAccept=%2A%2F%2A",
            "@multimediatype": "JPEG image file",
            "@type": "IMAGE-DOWNSAMPLED",
            "@size": "17021",
            "@ref": "gr2",
            "@mimetype": "image/jpeg"
          },
          {
            "@category": "standard",
            "@height": "245",
            "@width": "242",
            "@_fa": "true",
            "$": "https://api.elsevier.com/content/object/eid/1-s2.0-S2468823122003662-ga1.jpg?httpAccept=%2A%2F%2A",
            "@multimediatype": "JPEG image file",
            "@type": "IMAGE-DOWNSAMPLED",
            "@size": "40897",
            "@ref": "ga1",
            "@mimetype": "image/jpeg"
          },
          {
            "@category": "standard",
            "@height": "299",
            "@width": "659",
            "@_fa": "true",
            "$": "https://api.elsevier.com/content/object/eid/1-s2.0-S2468823122003662-sc4.jpg?httpAccept=%2A%2F%2A",
            "@multimediatype": "JPEG image file",
            "@type": "IMAGE-DOWNSAMPLED",
            "@size": "31969",
            "@ref": "sc4",
            "@mimetype": "image/jpeg"
          },
          {
            "@category": "standard",
            "@height": "104",
            "@width": "659",
            "@_fa": "true",
            "$": "https://api.elsevier.com/content/object/eid/1-s2.0-S2468823122003662-sc5.jpg?httpAccept=%2A%2F%2A",
            "@multimediatype": "JPEG image file",
            "@type": "IMAGE-DOWNSAMPLED",
            "@size": "15408",
            "@ref": "sc5",
            "@mimetype": "image/jpeg"
          },
          {
            "@category": "thumbnail",
            "@height": "126",
            "@width": "219",
            "@_fa": "true",
            "$": "https://api.elsevier.com/content/object/eid/1-s2.0-S2468823122003662-sc2.sml?httpAccept=%2A%2F%2A",
            "@multimediatype": "GIF image file",
            "@type": "IMAGE-THUMBNAIL",
            "@size": "3664",
            "@ref": "sc2",
            "@mimetype": "image/gif"
          },
          {
            "@category": "thumbnail",
            "@height": "163",
            "@width": "135",
            "@_fa": "true",
            "$": "https://api.elsevier.com/content/object/eid/1-s2.0-S2468823122003662-sc3.sml?httpAccept=%2A%2F%2A",
            "@multimediatype": "GIF image file",
            "@type": "IMAGE-THUMBNAIL",
            "@size": "3530",
            "@ref": "sc3",
            "@mimetype": "image/gif"
          },
          {
            "@category": "thumbnail",
            "@height": "36",
            "@width": "219",
            "@_fa": "true",
            "$": "https://api.elsevier.com/content/object/eid/1-s2.0-S2468823122003662-sc1.sml?httpAccept=%2A%2F%2A",
            "@multimediatype": "GIF image file",
            "@type": "IMAGE-THUMBNAIL",
            "@size": "2213",
            "@ref": "sc1",
            "@mimetype": "image/gif"
          },
          {
            "@category": "thumbnail",
            "@height": "116",
            "@width": "219",
            "@_fa": "true",
            "$": "https://api.elsevier.com/content/object/eid/1-s2.0-S2468823122003662-gr3.sml?httpAccept=%2A%2F%2A",
            "@multimediatype": "GIF image file",
            "@type": "IMAGE-THUMBNAIL",
            "@size": "6416",
            "@ref": "gr3",
            "@mimetype": "image/gif"
          },
          {
            "@category": "thumbnail",
            "@height": "150",
            "@width": "219",
            "@_fa": "true",
            "$": "https://api.elsevier.com/content/object/eid/1-s2.0-S2468823122003662-gr4.sml?httpAccept=%2A%2F%2A",
            "@multimediatype": "GIF image file",
            "@type": "IMAGE-THUMBNAIL",
            "@size": "6292",
            "@ref": "gr4",
            "@mimetype": "image/gif"
          },
          {
            "@category": "thumbnail",
            "@height": "158",
            "@width": "219",
            "@_fa": "true",
            "$": "https://api.elsevier.com/content/object/eid/1-s2.0-S2468823122003662-gr1.sml?httpAccept=%2A%2F%2A",
            "@multimediatype": "GIF image file",
            "@type": "IMAGE-THUMBNAIL",
            "@size": "15173",
            "@ref": "gr1",
            "@mimetype": "image/gif"
          },
          {
            "@category": "thumbnail",
            "@height": "164",
            "@width": "197",
            "@_fa": "true",
            "$": "https://api.elsevier.com/content/object/eid/1-s2.0-S2468823122003662-sc6.sml?httpAccept=%2A%2F%2A",
            "@multimediatype": "GIF image file",
            "@type": "IMAGE-THUMBNAIL",
            "@size": "7256",
            "@ref": "sc6",
            "@mimetype": "image/gif"
          },
          {
            "@category": "thumbnail",
            "@height": "164",
            "@width": "219",
            "@_fa": "true",
            "$": "https://api.elsevier.com/content/object/eid/1-s2.0-S2468823122003662-gr2.sml?httpAccept=%2A%2F%2A",
            "@multimediatype": "GIF image file",
            "@type": "IMAGE-THUMBNAIL",
            "@size": "9088",
            "@ref": "gr2",
            "@mimetype": "image/gif"
          },
          {
            "@category": "thumbnail",
            "@height": "164",
            "@width": "162",
            "@_fa": "true",
            "$": "https://api.elsevier.com/content/object/eid/1-s2.0-S2468823122003662-ga1.sml?httpAccept=%2A%2F%2A",
            "@multimediatype": "GIF image file",
            "@type": "IMAGE-THUMBNAIL",
            "@size": "16273",
            "@ref": "ga1",
            "@mimetype": "image/gif"
          },
          {
            "@category": "thumbnail",
            "@height": "99",
            "@width": "219",
            "@_fa": "true",
            "$": "https://api.elsevier.com/content/object/eid/1-s2.0-S2468823122003662-sc4.sml?httpAccept=%2A%2F%2A",
            "@multimediatype": "GIF image file",
            "@type": "IMAGE-THUMBNAIL",
            "@size": "5931",
            "@ref": "sc4",
            "@mimetype": "image/gif"
          },
          {
            "@category": "thumbnail",
            "@height": "34",
            "@width": "219",
            "@_fa": "true",
            "$": "https://api.elsevier.com/content/object/eid/1-s2.0-S2468823122003662-sc5.sml?httpAccept=%2A%2F%2A",
            "@multimediatype": "GIF image file",
            "@type": "IMAGE-THUMBNAIL",
            "@size": "4023",
            "@ref": "sc5",
            "@mimetype": "image/gif"
          },
          {
            "@category": "high",
            "@height": "1251",
            "@width": "2167",
            "@_fa": "true",
            "$": "https://api.elsevier.com/content/object/eid/1-s2.0-S2468823122003662-sc2_lrg.jpg?httpAccept=%2A%2F%2A",
            "@multimediatype": "JPEG image file",
            "@type": "IMAGE-HIGH-RES",
            "@size": "139420",
            "@ref": "sc2",
            "@mimetype": "image/jpeg"
          },
          {
            "@category": "high",
            "@height": "1007",
            "@width": "833",
            "@_fa": "true",
            "$": "https://api.elsevier.com/content/object/eid/1-s2.0-S2468823122003662-sc3_lrg.jpg?httpAccept=%2A%2F%2A",
            "@multimediatype": "JPEG image file",
            "@type": "IMAGE-HIGH-RES",
            "@size": "48256",
            "@ref": "sc3",
            "@mimetype": "image/jpeg"
          },
          {
            "@category": "high",
            "@height": "360",
            "@width": "2167",
            "@_fa": "true",
            "$": "https://api.elsevier.com/content/object/eid/1-s2.0-S2468823122003662-sc1_lrg.jpg?httpAccept=%2A%2F%2A",
            "@multimediatype": "JPEG image file",
            "@type": "IMAGE-HIGH-RES",
            "@size": "59008",
            "@ref": "sc1",
            "@mimetype": "image/jpeg"
          },
          {
            "@category": "high",
            "@height": "1548",
            "@width": "2917",
            "@_fa": "true",
            "$": "https://api.elsevier.com/content/object/eid/1-s2.0-S2468823122003662-gr3_lrg.jpg?httpAccept=%2A%2F%2A",
            "@multimediatype": "JPEG image file",
            "@type": "IMAGE-HIGH-RES",
            "@size": "212462",
            "@ref": "gr3",
            "@mimetype": "image/jpeg"
          },
          {
            "@category": "high",
            "@height": "1717",
            "@width": "2500",
            "@_fa": "true",
            "$": "https://api.elsevier.com/content/object/eid/1-s2.0-S2468823122003662-gr4_lrg.jpg?httpAccept=%2A%2F%2A",
            "@multimediatype": "JPEG image file",
            "@type": "IMAGE-HIGH-RES",
            "@size": "177967",
            "@ref": "gr4",
            "@mimetype": "image/jpeg"
          },
          {
            "@category": "high",
            "@height": "1079",
            "@width": "1500",
            "@_fa": "true",
            "$": "https://api.elsevier.com/content/object/eid/1-s2.0-S2468823122003662-gr1_lrg.jpg?httpAccept=%2A%2F%2A",
            "@multimediatype": "JPEG image file",
            "@type": "IMAGE-HIGH-RES",
            "@size": "235638",
            "@ref": "gr1",
            "@mimetype": "image/jpeg"
          },
          {
            "@category": "high",
            "@height": "1245",
            "@width": "1500",
            "@_fa": "true",
            "$": "https://api.elsevier.com/content/object/eid/1-s2.0-S2468823122003662-sc6_lrg.jpg?httpAccept=%2A%2F%2A",
            "@multimediatype": "JPEG image file",
            "@type": "IMAGE-HIGH-RES",
            "@size": "123237",
            "@ref": "sc6",
            "@mimetype": "image/jpeg"
          },
          {
            "@category": "high",
            "@height": "1125",
            "@width": "1500",
            "@_fa": "true",
            "$": "https://api.elsevier.com/content/object/eid/1-s2.0-S2468823122003662-gr2_lrg.jpg?httpAccept=%2A%2F%2A",
            "@multimediatype": "JPEG image file",
            "@type": "IMAGE-HIGH-RES",
            "@size": "120625",
            "@ref": "gr2",
            "@mimetype": "image/jpeg"
          },
          {
            "@category": "high",
            "@height": "1085",
            "@width": "1073",
            "@_fa": "true",
            "$": "https://api.elsevier.com/content/object/eid/1-s2.0-S2468823122003662-ga1_lrg.jpg?httpAccept=%2A%2F%2A",
            "@multimediatype": "JPEG image file",
            "@type": "IMAGE-HIGH-RES",
            "@size": "242713",
            "@ref": "ga1",
            "@mimetype": "image/jpeg"
          },
          {
            "@category": "high",
            "@height": "1325",
            "@width": "2917",
            "@_fa": "true",
            "$": "https://api.elsevier.com/content/object/eid/1-s2.0-S2468823122003662-sc4_lrg.jpg?httpAccept=%2A%2F%2A",
            "@multimediatype": "JPEG image file",
            "@type": "IMAGE-HIGH-RES",
            "@size": "210698",
            "@ref": "sc4",
            "@mimetype": "image/jpeg"
          },
          {
            "@category": "high",
            "@height": "459",
            "@width": "2917",
            "@_fa": "true",
            "$": "https://api.elsevier.com/content/object/eid/1-s2.0-S2468823122003662-sc5_lrg.jpg?httpAccept=%2A%2F%2A",
            "@multimediatype": "JPEG image file",
            "@type": "IMAGE-HIGH-RES",
            "@size": "93097",
            "@ref": "sc5",
            "@mimetype": "image/jpeg"
          },
          {
            "@category": "standard",
            "@_fa": "true",
            "$": "https://api.elsevier.com/content/object/eid/1-s2.0-S2468823122003662-mmc1.docx?httpAccept=%2A%2F%2A",
            "@multimediatype": "Microsoft Word file",
            "@type": "APPLICATION",
            "@size": "3396938",
            "@ref": "mmc1",
            "@mimetype": "application/word"
          },
          {
            "@category": "standard",
            "@_fa": "true",
            "$": "https://api.elsevier.com/content/object/eid/1-s2.0-S2468823122003662-am.pdf?httpAccept=%2A%2F%2A",
            "@multimediatype": "Acrobat PDF file",
            "@type": "AAM-PDF",
            "@size": "784135",
            "@ref": "am",
            "@mimetype": "application/pdf"
          }
        ]
      },
      "link": {
        "@rel": "abstract",
        "@href": "https://api.elsevier.com/content/abstract/scopus_id/85133531630"
      }
    }
  }
}