{
  "metadata": {
    "title": "Poly (ionic liquid)s-silica spheres as effective core-shell catalysts for the conversion of glucose and fructose into 5-hydroxymethylfurfural",
    "authors": "; ; ",
    "journal": "Molecular Catalysis",
    "date": "2023-07-15",
    "doi": "10.1016/j.mcat.2023.113244",
    "abstract": "",
    "uri": "https://api.elsevier.com/content/article/pii/S2468823123003280",
    "pii": "S2468823123003280"
  },
  "fulltext": {
    "full-text-retrieval-response": {
      "scopus-eid": "2-s2.0-85159320215",
      "originalText": "serial JL 315758 291210 291744 291790 291809 31 Molecular Catalysis MOLECULARCATALYSIS 2023-05-17 2023-05-17 2023-05-17 2023-05-17 2024-05-30T08:10:45 1-s2.0-S2468823123003280 S2468-8231(23)00328-0 S2468823123003280 10.1016/j.mcat.2023.113244 S300 S300.1 FULL-TEXT 1-s2.0-S2468823123X00121 2024-06-26T17:47:57.997821Z 0 0 20230715 2023 2023-05-17T22:46:40.95306Z absattachment articleinfo articlenumber articletitlenorm authfirstinitialnorm authfirstsurnamenorm cid cids contenttype copyright crossmark dateloaded dateloadedtxt datesearch datesort dateupdated dco docsubtype doctype doi eid ewtransactionid hubeid indexeddate issn issnnorm itemstage itemtransactionid itemweight openaccess openarchive pg pgfirst pii piinorm pubdatestart pubdatetxt pubyr sectiontitle sortorder srctitle srctitlenorm srctype ssids alllist content subj subheadings suppl tomb volfirst volissue volumelist webpdf webpdfpagecount yearnav figure table e-component body acknowledge affil appendices articletitle auth authfirstini authfull authkeywords authlast grantnumber grantsponsor grantsponsorid highlightsabst primabst ref specialabst 2468-8231 24688231 true 546 546 C Volume 546 8 113244 113244 113244 20230715 15 July 2023 2023-07-15 2023 Regular Papers article fla © 2023 Elsevier B.V. All rights reserved. POLYIONICLIQUIDSSILICASPHERESEFFECTIVECORESHELLCATALYSTSFORCONVERSIONGLUCOSEFRUCTOSE5HYDROXYMETHYLFURFURAL ZHU N 1 Introduction 2 Experimental section 2.1 Materials 2.2 Catalysts preparation 2.3 Catalysts characterization 2.4 General procedure for converting monosaccharides to 5-HMF 3 Results and discussions 3.1 Characterization of PIL@SiO2 catalysts 3.2 Effect of alkyl chain length on synthesis of 5-HMF from glucose and fructose 3.3 Effect of reaction temperature on synthesis of 5-HMF from fructose and glucose 3.4 Effects of dosage of PIL@SiO2-18 on 5-HMF synthesis from fructose and glucose 3.5 Effects of concentration of fructose and glucose on synthesis of 5-HMF 3.6 The effect of different proportions of MIBK and Sat.NaCl on 5-HMF yield 3.7 Catalyst recyclability 3.8 Mechanism of glucose and fructose conversion to 5-HMF 4 Conclusions CRediT authorship contribution statement Acknowledgments Appendix Supplementary materials References CHEN 2021 1711 1722 X ESTEBAN 2020 2097 2128 J SRINIVASARAO 2020 3428 3437 B YAN 2014 39453 39462 Y WANG 2020 2289 2293 Y SUN 2016 177 182 Y TEONG 2014 S YU 2017 716 732 I KUNNIKURUVAN 2019 7250 7263 S KONG 2020 106528 Q ZHANG 2017 877 883 L KARINEN 2011 1002 1016 R WANG 2012 2506 2512 J GARCIASANCHO 2017 617 625 C CHEN 2016 177 184 D LI 2015 820 828 L POLSHETTIWAR 2010 9652 9656 V SHAHANGI 2018 769 780 F MIKA 2018 505 613 L YANG 2015 19900 19906 L QI 2011 7985 7989 X HOU 2018 183 193 Q QU 2016 26067 Y SAXENA 2017 10379 10386 P MATSUBARA 2010 3053 3056 S WANG 2014 4234 4240 X BHATTACHERJEE 2015 20080 20092 A ZHUANG 2018 146 152 Y KARIMIZARCHI 2021 4929 4942 M LONG 2017 465 473 Y RAMEZANZADEH 2016 511 528 B MUSIC 2011 89 94 S CHEN 2019 1981 1987 Z PHILIPPE 2012 1107 1115 B WU 2019 6592 6600 S ZHU 2019 1555 1565 Q HE 2021 H XU 2018 30 39 Y JEON 2021 287 302 Y HE 2010 3139 3144 F PARK 2018 752 756 S HOANG 2022 P CHAKRAHARI 2019 4943 4947 K LEE 1988 785 789 C ROMANLESHKOV 2010 8954 8957 Y ELSAYED 2018 407 416 I ZHUX2023X113244 ZHUX2023X113244XN 2025-05-17T00:00:00.000Z 2025-05-17T00:00:00.000Z http://creativecommons.org/licenses/by-nc-nd/4.0/ © 2023 Elsevier B.V. All rights reserved. 2023-05-21T15:49:58.496Z http://vtw.elsevier.com/data/voc/AddOnTypes/50.7/aggregated-refined Beijing Municipal Education Commission KM202210011010 Beijing Municipal Commission of Education http://data.elsevier.com/vocabulary/SciValFunders/501100002888 http://sws.geonames.org/1814991/ BTBU Graduate Student Research Ability Enhancement Fund 19008022056 Research Foundation for Youth Scholars of Beijing Technology and Business University QNJJ2021-10 This work was supported by the R&D Program of Beijing Municipal Education Commission ( KM202210011010 ), the Research Foundation for Youth Scholars of Beijing Technology and Business University under grant number QNJJ2021-10 , and 2022 BTBU Graduate Student Research Ability Enhancement Fund (19008022056). https://doi.org/10.15223/policy-017 https://doi.org/10.15223/policy-037 https://doi.org/10.15223/policy-012 https://doi.org/10.15223/policy-029 https://doi.org/10.15223/policy-004 item S2468-8231(23)00328-0 S2468823123003280 1-s2.0-S2468823123003280 10.1016/j.mcat.2023.113244 315758 2024-05-30T11:49:19.349625Z 2023-07-15 1-s2.0-S2468823123003280-main.pdf https://s3-eu-west-1.amazonaws.com/prod-ucs-content-store-eu-west/content/pii:S2468823123003280/MAIN/application/pdf/fd158511418317c638a36fde829f6adb/main.pdf main.pdf pdf true 7735759 MAIN 11 1-s2.0-S2468823123003280-main_1.png https://s3-eu-west-1.amazonaws.com/prod-ucs-content-store-eu-west/content/pii:S2468823123003280/PREVIEW/image/png/dcb631226cdd913301afc90c378af5ad/main_1.png main_1.png png 60512 849 656 IMAGE-WEB-PDF 1 1-s2.0-S2468823123003280-gr7.jpg https://s3-eu-west-1.amazonaws.com/prod-ucs-content-store-eu-west/content/pii:S2468823123003280/gr7/DOWNSAMPLED/image/jpeg/115c90b191356aa0af97fd5f62716243/gr7.jpg gr7 gr7.jpg jpg 34089 288 388 IMAGE-DOWNSAMPLED 1-s2.0-S2468823123003280-gr6.jpg https://s3-eu-west-1.amazonaws.com/prod-ucs-content-store-eu-west/content/pii:S2468823123003280/gr6/DOWNSAMPLED/image/jpeg/21b4ecc55f8e81f9032561ac9628e175/gr6.jpg gr6 gr6.jpg jpg 51704 284 696 IMAGE-DOWNSAMPLED 1-s2.0-S2468823123003280-gr9.jpg https://s3-eu-west-1.amazonaws.com/prod-ucs-content-store-eu-west/content/pii:S2468823123003280/gr9/DOWNSAMPLED/image/jpeg/799ea3fb386c7ba0be1d993726ab6e1a/gr9.jpg gr9 gr9.jpg jpg 20737 304 380 IMAGE-DOWNSAMPLED 1-s2.0-S2468823123003280-gr8.jpg https://s3-eu-west-1.amazonaws.com/prod-ucs-content-store-eu-west/content/pii:S2468823123003280/gr8/DOWNSAMPLED/image/jpeg/450980aa55e791645863b4c253cb2441/gr8.jpg gr8 gr8.jpg jpg 31938 287 389 IMAGE-DOWNSAMPLED 1-s2.0-S2468823123003280-gr10.jpg https://s3-eu-west-1.amazonaws.com/prod-ucs-content-store-eu-west/content/pii:S2468823123003280/gr10/DOWNSAMPLED/image/jpeg/1779a8ca46b217305174577d71d63576/gr10.jpg gr10 gr10.jpg jpg 56108 355 508 IMAGE-DOWNSAMPLED 1-s2.0-S2468823123003280-gr3.jpg https://s3-eu-west-1.amazonaws.com/prod-ucs-content-store-eu-west/content/pii:S2468823123003280/gr3/DOWNSAMPLED/image/jpeg/7b4f67c8e25766c1036f0b0daeb615a8/gr3.jpg gr3 gr3.jpg jpg 51059 177 734 IMAGE-DOWNSAMPLED 1-s2.0-S2468823123003280-gr2.jpg https://s3-eu-west-1.amazonaws.com/prod-ucs-content-store-eu-west/content/pii:S2468823123003280/gr2/DOWNSAMPLED/image/jpeg/76b5cb8b1a322db8223437dd8ff2784e/gr2.jpg gr2 gr2.jpg jpg 77564 465 640 IMAGE-DOWNSAMPLED 1-s2.0-S2468823123003280-gr5.jpg https://s3-eu-west-1.amazonaws.com/prod-ucs-content-store-eu-west/content/pii:S2468823123003280/gr5/DOWNSAMPLED/image/jpeg/659fcf59e517e17ce1d4240ecb198479/gr5.jpg gr5 gr5.jpg jpg 28511 286 384 IMAGE-DOWNSAMPLED 1-s2.0-S2468823123003280-gr4.jpg https://s3-eu-west-1.amazonaws.com/prod-ucs-content-store-eu-west/content/pii:S2468823123003280/gr4/DOWNSAMPLED/image/jpeg/46014f18cb4f2aeacdddbfbca808d4ce/gr4.jpg gr4 gr4.jpg jpg 97131 368 734 IMAGE-DOWNSAMPLED 1-s2.0-S2468823123003280-gr1.jpg https://s3-eu-west-1.amazonaws.com/prod-ucs-content-store-eu-west/content/pii:S2468823123003280/gr1/DOWNSAMPLED/image/jpeg/97280e51eda6dc9585cedcbedfbbbef8/gr1.jpg gr1 gr1.jpg jpg 73014 512 602 IMAGE-DOWNSAMPLED 1-s2.0-S2468823123003280-sc2.jpg https://s3-eu-west-1.amazonaws.com/prod-ucs-content-store-eu-west/content/pii:S2468823123003280/sc2/DOWNSAMPLED/image/jpeg/2eee6c2cb6920abbc14fe469227aac40/sc2.jpg sc2 sc2.jpg jpg 38044 391 715 IMAGE-DOWNSAMPLED 1-s2.0-S2468823123003280-sc1.jpg https://s3-eu-west-1.amazonaws.com/prod-ucs-content-store-eu-west/content/pii:S2468823123003280/sc1/DOWNSAMPLED/image/jpeg/ad370015ed20f0944cb2ef11affa0e63/sc1.jpg sc1 sc1.jpg jpg 121604 868 715 IMAGE-DOWNSAMPLED 1-s2.0-S2468823123003280-ga1.jpg https://s3-eu-west-1.amazonaws.com/prod-ucs-content-store-eu-west/content/pii:S2468823123003280/ga1/DOWNSAMPLED/image/jpeg/8869ce672eeb20e6cf37b869fb10c5a3/ga1.jpg ga1 true ga1.jpg jpg 49433 190 500 IMAGE-DOWNSAMPLED 1-s2.0-S2468823123003280-gr7.sml https://s3-eu-west-1.amazonaws.com/prod-ucs-content-store-eu-west/content/pii:S2468823123003280/gr7/THUMBNAIL/image/gif/f9339cb23bdcadba4a445b553a7a4465/gr7.sml gr7 gr7.sml sml 12208 162 219 IMAGE-THUMBNAIL 1-s2.0-S2468823123003280-gr6.sml https://s3-eu-west-1.amazonaws.com/prod-ucs-content-store-eu-west/content/pii:S2468823123003280/gr6/THUMBNAIL/image/gif/9f8f32c7ae692ddaa2d2b29e813c3bed/gr6.sml gr6 gr6.sml sml 8907 89 219 IMAGE-THUMBNAIL 1-s2.0-S2468823123003280-gr9.sml https://s3-eu-west-1.amazonaws.com/prod-ucs-content-store-eu-west/content/pii:S2468823123003280/gr9/THUMBNAIL/image/gif/fc9c18c06e49b89181ce05f08a0c53fc/gr9.sml gr9 gr9.sml sml 8557 164 205 IMAGE-THUMBNAIL 1-s2.0-S2468823123003280-gr8.sml https://s3-eu-west-1.amazonaws.com/prod-ucs-content-store-eu-west/content/pii:S2468823123003280/gr8/THUMBNAIL/image/gif/6e1e95810a2fb7e8cdd5575e06334fea/gr8.sml gr8 gr8.sml sml 11543 161 219 IMAGE-THUMBNAIL 1-s2.0-S2468823123003280-gr10.sml https://s3-eu-west-1.amazonaws.com/prod-ucs-content-store-eu-west/content/pii:S2468823123003280/gr10/THUMBNAIL/image/gif/31b1599a1c0aa356e7f99a5bb2fc241a/gr10.sml gr10 gr10.sml sml 17892 153 219 IMAGE-THUMBNAIL 1-s2.0-S2468823123003280-gr3.sml https://s3-eu-west-1.amazonaws.com/prod-ucs-content-store-eu-west/content/pii:S2468823123003280/gr3/THUMBNAIL/image/gif/db754ff84b59d89a6d11c2cecebb899b/gr3.sml gr3 gr3.sml sml 9894 53 219 IMAGE-THUMBNAIL 1-s2.0-S2468823123003280-gr2.sml https://s3-eu-west-1.amazonaws.com/prod-ucs-content-store-eu-west/content/pii:S2468823123003280/gr2/THUMBNAIL/image/gif/a0dabf2cd26d2837b2a723af46a6dada/gr2.sml gr2 gr2.sml sml 12027 159 219 IMAGE-THUMBNAIL 1-s2.0-S2468823123003280-gr5.sml https://s3-eu-west-1.amazonaws.com/prod-ucs-content-store-eu-west/content/pii:S2468823123003280/gr5/THUMBNAIL/image/gif/559f0326779b38a50271221a1d922aad/gr5.sml gr5 gr5.sml sml 11175 163 219 IMAGE-THUMBNAIL 1-s2.0-S2468823123003280-gr4.sml https://s3-eu-west-1.amazonaws.com/prod-ucs-content-store-eu-west/content/pii:S2468823123003280/gr4/THUMBNAIL/image/gif/3bc2c0e0f1e40ae2223213a86bc0b5fe/gr4.sml gr4 gr4.sml sml 16773 110 219 IMAGE-THUMBNAIL 1-s2.0-S2468823123003280-gr1.sml https://s3-eu-west-1.amazonaws.com/prod-ucs-content-store-eu-west/content/pii:S2468823123003280/gr1/THUMBNAIL/image/gif/e614590a9dec0628d75b192902ac8bca/gr1.sml gr1 gr1.sml sml 12552 164 193 IMAGE-THUMBNAIL 1-s2.0-S2468823123003280-sc2.sml https://s3-eu-west-1.amazonaws.com/prod-ucs-content-store-eu-west/content/pii:S2468823123003280/sc2/THUMBNAIL/image/gif/f833a00196e75e9520f10ddf3166f934/sc2.sml sc2 sc2.sml sml 6250 120 219 IMAGE-THUMBNAIL 1-s2.0-S2468823123003280-sc1.sml https://s3-eu-west-1.amazonaws.com/prod-ucs-content-store-eu-west/content/pii:S2468823123003280/sc1/THUMBNAIL/image/gif/6dd2221e3efdcccfa5c8798417a5386b/sc1.sml sc1 sc1.sml sml 7536 164 135 IMAGE-THUMBNAIL 1-s2.0-S2468823123003280-ga1.sml https://s3-eu-west-1.amazonaws.com/prod-ucs-content-store-eu-west/content/pii:S2468823123003280/ga1/THUMBNAIL/image/gif/d6d8c2f7ddbe6e5b1c51e8a5cf64bd5e/ga1.sml ga1 true ga1.sml sml 15546 83 219 IMAGE-THUMBNAIL 1-s2.0-S2468823123003280-gr7_lrg.jpg https://s3-eu-west-1.amazonaws.com/prod-ucs-content-store-eu-west/content/pii:S2468823123003280/HIGHRES/image/jpeg/a16ec74100545514310d939c3bdcdce8/gr7_lrg.jpg gr7 gr7_lrg.jpg jpg 247881 1274 1717 IMAGE-HIGH-RES 1-s2.0-S2468823123003280-gr6_lrg.jpg https://s3-eu-west-1.amazonaws.com/prod-ucs-content-store-eu-west/content/pii:S2468823123003280/HIGHRES/image/jpeg/433a6c8def622c71d78102dee6c4dd30/gr6_lrg.jpg gr6 gr6_lrg.jpg jpg 380298 1256 3083 IMAGE-HIGH-RES 1-s2.0-S2468823123003280-gr9_lrg.jpg https://s3-eu-west-1.amazonaws.com/prod-ucs-content-store-eu-west/content/pii:S2468823123003280/HIGHRES/image/jpeg/5e7df00765674efe1a6f33bb840988b0/gr9_lrg.jpg gr9 gr9_lrg.jpg jpg 133349 1346 1683 IMAGE-HIGH-RES 1-s2.0-S2468823123003280-gr8_lrg.jpg https://s3-eu-west-1.amazonaws.com/prod-ucs-content-store-eu-west/content/pii:S2468823123003280/HIGHRES/image/jpeg/b22ca2863298ecfd1500067673f8d64b/gr8_lrg.jpg gr8 gr8_lrg.jpg jpg 237902 1271 1725 IMAGE-HIGH-RES 1-s2.0-S2468823123003280-gr10_lrg.jpg https://s3-eu-west-1.amazonaws.com/prod-ucs-content-store-eu-west/content/pii:S2468823123003280/HIGHRES/image/jpeg/b8f1a1a45143b98ebcdf331447ad1082/gr10_lrg.jpg gr10 gr10_lrg.jpg jpg 444663 1573 2250 IMAGE-HIGH-RES 1-s2.0-S2468823123003280-gr3_lrg.jpg https://s3-eu-west-1.amazonaws.com/prod-ucs-content-store-eu-west/content/pii:S2468823123003280/HIGHRES/image/jpeg/ddd2935981a777ca7ecf81e0eb3b01e2/gr3_lrg.jpg gr3 gr3_lrg.jpg jpg 410485 785 3250 IMAGE-HIGH-RES 1-s2.0-S2468823123003280-gr2_lrg.jpg https://s3-eu-west-1.amazonaws.com/prod-ucs-content-store-eu-west/content/pii:S2468823123003280/HIGHRES/image/jpeg/0c131f611af85a980fa4dc822b641791/gr2_lrg.jpg gr2 gr2_lrg.jpg jpg 663021 2058 2833 IMAGE-HIGH-RES 1-s2.0-S2468823123003280-gr5_lrg.jpg https://s3-eu-west-1.amazonaws.com/prod-ucs-content-store-eu-west/content/pii:S2468823123003280/HIGHRES/image/jpeg/7464a9af731a33acf5db10cccdcadbf8/gr5_lrg.jpg gr5 gr5_lrg.jpg jpg 211955 1268 1700 IMAGE-HIGH-RES 1-s2.0-S2468823123003280-gr4_lrg.jpg https://s3-eu-west-1.amazonaws.com/prod-ucs-content-store-eu-west/content/pii:S2468823123003280/HIGHRES/image/jpeg/6c358ff24ccdb3c82f4feac06369991e/gr4_lrg.jpg gr4 gr4_lrg.jpg jpg 831081 1628 3250 IMAGE-HIGH-RES 1-s2.0-S2468823123003280-gr1_lrg.jpg https://s3-eu-west-1.amazonaws.com/prod-ucs-content-store-eu-west/content/pii:S2468823123003280/HIGHRES/image/jpeg/0c220a3f823584168a41628504d8ae43/gr1_lrg.jpg gr1 gr1_lrg.jpg jpg 529478 2267 2667 IMAGE-HIGH-RES 1-s2.0-S2468823123003280-sc2_lrg.jpg https://s3-eu-west-1.amazonaws.com/prod-ucs-content-store-eu-west/content/pii:S2468823123003280/HIGHRES/image/jpeg/0170ad673aa9055affe9cdcf8b8e540e/sc2_lrg.jpg sc2 sc2_lrg.jpg jpg 298693 1731 3167 IMAGE-HIGH-RES 1-s2.0-S2468823123003280-sc1_lrg.jpg https://s3-eu-west-1.amazonaws.com/prod-ucs-content-store-eu-west/content/pii:S2468823123003280/HIGHRES/image/jpeg/f6c074bc80e6f936a2dad3907751777e/sc1_lrg.jpg sc1 sc1_lrg.jpg jpg 990908 3846 3167 IMAGE-HIGH-RES 1-s2.0-S2468823123003280-ga1_lrg.jpg https://s3-eu-west-1.amazonaws.com/prod-ucs-content-store-eu-west/content/pii:S2468823123003280/HIGHRES/image/jpeg/518f8952eb417249d2940ecb617b1848/ga1_lrg.jpg ga1 true ga1_lrg.jpg jpg 352522 843 2213 IMAGE-HIGH-RES 1-s2.0-S2468823123003280-mmc1.docx https://s3-eu-west-1.amazonaws.com/prod-ucs-content-store-eu-west/content/pii:S2468823123003280/mmc1/MAIN/application/vnd.openxmlformats-officedocument.wordprocessingml.document/29feb1f227efd106c19ec385290ba5ce/mmc1.docx mmc1 mmc1.docx docx 1163926 APPLICATION 1-s2.0-S2468823123003280-am.pdf https://s3-eu-west-1.amazonaws.com/prod-ucs-content-store-eu-west/content/egi:10LZZ00LBTQ/MAIN/application/pdf/f22b7aba7180b57b521e9c5b425b1b5c/am.pdf am am.pdf pdf false 1265232 AAM-PDF MCAT 113244 113244 S2468-8231(23)00328-0 10.1016/j.mcat.2023.113244 Elsevier B.V. Fig. 1 FTIR spectra (a) and XRD analysis (b) of PIL@SiO2 catalysts; (c) Pyridine-IR spectra of PIL@SiO2-18; (d) Full-spectrum of XPS for PIL@SiO2 catalysts. Fig 1 Fig. 2 XPS spectra of Si 2p (a), O 1s (b), N 1s (c), and C 1s (d) of PIL@SiO2 samples. Fig 2 Fig. 3 SEM images of (a) PIL@SiO2-14, (b) PIL@SiO2-16, (c) PIL@SiO2-18. Fig 3 Fig. 4 TEM (a) and TEM-HAADF (b) image of a PIL@SiO2-18 nanosphere; EDS mapping of (d) C, (e) N, (f) O, (g) Si, and (h) Br in PIL@SiO2-18 (c) sample. Fig 4 Fig. 5 Effects of length of alkyl chain on the yield of 5-HMF prepared from (a)fructose, (b)glucose. (Conditions: (a) 66.7 mM fructose, 5 mL of reaction solution (MIBK-Sat.NaCl=70: 30 (v/v)), 190 °C, 1 h; (b) 66.7 mM glucose, 5 mL of reaction solution (MIBK-Sat.NaCl=70: 30 (v/v)), 200 °C, 2 h) Fig 5 Fig. 6 Effects of reaction temperature on the yield of 5-HMF prepared from fructose (a) and glucose (b). (Conditions: (a) 66.7 mM fructose, 20 mg PIL@SiO2-18, 5 mL of reaction solution (MIBK-Sat.NaCl=70: 30 (v/v)); (b) 66.7 mM glucose, 20 mg PIL@SiO2-18, 5 mL of reaction solution (MIBK-Sat.NaCl=70: 30 (v/v))). Fig 6 Fig. 7 Effects of dosage of PIL@SiO2-18 on the yield of 5-HMF prepared from fructose (a) and glucose (b). (Conditions: (a) 66.7 mM fructose, 5 mL of reaction solution (MIBK-Sat.NaCl=70: 30 (v/v)), 190 °C, 1 h; (b) 66.7 mM glucose, 5 mL of reaction solution (MIBK-Sat.NaCl=70: 30 (v/v)), 200 °C, 2 h) Fig 7 Fig. 8 Effects of concentration of substrate on the yield of 5-HMF prepared from fructose (a) and glucose (b). (Conditions: (a) 66.7 mM fructose, 5 mL of reaction solution (MIBK-Sat.NaCl=70: 30 (v/v)), 190 °C, 1 h; (b) 66.7 mM glucose, 5 mL of reaction solution (MIBK-Sat.NaCl=70: 30 (v/v)), 200 °C, 2 h) Fig 8 Fig. 9 Reusability of PIL@SiO2-18 catalyst. (Conditions: 66.7 mM fructose, 5 mL of reaction solution (MIBK-Sat.NaCl=70: 30 (v/v)), 190 °C, 1 h) Fig 9 Fig. 10 Electrostatic potential calculation in (a) Glucose-PIL (1C), (b) Glucose-PIL (18C) and (c) Fructose-SiO2; (d) RDG of Fructose-SiO2. Fig 10 Scheme 1 Mechanism of glucose isomerization to fructose. Scheme 1 Scheme 2 Mechanism of fructose dehydration to 5-HMF. Scheme 2 Table 1 The effect of different proportions of MIBK and Sat.NaCl on 5-HMF yield Table 1 Entry Volume of solvent (mL) Yield (%) MIBK Sat.NaCl Organic phase Inorganic phase Total 1 0 5 0 14.33 14.33 2 1.5 3..5 32.94 18.58 51.52 3 2.5 2.5 58.01 12.22 70.23 4 3.5 1.5 65.87 6.93 72.80 5 4 1 63.51 4.74 68.25 6 5 0 3.29 0 3.29 (Conditions: 66.7 mM glucose, 5 mL of reaction solution (MIBK-Sat.NaCl), 200 °C, 2 h) Poly (ionic liquid)s-silica spheres as effective core-shell catalysts for the conversion of glucose and fructose into 5-hydroxymethylfurfural Niuniu Zhu Conceptualization Investigation Formal analysis Writing – original draft Writing – review & editing Manyu Zhang Data curation Validation Congcong Zhao Data curation Validation Guo Qiu Conceptualization Methodology Resources Writing – review & editing ⁎ Hongyu Tian Supervision Resources Beijing Key Laboratory of Flavor Chemistry, Beijing Technology and Business University, Beijing 100048, China Beijing Key Laboratory of Flavor Chemistry Beijing Technology and Business University Beijing 100048 China Beijing Key Laboratory of Flavor Chemistry, Beijing Technology and Business University, Beijing 100048, China ⁎ Corresponding author. 5-Hydroxymethylfurfural (5-HMF), as a significant, bio-derived platform chemical molecule, has been under extensive research due to its wide application in petrochemical industry. In this work, three kinds of poly (ionic liquid)s-silica spheres (PIL@SiO2) with various lengths of alkyl chains as effective core-shell catalysts were prepared by the polymerization and coating methods, and were used to prepare 5-HMF from glucose and fructose with optimal results. When the alkyl carbon number of PIL monomer was 18, PIL@SiO2-18 displayed good catalytic activity in 5-HMF production, resulting in the highest yields of 77.36% and 72.8% from glucose and fructose in methyl isobutyl ketone (MIBK)/ saturated solution of sodium chloride (Sat.NaCl) biphasic solvent. A possible reaction mechanism was proposed that the core-shell synergistic catalysis effectively promoted the preparation of 5-HMF from monosaccharide, in which Lewis acidic polycationic centers contributed to driving the isomerization process. The promising approach provides an efficient strategy for silica-based core-shell synergistic catalysts in the synthesis of 5-HMF from carbohydrates. Graphical abstract Image, graphical abstract Keywords 5-Hydroxymethylfurfural Glucose Fructose Core-shell Poly (ionic liquid)s-Silica Spheres Data availability The data that has been used is confidential. 1 Introduction With the gradual reduction of fossil energy and the degradation of natural environment, studying the development and utilization of biomass energy has become one of the main trends of renewable energy due to the characteristics of low-cost and pollution-free [1–3]. Biomass can serve as a kind of potential and alternative energy sources, which have twice as much energy storage as the total energy consumption in the world [4,5]. Carbohydrates, possessing relatively stable biochemical properties, are regarded as one of the most important raw materials for green organic chemistry. In recent years, the synthesis of platform compounds from the chemical conversion of carbohydrates feedstocks have been investigated worldwide [6], and furan-based chemicals can be obtained through the hydrolysis and dehydration of sugars [7]. 5-Hydroxymethylfurfural (5-HMF) can be considered to be one of the most significant platform chemicals with great potential and wide application, and the special chemical structure of 5-HMF, including furan ring, hydroxyl group and aldehyde group, which could be converted to generate a wide variety of secondary chemicals. In this case, 5-HMF has received much focus as a versatile platform material applied in the field of functional polyester, pharmaceutical intermediates and renewable polymeric materials [8–11]. With the consideration of the high efficiency in 5-HMF synthesis, hexoses have been regarded as the preferred substrate for converting carbohydrates into value-added chemicals. Among hexoses, fructose could be more prone to dehydration with the highest reactivity and 5-HMF selectivity, due to its furan structure easily converted to the target product 5-HMF [12,13]. Relatively speaking, there are certain difficulties for glucose converting to 5-HMF, and the initial ring-opening process become tough as a result of its stable pyran ring structure [12,14]. Despite all this, glucose is considered as one of the most promising substrate for 5-HMF production because of its wide materials supply and low cost [15]. Therefore, much effort has been devoted to transforming fructose and glucose into 5-HMF. It is well known that the synergistic effect of Brønsted acid and Lewis acid can effectively promote the dehydration of monosaccharide to produce 5-HMF, while most of the now available catalysts rely on the supported metal to provide Lewis acid. For example, Chen et al. found the supported metal Cr(III) on PCP(Cr)-SO3H catalyst as Lewis acid sites gave a 80.7% 5-HMF yield from glucose in 180 °C for 4 h [16]. A 62% glucose conversion and 62.1% 5-HMF selectivity were reported with a [Sn, Al]-Beta catalyst, the catalytic effect of which is much higher than H-Al-Beta [17]. Based on the research of Polshettiwar et al [18], Al-KCC-1 catalyst was prepared through metal aluminum loading on KCC-1, and 5-HMF yields of 92.9% and 39% were successfully obtained with fructose and glucose as substrate, respectively [19]. However, there are still plenty of shortcomings in the catalytic reaction with metal supported catalysts, such as eco-friendly defects, toxicity in soil, and high cost, which is not conducive to the large-scale application. Ionic liquids can not only be used as solvent but also catalyst in organic reactions due to wide liquid temperature range, good stability, non-volatility, friendly-environment, non-flammability non-toxicity and strong conductivity [20–22]. Therefore, it has also been widely concerned and gradually used for the hydrolysis of carbohydrates to prepare 5-HMF in recent years. Qi et al. reported that using [BMIM][Cl] as solvent can greatly reduce the reaction temperature required for converting fructose to 5-HMF [23]. Hou et al. used ionic liquid [EMIM][Br] as solvent and SnPO as catalyst to achieve the realization of the synergistic catalytic effect and a high yield of 58.3% of 5-HMF from glucose [24]. Moreover, Qu et al. reported that [AEMIM]BF4 showed a high catalytic activity and selectivity for the hydrolysis of sucrose [25]. Ionic liquid combined with heterogeneous support can provide a new model for designing active catalyst, and it has been widely concerned by researchers and some achievements have been made. Saxena et al. proposed a ionic liquid-encapsulated zeolite catalysts in 2017, and they found that the yield and selectivity were higher with the composite catalyst as compared to blank control groups involving zeolite support counterpart or ILs [26]. Therefore, the composite materials integrating ILs with heterogeneous catalyst can provide new approach to design an efficient system for organic synthesis. Based on all of above, three kinds of poly (ionic liquid)s-silica spheres (PIL@SiO2) with various lengths of alkyl chains as novel and effective spherical core-shell catalysts were prepared and used for 5-HMF synthesis from monosaccharide in MIBK-Sat.NaCl biphasic solvent. Considering the space effect and interface adhesion [27], three kinds of alkyl chains with different carbon chain length (tetradecyl, hexadecyl and octadecyl) were first introduced into vinyl imidazole to enable the substrate glucose to be more easily adsorbed on the polycationic imidazole ring. Through the protection of the silica shell, poly (ionic liquid)s with high catalytic activity can maintain good stability at higher temperature. Correspondingly, poly (ionic liquid)s with long alkyl chains in the core have helped support for the acidic silica shell in order to maintain the stability. The silica hydroxyl of the shell and the polycationic species in the core could provide Brønsted and Lewis acid sites required for the reaction, respectively [28]. The core-shell synergistic catalysis in the preparation of 5-HMF from monosaccharide can be realized. The optimal reaction conditions and the reaction mechanism of 5-HMF synthesis in PIL@SiO2 catalytic system were further discussed. These findings offer a feasibility of further designing a novel and effective core-shell catalytic system for 5-HMF synthesis. 2 Experimental section 2.1 Materials D-glucose (99%), D-fructose (99%), 4-methyl-2-pentanone (≥99.5%), methanol (≥99.9%), ethyl ether (AR), ethanol (99.5%), sodium chloride (≥99.5%), ammonium hydroxide solution (AR, 25%-28%), 2, 2’-azobis (2-methyl-N-(2-hydroxyethyl)propionamide) (98%) and 1-vinylimidazole (99%) were gained from HWRK Chem co., Ltd (Beijing, China). Cetyltrime-thylammonium bromide (CTAB, 99%), 1-bromooctadecane (99%), tetraethoxysilane (99%) and 1,4-dibromobutane (99%) were acquired from Damas-beta (Shanghai, China), and 1-bromotetradecane (97%) and 1-bromohexadecane (97%) were supplied by 9 Ding Chemistry Technology Co., Ltd (Shanghai, China). Each chemical was used as received. 2.2 Catalysts preparation Synthesis of 3-n-alkyl-1-vinylimidzaolium bromide (ILM-CnBr, n=14, 16, 18): Initially, 0.1 mol of n-alkyl bromide, 0.1 mol of 1-vinyl imidazole and 30 mL of methanol were added into a 100 mL round bottom flask with 15 h of vigorous stirring at 60 °C. After quenching, the reaction mixture was dropped into 1 L of anhydrous ether and a large amount of white sedimentation was generated. Finally, filter out the white sedimentation and dry it to constant weight at 40 °C. Synthesis of 1, 4-butanediyl-3, 3′-bis-l-vinylimidazoliurn dibromide (BVDB): 0.1 mol of 1,4-dibromobutane, 0.2 mol of 1-vinyl imidazole and 30 mL of methanol were added into a 100 mL round bottom flask with 15 h of vigorous stirring at 60 °C. After quenching, the reaction mixture was dropped into 1 L of anhydrous ether and a large amount of white sedimentation was generated. Finally, filter out the white sedimentation and dry it to constant weight at 40 °C. Synthesis of poly (ionic liquid)s (PIL) nanospheres: Firstly, a certain amount of ILM-CnBr monomer, initiator, BVDB crosslinking agent, and water were charged into a 250 mL reactor. Then, the mixture was vacuumized by a water pump and continuously stirred in the oil bath with the constant temperature of 70 °C for 24 h, while nitrogen was continuously injected. Finally, the formed dispersion was quenched to room temperature. The sample were marked as PIL-14, PIL-16 and PIL-18. Synthesis of PIL@SiO2 spheres: Firstly, 15 mL of PIL dispersion was added to a mixture solvent of H2O and ethanol, containing 1.5 g of CTAB and NH3•H2O (0.5 mL, 28 wt%). Then, the mixture was located in an oil bath at 38 °C after 15 min of ultrasonic treatment. Furthermore, 0.2 mL of tetraethyl orthosilicate was measured into the reactor with 24 h of vigorous stirring at 38 °C. Through centrifugation separation, the white precipitate was washed three times with ethanol, prior to drying at 80 °C overnight. Based on the carbon chain length of alkyl group, the sample were marked as PIL@SiO2-14, PIL@SiO2-16 and PIL@SiO2-18. The synthesis route for each step was shown in Fig. S1. In addition, the synthetic method of metal-loaded PIL@SiO2 spheres was described in Supporting information. 2.3 Catalysts characterization Fourier transform infrared (FTIR, iS 10, Nicolet) spectroscope with the wave number range from 400 to 4000 cm−1 was used to characterize the structure and chemical bonding state of PIL@SiO2 catalysts. X-ray diffractometer (XRD, smartlab, Japan) was used to analyze the crystallinity of PIL@SiO2 and the diffraction pattern was collected in the 2θ range of 5-90° with a copper target and the scanning speed of 5 °/min. X-ray photoelectron spectroscopy (XPS, PHI5000 Versaprobe III, Japan) was used to analyze the surface elements and chemical states. The surface acidic properties (Brønsted/ Lewis acidic sites) were determined by pyridine infrared spectroscopy (Pyridine-IR) with tensor 27 spectrometer. The morphology of PIL@SiO2 was characterized by transmission electron microscope (TEM, Fei talosf200x, US) and scanning electron microscope (SEM, JSM-7800F, Japan). The specific surface area and porosity analyzer (BET, Micromeritics ASAP 2460, US) were used to observe the specific surface area and pore size of PIL@SiO2. Nuclear magnetic resonance spectrometer (NMR, Bruker 300, German) was used for qualitative analysis of PIL monomers. The temperature-programmed desorption of NH3 (NH3-TPD, Micromeritics AutoChem II 2920, US) was used to determine the acid strength and total acid content of PIL@SiO2-18. 2.4 General procedure for converting monosaccharides to 5-HMF In a typical procedure, a certain amount of monosaccharide and PIL@SiO2 were added into a biphasic solvent system, and conduct the dehydration reaction at 190 °C for 1 h in the high-pressure reaction tube with the stirring speed of 30 rpm. After the reaction, the mixture was quenched to room temperature. Furthermore, MIBK phase and Sat.NaCl phase were filtered through 0.45-micron filter membrane and put into 5 mL centrifuge tube, respectively. Finally, methanol and ultrapure water were used to dilute MIBK phase and Sat.NaCl phase respectively. The concentration of 5-HMF was quantified by waters 2695 HPLC, equipped with an UV detector and a C18 column. 10% acetonitrile and 90% ultrapure water were utilized as the mobile phase at a flow rate of 1 mL/min. The residual monosaccharide was detected by HPLC using a HPX-87H column and a RI detector, and 5 mM sulfuric acid was selected as the mobile phase at a flow rate of 0.6 mL min−1. 3 Results and discussions 3.1 Characterization of PIL@SiO2 catalysts As shown in Fig. 1 a, the chemical structure of PIL@SiO2-14, PIL@SiO2-16 and PIL@SiO2-18 was verified by Fourier transform infrared (FTIR) spectroscopy, and there were no significant differences observed in FTIR spectra of PIL@SiO2 with different length of alkyl chain. Obviously, a band at approximately 3422 cm−1 was attributed to O-H asymmetric stretching vibration of PIL@SiO2 samples [29]. The sharp bands at 2925 and 2854 cm−1 were assigned to C-H vibration of -CH3 and -CH2, respectively [30]. A band at about 1550 cm−1 was associated to the vibration of C=N in the imidazole ring, while the band at 1467 cm−1 was related to C=C vibration [31,32]. The appearance of these above functional groups confirmed that the framework structure of poly (ionic liquid)s meets the requirements for design. The characteristic band at 1080 cm−1 was associated to the asymmetric stretching vibration of Si-O-Si and a band at 955 cm−1 corresponded to the bending vibration of Si-OH, while the bands at 800 cm−1 and 463 cm−1 were related to the symmetric stretching vibration of Si-O [33]. These characteristic bands were consistent with the framework of SiO2, indicating the generation of SiO2 shell in synthetic process. The powder XRD analysis was performed over the 2θ range of 5°-90°. As shown in Fig. 1b, there was a large peak appeared at 21.4°, indicating the formation of an amorphous phase in PIL@SiO2 samples [34]. The result of nitrogen isothermal adsorption-desorption (Table S1) indicated that the specific surface area and pore size of PIL@SiO2-18 were the largest among three catalysts. Pyridine adsorption infrared spectra was used to determine the types of acid sites. As shown in Fig. 1c, there were some characteristic absorption bands observed at the wave number of about 1440, 1490 and 1554 cm−1 in pyridine-IR spectra of PIL@SiO2-18. The band at 1440 cm−1 corresponded to Lewis acid sites, which were provided by some uncoordinated polyimidazole cations in the PIL core. The band centered at 1554 cm−1 was in accordance with Brønsted acid sites, owing to pyridine molecules protonated at the Si-OH group in the surface of SiO2 shell. Furthermore, a band at 1490 cm−1 was related to the interaction of pyridine molecules with both above acid sites [35,36]. These results demonstrated that both Brønsted and Lewis acid sites were simultaneously appeared in PIL@SiO2-18 catalysts. NH3-TPD spectra of PIL@SiO2-18 was shown in Fig. S2. It is obvious that three characteristic absorption bands were involved in the spectrum, in which the absorption peak in the range of 100-300 °C was consistent with the weak acid sites. Combined with NH3-TPD and pyridine infrared results (Table S2), the density of Brønsted acid sites and Lewis acid sites were also quantified, indicating that PIL@SiO2-18 possessed Lewis and Brønsted acidity. The 1H NMR and 13C NMR spectrum of PIL monomers (Fig. S3, Fig. S4, Fig. S5) and crosslinking agents (Fig. S6) are as follows. ILM-C14Br. 1H NMR (300 MHz, DMSO) δ: 9.52 (s, 1H), 8.21 (s, 1H), 7.94 (s, 1H), 7.30 (dd, J = 15.6, 8.8 Hz, 1H), 5.96 (dd, J = 15.6, 2.2 Hz, 1H), 5.43 (dd, J = 8.7, 2.2 Hz, 1H), 4.19 (t, J = 7.2 Hz, 2H), 1.87 – 1.76 (m, 2H), 1.24 (m, 22H), 0.85 (t, J = 6.5 Hz, 3H); 13C NMR (75 MHz, DMSO) δ: 135.28, 128.84, 123.23, 119.12, 108.53, 49.14, 31.28, 29.04, 29.01, 28.94, 28.80, 28.70, 28.38, 25.48 (s), 22.07, 13.90. ILM-C16Br. 1H NMR (300 MHz, DMSO) δ: 9.48 (s, 1H), 8.20 (s, 1H), 7.93 (s, 1H), 7.28 (dd, J = 15.6, 8.8 Hz, 1H), 5.95 (dd, J = 15.7, 2.2 Hz, 1H), 5.42 (dd, J = 8.6, 2.1 Hz, 1H), 4.18 (t, J = 7.2 Hz, 2H), 1.91 – 1.72 (m, 2H), 1.24 (m, 26H), 0.85 (t, J = 6.2 Hz, 3H); 13C NMR (75 MHz, DMSO) δ: 135.28, 128.84, 123.22, 119.14, 108.56, 49.15, 31.28, 29.09, 29.04, 28.97, 28.82, 28.70, 28.40, 25.49, 22.07, 13.88. ILM-C18Br. 1H NMR (300 MHz, DMSO) δ: 9.51 (s, 1H), 8.21 (s, 1H), 7.94 (s, 1H), 7.29 (dd, J = 15.6, 8.8 Hz, 1H), 5.96 (dd, J = 15.6, 2.3 Hz, 1H), 5.43 (dd, J = 8.7, 2.2 Hz, 1H), 4.19 (t, J = 7.2 Hz, 2H), 1.96 – 1.59 (m, 2H), 1.23 (m, 30H), 0.85 (t, J = 6.5 Hz, 3H); 13C NMR (75 MHz, DMSO) δ: 135.22, 128.73, 123.19, 119.19, 108.51, 49.08, 31.32, 29.19, 29.13, 29.07, 28.92, 28.76, 28.49, 25.54, 22.07, 13.72, 13.68. BVDB. 1H NMR (300 MHz, DMSO) δ: 9.65 (s, 2H), 8.25 (m, 2H), 7.99 (m, 2H), 7.33 (dd, J = 15.4, 8.7 Hz, 2H), 5.99 (dd, J = 15.5, 2.1 Hz, 2H), 5.44 (dd, J = 8.4, 2.0 Hz, 2H), 4.29 (m, 4H), 1.87 (m, 4H). 13C NMR (75 MHz, DMSO) δ: 135.46, 128.88, 123.25, 119.19, 108.70, 48.36, 25.71. The determination of these groups demonstrates that the structure of PIL completely conforms to the design. In order to explore the elemental chemical states of Si, O, N and C in three PIL@SiO2 samples, XPS spectra are reported in Fig. 1d and Fig. 2 . Both the Si 2p spectra (Fig. 2a) and O 1s spectra (Fig. 2b) involves only one peak, which were centered at 103.3 eV and 532.5 eV [37–39], respectively; these peaks are characteristic of silica shell. In addition, the curves on the N 1s spectra (Fig. 2c) were fitted into three peaks with binding energies of 399.19 eV, 401.3 eV and 402.5 eV, corresponding to C=N, C-N and N+ of imidazole, respectively [40–42]. Similarly, Fig. 2d shows the C1s spectra of PIL@SiO2, in which a peak located at 284.8 eV assigned to C-C and C=C, while the other peak at 286.4 eV coincided with C-N [43]. SEM images of PIL@SiO2 samples are presented in Fig. 3 . As can be seen, there were some aggregation structure of spherical particles with the average sizes of about 200∼300 nm formed in three kinds of PIL@SiO2 samples, indicating that the generation of symmetrically spherical silica structures. As can be seen in Fig. 4 , TEM images show that the morphology of PIL@SiO2-18 possessed obvious core-shell structure, in which the outer shell layer was spherical silica polymer with a size of about 200 nm, and the inner core layer was poly (ionic liquid)s chain with a size of approximately 150 nm. Furthermore, it is clear that the distribution of C, N, O, Si and Br elements in PIL@SiO2-18 samples could be respectively detected by STEM-EDS mappings, confirming the simultaneous existence of the above elements on the core-shell catalysts. 3.2 Effect of alkyl chain length on synthesis of 5-HMF from glucose and fructose Fig. 5 sums up the performance of PIL@SiO2 with different kernel alkyl chain length on 5-HMF synthesis in biphasic solvent. Above 50% yields of 5-HMF were attained using PIL@SiO2 as a catalyst, revealing that PIL@SiO2 catalytic system exhibited good promotion on the conversion of glucose and fructose, which was due to the catalysis of Lewis and Brønsted acid sites, stemming from polycationic centers and external surface Si-OH group, respectively. In this case, there were synchronous increasing trends on 5-HMF yields from fructose and glucose with increasing the number of carbon atoms on the core alkyl chain of PIL@SiO2 catalyst in the range of 14-18, conclusively demonstrating that the alkyl chain of poly (ionic liquid)s could promote the formation of 5-HMF. When the alkyl chain of polycationic centers was octadecane, 5-HMF yields obtained from the conversion of glucose and fructose reached the maximum, which were 72.8% and 77.36%, respectively. In other words, the number of carbon atoms on the alkyl chain was 18 in PIL@SiO2 catalyst, tending to form more target products on account of stronger steric effect of longer alkyl chain in the kernel space, which could create a favorable environment for the isomerization and the accommodation of more substrates [27]. In addition, the longer alkyl chain possessed stronger interfacial bonding, which can provide better stability as a support to reinforce the structure of the silica shell in PIL@SiO2 catalyst [44]. The relatively large specific surface area and pore size of PIL@SiO2-18 promote the interfacial adsorption between substrate and catalyst, which may also be one of the reasons for its better catalytic performance. Therefore, the number of carbon atoms is 18 as the optimal alkyl chain of PIL@SiO2 in the catalytic transformation of glucose and fructose under these reaction conditions, and the alkyl chain length of polycationic center has a great impact on the yield of 5-HMF. A series of controlled experiments were conducted to explore the catalytic effect of PIL-18 and SiO2 on the synthesis of 5-HMF from glucose, as shown in Table S3. It was evident that without the addition of any catalyst, the yields of 5-HMF and fructose were extremely low, with less than 20% of glucose being converted. With silicon-free PIL-18 used as a catalyst, the conversion of glucose into fructose was high, but less than 20% in the yield of 5-HMF was obtained. This is because weak Lewis acid sites provided by the cationic imidazole ring on PIL-18 promoted the isomerization process of glucose to fructose, but the absence of Si-OH on the silicon-free PIL-18 prevented the subsequent dehydration of fructose, which further confirmed that Brønsted acid sites required for the dehydration stemmed from external surface Si-OH groups. With SiO2 as a catalyst, the silyl hydroxyl group could promote the conversion of a small amount of glucose; however, the yield of 5-HMF was low due to the absence of Lewis acid sites leading to the inability of the isomerization step. The above results demonstrated the necessity of preparing composite core-shell PIL@SiO2 catalysts. When the alkyl carbon number of PIL monomer was 12, the catalytic performance of PIL@SiO2-12 was further investigated, and the result was showed in Table S3 (entry5). It is obvious that the catalytic activity of PIL@SiO2-12 was much lower than that of PIL@SiO2-18. When the alkyl chain length was further shortened with the alkyl carbon number of 8, PIL@SiO2-8 could not be synthesized, due to the inability of PIL to recrystallize during the first step of synthesis. Table S4 summarizes the effects of other reported catalysts in the preparation of 5-HMF from glucose, further demonstrating the excellent catalytic performance of PIL@SiO2-18 catalysts. In addition, there was observed that the different metals loaded on PIL@SiO2 also have influence on the catalytic activity, as shown in Table S5. It is obvious that PIL@SiO2 loaded with niobium and tin possessed preferable performance relative to other metals, which could be attributed to Lewis acidity of niobium and tin facilitating the isomerization process. With Fe as loading metal, the effect of alkyl chain length of polycationic center on synthesis of 5-HMF was further explored (Fig. S7), and the results show that PIL@SiO2 bonded with octadecyl had better catalytic activity, indicating stronger interfacial bonding would offer steric stability as a kernel support. In a word, the alkyl chain length of polycationic center played a significant role in 5-HMF synthesis, and metal-free PIL@SiO2 showed an excellent catalytic activation and stability. 3.3 Effect of reaction temperature on synthesis of 5-HMF from fructose and glucose Fig. 6 a shows the significant effect of PIL@SiO2-18 system on the catalytic activity for 5-HMF synthesis from fructose at different temperatures. Obviously, relatively low temperature resulted in a certain 5-HMF yield due to higher catalytic activity of PIL@SiO2 samples. As raising the reaction temperature, the 5-HMF yield increased significantly at the initial stage of the reaction. However, it doesn't necessarily mean that the higher the temperature, the higher the ultimate yield of 5-HMF. It is obvious that the maximum 5-HMF yield of 77.36% was gained at 190 °C in 60 min. The highest 5-HMF yield decreased once the temperature was continuously increased to 200 °C, possibly due to high temperature resulting in the occurrence of some side reactions such as the carbonization of sugar and the polymerization of products and substrates. In this case, the polymerization by-product covering the surface of PIL@SiO2-18 could weaken the catalytic activity. Therefore, in order to avoid the influence of side reactions and improve the catalytic activity of PIL@SiO2-18, the optimum temperature and reaction time for preparing 5-HMF from fructose was 190 °C for 1 h. Similarly, the different reaction temperature affected greatly the conversion of glucose in PIL@SiO2-18-catalytic system. As exposed in Fig. 6b, the initial rate of the reaction was comparatively slow with the generation of only a small amount of 5-HMF in the temperature range of 170 °C–180 °C. The increase of temperature could remarkably improve the performance of PIL@SiO2-18 system in the early stage of reaction, and the highest 5-HMF yield was 72.8% at 200 °C for 2 h. In this case, only less than 5% formic acid (FA) and levulinic acid (LA) were detected (Fig. S8), indicating that the hydration side reaction was effectively suppressed. When raising the temperature above 200 °C, the time required for reaching the highest yield could be shorten; However, the 5-HMF yield decreased rapidly with the extension of reaction time due to the side reactions. The gradual formation of some black humins could be observed when the temperature exceeded 200 °C. Thus, choosing an appropriate reaction temperature was essential for the preparation of 5-HMF from monosaccharides. 3.4 Effects of dosage of PIL@SiO2-18 on 5-HMF synthesis from fructose and glucose The effects of dosage of PIL@SiO2-18 on the preparation of 5-HMF from monosaccharides were experimented, as shown in Fig. 7 . When the dosage of PIL@SiO2-18 was in the range from 10 mg to 20 mg, the yields of 5-HMF showed increasing tendency with fructose and glucose as substrates. The highest 5-HMF yields were achieved to 77.36% and 72.8% from fructose and glucose, respectively. This was because the isomerization of glucose and dehydration of fructose can be effectively promoted with the acidic active sites provided by PIL@SiO2-18. Relatively, as the dosage was continuously increased to 50 mg, there was a decline in the yield of 5-HMF with a decrease of 11.12% from fructose and a larger drop of 18.56% from glucose. This might be due to too much content of PIL@SiO2-18 catalysts with an appearance of polymerization preventing the interaction between PIL@SiO2-18 and substrate molecules, further resulting in less substantial loss of 5-HMF yield. Therefore, 20 mg of PIL@SiO2-18 was selected as the optimum dosage of catalyst. 3.5 Effects of concentration of fructose and glucose on synthesis of 5-HMF To study the influence of substrate concentration on 5-HMF yield, a sequence of different concentrations of fructose and glucose were utilized for the dehydration reaction. As illustrated in Fig. 8 , the maximum 5-HMF yield were respectively 72.8% and 77.36% when the concentration of glucose and fructose was 66.7 mM. The 5-HMF yield decreased regardless of whether the concentration was lower or higher than 66.7 mM, indicating that too high or too low concentration of substrate was not conducive to PIL@SiO2-18-catalytic system. The reason for these results was that the probability of acidic sites on the surface of PIL@SiO2-18 contacting with sugar molecules was greatly increased in the low-concentration substrate reaction system, so as to better helping facilitate monosaccharide dehydration. In contrast, 5-HMF yield gained from fructose and glucose decreased with the increasing substrate concentration, this was mainly ascribed to that overconcentration of substrate could also lead to excessive collision between 5-HMF and sugar molecules and the occurrence of cross-linking polymerization, which was unfavorable to the reaction. 3.6 The effect of different proportions of MIBK and Sat.NaCl on 5-HMF yield The effect of different proportions of organic phase (MIBK) and inorganic phase (Sat.NaCl) on the yield of 5-HMF were studied using glucose as the substrate (Table 1 ). Obviously, the performance of PIL@SiO2-18 in the biphasic solvents was superior to the single-phase MIBK and Sat.NaCl solvents. This was because reactants and products were prone to condensation reactions in a single-phase solvent, while the biphasic solvents could effectively avoid the occurrence of side reactions. Secondly, it can be seen that in the biphasic solvents, the volume proportion of organic to inorganic phases was not linearly correlated with the yield of 5-HMF. When the volume proportion of MIBK to Sat.NaCl was 1, the yield of 5-HMF in the MIBK phase was higher than that in the Sat.NaCl phase, indicating that organic solvents possessed a better ability to accommodate 5-HMF molecules than inorganic solvents. In addition, it was evident that the optimal volume proportion of MIBK-Sat.NaCl solvent was 3.5: 1.5, and the yield of 5-HMF was as high as 72.8%. 3.7 Catalyst recyclability PIL@SiO2-18 was recycled and reused to evaluate its recyclability, and the result was shown in Fig. 9 . After the reaction, PIL@SiO2-18 catalyst was filtered and collected, then washed with deionized water for three times, and the collected sample was dried at 40 °C for 24 h. After four cycles of experiments, fructose conversion and 5-HMF yield were 91.8% and 75.93%, respectively, which were slightly lower than those in the initial reaction. This might be due to the small amount of by-product on the active site of PIL@SiO2-18, or the partial coverage of main product on the active site. Hence, PIL@SiO2-18 can be effectively separated and recycled in 5-HMF synthesis. 3.8 Mechanism of glucose and fructose conversion to 5-HMF Combined with the experimental results, the possible reaction mechanism of preparing 5-HMF from monosaccharide with PIL@SiO2 as catalyst has been speculated. It is obvious that the conversion reaction involves two major steps through the core-shell synergistic catalysis: (1) glucose isomerization to fructose and (2) fructose dehydration to 5-HMF (Fig. S9) [45]. Density functional theory (DFT) calculations were utilized for the optimization of the structure of PIL@SiO2, fructose and glucose molecules [46]. Reasonable models of PIL@SiO2 polycationic monomer, shell silica fragment, fructose and glucose were constructed in Materials Studio 7.0, and were calculated for optimizing to an appropriate cluster with the LYP correlation function (B3LYP) in Gaussian 16 [47]. The geometry optimization for C, Si, H, O and N atoms was conducted through the basis set of 6-31G (d). Electrostatic potential calculation in Glucose-PIL (1C) indicates that the presence of adsorption between glucose molecule and polycationic imidazole species acting as Lewis acid centers (Fig. 10 a). When polycationic monomer was bonded with octadecyl, it can be seen that the existence of the attraction with stronger interfacial bonding offering steric stability (Fig. 10b). SiO2 shell can promote the dehydration of fructose molecule to a certain extent, this is mainly ascribed to that silicon hydroxyl groups on the surface has strong adsorption with fructose molecule through stronger hydrogen bonding and weaker van der Waals forces (Fig. 10c and d). There is a relative balance in the surface electrostatic potential of the optimized adsorption sites between PIL@SiO2 and polyhydroxy carbohydrate molecule, thus promoting the adsorption of substrate molecules and the dehydration of fructose molecule. Indeed, the first step can be achieved through Lewis acid catalyzed intramolecular hydrogen transfer (Scheme 1 ) [48]. Initially, the anion-cation coordination effect on the surface of PIL polymer cation chain inside PIL@SiO2 catalyst plays a central role in the isomerization process. A portion of polyimidazole cation coordinate with hydroxyl ion in the solution, while other uncoordinated polycation centers could provide weak Lewis acid sites [28]. The active hydrogen on the imidazole ring with weak Lewis acidity first coordinates with the electronegative O1 on glucose, leading to a proton from O1H on glucose molecule transferring to OH− adsorbed on the imidazole ring (1-2-3-4). Next, the imidazole ring H proton obtained from the O1 site transfers to the pyranose O5 site, leading to the O5 protonation and further ring opening, and forming the aldehyde group at the O1 site (4-5-6). After that, the hydrogen proton at the O2 site is transferred to the OH− anion adsorbed on the imidazole ring and the active hydrogen on the imidazole ring changes from coordination with O1 to coordination with O2, resulting in the deprotonation of O2H and the regeneration of hydroxyl groups on the imidazole ring (6-7-8). The next molecular endoplasm transfer from C2 to C1 involves the generation of a five member chelate structure, leading to the transformation from the aldehyde O1 to the carbonyl O2 and the aldose ketose isomerization (8-9-10), which is combine with the formation of the open chain form of O1 deprotonated fructose bound to the active hydrogen site on the imidazole ring. Subsequently, the transmission of hydrogen protons from the O5 site to the O2 site promoted the closed-loop process and produced O1 deprotonated cyclic fructose (10-11-12). The proton transfer from OH on the imidazole ring to the terminal O1 site leads to the formation of the isomerized product furan fructose, and restored the original structure of the internal PIL (12-13-14), completing the catalytic cycle of glucose isomerization to fructose. From an experimental perspective, the presence of fructose can be detected at the initial stage of the reaction, when PIL@SiO2-18 was used as a catalyst (Fig. S10). These results are a further proof that the step of glucose isomerization to fructose is feasible. As the second step (Scheme 2 ), the three-step dehydration of fructose to 5-HMF is mainly achieved due to the catalysis of Brønsted acid [49]. In the synthesis of PIL@SiO2, terminal hydroxyl groups were formed at the edge of the outer SiO2 from some adsorbed water molecules, and the Brønsted acidic Si-OH attacks the C2-OH bond of fructose to form the first water molecule under the action of hydrogen bond, which generates aldehyde groups on the branch chain (1-2-3-4). Eventually, C3-OH bond and C4-OH bond are also striked by hydrogen proton of Si-OH, leading to the formation of furan ring and two water molecules, along with the acquisition of 5-HMF and the restoration of the outer layer structure of SiO2 (4-5-6). 4 Conclusions Three kinds of novel poly (ionic liquid)s-silica spherical core-shell catalysts with good catalytic effect were successfully prepared in the conversion of glucose and fructose. The highest 5-HMF yield of 72.8% was obtained in MIBK-Sat.NaCl biphasic solvent with 66.7 mM of glucose and 20 mg of PIL@SiO2-18 at 200 °C for 2 h. With the excellent catalytic performance of PIL@SiO2-18, 5-HMF yield from fructose could reach 77.36% at 190 °C for 1 h. In addition, the reaction mechanism for glucose converting to 5-HMF under the core-shell synergetic catalysis of PIL@SiO2 was proposed, in which Lewis acidic facilitated the isomerization of glucose with the silicon hydroxyl groups acting as Brønsted acid sites necessary for the dehydration process. The alkyl chains of polycationic center exerted a steric effect and strong support to ensure the catalytic adsorption and stability of PIL@SiO2. This study offers a new and promising way to produce 5-HMF from carbohydrates through the core-shell synergetic catalysis. CRediT authorship contribution statement Niuniu Zhu: Conceptualization, Investigation, Formal analysis, Writing – original draft, Writing – review & editing. Manyu Zhang: Data curation, Validation. Congcong Zhao: Data curation, Validation. Guo Qiu: Conceptualization, Methodology, Resources, Writing – review & editing. Hongyu Tian: Supervision, Resources. Declaration of Competing Interest The authors declare that they have no known competing financial interests or personal relationships that could have appeared to influence the work reported in this paper. Acknowledgments This work was supported by the R&D Program of Beijing Municipal Education Commission (KM202210011010), the Research Foundation for Youth Scholars of Beijing Technology and Business University under grant number QNJJ2021-10, and 2022 BTBU Graduate Student Research Ability Enhancement Fund (19008022056). Supplementary materials Supplementary material associated with this article can be found, in the online version, at doi:10.1016/j.mcat.2023.113244. Appendix Supplementary materials Image, application 1 References [1] X. Chen S. Song H. Li Expanding the boundary of biorefinery: organonitrogen chemicals from biomass Acc. Chem. Res. 54 2021 1711 1722 10.1021/acs.accounts.0c00842 X. Chen, S. Song, H. Li, et al., Expanding the boundary of biorefinery: organonitrogen chemicals from biomass, Acc. Chem. Res.. 54 (2021) 1711-1722, 10.1021/acs.accounts.0c00842. [2] J. Esteban A.J. Vorholt W. Leitner An overview of the biphasic dehydration of sugars to 5-hydroxymethylfurfural and furfural: a rational selection of solvents using COSMO-RS and selection guides Green Chem. 22 2020 2097 2128 10.1039/c9gc04208c J. Esteban, A.J. Vorholt, W. Leitner, An overview of the biphasic dehydration of sugars to 5-hydroxymethylfurfural and furfural: a rational selection of solvents using COSMO-RS and selection guides, Green Chem.. 22 (2020) 2097-2128, 10.1039/c9gc04208c. [3] B. Srinivasa Rao D. Dhana Lakshmi P. Krishna Kumari Dehydrative etherification of carbohydrates to 5-ethoxymethylfurfural over SBA-15-supported Sn-modified heteropolysilicate catalysts Sustain. Energy Fuels 4 2020 3428 3437 10.1039/d0se00509f B. Srinivasa Rao, D. Dhana Lakshmi, P. Krishna Kumari, et al., Dehydrative etherification of carbohydrates to 5-ethoxymethylfurfural over SBA-15-supported Sn-modified heteropolysilicate catalysts, Sustain. Energy Fuels. 4 (2020) 3428-3437, 10.1039/d0se00509f. [4] Y.N. Yan Q.B. Wu X. Guo Condition screening and process investigation of aldose transformation in borate-containing acidic phosphate buffer system under microwave irradiation RSC Adv. 4 2014 39453 39462 10.1039/c4ra02612h Y.N. Yan, Q.B. Wu, X. Guo, et al., Condition screening and process investigation of aldose transformation in borate-containing acidic phosphate buffer system under microwave irradiation, RSC Adv.. 4 (2014) 39453-39462, 10.1039/c4ra02612h. [5] M. Aghbashlo, M. Mandegari, M. Tabatabaei, et al., Exergy analysis of a lignocellulosic-based biorefinery annexed to a sugarcane mill for simultaneous lactic acid and electricity production, Energy. 149 (2018) 623-638, 10.1016/j.energy.2018.02.063. [6] Y. Wang S. Furukawa S. Song Catalytic production of alanine from waste glycerol Angew. Chem. Int. Ed Engl. 59 2020 2289 2293 10.1002/anie.201912580 Y. Wang, S. Furukawa, S. Song, et al., Catalytic production of alanine from waste glycerol, Angew. Chem. Int. Ed Engl.. 59 (2020) 2289-2293, 10.1002/anie.201912580. [7] Y. Sun P. Liu Z. Liu Catalytic conversion of carbohydrates to 5-hydroxymethylfurfural from the waste liquid of acid hydrolysis NCC Carbohydr. Polym. 142 2016 177 182 10.1016/j.carbpol.2016.01.053 Y. Sun, P. Liu, Z. Liu, Catalytic conversion of carbohydrates to 5-hydroxymethylfurfural from the waste liquid of acid hydrolysis NCC, Carbohydr. Polym.. 142 (2016) 177-182, 10.1016/j.carbpol.2016.01.053. [8] S.P. Teong G. Yi Y. Zhang Hydroxymethylfurfural production from bioresources: past, present and future Green Chem. 16 2014 10.1039/c3gc42018c S.P. Teong, G. Yi, Y. Zhang, Hydroxymethylfurfural production from bioresources: past, present and future, Green Chem.. 16 (2014), 10.1039/c3gc42018c. [9] I.K.M. Yu D.C.W. Tsang Conversion of biomass to hydroxymethylfurfural: a review of catalytic systems and underlying mechanisms Bioresour. Technol. 238 2017 716 732 10.1016/j.biortech.2017.04.026 I.K.M. Yu, D.C.W. Tsang, Conversion of biomass to hydroxymethylfurfural: a review of catalytic systems and underlying mechanisms, Bioresour. Technol. 238 (2017) 716-732, 10.1016/j.biortech.2017.04.026. [10] S. Kunnikuruvan N.N. Nair Mechanistic Insights into the brønsted acid-catalyzed dehydration of β-d-glucose to 5-hydroxymethylfurfural under ambient and subcritical conditions ACS Catal. 9 2019 7250 7263 10.1021/acscatal.9b00678 S. Kunnikuruvan, N.N. Nair, Mechanistic Insights into the brønsted acid-catalyzed dehydration of β-d-glucose to 5-hydroxymethylfurfural under ambient and subcritical conditions, ACS Catal. 9 (2019) 7250-7263, 10.1021/acscatal.9b00678. [11] Q.S. Kong X.L. Li H.J. Xu Conversion of 5-hydroxymethylfurfural to chemicals: a review of catalytic routes and product applications Fuel Process. Technol. 209 2020 106528 10.1016/j.fuproc.2020.106528 Q.S. Kong, X.L. Li, H.J. Xu, et al., Conversion of 5-hydroxymethylfurfural to chemicals: a review of catalytic routes and product applications, Fuel Process. Technol. 209 (2020) 106528, 10.1016/j.fuproc.2020.106528. [12] L.X. Zhang G.Y. Xi Z. Chen Enhanced formation of 5-HMF from glucose using a highly selective and stable SAPO-34 catalyst Chem. Eng. J. 307 2017 877 883 10.1016/j.cej.2016.09.003 L.X. Zhang, G.Y. Xi, Z. Chen, et al., Enhanced formation of 5-HMF from glucose using a highly selective and stable SAPO-34 catalyst, Chem. Eng. J. 307 (2017) 877-883, 10.1016/j.cej.2016.09.003. [13] R. Karinen K. Vilonen M. Niemela Biorefining: heterogeneously catalyzed reactions of carbohydrates for the production of furfural and hydroxymethylfurfural ChemSusChem 4 2011 1002 1016 10.1002/cssc.201000375 R. Karinen, K. Vilonen, M. Niemela, Biorefining: heterogeneously catalyzed reactions of carbohydrates for the production of furfural and hydroxymethylfurfural, ChemSusChem 4 (2011) 1002-1016, 10.1002/cssc.201000375. [14] J.J. Wang J.W. Ren X.H. Liu Direct conversion of carbohydrates to 5-hydroxymethylfurfural using Sn-Mont catalyst Green Chem. 14 2012 2506 2512 10.1039/c2gc35699f J.J. Wang, J.W. Ren, X.H. Liu, et al., Direct conversion of carbohydrates to 5-hydroxymethylfurfural using Sn-Mont catalyst, Green Chem.. 14 (2012) 2506-2512, 10.1039/c2gc35699f. [15] C. García-Sancho I. Fúnez-Núñez R. Moreno-Tost Beneficial effects of calcium chloride on glucose dehydration to 5-hydroxymethylfurfural in the presence of alumina as catalyst Appl. Catal. B Environ. 206 2017 617 625 10.1016/j.apcatb.2017.01.065 C. García-Sancho, I. Fúnez-Núñez, R. Moreno-Tost, et al., Beneficial effects of calcium chloride on glucose dehydration to 5-hydroxymethylfurfural in the presence of alumina as catalyst, Appl. Catal. B Environ. 206 (2017) 617-625, 10.1016/j.apcatb.2017.01.065. [16] D. Chen F. Liang D. Feng An efficient route from reproducible glucose to 5-hydroxymethylfurfural catalyzed by porous coordination polymer heterogeneous catalysts Chem. Eng. J. 300 2016 177 184 10.1016/j.cej.2016.04.039 D. Chen, F. Liang, D. Feng, et al., An efficient route from reproducible glucose to 5-hydroxymethylfurfural catalyzed by porous coordination polymer heterogeneous catalysts, Chem. Eng. J.. 300 (2016) 177-184, 10.1016/j.cej.2016.04.039. [17] L. Li J. Ding J.G. Jiang One-pot synthesis of 5-hydroxymethylfurfural from glucose using bifunctional [Sn,Al]-beta catalysts Chin. J. Catal. 36 2015 820 828 10.1016/s1872-2067(14)60287-4 L. Li, J. Ding, J.G. Jiang, et al., One-pot synthesis of 5-hydroxymethylfurfural from glucose using bifunctional [Sn,Al]-beta catalysts, Chin. J. Catal. 36 (2015) 820-828, 10.1016/s1872-2067(14)60287-4. [18] V. Polshettiwar D. Cha X. Zhang High-surface-area silica nanospheres (KCC-1) with a fibrous morphology Angew. Chem. Int. Ed Engl. 49 2010 9652 9656 10.1002/anie.201003451 V. Polshettiwar, D. Cha, X. Zhang, et al., High-surface-area silica nanospheres (KCC-1) with a fibrous morphology, Angew. Chem. Int. Ed Engl.. 49 (2010) 9652-9656, 10.1002/anie.201003451. [19] F. Shahangi A. Najafi Chermahini M. Saraji Dehydration of fructose and glucose to 5-hydroxymethylfurfural over Al-KCC-1 silica J. Energy Chem. 27 2018 769 780 10.1016/j.jechem.2017.06.004 F. Shahangi, A. Najafi Chermahini, M. Saraji, Dehydration of fructose and glucose to 5-hydroxymethylfurfural over Al-KCC-1 silica, J. Energy Chem. 27 (2018) 769-780, 10.1016/j.jechem.2017.06.004. [20] L.T. Mika E. Csefalvay A. Nemeth Catalytic conversion of carbohydrates to initial platform chemicals: chemistry and sustainability Chem. Rev. 118 2018 505 613 10.1021/acs.chemrev.7b00395 L.T. Mika, E. Csefalvay, A. Nemeth, Catalytic conversion of carbohydrates to initial platform chemicals: chemistry and sustainability, Chem. Rev.. 118 (2018) 505-613, 10.1021/acs.chemrev.7b00395. [21] Y. Yin, C.H. Ma, W. Li, et al., Rapid conversion of glucose to 5-hydroxymethylfurfural using a MoCl3 catalyst in an ionic liquid with microwave irradiation, Ind. Crop. Prod.. 160 (2021) 113091, 10.1016/j.indcrop.2020.113091. [22] L. Yang X.P. Yan S.Q. Xu One-pot synthesis of 5-hydroxymethylfurfural from carbohydrates using an inexpensive FePO4 catalyst RSC Adv. 5 2015 19900 19906 10.1039/c4ra16145a L. Yang, X.P. Yan, S.Q. Xu, et al., One-pot synthesis of 5-hydroxymethylfurfural from carbohydrates using an inexpensive FePO4 catalyst, RSC Adv.. 5 (2015) 19900-19906, 10.1039/c4ra16145a. [23] X. Qi H. Guo L. Li Efficient conversion of fructose to 5-hydroxymethylfurfural catalyzed by sulfated zirconia in ionic liquids Ind. Eng. Chem. Res. 50 2011 7985 7989 10.1021/ie200488k X. Qi, H. Guo, L. Li, Efficient conversion of fructose to 5-hydroxymethylfurfural catalyzed by sulfated zirconia in ionic liquids, Ind. Eng. Chem. Res.. 50 (2011) 7985-7989, 10.1021/ie200488k. [24] Q. Hou M. Zhen L. Liu Tin phosphate as a heterogeneous catalyst for efficient dehydration of glucose into 5-hydroxymethylfurfural in ionic liquid Appl. Catal. B Environ. 224 2018 183 193 10.1016/j.apcatb.2017.09.049 Q. Hou, M. Zhen, L. Liu, et al., Tin phosphate as a heterogeneous catalyst for efficient dehydration of glucose into 5-hydroxymethylfurfural in ionic liquid, Appl. Catal. B Environ.. 224 (2018) 183-193, 10.1016/j.apcatb.2017.09.049. [25] Y. Qu L. Li Q. Wei One-pot conversion of disaccharide into 5-hydroxymethylfurfural catalyzed by imidazole ionic liquid Sci. Rep. 6 2016 26067 10.1038/srep26067 Y. Qu, L. Li, Q. Wei, et al., One-pot conversion of disaccharide into 5-hydroxymethylfurfural catalyzed by imidazole ionic liquid, Sci. Rep.. 6 (2016) 26067, 10.1038/srep26067. [26] P. Saxena B. Velaga N.R. Peela Ionic liquid-encapsulated zeolite catalysts for the conversion of glucose to 5-hydroxymethylfurfural Chem. Select 2 2017 10379 10386 10.1002/slct.201701955 P. Saxena, B. Velaga, N.R. Peela, Ionic liquid-encapsulated zeolite catalysts for the conversion of glucose to 5-hydroxymethylfurfural, Chem. Select. 2 (2017) 10379-10386, 10.1002/slct.201701955. [27] S. Matsubara T. Okamura K. Asano Effects of a flexible alkyl chain on an imidazole ligand for copper-catalyzed mannich reactions of terminal alkynes Synlett 2010 3053 3056 10.1055/s-0030-1259069 S. Matsubara, T. Okamura, K. Asano, Effects of a flexible alkyl chain on an imidazole ligand for copper-catalyzed mannich reactions of terminal alkynes, Synlett 2010 (2010) 3053-3056, 10.1055/s-0030-1259069. [28] X. Wang Y. Song C. Huang Lactic acid production from glucose over polymer catalysts in aqueous alkaline solution under mild conditions Green Chem. 16 2014 4234 4240 10.1039/c4gc00811a X. Wang, Y. Song, C. Huang, et al., Lactic acid production from glucose over polymer catalysts in aqueous alkaline solution under mild conditions, Green Chem. 16 (2014) 4234-4240, 10.1039/c4gc00811a. [29] A. Bhattacherjee S. Wategaonkar Conformational preferences of monohydrated clusters of imidazole derivatives revisited Phys. Chem. Chem. Phys. 17 2015 20080 20092 10.1039/c5cp02422f A. Bhattacherjee, S. Wategaonkar, Conformational preferences of monohydrated clusters of imidazole derivatives revisited, Phys. Chem. Chem. Phys.. 17 (2015) 20080-20092, 10.1039/c5cp02422f. [30] Y. Zhuang Z. Ren L. Jiang Raman and FTIR spectroscopic studies on two hydroxylated tung oils (HTO) bearing conjugated double bonds Spectrochim. Acta A Mol. Biomol. Spectrosc. 199 2018 146 152 10.1016/j.saa.2018.03.020 Y. Zhuang, Z. Ren, L. Jiang, et al., Raman and FTIR spectroscopic studies on two hydroxylated tung oils (HTO) bearing conjugated double bonds, Spectrochim. Acta A Mol. Biomol. Spectrosc.. 199 (2018) 146-152, 10.1016/j.saa.2018.03.020. [31] M.A. Karimi Zarchi K. Behboodi B.F. Mirjalili Synthesis and characterization of a new polymeric catalyst and used for the synthesis of imidazole derivatives Res. Chem. Intermediat. 47 2021 4929 4942 10.1007/s11164-021-04577-6 M.A. Karimi Zarchi, K. Behboodi, B.F. Mirjalili, Synthesis and characterization of a new polymeric catalyst and used for the synthesis of imidazole derivatives, Res. Chem. Intermediat. 47 (2021) 4929-4942, 10.1007/s11164-021-04577-6. [32] Y. Long Y. Liu Z. Zhao Distinctive morphology effects of porous-spherical/yolk-shell/hollow Pd-nitrogen-doped-carbon spheres catalyst for catalytic reduction of 4-nitrophenol J. Colloid Interface Sci. 496 2017 465 473 10.1016/j.jcis.2017.02.051 Y. Long, Y. Liu, Z. Zhao, et al., Distinctive morphology effects of porous-spherical/yolk-shell/hollow Pd-nitrogen-doped-carbon spheres catalyst for catalytic reduction of 4-nitrophenol, J. Colloid Interface Sci.. 496 (2017) 465-473, 10.1016/j.jcis.2017.02.051. [33] B. Ramezanzadeh Z. Haeri M. Ramezanzadeh A facile route of making silica nanoparticles-covered graphene oxide nanohybrids (SiO2-GO); fabrication of SiO2-GO/epoxy composite coating with superior barrier and corrosion protection performance Chem. Eng. J. 303 2016 511 528 10.1016/j.cej.2016.06.028 B. Ramezanzadeh, Z. Haeri, M. Ramezanzadeh, A facile route of making silica nanoparticles-covered graphene oxide nanohybrids (SiO2-GO); fabrication of SiO2-GO/epoxy composite coating with superior barrier and corrosion protection performance, Chem. Eng. J. 303 (2016) 511-528, 10.1016/j.cej.2016.06.028. [34] S. Music N. Filipovic-Vincekovic L. Sekovanic Precipitation of amorphous SiO2 particles and their properties Braz. J. Chem. Eng. 28 2011 89 94 10.1590/s0104-66322011000100011 S. Music, N. Filipovic-Vincekovic, L. Sekovanic, Precipitation of amorphous SiO2 particles and their properties, Braz. J. Chem. Eng. 28 (2011) 89-94, 10.1590/s0104-66322011000100011. [35] Z. Chen J. Huang Q. Mu Modification of pillared MFI zeolite nanosheets by nitridation with tailored activity in benzylation of mesitylene and benzyl alcohol Chin. J. Chem. Eng. 27 2019 1981 1987 10.1016/j.cjche.2019.03.027 Z. Chen, J. Huang, Q. Mu, et al., Modification of pillared MFI zeolite nanosheets by nitridation with tailored activity in benzylation of mesitylene and benzyl alcohol, Chin. J. Chem. Eng.. 27 (2019) 1981-1987, 10.1016/j.cjche.2019.03.027. [36] C. Yan, S. Zheng, N. Chen, et al., Sulfated zirconia catalysts supported on mesoporous Mg-SBA-15 with different morphologies for highly efficient conversion of fructose to 5-hydroxymethylfurfural, Microporous Mesoporous Mater. 328 (2021), 10.1016/j.micromeso.2021.111507. [37] B. Philippe R. Dedryvère J. Allouche Nanosilicon electrodes for lithium-ion batteries: interfacial mechanisms studied by hard and soft X-ray photoelectron spectroscopy Chem. Mater. 24 2012 1107 1115 10.1021/cm2034195 B. Philippe, R. Dedryvère, J. Allouche, et al., Nanosilicon electrodes for lithium-ion batteries: interfacial mechanisms studied by hard and soft X-ray photoelectron spectroscopy, Chem. Mater.. 24 (2012) 1107-1115, 10.1021/cm2034195. [38] S. Wu X. Tan J. Lei Ga-doped and Pt-loaded porous TiO2-SiO2 for photocatalytic nonoxidative coupling of methane J. Am. Chem. Soc. 141 2019 6592 6600 10.1021/jacs.8b13858 S. Wu, X. Tan, J. Lei, et al., Ga-doped and Pt-loaded porous TiO2-SiO2 for photocatalytic nonoxidative coupling of methane, J. Am. Chem. Soc.. 141 (2019) 6592-6600, 10.1021/jacs.8b13858. [39] Q. Zhu L. Yin K. Ji Effect of catalyst structure and acid–base property on the multiproduct upgrade of ethanol and acetaldehyde to C4 (butadiene and butanol) over the Y–SiO2 catalysts ACS Sustain. Chem. Eng. 8 2019 1555 1565 10.1021/acssuschemeng.9b06199 Q. Zhu, L. Yin, K. Ji, et al., Effect of catalyst structure and acid–base property on the multiproduct upgrade of ethanol and acetaldehyde to C4 (butadiene and butanol) over the Y–SiO2 catalysts, ACS Sustain. Chem. Eng.. 8 (2019) 1555-1565, 10.1021/acssuschemeng.9b06199. [40] H. He X. Meng Q. Yue Thiol-ene click chemistry synthesis of a novel magnetic mesoporous silica/chitosan composite for selective Hg(II) capture and high catalytic activity of spent Hg(II) adsorbent Chem. Eng. J. 405 2021 10.1016/j.cej.2020.126743 H. He, X. Meng, Q. Yue, et al., Thiol-ene click chemistry synthesis of a novel magnetic mesoporous silica/chitosan composite for selective Hg(II) capture and high catalytic activity of spent Hg(II) adsorbent, Chem. Eng. J.. 405 (2021), 10.1016/j.cej.2020.126743. [41] Y.-J. Xu J. Wang Y. Tan A novel and feasible approach for one-pack flame-retardant epoxy resin with long pot life and fast curing Chem. Eng. J. 337 2018 30 39 10.1016/j.cej.2017.12.086 Y.-J. Xu, J. Wang, Y. Tan, et al., A novel and feasible approach for one-pack flame-retardant epoxy resin with long pot life and fast curing, Chem. Eng. J.. 337 (2018) 30-39, 10.1016/j.cej.2017.12.086. [42] Y. Jeon C. Lee G. Lee Thermally stable imidazole/heteropoly acid composite as a heterogeneous catalyst for m-xylene ammoxidation Res. Chem. Intermediat. 47 2021 287 302 10.1007/s11164-020-04342-1 Y. Jeon, C. Lee, G. Lee, et al., Thermally stable imidazole/heteropoly acid composite as a heterogeneous catalyst for m-xylene ammoxidation, Res. Chem. Intermediat. 47 (2021) 287-302, 10.1007/s11164-020-04342-1. [43] F. He J. Fan D. Ma The attachment of Fe3O4 nanoparticles to graphene oxide by covalent bonding Carbon 48 2010 3139 3144 10.1016/j.carbon.2010.04.052 F. He, J. Fan, D. Ma, et al., The attachment of Fe3O4 nanoparticles to graphene oxide by covalent bonding, Carbon 48 (2010) 3139-3144, 10.1016/j.carbon.2010.04.052. [44] S.M. Park D.S. Kim Effect of alkyl chain length grafted to graphene nanoplatelets on the characteristics of polypropylene nanocomposites Polym. Eng. Sci. 59 2018 752 756 10.1002/pen.24995 S.M. Park, D.S. Kim, Effect of alkyl chain length grafted to graphene nanoplatelets on the characteristics of polypropylene nanocomposites, Polym. Eng. Sci.. 59 (2018) 752-756, 10.1002/pen.24995. [45] P.H. Hoang T.D. Cuong Preparation of metal-loaded ZSM-5 zeolite catalyst and its catalytic effect on HMF production from biomass Appl. Biochem. Biotech. 2022 10.1007/s12010-022-03998-2 P.H. Hoang, T.D. Cuong, Preparation of metal-loaded ZSM-5 zeolite catalyst and its catalytic effect on HMF production from biomass, Appl. Biochem. Biotech.. (2022), 10.1007/s12010-022-03998-2. [46] K.K. Chakrahari R.P.B. Silalahi T.H. Chiu Synthesis of bimetallic copper-rich nanoclusters encapsulating a linear palladium dihydride unit Angew. Chem. Int. Ed Engl. 58 2019 4943 4947 10.1002/anie.201814264 K.K. Chakrahari, R.P.B. Silalahi, T.H. Chiu, et al., Synthesis of bimetallic copper-rich nanoclusters encapsulating a linear palladium dihydride unit, Angew. Chem. Int. Ed Engl.. 58 (2019) 4943-4947, 10.1002/anie.201814264. [47] C. Lee W. Yang R.G. Parr Development of the Colle-Salvetti correlation-energy formula into a functional of the electron density Phys. Rev. B Condens. Matter 37 1988 785 789 10.1103/physrevb.37.785 C. Lee, W. Yang, R.G. Parr, Development of the Colle-Salvetti correlation-energy formula into a functional of the electron density, Phys. Rev. B Condens. Matter. 37 (1988) 785-789, 10.1103/physrevb.37.785. [48] Y. Roman-Leshkov M. Moliner J.A. Labinger Mechanism of glucose isomerization using a solid Lewis acid catalyst in water Angew. Chem. Int. Ed Engl. 49 2010 8954 8957 10.1002/anie.201004689 Y. Roman-Leshkov, M. Moliner, J.A. Labinger, et al., Mechanism of glucose isomerization using a solid Lewis acid catalyst in water, Angew. Chem. Int. Ed Engl.. 49 (2010) 8954-8957, 10.1002/anie.201004689. [49] I. Elsayed M. Mashaly F. Eltaweel Dehydration of glucose to 5-hydroxymethylfurfural by a core-shell Fe3O4@SiO2-SO3H magnetic nanoparticle catalyst Fuel 221 2018 407 416 10.1016/j.fuel.2018.02.135 I. Elsayed, M. Mashaly, F. Eltaweel, et al., Dehydration of glucose to 5-hydroxymethylfurfural by a core-shell Fe3O4@SiO2-SO3H magnetic nanoparticle catalyst, Fuel. 221 (2018) 407-416, 10.1016/j.fuel.2018.02.135.",
      "scopus-id": "85159320215",
      "coredata": {
        "eid": "1-s2.0-S2468823123003280",
        "dc:description": "5-Hydroxymethylfurfural (5-HMF), as a significant, bio-derived platform chemical molecule, has been under extensive research due to its wide application in petrochemical industry. In this work, three kinds of poly (ionic liquid)s-silica spheres (PIL@SiO2) with various lengths of alkyl chains as effective core-shell catalysts were prepared by the polymerization and coating methods, and were used to prepare 5-HMF from glucose and fructose with optimal results. When the alkyl carbon number of PIL monomer was 18, PIL@SiO2-18 displayed good catalytic activity in 5-HMF production, resulting in the highest yields of 77.36% and 72.8% from glucose and fructose in methyl isobutyl ketone (MIBK)/ saturated solution of sodium chloride (Sat.NaCl) biphasic solvent. A possible reaction mechanism was proposed that the core-shell synergistic catalysis effectively promoted the preparation of 5-HMF from monosaccharide, in which Lewis acidic polycationic centers contributed to driving the isomerization process. The promising approach provides an efficient strategy for silica-based core-shell synergistic catalysts in the synthesis of 5-HMF from carbohydrates.",
        "openArchiveArticle": "false",
        "prism:coverDate": "2023-07-15",
        "openaccessUserLicense": null,
        "prism:aggregationType": "Journal",
        "prism:url": "https://api.elsevier.com/content/article/pii/S2468823123003280",
        "dc:creator": [
          {
            "@_fa": "true",
            "$": "Zhu, Niuniu"
          },
          {
            "@_fa": "true",
            "$": "Zhang, Manyu"
          },
          {
            "@_fa": "true",
            "$": "Zhao, Congcong"
          },
          {
            "@_fa": "true",
            "$": "Qiu, Guo"
          },
          {
            "@_fa": "true",
            "$": "Tian, Hongyu"
          }
        ],
        "link": [
          {
            "@_fa": "true",
            "@rel": "self",
            "@href": "https://api.elsevier.com/content/article/pii/S2468823123003280"
          },
          {
            "@_fa": "true",
            "@rel": "scidir",
            "@href": "https://www.sciencedirect.com/science/article/pii/S2468823123003280"
          }
        ],
        "dc:format": "application/json",
        "openaccessType": null,
        "pii": "S2468-8231(23)00328-0",
        "prism:volume": "546",
        "articleNumber": "113244",
        "prism:publisher": "Elsevier B.V.",
        "dc:title": "Poly (ionic liquid)s-silica spheres as effective core-shell catalysts for the conversion of glucose and fructose into 5-hydroxymethylfurfural",
        "prism:copyright": "© 2023 Elsevier B.V. All rights reserved.",
        "openaccess": "0",
        "prism:issn": "24688231",
        "dcterms:subject": [
          {
            "@_fa": "true",
            "$": "5-Hydroxymethylfurfural"
          },
          {
            "@_fa": "true",
            "$": "Glucose"
          },
          {
            "@_fa": "true",
            "$": "Fructose"
          },
          {
            "@_fa": "true",
            "$": "Core-shell"
          },
          {
            "@_fa": "true",
            "$": "Poly (ionic liquid)s-Silica Spheres"
          }
        ],
        "openaccessArticle": "false",
        "prism:publicationName": "Molecular Catalysis",
        "openaccessSponsorType": null,
        "prism:pageRange": "113244",
        "pubType": "fla",
        "prism:coverDisplayDate": "15 July 2023",
        "prism:doi": "10.1016/j.mcat.2023.113244",
        "prism:startingPage": "113244",
        "dc:identifier": "doi:10.1016/j.mcat.2023.113244",
        "openaccessSponsorName": null
      },
      "objects": {
        "object": [
          {
            "@category": "standard",
            "@height": "288",
            "@width": "388",
            "@_fa": "true",
            "$": "https://api.elsevier.com/content/object/eid/1-s2.0-S2468823123003280-gr7.jpg?httpAccept=%2A%2F%2A",
            "@multimediatype": "JPEG image file",
            "@type": "IMAGE-DOWNSAMPLED",
            "@size": "34089",
            "@ref": "gr7",
            "@mimetype": "image/jpeg"
          },
          {
            "@category": "standard",
            "@height": "284",
            "@width": "696",
            "@_fa": "true",
            "$": "https://api.elsevier.com/content/object/eid/1-s2.0-S2468823123003280-gr6.jpg?httpAccept=%2A%2F%2A",
            "@multimediatype": "JPEG image file",
            "@type": "IMAGE-DOWNSAMPLED",
            "@size": "51704",
            "@ref": "gr6",
            "@mimetype": "image/jpeg"
          },
          {
            "@category": "standard",
            "@height": "304",
            "@width": "380",
            "@_fa": "true",
            "$": "https://api.elsevier.com/content/object/eid/1-s2.0-S2468823123003280-gr9.jpg?httpAccept=%2A%2F%2A",
            "@multimediatype": "JPEG image file",
            "@type": "IMAGE-DOWNSAMPLED",
            "@size": "20737",
            "@ref": "gr9",
            "@mimetype": "image/jpeg"
          },
          {
            "@category": "standard",
            "@height": "287",
            "@width": "389",
            "@_fa": "true",
            "$": "https://api.elsevier.com/content/object/eid/1-s2.0-S2468823123003280-gr8.jpg?httpAccept=%2A%2F%2A",
            "@multimediatype": "JPEG image file",
            "@type": "IMAGE-DOWNSAMPLED",
            "@size": "31938",
            "@ref": "gr8",
            "@mimetype": "image/jpeg"
          },
          {
            "@category": "standard",
            "@height": "355",
            "@width": "508",
            "@_fa": "true",
            "$": "https://api.elsevier.com/content/object/eid/1-s2.0-S2468823123003280-gr10.jpg?httpAccept=%2A%2F%2A",
            "@multimediatype": "JPEG image file",
            "@type": "IMAGE-DOWNSAMPLED",
            "@size": "56108",
            "@ref": "gr10",
            "@mimetype": "image/jpeg"
          },
          {
            "@category": "standard",
            "@height": "177",
            "@width": "734",
            "@_fa": "true",
            "$": "https://api.elsevier.com/content/object/eid/1-s2.0-S2468823123003280-gr3.jpg?httpAccept=%2A%2F%2A",
            "@multimediatype": "JPEG image file",
            "@type": "IMAGE-DOWNSAMPLED",
            "@size": "51059",
            "@ref": "gr3",
            "@mimetype": "image/jpeg"
          },
          {
            "@category": "standard",
            "@height": "465",
            "@width": "640",
            "@_fa": "true",
            "$": "https://api.elsevier.com/content/object/eid/1-s2.0-S2468823123003280-gr2.jpg?httpAccept=%2A%2F%2A",
            "@multimediatype": "JPEG image file",
            "@type": "IMAGE-DOWNSAMPLED",
            "@size": "77564",
            "@ref": "gr2",
            "@mimetype": "image/jpeg"
          },
          {
            "@category": "standard",
            "@height": "286",
            "@width": "384",
            "@_fa": "true",
            "$": "https://api.elsevier.com/content/object/eid/1-s2.0-S2468823123003280-gr5.jpg?httpAccept=%2A%2F%2A",
            "@multimediatype": "JPEG image file",
            "@type": "IMAGE-DOWNSAMPLED",
            "@size": "28511",
            "@ref": "gr5",
            "@mimetype": "image/jpeg"
          },
          {
            "@category": "standard",
            "@height": "368",
            "@width": "734",
            "@_fa": "true",
            "$": "https://api.elsevier.com/content/object/eid/1-s2.0-S2468823123003280-gr4.jpg?httpAccept=%2A%2F%2A",
            "@multimediatype": "JPEG image file",
            "@type": "IMAGE-DOWNSAMPLED",
            "@size": "97131",
            "@ref": "gr4",
            "@mimetype": "image/jpeg"
          },
          {
            "@category": "standard",
            "@height": "512",
            "@width": "602",
            "@_fa": "true",
            "$": "https://api.elsevier.com/content/object/eid/1-s2.0-S2468823123003280-gr1.jpg?httpAccept=%2A%2F%2A",
            "@multimediatype": "JPEG image file",
            "@type": "IMAGE-DOWNSAMPLED",
            "@size": "73014",
            "@ref": "gr1",
            "@mimetype": "image/jpeg"
          },
          {
            "@category": "standard",
            "@height": "391",
            "@width": "715",
            "@_fa": "true",
            "$": "https://api.elsevier.com/content/object/eid/1-s2.0-S2468823123003280-sc2.jpg?httpAccept=%2A%2F%2A",
            "@multimediatype": "JPEG image file",
            "@type": "IMAGE-DOWNSAMPLED",
            "@size": "38044",
            "@ref": "sc2",
            "@mimetype": "image/jpeg"
          },
          {
            "@category": "standard",
            "@height": "868",
            "@width": "715",
            "@_fa": "true",
            "$": "https://api.elsevier.com/content/object/eid/1-s2.0-S2468823123003280-sc1.jpg?httpAccept=%2A%2F%2A",
            "@multimediatype": "JPEG image file",
            "@type": "IMAGE-DOWNSAMPLED",
            "@size": "121604",
            "@ref": "sc1",
            "@mimetype": "image/jpeg"
          },
          {
            "@category": "standard",
            "@height": "190",
            "@width": "500",
            "@_fa": "true",
            "$": "https://api.elsevier.com/content/object/eid/1-s2.0-S2468823123003280-ga1.jpg?httpAccept=%2A%2F%2A",
            "@multimediatype": "JPEG image file",
            "@type": "IMAGE-DOWNSAMPLED",
            "@size": "49433",
            "@ref": "ga1",
            "@mimetype": "image/jpeg"
          },
          {
            "@category": "thumbnail",
            "@height": "162",
            "@width": "219",
            "@_fa": "true",
            "$": "https://api.elsevier.com/content/object/eid/1-s2.0-S2468823123003280-gr7.sml?httpAccept=%2A%2F%2A",
            "@multimediatype": "GIF image file",
            "@type": "IMAGE-THUMBNAIL",
            "@size": "12208",
            "@ref": "gr7",
            "@mimetype": "image/gif"
          },
          {
            "@category": "thumbnail",
            "@height": "89",
            "@width": "219",
            "@_fa": "true",
            "$": "https://api.elsevier.com/content/object/eid/1-s2.0-S2468823123003280-gr6.sml?httpAccept=%2A%2F%2A",
            "@multimediatype": "GIF image file",
            "@type": "IMAGE-THUMBNAIL",
            "@size": "8907",
            "@ref": "gr6",
            "@mimetype": "image/gif"
          },
          {
            "@category": "thumbnail",
            "@height": "164",
            "@width": "205",
            "@_fa": "true",
            "$": "https://api.elsevier.com/content/object/eid/1-s2.0-S2468823123003280-gr9.sml?httpAccept=%2A%2F%2A",
            "@multimediatype": "GIF image file",
            "@type": "IMAGE-THUMBNAIL",
            "@size": "8557",
            "@ref": "gr9",
            "@mimetype": "image/gif"
          },
          {
            "@category": "thumbnail",
            "@height": "161",
            "@width": "219",
            "@_fa": "true",
            "$": "https://api.elsevier.com/content/object/eid/1-s2.0-S2468823123003280-gr8.sml?httpAccept=%2A%2F%2A",
            "@multimediatype": "GIF image file",
            "@type": "IMAGE-THUMBNAIL",
            "@size": "11543",
            "@ref": "gr8",
            "@mimetype": "image/gif"
          },
          {
            "@category": "thumbnail",
            "@height": "153",
            "@width": "219",
            "@_fa": "true",
            "$": "https://api.elsevier.com/content/object/eid/1-s2.0-S2468823123003280-gr10.sml?httpAccept=%2A%2F%2A",
            "@multimediatype": "GIF image file",
            "@type": "IMAGE-THUMBNAIL",
            "@size": "17892",
            "@ref": "gr10",
            "@mimetype": "image/gif"
          },
          {
            "@category": "thumbnail",
            "@height": "53",
            "@width": "219",
            "@_fa": "true",
            "$": "https://api.elsevier.com/content/object/eid/1-s2.0-S2468823123003280-gr3.sml?httpAccept=%2A%2F%2A",
            "@multimediatype": "GIF image file",
            "@type": "IMAGE-THUMBNAIL",
            "@size": "9894",
            "@ref": "gr3",
            "@mimetype": "image/gif"
          },
          {
            "@category": "thumbnail",
            "@height": "159",
            "@width": "219",
            "@_fa": "true",
            "$": "https://api.elsevier.com/content/object/eid/1-s2.0-S2468823123003280-gr2.sml?httpAccept=%2A%2F%2A",
            "@multimediatype": "GIF image file",
            "@type": "IMAGE-THUMBNAIL",
            "@size": "12027",
            "@ref": "gr2",
            "@mimetype": "image/gif"
          },
          {
            "@category": "thumbnail",
            "@height": "163",
            "@width": "219",
            "@_fa": "true",
            "$": "https://api.elsevier.com/content/object/eid/1-s2.0-S2468823123003280-gr5.sml?httpAccept=%2A%2F%2A",
            "@multimediatype": "GIF image file",
            "@type": "IMAGE-THUMBNAIL",
            "@size": "11175",
            "@ref": "gr5",
            "@mimetype": "image/gif"
          },
          {
            "@category": "thumbnail",
            "@height": "110",
            "@width": "219",
            "@_fa": "true",
            "$": "https://api.elsevier.com/content/object/eid/1-s2.0-S2468823123003280-gr4.sml?httpAccept=%2A%2F%2A",
            "@multimediatype": "GIF image file",
            "@type": "IMAGE-THUMBNAIL",
            "@size": "16773",
            "@ref": "gr4",
            "@mimetype": "image/gif"
          },
          {
            "@category": "thumbnail",
            "@height": "164",
            "@width": "193",
            "@_fa": "true",
            "$": "https://api.elsevier.com/content/object/eid/1-s2.0-S2468823123003280-gr1.sml?httpAccept=%2A%2F%2A",
            "@multimediatype": "GIF image file",
            "@type": "IMAGE-THUMBNAIL",
            "@size": "12552",
            "@ref": "gr1",
            "@mimetype": "image/gif"
          },
          {
            "@category": "thumbnail",
            "@height": "120",
            "@width": "219",
            "@_fa": "true",
            "$": "https://api.elsevier.com/content/object/eid/1-s2.0-S2468823123003280-sc2.sml?httpAccept=%2A%2F%2A",
            "@multimediatype": "GIF image file",
            "@type": "IMAGE-THUMBNAIL",
            "@size": "6250",
            "@ref": "sc2",
            "@mimetype": "image/gif"
          },
          {
            "@category": "thumbnail",
            "@height": "164",
            "@width": "135",
            "@_fa": "true",
            "$": "https://api.elsevier.com/content/object/eid/1-s2.0-S2468823123003280-sc1.sml?httpAccept=%2A%2F%2A",
            "@multimediatype": "GIF image file",
            "@type": "IMAGE-THUMBNAIL",
            "@size": "7536",
            "@ref": "sc1",
            "@mimetype": "image/gif"
          },
          {
            "@category": "thumbnail",
            "@height": "83",
            "@width": "219",
            "@_fa": "true",
            "$": "https://api.elsevier.com/content/object/eid/1-s2.0-S2468823123003280-ga1.sml?httpAccept=%2A%2F%2A",
            "@multimediatype": "GIF image file",
            "@type": "IMAGE-THUMBNAIL",
            "@size": "15546",
            "@ref": "ga1",
            "@mimetype": "image/gif"
          },
          {
            "@category": "high",
            "@height": "1274",
            "@width": "1717",
            "@_fa": "true",
            "$": "https://api.elsevier.com/content/object/eid/1-s2.0-S2468823123003280-gr7_lrg.jpg?httpAccept=%2A%2F%2A",
            "@multimediatype": "JPEG image file",
            "@type": "IMAGE-HIGH-RES",
            "@size": "247881",
            "@ref": "gr7",
            "@mimetype": "image/jpeg"
          },
          {
            "@category": "high",
            "@height": "1256",
            "@width": "3083",
            "@_fa": "true",
            "$": "https://api.elsevier.com/content/object/eid/1-s2.0-S2468823123003280-gr6_lrg.jpg?httpAccept=%2A%2F%2A",
            "@multimediatype": "JPEG image file",
            "@type": "IMAGE-HIGH-RES",
            "@size": "380298",
            "@ref": "gr6",
            "@mimetype": "image/jpeg"
          },
          {
            "@category": "high",
            "@height": "1346",
            "@width": "1683",
            "@_fa": "true",
            "$": "https://api.elsevier.com/content/object/eid/1-s2.0-S2468823123003280-gr9_lrg.jpg?httpAccept=%2A%2F%2A",
            "@multimediatype": "JPEG image file",
            "@type": "IMAGE-HIGH-RES",
            "@size": "133349",
            "@ref": "gr9",
            "@mimetype": "image/jpeg"
          },
          {
            "@category": "high",
            "@height": "1271",
            "@width": "1725",
            "@_fa": "true",
            "$": "https://api.elsevier.com/content/object/eid/1-s2.0-S2468823123003280-gr8_lrg.jpg?httpAccept=%2A%2F%2A",
            "@multimediatype": "JPEG image file",
            "@type": "IMAGE-HIGH-RES",
            "@size": "237902",
            "@ref": "gr8",
            "@mimetype": "image/jpeg"
          },
          {
            "@category": "high",
            "@height": "1573",
            "@width": "2250",
            "@_fa": "true",
            "$": "https://api.elsevier.com/content/object/eid/1-s2.0-S2468823123003280-gr10_lrg.jpg?httpAccept=%2A%2F%2A",
            "@multimediatype": "JPEG image file",
            "@type": "IMAGE-HIGH-RES",
            "@size": "444663",
            "@ref": "gr10",
            "@mimetype": "image/jpeg"
          },
          {
            "@category": "high",
            "@height": "785",
            "@width": "3250",
            "@_fa": "true",
            "$": "https://api.elsevier.com/content/object/eid/1-s2.0-S2468823123003280-gr3_lrg.jpg?httpAccept=%2A%2F%2A",
            "@multimediatype": "JPEG image file",
            "@type": "IMAGE-HIGH-RES",
            "@size": "410485",
            "@ref": "gr3",
            "@mimetype": "image/jpeg"
          },
          {
            "@category": "high",
            "@height": "2058",
            "@width": "2833",
            "@_fa": "true",
            "$": "https://api.elsevier.com/content/object/eid/1-s2.0-S2468823123003280-gr2_lrg.jpg?httpAccept=%2A%2F%2A",
            "@multimediatype": "JPEG image file",
            "@type": "IMAGE-HIGH-RES",
            "@size": "663021",
            "@ref": "gr2",
            "@mimetype": "image/jpeg"
          },
          {
            "@category": "high",
            "@height": "1268",
            "@width": "1700",
            "@_fa": "true",
            "$": "https://api.elsevier.com/content/object/eid/1-s2.0-S2468823123003280-gr5_lrg.jpg?httpAccept=%2A%2F%2A",
            "@multimediatype": "JPEG image file",
            "@type": "IMAGE-HIGH-RES",
            "@size": "211955",
            "@ref": "gr5",
            "@mimetype": "image/jpeg"
          },
          {
            "@category": "high",
            "@height": "1628",
            "@width": "3250",
            "@_fa": "true",
            "$": "https://api.elsevier.com/content/object/eid/1-s2.0-S2468823123003280-gr4_lrg.jpg?httpAccept=%2A%2F%2A",
            "@multimediatype": "JPEG image file",
            "@type": "IMAGE-HIGH-RES",
            "@size": "831081",
            "@ref": "gr4",
            "@mimetype": "image/jpeg"
          },
          {
            "@category": "high",
            "@height": "2267",
            "@width": "2667",
            "@_fa": "true",
            "$": "https://api.elsevier.com/content/object/eid/1-s2.0-S2468823123003280-gr1_lrg.jpg?httpAccept=%2A%2F%2A",
            "@multimediatype": "JPEG image file",
            "@type": "IMAGE-HIGH-RES",
            "@size": "529478",
            "@ref": "gr1",
            "@mimetype": "image/jpeg"
          },
          {
            "@category": "high",
            "@height": "1731",
            "@width": "3167",
            "@_fa": "true",
            "$": "https://api.elsevier.com/content/object/eid/1-s2.0-S2468823123003280-sc2_lrg.jpg?httpAccept=%2A%2F%2A",
            "@multimediatype": "JPEG image file",
            "@type": "IMAGE-HIGH-RES",
            "@size": "298693",
            "@ref": "sc2",
            "@mimetype": "image/jpeg"
          },
          {
            "@category": "high",
            "@height": "3846",
            "@width": "3167",
            "@_fa": "true",
            "$": "https://api.elsevier.com/content/object/eid/1-s2.0-S2468823123003280-sc1_lrg.jpg?httpAccept=%2A%2F%2A",
            "@multimediatype": "JPEG image file",
            "@type": "IMAGE-HIGH-RES",
            "@size": "990908",
            "@ref": "sc1",
            "@mimetype": "image/jpeg"
          },
          {
            "@category": "high",
            "@height": "843",
            "@width": "2213",
            "@_fa": "true",
            "$": "https://api.elsevier.com/content/object/eid/1-s2.0-S2468823123003280-ga1_lrg.jpg?httpAccept=%2A%2F%2A",
            "@multimediatype": "JPEG image file",
            "@type": "IMAGE-HIGH-RES",
            "@size": "352522",
            "@ref": "ga1",
            "@mimetype": "image/jpeg"
          },
          {
            "@category": "standard",
            "@_fa": "true",
            "$": "https://api.elsevier.com/content/object/eid/1-s2.0-S2468823123003280-mmc1.docx?httpAccept=%2A%2F%2A",
            "@multimediatype": "Microsoft Word file",
            "@type": "APPLICATION",
            "@size": "1163926",
            "@ref": "mmc1",
            "@mimetype": "application/word"
          },
          {
            "@category": "standard",
            "@_fa": "true",
            "$": "https://api.elsevier.com/content/object/eid/1-s2.0-S2468823123003280-am.pdf?httpAccept=%2A%2F%2A",
            "@multimediatype": "Acrobat PDF file",
            "@type": "AAM-PDF",
            "@size": "1265232",
            "@ref": "am",
            "@mimetype": "application/pdf"
          }
        ]
      },
      "link": {
        "@rel": "abstract",
        "@href": "https://api.elsevier.com/content/abstract/scopus_id/85159320215"
      }
    }
  }
}