{
  "metadata": {
    "title": "Co-C<ce:italic><ce:inf loc=post>x</ce:inf></ce:italic>N<ce:italic><ce:inf loc=post>y</ce:inf></ce:italic> embedded in N-doped carbon as robust catalysts for the synthesis of γ-valerolactone from the hydrogenation of levulinic acid under low hydrogen pressure",
    "authors": "; ; ",
    "journal": "Molecular Catalysis",
    "date": "2022-07-31",
    "doi": "10.1016/j.mcat.2022.112409",
    "abstract": "",
    "uri": "https://api.elsevier.com/content/article/pii/S2468823122002954",
    "pii": "S2468823122002954"
  },
  "fulltext": {
    "full-text-retrieval-response": {
      "scopus-eid": "2-s2.0-85131683669",
      "originalText": "serial JL 315758 291210 291744 291790 291809 31 Molecular Catalysis MOLECULARCATALYSIS 2022-06-08 2022-06-08 2022-06-08 2022-06-08 2022-12-24T23:55:43 1-s2.0-S2468823122002954 S2468-8231(22)00295-4 S2468823122002954 10.1016/j.mcat.2022.112409 S300 S300.1 FULL-TEXT 1-s2.0-S2468823122X00102 2024-06-26T17:47:42.388403Z 0 0 20220701 20220731 2022 2022-06-08T11:16:18.037763Z absattachment articleinfo articlenumber articletitlenorm authfirstinitialnorm authfirstsurnamenorm cid cids contenttype copyright crossmark dateloaded dateloadedtxt datesearch datesort dateupdated dco docsubtype doctype doi eid ewtransactionid hubeid indexeddate issn issnnorm itemstage itemtransactionid itemweight openaccess openarchive pg pgfirst pii piinorm pubdateend pubdatestart pubdatetxt pubyr sectiontitle sortorder srctitle srctitlenorm srctype ssids alllist content subj subheadings suppl tomb volfirst volissue volumelist webpdf webpdfpagecount yearnav figure table e-component body mmlmath acknowledge affil appendices articletitle auth authfirstini authfull authkeywords authlast grantnumber grantsponsor grantsponsorid highlightsabst primabst ref specialabst 2468-8231 24688231 true 527 527 C Volume 527 13 112409 112409 112409 202207 July 2022 2022-07-01 2022-07-31 2022 Regular Papers article fla © 2022 Elsevier B.V. All rights reserved. COCXNYEMBEDDEDINNDOPEDCARBONROBUSTCATALYSTSFORSYNTHESISVALEROLACTONEHYDROGENATIONLEVULINICACIDUNDERLOWHYDROGENPRESSURE LU J 1 Introduction 2 Experimental 2.1 Catalyst preparation 2.2 Characterizations 2.3 Catalytic tests 3 Results and discussion 3.1 Catalytic performance and characterization 3.2 Optimization of the reaction conditions 3.3 Catalyst recyclability 4 Conclusions CRediT authorship contribution statement Acknowledgments Appendix Supplementary materials References SERETIS 2020 221 A LUO 2019 3744 3768 W KARANWAL 2021 2846 2864 N DUTTAA 2019 992 1006 S XUE 2018 4391 4408 Z GALLETTI 2012 688 694 A WRIGHT 2012 1657 1667 W YAN 2014 230 232 K DU 2013 993 1001 X XIAO 2016 593 599 C TAN 2015 508 512 J LI 2019 117244 J LIU 2019 386 393 D SUN 2018 488 498 M HENGNE 2012 1064 1072 A HENGST 2017 2680 2689 K LONG 2015 1512 1518 X LI 2020 163 174 J LIAN 2019 46 51 Y SHEN 2016 5887 5903 K ZHAO 2019 110421 T LIU 2017 100 107 J KONG 2021 12 19 X ZHANG 2007 17200 17205 G GONG 2019 1808341 1808349 W LIANG 2021 1 7 Z CHEN 2015 5010 5016 Y GAO 2019 118076 X LI 2020 2043 2054 W SHAO 2022 17195 17207 Y TO 2021 1 11 D JIANG 2021 7065 7073 L SHAO 2019 4499 4511 Y LUX2022X112409 LUX2022X112409XJ 2024-06-08T00:00:00.000Z 2024-06-08T00:00:00.000Z http://creativecommons.org/licenses/by-nc-nd/4.0/ © 2022 Elsevier B.V. All rights reserved. 2022-06-15T00:42:37.058Z http://vtw.elsevier.com/data/voc/AddOnTypes/50.7/aggregated-refined National Natural Science Foundation of China 22178212 NSFC National Natural Science Foundation of China http://data.elsevier.com/vocabulary/SciValFunders/501100001809 http://sws.geonames.org/1814991/ Natural Science Foundation of Shaanxi Provincial 2022JM-073 Natural Science Foundation of Shaanxi Province http://data.elsevier.com/vocabulary/SciValFunders/501100007128 http://sws.geonames.org/1814991/ The authors gratefully acknowledge financial support from the National Natural Science Foundation of China ( 22178212 ) and the Natural Science Foundation of Shaanxi Provincial ( 2022JM-073 ). 0 https://doi.org/10.15223/policy-017 https://doi.org/10.15223/policy-037 https://doi.org/10.15223/policy-012 https://doi.org/10.15223/policy-029 https://doi.org/10.15223/policy-004 item S2468-8231(22)00295-4 S2468823122002954 1-s2.0-S2468823122002954 10.1016/j.mcat.2022.112409 315758 2022-12-24T23:59:05.214387Z 2022-07-01 2022-07-31 1-s2.0-S2468823122002954-main.pdf https://s3-eu-west-1.amazonaws.com/prod-ucs-content-store-eu-west/content/pii:S2468823122002954/MAIN/application/pdf/2f9a14346bedf970d51f62ac31c5deca/main.pdf main.pdf pdf true 7170304 MAIN 9 1-s2.0-S2468823122002954-main_1.png https://s3-eu-west-1.amazonaws.com/prod-ucs-content-store-eu-west/content/pii:S2468823122002954/PREVIEW/image/png/5d19afc9538de3a9b830234e56bdb6ce/main_1.png main_1.png png 57608 849 656 IMAGE-WEB-PDF 1 1-s2.0-S2468823122002954-gr5.jpg https://s3-eu-west-1.amazonaws.com/prod-ucs-content-store-eu-west/content/pii:S2468823122002954/gr5/DOWNSAMPLED/image/jpeg/d4b3033fe49108b308c79fcee05eabb7/gr5.jpg gr5 gr5.jpg jpg 31890 297 386 IMAGE-DOWNSAMPLED 1-s2.0-S2468823122002954-gr4.jpg https://s3-eu-west-1.amazonaws.com/prod-ucs-content-store-eu-west/content/pii:S2468823122002954/gr4/DOWNSAMPLED/image/jpeg/0358b9b07415f8c9f2f7a9444fe5f812/gr4.jpg gr4 gr4.jpg jpg 219635 859 386 IMAGE-DOWNSAMPLED 1-s2.0-S2468823122002954-gr1.jpg https://s3-eu-west-1.amazonaws.com/prod-ucs-content-store-eu-west/content/pii:S2468823122002954/gr1/DOWNSAMPLED/image/jpeg/2988d1b8b276c7348910abef3faf0f52/gr1.jpg gr1 gr1.jpg jpg 113899 678 386 IMAGE-DOWNSAMPLED 1-s2.0-S2468823122002954-gr3.jpg https://s3-eu-west-1.amazonaws.com/prod-ucs-content-store-eu-west/content/pii:S2468823122002954/gr3/DOWNSAMPLED/image/jpeg/478758dd2cebdf3742bec8b88e3726ef/gr3.jpg gr3 gr3.jpg jpg 214411 713 809 IMAGE-DOWNSAMPLED 1-s2.0-S2468823122002954-gr2.jpg https://s3-eu-west-1.amazonaws.com/prod-ucs-content-store-eu-west/content/pii:S2468823122002954/gr2/DOWNSAMPLED/image/jpeg/39290cf14d48247497cc7c5eaaa356b7/gr2.jpg gr2 gr2.jpg jpg 177401 966 563 IMAGE-DOWNSAMPLED 1-s2.0-S2468823122002954-ga1.jpg https://s3-eu-west-1.amazonaws.com/prod-ucs-content-store-eu-west/content/pii:S2468823122002954/ga1/DOWNSAMPLED/image/jpeg/cff40b7ad462c1c555b1a1adc9badcb9/ga1.jpg ga1 true ga1.jpg jpg 15254 140 301 IMAGE-DOWNSAMPLED 1-s2.0-S2468823122002954-sc1.jpg https://s3-eu-west-1.amazonaws.com/prod-ucs-content-store-eu-west/content/pii:S2468823122002954/sc1/DOWNSAMPLED/image/jpeg/9b0e62017a9b01cc56bc9f9d32475ba6/sc1.jpg sc1 sc1.jpg jpg 46631 356 762 IMAGE-DOWNSAMPLED 1-s2.0-S2468823122002954-gr5.sml https://s3-eu-west-1.amazonaws.com/prod-ucs-content-store-eu-west/content/pii:S2468823122002954/gr5/THUMBNAIL/image/gif/57018fe55f5851c7bce030fec2b68f43/gr5.sml gr5 gr5.sml sml 9146 164 213 IMAGE-THUMBNAIL 1-s2.0-S2468823122002954-gr4.sml https://s3-eu-west-1.amazonaws.com/prod-ucs-content-store-eu-west/content/pii:S2468823122002954/gr4/THUMBNAIL/image/gif/2d4dde91a34f23d9354a43ad83663842/gr4.sml gr4 gr4.sml sml 8319 162 73 IMAGE-THUMBNAIL 1-s2.0-S2468823122002954-gr1.sml https://s3-eu-west-1.amazonaws.com/prod-ucs-content-store-eu-west/content/pii:S2468823122002954/gr1/THUMBNAIL/image/gif/e3629059cee41d2e56a9b33a82ae918c/gr1.sml gr1 gr1.sml sml 9202 163 93 IMAGE-THUMBNAIL 1-s2.0-S2468823122002954-gr3.sml https://s3-eu-west-1.amazonaws.com/prod-ucs-content-store-eu-west/content/pii:S2468823122002954/gr3/THUMBNAIL/image/gif/0155fbda9a85e243bcbe83da4ded6e0c/gr3.sml gr3 gr3.sml sml 15992 164 186 IMAGE-THUMBNAIL 1-s2.0-S2468823122002954-gr2.sml https://s3-eu-west-1.amazonaws.com/prod-ucs-content-store-eu-west/content/pii:S2468823122002954/gr2/THUMBNAIL/image/gif/4163cc35aa570d7da62f5ba338e33c7d/gr2.sml gr2 gr2.sml sml 13784 163 95 IMAGE-THUMBNAIL 1-s2.0-S2468823122002954-ga1.sml https://s3-eu-west-1.amazonaws.com/prod-ucs-content-store-eu-west/content/pii:S2468823122002954/ga1/THUMBNAIL/image/gif/ed9a2e82c3e92ab6ab63d122eaf021a0/ga1.sml ga1 true ga1.sml sml 8388 102 219 IMAGE-THUMBNAIL 1-s2.0-S2468823122002954-sc1.sml https://s3-eu-west-1.amazonaws.com/prod-ucs-content-store-eu-west/content/pii:S2468823122002954/sc1/THUMBNAIL/image/gif/575232ff73c3062d330b89c0e54e3d3b/sc1.sml sc1 sc1.sml sml 8280 102 219 IMAGE-THUMBNAIL 1-s2.0-S2468823122002954-gr5_lrg.jpg https://s3-eu-west-1.amazonaws.com/prod-ucs-content-store-eu-west/content/pii:S2468823122002954/gr5/HIGHRES/image/jpeg/7d6b59fb8baea30139261ec5fd1761c7/gr5_lrg.jpg gr5 gr5_lrg.jpg jpg 201348 1316 1708 IMAGE-HIGH-RES 1-s2.0-S2468823122002954-gr4_lrg.jpg https://s3-eu-west-1.amazonaws.com/prod-ucs-content-store-eu-west/content/pii:S2468823122002954/gr4/HIGHRES/image/jpeg/06cf4de45a9adee7836a84d1b9588c19/gr4_lrg.jpg gr4 gr4_lrg.jpg jpg 2535803 3801 1708 IMAGE-HIGH-RES 1-s2.0-S2468823122002954-gr1_lrg.jpg https://s3-eu-west-1.amazonaws.com/prod-ucs-content-store-eu-west/content/pii:S2468823122002954/gr1/HIGHRES/image/jpeg/7157eaf3bbbe30ab27806bf7b8a728b6/gr1_lrg.jpg gr1 gr1_lrg.jpg jpg 802691 2998 1708 IMAGE-HIGH-RES 1-s2.0-S2468823122002954-gr3_lrg.jpg https://s3-eu-west-1.amazonaws.com/prod-ucs-content-store-eu-west/content/pii:S2468823122002954/gr3/HIGHRES/image/jpeg/52bcc5dda9d83b1c55755df1bdd9839e/gr3_lrg.jpg gr3 gr3_lrg.jpg jpg 1949364 3157 3583 IMAGE-HIGH-RES 1-s2.0-S2468823122002954-gr2_lrg.jpg https://s3-eu-west-1.amazonaws.com/prod-ucs-content-store-eu-west/content/pii:S2468823122002954/gr2/HIGHRES/image/jpeg/2e22e4f2f45733805caa33c4000fbbd3/gr2_lrg.jpg gr2 gr2_lrg.jpg jpg 1679658 4274 2492 IMAGE-HIGH-RES 1-s2.0-S2468823122002954-ga1_lrg.jpg https://s3-eu-west-1.amazonaws.com/prod-ucs-content-store-eu-west/content/pii:S2468823122002954/ga1/HIGHRES/image/jpeg/59b1cd903dcdf190227022a7dc31fe9f/ga1_lrg.jpg ga1 true ga1_lrg.jpg jpg 101603 622 1333 IMAGE-HIGH-RES 1-s2.0-S2468823122002954-sc1_lrg.jpg https://s3-eu-west-1.amazonaws.com/prod-ucs-content-store-eu-west/content/pii:S2468823122002954/sc1/HIGHRES/image/jpeg/6ecf115712a4a74db787b49cfe3b43b3/sc1_lrg.jpg sc1 sc1_lrg.jpg jpg 413613 1575 3375 IMAGE-HIGH-RES 1-s2.0-S2468823122002954-mmc1.docx https://s3-eu-west-1.amazonaws.com/prod-ucs-content-store-eu-west/content/pii:S2468823122002954/mmc1/MAIN/application/vnd.openxmlformats-officedocument.wordprocessingml.document/5fe78de25354cc12942a46f813a88520/mmc1.docx mmc1 mmc1.docx docx 713715 APPLICATION 1-s2.0-S2468823122002954-am.pdf https://s3-eu-west-1.amazonaws.com/prod-ucs-content-store-eu-west/content/egi:101409CJCFL/MAIN/application/pdf/7b2eb40a23c39a47a6b2959fa0e263b1/am.pdf am am.pdf pdf false 1389147 AAM-PDF MCAT 112409 112409 S2468-8231(22)00295-4 10.1016/j.mcat.2022.112409 Fig. 1 XRD patterns of catalysts calcinated at different temperature (a) and prepared by different methods (b). Fig. 1 Fig. 2 SEM image of ZIF-67 (a), SEM (b) and TEM (c–f) images of Co@NC-800H, statistics of particle sizes (g) and element mapping (h) of Co@NC-800H. Fig. 2 Fig. 3 XPS profiles of C1s (a), O1s (b), N1s (c) and Co 2p (d) for the various catalysts. Fig. 3 Fig. 4 The influences of H2 pressure (a), temperature (b) and catalyst loading (c) on the catalytic performance. Reaction conditions: LA 80 mg, H2O 20 mL, 3 h. (a) catalyst 20 mg, 120 °C, (b) catalyst 20 mg, 0.5 MPa H2, (c) 120 °C, 0.5 MPa H2. Fig. 4 Fig. 5 Recyclability of Co@NC-800H. Reaction conditions: LA 80 mg, catalyst 20 mg, 1,4-dioxane 20 mL, 180°C, 3 MPa H2, 1 h. Fig. 5 Scheme 1 The possible reaction routes of the LA hydrogenation over Co@NC-800H. Scheme 1 Table 1 Catalytic performances of the various catalysts a . Table 1 Entry Catalyst CLA (%) b YGVL (%) c SGVL (%) d 1 Co@NC-500H 44.9 44.5 >99 2 Co@NC-600H 69.3 68.7 >99 3 Co@NC-700H 77.7 77.0 >99 4 Co@NC-800H 92.1 91.3 >99 5 Co@NC-900H 89.1 88.3 >99 6 Co@NC-800N 26.8 26.6 >99 7 Co@NC-800NH 63.3 62.9 >99 8 NC 7.0 6.9 98.6 9 Co/NC 66.1 65.6 >99 10 Co/AC 7.3 7.1 97.3 a Reaction conditions: LA 80 mg, catalyst 20 mg, H2O 20 mL, 110 ℃, 3 MPa H2, 3 h. b CLA is the conversion of LA. c YGVL is the yield of GVL. d SGVL is the selectivity of GVL. Table 2 Physicochemical characteristics of various catalysts. Table 2 Catalysts Co Content (wt.%) a SBET (m2/g) b Vp(m3/g) b Dp(nm) b dCo(nm) c dCo(nm) d Acid capacity (mmol NH3/g) e Co dispersion (%) f GVL productivity(mmol/h/gsurf. Co) g Co@NC-800H 47.1 260.9 0.63 10.3 15.5 13.1 0.14 0.98 2293.5 Co@NC-800N 43.1 298.1 0.18 2.8 16.5 14.2 0.26 0.52 1364.2 Co@NC-800NH 42.1 334.7 0.22 3.0 18.1 16.0 0.12 1.96 876.2 Co/NC 46.2 160.2 0.31 8.9 23.9 21.3 2.22 0.92 1774.0 Co/AC 42.3 178.9 0.13 4.0 25.6 - 3.00 0.70 271.7 a Determined by ICP-OES. b Determined by N2 adsorption. c Calculated by XRD. d Calculated by TEM. e Calculated by NH3 chemisorption. f Estimated by H2 chemisorption. g The GVL productivity of different catalysts was estimated under the following reaction conditions: LA 80 mg, catalyst 20 mg, H2O 20 mL, 110 ℃, 3 MPa H2, 3 h. Table 3 Summary of XPS data for the various catalysts a . Table 3 Samples Content of different C types (at. %) Content of different N types (at. %) Content of different O types (at. %) Content of different Co types (at. %) sp2 C-C/N C-O O-C=O Graphitic-N Pyridinic-N Pyrrolic-N Oads Odef Co-O Co0 Co-CxNy Co-Nx Co@NC-800N 82.7 4.9 11.0 1.4 12.7 54.1 33.2 47.5 52.5 - 12.2 23.8 64.0 Co@NC-800NH 82.6 3.8 11.7 1.9 32.9 36.4 30.7 34.4 65.6 - 13.6 32.5 53.9 Co@NC-800H 86.8 4.5 7.3 1.4 61.7 38.3 0 28.7 71.3 - 16.3 67.3 16.4 Co/NC 80.5 2.2 14.1 3.2 36.1 63.9 0 19.8 69.3 10.9 26.5 43.8 29.7 a Determined by XPS. Table 4 A summary of the hydrogenation of LA and its esters to GVL over different catalysts. Table 4 Entry Catalyst Substrate Substrate/cat. mass ratio Reaction conditions Conversion Selectivity GVL productivitya (mmol/h/gsurf. metal) Ref. 1 Co/Al2O3 LA 95.0 180℃, 5.0 MPa H2 100% >99% 307.0 [17] 2 Co@NCNT-800 LA 10 180℃, 2.0 MPa H2 100% 100% 188.9 [23] 3 Co-900 LA 5.8 60℃, 2.0 MPa H2 68.7% 98.6% 138.0 [25] 4 Co@NC-800 LA 10 220℃, 2.0 MPa H2 100% 100% 2657.8 [29] 5 Co/ZnO@C-0.3 LA 2.3 100℃, 0.5 MPa H2 100% 98.3% 71.81 [30] LA 23 120℃, 2.0 MPa H2 89.3% 92.5% 452.1 6 GM@CoPS-700 LA 3 150℃, 3.0 MPa H2 96% 90% 1817.6 [31] 7 Co@NC-800H LA 2 120℃, 0.5 MPa H2 99.8% 99.6% 1275.8 This work LA 4 120℃, 2.0 MPa H2 99.3% 98.1% 2425.8 8 Ni1Zr1O EL 3 150℃, 0.3 MPa H2 96.2% 99.0% - [14] 9 Ni/Al2O3-CN-600 LA 2.9 130℃, 0.1 MPa H2 100% 99% 52.74 [32] 10 Cu/ZrO2-Al2O3 LA 5 130℃, 3.0 MPa H2 100% 100% 220.5 [18] 11 CuAl LA 1 110℃, 3.0 MPa H2 100% 95.3% 1393.9 [33] Co-C x N y embedded in N-doped carbon as robust catalysts for the synthesis of γ-valerolactone from the hydrogenation of levulinic acid under low hydrogen pressure Jingjing Lu Investigation Data curation Writing – original draft Yan Wei Validation Kaiyun Lu Chengming Wu Validation Xiaoyao Nong Validation Jifan Li Data curation Writing – original draft Writing – review & editing Supervision Funding acquisition ⁎ Chun-Ling Liu Writing – review & editing Supervision Wen-Sheng Dong Writing – review & editing Supervision Funding acquisition ⁎ Key Laboratory of Applied Surface and Colloid Chemistry (SNNU), MOE, School of Chemistry and Chemical Engineering, Shaanxi Normal University, Xi'an, Shaanxi 710062, China Key Laboratory of Applied Surface and Colloid Chemistry (SNNU) MOE School of Chemistry and Chemical Engineering Shaanxi Normal University Xi'an Shaanxi 710062 China Key Laboratory of Applied Surface and Colloid Chemistry (SNNU), MOE, School of Chemistry and Chemical Engineering, Shaanxi Normal University, Xi'an, Shaanxi 710062, China ⁎ Corresponding authors. The rational design of non-noble metal catalysts for the highly efficient production of γ-valerolactone (GVL) from the selective hydrogenation of levulinic acid (LA) at mild reaction conditions is still a big challenge. In this work, the Co embedded in N-doped carbon as a robust catalyst is fabricated by in situ carbonizing ZIF-67 for the LA selective hydrogenation to GVL. Several catalysts that differed in pyrolysis temperatures, pyrolysis gas and preparation methods were prepared and evaluated. The optimal catalytic performance is achieved with Co@NC-800H, which realizes a up to 99% yield of GVL at low temperature of 120 °C and low hydrogen pressure of 0.5 MPa. Also, the optimal Co@NC-800H catalyst exhibits excellent reusability. By the careful characterizations with multiple techniques, including BET, XRD, SEM, TEM, XPS and Raman, it is found that the excellent catalytic performance of Co@NC-800H is achieved through the synergistic catalysis between oxygen vacancies and Co-C x N y sites. Graphical abstract Image, graphical abstract Keywords ZIF-67 Levulinic acid γ-valerolactone Oxygen vacancies Co-C x N y 1 Introduction The diminishing crude oil reserves and increasing environmental issues caused by the overspend of fossil feedstocks force scientists to find renewable substitutes. Hence, the utilization of renewable biomass feedstocks to produce liquid biofuels and fine chemicals has attracted increasing attentions [1,2]. Levulinic acid (LA), a vital platform chemical derived from the decomposition of renewable lignocellulose, can be used as a feedstock to produce abundance of sustainable chemicals with high added-value. For example, γ-valerolactone (GVL), 2-methyltetrahydrofuran, 1,4-pentanediol, valeric acid and so on [2,3]. Among these valuable chemicals derived from LA, GVL is considered as one of the most promising derivatives obtained by the selective hydrogenation of LA, because it can be widely used as food additive, liquid fuel, green industrial solvent. Also, the GVL can act as renewable feedstocks to further produce other valuable derivatives [4,5]. Thus, the LA selective hydrogenation to GVL with high efficiency receives significant attentions. In the past decade, highly efficient synthesis of GVL via selective hydrogenation of LA has been achieved by the catalysis of precious metal catalysts under mild reaction conditions, e.g. Ru, Pd, Rh, Pt and Au [6–11]. However, the high cost and scarcity of noble metals obstruct their industrial application. Recently, various non-precious metal catalysts have been also developed to produce GVL through selective hydrogenation of LA [12–14]. For example, Hengne and Rode have explored the catalytic activity of Cu supported on various metal oxides (Cu/ZrO2, Cu/Al2O3, Cu/Cr2O3, Cu/BaO, Cu/Cr2O3-Al2O3, and Cu/BaO-Al2O3) [15]. The optimal Cu/ZrO2 catalyst finished complete LA conversion and 90% selectivity of GVL at 200 °C and 3.4 MPa H2. Hengst et al. successfully converted LA into GVL with a yield of 75% by using Ni/Al2O3 catalyst at 200 °C and 5 MPa H2 [16]. Co/Al2O3 catalyst derived from hydrotalcite was used to achieve a GVL yield up to 99% from LA hydrogenation at 180 °C and 5 MPa for 3 h [17]. In our recent study, a ternary catalyst of Cu/ZrO2-Al2O3 was designed to finish a high yield of GVL up to 99% at 130 °C and 3 MPa for 5 h [18]. Although the utilization of these catalysts free of precious metals also has been achieved high yield of GVL from selective hydrogenation of LA, the high yield of GVL relies on the harsh reaction conditions (high temperature and high pressure of H2). Hence, it is attractive to develop a robust catalyst for highly efficient production of GVL from LA under low temperature and H2 pressure. Nitrogen-doped carbon supported metal catalysts receives great attentions in recent years. The introducing nitrogen into the carbon architecture can stabilize the metal nanoparticles and favor the electron mobility, consequently enhancing the catalytic activity [19]. Metal-organic framework (MOF) materials have been applied as self-sacrificing templates to prepare highly dispersed metal catalysts for its ordered three-dimensional structures containing metal cation and organic ligand with high surface area and adjustable porosity [20]. The pyrolysis of MOF usually generates highly dispersed metal nanoparticles embedded in porous carbon matrix, because the porous carbon materials can effectively anchor the metal particles and prevent it aggregation [20,21]. Zhao et al. fabricated N-doped Co catalyst via the pyrolysis of ZIF-67 for the CO2 methanation reaction, which gave a 48.5% CO2 conversion with the 97.1% selectivity to CH4 [21]. The Fe-based catalysts obtained by the pyrolysis of Fe-MIL-88B achieved a 46.0% conversion of CO2 for CO2 methanation reaction [22]. Of these MOF materials, ZIF-67 can be facilely fabricated with low cost. Also, it contains abundant N species and thus avoid the addition of external N species. Herein, the Co embedded in N-doped carbon as a robust catalyst is fabricated by pyrolysis of ZIF-67 for the LA selective hydrogenation to GVL. The obtained catalyst Co@NC-800H achieves a up to 99% yield of GVL at low temperature of 120 °C and low hydrogen pressure of 0.5 MPa. Based on the systemic characterizations, the synergistic catalysis between oxygen vacancies and Co-C x N y sites is accounted for the excellent performance of Co@NC-800H. 2 Experimental 2.1 Catalyst preparation ZIF-67 was synthesized as follows: 3.49 g Co(NO3)2·6H2O and 3.94 g 2-methylimidazole were respectively dissolved by 60 mL methanol. Then the 2-methylimidazole solution was quickly added into the solution of Co(NO3)2, following by stirring for 20 h at room temperature. The ZIF-67 solid was obtained by centrifugation, washing four times with ethanol and drying at 60 °C in air for 24 h. The as-synthesized ZIF-67 was firstly heated in a flow of 10% H2/Ar to 400 ℃ for 2 h, and then to the designed temperature for 1 h with a heating rate of 2 ℃/min. The obtained samples were denoted as Co@NC-xH (x represents the final pyrolysis temperature, e.g. 500, 600, 700, 800, and 900). Besides, Co@NC-800N catalyst was also obtained by the pyrolysis of ZIF-67 particles at 800 °C in a flow of N2. Co@NC-800NH catalyst was obtained by the pyrolysis of Co@NC-800N in the flow of 10% H2/Ar at 800 °C for 1 h. The NC without of metal cobalt was prepared as below: briefly, 0.6 g Co@NC-800H was added into a flask with 120 mL 6 M HNO3 aqueous solution. After refluxing for 6 h at 120 °C, the black solid was obtained by centrifugation, washing several times with distilled water and ethanol and drying at 60 °C in air for 24 h. The obtained product was denoted as NC. The Co/NC and Co/AC catalysts were prepared via a wet impregnation. For Co/NC, 200 mg NC was added into 1.6 mL of 1.89 mol/L Co(NO3)2 aqueous solution under ultrasonication. After vigorous ultrasonic treatment for 2 h at room temperature, the mixture was evaporated at 80 °C and dried in vacuum at 60 °C for 24 h. Then the obtained sample was reduced at 500 °C for 2 h under 10% H2/Ar flow. The Co/AC catalyst was prepared with the same method by using commercial active carbon as support. 2.2 Characterizations The surface area and porosity of the catalysts were measured on Micromeritics ASAP 2020 PLUS HD88 via N2 physisorption experiments at -196 °C. All catalysts were degassed at 350 °C under vacuum for 300 min before analysis. The Bruker D8 Advance X-ray diffractometer equipped with Cu Kα radiation was used to conduct the X-ray diffraction (XRD) analysis. The contents of Co of different catalysts were determined by inductively coupled plasma optical emission spectrometer (ICP-OES, Prodigy 7, Leeman Labs, USA). The morphology and microstructure of sample were characterized by field-emission scanning electron microscopy (SEM) (Hitachi SU-8020, Japan). Transmission electron microscopes (TEM), high resolution transmission electron microscope (HRTEM) and energy dispersive X-ray spectra (EDX) images were obtained on JEM-2100F (JEOL, Japan) with an acceleration voltage of 200 kV. Raman spectra of the samples were performed on a Renishaw inVia Reflex Raman Spectroscope using an IK series He-Cd laser operating at 532 nm. X-ray photoelectron spectroscopy (XPS) was carried out on the X-ray photoelectron spectrometer system (ESCALAB Xi+, USA) from Thermo Fisher Scientific. The temperature-programmed desorption of ammonia (NH3-TPD), H2 temperature-programmed desorption (H2-TPD) and H2 temperature-programmed reduction (H2-TPR) were carried out on an AutoChem II 2920 instrument (Micromeritics, USA). For NH3-TPD tests, 50 mg sample was placed in a quartz tube reactor and pretreated in He at 300 °C for 120 min. The treated sample was saturated with 10% NH3/He for 60 min and then purged with He for 30 min at 100 °C. Finally, the sample was heated to 800 °C with a rate of 10°C/min. The H2-TPD studies were carried out to estimate the dispersion of cobalt. The study method is the same as NH3-TPD except that 10% NH3/He is replaced by 10% H2/Ar and He is replaced by Ar as the atmosphere of treatment. The detailed calculation methods of cobalt dispersion according to literature [21]. For the H2-TPR, the sample (30 mg) was pretreated in Ar at 80 °C for 30 min and then heated to 900 °C with a rate of 10 °C/min in a flow of 10% H2/Ar after being cooled down to 40 °C. 2.3 Catalytic tests The performance tests of these catalysts were carried out in an autoclave (35 mL). Typically, 80 mg LA, 20 mL solvent and 20 mg catalyst were introduced into the autoclave. After being purged three times with N2 flow, the autoclave was charged with H2 to the desired pressure. Afterwards, the autoclave was heated to target temperature for reaction. After the reaction, the autoclave was quickly cooled to room temperature in an ice-water. The reaction liquids were analyzed by high-performance liquid chromatography. The LA conversion was calculated via the equation as following: C LA ( % ) = moles of conv erted LA moles of init ial LA × 100 The GVL yield was calculated by the equation as following: Y GVL ( % ) = moles of prod uct GVL moles of init ial LA × 100 The GVL selectivity was calculated by the equation as following: S GVL ( % ) = moles of prod uct GVL moles of conv erted LA × 100 3 Results and discussion 3.1 Catalytic performance and characterization The catalytic performances of the various catalysts for the LA hydrogenation to GVL were evaluated at 110 °C under 3 MPa H2 for 3 h, the results are listed in Table 1 . Evidently, the pyrolysis temperature significantly influenced the catalytic activity of the catalysts derived from ZIF-67. The Co@NC-500H, which was obtained by pyrolysis of ZIF-67 at 500 °C in a 10% H2/Ar flow, achieves a low LA conversion of 44.9% (Enry 1 of Table 1). Under identical reaction conditions, the LA conversion and GVL yield increase remarkably as the pyrolysis temperature inclines (Entry 1–4 of Table 1), Co@NC-800H reaches the highest LA conversion of 92.1% with the GVL selectivity up to 99% (Entry 4 of Table 1). When the pyrolysis temperature further inclines up to 900 °C, the catalytic activity slightly decreases (Entry 5 of Table 1). The catalytic activity is also controlled by the types of pyrolysis gas. The catalyst (Co@NC-800N) obtained by pyrolysis of ZIF-67 in an inert gas flow of N2 only gives inferior catalytic activity with a low LA conversion of 26.8% (Entry 6 of Table 1), which is much lower than that of Co@NC-800H. After the secondary pyrolysis of Co@NC-800N in 10% H2/Ar flow, the catalytic activity recovers notably (Entry 7 of Table 1), although it is also lower than that of Co@NC-800H. When metal cobalt in Co@NC-800H was washed away by nitric acid solution, the sole NC catalyst is almost inactive for the hydrogenation of LA (Entry 8 of Table 1), suggesting that the metal cobalt is important to maintain the catalytic activity. However, even though equivalent weight of metal cobalt was introduced in sole NC by immersion, the Co/NC exhibits inferior catalytic activity than Co@NC-800H (Entry 9 of Table 1). Besides, the Co/AC catalyst with equivalent weight of metal cobalt supported on activated carbon shows an extremely poor activity for the hydrogenation of LA (Entry 10 of Table 1), probably due to the absence of nitrogen heteroatom doping on carbon matrix. As stated above, the Co@NC-800H displays excellent catalytic performance for the LA hydrogenation to produce GVL at low temperature. Hence, detailed characterizations of this sample were carried out and compared to those of other samples. Fig. 1 presents the XRD patterns of the various catalysts. As shown in Fig. 1a, the Co@NC-500H mainly presents weak peaks belonged to Co3O4, the absence of diffraction peaks for metallic cobalt evidences that cobalt oxide species are not well reduced at the low pyrolysis temperature of 500 °C. In the case of Co@NC-600H, the diffraction peaks of metallic cobalt emerge. As the pyrolysis temperature further increases, the diffraction peaks of metallic cobalt become clear and intensive. The XRD patterns displayed in Fig. 1b indicate that the cobalt oxide species in all these samples obtained via different methods are reduced into metallic cobalt. But the average size of cobalt particles, calculated based on Scherrer formula, is in obvious difference (Column 5 of Table 2 ). The cobalt particle size of these catalysts derived from ZIF-67 is much smaller than those of Co/NC and Co/AC. The cobalt particle size obtained by TEM in the later section further confirms this result. The Co@NC-800H has the smallest cobalt particles among these catalysts. N2 adsorption-desorption experiments were conducted to investigate the texture properties of these samples prepared by different methods. As displayed in Fig. S1, these samples possess I and IV adsorption-desorption isotherm, suggesting their microporous and mesoporous structure, which is also confirmed by their pore size distribution (Fig. S1b). The morphology and microstructure of Co@NC-800H were elucidated by SEM and TEM characterizations (Fig. 2 ). As displayed in Fig. 2a, the SEM images clearly show that the as-prepared ZIF-67 presents uniform dodecahedral structure. Upon pyrolysis in the flow of 10% H2/Ar at 800 °C, the dodecahedral structure is almost well maintained (Fig. 2b), but its surface becomes rough. The newborn carbon nanotubes can be observed clearly on the surface of Co@NC-800H (Fig. 2c), also a part of cobalt nanoparticles with an average particle size of 13.1 nm are confined in these nanotubes (Fig. 2c–g). Besides, the nitrogen element is homogeneously distributed over carbon matrix (Fig. 2h). In contrast, these samples obtained by pyrolysis in the flow of inert gas N2 present smooth surface without the formation of carbon nanotubes (Fig. S2a,b). These samples derived from ZIF-67 (Co@NC-800H, Co@NC-800N and Co@NC-800NH) possess small cobalt particle size in the range of 13∼16 nm, probably due to that the carbon matrix derived from ZIF-67 can anchor cobalt particles and in turn prevent sintering [21]. In contrast, the cobalt particles over the Co/NC and Co/AC catalysts prepared by impregnation are aggregated obviously (Fig. S2). The difference of particle size of cobalt particles observed in TEM is consistent with that detected by XRD. XPS characterizations were conducted to determine the surface composition and chemical states of the catalysts prepared by different methods. The XPS surveys (Fig. S3) suggest that these samples (Co@NC-800H, Co@NC-800N, Co@NC-800NH and Co/NC) contain Co, C, N and O elements. As listed in Table S1, the relatively lower contents of N element detected over Co@NC-800H, implying that the pyrolysis with 10% H2/Ar decreases the contents of N element. The C 1s spectra can be well deconvoluted into several peaks, assigning to C-C/N, C-O, O-C=O and sp2 carbon (Fig. 3 a) [23]. The contents of sp2 carbon is an indicator of the degree of graphitization [23]. As shown in column 1 of Table 3 , the Co@NC-800H contains the highest contents of sp2 carbon among these catalysts, indicating its high degree of graphitization. As illustrated in Fig. 3b, the O 1s peaks of these catalysts can be decomposed to two distinct peaks, belonging to surface oxygen vacancies and adsorption oxygen, respectively [19,24]. A lot of oxygen vacancies are determined over the surface of these samples derived via in situ carburization of ZIF-67 (Column 9 of Table 3, Co@NC-800H, Co@NC-800N and Co@NC-800NH). These surface oxygen vacancies are beneficial for the adsorption of LA [18]. The N 1s spectra of these samples can be carefully separated into graphitic-N, pyridinic-N and pyrrolic-N (Fig. 3c) [21,25]. The Co@NC-800N derived via pyrolysis in inert gas N2 contains a low content of graphitic-N and relatively high content of pyridinic-N and pyrrolic-N. After the secondary pyrolysis in 10% H2/Ar, the content of graphitic-N increases to 32.9% over Co@NC-800NH. The highest contents of graphitic-N are obtained over Co@NC-800H. These results imply that the H2 presenting in the pyrolysis gas can enhance the transformation of pyridinic-N and pyrrolic-N into graphitic-N. Fig. 3d displays the Co 2p spectra, the Co 2p spectra present three peaks at about 778.7 eV, 780.3 eV and 782.3 eV, which are belonged to Coo, Co-C x N y and Co-N x species, respectively [26,27]. As listed in Table 3, the Co@NC-800N possesses 64.0% of Co-N x species, but low contents of Coo and Co-C x N y species. In contrast, the lowest amounts of Co-Nx species, but the highest contents of Coo and Co-C x N y species are obtained over Co@NC-800H. The high contents of Co-C x N y species over Co@NC-800H may result from its large amount of sp2 carbon and graphitic-N, which could favor the formation of Co-C x N y species. Fig. S4 illustrates the Raman spectra of these samples prepared via different methods. For all these samples, two dominant bands located at around 1350 cm−1 and 1580 cm−1, which belonged to defective (D) carbon and graphitic (G) carbon respectively, can be observed. The intensity ratio of the D band to G band (ID/IG) reflected the degree of graphitization [25]. The value of ID/IG for Co@NC-800N is 0.65. After the secondary pyrolysis with 10% H2/Ar, the value of ID/IG for Co@NC-800NH decreases, suggesting the increasing degree of graphitization. Furthermore, the Co@NC-800H exhibits the lowest value of ID/IG among these samples. These results imply that the pyrolysis with H2 improves the graphitization degree, which is consistent with the results of XPS. The enhanced graphitization can favor the electronic mobility. The low catalytic activity of Co@NC-500H is due to its lack of activity metal cobalt. The poor catalytic performance of sole NC evidences also confirms that metal cobalt is essential for the hydrogenation of LA, while the inferior activity of Co/AC implies that physicochemical property of carbon support or the interaction between cobalt and N-doped carbon support is also vital. The Co-N x sites have been reported to be the active sites for the selective hydrogenation reactions [25]. In our results, the Co@NC-800N possesses the highest contents of Co-N x species as evidenced by the XPS results, but it only gives a low LA conversion of 26.8%. Thus, it is probably that the Co-N x species is not the highest active sites for the hydrogenation of LA in the present study. As the Co@NC-800NH was treated by the secondary pyrolysis in a flow of 10% H2/Ar, the catalytic activity is improved notably. As revealed by the results of XPS and Raman, the graphitization of carbon matrix and graphitic-N increases apparently after secondary pyrolysis in 10% H2/Ar. The enhanced graphitization carbon matrix and increasing graphitic-N would favor the electronic mobility, probably facilitating the interaction among Co, C and N species. Zhao et al. proposed that the existence of H2 in the pyrolysis gas enhances the electron transfer between Co and carbon matrix [21]. Hence, the pyrolysis in 10% H2/Ar may facilitates the electron transformation among Co, C and N species, probably favors the formation of Co-C x N y species. Compared to Co@NC-800N, an increasing content of Co-C x N y species is observed for Co@NC-800NH as determined by the results of XPS results. Also, as revealed by results of element mapping of Co@NC-800H (Fig. 2h), N element is homogeneously distributed in carbon matrix. The homogeneous distribution of N element suggests the intimate interaction of N with C species. The intimate interaction between N and C would facilitate the formation of Co-C x N y species. Furthermore, when the ZIF-67 precursor was treated in the flow of 10% H2/Ar, the highest amount of Co-C x N y species is obtained for Co@NC-800H. The H2-TPR of Co@NC-800H presents an obvious peak at low temperature at around 200 °C (Fig. S5), which may be corresponded to the dissociative adsorption of H2 over the Co-CxNy sites. Thus, these Co-CxNy species may play important roles on the dissociative adsorption of H2. Also, abundance of oxygen vacancies is detected over Co@NC-800H. As revealed in our previous work [18], these oxygen vacancies favor the adsorption and activation of LA. Hence, with the synergistic catalytic effect between oxygen vacancies and Co-C x N y , the Co@NC-800H presents an excellent catalytic performance for the hydrogenation of LA. In general, the reaction network for the yield of GVL from LA hydrogenation undergoes one of the following two reaction pathways: (1) first hydrogenation of the ketone group of LA to form intermediate 4-hydroxypentanoic acid (HPA), followed by its dehydration and cyclization and subsequent production of GVL, and (2) initial dehydration of LA to α-angelica lactone followed by its hydrogenation to GVL. The former pathway of GVL production is thermodynamically preferred and demonstrated to be the dominant route at low temperature, especially in liquid-phase hydrogenation [13,18,28]. Also, the intermediate angelica lactone is undetected in our reaction conditions, as displayed in Fig. S6. The absence of intermediate angelic lactone indicated that the hydrogenation of LA may undergoes the pathway with 4-hydroxypentanoic acid as reaction intermediate. Based on our experimental results and previous studies in literatures [13,18,28], the possible reaction route is proposed in Scheme 1. The LA will be firstly adsorbed and activated on these surface oxygen vacancies, and then undergoes the hydrodeoxygenation over Co-C x N y sites to form intermediate 4-hydroxypentanoic acid. The 4-hydroxypentanoic acid will undergo dehydration and cyclization catalyzed by acid sites to produce the desired product of GVL. In our work, the amount of acid sites is not directly correlated with the catalytic performance for these catalysts. As listed in the column 8 of Table 2, among these catalysts, the Co/NC and Co/AC catalysts have more acid sites than Co@NC-800H, but their catalytic activity is worse than Co@NC-800H. Perhaps the dehydration and cyclization steps catalyzed by acid sites are not the rate-determining step over these catalysts used in our work. The catalytic activity of these catalysts in our work may be mainly controlled by the adsorption and activation of LA catalyzed by the synergy of Co-CxNy species and oxygen vacancy. Therefore, the excellent catalytic performance of Co@NC-800H is realized via the synergistic effect between oxygen vacancies and Co-C x N y . 3.2 Optimization of the reaction conditions The influences of reaction conditions (H2 pressure, reaction temperature and catalyst loading) on catalytic performance were investigated over Co@NC-800H, the results are presented in Fig. 4 . The effect of H2 pressure was conducted at low temperature of 120 °C for 3 h by varying the H2 pressure in the range of 0.5∼3.0 MPa. As shown in Fig. 4a, the H2 pressure significantly influences the catalytic activity. When the reaction was carried out at low H2 pressure of 0.5 MPa, 41.5% of LA conversion is obtained. The increasing H2 pressure sharply improves the catalytic activity. As the H2 pressure increases to 2.0 MPa, the LA is completely converted, the yield of GVL reaches up to 99%. The further increase of H2 pressure almost not affects the catalytic performance. In the practical application, the harsh reaction condition of high H2 pressure will remarkably raise production costs and increase operating dangers. Hence, we try to explore the catalytic performance of Co@NC-800H at low H2 pressure. When the H2 pressure is fixed at 0.5 MPa, as expected, the elevating reaction temperature obviously increases the conversion of LA (Fig. 4b). More importantly, as illustrated in Fig. 4c, a high yield of GVL up to 99% is achieved over Co@NC-800H at low temperature of 120 °C and low H2 pressure of 0.5 MPa through appropriately adjusting the catalyst loading. From the literature survey, compared the catalytic performance of Co@NC-800H to those reported in previous literatures, as summarized in Table 4 , it is clearly demonstrated that the Co@NC-800H possesses better performance than other non-noble metal catalysts when the catalysts were evaluated under comparable severe reaction condition. 3.3 Catalyst recyclability The reusability of Co@NC-800H was also evaluated. The used catalyst was recovered by centrifugation after each run, washed several times with solvent, dried at 70 °C in a vacuum oven, and then reused in the next run. The recycled experiments were firstly carried out by using deionized water as solvent. As illustrated in in Fig. S7, the catalytic activity decreases notably after each recycle. As mentioned in the experimental section, the cobalt particles in Co@NC-800H can be washed off by nitric acid solution. The substrate of LA solution is also an acidic solution. This acidic LA solution cause the leaching of cobalt metal during the reaction, which is evidenced by the fact that large amounts of cobalt was detected via the analysis of the reaction solution after reaction (Table S2). Thus, the leaching of cobalt leads to the deactivation for the loss of active cobalt metal. However, when the reused experiments were conducted by using 1,4-dioxane as solvent, as shown in Fig. 5 , Co@NC-800H exhibits excellent reusability, a high catalytic performance can maintain for 5 recycled times. This is probably due to the fact that the leaching of cobalt is avoided in the organic solvent. 4 Conclusions In this work, the Co embedded in N-doped carbon as a robust catalyst is designed by pyrolysis of ZIF-67 in 10% H2/Ar flow for the selective hydrogenation of LA to GVL. The optimal catalyst Co@NC-800H achieves excellent catalytic performance with a yield of GVL up to 99% under mild reaction conditions (120 °C and 0.5 MPa H2). Also, the optimal Co@NC-800H catalyst exhibits excellent reusability. The excellent catalytic performance of Co@NC-800H is achieved through the synergistic catalysis between oxygen vacancies and Co-C x N y sites. CRediT authorship contribution statement Jingjing Lu: Investigation, Data curation, Writing – original draft. Yan Wei: Validation. Kaiyun Lu: . Chengming Wu: Validation. Xiaoyao Nong: Validation. Jifan Li: Data curation, Writing – original draft, Writing – review & editing, Supervision, Funding acquisition. Chun-Ling Liu: Writing – review & editing, Supervision. Wen-Sheng Dong: Writing – review & editing, Supervision, Funding acquisition. Declaration of Competing Interest This manuscript, or its contents in any other form, has not been published previously by any of the authors and/or is not under consideration for publication in another journal at the time of submission, and that its submission for publication has been approved by all of the authors. We have no any conflicts of interest and have not received any funding support. Acknowledgments The authors gratefully acknowledge financial support from the National Natural Science Foundation of China (22178212) and the Natural Science Foundation of Shaanxi Provincial (2022JM-073). Supplementary materials Supplementary material associated with this article can be found, in the online version, at doi:10.1016/j.mcat.2022.112409. Appendix Supplementary materials Image, application 1 References [1] A. Seretis P. Diamantopoulou L. Thanou P. Tzevelekidis C. Fakas P. Lilas G. Papadogianakis Recent advances in ruthenium-catalyzed hydrogenation reactions of renewable biomass-derived levulinic acid in aqueous media Front. Chem. 8 2020 221 A. Seretis, P. Diamantopoulou, L. Thanou, P. Tzevelekidis, C. Fakas, P. Lilas, G. Papadogianakis, Recent advances in ruthenium-catalyzed hydrogenation reactions of renewable biomass-derived levulinic acid in aqueous media, Front. Chem. 8 (2020) 221. [2] W. Luo W. Cao P.C.A. Bruijnincx L. Lin A. Wang T. Zhang Zeolite-supported metal catalysts for selective hydrodeoxygenation of biomass-derived platform molecules Green Chem. 21 2019 3744 3768 W. Luo, W. Cao, P.C.A. Bruijnincx, L. Lin, A. Wang, T. Zhang, Zeolite-supported metal catalysts for selective hydrodeoxygenation of biomass-derived platform molecules, Green Chem.. 21 (2019) 3744-3768. [3] N. Karanwal M.G. Sibi M.K. Khan A.A. Myint B.C. Ryu J.W. Kang J. Kim Trimetallic Cu-Ni-Zn/H-ZSM-5 catalyst for the one-pot conversion of levulinic acid to high-yield 1,4-pentanediol under mild conditions in an aqueous medium ACS Catal. 11 2021 2846 2864 N. Karanwal, M.G. Sibi, M.K. Khan, A.A. Myint, B.C. Ryu, J.W. Kang, J. Kim, Trimetallic Cu-Ni-Zn/H-ZSM-5 catalyst for the one-pot conversion of levulinic acid to high-yield 1,4-pentanediol under mild conditions in an aqueous medium, ACS Catal.. 11 (2021) 2846-2864. [4] S. Duttaa I.K. Yu D.C. Tsanga Y.H. Ng Y.S. Ok J. Sherwoodb J.H. Clark Green synthesis of gamma-valerolactone (GVL) through hydrogenation of biomass-derived levulinic acid using non-noble metal catalysts: a critical review Chem. Eng. J. 372 2019 992 1006 S. Duttaa, I.K. Yu, D.C. Tsanga, Y.H. Ng, Y.S. Ok, J. Sherwoodb, J.H. Clark, Green synthesis of gamma-valerolactone (GVL) through hydrogenation of biomass-derived levulinic acid using non-noble metal catalysts: a critical review, Chem. Eng. J. 372 (2019) 992-1006. [5] Z. Xue Q. Liu J. Wang T. Mu Valorization of levulinic acid over non-noble metal catalysts: challenges and opportunities Green Chem. 20 2018 4391 4408 Z. Xue, Q. Liu, J. Wang, T. Mu, Valorization of levulinic acid over non-noble metal catalysts: challenges and opportunities, Green Chem.. 20 (2018) 4391-4408. [6] A.M.R. Galletti C. Antonetti V.D. Luise M. Martinelli A sustainable process for the production of γ-valerolactone by hydrogenation of biomass-derived levulinic acid Green Chem. 14 2012 688 694 A.M.R. Galletti, C. Antonetti, V.D. Luise, M. Martinelli, A sustainable process for the production of γ-valerolactone by hydrogenation of biomass-derived levulinic acid, Green Chem.. 14 (2012) 688-694. [7] W.R.H. Wright R. Palkovits Development of heterogeneous catalysts for the conversion of levulinic acid to γ-valerolactone ChemSusChem 5 2012 1657 1667 W.R.H. Wright, R. Palkovits, Development of heterogeneous catalysts for the conversion of levulinic acid to γ-valerolactone, ChemSusChem 5 (2012) 1657-1667. [8] K. Yan T. Lafleur C. Jarvis G. Wu Clean and selective production of γ-valerolactone from biomass-derived levulinic acid catalyzed by recyclable Pd nanoparticle catalyst J. Clean. Prod. 72 2014 230 232 K. Yan, T. Lafleur, C. Jarvis, G. Wu, Clean and selective production of γ-valerolactone from biomass-derived levulinic acid catalyzed by recyclable Pd nanoparticle catalyst, J. Clean. Prod. 72 (2014) 230-232. [9] X. Du Y. Liu J. Wang Y. Cao K. Fan Catalytic conversion of biomass-derived levulinic acid into γ-valerolactone using iridium nanoparticles supported on carbon nanotubes Chin. J. Catal. 34 2013 993 1001 X. Du, Y. Liu, J. Wang, Y. Cao, K. Fan, Catalytic conversion of biomass-derived levulinic acid into γ-valerolactone using iridium nanoparticles supported on carbon nanotubes, Chin. J. Catal. 34 (2013) 993-1001. [10] C. Xiao T. Goh Z. Qi S. Goes K. Brashler C. Perez W. Huang Conversion of levulinic acid to γ-valerolactone over few-layer graphene-supported ruthenium catalysts ACS Catal. 6 2016 593 599 C. Xiao, T. Goh, Z. Qi, S. Goes, K. Brashler, C. Perez, W. Huang, Conversion of levulinic acid to γ-valerolactone over few-layer graphene-supported ruthenium catalysts, ACS Catal.. 6 (2016) 593-599. [11] J. Tan J. Cui T. Deng X. Cui G. Ding Y. Zhu Y. Li Water-promoted hydrogenation of levulinic acid to γ-valerolactone on supported ruthenium catalyst ChemCatChem 7 2015 508 512 J. Tan, J. Cui, T. Deng, X. Cui, G. Ding, Y. Zhu, Y. Li, Water-promoted hydrogenation of levulinic acid to γ-valerolactone on supported ruthenium catalyst, ChemCatChem7 (2015) 508-512. [12] J. Li L. Zhao J. Li M. Li C. Liu R. Yang W. Dong Highly selective synthesis of γ-valerolactone from levulinic acid at mild conditions catalyzed by boron oxide doped Cu/ZrO2 catalysts Appl. Catal. A Gen. 587 2019 117244 J. Li, L. Zhao, J. Li, M. Li, C. Liu, R. Yang, W. Dong, Highly selective synthesis of γ-valerolactone from levulinic acid at mild conditions catalyzed by boron oxide doped Cu/ZrO2 catalysts, Appl. Catal. A Gen. 587 (2019) 117244. [13] D. Liu L. Zhang W. Han M. Tang L. Zhou Y. Zhang X. Li Z. Qin H. Yang One-step fabrication of Ni-embedded hierarchically-porous carbon microspheres for levulinic acid hydrogenation Chem. Eng. J. 369 2019 386 393 D. Liu, L. Zhang, W. Han, M. Tang, L. Zhou, Y. Zhang, X. Li, Z. Qin, H. Yang, One-step fabrication of Ni-embedded hierarchically-porous carbon microspheres for levulinic acid hydrogenation, Chem. Eng. J. 369 (2019) 386-393. [14] M. Sun J. Xia H. Wang X. Liu Q. Xia Y. Wang An efficient NixZryO catalyst for hydrogenation of bio-derived methyl levulinate to γ-valerolactone in water under low hydrogen pressure Appl. Catal. B Environ. 227 2018 488 498 M. Sun, J. Xia, H. Wang, X. Liu, Q. Xia, Y. Wang, An efficient NixZryO catalyst for hydrogenation of bio-derived methyl levulinate to γ-valerolactone in water under low hydrogen pressure, Appl. Catal. B Environ. 227 (2018) 488-498. [15] A.M. Hengne C.V. Rode Cu-ZrO2 nanocomposite catalyst for selective hydrogenation of levulinic acid and its ester to γ-valerolactone Green Chem. 14 2012 1064 1072 A.M. Hengne, C.V. Rode, Cu-ZrO2 nanocomposite catalyst for selective hydrogenation of levulinic acid and its ester to γ-valerolactone, Green Chem.. 14 (2012) 1064-1072. [16] K. Hengst D.M. Ligthart D.E. Doronkin K.M. Walter W. Kleist E.J. Hensen J. Grunwaldt Continuous synthesis of γ-valerolactone in a trickle-bed reactor over supported nickel catalysts Ind. Eng. Chem. Res. 56 2017 2680 2689 K. Hengst, D.M. Ligthart, D.E. Doronkin, K.M. Walter, W. Kleist, E.J. Hensen, J. Grunwaldt, Continuous synthesis of γ-valerolactone in a trickle-bed reactor over supported nickel catalysts, Ind. Eng. Chem. Res. 56 (2017) 2680-2689. [17] X. Long P. Sun Z. Li R. Lang C. Xia F. Li Magnetic Co/Al2O3 catalyst derived from hydrotalcite for hydrogenation of levulinic acid to γ-valerolactone Chin. J. Catal. 36 2015 1512 1518 X. Long, P. Sun, Z. Li, R. Lang, C. Xia, F. Li, Magnetic Co/Al2O3 catalyst derived from hydrotalcite for hydrogenation of levulinic acid to γ-valerolactone, Chin. J. Catal. 36 (2015) 1512-1518. [18] J. Li M. Li C. Zhang C. Liu R. Yang W. Dong Construction of mesoporous Cu/ZrO2-Al2O3 as a ternary catalyst for efficient synthesis of γ-valerolactone from levulinic acid at low temperature J. Catal. 381 2020 163 174 J. Li, M. Li, C. Zhang, C. Liu, R. Yang, W. Dong, Construction of mesoporous Cu/ZrO2-Al2O3 as a ternary catalyst for efficient synthesis of γ-valerolactone from levulinic acid at low temperature, J. Catal. 381 (2020) 163-174. [19] Y. Lian T. Fang Y. Zhang B. Liu J. Li Hydrogenation of CO2 to alcohol species over Co@Co3O4/C-N catalysts J. Catal. 379 2019 46 51 Y. Lian, T. Fang, Y. Zhang, B. Liu, J. Li, Hydrogenation of CO2 to alcohol species over Co@Co3O4/C-N catalysts, J. Catal. 379 (2019) 46-51. [20] K. Shen X. Chen J. Chen Y. Li Development of MOF-derived carbon-based nanomaterials for efficient catalysis ACS Catal. 6 2016 5887 5903 K. Shen, X. Chen, J. Chen, Y. Li, Development of MOF-derived carbon-based nanomaterials for efficient catalysis, ACS Catal.. 6 (2016) 5887-5903. [21] T. Zhao Y. Hui Z.Li Niamatullah Controllable preparation of ZIF-67 derived catalyst for CO2 methanation Mol. Catal. 474 2019 110421 T. Zhao, Y. Hui, Z.Li Niamatullah, Controllable preparation of ZIF-67 derived catalyst for CO2 methanation, Mol. Catal. 474 (2019) 110421. [22] J. Liu A. Zhang M. Liu S. Hu F. Ding C. Song X. Guo Fe-MOF-derived highly active catalysts for carbon dioxide hydrogenation to valuable hydrocarbons J. CO2 Util. 21 2017 100 107 J. Liu, A. Zhang, M. Liu, S. Hu, F. Ding, C. Song, X. Guo, Fe-MOF-derived highly active catalysts for carbon dioxide hydrogenation to valuable hydrocarbons, J. CO2 Util. 21 (2017) 100-107. [23] X. Kong W. Geng W. Li L. Liu X. Yan L. Gong J. Liu Co encapsulated N-doped carbon nanotubes as robust catalyst for valorization of levulinic acid in aqueous media J. Energy Chem. 52 2021 12 19 X. Kong, W. Geng, W. Li, L. Liu, X. Yan, L. Gong, J. Liu, Co encapsulated N-doped carbon nanotubes as robust catalyst for valorization of levulinic acid in aqueous media, J. Energy Chem. 52 (2021) 12-19. [24] G. Zhang D. Yang E. Sacher Structure and morphology of Co nanoparticles deposited onto highly oriented pyrolytic graphite J. Phys. Chem. C 111 2007 17200 17205 G. Zhang, D. Yang, E. Sacher, Structure and morphology of Co nanoparticles deposited onto highly oriented pyrolytic graphite, J. Phys. Chem. C. 111 (2007) 17200-17205. [25] W. Gong Y. Lin C. Chen M. Al-Mamun H. Lu G. Wang H. Zhang H. Zhao Nitrogen-doped carbon nanotube confined Co-Nx sites for selective hydrogenation of biomass-derived compounds Adv. Mater. 31 2019 1808341 1808349 W. Gong, Y. Lin, C. Chen, M. Al-Mamun, H. Lu, G. Wang, H. Zhang, H. Zhao, Nitrogen-doped carbon nanotube confined Co-Nx sites for selective hydrogenation of biomass-derived compounds, Adv. Mater. 31 (2019) 1808341-1808349. [26] Z. Liang N. Kong C. Yang W. Zhang H. Zheng H. Lin R. Cao Highly curved nanostructure-coated Co, N-doped carbon materials for oxygen electrocatalysis Angew. Chem. Int. Ed. 60 2021 1 7 Z. Liang, N. Kong, C. Yang, W. Zhang, H. Zheng, H. Lin, R. Cao, Highly curved nanostructure-coated Co, N-doped carbon materials for oxygen electrocatalysis, Angew. Chem. Int. Ed. 60 (2021) 1-7. [27] Y. Chen C. Wang Z. Wu Y. Xiong Q. Xu S. Yu H. Jiang From bimetallic metal-organic framework to porous carbon: high surface area and multicomponent active dopants for excellent electrocatalysis Adv. Mater. 27 2015 5010 5016 Y. Chen, C. Wang, Z. Wu, Y. Xiong, Q. Xu, S. Yu, H. Jiang, From bimetallic metal-organic framework to porous carbon: high surface area and multicomponent active dopants for excellent electrocatalysis, Adv. Mater. 27 (2015) 5010-5016. [28] X. Gao S. Zhu M. Dong J. Wang W. Fan Ru nanoparticles deposited on ultrathin TiO2 nanosheets as highly active catalyst for levulinic acid hydrogenation to γ-valerolactone Appl. Catal. B Environ. 259 2019 118076 X. Gao, S. Zhu, M. Dong, J. Wang, W. Fan, Ru nanoparticles deposited on ultrathin TiO2 nanosheets as highly active catalyst for levulinic acid hydrogenation to γ-valerolactone, Appl. Catal. B Environ. 259 (2019) 118076. [29] W. Li W. Geng L. Liu Q. Shang L. Liu X. Kong In situ-generated Co embedded in N-doped carbon hybrids as robust catalysts for the upgrading of levulinic acid in aqueous phase Sustain. Energy Fuels 4 2020 2043 2054 W. Li, W. Geng, L. Liu, Q. Shang, L. Liu and X. Kong, In situ-generated Co embedded in N-doped carbon hybrids as robust catalysts for the upgrading of levulinic acid in aqueous phase, Sustain. Energy Fuels. 4 (2020) 2043-2054. [30] Y. Shao L. Zhou L. Yu Z. Li Y. Li W. Li T. Hu In situ construction of a Co/ZnO@C heterojunction catalyst for efficient hydrogenation of biomass derivative under mild conditions ACS Appl. Mater. 14 2022 17195 17207 Y. Shao, L. Zhou, L. Yu, Z. Li, Y. Li, W. Li and T. Hu, In situ construction of a Co/ZnO@C heterojunction catalyst for efficient hydrogenation of biomass derivative under mild conditions, ACS Appl. Mater. 14 (2022) 17195-17207. [31] D.T. To Y.C. Chiang J.F. Lee C.L. Chen Y.C. Lin Nitrogen-doped Co catalyst derived from carbothermal reduction of cobalt phyllosilicate and its application in levulinic acid hydrogenation to γ-valerolactone Catal. Lett. 2021 1 11 D.T. To, Y.C. Chiang, J.F. Lee, C.L. Chen and Y.C. Lin, Nitrogen-doped Co catalyst derived from carbothermal reduction of cobalt phyllosilicate and its application in levulinic acid hydrogenation to γ-valerolactone, Catal. Lett.. (2021) 1-11. [32] L. Jiang G. Xu Y. Fu A nitrogen-doped carbon modified nickel catalyst for the hydrogenation of levulinic acid under mild conditions Green Chem. 23 2021 7065 7073 L. Jiang, G. Xu and Y. Fu, A nitrogen-doped carbon modified nickel catalyst for the hydrogenation of levulinic acid under mild conditions, Green Chem.. 23 (2021) 7065-7073. [33] Y. Shao K. Sun Q. Li Q. Liu S. Zhang Q. Liu G. Hu X. Hu Copper-based catalysts with tunable acidic and basic sites for the selective conversion of levulinic acid/ester to γ-valerolactone or 1,4-pentanediol Green Chem. 21 2019 4499 4511 Y. Shao, K. Sun, Q. Li, Q. Liu, S. Zhang, Q. Liu, G. Hu, X. Hu, Copper-based catalysts with tunable acidic and basic sites for the selective conversion of levulinic acid/ester to γ-valerolactone or 1,4-pentanediol, Green Chem.. 21 (2019) 4499-4511",
      "scopus-id": "85131683669",
      "coredata": {
        "eid": "1-s2.0-S2468823122002954",
        "dc:description": "The rational design of non-noble metal catalysts for the highly efficient production of γ-valerolactone (GVL) from the selective hydrogenation of levulinic acid (LA) at mild reaction conditions is still a big challenge. In this work, the Co embedded in N-doped carbon as a robust catalyst is fabricated by in situ carbonizing ZIF-67 for the LA selective hydrogenation to GVL. Several catalysts that differed in pyrolysis temperatures, pyrolysis gas and preparation methods were prepared and evaluated. The optimal catalytic performance is achieved with Co@NC-800H, which realizes a up to 99% yield of GVL at low temperature of 120 °C and low hydrogen pressure of 0.5 MPa. Also, the optimal Co@NC-800H catalyst exhibits excellent reusability. By the careful characterizations with multiple techniques, including BET, XRD, SEM, TEM, XPS and Raman, it is found that the excellent catalytic performance of Co@NC-800H is achieved through the synergistic catalysis between oxygen vacancies and Co-C x N y sites.",
        "openArchiveArticle": "false",
        "prism:coverDate": "2022-07-31",
        "openaccessUserLicense": null,
        "prism:aggregationType": "Journal",
        "prism:url": "https://api.elsevier.com/content/article/pii/S2468823122002954",
        "dc:creator": [
          {
            "@_fa": "true",
            "$": "Lu, Jingjing"
          },
          {
            "@_fa": "true",
            "$": "Wei, Yan"
          },
          {
            "@_fa": "true",
            "$": "Lu, Kaiyun"
          },
          {
            "@_fa": "true",
            "$": "Wu, Chengming"
          },
          {
            "@_fa": "true",
            "$": "Nong, Xiaoyao"
          },
          {
            "@_fa": "true",
            "$": "Li, Jifan"
          },
          {
            "@_fa": "true",
            "$": "Liu, Chun-Ling"
          },
          {
            "@_fa": "true",
            "$": "Dong, Wen-Sheng"
          }
        ],
        "link": [
          {
            "@_fa": "true",
            "@rel": "self",
            "@href": "https://api.elsevier.com/content/article/pii/S2468823122002954"
          },
          {
            "@_fa": "true",
            "@rel": "scidir",
            "@href": "https://www.sciencedirect.com/science/article/pii/S2468823122002954"
          }
        ],
        "dc:format": "application/json",
        "openaccessType": null,
        "pii": "S2468-8231(22)00295-4",
        "prism:volume": "527",
        "articleNumber": "112409",
        "prism:publisher": "Elsevier B.V.",
        "dc:title": "Co-C x N y embedded in N-doped carbon as robust catalysts for the synthesis of γ-valerolactone from the hydrogenation of levulinic acid under low hydrogen pressure",
        "prism:copyright": "© 2022 Elsevier B.V. All rights reserved.",
        "openaccess": "0",
        "prism:issn": "24688231",
        "dcterms:subject": [
          {
            "@_fa": "true",
            "$": "ZIF-67"
          },
          {
            "@_fa": "true",
            "$": "Levulinic acid"
          },
          {
            "@_fa": "true",
            "$": "γ-valerolactone"
          },
          {
            "@_fa": "true",
            "$": "Oxygen vacancies"
          },
          {
            "@_fa": "true",
            "$": "Co-C x N y"
          }
        ],
        "openaccessArticle": "false",
        "prism:publicationName": "Molecular Catalysis",
        "openaccessSponsorType": null,
        "prism:pageRange": "112409",
        "pubType": "fla",
        "prism:coverDisplayDate": "July 2022",
        "prism:doi": "10.1016/j.mcat.2022.112409",
        "prism:startingPage": "112409",
        "dc:identifier": "doi:10.1016/j.mcat.2022.112409",
        "openaccessSponsorName": null
      },
      "objects": {
        "object": [
          {
            "@category": "standard",
            "@height": "297",
            "@width": "386",
            "@_fa": "true",
            "$": "https://api.elsevier.com/content/object/eid/1-s2.0-S2468823122002954-gr5.jpg?httpAccept=%2A%2F%2A",
            "@multimediatype": "JPEG image file",
            "@type": "IMAGE-DOWNSAMPLED",
            "@size": "31890",
            "@ref": "gr5",
            "@mimetype": "image/jpeg"
          },
          {
            "@category": "standard",
            "@height": "859",
            "@width": "386",
            "@_fa": "true",
            "$": "https://api.elsevier.com/content/object/eid/1-s2.0-S2468823122002954-gr4.jpg?httpAccept=%2A%2F%2A",
            "@multimediatype": "JPEG image file",
            "@type": "IMAGE-DOWNSAMPLED",
            "@size": "219635",
            "@ref": "gr4",
            "@mimetype": "image/jpeg"
          },
          {
            "@category": "standard",
            "@height": "678",
            "@width": "386",
            "@_fa": "true",
            "$": "https://api.elsevier.com/content/object/eid/1-s2.0-S2468823122002954-gr1.jpg?httpAccept=%2A%2F%2A",
            "@multimediatype": "JPEG image file",
            "@type": "IMAGE-DOWNSAMPLED",
            "@size": "113899",
            "@ref": "gr1",
            "@mimetype": "image/jpeg"
          },
          {
            "@category": "standard",
            "@height": "713",
            "@width": "809",
            "@_fa": "true",
            "$": "https://api.elsevier.com/content/object/eid/1-s2.0-S2468823122002954-gr3.jpg?httpAccept=%2A%2F%2A",
            "@multimediatype": "JPEG image file",
            "@type": "IMAGE-DOWNSAMPLED",
            "@size": "214411",
            "@ref": "gr3",
            "@mimetype": "image/jpeg"
          },
          {
            "@category": "standard",
            "@height": "966",
            "@width": "563",
            "@_fa": "true",
            "$": "https://api.elsevier.com/content/object/eid/1-s2.0-S2468823122002954-gr2.jpg?httpAccept=%2A%2F%2A",
            "@multimediatype": "JPEG image file",
            "@type": "IMAGE-DOWNSAMPLED",
            "@size": "177401",
            "@ref": "gr2",
            "@mimetype": "image/jpeg"
          },
          {
            "@category": "standard",
            "@height": "140",
            "@width": "301",
            "@_fa": "true",
            "$": "https://api.elsevier.com/content/object/eid/1-s2.0-S2468823122002954-ga1.jpg?httpAccept=%2A%2F%2A",
            "@multimediatype": "JPEG image file",
            "@type": "IMAGE-DOWNSAMPLED",
            "@size": "15254",
            "@ref": "ga1",
            "@mimetype": "image/jpeg"
          },
          {
            "@category": "standard",
            "@height": "356",
            "@width": "762",
            "@_fa": "true",
            "$": "https://api.elsevier.com/content/object/eid/1-s2.0-S2468823122002954-sc1.jpg?httpAccept=%2A%2F%2A",
            "@multimediatype": "JPEG image file",
            "@type": "IMAGE-DOWNSAMPLED",
            "@size": "46631",
            "@ref": "sc1",
            "@mimetype": "image/jpeg"
          },
          {
            "@category": "thumbnail",
            "@height": "164",
            "@width": "213",
            "@_fa": "true",
            "$": "https://api.elsevier.com/content/object/eid/1-s2.0-S2468823122002954-gr5.sml?httpAccept=%2A%2F%2A",
            "@multimediatype": "GIF image file",
            "@type": "IMAGE-THUMBNAIL",
            "@size": "9146",
            "@ref": "gr5",
            "@mimetype": "image/gif"
          },
          {
            "@category": "thumbnail",
            "@height": "162",
            "@width": "73",
            "@_fa": "true",
            "$": "https://api.elsevier.com/content/object/eid/1-s2.0-S2468823122002954-gr4.sml?httpAccept=%2A%2F%2A",
            "@multimediatype": "GIF image file",
            "@type": "IMAGE-THUMBNAIL",
            "@size": "8319",
            "@ref": "gr4",
            "@mimetype": "image/gif"
          },
          {
            "@category": "thumbnail",
            "@height": "163",
            "@width": "93",
            "@_fa": "true",
            "$": "https://api.elsevier.com/content/object/eid/1-s2.0-S2468823122002954-gr1.sml?httpAccept=%2A%2F%2A",
            "@multimediatype": "GIF image file",
            "@type": "IMAGE-THUMBNAIL",
            "@size": "9202",
            "@ref": "gr1",
            "@mimetype": "image/gif"
          },
          {
            "@category": "thumbnail",
            "@height": "164",
            "@width": "186",
            "@_fa": "true",
            "$": "https://api.elsevier.com/content/object/eid/1-s2.0-S2468823122002954-gr3.sml?httpAccept=%2A%2F%2A",
            "@multimediatype": "GIF image file",
            "@type": "IMAGE-THUMBNAIL",
            "@size": "15992",
            "@ref": "gr3",
            "@mimetype": "image/gif"
          },
          {
            "@category": "thumbnail",
            "@height": "163",
            "@width": "95",
            "@_fa": "true",
            "$": "https://api.elsevier.com/content/object/eid/1-s2.0-S2468823122002954-gr2.sml?httpAccept=%2A%2F%2A",
            "@multimediatype": "GIF image file",
            "@type": "IMAGE-THUMBNAIL",
            "@size": "13784",
            "@ref": "gr2",
            "@mimetype": "image/gif"
          },
          {
            "@category": "thumbnail",
            "@height": "102",
            "@width": "219",
            "@_fa": "true",
            "$": "https://api.elsevier.com/content/object/eid/1-s2.0-S2468823122002954-ga1.sml?httpAccept=%2A%2F%2A",
            "@multimediatype": "GIF image file",
            "@type": "IMAGE-THUMBNAIL",
            "@size": "8388",
            "@ref": "ga1",
            "@mimetype": "image/gif"
          },
          {
            "@category": "thumbnail",
            "@height": "102",
            "@width": "219",
            "@_fa": "true",
            "$": "https://api.elsevier.com/content/object/eid/1-s2.0-S2468823122002954-sc1.sml?httpAccept=%2A%2F%2A",
            "@multimediatype": "GIF image file",
            "@type": "IMAGE-THUMBNAIL",
            "@size": "8280",
            "@ref": "sc1",
            "@mimetype": "image/gif"
          },
          {
            "@category": "high",
            "@height": "1316",
            "@width": "1708",
            "@_fa": "true",
            "$": "https://api.elsevier.com/content/object/eid/1-s2.0-S2468823122002954-gr5_lrg.jpg?httpAccept=%2A%2F%2A",
            "@multimediatype": "JPEG image file",
            "@type": "IMAGE-HIGH-RES",
            "@size": "201348",
            "@ref": "gr5",
            "@mimetype": "image/jpeg"
          },
          {
            "@category": "high",
            "@height": "3801",
            "@width": "1708",
            "@_fa": "true",
            "$": "https://api.elsevier.com/content/object/eid/1-s2.0-S2468823122002954-gr4_lrg.jpg?httpAccept=%2A%2F%2A",
            "@multimediatype": "JPEG image file",
            "@type": "IMAGE-HIGH-RES",
            "@size": "2535803",
            "@ref": "gr4",
            "@mimetype": "image/jpeg"
          },
          {
            "@category": "high",
            "@height": "2998",
            "@width": "1708",
            "@_fa": "true",
            "$": "https://api.elsevier.com/content/object/eid/1-s2.0-S2468823122002954-gr1_lrg.jpg?httpAccept=%2A%2F%2A",
            "@multimediatype": "JPEG image file",
            "@type": "IMAGE-HIGH-RES",
            "@size": "802691",
            "@ref": "gr1",
            "@mimetype": "image/jpeg"
          },
          {
            "@category": "high",
            "@height": "3157",
            "@width": "3583",
            "@_fa": "true",
            "$": "https://api.elsevier.com/content/object/eid/1-s2.0-S2468823122002954-gr3_lrg.jpg?httpAccept=%2A%2F%2A",
            "@multimediatype": "JPEG image file",
            "@type": "IMAGE-HIGH-RES",
            "@size": "1949364",
            "@ref": "gr3",
            "@mimetype": "image/jpeg"
          },
          {
            "@category": "high",
            "@height": "4274",
            "@width": "2492",
            "@_fa": "true",
            "$": "https://api.elsevier.com/content/object/eid/1-s2.0-S2468823122002954-gr2_lrg.jpg?httpAccept=%2A%2F%2A",
            "@multimediatype": "JPEG image file",
            "@type": "IMAGE-HIGH-RES",
            "@size": "1679658",
            "@ref": "gr2",
            "@mimetype": "image/jpeg"
          },
          {
            "@category": "high",
            "@height": "622",
            "@width": "1333",
            "@_fa": "true",
            "$": "https://api.elsevier.com/content/object/eid/1-s2.0-S2468823122002954-ga1_lrg.jpg?httpAccept=%2A%2F%2A",
            "@multimediatype": "JPEG image file",
            "@type": "IMAGE-HIGH-RES",
            "@size": "101603",
            "@ref": "ga1",
            "@mimetype": "image/jpeg"
          },
          {
            "@category": "high",
            "@height": "1575",
            "@width": "3375",
            "@_fa": "true",
            "$": "https://api.elsevier.com/content/object/eid/1-s2.0-S2468823122002954-sc1_lrg.jpg?httpAccept=%2A%2F%2A",
            "@multimediatype": "JPEG image file",
            "@type": "IMAGE-HIGH-RES",
            "@size": "413613",
            "@ref": "sc1",
            "@mimetype": "image/jpeg"
          },
          {
            "@category": "standard",
            "@_fa": "true",
            "$": "https://api.elsevier.com/content/object/eid/1-s2.0-S2468823122002954-mmc1.docx?httpAccept=%2A%2F%2A",
            "@multimediatype": "Microsoft Word file",
            "@type": "APPLICATION",
            "@size": "713715",
            "@ref": "mmc1",
            "@mimetype": "application/word"
          },
          {
            "@category": "standard",
            "@_fa": "true",
            "$": "https://api.elsevier.com/content/object/eid/1-s2.0-S2468823122002954-am.pdf?httpAccept=%2A%2F%2A",
            "@multimediatype": "Acrobat PDF file",
            "@type": "AAM-PDF",
            "@size": "1389147",
            "@ref": "am",
            "@mimetype": "application/pdf"
          }
        ]
      },
      "link": {
        "@rel": "abstract",
        "@href": "https://api.elsevier.com/content/abstract/scopus_id/85131683669"
      }
    }
  }
}