{
  "metadata": {
    "title": "N, S co-doped carbon film wrapped Co nanoparticles for boosting oxygen reduction reaction",
    "authors": "; ; ",
    "journal": "Molecular Catalysis",
    "date": "2023-04-15",
    "doi": "10.1016/j.mcat.2023.113102",
    "abstract": "",
    "uri": "https://api.elsevier.com/content/article/pii/S2468823123001888",
    "pii": "S2468823123001888"
  },
  "fulltext": {
    "full-text-retrieval-response": {
      "scopus-eid": "2-s2.0-85151460509",
      "originalText": "serial JL 315758 291210 291744 291790 291809 31 Molecular Catalysis MOLECULARCATALYSIS 2023-03-28 2023-03-28 2023-03-28 2023-03-28 2023-04-14T11:57:02 1-s2.0-S2468823123001888 S2468-8231(23)00188-8 S2468823123001888 10.1016/j.mcat.2023.113102 S300 S300.1 FULL-TEXT 1-s2.0-S2468823123X00078 2024-06-26T17:47:58.02126Z 0 0 20230415 2023 2023-03-28T23:22:57.612846Z absattachment articleinfo articlenumber articletitlenorm authfirstinitialnorm authfirstsurnamenorm cid cids contenttype copyright crossmark dateloaded dateloadedtxt datesearch datesort dateupdated dco docsubtype doctype doi eid ewtransactionid hubeid indexeddate issn issnnorm itemstage itemtransactionid itemweight openaccess openarchive pg pgfirst pii piinorm pubdatestart pubdatetxt pubyr sectiontitle sortorder srctitle srctitlenorm srctype ssids alllist content subj subheadings suppl tomb volfirst volissue volumelist webpdf webpdfpagecount yearnav figure table e-component body mmlmath acknowledge affil appendices articletitle auth authfirstini authfull authkeywords authlast footnotes grantnumber grantsponsor grantsponsorid highlightsabst orcid primabst ref specialabst 2468-8231 24688231 true 541 541 C Volume 541 31 113102 113102 113102 20230415 15 April 2023 2023-04-15 2023 Regular Papers article fla © 2023 Elsevier B.V. All rights reserved. NSCODOPEDCARBONFILMWRAPPEDCONANOPARTICLESFORBOOSTINGOXYGENREDUCTIONREACTION HUANG K 1 Introduction 2 Experimental section 2.1 Chemicals and materials 2.2 Synthesis of the cobalt-modified N and S co-doped carbon catalyst 2.3 Physical characterizations 2.4 Electrochemical measurements 2.5 Zn-air battery measurements 3 Results and discussion 4 Conclusion CRediT authorship contribution statement Acknowledgements Appendix Supplementary materials References PEGIS 2018 2340 2391 M LI 2017 1370 1377 Y YUAN 2023 112805 R TIAN 2020 45 68 X WU 2011 443 447 G WANG 2015 3433 3467 Y ETESAMI 2020 110834 M LUO 2022 149 157 Y ZHANG 2022 1433 1443 L MUNARRIZ 2022 14517 14526 J YAN 2022 36 45 Z LI 2020 19209 19216 J AN 2022 112589 H FAN 2023 141514 F XIA 2016 2650 2676 W WANG 2019 24 30 T MA 2020 227659 Y NORSKOV 2004 17886 17892 J HUANG 2019 478 485 K JIN 2020 818 823 H XU 2019 311 320 X ASEFA 2017 10703 10713 T HU 2018 33124 33134 C SHARMA 2019 1205 1216 K LAI 2020 119086 C YUAN 2020 2404 2412 K YANG 2018 184 190 H ALSHAHATEISSA 2020 23436 23454 A SIAHKALROUDI 2021 111372 Z ZHANG 2020 1004 1014 H WU 2022 347 353 S SVANE 2021 230 237 K ZHU 2019 624 631 M WU 2014 1450 1455 Z HUANG 2021 100579 K YOU 2015 7068 7076 B AHN 2017 1603437 S WU 2016 468 478 M DU 2019 1017 1025 C DUAN 2023 940 948 D CHEN 2015 20674 20684 B JIA 2019 3390 3400 N HE 2019 24184 24196 X LIAN 2020 1907368 Y XIE 2020 97 W LI 2020 100455 Y LIU 2019 277 283 D HUANG 2021 30090 30100 K SHU 2019 520 528 J LIU 2022 971 977 J WEI 2022 112 119 W DING 2023 141548 F WANG 2021 100659 S AHSAN 2022 3919 3929 M LIN 2022 230926 S LING 2020 15193 15196 Y SON 2023 e202201528 D YUAN 2020 282 286 Y ZHENG 2023 675 683 H ZHANG 2022 115898 T SHENG 2022 154221 K LV 2020 8391 8401 L FAN 2023 450 458 F WU 2021 148262 W CHEN 2023 142030 Z SHEN 2015 1207 1218 M KONG 2018 544 552 W ZHANG 2018 e1800423 W QU 2022 139604 X HUANGX2023X113102 HUANGX2023X113102XK 2025-03-28T00:00:00.000Z 2025-03-28T00:00:00.000Z http://creativecommons.org/licenses/by-nc-nd/4.0/ © 2023 Elsevier B.V. All rights reserved. 2023-04-08T08:12:06.137Z http://vtw.elsevier.com/data/voc/AddOnTypes/50.7/aggregated-refined Natural Science Foundation of Guangxi Province 2019GXNSFGA245003 2021GXNSFBA220077 Natural Science Foundation of Guangxi Province http://data.elsevier.com/vocabulary/SciValFunders/501100004607 http://sws.geonames.org/1814991/ National Natural Science Foundation of China 22102035 22162006 NSFC National Natural Science Foundation of China http://data.elsevier.com/vocabulary/SciValFunders/501100001809 http://sws.geonames.org/1814991/ This work was supported by the National Natural Science Foundation of China ( 22162006 , 22102035 ) and Natural Science Foundation of Guangxi Province ( 2019GXNSFGA245003 , 2021GXNSFBA220077 ). https://doi.org/10.15223/policy-017 https://doi.org/10.15223/policy-037 https://doi.org/10.15223/policy-012 https://doi.org/10.15223/policy-029 https://doi.org/10.15223/policy-004 item S2468-8231(23)00188-8 S2468823123001888 1-s2.0-S2468823123001888 10.1016/j.mcat.2023.113102 315758 2023-04-14T11:15:23.207329Z 2023-04-15 1-s2.0-S2468823123001888-main.pdf https://s3-eu-west-1.amazonaws.com/prod-ucs-content-store-eu-west/content/pii:S2468823123001888/MAIN/application/pdf/d2f4abd47cc699243517c478e6a27f2e/main.pdf main.pdf pdf true 7320049 MAIN 9 1-s2.0-S2468823123001888-main_1.png https://s3-eu-west-1.amazonaws.com/prod-ucs-content-store-eu-west/content/pii:S2468823123001888/PREVIEW/image/png/99be23db5a8d4def95a2075e94066a95/main_1.png main_1.png png 56573 849 656 IMAGE-WEB-PDF 1 1-s2.0-S2468823123001888-gr5.jpg https://s3-eu-west-1.amazonaws.com/prod-ucs-content-store-eu-west/content/pii:S2468823123001888/gr5/DOWNSAMPLED/image/jpeg/4570850e47af9ba6569ba77bc713dd8d/gr5.jpg gr5 gr5.jpg jpg 81505 518 678 IMAGE-DOWNSAMPLED 1-s2.0-S2468823123001888-gr4.jpg https://s3-eu-west-1.amazonaws.com/prod-ucs-content-store-eu-west/content/pii:S2468823123001888/gr4/DOWNSAMPLED/image/jpeg/40fe6854ae25e8539c19422212613476/gr4.jpg gr4 gr4.jpg jpg 86666 503 715 IMAGE-DOWNSAMPLED 1-s2.0-S2468823123001888-gr3.jpg https://s3-eu-west-1.amazonaws.com/prod-ucs-content-store-eu-west/content/pii:S2468823123001888/gr3/DOWNSAMPLED/image/jpeg/43ba59e9748c2c4d53390abce378a9e1/gr3.jpg gr3 gr3.jpg jpg 132095 517 678 IMAGE-DOWNSAMPLED 1-s2.0-S2468823123001888-gr2.jpg https://s3-eu-west-1.amazonaws.com/prod-ucs-content-store-eu-west/content/pii:S2468823123001888/gr2/DOWNSAMPLED/image/jpeg/c5b01dd005029344fc8428096e29b17b/gr2.jpg gr2 gr2.jpg jpg 55221 239 678 IMAGE-DOWNSAMPLED 1-s2.0-S2468823123001888-ga1.jpg https://s3-eu-west-1.amazonaws.com/prod-ucs-content-store-eu-west/content/pii:S2468823123001888/ga1/DOWNSAMPLED/image/jpeg/643f3f74a7d7ed5299b819148c01ab83/ga1.jpg ga1 true ga1.jpg jpg 37936 200 405 IMAGE-DOWNSAMPLED 1-s2.0-S2468823123001888-gr1.jpg https://s3-eu-west-1.amazonaws.com/prod-ucs-content-store-eu-west/content/pii:S2468823123001888/gr1/DOWNSAMPLED/image/jpeg/d01e2f1ddc657b4796eb185ba6285390/gr1.jpg gr1 gr1.jpg jpg 272319 872 678 IMAGE-DOWNSAMPLED 1-s2.0-S2468823123001888-gr6.jpg https://s3-eu-west-1.amazonaws.com/prod-ucs-content-store-eu-west/content/pii:S2468823123001888/gr6/DOWNSAMPLED/image/jpeg/cecfbe1cb54896aa096eaddff1ac5695/gr6.jpg gr6 gr6.jpg jpg 98385 505 715 IMAGE-DOWNSAMPLED 1-s2.0-S2468823123001888-gr5.sml https://s3-eu-west-1.amazonaws.com/prod-ucs-content-store-eu-west/content/pii:S2468823123001888/gr5/THUMBNAIL/image/gif/b29eb3086679a4a5627adc76a04f6912/gr5.sml gr5 gr5.sml sml 10127 164 214 IMAGE-THUMBNAIL 1-s2.0-S2468823123001888-gr4.sml https://s3-eu-west-1.amazonaws.com/prod-ucs-content-store-eu-west/content/pii:S2468823123001888/gr4/THUMBNAIL/image/gif/62d950716f111def4bf9ca8e7d23221d/gr4.sml gr4 gr4.sml sml 10689 154 219 IMAGE-THUMBNAIL 1-s2.0-S2468823123001888-gr3.sml https://s3-eu-west-1.amazonaws.com/prod-ucs-content-store-eu-west/content/pii:S2468823123001888/gr3/THUMBNAIL/image/gif/93276d4a4c6e2d924e83b323dbcf5610/gr3.sml gr3 gr3.sml sml 16481 164 215 IMAGE-THUMBNAIL 1-s2.0-S2468823123001888-gr2.sml https://s3-eu-west-1.amazonaws.com/prod-ucs-content-store-eu-west/content/pii:S2468823123001888/gr2/THUMBNAIL/image/gif/9ccfb4a1337ea97ffc0e857c3c7e5999/gr2.sml gr2 gr2.sml sml 7934 77 219 IMAGE-THUMBNAIL 1-s2.0-S2468823123001888-ga1.sml https://s3-eu-west-1.amazonaws.com/prod-ucs-content-store-eu-west/content/pii:S2468823123001888/ga1/THUMBNAIL/image/gif/9323324c5a48e724f58bb70b9cee2d64/ga1.sml ga1 true ga1.sml sml 13241 108 219 IMAGE-THUMBNAIL 1-s2.0-S2468823123001888-gr1.sml https://s3-eu-west-1.amazonaws.com/prod-ucs-content-store-eu-west/content/pii:S2468823123001888/gr1/THUMBNAIL/image/gif/ccfd2487986730d150f9c208e6e412f5/gr1.sml gr1 gr1.sml sml 18007 163 127 IMAGE-THUMBNAIL 1-s2.0-S2468823123001888-gr6.sml https://s3-eu-west-1.amazonaws.com/prod-ucs-content-store-eu-west/content/pii:S2468823123001888/gr6/THUMBNAIL/image/gif/c231486c2969604db3ae4ab78a766b2c/gr6.sml gr6 gr6.sml sml 13524 155 219 IMAGE-THUMBNAIL 1-s2.0-S2468823123001888-gr5_lrg.jpg https://s3-eu-west-1.amazonaws.com/prod-ucs-content-store-eu-west/content/pii:S2468823123001888/HIGHRES/image/jpeg/d5d84f415dd4f166a67db4d6f958ff02/gr5_lrg.jpg gr5 gr5_lrg.jpg jpg 590938 2293 3000 IMAGE-HIGH-RES 1-s2.0-S2468823123001888-gr4_lrg.jpg https://s3-eu-west-1.amazonaws.com/prod-ucs-content-store-eu-west/content/pii:S2468823123001888/HIGHRES/image/jpeg/48b2d4048674d14f62a7c658672779ac/gr4_lrg.jpg gr4 gr4_lrg.jpg jpg 652422 2227 3167 IMAGE-HIGH-RES 1-s2.0-S2468823123001888-gr3_lrg.jpg https://s3-eu-west-1.amazonaws.com/prod-ucs-content-store-eu-west/content/pii:S2468823123001888/HIGHRES/image/jpeg/e61ad12610f7009a14520291d495dfe7/gr3_lrg.jpg gr3 gr3_lrg.jpg jpg 1072140 2286 3000 IMAGE-HIGH-RES 1-s2.0-S2468823123001888-gr2_lrg.jpg https://s3-eu-west-1.amazonaws.com/prod-ucs-content-store-eu-west/content/pii:S2468823123001888/HIGHRES/image/jpeg/7842de558dcdd94c9e58d3a37df32871/gr2_lrg.jpg gr2 gr2_lrg.jpg jpg 411074 1057 3000 IMAGE-HIGH-RES 1-s2.0-S2468823123001888-ga1_lrg.jpg https://s3-eu-west-1.amazonaws.com/prod-ucs-content-store-eu-west/content/pii:S2468823123001888/HIGHRES/image/jpeg/e32247d37707c169e1cc420602015590/ga1_lrg.jpg ga1 true ga1_lrg.jpg jpg 272571 886 1795 IMAGE-HIGH-RES 1-s2.0-S2468823123001888-gr1_lrg.jpg https://s3-eu-west-1.amazonaws.com/prod-ucs-content-store-eu-west/content/pii:S2468823123001888/HIGHRES/image/jpeg/df6099c65ab9cd7de3c2f23667ad6bad/gr1_lrg.jpg gr1 gr1_lrg.jpg jpg 2226038 3857 3000 IMAGE-HIGH-RES 1-s2.0-S2468823123001888-gr6_lrg.jpg https://s3-eu-west-1.amazonaws.com/prod-ucs-content-store-eu-west/content/pii:S2468823123001888/HIGHRES/image/jpeg/4ceac5a6b3393e77b5d3808fb470c1f3/gr6_lrg.jpg gr6 gr6_lrg.jpg jpg 732734 2237 3167 IMAGE-HIGH-RES 1-s2.0-S2468823123001888-mmc1.doc https://s3-eu-west-1.amazonaws.com/prod-ucs-content-store-eu-west/content/pii:S2468823123001888/mmc1/MAIN/application/msword/352187555cc6316357cc56bd0e8ed570/mmc1.doc mmc1 mmc1.doc doc 2029056 APPLICATION 1-s2.0-S2468823123001888-si1.svg https://s3-eu-west-1.amazonaws.com/prod-ucs-content-store-eu-west/content/pii:S2468823123001888/image/svg+xml/a6f54e536cc768863e910ffaa89d5dfa/si1.svg si1 si1.svg svg 12706 ALTIMG 1-s2.0-S2468823123001888-si2.svg https://s3-eu-west-1.amazonaws.com/prod-ucs-content-store-eu-west/content/pii:S2468823123001888/image/svg+xml/00ec022d4953ec44f8ef88b2a797e01c/si2.svg si2 si2.svg svg 6313 ALTIMG 1-s2.0-S2468823123001888-si3.svg https://s3-eu-west-1.amazonaws.com/prod-ucs-content-store-eu-west/content/pii:S2468823123001888/image/svg+xml/8940884384278ffb46673f579204ed03/si3.svg si3 si3.svg svg 9083 ALTIMG 1-s2.0-S2468823123001888-am.pdf https://s3-eu-west-1.amazonaws.com/prod-ucs-content-store-eu-west/content/egi:105B21SBZHF/MAIN/application/pdf/0575961957ea294417a0389e24fcb84b/am.pdf am am.pdf pdf false 2265390 AAM-PDF MCAT 113102 113102 S2468-8231(23)00188-8 10.1016/j.mcat.2023.113102 Elsevier B.V. Fig. 1 (a) Schematic illustration the preparation of N, S co-doped carbon film wrapped Co nanoparticles catalyst, (b,c) TEM and HRTEM, (d-i) STEM and EDS mapping image of Co/NSC. Fig 1 Fig. 2 (a) XRD patterns of Co/NSC, (b) Pore size distributions (inset: N2 sorption isotherms). Fig 2 Fig. 3 (a) C 1s, (b) N 1s, (c) S 2p and (d) Co 2p spectra of Co/NSC catalysts. Fig 3 Fig. 4 LSV curves (a) in an O2-saturated 0.1 M KOH electrolyte at a rotation rate of 1600 rpm (10 mV s-1), Tafel plots (b), RRDE curve (c) and electron-transfer number & H2O2 yield (d) originated from RRDE measurements of all catalysts. Fig 4 Fig. 5 Methanol tolerance test (a), current-time (i-t) curves for Co/NSC and Pt/C at 0.3 VRHE (1600 rpm) (b), LSVs of Co/NSC (c) and Pt/C (d) in an O2-saturated 0.1 M KOH electrolyte before and after 10,000 CV cycles (1600 rpm, 10 mV s-1). Fig 5 Fig. 6 The open-circuit voltage (a), polarization and power density curves (10 mV s-1) (b), specific capacities normalized by the Zn consumption (20 mA cm-2) (c), and typical galvanostatic discharge curves (2, 5, 10 mA cm-2) (d) of the as-assembled Zn-air battery with Co/NSC and Pt/C catalysts. Fig 6 Table 1 A comparison of E 1/2 of ORR on Co/NSC and other non-noble metal catalysts. Table 1 Catalyst E 1/2 / V (RHE) Electrolyte Reference (BCN)/ZrO2 0.85 0.1 M KOH [54] CoFe-NCNFs 0.85 0.1 M KOH [55] Co3O4/WS2 0.81 0.1 M KOH [56] FeCo-N,S@CNF 0.85 0.1 M KOH [57] ZrN 0.80 0.1 M KOH [58] Co/BN–CNT/VN 0.85 0.1 M KOH [59] Mn3O4/3DHG 0.833 0.1 M KOH [60] Fc@Fe-NHCS 0.85 0.1 M KOH [61] Co0.62Zn0.38Se@NCF-800 0.829 0.1 M KOH [62] Co/NC 0.840 0.1 M KOH [63] Co/Co-Nx-PCNSs 0.85 0.1 M KOH [64] CoNCI-0.5 0.85 0.1 M KOH [65] Co/NSC 0.86 0.1 M KOH This work N, S co-doped carbon film wrapped Co nanoparticles for boosting oxygen reduction reaction Kexin Huang Conceptualization Methodology Formal analysis Writing – original draft a b ‡ Yanxing Hui Methodology Visualization Validation Formal analysis Data curation a ‡ Zhongyun Yang Formal analysis Visualization a Muhammad Waqas Writing – review & editing a Fangfang Fan Formal analysis a Limin Wang Formal analysis a Xiaotian Liu Data curation a Qiulan Huang Data curation a Dujuan Huang Data curation a Du-Hong Chen Writing – review & editing Funding acquisition a ⁎ Youjun Fan Funding acquisition Project administration a ⁎ Wei Chen Conceptualization Funding acquisition Supervision a ⁎ a Guangxi Key Laboratory of Low Carbon Energy Materials, School of Chemistry and Pharmaceutical Sciences, Guangxi Normal University, Guilin 541004, China Guangxi Key Laboratory of Low Carbon Energy Materials School of Chemistry and Pharmaceutical Sciences Guangxi Normal University Guilin 541004 China aGuangxi Key Laboratory of Low Carbon Energy Materials, School of Chemistry and Pharmaceutical Sciences, Guangxi Normal University, Guilin 541004, China b Guangxi Vocational & Technical Institute of Industry, Nanning 530001, China Guangxi Vocational & Technical Institute of Industry Nanning 530001 China bGuangxi Vocational & Technical Institute of Industry, Nanning 530001, China ⁎ Corresponding authors. ‡ These authors contributed equally to the work. Electrochemical energy (e.g., fuel cell and metal-air batteries) is featured by large theoretical energy density, high conversion efficiency, safe operation and pollution-free emission. However, the sluggish dynamics of oxygen reduction reaction (ORR) and high cost of noble metals hinder their widespread commercial applications in electrochemical energy devices. Herein, we present a method for the preparation of the N, S co-doped carbon film wrapped Co nanoparticles (Co/NSC) for ORR by aging and then pyrolyzing the mixture of cobalt salt and 1-(p-Toluenesulfonyl)imidazole. The co-doping of N and S facilitates the electron rearrangement of the carbon film, resulting in a rapid electron transfer. The core-shell structure enhances the interaction between N, S co-doped carbon film and Co nanoparticles. These features endow the Co/NSC catalyst an excellent ORR with a half-wave potential of 0.860 V and limiting current density of 6.2 mA cm-2, besides the superior anti-methanol. The Co/NSC catalyst as the air cathode grants the assembled zinc-air battery high open circuit voltage (1.467 V), large peak power density (156.2 mW cm-2), great specific capacity (747.9 mAh gZn -1), and excellent stability. Thus, the prepared Co/NSC catalyst exhibits a promising application in zinc-air battery. This work provides an approach for the synthesis of the carbon-shell coated non-noble metal catalyst and its subsequent applications in oxygen electrocatalysis. Graphical abstract Simple method for the synthesis of Co@C for boosting the ORR Performance Image, graphical abstract Keywords Core-shell structure Oxygen reduction reaction Non-noble metal catalysts N, S co-doping Zinc-air battery Data availability The data that has been used is confidential. 1 Introduction Fuel cells and metal-air batteries are potential clean energy technologies to alleviate the energy crisis and environmental issues because of their advantages of high theoretical efficiency, environmental friendly, and safe operation [1–5]. However, the slow kinetic oxygen reduction reaction (ORR) in the air cathode of these devices results in a low energy conversion efficiency and, consequently, impedes their large-scale applications [6,7]. Pt or Pt-based alloys are commonly regarded as the best catalysts toward ORR due to their high energy conversion efficiency [8–11]. However, using these noble metals involves in high cost, low stability, and bad interferences to other fuels (e.g., methanol) and/or intermediates (e.g., COads), which greatly hinders their commercial application in oxygen electrocatalysis. Thus, it is urgent for the development of non-precious metal catalysts for ORR [12–14]. The non-precious metal catalysts towards ORR are featured by accessible active sites, low adsorption/desorption energy of ORR-related species, and accelerated kinetic process [15–17]. From the well-known ‘‘volcano plots’’ [18], Co located at the position near Ru, which endows it proper binding energy to bond oxygen and high activity for ORR. Moreover, Co is relatively abundant and cheap compared to other metals appeared in the ‘‘volcano plots’’. Thus, it is essential to perform the researches on the Co and/or Co-based materials for ORR. Previous reports demonstrated that the heteroatom (e.g., N, F, S, P and B) doped carbon composites supported transition metals exhibited excellent ORR performance [19–23]. For example, Sharma et al. synthesized a highly efficient ORR catalyst composed of N-doped graphene assembled cobalt-molybdenum nitrogen oxide (Co-Mo-ON/NG), in which the nitrogen atoms rearrange the electronic state of Co atoms and enhance the interaction of different elements, in addition to the synergistic effect between the dendritic nitrogen-doped graphene and the loaded metals nanoparticles [24]. Compared with single-atom doping, the multi-doping of carbon materials is more favorable because of the increasing asymmetric rotation and their enhanced charge regulation, thus promoting the adsorption and reduction of oxygen species [25,26]. At present, the preparation of multi-doped carbon composites loaded with transition metals composites requires a variety of heteroatomic precursors [27,28] or expensive carbon substances (e.g., graphene and carbon nanotube) [29–32]. Thus, it is necessary to simplify the heteroatomic precursors and decrease the cost to prepare non-noble metal catalysts. To overcome the above issues, here, we present a method for the preparation of N, S co-doped carbon film wrapped cobalt nanoparticles catalyst (Co/NSC) for ORR by the pyrolysis of the mixture containing 1-(p-Toluenesulfonyl)imidazole (C10H10N2O2S), cobalt salt (Co(NO3)2⋅6H2O), and zinc salt (Zn(NO3)2·6H2O), in which only 1-(p-Toluenesulfonyl)imidazole was selected as the precursor of the N, S co-doped carbon film, thus avoiding the use of a variety of heteroatomic precursors or expensive carbon substances and simplifying the preparation process. Transmission electron microscopy (TEM) and TEM mapping images indicated that the Co nanoparticles were coated with the N, S co-doped carbon film. X-ray photoelectron spectroscopy (XPS) spectra demonstrated the active site of Co-N-C exists in the prepared Co/NSC catalyst. The electrochemical measurements showed that the Co/NSC catalyst possesses an excellent ORR performance and high peak power density (156.2 mW cm-2), large specific capacity (747.9 mAh gZn -1) for Zn-air batteries. This work provides a simple approach for the preparation of highly efficient ORR catalyst and its subsequent application in oxygen catalysis. 2 Experimental section 2.1 Chemicals and materials Nafion (5 wt%) was bought from Sigma-Aldrich, methanol (CH3OH, analytical grade) was ordered from Shantou Xilong Scientific Co., Ltd., commercial Pt/C (20 wt%) was purchased from JM, potassium hydroxide (KOH, analytical grade), C10H10N2O2S (99%), cobalt(II) nitrate hexahydrate (Co(NO3)2⋅6H2O, analytical grade), zinc(II) nitrate hexahydrate (Zn(NO3)2·6H2O, analytical grade), and zinc acetate dihydrate (Zn(OAc)2·2H2O, analytical grade) were supplied by Aladdin. All chemicals that were purchased were used directly. 2.2 Synthesis of the cobalt-modified N and S co-doped carbon catalyst Initially, 75 mg of Co(NO3)2⋅6H2O and 225 mg of Zn(NO3)2·6H2O were dissolved in 10 mL of CH3OH to form a solution A, and 672 mg of C10H10N2O2S were dissolved in 10 mL CH3OH containing 500 μL ammonia to develop a solution B, respectively. Thereafter, the obtained two solutions were ultrasonically mixed and aged for 10 h, after which the precipitates were obtained by washing, vacuum drying, and then labeled as Co-TSIM. Finally, the obtained Co-TSIM was pyrolyzed at 950 °C for 3 h in a tube furnace under N2 protection. The obtained sample was marked Co/NSC. 2.3 Physical characterizations The XRD pattern was obtained using X-ray diffraction spectroscopy (XRD, D/MAX-2500 V/PC). The surface area and the pore size distribution were obtained using porosity analyzer (Quantachrome, NOVA 1200e). Scan electron microscopy (SEM, JSM-7500F) and high-resolution TEM (JEM-2100) with energy-dispersive X-ray spectroscopy (EDS, X-Max-65T) were used to obtain the compositions and morphology of the as-prepared samples. XPS (ESCALAB 250Xi) spectra were used to analyze the elemental compositions and states of the as-prepared samples. 2.4 Electrochemical measurements Prior to the electrochemical measurements, the catalyst ink was prepared as follows: 3 mg of the as-prepared catalyst was added into 1 mL ethanol solution containing 25 μL of nafion and ultrasonicated into a homogenous ink. Then, 30 μL of the catalyst ink was coated on the as-polished RDE/RRDE (0.19625/0.247 cm2) to maintain the catalyst loading of 0.45 mg cm-2. The catalytic performance of the as-prepared catalysts toward ORR was measured on an electrochemical workstation (WaveDriver 200, Pine, USA) equipped with a three-electrode system, in which a saturated calomel electrode (SCE), glassy carbon disk/ring-disk electrode (RDE/RRDE), and graphite sheet, as the reference, working, and counter electrodes, respectively. The electrolyte was an O2- or N2- saturated 0.1 M KOH solution. All the applied potential was calibrated to the reversible hydrogen electrode (RHE) according to the following formula: E ( R H E ) = E ( SCE ) + 0.241 + 0.0591 pH The electron transfer number (n) and hydrogen peroxide (H2O2) yield were calculated using the following formulas. n = 4 N · I D / ( N · I D + I R ) % H 2 O 2 = 200 · I R / ( N · I D + I R ) Where N represents the current collection efficiency (N = 0.37). I D and I R represent the disk and ring current, respectively. 2.5 Zn-air battery measurements A home-assembled Zn-air battery was used to evaluate the actual application of the as-prepared catalyst. The Zn-air battery was filled with 6.0 M KOH + 0.2 M Zn(OAc)2 electrolyte. The anode material was an as-polished zinc plate, and the air cathode was a carbon paper coated with Co/NSC or commercial Pt/C catalyst (1.0 mg cm-2). 3 Results and discussion The preparation of Co/NSC is schematically displayed in Fig. 1 a. Initially, the metal salts were reacted with 1-(p-Toluenesulfonyl)imidazole to produce a precipitated precursor. In the subsequent pyrolysis process, the obtained precursor was decomposed into Co/NSC, and the N, S co-doped carbon film was coated on the surface of Co nanoparticles. During the pyrolysis process, C10H10N2O2S provides the C-, N- and S-resources and converts into the N and S co-doped carbon film. The Zn cations were used to enlarge the surface areas by the evaporation of Zn atoms at high temperature. Furthermore, the successful fabrication of Co nanoparticles and homogeneous coating of carbon film could be validated through TEM image (Fig. 1b, c). The lattice fringes for the Co core and carbon shell are 0.206 and 0.341 nm, respectively (Fig. 1c) [33,34]. TEM-EDS mapping images (Fig. 1d-i) again validate the core-shell structure of Co/NSC, and their elemental compositions are S, C, N, O and Co. Characteristically, these results demonstrate the successful synthesis of Co/NSC. No lattice fringe and elemental signal for Zn are seen, which can be ascribed to the evaporation of Zn atoms at high temperature and is concordant with previous reports [35,36]. The XRD pattern of Co/NSC shows a broad signal peak of C (002) crystal plane at approximately 26.38° (JCPDS: PDF#41–1487), indicating that the precursor has been carbonized to graphitic carbon at 950 °C (Fig. 2 a). A comparison of the XRD patterns of the standard card (JCPDS: PDF#15–0806) and Co/NSC reveals that the three peaks at approximately 44.22°, 51.52° and 75.85° are credited to Co (111), (200) and (220) crystal planes, respectively (Fig. 2a) [37]. The evaporation of Zn and O atoms at high temperature can accelerate the formation of high specific surface area of carbon materials. To convince this viewpoint, the N2 sorption experiments demonstrates the pore size of Co/NSC samples, which is mainly distributed in the micropore range (0∼2 nm), in addition to little mesoporous (2∼6 nm) (Fig. 2b). The N2 sorption isotherms of Co/NSC samples exhibits the curves of IV isotherms (Fig. 2b, inset), which confirms that the micropore-mesoporous structure of Co/NSC samples and is consistent with the results of the distribution of pore size. The graded micropores and mesoporous in Co/NSC samples are conducive to the rapid transfer of oxygen species [38–40]. The specific surface area for Co/NSC is 339.6 m2 g-1, which is much greater than that of other N, S co-doped carbon materials reported previously (248 m2 g-1 [41], 178 m2 g-1 [42], 139.8 m2 g-1 [43]), and is supported by SEM images, where a rough surface is seen (Fig. S1a, b). Thus, the Co/NSC catalyst can offer highly exposed active sites for ORR. The chemical valences and compositions of the Co/NSC samples were analyzed by XPS. The full XPS survey of Co/NSC samples shows the signal peaks of S 2p, C 1 s, O 1 s, N 1 s and Co 2p at 164, 285, 401, 532 and 780 eV, and the atomic ratio of S, C, N, O, and Co is 0.72:87.31:4.97:5.51:1.49 (Fig. S2). The fitted peaks located at 284.62, 284.98, 285.97 and 288.51 eV are corresponded to C = C/CC, C = N/CO, C-S-C and OC = O, respectively [44,45] (Fig. 3 a). This result indicates the successful doping of N and S in the prepared Co/NSC. In addition, the hydrophilic oxygen-containing groups (CO and OC = O) in Co/NSC samples are beneficial to the adsorption of hydroxide groups (OH-) to promote the ORR process [15]. The N 1 s high-resolution spectrum exhibits four nitrogen species, including pyridinic N at 398.00 eV, Co-N at 398.98 eV, pyrrolic N at 401.05 eV, and graphitic N at 402.50 eV [46] (Fig. 3b). The S 2p high-resolution spectrum shows that the spin orbits energy of 2p3/2 and 2p1/2 of thiophen-S (C-S-C) are located at 164.00 and 165.16 eV, respectively, which is positively shifted 1 eV compared to the reported value [47] (Fig. 3c). This result confirms the electron rearrangement in Co/NSC. Moreover, the other peak at 168.02 eV is assigned to the satellite peak of S 2p [48]. The Co 2p high-resolution spectra displays that the Co0, Co2+, Co–NX, and satellite peaks are located at 778.85, 780.86, 782.99, and 786.79 eV, respectively [49] (Fig. 3d). This result indicates the active sites of Co–NX in Co/NSC [50–52]. To evaluate the ORR performance on Co/NSC, the linear sweep voltammetry (LSV) measurement was first performed in an O2-saturated 0.1 M KOH electrolyte. The half-wave potential (E 1/2) and limiting current density of the catalyst are shown in Fig. 4 a. The limiting current density is approximately 6 mA cm−2, suggesting a quick reaction rate of ORR on Co/NSC. The half-wave potential (E 1/2) is commonly used to assess the catalytic activity of a catalyst; specifically, a high E 1/2 represents an excellent catalytic activity of the material [53]. The E 1/2 of Co/NSC (0.860 V) is comparable to that of commercial Pt/C (0.865 V) and greater than of other reported non-noble metal catalysts listed in Table 1 [54–65]. A comparison of E 1/2 of Co/NSC and Co/NC [63] indicates that N and S co-doped carbon materials facilitate the ORR enhancement. The Tafel curves originated from the LSV polarization curves (Fig. 4a) are shown in Fig. 4b. A comparison of the Tafer slop of Co/NSC and commercial Pt/C discloses the similar kinetics for ORR. This result indicates that the Co/NSC possesses promising application in ORR [66,67]. The main reaction paths of ORR include four-electron (4e-) process to form water (H2O) and two-electron (2e-) process to yield hydrogen peroxide (H2O2). The 4e- process is more efficient in energy conversion compared to 2e- process. The ORR path can be estimated by the electron transfer number (n) or H2O2 yield. The RRDE experiment measured the n and H2O2 yield according to the formulas mentioned in the experimental section. As shown in Fig. 4c and d, the n value of Co/NSC catalyst is 3.91∼3.97, inferring the major pathway in ORR involves 4e-. Moreover, the H2O2 yield maintains a low level (1.45∼4.43%) at the potential windows. The above results verify that the prepared Co/NSC can be considered a high-efficiency catalyst in electrochemical energy devices (e.g., metal-air batteries and fuel cells) [66,68]. The ORR on the catalyst is declined easily by the methanol interference originated from the cathode of the galvanic cells. Therefore, a study on the anti-methanol of catalyst is necessary. The methanol-tolerance experiment of the catalyst is conducted by chronoamperometry (CA). The current density of Co/NSC catalyst remains stable after the addition of 3 mL of CH3OH (2 M) in 0.1 M KOH electrolyte, which is prior to Pt/C that a sharp drop appears after the addition of methanol (Fig. 5 a). This result confirms that the Co/NSC catalyst exhibits excellent methanol-tolerance during ORR. The CA and cyclic voltammetry (CV) measurements were used to investigate the stability of the prepared materials. The CA test shows that the final current density for Co/NSC catalyst is 92.45%, higher than that of commercial Pt/C (84.61%) (Fig. 5b). This result indicates the excellent long-term stability of Co/NSC catalyst toward ORR, which is supported by the result of 10,000 cyclic CV test, where the half-wave potential of Co/NSC catalyst only exhibits a negative shift 15 mV (Fig. 5c), lower than that of commercial Pt/C (58 mV, Fig. 5d). Both CA and CV measurements verify the excellent catalytic stability of the Co/NSC catalyst. This high ORR performance can be ascribed to the excellent conductivity Co/NSC catalyst, as confirmed by the impedance experiment (Fig. S3), the charge transfer resistance (R ct) of Co/NSC is 23.0 Ω, much lower than that of Pt/C (58.9 Ω). The high electrical conductivity Co/NSC benefits the faster charge transfer in the electrochemical process [69]. The practical application of the prepared catalyst is assessed by a homemade Zn-air battery, in which the carbon paper loaded with catalyst samples (Co/NSC or commercial Pt/C, 1 mg cm–2) and zinc plate were assembled as the cathode and anode, respectively. The open circuit voltage (OCV) of Co/NSC catalyst is 1.467 V, which is higher than that of commercial Pt/C (1.427 V) (Fig. 6 a). The power density is calculated from the discharge curve by the formula of P = U × I (where, P represents power density, U represents potential, and I represents current density) and the calculated values are present in Fig. 6b. The maximum power density of the Co/NSC catalyst is 156.2 mW cm-2, which is 1.24-fold higher than that of commercial Pt/C (125.93 mW cm-2). The specific capacity was normalized to the consumptions of the zinc plate that discharge continuously at 20 mA cm-2 until the occurrence of the broken circuit. The calculated specific capacity of the Co/NSC catalyst is 747.9 mAh gZn -1, higher than that of the commercial Pt/C (712.4 mAh gZn -1) (Fig. 6c). After separately discharging for 1.5 h at the current density of 2, 5, 10, 5, 2 mA cm-2, the discharge voltage of the Co/NSC catalyst is still higher than that of commercial Pt/C (Fig. 6d). This result again confirms the excellent stability of the Co/NSC catalyst. 4 Conclusion In summary, we demonstrated a method for the preparation of Co/NSC. After the aging and pyrolysis, the N and S were successfully doped into the carbon film. More importantly, the Co nanoparticles were coated by the N, S co-doped carbon film, which strengthens the interaction between the Co nanoparticles and carbon film, and facilitates the electron rearrangement of Co/NSC. In addition, the designed Co/NSC catalyst exhibits a large specific surface area, offering a high density of exposed active sites of Co-NX. These advantages give the Co/NSC catalyst a high half-wave potential of 0.860 V, which is comparable to that of commercial Pt/C and higher than that of recently reported non-noble metal catalysts. Furthermore, the Co/NSC catalyst highlights excellent stability and anti-methanol, outperforming the commercial Pt/C. The assembled Zn-air battery, using Co/NSC as the cathode catalyst, demonstrates a high open circuit voltage (1.467 V), large peak power density (156.2 mW cm-2), great specific capacity (747.9 mAh gZn -1), and excellent stability. Therefore, this work provides an approach for the preparation of N, S co-doped materials and the core-shell mental@C materials. The prepared catalyst can be used in the energy storage and conversion devices. CRediT authorship contribution statement Kexin Huang: Conceptualization, Methodology, Formal analysis, Writing – original draft. Yanxing Hui: Methodology, Visualization, Validation, Formal analysis, Data curation. Zhongyun Yang: Formal analysis, Visualization. Muhammad Waqas: Writing – review & editing. Fangfang Fan: Formal analysis. Limin Wang: Formal analysis. Xiaotian Liu: Data curation. Qiulan Huang: Data curation. Dujuan Huang: Data curation. Du-Hong Chen: Writing – review & editing, Funding acquisition. Youjun Fan: Funding acquisition, Project administration. Wei Chen: Conceptualization, Funding acquisition, Supervision. Declaration of Competing Interest The authors declare that they have no known competing financial interests or personal relationships that could have appeared to influence the work reported in this paper. Acknowledgements This work was supported by the National Natural Science Foundation of China (22162006, 22102035) and Natural Science Foundation of Guangxi Province (2019GXNSFGA245003, 2021GXNSFBA220077). Supplementary materials Supplementary material associated with this article can be found, in the online version, at doi:10.1016/j.mcat.2023.113102. Appendix Supplementary materials Image, application 1 References [1] M.L. Pegis C.F. Wise D.J. Martin J.M. Mayer Oxygen reduction by homogeneous molecular catalysts and electrocatalysts Chem. Rev. 118 2018 2340 2391 M.L. Pegis, C.F. Wise, D.J. Martin, J.M. Mayer, Oxygen reduction by homogeneous molecular catalysts and electrocatalysts, Chem. Rev. 118 (2018) 2340–2391. [2] Y. Li J. Lu Metal-air batteries: will they be the future electrochemical energy storage device of choice ACS Energy Lett 2 2017 1370 1377 Y. Li, J. Lu, Metal-air batteries: will they be the future electrochemical energy storage device of choice, ACS Energy Lett. 2 (2017) 1370–1377. [3] R. Yuan Y. Wei B. Musikavanhu M. Tang Z. Xue A. Wang J. Zhang X. Qiu L. Zhao Asymmetric cobalt porphyrins for oxygen reduction reactions: boosted catalytic activity by the use of triphenylamine Mol. Catal. 534 2023 112805 R. Yuan, Y. Wei, B. Musikavanhu, M. Tang, Z. Xue, A. Wang, J. Zhang, X. Qiu, L. Zhao, Asymmetric cobalt porphyrins for oxygen reduction reactions: boosted catalytic activity by the use of triphenylamine, Mol. Catal. 534 (2023), 112805. [4] X. Tian X.F. Lu B.Y. Xia X.W. Lou Advanced electrocatalysts for the oxygen reduction reaction in energy conversion technologies Joule 4 2020 45 68 X. Tian, X.F. Lu, B.Y. Xia, X.W. Lou, Advanced electrocatalysts for the oxygen reduction reaction in energy conversion technologies, Joule 4 (2020) 45–68. [5] G. Wu K.L. More C.M. Johnston P. Zelenay High performance electrocatalysts for oxygen reduction derived from polyaniline, iron, and cobalt Science 332 2011 443 447 G. Wu, K.L. More, C.M. Johnston, P. Zelenay, High performance electrocatalysts for oxygen reduction derived from polyaniline, iron, and cobalt, Science 332 (2011) 443–447. [6] Y.J. Wang N. Zhao B. Fang H. Li X.T. Bi H. Wang Carbon-supported Pt-based alloy electrocatalysts for the oxygen reduction reaction in polymer electrolyte membrane fuel cells: particle size, shape, and composition manipulation and their impact to activity Chem. Rev. 115 2015 3433 3467 Y.J. Wang, N. Zhao, B. Fang, H. Li, X.T. Bi, H. Wang, Carbon-supported Pt-based alloy electrocatalysts for the oxygen reduction reaction in polymer electrolyte membrane fuel cells: particle size, shape, and composition manipulation and their impact to activity, Chem. Rev. 115 (2015) 3433–3467. [7] M. Etesami M. Oroujzadeh S. Mehdipour-Ataei 3D nitrogen-doped carbon supported non-precious metals electrocatalyst for oxygen reduction reaction Mol. Catal. 485 2020 110834 M. Etesami, M. Oroujzadeh, S. Mehdipour-Ataei, 3D nitrogen-doped carbon supported non-precious metals electrocatalyst for oxygen reduction reaction, Mol. Catal. 485 (2020), 110834. [8] Y. Luo Y. Wang X. Qin Y. Wang K. Wu H. Zhang L. Zhang H. Huang W. Tian Y. Wang Bidirectional modulation interaction between monatomic Pt and Tin+ sites on Ti4O7 for high-efficiency and durable oxygen reduction J. Catal. 411 2022 149 157 Y. Luo, Y. Wang, X. Qin, Y. Wang, K. Wu, H. Zhang, L. Zhang, H. Huang, W. Tian, Y. Wang, Bidirectional modulation interaction between monatomic Pt and Tin+ sites on Ti4O7 for high-efficiency and durable oxygen reduction, J. Catal. 411 (2022) 149–157. [9] L. Zhang S. Jiang W. Ma Z. Zhou Oxygen reduction reaction on Pt-based electrocatalysts: four-electron vs. two-electron pathway Chin. J. Catal. 6 2022 1433 1443 L. Zhang, S. Jiang, W. Ma, Z. Zhou, Oxygen reduction reaction on Pt-based electrocatalysts: four-electron vs. two-electron pathway, Chin. J. Catal. 6 (2022) 1433–1443. [10] J. Munarriz Z. Zhang P. Sautet A.N. Alexandrova Graphite-Supported Ptn Cluster Electrocatalysts: major Change of Active Sites as a Function of the Applied Potential ACS Catal 23 2022 14517 14526 J. Munarriz, Z. Zhang, P. Sautet, A.N. Alexandrova, Graphite-Supported Ptn Cluster Electrocatalysts: major Change of Active Sites as a Function of the Applied Potential, ACS Catal. 23 (2022) 14517–14526. [11] Z. Yan Y. Zhang C. Dai Z. Zhang M. Zhang W. Wei X. Lv X. Zhao Porous, thick nitrogen-doped carbon encapsulated large PtNi core-shell nanoparticles for oxygen reduction reaction with extreme stability and activity Carbon N Y 186 2022 36 45 Z. Yan, Y. Zhang, C. Dai, Z. Zhang, M. Zhang, W. Wei, X. Lv, X. Zhao, Porous, thick nitrogen-doped carbon encapsulated large PtNi core-shell nanoparticles for oxygen reduction reaction with extreme stability and activity, Carbon N Y 186 (2022) 36–45. [12] J. Li S. Sharma K. Wei Z. Chen D. Morris H. Lin C. Zeng M. Chi Z. Yin M. Muzzio M. Shen P. Zhang A.A. Peterson S. Sun Anisotropic strain tuning of L10 ternary nanoparticles for oxygen reduction J. Am. Chem. Soc. 142 2020 19209 19216 J. Li, S. Sharma, K. Wei, Z. Chen, D. Morris, H. Lin, C. Zeng, M. Chi, Z. Yin, M. Muzzio, M. Shen, P. Zhang, A.A. Peterson, S. Sun, Anisotropic strain tuning of L10 ternary nanoparticles for oxygen reduction, J. Am. Chem. Soc. 142 (2020) 19209–19216. [13] H. An K. Min Y. Lee R. Na S. Shim S. Baeck Sacrificial template induced Fe-, N-, and S-tridoped hollow carbon sphere as a highly efficient electrocatalyst for oxygen reduction reaction Mol. Catal. 530 2022 112589 H. An, K. Min, Y. Lee, R. Na, S. Shim, S. Baeck, Sacrificial template induced Fe-, N-, and S-tridoped hollow carbon sphere as a highly efficient electrocatalyst for oxygen reduction reaction, Mol. Catal. 530 (2022), 112589. [14] F. Fan Q. Huang R. Devasenathipathy X. Peng F. Yang X. Liu L. Wang D.H. Chen Y. Fan W. Chen Composite-structure-defined nitrogen-doped carbon nanocage embedded Co/CoxP for enhanced oxygen reduction and evolution reactions Electrochim. Acta 437 2023 141514 F. Fan, Q. Huang, R. Devasenathipathy, X. Peng, F. Yang, X. Liu, L. Wang, D.H. Chen, Y. Fan, W. Chen, Composite-structure-defined nitrogen-doped carbon nanocage embedded Co/CoxP for enhanced oxygen reduction and evolution reactions, Electrochim. Acta 437 (2023), 141514. [15] W. Xia A. Mahmood Z. Liang R. Zou S. Guo Earth-abundant nanomaterials for oxygen reduction Angew. Chem. Int. Ed. 55 2016 2650 2676 W. Xia, A. Mahmood, Z. Liang, R. Zou, S. Guo, Earth-abundant nanomaterials for oxygen reduction, Angew. Chem. Int. Ed. 55 (2016) 2650–2676. [16] T. Wang J. Wu Y. Liu X. Cui P. Ding J. Deng C. Zha E. Coy Y. Li Scalable preparation and stabilization of atomic-thick CoNi layered double hydroxide nanosheets for bifunctional oxygen electrocatalysis and rechargeable zinc-air batteries Energy Storage Mater 16 2019 24 30 T. Wang, J. Wu, Y. Liu, X. Cui, P. Ding, J. Deng, C. Zha, E. Coy, Y. Li, Scalable preparation and stabilization of atomic-thick CoNi layered double hydroxide nanosheets for bifunctional oxygen electrocatalysis and rechargeable zinc-air batteries, Energy Storage Mater. 16 (2019) 24–30. [17] Y. Ma S. Luo M. Tian J.E. Lu Y. Peng C. Desmond Q. Liu Q. Li Y. Min Q. Xu S. Chen Hollow carbon spheres codoped with nitrogen and iron as effective electrocatalysts for oxygen reduction reaction J. Power Sources 450 2020 227659 Y. Ma, S. Luo, M. Tian, J.E. Lu, Y. Peng, C. Desmond, Q. Liu, Q. Li, Y. Min, Q. Xu, S. Chen, Hollow carbon spheres codoped with nitrogen and iron as effective electrocatalysts for oxygen reduction reaction, J. Power Sources 450 (2020), 227659. [18] J.K. Nørskov J. Rossmeisl A. Logadottir L. Lindqvist J.R. Kitchin T. Bligaard H. Jónsson Origin of the overpotential for oxygen reduction at a fuel-cell cathode J. Phys. Chem. B 108 2004 17886 17892 J.K. Nørskov, J. Rossmeisl, A. Logadottir, L. Lindqvist, J.R. Kitchin, T. Bligaard, H. Jónsson, Origin of the overpotential for oxygen reduction at a fuel-cell cathode, J. Phys. Chem. B 108 (2004) 17886–17892. [19] K. Huang W. Zhang J. Li Y. Fan B. Yang C. Rong J. Qi W. Chen J. Yang In situ anchoring of zeolite imidazole framework-derived Co, N-doped porous carbon on multiwalled carbon nanotubes toward efficient electrocatalytic oxygen reduction ACS Sustainable Chem. Eng. 8 2019 478 485 K. Huang, W. Zhang, J. Li, Y. Fan, B. Yang, C. Rong, J. Qi, W. Chen, J. Yang, In situ anchoring of zeolite imidazole framework-derived Co, N-doped porous carbon on multiwalled carbon nanotubes toward efficient electrocatalytic oxygen reduction, ACS Sustainable Chem. Eng. 8 (2019) 478–485. [20] H. Jin H. Zhou P. Ji C. Zhang J. Luo W. Zeng C. Hu D. He S. Mu ZIF-8/LiFePO4 derived Fe-N-P Co-doped carbon nanotube encapsulated Fe2P nanoparticles for efficient oxygen reduction and Zn-air batteries Nano Res 13 2020 818 823 H. Jin, H. Zhou, P. Ji, C. Zhang, J. Luo, W. Zeng, C. Hu, D. He, S. Mu, ZIF-8/LiFePO4 derived Fe-N-P Co-doped carbon nanotube encapsulated Fe2P nanoparticles for efficient oxygen reduction and Zn-air batteries, Nano Res. 13 (2020) 818–823. [21] X. Xu X. Yan Z. Zhong L. Kang J. Yao The construction of porous graphene tri-doped with B, N and Co for enhanced oxygen reduction reaction Carbon N Y 145 2019 311 320 X. Xu, X. Yan, Z. Zhong, L. Kang, J. Yao, The construction of porous graphene tri-doped with B, N and Co for enhanced oxygen reduction reaction, Carbon N Y 145 (2019) 311–320. [22] T. Asefa X. Huang Heteroatom-doped carbon materials for electrocatalysis Chem. Eur. J. 23 2017 10703 10713 T. Asefa, X. Huang, Heteroatom-doped carbon materials for electrocatalysis, Chem. Eur. J. 23 (2017) 10703–10713. [23] C.C. Hu J. Liu J. Wang W.X. She J.W. Xiao J.B. Xi Z.W. Bai S. Wang Coordination-assisted polymerization of mesoporous cobalt sulfide/heteroatom (N,S)-doped double-layered carbon tubes as an efficient bifunctional oxygen electrocatalyst ACS Appl. Mater. Interfaces 10 2018 33124 33134 C.C. Hu, J. Liu, J. Wang, W.X. She, J.W. Xiao, J.B. Xi, Z.W. Bai, S. Wang, Coordination-assisted polymerization of mesoporous cobalt sulfide/heteroatom (N,S)-doped double-layered carbon tubes as an efficient bifunctional oxygen electrocatalyst, ACS Appl. Mater. Interfaces 10 (2018) 33124–33134. [24] K. Sharma D. Hui N.H. Kim J.H. Lee Facile synthesis of N-doped graphene supported porous cobalt molybdenum oxynitride nanodendrites for the oxygen reduction reaction Nanoscale 11 2019 1205 1216 K. Sharma, D. Hui, N.H. Kim, J.H. Lee, Facile synthesis of N-doped graphene supported porous cobalt molybdenum oxynitride nanodendrites for the oxygen reduction reaction, Nanoscale 11 (2019) 1205–1216. [25] C. Lai M. Gong Y. Zhou J. Fang L. Huang Z. Deng X. Liu T. Zhao R. Lin K. Wang K. Jiang H. Xin D. Wang Sulphur modulated Ni3FeN supported on N/S co-doped graphene boosts rechargeable/flexible Zn-air battery performance Appl. Catal. B Environ. 274 2020 119086 C. Lai, M. Gong, Y. Zhou, J. Fang, L. Huang, Z. Deng, X. Liu, T. Zhao, R. Lin, K. Wang, K. Jiang, H. Xin, D. Wang, Sulphur modulated Ni3FeN supported on N/S co-doped graphene boosts rechargeable/flexible Zn-air battery performance, Appl. Catal. B Environ. 274 (2020), 119086. [26] K. Yuan D. Lützenkirchen-Hecht L. Li L. Shuai Y. Li R. Cao M. Qiu X. Zhuang M.K.H. Leung Y. Chen U. Scherf Boosting oxygen reduction of single iron active sites via geometric and electronic engineering: nitrogen and phosphorus dual coordination J. Am. Chem. Soc. 142 2020 2404 2412 K. Yuan, D. Lützenkirchen-Hecht, L. Li, L. Shuai, Y. Li, R. Cao, M. Qiu, X. Zhuang, M.K.H. Leung, Y. Chen, U. Scherf, Boosting oxygen reduction of single iron active sites via geometric and electronic engineering: nitrogen and phosphorus dual coordination, J. Am. Chem. Soc. 142 (2020) 2404–2412. [27] H.B. Yang C. Guo L. Zhang F.X. Hu W. Cai J. Gao C.M. Li B. Liu Nitrogen and sulfur Co-doped graphene inlaid with cobalt clusters for efficient oxygen reduction reaction Mater. Today Energy 10 2018 184 190 H.B. Yang, C. Guo, L. Zhang, F.X. Hu, W. Cai, J. Gao, C.M. Li, B. Liu, Nitrogen and sulfur Co-doped graphene inlaid with cobalt clusters for efficient oxygen reduction reaction, Mater. Today Energy 10 (2018) 184–190. [28] A. Al-Shahat Eissa N.H. Kim J.H. Lee Rational design of a highly mesoporous Fe-N-C/Fe3C/C-S-C nanohybrid with dense active sites for superb electrocatalysis of oxygen reduction J. Mater. Chem. A 8 2020 23436 23454 A. Al-Shahat Eissa, N.H. Kim, J.H. Lee, Rational design of a highly mesoporous Fe-N-C/Fe3C/C-S-C nanohybrid with dense active sites for superb electrocatalysis of oxygen reduction, J. Mater. Chem. A 8 (2020) 23436–23454. [29] Z. Siahkalroudi B. Aghabarari M. Vaezi E. Rodríguez-Castellón M. Martínez-Huertac Effect of secondary heteroatom (S, P) in N-doped reduced graphene oxide catalysts to oxygen reduction reaction Mol. Catal. 502 2021 111372 Z. Siahkalroudi, B. Aghabarari, M. Vaezi, E. Rodríguez-Castellón, M. Martínez-Huertac, Effect of secondary heteroatom (S, P) in N-doped reduced graphene oxide catalysts to oxygen reduction reaction, Mol. Catal. 502 (2021), 111372. [30] H. Zhang X. Wang Z. Yang S. Yan C. Zhang S. Liu Space-confined synthesis of lasagna-like N-doped graphene-wrapped copper-cobalt sulfides as efficient and durable electrocatalysts for oxygen reduction and oxygen evolution reactions ACS Sustainable Chem. Eng. 8 2020 1004 1014 H. Zhang, X. Wang, Z. Yang, S. Yan, C. Zhang, S. Liu, Space-confined synthesis of lasagna-like N-doped graphene-wrapped copper-cobalt sulfides as efficient and durable electrocatalysts for oxygen reduction and oxygen evolution reactions, ACS Sustainable Chem. Eng. 8 (2020) 1004–1014. [31] S. Wu D. Deng E. Zhang H. Li L. Xu CoN nanoparticles anchored on ultra-thin N-doped graphene as the oxygen reduction electrocatalyst for highly stable zinc-air batteries Carbon N Y 196 2022 347 353 S. Wu, D. Deng, E. Zhang, H. Li, L. Xu, CoN nanoparticles anchored on ultra-thin N-doped graphene as the oxygen reduction electrocatalyst for highly stable zinc-air batteries, Carbon N Y 196 (2022) 347–353. [32] K.L. Svane H.A. Hansen T. Vegge A comparison of single and double Co sites incorporated in N-doped graphene for the oxygen reduction reaction J. Catal. 393 2021 230 237 K.L. Svane, H.A. Hansen, T. Vegge, A comparison of single and double Co sites incorporated in N-doped graphene for the oxygen reduction reaction, J. Catal. 393 (2021) 230–237. [33] M. Zhu J. Nong P. Xie A.S. Zhu M.Z. Rong M.Q. Zhang Well-dispersed CoO embedded in 3D N-S-doped carbon framework through morphology-retaining pyrolysis as efficient oxygen reduction and evolution electrocatalyst Electrochim. Acta 295 2019 624 631 M. Zhu, J. Nong, P. Xie, A.S. Zhu, M.Z. Rong, M.Q. Zhang, Well-dispersed CoO embedded in 3D N-S-doped carbon framework through morphology-retaining pyrolysis as efficient oxygen reduction and evolution electrocatalyst, Electrochim. Acta 295 (2019) 624–631. [34] Z.S. Wu L. Chen J. Liu K. Parvez H. Liang J. Shu H. Sachdev R. Graf X. Feng K. Mullen High-performance electrocatalysts for oxygen reduction derived from cobalt porphyrin-based conjugated mesoporous polymers Adv. Mater. 26 2014 1450 1455 Z.S. Wu, L. Chen, J. Liu, K. Parvez, H. Liang, J. Shu, H. Sachdev, R. Graf, X. Feng, K. Mullen, High-performance electrocatalysts for oxygen reduction derived from cobalt porphyrin-based conjugated mesoporous polymers, Adv. Mater. 26 (2014) 1450–1455. [35] K. Huang C. Rong W. Zhang X. Yang Y. Fan L. Liu Z. Yang J.Yang W.Chen MOF-assisted synthesis of Ni, Co, Zn, and N multidoped porous carbon as highly efficient oxygen reduction electrocatalysts in Zn-air batteries Mater. Today Energy 19 2021 100579 K. Huang, C. Rong, W. Zhang, X. Yang, Y. Fan, L. Liu, Z. Yang, W.Chen, J.Yang, MOF-assisted synthesis of Ni, Co, Zn, and N multidoped porous carbon as highly efficient oxygen reduction electrocatalysts in Zn-air batteries, Mater. Today Energy 19 (2021), 100579. [36] B. You N. Jiang M. Sheng W.S. Drisdell J. Yano Y. Sun Bimetal-Organic Framework Self-Adjusted Synthesis of Support-Free Nonprecious Electrocatalysts for Efficient Oxygen Reduction ACS Catal 5 2015 7068 7076 B. You, N. Jiang, M. Sheng, W.S. Drisdell, J. Yano, Y. Sun, Bimetal-Organic Framework Self-Adjusted Synthesis of Support-Free Nonprecious Electrocatalysts for Efficient Oxygen Reduction, ACS Catal. 5 (2015) 7068–7076. [37] S.H. Ahn A. Manthiram Self-templated synthesis of Co- and N-doped carbon microtubes composed of hollow nanospheres and nanotubes for effcient oxygen reduction reaction Small 13 2017 1603437 S.H. Ahn, A. Manthiram, Self-templated synthesis of Co- and N-doped carbon microtubes composed of hollow nanospheres and nanotubes for effcient oxygen reduction reaction, Small 13 (2017) 1603437. [38] M. Wu E. Zhang Q. Guo Y. Wang J. Qiao K. Li P. Pei N/S-Me (Fe, Co, Ni) doped hierarchical porous carbons for fuel cell oxygen reduction reaction with high catalytic activity and long-term stability Appl. Energy 175 2016 468 478 M. Wu, E. Zhang, Q. Guo, Y. Wang, J. Qiao, K. Li, P. Pei, N/S-Me (Fe, Co, Ni) doped hierarchical porous carbons for fuel cell oxygen reduction reaction with high catalytic activity and long-term stability, Appl. Energy 175 (2016) 468–478. [39] C. Du X. Liu G. Ye X. Gao Z. Zhuang P. Li D. Xiang X. Li A.Z. Clayborne X. Zhou W. Chen Balancing the micro-mesoporosity for activity maximization of N-doped carbonaceous electrocatalysts for the oxygen reduction reaction ChemSusChem 12 2019 1017 1025 C. Du, X. Liu, G. Ye, X. Gao, Z. Zhuang, P. Li, D. Xiang, X. Li, A.Z. Clayborne, X. Zhou, W. Chen, Balancing the micro-mesoporosity for activity maximization of N-doped carbonaceous electrocatalysts for the oxygen reduction reaction, ChemSusChem 12 (2019) 1017–1025. [40] D. Duan S. Zhong J. Huo J. Chen X. Shi H. Peng X. Li S. Liao High-performance atomic Co/N co-doped porous carbon catalysts derived from Co-doped metal-organic frameworks for oxygen reduction J. Colloid Interface Sci. 634 2023 940 948 D. Duan, S. Zhong, J. Huo, J. Chen, X. Shi, H. Peng, X. Li, S. Liao, High-performance atomic Co/N co-doped porous carbon catalysts derived from Co-doped metal-organic frameworks for oxygen reduction, J. Colloid Interface Sci. 634 (2023) 940–948. [41] B. Chen R. Li G. Ma X. Gou Y. Zhu Y. Xia Cobalt sulfide/N,S codoped porous carbon core-shell nanocomposites as superior bifunctional electrocatalysts for oxygen reduction and evolution reactions Nanoscale 7 2015 20674 20684 B. Chen, R. Li, G. Ma, X. Gou, Y. Zhu, Y. Xia, Cobalt sulfide/N,S codoped porous carbon core-shell nanocomposites as superior bifunctional electrocatalysts for oxygen reduction and evolution reactions, Nanoscale 7 (2015) 20674–20684. [42] N. Jia J. Liu Y. Gao P. Chen X. Chen Z. An X. Li Y. Chen Graphene-encapsulated Co9S8 nanoparticles on N,S-codoped carbon nanotubes: an efficient bifunctional oxygen electrocatalyst ChemSusChem 12 2019 3390 3400 N. Jia, J. Liu, Y. Gao, P. Chen, X. Chen, Z. An, X. Li, Y. Chen, Graphene-encapsulated Co9S8 nanoparticles on N,S-codoped carbon nanotubes: an efficient bifunctional oxygen electrocatalyst, ChemSusChem 12 (2019) 3390–3400. [43] X. He J. Tan F. Yin B. Chen X. Liang G. Li H. Yin Well-dispersed Co-Co3O4 hybrid nanoparticles on N-doped carbon nanosheets as a bifunctional electrocatalyst for oxygen evolution and reduction reactions Int. J. Hydrogen Energy 44 2019 24184 24196 X. He, J. Tan, F. Yin, B. Chen, X. Liang, G. Li, H. Yin, Well-dispersed Co-Co3O4 hybrid nanoparticles on N-doped carbon nanosheets as a bifunctional electrocatalyst for oxygen evolution and reduction reactions, Int. J. Hydrogen Energy 44 (2019) 24184–24196. [44] Y. Lian K. Shi H. Yang H. Sun P. Qi J. Ye W. Wu Z. Deng Y. Peng Elucidation of active sites on S, N codoped carbon cubes embedding Co-Fe carbides toward reversible oxygen conversion in high-performance zinc-air batteries Small 16 2020 1907368 Y. Lian, K. Shi, H. Yang, H. Sun, P. Qi, J. Ye, W. Wu, Z. Deng, Y. Peng, Elucidation of active sites on S, N codoped carbon cubes embedding Co-Fe carbides toward reversible oxygen conversion in high-performance zinc-air batteries, Small 16 (2020), 1907368. [45] W. Xie J. Li Y. Song S. Li J. Li M. Shao Hierarchical carbon microtube@nanotube core-shell structure for high-performance oxygen electrocatalysis and Zn-air battery Nano-Micro Lett 12 2020 97 W. Xie, J. Li, Y. Song, S. Li, J. Li, M. Shao, Hierarchical carbon microtube@nanotube core-shell structure for high-performance oxygen electrocatalysis and Zn-air battery, Nano-Micro Lett. 12 (2020) 97. [46] Y. Li M. Cui C. Wang Y. Chen S. Chen L. Gao A. Liu W.N. Su T. Ma Morphology engineering of cobalt embedded in nitrogen doped porous carbon as bifunctional oxygen electrocatalyst for Zn-air battery Mater. Today Energy 17 2020 100455 Y. Li, M. Cui, C. Wang, Y. Chen, S. Chen, L. Gao, A. Liu, W.N. Su, T. Ma, Morphology engineering of cobalt embedded in nitrogen doped porous carbon as bifunctional oxygen electrocatalyst for Zn-air battery, Mater. Today Energy 17 (2020), 100455. [47] D. Liu B. Wang H. Li S. Huang M. Liu J. Wang Q. Wang J. Zhang Y. Zhao Distinguished Zn,Co-Nx-C-Sy active sites confined in dentric carbon for highly efficient oxygen reduction reaction and flexible Zn-air batteries Nano Energy 58 2019 277 283 D. Liu, B. Wang, H. Li, S. Huang, M. Liu, J. Wang, Q. Wang, J. Zhang, Y. Zhao, Distinguished Zn,Co-Nx-C-Sy active sites confined in dentric carbon for highly efficient oxygen reduction reaction and flexible Zn-air batteries, Nano Energy 58 (2019) 277–283. [48] K. Huang W. Zhang R. Devasenathipathy Z. Yang X. Zhang X. Wang D.H. Chen Y. Fan W. Chen Co nanoparticles and ZnS decorated N, S co-doped carbon nanotubes as an efficient oxygen reduction catalyst in zinc-air batteries Int. J. Hydrogen Energy 58 2021 30090 30100 K. Huang, W. Zhang, R. Devasenathipathy, Z. Yang, X. Zhang, X. Wang, D.H. Chen, Y. Fan, W. Chen, Co nanoparticles and ZnS decorated N, S co-doped carbon nanotubes as an efficient oxygen reduction catalyst in zinc-air batteries, Int. J. Hydrogen Energy 58 (2021) 30090–30100. [49] J. Shu Q. Niu N. Wang J. Nie G. Ma Alginate derived Co/N doped hierarchical porous carbon microspheres for efficient oxygen reduction reaction Appl. Surf. Sci. 485 2019 520 528 J. Shu, Q. Niu, N. Wang, J. Nie, G. Ma, Alginate derived Co/N doped hierarchical porous carbon microspheres for efficient oxygen reduction reaction, Appl. Surf. Sci. 485 (2019) 520–528. [50] J. Liu M. Zhang L. Zhai Y. Wang D. Han P. Chen N. Qin L. Mi L. Yang Co-N Heteroatomic Interface Engineering in Peanut Shell-Derived Porous Carbon for Enhanced Oxygen Reduction Reaction J. Colloid Interface Sci. 622 2022 971 977 J. Liu, M. Zhang, L. Zhai, Y. Wang, D. Han, P. Chen, N. Qin, L. Mi, L. Yang, Co-N Heteroatomic Interface Engineering in Peanut Shell-Derived Porous Carbon for Enhanced Oxygen Reduction Reaction, J. Colloid Interface Sci. 622 (2022) 971–977. [51] W. Wei F. Lu L. Cui Y. Zhang Y. Wei L. Zong S heteroatom doping in highly porous carbonaceous spheres for boosted oxygen reduction reaction of atomically dispersed Fe-N4 active sites Carbon N Y 197 2022 112 119 W. Wei, F. Lu, L. Cui, Y. Zhang, Y. Wei, L. Zong, S heteroatom doping in highly porous carbonaceous spheres for boosted oxygen reduction reaction of atomically dispersed Fe-N4 active sites, Carbon N Y 197 (2022) 112–119. [52] F. Ding H. Liu X. Jiang Y. Jiang J. Cheng Y. Tu W. Xiao C. Li X. Yan Bimetallic zeolite imidazolium framework derived multiphase Co/HNC as pH-universal catalysts with efficient oxygen reduction performance for microbial fuel cells Electrochim. Acta 438 2023 141548 F. Ding, H. Liu, X. Jiang, Y. Jiang, J. Cheng, Y. Tu, W. Xiao, C. Li, X. Yan, Bimetallic zeolite imidazolium framework derived multiphase Co/HNC as pH-universal catalysts with efficient oxygen reduction performance for microbial fuel cells, Electrochim. Acta 438 (2023), 141548. [53] S. Wang S. Chen L. Ma J.A. Zapien Recent progress in cobalt-based carbon materials as oxygen electrocatalysts for zinc-air battery applications Mater. Today Energy 20 2021 100659 S. Wang, S. Chen, L. Ma, J.A. Zapien, Recent progress in cobalt-based carbon materials as oxygen electrocatalysts for zinc-air battery applications, Mater. Today Energy 20 (2021), 100659. [54] Md.A. Ahsan T. He K. Eid A.M. Abdullah M.F. Sanad A. Aldalbahi B. Alvarado-Tenorio A. Du A.R.P. Santiago J.C. Noveron Controlling the Interfacial Charge Polarization of MOF-Derived 0D-2D vdW Architectures as a Unique Strategy for Bifunctional Oxygen Electrocatalysis ACS Appl. Mater. Interfaces 14 2022 3919 3929 Md.A. Ahsan, T. He, K. Eid, A.M. Abdullah, M.F. Sanad, A. Aldalbahi, B. Alvarado-Tenorio, A. Du, A.R.P. Santiago, J.C. Noveron, Controlling the Interfacial Charge Polarization of MOF-Derived 0D-2D vdW Architectures as a Unique Strategy for Bifunctional Oxygen Electrocatalysis, ACS Appl. Mater. Interfaces 14 (2022) 3919–3929. [55] S. Lin Y. Chen Y. Cao L. Zhang J. Feng A. Wang Aminouracil-assisted synthesis of CoFe decorated bougainvillea-like N-doped carbon nanoflowers for boosting Zn-air battery and water electrolysis J. Power Sources 521 2022 230926 S. Lin, Y. Chen, Y. Cao, L. Zhang, J. Feng, A. Wang, Aminouracil-assisted synthesis of CoFe decorated bougainvillea-like N-doped carbon nanoflowers for boosting Zn-air battery and water electrolysis, J. Power Sources 521 (2022), 230926. [56] Y. Ling M. Li K. Qu Z. Yang Electronically interacted Co3O4/WS2 as superior oxygen electrode for rechargeable zinc-air batteries Chem. Commun. 56 2020 15193 15196 Y. Ling, M. Li, K. Qu, Z. Yang, Electronically interacted Co3O4/WS2 as superior oxygen electrode for rechargeable zinc-air batteries, Chem. Commun. 56 (2020) 15193–15196. [57] D. Son S. Bae S.M.N. Jeghan G. Lee S-co-doped N FeCo Nanoparticles Supported on Porous Carbon Nanofibers as Efficient and Durable Oxygen Reduction Catalysts ChemSusChem 16 2023 e202201528 D. Son, S. Bae, S.M.N. Jeghan, G. Lee, N, S-co-doped FeCo Nanoparticles Supported on Porous Carbon Nanofibers as Efficient and Durable Oxygen Reduction Catalysts, ChemSusChem 16 (2023), e202201528. [58] Y. Yuan J. Wang S. Adimi H. Shen T. Thomas R. Ma J.P. Attfield M. Yang Zirconium nitride catalysts surpass platinum for oxygen reduction Nat. Mater. 19 2020 282 286 Y. Yuan, J. Wang, S. Adimi, H. Shen, T. Thomas, R. Ma, J.P. Attfield, M. Yang, Zirconium nitride catalysts surpass platinum for oxygen reduction, Nat. Mater. 19 (2020) 282–286. [59] H. Zheng J. Zhong X. Liu Y. Zhu B. Hou L. Zhao C. Sun X. Wang Z. Su Co-modified polyoxovanadoborates derived Co/BN-CNT/VN based bifunctional electrocatalysts for rechargeable zinc-air batteries J. Colloid Interface Sci. 634 2023 675 683 H. Zheng, J. Zhong, X. Liu, Y. Zhu, B. Hou, L. Zhao, C. Sun, X. Wang, Z. Su, Co-modified polyoxovanadoborates derived Co/BN-CNT/VN based bifunctional electrocatalysts for rechargeable zinc-air batteries, J. Colloid Interface Sci. 634 (2023) 675–683. [60] T. Zhang Q. Han T. Li L. Lv W. Luo Z. Li An efficient electrocatalyst toward oxygen reduction reaction: state-of-theart of hierarchical porous nanostructure of Mn3O4 supported on three-dimensional graphene J. Electroanal. Chem. 905 2022 115898 T. Zhang, Q. Han, T. Li, L. Lv, W. Luo, Z. Li, An efficient electrocatalyst toward oxygen reduction reaction: state-of-theart of hierarchical porous nanostructure of Mn3O4 supported on three-dimensional graphene, J. Electroanal. Chem. 905 (2022), 115898. [61] K. Sheng J. Li G. Li J. Hao Y. Wang Y. Liu Y. Liu Q. Yi W. Li Ultrafine Fe2C nanocrystals encapsulated in interconnected hollow carbon spheres as ORR electrocatalysts for Alkaline/Neutral Zn-Air batteries Appl. Surf. Sci. 601 2022 154221 K. Sheng, J. Li, G. Li, J. Hao, Y. Wang, Y. Liu, Y. Liu, Q. Yi, W. Li, Ultrafine Fe2C nanocrystals encapsulated in interconnected hollow carbon spheres as ORR electrocatalysts for Alkaline/Neutral Zn-Air batteries, Appl. Surf. Sci. 601 (2022), 154221. [62] L.P. Lv P. Du P. Liu X. Li Y. Wang Integrating mixed metallic selenides/nitrogen-doped carbon heterostructures in one-dimensional carbon fibers for efficient oxygen reduction electrocatalysis ACS Sustainable Chem. Eng. 8 2020 8391 8401 L.P. Lv, P. Du, P. Liu, X. Li, Y. Wang, Integrating mixed metallic selenides/nitrogen-doped carbon heterostructures in one-dimensional carbon fibers for efficient oxygen reduction electrocatalysis, ACS Sustainable Chem. Eng. 8 (2020) 8391–8401. [63] F. Fan Y. Hui R. Devasenathipathy X. Peng Q. Huang W. Xu F. Yang X. Liu L. Wang D.-.H. Chen Y. Fan W. Chen Composition-adjustable Mo6Co6C2/Co@carbon nanocage for enhanced oxygen reduction and evolution reactions J Colloid Interf Sci 636 2023 450 458 F. Fan, Y. Hui, R. Devasenathipathy, X. Peng, Q. Huang, W. Xu, F. Yang, X. Liu, L. Wang, D.-.H. Chen, Y. Fan, W. Chen, Composition-adjustable Mo6Co6C2/Co@carbon nanocage for enhanced oxygen reduction and evolution reactions. J Colloid Interf Sci, 636 (2023) 450–458. [64] W. Wu L. Zong X. Chen W. Zhang L. Cui Y. Yang X. Wang S. Li L. Wang Co nanoislands activated Co,N-doped porous carbon nanospheres for highly efficient and durable oxygen electrocatalyst Appl. Surf. Sci. 541 2021 148262 W. Wu, L. Zong, X. Chen, W. Zhang, L. Cui, Y. Yang, X. Wang, S. Li, L. Wang, Co nanoislands activated Co,N-doped porous carbon nanospheres for highly efficient and durable oxygen electrocatalyst, Appl. Surf. Sci. 541 (2021), 148262. [65] Z. Chen S. Zhang J. Zhao H. Zhang J. Wang Q. Dong W. Zhang X. Han W. Hu Iodine-induced formation of C-pyridinic-N-Co sites on carbon-encapsulated cobalt nanocrystals as electrocatalyst for rechargeable Zn-air batteries Chem. Eng. J. 462 2023 142030 Z. Chen, S. Zhang, J. Zhao, H. Zhang, J. Wang, Q. Dong, W. Zhang, X. Han, W. Hu, Iodine-induced formation of C-pyridinic-N-Co sites on carbon-encapsulated cobalt nanocrystals as electrocatalyst for rechargeable Zn-air batteries, Chem. Eng. J. 462 (2023), 142030. [66] M. Shen C. Ruan Y. Chen C. Jiang K. Ai L. Lu Covalent entrapment of cobalt-iron sulfides in N-doped mesoporous carbon: extraordinary bifunctional electrocatalysts for oxygen reduction and evolution reactions ACS Appl. Mater. Interfaces 7 2015 1207 1218 M. Shen, C. Ruan, Y. Chen, C. Jiang, K. Ai, L. Lu, Covalent entrapment of cobalt-iron sulfides in N-doped mesoporous carbon: extraordinary bifunctional electrocatalysts for oxygen reduction and evolution reactions, ACS Appl. Mater. Interfaces 7 (2015) 1207–1218. [67] W. Kong K. Yao X. Duan Z. Liu J. Hu Holey Co N-codoped graphene aerogel with in-plane pores and multiple active sites for efficient oxygen reduction Electrochim. Acta 269 2018 544 552 W. Kong, K. Yao, X. Duan, Z. Liu, J. Hu, Holey Co, N-codoped graphene aerogel with in-plane pores and multiple active sites for efficient oxygen reduction, Electrochim. Acta 269 (2018) 544–552. [68] W. Zhang X. Yao S. Zhou X. Li L. Li Z. Yu L. Gu ZIF-8/ZIF-67-derived Co-Nx-embedded 1D porous carbon nanofibers with graphitic carbon-encased Co nanoparticles as an efficient bifunctional electrocatalyst Small 14 2018 e1800423 W. Zhang, X. Yao, S. Zhou, X. Li, L. Li, Z. Yu, L. Gu, ZIF-8/ZIF-67-derived Co-Nx-embedded 1D porous carbon nanofibers with graphitic carbon-encased Co nanoparticles as an efficient bifunctional electrocatalyst, Small 14 (2018), e1800423. [69] X. Qu Y. Li G. Li R. Ji S. Yin X. Cheng C. Wang J. Yang Y. Jiang S. Sun Boosting the ORR performance of Fe-N/C catalyst via increasing the density and modifying the electronic structure of Fe-NX active sites Electrochim. Acta 403 2022 139604 X. Qu, Y. Li, G. Li, R. Ji, S. Yin, X. Cheng, C. Wang, J. Yang, Y. Jiang, S. Sun, Boosting the ORR performance of Fe-N/C catalyst via increasing the density and modifying the electronic structure of Fe-NX active sites, Electrochim. Acta 403 (2022), 139604.",
      "scopus-id": "85151460509",
      "coredata": {
        "eid": "1-s2.0-S2468823123001888",
        "dc:description": "Electrochemical energy (e.g., fuel cell and metal-air batteries) is featured by large theoretical energy density, high conversion efficiency, safe operation and pollution-free emission. However, the sluggish dynamics of oxygen reduction reaction (ORR) and high cost of noble metals hinder their widespread commercial applications in electrochemical energy devices. Herein, we present a method for the preparation of the N, S co-doped carbon film wrapped Co nanoparticles (Co/NSC) for ORR by aging and then pyrolyzing the mixture of cobalt salt and 1-(p-Toluenesulfonyl)imidazole. The co-doping of N and S facilitates the electron rearrangement of the carbon film, resulting in a rapid electron transfer. The core-shell structure enhances the interaction between N, S co-doped carbon film and Co nanoparticles. These features endow the Co/NSC catalyst an excellent ORR with a half-wave potential of 0.860 V and limiting current density of 6.2 mA cm-2, besides the superior anti-methanol. The Co/NSC catalyst as the air cathode grants the assembled zinc-air battery high open circuit voltage (1.467 V), large peak power density (156.2 mW cm-2), great specific capacity (747.9 mAh gZn -1), and excellent stability. Thus, the prepared Co/NSC catalyst exhibits a promising application in zinc-air battery. This work provides an approach for the synthesis of the carbon-shell coated non-noble metal catalyst and its subsequent applications in oxygen electrocatalysis.",
        "openArchiveArticle": "false",
        "prism:coverDate": "2023-04-15",
        "openaccessUserLicense": null,
        "prism:aggregationType": "Journal",
        "prism:url": "https://api.elsevier.com/content/article/pii/S2468823123001888",
        "dc:creator": [
          {
            "@_fa": "true",
            "$": "Huang, Kexin"
          },
          {
            "@_fa": "true",
            "$": "Hui, Yanxing"
          },
          {
            "@_fa": "true",
            "$": "Yang, Zhongyun"
          },
          {
            "@_fa": "true",
            "$": "Waqas, Muhammad"
          },
          {
            "@_fa": "true",
            "$": "Fan, Fangfang"
          },
          {
            "@_fa": "true",
            "$": "Wang, Limin"
          },
          {
            "@_fa": "true",
            "$": "Liu, Xiaotian"
          },
          {
            "@_fa": "true",
            "$": "Huang, Qiulan"
          },
          {
            "@_fa": "true",
            "$": "Huang, Dujuan"
          },
          {
            "@_fa": "true",
            "$": "Chen, Du-Hong"
          },
          {
            "@_fa": "true",
            "$": "Fan, Youjun"
          },
          {
            "@_fa": "true",
            "$": "Chen, Wei"
          }
        ],
        "link": [
          {
            "@_fa": "true",
            "@rel": "self",
            "@href": "https://api.elsevier.com/content/article/pii/S2468823123001888"
          },
          {
            "@_fa": "true",
            "@rel": "scidir",
            "@href": "https://www.sciencedirect.com/science/article/pii/S2468823123001888"
          }
        ],
        "dc:format": "application/json",
        "openaccessType": null,
        "pii": "S2468-8231(23)00188-8",
        "prism:volume": "541",
        "articleNumber": "113102",
        "prism:publisher": "Elsevier B.V.",
        "dc:title": "N, S co-doped carbon film wrapped Co nanoparticles for boosting oxygen reduction reaction",
        "prism:copyright": "© 2023 Elsevier B.V. All rights reserved.",
        "openaccess": "0",
        "prism:issn": "24688231",
        "dcterms:subject": [
          {
            "@_fa": "true",
            "$": "Core-shell structure"
          },
          {
            "@_fa": "true",
            "$": "Oxygen reduction reaction"
          },
          {
            "@_fa": "true",
            "$": "Non-noble metal catalysts"
          },
          {
            "@_fa": "true",
            "$": "N, S co-doping"
          },
          {
            "@_fa": "true",
            "$": "Zinc-air battery"
          }
        ],
        "openaccessArticle": "false",
        "prism:publicationName": "Molecular Catalysis",
        "openaccessSponsorType": null,
        "prism:pageRange": "113102",
        "pubType": "fla",
        "prism:coverDisplayDate": "15 April 2023",
        "prism:doi": "10.1016/j.mcat.2023.113102",
        "prism:startingPage": "113102",
        "dc:identifier": "doi:10.1016/j.mcat.2023.113102",
        "openaccessSponsorName": null
      },
      "objects": {
        "object": [
          {
            "@category": "standard",
            "@height": "518",
            "@width": "678",
            "@_fa": "true",
            "$": "https://api.elsevier.com/content/object/eid/1-s2.0-S2468823123001888-gr5.jpg?httpAccept=%2A%2F%2A",
            "@multimediatype": "JPEG image file",
            "@type": "IMAGE-DOWNSAMPLED",
            "@size": "81505",
            "@ref": "gr5",
            "@mimetype": "image/jpeg"
          },
          {
            "@category": "standard",
            "@height": "503",
            "@width": "715",
            "@_fa": "true",
            "$": "https://api.elsevier.com/content/object/eid/1-s2.0-S2468823123001888-gr4.jpg?httpAccept=%2A%2F%2A",
            "@multimediatype": "JPEG image file",
            "@type": "IMAGE-DOWNSAMPLED",
            "@size": "86666",
            "@ref": "gr4",
            "@mimetype": "image/jpeg"
          },
          {
            "@category": "standard",
            "@height": "517",
            "@width": "678",
            "@_fa": "true",
            "$": "https://api.elsevier.com/content/object/eid/1-s2.0-S2468823123001888-gr3.jpg?httpAccept=%2A%2F%2A",
            "@multimediatype": "JPEG image file",
            "@type": "IMAGE-DOWNSAMPLED",
            "@size": "132095",
            "@ref": "gr3",
            "@mimetype": "image/jpeg"
          },
          {
            "@category": "standard",
            "@height": "239",
            "@width": "678",
            "@_fa": "true",
            "$": "https://api.elsevier.com/content/object/eid/1-s2.0-S2468823123001888-gr2.jpg?httpAccept=%2A%2F%2A",
            "@multimediatype": "JPEG image file",
            "@type": "IMAGE-DOWNSAMPLED",
            "@size": "55221",
            "@ref": "gr2",
            "@mimetype": "image/jpeg"
          },
          {
            "@category": "standard",
            "@height": "200",
            "@width": "405",
            "@_fa": "true",
            "$": "https://api.elsevier.com/content/object/eid/1-s2.0-S2468823123001888-ga1.jpg?httpAccept=%2A%2F%2A",
            "@multimediatype": "JPEG image file",
            "@type": "IMAGE-DOWNSAMPLED",
            "@size": "37936",
            "@ref": "ga1",
            "@mimetype": "image/jpeg"
          },
          {
            "@category": "standard",
            "@height": "872",
            "@width": "678",
            "@_fa": "true",
            "$": "https://api.elsevier.com/content/object/eid/1-s2.0-S2468823123001888-gr1.jpg?httpAccept=%2A%2F%2A",
            "@multimediatype": "JPEG image file",
            "@type": "IMAGE-DOWNSAMPLED",
            "@size": "272319",
            "@ref": "gr1",
            "@mimetype": "image/jpeg"
          },
          {
            "@category": "standard",
            "@height": "505",
            "@width": "715",
            "@_fa": "true",
            "$": "https://api.elsevier.com/content/object/eid/1-s2.0-S2468823123001888-gr6.jpg?httpAccept=%2A%2F%2A",
            "@multimediatype": "JPEG image file",
            "@type": "IMAGE-DOWNSAMPLED",
            "@size": "98385",
            "@ref": "gr6",
            "@mimetype": "image/jpeg"
          },
          {
            "@category": "thumbnail",
            "@height": "164",
            "@width": "214",
            "@_fa": "true",
            "$": "https://api.elsevier.com/content/object/eid/1-s2.0-S2468823123001888-gr5.sml?httpAccept=%2A%2F%2A",
            "@multimediatype": "GIF image file",
            "@type": "IMAGE-THUMBNAIL",
            "@size": "10127",
            "@ref": "gr5",
            "@mimetype": "image/gif"
          },
          {
            "@category": "thumbnail",
            "@height": "154",
            "@width": "219",
            "@_fa": "true",
            "$": "https://api.elsevier.com/content/object/eid/1-s2.0-S2468823123001888-gr4.sml?httpAccept=%2A%2F%2A",
            "@multimediatype": "GIF image file",
            "@type": "IMAGE-THUMBNAIL",
            "@size": "10689",
            "@ref": "gr4",
            "@mimetype": "image/gif"
          },
          {
            "@category": "thumbnail",
            "@height": "164",
            "@width": "215",
            "@_fa": "true",
            "$": "https://api.elsevier.com/content/object/eid/1-s2.0-S2468823123001888-gr3.sml?httpAccept=%2A%2F%2A",
            "@multimediatype": "GIF image file",
            "@type": "IMAGE-THUMBNAIL",
            "@size": "16481",
            "@ref": "gr3",
            "@mimetype": "image/gif"
          },
          {
            "@category": "thumbnail",
            "@height": "77",
            "@width": "219",
            "@_fa": "true",
            "$": "https://api.elsevier.com/content/object/eid/1-s2.0-S2468823123001888-gr2.sml?httpAccept=%2A%2F%2A",
            "@multimediatype": "GIF image file",
            "@type": "IMAGE-THUMBNAIL",
            "@size": "7934",
            "@ref": "gr2",
            "@mimetype": "image/gif"
          },
          {
            "@category": "thumbnail",
            "@height": "108",
            "@width": "219",
            "@_fa": "true",
            "$": "https://api.elsevier.com/content/object/eid/1-s2.0-S2468823123001888-ga1.sml?httpAccept=%2A%2F%2A",
            "@multimediatype": "GIF image file",
            "@type": "IMAGE-THUMBNAIL",
            "@size": "13241",
            "@ref": "ga1",
            "@mimetype": "image/gif"
          },
          {
            "@category": "thumbnail",
            "@height": "163",
            "@width": "127",
            "@_fa": "true",
            "$": "https://api.elsevier.com/content/object/eid/1-s2.0-S2468823123001888-gr1.sml?httpAccept=%2A%2F%2A",
            "@multimediatype": "GIF image file",
            "@type": "IMAGE-THUMBNAIL",
            "@size": "18007",
            "@ref": "gr1",
            "@mimetype": "image/gif"
          },
          {
            "@category": "thumbnail",
            "@height": "155",
            "@width": "219",
            "@_fa": "true",
            "$": "https://api.elsevier.com/content/object/eid/1-s2.0-S2468823123001888-gr6.sml?httpAccept=%2A%2F%2A",
            "@multimediatype": "GIF image file",
            "@type": "IMAGE-THUMBNAIL",
            "@size": "13524",
            "@ref": "gr6",
            "@mimetype": "image/gif"
          },
          {
            "@category": "high",
            "@height": "2293",
            "@width": "3000",
            "@_fa": "true",
            "$": "https://api.elsevier.com/content/object/eid/1-s2.0-S2468823123001888-gr5_lrg.jpg?httpAccept=%2A%2F%2A",
            "@multimediatype": "JPEG image file",
            "@type": "IMAGE-HIGH-RES",
            "@size": "590938",
            "@ref": "gr5",
            "@mimetype": "image/jpeg"
          },
          {
            "@category": "high",
            "@height": "2227",
            "@width": "3167",
            "@_fa": "true",
            "$": "https://api.elsevier.com/content/object/eid/1-s2.0-S2468823123001888-gr4_lrg.jpg?httpAccept=%2A%2F%2A",
            "@multimediatype": "JPEG image file",
            "@type": "IMAGE-HIGH-RES",
            "@size": "652422",
            "@ref": "gr4",
            "@mimetype": "image/jpeg"
          },
          {
            "@category": "high",
            "@height": "2286",
            "@width": "3000",
            "@_fa": "true",
            "$": "https://api.elsevier.com/content/object/eid/1-s2.0-S2468823123001888-gr3_lrg.jpg?httpAccept=%2A%2F%2A",
            "@multimediatype": "JPEG image file",
            "@type": "IMAGE-HIGH-RES",
            "@size": "1072140",
            "@ref": "gr3",
            "@mimetype": "image/jpeg"
          },
          {
            "@category": "high",
            "@height": "1057",
            "@width": "3000",
            "@_fa": "true",
            "$": "https://api.elsevier.com/content/object/eid/1-s2.0-S2468823123001888-gr2_lrg.jpg?httpAccept=%2A%2F%2A",
            "@multimediatype": "JPEG image file",
            "@type": "IMAGE-HIGH-RES",
            "@size": "411074",
            "@ref": "gr2",
            "@mimetype": "image/jpeg"
          },
          {
            "@category": "high",
            "@height": "886",
            "@width": "1795",
            "@_fa": "true",
            "$": "https://api.elsevier.com/content/object/eid/1-s2.0-S2468823123001888-ga1_lrg.jpg?httpAccept=%2A%2F%2A",
            "@multimediatype": "JPEG image file",
            "@type": "IMAGE-HIGH-RES",
            "@size": "272571",
            "@ref": "ga1",
            "@mimetype": "image/jpeg"
          },
          {
            "@category": "high",
            "@height": "3857",
            "@width": "3000",
            "@_fa": "true",
            "$": "https://api.elsevier.com/content/object/eid/1-s2.0-S2468823123001888-gr1_lrg.jpg?httpAccept=%2A%2F%2A",
            "@multimediatype": "JPEG image file",
            "@type": "IMAGE-HIGH-RES",
            "@size": "2226038",
            "@ref": "gr1",
            "@mimetype": "image/jpeg"
          },
          {
            "@category": "high",
            "@height": "2237",
            "@width": "3167",
            "@_fa": "true",
            "$": "https://api.elsevier.com/content/object/eid/1-s2.0-S2468823123001888-gr6_lrg.jpg?httpAccept=%2A%2F%2A",
            "@multimediatype": "JPEG image file",
            "@type": "IMAGE-HIGH-RES",
            "@size": "732734",
            "@ref": "gr6",
            "@mimetype": "image/jpeg"
          },
          {
            "@category": "standard",
            "@_fa": "true",
            "$": "https://api.elsevier.com/content/object/eid/1-s2.0-S2468823123001888-mmc1.doc?httpAccept=%2A%2F%2A",
            "@multimediatype": "Microsoft Word file",
            "@type": "APPLICATION",
            "@size": "2029056",
            "@ref": "mmc1",
            "@mimetype": "application/word"
          },
          {
            "@category": "thumbnail",
            "@_fa": "true",
            "$": "https://api.elsevier.com/content/object/eid/1-s2.0-S2468823123001888-si1.svg?httpAccept=%2A%2F%2A",
            "@multimediatype": "Scalable Vector Graphics file",
            "@type": "ALTIMG",
            "@size": "12706",
            "@ref": "si1",
            "@mimetype": "image/svg+xml"
          },
          {
            "@category": "thumbnail",
            "@_fa": "true",
            "$": "https://api.elsevier.com/content/object/eid/1-s2.0-S2468823123001888-si2.svg?httpAccept=%2A%2F%2A",
            "@multimediatype": "Scalable Vector Graphics file",
            "@type": "ALTIMG",
            "@size": "6313",
            "@ref": "si2",
            "@mimetype": "image/svg+xml"
          },
          {
            "@category": "thumbnail",
            "@_fa": "true",
            "$": "https://api.elsevier.com/content/object/eid/1-s2.0-S2468823123001888-si3.svg?httpAccept=%2A%2F%2A",
            "@multimediatype": "Scalable Vector Graphics file",
            "@type": "ALTIMG",
            "@size": "9083",
            "@ref": "si3",
            "@mimetype": "image/svg+xml"
          },
          {
            "@category": "standard",
            "@_fa": "true",
            "$": "https://api.elsevier.com/content/object/eid/1-s2.0-S2468823123001888-am.pdf?httpAccept=%2A%2F%2A",
            "@multimediatype": "Acrobat PDF file",
            "@type": "AAM-PDF",
            "@size": "2265390",
            "@ref": "am",
            "@mimetype": "application/pdf"
          }
        ]
      },
      "link": {
        "@rel": "abstract",
        "@href": "https://api.elsevier.com/content/abstract/scopus_id/85151460509"
      }
    }
  }
}