{
  "metadata": {
    "title": "Two efficient pathways for the synthesis of aryl ketones catalyzed by phosphorus-free palladium catalysts",
    "authors": "; ; ",
    "journal": "Molecular Catalysis",
    "date": "2018-02-28",
    "doi": "10.1016/j.mcat.2017.10.021",
    "abstract": "",
    "uri": "https://api.elsevier.com/content/article/pii/S2468823117305655",
    "pii": "S2468823117305655"
  },
  "fulltext": {
    "full-text-retrieval-response": {
      "scopus-eid": "2-s2.0-85039808634",
      "originalText": "serial JL 315758 291210 291744 291790 291809 31 Molecular Catalysis MOLECULARCATALYSIS 2017-11-10 2017-11-10 2017-11-10 2017-11-10 2019-02-28T03:55:43 1-s2.0-S2468823117305655 S2468-8231(17)30565-5 S2468823117305655 10.1016/j.mcat.2017.10.021 S300 S300.4 FULL-TEXT 1-s2.0-S2468823117X00199 2019-02-28T04:03:11.973477Z 0 0 20180201 20180228 2018 2017-11-10T19:06:12.389006Z absattachment articleinfo articletitlenorm authfirstinitialnorm authfirstsurnamenorm cid cids contenttype copyright crossmark dateloaded dateloadedtxt datesearch datesort dateupdated dco docsubtype doctype doi eid ewtransactionid hubeid indexeddate issn issnnorm itemstage itemtransactionid itemweight openaccess openarchive pg pgfirst pglast pii piinorm pubdateend pubdatestart pubdatetxt pubyr sectiontitle sortorder srctitle srctitlenorm srctype ssids alllist content subj subheadings suppl tomb volfirst volissue volumelist webpdf webpdfpagecount yearnav figure table e-component body acknowledge affil appendices articletitle auth authfirstini authfull authkeywords authlast grantnumber grantsponsor highlightsabst primabst pubtype ref specialabst 2468-8231 24688231 true 445 445 C Volume 445 9 61 72 61 72 201802 February 2018 2018-02-01 2018-02-28 2018 Regular Papers article fla © 2017 Elsevier B.V. All rights reserved. TWOEFFICIENTPATHWAYSFORSYNTHESISARYLKETONESCATALYZEDBYPHOSPHORUSFREEPALLADIUMCATALYSTS WIRWIS A 1 Introduction 2 Results and discussion 2.1 Arylation of allylic alcohols 2.2 Synthesis of raspberry ketone 2.3 Arylation of unsaturated ketones 2.4 Catalytic activity of anionic palladates 2.5 TEM studies 2.6 The role of Pd NPs in the catalytic reaction: the mercury test 2.7 Isomerization and hydrogenation of allylic alcohols 3 Experimental 3.1 Instrumental methods 3.2 Arylation of 1-alken-3-ols 3.3 Arylation of 3-buten-2-one followed by hydrogenation 3.4 Arylation of 3-buten-2-ol in H2 atmosphere 3.5 Preparation of samples for TEM 3.6 Hg(0) test 4 Conclusions Acknowledgements Appendix A Supplementary data References MURTHY 1999 5344 5345 Y DUCKI 1997 3091 3094 S BOREJSZAWYSOCKI 1994 623 628 W MORIMOTO 2005 194 204 C BOKER 2001 568 572 A SAWASAKI 2004 254 258 E TATEIWA 1994 5901 5904 J FRATTINI 2001 6827 6829 S BERA 2009 1300 1305 R VIVIANO 2011 858 870 M RAJU 2010 11840 11842 B ZUMBANSEN 2010 1135 1138 K LUO 2007 1923 1930 S PAUL 2005 213 222 S CLIMENT 2007 1949 1954 M JANSAT 2009 244 246 S RALUY 2011 13579 13584 E LOPEZVINASCO 2015 56 61 A BOUQUILLON 2001 153 156 S SIGMAN 2012 874 884 M MUZART 2005 4179 4212 J CHAUDHARI 2015 4841 4845 T XU 2014 1960 1967 L BENHADDOU 1988 247 248 R MELPOLDER 1976 265 272 J DEVRIES 2003 3285 3288 A BRIOT 2004 1374 1377 A BATT 2008 5830 5832 F TONKS 1997 4319 4322 L BERTHIOL 2006 855 868 F ZHAO 2001 3665 3669 H MO 2006 3591 3593 J ALACID 2007 2572 2584 E YU 2015 2777 2781 Y YIN 2016 2982 2987 H CALO 2003 1382 1385 V CALO 2007 2596 2601 V JEFFERY 1984 1287 1289 T SUCHODOLSKI 2017 56 64 J FEDERKUBIS 2015 237 246 J SILARSKA 2017 458 464 E SILARSKA 2015 1 11 E TARNOWICZ 2017 5605 5612 S MIECZYNSKA 2010 2166 2177 E MIECZYNSKA 2011 195 205 E MOREL 2013 1215 1222 A WIDEGREN 2003 317 341 J PHAN 2006 609 679 N VANDERDRIFT 2002 1 24 R AHLSTEN 2012 1660 1670 N WIRWISX2018X61 WIRWISX2018X61X72 WIRWISX2018X61XA WIRWISX2018X61X72XA 2019-11-10T00:00:00Z http://creativecommons.org/licenses/by-nc-nd/4.0/ © 2017 Elsevier B.V. All rights reserved. item S2468-8231(17)30565-5 S2468823117305655 1-s2.0-S2468823117305655 10.1016/j.mcat.2017.10.021 315758 2019-02-28T04:03:11.973477Z 2018-02-01 2018-02-28 1-s2.0-S2468823117305655-main.pdf https://s3.amazonaws.com/prod-ucs-content-store-us-east/content/pii:S2468823117305655/MAIN/application/pdf/c41fda2c1c7f67b861f0b824f8fc4fe5/main.pdf main.pdf pdf true 3377695 MAIN 12 1-s2.0-S2468823117305655-main_1.png https://s3.amazonaws.com/prod-ucs-content-store-us-east/content/pii:S2468823117305655/PREVIEW/image/png/d5c8ef1b115ce73578522adbecce9c0e/main_1.png main_1.png png 53807 849 656 IMAGE-WEB-PDF 1 1-s2.0-S2468823117305655-fx1.sml https://s3.amazonaws.com/prod-ucs-content-store-us-east/content/pii:S2468823117305655/fx1/THUMBNAIL/image/gif/bca12869037ba6a715db55e0c09c75ed/fx1.sml fx1 true fx1.sml sml 1999 88 219 IMAGE-THUMBNAIL 1-s2.0-S2468823117305655-gr1.sml https://s3.amazonaws.com/prod-ucs-content-store-us-east/content/pii:S2468823117305655/gr1/THUMBNAIL/image/gif/1b46ed8360a370813ab8ef00b587822b/gr1.sml gr1 gr1.sml sml 2519 60 219 IMAGE-THUMBNAIL 1-s2.0-S2468823117305655-gr10.sml https://s3.amazonaws.com/prod-ucs-content-store-us-east/content/pii:S2468823117305655/gr10/THUMBNAIL/image/gif/15152feb6faaec5a96205b1bccabb564/gr10.sml gr10 gr10.sml sml 3593 134 219 IMAGE-THUMBNAIL 1-s2.0-S2468823117305655-gr11.sml https://s3.amazonaws.com/prod-ucs-content-store-us-east/content/pii:S2468823117305655/gr11/THUMBNAIL/image/gif/88566c27f1ebe187de2aa92411839664/gr11.sml gr11 gr11.sml sml 14172 95 219 IMAGE-THUMBNAIL 1-s2.0-S2468823117305655-gr12.sml https://s3.amazonaws.com/prod-ucs-content-store-us-east/content/pii:S2468823117305655/gr12/THUMBNAIL/image/gif/e4e346be49e302203a4bb67a23b83cc9/gr12.sml gr12 gr12.sml sml 2673 82 219 IMAGE-THUMBNAIL 1-s2.0-S2468823117305655-gr13.sml https://s3.amazonaws.com/prod-ucs-content-store-us-east/content/pii:S2468823117305655/gr13/THUMBNAIL/image/gif/002fd07d87265ac5672daf8553a78df0/gr13.sml gr13 gr13.sml sml 17472 94 219 IMAGE-THUMBNAIL 1-s2.0-S2468823117305655-gr14.sml https://s3.amazonaws.com/prod-ucs-content-store-us-east/content/pii:S2468823117305655/gr14/THUMBNAIL/image/gif/52d498fe1998fd54e47b66b6551e0e39/gr14.sml gr14 gr14.sml sml 3334 105 219 IMAGE-THUMBNAIL 1-s2.0-S2468823117305655-gr15.sml https://s3.amazonaws.com/prod-ucs-content-store-us-east/content/pii:S2468823117305655/gr15/THUMBNAIL/image/gif/a96381193a6224fe4de663b3f240cddd/gr15.sml gr15 gr15.sml sml 15835 96 219 IMAGE-THUMBNAIL 1-s2.0-S2468823117305655-gr16.sml https://s3.amazonaws.com/prod-ucs-content-store-us-east/content/pii:S2468823117305655/gr16/THUMBNAIL/image/gif/6fc66ba6d99aded66bfe4a0012487f8f/gr16.sml gr16 gr16.sml sml 3238 103 219 IMAGE-THUMBNAIL 1-s2.0-S2468823117305655-gr17.sml https://s3.amazonaws.com/prod-ucs-content-store-us-east/content/pii:S2468823117305655/gr17/THUMBNAIL/image/gif/e9c5a4bfc17aab39d68ba31cf50d07c8/gr17.sml gr17 gr17.sml sml 10928 92 219 IMAGE-THUMBNAIL 1-s2.0-S2468823117305655-gr18.sml https://s3.amazonaws.com/prod-ucs-content-store-us-east/content/pii:S2468823117305655/gr18/THUMBNAIL/image/gif/b8a8658144e881593cadb7b0b91f714f/gr18.sml gr18 gr18.sml sml 3374 109 219 IMAGE-THUMBNAIL 1-s2.0-S2468823117305655-gr19.sml https://s3.amazonaws.com/prod-ucs-content-store-us-east/content/pii:S2468823117305655/gr19/THUMBNAIL/image/gif/b9cfb88bf3a8af70370b56174d8c132e/gr19.sml gr19 gr19.sml sml 21864 164 189 IMAGE-THUMBNAIL 1-s2.0-S2468823117305655-gr2.sml https://s3.amazonaws.com/prod-ucs-content-store-us-east/content/pii:S2468823117305655/gr2/THUMBNAIL/image/gif/5f0165389fa3c075d9fa478a17494d0d/gr2.sml gr2 gr2.sml sml 4057 119 219 IMAGE-THUMBNAIL 1-s2.0-S2468823117305655-gr20.sml https://s3.amazonaws.com/prod-ucs-content-store-us-east/content/pii:S2468823117305655/gr20/THUMBNAIL/image/gif/0d2d52e17426c1a606165d7c552c4a45/gr20.sml gr20 gr20.sml sml 4061 103 219 IMAGE-THUMBNAIL 1-s2.0-S2468823117305655-gr3.sml https://s3.amazonaws.com/prod-ucs-content-store-us-east/content/pii:S2468823117305655/gr3/THUMBNAIL/image/gif/0806ab9ab59360328b2754aec2e80842/gr3.sml gr3 gr3.sml sml 9276 145 219 IMAGE-THUMBNAIL 1-s2.0-S2468823117305655-gr4.sml https://s3.amazonaws.com/prod-ucs-content-store-us-east/content/pii:S2468823117305655/gr4/THUMBNAIL/image/gif/a25d0fe18b3a9b4a9a1ad1d012de1bb4/gr4.sml gr4 gr4.sml sml 2227 47 219 IMAGE-THUMBNAIL 1-s2.0-S2468823117305655-gr5.sml https://s3.amazonaws.com/prod-ucs-content-store-us-east/content/pii:S2468823117305655/gr5/THUMBNAIL/image/gif/cc3166a106e8f42ad0d0039dcfc82742/gr5.sml gr5 gr5.sml sml 8555 134 219 IMAGE-THUMBNAIL 1-s2.0-S2468823117305655-gr6.sml https://s3.amazonaws.com/prod-ucs-content-store-us-east/content/pii:S2468823117305655/gr6/THUMBNAIL/image/gif/b1375ce0b9916a808c9beb2ffc006894/gr6.sml gr6 gr6.sml sml 2460 60 219 IMAGE-THUMBNAIL 1-s2.0-S2468823117305655-gr7.sml https://s3.amazonaws.com/prod-ucs-content-store-us-east/content/pii:S2468823117305655/gr7/THUMBNAIL/image/gif/0916f2945d0e241fb7dbf7578b7dfb3e/gr7.sml gr7 gr7.sml sml 9121 151 219 IMAGE-THUMBNAIL 1-s2.0-S2468823117305655-gr8.sml https://s3.amazonaws.com/prod-ucs-content-store-us-east/content/pii:S2468823117305655/gr8/THUMBNAIL/image/gif/bdff1189ba33c62576e310b03f3b18a6/gr8.sml gr8 gr8.sml sml 8456 127 219 IMAGE-THUMBNAIL 1-s2.0-S2468823117305655-gr9.sml https://s3.amazonaws.com/prod-ucs-content-store-us-east/content/pii:S2468823117305655/gr9/THUMBNAIL/image/gif/929c7e903f74989a32f06980ef8e3814/gr9.sml gr9 gr9.sml sml 2741 59 219 IMAGE-THUMBNAIL 1-s2.0-S2468823117305655-sc1.sml https://s3.amazonaws.com/prod-ucs-content-store-us-east/content/pii:S2468823117305655/sc1/THUMBNAIL/image/gif/34bc12a5f1ee5cba17bc3282df39f90e/sc1.sml sc1 sc1.sml sml 1861 51 219 IMAGE-THUMBNAIL 1-s2.0-S2468823117305655-fx1.jpg https://s3.amazonaws.com/prod-ucs-content-store-us-east/content/pii:S2468823117305655/fx1/DOWNSAMPLED/image/jpeg/eabb8d74509bf7c0069cf2fe06fd672e/fx1.jpg fx1 true fx1.jpg jpg 10076 200 500 IMAGE-DOWNSAMPLED 1-s2.0-S2468823117305655-gr1.jpg https://s3.amazonaws.com/prod-ucs-content-store-us-east/content/pii:S2468823117305655/gr1/DOWNSAMPLED/image/jpeg/6f84e557e57e2e7b1dd0c51de8f310d3/gr1.jpg gr1 gr1.jpg jpg 11724 154 565 IMAGE-DOWNSAMPLED 1-s2.0-S2468823117305655-gr10.jpg https://s3.amazonaws.com/prod-ucs-content-store-us-east/content/pii:S2468823117305655/gr10/DOWNSAMPLED/image/jpeg/a709227ec758e57fea2215efe6b6da95/gr10.jpg gr10 gr10.jpg jpg 24506 416 678 IMAGE-DOWNSAMPLED 1-s2.0-S2468823117305655-gr11.jpg https://s3.amazonaws.com/prod-ucs-content-store-us-east/content/pii:S2468823117305655/gr11/DOWNSAMPLED/image/jpeg/5e42e569011226f51ed9321ede67a205/gr11.jpg gr11 gr11.jpg jpg 57678 244 565 IMAGE-DOWNSAMPLED 1-s2.0-S2468823117305655-gr12.jpg https://s3.amazonaws.com/prod-ucs-content-store-us-east/content/pii:S2468823117305655/gr12/DOWNSAMPLED/image/jpeg/0049f89fdc651b31d179656f8da06df7/gr12.jpg gr12 gr12.jpg jpg 6691 140 376 IMAGE-DOWNSAMPLED 1-s2.0-S2468823117305655-gr13.jpg https://s3.amazonaws.com/prod-ucs-content-store-us-east/content/pii:S2468823117305655/gr13/DOWNSAMPLED/image/jpeg/7542f096650284f694318d21e5242e97/gr13.jpg gr13 gr13.jpg jpg 58696 242 565 IMAGE-DOWNSAMPLED 1-s2.0-S2468823117305655-gr14.jpg https://s3.amazonaws.com/prod-ucs-content-store-us-east/content/pii:S2468823117305655/gr14/DOWNSAMPLED/image/jpeg/71f6a6857cf89308a07d3f9834c71120/gr14.jpg gr14 gr14.jpg jpg 10224 180 376 IMAGE-DOWNSAMPLED 1-s2.0-S2468823117305655-gr15.jpg https://s3.amazonaws.com/prod-ucs-content-store-us-east/content/pii:S2468823117305655/gr15/DOWNSAMPLED/image/jpeg/14a7080b33dbb1ff33ed35cf424d82b3/gr15.jpg gr15 gr15.jpg jpg 53834 248 565 IMAGE-DOWNSAMPLED 1-s2.0-S2468823117305655-gr16.jpg https://s3.amazonaws.com/prod-ucs-content-store-us-east/content/pii:S2468823117305655/gr16/DOWNSAMPLED/image/jpeg/c1679f82b8ec9cd19ebf1ca92b9a8f4a/gr16.jpg gr16 gr16.jpg jpg 9533 177 376 IMAGE-DOWNSAMPLED 1-s2.0-S2468823117305655-gr17.jpg https://s3.amazonaws.com/prod-ucs-content-store-us-east/content/pii:S2468823117305655/gr17/DOWNSAMPLED/image/jpeg/d06c0576380061ebb5c73b9bc016160d/gr17.jpg gr17 gr17.jpg jpg 40776 238 565 IMAGE-DOWNSAMPLED 1-s2.0-S2468823117305655-gr18.jpg https://s3.amazonaws.com/prod-ucs-content-store-us-east/content/pii:S2468823117305655/gr18/DOWNSAMPLED/image/jpeg/bf6d0e8cdc534b09b6f1161d5397d0ec/gr18.jpg gr18 gr18.jpg jpg 9681 188 376 IMAGE-DOWNSAMPLED 1-s2.0-S2468823117305655-gr19.jpg https://s3.amazonaws.com/prod-ucs-content-store-us-east/content/pii:S2468823117305655/gr19/DOWNSAMPLED/image/jpeg/14a74d6c1fc11425224ebbaedee19bc4/gr19.jpg gr19 gr19.jpg jpg 95874 490 565 IMAGE-DOWNSAMPLED 1-s2.0-S2468823117305655-gr2.jpg https://s3.amazonaws.com/prod-ucs-content-store-us-east/content/pii:S2468823117305655/gr2/DOWNSAMPLED/image/jpeg/1eab9312089a983d313880d23c70f013/gr2.jpg gr2 gr2.jpg jpg 22562 307 565 IMAGE-DOWNSAMPLED 1-s2.0-S2468823117305655-gr20.jpg https://s3.amazonaws.com/prod-ucs-content-store-us-east/content/pii:S2468823117305655/gr20/DOWNSAMPLED/image/jpeg/8525bbe68619751bdcf177247d414bb1/gr20.jpg gr20 gr20.jpg jpg 17279 231 489 IMAGE-DOWNSAMPLED 1-s2.0-S2468823117305655-gr3.jpg https://s3.amazonaws.com/prod-ucs-content-store-us-east/content/pii:S2468823117305655/gr3/DOWNSAMPLED/image/jpeg/48f96a8562e6c5deb5eaa00bc9095b90/gr3.jpg gr3 gr3.jpg jpg 43431 373 565 IMAGE-DOWNSAMPLED 1-s2.0-S2468823117305655-gr4.jpg https://s3.amazonaws.com/prod-ucs-content-store-us-east/content/pii:S2468823117305655/gr4/DOWNSAMPLED/image/jpeg/ec91fba64398c87fb0ad4339c397e462/gr4.jpg gr4 gr4.jpg jpg 10621 122 565 IMAGE-DOWNSAMPLED 1-s2.0-S2468823117305655-gr5.jpg https://s3.amazonaws.com/prod-ucs-content-store-us-east/content/pii:S2468823117305655/gr5/DOWNSAMPLED/image/jpeg/3191b70c08f505b2eee9f0e50fa1887b/gr5.jpg gr5 gr5.jpg jpg 41772 346 565 IMAGE-DOWNSAMPLED 1-s2.0-S2468823117305655-gr6.jpg https://s3.amazonaws.com/prod-ucs-content-store-us-east/content/pii:S2468823117305655/gr6/DOWNSAMPLED/image/jpeg/4d5ab414503961683feab5536e362c5e/gr6.jpg gr6 gr6.jpg jpg 12225 155 565 IMAGE-DOWNSAMPLED 1-s2.0-S2468823117305655-gr7.jpg https://s3.amazonaws.com/prod-ucs-content-store-us-east/content/pii:S2468823117305655/gr7/DOWNSAMPLED/image/jpeg/e932a7a98766485a597a579aece621d3/gr7.jpg gr7 gr7.jpg jpg 42129 390 565 IMAGE-DOWNSAMPLED 1-s2.0-S2468823117305655-gr8.jpg https://s3.amazonaws.com/prod-ucs-content-store-us-east/content/pii:S2468823117305655/gr8/DOWNSAMPLED/image/jpeg/f7d8c9468b0666b4328735c6e1f49d17/gr8.jpg gr8 gr8.jpg jpg 40121 328 565 IMAGE-DOWNSAMPLED 1-s2.0-S2468823117305655-gr9.jpg https://s3.amazonaws.com/prod-ucs-content-store-us-east/content/pii:S2468823117305655/gr9/DOWNSAMPLED/image/jpeg/96c14cbfa8e822d9def7c7ab83c15749/gr9.jpg gr9 gr9.jpg jpg 10575 131 489 IMAGE-DOWNSAMPLED 1-s2.0-S2468823117305655-sc1.jpg https://s3.amazonaws.com/prod-ucs-content-store-us-east/content/pii:S2468823117305655/sc1/DOWNSAMPLED/image/jpeg/b3ae63ce0a15614fb94296e06e778b88/sc1.jpg sc1 sc1.jpg jpg 10622 159 678 IMAGE-DOWNSAMPLED 1-s2.0-S2468823117305655-mmc1.pdf https://s3.amazonaws.com/prod-ucs-content-store-us-east/content/pii:S2468823117305655/mmc1/MAIN/application/pdf/c10022d0aef486aa3f6289c649796b6b/mmc1.pdf mmc1 mmc1.pdf pdf false 1305107 APPLICATION MCAT 351 S2468-8231(17)30565-5 10.1016/j.mcat.2017.10.021 Elsevier B.V. Scheme 1 Hydrogen transfer in an α-alkyl-palladium intermediate. Scheme 1 Fig. 1 Arylation of 1-buten-3-ol. Fig. 1 Fig. 2 Ionic liquids and palladium anionic complexes used in these studies. Fig. 2 Fig. 3 Heck arylation of 1-buten-3-ol with ArI in the presence of different ionic liquids ([CA]Cl). Reaction conditions: 1.34mmol 1-buten-3-ol; 1.34mmol ArI; 0.5mol% PdCl2(cod); 1.25mmol NaHCO3; Pd/IL=1/1; DMF/H2O 1.5/1 (2.5cm3); 6h; 90°C. Fig. 3 Fig. 4 Heck arylation of 1-octen-3-ol. Fig. 4 Fig. 5 Heck arylation of 1-octen-3-ol with ArI in the presence of different ionic liquids ([CA]Cl). Fig. 5 Fig. 6 Heck arylation of 1-penten-3-ol. Fig. 6 Fig. 7 Heck arylation of 1-penten-3-ol with ArI in the presence of different ionic liquids ([CA]Cl). Fig. 7 Fig. 8 Efficiency of ketone formation in reactions of allylic alcohols with PhI. Fig. 8 Fig. 9 Synthesis of raspberry ketone. Fig. 9 Fig. 10 Synthesis of saturated ketones in a tandem reaction. Fig. 10 Fig. 11 TEM picture of [CAI]2[PdCl4]+DMF+H2 (atm) (30 min). Fig. 11 Fig. 12 Pd(0) nanoparticle size distribution after the reaction of [CAI]2[PdCl4] with H2. Fig. 12 Fig. 13 TEM picture of [CAI]2[PdCl4]+DMF+H2 (30 min) after 2 months. Fig. 13 Fig. 14 Pd(0) nanoparticle size distribution after 2 months. Fig. 14 Fig. 15 TEM picture of the sample of [CAI]2[PdCl4]+DMF+NaHCO3 +H2 (30 min) after 2 months. Fig. 15 Fig. 16 Pd(0) nanoparticle size distribution after 2 months. Fig. 16 Fig. 17 TEM picture of [CAI]2[PdCl4]+DMF+NaHCO3 +3-buten-2-on+PhI+H2 (30 min). Fig. 17 Fig. 18 Pd(0) nanoparticle size distribution after the reaction. Fig. 18 Fig. 19 TEM picture of [CAI]2[PdCl4]+DMF+NaHCO3 +3-buten-2-on+PhI+H2 (30min) after 2 months. Fig. 19 Fig. 20 Heck arylation of 3-buten-2-ol in the presence of H2. Fig. 20 Table 1 Reactions of 1-buten-3-ol with PhI catalyzed by different palladium catalysts. Table 1 entry catalyst Pd/[CAIII]Cl 1a% 2a% Solvent 1 PdCl2 a – 62 6 DMF 2 PdCl2 a 1/2 62 6 DMF 3 Pd(OAc)2 – 73 7 DMF 4 Pd(OAc)2 a – 40 3 DMF 5 Pd(OAc)2 a 1/2 50 5 DMF 6 PdCl2(cod) – 82 8 DMF 7 PdCl2(cod)a – 86 9 DMF/H2O 8 PdCl2(cod) – 90 9 DMF/H2O 9 PdCl2(cod) 1/2 80 9 DMF 10 PdCl2(cod)a 1/2 66 8 DMF 11 PdCl2(cod)a 1/1 88 8 DMF/H2O 12 PdCl2(cod) 1/1 85 10 DMF/H2O 13 Pd2dba3 – 67 7 DMF 14 Pd2dba3 1/1 62 7 DMF 15 Pd2dba3 1/2 56 7 DMF 16 [CAI]2[PdCl4]b – 27 2 DMF 17 [CAII]2[PdCl4]b 28 2 DMF 18 [CAIV]2[PdCl4]b 21 2 DMF Reaction conditions: 2.68mmol 1-buten-3-ol; 2.68mmol of PhI; 2 mol% Pd; 80°C; 24h, 2.5mmol NaHCO3; 5cm3 DMF or DMF/H2O=3/2 (5cm3); IL=[CAIII]Cl; a pre-treatment of Pd precursor with H2 (30min); b anionic palladates obtained in reaction of [CAI]Cl; [CAII]Cl or [CAIV]Cl with PdCl2(cod). Table 2 The effect of the palladium amount in reaction of 1-buten-3-ol with PhI. Table 2 mol% Pd 1a% 2a% TON (for 1a) 2 90 (85) * 9 (10) 45 (43) 1 87 (86) * 9 (10) 87 0.5 (86) * (10) 172 0.3 89 (87) * 9 (10) 296 0.1 (87) * (10) 870 0.05 (61) * (7) 1220 0.005 (23) * (3) 4600 0.001 22 (23) * 3 (3) 22000 Reaction conditions: 2.68mmol PhI; 2.68mmol 1-buten-3-ol; 2.5mmol NaHCO3; catalyst: PdCl2(cod); 80°C; 24h; DMF/H2O 3/2 (5cm3), * data in parentheses were obtained using PdCl2(cod) and [CAIII]Cl, Pd/IL=1/1. Table 3 Heck arylation of 3-buten-2-one with PhI in the presence of PdCl2(cod) and [CA]Cl. Table 3 ArI IL 7a% 8a% Conversion[%] PhI – 70 1 71 [CAI]Cl 82 3 85 [CAII]Cl 71 – 71 [CAIII]Cl 78 – 78 [CAIV]Cl 79 2 81 Reaction conditions: 1.34mmol 3-buten-2-one; 1.34mmol PhI; 0.5 mol% PdCl2(cod); 1.25mmol NaHCO3; Pd/IL=1/1; DMF=2.5cm3; 24h; 100°C. Table 4 Results after the second step, hydrogenation of the unsaturated aryl ketone. Table 4 ArI IL 8a% 9a% 1a% Conversion[%] PhI – 2 14 77 93 [CAI]Cl 3 6 83 92 [CAII]Cl – 4 74 78 [CAIII]Cl 5 11 78 94 [CAIV]Cl 3 7 82 92 Reaction conditions: the mixtures obtained under conditions reported in Table 5 were treated with H2 (1atm); 6h; 100°C. Table 5 Heck arylation of 3-buten-2-one with 4-iodophenol. Table 5 ArI IL 7c% Conversion 4-iodophenol – 29 29 [CAI]Cl 14 14 [CAII]Cl 16 16 [CAIII]Cl 29 29 [CAIV]Cl 12 12 Reaction conditions: 1.34mmol 3-buten-2-one; 1.34mmol ArI; 0.5 mol% PdCl2(cod); 1.25mmol NaHCO3; Pd/IL=1/1; DMF=2.5cm3; 24h; 100°C. Table 6 Results after the second step, hydrogenation of the unsaturated aryl ketone. Table 6 ArI IL 7c% 8c% 9c% 1c% Conversion[%] 4-iodophenol – – – – 98 98 [CAI]Cl 61 6 5 19 91 [CAII]Cl 35 – 14 51 100 [CAIII]Cl – 5 6 70 81 [CAIV]Cl 98 – – – 98 Reaction conditions: the mixtures obtained under conditions reported in Table 7 were treated with H2 (1atm); 6h; 100°C. Table 7 Heck coupling of 3-buten-2-one with PhI in the presence of [CA]2[PdCl4] complexes. Table 7 Complex H2 7a% 8a% 9a% 1a% Biphenyl Time/Temp. [h/°C] Conversion[%] [CAI]2[PdCl4] – 43 – – – – 24/100 43 [CAII]2[PdCl4] – 45 – – – – 24/100 45 [CAIV]2[PdCl4] – 47 – – – – 24/100 47 [CAI]2[PdCl4] + – 13 26 52 – 5/100 91 [CAII]2[PdCl4] + 68 6 9 4 2 5/100 90 [CAIV]2[PdCl4] + – 7 28 55 – 5/100 91 PdCl2(cod) + [CAIII]Cl + 10 11 28 33 3 5/100 85 Reaction conditions: 1.34mmol 3-buten-2-one; 1.34mmol ArI; 0.5 mol% Pd; 1.25mmol NaHCO3; DMF=2.5cm3. Table 8 Hg(0) poisoning test. Table 8 Hg(0) Time [h] 7a[%] – 1 23 – 2 58 + 2 28 Reaction conditions: 1.34mmol 3-buten-2-one; 1.34mmol PhI; 0.5 mol% Pd; [CAI]2[PdCl4]; 1.25mmol NaHCO3; DMF=2.5cm3; H2 from the beginning of the reaction. Research Paper Two efficient pathways for the synthesis of aryl ketones catalyzed by phosphorus-free palladium catalysts A. Wirwis a J. Feder-Kubis b A.M. Trzeciak a ⁎ a University of Wrocław, Faculty of Chemistry, 14 F. Joliot-Curie, 50-383 Wrocław, Poland University of Wrocław Faculty of Chemistry 14 F. Joliot-Curie Wrocław 50-383 Poland b Wrocław University of Science and Technology, Faculty of Chemistry, Wybrzeże Wyspiańskiego 27, 50-370 Wrocław, Poland Wrocław University of Science and Technology Faculty of Chemistry Wybrzeże Wyspiańskiego 27 Wrocław 50-370 Poland ⁎ corresponding author. Graphical abstract Allylic alcohols, 1-buten-3-ol, 1-penten-3-ol and 1-octen-3-ol, reacted with aryl iodides (iodotoluene, 4-iodotoluene, 4-iodophenol and 4-iodanisole) under Heck reaction conditions to form corresponding saturated aryl ketones in one step. The same products were obtained in a two-step tandem reaction consisted of the Heck coupling of allylic alcohols with aryl iodides, followed by hydrogenation. Reactions were catalyzed by phosphorus-free palladium precursors modified with the menthol-substituted imidazolium chlorides. Formation of crystalline palladium nanoparticles, of the diameter up to 65nm, in the reaction mixture was evidenced by TEM. Keywords Heck coupling Allylic alcohols Palladium Ionic liquid Aryl ketone Isomerization Nanoparticles 1 Introduction Aryl carbonyl compounds, aldehydes and ketones, have attracted considerable attention from synthetic chemists for many years. This is due to their properties, allowing them to be used as building blocks in the industrial production of pharmaceuticals, cosmetics, or agrochemicals [1–9]. In this context, particular attention has been paid to one group of aryl carbonyl compounds, 4-aryl-2-butanones. For example, raspberry ketone, 4-(4-hydroxyphenyl)-2-butanone, is a component of anticancer medicine and a dietary supplement [2–6]; nabumetone, 4-(6-methoxy-2-naphthalenyl)-2-butanone, is a non-steroidal anti-inflammatory drug, insecticide ingredient, and component in detergent preparation [22]. Aryl carbonyl compounds can be prepared by commonly known organic methods, such as Friedel–Crafts alkylation [10], Wittig olefination [11–13], or aldol condensation [14–17]. The main disadvantages of these procedures consist in the generation of large amounts of by-products and the need for expensive organophosphorus starting materials eventually forming environmentally unfriendly phosphorus waste. Therefore, the need to develop new synthesis methods for aryl ketones is obvious. Among them, the palladium-catalyzed Heck arylation of unsaturated ketones could be considered. Thus, the Heck arylation of 3-buten-2-on with iodoanisole and iodophenol has been performed with homogeneous and heterogeneous palladium catalysts [13,18]. Palladium nanoparticles in ionic liquid media have been employed with good results in the arylation of 3-buten-2-on with iodobenzene, followed by the hydrogenation of 4-phenyl-3-buten-2-one to 4-phenyl-3-butan-2-one [19–21]. The Heck arylation of unsaturated allyl alcohols presents an alternative synthetic strategy leading to aryl ketones. In this very challenging process, high chemo- and regioselectivity can be achieved due to the efficiency of double bond isomerization [23–26]. The Heck arylation of different allylic substrates has been performed with PdCl2 [27] and Pd(OAc)2 [28–31] under homogeneous conditions or after the impregnation of palladium on the polymer [32]. Good results have been obtained employing palladium systems with phosphorus ligands [28,33–35] or palladacyclic compounds [36]. The unique reactivity of allylic alcohols has also been exploited in the preparation of aryl-substituted dicarbonyl compounds [37,38]. Carbonylative coupling between allylic alcohols and aryl iodides has resulted in the formation of 1,4-diketones in high yield [37]. Dicarbonyl compounds have been prepared by the palladium-catalyzed Heck coupling of β-bromocarbonyl compounds with allylic alcohols [38]. In most cases, β-aryl ketone has been obtained as the main product of the Heck arylation of allylic alcohols. Although the interpretation of the selectivity of this reaction is still under debate [23–26], it can be assumed that β-hydride transfer (β-hydride elimination) is decisive for ketone formation. The rearrangement of an α-alkyl-palladium intermediate, formed by migratory insertion, has led to an unsaturated alcohol or an saturated ketone. Thus, the selective catalyst should favor the transfer (elimination) of Hb over Ha (Scheme 1 ). Interestingly, tetraalkylammonium salts and ionic liquids significantly influence the reaction course [22,39,40]. For example, the application of TBAA (tetrabutylammonium acetate) in reactions of 1-octen-3-ol have resulted in the selective formation of α-aryl alcohol, without isomerization to aryl ketone [40]. In contrast, TBAB (tetrabutylammonium bromide) has facilitated the formation of β-aryl ketone under similar conditions [40]. Aryl ketones have mainly been formed in the presence of TBAC (tetrabutylammonium chloride) [34,41], while alcohol has been obtained in the [bmim][BF4]/DMSO solution. Our research aimed at the evaluation and comparison of two protocols leading to arylated ketones. In both procedures, a palladium catalyst was employed in a two-step tandem reaction. In the first method, unsaturated allylic alcohols were used as substrates, while in an alternative method, unsaturated ketones were employed. In both cases, the first step consisted of the Heck coupling, followed by hydrogen transfer (isomerization of unsaturated alcohol) or the hydrogenation of unsaturated ketone. Considering literature examples that report the improvement of allylic alcohol reactions by ionic liquids, we decided to study the effect of menthol-modified imidazolium chlorides on the reaction course. Till now, these ionic liquids have not been used in catalytic reactions [42,43]. It was also expected that these ionic liquids would form in situ anionic palladates of the type [CA]2[PdX4] (CA=imidazolium cation) with attractive catalytic activity. In fact, the high catalytic activity of similar palladates has been evidenced in oxidative Heck reaction and in the functionalization of olefins by arylsilanes [44,45]. 2 Results and discussion 2.1 Arylation of allylic alcohols Our investigations started from the studies of the arylation of 1-buten-3-ol with iodobenzene and its substituted derivatives. The formation of arylated ketone in this system was possible in two steps. First, the formation of unsaturated arylated alcohol was expected as a result of the Heck arylation at β (products 1a–d) and α carbons (products 2a–d). According to the literature, in most systems arylation at the β position has been preferred [23–26]. The second step, involving the isomerization of unsaturated arylated allylic alcohol, leads to saturated ketone (Fig. 1 ). Thus, the palladium catalyst should be active in both steps, namely the Heck coupling and isomerization. As mentioned in the introduction, ketones 1a–d could be formed by the rearrangement of the σ-alkyl palladium intermediate without the isolation of unsaturated arylated alcohol. Different palladium precursors were tested in this reaction, including simple PdCl2 or Pd(OAc)2 and anionic complexes [CA]2[PdCl4] containing an imidazolium cation with menthyl substituents (Table 1 ). These complexes were prepared in the reaction of PdCl2(cod) with imidazolium chlorides of the type [CA]Cl.(Fig. 2 ) In all reactions, the saturated ketone 1a was obtained as the main product. The yield of the second product, 2a, did not exceed 10%. It is worth noting that the isomerization reaction to 1a was very efficient under the applied conditions and, as a result, unsaturated alcohol was not found in the reaction mixture. The highest conversion to 1a, 90%, was obtained for PdCl2(cod) in the DMF/H2O solvent mixture, while 82% of 1a was formed in DMF. The pre-treatment of the catalyst precursor with H2 (1atm) before the introduction of the substrates, in order to form Pd(0) in situ, only slightly changed the product composition, and 86% of 1a was formed. It can, therefore, be assumed that the Pd(II) precursor undergoes fast reduction in situ forming catalytically active Pd(0), similarly as was observed in other CC bond forming reactions [46–49]. The in situ reduction is so efficient under the reaction conditions that the presence of H2 has in fact no significant influence on the reaction course. Consequently, the pre-treatment of the catalyst is not needed to get high conversion. Interestingly, when a Pd(0) complex, Pd2dba3, was used, the yield of 1a was lower, namely 67%. With Pd(OAc)2 used as the catalyst precursor, conversion to 1a was 73%. It decreased significantly (to 40%) when the reaction solution was pre-treated with H2. Anionic palladium complexes, [CA]2[PdCl4], appeared less active, forming only 21–28% of 1a. The modification of the catalytic system by the introduction of imidazolium chlorides [CA]Cl (Fig. 1) did not change reaction selectivity, and 1a was mainly formed. The conversion and yield were similar to those obtained without [CA]Cl salts. It is also seen that pre-made [CA]2[PdCl4] anionic complexes were less active than systems containing palladium complexes and [CA]Cl, in which palladates could be formed in situ. In further experiments, the effect of the palladium amount on the reaction course was studied. In both series of experiments, performed in the absence and in the presence of [CAIII]Cl, very similar results were obtained. In the range of concentrations from 2 to 0.1 mol%, ca. 90% of 1a was formed. When the palladium amount decreased to 0.05 mol%, the yield of 3a also decreased to 61%. At 0.005 and 0.001 mol% of palladium, only 22–23% of 1a was formed. Nevertheless, TON values as high as 22 000, could easily be achieved, characteristic for the high efficiency of the catalytic system (Table 2 ). The further optimization of the reaction conditions was performed for the PdCl2(cod)/[CAIII]Cl catalytic system (Table S1–supplementary data). It was found that a reaction time of 6h was quite sufficient to get high conversion to 1a, in particular applying temperature 90 °C. Interestingly, the reaction appeared insensitive to reactant concentration changes as illustrated by the results presented in Table S2 (supplementary data). In the first experiment, when 5cm3 of the DMF/H2O mixture was used, 86% of 1a was obtained after 6 h. Only slightly lower yield was obtained when the same amounts of substrates reacted in a volume of 2.5cm3. Doubling the concentration by using double the substrate amount in a volume of 2.5cm3 gave practically the same result. Thus, up-scaling the process is possible without changing the product composition. From the practical point of view, this can be considered an advantage of this system. Having optimized the reaction conditions in hand, we tested different iodobenzenes as arylating agents in the synthesis of saturated ketones (Fig. 3 ). In all reactions, the desired product, ketone 1, was formed as the main one. The effect of the [CA]Cl co-catalyst was the weakest for PhI, and the addition of [CA]Cl practically did not influence the yield of products. Conversion to 1a was at the level of 80%. In reactions of 4-iodotoluene, 4-iodophenol, and 4-iodoanisole, the presence of [CA]Cl caused the increase of substrate conversion by 10–20%. The negative effect of the OH group on the substrate was clearly seen for 4-iodophenol, which gave the lowest conversion. However, selectivity was excellent at the same time because only one product was formed. The arylation of 1-octen-3-ol, another allyl alcohol tested, proceeded similarly and mainly produced saturated ketones 3a–d (Fig. 4 ). 1-Octen-3-ol reacted smoothly with PhI and 4-iodoanisole, while lower conversions were noted for 4-iodotoluene. Moreover, only one product was formed in the 4-iodophenol reaction. The effect of the presence of [CA]Cl salts was not spectacular, although some conversion increase in the presence of [CAI]Cl and [CAII]Cl was noted for 4-iodotoluene (Fig. 5 ). Reaction conditions: 1.34mmol 1-octen-3-ol; 1.34mmol ArI; 0.5mol% PdCl2(cod); 1.25mmol NaHCO3; Pd/IL=1/1; DMF/H2O 1.5/1 (2.5cm3); 6h; 90°C. The reaction of 1-penten-3-ol with aryl iodides occurs with the formation of 1-aryl-3-pentanone (5a–d) (Fig. 6 ). Unexpectedly, definitely lower conversions were noted for this alcohol, in the range from 50 to 72%. Ionic liquids, [CA]Cl, positively modified the reaction course for iodobenzene and 4-iodophenol, while only a small effect was noted for 4-iodoanisole (Fig. 7 ). The coupling of 1-penten-3-ol with 4-iodophenol proceeded with moderate yield of 5c, ca. 50%. On the other hand, selectivity to this product was close to 100%, and only traces of 6c (below 3%) were found. In one reaction, with 4-iodoanisole in the presence of [CAII]Cl, small amount of aryl alcohol, 4-(4-methoxyphenyl)-1-penten-3-ol (4%) was found. Reaction conditions: 1.34mmol 1-penten-3-ol; 1.34mmol ArI; 0.5 mol% PdCl2(cod); 1.25mmol NaHCO3; Pd/IL=1/1; DMF/H2O=1.5/1=2.5cm3; 6h; 90 °C. The influence of the allylic alcohol structure on the reaction course is illustrated in Fig. 8 . The highest yield of the ketone, 84–88%, was obtained for the longest chain alcohol, 1-octen-3-ol. Conversely, only 60–70% of the desired product was formed in reaction of 1-penten-3-ol. In all cases, the ionic liquid [CAII]Cl was the most effective increasing the reaction yield. 2.2 Synthesis of raspberry ketone As has already been mentioned, 4-aryl-2-butanones exhibit biological activity, and therefore their efficient synthesis is of practical importance. For example, 4-(4-hydroxyphenyl)-2-butanone, raspberry ketone, is a precursor of an anticancer drug and a dietary supplement ingredient. Using experience in the studies of the coupling reaction of 1-buten-3-ol with iodobenzene, the efficient synthesis of raspberry ketone was developed (Fig. 9 ). In this method, 0.1 mol% of Pd(OAc)2 was sufficient to form the ketone with 100% yield. 2.3 Arylation of unsaturated ketones The second method leading to saturated ketones employed 3-buten-2-one and aryl iodides (iodobenzene or 4-iodophenol) as substrates. In this two-step procedure, the hydrogenation of the unsaturated aryl ketone should be performed after the Heck coupling (Fig. 10 ). The studies aimed at the development of conditions enabling the performance of this tandem process in one vessel, without the separation of unsaturated ketones, the first reaction products. The arylation of 3-buten-2-one by PhI produced 7a with high selectivity and a yield of 70–82%. The product of diarylation, 8a, was found in trace amounts, up to 3% (Table 3 ). A significant improvement of conversion, by 14%, was achieved after the addition of [CAI]Cl as a co-catalyst. Next, H2 (1atm) was introduced into the same reaction vessel, and the reaction mixture was heated for 6h at 100 °C. After that time, product 1a was formed as the main one with a yield of 74–83%. The results presented in Table 4 confirmed the increase of iodobenzene conversion and high selectivity to 1a formed with a yield of 77–83%. The presence of H2 also facilitated the hydrogenation of 8a to 9a; however, the final yield of 9a remained below 14%. The best selectivity to 1a was obtained in the presence of [CAI]Cl. The Heck coupling of 3-buten-2-one with 4-iodophenol was less efficient under the same conditions. Product 7c was obtained selectively; however, its highest yield was only 29% in reaction with PdCl2(cod) alone and in the presence of [CAIII]Cl (Table 5 ). Interestingly, the conversion of 4-iodophenol significantly increased in an H2 atmosphere (Table 6 ). The results presented in Table 6 were obtained after 6h of stirring solutions prepared under conditions reported in Table 5 in an H2 atmosphere. Conversion increase up to 81–100% was noted in all systems; however, product mixtures were formed depending on the kind of IL. The highest yield of the expected product (1c), 98%, was obtained without IL. A good result, the yield of 70%, was achieved in reaction with [CAIII]Cl. The presence of [CAI]Cl and [CAIV]Cl facilitated the formation of unsaturated ketone, 7c; however, its reduction is rather slow in the presence of these co-catalysts (Table 6). This protocol worked quite well for the synthesis of raspberry ketone but only in the absence of IL. 2.4 Catalytic activity of anionic palladates In order to get a deeper understanding of the role of ionic liquids in the systems studied, the catalytic activity of [CA]2[PdCl4] complexes was investigated. First, the coupling of 3-buten-2-one with PhI was performed for 24h. After that time, 7a was identified as the only product, with a yield of 43–47% (Table 7 ). When the same reaction was performed in an H2 atmosphere (1atm), conversion increased significantly, to 85–91%, already after 5h. However, the regioselectivity was not satisfactory because, besides the desired monoarylated products, 7a and 1a, diarylated ketones, 8a and 9a, were also formed. Complexes [CAI]2[PdCl4] and [CAIV]2[PdCl4] formed the highest amounts of 1a, 52 and 55%. Using [CAII]2[PdCl4], only 4% of 1a was found. The most characteristic for these systems was the tendency to form diarylated products, both saturated and unsaturated. The diarylation of 7a competed with its hydrogenation to 1a leading to a decrease in regioselectivity. The same feature was also observed for the two-component system containing PdCl2(cod) and [CAIII]Cl, in which [CAIII]2[PdCl4] could be formed in situ. In this reaction, 33% of 1a was obtained. The yield of the diarylated product 9a was slightly lower, 28%. 2.5 TEM studies Palladates, [CA]2[PdCl4], demonstrated increased catalytic activity in the presence of H2. Under these conditions, the formation of palladium nanoparticles, Pd NPs, was very likely. To verify that hypothesis, TEM studies of the reaction mixtures were undertaken. The first sample was obtained by the treatment of [CAI]2[PdCl4] in DMF with H2 for 30min. TEM analysis showed the presence of Pd NPs with diameters of 8–12nm, with the maximum at 10nm (Figs. 11 and 12 ). The same sample analyzed after two months contained slightly bigger Pd NPs, with the average diameter of ca. 15nm (Figs. 13 and 14 ). Although Pd NPs were stored in air, their morphology was not changed significantly, indicating good stabilization by [CAI]Cl recovered during the decomposition of [CAI]2[PdCl4]. In the second experiment, a similar reaction of [CAI]2[PdCl4] with H2 was performed in the presence of the base NaHCO3. The obtained Pd NPs were slightly smaller, ca. 7nm in diameter, and mostly round in shape (Figs. 15 and 16 ). Interestingly, the TEM analysis of the post-reaction mixture containing [CAI]2[PdCl4] and all the reactants (3-buten-2-on, PhI, and H2) showed significantly bigger Pd NPs with well-defined shapes, for example triangular (Fig. 17 ). The size distribution was rather broad (Fig. 18 ), and some agglomerates were also observed. Nevertheless, it was interesting to find that the post-reaction sample analyzed after 2 months also contained well-defined crystalline Pd NPs (Fig. 19 ). Pd NPs found in the post-reaction mixtures were significantly larger than those observed in our previous studies [46–49]. The crystalline shapes of nanoparticles were also only rarely noted. One can assume that the ionic liquid formed during the decomposition of the [CAI]2[PdCl4] complex, in this case [CAI]Cl, contributed to the crystallization process. 2.6 The role of Pd NPs in the catalytic reaction: the mercury test The mercury test is one of the simplest methods used for the diagnosis of the catalytic reaction pathway [50,51]. It is expected that palladium nanoparticles or underligated palladium species will form amalgams with Hg(0), inactive in the catalytic reaction. Consequently, the inhibition of the reaction course in the presence of Hg(0) could indicate an important role of Pd NPs in the catalytic process. This is the case of our system (Table 8 ). The reaction of 3-buten-2-on with PhI under an H2 atmosphere produced 23% of 7a in 1 h. The yield increased to 58% when the reaction time was extended to 2h. When Hg(0) was added after 1h to the same reaction, and heating continued for the next 1 h, the final yield of 7a was only 28%. It could, therefore, be assumed that the formation of the amalgam eliminated catalytically active Pd NPs from the catalytic cycle, and, consequently, the formation of the product significantly slowed down. 2.7 Isomerization and hydrogenation of allylic alcohols The reaction employing allylic alcohols and aryl halides to form arylated saturated ketones was found highly efficient for different substrates. This is due to the high ability of the applied catalysts to carry out the isomerization of arylated alcohols formed in the first step. It should be pointed out here that the isomerization of the allylic substrate before the Heck coupling could generate undesirable side products [52,53]. In order to estimate the reactivity of the studied catalysts towards allylic alcohols, the test reactions were performed using the complexes [CAI]2[PdCl4] and PdCl2(cod) + [CAIV]Cl and 3-buten-2-ol as substrates. Interestingly, no products were found after 4h at 90 °C. However, the application of an H2 atmosphere resulted in the conversion of alcohol into two products, a hydrogenation product, 2-butanol, and an isomerization product, 2-butanone. The pre-made anionic complex, [CAI]2[PdCl4], was more active than the in situ formed one, [CAI]2[PdCl4] (Fig. 20 ). In conclusion, the studied complexes catalyze the isomerization and hydrogenation of allylic alcohols under mild conditions well, but only in the presence of H2. In agreement with the TEM studies, this activity could be assigned to Pd NPs, while Pd(II) complexes did not react with allylic alcohols. 3 Experimental 3.1 Instrumental methods 1H NMR and 13C NMR were recorded on a Bruker Avance 500MHz spectrometer (1H NMR 500MHz, 13C NMR 125MHz) using TMS as internal reference. Elemental analyses were performed on a 2400 CHNS Vario EL III apparatus. TEM measurements were carried out using a FEI Tecnai G2 20 X-TWIN electron microscope operating at 200kV. Catalytic reaction products were identified and analyzed with a HP 5890 Series II gas chromatograph connected to HP 5971A mass selective detector. Separation was achieved on a capillary HP-5 column coated with a diphenyl (5%) dimethylsiloxane (95%) copolymer film. Helium was used as the carrier gas. 3.2 Arylation of 1-alken-3-ols The reactions were carried out in a 50 cm3 Schlenk tube with magnetic stirring. The reagents, iodobenzene (1.34mmol), NaHCO3 (1.25mmol; 0.1050 g), PdCl2(cod) (0.5 mol%; 6.7×10−6 mol; 0.001913 g), and IL (6.7×10−6 mol), were introduced to the Schlenk tube under an N2 atmosphere. Next, 1-alken-3-ol (1.34mmol) and the solvent, DMF or DMF/H2O=1.5/1, were added with a pipette. The Schlenk tube was closed with a rubber plug, and the reaction mixture was stirred at 90 °C for 6 h. After the given reaction time, the Schlenk tube was cooled down, and the organic products were separated by extraction with diethyl ether (three times with 4, 3, and 3 cm3). The products were GC–MS analyzed (Hewlett Packard 8454A) with mesitylene (75 μl) as the internal standard. 3.3 Arylation of 3-buten-2-one followed by hydrogenation The reactions were carried out in a 50 cm3 Schlenk tube with magnetic stirring. The reagents, iodobenzene (1.34mmol), NaHCO3 (1.25mmol; 0.1050 g), PdCl2(cod) (0.5 mol%; 6.7×10−6 mol; 0.001913 g), and IL (6.7×10−6 mol) or [CA]2[PdCl4] [0.5 mol%; 6.7×10−6 mol], were introduced to the Schlenk tube under an N2 atmosphere. Next, 3-buten-2-on (1.34mmol, 0.109cm3) and DMF (2.5cm3) were added with a pipette. The Schlenk tube was closed with a rubber plug, and the reaction mixture was stirred at 100 °C for 24 h. After that time, the Schlenk tube was filled with H2 from a balloon (1atm), and heating continued for 6 h. Next, the Schlenk tube was cooled down, and the organic products were separated by extraction with diethyl ether (three times with 4, 3, and 3 cm3). The products were GC–MS analyzed (Hewlett Packard 8454A) with mesitylene (75 μl) as the internal standard. 3.4 Arylation of 3-buten-2-ol in H2 atmosphere The reactions were carried out according to the procedure described above, applying an H2 atmosphere (1atm) instead of an N2 one. 3.5 Preparation of samples for TEM a) [CAI]2[PdCl4]+DMF+H2 (30 min) The complex [CAI]2[PdCl4] (0.5 mol%; 6.7×10−6 mol; 0.0056g) and DMF (2.5cm3) were introduced into a 50cm3 Schlenk tube. The Schlenk tube was closed with a rubber plug, frozen in liquid nitrogen, and air was evacuated using a pump. The evacuation was repeated three times, and next the Schlenk tube was connected to a balloon with H2 (1atm). The solution was heated at 100 °C for 30min, cooled down, and analyzed by TEM. b) [CAI]2[PdCl4]+DMF+NaHCO3 +H2 (30 min) The sample was prepared according to the procedure described above with the addition of NaHCO3 (1.25mmol; 0.1050 g). c) [CAI]2[PdCl4]+DMF+NaHCO3 +3-buten-2-on+PhI+H2 (30min) The sample was prepared according to the procedure described above with the addition of NaHCO3 (1.25mmol; 0.1050 g), 3-buten-2-on (1.34mmol; 0.109cm3), and PhI (1.34mmol; 0.15cm3). 3.6 Hg(0) test The reactions were carried out in a 50 cm3 Schlenk tube with magnetic stirring. The reagents, iodobenzene (1.34mmol, 0.150cm3), NaHCO3 (1.25mmol; 0.1050 g), [CAI]2[PdCl4] (0.5 mol%; 6.7×10‐6 mol; 0.0056g), 3-buten-2-on (1.34mmol, 0.109cm3), PhI (1.34mmol, 0.150cm3), and DMF (2.5cm3), were added in an N2 atmosphere. The Schlenk tube was closed with a rubber plug, and the reaction mixture was stirred at 100 °C for 1 h. After that time, Hg(0) was added (3.35×10−3 mmol; 50μl], and heating continued for 1 h. Next, the Schlenk tube was cooled down, and the organic products were separated by extraction with diethyl ether (three times with 4, 3, and 3 cm3). The products were GC–MS analyzed (Hewlett Packard 8454A) with mesitylene (75 μl) as the internal standard. 4 Conclusions In these studies, two highly efficient methods leading to aryl ketones were developed. Allylic alcohols were used as substrates, and phosphorus-free palladium compounds were employed as catalyst precursors. In the second method, unsaturated ketones were first arylated according to the Heck protocol, and the resulting aryl ketone was hydrogenated to the final product. Under the studied conditions, the efficiency of this strategy was satisfactory for iodobenzene but not for 4-iodophenol. During the reactions, Pd(II) was reduced to Pd(0) nanoparticles, which participated in the catalytic process, most probably as a catalytically active form of palladium. The surface of Pd(0) nanoparticles was modified by ionic liquids which formed a layer preventing agglomeration to the less active palladium forms. However, ionic liquids had only moderate influence on the reaction course, although, in the reaction of 1- penten-3-ol, the yield of ketone increased by 20% in the presence of IL. It could be therefore concluded that ionic liquids did not restrict access of substrates to the catalytically active centers. On the other hand, a negative effect of ionic liquids in the Heck coupling of 3-buten-2-one with 4-iodophenol can indicate on the competition between substrates and ionic liquid for a place in the palladium environment. Furthermore, IL influenced the morphology of the palladium nanoparticles that formed big crystals of well-defined shape. The catalytic activity of anionic palladates, [CA]2[PdCl4], in the Heck coupling of unsaturated alcohols and ketones was rather low. This could be explained by the slow transformation of these complexes to Pd(0) nanoparticles which was however significantly facilitated by the introduction of an H2 atmosphere. Consequently the reactivity increased, but the selectivity of the reaction changed, and di-aryl ketones were formed. The comparison of the two protocols studied indicated the advantages of the one using allylic alcohols as substrates. In comparison to the procedure employing unsaturated ketones, the reactions of allylic alcohols could be performed in one step under mild conditions in a relatively short time. The possibility to perform efficiently the synthesis of aryl ketones from allylic alcohols in the studied system could be rationalized from the mechanistic point of view. Because of the low ability of palladium to isomerize the allylic alcohol substrate, isomerization did not compete with Heck arylation. Advantageously, Heck coupling proceeded mainly in β-position and the resulting σ-alkyl palladium intermediate could undergo isomerization to the final ketone. At this stage, the studied catalysts demonstrated high ability to activate CH bonds in the alkyl group coordinated to palladium. Acknowledgements Financial support of National Science Centre (NCN, Poland) with grant 2014/15/B/ST5/02101 is gratefully acknowledged. Appendix A Supplementary data Supplementary data associated with this article can be found, in the online version, at http://dx.doi.org/10.1016/j.mcat.2017.10.021. Appendix A Supplementary data The following is Supplementary data to this article: References [1] Y.V.S.N. Murthy Y. Meah V. Massey J. Am. Chem. Soc. 121 1999 5344 5345 [2] S. Ducki J.A. Hadfield L.A. Hepworth N.J. Lawrence Ch.-Y. Liu A.T. McGown Bioorg. Med. Chem. Lett. 7 1997 3091 3094 [3] W. Borejsza-Wysocki G. Hrazdina Phytochemistry 35 1994 623 628 [4] C. Morimoto Y. Satoh M. Hara S. Inoue T. Tsujita H. Okuda Life Sci. 77 2005 194 204 [5] T. Ikemoto H. Nakatsugawa T. Yokota, (Kanebo Ltd., Jpn) Skin-lightening cosmetics containing raspberry ketone glycosides as melanin formation inhibitors. JP 100 17 462, 1998; CAN 128: 145160. [6] A. Bo1ker M. Fischer R.G. Berger Biotechnol.Prog 17 2001 568 572 [7] C. Van Biezen, K.D. Perring, A. Churchill, A.F. Provan, J.M. Behan, G.M. Wentzo, (Quest International Services B. V., Netherlands.) Perfume compositions based on anisylacetone and 2-hydroxyethyl phenoxyacetate WO/2008/141769,2008; CAN 149:581999 2017. [8] J. Smets, H.R.G. Denutte, A. Pintens, D.T. Stanton, K. Van Aken, I.H.H. Laureyn, B. Denolf, F.A.C. Vrielynck, The Procter & Gamble Company, USA). Perfume systems for consumer products. US 2009; 2009-628255. [9] E. Sawasaki S. Okuyama H. Yokogoshi Aroma Res. 5 3 2004 254 258 [10] J. Tateiwa H. Horiuchi K. Jashimoto T. Yamauchi S. Uemura J. Org. Chem. 59 1994 5901 5904 [11] S. Frattini M. Quai E. Cereda Tetrahedron Lett. 42 2001 6827 6829 [12] R. Bera G. Dhananjaya S.N. Singh R. Kumar K. Mukkanti M. Pal Tetrahedron 65 2009 1300 1305 [13] M. Viviano T.N. Glasnov B. Reichart G. Tekautz C.O. Kappe Org. Process Res Dev. 15 2011 858 870 [14] B.C. Raju P. Suman Chem. Eur. J. 16 2010 11840 11842 [15] K. Zumbansen A. Doehring B. List Adv. Synth. Catal. 352 2010 1135 1138 [16] S. Luo X. Mi L. Zhang S. Liu H. Xu J.-P. Cheng Tetrahedron 63 2007 1923 1930 [17] S. Paul M. Gupta Synth. Commun. 35 2005 213 222 [18] M.J. Climent A. Corma S. Iborra M. Mifsud Adv. Synth. Catal. 349 2007 1949 1954 [19] S. Jansat J. Durand I. Favier I.F. Malbosc Ch. Pradel E. Teuma M. Gómez Chem. Cat. Chem. 1 2009 244 246 [20] E. Raluy I. Favier A.M. López-Vinasco Ch. Pradel E. Martin D. Madec E. Teuma M. Gómez Phys. Chem. Chem. Phys. 13 2011 13579 13584 [21] A.M. López-Vinasco I. Guerrero-Rios I. Favier Ch. Pradel E. Teuma M. Gómez E. Martin Catal. Commun. 63 2015 56 61 [22] S. Bouquillon B. Ganchegui B. Estrine F. Henin J. Muzart J. Organometal. Chem. 634 2001 153 156 [23] M.S. Sigman E.W. Werner Acc. Chem. Res. 45 2012 874 884 [24] J. Muzart Tetrahedron 61 2005 4179 4212 [25] T.Y. Chaudhari A. Hossian M.K. Manna R. Jana Org. Biomol. Chem. 13 2015 4841 4845 [26] L. Xu M.J. Hilton X. Zhang P.-O. Norrby Y.-D. Wu M.S. Sigman O. Wiest J. Am. Chem. Soc. 136 2014 1960 1967 [27] R. Benhaddou S. Czarnecki G. Ville J. Chem Soc. Chem. Commun. 1988 247 248 [28] J.B. Melpolder R.F. Heck J. Org. Chem. 41 1976 265 272 [29] A.H.M. de Vries J.M.C.A. Mulders J.H.M. Mommers H.J.W. Henderickx J.G. de Vries Org. Lett. 5 2003 3285 3288 [30] A. Briot C. Baehr R. Brouillard A. Wagner C. Mioskowski J. Org. Chem. 69 2004 1374 1377 [31] F. Batt Ch. Gozzi F. Fache Chem. Comm. 2008 5830 5832 [32] L. Tonks M.S. Anson K. Hellgardt A.R. Mirza D.F. Thompson J.M.J. Williams Tetrahedron Lett. 38 1997 4319 4322 [33] F. Berthiol H. Doucet M. Santelli Appl. Organometal. Chem. 20 2006 855 868 [34] H. Zhao M.-Z. Cai R.-H. Hu C.-S. Song Synth. Commun. 31 23 2001 3665 3669 [35] J. Mo L. Xu J. Ruan S. Liu J. Xiao Chem. Comm 2006 3591 3593 [36] E. Alacid C. Najera Adv. Synth. Catal. 349 2007 2572 2584 [37] Y. Yu U.K. Tambar Chem. Sci. 6 2015 2777 2781 [38] H. Yin D.U. Nielsen M.K. Johansen A.T. Lindhardt T. Skydstrup ACS Catal. 6 2016 2982 2987 [39] V. Calo A. Nacci A. Monopoli M. Spinelli Eur. J. Org. Chem. 2003 1382 1385 [40] V. Calo A. Nacci A. Monopoli V. Ferola J. Org. Chem. 72 2007 2596 2601 [41] T. Jeffery Chem. Commun. 1984 1287 1289 [42] J. Suchodolski J. Feder-Kubis A. Krasowska Microbiol. Res. 197 2017 56 64 [43] J. Feder-Kubis B. Szewczyk M. Kubicki J. Org. Chem. 80 2015 237 246 [44] E. Silarska M. Majchrzak B. Marciniec A.M. Trzeciak J. Mol. Catal. A Chem. 426 2017 458 464 [45] E. Silarska A.M. Trzeciak J. Mol. Catal. A Chem. 408 2015 1 11 [46] S. Tarnowicz W. Alsalahi E. Mieczyńska A.M. Trzeciak Tetrahedron 73 2017 5605 5612 [47] E. Mieczyńska A.M. Trzeciak Molecules 15 2010 2166 2177 [48] E. Mieczyńska A. Gniewek I. Pryjomska-Ray A.M. Trzeciak H. Grabowska M. Zawadzki Appl. Catal. A General 393 2011 195 205 [49] A. Morel E. Silarska A.M. Trzeciak J. Pernak Dalton Trans. 42 2013 1215 1222 [50] J.A. Widegren R.G. Finke J. Mol. Catal. A Chem. 198 2003 317 341 [51] N.T.S. Phan M. Van Der Sluys C.W. Jones Adv. Synth. Catal. 348 2006 609 679 [52] R.C. van der Drift E. Bouwman E. Drent J. Organomet. Chem. 650 2002 1 24 [53] N. Ahlsten A. Bartoszewicz B. Martin-Matute Dalton Trans. 41 2012 1660 1670",
      "scopus-id": "85039808634",
      "coredata": {
        "eid": "1-s2.0-S2468823117305655",
        "dc:description": "Allylic alcohols, 1-buten-3-ol, 1-penten-3-ol and 1-octen-3-ol, reacted with aryl iodides (iodotoluene, 4-iodotoluene, 4-iodophenol and 4-iodanisole) under Heck reaction conditions to form corresponding saturated aryl ketones in one step. The same products were obtained in a two-step tandem reaction consisted of the Heck coupling of allylic alcohols with aryl iodides, followed by hydrogenation. Reactions were catalyzed by phosphorus-free palladium precursors modified with the menthol-substituted imidazolium chlorides. Formation of crystalline palladium nanoparticles, of the diameter up to 65nm, in the reaction mixture was evidenced by TEM.",
        "openArchiveArticle": "false",
        "prism:coverDate": "2018-02-28",
        "openaccessUserLicense": null,
        "prism:aggregationType": "Journal",
        "prism:url": "https://api.elsevier.com/content/article/pii/S2468823117305655",
        "dc:creator": [
          {
            "@_fa": "true",
            "$": "Wirwis, A."
          },
          {
            "@_fa": "true",
            "$": "Feder-Kubis, J."
          },
          {
            "@_fa": "true",
            "$": "Trzeciak, A.M."
          }
        ],
        "link": [
          {
            "@_fa": "true",
            "@rel": "self",
            "@href": "https://api.elsevier.com/content/article/pii/S2468823117305655"
          },
          {
            "@_fa": "true",
            "@rel": "scidir",
            "@href": "https://www.sciencedirect.com/science/article/pii/S2468823117305655"
          }
        ],
        "dc:format": "application/json",
        "openaccessType": null,
        "pii": "S2468-8231(17)30565-5",
        "prism:volume": "445",
        "prism:publisher": "Elsevier B.V.",
        "dc:title": "Two efficient pathways for the synthesis of aryl ketones catalyzed by phosphorus-free palladium catalysts",
        "prism:copyright": "© 2017 Elsevier B.V. All rights reserved.",
        "openaccess": "0",
        "prism:issn": "24688231",
        "dcterms:subject": [
          {
            "@_fa": "true",
            "$": "Heck coupling"
          },
          {
            "@_fa": "true",
            "$": "Allylic alcohols"
          },
          {
            "@_fa": "true",
            "$": "Palladium"
          },
          {
            "@_fa": "true",
            "$": "Ionic liquid"
          },
          {
            "@_fa": "true",
            "$": "Aryl ketone"
          },
          {
            "@_fa": "true",
            "$": "Isomerization"
          },
          {
            "@_fa": "true",
            "$": "Nanoparticles"
          }
        ],
        "openaccessArticle": "false",
        "prism:publicationName": "Molecular Catalysis",
        "openaccessSponsorType": null,
        "prism:pageRange": "61-72",
        "prism:endingPage": "72",
        "pubType": "fla",
        "prism:coverDisplayDate": "February 2018",
        "prism:doi": "10.1016/j.mcat.2017.10.021",
        "prism:startingPage": "61",
        "dc:identifier": "doi:10.1016/j.mcat.2017.10.021",
        "openaccessSponsorName": null
      },
      "objects": {
        "object": [
          {
            "@category": "thumbnail",
            "@height": "88",
            "@width": "219",
            "@_fa": "true",
            "$": "https://api.elsevier.com/content/object/eid/1-s2.0-S2468823117305655-fx1.sml?httpAccept=%2A%2F%2A",
            "@multimediatype": "GIF image file",
            "@type": "IMAGE-THUMBNAIL",
            "@size": "1999",
            "@ref": "fx1",
            "@mimetype": "image/gif"
          },
          {
            "@category": "thumbnail",
            "@height": "60",
            "@width": "219",
            "@_fa": "true",
            "$": "https://api.elsevier.com/content/object/eid/1-s2.0-S2468823117305655-gr1.sml?httpAccept=%2A%2F%2A",
            "@multimediatype": "GIF image file",
            "@type": "IMAGE-THUMBNAIL",
            "@size": "2519",
            "@ref": "gr1",
            "@mimetype": "image/gif"
          },
          {
            "@category": "thumbnail",
            "@height": "134",
            "@width": "219",
            "@_fa": "true",
            "$": "https://api.elsevier.com/content/object/eid/1-s2.0-S2468823117305655-gr10.sml?httpAccept=%2A%2F%2A",
            "@multimediatype": "GIF image file",
            "@type": "IMAGE-THUMBNAIL",
            "@size": "3593",
            "@ref": "gr10",
            "@mimetype": "image/gif"
          },
          {
            "@category": "thumbnail",
            "@height": "95",
            "@width": "219",
            "@_fa": "true",
            "$": "https://api.elsevier.com/content/object/eid/1-s2.0-S2468823117305655-gr11.sml?httpAccept=%2A%2F%2A",
            "@multimediatype": "GIF image file",
            "@type": "IMAGE-THUMBNAIL",
            "@size": "14172",
            "@ref": "gr11",
            "@mimetype": "image/gif"
          },
          {
            "@category": "thumbnail",
            "@height": "82",
            "@width": "219",
            "@_fa": "true",
            "$": "https://api.elsevier.com/content/object/eid/1-s2.0-S2468823117305655-gr12.sml?httpAccept=%2A%2F%2A",
            "@multimediatype": "GIF image file",
            "@type": "IMAGE-THUMBNAIL",
            "@size": "2673",
            "@ref": "gr12",
            "@mimetype": "image/gif"
          },
          {
            "@category": "thumbnail",
            "@height": "94",
            "@width": "219",
            "@_fa": "true",
            "$": "https://api.elsevier.com/content/object/eid/1-s2.0-S2468823117305655-gr13.sml?httpAccept=%2A%2F%2A",
            "@multimediatype": "GIF image file",
            "@type": "IMAGE-THUMBNAIL",
            "@size": "17472",
            "@ref": "gr13",
            "@mimetype": "image/gif"
          },
          {
            "@category": "thumbnail",
            "@height": "105",
            "@width": "219",
            "@_fa": "true",
            "$": "https://api.elsevier.com/content/object/eid/1-s2.0-S2468823117305655-gr14.sml?httpAccept=%2A%2F%2A",
            "@multimediatype": "GIF image file",
            "@type": "IMAGE-THUMBNAIL",
            "@size": "3334",
            "@ref": "gr14",
            "@mimetype": "image/gif"
          },
          {
            "@category": "thumbnail",
            "@height": "96",
            "@width": "219",
            "@_fa": "true",
            "$": "https://api.elsevier.com/content/object/eid/1-s2.0-S2468823117305655-gr15.sml?httpAccept=%2A%2F%2A",
            "@multimediatype": "GIF image file",
            "@type": "IMAGE-THUMBNAIL",
            "@size": "15835",
            "@ref": "gr15",
            "@mimetype": "image/gif"
          },
          {
            "@category": "thumbnail",
            "@height": "103",
            "@width": "219",
            "@_fa": "true",
            "$": "https://api.elsevier.com/content/object/eid/1-s2.0-S2468823117305655-gr16.sml?httpAccept=%2A%2F%2A",
            "@multimediatype": "GIF image file",
            "@type": "IMAGE-THUMBNAIL",
            "@size": "3238",
            "@ref": "gr16",
            "@mimetype": "image/gif"
          },
          {
            "@category": "thumbnail",
            "@height": "92",
            "@width": "219",
            "@_fa": "true",
            "$": "https://api.elsevier.com/content/object/eid/1-s2.0-S2468823117305655-gr17.sml?httpAccept=%2A%2F%2A",
            "@multimediatype": "GIF image file",
            "@type": "IMAGE-THUMBNAIL",
            "@size": "10928",
            "@ref": "gr17",
            "@mimetype": "image/gif"
          },
          {
            "@category": "thumbnail",
            "@height": "109",
            "@width": "219",
            "@_fa": "true",
            "$": "https://api.elsevier.com/content/object/eid/1-s2.0-S2468823117305655-gr18.sml?httpAccept=%2A%2F%2A",
            "@multimediatype": "GIF image file",
            "@type": "IMAGE-THUMBNAIL",
            "@size": "3374",
            "@ref": "gr18",
            "@mimetype": "image/gif"
          },
          {
            "@category": "thumbnail",
            "@height": "164",
            "@width": "189",
            "@_fa": "true",
            "$": "https://api.elsevier.com/content/object/eid/1-s2.0-S2468823117305655-gr19.sml?httpAccept=%2A%2F%2A",
            "@multimediatype": "GIF image file",
            "@type": "IMAGE-THUMBNAIL",
            "@size": "21864",
            "@ref": "gr19",
            "@mimetype": "image/gif"
          },
          {
            "@category": "thumbnail",
            "@height": "119",
            "@width": "219",
            "@_fa": "true",
            "$": "https://api.elsevier.com/content/object/eid/1-s2.0-S2468823117305655-gr2.sml?httpAccept=%2A%2F%2A",
            "@multimediatype": "GIF image file",
            "@type": "IMAGE-THUMBNAIL",
            "@size": "4057",
            "@ref": "gr2",
            "@mimetype": "image/gif"
          },
          {
            "@category": "thumbnail",
            "@height": "103",
            "@width": "219",
            "@_fa": "true",
            "$": "https://api.elsevier.com/content/object/eid/1-s2.0-S2468823117305655-gr20.sml?httpAccept=%2A%2F%2A",
            "@multimediatype": "GIF image file",
            "@type": "IMAGE-THUMBNAIL",
            "@size": "4061",
            "@ref": "gr20",
            "@mimetype": "image/gif"
          },
          {
            "@category": "thumbnail",
            "@height": "145",
            "@width": "219",
            "@_fa": "true",
            "$": "https://api.elsevier.com/content/object/eid/1-s2.0-S2468823117305655-gr3.sml?httpAccept=%2A%2F%2A",
            "@multimediatype": "GIF image file",
            "@type": "IMAGE-THUMBNAIL",
            "@size": "9276",
            "@ref": "gr3",
            "@mimetype": "image/gif"
          },
          {
            "@category": "thumbnail",
            "@height": "47",
            "@width": "219",
            "@_fa": "true",
            "$": "https://api.elsevier.com/content/object/eid/1-s2.0-S2468823117305655-gr4.sml?httpAccept=%2A%2F%2A",
            "@multimediatype": "GIF image file",
            "@type": "IMAGE-THUMBNAIL",
            "@size": "2227",
            "@ref": "gr4",
            "@mimetype": "image/gif"
          },
          {
            "@category": "thumbnail",
            "@height": "134",
            "@width": "219",
            "@_fa": "true",
            "$": "https://api.elsevier.com/content/object/eid/1-s2.0-S2468823117305655-gr5.sml?httpAccept=%2A%2F%2A",
            "@multimediatype": "GIF image file",
            "@type": "IMAGE-THUMBNAIL",
            "@size": "8555",
            "@ref": "gr5",
            "@mimetype": "image/gif"
          },
          {
            "@category": "thumbnail",
            "@height": "60",
            "@width": "219",
            "@_fa": "true",
            "$": "https://api.elsevier.com/content/object/eid/1-s2.0-S2468823117305655-gr6.sml?httpAccept=%2A%2F%2A",
            "@multimediatype": "GIF image file",
            "@type": "IMAGE-THUMBNAIL",
            "@size": "2460",
            "@ref": "gr6",
            "@mimetype": "image/gif"
          },
          {
            "@category": "thumbnail",
            "@height": "151",
            "@width": "219",
            "@_fa": "true",
            "$": "https://api.elsevier.com/content/object/eid/1-s2.0-S2468823117305655-gr7.sml?httpAccept=%2A%2F%2A",
            "@multimediatype": "GIF image file",
            "@type": "IMAGE-THUMBNAIL",
            "@size": "9121",
            "@ref": "gr7",
            "@mimetype": "image/gif"
          },
          {
            "@category": "thumbnail",
            "@height": "127",
            "@width": "219",
            "@_fa": "true",
            "$": "https://api.elsevier.com/content/object/eid/1-s2.0-S2468823117305655-gr8.sml?httpAccept=%2A%2F%2A",
            "@multimediatype": "GIF image file",
            "@type": "IMAGE-THUMBNAIL",
            "@size": "8456",
            "@ref": "gr8",
            "@mimetype": "image/gif"
          },
          {
            "@category": "thumbnail",
            "@height": "59",
            "@width": "219",
            "@_fa": "true",
            "$": "https://api.elsevier.com/content/object/eid/1-s2.0-S2468823117305655-gr9.sml?httpAccept=%2A%2F%2A",
            "@multimediatype": "GIF image file",
            "@type": "IMAGE-THUMBNAIL",
            "@size": "2741",
            "@ref": "gr9",
            "@mimetype": "image/gif"
          },
          {
            "@category": "thumbnail",
            "@height": "51",
            "@width": "219",
            "@_fa": "true",
            "$": "https://api.elsevier.com/content/object/eid/1-s2.0-S2468823117305655-sc1.sml?httpAccept=%2A%2F%2A",
            "@multimediatype": "GIF image file",
            "@type": "IMAGE-THUMBNAIL",
            "@size": "1861",
            "@ref": "sc1",
            "@mimetype": "image/gif"
          },
          {
            "@category": "standard",
            "@height": "200",
            "@width": "500",
            "@_fa": "true",
            "$": "https://api.elsevier.com/content/object/eid/1-s2.0-S2468823117305655-fx1.jpg?httpAccept=%2A%2F%2A",
            "@multimediatype": "JPEG image file",
            "@type": "IMAGE-DOWNSAMPLED",
            "@size": "10076",
            "@ref": "fx1",
            "@mimetype": "image/jpeg"
          },
          {
            "@category": "standard",
            "@height": "154",
            "@width": "565",
            "@_fa": "true",
            "$": "https://api.elsevier.com/content/object/eid/1-s2.0-S2468823117305655-gr1.jpg?httpAccept=%2A%2F%2A",
            "@multimediatype": "JPEG image file",
            "@type": "IMAGE-DOWNSAMPLED",
            "@size": "11724",
            "@ref": "gr1",
            "@mimetype": "image/jpeg"
          },
          {
            "@category": "standard",
            "@height": "416",
            "@width": "678",
            "@_fa": "true",
            "$": "https://api.elsevier.com/content/object/eid/1-s2.0-S2468823117305655-gr10.jpg?httpAccept=%2A%2F%2A",
            "@multimediatype": "JPEG image file",
            "@type": "IMAGE-DOWNSAMPLED",
            "@size": "24506",
            "@ref": "gr10",
            "@mimetype": "image/jpeg"
          },
          {
            "@category": "standard",
            "@height": "244",
            "@width": "565",
            "@_fa": "true",
            "$": "https://api.elsevier.com/content/object/eid/1-s2.0-S2468823117305655-gr11.jpg?httpAccept=%2A%2F%2A",
            "@multimediatype": "JPEG image file",
            "@type": "IMAGE-DOWNSAMPLED",
            "@size": "57678",
            "@ref": "gr11",
            "@mimetype": "image/jpeg"
          },
          {
            "@category": "standard",
            "@height": "140",
            "@width": "376",
            "@_fa": "true",
            "$": "https://api.elsevier.com/content/object/eid/1-s2.0-S2468823117305655-gr12.jpg?httpAccept=%2A%2F%2A",
            "@multimediatype": "JPEG image file",
            "@type": "IMAGE-DOWNSAMPLED",
            "@size": "6691",
            "@ref": "gr12",
            "@mimetype": "image/jpeg"
          },
          {
            "@category": "standard",
            "@height": "242",
            "@width": "565",
            "@_fa": "true",
            "$": "https://api.elsevier.com/content/object/eid/1-s2.0-S2468823117305655-gr13.jpg?httpAccept=%2A%2F%2A",
            "@multimediatype": "JPEG image file",
            "@type": "IMAGE-DOWNSAMPLED",
            "@size": "58696",
            "@ref": "gr13",
            "@mimetype": "image/jpeg"
          },
          {
            "@category": "standard",
            "@height": "180",
            "@width": "376",
            "@_fa": "true",
            "$": "https://api.elsevier.com/content/object/eid/1-s2.0-S2468823117305655-gr14.jpg?httpAccept=%2A%2F%2A",
            "@multimediatype": "JPEG image file",
            "@type": "IMAGE-DOWNSAMPLED",
            "@size": "10224",
            "@ref": "gr14",
            "@mimetype": "image/jpeg"
          },
          {
            "@category": "standard",
            "@height": "248",
            "@width": "565",
            "@_fa": "true",
            "$": "https://api.elsevier.com/content/object/eid/1-s2.0-S2468823117305655-gr15.jpg?httpAccept=%2A%2F%2A",
            "@multimediatype": "JPEG image file",
            "@type": "IMAGE-DOWNSAMPLED",
            "@size": "53834",
            "@ref": "gr15",
            "@mimetype": "image/jpeg"
          },
          {
            "@category": "standard",
            "@height": "177",
            "@width": "376",
            "@_fa": "true",
            "$": "https://api.elsevier.com/content/object/eid/1-s2.0-S2468823117305655-gr16.jpg?httpAccept=%2A%2F%2A",
            "@multimediatype": "JPEG image file",
            "@type": "IMAGE-DOWNSAMPLED",
            "@size": "9533",
            "@ref": "gr16",
            "@mimetype": "image/jpeg"
          },
          {
            "@category": "standard",
            "@height": "238",
            "@width": "565",
            "@_fa": "true",
            "$": "https://api.elsevier.com/content/object/eid/1-s2.0-S2468823117305655-gr17.jpg?httpAccept=%2A%2F%2A",
            "@multimediatype": "JPEG image file",
            "@type": "IMAGE-DOWNSAMPLED",
            "@size": "40776",
            "@ref": "gr17",
            "@mimetype": "image/jpeg"
          },
          {
            "@category": "standard",
            "@height": "188",
            "@width": "376",
            "@_fa": "true",
            "$": "https://api.elsevier.com/content/object/eid/1-s2.0-S2468823117305655-gr18.jpg?httpAccept=%2A%2F%2A",
            "@multimediatype": "JPEG image file",
            "@type": "IMAGE-DOWNSAMPLED",
            "@size": "9681",
            "@ref": "gr18",
            "@mimetype": "image/jpeg"
          },
          {
            "@category": "standard",
            "@height": "490",
            "@width": "565",
            "@_fa": "true",
            "$": "https://api.elsevier.com/content/object/eid/1-s2.0-S2468823117305655-gr19.jpg?httpAccept=%2A%2F%2A",
            "@multimediatype": "JPEG image file",
            "@type": "IMAGE-DOWNSAMPLED",
            "@size": "95874",
            "@ref": "gr19",
            "@mimetype": "image/jpeg"
          },
          {
            "@category": "standard",
            "@height": "307",
            "@width": "565",
            "@_fa": "true",
            "$": "https://api.elsevier.com/content/object/eid/1-s2.0-S2468823117305655-gr2.jpg?httpAccept=%2A%2F%2A",
            "@multimediatype": "JPEG image file",
            "@type": "IMAGE-DOWNSAMPLED",
            "@size": "22562",
            "@ref": "gr2",
            "@mimetype": "image/jpeg"
          },
          {
            "@category": "standard",
            "@height": "231",
            "@width": "489",
            "@_fa": "true",
            "$": "https://api.elsevier.com/content/object/eid/1-s2.0-S2468823117305655-gr20.jpg?httpAccept=%2A%2F%2A",
            "@multimediatype": "JPEG image file",
            "@type": "IMAGE-DOWNSAMPLED",
            "@size": "17279",
            "@ref": "gr20",
            "@mimetype": "image/jpeg"
          },
          {
            "@category": "standard",
            "@height": "373",
            "@width": "565",
            "@_fa": "true",
            "$": "https://api.elsevier.com/content/object/eid/1-s2.0-S2468823117305655-gr3.jpg?httpAccept=%2A%2F%2A",
            "@multimediatype": "JPEG image file",
            "@type": "IMAGE-DOWNSAMPLED",
            "@size": "43431",
            "@ref": "gr3",
            "@mimetype": "image/jpeg"
          },
          {
            "@category": "standard",
            "@height": "122",
            "@width": "565",
            "@_fa": "true",
            "$": "https://api.elsevier.com/content/object/eid/1-s2.0-S2468823117305655-gr4.jpg?httpAccept=%2A%2F%2A",
            "@multimediatype": "JPEG image file",
            "@type": "IMAGE-DOWNSAMPLED",
            "@size": "10621",
            "@ref": "gr4",
            "@mimetype": "image/jpeg"
          },
          {
            "@category": "standard",
            "@height": "346",
            "@width": "565",
            "@_fa": "true",
            "$": "https://api.elsevier.com/content/object/eid/1-s2.0-S2468823117305655-gr5.jpg?httpAccept=%2A%2F%2A",
            "@multimediatype": "JPEG image file",
            "@type": "IMAGE-DOWNSAMPLED",
            "@size": "41772",
            "@ref": "gr5",
            "@mimetype": "image/jpeg"
          },
          {
            "@category": "standard",
            "@height": "155",
            "@width": "565",
            "@_fa": "true",
            "$": "https://api.elsevier.com/content/object/eid/1-s2.0-S2468823117305655-gr6.jpg?httpAccept=%2A%2F%2A",
            "@multimediatype": "JPEG image file",
            "@type": "IMAGE-DOWNSAMPLED",
            "@size": "12225",
            "@ref": "gr6",
            "@mimetype": "image/jpeg"
          },
          {
            "@category": "standard",
            "@height": "390",
            "@width": "565",
            "@_fa": "true",
            "$": "https://api.elsevier.com/content/object/eid/1-s2.0-S2468823117305655-gr7.jpg?httpAccept=%2A%2F%2A",
            "@multimediatype": "JPEG image file",
            "@type": "IMAGE-DOWNSAMPLED",
            "@size": "42129",
            "@ref": "gr7",
            "@mimetype": "image/jpeg"
          },
          {
            "@category": "standard",
            "@height": "328",
            "@width": "565",
            "@_fa": "true",
            "$": "https://api.elsevier.com/content/object/eid/1-s2.0-S2468823117305655-gr8.jpg?httpAccept=%2A%2F%2A",
            "@multimediatype": "JPEG image file",
            "@type": "IMAGE-DOWNSAMPLED",
            "@size": "40121",
            "@ref": "gr8",
            "@mimetype": "image/jpeg"
          },
          {
            "@category": "standard",
            "@height": "131",
            "@width": "489",
            "@_fa": "true",
            "$": "https://api.elsevier.com/content/object/eid/1-s2.0-S2468823117305655-gr9.jpg?httpAccept=%2A%2F%2A",
            "@multimediatype": "JPEG image file",
            "@type": "IMAGE-DOWNSAMPLED",
            "@size": "10575",
            "@ref": "gr9",
            "@mimetype": "image/jpeg"
          },
          {
            "@category": "standard",
            "@height": "159",
            "@width": "678",
            "@_fa": "true",
            "$": "https://api.elsevier.com/content/object/eid/1-s2.0-S2468823117305655-sc1.jpg?httpAccept=%2A%2F%2A",
            "@multimediatype": "JPEG image file",
            "@type": "IMAGE-DOWNSAMPLED",
            "@size": "10622",
            "@ref": "sc1",
            "@mimetype": "image/jpeg"
          },
          {
            "@category": "standard",
            "@_fa": "true",
            "$": "https://api.elsevier.com/content/object/eid/1-s2.0-S2468823117305655-mmc1.pdf?httpAccept=%2A%2F%2A",
            "@multimediatype": "Acrobat PDF file",
            "@type": "APPLICATION",
            "@size": "1305107",
            "@ref": "mmc1",
            "@mimetype": "application/pdf"
          }
        ]
      },
      "link": {
        "@rel": "abstract",
        "@href": "https://api.elsevier.com/content/abstract/scopus_id/85039808634"
      }
    }
  }
}