{
  "metadata": {
    "title": "Black phosphorus-based nanocomposites and transition metal phosphates for electrocatalytic oxidation of small molecules",
    "authors": "; ; ",
    "journal": "Molecular Catalysis",
    "date": "2024-04-01",
    "doi": "10.1016/j.mcat.2024.114023",
    "abstract": "",
    "uri": "https://api.elsevier.com/content/article/pii/S2468823124002062",
    "pii": "S2468823124002062"
  },
  "fulltext": {
    "full-text-retrieval-response": {
      "scopus-eid": "2-s2.0-85187799164",
      "originalText": "serial JL 315758 291210 291744 291790 291809 31 Molecular Catalysis MOLECULARCATALYSIS 2024-03-15 2024-03-15 2024-03-15 2024-03-15 2024-04-17T00:02:53 1-s2.0-S2468823124002062 S2468-8231(24)00206-2 S2468823124002062 10.1016/j.mcat.2024.114023 S300 S300.1 FULL-TEXT 1-s2.0-S2468823124X00048 2024-04-29T23:47:21.806552Z 0 0 20240401 2024 2024-03-15T23:46:30.872154Z absattachment articleinfo articlenumber articletitlenorm authfirstinitialnorm authfirstsurnamenorm cid cids contenttype copyright crossmark dateloaded dateloadedtxt datesearch datesort dateupdated dco docsubtype doctype doi eid ewtransactionid hubeid indexeddate issn issnnorm itemstage itemtransactionid itemweight openaccess openarchive pg pgfirst pii piinorm pubdatestart pubdatetxt pubyr sectiontitle sortorder srctitle srctitlenorm srctype ssids alllist content subj subheadings suppl tomb volfirst volissue volumelist webpdf webpdfpagecount yearnav figure body acknowledge affil articletitle auth authfirstini authfull authkeywords authlast grantnumber grantsponsor grantsponsorid highlightsabst orcid primabst ref specialabst 2468-8231 24688231 true 558 558 C Volume 558 40 114023 114023 114023 20240401 1 April 2024 2024-04-01 2024 8.000 Review Papers article rev © 2024 Elsevier B.V. All rights reserved. BLACKPHOSPHORUSBASEDNANOCOMPOSITESTRANSITIONMETALPHOSPHATESFORELECTROCATALYTICOXIDATIONSMALLMOLECULES FU Z 1 Introduction 2 Application for electrocatalytic oxidation of small molecules 2.1 Alcohol oxidation reaction 2.2 Urea oxidation reaction 2.3 Hydrazine oxidation reaction (HzOR) 2.4 Other small molecules oxidation 3 Problems and prospect 4 Conclusions CRediT authorship contribution statement Acknowledgments References WANG 2022 112339 S CHEN 2023 113355 Z WU 2023 112818 Y ZHAO 2021 7745 7778 C CAO 2021 1 19 X BAMBAGIONI 2010 851 855 V LI 2021 19550 19571 Y SONG 2021 20210050 Y HYDROGENPRODUCTIONCOUPLEDWATERORGANICOXIDATIONBASEDLAYEREDDOUBLEHYDROXIDESEXPLORATION XU 2019 3214 3226 Y XIA 2014 899 907 F JIANG 2016 14053 14057 Q XIA 2014 4458 F BATMUNKH 2018 2644 2647 M YUAN 2019 4972 4979 Z ZHAO 2024 263 272 M ZHAO 2023 6057 6066 M XIAO 2023 18685 18695 H XIAO 2023 H XIAO 2021 7381 7388 H ZHANG 2021 18717 18724 Q LIU 2005 14871 14878 P LI 2022 32 S PAN 2019 411 419 Y KRAYTSBERG 2014 7303 7330 A WANG 2011 981 1007 Y STEELE 2001 345 352 B HUANG 2018 9467 9472 J CHEN 2017 14136 L LUO 2016 16706 16713 Z MONYONCHO 2016 218 227 E YAN 2023 113327 H CHEN 2023 113410 Y CHURCHILL 2014 330 331 H DAS 2014 5733 5739 S LI 2014 372 377 L TRAN 2014 235319 V VITI 2015 5567 5572 L YUAN 2015 707 713 H WU 2018 1701799 T WU 2019 5136 5145 T VANNI 2019 M CHEN 2023 117820 H ZHU 2023 113132 Z KHOSA 2022 112514 R JOO 2019 1806682 J HUANG 2018 7420 7427 C LIN 2020 227294 J WU 2020 1900550 J YANG 2019 118053 L PEI 2019 583 593 Y WANG 2019 292 299 J HUANG 2019 7687 7690 C CHEN 2021 1063 1072 J XING 2016 13866 13873 J GUAN 2017 2386 2389 B ZHANG 2019 3348 3355 H YU 2018 1890 1897 Z XU 2021 130514 X KUMAR 2021 6494 6505 A WANG 2012 8215 8219 G XU 2020 7463 7471 X HUANG 2021 11947 11952 Y OUYANG 2019 4923 4928 T LI 2021 119987 C ZHU 2022 1020 1026 F ZHU 2020 1906133 B FENG 2020 124525 Y JIANG 2021 2104951 H TAO 2020 119367 X KANG 2022 2200950 J ZHANG 2022 112513 M YANG 2022 546 555 L LIU 2021 1759 1769 H YANG 2019 26364 26370 W CHANG 2017 486 496 J STERN 2015 2347 2351 L LIU 2019 16017 16025 H MARUTHAPANDIAN 2018 2795 2807 V ZHANG 2022 112640 K ZHANG 2019 16042 16050 N ZHANG 2019 16976 16981 L CHEN 2021 7297 7307 W QIAN 2021 6049 6058 Q WANG 2019 13466 13471 T ZHOU 2017 1604080 L CAO 2023 113625 S JING 2024 113832 C ZHAO 2024 113793 Y LI 2015 031002 X QIU 2017 13384 13403 M LIU 2017 7416 7423 Y ZHANG 2016 8707 8714 Q SEO 2016 1 8 S LIANG 2019 151648 B WANG 2019 10637 10645 W JAIN 2015 8501 A SUN 2021 4182 F SUN 2021 119740 H KUBOTA 2018 2138 2145 S GHATAK 2008 2904 2911 H GHATAK 2006 934 938 H LIU 2020 265 W ZHANG 2021 2104791 Y CHONG 2021 22181 22187 X HUANG 2018 13347 13350 Y YI 2021 21550 21557 L PEI 2021 6975 6983 Y FUX2024X114023 FUX2024X114023XZ 2026-03-15T00:00:00.000Z 2026-03-15T00:00:00.000Z http://creativecommons.org/licenses/by-nc-nd/4.0/ © 2024 Elsevier B.V. All rights reserved. 2024-03-20T04:04:18.166Z http://vtw.elsevier.com/data/voc/AddOnTypes/50.7/aggregated-refined 21571119 NSFC National Natural Science Foundation of China http://data.elsevier.com/vocabulary/SciValFunders/501100001809 http://sws.geonames.org/1814991 China postdoctoral Science Foundation 2021M691366 China Postdoctoral Science Foundation http://data.elsevier.com/vocabulary/SciValFunders/501100002858 http://sws.geonames.org/1814991/ Graduate Education Innovation Project of Shanxi Province 2022Y483 2021Y480 Chunhui Plan\" Cooperative Scientific Research Project of Education Ministry HZKY20220510 Scientific and Technological Innovation Programs of Higher Education Institution in Shanxi 2019L0466 Natural Science Foundation of Shanxi Province Natural Science Foundation of Shanxi Province http://data.elsevier.com/vocabulary/SciValFunders/501100004480 http://sws.geonames.org/1814991/ 1331 Engineering of Shanxi Province Fundamental Research Program of Shanxi Province 202203021221130 202203021221136 20210302124473 Graduate Education Innovation Project of Shanxi Normal University 2021XSY038 This research was supported by the National Natural Science Foundation of China ( 21571119 ), Fundamental Research Program of Shanxi Province (No. 202203021221130 , No. 202203021221136 , No. 20210302124473 ), the Natural Science Foundation of Shanxi Province (No. 202203021221130 , No. 202203021221136 , No. 20210302124473 ), \"Chunhui Plan\" Cooperative Scientific Research Project of Education Ministry (No. HZKY20220510 ), Scientific and Technological Innovation Programs of Higher Education Institution in Shanxi ( 2019L0466 ), the Graduate Education Innovation Project of Shanxi Province ( 2021Y480 , 2022Y483 ), the China postdoctoral Science Foundation ( 2021M691366 ), the Graduate Education Innovation Project of Shanxi Normal University ( 2021XSY038 ) and 1331 Engineering of Shanxi Province. https://doi.org/10.15223/policy-017 https://doi.org/10.15223/policy-037 https://doi.org/10.15223/policy-012 https://doi.org/10.15223/policy-029 https://doi.org/10.15223/policy-004 item S2468-8231(24)00206-2 S2468823124002062 1-s2.0-S2468823124002062 10.1016/j.mcat.2024.114023 315758 2024-04-29T23:47:21.806552Z 2024-04-01 1-s2.0-S2468823124002062-main.pdf https://s3-eu-west-1.amazonaws.com/prod-ucs-content-store-eu-west/content/pii:S2468823124002062/MAIN/application/pdf/49d6b17145869cca94aa6e097471d279/main.pdf main.pdf pdf true 13223372 MAIN 13 1-s2.0-S2468823124002062-main_1.png https://s3-eu-west-1.amazonaws.com/prod-ucs-content-store-eu-west/content/pii:S2468823124002062/PREVIEW/image/png/383ba47a5b7720ef14f24ef1af662949/main_1.png main_1.png png 59407 849 656 IMAGE-WEB-PDF 1 1-s2.0-S2468823124002062-gr2.jpg https://s3-eu-west-1.amazonaws.com/prod-ucs-content-store-eu-west/content/pii:S2468823124002062/gr2/DOWNSAMPLED/image/jpeg/f35b996d4af80c5e0c92788fe904e029/gr2.jpg gr2 gr2.jpg jpg 17886 113 628 IMAGE-DOWNSAMPLED 1-s2.0-S2468823124002062-gr10.jpg https://s3-eu-west-1.amazonaws.com/prod-ucs-content-store-eu-west/content/pii:S2468823124002062/gr10/DOWNSAMPLED/image/jpeg/8f44c38d7b60d757b00030814ae6dc47/gr10.jpg gr10 gr10.jpg jpg 74643 488 502 IMAGE-DOWNSAMPLED 1-s2.0-S2468823124002062-gr3.jpg https://s3-eu-west-1.amazonaws.com/prod-ucs-content-store-eu-west/content/pii:S2468823124002062/gr3/DOWNSAMPLED/image/jpeg/7f249fb16b757a9d3398ed51dee86035/gr3.jpg gr3 gr3.jpg jpg 76769 419 529 IMAGE-DOWNSAMPLED 1-s2.0-S2468823124002062-gr4.jpg https://s3-eu-west-1.amazonaws.com/prod-ucs-content-store-eu-west/content/pii:S2468823124002062/gr4/DOWNSAMPLED/image/jpeg/567a833dc158cf701eaa5f1c2f5b5d11/gr4.jpg gr4 gr4.jpg jpg 64202 265 645 IMAGE-DOWNSAMPLED 1-s2.0-S2468823124002062-gr12.jpg https://s3-eu-west-1.amazonaws.com/prod-ucs-content-store-eu-west/content/pii:S2468823124002062/gr12/DOWNSAMPLED/image/jpeg/48df679981f81538b978a80f47d78bb1/gr12.jpg gr12 gr12.jpg jpg 117788 526 656 IMAGE-DOWNSAMPLED 1-s2.0-S2468823124002062-gr5.jpg https://s3-eu-west-1.amazonaws.com/prod-ucs-content-store-eu-west/content/pii:S2468823124002062/gr5/DOWNSAMPLED/image/jpeg/3905d624b502587d89792aad67b6ee8e/gr5.jpg gr5 gr5.jpg jpg 89774 470 556 IMAGE-DOWNSAMPLED 1-s2.0-S2468823124002062-gr11.jpg https://s3-eu-west-1.amazonaws.com/prod-ucs-content-store-eu-west/content/pii:S2468823124002062/gr11/DOWNSAMPLED/image/jpeg/91da103265b6cea071d23db745460ea3/gr11.jpg gr11 gr11.jpg jpg 56545 260 566 IMAGE-DOWNSAMPLED 1-s2.0-S2468823124002062-gr6.jpg https://s3-eu-west-1.amazonaws.com/prod-ucs-content-store-eu-west/content/pii:S2468823124002062/gr6/DOWNSAMPLED/image/jpeg/69c75a74a3eee753420e0a759d06a8b8/gr6.jpg gr6 gr6.jpg jpg 38795 194 585 IMAGE-DOWNSAMPLED 1-s2.0-S2468823124002062-gr14.jpg https://s3-eu-west-1.amazonaws.com/prod-ucs-content-store-eu-west/content/pii:S2468823124002062/gr14/DOWNSAMPLED/image/jpeg/dc29a916a27685c4670e4889fa8127f0/gr14.jpg gr14 gr14.jpg jpg 72643 461 547 IMAGE-DOWNSAMPLED 1-s2.0-S2468823124002062-gr7.jpg https://s3-eu-west-1.amazonaws.com/prod-ucs-content-store-eu-west/content/pii:S2468823124002062/gr7/DOWNSAMPLED/image/jpeg/8aabac6b4cbe71d5576c9c449e9dc952/gr7.jpg gr7 gr7.jpg jpg 81489 459 568 IMAGE-DOWNSAMPLED 1-s2.0-S2468823124002062-gr13.jpg https://s3-eu-west-1.amazonaws.com/prod-ucs-content-store-eu-west/content/pii:S2468823124002062/gr13/DOWNSAMPLED/image/jpeg/00adcdaf3ac8a77d1b78d0d532e4af3f/gr13.jpg gr13 gr13.jpg jpg 16620 167 371 IMAGE-DOWNSAMPLED 1-s2.0-S2468823124002062-gr8.jpg https://s3-eu-west-1.amazonaws.com/prod-ucs-content-store-eu-west/content/pii:S2468823124002062/gr8/DOWNSAMPLED/image/jpeg/df2eaccdab456fcfd3a3d514448e5e00/gr8.jpg gr8 gr8.jpg jpg 38599 154 520 IMAGE-DOWNSAMPLED 1-s2.0-S2468823124002062-gr9.jpg https://s3-eu-west-1.amazonaws.com/prod-ucs-content-store-eu-west/content/pii:S2468823124002062/gr9/DOWNSAMPLED/image/jpeg/2149e58880486041b0d244b03ed861fd/gr9.jpg gr9 gr9.jpg jpg 44023 180 616 IMAGE-DOWNSAMPLED 1-s2.0-S2468823124002062-gr15.jpg https://s3-eu-west-1.amazonaws.com/prod-ucs-content-store-eu-west/content/pii:S2468823124002062/gr15/DOWNSAMPLED/image/jpeg/0d792d36cf520ccb406f20cb41c01d34/gr15.jpg gr15 gr15.jpg jpg 98343 492 635 IMAGE-DOWNSAMPLED 1-s2.0-S2468823124002062-gr1.jpg https://s3-eu-west-1.amazonaws.com/prod-ucs-content-store-eu-west/content/pii:S2468823124002062/gr1/DOWNSAMPLED/image/jpeg/a4acf2032705891b170582109f841ef1/gr1.jpg gr1 gr1.jpg jpg 41249 307 307 IMAGE-DOWNSAMPLED 1-s2.0-S2468823124002062-ga1.jpg https://s3-eu-west-1.amazonaws.com/prod-ucs-content-store-eu-west/content/pii:S2468823124002062/ga1/DOWNSAMPLED/image/jpeg/98e0081f5de3e4d37d75a6b592befb94/ga1.jpg ga1 true ga1.jpg jpg 30014 244 244 IMAGE-DOWNSAMPLED 1-s2.0-S2468823124002062-gr2.sml https://s3-eu-west-1.amazonaws.com/prod-ucs-content-store-eu-west/content/pii:S2468823124002062/gr2/THUMBNAIL/image/gif/e87535df0d69e792ad7bdb09caebeb84/gr2.sml gr2 gr2.sml sml 6466 39 219 IMAGE-THUMBNAIL 1-s2.0-S2468823124002062-gr10.sml https://s3-eu-west-1.amazonaws.com/prod-ucs-content-store-eu-west/content/pii:S2468823124002062/gr10/THUMBNAIL/image/gif/280f1c33d558e8984d64bc4f152d14f6/gr10.sml gr10 gr10.sml sml 13519 163 168 IMAGE-THUMBNAIL 1-s2.0-S2468823124002062-gr3.sml https://s3-eu-west-1.amazonaws.com/prod-ucs-content-store-eu-west/content/pii:S2468823124002062/gr3/THUMBNAIL/image/gif/126a8809dd74aef69ec0a3cfa04c442c/gr3.sml gr3 gr3.sml sml 14563 164 207 IMAGE-THUMBNAIL 1-s2.0-S2468823124002062-gr4.sml https://s3-eu-west-1.amazonaws.com/prod-ucs-content-store-eu-west/content/pii:S2468823124002062/gr4/THUMBNAIL/image/gif/4c925de27157a40a6377bdea72481c5e/gr4.sml gr4 gr4.sml sml 12393 90 219 IMAGE-THUMBNAIL 1-s2.0-S2468823124002062-gr12.sml https://s3-eu-west-1.amazonaws.com/prod-ucs-content-store-eu-west/content/pii:S2468823124002062/gr12/THUMBNAIL/image/gif/85a3498685979a3bab9fe5104c9dce0d/gr12.sml gr12 gr12.sml sml 17559 163 204 IMAGE-THUMBNAIL 1-s2.0-S2468823124002062-gr5.sml https://s3-eu-west-1.amazonaws.com/prod-ucs-content-store-eu-west/content/pii:S2468823124002062/gr5/THUMBNAIL/image/gif/7a6b4092df583ea54b7b333ad0dde1fc/gr5.sml gr5 gr5.sml sml 16663 164 194 IMAGE-THUMBNAIL 1-s2.0-S2468823124002062-gr11.sml https://s3-eu-west-1.amazonaws.com/prod-ucs-content-store-eu-west/content/pii:S2468823124002062/gr11/THUMBNAIL/image/gif/76beb14b0324d3c516ff27d7318e6feb/gr11.sml gr11 gr11.sml sml 13205 100 219 IMAGE-THUMBNAIL 1-s2.0-S2468823124002062-gr6.sml https://s3-eu-west-1.amazonaws.com/prod-ucs-content-store-eu-west/content/pii:S2468823124002062/gr6/THUMBNAIL/image/gif/fd4a331509e5a15ea8f0f76c1823fc2c/gr6.sml gr6 gr6.sml sml 10767 73 219 IMAGE-THUMBNAIL 1-s2.0-S2468823124002062-gr14.sml https://s3-eu-west-1.amazonaws.com/prod-ucs-content-store-eu-west/content/pii:S2468823124002062/gr14/THUMBNAIL/image/gif/7b786caf1dff5b25680bc70b37d261e9/gr14.sml gr14 gr14.sml sml 15356 163 194 IMAGE-THUMBNAIL 1-s2.0-S2468823124002062-gr7.sml https://s3-eu-west-1.amazonaws.com/prod-ucs-content-store-eu-west/content/pii:S2468823124002062/gr7/THUMBNAIL/image/gif/13fee4c6dee9d60004d10dfc254d0f7c/gr7.sml gr7 gr7.sml sml 14728 164 203 IMAGE-THUMBNAIL 1-s2.0-S2468823124002062-gr13.sml https://s3-eu-west-1.amazonaws.com/prod-ucs-content-store-eu-west/content/pii:S2468823124002062/gr13/THUMBNAIL/image/gif/bdded3b089ec6ab7e291ce521019cde7/gr13.sml gr13 gr13.sml sml 9638 99 219 IMAGE-THUMBNAIL 1-s2.0-S2468823124002062-gr8.sml https://s3-eu-west-1.amazonaws.com/prod-ucs-content-store-eu-west/content/pii:S2468823124002062/gr8/THUMBNAIL/image/gif/003905b57c1f7a8e3a5584a9c3626446/gr8.sml gr8 gr8.sml sml 11154 65 219 IMAGE-THUMBNAIL 1-s2.0-S2468823124002062-gr9.sml https://s3-eu-west-1.amazonaws.com/prod-ucs-content-store-eu-west/content/pii:S2468823124002062/gr9/THUMBNAIL/image/gif/9054efc6c8dda7814e87640f8096f24b/gr9.sml gr9 gr9.sml sml 9998 64 219 IMAGE-THUMBNAIL 1-s2.0-S2468823124002062-gr15.sml https://s3-eu-west-1.amazonaws.com/prod-ucs-content-store-eu-west/content/pii:S2468823124002062/gr15/THUMBNAIL/image/gif/b0101e890650d5bd657d997a0d0aa0af/gr15.sml gr15 gr15.sml sml 16966 164 212 IMAGE-THUMBNAIL 1-s2.0-S2468823124002062-gr1.sml https://s3-eu-west-1.amazonaws.com/prod-ucs-content-store-eu-west/content/pii:S2468823124002062/gr1/THUMBNAIL/image/gif/dd392da194d5ff6e0032964c22fa8b7b/gr1.sml gr1 gr1.sml sml 16917 164 164 IMAGE-THUMBNAIL 1-s2.0-S2468823124002062-ga1.sml https://s3-eu-west-1.amazonaws.com/prod-ucs-content-store-eu-west/content/pii:S2468823124002062/ga1/THUMBNAIL/image/gif/c4cf706040015624c80555b618c461c5/ga1.sml ga1 true ga1.sml sml 16354 163 163 IMAGE-THUMBNAIL 1-s2.0-S2468823124002062-gr2_lrg.jpg https://s3-eu-west-1.amazonaws.com/prod-ucs-content-store-eu-west/content/pii:S2468823124002062/HIGHRES/image/jpeg/303002879ea7fecf3dae43abfaaa5d9b/gr2_lrg.jpg gr2 gr2_lrg.jpg jpg 112990 500 2780 IMAGE-HIGH-RES 1-s2.0-S2468823124002062-gr10_lrg.jpg https://s3-eu-west-1.amazonaws.com/prod-ucs-content-store-eu-west/content/pii:S2468823124002062/HIGHRES/image/jpeg/fdf14e507aa224ae6fd36a990e812b35/gr10_lrg.jpg gr10 gr10_lrg.jpg jpg 506485 2162 2222 IMAGE-HIGH-RES 1-s2.0-S2468823124002062-gr3_lrg.jpg https://s3-eu-west-1.amazonaws.com/prod-ucs-content-store-eu-west/content/pii:S2468823124002062/HIGHRES/image/jpeg/60ab7ca57480e2233cfb8d3494205d2b/gr3_lrg.jpg gr3 gr3_lrg.jpg jpg 601466 1855 2344 IMAGE-HIGH-RES 1-s2.0-S2468823124002062-gr4_lrg.jpg https://s3-eu-west-1.amazonaws.com/prod-ucs-content-store-eu-west/content/pii:S2468823124002062/HIGHRES/image/jpeg/08552a10aebab7b8245d1be9e3a0329b/gr4_lrg.jpg gr4 gr4_lrg.jpg jpg 494776 1173 2857 IMAGE-HIGH-RES 1-s2.0-S2468823124002062-gr12_lrg.jpg https://s3-eu-west-1.amazonaws.com/prod-ucs-content-store-eu-west/content/pii:S2468823124002062/HIGHRES/image/jpeg/1287f65d8b796ecce8458c33f0de0ebd/gr12_lrg.jpg gr12 gr12_lrg.jpg jpg 895020 2329 2906 IMAGE-HIGH-RES 1-s2.0-S2468823124002062-gr5_lrg.jpg https://s3-eu-west-1.amazonaws.com/prod-ucs-content-store-eu-west/content/pii:S2468823124002062/HIGHRES/image/jpeg/49c113f23784f28cd2da0c36ab49b177/gr5_lrg.jpg gr5 gr5_lrg.jpg jpg 690989 2081 2463 IMAGE-HIGH-RES 1-s2.0-S2468823124002062-gr11_lrg.jpg https://s3-eu-west-1.amazonaws.com/prod-ucs-content-store-eu-west/content/pii:S2468823124002062/HIGHRES/image/jpeg/1a81227698b02646888555bb2cf9fd64/gr11_lrg.jpg gr11 gr11_lrg.jpg jpg 426610 1150 2506 IMAGE-HIGH-RES 1-s2.0-S2468823124002062-gr6_lrg.jpg https://s3-eu-west-1.amazonaws.com/prod-ucs-content-store-eu-west/content/pii:S2468823124002062/HIGHRES/image/jpeg/150e16a3a9fde063d09aa26c4e08a1ff/gr6_lrg.jpg gr6 gr6_lrg.jpg jpg 280733 859 2589 IMAGE-HIGH-RES 1-s2.0-S2468823124002062-gr14_lrg.jpg https://s3-eu-west-1.amazonaws.com/prod-ucs-content-store-eu-west/content/pii:S2468823124002062/HIGHRES/image/jpeg/7653b6c5109df6bae64e38bfa473cdf8/gr14_lrg.jpg gr14 gr14_lrg.jpg jpg 549746 2040 2421 IMAGE-HIGH-RES 1-s2.0-S2468823124002062-gr7_lrg.jpg https://s3-eu-west-1.amazonaws.com/prod-ucs-content-store-eu-west/content/pii:S2468823124002062/HIGHRES/image/jpeg/fe91b4249fc340c3fd9872a736636e61/gr7_lrg.jpg gr7 gr7_lrg.jpg jpg 633165 2031 2515 IMAGE-HIGH-RES 1-s2.0-S2468823124002062-gr13_lrg.jpg https://s3-eu-west-1.amazonaws.com/prod-ucs-content-store-eu-west/content/pii:S2468823124002062/HIGHRES/image/jpeg/dc1cf60491b51eba0e1cc2feab9b7435/gr13_lrg.jpg gr13 gr13_lrg.jpg jpg 107362 742 1646 IMAGE-HIGH-RES 1-s2.0-S2468823124002062-gr8_lrg.jpg https://s3-eu-west-1.amazonaws.com/prod-ucs-content-store-eu-west/content/pii:S2468823124002062/HIGHRES/image/jpeg/1cb20ddd433efd77127f13826dbc0cfe/gr8_lrg.jpg gr8 gr8_lrg.jpg jpg 269251 682 2303 IMAGE-HIGH-RES 1-s2.0-S2468823124002062-gr9_lrg.jpg https://s3-eu-west-1.amazonaws.com/prod-ucs-content-store-eu-west/content/pii:S2468823124002062/HIGHRES/image/jpeg/8ee60eb645e8ee3207edc8264dbec094/gr9_lrg.jpg gr9 gr9_lrg.jpg jpg 312767 796 2730 IMAGE-HIGH-RES 1-s2.0-S2468823124002062-gr15_lrg.jpg https://s3-eu-west-1.amazonaws.com/prod-ucs-content-store-eu-west/content/pii:S2468823124002062/HIGHRES/image/jpeg/6f214447a4bd0492cdb92f2055615919/gr15_lrg.jpg gr15 gr15_lrg.jpg jpg 865077 2179 2813 IMAGE-HIGH-RES 1-s2.0-S2468823124002062-gr1_lrg.jpg https://s3-eu-west-1.amazonaws.com/prod-ucs-content-store-eu-west/content/pii:S2468823124002062/HIGHRES/image/jpeg/26b237c7d5f702cec0ae537111677406/gr1_lrg.jpg gr1 gr1_lrg.jpg jpg 325529 1360 1360 IMAGE-HIGH-RES 1-s2.0-S2468823124002062-ga1_lrg.jpg https://s3-eu-west-1.amazonaws.com/prod-ucs-content-store-eu-west/content/pii:S2468823124002062/HIGHRES/image/jpeg/4ce00dd2cc7b47b72b4f2aa93fa9254a/ga1_lrg.jpg ga1 true ga1_lrg.jpg jpg 226417 1085 1083 IMAGE-HIGH-RES 1-s2.0-S2468823124002062-am.pdf am am.pdf pdf 1163795 AAM-PDF https://s3-eu-west-1.amazonaws.com/prod-ucs-content-store-eu-west/content/egi:10HD4QG1XLF/MAIN/application/pdf/39a0b3580d30778389fb8b22a8d3e434/am.pdf MCAT 114023 114023 S2468-8231(24)00206-2 10.1016/j.mcat.2024.114023 Elsevier B.V. Fig. 1 Schematic illustration of this review article, including potential applications for BP-based nanocomposites and the internal factors affecting the structure-activity relationship of these materials. Fig. 1 Fig. 2 Schematic illustration of the synthesis of Pd3P/BP [20]. Fig. 2 Fig. 3 (a) CVs of the Pd3P/BP, Pd3P + BP, Pd3P, Pd/C, and BP catalysts in 1 M NaOH solution. (b) Cyclic voltammetric measurements obtained for the Pd3P/BP, Pd3P + BP, Pd3P, Pd/C, and BP catalysts in 1 M NaOH + 1 M CH3CH2OH solution. (c) Comparison of the mass activity of various Pd- and Pt-based EOR catalysts. (d) CVs of Pd3P/GO, Pd3P/TiO2, and Pd3P/N4C3 in 1 M NaOH + 1 M CH3CH2OH solution [20]. Fig. 3 Fig. 4 Schematic diagram for the preparation of Pd/AG−BP catalysts [40]. Fig. 4 Fig. 5 (a) CVs of the Pd-based catalysts with different supports in a 1.0 M sodium hydroxide solution (scan rate: 50 mV s − 1). (b) CVs for the Pd/AG−BP catalysts in a 1.0 M sodium hydroxide solution (scan rate: 50 mV s − 1). (c) CVs for the Pd-based catalysts with different supports in a 1.0 M sodium hydroxide and 1.0 M ethanol mixture solution (scan rate: 50 mV s − 1). (d) CVs of Pd/AG−BP catalysts with different contents of Pd in 1.0 M sodium hydroxide solution (scan rate: 50 mV s − 1). (e) Comparison of mass activities for recent EOR catalysts. (f) Tafel plots of the catalysts. (g)Chronoamperometric curves for the Pd-based catalysts with different supports, and (h) The current densities of the catalysts toward EOR after durability tests of different times [40]. Fig. 5 Fig. 6 Schematic illustration of the fabrication of the Pd/ATN-BP hybrids [39]. Fig. 6 Fig. 7 (a) CVs of the Pd/ATN, Pd/BP, Pd/C, and Pd/ATN-BP-20% catalysts in 1.0 M NaOH solution at a scan rate of 50 mV s − 1. (b) CVs of Pd/ATN-BP catalysts with different feed mass percentages of Pd in 1.0 M NaOH solution at a scan rate of 50 mV s − 1. (c) Cyclic voltammetric measurements obtained for the Pd/ATN, Pd/BP, Pd/C, and Pd/ATN-BP-20% catalysts in 1.0 M NaOH + 1.0 M CH3CH2OH solution at a scan rate of 50 mV s − 1, and (d) Cyclic voltammetric measurements obtained for Pd/ATN-BP catalysts with different feed mass percentages of Pd in 1.0 M NaOH + 1.0 M CH3CH2OH solution at a scan rate of 50 mV s − 1 [39]. Fig. 7 Fig. 8 Schematic illustration of the synthetic process of CoP@PNC/PCWF [70]. Fig. 8 Fig. 9 (a) Polarization curves for the OER and UOR of CoP@PNC/PCWF with a scan rate of 5 mV s–1. (b) LSV curves of CoP@PNC/PCWF, CoP@NC/PCWF, CoP@PNC, Co@NC/CWF, and commercial Pt/C. (c) The comparison of potentials between CoP@PNC/PCWF and recently reported UOR catalysts at 10 mA cm–2 [70]. Fig. 9 Fig. 10 (a) LSV curves of Pt/C||CoP@PNC/PCWF for overall urea electrolysis in 1.0 M KOH with and without 0.5 M urea. (b) LSV curves of urea electrolysis at Pt/C||CoP@PNC/PCWF and Pt/C||Pt/C. (c) Chronopotentiometry plots of Pt/C||CoP@PNC/PWCF obtained at a constant current density of 20 mA cm−2 (the inset is a digital photo of the overall urea splitting cell) [70]. Fig. 10 Fig. 11 Illustration for the synthesis of CoNiOP composite [72]. Fig. 11 Fig. 12 (a) CV curves of CoNiOP/NF in different electrolytes. (b) LSV curves and (c) Tafel plots of CoOP-1/NF, CoOP-2/NF and CoNiOP/NF in 1.0 M KOH with 0.33 M urea. (d) Multi-current process of CoNiOP/NF: the current density changed from 10 to 190 mA cm−2 with an increment of 20 mA cm−2 per 200 s. (e) V–t curve of CoNiOP/NF during UOR at 30 mA cm−2 in 1.0 M KOH with 0.33 M urea. (f) Raman spectra of CoNiOP after UOR. (g) Schematic diagram of urea electrolytic cell with UOR and HER. (h) Polarization curves of the CoNiOP/NF|| CoNiOP/NF electrode in different electrolyte in a two-electrode system. (i)V–t curve of overall urea-containing water splitting at 50 mA cm−2. (Inset: A photograph of the electrode surface during electrolysis) [72]. Fig. 12 Fig. 13 Synthesis scheme for Ni2P nanoflakes [73]. Fig. 13 Fig. 14 (a) Cyclic voltammetry curves in 1 M KOH solution with and without 0.5 M urea at a scan rate of 5 mV s − 1. (b) Tafel slope values. (c) TOF values during the OER process and (d) TOF values during the UOR process for Ni2P and β-Ni(OH)2 nanoflakes [73]. Fig. 14 Fig. 15 The electrochemical tests of Ni/C, Co/C, NiCo/C and NiCoP/C electrocatalysts (scan rate: 50 mV s − 1): (a) CVs in 1.0 M KOH solution. (b) HzOR in 0.02 M N2H4 + 1.0 M KOH solution. (c) CAs for 3000 s in 0.02 M N2H4 + 1.0 M KOH solution. (d) Histogram of after 3000 s in 0.02 M N2H4 + 1.0 M KOH solution via CAs tests [94]. Fig. 15 Black phosphorus-based nanocomposites and transition metal phosphates for electrocatalytic oxidation of small molecules Zimei Fu Writing – original draft Formal analysis Conceptualization a Chunmei Liu Software Investigation Formal analysis a Meng Bai Software Formal analysis a Jiamin Ma Software Formal analysis a Peipei Zhao Software Formal analysis a Yang Gao Software Formal analysis a Man Zhao Writing – review & editing Software Formal analysis a ⁎ Yingluo He Formal analysis Software b He Xiao Software Formal analysis a ⁎ Jianfeng Jia Writing – review & editing Funding acquisition Formal analysis a ⁎ a Key Laboratory of Magnetic Molecules & Magnetic Information Materials Ministry of Education, The School of Chemical and Material Science, Shanxi Normal University, Taiyuan, 030000, PR China Key Laboratory of Magnetic Molecules & Magnetic Information Materials Ministry of Education The School of Chemical and Material Science Shanxi Normal University Taiyuan 030000 PR China aKey Laboratory of Magnetic Molecules & Magnetic Information Materials Ministry of Education, The School of Chemical and Material Science, Shanxi Normal University, Taiyuan, 030000, PR China b Department of Applied Chemistry, School of Engineering, University of Toyama, Gofuku 3190, Toyama, 930-8555, Japan Department of Applied Chemistry School of Engineering University of Toyama Gofuku 3190 Toyama 930-8555 Japan bDepartment of Applied Chemistry, School of Engineering, University of Toyama, Gofuku 3190, Toyama, 930-8555, Japan ⁎ Corresponding authors. The electrochemical oxidation reaction of small molecules (EORSM) has attracted extensive attention due to its advantages such as mild operating conditions, high conversion efficiency, good selectivity and environmental friendliness. Moreover, with relatively fast reaction kinetics and low theoretical thermodynamic equilibrium potential, EORSM is expected to replace anodic oxygen evolution reaction (OER). The coupling of EORSM at anode with hydrogen evolution reaction (HER) at cathode could realize multiple targets including high-value chemicals production, pollutant degradation and efficient hydrogen production. Black phosphorus-based nanocomposites are supposed as a promising EORSM electrocatalyst due to their adjustable electronic structure, large specific surface area, high carrier mobility and active lone pair electrons. Apart from that, transition metal phosphates (TMPs) are also widely used for EORSM because of their abundant active sites, strong electrical conductivity and adjustable component structure. This mini review briefly summarizes the recent progress of EORSM including alcohol oxidation, urea oxidation and hydrazine oxidation over BP-based nanocomposites or TMPs. In addition, possible challenges and research directions are also discussed for inspiring people to optimize EORSM using BP-based nanocomposites and ™Ps. Graphical abstract Black phosphorus-based nanocomposites and transition metal phosphates for electrocatalytic oxidation of small molecules. Image, graphical abstract Key Words Black phosphorus Electrocatalytic oxidation Small molecule Transition metal phosphates Data availability Data will be made available on request. 1 Introduction To deal with the energy crisis and environmental pollution problems, renewable energy must be developed. Clean hydrogen fuel is expected as an ideal substitute to fossil fuels [1]. Among these methods for hydrogen production, electrocatalytic water electrolysis has drawn more attentions due to its mild synthesis condition and environmental friendliness. Electrocatalytic water electrolysis involves two half reaction, hydrogen evolution reaction (HER) carries out at cathode and oxygen evolution reaction (OER) happens at anode. Different from HER, the four-electron transfer process of OER results in slow reaction kinetics and a high theoretical potential (1.23 V vs. RHE) for OER [2,3]. Such a large overpotential greatly diminishes the conversion efficiency of water electrolysis [4,5]. To produce hydrogen with high energy efficiency, researchers have explored electrooxidation of small organic molecules with low-overpotential to replace anodic OER. For example, Bambagioni et al. [6] found that the electrooxidation of renewable alcohols for hydrogen production could achieve a 67% conversion efficiency compared with conventional water electrolysis under the same condition. In this mini review, several electrochemical oxidation reaction of small molecules (EORSM) for hydrogen production are reviewed. In addition, EORSM has other advantages. Electrochemical urea oxidation and hydrazine oxidation could avoid potential environmental pollution from direct urea and hydrazine emission. Electrochemical alcohol oxidation reaction generates chemical products such as acetate or acetaldehyde with strong practicality for chemical industry. In industrial production processes, the synthesis of oxidation products is performed via a sequence of energy-intensive and high-temperature processes. Furthermore, precious metal catalysts and dedicated infrastructure are generally required, leading to high costs and large amounts of catastrophic chemical reagents. Compared with that, electrochemical synthesis reactions require less energy and lower temperature. Therefore, the EORSM not only can be coupled with HER for hydrogen production, but also provide other benefits. [7–9]. Since 2014, the two-dimensional black phosphorus (BP) nanosheets have been widely used in the fields of electrocatalysis and photoelectrocatalysis [10–13]. As a new promising OER electrocatalyst, BP based materials show excellent properties such as controllable electronic structure, large specific surface area, high carrier mobility, and lone pair electrons [14–19]. Moreover, the advantage of using BP as electrocatalyst lies in the following aspects: (1) BP is easily to form into phosphide by coordination with metal due to its lone pair electrons. (2) Metal nanoparticles can be effectively dispersed on BP, which supports a large specific surface area, resulting in a high number of active sites. (3) BP exhibits a strong adsorption capacity for water molecules, facilitating the formation of hydroxyl groups and intermediates [20]. For transition metal phosphides (TMPs), metal cations as proton receptors and non-metallic phosphorus as hydride receptors play an important part in hydroxyl adsorption and O2 desorption, respectively. Therefore, TMPs are potential efficient eleccatalysts for water splitting [21,22]. Here, phosphorus can increase the atomic spacing, weaken the interaction between metals, cause d-band contraction, and enhance electrical conductivity of the TMPs [23]. This review provides a concise summary of the recent advancements in the oxidation reactions of small molecules over BP-based nanocomposites or TMPs. What's more, the structure-activity relationship of BP-based nanocomposites or TMPs towards EORSM is systematically investigated. The schematic illustration of this review content is shown in Fig. 1 . In the final part, the review discusses potential challenges and research directions for EORSM over BP-based nanocomposites and TMPs. 2 Application for electrocatalytic oxidation of small molecules 2.1 Alcohol oxidation reaction With the rapid consumption of limited fossil fuels and growing energy needs, search for renewable energy as well as green energy is urgent [24,25]. Solar energy is considered as a promising clean energy with the characteristics of high theoretical power generation rate and environmental friendliness [26,27]. However, the fluctuation of natural solar energy limited their application. Different from that, direct ethanol fuel cells (DEFCs), which converts chemical energy directly into electric energy, drawn more attentions due to the abundance of ethanol sources and high theoretical energy density. The challenge of slow reaction rate and poor stability in ethanol oxidation reaction needs to be addressed in order to promote the widespread use of DEFCs. Numerous studies have demonstrated that, palladium-based catalysts exhibit high catalytic activity, low cost and excellent resistance to carbon monoxide toxicity in alkaline medium [28–30]. By improving the stability of nanoparticles, other metals or non-metals are doped to adjust their electronic structure, which becomes the focus of current research on material synthesis strategies, and the catalytic activity of the target can be further improved [31,32]. Zhang et al. [20] designed and synthesized a type of heterogeneous Pd3P/BP catalyst, which exhibits high catalytic activity and stability for EOR at low temperatures (Fig. 2 ). Firstly, Pd2+ ions are firmly bound to the BP to from the BP/Pd2+ complex. Later, nanoparticles with an average size of 6.2 nm were obtained on the surface of black phosphorus using a solvothermal strategy. The synergistic effect between Pd3P NPs and BP boost EOR activity and stability of Pd3P/BP compared to Pd3P + BP (physical mixture), Pd3P, and BP (Fig. 3 ). For Pd/graphene catalyst towards alcohol oxidation, introduction of heteroatoms such as nitrogen, sulfur, phosphorus, etc. can change the electronic structure of graphene. Moreover, introducing transition metal oxides (MnO2, CeO2, TiO2, etc.) into the Pd/graphene are extremely useful strategy for enhancing the electrocatalytic activity by adsorbing more *OH in alkaline solution. With direct band gap, BP exhibits adjustable carrier mobility and high hole migration rate [33–38]. Recent research have shown that the generation of *OH and stripping of active intermediates depend on the introduction of 2D BP [39]. Wu et al. [40] proposed a new method for the rational preparation of graphene/BP heterostructures to enhance the EOR activity of Pd (Fig. 4 ). BP, potassium hydroxide (potassium hydroxide) and activated graphene (AG) structure were combined by ball grinding. The obtained Pd/AG-BP hybrids show ultra-high electrochemical activity for the EOR under alkaline conditions (Fig. 5 ). The AG-BP heterostructures with P-C bond linkage can facilitate the generation of adsorbed OH species (OHads) for the oxidation of carcinomic intermediates. The substitution of OER by alcohol oxidation for hydrogen production has been proven to be significant in studies. However, it has also been found that the separation and purification of alcohol oxidation products is still a problem to be solved. In addition, the competition between OER and alcohol oxidation reaction still exists at high current density, which greatly limits its application in industry. Peruzzini et al. [41] found that the strong interaction exist between the metal and the 2D BP carriers as confirmed by scanning transmission electron microscopy. The interaction was quantitatively characterized by X-ray absorption spectroscopy, and the short distance of Pd-P was found to be only 2.26 Å, indicating that the interaction is a covalent Pd-P coordination bond. The change of the electronic environment of Pd atoms depends on the synergistic effect between Pd nanoparticles and phosphorus atoms. At the same time, the change of metal electronic structure has a favorable influence on the adsorption energy and activation barrier of interfacial reactants or intermediates in electrochemical catalysis. Yu et al. [42] synthesized the platinum/BP catalyst. The characterization results suggest that BP has a strong activation effect on the platinum through the synergistic effect between the metal and the supporter. When platinum is bonded to phosphorus, the center of its d band is optimized to the Fermi level, providing suitable energy for electrocatalytic HER intermediates. A large number of literature researches support the idea that loading metal on 2D BP nanosheets can enhance the reactivity of alcohol oxidation. For AOR, BP based materials show the following advantages: (1) Benefiting from the large specific surface area of BP, metal nanoparticles with high dispersion and more active sites can be obtained, which could make full use of metal catalysts. (2) Metal atoms can interact strongly with the lone pair electrons of BP, thus this will optimize the d-band center of metal atoms and enhance the electrocatalytic performance for AOR. (3) BP shows a good adsorption capacity toward water, which promotes the formation of OHads and the stripping of intermediates COads. (4) The strong coordination bond between BP and the metal will promote the separation and agglomeration of the metal, thus enhancing the stability of the catalyst. However, BP nanosheets are easy to be oxidized, which greatly limits their application as two-dimensional material supports. The inhibition of oxidative degradation of BP can be achieved by surface modification or doping. For instance, tannin (TA) or polyurethane-functionalized BP nanosheets can enhance stability after prolonged exposure to oxygen and water. In fact, the lone electron coordination of phosphorus atoms is affected by the change of group or doping element, which will lead to the loss of the inherent structural advantages of supporter. In general, the preparation of two-dimensional BP nanosheets with high stability, large specific surface area and high performance is particularly important for the development of processing technology. Min et al. [39] synthesized a new anatase titanium dioxide/black phosphorus hybrid (ATN-BP) as the supporter for palladium nanoparticles towards EOR (Fig. 6 ). Under the protection of argon gas, BP nanosheets and ATN are prepared directly by ball milling, leading to the formed bonding of P-O-Ti. The construction of ATN-BP not only improves electrolyte permeability and electron transport, but also promotes the stripping of intermediates through the synergistic effect of Pd and ATN-BP. The P impurity occupies the cation site (Ti4+) in the ATN lattice, forming into phosphorus-doped ATN. When ATN-BP is used to support Pd NPs, the resulted Pd/ATN-BP hybrids with heterogeneous interfaces of Pd, BP and ATN show significant electrical activity and durability in alkaline media. After 3600 s of testing, the Pd/ATN-BP catalyst exhibits good durability and stability (Fig. 7 ). Designing and synthesizing heterogeneous materials could make the best use of BP-based materials as metal supporters. Non noble metal phosphide is also promising electrocatalyst for alcohol oxidation. In a Lewis acid-base environment, the introduction of metal ions (such as Fe, Cu, Co, Mn) to BP enhances the ability of d electron transfer between transition metal elements, thus affecting their catalytic performance [43]. As shown for molybdenum phosphide, its exhibits good electronic properties and high conductivity because of enhanced compositions and structures [44]. 2.2 Urea oxidation reaction With a low theoretical potential (0.37 V vs. RHE), anodic urea oxidation reaction has been widely concerned and used to improve hydrogen production efficiency [57,58]. Additionally, urea oxidation as a direct fuel cell also provides a significant function for wastewater purification [59,60]. However, the anodic UOR process involves 6e– transfer (CO(NH2)2 + 6OH− → N2 + 5H2O + CO2 + 6e−), highly active and affordable electrocatalysts are required to boost the efficiency [61]. While Pt/C and IrO2 have been demonstrated good activity for UOR, their low earth content and high-cost limit their scope of application [62–65]. Therefore, the development of high efficiency electrocatalyst is of great significance to improve the efficiency of hydrogen production through UOR. In recent years, researchers have found that nickel-based catalysts, including nickel oxides, hydroxides, and phosphides, exhibit high catalytic activity for UOR [46,66,67]. Among them, nickel-based phosphides with low cost, adjustable element composition, redox characteristics, show a good development for UOR [68,69]. Transition metal phosphates (TMPs) have drawn more attentions because of their low cost and abundant sources [45–48]. Besides, they also show specific properties such as high stability, adjustable central metal valence state, and appropriate binding energy of intermediates in catalytic reactions. Inspired by highly active centers of layered dihydroxide, dimetallic phosphates (e.g. NiCoP [49], CoFeP [50], NiFeP [51–53]) enhance electrocatalytic performance through synergistic interaction between the two active metal components. Moreover, the oxyphosphates [54–56] exhibit good catalytic activity on account of phosphorus-oxygen interaction, which would greatly increase the number of active sites. The generated M-P and M-O bonds are benefitting for regulating the electron configuration, optimizing the adsorption/desorption free energy of intermediates, and improving the reaction activity [31]. Lu et al. [70] successfully loaded ZIF-67 on the surface of wood fiber by using the anchoring effect of forest residues and wood fiber. Subsequently, a P-doped carbonized wood fiber supported P, N co-doped carbon-coated CoP nanoparticle composite electrocatalyst (CoP@PNC/PCWF) was synthesized by simultaneous carbonization phosphatizing treatment for efficient urea catalytic oxidation (Fig. 8 ). The results show that the unique coating structure of the CoP@PNC/PCWF provides the electrocatalyst with good conductivity, structural stability, and a large number of exposed active sites. Meanwhile, doped carbon can induce more defect structures of carbon and regulate the electronic structure of the CoP@PNC surface. The electrochemical test results show that the CoP@PNC/PCWF catalyst exhibits outstanding catalytic performance for UOR, achieving a current density of 50 mA cm−2 with a voltage of only 1.32 V (vs. RHE) (Fig. 9 ). In addition, when urea-assisted electrolytic hydrogen production is carried out with CoP@PNC/PCWF as the anode, a current density of 50 mA cm−2 can be achieved with only 1.5 V working voltage (Fig. 10 ). This work offers an idea for the development of low-cost, urea-assisted, energy-saving electrocatalysts for hydrogen production using forest residues, without the need of nickel. The morphological regulation of nanomaterials can increase the number of active sites, so the catalytic activity in the reaction can be further improved [23,71]. There are various morphologies of oxygen phosphating catalysts (for example nanoparticles [17], nanosheets [24], nanotubes [25]). Their special porosity and large specific surface area made them serve as an effective water cracking catalyst. Good electrical conductivity, more active site exposure, and larger specific surface area are the unique advantages of ultra-thin two-dimensional materials, therefore, they are widely used in catalysis, electronics, energy, and other fields [26]. Oxygen phosphating catalysts also show good catalytic activity due to the interaction of phosphorus and oxygen, which will greatly increase the active site. The symbiotic metal-P bond and metal-O bond are beneficial to regulate the electronic structure of the intermediates, optimize the adsorption/desorption free energy of the intermediates, and thus improve the overall water decomposition performance. In-situ conversion of doped nitrogen and multicomponent metal by ion substitution is another method to change catalytic activity of the composites. Yang et al. [72] synthesized ultra-thin bimetal nanoparticles (CoNiOP/NF) as a multifunction catalyst for HER, OER and UOR (Fig. 11 ). Theoretical calculations and experimental studies both confirm that electron transfer between the metal center and the interface anion is conducive to accelerating the reaction, optimizing the adsorption of intermediates. Therefore the electrocatalytic activity has been greatly improved. Using UOR instead of OER, it needs 1.42 V to achieve current density of 50 mA cm−2. CoNiOP displays the excellent electrocatalytic activity and remarkable durability, attributed to the ultrathin nanosheet, adjustable chemical composition and three-dimensional porous conductive supporter. Constructing planar heterostructures, increasing the number of edge active sites, enhancing the surface area of two-dimensional nanosheets, and cutting the transport distance between electrons and ions are important way to improve the catalytic activity (Fig. 12 ). That is conductive to regulating the electronic structure and optimizing the adsorption/desorption free energy of intermediates, so that it displays good performance. Liu et al. [73] successfully synthesized Ni2P nanosheets through phosphorylating β-Ni (OH)2 nanosheets for electrocatalytic urea oxidation (Fig. 13 ). Ni2P nanosheets effectively improve the OER and UOR performance compared to β-Ni (OH)2 nanosheets. The Ni2P nanosheets also exhibit relatively good UOR performance with onset potential of 1.33 V and peak current of 95.47 mA cm−2 at 1.6 V (Fig. 14 ). The accelerated proton-coupled electron transfer (PCET) process resulted from (PO4)3 promotes the formation of NiOOH; therefore, it results in a lower initial potential for the OER and UOR compared to β-Ni (OH)2. For nickel-based catalysts, in-situ generated NiOOH are considered as the main reactive species for OER and UOR [74–77]. The amount of Ni(OH)2 recovered from NiOOH on the Ni-based catalyst can be determined by the abundant charge calculated (q) from the reduction peak [78]. The redox peak indicates the ability to accumulate NiOOH, and reflects the molar ratio of generated NiOOH to the total nickel metal loaded on the catalyst. In M-N, the substitution of coordination nitrogen atoms in the components (M= Fe, Ni, Co, etc.) with oxygen, sulfur, or phosphorus has been widely used. Co-doping with multiple heteroatoms to change the electronic structure of the active site is also one of the most effective ways to improve the catalytic activity of metal-free materials [79]. These studies show that the electronic structure takes a great influence on the catalytic activity. So far, this is a huge challenge for the synergies of co-dopants and their corresponding active sites, on the effect of the reaction [80]. The mechanism of urea oxidation is complex because of its six-electron transfer process. Zhang et al. [81] synthesized NiClO-D catalysts via a modified sol-gel technique. The NiClO-D electrode requires a potential of 1.386 V vs.RHE to drive a current density of 50 mA cm−2, and they used DFT, 18O isotope labeling mass spectrometry, and in situ Fourier transform infrared (FTIR) to explore the UOR pathway. The results show that in the UOR process, lattice oxygen preferentially selects the active site of Ni4+ compared with Ni3+, and the kinetic rate is significantly accelerated. Chen et al. [82] proposed an effective electrocatalyst design strategy, which reduces the energy barrier formed by β-Ni(OH)O by regulating the lattice oxygen ligand environment of β-Ni(OH)2 by Co, and thus has good activity in UOR. Moreover, they explored the urea oxidation path by using β-Ni(OH)2 as the model catalyst. They provided conclusive evidence for intramolecular coupling of NN bonds by isotopically labeled in situ differential electrochemical mass spectrometry (DEMS), with two N atoms in each N2 molecule formed during the UOR process coming from a single urea molecule. 2.3 Hydrazine oxidation reaction (HzOR) With superior properties such as no noise, high volume energy density, easy to carry and low standard potential value (Eθ = −0.33 V vs. RHE), the hydrazine fuel cell is easy to adapt to military and other special environments [83]. In alkaline environments, the dominant equation for the fuel cell is N2H4 + 4OH−→N2 + 4H2O + 4e−. Obviously, the oxidation products of HzOR are water and N2, which are clean and satisfactory [84,85]. Moreover, HzOR can degrade the harmful hydrazine in wastewater, making HzOR attracted extensive attention instead of oxygen evolution in the production of hydrogen. Modified TMPs has the potential to enhance its catalytic performance for HzOR. It is worth noting that metal doping displays the advantages of controllable doping-amount, simple operation, and short synthesis period. In addition, doping of metal atoms can lead to changes in the inherent properties of excessive metal phosphide, such as increased active specific surface area and optimized electronic structure [86–88]. Therefore, the use of metal doping to metal phosphide has become a common method. So far, both noble metals (Pt, Pd) and non-noble metals (Ni, Co, Cu, Fe) have been explored as electrocatalysts for HzOR [89]. In particular, Ni is characterized by the characteristics of costliness, excellent stability, high electrocatalytic performance, good conductivity and easy preparation [90]. Specifically, Ni-based binary catalysts, such as NiCo, and NiFe, exhibit enhanced electrocatalytic activity and durability compared to mono-metal electrocatalysts because the good synergistic effect [91,92]. It is supposed that introduction of a third heteroatom into the electrocatalyst can restructure the band gap of the material, which is beneficial to improve the activity of the catalyst. P doping has been reported to contribute lone electrons and facilitate the mass transport of catalysts involved in chemical reactions. In addition, P doping can extend the life of the supporter and alter the electron distribution, resulting in high catalytic stability properties [93]. Liang et al. [94] prepared a carbon-borne phosphorus-doped NiCo alloy (NiCoP/C) electrocatalyst in alkaline conditions. The carbon carrier with a large electrochemical surface area is fully in contact with the nanoparticles to accelerate the transfer of the electrons, consequently improving its electrocatalytic performance. Compared with Ni/C and Co/C, NiCoP/C displays high activity with high current density. In addition, NiCoP/C shows small value Tafel slope of 109.17 mV dec−1, low apparent activation energy value (14.66 kJ mol−1) and fast charge transfer rate (Fig. 15 ). It points out the direction for the future development of new non precious metal electrocatalysts. Wang et al. [95] prepared the carbon-borne CuNi catalyst (P-CuxNi/C) using the high-temperature phosphorization process. The P-Cu2Ni/C material shows a high catalytic activity and excellent stability, due to the synergy between Cu, Ni and P. The P-Cu2Ni/C was found to be a diffusion control process of one-way reaction for hydrazine oxidation. This research demonstrates that the synthesized phosphometal catalysts have promising application future for HzOR. Currently, the majority of hydrogen produced through hydroelectrolysis comes from fresh water, which limits the application of the technology in arid regions. Electrolysis of seawater to produce hydrogen is of great significance for saving fresh water resources. As is known, the complex ionic environment of seawater requires great efforts to deal with the interference of negative anion reactions as well as erosion of electrolytic agents and catalysts [96]. Sun et al. [97] made use of a hybrid seawater means for chloride-free H2 by electrolysis related to hydrazine degradation. The researchers designed a self-supported NiCo/Mxene-based catalyst and discovered its hydrazine-assisted seawaterlysis activity in neutral and alkaline seawater electrolytes. The electrolyzer only required an ultra-low voltage of 1.05 V and 0.7 V to achieve a current density of 500 mA cm−2, without producing Cl2/ClO−, and it has greatly avoided the impact of OER. And electrolysis of seawater has been successfully applied to industry to achieve industrial production of hydrogen. Products obtained by UOR and HzOR show low value, but their prospects to reduce severe environmental pollution and water eutrophication dilemmas are good. For example, Wang et al. [98] discovered that there are many advantages by direct electrolysis of animal urine in an alkaline electrolyte. Qiu et al. [90] enables rapid hydrazine degradation of ∼3 ppb residue through HzOR. This proves that UOR and HzOR can be served as a possible urine/hydralide wastewater treatment. These are all typical examples of the utilization of biological wastes. In addition, Ghatak et al. [99,100] have shown the ability to produce hydrogen from black liquor. It's found the effluent from lignocellulosic raw materials for paper-making can be finished at a lower voltage. Hibino et al. [101] discovered that direct electrolysis of non-waste materials as anode reaction has great possibilities, such as paper, breads, cypress chips and rice bran lasting hydrogen preparation. In the near future, there will be various research toward bioassisted electrolytic hydrogen production to achieve more efficient hydrogen production and waste utilization. 2.4 Other small molecules oxidation In addition to small molecule oxidation mentioned in this article, there are some other molecular electrooxidation, such as carbohydrate [102,103], primary amine [104,105] and sulfoxide [106,107]. Liu et al. [102] reported the replacement of OER by electrooxidation of glucose to enhance H2 production. They used a two-electrode electrolyzer with NiFeOx as the anode and NiFeNx as the cathode, which resulted in a high gluconic acid (GRA) yield of 83% at 1.48 V. Zhang et al. [105] synthesized the NiSe electrode by direct selenization of commercially available nickel foam. And they have demonstrated that the electrooxidative conversion of various primary amines to nitrile has high selectivity, high yield, good substrate compatibility and olefinic bond tolerance on the NiSe anode, where Ni2+/Ni3+ can effectively promote its reaction as a active species. Since the electrocatalytic oxidation reactions of primary amines (PAEOR) has a lower theoretical potential than OER, using it as the anode and CoP as the cathode, the battery voltage is significantly reduced relative to the overall water decomposition (for example, a decrease of 210 mV for the benchmark current density of 20 mA cm−2), hydrogen and nitrile can be generated at both the cathode and anode. 3 Problems and prospect Small molecule oxidation is a promising electrochemical strategy to assist water splitting for hydrogen production. Researches have shown that there are many kinds of electro-catalysts for small molecule oxidation. Low-cost non-precious metals, such as nickel and cobalt, have attracted much attention. The influences of the structure and composition of the catalyst on the activity and reaction mechanism of the related reaction are also important scientific topic. In this review, we discussed some EORSM that can replace OER, focusing on small molecule oxidation on BP-based catalysts and TMPs. The EORSM paired with HER not only reduces the electrolytic voltage, but also hinders the production of explosive H2/O2 mixtures and reactive oxygen species. Moreover, EORSM has other advantages. Electrochemical alcohol oxidation can obtain valuable by-products, urea and hydrazine oxidation could reduce wastewater contamination. Electrochemical oxidation of sulfide (H2S) can achieve sulfur recovery and resource utilization of this hazardous waste. The electrochemical oxidative products of glucose such as gluconic acid and glucaric acid are key materials in pharmaceutical industry. Electrochemical oxidation of primary amines could produce nitriles, which are also important intermediate in production of agrochemicals, pharmaceuticals, and fine chemicals. While hydrogen production through EORSM has gained recognition, there is still a lot of room for progress in its industrial applications. Therefore, we propose the following points we think should be considered in the following scientific studies from the aspect of catalyst design, mechanism study and selectivity at high current density. According to previous studies, designing a good catalyst for EORSM for hydrogen production is still very challenging. So it is very important to gain an insight into the mechanism of the related catalytic reactions and realize the targeted design of the oxidation reaction of each small molecule, thus exploiting the potential catalyst. The rapid and effective screening of catalysts conducive to small molecule oxidation is closely related to its mechanism. Subsequently, the electrocatalytic activity can be improved by regulating the electronic structure of the catalyst. In addition, small molecules mostly have different groups, and an in-depth understanding of the links between various groups and different catalysts can help us quickly find catalysts that are more beneficial to the reaction. Up to now, the mechanism of the oxidation reaction of these small molecules is still controversial. Identifying the active sites of catalysts is critical for deducing the reaction mechanism. However, heterogeneous catalysts always involve several different active sites on the surface, which are difficult to distinguish. In particular, the catalytic active sites are dynamically altered during EORSM under anodic potential. This makes the active sites more difficult to identify. For BP-based catalysts and TMPs, the function of BP and active sites still need to be explored. Therefore, making full use of in situ characterization technology and DFT calculations is essential to analyze the active sites and get the optimal reaction pathway. A comprehensive understanding of the main electrocatalytic reaction mechanism of multiple small molecules can help us effectively grasp the reaction pathway, improve the selectivity of target products, and speed up the development of BP-based catalysts and TMPs for EORSM. For commercial applications, improving its selectivity of the catalyst at high current densities has become a great challenge. The side reaction OER is possibly to compete with EORSM at high current density. To reduce the occurrence of the side reaction OER, preferential adsorption of small molecules is important. In addition, enhancing the contact between reactants and active species is another strategy. This strategy not only facilitates the selection of catalysts but also holds promising commercial prospects. Despite significant progress has been made, current EORSM catalyzed by BP-based catalysts and TMP still mainly focus on directly oxidation of alcohol, urea and hydrazine. Most of these reported oxidation reactions involve multi-electron transfer steps, resulting in lower oxidation kinetics for hydrogen production. Furthermore, electrochemical upgrading from a simple molecular substrate to a more valuable carbon-added molecule has rarely reported. At last, most of the anodic oxidation products are hydrophilic, leading to overoxidation of product with low selectivity and requirement of additional work for product separation from the electrolyte. Therefore, based on BP and TMP catalysts, searching for a diversified more readily oxidized small molecule oxidation reaction to replace OER for producing hydrogen and value-added product with high selectivity, is still demandable. 4 Conclusions In this work, based on these superior properties of BP based nanocomposites and TMPs, such as large specific surface area, strong adsorbability to water, the strong interaction between phosphorus and metals, strong electrical conductivity, etc., the application of BP based nanocomposites and TMPs for EORSM was systematically summarized in the following aspects: (1) Alcohol oxidation; (2) Urea oxidation; (3) Hydrazine oxidation. Moreover, the potential opportunities and challenges for application of BP-based materials and TMPs are also proposed for promoting their development towards electrocatalysis. This work will provide important guidelines for constructing efficient BP-based electrocatalysts and TMPs towards EORSM. CRediT authorship contribution statement Zimei Fu: Writing – original draft, Formal analysis, Conceptualization. Chunmei Liu: Software, Investigation, Formal analysis. Meng Bai: Software, Formal analysis. Jiamin Ma: Software, Formal analysis. Peipei Zhao: Software, Formal analysis. Yang Gao: Software, Formal analysis. Man Zhao: Writing – review & editing, Software, Formal analysis. Yingluo He: Formal analysis, Software. He Xiao: Software, Formal analysis. Jianfeng Jia: Writing – review & editing, Funding acquisition, Formal analysis. Declaration of competing interest The authors declare that they have no known competing financial interests or personal relationships that could have appeared to influence the work reported in this paper. Acknowledgments This research was supported by the National Natural Science Foundation of China (21571119), Fundamental Research Program of Shanxi Province (No. 202203021221130, No. 202203021221136, No. 20210302124473), the Natural Science Foundation of Shanxi Province (No. 202203021221130, No. 202203021221136, No. 20210302124473), \"Chunhui Plan\" Cooperative Scientific Research Project of Education Ministry (No. HZKY20220510), Scientific and Technological Innovation Programs of Higher Education Institution in Shanxi (2019L0466), the Graduate Education Innovation Project of Shanxi Province (2021Y480, 2022Y483), the China postdoctoral Science Foundation (2021M691366), the Graduate Education Innovation Project of Shanxi Normal University (2021XSY038) and 1331 Engineering of Shanxi Province. References [1] S. Wang F. Yuan G.X. Yang S.C. Luo M. Chen T.T. Fan J.T. Ma In situ construction of CoFe-LDH by regulating the Co/Fe molar ratio for promoting oxygen evolution reaction Mol. Catal. 525 2022 112339 10.1016/j.mcat.2022.112339 S. Wang, F. Yuan, G.X. Yang, S.C. Luo, M. Chen, T.T. Fan, J.T. Ma, In situ construction of CoFe-LDH by regulating the Co/Fe molar ratio for promoting oxygen evolution reaction, Mol. Catal. 525 (2022) 112339, https://doi.org/10.1016/j.mcat.2022.112339. [2] Z.D. Chen W. Deng X. Li J.J. Zhang D.W. Long S.L. Qiao F. Jiang Modulating the electronic structure of CoFeCNO 2D nanosheets via Ni incorporation for efficient electrochemical oxygen evolution Mol. Catal. 547 2023 113355 10.1016/j.mcat.2023.113355 Z.D. Chen, W. Deng, X. Li, J.J. Zhang, D.W. Long, S.L. Qiao, F. Jiang, Modulating the electronic structure of CoFeCNO 2D nanosheets via Ni incorporation for efficient electrochemical oxygen evolution, Mol. Catal. 547 (2023) 113355, https://doi.org/10.1016/j.mcat.2023.113355. [3] Y.J. Wu Y.N. Zhang M.V. Nguyen T.T.H. Chu T.B.H. Nguyen E.N. Dragoi C.L. Xia Latest insights on eco-friendly metal based-electrocatalyst for oxygen evolution reaction: challenges, and future perspectives Mol. Catal. 534 2023 112818 10.1016/j.mcat.2022.112818 Y.J. Wu, Y.N. Zhang, M.V. Nguyen, T.T.H. Chu, T.B.H. Nguyen, E.N. Dragoi, C.L. Xia, Latest insights on eco-friendly metal based-electrocatalyst for oxygen evolution reaction: challenges, and future perspectives, Mol. Catal. 534 (2023) 112818, https://doi.org/10.1016/j.mcat.2022.112818. [4] C.X. Zhao J.N. Liu J. Wang D. Ren B.Q. Li Q. Zhang Recent advances of noble-metal-free bifunctional oxygen reduction and evolution electrocatalysts Chem. Soc. Rev. 50 2021 7745 7778 10.1039/d1cs00135c C.X. Zhao, J.N. Liu, J. Wang, D. Ren, B.Q. Li, Q. Zhang, Recent advances of noble-metal-free bifunctional oxygen reduction and evolution electrocatalysts, Chem. Soc. Rev. 50 (2021) 7745–7778, https://doi.org/10.1039/d1cs00135c. [5] X.J. Cao T.Z. Wang L.F. Jiao Transition-metal (Fe, Co, and Ni)-based nanofiber electrocatalysts for water splitting Advan. Fiber Mater. 2021 1 19 10.1007/s42765-021-00065-z X.J. Cao, T.Z. Wang, L.F. Jiao, Transition-metal (Fe, Co, and Ni)-based nanofiber electrocatalysts for water splitting, Advan. Fiber Mater.. (2021) 1–19, https://doi.org/10.1007/s42765-021-00065-z. [6] V. Bambagioni M. Bevilacqua C. Bianchini J. Filippi A. Lavacchi A. Marchionni F. Vizza P.K. Shen Self-sustainable production of hydrogen, chemicals, and energy from renewable alcohols by electrocatalysis ChemSusChem 3 2010 851 855 10.1002/cssc.201000103 V. Bambagioni, M. Bevilacqua, C. Bianchini, J. Filippi, A. Lavacchi, A. Marchionni, F. Vizza, P.K. Shen, Self-sustainable production of hydrogen, chemicals, and energy from renewable alcohols by electrocatalysis, ChemSusChem. 3 (2010) 851–855, https://doi.org/10.1002/cssc.201000103. [7] Y. Li X.F. Wei L.S. Chen J.L. Shi Electrocatalytic hydrogen production trilogy Angew. Chem. Int. Ed. 60 2021 19550 19571 10.1002/anie.202009854 Y. Li, X.F. Wei, L.S. Chen, J.L. Shi, Electrocatalytic hydrogen production trilogy, Angew. Chem. Int. Ed. 60 (2021) 19550–19571, https://doi.org/10.1002/anie.202009854. [8] Y.J. Song K.Y. Ji H.H. Duan M.F. Shao Hydrogen Production Coupled With Water and Organic Oxidation Based On Layered Double hydroxides, Exploration 2021 Wiley Online Library 20210050 Y.J. Song, K.Y. Ji, H.H. Duan, M.F. Shao, Hydrogen Production Coupled With Water and Organic Oxidation Based On Layered Double hydroxides, Exploration, Wiley Online Library, 2021, pp. 20210050. [9] Y. Xu B. Zhang Recent advances in electrochemical hydrogen production from water assisted by alternative oxidation reactions ChemElectroChem 6 2019 3214 3226 10.1002/celc.201900675 Y. Xu, B. Zhang, Recent advances in electrochemical hydrogen production from water assisted by alternative oxidation reactions, ChemElectroChem. 6 (2019) 3214–3226, https://doi.org/10.1002/celc.201900675. [10] F.N. Xia H. Wang D. Xiao M. Dubey A. Ramasubramaniam Two-dimensional material nanophotonics Nat. Photonics. 8 2014 899 907 10.1038/nphoton.2014.271 F.N. Xia, H. Wang, D. Xiao, M. Dubey, A. Ramasubramaniam, Two-dimensional material nanophotonics, Nat. Photonics. 8 (2014) 899–907, https://doi.org/10.1038/nphoton.2014.271. [11] Q.Q. Jiang L. Xu N. Chen H. Zhang L.M. Dai S.Y. Wang Facile synthesis of black phosphorus: an efficient electrocatalyst for the oxygen evolving reaction Angew. Chem. 128 2016 14053 14057 10.1002/anie.201607393 Q.Q. Jiang, L. Xu, N. Chen, H. Zhang, L.M. Dai, S.Y. Wang, Facile synthesis of black phosphorus: an efficient electrocatalyst for the oxygen evolving reaction, Angew. Chem. 128 (2016) 14053–14057, https://doi.org/10.1002/anie.201607393. [12] F.N. Xia H. Wang Y.C. Jia Rediscovering black phosphorus as an anisotropic layered material for optoelectronics and electronics Nat. Commun. 5 2014 4458 10.1038/ncomms5458 F.N. Xia, H. Wang, Y.C. Jia, Rediscovering black phosphorus as an anisotropic layered material for optoelectronics and electronics, Nat. Commun. 5 (2014) 4458, https://doi.org/10.1038/ncomms5458. [13] M. Batmunkh A. Shrestha M. Bat Erdene M.J. Nine C.J. Shearer C.T. Gibson A.D. Slattery S.A. Tawfik M.J. Ford S. Dai Electrocatalytic activity of a 2D phosphorene-based heteroelectrocatalyst for photoelectrochemical cells Angew. Chem. Int. Ed. 57 2018 2644 2647 10.1002/ange.201712280 M. Batmunkh, A. Shrestha, M. Bat Erdene, M.J. Nine, C.J. Shearer, C.T. Gibson, A.D. Slattery, S.A. Tawfik, M.J. Ford, S. Dai, Electrocatalytic activity of a 2D phosphorene-based heteroelectrocatalyst for photoelectrochemical cells, Angew. Chem. Int. Ed. 57 (2018) 2644–2647, https://doi.org/10.1002/ange.201712280. [14] Z.K. Yuan J. Li M.J. Yang Z.S. Fang J.H. Jian D.S. Yu X.D. Chen L.M. Dai Ultrathin black phosphorus-on-nitrogen doped graphene for efficient overall water splitting: dual modulation roles of directional interfacial charge transfer J. Am. Chem. Soc. 141 2019 4972 4979 10.1021/jacs.9b00154 Z.K. Yuan, J. Li, M.J. Yang, Z.S. Fang, J.H. Jian, D.S. Yu, X.D. Chen, L.M. Dai, Ultrathin black phosphorus-on-nitrogen doped graphene for efficient overall water splitting: dual modulation roles of directional interfacial charge transfer, J. Am. Chem. Soc. 141 (2019) 4972–4979, https://doi.org/10.1021/jacs.9b00154. [15] M. Zhao R. Zhang Z.M. Fu H. Xiao M. Bai L. Zhang J.M. Zhang J.F. Jia N.J. Yang Revealing operando reconstruction effect of Ni–Co dual-cation in black phosphorus for promoting oxygen evolution reaction Int. J. Hydrogen Energy. 53 2024 263 272 10.1016/j.ijhydene.2023.12.084 M. Zhao, R. Zhang, Z.M. Fu, H. Xiao, M. Bai, L. Zhang, J.M. Zhang, J.F. Jia, N.J. Yang, Revealing operando reconstruction effect of Ni–Co dual-cation in black phosphorus for promoting oxygen evolution reaction, Int. J. Hydrogen Energy. 53 (2024) 263–272, https://doi.org/10.1016/j.ijhydene.2023.12.084. [16] M. Zhao X.R. Cheng H. Xiao J.R. Gao S.F. Xue X.X. Wang H.S. Wu J.F. Jia N.J. Yang Cobalt-iron oxide/black phosphorus nanosheet heterostructure: electrosynthesis and performance of (photo-)electrocatalytic oxygen evolution Nano Res 16 2023 6057 6066 10.1007/s12274-022-4676-9 M. Zhao, X.R. Cheng, H. Xiao, J.R. Gao, S.F. Xue, X.X. Wang, H.S. Wu, J.F. Jia, N.J. Yang, Cobalt-iron oxide/black phosphorus nanosheet heterostructure: electrosynthesis and performance of (photo-)electrocatalytic oxygen evolution, Nano Res 16 (2023) 6057–6066, doi:10.1007/s12274-022-4676-9. [17] H. Xiao R. Zhang M. Zhao X.M. Yang Y.Y. Jing L. Zhang H.S. Wu J.F. Jia 2D/1D heterostructure of carbon nanotubes wrapping black phosphorus nanosheets with superior electrophilic property for improving oxygen evolution reaction Int. J. Hydrogen Energy. 48 2023 18685 18695 10.1016/j.ijhydene.2023.01.373 H. Xiao, R. Zhang, M. Zhao, X.M. Yang, Y.Y. Jing, L. Zhang, H.S. Wu, J.F. Jia, 2D/1D heterostructure of carbon nanotubes wrapping black phosphorus nanosheets with superior electrophilic property for improving oxygen evolution reaction, Int. J. Hydrogen Energy. 48 (2023) 18685–18695, https://doi.org/10.1016/j.ijhydene.2023.01.373. [18] H. Xiao S.F. Xue Z.M. Fu M. Zhao L. Zhang J.M. Zhang H.S. Wu J.F. Jia N.J. Yang Revealing component synergy of Ni–Fe/black phosphorous composites synthesized by self-designed electrochemical method for enhancing photoelectrocatalytic oxygen evolution reaction Front Mater Sci 17 2023 10.1007/s11706-023-0646-8 H. Xiao, S.F. Xue, Z.M. Fu, M. Zhao, L. Zhang, J.M. Zhang, H.S. Wu, J.F. Jia, N.J. Yang, Revealing component synergy of Ni–Fe/black phosphorous composites synthesized by self-designed electrochemical method for enhancing photoelectrocatalytic oxygen evolution reaction, Front Mater Sci. 17 (2023), https://doi.org/10.1007/s11706-023-0646-8. [19] H. Xiao X.L. Du M. Zhao Y. Li T.J. Hu H.S. Wu J.F. Jia N.J. Yang Structural dependence of electrosynthesized cobalt phosphide/black phosphorus pre-catalyst for oxygen evolution in alkaline media Nanoscale 13 2021 7381 7388 10.1039/d1nr00062d H. Xiao, X.L. Du, M. Zhao, Y. Li, T.J. Hu, H.S. Wu, J.F. Jia, N.J. Yang, Structural dependence of electrosynthesized cobalt phosphide/black phosphorus pre-catalyst for oxygen evolution in alkaline media, Nanoscale. 13 (2021) 7381–7388, https://doi.org/10.1039/d1nr00062d. [20] Q. Zhang J. Weng J. Xu Palladium phosphide/black phosphorus heterostructures with enhanced ethanol oxidation activity and stability J. Phys. Chem. C 125 2021 18717 18724 Q. Zhang, J. Weng, J. Xu, Palladium phosphide/black phosphorus heterostructures with enhanced ethanol oxidation activity and stability, J. Phys. Chem. C. 125 (2021) 18717–18724. [21] P. Liu J.A. Rodriguez Catalysts for hydrogen evolution from the [NiFe] hydrogenase to the Ni2P(001) surface: the importance of ensemble effect J. Am. Chem. Soc. 127 2005 14871 14878 10.1021/ja0540019 P. Liu, J.A. Rodriguez, Catalysts for hydrogen evolution from the [NiFe] hydrogenase to the Ni2P(001) surface: the importance of ensemble effect, J. Am. Chem. Soc. 127 (2005) 14871–14878, https://doi.org/10.1021/ja0540019. [22] S.S. Li L. Wang H. Su A.N. Hong Y.X. Wang H.j. Yang L. Ge W.Y. Song J. Liu T.Y. Ma Electron redistributed S-doped nickel iron phosphides derived from one-step phosphatization of MOFs for significantly boosting electrochemical water splitting Adv. Funct. Mater. 2022 32 10.1002/adfm.202200733 S.S. Li, L. Wang, H. Su, A.N. Hong, Y.X. Wang, H.j. Yang, L. Ge, W.Y. Song, J. Liu, T.Y. Ma, Electron redistributed S-doped nickel iron phosphides derived from one-step phosphatization of MOFs for significantly boosting electrochemical water splitting, Adv. Funct. Mater. (2022) 32, https://doi.org/10.1002/adfm.202200733. [23] Y. Pan K. Sun Y. Lin X. Cao Y.S. Cheng S.J. Liu L.Y. Zeng W.C. Cheong D. Zhao K.L. Wu Z. Liu Y.Q. Liu D.S. Wang Q. Peng C. Chen Y.D. Li Electronic structure and D-band center control engineering over M-doped CoP (M = Ni, Mn, Fe) hollow polyhedron frames for boosting hydrogen production Nano Energy 56 2019 411 419 10.1016/j.nanoen.2018.11.034 Y. Pan, K. Sun, Y. Lin, X. Cao, Y.S. Cheng, S.J. Liu, L.Y. Zeng, W.C. Cheong, D. Zhao, K.L. Wu, Z. Liu, Y.Q. Liu, D.S. Wang, Q. Peng, C. Chen, Y.D. Li, Electronic structure and D-band center control engineering over M-doped CoP (M = Ni, Mn, Fe) hollow polyhedron frames for boosting hydrogen production, Nano Energy. 56 (2019) 411–419, https://doi.org/10.1016/j.nanoen.2018.11.034. [24] A. Kraytsberg Y.Ein Eli Review of advanced materials for proton exchange membrane fuel cells Energy Fuel 28 2014 7303 7330 10.1021/ef501977k A. Kraytsberg, Y.Ein Eli, Review of advanced materials for proton exchange membrane fuel cells, Energy Fuel. 28 (2014) 7303–7330, https://doi.org/10.1021/ef501977k. [25] Y. Wang K.S. Chen J. Mishler S.C. Cho X.C. Adroher A review of polymer electrolyte membrane fuel cells: technology, applications, and needs on fundamental research Appl. Energ 88 2011 981 1007 10.1016/j.apenergy.2010.09.030 Y. Wang, K.S. Chen, J. Mishler, S.C. Cho, X.C. Adroher, A review of polymer electrolyte membrane fuel cells: technology, applications, and needs on fundamental research, Appl. Energ. 88 (2011) 981–1007, https://doi.org/10.1016/j.apenergy.2010.09.030. [26] B.C. Steele A. Heinzel Materials for fuel-cell technologies Nature 414 2001 345 352 10.1038/35104620 B.C. Steele, A. Heinzel, Materials for fuel-cell technologies, Nature. 414 (2001) 345–352, https://doi.org/10.1038/35104620. [27] J. Huang Y. Zhang W. Wu C. Wu FeOx/FeP hybrid nanorods nanorods neutra hydrogen evolution electrocatalysis: insight into interface J. Mater. Chem. A. 6 2018 9467 9472 10.1039/C8TA02204F J. Huang, Y. Zhang, W. Wu, C. Wu, FeOx/FeP hybrid nanorods nanorods neutra hydrogen evolution electrocatalysis: insight into interface, J. Mater. Chem. A. 6 (2018) 9467–9472, https://doi.org/10.1039/C8TA02204F. [28] L. Chen L.L. Lu H.L. Zhu Y.G. Chen Y. Huang Y.D. Li L.Y. Wang Improved ethanol electrooxidation performance by shortening Pd–Ni active site distance in Pd–Ni–P nanocatalysts Nat. Commun. 8 2017 14136 10.1038/ncomms14136 L. Chen, L.L. Lu, H.L. Zhu, Y.G. Chen, Y. Huang, Y.D. Li, L.Y. Wang, Improved ethanol electrooxidation performance by shortening Pd–Ni active site distance in Pd–Ni–P nanocatalysts, Nat. Commun. 8 (2017) 14136, https://doi.org/10.1038/ncomms14136. [29] Z.S. Luo J.M. Lu C. Flox R. Nafria A. Genç J. Arbiol J. Llorca M. Ibáñez J.R. Morante A. Cabot Pd2Sn[010]nanorods as a highly active and stable ethanol oxidation catalyst J. Mater. Chem. A. 4 2016 16706 16713 10.1039/c6ta06430b Z.S. Luo, J.M. Lu, C. Flox, R. Nafria, A. Genç, J. Arbiol, J. Llorca, M. Ibáñez, J.R. Morante, A. Cabot, Pd2Sn[010]nanorods as a highly active and stable ethanol oxidation catalyst, J. Mater. Chem. A. 4 (2016) 16706–16713, https://doi.org/10.1039/c6ta06430b. [30] E.A. Monyoncho S. Ntais N. Brazeau J. Wu C. Sun E.A. Baranova Role of the metal-oxide support in the catalytic activity of Pd nanoparticles for ethanol electrooxidation in alkaline media ChemElectroChem 3 2016 218 227 10.1002/celc.201500432 E.A. Monyoncho, S. Ntais, N. Brazeau, J. Wu, C. Sun, E.A. Baranova, Role of the metal-oxide support in the catalytic activity of Pd nanoparticles for ethanol electrooxidation in alkaline media, ChemElectroChem. 3 (2016) 218–227, https://doi.org/10.1002/celc.201500432. [31] H.L. Yan X. Xiao C.Y. Hu X.H. Liu Y. Song Construction of wool-shaped heterostructure structure CoNi/NF-P electrocatalyst for efficient hydrogen evolution reaction Mol. Catal. 547 2023 113327 10.1016/j.mcat.2023.113327 H.L. Yan, X. Xiao, C.Y. Hu, X.H. Liu, Y. Song, Construction of wool-shaped heterostructure structure CoNi/NF-P electrocatalyst for efficient hydrogen evolution reaction, Mol. Catal. 547 (2023) 113327, https://doi.org/10.1016/j.mcat.2023.113327. [32] Y.L. Chen X.W. Wang W.X. He C. Yu X.J. Dang Z.Y. Zheng Y.F. Zhang Fe and Cr doped porous Co3O4@C nanosheets with abundant oxygen vacancies for highly efficient oxygen evolution reaction Mol. Catal. 548 2023 113410 10.1016/j.mcat.2023.113410 Y.L. Chen, X.W. Wang, W.X. He, C. Yu, X.J. Dang, Z.Y. Zheng, Y.F. Zhang, Fe and Cr doped porous Co3O4@C nanosheets with abundant oxygen vacancies for highly efficient oxygen evolution reaction, Mol. Catal. 548 (2023) 113410, https://doi.org/10.1016/j.mcat.2023.113410. [33] H.O. Churchill P.Jarillo Herrero Two-dimensional crystals: phosphorus joins the family Nat. Nanotechnol. 9 2014 330 331 10.1038/nnano.2014.85 H.O. Churchill, P.Jarillo Herrero, Two-dimensional crystals: phosphorus joins the family, Nat. Nanotechnol. 9 (2014) 330–331, https://doi.org/10.1038/nnano.2014.85. [34] S. Das W. Zhang M. Demarteau A. Hoffmann M. Dubey A. Roelofs Tunable transport gap in phosphorene Nano Lett 14 2014 5733 5739 10.1021/nl5025535 S. Das, W. Zhang, M. Demarteau, A. Hoffmann, M. Dubey, A. Roelofs, Tunable transport gap in phosphorene, Nano Lett. 14 (2014) 5733–5739, https://doi.org/10.1021/nl5025535. [35] L.k. Li Y.J. Yu G.J. Ye Q.Q. Ge X.D. Ou H. Wu D.L. Feng X.H. Chen Y.B. Zhang Black phosphorus field-effect transistors Nat. Nanotechnol. 9 2014 372 377 10.1038/nnano.2014.35 L.k. Li, Y.J. Yu, G.J. Ye, Q.Q. Ge, X.D. Ou, H. Wu, D.L. Feng, X.H. Chen, Y.B. Zhang, Black phosphorus field-effect transistors, Nat. Nanotechnol. 9 (2014) 372–377, https://doi.org/10.1038/nnano.2014.35. [36] V. Tran R. Soklaski Y. Liang L. Yang Layer-controlled band gap and anisotropic excitons in few-layer black phosphorus Phys. Rev. B. 89 2014 235319 10.1103/PhysRevB.89.235319 V. Tran, R. Soklaski, Y. Liang, L. Yang, Layer-controlled band gap and anisotropic excitons in few-layer black phosphorus, Phys. Rev. B. 89 (2014) 235319, https://doi.org/10.1103/PhysRevB.89.235319. [37] L. Viti J. Hu D. Coquillat W. Knap A. Tredicucci A. Politano M.S. Vitiello Black phosphorus terahertz photodetectors Adv. Mater. 27 2015 5567 5572 10.1002/adma.201502052 L. Viti, J. Hu, D. Coquillat, W. Knap, A. Tredicucci, A. Politano, M.S. Vitiello, Black phosphorus terahertz photodetectors, Adv. Mater. 27 (2015) 5567–5572, https://doi.org/10.1002/adma.201502052. [38] H.T. Yuan X.G. Liu F. Afshinmanesh W. Li G. Xu J. Sun B. Lian A.G. Curto G.J. Ye Y. Hikita Polarization-sensitive broadband photodetector using a black phosphorus vertical p–n junction Nat. Nanotechnol. 10 2015 707 713 10.1038/nnano.2015.112 H.T. Yuan, X.G. Liu, F. Afshinmanesh, W. Li, G. Xu, J. Sun, B. Lian, A.G. Curto, G.J. Ye, Y. Hikita, Polarization-sensitive broadband photodetector using a black phosphorus vertical p–n junction, Nat. Nanotechnol. 10 (2015) 707–713, https://doi.org/10.1038/nnano.2015.112. [39] T. Wu J.C. Fan Q.X. Li P.H. Shi Q.J. Xu Y.L. Min Palladium nanoparticles anchored on anatase titanium dioxide-black phosphorus hybrids with heterointerfaces: highly electroactive and durable catalysts for ethanol electrooxidation Adv. Energy Mater. 8 2018 1701799 10.1002/aenm.201701799 T. Wu, J.C. Fan, Q.X. Li, P.H. Shi, Q.J. Xu, Y.L. Min, Palladium nanoparticles anchored on anatase titanium dioxide-black phosphorus hybrids with heterointerfaces: highly electroactive and durable catalysts for ethanol electrooxidation, Adv. Energy Mater. 8 (2018) 1701799, https://doi.org/10.1002/aenm.201701799. [40] T. Wu Y. Ma Z.B. Qu J.C. Fan Q.X. Li P.H. Shi Q.J. Xu Y.L. Min Black phosphorus–graphene heterostructure-supported Pd nanoparticles with superior activity and stability for ethanol electro-oxidation ACS Appl. Mater. Inter. 11 2019 5136 5145 10.1021/acsami.8b20240 T. Wu, Y. Ma, Z.B. Qu, J.C. Fan, Q.X. Li, P.H. Shi, Q.J. Xu, Y.L. Min, Black phosphorus–graphene heterostructure-supported Pd nanoparticles with superior activity and stability for ethanol electro-oxidation, ACS Appl. Mater. Inter. 11 (2019) 5136–5145, https://doi.org/10.1021/acsami.8b20240. [41] M. Vanni M. Serrano Ruiz F. Telesio S. Heun M. Peruzzini Black Phosphorus/Palladium Nanohybrid: unraveling the Nature of P-Pd Interaction and Application in Selective Hydrogenation Chem. Mater. 31 2019 10.1021/acs.chemmater.9b00851 M. Vanni, M. Serrano Ruiz, F. Telesio, S. Heun, M. Peruzzini, Black Phosphorus/Palladium Nanohybrid: unraveling the Nature of P-Pd Interaction and Application in Selective Hydrogenation, Chem. Mater. 31 (2019), https://doi.org/10.1021/acs.chemmater.9b00851. [42] H.M. Chen X.Y. Luo S.P. Huang F. Yu D. Li Y. Chen Phosphorus-doped activated carbon as a platinum-based catalyst support for electrocatalytic hydrogen evolution reaction J. Electroanaly Chem. 948 2023 117820 10.1016/j.jelechem.2023.117820 H.M. Chen, X.Y. Luo, S.P. Huang, F. Yu, D. Li, Y. Chen, Phosphorus-doped activated carbon as a platinum-based catalyst support for electrocatalytic hydrogen evolution reaction, J. Electroanaly Chem. 948 (2023) 117820, https://doi.org/10.1016/j.jelechem.2023.117820. [43] Z.Z. Zhu H.Y. Zhang W. Guo H. Zhou Y.L. Zhou W.J. Liang M.S. He W.X. Wei T.T. Yu H. Zhao T. Yang Mo, V and M (M=Mn, Fe, Co, Cu) Co-modulated Ni oxides in-situ derived from nickel foam as efficient electrocatalysts for alkaline hydrogen evolution and oxygen evolution Mol. Catal. 542 2023 113132 10.1016/j.mcat.2023.113132 Z.Z. Zhu, H.Y. Zhang, W. Guo, H. Zhou, Y.L. Zhou, W.J. Liang, M.S. He, W.X. Wei, T.T. Yu, H. Zhao, T. Yang, Mo, V and M (M=Mn, Fe, Co, Cu) Co-modulated Ni oxides in-situ derived from nickel foam as efficient electrocatalysts for alkaline hydrogen evolution and oxygen evolution, Mol. Catal. 542 (2023) 113132, https://doi.org/10.1016/j.mcat.2023.113132. [44] R. Khosa E. Pervaiz U. Abdullah M. Ali U. Sohail A. Shakoor An insight on molybdenum phosphide and its hybrids as catalyst for electrochemical water splitting: a mini-review Mol. Catal. 528 2022 112514 10.1016/j.mcat.2022.112514 R. Khosa, E. Pervaiz, U. Abdullah, M. Ali, U. Sohail, A. Shakoor, An insight on molybdenum phosphide and its hybrids as catalyst for electrochemical water splitting: a mini-review, Mol. Catal. 528 (2022) 112514, https://doi.org/10.1016/j.mcat.2022.112514. [45] J. Joo T. Kim J. Lee S.I. Choi K. Lee Morphology-controlled metal sulfides and phosphides for electrochemical water splitting Adv. Mater. 31 2019 1806682 10.1002/adma.201806682 J. Joo, T. Kim, J. Lee, S.I. Choi, K. Lee, Morphology-controlled metal sulfides and phosphides for electrochemical water splitting, Adv. Mater. 31 (2019) 1806682, https://doi.org/10.1002/adma.201806682. [46] C. Huang T. Ouyang Y. Zou N. Li Z.Q. Liu Ultrathin NiCo2Px nanosheets strongly coupled with CNTs as efficient and robust electrocatalysts for overall water splitting J. Mater. Chem. A. 6 2018 7420 7427 10.1039/c7ta11364a C. Huang, T. Ouyang, Y. Zou, N. Li, Z.Q. Liu, Ultrathin NiCo2Px nanosheets strongly coupled with CNTs as efficient and robust electrocatalysts for overall water splitting, J. Mater. Chem. A. 6 (2018) 7420–7427, https://doi.org/10.1039/c7ta11364a. [47] J.H. Lin H.H. Wang Y.T. Yan J. Cao C.Q. Qu X.H. Zheng J.C. Feng J.L. Qi Sandwich-like structured NiSe2/Ni2P@ FeP interface nanosheets with rich defects for efficient electrocatalytic water splitting J. Power Sources. 445 2020 227294 10.1016/j.jpowsour.2019.227294 J.H. Lin, H.H. Wang, Y.T. Yan, J. Cao, C.Q. Qu, X.H. Zheng, J.C. Feng, J.L. Qi, Sandwich-like structured NiSe2/Ni2P@ FeP interface nanosheets with rich defects for efficient electrocatalytic water splitting, J. Power Sources. 445 (2020) 227294, https://doi.org/10.1016/j.jpowsour.2019.227294. [48] J.D. Wu D.P. Wang S. Wan H.L. Liu C. Wang X. Wang An efficient cobalt phosphide electrocatalyst derived from cobalt phosphonate complex for all-pH hydrogen evolution reaction and overall water splitting in alkaline solution Small 16 2020 1900550 10.1002/smll.201900550 J.D. Wu, D.P. Wang, S. Wan, H.L. Liu, C. Wang, X. Wang, An efficient cobalt phosphide electrocatalyst derived from cobalt phosphonate complex for all-pH hydrogen evolution reaction and overall water splitting in alkaline solution, Small. 16 (2020) 1900550, https://doi.org/10.1002/smll.201900550. [49] L.J. Yang L. Zhang N-enriched porous carbon encapsulated bimetallic phosphides with hierarchical structure derived from controlled electrodepositing multilayer ZIFs for electrochemical overall water splitting Appl. Catal. B Environ. 259 2019 118053 10.1016/j.apcatb.2019.118053 L.J. Yang, L. Zhang, N-enriched porous carbon encapsulated bimetallic phosphides with hierarchical structure derived from controlled electrodepositing multilayer ZIFs for electrochemical overall water splitting, Appl. Catal. B Environ. 259 (2019) 118053, https://doi.org/10.1016/j.apcatb.2019.118053. [50] Y. Pei Y.C. Ge H. Chu W. Smith P. Dong P.M. Ajayan M.X. Ye J.F. Shen Controlled synthesis of 3D porous structured cobalt-iron based nanosheets by electrodeposition as asymmetric electrodes for ultra-efficient water splitting Appl. Catal. B Environ. 244 2019 583 593 10.1016/j.apcatb.2018.11.091 Y. Pei, Y.C. Ge, H. Chu, W. Smith, P. Dong, P.M. Ajayan, M.X. Ye, J.F. Shen, Controlled synthesis of 3D porous structured cobalt-iron based nanosheets by electrodeposition as asymmetric electrodes for ultra-efficient water splitting, Appl. Catal. B Environ. 244 (2019) 583–593, https://doi.org/10.1016/j.apcatb.2018.11.091. [51] J. Wang F. Ciucci In-situ synthesis of bimetallic phosphide with carbon tubes as an active electrocatalyst for oxygen evolution reaction Appl. Catal. B Environ. 254 2019 292 299 10.1016/j.apcatb.2019.05.009 J. Wang, F. Ciucci, In-situ synthesis of bimetallic phosphide with carbon tubes as an active electrocatalyst for oxygen evolution reaction, Appl. Catal. B Environ. 254 (2019) 292–299, https://doi.org/10.1016/j.apcatb.2019.05.009. [52] C. Huang Y. Zou Y.Q. Ye T. Ouyang K. Xiao Z.Q. Liu Unveiling the active sites of Ni–Fe phosphide/metaphosphate for efficient oxygen evolution under alkaline conditions Chem. Commun. 55 2019 7687 7690 10.1039/c9cc03024g C. Huang, Y. Zou, Y.Q. Ye, T. Ouyang, K. Xiao, Z.Q. Liu, Unveiling the active sites of Ni–Fe phosphide/metaphosphate for efficient oxygen evolution under alkaline conditions, Chem. Commun. 55 (2019) 7687–7690, https://doi.org/10.1039/c9cc03024g. [53] J.X. Chen Q.W. Long K. Xiao T. Ouyang N. Li S.Y. Ye Z.Q. Liu Vertically-interlaced NiFeP/MXene electrocatalyst with tunable electronic structure for high-efficiency oxygen evolution reaction Sci. Bull. 66 2021 1063 1072 10.1016/j.scib.2021.02.033 J.X. Chen, Q.W. Long, K. Xiao, T. Ouyang, N. Li, S.Y. Ye, Z.Q. Liu, Vertically-interlaced NiFeP/MXene electrocatalyst with tunable electronic structure for high-efficiency oxygen evolution reaction, Sci. Bull. 66 (2021) 1063–1072, https://doi.org/10.1016/j.scib.2021.02.033. [54] J.H. Xing H. Li M.M.C. Cheng S.M. Geyer K.S. Ng Electro-synthesis of 3D porous hierarchical Ni–Fe phosphate film/Ni foam as a high-efficiency bifunctional electrocatalyst for overall water splitting J. Mater. Chem. A. 4 2016 13866 13873 10.1039/C6TA05952J J.H. Xing, H. Li, M.M.C. Cheng, S.M. Geyer, K.S. Ng, Electro-synthesis of 3D porous hierarchical Ni–Fe phosphate film/Ni foam as a high-efficiency bifunctional electrocatalyst for overall water splitting, J. Mater. Chem. A. 4 (2016) 13866–13873, https://doi.org/10.1039/C6TA05952J. [55] B.Y. Guan L. Yu X.W. Lou General synthesis of multishell mixed-metal oxyphosphide particles with enhanced electrocatalytic activity in the oxygen evolution reaction Angew. Chem. Int. Ed. 56 2017 2386 2389 10.1002/anie.201611804 B.Y. Guan, L. Yu, X.W. Lou, General synthesis of multishell mixed-metal oxyphosphide particles with enhanced electrocatalytic activity in the oxygen evolution reaction, Angew. Chem. Int. Ed. 56 (2017) 2386–2389, https://doi.org/10.1002/anie.201611804. [56] H.B. Zhang W. Zhou J.C. Dong X.F. Lu X.W.D. Lou Intramolecular electronic coupling in porous iron cobalt (oxy) phosphide nanoboxes enhances the electrocatalytic activity for oxygen evolution Energy Environ. Sci. 12 2019 3348 3355 10.1039/c9ee02787d H.B. Zhang, W. Zhou, J.C. Dong, X.F. Lu, X.W.D. Lou, Intramolecular electronic coupling in porous iron cobalt (oxy) phosphide nanoboxes enhances the electrocatalytic activity for oxygen evolution, Energy Environ. Sci. 12 (2019) 3348–3355, https://doi.org/10.1039/c9ee02787d. [57] Z.Y. Yu C.C. Lang M.R. Gao Y. Chen Q.Q. Fu Y. Duan S.H. Yu Catalysts for efficient alkaline water-to-hydrogen conversion via urea electrolysis Energy Environ. Sci. 11 2018 1890 1897 Z.Y. Yu, C.C. Lang, M.R. Gao, Y. Chen, Q.Q. Fu, Y. Duan, S.H. Yu, Catalysts for efficient alkaline water-to-hydrogen conversion via urea electrolysis, Energy Environ. Sci. 11 (2018) 1890–1897. [58] X.J. Xu T. Guo J.Y. Xia B.L. Zhao G. Su H.L. Wang M.H. Huang A. Toghan Modulation of the crystalline/amorphous interface engineering on Ni-PO-based catalysts for boosting urea electrolysis at large current densities Chem. Eng. J. 425 2021 130514 10.1016/j.cej.2021.130514 X.J. Xu, T. Guo, J.Y. Xia, B.L. Zhao, G. Su, H.L. Wang, M.H. Huang, A. Toghan, Modulation of the crystalline/amorphous interface engineering on Ni-PO-based catalysts for boosting urea electrolysis at large current densities, Chem. Eng. J. 425 (2021) 130514, https://doi.org/10.1016/j.cej.2021.130514. [59] A. Kumar X.H. Liu J.S. Lee B. Debnath A.R. Jadhav X.D. Shao V.Q. Bui Y. Hwang Y. Liu M.G. Kim Discovering ultrahigh loading of single-metal-atoms via surface tensile-strain for unprecedented urea electrolysis Energy Environ. Sci. 14 2021 6494 6505 10.1039/d1ee02603h A. Kumar, X.H. Liu, J.S. Lee, B. Debnath, A.R. Jadhav, X.D. Shao, V.Q. Bui, Y. Hwang, Y. Liu, M.G. Kim, Discovering ultrahigh loading of single-metal-atoms via surface tensile-strain for unprecedented urea electrolysis, Energy Environ. Sci. 14 (2021) 6494–6505, https://doi.org/10.1039/d1ee02603h. [60] G.M. Wang Y.C. Ling X.H. Lu H.Y. Wang F. Qian Y.X. Tong Y. Li Solar driven hydrogen releasing from urea and human urine Energy Environ. Sci. 5 2012 8215 8219 10.1039/C2EE22087C G.M. Wang, Y.C. Ling, X.H. Lu, H.Y. Wang, F. Qian, Y.X. Tong, Y. Li, Solar driven hydrogen releasing from urea and human urine, Energy Environ. Sci. 5 (2012) 8215–8219, https://doi.org/10.1039/C2EE22087C. [61] X.J. Xu P.Y. Du T. Guo B.L. Zhao H.L. Wang M.H. Huang In situ grown Ni phosphate@ Ni12P5 nanorod arrays as a unique core–shell architecture: competitive bifunctional electrocatalysts for urea electrolysis at large current densities ACS Sustain. Chem. Eng. 8 2020 7463 7471 10.1021/acssuschemeng.0c01814 X.J. Xu, P.Y. Du, T. Guo, B.L. Zhao, H.L. Wang, M.H. Huang, In situ grown Ni phosphate@ Ni12P5 nanorod arrays as a unique core–shell architecture: competitive bifunctional electrocatalysts for urea electrolysis at large current densities, ACS Sustain. Chem. Eng. 8 (2020) 7463–7471, https://doi.org/10.1021/acssuschemeng.0c01814. [62] Y. Huang S.L. Zhang X.F. Lu Z.P. Wu D.Y. Luan X.W. Lou Trimetallic spinel NiCo2− xFexO4 nanoboxes for highly efficient electrocatalytic oxygen evolution Angew. Chem. 133 2021 11947 11952 10.1002/anie.202103058 Y. Huang, S.L. Zhang, X.F. Lu, Z.P. Wu, D.Y. Luan, X.W. Lou, Trimetallic spinel NiCo2− xFexO4 nanoboxes for highly efficient electrocatalytic oxygen evolution, Angew. Chem. 133 (2021) 11947–11952, https://doi.org/10.1002/anie.202103058. [63] T. Ouyang Y.Q. Ye C. Wu K. Xiao Z. Liu Heterostructures composed of N-doped carbon nanotubes encapsulating cobalt and β-Mo2C nanoparticles as bifunctional electrodes for water splitting Angew. Chem. Int. Ed. 58 2019 4923 4928 10.1002/anie.201814262 T. Ouyang, Y.Q. Ye, C. Wu, K. Xiao, Z. Liu, Heterostructures composed of N-doped carbon nanotubes encapsulating cobalt and β-Mo2C nanoparticles as bifunctional electrodes for water splitting, Angew. Chem. Int. Ed. 58 (2019) 4923–4928, https://doi.org/10.1002/anie.201814262. [64] C.F. Li J.W. Zhao L.J. Xie J.Q. Wu G.R. Li Fe doping and oxygen vacancy modulated Fe-Ni5P4/NiFeOH nanosheets as bifunctional electrocatalysts for efficient overall water splitting Appl. Catal. B Environ. 291 2021 119987 10.1016/j.apcatb.2021.119987 C.F. Li, J.W. Zhao, L.J. Xie, J.Q. Wu, G.R. Li, Fe doping and oxygen vacancy modulated Fe-Ni5P4/NiFeOH nanosheets as bifunctional electrocatalysts for efficient overall water splitting, Appl. Catal. B Environ. 291 (2021) 119987, https://doi.org/10.1016/j.apcatb.2021.119987. [65] F.Y. Zhu J.Y. Xue L.J. Zeng J.R. Shang S.L. Lu X.Q. Cao B.F. Abrahams H.W. Gu J.P. Lang One-pot pyrolysis synthesis of highly active Ru/RuOX nanoclusters for water splitting Nano Res 15 2022 1020 1026 10.1007/s12274-021-3590-x F.Y. Zhu, J.Y. Xue, L.J. Zeng, J.R. Shang, S.L. Lu, X.Q. Cao, B.F. Abrahams, H.W. Gu, J.P. Lang, One-pot pyrolysis synthesis of highly active Ru/RuOX nanoclusters for water splitting, Nano Res. 15 (2022) 1020–1026, https://doi.org/10.1007/s12274-021-3590-x. [66] B.J. Zhu Z.B. Liang R.Q. Zou Designing advanced catalysts for energy conversion based on urea oxidation reaction Small 16 2020 1906133 10.1002/smll.201906133 B.J. Zhu, Z.B. Liang, R.Q. Zou, Designing advanced catalysts for energy conversion based on urea oxidation reaction, Small. 16 (2020) 1906133, https://doi.org/10.1002/smll.201906133. [67] Y.Q. Feng X. Wang J.F. Huang P.P. Dong J. Ji J. Li L.Y. Cao L.L. Feng P. Jin C.R. Wang Decorating CoNi layered double hydroxides nanosheet arrays with fullerene quantum dot anchored on Ni foam for efficient electrocatalytic water splitting and urea electrolysis Chem. Eng. J. 390 2020 124525 10.1016/j.cej.2020.124525 Y.Q. Feng, X. Wang, J.F. Huang, P.P. Dong, J. Ji, J. Li, L.Y. Cao, L.L. Feng, P. Jin, C.R. Wang, Decorating CoNi layered double hydroxides nanosheet arrays with fullerene quantum dot anchored on Ni foam for efficient electrocatalytic water splitting and urea electrolysis, Chem. Eng. J. 390 (2020) 124525, https://doi.org/10.1016/j.cej.2020.124525. [68] H. Jiang M.Z. Sun S.L. Wu B.L. Huang C.S. Lee W.J. Zhang Oxygen-incorporated NiMoP nanotube arrays as efficient bifunctional electrocatalysts for urea-assisted energy-saving hydrogen production in alkaline electrolyte Adv. Funct. Mater. 31 2021 2104951 10.1002/adfm.202104951 H. Jiang, M.Z. Sun, S.L. Wu, B.L. Huang, C.S. Lee, W.J. Zhang, Oxygen-incorporated NiMoP nanotube arrays as efficient bifunctional electrocatalysts for urea-assisted energy-saving hydrogen production in alkaline electrolyte, Adv. Funct. Mater. 31 (2021) 2104951, https://doi.org/10.1002/adfm.202104951. [69] X. Tao H. Xu S. Luo Y.Q. Wu C.H. Tian X.H. Lu Y. Qing Construction of N-doped carbon nanotube encapsulated active nanoparticles in hierarchically porous carbonized wood frameworks to boost the oxygen evolution reaction Appl. Catal. B Environ. 279 2020 119367 10.1016/j.apcatb.2020.119367 X. Tao, H. Xu, S. Luo, Y.Q. Wu, C.H. Tian, X.H. Lu, Y. Qing, Construction of N-doped carbon nanotube encapsulated active nanoparticles in hierarchically porous carbonized wood frameworks to boost the oxygen evolution reaction, Appl. Catal. B Environ. 279 (2020) 119367, https://doi.org/10.1016/j.apcatb.2020.119367. [70] J.F. Kang F. Yang C. Sheng H. Xu J.Y. Wang Y. Qing Y.Q. Wu X.H. Lu CoP nanoparticle confined in P, N Co-doped porous carbon anchored on P-doped carbonized wood fibers with tailored electronic structure for efficient urea electro-oxidation Small 18 2022 2200950 10.1002/smll.202200950 J.F. Kang, F. Yang, C. Sheng, H. Xu, J.Y. Wang, Y. Qing, Y.Q. Wu, X.H. Lu, CoP nanoparticle confined in P, N Co-doped porous carbon anchored on P-doped carbonized wood fibers with tailored electronic structure for efficient urea electro-oxidation, Small. 18 (2022) 2200950, https://doi.org/10.1002/smll.202200950. [71] M.J. Zhang D.D. Qi Y. Xin X.M. Hu T. Cao Y.C. Jin K. Wang Z. Zhou L. Yang J.Z. Jiang D.P. Zhang Highly efficient bifunctional catalyst with 2D MoN formed in situ synergy for OER and ORR based-on Co(II) doped Mo(IV)-Ni(II) supramolecular coordination polymer Mol. Catal. 528 2022 112513 10.1016/j.mcat.2022.112513 M.J. Zhang, D.D. Qi, Y. Xin, X.M. Hu, T. Cao, Y.C. Jin, K. Wang, Z. Zhou, L. Yang, J.Z. Jiang, D.P. Zhang, Highly efficient bifunctional catalyst with 2D MoN formed in situ synergy for OER and ORR based-on Co(II) doped Mo(IV)-Ni(II) supramolecular coordination polymer, Mol. Catal. 528 (2022) 112513, https://doi.org/10.1016/j.mcat.2022.112513. [72] L.J. Yang L. Zhang Interfacial electronic modification of bimetallic oxyphosphides as Multi-functional electrocatalyst for water splitting and urea electrolysis J. Colloid Interf. Sci. 607 2022 546 555 10.1016/j.jcis.2021.09.013 L.J. Yang, L. Zhang, Interfacial electronic modification of bimetallic oxyphosphides as Multi-functional electrocatalyst for water splitting and urea electrolysis, J. Colloid Interf. Sci. 607 (2022) 546–555, https://doi.org/10.1016/j.jcis.2021.09.013. [73] H.P. Liu S.L. Zhu Z.D. Cui Z.Y. Li S.L. Wu Y.Q. Liang Ni2P nanoflakes for the high-performing urea oxidation reaction: linking active sites to a UOR mechanism Nanoscale 13 2021 1759 1769 10.1039/d0nr08025j H.P. Liu, S.L. Zhu, Z.D. Cui, Z.Y. Li, S.L. Wu, Y.Q. Liang, Ni2P nanoflakes for the high-performing urea oxidation reaction: linking active sites to a UOR mechanism, Nanoscale. 13 (2021) 1759–1769, https://doi.org/10.1039/d0nr08025j. [74] W.L. Yang X.P. Yang B.J. Li J.H. Lin H.T. Gao C.M. Hou X.L. Luo Ultrathin nickel hydroxide nanosheets with a porous structure for efficient electrocatalytic urea oxidation J. Mater. Chem. A. 7 2019 26364 26370 10.1039/C9TA06887B W.L. Yang, X.P. Yang, B.J. Li, J.H. Lin, H.T. Gao, C.M. Hou, X.L. Luo, Ultrathin nickel hydroxide nanosheets with a porous structure for efficient electrocatalytic urea oxidation, J. Mater. Chem. A. 7 (2019) 26364–26370, https://doi.org/10.1039/C9TA06887B. [75] J.F. Chang Q. Lv G.Q. Li J.J. Ge C.P. Liu W. Xing Core-shell structured Ni12P5/Ni3 (PO4)2 hollow spheres as difunctional and efficient electrocatalysts for overall water electrolysis Appl. Catal. B Environ. 204 2017 486 496 10.1016/j.apcatb.2016.11.050 J.F. Chang, Q. Lv, G.Q. Li, J.J. Ge, C.P. Liu, W. Xing, Core-shell structured Ni12P5/Ni3 (PO4)2 hollow spheres as difunctional and efficient electrocatalysts for overall water electrolysis, Appl. Catal. B Environ. 204 (2017) 486–496, https://doi.org/10.1016/j.apcatb.2016.11.050. [76] L.A. Stern L.G. Feng F. Song X.L. Hu Ni2P as a Janus catalyst for water splitting: the oxygen evolution activity of Ni2P nanoparticles Energy Environ. Sci. 8 2015 2347 2351 10.1039/c5ee01155h L.A. Stern, L.G. Feng, F. Song, X.L. Hu, Ni2P as a Janus catalyst for water splitting: the oxygen evolution activity of Ni2P nanoparticles, Energy Environ. Sci. 8 (2015) 2347–2351, https://doi.org/10.1039/c5ee01155h. [77] H. Liu Z. Liu L.G. Feng Bonding state synergy of the NiF2/Ni2P hybrid with the co-existence of covalent and ionic bonds and the application of this hybrid as a robust catalyst for the energy-relevant electrooxidation of water and urea Nanoscale 11 2019 16017 16025 10.1039/c9nr05204f H. Liu, Z. Liu, L.G. Feng, Bonding state synergy of the NiF2/Ni2P hybrid with the co-existence of covalent and ionic bonds and the application of this hybrid as a robust catalyst for the energy-relevant electrooxidation of water and urea, Nanoscale. 11 (2019) 16017–16025, https://doi.org/10.1039/c9nr05204f. [78] V. Maruthapandian S. Kumaraguru S. Mohan V. Saraswathy S. Muralidharan An insight on the electrocatalytic mechanistic study of pristine Ni MOF (BTC) in alkaline medium for enhanced OER and UOR ChemElectroChem 5 2018 2795 2807 10.1002/celc.201800802 V. Maruthapandian, S. Kumaraguru, S. Mohan, V. Saraswathy, S. Muralidharan, An insight on the electrocatalytic mechanistic study of pristine Ni MOF (BTC) in alkaline medium for enhanced OER and UOR, ChemElectroChem 5 (2018) 2795–2807, doi:10.1002/celc.201800802. [79] K. Zhang W.H. Ma G. Tan Z.Z. Cheng Y.P. Ma W.Q. Li X. Feng Z.J. Li Interfacial engineering of Ru-doped Co3O4/CoP nanowires heterostructure as efficient bifunctional electrocatalysts for alkaline water splitting Mol. Catal. 530 2022 112640 10.1016/j.mcat.2022.112640 K. Zhang, W.H. Ma, G. Tan, Z.Z. Cheng, Y.P. Ma, W.Q. Li, X. Feng, Z.J. Li, Interfacial engineering of Ru-doped Co3O4/CoP nanowires heterostructure as efficient bifunctional electrocatalysts for alkaline water splitting, Mol. Catal. 530 (2022) 112640, https://doi.org/10.1016/j.mcat.2022.112640. [80] N.N. Zhang Y.Q. Zou L. Tao W. Chen L. Zhou Z.J. Liu B. Zhou G. Huang H.Z. Lin S.Y. Wang Electrochemical oxidation of 5-hydroxymethylfurfural on nickel nitride/carbon nanosheets: reaction pathway determined by in situ sum frequency generation vibrational spectroscopy Angew. Chem. 131 2019 16042 16050 10.1002/ange.201908722 N.N. Zhang, Y.Q. Zou, L. Tao, W. Chen, L. Zhou, Z.J. Liu, B. Zhou, G. Huang, H.Z. Lin, S.Y. Wang, Electrochemical oxidation of 5-hydroxymethylfurfural on nickel nitride/carbon nanosheets: reaction pathway determined by in situ sum frequency generation vibrational spectroscopy, Angew. Chem. 131 (2019) 16042–16050, https://doi.org/10.1002/ange.201908722. [81] L.S. Zhang L.P. Wang H.P. Lin Y.X. Liu J.Y. Ye Y.Z. Wen A. Chen L. Wang F.L. Ni Z.Y. Zhou A lattice-oxygen-involved reaction pathway to boost urea oxidation Angew. Chem. 131 2019 16976 16981 10.1002/ange.201909832 L.S. Zhang, L.P. Wang, H.P. Lin, Y.X. Liu, J.Y. Ye, Y.Z. Wen, A. Chen, L. Wang, F.L. Ni, Z.Y. Zhou, A lattice-oxygen-involved reaction pathway to boost urea oxidation, Angew. Chem. 131 (2019) 16976–16981, https://doi.org/10.1002/ange.201909832. [82] W. Chen L.T. Xu X.R. Zhu Y.C. Huang W. Zhou D.D. Wang Y.Y. Zhou S.Q. Du Q.L. Li C. Xie Unveiling the electrooxidation of urea: intramolecular coupling of the N−N bond Angew. Chem. Int. Ed. 60 2021 7297 7307 10.1002/anie.202015773 W. Chen, L.T. Xu, X.R. Zhu, Y.C. Huang, W. Zhou, D.D. Wang, Y.Y. Zhou, S.Q. Du, Q.L. Li, C. Xie, Unveiling the electrooxidation of urea: intramolecular coupling of the N−N bond, Angew. Chem. Int. Ed. 60 (2021) 7297–7307, https://doi.org/10.1002/anie.202015773. [83] Q.Z. Qian J.H. Zhang J.M. Li Y.P. Li X. Jin Y. Zhu Y. Liu Z.Y. Li A. El Harairy C. Xiao Artificial heterointerfaces achieve delicate reaction kinetics towards hydrogen evolution and hydrazine oxidation catalysis Angew. Chem. 133 2021 6049 6058 10.1002/anie.202014362 Q.Z. Qian, J.H. Zhang, J.M. Li, Y.P. Li, X. Jin, Y. Zhu, Y. Liu, Z.Y. Li, A. El Harairy, C. Xiao, Artificial heterointerfaces achieve delicate reaction kinetics towards hydrogen evolution and hydrazine oxidation catalysis, Angew. Chem. 133 (2021) 6049–6058, https://doi.org/10.1002/anie.202014362. [84] T.Z. Wang Q. Wang Y.C. Wang Y.L. Da W. Zhou Y. Shao D.B. Li S.H. Zhan J.Y. Yuan H. Wang Atomically dispersed semimetallic selenium on porous carbon membrane as an electrode for hydrazine fuel cells Angew. Chem. Int. Ed. 58 2019 13466 13471 10.1002/anie.201907752 T.Z. Wang, Q. Wang, Y.C. Wang, Y.L. Da, W. Zhou, Y. Shao, D.B. Li, S.H. Zhan, J.Y. Yuan, H. Wang, Atomically dispersed semimetallic selenium on porous carbon membrane as an electrode for hydrazine fuel cells, Angew. Chem. Int. Ed. 58 (2019) 13466–13471, https://doi.org/10.1002/anie.201907752. [85] L. Zhou M.F. Shao C. Zhang J.W. Zhao S. He D.M. Rao M. Wei D.G. Evans X. Duan Hierarchical CoNi-sulfide nanosheet arrays derived from layered double hydroxides toward efficient hydrazine electrooxidation Adv. Mater. 29 2017 1604080 10.1002/adma.201604080 L. Zhou, M.F. Shao, C. Zhang, J.W. Zhao, S. He, D.M. Rao, M. Wei, D.G. Evans, X. Duan, Hierarchical CoNi-sulfide nanosheet arrays derived from layered double hydroxides toward efficient hydrazine electrooxidation, Adv. Mater. 29 (2017) 1604080, https://doi.org/10.1002/adma.201604080. [86] S.Y. Cao Y.H. Luo T.H. Li J.D. Li L.L. Wu G.H. Liu Machine learning assisted screening of doped metals phosphides electrocatalyst towards efficient hydrogen evolution reaction Mol. Catal. 551 2023 113625 10.1016/j.mcat.2023.113625 S.Y. Cao, Y.H. Luo, T.H. Li, J.D. Li, L.L. Wu, G.H. Liu, Machine learning assisted screening of doped metals phosphides electrocatalyst towards efficient hydrogen evolution reaction, Mol. Catal. 551 (2023) 113625, https://doi.org/10.1016/j.mcat.2023.113625. [87] C.D. Jing L.M. Hong B. Li Y. Wang F.M. Zhang H.Bo Huang Q.Q. Jiang J.G. Tang A review with transition-metal phosphide electrocatalysts in hydrogen evolution reaction: doping perspective Mol. Catal. 554 2024 113832 10.1016/j.mcat.2024.113832 C.D. Jing, L.M. Hong, B. Li, Y. Wang, F.M. Zhang, H.Bo Huang, Q.Q. Jiang, J.G. Tang, A review with transition-metal phosphide electrocatalysts in hydrogen evolution reaction: doping perspective, Mol. Catal. 554 (2024) 113832, https://doi.org/10.1016/j.mcat.2024.113832. [88] Y. Zhao J.F. Huang X.Y. Li L.Y. Cao J.H. Li Q. Chen Y.F. Zhang K. Kajiyoshi L.L. Feng Zn2+-triggered synthesis of Ni2P/Ni12P5 microflower arrays for efficient alkaline overall water splitting Mol. Catal. 553 2024 113793 10.1016/j.mcat.2023.113793 Y. Zhao, J.F. Huang, X.Y. Li, L.Y. Cao, J.H. Li, Q. Chen, Y.F. Zhang, K. Kajiyoshi, L.L. Feng, Zn2+-triggered synthesis of Ni2P/Ni12P5 microflower arrays for efficient alkaline overall water splitting, Mol. Catal. 553 (2024) 113793, https://doi.org/10.1016/j.mcat.2023.113793. [89] X.S. Li B.C. Deng X.M. Wang S.Z. Chen M. Vaisman S.I. Karato G. Pan M.L. Lee J. Cha H. Wang Synthesis of thin-film black phosphorus on a flexible substrate 2D Mater. 2 2015 031002 10.1088/2053-1583/2/3/031002 X.S. Li, B.C. Deng, X.M. Wang, S.Z. Chen, M. Vaisman, S.I. Karato, G. Pan, M.L. Lee, J. Cha, H. Wang, Synthesis of thin-film black phosphorus on a flexible substrate, 2D Mater. 2 (2015) 031002, doi:10.1088/2053-1583/2/3/031002. [90] M. Qiu Z.T. Sun D.K. Sang X.G. Han H. Zhang C.M. Niu Current progress in black phosphorus materials and their applications in electrochemical energy storage Nanoscale 9 2017 13384 13403 10.1039/c7nr03318d M. Qiu, Z.T. Sun, D.K. Sang, X.G. Han, H. Zhang, C.M. Niu, Current progress in black phosphorus materials and their applications in electrochemical energy storage, Nanoscale. 9 (2017) 13384–13403, https://doi.org/10.1039/c7nr03318d. [91] Y.D. Liu K.W. Ang Monolithically integrated flexible black phosphorus complementary inverter circuits ACS Nano 11 2017 7416 7423 10.1021/acsnano.7b03703 Y.D. Liu, K.W. Ang, Monolithically integrated flexible black phosphorus complementary inverter circuits, ACS Nano. 11 (2017) 7416–7423, https://doi.org/10.1021/acsnano.7b03703. [92] Q.H. Zhang Z.Y. Chang G.Z. Xu Z.Y. Wang Y.P. Zhang Z.Q. Xu S.J. Chen Q.L. Bao J.Z. Liu Y.W. Mai Strain relaxation of monolayer WS2 on plastic substrate Adv. Funct. Mater. 26 2016 8707 8714 10.1002/adfm.201603064 Q.H. Zhang, Z.Y. Chang, G.Z. Xu, Z.Y. Wang, Y.P. Zhang, Z.Q. Xu, S.J. Chen, Q.L. Bao, J.Z. Liu, Y.W. Mai, Strain relaxation of monolayer WS2 on plastic substrate, Adv. Funct. Mater. 26 (2016) 8707–8714, https://doi.org/10.1002/adfm.201603064. [93] S. Seo H.U. Lee S.C. Lee Y. Kim H. Kim J. Bang J. Won Y. Kim B. Park J. Lee Triangular black phosphorus atomic layers by liquid exfoliation Sci. Rep. 6 2016 1 8 10.1038/srep23736 S. Seo, H.U. Lee, S.C. Lee, Y. Kim, H. Kim, J. Bang, J. Won, Y. Kim, B. Park, J. Lee, Triangular black phosphorus atomic layers by liquid exfoliation, Sci. Rep. 6 (2016) 1–8, https://doi.org/10.1038/srep23736. [94] B. Liang Y.H. Wang X.Y. Liu T. Tan L.W. Zhang W. Wang Nickel–cobalt alloy doping phosphorus as advanced electrocatalyst for hydrazine oxidation J. Alloys Compd. 807 2019 151648 10.1016/j.jallcom.2019.151648 B. Liang, Y.H. Wang, X.Y. Liu, T. Tan, L.W. Zhang, W. Wang, Nickel–cobalt alloy doping phosphorus as advanced electrocatalyst for hydrazine oxidation, J. Alloys Compd. 807 (2019) 151648, https://doi.org/10.1016/j.jallcom.2019.151648. [95] W. Wang Y.H. Wang S.J. Liu M. Yahia Y.J. Dong Z.Q. Lei Carbon-supported phosphatized CuNi nanoparticle catalysts for hydrazine electrooxidation Int. J. Hydrogen Energy. 44 2019 10637 10645 10.1016/j.ijhydene.2019.03.005 W. Wang, Y.H. Wang, S.J. Liu, M. Yahia, Y.J. Dong, Z.Q. Lei, Carbon-supported phosphatized CuNi nanoparticle catalysts for hydrazine electrooxidation, Int. J. Hydrogen Energy. 44 (2019) 10637–10645, https://doi.org/10.1016/j.ijhydene.2019.03.005. [96] A. Jain A.J. McGaughey Strongly anisotropic in-plane thermal transport in single-layer black phosphorene Sci. Rep. 5 2015 8501 10.1038/srep08501 A. Jain, A.J. McGaughey, Strongly anisotropic in-plane thermal transport in single-layer black phosphorene, Sci. Rep. 5 (2015) 8501, https://doi.org/10.1038/srep08501. [97] F. Sun J.S. Qin Z.Y. Wang M.Z. Yu X.H. Wu X.M. Sun J.S. Qiu Energy-saving hydrogen production by chlorine-free hybrid seawater splitting coupling hydrazine degradation Nat. Commun. 12 2021 4182 10.1038/s41467-021-24529-3 F. Sun, J.S. Qin, Z.Y. Wang, M.Z. Yu, X.H. Wu, X.M. Sun, J.S. Qiu, Energy-saving hydrogen production by chlorine-free hybrid seawater splitting coupling hydrazine degradation, Nat. Commun. 12 (2021) 4182, https://doi.org/10.1038/s41467-021-24529-3. [98] H.C. Sun W. Zhang J.G. Li Z. Li X. Ao K.H. Xue K.K. Ostrikov J. Tang C.D. Wang Rh-engineered ultrathin NiFe-LDH nanosheets enable highly-efficient overall water splitting and urea electrolysis Appl. Catal. B Environ. 284 2021 119740 10.1016/j.apcatb.2020.119740 H.C. Sun, W. Zhang, J.G. Li, Z. Li, X. Ao, K.H. Xue, K.K. Ostrikov, J. Tang, C.D. Wang, Rh-engineered ultrathin NiFe-LDH nanosheets enable highly-efficient overall water splitting and urea electrolysis, Appl. Catal. B Environ. 284 (2021) 119740, https://doi.org/10.1016/j.apcatb.2020.119740. [99] S.R. Kubota K.S. Choi Electrochemical oxidation of 5-hydroxymethylfurfural to 2, 5-furandicarboxylic acid (FDCA) in acidic media enabling spontaneous FDCA separation ChemSusChem 11 2018 2138 2145 10.1002/cssc.201800532 S.R. Kubota, K.S. Choi, Electrochemical oxidation of 5-hydroxymethylfurfural to 2, 5-furandicarboxylic acid (FDCA) in acidic media enabling spontaneous FDCA separation, ChemSusChem. 11 (2018) 2138–2145, https://doi.org/10.1002/cssc.201800532. [100] H.R. Ghatak S. Kumar P. Kundu Electrode processes in black liquor electrolysis and their significance for hydrogen production Int. J. Hydrogen Energy. 33 2008 2904 2911 10.1016/j.ijhydene.2008.03.051 H.R. Ghatak, S. Kumar, P. Kundu, Electrode processes in black liquor electrolysis and their significance for hydrogen production, Int. J. Hydrogen Energy. 33 (2008) 2904–2911, https://doi.org/10.1016/j.ijhydene.2008.03.051. [101] H.R. Ghatak Electrolysis of black liquor for hydrogen production: some initial findings Int. J. Hydrogen Energy. 31 2006 934 938 10.1016/j.ijhydene.2005.07.013 H.R. Ghatak, Electrolysis of black liquor for hydrogen production: some initial findings, Int. J. Hydrogen Energy. 31 (2006) 934–938, https://doi.org/10.1016/j.ijhydene.2005.07.013. [102] W.J. Liu Z.R. Xu D.T. Zhao X.Q. Pan H.C. Li X. Hu Z.Y. Fan W.K. Wang G.H. Zhao S. Jin Efficient electrochemical production of glucaric acid and H2 via glucose electrolysis Nat. Commun. 11 2020 265 10.1038/s41467-019-14157-3 W.J. Liu, Z.R. Xu, D.T. Zhao, X.Q. Pan, H.C. Li, X. Hu, Z.Y. Fan, W.K. Wang, G.H. Zhao, S. Jin, Efficient electrochemical production of glucaric acid and H2 via glucose electrolysis, Nat. Commun. 11 (2020) 265, https://doi.org/10.1038/s41467-019-14157-3. [103] Y.Q. Zhang B. Zhou Z.X. Wei W. Zhou D.D. Wang J. Tian T.H. Wang S.L. Zhao J.L. Liu L. Tao Coupling glucose-assisted Cu (I)/Cu (II) redox with electrochemical hydrogen production Adv. Mater. 33 2021 2104791 10.1002/adma.202104791 Y.Q. Zhang, B. Zhou, Z.X. Wei, W. Zhou, D.D. Wang, J. Tian, T.H. Wang, S.L. Zhao, J.L. Liu, L. Tao, Coupling glucose-assisted Cu (I)/Cu (II) redox with electrochemical hydrogen production, Adv. Mater. 33 (2021) 2104791, https://doi.org/10.1002/adma.202104791. [104] X.D. Chong C.B. Liu C.H. Wang R. Yang B. Zhang Integrating hydrogen production and transfer hydrogenation with selenite promoted electrooxidation of α-nitrotoluenes to e-nitroethenes Angew. Chem. 133 2021 22181 22187 10.1002/ange.202108666 X.D. Chong, C.B. Liu, C.H. Wang, R. Yang, B. Zhang, Integrating hydrogen production and transfer hydrogenation with selenite promoted electrooxidation of α-nitrotoluenes to e-nitroethenes, Angew. Chem. 133 (2021) 22181–22187, https://doi.org/10.1002/ange.202108666. [105] Y. Huang X.D. Chong C.B. Liu Y. Liang B. Zhang Boosting hydrogen production by anodic oxidation of primary amines over a NiSe nanorod electrode Angew. Chem. 130 2018 13347 13350 10.1002/anie.201807717 Y. Huang, X.D. Chong, C.B. Liu, Y. Liang, B. Zhang, Boosting hydrogen production by anodic oxidation of primary amines over a NiSe nanorod electrode, Angew. Chem. 130 (2018) 13347–13350, https://doi.org/10.1002/anie.201807717. [106] L.C. Yi Y.X. Ji P. Shao J.X. Chen J.W. Li H. Li K. Chen X.X. Peng Z.H. Wen Scalable synthesis of tungsten disulfide nanosheets for alkali-acid electrocatalytic sulfion recycling and H2 generation Angew. Chem. Int. Ed. 60 2021 21550 21557 10.1002/anie.202108992 L.C. Yi, Y.X. Ji, P. Shao, J.X. Chen, J.W. Li, H. Li, K. Chen, X.X. Peng, Z.H. Wen, Scalable synthesis of tungsten disulfide nanosheets for alkali-acid electrocatalytic sulfion recycling and H2 generation, Angew. Chem. Int. Ed. 60 (2021) 21550–21557, https://doi.org/10.1002/anie.202108992. [107] Y.H. Pei J. Cheng H. Zhong Z.F. Pi Y. Zhao F.M. Jin Sulfide-oxidation-assisted electrochemical water splitting for H2 production on a bifunctional Cu2S/nickel foam catalyst Green Chem 23 2021 6975 6983 10.1039/d1gc01857d Y.H. Pei, J. Cheng, H. Zhong, Z.F. Pi, Y. Zhao, F.M. Jin, Sulfide-oxidation-assisted electrochemical water splitting for H2 production on a bifunctional Cu2S/nickel foam catalyst, Green Chem. 23 (2021) 6975–6983, https://doi.org/10.1039/d1gc01857d.",
      "scopus-id": "85187799164",
      "coredata": {
        "eid": "1-s2.0-S2468823124002062",
        "dc:description": "The electrochemical oxidation reaction of small molecules (EORSM) has attracted extensive attention due to its advantages such as mild operating conditions, high conversion efficiency, good selectivity and environmental friendliness. Moreover, with relatively fast reaction kinetics and low theoretical thermodynamic equilibrium potential, EORSM is expected to replace anodic oxygen evolution reaction (OER). The coupling of EORSM at anode with hydrogen evolution reaction (HER) at cathode could realize multiple targets including high-value chemicals production, pollutant degradation and efficient hydrogen production. Black phosphorus-based nanocomposites are supposed as a promising EORSM electrocatalyst due to their adjustable electronic structure, large specific surface area, high carrier mobility and active lone pair electrons. Apart from that, transition metal phosphates (TMPs) are also widely used for EORSM because of their abundant active sites, strong electrical conductivity and adjustable component structure. This mini review briefly summarizes the recent progress of EORSM including alcohol oxidation, urea oxidation and hydrazine oxidation over BP-based nanocomposites or TMPs. In addition, possible challenges and research directions are also discussed for inspiring people to optimize EORSM using BP-based nanocomposites and ™Ps.",
        "openArchiveArticle": "false",
        "prism:coverDate": "2024-04-01",
        "openaccessUserLicense": null,
        "prism:aggregationType": "Journal",
        "prism:url": "https://api.elsevier.com/content/article/pii/S2468823124002062",
        "dc:creator": [
          {
            "@_fa": "true",
            "$": "Fu, Zimei"
          },
          {
            "@_fa": "true",
            "$": "Liu, Chunmei"
          },
          {
            "@_fa": "true",
            "$": "Bai, Meng"
          },
          {
            "@_fa": "true",
            "$": "Ma, Jiamin"
          },
          {
            "@_fa": "true",
            "$": "Zhao, Peipei"
          },
          {
            "@_fa": "true",
            "$": "Gao, Yang"
          },
          {
            "@_fa": "true",
            "$": "Zhao, Man"
          },
          {
            "@_fa": "true",
            "$": "He, Yingluo"
          },
          {
            "@_fa": "true",
            "$": "Xiao, He"
          },
          {
            "@_fa": "true",
            "$": "Jia, Jianfeng"
          }
        ],
        "link": [
          {
            "@_fa": "true",
            "@rel": "self",
            "@href": "https://api.elsevier.com/content/article/pii/S2468823124002062"
          },
          {
            "@_fa": "true",
            "@rel": "scidir",
            "@href": "https://www.sciencedirect.com/science/article/pii/S2468823124002062"
          }
        ],
        "dc:format": "application/json",
        "openaccessType": null,
        "pii": "S2468-8231(24)00206-2",
        "prism:volume": "558",
        "articleNumber": "114023",
        "prism:publisher": "Elsevier B.V.",
        "dc:title": "Black phosphorus-based nanocomposites and transition metal phosphates for electrocatalytic oxidation of small molecules",
        "prism:copyright": "© 2024 Elsevier B.V. All rights reserved.",
        "openaccess": "0",
        "prism:issn": "24688231",
        "dcterms:subject": [
          {
            "@_fa": "true",
            "$": "Black phosphorus"
          },
          {
            "@_fa": "true",
            "$": "Electrocatalytic oxidation"
          },
          {
            "@_fa": "true",
            "$": "Small molecule"
          },
          {
            "@_fa": "true",
            "$": "Transition metal phosphates"
          }
        ],
        "openaccessArticle": "false",
        "prism:publicationName": "Molecular Catalysis",
        "openaccessSponsorType": null,
        "prism:pageRange": "114023",
        "pubType": "rev",
        "prism:coverDisplayDate": "1 April 2024",
        "prism:doi": "10.1016/j.mcat.2024.114023",
        "prism:startingPage": "114023",
        "dc:identifier": "doi:10.1016/j.mcat.2024.114023",
        "openaccessSponsorName": null
      },
      "objects": {
        "object": [
          {
            "@category": "standard",
            "@height": "113",
            "@width": "628",
            "@_fa": "true",
            "$": "https://api.elsevier.com/content/object/eid/1-s2.0-S2468823124002062-gr2.jpg?httpAccept=%2A%2F%2A",
            "@multimediatype": "JPEG image file",
            "@type": "IMAGE-DOWNSAMPLED",
            "@size": "17886",
            "@ref": "gr2",
            "@mimetype": "image/jpeg"
          },
          {
            "@category": "standard",
            "@height": "488",
            "@width": "502",
            "@_fa": "true",
            "$": "https://api.elsevier.com/content/object/eid/1-s2.0-S2468823124002062-gr10.jpg?httpAccept=%2A%2F%2A",
            "@multimediatype": "JPEG image file",
            "@type": "IMAGE-DOWNSAMPLED",
            "@size": "74643",
            "@ref": "gr10",
            "@mimetype": "image/jpeg"
          },
          {
            "@category": "standard",
            "@height": "419",
            "@width": "529",
            "@_fa": "true",
            "$": "https://api.elsevier.com/content/object/eid/1-s2.0-S2468823124002062-gr3.jpg?httpAccept=%2A%2F%2A",
            "@multimediatype": "JPEG image file",
            "@type": "IMAGE-DOWNSAMPLED",
            "@size": "76769",
            "@ref": "gr3",
            "@mimetype": "image/jpeg"
          },
          {
            "@category": "standard",
            "@height": "265",
            "@width": "645",
            "@_fa": "true",
            "$": "https://api.elsevier.com/content/object/eid/1-s2.0-S2468823124002062-gr4.jpg?httpAccept=%2A%2F%2A",
            "@multimediatype": "JPEG image file",
            "@type": "IMAGE-DOWNSAMPLED",
            "@size": "64202",
            "@ref": "gr4",
            "@mimetype": "image/jpeg"
          },
          {
            "@category": "standard",
            "@height": "526",
            "@width": "656",
            "@_fa": "true",
            "$": "https://api.elsevier.com/content/object/eid/1-s2.0-S2468823124002062-gr12.jpg?httpAccept=%2A%2F%2A",
            "@multimediatype": "JPEG image file",
            "@type": "IMAGE-DOWNSAMPLED",
            "@size": "117788",
            "@ref": "gr12",
            "@mimetype": "image/jpeg"
          },
          {
            "@category": "standard",
            "@height": "470",
            "@width": "556",
            "@_fa": "true",
            "$": "https://api.elsevier.com/content/object/eid/1-s2.0-S2468823124002062-gr5.jpg?httpAccept=%2A%2F%2A",
            "@multimediatype": "JPEG image file",
            "@type": "IMAGE-DOWNSAMPLED",
            "@size": "89774",
            "@ref": "gr5",
            "@mimetype": "image/jpeg"
          },
          {
            "@category": "standard",
            "@height": "260",
            "@width": "566",
            "@_fa": "true",
            "$": "https://api.elsevier.com/content/object/eid/1-s2.0-S2468823124002062-gr11.jpg?httpAccept=%2A%2F%2A",
            "@multimediatype": "JPEG image file",
            "@type": "IMAGE-DOWNSAMPLED",
            "@size": "56545",
            "@ref": "gr11",
            "@mimetype": "image/jpeg"
          },
          {
            "@category": "standard",
            "@height": "194",
            "@width": "585",
            "@_fa": "true",
            "$": "https://api.elsevier.com/content/object/eid/1-s2.0-S2468823124002062-gr6.jpg?httpAccept=%2A%2F%2A",
            "@multimediatype": "JPEG image file",
            "@type": "IMAGE-DOWNSAMPLED",
            "@size": "38795",
            "@ref": "gr6",
            "@mimetype": "image/jpeg"
          },
          {
            "@category": "standard",
            "@height": "461",
            "@width": "547",
            "@_fa": "true",
            "$": "https://api.elsevier.com/content/object/eid/1-s2.0-S2468823124002062-gr14.jpg?httpAccept=%2A%2F%2A",
            "@multimediatype": "JPEG image file",
            "@type": "IMAGE-DOWNSAMPLED",
            "@size": "72643",
            "@ref": "gr14",
            "@mimetype": "image/jpeg"
          },
          {
            "@category": "standard",
            "@height": "459",
            "@width": "568",
            "@_fa": "true",
            "$": "https://api.elsevier.com/content/object/eid/1-s2.0-S2468823124002062-gr7.jpg?httpAccept=%2A%2F%2A",
            "@multimediatype": "JPEG image file",
            "@type": "IMAGE-DOWNSAMPLED",
            "@size": "81489",
            "@ref": "gr7",
            "@mimetype": "image/jpeg"
          },
          {
            "@category": "standard",
            "@height": "167",
            "@width": "371",
            "@_fa": "true",
            "$": "https://api.elsevier.com/content/object/eid/1-s2.0-S2468823124002062-gr13.jpg?httpAccept=%2A%2F%2A",
            "@multimediatype": "JPEG image file",
            "@type": "IMAGE-DOWNSAMPLED",
            "@size": "16620",
            "@ref": "gr13",
            "@mimetype": "image/jpeg"
          },
          {
            "@category": "standard",
            "@height": "154",
            "@width": "520",
            "@_fa": "true",
            "$": "https://api.elsevier.com/content/object/eid/1-s2.0-S2468823124002062-gr8.jpg?httpAccept=%2A%2F%2A",
            "@multimediatype": "JPEG image file",
            "@type": "IMAGE-DOWNSAMPLED",
            "@size": "38599",
            "@ref": "gr8",
            "@mimetype": "image/jpeg"
          },
          {
            "@category": "standard",
            "@height": "180",
            "@width": "616",
            "@_fa": "true",
            "$": "https://api.elsevier.com/content/object/eid/1-s2.0-S2468823124002062-gr9.jpg?httpAccept=%2A%2F%2A",
            "@multimediatype": "JPEG image file",
            "@type": "IMAGE-DOWNSAMPLED",
            "@size": "44023",
            "@ref": "gr9",
            "@mimetype": "image/jpeg"
          },
          {
            "@category": "standard",
            "@height": "492",
            "@width": "635",
            "@_fa": "true",
            "$": "https://api.elsevier.com/content/object/eid/1-s2.0-S2468823124002062-gr15.jpg?httpAccept=%2A%2F%2A",
            "@multimediatype": "JPEG image file",
            "@type": "IMAGE-DOWNSAMPLED",
            "@size": "98343",
            "@ref": "gr15",
            "@mimetype": "image/jpeg"
          },
          {
            "@category": "standard",
            "@height": "307",
            "@width": "307",
            "@_fa": "true",
            "$": "https://api.elsevier.com/content/object/eid/1-s2.0-S2468823124002062-gr1.jpg?httpAccept=%2A%2F%2A",
            "@multimediatype": "JPEG image file",
            "@type": "IMAGE-DOWNSAMPLED",
            "@size": "41249",
            "@ref": "gr1",
            "@mimetype": "image/jpeg"
          },
          {
            "@category": "standard",
            "@height": "244",
            "@width": "244",
            "@_fa": "true",
            "$": "https://api.elsevier.com/content/object/eid/1-s2.0-S2468823124002062-ga1.jpg?httpAccept=%2A%2F%2A",
            "@multimediatype": "JPEG image file",
            "@type": "IMAGE-DOWNSAMPLED",
            "@size": "30014",
            "@ref": "ga1",
            "@mimetype": "image/jpeg"
          },
          {
            "@category": "thumbnail",
            "@height": "39",
            "@width": "219",
            "@_fa": "true",
            "$": "https://api.elsevier.com/content/object/eid/1-s2.0-S2468823124002062-gr2.sml?httpAccept=%2A%2F%2A",
            "@multimediatype": "GIF image file",
            "@type": "IMAGE-THUMBNAIL",
            "@size": "6466",
            "@ref": "gr2",
            "@mimetype": "image/gif"
          },
          {
            "@category": "thumbnail",
            "@height": "163",
            "@width": "168",
            "@_fa": "true",
            "$": "https://api.elsevier.com/content/object/eid/1-s2.0-S2468823124002062-gr10.sml?httpAccept=%2A%2F%2A",
            "@multimediatype": "GIF image file",
            "@type": "IMAGE-THUMBNAIL",
            "@size": "13519",
            "@ref": "gr10",
            "@mimetype": "image/gif"
          },
          {
            "@category": "thumbnail",
            "@height": "164",
            "@width": "207",
            "@_fa": "true",
            "$": "https://api.elsevier.com/content/object/eid/1-s2.0-S2468823124002062-gr3.sml?httpAccept=%2A%2F%2A",
            "@multimediatype": "GIF image file",
            "@type": "IMAGE-THUMBNAIL",
            "@size": "14563",
            "@ref": "gr3",
            "@mimetype": "image/gif"
          },
          {
            "@category": "thumbnail",
            "@height": "90",
            "@width": "219",
            "@_fa": "true",
            "$": "https://api.elsevier.com/content/object/eid/1-s2.0-S2468823124002062-gr4.sml?httpAccept=%2A%2F%2A",
            "@multimediatype": "GIF image file",
            "@type": "IMAGE-THUMBNAIL",
            "@size": "12393",
            "@ref": "gr4",
            "@mimetype": "image/gif"
          },
          {
            "@category": "thumbnail",
            "@height": "163",
            "@width": "204",
            "@_fa": "true",
            "$": "https://api.elsevier.com/content/object/eid/1-s2.0-S2468823124002062-gr12.sml?httpAccept=%2A%2F%2A",
            "@multimediatype": "GIF image file",
            "@type": "IMAGE-THUMBNAIL",
            "@size": "17559",
            "@ref": "gr12",
            "@mimetype": "image/gif"
          },
          {
            "@category": "thumbnail",
            "@height": "164",
            "@width": "194",
            "@_fa": "true",
            "$": "https://api.elsevier.com/content/object/eid/1-s2.0-S2468823124002062-gr5.sml?httpAccept=%2A%2F%2A",
            "@multimediatype": "GIF image file",
            "@type": "IMAGE-THUMBNAIL",
            "@size": "16663",
            "@ref": "gr5",
            "@mimetype": "image/gif"
          },
          {
            "@category": "thumbnail",
            "@height": "100",
            "@width": "219",
            "@_fa": "true",
            "$": "https://api.elsevier.com/content/object/eid/1-s2.0-S2468823124002062-gr11.sml?httpAccept=%2A%2F%2A",
            "@multimediatype": "GIF image file",
            "@type": "IMAGE-THUMBNAIL",
            "@size": "13205",
            "@ref": "gr11",
            "@mimetype": "image/gif"
          },
          {
            "@category": "thumbnail",
            "@height": "73",
            "@width": "219",
            "@_fa": "true",
            "$": "https://api.elsevier.com/content/object/eid/1-s2.0-S2468823124002062-gr6.sml?httpAccept=%2A%2F%2A",
            "@multimediatype": "GIF image file",
            "@type": "IMAGE-THUMBNAIL",
            "@size": "10767",
            "@ref": "gr6",
            "@mimetype": "image/gif"
          },
          {
            "@category": "thumbnail",
            "@height": "163",
            "@width": "194",
            "@_fa": "true",
            "$": "https://api.elsevier.com/content/object/eid/1-s2.0-S2468823124002062-gr14.sml?httpAccept=%2A%2F%2A",
            "@multimediatype": "GIF image file",
            "@type": "IMAGE-THUMBNAIL",
            "@size": "15356",
            "@ref": "gr14",
            "@mimetype": "image/gif"
          },
          {
            "@category": "thumbnail",
            "@height": "164",
            "@width": "203",
            "@_fa": "true",
            "$": "https://api.elsevier.com/content/object/eid/1-s2.0-S2468823124002062-gr7.sml?httpAccept=%2A%2F%2A",
            "@multimediatype": "GIF image file",
            "@type": "IMAGE-THUMBNAIL",
            "@size": "14728",
            "@ref": "gr7",
            "@mimetype": "image/gif"
          },
          {
            "@category": "thumbnail",
            "@height": "99",
            "@width": "219",
            "@_fa": "true",
            "$": "https://api.elsevier.com/content/object/eid/1-s2.0-S2468823124002062-gr13.sml?httpAccept=%2A%2F%2A",
            "@multimediatype": "GIF image file",
            "@type": "IMAGE-THUMBNAIL",
            "@size": "9638",
            "@ref": "gr13",
            "@mimetype": "image/gif"
          },
          {
            "@category": "thumbnail",
            "@height": "65",
            "@width": "219",
            "@_fa": "true",
            "$": "https://api.elsevier.com/content/object/eid/1-s2.0-S2468823124002062-gr8.sml?httpAccept=%2A%2F%2A",
            "@multimediatype": "GIF image file",
            "@type": "IMAGE-THUMBNAIL",
            "@size": "11154",
            "@ref": "gr8",
            "@mimetype": "image/gif"
          },
          {
            "@category": "thumbnail",
            "@height": "64",
            "@width": "219",
            "@_fa": "true",
            "$": "https://api.elsevier.com/content/object/eid/1-s2.0-S2468823124002062-gr9.sml?httpAccept=%2A%2F%2A",
            "@multimediatype": "GIF image file",
            "@type": "IMAGE-THUMBNAIL",
            "@size": "9998",
            "@ref": "gr9",
            "@mimetype": "image/gif"
          },
          {
            "@category": "thumbnail",
            "@height": "164",
            "@width": "212",
            "@_fa": "true",
            "$": "https://api.elsevier.com/content/object/eid/1-s2.0-S2468823124002062-gr15.sml?httpAccept=%2A%2F%2A",
            "@multimediatype": "GIF image file",
            "@type": "IMAGE-THUMBNAIL",
            "@size": "16966",
            "@ref": "gr15",
            "@mimetype": "image/gif"
          },
          {
            "@category": "thumbnail",
            "@height": "164",
            "@width": "164",
            "@_fa": "true",
            "$": "https://api.elsevier.com/content/object/eid/1-s2.0-S2468823124002062-gr1.sml?httpAccept=%2A%2F%2A",
            "@multimediatype": "GIF image file",
            "@type": "IMAGE-THUMBNAIL",
            "@size": "16917",
            "@ref": "gr1",
            "@mimetype": "image/gif"
          },
          {
            "@category": "thumbnail",
            "@height": "163",
            "@width": "163",
            "@_fa": "true",
            "$": "https://api.elsevier.com/content/object/eid/1-s2.0-S2468823124002062-ga1.sml?httpAccept=%2A%2F%2A",
            "@multimediatype": "GIF image file",
            "@type": "IMAGE-THUMBNAIL",
            "@size": "16354",
            "@ref": "ga1",
            "@mimetype": "image/gif"
          },
          {
            "@category": "high",
            "@height": "500",
            "@width": "2780",
            "@_fa": "true",
            "$": "https://api.elsevier.com/content/object/eid/1-s2.0-S2468823124002062-gr2_lrg.jpg?httpAccept=%2A%2F%2A",
            "@multimediatype": "JPEG image file",
            "@type": "IMAGE-HIGH-RES",
            "@size": "112990",
            "@ref": "gr2",
            "@mimetype": "image/jpeg"
          },
          {
            "@category": "high",
            "@height": "2162",
            "@width": "2222",
            "@_fa": "true",
            "$": "https://api.elsevier.com/content/object/eid/1-s2.0-S2468823124002062-gr10_lrg.jpg?httpAccept=%2A%2F%2A",
            "@multimediatype": "JPEG image file",
            "@type": "IMAGE-HIGH-RES",
            "@size": "506485",
            "@ref": "gr10",
            "@mimetype": "image/jpeg"
          },
          {
            "@category": "high",
            "@height": "1855",
            "@width": "2344",
            "@_fa": "true",
            "$": "https://api.elsevier.com/content/object/eid/1-s2.0-S2468823124002062-gr3_lrg.jpg?httpAccept=%2A%2F%2A",
            "@multimediatype": "JPEG image file",
            "@type": "IMAGE-HIGH-RES",
            "@size": "601466",
            "@ref": "gr3",
            "@mimetype": "image/jpeg"
          },
          {
            "@category": "high",
            "@height": "1173",
            "@width": "2857",
            "@_fa": "true",
            "$": "https://api.elsevier.com/content/object/eid/1-s2.0-S2468823124002062-gr4_lrg.jpg?httpAccept=%2A%2F%2A",
            "@multimediatype": "JPEG image file",
            "@type": "IMAGE-HIGH-RES",
            "@size": "494776",
            "@ref": "gr4",
            "@mimetype": "image/jpeg"
          },
          {
            "@category": "high",
            "@height": "2329",
            "@width": "2906",
            "@_fa": "true",
            "$": "https://api.elsevier.com/content/object/eid/1-s2.0-S2468823124002062-gr12_lrg.jpg?httpAccept=%2A%2F%2A",
            "@multimediatype": "JPEG image file",
            "@type": "IMAGE-HIGH-RES",
            "@size": "895020",
            "@ref": "gr12",
            "@mimetype": "image/jpeg"
          },
          {
            "@category": "high",
            "@height": "2081",
            "@width": "2463",
            "@_fa": "true",
            "$": "https://api.elsevier.com/content/object/eid/1-s2.0-S2468823124002062-gr5_lrg.jpg?httpAccept=%2A%2F%2A",
            "@multimediatype": "JPEG image file",
            "@type": "IMAGE-HIGH-RES",
            "@size": "690989",
            "@ref": "gr5",
            "@mimetype": "image/jpeg"
          },
          {
            "@category": "high",
            "@height": "1150",
            "@width": "2506",
            "@_fa": "true",
            "$": "https://api.elsevier.com/content/object/eid/1-s2.0-S2468823124002062-gr11_lrg.jpg?httpAccept=%2A%2F%2A",
            "@multimediatype": "JPEG image file",
            "@type": "IMAGE-HIGH-RES",
            "@size": "426610",
            "@ref": "gr11",
            "@mimetype": "image/jpeg"
          },
          {
            "@category": "high",
            "@height": "859",
            "@width": "2589",
            "@_fa": "true",
            "$": "https://api.elsevier.com/content/object/eid/1-s2.0-S2468823124002062-gr6_lrg.jpg?httpAccept=%2A%2F%2A",
            "@multimediatype": "JPEG image file",
            "@type": "IMAGE-HIGH-RES",
            "@size": "280733",
            "@ref": "gr6",
            "@mimetype": "image/jpeg"
          },
          {
            "@category": "high",
            "@height": "2040",
            "@width": "2421",
            "@_fa": "true",
            "$": "https://api.elsevier.com/content/object/eid/1-s2.0-S2468823124002062-gr14_lrg.jpg?httpAccept=%2A%2F%2A",
            "@multimediatype": "JPEG image file",
            "@type": "IMAGE-HIGH-RES",
            "@size": "549746",
            "@ref": "gr14",
            "@mimetype": "image/jpeg"
          },
          {
            "@category": "high",
            "@height": "2031",
            "@width": "2515",
            "@_fa": "true",
            "$": "https://api.elsevier.com/content/object/eid/1-s2.0-S2468823124002062-gr7_lrg.jpg?httpAccept=%2A%2F%2A",
            "@multimediatype": "JPEG image file",
            "@type": "IMAGE-HIGH-RES",
            "@size": "633165",
            "@ref": "gr7",
            "@mimetype": "image/jpeg"
          },
          {
            "@category": "high",
            "@height": "742",
            "@width": "1646",
            "@_fa": "true",
            "$": "https://api.elsevier.com/content/object/eid/1-s2.0-S2468823124002062-gr13_lrg.jpg?httpAccept=%2A%2F%2A",
            "@multimediatype": "JPEG image file",
            "@type": "IMAGE-HIGH-RES",
            "@size": "107362",
            "@ref": "gr13",
            "@mimetype": "image/jpeg"
          },
          {
            "@category": "high",
            "@height": "682",
            "@width": "2303",
            "@_fa": "true",
            "$": "https://api.elsevier.com/content/object/eid/1-s2.0-S2468823124002062-gr8_lrg.jpg?httpAccept=%2A%2F%2A",
            "@multimediatype": "JPEG image file",
            "@type": "IMAGE-HIGH-RES",
            "@size": "269251",
            "@ref": "gr8",
            "@mimetype": "image/jpeg"
          },
          {
            "@category": "high",
            "@height": "796",
            "@width": "2730",
            "@_fa": "true",
            "$": "https://api.elsevier.com/content/object/eid/1-s2.0-S2468823124002062-gr9_lrg.jpg?httpAccept=%2A%2F%2A",
            "@multimediatype": "JPEG image file",
            "@type": "IMAGE-HIGH-RES",
            "@size": "312767",
            "@ref": "gr9",
            "@mimetype": "image/jpeg"
          },
          {
            "@category": "high",
            "@height": "2179",
            "@width": "2813",
            "@_fa": "true",
            "$": "https://api.elsevier.com/content/object/eid/1-s2.0-S2468823124002062-gr15_lrg.jpg?httpAccept=%2A%2F%2A",
            "@multimediatype": "JPEG image file",
            "@type": "IMAGE-HIGH-RES",
            "@size": "865077",
            "@ref": "gr15",
            "@mimetype": "image/jpeg"
          },
          {
            "@category": "high",
            "@height": "1360",
            "@width": "1360",
            "@_fa": "true",
            "$": "https://api.elsevier.com/content/object/eid/1-s2.0-S2468823124002062-gr1_lrg.jpg?httpAccept=%2A%2F%2A",
            "@multimediatype": "JPEG image file",
            "@type": "IMAGE-HIGH-RES",
            "@size": "325529",
            "@ref": "gr1",
            "@mimetype": "image/jpeg"
          },
          {
            "@category": "high",
            "@height": "1085",
            "@width": "1083",
            "@_fa": "true",
            "$": "https://api.elsevier.com/content/object/eid/1-s2.0-S2468823124002062-ga1_lrg.jpg?httpAccept=%2A%2F%2A",
            "@multimediatype": "JPEG image file",
            "@type": "IMAGE-HIGH-RES",
            "@size": "226417",
            "@ref": "ga1",
            "@mimetype": "image/jpeg"
          },
          {
            "@category": "standard",
            "@_fa": "true",
            "$": "https://api.elsevier.com/content/object/eid/1-s2.0-S2468823124002062-am.pdf?httpAccept=%2A%2F%2A",
            "@multimediatype": "Acrobat PDF file",
            "@type": "AAM-PDF",
            "@size": "1163795",
            "@ref": "am",
            "@mimetype": "application/pdf"
          }
        ]
      },
      "link": {
        "@rel": "abstract",
        "@href": "https://api.elsevier.com/content/abstract/scopus_id/85187799164"
      }
    }
  }
}