{
  "metadata": {
    "title": "Highly regio-selective hydroformylation of biomass derived eugenol using aqueous biphasic Rh/TPPTS/CDs as a greener and recyclable catalyst",
    "authors": "; ; ",
    "journal": "Molecular Catalysis",
    "date": "2017-07-31",
    "doi": "10.1016/j.mcat.2017.04.019",
    "abstract": "",
    "uri": "https://api.elsevier.com/content/article/pii/S2468823117302262",
    "pii": "S2468823117302262"
  },
  "fulltext": {
    "full-text-retrieval-response": {
      "scopus-eid": "2-s2.0-85029627423",
      "originalText": "serial JL 315758 291210 291744 291790 291809 31 Molecular Catalysis MOLECULARCATALYSIS 2017-05-01 2017-05-01 2017-05-01 2017-05-01 2017-05-22T19:23:15 1-s2.0-S2468823117302262 S2468-8231(17)30226-2 S2468823117302262 10.1016/j.mcat.2017.04.019 S300 S300.1 FULL-TEXT 1-s2.0-S2468823117X00102 2021-10-25T07:48:33.311909Z 0 0 20170701 20170731 2017 2017-05-01T16:19:39.282105Z absattachment articleinfo articletitlenorm authfirstinitialnorm authfirstsurnamenorm cid cids contenttype copyright crossmark dateloaded dateloadedtxt datesearch datesort dateupdated dco docsubtype doctype doi eid ewtransactionid hubeid indexeddate issn issnnorm itemstage itemtransactionid itemweight openaccess openarchive pg pgfirst pglast pii piinorm pubdateend pubdatestart pubdatetxt pubyr sectiontitle sortorder srctitle srctitlenorm srctype ssids alllist content subj subheadings suppl tomb volfirst volissue volumelist webpdf webpdfpagecount yearnav figure table e-component body acknowledge affil appendices articletitle auth authfirstini authfull authkeywords authlast highlightsabst primabst ref specialabst 2468-8231 24688231 true 436 436 C Volume 436 19 157 163 157 163 201707 July 2017 2017-07-01 2017-07-31 2017 Regular Papers article fla © 2017 Elsevier B.V. All rights reserved. HIGHLYREGIOSELECTIVEHYDROFORMYLATIONBIOMASSDERIVEDEUGENOLUSINGAQUEOUSBIPHASICRHTPPTSCDSAGREENERRECYCLABLECATALYST JAGTAP S 1 Introduction 2 Experimental 2.1 Materials and methods 2.2 General experimental procedure for aqueous biphasic hydroformylation of eugenol 2.3 General experimental procedure for recycling of the catalyst 3 Results and discussion 3.1 Aqueous biphasic hydroformylation of eugenol 3.2 Effect of various modified cyclodextrins and its concentration on the hydroformylation of eugenol 3.3 Optimization of reaction conditions for the eugenol hydroformylation 3.4 Effect of metallic precursor on hydroformylation of eugenol 3.5 Effect of Rh/TPPTS/CDs ratio on eugenol hydroformylation 3.6 Substrate study of hydroformylation of various derivatives of allyl benzene 4 Catalyst reusability 5 Conclusion Acknowledgement Appendix A Supplementary data References FRANKE 2012 5675 5732 R DABBAWALA 2009 97 106 A KHAN 2011 141 145 S VILCHESHERRERA 2014 1706 1724 M JAGTAP 2016 162 168 S DONG 2015 5059 5062 K 2012 1 23 PHOSPHORUSIIILIGANDSINHOMOGENEOUSCATALYSISDESIGNSYNTHESIS FUJITA 2004 2881 2887 S HOU 2014 1364 C YU 2008 3469 3472 S SHAUGHNESSY 2009 643 710 K CHAUDHARI 1995 123 133 R CORNILS 1995 177 186 B CHAUDHARI 1995 501 503 R CORNILS 1998 121 127 B PURWANTO 1995 135 140 P KALCK 1998 431 440 P HAMERLA 2013 1854 1862 T HAMERLA 2013 1854 1862 T STRAUB 2013 2071 2075 A DESSET 2009 630 637 S HAPIOT 2008 162 172 F DING 1994 3761 3763 H FERREIRA 2012 1337 1346 M FERREIRA 2010 1193 1203 M BOULANGER 2012 1439 1446 J HAPIOT 2014 1899 1908 F SZEJTLI 1998 1743 1754 J CRINI 2014 10940 10975 G MALLAVARAPU 1995 239 242 G PAGANELLI 2006 138 144 S GRAYSON 1998 449 475 D GRAYSON 1988 419 464 D SIEGEL 1980 178 183 H AXET 2006 2973 2979 M SIEGEL 1980 178 183 H DASILVA 2002 133 141 A BARICELLI 2015 163 169 P MELEAN 2011 117 123 L BARICELLI 2013 299 305 P KALCK 1986 349 357 P KOLLAR 1997 283 288 L ALHAFFAR 2010 778 782 M DASILVA 2002 133 141 A OLIVEIRA 2012 204 208 K MATHIVET 2001 105 116 T FERREIRA 2017 140 M MONFLIER 2004 425 431 E JAGTAPX2017X157 JAGTAPX2017X157X163 JAGTAPX2017X157XS JAGTAPX2017X157X163XS 2019-05-01T00:00:00Z http://creativecommons.org/licenses/by-nc-nd/4.0/ © 2017 Elsevier B.V. All rights reserved. 0 item S2468-8231(17)30226-2 S2468823117302262 1-s2.0-S2468823117302262 10.1016/j.mcat.2017.04.019 315758 2017-05-22T14:51:53.420479-04:00 2017-07-01 2017-07-31 1-s2.0-S2468823117302262-main.pdf https://s3-eu-west-1.amazonaws.com/prod-ucs-content-store-eu-west/content/pii:S2468823117302262/MAIN/application/pdf/e7b874c1bb11391ba93002a11334e669/main.pdf https://s3.amazonaws.com/prod-ucs-content-store-us-east/content/pii:S2468823117302262/MAIN/application/pdf/e7b874c1bb11391ba93002a11334e669/main.pdf main.pdf pdf true 1220441 MAIN 7 1-s2.0-S2468823117302262-main_1.png https://s3-eu-west-1.amazonaws.com/prod-ucs-content-store-eu-west/content/pii:S2468823117302262/PREVIEW/image/png/f7b60f9f831b5b5d32f220b94e0df474/main_1.png https://s3.amazonaws.com/prod-ucs-content-store-us-east/content/pii:S2468823117302262/PREVIEW/image/png/f7b60f9f831b5b5d32f220b94e0df474/main_1.png main_1.png png 56912 849 656 IMAGE-WEB-PDF 1 1-s2.0-S2468823117302262-fx1.sml https://s3-eu-west-1.amazonaws.com/prod-ucs-content-store-eu-west/content/pii:S2468823117302262/fx1/THUMBNAIL/image/gif/c56c6496bc7204d686c0744883043cc4/fx1.sml https://s3.amazonaws.com/prod-ucs-content-store-us-east/content/pii:S2468823117302262/fx1/THUMBNAIL/image/gif/c56c6496bc7204d686c0744883043cc4/fx1.sml fx1 true fx1.sml sml 4391 164 201 IMAGE-THUMBNAIL 1-s2.0-S2468823117302262-fx2.sml https://s3-eu-west-1.amazonaws.com/prod-ucs-content-store-eu-west/content/pii:S2468823117302262/fx2/THUMBNAIL/image/gif/3fedb1e3a340acf6102585d3d65dd4f8/fx2.sml https://s3.amazonaws.com/prod-ucs-content-store-us-east/content/pii:S2468823117302262/fx2/THUMBNAIL/image/gif/3fedb1e3a340acf6102585d3d65dd4f8/fx2.sml fx2 fx2.sml sml 6351 164 201 IMAGE-THUMBNAIL 1-s2.0-S2468823117302262-gr1.sml https://s3-eu-west-1.amazonaws.com/prod-ucs-content-store-eu-west/content/pii:S2468823117302262/gr1/THUMBNAIL/image/gif/7d9158231af3ccd2dbd73f570b734491/gr1.sml https://s3.amazonaws.com/prod-ucs-content-store-us-east/content/pii:S2468823117302262/gr1/THUMBNAIL/image/gif/7d9158231af3ccd2dbd73f570b734491/gr1.sml gr1 gr1.sml sml 6393 148 219 IMAGE-THUMBNAIL 1-s2.0-S2468823117302262-gr2.sml https://s3-eu-west-1.amazonaws.com/prod-ucs-content-store-eu-west/content/pii:S2468823117302262/gr2/THUMBNAIL/image/gif/351e935d3e7ba6e3a05c143857d51a20/gr2.sml https://s3.amazonaws.com/prod-ucs-content-store-us-east/content/pii:S2468823117302262/gr2/THUMBNAIL/image/gif/351e935d3e7ba6e3a05c143857d51a20/gr2.sml gr2 gr2.sml sml 3909 86 219 IMAGE-THUMBNAIL 1-s2.0-S2468823117302262-gr3.sml https://s3-eu-west-1.amazonaws.com/prod-ucs-content-store-eu-west/content/pii:S2468823117302262/gr3/THUMBNAIL/image/gif/b038f2b3903fae703e1b340862383bca/gr3.sml https://s3.amazonaws.com/prod-ucs-content-store-us-east/content/pii:S2468823117302262/gr3/THUMBNAIL/image/gif/b038f2b3903fae703e1b340862383bca/gr3.sml gr3 gr3.sml sml 5273 109 219 IMAGE-THUMBNAIL 1-s2.0-S2468823117302262-sc1.sml https://s3-eu-west-1.amazonaws.com/prod-ucs-content-store-eu-west/content/pii:S2468823117302262/sc1/THUMBNAIL/image/gif/b3732c1fd3279224cfb8017a35e082ac/sc1.sml https://s3.amazonaws.com/prod-ucs-content-store-us-east/content/pii:S2468823117302262/sc1/THUMBNAIL/image/gif/b3732c1fd3279224cfb8017a35e082ac/sc1.sml sc1 sc1.sml sml 3236 68 219 IMAGE-THUMBNAIL 1-s2.0-S2468823117302262-sc2.sml https://s3-eu-west-1.amazonaws.com/prod-ucs-content-store-eu-west/content/pii:S2468823117302262/sc2/THUMBNAIL/image/gif/5a33cf50f14a9f788264c9f48cd7036e/sc2.sml https://s3.amazonaws.com/prod-ucs-content-store-us-east/content/pii:S2468823117302262/sc2/THUMBNAIL/image/gif/5a33cf50f14a9f788264c9f48cd7036e/sc2.sml sc2 sc2.sml sml 4257 85 219 IMAGE-THUMBNAIL 1-s2.0-S2468823117302262-fx1.jpg https://s3-eu-west-1.amazonaws.com/prod-ucs-content-store-eu-west/content/pii:S2468823117302262/fx1/DOWNSAMPLED/image/jpeg/c7d2b767b498f028e82a32b7e8124be3/fx1.jpg https://s3.amazonaws.com/prod-ucs-content-store-us-east/content/pii:S2468823117302262/fx1/DOWNSAMPLED/image/jpeg/c7d2b767b498f028e82a32b7e8124be3/fx1.jpg fx1 true fx1.jpg jpg 10419 245 301 IMAGE-DOWNSAMPLED 1-s2.0-S2468823117302262-fx2.jpg https://s3-eu-west-1.amazonaws.com/prod-ucs-content-store-eu-west/content/pii:S2468823117302262/fx2/DOWNSAMPLED/image/jpeg/ab12b351853405c7ec00df240e647c3f/fx2.jpg https://s3.amazonaws.com/prod-ucs-content-store-us-east/content/pii:S2468823117302262/fx2/DOWNSAMPLED/image/jpeg/ab12b351853405c7ec00df240e647c3f/fx2.jpg fx2 fx2.jpg jpg 13012 245 301 IMAGE-DOWNSAMPLED 1-s2.0-S2468823117302262-gr1.jpg https://s3-eu-west-1.amazonaws.com/prod-ucs-content-store-eu-west/content/pii:S2468823117302262/gr1/DOWNSAMPLED/image/jpeg/ef9970821008c5c1a4691ef4048fb77f/gr1.jpg https://s3.amazonaws.com/prod-ucs-content-store-us-east/content/pii:S2468823117302262/gr1/DOWNSAMPLED/image/jpeg/ef9970821008c5c1a4691ef4048fb77f/gr1.jpg gr1 gr1.jpg jpg 17157 257 379 IMAGE-DOWNSAMPLED 1-s2.0-S2468823117302262-gr2.jpg https://s3-eu-west-1.amazonaws.com/prod-ucs-content-store-eu-west/content/pii:S2468823117302262/gr2/DOWNSAMPLED/image/jpeg/11e2d16c4ea629de797f6f3877aa616a/gr2.jpg https://s3.amazonaws.com/prod-ucs-content-store-us-east/content/pii:S2468823117302262/gr2/DOWNSAMPLED/image/jpeg/11e2d16c4ea629de797f6f3877aa616a/gr2.jpg gr2 gr2.jpg jpg 35796 295 753 IMAGE-DOWNSAMPLED 1-s2.0-S2468823117302262-gr3.jpg https://s3-eu-west-1.amazonaws.com/prod-ucs-content-store-eu-west/content/pii:S2468823117302262/gr3/DOWNSAMPLED/image/jpeg/bc818441ff41a10cd69f6ed578703306/gr3.jpg https://s3.amazonaws.com/prod-ucs-content-store-us-east/content/pii:S2468823117302262/gr3/DOWNSAMPLED/image/jpeg/bc818441ff41a10cd69f6ed578703306/gr3.jpg gr3 gr3.jpg jpg 34966 299 602 IMAGE-DOWNSAMPLED 1-s2.0-S2468823117302262-sc1.jpg https://s3-eu-west-1.amazonaws.com/prod-ucs-content-store-eu-west/content/pii:S2468823117302262/sc1/DOWNSAMPLED/image/jpeg/44cdc9c24c79a032e4f33a6de874951d/sc1.jpg https://s3.amazonaws.com/prod-ucs-content-store-us-east/content/pii:S2468823117302262/sc1/DOWNSAMPLED/image/jpeg/44cdc9c24c79a032e4f33a6de874951d/sc1.jpg sc1 sc1.jpg jpg 34502 223 715 IMAGE-DOWNSAMPLED 1-s2.0-S2468823117302262-sc2.jpg https://s3-eu-west-1.amazonaws.com/prod-ucs-content-store-eu-west/content/pii:S2468823117302262/sc2/DOWNSAMPLED/image/jpeg/9e03f685791f4d08e34a0e49488d3b99/sc2.jpg https://s3.amazonaws.com/prod-ucs-content-store-us-east/content/pii:S2468823117302262/sc2/DOWNSAMPLED/image/jpeg/9e03f685791f4d08e34a0e49488d3b99/sc2.jpg sc2 sc2.jpg jpg 41527 276 715 IMAGE-DOWNSAMPLED 1-s2.0-S2468823117302262-mmc1.docx https://s3-eu-west-1.amazonaws.com/prod-ucs-content-store-eu-west/content/pii:S2468823117302262/mmc1/MAIN/application/msword/0b082b3d000d71fa7afd519d6fd10ce2/mmc1.docx https://s3.amazonaws.com/prod-ucs-content-store-us-east/content/pii:S2468823117302262/mmc1/MAIN/application/msword/0b082b3d000d71fa7afd519d6fd10ce2/mmc1.docx mmc1 mmc1.docx docx 136931 APPLICATION MCAT 155 S2468-8231(17)30226-2 10.1016/j.mcat.2017.04.019 Elsevier B.V. Scheme 1 Regio-selective hydroformylation of eugenol using Rh/TPPTS/CDs as a greener and reusable catalyst. aReaction Conditions: Eugenol (1mmol), Rhacac(CO)2 (0.0015mmol), TPPTS (0.0075mmol), CD (0.015mmol), CO/H2 (25bar), Water (10mL), 80°C, 6h. bDetermined by GC and GC–MS. cReaction carried out with Rh/TPPTS/H2O as catalyst. Scheme 1 Scheme 2 Plausible mechanism for the regioselective hydroformylation of eugenol using Rh/TPPTS with RAME-β-CD as greener and reusable catalytic system. Scheme 2 Fig. 1 The general schematic representation of aqueous biphasic catalysis. Fig. 1 Fig. 2 The structures of native cyclodextrins (α-CD, β-CD and γ-CD). Fig. 2 Fig. 3 Recyclability study of aqueous biphasic hydroformylation of eugenol (1a) using Rh/TPPTS/RAME-β-CD as a reusable catalyst. aReaction conditions: 1a (1mmol), Rh acac(CO)2 (0.0015mmol), TPPTS (0.0075mmol), RAME-β-CD (0.015mmol), CO/H2 (25bar), H2O (10mL), 80°C, 6h. bGC Yield. Fig. 3 Table 1 Chemical structure and characteristic of the cyclodextrin derivatives. Table 1 G: H or R Entry Abbreviation n Substituent R Carbons bearing the OR group Number of R groups per CD Molecular weight (gmol−1) 1 α-CD 6 (–) (–) 0 972 2 β-CD 7 (–) (–) 0 1134 3 γ-CD 8 (–) (–) 0 1297 4 RAME-α-CD 6 CH3 2, 3 and 6 10.8 1127 5 RAME-β-CD 7 CH3 2, 3 and 6 12.6 1314 6 HP-β-CD 7 CH2 CHOHCH3 2, 3 and 6 5.6 1460 Table 2 Effect of various cyclodextrins and its concentration on the aqueous biphasic hydroformylation of eugenol (1a). a Table 2 Entry CDs Conc. in mmol Conversion (%) b Aldehyedes (%) b Selectivity (%) b 2a:3a:4a 1 c – – 68 60 14:34:52 2 α-CD 0.030 82 65 15:25:60 3 α-CD 0.061 84 72 15:20:65 4 α-CD 0.102 83 69 10:28:62 5 β-CD 0.026 88 69 12:16:72 6 β-CD 0.052 92 72 06:16:78 7 β-CD 0.088 91 69 10:20:70 8 γ-CD 0.025 69 59 12:20:68 9 γ-CD 0.050 79 64 14:16:70 10 γ-CD 0.083 77 64 16:12:62 11 RAME-α-CD 0.026 79 67 20:16:64 12 RAME-α-CD 0.053 84 69 19:21:60 13 RAME-α-CD 0.088 82 65 16:22:62 14 RAME-β-CD 0.015 92 86 08:12:80 15 RAME-β-CD 0.025 97 89 03:10:87 16 RAME-β-CD 0.050 99 81 10:15:75 17 hp-β-CD 0.020 78 84 16:22:62 18 hp-β-CD 0.041 86 85 12:20:68 19 hp-β-CD 0.070 89 83 19:21:60 a Reaction Conditions: Eugenol (1mmol), Rhacac(CO)2 (0.0015mmol), TPPTS (0.0075mmol), CO/H2 (25bar), Water (10mL), 80°C, 6h. b Determined by GC and GC–MS. c Reaction carried out with Rh/TPPTS/H2O as catalyst. RAME- RAndomly MEthylated, hp- hydroxy propyl. Table 3 Optimization of reaction conditions for an aqueous biphasic hydroformylation of eugenol (1a). a Table 3 Entry Pressure in bar (CO/H2) Time (h) Temp. (°C) Conv. (%) b Selectivity (%) b (2a:3a:4a) Effect of pressure 1 45 10 80 99 16:24:60 2 35 10 80 99 12:22:64 3 25 10 80 97 12:12:76 4 15 10 80 92 14:28:58 Effect of time 5 25 12 80 99 10:16:74 6 25 8 80 97 04:10:86 7 25 6 80 97 03:10:87 8 25 4 80 89 05:16:79 Effect of temperature 9 25 6 120 99 19:23:58 10 25 6 100 98 15:20:65 11 25 6 60 86 10:22:68 12 25 6 40 78 20:28:52 a Reaction Conditions: Eugenol (1mmol), Rhacac(CO)2 (0.0015mmol), TPPTS (0.0075mmol), RAME-β-CD (0.025mmol), Water (10mL), 700rpm. b Confirmed by GC and GC–MS analysis. Table 4 Effect of metallic precursors on aqueous biphasic hydroformylation of eugenol (1a). a Table 4 Entry Metallic precursors Conc. (mmol) Conv. (%) b Aldehydes (%) b Selectivity (%) b 2a:3a:4a 1 – – – – – 2 Pd(OAc)2 0.044 26 – – 3 RuCl3 0.048 59 62 10:22:68 4 RhCl3 0.015 68 63 16:20:64 5 Rh(acac)(CO)2 0.001 92 85 08:12:80 6 Rh(acac)(CO)2 0.0015 97 89 03:10:87 7 [Rh(COD)Cl]2 0.0025 92 87 10:11:79 8 Rh(COD)2BF4 0.0025 87 84 12:19:69 9 Rh2(OAc)4 0.0025 89 89 04:20:76 10 c Co2(CO)8 0.025 49 65 15:25:60 11 d CoCl2·6H2O 0.05 45 59 11:30:59 a Reaction Conditions: Eugenol (1mmol), TPPTS (0.0075mmol), RAME-β-CD (0.025mmol), CO/H2 (25bar), Water (10mL), 700rpm, 80°C, 6h. b Confirmed by GC and GC–MS analysis. c 50bar, 100°C, 8h. d 50bar, 100°C, 8h. Table 5 Effect of Rh/TPPTS/CDs ratio on biphasic hydroformylation of eugenol (1a). a Table 5 Entry Rh/TPPTS/CDs ratio Conv. (%) b Aldehyde (%) b Selectivity (%) b 2a:3a:4a 1 c 1:2:0 68 65 14:30:56 2 1:2:4 90 84 10:12:78 3 1:3:6 94 86 10:15:75 4 1:5:10 97 89 03:10:87 5 d 1:0:4 58 76 18:18:64 6 1:4:4 95 86 06:12:82 a Reaction Conditions: Eugenol (1mmol), Rhacac(CO)2 (0.0015mmol), CO/H2 (25bar), Water (10mL), 80°C, 6h. b Confirmed by GC and GC–MS analysis. c Reaction carried out with Rh/TPPTS as catalyst. d Reaction carried out with Rh/CDs as a catalyst. Table 6 Substrate study of biphasic hydroformylation of various derivatives of allyl benzene. Table 6 Entry Substrates Conv. (%) b Aldehyde (%) b Selectivity (%) b 2a-2h:3a-3h:4a-4h 1 Eugenol (1a) 97 89 03:10:87 2 c Anethole (1b) 94 84 30:55:15 3 Estragole (1c) 98 89 13:12:75 4 Allyl benzene (1d) 92 89 10:22:68 5 4-allyl toluene (1e) 96 88 14:14:72 6 4-allyl-1,2-dimethoxybenzene (1f) 96 82 10:12:78 7 1-allyl-4-(trifluromethyl)benzene (1g) 89 78 15:20:65 aReaction Conditions: Olefin (1mmol), Rhacac(CO)2 (0.0015mmol), TPPTS (0.0075mmol), RAME-β-CD (0.015mmol), CO/H2 (25bar), Water (10mL), 80°C, 6h. b Confirmed by GC and GC–MS analysis. c 90°C, 10h, 40bar. Highly regio-selective hydroformylation of biomass derived eugenol using aqueous biphasic Rh/TPPTS/CDs as a greener and recyclable catalyst Samadhan A. Jagtap a Eric Monflier b Anne Ponchel b Bhalchandra M. Bhanage a ⁎ a Department of Chemistry, Institute of Chemical Technology, N. Parekh Marg, Matunga, Mumbai, 400 019, Maharashtra, India Department of Chemistry Institute of Chemical Technology N. Parekh Marg Matunga Mumbai Maharashtra 400 019 India b Univ. Artois, CNRS, Centrale Lille, ENSCL, Univ. Lille, UMR 8181, Unité de Catalyse et Chimie du Solide (UCCS), Lens, F-62300, France Univ. Artois CNRS Centrale Lille ENSCL Univ. Lille MR 8181 Unité de Catalyse et Chimie du Solide (UCCS) Lens F-62300 France ⁎ Corresponding author Graphical abstract The present work describes an aqueous biphasic hydroformylation of biomass derived olefins such as eugenol, anethole and estragole using Rh/TPPTS/CDs as recyclable catalyst. The various modified cyclodextrins α-CD, β-CD, γ-CD, RAME-α-CD, RAME-β-CD and hp-β-CD were examined, among them RAME-β-CD shows best results as 89% conversion and 87% selectivity towards the linear aldehydes (4a). The various aldehydes were synthesized in good to excellent yields. The terminal olefins (eugenol and estragole) can provide selectively linear aldehydes (87%) as major product and the internal olefin (anethole) gives the selectively branched aldehyde (78%) as the major product. The Rh/TPPTS/CD is used as a recyclable catalytic system for an aqueous biphasic hydroformylation of naturally occurring olefins eugenol, anethole and estragole. A Rh/TPPTS catalyzed aqueous biphasic hydroformylation of eugenol was performed in an aqueous medium in the presence of different modified cyclodextrins. The internal olefin such as anethole shows high selectivity towards the branched aldehydes (78%) where as terminal alkene like eugenol shows high selectivity towards the linear aldehydes (87%). The various reaction parameters such as effect of syngas pressure, time, temperature, catalyst precursor and loading have been studied. The high activity and high selectivity towards the linear aldehydes is due to the steric crowding of methyl group present in RAME-β-cyclodextrins. The effect of ratio of Rh/TPPTS/RAME-β-CD were also studied for the hydroformylation of eugenol. Moreover, this catalytic system was recycled up to four consecutive cycles without loss in its catalytic activity and selectivity. Keywords Biphasic catalysis rhodium TPPTS Cyclodextrins Hydroformylation Eugenol 1 Introduction Hydroformylation is a very important homogeneous catalytic industrial process by use of rhodium metal for the synthesis of aldehydes from alkenes using syngas (CO/H2) [1,2]. The difficulties in controlling the selectivity of products, separation and recovery of the catalysts from the reaction mixture are the biggest challenges [3]. The phosphine or phosphite ligands were used to enhance the regio-selectivity towards the expected linear or branched aldehydes [4,5]. While homogeneous rhodium catalysts affords high conversion and selectivity for desired product in less reaction time, they suffer from the trouble of separating the catalyst from the reaction mixture and catalyst recovery [6]. Aqueous biphasic catalysis provides a straightforward solution to the problem of product separation and catalyst recovery [7]. The general schematic representation of aqueous biphasic organometallic catalysis has been shown in (Fig. 1 ). Aqueous biphasic organometallic hydroformylation has been growing importance since the synthesis of sodium salt of trisulfonated triphenylphosphine (TPPTS) early in 19th century [8]. Formerly, in 1984 the Rh/TPPTS/H2O aqueous biphasic catalytic system was used by Ruhrchemie and Rhone-Poulenc for the hydroformylation of propene [9]. During this process, the rhodium catalyst was capably anchored in aqueous phase through water soluble TPPTS ligand which leads to negligible amount of metal leaching in ppb. However, the scope of this process is reduced by the low solubility of organic substrate in water and need of synthesis of water soluble ligands. To overcome these drawbacks the addition of co-solvent [10], surfactants [11,12], cyclodextrins [13], surface active ligand [14] and activated carbon [15] was reported. Along with the different approaches proposed, the use of cyclodextrins (CDs) proves to be challenging in aqueous biphasic systems [16]. The cyclodextrins (CDs) are cyclic oligosaccharides consist of (α-1,4) -linked α-d-glucopyranose units which is obtained from the enzymatic conversion of starch [17]. It contains a somewhat lipophilic central cavity and a hydrophilic outer surface. The natural α-, β- and γ-cyclodextrin consist of six, seven, and eight glucopyranose units, respectively [18]. Naturally occurring olefins are the green alternative source of renewable feedstocks for the chemical industry. The derivatives of allyl benzenes such as eugenol, anethole and estragole are the bio-renewable starting materials obtained from (biomass) cloves, basil and sweet basil, respectively [19]. The hydroformylation of these biorenewable starting materials provides aldehydes of high added-value with an interesting properties that are significant in the cosmetic, pharmacological, fragrance and food industries [20,21]. Several groups have studied the hydroformylation of eugenol over the years. In 1980, Siegel and Himmele reported the Rh-catalyzed hydroformylation of eugenol [22]. Santos and coworkers reported the rhodium catalyzed hydroformylation of various allylbenzenes and propenylbenzenes with 97–99% chemoselectivity in the presence of phosphine ligands [23]. Recently, Santos and co-workers utilized cetyltrimethylammonium bromide (CTAB) as a cationic surfactant in rhodium catalyzed biphasic hydroformylation of eugenol in the presence of water soluble phosphines can provide 97–99% chemoselectivity [24]. In 2011, Baricelli and co-workers first time reported the biphasic hydroformylation of substituted allylbenzenes with water-soluble rhodium [Rh(CO)(Pz)(L)]2 or ruthenium [HRu(CO) (CH3CN)(L)3][BF4] complexes [25]. Afterwards, Escalante and co-workers reported biphasic hydrogenation and hydroformylation of natural olefins with a binuclear rhodium complex in ionic liquid/toluene as a catalytic system [26]. The hydroformylation of the naturally occurring olefins, such as eugenol, anethole and estragole has been rather extensively investigated in the literature [27]. In the last decade, various homogenous catalytic protocols were developed [28,29]. However, with these homogeneous catalytic processes, the recovery and reutilization of the expensive metal catalysts is a difficult task which affects the overall process economy. Herein, we report the aqueous biphasic hydroformylation of natural olefin such as eugenol using Rh/TPPTS/CDs/H2O as greener and recyclable catalytic system (Scheme 1 ). In the present protocol, native and modified cyclodextrins were used in the aqueous biphasic catalysis. The aim of the present work is screening an effect of the various cyclodextrins such as α-cyclodextrins (α-CD), β-cyclodextrin (β-CD), γ-cyclodextrin (γ-CD), hydroxyl propyl β-cyclodextrin (hp-β-CD) and RAndomly MEthylated β-cyclodextrin (RAME-β-CD). 2 Experimental 2.1 Materials and methods All the chemicals were purchased from Sigma Aldrich, Alfa Aesar, Spectrochem Pvt. Ltd., India and used without further purification. Distilled deionized water was used in all experiments. All catalytic reactions were performed under nitrogen atmosphere. A syngas containing mixture of hydrogen (49.9%) and carbon monoxide (49.9%) were purchased from Rakhangi Gas Service, Mumbai. All reactions were performed in a 100mL autoclave. The reaction process was monitored by gas chromatography on Perkin Elmer Clarus 400 GC equipped with flame ionization detector with a capillary column (Elite-1, 30m×0.32mm×0.25μm)). GC-MS-QP 2010 instrument (Rtx-17, 30m×25mm ID, film thickness 0.25μmdf) (column flow 2 10mLmin−1, 80°C–240°C at 10°/min rise). 2.2 General experimental procedure for aqueous biphasic hydroformylation of eugenol To a 100mL autoclave, Eugenol (1mmol), [Rh (acac) (CO) 2] (0.0015mmol), TPPTS (0.0075mmol), RAME-β-CD (0.015mmol) and water (10mL) were added. The autoclave was closed, flushed three times with syngas, pressurized with 25bar of syngas and heated at 80°C for 6h. After the completion of the reaction, the reactor was cooled to room temperature, and the remaining syngas gas was vented carefully, and the reactor was opened. The organic layer containing product from aqueous layer was separated by a simple separation technique using separating funnel. The reactor vessel was thoroughly washed with ethyl acetate (3×5mL) to remove traces of the product. The reaction mixture was collected in separating funnel and separates the organic layer containing product. The separated aqueous layer containing catalytic system was reused as catalyst for further recycle experiment. The organic layer containing product was passed through dry Na2SO4 to remove traces of water (moisture) if present and it is used as for further GC and GC–MS analysis. 2.3 General experimental procedure for recycling of the catalyst The recovery and recycling of the catalysts have been performed under nitrogen atmosphere. After the completion of the reaction, the catalytic system was recovered by separating the aqueous layer from the organic layer in the separating funnel. The reaction mixture was washed three times with 3mL of ethyl acetate to remove the product present in the reaction mixture. After the separation of organic layer of reaction mixture, remaining aqueous solution containing metal, ligand and cyclodextrin as a catalyst was collected and used as it is for next recycle experiment. This biphasic Rh/TPPTS/CDs catalytic system was easily recycled up to four consecutive cycles without loosing its catalytic activity and selectivity. 3 Results and discussion 3.1 Aqueous biphasic hydroformylation of eugenol The aqueous biphasic hydroformylation of eugenol (1a) to the synthesis of respective aldehydes i.e. 4-(3-hydroxy-4-methoxyphenyl) butanal (4a) was chosen as model reaction. The reaction was carried out in presence of Rhacac(CO)2 as a catalyst precussor, TPPTS as water soluble phosphine and cyclodextrin as mass transfer promoter. 3.2 Effect of various modified cyclodextrins and its concentration on the hydroformylation of eugenol The chemical structure and characteristics of native cyclodextrins (α-CD, β-CD and γ-CD) and derivatives (RAME-α-CD, RAME-β-CD and hp-β-CD) were shown in Table 1 . The cyclodextrins are cyclic oligosaccharides with a hydrophilic outer surface and a lipophilic central cavity. The α-CD, β-CD and γ-CD contain 6, 7 and 8 (α-1,4) linked α-d-glucopyranose units, respectively (Fig. 2 ). The RAME-α-CD and RAME-β-CD were a mixture of CDs partially O-methylated with statistically 11.8 OH and 12.6 groups modified per CD, respectively. The OH groups in C-6 position are fully methylated whereas those in C-2 and C-3 positions are partially methylated (Table 1, entries 4 and 5). The hp-β-CD is a mixture of β-CDs partially O-hydroxypropylated with statistically 5.6 OH groups modified per CD. The OH groups can be in C-2, C-3 or C-6 positions (Table 1, entry 6). Initially, we screened the effect of various modified cyclodextrins and its concentration on the hydroformylation of eugenol (1a) as shown in Table 2 . The reaction with the Rh/TPPTS/H2O catalytic system provides good conversion (68%) with moderate yield of aldehydes (60%) and the selectivity (52%) was less (Table 2, entry 1). It was observed that the better yield (72%) of aldehydes and selectivity (78%) of 4a was obtained when 0.0052mmol concentration of β-CD used in the reaction (Table 2, entry 6). The better results were obtained using β-CD (Table 2, entries 5–7) as compared to α-CD and γ-CD. The less yield and selectivity was observed using α-CD (Table 2, entries 2–4) and γ-CD (Table 2, entries 8–10) at the same rection conditions. From these results, it is concluded that the size of CDs cavity was appeared to be key limit to manage the catalytic activity. Moreover, we studied some modified CDs are RAME-α-CD, RAME-β-CD and hp-β-CD for the hydroformylation reaction of eugenol under the optimum reaction conditions. The reaction with RAME-α-CD provides better conversion, but selectivity was observed less as compared to the RAME-β-CD and hp-β-CD (Table 2, entries 11–13). The addition of 0.053mmol of RAME-α-CD in the reaction provides 84% conversion and 69% yield of aldehydes with 60% selectivity of 4a (Table 2, entry 12). The modified RAME-β-CD of 0.0252mmol concentration shows the best results for better conversion (97%) of 1a and 87% selectivity of 4a (Table 2, entry 15). The high activity can probably be attributed to the surface-active properties of RAME-β-CD and selectivity towards the linear aldehydes could be due to the steric crowding of randomly presence of methyl groups in the RAME-β-CD. As we increase the concentration of RAME-β-CD from 0.015mmol to 0.050mmol resulting into the conversion increases from 92% to 99%. However, the yield of aldehyde and selectivity of linear aldehydes initially increases and then decreases at the end (Table 2, entries 14–16). The hp-β-CD was also shows better results in the conversion of eugenol and the better selectivities of 4a (Table 2, entries 17–19). At the 0.041mmol concentration of hp-β-CD it can provide the 86% conversion and 85% yield of aldehydes with 68% selectivity of 4a (Table 2, entry 18). From this first set of expriments, it clearly appears that the presence of CD allows in all case to increase the eugenol selectivity. This result can be likely attributed to the inclusion of eugenol inside the CD cavity. Indeed, CD can transitorily accommodate the substrate into its cavity restricting its conformational flexibility and masking a part of the allyl group while exposing distal position of the allyl group to Rh catalytic species. This result is remarkable as it is well-known that CD can interact with TPPTS to form phosphane low-coordinated species which are expected to be less regioselective in the hydroformylation reaction (Scheme 2 ) [30–32]. 3.3 Optimization of reaction conditions for the eugenol hydroformylation Aqueous biphasic hydroformylation of eugenol (1a) for the synthesis of respective aldehydes i.e. 4-(3-hydroxy-4-methoxyphenyl) butanal (4a) was chosen as a model reaction for an optimization study. The various reaction parameters such as the effect of syngas (CO/H2) pressure, time, temperature, catalyst screening and loading were studied for the regio-selective hydroformylation of eugenol (1a) and the results are summarized in Tables 3 and 4 . Similarly the effect of metal to ligand to CDs ratio were screened and results are shown in Table 5 . Initially, we studied the effect of syngas pressure in the hydroformylation reaction of eugenol using Rh/TPPTS/CDs as a recyclable catalytic system. When the use of 45bar and 35bar of syngas pressure, then conversion was almost complete but selectivity of the product (4a) was very less about 60% and 64% respectively (Table 3, entries 1 and 2). The best results were observed at 25bar of syngas pressure provides 97% conversion of 1a and 76% selectivity of 4a (Table 3, entry 3). Then we reduced the pressure up to 15bar both conversion reduces to 92% and selectivity decreases to 58% (Table 3, entry 4). Thus the 25bar was fine pressure for a successful conversion and better selectivity of 4a. Furthermore, we have studied the effect of time in the range of 12h–4h (Table 3, entries 5–8). Initially, we increase the time from 10h to 12h, the conversion has no significant change, but selectivity of 4a decreases to 74% (Table 3, entry 5). Then, we reduce the raction time to 8h we get the slightly decrease in conversion (97%) but selectivityof 4a increases up to 86% (Table 3, entry 6). Between all the reaction time the 6h time was the favourable reaction time to get the best results as 97% conversion of 1a with 87% selectivity of 4a (Table 3, entry 7). As we reduced time reaction at 4h the conversion decreases to 89% and selectivity of 4a decreases to 79% (Table 3, entry 8). Afterwards, we examine the range of temperature of (120°C–40°C) to optimize the suitable temperature for the biphasic hydroformylation of eugenol (Table 3, entries 9–12). If we increase the reaction temperature up to 120°C then the conversion was almost complete, but the selectivity of 4a decreased to 58% (Table 3, entry 9). At the 100°C of reaction temperature, conversion does not affected but slightly increase in selectivity up to 65% (Table 3, entry 10). The best results were observed at the reaction temperature of 80°C which can afford 97% conversion of 1a and 87% selectivity of 4a (Table 3, entry 7). Moreover, at lower temperatures of 60°C, the conversion and selectivity both decreases (Table 3, entry 11). Finally, the 78% conversion and 52% selectivity was observed at a low reaction temperature of 40°C (Table 3, entry 12). 3.4 Effect of metallic precursor on hydroformylation of eugenol In absence of catalyst, the reaction does not occur, confirming that the catalyst is solely responsible for the reaction (Table 4, entry 1). Moreover, we have studied the various metallic precursors of Palladium, Ruthenium, Rhodium and Cobalt metals for the hydroformylation of eugenol in the presence of TPPTS ligand along with RAME-β-CD. Among them the rhodium metal precursors were the active catalysts for the hydroformylation of 1a. The catalyst Pd(OAc)2 provides less conversion of 26%, but the desired product (4a) was not observed (Table 4, entry 2). The Ruthenium (III) Chloride can furnish moderate conversion and selectivity towards 4a (Table 4, entry 3). The various rhodium precursors can afford good conversion and better selectivity towards 4a (Table 4, entries 4–9). Among all the rhodium precursors the Rhacac(CO)2 catalyst was active for hydroformylation of 1a, which shows the best results as conversion of 97% and selectivity of 87% towards 4a (Table 4, entry 6). We have also used the Cobalt precursors such as Co2(CO)8 and CoCl2·6H2O, these precursors was not active so much for hydroformylation of 1a, which requires high pressure (50bar) and high temperature (100°C) (Table 4, entries 10 and 11). 3.5 Effect of Rh/TPPTS/CDs ratio on eugenol hydroformylation We screened the effect of ratio of metal/TPPTS/CDs for the hydroformylation of 1a for the better conversion and selectivity of 4a. The reaction carried out with Rh/TPPTS as catalyst with 1:2 ratio, which can provide the conversion (68%) and 65% yield of aldehydes with 56% selectivity of 4a (Table 5, entry 1). After the addition of RAME-β-CD to the Rh/TPPTS catalyst the remarkable increase in the 90% conversion and 84% yield with 78% selectivity of 4a (Table 5, entry 2). The Rh/TPPTS/RAME-β-CD ratio of 1:3:6 also provides good conversion (94%) and good yield (86%) with selectivity (75%) of 4a (Table 5, entry 3). The best results were observed at the ratio of 1:5:10 which shows the conversion of 97% and 89% yield with the selectivity of 4a up to 87% (Table 5, entry 4). The reaction carried out using 1:4 ratio of Rh/RAME-β-CD as a catalytic system with water as solvent, it observed that the decrease in conversion to 58% and 76% aldehydes with 64% selectivity of 4a (Table 5, entry 5). In this case, the catalytic system mainly present in organic phase due to absence of water soluble TPPTS ligand which can acquire catalytic system into aqueous phase. Consequently, the TPPTS ligand plays crucial role for the separation of catalytic system in aqueous biphasic organometallic catalysis. The ratio 1:4:4 also supply good conversion of 95% and 86% yield of aldehydes along with 82% selectivity to the linear aldehyde 4a (Table 5, entry 6). It is concluded that, from the studies of entry no. 1 and 5, it is concluded that the whole catalytic system (Rh/TPPTS/RAME-β-CD) is solely responsible for the aqueous biphasic hydroformylation of 1a. 3.6 Substrate study of hydroformylation of various derivatives of allyl benzene The optimized reaction parameters were further applied to examine the substrate applicability of this protocol. The derivatives of allyl benzenes bearing electron-donating groups (Me, OMe) and electron withdrawing groups (OH, CF3) were smoothly converted into the desired products. The terminal alkene eugenol (1a) provides conversion (97%) and a yield (89%) of aldehydes with selectivity (87%) of linear aldehyde (4a) (Table 6 , entry 1). The internal alkene anethole (1b) can provide 94% conversion and 84% yield of aldehyde, but branched aldehyde (3b) selectivity (55%) was observed as a major product (Table 6, entry 2). The estragole (1c) is the derivative of allyl benzene containing group at para position, which affords the conversion (98%) and selectivity (75%) towards the linear aldehyde (4c) (Table 6, entry 3). The simple allyl benzene (1d) was easily converted to the 4d with conversion (92%) and selectivity (68%) of 4d (Table 6, entry 4). The allyl benzenes containing electron donating groups such as −Me (1e) and OMe (1f) also provides better conversion and good selectivities 72% towards 4e, 78% towards 4f (Table 6, entries 5 and 6). Finally, the electron withdrawing group also provides good conversion (89%), but slightly decrease in selectivity (65%) of 4g (Table 6, entry 7). 4 Catalyst reusability Reusability of Rh/TPPTS/CDs catalyst was an important aspect to ensure efficiency of the catalytic protocol. So, we have tested the reusability of Rh/TPPTS/CDs catalyst for the biphasic hydroformylation of naturally occurring olefins such as Eugenol (1a). All the experiments of recovery of catalytic system was performed under the nitrogen atmospheric condition. The catalytic system was found to be reused for four consecutive cycles with an excellent catalytic activity and selectivity towards the formation of desired product 4a (Fig. 3 ). The leaching of rhodium metal was investigated after the 1st and 4th recycle run by ICP-AES analysis and observed below has detected level (≈0.1ppm) of rhodium in solution which revealed that negligible leaching of rhodium metal into the solution. 5 Conclusion In conclusions, we have described the effect of various modified cyclodextrins for the aqueous biphasic hydroformylation of biomass derived olefins using Rh/TPPTS/CDs as an efficient, recyclable and greener protocol. The various cyclodextrins such as α-CD, β-CD, γ-CD, RAME-α-CD, RAME-β-CD and hp-β-CD have been successfully screened for aqueous biphasic hydroformylation of eugenol. Among them RAME-β-CD can provide the best conversion and excellent selectivity towards the linear aldehydes. Because, the internal cavity RAME-β-CD of is hydrophobic in nature which can be resulted into fixation of eugenol benzene ring into the cavity. The allyl group of eugenol remains at outside of cavity which can be resulted into the linear aldehydes as major product instead of isomerisation and branched aldehydes. The natural olefins such as eugenol, anethole, estragole were smoothly converted to the aldehydes with good to excellent yields. The olefins containing various functional groups such as electron withdrawing and donating groups can also be efficiently utilized in hydroformylation reaction giving higher selectivity towards aldehydes as major products. The present protocol gives simple and easy access towards aldehydes which is widely used as raw material in the pharmaceutical industry. Furthermore, the catalyst was found to be reused up to four consecutive cycles with an excellent catalytic activity and selectivity towards the formation of aldehydes as a product. Acknowledgement The author S.A. Jagtap is thankful to the Council of Scientific and Industrial Research (CSIR) India, for providing a Senior Research Fellowship (SRF). Appendix A Supplementary data Supplementary data associated with this article can be found, in the online version, at http://dx.doi.org/10.1016/j.mcat.2017.04.019. Appendix A Supplementary data The following is Supplementary data to this article: References [1] (a) R. Franke D. Selent A. Borner Chem. Rev. 112 2012 5675 5732 (b) A.A. Dabbawala H.C. Bajaj R.V. Jasra J. Mol. Catal. A: Chem. 302 2009 97 106 [2] S.R. Khan M.V. Khedkar Z.S. Qureshi D.B. Bagal B.M. Bhanage Catal. Commun. 15 2011 141 145 [3] (a) M. Vilches-Herrera L. Domke A. Borner ACS Catal. 4 2014 1706 1724 (b) S.A. Jagtap M.A. Bhosale T. Sasaki B.M. Bhanage Polyhedron 120 2016 162 168 [4] (a) K. Dong X. Fang R. Jackstell M. Beller Chem. Commun. 51 2015 5059 5062 (b) Phosphorus (III) Ligands in Homogeneous Catalysis: Design and Synthesis J.A. Gillespie E. Zuidema P.W.N.M. van Leeuwen P.C.J. Kamer 2012 Wiley-VCH Weinheim 1 23 [5] S. Fujita S. Fujisawa B.M. Bhanage Y. Ikushima M. Arai Eur. J. Org. Chem. 13 2004 2881 2887 [6] (a) C. Hou G. Zhao Y. Ji Z. Niu D. Wang Y. Li Nano Res. 7 2014 1364 (b) S. Yu Y.-M. Chie Z.-H. Guan X. Zhang Org. Lett. 10 2008 3469 3472 [7] (a) K.H. Shaughnessy Chem. Rev. 109 2009 643 710 b) R.V. Chaudhari A. Bhattacharya B.M. Bhanage Catal. Today 24 1995 123 133 [8] (a) B. Cornils E.G. Kuntz J. Organomet. Chem. 502 1995 177 186 (b) R.V. Chaudhari B.M. Bhanage R.M. Deshpande H. Delmas Nature 373 1995 501 503 [9] B. Cornils Industrial aqueous biphasic catalysis: status and directions Org. Process. Res. Div. 2 1998 121 127 [10] (a) P. Purwanto H. Delmas Catal. Today 24 1995 135 140 (b) P. Kalck L. Miquel M. Dessoudeix Catal. Today 42 1998 431 440 (c) T. Hamerla A. Rost Y. Kasaka R. Schomacker ChemCatChem 5 2013 1854 1862 [11] (a) T. Hamerla A. Rost Y. Kasaka R. Schomacker ChemCatChem 5 2013 1854 1862 (b) A.T. Straub M. Otto I. Usui B. Breit Adv. Synth. Catal. 355 2013 2071 2075 [12] S.L. Desset S.W. Reader D.J. Cole-Hamilton Green Chem. 11 2009 630 637 [13] F. Hapiot L. Leclercq N. Azaroual S. Fourmentin S. Tilloy E. Monflier Curr. Org. Synth. 5 2008 162 172 [14] (a) H. Ding B.E. Hanson T. Bartik B. Bartik Organometallics 13 1994 3761 3763 (b) M. Ferreira H. Bricout N. Azaroul D. Landy S. Tilloy F. Hapiot E. Monflier Adv. Synth. Catal. 354 2012 1337 1346 (c) M. Ferreira H. Bricout N. Azaroul C. Gaillard D. Landy S. Tilloy E. Monflier Adv. Synth. Catal. 352 2010 1193 1203 [15] J. Boulanger A. Ponchel H. Bricout F. Hapiot E. Monflier Eur. J. Lipid Sci. Technol. 114 2012 1439 1446 [16] F. Hapiot H. Bricout S. Menuel S. Tilloy E. Monflier Catal. Sci. Technol. 4 2014 1899 1908 [17] J. Szejtli Chem. Rev. 98 1998 1743 1754 [18] Gregorio Crini Chem. Rev. 114 2014 10940 10975 [19] G.R. Mallavarapu S. Ramesh R.S. Chandrasekhara Flavour Fragr. J. 10 1995 239 242 [20] (a) S. Paganelli A. Ciappa M. Marchetti A. Scrivanti U. Matteoli J. Mol. Catal. A Chem. 247 2006 138 144 (b) D.H. Grayson Nat. Prod. Rep. 15 1998 449 475 [21] (a) D.H. Grayson Nat. Prod. Rep. 5 1988 419 464 (b) H. Siegel W. Himmele Angew. Chem. Int. Ed. 19 1980 178 183 (c) M.R. Axet S. Castillon C. Claver Inorg. Chim. Acta 359 2006 2973 2979 [22] H. Siegel W. Himmele Angew. Chem. Int. Ed. 19 1980 178 183 [23] A.C. da Silva K.C.B. de Oliveira E.V. Gusevskaya E.N. dos Santos J. Mol. Catal. A: Chem. 179 2002 133 141 [24] P.J. Baricelli M. Rodriguez L.G. Melean M.M. Alonso M. Borusiak M. Rosales B. Gonzalez K.C.B. de Oliveira E.V. Gusevskaya E.N. dos Santos Appl. Catal. A 490 2015 163 169 [25] L.G. Melean M. Rodriguez M. Romero M.L. Alvarado M. Rosales P.J. Baricelli Appl. Catal. A 394 2011 117 123 [26] P.J. Baricelli L.G. Melean M. Rodriguez M. dos Santos M. Rosales E. Escalante J. Chem. Chem. Eng. 7 2013 299 305 [27] (a) P.H. Kalck D.C. Park F. Serein A. Thorex J. Mol. Catal. 36 1986 349 357 (b) L. Kollar E. Farkas J. Batiu J. Mol. Catal. A: Chem. 115 1997 283 288 [28] (a) M. Alhaffar R. Suleiman B. El Ali Catal. Commun. 11 2010 778 782 (b) A.C. da Silva K.C.B. de Oliveira E.V. Gusevskaya E.N. dos Santos J. Mol. Catal. A: Chem. 179 2002 133 141 [29] K.C.B. Oliveira A.G. Santos E.N. dos Santos Appl. Catal. A 445–446 2012 204 208 [30] T. Mathivet C. Meliet Y. Castanet A. Mortreux L. Caron S. Tilloy E. Monflier J. Mol. Catal. A: Chem. 176 2001 105 116 [31] M. Ferreira H. Bricout S. Tilloy E. Monflier Molecules 22 2017 140 [32] E. Monflier H. Bricout F. Hapiot S. Tilloy A. Aghmiz A.M. Masdeu-Bultó Adv. Synth. Catal. 346 2004 425 431",
      "scopus-id": "85029627423",
      "coredata": {
        "eid": "1-s2.0-S2468823117302262",
        "dc:description": "A Rh/TPPTS catalyzed aqueous biphasic hydroformylation of eugenol was performed in an aqueous medium in the presence of different modified cyclodextrins. The internal olefin such as anethole shows high selectivity towards the branched aldehydes (78%) where as terminal alkene like eugenol shows high selectivity towards the linear aldehydes (87%). The various reaction parameters such as effect of syngas pressure, time, temperature, catalyst precursor and loading have been studied. The high activity and high selectivity towards the linear aldehydes is due to the steric crowding of methyl group present in RAME-β-cyclodextrins. The effect of ratio of Rh/TPPTS/RAME-β-CD were also studied for the hydroformylation of eugenol. Moreover, this catalytic system was recycled up to four consecutive cycles without loss in its catalytic activity and selectivity.",
        "openArchiveArticle": "false",
        "prism:coverDate": "2017-07-31",
        "openaccessUserLicense": null,
        "prism:aggregationType": "Journal",
        "prism:url": "https://api.elsevier.com/content/article/pii/S2468823117302262",
        "dc:creator": [
          {
            "@_fa": "true",
            "$": "Jagtap, Samadhan A."
          },
          {
            "@_fa": "true",
            "$": "Monflier, Eric"
          },
          {
            "@_fa": "true",
            "$": "Ponchel, Anne"
          },
          {
            "@_fa": "true",
            "$": "Bhanage, Bhalchandra M."
          }
        ],
        "link": [
          {
            "@_fa": "true",
            "@rel": "self",
            "@href": "https://api.elsevier.com/content/article/pii/S2468823117302262"
          },
          {
            "@_fa": "true",
            "@rel": "scidir",
            "@href": "https://www.sciencedirect.com/science/article/pii/S2468823117302262"
          }
        ],
        "dc:format": "application/json",
        "openaccessType": null,
        "pii": "S2468-8231(17)30226-2",
        "prism:volume": "436",
        "prism:publisher": "Elsevier B.V.",
        "dc:title": "Highly regio-selective hydroformylation of biomass derived eugenol using aqueous biphasic Rh/TPPTS/CDs as a greener and recyclable catalyst",
        "prism:copyright": "© 2017 Elsevier B.V. All rights reserved.",
        "openaccess": "0",
        "prism:issn": "24688231",
        "dcterms:subject": [
          {
            "@_fa": "true",
            "$": "Biphasic catalysis rhodium"
          },
          {
            "@_fa": "true",
            "$": "TPPTS"
          },
          {
            "@_fa": "true",
            "$": "Cyclodextrins"
          },
          {
            "@_fa": "true",
            "$": "Hydroformylation"
          },
          {
            "@_fa": "true",
            "$": "Eugenol"
          }
        ],
        "openaccessArticle": "false",
        "prism:publicationName": "Molecular Catalysis",
        "openaccessSponsorType": null,
        "prism:pageRange": "157-163",
        "prism:endingPage": "163",
        "pubType": "fla",
        "prism:coverDisplayDate": "July 2017",
        "prism:doi": "10.1016/j.mcat.2017.04.019",
        "prism:startingPage": "157",
        "dc:identifier": "doi:10.1016/j.mcat.2017.04.019",
        "openaccessSponsorName": null
      },
      "objects": {
        "object": [
          {
            "@category": "thumbnail",
            "@height": "164",
            "@width": "201",
            "@_fa": "true",
            "$": "https://api.elsevier.com/content/object/eid/1-s2.0-S2468823117302262-fx1.sml?httpAccept=%2A%2F%2A",
            "@multimediatype": "GIF image file",
            "@type": "IMAGE-THUMBNAIL",
            "@size": "4391",
            "@ref": "fx1",
            "@mimetype": "image/gif"
          },
          {
            "@category": "thumbnail",
            "@height": "164",
            "@width": "201",
            "@_fa": "true",
            "$": "https://api.elsevier.com/content/object/eid/1-s2.0-S2468823117302262-fx2.sml?httpAccept=%2A%2F%2A",
            "@multimediatype": "GIF image file",
            "@type": "IMAGE-THUMBNAIL",
            "@size": "6351",
            "@ref": "fx2",
            "@mimetype": "image/gif"
          },
          {
            "@category": "thumbnail",
            "@height": "148",
            "@width": "219",
            "@_fa": "true",
            "$": "https://api.elsevier.com/content/object/eid/1-s2.0-S2468823117302262-gr1.sml?httpAccept=%2A%2F%2A",
            "@multimediatype": "GIF image file",
            "@type": "IMAGE-THUMBNAIL",
            "@size": "6393",
            "@ref": "gr1",
            "@mimetype": "image/gif"
          },
          {
            "@category": "thumbnail",
            "@height": "86",
            "@width": "219",
            "@_fa": "true",
            "$": "https://api.elsevier.com/content/object/eid/1-s2.0-S2468823117302262-gr2.sml?httpAccept=%2A%2F%2A",
            "@multimediatype": "GIF image file",
            "@type": "IMAGE-THUMBNAIL",
            "@size": "3909",
            "@ref": "gr2",
            "@mimetype": "image/gif"
          },
          {
            "@category": "thumbnail",
            "@height": "109",
            "@width": "219",
            "@_fa": "true",
            "$": "https://api.elsevier.com/content/object/eid/1-s2.0-S2468823117302262-gr3.sml?httpAccept=%2A%2F%2A",
            "@multimediatype": "GIF image file",
            "@type": "IMAGE-THUMBNAIL",
            "@size": "5273",
            "@ref": "gr3",
            "@mimetype": "image/gif"
          },
          {
            "@category": "thumbnail",
            "@height": "68",
            "@width": "219",
            "@_fa": "true",
            "$": "https://api.elsevier.com/content/object/eid/1-s2.0-S2468823117302262-sc1.sml?httpAccept=%2A%2F%2A",
            "@multimediatype": "GIF image file",
            "@type": "IMAGE-THUMBNAIL",
            "@size": "3236",
            "@ref": "sc1",
            "@mimetype": "image/gif"
          },
          {
            "@category": "thumbnail",
            "@height": "85",
            "@width": "219",
            "@_fa": "true",
            "$": "https://api.elsevier.com/content/object/eid/1-s2.0-S2468823117302262-sc2.sml?httpAccept=%2A%2F%2A",
            "@multimediatype": "GIF image file",
            "@type": "IMAGE-THUMBNAIL",
            "@size": "4257",
            "@ref": "sc2",
            "@mimetype": "image/gif"
          },
          {
            "@category": "standard",
            "@height": "245",
            "@width": "301",
            "@_fa": "true",
            "$": "https://api.elsevier.com/content/object/eid/1-s2.0-S2468823117302262-fx1.jpg?httpAccept=%2A%2F%2A",
            "@multimediatype": "JPEG image file",
            "@type": "IMAGE-DOWNSAMPLED",
            "@size": "10419",
            "@ref": "fx1",
            "@mimetype": "image/jpeg"
          },
          {
            "@category": "standard",
            "@height": "245",
            "@width": "301",
            "@_fa": "true",
            "$": "https://api.elsevier.com/content/object/eid/1-s2.0-S2468823117302262-fx2.jpg?httpAccept=%2A%2F%2A",
            "@multimediatype": "JPEG image file",
            "@type": "IMAGE-DOWNSAMPLED",
            "@size": "13012",
            "@ref": "fx2",
            "@mimetype": "image/jpeg"
          },
          {
            "@category": "standard",
            "@height": "257",
            "@width": "379",
            "@_fa": "true",
            "$": "https://api.elsevier.com/content/object/eid/1-s2.0-S2468823117302262-gr1.jpg?httpAccept=%2A%2F%2A",
            "@multimediatype": "JPEG image file",
            "@type": "IMAGE-DOWNSAMPLED",
            "@size": "17157",
            "@ref": "gr1",
            "@mimetype": "image/jpeg"
          },
          {
            "@category": "standard",
            "@height": "295",
            "@width": "753",
            "@_fa": "true",
            "$": "https://api.elsevier.com/content/object/eid/1-s2.0-S2468823117302262-gr2.jpg?httpAccept=%2A%2F%2A",
            "@multimediatype": "JPEG image file",
            "@type": "IMAGE-DOWNSAMPLED",
            "@size": "35796",
            "@ref": "gr2",
            "@mimetype": "image/jpeg"
          },
          {
            "@category": "standard",
            "@height": "299",
            "@width": "602",
            "@_fa": "true",
            "$": "https://api.elsevier.com/content/object/eid/1-s2.0-S2468823117302262-gr3.jpg?httpAccept=%2A%2F%2A",
            "@multimediatype": "JPEG image file",
            "@type": "IMAGE-DOWNSAMPLED",
            "@size": "34966",
            "@ref": "gr3",
            "@mimetype": "image/jpeg"
          },
          {
            "@category": "standard",
            "@height": "223",
            "@width": "715",
            "@_fa": "true",
            "$": "https://api.elsevier.com/content/object/eid/1-s2.0-S2468823117302262-sc1.jpg?httpAccept=%2A%2F%2A",
            "@multimediatype": "JPEG image file",
            "@type": "IMAGE-DOWNSAMPLED",
            "@size": "34502",
            "@ref": "sc1",
            "@mimetype": "image/jpeg"
          },
          {
            "@category": "standard",
            "@height": "276",
            "@width": "715",
            "@_fa": "true",
            "$": "https://api.elsevier.com/content/object/eid/1-s2.0-S2468823117302262-sc2.jpg?httpAccept=%2A%2F%2A",
            "@multimediatype": "JPEG image file",
            "@type": "IMAGE-DOWNSAMPLED",
            "@size": "41527",
            "@ref": "sc2",
            "@mimetype": "image/jpeg"
          },
          {
            "@category": "standard",
            "@_fa": "true",
            "$": "https://api.elsevier.com/content/object/eid/1-s2.0-S2468823117302262-mmc1.docx?httpAccept=%2A%2F%2A",
            "@multimediatype": "Microsoft Word file",
            "@type": "APPLICATION",
            "@size": "136931",
            "@ref": "mmc1",
            "@mimetype": "application/word"
          }
        ]
      },
      "link": {
        "@rel": "abstract",
        "@href": "https://api.elsevier.com/content/abstract/scopus_id/85029627423"
      }
    }
  }
}