{
  "metadata": {
    "title": "Synergistic catalysis of hypercrosslinked ionic polymers with multi-ionic sites for conversion of CO<ce:inf loc=post>2</ce:inf> to cyclic carbonates",
    "authors": "; ; ",
    "journal": "Molecular Catalysis",
    "date": "2023-01-15",
    "doi": "10.1016/j.mcat.2022.112834",
    "abstract": "",
    "uri": "https://api.elsevier.com/content/article/pii/S2468823122007209",
    "pii": "S2468823122007209"
  },
  "fulltext": {
    "full-text-retrieval-response": {
      "scopus-eid": "2-s2.0-85142799166",
      "originalText": "serial JL 315758 291210 291744 291790 291809 31 Molecular Catalysis MOLECULARCATALYSIS 2022-11-28 2022-11-28 2022-11-28 2022-11-28 2023-01-07T15:56:45 1-s2.0-S2468823122007209 S2468-8231(22)00720-9 S2468823122007209 10.1016/j.mcat.2022.112834 S300 S300.1 FULL-TEXT 1-s2.0-S2468823122X00187 2024-06-26T17:47:57.840046Z 0 0 20230115 2023 2022-11-28T18:55:23.88024Z absattachment articleinfo articlenumber articletitlenorm authfirstinitialnorm authfirstsurnamenorm cid cids contenttype copyright crossmark dateloaded dateloadedtxt datesearch datesort dateupdated dco docsubtype doctype doi eid ewtransactionid hubeid indexeddate issn issnnorm itemstage itemtransactionid itemweight openaccess openarchive pg pgfirst pii piinorm pubdatestart pubdatetxt pubyr sectiontitle sortorder srctitle srctitlenorm srctype ssids alllist content subj subheadings suppl tomb volfirst volissue volumelist webpdf webpdfpagecount yearnav figure table e-component body acknowledge affil appendices articletitle auth authfirstini authfull authkeywords authlast grantnumber grantsponsor grantsponsorid highlightsabst orcid primabst ref specialabst 2468-8231 24688231 true 535 535 C Volume 535 8 112834 112834 112834 20230115 15 January 2023 2023-01-15 2023 Regular Papers article fla © 2022 Elsevier B.V. All rights reserved. SYNERGISTICCATALYSISHYPERCROSSLINKEDIONICPOLYMERSMULTIIONICSITESFORCONVERSIONCO2CYCLICCARBONATES LIAO X 1 Introduction 2 Experimental section 2.1 Synthesis of N,N,N,N-(4-Bromo-buthyl)-triethyl-ammonium bromide (QA) 2.2 Synthesis of HBIM(x) 2.3 Synthesis of HBIM(x)@QA 2.4 Synthesis of HBIM(x)@QA-Br 2.5 General catalytic procedure for CO2 cycloaddition with epoxides 3 Result and discussion 3.1 Characterization of the polymers 3.2 Catalytic evaluation 3.3 Understanding the catalytic process 4 Conclusions CRediT authorship contribution statement Acknowledgements Appendix Supplementary materials References ZHANG 2014 2868 2899 Z SANZPEREZ 2016 11840 11876 E KIRCHNER 2016 401 402 B ARTZ 2017 434 504 J ARESTA 2014 1709 1742 M ZHOU 2019 9387 9398 Y XU 2015 108 122 B WANG 2015 6916 6924 X CHEN 2016 6493 6500 J SAKAKURA 2007 2365 2387 T Y 2020 101301 Z BEZERRA 2022 112632 W COMIN 2022 112624 E QU 2021 2494 2503 Y ALVES 2017 2651 2684 M MA 2012 2410 2420 J THARUN 2013 1673 1677 J YANG 2021 111733 H CHEN 2021 16210 16219 J ZHANG 2022 33 40 H DING 2018 3194 3201 M ULLAH 2022 752 761 N XIONG 2022 111601 L FENG 2022 124853 B SONG 2019 9489 H QIU 2022 112171 Y XIE 2018 6660 6666 Y YU 2022 136275 Q DU 2022 112164 Y LAN 2021 3085 3095 J LUO 2021 25731 25749 R LYU 2022 12989 12995 H ZHAO 2022 111526 Y SAMY 2022 137158 M AHMAD 2020 23333 23370 M TAN 2015 530 540 L LIAO 2022 2846 2857 X KIM 2020 527 534 D LIAO 2022 62 X LIU 2022 131633 C LI 2017 2675 2686 J SANG 2020 123973 Y WANG 2015 15708 15711 J SONG 2021 2115 2128 H LI 2020 676 684 J PUTHIARAJ 2019 195 205 P LOMBARDO 2008 11288 11291 M ZHANG 2014 4767 4774 W MEN 2011 15244 15255 S SONG 2016 2187 2197 K CHEN 2018 9172 9182 Y DAI 2017 1186 1192 Z ZHANG 2019 1030 1038 W DONG 2016 7082 7085 B XIE 2017 25594 25600 Y JIA 2020 124652 D LIAOX2023X112834 LIAOX2023X112834XX 2024-11-28T00:00:00.000Z 2024-11-28T00:00:00.000Z http://creativecommons.org/licenses/by-nc-nd/4.0/ © 2022 Elsevier B.V. All rights reserved. 2022-12-02T01:53:18.237Z http://vtw.elsevier.com/data/voc/AddOnTypes/50.7/aggregated-refined National Natural Science Foundation of China 21246008 21803021 NSFC National Natural Science Foundation of China http://data.elsevier.com/vocabulary/SciValFunders/501100001809 http://sws.geonames.org/1814991/ Natural Science Foundation of Fujian Province 2020J01065 Natural Science Foundation of Fujian Province http://data.elsevier.com/vocabulary/SciValFunders/501100003392 http://sws.geonames.org/1814991/ This work was supported by the National Natural Science Foundation of China ( 21803021 , 21246008 ), the Natural Science Foundation of Fujian Province ( 2020J01065 ). 0 https://doi.org/10.15223/policy-017 https://doi.org/10.15223/policy-037 https://doi.org/10.15223/policy-012 https://doi.org/10.15223/policy-029 https://doi.org/10.15223/policy-004 item S2468-8231(22)00720-9 S2468823122007209 1-s2.0-S2468823122007209 10.1016/j.mcat.2022.112834 315758 2023-01-07T16:15:48.580654Z 2023-01-15 1-s2.0-S2468823122007209-main.pdf https://s3-eu-west-1.amazonaws.com/prod-ucs-content-store-eu-west/content/pii:S2468823122007209/MAIN/application/pdf/2fe0fda1ff371ef76839e826fca9ab65/main.pdf main.pdf pdf true 8108957 MAIN 11 1-s2.0-S2468823122007209-main_1.png https://s3-eu-west-1.amazonaws.com/prod-ucs-content-store-eu-west/content/pii:S2468823122007209/PREVIEW/image/png/d6c1f885ba1ea29e66131aa0dae6206f/main_1.png main_1.png png 58276 849 656 IMAGE-WEB-PDF 1 1-s2.0-S2468823122007209-gr8.jpg https://s3-eu-west-1.amazonaws.com/prod-ucs-content-store-eu-west/content/pii:S2468823122007209/gr8/DOWNSAMPLED/image/jpeg/62360f7733471042480dc1b97141f204/gr8.jpg gr8 gr8.jpg jpg 67609 408 546 IMAGE-DOWNSAMPLED 1-s2.0-S2468823122007209-gr7.jpg https://s3-eu-west-1.amazonaws.com/prod-ucs-content-store-eu-west/content/pii:S2468823122007209/gr7/DOWNSAMPLED/image/jpeg/8ddd86fb04882bfcdde37cf2609ca5a5/gr7.jpg gr7 gr7.jpg jpg 30614 288 359 IMAGE-DOWNSAMPLED 1-s2.0-S2468823122007209-gr6.jpg https://s3-eu-west-1.amazonaws.com/prod-ucs-content-store-eu-west/content/pii:S2468823122007209/gr6/DOWNSAMPLED/image/jpeg/04b89d43e77901d97a21822e216869f4/gr6.jpg gr6 gr6.jpg jpg 99216 470 677 IMAGE-DOWNSAMPLED 1-s2.0-S2468823122007209-gr5.jpg https://s3-eu-west-1.amazonaws.com/prod-ucs-content-store-eu-west/content/pii:S2468823122007209/gr5/DOWNSAMPLED/image/jpeg/8045b3b7f4ab45ddaa74d6fb06ab7fc8/gr5.jpg gr5 gr5.jpg jpg 76403 258 675 IMAGE-DOWNSAMPLED 1-s2.0-S2468823122007209-gr4.jpg https://s3-eu-west-1.amazonaws.com/prod-ucs-content-store-eu-west/content/pii:S2468823122007209/gr4/DOWNSAMPLED/image/jpeg/1fbe70315164cc38a4524315791837ab/gr4.jpg gr4 gr4.jpg jpg 86355 260 666 IMAGE-DOWNSAMPLED 1-s2.0-S2468823122007209-gr3.jpg https://s3-eu-west-1.amazonaws.com/prod-ucs-content-store-eu-west/content/pii:S2468823122007209/gr3/DOWNSAMPLED/image/jpeg/b9aa4f8e2e7d0066e39de6d3c4e21fe8/gr3.jpg gr3 gr3.jpg jpg 130690 458 715 IMAGE-DOWNSAMPLED 1-s2.0-S2468823122007209-gr2.jpg https://s3-eu-west-1.amazonaws.com/prod-ucs-content-store-eu-west/content/pii:S2468823122007209/gr2/DOWNSAMPLED/image/jpeg/d5d852b093d0abf603e4c26fb41fe2de/gr2.jpg gr2 gr2.jpg jpg 144308 559 715 IMAGE-DOWNSAMPLED 1-s2.0-S2468823122007209-fx9.jpg https://s3-eu-west-1.amazonaws.com/prod-ucs-content-store-eu-west/content/pii:S2468823122007209/fx9/DOWNSAMPLED/image/jpeg/57eb8452e03b97991f4bfdb6069b4e78/fx9.jpg fx9 fx9.jpg jpg 1607 36 117 IMAGE-DOWNSAMPLED 1-s2.0-S2468823122007209-gr1.jpg https://s3-eu-west-1.amazonaws.com/prod-ucs-content-store-eu-west/content/pii:S2468823122007209/gr1/DOWNSAMPLED/image/jpeg/751d68a07271bbfd9cddddc2863bb78d/gr1.jpg gr1 gr1.jpg jpg 142858 552 715 IMAGE-DOWNSAMPLED 1-s2.0-S2468823122007209-fx8.jpg https://s3-eu-west-1.amazonaws.com/prod-ucs-content-store-eu-west/content/pii:S2468823122007209/fx8/DOWNSAMPLED/image/jpeg/32ff14c656a8da2d330c40f682bba555/fx8.jpg fx8 fx8.jpg jpg 3079 93 133 IMAGE-DOWNSAMPLED 1-s2.0-S2468823122007209-fx7.jpg https://s3-eu-west-1.amazonaws.com/prod-ucs-content-store-eu-west/content/pii:S2468823122007209/fx7/DOWNSAMPLED/image/jpeg/f423370a833492ea0a31e8de3d1d4074/fx7.jpg fx7 fx7.jpg jpg 2291 66 119 IMAGE-DOWNSAMPLED 1-s2.0-S2468823122007209-fx6.jpg https://s3-eu-west-1.amazonaws.com/prod-ucs-content-store-eu-west/content/pii:S2468823122007209/fx6/DOWNSAMPLED/image/jpeg/da7fe547bfcf42959f5e4489910a3265/fx6.jpg fx6 fx6.jpg jpg 2749 92 127 IMAGE-DOWNSAMPLED 1-s2.0-S2468823122007209-fx5.jpg https://s3-eu-west-1.amazonaws.com/prod-ucs-content-store-eu-west/content/pii:S2468823122007209/fx5/DOWNSAMPLED/image/jpeg/2b75219b595aec0754d562f8b80a70ff/fx5.jpg fx5 fx5.jpg jpg 1999 64 116 IMAGE-DOWNSAMPLED 1-s2.0-S2468823122007209-sc2.jpg https://s3-eu-west-1.amazonaws.com/prod-ucs-content-store-eu-west/content/pii:S2468823122007209/sc2/DOWNSAMPLED/image/jpeg/755b25da27bd0f09341302f64e750e07/sc2.jpg sc2 sc2.jpg jpg 41159 320 391 IMAGE-DOWNSAMPLED 1-s2.0-S2468823122007209-fx4.jpg https://s3-eu-west-1.amazonaws.com/prod-ucs-content-store-eu-west/content/pii:S2468823122007209/fx4/DOWNSAMPLED/image/jpeg/b5430e5ce8b8a0dde29e2e4789872faf/fx4.jpg fx4 fx4.jpg jpg 2491 92 93 IMAGE-DOWNSAMPLED 1-s2.0-S2468823122007209-sc1.jpg https://s3-eu-west-1.amazonaws.com/prod-ucs-content-store-eu-west/content/pii:S2468823122007209/sc1/DOWNSAMPLED/image/jpeg/931cf20cb5d3b81cef3148adab9bbb9f/sc1.jpg sc1 sc1.jpg jpg 46017 205 677 IMAGE-DOWNSAMPLED 1-s2.0-S2468823122007209-fx3.jpg https://s3-eu-west-1.amazonaws.com/prod-ucs-content-store-eu-west/content/pii:S2468823122007209/fx3/DOWNSAMPLED/image/jpeg/6cd5ed87e71fa12b2e924163d54567ea/fx3.jpg fx3 fx3.jpg jpg 1681 66 79 IMAGE-DOWNSAMPLED 1-s2.0-S2468823122007209-fx2.jpg https://s3-eu-west-1.amazonaws.com/prod-ucs-content-store-eu-west/content/pii:S2468823122007209/fx2/DOWNSAMPLED/image/jpeg/58c972ea155a84aeb6799f5c62618de2/fx2.jpg fx2 fx2.jpg jpg 1891 58 84 IMAGE-DOWNSAMPLED 1-s2.0-S2468823122007209-fx1.jpg https://s3-eu-west-1.amazonaws.com/prod-ucs-content-store-eu-west/content/pii:S2468823122007209/fx1/DOWNSAMPLED/image/jpeg/e9e4b656096c8a0d6ab884557ac79a50/fx1.jpg fx1 fx1.jpg jpg 1146 35 67 IMAGE-DOWNSAMPLED 1-s2.0-S2468823122007209-ga1.jpg https://s3-eu-west-1.amazonaws.com/prod-ucs-content-store-eu-west/content/pii:S2468823122007209/ga1/DOWNSAMPLED/image/jpeg/b3a3341bf31d0ecb077d177480c81db3/ga1.jpg ga1 true ga1.jpg jpg 32943 174 301 IMAGE-DOWNSAMPLED 1-s2.0-S2468823122007209-fx15.jpg https://s3-eu-west-1.amazonaws.com/prod-ucs-content-store-eu-west/content/pii:S2468823122007209/fx15/DOWNSAMPLED/image/jpeg/1cf417c4fe64f17ae8db8cc3b4ce65b1/fx15.jpg fx15 fx15.jpg jpg 1760 43 134 IMAGE-DOWNSAMPLED 1-s2.0-S2468823122007209-fx14.jpg https://s3-eu-west-1.amazonaws.com/prod-ucs-content-store-eu-west/content/pii:S2468823122007209/fx14/DOWNSAMPLED/image/jpeg/cc4d2fe7a308f0a7a4fefdf28d5b1107/fx14.jpg fx14 fx14.jpg jpg 2592 53 154 IMAGE-DOWNSAMPLED 1-s2.0-S2468823122007209-fx17.jpg https://s3-eu-west-1.amazonaws.com/prod-ucs-content-store-eu-west/content/pii:S2468823122007209/fx17/DOWNSAMPLED/image/jpeg/c1084db6009a8ebd01438dcc0ffd74a9/fx17.jpg fx17 fx17.jpg jpg 1521 52 70 IMAGE-DOWNSAMPLED 1-s2.0-S2468823122007209-fx16.jpg https://s3-eu-west-1.amazonaws.com/prod-ucs-content-store-eu-west/content/pii:S2468823122007209/fx16/DOWNSAMPLED/image/jpeg/1d23f917d20537b4cbd97295a89fa18f/fx16.jpg fx16 fx16.jpg jpg 2833 82 155 IMAGE-DOWNSAMPLED 1-s2.0-S2468823122007209-fx11.jpg https://s3-eu-west-1.amazonaws.com/prod-ucs-content-store-eu-west/content/pii:S2468823122007209/fx11/DOWNSAMPLED/image/jpeg/41e04fb62ba92bcd4ddc7021576e3a7d/fx11.jpg fx11 fx11.jpg jpg 1476 39 102 IMAGE-DOWNSAMPLED 1-s2.0-S2468823122007209-fx10.jpg https://s3-eu-west-1.amazonaws.com/prod-ucs-content-store-eu-west/content/pii:S2468823122007209/fx10/DOWNSAMPLED/image/jpeg/502fcf6f238d2bc00c620bdb905e9850/fx10.jpg fx10 fx10.jpg jpg 2253 62 136 IMAGE-DOWNSAMPLED 1-s2.0-S2468823122007209-fx13.jpg https://s3-eu-west-1.amazonaws.com/prod-ucs-content-store-eu-west/content/pii:S2468823122007209/fx13/DOWNSAMPLED/image/jpeg/811b30e8d79930e8e3a2ef3b219ab338/fx13.jpg fx13 fx13.jpg jpg 1840 35 141 IMAGE-DOWNSAMPLED 1-s2.0-S2468823122007209-fx12.jpg https://s3-eu-west-1.amazonaws.com/prod-ucs-content-store-eu-west/content/pii:S2468823122007209/fx12/DOWNSAMPLED/image/jpeg/c89d14c8631e2ba61ffb2a6ea3c77a10/fx12.jpg fx12 fx12.jpg jpg 2428 66 123 IMAGE-DOWNSAMPLED 1-s2.0-S2468823122007209-fx18.jpg https://s3-eu-west-1.amazonaws.com/prod-ucs-content-store-eu-west/content/pii:S2468823122007209/fx18/DOWNSAMPLED/image/jpeg/2370d949fd1b7ea559acde9ce225a167/fx18.jpg fx18 fx18.jpg jpg 2138 52 113 IMAGE-DOWNSAMPLED 1-s2.0-S2468823122007209-gr8.sml https://s3-eu-west-1.amazonaws.com/prod-ucs-content-store-eu-west/content/pii:S2468823122007209/gr8/THUMBNAIL/image/gif/d06b358f398faa7c7f72cef98626c4a8/gr8.sml gr8 gr8.sml sml 17347 164 219 IMAGE-THUMBNAIL 1-s2.0-S2468823122007209-gr7.sml https://s3-eu-west-1.amazonaws.com/prod-ucs-content-store-eu-west/content/pii:S2468823122007209/gr7/THUMBNAIL/image/gif/789b5887c21e0b9ee41a4d32bc83e6ea/gr7.sml gr7 gr7.sml sml 9508 163 204 IMAGE-THUMBNAIL 1-s2.0-S2468823122007209-gr6.sml https://s3-eu-west-1.amazonaws.com/prod-ucs-content-store-eu-west/content/pii:S2468823122007209/gr6/THUMBNAIL/image/gif/eebbdfea87546809fcfcf6b0a21cdc60/gr6.sml gr6 gr6.sml sml 11035 152 219 IMAGE-THUMBNAIL 1-s2.0-S2468823122007209-gr5.sml https://s3-eu-west-1.amazonaws.com/prod-ucs-content-store-eu-west/content/pii:S2468823122007209/gr5/THUMBNAIL/image/gif/8baee6879f7e1c62041e1fd9da68c49b/gr5.sml gr5 gr5.sml sml 10854 84 219 IMAGE-THUMBNAIL 1-s2.0-S2468823122007209-gr4.sml https://s3-eu-west-1.amazonaws.com/prod-ucs-content-store-eu-west/content/pii:S2468823122007209/gr4/THUMBNAIL/image/gif/3d9e3cad8721ff2c791bbfee8fa7f4a9/gr4.sml gr4 gr4.sml sml 11615 86 219 IMAGE-THUMBNAIL 1-s2.0-S2468823122007209-gr3.sml https://s3-eu-west-1.amazonaws.com/prod-ucs-content-store-eu-west/content/pii:S2468823122007209/gr3/THUMBNAIL/image/gif/f29c8a720cd07700307c51cb349fcca7/gr3.sml gr3 gr3.sml sml 19783 140 219 IMAGE-THUMBNAIL 1-s2.0-S2468823122007209-gr2.sml https://s3-eu-west-1.amazonaws.com/prod-ucs-content-store-eu-west/content/pii:S2468823122007209/gr2/THUMBNAIL/image/gif/e85923cb008eb3d24e711655c0ee0539/gr2.sml gr2 gr2.sml sml 15862 164 210 IMAGE-THUMBNAIL 1-s2.0-S2468823122007209-fx9.sml https://s3-eu-west-1.amazonaws.com/prod-ucs-content-store-eu-west/content/pii:S2468823122007209/fx9/THUMBNAIL/image/gif/72a780e3078f5a48f88b315db106bae7/fx9.sml fx9 fx9.sml sml 2614 68 219 IMAGE-THUMBNAIL 1-s2.0-S2468823122007209-gr1.sml https://s3-eu-west-1.amazonaws.com/prod-ucs-content-store-eu-west/content/pii:S2468823122007209/gr1/THUMBNAIL/image/gif/61a7da882053398136b925eff927c09a/gr1.sml gr1 gr1.sml sml 16257 164 212 IMAGE-THUMBNAIL 1-s2.0-S2468823122007209-fx8.sml https://s3-eu-west-1.amazonaws.com/prod-ucs-content-store-eu-west/content/pii:S2468823122007209/fx8/THUMBNAIL/image/gif/76bc0db12d731e7687c7a816b798339b/fx8.sml fx8 fx8.sml sml 3937 154 219 IMAGE-THUMBNAIL 1-s2.0-S2468823122007209-fx7.sml https://s3-eu-west-1.amazonaws.com/prod-ucs-content-store-eu-west/content/pii:S2468823122007209/fx7/THUMBNAIL/image/gif/a48acde0ff543369291043276631b110/fx7.sml fx7 fx7.sml sml 3461 122 219 IMAGE-THUMBNAIL 1-s2.0-S2468823122007209-fx6.sml https://s3-eu-west-1.amazonaws.com/prod-ucs-content-store-eu-west/content/pii:S2468823122007209/fx6/THUMBNAIL/image/gif/f5e867fd75da3b599673e7628c07e6ef/fx6.sml fx6 fx6.sml sml 3994 159 219 IMAGE-THUMBNAIL 1-s2.0-S2468823122007209-fx5.sml https://s3-eu-west-1.amazonaws.com/prod-ucs-content-store-eu-west/content/pii:S2468823122007209/fx5/THUMBNAIL/image/gif/5863dd92158d7d4b6e6a52e9106bab11/fx5.sml fx5 fx5.sml sml 3250 121 219 IMAGE-THUMBNAIL 1-s2.0-S2468823122007209-sc2.sml https://s3-eu-west-1.amazonaws.com/prod-ucs-content-store-eu-west/content/pii:S2468823122007209/sc2/THUMBNAIL/image/gif/ad6aa84ec695883b274f3de8f1433cec/sc2.sml sc2 sc2.sml sml 10003 164 200 IMAGE-THUMBNAIL 1-s2.0-S2468823122007209-fx4.sml https://s3-eu-west-1.amazonaws.com/prod-ucs-content-store-eu-west/content/pii:S2468823122007209/fx4/THUMBNAIL/image/gif/b3740dda9c3683ae93a923be7a5c20ed/fx4.sml fx4 fx4.sml sml 3729 164 165 IMAGE-THUMBNAIL 1-s2.0-S2468823122007209-sc1.sml https://s3-eu-west-1.amazonaws.com/prod-ucs-content-store-eu-west/content/pii:S2468823122007209/sc1/THUMBNAIL/image/gif/0c8e51c65a8c645d4a13bafcaf577b70/sc1.sml sc1 sc1.sml sml 7347 66 219 IMAGE-THUMBNAIL 1-s2.0-S2468823122007209-fx3.sml https://s3-eu-west-1.amazonaws.com/prod-ucs-content-store-eu-west/content/pii:S2468823122007209/fx3/THUMBNAIL/image/gif/9d89d00181ca95d017e416aca1e44a92/fx3.sml fx3 fx3.sml sml 3889 164 196 IMAGE-THUMBNAIL 1-s2.0-S2468823122007209-fx2.sml https://s3-eu-west-1.amazonaws.com/prod-ucs-content-store-eu-west/content/pii:S2468823122007209/fx2/THUMBNAIL/image/gif/e3b2afaa74ad43340b4cfff95728b490/fx2.sml fx2 fx2.sml sml 4392 152 219 IMAGE-THUMBNAIL 1-s2.0-S2468823122007209-fx1.sml https://s3-eu-west-1.amazonaws.com/prod-ucs-content-store-eu-west/content/pii:S2468823122007209/fx1/THUMBNAIL/image/gif/2437b54e054dd1d02af5c5564bbf702a/fx1.sml fx1 fx1.sml sml 3608 116 219 IMAGE-THUMBNAIL 1-s2.0-S2468823122007209-ga1.sml https://s3-eu-west-1.amazonaws.com/prod-ucs-content-store-eu-west/content/pii:S2468823122007209/ga1/THUMBNAIL/image/gif/203049b3af80b2c55afa0901274e6e9e/ga1.sml ga1 true ga1.sml sml 14676 127 219 IMAGE-THUMBNAIL 1-s2.0-S2468823122007209-fx15.sml https://s3-eu-west-1.amazonaws.com/prod-ucs-content-store-eu-west/content/pii:S2468823122007209/fx15/THUMBNAIL/image/gif/63ee3a6ad6bad7c132472ab307cf331b/fx15.sml fx15 fx15.sml sml 2398 70 219 IMAGE-THUMBNAIL 1-s2.0-S2468823122007209-fx14.sml https://s3-eu-west-1.amazonaws.com/prod-ucs-content-store-eu-west/content/pii:S2468823122007209/fx14/THUMBNAIL/image/gif/4566019d1ceff573a8d9fa7d97b741c1/fx14.sml fx14 fx14.sml sml 2785 76 219 IMAGE-THUMBNAIL 1-s2.0-S2468823122007209-fx17.sml https://s3-eu-west-1.amazonaws.com/prod-ucs-content-store-eu-west/content/pii:S2468823122007209/fx17/THUMBNAIL/image/gif/1c7175f00e6d520777d37309f61de949/fx17.sml fx17 fx17.sml sml 4194 163 219 IMAGE-THUMBNAIL 1-s2.0-S2468823122007209-fx16.sml https://s3-eu-west-1.amazonaws.com/prod-ucs-content-store-eu-west/content/pii:S2468823122007209/fx16/THUMBNAIL/image/gif/2780312975bac94ddc7517adaa3abb02/fx16.sml fx16 fx16.sml sml 3002 116 219 IMAGE-THUMBNAIL 1-s2.0-S2468823122007209-fx11.sml https://s3-eu-west-1.amazonaws.com/prod-ucs-content-store-eu-west/content/pii:S2468823122007209/fx11/THUMBNAIL/image/gif/bb21ae76de4753fd05a0f4f6a781670c/fx11.sml fx11 fx11.sml sml 2988 84 219 IMAGE-THUMBNAIL 1-s2.0-S2468823122007209-fx10.sml https://s3-eu-west-1.amazonaws.com/prod-ucs-content-store-eu-west/content/pii:S2468823122007209/fx10/THUMBNAIL/image/gif/a66f6a5cc9c9f3dfc068b4738d1d180e/fx10.sml fx10 fx10.sml sml 3093 99 219 IMAGE-THUMBNAIL 1-s2.0-S2468823122007209-fx13.sml https://s3-eu-west-1.amazonaws.com/prod-ucs-content-store-eu-west/content/pii:S2468823122007209/fx13/THUMBNAIL/image/gif/c7ccbe8e703496473dbc0d481f57ee43/fx13.sml fx13 fx13.sml sml 2283 55 219 IMAGE-THUMBNAIL 1-s2.0-S2468823122007209-fx12.sml https://s3-eu-west-1.amazonaws.com/prod-ucs-content-store-eu-west/content/pii:S2468823122007209/fx12/THUMBNAIL/image/gif/733f5591464d2c2fb382f87296f1dc52/fx12.sml fx12 fx12.sml sml 3512 117 219 IMAGE-THUMBNAIL 1-s2.0-S2468823122007209-fx18.sml https://s3-eu-west-1.amazonaws.com/prod-ucs-content-store-eu-west/content/pii:S2468823122007209/fx18/THUMBNAIL/image/gif/8574c3dd1f6901db084688ac564b8057/fx18.sml fx18 fx18.sml sml 3380 101 219 IMAGE-THUMBNAIL 1-s2.0-S2468823122007209-gr8_lrg.jpg https://s3-eu-west-1.amazonaws.com/prod-ucs-content-store-eu-west/content/pii:S2468823122007209/HIGHRES/image/jpeg/2d3882d4c8df1e162163f5a328519c10/gr8_lrg.jpg gr8 gr8_lrg.jpg jpg 587006 1804 2416 IMAGE-HIGH-RES 1-s2.0-S2468823122007209-gr7_lrg.jpg https://s3-eu-west-1.amazonaws.com/prod-ucs-content-store-eu-west/content/pii:S2468823122007209/HIGHRES/image/jpeg/16e8edfabf0e96bfbc68ca50dc7dcc1b/gr7_lrg.jpg gr7 gr7_lrg.jpg jpg 198132 1274 1590 IMAGE-HIGH-RES 1-s2.0-S2468823122007209-gr6_lrg.jpg https://s3-eu-west-1.amazonaws.com/prod-ucs-content-store-eu-west/content/pii:S2468823122007209/HIGHRES/image/jpeg/ff48bbb4a03f67cca714dc8a42602c1a/gr6_lrg.jpg gr6 gr6_lrg.jpg jpg 687472 2079 2996 IMAGE-HIGH-RES 1-s2.0-S2468823122007209-gr5_lrg.jpg https://s3-eu-west-1.amazonaws.com/prod-ucs-content-store-eu-west/content/pii:S2468823122007209/HIGHRES/image/jpeg/f5bc0d04267edefe0a00d14a3d3e51f4/gr5_lrg.jpg gr5 gr5_lrg.jpg jpg 633349 1144 2990 IMAGE-HIGH-RES 1-s2.0-S2468823122007209-gr4_lrg.jpg https://s3-eu-west-1.amazonaws.com/prod-ucs-content-store-eu-west/content/pii:S2468823122007209/HIGHRES/image/jpeg/28dd6084fefa61bfff7e2c8a05850397/gr4_lrg.jpg gr4 gr4_lrg.jpg jpg 667329 1153 2949 IMAGE-HIGH-RES 1-s2.0-S2468823122007209-gr3_lrg.jpg https://s3-eu-west-1.amazonaws.com/prod-ucs-content-store-eu-west/content/pii:S2468823122007209/HIGHRES/image/jpeg/3a5fcae923aab9353502a5feb357f81b/gr3_lrg.jpg gr3 gr3_lrg.jpg jpg 1580049 2027 3167 IMAGE-HIGH-RES 1-s2.0-S2468823122007209-gr2_lrg.jpg https://s3-eu-west-1.amazonaws.com/prod-ucs-content-store-eu-west/content/pii:S2468823122007209/HIGHRES/image/jpeg/fd82a275d2465478eb9952be56c94795/gr2_lrg.jpg gr2 gr2_lrg.jpg jpg 1157321 2477 3167 IMAGE-HIGH-RES 1-s2.0-S2468823122007209-fx9_lrg.jpg https://s3-eu-west-1.amazonaws.com/prod-ucs-content-store-eu-west/content/pii:S2468823122007209/HIGHRES/image/jpeg/9ee8c43cd5430469626dbb5272e973a7/fx9_lrg.jpg fx9 fx9_lrg.jpg jpg 9496 160 519 IMAGE-HIGH-RES 1-s2.0-S2468823122007209-gr1_lrg.jpg https://s3-eu-west-1.amazonaws.com/prod-ucs-content-store-eu-west/content/pii:S2468823122007209/HIGHRES/image/jpeg/5ad3cd1ead538fd1d1c4313888064936/gr1_lrg.jpg gr1 gr1_lrg.jpg jpg 1066833 2447 3167 IMAGE-HIGH-RES 1-s2.0-S2468823122007209-fx8_lrg.jpg https://s3-eu-west-1.amazonaws.com/prod-ucs-content-store-eu-west/content/pii:S2468823122007209/HIGHRES/image/jpeg/06343be5a96f5f8022bfbeafb51b1256/fx8_lrg.jpg fx8 fx8_lrg.jpg jpg 20942 413 589 IMAGE-HIGH-RES 1-s2.0-S2468823122007209-fx7_lrg.jpg https://s3-eu-west-1.amazonaws.com/prod-ucs-content-store-eu-west/content/pii:S2468823122007209/HIGHRES/image/jpeg/6c0f67f242b2add9c2cce68d0b7be381/fx7_lrg.jpg fx7 fx7_lrg.jpg jpg 14649 294 528 IMAGE-HIGH-RES 1-s2.0-S2468823122007209-fx6_lrg.jpg https://s3-eu-west-1.amazonaws.com/prod-ucs-content-store-eu-west/content/pii:S2468823122007209/HIGHRES/image/jpeg/e22e97f8a6b05a5d94b0615f697f5a05/fx6_lrg.jpg fx6 fx6_lrg.jpg jpg 19763 409 564 IMAGE-HIGH-RES 1-s2.0-S2468823122007209-fx5_lrg.jpg https://s3-eu-west-1.amazonaws.com/prod-ucs-content-store-eu-west/content/pii:S2468823122007209/HIGHRES/image/jpeg/1470e942dd9b8760841854d19f8a7966/fx5_lrg.jpg fx5 fx5_lrg.jpg jpg 13640 285 517 IMAGE-HIGH-RES 1-s2.0-S2468823122007209-sc2_lrg.jpg https://s3-eu-west-1.amazonaws.com/prod-ucs-content-store-eu-west/content/pii:S2468823122007209/HIGHRES/image/jpeg/cd3e806187ef8b9328d006cf115e5e44/sc2_lrg.jpg sc2 sc2_lrg.jpg jpg 310278 1419 1733 IMAGE-HIGH-RES 1-s2.0-S2468823122007209-fx4_lrg.jpg https://s3-eu-west-1.amazonaws.com/prod-ucs-content-store-eu-west/content/pii:S2468823122007209/HIGHRES/image/jpeg/50f738b5919232bf5e6fa11f4caef6cf/fx4_lrg.jpg fx4 fx4_lrg.jpg jpg 16612 409 412 IMAGE-HIGH-RES 1-s2.0-S2468823122007209-sc1_lrg.jpg https://s3-eu-west-1.amazonaws.com/prod-ucs-content-store-eu-west/content/pii:S2468823122007209/HIGHRES/image/jpeg/8af2f02c84dca534e8d5b030e4c79fef/sc1_lrg.jpg sc1 sc1_lrg.jpg jpg 333984 909 2997 IMAGE-HIGH-RES 1-s2.0-S2468823122007209-fx3_lrg.jpg https://s3-eu-west-1.amazonaws.com/prod-ucs-content-store-eu-west/content/pii:S2468823122007209/HIGHRES/image/jpeg/12117026a372d160d61fb9b3410c067c/fx3_lrg.jpg fx3 fx3_lrg.jpg jpg 10757 294 352 IMAGE-HIGH-RES 1-s2.0-S2468823122007209-fx2_lrg.jpg https://s3-eu-west-1.amazonaws.com/prod-ucs-content-store-eu-west/content/pii:S2468823122007209/HIGHRES/image/jpeg/1ecdc441e7b1a492aff89a90139fb0f0/fx2_lrg.jpg fx2 fx2_lrg.jpg jpg 11329 259 373 IMAGE-HIGH-RES 1-s2.0-S2468823122007209-fx1_lrg.jpg https://s3-eu-west-1.amazonaws.com/prod-ucs-content-store-eu-west/content/pii:S2468823122007209/HIGHRES/image/jpeg/1508db3f2b216d5f63500f38e4e68b33/fx1_lrg.jpg fx1 fx1_lrg.jpg jpg 6197 157 297 IMAGE-HIGH-RES 1-s2.0-S2468823122007209-ga1_lrg.jpg https://s3-eu-west-1.amazonaws.com/prod-ucs-content-store-eu-west/content/pii:S2468823122007209/HIGHRES/image/jpeg/bcb9f8512e33bee2f5098b298dcd28a0/ga1_lrg.jpg ga1 true ga1_lrg.jpg jpg 226516 771 1333 IMAGE-HIGH-RES 1-s2.0-S2468823122007209-fx15_lrg.jpg https://s3-eu-west-1.amazonaws.com/prod-ucs-content-store-eu-west/content/pii:S2468823122007209/HIGHRES/image/jpeg/d7ae9e05dd7ecf37f4a4a021a4f24a9f/fx15_lrg.jpg fx15 fx15_lrg.jpg jpg 10681 191 597 IMAGE-HIGH-RES 1-s2.0-S2468823122007209-fx14_lrg.jpg https://s3-eu-west-1.amazonaws.com/prod-ucs-content-store-eu-west/content/pii:S2468823122007209/HIGHRES/image/jpeg/1c9a216bbf2756f47fd14ba83951e64d/fx14_lrg.jpg fx14 fx14_lrg.jpg jpg 16056 237 685 IMAGE-HIGH-RES 1-s2.0-S2468823122007209-fx17_lrg.jpg https://s3-eu-west-1.amazonaws.com/prod-ucs-content-store-eu-west/content/pii:S2468823122007209/HIGHRES/image/jpeg/bb3f6f0256108a7b6548c8f11c0cd787/fx17_lrg.jpg fx17 fx17_lrg.jpg jpg 8749 233 314 IMAGE-HIGH-RES 1-s2.0-S2468823122007209-fx16_lrg.jpg https://s3-eu-west-1.amazonaws.com/prod-ucs-content-store-eu-west/content/pii:S2468823122007209/HIGHRES/image/jpeg/72bdd41e9461dcf305adab5d550df56d/fx16_lrg.jpg fx16 fx16_lrg.jpg jpg 18940 364 689 IMAGE-HIGH-RES 1-s2.0-S2468823122007209-fx11_lrg.jpg https://s3-eu-west-1.amazonaws.com/prod-ucs-content-store-eu-west/content/pii:S2468823122007209/HIGHRES/image/jpeg/4524340364c998088f3608e395cdcdc2/fx11_lrg.jpg fx11 fx11_lrg.jpg jpg 9277 174 453 IMAGE-HIGH-RES 1-s2.0-S2468823122007209-fx10_lrg.jpg https://s3-eu-west-1.amazonaws.com/prod-ucs-content-store-eu-west/content/pii:S2468823122007209/HIGHRES/image/jpeg/93e730277d34413842ab3abbb49e5f97/fx10_lrg.jpg fx10 fx10_lrg.jpg jpg 15881 274 605 IMAGE-HIGH-RES 1-s2.0-S2468823122007209-fx13_lrg.jpg https://s3-eu-west-1.amazonaws.com/prod-ucs-content-store-eu-west/content/pii:S2468823122007209/HIGHRES/image/jpeg/b449f4a1832a639386d5c47a11928a7e/fx13_lrg.jpg fx13 fx13_lrg.jpg jpg 10717 157 628 IMAGE-HIGH-RES 1-s2.0-S2468823122007209-fx12_lrg.jpg https://s3-eu-west-1.amazonaws.com/prod-ucs-content-store-eu-west/content/pii:S2468823122007209/HIGHRES/image/jpeg/337463b9600c0b4551faac799af2e2a8/fx12_lrg.jpg fx12 fx12_lrg.jpg jpg 15702 294 548 IMAGE-HIGH-RES 1-s2.0-S2468823122007209-fx18_lrg.jpg https://s3-eu-west-1.amazonaws.com/prod-ucs-content-store-eu-west/content/pii:S2468823122007209/HIGHRES/image/jpeg/0277d6113be7dfc9d79183e1a09b5ee4/fx18_lrg.jpg fx18 fx18_lrg.jpg jpg 12593 230 500 IMAGE-HIGH-RES 1-s2.0-S2468823122007209-mmc1.pdf https://s3-eu-west-1.amazonaws.com/prod-ucs-content-store-eu-west/content/pii:S2468823122007209/mmc1/MAIN/application/pdf/785128f1724700621526677b2b136681/mmc1.pdf mmc1 mmc1.pdf pdf false 1838121 APPLICATION 1-s2.0-S2468823122007209-am.pdf https://s3-eu-west-1.amazonaws.com/prod-ucs-content-store-eu-west/content/egi:10QJN4G3Z3X/MAIN/application/pdf/ebd158d451da8df397f64f62bebeecaf/am.pdf am am.pdf pdf false 2584996 AAM-PDF MCAT 112834 112834 S2468-8231(22)00720-9 10.1016/j.mcat.2022.112834 Elsevier B.V. Scheme 1 Preparation of hypercrosslinked ionic polymer with multi-ionic sites HBIM(x)@QA-Br (x is the mole ratio of DBX to BIM). Scheme 1 Scheme 2 Plausible mechanism for HBIM(0.5)@QA-Br catalyzed CO2 cycloaddition to epoxides. Scheme 2 Fig. 1 FT-IR spectra of (a) HBIM(0.5), HBIM(0.5)@QA and HBIM(0.5)@QA-Br; (b) HBIM(1), HBIM(1)@QA and HBIM(1)@QA-Br; (c) HBIM(2), HBIM(2)@QA and HBIM(2)@QA-Br; (d) 13C CP/MAS NMR spectra of HBIM(0.5), HBIM(0.5)@QA and HBIM(0.5)@QA-Br. Fig 1 Fig. 2 (a) TGA curves of HBIM(x), HBIM(x)@QA and HBIM(x)@QA-Br; (b) Survey scan, (c) N 1 s XPS, (d) Br 3 d XPS spectra of HBIM(0.5), HBIM(0.5)@QA and HBIM(0.5)@QA-Br. Fig 2 Fig. 3 SEM images of (a) HBIM(0.5), (b) HBIM(0.5)@QA and (c) HBIM(0.5)@QA-Br; TEM images of (d) HBIM(0.5)@QA-Br, (e) HBIM(0.5)@QA and (f) HBIM(0.5)@QA-Br; elemental (C, N and Br) mapping images of (g–j) HBIM(0.5)@QA-Br. Fig 3 Fig. 4 (a) N2 adsorption-desorption isotherms and (b) pore size distribution of polymers. Fig 4 Fig. 5 CO2 adsorption isotherms of the polymers at 273 K (a) and 298 K (b). Fig 5 Fig. 6 Yield and selective as a function of (a) mass ratio of catalyst to SO, 5 mmol styrene oxide, CO2 (0.1 MPa), 140 °C, 4 h; (b) reaction temperature, 5 mmol styrene oxide, CO2 (0.1 MPa), HBIM(0.5)@QA-Br (20 wt%), 4 h; (c) CO2 pressure, 5 mmol styrene oxide, HBIM(0.5)@QA-Br (20 wt%), 120 °C, 4 h; (d) reaction time, 5 mmol styrene oxide, CO2 (0.1 MPa), HBIM(0.5)@QA-Br (20 wt%), 140 °C;. Fig 6 Fig.7 Reusability of HBIM(0.5)@QA-Br for CO2 cycloaddition to styrene oxide. Reaction conditions: styrene oxide (5 mmol), HBIM(0.5)@QA-Br (20 wt%), CO2, (0.1 MPa), 140 °C, 4 h. Fig7 Fig. 8 (a) FT-IR spectra, (b) TG curves of fresh HBIM(0.5)@QA-Br and HBIM(0.5)@QA-Br after recycling; (c) N2 sorption isotherm (inset: the pore size distribution curve), (d) SEM image of HBIM(0.5)@QA-Br after recycling. Fig 8 Table 1 Textual properties of polymers. Table 1 Sample BIM/DBX SBET a (m2 g − 1) Vp b (cm3 g − 1) Vmicro c (cm3 g − 1) Smicro d (cm2 g − 1) Dtotal e (nm) N content (wt%) f Ionic content g (mmol g − 1) CO2 uptake h (mmol g − 1) 273/298 K Qst (kJ mol−1) HBIM(0.5) 1:0.5 320 0.416 0.260 307 5.198 1.64 – 1.82/1.29 26.90 HBIM(0.5)@QA 1:0.5 202 0.311 0.170 114 6.151 2.61 – 2.08/1.45 29.15 HBIM(0.5)@QA-Br 1:0.5 120 0.300 0.136 75 9.949 2.43 1.56 1.80/1.20 37.90 HBIM(1) 1:1 603 0.536 0.474 423 3.556 1.34 – 2.52/1.72 35.09 HBIM(1)@QA 1:1 503 0.486 0.335 356 3.856 1.88 – 2.82/1.87 37.95 HBIM(1)@QA-Br 1:1 391 0.418 0.228 310 4.270 1.68 1.02 2.51/1.72 37.15 HBIM(2) 1:2 749 0.653 0.547 557 2.483 0.94 – 2.92/1.97 37.30 HBIM(2)@QA 1:2 675 0.555 0.506 657 2.694 1.45 – 2.97/2.03 26.66 HBIM(2)@QA-Br 1:2 533 0.484 0.380 530 2.882 1.29 0.85 2.94/2.01 37.51 a BET surface area. b Total pore volume. c Microporous volume estimated by the DR. method. d Microporous external surface area estimated by the t-plot method. e Average pore size for total pores. f N content calculated by elemental analysis. g Ionic content calculated by elemental analysis (theoretical values). h CO2 uptakes at 273 K and 298 K (1 bar). i Maximum Qst of CO2 in kJ/mol calculated by Clausius-Clapeyorn equation. Table 2 Cycloaddition of CO2 with styrene oxide. Table 2 Entry a Sample N Content b BET c (m2g−1) Yield d (%) Sel. d (%) TON f TOF g (h − 1) 1 HBIM(0.5) 1.64 320 47 99 – – 2 HBIM(0.5)@QA 2.61 202 80 >99 – – 3 HBIM(0.5)@QA-Br 2.43 (1.56 e ) 120 92 >99 29.49 7.37 4 HBIM(1) 1.34 603 29 99 – – 5 HBIM(1)@QA 1.88 503 67 >99 – – 6 HBIM(1)@QA-Br 1.68 (1.02 e ) 391 85 99 41.67 10.42 7 HBIM(2) 0.94 749 41 99 – – 8 HBIM(2)@QA 1.45 675 60 99 – – 9 HBIM(2)@QA-Br 1.29 (0.85 e ) 533 88 >99 51.76 12.94 a Reaction condition: 5 mmol styrene oxide, 100 mg catalysts, CO2 (0.1 MPa), 140 °C, 4 h. b N content calculated by elemental analysis. c BET surface area. d Yield and selectivity were determined by 1H NMR. e Ionic content calculated by elemental analysis (theoretical values). f Turnover number (TON) = [mmol (product)]/[mmol (ionic sites)]. g Turnover frequency (TOF) = [mmol (product)]/[mmol (ionic sites) × (reaction time)]. Table 3 Cycloaddition of CO2 with epoxides catalyzed by HBIM(0.5)@QA-Br. Table 3 Entry a Substrate Product T (h) Yield b (%) Sel b (%) TON d TOF e (h − 1) 1 Image, table 3 Image, table 3 2 99 99 26.71 13.36 2 Image, table 3 Image, table 3 46.5 (120 °C)16 (100 °C) 999394 99>9999 26.7124.8425.11 6.683.821.57 3 Image, table 3 Image, table 3 5 96 c - 25.64 5.13 4 Image, table 3 Image, table 3 5 99 99 26.71 5.34 5 Image, table 3 Image, table 3 5 98 >99 26.18 5.24 6 Image, table 3 Image, table 3 5 98 >99 26.18 5.24 7 Image, table 3 Image, table 3 8 93 99 24.84 3.11 8 Image, table 3 Image, table 3 10 98 >99 26.18 2.62 9 Image, table 3 Image, table 3 12 12 - 3.21 0.28 a Reaction condition: 5 mmol styrene oxide, HBIM(0.5)@QA-Br (120 mg), CO2 (0.1 Mpa), 140 °C. b Yield and selectivity were determined by 1H NMR. c Isolate yield. d Turnover number (TON) = [mmol (product)]/[mmol (ionic sites)]. e Turnover frequency (TOF) = [mmol (product)]/[mmol (ionic sites) × (reaction time)]. Synergistic catalysis of hypercrosslinked ionic polymers with multi-ionic sites for conversion of CO2 to cyclic carbonates Xu Liao Investigation Writing – original draft Data curation a b Zeyu Wang Data curation Software a Lingzheng Kong Visualization Validation c Xilin Gao Supervision Formal analysis a Jiao He Visualization Validation a Dongha Huang Formal analysis Software a Jinqing Lin Supervision Resources Project administration a ⁎ a College of Materials Science and Engineering, Huaqiao University, Xiamen 361021, China College of Materials Science and Engineering Huaqiao University Xiamen 361021 China aCollege of Materials Science and Engineering, Huaqiao University, Xiamen 361021, China b College of Chemistry and Bioengineering, Hunan University of Science and Engineering, Yongzhou 425199, China College of Chemistry and Bioengineering Hunan University of Science and Engineering Yongzhou 425199 China bCollege of Chemistry and Bioengineering, Hunan University of Science and Engineering, Yongzhou 425199, China c College of Chemical Engineering, Huaqiao University, Xiamen 361021, China College of Chemical Engineering Huaqiao University Xiamen 361021 China cCollege of Chemical Engineering, Huaqiao University, Xiamen 361021, China ⁎ Corresponding author. High catalytic activity for the conversion of CO2 into cyclic carbonates requires the preparation of porous ionic catalysts with multi-active sites and high ionic density. Herein, a series of hypercrosslinked ionic polymers (HIPs) with multi-ionic sites, high ionic density and hydrogen bond donors (imino group) were synthesized through the one-pot Friedel–Crafts alkylation and post-synthetic strategies. Adsorption measurements showed that HIPs exhibited outstanding CO2 uptakes (1.80−2.97 mmol g − 1, 273 K and 1 bar). Importantly, under the synergistic effects of multi-ionic sites, high ionic density and hydrogen bond donors, the metal-free catalyst HBIM(0.5)@QA-Br showed excellent catalytic yield (99%) and selectivity (99%) for cycloaddition of CO2 with epichlorohydrin at 140 °C, 0.1 MPa CO2 in 2 h. By extending the time appropriately, high catalytic yields (styrene oxide, 140 °C, 4 h, 99% yield; 120 °C, 6.5 h, 93% yield; 100 °C, 16 h, 94% yield) were achieved at low temperature. In addition, the catalyst can be easily reused with stable recyclability. This work not only provides a new strategy to prepare metal-free porous ionic catalysts with multi-ionic sites and hydrogen bond donors but also demonstrated that the synergistic catalysis of multi-ionic sites is helpful to promote CO2 conversion. Graphical abstract Image, graphical abstract Keywords CO2 cycloaddition Hypercrosslinked ionic polymers Multi-ionic sites Synergistic catalysis Data availability The data that has been used is confidential. 1 Introduction The greenhouse gas as carbon dioxide (CO2) has caused a series of global environmental problems, such as global climate change and sea-level rise [1–3]. In recent years, the chemical conversion of CO2 into value fuels and industrial value-added products has captured widespread concerns because CO2 is a readily available, abundant, and nontoxic C1 raw resource [4–6]. The transformation of CO2 and epoxides into cyclic carbonates is appealing due to the CO2 cycloaddition reaction with a 100% atom utilization rate and the produced cyclic carbonates are vital raw materials in polycarbonate syntheses, lithium batteries' electrolytes and solvents or intermediates in chemical processes, etc. [7–11]. Nevertheless, the practicability of this strategy requires materials with high CO2 capture and conversion ability. So far, a large number of catalysts have been synthesized for CO2 cycloaddition reaction, such as ionic liquids [12–15], metal halide [16–17], metal complexes [18–19], metal-organic frameworks [20–23] and porous organic polymers [24–29]. Since catalyst recycling and product separation are convenient, the adsorption ability of porous solid-state catalysts is more advantageous than homogeneous catalysts. However, the co-catalysts were required for some porous metal-related catalysts [19,30], increasing the cost of product purification and risking environmental pollution. To address this issue, various strategies have been developed to design highly efficient metal-free porous polymers for CO2 cycloaddition reaction. porous organic polymers (POPs) are proven promising materials for CO2 conversion because they feature abundant porosity, structural designability and functional diversity, and stable physiochemical property [31]. Nevertheless, the large-scale preparation of somePOPs (such as COFs, CTFs, CMPs and PIMs) [32–35] is restricted because of the use of expensive monomers and stoichiometric coupling reagents, and harsh synthetic conditions. As a type of POPs, hypercrosslinked polymers (HCPs) with low-cost, large surface area and abundant microporous were synthesized by a simple Friedel-Crafts alkylation from many monomers [36]. Therefore, it is necessary to incorporate IL units into the hypercrosslinked polymers network to obtain hypercrosslinked ionic polymers (HIPs) with high CO2 absorption ability and catalytic activity due to the nonionic HCPs lack of active sites and functional groups.HIPs are prepared mainly through post-functionalization [37–39], in situ generations of ionic sites in the hypercrosslinked process [40–42] and crosslinking of ionic monomer strategies [43–44]. Nevertheless, the direct crosslinking of ionic monomers to form uniform porous ionic skeletons is challenging due to the ionic monomers are insoluble in the solvent 1,2 dichloroethane. In addition, Wang et al. [41]. and Huang et al. [42]. synthesized a series of imidazolinium-based HIPs through concurrent Friedel–Crafts alkylation and quaternization of benzyl halides with 2-phenylimidazoline and benzimidazole, respectively. In the presence of co-catalysts, the above catalysts with high yields under mild reaction conditions. Sun et al. [40]. developed pyridine-based HIPs via the above strategy, and the 97% yield of propylene carbonate was obtained at 120 °C, 2 MPa CO2 in 8 h. Although the above HIPs exhibited high catalytic yields for CO2 cycloaddition with epoxides, the co-catalysts or long reaction time or high CO2 pressure were needed because of the obtained HIPs with low ionic density, increasing the difficulty of separation and the cost of industrial application. The main factor of the low ionic density can be ascribed to the Friedel–Crafts alkylation for constructing porous skeleton and quaternization of generating ionic sites are electrophilic reaction and nucleophilic reaction respectively, which are contradictory and result in a large number of active sites not being reacted. Therefore, it is highly desirable to introduce the multi-active sites and hydrogen bond donors into the polymer skeleton by utilizing and activating most of the reaction sites on imidazoline. At present, the HIPs with multi-active sites are usually a combination of metal and ionic sites [45–46], but the metal leaching and leftover could cause potential environmental pollution. Based on synthesis and catalysis, the development of a new strategy to synthesize metal-free HIPs with multi-ionic sites to efficiently catalyze CO2 cycloaddition reaction is highly necessary. In this work, the metal-free HIPs with multi-ionic sites were prepared through Friedel–Crafts alkylation and post-synthetic strategies (Scheme 1 ). Firstly, the polymer skeletons (HBIM(x)) with different N contents and specific surface areas were constructed by adjusting the mole ratio of benzimidazole with dibromo-p-xylene through the one-pot Friedel–Crafts alkylation. To full make use of the reaction site (-NH-) on imidazolinium, a new ionic active site was further intercalated into the skeleton of HBIM(x) through the alkylation reaction with 4‑bromo-buthyl-triethyl-ammonium bromide (QA) to obtain HBIM(x)@QA. Finally, to activate the unreacted sites of HBIM(x), HBIM(x)@QA-Br with multi-ionic sites and hydrogen bond donors (imino group) were synthesized through the quaternization of HBIM(x)@QA with hydrobromic acid. The experimental results showed that the catalytic activity of HIPs was continuously improved through post-synthetic strategies due to the positive effects of multi-ionic sites and hydrogen bond donors. The obtained metal-free catalyst HBIM(0.5)@QA-Br with multi-ionic sites, high ionic density and hydrogen bond donors exhibited high catalytic activity, outstanding reusability and broad substrate compatibility for rapid conversion of CO2 into cyclic carbonates at atmospheric pressure. 2 Experimental section 2.1 Synthesis of N,N,N,N-(4-Bromo-buthyl)-triethyl-ammonium bromide (QA) The N,N,N,N-(4-Bromo-buthyl)-triethyl-ammonium bromide was synthesized according to the previously reported method [47]. A mixture of triethylamine (1.01 g, 10 mmol) and 1,4-dibromobutane (6.48 g, 30 mmol) was stirred at 80 °C for 3 h. The resulting suspension was cooled to 0 °C, the title product was washed with ethyl acetate and isolated by filtration as a white solid in 96% yield, and 1H NMR and 13C NMR spectra of N,N,N,N-(4-Bromo-buthyl)-triethyl-ammonium bromide are shown in Fig. S1. 2.2 Synthesis of HBIM(x) BIM (0.59 g, 5 mmol) and DBX (0.66 g, 2.5 mmol) were added in DCE (50 mL) and stirred for 10 min, then the FeCl3 (4.05 g, 25 mol) was added and heat it to 80 °C for 24 h. The resultant precipitate was isolated by filtration, washed with methanol, and further purified to remove residual FeCl3 via Soxhlet extractions with methanol as solvent. Finally, dried in a vacuum oven at 80 °C for 24 h to obtain HBIM(0.5), and the HBIM(1) and HBIM(2) were synthesized by the same method (x is the mole ratio of DBX to BIM). 2.3 Synthesis of HBIM(x)@QA Such as HBIM(0.5)@QA, HBIM(0.5) (0.5 g), CH3CN (20 mL) and the aqueous solution of sodium hydroxide (0.12 g, 3 mmol, 10 mL H2O) were added in the round bottom flask and stirred for 10 min at room temperature. Then the N,N,N,N-(4-Bromo-buthyl)-triethyl-ammonium bromide (634 mg, 2 mmol) was dissolved in distilled water (10 mL) and slowly dripped into the above mixture and the reaction mixture was kept at 80 °C for 24 h. The remaining solid was washed with H2O, ethyl acetate and ethanol Finally, vacuum-dried at 80 °C for 24 h to obtain HBIM(0.5)@QA, and the synthesis of HBIM(1)@QA and HBIM(2)@QA is similar to the above procedure. 2.4 Synthesis of HBIM(x)@QA-Br A solution of hydrobromic acid (1 g, 5 mmol, 20 mL H2O) was added dropwise to the mixture of HBIM(0.5)@QA (0.5 g) in CH3CN (20 mL), and the mixture was stirred and heated to 80 °C for 24 h. Finally, the precipitate was washed with H2O, ethyl acetate and ethanol, and vacuum-dried at 80 °C for 24 h to obtain HBIM(0.5)@QA-Br. The HBIM(1)@QA-Br and HBIM(2)@QA-Br were synthesized by using a similar procedure. 2.5 General catalytic procedure for CO2 cycloaddition with epoxides In a typical run, styrene oxide (SO, 5 mmol) and HBIM(0.5)@QA-Br (20 wt%) were added to a predried autoclave reactor and pressurized of CO2 to 0.1 MPa, and the reactant was heated to 140 °C for 4 h. After the reaction and cooling to room temperature, the remaining CO2 was released slowly. The mixture was diluted with ethyl acetate, and separated by filtration. The yield and selectivity were analyzed via 1H NMR (Fig. S2–S9): the dibromomethane (0.5 mmol, 36 uL) was added into the liquid phase as the internal standard after the rotary evaporation of ethyl acetate under reduced pressure, and the molar ratio of the dibromomethane (4.86 ppm, s, 2 H) to the products (t, 1 H) is the ratio of the integrated area of their hydrogens. The catalyst HBIM(0.5)@QA-Br was used for the next run after vacuum-dried at 80 °C for 12 h. 3 Result and discussion 3.1 Characterization of the polymers The FT-IR spectra of the as-prepared HIPs are shown in Fig. 1a, 1b and 1c, a comparative research was fabricated among HBIM(x), HBIM(x)@QA and HBIM(x)@QA-Br for more acquaintance of the HIPs structure. As shown in Fig. 1a, the C–H stretching at 2920 cm−1 of HBIM(0.5), HBIM(0.5)@QA and HBIM(0.5)@QA-Br belonged to the methylene (–CH2–) crosslinking bridges, and the peak 611 cm−1 of HBIM(0.5) was ascribed to the C-Br stretching of unreacted DBX [42]. Additionally, the characteristic peaks at around 1679 cm−1, 1593 cm−1 and 1210 cm−1 were attributed to the imidazolinium ring [48]. By contrast, a new absorption peak at 1392 cm−1 in HBIM(0.5)@QA and HBIM(0.5)@QA-Br was associated with the C–N stretching of quaternary ammonium. Similar results were detected for other HIPs (Fig. 1b, 1c). The chemical structure of HBIM(0.5), HBIM(0.5)@QA and HBIM(0.5)@QA-Br is further studied by 13C CP/MAS NMR spectra (Fig. 1d). The chemical shift peaks at 136, 131 and 37 ppm were assumed to phenyl carbons, imidazoline and methylene bridges, respectively. Compared with HBIM(0.5), the new peaks at 56, 54, 37, 31, 26, 20 and 7 ppm were related to N,N,N,N-(4-Bromo-buthyl)-triethyl-ammonium bromide (QA) on the HBIM(0.5)@QA and HBIM(0.5)@QA-Br [37, 41]. The above experimental results confirmed the presence of imidazolium cations and quaternary ammonium in the polymer skeleton. As shown in Fig. 2a, the thermogravimetric analysis (TGA) curves of HBIM(x), HBIM(x)@QA and HBIM(x)@QA-Br revealed that the thermal decomposition temperature of polymers about 172 °C, meeting the demand of the catalytic reaction. The structure of samples HBIM(0.5), HBIM(0.5)@QA and HBIM(0.5)@QA-Br was further studied by X-ray photoelectron spectroscopy (XPS) analyses. The full survey scan XPS spectra are shown in Fig. 2b, demonstrating the Br 3d, C 1 s, N 1 s and O 1 s signals at 70.8, 284.2, 398.3, 532.4 eV. The high-resolution N 1 s showed that the imine-like (-N=) and amine-like (-NH-) were the main types of the imidazoline, and the N 1 s signals of HIPs were divided into three different peaks (Fig. 2c). The binding energies of samples HBIM(0.5) at 400.19 eV attributed to imidazolinium cations, and the peaks of 398.09 eV and 399.12 eV ascribed to the imidazoline [49]. The HBIM(0.5)@QA was synthesized through the alkylation reaction of HBIM(0.5) with QA and a new peak at 401.98 eV belonged to quaternary ammonium nitrogen of HBIM(0.5)@QA [50], showing that quaternary ammonium salts were inserted into the polymer skeleton. In addition, the N1s signal of the HBIM(0.5)@QA-Br has no obvious change compared to that of HBIM(0.5)@QA. As shown in Fig. 2d, the Br 3d signals demonstrated that the two binding energies of HBIM(0.5) at 70.64 eV and 69.68 eV were associated with the free bromide anion [40–41]. Besides, the new peaks at 67.47 eV and 67.45 eV were surveyed in spectra of HBIM(0.5)@QA and HBIM(0.5)@QA-Br, attributable to Br– in quaternary ammonium salts [51]. These results confirmed that the HIPs with multi-ionic sites were successfully synthesized through Friedel-Crafts alkylation, alkylation reaction, and quaternization. The irregular nanoparticles and layered structures of polymers are inspected by SEM images (Fig. 3). The layered porous structure is contributed to the mass transfer of reaction substrate, accelerating the rate of cycloaddition of CO2. Interestingly, SEM images of HBIM(0.5) (Fig. 3a) displayed a flower-like form by crosslinking spherical particles with each other. The quaternary ammonium salts and Br– were grafted onto the HBIM(0.5) through alkylation reaction and quaternization, and the spherical particles of HBIM(0.5)@QA (Fig. 3b) and HBIM(0.5)@QA-Br (Fig. 3c) were wrapped in a glue-like substance and appear in the block-like morphology. Similar results were obtained for other HIPs (Fig. S10, Fig. S11 and Fig. S12). Elemental mapping images of HBIM(0.5)@QA-Br (Fig. 3g–j) showed that C, N, and Br were uniformly dispersed in the polymer frameworks, indicating uniform dispersions of the IL units across the skeleton of the HIPs. As shown in Fig. 3d, 3e, 3f, TEM images of HBIM(0.5), HBIM(0.5)@QA and HBIM(0.5)@QA-Br demonstrated the dark alternating worm-like holes structure, confirming the polymer with abundant pore structures. In addition, X-ray diffraction (XRD) patterns (Fig. S13) showed that the prepared HIPs were amorphous. As shown in Fig. 4a, the porosity of HBIM(x), HBIM(x)@QA and HBIM(x)@QA-Br were measured by N2 sorption. The pore size distribution of polymers was examined by the NLDFT model in Fig. 4b, demonstrating that the HIPs have narrowly distributed micropores concentrated around 1 nm. In addition, minority polymers have mesopores that appeared at 2 − 3 nm. The hierarchical micro/mesoporous structures are favorable for the enrichment of CO2 and the mass transfer of reaction substrates [52–53]. The texture properties of the polymers were determined according to the N2 isotherm and the results are summarized in Table 1 . Notably, the Brunauer-Emmett-Teller surface areas (SBET) and total pore volumes (Vtotal) of HBIM(x) can be readily adjusted by changing the ratio of DBX and BIM in the initial synthesis of HBIM(x). About HBIM(x), a series of HBIM(x) were obtained by changing the molar ratios of BIM to DCX (x = 0.5, 1, 2). The SBET and Vtotal of HBIM(x) were increased whereas it decreases the N content with increasing the proportion of crosslinker DBX (Table S1), giving the maximum SBET of 749 m2g−1, the highest Vtotal of 0.653 cm3g−1 and the lowest N content (x = 2). The SBET followed the order of HBIM(2) (749 m2g−1) > HBIM(1) (603 m2g−1) > HBIM(0.5) (320 m2g−1), and the law of N content is opposite. Compared with HBIM(X), the SBET of HBIM(x)@QA and HBIM(x)@QA-Br gradually decreased after alkylation reaction and quaternization, but a higher N content was obtained. It is worth noting that the N content of HBIM(x)@QA is higher than HBIM(x)@QA-Br because the Br content of HBIM(x)@QA-Br was increased after quaternization of HBIM(x)@QA. In fact, HBIM(x)@QA-Br has a higher ionic density than HBIM(x)@QA. When the molar ratio of monomer DBX to crosslinker BIM is 0.5, the obtained HIPs with multi-ionic sites have the highest ionic density (theoretical value =1.56 mmol g − 1), which is conducive to the CO2 cycloaddition reaction. The CO2 adsorption isotherms (273 K and 298 K, 0 − 1 bar) of HBIM(x), HBIM(x)@QA and HBIM(x)@QA-Br (X = 0.5, 1, 2) were recorded on Fig. 5a and 5b and the results are summarized in Table 1. The HIPs exhibited outstanding CO2 uptakes of 1.82–2.97 mmol g − 1 at 273 K and 1.20–2.03 mmol g − 1 at 298 K. The CO2 adsorption capacity of HIPs is associated with their ionic density and specific surface area [54]. The HIPs (x = 2) with large specific surface area showed outstanding CO2 uptakes with the values of 2.92–2.97 mmol g − 1 at 273 K and 1.97–2.03 mmol g − 1 at 298 K, which are higher than other HIPs (x = 0.5, 1). Interestingly, HBIM(2)@QA has the highest CO2 uptakes at 273 K (2.97 mmol g − 1) and 298 K (2.03 mmol g − 1) under the effect of higher specific surface area and ionic density. The same results were obtained for other HIPs (x = 0.5, 1), the CO2 uptakes of HBIM(0.5)@QA (2.08/1.45 mmol g − 1) are higher than HBIM(0.5) (1.82/1.29 mmol g − 1) and HBIM(0.5)@QA-Br (1.80/1.20 mmol g − 1) at 273 K/298 K, and higher CO2 uptakes of HBIM(1) (2.52/1.72 mmol g − 1) were obtained than HBIM(1)@QA (2.82/1.87 mmol g − 1) and HBIM(1)@QA-Br (2.51/1.72 mmol g − 1). Therefore, the experimental results showed that the introduction of multi-ionic sites improves CO2 uptake ability, contributed to the subsequent catalytic reaction. As shown in Fig. S14 and Table 1, the Qst values (26.66–37.95 kJ mol−1) were calculated by using the Clausius–Clapeyron equation. 3.2 Catalytic evaluation The prepared HIPs catalysts were evaluated for cycloaddition of CO2 with styrene oxide (SO) to form styrene carbonate (SC) under relatively mild reaction conditions (140 °C, 0.1 MPa CO2, 4 h) without the existence of any solvents, additives and co-catalysts (Table 2 ). Interestingly, the catalytic yields of HIPs were greatly enhanced with increase of ionic sites, the catalytic yields followed the order of HBIM(0.5)@QA-Br (92%, entry 3) > HBIM(0.5)@QA (80%, entry 2) > HBIM(0.5) (47%, entry 1), HBIM(1)@QA-Br (85%, entry 6) > HBIM(1)@QA (67%, entry 5) > HBIM(1) (29%, entry 4) and HBIM(2)@QA-Br (88%, entry 9) > HBIM(2)@QA (60%, entry 8) > HBIM(2) (41%, entry 7), showing the positive effects of the multi-ionic site on catalytic performance. The experimental results demonstrated that excellent catalytic activity was achieved after anchoring multi-ionic sites into HBIM(0.5), the obtained HBIM(0.5)@QA-Br with multi-ionic sites and the highest ionic density exhibited 92% yield (entry 3) for cycloaddition of CO2 with SO, which are superior to other HIPs under the same reaction conditions. Compared with HBIM(0.5)@QA-Br, HBIM(1)@QA-Br offered a lower yield of 85% (entry 6), which could be attributed to moderate specific surface area and density. In addition, HBIM(2)@QA-Br with a large specific surface area and low ionic density gave a higher yield of 88% (entry 9) and a large turnover number (TON) of 51.76 (TOF of 12.94 h − 1). In summary, HBIM(0.5)@QA-Br showed the highest catalytic yield under the synergistic effect of the multi-ionic sites and high ionic density and reflected that the ionic sites of HIPs are closely associated with the yield of the target product. Besides, we further studied the optimum reaction conditions and substrate compatibility of the HBIM(0.5)@QA-Br. The catalytic activity of CO2 cycloaddition with epoxides relies on the main factors, such as catalyst amount, reaction temperature, CO2 pressure and reaction time of the reaction system. The previous experimental results showed that HBIM(0.5)@QA-Br exhibited the highest catalytic activity for the cycloaddition of CO2 with SO. Therefore, the catalyst HBIM(0.5)@QA-Br was used to evaluate the effect of these reaction factors in the cycloaddition of CO2 with SO, and the research results are shown in Fig. 6. It should be noted that no matter how to vary the reaction condition, high selectivity is still achieved. The effect of the mass ratio of catalyst to SO on catalytic performance is investigated in Fig. 6a, it was found that the yields of SC increased rapidly from 58% to 99% when the mass ratio of catalyst to SO was increased from 4 wt% to 20 wt%. Furthermore, the influence of reaction temperature on catalytic activity is studied in Fig. 6b. The yields were increased when increasing the reaction temperature from 50 °C to 140 °C, and then it keep stable. Fig. 6c shows that the yield of SC was closely related to the CO2 pressure and the yield increased (from 25% to 87%) with the maximum yield of 87% at 2 MPa CO2. At last, the effect of the reaction time on catalytic performance was investigated while keeping the mass ratio of catalyst to SO (20 wt%) and reaction temperature (140 °C) constant in Fig. 6d. The yields of SC were improved with the increase of reaction time, achieving a maximum yield of 99% within 4 h. In summary, HBIM(0.5)@QA-Br exhibited 99% yield and 99% selectivity at 0.1 MPa CO2, 140 °C in 4 h (mass ratio of catalyst to SO: 20 wt%). To explore the substrate compatibility of the catalyst, the catalyst HBIM(0.5)@QA-Br was assessed for the cycloaddition of CO2 with various epoxide substrates. As shown in Table 3 , the HBIM(0.5)@QA-Br exhibited high catalytic yields (93–99%) and selectivities (99%) for most epoxides (entries 1–8). The high yield (entry 1, 99% yield) was achieved for the conversion of epichlorohydrin within a relatively short reaction time (2 h). Moreover, HBIM(0.5)@QA-Br can convert the large size of substrates by prolonging reaction time, and the large substrates were challenging in previous reports due to difficulty in reacting with CO2 [11]. The conversion of glycidyl phenyl ether, o-tolyl glycidyl ether, allyl glycidyl ether and butyl glycidyl ether into corresponding cyclic carbonates with 96−98% yields (entries 3 − 6) in 5 h. Interestingly, the HBIM(0.5)@QA-Br catalyzed CO2 cycloaddition with the long carbon-chain alkyl epoxide and bis epoxide in 8 h and 10 h, affording the yields of 93% (entry 7) and 98% (entry 8). Notably, achieving high yields of SC (entry 2, 120 °C, 6.5 h, 93% yield; 100 °C, 16 h, 94% yield) at a lower temperature, and the reaction time is shorter than that of most porous ionic polymers previously reported (Table S2). The outstanding reusability and stability of heterogeneous catalysts are very pivotal for their practical application. To examine the reusability of the catalyst, HBIM(0.5)@QA-Br was applied to carry out recycling tests for CO2 cycloaddition with SO at 0.1 MPa CO2, 140 °C in 4 h. As shown in Fig. 7, a high yield (93%) was achieved after running 6 times. In addition, A series of characterization including FT-IR spectra (Fig. 8a), thermogravimetric analysis (Fig. 8b), N2 sorption isotherm (inset: the pore size distribution curve) (Fig. 8c) and SEM image (Fig. 8d) of the recovered catalyst HBIM(0.5)@QA-Br that demonstrate the chemical structural composition and textural structure of HBIM(0.5)@QA-Br are well-preserved corresponding to the fresh sample. The above results confirmed that the catalyst HBIM(0.5)@QA-Br has outstanding stability and good recyclability. 3.3 Understanding the catalytic process According to the previous reports and experimental results, the plausible reaction mechanism of HBIM(0.5)@QA-Br catalyzed CO2 cycloaddition with epoxides is revealed as described in Scheme 2 . Firstly, the epoxides are activated through the hydrogen bonding interaction between the oxygen atom of the epoxides and the imino group (as well as the acidic C2 hydrogen atom) of imidazoline, and interaction between the quaternary ammonium salt (N +) and the oxygen atom of epoxides [38,42,55,56]. Meanwhile, bromine anions of HIPs as nucleophile attacks the less sterically hindered β-carbon atom, resulting in the ring-opening of epoxides to form the oxyanion intermediate that is steadied through the imino group and acidic C2 hydrogen atom of imidazoline, and quaternary ammonium salt (N +). Subsequently, the alkyl carbonate anion intermediate is formed by the inserted CO2 that reacts with the oxyanion intermediate. Finally, intramolecular cyclization leads to the production of cyclic carbonate, with the leaving of bromide anion and thus releasing the catalyst HBIM(0.5)@QA-Br. 4 Conclusions In conclusion, we constructed a series of HIPs with multi-ionic sites and hydrogen bond donors (imino group) through the one-pot Friedel–Crafts alkylation and post-synthetic strategies, the synthesized HIPs with available multiple characteristics of high specific surface area, abundant hierarchical porosities, highly dispersed multi-ionic sites and hydrogen bond donors. FT-IR, XPS, SEM images and elemental analyses showed that the multi-ionic sites were successfully inserted into the skeleton structure of hypercrosslinked polymers. Under the synergistic effects of multi-ionic sites and high ionic density, the catalyst HBIM(0.5)@QA-Br exhibited high catalytic yields (93%−99%) for cycloaddition of CO2 with epoxides at atmospheric pressure in the short reaction time (2 − 10 h). This work synthesizes a series of new HIPs with multi-ionic sites and hydrogen bond donors by utilizing and activating most of the reaction sites on imidazoline for efficient CO2 capture and conversion and highlights the significance of the introduction of multi-ionic sites has synergistic effects on enhancing the catalytic activity of HIPs for CO2 cycloaddition reaction. CRediT authorship contribution statement Xu Liao: Investigation, Writing – original draft, Data curation. Zeyu Wang: Data curation, Software. Lingzheng Kong: Visualization, Validation. Xilin Gao: Supervision, Formal analysis. Jiao He: Visualization, Validation. Dongha Huang: Formal analysis, Software. Jinqing Lin: Supervision, Resources, Project administration. Declaration of competing interest The authors declare that they have no known competing financial interests or personal relationships that could have appeared to influence the work reported in this paper. Acknowledgements This work was supported by the National Natural Science Foundation of China (21803021, 21246008), the Natural Science Foundation of Fujian Province (2020J01065). Supplementary materials Supplementary material associated with this article can be found, in the online version, at doi:10.1016/j.mcat.2022.112834. Appendix Supplementary materials Image, application 1 References [1] Z. Zhang Z.-.Z. Yao S. Xiang B. Chen Perspective of microporous metal–organic frameworks for CO2 capture and separation Energy Environ. Sci. 7 2014 2868 2899 Z. Zhang, Z.-.Z. Yao, S. Xiang, B. Chen, Perspective of microporous metal–organic frameworks for CO2 capture and separation, Energy Environ. Sci. 7 (2014) 2868–2899. [2] E.S. Sanz-Perez C.R. Murdock S.A. Didas C.W. Jones Direct capture of CO2 from ambient air Chem. Rev. 116 2016 11840 11876 E.S. Sanz-Perez, C.R. Murdock, S.A. Didas, C.W. Jones, Direct capture of CO2 from ambient air, Chem. Rev. 116 (2016) 11840–11876. [3] B. Kirchner B. Intemann Catch the carbon dioxide Nat. Chem. 8 2016 401 402 B. Kirchner, B. Intemann, Catch the carbon dioxide, Nat Chem. 8 (2016) 401–402. [4] J. Artz T.E. Muller K. Thenert Sustainable conversion of carbon dioxide: an integrated review of catalysis and life cycle assessment Chem. Rev. 118 2017 434 504 J. Artz, T.E. Muller, K. Thenert, Sustainable conversion of carbon dioxide: an integrated review of catalysis and life cycle assessment, Chem. Rev. 118 (2017) 434–504. [5] M. Aresta A. Dibenedetto A. Angelini Catalysis for the valorization of exhaust carbon: from CO2 to chemicals, materials, and fuels. technological use of CO2 Chem. Rev. 114 2014 1709 1742 M. Aresta, A. Dibenedetto, A. Angelini, Catalysis for the valorization of exhaust carbon: from CO2 to chemicals, materials, and fuels. technological use of CO2, Chem. Rev. 114 (2014) 1709–1742. [6] Y. Zhou W.L. Zhang L. Ma Y. Zhou J. Wang Amino acid anion paired mesoporous poly(ionic liquids) as metal-/halogen-free heterogeneous catalysts for carbon dioxide fixation ACS Sustain. Chem. Eng. 7 2019 9387 9398 Y. Zhou, W.L. Zhang, L. Ma, Y. Zhou, J. Wang, Amino acid anion paired mesoporous poly(ionic liquids) as metal-/halogen-free heterogeneous catalysts for carbon dioxide fixation, ACS Sustain. Chem. Eng. 7 (2019) 9387–9398. [7] B. Xu J. Wang J. Sun Y. Huang J. Zhang X. Zhang S. Zhang Fixation of CO2 into cyclic carbonates catalyzed by ionic liquids: a multi-scale approach Green Chem. 17 2015 108 122 B. Xu, J. Wang, J. Sun, Y. Huang, J. Zhang, X. Zhang and S. Zhang, Fixation of CO2 into cyclic carbonates catalyzed by ionic liquids: a multi-scale approach, Green Chem. 17 (2015) 108–122. [8] X. Wang Y. Zhou Z. Guo G. Chen J. Li Y. Shi Y. Liu J. Wang Heterogeneous conversion of CO2 into cyclic carbonates at ambient pressure catalyzed by ionothermal-derived meso-macroporous hierarchical poly(ionic liquid)s Chem. Sci. 6 2015 6916 6924 X. Wang, Y. Zhou, Z. Guo, G. Chen, J. Li, Y. Shi, Y. Liu, J. Wang, Heterogeneous conversion of CO2 into cyclic carbonates at ambient pressure catalyzed by ionothermal-derived meso-macroporous hierarchical poly(ionic liquid)s, Chem. Sci. 6 (2015) 6916–6924. [9] J. Chen H. Li M. Zhong Q. Yang Hierarchical mesoporous organic polymer with an intercalated metal complex for the efficient synthesis of cyclic carbonates from flue gas Green Chem. 18 2016 6493 6500 J. Chen, H. Li, M. Zhong, Q. Yang, Hierarchical mesoporous organic polymer with an intercalated metal complex for the efficient synthesis of cyclic carbonates from flue gas, Green Chem. 18 (2016) 6493–6500. [10] T. Sakakura J.C. Choi H. Yasuda Transformation of carbon dioxide Chem. Rev. 107 2007 2365 2387 T. Sakakura, J.C. Choi, H. Yasuda, Transformation of carbon dioxide, Chem. Rev. 107 (2007) 2365–2387. [11] Zhang Y E.M. El-Sayed K. Su D. Yuan. Z. Han Facile syntheses of ionic polymers for efficient catalytic conversion of CO2 to cyclic carbonates J. CO2 Util. 42 2020 101301 Y, Zhang, E.M. El-Sayed, K. Su, D. Yuan. Z. Han, Facile syntheses of ionic polymers for efficient catalytic conversion of CO2 to cyclic carbonates, J. CO2 Util. 42 (2020) 101301. [12] W.D.A. Bezerra J.L.S. Milani C.H.D.J. Franco F.T. Martins A.D. Fatima A.F.A.D. Mata P.D. Chagas Bis-benzimidazolium salts as bifunctional organocatalysts for the cycloaddition of CO2 with epoxides Mol. Catal. 530 2022 112632 W.D.A. Bezerra, J.L.S. Milani, C.H.D.J. Franco, F.T. Martins, A.D. Fatima, A.F.A.D. Mata, P.D. Chagas, Bis-benzimidazolium salts as bifunctional organocatalysts for the cycloaddition of CO2 with epoxides, Mol. Catal. 530 (2022) 112632. [13] E. Comin A.S. Aquino C. Favero M.L. Mignoni R.F.D. Souza M.O.D. Souza S.B.C. Pergher C.X.D.S. Campos K.B. Gusmao Cyclic carbonate synthesis via cycloaddition of CO2 and epoxides catalysed by beta zeolites containing alkyl imidazolium ionic liquids used as structure-directing agents Mol. Catal. 530 2022 112624 E. Comin, A.S. Aquino, C. Favero, M.L. Mignoni, R.F.D. Souza, M.O.D. Souza, S.B.C. Pergher, C.X.D.S. Campos, K.B. Gusmao, Cyclic carbonate synthesis via cycloaddition of CO2 and epoxides catalysed by beta zeolites containing alkyl imidazolium ionic liquids used as structure-directing agents, Mol. Catal. 530 (2022) 112624. [14] Y. Qu J. Lan Y. Chen J. Sun Amino acid ionic liquids as efficient catalysts for CO2 capture and chemical conversion with epoxides under metal/halogen/cocatalyst/solvent-free conditions Sustain. Energy Fuels 5 2021 2494 2503 Y. Qu, J. Lan, Y. Chen, J. Sun, Amino acid ionic liquids as efficient catalysts for CO2 capture and chemical conversion with epoxides under metal/halogen/cocatalyst/solvent-free conditions, Sustainable Energy Fuels. 5 (2021) 2494–2503. [15] M. Alves B. Grignard R. Mereau C. Jerome T. Tassaing C. Detrembleur Organocatalyzed coupling of carbon dioxide with epoxides for the synthesis of cyclic carbonates: catalyst design and mechanistic studies Catal. Sci. Technol. 7 2017 2651 2684 M. Alves, B. Grignard, R. Mereau, C. Jerome, T. Tassaing, C. Detrembleur, Organocatalyzed coupling of carbon dioxide with epoxides for the synthesis of cyclic carbonates: catalyst design and mechanistic studies, Catal. Sci. Technol. 7 (2017) 2651–2684. [16] J. Ma J. Liu Z. Zhang B. Han The catalytic mechanism of KI and the co-catalytic mechanism of hydroxyl substances for cycloaddition of CO2 with propylene oxide Green Chem. 14 2012 2410 2420 J. Ma, J. Liu, Z. Zhang, B. Han, The catalytic mechanism of KI and the co-catalytic mechanism of hydroxyl substances for cycloaddition of CO2 with propylene oxide, Green Chem. 14 (2012) 2410–2420. [17] J. Tharun G. Mathai A.C. Kathalikkattil R. Roshan J.Y. Kwak D.W. Park Microwave-assisted synthesis of cyclic carbonates by a formic acid/KI catalytic system Green Chem. 15 2013 1673 1677 J. Tharun, G. Mathai, A.C. Kathalikkattil, R. Roshan, J.Y. Kwak, D.W. Park, Microwave-assisted synthesis of cyclic carbonates by a formic acid/KI catalytic system, Green Chem. 15 (2013) 1673–1677. [18] H.Q. Yang Z.X. Chen Theoretical investigation on conversion of CO2 with epoxides to cyclic carbonates by bifunctional metal-salen complexes bearing ionic liquid substsituents Mol. Catal. 511 2021 111733 H.Q. Yang, Z.X. Chen, Theoretical investigation on conversion of CO2 with epoxides to cyclic carbonates by bifunctional metal-salen complexes bearing ionic liquid substsituents, Mol. Catal. 511 (2021) 111733. [19] J. Chen X. Wu H. Ding N. Liu B. Liu L. He Tolerant bimetallic macrocyclic [OSSO]-type zinc complexes for efficient CO2 fixation into fyclic farbonates ACS Sustain. Chem. Eng. 9 2021 16210 16219 J. Chen, X. Wu, H. Ding, N. Liu, B. Liu, L. He, Tolerant bimetallic macrocyclic [OSSO]-type zinc complexes for efficient CO2 fixation into fyclic farbonates, ACS Sustain. Chem. Eng. 9 (2021) 16210–16219. [20] H. Zhang G. Zhai L. Lei C. Zhang Y. Liu Z. Wang H. Cheng Z. Zheng P. Wang Y. Dai B. Huang Photo-induced photo-thermal synergy effect leading to efficient CO2 cycloaddition with epoxide over a Fe-based metal organic framework J. Colloid Interface Sci. 625 2022 33 40 H. Zhang, G. Zhai, L. Lei, C. Zhang, Y. Liu, Z. Wang, H. Cheng, Z. Zheng, P. Wang, Y. Dai, B. Huang, Photo-induced photo-thermal synergy effect leading to efficient CO2 cycloaddition with epoxide over a Fe-based metal organic framework, J. Colloid Interface Sci. 625 (2022) 33–40. [21] M. Ding H.L. Jiang Incorporation of imidazolium-based poly(ionic liquid)s into a metal-organic framework for CO2 capture and conversion ACS Catal. 8 2018 3194 3201 M. Ding, H.L. Jiang, Incorporation of imidazolium-based poly(ionic liquid)s into a metal-organic framework for CO2 capture and conversion, ACS Catal. 8 (2018) 3194–3201. [22] N. Ullah A. Ramiere W. Raza P. Ye W. Liu X. Cai Z. Peng K.-.H. Kim Cobalt-based MOF nanoribbons with abundant O/N species for cycloaddition of carbon dioxide to epoxides J. Colloid Interface Sci. 623 2022 752 761 N. Ullah, A. Ramiere, W. Raza, P. Ye, W. Liu, X. Cai, Z. Peng, K.-.H. Kim, Cobalt-based MOF nanoribbons with abundant O/N species for cycloaddition of carbon dioxide to epoxides, J. Colloid Interface Sci. 623 (2022) 752–761. [23] L.F. Xiong L.J. Zhou R. Bu S.L. Yang E.Q. Gao Efficient ionic functionalization of metal-organic frameworks for efficient addition of carbon dioxide to epoxides Microporous Mesoporous Mater. 330 2022 111601 L.F. Xiong, L.J. Zhou, R. Bu, S.L. Yang, E.Q. Gao, Efficient ionic functionalization of metal-organic frameworks for efficient addition of carbon dioxide to epoxides, Microporous Mesoporous Mater. 330 (2022) 111601. [24] B. Feng Z. Zhang J. Wang D. Yang Q. Li Y. Liu H. Gai T. Huang H. Song Synthesis of hydrophobic Pd-poly(ionic liquid)s with excellent CO2 affinity to efficiently catalyze CO2 hydrogenation to formic acid Fuel 325 2022 124853 B. Feng, Z. Zhang, J. Wang, D. Yang, Q. Li, Y. Liu, H. Gai, T. Huang, H. Song, Synthesis of hydrophobic Pd-poly(ionic liquid)s with excellent CO2 affinity to efficiently catalyze CO2 hydrogenation to formic acid, Fuel. 325 (2022) 124853. [25] H. Song Y. Wang M. Xiao L. Liu Y. Liu X. Liu H. Gai Design of novel poly(ionic liquids) for the conversion of CO2 to cyclic carbonates under mild conditions without solvent ACS Sustain. Chem. Eng. 7 2019 9489 H. Song, Y. Wang, M. Xiao, L. Liu, Y. Liu, X. Liu, H. Gai, Design of novel poly(ionic liquids) for the conversion of CO2 to cyclic carbonates under mild conditions without solvent, ACS Sustainable Chem. Eng. 7 (2019) 9489. [26] Y. Qiu Y. Chen L. Lei X. Wang X. Zeng Z. Feng C. Deng D. Li H. Ji Bottom-up oriented synthesis of metalloporphyrin-based porous ionic polymers for the cycloaddition of CO2 to epoxides Mol. Catal. 521 2022 112171 Y. Qiu, Y. Chen, L. Lei, X. Wang, X. Zeng, Z. Feng, C. Deng, D. Li, H. Ji, Bottom-up oriented synthesis of metalloporphyrin-based porous ionic polymers for the cycloaddition of CO2 to epoxides, Mol. Catal. 521 (2022) 112171. [27] Y. Xie J. Liang Y. Fu M. Huang X. Xu H. Wang S. Tu J. Li Hypercrosslinked mesoporous poly(ionic liquid)s with high ionic density for efficient CO2 capture and conversion into cyclic carbonates J. Mater. Chem. A. 6 2018 6660 6666 Y. Xie, J. Liang, Y. Fu, M. Huang, X. Xu, H. Wang, S. Tu, J. Li, Hypercrosslinked mesoporous poly(ionic liquid)s with high ionic density for efficient CO2 capture and conversion into cyclic carbonates, J. Mater. Chem. A. 6 (2018) 6660–6666. [28] Q. Yu Y.Z. Cheng Z. Li D.H. Yang Q.Bo Meng B.H. Han Constructing ionic porous organic polymers with high specific surface area through crosslinking strategy Chem. Eng. J. 442 2022 136275 Q. Yu, Y.Z. Cheng, Z. Li, D.H. Yang, Q.Bo Meng, B.H. Han, Constructing ionic porous organic polymers with high specific surface area through crosslinking strategy, Chem. Eng. J. 442 (2022) 136275. [29] Y.-.R. Du X. Yang Y.F. Wang P.-.X. Guan R. Wang B.-.H. Xu Immobilization poly(ionic liquid)s into hierarchical porous covalent organic frameworks as heterogeneous catalyst for cycloaddition of CO2 with epoxides Mol. Catal. 520 2022 112164 Y.-.R. Du, X. Yang, Y.F. Wang, P.-.X. Guan, R. Wang, B.-.H. Xu, Immobilization poly(ionic liquid)s into hierarchical porous covalent organic frameworks as heterogeneous catalyst for cycloaddition of CO2 with epoxides, Mol. Catal. 520 (2022) 112164. [30] J. Lan Y. Qu Z. Wang P. Xu J. Sun A facile fabrication of a multi-functional and hierarchical Zn-based MOF as an efficient catalyst for CO2 fixation at room-temperature Inorg. Chem. Front. 8 2021 3085 3095 J. Lan, Y. Qu, Z. Wang, P. Xu, J. Sun, A facile fabrication of a multi-functional and hierarchical Zn-based MOF as an efficient catalyst for CO2 fixation at room-temperature, Inorg. Chem. Front. 8 (2021) 3085–3095. [31] R. Luo M. Chen F. Zhou J. Zhan Q. Deng Y. Yu Y. Zhang W. Xu Y. Fang Synthesis of metalloporphyrin-based porous organic polymers and their functionalization for conversion of CO2 into cyclic carbonates: recent advances, opportunities and challenges J. Mater. Chem. A. 9 2021 25731 25749 R. Luo, M. Chen, F. Zhou, J. Zhan, Q. Deng, Y. Yu, Y. Zhang, W. Xu, Y. Fang, Synthesis of metalloporphyrin-based porous organic polymers and their functionalization for conversion of CO2 into cyclic carbonates: recent advances, opportunities and challenges, J. Mater. Chem. A. 9 (2021) 25731–25749. [32] H. Lyu H. Li N. Hanikel K. Wang O.M. Yaghi Covalent organic frameworks for carbon dioxide capture from air J. Am. Chem. Soc. 144 2022 12989 12995 H. Lyu, H. Li, N. Hanikel, K. Wang, O.M. Yaghi, Covalent organic frameworks for carbon dioxide capture from air, J. Am. Chem. Soc. 144 (2022) 12989–12995. [33] Y. Zhao H. Huang H. Zhu C. Zhong Design and synthesis of novel pyridine-rich cationic covalent triazine framework for CO2 capture and conversion Microporous Mesoporous Mater. 329 2022 111526 Y. Zhao, H. Huang, H. Zhu, C. Zhong, Design and synthesis of novel pyridine-rich cationic covalent triazine framework for CO2 capture and conversion, Microporous Mesoporous Mater. 329 (2022) 111526. [34] M.Mohamed Samy I.M.A. Mekhemer M.G. Mohamed M.Hammad Elsayed K.H. Lin Y.-.K. Chen T.L. Wu H.H. Chou S.W. Kuo Conjugated microporous polymers incorporating thiazolo[5,4-d]thiazole moieties for sunlight-driven hydrogen production from water Chem. Eng. J. 446 2022 137158 M.Mohamed Samy, I.M.A. Mekhemer, M.G. Mohamed, M.Hammad Elsayed, K.H. Lin, Y.-.K. Chen, T.L. Wu, H.H. Chou, S.W. Kuo, Conjugated microporous polymers incorporating thiazolo[5,4-d]thiazole moieties for sunlight-driven hydrogen production from water, Chem. Eng. J. 446 (2022) 137158. [35] M.Z. Ahmad R. Castro-Munoz P.M. Budd Boosting gas separation performance and suppressing the physical aging of polymers of intrinsic microporosity (PIM-1) by nanomaterial blending Nanoscale 12 2020 23333 23370 M.Z. Ahmad, R. Castro-Munoz, P.M. Budd, Boosting gas separation performance and suppressing the physical aging of polymers of intrinsic microporosity (PIM-1) by nanomaterial blending, Nanoscale. 12 (2020) 23333–23370. [36] L.X. Tan B.E. Tan Research progress in hypercrosslinked microporous organic polymers Acta. Chim. Sinica. 73 2015 530 540 L.X. Tan, B.E. Tan, Research progress in hypercrosslinked microporous organic polymers, Acta. Chim. Sinica. 73 (2015) 530–540. [37] X. Liao X. Xiang Z. Wang R. Ma L. Kong X. Gao J. He W. Hou C. Peng J. Lin A novel crosslinker for synthesizing hypercrosslinked ionic polymers containing activating groups as efficient catalysts for the CO2 cycloaddition reaction Sustain. Energy Fuels. 6 2022 2846 2857 X. Liao, X. Xiang, Z. Wang, R. Ma, L. Kong, X. Gao, J. He, W. Hou, C. Peng, J. Lin, A novel crosslinker for synthesizing hypercrosslinked ionic polymers containing activating groups as efficient catalysts for the CO2 cycloaddition reaction, Sustain. Energy Fuels. 6 (2022) 2846–2857. [38] D. Kim S. Subramanian D. Thirion Y.D. Song A. Jamal M.S. Otaibi C.T. Yavuz Quaternary ammonium salt grafted nanoporous covalent organic polymer for atmospheric CO2 fixation and cyclic carbonate formation Catal. Today. 356 2020 527 534 D. Kim, S. Subramanian, D. Thirion, Y.D. Song, A. Jamal, M.S. Otaibi, C.T. Yavuz, Quaternary ammonium salt grafted nanoporous covalent organic polymer for atmospheric CO2 fixation and cyclic carbonate formation, Catal. Today. 356 (2020) 527–534. [39] X. Liao B. Pei R. Ma L. Kong X. Gao J. He X. Luo J. Lin Hypercrosslinked ionic polymers with high ionic content for efficient conversion of carbon dioxide into cyclic carbonates Catalysts 12 2022 62 X. Liao, B. Pei, R. Ma, L. Kong, X. Gao, J. He, X. Luo, J. Lin, Hypercrosslinked ionic polymers with high ionic content for efficient conversion of carbon dioxide into cyclic carbonates, Catalysts. 12 (2022) 62. [40] C. Liu L. Shi J. Zhang J. Sun One-pot synthesis of pyridine-based ionic hyper-cross-linked polymers with hierarchical pores for efficient CO2 capture and catalytic conversion Chem. Eng. J. 427 2022 131633 C. Liu, L. Shi, J. Zhang, J. Sun, One-pot synthesis of pyridine-based ionic hyper-cross-linked polymers with hierarchical pores for efficient CO2 capture and catalytic conversion, Chem. Eng. J. 427 (2022) 131633. [41] J. Li D. Jia Z. Guo Y. Liu Y. Lyu Y. Zhou J. Wang Imidazolinium based porous hypercrosslinked ionic polymers for efficient CO2 capture and fixation with epoxides Green Chem. 19 2017 2675 2686 J. Li, D. Jia, Z. Guo, Y. Liu, Y. Lyu, Y. Zhou, J. Wang, Imidazolinium based porous hypercrosslinked ionic polymers for efficient CO2 capture and fixation with epoxides, Green Chem. 19 (2017) 2675–2686. [42] Y. Sang J. Huang Benzimidazole-based hyper-cross-linked poly(ionic liquid)s for efficient CO2 capture and conversion Chem. Eng. J. 385 2020 123973 Sang Y., Huang J., Benzimidazole-based hyper-cross-linked poly(ionic liquid)s for efficient CO2 capture and conversion, Chem. Eng. J. 385 (2020) 123973. [43] J. Wang J.G. Wei Yang G. Yi Y. Zhang Phosphonium salt incorporated hypercrosslinked porous polymers for CO2 capture and conversion Chem. Commun. 51 2015 15708 15711 J. Wang, J.G. Wei Yang, G. Yi, Y. Zhang, Phosphonium salt incorporated hypercrosslinked porous polymers for CO2 capture and conversion, Chem. Commun. 51 (2015) 15708–15711. [44] H. Song Y. Wang Y. Liu L. Chen B. Feng X. Jin Y. Zhou T. Huang M. Xiao F. Huang H. Gai Conferring poly(ionic liquid)s with high surface areas for enhanced catalytic activity ACS Sustain. Chem. Eng. 9 2021 2115 2128 H. Song, Y. Wang, Y. Liu, L. Chen, B. Feng, X. Jin, Y. Zhou, T. Huang, M. Xiao, F. Huang, H. Gai, Conferring poly(ionic liquid)s with high surface areas for enhanced catalytic activity, ACS Sustain. Chem. Eng. 9 (2021) 2115–2128. [45] J. Li Y. Han T. Ji N. Wu H. Lin J. Jiang J. Zhu Porous metallosalen hypercrosslinked ionic polymers for cooperative CO2 cycloaddition conversion Ind. Eng. Chem. Res. 59 2020 676 684 J. Li, Y. Han, T. Ji, N. Wu, H. Lin, J. Jiang, J. Zhu, Porous metallosalen hypercrosslinked ionic polymers for cooperative CO2 cycloaddition conversion, Ind. Eng. Chem. Res. 59 (2020) 676–684. [46] P. Puthiaraj S. Ravi K. Yu W.-.S. Ahn CO2 adsorption and conversion into cyclic carbonates over a porous ZnBr2-grafted N-heterocyclic carbene-based aromatic polymer Appl. Catal. B. 251 2019 195 205 P. Puthiaraj, S. Ravi, K. Yu, W.-.S. Ahn, CO2 adsorption and conversion into cyclic carbonates over a porous ZnBr2-grafted N-heterocyclic carbene-based aromatic polymer, Appl. Catal. B. 251 (2019) 195–205. [47] M. Lombardo M. Chiarucci C. Trombini The first enantioselective addition of diethylzinc to aldehydes in ionic liquids catalysed by a recyclable ion-tagged diphenylprolinol Chem. Eur. J. 14 2008 11288 11291 M. Lombardo, M. Chiarucci, C. Trombini, The first enantioselective addition of diethylzinc to aldehydes in ionic liquids catalysed by a recyclable ion-tagged diphenylprolinol, Chem. Eur. J. 14 (2008) 11288–11291. [48] W. Zhang Q. Wang H. Wu P. Wu M. He A highly ordered mesoporous polymer supported imidazolium-based ionic liquid: an efficient catalyst for cycloaddition of CO2 with epoxides to produce cyclic carbonates Green Chem. 16 2014 4767 4774 W. Zhang, Q. Wang, H. Wu, P. Wu, M. He, A highly ordered mesoporous polymer supported imidazolium-based ionic liquid: an efficient catalyst for cycloaddition of CO2 with epoxides to produce cyclic carbonates, Green Chem. 16 (2014) 4767–4774. [49] S. Men K.R. Lovelock P. Licence X-ray photoelectron spectroscopy of pyrrolidinium-based ionic liquids: cation–anion interactions and a comparison to imidazolium-based analogues Phys. Chem. Chem. Phys. 13 2011 15244 15255 S. Men, K.R. Lovelock, P. Licence, X-ray photoelectron spectroscopy of pyrrolidinium-based ionic liquids: cation–anion interactions and a comparison to imidazolium-based analogues, Phys. Chem. Chem. Phys. 13 (2011) 15244–15255. [50] K. Song Z. Zou D. Wang B. Tan J. Wang J. Chen T. Li Microporous organic polymers derived microporous carbon supported Pd catalysts for oxygen reduction reaction: impact of framework and heteroatom J. Phys. Chem. C. 120 2016 2187 2197 K. Song, Z. Zou, D. Wang, B. Tan, J. Wang, J. Chen, T. Li, Microporous organic polymers derived microporous carbon supported Pd catalysts for oxygen reduction reaction: impact of framework and heteroatom, J. Phys. Chem. C. 120 (2016) 2187–2197. [51] Y. Chen R. Luo J. Bao Q. Xu J. Jiang X. Zhou H. Ji Function-oriented ionic polymers having highdensity active sites for sustainable carbon dioxide conversion J. Mater. Chem. A. 6 2018 9172 9182 Y. Chen, R. Luo, J. Bao, Q. Xu, J. Jiang, X. Zhou, H. Ji, Function-oriented ionic polymers having highdensity active sites for sustainable carbon dioxide conversion, J. Mater. Chem. A. 6 (2018) 9172–9182. [52] Z.F. Dai Q. Sun X.L. Liu L.P. Guo J.X. Li S.X. Pan C.Q. Bian L. Wang X. Hu X.J. Meng L.H. Zhao F. Deng F.S. Xiao A hierarchical bipyridine-constructed framework for highly efficient carbon dioxide capture and catalytic conversion ChemSusChem 10 2017 1186 1192 Z.F. Dai, Q. Sun, X.L. Liu, L.P. Guo, J.X. Li, S.X. Pan, C.Q. Bian, L. Wang, X. Hu, X.J. Meng, L.H. Zhao, F. Deng, F.S. Xiao, A hierarchical bipyridine-constructed framework for highly efficient carbon dioxide capture and catalytic conversion, ChemSusChem. 10 (2017) 1186–1192. [53] W. Zhang Y. Mei P. Wu H.H. Wu M.Y. He Highly tunable periodic imidazole-based mesoporous polymers as cooperative catalysts for efficient carbon dioxide fixation Catal. Sci. Technol. 9 2019 1030 1038 W. Zhang, Y. Mei, P. Wu, H.H. Wu, M.Y. He, Highly tunable periodic imidazole-based mesoporous polymers as cooperative catalysts for efficient carbon dioxide fixation, Catal. Sci. Technol. 9 (2019) 1030–1038. [54] B. Dong L. Wang S. Zhao R. Ge X. Song Y. Wang Y. Gao Immobilization of ionic liquids to covalent organic frameworks for catalyzing the formylation of amines with CO2 and phenylsilane Chem. Commun. 52 2016 7082 7085 B. Dong, L. Wang, S. Zhao, R. Ge, X. Song, Y. Wang, Y. Gao, Immobilization of ionic liquids to covalent organic frameworks for catalyzing the formylation of amines with CO2 and phenylsilane, Chem. Commun. 52 (2016) 7082–7085. [55] Y. Xie Q. Sun Y. Fu L. Song J. Liang X. Xu H. Wang J. Li S. Tu X. Lu J. Li Sponge-like quaternary ammonium-based poly(ionic liquid)s for high CO2 capture and efficient cycloaddition under mild conditions J. Mater. Chem. A. 5 2017 25594 25600 Y. Xie, Q. Sun, Y. Fu, L. Song, J. Liang, X. Xu, H. Wang, J. Li, S. Tu, X. Lu, J. Li, Sponge-like quaternary ammonium-based poly(ionic liquid)s for high CO2 capture and efficient cycloaddition under mild conditions, J. Mater. Chem. A. 5 (2017) 25594–25600. [56] D. Jia L. Ma Y. Wang W. Zhang J. Li Y. Zhou J. Wang Efficient CO2 enrichment and fixation by engineering micropores of multifunctional hypercrosslinked ionic polymers Chem. Eng. J. 390 2020 124652 D. Jia, L. Ma, Y. Wang, W. Zhang, J. Li, Y. Zhou, J. Wang, Efficient CO2 enrichment and fixation by engineering micropores of multifunctional hypercrosslinked ionic polymers, Chem. Eng. J. 390 (2020) 124652.",
      "scopus-id": "85142799166",
      "coredata": {
        "eid": "1-s2.0-S2468823122007209",
        "dc:description": "High catalytic activity for the conversion of CO2 into cyclic carbonates requires the preparation of porous ionic catalysts with multi-active sites and high ionic density. Herein, a series of hypercrosslinked ionic polymers (HIPs) with multi-ionic sites, high ionic density and hydrogen bond donors (imino group) were synthesized through the one-pot Friedel–Crafts alkylation and post-synthetic strategies. Adsorption measurements showed that HIPs exhibited outstanding CO2 uptakes (1.80−2.97 mmol g − 1, 273 K and 1 bar). Importantly, under the synergistic effects of multi-ionic sites, high ionic density and hydrogen bond donors, the metal-free catalyst HBIM(0.5)@QA-Br showed excellent catalytic yield (99%) and selectivity (99%) for cycloaddition of CO2 with epichlorohydrin at 140 °C, 0.1 MPa CO2 in 2 h. By extending the time appropriately, high catalytic yields (styrene oxide, 140 °C, 4 h, 99% yield; 120 °C, 6.5 h, 93% yield; 100 °C, 16 h, 94% yield) were achieved at low temperature. In addition, the catalyst can be easily reused with stable recyclability. This work not only provides a new strategy to prepare metal-free porous ionic catalysts with multi-ionic sites and hydrogen bond donors but also demonstrated that the synergistic catalysis of multi-ionic sites is helpful to promote CO2 conversion.",
        "openArchiveArticle": "false",
        "prism:coverDate": "2023-01-15",
        "openaccessUserLicense": null,
        "prism:aggregationType": "Journal",
        "prism:url": "https://api.elsevier.com/content/article/pii/S2468823122007209",
        "dc:creator": [
          {
            "@_fa": "true",
            "$": "Liao, Xu"
          },
          {
            "@_fa": "true",
            "$": "Wang, Zeyu"
          },
          {
            "@_fa": "true",
            "$": "Kong, Lingzheng"
          },
          {
            "@_fa": "true",
            "$": "Gao, Xilin"
          },
          {
            "@_fa": "true",
            "$": "He, Jiao"
          },
          {
            "@_fa": "true",
            "$": "Huang, Dongha"
          },
          {
            "@_fa": "true",
            "$": "Lin, Jinqing"
          }
        ],
        "link": [
          {
            "@_fa": "true",
            "@rel": "self",
            "@href": "https://api.elsevier.com/content/article/pii/S2468823122007209"
          },
          {
            "@_fa": "true",
            "@rel": "scidir",
            "@href": "https://www.sciencedirect.com/science/article/pii/S2468823122007209"
          }
        ],
        "dc:format": "application/json",
        "openaccessType": null,
        "pii": "S2468-8231(22)00720-9",
        "prism:volume": "535",
        "articleNumber": "112834",
        "prism:publisher": "Elsevier B.V.",
        "dc:title": "Synergistic catalysis of hypercrosslinked ionic polymers with multi-ionic sites for conversion of CO2 to cyclic carbonates",
        "prism:copyright": "© 2022 Elsevier B.V. All rights reserved.",
        "openaccess": "0",
        "prism:issn": "24688231",
        "dcterms:subject": [
          {
            "@_fa": "true",
            "$": "CO2 cycloaddition"
          },
          {
            "@_fa": "true",
            "$": "Hypercrosslinked ionic polymers"
          },
          {
            "@_fa": "true",
            "$": "Multi-ionic sites"
          },
          {
            "@_fa": "true",
            "$": "Synergistic catalysis"
          }
        ],
        "openaccessArticle": "false",
        "prism:publicationName": "Molecular Catalysis",
        "openaccessSponsorType": null,
        "prism:pageRange": "112834",
        "pubType": "fla",
        "prism:coverDisplayDate": "15 January 2023",
        "prism:doi": "10.1016/j.mcat.2022.112834",
        "prism:startingPage": "112834",
        "dc:identifier": "doi:10.1016/j.mcat.2022.112834",
        "openaccessSponsorName": null
      },
      "objects": {
        "object": [
          {
            "@category": "standard",
            "@height": "408",
            "@width": "546",
            "@_fa": "true",
            "$": "https://api.elsevier.com/content/object/eid/1-s2.0-S2468823122007209-gr8.jpg?httpAccept=%2A%2F%2A",
            "@multimediatype": "JPEG image file",
            "@type": "IMAGE-DOWNSAMPLED",
            "@size": "67609",
            "@ref": "gr8",
            "@mimetype": "image/jpeg"
          },
          {
            "@category": "standard",
            "@height": "288",
            "@width": "359",
            "@_fa": "true",
            "$": "https://api.elsevier.com/content/object/eid/1-s2.0-S2468823122007209-gr7.jpg?httpAccept=%2A%2F%2A",
            "@multimediatype": "JPEG image file",
            "@type": "IMAGE-DOWNSAMPLED",
            "@size": "30614",
            "@ref": "gr7",
            "@mimetype": "image/jpeg"
          },
          {
            "@category": "standard",
            "@height": "470",
            "@width": "677",
            "@_fa": "true",
            "$": "https://api.elsevier.com/content/object/eid/1-s2.0-S2468823122007209-gr6.jpg?httpAccept=%2A%2F%2A",
            "@multimediatype": "JPEG image file",
            "@type": "IMAGE-DOWNSAMPLED",
            "@size": "99216",
            "@ref": "gr6",
            "@mimetype": "image/jpeg"
          },
          {
            "@category": "standard",
            "@height": "258",
            "@width": "675",
            "@_fa": "true",
            "$": "https://api.elsevier.com/content/object/eid/1-s2.0-S2468823122007209-gr5.jpg?httpAccept=%2A%2F%2A",
            "@multimediatype": "JPEG image file",
            "@type": "IMAGE-DOWNSAMPLED",
            "@size": "76403",
            "@ref": "gr5",
            "@mimetype": "image/jpeg"
          },
          {
            "@category": "standard",
            "@height": "260",
            "@width": "666",
            "@_fa": "true",
            "$": "https://api.elsevier.com/content/object/eid/1-s2.0-S2468823122007209-gr4.jpg?httpAccept=%2A%2F%2A",
            "@multimediatype": "JPEG image file",
            "@type": "IMAGE-DOWNSAMPLED",
            "@size": "86355",
            "@ref": "gr4",
            "@mimetype": "image/jpeg"
          },
          {
            "@category": "standard",
            "@height": "458",
            "@width": "715",
            "@_fa": "true",
            "$": "https://api.elsevier.com/content/object/eid/1-s2.0-S2468823122007209-gr3.jpg?httpAccept=%2A%2F%2A",
            "@multimediatype": "JPEG image file",
            "@type": "IMAGE-DOWNSAMPLED",
            "@size": "130690",
            "@ref": "gr3",
            "@mimetype": "image/jpeg"
          },
          {
            "@category": "standard",
            "@height": "559",
            "@width": "715",
            "@_fa": "true",
            "$": "https://api.elsevier.com/content/object/eid/1-s2.0-S2468823122007209-gr2.jpg?httpAccept=%2A%2F%2A",
            "@multimediatype": "JPEG image file",
            "@type": "IMAGE-DOWNSAMPLED",
            "@size": "144308",
            "@ref": "gr2",
            "@mimetype": "image/jpeg"
          },
          {
            "@category": "standard",
            "@height": "36",
            "@width": "117",
            "@_fa": "true",
            "$": "https://api.elsevier.com/content/object/eid/1-s2.0-S2468823122007209-fx9.jpg?httpAccept=%2A%2F%2A",
            "@multimediatype": "JPEG image file",
            "@type": "IMAGE-DOWNSAMPLED",
            "@size": "1607",
            "@ref": "fx9",
            "@mimetype": "image/jpeg"
          },
          {
            "@category": "standard",
            "@height": "552",
            "@width": "715",
            "@_fa": "true",
            "$": "https://api.elsevier.com/content/object/eid/1-s2.0-S2468823122007209-gr1.jpg?httpAccept=%2A%2F%2A",
            "@multimediatype": "JPEG image file",
            "@type": "IMAGE-DOWNSAMPLED",
            "@size": "142858",
            "@ref": "gr1",
            "@mimetype": "image/jpeg"
          },
          {
            "@category": "standard",
            "@height": "93",
            "@width": "133",
            "@_fa": "true",
            "$": "https://api.elsevier.com/content/object/eid/1-s2.0-S2468823122007209-fx8.jpg?httpAccept=%2A%2F%2A",
            "@multimediatype": "JPEG image file",
            "@type": "IMAGE-DOWNSAMPLED",
            "@size": "3079",
            "@ref": "fx8",
            "@mimetype": "image/jpeg"
          },
          {
            "@category": "standard",
            "@height": "66",
            "@width": "119",
            "@_fa": "true",
            "$": "https://api.elsevier.com/content/object/eid/1-s2.0-S2468823122007209-fx7.jpg?httpAccept=%2A%2F%2A",
            "@multimediatype": "JPEG image file",
            "@type": "IMAGE-DOWNSAMPLED",
            "@size": "2291",
            "@ref": "fx7",
            "@mimetype": "image/jpeg"
          },
          {
            "@category": "standard",
            "@height": "92",
            "@width": "127",
            "@_fa": "true",
            "$": "https://api.elsevier.com/content/object/eid/1-s2.0-S2468823122007209-fx6.jpg?httpAccept=%2A%2F%2A",
            "@multimediatype": "JPEG image file",
            "@type": "IMAGE-DOWNSAMPLED",
            "@size": "2749",
            "@ref": "fx6",
            "@mimetype": "image/jpeg"
          },
          {
            "@category": "standard",
            "@height": "64",
            "@width": "116",
            "@_fa": "true",
            "$": "https://api.elsevier.com/content/object/eid/1-s2.0-S2468823122007209-fx5.jpg?httpAccept=%2A%2F%2A",
            "@multimediatype": "JPEG image file",
            "@type": "IMAGE-DOWNSAMPLED",
            "@size": "1999",
            "@ref": "fx5",
            "@mimetype": "image/jpeg"
          },
          {
            "@category": "standard",
            "@height": "320",
            "@width": "391",
            "@_fa": "true",
            "$": "https://api.elsevier.com/content/object/eid/1-s2.0-S2468823122007209-sc2.jpg?httpAccept=%2A%2F%2A",
            "@multimediatype": "JPEG image file",
            "@type": "IMAGE-DOWNSAMPLED",
            "@size": "41159",
            "@ref": "sc2",
            "@mimetype": "image/jpeg"
          },
          {
            "@category": "standard",
            "@height": "92",
            "@width": "93",
            "@_fa": "true",
            "$": "https://api.elsevier.com/content/object/eid/1-s2.0-S2468823122007209-fx4.jpg?httpAccept=%2A%2F%2A",
            "@multimediatype": "JPEG image file",
            "@type": "IMAGE-DOWNSAMPLED",
            "@size": "2491",
            "@ref": "fx4",
            "@mimetype": "image/jpeg"
          },
          {
            "@category": "standard",
            "@height": "205",
            "@width": "677",
            "@_fa": "true",
            "$": "https://api.elsevier.com/content/object/eid/1-s2.0-S2468823122007209-sc1.jpg?httpAccept=%2A%2F%2A",
            "@multimediatype": "JPEG image file",
            "@type": "IMAGE-DOWNSAMPLED",
            "@size": "46017",
            "@ref": "sc1",
            "@mimetype": "image/jpeg"
          },
          {
            "@category": "standard",
            "@height": "66",
            "@width": "79",
            "@_fa": "true",
            "$": "https://api.elsevier.com/content/object/eid/1-s2.0-S2468823122007209-fx3.jpg?httpAccept=%2A%2F%2A",
            "@multimediatype": "JPEG image file",
            "@type": "IMAGE-DOWNSAMPLED",
            "@size": "1681",
            "@ref": "fx3",
            "@mimetype": "image/jpeg"
          },
          {
            "@category": "standard",
            "@height": "58",
            "@width": "84",
            "@_fa": "true",
            "$": "https://api.elsevier.com/content/object/eid/1-s2.0-S2468823122007209-fx2.jpg?httpAccept=%2A%2F%2A",
            "@multimediatype": "JPEG image file",
            "@type": "IMAGE-DOWNSAMPLED",
            "@size": "1891",
            "@ref": "fx2",
            "@mimetype": "image/jpeg"
          },
          {
            "@category": "standard",
            "@height": "35",
            "@width": "67",
            "@_fa": "true",
            "$": "https://api.elsevier.com/content/object/eid/1-s2.0-S2468823122007209-fx1.jpg?httpAccept=%2A%2F%2A",
            "@multimediatype": "JPEG image file",
            "@type": "IMAGE-DOWNSAMPLED",
            "@size": "1146",
            "@ref": "fx1",
            "@mimetype": "image/jpeg"
          },
          {
            "@category": "standard",
            "@height": "174",
            "@width": "301",
            "@_fa": "true",
            "$": "https://api.elsevier.com/content/object/eid/1-s2.0-S2468823122007209-ga1.jpg?httpAccept=%2A%2F%2A",
            "@multimediatype": "JPEG image file",
            "@type": "IMAGE-DOWNSAMPLED",
            "@size": "32943",
            "@ref": "ga1",
            "@mimetype": "image/jpeg"
          },
          {
            "@category": "standard",
            "@height": "43",
            "@width": "134",
            "@_fa": "true",
            "$": "https://api.elsevier.com/content/object/eid/1-s2.0-S2468823122007209-fx15.jpg?httpAccept=%2A%2F%2A",
            "@multimediatype": "JPEG image file",
            "@type": "IMAGE-DOWNSAMPLED",
            "@size": "1760",
            "@ref": "fx15",
            "@mimetype": "image/jpeg"
          },
          {
            "@category": "standard",
            "@height": "53",
            "@width": "154",
            "@_fa": "true",
            "$": "https://api.elsevier.com/content/object/eid/1-s2.0-S2468823122007209-fx14.jpg?httpAccept=%2A%2F%2A",
            "@multimediatype": "JPEG image file",
            "@type": "IMAGE-DOWNSAMPLED",
            "@size": "2592",
            "@ref": "fx14",
            "@mimetype": "image/jpeg"
          },
          {
            "@category": "standard",
            "@height": "52",
            "@width": "70",
            "@_fa": "true",
            "$": "https://api.elsevier.com/content/object/eid/1-s2.0-S2468823122007209-fx17.jpg?httpAccept=%2A%2F%2A",
            "@multimediatype": "JPEG image file",
            "@type": "IMAGE-DOWNSAMPLED",
            "@size": "1521",
            "@ref": "fx17",
            "@mimetype": "image/jpeg"
          },
          {
            "@category": "standard",
            "@height": "82",
            "@width": "155",
            "@_fa": "true",
            "$": "https://api.elsevier.com/content/object/eid/1-s2.0-S2468823122007209-fx16.jpg?httpAccept=%2A%2F%2A",
            "@multimediatype": "JPEG image file",
            "@type": "IMAGE-DOWNSAMPLED",
            "@size": "2833",
            "@ref": "fx16",
            "@mimetype": "image/jpeg"
          },
          {
            "@category": "standard",
            "@height": "39",
            "@width": "102",
            "@_fa": "true",
            "$": "https://api.elsevier.com/content/object/eid/1-s2.0-S2468823122007209-fx11.jpg?httpAccept=%2A%2F%2A",
            "@multimediatype": "JPEG image file",
            "@type": "IMAGE-DOWNSAMPLED",
            "@size": "1476",
            "@ref": "fx11",
            "@mimetype": "image/jpeg"
          },
          {
            "@category": "standard",
            "@height": "62",
            "@width": "136",
            "@_fa": "true",
            "$": "https://api.elsevier.com/content/object/eid/1-s2.0-S2468823122007209-fx10.jpg?httpAccept=%2A%2F%2A",
            "@multimediatype": "JPEG image file",
            "@type": "IMAGE-DOWNSAMPLED",
            "@size": "2253",
            "@ref": "fx10",
            "@mimetype": "image/jpeg"
          },
          {
            "@category": "standard",
            "@height": "35",
            "@width": "141",
            "@_fa": "true",
            "$": "https://api.elsevier.com/content/object/eid/1-s2.0-S2468823122007209-fx13.jpg?httpAccept=%2A%2F%2A",
            "@multimediatype": "JPEG image file",
            "@type": "IMAGE-DOWNSAMPLED",
            "@size": "1840",
            "@ref": "fx13",
            "@mimetype": "image/jpeg"
          },
          {
            "@category": "standard",
            "@height": "66",
            "@width": "123",
            "@_fa": "true",
            "$": "https://api.elsevier.com/content/object/eid/1-s2.0-S2468823122007209-fx12.jpg?httpAccept=%2A%2F%2A",
            "@multimediatype": "JPEG image file",
            "@type": "IMAGE-DOWNSAMPLED",
            "@size": "2428",
            "@ref": "fx12",
            "@mimetype": "image/jpeg"
          },
          {
            "@category": "standard",
            "@height": "52",
            "@width": "113",
            "@_fa": "true",
            "$": "https://api.elsevier.com/content/object/eid/1-s2.0-S2468823122007209-fx18.jpg?httpAccept=%2A%2F%2A",
            "@multimediatype": "JPEG image file",
            "@type": "IMAGE-DOWNSAMPLED",
            "@size": "2138",
            "@ref": "fx18",
            "@mimetype": "image/jpeg"
          },
          {
            "@category": "thumbnail",
            "@height": "164",
            "@width": "219",
            "@_fa": "true",
            "$": "https://api.elsevier.com/content/object/eid/1-s2.0-S2468823122007209-gr8.sml?httpAccept=%2A%2F%2A",
            "@multimediatype": "GIF image file",
            "@type": "IMAGE-THUMBNAIL",
            "@size": "17347",
            "@ref": "gr8",
            "@mimetype": "image/gif"
          },
          {
            "@category": "thumbnail",
            "@height": "163",
            "@width": "204",
            "@_fa": "true",
            "$": "https://api.elsevier.com/content/object/eid/1-s2.0-S2468823122007209-gr7.sml?httpAccept=%2A%2F%2A",
            "@multimediatype": "GIF image file",
            "@type": "IMAGE-THUMBNAIL",
            "@size": "9508",
            "@ref": "gr7",
            "@mimetype": "image/gif"
          },
          {
            "@category": "thumbnail",
            "@height": "152",
            "@width": "219",
            "@_fa": "true",
            "$": "https://api.elsevier.com/content/object/eid/1-s2.0-S2468823122007209-gr6.sml?httpAccept=%2A%2F%2A",
            "@multimediatype": "GIF image file",
            "@type": "IMAGE-THUMBNAIL",
            "@size": "11035",
            "@ref": "gr6",
            "@mimetype": "image/gif"
          },
          {
            "@category": "thumbnail",
            "@height": "84",
            "@width": "219",
            "@_fa": "true",
            "$": "https://api.elsevier.com/content/object/eid/1-s2.0-S2468823122007209-gr5.sml?httpAccept=%2A%2F%2A",
            "@multimediatype": "GIF image file",
            "@type": "IMAGE-THUMBNAIL",
            "@size": "10854",
            "@ref": "gr5",
            "@mimetype": "image/gif"
          },
          {
            "@category": "thumbnail",
            "@height": "86",
            "@width": "219",
            "@_fa": "true",
            "$": "https://api.elsevier.com/content/object/eid/1-s2.0-S2468823122007209-gr4.sml?httpAccept=%2A%2F%2A",
            "@multimediatype": "GIF image file",
            "@type": "IMAGE-THUMBNAIL",
            "@size": "11615",
            "@ref": "gr4",
            "@mimetype": "image/gif"
          },
          {
            "@category": "thumbnail",
            "@height": "140",
            "@width": "219",
            "@_fa": "true",
            "$": "https://api.elsevier.com/content/object/eid/1-s2.0-S2468823122007209-gr3.sml?httpAccept=%2A%2F%2A",
            "@multimediatype": "GIF image file",
            "@type": "IMAGE-THUMBNAIL",
            "@size": "19783",
            "@ref": "gr3",
            "@mimetype": "image/gif"
          },
          {
            "@category": "thumbnail",
            "@height": "164",
            "@width": "210",
            "@_fa": "true",
            "$": "https://api.elsevier.com/content/object/eid/1-s2.0-S2468823122007209-gr2.sml?httpAccept=%2A%2F%2A",
            "@multimediatype": "GIF image file",
            "@type": "IMAGE-THUMBNAIL",
            "@size": "15862",
            "@ref": "gr2",
            "@mimetype": "image/gif"
          },
          {
            "@category": "thumbnail",
            "@height": "68",
            "@width": "219",
            "@_fa": "true",
            "$": "https://api.elsevier.com/content/object/eid/1-s2.0-S2468823122007209-fx9.sml?httpAccept=%2A%2F%2A",
            "@multimediatype": "GIF image file",
            "@type": "IMAGE-THUMBNAIL",
            "@size": "2614",
            "@ref": "fx9",
            "@mimetype": "image/gif"
          },
          {
            "@category": "thumbnail",
            "@height": "164",
            "@width": "212",
            "@_fa": "true",
            "$": "https://api.elsevier.com/content/object/eid/1-s2.0-S2468823122007209-gr1.sml?httpAccept=%2A%2F%2A",
            "@multimediatype": "GIF image file",
            "@type": "IMAGE-THUMBNAIL",
            "@size": "16257",
            "@ref": "gr1",
            "@mimetype": "image/gif"
          },
          {
            "@category": "thumbnail",
            "@height": "154",
            "@width": "219",
            "@_fa": "true",
            "$": "https://api.elsevier.com/content/object/eid/1-s2.0-S2468823122007209-fx8.sml?httpAccept=%2A%2F%2A",
            "@multimediatype": "GIF image file",
            "@type": "IMAGE-THUMBNAIL",
            "@size": "3937",
            "@ref": "fx8",
            "@mimetype": "image/gif"
          },
          {
            "@category": "thumbnail",
            "@height": "122",
            "@width": "219",
            "@_fa": "true",
            "$": "https://api.elsevier.com/content/object/eid/1-s2.0-S2468823122007209-fx7.sml?httpAccept=%2A%2F%2A",
            "@multimediatype": "GIF image file",
            "@type": "IMAGE-THUMBNAIL",
            "@size": "3461",
            "@ref": "fx7",
            "@mimetype": "image/gif"
          },
          {
            "@category": "thumbnail",
            "@height": "159",
            "@width": "219",
            "@_fa": "true",
            "$": "https://api.elsevier.com/content/object/eid/1-s2.0-S2468823122007209-fx6.sml?httpAccept=%2A%2F%2A",
            "@multimediatype": "GIF image file",
            "@type": "IMAGE-THUMBNAIL",
            "@size": "3994",
            "@ref": "fx6",
            "@mimetype": "image/gif"
          },
          {
            "@category": "thumbnail",
            "@height": "121",
            "@width": "219",
            "@_fa": "true",
            "$": "https://api.elsevier.com/content/object/eid/1-s2.0-S2468823122007209-fx5.sml?httpAccept=%2A%2F%2A",
            "@multimediatype": "GIF image file",
            "@type": "IMAGE-THUMBNAIL",
            "@size": "3250",
            "@ref": "fx5",
            "@mimetype": "image/gif"
          },
          {
            "@category": "thumbnail",
            "@height": "164",
            "@width": "200",
            "@_fa": "true",
            "$": "https://api.elsevier.com/content/object/eid/1-s2.0-S2468823122007209-sc2.sml?httpAccept=%2A%2F%2A",
            "@multimediatype": "GIF image file",
            "@type": "IMAGE-THUMBNAIL",
            "@size": "10003",
            "@ref": "sc2",
            "@mimetype": "image/gif"
          },
          {
            "@category": "thumbnail",
            "@height": "164",
            "@width": "165",
            "@_fa": "true",
            "$": "https://api.elsevier.com/content/object/eid/1-s2.0-S2468823122007209-fx4.sml?httpAccept=%2A%2F%2A",
            "@multimediatype": "GIF image file",
            "@type": "IMAGE-THUMBNAIL",
            "@size": "3729",
            "@ref": "fx4",
            "@mimetype": "image/gif"
          },
          {
            "@category": "thumbnail",
            "@height": "66",
            "@width": "219",
            "@_fa": "true",
            "$": "https://api.elsevier.com/content/object/eid/1-s2.0-S2468823122007209-sc1.sml?httpAccept=%2A%2F%2A",
            "@multimediatype": "GIF image file",
            "@type": "IMAGE-THUMBNAIL",
            "@size": "7347",
            "@ref": "sc1",
            "@mimetype": "image/gif"
          },
          {
            "@category": "thumbnail",
            "@height": "164",
            "@width": "196",
            "@_fa": "true",
            "$": "https://api.elsevier.com/content/object/eid/1-s2.0-S2468823122007209-fx3.sml?httpAccept=%2A%2F%2A",
            "@multimediatype": "GIF image file",
            "@type": "IMAGE-THUMBNAIL",
            "@size": "3889",
            "@ref": "fx3",
            "@mimetype": "image/gif"
          },
          {
            "@category": "thumbnail",
            "@height": "152",
            "@width": "219",
            "@_fa": "true",
            "$": "https://api.elsevier.com/content/object/eid/1-s2.0-S2468823122007209-fx2.sml?httpAccept=%2A%2F%2A",
            "@multimediatype": "GIF image file",
            "@type": "IMAGE-THUMBNAIL",
            "@size": "4392",
            "@ref": "fx2",
            "@mimetype": "image/gif"
          },
          {
            "@category": "thumbnail",
            "@height": "116",
            "@width": "219",
            "@_fa": "true",
            "$": "https://api.elsevier.com/content/object/eid/1-s2.0-S2468823122007209-fx1.sml?httpAccept=%2A%2F%2A",
            "@multimediatype": "GIF image file",
            "@type": "IMAGE-THUMBNAIL",
            "@size": "3608",
            "@ref": "fx1",
            "@mimetype": "image/gif"
          },
          {
            "@category": "thumbnail",
            "@height": "127",
            "@width": "219",
            "@_fa": "true",
            "$": "https://api.elsevier.com/content/object/eid/1-s2.0-S2468823122007209-ga1.sml?httpAccept=%2A%2F%2A",
            "@multimediatype": "GIF image file",
            "@type": "IMAGE-THUMBNAIL",
            "@size": "14676",
            "@ref": "ga1",
            "@mimetype": "image/gif"
          },
          {
            "@category": "thumbnail",
            "@height": "70",
            "@width": "219",
            "@_fa": "true",
            "$": "https://api.elsevier.com/content/object/eid/1-s2.0-S2468823122007209-fx15.sml?httpAccept=%2A%2F%2A",
            "@multimediatype": "GIF image file",
            "@type": "IMAGE-THUMBNAIL",
            "@size": "2398",
            "@ref": "fx15",
            "@mimetype": "image/gif"
          },
          {
            "@category": "thumbnail",
            "@height": "76",
            "@width": "219",
            "@_fa": "true",
            "$": "https://api.elsevier.com/content/object/eid/1-s2.0-S2468823122007209-fx14.sml?httpAccept=%2A%2F%2A",
            "@multimediatype": "GIF image file",
            "@type": "IMAGE-THUMBNAIL",
            "@size": "2785",
            "@ref": "fx14",
            "@mimetype": "image/gif"
          },
          {
            "@category": "thumbnail",
            "@height": "163",
            "@width": "219",
            "@_fa": "true",
            "$": "https://api.elsevier.com/content/object/eid/1-s2.0-S2468823122007209-fx17.sml?httpAccept=%2A%2F%2A",
            "@multimediatype": "GIF image file",
            "@type": "IMAGE-THUMBNAIL",
            "@size": "4194",
            "@ref": "fx17",
            "@mimetype": "image/gif"
          },
          {
            "@category": "thumbnail",
            "@height": "116",
            "@width": "219",
            "@_fa": "true",
            "$": "https://api.elsevier.com/content/object/eid/1-s2.0-S2468823122007209-fx16.sml?httpAccept=%2A%2F%2A",
            "@multimediatype": "GIF image file",
            "@type": "IMAGE-THUMBNAIL",
            "@size": "3002",
            "@ref": "fx16",
            "@mimetype": "image/gif"
          },
          {
            "@category": "thumbnail",
            "@height": "84",
            "@width": "219",
            "@_fa": "true",
            "$": "https://api.elsevier.com/content/object/eid/1-s2.0-S2468823122007209-fx11.sml?httpAccept=%2A%2F%2A",
            "@multimediatype": "GIF image file",
            "@type": "IMAGE-THUMBNAIL",
            "@size": "2988",
            "@ref": "fx11",
            "@mimetype": "image/gif"
          },
          {
            "@category": "thumbnail",
            "@height": "99",
            "@width": "219",
            "@_fa": "true",
            "$": "https://api.elsevier.com/content/object/eid/1-s2.0-S2468823122007209-fx10.sml?httpAccept=%2A%2F%2A",
            "@multimediatype": "GIF image file",
            "@type": "IMAGE-THUMBNAIL",
            "@size": "3093",
            "@ref": "fx10",
            "@mimetype": "image/gif"
          },
          {
            "@category": "thumbnail",
            "@height": "55",
            "@width": "219",
            "@_fa": "true",
            "$": "https://api.elsevier.com/content/object/eid/1-s2.0-S2468823122007209-fx13.sml?httpAccept=%2A%2F%2A",
            "@multimediatype": "GIF image file",
            "@type": "IMAGE-THUMBNAIL",
            "@size": "2283",
            "@ref": "fx13",
            "@mimetype": "image/gif"
          },
          {
            "@category": "thumbnail",
            "@height": "117",
            "@width": "219",
            "@_fa": "true",
            "$": "https://api.elsevier.com/content/object/eid/1-s2.0-S2468823122007209-fx12.sml?httpAccept=%2A%2F%2A",
            "@multimediatype": "GIF image file",
            "@type": "IMAGE-THUMBNAIL",
            "@size": "3512",
            "@ref": "fx12",
            "@mimetype": "image/gif"
          },
          {
            "@category": "thumbnail",
            "@height": "101",
            "@width": "219",
            "@_fa": "true",
            "$": "https://api.elsevier.com/content/object/eid/1-s2.0-S2468823122007209-fx18.sml?httpAccept=%2A%2F%2A",
            "@multimediatype": "GIF image file",
            "@type": "IMAGE-THUMBNAIL",
            "@size": "3380",
            "@ref": "fx18",
            "@mimetype": "image/gif"
          },
          {
            "@category": "high",
            "@height": "1804",
            "@width": "2416",
            "@_fa": "true",
            "$": "https://api.elsevier.com/content/object/eid/1-s2.0-S2468823122007209-gr8_lrg.jpg?httpAccept=%2A%2F%2A",
            "@multimediatype": "JPEG image file",
            "@type": "IMAGE-HIGH-RES",
            "@size": "587006",
            "@ref": "gr8",
            "@mimetype": "image/jpeg"
          },
          {
            "@category": "high",
            "@height": "1274",
            "@width": "1590",
            "@_fa": "true",
            "$": "https://api.elsevier.com/content/object/eid/1-s2.0-S2468823122007209-gr7_lrg.jpg?httpAccept=%2A%2F%2A",
            "@multimediatype": "JPEG image file",
            "@type": "IMAGE-HIGH-RES",
            "@size": "198132",
            "@ref": "gr7",
            "@mimetype": "image/jpeg"
          },
          {
            "@category": "high",
            "@height": "2079",
            "@width": "2996",
            "@_fa": "true",
            "$": "https://api.elsevier.com/content/object/eid/1-s2.0-S2468823122007209-gr6_lrg.jpg?httpAccept=%2A%2F%2A",
            "@multimediatype": "JPEG image file",
            "@type": "IMAGE-HIGH-RES",
            "@size": "687472",
            "@ref": "gr6",
            "@mimetype": "image/jpeg"
          },
          {
            "@category": "high",
            "@height": "1144",
            "@width": "2990",
            "@_fa": "true",
            "$": "https://api.elsevier.com/content/object/eid/1-s2.0-S2468823122007209-gr5_lrg.jpg?httpAccept=%2A%2F%2A",
            "@multimediatype": "JPEG image file",
            "@type": "IMAGE-HIGH-RES",
            "@size": "633349",
            "@ref": "gr5",
            "@mimetype": "image/jpeg"
          },
          {
            "@category": "high",
            "@height": "1153",
            "@width": "2949",
            "@_fa": "true",
            "$": "https://api.elsevier.com/content/object/eid/1-s2.0-S2468823122007209-gr4_lrg.jpg?httpAccept=%2A%2F%2A",
            "@multimediatype": "JPEG image file",
            "@type": "IMAGE-HIGH-RES",
            "@size": "667329",
            "@ref": "gr4",
            "@mimetype": "image/jpeg"
          },
          {
            "@category": "high",
            "@height": "2027",
            "@width": "3167",
            "@_fa": "true",
            "$": "https://api.elsevier.com/content/object/eid/1-s2.0-S2468823122007209-gr3_lrg.jpg?httpAccept=%2A%2F%2A",
            "@multimediatype": "JPEG image file",
            "@type": "IMAGE-HIGH-RES",
            "@size": "1580049",
            "@ref": "gr3",
            "@mimetype": "image/jpeg"
          },
          {
            "@category": "high",
            "@height": "2477",
            "@width": "3167",
            "@_fa": "true",
            "$": "https://api.elsevier.com/content/object/eid/1-s2.0-S2468823122007209-gr2_lrg.jpg?httpAccept=%2A%2F%2A",
            "@multimediatype": "JPEG image file",
            "@type": "IMAGE-HIGH-RES",
            "@size": "1157321",
            "@ref": "gr2",
            "@mimetype": "image/jpeg"
          },
          {
            "@category": "high",
            "@height": "160",
            "@width": "519",
            "@_fa": "true",
            "$": "https://api.elsevier.com/content/object/eid/1-s2.0-S2468823122007209-fx9_lrg.jpg?httpAccept=%2A%2F%2A",
            "@multimediatype": "JPEG image file",
            "@type": "IMAGE-HIGH-RES",
            "@size": "9496",
            "@ref": "fx9",
            "@mimetype": "image/jpeg"
          },
          {
            "@category": "high",
            "@height": "2447",
            "@width": "3167",
            "@_fa": "true",
            "$": "https://api.elsevier.com/content/object/eid/1-s2.0-S2468823122007209-gr1_lrg.jpg?httpAccept=%2A%2F%2A",
            "@multimediatype": "JPEG image file",
            "@type": "IMAGE-HIGH-RES",
            "@size": "1066833",
            "@ref": "gr1",
            "@mimetype": "image/jpeg"
          },
          {
            "@category": "high",
            "@height": "413",
            "@width": "589",
            "@_fa": "true",
            "$": "https://api.elsevier.com/content/object/eid/1-s2.0-S2468823122007209-fx8_lrg.jpg?httpAccept=%2A%2F%2A",
            "@multimediatype": "JPEG image file",
            "@type": "IMAGE-HIGH-RES",
            "@size": "20942",
            "@ref": "fx8",
            "@mimetype": "image/jpeg"
          },
          {
            "@category": "high",
            "@height": "294",
            "@width": "528",
            "@_fa": "true",
            "$": "https://api.elsevier.com/content/object/eid/1-s2.0-S2468823122007209-fx7_lrg.jpg?httpAccept=%2A%2F%2A",
            "@multimediatype": "JPEG image file",
            "@type": "IMAGE-HIGH-RES",
            "@size": "14649",
            "@ref": "fx7",
            "@mimetype": "image/jpeg"
          },
          {
            "@category": "high",
            "@height": "409",
            "@width": "564",
            "@_fa": "true",
            "$": "https://api.elsevier.com/content/object/eid/1-s2.0-S2468823122007209-fx6_lrg.jpg?httpAccept=%2A%2F%2A",
            "@multimediatype": "JPEG image file",
            "@type": "IMAGE-HIGH-RES",
            "@size": "19763",
            "@ref": "fx6",
            "@mimetype": "image/jpeg"
          },
          {
            "@category": "high",
            "@height": "285",
            "@width": "517",
            "@_fa": "true",
            "$": "https://api.elsevier.com/content/object/eid/1-s2.0-S2468823122007209-fx5_lrg.jpg?httpAccept=%2A%2F%2A",
            "@multimediatype": "JPEG image file",
            "@type": "IMAGE-HIGH-RES",
            "@size": "13640",
            "@ref": "fx5",
            "@mimetype": "image/jpeg"
          },
          {
            "@category": "high",
            "@height": "1419",
            "@width": "1733",
            "@_fa": "true",
            "$": "https://api.elsevier.com/content/object/eid/1-s2.0-S2468823122007209-sc2_lrg.jpg?httpAccept=%2A%2F%2A",
            "@multimediatype": "JPEG image file",
            "@type": "IMAGE-HIGH-RES",
            "@size": "310278",
            "@ref": "sc2",
            "@mimetype": "image/jpeg"
          },
          {
            "@category": "high",
            "@height": "409",
            "@width": "412",
            "@_fa": "true",
            "$": "https://api.elsevier.com/content/object/eid/1-s2.0-S2468823122007209-fx4_lrg.jpg?httpAccept=%2A%2F%2A",
            "@multimediatype": "JPEG image file",
            "@type": "IMAGE-HIGH-RES",
            "@size": "16612",
            "@ref": "fx4",
            "@mimetype": "image/jpeg"
          },
          {
            "@category": "high",
            "@height": "909",
            "@width": "2997",
            "@_fa": "true",
            "$": "https://api.elsevier.com/content/object/eid/1-s2.0-S2468823122007209-sc1_lrg.jpg?httpAccept=%2A%2F%2A",
            "@multimediatype": "JPEG image file",
            "@type": "IMAGE-HIGH-RES",
            "@size": "333984",
            "@ref": "sc1",
            "@mimetype": "image/jpeg"
          },
          {
            "@category": "high",
            "@height": "294",
            "@width": "352",
            "@_fa": "true",
            "$": "https://api.elsevier.com/content/object/eid/1-s2.0-S2468823122007209-fx3_lrg.jpg?httpAccept=%2A%2F%2A",
            "@multimediatype": "JPEG image file",
            "@type": "IMAGE-HIGH-RES",
            "@size": "10757",
            "@ref": "fx3",
            "@mimetype": "image/jpeg"
          },
          {
            "@category": "high",
            "@height": "259",
            "@width": "373",
            "@_fa": "true",
            "$": "https://api.elsevier.com/content/object/eid/1-s2.0-S2468823122007209-fx2_lrg.jpg?httpAccept=%2A%2F%2A",
            "@multimediatype": "JPEG image file",
            "@type": "IMAGE-HIGH-RES",
            "@size": "11329",
            "@ref": "fx2",
            "@mimetype": "image/jpeg"
          },
          {
            "@category": "high",
            "@height": "157",
            "@width": "297",
            "@_fa": "true",
            "$": "https://api.elsevier.com/content/object/eid/1-s2.0-S2468823122007209-fx1_lrg.jpg?httpAccept=%2A%2F%2A",
            "@multimediatype": "JPEG image file",
            "@type": "IMAGE-HIGH-RES",
            "@size": "6197",
            "@ref": "fx1",
            "@mimetype": "image/jpeg"
          },
          {
            "@category": "high",
            "@height": "771",
            "@width": "1333",
            "@_fa": "true",
            "$": "https://api.elsevier.com/content/object/eid/1-s2.0-S2468823122007209-ga1_lrg.jpg?httpAccept=%2A%2F%2A",
            "@multimediatype": "JPEG image file",
            "@type": "IMAGE-HIGH-RES",
            "@size": "226516",
            "@ref": "ga1",
            "@mimetype": "image/jpeg"
          },
          {
            "@category": "high",
            "@height": "191",
            "@width": "597",
            "@_fa": "true",
            "$": "https://api.elsevier.com/content/object/eid/1-s2.0-S2468823122007209-fx15_lrg.jpg?httpAccept=%2A%2F%2A",
            "@multimediatype": "JPEG image file",
            "@type": "IMAGE-HIGH-RES",
            "@size": "10681",
            "@ref": "fx15",
            "@mimetype": "image/jpeg"
          },
          {
            "@category": "high",
            "@height": "237",
            "@width": "685",
            "@_fa": "true",
            "$": "https://api.elsevier.com/content/object/eid/1-s2.0-S2468823122007209-fx14_lrg.jpg?httpAccept=%2A%2F%2A",
            "@multimediatype": "JPEG image file",
            "@type": "IMAGE-HIGH-RES",
            "@size": "16056",
            "@ref": "fx14",
            "@mimetype": "image/jpeg"
          },
          {
            "@category": "high",
            "@height": "233",
            "@width": "314",
            "@_fa": "true",
            "$": "https://api.elsevier.com/content/object/eid/1-s2.0-S2468823122007209-fx17_lrg.jpg?httpAccept=%2A%2F%2A",
            "@multimediatype": "JPEG image file",
            "@type": "IMAGE-HIGH-RES",
            "@size": "8749",
            "@ref": "fx17",
            "@mimetype": "image/jpeg"
          },
          {
            "@category": "high",
            "@height": "364",
            "@width": "689",
            "@_fa": "true",
            "$": "https://api.elsevier.com/content/object/eid/1-s2.0-S2468823122007209-fx16_lrg.jpg?httpAccept=%2A%2F%2A",
            "@multimediatype": "JPEG image file",
            "@type": "IMAGE-HIGH-RES",
            "@size": "18940",
            "@ref": "fx16",
            "@mimetype": "image/jpeg"
          },
          {
            "@category": "high",
            "@height": "174",
            "@width": "453",
            "@_fa": "true",
            "$": "https://api.elsevier.com/content/object/eid/1-s2.0-S2468823122007209-fx11_lrg.jpg?httpAccept=%2A%2F%2A",
            "@multimediatype": "JPEG image file",
            "@type": "IMAGE-HIGH-RES",
            "@size": "9277",
            "@ref": "fx11",
            "@mimetype": "image/jpeg"
          },
          {
            "@category": "high",
            "@height": "274",
            "@width": "605",
            "@_fa": "true",
            "$": "https://api.elsevier.com/content/object/eid/1-s2.0-S2468823122007209-fx10_lrg.jpg?httpAccept=%2A%2F%2A",
            "@multimediatype": "JPEG image file",
            "@type": "IMAGE-HIGH-RES",
            "@size": "15881",
            "@ref": "fx10",
            "@mimetype": "image/jpeg"
          },
          {
            "@category": "high",
            "@height": "157",
            "@width": "628",
            "@_fa": "true",
            "$": "https://api.elsevier.com/content/object/eid/1-s2.0-S2468823122007209-fx13_lrg.jpg?httpAccept=%2A%2F%2A",
            "@multimediatype": "JPEG image file",
            "@type": "IMAGE-HIGH-RES",
            "@size": "10717",
            "@ref": "fx13",
            "@mimetype": "image/jpeg"
          },
          {
            "@category": "high",
            "@height": "294",
            "@width": "548",
            "@_fa": "true",
            "$": "https://api.elsevier.com/content/object/eid/1-s2.0-S2468823122007209-fx12_lrg.jpg?httpAccept=%2A%2F%2A",
            "@multimediatype": "JPEG image file",
            "@type": "IMAGE-HIGH-RES",
            "@size": "15702",
            "@ref": "fx12",
            "@mimetype": "image/jpeg"
          },
          {
            "@category": "high",
            "@height": "230",
            "@width": "500",
            "@_fa": "true",
            "$": "https://api.elsevier.com/content/object/eid/1-s2.0-S2468823122007209-fx18_lrg.jpg?httpAccept=%2A%2F%2A",
            "@multimediatype": "JPEG image file",
            "@type": "IMAGE-HIGH-RES",
            "@size": "12593",
            "@ref": "fx18",
            "@mimetype": "image/jpeg"
          },
          {
            "@category": "standard",
            "@_fa": "true",
            "$": "https://api.elsevier.com/content/object/eid/1-s2.0-S2468823122007209-mmc1.pdf?httpAccept=%2A%2F%2A",
            "@multimediatype": "Acrobat PDF file",
            "@type": "APPLICATION",
            "@size": "1838121",
            "@ref": "mmc1",
            "@mimetype": "application/pdf"
          },
          {
            "@category": "standard",
            "@_fa": "true",
            "$": "https://api.elsevier.com/content/object/eid/1-s2.0-S2468823122007209-am.pdf?httpAccept=%2A%2F%2A",
            "@multimediatype": "Acrobat PDF file",
            "@type": "AAM-PDF",
            "@size": "2584996",
            "@ref": "am",
            "@mimetype": "application/pdf"
          }
        ]
      },
      "link": {
        "@rel": "abstract",
        "@href": "https://api.elsevier.com/content/abstract/scopus_id/85142799166"
      }
    }
  }
}