{
  "metadata": {
    "title": "Influence of heteroatom-doped Fe-carbon sphere catalysts on CO<ce:inf loc=post>2</ce:inf>- mediated oxidative dehydrogenation of ethylbenzene",
    "authors": "; ; ",
    "journal": "Molecular Catalysis",
    "date": "2023-01-15",
    "doi": "10.1016/j.mcat.2022.112836",
    "abstract": "",
    "uri": "https://api.elsevier.com/content/article/pii/S2468823122007222",
    "pii": "S2468823122007222"
  },
  "fulltext": {
    "full-text-retrieval-response": {
      "scopus-eid": "2-s2.0-85143508865",
      "originalText": "serial JL 315758 291210 291744 291790 291809 31 Molecular Catalysis MOLECULARCATALYSIS 2022-12-02 2022-12-02 2022-12-02 2022-12-02 2023-01-07T15:56:45 1-s2.0-S2468823122007222 S2468-8231(22)00722-2 S2468823122007222 10.1016/j.mcat.2022.112836 S300 S300.1 FULL-TEXT 1-s2.0-S2468823122X00187 2024-06-26T17:47:57.840046Z 0 0 20230115 2023 2022-12-02T12:42:36.501987Z absattachment articleinfo articlenumber articletitlenorm authfirstinitialnorm authfirstsurnamenorm cid cids contenttype copyright crossmark dateloaded dateloadedtxt datesearch datesort dateupdated dco docsubtype doctype doi eid ewtransactionid hubeid indexeddate issn issnnorm itemstage itemtransactionid itemweight openaccess openarchive pg pgfirst pii piinorm pubdatestart pubdatetxt pubyr sectiontitle sortorder srctitle srctitlenorm srctype ssids alllist content subj subheadings suppl tomb volfirst volissue volumelist webpdf webpdfpagecount yearnav figure table e-component body mmlmath acknowledge affil appendices articletitle auth authfirstini authfull authkeywords authlast highlightsabst orcid primabst ref specialabst 2468-8231 24688231 true 535 535 C Volume 535 16 112836 112836 112836 20230115 15 January 2023 2023-01-15 2023 Regular Papers article fla © 2022 Elsevier B.V. All rights reserved. INFLUENCEHETEROATOMDOPEDFECARBONSPHERECATALYSTSCO2MEDIATEDOXIDATIVEDEHYDROGENATIONETHYLBENZENE GHOSH A 1 Introduction 2 Experimental 2.1 Materials and reagents 2.2 Preparation of catalysts 2.2.1 Preparation of N doped Fe-carbon sphere catalyst 2.2.2 Preparation of N, S, and N, P co-doped Fe-carbon sphere catalysts 2.2.3 Preparation Fe-carbon sphere catalyst 2.3 Catalytic activity studies 3 Results and discussion 3.1 Physicochemical characterizations 3.2 Catalytic activity study 3.2.1 The behavioral aspect of as-synthesized catalysts on direct dehydrogenation of ethylbenzene (DDH) 3.2.2 Performance of as-synthesized catalysts in oxidative (CO2) dehydrogenation of ethylbenzene (DDH) 4 Conclusions CRediT authorship contribution statement Acknowledgements Appendix Supplementary materials References NIETOMARQUEZ 2011 1664 1672 A GHOSH 2022 A ZHANG 2015 9246 9256 P WANG 2014 4406 4412 S 2015 268 311 NANOSTRUCTUREDCARBONMATERIALSFORCATALYSIS CHAPTER6DOPEDNANOSTRUCTUREDCARBONMATERIALSCATALYSTS LIU 2018 15962 15967 M WU 2015 327 338 J HU 2020 742 752 X TAO 2019 47 55 X GAO 2020 8584 8686 W ARTZ 2018 434 504 J MODAK 2021 12431 12460 A BHANJA 2018 7278 7297 P TOMKINS 2019 3994 4013 P KAINTHLA 2015 5062 5076 I IKENAGA 2000 1228 1234 N ANSARI 2012 9419 9437 M LIU 2008 15490 15501 B SATO 1988 207 215 S KIM 2019 5893 5899 S YUAN 2018 4156 4165 M WANG 2017 10610 10617 H MA 2019 10283 10289 Z LUO 2022 3166 3175 L KIM 2019 9893 9899 S SULISTYA 2020 1042 1050 E GHOSH 2020 4827 4844 A FENG 2021 2102974 J KIM 2017 14400 C ANTONIOU 2014 16 22 M CYCHOSZ 2017 389 414 K LIU 2021 F HUAYANG 2014 614 619 X CAO 2017 8090 8112 Y RANGRAZ 2021 23725 23778 Y 2015 163 222 NANOSTRUCTUREDCARBONMATERIALSFORCATALYSIS CHAPTER4SURFACECHEMISTRYNANOSTRUCTUREDCARBONMATERIALSPREPARATIONNANOCARBONSUPPORTEDCATALYSTS LI 2017 11631 11638 Y WILSON 2014 6 13 D DUTTA 2020 4982 S 2022 FIGUEIREDO 2013 9351 9364 J QIN 2019 61 68 L KAINTHLA 2017 4173 4181 I SEVILLA 2011 2781 2787 M LIU 2021 22444 22449 Y 2022 635 646 CHOU 2019 773 C HU 2022 136357 T KUMAR 2008 156 167 C GHOSHX2023X112836 GHOSHX2023X112836XA 2024-12-02T00:00:00.000Z 2024-12-02T00:00:00.000Z http://creativecommons.org/licenses/by-nc-nd/4.0/ © 2022 Elsevier B.V. All rights reserved. 2022-12-13T05:48:45.775Z http://vtw.elsevier.com/data/voc/AddOnTypes/50.7/aggregated-refined IGSTC/Call 2018/CO2BioFeed/15/2019–20 IGSTC Indo-German Science & Technology Centre http://data.elsevier.com/vocabulary/SciValFunders/501100018761 http://sws.geonames.org/1269750 ISM ISM IIlinois State Museum http://data.elsevier.com/vocabulary/SciValFunders/100004891 http://sws.geonames.org/6252001/ CSIR CSIR Council of Scientific and Industrial Research, India http://data.elsevier.com/vocabulary/SciValFunders/501100001412 http://sws.geonames.org/1269750/ IACS-Kolkata DLR DLR Deutsches Zentrum für Luft- und Raumfahrt http://data.elsevier.com/vocabulary/SciValFunders/501100002946 http://sws.geonames.org/2921044/ BC and AB would like to acknowledge IGSTC (IGSTC/Call 2018/CO2BioFeed/15/2019–20), for funding under Indo-German collaboration research for research grant. TM would like to acknowledge DLR for the research grant, AG would like to acknowledge IIT (ISM) for research fellowship and RC would like to acknowledge CSIR, Govt of India for research fellowship. Authors would like to acknowledge the central research facility at IIT(ISM)-Dhanbad and IACS-Kolkata for catalyst characterizations. BC and AB would like to acknowledge IGSTC (IGSTC/Call 2018/CO 2 BioFeed/15/2019–20), for funding under Indo-German collaboration research for research grant. TM would like to acknowledge DLR for the research grant, AG would like to acknowledge IIT (ISM) for research fellowship and RC would like to acknowledge CSIR, Govt of India for research fellowship. Authors would like to acknowledge the central research facility at IIT(ISM)-Dhanbad and IACS-Kolkata for catalyst characterizations. 0 https://doi.org/10.15223/policy-017 https://doi.org/10.15223/policy-037 https://doi.org/10.15223/policy-012 https://doi.org/10.15223/policy-029 https://doi.org/10.15223/policy-004 item S2468-8231(22)00722-2 S2468823122007222 1-s2.0-S2468823122007222 10.1016/j.mcat.2022.112836 315758 2023-01-07T16:15:48.580654Z 2023-01-15 1-s2.0-S2468823122007222-main.pdf https://s3-eu-west-1.amazonaws.com/prod-ucs-content-store-eu-west/content/pii:S2468823122007222/MAIN/application/pdf/1822b51a12f393ecf2b4246043f66de0/main.pdf main.pdf pdf true 24915306 MAIN 18 1-s2.0-S2468823122007222-main_1.png https://s3-eu-west-1.amazonaws.com/prod-ucs-content-store-eu-west/content/pii:S2468823122007222/PREVIEW/image/png/186a63f03c7f827fcf87be4733a700db/main_1.png main_1.png png 57484 849 656 IMAGE-WEB-PDF 1 1-s2.0-S2468823122007222-ga1.jpg https://s3-eu-west-1.amazonaws.com/prod-ucs-content-store-eu-west/content/pii:S2468823122007222/ga1/DOWNSAMPLED/image/jpeg/116dc96ee4e67419bf2321e5b04bd081/ga1.jpg ga1 true ga1.jpg jpg 16402 199 214 IMAGE-DOWNSAMPLED 1-s2.0-S2468823122007222-gr14.jpg https://s3-eu-west-1.amazonaws.com/prod-ucs-content-store-eu-west/content/pii:S2468823122007222/gr14/DOWNSAMPLED/image/jpeg/fa2b91140cf3cad43ab347965ab49cb5/gr14.jpg gr14 gr14.jpg jpg 47511 293 636 IMAGE-DOWNSAMPLED 1-s2.0-S2468823122007222-gr15.jpg https://s3-eu-west-1.amazonaws.com/prod-ucs-content-store-eu-west/content/pii:S2468823122007222/gr15/DOWNSAMPLED/image/jpeg/77f929e9c8abebde725305b7e564f429/gr15.jpg gr15 gr15.jpg jpg 85033 538 665 IMAGE-DOWNSAMPLED 1-s2.0-S2468823122007222-gr12.jpg https://s3-eu-west-1.amazonaws.com/prod-ucs-content-store-eu-west/content/pii:S2468823122007222/gr12/DOWNSAMPLED/image/jpeg/a734b73272455086781365188bd30483/gr12.jpg gr12 gr12.jpg jpg 131428 622 649 IMAGE-DOWNSAMPLED 1-s2.0-S2468823122007222-gr13.jpg https://s3-eu-west-1.amazonaws.com/prod-ucs-content-store-eu-west/content/pii:S2468823122007222/gr13/DOWNSAMPLED/image/jpeg/d6b57b9ed05444e4863e2c5f48661d16/gr13.jpg gr13 gr13.jpg jpg 34670 302 373 IMAGE-DOWNSAMPLED 1-s2.0-S2468823122007222-gr10.jpg https://s3-eu-west-1.amazonaws.com/prod-ucs-content-store-eu-west/content/pii:S2468823122007222/gr10/DOWNSAMPLED/image/jpeg/2251d78f267f52d72828f102578c0e1c/gr10.jpg gr10 gr10.jpg jpg 63034 275 664 IMAGE-DOWNSAMPLED 1-s2.0-S2468823122007222-gr11.jpg https://s3-eu-west-1.amazonaws.com/prod-ucs-content-store-eu-west/content/pii:S2468823122007222/gr11/DOWNSAMPLED/image/jpeg/24256aaf21bfbb0c94be5a3e03f5cc0e/gr11.jpg gr11 gr11.jpg jpg 53222 280 640 IMAGE-DOWNSAMPLED 1-s2.0-S2468823122007222-gr2.jpg https://s3-eu-west-1.amazonaws.com/prod-ucs-content-store-eu-west/content/pii:S2468823122007222/gr2/DOWNSAMPLED/image/jpeg/61a3037909b04497fef5b3d0c19ed9f2/gr2.jpg gr2 gr2.jpg jpg 46405 302 346 IMAGE-DOWNSAMPLED 1-s2.0-S2468823122007222-gr1.jpg https://s3-eu-west-1.amazonaws.com/prod-ucs-content-store-eu-west/content/pii:S2468823122007222/gr1/DOWNSAMPLED/image/jpeg/ff5ec02c7506b28d28569eb88f3d53ae/gr1.jpg gr1 gr1.jpg jpg 48204 317 679 IMAGE-DOWNSAMPLED 1-s2.0-S2468823122007222-gr18.jpg https://s3-eu-west-1.amazonaws.com/prod-ucs-content-store-eu-west/content/pii:S2468823122007222/gr18/DOWNSAMPLED/image/jpeg/77a1e2cb321fd84428275cadfb50eeb4/gr18.jpg gr18 gr18.jpg jpg 42014 242 613 IMAGE-DOWNSAMPLED 1-s2.0-S2468823122007222-sc2.jpg https://s3-eu-west-1.amazonaws.com/prod-ucs-content-store-eu-west/content/pii:S2468823122007222/sc2/DOWNSAMPLED/image/jpeg/37f6d095d9d493107ce0a8ac06b80bd1/sc2.jpg sc2 sc2.jpg jpg 161890 730 708 IMAGE-DOWNSAMPLED 1-s2.0-S2468823122007222-gr19.jpg https://s3-eu-west-1.amazonaws.com/prod-ucs-content-store-eu-west/content/pii:S2468823122007222/gr19/DOWNSAMPLED/image/jpeg/b3f74dc71c82f4c56bfaceec8f7e4c3a/gr19.jpg gr19 gr19.jpg jpg 66425 409 628 IMAGE-DOWNSAMPLED 1-s2.0-S2468823122007222-gr16.jpg https://s3-eu-west-1.amazonaws.com/prod-ucs-content-store-eu-west/content/pii:S2468823122007222/gr16/DOWNSAMPLED/image/jpeg/ca5522a78e31fc3287cb730fd5633676/gr16.jpg gr16 gr16.jpg jpg 85237 541 626 IMAGE-DOWNSAMPLED 1-s2.0-S2468823122007222-gr17.jpg https://s3-eu-west-1.amazonaws.com/prod-ucs-content-store-eu-west/content/pii:S2468823122007222/gr17/DOWNSAMPLED/image/jpeg/8514db8539bda0538cb3eb70dbacd68e/gr17.jpg gr17 gr17.jpg jpg 36018 267 389 IMAGE-DOWNSAMPLED 1-s2.0-S2468823122007222-sc1.jpg https://s3-eu-west-1.amazonaws.com/prod-ucs-content-store-eu-west/content/pii:S2468823122007222/sc1/DOWNSAMPLED/image/jpeg/1b65132a0a027d91f3c4bb2b3902a962/sc1.jpg sc1 sc1.jpg jpg 50481 340 713 IMAGE-DOWNSAMPLED 1-s2.0-S2468823122007222-gr8.jpg https://s3-eu-west-1.amazonaws.com/prod-ucs-content-store-eu-west/content/pii:S2468823122007222/gr8/DOWNSAMPLED/image/jpeg/4beb37f45a8043b97d2400e1a74db03a/gr8.jpg gr8 gr8.jpg jpg 92279 537 648 IMAGE-DOWNSAMPLED 1-s2.0-S2468823122007222-gr7.jpg https://s3-eu-west-1.amazonaws.com/prod-ucs-content-store-eu-west/content/pii:S2468823122007222/gr7/DOWNSAMPLED/image/jpeg/0d657dd410bd7f32650c75c3914264b1/gr7.jpg gr7 gr7.jpg jpg 100348 558 631 IMAGE-DOWNSAMPLED 1-s2.0-S2468823122007222-gr9.jpg https://s3-eu-west-1.amazonaws.com/prod-ucs-content-store-eu-west/content/pii:S2468823122007222/gr9/DOWNSAMPLED/image/jpeg/681fd6230b40c6bda183f8d62a2ab129/gr9.jpg gr9 gr9.jpg jpg 87898 536 645 IMAGE-DOWNSAMPLED 1-s2.0-S2468823122007222-gr4.jpg https://s3-eu-west-1.amazonaws.com/prod-ucs-content-store-eu-west/content/pii:S2468823122007222/gr4/DOWNSAMPLED/image/jpeg/1e7b16d708a11a173d78172434275683/gr4.jpg gr4 gr4.jpg jpg 164621 537 696 IMAGE-DOWNSAMPLED 1-s2.0-S2468823122007222-gr3.jpg https://s3-eu-west-1.amazonaws.com/prod-ucs-content-store-eu-west/content/pii:S2468823122007222/gr3/DOWNSAMPLED/image/jpeg/cb8a93d12939a09e4ec5563b52bdfd27/gr3.jpg gr3 gr3.jpg jpg 170357 581 703 IMAGE-DOWNSAMPLED 1-s2.0-S2468823122007222-gr6.jpg https://s3-eu-west-1.amazonaws.com/prod-ucs-content-store-eu-west/content/pii:S2468823122007222/gr6/DOWNSAMPLED/image/jpeg/3793566ab97c00c5c948c0ab70c5c2ca/gr6.jpg gr6 gr6.jpg jpg 123401 542 699 IMAGE-DOWNSAMPLED 1-s2.0-S2468823122007222-gr5.jpg https://s3-eu-west-1.amazonaws.com/prod-ucs-content-store-eu-west/content/pii:S2468823122007222/gr5/DOWNSAMPLED/image/jpeg/3dc6fad147611ceb60bb19d3dd83b928/gr5.jpg gr5 gr5.jpg jpg 125238 540 699 IMAGE-DOWNSAMPLED 1-s2.0-S2468823122007222-ga1.sml https://s3-eu-west-1.amazonaws.com/prod-ucs-content-store-eu-west/content/pii:S2468823122007222/ga1/THUMBNAIL/image/gif/a00259b24c796115b4e9bd8e01776c6a/ga1.sml ga1 true ga1.sml sml 8653 164 176 IMAGE-THUMBNAIL 1-s2.0-S2468823122007222-gr14.sml https://s3-eu-west-1.amazonaws.com/prod-ucs-content-store-eu-west/content/pii:S2468823122007222/gr14/THUMBNAIL/image/gif/2c5326a3bf81fd8a9618dac7f0f49d08/gr14.sml gr14 gr14.sml sml 8644 101 219 IMAGE-THUMBNAIL 1-s2.0-S2468823122007222-gr15.sml https://s3-eu-west-1.amazonaws.com/prod-ucs-content-store-eu-west/content/pii:S2468823122007222/gr15/THUMBNAIL/image/gif/735dbf87a5de1ed8ee8d16c8a7ebe4b6/gr15.sml gr15 gr15.sml sml 11492 163 202 IMAGE-THUMBNAIL 1-s2.0-S2468823122007222-gr12.sml https://s3-eu-west-1.amazonaws.com/prod-ucs-content-store-eu-west/content/pii:S2468823122007222/gr12/THUMBNAIL/image/gif/8827d31148b6352895290c660944277c/gr12.sml gr12 gr12.sml sml 15416 164 171 IMAGE-THUMBNAIL 1-s2.0-S2468823122007222-gr13.sml https://s3-eu-west-1.amazonaws.com/prod-ucs-content-store-eu-west/content/pii:S2468823122007222/gr13/THUMBNAIL/image/gif/62a2f371f3064a14d8d246689aae32b8/gr13.sml gr13 gr13.sml sml 9931 164 202 IMAGE-THUMBNAIL 1-s2.0-S2468823122007222-gr10.sml https://s3-eu-west-1.amazonaws.com/prod-ucs-content-store-eu-west/content/pii:S2468823122007222/gr10/THUMBNAIL/image/gif/5acf1d7d4f3b956dd81614932f60712f/gr10.sml gr10 gr10.sml sml 11090 91 219 IMAGE-THUMBNAIL 1-s2.0-S2468823122007222-gr11.sml https://s3-eu-west-1.amazonaws.com/prod-ucs-content-store-eu-west/content/pii:S2468823122007222/gr11/THUMBNAIL/image/gif/513c7be3de49f5f5487060e0c485a55f/gr11.sml gr11 gr11.sml sml 9996 96 219 IMAGE-THUMBNAIL 1-s2.0-S2468823122007222-gr2.sml https://s3-eu-west-1.amazonaws.com/prod-ucs-content-store-eu-west/content/pii:S2468823122007222/gr2/THUMBNAIL/image/gif/1ebc5dc65d9c6cbec99c59528894a1a6/gr2.sml gr2 gr2.sml sml 11823 164 188 IMAGE-THUMBNAIL 1-s2.0-S2468823122007222-gr1.sml https://s3-eu-west-1.amazonaws.com/prod-ucs-content-store-eu-west/content/pii:S2468823122007222/gr1/THUMBNAIL/image/gif/f7c1fcb1793e3192a72df9c987142fc1/gr1.sml gr1 gr1.sml sml 8461 102 219 IMAGE-THUMBNAIL 1-s2.0-S2468823122007222-gr18.sml https://s3-eu-west-1.amazonaws.com/prod-ucs-content-store-eu-west/content/pii:S2468823122007222/gr18/THUMBNAIL/image/gif/86f502d65c08c23522b34663cf6faa46/gr18.sml gr18 gr18.sml sml 9024 87 219 IMAGE-THUMBNAIL 1-s2.0-S2468823122007222-sc2.sml https://s3-eu-west-1.amazonaws.com/prod-ucs-content-store-eu-west/content/pii:S2468823122007222/sc2/THUMBNAIL/image/gif/e14a4ad53b5f3a169ad086f4e7ea3a66/sc2.sml sc2 sc2.sml sml 16679 164 159 IMAGE-THUMBNAIL 1-s2.0-S2468823122007222-gr19.sml https://s3-eu-west-1.amazonaws.com/prod-ucs-content-store-eu-west/content/pii:S2468823122007222/gr19/THUMBNAIL/image/gif/8fbf640a2d204734edfbe9512a4983fe/gr19.sml gr19 gr19.sml sml 10147 142 219 IMAGE-THUMBNAIL 1-s2.0-S2468823122007222-gr16.sml https://s3-eu-west-1.amazonaws.com/prod-ucs-content-store-eu-west/content/pii:S2468823122007222/gr16/THUMBNAIL/image/gif/eea1ba4710daaf344a0f2b5297107301/gr16.sml gr16 gr16.sml sml 11671 164 190 IMAGE-THUMBNAIL 1-s2.0-S2468823122007222-gr17.sml https://s3-eu-west-1.amazonaws.com/prod-ucs-content-store-eu-west/content/pii:S2468823122007222/gr17/THUMBNAIL/image/gif/6b311d9daae9a043f728a710efce2060/gr17.sml gr17 gr17.sml sml 9233 150 219 IMAGE-THUMBNAIL 1-s2.0-S2468823122007222-sc1.sml https://s3-eu-west-1.amazonaws.com/prod-ucs-content-store-eu-west/content/pii:S2468823122007222/sc1/THUMBNAIL/image/gif/18bb36423677aefc80352495223ec5e4/sc1.sml sc1 sc1.sml sml 7079 104 219 IMAGE-THUMBNAIL 1-s2.0-S2468823122007222-gr8.sml https://s3-eu-west-1.amazonaws.com/prod-ucs-content-store-eu-west/content/pii:S2468823122007222/gr8/THUMBNAIL/image/gif/6b92a090604ba0076ef573259f304f95/gr8.sml gr8 gr8.sml sml 12628 164 198 IMAGE-THUMBNAIL 1-s2.0-S2468823122007222-gr7.sml https://s3-eu-west-1.amazonaws.com/prod-ucs-content-store-eu-west/content/pii:S2468823122007222/gr7/THUMBNAIL/image/gif/62b5600de4b267f26e21c5183c6fa98b/gr7.sml gr7 gr7.sml sml 12768 163 185 IMAGE-THUMBNAIL 1-s2.0-S2468823122007222-gr9.sml https://s3-eu-west-1.amazonaws.com/prod-ucs-content-store-eu-west/content/pii:S2468823122007222/gr9/THUMBNAIL/image/gif/ce069fde51f3e6d7e7fbaf258b00f87c/gr9.sml gr9 gr9.sml sml 12313 164 197 IMAGE-THUMBNAIL 1-s2.0-S2468823122007222-gr4.sml https://s3-eu-west-1.amazonaws.com/prod-ucs-content-store-eu-west/content/pii:S2468823122007222/gr4/THUMBNAIL/image/gif/7db6497147259e6e474a375c35b45aff/gr4.sml gr4 gr4.sml sml 27166 164 212 IMAGE-THUMBNAIL 1-s2.0-S2468823122007222-gr3.sml https://s3-eu-west-1.amazonaws.com/prod-ucs-content-store-eu-west/content/pii:S2468823122007222/gr3/THUMBNAIL/image/gif/0d58b5145505c8b1f18ddc052bff6e59/gr3.sml gr3 gr3.sml sml 24995 164 198 IMAGE-THUMBNAIL 1-s2.0-S2468823122007222-gr6.sml https://s3-eu-west-1.amazonaws.com/prod-ucs-content-store-eu-west/content/pii:S2468823122007222/gr6/THUMBNAIL/image/gif/ff3889c5796305be60c93852dd4bfa95/gr6.sml gr6 gr6.sml sml 23496 164 211 IMAGE-THUMBNAIL 1-s2.0-S2468823122007222-gr5.sml https://s3-eu-west-1.amazonaws.com/prod-ucs-content-store-eu-west/content/pii:S2468823122007222/gr5/THUMBNAIL/image/gif/54973ac4038ebb541ddfee679f454410/gr5.sml gr5 gr5.sml sml 24463 164 212 IMAGE-THUMBNAIL 1-s2.0-S2468823122007222-ga1_lrg.jpg https://s3-eu-west-1.amazonaws.com/prod-ucs-content-store-eu-west/content/pii:S2468823122007222/HIGHRES/image/jpeg/7a35d20cc4dd0fa2a04200c9c788f034/ga1_lrg.jpg ga1 true ga1_lrg.jpg jpg 113554 886 951 IMAGE-HIGH-RES 1-s2.0-S2468823122007222-gr14_lrg.jpg https://s3-eu-west-1.amazonaws.com/prod-ucs-content-store-eu-west/content/pii:S2468823122007222/HIGHRES/image/jpeg/ddf142b78fbdba83c28f817335901505/gr14_lrg.jpg gr14 gr14_lrg.jpg jpg 306628 1296 2816 IMAGE-HIGH-RES 1-s2.0-S2468823122007222-gr15_lrg.jpg https://s3-eu-west-1.amazonaws.com/prod-ucs-content-store-eu-west/content/pii:S2468823122007222/HIGHRES/image/jpeg/481196a5b11c75a9a2794e301a471bfb/gr15_lrg.jpg gr15 gr15_lrg.jpg jpg 570041 2384 2946 IMAGE-HIGH-RES 1-s2.0-S2468823122007222-gr12_lrg.jpg https://s3-eu-west-1.amazonaws.com/prod-ucs-content-store-eu-west/content/pii:S2468823122007222/HIGHRES/image/jpeg/b401b0792541681bb341185fae977384/gr12_lrg.jpg gr12 gr12_lrg.jpg jpg 1086229 2757 2875 IMAGE-HIGH-RES 1-s2.0-S2468823122007222-gr13_lrg.jpg https://s3-eu-west-1.amazonaws.com/prod-ucs-content-store-eu-west/content/pii:S2468823122007222/HIGHRES/image/jpeg/6934cea2df2eb00b61c800b9b3050884/gr13_lrg.jpg gr13 gr13_lrg.jpg jpg 267025 1339 1654 IMAGE-HIGH-RES 1-s2.0-S2468823122007222-gr10_lrg.jpg https://s3-eu-west-1.amazonaws.com/prod-ucs-content-store-eu-west/content/pii:S2468823122007222/HIGHRES/image/jpeg/8da41715884fabde1c515e6f0455a365/gr10_lrg.jpg gr10 gr10_lrg.jpg jpg 469018 1215 2939 IMAGE-HIGH-RES 1-s2.0-S2468823122007222-gr11_lrg.jpg https://s3-eu-west-1.amazonaws.com/prod-ucs-content-store-eu-west/content/pii:S2468823122007222/HIGHRES/image/jpeg/13e085a4cd6a89b3f26b5ff392abf825/gr11_lrg.jpg gr11 gr11_lrg.jpg jpg 396918 1239 2835 IMAGE-HIGH-RES 1-s2.0-S2468823122007222-gr2_lrg.jpg https://s3-eu-west-1.amazonaws.com/prod-ucs-content-store-eu-west/content/pii:S2468823122007222/HIGHRES/image/jpeg/7652a68423e5a2af2af70b530daf4378/gr2_lrg.jpg gr2 gr2_lrg.jpg jpg 349774 1341 1535 IMAGE-HIGH-RES 1-s2.0-S2468823122007222-gr1_lrg.jpg https://s3-eu-west-1.amazonaws.com/prod-ucs-content-store-eu-west/content/pii:S2468823122007222/HIGHRES/image/jpeg/9e0c984c76d8aa14c9fb1865232d31f2/gr1_lrg.jpg gr1 gr1_lrg.jpg jpg 313462 1405 3006 IMAGE-HIGH-RES 1-s2.0-S2468823122007222-gr18_lrg.jpg https://s3-eu-west-1.amazonaws.com/prod-ucs-content-store-eu-west/content/pii:S2468823122007222/HIGHRES/image/jpeg/d4b6c4a1fc186cf6d35226fece73cfc2/gr18_lrg.jpg gr18 gr18_lrg.jpg jpg 346014 1073 2713 IMAGE-HIGH-RES 1-s2.0-S2468823122007222-sc2_lrg.jpg https://s3-eu-west-1.amazonaws.com/prod-ucs-content-store-eu-west/content/pii:S2468823122007222/HIGHRES/image/jpeg/92b38c9cba6de1ddbc5c5a43018f85ef/sc2_lrg.jpg sc2 sc2_lrg.jpg jpg 1365429 3231 3133 IMAGE-HIGH-RES 1-s2.0-S2468823122007222-gr19_lrg.jpg https://s3-eu-west-1.amazonaws.com/prod-ucs-content-store-eu-west/content/pii:S2468823122007222/HIGHRES/image/jpeg/3ee184d3ef1eaf98ec10bf1f836b266a/gr19_lrg.jpg gr19 gr19_lrg.jpg jpg 429700 1810 2782 IMAGE-HIGH-RES 1-s2.0-S2468823122007222-gr16_lrg.jpg https://s3-eu-west-1.amazonaws.com/prod-ucs-content-store-eu-west/content/pii:S2468823122007222/HIGHRES/image/jpeg/74f28f4782c44aa803cd0074573730c5/gr16_lrg.jpg gr16 gr16_lrg.jpg jpg 886681 2396 2774 IMAGE-HIGH-RES 1-s2.0-S2468823122007222-gr17_lrg.jpg https://s3-eu-west-1.amazonaws.com/prod-ucs-content-store-eu-west/content/pii:S2468823122007222/HIGHRES/image/jpeg/d5495d8a900a1adee3124e933d7dbaa3/gr17_lrg.jpg gr17 gr17_lrg.jpg jpg 237635 1183 1724 IMAGE-HIGH-RES 1-s2.0-S2468823122007222-sc1_lrg.jpg https://s3-eu-west-1.amazonaws.com/prod-ucs-content-store-eu-west/content/pii:S2468823122007222/HIGHRES/image/jpeg/339d36618a1bbb54e9e2bfe6906830d2/sc1_lrg.jpg sc1 sc1_lrg.jpg jpg 355106 1505 3156 IMAGE-HIGH-RES 1-s2.0-S2468823122007222-gr8_lrg.jpg https://s3-eu-west-1.amazonaws.com/prod-ucs-content-store-eu-west/content/pii:S2468823122007222/HIGHRES/image/jpeg/06bb65de0d06a82f423f27c159381b8d/gr8_lrg.jpg gr8 gr8_lrg.jpg jpg 677388 2377 2868 IMAGE-HIGH-RES 1-s2.0-S2468823122007222-gr7_lrg.jpg https://s3-eu-west-1.amazonaws.com/prod-ucs-content-store-eu-west/content/pii:S2468823122007222/HIGHRES/image/jpeg/2eeedd9a0e0244c056e19ce6aa0e035b/gr7_lrg.jpg gr7 gr7_lrg.jpg jpg 676050 2470 2795 IMAGE-HIGH-RES 1-s2.0-S2468823122007222-gr9_lrg.jpg https://s3-eu-west-1.amazonaws.com/prod-ucs-content-store-eu-west/content/pii:S2468823122007222/HIGHRES/image/jpeg/316d830c13a3b7d25f5897f2a561d6af/gr9_lrg.jpg gr9 gr9_lrg.jpg jpg 633354 2373 2856 IMAGE-HIGH-RES 1-s2.0-S2468823122007222-gr4_lrg.jpg https://s3-eu-west-1.amazonaws.com/prod-ucs-content-store-eu-west/content/pii:S2468823122007222/HIGHRES/image/jpeg/6f39dd1de61597e24b2dd7ca69596608/gr4_lrg.jpg gr4 gr4_lrg.jpg jpg 1974814 2381 3084 IMAGE-HIGH-RES 1-s2.0-S2468823122007222-gr3_lrg.jpg https://s3-eu-west-1.amazonaws.com/prod-ucs-content-store-eu-west/content/pii:S2468823122007222/HIGHRES/image/jpeg/9a557357509e0a810e9ac8ae1ee9502d/gr3_lrg.jpg gr3 gr3_lrg.jpg jpg 1688763 2574 3113 IMAGE-HIGH-RES 1-s2.0-S2468823122007222-gr6_lrg.jpg https://s3-eu-west-1.amazonaws.com/prod-ucs-content-store-eu-west/content/pii:S2468823122007222/HIGHRES/image/jpeg/053c23c8fc0cc51cac50a69f99eb6153/gr6_lrg.jpg gr6 gr6_lrg.jpg jpg 1234423 2399 3095 IMAGE-HIGH-RES 1-s2.0-S2468823122007222-gr5_lrg.jpg https://s3-eu-west-1.amazonaws.com/prod-ucs-content-store-eu-west/content/pii:S2468823122007222/HIGHRES/image/jpeg/d61cfeb584d08ab12c7cdff7e4a81cff/gr5_lrg.jpg gr5 gr5_lrg.jpg jpg 1143544 2390 3095 IMAGE-HIGH-RES 1-s2.0-S2468823122007222-mmc1.docx https://s3-eu-west-1.amazonaws.com/prod-ucs-content-store-eu-west/content/pii:S2468823122007222/mmc1/MAIN/application/vnd.openxmlformats-officedocument.wordprocessingml.document/c46aa8a3e6e5254bb0f4f6e123c4ec6d/mmc1.docx mmc1 mmc1.docx docx 295068 APPLICATION 1-s2.0-S2468823122007222-si1.svg https://s3-eu-west-1.amazonaws.com/prod-ucs-content-store-eu-west/content/pii:S2468823122007222/image/svg+xml/56f77511e8b63c719a754f29c44c3ada/si1.svg si1 si1.svg svg 1549 ALTIMG 1-s2.0-S2468823122007222-si2.svg https://s3-eu-west-1.amazonaws.com/prod-ucs-content-store-eu-west/content/pii:S2468823122007222/image/svg+xml/59f600695da042d4796dd58331138619/si2.svg si2 si2.svg svg 1684 ALTIMG 1-s2.0-S2468823122007222-si3.svg https://s3-eu-west-1.amazonaws.com/prod-ucs-content-store-eu-west/content/pii:S2468823122007222/image/svg+xml/a789485b21b2a3bde9ad306c5c9682e2/si3.svg si3 si3.svg svg 1642 ALTIMG 1-s2.0-S2468823122007222-si4.svg https://s3-eu-west-1.amazonaws.com/prod-ucs-content-store-eu-west/content/pii:S2468823122007222/image/svg+xml/90c14a93275374af7f67a0019cbd2685/si4.svg si4 si4.svg svg 4599 ALTIMG 1-s2.0-S2468823122007222-si5.svg https://s3-eu-west-1.amazonaws.com/prod-ucs-content-store-eu-west/content/pii:S2468823122007222/image/svg+xml/4765397932bc6f4d19296bcbbdd10e9d/si5.svg si5 si5.svg svg 20099 ALTIMG 1-s2.0-S2468823122007222-si6.svg https://s3-eu-west-1.amazonaws.com/prod-ucs-content-store-eu-west/content/pii:S2468823122007222/image/svg+xml/62d57bc97de10cecd208b7d8c39cbb5b/si6.svg si6 si6.svg svg 18947 ALTIMG 1-s2.0-S2468823122007222-am.pdf https://s3-eu-west-1.amazonaws.com/prod-ucs-content-store-eu-west/content/egi:10G23PVXRWF/MAIN/application/pdf/29e770f8f225f537a816622248516431/am.pdf am am.pdf pdf false 3966332 AAM-PDF MCAT 112836 112836 S2468-8231(22)00722-2 10.1016/j.mcat.2022.112836 Elsevier B.V. Fig. 1 XRD patterns (a) and enlarged view (b) of heteroatom doped Fe-carbon sphere catalysts. Fig 1 Fig. 2 Raman analysis of heteroatom doped Fe-carbon sphere catalysts. Fig 2 Fig. 3 FESEM images (a) & (b), HRTEM images (c) & (d), HAADF-STEM images (e) and corresponding EDX elemental mapping of all (f) and each elements (g–i) of Fe-C catalyst. Fig 3 Fig. 4 FESEM images (a) & (b), HRTEM images (c)–(f), HAADF-STEM images (g) and corresponding EDX elemental mapping of all (h) and each elements (i–l) of Fe-N-C catalyst. Fig 4 Fig. 5 FESEM images (a) & (b), HRTEM images (c)–(f), HAADF-STEM images (g) and corresponding EDX elemental mapping of all (h) and each elements (i–l) of Fe-N-S-C catalyst. Fig 5 Fig. 6 FESEM images (a) & (b), HRTEM images (c)–(f), HAADF-STEM images (g) and corresponding EDX elemental mapping of all (h) and each elements (i–l) of Fe-N-P-C catalyst. Fig 6 Fig. 7 Nitrogen adsorption–desorption isotherms and NLDFT pore size distribution (inset) analysis of Fe-carbon sphere catalysts. Fig 7 Fig. 8 C (1 s) XPS core-level spectra of Fe-C (a), Fe-N-C (b), Fe-N-S-C (c), and Fe-N-P-C (d) catalysts. Fig 8 Fig. 9 O (1 s) XPS core-level spectra of Fe-C (a), Fe-N-C (b), Fe-N-S-C (c), and Fe-N-P-C (d). Fig 9 Fig. 10 N (1 s) XPS core-level spectra of Fe-N-C (a), Fe-N-S-C (b), and Fe-N-P-C (c). Fig 10 Fig. 11 S (2p) and P (2p) XPS core-level spectra of Fe-N-S-C (a), and Fe-N-P-C (b) respectively. Fig 11 Fig. 12 Fe (2p) XPS core-level spectra of Fe-C (a), Fe-N-C (b), Fe-N-S-C (c), and Fe-N-P-C (d). Fig 12 Fig. 13 Thermogravimetric analysis of heteroatom doped Fe-carbon sphere catalysts. Fig 13 Fig. 14 Effect of the reaction temperature in ethylbenzene dehydrogenation (DDH) reaction at different times over the stream (TOS) (a), and effect of ID/IG value on space-time yield. Reaction conditions: 150 mg catalyst, reaction temperature: 723 & 823 K, ethylbenzene: 1 mL/h, nitrogen:10 mL/ min. Fig 14 Fig. 15 At 723 K temperature, the selectivity of styrene (a), toluene (b), benzene (c), and at 823 K temperature, the selectivity of styrene (d), toluene (e), and benzene (f). Reaction conditions: 150 mg catalyst, ethylbenzene: 1 mL/h, nitrogen:10 mL/min. Fig 15 Fig. 16 Effect of reaction temperature on ethylbenzene conversion (a), product selectivity at 723 K (b), 773 K (c), and 823 K (d) in CO2 mediated ethylbenzene dehydrogenation reaction. Reaction conditions: 150 mg catalyst, reaction temperature: 723–823 K, ethylbenzene: 1 mL/h, CO2:10 mL/min, TOS: 4 h. Fig 16 Fig. 17 Variation of CO2 conversion with space time yield of styrene at different times over the stream (TOS) (a), product selectivity in CO2 mediated ethylbenzene dehydrogenation reaction. Reaction conditions: 150 mg Fe-N-C catalyst, reaction temperature: 823 K, ethylbenzene: 1 mL/h, CO2:10 mL/min, TOS: 8 h. Fig 17 Fig. 18 Comparison of catalytic performances between direct ethylbenzene dehydrogenation (DDH) and oxidative dehydrogenation (ODH) reaction (a), and catalytic reusability test up to 4 h time over the stream (TOS) (b). Reaction conditions: Fe-N-C catalyst: 150 mg, reaction temperature: 823 K, ethylbenzene: 1 mL/h, N2/CO2:10 mL/min. Fig 18 Fig. 19 Plausible reaction mechanism of oxidative dehydrogenation of ethylbenzene. Fig 19 Scheme 1 Role of CO2 (Eqs. (2)–(4)) in the oxidative dehydrogenation of ethylbenzene (Eq. (3)). Scheme 1 Scheme 2 Formation mechanism of Fe-C, Fe-N-C, Fe-N-S-C and Fe-N-P-C catalysts. Scheme 2 Table 1 Relative atomic concentration (%) of various C species obtained from XPS for Fe-carbon sphere catalysts. Table 1 Carbon (%) Catalyst sp2 C=C sp3 C-C C-O/C-O-C/C-heteroatom C=O O=C-O/C=N Fe-C 60.4 11.0 4.7 2.5 1.3 Fe-N-C 49.8 13.2 4.6 3.6 2.3 Fe-N-S-C 46.9 10.3 7.8 4.9 2.3 Fe-N-P-C 47.5 11.0 5.6 1.9 1.2 Table 2 Relative atomic concentration (%) of various O and N species obtained from XPS for Fe-carbon sphere catalysts. Table 2 Oxygen (%) Nitrogen (%) Catalyst C=O C-OH O=C-O Pyridinic N Pyrrolic N quaternary N N oxides Fe-C 3.9 9.7 6.3 - - - - Fe-N-C 5.4 8.9 8.4 0.93 0.11 0.98 0.28 Fe-N-S-C 2.2 12.8 - 3.34 0.66 1.17 1.61 Fe-N-P-C 3.4 9.5 5.4 4.59 0.57 3.01 0.91 Table 3 Relative atomic concentration (%) of various iron S and N species obtained from XPS for Fe-carbon sphere catalysts. Table 3 Catalyst Iron (%) Iron (wt.%) a Sulfur (%) Phosphorous (%) C-SO2 C-SO3 C3PO C2PO2/CPO3 Fe-C 0.3 2.66 - - - - Fe-N-C 1.4 3.88 - - - - Fe-N-S-C 0.3 1.82 3.7 1.8 - - Fe-N-P-C 0.1 0.33 - - 2.9 2.6 a Estimated by ICP-OES analysis. Influence of heteroatom-doped Fe-carbon sphere catalysts on CO2- mediated oxidative dehydrogenation of ethylbenzene Anindya Ghosh a Aniruddha Singha a Rupak Chatterjee b Thomas E. Müller c Asim Bhaumik b Biswajit Chowdhury a ⁎ a Department of Chemistry, Indian Institute of Technology (ISM), Dhanbad, Jharkhand, India Department of Chemistry Indian Institute of Technology (ISM) Dhanbad Jharkhand India aDepartment of Chemistry, Indian Institute of Technology (ISM), Dhanbad, Jharkhand, India b School of Materials Science, Indian Association for the Cultivation of Science, Kolkata, India School of Materials Science Indian Association for the Cultivation of Science Kolkata India bSchool of Materials Science, Indian Association for the Cultivation of Science, Kolkata, India c Carbon Sources and Conversion, Ruhr-Universität Bochum, Universitätsstraße 150, Bochum 44801, Germany Carbon Sources and Conversion Ruhr-Universität Bochum Universitätsstraße 150 Bochum 44801 Germany cCarbon Sources and Conversion, Ruhr-Universität Bochum, Universitätsstraße 150, Bochum 44801, Germany ⁎ Corresponding author. Distinctly shaping carbon materials together with doping is an excellent approach for tailoring advanced materials. In this study, a series of heteroatom (N, S, P)-doped Fe-carbon sphere catalysts were prepared by a hydrothermal process to explore the effect of unary and binary dopants on the CO2-mediated ethyl benzene oxidative dehydrogenation. Upon doing so, a transformation from quasi to hollow to perfect spheres was observed that takes place due to the increasing hydrolysis rate and attainment of supersaturation. It was shown that each type of heteroatom has a beneficial role in creating specific chemical entities as well as in defining the iron amount of the catalyst. Catalytic activity correlated with XPS and Raman analysis reveal that the direct dehydrogenation of ethylbenzene is controlled by the iron content at low temperatures, while defect sites are the controlling parameter at high temperatures. Under oxidative conditions, the N-doped hierarchical Fe-hollow sphere carbon (Fe-N-C) catalyst shows the highest catalytic performance among all synthesized catalysts due to the cooperative action of pyridinic N species and the Fe3C phase for CO2 activation as well as RWGS reaction promotion. Graphical abstract Image, graphical abstract Keywords CO2 Soft oxidant Oxidative dehydrogenation Carbon sphere Heteroatom-doped Data availability The data that has been used is confidential. 1 Introduction Carbon nanomaterials with distinct shapes and structures have gained global recognition from academia and industry due to their superior properties like high surface area, good thermal stability and electrical conductivity, and chemical inertness which enables widespread applications in various fields such as adsorbents, catalysts, catalyst supports, energy storage, electrode material, drug delivery and so forth [1–3]. Porous carbon spheres receive particular interest as they possess adequate structural stability, a high surface-to-volume ratio, and an empty space for accommodating metal ions [4]. The advantages of spherical carbon as heterogeneous catalyst support far outweigh that conventional non-spherical materials as it provides faster diffusion and transfer of reactants and products, and good pore accessibility [3]. The deactivation of a supported metal catalyst is frequently the biggest problem of a heterogeneous catalyst and often takes place owing to the sintering or agglomeration of metal nanoparticles [3]. The encapsulation of metal nanoparticles inside the core of the carbon structure is an effective strategy to solve this problem. Generally, the coupling of pentagonal and heptagonal rings cause the carbon nanospheres, where graphitic sheets are more likely to turn out to be a curved along a sphere, to have reactive bonds at the surface which is unlike in the case of C60 [1]. The size of typical carbon spheres ranges from 50 nm to10 μm and can be controlled by varying the reaction temperature and the concentration of precursor species. So far, several strategies have been adopted to prepare carbon nanosphere such as CVD, hydrothermal carbonization (HTC), soft and hard templating, modified Stöber process, and others [3]. Among these low-temperature HTC process is the oldest and easiest approach comprising decomposition of the sugar-based system into HMF followed by polymerization and polycondensation. The introduction of heteroatoms inside the carbon framework is a promising approach in order to change its surface chemistry. The heteroatoms (B, N, S, P) impose unpaired electron density inside the sp2-ring causing the strengthening of the host-guest interaction that eventually alters the catalytic activity [5]. Nitrogen and oxygen doped carbons are extensively studied and widely used materials owing to diverse range of properties. For example, oxygen doping is responsible for developing acidic, basic, or bifunctional acid-base characteristics of carbon depending on the carbonization temperature. In contrast, due to the electronegativity differences between nitrogen and carbon (Pauling scale χ O :3.344, χ N :3.04, χ C :2.44), doping with nitrogen polarizes the carbon framework in a more stable way and promotes the interactions of the carbon surface with acidic molecules through covalent bonding, hydrogen bonding, and dipole-dipole interactions. In a word, nitrogen doping enhances the basic properties of carbon. Likewise, S and P doping induces lots of structural defect sites due to the comparably large size of the S and P atoms apart from delivering acidic functionalities at the edge or outer surface of the carbon materials. Interestingly, the presence of sulfur atoms prevents the sintering of metal nanoparticles at high temperatures. In recent times, binary or tertiary heteroatoms doped carbon material have opened a new domain in the field of catalysis due to their unique electron distribution and cooperative effect [2,6]. Recently, our group experimentally and theoretically showed the synergistic effect between pyridine N and surface -SO2H of N, S co-doped carbon is essential in order to obtain effective CO2 fixation performances [2]. Wu et al. pointed out that the synergistic effect of P, N, and S triggers the electrocatalytic oxygen reduction reaction [7]. Further, Hu et al. mentioned that a porous structure is also beneficial along with N, S active sites while performing nitroarene reduction and ethylbenzene oxidation using N, S co-doped carbon catalysts [8]. Mostly, a stepwise introduction pathway is followed for the co-doped carbon materials which often requires harmful precursors (H2S, NH3) and sophisticated instruments (plasma treatment, chemical vapor deposition, ball milling) [9]. Thus, compositional co-doping with environmentally friendly chemicals in a simple way such as hydrothermal synthesis is highly desirable to develop a sustainable economy. Reducing the CO2 concentration is of increasing global concern and net-zero carbon emissions need to be achieved in the near future. In this respect, utilization of CO2 in the form of capture, storage, and conversion is a good approach to meet the target of long-term sustainable production and establish a carbon-neutral economy [10]. Among various technologies, utilizing CO2 as C1 raw material for the production of chemicals and fuels is a promising as well as indispensable strategy for generating anthropogenic carbon cycles [11]. To date, numerous chemical compounds have been synthesized from CO2 such as formic acid, urea, cyclic carbonates, salicylic acid, methanol olefins, dimethyl carbonates, etc. [12–15]. Nevertheless, those are not sufficient to meet the climate target within a short time. For providing an ecologically and economically beneficial entry to production chains of the chemical industry, new routes and technologies will have to be developed. In this perspective, utilizing CO2 as a soft oxidant and promoter in catalytic processes is an attractive addition in the area of CO2 mitigation. A highly attractive application of CO2 is the synthesis of styrene through oxidative dehydrogenation (ODH) of ethylbenzene (Scheme 1 ). As styrene is a highly valuable monomer in the polymer industry and is mainly produced by dehydrogenation (DDH) of ethylbenzene over potassium promoted iron oxide at high temperatures (Eq. (1)) [16]. Though this process is commercialized, it faces many hurdles as it is an endothermic reversible reaction ( Δ H 298 o = 117.6 kJ/mol) and restricted by thermodynamic equilibrium leading to the consumption of huge amount of energy (1.5 × 106 kcal/ton of styrene) [17,18]. An excess amount of superheated steam is provided to remove the coke that is formed on the catalyst surface during reaction along with keeping the reactant partial pressure low. To eliminate these problems, catalytic oxidative dehydrogenation in the presence or co-feeding of O2, NOx, SO2, or CO2 is regarded as a thermodynamically beneficial process [19]. However, the use of O2 causes over-oxidation and generating unwanted hydrocarbons and carbon oxides. In comparison, NOx and SO2 act as softer oxidants but are not appropriate for industrial production as several toxic and hazardous products (CS2, COS) are released during reaction. In this context, utilization of CO2 as a soft oxidant would not only have a positive impact on global carbon neutrality but also provide many advantages from reaction point of view, such as suppression of over oxidation, triggering a higher reaction rate by altering the oxidative dehydrogenation pathway, minimizing hot spot phenomena, reduce coke formation by removal of deposited carbon through the Boudouard equilibrium (Eq. (4)) and consequently less catalyst deactivation, and reducing the partial pressure of the ethylbenzene (Eqs. (1)–(3)) [19,20]. Noteworthy, addition of CO2 shifts the thermodynamic equilibrium towards the product side as generated hydrogen is removed through the reverse water gas shift (RWGS) reaction between H2 and CO2. This leads to improve in catalytic activity and reduce energy consumption (1.9 × 105 kcal/ton of styrene) [17]. To date, a variety of transition metal oxides (Fe, V, Cr, Ce based), mixed metal oxides, metal oxides, and carbon supports as well some promoters effects have been studied for the oxidative dehydrogenation of ethylbenzene with CO2 [16,19]. Among all, a catalyst comprising of Fe (+3) and V (+5) metal centers has received particular interest as these centers are redox active [16]. Further, the synergistic effect of acidic and basic properties of a catalyst plays a crucial role as shown by Sato et al. [21]. Likewise, the use of carbon supports for this reaction has gained momentum as they offer high surface area, easy surface modification, and most importantly surface oxygenated groups which influence dehydrogenation reaction. Rao et al. studied the effect of hydroxylation defects on MWCNTs prepared by hydrothermal, ball-milling, and ultrasonic treatments for CO2 ODH reaction [22]. It was found that the hydroxylation enhances the defect density which finally improves catalytic performances. Recently, Kim et al. prepared a N doped Fe-graphite catalyst through a mechanochemical process that showed stable performances in the CO2 ODH reaction of ethylbenzene at low temperatures [23]. Nevertheless, there is a lack of suitable catalysts for this reaction that can be prepared easily. To think of this matter, we have prepared a series of heteroatoms (N, P, S) doped Fe-carbon sphere catalysts by a simple hydrothermal process for the CO2 mediated oxidative dehydrogenation of ethylbenzene and showed the impact of the presence of the heteroatoms. Further, the benefit for selecting CO2 as soft oxidant were also explored by comparison with N2 as inert medium. 2 Experimental 2.1 Materials and reagents All chemicals utilized in this study were commercially available and used without any further purification. Fe(NO3)3. 9H2O (98%, SRL India) and p-toluenesulfonic acid (99.5%) were obtained from Sisco Research Laboratories, India. Phosphoric acid (85% aq.) and Melamine (99%) were purchased from Alfa Aesar, USA. Sucrose (GR) was acquired from Mark, Germany. Ethylbenzene (99.8%) was provided by ThermoFisher scientific, USA. 2.2 Preparation of catalysts The catalysts were prepared after slight modifying a procedure reported elsewhere, as described below [24]. 2.2.1 Preparation of N doped Fe-carbon sphere catalyst This catalyst was prepared by the sonicating amixture of 2 g sucrose, 1 g melamine, and 0.25 g Fe(NO3)3. 9H2O in a 250 mL round bottom flask containing 60 mL water for 30 min. Once, the reaction mixture had turned completely pale yellow, it was subjected to hydrothermal treatment in 100 mL Teflon tube autoclave at 453 K for 24 h. Then, the autoclave was cooled to room temperature, and subsequently, the product was recovered by filtration and washed with sufficient water. Finally, obtained black material was carbonized at 873 K for 2 h in a quartz tube with a temperature rate of 5 K/min. This catalyst is denoted as Fe-N-C. 2.2.2 Preparation of N, S, and N, P co-doped Fe-carbon sphere catalysts For N, S co-doped carbon sphere, 2 g sucrose, 1 g melamine, 1 g p-toluenesulfonic acid and 0.25 g Fe(NO3)3. 9H2O while for N, P co-doped carbon sphere 2 g sucrose, 1 g melamine, 1 g phosphoric acid, and 0.25 g Fe(NO3)3. 9H2O was taken in a 250 mL round bottom flask containing 60 mL water respectively followed by sonication for 30 min. At the end of sonication, the p-toluenesulfonic acid-containing mixture became pale yellow while the phosphoric acid-containing mixture turned pale yellow to white. Afterward, similar procedures such as hydrothermal treatment, filtrations, and carbonization were followed as N doped iron sphere described above. After carbonization, N, S, and N, P co-doped carbon sphere catalysts are termed Fe-N-S-C and Fe-N-P-C. 2.2.3 Preparation Fe-carbon sphere catalyst Briefly, 2 g sucrose and 0.25 g Fe(NO3)3. 9H2O were dissolved in 60 mL water and followed all necessary steps as in the preparation of Fe-N-C or Fe-N-S-C or Fe-N-P-C catalysts. This as-synthesized catalyst after carbonization is named Fe-C. 2.3 Catalytic activity studies The efficacy of each carbon sphere catalyst was tested at atmospheric pressure in a downflow fixed bed reactor, where 0.15 g (100–120 mesh) catalyst was loaded into a quartz reactor (I.D. 9 mm) and finally placed into a furnace. The reaction temperature was controlled throughout the reaction by using a K-type thermocouple. The oxidative dehydrogenation reaction was studied in a range of temperatures Prior to the reaction, the catalyst was pre-treated at 823 K for 1 h under N2 (purity 99.999%) atmosphere (10 mL/min). Afterward, the reaction temperature was maintained (723–823 K) by introducing CO2/N2 (purity 99.999%) gas (10 mL/min). Finally, the reaction was begun by injecting ethylbenzene (1 mL/h) through a liquid feed pump. The liquid reaction mixture (benzene, toluene, styrene, ethylbenzene) was trapped in an ice-cold trap at regular time intervals while the gaseous products were directly sent to a gas chromatograph through a heated line connected with gas sampling valves. The confirmation and quantification of liquid products were achieved by manually injecting the reaction mixture on an Agilent 7890 B gas chromatography equipment fitted with FID using the HP FFAP column. A two-column assembly i.e. Porapak and Molecular Sieve Packed (Agilent) columns with valve switching were used for the separation of CO2, CH4, CO, and H2 gasses in TCD. The chromatograms of all detected products are provided in Figs. S1–S3. The ethylbenzene conversion and styrene selectivity were determined by applying the following equations. The carbon balance was found 88 to 95%. The ethylbenzene conversion and styrene selectivity were calculated by applying the following equations. Conv ersi on ( % ) = ( 1 − Ethy lben zen e ( out ) Ethy lben zen e ( in ) ) × 100 Selectivity ( % ) = ( Styren e ( in ) ( Ethylbenzen e ( in ) − Ethylbenzen e ( out ) ) ) × 100 3 Results and discussion 3.1 Physicochemical characterizations The structural information of carbon sphere catalysts is investigated by X-ray diffraction analysis and depicted in Fig. 1 . Two broad reflections in the XRD pattern at 2θ = ∼ 21–25° and 44° describe the (002) and (100) planes of the nanocrystalline graphitic domain within the carbon regime (JCPDS No. 89−8487) [2,25]. Again, the Fe-N-C catalysts exhibit two sharp diffraction peaks at 44.7° and 44.8° (Fig. 2 ) corresponding to the (110) and (031) plane of metallic Fe (JCPDS No. 06–0696) and iron carbide (Fe3C) (JCPDS No. 35–0772) [26–28]. Since ample amount of binding sites (N species) are available to capture or reduce the iron either through iron and carbon bond or through a donation of electrons from nitrogen. Despite not having any N heteroatom in the Fe-C catalyst, holds a higher amount of Fe species as it is physically trapped inside the carbon framework which is also evident from HRTEM [28]. Upon carbonization, the Fe species finally turns out to be an oxide form at 35.45° (magnetite Fe3O4, JCPDS No. 00–001–111). However, the ICP-OES analysis (Table 3) suggested the Fe amount is too low to appear in any particular crystalline form in XRD pattern of Fe-C-N-P catalyst. Interestingly, the metallic Fe, Fe3C crystalline phase is also possible to observe in the case of Fe-N-S-C along with a small shifting towards a lower 2θ angle. Upon moving from Fe-N-C to Fe-N-S-C catalysts, an increase in defect sites is noticed from Raman analysis (Fig. 2) as sulfur heteroatom is embedded inside carbon matrix. Since, the covalent radius of carbon (rcov: 0.73 Å) is much smaller than that of sulfur (rcov: 1.04 Å) resulting in increased interplanar distance and displacement of Fe, Fe3C peaks at lower 2θ angle [27]. Furthermore, the degree of structural deformation is disclosed in Fig. 2 by Raman spectroscopy. All carbon sphere catalysts have two typical D and G bands that are visible at around 1348 cm−1 and 1578 cm−1 respectively. The origination of the G band is associated with the in-plane vibration of sp2 aromatic carbon while the D band corresponds to the disorder caused by the defect and dislocation within the carbon framework [2]. Generally, the extent of the disorder, defect sites, or planarity is expressed by the relative intensity of the D and G bands. The obtained ID/IG value follows the order of Fe-N-S-C (1.23)> Fe-N-P-C(0.98)> Fe-N-C (0.89)>Fe-C(0.82) indicating that the heteroatoms play a great role in order to increase the disorders or defect sites of carbon catalyst. It is also noted that the co-doping by two heteroatoms (Fe-N-P-C and Fe-N-S-C) induces more structural deformation rather than a single doping carbon sphere catalyst (Fe-N-C). The morphological details of hydrothermally prepared carbonized samples were examined through FESEM and displayed in Figs. 3 –5(a, b). All samples after carbonization emerge as a mostly discrete sphere with a smooth surface regardless of any dopants but vary in size distributions. It is noted that the Fe-C catalyst possesses a variable-shaped microsphere with a mean diameter of 2.4 μm slightly lower than the other three (∼3.1–4.5 μm). Thus, it is believed that in absence of heteroatoms (N, S, P) carbon skeleton experiences a shrinkage. However, a clear insight into microstructural properties has been paid by using HRTEM, where Fe-C and Fe-N-C catalysts appear as a quasi-carbon sphere (Fig. 3(c)) and hollow carbon sphere (Fig. 4 (e) & (f)), while the other two (Fe-N-S-C and Fe-N-P-C) exhibit perfect sphere (Figs. 5 (c–f) & 6 (c–f)). Based on literature reports and microstructural analysis, a plausible reaction mechanism for the formation of carbon spheres is established (Scheme 2 ) [29–32]. Generally, the hydrolysis of sucrose to glucose and fructose monomer is the primary step in the formation of a carbon sphere, where sucrose hydrolysis is initiated either in presence of hydronium ion, originating from autoionization of water or in presence of any acid. But the latter one is effective as the hydrolysis rate increases enormously by acid catalysis. Then, the formed monomers undergo decomposition reactions (dehydration, decarbonylation, and aromatization) to form soluble macromolecules (1,6-anhydroglucose, furyl, and 1,2,4-benzenetriol) followed by polymerization or cross linking originated from intermolecular dehydration of formed macromolecules, linear or branchlike oligosaccharides, and other molecules (if present) . If the concentration of polymeric solution meets the critical supersaturation point, then burst nucleation happens, where each nucleus starts growing uniformly by diffusion to the surface of the chemical species present in the solution and is eventually obtained as particles. Finally, the aggregation of high-density particles compactly results in a carbon sphere. Therefore, to reach the threshold of supersaturation point, the concentration of macromolecules should be high enough as we know polymerization of the pentagonal and heptagonal ring is the second crucial step to getting a carbon sphere. In the case of the Fe-C catalyst, there was not any acid to be used during the hydrothermal process so slow hydrolysis took place in presence of autoionized H + [31]. Thus, that hydrothermal condition was not sufficient to reach the supersaturation point which may be the main reason why a perfect carbon sphere does not appear. Though in the case of Fe-N-C catalyst any acid was not used the existence of melamine somehow manages optimum concentration to attain supersaturation point for burst nucleation which causes the formation of carbon spheres. The high-resolution HRTEM images suggested it seems more like a hollow sphere (Fig. 4(e)&(f)) having various internal diameters of 20–32 nm and shell thickness of 3.2–4 nm. This may be due to the incomplete polymerization of melamine and macromolecules leading to the recrystallization during the growth of nuclei. On the other hand, the utilization of acids such as (H3PO4 and p-toluenesulfonic acid) triggers hydrolysis rate in the case of Fe-N-S-C and Fe-N-P-C catalysts and can easily attain the desired macromolecules concentration at which burst nucleation takes place by the overcoming of supersaturation point easily. Finally, high-energy particles are assembled tightly and appear as a perfect sphere. In a word, those acids not only help in hydrolysis and achieving supersaturation points but also make the sphere formation feasible by coupling with macromolecules. As Raman's analysis has suggested, the introduction of binary dopants is the main reason for creating enormous disorder or defect sites in the carbon skeleton. These defect sites might minimize the ring strain and help in the formation of a perfect carbon sphere. Additionally, high-angle annular dark-field scanning transmission electron microscopy (HAADF-STEM) was introduced to survey the existence of Fe species. As can be seen from (Figs. 3–5), all carbon sample surfaces appear with uniform brightness. So, one can think Fe might exist as isolated species but map images suggested the good distribution of Fe species throughout the carbon surface (Figs. 3(g), 4(l), 5(l) & 6(l)). This may be due to a few reasons reported elsewhere such as (i) high surface area of carbon, (ii) high nitrogen amount, (iii) utilization of oxygen-enriched precursor, and (iv) low iron amount [33]. Again, the map images of N dopant for Fe-N-S-C (Fig. 5(j)) and Fe-N-P-C (Fig. 6(j)) catalysts show the higher density of N in the center of the carbon sphere, implying the N doping is not restricted by the other dopants rather homogeneous over the sphere [34]. The porosity and BET surface area of Fe-carbon sphere catalysts are examined by N2 adsorption-desorption analysis and obtained isotherms are displayed in Fig. 7 . A classical feature of type IV isotherms with the variable shape of hysteresis indicates different textural properties. In each case, an ample amount of N2 uptake is found at a lower pressure region (P/P0 =0–0.1), which is a good sign of having a considerable amount of microporosity, especially for Fe-N-C catalyst [35]. However, the desorption branches of Fe-C, Fe-N-S-C, and Fe-N-P-C catalysts are affected by the cavitation and turn out as H3 hysteresis due to the formation of slit-like pores by the aggregation of plate-like particles [36]. Again, the persistence of H3 hysteresis up to low relative pressure (P/P0 < 0.4) is an indication of kinetic effect (diffusion limitation). Interestingly, an open H4 type of hysteresis can be seen in the case of Fe-N-C, implying the co-existence of micro and mesopores which are very frequently observed in hierarchical carbon and mesoporous zeolite [36]. The pore size distribution derived from the NLDFT method in Fig. 7(inset) reinforces the hierarchical porosity of the Fe-N-C catalyst. The unusual open H4 hysteresis may be caused either by the diffusion hindrance or by the strong interaction between N2 with high energetic sites. The surface area of synthesized catalysts follows the order of Fe-N-C> Fe-N-S-C> Fe-N-P-C where highest surface area (194 m2/g) of Fe-N-C is mainly accounted for by the hollow sphere structure of the catalyst [37]. Upon co-doping, surface area decreases substantially as perfect sphere formation takes place along with the insertion of a greater number of heteroatoms. However, the Fe-N-P-C catalyst possesses a lower surface (67 m2/g) area as compared to Fe-N-S-C (112 m2/g) due to having the highest amount of heteroatoms, shown in XPS [2]. XPS analysis of all catalysts provides deep insight into the surface elemental composition. The asymmetric nature of C (1 s) core-level spectra of all synthesized catalysts indicates the existence of different bonding environments of carbon, shown in Fig. 8 . The deconvolution of C (1 s) results in five distinct peaks, related to the sp2 C = C (peak 1, 284.6 eV), sp3 CC (peak 2, 285.51–285.68 eV), CO/CO-C/C-heteroatom (Peak 3, ca. 286.25–286.58 eV), C = O (peak 4, 287.2–287.55 eV), and O = CO/C = N (peak 5, 288.04–288.66 eV) species respectively [2,32,38]. Further, the calculation of atomic concentration (Table 1 ) shows a decrease in the concentration ratio of sp2 C = C and sp3 CC species upon the introduction of heteroatoms inside the carbon framework. This fact supports the Raman analysis results, related to the induction of defect sites by heteroatoms. Despite having similar kinds of carbon species within all catalysts, their variable atomic concentrations make them different from each other to catalyze different reactions. Earlier, our group showed the significance of O = CO species for glycerol acetalization reaction [32]. However, Kim et al. showed the effect of surface C = O species for oxidative dehydrogenation of ethylbenzene [28]. The deconvoluted O (1 s) spectra (Fig. 9 ) of Fe-C, Fe-N-C, and Fe-N-P-C catalysts are each made of three peaks, associated with C = O (peak 1, 530.56–531.7 eV), COH (peak 2, 532.36–532.72 eV) and O = CO (peak 3 533.15–533.6 eV) species [32]. However, the O = CO species is not found in the case of Fe-N-S-C catalyst (Fig. 8(c)). This result suggests the absence of surface COOH species in this catalyst and also confirms the appearance of a peak at 288.46 eV (peak 5) in the C (1 s) spectrum is solely responsible for C = N species (Fig. 8(c)). Notably, the calculated atomic percentages suggest the surface is mainly enriched by COH species (Table 2 ). Fig. 10 shows the N(1 s) core level spectra of Fe-N-C, Fe-N-S-C, and Fe-N-P-C catalysts, four distinctive peaks are visible for each catalyst which are assigned for the presence of pyridinic N (peak 1, 398.01–398.29 eV), pyrrolic N (peak 2, 399.11–399.45 eV), quaternary N (peak 3, 399.22–400.33 eV), and several N oxides (peak 4, 400.71–401.31 eV) species respectively [39]. Interestingly, it is seen in Table 2, that sulfur and phosphorus induce more nitrogen in the carbon surface for Fe-N-S-C and Fe-N-P-C catalyst as compared to only nitrogen-doped catalysts (Fe-N-C). Hence co-doping plays a beneficial role in inserting more nitrogen species and their distributions. However, the concentration of pyridinic N (Table 2) dominates with an order of pyridinic N >quaternary N > N-oxide > pyrrolic N for all three catalysts despite having a co-doping effect. The pyrrolic species is thermally unstable as it might transform into quaternary N at higher temperatures [40]. Several theoretical experimental studies prevailed that the carbon catalyst having a greater amount of pyridinic N species can be favorable for CO2 adsorption through an association between N lone pair and C of CO2 but their interaction sometimes varies in presence of other dopants. In the case of the Fe-N-S-C catalyst (Fig. 11 (a)), the deconvoluted S (2p) spectra consist of four peaks. The one set of doublets features at ca. 164.73 (peak 1) and 165.77 (peak 2) eV from the spin-orbit coupling of S (2p), can be identified for the interaction of sulfur and carbon (C-S-C 2p 3/2 and C-S-C 2p ½) in thiophene species. However, another interaction is found at ca. 167.82 (peak 3) and 170.05 (peak 4) eV, ascribing the presence of terminal C-SO2 and C-SO3 species [2,32]. It is noted from the relative atomic concentration that about 98% of sulfur species exist in the form of C-SO2 and C-SO3 and can be efficient to work as Brønsted acidic sites (Table 3 ). On the other hand, the deconvoluted P (2p) of Fe-N-P-C catalyst (Fig. 11(b)) gives rise to two peaks, indicating different bonding fashion of phosphorus in the carbon framework. Though the stability of phosphorus species is still a matter of debate at high temperatures [41]. But the peaks at ca. 132.64 (peak 1) and 134.92 (peak 2) eV assure the existence of pentavalent tetracoordinate C3PO and C2PO2/CPO3 species [42]. Both species are located at the edge of the carbon surface. The C3PO helps to link the carbon layers while the C2PO2/CPO3 species mainly act as Brønsted acidic sites. In addition, this catalyst contains a significant amount of acidity as 47% of the total atomic concentration of phosphate (Table 3), acts as an acidic site. This result further suggests, that the peak at 532.36 (peak 2) eV in the O (1 s) spectrum (Fig. 9(d)) of Fe-N-P-C catalyst also may be caused by the P-O along with COH species [42]. Apart from this, diversity in the distribution of iron species is found in Fe (2p) spectra for all catalysts (Fig. 12 ). Owing to having a lower content of iron, poor signals are obtained. In the case of Fe-C catalyst (Fig. 12(a)), one pair of spin-orbit peaks arise at ca. 709.9 (2p3/2, peak 1) and 724.51(2p1/2, peak 5) eV are due to the presence of Fe2+. However, another pair at ca. 712.7 (2p3/2, peak 2) and 727.2 (2p1/2, peak 6) eV guarantees the co-existence of Fe3+ [43,44]. This observation further strengthens the information about the existence of Fe3O4 obtained from XRD (Fig. 1). Additionally, three other peaks at ca. 716.95 (peak 3), 720.69 (peak 4), and 730.88 (peak 7) eV are the satellite peaks of Fe2+ and Fe3+ respectively [43,45]. In contrast, one pair of Fe3+ spin-orbit peaks and metallic iron peaks are found in the case of Fe-N-C and Fe-N-S-C catalysts (Fig. 12(b) & (c)) [46]. Where the slight change in the binding energy of Fe3+ peak as compared to Fe-C catalyst indicates that the surface may be electronically modified. Since nitrogen dopant improves the electron mobility of the carbon material, causing induces more electron density around Fe3+ which ultimately helps to shift the binding energy downwards. This observation combined with XRD results led us to suggest the existence of Fe3+ in the form of Fe3C in Fe-N-C and Fe-N-S-C catalysts. However, in the case of the Fe-N-P-C catalyst, the iron is present in the state of Fe0, Fe2+, and Fe3+ (Fig. 12(d)). It is worth noting from Table 3, the iron content found from XPS varies significantly in the order of Fe-N-P-C (at.%= 0.1%) < <Fe-C (at.%= 0.3) = Fe-N-S-C (at.%= 0.3) < Fe-N-C (at.%= 1.4), demonstrating the impact of different dopants on the loading of Fe during the synthesis. The maximum iron loading in the Fe-N-C catalyst is probably due to the presence of N dopants. The comparable atomic radius and higher electronegativity difference of N with C accelerate electron mobility and polarize electron cloud over the carbon surface which leads to enhanced charge distribution [3,39]. This phenomenon may be responsible for maximum iron intake. Whereas, S dopant is unable to develop adequate charge distribution despite bearing a similar kind of electronegativity to that of carbon as they differ in atomic radius substantially [40]. As a result, the Fe-N-S-C catalyst shows similar iron acceptance to the Fe-C catalyst. While preparing the Fe-N-P-C catalyst by sonication, the color changed from pale yellow to white with the addition of H3PO4. This indicates the formation of a complex Fe[HPO4]+ by capturing Fe3+ ions which may be the reason why Fe3+ is no longer available to interact with the dopants present in the carbon framework. Therefore, a lower amount of iron is found in Fe-N-P-C catalyst. Meanwhile, a variable amount of iron species has been washed away due to the effects of dopant as well as synthesis conditions. The thermal stability of a catalyst is a salient parameter for a heterogeneous catalyst, especially for high-temperature gas-phase reactions. To check that, thermogravimetric analysis was carried out under inert conditions and displayed in Fig. 13 . The nonlinear TGA profile of the aforementioned catalysts conferred the catalyst has variable thermal stability. The first mass loss in the temperature range 400–405 K for all catalysts is analogous to the loss of physisorbed water molecule molecules [2,32]. However, the mass loss found above 870 K, corresponds to the decomposition of mainly phenolic species attached to the carbon framework, indicating, that performing a reaction beyond this is not worth it. In addition, Fe-C and Fe-N-P-C catalysts encountered a little mass loss in the range of 620–650 K. The mass loss for Fe-C catalyst is mainly due to the combustion of acidic sites (anhydrides species) while for Fe-N-P-C catalyst it is related to the combustion of acidic sites along with C-P-O species [41,47]. This observation supports well with earlier reports. Interestingly, no loss is observed in the case of Fe-N-C and Fe-N-S-C catalysts in the range of 400–870 K, which is a good indication to perform a gas phase reaction in this temperature region. 3.2 Catalytic activity study 3.2.1 The behavioral aspect of as-synthesized catalysts on direct dehydrogenation of ethylbenzene (DDH) Primarily, the ethylbenzene dehydrogenation reaction was conducted by using as-synthesized catalysts without oxidative conditions to find a suitable catalyst. The direct dehydrogenation of ethylbenzene produces styrene as the main product and side-chain cracking results in toluene, benzene, and CH4 as side products. Though the ethylbenzene conversion vs TOS profile at 723 K shows a steady performance for 8 h ethylbenzene conversion is not significant (Fig. 14 (a)). Still, Fe-N-C shows high conversion among all four catalysts. The active phase that is responsible for low temperature is not clear. Still, circumstantial results indicate the Fe3C phase of the Fe-N-C catalyst which may be the active site for this dehydrogenation reaction as reported earlier. Fe3C unit cell has 12 iron and 3 carbon atoms. The iron comes up with the adsorption sites for the ethylbenzene, thus higher iron-containing catalyst may tend to be proportional to the conversion. Even, though the Fe-N-S-C catalyst also contains the Fe3C phase the estimated quantity (0.3%) is too low to make a difference in conversion from low iron-containing other (Fe-C and Fe-N-P-C) catalysts. However, by increasing the temperature from 723 to 823 K, a noteworthy enhancement of ethylbenzene conversion is observed irrespective of any four catalysts. Ethylbenzene dehydrogenation being an endothermic reaction can work effectively at high temperatures as equilibrium shifts towards the product sides. Again Table 3 shows the low iron (0.3%) content of Fe-N-P-C catalyst but has the higher conversion throughout the 8 h TOS as compared to the high iron (1.4%) content of Fe-N-C catalyst. Therefore, the ethylbenzene conversion is not only controlled by the iron content at high temperatures. Kim et al. categorized three factors: iron content, C = O/N-functional groups, and defect sites that could be a contributor to ethylbenzene dehydrogenation reaction over Fe-based graphite catalyst [23]. From the O(1 s) core level spectra, the C = O atomic concentration of all catalysts follows the order of Fe-N-C<Fe-N-S-C<Fe-N-P-C while the total atomic concentration of N species follows the sequence of Fe-N-C<Fe-N-S-C<Fe-N-P-C. These observations imply neither of them is directly responsible for the catalytic conversion of ethylbenzene. Hence, to find out the role of defect sites, the styrene formation rate is correlated with ID/IG value, as shown in (Fig. 14(a)). It is noticed that with an increase in defect sites (ID/IG), the ethylbenzene conversion steadily rises at 823 K but not at 723 K. Where iron content controls the ethylbenzene conversion. Hence, iron content and ID/IG ratio are the two important parameters for direct ethylbenzene dehydrogenation. In addition, the maximum selectivity of styrene is observed for the Fe-N-C catalyst at both temperatures (723 and 823 K) throughout the 8 h induction process (Fig. 15 (a) &(d)). Qui et al. stated that benzene formation is promoted by the surface COH and N-oxides species as they catalyze the cracking reaction of ethylbenzene, leading to the decrease in styrene selectivity. As displayed in Table 2, the benzene being the major by-product can easily diffuse through small pores and starts producing more with time for Fe-C, Fe-N-S-C, and Fe-N-P-C. The combination of lower atomic concentration of COH species and hierarchical pore structure of Fe-N-C catalyst ensures highest selectivity of styrene [48]. However, the worst selectivity is shown by the Fe-N-S-C catalyst after 8 h of reaction, which could be accompanied by the presence of the highest concentration of N-oxide along with COH species (Table 2) [48]. 3.2.2 Performance of as-synthesized catalysts in oxidative (CO2) dehydrogenation of ethylbenzene (DDH) CO2-mediated oxidative dehydrogenation of ethylbenzene over acidic-basic carbon catalyst follows a little different pathway compared to direct dehydrogenation, where the reaction starts with simple dehydrogenation and later proceeds by oxidative dehydrogenation. In simple, the efficient CO2 activation, rate of reverse water gas shifting (RWGS) reaction, and concentration of C = O species are the few deciding factors in CO2 mediated-dehydrogenation [19,28,49]. In order to witness the role of CO2, the obtained Fe-carbon sphere catalysts have been attempted for the same reaction at three different temperatures by keeping other reaction parameters constant (Fig. 16 ). It is found that the ethylbenzene conversion increases with temperature as a higher temperature can be able to overcome the thermodynamic limit of an endothermic reaction [49]. However, the conversion of the as-synthesized catalysts at each temperature follows a similar trend of Fe-N-C > Fe-C > Fe-N-S-C > Fe-N-P-C (Fig. 16(a)). Among all N species, Pyridinic N sites are majorly accountable for CO2 activation through the interaction between nitrogen lone pair and C of CO2 [50,51]. In the case of Fe-N-C catalyst, the highest conversion is related to the efficient CO2 activation as well as the alleviation of RWGS reaction by the Fe3C phase. It is reported that Fe3C can act as active sites in RWGS reactions [52–54]. So, consumption of formed H2 through reverse water gas shifting (RWGS) reaction, compels the ethylbenzene to be converted more. Besides, the highest amount of surface C = O species also helps the weakening of α -hydrogen of ethylbenzene [28]. Despite the presence of the highest amount of surface pyridinic N sites in Fe-N-S-C and Fe-N-P-C catalysts, they are unable to perform like Fe-N-C because other dopants i.e. sulfur and phosphorus restrict the efficient adsorption and subsequent activation of CO2 through their acidic nature. In particular, Brønsted acidic sites such as C-SO3, C-SO2, C3PO, and C2PO2/CPO3 are much suitable for the adsorption of basic molecules such as NH3, pyridine, etc. [55]. The activation of CO2 is predicted by changing the bond angle from linear geometry [19]. Hence, Brønsted acidic sites may either impede the acidic CO2 molecule to be adsorbed on the surface or do not allow a proper change of the bond angle, which in turn, could lead to inefficient activation. However, the dopant (N, S, P) interference is absent in the Fe-C catalyst, leading to better conversion than Fe-N-S-C and Fe-N-P-C catalysts. It is worth saying that the selectivity of styrene remains high and more or less unchanged for all catalysts at each temperature but the Fe-N-C catalyst appears as the best one in that (Fig. 16 (b–d)). Owing to the existence of a lesser amount of COH and N-oxide species, the cracking reaction is less favorable as compared to others [48]. Further, the styrene formation rate of Fe-N-C at different reaction temperatures is monitored with the CO2 conversion at a different time interval. It is noticed that the styrene formation rate increases from 723 K to 773 K and becomes twice as high at 823 K (Fig. 17 ). Likewise, CO2 consumption enhances with reaction temperature and reaches a maximum of 823 K (Fig. 17). This observation suggests that as the yield of styrene increases, more CO2 participates in the reaction. The CO2 conversion is mainly dependent on the abundance of H2 and the production of H2 is controlled by the reaction temperature. Thus, a combination of two at high temperatures achieves a high yield of styrene. The role of CO2 as a soft oxidant in this oxidative dehydrogenation is further compared with direct dehydrogenation. As indicated in Fig. 18 (a), the ethylbenzene conversion and styrene selectivity in presence of CO2 are much higher than that in N2. Initially, styrene and H2 form through direct dehydrogenation. But only in presence of CO2, the formed H2 can couple with activated CO2 and shifts the equilibrium of the dehydrogenation towards higher ethylbenzene conversion [49]. This coupling reaction accelerates the dehydrogenation reaction rate and suppresses the over-oxidation of products resulting in higher conversion and selectivity. However, the coke deposition that causes deactivation is very common in the ethylbenzene dehydrogenation reaction. In this regard, CO2 can also help as an oxidant for the effective removal of coke through oxidation and eventually improves the catalytic performance and catalyst lifetime [19]. It is found in the literature that the oxidative dehydrogenation of ethane using molecular O2, where CO and CO2 were produced as by-products where dehydrogenated products increased at high pressure of O2 with obtained selectivity of ethylene was around 80%. In our present study, the selectivity of dehydrogenated product is around 70% with a styrene formation rate of 15.6 mmol/g/h after 8 h of TOS in presence of CO2 as a soft oxidant [56]. It might have seemed from Table S1 that the ethyl benzene conversion and styrene selectivity of previously reported catalysts are better than our catalyst but the styrene formation rate demonstrates the overall superiority of our synthesized catalyst at 523 K temperature. Finally, the spent catalyst is regenerated in each cycle at 823 K under a CO2 atmosphere. The removal of coke in the form of CO is also evident by the gas chromatogram. In Fig. 18(b), there is not any drastic fall in catalytic activity observed even after three-time reuses. Interestingly, in the first cycle, CO2 conversion increases significantly, implying coke on the catalyst surface is not removed completely which in turn is removed during the reaction. However, the styrene selectivity after the third cycle decreases abruptly owing to the formation of benzene. The excellent catalytic activity of Fe-carbon sphere catalysts is rationalized readily on the basis of the catalytic functions that are present in the catalysts (Fig. 19). The porous carbon sphere encapsulates iron nanoparticles thereby perfectly stabilizing the metallic iron phase, while at the same time providing ready access of the substrate molecules to the iron surface atoms. Dehydrogenation of ethylbenzene at the iron atoms provides styrene that diffuses rapidly out of the porous carbon sphere. The hydrogen is transferred by surface diffusion or a molecular diffusion process that occurs within the sphere to a neighbouring Fe3C site. In parallel, CO2 is activated upon passing through the porous carbon sphere upon adsorption on pyridinic N sites. Spatially close hydrogen and carbon dioxide are then converted rapidly through the RWGS reaction over Fe3C active sites to carbon monoxide and water that diffuse out of the porous carbon sphere. The synergistic effect of the different sites in the Fe-carbon sphere catalysts thus gives rise to the high catalytic activity and excellent selectivity of Fe-carbon spheres in the CO2-mediated ethylbenzene dehydrogenation. 4 Conclusions In summary, a series of heteroatoms (N, P, S) doped Fe-carbon sphere catalysts have been prepared by the conventional hydrothermal approach and compared with regard to their catalytic efficiency for CO2-mediated oxidative dehydrogenation reaction. The appearance of a perfect carbon sphere for Fe-N-S-C and Fe-N-S-C catalysts is well explained based on HRTEM and FESEM results. XRD gives a brief idea about the formation of the nanocrystalline graphitic domain along with different iron species while Raman analysis unveils, that the compositional co-doping is responsible for introducing more structural disorders or defect sites in the carbon framework. Further, the existence of surface chemical species is confirmed by XPS analysis. Additionally, the nature of the heteroatom sites and their ability of charge distribution on the carbon surface has a great impact on the variation of the amount of iron from one catalyst to another. In the case of both direct and oxidative ethylbenzene dehydrogenation reactions, Fe-N-C turns out to be the best catalyst at a temperature of 823 K. The catalytic performance under oxidative conditions is much higher than that of direct dehydrogenation. This rationalizes readily as CO2 is efficiently activated by pyridinic N and can be able to favor RWGS by coupling with formed H2 over Fe3C active sites. However, the other acidic species such as C-SO3, C-SO2 and the C2PO2/CPO3 hinder the efficient CO2 adsorption in Fe-N-S-C and Fe-N-P-C catalysts, resulting in a low catalytic activity. It is envisaged that this study related to the utilization of CO2 as a soft oxidant and its behavior on different chemical species could be a prototype for designing carbon-based catalysts for industrial scale operations. CRediT authorship contribution statement Anindya Ghosh: Catalyst synthesis and characterization, Activity study, Data interpretation, Writing ...original draft. Aniruddha Singha: Activity study, Data interpretation. Rupak Chatterjee: Catalyst characterization. Thomas E. M..ller: Writing-review & editing, Data curation, Funding acquisition. Asim Bhaumik: Writing-review & editing, Data curation, Funding acquisition, Biswajit Chowdhury: Conceptualization, Writing-review & editing, Funding acquisition, Supervision. Declaration of Competing Interest The authors declare that they have no known competing financial interests or personal relationships that could have appeared to influence the work reported in this paper. Acknowledgements BC and AB would like to acknowledge IGSTC (IGSTC/Call 2018/CO2BioFeed/15/2019–20), for funding under Indo-German collaboration research for research grant. TM would like to acknowledge DLR for the research grant, AG would like to acknowledge IIT (ISM) for research fellowship and RC would like to acknowledge CSIR, Govt of India for research fellowship. Authors would like to acknowledge the central research facility at IIT(ISM)-Dhanbad and IACS-Kolkata for catalyst characterizations. Supplementary materials Supplementary material associated with this article can be found, in the online version, at doi:10.1016/j.mcat.2022.112836. Appendix Supplementary materials Image, application 1 References [1] A. Nieto-Márquez R. Romero A. Romero J.L. Valverde Carbon nanospheres: synthesis, physicochemical properties and applications J. Mater. Chem. 21 2011 1664 1672 10.1039/C0JM01350A A. Nieto-Márquez, R. Romero, A. Romero, J.L. Valverde, Carbon nanospheres: synthesis, physicochemical properties and applications, J. Mater. Chem.. 21 (2011) 1664–1672. 10.1039/C0JM01350A. [2] A. Ghosh G.N. Reddy P.K. Mohammed Siddhique S. Chatterjee S. Bhattacharjee R. Maitra S.E. Lyubimov A.V. Arzumanyan A. Naumkin A. Bhaumik B. Chowdhury Fabrication of a hollow sphere N,S co-doped bifunctional carbon catalyst for sustainable fixation of CO2 to cyclic carbonates Green Chem. 2022 10.1039/D1GC04153C A. Ghosh, G.N. Reddy, P.K. Mohammed Siddhique, S. Chatterjee, S. Bhattacharjee, R. Maitra, S.E. Lyubimov, A.V. Arzumanyan, A. Naumkin, A. Bhaumik, B. Chowdhury, Fabrication of a hollow sphere N,S co-doped bifunctional carbon catalyst for sustainable fixation of CO2 to cyclic carbonates, Green Chem. (2022). 10.1039/D1GC04153C. [3] P. Zhang Z.A. Qiao S. Dai Recent advances in carbon nanospheres: synthetic routes and applications Chem. Commun. 51 2015 9246 9256 10.1039/C5CC01759A P. Zhang, Z.A. Qiao, S. Dai, Recent advances in carbon nanospheres: synthetic routes and applications, Chem. Commun. 51 (2015) 9246–9256. 10.1039/C5CC01759A. [4] S. Wang W.C. Li L. Zhang Z.Y. Jin A.H. Lu Polybenzoxazine-based monodisperse carbon spheres with low-thermal shrinkage and their CO2 adsorption properties J. Mater. Chem. A 2 2014 4406 4412 10.1039/C3TA15065H S. Wang, W.C. Li, L. Zhang, Z.Y. Jin, A.H. Lu, Polybenzoxazine-based monodisperse carbon spheres with low-thermal shrinkage and their CO2 adsorption properties, J. Mater. Chem. A. 2 (2014) 4406–4412. 10.1039/C3TA15065H. [5] Chapter 6:Doped nanostructured carbon materials as catalysts Nanostructured Carbon Materials for Catalysis 2015 Royal Society Of Chemistry (RSC) 268 311 Chapter 6:Doped nanostructured carbon materials as catalysts, in: Nanostructured Carbon Materials for Catalysis, 2015: pp. 268–311. 10.1039/9781782622567-00268. [6] M. Liu Y. Liu Z. Gao C. Wang W. Ye R. Lu S. Zhang Nitrogen and sulfur co-doped carbon nanospheres for highly efficient oxidation of ethylbenzene New J. Chem. 42 2018 15962 15967 10.1039/C8NJ02948B M. Liu, Y. Liu, Z. Gao, C. Wang, W. Ye, R. Lu, S. Zhang, Nitrogen and sulfur co-doped carbon nanospheres for highly efficient oxidation of ethylbenzene, New J. Chem. 42 (2018) 15962–15967. 10.1039/C8NJ02948B. [7] J. Wu X. Zheng C. Jin J. Tian R. Yang Ternary doping of phosphorus, nitrogen, and sulfur into porous carbon for enhancing electrocatalytic oxygen reduction Carbon 92 2015 327 338 10.1016/j.carbon.2015.05.013 J. Wu, X. Zheng, C. Jin, J. Tian, R. Yang, Ternary doping of phosphorus, nitrogen, and sulfur into porous carbon for enhancing electrocatalytic oxygen reduction, Carbon. 92 (2015) 327–338. 10.1016/j.carbon.2015.05.013. [8] X. Hu X. Sun Q. Song Y. Zhu Y. Long Z. Dong N,S co-doped hierarchically porous carbon materials for efficient metal-free catalysis Green Chem. 22 2020 742 752 10.1039/C9GC03863A X. Hu, X. Sun, Q. Song, Y. Zhu, Y. Long, Z. Dong, N,S co-doped hierarchically porous carbon materials for efficient metal-free catalysis, Green Chem. 22 (2020) 742–752. 10.1039/C9GC03863A. [9] X. Tao Q. Zhang Y. Li X. Lv D. Ma H. Wang N, P, S tri-doped hollow carbon nanosphere as a high-efficient bifunctional oxygen electrocatalyst for rechargeable Zn-air batteries Appl. Surf. Sci. 490 2019 47 55 10.1016/j.apsusc.2019.06.076 X. Tao, Q. Zhang, Y. Li, X. Lv, D. Ma, H. Wang, N, P, S tri-doped hollow carbon nanosphere as a high-efficient bifunctional oxygen electrocatalyst for rechargeable Zn-air batteries, Appl. Surf. Sci. 490 (2019) 47–55. 10.1016/j.apsusc.2019.06.076. [10] W. Gao S. Liang R. Wang Q. Jiang Y. Zhang Q. Zheng B. Xie C.Y. Toe X. Zhu J. Wang L. Huang Y. Gao Z. Wang C. Jo Q. Wang L. Wang Y. Liu B. Louis J. Scott A.C. Roger R. Amal H. He S.E. Park Industrial carbon dioxide capture and utilization: state of the art and future challenges Chem. Soc. Rev. 49 2020 8584 8686 10.1039/D0CS00025F W. Gao, S. Liang, R. Wang, Q. Jiang, Y. Zhang, Q. Zheng, B. Xie, C.Y. Toe, X. Zhu, J. Wang, L. Huang, Y. Gao, Z. Wang, C. Jo, Q. Wang, L. Wang, Y. Liu, B. Louis, J. Scott, A.C. Roger, R. Amal, H. He, S.E. Park, Industrial carbon dioxide capture and utilization: state of the art and future challenges, Chem. Soc. Rev. 49 (2020) 8584–8686. 10.1039/D0CS00025F. [11] J. Artz T.E. Müller K. Thenert J. Kleinekorte R. Meys A. Sternberg A. Bardow W. Leitner Sustainable conversion of carbon dioxide: an integrated review of catalysis and life cycle assessment Chem. Rev. 118 2018 434 504 10.1021/acs.chemrev.7b00435 J. Artz, T.E. Müller, K. Thenert, J. Kleinekorte, R. Meys, A. Sternberg, A. Bardow, W. Leitner, Sustainable conversion of carbon dioxide: an integrated review of catalysis and life cycle assessment, Chem. Rev. 118 (2018) 434–504. 10.1021/acs.chemrev.7b00435. [12] A. Modak A. Ghosh A.R. Mankar A. Pandey M. Selvaraj K.K. Pant B. Chowdhury A. Bhaumik Cross-linked porous polymers as heterogeneous organocatalysts for task-specific applications in biomass transformations, CO2 fixation, and asymmetric reactions ACS Sustain. Chem. Eng. 9 2021 12431 12460 10.1021/acssuschemeng.1c01537 A. Modak, A. Ghosh, A.R. Mankar, A. Pandey, M. Selvaraj, K.K. Pant, B. Chowdhury, A. Bhaumik, Cross-linked porous polymers as heterogeneous organocatalysts for task-specific applications in biomass transformations, CO2 fixation, and asymmetric reactions, ACS Sustain. Chem. Eng. 9 (2021) 12431–12460. 10.1021/acssuschemeng.1c01537. [13] CO2 hydrogenation over functional nanoporous polymers and metal-organic frameworks - ScienceDirect, (n.d.). https://www.sciencedirect.com/science/article/pii/S0001868620306187?via%3Dihub (accessed February 14, 2022). [14] P. Bhanja A. Modak A. Bhaumik Supported porous nanomaterials as efficient heterogeneous catalysts for CO2 fixation reactions Chem. Eur. J. 24 2018 7278 7297 10.1002/chem.201800075 Supported porous nanomaterials as efficient heterogeneous catalysts for CO2 fixation reactions, Chem. Eur. J.- Bhanja - 2018 - Wiley Online Library, (n.d.). https://chemistry-europe.onlinelibrary.wiley.com/doi/full/10.1002/chem.201800075 (accessed February 14, 2022). [15] P. Tomkins T.E. Müller Evaluating the carbon inventory, carbon fluxes and carbon cycles for a long-term sustainable world Green Chem. 21 2019 3994 4013 10.1039/C9GC00528E P. Tomkins, T.E. Müller, Evaluating the carbon inventory, carbon fluxes and carbon cycles for a long-term sustainable world, Green Chem. 21 (2019) 3994–4013. 10.1039/C9GC00528E. [16] I. Kainthla J.T. Bhanushali R.S. Keri B.M. Nagaraja Activity studies of vanadium, iron, carbon and mixed oxides based catalysts for the oxidative dehydrogenation of ethylbenzene to styrene: a review Catal. Sci. Technol. 5 2015 5062 5076 10.1039/C5CY00996K I. Kainthla, J.T. Bhanushali, R.S. Keri, B.M. Nagaraja, Activity studies of vanadium, iron, carbon and mixed oxides based catalysts for the oxidative dehydrogenation of ethylbenzene to styrene: a review, Catal. Sci. Technol. 5 (2015) 5062–5076. 10.1039/C5CY00996K. [17] Dehydrogenation of ethylbenzene to styrene over Fe2O3/Al2O3 catalysts in the presence of carbon dioxide - ScienceDirect, (n.d.). https://www.sciencedirect.com/science/article/pii/S0920586199002369 (accessed February 14, 2022). [18] N. Ikenaga T. Tsuruda K. Senma T. Yamaguchi Y. Sakurai T. Suzuki Dehydrogenation of ethylbenzene with carbon dioxide using activated carbon-supported catalysts Ind. Eng. Chem. Res. 39 2000 1228 1234 10.1021/ie990426q N. Ikenaga, T. Tsuruda, K. Senma, T. Yamaguchi, Y. Sakurai, T. Suzuki, Dehydrogenation of ethylbenzene with carbon dioxide using activated carbon-supported catalysts, Ind. Eng. Chem. Res. 39 (2000) 1228–1234. 10.1021/ie990426q. [19] M.B. Ansari S.E. Park Carbon dioxide utilization as a soft oxidant and promoter in catalysis Energy Environ. Sci. 5 2012 9419 9437 10.1039/C2EE22409G M.B. Ansari, S.E. Park, Carbon dioxide utilization as a soft oxidant and promoter in catalysis, Energy Environ. Sci. 5 (2012) 9419–9437. 10.1039/C2EE22409G. [20] B.S. Liu R.Z. Chang L. Jiang W. Liu C.T. Au Preparation and high performance of La2O3−V2O5/MCM-41 catalysts for ethylbenzene dehydrogenation in the presence of CO2 J. Phys. Chem. C 112 2008 15490 15501 10.1021/jp802526z Preparation and high performance of La2O3−V2O5/MCM-41 catalysts for ethylbenzene dehydrogenation in the presence of CO2, J. Phys. Chem. C, (n.d.). https://pubs.acs.org/doi/abs/10.1021/jp802526z (accessed February 14, 2022). [21] S. Sato M. Ohhara T. Sodesawa F. Nozaki Combination of ethylbenzene dehydrogenation and carbon dioxide shift-reaction over a sodium oxide/alumina catalyst Appl. Catal. 37 1988 207 215 10.1016/S0166-9834(00)80761-7 S. Sato, M. Ohhara, T. Sodesawa, F. Nozaki, Combination of ethylbenzene dehydrogenation and carbon dioxide shift-reaction over a sodium oxide/alumina catalyst, Appl. Catal. 37 (1988) 207–215. 10.1016/S0166-9834(00)80761-7. [22] Defect-mediated hydroxylation of multi-walled carbon nanotubes as metal-free catalysts to enhance catalytic performance for oxidative dehydrogenation of ethylbenzene using CO2 - ScienceDirect, (n.d.). https://www.sciencedirect.com/science/article/pii/S2212982018310047 (accessed February 14, 2022). [23] S.J. Kim G.F. Han S.M. Jung J.P. Jeon S.H. Shin S.W. Kim I.Y. Jeon J.B. Baek Oxidative dehydrogenation of ethylbenzene into styrene by Fe-graphitic catalysts ACS Nano 13 2019 5893 5899 10.1021/acsnano.9b01664 S.J. Kim, G.F. Han, S.M. Jung, J.P. Jeon, S.H. Shin, S.W. Kim, I.Y. Jeon, J.B. Baek, Oxidative dehydrogenation of ethylbenzene into styrene by Fe-graphitic catalysts, ACS Nano. 13 (2019) 5893–5899. 10.1021/acsnano.9b01664. [24] M. Yuan Y. Long J. Yang X. Hu D. Xu Y. Zhu Z. Dong Biomass sucrose-derived Cobalt@Nitrogen-doped carbon for catalytic transfer hydrogenation of nitroarenes with formic acid ChemSusChem 11 2018 4156 4165 10.1002/cssc.201802163 M. Yuan, Y. Long, J. Yang, X. Hu, D. Xu, Y. Zhu, Z. Dong, Biomass sucrose-derived Cobalt@Nitrogen-doped carbon for catalytic transfer hydrogenation of nitroarenes with formic acid, ChemSusChem. 11 (2018) 4156–4165. 10.1002/cssc.201802163. [25] H. Wang W. Wang Y.Y. Xu S. Dong J. Xiao F. Wang H. Liu B.Y. Xia Hollow nitrogen-doped carbon spheres with Fe3O4 nanoparticles encapsulated as a highly active oxygen-reduction catalyst ACS Appl. Mater. Interfaces 9 2017 10610 10617 10.1021/acsami.6b15392 H. Wang, W. Wang, Y.Y. Xu, S. Dong, J. Xiao, F. Wang, H. Liu, B.Y. Xia, Hollow nitrogen-doped carbon spheres with Fe3O4 nanoparticles encapsulated as a highly active oxygen-reduction catalyst, ACS Appl. Mater. Interfaces. 9 (2017) 10610–10617. 10.1021/acsami.6b15392. [26] Z. Ma T. Song Y. Yuan Y. Yang Synergistic catalysis on Fe–Nx sites and Fe nanoparticles for efficient synthesis of quinolines and quinazolinones via oxidative coupling of amines and aldehydes Chem. Sci. 10 2019 10283 10289 10.1039/C9SC04060A Z. Ma, T. Song, Y. Yuan, Y. Yang, Synergistic catalysis on Fe–Nx sites and Fe nanoparticles for efficient synthesis of quinolines and quinazolinones via oxidative coupling of amines and aldehydes, Chem. Sci. 10 (2019) 10283–10289. 10.1039/C9SC04060A. [27] L. Luo Y. Xu D. Wang W. Feng X. Qiu Tuning active species in N-doped carbon with Fe/Fe3C nanoparticles for efficient oxygen reduction reaction Inorg. Chem. 61 2022 3166 3175 10.1021/acs.inorgchem.1c03573 Tuning active species in N-doped carbon with Fe/Fe3C nanoparticles for efficient oxygen reduction reaction, Inorg. Chem., (n.d.). https://pubs.acs.org/doi/10.1021/acs.inorgchem.1c03573 (accessed February 20, 2022). [28] S-J. Kim G-F. Han S-M. Jung J-P. Jeon S-J. Shin S-W. Kim I-Y. Jeon J-B. Beak Oxidative dehydrogenation of ethylbenzene into styrene by Fe-graphitic catalysts ACS Nano 13 2019 9893 9899 10.1021/acsnano.9b01664 Oxidative dehydrogenation of ethylbenzene into styrene by Fe-graphitic catalysts, ACS Nano, (n.d.). https://pubs.acs.org/doi/abs/10.1021/acsnano.9b01664 (accessed February 14, 2022). [29] Hydrothermal synthesis, characterization, and KOH activation of carbon spheres from glucose - ScienceDirect, (n.d.). https://www.sciencedirect.com/science/article/pii/S0008621511001327 (accessed February 20, 2022). [30] Development of Ti bipolar plates with carbon/PTFE/TiN composites coating for PEMFCs - ScienceDirect, (n.d.). https://www.sciencedirect.com/science/article/pii/S0360319918328921 (accessed February 20, 2022). [31] E. Sulistya L. Hui-Hui N.K. Attenborough S. Pourshahrestani N.A. Kadri E. Zeimaran N.A. bin A. Razak B. Amini Horri B. Salamatinia Hydrothermal synthesis of carbon microspheres from sucrose with citric acid as a catalyst: physicochemical and structural properties J. Taibah Univ. Sci. 14 2020 1042 1050 10.1080/16583655.2020.1794566 E. Sulistya, L. Hui-Hui, N.K. Attenborough, S. Pourshahrestani, N.A. Kadri, E. Zeimaran, N.A. bin A. Razak, B. Amini Horri, B. Salamatinia, Hydrothermal synthesis of carbon microspheres from sucrose with citric acid as a catalyst: physicochemical and structural properties, J. Taibah Univ. Sci. 14 (2020) 1042–1050. 10.1080/16583655.2020.1794566. [32] A. Ghosh A. Singha A. Auroux A. Das D. Sen B. Chowdhury A green approach for the preparation of a surfactant embedded sulfonated carbon catalyst towards glycerol acetalization reactions Catal. Sci. Technol. 10 2020 4827 4844 10.1039/D0CY00336K A. Ghosh, A. Singha, A. Auroux, A. Das, D. Sen, B. Chowdhury, A green approach for the preparation of a surfactant embedded sulfonated carbon catalyst towards glycerol acetalization reactions, Catal. Sci. Technol. 10 (2020) 4827–4844. 10.1039/D0CY00336K. [33] J. Feng Iron, nitrogen Co-doped carbon spheres as low cost, scalable electrocatalysts for the oxygen reduction reaction Adv. Funct. Mater. 31 2021 2102974 10.1002/adfm.202102974 Iron, nitrogen Co-doped carbon spheres as low cost, scalable electrocatalysts for the oxygen reduction reaction, Adv. Funct. Mater. - Feng - 2021 - Wiley Online Library, (n.d.). https://onlinelibrary.wiley.com/doi/full/10.1002/adfm.202102974 (accessed February 20, 2022). [34] C. Kim K. Kim J.H. Moon Highly N-doped microporous carbon nanospheres with high energy storage and conversion efficiency Sci. Rep. 7 2017 14400 10.1038/s41598-017-14686-1 Highly N-doped microporous carbon nanospheres with high energy storage and conversion efficiency, Sci. Rep., (n.d.). https://www.nature.com/articles/s41598-017-14686-1 (accessed February 20, 2022). [35] M.K. Antoniou E.K. Diamanti A. Enotiadis A. Policicchio K. Dimos F. Ciuchi E. Maccallini D. Gournis R.G. Agostino Methane storage in zeolite-like carbon materials Microporous Mesoporous Mater. 188 2014 16 22 10.1016/j.micromeso.2013.12.030 M.K. Antoniou, E.K. Diamanti, A. Enotiadis, A. Policicchio, K. Dimos, F. Ciuchi, E. Maccallini, D. Gournis, R.G. Agostino, Methane storage in zeolite-like carbon materials, Microporous Mesoporous Mater. 188 (2014) 16–22. 10.1016/j.micromeso.2013.12.030. [36] K.A. Cychosz R. Guillet-Nicolas J. García-Martínez M. Thommes Recent advances in the textural characterization of hierarchically structured nanoporous materials Chem. Soc. Rev. 46 2017 389 414 10.1039/C6CS00391E K.A. Cychosz, R. Guillet-Nicolas, J. García-Martínez, M. Thommes, Recent advances in the textural characterization of hierarchically structured nanoporous materials, Chem. Soc. Rev. 46 (2017) 389–414. 10.1039/C6CS00391E. [37] F. Liu Y. Cheng J. Tan J. Li H. Cheng H. Hu C. Du S. Zhao Y. Yan M. Liu Carbon nanomaterials with hollow structures: a mini-review Front. Chem. 9 2021 https://www.frontiersin.org/article/10.3389/fchem.2021.668336 (accessed May 14, 2022) F. Liu, Y. Cheng, J. Tan, J. Li, H. Cheng, H. Hu, C. Du, S. Zhao, Y. Yan, M. Liu, Carbon nanomaterials with hollow structures: a mini-review, Front. Chem. 9 (2021). https://www.frontiersin.org/article/10.3389/fchem.2021.668336 (accessed May 14, 2022). [38] X. Hua Yang J. Wei Guo S. Yang Y. Hou B. Zhang H.G. Yang A free radical assisted strategy for preparing ultra-small Pt decorated CNTs as a highly efficient counter electrode for dye-sensitized solar cells J. Mater. Chem. A 2 2014 614 619 10.1039/C3TA13986G X. Hua Yang, J. Wei Guo, S. Yang, Y. Hou, B. Zhang, H.G. Yang, A free radical assisted strategy for preparing ultra-small Pt decorated CNTs as a highly efficient counter electrode for dye-sensitized solar cells, J. Mater. Chem. A. 2 (2014) 614–619. 10.1039/C3TA13986G. [39] Y. Cao S. Mao M. Li Y. Chen Y. Wang Metal/porous carbon composites for heterogeneous catalysis: old catalysts with improved performance promoted by N-doping ACS Catal. 7 2017 8090 8112 10.1021/acscatal.7b02335 Y. Cao, S. Mao, M. Li, Y. Chen, Y. Wang, Metal/porous carbon composites for heterogeneous catalysis: old catalysts with improved performance promoted by N-doping, ACS Catal. 7 (2017) 8090–8112. 10.1021/acscatal.7b02335. [40] Y. Rangraz M.M. Heravi Recent advances in metal-free heteroatom-doped carbon heterogonous catalysts RSC Adv. 11 2021 23725 23778 10.1039/D1RA03446D Y. Rangraz, M.M. Heravi, Recent advances in metal-free heteroatom-doped carbon heterogonous catalysts, RSC Adv. 11 (2021) 23725–23778. 10.1039/D1RA03446D. [41] Chapter 4:Surface chemistry of nanostructured carbon materials and preparation of nanocarbon supported catalysts Nanostructured Carbon Materials for Catalysis 2015 Royal Society Of Chemistry (RSC) 163 222 Chapter 4:Surface chemistry of nanostructured carbon materials and preparation of nanocarbon supported catalysts, in: Nanostructured Carbon Materials for Catalysis, 2015: pp. 163–222. 10.1039/9781782622567-00163. [42] Y. Li S. Li Y. Wang J. Wang H. Liu X. Liu L. Wang X. Liu W. Xue N. Ma Electrochemical synthesis of phosphorus-doped graphene quantum dots for free radical scavenging Phys. Chem. Chem. Phys. 19 2017 11631 11638 10.1039/C6CP06377B Y. Li, S. Li, Y. Wang, J. Wang, H. Liu, X. Liu, L. Wang, X. Liu, W. Xue, N. Ma, Electrochemical synthesis of phosphorus-doped graphene quantum dots for free radical scavenging, Phys. Chem. Chem. Phys. 19 (2017) 11631–11638. 10.1039/C6CP06377B. [43] D. Wilson M.A. Langell XPS analysis of oleylamine/oleic acid capped Fe3O4 nanoparticles as a function of temperature Appl. Surf. Sci. 303 2014 6 13 10.1016/j.apsusc.2014.02.006 D. Wilson, M.A. Langell, XPS analysis of oleylamine/oleic acid capped Fe3O4 nanoparticles as a function of temperature, Appl. Surf. Sci. 303 (2014) 6–13. 10.1016/j.apsusc.2014.02.006. [44] S. Dutta K. Manna S.K. Srivastava A.K. Gupta M.K. Yadav Hollow polyaniline microsphere/Fe3O4 nanocomposite as an effective adsorbent for removal of arsenic from water Sci. Rep. 10 2020 4982 10.1038/s41598-020-61763-z S. Dutta, K. Manna, S.K. Srivastava, A.K. Gupta, M.K. Yadav, Hollow polyaniline microsphere/Fe3O4 nanocomposite as an effective adsorbent for removal of arsenic from water, Sci. Rep. 10 (2020) 4982. 10.1038/s41598-020-61763-z. [45] Self-assembled 3D flower-like Fe3O4/C architecture with superior lithium ion storage performance J. Mater. Chem. A 2022 (RSC Publishing), (n.d.) https://pubs.rsc.org/en/content/articlelanding/2018/ta/c8ta06482b (accessed April 5) Self-assembled 3D flower-like Fe3O4/C architecture with superior lithium ion storage performance - J. Mater. Chem. A (RSC Publishing), (n.d.). https://pubs.rsc.org/en/content/articlelanding/2018/ta/c8ta06482b (accessed April 5, 2022). [46] Iron/carbon composite microfiber catalyst derived from hemoglobin blood protein for lithium-oxygen batteries - ScienceDirect, (n.d.). https://www.sciencedirect.com/science/article/pii/S0169433218327168 (accessed April 5, 2022). [47] J.L. Figueiredo Functionalization of porous carbons for catalytic applications J. Mater. Chem. A 1 2013 9351 9364 10.1039/C3TA10876G J.L. Figueiredo, Functionalization of porous carbons for catalytic applications, J. Mater. Chem. A. 1 (2013) 9351–9364. 10.1039/C3TA10876G. [48] L. Qin L. Wang C. Wang X. Yang B. Lv Enhanced role of graphitic-N on nitrogen-doped porous carbon ball for direct dehydrogenation of ethylbenzene Mol. Catal. 462 2019 61 68 10.1016/j.mcat.2018.10.021 L. Qin, L. Wang, C. Wang, X. Yang, B. Lv, Enhanced role of graphitic-N on nitrogen-doped porous carbon ball for direct dehydrogenation of ethylbenzene, Mol. Catal. 462 (2019) 61–68. 10.1016/j.mcat.2018.10.021. [49] I. Kainthla G.V.R. Babu J.T. Bhanushali R.S. Keri K.S.R. Rao B.M. Nagaraja Vapor-phase dehydrogenation of ethylbenzene to styrene over a V2O5/TiO2–Al2O3 catalyst with CO2 New J. Chem. 41 2017 4173 4181 10.1039/C7NJ01022B I. Kainthla, G.V.R. Babu, J.T. Bhanushali, R.S. Keri, K.S.R. Rao, B.M. Nagaraja, Vapor-phase dehydrogenation of ethylbenzene to styrene over a V2O5/TiO2–Al2O3 catalyst with CO2, New J. Chem. 41 (2017) 4173–4181. 10.1039/C7NJ01022B. [50] Influence of surface modification on selective CO2 adsorption: a technical review on mechanisms and methods - ScienceDirect, (n.d.). https://www.sciencedirect.com/science/article/pii/S1387181120307514 (accessed April 14, 2022). [51] M. Sevilla P. Valle-Vigón A.B. Fuertes N-doped polypyrrole-based porous carbons for CO2 capture Adv. Funct. Mater. 21 2011 2781 2787 10.1002/adfm.201100291 M. Sevilla, P. Valle-Vigón, A.B. Fuertes, N-doped polypyrrole-based porous carbons for CO2 capture, Adv. Funct. Mater. 21 (2011) 2781–2787. 10.1002/adfm.201100291. [52] Y. Liu P.R. Murthy X. Zhang H. Wang C. Shi Phase transformation of iron oxide to carbide and Fe3C as an active center for the RWGS reaction New J. Chem. 45 2021 22444 22449 10.1039/D1NJ04120G Y. Liu, P.R. Murthy, X. Zhang, H. Wang, C. Shi, Phase transformation of iron oxide to carbide and Fe3C as an active center for the RWGS reaction, New J. Chem. 45 (2021) 22444–22449. 10.1039/D1NJ04120G. [53] Conversion of CO2 to added value products via rWGS using Fe-promoted catalysts: carbide, metallic Fe or a mixture? J. Energy Chem. 66 2022 635 646 10.1016/j.jechem.2021.09.015 Conversion of CO2 to added value products via rWGS using Fe-promoted catalysts: carbide, metallic Fe or a mixture?, J. Energy Chem. 66 (2022) 635–646. 10.1016/j.jechem.2021.09.015. [54] C.Y. Chou J.A. Loiland R.F. Lobo Reverse water-gas shift iron catalyst derived from magnetite Catalysts 9 2019 773 10.3390/catal9090773 C.Y. Chou, J.A. Loiland, R.F. Lobo, Reverse water-gas shift iron catalyst derived from magnetite, Catalysts. 9 (2019) 773. 10.3390/catal9090773. [55] T.T. Hu F. Liu S. Dou L.B. Zhong X. Cheng Z.D. Shao Y.M. Zheng Selective adsorption of trace gaseous ammonia from air by a sulfonic acid-modified silica xerogel: preparation, characterization and performance Chem. Eng. J. 2022 136357 10.1016/j.cej.2022.136357 T.T. Hu, F. Liu, S. Dou, L.B. Zhong, X. Cheng, Z.D. Shao, Y.M. Zheng, Selective adsorption of trace gaseous ammonia from air by a sulfonic acid-modified silica xerogel: preparation, characterization and performance, Chem. Eng. J. (2022) 136357. 10.1016/j.cej.2022.136357. [56] C.P. Kumar S. Gaab T.E. Müller J.A. Lercher Oxidative dehydrogenation of light alkanes on supported molten alkali metal chloride catalysts Top. Catal. 50 2008 156 167 10.1007/s11244-008-9102-3 C.P. Kumar, S. Gaab, T.E. Müller, J.A. Lercher, Oxidative dehydrogenation of light alkanes on supported molten alkali metal chloride catalysts, Top. Catal. 50 (2008) 156–167. 10.1007/s11244-008-9102-3.",
      "scopus-id": "85143508865",
      "coredata": {
        "eid": "1-s2.0-S2468823122007222",
        "dc:description": "Distinctly shaping carbon materials together with doping is an excellent approach for tailoring advanced materials. In this study, a series of heteroatom (N, S, P)-doped Fe-carbon sphere catalysts were prepared by a hydrothermal process to explore the effect of unary and binary dopants on the CO2-mediated ethyl benzene oxidative dehydrogenation. Upon doing so, a transformation from quasi to hollow to perfect spheres was observed that takes place due to the increasing hydrolysis rate and attainment of supersaturation. It was shown that each type of heteroatom has a beneficial role in creating specific chemical entities as well as in defining the iron amount of the catalyst. Catalytic activity correlated with XPS and Raman analysis reveal that the direct dehydrogenation of ethylbenzene is controlled by the iron content at low temperatures, while defect sites are the controlling parameter at high temperatures. Under oxidative conditions, the N-doped hierarchical Fe-hollow sphere carbon (Fe-N-C) catalyst shows the highest catalytic performance among all synthesized catalysts due to the cooperative action of pyridinic N species and the Fe3C phase for CO2 activation as well as RWGS reaction promotion.",
        "openArchiveArticle": "false",
        "prism:coverDate": "2023-01-15",
        "openaccessUserLicense": null,
        "prism:aggregationType": "Journal",
        "prism:url": "https://api.elsevier.com/content/article/pii/S2468823122007222",
        "dc:creator": [
          {
            "@_fa": "true",
            "$": "Ghosh, Anindya"
          },
          {
            "@_fa": "true",
            "$": "Singha, Aniruddha"
          },
          {
            "@_fa": "true",
            "$": "Chatterjee, Rupak"
          },
          {
            "@_fa": "true",
            "$": "Müller, Thomas E."
          },
          {
            "@_fa": "true",
            "$": "Bhaumik, Asim"
          },
          {
            "@_fa": "true",
            "$": "Chowdhury, Biswajit"
          }
        ],
        "link": [
          {
            "@_fa": "true",
            "@rel": "self",
            "@href": "https://api.elsevier.com/content/article/pii/S2468823122007222"
          },
          {
            "@_fa": "true",
            "@rel": "scidir",
            "@href": "https://www.sciencedirect.com/science/article/pii/S2468823122007222"
          }
        ],
        "dc:format": "application/json",
        "openaccessType": null,
        "pii": "S2468-8231(22)00722-2",
        "prism:volume": "535",
        "articleNumber": "112836",
        "prism:publisher": "Elsevier B.V.",
        "dc:title": "Influence of heteroatom-doped Fe-carbon sphere catalysts on CO2- mediated oxidative dehydrogenation of ethylbenzene",
        "prism:copyright": "© 2022 Elsevier B.V. All rights reserved.",
        "openaccess": "0",
        "prism:issn": "24688231",
        "dcterms:subject": [
          {
            "@_fa": "true",
            "$": "CO2"
          },
          {
            "@_fa": "true",
            "$": "Soft oxidant"
          },
          {
            "@_fa": "true",
            "$": "Oxidative dehydrogenation"
          },
          {
            "@_fa": "true",
            "$": "Carbon sphere"
          },
          {
            "@_fa": "true",
            "$": "Heteroatom-doped"
          }
        ],
        "openaccessArticle": "false",
        "prism:publicationName": "Molecular Catalysis",
        "openaccessSponsorType": null,
        "prism:pageRange": "112836",
        "pubType": "fla",
        "prism:coverDisplayDate": "15 January 2023",
        "prism:doi": "10.1016/j.mcat.2022.112836",
        "prism:startingPage": "112836",
        "dc:identifier": "doi:10.1016/j.mcat.2022.112836",
        "openaccessSponsorName": null
      },
      "objects": {
        "object": [
          {
            "@category": "standard",
            "@height": "199",
            "@width": "214",
            "@_fa": "true",
            "$": "https://api.elsevier.com/content/object/eid/1-s2.0-S2468823122007222-ga1.jpg?httpAccept=%2A%2F%2A",
            "@multimediatype": "JPEG image file",
            "@type": "IMAGE-DOWNSAMPLED",
            "@size": "16402",
            "@ref": "ga1",
            "@mimetype": "image/jpeg"
          },
          {
            "@category": "standard",
            "@height": "293",
            "@width": "636",
            "@_fa": "true",
            "$": "https://api.elsevier.com/content/object/eid/1-s2.0-S2468823122007222-gr14.jpg?httpAccept=%2A%2F%2A",
            "@multimediatype": "JPEG image file",
            "@type": "IMAGE-DOWNSAMPLED",
            "@size": "47511",
            "@ref": "gr14",
            "@mimetype": "image/jpeg"
          },
          {
            "@category": "standard",
            "@height": "538",
            "@width": "665",
            "@_fa": "true",
            "$": "https://api.elsevier.com/content/object/eid/1-s2.0-S2468823122007222-gr15.jpg?httpAccept=%2A%2F%2A",
            "@multimediatype": "JPEG image file",
            "@type": "IMAGE-DOWNSAMPLED",
            "@size": "85033",
            "@ref": "gr15",
            "@mimetype": "image/jpeg"
          },
          {
            "@category": "standard",
            "@height": "622",
            "@width": "649",
            "@_fa": "true",
            "$": "https://api.elsevier.com/content/object/eid/1-s2.0-S2468823122007222-gr12.jpg?httpAccept=%2A%2F%2A",
            "@multimediatype": "JPEG image file",
            "@type": "IMAGE-DOWNSAMPLED",
            "@size": "131428",
            "@ref": "gr12",
            "@mimetype": "image/jpeg"
          },
          {
            "@category": "standard",
            "@height": "302",
            "@width": "373",
            "@_fa": "true",
            "$": "https://api.elsevier.com/content/object/eid/1-s2.0-S2468823122007222-gr13.jpg?httpAccept=%2A%2F%2A",
            "@multimediatype": "JPEG image file",
            "@type": "IMAGE-DOWNSAMPLED",
            "@size": "34670",
            "@ref": "gr13",
            "@mimetype": "image/jpeg"
          },
          {
            "@category": "standard",
            "@height": "275",
            "@width": "664",
            "@_fa": "true",
            "$": "https://api.elsevier.com/content/object/eid/1-s2.0-S2468823122007222-gr10.jpg?httpAccept=%2A%2F%2A",
            "@multimediatype": "JPEG image file",
            "@type": "IMAGE-DOWNSAMPLED",
            "@size": "63034",
            "@ref": "gr10",
            "@mimetype": "image/jpeg"
          },
          {
            "@category": "standard",
            "@height": "280",
            "@width": "640",
            "@_fa": "true",
            "$": "https://api.elsevier.com/content/object/eid/1-s2.0-S2468823122007222-gr11.jpg?httpAccept=%2A%2F%2A",
            "@multimediatype": "JPEG image file",
            "@type": "IMAGE-DOWNSAMPLED",
            "@size": "53222",
            "@ref": "gr11",
            "@mimetype": "image/jpeg"
          },
          {
            "@category": "standard",
            "@height": "302",
            "@width": "346",
            "@_fa": "true",
            "$": "https://api.elsevier.com/content/object/eid/1-s2.0-S2468823122007222-gr2.jpg?httpAccept=%2A%2F%2A",
            "@multimediatype": "JPEG image file",
            "@type": "IMAGE-DOWNSAMPLED",
            "@size": "46405",
            "@ref": "gr2",
            "@mimetype": "image/jpeg"
          },
          {
            "@category": "standard",
            "@height": "317",
            "@width": "679",
            "@_fa": "true",
            "$": "https://api.elsevier.com/content/object/eid/1-s2.0-S2468823122007222-gr1.jpg?httpAccept=%2A%2F%2A",
            "@multimediatype": "JPEG image file",
            "@type": "IMAGE-DOWNSAMPLED",
            "@size": "48204",
            "@ref": "gr1",
            "@mimetype": "image/jpeg"
          },
          {
            "@category": "standard",
            "@height": "242",
            "@width": "613",
            "@_fa": "true",
            "$": "https://api.elsevier.com/content/object/eid/1-s2.0-S2468823122007222-gr18.jpg?httpAccept=%2A%2F%2A",
            "@multimediatype": "JPEG image file",
            "@type": "IMAGE-DOWNSAMPLED",
            "@size": "42014",
            "@ref": "gr18",
            "@mimetype": "image/jpeg"
          },
          {
            "@category": "standard",
            "@height": "730",
            "@width": "708",
            "@_fa": "true",
            "$": "https://api.elsevier.com/content/object/eid/1-s2.0-S2468823122007222-sc2.jpg?httpAccept=%2A%2F%2A",
            "@multimediatype": "JPEG image file",
            "@type": "IMAGE-DOWNSAMPLED",
            "@size": "161890",
            "@ref": "sc2",
            "@mimetype": "image/jpeg"
          },
          {
            "@category": "standard",
            "@height": "409",
            "@width": "628",
            "@_fa": "true",
            "$": "https://api.elsevier.com/content/object/eid/1-s2.0-S2468823122007222-gr19.jpg?httpAccept=%2A%2F%2A",
            "@multimediatype": "JPEG image file",
            "@type": "IMAGE-DOWNSAMPLED",
            "@size": "66425",
            "@ref": "gr19",
            "@mimetype": "image/jpeg"
          },
          {
            "@category": "standard",
            "@height": "541",
            "@width": "626",
            "@_fa": "true",
            "$": "https://api.elsevier.com/content/object/eid/1-s2.0-S2468823122007222-gr16.jpg?httpAccept=%2A%2F%2A",
            "@multimediatype": "JPEG image file",
            "@type": "IMAGE-DOWNSAMPLED",
            "@size": "85237",
            "@ref": "gr16",
            "@mimetype": "image/jpeg"
          },
          {
            "@category": "standard",
            "@height": "267",
            "@width": "389",
            "@_fa": "true",
            "$": "https://api.elsevier.com/content/object/eid/1-s2.0-S2468823122007222-gr17.jpg?httpAccept=%2A%2F%2A",
            "@multimediatype": "JPEG image file",
            "@type": "IMAGE-DOWNSAMPLED",
            "@size": "36018",
            "@ref": "gr17",
            "@mimetype": "image/jpeg"
          },
          {
            "@category": "standard",
            "@height": "340",
            "@width": "713",
            "@_fa": "true",
            "$": "https://api.elsevier.com/content/object/eid/1-s2.0-S2468823122007222-sc1.jpg?httpAccept=%2A%2F%2A",
            "@multimediatype": "JPEG image file",
            "@type": "IMAGE-DOWNSAMPLED",
            "@size": "50481",
            "@ref": "sc1",
            "@mimetype": "image/jpeg"
          },
          {
            "@category": "standard",
            "@height": "537",
            "@width": "648",
            "@_fa": "true",
            "$": "https://api.elsevier.com/content/object/eid/1-s2.0-S2468823122007222-gr8.jpg?httpAccept=%2A%2F%2A",
            "@multimediatype": "JPEG image file",
            "@type": "IMAGE-DOWNSAMPLED",
            "@size": "92279",
            "@ref": "gr8",
            "@mimetype": "image/jpeg"
          },
          {
            "@category": "standard",
            "@height": "558",
            "@width": "631",
            "@_fa": "true",
            "$": "https://api.elsevier.com/content/object/eid/1-s2.0-S2468823122007222-gr7.jpg?httpAccept=%2A%2F%2A",
            "@multimediatype": "JPEG image file",
            "@type": "IMAGE-DOWNSAMPLED",
            "@size": "100348",
            "@ref": "gr7",
            "@mimetype": "image/jpeg"
          },
          {
            "@category": "standard",
            "@height": "536",
            "@width": "645",
            "@_fa": "true",
            "$": "https://api.elsevier.com/content/object/eid/1-s2.0-S2468823122007222-gr9.jpg?httpAccept=%2A%2F%2A",
            "@multimediatype": "JPEG image file",
            "@type": "IMAGE-DOWNSAMPLED",
            "@size": "87898",
            "@ref": "gr9",
            "@mimetype": "image/jpeg"
          },
          {
            "@category": "standard",
            "@height": "537",
            "@width": "696",
            "@_fa": "true",
            "$": "https://api.elsevier.com/content/object/eid/1-s2.0-S2468823122007222-gr4.jpg?httpAccept=%2A%2F%2A",
            "@multimediatype": "JPEG image file",
            "@type": "IMAGE-DOWNSAMPLED",
            "@size": "164621",
            "@ref": "gr4",
            "@mimetype": "image/jpeg"
          },
          {
            "@category": "standard",
            "@height": "581",
            "@width": "703",
            "@_fa": "true",
            "$": "https://api.elsevier.com/content/object/eid/1-s2.0-S2468823122007222-gr3.jpg?httpAccept=%2A%2F%2A",
            "@multimediatype": "JPEG image file",
            "@type": "IMAGE-DOWNSAMPLED",
            "@size": "170357",
            "@ref": "gr3",
            "@mimetype": "image/jpeg"
          },
          {
            "@category": "standard",
            "@height": "542",
            "@width": "699",
            "@_fa": "true",
            "$": "https://api.elsevier.com/content/object/eid/1-s2.0-S2468823122007222-gr6.jpg?httpAccept=%2A%2F%2A",
            "@multimediatype": "JPEG image file",
            "@type": "IMAGE-DOWNSAMPLED",
            "@size": "123401",
            "@ref": "gr6",
            "@mimetype": "image/jpeg"
          },
          {
            "@category": "standard",
            "@height": "540",
            "@width": "699",
            "@_fa": "true",
            "$": "https://api.elsevier.com/content/object/eid/1-s2.0-S2468823122007222-gr5.jpg?httpAccept=%2A%2F%2A",
            "@multimediatype": "JPEG image file",
            "@type": "IMAGE-DOWNSAMPLED",
            "@size": "125238",
            "@ref": "gr5",
            "@mimetype": "image/jpeg"
          },
          {
            "@category": "thumbnail",
            "@height": "164",
            "@width": "176",
            "@_fa": "true",
            "$": "https://api.elsevier.com/content/object/eid/1-s2.0-S2468823122007222-ga1.sml?httpAccept=%2A%2F%2A",
            "@multimediatype": "GIF image file",
            "@type": "IMAGE-THUMBNAIL",
            "@size": "8653",
            "@ref": "ga1",
            "@mimetype": "image/gif"
          },
          {
            "@category": "thumbnail",
            "@height": "101",
            "@width": "219",
            "@_fa": "true",
            "$": "https://api.elsevier.com/content/object/eid/1-s2.0-S2468823122007222-gr14.sml?httpAccept=%2A%2F%2A",
            "@multimediatype": "GIF image file",
            "@type": "IMAGE-THUMBNAIL",
            "@size": "8644",
            "@ref": "gr14",
            "@mimetype": "image/gif"
          },
          {
            "@category": "thumbnail",
            "@height": "163",
            "@width": "202",
            "@_fa": "true",
            "$": "https://api.elsevier.com/content/object/eid/1-s2.0-S2468823122007222-gr15.sml?httpAccept=%2A%2F%2A",
            "@multimediatype": "GIF image file",
            "@type": "IMAGE-THUMBNAIL",
            "@size": "11492",
            "@ref": "gr15",
            "@mimetype": "image/gif"
          },
          {
            "@category": "thumbnail",
            "@height": "164",
            "@width": "171",
            "@_fa": "true",
            "$": "https://api.elsevier.com/content/object/eid/1-s2.0-S2468823122007222-gr12.sml?httpAccept=%2A%2F%2A",
            "@multimediatype": "GIF image file",
            "@type": "IMAGE-THUMBNAIL",
            "@size": "15416",
            "@ref": "gr12",
            "@mimetype": "image/gif"
          },
          {
            "@category": "thumbnail",
            "@height": "164",
            "@width": "202",
            "@_fa": "true",
            "$": "https://api.elsevier.com/content/object/eid/1-s2.0-S2468823122007222-gr13.sml?httpAccept=%2A%2F%2A",
            "@multimediatype": "GIF image file",
            "@type": "IMAGE-THUMBNAIL",
            "@size": "9931",
            "@ref": "gr13",
            "@mimetype": "image/gif"
          },
          {
            "@category": "thumbnail",
            "@height": "91",
            "@width": "219",
            "@_fa": "true",
            "$": "https://api.elsevier.com/content/object/eid/1-s2.0-S2468823122007222-gr10.sml?httpAccept=%2A%2F%2A",
            "@multimediatype": "GIF image file",
            "@type": "IMAGE-THUMBNAIL",
            "@size": "11090",
            "@ref": "gr10",
            "@mimetype": "image/gif"
          },
          {
            "@category": "thumbnail",
            "@height": "96",
            "@width": "219",
            "@_fa": "true",
            "$": "https://api.elsevier.com/content/object/eid/1-s2.0-S2468823122007222-gr11.sml?httpAccept=%2A%2F%2A",
            "@multimediatype": "GIF image file",
            "@type": "IMAGE-THUMBNAIL",
            "@size": "9996",
            "@ref": "gr11",
            "@mimetype": "image/gif"
          },
          {
            "@category": "thumbnail",
            "@height": "164",
            "@width": "188",
            "@_fa": "true",
            "$": "https://api.elsevier.com/content/object/eid/1-s2.0-S2468823122007222-gr2.sml?httpAccept=%2A%2F%2A",
            "@multimediatype": "GIF image file",
            "@type": "IMAGE-THUMBNAIL",
            "@size": "11823",
            "@ref": "gr2",
            "@mimetype": "image/gif"
          },
          {
            "@category": "thumbnail",
            "@height": "102",
            "@width": "219",
            "@_fa": "true",
            "$": "https://api.elsevier.com/content/object/eid/1-s2.0-S2468823122007222-gr1.sml?httpAccept=%2A%2F%2A",
            "@multimediatype": "GIF image file",
            "@type": "IMAGE-THUMBNAIL",
            "@size": "8461",
            "@ref": "gr1",
            "@mimetype": "image/gif"
          },
          {
            "@category": "thumbnail",
            "@height": "87",
            "@width": "219",
            "@_fa": "true",
            "$": "https://api.elsevier.com/content/object/eid/1-s2.0-S2468823122007222-gr18.sml?httpAccept=%2A%2F%2A",
            "@multimediatype": "GIF image file",
            "@type": "IMAGE-THUMBNAIL",
            "@size": "9024",
            "@ref": "gr18",
            "@mimetype": "image/gif"
          },
          {
            "@category": "thumbnail",
            "@height": "164",
            "@width": "159",
            "@_fa": "true",
            "$": "https://api.elsevier.com/content/object/eid/1-s2.0-S2468823122007222-sc2.sml?httpAccept=%2A%2F%2A",
            "@multimediatype": "GIF image file",
            "@type": "IMAGE-THUMBNAIL",
            "@size": "16679",
            "@ref": "sc2",
            "@mimetype": "image/gif"
          },
          {
            "@category": "thumbnail",
            "@height": "142",
            "@width": "219",
            "@_fa": "true",
            "$": "https://api.elsevier.com/content/object/eid/1-s2.0-S2468823122007222-gr19.sml?httpAccept=%2A%2F%2A",
            "@multimediatype": "GIF image file",
            "@type": "IMAGE-THUMBNAIL",
            "@size": "10147",
            "@ref": "gr19",
            "@mimetype": "image/gif"
          },
          {
            "@category": "thumbnail",
            "@height": "164",
            "@width": "190",
            "@_fa": "true",
            "$": "https://api.elsevier.com/content/object/eid/1-s2.0-S2468823122007222-gr16.sml?httpAccept=%2A%2F%2A",
            "@multimediatype": "GIF image file",
            "@type": "IMAGE-THUMBNAIL",
            "@size": "11671",
            "@ref": "gr16",
            "@mimetype": "image/gif"
          },
          {
            "@category": "thumbnail",
            "@height": "150",
            "@width": "219",
            "@_fa": "true",
            "$": "https://api.elsevier.com/content/object/eid/1-s2.0-S2468823122007222-gr17.sml?httpAccept=%2A%2F%2A",
            "@multimediatype": "GIF image file",
            "@type": "IMAGE-THUMBNAIL",
            "@size": "9233",
            "@ref": "gr17",
            "@mimetype": "image/gif"
          },
          {
            "@category": "thumbnail",
            "@height": "104",
            "@width": "219",
            "@_fa": "true",
            "$": "https://api.elsevier.com/content/object/eid/1-s2.0-S2468823122007222-sc1.sml?httpAccept=%2A%2F%2A",
            "@multimediatype": "GIF image file",
            "@type": "IMAGE-THUMBNAIL",
            "@size": "7079",
            "@ref": "sc1",
            "@mimetype": "image/gif"
          },
          {
            "@category": "thumbnail",
            "@height": "164",
            "@width": "198",
            "@_fa": "true",
            "$": "https://api.elsevier.com/content/object/eid/1-s2.0-S2468823122007222-gr8.sml?httpAccept=%2A%2F%2A",
            "@multimediatype": "GIF image file",
            "@type": "IMAGE-THUMBNAIL",
            "@size": "12628",
            "@ref": "gr8",
            "@mimetype": "image/gif"
          },
          {
            "@category": "thumbnail",
            "@height": "163",
            "@width": "185",
            "@_fa": "true",
            "$": "https://api.elsevier.com/content/object/eid/1-s2.0-S2468823122007222-gr7.sml?httpAccept=%2A%2F%2A",
            "@multimediatype": "GIF image file",
            "@type": "IMAGE-THUMBNAIL",
            "@size": "12768",
            "@ref": "gr7",
            "@mimetype": "image/gif"
          },
          {
            "@category": "thumbnail",
            "@height": "164",
            "@width": "197",
            "@_fa": "true",
            "$": "https://api.elsevier.com/content/object/eid/1-s2.0-S2468823122007222-gr9.sml?httpAccept=%2A%2F%2A",
            "@multimediatype": "GIF image file",
            "@type": "IMAGE-THUMBNAIL",
            "@size": "12313",
            "@ref": "gr9",
            "@mimetype": "image/gif"
          },
          {
            "@category": "thumbnail",
            "@height": "164",
            "@width": "212",
            "@_fa": "true",
            "$": "https://api.elsevier.com/content/object/eid/1-s2.0-S2468823122007222-gr4.sml?httpAccept=%2A%2F%2A",
            "@multimediatype": "GIF image file",
            "@type": "IMAGE-THUMBNAIL",
            "@size": "27166",
            "@ref": "gr4",
            "@mimetype": "image/gif"
          },
          {
            "@category": "thumbnail",
            "@height": "164",
            "@width": "198",
            "@_fa": "true",
            "$": "https://api.elsevier.com/content/object/eid/1-s2.0-S2468823122007222-gr3.sml?httpAccept=%2A%2F%2A",
            "@multimediatype": "GIF image file",
            "@type": "IMAGE-THUMBNAIL",
            "@size": "24995",
            "@ref": "gr3",
            "@mimetype": "image/gif"
          },
          {
            "@category": "thumbnail",
            "@height": "164",
            "@width": "211",
            "@_fa": "true",
            "$": "https://api.elsevier.com/content/object/eid/1-s2.0-S2468823122007222-gr6.sml?httpAccept=%2A%2F%2A",
            "@multimediatype": "GIF image file",
            "@type": "IMAGE-THUMBNAIL",
            "@size": "23496",
            "@ref": "gr6",
            "@mimetype": "image/gif"
          },
          {
            "@category": "thumbnail",
            "@height": "164",
            "@width": "212",
            "@_fa": "true",
            "$": "https://api.elsevier.com/content/object/eid/1-s2.0-S2468823122007222-gr5.sml?httpAccept=%2A%2F%2A",
            "@multimediatype": "GIF image file",
            "@type": "IMAGE-THUMBNAIL",
            "@size": "24463",
            "@ref": "gr5",
            "@mimetype": "image/gif"
          },
          {
            "@category": "high",
            "@height": "886",
            "@width": "951",
            "@_fa": "true",
            "$": "https://api.elsevier.com/content/object/eid/1-s2.0-S2468823122007222-ga1_lrg.jpg?httpAccept=%2A%2F%2A",
            "@multimediatype": "JPEG image file",
            "@type": "IMAGE-HIGH-RES",
            "@size": "113554",
            "@ref": "ga1",
            "@mimetype": "image/jpeg"
          },
          {
            "@category": "high",
            "@height": "1296",
            "@width": "2816",
            "@_fa": "true",
            "$": "https://api.elsevier.com/content/object/eid/1-s2.0-S2468823122007222-gr14_lrg.jpg?httpAccept=%2A%2F%2A",
            "@multimediatype": "JPEG image file",
            "@type": "IMAGE-HIGH-RES",
            "@size": "306628",
            "@ref": "gr14",
            "@mimetype": "image/jpeg"
          },
          {
            "@category": "high",
            "@height": "2384",
            "@width": "2946",
            "@_fa": "true",
            "$": "https://api.elsevier.com/content/object/eid/1-s2.0-S2468823122007222-gr15_lrg.jpg?httpAccept=%2A%2F%2A",
            "@multimediatype": "JPEG image file",
            "@type": "IMAGE-HIGH-RES",
            "@size": "570041",
            "@ref": "gr15",
            "@mimetype": "image/jpeg"
          },
          {
            "@category": "high",
            "@height": "2757",
            "@width": "2875",
            "@_fa": "true",
            "$": "https://api.elsevier.com/content/object/eid/1-s2.0-S2468823122007222-gr12_lrg.jpg?httpAccept=%2A%2F%2A",
            "@multimediatype": "JPEG image file",
            "@type": "IMAGE-HIGH-RES",
            "@size": "1086229",
            "@ref": "gr12",
            "@mimetype": "image/jpeg"
          },
          {
            "@category": "high",
            "@height": "1339",
            "@width": "1654",
            "@_fa": "true",
            "$": "https://api.elsevier.com/content/object/eid/1-s2.0-S2468823122007222-gr13_lrg.jpg?httpAccept=%2A%2F%2A",
            "@multimediatype": "JPEG image file",
            "@type": "IMAGE-HIGH-RES",
            "@size": "267025",
            "@ref": "gr13",
            "@mimetype": "image/jpeg"
          },
          {
            "@category": "high",
            "@height": "1215",
            "@width": "2939",
            "@_fa": "true",
            "$": "https://api.elsevier.com/content/object/eid/1-s2.0-S2468823122007222-gr10_lrg.jpg?httpAccept=%2A%2F%2A",
            "@multimediatype": "JPEG image file",
            "@type": "IMAGE-HIGH-RES",
            "@size": "469018",
            "@ref": "gr10",
            "@mimetype": "image/jpeg"
          },
          {
            "@category": "high",
            "@height": "1239",
            "@width": "2835",
            "@_fa": "true",
            "$": "https://api.elsevier.com/content/object/eid/1-s2.0-S2468823122007222-gr11_lrg.jpg?httpAccept=%2A%2F%2A",
            "@multimediatype": "JPEG image file",
            "@type": "IMAGE-HIGH-RES",
            "@size": "396918",
            "@ref": "gr11",
            "@mimetype": "image/jpeg"
          },
          {
            "@category": "high",
            "@height": "1341",
            "@width": "1535",
            "@_fa": "true",
            "$": "https://api.elsevier.com/content/object/eid/1-s2.0-S2468823122007222-gr2_lrg.jpg?httpAccept=%2A%2F%2A",
            "@multimediatype": "JPEG image file",
            "@type": "IMAGE-HIGH-RES",
            "@size": "349774",
            "@ref": "gr2",
            "@mimetype": "image/jpeg"
          },
          {
            "@category": "high",
            "@height": "1405",
            "@width": "3006",
            "@_fa": "true",
            "$": "https://api.elsevier.com/content/object/eid/1-s2.0-S2468823122007222-gr1_lrg.jpg?httpAccept=%2A%2F%2A",
            "@multimediatype": "JPEG image file",
            "@type": "IMAGE-HIGH-RES",
            "@size": "313462",
            "@ref": "gr1",
            "@mimetype": "image/jpeg"
          },
          {
            "@category": "high",
            "@height": "1073",
            "@width": "2713",
            "@_fa": "true",
            "$": "https://api.elsevier.com/content/object/eid/1-s2.0-S2468823122007222-gr18_lrg.jpg?httpAccept=%2A%2F%2A",
            "@multimediatype": "JPEG image file",
            "@type": "IMAGE-HIGH-RES",
            "@size": "346014",
            "@ref": "gr18",
            "@mimetype": "image/jpeg"
          },
          {
            "@category": "high",
            "@height": "3231",
            "@width": "3133",
            "@_fa": "true",
            "$": "https://api.elsevier.com/content/object/eid/1-s2.0-S2468823122007222-sc2_lrg.jpg?httpAccept=%2A%2F%2A",
            "@multimediatype": "JPEG image file",
            "@type": "IMAGE-HIGH-RES",
            "@size": "1365429",
            "@ref": "sc2",
            "@mimetype": "image/jpeg"
          },
          {
            "@category": "high",
            "@height": "1810",
            "@width": "2782",
            "@_fa": "true",
            "$": "https://api.elsevier.com/content/object/eid/1-s2.0-S2468823122007222-gr19_lrg.jpg?httpAccept=%2A%2F%2A",
            "@multimediatype": "JPEG image file",
            "@type": "IMAGE-HIGH-RES",
            "@size": "429700",
            "@ref": "gr19",
            "@mimetype": "image/jpeg"
          },
          {
            "@category": "high",
            "@height": "2396",
            "@width": "2774",
            "@_fa": "true",
            "$": "https://api.elsevier.com/content/object/eid/1-s2.0-S2468823122007222-gr16_lrg.jpg?httpAccept=%2A%2F%2A",
            "@multimediatype": "JPEG image file",
            "@type": "IMAGE-HIGH-RES",
            "@size": "886681",
            "@ref": "gr16",
            "@mimetype": "image/jpeg"
          },
          {
            "@category": "high",
            "@height": "1183",
            "@width": "1724",
            "@_fa": "true",
            "$": "https://api.elsevier.com/content/object/eid/1-s2.0-S2468823122007222-gr17_lrg.jpg?httpAccept=%2A%2F%2A",
            "@multimediatype": "JPEG image file",
            "@type": "IMAGE-HIGH-RES",
            "@size": "237635",
            "@ref": "gr17",
            "@mimetype": "image/jpeg"
          },
          {
            "@category": "high",
            "@height": "1505",
            "@width": "3156",
            "@_fa": "true",
            "$": "https://api.elsevier.com/content/object/eid/1-s2.0-S2468823122007222-sc1_lrg.jpg?httpAccept=%2A%2F%2A",
            "@multimediatype": "JPEG image file",
            "@type": "IMAGE-HIGH-RES",
            "@size": "355106",
            "@ref": "sc1",
            "@mimetype": "image/jpeg"
          },
          {
            "@category": "high",
            "@height": "2377",
            "@width": "2868",
            "@_fa": "true",
            "$": "https://api.elsevier.com/content/object/eid/1-s2.0-S2468823122007222-gr8_lrg.jpg?httpAccept=%2A%2F%2A",
            "@multimediatype": "JPEG image file",
            "@type": "IMAGE-HIGH-RES",
            "@size": "677388",
            "@ref": "gr8",
            "@mimetype": "image/jpeg"
          },
          {
            "@category": "high",
            "@height": "2470",
            "@width": "2795",
            "@_fa": "true",
            "$": "https://api.elsevier.com/content/object/eid/1-s2.0-S2468823122007222-gr7_lrg.jpg?httpAccept=%2A%2F%2A",
            "@multimediatype": "JPEG image file",
            "@type": "IMAGE-HIGH-RES",
            "@size": "676050",
            "@ref": "gr7",
            "@mimetype": "image/jpeg"
          },
          {
            "@category": "high",
            "@height": "2373",
            "@width": "2856",
            "@_fa": "true",
            "$": "https://api.elsevier.com/content/object/eid/1-s2.0-S2468823122007222-gr9_lrg.jpg?httpAccept=%2A%2F%2A",
            "@multimediatype": "JPEG image file",
            "@type": "IMAGE-HIGH-RES",
            "@size": "633354",
            "@ref": "gr9",
            "@mimetype": "image/jpeg"
          },
          {
            "@category": "high",
            "@height": "2381",
            "@width": "3084",
            "@_fa": "true",
            "$": "https://api.elsevier.com/content/object/eid/1-s2.0-S2468823122007222-gr4_lrg.jpg?httpAccept=%2A%2F%2A",
            "@multimediatype": "JPEG image file",
            "@type": "IMAGE-HIGH-RES",
            "@size": "1974814",
            "@ref": "gr4",
            "@mimetype": "image/jpeg"
          },
          {
            "@category": "high",
            "@height": "2574",
            "@width": "3113",
            "@_fa": "true",
            "$": "https://api.elsevier.com/content/object/eid/1-s2.0-S2468823122007222-gr3_lrg.jpg?httpAccept=%2A%2F%2A",
            "@multimediatype": "JPEG image file",
            "@type": "IMAGE-HIGH-RES",
            "@size": "1688763",
            "@ref": "gr3",
            "@mimetype": "image/jpeg"
          },
          {
            "@category": "high",
            "@height": "2399",
            "@width": "3095",
            "@_fa": "true",
            "$": "https://api.elsevier.com/content/object/eid/1-s2.0-S2468823122007222-gr6_lrg.jpg?httpAccept=%2A%2F%2A",
            "@multimediatype": "JPEG image file",
            "@type": "IMAGE-HIGH-RES",
            "@size": "1234423",
            "@ref": "gr6",
            "@mimetype": "image/jpeg"
          },
          {
            "@category": "high",
            "@height": "2390",
            "@width": "3095",
            "@_fa": "true",
            "$": "https://api.elsevier.com/content/object/eid/1-s2.0-S2468823122007222-gr5_lrg.jpg?httpAccept=%2A%2F%2A",
            "@multimediatype": "JPEG image file",
            "@type": "IMAGE-HIGH-RES",
            "@size": "1143544",
            "@ref": "gr5",
            "@mimetype": "image/jpeg"
          },
          {
            "@category": "standard",
            "@_fa": "true",
            "$": "https://api.elsevier.com/content/object/eid/1-s2.0-S2468823122007222-mmc1.docx?httpAccept=%2A%2F%2A",
            "@multimediatype": "Microsoft Word file",
            "@type": "APPLICATION",
            "@size": "295068",
            "@ref": "mmc1",
            "@mimetype": "application/word"
          },
          {
            "@category": "thumbnail",
            "@_fa": "true",
            "$": "https://api.elsevier.com/content/object/eid/1-s2.0-S2468823122007222-si1.svg?httpAccept=%2A%2F%2A",
            "@multimediatype": "Scalable Vector Graphics file",
            "@type": "ALTIMG",
            "@size": "1549",
            "@ref": "si1",
            "@mimetype": "image/svg+xml"
          },
          {
            "@category": "thumbnail",
            "@_fa": "true",
            "$": "https://api.elsevier.com/content/object/eid/1-s2.0-S2468823122007222-si2.svg?httpAccept=%2A%2F%2A",
            "@multimediatype": "Scalable Vector Graphics file",
            "@type": "ALTIMG",
            "@size": "1684",
            "@ref": "si2",
            "@mimetype": "image/svg+xml"
          },
          {
            "@category": "thumbnail",
            "@_fa": "true",
            "$": "https://api.elsevier.com/content/object/eid/1-s2.0-S2468823122007222-si3.svg?httpAccept=%2A%2F%2A",
            "@multimediatype": "Scalable Vector Graphics file",
            "@type": "ALTIMG",
            "@size": "1642",
            "@ref": "si3",
            "@mimetype": "image/svg+xml"
          },
          {
            "@category": "thumbnail",
            "@_fa": "true",
            "$": "https://api.elsevier.com/content/object/eid/1-s2.0-S2468823122007222-si4.svg?httpAccept=%2A%2F%2A",
            "@multimediatype": "Scalable Vector Graphics file",
            "@type": "ALTIMG",
            "@size": "4599",
            "@ref": "si4",
            "@mimetype": "image/svg+xml"
          },
          {
            "@category": "thumbnail",
            "@_fa": "true",
            "$": "https://api.elsevier.com/content/object/eid/1-s2.0-S2468823122007222-si5.svg?httpAccept=%2A%2F%2A",
            "@multimediatype": "Scalable Vector Graphics file",
            "@type": "ALTIMG",
            "@size": "20099",
            "@ref": "si5",
            "@mimetype": "image/svg+xml"
          },
          {
            "@category": "thumbnail",
            "@_fa": "true",
            "$": "https://api.elsevier.com/content/object/eid/1-s2.0-S2468823122007222-si6.svg?httpAccept=%2A%2F%2A",
            "@multimediatype": "Scalable Vector Graphics file",
            "@type": "ALTIMG",
            "@size": "18947",
            "@ref": "si6",
            "@mimetype": "image/svg+xml"
          },
          {
            "@category": "standard",
            "@_fa": "true",
            "$": "https://api.elsevier.com/content/object/eid/1-s2.0-S2468823122007222-am.pdf?httpAccept=%2A%2F%2A",
            "@multimediatype": "Acrobat PDF file",
            "@type": "AAM-PDF",
            "@size": "3966332",
            "@ref": "am",
            "@mimetype": "application/pdf"
          }
        ]
      },
      "link": {
        "@rel": "abstract",
        "@href": "https://api.elsevier.com/content/abstract/scopus_id/85143508865"
      }
    }
  }
}