{
  "metadata": {
    "title": "MXene-supported transition metal single-atom catalysts for nitrogen dissociation",
    "authors": "; ; ",
    "journal": "Molecular Catalysis",
    "date": "2023-08-31",
    "doi": "10.1016/j.mcat.2023.113373",
    "abstract": "",
    "uri": "https://api.elsevier.com/content/article/pii/S2468823123004571",
    "pii": "S2468823123004571"
  },
  "fulltext": {
    "full-text-retrieval-response": {
      "scopus-eid": "2-s2.0-85165109804",
      "originalText": "serial JL 315758 291210 291744 291790 291809 31 90 Molecular Catalysis MOLECULARCATALYSIS 2023-07-12 2023-07-12 2023-08-03 2023-08-03 2023-11-16T15:56:12 1-s2.0-S2468823123004571 S2468-8231(23)00457-1 S2468823123004571 10.1016/j.mcat.2023.113373 S300 S300.1 FULL-TEXT 1-s2.0-S2468823123X00133 2023-11-16T16:10:46.805064Z 0 0 20230801 20230831 2023 2023-07-12T13:39:39.911235Z absattachment articleinfo articlenumber articletitlenorm authfirstinitialnorm authfirstsurnamenorm cid cids contenttype copyright crossmark dateloaded dateloadedtxt datesearch datesort dateupdated dco docsubtype doctype doi eid ewtransactionid fundingbodyid hubeid indexeddate issn issnnorm itemstage itemtransactionid itemweight oauserlicense openaccess openarchive pg pgfirst pii piinorm pubdateend pubdatestart pubdatetxt pubyr sectiontitle sortorder sponsoredaccesstype srctitle srctitlenorm srctype ssids alllist content oa subj subheadings suppl tomb volfirst volissue volumelist webpdf webpdfpagecount yearnav figure table e-component body mmlmath acknowledge affil appendices articletitle auth authfirstini authfull authkeywords authlast highlightsabst orcid primabst ref specialabst 2468-8231 24688231 UNLIMITED FCTHYB22 true 547 547 C Volume 547 126 113373 113373 113373 202308 August 2023 2023-08-01 2023-08-31 2023 Regular Papers article fla © 2023 The Authors. Published by Elsevier B.V. MXENESUPPORTEDTRANSITIONMETALSINGLEATOMCATALYSTSFORNITROGENDISSOCIATION GOUVEIA J Introduction Computational methods and models Results and discussion N2 adsorption N2 dissociation Conclusions CRediT authorship contribution statement Acknowledgements Appendix Supplementary materials References KANDEMIR 2013 12723 12726 T LASSALETTA 2014 105011 L VALERAMEDINA 2018 63 102 A AFONSO 2021 032016 R SPENCER 1982 129 135 N HONKALA 2005 555 558 K ROCHANA 2014 4238 4249 P NAGUIB 2011 4248 4253 M VOJVODIC 2014 108 112 A DEEVA 2019 4505 4513 E YORULMAZ 2016 335702 U LI 2019 1804736 Z GOUVEIA 2020 118191 J GOUVEIA 2022 J MORALESSALVADOR 2021 11248 11255 R MORALESSALVADOR 2018 17117 17124 R PERSSON 2019 1805472 I YI 2019 19950 19960 S GOUVEIA 2020 5049 5056 J GOUVEIA 2020 054003 J MURALI 2022 13370 13429 G PENG 2023 115595 Q ZHAO 2019 4086 4093 D ROCHA 2022 105801 H OSCHINSKI 2021 2477 2484 H KRESSE 1996 11169 11186 G PERDEW 1996 3865 3868 J GRIMME 2010 154104 S GOUVEIA 2020 5913 5921 J GOUVEIA 2021 148946 J BORDONHOS 2022 2200628 M PATEL 2018 29307 29318 A BARLOCCO 2022 2200513 I XIE 2013 235441 Y GUHA 2022 202 S GOUVEIA 2022 024004 J BLOCHL 1994 17953 17979 P MONKHORST 1976 5188 5192 H HENKELMAN 1999 7010 7022 G DILIBERTO 2021 20431 20441 G CIPRIANO 2022 11682 11691 L DERINGER 2011 5461 5466 V MAINTZ 2016 1030 1035 S HEYD 2003 8207 8215 J GOUVEIA 2019 015008 J BRONSTED 1928 231 338 J EVANS 1938 11 M GOUVEIA 2023 101441 J GOUVEIAX2023X113373 GOUVEIAX2023X113373XJ Full 2023-07-08T16:19:35Z FundingBody Portugal institutions 2022: Hybrid journals http://creativecommons.org/licenses/by/4.0/ 2025-08-03T00:00:00.000Z 2025-08-03T00:00:00.000Z http://creativecommons.org/licenses/by-nc-nd/4.0/ This is an open access article under the CC BY license. © 2023 The Authors. Published by Elsevier B.V. 2023-08-17T11:19:45.651Z http://vtw.elsevier.com/data/voc/AddOnTypes/50.7/aggregated-refined Portuguese Foundation for Science and Technology 2021.09799 2022.00719 LA/P/0006/2020 UIDB/50011/2020 UIDP/50011/2020 FCT Fundação para a Ciência e a Tecnologia http://data.elsevier.com/vocabulary/SciValFunders/501100001871 http://sws.geonames.org/2264397/ MCTES MCTES Ministério da Ciência, Tecnologia e Ensino Superior http://data.elsevier.com/vocabulary/SciValFunders/501100006111 http://sws.geonames.org/2264397/ This work was developed within the scope of the project CICECO-Aveiro Institute of Materials, Refs. UIDB/50011/2020, UIDP/50011/2020 and LA/P/0006/2020, financed by national funds through the FCT/MCTES (PIDDAC). JDG thanks the Portuguese Foundation for Science and Technology (FCT) through the grant Ref. 2022.00719.CEECIND, in the scope of the Individual Call to Scientific Employment Stimulus – 5th Edition. We are also thankful to FCT I.P. for the computational resources granted in the framework of project Ref. 2021.09799.CPCA by the FCT/CPCA/2021/01 Call for Advanced Computing Projects. This work was developed within the scope of the project CICECO-Aveiro Institute of Materials, Refs. UIDB/50011/2020, UIDP/50011/2020 and LA/P/0006/2020, financed by national funds through the FCT/MCTES (PIDDAC). JDG thanks the Portuguese Foundation for Science and Technology (FCT) through the grant Ref. 2022.00719.CEECIND, in the scope of the Individual Call to Scientific Employment Stimulus – 5th Edition. We are also thankful to FCT I.P. for the computational resources granted in the framework of project Ref. 2021.09799.CPCA by the FCT/CPCA/2021/01 Call for Advanced Computing Projects. item S2468-8231(23)00457-1 S2468823123004571 1-s2.0-S2468823123004571 10.1016/j.mcat.2023.113373 315758 2023-11-16T16:10:46.805064Z 2023-08-01 2023-08-31 UNLIMITED FCTHYB22 1-s2.0-S2468823123004571-main.pdf https://s3-eu-west-1.amazonaws.com/prod-ucs-content-store-eu-west/content/pii:S2468823123004571/MAIN/application/pdf/1be159b9d343dbda2a41c37e31eea095/main.pdf main.pdf pdf true 4126221 MAIN 8 1-s2.0-S2468823123004571-main_1.png https://s3-eu-west-1.amazonaws.com/prod-ucs-content-store-eu-west/content/pii:S2468823123004571/PREVIEW/image/png/251cf6a47769f74dfc70a159b133648b/main_1.png main_1.png png 60755 849 656 IMAGE-WEB-PDF 1 1-s2.0-S2468823123004571-gr3.jpg https://s3-eu-west-1.amazonaws.com/prod-ucs-content-store-eu-west/content/pii:S2468823123004571/gr3/DOWNSAMPLED/image/jpeg/3a8b1d4566a37dd15bb70d762257320a/gr3.jpg gr3 gr3.jpg jpg 29781 143 489 IMAGE-DOWNSAMPLED 1-s2.0-S2468823123004571-gr2.jpg https://s3-eu-west-1.amazonaws.com/prod-ucs-content-store-eu-west/content/pii:S2468823123004571/gr2/DOWNSAMPLED/image/jpeg/af654e799eb8a6336ff747fe3c15ca17/gr2.jpg gr2 gr2.jpg jpg 46760 226 489 IMAGE-DOWNSAMPLED 1-s2.0-S2468823123004571-ga1.jpg https://s3-eu-west-1.amazonaws.com/prod-ucs-content-store-eu-west/content/pii:S2468823123004571/ga1/DOWNSAMPLED/image/jpeg/dd17540ccebced23f6320099e7dd544c/ga1.jpg ga1 true ga1.jpg jpg 28273 200 447 IMAGE-DOWNSAMPLED 1-s2.0-S2468823123004571-gr5.jpg https://s3-eu-west-1.amazonaws.com/prod-ucs-content-store-eu-west/content/pii:S2468823123004571/gr5/DOWNSAMPLED/image/jpeg/bb290c7246f6b1c1ed4e224a6a7e1317/gr5.jpg gr5 gr5.jpg jpg 88514 609 659 IMAGE-DOWNSAMPLED 1-s2.0-S2468823123004571-gr4.jpg https://s3-eu-west-1.amazonaws.com/prod-ucs-content-store-eu-west/content/pii:S2468823123004571/gr4/DOWNSAMPLED/image/jpeg/5c5fd01262b06a2841d5565159f4a113/gr4.jpg gr4 gr4.jpg jpg 25904 253 357 IMAGE-DOWNSAMPLED 1-s2.0-S2468823123004571-gr7.jpg https://s3-eu-west-1.amazonaws.com/prod-ucs-content-store-eu-west/content/pii:S2468823123004571/gr7/DOWNSAMPLED/image/jpeg/eb15bb085988e83274410f920c437c01/gr7.jpg gr7 gr7.jpg jpg 26086 255 357 IMAGE-DOWNSAMPLED 1-s2.0-S2468823123004571-gr6.jpg https://s3-eu-west-1.amazonaws.com/prod-ucs-content-store-eu-west/content/pii:S2468823123004571/gr6/DOWNSAMPLED/image/jpeg/63f4bf5c9d1864cc323a7e4579500caa/gr6.jpg gr6 gr6.jpg jpg 29842 140 489 IMAGE-DOWNSAMPLED 1-s2.0-S2468823123004571-gr9.jpg https://s3-eu-west-1.amazonaws.com/prod-ucs-content-store-eu-west/content/pii:S2468823123004571/gr9/DOWNSAMPLED/image/jpeg/7f7cc83b65ff7471c8cebea32be96a5f/gr9.jpg gr9 gr9.jpg jpg 25874 255 357 IMAGE-DOWNSAMPLED 1-s2.0-S2468823123004571-gr8.jpg https://s3-eu-west-1.amazonaws.com/prod-ucs-content-store-eu-west/content/pii:S2468823123004571/gr8/DOWNSAMPLED/image/jpeg/41e66246a08b494bdd2e6656e3f15039/gr8.jpg gr8 gr8.jpg jpg 35894 151 565 IMAGE-DOWNSAMPLED 1-s2.0-S2468823123004571-gr1.jpg https://s3-eu-west-1.amazonaws.com/prod-ucs-content-store-eu-west/content/pii:S2468823123004571/gr1/DOWNSAMPLED/image/jpeg/e3efd0f47d8eeff8f9f34fb3835a794a/gr1.jpg gr1 gr1.jpg jpg 30311 231 263 IMAGE-DOWNSAMPLED 1-s2.0-S2468823123004571-gr3.sml https://s3-eu-west-1.amazonaws.com/prod-ucs-content-store-eu-west/content/pii:S2468823123004571/gr3/THUMBNAIL/image/gif/a9eee11e16b09ca6e496d741d88319d9/gr3.sml gr3 gr3.sml sml 13386 64 219 IMAGE-THUMBNAIL 1-s2.0-S2468823123004571-gr2.sml https://s3-eu-west-1.amazonaws.com/prod-ucs-content-store-eu-west/content/pii:S2468823123004571/gr2/THUMBNAIL/image/gif/fd8fbb2b97cac7db5e4407bbe9204cd2/gr2.sml gr2 gr2.sml sml 18067 101 219 IMAGE-THUMBNAIL 1-s2.0-S2468823123004571-ga1.sml https://s3-eu-west-1.amazonaws.com/prod-ucs-content-store-eu-west/content/pii:S2468823123004571/ga1/THUMBNAIL/image/gif/18a703cc4a39a5a7080a27faedba86a8/ga1.sml ga1 true ga1.sml sml 10873 98 219 IMAGE-THUMBNAIL 1-s2.0-S2468823123004571-gr5.sml https://s3-eu-west-1.amazonaws.com/prod-ucs-content-store-eu-west/content/pii:S2468823123004571/gr5/THUMBNAIL/image/gif/1bc9f78d93ed52198137223ad4eb8128/gr5.sml gr5 gr5.sml sml 11649 164 177 IMAGE-THUMBNAIL 1-s2.0-S2468823123004571-gr4.sml https://s3-eu-west-1.amazonaws.com/prod-ucs-content-store-eu-west/content/pii:S2468823123004571/gr4/THUMBNAIL/image/gif/53ca8a5e7deabdd27c25312fb6066510/gr4.sml gr4 gr4.sml sml 8340 155 219 IMAGE-THUMBNAIL 1-s2.0-S2468823123004571-gr7.sml https://s3-eu-west-1.amazonaws.com/prod-ucs-content-store-eu-west/content/pii:S2468823123004571/gr7/THUMBNAIL/image/gif/83b32663b33bd24296b3d7284479c914/gr7.sml gr7 gr7.sml sml 8382 156 219 IMAGE-THUMBNAIL 1-s2.0-S2468823123004571-gr6.sml https://s3-eu-west-1.amazonaws.com/prod-ucs-content-store-eu-west/content/pii:S2468823123004571/gr6/THUMBNAIL/image/gif/06a77ea4cc7c4b79c6f0d9af1e01c99a/gr6.sml gr6 gr6.sml sml 13033 63 219 IMAGE-THUMBNAIL 1-s2.0-S2468823123004571-gr9.sml https://s3-eu-west-1.amazonaws.com/prod-ucs-content-store-eu-west/content/pii:S2468823123004571/gr9/THUMBNAIL/image/gif/df15f48bcdf53dcd0b1c544288cadcc3/gr9.sml gr9 gr9.sml sml 8196 156 219 IMAGE-THUMBNAIL 1-s2.0-S2468823123004571-gr8.sml https://s3-eu-west-1.amazonaws.com/prod-ucs-content-store-eu-west/content/pii:S2468823123004571/gr8/THUMBNAIL/image/gif/01798d4c83e7c560e8f3f6fd81319ac7/gr8.sml gr8 gr8.sml sml 12458 59 219 IMAGE-THUMBNAIL 1-s2.0-S2468823123004571-gr1.sml https://s3-eu-west-1.amazonaws.com/prod-ucs-content-store-eu-west/content/pii:S2468823123004571/gr1/THUMBNAIL/image/gif/14eb39e6a4199d33e6ee664b03ddafdf/gr1.sml gr1 gr1.sml sml 26112 164 186 IMAGE-THUMBNAIL 1-s2.0-S2468823123004571-gr3_lrg.jpg https://s3-eu-west-1.amazonaws.com/prod-ucs-content-store-eu-west/content/pii:S2468823123004571/HIGHRES/image/jpeg/ea3482f034185909cf7553709b68f829/gr3_lrg.jpg gr3 gr3_lrg.jpg jpg 211218 634 2167 IMAGE-HIGH-RES 1-s2.0-S2468823123004571-gr2_lrg.jpg https://s3-eu-west-1.amazonaws.com/prod-ucs-content-store-eu-west/content/pii:S2468823123004571/HIGHRES/image/jpeg/c48e53350b37ed8d70cd7e96ec036417/gr2_lrg.jpg gr2 gr2_lrg.jpg jpg 338028 1002 2167 IMAGE-HIGH-RES 1-s2.0-S2468823123004571-ga1_lrg.jpg https://s3-eu-west-1.amazonaws.com/prod-ucs-content-store-eu-west/content/pii:S2468823123004571/HIGHRES/image/jpeg/b3a2a1683216682139620aa0fc1d2b75/ga1_lrg.jpg ga1 true ga1_lrg.jpg jpg 178775 886 1981 IMAGE-HIGH-RES 1-s2.0-S2468823123004571-gr5_lrg.jpg https://s3-eu-west-1.amazonaws.com/prod-ucs-content-store-eu-west/content/pii:S2468823123004571/HIGHRES/image/jpeg/92d3144c2468f6e67abe7e5ce8070194/gr5_lrg.jpg gr5 gr5_lrg.jpg jpg 602006 2695 2917 IMAGE-HIGH-RES 1-s2.0-S2468823123004571-gr4_lrg.jpg https://s3-eu-west-1.amazonaws.com/prod-ucs-content-store-eu-west/content/pii:S2468823123004571/HIGHRES/image/jpeg/c7c4fc02799a77874438f0aa75e65055/gr4_lrg.jpg gr4 gr4_lrg.jpg jpg 148786 1120 1583 IMAGE-HIGH-RES 1-s2.0-S2468823123004571-gr7_lrg.jpg https://s3-eu-west-1.amazonaws.com/prod-ucs-content-store-eu-west/content/pii:S2468823123004571/HIGHRES/image/jpeg/0b39ee39480f3494a0e1f85e4765b7c7/gr7_lrg.jpg gr7 gr7_lrg.jpg jpg 147684 1129 1583 IMAGE-HIGH-RES 1-s2.0-S2468823123004571-gr6_lrg.jpg https://s3-eu-west-1.amazonaws.com/prod-ucs-content-store-eu-west/content/pii:S2468823123004571/HIGHRES/image/jpeg/a52d4252faad299c36ea526c8547b2ba/gr6_lrg.jpg gr6 gr6_lrg.jpg jpg 215507 622 2167 IMAGE-HIGH-RES 1-s2.0-S2468823123004571-gr9_lrg.jpg https://s3-eu-west-1.amazonaws.com/prod-ucs-content-store-eu-west/content/pii:S2468823123004571/HIGHRES/image/jpeg/137bb512c519ac00e0f42f872167572b/gr9_lrg.jpg gr9 gr9_lrg.jpg jpg 141985 1130 1583 IMAGE-HIGH-RES 1-s2.0-S2468823123004571-gr8_lrg.jpg https://s3-eu-west-1.amazonaws.com/prod-ucs-content-store-eu-west/content/pii:S2468823123004571/HIGHRES/image/jpeg/4d4be422c25ee869ad832d0cf7b526b2/gr8_lrg.jpg gr8 gr8_lrg.jpg jpg 254396 670 2500 IMAGE-HIGH-RES 1-s2.0-S2468823123004571-gr1_lrg.jpg https://s3-eu-west-1.amazonaws.com/prod-ucs-content-store-eu-west/content/pii:S2468823123004571/HIGHRES/image/jpeg/7f31c6f3950964df7a436674832a62d7/gr1_lrg.jpg gr1 gr1_lrg.jpg jpg 234176 1027 1167 IMAGE-HIGH-RES 1-s2.0-S2468823123004571-mmc1.docx https://s3-eu-west-1.amazonaws.com/prod-ucs-content-store-eu-west/content/pii:S2468823123004571/mmc1/MAIN/application/vnd.openxmlformats-officedocument.wordprocessingml.document/916d3d6172e7019bf55eff23b762d5c4/mmc1.docx mmc1 mmc1.docx docx 1319752 APPLICATION 1-s2.0-S2468823123004571-si1.svg https://s3-eu-west-1.amazonaws.com/prod-ucs-content-store-eu-west/content/pii:S2468823123004571/image/svg+xml/51de18ac4d725f28e15b548ddcefa0ef/si1.svg si1 si1.svg svg 2295 ALTIMG 1-s2.0-S2468823123004571-si10.svg https://s3-eu-west-1.amazonaws.com/prod-ucs-content-store-eu-west/content/pii:S2468823123004571/image/svg+xml/ff08d9b71e2c6d2c42c9d08a8804d23d/si10.svg si10 si10.svg svg 12417 ALTIMG 1-s2.0-S2468823123004571-si11.svg https://s3-eu-west-1.amazonaws.com/prod-ucs-content-store-eu-west/content/pii:S2468823123004571/image/svg+xml/b22274efd312ab666da103833be1047a/si11.svg si11 si11.svg svg 6813 ALTIMG 1-s2.0-S2468823123004571-si12.svg https://s3-eu-west-1.amazonaws.com/prod-ucs-content-store-eu-west/content/pii:S2468823123004571/image/svg+xml/76b7d77d86be80011f81ed12bbb872be/si12.svg si12 si12.svg svg 11406 ALTIMG 1-s2.0-S2468823123004571-si13.svg https://s3-eu-west-1.amazonaws.com/prod-ucs-content-store-eu-west/content/pii:S2468823123004571/image/svg+xml/e95e2afbe8dfe233ad1f2f5a28e0ed3d/si13.svg si13 si13.svg svg 7491 ALTIMG 1-s2.0-S2468823123004571-si14.svg https://s3-eu-west-1.amazonaws.com/prod-ucs-content-store-eu-west/content/pii:S2468823123004571/image/svg+xml/d097ba490f2b9f19e5e32a224e5bf69a/si14.svg si14 si14.svg svg 1412 ALTIMG 1-s2.0-S2468823123004571-si2.svg https://s3-eu-west-1.amazonaws.com/prod-ucs-content-store-eu-west/content/pii:S2468823123004571/image/svg+xml/c0729d646c5231e55992755988187830/si2.svg si2 si2.svg svg 3062 ALTIMG 1-s2.0-S2468823123004571-si3.svg https://s3-eu-west-1.amazonaws.com/prod-ucs-content-store-eu-west/content/pii:S2468823123004571/image/svg+xml/cb5882cac2cb0f26e7162e823fb82773/si3.svg si3 si3.svg svg 3867 ALTIMG 1-s2.0-S2468823123004571-si4.svg https://s3-eu-west-1.amazonaws.com/prod-ucs-content-store-eu-west/content/pii:S2468823123004571/image/svg+xml/21bac95c97b05ea6589e414961ca43ed/si4.svg si4 si4.svg svg 2894 ALTIMG 1-s2.0-S2468823123004571-si5.svg https://s3-eu-west-1.amazonaws.com/prod-ucs-content-store-eu-west/content/pii:S2468823123004571/image/svg+xml/55fde45f29a2e48d19b3d0bf832b8300/si5.svg si5 si5.svg svg 11876 ALTIMG 1-s2.0-S2468823123004571-si6.svg https://s3-eu-west-1.amazonaws.com/prod-ucs-content-store-eu-west/content/pii:S2468823123004571/image/svg+xml/a730d8e60349596f170a793cd0204644/si6.svg si6 si6.svg svg 6749 ALTIMG 1-s2.0-S2468823123004571-si7.svg https://s3-eu-west-1.amazonaws.com/prod-ucs-content-store-eu-west/content/pii:S2468823123004571/image/svg+xml/24e5237830879668e10346150525aca5/si7.svg si7 si7.svg svg 5853 ALTIMG 1-s2.0-S2468823123004571-si8.svg https://s3-eu-west-1.amazonaws.com/prod-ucs-content-store-eu-west/content/pii:S2468823123004571/image/svg+xml/b75fa852a6a9dc957915e2a98ad73068/si8.svg si8 si8.svg svg 2392 ALTIMG 1-s2.0-S2468823123004571-si9.svg https://s3-eu-west-1.amazonaws.com/prod-ucs-content-store-eu-west/content/pii:S2468823123004571/image/svg+xml/99358bdbd16de139bee4d38a06e908a9/si9.svg si9 si9.svg svg 8273 ALTIMG 1-s2.0-S2468823123004571-am.pdf https://s3-eu-west-1.amazonaws.com/prod-ucs-content-store-eu-west/content/egi:10BLKSNR2XC/MAIN/application/pdf/e9fa6047ddba8f3851b4fb3655d19e9f/am.pdf am am.pdf pdf false 1820870 AAM-PDF MCAT 113373 113373 S2468-8231(23)00457-1 10.1016/j.mcat.2023.113373 The Authors Fig. 1 Top view (top image) and side view (bottom image) of the Ti2C model used in this work, with a TM atom adsorbed on each of the high-symmetry sites of interest on the Ti2C MXene surface: hollow above a carbon atom (HC), hollow above a titanium atom (HTi), bridge (B), and top (T). The rhombus (green line) represents the shape and size of the computational supercell used in the calculations. The spheres represent atoms of titanium (in silver), carbon (in black), or a TM element (in yellow). Fig 1 Fig. 2 Top views (top images) and side views (bottom images) of N2 molecular adsorption (left figures), dissociation transition state (centre figures), and dissociated state (right figures) on the Ti2C MXene surface. The spheres represent atoms of titanium (in silver), carbon (in black), or nitrogen (in blue). Fig 2 Fig. 3 Top views of N2 adsorption configurations on some TM@Ti2C surfaces, in which the most stable adsorption site of the TM adatom is B (left image), HC (centre image), or HTi (right image). The images were drawn using the coordinates for TM = Hf, Ni and Zn, respectively, but the configurations shown are representative of all the TMs above each of the panels. The spheres represent atoms of titanium (in silver), carbon (in black), nitrogen (blue), or a TM element (in yellow). Fig 3 Fig. 4 Adsorption energy, of one N2 molecule on the TM@Ti2C systems studied in this work. The black box contains the cases in which the molecule is unable to adsorb while forming bonds with the TM atom. The dashed line is set at the adsorption energy of N2 on the Ti2C MXene surface (without the TM atom). Fig 4 Fig. 5 Projected density of states (DOS, left) and Crystal Orbital Hamilton Population (COHP, right) of N2 on Sc@Ti2C (top rows), Co@Ti2C (middle) and Cd@Ti2C (bottom). Fig 5 Fig. 6 Top views of transition state configurations of N2 dissociation on some TM@Ti2C surfaces, in which the most stable adsorption site of the TM atom is B (left image), HC (centre image), or HTi (right image). The images were drawn using the coordinates for TM = Hf, Ni and Zn, respectively, but the configurations shown are representative of all the TMs above each of the panels. The spheres represent atoms of titanium (in silver), carbon (in black), nitrogen (blue), or a TM element (in yellow). Fig 6 Fig. 7 N2 dissociation energy barriers on the TM@Ti2C systems studied in this work. The black box contains the cases in which the molecule is unable to adsorb while forming bonds with the M atom. The dashed line is set at the N2 dissociation energy barrier on the Ti2C MXene surface (without the TM atom). Fig 7 Fig. 8 Top views of N2 adsorbed on some TM@Ti2C surfaces, in its dissociated state. After N2 dissociates, the TM adatoms that prefer adsorbing on a B site move to either HC (a) or T (b), while the those that prefer adsorbing on (c) HC or (d) HTi sites remain in the same site. The images were drawn using the coordinates for TM = Sc, Hf, Ni and Zn, respectively, but the configurations shown are representative of all the TMs above each of the panels. The spheres represent atoms of titanium (in silver), carbon (in black), nitrogen (blue), or a TM element (in yellow). Fig 8 Fig. 9 N2 dissociation reaction energy, in eV, on the TM@Ti2C systems studied in this work. The black box contains the cases in which the molecule is unable to adsorb while forming bonds with the TM atom. The dashed line is set at the dissociation reaction energy of N2 on the Ti2C MXene surface (without the TM atom). Fig 9 Table 1 Most stable adsorption site of an atom of each transition metal considered in this work, on the Ti2C MXene surface. Table 1 Sc Ti V Cr Mn Fe Co Ni Cu Zn B B B HC HC HC HC HC HTi HTi Y Zr Nb Mo Tc Ru Rh Pd Ag Cd B B HC HC HC HC HC HC HTi HTi Lu Hf Ta W Re Os Ir Pt Au Hg B B B HC HC HC HC HC HTi HTi Table 2 Calculated energy barriers (E barr) and reaction energies (E reac), in eV, for N adatom hydrogenation towards NH3, on three MXene surfaces. Data for W2N were obtained in [Ref. 19]. Table 2 MXene Surface Reaction E barr E reac W2N N + H → NH 1.24 0.14 NH + H → N H 2 1.70 1.37 N H 2 + H → N H 3 1.69 0.79 Ti2C N + H → NH 0.90 −0.34 NH + H → N H 2 1.99 1.74 N H 2 + H → N H 3 2.40 2.07 Co@Ti2C N + H → NH 1.65 0.91 NH + H → N H 2 2.51 0.99 N H 2 + H → N H 3 2.28 1.95 MXene-supported transition metal single-atom catalysts for nitrogen dissociation José D. Gouveia Conceptualization Formal analysis Investigation Writing – original draft Visualization ⁎ Henrique Rocha Investigation Formal analysis Writing – review & editing José R.B. Gomes Conceptualization Resources Writing – review & editing Supervision Project administration Funding acquisition Department of Chemistry, CICECO – Aveiro Institute of Materials, University of Aveiro, Campus Universitário de Santiago, Aveiro, Portugal Department of Chemistry CICECO – Aveiro Institute of Materials University of Aveiro Campus Universitário de Santiago Aveiro Portugal Department of Chemistry, CICECO – Aveiro Institute of Materials, University of Aveiro, Campus Universitário de Santiago, Aveiro, Portugal ⁎ Corresponding author. Industrial ammonia production follows the Haber-Bosch process, whose rate-limiting step is the dissociation of the nitrogen molecule (N2), hence requiring suitable catalysts to break its triple bond. MXenes, a class of two-dimensional transition metal carbides and nitrides, have been proposed as very efficient catalysts for N2 dissociation. Here, by employing density functional theory-based calculations, we assess whether the deposition of one atom of a transition metal element (TM) on the Ti2C MXene surface further improves the catalytic potential of the MXene, serving as a single-atom catalyst. The results show that, for 21 of the 30 TMs considered, N2 can exothermically bind to the TM adatom, this bonding being favourable with respect to adsorption on the pristine Ti2C MXene surface for TMs of groups 3 to 6 of the Periodic Table. All the 21 TMs that successfully bind to N2 effectively reduce the N2 dissociation energy barrier when compared to the bulk Ti2C MXene by 18 to 84 %. Our results strongly indicate that doping the Ti2C MXene with atoms of transition metal elements significantly reduces the energy required to break the triple bond in N2, which may impact the nitrogen-to-ammonia process. Graphical abstract Image, graphical abstract Keywords MXenes Density functional theory Adsorption Single-atom catalysts Nitrogen dissociation Data availability Data will be made available on request. Introduction The Haber-Bosch (HB) process is the dominating means of industrial production of ammonia (NH3) today [1]. This compound is the precursor of many others containing nitrogen, which have application, for example, in areas such as the pharmaceutical industry, as fertilizers, or as cleaning products [2]. Ammonia has also been proposed as an energy carrier due to its high hydrogen capacity and energy density [3,4]. The HB process converts atmospheric nitrogen (N2) and hydrogen (H2) into ammonia. The most challenging step of this conversion is the dissociation of N2 molecules, since their triple covalent bond is extremely strong, with a dissociation energy close to 10 eV. This obstacle has driven much of the research in this area to focus on finding catalysts that can reduce the N2 dissociation activation energy. Well established catalysts include Fe(111) surfaces, displaying an experimentally measured barrier for N2 dissociation around 0.8 eV [5], or Ru nanoparticles, on which the same energy barrier is in the 0.4–1.9 eV range, depending on the surface site considered [6]. Other materials, such as V(110) surfaces, provide energy barriers of the same order [7]. Despite greatly facilitating N2 dissociation, the usage of these materials in the HB process still requires temperatures around 450 °C and pressures of several hundred bar [1]. One way to allow HB synthesis to be operated at milder conditions is to find catalysts that can further reduce the energy barrier for N2 dissociation. MXenes are two-dimensional materials discovered just over 10 years ago [8]. They are made up of very few close-packed layers of early transition metal elements intercalated with layers of carbon or nitrogen. Depending on the synthesis procedure, MXenes may include different surface terminations bound to the outer metallic atomic layers, but post-synthesis heating treatments have been used successfully to obtain MXenes devoid of surface termination [9,10]. These bare MXenes are stable[11] and their potential in catalysis is well known [12]. In particular, MXenes have been shown to be suitable catalysts for hydrogen production via the water-gas shift reaction [10,13,14], for CO2 reduction to CO[15–17] and, most importantly here, for N2 dissociation [18–20]. In fact, some MXenes have been predicted to be able to reduce the energy barrier for N2 dissociation by over 95 %, e.g. up to 0.18 eV on Mo2N. The Ti2C MXene is expected to exothermically adsorb and dissociate N2, with an energy barrier of 0.98 eV. Unfortunately, some of the MXenes predicted to be the best for dissociating N2, such as W2N, have not been synthesised to date [21]. Since the titanium carbide MXene was the first to be manufactured, it is naturally the most studied and well-known member of the MXene family, but regrettably is not amongst the most promising MXenes for serving as a catalyst in the HB process in its pristine form. However, because it has been synthesised so many times, its production method is already very optimized and, for this reason, it is scientifically desirable to improve on its properties by tweaking its composition or structure. One such tweak could be the doping of the Ti2C MXene surface with atoms of other transition metal (TM) elements, which has been considered by numerous studies, and found to often improve the catalytic activity of the MXene. For example, a Zn@Ti2CN2 single-atom catalyst (SAC) was very recently predicted to reduce the CO oxidation energy barrier to a mere 0.06 eV [22], and a Pt@Ti3C2 SAC was experimentally shown to very efficiently fixate CO2 [23]. This led us and other researchers to conduct systematic analyses of the interaction of MXenes with atoms of transition metal elements [24,25], by which we found that very stable TM@MXene complexes are formed. This again hints at their potential for applications such as catalysis, and that is the subject of the present work. In this work, we examine the interaction between single transition metal atoms of 30 different chemical elements, deposited on the Ti2C MXene surface, and a nitrogen molecule. To this end, we calculate N2 adsorption configurations and energies in the vicinity of each TM atom, the N2 dissociation activation energy starting from its adsorbed configuration, and the dissociation energy. Lastly, we compare the results found for each TM element with the ones on the bulk Ti2C MXene surface. In the sections that follow, we first describe the computational methods and models used, then present and discuss the results found, and finally summarize the main conclusions. Computational methods and models The Ti2C MXene surface was modelled as a supercell containing 4 × 4 unit cells (48 atoms) of the material, with periodic boundary conditions in all cartesian directions. A width of circa 18 Å of vacuum was inserted in the direction perpendicular to the slab to avoid interaction between periodic copies of the system. Fig. 1 shows the MXene model considered in this work, with a TM atom adsorbed in four different high-symmetry sites of the surface: hollow carbon (HC), hollow titanium (HTi), bridge (B), and top (T). Table 1 shows the most stable adsorption site of an atom of each of the TM elements studied here on the Ti2C MXene, taken from Ref. [24], where the adsorption energies of TM adatoms on Ti2C can also be found. Notice that Fig. 1 includes a model of the Ti2C MXene with a TM atom adsorbed on a T site despite none of the TM preferring this site. This is for the sake of completeness since some TM atoms may move to a T site upon nearby N2 adsorption and/or dissociation. The TM elements chosen were those of the fourth, fifth and sixth periods of the Periodic Table, with Lu representing the lanthanoids, since its electronic configuration and adsorption behaviour on Ti2C are the most similar to those of the remaining elements of this period, due to the filled 4f subshell [24]. The density functional theory (DFT) calculations were carried out using the VASP package [26]. The exchange correlation functional of choice was PBE [27], including dispersion interactions via the D3 method by Grimme [28]. This selection is known to accurately describe adsorption phenomena on MXenes[29,30] and has been used in previous works, allowing method consistency and comparison of results [20,31]. Previous theoretical studies on the application of SACs in electrochemical processes have shown that the use of hybrid functionals may yield significantly different results [32,33]. In the case of MXenes without SACs, the PBE and HSE functionals have been reported to give similar results, with the exception of band gap values [34–36]. Valence electron wave functions were expanded in a plane wave basis set with an energy cut-off of 415 eV, while core electrons were treated using the projector augmented wave (PAW) method [37]. The valence configurations of individual atoms are the same as in [Ref. 24]. Our preliminary tests showed that, to obtain relative energies converged within 1 meV/atom, a gamma-centred Monkhorst-Pack grid of 3 × 3 × 1 k-points[38] adequately samples the Brillouin zone. From the results of these tests, we additionally settled for atomic nuclei relaxations to be considered converged once no atoms felt net forces over 0.001 eV/Å, while the total energy calculations stopped when the difference between consecutive steps was lower than 10−6 eV. Spin polarization was considered in all calculations. For each TM@Ti2C, we searched for the most stable adsorption configuration of N2, by initially placing the molecule vertically or horizontally over each relevant site of the surface in the vicinity of the TM atom, optimizing the positions of the atoms, and comparing the final total energies. We then took each ground state N2 adsorption configuration and calculated the adsorption energy of N2 on each TM@Ti2C as E ads = E TM @ T i 2 C + N 2 − ( E TM @ T i 2 C + E N 2 ) . Here, the E TM @ T i 2 C + N 2 , E TM @ T i 2 C and E N 2 are the total energies of supercells containing the Ti2C MXene surface with a TM atom and a nitrogen molecule adsorbed, the Ti2C MXene surface with a TM atom, and a nitrogen molecule, respectively. In this work, all the calculated adsorption energies are negative, indicating exothermic adsorption, meaning that values farther from zero imply stronger adsorption. The N2 dissociation activation energies, E barr, were calculated as the difference between the total energy of TM@Ti2C+N2 in its transition ( E TM @ T i 2 C + N 2 , TS ) and molecular ( E TM @ T i 2 C + N 2 ) states, E barr = E TM @ T i 2 C + N 2 − E TM @ T i 2 C + N 2 , TS . The transition states were obtained using the dimer method [39]. This method allows one to find first-order saddle points of the potential energy hypersurface of the system, which was verified by calculating the normal vibrational modes of the adsorbed N2 in the state found by the dimer approach and checking that a single imaginary frequency was present. The vibration of the molecule in the mode with the imaginary frequency corresponds to oscillation between the adsorbed molecular and dissociated states, thus providing us with information on the configuration of the system after N2 dissociates. The N2 dissociation reaction energy was obtained as the difference between the total energies of the supercells containing N2 adsorbed in its dissociated ( E TM @ T i 2 C + 2 N ) and molecular ( E TM @ T i 2 C + N 2 ) states, E reac = E TM @ T i 2 C + 2 N − E TM @ T i 2 C + N 2 . All total energies of systems involving N2 include the zero-point energy corrections, calculated using the harmonic approximation and considering the vibrational degrees of freedom of the molecule. Results and discussion The mechanism of N2 dissociation on the pristine Ti2C MXene surface was studied in a previous work, employing a supercell size of 3 × 3 MXene unit cells [19]. The calculated N2 adsorption energy, N2 activation energy, and N2 dissociation reaction energy were −3.26 eV, 0.98 eV, and −1.55 eV, respectively. Here, for the sake of consistency with the calculations involving the TM atoms, we briefly revisited this problem using the same parameters that we use in the rest of the calculations, including a wider 4 × 4 supercell. Structurally, we found the same adsorption, activated and dissociated state configurations, as can be seen in Fig. 2 . The molecule adsorbs with one N atom on each of two neighbouring hollow sites (HC and HTi), and its dissociation involves a jump of the N atom adsorbed on HC to HTi, so that ultimately, each N atom sits on its most stable adsorption site, HTi. The interatomic distances surrounding the N2 molecule obtained here differ by less than 1 % from the ones found in the previous work. For example, the newly obtained N-N distance is 1.35 Å, similar to the 1.36 Å found in [Ref. 19]. Energetically, some differences were found. The adsorption energy calculated on the 4 × 4 supercell is lower than on the 3 × 3 one by 0.28 eV, standing for an adsorption that is 9 % stronger. This was expected since, on a smaller supercell, there is stronger repulsion between the periodic replicas of the molecule, and its adsorption involves a more pronounced lattice distortion, leading to lower stability. In turn, the N2 dissociation energy barrier calculated on the 4 × 4 supercell is higher by 0.09 eV, and the dissociation was predicted to be less exothermic by 0.12 eV. To verify that the results are converged with respect to supercell size, we also compared the mechanism of N2 adsorption and dissociation on a 5 × 5 Ti2C supercell vs. a 4 × 4 one and found energetic differences of less than 0.03 eV. In the following subsections, we analyse the N2 adsorption and dissociation mechanism on the Ti2C MXene surface in the vicinity of a TM adatom, and compare it with the one predicted for the clean MXene. N2 adsorption Regardless of the TM atom added to the Ti2C MXene surface, the N2 molecule always adsorbs preferably on the same lattice sites as the ones found for the pristine Ti2C, i.e., with one of its atoms on an HC site and the other on an adjacent HTi site. The TM elements considered in this work can be divided into two sets depending on their behaviour towards N2 adsorption on TM@Ti2C: metals from the first set form no chemical bonds with N2, and metals from the second set form a bond with at least one of the N atoms. For the metals of the first set (Ru, Rh, Pd, Ag, Cd, Ir, Pt, Au and Hg), no N2 adsorption configurations on TM@Ti2C with TM-N2 bonds are stable, and the molecule can only adsorb far from the TM adatom, at least 4 Å away. In this set, all the calculated adsorption energies are higher than on the clean Ti2C MXene, indicating weaker adsorption. This suggests that, in these situations, the molecule attempts to adsorb as far from the TM adatom as possible, on the bulk Ti2C MXene, but due to the finite size of the model, it still interacts weakly with TM adatom and is affected by the electronic and structural changes on the Ti2C surface that this adatom induces. Fig. 3 shows the N2 adsorption configurations on the TM@Ti2C, for the TM elements of the second set. Three images are shown, each one representative of all TMs that adsorb on a different lattice site, and the average N-N distance is 1.38 Å, which is a little higher than the one calculated for the Ti2C Mxene by 0.03 Å, and 23 % higher than the 1.12 Å calculated for gaseous N2, indicating molecule activation. As can be seen, each TM adatom remains adsorbed in its original lattice site, only slightly dislocated because of the presence of the adsorbed N2 species nearby. The N2 adsorption configurations depicted in Fig. 3 are not the only stable ones. The molecule can also adsorb by bonding only to the TM adatom, either by sitting parallel (η2-bonding) or perpendicularly (η1-bonding) to the plane of the surface, in a manner similar to the one observed for H2 or O2 adsorptions on SACs deposited on nitrogen-doped graphene in Refs. [40,41], respectively. These configurations are almost equally stable, with a slight tendency for the perpendicular one, but both are less stable than the ground state by at least 2.5 eV. As one would expect, parallel adsorption on top of the TM adatom stretches the N-N bond and can facilitate dissociation. This stretching is much less noticeable than in the ground state configuration, with an average N-N distance of 1.17 Å, hinting that N2 dissociation is much cheaper energetically when starting from the ground state adsorption configuration. The N2 adsorption energies on all TM@Ti2C systems are shown in Fig. 4 and Table S1. Concerning metals of the second set, even though N2 adsorption close to the TM adatom is stable in all cases, it is only energetically advantageous with respect to adsorption on the pristine Ti2C MXene surface for metals of groups 3 to 6 of the Periodic Table. Nitrogen can adsorb bonded to the remaining metals of this set, but this is a metastable adsorption configuration. Although the TM@Ti2C surfaces with TM adsorbed on a B site display the highest affinity towards N2, there are no clear changes of behaviour in terms of N2 adsorption for TM adatoms that prefer different lattice sites. On all the TM@Ti2C systems with TM in the fourth period of the Periodic Table, the TM adatom is able to form a chemical bond with N2, with the TM-N2 interaction being strongest for Sc@Ti2C, with E ads = −4.00 eV, becoming weaker as we move along this period, achieving its weakest intensity for Co@Ti2C, with E ads = −2.81 eV, and then becoming stronger again. The lines corresponding to the TM elements of the fifth and sixth periods of the Periodic Table in Fig. 4 appear to attempt to follow the same behaviour as that of the fourth period – adsorption is strongest for metals from the leftmost groups and becomes weaker as one moves along the period. However, instead of peaking on group 9, they peak earlier, on the last TM element of each period that can bond with N2 on the TM@Ti2C surface. This is most likely due to the inability of TM@Ti2C with one of the last TM elements of periods 5 and 6 to bind N2, which necessarily causes the N2 adsorption energy on these surfaces to approach the one of the clean Ti2C MXene. To analyse the TM-N2 bonds in terms of electronic structure, we calculated the density of states (DOS), projected onto the TM adatom and the two N atoms of N2 adsorbed in every TM@Ti2C surface studied here. Fig. 5 shows the resulting plots for Sc@Ti2C, Co@Ti2C and Cd@Ti2C as examples and the plots for the remaining elements are shown in Figures S2, S3 and S4. The highest DOS of N2 is found on three peaks around 6 eV and around 2 eV below the Fermi energy, and most TMs also display DOS peaks at the same locations, as in the examples of Sc@Ti2C and Co@Ti2C (Fig. 5). The ones that do not present the same DOS features (e.g. Cd@Ti2C in Fig. 5) are the TMs that do not allow N2 to adsorb within bonding distance on TM@Ti2C, suggesting that the formation of a chemical bond with N2 is related to hybridization of electronic states near this energy range. To confirm this, we performed a crystal orbital Hamilton population (COHP) analysis[42,43] which provides information about the bonding or antibonding character to the band-structure energy, with results for the projected COHP (-pCOHP) N-N and N-TM bonding displayed in Fig. 5. In this context, a more positive -pCOHP value is associated with stronger bonding. As can be seen, the regions of interest are the same as those referred to in the analyses of the DOS, with significant N-TM bonding regions in the Sc@Ti2C and Co@Ti2C systems and negligible interactions for Cd@Ti2C. The integrated COHP (-IpCOHP) up to the Fermi level for the N-N interactions are 1.54, 2.07 and 2.12, for Sc@Ti2C, Co@Ti2C and Cd@Ti2C, respectively, showing that the N-N bond is more activated in the former, which is a consequence of the N-TM bonding that is greater in the case of Sc@Ti2C (average value for TM-Nnear and TM-Nfar bonding of 2.46) than on Co@Ti2C (average value of 1.58) and Cd@Ti2C (average value of 0.07). N2 dissociation Like N2 adsorption, N2 dissociation on the TM@Ti2C SACs also occurs in a manner similar to the mechanism on the Ti2C MXene surface. Namely, the N adatom that lies on HTi remains on this site, while the other N adatom moves from HC to a neighbouring HTi site, leading both N adatoms to finally sit on their most stable surface site. For TM@Ti2C systems in which the TM does not form a bond with N2, the N2 dissociation transition state is structurally nearly identical to the one on the Ti2C MXene. For the remaining TM elements, Fig. 6 shows the N2 dissociation transition state configurations for metals that adsorb on each surface site. Tables S2, S3 and S4 contain the N-N distance on each TM@Ti2C surface, for the adsorbed, transition and dissociated state of N2, respectively. Considering only the TM elements that bind N2 on TM@Ti2C, the average N-N distance in the transition state configuration is 1.77 Å, representing an increase of 27 % with respect to the molecular adsorption state. Whereas the average N-N bond length in the N2 adsorbed state is higher on TM@Ti2C than on Ti2C by 0.03 Å, the same bond length in the transition state is considerably shorter on TM@Ti2C than on Ti2C, by 0.14 Å. This means that, while on the Ti2C MXene the N-N bond length needs to increase by 0.56 Å for the dissociation transition state to be reached, on TM@Ti2C a stretching of 0.39 Å is enough on average. The fact that the bond length does not need to change as much for the reaction transition state to be achieved reveals an early transition state and is typical of a lower activation energy. The calculated N2 dissociation energy barriers on TM@Ti2C are shown in Fig. 7 and Table S5. The different behaviour of TM adatoms that can or cannot bind N2 on TM@Ti2C is well reflected in the corresponding N2 dissociation energy barriers. As expected, the latter exhibit energy barriers remarkably close to the one on the pristine Ti2C MXene, with a maximum deviation of 4 % (Ru@Ti2C), while the former differ by at least 18 % (Cu@Ti2C) and at most 84 % (Hf@Ti2C and W@Ti2C). Thus, the presence of TM adatoms that do not bind to N2 on the Ti2C MXene surface does not affect the N2 dissociation energy barrier. On the other hand, all the other TM adatoms effectively reduce this energy barrier by at least 18 % with respect to the bulk Ti2C MXene. The W@Ti2C SAC provides one of the lowest calculated energy barriers, 0.17 eV, which is noteworthy since W2N, a W-based MXene, has been predicted to be the pristine MXene that most easily dissociates N2, with an activation energy of 0.18 eV [20]. Many of the energy barriers calculated here are lower than the ones found for transition metal-based industrial catalysts, such as Fe or Ru, which display values above 0.4 eV, representing an advantage of the TM@Ti2C MXene surfaces. The configurations of adsorbed N2 in its dissociate state, with dissociation catalysed by TM@Ti2C surfaces in which the TM adatom binds to N2, are shown in Fig. 8 . If the TM element adsorbs on a HC (Fig. 8c) or HTi (Fig. 8d) surface site, it remains on this site upon N2 adsorption and dissociation, during which one of the N adatoms moves farther from both the other N and the TM adatoms. However, TM adatoms that adsorb preferably on a B site do not remain on this site after N2 dissociates. Instead, depending on the TM element, they move to either a nearby HC (Sc, Ti, or V, see Fig. 8a) or T (Y, Zr, Lu, Hf, or Ta, see Fig. 8b) site. Furthermore, these TM adatoms remain bonded to both N atoms after N2 dissociation, and have much smaller N-N distances after N2 dissociation (2.92 Å on average, see Table S4) than the other TM@Ti2C cases (3.19 Å on average). Figure S6 illustrates the two possible mechanisms for N2 dissociation near TM@Ti2C where TM adsorbs on a B site. This Figure shows that, as one N adatom moves from an HC site in the molecular state to an HTi site in the dissociated state, the TM adatom moves from a B site in the molecular state to an adjacent T site in the transition state. Finally, depending on the TM element, it can stay on the T site in the dissociated state, or further move to an HC site. For the latter to occur, the TM adatom must go through the line connecting the two N adatoms, or over it. Notice that the TMs that move to a HC site belong to the 4th period of the Periodic Table, while the ones that remain on the T site belong to the 5th and 6th periods. This suggests that the latter may be kinetically inhibited from moving to the HC site. To verify this, we took the dissociated configurations for TM = Y, Zr, Lu, Hf, and Ta, moved the TM adatom to the HC site, and reoptimized the atomic positions. The conclusion was that this new position is indeed more stable than the T site, by 0.4 to 0.7 eV, depending on the TM. Consequently, all the TM adatoms that adsorb preferably on a B site on Ti2C tend to thermodynamically move to an HC site after catalysing N2 dissociation, but the heavier ones, those of the 5th and 6th periods, are kinetically inhibited to do so and instead stay on the intermediate T site. The calculated N2 dissociation reaction energies on TM@Ti2C are displayed in Fig. 9 and Table S7. The reaction is clearly exothermic regardless of the TM element, especially in the cases in which the TM adatom adsorbs N2. For some TM elements, N2 dissociation on TM@Ti2C is more exothermic than on the Ti2C MXene by several eV. This indicates that N2 dissociation is thermodynamically very favourable, but may be undesired for catalytic applications, as the products of reactions that are too exothermic tend to be adsorbed too strongly on the surface, hindering its regeneration. In addition, as can be seen by comparing Fig. 7 and Fig. 9, the TM@Ti2C SACs that allow the lowest N2 dissociation energy barriers tend to be the ones that dissociate N2 more exothermically. Consequently, a balance must be found between a very easy N2 dissociation while risking having a hard time regenerating the catalyst, and a slightly higher energy barrier that leads to a less exothermic reaction and facilitates the restoration of the catalyst. As an attempt to find such a balance, and since we seek the lowest possible energy barrier accompanied by the least exothermic N2 dissociation, one can define the quantity α = E barr + | E reac | , which yields a lower number for lower energy barriers and a less exothermic reaction. The TM element for which α is lowest is Co, with the corresponding TM@Ti2C surface allowing N2 to dissociate with an energy barrier of 0.54 eV, which is half the one on the pristine Ti2C MXene, and a dissociation energy of −1.71 eV, that is, more exothermic than on the Ti2C MXene by only 0.28 eV. On the Ti2C and Co@Ti2C MXene surfaces, we recalculated the N2 dissociation reaction and activation energies, by doing single point energy calculations using the HSE06 hybrid functional [44]. On both materials, this functional predicted the energy barrier to be higher by 0.19 eV and the reaction to be more exothermic by 0.22 eV, so it is possible that HSE06 systematically yields such differences for other MXenes or SACs. Note that the HSE06 energies were obtained by single-point calculations on the PBE-relaxed structures, which is the usual method due to the extremely high computational demand of HSE06 calculations, especially when using the plane-wave formalism [45]. It is common for reactions of the same family to follow a linear relationship between activation and reaction energy, known as a Brønsted-Evans-Polanyi relationship [46,47]. Here, this appears to not be the case. Figure S5 shows a plot of E barr vs E reac for the 18 TM@Ti2C MXene surfaces studied in this work. By observation, the relationship between these two quantities is clearly not linear; the corresponding correlation coefficient is 0.75. Instead, as we move from right to left on the plot of Figure S5, the reaction energies decrease, while the energy barriers appear to decrease more slowly, while the straight line predicts negative N2 dissociation energy barriers for the TM@Ti2C surfaces on which the N2 adsorption energy is below −3 eV, which does not make sense. We attempted an exponential fit to the data points, and found a much more appropriate fit, with a correlation coefficient of 0.96. For ammonia synthesis to be completed, not only does nitrogen need to dissociate, but hydrogen also needs to adsorb and dissociate, and each resulting N adatom should be hydrogenated three times. On the pristine Ti2C MXene surface, H2 dissociates spontaneously [48]. On the other hand, the hydrogenation steps are expected to not occur as easily [19,20]. Table 2 shows the energy barriers and reaction energies for the successive N hydrogenations that lead to the formation of NH3, as calculated for W2N, Ti2C and Co@Ti2C. Data from W2N were obtained in Ref. [19], where microkinetic calculations showed that ammonia synthesis via the Haber-Bosch formula is not possible, since the hydrogenation does not get past the NH2 species. Generally speaking, the W2N MXene displays the lowest N hydrogenation energy barriers amongst the three materials in Table 2, and Co@Ti2C the highest. While the first hydrogenation is exothermic on the clean Ti2C MXene, it is endothermic, by 0.91 eV, on Co@Ti2C. Therefore, on Ti2C, the reaction is more likely to proceed in the forward direction than in reverse, effectively producing NH, but on Co@Ti2C the opposite is expected, since the forward activation energy is 1.65 eV and the backward one only 0.74 eV. On Co@Ti2C, the subsequent hydrogenations are even more energetically demanding, with energy barriers above 2 eV, and more endothermic, with reaction energies of 0.99 and 1.95 eV, respectively. Overall, these values are much higher than on either W2N or Ti2C. This suggests that hydrogenation towards NH3 is most likely kinetically inhibited on a TM@Ti2C MXene surface, more so than on clean Ti2C. In a sense, the doping of the MXene surface with atoms of transition metal elements enhances the usual behaviour of the original material, by further facilitating N2 dissociation, and further hindering the hydrogenation of the resulting N adatoms. These findings lead to the recommendation of combining TM@Ti2C MXenes with, for example, Ru nanoparticles to effectively realize ammonia synthesis via the Haber-Bosch route. So far, we have assumed that ammonia synthesis on these surfaces should follow a dissociative mechanism. This is because, firstly, from previous experience, we know that MXenes devoid of a surface termination excel at breaking adsorbed species into smaller ones and, therefore, it is difficult to form larger species on their surfaces [13,29]. Secondly, because the calculated N2 dissociation activation energies are so small that it becomes very unlikely that any other ammonia synthesis mechanism would be kinetically easier. Nevertheless, for the sake of completeness, we explored the possibility of an associative pathway on four systems: Ti2C, Co@Ti2C, Cu@Ti2C and Ti@Ti2C, i.e., the bare MXene and one TM@Ti2C MXene for each N2 adsorption configuration seen in Fig. 3. For that, we studied the N2* + H* → NNH* reaction by hydrogenating either one of the N adatoms, for a total of 8 calculated activation energies and reaction energies. We found that the hydrogenation occurs preferably on the N adatom that is sitting on a HC surface site. However, the reaction is endothermic in all cases, by 0.27 to 1.4 eV, and involves an energy barrier between 1.15 and 2.02 eV. Given the much lower activation and reaction energies calculated for N2 dissociation on the TM@Ti2C MXene surfaces, these results indicate that the dissociative pathway is favoured. Conclusions In summary, we have employed density functional theory-based calculations to assess the potential of single-atom catalysts, consisting of an atom of a transition metal element deposited on the Ti2C MXene surface, to dissociate N2, the rate-limiting step of the Haber-Bosch process for ammonia synthesis. To achieve this goal, we built 30 surface models of the Ti2C MXene, each with an atom of a different transition metal adsorbed on its most stable surface site. Then, on each of these models, we calculated the N2 adsorption energy, dissociation energy barrier, and dissociation energy. For 9 out of the 30 cases, viz. Ru, Rh, Pd, Ag, Cd, Ir, Pt, Au and Hg, the nitrogen molecule adsorbs far from the transition metal adatom, and its adsorption and dissociation mechanisms are nearly identical to those on the clean Ti2C MXene, indicating that atoms of these elements supported on this MXene do not significantly change its catalytic activity towards N2 dissociation. For the remaining 21 transition metals, N2 adsorption is exothermic, but it is only more advantageous when compared to adsorption on the bulk Ti2C MXene for metals of groups 3 to 6 of the Periodic Table. Nevertheless, according to our calculations, a single adatom of any of these 21 elements effectively reduces the N2 dissociation activation energy with respect to the clean Ti2C MXene, by 18 to 84 %. The reaction was found to be more exothermic than on the Ti2C MXene in all cases. In conclusion, we found that single-atom catalysts, based on the majority of the transition metal elements considered here, represent a significant improvement of the catalytic activity of the Ti2C MXene surface for dissociating N2. One shortcoming of the models used in this work is the lack of MXene surface termination, known to be present upon MXene synthesis. This may be the subject of future work. Further analysis may also include the investigation of the effect of single transition metal adatoms in the catalytic activity towards N2 dissociation of other MXenes that have been synthesised, such as V2C, Nb2C or Mo2C, and whether MXene thickness affects the catalytic behaviour. CRediT authorship contribution statement José D. Gouveia: Conceptualization, Formal analysis, Investigation, Writing – original draft, Visualization. Henrique Rocha: Investigation, Formal analysis, Writing – review & editing. José R.B. Gomes: Conceptualization, Resources, Writing – review & editing, Supervision, Project administration, Funding acquisition. Declaration of Competing Interest The authors declare that they have no known competing financial interests or personal relationships that could have appeared to influence the work reported in this paper. Acknowledgements This work was developed within the scope of the project CICECO-Aveiro Institute of Materials, Refs. UIDB/50011/2020, UIDP/50011/2020 and LA/P/0006/2020, financed by national funds through the FCT/MCTES (PIDDAC). JDG thanks the Portuguese Foundation for Science and Technology (FCT) through the grant Ref. 2022.00719.CEECIND, in the scope of the Individual Call to Scientific Employment Stimulus – 5th Edition. We are also thankful to FCT I.P. for the computational resources granted in the framework of project Ref. 2021.09799.CPCA by the FCT/CPCA/2021/01 Call for Advanced Computing Projects. Supplementary materials Supplementary material associated with this article can be found, in the online version, at doi:10.1016/j.mcat.2023.113373. Appendix Supplementary materials Image, application 1 References [1] T. Kandemir M.E. Schuster A. Senyshyn M. Behrens R. Schlögl The haber-bosch process revisited: on the real structure and stability of “ammonia iron” under working conditions Angew. Chemie Int. Ed. 52 48 2013 12723 12726 10.1002/anie.201305812 Kandemir, T.; Schuster, M.E.; Senyshyn, A.; Behrens, M.; Schlögl, R. The haber-bosch process revisited: on the real structure and stability of “ammonia iron” under working conditions. Angew. Chemie Int. Ed. 2013, 52 (48), 12723–12726. 10.1002/anie.201305812. [2] L. Lassaletta G. Billen B. Grizzetti J. Anglade J. Garnier 50 year trends in nitrogen use efficiency of world cropping systems: the relationship between yield and nitrogen input to cropland Environ. Res. Lett. 9 10 2014 105011 10.1088/1748-9326/9/10/105011 Lassaletta, L.; Billen, G.; Grizzetti, B.; Anglade, J.; Garnier, J. 50 year trends in nitrogen use efficiency of world cropping systems: the relationship between yield and nitrogen input to cropland. Environ. Res. Lett. 2014, 9 (10), 105011. 10.1088/1748-9326/9/10/105011. [3] A. Valera-Medina H. Xiao M. Owen-Jones W.I.F. David P.J. Bowen Ammonia for power Prog. Energy Combust. Sci. 69 2018 63 102 10.1016/j.pecs.2018.07.001 Valera-Medina, A.; Xiao, H.; Owen-Jones, M.; David, W.I.F.; Bowen, P.J. Ammonia for power. Prog. Energy Combust. Sci. 2018, 69, 63–102. 10.1016/j.pecs.2018.07.001. [4] R.V. Afonso J.D. Gouveia J.R.B Gomes Catalytic reactions for H 2 production on multimetallic surfaces: a review J. Phys. Energy 3 3 2021 032016 10.1088/2515-7655/ac0d9f Afonso, R.V.; Gouveia, J.D.; Gomes, J.R.B. Catalytic reactions for H 2 production on multimetallic surfaces: a review. J. Phys. Energy 2021, 3 (3), 032016. 10.1088/2515-7655/ac0d9f. [5] N. Spencer Iron single crystals as ammonia synthesis catalysts: effect of surface structure on catalyst activity J. Catal. 74 1 1982 129 135 10.1016/0021-9517(82)90016-1 SPENCER, N. Iron single crystals as ammonia synthesis catalysts: effect of surface structure on catalyst activity. J. Catal. 1982, 74 (1), 129–135. 10.1016/0021-9517(82)90016-1. [6] K. Honkala A. Hellman I.N. Remediakis A. Logadottir A. Carlsson S. Dahl C.H. Christensen J.K. Nørskov Ammonia synthesis from first-principles calculations Science (80) 307 5709 2005 555 558 10.1126/science.1106435 Honkala, K.; Hellman, A.; Remediakis, I.N.; Logadottir, A.; Carlsson, A.; Dahl, S.; Christensen, C.H.; Nørskov, J.K. Ammonia synthesis from first-principles calculations. Science (80). 2005, 307 (5709), 555–558. 10.1126/science.1106435. [7] P. Rochana K. Lee J. Wilcox Nitrogen adsorption, dissociation, and subsurface diffusion on the vanadium (110) surface: a DFT study for the nitrogen-selective catalytic membrane application J. Phys. Chem. C 118 8 2014 4238 4249 10.1021/jp411763k Rochana, P.; Lee, K.; Wilcox, J. Nitrogen adsorption, dissociation, and subsurface diffusion on the vanadium (110) surface: a DFT study for the nitrogen-selective catalytic membrane application. J. Phys. Chem. C 2014, 118 (8), 4238–4249. 10.1021/jp411763k. [8] M. Naguib M. Kurtoglu V. Presser J. Lu J. Niu M. Heon L. Hultman Y. Gogotsi M.W. Barsoum Two-dimensional nanocrystals produced by exfoliation of Ti3AlC2 Adv. Mater. 23 37 2011 4248 4253 10.1002/adma.201102306 Naguib, M.; Kurtoglu, M.; Presser, V.; Lu, J.; Niu, J.; Heon, M.; Hultman, L.; Gogotsi, Y.; Barsoum, M.W. Two-dimensional nanocrystals produced by exfoliation of Ti3AlC2. Adv. Mater. 2011, 23 (37), 4248–4253. 10.1002/adma.201102306. [9] A. Vojvodic A.J. Medford F. Studt F. Abild-Pedersen T.S. Khan T. Bligaard J.K. Nørskov Exploring the limits: a low-pressure, low-temperature haber–bosch process Chem. Phys. Lett. 598 2014 108 112 10.1016/j.cplett.2014.03.003 Vojvodic, A.; Medford, A.J.; Studt, F.; Abild-Pedersen, F.; Khan, T.S.; Bligaard, T.; Nørskov, J.K. Exploring the limits: a low-pressure, low-temperature haber–bosch process. Chem. Phys. Lett. 2014, 598, 108–112. 10.1016/j.cplett.2014.03.003. [10] E.B. Deeva A. Kurlov P.M. Abdala D. Lebedev S.M. Kim C.P. Gordon A. Tsoukalou A. Fedorov C.R.In Müller Situ XANES/XRD study of the structural stability of two-dimensional molybdenum carbide Mo2CTX : implications for the catalytic activity in the water–gas shift reaction Chem. Mater. 31 12 2019 4505 4513 10.1021/acs.chemmater.9b01105 Deeva, E.B.; Kurlov, A.; Abdala, P.M.; Lebedev, D.; Kim, S.M.; Gordon, C.P.; Tsoukalou, A.; Fedorov, A.; Müller, C.R.In Situ XANES/XRD study of the structural stability of two-dimensional molybdenum carbide Mo 2 CT X : implications for the catalytic activity in the water–gas shift reaction. Chem. Mater. 2019, 31 (12), 4505–4513. 10.1021/acs.chemmater.9b01105. [11] U. Yorulmaz A. Özden N.K. Perkgöz F. Ay C. Sevik Vibrational and mechanical properties of single layer MXene structures: a first-principles investigation Nanotechnology 27 33 2016 335702 10.1088/0957-4484/27/33/335702 Yorulmaz, U.; Özden, A.; Perkgöz, N.K.; Ay, F.; Sevik, C. Vibrational and mechanical properties of single layer MXene structures: a first-principles investigation. Nanotechnology 2016, 27 (33), 335702. 10.1088/0957-4484/27/33/335702. [12] Z. Li Y. Wu 2D early transition metal carbides (MXenes) for catalysis Small 15 29 2019 1804736 10.1002/smll.201804736 Li, Z.; Wu, Y. 2D early transition metal carbides (MXenes) for catalysis. Small 2019, 15 (29), 1804736. 10.1002/smll.201804736. [13] J.D. Gouveia Á. Morales-García F. Viñes F. Illas J.R.B. Gomes MXenes as promising catalysts for water dissociation Appl. Catal. B Environ. 260 2020 118191 10.1016/j.apcatb.2019.118191 Gouveia, J.D.; Morales-García, Á.; Viñes, F.; Illas, F.; Gomes, J.R.B. MXenes as promising catalysts for water dissociation. Appl. Catal. B Environ. 2020, 260, 118191. 10.1016/j.apcatb.2019.118191. [14] J.D. Gouveia J.R.B. Gomes The determining role of T species in the catalytic potential of MXenes: water adsorption and dissociation on Mo2CT Catal. Today 2022 10.1016/j.cattod.2022.07.016 Gouveia, J.D.; Gomes, J.R.B. The determining role of T species in the catalytic potential of MXenes: water adsorption and dissociation on Mo2CT. Catal. Today 2022. 10.1016/j.cattod.2022.07.016. [15] R. Morales-Salvador J.D. Gouveia Á. Morales-García F. Viñes J.R.B. Gomes F. Illas Carbon capture and usage by MXenes ACS Catal 11 17 2021 11248 11255 10.1021/acscatal.1c02663 Morales-Salvador, R.; Gouveia, J.D.; Morales-García, Á.; Viñes, F.; Gomes, J.R.B.; Illas, F. Carbon capture and usage by MXenes. ACS Catal. 2021, 11 (17), 11248–11255. 10.1021/acscatal.1c02663. [16] R. Morales-Salvador Á. Morales-García F. Viñes F. Illas Two-dimensional nitrides as highly efficient potential candidates for CO2 capture and activation Phys. Chem. Chem. Phys. 20 25 2018 17117 17124 10.1039/C8CP02746C Morales-Salvador, R.; Morales-García, Á.; Viñes, F.; Illas, F. Two-dimensional nitrides as highly efficient potential candidates for CO 2 capture and activation. Phys. Chem. Chem. Phys. 2018, 20 (25), 17117–17124. 10.1039/C8CP02746C. [17] I. Persson J. Halim H. Lind T.W. Hansen J.B. Wagner L.Å. Näslund V. Darakchieva J. Palisaitis J. Rosen P.O.Å. Persson 2D transition metal carbides (MXenes) for carbon capture Adv. Mater. 31 2 2019 1805472 10.1002/adma.201805472 Persson, I.; Halim, J.; Lind, H.; Hansen, T.W.; Wagner, J.B.; Näslund, L.Å.; Darakchieva, V.; Palisaitis, J.; Rosen, J.; Persson, P.O.Å. 2D transition metal carbides (MXenes) for carbon capture. Adv. Mater. 2019, 31 (2), 1805472. 10.1002/adma.201805472. [18] S. Yi G. Liu Z. Liu W. Hu H. Deng Theoretical insights into nitrogen fixation on Ti2C and Ti2CO2 in a lithium–nitrogen battery J. Mater. Chem. A 7 34 2019 19950 19960 10.1039/C9TA06232G Yi, S.; Liu, G.; Liu, Z.; Hu, W.; Deng, H. Theoretical insights into nitrogen fixation on Ti 2 C and Ti 2 CO 2 in a lithium–nitrogen battery. J. Mater. Chem. A 2019, 7 (34), 19950–19960. 10.1039/C9TA06232G. [19] J.D. Gouveia Á. Morales-García F. Viñes J.R.B. Gomes F. Illas Facile heterogeneously catalyzed nitrogen fixation by MXenes ACS Catal 10 9 2020 5049 5056 10.1021/acscatal.0c00935 Gouveia, J.D.; Morales-García, Á.; Viñes, F.; Gomes, J.R.B.; Illas, F. Facile heterogeneously catalyzed nitrogen fixation by MXenes. ACS Catal. 2020, 10 (9), 5049–5056. 10.1021/acscatal.0c00935. [20] J.D. Gouveia F. Viñes F. Illas J.R.B. Gomes MXenes atomic layer stacking phase transitions and their chemical activity consequences Phys. Rev. Mater. 4 5 2020 054003 10.1103/PhysRevMaterials.4.054003 Gouveia, J.D.; Viñes, F.; Illas, F.; Gomes, J.R.B. MXenes atomic layer stacking phase transitions and their chemical activity consequences. Phys. Rev. Mater. 2020, 4 (5), 054003. 10.1103/PhysRevMaterials.4.054003. [21] G. Murali J.K. Reddy Modigunta Y.H. Park J.H. Lee J. Rawal S.Y. Lee I. In S.J. Park A review on MXene synthesis, stability, and photocatalytic applications ACS Nano 16 9 2022 13370 13429 10.1021/acsnano.2c04750 Murali, G.; Reddy Modigunta, J.K.; Park, Y.H.; Lee, J.H.; Rawal, J.; Lee, S.Y.; In, I.; Park, S.J. A review on MXene synthesis, stability, and photocatalytic applications. ACS Nano 2022, 16 (9), 13370–13429. 10.1021/acsnano.2c04750. [22] Q. Peng X. Zhang Z. Geng Z. Yang J. Yang Single Zn atom catalyst on Ti2CN2 MXenes for efficient CO oxidation Phys. E Low-dimensional Syst. Nanostructures 147 2023 115595 10.1016/j.physe.2022.115595 Peng, Q.; Zhang, X.; Geng, Z.; Yang, Z.; Yang, J. Single Zn atom catalyst on Ti2CN2 MXenes for efficient CO oxidation. Phys. E Low-dimensional Syst. Nanostructures 2023, 147, 115595. 10.1016/j.physe.2022.115595. [23] D. Zhao Z. Chen W. Yang S. Liu X. Zhang Y. Yu W.C. Cheong L. Zheng F. Ren G. Ying X. Cao D. Wang Q. Peng G. Wang C.MXene Chen Ti3C2 vacancy-confined single-atom catalyst for efficient functionalization of CO2 J. Am. Chem. Soc. 141 9 2019 4086 4093 10.1021/jacs.8b13579 Zhao, D.; Chen, Z.; Yang, W.; Liu, S.; Zhang, X.; Yu, Y.; Cheong, W.C.; Zheng, L.; Ren, F.; Ying, G.; Cao, X.; Wang, D.; Peng, Q.; Wang, G.; Chen, C.MXene (Ti 3 C 2) vacancy-confined single-atom catalyst for efficient functionalization of CO 2. J. Am. Chem. Soc. 2019, 141 (9), 4086–4093. 10.1021/jacs.8b13579. [24] H. Rocha J.D. Gouveia J.R.B. Gomes Transition metal atom adsorption on the titanium carbide mxene: trends across the periodic table for the bare and O-terminated surfaces Phys. Rev. Mater. 6 10 2022 105801 10.1103/PhysRevMaterials.6.105801 Rocha, H.; Gouveia, J.D.; Gomes, J.R.B. Transition metal atom adsorption on the titanium carbide mxene: trends across the periodic table for the bare and o-terminated surfaces. Phys. Rev. Mater. 2022, 6 (10), 105801. 10.1103/PhysRevMaterials.6.105801. [25] H. Oschinski Á. Morales-García F Illas Interaction of first row transition metals with M2C (M = Ti, Zr, Hf, V, Nb, Ta, Cr, Mo, and W) MXenes: a quest for single-atom catalysts J. Phys. Chem. C 125 4 2021 2477 2484 10.1021/acs.jpcc.0c10877 Oschinski, H.; Morales-García, Á.; Illas, F. Interaction of first row transition metals with M 2 C (M = Ti, Zr, Hf, V, Nb, Ta, Cr, Mo, and W) MXenes: a quest for single-atom catalysts. J. Phys. Chem. C 2021, 125 (4), 2477–2484. 10.1021/acs.jpcc.0c10877. [26] G. Kresse J. Furthmüller Efficient iterative schemes for ab initio total-energy calculations using a plane-wave basis set Phys. Rev. B 54 16 1996 11169 11186 10.1103/PhysRevB.54.11169 Kresse, G.; Furthmüller, J. Efficient iterative schemes for ab initio total-energy calculations using a plane-wave basis set. Phys. Rev. B 1996, 54 (16), 11169–11186. 10.1103/PhysRevB.54.11169. [27] J.P. Perdew K. Burke M. Ernzerhof Generalized gradient approximation made simple Phys. Rev. Lett. 77 18 1996 3865 3868 10.1103/PhysRevLett.77.3865 Perdew, J.P.; Burke, K.; Ernzerhof, M. Generalized gradient approximation made simple. Phys. Rev. Lett. 1996, 77 (18), 3865–3868. 10.1103/PhysRevLett.77.3865. [28] S. Grimme J. Antony S. Ehrlich H. Krieg A consistent and accurate ab initio parametrization of Density Functional Dispersion Correction (DFT-D) for the 94 elements H-Pu J. Chem. Phys. 132 15 2010 154104 10.1063/1.3382344 Grimme, S.; Antony, J.; Ehrlich, S.; Krieg, H. A consistent and accurate ab initio parametrization of Density Functional Dispersion Correction (DFT-D) for the 94 elements H-Pu. J. Chem. Phys. 2010, 132 (15), 154104. 10.1063/1.3382344. [29] J.D. Gouveia G. Novell-Leruth P.M.L.S. Reis F. Viñes F. Illas J.R.B. Gomes First-principles calculations on the adsorption behavior of amino acids on a titanium carbide MXene ACS Appl. Bio Mater. 3 9 2020 5913 5921 10.1021/acsabm.0c00621 Gouveia, J.D.; Novell-Leruth, G.; Reis, P.M.L.S.; Viñes, F.; Illas, F.; Gomes, J.R.B. First-principles calculations on the adsorption behavior of amino acids on a titanium carbide MXene. ACS Appl. Bio Mater. 2020, 3 (9), 5913–5921. 10.1021/acsabm.0c00621. [30] J.D. Gouveia G. Novell-Leruth F. Viñes F. Illas J.R.B. Gomes The Ti2CO2 MXene as a nucleobase 2D sensor: a first-principles study Appl. Surf. Sci. 544 2021 148946 10.1016/j.apsusc.2021.148946 Gouveia, J.D.; Novell-Leruth, G.; Viñes, F.; Illas, F.; Gomes, J.R.B. The Ti2CO2 MXene as a nucleobase 2D sensor: a first-principles study. Appl. Surf. Sci. 2021, 544, 148946. 10.1016/j.apsusc.2021.148946. [31] M. Bordonhos T.L.P. Galvão J.R.B. Gomes J.D. Gouveia M. Jorge M.A.O. Lourenço J.M. Pereira G. Pérez-Sánchez M.L. Pinto C.M. Silva J. Tedim B. Zêzere Multiscale computational approaches toward the understanding of materials Adv. Theory Simulations 2022 2200628 10.1002/adts.202200628 Bordonhos, M.; Galvão, T.L.P.; Gomes, J.R.B.; Gouveia, J.D.; Jorge, M.; Lourenço, M.A.O.; Pereira, J.M.; Pérez-Sánchez, G.; Pinto, M.L.; Silva, C.M.; Tedim, J.; Zêzere, B. Multiscale computational approaches toward the understanding of materials. Adv. Theory Simulations 2022, 2200628. 10.1002/adts.202200628. [32] A.M. Patel S. Ringe S. Siahrostami M. Bajdich J.K. Nørskov A.R. Kulkarni Theoretical approaches to describing the oxygen reduction reaction activity of single-atom catalysts J. Phys. Chem. C 122 51 2018 29307 29318 10.1021/acs.jpcc.8b09430 Patel, A.M.; Ringe, S.; Siahrostami, S.; Bajdich, M.; Nørskov, J.K.; Kulkarni, A.R. Theoretical approaches to describing the oxygen reduction reaction activity of single-atom catalysts. J. Phys. Chem. C 2018, 122 (51), 29307–29318. 10.1021/acs.jpcc.8b09430. [33] I. Barlocco L.A. Cipriano G. Di Liberto G. Pacchioni Modeling hydrogen and oxygen evolution reactions on single atom catalysts with density functional theory: role of the functional Adv. Theory Simulations 2022 2200513 10.1002/adts.202200513 Barlocco, I.; Cipriano, L.A.; Di Liberto, G.; Pacchioni, G. Modeling hydrogen and oxygen evolution reactions on single atom catalysts with density functional theory: role of the functional. Adv. Theory Simulations 2022, 2200513. 10.1002/adts.202200513. [34] Y. Xie P.R.C. Kent Hybrid density functional study of structural and electronic properties of functionalized Tin+1Xn (X=C, N) monolayers Phys. Rev. B 87 23 2013 235441 10.1103/PhysRevB.87.235441 Xie, Y.; Kent, P.R.C. Hybrid density functional study of structural and electronic properties of functionalized Tin+1Xn (X=C, N) monolayers. Phys. Rev. B 2013, 87 (23), 235441. 10.1103/PhysRevB.87.235441. [35] S. Guha A. Kabiraj S. Mahapatra High-throughput design of functional-engineered MXene transistors with low-resistive contacts NPJ Comput. Mater. 8 1 2022 202 10.1038/s41524-022-00885-6 Guha, S.; Kabiraj, A.; Mahapatra, S. High-throughput design of functional-engineered MXene transistors with low-resistive contacts. NPJ Comput. Mater. 2022, 8 (1), 202. 10.1038/s41524-022-00885-6. [36] J.D. Gouveia J.R.B. Gomes Structural and energetic properties of vacancy defects in MXene surfaces Phys. Rev. Mater. 6 2 2022 024004 10.1103/PhysRevMaterials.6.024004 Gouveia, J.D.; Gomes, J.R.B. Structural and energetic properties of vacancy defects in MXene surfaces. Phys. Rev. Mater. 2022, 6 (2), 024004. 10.1103/PhysRevMaterials.6.024004. [37] P.E. Blöchl Projector augmented-wave method Phys. Rev. B 50 24 1994 17953 17979 10.1103/PhysRevB.50.17953 Blöchl, P.E. Projector augmented-wave method. Phys. Rev. B 1994, 50 (24), 17953–17979. 10.1103/PhysRevB.50.17953. [38] H.J. Monkhorst J.D. Pack Special points for brillouin-zone integrations Phys. Rev. B 13 12 1976 5188 5192 10.1103/PhysRevB.13.5188 Monkhorst, H.J.; Pack, J.D. Special points for brillouin-zone integrations. Phys. Rev. B 1976, 13 (12), 5188–5192. 10.1103/PhysRevB.13.5188. [39] G. Henkelman H. Jónsson A dimer method for finding saddle points on high dimensional potential surfaces using only first derivatives J. Chem. Phys. 111 15 1999 7010 7022 10.1063/1.480097 Henkelman, G.; Jónsson, H. A dimer method for finding saddle points on high dimensional potential surfaces using only first derivatives. J. Chem. Phys. 1999, 111 (15), 7010–7022. 10.1063/1.480097. [40] G. Di Liberto L.A. Cipriano G. Pacchioni Role of dihydride and dihydrogen complexes in hydrogen evolution reaction on single-atom catalysts J. Am. Chem. Soc. 143 48 2021 20431 20441 10.1021/jacs.1c10470 Di Liberto, G.; Cipriano, L.A.; Pacchioni, G. Role of dihydride and dihydrogen complexes in hydrogen evolution reaction on single-atom catalysts. J. Am. Chem. Soc. 2021, 143 (48), 20431–20441. 10.1021/jacs.1c10470. [41] L.A. Cipriano G. Di Liberto G. Pacchioni Superoxo and peroxo complexes on single-atom catalysts: impact on the oxygen evolution reaction ACS Catal. 12 19 2022 11682 11691 10.1021/acscatal.2c03020 Cipriano, L.A.; Di Liberto, G.; Pacchioni, G. Superoxo and peroxo complexes on single-atom catalysts: impact on the oxygen evolution reaction. ACS Catal.. 2022, 12 (19), 11682–11691. 10.1021/acscatal.2c03020. [42] V.L. Deringer A.L. Tchougréeff R. Dronskowski Crystal Orbital Hamilton Population (COHP) analysis as projected from plane-wave basis sets J. Phys. Chem. A 115 21 2011 5461 5466 10.1021/jp202489s Deringer, V.L.; Tchougréeff, A.L.; Dronskowski, R. Crystal Orbital Hamilton Population (COHP) analysis as projected from plane-wave basis sets. J. Phys. Chem. A 2011, 115 (21), 5461–5466. 10.1021/jp202489s. [43] S. Maintz V.L. Deringer A.L. Tchougréeff R. Dronskowski LOBSTER: a tool to extract chemical bonding from plane-wave based DFT J. Comput. Chem. 37 11 2016 1030 1035 10.1002/jcc.24300 Maintz, S.; Deringer, V.L.; Tchougréeff, A.L.; Dronskowski, R. LOBSTER: a tool to extract chemical bonding from plane-wave based DFT. J. Comput. Chem. 2016, 37 (11), 1030–1035. 10.1002/jcc.24300. [44] J. Heyd G.E. Scuseria M. Ernzerhof Hybrid functionals based on a screened coulomb potential J. Chem. Phys. 118 18 2003 8207 8215 10.1063/1.1564060 Heyd, J.; Scuseria, G.E.; Ernzerhof, M. Hybrid functionals based on a screened coulomb potential. J. Chem. Phys. 2003, 118 (18), 8207–8215. 10.1063/1.1564060. [45] J.D. Gouveia J. Coutinho Can we rely on hybrid-DFT energies of solid-state problems with local-DFT geometries? Electron. Struct. 1 1 2019 015008 10.1088/2516-1075/aafc4b Gouveia, J.D.; Coutinho, J. Can we rely on hybrid-DFT energies of solid-state problems with local-DFT geometries? Electron. Struct. 2019, 1 (1), 015008. 10.1088/2516-1075/aafc4b. [46] J.N. Bronsted Acid and basic catalysis Chem. Rev. 5 3 1928 231 338 10.1021/cr60019a001 Bronsted, J.N. Acid and basic catalysis. Chem. Rev. 1928, 5 (3), 231–338. 10.1021/cr60019a001. [47] M.G. Evans M. Polanyi Inertia and driving force of chemical reactions Trans. Faraday Soc. 34 1938 11 10.1039/tf9383400011 Evans, M.G.; Polanyi, M. Inertia and driving force of chemical reactions. Trans. Faraday Soc. 1938, 34, 11. 10.1039/tf9383400011. [48] J.D. Gouveia J.R.B. Gomes Effect of the surface termination on the adsorption of flue gas by the titanium carbide MXene Mater. Today Chem. 29 2023 101441 10.1016/j.mtchem.2023.101441 Gouveia, J.D.; Gomes, J.R.B. Effect of the surface termination on the adsorption of flue gas by the titanium carbide MXene. Mater. Today Chem. 2023, 29, 101441. 10.1016/j.mtchem.2023.101441.",
      "scopus-id": "85165109804",
      "coredata": {
        "eid": "1-s2.0-S2468823123004571",
        "dc:description": "Industrial ammonia production follows the Haber-Bosch process, whose rate-limiting step is the dissociation of the nitrogen molecule (N2), hence requiring suitable catalysts to break its triple bond. MXenes, a class of two-dimensional transition metal carbides and nitrides, have been proposed as very efficient catalysts for N2 dissociation. Here, by employing density functional theory-based calculations, we assess whether the deposition of one atom of a transition metal element (TM) on the Ti2C MXene surface further improves the catalytic potential of the MXene, serving as a single-atom catalyst. The results show that, for 21 of the 30 TMs considered, N2 can exothermically bind to the TM adatom, this bonding being favourable with respect to adsorption on the pristine Ti2C MXene surface for TMs of groups 3 to 6 of the Periodic Table. All the 21 TMs that successfully bind to N2 effectively reduce the N2 dissociation energy barrier when compared to the bulk Ti2C MXene by 18 to 84 %. Our results strongly indicate that doping the Ti2C MXene with atoms of transition metal elements significantly reduces the energy required to break the triple bond in N2, which may impact the nitrogen-to-ammonia process.",
        "openArchiveArticle": "false",
        "prism:coverDate": "2023-08-31",
        "openaccessUserLicense": "http://creativecommons.org/licenses/by/4.0/",
        "prism:aggregationType": "Journal",
        "prism:url": "https://api.elsevier.com/content/article/pii/S2468823123004571",
        "dc:creator": [
          {
            "@_fa": "true",
            "$": "Gouveia, José D."
          },
          {
            "@_fa": "true",
            "$": "Rocha, Henrique"
          },
          {
            "@_fa": "true",
            "$": "Gomes, José R.B."
          }
        ],
        "link": [
          {
            "@_fa": "true",
            "@rel": "self",
            "@href": "https://api.elsevier.com/content/article/pii/S2468823123004571"
          },
          {
            "@_fa": "true",
            "@rel": "scidir",
            "@href": "https://www.sciencedirect.com/science/article/pii/S2468823123004571"
          }
        ],
        "dc:format": "application/json",
        "openaccessType": "Full",
        "pii": "S2468-8231(23)00457-1",
        "prism:volume": "547",
        "articleNumber": "113373",
        "prism:publisher": "The Authors. Published by Elsevier B.V.",
        "dc:title": "MXene-supported transition metal single-atom catalysts for nitrogen dissociation",
        "prism:copyright": "© 2023 The Authors. Published by Elsevier B.V.",
        "openaccess": "1",
        "prism:issn": "24688231",
        "dcterms:subject": [
          {
            "@_fa": "true",
            "$": "MXenes"
          },
          {
            "@_fa": "true",
            "$": "Density functional theory"
          },
          {
            "@_fa": "true",
            "$": "Adsorption"
          },
          {
            "@_fa": "true",
            "$": "Single-atom catalysts"
          },
          {
            "@_fa": "true",
            "$": "Nitrogen dissociation"
          }
        ],
        "openaccessArticle": "true",
        "prism:publicationName": "Molecular Catalysis",
        "openaccessSponsorType": "FundingBody",
        "prism:pageRange": "113373",
        "pubType": "fla",
        "prism:coverDisplayDate": "August 2023",
        "prism:doi": "10.1016/j.mcat.2023.113373",
        "prism:startingPage": "113373",
        "dc:identifier": "doi:10.1016/j.mcat.2023.113373",
        "openaccessSponsorName": "Portugal institutions 2022: Hybrid journals"
      },
      "objects": {
        "object": [
          {
            "@category": "standard",
            "@height": "143",
            "@width": "489",
            "@_fa": "true",
            "$": "https://api.elsevier.com/content/object/eid/1-s2.0-S2468823123004571-gr3.jpg?httpAccept=%2A%2F%2A",
            "@multimediatype": "JPEG image file",
            "@type": "IMAGE-DOWNSAMPLED",
            "@size": "29781",
            "@ref": "gr3",
            "@mimetype": "image/jpeg"
          },
          {
            "@category": "standard",
            "@height": "226",
            "@width": "489",
            "@_fa": "true",
            "$": "https://api.elsevier.com/content/object/eid/1-s2.0-S2468823123004571-gr2.jpg?httpAccept=%2A%2F%2A",
            "@multimediatype": "JPEG image file",
            "@type": "IMAGE-DOWNSAMPLED",
            "@size": "46760",
            "@ref": "gr2",
            "@mimetype": "image/jpeg"
          },
          {
            "@category": "standard",
            "@height": "200",
            "@width": "447",
            "@_fa": "true",
            "$": "https://api.elsevier.com/content/object/eid/1-s2.0-S2468823123004571-ga1.jpg?httpAccept=%2A%2F%2A",
            "@multimediatype": "JPEG image file",
            "@type": "IMAGE-DOWNSAMPLED",
            "@size": "28273",
            "@ref": "ga1",
            "@mimetype": "image/jpeg"
          },
          {
            "@category": "standard",
            "@height": "609",
            "@width": "659",
            "@_fa": "true",
            "$": "https://api.elsevier.com/content/object/eid/1-s2.0-S2468823123004571-gr5.jpg?httpAccept=%2A%2F%2A",
            "@multimediatype": "JPEG image file",
            "@type": "IMAGE-DOWNSAMPLED",
            "@size": "88514",
            "@ref": "gr5",
            "@mimetype": "image/jpeg"
          },
          {
            "@category": "standard",
            "@height": "253",
            "@width": "357",
            "@_fa": "true",
            "$": "https://api.elsevier.com/content/object/eid/1-s2.0-S2468823123004571-gr4.jpg?httpAccept=%2A%2F%2A",
            "@multimediatype": "JPEG image file",
            "@type": "IMAGE-DOWNSAMPLED",
            "@size": "25904",
            "@ref": "gr4",
            "@mimetype": "image/jpeg"
          },
          {
            "@category": "standard",
            "@height": "255",
            "@width": "357",
            "@_fa": "true",
            "$": "https://api.elsevier.com/content/object/eid/1-s2.0-S2468823123004571-gr7.jpg?httpAccept=%2A%2F%2A",
            "@multimediatype": "JPEG image file",
            "@type": "IMAGE-DOWNSAMPLED",
            "@size": "26086",
            "@ref": "gr7",
            "@mimetype": "image/jpeg"
          },
          {
            "@category": "standard",
            "@height": "140",
            "@width": "489",
            "@_fa": "true",
            "$": "https://api.elsevier.com/content/object/eid/1-s2.0-S2468823123004571-gr6.jpg?httpAccept=%2A%2F%2A",
            "@multimediatype": "JPEG image file",
            "@type": "IMAGE-DOWNSAMPLED",
            "@size": "29842",
            "@ref": "gr6",
            "@mimetype": "image/jpeg"
          },
          {
            "@category": "standard",
            "@height": "255",
            "@width": "357",
            "@_fa": "true",
            "$": "https://api.elsevier.com/content/object/eid/1-s2.0-S2468823123004571-gr9.jpg?httpAccept=%2A%2F%2A",
            "@multimediatype": "JPEG image file",
            "@type": "IMAGE-DOWNSAMPLED",
            "@size": "25874",
            "@ref": "gr9",
            "@mimetype": "image/jpeg"
          },
          {
            "@category": "standard",
            "@height": "151",
            "@width": "565",
            "@_fa": "true",
            "$": "https://api.elsevier.com/content/object/eid/1-s2.0-S2468823123004571-gr8.jpg?httpAccept=%2A%2F%2A",
            "@multimediatype": "JPEG image file",
            "@type": "IMAGE-DOWNSAMPLED",
            "@size": "35894",
            "@ref": "gr8",
            "@mimetype": "image/jpeg"
          },
          {
            "@category": "standard",
            "@height": "231",
            "@width": "263",
            "@_fa": "true",
            "$": "https://api.elsevier.com/content/object/eid/1-s2.0-S2468823123004571-gr1.jpg?httpAccept=%2A%2F%2A",
            "@multimediatype": "JPEG image file",
            "@type": "IMAGE-DOWNSAMPLED",
            "@size": "30311",
            "@ref": "gr1",
            "@mimetype": "image/jpeg"
          },
          {
            "@category": "thumbnail",
            "@height": "64",
            "@width": "219",
            "@_fa": "true",
            "$": "https://api.elsevier.com/content/object/eid/1-s2.0-S2468823123004571-gr3.sml?httpAccept=%2A%2F%2A",
            "@multimediatype": "GIF image file",
            "@type": "IMAGE-THUMBNAIL",
            "@size": "13386",
            "@ref": "gr3",
            "@mimetype": "image/gif"
          },
          {
            "@category": "thumbnail",
            "@height": "101",
            "@width": "219",
            "@_fa": "true",
            "$": "https://api.elsevier.com/content/object/eid/1-s2.0-S2468823123004571-gr2.sml?httpAccept=%2A%2F%2A",
            "@multimediatype": "GIF image file",
            "@type": "IMAGE-THUMBNAIL",
            "@size": "18067",
            "@ref": "gr2",
            "@mimetype": "image/gif"
          },
          {
            "@category": "thumbnail",
            "@height": "98",
            "@width": "219",
            "@_fa": "true",
            "$": "https://api.elsevier.com/content/object/eid/1-s2.0-S2468823123004571-ga1.sml?httpAccept=%2A%2F%2A",
            "@multimediatype": "GIF image file",
            "@type": "IMAGE-THUMBNAIL",
            "@size": "10873",
            "@ref": "ga1",
            "@mimetype": "image/gif"
          },
          {
            "@category": "thumbnail",
            "@height": "164",
            "@width": "177",
            "@_fa": "true",
            "$": "https://api.elsevier.com/content/object/eid/1-s2.0-S2468823123004571-gr5.sml?httpAccept=%2A%2F%2A",
            "@multimediatype": "GIF image file",
            "@type": "IMAGE-THUMBNAIL",
            "@size": "11649",
            "@ref": "gr5",
            "@mimetype": "image/gif"
          },
          {
            "@category": "thumbnail",
            "@height": "155",
            "@width": "219",
            "@_fa": "true",
            "$": "https://api.elsevier.com/content/object/eid/1-s2.0-S2468823123004571-gr4.sml?httpAccept=%2A%2F%2A",
            "@multimediatype": "GIF image file",
            "@type": "IMAGE-THUMBNAIL",
            "@size": "8340",
            "@ref": "gr4",
            "@mimetype": "image/gif"
          },
          {
            "@category": "thumbnail",
            "@height": "156",
            "@width": "219",
            "@_fa": "true",
            "$": "https://api.elsevier.com/content/object/eid/1-s2.0-S2468823123004571-gr7.sml?httpAccept=%2A%2F%2A",
            "@multimediatype": "GIF image file",
            "@type": "IMAGE-THUMBNAIL",
            "@size": "8382",
            "@ref": "gr7",
            "@mimetype": "image/gif"
          },
          {
            "@category": "thumbnail",
            "@height": "63",
            "@width": "219",
            "@_fa": "true",
            "$": "https://api.elsevier.com/content/object/eid/1-s2.0-S2468823123004571-gr6.sml?httpAccept=%2A%2F%2A",
            "@multimediatype": "GIF image file",
            "@type": "IMAGE-THUMBNAIL",
            "@size": "13033",
            "@ref": "gr6",
            "@mimetype": "image/gif"
          },
          {
            "@category": "thumbnail",
            "@height": "156",
            "@width": "219",
            "@_fa": "true",
            "$": "https://api.elsevier.com/content/object/eid/1-s2.0-S2468823123004571-gr9.sml?httpAccept=%2A%2F%2A",
            "@multimediatype": "GIF image file",
            "@type": "IMAGE-THUMBNAIL",
            "@size": "8196",
            "@ref": "gr9",
            "@mimetype": "image/gif"
          },
          {
            "@category": "thumbnail",
            "@height": "59",
            "@width": "219",
            "@_fa": "true",
            "$": "https://api.elsevier.com/content/object/eid/1-s2.0-S2468823123004571-gr8.sml?httpAccept=%2A%2F%2A",
            "@multimediatype": "GIF image file",
            "@type": "IMAGE-THUMBNAIL",
            "@size": "12458",
            "@ref": "gr8",
            "@mimetype": "image/gif"
          },
          {
            "@category": "thumbnail",
            "@height": "164",
            "@width": "186",
            "@_fa": "true",
            "$": "https://api.elsevier.com/content/object/eid/1-s2.0-S2468823123004571-gr1.sml?httpAccept=%2A%2F%2A",
            "@multimediatype": "GIF image file",
            "@type": "IMAGE-THUMBNAIL",
            "@size": "26112",
            "@ref": "gr1",
            "@mimetype": "image/gif"
          },
          {
            "@category": "high",
            "@height": "634",
            "@width": "2167",
            "@_fa": "true",
            "$": "https://api.elsevier.com/content/object/eid/1-s2.0-S2468823123004571-gr3_lrg.jpg?httpAccept=%2A%2F%2A",
            "@multimediatype": "JPEG image file",
            "@type": "IMAGE-HIGH-RES",
            "@size": "211218",
            "@ref": "gr3",
            "@mimetype": "image/jpeg"
          },
          {
            "@category": "high",
            "@height": "1002",
            "@width": "2167",
            "@_fa": "true",
            "$": "https://api.elsevier.com/content/object/eid/1-s2.0-S2468823123004571-gr2_lrg.jpg?httpAccept=%2A%2F%2A",
            "@multimediatype": "JPEG image file",
            "@type": "IMAGE-HIGH-RES",
            "@size": "338028",
            "@ref": "gr2",
            "@mimetype": "image/jpeg"
          },
          {
            "@category": "high",
            "@height": "886",
            "@width": "1981",
            "@_fa": "true",
            "$": "https://api.elsevier.com/content/object/eid/1-s2.0-S2468823123004571-ga1_lrg.jpg?httpAccept=%2A%2F%2A",
            "@multimediatype": "JPEG image file",
            "@type": "IMAGE-HIGH-RES",
            "@size": "178775",
            "@ref": "ga1",
            "@mimetype": "image/jpeg"
          },
          {
            "@category": "high",
            "@height": "2695",
            "@width": "2917",
            "@_fa": "true",
            "$": "https://api.elsevier.com/content/object/eid/1-s2.0-S2468823123004571-gr5_lrg.jpg?httpAccept=%2A%2F%2A",
            "@multimediatype": "JPEG image file",
            "@type": "IMAGE-HIGH-RES",
            "@size": "602006",
            "@ref": "gr5",
            "@mimetype": "image/jpeg"
          },
          {
            "@category": "high",
            "@height": "1120",
            "@width": "1583",
            "@_fa": "true",
            "$": "https://api.elsevier.com/content/object/eid/1-s2.0-S2468823123004571-gr4_lrg.jpg?httpAccept=%2A%2F%2A",
            "@multimediatype": "JPEG image file",
            "@type": "IMAGE-HIGH-RES",
            "@size": "148786",
            "@ref": "gr4",
            "@mimetype": "image/jpeg"
          },
          {
            "@category": "high",
            "@height": "1129",
            "@width": "1583",
            "@_fa": "true",
            "$": "https://api.elsevier.com/content/object/eid/1-s2.0-S2468823123004571-gr7_lrg.jpg?httpAccept=%2A%2F%2A",
            "@multimediatype": "JPEG image file",
            "@type": "IMAGE-HIGH-RES",
            "@size": "147684",
            "@ref": "gr7",
            "@mimetype": "image/jpeg"
          },
          {
            "@category": "high",
            "@height": "622",
            "@width": "2167",
            "@_fa": "true",
            "$": "https://api.elsevier.com/content/object/eid/1-s2.0-S2468823123004571-gr6_lrg.jpg?httpAccept=%2A%2F%2A",
            "@multimediatype": "JPEG image file",
            "@type": "IMAGE-HIGH-RES",
            "@size": "215507",
            "@ref": "gr6",
            "@mimetype": "image/jpeg"
          },
          {
            "@category": "high",
            "@height": "1130",
            "@width": "1583",
            "@_fa": "true",
            "$": "https://api.elsevier.com/content/object/eid/1-s2.0-S2468823123004571-gr9_lrg.jpg?httpAccept=%2A%2F%2A",
            "@multimediatype": "JPEG image file",
            "@type": "IMAGE-HIGH-RES",
            "@size": "141985",
            "@ref": "gr9",
            "@mimetype": "image/jpeg"
          },
          {
            "@category": "high",
            "@height": "670",
            "@width": "2500",
            "@_fa": "true",
            "$": "https://api.elsevier.com/content/object/eid/1-s2.0-S2468823123004571-gr8_lrg.jpg?httpAccept=%2A%2F%2A",
            "@multimediatype": "JPEG image file",
            "@type": "IMAGE-HIGH-RES",
            "@size": "254396",
            "@ref": "gr8",
            "@mimetype": "image/jpeg"
          },
          {
            "@category": "high",
            "@height": "1027",
            "@width": "1167",
            "@_fa": "true",
            "$": "https://api.elsevier.com/content/object/eid/1-s2.0-S2468823123004571-gr1_lrg.jpg?httpAccept=%2A%2F%2A",
            "@multimediatype": "JPEG image file",
            "@type": "IMAGE-HIGH-RES",
            "@size": "234176",
            "@ref": "gr1",
            "@mimetype": "image/jpeg"
          },
          {
            "@category": "standard",
            "@_fa": "true",
            "$": "https://api.elsevier.com/content/object/eid/1-s2.0-S2468823123004571-mmc1.docx?httpAccept=%2A%2F%2A",
            "@multimediatype": "Microsoft Word file",
            "@type": "APPLICATION",
            "@size": "1319752",
            "@ref": "mmc1",
            "@mimetype": "application/word"
          },
          {
            "@category": "thumbnail",
            "@_fa": "true",
            "$": "https://api.elsevier.com/content/object/eid/1-s2.0-S2468823123004571-si1.svg?httpAccept=%2A%2F%2A",
            "@multimediatype": "Scalable Vector Graphics file",
            "@type": "ALTIMG",
            "@size": "2295",
            "@ref": "si1",
            "@mimetype": "image/svg+xml"
          },
          {
            "@category": "thumbnail",
            "@_fa": "true",
            "$": "https://api.elsevier.com/content/object/eid/1-s2.0-S2468823123004571-si10.svg?httpAccept=%2A%2F%2A",
            "@multimediatype": "Scalable Vector Graphics file",
            "@type": "ALTIMG",
            "@size": "12417",
            "@ref": "si10",
            "@mimetype": "image/svg+xml"
          },
          {
            "@category": "thumbnail",
            "@_fa": "true",
            "$": "https://api.elsevier.com/content/object/eid/1-s2.0-S2468823123004571-si11.svg?httpAccept=%2A%2F%2A",
            "@multimediatype": "Scalable Vector Graphics file",
            "@type": "ALTIMG",
            "@size": "6813",
            "@ref": "si11",
            "@mimetype": "image/svg+xml"
          },
          {
            "@category": "thumbnail",
            "@_fa": "true",
            "$": "https://api.elsevier.com/content/object/eid/1-s2.0-S2468823123004571-si12.svg?httpAccept=%2A%2F%2A",
            "@multimediatype": "Scalable Vector Graphics file",
            "@type": "ALTIMG",
            "@size": "11406",
            "@ref": "si12",
            "@mimetype": "image/svg+xml"
          },
          {
            "@category": "thumbnail",
            "@_fa": "true",
            "$": "https://api.elsevier.com/content/object/eid/1-s2.0-S2468823123004571-si13.svg?httpAccept=%2A%2F%2A",
            "@multimediatype": "Scalable Vector Graphics file",
            "@type": "ALTIMG",
            "@size": "7491",
            "@ref": "si13",
            "@mimetype": "image/svg+xml"
          },
          {
            "@category": "thumbnail",
            "@_fa": "true",
            "$": "https://api.elsevier.com/content/object/eid/1-s2.0-S2468823123004571-si14.svg?httpAccept=%2A%2F%2A",
            "@multimediatype": "Scalable Vector Graphics file",
            "@type": "ALTIMG",
            "@size": "1412",
            "@ref": "si14",
            "@mimetype": "image/svg+xml"
          },
          {
            "@category": "thumbnail",
            "@_fa": "true",
            "$": "https://api.elsevier.com/content/object/eid/1-s2.0-S2468823123004571-si2.svg?httpAccept=%2A%2F%2A",
            "@multimediatype": "Scalable Vector Graphics file",
            "@type": "ALTIMG",
            "@size": "3062",
            "@ref": "si2",
            "@mimetype": "image/svg+xml"
          },
          {
            "@category": "thumbnail",
            "@_fa": "true",
            "$": "https://api.elsevier.com/content/object/eid/1-s2.0-S2468823123004571-si3.svg?httpAccept=%2A%2F%2A",
            "@multimediatype": "Scalable Vector Graphics file",
            "@type": "ALTIMG",
            "@size": "3867",
            "@ref": "si3",
            "@mimetype": "image/svg+xml"
          },
          {
            "@category": "thumbnail",
            "@_fa": "true",
            "$": "https://api.elsevier.com/content/object/eid/1-s2.0-S2468823123004571-si4.svg?httpAccept=%2A%2F%2A",
            "@multimediatype": "Scalable Vector Graphics file",
            "@type": "ALTIMG",
            "@size": "2894",
            "@ref": "si4",
            "@mimetype": "image/svg+xml"
          },
          {
            "@category": "thumbnail",
            "@_fa": "true",
            "$": "https://api.elsevier.com/content/object/eid/1-s2.0-S2468823123004571-si5.svg?httpAccept=%2A%2F%2A",
            "@multimediatype": "Scalable Vector Graphics file",
            "@type": "ALTIMG",
            "@size": "11876",
            "@ref": "si5",
            "@mimetype": "image/svg+xml"
          },
          {
            "@category": "thumbnail",
            "@_fa": "true",
            "$": "https://api.elsevier.com/content/object/eid/1-s2.0-S2468823123004571-si6.svg?httpAccept=%2A%2F%2A",
            "@multimediatype": "Scalable Vector Graphics file",
            "@type": "ALTIMG",
            "@size": "6749",
            "@ref": "si6",
            "@mimetype": "image/svg+xml"
          },
          {
            "@category": "thumbnail",
            "@_fa": "true",
            "$": "https://api.elsevier.com/content/object/eid/1-s2.0-S2468823123004571-si7.svg?httpAccept=%2A%2F%2A",
            "@multimediatype": "Scalable Vector Graphics file",
            "@type": "ALTIMG",
            "@size": "5853",
            "@ref": "si7",
            "@mimetype": "image/svg+xml"
          },
          {
            "@category": "thumbnail",
            "@_fa": "true",
            "$": "https://api.elsevier.com/content/object/eid/1-s2.0-S2468823123004571-si8.svg?httpAccept=%2A%2F%2A",
            "@multimediatype": "Scalable Vector Graphics file",
            "@type": "ALTIMG",
            "@size": "2392",
            "@ref": "si8",
            "@mimetype": "image/svg+xml"
          },
          {
            "@category": "thumbnail",
            "@_fa": "true",
            "$": "https://api.elsevier.com/content/object/eid/1-s2.0-S2468823123004571-si9.svg?httpAccept=%2A%2F%2A",
            "@multimediatype": "Scalable Vector Graphics file",
            "@type": "ALTIMG",
            "@size": "8273",
            "@ref": "si9",
            "@mimetype": "image/svg+xml"
          },
          {
            "@category": "standard",
            "@_fa": "true",
            "$": "https://api.elsevier.com/content/object/eid/1-s2.0-S2468823123004571-am.pdf?httpAccept=%2A%2F%2A",
            "@multimediatype": "Acrobat PDF file",
            "@type": "AAM-PDF",
            "@size": "1820870",
            "@ref": "am",
            "@mimetype": "application/pdf"
          }
        ]
      },
      "link": {
        "@rel": "abstract",
        "@href": "https://api.elsevier.com/content/abstract/scopus_id/85165109804"
      }
    }
  }
}