{
  "metadata": {
    "title": "Olefin epoxidation with ionic liquid catalysts formed by supramolecular interactions",
    "authors": "; ; ",
    "journal": "Molecular Catalysis",
    "date": "2021-01-31",
    "doi": "10.1016/j.mcat.2020.111342",
    "abstract": "",
    "uri": "https://api.elsevier.com/content/article/pii/S2468823120306052",
    "pii": "S2468823120306052"
  },
  "fulltext": {
    "full-text-retrieval-response": {
      "scopus-eid": "2-s2.0-85098181832",
      "originalText": "serial JL 315758 291210 291744 291790 291809 31 Molecular Catalysis MOLECULARCATALYSIS 2020-12-28 2020-12-28 2020-12-28 2020-12-28 2021-01-11T23:55:37 1-s2.0-S2468823120306052 S2468-8231(20)30605-2 S2468823120306052 10.1016/j.mcat.2020.111342 S300 S300.1 FULL-TEXT 1-s2.0-S2468823120X00198 2021-03-27T06:06:37.846603Z 0 0 20210101 20210131 2021 2020-12-28T13:08:33.464497Z absattachment articleinfo articlenumber articletitlenorm authfirstinitialnorm authfirstsurnamenorm cid cids contenttype copyright crossmark dateloaded dateloadedtxt datesearch datesort dateupdated dco docsubtype doctype doi eid ewtransactionid hubeid indexeddate issn issnnorm itemstage itemtransactionid itemweight openaccess openarchive pg pgfirst pii piinorm pubdateend pubdatestart pubdatetxt pubyr sectiontitle sortorder srctitle srctitlenorm srctype ssids alllist content subj subheadings suppl tomb volfirst volissue volumelist webpdf webpdfpagecount yearnav figure table e-component body mmlmath acknowledge affil appendices articletitle auth authfirstini authfull authkeywords authlast grantnumber grantsponsor highlightsabst primabst ref specialabst 2468-8231 24688231 true 500 500 C Volume 500 12 111342 111342 111342 202101 January 2021 2021-01-01 2021-01-31 2021 Regular Papers article fla © 2020 Elsevier B.V. All rights reserved. OLEFINEPOXIDATIONIONICLIQUIDCATALYSTSFORMEDBYSUPRAMOLECULARINTERACTIONS DING B 1 Introduction 2 Experimental 2.1 Materials 2.2 Catalyst characterization 2.3 Catalyst preparation 2.3.1 Synthesis of (NH4)3[Nb(O2)4] 2.3.2 Preparation of (CE)6(NH4)4[Nb2O4(μ-O)(η2-O2)2](CE-1) 2.3.3 Preparation of (CE)6(NH4)4[Nb2O4(μ-O)(GLY)2] (CE-2) 2.4 Typical method for the epoxidation 2.5 Catalytic kinetics of epoxidation 3 Results and discussion 3.1 Catalyst characterization 3.2 H2O2-induced structure transformation of peroxoniobate anion 3.3 Catalytic performance 3.4 Kinetic studies 3.5 Substrate scope and recyclability 4 Conclusions CRediT authorship contribution statement Acknowledgements Appendix A Supplementary data References BREGANTE 2018 2995 3010 D CUNNINGHAM 2020 513 524 W JIA 2020 111146 111155 Y KAMATA 2014 2327 2332 K CHEN 2020 213443 213470 J LANE 2003 2457 2473 B CHENG 2008 343 346 W DAVIES 2001 632 639 L GOLDSMITH 2018 209 224 C AMINI 2014 83 100 M DUPE 2015 3572 3579 A SCHMIDT 2014 119 126 A ZWETTER 2017 209 219 N YAN 2018 4423 4452 W ISHIKAWA 2018 4160 4169 S COPERET 2016 323 421 C CARNITI 2014 469 479 P THORNBURG 2016 6124 6134 N THORNBURG 2015 5077 5088 N EGAMI 2010 5886 5895 H BATALHA 2020 110941 110952 D QIAO 2017 6881 6928 Y CHEN 2020 1963 1967 G HALLETT 2011 3508 3576 J LEAL 2015 903 909 B SHAMSHINA 2014 3924 3936 J GRASVIK 2014 7258 7261 J LI 2019 1 11 Y HERRMANN 2017 1667 1670 S BEDIAKO 2019 4152 4158 B SOUZA 2016 7469 7475 V CHEN 2016 3354 3364 C MA 2018 4645 4659 W BENAY 2014 13913 13929 G YU 2019 4958 4966 D GAO 2015 20541 20546 M SONG 2011 8731 8738 Y XIAO 2019 1526 1540 T FOWLER 2014 6010 6022 D MA 2017 7287 7296 W CHEN 2015 1842 1852 A BAYOT 2003 439 447 D KAMATA 2004 4728 4734 K ENDICOTT 2007 1236 1244 C YU 2019 4183 4188 D MOHAMED 2020 2420 2429 M YANG 2014 253 258 Z BAYOT 2005 4118 4123 D YAN 2017 3064 3068 Z PATRON 2003 281 288 L FIELICKE 2003 3659 3667 A XU 2020 15175 15184 G GARRIDO 2018 8301 8308 L SAHA 2017 44 52 S ZANATTA 2019 2567 2571 M BARANSKA 2003 68 76 H BAYOT 2005 1554 1562 D REGHUNADHANNAIR 2020 109687 109696 C CHEN 2014 3231 3238 C LIU 2012 16948 16950 F SOLEDAURA 2020 4737 4750 A QIAO 2009 1955 1960 Y CAO 2017 99 103 Y ZIOLEK 2011 194 204 M ZIOLEK 2015 288 296 M ALSHAMMARI 2014 908 911 H PAPASTERGIOU 2016 104 115 M DJORDJEVIC 1968 1864 1868 C DINGX2021X111342 DINGX2021X111342XB 2022-12-28T00:00:00.000Z 2022-12-28T00:00:00.000Z http://creativecommons.org/licenses/by-nc-nd/4.0/ © 2020 Elsevier B.V. All rights reserved. 2020-12-16T00:15:29.351Z http://vtw.elsevier.com/data/voc/AddOnTypes/50.7/eoas MOST Ministry of Science and Technology of the People's Republic of China http://data.elsevier.com/vocabulary/SciValFunders/501100002855 http://sws.geonames.org/1814991 NSFC National Natural Science Foundation of China http://data.elsevier.com/vocabulary/SciValFunders/501100001809 http://sws.geonames.org/1814991 item S2468-8231(20)30605-2 S2468823120306052 1-s2.0-S2468823120306052 10.1016/j.mcat.2020.111342 315758 2021-03-27T06:06:37.846603Z 2021-01-01 2021-01-31 1-s2.0-S2468823120306052-main.pdf https://s3-eu-west-1.amazonaws.com/prod-ucs-content-store-eu-west/content/pii:S2468823120306052/MAIN/application/pdf/895e5d49386bed01c773fe8dcf281267/main.pdf main.pdf pdf true 3315257 MAIN 11 1-s2.0-S2468823120306052-main_1.png https://s3-eu-west-1.amazonaws.com/prod-ucs-content-store-eu-west/content/pii:S2468823120306052/PREVIEW/image/png/0f1fc4c702114496d19958a6e6ade610/main_1.png main_1.png png 55380 849 656 IMAGE-WEB-PDF 1 1-s2.0-S2468823120306052-gr9.jpg https://s3-eu-west-1.amazonaws.com/prod-ucs-content-store-eu-west/content/pii:S2468823120306052/gr9/DOWNSAMPLED/image/jpeg/37b10e7caf0d116888c303b2c7ccbd32/gr9.jpg gr9 gr9.jpg jpg 49182 282 376 IMAGE-DOWNSAMPLED 1-s2.0-S2468823120306052-gr8.jpg https://s3-eu-west-1.amazonaws.com/prod-ucs-content-store-eu-west/content/pii:S2468823120306052/gr8/DOWNSAMPLED/image/jpeg/2e479cf32e9145d34a9b3442e8190f46/gr8.jpg gr8 gr8.jpg jpg 61534 444 565 IMAGE-DOWNSAMPLED 1-s2.0-S2468823120306052-fx11.jpg https://s3-eu-west-1.amazonaws.com/prod-ucs-content-store-eu-west/content/pii:S2468823120306052/fx11/DOWNSAMPLED/image/jpeg/134e0e124b82a39ab3e0fa7e6ca25522/fx11.jpg fx11 fx11.jpg jpg 862 12 59 IMAGE-DOWNSAMPLED 1-s2.0-S2468823120306052-fx10.jpg https://s3-eu-west-1.amazonaws.com/prod-ucs-content-store-eu-west/content/pii:S2468823120306052/fx10/DOWNSAMPLED/image/jpeg/3b3f5034c22fc4a7454917bc5daa0c8b/fx10.jpg fx10 fx10.jpg jpg 641 21 41 IMAGE-DOWNSAMPLED 1-s2.0-S2468823120306052-gr5.jpg https://s3-eu-west-1.amazonaws.com/prod-ucs-content-store-eu-west/content/pii:S2468823120306052/gr5/DOWNSAMPLED/image/jpeg/3e2c83a69bfaa7608d68748239674d02/gr5.jpg gr5 gr5.jpg jpg 20996 212 565 IMAGE-DOWNSAMPLED 1-s2.0-S2468823120306052-fx13.jpg https://s3-eu-west-1.amazonaws.com/prod-ucs-content-store-eu-west/content/pii:S2468823120306052/fx13/DOWNSAMPLED/image/jpeg/f963442655b90c183fdb7c8620e3abe5/fx13.jpg fx13 fx13.jpg jpg 801 15 49 IMAGE-DOWNSAMPLED 1-s2.0-S2468823120306052-gr4.jpg https://s3-eu-west-1.amazonaws.com/prod-ucs-content-store-eu-west/content/pii:S2468823120306052/gr4/DOWNSAMPLED/image/jpeg/0f9e026a86deb2b9e45b1731b87d409d/gr4.jpg gr4 gr4.jpg jpg 25019 283 376 IMAGE-DOWNSAMPLED 1-s2.0-S2468823120306052-fx12.jpg https://s3-eu-west-1.amazonaws.com/prod-ucs-content-store-eu-west/content/pii:S2468823120306052/fx12/DOWNSAMPLED/image/jpeg/1106f98adc75a6aa04ee8978ce660ac3/fx12.jpg fx12 fx12.jpg jpg 1282 22 84 IMAGE-DOWNSAMPLED 1-s2.0-S2468823120306052-gr7.jpg https://s3-eu-west-1.amazonaws.com/prod-ucs-content-store-eu-west/content/pii:S2468823120306052/gr7/DOWNSAMPLED/image/jpeg/4599f5a026abe75235774b4cae535fe7/gr7.jpg gr7 gr7.jpg jpg 15995 298 376 IMAGE-DOWNSAMPLED 1-s2.0-S2468823120306052-gr6.jpg https://s3-eu-west-1.amazonaws.com/prod-ucs-content-store-eu-west/content/pii:S2468823120306052/gr6/DOWNSAMPLED/image/jpeg/e1b47ae7b20173dc75c2182abcfcb7e8/gr6.jpg gr6 gr6.jpg jpg 40159 355 376 IMAGE-DOWNSAMPLED 1-s2.0-S2468823120306052-fx2.jpg https://s3-eu-west-1.amazonaws.com/prod-ucs-content-store-eu-west/content/pii:S2468823120306052/fx2/DOWNSAMPLED/image/jpeg/ad6aabe8c14fcc2bdd9a0582ecb1cc12/fx2.jpg fx2 fx2.jpg jpg 773 28 26 IMAGE-DOWNSAMPLED 1-s2.0-S2468823120306052-fx1.jpg https://s3-eu-west-1.amazonaws.com/prod-ucs-content-store-eu-west/content/pii:S2468823120306052/fx1/DOWNSAMPLED/image/jpeg/3f8d4968445bf4bbbd72305e34ece1e7/fx1.jpg fx1 fx1.jpg jpg 557 23 23 IMAGE-DOWNSAMPLED 1-s2.0-S2468823120306052-gr1.jpg https://s3-eu-west-1.amazonaws.com/prod-ucs-content-store-eu-west/content/pii:S2468823120306052/gr1/DOWNSAMPLED/image/jpeg/b810e2f317c059a2cd0a1b8557664ba7/gr1.jpg gr1 gr1.jpg jpg 14549 126 565 IMAGE-DOWNSAMPLED 1-s2.0-S2468823120306052-fx8.jpg https://s3-eu-west-1.amazonaws.com/prod-ucs-content-store-eu-west/content/pii:S2468823120306052/fx8/DOWNSAMPLED/image/jpeg/14dbc9f239f1c175bd4cc36f55ff8a87/fx8.jpg fx8 fx8.jpg jpg 874 24 54 IMAGE-DOWNSAMPLED 1-s2.0-S2468823120306052-fx7.jpg https://s3-eu-west-1.amazonaws.com/prod-ucs-content-store-eu-west/content/pii:S2468823120306052/fx7/DOWNSAMPLED/image/jpeg/5e3606a158a8c75703d208068259c244/fx7.jpg fx7 fx7.jpg jpg 566 12 29 IMAGE-DOWNSAMPLED 1-s2.0-S2468823120306052-gr3.jpg https://s3-eu-west-1.amazonaws.com/prod-ucs-content-store-eu-west/content/pii:S2468823120306052/gr3/DOWNSAMPLED/image/jpeg/e66b2c3d08ea461efac76bb53da793ad/gr3.jpg gr3 gr3.jpg jpg 19813 274 376 IMAGE-DOWNSAMPLED 1-s2.0-S2468823120306052-gr2.jpg https://s3-eu-west-1.amazonaws.com/prod-ucs-content-store-eu-west/content/pii:S2468823120306052/gr2/DOWNSAMPLED/image/jpeg/18c2b24aab50f93fb56f627c41540986/gr2.jpg gr2 gr2.jpg jpg 35230 233 565 IMAGE-DOWNSAMPLED 1-s2.0-S2468823120306052-fx9.jpg https://s3-eu-west-1.amazonaws.com/prod-ucs-content-store-eu-west/content/pii:S2468823120306052/fx9/DOWNSAMPLED/image/jpeg/0523896d3b57a10c1885d22eef1cbe13/fx9.jpg fx9 fx9.jpg jpg 1058 12 76 IMAGE-DOWNSAMPLED 1-s2.0-S2468823120306052-fx4.jpg https://s3-eu-west-1.amazonaws.com/prod-ucs-content-store-eu-west/content/pii:S2468823120306052/fx4/DOWNSAMPLED/image/jpeg/1adbe9db366f999af598e0781f4d6fa0/fx4.jpg fx4 fx4.jpg jpg 1195 12 94 IMAGE-DOWNSAMPLED 1-s2.0-S2468823120306052-fx3.jpg https://s3-eu-west-1.amazonaws.com/prod-ucs-content-store-eu-west/content/pii:S2468823120306052/fx3/DOWNSAMPLED/image/jpeg/d0d74d99f00df56daa5de444521f5cc4/fx3.jpg fx3 fx3.jpg jpg 1039 12 94 IMAGE-DOWNSAMPLED 1-s2.0-S2468823120306052-sc1.jpg https://s3-eu-west-1.amazonaws.com/prod-ucs-content-store-eu-west/content/pii:S2468823120306052/sc1/DOWNSAMPLED/image/jpeg/021c17861f4ba7733813ceea2f7e43d3/sc1.jpg sc1 sc1.jpg jpg 23509 314 376 IMAGE-DOWNSAMPLED 1-s2.0-S2468823120306052-fx6.jpg https://s3-eu-west-1.amazonaws.com/prod-ucs-content-store-eu-west/content/pii:S2468823120306052/fx6/DOWNSAMPLED/image/jpeg/f801cdc8cb98e4f777fe99d90e90aa18/fx6.jpg fx6 fx6.jpg jpg 709 25 28 IMAGE-DOWNSAMPLED 1-s2.0-S2468823120306052-fx5.jpg https://s3-eu-west-1.amazonaws.com/prod-ucs-content-store-eu-west/content/pii:S2468823120306052/fx5/DOWNSAMPLED/image/jpeg/a927803958e0a882ba8a1d0ef528304c/fx5.jpg fx5 fx5.jpg jpg 1080 26 82 IMAGE-DOWNSAMPLED 1-s2.0-S2468823120306052-ga1.jpg https://s3-eu-west-1.amazonaws.com/prod-ucs-content-store-eu-west/content/pii:S2468823120306052/ga1/DOWNSAMPLED/image/jpeg/34254f4438d0256168403c7039b9ce7c/ga1.jpg ga1 true ga1.jpg jpg 20323 200 464 IMAGE-DOWNSAMPLED 1-s2.0-S2468823120306052-gr9.sml https://s3-eu-west-1.amazonaws.com/prod-ucs-content-store-eu-west/content/pii:S2468823120306052/gr9/THUMBNAIL/image/gif/ea04223712997a3c37ed9ad82eb52ec5/gr9.sml gr9 gr9.sml sml 18120 164 219 IMAGE-THUMBNAIL 1-s2.0-S2468823120306052-gr8.sml https://s3-eu-west-1.amazonaws.com/prod-ucs-content-store-eu-west/content/pii:S2468823120306052/gr8/THUMBNAIL/image/gif/9d8893fd70ad1f1f28c3d3e8397e0445/gr8.sml gr8 gr8.sml sml 9405 164 208 IMAGE-THUMBNAIL 1-s2.0-S2468823120306052-fx11.sml https://s3-eu-west-1.amazonaws.com/prod-ucs-content-store-eu-west/content/pii:S2468823120306052/fx11/THUMBNAIL/image/gif/c7b02e4559e4aab27db40487626823ee/fx11.sml fx11 fx11.sml sml 3156 46 219 IMAGE-THUMBNAIL 1-s2.0-S2468823120306052-fx10.sml https://s3-eu-west-1.amazonaws.com/prod-ucs-content-store-eu-west/content/pii:S2468823120306052/fx10/THUMBNAIL/image/gif/f96042cbccf575472e7f1c986a569ddf/fx10.sml fx10 fx10.sml sml 2589 93 184 IMAGE-THUMBNAIL 1-s2.0-S2468823120306052-gr5.sml https://s3-eu-west-1.amazonaws.com/prod-ucs-content-store-eu-west/content/pii:S2468823120306052/gr5/THUMBNAIL/image/gif/118d72f7f394a6b4c3e830d3eeaa5e14/gr5.sml gr5 gr5.sml sml 4181 82 219 IMAGE-THUMBNAIL 1-s2.0-S2468823120306052-fx13.sml https://s3-eu-west-1.amazonaws.com/prod-ucs-content-store-eu-west/content/pii:S2468823120306052/fx13/THUMBNAIL/image/gif/7229107486d4d95896bbd250a85e5f1a/fx13.sml fx13 fx13.sml sml 2914 67 218 IMAGE-THUMBNAIL 1-s2.0-S2468823120306052-gr4.sml https://s3-eu-west-1.amazonaws.com/prod-ucs-content-store-eu-west/content/pii:S2468823120306052/gr4/THUMBNAIL/image/gif/cd3ee02c94644b067f2f80fdb241eb74/gr4.sml gr4 gr4.sml sml 8253 164 218 IMAGE-THUMBNAIL 1-s2.0-S2468823120306052-fx12.sml https://s3-eu-west-1.amazonaws.com/prod-ucs-content-store-eu-west/content/pii:S2468823120306052/fx12/THUMBNAIL/image/gif/25bd318a2f75a876e70d6ee7bb0ba2ff/fx12.sml fx12 fx12.sml sml 2927 58 219 IMAGE-THUMBNAIL 1-s2.0-S2468823120306052-gr7.sml https://s3-eu-west-1.amazonaws.com/prod-ucs-content-store-eu-west/content/pii:S2468823120306052/gr7/THUMBNAIL/image/gif/635b15c7be014d67f4c2eff1129b85f1/gr7.sml gr7 gr7.sml sml 5403 164 207 IMAGE-THUMBNAIL 1-s2.0-S2468823120306052-gr6.sml https://s3-eu-west-1.amazonaws.com/prod-ucs-content-store-eu-west/content/pii:S2468823120306052/gr6/THUMBNAIL/image/gif/13c0cb311d54a99389506be5d43a3597/gr6.sml gr6 gr6.sml sml 8772 163 173 IMAGE-THUMBNAIL 1-s2.0-S2468823120306052-fx2.sml https://s3-eu-west-1.amazonaws.com/prod-ucs-content-store-eu-west/content/pii:S2468823120306052/fx2/THUMBNAIL/image/gif/3544fe3270237ac3f363ae8f3418b09c/fx2.sml fx2 fx2.sml sml 2647 125 117 IMAGE-THUMBNAIL 1-s2.0-S2468823120306052-fx1.sml https://s3-eu-west-1.amazonaws.com/prod-ucs-content-store-eu-west/content/pii:S2468823120306052/fx1/THUMBNAIL/image/gif/cabdea2f287d36094209dd57d5a3a822/fx1.sml fx1 fx1.sml sml 2225 105 104 IMAGE-THUMBNAIL 1-s2.0-S2468823120306052-gr1.sml https://s3-eu-west-1.amazonaws.com/prod-ucs-content-store-eu-west/content/pii:S2468823120306052/gr1/THUMBNAIL/image/gif/b84ce4be5c8d2182bfbe12535ba7efc2/gr1.sml gr1 gr1.sml sml 3226 49 219 IMAGE-THUMBNAIL 1-s2.0-S2468823120306052-fx8.sml https://s3-eu-west-1.amazonaws.com/prod-ucs-content-store-eu-west/content/pii:S2468823120306052/fx8/THUMBNAIL/image/gif/033b56d2f85c75c245c2346b8741fcaa/fx8.sml fx8 fx8.sml sml 3599 96 219 IMAGE-THUMBNAIL 1-s2.0-S2468823120306052-fx7.sml https://s3-eu-west-1.amazonaws.com/prod-ucs-content-store-eu-west/content/pii:S2468823120306052/fx7/THUMBNAIL/image/gif/0da995b764bc9b16614760a261ccc3e5/fx7.sml fx7 fx7.sml sml 2104 54 131 IMAGE-THUMBNAIL 1-s2.0-S2468823120306052-gr3.sml https://s3-eu-west-1.amazonaws.com/prod-ucs-content-store-eu-west/content/pii:S2468823120306052/gr3/THUMBNAIL/image/gif/6b1a3b01b78e97a39d4b0f7cbd5a12d6/gr3.sml gr3 gr3.sml sml 6157 160 219 IMAGE-THUMBNAIL 1-s2.0-S2468823120306052-gr2.sml https://s3-eu-west-1.amazonaws.com/prod-ucs-content-store-eu-west/content/pii:S2468823120306052/gr2/THUMBNAIL/image/gif/18bb6d7c23176d5108b766c9530c4e4b/gr2.sml gr2 gr2.sml sml 5849 90 219 IMAGE-THUMBNAIL 1-s2.0-S2468823120306052-fx9.sml https://s3-eu-west-1.amazonaws.com/prod-ucs-content-store-eu-west/content/pii:S2468823120306052/fx9/THUMBNAIL/image/gif/97c30bf981db1abb0f88503b423f9701/fx9.sml fx9 fx9.sml sml 2711 35 219 IMAGE-THUMBNAIL 1-s2.0-S2468823120306052-fx4.sml https://s3-eu-west-1.amazonaws.com/prod-ucs-content-store-eu-west/content/pii:S2468823120306052/fx4/THUMBNAIL/image/gif/51147972f8db79603d8ac67edfe578f1/fx4.sml fx4 fx4.sml sml 2260 28 219 IMAGE-THUMBNAIL 1-s2.0-S2468823120306052-fx3.sml https://s3-eu-west-1.amazonaws.com/prod-ucs-content-store-eu-west/content/pii:S2468823120306052/fx3/THUMBNAIL/image/gif/94cca47fd0e1e378003cc9ca4acefd82/fx3.sml fx3 fx3.sml sml 2247 28 219 IMAGE-THUMBNAIL 1-s2.0-S2468823120306052-sc1.sml https://s3-eu-west-1.amazonaws.com/prod-ucs-content-store-eu-west/content/pii:S2468823120306052/sc1/THUMBNAIL/image/gif/7e84a1047c80a327bfaf2b3e2468fdff/sc1.sml sc1 sc1.sml sml 6354 164 196 IMAGE-THUMBNAIL 1-s2.0-S2468823120306052-fx6.sml https://s3-eu-west-1.amazonaws.com/prod-ucs-content-store-eu-west/content/pii:S2468823120306052/fx6/THUMBNAIL/image/gif/428b97c7cdd628f1ba3f86b0dbf28e96/fx6.sml fx6 fx6.sml sml 2658 114 126 IMAGE-THUMBNAIL 1-s2.0-S2468823120306052-fx5.sml https://s3-eu-west-1.amazonaws.com/prod-ucs-content-store-eu-west/content/pii:S2468823120306052/fx5/THUMBNAIL/image/gif/339d5032b01c470086789de20d74880d/fx5.sml fx5 fx5.sml sml 2564 68 219 IMAGE-THUMBNAIL 1-s2.0-S2468823120306052-ga1.sml https://s3-eu-west-1.amazonaws.com/prod-ucs-content-store-eu-west/content/pii:S2468823120306052/ga1/THUMBNAIL/image/gif/47fcb80b9803c05e189b7a3697f01fe5/ga1.sml ga1 true ga1.sml sml 12717 94 219 IMAGE-THUMBNAIL 1-s2.0-S2468823120306052-mmc1.docx https://s3-eu-west-1.amazonaws.com/prod-ucs-content-store-eu-west/content/pii:S2468823120306052/mmc1/MAIN/application/vnd.openxmlformats-officedocument.wordprocessingml.document/f5adb4c5a6c5fcf1d2d9d0fb3f61182c/mmc1.docx mmc1 mmc1.docx docx 4097243 APPLICATION 1-s2.0-S2468823120306052-si1.svg https://s3-eu-west-1.amazonaws.com/prod-ucs-content-store-eu-west/content/pii:S2468823120306052/STRIPIN/image/svg+xml/8f4dd6e2914946426c0117951e4e411d/si1.svg si1 si1.svg svg 825 ALTIMG 1-s2.0-S2468823120306052-am.pdf am am.pdf pdf 1660368 AAM-PDF https://s3-eu-west-1.amazonaws.com/prod-ucs-content-store-eu-west/content/egi:10R1CTPT1JJ/MAIN/application/pdf/438fde4c24e95b0e85437e984450ab36/am.pdf MCAT 111342 111342 S2468-8231(20)30605-2 10.1016/j.mcat.2020.111342 Elsevier B.V. Fig. 1 Proposed dimer structure of CE-1 and CE-2. Fig. 1 Fig. 2 DSC patterns (left) and FT-IR spectra (right) of (a) CE, (b) NH4-Nb, (c) CE-1, and (d) CE-2. Fig. 2 Fig. 3 The conductivity as function of the CNb at 25 °C, where CNb represented the molar concentration of Nb in H2O. Fig. 3 Fig. 4 Raman spectra of (a) CE-1, (b) CE-2. Fig. 4 Fig. 5 TGA patterns of the crown ionic liquids: (a) CE-1; (b) CE-2. Fig. 5 Fig. 6 93Nb NMR spectra of different samples: (a) NH4-Nb, (b) CE-1, (c) CE-2, (d) reused CE-2 and (e) CE-2 in H2O2. Fig. 6 Fig. 7 Raman spectra of the oxidizing species of CE-2. Fig. 7 Fig. 8 Conversion/time profiles for the epoxidation reaction by using CE-1 (a) and CE-2 (c) catalysts under various temperatures. Arrhenius plots for epoxidation of cyclooctene of CE-1 (b) and CE-2 (d). The observed rate constants (k) were measured with initial rates accordingly. Reaction conditions: cyclooctene (1 mmol), H2O2 (1 mmol), IL catalyst (0.01 mmol), CH3OH (2 mL), stirring speed (800 rpm). Fig. 8 Fig. 9 The recyclability of CE-2 for epoxidation of cyclooctene. Fig. 9 Scheme 1 Reaction pathways of cyclooctene epoxidation on the supramolecular IL (CE-2) catalyst. MH2O2 and MCE-2 denoted the molar amounts of H2O2 and CE-2 used in the reaction, respectively. Scheme 1 Table 1 The physico-chemical properties of the NH4-Nb and the IL catalysts. Table 1 Samples M.p/°C States Peroxy-bond/Nb Solubility a H2O CH3OH AcOEt PhCH3 NH4-Nb N.D b White powder 3.6 √ × × × CE-1 36.30 Yellow liquid 1.5 √ √ × × CE-2 34.08 Yellow liquid 0.5 √ √ × × a √: soluble, ×: insoluble. b N.D: Not determined. Table 2 Epoxidation of cyclooctene with various catalysts a . Table 2 Entries Catalysts Additives Con. (%) b 1 none none 1 2 CE none 1 3 Glycolic acid none 1 4 NH4-Nb none 2 5 CE-1 none 60 6 CE-2 none 99 7 c CE-1 acetic acid 63 8 c CE-1 3-hydroxypropionic acid 62 9 c CE-1 oxalic acid 40 10 c CE-1 lactic acid 83 11 c CE-1 glycolic acid 98 12 CE-2a none 93 13 CE-2b none 98 a Reaction conditions: Cyclooctene (1 mmol), H2O2 (1 mmol), 2 mL of CH3OH, IL catalyst (0.01 mmol), 50 °C, 3 h. Epoxide was detected as a sole product in all reaction. b The conversion was obtained by GC with dodecane as an internal standard. c 0.02 mmol of additive was used. Table 3 Epoxidation of allylic alcohols and olefins with CE-2. Table 3 Entries Substrates T/oC t/h Con.(%) b Sel.(%) epoxide others 1 50 3 99 ≥99 <1 2 50 5 65 ≥74 <26 3 50 8 35 ≥99 <1 4 50 8 21 ≥99 <1 5 50 8 81 ≥72 <28 6 50 8 80 ≥99 <1 7 c 40 12 32 c ≥99 <1 8 d 0 0.5 99 ≥99 <1 9 30 5 90 ≥99 <1 10 d 30 5 98 ≥99 <1 11 d 30 3 96 ≥99 <1 12 20 2 99 ≥99 <1 13 25 3 60 ≥99 <1 aReaction conditions: substrate (1 mmol), H2O2 (1 mmol), CE-2 (0.01 mmol), 2 mL of CH3OH. b The conversion was obtained by GC with dodecane as an internal standard. c Refers to yield, propylene 1.5 MPa. d Solvent-free conditions. Olefin epoxidation with ionic liquid catalysts formed by supramolecular interactions Bingjie Ding Conceptualization Methodology Data curation Formal analysis Writing - original draft a Ran Zhang Formal analysis b Qingqing Zhou Formal analysis Writing - review & editing a Wenbao Ma Investigation Formal analysis a Anna Zheng Resources a Difan Li Software a Yefeng Yao Methodology Validation Visualization b * Zhenshan Hou Funding acquisition Writing - review & editing Supervision Project administration a * a Key Laboratory for Advanced Materials, Research Institute of Industrial Catalysis, East China University of Science and Technology, Shanghai 200237, China Key Laboratory for Advanced Materials Research Institute of Industrial Catalysis East China University of Science and Technology Shanghai 200237 China Key Laboratory for Advanced Materials, Research Institute of Industrial Catalysis, East China University of Science and Technology, Shanghai 200237, China b Physics Department and Shanghai Key Laboratory of Magnetic Resonance, East China Normal University, Shanghai 200062, China Physics Department and Shanghai Key Laboratory of Magnetic Resonance East China Normal University Shanghai 200062 China Physics Department and Shanghai Key Laboratory of Magnetic Resonance, East China Normal University, Shanghai 200062, China ⁎ Corresponding authors. Graphical abstract This work demonstrated that the specific ionic liquids (ILs) have been designed via the supramolecular complexation between 18-crown-6 (CE) and ammonium peroxoniobate (NH4-Nb). The resultant ILs have been characterized by elemental analysis, FT-IR, Raman, NMR, DSC, conductivity measurement and MALDI-TOF, etc. The IL (CE-1) consisting of CE and ammonium peroxoniobate can be further coordinated with GLY to generate a new IL (CE-2), which showed both high catalytic activity in epoxidation with H2O2 and good recyclability. The characterization of 93Nb NMR spectra revealed that the peroxoniobate anions has demonstrated a structural evolution in the presence of hydrogen peroxide, in which NbO species can be easily oxidized into the catalytically active niobium−peroxo species. Especially, the supramolecular complexation can provide suitable hydrophobicity, which ensured that the hydrophobic olefins and allylic alcohols were easily accessible to the catalytically active anions, and thus facilitated the epoxidation reaction. Notably, the supramolecular IL catalysts in this work exhibited a huge advantage of the easy availability, as compared with the previously reported peroxoniobate-based ILs. As far as we know, this is the first example of the highly selective epoxidation of olefins and allylic alcohols by using supramolecular ILs as catalysts. Keywords Ionic liquid Peroxoniobate Crown ether Supramolecularinteraction Olefin epoxidation 1 Introduction The epoxidation of olefins and allylic alcohols plays an essential role in industrial and synthetic chemistry [1–3]. Many high value-added products such as surfactants, perfumes and epoxy resins are manufactured from epoxides [4]. However, peracids and hazardous solvents are usually involved in epoxidation reaction, which are expensive and environmentally harmful [5]. Comparatively, hydrogen peroxide is possibly the best oxidant except for oxygen in consideration of environment and economy considering that water is the sole product along with H2O2 consumption [6]. As for olefin epoxidation reactions, a microporous titanium silicate zeolite (TS-1) exhibits extensive application in epoxidizing light alkenes with hydrogen peroxide [7]. Nevertheless, long-chain olefins cannot facilely contact the reactive centers due to the small pore sizes of TS-1. In addition, the active species of TS-1 are liable to leach in the course of epoxidation with H2O2 as oxidant [8]. Meanwhile, various homogeneous transition-metal complexes have been applied to highly efficient olefin epoxidation [9]. For example, some homogeneous tungsten complexes afforded much better catalytic activity than heterogeneous analogues in the epoxidation of alkenes [10,11]. Besides, the complexes of early transition metals, especially molybdenum complexes (oxomolybdenum species), have also shown good catalytic activity and selectivity [12,13]. However, the homogeneous complex catalysts are confronted with challenges including the oxidative decomposition under reaction conditions and the difficult separation and recovery, greatly limiting their applications. On the other hand, the simple loading of the tungsten-based precursor onto porous siliceous molecular sieves typically causes uneven surface WO3 domains, which is thus prone to further aggregation, resulting in activity loss and scarce robustness [14]. Although much efforts have been made to grafting the complexes of transition metals to porous solid materials by strong covalent linkage, the inherent catalytic activity of metal complexes is normally reduced because of the adverse interactions of active sites with non-uniform solid surfaces [15,16]. Hence, the development of highly active and recoverable catalysts is fairly promising, which is also in line with the requirements of green chemistry. Niobium-based compounds can be extensively studied as the catalytic materials [17,18]. For examples, Nb-silicates offer more advantages with respect to hydrolytic stability as compared with that of V and Mo catalysts [19]. Especially, as potential oxygen donors, niobium complexes have received increasing attention in oxidation reaction recently [20]. The previous studies have confirmed that the peroxo niobium complexes are able to release active oxygen either chemically or on irradiation, thus participating in oxidation of various organic substrates [21]. Ionic liquid (IL) has been represented as a research hotspot recently owing to their distinctive natures containing a wide liquid range, non-volatility, ionicity and strong polarity [22–24]. These specific properties of ILs have opened up their applications in the industry as reaction solvents, catalysts, electrolytes, sensors, enzyme stabilizers [25,26]. The structures and properties of ILs can be easily designed and adjusted via varying their cations and inorganic anions. Currently, a great deal of functionalized ILs have been investigated, providing a promising methodology to synthesize catalysts with high performance and excellent recyclability [27]. As a subset of functionalized ILs, polyoxometallate anion-based ILs (POM-ILs) have been achieved and employed in acid-catalysis and oxidative reaction with excellent catalytic activity and reusability [28,29]. There is no doubt that the appearance of the functionalized ILs will assure the ILs with different particular capabilities, promoting more sustainable and reasonable development of ILs [30,31]. In our previous research, a series of peroxoniobate (peroxotantalate)-based ILs have been utilized in epoxidizing olefins and allylic alcohols [32,33]. These ILs catalysts showed huge advantages in separation and recycling and demonstrated better performance in catalytic epoxidation compared to tungsten-containing catalysts. However, the preparation of these ILs normally needs tedious procedures such as neutralization, ionic exchange and solvent removal etc., which contains time-consuming multiple operations and might bring impurities in ILs. As a branch of noncovalent interplay and supramolecular chemistry, host-guest interaction exists extensively between metal cations and macrocyclic ethers [34,35]. In recent years, crown ethers have drawn growing interest because they are capable of forming complexes selectively with ionic species by host-guest interaction [36]. In the previous studies, a crown ether complex cation ILs were employed for various carbon-carbon bond-forming reactions, including Michael addition, Heck reaction and Henry reaction [37]. It indicated that these ILs can be recycled for many times without significant deactivation. Sequentially, the numerous deep eutectic solvents have been developed based on host-guest interactions [38,39]. However, up to now the specific ILs formed by the host-guest interactions have seldom been reported for catalysis, let alone oxidation reaction. According to our previous work, organic acid-modified peroxoniobate ILs had high reactivity toward the epoxidation reaction [33]. However, the synthesis of the specific ILs was rather tedious due to multiple steps. As a continuous effort to optimize the catalytic application of the ILs, in this work we have developed a novel type of ILs formed by supramolecular interactions. The supramolecular ILs can be obtained by a direct mixing of CE with the NH4-Nb ((NH4)3[Nb(O2)4]) with the certain molar ratio in methanol. Afterwards, the methanol was evaporated under the vacuum to generate the ILs without any by-products, which was a much simpler approach in comparison to that of the previous work [33,40]. The supramolecular complexation of CE and NH4-Nb has been proved by FT-IR spectra, differential scanning calorimetry (DSC) and conductivity measurement etc. Notably, the easily available ILs demonstrated the excellent catalytic performance for the epoxidation under very mild conditions. 2 Experimental 2.1 Materials 18-crown-6 (CE, C12H24O6, 98 wt.%) was provided by Bide Pharmatech Ltd. Potassium hydroxide (KOH) and Hydrogen peroxide (H2O2, 30 wt.%) were supplied by Shanghai Titan Scientific Co., Ltd. Niobium pentaoxide (Nb2O5), ammonium hydroxide (NH3·H2O, AR) and methanol (CH3OH, AR) were purchased from Aladdin. Glycolic acid (GLY, C2H4O3, 98 wt.%) was supplied by TCI (Shanghai) Development Co., Ltd. 2.2 Catalyst characterization The procedures for catalyst characterization can be found in Supporting Information. 2.3 Catalyst preparation 2.3.1 Synthesis of (NH4)3[Nb(O2)4] At first, Nb2O5·nH2O was prepared by sintering KOH and Nb2O5 in a molar ratio of 10 (n(KOH/Nb2O5) = 10) at 550 °C for 6 h [41]. Subsequently, the mixture was dissolved in water and acidified by acetic acid with pH reaching to 4. The white precipitate was obtained by filtration and washed thoroughly, followed by drying at 60 °C for 1 h. Then NH4-Nb ((NH4)3[Nb(O2)4]) was obtained from the reaction of the Nb2O5·nH2O and H2O2, adjusting pH around 10 with NH3·H2O until the solution became clear. Ethanol was poured into the clear solution to precipitate the NH4-Nb ((NH4)3[Nb(O2)4]) as a white powder [42]. Anal. Calcd for NH4-Nb (274.97): Nb, 33.8. Found: Nb, 33.1. Number of peroxide bonds: 3.6. 2.3.2 Preparation of (CE)6(NH4)4[Nb2O4(μ-O)(η2-O2)2](CE-1) The IL (CE-1) was obtained according to the following procedure. Briefly, CE (0.79 g, 3 mmol) and NH4-Nb (0.27 g, 1 mmol) (CE/Nb = 3:1) were stirred in 10 mL of methanol at 60 °C for 24 h. The clear solution was rotary evaporated to obtain the light yellow viscous liquid as (CE)6(NH4)4[Nb2O4(μ-O)(η2-O2)2], designated as CE-1 (Fig. S1). 1H NMR (400 MHz, D2O): 3.33 (s, 0..12 H), 3.67 (s, 6..15 H), δ 4.79 (s, 1 H). 13C NMR (100 MHz, D2O): δ 70.21, 49.50 (Fig. S2). Anal. Calcd for C72H160N4Nb2O45 (1987.87): C, 43.46; H, 8.05; N, 2.81; Nb, 9.35. Found: C, 42.70; H, 7.70; N, 2.50; Nb, 9.20. Number of peroxide bonds: 1.5 per Nb atom. 2.3.3 Preparation of (CE)6(NH4)4[Nb2O4(μ-O)(GLY)2] (CE-2) The preparation of CE-2 was similar to that of CE-1. Firstly, CE (0.79 g, 3 mmol) was dissolved in 10 mL of methanol and NH4-Nb (0.27 g, 1 mmol) was then added to the above solution with the molar ratio of CE/Nb = 3:1. The resulting mixture was stirred at 60 °C for 24 h until it became a clear solution. Next, GLY (0.08 g, 1 mmol) was dissolved in 2 mL of methanol and added dropwise to the above solution. The mixture was then agitated intensely at 40 °C for another 12 h, and the solvent was removed with a rotary evaporator. The resultant IL was placed under vacuum at 40 °C to obtain yellow viscous liquid ((CE)6(NH4)4[Nb2O4(μ-O)(GLY)2]), designated as CE-2 (Fig. S1). 1H NMR (400 MHz, D2O): 3.34 (s, 2 H), 3.68 (s, 44 H), δ 3.98 (s, 1 H), 4.79 (s, 8 H). 13C NMR (100 MHz, D2O): δ 179.84, 171.03, 72.37, 70.20, 61.71, 49.50 (Fig. S3). Anal. Calcd for C76H164N4Nb2O47 (2071.94): C, 44.01; H, 7.91; N, 2.70; Nb, 8.98. Found: C, 42.27; H, 7.48; N, 2.66; Nb, 8.89. Number of peroxide bonds: 0.5 per Nb atom. For the sake of comparison, CE-2a and CE-2b were prepared in a similar way but 2 mmol CE (CE/Nb = 2) or 4 mmol CE (CE/Nb = 4) was charged to 10 mL of methanol solution of NH4-Nb, respectively, followed by adding GLY (0.08 g, 1 mmol). The resultant solution was agitated at 40 °C for 12 h, and then the solvent was removed to afford CE-2a and CE-2b, respectively. CE-2a ((CE)4(NH4)4[Nb2O4(μ-O)(GLY)2]): Anal. Calcd for C52H116N4Nb2O35 (1542.55): C, 40.45; H, 7.52; N, 3.63; Nb, 12.06. Found: C, 39.88; H, 7.39; N, 3.52; Nb, 11.29. CE-2b ((CE)8(NH4)4[Nb2O4(μ-O)(GLY)2]): Anal. Calcd for C100H212N4Nb2O59 (2599.18): C, 46.17; H, 8.16; N, 2.15; Nb, 7.16. Found: C, 45.45; H, 7.89; N, 2.05; Nb, 7.05. FT-IR spectra of both CE-2a and CE-2b were given in Fig. S4. 2.4 Typical method for the epoxidation Catalysts (0.01 mmol), olefins (1 mmol), an internal standard (dodecane) and 30 % aqueous H2O2 (1 mmol) were dissolved in CH3OH (2 mL) and then charged into a 25 mL Schlenk flask. The reaction mixture was agitated intensely at 50 °C for different time. After reaction, the reaction mixture was extracted with cyclohexane at least three times, which was also monitored by gas chromatography (GC). In catalyst recycling, after extraction with cyclohexane the remaining catalyst was evaporated to dryness under vacuum at 40 °C and could be used for the next run. 2.5 Catalytic kinetics of epoxidation The method of studying reaction kinetic for the epoxidation reaction by using the supramolecular ILs is displayed as follows. Cyclooctene (1 mmol), catalyst (0.01 mmol), an internal standard (dodecane) and 30 % aqueous H2O2 (1 mmol) were dissolved in CH3OH (2 mL), and then the mixture was agitated and heated to designed temperature (303−333 K) and time. The reaction process was monitored by GC and reaction rates were obtained accordingly under low conversions of cyclooctene (<20 %). Then the rate constants were calculated at the different temperatures based on initial rate method [43]. The activation energy was achieved by following Arrhenius equation. 3 Results and discussion 3.1 Catalyst characterization The IL catalysts (such as CE-1 and CE-2) were all yellow and exhibited the common features of ILs like a viscous liquid around ambient temperature and non-volatility. Additionally, they were immiscible with low-polarity or non-polarity solvents (such as alkane, ethyl acetate, toluene, etc.), but fully miscible with polar solvents (H2O, CH3OH, CH3CH2OH, CH3CN etc.) (Table 1 ). Based on the elemental analysis, potential difference titration of Ce3+/Ce4+ and other characterization (following section), it indicated that anions of the ILs existed in the form of the dimeric structure likely owning to the supramolecular complexation between CE and ammonium cations. The dimeric structure has been depicted in Fig. 1 . The host-guest interaction in the specific ILs was firstly investigated by DSC. As shown in Fig. 2 (Left), the melting point of the sole CE is around 43.34 °C and the melting point of the ionic compound NH4-Nb could be very high and not available because it was labile to decompose prior to melting (Fig. 2, left). Comparatively, the melting point of two ILs like CE-1 and CE-2 were determined as 36.30 °C and 34.08 °C respectively, indicated that the melting point was obviously lower than that of a sole CE (Fig. 2, left). The reduced melting points actually reflected that the hydrogens of the NH4 + might interact with the oxygens of CE by hydrogen bonding, and NH4 + could diffuse into the flexible holes of the CE considering that the radius of ammonium was close to the size of the cavity of CE [44], leading to a decreased coulomb interaction due to the distribution of positive and negative charge [45,46]. The small peak around 47 °C (Fig. 2c, left) could be assigned to a minor dimer form besides the structure of CE-1 due to the labile peroxo group. Subsequently, the ILs with the different molar ratios of CE/NH4-Nb were also prepared and characterized by DSC. It was observed visually that if the molar ratio of CE/Nb decreased to 1:1, the reaction between CE and NH4-Nb in methanol was unable to lead to the clear solution, indicating that the supermolecular complexes were not formed under this condition. However, the molar ratio of CE/Nb = 2:1 (CE-2a) and 4:1 (CE-2b) would result in the formation of the supermolecular ILs. Next, the DSC curves of CE-2a and CE-2b were also conducted and shown in Fig. S5. It indicated that the molar ratio of CE/Nb has a subtle influence on the melting point of supermolecular ILs likely due to a symmetrical structure of CE. It should be noted that if the molar ratio of CE/Nb was increased up to 4:1 (CE-2b), the resulting IL actually contained a part of free CE, whose melting point (42.88 °C) was very close to that of the sole CE (43.34 °C) (Fig. 2 vs Fig. S5c). Consequently, a 3:1 M ratio of CE/Nb has been chosen as the optimal ratio in this work. Next, these synthesized ILs were characterized with FT-IR spectroscopy. As can be seen in Fig. 2 (right), the band of CE at approximately 2887 cm−1 arose from the vibration of C–H and the band near 1112 cm−1 was belong to v(CO) [47]. In addition, the band in NH4-Nb near 3169 cm−1 was related to the vibration of NH and the band at 815 cm−1 was characteristic for v(OO) [48]. However, some of the peaks showed obvious shifts after CE was added to the original NH4-Nb, forming the specific ILs (Fig. 2c and 2d, right). The band near 815 cm−1 attributing to v(OO) of NH4-Nb moved from 815 cm−1 to ca. 858 cm−1, revealing the existence of only one sort of perexo bond. Obviously, a blue shift of NH of ammonium ion was observed as the ILs was derived from NH4-Nb (Fig. 2b vs 2c and 2d, right), which indicated the hydrogen bonding interaction between CE and ammonium ion. Meanwhile, the host-guest interaction can also be evidenced by the shape of the characteristic peak around 3540 cm−1 corresponding to the v(C–H) of crown, which became broader after forming the specific ILs, indicating that NH4 + was likely bonded in the hole of CE, and thus the CE framework was affected by supramolecular interaction as well [49]. Additionally, the bands near 590 and 536 cm−1 were assigned to vibration of Nb-O in ILs [50]. The existence of the stretching of Nb-O-Nb bridge near 836 cm−1 evidenced that the peroxoniobate anion could be formed as dimer rather than mononuclear form [51]. Moreover, as compared to the band of peroxo bonds in CE-1 (Fig. 2c, right), the intensity of the band around 858 cm−1 (OO species) became weaker in organic acid coordinated crown-based ILs, suggesting the substitution of peroxo bonds by carboxylate ligands (Fig. 1). Meanwhile, the band near 1654 cm−1 could be assigned to the vibration of COO- coordinating with the niobium atom [33]. The result was also highly consistent with the result of the potential difference titration of Ce3+/Ce4+ (Table 1). It can be seen that in spite of the different CE/Nb, the FT-IR spectra of CE-2a and CE-2b were close to that of CE-2 (Fig. S4 vs Fig. 2d, right), demonstrating that their anion structures were very similar to each other. Next, the conductivity of CE and the ILs in the aqueous solution was determined as well. It was known that the conductivity was closely relevant to ionic diffusion rate [52]. As shown in Fig. 3 , the conductivity was approximately linear to the concentration of Nb (CNb) under low concentrations (0−2 mmol⋅L−1). Notably, the conductivity of NH4-Nb was much greater than that of the derived ILs in the aqueous solution. The conductivity (σ) is positively correlated with the ionic diffusion coefficient according to the Nernst-Einstein Eq. (1) [53]: (1) σ = F 2 R T α c ( D + + D - ) where α is degree of dissociation, σ is conductivity of compound, c represents molar concentration of compound, D+ and D− are the diffusion coefficients of ions, F is Faraday number, R is gas constant, and T is absolute temperature. The results from the conductivity measurement implied that the diffusion coefficient of ions in derived ILs was much smaller than that of NH4-Nb (Fig. 3). It has been reported that the diffusion coefficient of ions was highly dependent on the size and functional group of molecules [54,55]. The obvious reduction of the diffusion coefficient indicated the supramolecular association of the ammonium peroxoniobate with CE, leading to formation of the specific ILs. The as-synthesized ILs were also characterized by Raman spectroscopy. As shown in Fig. 4 a (CE-1), the band near 580 cm−1 was attributed to vs(Nb(O2)) and the band at 603 cm−1 was assigned to the vibration of Nb-O [56]. Besides, the band around 830 cm−1 was attributing to the stretching of the Nb-O-Nb and the band at 865 cm−1 was related to vibration of OO [48]. Additionally, the band around 898 cm−1 which resulted from v(NbO) was inactive in FT-IR spectroscopy but active in Raman spectroscopy, showing a high symmetry in structure of the IL. Moreover, the band at 1032 cm−1 was attributed to v(CO). For GLY coordinated IL (CE-2), the band assigned to vs(Nb(O2)) shifted from the former 580 cm−1 to 586 cm−1 and the intensity became weaker (Fig. 4a vs 4b), indicating that the peroxo band in CE-1 was replaced by the carboxylato ligands. The band attributed to v(Nb = O) shifted from 898 cm−1 to 908 cm−1 and the band at 1043 cm−1 was assigned to v(CO). Meantime, the band near 1680 cm−1 was related to v(COO-) which was coordinated with niobium atom by forming five-membered ring. The results indicated that both carboxylato group and neighboring hydroxyl group in GLY molecule were involved in generating complexes [57]. These results are in line with the structure of ILs as shown in Fig. 1 The thermogravimetric analysis (TGA) of the ILs was conducted sequentially. As shown in Fig. 5 , the obvious weight losses of approximately 89.8 % and 86.5 % were seen between 40 and 800 °C, which could be assigned to the decay of organic cations and carboxylate group in anion species. The weight loss at the beginning could be due to adsorbed water on ILs. The weight of ILs started to decrease sharply at approximately 200 °C, confirming that thermal stability of the specific ILs was almost identical to that of these conventional ILs. The matrix-assisted laser desorption and ionization time-of-flight mass spectrometry (MALDI-TOF) was thereafter utilized to investigate the dimer structure of ILs dissolved in water in the negative mode (Fig. S6a and S6b). The peaks of CE-1 dominantly existed at 516.9 m/z, 671.9 m/z, 687.9 m/z and 861.0 m/z, and the peaks of CE-2 presented at 500.9 m/z, 558.9 m/z, 672.0 m/z, 688.0 m/z and 861.1 m/z, respectively. The other unlabeled peaks are belonging to those of matrix molecules (CHCA). The other probable structures were displayed in Table S1, which revealed that CE-1 and CE-2 indeed existed in the form of the dimeric structure rather than mononuclear structure. The results of MALDI-TOF were then in line with those of elemental analysis, FT-IR and Raman spectra. 3.2 H2O2-induced structure transformation of peroxoniobate anion It is crucial to clarify how the specific IL anions evolved during the epoxidation. Next, the transformation of peroxoniobate anion in the ILs was determined by 93Nb NMR spectra. As shown in Fig. 6 a, a mononuclear NH4-Nb complex exhibited a resonance signal at -1522 ppm, which was in well agreement with that of our previous result [32]. When the NH4-Nb was complexed with CE, the resulting CE-1 displayed a peak around -1160 ppm, indicating that the supramolecular interaction indeed has a considerable effect on the structure of peroxoniobate anion (Fig. 6b). Additionally, on coordinating with GLY, the chemical shift was further moved to low field and the signal shifted to -1000 ppm (Fig. 6c). This was due to a decrease of electron density around niobium atom when the peroxo bond was substituted by GLY acting as electron-withdrawing groups [58]. Especially, the presence of only one peak in CE-1 or CE-2 in 93Nb NMR indicated that the binuclear Nb-O-Nb sites in the supramolecular ILs might exist in the same chemical environment. In combination with the characterization of FT-IR, Raman, MALDI-TOF and 93Nb NMR, the evidences suggest that CE-1 and CE-2 exhibit as highly symmetric dimeric structure (Fig. 1). It was observed visually that when the present ILs were mixed with H2O2, an obvious exothermic phenomenon occurred. According to the experimental observation, the peroxoniobate anion could undergo the transformation of structure under action of H2O2. To investigate evolution of anion structure, CE-2 (0.4 mmol) was dissolved in methanol (2 mL), and then H2O2 (4 mmol) was dropped into the methanol solution and agitated continuously for 0.5 h at 273 K. The diethyl ether was immediately added to solution and then the sediment of the oxidizing Nb species was collected, which was washed with diethyl ether and was dried with cold air to get the oxidizing species sequentially. It was seen that the resulting oxidizing species owned a resonance signal at -1250 ppm in D2O (Fig. 6e), which appeared in higher field compared to other peroxoniobium species expect for NH4-Nb, implying the different chemical environment around niobium in oxidizing peroxoniobium species (Fig. 6e). The resonance signal shifting to high field meant more numbers of peroxo groups around niobium sites, which revealed that the peroxoniobate anion was further oxidized in the presence of H2O2. Additionally, Raman spectra of the oxidizing peroxoniobium species demonstrated the same phenomenon. As shown in Fig. 7 , there was a great difference in the characteristic peaks between the parent CE-2 and the oxidizing species (Fig. 7 vs 3b). The intensity of the bands at approximately 865 cm−1 and 581 cm−1 became stronger respectively, which were attributed to v(OO) and vs(Nb(O2)). Besides, the band at 908 cm−1 (vibration of Nb = O species) disappeared in the oxidizing species of the CE-2, revealing that the evolution from Nb = O to niobium peroxo groups were actually reversible in the course of reaction condition. Meantime, the band related to vibration of Nb-O moved from 603 cm−1 to 613 cm−1, reflecting that Nb = O and Nb-O bonds were highly dependent on each other. Further on, the peroxo number of the oxidizing form of CE-2 was measured via potential difference titration of Ce3+/Ce4+. The number of peroxo bonds was almost two per Nb atom in the dimer, indicating the oxidizing Nb species contained nearly four peroxo bonds, which is in accordance to the variation trend of 93Nb NMR. 3.3 Catalytic performance The cyclooctene was firstly chosen as model substrate for the epoxidation with H2O2 by using the IL catalysts at 50 °C with methanol as solvent. As displayed in Table 2 , the epoxidation might hardly proceed in the absence of catalysts (Table 2, entry 1), implying that only the H2O2 cannot epoxidize cyclooctene. CE also afforded poor activity in epoxidizing olefins (Table 2, entry 2). Obviously, GLY itself hardly epoxidized olefins (Table 2, entry 3), implying that the organic peroxo acid couldn’t be active species for the epoxidation under the present condition. Moreover, NH4-Nb was also inactive for epoxidation reaction (Table 2, entry 4). The NH4-Nb had a very poor solubility in methanol and the reaction mixture showed a clear solid-liquid biphase in the course of the reaction. However, the IL CE-1 was dissolved in the methanol and remained a homogeneous phase, and it showed much better performance than NH4-Nb (Table 2, entries 4 vs 5). These results confirmed that catalytic active sites might result from the part of peroxoniobate anions and the supramolecular complexation of the ammonium ion (NH4 +) with the CE led to better performance of the epoxidation reaction because of the better miscibility of the catalyst in the methanol [59,60]. Next, the effect of the anion structure on catalytic performance has been investigated. An interesting phenomenon was that epoxidation reaction proceeded even more efficiently when CE-1 was coordinated with GLY. The resulting IL CE-2 exhibited an excellent catalytic performance (Table 2, entry 6). This was because that organic ligand (GLY) acting as an electro-withdrawing group tended to decrease the electron density of Nb anion. The resulting electron-poor reaction sites (OO) was more prone to react with CC double bond due to electrophilic addition mechanism of the epoxidation process [61,62]. It has been found that introduction of 3-hydroxypropionic acid and acetic acid did not improve the catalytic activity at all, affording the almost same performance as parent IL (Table 2, entries 5, 7 and 8). Besides, when oxalic acid was added to CE-1, the conversion dropped down sharply due to too strong coordination interaction between oxalic acid and niobium sites (Table 2, entry 9), likely preventing the substrate molecules accessible to the reaction sites. However, lactic acid was proved to be a more effective additive than that of oxalic acid (Table 2, entry 10). Notably, the GLY was the best additive, and almost full conversion of cyclooctene could be achieved under the identical condition (Table 2, entry 11). The results suggested that only α-hydroxy carboxylic acid had a favorable influence on epoxidation reaction. Additionally, it should be noticed that the molar ratio of CE/Nb had a subtle effect on catalytic activity (Table 2, entries 6, 12 and 13) when specific ILs were generated via the NH4 + complexation with crown ether ring, which can be further confirmed via the time profile of the epoxidation using CE-2, CE-2a and CE-2b as catalysts (Fig. S7). CE-2 and CE-2b could show a slightly better activity, as compared with CE-2a, implying that increasing amount of CE could be beneficial to interaction between substrate and active centers duo to appropriate hydrophobicity. The effect of the solvents was sequentially investigated for epoxidizing cyclooctene with CE-2 as a catalyst. As shown in Table S2, the catalytic activity is very poor under solvent-free conditions, and the poor activity was also observed in ethyl acetate and dichloromethane likely owning to biphasic state under the conditions used. (Table S2, entries 1–3). However, the conversions of cyclooctene can reach up to 43 %, 82 %, 99 % in acetonitrile, ethanol and methanol, respectively (Table S2, entries 4–6). These data suggested that the strongly polar protic solvents, especially methanol could enhance the epoxidation reaction (Table S1, entries 4–6). It has been demonstrated from the previous work that the proton in the solvent participated in the formation of active intermediates via hydrogen bonding, which were favorable for the epoxidation of substrates [63]. A radical mechanism has been suggested in oxidation reactions for niobium-containing catalysts [64,65]. In this work, butylated hydroxytoluene (BHT) was used as a free radical trapper to investigate possible reaction mechanism, (Fig. S8). After reaction started for some time, the homogeneous mixture was separated into two parts. The one part continued to stir for reaction, and the second part was added 0.5 mmol BHT. Both of parts were subjected to GC analysis consecutively. As displayed in Fig. S8, the introduction of BHT had no any effect on the epoxidation reaction, demonstrating clearly that the epoxidation reaction occurred by catalytic mechanism instead of radical approach [66]. In addition, the EPR spectrum of the DMPO/⋅OH adduct kept silent under the reaction condition (Fig. S9), suggesting that ⋅OH radical could be not possibly involved in the oxidation reaction, in line with that of the above activity tests using BHT as free radical trapper. 3.4 Kinetic studies The cyclooctene has been selected as model substrate for the following kinetic investigation. With respect to the previous investigation of other groups and our work [32,33,43], the epoxidation of alkenes displayed the first-order dependence on the concentration of olefins and the zero-order dependence on H2O2 at low concentrations, indicating that the concentration of olefins rather than hydrogen peroxide could be responsible for the rate-limiting transition state. First, the influence of dosage of catalysts and stirring speeds on the reaction rate was studied to exclude limitations of diffusion (Fig. S10). Next, the dependence of reaction rate of cyclooctene on temperature (Arrhenius plots, 303−333 K) was examined with different ILs. The rate constants were obtained at low conversions (<20 %) on the basis of initial rate method. As can be seen in Fig. 8 , the linearity of Arrhenius plots was determined and activation energy was calculated on the basis of the pseudo-first-order kinetics pattern. It indicated that activation energy of CE-2 was only 29.81 kJ mol−1 which was below that of CE-1 (Ea = 58.99 kJ mol−1). The activation energy of the current ILs was also below that of the previous report, of which the activation energies were around 50−100 kJ mol-1 [67]. Actually, the activation energy of the current IL CE-2 was very close to that of carboxylic acid-modified peroxoniobate-based ILs [33], confirming that the present CE-2 was also a superior catalyst for epoxidation, but it was much easily available just via a supramolecular interaction, as compared with the peroxoniobate-based IL. 3.5 Substrate scope and recyclability Subsequently, the activity tests were performed to investigate the range of the substrates. As shown in Table 3 , various olefins and allylic alcohols were epoxidized into the corresponding epoxides with only 1 equiv of H2O2 with CE-2. A conversion in the range of 21–99 % was gained for epoxidation of cyclic olefins and chain olefins using methanol as the solvent (Table 3, entries 1–7). The epoxidation of cyclooctene showed better reactivity and selectivity in comparison to cyclohexene in the epoxidation of which the by-products were cyclohexane-1,2-diol and 2-methoxycyclohexanol detected by GC-MS (Table 3, entry 1 vs 2). The 2-cyclohexen-1-ol and cyclohexanone was not detected in the products, implying that a single electron transfer approach was not included in the epoxidation. Overall, the performance of the epoxidation of cyclic olefins was better than that of chain olefins. Interestingly, the conversion of trans-2-octene was obtained at approximately 21 %, which was lower than that of cis-2-octene (Table 3, entry 4 vs 5). The result suggested that steric hindrance around CC could have an important influence on the epoxidation reactivity, demonstrating that the process did not proceed by free radical mechanism. Moreover, the propylene can likewise be epoxidized to propylene oxide selectively under the present conditions, and the yield was around 32 % under 1.5 MPa of propylene pressure, providing a premising result for possible application. In addition, the IL CE-2 also had good catalytic activity and selectivity in the epoxidation of allylic alcohols (Table 3, entries 8–12). For long-chain allylic alcohols, methanol was needed to achieve higher reactivity and selectivity (Table 3, entries 9 and 12). Moreover, the oxidation of geraniol was regioselective because that hydroxyl groups in geraniol can be coordinated with Nb anion [32], and the main products were 2,3-epoxygeraniol. Nevertheless, when an electron-withdrawing group was around CC, a low reactivity for the epoxidation was obtained. The conversion of allyl methyl ether was low in comparison to other allylic alcohols, which was due to electrophilic addition mechanism of epoxidation (Table 3, entry 13). Besides, the hydroxyl group adjacent to the double bond could play a key role in bring CC bonds close to the peroxy oxygen, and facilitating the transfer of oxygen by forming hydrogen bond with the peroxo bond of ILs. The reusability of catalyst was likewise conducted at mild conditions. As displayed in Fig. 9 , the IL could still show the good performance even after five recycles in the epoxidation of cyclooctene, implying that the structure of the IL maintained high stability in the course of reaction, as verified by the similar 93Nb resonance signal as compared that of fresh with spent catalysts (Fig. 6c vs 6d). The 93Nb NMR signal of the reused CE-2 slightly shifted to -980 ppm, which was assigned to less numbers of peroxo groups around niobium sites, as compared to that of fresh CE-2 (-1000 ppm) due to the loss of peroxo groups after the consecutive recycles. Additionally, the FT-IR spectra of the spent CE-2 IL catalyst was almost identical to that of the fresh one (Fig. 2d, right and Fig. S11). Furthermore, the ICP-AES analysis demonstrated that no obvious Nb leaching was monitored (10−20 ppm), which could be responsible for a slight loss of the activity in the successive recycles. Moreover, the catalytic performance between two CE-derived ILs can be identified more clearly by the epoxidation of allylic alcohols. As shown in Fig. S12a, CE-2 indeed exhibited much higher activity than CE-1 when 2-buten-1-ol was adopted as model substrate under the identical conditions. As shown from Fig. S12b, there was an obvious difference of CE-1 and CE-2 in the decomposition rates of H2O2. Obviously, CE-2 was able to suppress invalid decomposition of H2O2 even in the absence of substrates compared with CE-1. This can be ascribed to the coordination of GLY with Nb anion, stabilizing peroxoniobate anion [33,68]. However, CE-1 catalyst can still exhibit moderate to high conversion in epoxidizing allylic alcohols although reaction time was needed to prolong (Table 3 and Table S3). Besides, the epoxidation of long-chain allylic alcohols required methanol as the solvent to achieve high reactivity and selectivity. Especially, the recyclability of the two catalysts was investigated under the optimal conditions for the epoxidation of 3-methyl-2-buten-1-ol. As observed in Fig. S13, the catalytic activity decreased slightly even after five recycles, demonstrating that both of two ILs could maintain high catalytic stability in epoxidizing allylic alcohols at the present reaction conditions. Based on the above characterization and activity tests, the reaction pathways were proposed and shown in Scheme 1 . The supramolecular IL (CE-2) was derived from CE-1 and the peroxo group of CE-2 was hardly detected by the potential difference titration of Ce3+/Ce4+(ca. 0.5 peroxo group per Nb atom) (Table 1). The symmetric dimeric structure has further been evidenced by the elemental analysis, MS, FT-IR and 93Nb NMR spectra etc. Next, the IL was oxidized under the action of the excess of H2O2, forming oxidizing intermediate species with four peroxo groups (OO), which was proved by potential difference titration of Ce3+/Ce4+. Afterwards, the CC double bonds then interacted with the peroxo group to generate epoxides through electrophilic oxygen transfer from the oxidizing species. Meantime, the peroxo group was transformed into Nb = O species. From the previous 93Nb NMR spectra, it demonstrated that the interconversion between Nb = O and niobium peroxo groups was completely reversible, which endowed the IL catalyst with good stability and recyclability. Furthermore, the present ILs can obviously improve their miscibility with organic solvent and H2O2, and allowing the facile access of substrates to the catalytically active due to the presence of CE, which enhanced the reaction rate in the process of the epoxidation reaction. Besides, in the crown ether-ammonium ion complexes, it has been reported that the three hydrogens of the NH4 + directly interact with the oxygens on the inside of CE by hydrogen-bond interaction while the fourth ammonium hydrogen could be hydrogen bonded to the anion [41]. This specific interaction would decrease the electron density of peroxo (OO) bond and could be beneficial to the epoxidation reaction by electrophilic oxygen transfer from peroxoniobate anions [32,33]. 4 Conclusions In this work, we have developed CE (18-crown-6)-derived ILs via the supramolecular complexation between CE and ammonium peroxoniobate in a simple manner. The molar ratio of CE to Nb atom have a vital influence on supramolecular complexation, and it indicated that the specific ILs were formed as the molar ratio of CE to Nb atom was more than 2:1. The parent IL consisting of CE and ammonium peroxoniobate (CE-1) could be further coordinated with GLY by forming five-membered chelate rings to generate a high performance IL (CE-2), which can act as a highly efficient and recoverable catalyst in epoxidizing a series of olefins and allylic alcohols using H2O2 at mild conditions. Additionally, it was demonstrated that CE-2 could suppress the degradation of H2O2 effectively in comparison with CE-1. Especially, the supramolecular complexation of CE with ammonium ion could play an important role in providing the appropriate hydrophobicity which is beneficial for the easy accessibility of hydrophobic substrates to the active centers. Furthermore, the interconversion between Nb = O and niobium peroxo groups was completely reversible, which was proved by 93Nb NMR and helped us to understand the reaction mechanism thoroughly. The supramolecular ILs exhibited huge advantages in that they was more easily available than that of the previously reported ILs. Undoubtedly, this work represents a vital research subject in the field of green catalysis that can be extended definitely for the efficient catalytic organic transformations via an easily available and sustainable catalytic system. CRediT authorship contribution statement Bingjie Ding: Conceptualization, Methodology, Data curation, Formal analysis, Writing - original draft. Ran Zhang: Formal analysis. Qingqing Zhou: Formal analysis, Writing - review & editing. Wenbao Ma: Investigation, Formal analysis. Anna Zheng: Resources. Difan Li: Software. Yefeng Yao: Methodology, Validation, Visualization. Zhenshan Hou: Funding acquisition, Writing - review & editing, Supervision, Project administration. Declaration of Competing Interest The authors reported no declarations of interest. Acknowledgements The authors gratefully thank from the National Natural Science Foundation of China (21773061, 21978095). Y. F. acknowledges financial support from Ministry of Science and Technology of the People’s Republic of China(Grant No. 2018YFC1602804, 2018YFF01012504) and Microscale Magnetic Resonance Platform of ECNU. Appendix A Supplementary data Supplementary material related to this article can be found, in the online version, at doi:https://doi.org/10.1016/j.mcat.2020.111342. Appendix A Supplementary data The following is Supplementary data to this article: References [1] D.T. Bregante N.E. Thornburg J.M. Notestein D.W. Flaherty Consequences of confinement for alkene epoxidation with hydrogen peroxide on highly dispersed group 4 and 5 metal oxide catalysts ACS Catal. 8 2018 2995 3010 10.1021/acscatal.7b03986 D.T. Bregante, N.E. Thornburg, J.M. Notestein, D.W. Flaherty, Consequences of confinement for alkene epoxidation with hydrogen peroxide on highly dispersed group 4 and 5 metal oxide catalysts, ACS Catal. 8 (2018) 2995-3010. https://pubs.acs.org/doi/10.1021/acscatal.7b03986. [2] W.B. Cunningham J.D. Tibbetts M. Hutchby K.A. Maltby M.G. Davidson U. Hintermair P. Plucinski S.D. Bull Sustainable catalytic protocols for the solvent free epoxidation and anti-dihydroxylation of the alkene bonds of biorenewable terpene feedstocks using H2O2 as oxidant Green Chem. 22 2020 513 524 10.1039/C9GC03208H W.B. Cunningham, J.D. Tibbetts, M. Hutchby, K.A. Maltby, M.G. Davidson, U. Hintermair, P. Plucinski, S.D. Bull, Sustainable catalytic protocols for the solvent free epoxidation and anti-dihydroxylation of the alkene bonds of biorenewable terpene feedstocks using H2O2 as oxidant, Green Chem. 22 (2020) 513-524. https://doi.org/10.1039/C9GC03208H. [3] Y. Jia Z.A. Alothman R. Liang S. Cha X. Li W. Ouyang A. Zheng S.M. Osman R. Luque Y. Sun Immobilization of (tartrate-salen)Mn(III) polymer complexes into SBA-15 for catalytic asymmetric epoxidation of alkenes Mol. Catal. 495 2020 111146 111155 10.1016/j.mcat.2020.111146 Y. Jia, Z.A. Alothman, R. Liang, S. Cha, X. Li, W. Ouyang, A. Zheng, S.M. Osman, R. Luque, Y. Sun, Immobilization of (tartrate-salen)Mn(III) polymer complexes into SBA-15 for catalytic asymmetric epoxidation of alkenes, Mol. Catal. 495 (2020) 111146-111155. https://doi.org/10.1016/j.mcat.2020.111146. [4] K. Kamata K. Sugahara R. Ishimoto S. Nojima M. Okazaki T. Matsumoto N. Mizuno Highly selective epoxidation of cycloaliphatic alkenes with aqueous hydrogen peroxide catalyzed by [PO4{WO(O2)2}4]3−/imidazole ChemCatChem 6 2014 2327 2332 10.1002/cctc.201402268 K. Kamata, K. Sugahara, R. Ishimoto, S. Nojima, M. Okazaki, T. Matsumoto, N. Mizuno, Highly selective epoxidation of cycloaliphatic alkenes with aqueous hydrogen peroxide catalyzed by [PO4{WO(O2)2}4]3-−/imidazole, ChemCatChem 6 (2014) 2327-2332. https://doi.org/10.1002/cctc.201402268. [5] J. Chen Z. Jiang S. Fukuzumi W. Nam B. Wang Artificial nonheme iron and manganese oxygenases for enantioselective olefin epoxidation and alkane hydroxylation reactions Coord. Chem. Rev. 421 2020 213443 213470 10.1016/j.ccr.2020.213443 J. Chen, Z. Jiang, S. Fukuzumi, W. Nam, B. Wang, Artificial nonheme iron and manganese oxygenases for enantioselective olefin epoxidation and alkane hydroxylation reactions, Coord. Chem. Rev. 421 (2020) 213443-213470. https://doi.org/10.1016/j.ccr.2020.213443. [6] B.S. Lane K. Burgess Metal-catalyzed epoxidations of alkenes with hydrogen peroxide Chem. Rev. 103 2003 2457 2473 10.1021/cr020471z B.S. Lane, K. Burgess, Metal-catalyzed epoxidations of alkenes with hydrogen peroxide, Chem. Rev. 103 (2003) 2457-2473. https://doi.org/10.1021/cr020471z. [7] W. Cheng X. Wang G. Li X. Guo S. Zhang Highly efficient epoxidation of propylene to propylene oxide over TS-1 using urea + hydrogen peroxide as oxidizing agent J. Catal. 255 2008 343 346 10.1016/j.jcat.2008.02.018 W. Cheng, X. Wang, G. Li, X. Guo, S. Zhang, Highly efficient epoxidation of propylene to propylene oxide over TS-1 using urea + hydrogen peroxide as oxidizing agent, J. Catal. 255 (2008) 343-346. https://doi.org/10.1016/j.jcat.2008.02.018. [8] L. Davies P. McMorn D. Bethell P.C. Bulman Page F. King F.E. Hancock G.J. Hutchings Effect of preparation method on leaching of Ti from the redox molecular sieve TS-1 Phys. Chem. Chem. Phys. 3 2001 632 639 10.1039/B007651L L. Davies, P. McMorn, D. Bethell, P.C. Bulman Page, F. King, F.E. Hancock, G.J. Hutchings, Effect of preparation method on leaching of Ti from the redox molecular sieve TS-1, Phys. Chem. Chem. Phys. 3 (2001) 632-639. https://doi.org/10.1039/B007651L. [9] C.R. Goldsmith Aluminum and gallium complexes as homogeneous catalysts for reduction/oxidation reactions Coord. Chem. Rev. 377 2018 209 224 10.1016/j.ccr.2018.08.025 C.R. Goldsmith, Aluminum and gallium complexes as homogeneous catalysts for reduction/oxidation reactions, Coord. Chem. Rev. 377 (2018) 209-224. https://doi.org/10.1016/j.ccr.2018.08.025. [10] M. Amini M.M. Haghdoost M. Bagherzadeh Monomeric and dimeric oxido–peroxido tungsten(VI) complexes in catalytic and stoichiometric epoxidation Coord. Chem. Rev. 268 2014 83 100 10.1016/j.ccr.2014.01.035 M. Amini, M.M. Haghdoost, M. Bagherzadeh, Monomeric and dimeric oxido–peroxido tungsten(VI) complexes in catalytic and stoichiometric epoxidation, Coord. Chem. Rev. 268 (2014) 83-100. https://doi.org/10.1016/j.ccr.2014.01.035. [11] A. Dupé M.K. Hossain J.A. Schachner F. Belaj A. Lehtonen E. Nordlander N.C. Mösch-Zanetti Dioxomolybdenum(VI) and -tungsten(VI) complexes with multidentate aminobisphenol ligands as catalysts for olefin epoxidation Eur. J. Inorg. Chem. 2015 2015 3572 3579 10.1002/ejic.201500055 2015A. Dupé, M.K. Hossain, J.A. Schachner, F. Belaj, A. Lehtonen, E. Nordlander, N.C. Mösch-Zanetti, Dioxomolybdenum(VI) and -tungsten(VI) complexes with multidentate aminobisphenol ligands as catalysts for olefin epoxidation, Eur. J. Inorg. Chem. 2015 (2015) 3572-3579. https://doi.org/10.1002/ejic.201500055. [12] A. Schmidt N. Grover T.K. Zimmermann L. Graser M. Cokoja A. Pöthig F.E. Kühn Synthesis and characterization of novel cyclopentadienyl molybdenum imidazo[1,5-a]pyridine-3-ylidene complexes and their application in olefin epoxidation catalysis J. Catal. 319 2014 119 126 10.1016/j.jcat.2014.08.013 A. Schmidt, N. Grover, T.K. Zimmermann, L. Graser, M. Cokoja, A. Pöthig, F.E. Kühn, Synthesis and characterization of novel cyclopentadienyl molybdenum imidazo[1,5-a]pyridine-3-ylidene complexes and their application in olefin epoxidation catalysis, J. Catal. 319 (2014) 119-126. https://doi.org/10.1016/j.jcat.2014.08.013. [13] N. Zwetter J.A. Schachner F. Belaj N.C. Mösch-Zanetti Hydrogen bond donor functionalized dioxido-molybdenum(VI) complexes as robust and highly efficient precatalysts for alkene epoxidation Mol. Catal. 443 2017 209 219 10.1016/j.mcat.2017.09.036 N. Zwetter, J.A. Schachner, F. Belaj, N.C. Mösch-Zanetti, Hydrogen bond donor functionalized dioxido-molybdenum(VI) complexes as robust and highly efficient precatalysts for alkene epoxidation, Mol. Catal. 443 (2017) 209-219. https://doi.org/10.1016/j.mcat.2017.09.036. [14] W. Yan G. Zhang H. Yan Y. Liu X. Chen X. Feng X. Jin C. Yang Liquid-phase epoxidation of light olefins over W and Nb nanocatalysts ACS Sustain. Chem. Eng. 6 2018 4423 4452 10.1021/acssuschemeng.7b03101 W. Yan, G. Zhang, H. Yan, Y. Liu, X. Chen, X. Feng, X. Jin, C. Yang, Liquid-phase epoxidation of light olefins over W and Nb nanocatalysts, ACS Sustain. Chem. Eng. 6 (2018) 4423-4452. https://doi.org/10.1021/acssuschemeng.7b03101. [15] S. Ishikawa Y. Maegawa M. Waki S. Inagaki Immobilization of a molybdenum complex on bipyridine-based periodic mesoporous organosilica and its catalytic activity for epoxidation of olefins ACS Catal. 8 2018 4160 4169 10.1021/acscatal.8b00809 S. Ishikawa, Y. Maegawa, M. Waki, S. Inagaki, Immobilization of a molybdenum complex on bipyridine-based periodic mesoporous organosilica and its catalytic activity for epoxidation of olefins, ACS Catal. 8 (2018) 4160-4169. https://doi.org/10.1021/acscatal.8b00809. [16] C. Copéret A. Comas-Vives M.P. Conley D.P. Estes A. Fedorov V. Mougel H. Nagae F. Núñez-Zarur P.A. Zhizhko Surface organometallic and coordination chemistry toward single-site heterogeneous catalysts: strategies, methods, structures, and activities Chem. Rev. 116 2016 323 421 10.1021/acs.chemrev.5b00373 C. Copéret, A. Comas-Vives, M.P. Conley, D.P. Estes, A. Fedorov, V. Mougel, H. Nagae, F. Núñez-Zarur, P.A. Zhizhko, Surface organometallic and coordination chemistry toward single-site heterogeneous catalysts: strategies, methods, structures, and activities, Chem. Rev. 116 (2016) 323-421. https://doi.org/10.1021/acs.chemrev.5b00373. [17] P. Carniti A. Gervasini C. Tiozzo M. Guidotti Niobium-containing hydroxyapatites as amphoteric catalysts: synthesis, properties, and activity ACS Catal. 4 2014 469 479 10.1021/cs4010453 P. Carniti, A. Gervasini, C. Tiozzo, M. Guidotti, Niobium-containing hydroxyapatites as amphoteric catalysts: synthesis, properties, and activity, ACS Catal. 4 (2014) 469-479. https://doi.org/10.1021/cs4010453. [18] N.E. Thornburg S.L. Nauert A.B. Thompson J.M. Notestein Synthesis−structure−function relationships of silica-supported Niobium(V) catalysts for alkene epoxidation with H2O2 ACS Catal. 6 2016 6124 6134 10.1021/acscatal.6b01796 N.E. Thornburg, S.L. Nauert, A.B. Thompson, J.M. Notestein, Synthesis−structure−function relationships of silica-supported Niobium(V) catalysts for alkene epoxidation with H2O2, ACS Catal. 6 (2016) 6124-6134. https://doi.org/10.1021/acscatal.6b01796. [19] N.E. Thornburg A.B. Thompson J.M. Notestein Periodic trends in highly dispersed groups IV and V supported metal oxide catalysts for alkene epoxidation with H2O2 ACS Catal. 5 2015 5077 5088 10.1021/acscatal.5b01105 N.E. Thornburg, A.B. Thompson, J.M. Notestein, Periodic trends in highly dispersed groups IV and V supported metal oxide catalysts for alkene epoxidation with H2O2, ACS Catal. 5 (2015) 5077-5088. https://doi.org/10.1021/acscatal.5b01105. [20] H. Egami T. Oguma T. Katsuki Oxidation catalysis of Nb(salan) complexes: asymmetric epoxidation of allylic alcohols using aqueous hydrogen peroxide as an oxidant J. Am. Chem. Soc. 132 2010 5886 5895 10.1021/ja100795k H. Egami, T. Oguma, T. Katsuki, Oxidation catalysis of Nb(salan) complexes: asymmetric epoxidation of allylic alcohols using aqueous hydrogen peroxide as an oxidant, J. Am. Chem. Soc. 132 (2010) 5886-5895. https://doi.org/10.1021/ja100795k. [21] D.C. Batalha N.H. Marins R.M. Silva N.L.V. Carreño H.V. Fajardo M.J. Silva Oxidation of terpenic alcohols with hydrogen peroxide promoted by Nb2O5 obtained by microwave-assisted hydrothermal method Mol. Catal. 489 2020 110941 110952 10.1016/j.mcat.2020.110941 D.C. Batalha, N.H. Marins, R.M. Silva, N.L.V. Carreño, H.V. Fajardo, M.J. Silva, Oxidation of terpenic alcohols with hydrogen peroxide promoted by Nb2O5 obtained by microwave-assisted hydrothermal method, Mol. Catal. 489 (2020) 110941-110952. https://doi.org/10.1016/j.mcat.2020.110941. [22] Y. Qiao W. Ma N. Theyssen C. Chen Z. Hou Temperature-responsive ionic liquids: fundamental behaviors and catalytic applications Chem. Rev. 117 2017 6881 6928 10.1021/acs.chemrev.6b00652 Y. Qiao, W. Ma, N. Theyssen, C. Chen, Z. Hou, Temperature-responsive ionic liquids: fundamental behaviors and catalytic applications, Chem. Rev. 117 (2017) 6881-6928. https://doi.org/10.1021/acs.chemrev.6b00652. [23] G. Chen J. Zhang X. Chen X. Tan J. Shi D. Tan B. Zhang Q. Wan F. Zhang L. Liu B. Han G. Yang Metal ionic liquids for the rapid chemical fixation of CO2 under ambient conditions ChemCatChem 12 2020 1963 1967 10.1002/cctc.201902347 G. Chen, J. Zhang, X. Cheng, X. Tan, J. Shi, D. Tan, B. Zhang, Q. Wan, F. Zhang, L. Liu, B. Han, G. Yang, Metal ionic liquids for the rapid chemical fixation of CO2 under ambient conditions, ChemCatChem 12 (2020) 1963-1967. https://doi.org/10.1002/cctc.201902347. [24] J.P. Hallett T. Welton Room-temperature ionic liquids: solvents for synthesis and catalysis 2, Chem. Rev. 111 2011 3508 3576 10.1021/cr1003248 J.P. Hallett, T. Welton, Room-temperature ionic liquids: solvents for synthesis and catalysis. 2, Chem. Rev. 111 (2011) 3508-3576. https://doi.org/10.1021/cr1003248. [25] B.C. Leal C.S. Consorti G. Machado J. Dupont Palladium metal nanoparticles stabilized by ionophilic ligands in ionic liquids: synthesis and application in hydrogenation reactions Catal. Sci. Technol. 5 2015 903 909 10.1039/C4CY01116C B.C. Leal, C.S. Consorti, G. Machado, J. Dupont, Palladium metal nanoparticles stabilized by ionophilic ligands in ionic liquids: synthesis and application in hydrogenation reactions, Catal. Sci. Technol. 5 (2015) 903-909. https://doi.org/10.1039/C4CY01116C. [26] J.L. Shamshina G. Gurau L.E. Block L.K. Hansen C. Dingee A. Walters R.D. Rogers Chitin–calcium alginate composite fibers for wound care dressings spun from ionic liquid solution J. Mater. Chem. B. 2 2014 3924 3936 10.1039/C4TB00329B J.L. Shamshina, G. Gurau, L.E. Block, L.K. Hansen, C. Dingee, A. Walters, R.D. Rogers, Chitin–calcium alginate composite fibers for wound care dressings spun from ionic liquid solution, J. Mater. Chem. B. 2 (2014) 3924-3936. https://doi.org/10.1039/C4TB00329B. [27] J. Gräsvik J.P. Hallett T.Q. To T. Welton A quick, simple, robust method to measure the acidity of ionic liquids Chem. Commun. 50 2014 7258 7261 10.1039/C4CC02816C J. Gräsvik, J.P. Hallett, T.Q. To, T. Welton, A quick, simple, robust method to measure the acidity of ionic liquids, Chem. Commun. 50 (2014) 7258-7261. https://doi.org/10.1039/C4CC02816C. [28] Y. Li X. Zhang Z. Li J. Song X. Wang Full utilization of lignocellulose with ionic liquid polyoxometalates in a one-pot three-step conversion ChemSusChem 12 2019 1 11 10.1002/cssc.201902503 Y. Li, X. Zhang, Z. Li, J. Song, X. Wang, Full utilization of lignocellulose with ionic liquid polyoxometalates in a one-pot three-step conversion, ChemSusChem 12 (2019) 1-11. https://doi.org/10.1002/cssc.201902503. [29] S. Herrmann L.D. Matteis J.M. de la Fuente S.G. Mitchell C. Streb Removal of multiple contaminants from water by polyoxometalate supported ionic liquid phases (POM-SILPs) Angew. Chem. Int. Ed. 56 2017 1667 1670 10.1002/anie.201611072 S. Herrmann, L.D. Matteis, J.M. de la Fuente, S.G. Mitchell, C. Streb, Removal of multiple contaminants from water by polyoxometalate supported ionic liquid phases (POM-SILPs), Angew. Chem. Int. Ed. 56 (2017) 1667-1670. https://doi.org/10.1002/anie.201611072. [30] B.B.A. Bediako Q. Qian J. Zhang Y. Wang X. Shen J. Shi M. Cui G. Yang Z. Wang S. Tong B. Han Ru-catalyzed methanol homologation with CO2 and H2 in an ionic liquid Green Chem. 21 2019 4152 4158 10.1039/C9GC01185D B.B.A. Bediako, Q. Qian, J. Zhang, Y. Wang, X. Shen, J. Shi, M. Cui, G. Yang, Z. Wang, S. Tong, B. Han, Ru-catalyzed methanol homologation with CO2 and H2 in an ionic liquid, Green Chem. 21 (2019) 4152-4158. https://doi.org/10.1039/C9GC01185D. [31] V.S. Souza J.D. Scholten D.E. Weibel D. Eberhardt D.L. Baptista S.R. Teixeira J. Dupont Hybrid tantalum oxide nanoparticles from the hydrolysis of imidazolium tantalate ionic liquids: efficient catalysts for hydrogen generation from ethanol/water solutions J. Mater. Chem. A. 4 2016 7469 7475 10.1039/C6TA02114J V.S. Souza, J.D. Scholten, D.E. Weibel, D. Eberhardt, D.L. Baptista, S.R. Teixeira, J. Dupont, Hybrid tantalum oxide nanoparticles from the hydrolysis of imidazolium tantalate ionic liquids: efficient catalysts for hydrogen generation from ethanol/water solutions, J. Mater. Chem. A. 4 (2016) 7469-7475. https://doi.org/10.1039/C6TA02114J. [32] C. Chen H. Yuan H. Wang Y. Yao W. Ma J. Chen Z. Hou Highly efficient epoxidation of allylic alcohols with hydrogen peroxide catalyzed by peroxoniobate-based ionic liquids ACS Catal. 6 2016 3354 3364 10.1021/acscatal.6b00786 C. Chen, H. Yuan, H. Wang, Y. Yao, W. Ma, J. Chen, Z. Hou, Highly efficient epoxidation of allylic alcohols with hydrogen peroxide catalyzed by peroxoniobate-based ionic liquids, ACS Catal. 6 (2016) 3354-3364. https://doi.org/10.1021/acscatal.6b00786. [33] W. Ma H. Yuan H. Wang Q. Zhou K. Kong D. Li Y. Yao Z. Hou Identifying catalytically active mononuclear peroxoniobate anion of ionic liquids in the epoxidation of Olefins ACS Catal. 8 2018 4645 4659 10.1021/acscatal.7b04443 W. Ma, H. Yuan, H. Wang, Q. Zhou, K. Kong, D. Li, Y. Yao, Z. Hou, Identifying catalytically active mononuclear peroxoniobate anion of ionic liquids in the epoxidation of Olefins, ACS Catal. 8 (2018) 4645-4659. https://doi.org/10.1021/acscatal.7b04443. [34] G. Benay G. Wipff Ammonium recognition by 18-crown‑6 in different solutions and at an aqueous interface: a simulation study J. Phys. Chem. B 118 2014 13913 13929 10.1021/jp508379w G. Benay, G. Wipff, Ammonium recognition by 18-crown‑6 in different solutions and at an aqueous interface: a simulation study, J. Phys. Chem. B. 118 (2014) 13913-13929. https://doi.org/10.1021/jp508379w. [35] D. Yu T. Mu Strategy to form eutectic molecular liquids based on noncovalent interactions J. Phys. Chem. B 123 2019 4958 4966 10.1021/acs.jpcb.9b02891 D. Yu, T. Mu, Strategy to form eutectic molecular liquids based on noncovalent interactions, J. Phys. Chem. B. 123 (2019) 4958-4966. https://doi.org/10.1021/acs.jpcb.9b02891. [36] M. Gao Y. Wang Q. Yi Y. Su P. Sun X. Wang J. Zhao G. Zou A novel solid-state electrolyte based on a crown ether lithium salt complex J. Mater. Chem. A. 3 2015 20541 20546 10.1039/C5TA04933D M. Gao, Y. Wang, Q. Yi, Y. Su, P. Sun, X. Wang, J. Zhao, G. Zou, A novel solid-state electrolyte based on a crown ether lithium salt complex, J. Mater. Chem. A. 3 (2015) 20541-20546. https://doi.org/10.1039/C5TA04933D. [37] Y. Song H. Jing B. Li D. Bai Crown ether complex cation ionic liquids: preparation and applications in organic reactions Chem. Eur. J. 17 2011 8731 8738 10.1002/chem.201100112 Y. Song, H. Jing, B. Li, D. Bai, Crown ether complex cation ionic liquids: preparation and applications in organic reactions, Chem. Eur. J. 17 (2011) 8731-8738. https://doi.org/10.1002/chem.201100112. [38] T. Xiao L. Xu L. Zhou X.Q. Sun C. Lin L. Wang Dynamic hydrogels mediated by macrocyclic host–guest interactions J. Mater. Chem. B. 7 2019 1526 1540 10.1039/C8TB02339E T. Xiao, L. Xu, L. Zhou, X.Q. Sun, C. Lin, L. Wang, Dynamic hydrogels mediated by macrocyclic host–guest interactions, J. Mater. Chem. B. 7 (2019) 1526-1540. https://doi.org/10.1039/C8TB02339E. [39] D.A. Fowler C.R. Pfeiffer S.J. Teat C.M. Beavers G.A. Baker J.L. Atwood Illuminating host–guest cocrystallization between pyrogallol[4]arenes and the ionic liquid 1-ethyl-3-methylimidazolium ethylsulfate CrystEngComm 16 2014 6010 6022 10.1039/C4CE00359D D.A. Fowler, C.R. Pfeiffer, S.J. Teat, C.M. Beavers, G.A. Baker, J.L. Atwood, Illuminating host–guest cocrystallization between pyrogallol[4]arenes and the ionic liquid 1-ethyl-3-methylimidazolium ethylsulfate, CrystEngComm 16 (2014) 6010-6022. https://doi.org/10.1039/C4CE00359D. [40] W. Ma C. Chen K. Kong Q. Dong K. Li M. Yuan D. Li Z. Hou Peroxotantalate-based ionic liquid catalyzed epoxidation of allylic alcohols with hydrogen peroxide Chem. Eur. J. 23 2017 7287 7296 10.1002/chem.201605661 W. Ma, C. Chen, K. Kong, Q. Dong, K. Li, M. Yuan, D. Li, Z. Hou, Peroxotantalate-based ionic liquid catalyzed epoxidation of allylic alcohols with hydrogen peroxide, Chem. Eur. J. 23 (2017) 7287-7296. https://doi.org/10.1002/chem.201605661. [41] A. Chen C. Chen Y. Xiu X. Liu J. Chen L. Guo R. Zhang Z. Hou Niobate salts of organic base catalyzed chemical fixation of carbon dioxide with epoxides to form cyclic carbonates Green Chem. 17 2015 1842 1852 10.1039/C4GC02244K A. Chen, C. Chen, Y. Xiu, X. Liu, J. Chen, L. Guo, R. Zhang, Z. Hou, Niobate salts of organic base catalyzed chemical fixation of carbon dioxide with epoxides to form cyclic carbonates, Green Chem. 17 (2015) 1842-1852. https://doi.org/10.1039/C4GC02244K. [42] D. Bayot B. Tinant M. Devillers Water-soluble niobium peroxo complexes as precursors for the preparation of Nb-based oxide catalysts Catal. Today 78 2003 439 447 10.1016/S0920-5861(02)00325-5 D. Bayot, B. Tinant, M. Devillers, Water-soluble niobium peroxo complexes as precursors for the preparation of Nb-based oxide catalysts, Catal. Today 78 (2003) 439-447. https://doi.org/10.1016/S0920-5861(02)00325-5. [43] K. Kamata K. Yamaguchi N. Mizuno Highly selective, recyclable epoxidation of allylic alcohols with hydrogen peroxide in water catalyzed by dinuclear peroxotungstate Chem. Eur. J. 10 2004 4728 4734 10.1002/chem.200400352 K. Kamata, K. Yamaguchi, N. Mizuno, Highly selective, recyclable epoxidation of allylic alcohols with hydrogen peroxide in water catalyzed by dinuclear peroxotungstate, Chem. Eur. J. 10 (2004) 4728-4734. https://doi.org/10.1002/chem.200400352. [44] C. Endicott H.L. Strauss Infrared hole burning of crown ether 18-c-6 ammonium ion complexes J. Phys. Chem. A 111 2007 1236 1244 10.1021/jp0658795 C. Endicott, H.L. Strauss, Infrared hole burning of crown ether 18-c-6 ammonium ion complexes, J. Phys. Chem. A. 111 (2007) 1236-1244. https://doi.org/10.1021/jp0658795. [45] D. Yu H. Mou H. Fu X. Lan Y. Wang T. Mu “Inverted” deep eutectic solvents based on host-guest interactions Chem. Asian J. 14 2019 4183 4188 10.1002/asia.201901365 D. Yu, H. Mou, H. Fu, X. Lan, Y. Wang, T. Mu, “Inverted” deep eutectic solvents based on host-guest interactions, Chem. Asian J. 14 (2019) 4183-4188. https://doi.org/10.1002/asia.201901365. [46] M.G. Mohamed S.-W. Kuo Crown ether-functionalized polybenzoxazine for metal ion adsorption Macromolecules 53 2020 2420 2429 10.1021/acs.macromol.9b02519 M.G. Mohamed, S.-W. Kuo, Crown ether-functionalized polybenzoxazine for metal ion adsorption, Macromolecules 53 (2020) 2420-2429. https://dx.doi.org/10.1021/acs.macromol.9b02519. [47] Z.-Z. Yang D. Jiang X. Zhu C. Tian S. Brown C.-L. Do-Thanh L.-N. He S. Dai Coordination effect-regulated CO2 capture with an alkali metal onium salts/crown ether system Green Chem. 16 2014 253 258 10.1039/C3GC41513A Z.-Z. Yang, D. Jiang, X. Zhu, C. Tian, S. Brown, C.-L. Do-Thanh, L.-N. He, S. Dai, Coordination effect-regulated CO2 capture with an alkali metal onium salts/crown ether system, Green Chem. 16 (2014) 253-258. https://doi.org/10.1039/C3GC41513A. [48] D. Bayot M. Devillers D. Peeters Vibrational spectra of eight-coordinate niobium and tantalum complexes with peroxo ligands: a theoretical simulation Eur. J. Inorg. Chem. 2005 2005 4118 4123 10.1002/ejic.200500428 2005D. Bayot, M. Devillers, D. Peeters, Vibrational spectra of eight-coordinate niobium and tantalum complexes with peroxo ligands: a theoretical simulation, Eur. J. Inorg. Chem. 2005 (2005) 4118-4123. https://doi.org/10.1002/ejic.200500428. [49] Z. Yan X. Lin H. Guo F. Yang A novel fluorescence sensor for K+ based on bis-Bodipy: the ACQ effect controlled by cation complexation of pseudo crown ether ring Tetrahedron Lett. 58 2017 3064 3068 10.1016/j.tetlet.2017.06.065 Z. Yan, X. Lin, H. Guo, F. Yang, A novel fluorescence sensor for K+ based on bis-Bodipy: the ACQ effect controlled by cation complexation of pseudo crown ether ring, Tetrahedron Lett. 58 (2017) 3064-3068. https://doi.org/10.1016/j.tetlet.2017.06.065. [50] L. Patron O. Carp I. Mindru G. Marinescu E. Segal Iron, nickel and zinc malates coordination compounds synthesis, characterization and thermal behaviour J. Therm. Anal. Cal. 72 2003 281 288 10.1023/A:1023948526145 L. Patron, O. Carp, I. Mindru, G. Marinescu, E. Segal, Iron, nickel and zinc malates coordination compounds synthesis, characterization and thermal behaviour, J. Therm. Anal. Cal. 72 (2003) 281-288. https://doi.org/10.1023/A:1023948526145. [51] A. Fielicke G. Meijer G. Helden Infrared spectroscopy of niobium oxide cluster cations in a molecular beam: identifying the cluster structures J. Am. Chem. Soc. 125 2003 3659 3667 10.1021/ja0288946 A. Fielicke, G. Meijer, G. Helden, Infrared spectroscopy of niobium oxide cluster cations in a molecular beam: identifying the cluster structures, J. Am. Chem. Soc. 125 (2003) 3659-3667. https://doi.org/10.1021/ja0288946. [52] G. Xu F. Hao M. Weng J. Hong F. Pan D. Fang Strong influence of strain gradient on lithium diffusion: flexo-diffusion effect Nanoscale 12 2020 15175 15184 10.1039/D0NR03746J G. Xu, F. Hao, M. Weng, J. Hong, F. Pan, D. Fang, Strong influence of strain gradient on lithium diffusion: flexo-diffusion effect, Nanoscale 12 (2020) 15175-15184. https://doi.org/10.1039/D0NR03746J. [53] L. Garrido I. Aranaz A. Gallardo C. García N. García E. Benito J. Guzmán Ionic conductivity, diffusion coefficients, and degree of dissociation in lithium electrolytes, ionic liquids, and hydrogel polyelectrolytes J. Phys. Chem. B 122 2018 8301 8308 10.1021/acs.jpcb.8b06424 L. Garrido, I. Aranaz, A. Gallardo, C. García, N. García, E. Benito, J. Guzmán, Ionic conductivity, diffusion coefficients, and degree of dissociation in lithium electrolytes, ionic liquids, and hydrogel polyelectrolytes, J. Phys. Chem. B. 122 (2018) 8301-8308. https://doi.org/10.1021/acs.jpcb.8b06424. [54] S. Saha M.N. Roy Exploration of complexes of 18-crown-6 with three similarly substituted imidazolium, pyridinium and pyrrolidinium ionic liquids Chem. Phys. Lett. 684 2017 44 52 10.1016/j.cplett.2017.06.037 S. Saha, M.N. Roy, Exploration of complexes of 18-crown-6 with three similarly substituted imidazolium, pyridinium and pyrrolidinium ionic liquids, Chem. Phys. Lett. 684 (2017) 44-52. https://doi.org/10.1016/j.cplett.2017.06.037. [55] M. Zanatta V.U. Antunes C.F. Tormena J. Dupont F.P. dos Santos Dealing with supramolecular structure for ionic liquids: a DOSY NMR approach Phys. Chem. Chem. Phys. 21 2019 2567 2571 10.1039/C8CP07071G M. Zanatta, V.U. Antunes, C.F. Tormena, J. Dupont, F.P. dos Santos, Dealing with supramolecular structure for ionic liquids: a DOSY NMR approach, Phys. Chem. Chem. Phys. 21 (2019) 2567-2571. https://doi.org/10.1039/C8CP07071G. [56] H. Barańska J. Kuduk-Jaworska R. Szostak A. Romaniewska Vibrational spectra of racemic and enantiomeric malic acids J. Raman Spectrosc. 34 2003 68 76 10.1002/jrs.953 H. Barańska, J. Kuduk-Jaworska, R. Szostak, A. Romaniewska. Vibrational spectra of racemic and enantiomeric malic acids, J. Raman Spectrosc. 34 (2003) 68-76. https://doi.org/10.1002/jrs.953. [57] D. Bayot B. Tinant M. Devillers Homo- and heterobimetallic niobiumv and tantalumv peroxo-tartrate complexes and their use as molecular precursors for Nb-Ta mixed oxides Inorg. Chem. 44 2005 1554 1562 10.1021/ic0484250 D. Bayot, B. Tinant, M. Devillers, Homo- and heterobimetallic niobiumv and tantalumv peroxo-tartrate complexes and their use as molecular precursors for Nb-Ta mixed oxides, Inorg. Chem. 44 (2005) 1554-1562. https://doi.org/10.1021/ic0484250. [58] C.P. Reghunadhan Nair P.K. Manshad A.M. Ashir S. Athul Synthesis of 3-carbonoyl acrylic acid-functionalized polystyrene and an insight in to its role in cross linking and grafting of polystyrene on to natural rubber Eur. Polym. J. 131 2020 109687 109696 10.1016/j.eurpolymj.2020.109688 C.P. Reghunadhan Nair, P.K. Manshad, A.M. Ashir, S. Athul, Synthesis of 3-carbonoyl acrylic acid-functionalized polystyrene and an insight in to its role in cross linking and grafting of polystyrene on to natural rubber, Eur. Polym. J. 131 (2020) 109687-109696. https://doi.org/10.1016/j.eurpolymj.2020.109688. [59] C. Chen X. Zhao J. Chen L. Hua R. Zhang L. Guo B. Song H. Gan Z. Hou Niobium peroxide-catalyzed selective epoxidation of allylic alcohols ChemCatChem 6 2014 3231 3238 10.1002/cctc.201402545 C. Chen, X. Zhao, J. Chen, L. Hua, R. Zhang, L. Guo, B. Song, H. Gan, Z. Hou, Niobium peroxide-catalyzed selective epoxidation of allylic alcohols, ChemCatChem 6 (2014) 3231-3238. https://doi.org/10.1002/cctc.201402545. [60] F. Liu L. Wang Q. Sun L. Zhu X. Meng F.-S. Xiao Transesterification catalyzed by ionic liquids on superhydrophobic mesoporous polymers: heterogeneous catalysts that are faster than homogeneous catalysts J. Am. Chem. Soc. 134 2012 16948 16950 10.1021/ja307455w F. Liu, L. Wang, Q. Sun, L. Zhu, X. Meng, F.-S. Xiao, Transesterification catalyzed by ionic liquids on superhydrophobic mesoporous polymers: heterogeneous catalysts that are faster than homogeneous catalysts, J. Am. Chem. Soc. 134 (2012) 16948-16950. https://doi.org/10.1021/ja307455w. [61] A. Solé-Daura T. Zhang H. Fouilloux C. Robert C.M. Thomas L.-M. Chamoreau J.J. Carbó A. Proust G. Guillemot J.M. Poblet Catalyst design for alkene epoxidation by molecular analogues of heterogeneous titanium-silicalite catalysts ACS Catal. 10 2020 4737 4750 10.1021/acscatal.9b05147 A. Solé-Daura, T. Zhang, H. Fouilloux, C. Robert, C.M. Thomas, L.-M. Chamoreau, J.J. Carbó, A. Proust, G. Guillemot, J.M. Poblet, Catalyst design for alkene epoxidation by molecular analogues of heterogeneous titanium-silicalite catalysts, ACS Catal. 10 (2020) 4737-4750. https://dx.doi.org/10.1021/acscatal.9b05147. [62] Y. Qiao Z. Hou H. Li Y. Hu B. Feng X. Wang L. Hua Q. Huang Polyoxometalate-based protic alkylimidazolium salts as reaction-induced phase-separation catalysts for olefin epoxidation Green Chem. 11 2009 1955 1960 10.1039/B916766H Y. Qiao, Z. Hou, H. Li, Y. Hu, B. Feng, X. Wang, L. Hua, Q. Huang, Polyoxometalate-based protic alkylimidazolium salts as reaction-induced phase-separation catalysts for olefin epoxidation, Green Chem. 11 (2009) 1955-1960. https://doi.org/10.1039/B916766H. [63] Y. Cao H. Yu H. Wang F. Peng Solvent effect on the allylic oxidation of cyclohexene catalyzed by nitrogen doped carbon nanotubes Catal. Commun. 88 2017 99 103 10.1016/j.catcom.2016.10.002 Y. Cao, H. Yu, H. Wang, F. Peng, Solvent effect on the allylic oxidation of cyclohexene catalyzed by nitrogen doped carbon nanotubes, Catal. Commun. 88 (2017) 99-103. https://doi.org/10.1016/j.catcom.2016.10.002. [64] M. Ziolek P. Decyk I. Sobczak M. Trejda J. Florek H.G.W. Klimas A. Wojtaszek Catalytic performance of niobium species in crystalline and amorphous solids—gas and liquid phase oxidation Appl. Catal. A Gen. 391 2011 194 204 10.1016/j.apcata.2010.07.022 M. Ziolek, P. Decyk, I. Sobczak, M. Trejda, J. Florek, H.G.W. Klimas, A. Wojtaszek, Catalytic performance of niobium species in crystalline and amorphous solids—gas and liquid phase oxidation, Appl. Catal. A. 391 (2011) 194-204. https://doi.org/10.1016/j.apcata.2010.07.022. [65] M. Ziolek I. Sobczak P. Decyk K. Sobańska P. Pietrzyk Z. Sojka Search for reactive intermediates in catalytic oxidation with hydrogenperoxide over amorphous niobium(V) and tantalum(V) oxides Appl. Catal. B 164 2015 288 296 10.1016/j.apcatb.2014.09.024 M. Ziolek, I. Sobczak, P. Decyk, K. Sobańska, P. Pietrzyk, Z. Sojka, Search for reactive intermediates in catalytic oxidation with hydrogenperoxide over amorphous niobium(V) and tantalum(V) oxides, Appl. Catal. B. 164 (2015) 288-296. https://doi.org/10.1016/j.apcatb.2014.09.024. [66] H. Alshammari P.J. Miedziak T.E. Davies D.J. Willock D.W. Knight G.J. Hutchings Initiator-free hydrocarbon oxidation using supported gold nanoparticles Catal. Sci. Technol. 4 2014 908 911 10.1039/C4CY00088A H. Alshammari, P.J. Miedziak, T.E. Davies, D.J. Willock, D.W. Knight, G.J. Hutchings, Initiator-free hydrocarbon oxidation using supported gold nanoparticles, Catal. Sci. Technol. 4 (2014) 908-911. https://doi.org/10.1039/C4CY00088A. [67] M. Papastergiou P. Stathi E.R. Milaeva Y. Deligiannakis M. Louloudi Comparative study of the catalytic thermodynamic barriers for two homologous Mn- and Fe-non-heme oxidation catalysts J. Catal. 341 2016 104 115 10.1016/j.jcat.2016.06.017 M. Papastergiou, P. Stathi, E.R. Milaeva, Y. Deligiannakis, M. Louloudi, Comparative study of the catalytic thermodynamic barriers for two homologous Mn- and Fe-non-heme oxidation catalysts, J. Catal. 341 (2016) 104-115. https://doi.org/10.1016/j.jcat.2016.06.017. [68] C. Djordjević N. Vuletić Coordination complexes of niobium and tantalum. V. eight-coordinated di- and triperoxoniobates(V) and -tantalates(V) with some nitrogen and oxygen bidentate ligands Inorg. Chem. 7 1968 1864 1868 10.1021/ic50067a033 C. Djordjević, N. Vuletić, Coordination complexes of niobium and tantalum. V. eight-coordinated di- and triperoxoniobates(V) and -tantalates(V) with some nitrogen and oxygen bidentate ligands, Inorg. Chem. 7 (1968) 1864-1868. https://doi.org/10.1021/ic50067a033.",
      "scopus-id": "85098181832",
      "coredata": {
        "eid": "1-s2.0-S2468823120306052",
        "dc:description": "This work demonstrated that the specific ionic liquids (ILs) have been designed via the supramolecular complexation between 18-crown-6 (CE) and ammonium peroxoniobate (NH4-Nb). The resultant ILs have been characterized by elemental analysis, FT-IR, Raman, NMR, DSC, conductivity measurement and MALDI-TOF, etc. The IL (CE-1) consisting of CE and ammonium peroxoniobate can be further coordinated with GLY to generate a new IL (CE-2), which showed both high catalytic activity in epoxidation with H2O2 and good recyclability. The characterization of 93Nb NMR spectra revealed that the peroxoniobate anions has demonstrated a structural evolution in the presence of hydrogen peroxide, in which NbO species can be easily oxidized into the catalytically active niobium−peroxo species. Especially, the supramolecular complexation can provide suitable hydrophobicity, which ensured that the hydrophobic olefins and allylic alcohols were easily accessible to the catalytically active anions, and thus facilitated the epoxidation reaction. Notably, the supramolecular IL catalysts in this work exhibited a huge advantage of the easy availability, as compared with the previously reported peroxoniobate-based ILs. As far as we know, this is the first example of the highly selective epoxidation of olefins and allylic alcohols by using supramolecular ILs as catalysts.",
        "openArchiveArticle": "false",
        "prism:coverDate": "2021-01-31",
        "openaccessUserLicense": null,
        "prism:aggregationType": "Journal",
        "prism:url": "https://api.elsevier.com/content/article/pii/S2468823120306052",
        "dc:creator": [
          {
            "@_fa": "true",
            "$": "Ding, Bingjie"
          },
          {
            "@_fa": "true",
            "$": "Zhang, Ran"
          },
          {
            "@_fa": "true",
            "$": "Zhou, Qingqing"
          },
          {
            "@_fa": "true",
            "$": "Ma, Wenbao"
          },
          {
            "@_fa": "true",
            "$": "Zheng, Anna"
          },
          {
            "@_fa": "true",
            "$": "Li, Difan"
          },
          {
            "@_fa": "true",
            "$": "Yao, Yefeng"
          },
          {
            "@_fa": "true",
            "$": "Hou, Zhenshan"
          }
        ],
        "link": [
          {
            "@_fa": "true",
            "@rel": "self",
            "@href": "https://api.elsevier.com/content/article/pii/S2468823120306052"
          },
          {
            "@_fa": "true",
            "@rel": "scidir",
            "@href": "https://www.sciencedirect.com/science/article/pii/S2468823120306052"
          }
        ],
        "dc:format": "application/json",
        "openaccessType": null,
        "pii": "S2468-8231(20)30605-2",
        "prism:volume": "500",
        "articleNumber": "111342",
        "prism:publisher": "Elsevier B.V.",
        "dc:title": "Olefin epoxidation with ionic liquid catalysts formed by supramolecular interactions",
        "prism:copyright": "© 2020 Elsevier B.V. All rights reserved.",
        "openaccess": "0",
        "prism:issn": "24688231",
        "dcterms:subject": [
          {
            "@_fa": "true",
            "$": "Ionic liquid"
          },
          {
            "@_fa": "true",
            "$": "Peroxoniobate"
          },
          {
            "@_fa": "true",
            "$": "Crown ether"
          },
          {
            "@_fa": "true",
            "$": "Supramolecularinteraction"
          },
          {
            "@_fa": "true",
            "$": "Olefin epoxidation"
          }
        ],
        "openaccessArticle": "false",
        "prism:publicationName": "Molecular Catalysis",
        "openaccessSponsorType": null,
        "prism:pageRange": "111342",
        "pubType": "fla",
        "prism:coverDisplayDate": "January 2021",
        "prism:doi": "10.1016/j.mcat.2020.111342",
        "prism:startingPage": "111342",
        "dc:identifier": "doi:10.1016/j.mcat.2020.111342",
        "openaccessSponsorName": null
      },
      "objects": {
        "object": [
          {
            "@category": "standard",
            "@height": "282",
            "@width": "376",
            "@_fa": "true",
            "$": "https://api.elsevier.com/content/object/eid/1-s2.0-S2468823120306052-gr9.jpg?httpAccept=%2A%2F%2A",
            "@multimediatype": "JPEG image file",
            "@type": "IMAGE-DOWNSAMPLED",
            "@size": "49182",
            "@ref": "gr9",
            "@mimetype": "image/jpeg"
          },
          {
            "@category": "standard",
            "@height": "444",
            "@width": "565",
            "@_fa": "true",
            "$": "https://api.elsevier.com/content/object/eid/1-s2.0-S2468823120306052-gr8.jpg?httpAccept=%2A%2F%2A",
            "@multimediatype": "JPEG image file",
            "@type": "IMAGE-DOWNSAMPLED",
            "@size": "61534",
            "@ref": "gr8",
            "@mimetype": "image/jpeg"
          },
          {
            "@category": "standard",
            "@height": "12",
            "@width": "59",
            "@_fa": "true",
            "$": "https://api.elsevier.com/content/object/eid/1-s2.0-S2468823120306052-fx11.jpg?httpAccept=%2A%2F%2A",
            "@multimediatype": "JPEG image file",
            "@type": "IMAGE-DOWNSAMPLED",
            "@size": "862",
            "@ref": "fx11",
            "@mimetype": "image/jpeg"
          },
          {
            "@category": "standard",
            "@height": "21",
            "@width": "41",
            "@_fa": "true",
            "$": "https://api.elsevier.com/content/object/eid/1-s2.0-S2468823120306052-fx10.jpg?httpAccept=%2A%2F%2A",
            "@multimediatype": "JPEG image file",
            "@type": "IMAGE-DOWNSAMPLED",
            "@size": "641",
            "@ref": "fx10",
            "@mimetype": "image/jpeg"
          },
          {
            "@category": "standard",
            "@height": "212",
            "@width": "565",
            "@_fa": "true",
            "$": "https://api.elsevier.com/content/object/eid/1-s2.0-S2468823120306052-gr5.jpg?httpAccept=%2A%2F%2A",
            "@multimediatype": "JPEG image file",
            "@type": "IMAGE-DOWNSAMPLED",
            "@size": "20996",
            "@ref": "gr5",
            "@mimetype": "image/jpeg"
          },
          {
            "@category": "standard",
            "@height": "15",
            "@width": "49",
            "@_fa": "true",
            "$": "https://api.elsevier.com/content/object/eid/1-s2.0-S2468823120306052-fx13.jpg?httpAccept=%2A%2F%2A",
            "@multimediatype": "JPEG image file",
            "@type": "IMAGE-DOWNSAMPLED",
            "@size": "801",
            "@ref": "fx13",
            "@mimetype": "image/jpeg"
          },
          {
            "@category": "standard",
            "@height": "283",
            "@width": "376",
            "@_fa": "true",
            "$": "https://api.elsevier.com/content/object/eid/1-s2.0-S2468823120306052-gr4.jpg?httpAccept=%2A%2F%2A",
            "@multimediatype": "JPEG image file",
            "@type": "IMAGE-DOWNSAMPLED",
            "@size": "25019",
            "@ref": "gr4",
            "@mimetype": "image/jpeg"
          },
          {
            "@category": "standard",
            "@height": "22",
            "@width": "84",
            "@_fa": "true",
            "$": "https://api.elsevier.com/content/object/eid/1-s2.0-S2468823120306052-fx12.jpg?httpAccept=%2A%2F%2A",
            "@multimediatype": "JPEG image file",
            "@type": "IMAGE-DOWNSAMPLED",
            "@size": "1282",
            "@ref": "fx12",
            "@mimetype": "image/jpeg"
          },
          {
            "@category": "standard",
            "@height": "298",
            "@width": "376",
            "@_fa": "true",
            "$": "https://api.elsevier.com/content/object/eid/1-s2.0-S2468823120306052-gr7.jpg?httpAccept=%2A%2F%2A",
            "@multimediatype": "JPEG image file",
            "@type": "IMAGE-DOWNSAMPLED",
            "@size": "15995",
            "@ref": "gr7",
            "@mimetype": "image/jpeg"
          },
          {
            "@category": "standard",
            "@height": "355",
            "@width": "376",
            "@_fa": "true",
            "$": "https://api.elsevier.com/content/object/eid/1-s2.0-S2468823120306052-gr6.jpg?httpAccept=%2A%2F%2A",
            "@multimediatype": "JPEG image file",
            "@type": "IMAGE-DOWNSAMPLED",
            "@size": "40159",
            "@ref": "gr6",
            "@mimetype": "image/jpeg"
          },
          {
            "@category": "standard",
            "@height": "28",
            "@width": "26",
            "@_fa": "true",
            "$": "https://api.elsevier.com/content/object/eid/1-s2.0-S2468823120306052-fx2.jpg?httpAccept=%2A%2F%2A",
            "@multimediatype": "JPEG image file",
            "@type": "IMAGE-DOWNSAMPLED",
            "@size": "773",
            "@ref": "fx2",
            "@mimetype": "image/jpeg"
          },
          {
            "@category": "standard",
            "@height": "23",
            "@width": "23",
            "@_fa": "true",
            "$": "https://api.elsevier.com/content/object/eid/1-s2.0-S2468823120306052-fx1.jpg?httpAccept=%2A%2F%2A",
            "@multimediatype": "JPEG image file",
            "@type": "IMAGE-DOWNSAMPLED",
            "@size": "557",
            "@ref": "fx1",
            "@mimetype": "image/jpeg"
          },
          {
            "@category": "standard",
            "@height": "126",
            "@width": "565",
            "@_fa": "true",
            "$": "https://api.elsevier.com/content/object/eid/1-s2.0-S2468823120306052-gr1.jpg?httpAccept=%2A%2F%2A",
            "@multimediatype": "JPEG image file",
            "@type": "IMAGE-DOWNSAMPLED",
            "@size": "14549",
            "@ref": "gr1",
            "@mimetype": "image/jpeg"
          },
          {
            "@category": "standard",
            "@height": "24",
            "@width": "54",
            "@_fa": "true",
            "$": "https://api.elsevier.com/content/object/eid/1-s2.0-S2468823120306052-fx8.jpg?httpAccept=%2A%2F%2A",
            "@multimediatype": "JPEG image file",
            "@type": "IMAGE-DOWNSAMPLED",
            "@size": "874",
            "@ref": "fx8",
            "@mimetype": "image/jpeg"
          },
          {
            "@category": "standard",
            "@height": "12",
            "@width": "29",
            "@_fa": "true",
            "$": "https://api.elsevier.com/content/object/eid/1-s2.0-S2468823120306052-fx7.jpg?httpAccept=%2A%2F%2A",
            "@multimediatype": "JPEG image file",
            "@type": "IMAGE-DOWNSAMPLED",
            "@size": "566",
            "@ref": "fx7",
            "@mimetype": "image/jpeg"
          },
          {
            "@category": "standard",
            "@height": "274",
            "@width": "376",
            "@_fa": "true",
            "$": "https://api.elsevier.com/content/object/eid/1-s2.0-S2468823120306052-gr3.jpg?httpAccept=%2A%2F%2A",
            "@multimediatype": "JPEG image file",
            "@type": "IMAGE-DOWNSAMPLED",
            "@size": "19813",
            "@ref": "gr3",
            "@mimetype": "image/jpeg"
          },
          {
            "@category": "standard",
            "@height": "233",
            "@width": "565",
            "@_fa": "true",
            "$": "https://api.elsevier.com/content/object/eid/1-s2.0-S2468823120306052-gr2.jpg?httpAccept=%2A%2F%2A",
            "@multimediatype": "JPEG image file",
            "@type": "IMAGE-DOWNSAMPLED",
            "@size": "35230",
            "@ref": "gr2",
            "@mimetype": "image/jpeg"
          },
          {
            "@category": "standard",
            "@height": "12",
            "@width": "76",
            "@_fa": "true",
            "$": "https://api.elsevier.com/content/object/eid/1-s2.0-S2468823120306052-fx9.jpg?httpAccept=%2A%2F%2A",
            "@multimediatype": "JPEG image file",
            "@type": "IMAGE-DOWNSAMPLED",
            "@size": "1058",
            "@ref": "fx9",
            "@mimetype": "image/jpeg"
          },
          {
            "@category": "standard",
            "@height": "12",
            "@width": "94",
            "@_fa": "true",
            "$": "https://api.elsevier.com/content/object/eid/1-s2.0-S2468823120306052-fx4.jpg?httpAccept=%2A%2F%2A",
            "@multimediatype": "JPEG image file",
            "@type": "IMAGE-DOWNSAMPLED",
            "@size": "1195",
            "@ref": "fx4",
            "@mimetype": "image/jpeg"
          },
          {
            "@category": "standard",
            "@height": "12",
            "@width": "94",
            "@_fa": "true",
            "$": "https://api.elsevier.com/content/object/eid/1-s2.0-S2468823120306052-fx3.jpg?httpAccept=%2A%2F%2A",
            "@multimediatype": "JPEG image file",
            "@type": "IMAGE-DOWNSAMPLED",
            "@size": "1039",
            "@ref": "fx3",
            "@mimetype": "image/jpeg"
          },
          {
            "@category": "standard",
            "@height": "314",
            "@width": "376",
            "@_fa": "true",
            "$": "https://api.elsevier.com/content/object/eid/1-s2.0-S2468823120306052-sc1.jpg?httpAccept=%2A%2F%2A",
            "@multimediatype": "JPEG image file",
            "@type": "IMAGE-DOWNSAMPLED",
            "@size": "23509",
            "@ref": "sc1",
            "@mimetype": "image/jpeg"
          },
          {
            "@category": "standard",
            "@height": "25",
            "@width": "28",
            "@_fa": "true",
            "$": "https://api.elsevier.com/content/object/eid/1-s2.0-S2468823120306052-fx6.jpg?httpAccept=%2A%2F%2A",
            "@multimediatype": "JPEG image file",
            "@type": "IMAGE-DOWNSAMPLED",
            "@size": "709",
            "@ref": "fx6",
            "@mimetype": "image/jpeg"
          },
          {
            "@category": "standard",
            "@height": "26",
            "@width": "82",
            "@_fa": "true",
            "$": "https://api.elsevier.com/content/object/eid/1-s2.0-S2468823120306052-fx5.jpg?httpAccept=%2A%2F%2A",
            "@multimediatype": "JPEG image file",
            "@type": "IMAGE-DOWNSAMPLED",
            "@size": "1080",
            "@ref": "fx5",
            "@mimetype": "image/jpeg"
          },
          {
            "@category": "standard",
            "@height": "200",
            "@width": "464",
            "@_fa": "true",
            "$": "https://api.elsevier.com/content/object/eid/1-s2.0-S2468823120306052-ga1.jpg?httpAccept=%2A%2F%2A",
            "@multimediatype": "JPEG image file",
            "@type": "IMAGE-DOWNSAMPLED",
            "@size": "20323",
            "@ref": "ga1",
            "@mimetype": "image/jpeg"
          },
          {
            "@category": "thumbnail",
            "@height": "164",
            "@width": "219",
            "@_fa": "true",
            "$": "https://api.elsevier.com/content/object/eid/1-s2.0-S2468823120306052-gr9.sml?httpAccept=%2A%2F%2A",
            "@multimediatype": "GIF image file",
            "@type": "IMAGE-THUMBNAIL",
            "@size": "18120",
            "@ref": "gr9",
            "@mimetype": "image/gif"
          },
          {
            "@category": "thumbnail",
            "@height": "164",
            "@width": "208",
            "@_fa": "true",
            "$": "https://api.elsevier.com/content/object/eid/1-s2.0-S2468823120306052-gr8.sml?httpAccept=%2A%2F%2A",
            "@multimediatype": "GIF image file",
            "@type": "IMAGE-THUMBNAIL",
            "@size": "9405",
            "@ref": "gr8",
            "@mimetype": "image/gif"
          },
          {
            "@category": "thumbnail",
            "@height": "46",
            "@width": "219",
            "@_fa": "true",
            "$": "https://api.elsevier.com/content/object/eid/1-s2.0-S2468823120306052-fx11.sml?httpAccept=%2A%2F%2A",
            "@multimediatype": "GIF image file",
            "@type": "IMAGE-THUMBNAIL",
            "@size": "3156",
            "@ref": "fx11",
            "@mimetype": "image/gif"
          },
          {
            "@category": "thumbnail",
            "@height": "93",
            "@width": "184",
            "@_fa": "true",
            "$": "https://api.elsevier.com/content/object/eid/1-s2.0-S2468823120306052-fx10.sml?httpAccept=%2A%2F%2A",
            "@multimediatype": "GIF image file",
            "@type": "IMAGE-THUMBNAIL",
            "@size": "2589",
            "@ref": "fx10",
            "@mimetype": "image/gif"
          },
          {
            "@category": "thumbnail",
            "@height": "82",
            "@width": "219",
            "@_fa": "true",
            "$": "https://api.elsevier.com/content/object/eid/1-s2.0-S2468823120306052-gr5.sml?httpAccept=%2A%2F%2A",
            "@multimediatype": "GIF image file",
            "@type": "IMAGE-THUMBNAIL",
            "@size": "4181",
            "@ref": "gr5",
            "@mimetype": "image/gif"
          },
          {
            "@category": "thumbnail",
            "@height": "67",
            "@width": "218",
            "@_fa": "true",
            "$": "https://api.elsevier.com/content/object/eid/1-s2.0-S2468823120306052-fx13.sml?httpAccept=%2A%2F%2A",
            "@multimediatype": "GIF image file",
            "@type": "IMAGE-THUMBNAIL",
            "@size": "2914",
            "@ref": "fx13",
            "@mimetype": "image/gif"
          },
          {
            "@category": "thumbnail",
            "@height": "164",
            "@width": "218",
            "@_fa": "true",
            "$": "https://api.elsevier.com/content/object/eid/1-s2.0-S2468823120306052-gr4.sml?httpAccept=%2A%2F%2A",
            "@multimediatype": "GIF image file",
            "@type": "IMAGE-THUMBNAIL",
            "@size": "8253",
            "@ref": "gr4",
            "@mimetype": "image/gif"
          },
          {
            "@category": "thumbnail",
            "@height": "58",
            "@width": "219",
            "@_fa": "true",
            "$": "https://api.elsevier.com/content/object/eid/1-s2.0-S2468823120306052-fx12.sml?httpAccept=%2A%2F%2A",
            "@multimediatype": "GIF image file",
            "@type": "IMAGE-THUMBNAIL",
            "@size": "2927",
            "@ref": "fx12",
            "@mimetype": "image/gif"
          },
          {
            "@category": "thumbnail",
            "@height": "164",
            "@width": "207",
            "@_fa": "true",
            "$": "https://api.elsevier.com/content/object/eid/1-s2.0-S2468823120306052-gr7.sml?httpAccept=%2A%2F%2A",
            "@multimediatype": "GIF image file",
            "@type": "IMAGE-THUMBNAIL",
            "@size": "5403",
            "@ref": "gr7",
            "@mimetype": "image/gif"
          },
          {
            "@category": "thumbnail",
            "@height": "163",
            "@width": "173",
            "@_fa": "true",
            "$": "https://api.elsevier.com/content/object/eid/1-s2.0-S2468823120306052-gr6.sml?httpAccept=%2A%2F%2A",
            "@multimediatype": "GIF image file",
            "@type": "IMAGE-THUMBNAIL",
            "@size": "8772",
            "@ref": "gr6",
            "@mimetype": "image/gif"
          },
          {
            "@category": "thumbnail",
            "@height": "125",
            "@width": "117",
            "@_fa": "true",
            "$": "https://api.elsevier.com/content/object/eid/1-s2.0-S2468823120306052-fx2.sml?httpAccept=%2A%2F%2A",
            "@multimediatype": "GIF image file",
            "@type": "IMAGE-THUMBNAIL",
            "@size": "2647",
            "@ref": "fx2",
            "@mimetype": "image/gif"
          },
          {
            "@category": "thumbnail",
            "@height": "105",
            "@width": "104",
            "@_fa": "true",
            "$": "https://api.elsevier.com/content/object/eid/1-s2.0-S2468823120306052-fx1.sml?httpAccept=%2A%2F%2A",
            "@multimediatype": "GIF image file",
            "@type": "IMAGE-THUMBNAIL",
            "@size": "2225",
            "@ref": "fx1",
            "@mimetype": "image/gif"
          },
          {
            "@category": "thumbnail",
            "@height": "49",
            "@width": "219",
            "@_fa": "true",
            "$": "https://api.elsevier.com/content/object/eid/1-s2.0-S2468823120306052-gr1.sml?httpAccept=%2A%2F%2A",
            "@multimediatype": "GIF image file",
            "@type": "IMAGE-THUMBNAIL",
            "@size": "3226",
            "@ref": "gr1",
            "@mimetype": "image/gif"
          },
          {
            "@category": "thumbnail",
            "@height": "96",
            "@width": "219",
            "@_fa": "true",
            "$": "https://api.elsevier.com/content/object/eid/1-s2.0-S2468823120306052-fx8.sml?httpAccept=%2A%2F%2A",
            "@multimediatype": "GIF image file",
            "@type": "IMAGE-THUMBNAIL",
            "@size": "3599",
            "@ref": "fx8",
            "@mimetype": "image/gif"
          },
          {
            "@category": "thumbnail",
            "@height": "54",
            "@width": "131",
            "@_fa": "true",
            "$": "https://api.elsevier.com/content/object/eid/1-s2.0-S2468823120306052-fx7.sml?httpAccept=%2A%2F%2A",
            "@multimediatype": "GIF image file",
            "@type": "IMAGE-THUMBNAIL",
            "@size": "2104",
            "@ref": "fx7",
            "@mimetype": "image/gif"
          },
          {
            "@category": "thumbnail",
            "@height": "160",
            "@width": "219",
            "@_fa": "true",
            "$": "https://api.elsevier.com/content/object/eid/1-s2.0-S2468823120306052-gr3.sml?httpAccept=%2A%2F%2A",
            "@multimediatype": "GIF image file",
            "@type": "IMAGE-THUMBNAIL",
            "@size": "6157",
            "@ref": "gr3",
            "@mimetype": "image/gif"
          },
          {
            "@category": "thumbnail",
            "@height": "90",
            "@width": "219",
            "@_fa": "true",
            "$": "https://api.elsevier.com/content/object/eid/1-s2.0-S2468823120306052-gr2.sml?httpAccept=%2A%2F%2A",
            "@multimediatype": "GIF image file",
            "@type": "IMAGE-THUMBNAIL",
            "@size": "5849",
            "@ref": "gr2",
            "@mimetype": "image/gif"
          },
          {
            "@category": "thumbnail",
            "@height": "35",
            "@width": "219",
            "@_fa": "true",
            "$": "https://api.elsevier.com/content/object/eid/1-s2.0-S2468823120306052-fx9.sml?httpAccept=%2A%2F%2A",
            "@multimediatype": "GIF image file",
            "@type": "IMAGE-THUMBNAIL",
            "@size": "2711",
            "@ref": "fx9",
            "@mimetype": "image/gif"
          },
          {
            "@category": "thumbnail",
            "@height": "28",
            "@width": "219",
            "@_fa": "true",
            "$": "https://api.elsevier.com/content/object/eid/1-s2.0-S2468823120306052-fx4.sml?httpAccept=%2A%2F%2A",
            "@multimediatype": "GIF image file",
            "@type": "IMAGE-THUMBNAIL",
            "@size": "2260",
            "@ref": "fx4",
            "@mimetype": "image/gif"
          },
          {
            "@category": "thumbnail",
            "@height": "28",
            "@width": "219",
            "@_fa": "true",
            "$": "https://api.elsevier.com/content/object/eid/1-s2.0-S2468823120306052-fx3.sml?httpAccept=%2A%2F%2A",
            "@multimediatype": "GIF image file",
            "@type": "IMAGE-THUMBNAIL",
            "@size": "2247",
            "@ref": "fx3",
            "@mimetype": "image/gif"
          },
          {
            "@category": "thumbnail",
            "@height": "164",
            "@width": "196",
            "@_fa": "true",
            "$": "https://api.elsevier.com/content/object/eid/1-s2.0-S2468823120306052-sc1.sml?httpAccept=%2A%2F%2A",
            "@multimediatype": "GIF image file",
            "@type": "IMAGE-THUMBNAIL",
            "@size": "6354",
            "@ref": "sc1",
            "@mimetype": "image/gif"
          },
          {
            "@category": "thumbnail",
            "@height": "114",
            "@width": "126",
            "@_fa": "true",
            "$": "https://api.elsevier.com/content/object/eid/1-s2.0-S2468823120306052-fx6.sml?httpAccept=%2A%2F%2A",
            "@multimediatype": "GIF image file",
            "@type": "IMAGE-THUMBNAIL",
            "@size": "2658",
            "@ref": "fx6",
            "@mimetype": "image/gif"
          },
          {
            "@category": "thumbnail",
            "@height": "68",
            "@width": "219",
            "@_fa": "true",
            "$": "https://api.elsevier.com/content/object/eid/1-s2.0-S2468823120306052-fx5.sml?httpAccept=%2A%2F%2A",
            "@multimediatype": "GIF image file",
            "@type": "IMAGE-THUMBNAIL",
            "@size": "2564",
            "@ref": "fx5",
            "@mimetype": "image/gif"
          },
          {
            "@category": "thumbnail",
            "@height": "94",
            "@width": "219",
            "@_fa": "true",
            "$": "https://api.elsevier.com/content/object/eid/1-s2.0-S2468823120306052-ga1.sml?httpAccept=%2A%2F%2A",
            "@multimediatype": "GIF image file",
            "@type": "IMAGE-THUMBNAIL",
            "@size": "12717",
            "@ref": "ga1",
            "@mimetype": "image/gif"
          },
          {
            "@category": "standard",
            "@_fa": "true",
            "$": "https://api.elsevier.com/content/object/eid/1-s2.0-S2468823120306052-mmc1.docx?httpAccept=%2A%2F%2A",
            "@multimediatype": "Microsoft Word file",
            "@type": "APPLICATION",
            "@size": "4097243",
            "@ref": "mmc1",
            "@mimetype": "application/word"
          },
          {
            "@category": "thumbnail",
            "@_fa": "true",
            "$": "https://api.elsevier.com/content/object/eid/1-s2.0-S2468823120306052-si1.svg?httpAccept=%2A%2F%2A",
            "@multimediatype": "Scalable Vector Graphics file",
            "@type": "ALTIMG",
            "@size": "825",
            "@ref": "si1",
            "@mimetype": "image/svg+xml"
          },
          {
            "@category": "standard",
            "@_fa": "true",
            "$": "https://api.elsevier.com/content/object/eid/1-s2.0-S2468823120306052-am.pdf?httpAccept=%2A%2F%2A",
            "@multimediatype": "Acrobat PDF file",
            "@type": "AAM-PDF",
            "@size": "1660368",
            "@ref": "am",
            "@mimetype": "application/pdf"
          }
        ]
      },
      "link": {
        "@rel": "abstract",
        "@href": "https://api.elsevier.com/content/abstract/scopus_id/85098181832"
      }
    }
  }
}