{
  "metadata": {
    "title": "Au, Ag, Cu induced electron transfer to achieve ultra-long-range stability for catalytic alkaline bulk water splitting",
    "authors": "; ; ",
    "journal": "Molecular Catalysis",
    "date": "2025-09-30",
    "doi": "10.1016/j.mcat.2025.115313",
    "abstract": "",
    "uri": "https://api.elsevier.com/content/article/pii/S2468823125005012",
    "pii": "S2468823125005012"
  },
  "fulltext": {
    "full-text-retrieval-response": {
      "scopus-eid": "2-s2.0-105009255778",
      "originalText": "serial JL 315758 291210 291744 291790 291809 31 Molecular Catalysis MOLECULARCATALYSIS 2025-06-30 2025-06-30 2025-06-30 2025-06-30 2025-09-25T07:56:26 1-s2.0-S2468823125005012 S2468-8231(25)00501-2 S2468823125005012 10.1016/j.mcat.2025.115313 S300 S300.1 FULL-TEXT 1-s2.0-S2468823125X00110 2025-09-25T07:10:46.600932Z 0 0 20250901 20250930 2025 2025-06-30T09:39:31.956823Z absattachment articleinfo articlenumber articletitlenorm authfirstinitialnorm authfirstsurnamenorm cid cids contenttype copyright crossmark dateloaded dateloadedtxt datesearch datesort dateupdated dco docsubtype doctype doi eid ewtransactionid hubeid indexeddate issn issnnorm itemstage itemtransactionid itemweight openaccess openarchive pg pgfirst pii piinorm pubdateend pubdatestart pubdatetxt pubyr sectiontitle sortorder srctitle srctitlenorm srctype ssids alllist content subj subheadings suppl tomb volfirst volissue volumelist webpdf webpdfpagecount yearnav figure e-component body mmlmath acknowledge affil appendices articletitle auth authfirstini authfull authkeywords authlast grantnumber grantsponsor highlightsabst orcid primabst pubtype ref specialabst 2468-8231 24688231 true 584 584 C Volume 584 50 115313 115313 115313 202509 September 2025 2025-09-01 2025-09-30 2025 Regular Papers article fla © 2025 Elsevier B.V. All rights are reserved, including those for text and data mining, AI training, and similar technologies. AUAGCUINDUCEDELECTRONTRANSFERACHIEVEULTRALONGRANGESTABILITYFORCATALYTICALKALINEBULKWATERSPLITTING YANG M 1 Introduction 2 Experimental section 2.1 Materals 2.2 Synthesis of the Aux/NiWO4 catalyst 2.3 Synthesis of Agx/NiWO4 catalyst 2.4 Synthesis of Cux/NiWO4 catalyst 2.5 The schematic representation of the synthesis of (IBx:NiWO4, x=Au,Ag,Cu) 3 Results and discussion 3.1 Fabrication and characterization of Au/NiWO4, Ag/NiWO4, Cu/NiWO4 3.2 Electrocatalytic performance of the catalysts 4. Conclusion CRediT authorship contribution statement Acknowledgments Appendix Supplementary materials References ZHANG 2024 441 451 B WANG 2024 2313378 Y ZHU 2024 1447 Y QUAN 2024 3694 3812 L HANSORA 2024 272 284 D PW 2024 2316709 K REN 2024 2400777 H FANG 2024 2402478 T YANG 2024 1389 D GUO 2024 2401455 W HONG 2024 1623 1648 E HU 2024 1747 Z LIU 2024 165 L LIU 2024 202400069 S WANG 2024 1825 Q YU 2024 2313935 W HOU 2024 91 102 R CUI 2024 212 219 Y HE 2021 14224 14236 L CASSOL 2024 2617 G LIU 2024 124270 X WAN 2024 144685 Y QIAO 2024 2402286 L CHEN 2024 522 G ZHANG 2024 1959 1966 C LIU 2024 4797 W SHAH 2024 11440 11452 A ZHOU 2025 536 546 Y YANG 2024 143599 M GAO 2024 2315949 T QUAN 2024 3694 3812 L HUNG 2024 149772 K CHEN 2024 155302 M NIE 2024 2314172 J KANG 2024 5314 5325 H RANI 2019 279 285 B GENG 2022 111308 Q ZHANG 2020 109661 C HUANG 2024 2407407 Q TIAN 2024 5039 5046 R SHI 2024 2311076 N PENG 2024 498 W MUTHURASU 2024 2404254 A QIAN 2024 2404055 G YU 2024 149406 J VERMAAK 2024 215716 V LIU 2024 573 581 Y WU 2024 2406917 Z LIU 2024 120389 D VILLANUEVA 2024 2024 2032 E LI 2024 2311335 X WANG 2024 2446 2454 H MAENG 2024 2403253 J LI 2024 2403170 D WANG 2024 2403170 H PAN 2024 2311149 D GUO 2024 7106 7114 Z ZHANG 2024 7867 7876 Y YANG 2024 2401094 L ZHU 2024 4443 4450 Z DUAN 2024 2310491 D JIANG 2024 13745 13754 J LI 2024 8976 8987 Z ZHU 2024 1447 Y LIU 2024 2405835 X ZHANG 2024 441 451 B QIN 2024 8414 8426 M ISLAM 2024 25090 25100 I YU 2024 3260 3268 X YANGX2025X115313 YANGX2025X115313XM 2027-06-30T00:00:00.000Z 2027-06-30T00:00:00.000Z http://creativecommons.org/licenses/by-nc-nd/4.0/ © 2025 Elsevier B.V. All rights are reserved, including those for text and data mining, AI training, and similar technologies. 2025-07-02T03:16:00.803Z http://vtw.elsevier.com/data/voc/AddOnTypes/50.7/aggregated-refined Chengdu Normal University http://data.elsevier.com/vocabulary/SciValFunders/501100004498 http://sws.geonames.org/1814991 National undergraduate training program for innovation and entrepreneurship S202414389118 S202414389111 National College Students Innovation and Entrepreneurship Training Program http://data.elsevier.com/vocabulary/SciValFunders/501100013254 http://sws.geonames.org/1814991/ Medical Imaging Key Laboratory of Sichuan Province MIKL202204 Functional Molecules Key Laboratory of Sichuan Province 2023GNFZ-02 This work is financially supported by National undergraduate training program for innovation and entrepreneurship (Grant No. S202414389111, S202414389118). Opening Project of Structural Optimization and Application of Functional Molecules Key Laboratory of Sichuan Province (2023GNFZ-02). Opening Project of Medical Imaging Key Laboratory of Sichuan Province (MIKL202204). https://doi.org/10.15223/policy-017 https://doi.org/10.15223/policy-037 https://doi.org/10.15223/policy-012 https://doi.org/10.15223/policy-029 https://doi.org/10.15223/policy-004 item S2468-8231(25)00501-2 S2468823125005012 1-s2.0-S2468823125005012 10.1016/j.mcat.2025.115313 315758 2025-09-25T07:10:46.600932Z 2025-09-01 2025-09-30 1-s2.0-S2468823125005012-main.pdf https://s3-eu-west-1.amazonaws.com/prod-ucs-content-store-eu-west/content/pii:S2468823125005012/MAIN/application/pdf/a804d051b844bc7d52522b95259eda2a/main.pdf main.pdf pdf true 15276424 MAIN 13 1-s2.0-S2468823125005012-main_1.png https://s3-eu-west-1.amazonaws.com/prod-ucs-content-store-eu-west/content/pii:S2468823125005012/PREVIEW/image/png/49afd27a675110fd87d08af8133cb8d9/main_1.png main_1.png png 59783 928 656 IMAGE-WEB-PDF 1 1-s2.0-S2468823125005012-gr7.jpg https://s3-eu-west-1.amazonaws.com/prod-ucs-content-store-eu-west/content/pii:S2468823125005012/gr7/DOWNSAMPLED/image/jpeg/cfcdd77b034f1caa8b9ca117129b7fb0/gr7.jpg gr7 gr7.jpg jpg 52079 259 678 IMAGE-DOWNSAMPLED 1-s2.0-S2468823125005012-gr8.jpg https://s3-eu-west-1.amazonaws.com/prod-ucs-content-store-eu-west/content/pii:S2468823125005012/gr8/DOWNSAMPLED/image/jpeg/6e7191295b09b109f92c4aca2bc4ebff/gr8.jpg gr8 gr8.jpg jpg 18746 154 376 IMAGE-DOWNSAMPLED 1-s2.0-S2468823125005012-sc1.jpg https://s3-eu-west-1.amazonaws.com/prod-ucs-content-store-eu-west/content/pii:S2468823125005012/sc1/DOWNSAMPLED/image/jpeg/075ce74a60f9b9b7a8ef43cd9dd33ff1/sc1.jpg sc1 sc1.jpg jpg 54826 280 678 IMAGE-DOWNSAMPLED 1-s2.0-S2468823125005012-gr1.jpg https://s3-eu-west-1.amazonaws.com/prod-ucs-content-store-eu-west/content/pii:S2468823125005012/gr1/DOWNSAMPLED/image/jpeg/b3009fccb91b5642ab2a5ec6c159c890/gr1.jpg gr1 gr1.jpg jpg 257699 829 753 IMAGE-DOWNSAMPLED 1-s2.0-S2468823125005012-gr2.jpg https://s3-eu-west-1.amazonaws.com/prod-ucs-content-store-eu-west/content/pii:S2468823125005012/gr2/DOWNSAMPLED/image/jpeg/5103e85a1fddb858feb412add1ac3147/gr2.jpg gr2 gr2.jpg jpg 198963 946 753 IMAGE-DOWNSAMPLED 1-s2.0-S2468823125005012-ga1.jpg https://s3-eu-west-1.amazonaws.com/prod-ucs-content-store-eu-west/content/pii:S2468823125005012/ga1/DOWNSAMPLED/image/jpeg/10c3766495d27da4ece85335e5f14233/ga1.jpg ga1 true ga1.jpg jpg 36606 245 245 IMAGE-DOWNSAMPLED 1-s2.0-S2468823125005012-gr5.jpg https://s3-eu-west-1.amazonaws.com/prod-ucs-content-store-eu-west/content/pii:S2468823125005012/gr5/DOWNSAMPLED/image/jpeg/4a9561aecee5470a931bcefe18846dc7/gr5.jpg gr5 gr5.jpg jpg 124954 767 602 IMAGE-DOWNSAMPLED 1-s2.0-S2468823125005012-gr6.jpg https://s3-eu-west-1.amazonaws.com/prod-ucs-content-store-eu-west/content/pii:S2468823125005012/gr6/DOWNSAMPLED/image/jpeg/69aacf14fbf7622ad232ba9c72621c06/gr6.jpg gr6 gr6.jpg jpg 166603 765 602 IMAGE-DOWNSAMPLED 1-s2.0-S2468823125005012-gr3.jpg https://s3-eu-west-1.amazonaws.com/prod-ucs-content-store-eu-west/content/pii:S2468823125005012/gr3/DOWNSAMPLED/image/jpeg/d597293edc38b6ddeec4f9dc4d5e1e3d/gr3.jpg gr3 gr3.jpg jpg 155579 672 753 IMAGE-DOWNSAMPLED 1-s2.0-S2468823125005012-gr4.jpg https://s3-eu-west-1.amazonaws.com/prod-ucs-content-store-eu-west/content/pii:S2468823125005012/gr4/DOWNSAMPLED/image/jpeg/6b9765f0fc828b7e4efde7274f5bb464/gr4.jpg gr4 gr4.jpg jpg 155559 676 753 IMAGE-DOWNSAMPLED 1-s2.0-S2468823125005012-gr7.sml https://s3-eu-west-1.amazonaws.com/prod-ucs-content-store-eu-west/content/pii:S2468823125005012/gr7/THUMBNAIL/image/gif/b2526623b778a0e3377f5a173d9e1e54/gr7.sml gr7 gr7.sml sml 9721 84 219 IMAGE-THUMBNAIL 1-s2.0-S2468823125005012-gr8.sml https://s3-eu-west-1.amazonaws.com/prod-ucs-content-store-eu-west/content/pii:S2468823125005012/gr8/THUMBNAIL/image/gif/509ea72fb15f95fb343150adf65b0ebc/gr8.sml gr8 gr8.sml sml 7870 89 219 IMAGE-THUMBNAIL 1-s2.0-S2468823125005012-sc1.sml https://s3-eu-west-1.amazonaws.com/prod-ucs-content-store-eu-west/content/pii:S2468823125005012/sc1/THUMBNAIL/image/gif/9f610ccd24f9910d9710ef322ac71799/sc1.sml sc1 sc1.sml sml 10383 90 219 IMAGE-THUMBNAIL 1-s2.0-S2468823125005012-gr1.sml https://s3-eu-west-1.amazonaws.com/prod-ucs-content-store-eu-west/content/pii:S2468823125005012/gr1/THUMBNAIL/image/gif/4e8ba0e3513f9918801baa9eed2992cd/gr1.sml gr1 gr1.sml sml 20939 164 149 IMAGE-THUMBNAIL 1-s2.0-S2468823125005012-gr2.sml https://s3-eu-west-1.amazonaws.com/prod-ucs-content-store-eu-west/content/pii:S2468823125005012/gr2/THUMBNAIL/image/gif/bf06823095fa5c9bc22fb34caa94e18c/gr2.sml gr2 gr2.sml sml 12107 163 130 IMAGE-THUMBNAIL 1-s2.0-S2468823125005012-ga1.sml https://s3-eu-west-1.amazonaws.com/prod-ucs-content-store-eu-west/content/pii:S2468823125005012/ga1/THUMBNAIL/image/gif/01ae7611720de79636ce625be8f361be/ga1.sml ga1 true ga1.sml sml 26064 164 164 IMAGE-THUMBNAIL 1-s2.0-S2468823125005012-gr5.sml https://s3-eu-west-1.amazonaws.com/prod-ucs-content-store-eu-west/content/pii:S2468823125005012/gr5/THUMBNAIL/image/gif/3c44de03f8240c07904f75acff785464/gr5.sml gr5 gr5.sml sml 10604 163 128 IMAGE-THUMBNAIL 1-s2.0-S2468823125005012-gr6.sml https://s3-eu-west-1.amazonaws.com/prod-ucs-content-store-eu-west/content/pii:S2468823125005012/gr6/THUMBNAIL/image/gif/57f5fd09d3c805b8f9f6f31fb5c4a893/gr6.sml gr6 gr6.sml sml 14813 164 129 IMAGE-THUMBNAIL 1-s2.0-S2468823125005012-gr3.sml https://s3-eu-west-1.amazonaws.com/prod-ucs-content-store-eu-west/content/pii:S2468823125005012/gr3/THUMBNAIL/image/gif/1f4ffb45a7f7c9d1972ed50f5fbaa9bd/gr3.sml gr3 gr3.sml sml 13756 164 184 IMAGE-THUMBNAIL 1-s2.0-S2468823125005012-gr4.sml https://s3-eu-west-1.amazonaws.com/prod-ucs-content-store-eu-west/content/pii:S2468823125004444/gr4/THUMBNAIL/image/gif/c51bcf8b94930526bc003a992391c62d/gr4.sml gr4 gr4.sml sml 13594 164 183 IMAGE-THUMBNAIL 1-s2.0-S2468823125005012-gr7_lrg.jpg https://s3-eu-west-1.amazonaws.com/prod-ucs-content-store-eu-west/content/pii:S2468823125005012/HIGHRES/image/jpeg/e72ec4c21409b978443ff0797121d0d6/gr7_lrg.jpg gr7 gr7_lrg.jpg jpg 401695 1144 3000 IMAGE-HIGH-RES 1-s2.0-S2468823125005012-gr8_lrg.jpg https://s3-eu-west-1.amazonaws.com/prod-ucs-content-store-eu-west/content/pii:S2468823125005012/HIGHRES/image/jpeg/065ee077d101db7268cf8c5ab1d9b5bd/gr8_lrg.jpg gr8 gr8_lrg.jpg jpg 111612 681 1667 IMAGE-HIGH-RES 1-s2.0-S2468823125005012-sc1_lrg.jpg https://s3-eu-west-1.amazonaws.com/prod-ucs-content-store-eu-west/content/pii:S2468823125005012/HIGHRES/image/jpeg/9b9383cbc1bde4e2bf732ba07d250b3c/sc1_lrg.jpg sc1 sc1_lrg.jpg jpg 421699 1238 3000 IMAGE-HIGH-RES 1-s2.0-S2468823125005012-gr1_lrg.jpg https://s3-eu-west-1.amazonaws.com/prod-ucs-content-store-eu-west/content/pii:S2468823125005012/HIGHRES/image/jpeg/9fddc077217a99a740054215a5cac443/gr1_lrg.jpg gr1 gr1_lrg.jpg jpg 2231666 3670 3333 IMAGE-HIGH-RES 1-s2.0-S2468823125005012-gr2_lrg.jpg https://s3-eu-west-1.amazonaws.com/prod-ucs-content-store-eu-west/content/pii:S2468823125005012/HIGHRES/image/jpeg/078c9c49838d0c1dbad554c476171d4f/gr2_lrg.jpg gr2 gr2_lrg.jpg jpg 1279235 4187 3333 IMAGE-HIGH-RES 1-s2.0-S2468823125005012-ga1_lrg.jpg https://s3-eu-west-1.amazonaws.com/prod-ucs-content-store-eu-west/content/pii:S2468823125005012/HIGHRES/image/jpeg/157493c27c76a397e85c309a987042c8/ga1_lrg.jpg ga1 true ga1_lrg.jpg jpg 446160 1085 1085 IMAGE-HIGH-RES 1-s2.0-S2468823125005012-gr5_lrg.jpg https://s3-eu-west-1.amazonaws.com/prod-ucs-content-store-eu-west/content/pii:S2468823125005012/HIGHRES/image/jpeg/f188b393412bebe07823272bceae1cb2/gr5_lrg.jpg gr5 gr5_lrg.jpg jpg 976228 3397 2667 IMAGE-HIGH-RES 1-s2.0-S2468823125005012-gr6_lrg.jpg https://s3-eu-west-1.amazonaws.com/prod-ucs-content-store-eu-west/content/pii:S2468823125005012/HIGHRES/image/jpeg/3085cb5ab6357156b6bca366f19b868e/gr6_lrg.jpg gr6 gr6_lrg.jpg jpg 1331292 3387 2667 IMAGE-HIGH-RES 1-s2.0-S2468823125005012-gr3_lrg.jpg https://s3-eu-west-1.amazonaws.com/prod-ucs-content-store-eu-west/content/pii:S2468823125005012/HIGHRES/image/jpeg/13a0b1cf90837b9c8ad7b26c75774b6c/gr3_lrg.jpg gr3 gr3_lrg.jpg jpg 996374 2975 3333 IMAGE-HIGH-RES 1-s2.0-S2468823125005012-gr4_lrg.jpg https://s3-eu-west-1.amazonaws.com/prod-ucs-content-store-eu-west/content/pii:S2468823125004444/HIGHRES/image/jpeg/3b757ebfc7d6956c19fe6cf4e54a15c9/gr4_lrg.jpg gr4 gr4_lrg.jpg jpg 993795 2990 3333 IMAGE-HIGH-RES 1-s2.0-S2468823125005012-mmc1.docx https://s3-eu-west-1.amazonaws.com/prod-ucs-content-store-eu-west/content/pii:S2468823125005012/mmc1/MAIN/application/vnd.openxmlformats-officedocument.wordprocessingml.document/5c736c0b70400135f5afec46a76e26e5/mmc1.docx mmc1 mmc1.docx docx 3517213 APPLICATION 1-s2.0-S2468823125005012-mmc2.mp4 https://s3-eu-west-1.amazonaws.com/prod-ucs-content-store-eu-west/content/pii:S2468823125005012/mmc2/MAIN/video/mp4/16ee61a2adae8775809a4a6aaea57701/mmc2.mp4 mmc2 mmc2.mp4 mp4 2638660 VIDEO 1-s2.0-S2468823125005012-si1.svg https://s3-eu-west-1.amazonaws.com/prod-ucs-content-store-eu-west/content/pii:S2468823125005012/image/svg+xml/4bc3d91d17c0fb109a1a1f4da3b3f8cc/si1.svg si1 si1.svg svg 5729 ALTIMG 1-s2.0-S2468823125005012-si2.svg https://s3-eu-west-1.amazonaws.com/prod-ucs-content-store-eu-west/content/pii:S2468823125005012/image/svg+xml/716c59ddcbbb576759e679d0d2cc3b5e/si2.svg si2 si2.svg svg 6654 ALTIMG 1-s2.0-S2468823125005012-si3.svg https://s3-eu-west-1.amazonaws.com/prod-ucs-content-store-eu-west/content/pii:S2468823125005012/image/svg+xml/7f04b670cd10c4a6d608b88c04e0ee16/si3.svg si3 si3.svg svg 5984 ALTIMG 1-s2.0-S2468823125005012-si4.svg https://s3-eu-west-1.amazonaws.com/prod-ucs-content-store-eu-west/content/pii:S2468823125005012/image/svg+xml/4c9c0399ccc372ef49a257b5f8eeef19/si4.svg si4 si4.svg svg 6760 ALTIMG 1-s2.0-S2468823125005012-si5.svg https://s3-eu-west-1.amazonaws.com/prod-ucs-content-store-eu-west/content/pii:S2468823125005012/image/svg+xml/7a71b167b2cd3a154a366611622a81c9/si5.svg si5 si5.svg svg 17244 ALTIMG 1-s2.0-S2468823125005012-si6.svg https://s3-eu-west-1.amazonaws.com/prod-ucs-content-store-eu-west/content/pii:S2468823125005012/image/svg+xml/f0c2f21183019c22d43cd108761d72f4/si6.svg si6 si6.svg svg 7071 ALTIMG 1-s2.0-S2468823125005012-si7.svg https://s3-eu-west-1.amazonaws.com/prod-ucs-content-store-eu-west/content/pii:S2468823125005012/image/svg+xml/cd50f0808907822710c4422f4620dcee/si7.svg si7 si7.svg svg 2775 ALTIMG 1-s2.0-S2468823125005012-si8.svg https://s3-eu-west-1.amazonaws.com/prod-ucs-content-store-eu-west/content/pii:S2468823125005012/image/svg+xml/d47b7b2fdfa3f5d160c8c3187bcc0298/si8.svg si8 si8.svg svg 5257 ALTIMG 1-s2.0-S2468823125005012-si9.svg https://s3-eu-west-1.amazonaws.com/prod-ucs-content-store-eu-west/content/pii:S2468823125005012/image/svg+xml/98b7fea6def9e0de27bb6b351cbba14a/si9.svg si9 si9.svg svg 4358 ALTIMG MCAT 115313 115313 S2468-8231(25)00501-2 10.1016/j.mcat.2025.115313 Elsevier B.V. Scheme 1 Schematic illustration of the fabrication process of Au/NiWO4, Ag/NiWO4, Cu/NiWO4. Scheme 1 Fig. 1 (a)XRD patterns of Au/NiWO4,Ag/NiWO4,Cu/NiWO4 nanocomposities; (b) Schematic diagram of NiWO4 cell structure; (c∼f) SEM image of NiWO4, Au/NiWO4, Ag/NiWO4, Cu/NiWO4, scale bar: 2 μm; (g∼j) TEM images image of NiWO4, Au/NiWO4, Ag/NiWO4, Cu/NiWO4, scale bar: 100 nm, (k∼m) HRTEM images of Au/NiWO4, Ag/NiWO4, Cu/NiWO4, scale bar: 10 nm; (n-p) The element mappings of Ni/Au/Ag/Cu. Fig 1 Fig. 2 (a) The XPS spectra of Au/NiWO4; (b) The XPS spectra of Ni2p; (c) The XPS spectra of Au4f; (d) The XPS spectra of Ag/NiWO4; (e) The XPS spectra of Ni2p, (f) The XPS spectra of Ag4f; (g) The XPS patterns of Cu/NiWO4; (h) The XPS spectra of Ni2p; (i) The XPS spectra of Cu2p; (j-l) N2 adsorption desorption isotherms and its aperture of Au/NiWO4, Ag/NiWO4, Cu/NiWO4. Fig 2 Fig. 3 (a) OER polarization curves of Au3/NiWO4, Ag3/NiWO4, Cu2/NiWO4, NiWO4, IrO2 in 1.0 M KOH; (b) Correspongding impedance diagram;(c)Correspongding Tafel slopes; (d)Activation energy curves of samples;(e)Required overpotentials to produce current densities of 10 mA cm−2, 50 mA cm−2100 mA cm−2; (f)Ladder diagram of samples; (g)1000th CV curves of Ag3/NiWO4; (h)Time-dependent current density curve of Ag3/NiWO4 at constant voltage for 300 h; (i)TOF values for OER of samples. Fig 3 Fig. 4 (a) HER polarization curves of Au3/NiWO4, Ag3/NiWO4, Cu2/NiWO4, NiWO4, 20wt % Pt/C in 1.0 M KOH; (b) Correspongding impedance diagram; (c) Correspongding Tafel slopes; (d) Plot of capacitive current measured at 10 mV cm−2 and scanning rate for samples; (e) Activation energy curve of sample; (f) Required overpotentials to produce current densities of 10 mA cm−2, 50 mA cm−2100 mA cm−2; (g) Comparison of the overpotentials to achieve the HER current density of 10 mA cm−2 for Au3/NiWO4 with reported catalysts; (h)1000th CV curves of Au3/NiWO4; (i) Time-dependent current density curve of Au3/NiWO4 at constant voltage for 150 h. Fig 4 Fig. 5 (a) HER polarization curves of Au3/NiWO4, NiWO4, Pt/C‖IrO2; (b) Comparison of voltage between Au3/NiWO4 and other electrocatalysts at 10 mA cm−2; (c) OER polarization curves of Ag3/NiWO4; (d) Required overpotentials to produce current densities of 10 mA cm−2, 50 mA cm−2, 100 mA cm−2, 120 mA cm−2; (e) Faradaic efficiency of H2 and O2 production in the HER/OER system upon operation time; (f) I-t curve of Au3/NiWO4llAg3/NiWO4 working for 100 h. Fig 5 Fig. 6 (a) Gibbs free energy change diagrams of the OER process on Cu/NiWO4; (b) The different view of the Cu/NiWO4(110) structure; (c) The different view of the *OH intermediate structure; (d) Gibbs free energy change diagrams of the OER process on Au/NiWO4; (e) The different view of the *OOH intermediate structure; (f) The different view of the *OH intermediate structure. Fig 6 Fig. 7 HER mechanism of Ag3/NiWO4 and OER of mechanism of Au3/NiWO4. Fig 7 Fig. 8 crystal ffeld study of Au, Ag, Cu ion doping NiWO4. Fig 8 Research Paper Au, Ag, Cu induced electron transfer to achieve ultra-long-range stability for catalytic alkaline bulk water splitting Min Yang Writing – original draft Resources Project administration a Shuang Sheng Methodology Conceptualization a Ziyi Wan Visualization a Yaoyao Xu Data curation a Rui Qi Formal analysis a Xiaofeng Luo Data curation a Weiyu Pan Visualization Data curation a Kunshan Yang a Ziqing Zhang Funding acquisition b Guowei Deng Funding acquisition a ⁎ a College of Chemistry and Life Science, Sichuan Provincial Key Laboratory for Structural Optimization and Application of Functional Molecules, Chengdu Normal University, Chengdu 611130, China College of Chemistry and Life Science, Sichuan Provincial Key Laboratory for Structural Optimization and Application of Functional Molecules Chengdu Normal University Chengdu 611130 China aCollege of Chemistry and Life Science, Sichuan Provincial Key Laboratory for Structural Optimization and Application of Functional Molecules, Chengdu Normal University, Chengdu 611130, China b Key Laboratory of Functional Inorganic Material Chemistry, Heilongjiang University, Ministry of Education, China Key Laboratory of Functional Inorganic Material Chemistry Heilongjiang University Ministry of Education China bKey Laboratory of Functional Inorganic Material Chemistry, Heilongjiang University, Ministry of Education, China ⁎ Corresponding author. Hydrogen evolution reaction (HER) is a key step in the production of hydrogen (H2) by overall water splitting, which is of great significance for the storage and conversion of renewable energy. Nevertheless, the elevated excess potential and insufficient stability of catalysts constrain their industrial applicability. Due to the poor catalytic activity of NiWO4 in alkaline solution, this study investigated the effect of IB metal (IB=Au, Ag, Cu) ion doping and its interaction with different concentrations of IBx/NiWO4 (X = 1,2,3,4 mmol) on catalytic activity to achieve stable H2 in alkaline media. In 1.0 M KOH solution, the current density is 10 mA cm−2, the Au3/NiWO4 exhibits a low overpotential is 86.11 mV, the slope of Tafel is 115.16 mV dec−1, and the overpotential of Ag3/NiWO4 is 168.41 mV, with a Tafel slope of 64.32 mV dec−1, the catalyst also showed long term stability for 150 h, the Au3/NiWO4 NF‖Au3/NiWO4 NF catalysts achieved a low voltage of 1.45 V at 10 mA cm−2 current density for 100 h. The synergistic interactions of bimetals present a novel approach for enhancing catalyst design and optimizing performance. Graphical abstract Image, graphical abstract Keywords Interface engineering Regulation of electronic structures Overall water splitting Data availability The data that has been used is confidential. 1 Introduction As a low-carbon, zero-carbon energy, hydrogen energy considered to be the most promising clean energy in the 21st century, because hydrogen energy has high energy density, high conversion efficiency, and the product of combustion is water, which is a pollution-free energy carrier, in line with the world’s demand for non-fossil energy [1–4]. Currently, electrocatalytic cracking of water for greenest and most sustainable effective strategy to address the energy crisis, and the design and synthesis of electrocatalysts with excellent catalytic efficiency has attracted much attention abroad [5–8]. The essence of an electrocatalytic reaction is a charge transfer reaction at the interface between the electrode and the electrolyte, which is accelerated by the catalyst, and the rate of the reaction is determined by the activity of the catalyst [9,10]. Traditionally, iridium, ruthenium and platinum anchored catalysts have been effective in promoting the evolution of HER and OER, and the development of bifunctional catalysts with excellent activity has opened a new avenue for H2 synthesis [11–14]. Compared to the greatly efficient HER reaction with significant proton concentration, the cyclic anodic OER reaction has moderate dynamics and catalyst deactivation problems [15–17]. The design of low-cost and efficient electrocatalysts can accelerate the proton transfer process and provide a more theoretical basis for the construction of catalytic systems that are necessary for the sustainable development of the energy economy [18–20]. The wolframite structure of NiWO4 has been extensively studied due to its advantages of simple preparation, low cost, weak toxicity and stable properties [21,22]. The NiWO4 crystal has a monoclinic tetrahedral structure with space group P2/c, with oxygen atoms forming a twisted structure while Ni and W atoms each occupy a quarter of the oxygen octahedral gap [23,24]. The substitution of one Ni atom in the NiWO4 lattice with an IB metal atom, and the introduction of the IB metal atom to create oxygen vacancies, considerably improves the conductivity and charge transfer efficiency of NiWO4 [25]. The introduced IB metal atoms can also act as proton carriers and electron acceptors, enabling simultaneous enhancement of HER/OER catalytic activity by accelerating proton activation and metal production at elevated values [26–29]. For HER, the strong adsorption of H2 by Au elements promotes the production of active hydrogen and improves the catalytic dynamics of HER. In the OER process, Ag enhances the OER activity by promoting the formation of Ni 3 ⁺ and promoting the electron outflow of low cost [30,31]. The presence of oxygen vacancies not only modulates the electronic configuration of the catalyst and improves its charge transfer efficiency, but also acts as an active site and oxygen carrier in the catalytic reaction, thus enhancing the catalytic activity [32]. The anchoring of the IB metal enables NiWO4 to have a larger specific surface area, which effectively broadens the range of ECSA available and significantly increases the conductivity and charge transfer efficiency of the catalyst [32]. Increased catalytic active sites and improved charge transfer efficiency are responsible for the increased catalytic activity of NiWO4 [33]. By exploring the strong activity, elevated stability and hydrogen production properties of NiWO4, production costs activity is increased [34–35]. IB metal anchoring on NiWO4 is the most effective method to improve electrocatalytic performance. The dynamics of electrocatalytic reactions can be improved by tuning the electronic structure. Moreover, by optimizing the Gibbs free energy of the formed electronic intermediates through the IB metal atoms, interfacial charge transfer is affected, which facilitates catalytic reactions and thus significantly increases the electron transfer rate [36–38]. Therefore, we design a moderately efficient catalyst that introduces a unique flower-like structure anchored by ultra-low content of IB atoms into the NiWO4 material and optimizes the HER adsorption capacity in alkaline solutions. In order to improve the HER activity of Ni-based catalysts, Au, Cu and Ag contents are discussed and the effect of bulk activity on the catalytic performance is investigated. Since adsorption by H + is an important driving force leading to the leaching of monoatomic Cu from the catalyst surface, the higher the negative potential, the stronger the adsorption by H +, a competitive reaction that results in the Cu atom being partially anchored to the catalyst surface and partially dissolved in an alkaline solution, with a catalytic effect slightly lower than Au/NiWO4 and Ag/NiWO4. Au and Ag can effectively control the surface adsorption properties of NiWO4 catalysts and optimize their performance. Compared to conventional Ni-based catalysts, Au, Cu, Ag/NiWO4 catalysts have excellent hydrogen production efficiency at very low excess voltages. 2 Experimental section 2.1 Materals Ni(NO3)2·6H2O (99.99 %, Macklin), HAuCl4·3H2O (99.99 %, Macklin), Ag nanowires and PEG (Sinopharm Chemical Reagent Co. Ltd), Cu(CH3COO)2·H2O (99.99 %, Aladdin’s reagent), NaBH4 (99 %, Sinopharm Reagent Co., LTD), N4H2·H2O (99.99 %, Titan reagent), IrO2 (Irifium Oxide) and Pt/C (20 wt %) were obtained from Aladdin. 2.2 Synthesis of the Aux/NiWO4 catalyst The synthesis route of NiWO4 is consistent with that reported in literature [38]. Au atoms anchored on NiWO4 nanomaterials is a novel synthesis process, the NiWO4 (0.05 g) nanomaterial synthesized in the previous step, which dissolved in H2O (60 mL) and CH3CH2OH (30 mL) solution. The solution was stirred and treated with ultrasound to form a uniformly yellowish solution, 0.1 mol L −1 NaBH4 (0.30 mL), 1 mmol∼4 mmol % HAuCl4·3H2O were added drop by drop and stirred for 1 h at room temperature, named Aux/NiWO4 (x = 1, 2, 3, 4). Finally, the yellow precipitate obtained at a water bath temperature of 50 °C for 3 h, then Aux/NiWO4 nanomaterials is extracted by centrifugal. 2.3 Synthesis of Agx/NiWO4 catalyst 0.04 g Ni (NO3)2·6H2O was dispersed in 20 mL deionized water, stirred at room temperature for 30 min, and then NaWO4·2H2O (0.05 g) was added. 1 mmol %∼4 mmol % silver nanowires were slowly dropped into the precursor solution, stirred for 10 min, and 0.2 mL N4H2·H2O was added, named Agx/NiWO4 (x = 1, 2, 3, 4). The sufficiently stirred sample was centrifuged to neutral with 1:2 ethanol and water and dried in a vacuum oven at 60 °C for 12 h. Agx/NiWO4 was obtained by calcination at 800 °C for 2 h and heating and cooling at 2 °C min−1 in N2 atmosphere. 2.4 Synthesis of Cux/NiWO4 catalyst 0.09 g NaWO4·2H2O was dispersed in 30 mL deionized water and stirred at room temperature for 30 min. After stirring, PEG (0.61 g) was added and Ni (NO3)2·6H2O (0.09 g) was added to obtain green precursor solution. Then, 1 mmol∼4 mmol % Cu(CH3COO)2·H2O was dropped into the precursor solution, stirred at 70 °C and 450 rpm for 2 h, centrifuged to neutral with 1:1 ethanol and water, dried in a vacuum oven at 60 °C for 12 h, Cux/NiWO4 (x = 1, 2, 3, 4). The Cux/NiWO4 nanomaterial was obtained by calcining the powder sample at 500 °C for 2 h. 2.5 The schematic representation of the synthesis of (IBx:NiWO4, x=Au,Ag,Cu) Firstly, NiWO4 nanomaterials were synthesized by wet precipitation method, and then Cu(CH3COO)2·H2O, Ag nanowires, reduced Au nanoparticles are added to the system, the schematic representation of the synthesis of (IBx:NiWO4, x=Au, Ag, Cu) are represented as Scheme 1 . 3 Results and discussion 3.1 Fabrication and characterization of Au/NiWO4, Ag/NiWO4, Cu/NiWO4 Fig. 1 a clarified the XRD pattern of the NiWO4 nanomorph anchored with Cu (CH3COO)2·H2O, HAuCl4·3H2O and Ag nanowires with optimal content is consistent with that of the pure NiWO4 sample, and there is no impurity peak, and the XRD peak is slightly inclined to a higher Angle. As a result, NiWO4 nanocrystals have rarely been reported as electrocatalytic materials. Due to its unique WO6 octahedron and NiO4 co-vertex chain multilayer structure, the XRD diffraction peaks of the NiWO4 are shifted to lower angles due to the doping of Au, Ag and Cu. Doping causes an increase in the lattice constant. The atomic radii of Au, Ag and Cu are largely different from those of Ni ions in the NiWO4. When metal ions are doped into the NiWO4 lattice, the lattice distortion occurs due to the difference in atomic size, resulting in an increase of the lattice constant. An increase in the lattice constant leads to an increase in the interlunar spacing d and a decrease in the diffraction angle, resulting in a shift of the XRD diffraction peak to lower angles (Fig. 1b). As a result, Au, Ag, and Cu nanoparticles were successfully anchored into the lattice of NiWO4. To investigate the effect of IB metals on the electrocatalytic activity of NiWO4, Fig. S1 to S3 is shown. Ion doping does not alter the crystal structure of NiWO4. The peaks at (100), (−111), (002), (−202), the diffraction angles match completely with NiWO4 (JCPD#15–0755) [39]. The apparent morphology of the sample can be observed by SEM, the NiWO4 was like hydrangea with a size of about 2 μm (Fig. 1c). The morphologies of Au3/NiWO4 and Cu2/NiWO4 samples shape like coral with a size of about 1 μm (Fig. 1d, e). Ag nanowires have been directly synthesized for coprecipitation, there is no redox reaction between silver and N2H4·H2O, resulting in slightly different particle sizes and sizes of the sample, as shown in Fig. 1f. The grain morphology is similar to a coral, with a size of about 50 nm. Coral-like structures consist of self-assembled stratified structures with particle sizes up to 10 nm. The microstructure of NiWO4 was also studied by TEM as illustrated in Fig. 1g, where the sheets are strongly connected and the width of the NiWO4 micromaser is 10 nm. TEM images also revealed the heterogeneous structure of Au3/NiWO4 nano-flowers (Fig. 1h). The TEM of Ag3/NiWO4 is elucidated in Fig. 1i, it is definitely seen that the sample presents a rod-like structure with a size of about 200 nm, and the inset shows the SEAD photograph. The TEM image of Cu2/NiWO4 is shown in Fig. 1j, which is consistent with the coral like sample. The surface of the sample is composed of granular nanoparticles, which are also responsible for the large specific surface area of the catalyst. HRTEM images of the Au3/NiWO4 showed that the lattice distance is 0.21 nm, corresponding to the crystal plane of Au (200) (Fig. 1k). HRTEM image of Ag3/NiWO4 in Fig. 1I indicated that there is an obvious interface between Ag3/NiWO4 and NiWO4, the lattice distance of 0.28 nm corresponds to the (020) lattice plane of NiWO4, the lattice distance of 0.23 nm corresponds to the (111) crystal plane of Ag. Fig. 1m manifested crystal planes of (110) and (−111) are distinctly marked. Fig. 1m indicates the HRTEM image of NiWO4, the crystal plane spacing was 0.35 nm, and the crystal fringe boundary with higher resolution is clear, corresponding to (110) crystal plane of NiWO4 [40,41]. It was noteworthy that the lattice spacing of anchored NiWO4 phase is larger than 0.265 nm of pure phase, indicating that Au, Ag and Cu are inserted in the crystal plane gap of NiWO4 (Fig. 1n∼p). Structural properties of the sample as represented by the IR spectra. Fig. S4a∼S6a show the FT-IR spectra of Cu2/NiWO4, Ag3/NiWO4 and Au3/NiWO4. At 3440 cm−1 is the tensile vibration peak of the OH− group, which was due to the adsorption of a limited number of water molecules on the sample surface. The bending vibration of water’s hydroxyl group typically occurs around 1600∼1650 cm−1. The tensile vibration peak of W-O bond and Ni-O bond is located at 500∼1000 cm−1, while the asymmetric tensile vibration peak of W-O bond was the absorption peak at 935 cm−1. After elevated temperature treatment, the absorption peaks of Cu2/NiWO4, Ag3/NiWO4 and Au3/NiWO4 are stronger than those of NiWO4 nanomaterials at 1640 cm−1 and 500∼1000 cm−1, indicating that Au, Ag and Cu are successfully anchored on the surface of NiWO4 electrocatalyst [42]. Raman spectroscopy can determine the structure of Cu2/NiWO4, Ag3/NiWO4 and Au3/NiWO4 nanomaterials. The Raman spectra are shown in Figs. S4b∼S6b. There were three strong peaks at 893 cm−1, 701 cm−1 and 421 cm−1, and weak peaks at 539 cm−1 and 513 cm−1, indicating that the fingerprint peak corresponding to the shortest W-O bond is 874 cm−1, with a fitting bias of ∼55 cm−1, in excellent agreement with our results [43]. The three strong peaks show a Wolframite structure, exhibiting an in-plane stretching pattern induced by the W-O bond on the WO6 octahedra. The XRD and TEM results were also validated by Raman and IR spectroscopy. Au, Ag, and Cu have been successfully anchored into the matrix lattice of NiWO4, which facilitates the analysis of the electrochemical properties of the electrodes. The XPS spectra in Fig. 2 a showed the coexistence of Ni, W, Au and O elements. As shown in Fig. 2b, the Ni peak is located at 870 eV and the binding energies are 855.71 eV, 861.31 eV, respectively. High resolution XPS spectra corresponding to Ni 2p3/2 and Ni 2p1/2 indicated the presence of Ni2+ and Ni3+ in Au/NiWO4. XPS spectroscopy of Ni can also identify the presence of Ni 2p and its satellite peaks, indicating the presence of significant amounts of Ni2+. The peaks observed at 83.78 eV and 88.43 eV identify Au 4f7/2 and Au 4f5/2, indicating the presence of single atom Au in Au/NiWO4 (Fig. 2c). Fig. 2d displayed the XPS spectrum of Ag/NiWO4. The peaks at 857.31 eV and 863.21 eV were Ni 2p3/2 and Ni 2p1/2, respectively, indicating the presence of Ni2+ in Ag/NiWO4 (Fig. 2e). Ag 3d had two characteristic peaks, Ag 3d5/2 and Ag 3d3/2 (367.11 eV and 373.31 eV) (Fig. 2f). As can be seen, all the XPS results indicate that Ag is successfully anchored in the matrix lattice of Ag/NiWO4. Fig. 2g demonstrated the XPS spectrum of Cu/NiWO4. The peaks at 857.41 eV and 881.41 eV are identified as Ni 2p3/2 and Ni 2p1/2 (Fig. 2h), respectively [44–47]. The high-resolution XPS spectra of Cu show two spin orbit peaks at 944.31 and 949.11 eV, indicating an oxidation state of Cu. The oxidation of Cu may be due to the inevitable oxidation of the sample in air (Fig. 2i). Oxygen defects occur because oxygen atoms bind to the Ni surface and contain either adsorbed oxygen or hydroxyl groups containing oxygen atoms. This may be due to physical or chemical adsorption of water from the sample surface. However, the peaks found at 863.11 eV and 880.61 eV indicate the coexistence of Ni3+at low concentrations. The energy transfer of Cu to higher energy levels can BE attributed to the higher electronegativity of Ni than Cu, which induces the transfer of electrons from Cu to surrounding atoms in the O1s region (Fig.S7a∼b), and the peak of BE value of 531.91 eV in the W4f region is attributed to WO6. Because Ni 2p has a low energy (855.7 eV). XPS spectroscopy of Ni 2p shows that the oxidation state of Ni at Au/NiWO4 NF, Ag/NiWO4 NF and Cu/NiWO4 NF when the W3d peak was below the M/NiWO4 binding energy. As the W3d peak was shifted, the oxidation state of Ni changes as the electron density shifts from Ni to tightly coupled NiWO4 [48,49]. The pore structures of Au/NiWO4, Ag/NiWO4 and Cu/NiWO4 have been studied using N2 adsorption and desorption. As shown in Fig. 2j-I, the isotherms of both electrocatalysts rise sharply when the relative pressure was low, and a hysteresis loop appears when the relative pressure is about 0.2∼0.6. The pore size distribution was mainly about 1∼20 nm (inset), confirming that the pores are mainly micropores, hysteresis loops at relative pressure around about 0.8∼1 nm with pore size distribution about 20∼100 nm, hysteresis loop appears about 0.2∼0.8 nm relative pressure with an aperture of about 20∼30 nm. The BET specific surface areas of Cu2/NiWO4, Ag3/NiWO4 and Au3/NiWO4 were 2.14 and 10.96, 8.93 m2g−1, respectively. The results showed that the high porosity of the material provides channels for electrolytes and ions, promoting the electrocatalytic reactions. 3.2 Electrocatalytic performance of the catalysts The IB metal anchored NiWO4 catalysts with different mole ratios, including 1∼4 mmol %Cu, 1∼4 mmol % Ag and 1∼4 mmol % Au have been studied at 1 M KOH. Undoubtedly, Ag3/NiWO4 exhibited better OER activity, suggesting that the doping of elemental silver nanowires was more favorable for OER catalytic activity, and Ag3/NiWO4 had higher electrocatalytic activity than Au3/NiWO4 and Cu2/NiWO4. Fig.S8 demonstrated the overpotentical of Cux/NiWO4 (x = 1∼4). Cu2/NiWO4 (191.41 mV) <Cu4/NiWO4(294.01 mV) <Cu1/NiWO4(295.91 mV) <Cu3/NiWO4 (353.41 mV). Fig.S9 displayed that Ag3/NiWO4 had the lowest overpotential of 168.4 mV than Ag1/NiWO4, Ag2/NiWO4 and Ag4/NiWO4 (η=245.61 mV, 196.11 mV and 307.21 mV), which was better than the recently reported transition metal OER electrocatalysts, the Ag3/NiWO4 appeared a low η value of 168.41 mV. Fig.S10 expounded the LSV curves of Aux/NiWO4 (x = 1∼4), with Au3/NiWO4 had the lowest η10 = 275.4 mV. The LSV curves of the electrocatalytic activity of the IB metal on NiWO4 is represented in Fig. 3 a. It clearly showed that doping the sample with Au, Ag, and Cu in the lattice gap enhanced the OER activity, which was significantly higher than that of NiWO4 nanoparticles. Compared to Cu2/NiWO4 and Au3/NiWO4, Ag3/NiWO4 had the smallest potential for oxygen evolution excess. When the current density reached 10 mA cm−2, NiWO4 (364.41 mV) > Au3/NiWO4 (275.41 mV) > Cu2/NiWO4 (191.41 mV) > Ag3/NiWO4 (168.41 mV). Finally, the OER activity of Ag3/NiWO4 compared with that of non-precious metal electrocatalysts reported in the literature (Table.S1). Finally, the OER activity of Ag3/NiWO4 was compared with that of non-noble metal electrocatalysts reported in the literature (Table.S2), indicating that our catalyst has excellent catalytic activity. It is well known that the Tafel slope is a key parameter for the evaluation of catalytic processes and hence for the determination of OER dynamics. The Nyquist plot of the sample was distinctly semicircular, and its diameter was related to the charge transfer resistance (Rct). The Rct of Cu2/NiWO4 (1.80 Ω) < Cu4/NiWO4 (2.41 Ω) < Cu1/NiWO4 (3.81 Ω) < Cu3/NiWO4 (4.87 Ω) (Fig.S11a). The Rct of Ag3/NiWO4 (1.29 Ω) and Au3/NiWO4 (1.88 Ω) were smaller than that of other proportions of the compound catalysts (Fig. 3b, Fig.S12a, Fig.S13a). The lower the Tafel slope, the faster the oxygen evolution rate. The Tafel slope of Ag3/NiWO4 was 64.32 mV dec−1 (Fig. 3c), which was greatly lower than that of NiWO4 (87.08 mV dec−1), Cu2/NiWO4 (69 mV dec−1), Au3/NiWO4 (83.97 mV dec−1) and IrO2 (107.09 mV dec−1), suggesting that Ag3/NiWO4 had a potential active site and a lower charge transfer energy barrier. The OER process is a complex fourelectron oxidation process, and it can be divided into the following four steps: (1) H − + M → M − O H * + e − (2) O H − + M − O H * → M − O * + H 2 O + e − (3) O H − + M − O * → M − O O H * + e − (4) O H − + M − O O H * → M * + O 2 + H 2 O + e − M* represents the Au,Cu and Ag atoms present on the surface of NiWO4 samples during the OER process. The active site binds to OH– to form M −,OH*, M − O* and M− OOH* intermediates, which then form O2 at the active site [50,51]. Fig. 3d showed Ea of 50.89 kJ mol−1, 48.15 kJ mol−1, 46.47 kJ mol−1 for Au3/NiWO4, Cu2/NiWO4 and Ag3/NiWO4, respectively. The activation energy test is shown in the video1, compared to 61.09 kJ mol−1 for NiWO4, the results demonstrated that doping with Ag atoms can effectively reduce the activation energy of the OER reaction. As displayed in Fig. 3e, Ag3/NiWO4 demonstrated overpotentials (168.4, 37.11 and 507.91) mV at cathodic current densities of (10, 50 and 100) mA cm−2, respectively. As depicted in Fig. 3f, M/NiWO4 (M= Au, Ag, Cu) rapidly stabilize and maintain with the increase of current density, indicating rapid electron transmission and excellent conductivity, Ag3/NiWO4 showed excellent catalytic activity of OER. At a current density of 100 mA cm−2, the overpotential of Ag3/NiWO4 increased slightly, which may be due to the dissolution of trace metals at higher current densities during the OER process. As shown in Fig. 3g and 3h, the current density of Ag3/NiWO4 at 100 mA cm−2 only decreased by 5 % within 100 h, and even the overpotential of 10 mA cm−2 only decreased by 5 mV after 1000 cycles, which verified that the material had significant long stability. When the overpotential is 400 mV (Fig. 3i), Ag was assumed to be the active atom in Ag3/NiWO4, further evaluation of catalyst TOF at fixed potential showed that the Ag3/NiWO4 was 0.043 s−1, approximately 8.76 times that of NiWO4 (0.00491 s−1) (Table.S3). The mild dynamics of the alkaline OER is mainly due to the dissociation energy of water molecules [52,53]. The key factors to improve OER kinetics in alkali environments, reducing the excess potential of the catalyst and to reduce the activation energy of the reaction. In bifunctional catalysts, the doping of IB group metal atoms facilitates the dissociation of water and the production of hydrogen intermediates, with H subsequently adsorbed on nearby Au, Ag, and Cu surfaces and recombined to form hydrogen molecules. The production of these hydrogen intermediates can be further enhanced by inducing instabilities in the HOH bond, thereby increasing the OER activity [54]. Higher catalytic activity of IB group metal anchored NiWO4 catalysts for different mole ratios. As shown in Fig. 4 a, Au3/NiWO4 had an ultra low overvoltage of 86.1 mV at a current density of 10 mA cm−2, which was superior to Ag3/NiWO4 (η10 = 171.51 mV) and Cu2/NiWO4 (η10 = 106.4 mV), respectively. In addition, EIS used to measure Cu/NiWO4, Ag/NiWO4 and Au/NiWO4 the charge transfer resistance of the catalysts (Fig.S11b∼13b). The Nyquist plot of the sample was distinctly semicircular, and its diameter was related to the charge transfer resistance (Rct). The Rct of Cu1/NiWO4(1.30Ω) < Cu4/NiWO4(1.81 Ω) < Cu2/NiWO4(2.73 Ω) < Cu3/NiWO4(3.39 Ω). The Rct of Au3/NiWO4 (0.48 Ω) were smallest than that of other catalysts.The HER performance of catalysts was investigated in 1.0 M KOH, Fig.S14∼S16 displayed the LSV curves of Cu1/NiWO4, Cu2/NiWO4, Cu3/NiWO4 and Cu4/NiWO4, Ag1/NiWO4, Ag2/NiWO4, Ag3/NiWO4 and Ag4/NiWO4, and Au1/NiWO4, Au2/NiWO4, Au3/NiWO4 and Au4/NiWO4, respectively. At the current density of 10 mA cm−2, Fig.S14, Table.S4 showed the LSV curves of Cu2/NiWO4 displayed low η10=106.41 mV, inferior to that of Cu1/NiWO4, Cu3/NiWO4 and Cu4/NiWO4 (140 mV, 176.91 mV and 168.21 mV). Fig.S15 showed the LSV curves of Ag3/NiWO4 displayed low η10=171.51 mV. Fig.S16 expounded the LSV curves of Au3/NiWO4 displays low η10=86.1 mV. The results showed that the Cu2/NiWO4, Ag3/NiWO4 and Au3/NiWO4 composite catalysts exhibited fast charge transfer at HER activity. Fig. 4b represented the Nyquist diagram of the catalysts, the diameter of the semicircle was related to the charge transfer resistance of the catalyst. The obtained charge transfer resistance values were shown in the following sequence: Au3/NiWO4<Cu2/NiWO4<Ag3/NiWO4<NiWO4. The lower the value of the drag force, the faster the electron transfer in the HER process and the higher the OER efficiency [55]. The Tafel slope of Au3/NiWO4 was 115.16 mV dec−1 (Fig. 4c), which was considerably lower than that of Ag3/NiWO4 (148.36 mV dec−1) and Cu2/NiWO4(148.22 mV dec−1), suggesting that Au3/NiWO4 had a potential active site and a lower charge transfer energy barrier. In a typical HER, the reaction kinetics can be described by the steps based on the Tafel slope: (5) M * + H 2 O + e − = M − H a d s + O H − ( V o l m e r , 120 m V d e c − 1 ) The lower Tafel slope value of the M/NiWO4 suggested that the rate-determining step in the HER process. This means that the activation of H2O molecules on the Au3/NiWO4 electrode surface was more efffcient towards a faster HER reaction [56]. The HER activity of Au3/NiWO4 compared with that of non-noble metal electrocatalysts reported in the literature (Table.S5). The value of Au3/NiWO4 had the largest Cdl values of 9.34 mF cm−2 (Fig. 4d). ECSA was another key factor of electrocatalysis, to further illustrated the possible reasons for the improved catalytic activity, the electrochemical surface area evaluated by double layer capacitance (Cdl), calculated from the cyclic voltammetry curves of Fig.S17, S18 and S19. The value of Cdl and ECSA were estimated using the following equation: (6) E C S A = C d l / C s × S Cs (µF cm−2) represents the speciffc capacitance on the electrode surface, and S (cm2) is the actual area of the working electrodes (1 × 1 cm2). The Faraday region of each catalyst was evaluated from the double layer capacitance (Cdl) by measuring the CV at different scanning rates. The Cdl value for each catalyst calculated by determining the slope of a linear curve of the capacitance current difference (∆J/2) with one half of the scan rate [57,58]. The ECSA values of the catalysts were Au3/NiWO4(15.23 mF cm−2) > Ag3/NiWO4(11.57 mF cm−2) > Cu2/NiWO4(10.57 mF cm−2) > NiWO4(9.34 mF cm−2). Higher Cdl values confirmed higher ECSA, which provided higher catalytic active sites for adsorption of OH− and thus accelerated oxygen production. Fig. 4e showed Ea at 15.57 kJ mol−1, 15.73 kJ mol−1, 16.82 kJ mol−1 and 26.26 kJ mol−1 for Au3/NiWO4, Ag3/NiWO4, Cu2/NiWO4 and NiWO4, respectively. The results demonstrated that doping of Au atoms can effectively reduce the activation energy of HER reactions. As displayed in Fig. 4f, Au3/NiWO4 demonstrated overpotentials of 86.1 mV, 350 mV and 450.3 mV at cathodic current densities of 10 mA cm−2, 50 mA cm−2 and 100 mA cm−2, respectively. The best proportionally anchored (M=Au, Ag, Cu)/NiWO4 electrodes for the HER, we further studied the durability of the electrodes which will be of great concern toward its practical applications (Fig. 4g). ​In order to study the stability of the electrocatalyst, the period curve is almost unchanged after 1000 cycles, verifying the long-term stability of the material (Fig. 4h). Among all synthetic catalysts, Au3/NiWO4 was the best HER catalyst (Fig. 4i). When the overpotential was 400 mV, further evaluation of catalyst TOF at fixed potential showed that the Au3/NiO4 was 0.1261 s−1, nearly 1.88 times that of NiWO4 (0.0670 s−1) (Table.S6). This result was consistent with the Tafel slope obtained by HER. Doping of IB elements can modify the band structure, raising the Fermi level and lowering the work function to activate neighboring W atoms, thus providing additional active sites for HER. These results point to a continuous electron transfer process (Ni→W→O→M) in an alkaline medium by surface oxidation of Ni to form NiOOH, promoting the oxidation of OH− to O2 [59–62]. This suggests that the synergistic effect between Au, Ag, Cu and NiWO4 promoted the formation of NiOOH, which can enhance the HER activity. The bifunctional activity of overall water splitting and hydrogen evolution in alkaline media can be ensured by surface adsorption mechanisms. In order to verify the durability of the catalyst, under the current density of 10 mA cm−2, Au/NiWO4‖Au/NiWO4, Ag/NiWO4‖Ag/NiWO4, Cu/NiWO4‖Cu/NiWO4 catalysts stability tested for both the HER and OER in 1 M KOH solution (Fig.S20∼S22), and prolonged term stability tests for 150 h. The slight degradation of Cu2/NiWO4 for 12 h at a set overpotential for both the OER and HER (η10 = 191.4 mV, I12 /I0 = 70.39 % and η10 = 160.41 mV, I12 /I0 = 53 %), Ag3/NiWO4 for 12 h at a set overpotential for both the OER and HER (η10 = 168.4 mV, I12 /I0 = 88.57 % and η10 = 171.51 mV, I12 /I0 = 70.35 %), Au3/NiWO4 for 150 h at a set overpotential for both the OER and HER (η10 = 275.4 mV, I10/I0 = 99.78 %, I50/I0 = 96.09 %, I100/I0 = 94.51 %), and a large number of bubbles can be observed on both cathode and anode surfaces during electrolysis, Ag3/NiWO4 had high stability. As shown in Fig. 5 a, when the current density was 10 mA cm−2, the voltage of Au3/NiWO4 NF‖Au3/NiWO4 NF was 1.45 V, the NiWO4 NF‖NiWO4 NF was 1.68 V, the Pt/C‖IrO2 voltage was 1.79 V. the voltage of Au3/NiWO4 (+, -) was lower than that of nanomaterials electrode systems (Fig. 5b). The polarization curves of Ag3/NiWO4 NF‖Ag3/NiWO4 NF, NiWO4 NF‖NiWO4 NF and Pt/C‖IrO2 were 1.47 V, 1.67 V and 1.78 V (Fig. 5c). The Au3/NiWO4 NF‖Au3/NiWO4 NF voltages are 1.45 V, 1.68 V, 1.88 V and 1.95 V at a current density of 10, 50, 100 and 120 mA cm−2, respectively. Which was comparable to the performance of most recently developed dual function total water splitting electrocatalysts (Fig. 5d, Table.S7). The current O2 rate of Au3/NiWO4 NF‖Au3/NiWO4 NF is 99.94 %, the current H2 rate was 99.91 % (Fig. 5e). The excellent catalytic performance attributed to the following factors:(i) The IB metal- anchored tungstate not only improves its own metallic properties and internal conductivity, but also provides a good surface electronic structure to enhance its catalytic activity [63]. At the same time, it can induce changes in the surface actives sites, making it easier to achieve thermodynamic adsorption of hydrogen/oxygen at the catalyst surface. At the same time, electron transfer between precious metals is more likely to increase electron conduction, reducing the energy barrier of the reactant adsorption-desorption process and thus enhancing its electrostatic activity. (ii) The introduction of heteroatoms can not only regulate the coordination environment of nickel-based octahedral groups, but also provide a certain steric hindrance to alleviate the agglomeration phenomenon in the process of overall water splitting [64]. (iii) The formation of nano-multilayer structures around metal sites is conducive to the mass transfer of catalytic reactions and the exposure of active sites [65,66]. Based on the above analysis, the synergistic effect between the active bimetallic tungstate and the metal doping played a decisive role in improving the electrocatalytic performance of bimetallic Ni based materials. (M=Au, Ag, Cu)/NiWO4 provides an efficient route to the development and utilization of clean and renewable energy sources as a high-efficiency, low-cost, electrochemically stable dual-function catalyst. This indicated that Au3/NiWO4 NF‖Ag3/NiWO4 NF had excellent long-term stability in the process of overall water splitting. Fig. 5f showed the η10 at 1 M KOH, and the electrolytic cell can operate stable for 100 h. DFT used to demonstrate the influence of the effect interface of heterojunction on catalytic performance displayed in Fig. 6 . According to HRTEM results, Cu2O (111) and NiWO4(110) were catalytic interfaces. The Gibbs free energy shift was calculated at each reaction step of the alkaline OER for Cu/NiWO4. The binding energies indicate that Cu2O and NiWO4 are bound by chemical bonds rather than weak vander Waals forces. The charge between Cu and O atoms in Cu2O forms a Cu-O bond through the interface, which allowed Cu to enter the heterojunction with a stronger positive charge than in the original Cu2O. According to the mechanism of OER four electron transfer reaction, the stable structures of M/NiWO4 interacting with the oxygen-containing intermediate states (OH*, O* and OOH*) generated during the reaction were determined, respectively [67–69]. Fig. 6a was the ΔGH* diagram of oxygen-containing intermediate states generated during OER adsorption at different sites of Cu/NiWO4 at an applied voltage of 1.23 V. As shown in Fig. 6b, red and silver sticks represent *OH, red balls represent oxygen atoms, the blue balls represent Cu atoms. Ag3/NiWO4 exhibits the highest OER catalytic activity, presumably because the Au3/NiWO4 and Cu2/NiWO4 systems have stronger adsorption onto oxygen-containing intermediates, making subsequent reactions or gas dissociation more difficult. Therefore, in the catalytic OER process, the catalyst for the adsorption of oxygen intermediate state requires a suitable adsorption energy (Fig. 6c). HER electrocatalytic mechanism diagram for Au/NiWO4 constructed (Fig. 6d). It performs a series of DFT calculations using VASP software. *H and *2H are connected to nickel atoms to construct a stable structure after the interaction of H* generated during the reaction between Au/NiWO4 and HER. As shown in Fig. 6e, indicating that H* has a significant activity on Au/NiWO4. ΔGH* on Au/NiWO4 is closer to zero. Theoretical calculations showed that a certain amount of Au atom can enhance the HER catalytic activity. It is known that Ni2+ and W6+ ions in the NiWO4 structure form NiO6 octahedra and WO6 octahedra with oxygen, respectively. W6+ can not participate in redox reactions and their essential role is to enhance the conductivity and electrochemical properties of NiWO4 electrocatalysts. After OH− ions diffuse to the electrocatalyst, they interact with oxygen atoms in the NiO6 cluster during charging to form NiOOH structures and release electrons (Fig. 6f). It has been shown that IB group electron transport is closely related to crystal structure distortions. When the degree of crystal structure distortion is relatively low, as in NiOOH. Its unoccupied d z 2 orbit coincides exactly with the a1g* orbit. Since the a1g* band is formed by the hybridization of metal 4 s and O 2p orbitals, according to the filling order of Ni atomic orbitals, the electron transfer from oxygen band to d z 2 orbitals cannot be realized. The doping regime of Au can be improved when the degree of crystal structure distortion is relatively steep. The oxygen band can be transferred to the metal d z 2 orbital electron, which is conducive to the hydrogen evolution reaction, as shown in Fig. 7 a. Ni as the active site can capture OH− from water, and alter the reaction speed step from OOH* generate to O2 by conventional adsorbent evolution mechanism (AEM), which considerably reduces the reaction energy barrier and significantly improves the catalytic activity without sacrificing stability. At the same time, Ag can dynamically provide electrons to Ni in the reaction under synergistic multiple mechanisms, which inhibits excessive oxidation and dissociation of active sites and further improves catalytic stability (Fig. 7b). The effect of Au, Ag, and Cu doping on the electronic configuration and catalytic activity of NiWO4 has been discussed in terms of the splitting pattern of Ni2+in the crystal field. As shown in Fig. 8 , consistent with the results verified by XPS, doping of group IB metals can lead to the oxidation of Ni2+ in the tungstate lattice to form Ni3+ ions, and the corresponding electronic configuration of Ni3+ is ( t 2 g 6 e g 1 ). This asymmetric electronic configuration is prone to lattice distortions in the octahedral field. In addition, high-energy eg orbitals can form d x 2 − y 2 and d z 2 , and empty high-energy orbitals act as acceptor orbitals to receive electron fillings from lone pairs of OH−, thus enhancing the catalytic activity of oxygen evolution reactions. As shown in formula (2), as the active center in alkaline solution, the empty orbitals of Ni3+ are more easily hybrid with the full 2p orbitals of oxygen atoms. This accelerates electron transfer, whereas Ni2+ has no additional empty orbitals and requires additional energy to accommodate lone pairs of OH-electrons. Therefore, the presence of Au, Ag and Cu also plays a crucial role in improving the catalyst performance of NiWO4: (1) The doping of IB metal leads to the synergistic effect of bimetallic active sites, which is conducive to the formation of catalytic active intermediates; (2) Anchored IB metal ions in NiWO4 lattice are conducive to the release of O2 molecules, which may be caused by the synergistic effect of IB metal ions and Ni2+; (3) The presence of anchored IB metal ions in the NiWO4 lattice enhances the elevated conductivity of the catalytic material and also improves the electron transfer at the electrode/electrolyte interface; (4) Due to the flow-like structure of NiWO4, additional active sites are exposed, and the introduction of Au nanoparticles avoids the easy agglomeration of materials, enhances the stability of HER, and the synergistic effect is conducive to the improvement of catalytic activity; (5) There is orbital overlap between d orbital of Ag and Ni, which also verifies the synergistic effect of Ag and Ni. Moreover, the introduction of Ag nanowires makes the catalyst more conductive, with a larger active area and higher Ni3+, which is also responsible for the better OER activity. In order to further explore the crystal structure of Au, Ag, Cu@NiWO4 nanocrystals after testing, XRD tests were performed. As shown in Fig.S23, there are characteristic diffraction peaks at 2θ =15.62°,19.28°,23.97°,24.92°,30.93°and 36.57°, corresponding to the (010), (100), (011), (110), (−111), (002) crystal planes of diffraction, respectively. All XRD peaks are consistent with the crystal system NiWO4 (JCPDS:15–0755), the diffraction peaks are significantly weakened, and the diffraction angle is partially offset, indicating that after electrocatalytic test, although the sample morphology is damaged, the crystal structure is still stable, which is consistent with the electrocatalytic property, and also the reason for the relatively lengthy stability of catalytic evolution energy (Fig.S23a). In order to additionally observe the morphology of the tested samples, it was found that due to the use of naphthol reagents, the catalyst was wrapped in a membrane-like structure, and the surface and fault were wire-drawn structures, so the morphology of the catalyst could not be accurately observed (Fig.S23b∼Fig. 23f). 4. Conclusion In this study, through the double modulation of Au, Ag, Cu/NiWO4, both the metal site and the oxygen active site of the catalyst were activated, and the adsorption of OER active intermediates under the mechanism of adsorbent evolution was effectively optimized, and a bifunctional catalyst with metal active site and lattice oxygen compatibility mechanism was constructed. In alkaline media, Ag3/NiWO4 exhibited excellent OER performance with the potential of 168.41 mV at a current density of 10 mA cm−2. Au3/NiWO4 showed excellent HER performance with the potential of 86.11 mV. The Au3/NiWO4@NF‖Au3/NiWO4-@NF consisted of double electrodes are 1.448 V and used for overall water splitting, and stability maintained up to 100 h. The designed Au, Ag, Cu/NiWO4 catalysts maximize the use of surfaces active sites and show excellent HER/OER catalytic activity and stability under cooperative optimization of multiple mechanisms. This work provides fresh ideas for the design of modern efficient OER catalysts. CRediT authorship contribution statement Min Yang: Writing – original draft, Resources, Project administration. Shuang Sheng: Methodology, Conceptualization. Ziyi Wan: Visualization. Yaoyao Xu: Data curation. Rui Qi: Formal analysis. Xiaofeng Luo: Data curation. Weiyu Pan: Visualization, Data curation. Kunshan Yang: . Ziqing Zhang: Funding acquisition. Guowei Deng: Funding acquisition. Declaration of competing interest The authors declare that they have no known competing financial interests or personal relationships that could have appeared to influence the work reported in this paper. Acknowledgments This work is financially supported by National undergraduate training program for innovation and entrepreneurship (Grant No. S202414389111, S202414389118). Opening Project of Structural Optimization and Application of Functional Molecules Key Laboratory of Sichuan Province (2023GNFZ-02). Opening Project of Medical Imaging Key Laboratory of Sichuan Province (MIKL202204). Supplementary materials Supplementary material associated with this article can be found, in the online version, at doi:10.1016/j.mcat.2025.115313. Appendix Supplementary materials Image, application 1 Image, video 2 References [1] B. Zhang J. Wang G. Liu C. Weiss D. Liu Y. Chen L. Xia P. Zhou M. Gao Y. Liu J. Chen Y. Yan M. Shao H. Pan W. Sun A strongly coupled Ru–CrOx cluster–cluster heterostructure for efficient alkaline hydrogen electrocatalysis Nat. Catal. 7 2024 441 451 B. Zhang, J. Wang, G. Liu, C. Weiss, D. Liu, Y. Chen, L. Xia, P. Zhou, M. Gao, Y. Liu, J. Chen, Y. Yan, M. Shao, H. Pan, W. Sun, A strongly coupled Ru–CrOx cluster–cluster heterostructure for efficient alkaline hydrogen electrocatalysis, Nat. Catal. 2024, 7, 441–451. [2] Y. Wang T. Wang H. Arandiyan G. Song H. Sun Y. Sabri C. Zhao Z. Shao S. Kawi Advancing catalysts by stacking fault defects for enhanced hydrogen production: a review Adv. Mater. 36 2024 2313378 Y. Wang, T. Wang, H. Arandiyan, G. Song, H. Sun, Y. Sabri, C. Zhao, Z. Shao, S. Kawi, Advancing catalysts by stacking fault defects for enhanced hydrogen production: a review, Adv. Mater. 2024, 36, 2313378. [3] Y. Zhu M. Klingenhof C. Gao T. Koketsu G. Weiser Y. Pi S. Liu L. Sui J. Hou J. Li H. Jang L. Xu W. Huang C. Pao M. Yang Z. Hu P. Strasser J. Ma Facilitating alkaline hydrogen evolution reaction on the hetero-interfaced Ru/RuO2 through Pt single atoms doping Nat. Commun. 15 2024 1447 Y. Zhu, M. Klingenhof, C. Gao, T. Koketsu, G. Weiser, Y. Pi, S. Liu, L. Sui, J. Hou, J. Li, H. Jang, L. Xu, W. Huang, C. Pao, M. Yang, Z. Hu, P. Strasser, J. Ma, Facilitating alkaline hydrogen evolution reaction on the hetero-interfaced Ru/RuO2 through Pt single atoms doping, Nat. Commun. 2024, 15, 1447. [4] L. Quan H. Jiang G. Mei Y. Sun B. You Bifunctional electrocatalysts for overall and hybrid water splitting Chem. Rev. 7 2024 3694 3812 L. Quan, H. Jiang, G. Mei, Y. Sun, B. You, Bifunctional electrocatalysts for overall and hybrid water splitting, Chem. Rev. 2024, 7, 3694–3812. [5] D. Hansora J.W. Yoo R. Mehrotra W.J. Byun D. Lim Y.K. Kim E. Noh H. Lim J.-W. Jang S.I. Seok J.S. Lee All-perovskite-based unassisted photoelectrochemical water splitting system for efficient, stable and scalable solar hydrogen production Nat. Energy. 9 2024 272 284 D. Hansora , J.W. Yoo, R. Mehrotra, W.J. Byun, D. Lim, Y.K. Kim, E. Noh, H. Lim, J.-W. Jang, S.I. Seok, J.S. Lee, All-perovskite-based unassisted photoelectrochemical water splitting system for efficient, stable and scalable solar hydrogen production, Nat. Energy. 2024, 9, 272–284. [6] K.Wang P.W Y. Liu H. Li Y. Guo Y. Tian S. Guo M. Luo Y. He Z. Liu S. Guo Dual-type Ru atomic sites for efficient alkaline overall water splitting Adv. Funct. Mater. 2024 2316709 P.W, K.Wang, Y. Liu, H. Li, Y. Guo, Y. Tian, S. Guo, M. Luo, Y. He, Z. Liu, S. Guo, Dual-type Ru atomic sites for efficient alkaline overall water splitting, Adv. Funct. Mater. 2024, 2316709. [7] H. Ren Z. Zhang Z. Geng Z. Wang F. Shen X. Liang Z. Cai Y. Wang D. Cheng Y. Cao X. Yang M. Hu X. Yao K. Zhou Gradient OH desorption facilitating alkaline hydrogen evolution over ultrafine quinary nanoalloy Adv. Energy Mater. 14 2024 2400777 H. Ren, Z. Zhang, Z. Geng, Z. Wang, F. Shen, X. Liang, Z. Cai, Y. Wang, D. Cheng, Y. Cao, X. Yang, M. Hu, X. Yao, K. Zhou, Gradient OH desorption facilitating alkaline hydrogen evolution over ultrafine quinary nanoalloy, Adv. Energy Mater. 2024, 14, 2400777. [8] T. Fang X. Yu X. Han J. Gao Y. Ma Coordination engineering of carbon dots and Mn in Co-based phosphides for highly efficient seawater splitting at ampere-level current density Small 37 2024 2402478 T. Fang, X. Yu, X. Han, J. Gao, Y. Ma, Coordination engineering of carbon dots and Mn in Co-based phosphides for highly efficient seawater splitting at ampere-level current density, Small. 2024, 37, 2402478. [9] D. Yang J. Liang J. Wu Y. Xiao J.I. Dadap K. Watanabe T. Taniguchi Z. Ye Non-volatile electrical polarization switching via domain wall release in 3R-MoS2 bilayer Nat. Commun. 15 2024 1389 D. Yang, J. Liang, J. Wu, Y. Xiao, J.I. Dadap, K. Watanabe, T. Taniguchi, Z. Ye, Non-volatile electrical polarization switching via domain wall release in 3R-MoS2 bilayer, Nat. Commun. 2024, 15, 1389. [10] W. Guo J. Li D.-F. Chai D. Guo G. Sui Y. Li D. Luo L. Tan Iron active center coordination reconstruction in Iron carbide modified on porous carbon for superior overall water splitting Adv. Sci. 11 2024 2401455 W. Guo, J. Li, D.-F. Chai, D. Guo, G. Sui, Y. Li, D. Luo, L. Tan, Iron active center coordination reconstruction in Iron carbide modified on porous carbon for superior overall water splitting, Adv. Sci. 2024,11, 2401455. [11] E. Hong Z. Yang H. Zeng L. Gao C. Yang Recent development and challenges of bipolar membranes for high performance water electrolysis ACS Mater. Lett. 6 2024 1623 1648 E. Hong, Z. Yang, H. Zeng, L. Gao, C. Yang, Recent development and challenges of bipolar membranes for high performance water electrolysis, ACS Mater. Lett. 2024, 6, 1623–1648. [12] Z. Hu T. Krisnanda A. Fieramosca J. Zhao Q. Sun Y. Chen H. Liu Y. Luo R. Su J. Wang K. Watanabe T. Taniguchi G. Eda X.R. Wang S. Ghosh K. Dini D. Sanvitto T.C.H. Liew Q. Xiong Energy transfer driven brightening of MoS2 by ultrafast polariton relaxation in microcavity MoS2/hBN/WS2 heterostructures Nat. Commun. 15 2024 1747 Z. Hu, T. Krisnanda, A. Fieramosca, J. Zhao, Q. Sun, Y. Chen, H. Liu, Y. Luo, R. Su, J. Wang, K. Watanabe, T. Taniguchi, G. Eda, X.R. Wang S. Ghosh, K. Dini, D. Sanvitto, T.C.H. Liew, Q. Xiong, Energy transfer driven brightening of MoS2 by ultrafast polariton relaxation in microcavity MoS2/hBN/WS2 heterostructures, Nat. Commun. 2024, 15, 1747. [13] L. Liu Y. Chen L. Chen B. Xie G. Li L. Kong Q. Tao Z. Li X. Yang Z. Lu L. Ma D. Lu X. Yang Y. Liu Ultrashort vertical-channel MoS2 transistor using a self-aligned contact Nat. Commun. 15 2024 165 L. Liu, Y. Chen, L. Chen, B. Xie, G. Li, L. Kong, Q. Tao, Z. Li, X. Yang, Z. Lu, L. Ma, D. Lu, X. Yang, Y. Liu, Ultrashort vertical-channel MoS2 transistor using a self-aligned contact, Nat. Commun. 2024,15, 165. [14] S. Liu Z. Li Y. Chang M.G. Kim H. Jang J. Cho L. Hou Xien Liu Substantial impact of built-in electric field and electrode potential on the alkaline hydrogen evolution reaction of Ru-CoP urchin arrays Angew Chem Int Edit 63 2024 202400069 S. Liu, Z. Li, Y. Chang, M.G. Kim, H. Jang, J. Cho, L. Hou, Xien Liu, Substantial impact of built-in electric field and electrode potential on the alkaline hydrogen evolution reaction of Ru-CoP urchin arrays, Angew Chem Int Edit. 2024, 63, 202400069. [15] Q. Wang F. Wu Q. Xu J. Tian Z. Huang Q. Wang X. Zhao Q. Zhang Q. Fan X. Li Y. Peng Y. Zhang K. Ji A. Zhi H. Sun M. Zhu J. Zhu N. Lu Y. Lu S. Wang X. Bai Y. Xu W. Yang N. Li D. Shi L. Xian K. Liu L. Du G. Zhang Epitaxy of wafer-scale single-crystal MoS2 monolayer via buffer layer control Nat. Commun. 15 2024 1825 Q. Wang, F. Wu, Q. Xu, J. Tian, Z. Huang, Q. Wang, X. Zhao, Q. Zhang, Q. Fan, X. Li, Y. Peng, Y. Zhang, K. Ji, A. Zhi, H. Sun, M. Zhu, J. Zhu, N. Lu, Y. Lu, S. Wang, X. Bai, Y. Xu, W. Yang, N. Li, D. Shi, L. Xian, K. Liu, L. Du, G. Zhang, Epitaxy of wafer-scale single-crystal MoS2 monolayer via buffer layer control, Nat. Commun. 2024,15, 1825. [16] W. Yu Q. Li W. Xiao J. Wang B. Dong Y. Chai Z. Wu L. Wang Unique CoP microflower decorated with phosphorous-enriched PtP2 onto nickel foam with interfacial electronic interactions to boost alkaline water-splitting Adv. Funct. Mater. 34 2024 2313935 W. Yu, Q. Li, W. Xiao, J. Wang, B. Dong, Y. Chai, Z. Wu, L. Wang, Unique CoP microflower decorated with phosphorous-enriched PtP2 onto nickel foam with interfacial electronic interactions to boost alkaline water-splitting, Adv. Funct. Mater. 2024,34, 2313935. [17] R.X. Hou J.W. Xiao Q. Wu T.Y. Zhang Boosting oxygen vacancies by modulating the morphology of Au decorated In2O3 with enhanced CO2 hydrogenation activity to CH3OH J. Environ. Sci 140 2024 91 102 R.X. Hou, J.W. Xiao, Q. Wu, T.Y. Zhang,Boosting oxygen vacancies by modulating the morphology of Au decorated In2O3 with enhanced CO2 hydrogenation activity to CH3OH, J. Environ. Sci, 140 (2024) 91–102. [18] Y. Cui J. Wang Y. Li Y. Wu E. Been Z. Zhang J. Zhou W. Zhang H.Y. Hwang R. Sinclair Y. Cui Twisted epitaxy of gold nanodisks grown between twisted substrate layers of molybdenum disulfide Science 383 2024 212 219 Y. Cui, J. Wang, Y. Li, Y. Wu, E. Been, Z. Zhang, J. Zhou, W. Zhang, H.Y. Hwang, R. Sinclair, Y. Cui, Twisted epitaxy of gold nanodisks grown between twisted substrate layers of molybdenum disulfide, Science. 2024, 383, 212–219. [19] L.J. He Y. Zhang Y.C. Zang C.X. Liu W.C. Wang R. Han N. Ji S.T. Zhang Q.L. Liu Promotion of ASite Ag-doped perovskites for the catalytic oxidation of soot: synergistic catalytic effect of dual active sites ACS Catal 11 2021 14224 14236 L.J. He, Y. Zhang, Y.C. Zang, C.X. Liu, W.C. Wang, R. Han, N. Ji, S.T. Zhang, and Q.L. Liu. Promotion of ASite Ag-doped perovskites for the catalytic oxidation of soot: synergistic catalytic effect of dual active sites, ACS Catal. 2021, 11, 14224–14236. [20] G.S. Cassol C. Shang A.K. An N.K. Khanzada F. Ciucci A. Manzotti P. Westerhoff Y. Song L. Ling Ultra-fast green hydrogen production from municipal wastewater by an integrated forward osmosis-alkaline water electrolysis system Nat. Commun. 15 2024 2617 G.S. Cassol, C. Shang, A.K. An, N.K. Khanzada, F. Ciucci, A. Manzotti, P. Westerhoff, Y. Song, L. Ling, Ultra-fast green hydrogen production from municipal wastewater by an integrated forward osmosis-alkaline water electrolysis system, Nat. Commun. 2024, 15, 2617. [21] X. Liu H. Liao S. Zhang M. Liu Y. Zhang X. He F. Liu H. Cui P. Tan J. Pan Deciphering role of dual nickel sites in reconstructed hetero-anionic structure of nickel sulfide for boosted hydrogen evolution reaction Appl Catal B-Environ 375 2024 124270 X. Liu, H. Liao, S. Zhang, M. Liu, Y. Zhang, X. He, F. Liu, H. Cui, P. Tan, J. Pan Deciphering role of dual nickel sites in reconstructed hetero-anionic structure of nickel sulfide for boosted hydrogen evolution reaction, Appl Catal B-Environ. 2024, 375, 124270. [22] Y. Wan K.S. Yang P.P. Li S.R. Yang X.N. Wang R.Q. Gao X.M. Xie G.W. Deng M. Yang Z.F. Wang Atomically dispersed Au single sites and nanoengineered structural defects enable a high electrocatalytic activity and durability for hydrogen evolution reaction and overall urea electrolysis Electrochimica. Acta. 449 2024 144685 Wan, Y.; Yang, K.S.; Li, P.P.; Yang, S.R.; Wang, X.N.; Gao, R.Q.; Xie, X.M.; Deng, G.W.; Yang, M.; Wang, Z.F.; Atomically dispersed Au single sites and nanoengineered structural defects enable a high electrocatalytic activity and durability for hydrogen evolution reaction and overall urea electrolysis. Electrochimica. Acta. 2024, 449, 144685. [23] L. Qiao C. Xi C. Li K. Zhang Q. Li J. Han Y. Ding Self-limited formation of nanoporous nickel heterostructure catalyst for electrochemical hydrogen production Adv. Funct. Mater. 2024 2402286 L. Qiao, C. Xi, C. Li, K. Zhang, Q. Li, J. Han, Y. Ding, Self-limited formation of nanoporous nickel heterostructure catalyst for electrochemical hydrogen production, Adv. Funct. Mater. 2024, 2402286. [24] G. Chen H. Xiang Y. Guo J. Huang W. Chen Z. Chen T. Li K. Ostrikov Yttrium and nitrogen doped NiCo phosphide nanosheets for high-efficiency water electrolysis Carbon Ener 2024 522 G. Chen, H. Xiang, Y. Guo, J. Huang, W. Chen, Z. Chen, T. Li, K. Ostrikov, Yttrium and nitrogen doped NiCo phosphide nanosheets for high-efficiency water electrolysis, Carbon Ener. 2024, 522. [25] C. Zhang C. Teng S. Guo Y. Sun C. Yu X. Jin K. Liu L. Jiang Superaerophilic/superaerophobic NiFe-LDHs electrode for enhancing overall water splitting in alkaline Media Nano Lett. 24 2024 1959 1966 C. Zhang, C. Teng, S. Guo, Y. Sun, C. Yu, X. Jin, K. Liu, L. Jiang, Superaerophilic/superaerophobic NiFe-LDHs electrode for enhancing overall water splitting in alkaline Media, Nano Lett. 2024, 24, 1959–1966. [26] W.J. Liu W.X. Liu T. Hou J.Y. Ding Z.G. Wang R.L. Yin X.Y. San L.G. Feng J. Luo X.J. Liu Coupling Co-Ni phosphides for energy-saving alkaline seawater splitting Nano Res 17 2024 4797 W.J. Liu, W.X. Liu, T. Hou, J.Y. Ding, Z.G. Wang, R.L. Yin, X.Y. San, L.G. Feng, J. Luo, and X.J. Liu. Coupling Co-Ni phosphides for energy-saving alkaline seawater splitting, Nano Res. 2024, 17, 4797. [27] A.M. Shah K.H. Modi P.M. Pataniya K.S. Joseph S. Dabhi G.R. Bhadu C.K. Sumesh Self-supported Mn-Ni3Se2 electrocatalysts for water and urea electrolysis for energy-saving hydrogen production ACS Appl Mater Inter 16 2024 11440 11452 A.M. Shah, K.H. Modi, P.M. Pataniya, K.S. Joseph, S. Dabhi, G.R. Bhadu, C.K. Sumesh, Self-supported Mn-Ni3Se2 electrocatalysts for water and urea electrolysis for energy-saving hydrogen production, ACS Appl Mater Inter. 2024,16, 11440–11452. [28] Y. Zhou J.Z. Zeng X.R. Zheng W.J. Huang Y. Dong J.F. Zhang Y.D. Deng R.Z. Wu Enhancing the oxygen evolution reaction activity and stability of high-valent CoOOH by switching the catalytic pathway through doping low-valent Cu J Colloid Interface Sci 678 2025 536 546 Y. Zhou, J.Z. Zeng, X.R. Zheng, W.J. Huang, Y. Dong, J.F. Zhang, Y.D. Deng, R.Z. Wu. Enhancing the oxygen evolution reaction activity and stability of high-valent CoOOH by switching the catalytic pathway through doping low-valent Cu. J Colloid Interface Sci, 678 (2025) 536–546 [29] M. Yang Y.G. Li D.L. Luo Q.H. Wang X.L. Zhang J. Liu L. Li J. Zhao G.W. Deng A novel sea urchin like nanostructure as a bifunctional catalyst for overall water splitting Electrochimica. Acta. 475 2024 143599 Yang, M.; Li, Y.G.; Luo, D.L.; Wang, Q.H.; Zhang, X.L.; Liu, J.; Li, L.; Zhao, J.; Deng, G.W.; A novel sea urchin like nanostructure as a bifunctional catalyst for overall water splitting. Electrochimica. Acta. 2024, 475, 143599. [30] T.-Q. Gao Y.-Q. Zhou X.-J. Zhao Z.-H. Liu Y. Chen Borate anion-intercalated NiV-LDH nanoflakes/NiCoP nanowires heterostructures for enhanced oxygen evolution selectivity in seawater splitting Adv, Funct. Mater. 34 2024 2315949 T.-Q. Gao, Y.-Q. Zhou, X.-J. Zhao, Z.-H. Liu, Y. Chen, Borate anion-intercalated NiV-LDH nanoflakes/NiCoP nanowires heterostructures for enhanced oxygen evolution selectivity in seawater splitting. Adv, Funct. Mater. 2024, 34, 2315949. [31] L. Quan H. Jiang G. Mei Y. Sun B. You Bifunctional electrocatalysts for overall and hybrid water splitting Chem. Rev. 124 2024 3694 3812 L. Quan, H. Jiang, G. Mei, Y. Sun, B. You, Bifunctional electrocatalysts for overall and hybrid water splitting, Chem. Rev. 2024,124, 3694–3812. [32] K.-M. Hung J.-J. Wu Bifunctional nickel phosphide nanoparticle/nickel cobalt sulfide nanosheet framework for electrocatalytic simultaneous hydrogen evolution and 2,5-furandicaroxylic acid production Chem. Eng. J. 484 2024 149772 K.-M. Hung, J.-J. Wu, Bifunctional nickel phosphide nanoparticle/nickel cobalt sulfide nanosheet framework for electrocatalytic simultaneous hydrogen evolution and 2,5-furandicaroxylic acid production, Chem. Eng. J. 2024, 484, 149772. [33] M.Y. Chen J.J. Ma C.J. Chen J.Y. Ding Y.F. Liu H.B. He Q. Liu G.Z. Hu Y.H. Wu X.J. Liu Cutting-edge innovations in red carbon dots: synthesis, perfection, and breakthroughs in optoelectronics and electrocatalysis Chem. Eng. J. 498 2024 155302 M.Y. Chen, J.J. Ma, C.J. Chen, J.Y. Ding, Y.F. Liu, H.B. He, Q. Liu, G.Z. Hu, Y.H. Wu, X.J. Liu, Cutting-edge innovations in red carbon dots: synthesis, perfection, and breakthroughs in optoelectronics and electrocatalysis. Chem. Eng. J. 2024, 498, 155302. [34] J. Nie J. Shi T. Huang M.-Y. Xie Z.-Y. Ouyang M.-H. Xian G.-F. Huang H. Wan W. Hu W.-Q. Huang Cation-induced deep reconstruction and self-optimization of NiFe phosphide precatalysts for hydrogen evolution and overall water splitting Adv. Funct. Mater. 2024 2314172 J. Nie, J. Shi, T. Huang, M.-Y. Xie, Z.-Y. Ouyang, M.-H. Xian, G.-F. Huang, H. Wan, W. Hu, W.-Q. Huang, Cation-induced deep reconstruction and self-optimization of NiFe phosphide precatalysts for hydrogen evolution and overall water splitting, Adv. Funct. Mater. 2024, 2314172. [35] H. Kang D. He X. Yan B. Dao N.B. Williams G.I. Elliott D. Streater J. Nyakuchena J. Huang X. Pan X. Xiao J. Gu Cu promoted the dynamic evolution of Ni-based catalysts for polyethylene terephthalate plastic upcycling ACS Catal 14 2024 5314 5325 H. Kang, D. He, X. Yan, B. Dao, N.B. Williams, G.I. Elliott, D. Streater, J. Nyakuchena, J. Huang, X. Pan, X. Xiao, J. Gu, Cu promoted the dynamic evolution of Ni-based catalysts for polyethylene terephthalate plastic upcycling, ACS Catal. 2024,14, 5314–5325. [36] B.J. Rani G. Ravi R. Yuvakkumar S.I. Hong Novel SmMn2O5 hollow long nano-cuboids for electrochemical supercapacitor and water splitting applications Vacuum 166 2019 279 285 B.J. Rani, G. Ravi, R. Yuvakkumar, S.I. Hong, Novel SmMn2O5 hollow long nano-cuboids for electrochemical supercapacitor and water splitting applications, Vacuum, 2019, 166, 279–285. [37] Q. Geng Y.Z. Li H.T. Xie Interface engineering of CoS/SnS2 nanosheets for boosting electrocatalytic overall water splitting in alkaline medium Vacuum 203 2022 111308 Q. Geng, Y.Z. Li, H.T. Xie, Interface engineering of CoS/SnS2 nanosheets for boosting electrocatalytic overall water splitting in alkaline medium, Vacuum, 2022, 203, 111308. [38] C.Q. Zhang S. Zhou X.J. Dong Y. Han J.H. Li W.Z. Yin Three-dimensional self-supported iron-doped nickel sulfides for sustainable overall water splitting Vacuum 181 2020 109661 C.Q. Zhang, S. Zhou, X.J. Dong, Y. Han, J.H. Li, W.Z. Yin, Three-dimensional self-supported iron-doped nickel sulfides for sustainable overall water splitting, Vacuum, 2020, 181, 109661. [39] Q. Huang F. Wang Z. Sun B. Zhang W.Z. Li F. Guo Y. Liu F.Z. Ren X. Duan In situ growth and dynamic transformation of nickel chelate nanoarrays into reactive surface reconstituted heterostructure for overall water splitting Adv. Funct. Mater. 2024 2407407 Q. Huang, F. Wang, Z. Sun, B. Zhang, W.Z. Li, F. Guo, Y. Liu, F.Z. Ren, X. Duan, In situ growth and dynamic transformation of nickel chelate nanoarrays into reactive surface reconstituted heterostructure for overall water splitting, Adv. Funct. Mater. 2024, 2407407. [40] R.-G. Tian L. Wang L. Zheng S.-K. Tian Nickel-catalyzed inter- and intramolecular reductive CrossCoupling reactions of arylbenzylammonium salts through highly site-selective C–N bond cleavage ACS Catal 14 2024 5039 5046 R.-G. Tian, L. Wang, L. Zheng, S.-K. Tian, Nickel-catalyzed inter- and intramolecular reductive CrossCoupling reactions of arylbenzylammonium salts through highly site-selective C–N bond cleavage, ACS Catal. 2024, 14, 5039–5046. [41] N. Shi R. Ma L. Lin W. Xie P. Liu P. Li H. Fan Y. Tang Y. Wang S. Lin Xing Huang In-situ derived defective Ru particles anchored on Ru–Ni layered double hydroxides for enhanced alkaline hydrogen evolution Small 20 2024 2311076 N. Shi, R. Ma, L. Lin, W. Xie, P. Liu, P. Li, H. Fan, Y. Tang, Y. Wang, S. Lin, Xing Huang, In-situ derived defective Ru particles anchored on Ru–Ni layered double hydroxides for enhanced alkaline hydrogen evolution, Small. 2024, 20, 2311076. [42] W. Peng F. Li S. Kong C. Guo H. Wu J. Wang Y. Shen X. Meng M. Zhang Recent advances in nickel-based catalysts in eCO2RR for carbon neutrality Carbon Ener 6 2024 498 W. Peng, F. Li, S. Kong, C. Guo, H. Wu, J. Wang, Y. Shen, X. Meng, M. Zhang, Recent advances in nickel-based catalysts in eCO2RR for carbon neutrality, Carbon Ener. 2024, 6, 498. [43] A. Muthurasu T.H. Ko T.W. Kim K. Chhetri H.Y. Kim Interfacial electronic modification of nickel phosphide via iron doping: an efficient bifunctional catalyst for water/seawater splitting Adv. Funct. Mater. 34 2024 2404254 A. Muthurasu, T.H. Ko, T.W. Kim, K. Chhetri, H.Y. Kim, Interfacial electronic modification of nickel phosphide via iron doping: an efficient bifunctional catalyst for water/seawater splitting, Adv. Funct. Mater. 2024, 34, 2404254. [44] G. Qian Y. Wang L. Li M. Lu C. Chen D. Min Z. Wei P. Tsiakaras Strategies for tuning tensile strain and localized electrons in a Mo-doped NiCoCu alloy for enhancing ampere-level current density HER performance Adv. Funct. Mater. 34 2024 2404055 G. Qian, Y. Wang, L. Li, M. Lu, C. Chen, D. Min, Z. Wei, P. Tsiakaras, Strategies for tuning tensile strain and localized electrons in a Mo-doped NiCoCu alloy for enhancing ampere-level current density HER performance, Adv. Funct. Mater. 2024, 34, 2404055. [45] J. Yu Y. Wang Y. Jing M.I. Asghar Y. Li Y. Zhang Q. Liu R. Li Wang P.D. Lund Improving electrocatalytic hydrogen evolution through Co and Ni single atom sites with synergistic effects anchored on carbon foam as a self-supporting electrode Chem. Eng. J. 484 2024 149406 J. Yu, Y. Wang, Y. Jing, M.I. Asghar, Y. Li, Y. Zhang, Q. Liu, R. Li, Wang, P.D. Lund, Improving electrocatalytic hydrogen evolution through Co and Ni single atom sites with synergistic effects anchored on carbon foam as a self-supporting electrode, Chem. Eng. J. 2024, 484, 149406. [46] V. Vermaak H.C.M. Vosloo A.J. Swarts The development and application of homogeneous nickel catalysts for transfer hydrogenation and related reactions Coord. Chem. Rev. 507 2024 215716 V. Vermaak, H.C.M. Vosloo, A.J. Swarts, The development and application of homogeneous nickel catalysts for transfer hydrogenation and related reactions, Coord. Chem. Rev. 2024, 507, 215716. [47] Y.H. Liu X.G. Ma H.S. Huang G.W. Deng J.X. Wang X.J. Chen T.T. Gao Ammonia-assisted Ni particle preferential deposition in Ni-Fe pyrophosphates on iron foam to improve the catalytic performance for overall water splitting J Colloid Interface Sci 665 2024 573 581 Y.H. Liu, X.G. Ma, H.S. Huang, G.W. Deng, J.X. Wang, X.J. Chen, T.T. Gao, Ammonia-assisted Ni particle preferential deposition in Ni-Fe pyrophosphates on iron foam to improve the catalytic performance for overall water splitting. J Colloid Interface Sci 665 (2024) 573–581. [48] Z. Wu X. Kang S. Wang Y. Song F. Xie J.Yang X.Duan Co-catalytic metal-support interactions design on single-atom alloy for boosted electro-reduction of nitrate to nitrogen Adv. Funct. Mater. 34 2024 2406917 Z. Wu, X. Kang, S. Wang, Y. Song, F. Xie, X.Duan, J.Yang, Co-catalytic metal-support interactions design on single-atom alloy for boosted electro-reduction of nitrate to nitrogen, Adv. Funct. Mater. 2024, 34, 2406917. [49] D. Liu A. Barbar T. Najam M.S. Javed J. Shen P. Tsiakaras X. Cai Single noble metal atoms doped 2D materials for catalysis Appl Catal B-Environ 297 2024 120389 D. Liu, A. Barbar, T. Najam, M.S. Javed, J. Shen, P. Tsiakaras, X. Cai, Single noble metal atoms doped 2D materials for catalysis, Appl Catal B-Environ. 2024, 297, 120389. [50] E.F. -Villanueva P.G. Lustemberg M. Zhao J.S. Rodriguez P. Concepción M.V. G.-Pirovano Water and Cu+ synergy in selective CO2 hydrogenation to methanol over Cu-MgO-Al2O3 catalysts J. Am. Chem. Soc. 146 2024 2024 2032 E.F. -Villanueva, P.G. Lustemberg, M. Zhao, J.S. Rodriguez, P. Concepción, M.V. G.-Pirovano, Water and Cu+ synergy in selective CO2 hydrogenation to methanol over Cu-MgO-Al2O3 catalysts, J. Am. Chem. Soc. 2024, 146, 2024–2032. [51] X. Li Z.Y. Niu M. Niu J. Wang D. Cao X. Zeng Single atom Ru doped Ni2P/Fe3P heterostructure for boosting hydrogen evolution for water splitting Small 4 2024 2311335 X. Li, Z.Y. Niu, M. Niu, J. Wang, D. Cao, X. Zeng, Single atom Ru doped Ni2P/Fe3P heterostructure for boosting hydrogen evolution for water splitting, Small. 2024, 4, 2311335. [52] H. Wang K. Xie Q. Fang L. Zheng X. Yang L. Ling Y. Wen L. Lin X. Yang W.g Gu C. He C. Zhu Ni2P aerogels with Pt single-atom doping tune competitive adsorption for boosted methanol electrooxidation ACS Mater. Lett. 6 2024 2446 2454 H. Wang, K. Xie, Q. Fang, L. Zheng, X. Yang, L. Ling, Y. Wen, L. Lin, X. Yang, W.g Gu, C. He, C. Zhu, Ni2P aerogels with Pt single-atom doping tune competitive adsorption for boosted methanol electrooxidation, ACS Mater. Lett. 2024, 6, 2446–2454. [53] J. Maeng D. Jang J. Ha J. Ji J. Heo Y. Park S. Kim W.B. Kim Oxygen vacancy-controlled CuOx/N,Se Co-doped porous carbon via plasma-treatment for enhanced electro-reduction of nitrate to green ammonia Small 20 2024 2403253 J. Maeng, D. Jang, J. Ha, J. Ji, J. Heo, Y. Park, S. Kim, W.B. Kim, Oxygen vacancy-controlled CuOx/N,Se Co-doped porous carbon via plasma-treatment for enhanced electro-reduction of nitrate to green ammonia, Small. 2024, 20, 2403253. [54] D. Li Z. Wang S. Jin M. Zhu Oxidation–Reduction treatment initiated In situ redispersion of the supported Cu/Al2O3 catalyst Chem & Bio Engineering 20 2024 2403170 D. Li, Z. Wang, S. Jin, M. Zhu, Oxidation–Reduction treatment initiated In situ redispersion of the supported Cu/Al2O3 catalyst, Chem & Bio Engineering. 2024, 20, 2403170. [55] H. Wang C. Zhang D. Zhang L. Jiang Y. Gao T. Zhuang Z. Lv I single-atom doped P-rich CoPn nanocluster@CoP with enhanced HER Small. 20 2024 2403170 H. Wang, C. Zhang, D. Zhang, L. Jiang, Y. Gao, T. Zhuang, Z. Lv, I single-atom doped P-rich CoPn nanocluster@CoP with enhanced HER, Small. 2024, 20, 2403170. [56] D. Pan S. Deng L. Chen Z. Tian A new model of carbon nitride as a substrate to support single metal atom J. Phys. Chem. C. 36 2024 2311149 D. Pan, S. Deng, L. Chen, Z. Tian, A new model of carbon nitride as a substrate to support single metal atom, J. Phys. Chem. C. 2024, 36, 2311149. [57] Z. Guo P. Zhou L. Jiang S. Liu Y. Yang Z. Li P. Wu Z. Zhang H. Li Electron localization-triggered proton pumping toward Cu single atoms for electrochemical CO2 methanation of unprecedented selectivity Adv. Mater. 128 2024 7106 7114 Z. Guo, P. Zhou, L. Jiang, S. Liu, Y. Yang, Z. Li, P. Wu, Z. Zhang, H. Li, Electron localization-triggered proton pumping toward Cu single atoms for electrochemical CO2 methanation of unprecedented selectivity, Adv. Mater. 2024, 128, 7106–7114. [58] Y.-C. Zhang M. Zhao J. Wu Y. Wang L. Zheng F. Gu J.-J. Zou J. Gao X.-D. Zhu Construction of Pt single-atom and cluster/FeOOH synergistic active sites for efficient electrocatalytic hydrogen evolution reaction ACS Catal 2024 7867 7876 Y.-C. Zhang, M. Zhao, J. Wu, Y. Wang, L. Zheng, F. Gu, J.-J. Zou, J. Gao, X.-D. Zhu, Construction of Pt single-atom and cluster/FeOOH synergistic active sites for efficient electrocatalytic hydrogen evolution reaction, ACS Catal. 2024, 7867–7876. [59] L. Yang C. Wang Y. Li W. Ge L. Tang J. Shen Y. Zhu C. Li Frustrated Lewis pairs on Zr single atoms supported N-doped TiO2-x catalysts for electrochemical nitrate reduction to Ammonia Adv. Funct. Mater. 34 2024 2401094 L. Yang, C. Wang, Y. Li, W. Ge, L. Tang, J. Shen, Y. Zhu, C. Li, Frustrated Lewis pairs on Zr single atoms supported N-doped TiO2-x catalysts for electrochemical nitrate reduction to Ammonia, Adv. Funct. Mater. 2024, 34, 2401094. [60] Z. Zhu T. Yan H. Tian J. Lai C. Wang C. Chen M. Luo Epitaxial growth of pType Cu-doped Ga2O3 nanoarrays on MgO substrates Cryst Growth Des 24 2024 4443 4450 Z. Zhu, T. Yan, H. Tian, J. Lai, C. Wang, C. Chen, M. Luo, Epitaxial growth of pType Cu-doped Ga2O3 nanoarrays on MgO substrates, Cryst Growth Des. 2024, 24, 4443–4450. [61] D. Duan J. Huo J. Chen B. Chi Z. Chen S. Sun Y. Zhao H. Zhao Z. Cui S. Liao Hf and Co dual single atoms Co-doped carbon catalyst enhance the oxygen reduction performance Small 19 2024 2310491 D. Duan, J. Huo, J. Chen, B. Chi, Z. Chen, S. Sun, Y. Zhao, H. Zhao, Z. Cui, S. Liao, Hf and Co dual single atoms Co-doped carbon catalyst enhance the oxygen reduction performance, Small. 2024, 19, 2310491. [62] J. Jiang G. Wu M. Sun Y. Liu Y. Yang A. Du L. Dai X. Mao Q. Qin Cu–Mo dual sites in Cu-doped MoSe2 for enhanced electrosynthesis of urea ACS Nano 18 2024 13745 13754 J. Jiang, G. Wu, M. Sun, Y. Liu, Y. Yang, A. Du, L. Dai, X. Mao, Q. Qin, Cu–Mo dual sites in Cu-doped MoSe2 for enhanced electrosynthesis of urea. ACS Nano. 2024, 18, 13745–13754. [63] Z. Li Y. Wu H. Wang Z. Wu X. Wu High-efficiency electrocatalytic reduction of N2O with single-atom Cu supported on nitrogen-doped carbon Environ. Sci. Technol. 58 2024 8976 8987 Z. Li, Y. Wu, H. Wang, Z. Wu, X. Wu High-efficiency electrocatalytic reduction of N2O with single-atom Cu supported on nitrogen-doped carbon, Environ. Sci. Technol. 2024, 58, 8976–8987. [64] Y. Zhu M. Klingenhof C. Gao1 T. Koketsu G. Weiser Y. Pi S. Liu L. Sui J. Hou J. Li H. Jiang L. Xu W.-H. Huang C.-W. Pao M. Yang Z. Hu P. Strasser J. Ma Facilitating alkaline hydrogen evolution reaction on the hetero-interfaced Ru/RuO2 through Pt single atoms doping Nat. Commun. 15 2024 1447 Y. Zhu, M. Klingenhof, C. Gao1, T. Koketsu, G. Weiser, Y. Pi, S. Liu, L. Sui, J. Hou, J. Li, H. Jiang, L. Xu, W.-H. Huang, C.-W. Pao, M. Yang, Z. Hu, P. Strasser, J. Ma, Facilitating alkaline hydrogen evolution reaction on the hetero-interfaced Ru/RuO2 through Pt single atoms doping, Nat. Commun. 2024, 15, 1447. [65] X. Liu C. Zhen J. Wu X. You Y. Wu Q. Hao G. Yu M.D. Gu K. Liu J. Lu Modulating the hydrogenation mechanism of electrochemical CO2 reduction using ruthenium atomic species on bismuth Adv. Funct. Mater. 34 2024 2405835 X. Liu, C. Zhen, J. Wu, X. You, Y. Wu, Q. Hao, G. Yu, M.D. Gu, K. Liu, J. Lu, Modulating the hydrogenation mechanism of electrochemical CO2 reduction using ruthenium atomic species on bismuth, Adv. Funct. Mater. 2024, 34, 2405835. [66] B. Zhang J. Wang G. Liu C.M. Weiss D. Liu Y. Chen L. Xia P. Zhou M. Gao Y. Liu J. Chen Y. Yan M. Shao H. Pan W. Sun A strongly coupled Ru-CrOx cluster-cluster heterostructure for efficient alkaline hydrogen electrocatalysis Nat. Catal. 7 2024 441 451 Zhang, B.; Wang, J.; Liu, G.; Weiss, C.M.; Liu, D.; Chen, Y.; Xia, L.; Zhou, P.; Gao, M.; Liu, Y.; Chen, J.; Yan, Y.; Shao, M.; Pan, H.; Sun, W.; A strongly coupled Ru-CrOx cluster-cluster heterostructure for efficient alkaline hydrogen electrocatalysis. Nat. Catal. 2024, 7, 441–451. [67] M. Qin J. Chen M. Qi H. Wang S. Mao L. Xi Y. Wang Constructing heteronuclear bridging atoms toward bifunctional electrocatalysis ACS Catal 14 2024 8414 8426 Qin, M.; Chen, J.; Qi, M.; Wang, H.; Mao, S.; Xi, L.; Wang, Y. Constructing heteronuclear bridging atoms toward bifunctional electrocatalysis. ACS Catal. 2024, 14, 8414–8426. [68] I.U. Islam Y. Zhang B. Dong A. Iqbal S. Abbas J. Zai S.S.A. Shah X. Qian Highly selective electroreduction of nitrobenzene to aniline by CoDoped 1T-MoS2 ACS Appl. Mater. Interfaces 16 2024 25090 25100 Islam, I.U.; Zhang, Y.; Dong, B.; Iqbal, A.; Abbas, S.; Zai, J.; Shah, S.S.A.; Qian, X. Highly selective electroreduction of nitrobenzene to aniline by CoDoped 1T-MoS2. ACS Appl. Mater. Interfaces 2024, 16, 25090–25100 [69] X. Yu K. Huang Y. Zhang Y. Jin Y. Chen F. Chen X. Zhang Photodynamically functionalized CoP/MoS2 nanocomposites with antibacterial activity ACS Appl. Nano Mater 7 2024 3260 3268 Yu, X.; Huang, K.; Zhang, Y.; Jin, Y.; Chen, Y.; Chen, F.; Zhang, X. Photodynamically functionalized CoP/MoS2 nanocomposites with antibacterial activity. ACS Appl. Nano Mater 2024, 7, 3260–3268.",
      "scopus-id": "105009255778",
      "coredata": {
        "eid": "1-s2.0-S2468823125005012",
        "dc:description": "Hydrogen evolution reaction (HER) is a key step in the production of hydrogen (H2) by overall water splitting, which is of great significance for the storage and conversion of renewable energy. Nevertheless, the elevated excess potential and insufficient stability of catalysts constrain their industrial applicability. Due to the poor catalytic activity of NiWO4 in alkaline solution, this study investigated the effect of IB metal (IB=Au, Ag, Cu) ion doping and its interaction with different concentrations of IBx/NiWO4 (X = 1,2,3,4 mmol) on catalytic activity to achieve stable H2 in alkaline media. In 1.0 M KOH solution, the current density is 10 mA cm−2, the Au3/NiWO4 exhibits a low overpotential is 86.11 mV, the slope of Tafel is 115.16 mV dec−1, and the overpotential of Ag3/NiWO4 is 168.41 mV, with a Tafel slope of 64.32 mV dec−1, the catalyst also showed long term stability for 150 h, the Au3/NiWO4 NF‖Au3/NiWO4 NF catalysts achieved a low voltage of 1.45 V at 10 mA cm−2 current density for 100 h. The synergistic interactions of bimetals present a novel approach for enhancing catalyst design and optimizing performance.",
        "openArchiveArticle": "false",
        "prism:coverDate": "2025-09-30",
        "openaccessUserLicense": null,
        "prism:aggregationType": "Journal",
        "prism:url": "https://api.elsevier.com/content/article/pii/S2468823125005012",
        "dc:creator": [
          {
            "@_fa": "true",
            "$": "Yang, Min"
          },
          {
            "@_fa": "true",
            "$": "Sheng, Shuang"
          },
          {
            "@_fa": "true",
            "$": "Wan, Ziyi"
          },
          {
            "@_fa": "true",
            "$": "Xu, Yaoyao"
          },
          {
            "@_fa": "true",
            "$": "Qi, Rui"
          },
          {
            "@_fa": "true",
            "$": "Luo, Xiaofeng"
          },
          {
            "@_fa": "true",
            "$": "Pan, Weiyu"
          },
          {
            "@_fa": "true",
            "$": "Yang, Kunshan"
          },
          {
            "@_fa": "true",
            "$": "Zhang, Ziqing"
          },
          {
            "@_fa": "true",
            "$": "Deng, Guowei"
          }
        ],
        "link": [
          {
            "@_fa": "true",
            "@rel": "self",
            "@href": "https://api.elsevier.com/content/article/pii/S2468823125005012"
          },
          {
            "@_fa": "true",
            "@rel": "scidir",
            "@href": "https://www.sciencedirect.com/science/article/pii/S2468823125005012"
          }
        ],
        "dc:format": "application/json",
        "openaccessType": null,
        "pii": "S2468-8231(25)00501-2",
        "prism:volume": "584",
        "articleNumber": "115313",
        "prism:publisher": "Elsevier B.V. All rights are reserved, including those for text and data mining, AI training, and similar technologies.",
        "dc:title": "Au, Ag, Cu induced electron transfer to achieve ultra-long-range stability for catalytic alkaline bulk water splitting",
        "prism:copyright": "© 2025 Elsevier B.V. All rights are reserved, including those for text and data mining, AI training, and similar technologies.",
        "openaccess": "0",
        "prism:issn": "24688231",
        "dcterms:subject": [
          {
            "@_fa": "true",
            "$": "Interface engineering"
          },
          {
            "@_fa": "true",
            "$": "Regulation of electronic structures"
          },
          {
            "@_fa": "true",
            "$": "Overall water splitting"
          }
        ],
        "openaccessArticle": "false",
        "prism:publicationName": "Molecular Catalysis",
        "openaccessSponsorType": null,
        "prism:pageRange": "115313",
        "pubType": "fla",
        "prism:coverDisplayDate": "September 2025",
        "prism:doi": "10.1016/j.mcat.2025.115313",
        "prism:startingPage": "115313",
        "dc:identifier": "doi:10.1016/j.mcat.2025.115313",
        "openaccessSponsorName": null
      },
      "objects": {
        "object": [
          {
            "@category": "standard",
            "@height": "259",
            "@width": "678",
            "@_fa": "true",
            "$": "https://api.elsevier.com/content/object/eid/1-s2.0-S2468823125005012-gr7.jpg?httpAccept=%2A%2F%2A",
            "@multimediatype": "JPEG image file",
            "@type": "IMAGE-DOWNSAMPLED",
            "@size": "52079",
            "@ref": "gr7",
            "@mimetype": "image/jpeg"
          },
          {
            "@category": "standard",
            "@height": "154",
            "@width": "376",
            "@_fa": "true",
            "$": "https://api.elsevier.com/content/object/eid/1-s2.0-S2468823125005012-gr8.jpg?httpAccept=%2A%2F%2A",
            "@multimediatype": "JPEG image file",
            "@type": "IMAGE-DOWNSAMPLED",
            "@size": "18746",
            "@ref": "gr8",
            "@mimetype": "image/jpeg"
          },
          {
            "@category": "standard",
            "@height": "280",
            "@width": "678",
            "@_fa": "true",
            "$": "https://api.elsevier.com/content/object/eid/1-s2.0-S2468823125005012-sc1.jpg?httpAccept=%2A%2F%2A",
            "@multimediatype": "JPEG image file",
            "@type": "IMAGE-DOWNSAMPLED",
            "@size": "54826",
            "@ref": "sc1",
            "@mimetype": "image/jpeg"
          },
          {
            "@category": "standard",
            "@height": "829",
            "@width": "753",
            "@_fa": "true",
            "$": "https://api.elsevier.com/content/object/eid/1-s2.0-S2468823125005012-gr1.jpg?httpAccept=%2A%2F%2A",
            "@multimediatype": "JPEG image file",
            "@type": "IMAGE-DOWNSAMPLED",
            "@size": "257699",
            "@ref": "gr1",
            "@mimetype": "image/jpeg"
          },
          {
            "@category": "standard",
            "@height": "946",
            "@width": "753",
            "@_fa": "true",
            "$": "https://api.elsevier.com/content/object/eid/1-s2.0-S2468823125005012-gr2.jpg?httpAccept=%2A%2F%2A",
            "@multimediatype": "JPEG image file",
            "@type": "IMAGE-DOWNSAMPLED",
            "@size": "198963",
            "@ref": "gr2",
            "@mimetype": "image/jpeg"
          },
          {
            "@category": "standard",
            "@height": "245",
            "@width": "245",
            "@_fa": "true",
            "$": "https://api.elsevier.com/content/object/eid/1-s2.0-S2468823125005012-ga1.jpg?httpAccept=%2A%2F%2A",
            "@multimediatype": "JPEG image file",
            "@type": "IMAGE-DOWNSAMPLED",
            "@size": "36606",
            "@ref": "ga1",
            "@mimetype": "image/jpeg"
          },
          {
            "@category": "standard",
            "@height": "767",
            "@width": "602",
            "@_fa": "true",
            "$": "https://api.elsevier.com/content/object/eid/1-s2.0-S2468823125005012-gr5.jpg?httpAccept=%2A%2F%2A",
            "@multimediatype": "JPEG image file",
            "@type": "IMAGE-DOWNSAMPLED",
            "@size": "124954",
            "@ref": "gr5",
            "@mimetype": "image/jpeg"
          },
          {
            "@category": "standard",
            "@height": "765",
            "@width": "602",
            "@_fa": "true",
            "$": "https://api.elsevier.com/content/object/eid/1-s2.0-S2468823125005012-gr6.jpg?httpAccept=%2A%2F%2A",
            "@multimediatype": "JPEG image file",
            "@type": "IMAGE-DOWNSAMPLED",
            "@size": "166603",
            "@ref": "gr6",
            "@mimetype": "image/jpeg"
          },
          {
            "@category": "standard",
            "@height": "672",
            "@width": "753",
            "@_fa": "true",
            "$": "https://api.elsevier.com/content/object/eid/1-s2.0-S2468823125005012-gr3.jpg?httpAccept=%2A%2F%2A",
            "@multimediatype": "JPEG image file",
            "@type": "IMAGE-DOWNSAMPLED",
            "@size": "155579",
            "@ref": "gr3",
            "@mimetype": "image/jpeg"
          },
          {
            "@category": "standard",
            "@height": "676",
            "@width": "753",
            "@_fa": "true",
            "$": "https://api.elsevier.com/content/object/eid/1-s2.0-S2468823125005012-gr4.jpg?httpAccept=%2A%2F%2A",
            "@multimediatype": "JPEG image file",
            "@type": "IMAGE-DOWNSAMPLED",
            "@size": "155559",
            "@ref": "gr4",
            "@mimetype": "image/jpeg"
          },
          {
            "@category": "thumbnail",
            "@height": "84",
            "@width": "219",
            "@_fa": "true",
            "$": "https://api.elsevier.com/content/object/eid/1-s2.0-S2468823125005012-gr7.sml?httpAccept=%2A%2F%2A",
            "@multimediatype": "GIF image file",
            "@type": "IMAGE-THUMBNAIL",
            "@size": "9721",
            "@ref": "gr7",
            "@mimetype": "image/gif"
          },
          {
            "@category": "thumbnail",
            "@height": "89",
            "@width": "219",
            "@_fa": "true",
            "$": "https://api.elsevier.com/content/object/eid/1-s2.0-S2468823125005012-gr8.sml?httpAccept=%2A%2F%2A",
            "@multimediatype": "GIF image file",
            "@type": "IMAGE-THUMBNAIL",
            "@size": "7870",
            "@ref": "gr8",
            "@mimetype": "image/gif"
          },
          {
            "@category": "thumbnail",
            "@height": "90",
            "@width": "219",
            "@_fa": "true",
            "$": "https://api.elsevier.com/content/object/eid/1-s2.0-S2468823125005012-sc1.sml?httpAccept=%2A%2F%2A",
            "@multimediatype": "GIF image file",
            "@type": "IMAGE-THUMBNAIL",
            "@size": "10383",
            "@ref": "sc1",
            "@mimetype": "image/gif"
          },
          {
            "@category": "thumbnail",
            "@height": "164",
            "@width": "149",
            "@_fa": "true",
            "$": "https://api.elsevier.com/content/object/eid/1-s2.0-S2468823125005012-gr1.sml?httpAccept=%2A%2F%2A",
            "@multimediatype": "GIF image file",
            "@type": "IMAGE-THUMBNAIL",
            "@size": "20939",
            "@ref": "gr1",
            "@mimetype": "image/gif"
          },
          {
            "@category": "thumbnail",
            "@height": "163",
            "@width": "130",
            "@_fa": "true",
            "$": "https://api.elsevier.com/content/object/eid/1-s2.0-S2468823125005012-gr2.sml?httpAccept=%2A%2F%2A",
            "@multimediatype": "GIF image file",
            "@type": "IMAGE-THUMBNAIL",
            "@size": "12107",
            "@ref": "gr2",
            "@mimetype": "image/gif"
          },
          {
            "@category": "thumbnail",
            "@height": "164",
            "@width": "164",
            "@_fa": "true",
            "$": "https://api.elsevier.com/content/object/eid/1-s2.0-S2468823125005012-ga1.sml?httpAccept=%2A%2F%2A",
            "@multimediatype": "GIF image file",
            "@type": "IMAGE-THUMBNAIL",
            "@size": "26064",
            "@ref": "ga1",
            "@mimetype": "image/gif"
          },
          {
            "@category": "thumbnail",
            "@height": "163",
            "@width": "128",
            "@_fa": "true",
            "$": "https://api.elsevier.com/content/object/eid/1-s2.0-S2468823125005012-gr5.sml?httpAccept=%2A%2F%2A",
            "@multimediatype": "GIF image file",
            "@type": "IMAGE-THUMBNAIL",
            "@size": "10604",
            "@ref": "gr5",
            "@mimetype": "image/gif"
          },
          {
            "@category": "thumbnail",
            "@height": "164",
            "@width": "129",
            "@_fa": "true",
            "$": "https://api.elsevier.com/content/object/eid/1-s2.0-S2468823125005012-gr6.sml?httpAccept=%2A%2F%2A",
            "@multimediatype": "GIF image file",
            "@type": "IMAGE-THUMBNAIL",
            "@size": "14813",
            "@ref": "gr6",
            "@mimetype": "image/gif"
          },
          {
            "@category": "thumbnail",
            "@height": "164",
            "@width": "184",
            "@_fa": "true",
            "$": "https://api.elsevier.com/content/object/eid/1-s2.0-S2468823125005012-gr3.sml?httpAccept=%2A%2F%2A",
            "@multimediatype": "GIF image file",
            "@type": "IMAGE-THUMBNAIL",
            "@size": "13756",
            "@ref": "gr3",
            "@mimetype": "image/gif"
          },
          {
            "@category": "thumbnail",
            "@height": "164",
            "@width": "183",
            "@_fa": "true",
            "$": "https://api.elsevier.com/content/object/eid/1-s2.0-S2468823125005012-gr4.sml?httpAccept=%2A%2F%2A",
            "@multimediatype": "GIF image file",
            "@type": "IMAGE-THUMBNAIL",
            "@size": "13594",
            "@ref": "gr4",
            "@mimetype": "image/gif"
          },
          {
            "@category": "high",
            "@height": "1144",
            "@width": "3000",
            "@_fa": "true",
            "$": "https://api.elsevier.com/content/object/eid/1-s2.0-S2468823125005012-gr7_lrg.jpg?httpAccept=%2A%2F%2A",
            "@multimediatype": "JPEG image file",
            "@type": "IMAGE-HIGH-RES",
            "@size": "401695",
            "@ref": "gr7",
            "@mimetype": "image/jpeg"
          },
          {
            "@category": "high",
            "@height": "681",
            "@width": "1667",
            "@_fa": "true",
            "$": "https://api.elsevier.com/content/object/eid/1-s2.0-S2468823125005012-gr8_lrg.jpg?httpAccept=%2A%2F%2A",
            "@multimediatype": "JPEG image file",
            "@type": "IMAGE-HIGH-RES",
            "@size": "111612",
            "@ref": "gr8",
            "@mimetype": "image/jpeg"
          },
          {
            "@category": "high",
            "@height": "1238",
            "@width": "3000",
            "@_fa": "true",
            "$": "https://api.elsevier.com/content/object/eid/1-s2.0-S2468823125005012-sc1_lrg.jpg?httpAccept=%2A%2F%2A",
            "@multimediatype": "JPEG image file",
            "@type": "IMAGE-HIGH-RES",
            "@size": "421699",
            "@ref": "sc1",
            "@mimetype": "image/jpeg"
          },
          {
            "@category": "high",
            "@height": "3670",
            "@width": "3333",
            "@_fa": "true",
            "$": "https://api.elsevier.com/content/object/eid/1-s2.0-S2468823125005012-gr1_lrg.jpg?httpAccept=%2A%2F%2A",
            "@multimediatype": "JPEG image file",
            "@type": "IMAGE-HIGH-RES",
            "@size": "2231666",
            "@ref": "gr1",
            "@mimetype": "image/jpeg"
          },
          {
            "@category": "high",
            "@height": "4187",
            "@width": "3333",
            "@_fa": "true",
            "$": "https://api.elsevier.com/content/object/eid/1-s2.0-S2468823125005012-gr2_lrg.jpg?httpAccept=%2A%2F%2A",
            "@multimediatype": "JPEG image file",
            "@type": "IMAGE-HIGH-RES",
            "@size": "1279235",
            "@ref": "gr2",
            "@mimetype": "image/jpeg"
          },
          {
            "@category": "high",
            "@height": "1085",
            "@width": "1085",
            "@_fa": "true",
            "$": "https://api.elsevier.com/content/object/eid/1-s2.0-S2468823125005012-ga1_lrg.jpg?httpAccept=%2A%2F%2A",
            "@multimediatype": "JPEG image file",
            "@type": "IMAGE-HIGH-RES",
            "@size": "446160",
            "@ref": "ga1",
            "@mimetype": "image/jpeg"
          },
          {
            "@category": "high",
            "@height": "3397",
            "@width": "2667",
            "@_fa": "true",
            "$": "https://api.elsevier.com/content/object/eid/1-s2.0-S2468823125005012-gr5_lrg.jpg?httpAccept=%2A%2F%2A",
            "@multimediatype": "JPEG image file",
            "@type": "IMAGE-HIGH-RES",
            "@size": "976228",
            "@ref": "gr5",
            "@mimetype": "image/jpeg"
          },
          {
            "@category": "high",
            "@height": "3387",
            "@width": "2667",
            "@_fa": "true",
            "$": "https://api.elsevier.com/content/object/eid/1-s2.0-S2468823125005012-gr6_lrg.jpg?httpAccept=%2A%2F%2A",
            "@multimediatype": "JPEG image file",
            "@type": "IMAGE-HIGH-RES",
            "@size": "1331292",
            "@ref": "gr6",
            "@mimetype": "image/jpeg"
          },
          {
            "@category": "high",
            "@height": "2975",
            "@width": "3333",
            "@_fa": "true",
            "$": "https://api.elsevier.com/content/object/eid/1-s2.0-S2468823125005012-gr3_lrg.jpg?httpAccept=%2A%2F%2A",
            "@multimediatype": "JPEG image file",
            "@type": "IMAGE-HIGH-RES",
            "@size": "996374",
            "@ref": "gr3",
            "@mimetype": "image/jpeg"
          },
          {
            "@category": "high",
            "@height": "2990",
            "@width": "3333",
            "@_fa": "true",
            "$": "https://api.elsevier.com/content/object/eid/1-s2.0-S2468823125005012-gr4_lrg.jpg?httpAccept=%2A%2F%2A",
            "@multimediatype": "JPEG image file",
            "@type": "IMAGE-HIGH-RES",
            "@size": "993795",
            "@ref": "gr4",
            "@mimetype": "image/jpeg"
          },
          {
            "@category": "standard",
            "@_fa": "true",
            "$": "https://api.elsevier.com/content/object/eid/1-s2.0-S2468823125005012-mmc1.docx?httpAccept=%2A%2F%2A",
            "@multimediatype": "Microsoft Word file",
            "@type": "APPLICATION",
            "@size": "3517213",
            "@ref": "mmc1",
            "@mimetype": "application/word"
          },
          {
            "@category": "standard",
            "@_fa": "true",
            "$": "https://api.elsevier.com/content/object/eid/1-s2.0-S2468823125005012-mmc2.mp4?httpAccept=%2A%2F%2A",
            "@multimediatype": "MPEG-4 movie",
            "@type": "VIDEO",
            "@size": "2638660",
            "@ref": "mmc2",
            "@mimetype": "video/mp4"
          },
          {
            "@category": "thumbnail",
            "@_fa": "true",
            "$": "https://api.elsevier.com/content/object/eid/1-s2.0-S2468823125005012-si1.svg?httpAccept=%2A%2F%2A",
            "@multimediatype": "Scalable Vector Graphics file",
            "@type": "ALTIMG",
            "@size": "5729",
            "@ref": "si1",
            "@mimetype": "image/svg+xml"
          },
          {
            "@category": "thumbnail",
            "@_fa": "true",
            "$": "https://api.elsevier.com/content/object/eid/1-s2.0-S2468823125005012-si2.svg?httpAccept=%2A%2F%2A",
            "@multimediatype": "Scalable Vector Graphics file",
            "@type": "ALTIMG",
            "@size": "6654",
            "@ref": "si2",
            "@mimetype": "image/svg+xml"
          },
          {
            "@category": "thumbnail",
            "@_fa": "true",
            "$": "https://api.elsevier.com/content/object/eid/1-s2.0-S2468823125005012-si3.svg?httpAccept=%2A%2F%2A",
            "@multimediatype": "Scalable Vector Graphics file",
            "@type": "ALTIMG",
            "@size": "5984",
            "@ref": "si3",
            "@mimetype": "image/svg+xml"
          },
          {
            "@category": "thumbnail",
            "@_fa": "true",
            "$": "https://api.elsevier.com/content/object/eid/1-s2.0-S2468823125005012-si4.svg?httpAccept=%2A%2F%2A",
            "@multimediatype": "Scalable Vector Graphics file",
            "@type": "ALTIMG",
            "@size": "6760",
            "@ref": "si4",
            "@mimetype": "image/svg+xml"
          },
          {
            "@category": "thumbnail",
            "@_fa": "true",
            "$": "https://api.elsevier.com/content/object/eid/1-s2.0-S2468823125005012-si5.svg?httpAccept=%2A%2F%2A",
            "@multimediatype": "Scalable Vector Graphics file",
            "@type": "ALTIMG",
            "@size": "17244",
            "@ref": "si5",
            "@mimetype": "image/svg+xml"
          },
          {
            "@category": "thumbnail",
            "@_fa": "true",
            "$": "https://api.elsevier.com/content/object/eid/1-s2.0-S2468823125005012-si6.svg?httpAccept=%2A%2F%2A",
            "@multimediatype": "Scalable Vector Graphics file",
            "@type": "ALTIMG",
            "@size": "7071",
            "@ref": "si6",
            "@mimetype": "image/svg+xml"
          },
          {
            "@category": "thumbnail",
            "@_fa": "true",
            "$": "https://api.elsevier.com/content/object/eid/1-s2.0-S2468823125005012-si7.svg?httpAccept=%2A%2F%2A",
            "@multimediatype": "Scalable Vector Graphics file",
            "@type": "ALTIMG",
            "@size": "2775",
            "@ref": "si7",
            "@mimetype": "image/svg+xml"
          },
          {
            "@category": "thumbnail",
            "@_fa": "true",
            "$": "https://api.elsevier.com/content/object/eid/1-s2.0-S2468823125005012-si8.svg?httpAccept=%2A%2F%2A",
            "@multimediatype": "Scalable Vector Graphics file",
            "@type": "ALTIMG",
            "@size": "5257",
            "@ref": "si8",
            "@mimetype": "image/svg+xml"
          },
          {
            "@category": "thumbnail",
            "@_fa": "true",
            "$": "https://api.elsevier.com/content/object/eid/1-s2.0-S2468823125005012-si9.svg?httpAccept=%2A%2F%2A",
            "@multimediatype": "Scalable Vector Graphics file",
            "@type": "ALTIMG",
            "@size": "4358",
            "@ref": "si9",
            "@mimetype": "image/svg+xml"
          }
        ]
      },
      "link": {
        "@rel": "abstract",
        "@href": "https://api.elsevier.com/content/abstract/scopus_id/105009255778"
      }
    }
  }
}