{
  "metadata": {
    "title": "Novel preparation method of bimetallic Ni-In alloy catalysts supported on amorphous alumina for the highly selective hydrogenation of furfural",
    "authors": "; ; ",
    "journal": "Molecular Catalysis",
    "date": "2018-02-28",
    "doi": "10.1016/j.mcat.2017.11.004",
    "abstract": "",
    "uri": "https://api.elsevier.com/content/article/pii/S2468823117305965",
    "pii": "S2468823117305965"
  },
  "fulltext": {
    "full-text-retrieval-response": {
      "scopus-eid": "2-s2.0-85039784404",
      "originalText": "serial JL 315758 291210 291744 291790 291809 31 Molecular Catalysis MOLECULARCATALYSIS 2017-11-10 2017-11-10 2017-11-10 2017-11-10 2019-02-28T03:55:43 1-s2.0-S2468823117305965 S2468-8231(17)30596-5 S2468823117305965 10.1016/j.mcat.2017.11.004 S300 S300.4 FULL-TEXT 1-s2.0-S2468823117X00199 2019-02-28T04:03:11.971949Z 0 0 20180201 20180228 2018 2017-11-10T19:06:12.388386Z absattachment articleinfo articletitlenorm authfirstsurnamenorm cid cids contenttype copyright crossmark dateloaded dateloadedtxt datesearch datesort dateupdated dco docsubtype doctype doi eid ewtransactionid hubeid indexeddate issn issnnorm itemstage itemtransactionid itemweight openaccess openarchive pg pgfirst pglast pii piinorm pubdateend pubdatestart pubdatetxt pubyr sectiontitle sortorder srctitle srctitlenorm srctype ssids alllist content subj subheadings suppl tomb volfirst volissue volumelist webpdf webpdfpagecount yearnav figure table e-component body mmlmath acknowledge affil appendices articletitle auth authfirstini authfull authkeywords authlast highlightsabst primabst pubtype ref specialabst 2468-8231 24688231 true 445 445 C Volume 445 8 52 60 52 60 201802 February 2018 2018-02-01 2018-02-28 2018 Regular Papers article fla © 2017 Elsevier B.V. All rights reserved. NOVELPREPARATIONMETHODBIMETALLICNIINALLOYCATALYSTSSUPPORTEDAMORPHOUSALUMINAFORHIGHLYSELECTIVEHYDROGENATIONFURFURAL RODIANSONO 1 Introduction 2 Experimental 2.1 Reagents 2.2 Catalyst synthesis 2.2.1 Synthesis of R-Ni/AlOH 2.2.2 Synthesis of Ni-In/AlOH 2.3 Catalyst characterization 2.4 Typical procedure for the selective hydrogenation of furfural 2.5 Product analysis 3 Results and discussion 3.1 Catalyst characterization 3.2 Catalytic reactions: furfural hydrogenation 3.2.1 Selection of the second metals 3.2.2 Effect of In loading amount 3.2.3 Effect of thermal treatment on Ni-In(2.0)/AlOH catalysts 3.2.4 Effect of temperature 3.2.5 Effect of initial H2 pressure 3.2.6 Kinetics 3.2.7 Re-usability test 4 Conclusions Acknowledgements Appendix A Supplementary data References FALBE 2005 21 J ULLMANNSENCYCLOPEDIAINDUSTRIALCHEMISTRY LANGE 2012 150 166 J MARISCAL 2016 1144 1189 R GALLEZOT 2012 1538 1558 P DUTTA 2012 2025 2036 S METKAR 2015 1453 1466 P ALONSO 2012 8075 8098 D PRITCHARD 2015 3808 3833 J BESSON 2014 1827 1870 M BREMNER 1947 1068 1080 J RODIANSONO 2012 2139 2145 RODIANSONO 2012 769 771 RODIANSONO 2014 53 59 HALILU 2016 2216 2226 A PUTRO 2017 149 151 W LI 2013 3888 3896 C SITTHISA 2011 90 101 S SHI 2015 2177 2183 D DELBECQ 1995 217 236 F DELBECQ 2003 115 126 F HLUKHYY 2008 3737 3744 V RODIANSONO 2015 192 200 RODIANSONO 2016 2955 2961 PETRO 2000 73 86 J LOWELL 2004 S CHARACTERIZATIONPOROUSSOLIDSPOWDERSSURFACEAREAPORESIZEDENSITYCHAPTER8 BARTHOLOMEW 1980 335 347 C BARTHOLOMEW 1980 390 401 C 1997 POWDERDIFFRACTIONFILESJCPDSINTERNATIONALCENTREFORDIFFRACTIONDATAICDD SWIFT 1968 5 14 H NIKOLLA 2007 85 93 E SUN 2016 191 201 R RUAN 2001 745 750 H RUAN 2002 265 272 H CAVA 2007 394 399 S RODIANSONO 2015 531 539 SORDELLI 1999 186 198 L MARGITFALVI 1998 246 249 J RODIANSONOX2018X52 RODIANSONOX2018X52X60 2019-11-10T00:00:00Z http://creativecommons.org/licenses/by-nc-nd/4.0/ © 2017 Elsevier B.V. All rights reserved. item S2468-8231(17)30596-5 S2468823117305965 1-s2.0-S2468823117305965 10.1016/j.mcat.2017.11.004 315758 2019-02-28T04:03:11.971949Z 2018-02-01 2018-02-28 1-s2.0-S2468823117305965-main.pdf https://s3.amazonaws.com/prod-ucs-content-store-us-east/content/pii:S2468823117305965/MAIN/application/pdf/f01b405239efbbb996b4966c70fb43d9/main.pdf main.pdf pdf true 1635359 MAIN 9 1-s2.0-S2468823117305965-main_1.png https://s3.amazonaws.com/prod-ucs-content-store-us-east/content/pii:S2468823117305965/PREVIEW/image/png/93fe488ed7d6463c61c3caddfd96f7f9/main_1.png main_1.png png 58761 849 656 IMAGE-WEB-PDF 1 1-s2.0-S2468823117305965-fx1.sml https://s3.amazonaws.com/prod-ucs-content-store-us-east/content/pii:S2468823117305965/fx1/THUMBNAIL/image/gif/2da905c4cfeae159fe52a8239496bc14/fx1.sml fx1 true fx1.sml sml 7893 88 219 IMAGE-THUMBNAIL 1-s2.0-S2468823117305965-gr1.sml https://s3.amazonaws.com/prod-ucs-content-store-us-east/content/pii:S2468823117305965/gr1/THUMBNAIL/image/gif/bc2c24b4a8122ffc8a2f77d199117551/gr1.sml gr1 gr1.sml sml 5928 164 143 IMAGE-THUMBNAIL 1-s2.0-S2468823117305965-gr2.sml https://s3.amazonaws.com/prod-ucs-content-store-us-east/content/pii:S2468823117305965/gr2/THUMBNAIL/image/gif/c2c1ceea7d7ce68e8680e2f36bca2495/gr2.sml gr2 gr2.sml sml 4103 164 72 IMAGE-THUMBNAIL 1-s2.0-S2468823117305965-gr3.sml https://s3.amazonaws.com/prod-ucs-content-store-us-east/content/pii:S2468823117305965/gr3/THUMBNAIL/image/gif/9bcebb953468e689ffedd30df42ccf6c/gr3.sml gr3 gr3.sml sml 6674 164 143 IMAGE-THUMBNAIL 1-s2.0-S2468823117305965-gr4.sml https://s3.amazonaws.com/prod-ucs-content-store-us-east/content/pii:S2468823117305965/gr4/THUMBNAIL/image/gif/a43ef4a97bdcfa6ab3af2aef3a41b4f6/gr4.sml gr4 gr4.sml sml 5474 164 141 IMAGE-THUMBNAIL 1-s2.0-S2468823117305965-gr5.sml https://s3.amazonaws.com/prod-ucs-content-store-us-east/content/pii:S2468823117305965/gr5/THUMBNAIL/image/gif/79c0aa27200bf7338a3487a54326161c/gr5.sml gr5 gr5.sml sml 5245 163 165 IMAGE-THUMBNAIL 1-s2.0-S2468823117305965-gr6.sml https://s3.amazonaws.com/prod-ucs-content-store-us-east/content/pii:S2468823117305965/gr6/THUMBNAIL/image/gif/01f64c8cedf30bcf0e0db4f865d84415/gr6.sml gr6 gr6.sml sml 5331 164 175 IMAGE-THUMBNAIL 1-s2.0-S2468823117305965-gr7.sml https://s3.amazonaws.com/prod-ucs-content-store-us-east/content/pii:S2468823117305965/gr7/THUMBNAIL/image/gif/d570b7c6085adf7f2b256d381e64dfe1/gr7.sml gr7 gr7.sml sml 4871 164 167 IMAGE-THUMBNAIL 1-s2.0-S2468823117305965-sc1.sml https://s3.amazonaws.com/prod-ucs-content-store-us-east/content/pii:S2468823117305965/sc1/THUMBNAIL/image/gif/36a04c5416890421f8105ce55c84b850/sc1.sml sc1 sc1.sml sml 4200 136 219 IMAGE-THUMBNAIL 1-s2.0-S2468823117305965-fx1.jpg https://s3.amazonaws.com/prod-ucs-content-store-us-east/content/pii:S2468823117305965/fx1/DOWNSAMPLED/image/jpeg/cdeeabb6c9736a82481ca27d3ea46fb2/fx1.jpg fx1 true fx1.jpg jpg 30397 200 500 IMAGE-DOWNSAMPLED 1-s2.0-S2468823117305965-gr1.jpg https://s3.amazonaws.com/prod-ucs-content-store-us-east/content/pii:S2468823117305965/gr1/DOWNSAMPLED/image/jpeg/9226141d7f9d84fe971030695ce6e129/gr1.jpg gr1 gr1.jpg jpg 34205 430 376 IMAGE-DOWNSAMPLED 1-s2.0-S2468823117305965-gr2.jpg https://s3.amazonaws.com/prod-ucs-content-store-us-east/content/pii:S2468823117305965/gr2/DOWNSAMPLED/image/jpeg/3a24a8429f0826fb7134978abc84351d/gr2.jpg gr2 gr2.jpg jpg 69053 856 376 IMAGE-DOWNSAMPLED 1-s2.0-S2468823117305965-gr3.jpg https://s3.amazonaws.com/prod-ucs-content-store-us-east/content/pii:S2468823117305965/gr3/DOWNSAMPLED/image/jpeg/f0b60e2744a216c36397cfc77bd01854/gr3.jpg gr3 gr3.jpg jpg 35156 431 376 IMAGE-DOWNSAMPLED 1-s2.0-S2468823117305965-gr4.jpg https://s3.amazonaws.com/prod-ucs-content-store-us-east/content/pii:S2468823117305965/gr4/DOWNSAMPLED/image/jpeg/3e065ee032c221c73c878d82b19b5ffe/gr4.jpg gr4 gr4.jpg jpg 32255 437 376 IMAGE-DOWNSAMPLED 1-s2.0-S2468823117305965-gr5.jpg https://s3.amazonaws.com/prod-ucs-content-store-us-east/content/pii:S2468823117305965/gr5/DOWNSAMPLED/image/jpeg/bbadeb013c8d780ced5eb7a23dfe5057/gr5.jpg gr5 gr5.jpg jpg 25314 372 376 IMAGE-DOWNSAMPLED 1-s2.0-S2468823117305965-gr6.jpg https://s3.amazonaws.com/prod-ucs-content-store-us-east/content/pii:S2468823117305965/gr6/DOWNSAMPLED/image/jpeg/c5a155daa3a3537dd44213ae72186677/gr6.jpg gr6 gr6.jpg jpg 23573 352 376 IMAGE-DOWNSAMPLED 1-s2.0-S2468823117305965-gr7.jpg https://s3.amazonaws.com/prod-ucs-content-store-us-east/content/pii:S2468823117305965/gr7/DOWNSAMPLED/image/jpeg/d0cf6710c1fcc114ce3b1b4c1bb60509/gr7.jpg gr7 gr7.jpg jpg 21788 370 376 IMAGE-DOWNSAMPLED 1-s2.0-S2468823117305965-sc1.jpg https://s3.amazonaws.com/prod-ucs-content-store-us-east/content/pii:S2468823117305965/sc1/DOWNSAMPLED/image/jpeg/2429f68526a55a4b575f31504142f9d2/sc1.jpg sc1 sc1.jpg jpg 20865 305 489 IMAGE-DOWNSAMPLED 1-s2.0-S2468823117305965-mmc1.docx https://s3.amazonaws.com/prod-ucs-content-store-us-east/content/pii:S2468823117305965/mmc1/MAIN/application/vnd.openxmlformats-officedocument.wordprocessingml.document/bbb06faaf83d6de4e499e4d43b56008c/mmc1.docx mmc1 mmc1.docx docx 2981408 APPLICATION 1-s2.0-S2468823117305965-si1.gif https://s3.amazonaws.com/prod-ucs-content-store-us-east/content/pii:S2468823117305965/STRIPIN/image/gif/ab147f9c6f2adfcb110ab47f3192eda1/si1.gif si1 si1.gif gif 1677 26 372 ALTIMG 1-s2.0-S2468823117305965-si2.gif https://s3.amazonaws.com/prod-ucs-content-store-us-east/content/pii:S2468823117305965/STRIPIN/image/gif/caf3f4c9aea3aa233b59313475accff2/si2.gif si2 si2.gif gif 1538 36 293 ALTIMG 1-s2.0-S2468823117305965-si3.gif https://s3.amazonaws.com/prod-ucs-content-store-us-east/content/pii:S2468823117305965/STRIPIN/image/gif/9f450b43e03ec3b14d12f8a4a50f5a7d/si3.gif si3 si3.gif gif 1446 35 262 ALTIMG MCAT 371 S2468-8231(17)30596-5 10.1016/j.mcat.2017.11.004 Elsevier B.V. Scheme 1 Reaction pathways of furfural hydrogenation over bimetallic Ni-In catalysts. Scheme 1 Fig. 1 XRD patterns of (a) R-Ni/AlOH and the as-prepared Ni-In(x)/AlOH (x =Ni/In molar ratio) at different Ni/In molar ratios of (b) 5.1, (c) 3.1, (d) 2.0, (e) 1.1, and (f) 0.8. (●) bayerite; (⊗) gibbsite; (#) In(OH)3; (▼) Ni(0); (*) Ni2In3. Fig. 1 Fig. 2 XRD patterns of the H2-treated Ni-In(x)/AA at a temperature of 673K for 1.5h and selected area at 2θ=40−50° for (a) 5.1, (b) 3.1, (c) 2.0, (d) 1.1, and (e) 0.8. (▼) Ni(0); (*) bimetallic Ni3In (#JCPDS-21-404). Fig. 2 Fig. 3 Raman spectra of (a) the as-prepared Ni-In(2.0)/AlOH and (b) after H2 treatment at 673K for 1.5h (Ni-In(2.0)/AA)). Fig. 3 Fig. 4 XRD patterns of (a) as-prepared Ni-In(2.0)/AlOH and H2 treated (Ni-In(2.0)/AA) at different temperatures of (b) 573, (c) 673, (d) 773, and (e) 873K for 1.5h. (●) bayerite; (⊗) gibbsite; (#) In(OH)3; (▼) Ni(0); (*) Ni3In (#JCPDS-21-404); (♦) Ni2In3 (#JCPDS-65-3486). Fig. 4 Fig. 5 Effect of reaction temperature on the conversion of furfural (F) over the bulk and supported Ni-In(2.0)/AA 773K/H2 alloy catalysts. Reaction conditions: catalyst, 50mg; F, 1.1mmol; iso-PrOH, 3mL; H2, 3.0MPa, 75min. Fig. 5 Fig. 6 Effect of the initial H2 pressure on the conversion and selectivity in the hydrogenation of furfural (F) over the Ni-In(2.0)/AA 773K/H2 alloy catalyst. Reaction conditions: catalyst, 50mg; F, 1.1mmol; isoPrOH, 3mL; 453K, 75min. Fig. 6 Fig. 7 Kinetics of the hydrogenation of furfural (F) over bimetallic bulk Ni-In(2.0) and Ni-In(2.0)/AA catalysts. Reaction conditions: catalyst, 50mg; F, 1.1mmol; iso-PrOH, 3mL; H2, 3.0MPa, 453K. Fig. 7 Table 1 Physicochemical properties of the synthesized bimetallic Ni-In alloy catalysts supported on amorphous alumina (Ni-In(x)/AA, x =Ni/In molar ratio). Table 1 Entry Catalysts a Ni a In a H2 uptake b / S BET c / D d /nm (mmol−1) (mmol−1) μmolg−1 m2 g−1 1 Raney Ni 4.0 0 121 70 8.6 2 R-Ni/AlOH 3.5 0 104 150 9.0 3 Ni-In(5.1)/AA 7.1 1.4 84 128(101) 8.0(5.2) 4 Ni-In(3.1)AA 7.2 2.3 71 120(90) 7.0(3.8) 5 Ni-In(2.0)/AA 8.8 4.5 75 154(98) 3.8(2.9) 6 Ni-In(1.1)/AA 7.0 6.2 76 161(75) 6.6(3.9) 7 Ni-In(0.8)/AA 7.2 9.4 48 157(72) 5.2(3.4) 8 e Bulk Ni-In(2.0) 4.1 2.0 29 43 39.8 a Values between parentheses are the Ni/In molar ratios determined by ICP-AES. b Based upon the total H2 uptake at 273K (after corrections for physical and chemical adsorption). c Specific surface area of BET (SBET) of samples after H2 treatment at 673K for 1.5h, determined by N2 adsorption at 77K; values between parentheses are the S BET values of the as-prepared samples. d Average Ni(111) or Ni-In crystallite sizes were calculated according to the Scherer equation; values between parentheses are the crystallite sizes of Ni(111) or Ni-In of the as-prepared catalysts. e Bulk Ni-In(2.0) catalysts were synthesized via the hydrothermal treatment of a mixture of NiCl2 and InCl3·4H2O solutions at 423K for 24h, followed by H2 treatment at 673K for 1.5h. Table 2 Results of the catalytic hydrogenation of biomass-derived furfural over the various as-prepared bimetallic Ni-M/AlOH catalysts (M=Sn, In, Ga, Ag, Nb, and Zr). Table 2 Entry Catalyst M a /mmolg−1 Conversionb/% Yieldb/% FA THFA 1 Raney Ni – 99 48 51 2 R-Ni/AlOH – >99 1 99 3 Ni-Sn/AlOH 1.0 95.0 91 3 4 Ni-In/AlOH 1.4 47.0 40 7 5 Ni-Ga/AlOH 1.1 12.8 0 0 6 Ni-Ag/AlOH 1.2 44.9 7 16 7 Ni-Nb/AlOH 1.2 47.3 6 17 8 Ni-Zr/AlOH 1.1 >99 0 96 Reaction conditions: catalyst (50mg), F (1.1mmol), iso-PrOH (3mL), H2 (3.0MPa), 453K, 75min. a Loading amount of In was determined by ICP-AES. Table 3 Results of the catalytic hydrogenation of biomass-derived furfural over as prepared bimetallic Ni-In(x)/AlOH catalysts with various loading amounts of indium (In). Table 3 Entry Catalyst a In b /mmolg−1 Conversion c /% Yield c /% FA THFA 1 Ni-In(5.1)/AlOH 1.4 47 40 7 2 Ni-In(3.1)/AlOH 2.3 53 47 6 3 Ni-In(2.0)/AlOH 4.5 61 55 6 4 d Ni-In(2.0)/AlOH 4.5 96 92 4 5 e Ni-In(2.0)/AlOH 4.5 45 40 5 6 f Ni-In(2.0)/AlOH 4.5 17 5 2 7 Ni-In(1.1)/AlOH 6.2 59 51 8 8 Ni-In(0.8)/AlOH 9.4 42 39 3 9 g R-Ni-In/SiO2 2.7 43 39 4 10 In/AlOH 4.5 28 0 0 11 In2O3 – 28 6 3 12 InCl3·4H2O – 52 3 1 13 Neat (no catalyst) – 15 0 0 a Values between parentheses are the Ni/In molar ratio. Reaction conditions: catalyst (50mg), F (1.1mmol), iso-PrOH (3mL), H2 (3.0MPa), 453K, 75min. b Loading amount of In was determined by ICP-AES. c Conversion and yield were determined by GC analysis using an internal standard. d Reaction time was 180min. e Initial pressure of H2 was 2.0MPa. f Reaction occurred in the absence of H2. g Precursor of nickel was Raney Ni and supported on SiO2. Table 4 Results of the catalytic hydrogenation of biomass-derived furfural over bimetallic Ni-In(x)/AA catalysts after H2 treatment at 673K for 1.5h. Table 4 Entry Catalyst a In b /mmolg−1 Conversion c /% Yield c /% FA THFA 1 Ni-In(5.1)/AA 1.4 98 94 4 2 Ni-In(3.1)/AA 2.3 97 95 2 3 Ni-In(2.0)/AA 4.5 >99 100 0 4 d Ni-In(2.0)/AA 4.5 >99 99 1 5 Ni-In(1.1)/AA 6.2 99 96 3 6 Ni-In(0.8)/AA 9.4 97 93 4 7 RNi-In/SiO2 2.7 96 87 9 8 e Bulk Ni-In(2.0) 2.0 42 42 0 a Values between parentheses are the Ni/In molar ratio. Reaction conditions: catalyst (50mg), F (1.1mmol), iso-PrOH (3mL), H2 (3.0MPa), 453K, 75min. b Loading amount of In was determined by ICP-AES. c Conversion and yield were determined by GC analysis using an internal standard. d Reaction time was 360min. e Bulk Ni-In(2.0) catalyst was synthesized via hydrothermal treatment of NiCl2 and InCl3·4H2O in an ethanol/H2O mixture at 423K for 2h, subsequently followed by reduction with H2 at 673K for 1.5h. The XRD patterns of the as-prepared and H2-treated bulk Ni-In(2.0) samples are shown in Fig. S6 in the ESI. Table 5 Results of furfural hydrogenation over various Ni-In(2.0)/AA catalysts after H2 treatment at various temperature of 573–873K for 1.5h. Table 5 Entry Catalyst Temp. H2 treatment/K Conversion a /% Yield a /% FA THFA 1 Ni-In(2.0)/AA 573 >99 95.0 5.0 2 Ni-In(2.0)/AA 673 >99 99.0 1.0 3 Ni-In(2.0)/AA 773 >99 99.9 0 4 Ni-In(2.0)/AA 873 >99 99.9 0 5 b Ni-In(2.0)/AA 773 5 – 5.0 Reaction conditions: catalyst (50mg), furfural (1.1mmol), iso-PrOH (3mL), H2 3.0MPa, 453K, 75min. a Conversion and yield were determined by GC analysis using an internal standard. b Furfuryl alcohol (FA) was the substrate, and reaction time was 180min. Table 6 Results of the re-usability tests for the Ni-In(2.0)/AA 773K/H2 catalyst in the selective hydrogenation of furfural. Table 6 Run a 1 2 3 4 5 Conversion (%) >99 95 93 91 91 Selectivity b (%) 100 99 99 99 99 Reaction conditions: F, 1.1mmol (F/Ni ratio=15); iso-PrOH (3mL); H2, 3.0MPa, 453K, 75min. a The recovered catalyst was reused without any further treatment. b Selectivity to FA was determined by GC analysis using an internal standard technique. Research Paper Novel preparation method of bimetallic Ni-In alloy catalysts supported on amorphous alumina for the highly selective hydrogenation of furfural Rodiansono a ⁎ Maria Dewi Astuti a Dwi Rasy Mujiyanti a Uripto Trisno Santoso a Shogo Shimazu b ⁎ a Department of Chemistry, Lambung Mangkurat University, Jl. A. Yani Km 36 Banjarbaru 70714, Indonesia Department of Chemistry Lambung Mangkurat University Jl. A. Yani Km 36 Banjarbaru 70714 Indonesia b Graduate School of Engineering, Chiba University, 1-33 Yayoi, Inage, Chiba, 263-8522, Japan Graduate School of Engineering Chiba University 1-33 Yayoi, Inage Chiba 263-8522 Japan ⁎ Corresponding authors. Graphical abstract A novel preparation method for bimetallic nickel-indium alloy catalysts supported on amorphous alumina (Ni-In(x)/AA; x =Ni/In molar ratio) catalysts has been developed and evaluated for the highly selective hydrogenation of biomass-derived furfural. Ni-In(x)/AA catalysts were obtained via the hydrothermal treatment of Raney® nickel supported on aluminium hydroxide (R-Ni/AlOH) and an InCl2·H2O solution in an ethanol/H2O mixture at 423K for 2h, followed by reduction with H2 at 573–873K for 1.5h. The formation of Ni-In alloy phases such as Ni3In2, Ni3In, Ni2In, and NiIn in Ni-In(2.0)/AA was clearly observed after reduction with H2 at 873K for 1.5h. Ni-In(2.0)/AA contained a Ni2In alloy as the major phase, which exhibited the best catalytic performance for the selective hydrogenation of furfural into furfuryl alcohol and was stable for at least five consecutive reaction runs. Keywords Bimetallic Ni-In alloy catalyst Selective hydrogenation Biomass-derived furfural Furfuryl alcohol 1 Introduction Biomass feedstock valorizations are currently being explored by using heterogeneous catalysts to produce bio-based platform chemicals, fuels, and various commodity products. Furfural (F) is one of the most promising biorefinery platform molecules because it can be transformed into a wide range of value-added derivative molecules, which can be used as plasticizers, solvents, agrochemicals, monomers in the production of resins (e.g., furfuryl alcohol (FA) and tetrahydrofurfuryl alcohol (THFA)) and gasoline blends (e.g., methyl furan (MF) or terminal diols (e.g., pentanediol (PD)) [1–3]. F could be produced effectively from C-5 sugars in hemicellulosic biomasses, such as xylan, arabinose and C-6 sugars in form of glucose or fructose via acidic hydrolysis [4–6].Autor name: Interactions between metals in bimetallic catalysts can modify their surfaces, which can be beneficial for the conversion and upgrading of highly complex biomass fractions[7–9]. Copper chromite was the first industrial bimetallic catalyst for the hydrogenation of F under harsh reaction conditions (473–573K, 20–30MPa) with maximum FA yields of ca. 70% [10]. In previously published studies, several bimetallic alloy transition metal catalysts (e.g., Ni-Sn [11–13], Ni-Fe [14,15], Ni-In [16] Pd-Cu [17], and Pt-Zn [18]) have shown superior performance for the selective hydrogenation of F compared with their single metal counterpart. Delbecq et al. have suggested that an increase in the charge density of Pt metals by the addition of hyperelectronic metals or the formation of a metal alloy could enhance the affinity towards the CO bond rather than towards the CC bond to form unsaturated alcohols in the hydrogenation of α,β-unsaturated aldehydes [19,20]. Moreover, unlike tin alloyed with Pt, the utilization of Ni-Sn alloy-based catalysts for the selective hydrogenation of unsaturated carbonyl compounds has been rarely investigated to date [21]. In our previous investigations, we have reported the synthesis of both bulk and supported bimetallic Ni-Sn alloy catalysts from two types nickel precursors: first, from nickel salt (e.g., NiCl2 or NiCl2·4H2O) produced from both bulk and supported Ni-Sn alloys [11] and, second, from Raney® nickel supported on aluminium hydroxide (R-Ni/AlOH), which produced a nickel-tin alloy supported on aluminium hydroxide (Ni-Sn(x)/AlOH; x =Ni/Sn molar ratio) [12,13]. The catalysts showed high activity and selectivity during hydrogenation of F to FA [11–13], and the catalyst that consisted of the Ni3Sn2 alloy dispersed on TiO2 allowed a remarkable reduction in the reaction temperature from 453K to 383K [11]. We have also recently reported the catalytic performance of the Ni-Sn alloy during hydrogenation of biomass-derived levulinic acid in water to γ-valerolactone (GVL) [22,23]. Over bulk Ni-Sn alloy catalysts, a relatively high reaction temperature (433K, 4.0MPa H2, 6h) was applied to achieve both a high conversion and GVL yield (99%) [22]. Alternatively, a GVL yield of >99% was obtained over Ni-Sn(x)/AlOH catalysts at a lower reaction temperature (393K) compared to the bulk catalysts [23]. We found that the selectivity of Ni could be controlled precisely by changing the Ni/Sn ratio in a Ni-Sn alloy or of the dispersion of the Ni-Sn alloy on an appropriate support that might play a key role in chemoselectivity enhancement. Herein, we report our extended investigation on a facile and novel preparation method for nanosized bimetallic nickel-indium alloy catalysts supported on amorphous alumina (denoted Ni-In(x)/AA; x is Ni/In molar ratio and AA is amorphous alumina). Ni-In(x)/AA catalysts were synthesized via a very similar synthetic procedure to Ni-Sn(x)/AlOH, which has been reported elsewhere [12]. The effects of the loading amount of In and thermal treatment on the activity and selectivity of Ni-In(x)/AA catalysts during the hydrogenation of furfural to furfuryl alcohol were studied systematically. 2 Experimental 2.1 Reagents Raney Ni-Al alloy (50%wt Ni and 50%wt Al) was purchased from Kanto Chemical Co., Inc.). NaOH, InCl3·4H2O and SnCl2·2H2O were purchased from WAKO Pure Chemical Industries, Ltd., and GaCl3, AgNO3, NbCl5, and ZrCl4 were purchased from Sigma-Aldrich, Co., and used as received. Furfural, furfuryl alcohol, tetrahydrofurfuryl alcohol, ethanol, and isopropanol were purchased from Tokyo Chemical Industries (TCI) Ltd. and purified using standard procedures prior to use. 2.2 Catalyst synthesis 2.2.1 Synthesis of R-Ni/AlOH A typical procedure for the synthesis of the Raney nickel supported on aluminium hydroxide catalyst (denoted as R-Ni/AlOH) is described as follows [12,24]: Raney Ni-Al alloy powder (2.0g) was slowly added to a dilute aqueous solution of NaOH (0.31M, 16mL) at room temperature. The temperature was raised to 363K, and 4mL of 3.1M NaOH solution was subsequently added and stirred for 30min. The mixture was then placed into a sealed Teflon autoclave reactor for hydrothermal treatment at 423K for 2h. The resulting precipitate was filtered, washed with distilled water until the filtrate was neutralized and then stored in water. Finally, the catalyst was dried under vacuum prior to use. 2.2.2 Synthesis of Ni-In/AlOH A typical procedure for the synthesis of the nickel-indium alloy supported on aluminium hydroxide (denoted as Ni-In(2.0)/AlOH, 2.0 is Ni/In molar ratio) consisted of first mixing R-Ni/AlOH at room temperature in an ethanol/H2O solution (∼25mL) that contained 4.5mmol InCl3·4H2O and then stirring for 2h. The mixture was placed into a sealed Teflon autoclave reactor for hydrothermal treatment at 423K for 2h. The resulting precipitate was filtered, washed with distilled water and ethanol, and dried under vacuum overnight. The Ni-In(x)/AlOH samples were reduced by hydrogen (H2) at 673K for 1.5h, which produced Ni-In(x)/AA, where AA is amorphous alumina. The Ni-In(2.0)/AlOH sample was reduced by hydrogen (H2) at 573–873K for 1.5h in order to investigate the effect of temperature reduction on the formation of the Ni-In alloy in Ni-In(2.0)/AA. The H2 uptake was determined through irreversible H2 chemisorption. After the catalyst was heated at 393K under vacuum for 30min, it was then heated at 673K under H2 for 30min. The catalysts were subsequently cooled to room temperature under vacuum for 30min. The H2 measurement was conducted at 273K, and the H2 uptake was calculated according to a method described in the literature [26,27]. 2.3 Catalyst characterization Powder X-ray diffraction (XRD) measurements were recorded on a Mac Science M18XHF instrument using monochromatic CuKα radiation (λ=0.15418nm). The XRD equipment operated at 40kV and 200mA with a step width of 0.02° and a scan speed of 4° min−1 (α1=0.154057nm, α2=0.154433nm). Inductively coupled plasma (ICP) measurements were performed on an SPS 1800H plasma spectrometer by Seiko Instruments Inc., Japan (Ni: 221.7162nm and Sn: 189.898nm). The BET surface area (S BET) and pore volume (V p) were measured using N2 physisorption at 77K on a Belsorp Max (BEL Japan). The samples were degassed at 473K for 2h to remove physisorbed gases prior to the measurements. The amount of nitrogen adsorbed onto the samples was used to calculate the BET surface area via the BET equation. The pore volume was estimated to be the liquid volume of nitrogen at a relative pressure of approximately 0.995 according to the Barrett–Joyner–Halenda (BJH) approach based on desorption data [25]. SEM images of the synthesized catalysts were taken on a JEOL JSM-610 microscope after the samples were coated using a JEOL JTC-1600 autofine coater. TEM images were recorded on a JEOL JEM1400 microscope. Raman spectra were collected on a JASCO NRS-2100 laser-Raman spectrophotometer with an Ar beam lamp at excitations of 488nm and 514.5nm. 2.4 Typical procedure for the selective hydrogenation of furfural The catalyst (50mg), furfural (1.1mmol), and isopropanol (3mL) as the solvent were placed into a glass reaction tube, which fit inside a stainless steel reactor. After H2 was introduced into the reactor at an initial H2 pressure of 3.0MPa at room temperature, the temperature of the reactor was increased to 383–453K. After 75min, the conversion of furfural (F) and the yields of furfuryl alcohol (FA) and tetrahydrofurfuryl alcohol (THFA) were determined using GC analysis. The used Ni-In(2.0)/AA 773K/H2 catalyst was easily separated using either simple centrifugation (4000rpm for 10min) or filtration, then finally dried overnight under vacuum at room temperature prior to re-usability testing. 2.5 Product analysis GC analysis of the reactant (F) and products (FA and THFA) was performed on a Shimadzu GC-8A with a flame ionization detector equipped with a silicone OV-101 packed column (length (m) =3.0; inner diameter (mm) =2.0; methylsilicone from Sigma-Aldrich Co. Ltd.). Gas chromatography-mass spectrometry (GC–MS) was performed on a Shimadzu GC–17B equipped with a thermal conductivity detector and an RT-βDEXsm capillary column. 1H and 13C NMR spectra were obtained on a JNM-AL400 spectrometer at 400MHz; the samples for NMR analysis were dissolved in chloroform-d 1 with TMS as the internal standard. The products were confirmed by a comparison of their GC retention time, mass, 1H and 13C NMR spectra with those of authentic samples. The conversion of furfural, yield and selectivity of the products were calculated according to the following equations: C o n v e r s i o n : i n t r o d u c e d m o l r e a c t a n t ( F 0 ) − r e m a i n e d m o l r e a c t a n ( F t ) i n t r o d u c e d m o l r e a c t a n t ( F 0 ) x 100 % Y e i l d : m o l p r o d u c t c o n s u m e d m o l r e a c t a n t ( Δ F ) x 100 % S e l e c t i v i t y : mol product total mol products x 100 % where F0 is the introduced mol reactant (furfural, F), Ft is the remaining mol reactant, and ΔF is the consumed mol reactant (introducedmol reactant- remained mol reactant), which are all obtained from GC analysis using an internal standard technique. 3 Results and discussion 3.1 Catalyst characterization A series of bimetallic alloys (Ni-In(x)/AA, x =Ni/In molar ratio) prepared via hydrothermal treatment of a mixture of Raney® nickel supported on aluminium hydroxide (R-Ni/AlOH) [12,24] and InCl2·H2O solution in ethanol/H2O at 423K for 2h, produced the as-prepared Ni-In(x)/AlOH. After reduction of the as-prepared Ni-In(x)/AlOH with H2 treatment at 573–873K for 1.5h, Ni-In(x)/AA, x =Ni/In molar ratio and AA=amorphous alumina were produced. The physicochemical properties of the synthesized Ni-In(x)/AA catalysts are summarized in Table 1 . Based on the ICP-AES results, the loading amounts of In were 1.4, 2.3, 4.5, 6.2, and 9.4mmolg−1, which was reflected by the Ni/In molar ratios of 5.1, 3.1, 2.0, 1.1, and 0.8, respectively. The results also indicate that S BET increased gradually, while the H2 uptake decreased with an increase in the loading amount of In. The S BET values of the Ni-In(x)/AA samples were higher than those of the as-prepared samples (Ni-In(x)/AlOH) because of thermal treatment or the formation of amorphous alumina. In the Ni-In(2.0)/AA sample, the H2 uptake was 75μmolg−1 (entry 4), which is comparable to the previous results of the H2 uptake of Ni-Sn(1.4)/AlOH [12]. An increase in the loading amount of In reduced the surface activity of Ni, as also indicated by the H2 uptake in samples with Ni/In ratios of 1.1-0.8 (entries 5–7) and bulk Ni-In(2.0) (entry 8). The average crystallite sizes of the Ni(111) species or bimetallic Ni-In before and after H2 treatment were calculated by using the Scherer equation using the diffraction peak at 2θ=44.4° and the results are also summarized in Table 1. The findings indicate that the average crystallite sizes of Ni(111) or bimetallic Ni-In are larger than that of the as-prepared sample due to thermal treatment under hydrogen atmosphere. Compared with the bulk Ni-In(2.0) catalyst with average crystallite sizes of bimetallic Ni-In of 39.8nm (entry 8), the crystallite sizes in Ni-In(x)/AA catalysts are much smaller. The crystallite sizes of Ni or the Ni-In alloy in Ni-In(x)/AA are also consistent with the H2 uptake. These results suggest that the dispersion of active metal on amorphous alumina may influence the catalytic activity. The XRD patterns of R-Ni/AlOH and the as-prepared Ni-In(x)/AlOH with different Ni/In molar ratios are shown in Fig. 1 . R-Ni/AlOH showed sharp diffraction peaks at 2θ=44.3°, 51.6°, and 76.3°, which correspond to the Ni(111), Ni(200), and Ni(220) species, respectively (Fig. 1 a). Sharp diffraction peaks were also observed at 2θ=18.3°, 27.8°, and 40.5°, which represent bayerite, and at 2θ=18.7°, 20.4°, 36.7°, 37.8°, 53.2°, 63.9°, and 70.7°, which correspond to gibbsite (Fig. 1 a–f). In contrast, the XRD patterns of the as-prepared Ni-In(x)/AlOH exhibited broadened peaks at 2θ=44.4° due to the formation of bimetallic Ni-In, i.e., Ni2In and Ni3In2 (Fig. 1 b–f). The formation of bimetallic Ni2In3 (#JCPDS-36-1147) at 2θ=31.9° and indium oxides such as In2O3 (#JCPDS-06-416) at 2θ=22.4°, 39.4°, 51.0°, and 57.6° were also observed (Figure d–f) [24,28]. To confirm the formation of the bimetallic Ni-In alloy, the as-prepared Ni-In(x)/AlOH samples were reduced with H2 at 673K for 1.5h and resulted in the bimetallic Ni-In alloy supported on amorphous alumina (denoted as Ni-In(x)/AA) and the XRD patterns are shown in Fig. 2 . The results indicate that controlled thermal treatment under H2 transformed the remaining aluminium hydroxides (both bayerite and gibbsite phases) into amorphous alumina, which were not detectable using XRD analysis. The diffraction peak at 2θ=44.4° that is recognized as an identical peak of the Ni(111) species became broadened and overlapped with the bimetallic Ni-In alloy phases with an increase in the loading amount of In (Fig. 2 a–e). A shoulder peak at 2θ=43.2° was also observed for a Ni/In ratio of 0.8 (where the amount of Ni >>In) that can be attributed to the formation of the bimetallic Ni3In species (#JCPDS-21-404) (Fig. 2 e). Additionally, the broadened peak of the Ni(111) species both in the as-prepared and H2-treated samples suggest the formation of a bimetallic Ni-In alloy that might have selectively occurred on the surface of Ni(111) rather than on the surface of Ni(200) or Ni(220) [29–31]. The low-frequency Raman spectrum of the as-prepared Ni-In(2.0)/AlOH resembles Ni-Sn(1.4)/AlOH, as has been previously reported [23]. It is found that the low-frequency Raman spectrum showed a 530cm−1 band, which can be attributed to the γ(OH) vibrational mode and Al-O-Al deformation, whereas the 315cm−1 band is ascribed to Al-O-Al stretching vibrations of gibbsite or bayerite (Fig. 3 ). Alternatively, the bands of Al-O-Al deformation and Al-O-Al stretching vibrations disappeared after H2 treatment at 673K for 1.5h (Fig. 3 b) due to the formation of amorphous alumina [32–34], which had been not detected by XRD [12,13]. Scanning electron microscopy (SEM) images, EDS spectra and TEM images of both Ni-In(3.1)/AA and Ni-In(2.0)/AA are shown in Figs. S1, S2, and S3 (see ESI), respectively. 3.2 Catalytic reactions: furfural hydrogenation 3.2.1 Selection of the second metals At the first stage, the catalytic performances of various transition metal modified-R-Ni/AlOH, such as Sn, In, Ga, Ag, Nb, and Zr, were first evaluated by the selective hydrogenation of the typical unsaturated aldehyde furfural (F) to furfuryl alcohol (FA), which is a promising chemical intermediate for the synthesis of biosourced products widely used in the polymer industry. Conventional Raney nickel (Raney Ni) and Raney nickel supported on aluminium hydroxide (R-Ni/AlOH) catalysts were also synthesized and evaluated using the same reaction conditions as catalyst references. The detailed information for these catalysts is summarized in Table S1 in the ESI. The XRD patterns of the as-prepared R-Ni-M/AlOH are shown in Fig. S4 in the ESI. The results of the catalytic hydrogenation of F are summarized in Table 2 , and the reaction pathways are shown in Scheme 1 . Conventional Raney Ni exhibited a 99.6% conversion of F and FA and THFA yields of 48% and 51%, respectively (entry 1). As expected, by using the R-Ni/AlOH catalyst, F converted completely to produce a 99% yield of THFA (entry 2). Interestingly, the addition of Sn or In shifted the product selectivity to FA with yields of 91% and 40%, respectively (entries 3 and 4). In tin-alloyed Ni-based (Ni-Sn) catalysts, the catalytic performances have been reported previously [11–13,22,23]. Alternatively, the presence of Ga, Ag, and Nb significantly reduced the activity of R-Ni/AlOH (entries 5, 6, and 7), while Zr did not affect the activity or selectivity of the former catalyst (entry 8). Therefore, in the present report, we focused on catalytic performance studies of indium-alloyed Ni catalysts on F hydrogenation including the effect of loading amount, H2 treatment, time profiles, and catalyst reusability. 3.2.2 Effect of In loading amount The results for the selective hydrogenation of F using the as-prepared supported bimetallic Ni-In(x)/AlOH catalysts are summarized in Table 3 . It can be observed that after introducing 1.4mmol InCl3·4H2O to R-Ni/AlOH, the conversion of F drastically decreased to 47% and yielded 40% FA (entry 1). By increasing the loading amount of In to 9.4 mmolg−1, the FA yield was almost constant (entries 7 and 8, 51% and 39%, respectively). The prolonged reaction time of 180min over Ni-In(2.0)/AlOH produced a marked increase in the FA yield from 55% to 92% (entries 3 and 4, respectively). In contrast, the yield of tetrahydrofurfuryl alcohol (THFA) decreased to 4% (entry 4). The FA yield decreased when an initial H2 pressure of 2.0MPa was applied (entry 5, 40%). The F conversion and FA yield drastically decreased without the presence of H2 (entry 6). The R-Ni-In/SiO2 catalyst (loading amount of In, 2.7mmolg−1) produced a 43% conversion and a 39% yield of FA (entry 9). Moreover, the In/AlOH, In2O3, and InCl3·4H2O catalysts (entries 10–12) and the absence of a catalyst (entry 13) did not produce hydrogenated products of F under the same conditions. In addition, screening tests using solvents (e.g., methanol, ethanol, toluene, 1-propanol, and H2O) other than isopropanol (iso-PrOH) were also performed, and the results were inferior to the results with iso-PrOH, as reported previously [35]. The H2 treatment of as-prepared Ni-In(x)/AlOH at 673K for 1.5h resulted in Ni-In(x)/AA catalysts (the XRD patterns are shown in Fig. 2). The catalysts were evaluated for the catalytic hydrogenation of biomass-derived furfural to furfuryl alcohol, and the results are summarized in Table 4 . Interestingly, over H2-treated Ni-In(x)/AA catalysts, the high conversion of F was achieved and produced a high yield of FA (entries 1–6). In Ni-In(2.0)/AA, F was converted completely into almost a 100% yield of FA. The high yield of FA without the formation of THFA, even though the reaction time was prolonged to 360min (entry 4), obviously indicated the important role of In in the Ni-In alloy catalyst system. Additionally, over the indium-modified Raney Ni supported on silica (RNi-In/SiO2 673K/H2) catalyst, the conversion of F was 96% with yield of FA that was much lower than that of Ni-In(2.0)/AA under the same reaction conditions (entry 7). The XRD patterns of this catalyst are shown in Fig. S5 in the ESI, and the physicochemical properties are summarized in Table S1 in the ESI. Moreover, by using the bulk Ni-In(2.0) catalyst (XRD patterns are shown in Fig. S6 in the ESI), the conversion of F was only 42% under the same reaction conditions (entry 8). 3.2.3 Effect of thermal treatment on Ni-In(2.0)/AlOH catalysts Among the synthesized Ni-In(x)/AA catalysts, Ni-In(2.0)/AA demonstrated a very high activity and selectivity towards the desired product of FA. Therefore, we investigated the effect of temperature during hydrogen treatment on Ni-In(2.0)/AA at 573–873K for 1.5h, and the XRD patterns are shown in Fig. 4 . After H2 treatment at 573K, the diffraction peaks of the aluminium hydroxides (e.g., bayerite and gibbsite) totally disappeared, and the broadened peaks at 2θ=42-44.5° were hardly distinguished due to the overlap of the bimetallic alloy Ni-In phases and Ni metal diffraction peaks. Peak formation of NiIn (PDF#07-0178) at 2θ=30.2° and the remaining In2O3 at 2θ=22.3° and 31.9° was clearly observed (Fig. 4 a-b). The increase in temperature from 673K to 873K transformed the NiIn alloy species to Ni2In (PDF #65-3486), Ni3In (PDF#65-3522) and Ni2In3 (PDF # 65–3486) alloy phases (Fig. 4c–e), and the peaks became intensified at a temperature of 873K (Fig. 4 e). The results of the catalytic hydrogenation of F to FA and THFA over Ni-In(2.0)/AA treated with H2 at different temperature treatments are summarized in Table 5 . For Ni-In(2.0)/AA catalysts at 573K (entry 1) and 673K (entry 2), a small amount of THFA product was obtained over those catalysts (5% and 1% yield of THFA, respectively). The best catalytic performance was achieved over Ni-In(2.0)/AA 773K (entry 3) and Ni-In(2.0)/AA 873K (entry 4). We also intentionally carried out the hydrogenation reaction of FA as substrate over Ni-In(2.0)/AA 773K under the same reaction conditions, and only 5.2% of FA was converted into THFA with a yield of 5%, even after the reaction time was prolonged to 180min (entry 5). These results suggest that the addition of indium to R-Ni/AlOH to form the bimetallic Ni-In alloy retards the CC hydrogenation activity of nickel, and as a result, further hydrogenation of the CC furan ring in F did not proceed in the presence of the Ni-In(2.0)/AA catalyst. 3.2.4 Effect of temperature The effect of temperature on the catalytic hydrogenation of F to FA was evaluated over both Ni-In(2.0)/AA 773K/H2 and bulk Ni-In(2.0) catalysts, and the results are shown in Fig. 5 . Differences in the activity of each catalyst were clearly observed. On the bulk Ni-In(2.0) catalyst, the conversion of F gradually increased as temperature increased, and the highest conversion of F (∼76%) was achieved at 453K at the current reaction conditions. In contrast, F was converted completely at 443K over the Ni-In(2.0)/AA 773K/H2 catalyst. These results are very similar to the bimetallic Ni-Sn alloy catalyst system, in which bulk Ni-Sn catalysts have much lower activity and reactivity during F hydrogenation compared with the supported Ni-Sn catalysts, as reported previously [11]. 3.2.5 Effect of initial H2 pressure The effect of the initial H2 pressure on F conversion and product selectivity was evaluated over the Ni-In(2.0)/AA 773K/H2 catalyst, and the results are shown in Fig. 6 . F conversion and FA selectivity gradually increased as the initial H2 pressure increased, whereas the THFA selectivity decreased smoothly to almost 0% between 2.5 and 3.0MPa and then gradually increased between 3.5–4.0MPa. 3.2.6 Kinetics The kinetics of F hydrogenation at 453K on the bulk and supported Ni-In(2.0)/AA 773K/H2 alloy catalysts are shown in Fig. 7 . When the bulk Ni-In(2.0) catalyst was used, FA was slowly increased to achieve a 75% yield, even after 180min. Therefore, a similar explanation can be applied to the current results as follows. The induction periods could be associated with the slow formation of oxidic tin (Snn+) from metallic tin (Sn0), as reported by Sordelli et al. (Rh-Sn) [36] and Margitfalvi et al. (Pt-Sn) [37]. Since the crystallite size or dispersion of Ni-In alloy could affect the length of the induction period, the induction period of Ni-In(2.0)/AA diminished, and a 100% F conversion (>99% FA yield) was achieved after 75min. The excellent catalytic performance of Ni-In(2.0)/AA produces a promising candidate suitable for the large-scale production of FA from the selective hydrogenation of furfural (F). 3.2.7 Re-usability test A re-usability test was performed on the Ni-In(2.0)/AA 773K/H2 catalyst, and the results are summarized in Table 6 . The used Ni-In(2.0)/AA catalyst was easily separated by either simple centrifugation or filtration after the reaction. The activity of the catalyst slightly decreased, while a high selectivity was maintained for at least five consecutive runs. The amount of Ni and In that leached into the reaction solution was 0.7% and 1.4%, respectively, after four runs. The small amount of leached metal is consistent with the XRD patterns of the recovered Ni-In(2.0)/AA 773K/H2 catalyst, and no obvious phase separation or agglomeration of the Ni2In nanoparticles was observed in the used Ni-In(2.0)/AA 773K/H2 catalyst, as indicated by the XRD patterns (Fig. S7 in the ESI). 4 Conclusions A novel preparation method for bimetallic nickel-indium alloy catalysts supported on amorphous alumina (Ni-In(x)/AA; x =Ni/In molar ratio) catalysts has been developed and evaluated for the highly selective hydrogenation of biomass-derived furfural. The formation of Ni-In alloy phases such as Ni3In2, Ni3In, and Ni2In in Ni-In(2.0)/AA was clearly observed after H2 treatment at 873K for 1.5h. Ni-Sn(2.0)/AA contained an Ni2In alloy as the major phase, which exhibited the best catalytic performance for the selective hydrogenation of furfural to furfuryl alcohol exclusively and was stable for at least five consecutive reaction runs. Acknowledgements This work was financially supported by JSPS-DGHE through the Joint Bilateral Research Project FY 2014-2017, KLN and the International Publication Project of DGHE FY 2016 under Grant Number of DIPA-023-04.1.673453/2016, Insentif Riset Nasional (Insinas) FY 2016-2017, and IPTEKS Project FY 2016, Ministry of Research, Technology & Higher Education, Republic of Indonesia. Appendix A Supplementary data Supplementary data associated with this article can be found, in the online version, at http://dx.doi.org/10.1016/j.mcat.2017.11.004. Appendix A Supplementary data The following is Supplementary data to this article: References [1] J. Falbe H. Bahrmann W. Lipps D. Meyer Ullmanns Encyclopedia of Industrial Chemistry 11 2005 Wiley-VCH Verlag GmbH & Co. 21 [2] J.P. Lange E. van der Heide J. van Buijtenen R. Price Furfural a promising platform for lignocellulosic biofuels ChemSusChem 5 2012 150 166 10.1002/cssc.201100648 [3] R. Mariscal P. Maireles-Torres M. Ojeda I. Sádaba M.L. Granados Furfural: a renewable and versatile platform molecule for the synthesis of chemicals and fuels Energy Environ. Sci. 9 2016 1144 1189 10.1039/C5EE02666K [4] P. Gallezot Conversion of biomass to selected chemical products Chem. Soc. Rev. 41 2012 1538 1558 10.1039/C1CS15147A [5] S. Dutta S. De B. Saha Md. I. Alam Advances in conversion of hemicellulosic biomass to furfural and upgrading to biofuels Catal. Sci. Technol. 2 2012 2025 2036 10.1039/c2cy20235b [6] P.S. Metkar E.J. Till D.R. Corbin C.J. Pereira K.W. Hutchenson S.K. Sengupta Reactive distillation process for the production of furfural using solid acid catalysts Green Chem. 17 2015 1453 1466 10.1039/C4GC01912A [7] D.M. Alonso S.G. Wettstein J.A. Dumesic Bimetallic catalysts for upgrading of biomass to fuels and chemicals Chem. Soc. Rev. 41 2012 8075 8098 10.1039/C2CS35188A [8] J. Pritchard G.A. Filonenko R. van Putten E.J.M. Hensen E.A. Pidko Heterogeneous and homogeneous catalysis for the hydrogenation of carboxylic acid derivatives: history, advances and future directions Chem. Soc. Rev. 44 2015 3808 3833 10.1039/C5CS00038F [9] M. Besson P. Gallezot C. Pine Conversion of biomass into chemicals over metal catalysts Chem. Rev. 114 2014 1827 1870 10.1021/cr4002269 [10] J.G.M. Bremner R.K.F. Keeys The hydrogenation of furfuraldehyde to furfuryl alcohol and sylvan (2-methylfuran) J. Chem. Soc. 1947 1068 1080 10.1039/JR9470001068 [11] Rodiansono S. Khairi T. Hara N. Ichikuni S. Shimazu Highly efficient and selective hydrogenation of unsaturated carbonyl compounds using Ni-Sn alloy catalysts Catal. Sci. Technol. 2 2012 2139 2145 10.1039/C2CY20216F [12] Rodiansono T. Hara T. Ichikuni S. Shimazu A novel preparation method of Ni-Sn alloy catalysts supported on aluminium hydroxide: application to chemoselective hydrogenation of unsaturated carbonyl compounds Chem. Lett. 41 2012 769 771 10.1246/cl.2012.769 [13] Rodiansono T. Hara N. Ichikuni S. Shimazu Development of nanoporous Ni-Sn alloy and application for chemoselective hydrogenation of furfural to furfuryl alcohol Bull. Chem. React. Eng. Catal. 9 1 2014 53 59 10.9767/bcrec.9.1.5529.53-59 [14] A. Halilu T.H. Ali A.Y. Atta P. Sudarsanam S.K. Bhargava S. bee abd hamid, highly selective hydrogenation of biomass-Derived furfural into furfuryl alcohol using a novel magnetic nanoparticles catalyst Energy Fuels 30 3 2016 2216 2226 10.1021/acs.energyfuels.5b02826 [15] W.S. Putro T. Hara N. Ichikuni S. Shimazu Efficiently recyclable and easily separable Ni-Fe alloy catalysts for chemoselective hydrogenation of biomass-derived furfural Chem. Lett. 46 1 2017 149 151 10.1246/cl.160905 [16] C. Li Y. Chen S. Zhang S. Xu J. Zhou F. Wang M. Wei D.G. Evans X. Duan Ni–In intermetallic nanocrystals as efficient catalysts toward unsaturated aldehydes hydrogenation Chem. Mater 25 2013 3888 3896 10.1021/cm4021832 [17] S. Sitthisa W. An D.E. Resasco Selective conversion of furfural to methylfuran over silica-supported Ni-Fe bimetallic catalysts J. Catal. 284 2011 90 101 10.1016/j.jcat.2011.09.005 [18] D. Shi J.M. Vohs Deoxygenation of biomass-Derived oxygenates: reaction of furfural on Zn-Modified Pt(111) ACS Catal. 5 2015 2177 2183 10.1021/acscatal.5b00038 [19] F. Delbecq P. Sautet Competitive CC and CO adsorption of α-β- unsaturated aldehydes on Pt and Pd surfaces in relation with the selectivity of hydrogenation reactions: a theoretical approach J. Catal. 152 1995 217 236 10.1006/jcat.1995.1077 [20] F. Delbecq P. Sautet Influence of Sn additives on the selectivity of hydrogenation of α-β-unsaturated aldehydes with Pt catalysts: a density functional study of molecular adsorption J. Catal. 220 2003 115 126 10.1016/S0021-9517(03)002495 [21] V. Hlukhyy F. Raif P. Clauss T.F. Fässler Polar intermetallic compounds as catalysts for hydrogenation reactions: synthesis, structures, bonding, and catalytic properties of Ca1-xSrxNi4Sn2 (x=0. 0, 0. 5, 1. 0) and catalytic properties of Ni3Sn and Ni3Sn2 Chem. Eur J. 14 2008 3737 3744 10.1002/chem.200701547 [22] Rodiansono A. Ghofur M.D. Astuti K.C. Sembiring Catalytic hydrogenation of levulinic acid in water into γ-Valerolactone over bulk structure of inexpensive intermetallic Ni-Sn alloy catalysts Bull. Chem. React. Eng. Catal. 10 2 2015 192 200 10.9767/bcrec.10.2.8284.192-200 [23] Rodiansono M.D. Astuti T. Hara N. Ichikuni S. Shimazu Efficient hydrogenation of levulinic acid in water using a supported Ni-Sn alloy on aluminium hydroxide catalysts Catal. Sci. Technol. 6 2016 2955 2961 10.1039/c5cy01731a [24] J. Petro A. Bota K. Laszlo H. Beyer E. Kalman I. Dódony A new alumina-supported, not pyrophoric Raney-type Ni catalyst Appl. Catal. A 190 2000 73 86 10.1016/S0926-860X(99)00267-7 [25] S. Lowell J.E. Shields M.A. Thomas M. Thommes Characterization of Porous Solids and Powders: Surface Area, Pore Size and Density Chapter 8 2004 Kluwer Academic Publishers Netherlands [26] C.H. Bartholomew R.B. Pannel J.L. Butler Support and crystallite size effects in CO hydrogenation on nickel J. Catal. 65 1980 335 347 10.1016/0021-9517(80)90311-5 [27] C.H. Bartholomew R.B. Pannel The stoichiometry of hydrogen and carbon monoxide chemisorption on alumina- and silica-supported nickel J. Catal. 65 1980 390 401 10.1016/0021-9517(80)90316-4 [28] Powder Diffraction Files, JCPDS-International Centre for Diffraction Data (ICDD) 1997 [29] H.E. Swift J.E. Bozik Metallic phases and activities of nickel-tin-silica catalysts: dehydrogenation of cyclohexanone, cyclohexanol, and cyclohexane J. Catal. 12 1968 5 14 10.1016/0021-9517(68)90067-5 [30] E. Nikolla J. Schwank S. Linic Promotion of the long-term stability of reforming Ni catalysts by surface alloying J. Catal. 250 2007 85 93 10.1016/j.jcat.2007.04.020 [31] R. Sun M. Zheng J. Pang X. Liu J. Wang X. Pan A. Wang X. Wang T. Zhang Selectivity-Switchable conversion of cellulose to glycols over Ni–Sn catalysts ACS Catal. 6 2016 191 201 10.1021/acscatal.5b01807 [32] H.D. Ruan R.L. Frost J.T. Kloprogge Comparison of Raman spectra in characterizing gibbsite, bayerite, diaspore and boehmite J. Raman Spectros. 32 9 2001 745 750 10.1002/jrs.736 [33] H.D. Ruan R.L. Frost J.T. Kloprogge L. Duong Far-infrared spectroscopy of alumina phases Spectrochimica Acta Part A 58 2002 265 272 10.1016/S1386-1425(01)00532-7 [34] S. Cava S.M. Tebcherani I.A. Souza S.A. Pianaro C.A. Paskocimas E. Longo J.A. Varela Structural characterization of phase transition of Al2O3 nanopowders obtained by polymeric precursor method Mater. Chem. Physics 103 2007 394 399 10.1016/j.matchemphys.2007.02.046 [35] Rodiansono M.D. Astuti U.T. Santoso S. Shimazu Hydrogenation of biomass-derived furfural over highly dispersed-Aluminium hydroxide supported Ni-Sn(3.0) alloy catalysts Procedia Chem. 16 2015 531 539 10.1016/j.proche.2015.12.089 [36] L. Sordelli R. Psaro G. Vlaic A. Cepparo S. Recchia A. Fusi R. Zanoni EXAFS studies of supported Rh–Sn catalysts for citral hydrogenation J. Catal. 182 1999 186 198 10.1006/jcat.1998.2348 [37] J.L. Margitfalvi A. Tompos I. Kolosova J. Valyon Reaction induced selectivity improvement in the hydrogenation of crotonaldehyde over Sn-Pt/SiO2 catalysts J. Catal. 174 1998 246 249 10.1006/jcat.1998.1966",
      "scopus-id": "85039784404",
      "coredata": {
        "eid": "1-s2.0-S2468823117305965",
        "dc:description": "A novel preparation method for bimetallic nickel-indium alloy catalysts supported on amorphous alumina (Ni-In(x)/AA; x =Ni/In molar ratio) catalysts has been developed and evaluated for the highly selective hydrogenation of biomass-derived furfural. Ni-In(x)/AA catalysts were obtained via the hydrothermal treatment of Raney® nickel supported on aluminium hydroxide (R-Ni/AlOH) and an InCl2·H2O solution in an ethanol/H2O mixture at 423K for 2h, followed by reduction with H2 at 573–873K for 1.5h. The formation of Ni-In alloy phases such as Ni3In2, Ni3In, Ni2In, and NiIn in Ni-In(2.0)/AA was clearly observed after reduction with H2 at 873K for 1.5h. Ni-In(2.0)/AA contained a Ni2In alloy as the major phase, which exhibited the best catalytic performance for the selective hydrogenation of furfural into furfuryl alcohol and was stable for at least five consecutive reaction runs.",
        "openArchiveArticle": "false",
        "prism:coverDate": "2018-02-28",
        "openaccessUserLicense": null,
        "prism:aggregationType": "Journal",
        "prism:url": "https://api.elsevier.com/content/article/pii/S2468823117305965",
        "dc:creator": [
          {
            "@_fa": "true",
            "$": "Rodiansono,"
          },
          {
            "@_fa": "true",
            "$": "Astuti, Maria Dewi"
          },
          {
            "@_fa": "true",
            "$": "Mujiyanti, Dwi Rasy"
          },
          {
            "@_fa": "true",
            "$": "Santoso, Uripto Trisno"
          },
          {
            "@_fa": "true",
            "$": "Shimazu, Shogo"
          }
        ],
        "link": [
          {
            "@_fa": "true",
            "@rel": "self",
            "@href": "https://api.elsevier.com/content/article/pii/S2468823117305965"
          },
          {
            "@_fa": "true",
            "@rel": "scidir",
            "@href": "https://www.sciencedirect.com/science/article/pii/S2468823117305965"
          }
        ],
        "dc:format": "application/json",
        "openaccessType": null,
        "pii": "S2468-8231(17)30596-5",
        "prism:volume": "445",
        "prism:publisher": "Elsevier B.V.",
        "dc:title": "Novel preparation method of bimetallic Ni-In alloy catalysts supported on amorphous alumina for the highly selective hydrogenation of furfural",
        "prism:copyright": "© 2017 Elsevier B.V. All rights reserved.",
        "openaccess": "0",
        "prism:issn": "24688231",
        "dcterms:subject": [
          {
            "@_fa": "true",
            "$": "Bimetallic Ni-In alloy catalyst"
          },
          {
            "@_fa": "true",
            "$": "Selective hydrogenation"
          },
          {
            "@_fa": "true",
            "$": "Biomass-derived furfural"
          },
          {
            "@_fa": "true",
            "$": "Furfuryl alcohol"
          }
        ],
        "openaccessArticle": "false",
        "prism:publicationName": "Molecular Catalysis",
        "openaccessSponsorType": null,
        "prism:pageRange": "52-60",
        "prism:endingPage": "60",
        "pubType": "fla",
        "prism:coverDisplayDate": "February 2018",
        "prism:doi": "10.1016/j.mcat.2017.11.004",
        "prism:startingPage": "52",
        "dc:identifier": "doi:10.1016/j.mcat.2017.11.004",
        "openaccessSponsorName": null
      },
      "objects": {
        "object": [
          {
            "@category": "thumbnail",
            "@height": "88",
            "@width": "219",
            "@_fa": "true",
            "$": "https://api.elsevier.com/content/object/eid/1-s2.0-S2468823117305965-fx1.sml?httpAccept=%2A%2F%2A",
            "@multimediatype": "GIF image file",
            "@type": "IMAGE-THUMBNAIL",
            "@size": "7893",
            "@ref": "fx1",
            "@mimetype": "image/gif"
          },
          {
            "@category": "thumbnail",
            "@height": "164",
            "@width": "143",
            "@_fa": "true",
            "$": "https://api.elsevier.com/content/object/eid/1-s2.0-S2468823117305965-gr1.sml?httpAccept=%2A%2F%2A",
            "@multimediatype": "GIF image file",
            "@type": "IMAGE-THUMBNAIL",
            "@size": "5928",
            "@ref": "gr1",
            "@mimetype": "image/gif"
          },
          {
            "@category": "thumbnail",
            "@height": "164",
            "@width": "72",
            "@_fa": "true",
            "$": "https://api.elsevier.com/content/object/eid/1-s2.0-S2468823117305965-gr2.sml?httpAccept=%2A%2F%2A",
            "@multimediatype": "GIF image file",
            "@type": "IMAGE-THUMBNAIL",
            "@size": "4103",
            "@ref": "gr2",
            "@mimetype": "image/gif"
          },
          {
            "@category": "thumbnail",
            "@height": "164",
            "@width": "143",
            "@_fa": "true",
            "$": "https://api.elsevier.com/content/object/eid/1-s2.0-S2468823117305965-gr3.sml?httpAccept=%2A%2F%2A",
            "@multimediatype": "GIF image file",
            "@type": "IMAGE-THUMBNAIL",
            "@size": "6674",
            "@ref": "gr3",
            "@mimetype": "image/gif"
          },
          {
            "@category": "thumbnail",
            "@height": "164",
            "@width": "141",
            "@_fa": "true",
            "$": "https://api.elsevier.com/content/object/eid/1-s2.0-S2468823117305965-gr4.sml?httpAccept=%2A%2F%2A",
            "@multimediatype": "GIF image file",
            "@type": "IMAGE-THUMBNAIL",
            "@size": "5474",
            "@ref": "gr4",
            "@mimetype": "image/gif"
          },
          {
            "@category": "thumbnail",
            "@height": "163",
            "@width": "165",
            "@_fa": "true",
            "$": "https://api.elsevier.com/content/object/eid/1-s2.0-S2468823117305965-gr5.sml?httpAccept=%2A%2F%2A",
            "@multimediatype": "GIF image file",
            "@type": "IMAGE-THUMBNAIL",
            "@size": "5245",
            "@ref": "gr5",
            "@mimetype": "image/gif"
          },
          {
            "@category": "thumbnail",
            "@height": "164",
            "@width": "175",
            "@_fa": "true",
            "$": "https://api.elsevier.com/content/object/eid/1-s2.0-S2468823117305965-gr6.sml?httpAccept=%2A%2F%2A",
            "@multimediatype": "GIF image file",
            "@type": "IMAGE-THUMBNAIL",
            "@size": "5331",
            "@ref": "gr6",
            "@mimetype": "image/gif"
          },
          {
            "@category": "thumbnail",
            "@height": "164",
            "@width": "167",
            "@_fa": "true",
            "$": "https://api.elsevier.com/content/object/eid/1-s2.0-S2468823117305965-gr7.sml?httpAccept=%2A%2F%2A",
            "@multimediatype": "GIF image file",
            "@type": "IMAGE-THUMBNAIL",
            "@size": "4871",
            "@ref": "gr7",
            "@mimetype": "image/gif"
          },
          {
            "@category": "thumbnail",
            "@height": "136",
            "@width": "219",
            "@_fa": "true",
            "$": "https://api.elsevier.com/content/object/eid/1-s2.0-S2468823117305965-sc1.sml?httpAccept=%2A%2F%2A",
            "@multimediatype": "GIF image file",
            "@type": "IMAGE-THUMBNAIL",
            "@size": "4200",
            "@ref": "sc1",
            "@mimetype": "image/gif"
          },
          {
            "@category": "standard",
            "@height": "200",
            "@width": "500",
            "@_fa": "true",
            "$": "https://api.elsevier.com/content/object/eid/1-s2.0-S2468823117305965-fx1.jpg?httpAccept=%2A%2F%2A",
            "@multimediatype": "JPEG image file",
            "@type": "IMAGE-DOWNSAMPLED",
            "@size": "30397",
            "@ref": "fx1",
            "@mimetype": "image/jpeg"
          },
          {
            "@category": "standard",
            "@height": "430",
            "@width": "376",
            "@_fa": "true",
            "$": "https://api.elsevier.com/content/object/eid/1-s2.0-S2468823117305965-gr1.jpg?httpAccept=%2A%2F%2A",
            "@multimediatype": "JPEG image file",
            "@type": "IMAGE-DOWNSAMPLED",
            "@size": "34205",
            "@ref": "gr1",
            "@mimetype": "image/jpeg"
          },
          {
            "@category": "standard",
            "@height": "856",
            "@width": "376",
            "@_fa": "true",
            "$": "https://api.elsevier.com/content/object/eid/1-s2.0-S2468823117305965-gr2.jpg?httpAccept=%2A%2F%2A",
            "@multimediatype": "JPEG image file",
            "@type": "IMAGE-DOWNSAMPLED",
            "@size": "69053",
            "@ref": "gr2",
            "@mimetype": "image/jpeg"
          },
          {
            "@category": "standard",
            "@height": "431",
            "@width": "376",
            "@_fa": "true",
            "$": "https://api.elsevier.com/content/object/eid/1-s2.0-S2468823117305965-gr3.jpg?httpAccept=%2A%2F%2A",
            "@multimediatype": "JPEG image file",
            "@type": "IMAGE-DOWNSAMPLED",
            "@size": "35156",
            "@ref": "gr3",
            "@mimetype": "image/jpeg"
          },
          {
            "@category": "standard",
            "@height": "437",
            "@width": "376",
            "@_fa": "true",
            "$": "https://api.elsevier.com/content/object/eid/1-s2.0-S2468823117305965-gr4.jpg?httpAccept=%2A%2F%2A",
            "@multimediatype": "JPEG image file",
            "@type": "IMAGE-DOWNSAMPLED",
            "@size": "32255",
            "@ref": "gr4",
            "@mimetype": "image/jpeg"
          },
          {
            "@category": "standard",
            "@height": "372",
            "@width": "376",
            "@_fa": "true",
            "$": "https://api.elsevier.com/content/object/eid/1-s2.0-S2468823117305965-gr5.jpg?httpAccept=%2A%2F%2A",
            "@multimediatype": "JPEG image file",
            "@type": "IMAGE-DOWNSAMPLED",
            "@size": "25314",
            "@ref": "gr5",
            "@mimetype": "image/jpeg"
          },
          {
            "@category": "standard",
            "@height": "352",
            "@width": "376",
            "@_fa": "true",
            "$": "https://api.elsevier.com/content/object/eid/1-s2.0-S2468823117305965-gr6.jpg?httpAccept=%2A%2F%2A",
            "@multimediatype": "JPEG image file",
            "@type": "IMAGE-DOWNSAMPLED",
            "@size": "23573",
            "@ref": "gr6",
            "@mimetype": "image/jpeg"
          },
          {
            "@category": "standard",
            "@height": "370",
            "@width": "376",
            "@_fa": "true",
            "$": "https://api.elsevier.com/content/object/eid/1-s2.0-S2468823117305965-gr7.jpg?httpAccept=%2A%2F%2A",
            "@multimediatype": "JPEG image file",
            "@type": "IMAGE-DOWNSAMPLED",
            "@size": "21788",
            "@ref": "gr7",
            "@mimetype": "image/jpeg"
          },
          {
            "@category": "standard",
            "@height": "305",
            "@width": "489",
            "@_fa": "true",
            "$": "https://api.elsevier.com/content/object/eid/1-s2.0-S2468823117305965-sc1.jpg?httpAccept=%2A%2F%2A",
            "@multimediatype": "JPEG image file",
            "@type": "IMAGE-DOWNSAMPLED",
            "@size": "20865",
            "@ref": "sc1",
            "@mimetype": "image/jpeg"
          },
          {
            "@category": "standard",
            "@_fa": "true",
            "$": "https://api.elsevier.com/content/object/eid/1-s2.0-S2468823117305965-mmc1.docx?httpAccept=%2A%2F%2A",
            "@multimediatype": "Microsoft Word file",
            "@type": "APPLICATION",
            "@size": "2981408",
            "@ref": "mmc1",
            "@mimetype": "application/word"
          },
          {
            "@category": "thumbnail",
            "@height": "26",
            "@width": "372",
            "@_fa": "true",
            "$": "https://api.elsevier.com/content/object/eid/1-s2.0-S2468823117305965-si1.gif?httpAccept=%2A%2F%2A",
            "@multimediatype": "GIF image file",
            "@type": "ALTIMG",
            "@size": "1677",
            "@ref": "si1",
            "@mimetype": "image/gif"
          },
          {
            "@category": "thumbnail",
            "@height": "36",
            "@width": "293",
            "@_fa": "true",
            "$": "https://api.elsevier.com/content/object/eid/1-s2.0-S2468823117305965-si2.gif?httpAccept=%2A%2F%2A",
            "@multimediatype": "GIF image file",
            "@type": "ALTIMG",
            "@size": "1538",
            "@ref": "si2",
            "@mimetype": "image/gif"
          },
          {
            "@category": "thumbnail",
            "@height": "35",
            "@width": "262",
            "@_fa": "true",
            "$": "https://api.elsevier.com/content/object/eid/1-s2.0-S2468823117305965-si3.gif?httpAccept=%2A%2F%2A",
            "@multimediatype": "GIF image file",
            "@type": "ALTIMG",
            "@size": "1446",
            "@ref": "si3",
            "@mimetype": "image/gif"
          }
        ]
      },
      "link": {
        "@rel": "abstract",
        "@href": "https://api.elsevier.com/content/abstract/scopus_id/85039784404"
      }
    }
  }
}