{
  "metadata": {
    "title": "Boron oxide layer confinement engineering for enhanced catalytic activity and stability in Heck reaction",
    "authors": "; ; ",
    "journal": "Molecular Catalysis",
    "date": "2025-11-30",
    "doi": "10.1016/j.mcat.2025.115397",
    "abstract": "",
    "uri": "https://api.elsevier.com/content/article/pii/S246882312500584X",
    "pii": "S246882312500584X"
  },
  "fulltext": {
    "full-text-retrieval-response": {
      "scopus-eid": "2-s2.0-105012384768",
      "originalText": "serial JL 315758 291210 291744 291790 291809 31 Molecular Catalysis MOLECULARCATALYSIS 2025-08-06 2025-08-06 2025-08-06 2025-08-06 2025-09-12T11:56:17 1-s2.0-S246882312500584X S2468-8231(25)00584-X S246882312500584X 10.1016/j.mcat.2025.115397 S300 S300.1 FULL-TEXT 1-s2.0-S2468823125X00134 2025-09-12T11:06:16.182716Z 0 0 20251101 20251130 2025 2025-08-07T00:30:27.010491Z absattachment articleinfo articlenumber articletitlenorm authfirstinitialnorm authfirstsurnamenorm cid cids contenttype copyright crossmark dateloaded dateloadedtxt datesearch datesort dateupdated dco docsubtype doctype doi eid ewtransactionid hubeid indexeddate issn issnnorm itemstage itemtransactionid itemweight openaccess openarchive pg pgfirst pii piinorm pubdateend pubdatestart pubdatetxt pubyr sectiontitle sortorder srctitle srctitlenorm srctype ssids alllist content subj subheadings suppl tomb volfirst volissue volumelist webpdf webpdfpagecount yearnav figure table e-component body acknowledge affil appendices articletitle auth authfirstini authfull authkeywords authlast footnotes grantnumber grantsponsor highlightsabst orcid primabst pubtype ref specialabst 2468-8231 24688231 true 586 586 C Volume 586 7 115397 115397 115397 202511 November 2025 2025-11-01 2025-11-30 2025 Regular Papers article fla © 2025 Elsevier B.V. All rights are reserved, including those for text and data mining, AI training, and similar technologies. BORONOXIDELAYERCONFINEMENTENGINEERINGFORENHANCEDCATALYTICACTIVITYSTABILITYINHECKREACTION LEI F 1 Introduction 2 Results and discussion 2.1 Synthesis and characterization of Pd@BOx/BN hybrid materials 2.2 Investigation the heck reaction performance over Pd@BOx/BN hybrid catalysts 3 Conclusion CRediT authorship contribution statement Appendix Supplementary materials References LEE 2022 8758 8808 J LIU 2024 25 44 X MIECZYNSKA 2010 2166 2177 E DANIEL 2020 9926 9936 F FREDRICKS 2010 1467 1476 M ELUMALAI 2016 1344 1354 V CHEN 2024 e202300249 W GU 2019 669 683 Q GOLE 2016 2345 2354 B HAJIPOUR 2024 138156 A MERCADANTE 2022 A GAO 2022 e6541 T LUO 2021 197 206 Z KHALILI 2017 2674 2687 D CHAUDHARY 2024 112405 G LI 2024 139081 J LEI 2023 140542 F LAN 2024 115333 Y ZHANG 2021 130237 L PEI 2021 20 27 X XU 2024 7273 X ALI 2025 118442 S CHEN 2023 52 65 H LIU 2024 111410 H NACLERIO 2023 2207374 A SONG 2021 4187 4194 T DONG 2020 17167 17174 J WANG 2022 451 457 Y XU 2023 115094 Y PETRUCCI 2014 2813 2819 C GIACALONE 2016 F SARKAR 2017 103 110 S WU 2023 115121 Z ZHANG 2023 140592 H XIAO 2021 104843 J XIAO 2022 117053 J ZHOU 2012 5743 5748 P LUO 2021 3230 3238 Z BALINGE 2019 119017 K MAHMOUDI 2019 355 360 H FERNANDEZ 2019 1928 1940 E LEIX2025X115397 LEIX2025X115397XF 2027-08-06T00:00:00.000Z 2027-08-06T00:00:00.000Z http://creativecommons.org/licenses/by-nc-nd/4.0/ © 2025 Elsevier B.V. All rights are reserved, including those for text and data mining, AI training, and similar technologies. 2025-08-08T01:58:33.779Z http://vtw.elsevier.com/data/voc/AddOnTypes/50.7/aggregated-refined Scientific and Technological Innovation Team for Qinghai-Tibetan Plateau Research in Southwest Minzu University 2024CXTD15 SWUN Southwest Minzu University http://data.elsevier.com/vocabulary/SciValFunders/501100018927 http://sws.geonames.org/1814991/ Fundamental Research Funds for the Central Universities ZYN2024056 Fundamental Research Funds for the Central Universities http://data.elsevier.com/vocabulary/SciValFunders/501100012226 http://sws.geonames.org/1814991/ National Natural Science Foundation of China 21908183 32402907 NSFC National Natural Science Foundation of China http://data.elsevier.com/vocabulary/SciValFunders/501100001809 http://sws.geonames.org/1814991/ This work was supported by the National Natural Science Foundation of China (Nos. 21908183 , 32402907 ), Scientific and Technological Innovation Team for Qinghai-Tibetan Plateau Research in Southwest Minzu University (Grant No. 2024CXTD15 ), the Fundamental Research Funds for the Central Universities ( ZYN2024056 ), and \\u2018Weizhou Team\\u2019 Special Fund Project in Southwest Minzu University. The authors would like to thank Jin Dong ( www.sci-go.com ) for the XPS and TEM measurements. https://doi.org/10.15223/policy-017 https://doi.org/10.15223/policy-037 https://doi.org/10.15223/policy-012 https://doi.org/10.15223/policy-029 https://doi.org/10.15223/policy-004 item S2468-8231(25)00584-X S246882312500584X 1-s2.0-S246882312500584X 10.1016/j.mcat.2025.115397 315758 2025-09-12T11:06:16.182716Z 2025-11-01 2025-11-30 1-s2.0-S246882312500584X-main.pdf https://s3-eu-west-1.amazonaws.com/prod-ucs-content-store-eu-west/content/pii:S246882312500584X/MAIN/application/pdf/b36d008b7f4a94addaa338600f204015/main.pdf main.pdf pdf true 10059626 MAIN 10 1-s2.0-S246882312500584X-main_1.png https://s3-eu-west-1.amazonaws.com/prod-ucs-content-store-eu-west/content/pii:S246882312500584X/PREVIEW/image/png/22744dd4a9d8eda6a0a5201184a8c36d/main_1.png main_1.png png 58472 928 656 IMAGE-WEB-PDF 1 1-s2.0-S246882312500584X-gr1.jpg https://s3-eu-west-1.amazonaws.com/prod-ucs-content-store-eu-west/content/pii:S246882312500584X/gr1/DOWNSAMPLED/image/jpeg/8a85accdb586d3869c649dced90d640b/gr1.jpg gr1 gr1.jpg jpg 176684 583 753 IMAGE-DOWNSAMPLED 1-s2.0-S246882312500584X-gr3.jpg https://s3-eu-west-1.amazonaws.com/prod-ucs-content-store-eu-west/content/pii:S246882312500584X/gr3/DOWNSAMPLED/image/jpeg/7255cbccde052b7230f6af09795ceb20/gr3.jpg gr3 gr3.jpg jpg 148921 611 753 IMAGE-DOWNSAMPLED 1-s2.0-S246882312500584X-gr2.jpg https://s3-eu-west-1.amazonaws.com/prod-ucs-content-store-eu-west/content/pii:S246882312500584X/gr2/DOWNSAMPLED/image/jpeg/882a63a4ddad4b4c3772047b53b8b180/gr2.jpg gr2 gr2.jpg jpg 144910 496 508 IMAGE-DOWNSAMPLED 1-s2.0-S246882312500584X-ga1.jpg https://s3-eu-west-1.amazonaws.com/prod-ucs-content-store-eu-west/content/pii:S246882312500584X/ga1/DOWNSAMPLED/image/jpeg/965ab19876bdc57bb8684f0d18d1123f/ga1.jpg ga1 true ga1.jpg jpg 44311 200 324 IMAGE-DOWNSAMPLED 1-s2.0-S246882312500584X-gr8.jpg https://s3-eu-west-1.amazonaws.com/prod-ucs-content-store-eu-west/content/pii:S246882312500584X/gr8/DOWNSAMPLED/image/jpeg/5fa109a0d782d4c06c29924b61ba1528/gr8.jpg gr8 gr8.jpg jpg 105884 622 753 IMAGE-DOWNSAMPLED 1-s2.0-S246882312500584X-gr5.jpg https://s3-eu-west-1.amazonaws.com/prod-ucs-content-store-eu-west/content/pii:S246882312500584X/gr5/DOWNSAMPLED/image/jpeg/58d2d529b41a40de6da760b6f2d7afb4/gr5.jpg gr5 gr5.jpg jpg 109924 543 508 IMAGE-DOWNSAMPLED 1-s2.0-S246882312500584X-gr4.jpg https://s3-eu-west-1.amazonaws.com/prod-ucs-content-store-eu-west/content/pii:S246882312500584X/gr4/DOWNSAMPLED/image/jpeg/d6ab4b4d53e4e28856f20a729ac3b6e7/gr4.jpg gr4 gr4.jpg jpg 107107 617 753 IMAGE-DOWNSAMPLED 1-s2.0-S246882312500584X-gr7.jpg https://s3-eu-west-1.amazonaws.com/prod-ucs-content-store-eu-west/content/pii:S246882312500584X/gr7/DOWNSAMPLED/image/jpeg/bb2e785b0b9cea2ad85083fe1153035d/gr7.jpg gr7 gr7.jpg jpg 104173 612 753 IMAGE-DOWNSAMPLED 1-s2.0-S246882312500584X-gr6.jpg https://s3-eu-west-1.amazonaws.com/prod-ucs-content-store-eu-west/content/pii:S246882312500584X/gr6/DOWNSAMPLED/image/jpeg/044d68bc4db1456c1168812d6d1c153c/gr6.jpg gr6 gr6.jpg jpg 58946 321 565 IMAGE-DOWNSAMPLED 1-s2.0-S246882312500584X-gr1.sml https://s3-eu-west-1.amazonaws.com/prod-ucs-content-store-eu-west/content/pii:S246882312500584X/gr1/THUMBNAIL/image/gif/b367054b2a1bdf0132e82d76958cc782/gr1.sml gr1 gr1.sml sml 18675 164 212 IMAGE-THUMBNAIL 1-s2.0-S246882312500584X-gr3.sml https://s3-eu-west-1.amazonaws.com/prod-ucs-content-store-eu-west/content/pii:S246882312500584X/gr3/THUMBNAIL/image/gif/b9068497b6f4fbfc9d351bfc457a2c61/gr3.sml gr3 gr3.sml sml 18285 164 202 IMAGE-THUMBNAIL 1-s2.0-S246882312500584X-gr2.sml https://s3-eu-west-1.amazonaws.com/prod-ucs-content-store-eu-west/content/pii:S246882312500584X/gr2/THUMBNAIL/image/gif/1d990427b7ae7b6231e405dd57496e32/gr2.sml gr2 gr2.sml sml 21594 164 168 IMAGE-THUMBNAIL 1-s2.0-S246882312500584X-ga1.sml https://s3-eu-west-1.amazonaws.com/prod-ucs-content-store-eu-west/content/pii:S246882312500584X/ga1/THUMBNAIL/image/gif/15b89ea90b48cd809fce071d113ad796/ga1.sml ga1 true ga1.sml sml 17005 135 219 IMAGE-THUMBNAIL 1-s2.0-S246882312500584X-gr8.sml https://s3-eu-west-1.amazonaws.com/prod-ucs-content-store-eu-west/content/pii:S246882312500584X/gr8/THUMBNAIL/image/gif/509eceb1f7ed490ea011b7ae962406ce/gr8.sml gr8 gr8.sml sml 10584 163 198 IMAGE-THUMBNAIL 1-s2.0-S246882312500584X-gr5.sml https://s3-eu-west-1.amazonaws.com/prod-ucs-content-store-eu-west/content/pii:S246882312500584X/gr5/THUMBNAIL/image/gif/8a2c698f6cb26a06515b2d4bb5566e21/gr5.sml gr5 gr5.sml sml 16235 163 153 IMAGE-THUMBNAIL 1-s2.0-S246882312500584X-gr4.sml https://s3-eu-west-1.amazonaws.com/prod-ucs-content-store-eu-west/content/pii:S246882312500584X/gr4/THUMBNAIL/image/gif/a49366720258ba11afb61b874e7ab74e/gr4.sml gr4 gr4.sml sml 12751 164 200 IMAGE-THUMBNAIL 1-s2.0-S246882312500584X-gr7.sml https://s3-eu-west-1.amazonaws.com/prod-ucs-content-store-eu-west/content/pii:S246882312500584X/gr7/THUMBNAIL/image/gif/23db7c3e10e4f72e221f24ac121ae1cd/gr7.sml gr7 gr7.sml sml 10742 164 202 IMAGE-THUMBNAIL 1-s2.0-S246882312500584X-gr6.sml https://s3-eu-west-1.amazonaws.com/prod-ucs-content-store-eu-west/content/pii:S246882312500584X/gr6/THUMBNAIL/image/gif/f21883b646e868fb4aead81a3331f971/gr6.sml gr6 gr6.sml sml 10914 124 219 IMAGE-THUMBNAIL 1-s2.0-S246882312500584X-gr1_lrg.jpg https://s3-eu-west-1.amazonaws.com/prod-ucs-content-store-eu-west/content/pii:S246882312500584X/HIGHRES/image/jpeg/9fa8dac98d2918c0599cbab2e7c715ea/gr1_lrg.jpg gr1 gr1_lrg.jpg jpg 1235041 2579 3333 IMAGE-HIGH-RES 1-s2.0-S246882312500584X-gr3_lrg.jpg https://s3-eu-west-1.amazonaws.com/prod-ucs-content-store-eu-west/content/pii:S246882312500584X/HIGHRES/image/jpeg/f1d6142aa18738b361f4d5eee19982b4/gr3_lrg.jpg gr3 gr3_lrg.jpg jpg 942591 2703 3333 IMAGE-HIGH-RES 1-s2.0-S246882312500584X-gr2_lrg.jpg https://s3-eu-west-1.amazonaws.com/prod-ucs-content-store-eu-west/content/pii:S246882312500584X/HIGHRES/image/jpeg/9437a097207c4852368452ec28fc8e4e/gr2_lrg.jpg gr2 gr2_lrg.jpg jpg 1210260 2195 2250 IMAGE-HIGH-RES 1-s2.0-S246882312500584X-ga1_lrg.jpg https://s3-eu-west-1.amazonaws.com/prod-ucs-content-store-eu-west/content/pii:S246882312500584X/HIGHRES/image/jpeg/d87bb7ff16c74819b5ed24279628967a/ga1_lrg.jpg ga1 true ga1_lrg.jpg jpg 375276 886 1435 IMAGE-HIGH-RES 1-s2.0-S246882312500584X-gr8_lrg.jpg https://s3-eu-west-1.amazonaws.com/prod-ucs-content-store-eu-west/content/pii:S246882312500584X/HIGHRES/image/jpeg/6fc68d638acad705ac0e4fcd70c4d7ad/gr8_lrg.jpg gr8 gr8_lrg.jpg jpg 606845 2751 3333 IMAGE-HIGH-RES 1-s2.0-S246882312500584X-gr5_lrg.jpg https://s3-eu-west-1.amazonaws.com/prod-ucs-content-store-eu-west/content/pii:S246882312500584X/HIGHRES/image/jpeg/e5299e37163fae60b8b8381f0173fbac/gr5_lrg.jpg gr5 gr5_lrg.jpg jpg 754832 2404 2250 IMAGE-HIGH-RES 1-s2.0-S246882312500584X-gr4_lrg.jpg https://s3-eu-west-1.amazonaws.com/prod-ucs-content-store-eu-west/content/pii:S246882312500584X/HIGHRES/image/jpeg/9cf3a2d88145678093a71923f90bb316/gr4_lrg.jpg gr4 gr4_lrg.jpg jpg 622440 2733 3333 IMAGE-HIGH-RES 1-s2.0-S246882312500584X-gr7_lrg.jpg https://s3-eu-west-1.amazonaws.com/prod-ucs-content-store-eu-west/content/pii:S246882312500584X/HIGHRES/image/jpeg/343f151639050721d8d71370dd22578e/gr7_lrg.jpg gr7 gr7_lrg.jpg jpg 589750 2708 3333 IMAGE-HIGH-RES 1-s2.0-S246882312500584X-gr6_lrg.jpg https://s3-eu-west-1.amazonaws.com/prod-ucs-content-store-eu-west/content/pii:S246882312500584X/HIGHRES/image/jpeg/29f065ee9c7fc611702e82a3ff63b169/gr6_lrg.jpg gr6 gr6_lrg.jpg jpg 310749 1421 2500 IMAGE-HIGH-RES 1-s2.0-S246882312500584X-mmc1.docx https://s3-eu-west-1.amazonaws.com/prod-ucs-content-store-eu-west/content/pii:S246882312500584X/mmc1/MAIN/application/vnd.openxmlformats-officedocument.wordprocessingml.document/bc0e57fe78fe0b23a4dc41e1a94e551e/mmc1.docx mmc1 mmc1.docx docx 7825613 APPLICATION MCAT 115397 115397 S2468-8231(25)00584-X 10.1016/j.mcat.2025.115397 Elsevier B.V. Fig. 1 (a) A schematic illustration of the synthesis procedure of Pd@BOx/BN materials. (b) XRD patterns of PdO/BOx/BN, (c) B 1 s, C 1 s, N 1 s, O 1 s, Pd 3d XPS profiles, (d) TEM images, (e) H2-TPR profile, and (f - g) H2-TPR-MS profiles of PdO/BOx/BN heterostructure materia ls. Fig. 1 Fig. 2 (a) XRD patterns of Pd@BO x /BN-RT catalysts. TEM images and palladium particle size distribution of (b) Pd@BO x /BN-R450, (c) Pd@BO x /BN-R600, and (d) Pd@BO x /BN-R700 catalysts. Fig. 2 Fig. 3 (a) B 1 s, (b) Pd 3d, (c) N 1 s, and (d) O 1 s XPS profiles of the representative catalysts (Pd@BO x /BN-R450, Pd@BO x /BN-R600, and Pd@BO x /BN-R700 catalysts). Fig. 3 Fig. 4 (a, b) Catalytic activities of PdO/BO x /BN and Pd@BO x /BN-RT catalysts in Heck reaction between iodobenzene (IB) and methyl acrylate (MA). (c) The relationship between Pd0 ratio and initial reaction rate over the PdO/BO x /BN and Pd@BO x /BN-RT catalysts. (d) Time-conversion plots of IB and MA over Pd@BO x /BN-R600 catalyst. Fig. 4 Fig. 5 TEM images and palladium particle size distributions of (a) Pd@BOx/BN-R700 and (b) Pd@BOx/BN-R700-W. Time-conversion plots of IB and MA over (c) Pd@BO x /BN-R700 and (d) Pd@BO x /BN-R700-W catalysts. Fig. 5 Fig. 6 Reusability of MA and IB in Pd@BOx/BN-R700-W catalyst in Heck reaction. Fig. 6 Fig. 7 Heck reaction activities of MA and 4-substituted IBs over Pd@BOx/BN-R700-W and Pd@BOx/BN-R700 catalysts. Fig. 7 Fig. 8 Heck reaction scope of styrene and 4-substituted IBs and over Pd@BOx/BN-R700-W and Pd@BOx/BN-R700 catalysts. Fig. 8 Table 1 Comparison of several palladium-based catalysts for the Heck reaction. Table 1 Entry Catalyst/ cat. Amount Solvent PhI (mmol) Temp ( °C) Time (h) Conv. ( %)a / Yield ( %)b Run TOF (h−1)c/ TONd Ref 1 SIILP Pd-catalysts/ 0.1 mol % CH3CN+H2O 1 130 2 100 a 4 4000d [30] 2 SWCNT-PAMAM3.0-Pd/ 0.1 mol % DMF+H2O 0.5 90 5 99 b 6 10000d [31] 3 Pd(II) complex 3/ 0.03 mol % DMF 1 130 5 93b 7 92000d [32] 4 PANPALF-Pd/ 0.05 mol % none 1 120 0.33 99b 11 89000d [33] 5 PANbis(NHC)-PdF/ 0.1 mol % none 1 120 0.33 99b 20 990d [34] 6 PANPhenF-Pd/ 0.1 mol % none 1 110 3 91b 6 970d [35] 7 PANGQAF-Pd/ 0.02 mol % none 1 120 2 98b 10 4900d [36] 8 Pd/BC/ 0.1 mol % DMF 1 120 8 94 b 5 470c [37] 9 Pd-in-CNT/ 0.1 mol % DMF 5 100 0.5 92.3 a 2 1846c [38] 10 Pd@NC/ 2 mg DMF 1 100 1 60.8 a 2 4659c [20] 11 Pd/CNTs-PDA/ 0.15 mol % DMF 1 100 1 91.2b 5 608c [13] 12 PS-Pd-Salen/ 10 mg DMF 1 110 10 79 b 5 138c [39] 13 Pd(II)-POLI-TAG/ 0.1 mol % DMF 1 130 2 99 a 5 487c [40] 14 Pd/EVOH/ 0.1 mol % NMP 1 135 2 100a – 1200c [41] 15 Pd/NC-650/ 0.09 mol % DMF 5 100 6 82b 7 1662c [16] 16 Pd/PDA-0 h/ 0.1 mol % DMF 1 100 0.16 26.3b 9 1374c [18] 17 Pd@MOF-APBA/ 0.5 mol % MeCN 0.1 120 8 99b 4 [21] 18 Pd@BO x /BN-R700-W/0.02 mol % DMF 5 100 0.16 36.3a 14 4196c This work Research Paper Boron oxide layer confinement engineering for enhanced catalytic activity and stability in Heck reaction Fukun Lei Formal analysis Data curation a 1 Zisheng Xu Investigation a 1 Jiayi Li Methodology a Lu Wang Resources b ⁎ Yuan Liu Validation b Maofei Ran Project administration a Tao Dai Writing – review & editing Writing – original draft Visualization Conceptualization a b ⁎ a Key Laboratory of General Chemistry of the National Ethnic Affairs Commission, School of Chemistry and Environment, Southwest Minzu University, Chengdu 610041, China Key Laboratory of General Chemistry of the National Ethnic Affairs Commission, School of Chemistry and Environment Southwest Minzu University Chengdu 610041 China aKey Laboratory of General Chemistry of the National Ethnic Affairs Commission, School of Chemistry and Environment, Southwest Minzu University, Chengdu 610041, China b Institute of Qinghai-Tibetan Plateau, Southwest Minzu University, Chengdu 610041, China Institute of Qinghai-Tibetan Plateau Southwest Minzu University Chengdu 610041 China bInstitute of Qinghai-Tibetan Plateau, Southwest Minzu University, Chengdu 610041, China ⁎ Corresponding authors. 1 These authors contributed equally to this work. The confinement effect of the boron oxide layer has attracted significant attention in the field of heterogeneous catalysis. In this study, we introduce a strategically designed Pd@boron oxide-boron nitride hybrid (Pd@BOₓ/BN) catalyst, synthesized via pyrolysis, impregnation, reduction, and water treatment processes, for catalyzing the Heck reaction. Structural analyses reveal highly dispersed Pd nanoparticles encapsulated by tunable BOₓ layers, with phase transitions (NH4B5O8 → H3BO3 → BOₓ) occurring during hydrogen reduction. Increasing the reduction temperature from 450 °C to 700 °C resulted in the formation of thicker BOₓ layers, while water treatment partially removed the surface BOₓ. The post-water treatment catalyst (Pd@BOₓ/BN-R700-W) exhibited activity 5.8 and 17.5 times higher than those of Pd@BOₓ/BN-R600 and untreated Pd@BOₓ/BN-R700 in the Heck reaction, respectively. This enhanced activity is attributed to the optimized BOₓ layer thickness and confinement effects. Furthermore, comprehensive evaluations of the substrate scope demonstrated that Pd@BOₓ/BN-R700-W exhibited superior catalytic activity compared to other catalysts. This is accompanied by notable stability and reusability, as evidenced by a yield retention exceeding 93 % after fourteen cycles and minimal palladium leaching of 0.13 %. This study underscores the efficacy of BOₓ layers confinement engineering as a robust approach for developing durable and highly efficient catalysts in Heck coupling reactions. Graphical abstract Image, graphical abstract Keywords Boron oxide layers Confinement effect Heck reaction Pd nanoparticles Data availability Data will be made available on request. 1 Introduction Catalysts play a crucial role in contemporary industrial processes, with approximately 80 % of these processes utilizing catalytic systems to enhance reaction rates [1,2]. Homogeneous palladium complexes including Pd(OAc)₂ [3,4] and Pd(PPh₃)₄ [5,6] have demonstrated efficacy in conventional Heck coupling reactions. However, they face significant challenges related to separation, metal leaching, recyclability, and long-term stability [7,8]. In response, heterogeneous catalysis has emerged as a promising alternative, employing supports such as metal-organic frameworks (MOFs) [9,10], carbon nanotubes [11–14], silica [15], and others [16,17] to stabilize palladium nanoparticles, thereby improving reusability while maintaining catalytic activity. Nonetheless, the aggregation of Pd nanoparticles during Heck reactions frequently results in catalyst deactivation, necessitating the development of alternative strategies to address this critical issue [18–20]. Recent research has concentrated on engineering high-performance heterogeneous Pd catalysts, such as Pd@MOF-APBA [21], where N,N'-bidentate APBA ligands effectively prevent nanoparticle aggregation. This catalyst exhibited outstanding catalytic performance in Heck reactions, achieving a high turnover numbers (TON) exceeding 95,000, with reduced metal leaching (4.8 ppm) and sustained activity over four recycling cycles. Despite significant advancements in heterogeneous Heck catalysis, the ongoing challenge of palladium nanoparticle aggregation under stringent reaction conditions remains, highlighting the necessity for advanced stabilization strategies to maintain nanoparticle dispersion and enhance catalytic performance. Hexagonal boron nitride (h-BN), commonly referred to as \"white graphene,\" is characterized by alternating boron and nitrogen atoms configured in a layered honeycomb lattice, offering distinct advantages for catalytic applications [22,23]. This material exhibits a combination of strong in-plane covalent B-N bonds and interlayer van der Waals interactions, facilitating the creation of a robust and tunable support framework. Recent studies have demonstrated that strong metal-support interactions (SMSI) between h-BN supports and metal nanoparticles can significantly enhance catalytic stability and activity by altering the electronic structure of the metal and generating interfacial active sites [24–27]. Notably, the formation of boron oxide (BOx) layers on metal surfaces has been shown to promote catalytic reactions such as oxidative dehydrogenation and dry reforming of methane [28,29]. Additionally, the permeable nature of BOx layers allows reactant molecules to access the active surface, thereby improving reaction efficiency. Despite these promising developments, the exploration of new catalytic systems utilizing BOx layers encapsulated Pd catalysts to enhance catalytic activity and reusability in the Heck reaction remains limited. In this study, we developed catalysts with boron oxide (BOx) layers encapsulating Pd nanoparticles, denoted as Pd@BOx/BN structures. We systematically investigated the Heck reaction involving various substituted iodobenzenes with methyl acrylate and styrene using these catalysts. The Pd@BOx/BN-R700-W catalyst demonstrated significantly superior catalytic performance and excellent reusability compared to other representative catalysts in Heck reactions. These findings underscore the potential of BOx-encapsulated Pd catalysts as a promising platform for improving both catalytic efficiency and recyclability in Heck reactions. Furthermore, this work establishes a new paradigm for designing durable, high-performance heterogeneous catalysts through controlled BOx layers encapsulation engineering, with broad implications for sustainable pharmaceutical synthesis and fine chemical production. 2 Results and discussion 2.1 Synthesis and characterization of Pd@BOx/BN hybrid materials The Pd@boron oxide-boron nitride hybrid materials (Pd@BOx/BN) were successfully synthesized through a combined pyrolysis and wet impregnation approach, utilizing porous boron nitride (PBN) as the support matrix, followed by controlled thermal processing. Fig. 1 a provides a schematic representation of the synthesis procedure, which involves the impregnation of palladium chloride, subsequent air calcination at 200 °C, hydrogen reduction, and water treatment. As depicted in Fig. 1b, the XRD pattern reveals characteristic peaks corresponding to the (002) and (101) crystal planes of boron nitride at 2θ values of 25.7° and 42.4° (PDF#45-1171), respectively. Additionally, peaks at 2θ values of 25.1°, 26.3°, and 31.5° (PDF#31-0043) are attributed to the (202), (212), and (040) crystal planes of the NH4B5O8 crystal. TEM analysis, as shown in Fig. 1c, further confirms the high dispersion of palladium particles on the support. XPS analysis in Fig. 1d indicates the absence of zero-valence Pd species, likely due to the fact that PdCl2, when loaded onto the PBN surface and subjected to calcination in air at 200 °C, did not convert into metallic Pd. Hydrogen temperature-programmed reduction-mass spectrometry (H2-TPR-MS) analyses were performed on PdO/BOx/BN sample. Fig. 1e presents the H2-TPR spectrum of PdO/BOx/BN sample, revealing distinct temperature-dependent H2 consumption peaks that correspond to five reduction processes occurring at 258 °C, 349 °C, 414 °C, 676 °C, and 742 °C, respectively. Mass spectrometry data (Fig. 1f and g) indicate that the signals observed near 248 °C can be attributed to the formation of ammonia and water. The signals detected between 550–590 °C are associated with the production of CO and CH4, while those above 700 °C correspond to CO2 generation. Consequently, the PdCl2/PBN materials developed a PdO/BOx/BN hybrid structure following pretreatment in air at 200 °C. The relative surface elemental compositions of B 1 s, C 1 s, N 1 s, O 1 s, Pd 3d are detailed in Tables S1 and S2. To investigate the structural changes of the Pd@BO x /BN-RT catalysts during the reduction process, we characterized their textural properties of the Pd@BO x /BN-RT using X-ray diffraction (XRD), scanning electron microscopy (SEM), and transmission electron microscopy (TEM) analyses (Figs. 2 and S1–S4). The XRD analysis identified the presence of weak characteristic peaks associated with palladium, indicating that the palladium nanoparticles were either highly dispersed or encapsulated by H3BO3 and NH4B5O8 species (Fig. 2a). In the Pd@BOx/BN-R450 and Pd@BOx/BN-R600 catalysts, characteristic peaks corresponding to the (202) plane of NH4B5O8 were observed. Additionally, a characteristic peak corresponding to the (002) plane of boric acid (H3BO3) was detected in the XRD spectrum of Pd@BOx/BN-R600. Upon increasing the reduction temperature to 700 °C (Pd@BOx/BN-R700), the characteristic peaks of NH4B5O8 disappeared, and only those corresponding to the H3BO3 or BOx were observed in the XRD spectrum of the sample. These XRD results suggest that phase transformations occurred on the surface of Pd@BOx/BN during the reduction process, with BOx emerging as the predominant surface phase following reduction. The combined findings from XRD and H2-TPR analyses indicate a phase transition sequence (NH4B5O8 to H3BO3 and to BOx) within the sample during hydrogen reduction. The SEM images further revealed that an increase in the reduction temperature resulted in enhanced crystallinity of the Pd@BOx/BN-RT catalysts (Fig. S1). TEM was utilized to characterize the synthesized Pd NPs supported on Pd@BO x /BN-R450, Pd@BO x /BN-R600, and Pd@BO x /BN-R700 catalysts (Figs. 2b–d and S2-S4). The TEM images reveal that the majority of the Pd NPs exhibit an ellipsoidal morphology, as depicted in Fig. 2b–d A comprehensive particle analysis, conducted on multiple TEM images from various regions of these catalysts, confirmed that the Pd NPs predominantly have mean diameters of 4.80 nm for Pd@BO x /BN-R450, 4.52 nm for Pd@BO x /BN-R600, and 4.59 nm for Pd@BO x /BN-R700 catalyst, respectively. Notably, an increase in the reduction temperature did not lead to a significant enlargement in the size of Pd NPs. A novel and intriguing observation is that the in-situ synthesized Pd@BO x /BN-R600 and Pd@BO x /BN-R700 are encapsulated with a minimal number of BOx layers (Figs. S2 and S3), unlike the Pd@BO x /BN-R450 catalyst, which lacks such encapsulation. Furthermore, as the reduction temperature increased, the number of BOx layers in Pd@BO x /BN-R700 surpassed that in Pd@BOx/BN-R600. With an increase in reduction temperature, a significant rise in the number of BO x layers was observed in Pd@BO x /BN-R700 compared to the Pd@BO x /BN-R600, indicating a temperature-dependent enhancement in layer integration. Crystallographic analysis, as illustrated in Figs. S2 and S3, revealed lattice spacing for palladium at 0.213 nm and 0.238 nm, while the boron oxide (BO x ) layers extended to 0.334 nm and 0.346 nm. This observation clearly indicated the presence of BO x layers enveloping the active palladium center, suggesting a potential structural configuration that may influence catalytic performance. STEM and line-EDS analyses confirmed the presence of trace amounts of BO x layers on the surface of Pd@BO x /BN-R600 catalyst (Fig. S4b and c). The surface characteristics of these catalysts were further examined using X-ray photoelectron spectroscopy (XPS), as detailed in Fig. 3 . The spectra distinctly revealed characteristic peaks corresponding to palladium (Pd), boron (B), nitrogen (N), and oxygen (O). The N 1 s XPS spectrum of the Pd catalyst exhibited peaks at 398.3 eV and 400.1 eV, attributable to B-N bonds and other nitrogen species. Simultaneously, the B 1 s XPS spectrum exhibited peaks at 190.7 eV, 192.3 eV, and 193.6 eV, which correspond to B-N, B-OH, and BO x species, respectively. Upon examining the O 1 s XPS spectrum, a notable increase in the intensity of the BO x peaks was observed with the elevation of the reduction temperature, suggesting a correlation between the boron oxide layer content and the reduction conditions. These findings confirmed the presence of boron oxide in the Pd@BOx/BN-R450, Pd@BOx/BN-R600, and Pd@BOx/BN-R700 catalysts. The Pd 3d XPS spectrum was deconvoluted into three distinct peaks, with a principal peak at 335 eV in the Pd@BOx/BN-R450, Pd@BOx/BN-R600, and Pd@BOx/BN-R700 catalysts. This observation indicates the coexistence of supported Pd (0) species, as illustrated in Fig. 2b The binding energy of Pd 3d in the catalysts was measured at 336.4 eV, indicative of oxidized Pd (II) species. Peaks above 338.3 eV in the Pd 3d spectrum corroborate the formation of Pd (IV) complexes. Therefore, the encapsulation of Pd species by boron oxide (BO x ) layers may potentially influence the catalyst's activity and stability in Heck reaction. 2.2 Investigation the heck reaction performance over Pd@BOx/BN hybrid catalysts To investigate the effect of reduction temperature on the BO x layers encapsulated Pd particles, the catalytic performance of PdO/BO x /BN and Pd@BO x /BN-RT catalysts were assessed in the Heck reaction between iodobenzene (IB) and methyl acrylate (MA), as depicted in Fig. 4 a. The reaction was conducted using 10 mg of each catalyst in 10 mL of dimethylformamide (DMF) containing IB (5 mmol) and MA (7.5 mmol) under atmospheric pressure. The conversion of IB over Pd@BO x /BN-R600 catalyst reached 0.33 mol·L−1·min−1 within 60 min at 100 °C, outperforming the Pd@BO x /BN-R450 catalyst (0.05 mol·L−1·min−1) and Pd@BO x /BN-R700 (0.065 mol·L−1·min−1). The PdO/BO x /BN catalyst did not catalyze the Heck reaction during the initial three hours. As the reduction temperature increased, the reaction rate initially increased and then decreased. This trend suggests that an optimal thickness of boron oxide layers enhances the reaction, whereas either excessive or insufficient thickness impedes it. A control experiment using pure NC support showed no conversion, indicating the necessity of Pd species for the Heck reaction. The conversion of IB over the Pd@BO x /BN-R600 catalyst (30 mg) reached up to 14 % within 20 min at 100 °C, surpassing the performance of the Pd@BO x /BN-R600 catalyst (10 mg, 60 min with conversion 9.2 %), as illustrated in Fig. 4b The average turnover frequency (ATOF) of Pd@BO x /BN-R600 catalyst (30 mg) is 776 h−1, while the ATOF for Pd@BO x /BN-R600 catalyst (10 mg) is 498 h−1. The size distribution of these catalysts was found to be similar (Fig. 2), suggesting that Pd@BOx/BN-R450, Pd@BOx/BN-R600, and Pd@BOx/BN-R700 likely exhibit comparable dispersion of Pd nanoparticles. A positive correlation is observed between the reaction rate of the Heck reaction and the surface concentration of zero-valent palladium (Fig. 4c). The catalytic activity of the Heck reaction increases with a higher content of Pd (0) species. Time-conversion plots for the Heck reaction of IB and MA were analyzed at various temperatures, as shown in Fig. 4d The reaction of IB over Pd@BO x /BN-R600 achieved a conversion rate of 0.33 mol·L−1·min−1 within 60 min at 100 °C, outperforming the conversion rates of 0.13 mol·L−1·min−1 within 60 min at 90 °C and 0.055 mol·L−1·min−1 within 60 min at 80 °C. These comparisons indicate that the surface boron oxide layers significantly accelerate the Heck reaction. To further elucidate the impact of boron oxide layer thickness on the Heck reaction, we employed a catalyst with relatively lower activity, which reduction at 700 °C (Pd@BOx/BN-R700) and was characterized by a thicker boron oxide layer (Fig. S2). This surface of this catalyst was partially stripped of its boron oxide layer through water treatment (Figs. S6 and S7). STEM analysis revealed a reduction in the number of boron oxide layers on the catalyst surface post-water treatment (Pd@BOx/BN-R700-W). Furthermore, line-EDS data corroborated the thinning of the boron oxide layers on the catalyst surface following water treatment (Fig. S7). The results form BET (Fig. S8), XPS (Fig. S9), and XRD (Fig. S10) analyses corroborate the finding that water treatment results in a reduction of boron oxide layers on the catalyst surface. We investigated the time-conversion plots for the Heck reaction of IB and MA using these catalysts at various temperatures (Fig. 5 c and d and S11). Notably, the reaction of IB over Pd@BOx/BN-R700-W achieved an initial rate of 1.14 mol·L−1·min−1 within 10 min, significantly surpassing the 0.065 mol·L−1·min−1 rate observed within 60 min for the Pd@BOx/BN-R700 catalyst. These findings underscore the substantial influence of boron oxide layer thickness on the activity of the Heck reaction, indicating that palladium-based catalysts with an optimized boron oxide layers can enhance the reaction rate. To investigate the influence of the boron oxide layers on the stability and reusability of catalysts, we conducted thermal filtration and reusability experiments on the Pd@BOx/BN-R600 and Pd@BOx/BN-R700-W catalysts (Figs. 6 and S12). Notably, the Pd@BOx/BN-R600 catalyst yielded only 20 % of methyl cinnamate following a 30-minute thermal filtration test (Fig. S12a). The conversion of the Heck reaction decreased from 99 % in the initial use to 81 % in the seventh cycle, suggesting a certain degree of stability and reusability on Pd@BOx/BN-R600 catalyst, albeit suboptimal. By modifying the thickness of the boron oxide layers, the catalytic activity was significantly enhanced (Fig. S11). Consequently, we explored whether the stability of the catalyst could also be improved by modulating the boron oxide layers thickness. In this context, we evaluated the stability of the Pd@BOx/BN-R700-W catalyst, as illustrated in Fig. 6. Remarkably, after 14 cycles of reuse, the reaction conversion remained high at 93 %, with the catalyst demonstrating an average palladium leaching of only 0.13 %. The findings indicate that by precisely adjusting the thickness of the boron oxide layer on the catalyst surface through reduction and water treatment, the activity and stability of the Pd@BOx/BN-R700-W catalyst can be significantly improved. Post-reaction characterization of the spent catalyst was conducted using electron microscopy, revealing a slight increase in the size of the palladium particles. Line scanning analyses demonstrated that the spent catalyst possessed only a few layers of boron oxide on the outer surface of the palladium particles. This thin boron oxide layer enhances the catalyst's activity and stability via a confinement effect. Consequently, it can be inferred that Pd@BOx/BN-R700-W exhibits superior catalytic activity compared to Pd@BOx/BN-R700, thereby confirming that the confinement effect can accelerate chemical reactions and enhance both catalyst activity and stability. Subsequently, the confinement effects of Pd@BOx/BN-R700-W and Pd@BOx/BN-R700 catalysts were investigated using 4-substituted IBs and MA. The results demonstrated that Pd@BOx/BN-R700-W exhibited higher activity than Pd@BOx/BN-R700 during the Heck reaction for the majority of the substrates, as illustrated in Figs. 7 a–f and S15. The average turnover frequency (ATOF) value for para-fluorine-substituted IB with MA over Pd@BOx/BN-R700-W was 1283 h−1, in contrast to a significantly lower value of 474 h−1 observed with the Pd@BOx/BN-R700 (Fig. S15, p-F-IB). Consequently, the ATOF value for para-F-IB and MA over Pd@BOx/BN-R700-W was 2.7 times higher than that over Pd@BOx/BN-R700. As depicted in Fig. 7d, the reaction conversion for IB and MA over Pd@BOx/BN-R700-W was also much higher than that over Pd@BOx/BN-R700. Specifically, the ATOF value for IB and MA over Pd@BOx/BN-R700-W was 4196 h−1, whereas it was only 240 h−1 over Pd@BOx/BN-R700, indicating a 17.5-fold increase. The average TOF values for various para-substituted IBs and MA are shown in Fig. S11. The ATOF values for these substrates, namely, p-F (Fig. 7(a)), p-Cl (Fig. 7(b)), p-Br (Fig. 7(c)), p-H (Fig. 7(d)), p-CH3 (Fig. 7(e)), and, p–OCH3 (Fig. 7(f))) over Pd@BOx/BN-R700W were 1283, 1608, 1528, 4196, 2034, and 2128 h−1, respectively. In contrast, their ATOF values over Pd@BOx/BN-R700 were 474, 569, 498, 240, 298, and 307 h−1, respectively. Thus, the ATOF values over Pd@BOx/BN-R700-W were 2.7, 2.8, 3.1, 17.5, 6.8, and 6.9 times higher, than those over Pd@BOx/BN-R700, respectively. To evaluate the scope of the confinement effect of boron oxide layers in Pd@BOx/BN-R700-W and Pd@BOx/BN-R700 catalysts during the Heck reaction of between various 4-substituted IBs and styrene, the catalytic performances of the two catalysts were systematically investigated. The findings, presented in Figs. 8 and S16, reveal that the ATOF value for the reaction of para-F-IB and styrene over Pd@BOx/BN-R700-W was 694 h−1, surpassing the 498 h−1 observed for Pd@BOx/BN-R700. The ATOF values for the Heck reaction over Pd@BOx/BN-R700-W and Pd@BOx/BN-R700 followed the sequence: para-Cl (819 and 340 h−1, respectively), para-Br (742 and 293 h−1, respectively), para-H (363 and 58 h−1, respectively), para–OCH3 (604 and 293 h−1, respectively), and para-CH3 (618 and 277 h−1, respectively). These results demonstrated that Pd@BOx/BN-R700-W exhibits superior performance compared to Pd@BOx/BN-R700 in the Heck reaction of the para-substituted IBs and styrene. The observed differences in the catalytic performances between Pd@BOx/BN-R700-W and Pd@BOx/BN-R700 can likely be attributed to variations in their electronic properties and steric hindrance effects. Additionally, we have substantiated the efficacy of Pd@BOx/BN-R700-W in catalyzing the Heck reaction across a broad range of substrates, including aromatic bromides with alkenes, as detailed in Table S3. Moreover, the catalytic performance of Pd@BOx/BN-R700-W and Pd@BOx/BN-R700 was further validated in other Pd-based reactions, such as the hydrogenation of nitrobenzene and benzaldehyde, as well as the Ullmann reaction, as illustrated in Fig. S17. Some related works have been cited to further demonstrated that Pd@BOx/BN-R700-W has excellent performance and reusability in Heck reaction, as displayed in Table 1 . Furthermore, all the results indicated that the confinement of the palladium nanoparticles within the optimal boron oxide layers accelerated the Heck reaction. 3 Conclusion In conclusion, we have developed a straightforward synthesis method utilizing a calcination-reduction-leaching strategy to immobilize Pd nanoparticles within boron oxide layers, thereby enabling the controlled preparation of Pd@BOₓ/BN hybrid catalysts. A range of characterization techniques, including Transmission Electron Microscopy (TEM) and X-ray Photoelectron Spectroscopy (XPS) were employed to verify that the Pd nanoparticles were highly dispersed on the boron nitride (BN) support, with the average particle size remaining relatively constant despite variations in reduction temperature (Pd@BOx/BN-R450: 4.80 nm, Pd@BOx/BN-R600: 4.52 nm, Pd@BOx/BN-R700: 4.59 nm, and Pd@BOx/BN-R700-W: 4.44 nm). TEM and XPS analyses further confirmed the presence of a few layers of boron oxide-encapsulated palladium nanoparticles in the Pd@BOₓ/BN-R600, Pd@BOₓ/BN-R700 and Pd@BOₓ/BN-700-W catalysts. We conducted a systematic evaluation of the influence of boron oxide layers on the catalytic performance in Heck reactions, revealing that the Pd@BOₓ/BN-R600 catalyst exhibited the highest initial reaction rate (0.33 mol L−1·min−1), which was significantly higher than thos of Pd@BOₓ/BN-R450 (0.05 mol L−1·min−1) and Pd@BOₓ/BN-R700 (0.065 mol L−1·min−1). The enhanced catalytic activity can be attributed to the interaction between the palladium particles and boron oxide layers. Notably, Pd@BOₓ/BN-R700-W, exhibited exceptional activity and superior stability. The activity of Pd@BOₓ/BN-R700-W outperformed other Pd@BOₓ/BN-R700 and Pd@BOₓ/BN-R600 catalysts in Heck reactions. Specifically, the initial reaction for IB with MA in Pd@BOₓ/BN-R700-W was 1.14 mol L−1·min−1, which is markedly higher than the rates achieved with Pd@BOₓ/BN-R700 (0.065 mol L−1·min−1) and Pd@BOₓ/BN-R600 (0.33 mol L−1·min−1), respectivily. The TOF value for Pd@BOₓ/BN-R700-W was 4916 h−1, approximately 17.5 times higher than that of the Pd@BOₓ/BN-R700 catalyst in the Heck reaction. Additionally, extensive substrate scope studies revealed that the Pd@BOₓ/BN-R700-W exhibited enhanced catalytic activity compared to Pd@BOₓ/BN-R700, maintaining remarkable stability even after 14 cycles of reuse, with a consistent yield of 93 % and a minimal palladium loss of 0.13 %. This work successfully demonstrates the dynamic encapsulation of palladium particles via the modulation of the boron oxide layers, underscoring the significant potential of BOₓ layers-encapsulated palladium catalysts for large-scale applications in Heck reactions. CRediT authorship contribution statement Fukun Lei: Formal analysis, Data curation. Zisheng Xu: Investigation. Jiayi Li: Methodology. Lu Wang: Resources. Yuan Liu: Validation. Maofei Ran: Project administration. Tao Dai: Writing – review & editing, Writing – original draft, Visualization, Conceptualization. Declaration of competing interest The authors declare that they have no known competing financial interests or personal relationships that could have appeared to influence the work reported in this paper. Acknowledgements This work was supported by the National Natural Science Foundation of China (Nos. 21908183, 32402907), Scientific and Technological Innovation Team for Qinghai-Tibetan Plateau Research in Southwest Minzu University (Grant No.2024CXTD15), the Fundamental Research Funds for the Central Universities (ZYN2024056), and ‘Weizhou Team’ Special Fund Project in Southwest Minzu University. The authors would like to thank Jin Dong (www.sci-go.com) for the XPS and TEM measurements. Experimental Section The preparation and characterization of Pd@BOx/BN materials and the performances are detailed in the supplementary information. Supplementary materials Supplementary material associated with this article can be found, in the online version, at doi:10.1016/j.mcat.2025.115397. Appendix Supplementary materials Image, application 1 References [1] I J.D. Lee J.B. Miller A. Shneidman L.Sun V J.F. Weaver J. Aizenberg J. Biener J.A. Boscoboinik A.C. Foucher A. Frenkel J.E.S.v.d. Hoeven B. Kozinsky N. Marcella M.M. Montemore H.T. Ngan C.R.O. Connor C.J. Owen D.J. Stacchiola E.A. Stach R.J. Madix P. Sautet C.M. Friend Dilute alloys based on Au, Ag, or Cu for efficient catalysis: from synthesis to active sites Chem. Rev. 122 9 2022 8758 8808 https://pubs.acs.org/doi/10.1021/acs.chemrev.1c00967 J.D. Lee, J.B. Miller, A. Shneidman, V, L.Sun, J.F. Weaver, J. Aizenberg, J. Biener, J.A. Boscoboinik, A.C. Foucher, A. Frenkel, I, J.E.S.v.d. Hoeven, B. Kozinsky, N. Marcella, M.M. Montemore, H.T. Ngan, C.R.O. Connor, C.J. Owen, D.J. Stacchiola, E.A. Stach, R.J. Madix, P. Sautet, C.M. Friend, Dilute alloys based on Au, Ag, or Cu for efficient catalysis: from synthesis to active sites, Chem. Rev. 122(9) (2022) 8758–8808. https://pubs.acs.org/doi/10.1021/acs.chemrev.1c00967. [2] X. Liu H.-J. Peng Toward next-generation heterogeneous catalysts: empowering surface reactivity prediction with machine learning Engineering 39 2024 25 44 10.1016/j.eng.2023.07.021 X. Liu, H.-J. Peng, Toward next-generation heterogeneous catalysts: empowering surface reactivity prediction with machine learning, Engineering 39 (2024) 25–44. 10.1016/j.eng.2023.07.021. [3] E. Mieczyńska A.M. Trzeciak Selective heck arylation of cyclohexene with homogeneous and heterogeneous palladium catalysts Molecules 2010 2166 2177 E. Mieczyńska, A.M. Trzeciak, Selective heck arylation of cyclohexene with homogeneous and heterogeneous palladium catalysts, Molecules, 2010, pp. 2166–2177. [4] F. Daniel K. Tamas M.T. Jozsef K.H. Attila T.M. Laszlo Homogeneous Pd-catalyzed heck coupling in γ-valerolactone as a green reaction medium: a catalytic, kinetic, and computational study ACS Sustain. Chem. Eng. 2020 9926 9936 10.1021/acssuschemeng.0c03523 F. Daniel, K. Tamas, M.T. Jozsef, K.H. Attila, T.M. Laszlo, Homogeneous Pd-catalyzed heck coupling in γ-valerolactone as a green reaction medium: a catalytic, kinetic, and computational study, ACS Sustain. Chem. Eng. (2020) 9926–9936. https://doi.org/10.1021/acssuschemeng.0c03523. [5] M.A. Fredricks M. Drees K. Köhler Acceleration of the rate of the heck reaction through UV- and visible-light-induced palladium(II) reduction ChemCatChem 2 11 2010 1467 1476 10.1002/cctc.201000137 M.A. Fredricks, M. Drees, K. Köhler, Acceleration of the rate of the heck reaction through UV- and visible-light-induced palladium(II) reduction, ChemCatChem 2(11) (2010) 1467–1476. 10.1002/cctc.201000137. [6] V. Elumalai A.H. Sandtorv H.-R. Bjørsvik A highly efficient Pd(PPh3)4-catalyzed Suzuki cross-coupling method for the preparation of 2-nitrobi­phenyls from 1-chloro-2-nitrobenz­enes and phenylboronic acids Eur. J. Org. Chem. 2016 7 2016 1344 1354 10.1002/ejoc.201501487 V. Elumalai, A.H. Sandtorv, H.-R. Bjørsvik, A highly efficient Pd(PPh3)4-catalyzed Suzuki cross-coupling method for the preparation of 2-nitrobi­phenyls from 1-chloro-2-nitrobenz­enes and phenylboronic acids, Eur. J. Org. Chem. 2016(7) (2016) 1344–1354. 10.1002/ejoc.201501487. [7] W. Chen I. Shaikh F. Ahmed S. Karkoub M. AlRawashdeh H. Zhou S. Madrahimov Phosphine-incorporated metal-Organic framework for palladium catalyzed heck coupling reaction ChemistryOpen 13 8 2024 e202300249 10.1002/open.202300249 W. Chen, I. Shaikh, F. Ahmed, S. Karkoub, M. AlRawashdeh, H. Zhou, S. Madrahimov, Phosphine-incorporated metal-Organic framework for palladium catalyzed heck coupling reaction, ChemistryOpen 13(8) (2024) e202300249. 10.1002/open.202300249. [8] Q. Gu Q. Jia J. Long Z. Gao Heterogeneous photocatalyzed C−C cross-coupling reactions under visible-light and near-infrared light irradiation ChemCatChem 11 2 2019 669 683 10.1002/cctc.201801616 Q. Gu, Q. Jia, J. Long, Z. Gao, Heterogeneous photocatalyzed C−C cross-coupling reactions under visible-light and near-infrared light irradiation, ChemCatChem 11(2) (2019) 669–683. 10.1002/cctc.201801616. [9] B. Gole U. Sanyal R. Banerjee P.S. Mukherjee High loading of Pd nanoparticles by interior functionalization of MOFs for heterogeneous catalysis Inorg. Chem. 55 5 2016 2345 2354 10.1021/acs.inorgchem.5b02739 B. Gole, U. Sanyal, R. Banerjee, P.S. Mukherjee, High loading of Pd nanoparticles by interior functionalization of MOFs for heterogeneous catalysis, Inorg. Chem. 55(5) (2016) 2345–2354. https://doi.org/10.1021/acs.inorgchem.5b02739. [10] A.R. Hajipour S. Raimi Efficient heck and Suzuki-Miyaura cross-coupling reactions catalyzed by heterogeneous Pd NPs-decorated porous MOF catalysts under mild conditions J. Mol. Struct. 1309 2024 138156 10.1016/j.molstruc.2024.138156 A.R. Hajipour, S. Raimi, Efficient heck and Suzuki-Miyaura cross-coupling reactions catalyzed by heterogeneous Pd NPs-decorated porous MOF catalysts under mild conditions, J. Mol. Struct. 1309 (2024) 138156. 10.1016/j.molstruc.2024.138156. [11] A. Mercadante V. Campisciano A. Morena L. Valentino V. La Parola C. Aprile M. Gruttadauria F. Giacalone Catechol-functionalized carbon nanotubes as support for Pd nanoparticles: a recyclable system for the Heck reaction Eur. J. Org. Chem. 2022 10.1002/ejoc.202200497 A. Mercadante, V. Campisciano, A. Morena, L. Valentino, V. La Parola, C. Aprile, M. Gruttadauria, F. Giacalone, Catechol-functionalized carbon nanotubes as support for Pd nanoparticles: a recyclable system for the Heck reaction, Eur. J. Org. Chem. (2022). 10.1002/ejoc.202200497. [12] T. Gao Y. Zhao Y. Zhou Z. Kang Mesoporous silica nanospheres supported atomically precise palladium nanocluster: highly efficient and recyclable catalysts in the reduction of 4-nitrophenol and Heck reactions Appl. Organomet. Chem. 36 3 2022 e6541 10.1002/aoc.6541 T. Gao, Y. Zhao, Y. Zhou, Z. Kang, Mesoporous silica nanospheres supported atomically precise palladium nanocluster: highly efficient and recyclable catalysts in the reduction of 4-nitrophenol and Heck reactions, Appl. Organomet. Chem. 36(3) (2022) e6541. 10.1002/aoc.6541. [13] Z. Luo N. Wang X. Pei T. Dai Z. Zhao C. Chen M. Ran W. Sun Facile one-pot synthesis of superfine palladium nanoparticles on polydopamine-functionalized carbon nanotubes as a nanocatalyst for the Heck reaction J. Mater. Sci. Technol. 82 2021 197 206 10.1016/j.jmst.2020.12.035 Z. Luo, N. Wang, X. Pei, T. Dai, Z. Zhao, C. Chen, M. Ran, W. Sun, Facile one-pot synthesis of superfine palladium nanoparticles on polydopamine-functionalized carbon nanotubes as a nanocatalyst for the Heck reaction, J. Mater. Sci. Technol. 82 (2021) 197–206. 10.1016/j.jmst.2020.12.035. [14] D. Khalili A.R. Banazadeh E. Etemadi-Davan Palladium stabilized by amino-vinyl Silica functionalized magnetic carbon nanotube: application in Suzuki–Miyaura and Heck–Mizoroki coupling reactions Catal. Lett. 147 10 2017 2674 2687 10.1007/s10562-017-2150-1 D. Khalili, A.R. Banazadeh, E. Etemadi-Davan, Palladium stabilized by amino-vinyl Silica functionalized magnetic carbon nanotube: application in Suzuki–Miyaura and Heck–Mizoroki coupling reactions, Catal. Lett. 147(10) (2017) 2674–2687. https://doi.org/10.1007/s10562-017-2150-1. [15] G. Chaudhary B. Joshi A.P. Singh Recyclable Pd(II) immobilized MCM-41 based heterogeneous catalyst for Suzuki–Miyaura and Heck coupling reactions Inorg. Chem. Commun 164 2024 112405 10.1016/j.inoche.2024.112405 G. Chaudhary, B. Joshi, A.P. Singh, Recyclable Pd(II) immobilized MCM-41 based heterogeneous catalyst for Suzuki–Miyaura and Heck coupling reactions, Inorg. Chem. Commun 164 (2024) 112405. 10.1016/j.inoche.2024.112405. [16] J. Li Q. Hou X. Pei L. Wang F. Liu M. Ran T. Dai Study of size effect of palladium atoms as single-atom and clusters nanoparticle catalysts for Heck reactions J. Mol. Struct. 1316 2024 139081 10.1016/j.molstruc.2024.139081 J. Li, Q. Hou, X. Pei, L. Wang, F. Liu, M. Ran, T. Dai, Study of size effect of palladium atoms as single-atom and clusters nanoparticle catalysts for Heck reactions, J. Mol. Struct. 1316 (2024) 139081. 10.1016/j.molstruc.2024.139081. [17] F. Lei Y. Jiang Y. Ma D. Xiang J. Wang Z. Guo T. Dai M. Ran Effect of electron transfer in Pd on nitrogen-doped carbon nanotube catalysts in the Heck reaction Chem. Phys. Lett. 824 2023 140542 10.1016/j.cplett.2023.140542 F. Lei, Y. Jiang, Y. Ma, D. Xiang, J. Wang, Z. Guo, T. Dai, M. Ran, Effect of electron transfer in Pd on nitrogen-doped carbon nanotube catalysts in the Heck reaction, Chem. Phys. Lett. 824 (2023) 140542. 10.1016/j.cplett.2023.140542. [18] Y. Lan Y. Ma Q. Hou Z. Luo L. Wang M. Ran T. Dai Immobilization of palladium nanoparticles on polydopamine spheres with superior activity and reusability in Heck reaction J. Catal. 430 2024 115333 10.1016/j.jcat.2024.115333 Y. Lan, Y. Ma, Q. Hou, Z. Luo, L. Wang, M. Ran, T. Dai, Immobilization of palladium nanoparticles on polydopamine spheres with superior activity and reusability in Heck reaction, J. Catal. 430 (2024) 115333. 10.1016/j.jcat.2024.115333. [19] L. Zhang H. Yu S. Gao H. Wang Z. He K. Huang Synthesis of yolk-shell magnetic porous organic nanospheres supported Pd catalyst for oxidation of alcohols and Heck reactions Chem. Eng. J. 423 2021 130237 10.1016/j.cej.2021.130237 L. Zhang, H. Yu, S. Gao, H. Wang, Z. He, K. Huang, Synthesis of yolk-shell magnetic porous organic nanospheres supported Pd catalyst for oxidation of alcohols and Heck reactions, Chem. Eng. J. 423 (2021) 130237. 10.1016/j.cej.2021.130237. [20] X. Pei D. Xiang Z. Luo F. Lei Z. Guo D. Liu Z. Zhao M. Ran T. Dai Catalytic performance of palladium nanoparticles encapsulated within nitrogen-doped carbon during Heck reaction J. Catal. 400 2021 20 27 10.1016/j.jcat.2021.05.020 X. Pei, D. Xiang, Z. Luo, F. Lei, Z. Guo, D. Liu, Z. Zhao, M. Ran, T. Dai, Catalytic performance of palladium nanoparticles encapsulated within nitrogen-doped carbon during Heck reaction, J. Catal. 400 (2021) 20–27. 10.1016/j.jcat.2021.05.020. [21] X.-L. Xu N.-N. Wang Y.-H. Zou X. Qin P. Wang X.-Y. Lu X.-Y. Zhang W.-Y. Sun Y. Lu N, N’-bidentate ligand anchored palladium catalysts on MOFs for efficient Heck reaction Nat. Commun. 15 1 2024 7273 10.1038/s41467-024-51552-x X.-L. Xu, N.-N. Wang, Y.-H. Zou, X. Qin, P. Wang, X.-Y. Lu, X.-Y. Zhang, W.-Y. Sun, Y. Lu, N, N’-bidentate ligand anchored palladium catalysts on MOFs for efficient Heck reaction, Nat. Commun. 15(1) (2024) 7273. https://doi.org/10.1038/s41467-024-51552-x. [22] S. Ali P.M. Ismail M. Humayun M. Bououdina Hexagonal boron nitride: from fundamentals to applications Desalination 599 2025 118442 10.1016/j.desal.2024.118442 S. Ali, P.M. Ismail, M. Humayun, M. Bououdina, Hexagonal boron nitride: from fundamentals to applications, Desalination 599 (2025) 118442. 10.1016/j.desal.2024.118442. [23] H. Chen D.-e. Jiang Z. Yang S. Dai Engineering nanostructured interfaces of hexagonal boron nitride-based materials for enhanced catalysis Acc. Chem. Res. 56 1 2023 52 65 10.1021/acs.accounts.2c00564 H. Chen, D.-e. Jiang, Z. Yang, S. Dai, Engineering nanostructured interfaces of hexagonal boron nitride-based materials for enhanced catalysis, Acc. Chem. Res. 56(1) (2023) 52–65. https://doi.org/10.1021/acs.accounts.2c00564. [24] H. Liu M. Yan W. Jing G. Zeng G. Xie X. Pu Y. Fu X. Peng H. Wang C. Lai D. Huang L. Tang Hexagonal boron nitride for extreme environment application Diam. Relat. Mater. 148 2024 111410 10.1016/j.diamond.2024.111410 H. Liu, M. Yan, W. Jing, G. Zeng, G. Xie, X. Pu, Y. Fu, X. Peng, H. Wang, C. Lai, D. Huang, L. Tang, Hexagonal boron nitride for extreme environment application, Diam. Relat. Mater. 148 (2024) 111410. 10.1016/j.diamond.2024.111410. [25] A.E. Naclerio P.R. Kidambi A review of scalable hexagonal boron nitride (h-BN) synthesis for present and future applications Adv. Mater. 35 6 2023 2207374 10.1002/adma.202207374 A.E. Naclerio, P.R. Kidambi, A review of scalable hexagonal boron nitride (h-BN) synthesis for present and future applications, Adv. Mater. 35(6) (2023) 2207374. 10.1002/adma.202207374. [26] T. Song J. Dong R. Li X. Xu X. Bao Oxidative strong MetalSupport interactions between metals and inert boron nitride J. Phys. Chem. Lett, 12 2021 4187 4194 T. Song, J. Dong, R. Li, X. Xu, X. Bao, Oxidative strong MetalSupport interactions between metals and inert boron nitride, J. Phys. Chem. Lett, (12) (2021) 4187–4194. [27] J. Dong Q. Fu H. Li J. Xiao B. Yang B. Zhang Y. Bai T. Song R. Zhang L. Gao J. Cai H. Zhang Z. Liu X. Bao Reaction-induced strong metal–Support interactions between metals and inert boron nitride nanosheets J. Am. Chem. Soc. 142 40 2020 17167 17174 10.1021/jacs.0c08139 J. Dong, Q. Fu, H. Li, J. Xiao, B. Yang, B. Zhang, Y. Bai, T. Song, R. Zhang, L. Gao, J. Cai, H. Zhang, Z. Liu, X. Bao, Reaction-induced strong metal–Support interactions between metals and inert boron nitride nanosheets, J. Am. Chem. Soc. 142(40) (2020) 17167–17174. https://doi.org/10.1021/jacs.0c08139. [28] Y. Wang J. Wang P. Zheng C. Sun J. Luo X. Xie Boosting selectivity and stability on Pt/BN catalysts for propane dehydrogenation via calcination & reduction-mediated strong metal-support interaction J. Energy Chem. 67 2022 451 457 10.1016/j.jechem.2021.10.008 Y. Wang, J. Wang, P. Zheng, C. Sun, J. Luo, X. Xie, Boosting selectivity and stability on Pt/BN catalysts for propane dehydrogenation via calcination & reduction-mediated strong metal-support interaction, J. Energy Chem. 67 (2022) 451–457. 10.1016/j.jechem.2021.10.008. [29] Y. Xu Z. An X. Yu J. Yao Q. Lv H. Yang Z. Lv H. Guo Q. Jiang W. Liu L. Wu L. Tan Y. Dai Y. Tang Enhanced catalytic stability and structural evolution of Rh-BN interface in dry reforming of methane under intensified CO2 partial pressure J. Catal. 427 2023 115094 10.1016/j.jcat.2023.08.010 Y. Xu, Z. An, X. Yu, J. Yao, Q. Lv, H. Yang, Z. Lv, H. Guo, Q. Jiang, W. Liu, L. Wu, L. Tan, Y. Dai, Y. Tang, Enhanced catalytic stability and structural evolution of Rh-BN interface in dry reforming of methane under intensified CO2 partial pressure, J. Catal. 427 (2023) 115094. 10.1016/j.jcat.2023.08.010. [30] C. Petrucci G. Strappaveccia F. Giacalone M. Gruttadauria F. Pizzo L. Vaccaro An E-factor minimized protocol for a sustainable and efficient heck reaction in flow ACS Sustain. Chem. Eng. 2 12 2014 2813 2819 10.1021/sc500584y C. Petrucci, G. Strappaveccia, F. Giacalone, M. Gruttadauria, F. Pizzo, L. Vaccaro, An E-factor minimized protocol for a sustainable and efficient heck reaction in flow, ACS Sustain. Chem. Eng. 2(12) (2014) 2813–2819. https://doi.org/10.1021/sc500584y. [31] F. Giacalone V. Campisciano C. Calabrese V.L. Parola Z. Syrgiannis M. Prato M. Gruttadauria Single-walled carbon nanotube−polyamidoamine dendrimer hybrids for heterogeneous catalysis ACS Nano 2016 10.1021/acsnano.6b00936.s001 F. Giacalone, V. Campisciano, C. Calabrese, V.L. Parola, Z. Syrgiannis, M. Prato, M. Gruttadauria, Single-walled carbon nanotube−polyamidoamine dendrimer hybrids for heterogeneous catalysis, ACS Nano (2016). https://doi.org/10.1021/acsnano.6b00936.s001 [32] S.M. Sarkar M.L. Rahman K.F. Chong M.M. Yusoff Poly(hydroxamic acid) palladium catalyst for heck reactions and its application in the synthesis of Ozagrel J. Catal. 350 2017 103 110 10.1016/j.jcat.2017.03.023 S.M. Sarkar, M.L. Rahman, K.F. Chong, M.M. Yusoff, Poly(hydroxamic acid) palladium catalyst for heck reactions and its application in the synthesis of Ozagrel, J. Catal. 350 (2017) 103–110. https://doi.org/10.1016/j.jcat.2017.03.023. [33] Z. Wu B. Ren J. Zheng J. Xiao Immobilization of Pd(0) nanoparticles on polyaza-ligand-functionalized polyacrylonitrile fiber as highly active catalyst for the Heck reaction J. Catal. 427 2023 115121 10.1016/j.jcat.2023.115121 Z. Wu, B. Ren, J. Zheng, J. Xiao, Immobilization of Pd(0) nanoparticles on polyaza-ligand-functionalized polyacrylonitrile fiber as highly active catalyst for the Heck reaction, J. Catal. 427 (2023) 115121. https://doi.org/10.1016/j.jcat.2023.115121. [34] H. Zhang W. Liang J. Xiao J. Zhao Functional fiber with bis (N-heterocyclic carbene) structure prevents Pd(0) nanoparticle agglomeration for an efficient and recyclable Heck reaction Chem. Eng. J. 455 2023 140592 10.1016/j.cej.2022.140592 H. Zhang, W. Liang, J. Xiao, J. Zhao, Functional fiber with bis (N-heterocyclic carbene) structure prevents Pd(0) nanoparticle agglomeration for an efficient and recyclable Heck reaction, Chem. Eng. J. 455 (2023) 140592. https://doi.org/10.1016/j.cej.2022.140592. [35] J. Xiao H. Zhang A.C. Ejike L. Wang M. Tao W. Zhang Phenanthroline functionalized polyacrylonitrile fiber with Pd(0) nanoparticles as a highly active catalyst for the Heck reaction React. Funct. Polym. 161 2021 104843 10.1016/j.reactfunctpolym.2021.104843 J. Xiao, H. Zhang, A.C. Ejike, L. Wang, M. Tao, W. Zhang, Phenanthroline functionalized polyacrylonitrile fiber with Pd(0) nanoparticles as a highly active catalyst for the Heck reaction, React. Funct. Polym. 161 (2021) 104843. https://doi.org/10.1016/j.reactfunctpolym.2021.104843. [36] J. Xiao L. Wang H. Zhang N. Ma M. Tao W. Zhang Immobilization of Pd(0) nanoparticles on gemini quaternary ammonium functionalized polyacrylonitrile fibers as highly active catalysts for heck reactions and 4-nitrophenol reduction Chem. Eng. Sci. 247 2022 117053 10.1016/j.ces.2021.117053 J. Xiao, L. Wang, H. Zhang, N. Ma, M. Tao, W. Zhang, Immobilization of Pd(0) nanoparticles on gemini quaternary ammonium functionalized polyacrylonitrile fibers as highly active catalysts for heck reactions and 4-nitrophenol reduction, Chem. Eng. Sci. 247 (2022) 117053. https://doi.org/10.1016/j.ces.2021.117053. [37] P. Zhou H. Wang J. Yang J. Tang D. Sun W. Tang Bacteria cellulose nanofibers supported palladium(0) nanocomposite and its catalysis evaluation in heck reaction Ind. Eng. Chem. Res. 51 16 2012 5743 5748 10.1021/ie300395q P. Zhou, H. Wang, J. Yang, J. Tang, D. Sun, W. Tang, Bacteria cellulose nanofibers supported palladium(0) nanocomposite and its catalysis evaluation in heck reaction, Ind. Eng. Chem. Res. 51(16) (2012) 5743–5748. https://doi.org/10.1021/ie300395q. [38] Z.X. Luo D. Xiang X.Y. Pei L. Wang Z.G. Zhao W.J. Sun M.F. Ran T. Dai Enhanced performance of palladium catalyst confined within carbon nanotubes for heck reaction Catal. Lett. 151 2021 3230 3238 10.1007/s10562-021-03577-w Z.X. Luo, D. Xiang, X.Y. Pei, L. Wang, Z.G. Zhao, W.J. Sun, M.F. Ran, T. Dai, Enhanced performance of palladium catalyst confined within carbon nanotubes for heck reaction, Catal. Lett., 151 (2021) 3230–3238. https://doi.org/10.1007/s10562-021-03577-w. [39] K.R. Balinge P.R. Bhagat A polymer-supported salen-palladium complex as a heterogeneous catalyst for the Mizoroki-Heck cross-coupling reaction Inorgan. Chim. Acta 495 2019 119017 10.1016/j.ica.2019.119017 K.R. Balinge, P.R. Bhagat, A polymer-supported salen-palladium complex as a heterogeneous catalyst for the Mizoroki-Heck cross-coupling reaction, Inorgan. Chim. Acta 495 (2019) 119017. https://doi.org/10.1016/j.ica.2019.119017. [40] H. Mahmoudi F. Valentini F. Ferlin L.A. Bivona I. Anastasiou L. Fusaro C. Aprile A. Marrocchi L. Vaccaro A tailored polymeric cationic tag–anionic Pd(ii) complex as a catalyst for the low-leaching Heck–Mizoroki coupling in flow and in biomass-derived GVL Green Chem. 21 2 2019 355 360 10.1039/c8gc03228a H. Mahmoudi, F. Valentini, F. Ferlin, L.A. Bivona, I. Anastasiou, L. Fusaro, C. Aprile, A. Marrocchi, L. Vaccaro, A tailored polymeric cationic tag–anionic Pd(ii) complex as a catalyst for the low-leaching Heck–Mizoroki coupling in flow and in biomass-derived GVL, Green Chem. 21(2) (2019) 355–360. https://doi.org/10.1039/c8gc03228a. [41] E. Fernandez M.A. Rivero-Crespo I. Dominguez P. Rubio-Marques J. Oliver-Meseguer L. Liu M. Cabrero-Antonino R. Gavara J.C. Hernandez-Garrido M. Boronat A. Leyva-Perez A. Corma Base-controlled Heck, Suzuki, and Sonogashira reactions catalyzed by ligand-free platinum or palladium single atom and sub-nanometer clusters J. Am. Chem. Soc. 141 5 2019 1928 1940 10.1021/jacs.8b07884 E. Fernandez, M.A. Rivero-Crespo, I. Dominguez, P. Rubio-Marques, J. Oliver-Meseguer, L. Liu, M. Cabrero-Antonino, R. Gavara, J.C. Hernandez-Garrido, M. Boronat, A. Leyva-Perez, A. Corma, Base-controlled Heck, Suzuki, and Sonogashira reactions catalyzed by ligand-free platinum or palladium single atom and sub-nanometer clusters, J. Am. Chem. Soc. 141(5) (2019) 1928–1940. https://doi.org/10.1021/jacs.8b07884.",
      "scopus-id": "105012384768",
      "coredata": {
        "eid": "1-s2.0-S246882312500584X",
        "dc:description": "The confinement effect of the boron oxide layer has attracted significant attention in the field of heterogeneous catalysis. In this study, we introduce a strategically designed Pd@boron oxide-boron nitride hybrid (Pd@BOₓ/BN) catalyst, synthesized via pyrolysis, impregnation, reduction, and water treatment processes, for catalyzing the Heck reaction. Structural analyses reveal highly dispersed Pd nanoparticles encapsulated by tunable BOₓ layers, with phase transitions (NH4B5O8 → H3BO3 → BOₓ) occurring during hydrogen reduction. Increasing the reduction temperature from 450 °C to 700 °C resulted in the formation of thicker BOₓ layers, while water treatment partially removed the surface BOₓ. The post-water treatment catalyst (Pd@BOₓ/BN-R700-W) exhibited activity 5.8 and 17.5 times higher than those of Pd@BOₓ/BN-R600 and untreated Pd@BOₓ/BN-R700 in the Heck reaction, respectively. This enhanced activity is attributed to the optimized BOₓ layer thickness and confinement effects. Furthermore, comprehensive evaluations of the substrate scope demonstrated that Pd@BOₓ/BN-R700-W exhibited superior catalytic activity compared to other catalysts. This is accompanied by notable stability and reusability, as evidenced by a yield retention exceeding 93 % after fourteen cycles and minimal palladium leaching of 0.13 %. This study underscores the efficacy of BOₓ layers confinement engineering as a robust approach for developing durable and highly efficient catalysts in Heck coupling reactions.",
        "openArchiveArticle": "false",
        "prism:coverDate": "2025-11-30",
        "openaccessUserLicense": null,
        "prism:aggregationType": "Journal",
        "prism:url": "https://api.elsevier.com/content/article/pii/S246882312500584X",
        "dc:creator": [
          {
            "@_fa": "true",
            "$": "Lei, Fukun"
          },
          {
            "@_fa": "true",
            "$": "Xu, Zisheng"
          },
          {
            "@_fa": "true",
            "$": "Li, Jiayi"
          },
          {
            "@_fa": "true",
            "$": "Wang, Lu"
          },
          {
            "@_fa": "true",
            "$": "Liu, Yuan"
          },
          {
            "@_fa": "true",
            "$": "Ran, Maofei"
          },
          {
            "@_fa": "true",
            "$": "Dai, Tao"
          }
        ],
        "link": [
          {
            "@_fa": "true",
            "@rel": "self",
            "@href": "https://api.elsevier.com/content/article/pii/S246882312500584X"
          },
          {
            "@_fa": "true",
            "@rel": "scidir",
            "@href": "https://www.sciencedirect.com/science/article/pii/S246882312500584X"
          }
        ],
        "dc:format": "application/json",
        "openaccessType": null,
        "pii": "S2468-8231(25)00584-X",
        "prism:volume": "586",
        "articleNumber": "115397",
        "prism:publisher": "Elsevier B.V. All rights are reserved, including those for text and data mining, AI training, and similar technologies.",
        "dc:title": "Boron oxide layer confinement engineering for enhanced catalytic activity and stability in Heck reaction",
        "prism:copyright": "© 2025 Elsevier B.V. All rights are reserved, including those for text and data mining, AI training, and similar technologies.",
        "openaccess": "0",
        "prism:issn": "24688231",
        "dcterms:subject": [
          {
            "@_fa": "true",
            "$": "Boron oxide layers"
          },
          {
            "@_fa": "true",
            "$": "Confinement effect"
          },
          {
            "@_fa": "true",
            "$": "Heck reaction"
          },
          {
            "@_fa": "true",
            "$": "Pd nanoparticles"
          }
        ],
        "openaccessArticle": "false",
        "prism:publicationName": "Molecular Catalysis",
        "openaccessSponsorType": null,
        "prism:pageRange": "115397",
        "pubType": "fla",
        "prism:coverDisplayDate": "November 2025",
        "prism:doi": "10.1016/j.mcat.2025.115397",
        "prism:startingPage": "115397",
        "dc:identifier": "doi:10.1016/j.mcat.2025.115397",
        "openaccessSponsorName": null
      },
      "objects": {
        "object": [
          {
            "@category": "standard",
            "@height": "583",
            "@width": "753",
            "@_fa": "true",
            "$": "https://api.elsevier.com/content/object/eid/1-s2.0-S246882312500584X-gr1.jpg?httpAccept=%2A%2F%2A",
            "@multimediatype": "JPEG image file",
            "@type": "IMAGE-DOWNSAMPLED",
            "@size": "176684",
            "@ref": "gr1",
            "@mimetype": "image/jpeg"
          },
          {
            "@category": "standard",
            "@height": "611",
            "@width": "753",
            "@_fa": "true",
            "$": "https://api.elsevier.com/content/object/eid/1-s2.0-S246882312500584X-gr3.jpg?httpAccept=%2A%2F%2A",
            "@multimediatype": "JPEG image file",
            "@type": "IMAGE-DOWNSAMPLED",
            "@size": "148921",
            "@ref": "gr3",
            "@mimetype": "image/jpeg"
          },
          {
            "@category": "standard",
            "@height": "496",
            "@width": "508",
            "@_fa": "true",
            "$": "https://api.elsevier.com/content/object/eid/1-s2.0-S246882312500584X-gr2.jpg?httpAccept=%2A%2F%2A",
            "@multimediatype": "JPEG image file",
            "@type": "IMAGE-DOWNSAMPLED",
            "@size": "144910",
            "@ref": "gr2",
            "@mimetype": "image/jpeg"
          },
          {
            "@category": "standard",
            "@height": "200",
            "@width": "324",
            "@_fa": "true",
            "$": "https://api.elsevier.com/content/object/eid/1-s2.0-S246882312500584X-ga1.jpg?httpAccept=%2A%2F%2A",
            "@multimediatype": "JPEG image file",
            "@type": "IMAGE-DOWNSAMPLED",
            "@size": "44311",
            "@ref": "ga1",
            "@mimetype": "image/jpeg"
          },
          {
            "@category": "standard",
            "@height": "622",
            "@width": "753",
            "@_fa": "true",
            "$": "https://api.elsevier.com/content/object/eid/1-s2.0-S246882312500584X-gr8.jpg?httpAccept=%2A%2F%2A",
            "@multimediatype": "JPEG image file",
            "@type": "IMAGE-DOWNSAMPLED",
            "@size": "105884",
            "@ref": "gr8",
            "@mimetype": "image/jpeg"
          },
          {
            "@category": "standard",
            "@height": "543",
            "@width": "508",
            "@_fa": "true",
            "$": "https://api.elsevier.com/content/object/eid/1-s2.0-S246882312500584X-gr5.jpg?httpAccept=%2A%2F%2A",
            "@multimediatype": "JPEG image file",
            "@type": "IMAGE-DOWNSAMPLED",
            "@size": "109924",
            "@ref": "gr5",
            "@mimetype": "image/jpeg"
          },
          {
            "@category": "standard",
            "@height": "617",
            "@width": "753",
            "@_fa": "true",
            "$": "https://api.elsevier.com/content/object/eid/1-s2.0-S246882312500584X-gr4.jpg?httpAccept=%2A%2F%2A",
            "@multimediatype": "JPEG image file",
            "@type": "IMAGE-DOWNSAMPLED",
            "@size": "107107",
            "@ref": "gr4",
            "@mimetype": "image/jpeg"
          },
          {
            "@category": "standard",
            "@height": "612",
            "@width": "753",
            "@_fa": "true",
            "$": "https://api.elsevier.com/content/object/eid/1-s2.0-S246882312500584X-gr7.jpg?httpAccept=%2A%2F%2A",
            "@multimediatype": "JPEG image file",
            "@type": "IMAGE-DOWNSAMPLED",
            "@size": "104173",
            "@ref": "gr7",
            "@mimetype": "image/jpeg"
          },
          {
            "@category": "standard",
            "@height": "321",
            "@width": "565",
            "@_fa": "true",
            "$": "https://api.elsevier.com/content/object/eid/1-s2.0-S246882312500584X-gr6.jpg?httpAccept=%2A%2F%2A",
            "@multimediatype": "JPEG image file",
            "@type": "IMAGE-DOWNSAMPLED",
            "@size": "58946",
            "@ref": "gr6",
            "@mimetype": "image/jpeg"
          },
          {
            "@category": "thumbnail",
            "@height": "164",
            "@width": "212",
            "@_fa": "true",
            "$": "https://api.elsevier.com/content/object/eid/1-s2.0-S246882312500584X-gr1.sml?httpAccept=%2A%2F%2A",
            "@multimediatype": "GIF image file",
            "@type": "IMAGE-THUMBNAIL",
            "@size": "18675",
            "@ref": "gr1",
            "@mimetype": "image/gif"
          },
          {
            "@category": "thumbnail",
            "@height": "164",
            "@width": "202",
            "@_fa": "true",
            "$": "https://api.elsevier.com/content/object/eid/1-s2.0-S246882312500584X-gr3.sml?httpAccept=%2A%2F%2A",
            "@multimediatype": "GIF image file",
            "@type": "IMAGE-THUMBNAIL",
            "@size": "18285",
            "@ref": "gr3",
            "@mimetype": "image/gif"
          },
          {
            "@category": "thumbnail",
            "@height": "164",
            "@width": "168",
            "@_fa": "true",
            "$": "https://api.elsevier.com/content/object/eid/1-s2.0-S246882312500584X-gr2.sml?httpAccept=%2A%2F%2A",
            "@multimediatype": "GIF image file",
            "@type": "IMAGE-THUMBNAIL",
            "@size": "21594",
            "@ref": "gr2",
            "@mimetype": "image/gif"
          },
          {
            "@category": "thumbnail",
            "@height": "135",
            "@width": "219",
            "@_fa": "true",
            "$": "https://api.elsevier.com/content/object/eid/1-s2.0-S246882312500584X-ga1.sml?httpAccept=%2A%2F%2A",
            "@multimediatype": "GIF image file",
            "@type": "IMAGE-THUMBNAIL",
            "@size": "17005",
            "@ref": "ga1",
            "@mimetype": "image/gif"
          },
          {
            "@category": "thumbnail",
            "@height": "163",
            "@width": "198",
            "@_fa": "true",
            "$": "https://api.elsevier.com/content/object/eid/1-s2.0-S246882312500584X-gr8.sml?httpAccept=%2A%2F%2A",
            "@multimediatype": "GIF image file",
            "@type": "IMAGE-THUMBNAIL",
            "@size": "10584",
            "@ref": "gr8",
            "@mimetype": "image/gif"
          },
          {
            "@category": "thumbnail",
            "@height": "163",
            "@width": "153",
            "@_fa": "true",
            "$": "https://api.elsevier.com/content/object/eid/1-s2.0-S246882312500584X-gr5.sml?httpAccept=%2A%2F%2A",
            "@multimediatype": "GIF image file",
            "@type": "IMAGE-THUMBNAIL",
            "@size": "16235",
            "@ref": "gr5",
            "@mimetype": "image/gif"
          },
          {
            "@category": "thumbnail",
            "@height": "164",
            "@width": "200",
            "@_fa": "true",
            "$": "https://api.elsevier.com/content/object/eid/1-s2.0-S246882312500584X-gr4.sml?httpAccept=%2A%2F%2A",
            "@multimediatype": "GIF image file",
            "@type": "IMAGE-THUMBNAIL",
            "@size": "12751",
            "@ref": "gr4",
            "@mimetype": "image/gif"
          },
          {
            "@category": "thumbnail",
            "@height": "164",
            "@width": "202",
            "@_fa": "true",
            "$": "https://api.elsevier.com/content/object/eid/1-s2.0-S246882312500584X-gr7.sml?httpAccept=%2A%2F%2A",
            "@multimediatype": "GIF image file",
            "@type": "IMAGE-THUMBNAIL",
            "@size": "10742",
            "@ref": "gr7",
            "@mimetype": "image/gif"
          },
          {
            "@category": "thumbnail",
            "@height": "124",
            "@width": "219",
            "@_fa": "true",
            "$": "https://api.elsevier.com/content/object/eid/1-s2.0-S246882312500584X-gr6.sml?httpAccept=%2A%2F%2A",
            "@multimediatype": "GIF image file",
            "@type": "IMAGE-THUMBNAIL",
            "@size": "10914",
            "@ref": "gr6",
            "@mimetype": "image/gif"
          },
          {
            "@category": "high",
            "@height": "2579",
            "@width": "3333",
            "@_fa": "true",
            "$": "https://api.elsevier.com/content/object/eid/1-s2.0-S246882312500584X-gr1_lrg.jpg?httpAccept=%2A%2F%2A",
            "@multimediatype": "JPEG image file",
            "@type": "IMAGE-HIGH-RES",
            "@size": "1235041",
            "@ref": "gr1",
            "@mimetype": "image/jpeg"
          },
          {
            "@category": "high",
            "@height": "2703",
            "@width": "3333",
            "@_fa": "true",
            "$": "https://api.elsevier.com/content/object/eid/1-s2.0-S246882312500584X-gr3_lrg.jpg?httpAccept=%2A%2F%2A",
            "@multimediatype": "JPEG image file",
            "@type": "IMAGE-HIGH-RES",
            "@size": "942591",
            "@ref": "gr3",
            "@mimetype": "image/jpeg"
          },
          {
            "@category": "high",
            "@height": "2195",
            "@width": "2250",
            "@_fa": "true",
            "$": "https://api.elsevier.com/content/object/eid/1-s2.0-S246882312500584X-gr2_lrg.jpg?httpAccept=%2A%2F%2A",
            "@multimediatype": "JPEG image file",
            "@type": "IMAGE-HIGH-RES",
            "@size": "1210260",
            "@ref": "gr2",
            "@mimetype": "image/jpeg"
          },
          {
            "@category": "high",
            "@height": "886",
            "@width": "1435",
            "@_fa": "true",
            "$": "https://api.elsevier.com/content/object/eid/1-s2.0-S246882312500584X-ga1_lrg.jpg?httpAccept=%2A%2F%2A",
            "@multimediatype": "JPEG image file",
            "@type": "IMAGE-HIGH-RES",
            "@size": "375276",
            "@ref": "ga1",
            "@mimetype": "image/jpeg"
          },
          {
            "@category": "high",
            "@height": "2751",
            "@width": "3333",
            "@_fa": "true",
            "$": "https://api.elsevier.com/content/object/eid/1-s2.0-S246882312500584X-gr8_lrg.jpg?httpAccept=%2A%2F%2A",
            "@multimediatype": "JPEG image file",
            "@type": "IMAGE-HIGH-RES",
            "@size": "606845",
            "@ref": "gr8",
            "@mimetype": "image/jpeg"
          },
          {
            "@category": "high",
            "@height": "2404",
            "@width": "2250",
            "@_fa": "true",
            "$": "https://api.elsevier.com/content/object/eid/1-s2.0-S246882312500584X-gr5_lrg.jpg?httpAccept=%2A%2F%2A",
            "@multimediatype": "JPEG image file",
            "@type": "IMAGE-HIGH-RES",
            "@size": "754832",
            "@ref": "gr5",
            "@mimetype": "image/jpeg"
          },
          {
            "@category": "high",
            "@height": "2733",
            "@width": "3333",
            "@_fa": "true",
            "$": "https://api.elsevier.com/content/object/eid/1-s2.0-S246882312500584X-gr4_lrg.jpg?httpAccept=%2A%2F%2A",
            "@multimediatype": "JPEG image file",
            "@type": "IMAGE-HIGH-RES",
            "@size": "622440",
            "@ref": "gr4",
            "@mimetype": "image/jpeg"
          },
          {
            "@category": "high",
            "@height": "2708",
            "@width": "3333",
            "@_fa": "true",
            "$": "https://api.elsevier.com/content/object/eid/1-s2.0-S246882312500584X-gr7_lrg.jpg?httpAccept=%2A%2F%2A",
            "@multimediatype": "JPEG image file",
            "@type": "IMAGE-HIGH-RES",
            "@size": "589750",
            "@ref": "gr7",
            "@mimetype": "image/jpeg"
          },
          {
            "@category": "high",
            "@height": "1421",
            "@width": "2500",
            "@_fa": "true",
            "$": "https://api.elsevier.com/content/object/eid/1-s2.0-S246882312500584X-gr6_lrg.jpg?httpAccept=%2A%2F%2A",
            "@multimediatype": "JPEG image file",
            "@type": "IMAGE-HIGH-RES",
            "@size": "310749",
            "@ref": "gr6",
            "@mimetype": "image/jpeg"
          },
          {
            "@category": "standard",
            "@_fa": "true",
            "$": "https://api.elsevier.com/content/object/eid/1-s2.0-S246882312500584X-mmc1.docx?httpAccept=%2A%2F%2A",
            "@multimediatype": "Microsoft Word file",
            "@type": "APPLICATION",
            "@size": "7825613",
            "@ref": "mmc1",
            "@mimetype": "application/word"
          }
        ]
      },
      "link": {
        "@rel": "abstract",
        "@href": "https://api.elsevier.com/content/abstract/scopus_id/105012384768"
      }
    }
  }
}