{
  "metadata": {
    "title": "In-situ hydrothermal synthesis of Al-rich Cu@ZSM-5 catalyst for furfuryl alcohol upgrading to pentanediols",
    "authors": "; ; ",
    "journal": "Molecular Catalysis",
    "date": "2023-08-31",
    "doi": "10.1016/j.mcat.2023.113381",
    "abstract": "",
    "uri": "https://api.elsevier.com/content/article/pii/S2468823123004650",
    "pii": "S2468823123004650"
  },
  "fulltext": {
    "full-text-retrieval-response": {
      "scopus-eid": "2-s2.0-85165002913",
      "originalText": "serial JL 315758 291210 291744 291790 291809 31 Molecular Catalysis MOLECULARCATALYSIS 2023-07-14 2023-07-14 2023-07-14 2023-07-14 2023-11-16T15:56:12 1-s2.0-S2468823123004650 S2468-8231(23)00465-0 S2468823123004650 10.1016/j.mcat.2023.113381 S300 S300.1 FULL-TEXT 1-s2.0-S2468823123X00133 2023-11-16T16:10:46.878106Z 0 0 20230801 20230831 2023 2023-07-14T03:54:48.554836Z absattachment articleinfo articlenumber articletitlenorm authfirstinitialnorm authfirstsurnamenorm cid cids contenttype copyright crossmark dateloaded dateloadedtxt datesearch datesort dateupdated dco docsubtype doctype doi eid ewtransactionid hubeid indexeddate issn issnnorm itemstage itemtransactionid itemweight openaccess openarchive pg pgfirst pii piinorm pubdateend pubdatestart pubdatetxt pubyr sectiontitle sortorder srctitle srctitlenorm srctype ssids alllist content subj subheadings suppl tomb volfirst volissue volumelist webpdf webpdfpagecount yearnav figure table e-component body acknowledge affil appendices articletitle auth authfirstini authfull authkeywords authlast grantnumber grantsponsor grantsponsorid highlightsabst primabst ref specialabst 2468-8231 24688231 true 547 547 C Volume 547 83 113381 113381 113381 202308 August 2023 2023-08-01 2023-08-31 2023 Regular Papers article fla © 2023 Elsevier B.V. All rights reserved. INSITUHYDROTHERMALSYNTHESISALRICHCUZSM5CATALYSTFORFURFURYLALCOHOLUPGRADINGPENTANEDIOLS DAI D 1 Introduction 2 Results and discussion 2.1 Synthetic strategy for Cu@HZ40 catalyst 2.2 Characterization of catalysts 2.3 Catalysts performance for the FFA ring-opening to pentanediols 2.4 Catalytic stability and reusability 2.5 DFT calculation 3 Conclusions CRediT authorship contribution statement Acknowledgements Appendix Supplementary materials References SHI 2020 3495 3504 X FARRUSSENG 2016 3933 3949 D WANG 2019 1901905 L ZHANG 2018 540 546 J WANG 2022 137404 H CAO 2021 10246 10256 P YANG 2022 1847 1856 J HE 2022 14717 14726 P JIN 2019 560 568 Z GAO 2021 1689 1699 M CHO 2018 13514 13520 H WANG 2019 1803966 N LI 2022 7243 7728 X WANG 2018 474 481 C WANG 2016 7484 7487 N SHI 2019 9464 9473 Y SUN 2019 18570 18576 Q SUN 2016 2579 2597 D FU 2021 111298 X LIU 2016 700 710 H YUN 2021 11193 11232 Y YANG 2021 158 173 Z LI 2016 7621 7640 X LIU 2016 668 671 H ZHAO 2023 5170 5193 Z ZHANG 2017 278 285 J DAI 2023 112484 D DAI 2022 5879 5890 D THOMMES 2015 1051 1069 M MARDIANA 2022 122119 S SUN 2016 3479 3563 M KERSTENS 2020 2004690 D YANG 2018 1836 1840 H YUE 2013 1 7 H XU 2018 C CHEN 2020 421 431 C GONG 2012 13922 13925 J SULTANA 2010 61 67 A RICHTER 2007 269 281 M YARIPOUR 2015 41 53 F BEGUM 2016 423 432 S SONG 2020 5149 5162 T CHIA 2011 12675 12689 M DAIX2023X113381 DAIX2023X113381XD 2025-07-14T00:00:00.000Z 2025-07-14T00:00:00.000Z http://creativecommons.org/licenses/by-nc-nd/4.0/ © 2023 Elsevier B.V. All rights reserved. 2023-07-22T08:12:45.566Z http://vtw.elsevier.com/data/voc/AddOnTypes/50.7/aggregated-refined Fundamental Research Funds for the Central Universities http://data.elsevier.com/vocabulary/SciValFunders/501100013804 http://sws.geonames.org/1814991 National Natural Science Foundation of China 22005342 NSFC National Natural Science Foundation of China http://data.elsevier.com/vocabulary/SciValFunders/501100001809 http://sws.geonames.org/1814991/ State Key Laboratory of Heavy Oil Processing State Key Laboratory of Heavy Oil Processing http://data.elsevier.com/vocabulary/SciValFunders/501100011175 http://sws.geonames.org/1814991/ Fundamental Research funds for the Central Universities 20CX02217A Fundamental Research Funds for the Central Universities http://data.elsevier.com/vocabulary/SciValFunders/501100012226 http://sws.geonames.org/1814991/ This work has been financially supported by the National Natural Science Foundation of China ( 22005342 ), the Fundamental Research funds for the Central Universities ( 20CX02217A ), the Opening Fund of State Key Laboratory of Heavy Oil Processing. https://doi.org/10.15223/policy-017 https://doi.org/10.15223/policy-037 https://doi.org/10.15223/policy-012 https://doi.org/10.15223/policy-029 https://doi.org/10.15223/policy-004 item S2468-8231(23)00465-0 S2468823123004650 1-s2.0-S2468823123004650 10.1016/j.mcat.2023.113381 315758 2023-11-16T16:10:46.878106Z 2023-08-01 2023-08-31 1-s2.0-S2468823123004650-main.pdf https://s3-eu-west-1.amazonaws.com/prod-ucs-content-store-eu-west/content/pii:S2468823123004650/MAIN/application/pdf/c37ec873678b57bbc87630d4f286a5ce/main.pdf main.pdf pdf true 12542078 MAIN 10 1-s2.0-S2468823123004650-main_1.png https://s3-eu-west-1.amazonaws.com/prod-ucs-content-store-eu-west/content/pii:S2468823123004650/PREVIEW/image/png/a7d041756aad2f376f14f1d9294f6db2/main_1.png main_1.png png 56816 849 656 IMAGE-WEB-PDF 1 1-s2.0-S2468823123004650-sc2.jpg https://s3-eu-west-1.amazonaws.com/prod-ucs-content-store-eu-west/content/pii:S2468823123004650/sc2/DOWNSAMPLED/image/jpeg/180c858c40154cd5d16fb86f394a7afb/sc2.jpg sc2 sc2.jpg jpg 50759 159 637 IMAGE-DOWNSAMPLED 1-s2.0-S2468823123004650-sc1.jpg https://s3-eu-west-1.amazonaws.com/prod-ucs-content-store-eu-west/content/pii:S2468823123004650/sc1/DOWNSAMPLED/image/jpeg/08ca1a43cf5379b23f1e5ad1eddbc152/sc1.jpg sc1 sc1.jpg jpg 29527 282 629 IMAGE-DOWNSAMPLED 1-s2.0-S2468823123004650-gr5.jpg https://s3-eu-west-1.amazonaws.com/prod-ucs-content-store-eu-west/content/pii:S2468823123004650/gr5/DOWNSAMPLED/image/jpeg/8208177ced1a06862decab8c7676aae9/gr5.jpg gr5 gr5.jpg jpg 38586 187 643 IMAGE-DOWNSAMPLED 1-s2.0-S2468823123004650-gr4.jpg https://s3-eu-west-1.amazonaws.com/prod-ucs-content-store-eu-west/content/pii:S2468823123004650/gr4/DOWNSAMPLED/image/jpeg/3849d0eabbb459811535b5764c4fa0dd/gr4.jpg gr4 gr4.jpg jpg 50562 281 634 IMAGE-DOWNSAMPLED 1-s2.0-S2468823123004650-gr7.jpg https://s3-eu-west-1.amazonaws.com/prod-ucs-content-store-eu-west/content/pii:S2468823123004650/gr7/DOWNSAMPLED/image/jpeg/b603557968455e7c0c468cc0f3b3b38c/gr7.jpg gr7 gr7.jpg jpg 106805 766 621 IMAGE-DOWNSAMPLED 1-s2.0-S2468823123004650-gr6.jpg https://s3-eu-west-1.amazonaws.com/prod-ucs-content-store-eu-west/content/pii:S2468823123004650/gr6/DOWNSAMPLED/image/jpeg/5ded4d117a9dc991ba40c251150210fd/gr6.jpg gr6 gr6.jpg jpg 85550 337 642 IMAGE-DOWNSAMPLED 1-s2.0-S2468823123004650-gr1.jpg https://s3-eu-west-1.amazonaws.com/prod-ucs-content-store-eu-west/content/pii:S2468823123004650/gr1/DOWNSAMPLED/image/jpeg/66827a340f1dfe7be0cbad8fbb3f316f/gr1.jpg gr1 gr1.jpg jpg 89216 437 528 IMAGE-DOWNSAMPLED 1-s2.0-S2468823123004650-gr3.jpg https://s3-eu-west-1.amazonaws.com/prod-ucs-content-store-eu-west/content/pii:S2468823123004650/gr3/DOWNSAMPLED/image/jpeg/ce873a6424d1ff427f4593e369a09e5f/gr3.jpg gr3 gr3.jpg jpg 102073 507 574 IMAGE-DOWNSAMPLED 1-s2.0-S2468823123004650-gr2.jpg https://s3-eu-west-1.amazonaws.com/prod-ucs-content-store-eu-west/content/pii:S2468823123004650/gr2/DOWNSAMPLED/image/jpeg/fc1f9ed8a2d894ba67fcafc9eb2df4fc/gr2.jpg gr2 gr2.jpg jpg 182238 629 615 IMAGE-DOWNSAMPLED 1-s2.0-S2468823123004650-gr9.jpg https://s3-eu-west-1.amazonaws.com/prod-ucs-content-store-eu-west/content/pii:S2468823123004650/gr9/DOWNSAMPLED/image/jpeg/412fd44774d9da482634274ffd408d47/gr9.jpg gr9 gr9.jpg jpg 106662 459 585 IMAGE-DOWNSAMPLED 1-s2.0-S2468823123004650-gr8.jpg https://s3-eu-west-1.amazonaws.com/prod-ucs-content-store-eu-west/content/pii:S2468823123004650/gr8/DOWNSAMPLED/image/jpeg/4d122d497f64530800e01ac301e07a53/gr8.jpg gr8 gr8.jpg jpg 153527 421 651 IMAGE-DOWNSAMPLED 1-s2.0-S2468823123004650-ga1.jpg https://s3-eu-west-1.amazonaws.com/prod-ucs-content-store-eu-west/content/pii:S2468823123004650/ga1/DOWNSAMPLED/image/jpeg/bfa815055f8febc601d25163143a0aab/ga1.jpg ga1 true ga1.jpg jpg 34894 200 296 IMAGE-DOWNSAMPLED 1-s2.0-S2468823123004650-sc2.sml https://s3-eu-west-1.amazonaws.com/prod-ucs-content-store-eu-west/content/pii:S2468823123004650/sc2/THUMBNAIL/image/gif/6e8a2c9f729ad3b82fc35b508d3cb8ed/sc2.sml sc2 sc2.sml sml 8741 55 219 IMAGE-THUMBNAIL 1-s2.0-S2468823123004650-sc1.sml https://s3-eu-west-1.amazonaws.com/prod-ucs-content-store-eu-west/content/pii:S2468823123004650/sc1/THUMBNAIL/image/gif/4ef17e43984de88b7ff72bcf72394288/sc1.sml sc1 sc1.sml sml 5483 98 219 IMAGE-THUMBNAIL 1-s2.0-S2468823123004650-gr5.sml https://s3-eu-west-1.amazonaws.com/prod-ucs-content-store-eu-west/content/pii:S2468823123004650/gr5/THUMBNAIL/image/gif/42a4b03113378c0ae0721af73519fa55/gr5.sml gr5 gr5.sml sml 7823 64 219 IMAGE-THUMBNAIL 1-s2.0-S2468823123004650-gr4.sml https://s3-eu-west-1.amazonaws.com/prod-ucs-content-store-eu-west/content/pii:S2468823123004650/gr4/THUMBNAIL/image/gif/61ca47f78ac7ff2d63c98c606cf7f670/gr4.sml gr4 gr4.sml sml 10410 97 219 IMAGE-THUMBNAIL 1-s2.0-S2468823123004650-gr7.sml https://s3-eu-west-1.amazonaws.com/prod-ucs-content-store-eu-west/content/pii:S2468823123004650/gr7/THUMBNAIL/image/gif/7575526ff275c9edd50bf8280f14aa25/gr7.sml gr7 gr7.sml sml 9788 164 133 IMAGE-THUMBNAIL 1-s2.0-S2468823123004650-gr6.sml https://s3-eu-west-1.amazonaws.com/prod-ucs-content-store-eu-west/content/pii:S2468823123004650/gr6/THUMBNAIL/image/gif/a2382849044338b66f00bec36d9e8fae/gr6.sml gr6 gr6.sml sml 13121 115 219 IMAGE-THUMBNAIL 1-s2.0-S2468823123004650-gr1.sml https://s3-eu-west-1.amazonaws.com/prod-ucs-content-store-eu-west/content/pii:S2468823123004650/gr1/THUMBNAIL/image/gif/522d0d04c7b728b86de6e24954945073/gr1.sml gr1 gr1.sml sml 14720 164 198 IMAGE-THUMBNAIL 1-s2.0-S2468823123004650-gr3.sml https://s3-eu-west-1.amazonaws.com/prod-ucs-content-store-eu-west/content/pii:S2468823123004650/gr3/THUMBNAIL/image/gif/d1c020ba2f166c184dd274cd08fc2a2b/gr3.sml gr3 gr3.sml sml 14386 164 186 IMAGE-THUMBNAIL 1-s2.0-S2468823123004650-gr2.sml https://s3-eu-west-1.amazonaws.com/prod-ucs-content-store-eu-west/content/pii:S2468823123004650/gr2/THUMBNAIL/image/gif/0f109ac929454a29e86a22d0230f2c5f/gr2.sml gr2 gr2.sml sml 21278 164 160 IMAGE-THUMBNAIL 1-s2.0-S2468823123004650-gr9.sml https://s3-eu-west-1.amazonaws.com/prod-ucs-content-store-eu-west/content/pii:S2468823123004650/gr9/THUMBNAIL/image/gif/f465ddecdf7c71dcc6ec56220c478b75/gr9.sml gr9 gr9.sml sml 14504 164 209 IMAGE-THUMBNAIL 1-s2.0-S2468823123004650-gr8.sml https://s3-eu-west-1.amazonaws.com/prod-ucs-content-store-eu-west/content/pii:S2468823123004650/gr8/THUMBNAIL/image/gif/61a4a834378f3f9bb7de897709ed62e1/gr8.sml gr8 gr8.sml sml 23032 142 219 IMAGE-THUMBNAIL 1-s2.0-S2468823123004650-ga1.sml https://s3-eu-west-1.amazonaws.com/prod-ucs-content-store-eu-west/content/pii:S2468823123004650/ga1/THUMBNAIL/image/gif/c28ab85612baca0c7595e0b11cf3732d/ga1.sml ga1 true ga1.sml sml 16996 148 219 IMAGE-THUMBNAIL 1-s2.0-S2468823123004650-sc2_lrg.jpg https://s3-eu-west-1.amazonaws.com/prod-ucs-content-store-eu-west/content/pii:S2468823123004650/HIGHRES/image/jpeg/563abc803755414238fe23ff2f2fec9f/sc2_lrg.jpg sc2 sc2_lrg.jpg jpg 346225 704 2820 IMAGE-HIGH-RES 1-s2.0-S2468823123004650-sc1_lrg.jpg https://s3-eu-west-1.amazonaws.com/prod-ucs-content-store-eu-west/content/pii:S2468823123004650/HIGHRES/image/jpeg/5ab45e57770f86e3b4b6c5ae65f847de/sc1_lrg.jpg sc1 sc1_lrg.jpg jpg 204198 1249 2786 IMAGE-HIGH-RES 1-s2.0-S2468823123004650-gr5_lrg.jpg https://s3-eu-west-1.amazonaws.com/prod-ucs-content-store-eu-west/content/pii:S2468823123004650/HIGHRES/image/jpeg/85c8ff2428efd0a911ad1686b49636c4/gr5_lrg.jpg gr5 gr5_lrg.jpg jpg 301197 829 2848 IMAGE-HIGH-RES 1-s2.0-S2468823123004650-gr4_lrg.jpg https://s3-eu-west-1.amazonaws.com/prod-ucs-content-store-eu-west/content/pii:S2468823123004650/HIGHRES/image/jpeg/9307d1653434009b00675546566a27bc/gr4_lrg.jpg gr4 gr4_lrg.jpg jpg 417947 1244 2807 IMAGE-HIGH-RES 1-s2.0-S2468823123004650-gr7_lrg.jpg https://s3-eu-west-1.amazonaws.com/prod-ucs-content-store-eu-west/content/pii:S2468823123004650/HIGHRES/image/jpeg/c5bf6f6f5f2bc5b09994ac65c14eb6cc/gr7_lrg.jpg gr7 gr7_lrg.jpg jpg 792454 3389 2748 IMAGE-HIGH-RES 1-s2.0-S2468823123004650-gr6_lrg.jpg https://s3-eu-west-1.amazonaws.com/prod-ucs-content-store-eu-west/content/pii:S2468823123004650/HIGHRES/image/jpeg/068d420edb5e888a49bd7230c415feb5/gr6_lrg.jpg gr6 gr6_lrg.jpg jpg 575084 1494 2843 IMAGE-HIGH-RES 1-s2.0-S2468823123004650-gr1_lrg.jpg https://s3-eu-west-1.amazonaws.com/prod-ucs-content-store-eu-west/content/pii:S2468823123004650/HIGHRES/image/jpeg/029806b86f68d64b2c2e021c77ca3645/gr1_lrg.jpg gr1 gr1_lrg.jpg jpg 669794 1936 2340 IMAGE-HIGH-RES 1-s2.0-S2468823123004650-gr3_lrg.jpg https://s3-eu-west-1.amazonaws.com/prod-ucs-content-store-eu-west/content/pii:S2468823123004650/HIGHRES/image/jpeg/eaea2f321490849691f2293848bb4f99/gr3_lrg.jpg gr3 gr3_lrg.jpg jpg 674463 2243 2541 IMAGE-HIGH-RES 1-s2.0-S2468823123004650-gr2_lrg.jpg https://s3-eu-west-1.amazonaws.com/prod-ucs-content-store-eu-west/content/pii:S2468823123004650/HIGHRES/image/jpeg/1633a9e22b388107f8f4929597288dca/gr2_lrg.jpg gr2 gr2_lrg.jpg jpg 1795159 2789 2725 IMAGE-HIGH-RES 1-s2.0-S2468823123004650-gr9_lrg.jpg https://s3-eu-west-1.amazonaws.com/prod-ucs-content-store-eu-west/content/pii:S2468823123004650/HIGHRES/image/jpeg/8b819110294c75ef2e45c434c2107c70/gr9_lrg.jpg gr9 gr9_lrg.jpg jpg 766623 2031 2589 IMAGE-HIGH-RES 1-s2.0-S2468823123004650-gr8_lrg.jpg https://s3-eu-west-1.amazonaws.com/prod-ucs-content-store-eu-west/content/pii:S2468823123004650/HIGHRES/image/jpeg/954cd0d9fa634a33eb6d6d8ca1ad30f8/gr8_lrg.jpg gr8 gr8_lrg.jpg jpg 1214455 1864 2883 IMAGE-HIGH-RES 1-s2.0-S2468823123004650-ga1_lrg.jpg https://s3-eu-west-1.amazonaws.com/prod-ucs-content-store-eu-west/content/pii:S2468823123004650/HIGHRES/image/jpeg/864ce3c1efbf918ec0b00b9cde7d6680/ga1_lrg.jpg ga1 true ga1_lrg.jpg jpg 262740 886 1311 IMAGE-HIGH-RES 1-s2.0-S2468823123004650-mmc1.docx https://s3-eu-west-1.amazonaws.com/prod-ucs-content-store-eu-west/content/pii:S2468823123004650/mmc1/MAIN/application/vnd.openxmlformats-officedocument.wordprocessingml.document/37d0f4866acbd327b7336d1a8e25b83f/mmc1.docx mmc1 mmc1.docx docx 12474661 APPLICATION 1-s2.0-S2468823123004650-am.pdf https://s3-eu-west-1.amazonaws.com/prod-ucs-content-store-eu-west/content/egi:10284PZ2G8R/MAIN/application/pdf/4bc7fc0d471e7a086c3b2f0d07fc1b68/am.pdf am am.pdf pdf false 3146412 AAM-PDF MCAT 113381 113381 S2468-8231(23)00465-0 10.1016/j.mcat.2023.113381 Elsevier B.V. Fig. 1 (a) X-ray diffraction (XRD) patterns of the Cu@HZ40, Cu/HZ40, Cu@S-1 and HZ40. (b) Nitrogen adsorption-desorption isotherms of the Cu@HZ40 and Cu/HZ40, with corresponding pore size distribution. (c) FT-IR spectra of Cu@HZ40, Cu/HZ40 and Cu@S-1. (d) 27Al MAS NMR spectra of Cu@HZ40 and Cu/HZ40. Fig 1 Fig. 2 HRTEM images of (a) Cu/HZ40-400R and (b) Cu@HZ40-400R, with corresponding Cu NPS size distribution. (c) HAADF-STEM images of Cu@HZ40-400R, the corresponding EDS-mapping of (d) Cu and Si, (e) Cu, (f) Si, (g) Al, and (h) O. Fig 2 Fig. 3 XRD patterns of Cu@HZ40 and Cu/HZ40 after reduction at different condition. (a) reduced Cu@HZ40, 2 θ=5-75o, (b) reduced Cu@HZ40, 2θ=35-45o. (c) reduced Cu/HZ40, 2θ=5-75o, (d) reduced Cu/HZ40, 2 θ=35-45o. reduction condition: 99.99% H2, 300 °C for 2 h, 400 °C for 2 h, 500 °C for 2 h, and 600°C for 1 h, respectively. Fig 3 Fig. 4 Cu 2p XPS spectrum of (a) Cu@HZ40 and Cu/HZ40, (b) Cu@HZ40-400R and Cu/HZ40-400R. Fig 4 Fig. 5 (a) H2-TPR profile of Cu@HZ40 and Cu/HZ40. (b) NH3-TPD profiles of reduced Cu@HZ40, Cu/HZ40, and Cu@S-1. (c) Pyridine-adsorbed IR (Py-IR) spectra of reduced Cu@HZ40, Cu/HZ40, and Cu@S-1. Fig 5 Fig. 6 Catalyst performance test of (a) FFA conversion, (b) 1,5-PDO selectivity, (c) 1,2-PDO selectivity, and (d) THFA selectivity using Cu@HZ40, Cu/HZ40, and Cu@S-1, respectively. 160°C, 2.5 MPa, WHSV=0.19 h−1. Effect of reaction condition on catalyst performance (e) reaction temperature (2.5 MPa, WHSV=0.19 h−1), (f) reaction pressure (160°C, WHSV=0.19 h−1). Fig 6 Fig. 7 (a) Catalytic stability test of Cu@HZ40 (WHSV=0.19 h−1, 95 °C, 2.5 MPa). (b) Catalytic reusability of Cu@HZ40 sample (WHSV=0.19 h−1, 160 °C, 2.5 MPa). Fig 7 Fig. 8 The differential charge density diagram of (a) Cu@HZ40, (b) Cu/HZ40, and (c) Cu@S-1. The bader charges of Cu atom for (d) Cu@HZ40, (e) Cu/HZ40, and (f) Cu@S-1. Fig 8 Fig. 9 The optimized structures of the intermediates and the transition states for the conversion of FFA to PDO on Cu@HZ40. Gibbs free energy of Cu@HZ40 corresponding to FFA adsorption (Ori), C-O cleavage (TS-1), Hydrogenation of intermediate products (TS-2) and PDO desorption (TS-3). The energy profiles in the red line and the pink line were based on the C2-O and C5-O bond cleavage modes of the FFA ring opening, respectively. The orange, light blue, blue, brown, red and white spheres represent Si, Al, Cu, C, O and H atoms, respectively. Fig 9 Scheme 1 Reaction pathway of FFA with different catalysts. Scheme 1 Scheme 2 The in-situ hydrothermal synthesis process of Cu@HZ40 catalyst. Scheme 2 Table 1 Basic physical properties of catalysts. Table 1 Sample a Cu/wt% a SiO2/Al2O3 b Sext/m2·g−1 c Smic/m2·g−1 V/cm3·g−1 d D/nm Cu@HZ40 1.21 42.7 123.9 98.0 0.46 8.2 Cu/HZ40 1.20 39.8 79.8 225.4 0.17 2.2 a Obtained by XRF. b External surface area. c Micropore specific surface area. d Average pore diameter. In-situ hydrothermal synthesis of Al-rich Cu@ZSM-5 catalyst for furfuryl alcohol upgrading to pentanediols Dengfeng Dai Conceptualization Data curation Investigation Writing – original draft Methodology Formal analysis Visualization Writing – review & editing a Yu Zhang Formal analysis Conceptualization a Ting Zhao Formal analysis Visualization a Dandan Liu Resources Conceptualization Methodology Formal analysis a b ⁎ Chao Feng Resources Conceptualization Methodology Formal analysis Funding acquisition Writing – review & editing c Yunqi Liu Supervision Resources Conceptualization Methodology Formal analysis Writing – review & editing a a State Key Laboratory of Heavy Oil Processing, China University of Petroleum (East China), Qingdao 266580 (China) State Key Laboratory of Heavy Oil Processing China University of Petroleum (East China) Qingdao 266580 China aState Key Laboratory of Heavy Oil Processing, China University of Petroleum (East China), Qingdao 266580 (China) b College of New Energy, China University of Petroleum (East China), Qingdao 266580 (China) College of New Energy China University of Petroleum (East China) Qingdao 266580 China bCollege of New Energy, China University of Petroleum (East China), Qingdao 266580 (China) c Key Laboratory of Biofuels, Qingdao Institute of Bioenergy and Bioprocess Technology, Chinese Academy of Sciences, Qingdao 266101, (China) Key Laboratory of Biofuels Qingdao Institute of Bioenergy and Bioprocess Technology Chinese Academy of Sciences Qingdao 266101 China cKey Laboratory of Biofuels, Qingdao Institute of Bioenergy and Bioprocess Technology, Chinese Academy of Sciences, Qingdao 266101, (China) ⁎ Corresponding author. Bifunctional metal-acid catalysts have been widely used in the process of upgrading the molecules of biomass. As an important bifunctional catalyst, metal @ zeolite exhibits excellent sintering resistance and efficient catalytic performance, which is significant for improving practical applications. While the development of Al-rich zeolite-confined nanocluster catalysts is still a considerable challenge. In this paper, Cu@ZSM-5 (SiO2/Al2O3 = 40) catalyst with Al-rich ZSM-5 zeolite-confined copper nanoclusters were designed and synthesized by the in-situ ligand-assisted hydrothermal crystallization method. The average size of the encapsulation metal clusters was only 2.3 nm after treatment at 400°C for 2 h in a hydrogen environment, which exhibits excellent thermal stability. 27Al MAS NMR and Pyridine-adsorbed IR (Py-IR) spectra confirmed that Al was successfully introduced into the zeolite framework. The intimate metal- Brønsted acidic site distribution enables complete conversion of furfuryl alcohol and 92.1 % selectivity of pentanediols. DFT calculations revealed that the high catalytic activity in catalyzing the ring opening of furfuryl alcohol to pentanediols could be attributed to the unique electronic effect in the Al-rich catalyst Cu@ZSM-5 (SiO2/Al2O3 = 40). The in-situ ligand-assisted hydrothermal crystallization method will be very attractive regarding the simplicity required for industrial production. The Al-rich Cu@ZSM-5 (SiO2/Al2O3 = 40) catalyst was endowed with rich and dense metal-Brønsted acidic sites by a simple in-situ synthesis method, providing a practical and feasible path for the high-value utilization of biomass molecules. Graphical abstract Al-rich Cu@MFI catalyst encapsulating copper nanoparticles exhibits significant pentanediols selectivity and high anti-sintering performance in boosting furfuryl alcohol upgrading to pentanediols. Image, graphical abstract Keywords Pentanediols Encapsulation Cu nanoparticles Furfuryl alcohol Metal-Acid Data availability No data was used for the research described in the article. 1 Introduction Metal nanoparticles (NPS) have essential applications in heterogeneous catalysis due to their high activity [1]. At the same time, metal nanoparticles are unstable in actual catalytic reactions due to their small size and high surface energy, which can easily lead to metal agglomeration [2]. Metal encapsulation strategies have been increasingly investigated in catalytic reactions to overcome the problem of the sintering of metal nanoparticles [3,4]. Zeolites have been extensively studied as encapsulation supports for metal NPS such as Cu [5,6], Ru [7,8], Pd [9,10], and Pt [11]. The metal encapsulation strategies confine the metal particles within zeolite pores or cages and inhibit migration and sintering of metal particles, achieving nanocrystallisation and homogenization of metal species. In addition, the confined environment also has unique effects and significant advantages in improving selectivity and activity [12]. Impregnation and ion exchange are the traditional metal encapsulation strategies for zeolites. However, the impregnation method is limited by the pore size and accessible surface area of the zeolite, which cannot effectively achieve metal encapsulation. It puts forward higher requirements on metal precursors. Ion exchange utilizes charge balance on Si-OH-Al to achieve metal encapsulation, which has the disadvantage of limited metal loading and a significant impact on the acidic properties of the catalyst, especially for reactions that require the participation of acidic functions [13]. The in-situ hydrothermal synthesis avoids the above drawbacks and has attracted the interest of researchers. In previous reports, the in-situ hydrothermal synthesis methods have mainly focused on the synthesis of all silica zeolite-confined metal NPS, such as Pd@Silicalite-1 [14,15], Ni@Silicalite-1 [16] and Rh@Silicalite-1 [17]. However, there are few reports on the in-situ hydrothermal synthesis of confined metal-acid bifunctional catalysts. The activation of C-O and C-C bonds is generally involved in biomass upgrading, which often requires the synergistic effect of metal and acidic sites [18–21]. Furfuryl alcohol (FFA) is a critical biomass platform molecule. The ring-opening of FFA to produce pentanediols (PDO) (Scheme 1 ) can compensate for the lack of petroleum-based pentadiene feedstock [22,23]. This progress has been demonstrated to be a tandem reaction catalyzed by metal-acid bifunctional catalysis [24,25]. Firstly, Furfuryl alcohol is adsorbed onto the catalyst, breaking the C-O in the furan ring under the action of the Brønsted (B) acidic site to form a diene intermediate. The intermediate is then selectively hydrogenated under the action of the activated hydrogen on the metal site to produce the pentanediol. As an essential solid acid, the acidity of the Al-containing zeolite is mainly from the tetra-coordinated Al structure [26]. It has the advantage of being acid-tunable and is widely used in the design of metal-acid bifunctional catalysts. At present, the realization of Al-rich zeolite confined metal clusters faces many challenges. For example, the presence of metal salts leads to the failure of the assembly of zeolite units, which quickly leads to the formation of many non-tetra-coordinated Al species [13]. These problems limit the application scenarios of bifunctional metal@zeolite catalysts. Therefore, the successful synthesis of metal-acid bifunctional metal@zeolite catalysts is of great significance for improving their practical applications. Previous research results have confirmed that Cu and the B acidic sites of zeolite can synergistically catalyze the production of PDO from FFA [27,28]. Here, we developed an Al-rich catalyst Cu@HZ40 (SiO2/Al2O3 = 40) by the in-situ hydrothermal crystallization method, which achieved a highly selective ring opening of furfuryl alcohol to produce pentanediol. 27Al MAS NMR confirmed that Al has intercalated into the zeolite framework as tetracoordination Al. Py-IR spectra and NH3-TPD analyses showed that the catalyst possesses abounds of B acid. After reduction treatment at 400 °C in a hydrogen atmosphere for 2 h, the small-sized copper nanoclusters showed high sintering resistance. The activity evaluation results showed that the selectivity of Cu@HZ40 to pentanediol was much higher than that of the catalyst Cu/HZ40 prepared by the impregnation method. DFT calculations further confirmed that the excellent catalytic activity in the ring opening of FFA to PDO could be attributed to the unique electronic effect of Cu@HZ40. This particular preparation method enables the metal to be encapsulated in the Al-rich zeolite, effectively exploiting the synergistic effect of acid-metal sites and exhibiting efficient catalytic properties. The special structure realizes the proximity of metal and acid sites, inhibits the agglomeration of copper nanoclusters in the reaction process, and shows friendliness to practical applications. 2 Results and discussion 2.1 Synthetic strategy for Cu@HZ40 catalyst The synthesis of MFI zeolites is generally carried out at high temperatures (> 150°C) and alkaline conditions, which poses a challenge to the stability of metal precursors. In this paper, an in situ hydrothermal method assisted by tetraethylenepentamine (TEPA) ligands was adopted to prevent the precipitation of copper precursors during the synthesis process. The synthesis process is shown in Scheme 2 . The interaction between the TEPA ligand and Cu ions is more potent than that between Cu ions and OH ions. Thus, Cu ions are preferentially complex with TEPA, avoiding the precipitation of metal in the form of colloidal hydroxide and leading to the heterogeneous distribution of Cu in MFI. Cu-TEPA binds to the zeolite framework through electrostatic and van der Waals interactions, ensuring uniform distribution and encapsulation of metals in the zeolite. In the process of encapsulation of Cu metal by Al-rich zeolite, the organic structure directing agent will interact with the metal precursor, hindering the construction of the primary zeolite unit. Here, MFI crystal seeds were introduced to direct the construction of primary zeolite units. The synthesis of Cu@HZ40 samples was achieved without introducing sodium ions and avoiding the tedious steps of subsequent ion exchange. 2.2 Characterization of catalysts As shown in Fig 1 a, all samples present the typical structure of MFI. XRF data in Table 1 showed that the Cu content in Cu/HZ40 and Cu@HZ40 was similar, and the SiO2/Al2O3 ratio was close to the theoretical value. These results indicate that the MFI-type zeolite catalyst was successfully synthesized by the in-situ hydrothermal method. The diffraction peaks attributed to CuO in all samples were not observed at 35.5° and 38.7°, indicating that the Cu species present a small particle morphology after calcination. The Cu/HZ40 sample prepared by the impregnation method has an apparently saturated adsorption platform in the low relative pressure region and the absence of a hysteresis loop in the high P/P0 region (Fig 1b). This indicates that Cu/HZ40 was mainly a microporous structure [29]. While the low relative pressure region of the Cu@HZ40 sample shows similar adsorption isotherms to Cu/HZ40, indicating the existence of micropores in Cu@HZ40. In addition, the hysteresis loop and pore size distribution observed in Cu@HZ40 indicate the presence of a hierarchical pore structure. The formation of hierarchical pore structure is probably caused by introducing TEPA, which can promote the diffusion of raw materials and products in the catalytic reaction [30–32]. The micropore area of Cu@HZ40 was only 98.0 m2 / g, which is far lower than that of Cu/HZ40. It may be that the introduction of Cu nanoparticles into the channel and pores reduce the micropore area. While the surface area > 200 m2 / g and the hierarchical pore structure provide sufficient effective active sites for the catalytic reaction. FT-IR was used to record the surface groups of the catalyst. It was found that the presence of characteristic bands at 452 cm−1,798 cm−1, and 1102 cm−1, corresponding to the Si-O vibration peak in the SiO4 unit, and the feature signals at 548 cm−1 and 1226 cm−1 were the characteristic bands of the MFI topological structure [6]. These results showed that the MFI-structured catalyst was successfully synthesized by the in-situ hydrothermal method. The 27Al MAS NMR spectrum of Cu/HZ40 shows a strong resonance centered at 54.1 ppm, attributed to tetracoordinated Al. A primary resonance centered at 54.1 ppm and a weak resonance around 0 ppm corresponding to octahedral-Al were observed in the 27Al MAS NMR spectrum of Cu@HZ40 [7,11], implying that most of the Al atoms were inserted into the zeolite framework. The introduction of Cu did not affect the formation of tetracoordinated Al. HRTEM and EDS-mapping were used to further study the structural morphology of Cu NPS and the distribution of Al in Cu/HZ40-400 R and Cu@HZ40-400 R samples. Fig. 2 a displays that the surface of Cu/HZ40-400R was distributed with Cu NPS in the range of 2-14 nm with an average surface particle size of 7.1 nm. And there were many large particles of Cu species present in the catalyst. Fig. 2b shows Cu NPS with narrow particle size distribution (1-3 nm) and an average pore size of only 2.3 nm. EDX-mapping analysis showed that uniform Cu NPS (Fig. 2d and e) and Al were uniformly distributed in Cu @ HZ40-400R (Fig. 2g), which proved that the in-situ prepared Cu@HZ40-400R maintained smaller Cu NPS and more uniform distribution than the Cu/HZ40-400R prepared by the impregnation method. Due to the low Tamman temperature of copper, Cu NPS is prone to agglomeration in the hydrogen atmosphere during the reaction and reduction process, resulting in reduced utilization efficiency of active sites [33–35]. To further explore the anti-sintering performance of the confined Cu NPS of Cu@HZ40. All samples were treated in the hydrogen atmosphere at different temperature conditions. The results are shown in Fig 3 . For the Cu/HZ40 sample (Fig. 3c and d), a new diffraction peak appeared at 43.3o after treatment in the hydrogen atmosphere at 300°C, corresponding to Cu (111) (JCPDS 04–0836). As the treating temperature increases, the half-width of the diffraction peak at 43.3o decreases, and the peak intensity increases, indicating that the size of the metallic Cu NPS gradually increases and sintering agglomeration. However, the confined Cu@HZ40 sample (Fig. 3a and b) has no Cu (111) diffraction peak that appeared at 43.3 after 400° treatment in a hydrogen atmosphere. Even after 600 °C hydrogen treatment, it still shows excellent sintering resistance. These results indicate that the Cu@HZ40 sample synthesized by the in-situ hydrothermal method exhibits a superior anti-sintering performance due to the unique confinement effect of the zeolite channels or cages on Cu NPS, which inhibits Cu NPS migration and agglomeration in the high-temperature hydrogen atmosphere. XPS was used to characterize the samples after calcination and reduction to explore the surface metal valence of the samples. The results are shown in Fig. 4 a and b. The Cu 2p signal was observed around 943 eV corresponding to the Cu satellite in Cu/HZ40 and Cu@HZ40 samples, which means that the valence state of the sample after calcination mainly exists in the form of Cu2+ [36]. Following reduction, the satellite peak of Cu/HZ40-400R disappeared, indicating that Cu2 + was reduced to Cu +/Cu0. While the satellite peak still existed in the Cu@HZ40-400R, and the Cu 2p 3/2 signals presented two overlapping peaks at 936.1 eV and 933.3 eV, ascribed to Cu2+ and Cu+/Cu0, respectively [37]. Compared to the Cu/HZ40-400R catalyst prepared by the impregnation method, a slight positive shift of 0.4 eV was found in Cu@HZ40-400R. This might indicate that Cu NPS has more positive charges after confinement as the result of electron induction between the Cu NPS and the zeolite framework [6,7]. The reducibility of Cu species in the catalyst was investigated by H2-TPR, and the profiles are displayed in Fig. 5 a. A reduction peak at 240°C was observed for Cu/HZ40, corresponding to the reduction of uniformly distribution CuO to Cu0 particles. Cu@HZ40 shows a low-temperature reduction peak at 198°C, attributed to the small Cu species particles reduce to Cu+ / Cu0 species on the external surface of ZSM-5. Differently, a higher reduction peak appeared at 447°C was shown with Cu@HZ40, attributed to the highly dispersed Cu nanoparticle species inside the zeolite to Cu0 species [38,39]. This was probably caused by the strong interaction between the Cu species and the zeolite, which was similar to the reported results [27]. The acidity property is an essential part of the bifunctional catalyst. The acidity of catalyst was explored employing Py-IR and NH3-TPD, and the corresponding profiles are shown in Fig. 5b and c. The characteristic bands at 1543cm−1, 1490cm−1, and 1452cm−1 were found in the Cu/HZ40 and Cu@HZ40 samples, ascribed to B acid, L + B acid and Lewis (L) acid, respectively [40,41]. No characteristic band around 1543 cm−1 was observed in Cu@S-1 sample, indicating no B acidic sites. In Fig. 5b, the Cu/HZ40 and Cu@HZ40 showed three continuous ammonia desorption peaks in the range of 150-550 °C, indicating the presence of weak acid, medium acid, and strong acid [42]. The ammonia desorption area of Cu@S-1 implies that a small amount of weak acid mainly dominates the acidic properties. It has been reported that the strong acid of the zeolite is primarily derived from the B acid produced by the tetracoordinate Al of the zeolite framework. The center of the strong acid NH3 desorption peak of Cu/HZ40 and Cu@HZ40 is around 400°C, and the peak area is similar, demonstrating that both have identical B acid properties. These results reveal that the Al-rich catalyst prepared by the confinement method possesses rich B-acid properties similar to those of the Cu/HZ40 catalyst prepared by the impregnation method. 2.3 Catalysts performance for the FFA ring-opening to pentanediols The catalytic performance of zeolite-confined Cu NPs was investigated in the selective ring-opening hydrogenation of furfuryl alcohol to pentanediol. For comparison, the reference catalyst was also evaluated under the same conditions. The results are shown in Fig. 6 a-d. Cu@HZ40 shows almost 100 % conversion of FFA with 92.1 % selectivity of PDO (76.4 % 1,5-PDO, 15.7 % 1,2-PDO) in 12 h time on stream (TOS). As a comparison catalyst, Cu/HZ40 achieved a similar FFA conversion within the first 4 hours of reaction, then a gradual decrease in the FFA conversion to 82.9% and a rapid decrease in the PDO selectivity from 88.1% initially to 36.3%, coupled with a gradual increase in the tetrahydrofurfuryl alcohol (THFA) selectivity from 5.0% to 44.4%. These results indicated that the reaction route of FFA hydrogenation to THFA was gradually enhanced as the reaction proceeded, and the reaction route of C-O bond cleavage of the furan ring was inhibited, which may be attributed to the metal-acid bifunctional imbalance caused by Cu NPS agglomeration and acidic carbon deposition in the Cu/HZ40 catalyst. In comparison, Cu@HZ40 prepared by the confined method has better activity and PDO selectivity in the reaction. Its stability was also significantly improved over that of Cu/HZ40 prepared by the impregnation method, which is attributed to its excellent metal sintering resistance and hierarchical pore structure. The unique encapsulation structure endows Cu NPS with higher stability, and the hierarchical pore structure facilitates the diffusion of intermediates and suppresses carbon deposition. The intimate proximity between the Cu NPS confined inside the zeolite and the Brønsted acid sites performed a better synergistic effect, further improving the catalytic activity and product selectivity of Cu@HZ40. The activity of the Cu@S-1 catalyst without tetracoordinated Al decreased rapidly in FFA conversion, and the selectivity of PDO decreased from 42.0% to 34.1%, showing a poor catalytic activity. This was because lacking B acid support limits the C-O cleavage in the furan ring, The confined metal nanoparticles promote the reaction pathway of furfuryl alcohol hydrogenation to THFA, showing high THFA selectivity. The catalytic performance of Cu@HZ40 at different temperatures (80-240 °C) and pressures (0.5-3.5 MPa) was also investigated. The results are shown in Fig. 6e and f. Cu@HZ40 showed a high FFA conversion in the range of 80-240°C, and the FFA conversion was up to 99 % after the reaction temperature exceeded 100°C, showing excellent catalytic activity. The PDO selectivity increased from 45.6% to 92.1% while THFA selectivity decreased from 47.6% to <1% when the reaction temperature was increased from 80°C to 160°C (Fig. S1). These results suggest that the increasing temperature favors the cleavage of the C-O bond in the furan ring and inhibits the reaction route of furfuryl alcohol hydrogenation to THFA. Interestingly, 1,5-PDO is the main product of PDO, and its selectivity is less affected by temperature (100-220°C). This indicates that the selective cleavage rate of the C2-O bond in the furan ring is much higher than that of the C5-O bond, and it is more prone to generate 1,5-PDO under the action of acid-metal bifunctional. Fig. 6f shows the effect of reaction pressure on selectivity and conversion. FFA was almost completely converted within 0.5-3.5MPa. With increasing pressure, the selectivity of PDO increases from 61.1% to 92.1%. It shows the best catalytic performance at 2.5 MPa, after which the selectivity decreases slightly and remains at 86.3% PDO selectivity, indicating that increasing the pressure within a specific range can promote the cleavage of the C-O bond of the furan ring. 2.4 Catalytic stability and reusability The bifunctional metal-B-acid catalyst often suffers from activity deactivation caused by carbon deposition and metal sintering. The XRD patterns of the spent catalyst were shown in Fig. S2. An obvious diffraction peak of Cu metal was observed in Cu / HZ40-spent, indicating that Cu metal particles appeared serious sintering phenomenon. A slight Cu diffraction peak was observed in Cu@HZ40-spent, and a small amount of metal agglomeration was observed in HAADF-STEM images of Cu@HZ40-spent with corresponding EDS mapping (Fig. S3), while most of them showed a uniform dispersion state, indicating that the metal exhibited excellent thermal stability after confined in HZ40. The stability and reusability of the catalyst are very significant for the industrial application. The stability of the Cu@HZ40 sample was evaluated at 95°C, 2.5 MPa, and WHSV = 0.19 h−1, and the result is shown in Fig. 7 a. The FFA conversion slightly decreased from 96.7% to 94.7% and the selectivity of PDO remained unchanged, showing excellent stability. The reusability of the Cu@HZ40 sample was tested at 160°C, 2.5 MPa and WHSV = 0.19 h−1, and the result is shown in Fig. 7b. The selectivity of THFA gradually increases while that of PDO gradually decreases. This may be caused by carbon deposition on B acidic sites, which weakens the ring-opening performance of FFA and strengthens the reaction pathway of FFA hydrogenation to THFA. This was fully confirmed by the TG/DTA result (Fig. S4). Even after two regenerations, the FFA conversion is still close to full conversion and the PDO selectivity reaches over 88%, showing superior reusability. 2.5 DFT calculation B acid sites are predominantly derived from the tetracoordinate alumina of zeolite. It has been shown to play a crucial synergistic role in converting of furfuryl alcohol to pentanediol [28,43]. The high activity of Cu@HZ40 has been further demonstrated using the DFT technique. The d-band of Cu in the catalyst was very close to the Fermi level (Fig. S5d, from − 1.688 eV to − 0.459 eV) after introducing tetracoordinated Al by the in-situ hydrothermal method, which caused a decrease in the surface energy and promoted the adsorption of FFA molecules. It has a lower surface energy than the impregnated Cu/HZ40. This was more conducive to the adsorption of reactant molecules. The differential charge density diagram is shown in Fig. 8 a, b, and c. Compared with Cu/HZ40 and Cu@S-1, Cu@HZ40 has an apparent electron transfer from Cu to HZ40, which improves the electron cloud density of the Al skeleton and is conducive to providing more electrons for participation in the ring-opening reaction. This was confirmed by the Bader charge (Fig. 8d, e, and f), and it was observed that the Cu Bader charges for Cu@HZ40 was significantly lower than that for Cu/HZ40 and Cu@S-1. To further verify the high activity of confined Al-rich Cu@HZ40 in the reaction, the elementary steps with energetic profiles for FFA ring opening on Cu@HZ40, Cu/HZ40, and Cu@S-1 were explored, respectively. The optimized structures of the intermediates and the transition states for the conversion of FFA to PDO on the three catalysts are shown in Figs. 9 , S6 and S7. According to the energy barriers of each step, it could be seen that the FFA ring-opening step (TS-1) was the controlling step of the reaction on all three catalysts. The ring-opening energy barrier of FFA at the C2-O cleavage was significantly lower than that at the C5-O cleavage. This is why PDO is dominated by 1,5-PDO in the product. By comparing the Cu@HZ40 and Cu@S-1 catalysts, the ring-opening energy barrier of FFA at the C2-O position on Cu@HZ40 was reduced from 2.27 eV to 1.84 eV after the introduction of tetracoordinate Al. This indicates that the introduction of tetracoordinate Al (B acidic site) reduces the ring-opening energy barrier of C2-O cleavage and improves the catalytic activity of Cu@HZ40. Simultaneously, the ring-opening energy barrier of Cu@HZ40 at the C2-O position of FFA is also lower than that of Cu/HZ40 prepared by impregnation (1.97 eV). This is because the unique preparation method obtains a close acid-metal distance and exhibits better activity in the reaction. 3 Conclusions In conclusion, we have successfully synthesized a Cu@HZ40 catalyst with Cu NPS confined in an Al-rich zeolite, which has uniformly dispersed small Cu nanoparticles and exhibits excellent anti-sintering performance in a high-temperature hydrogen environment. The successful introduction of tetracoordinated Al endows the catalyst with abundant B acid sites, achieving a complete FFA conversion and 92.1% PDO selectivity. DFT further proves that the unique metal-acid site structure after encapsulation significantly improves the ability to perform ring opening of furfuryl alcohol. Compared to metal/zeolite, the proximity of acid and metal sites in metal @ zeolite improves catalytic activity, which is more conducive to fully utilizing the metal-acid synergistic effect. This inspires the design and application of bifunctional anti-metal agglomeration catalysts. CRediT authorship contribution statement Dengfeng Dai: Conceptualization, Data curation, Investigation, Writing – original draft, Methodology, Formal analysis, Visualization, Writing – review & editing. Yu Zhang: Formal analysis, Conceptualization. Ting Zhao: Formal analysis, Visualization. Dandan Liu: Resources, Conceptualization, Methodology, Formal analysis. Chao Feng: Resources, Conceptualization, Methodology, Formal analysis, Funding acquisition, Writing – review & editing. Yunqi Liu: Supervision, Resources, Conceptualization, Methodology, Formal analysis, Writing – review & editing. Declaration of Competing Interest There are no conflicts to declare. Acknowledgements This work has been financially supported by the National Natural Science Foundation of China (22005342), the Fundamental Research funds for the Central Universities(20CX02217A), the Opening Fund of State Key Laboratory of Heavy Oil Processing. Supplementary materials Supplementary material associated with this article can be found, in the online version, at doi:10.1016/j.mcat.2023.113381. Appendix Supplementary materials Image, application 1 References [1] X. Shi Copper catalysts in semihydrogenation of acetylene: from single atoms to nanoparticles ACS Catal.. 10 5 2020 3495 3504 Shi, X., et al., Copper catalysts in semihydrogenation of acetylene: from single atoms to nanoparticles. ACS Catal.., 2020. 10(5): p. 3495-3504. [2] D. Farrusseng A. Tuel Perspectives on zeolite-encapsulated metal nanoparticles and their applications in catalysis New J. Chem. 4 5 2016 3933 3949 Farrusseng, D. and A. Tuel, Perspectives on zeolite-encapsulated metal nanoparticles and their applications in catalysis. New J. Chem., 2016. 4(5): p. 3933-3949. [3] L. Wang New strategies for the preparation of sinter-resistant metal-nanoparticle-based catalysts Adv. Mater. 31 50 2019 1901905 Wang, L., et al., New strategies for the preparation of sinter-resistant metal-nanoparticle-based catalysts. Adv. Mater., 2019. 31(50): p. 1901905. [4] J. Zhang Sinter-resistant metal nanoparticle catalysts achieved by immobilization within zeolite crystals via seed-directed growth Nat. Catal. 1 7 2018 540 546 Zhang, J., et al., Sinter-resistant metal nanoparticle catalysts achieved by immobilization within zeolite crystals via seed-directed growth. Nat. Catal., 2018. 1(7): p. 540-546. [5] H. Wang Controlling reaction pathways via selective C-O activation for highly efficient biomass oriented-upgrading Chem. Eng. J. 446 2022 137404 Wang, H., et al., Controlling reaction pathways via selective C-O activation for highly efficient biomass oriented-upgrading. Chem. Eng. J., 2022. 446: p. 137404. [6] P. Cao Zeolite-encapsulated Cu nanoparticles for the selective hydrogenation of furfural to furfuryl alcohol ACS Catal. 11 16 2021 10246 10256 Cao, P., et al., Zeolite-encapsulated Cu nanoparticles for the selective hydrogenation of furfural to furfuryl alcohol. ACS Catal., 2021. 11(16): p. 10246-10256. [7] J. Yang Enhanced catalytic performance through in situ encapsulation of ultrafine Ru clusters within a high-aluminum zeolite ACS Catal. 12 3 2022 1847 1856 Yang, J., et al., Enhanced catalytic performance through in situ encapsulation of ultrafine Ru clusters within a high-aluminum zeolite. ACS Catal., 2022. 12(3): p. 1847-1856. [8] P. He Boosting the catalytic activity and stability of Ru metal clusters in hydrodeoxygenation of guaiacol through MWW zeolite pore constraints ACS Catal. 12 23 2022 14717 14726 He, P., et al., Boosting the catalytic activity and stability of Ru metal clusters in hydrodeoxygenation of guaiacol through MWW zeolite pore constraints. ACS Catal., 2022. 12(23): p. 14717-14726. [9] Z. Jin Metal-acid interfaces enveloped in zeolite crystals for cascade biomass hydrodeoxygenation Appl. Catal. B 254 2019 560 568 Jin, Z., et al., Metal-acid interfaces enveloped in zeolite crystals for cascade biomass hydrodeoxygenation. Appl. Catal. B, 2019. 254: p. 560-568. [10] M. Gao Methane combustion over palladium catalyst within the confined space of MFI zeolite Chin. J. Catal. 42 10 2021 1689 1699 Gao, M., et al., Methane combustion over palladium catalyst within the confined space of MFI zeolite. Chin. J. Catal., 2021. 42(10): p. 1689-1699. [11] H.J. Cho Zeolite-encapsulated Pt nanoparticles for tandem catalysis J. Am. Chem. Soc. 140 41 2018 13514 13520 Cho, H.J., et al., Zeolite-encapsulated Pt nanoparticles for tandem catalysis. J. Am. Chem. Soc., 2018. 140(41): p. 13514-13520. [12] N. Wang Q. Sun J. Yu Ultrasmall metal nanoparticles confined within crystalline nanoporous materials: a fascinating class of nanocatalysts Adv. Mater. 31 1 2019 1803966 Wang, N., Q. Sun and J. Yu, Ultrasmall metal nanoparticles confined within crystalline nanoporous materials: a fascinating class of nanocatalysts. Adv. Mater., 2019. 31(1): p. 1803966. [13] X. Li S. Ma H. Li Zeolite confinement-catalyzed cleavage of C-O/C-C bonds in biomass Green Chem. 24 19 2022 7243 7728 Li, X., S. Ma and H. Li, Zeolite confinement-catalyzed cleavage of C-O/C-C bonds in biomass. Green Chem., 2022. 24(19): p. 7243-728. [14] C. Wang Importance of Zeolite Wettability for Selective Hydrogenation of Furfural over Pd@Zeolite Catalysts ACS Catal. 8 1 2018 474 481 Wang, C., et al., Importance of Zeolite Wettability for Selective Hydrogenation of Furfural over Pd@Zeolite Catalysts. ACS Catal., 2018. 8(1): p. 474-481. [15] N. Wang In situ confinement of ultrasmall Pd clusters within nanosized silicalite-1 zeolite for highly efficient catalysis of hydrogen generation J. Am. Chem. Soc. 138 24 2016 7484 7487 Wang, N., et al., In situ confinement of ultrasmall Pd clusters within nanosized silicalite-1 zeolite for highly efficient catalysis of hydrogen generation. J. Am. Chem. Soc., 2016. 138(24): p. 7484-7487. [16] Y. Shi Temperature-dependent selectivity of hydrogenation/hydrogenolysis during phenol conversion over Ni catalysts ACS Sustain. Chem. Eng. 7 10 2019 9464 9473 Shi, Y., et al., Temperature-dependent selectivity of hydrogenation/hydrogenolysis during phenol conversion over Ni catalysts. ACS Sustain. Chem. Eng., 2019. 7(10): p. 9464-9473. [17] Q. Sun Zeolite‒encaged single‒atom rhodium catalysts: highly‒efficient hydrogen generation and shape‒selective tandem hydrogenation of nitroarenes Angew. Chem. Int. Ed. 58 51 2019 18570 18576 Sun, Q., et al., Zeolite‒encaged single‒atom rhodium catalysts: highly‒efficient hydrogen generation and shape‒selective tandem hydrogenation of nitroarenes. Angew. Chem. Int. Ed., 2019. 58(51): p. 18570-18576. [18] D. Sun Production of C4 and C5 alcohols from biomass-derived materials Green Chem. 18 9 2016 2579 2597 Sun, D., et al., Production of C4 and C5 alcohols from biomass-derived materials. Green Chem., 2016. 18(9): p. 2579-2597. [19] X. Fu Synergistic catalytic hydrogenation of furfural to 1,2-pentanediol and 1,5-pentanediol with LDO derived from CuMgAl hydrotalcite Mol. Catal. 499 2021 111298 Fu, X., et al., Synergistic catalytic hydrogenation of furfural to 1,2-pentanediol and 1,5-pentanediol with LDO derived from CuMgAl hydrotalcite. Mol. Catal., 2021. 499: p. 111298. [20] H. Liu Selective hydrogenolysis of biomass-derived furfuryl alcohol into 1,2-and 1,5-pentanediol over highly dispersed Cu-Al2O3 catalysts Chin. J. Catal. 37 2016 700 710 Liu, H., et al., Selective hydrogenolysis of biomass-derived furfuryl alcohol into 1,2-and 1,5-pentanediol over highly dispersed Cu-Al2O3 catalysts. Chin. J. Catal., 2016. 37: p. 700-710. [21] Y.S. Yun C.E. Berdugo-Díaz D.W. Flaherty Advances in understanding the selective hydrogenolysis of biomass derivatives ACS Catal. 11 17 2021 11193 11232 Yun, Y.S., C.E. Berdugo-Díaz and D.W. Flaherty, Advances in understanding the selective hydrogenolysis of biomass derivatives. ACS Catal. 2021. 11(17): p. 11193-11232. [22] Z. Yang Production of biomass-derived monomers through catalytic conversion of furfural and hydroxymethylfurfural Green Chem. Eng. 2 2 2021 158 173 Yang, Z., et al., Production of biomass-derived monomers through catalytic conversion of furfural and hydroxymethylfurfural. Green Chem. Eng., 2021. 2(2): p. 158-173. [23] X. Li P. Jia T. Wang Furfural: a promising platform compound for sustainable production of C4 and C5 chemicals ACS Catal. 6 11 2016 7621 7640 Li, X., P. Jia and T. Wang, Furfural: a promising platform compound for sustainable production of C4 and C5 chemicals. ACS Catal., 2016. 6(11): p. 7621-7640. [24] H. Liu Efficient hydrogenolysis of biomass-derived furfuryl alcohol to 1,2-and 1,5-pentanediols over a non-precious Cu-Mg3AlO4.5 bifunctional catalyst Catal. Sci. Technol. 6 2016 668 671 Liu, H., et al., Efficient hydrogenolysis of biomass-derived furfuryl alcohol to 1,2-and 1,5-pentanediols over a non-precious Cu-Mg3AlO4.5 bifunctional catalyst. Catal. Sci. Technol., 2016. 6: p. 668-671. [25] Z. Zhao Synergistic catalysis for promoting ring-opening hydrogenation of biomass-derived cyclic oxygenates ACS Catal. 2023 5170 5193 Zhao, Z., et al., Synergistic catalysis for promoting ring-opening hydrogenation of biomass-derived cyclic oxygenates. ACS Catal., 2023: p. 5170-5193. [26] J. Zhang The origin of the activity and selectivity of silicalite-1 zeolite for toluene methylation to para -xylene Chem. Eng. J. 327 2017 278 285 Zhang, J., et al., The origin of the activity and selectivity of silicalite-1 zeolite for toluene methylation to para -xylene. Chem. Eng. J., 2017. 327: p. 278-285. [27] D. Dai Ring-opening of furfuryl alcohol to pentanediol with hierarchically structured Cu-MFI catalysts Microporous Mesoporous Mater. 351 2023 112484 Dai, D., et al., Ring-opening of furfuryl alcohol to pentanediol with hierarchically structured Cu-MFI catalysts. Microporous Mesoporous Mater., 2023. 351: p. 112484. [28] D. Dai Ring-opening of furfuryl alcohol to pentanediol with extremely high selectivity over Cu/MFI catalysts with balanced Cu0‒Cu+ and Brønsted acid sites Catal. Sci. Technol. 12 19 2022 5879 5890 Dai, D., et al., Ring-opening of furfuryl alcohol to pentanediol with extremely high selectivity over Cu/MFI catalysts with balanced Cu0‒Cu+ and Brønsted acid sites. Catal. Sci. Technol., 2022. 12(19): p. 5879-5890. [29] M. Thommes Physisorption of gases, with special reference to the evaluation of surface area and pore size distribution (IUPAC Technical Report) Pure Appl. Chem. 87 9 2015 1051 1069 Thommes, M., et al., Physisorption of gases, with special reference to the evaluation of surface area and pore size distribution (IUPAC Technical Report). Pure Appl. Chem., 2015. 87(9): p. 1051-1069. [30] S. Mardiana Hierarchical zeolite for biomass conversion to biofuel: A review Fuel 309 2022 122119 Mardiana, S., et al., Hierarchical zeolite for biomass conversion to biofuel: A review. Fuel, 2022. 309: p. 122119. [31] M. Sun Applications of hierarchically structured porous materials from energy storage and conversion, catalysis, photocatalysis, adsorption, separation, and sensing to biomedicine Chem. Soc. Rev. 45 12 2016 3479 3563 Sun, M., et al., Applications of hierarchically structured porous materials from energy storage and conversion, catalysis, photocatalysis, adsorption, separation, and sensing to biomedicine. Chem. Soc. Rev., 2016. 45(12): p. 3479-3563. [32] D. Kerstens State of the art and perspectives of hierarchical zeolites: practical overview of synthesis methods and use in catalysis Adv. Mater. 32 44 2020 2004690 Kerstens, D., et al., State of the art and perspectives of hierarchical zeolites: practical overview of synthesis methods and use in catalysis. Adv. Mater., 2020. 32(44): p. 2004690. [33] H. Yang A highly stable copper-based catalyst for clarifying the catalytic roles of Cu0 and Cu+ species in methanol dehydrogenation Angew. Chem. Int. Ed. 57 7 2018 1836 1840 Yang, H., et al., A highly stable copper-based catalyst for clarifying the catalytic roles of Cu0 and Cu+ species in methanol dehydrogenation. Angew. Chem. Int. Ed., 2018. 57(7): p. 1836-1840. [34] H. Yue A copper-phyllosilicate core-sheath nanoreactor for carbon-oxygen hydrogenolysis reactions Nat. Commun. 4 1 2013 1 7 Yue, H., et al., A copper-phyllosilicate core-sheath nanoreactor for carbon-oxygen hydrogenolysis reactions. Nat. Commun., 2013. 4(1): p. 1-7. [35] C. Xu Interfacing with silica boosts the catalysis of copper Nat. Commun. 9 1 2018 Xu, C., et al., Interfacing with silica boosts the catalysis of copper. Nat. Commun., 2018. 9(1). [36] C. Chen Mannitol as a novel dopant for Cu/SiO2: A low-cost, environmental and highly stable catalyst for dimethyl oxalate hydrogenation without hydrogen prereduction J. Catal. 389 2020 421 431 Chen, C., et al., Mannitol as a novel dopant for Cu/SiO2: A low-cost, environmental and highly stable catalyst for dimethyl oxalate hydrogenation without hydrogen prereduction. J. Catal., 2020. 389: p. 421-431. [37] J. Gong Synthesis of ethanol via syngas on Cu/SiO2 catalysts with balanced Cu0‒Cu+ sites J. Am. Chem. Soc. 134 34 2012 13922 13925 Gong, J., et al., Synthesis of ethanol via syngas on Cu/SiO2 catalysts with balanced Cu0‒Cu+ sites. J. Am. Chem. Soc., 2012. 134(34): p. 13922-13925. [38] A. Sultana Influence of co-cations on the formation of Cu+ species in Cu/ZSM-5 and its effect on selective catalytic reduction of NOx with NH3 Appl. Catal. B 101 1-2 2010 61 67 Sultana, A., et al., Influence of co-cations on the formation of Cu+ species in Cu/ZSM-5 and its effect on selective catalytic reduction of NOx with NH3. Appl. Catal. B, 2010. 101(1-2): p. 61-67. [39] M. Richter Oxidative gas phase carbonylation of methanol to dimethyl carbonate over chloride-free Cu-impregnated zeolite Y catalysts at elevated pressure Appl. Catal. B 73 3-4 2007 269 281 Richter, M., et al., Oxidative gas phase carbonylation of methanol to dimethyl carbonate over chloride-free Cu-impregnated zeolite Y catalysts at elevated pressure. Appl. Catal. B, 2007. 73(3-4): p. 269-281. [40] F. Yaripour Effect of boron incorporation on the structure, products selectivities and lifetime of H-ZSM-5 nanocatalyst designed for application in methanol-to-olefins (MTO) reaction Microporous Mesoporous Mater. 203 2015 41 53 Yaripour, F., et al., Effect of boron incorporation on the structure, products selectivities and lifetime of H-ZSM-5 nanocatalyst designed for application in methanol-to-olefins (MTO) reaction. Microporous Mesoporous Mater., 2015. 203: p. 41-53. [41] S.H. Begum Acidity-activity correlation over bimetallic iron-based ZSM-5 catalysts during selective catalytic reduction of NO by NH3 J. Mol. Catal. A 423 2016 423 432 Begum, S.H., et al., Acidity-activity correlation over bimetallic iron-based ZSM-5 catalysts during selective catalytic reduction of NO by NH3. J. Mol. Catal. A, 2016. 423: p. 423-432. [42] T. Song Efficient synthesis of methanol and ethylene glycol via the hydrogenation of CO2-derived ethylene carbonate on Cu/SiO2 catalysts with balanced Cu+‒Cu0 sites Catal. Sci. Technol. 10 15 2020 5149 5162 Song, T., et al., Efficient synthesis of methanol and ethylene glycol via the hydrogenation of CO2-derived ethylene carbonate on Cu/SiO2 catalysts with balanced Cu+‒Cu0 sites. Catal. Sci. Technol., 2020. 10(15): p. 5149-5162. [43] M. Chia Selective hydrogenolysis of polyols and cyclic ethers over bifunctional surface sites on Rhodium-Rhenium catalysts J. Am. Chem. Soc. 133 32 2011 12675 12689 Chia, M., et al., Selective hydrogenolysis of polyols and cyclic ethers over bifunctional surface sites on Rhodium-Rhenium catalysts. J. Am. Chem. Soc., 2011. 133(32): p. 12675-12689.",
      "scopus-id": "85165002913",
      "coredata": {
        "eid": "1-s2.0-S2468823123004650",
        "dc:description": "Bifunctional metal-acid catalysts have been widely used in the process of upgrading the molecules of biomass. As an important bifunctional catalyst, metal @ zeolite exhibits excellent sintering resistance and efficient catalytic performance, which is significant for improving practical applications. While the development of Al-rich zeolite-confined nanocluster catalysts is still a considerable challenge. In this paper, Cu@ZSM-5 (SiO2/Al2O3 = 40) catalyst with Al-rich ZSM-5 zeolite-confined copper nanoclusters were designed and synthesized by the in-situ ligand-assisted hydrothermal crystallization method. The average size of the encapsulation metal clusters was only 2.3 nm after treatment at 400°C for 2 h in a hydrogen environment, which exhibits excellent thermal stability. 27Al MAS NMR and Pyridine-adsorbed IR (Py-IR) spectra confirmed that Al was successfully introduced into the zeolite framework. The intimate metal- Brønsted acidic site distribution enables complete conversion of furfuryl alcohol and 92.1 % selectivity of pentanediols. DFT calculations revealed that the high catalytic activity in catalyzing the ring opening of furfuryl alcohol to pentanediols could be attributed to the unique electronic effect in the Al-rich catalyst Cu@ZSM-5 (SiO2/Al2O3 = 40). The in-situ ligand-assisted hydrothermal crystallization method will be very attractive regarding the simplicity required for industrial production. The Al-rich Cu@ZSM-5 (SiO2/Al2O3 = 40) catalyst was endowed with rich and dense metal-Brønsted acidic sites by a simple in-situ synthesis method, providing a practical and feasible path for the high-value utilization of biomass molecules.",
        "openArchiveArticle": "false",
        "prism:coverDate": "2023-08-31",
        "openaccessUserLicense": null,
        "prism:aggregationType": "Journal",
        "prism:url": "https://api.elsevier.com/content/article/pii/S2468823123004650",
        "dc:creator": [
          {
            "@_fa": "true",
            "$": "Dai, Dengfeng"
          },
          {
            "@_fa": "true",
            "$": "Zhang, Yu"
          },
          {
            "@_fa": "true",
            "$": "Zhao, Ting"
          },
          {
            "@_fa": "true",
            "$": "Liu, Dandan"
          },
          {
            "@_fa": "true",
            "$": "Feng, Chao"
          },
          {
            "@_fa": "true",
            "$": "Liu, Yunqi"
          }
        ],
        "link": [
          {
            "@_fa": "true",
            "@rel": "self",
            "@href": "https://api.elsevier.com/content/article/pii/S2468823123004650"
          },
          {
            "@_fa": "true",
            "@rel": "scidir",
            "@href": "https://www.sciencedirect.com/science/article/pii/S2468823123004650"
          }
        ],
        "dc:format": "application/json",
        "openaccessType": null,
        "pii": "S2468-8231(23)00465-0",
        "prism:volume": "547",
        "articleNumber": "113381",
        "prism:publisher": "Elsevier B.V.",
        "dc:title": "In-situ hydrothermal synthesis of Al-rich Cu@ZSM-5 catalyst for furfuryl alcohol upgrading to pentanediols",
        "prism:copyright": "© 2023 Elsevier B.V. All rights reserved.",
        "openaccess": "0",
        "prism:issn": "24688231",
        "dcterms:subject": [
          {
            "@_fa": "true",
            "$": "Pentanediols"
          },
          {
            "@_fa": "true",
            "$": "Encapsulation"
          },
          {
            "@_fa": "true",
            "$": "Cu nanoparticles"
          },
          {
            "@_fa": "true",
            "$": "Furfuryl alcohol"
          },
          {
            "@_fa": "true",
            "$": "Metal-Acid"
          }
        ],
        "openaccessArticle": "false",
        "prism:publicationName": "Molecular Catalysis",
        "openaccessSponsorType": null,
        "prism:pageRange": "113381",
        "pubType": "fla",
        "prism:coverDisplayDate": "August 2023",
        "prism:doi": "10.1016/j.mcat.2023.113381",
        "prism:startingPage": "113381",
        "dc:identifier": "doi:10.1016/j.mcat.2023.113381",
        "openaccessSponsorName": null
      },
      "objects": {
        "object": [
          {
            "@category": "standard",
            "@height": "159",
            "@width": "637",
            "@_fa": "true",
            "$": "https://api.elsevier.com/content/object/eid/1-s2.0-S2468823123004650-sc2.jpg?httpAccept=%2A%2F%2A",
            "@multimediatype": "JPEG image file",
            "@type": "IMAGE-DOWNSAMPLED",
            "@size": "50759",
            "@ref": "sc2",
            "@mimetype": "image/jpeg"
          },
          {
            "@category": "standard",
            "@height": "282",
            "@width": "629",
            "@_fa": "true",
            "$": "https://api.elsevier.com/content/object/eid/1-s2.0-S2468823123004650-sc1.jpg?httpAccept=%2A%2F%2A",
            "@multimediatype": "JPEG image file",
            "@type": "IMAGE-DOWNSAMPLED",
            "@size": "29527",
            "@ref": "sc1",
            "@mimetype": "image/jpeg"
          },
          {
            "@category": "standard",
            "@height": "187",
            "@width": "643",
            "@_fa": "true",
            "$": "https://api.elsevier.com/content/object/eid/1-s2.0-S2468823123004650-gr5.jpg?httpAccept=%2A%2F%2A",
            "@multimediatype": "JPEG image file",
            "@type": "IMAGE-DOWNSAMPLED",
            "@size": "38586",
            "@ref": "gr5",
            "@mimetype": "image/jpeg"
          },
          {
            "@category": "standard",
            "@height": "281",
            "@width": "634",
            "@_fa": "true",
            "$": "https://api.elsevier.com/content/object/eid/1-s2.0-S2468823123004650-gr4.jpg?httpAccept=%2A%2F%2A",
            "@multimediatype": "JPEG image file",
            "@type": "IMAGE-DOWNSAMPLED",
            "@size": "50562",
            "@ref": "gr4",
            "@mimetype": "image/jpeg"
          },
          {
            "@category": "standard",
            "@height": "766",
            "@width": "621",
            "@_fa": "true",
            "$": "https://api.elsevier.com/content/object/eid/1-s2.0-S2468823123004650-gr7.jpg?httpAccept=%2A%2F%2A",
            "@multimediatype": "JPEG image file",
            "@type": "IMAGE-DOWNSAMPLED",
            "@size": "106805",
            "@ref": "gr7",
            "@mimetype": "image/jpeg"
          },
          {
            "@category": "standard",
            "@height": "337",
            "@width": "642",
            "@_fa": "true",
            "$": "https://api.elsevier.com/content/object/eid/1-s2.0-S2468823123004650-gr6.jpg?httpAccept=%2A%2F%2A",
            "@multimediatype": "JPEG image file",
            "@type": "IMAGE-DOWNSAMPLED",
            "@size": "85550",
            "@ref": "gr6",
            "@mimetype": "image/jpeg"
          },
          {
            "@category": "standard",
            "@height": "437",
            "@width": "528",
            "@_fa": "true",
            "$": "https://api.elsevier.com/content/object/eid/1-s2.0-S2468823123004650-gr1.jpg?httpAccept=%2A%2F%2A",
            "@multimediatype": "JPEG image file",
            "@type": "IMAGE-DOWNSAMPLED",
            "@size": "89216",
            "@ref": "gr1",
            "@mimetype": "image/jpeg"
          },
          {
            "@category": "standard",
            "@height": "507",
            "@width": "574",
            "@_fa": "true",
            "$": "https://api.elsevier.com/content/object/eid/1-s2.0-S2468823123004650-gr3.jpg?httpAccept=%2A%2F%2A",
            "@multimediatype": "JPEG image file",
            "@type": "IMAGE-DOWNSAMPLED",
            "@size": "102073",
            "@ref": "gr3",
            "@mimetype": "image/jpeg"
          },
          {
            "@category": "standard",
            "@height": "629",
            "@width": "615",
            "@_fa": "true",
            "$": "https://api.elsevier.com/content/object/eid/1-s2.0-S2468823123004650-gr2.jpg?httpAccept=%2A%2F%2A",
            "@multimediatype": "JPEG image file",
            "@type": "IMAGE-DOWNSAMPLED",
            "@size": "182238",
            "@ref": "gr2",
            "@mimetype": "image/jpeg"
          },
          {
            "@category": "standard",
            "@height": "459",
            "@width": "585",
            "@_fa": "true",
            "$": "https://api.elsevier.com/content/object/eid/1-s2.0-S2468823123004650-gr9.jpg?httpAccept=%2A%2F%2A",
            "@multimediatype": "JPEG image file",
            "@type": "IMAGE-DOWNSAMPLED",
            "@size": "106662",
            "@ref": "gr9",
            "@mimetype": "image/jpeg"
          },
          {
            "@category": "standard",
            "@height": "421",
            "@width": "651",
            "@_fa": "true",
            "$": "https://api.elsevier.com/content/object/eid/1-s2.0-S2468823123004650-gr8.jpg?httpAccept=%2A%2F%2A",
            "@multimediatype": "JPEG image file",
            "@type": "IMAGE-DOWNSAMPLED",
            "@size": "153527",
            "@ref": "gr8",
            "@mimetype": "image/jpeg"
          },
          {
            "@category": "standard",
            "@height": "200",
            "@width": "296",
            "@_fa": "true",
            "$": "https://api.elsevier.com/content/object/eid/1-s2.0-S2468823123004650-ga1.jpg?httpAccept=%2A%2F%2A",
            "@multimediatype": "JPEG image file",
            "@type": "IMAGE-DOWNSAMPLED",
            "@size": "34894",
            "@ref": "ga1",
            "@mimetype": "image/jpeg"
          },
          {
            "@category": "thumbnail",
            "@height": "55",
            "@width": "219",
            "@_fa": "true",
            "$": "https://api.elsevier.com/content/object/eid/1-s2.0-S2468823123004650-sc2.sml?httpAccept=%2A%2F%2A",
            "@multimediatype": "GIF image file",
            "@type": "IMAGE-THUMBNAIL",
            "@size": "8741",
            "@ref": "sc2",
            "@mimetype": "image/gif"
          },
          {
            "@category": "thumbnail",
            "@height": "98",
            "@width": "219",
            "@_fa": "true",
            "$": "https://api.elsevier.com/content/object/eid/1-s2.0-S2468823123004650-sc1.sml?httpAccept=%2A%2F%2A",
            "@multimediatype": "GIF image file",
            "@type": "IMAGE-THUMBNAIL",
            "@size": "5483",
            "@ref": "sc1",
            "@mimetype": "image/gif"
          },
          {
            "@category": "thumbnail",
            "@height": "64",
            "@width": "219",
            "@_fa": "true",
            "$": "https://api.elsevier.com/content/object/eid/1-s2.0-S2468823123004650-gr5.sml?httpAccept=%2A%2F%2A",
            "@multimediatype": "GIF image file",
            "@type": "IMAGE-THUMBNAIL",
            "@size": "7823",
            "@ref": "gr5",
            "@mimetype": "image/gif"
          },
          {
            "@category": "thumbnail",
            "@height": "97",
            "@width": "219",
            "@_fa": "true",
            "$": "https://api.elsevier.com/content/object/eid/1-s2.0-S2468823123004650-gr4.sml?httpAccept=%2A%2F%2A",
            "@multimediatype": "GIF image file",
            "@type": "IMAGE-THUMBNAIL",
            "@size": "10410",
            "@ref": "gr4",
            "@mimetype": "image/gif"
          },
          {
            "@category": "thumbnail",
            "@height": "164",
            "@width": "133",
            "@_fa": "true",
            "$": "https://api.elsevier.com/content/object/eid/1-s2.0-S2468823123004650-gr7.sml?httpAccept=%2A%2F%2A",
            "@multimediatype": "GIF image file",
            "@type": "IMAGE-THUMBNAIL",
            "@size": "9788",
            "@ref": "gr7",
            "@mimetype": "image/gif"
          },
          {
            "@category": "thumbnail",
            "@height": "115",
            "@width": "219",
            "@_fa": "true",
            "$": "https://api.elsevier.com/content/object/eid/1-s2.0-S2468823123004650-gr6.sml?httpAccept=%2A%2F%2A",
            "@multimediatype": "GIF image file",
            "@type": "IMAGE-THUMBNAIL",
            "@size": "13121",
            "@ref": "gr6",
            "@mimetype": "image/gif"
          },
          {
            "@category": "thumbnail",
            "@height": "164",
            "@width": "198",
            "@_fa": "true",
            "$": "https://api.elsevier.com/content/object/eid/1-s2.0-S2468823123004650-gr1.sml?httpAccept=%2A%2F%2A",
            "@multimediatype": "GIF image file",
            "@type": "IMAGE-THUMBNAIL",
            "@size": "14720",
            "@ref": "gr1",
            "@mimetype": "image/gif"
          },
          {
            "@category": "thumbnail",
            "@height": "164",
            "@width": "186",
            "@_fa": "true",
            "$": "https://api.elsevier.com/content/object/eid/1-s2.0-S2468823123004650-gr3.sml?httpAccept=%2A%2F%2A",
            "@multimediatype": "GIF image file",
            "@type": "IMAGE-THUMBNAIL",
            "@size": "14386",
            "@ref": "gr3",
            "@mimetype": "image/gif"
          },
          {
            "@category": "thumbnail",
            "@height": "164",
            "@width": "160",
            "@_fa": "true",
            "$": "https://api.elsevier.com/content/object/eid/1-s2.0-S2468823123004650-gr2.sml?httpAccept=%2A%2F%2A",
            "@multimediatype": "GIF image file",
            "@type": "IMAGE-THUMBNAIL",
            "@size": "21278",
            "@ref": "gr2",
            "@mimetype": "image/gif"
          },
          {
            "@category": "thumbnail",
            "@height": "164",
            "@width": "209",
            "@_fa": "true",
            "$": "https://api.elsevier.com/content/object/eid/1-s2.0-S2468823123004650-gr9.sml?httpAccept=%2A%2F%2A",
            "@multimediatype": "GIF image file",
            "@type": "IMAGE-THUMBNAIL",
            "@size": "14504",
            "@ref": "gr9",
            "@mimetype": "image/gif"
          },
          {
            "@category": "thumbnail",
            "@height": "142",
            "@width": "219",
            "@_fa": "true",
            "$": "https://api.elsevier.com/content/object/eid/1-s2.0-S2468823123004650-gr8.sml?httpAccept=%2A%2F%2A",
            "@multimediatype": "GIF image file",
            "@type": "IMAGE-THUMBNAIL",
            "@size": "23032",
            "@ref": "gr8",
            "@mimetype": "image/gif"
          },
          {
            "@category": "thumbnail",
            "@height": "148",
            "@width": "219",
            "@_fa": "true",
            "$": "https://api.elsevier.com/content/object/eid/1-s2.0-S2468823123004650-ga1.sml?httpAccept=%2A%2F%2A",
            "@multimediatype": "GIF image file",
            "@type": "IMAGE-THUMBNAIL",
            "@size": "16996",
            "@ref": "ga1",
            "@mimetype": "image/gif"
          },
          {
            "@category": "high",
            "@height": "704",
            "@width": "2820",
            "@_fa": "true",
            "$": "https://api.elsevier.com/content/object/eid/1-s2.0-S2468823123004650-sc2_lrg.jpg?httpAccept=%2A%2F%2A",
            "@multimediatype": "JPEG image file",
            "@type": "IMAGE-HIGH-RES",
            "@size": "346225",
            "@ref": "sc2",
            "@mimetype": "image/jpeg"
          },
          {
            "@category": "high",
            "@height": "1249",
            "@width": "2786",
            "@_fa": "true",
            "$": "https://api.elsevier.com/content/object/eid/1-s2.0-S2468823123004650-sc1_lrg.jpg?httpAccept=%2A%2F%2A",
            "@multimediatype": "JPEG image file",
            "@type": "IMAGE-HIGH-RES",
            "@size": "204198",
            "@ref": "sc1",
            "@mimetype": "image/jpeg"
          },
          {
            "@category": "high",
            "@height": "829",
            "@width": "2848",
            "@_fa": "true",
            "$": "https://api.elsevier.com/content/object/eid/1-s2.0-S2468823123004650-gr5_lrg.jpg?httpAccept=%2A%2F%2A",
            "@multimediatype": "JPEG image file",
            "@type": "IMAGE-HIGH-RES",
            "@size": "301197",
            "@ref": "gr5",
            "@mimetype": "image/jpeg"
          },
          {
            "@category": "high",
            "@height": "1244",
            "@width": "2807",
            "@_fa": "true",
            "$": "https://api.elsevier.com/content/object/eid/1-s2.0-S2468823123004650-gr4_lrg.jpg?httpAccept=%2A%2F%2A",
            "@multimediatype": "JPEG image file",
            "@type": "IMAGE-HIGH-RES",
            "@size": "417947",
            "@ref": "gr4",
            "@mimetype": "image/jpeg"
          },
          {
            "@category": "high",
            "@height": "3389",
            "@width": "2748",
            "@_fa": "true",
            "$": "https://api.elsevier.com/content/object/eid/1-s2.0-S2468823123004650-gr7_lrg.jpg?httpAccept=%2A%2F%2A",
            "@multimediatype": "JPEG image file",
            "@type": "IMAGE-HIGH-RES",
            "@size": "792454",
            "@ref": "gr7",
            "@mimetype": "image/jpeg"
          },
          {
            "@category": "high",
            "@height": "1494",
            "@width": "2843",
            "@_fa": "true",
            "$": "https://api.elsevier.com/content/object/eid/1-s2.0-S2468823123004650-gr6_lrg.jpg?httpAccept=%2A%2F%2A",
            "@multimediatype": "JPEG image file",
            "@type": "IMAGE-HIGH-RES",
            "@size": "575084",
            "@ref": "gr6",
            "@mimetype": "image/jpeg"
          },
          {
            "@category": "high",
            "@height": "1936",
            "@width": "2340",
            "@_fa": "true",
            "$": "https://api.elsevier.com/content/object/eid/1-s2.0-S2468823123004650-gr1_lrg.jpg?httpAccept=%2A%2F%2A",
            "@multimediatype": "JPEG image file",
            "@type": "IMAGE-HIGH-RES",
            "@size": "669794",
            "@ref": "gr1",
            "@mimetype": "image/jpeg"
          },
          {
            "@category": "high",
            "@height": "2243",
            "@width": "2541",
            "@_fa": "true",
            "$": "https://api.elsevier.com/content/object/eid/1-s2.0-S2468823123004650-gr3_lrg.jpg?httpAccept=%2A%2F%2A",
            "@multimediatype": "JPEG image file",
            "@type": "IMAGE-HIGH-RES",
            "@size": "674463",
            "@ref": "gr3",
            "@mimetype": "image/jpeg"
          },
          {
            "@category": "high",
            "@height": "2789",
            "@width": "2725",
            "@_fa": "true",
            "$": "https://api.elsevier.com/content/object/eid/1-s2.0-S2468823123004650-gr2_lrg.jpg?httpAccept=%2A%2F%2A",
            "@multimediatype": "JPEG image file",
            "@type": "IMAGE-HIGH-RES",
            "@size": "1795159",
            "@ref": "gr2",
            "@mimetype": "image/jpeg"
          },
          {
            "@category": "high",
            "@height": "2031",
            "@width": "2589",
            "@_fa": "true",
            "$": "https://api.elsevier.com/content/object/eid/1-s2.0-S2468823123004650-gr9_lrg.jpg?httpAccept=%2A%2F%2A",
            "@multimediatype": "JPEG image file",
            "@type": "IMAGE-HIGH-RES",
            "@size": "766623",
            "@ref": "gr9",
            "@mimetype": "image/jpeg"
          },
          {
            "@category": "high",
            "@height": "1864",
            "@width": "2883",
            "@_fa": "true",
            "$": "https://api.elsevier.com/content/object/eid/1-s2.0-S2468823123004650-gr8_lrg.jpg?httpAccept=%2A%2F%2A",
            "@multimediatype": "JPEG image file",
            "@type": "IMAGE-HIGH-RES",
            "@size": "1214455",
            "@ref": "gr8",
            "@mimetype": "image/jpeg"
          },
          {
            "@category": "high",
            "@height": "886",
            "@width": "1311",
            "@_fa": "true",
            "$": "https://api.elsevier.com/content/object/eid/1-s2.0-S2468823123004650-ga1_lrg.jpg?httpAccept=%2A%2F%2A",
            "@multimediatype": "JPEG image file",
            "@type": "IMAGE-HIGH-RES",
            "@size": "262740",
            "@ref": "ga1",
            "@mimetype": "image/jpeg"
          },
          {
            "@category": "standard",
            "@_fa": "true",
            "$": "https://api.elsevier.com/content/object/eid/1-s2.0-S2468823123004650-mmc1.docx?httpAccept=%2A%2F%2A",
            "@multimediatype": "Microsoft Word file",
            "@type": "APPLICATION",
            "@size": "12474661",
            "@ref": "mmc1",
            "@mimetype": "application/word"
          },
          {
            "@category": "standard",
            "@_fa": "true",
            "$": "https://api.elsevier.com/content/object/eid/1-s2.0-S2468823123004650-am.pdf?httpAccept=%2A%2F%2A",
            "@multimediatype": "Acrobat PDF file",
            "@type": "AAM-PDF",
            "@size": "3146412",
            "@ref": "am",
            "@mimetype": "application/pdf"
          }
        ]
      },
      "link": {
        "@rel": "abstract",
        "@href": "https://api.elsevier.com/content/abstract/scopus_id/85165002913"
      }
    }
  }
}