{
  "metadata": {
    "title": "Studies on the preparation of fly ash-derived Fe-SSZ-13 catalysts and their performance in the catalytic oxidation of NO by H<ce:inf loc=post>2</ce:inf>O<ce:inf loc=post>2</ce:inf>",
    "authors": "; ; ",
    "journal": "Molecular Catalysis",
    "date": "2023-02-15",
    "doi": "10.1016/j.mcat.2023.112920",
    "abstract": "",
    "uri": "https://api.elsevier.com/content/article/pii/S246882312300007X",
    "pii": "S246882312300007X"
  },
  "fulltext": {
    "full-text-retrieval-response": {
      "scopus-eid": "2-s2.0-85146259007",
      "originalText": "serial JL 315758 291210 291744 291790 291809 31 Molecular Catalysis MOLECULARCATALYSIS 2023-01-15 2023-01-15 2023-01-15 2023-01-15 2023-11-20T12:02:07 1-s2.0-S246882312300007X S2468-8231(23)00007-X S246882312300007X 10.1016/j.mcat.2023.112920 S300 S300.1 FULL-TEXT 1-s2.0-S2468823123X00030 2024-06-26T17:47:58.012062Z 0 0 20230215 2023 2023-01-15T04:48:42.689002Z absattachment articleinfo articlenumber articletitlenorm authfirstinitialnorm authfirstsurnamenorm cid cids contenttype copyright crossmark dateloaded dateloadedtxt datesearch datesort dateupdated dco docsubtype doctype doi eid ewtransactionid hubeid indexeddate issn issnnorm itemstage itemtransactionid itemweight openaccess openarchive pg pgfirst pii piinorm pubdatestart pubdatetxt pubyr sectiontitle sortorder srctitle srctitlenorm srctype ssids alllist content subj subheadings suppl tomb volfirst volissue volumelist webpdf webpdfpagecount yearnav figure table e-component body mmlmath affil appendices articletitle auth authfirstini authfull authkeywords authlast highlightsabst orcid primabst ref specialabst 2468-8231 24688231 true 537 537 C Volume 537 10 112920 112920 112920 20230215 15 February 2023 2023-02-15 2023 Regular Papers article fla © 2023 Elsevier B.V. All rights reserved. STUDIESPREPARATIONFLYASHDERIVEDFESSZ13CATALYSTSPERFORMANCEINCATALYTICOXIDATIONNOBYH2O2 LI J 1 Introduction 2 Material and methods 2.1 Chemicals 2.2 Characterization of the catalysts 2.3 Synthesis of FA-SSZ-13 zeolite 2.4 Synthesis of SSZ-13-seed 2.5 Preparation of Fe-SSZ-13 catalysts 2.5.1 Preparation by impregnation method (IM) 2.5.2 Preparation by liquid ion exchange method (LIE) 2.5.3 Solid state ion exchange method (SSIE) 2.6 NO removal performance test 3 Results and discussion 3.1 Preparation of fly ash-based SSZ-13 zeolite 3.1.1 XRF 3.1.2 XRD 3.1.3 FTIR 3.1.4 Morphological observations 3.2 Synthesis and catalytic properties of Fe-SSZ-13 3.2.1 XRF 3.2.2 XRD 3.2.3 FTIR 3.2.4 N2 adsorption-desorption 3.2.5 H2-TPR 3.2.6 XPS 3.2.7 UV-Vis spectroscopy 3.2.8 ESR 3.2.9 NH3-TPD 3.2.10 Py-FTIR 3.3 Relationship between active iron species with acidic sites and catalytic activities 4 Conclusions CRediT authorship contribution statement Appendix Supplementary materials References SHI 2022 P AMONI 2022 275 B MURUKUTTI 2022 127085 M REN 2020 295 X LIU 2019 341 348 Y CHEN 2018 18 26 Y AMEH 2020 416 424 A LI 2013 42 48 D LI 2017 105 115 G GOLLAKOTA 2021 125925 A LI 2019 470 482 G ARAKI 2020 613 S TANG 2019 306 314 L SARKER 2021 94 100 M LI 2021 304 Q CHEN 2021 514 L SHI 2018 59 63 J ROMEROSAEZ 2016 210 218 M ZHANG 2021 324 H WANG 2018 1112 1118 Y XU 2015 3842 3847 R BIESEKI 2012 38 43 L ZHANG 2014 520 531 T ZHANG 2022 630 J BANDALA 2021 409 E GAO 2016 2939 2954 F LI 2008 131 141 L NIU 2020 287 K YUE 2020 398 Y WU 2022 134 G TAN 2016 21 29 P WANG 2022 138 150 H HUANG 2015 66 72 X WU 2018 343 354 B RAMOS 2021 366 386 M WAN 2021 306 316 J CHEN 2021 286 Z WANG 2018 199 210 A YANG 2019 324 330 X LIN 2021 70 80 F CHENG 2016 582 598 M SHANGGUAN 2022 Z ZHOU 2018 4174 4184 C CUI 2019 302 309 R LI 2022 331 Q XIA 2018 426 432 H XIAO 2021 1070 1080 P BENCHEQROUN 2022 10 Z ZHANG 2016 444 457 P LIX2023X112920 LIX2023X112920XJ 2025-01-15T00:00:00.000Z 2025-01-15T00:00:00.000Z http://creativecommons.org/licenses/by-nc-nd/4.0/ © 2023 Elsevier B.V. All rights reserved. 2023-01-07T15:02:30.816Z http://vtw.elsevier.com/data/voc/AddOnTypes/50.7/eoas https://doi.org/10.15223/policy-017 https://doi.org/10.15223/policy-037 https://doi.org/10.15223/policy-012 https://doi.org/10.15223/policy-029 https://doi.org/10.15223/policy-004 item S2468-8231(23)00007-X S246882312300007X 1-s2.0-S246882312300007X 10.1016/j.mcat.2023.112920 315758 2023-11-20T12:45:58.270178Z 2023-02-15 1-s2.0-S246882312300007X-main.pdf https://s3-eu-west-1.amazonaws.com/prod-ucs-content-store-eu-west/content/pii:S246882312300007X/MAIN/application/pdf/42846eeb0deb1b568b1b6b00e4f44403/main.pdf main.pdf pdf true 11129746 MAIN 15 1-s2.0-S246882312300007X-main_1.png https://s3-eu-west-1.amazonaws.com/prod-ucs-content-store-eu-west/content/pii:S246882312300007X/PREVIEW/image/png/804c7626f20b70af2ac0ae937f8336bb/main_1.png main_1.png png 58840 849 656 IMAGE-WEB-PDF 1 1-s2.0-S246882312300007X-gr1.jpg https://s3-eu-west-1.amazonaws.com/prod-ucs-content-store-eu-west/content/pii:S246882312300007X/gr1/DOWNSAMPLED/image/jpeg/2f3a5b07cbab81499c35baa61ed63cf4/gr1.jpg gr1 gr1.jpg jpg 135867 972 565 IMAGE-DOWNSAMPLED 1-s2.0-S246882312300007X-gr2.jpg https://s3-eu-west-1.amazonaws.com/prod-ucs-content-store-eu-west/content/pii:S246882312300007X/gr2/DOWNSAMPLED/image/jpeg/c76888a86a016ccd0127c9202aa17218/gr2.jpg gr2 gr2.jpg jpg 165144 941 601 IMAGE-DOWNSAMPLED 1-s2.0-S246882312300007X-gr3.jpg https://s3-eu-west-1.amazonaws.com/prod-ucs-content-store-eu-west/content/pii:S246882312300007X/gr3/DOWNSAMPLED/image/jpeg/35100adccd40c7b8e255ae833975e012/gr3.jpg gr3 gr3.jpg jpg 151729 761 659 IMAGE-DOWNSAMPLED 1-s2.0-S246882312300007X-gr4.jpg https://s3-eu-west-1.amazonaws.com/prod-ucs-content-store-eu-west/content/pii:S246882312300007X/gr4/DOWNSAMPLED/image/jpeg/53f9ce8fa27f2abe857f9ab9872c3571/gr4.jpg gr4 gr4.jpg jpg 55425 413 489 IMAGE-DOWNSAMPLED 1-s2.0-S246882312300007X-gr10.jpg https://s3-eu-west-1.amazonaws.com/prod-ucs-content-store-eu-west/content/pii:S246882312300007X/gr10/DOWNSAMPLED/image/jpeg/ea962559e146c20a62c1a992c54aa429/gr10.jpg gr10 gr10.jpg jpg 55920 417 489 IMAGE-DOWNSAMPLED 1-s2.0-S246882312300007X-gr5.jpg https://s3-eu-west-1.amazonaws.com/prod-ucs-content-store-eu-west/content/pii:S246882312300007X/gr5/DOWNSAMPLED/image/jpeg/a195b81299d634a1cc26f11978a87ae0/gr5.jpg gr5 gr5.jpg jpg 50998 419 489 IMAGE-DOWNSAMPLED 1-s2.0-S246882312300007X-gr6.jpg https://s3-eu-west-1.amazonaws.com/prod-ucs-content-store-eu-west/content/pii:S246882312300007X/gr6/DOWNSAMPLED/image/jpeg/1906e111c2b64afacd7073aa116d1e59/gr6.jpg gr6 gr6.jpg jpg 54698 429 489 IMAGE-DOWNSAMPLED 1-s2.0-S246882312300007X-gr7.jpg https://s3-eu-west-1.amazonaws.com/prod-ucs-content-store-eu-west/content/pii:S246882312300007X/gr7/DOWNSAMPLED/image/jpeg/ff68c4466f5f14b9cceb0dbf77014441/gr7.jpg gr7 gr7.jpg jpg 44473 418 489 IMAGE-DOWNSAMPLED 1-s2.0-S246882312300007X-gr8.jpg https://s3-eu-west-1.amazonaws.com/prod-ucs-content-store-eu-west/content/pii:S246882312300007X/gr8/DOWNSAMPLED/image/jpeg/b22d8db9a7ea85b02775c7cffc31f8df/gr8.jpg gr8 gr8.jpg jpg 53294 242 659 IMAGE-DOWNSAMPLED 1-s2.0-S246882312300007X-gr14.jpg https://s3-eu-west-1.amazonaws.com/prod-ucs-content-store-eu-west/content/pii:S246882312300007X/gr14/DOWNSAMPLED/image/jpeg/b9230fad4cae32349649eeeb0513373d/gr14.jpg gr14 gr14.jpg jpg 44288 293 659 IMAGE-DOWNSAMPLED 1-s2.0-S246882312300007X-gr9.jpg https://s3-eu-west-1.amazonaws.com/prod-ucs-content-store-eu-west/content/pii:S246882312300007X/gr9/DOWNSAMPLED/image/jpeg/696f09ec144a90318d745e9624fe6a12/gr9.jpg gr9 gr9.jpg jpg 49302 421 489 IMAGE-DOWNSAMPLED 1-s2.0-S246882312300007X-gr13.jpg https://s3-eu-west-1.amazonaws.com/prod-ucs-content-store-eu-west/content/pii:S246882312300007X/gr13/DOWNSAMPLED/image/jpeg/07d361b739b752332983181335c09368/gr13.jpg gr13 gr13.jpg jpg 34558 430 489 IMAGE-DOWNSAMPLED 1-s2.0-S246882312300007X-gr12.jpg https://s3-eu-west-1.amazonaws.com/prod-ucs-content-store-eu-west/content/pii:S246882312300007X/gr12/DOWNSAMPLED/image/jpeg/850f87b73d09c51eefa669a77610eb46/gr12.jpg gr12 gr12.jpg jpg 50785 417 489 IMAGE-DOWNSAMPLED 1-s2.0-S246882312300007X-gr11.jpg https://s3-eu-west-1.amazonaws.com/prod-ucs-content-store-eu-west/content/pii:S246882312300007X/gr11/DOWNSAMPLED/image/jpeg/b318c890f52f6da8e334d6754e4fb499/gr11.jpg gr11 gr11.jpg jpg 48926 417 489 IMAGE-DOWNSAMPLED 1-s2.0-S246882312300007X-ga1.jpg https://s3-eu-west-1.amazonaws.com/prod-ucs-content-store-eu-west/content/pii:S246882312300007X/ga1/DOWNSAMPLED/image/jpeg/adf2d2928e17021c032e6c3a18fd38c3/ga1.jpg ga1 true ga1.jpg jpg 21325 124 301 IMAGE-DOWNSAMPLED 1-s2.0-S246882312300007X-gr1.sml https://s3-eu-west-1.amazonaws.com/prod-ucs-content-store-eu-west/content/pii:S246882312300007X/gr1/THUMBNAIL/image/gif/0139988c9ac84667feace9a0fd779034/gr1.sml gr1 gr1.sml sml 8210 163 95 IMAGE-THUMBNAIL 1-s2.0-S246882312300007X-gr2.sml https://s3-eu-west-1.amazonaws.com/prod-ucs-content-store-eu-west/content/pii:S246882312300007X/gr2/THUMBNAIL/image/gif/344bb79b434875897db7b86a51304435/gr2.sml gr2 gr2.sml sml 9444 163 104 IMAGE-THUMBNAIL 1-s2.0-S246882312300007X-gr3.sml https://s3-eu-west-1.amazonaws.com/prod-ucs-content-store-eu-west/content/pii:S246882312300007X/gr3/THUMBNAIL/image/gif/a36f4268af832f122ba05da6bb1ee75e/gr3.sml gr3 gr3.sml sml 19028 164 142 IMAGE-THUMBNAIL 1-s2.0-S246882312300007X-gr4.sml https://s3-eu-west-1.amazonaws.com/prod-ucs-content-store-eu-west/content/pii:S246882312300007X/gr4/THUMBNAIL/image/gif/3e3d28c1e999539603b93a610ecf8457/gr4.sml gr4 gr4.sml sml 11061 164 194 IMAGE-THUMBNAIL 1-s2.0-S246882312300007X-gr10.sml https://s3-eu-west-1.amazonaws.com/prod-ucs-content-store-eu-west/content/pii:S246882312300007X/gr10/THUMBNAIL/image/gif/e7997c27880eac88ec218afa3c741da8/gr10.sml gr10 gr10.sml sml 10583 164 192 IMAGE-THUMBNAIL 1-s2.0-S246882312300007X-gr5.sml https://s3-eu-west-1.amazonaws.com/prod-ucs-content-store-eu-west/content/pii:S246882312300007X/gr5/THUMBNAIL/image/gif/e7f26e2a790ddec12ebef8b4092889f8/gr5.sml gr5 gr5.sml sml 10535 164 191 IMAGE-THUMBNAIL 1-s2.0-S246882312300007X-gr6.sml https://s3-eu-west-1.amazonaws.com/prod-ucs-content-store-eu-west/content/pii:S246882312300007X/gr6/THUMBNAIL/image/gif/e8260e0dfbb2757bacc1f1604b525668/gr6.sml gr6 gr6.sml sml 9299 164 187 IMAGE-THUMBNAIL 1-s2.0-S246882312300007X-gr7.sml https://s3-eu-west-1.amazonaws.com/prod-ucs-content-store-eu-west/content/pii:S246882312300007X/gr7/THUMBNAIL/image/gif/ff76a1725ab9419d19a4b3cd5f87d543/gr7.sml gr7 gr7.sml sml 8936 163 191 IMAGE-THUMBNAIL 1-s2.0-S246882312300007X-gr8.sml https://s3-eu-west-1.amazonaws.com/prod-ucs-content-store-eu-west/content/pii:S246882312300007X/gr8/THUMBNAIL/image/gif/ad12956e10aa7d0a6a1bbfcbe8700d71/gr8.sml gr8 gr8.sml sml 9719 80 219 IMAGE-THUMBNAIL 1-s2.0-S246882312300007X-gr14.sml https://s3-eu-west-1.amazonaws.com/prod-ucs-content-store-eu-west/content/pii:S246882312300007X/gr14/THUMBNAIL/image/gif/a43423402791a9d297c83d97166dc64e/gr14.sml gr14 gr14.sml sml 7744 97 219 IMAGE-THUMBNAIL 1-s2.0-S246882312300007X-gr9.sml https://s3-eu-west-1.amazonaws.com/prod-ucs-content-store-eu-west/content/pii:S246882312300007X/gr9/THUMBNAIL/image/gif/83f889f57bc9fc1b72adb2278c0678ef/gr9.sml gr9 gr9.sml sml 11153 164 190 IMAGE-THUMBNAIL 1-s2.0-S246882312300007X-gr13.sml https://s3-eu-west-1.amazonaws.com/prod-ucs-content-store-eu-west/content/pii:S246882312300007X/gr13/THUMBNAIL/image/gif/b7ad760c306175f57305f53632d77c9c/gr13.sml gr13 gr13.sml sml 7372 164 186 IMAGE-THUMBNAIL 1-s2.0-S246882312300007X-gr12.sml https://s3-eu-west-1.amazonaws.com/prod-ucs-content-store-eu-west/content/pii:S246882312300007X/gr12/THUMBNAIL/image/gif/d988fa912af5eac67b21630a00b774f7/gr12.sml gr12 gr12.sml sml 10089 164 192 IMAGE-THUMBNAIL 1-s2.0-S246882312300007X-gr11.sml https://s3-eu-west-1.amazonaws.com/prod-ucs-content-store-eu-west/content/pii:S246882312300007X/gr11/THUMBNAIL/image/gif/a089a93ecbb3e8476684ae8e13a87820/gr11.sml gr11 gr11.sml sml 9937 164 192 IMAGE-THUMBNAIL 1-s2.0-S246882312300007X-ga1.sml https://s3-eu-west-1.amazonaws.com/prod-ucs-content-store-eu-west/content/pii:S246882312300007X/ga1/THUMBNAIL/image/gif/d77dacc6faec88bea2bd4d9519a4c8b6/ga1.sml ga1 true ga1.sml sml 10906 90 219 IMAGE-THUMBNAIL 1-s2.0-S246882312300007X-gr1_lrg.jpg https://s3-eu-west-1.amazonaws.com/prod-ucs-content-store-eu-west/content/pii:S246882312300007X/HIGHRES/image/jpeg/a5a3a14939630cc54fb2016765018beb/gr1_lrg.jpg gr1 gr1_lrg.jpg jpg 1192768 4302 2500 IMAGE-HIGH-RES 1-s2.0-S246882312300007X-gr2_lrg.jpg https://s3-eu-west-1.amazonaws.com/prod-ucs-content-store-eu-west/content/pii:S246882312300007X/HIGHRES/image/jpeg/d028beff611da235b71406bc625af4a0/gr2_lrg.jpg gr2 gr2_lrg.jpg jpg 1371651 4167 2662 IMAGE-HIGH-RES 1-s2.0-S246882312300007X-gr3_lrg.jpg https://s3-eu-west-1.amazonaws.com/prod-ucs-content-store-eu-west/content/pii:S246882312300007X/HIGHRES/image/jpeg/8049b23df31528ca7d2148aaacdc2148/gr3_lrg.jpg gr3 gr3_lrg.jpg jpg 1357460 3367 2917 IMAGE-HIGH-RES 1-s2.0-S246882312300007X-gr4_lrg.jpg https://s3-eu-west-1.amazonaws.com/prod-ucs-content-store-eu-west/content/pii:S246882312300007X/HIGHRES/image/jpeg/955084198ad44b68f189d4125bf94b1b/gr4_lrg.jpg gr4 gr4_lrg.jpg jpg 445762 1832 2167 IMAGE-HIGH-RES 1-s2.0-S246882312300007X-gr10_lrg.jpg https://s3-eu-west-1.amazonaws.com/prod-ucs-content-store-eu-west/content/pii:S246882312300007X/HIGHRES/image/jpeg/7d23201a81ffd9b9c9f4ba90caab18c8/gr10_lrg.jpg gr10 gr10_lrg.jpg jpg 458410 1850 2167 IMAGE-HIGH-RES 1-s2.0-S246882312300007X-gr5_lrg.jpg https://s3-eu-west-1.amazonaws.com/prod-ucs-content-store-eu-west/content/pii:S246882312300007X/HIGHRES/image/jpeg/ea247153655df6a0df47a0e4487d7fcb/gr5_lrg.jpg gr5 gr5_lrg.jpg jpg 411347 1855 2167 IMAGE-HIGH-RES 1-s2.0-S246882312300007X-gr6_lrg.jpg https://s3-eu-west-1.amazonaws.com/prod-ucs-content-store-eu-west/content/pii:S246882312300007X/HIGHRES/image/jpeg/7a113a28a263845238c92945b861f20a/gr6_lrg.jpg gr6 gr6_lrg.jpg jpg 341530 1900 2167 IMAGE-HIGH-RES 1-s2.0-S246882312300007X-gr7_lrg.jpg https://s3-eu-west-1.amazonaws.com/prod-ucs-content-store-eu-west/content/pii:S246882312300007X/HIGHRES/image/jpeg/d359c8554cfc2ed18a3c44318f3c274c/gr7_lrg.jpg gr7 gr7_lrg.jpg jpg 312219 1854 2167 IMAGE-HIGH-RES 1-s2.0-S246882312300007X-gr8_lrg.jpg https://s3-eu-west-1.amazonaws.com/prod-ucs-content-store-eu-west/content/pii:S246882312300007X/HIGHRES/image/jpeg/9f0d7040ced83dfc286db46789de67f4/gr8_lrg.jpg gr8 gr8_lrg.jpg jpg 415149 1070 2917 IMAGE-HIGH-RES 1-s2.0-S246882312300007X-gr14_lrg.jpg https://s3-eu-west-1.amazonaws.com/prod-ucs-content-store-eu-west/content/pii:S246882312300007X/HIGHRES/image/jpeg/0ffe0beba3f2d743fbc5d0b265805e6e/gr14_lrg.jpg gr14 gr14_lrg.jpg jpg 308979 1297 2917 IMAGE-HIGH-RES 1-s2.0-S246882312300007X-gr9_lrg.jpg https://s3-eu-west-1.amazonaws.com/prod-ucs-content-store-eu-west/content/pii:S246882312300007X/HIGHRES/image/jpeg/63ce1e46136ccb2c77b2732d313b3179/gr9_lrg.jpg gr9 gr9_lrg.jpg jpg 434625 1866 2167 IMAGE-HIGH-RES 1-s2.0-S246882312300007X-gr13_lrg.jpg https://s3-eu-west-1.amazonaws.com/prod-ucs-content-store-eu-west/content/pii:S246882312300007X/HIGHRES/image/jpeg/05ea934c3c3a198d4bc6ee842b2a51ef/gr13_lrg.jpg gr13 gr13_lrg.jpg jpg 234299 1907 2167 IMAGE-HIGH-RES 1-s2.0-S246882312300007X-gr12_lrg.jpg https://s3-eu-west-1.amazonaws.com/prod-ucs-content-store-eu-west/content/pii:S246882312300007X/HIGHRES/image/jpeg/0e07f334af8e7135a872a849cc3cc843/gr12_lrg.jpg gr12 gr12_lrg.jpg jpg 398766 1850 2167 IMAGE-HIGH-RES 1-s2.0-S246882312300007X-gr11_lrg.jpg https://s3-eu-west-1.amazonaws.com/prod-ucs-content-store-eu-west/content/pii:S246882312300007X/HIGHRES/image/jpeg/d905977410563a81c7406fec2183b823/gr11_lrg.jpg gr11 gr11_lrg.jpg jpg 401419 1850 2167 IMAGE-HIGH-RES 1-s2.0-S246882312300007X-ga1_lrg.jpg https://s3-eu-west-1.amazonaws.com/prod-ucs-content-store-eu-west/content/pii:S246882312300007X/HIGHRES/image/jpeg/9c56b977b550527d8ab9b90a33fc2f75/ga1_lrg.jpg ga1 true ga1_lrg.jpg jpg 171057 548 1333 IMAGE-HIGH-RES 1-s2.0-S246882312300007X-mmc1.docx https://s3-eu-west-1.amazonaws.com/prod-ucs-content-store-eu-west/content/pii:S246882312300007X/mmc1/MAIN/application/vnd.openxmlformats-officedocument.wordprocessingml.document/1418ca1b3dd26b6b28abdbbda8bc56a0/mmc1.docx mmc1 mmc1.docx docx 2676875 APPLICATION 1-s2.0-S246882312300007X-si1.svg https://s3-eu-west-1.amazonaws.com/prod-ucs-content-store-eu-west/content/pii:S246882312300007X/image/svg+xml/cb6089cb59b594d0854d4438ce2398b6/si1.svg si1 si1.svg svg 9185 ALTIMG 1-s2.0-S246882312300007X-si10.svg https://s3-eu-west-1.amazonaws.com/prod-ucs-content-store-eu-west/content/pii:S246882312300007X/image/svg+xml/27e966a82fe72d2c7252cbaeb0bf1965/si10.svg si10 si10.svg svg 4640 ALTIMG 1-s2.0-S246882312300007X-si11.svg https://s3-eu-west-1.amazonaws.com/prod-ucs-content-store-eu-west/content/pii:S246882312300007X/image/svg+xml/c24a3a40bbb4bf9d8448f4fa75034a66/si11.svg si11 si11.svg svg 4844 ALTIMG 1-s2.0-S246882312300007X-si2.svg https://s3-eu-west-1.amazonaws.com/prod-ucs-content-store-eu-west/content/pii:S246882312300007X/image/svg+xml/efec1c5938a35cce2495a357bc2175d3/si2.svg si2 si2.svg svg 2351 ALTIMG 1-s2.0-S246882312300007X-si3.svg https://s3-eu-west-1.amazonaws.com/prod-ucs-content-store-eu-west/content/pii:S246882312300007X/image/svg+xml/a0837e31ce10baf0192e37906c4c4067/si3.svg si3 si3.svg svg 2768 ALTIMG 1-s2.0-S246882312300007X-si4.svg https://s3-eu-west-1.amazonaws.com/prod-ucs-content-store-eu-west/content/pii:S246882312300007X/image/svg+xml/0477706a89c00ef475a1be0aa8b738da/si4.svg si4 si4.svg svg 5979 ALTIMG 1-s2.0-S246882312300007X-si5.svg https://s3-eu-west-1.amazonaws.com/prod-ucs-content-store-eu-west/content/pii:S246882312300007X/image/svg+xml/9da3afde327229c79d490352aee29feb/si5.svg si5 si5.svg svg 5876 ALTIMG 1-s2.0-S246882312300007X-si6.svg https://s3-eu-west-1.amazonaws.com/prod-ucs-content-store-eu-west/content/pii:S246882312300007X/image/svg+xml/fc9bfa7f9eaf84cd7f03d49ece0a02f5/si6.svg si6 si6.svg svg 6115 ALTIMG 1-s2.0-S246882312300007X-si7.svg https://s3-eu-west-1.amazonaws.com/prod-ucs-content-store-eu-west/content/pii:S246882312300007X/image/svg+xml/b912b2e86ea6826894ed7c70a52f32c1/si7.svg si7 si7.svg svg 4706 ALTIMG 1-s2.0-S246882312300007X-si8.svg https://s3-eu-west-1.amazonaws.com/prod-ucs-content-store-eu-west/content/pii:S246882312300007X/image/svg+xml/7404b575878c985b88fd4b7bd2fe8048/si8.svg si8 si8.svg svg 3772 ALTIMG 1-s2.0-S246882312300007X-si9.svg https://s3-eu-west-1.amazonaws.com/prod-ucs-content-store-eu-west/content/pii:S246882312300007X/image/svg+xml/10b3b2a4600f6c94c692e845c9ae7ee9/si9.svg si9 si9.svg svg 3873 ALTIMG 1-s2.0-S246882312300007X-am.pdf https://s3-eu-west-1.amazonaws.com/prod-ucs-content-store-eu-west/content/egi:105273MXS0K/MAIN/application/pdf/7ed78dee629b1ba659c8554bbadaca4a/am.pdf am am.pdf pdf false 5498070 AAM-PDF MCAT 112920 112920 S2468-8231(23)00007-X 10.1016/j.mcat.2023.112920 Fig. 1 . XRD patterns of FA-SSZ-13 zeolite samples synthesized with different preparation conditions: (a) NaOH/FA ratios, (b) SiO2/Al2O3 ratios, (c) H2O/Al2O3 ratios, (d) TMAda-OH/ Al2O3 ratios, (e) the amount of SSZ-13-seed, (f) hydrothermal time, (g) 10% SSZ-13-seed+ hydrothermal time (40 h) + TMAda-OH/Al2O3 ratios. Fig 1 Fig. 2 FTIR spectra of FA-SSZ-13 zeolite samples synthesized with different preparation conditions: (a) NaOH/FA ratios, (b) SiO2/Al2O3 ratios, (c) H2O/Al2O3 ratios, (d) TMAda-OH/Al2O3 ratios, (e) the amount of SSZ-13-seed, (f) hydrothermal time, (g) 10% SSZ-13-seed+ hydrothermal time (40 h) + TMAda-OH/Al2O3 ratios. Fig 2 Fig. 3 SEM images of (a) Raw fly ash, (b) Alkali fusion fly ash, (c) Commercial SSZ-13, (d) FA-SSZ-13, (e) Fe-SSZ-13, (f) Element mapping of Fe in Fe-SSZ-13. Fig 3 Fig. 4 XRD patterns of the synthesized Fe-SSZ-13 catalysts. Fig 4 Fig. 5 FTIR spectra of the synthesized Fe-SSZ-13 catalysts. Fig 5 Fig. 6 N2 adsorption-desorption isotherm of the synthesized Fe-SSZ-13 catalysts. Fig 6 Fig. 7 H2-TPR curves of the synthesized Fe-SSZ-13 catalysts. Fig 7 Fig. 8 XPS of the Fe 2p (a) and O 1 s (b) spectra of the synthesized Fe-SSZ-13 catalysts. Fig 8 Fig. 9 UV-Vis spectra of the Fe-SSZ-13 catalysts. Fig 9 Fig. 10 DMPO spin-trapping ESR spectra of the synthesized Fe-SSZ-13 catalysts. Fig 10 Fig. 11 NH3-TPD profiles of the synthesized Fe-SSZ-13 catalysts. Fig 11 Fig. 12 Py-FTIR spectras of the synthesized Fe-SSZ-13 catalysts. Fig 12 Fig. 13 Comparison of the NO oxidation activity for commercial SSZ-13, FA-SSZ-13, Fe-SSZ-13-IM, Fe-SSZ-13-LIE and Fe-SSZ-13-SSIE using 700 mg/m3 NO, 2 mol/L H2O2. Fig 13 Fig. 14 Schematic diagram of the mechanism of NO removal by catalytic oxidation. Fig 14 Table 1 Chemical ingredients with the different NaOH/FA ratios. Table 1 Samples SiO2 Al2O3 Na2O Fe2O3 CaO others SiO2/Al2O3 FA 51.36 30.37 0 4.82 6.42 7.03 1.78 FA1.0 30.72 15.93 41.40 4.12 1.98 5.85 1.84 FA1.2 27.46 9.04 55.90 2.27 2.94 2.39 2.69 FA1.4 25.23 6.12 57.10 2.01 2.78 6.76 4.12 FA1.6 24.01 2.85 59.76 2.47 2.70 8.21 8.42 Table 2 Description of Fe/SSZ-13 catalysts with different preparation methods. Table 2 Sample Si/Al Fe/Al BET Surface area (m2·g−1) Pore Volume (cm3·g−1) Average pore width (nm) SSZ-13 10 0 84.9 0.20 9.96 Fe-SSZ-13-IM 7.9 1.95 99.38 0.23 7.23 Fe-SSZ-13-LIE 8 1.84 119.34 0.32 7.68 Fe-SSZ-13-SSIE 7.5 1.74 106.61 0.25 7.96 Table 3 Surface Fe element distributions in Fe-SSZ-13 samples. Table 3 Sample Fe2+ Fe3+ Fe3+/ Fe2+ Binding energy (eV) Binding energy (eV) Fe-SSZ-13-IM 710.9 713.7 1.55 Fe-SSZ-13-LIE 710.7 712.8 2.57 Fe-SSZ-13-SSIE 710.7 713.6 1.57 Table 4 Area percentages of each band and their allocation to Fe3+ species derived from deconvolution of UV-vis for Fe-SSZ-13 samples. Table 4 Sample isolatedFe3+ Fe(Ⅲ)xOy clusters Fe2O3 particles Fe-SSZ-13-IM 50.5 37.9 11.6 Fe-SSZ-13-LIE 52.1 38.5 9.4 Fe-SSZ-13-SSIE 50.5 40.9 8.6 Table 5 Contents of different acid density of the synthesized Fe-SSZ-13 catalysts. Table 5 Sample Weak acid density (mmol/g) Strong acid density (mmol/g) Total acid density (mmol/g) Fe-SSZ-13-IM 3.62 0.17 3.79 Fe-SSZ-13-LIE 2.84 0.34 3.18 Fe-SSZ-13-SSIE 1.50 0.26 1.76 Table 6 Acidic properties of the synthesized Fe-SSZ-13 catalysts. Table 6 Sample Acidity Brønsted acid concentration (µmol/g) Lewis acid concentration (µmol/g) CB/CL Fe/SSZ-13-IM 6.56 19.01 0.35 Fe/SSZ-13-LIE 10.71 19.12 0.56 Fe/SSZ-13-SSIE 4.44 12.68 0.35 Studies on the preparation of fly ash-derived Fe-SSZ-13 catalysts and their performance in the catalytic oxidation of NO by H2O2 Jing Li Conceptualization Methodology Validation Investigation Data curation Writing – original draft Writing – review & editing Suxia Ma Writing – review & editing Supervision Funding acquisition ⁎ Ke Ren Validation Formal analysis Visualization Nuo Xu Investigation Writing – review & editing College of Electrical and Power Engineering, Taiyuan University of Technology, 79 Yingze West Street, Taiyuan 030024 PR China College of Electrical and Power Engineering Taiyuan University of Technology 79 Yingze West Street Taiyuan 030024 PR China College of Electrical and Power Engineering, Taiyuan University of Technology, 79 Yingze West Street, Taiyuan 030024 PR China ⁎ Corresponding author. SSZ-13 zeolite was synthesized from fly ash using a combined alkali fusion hydrothermal method. The optimal synthesis parameters are as follows: NaOH/FA=1.4, SiO2/Al2O3=50, H2O/SiO2=1800, TMAda-OH/Al2O3=7, the amount of SSZ-13-seed=10%, and crystallization time and temperature were 160 °C and 40 h. Based on this, a series of fly ash-based Fe-SSZ-13 catalysts were prepared using three different methods and tested in catalytic oxidation with H2O2 for NO removal. The experiment results showed that the NO removal efficiency catalyzed by Fe-SSZ-13-SSIE, Fe-SSZ-13-LIE and Fe-SSZ-13-IM were 78%, 87% and 84%, respectively. ESR was used to detect hydroxyl radicals, UV-vis, XPS and H2-TPR were applied to test the composition, state and distribution of iron species, while NH3-TPD and Py-FTIR were performed to analyze the intensity and type of acidic sites, and finally to determine the relationship between catalyst structure, active species and catalytic performance in combination with NO removal experiments. The catalytic oxidation mechanism analysis revealed that the excellent catalytic performance can be attributed to the dual function of strong Brønsted acidity on the surface and isolated Fe3+ with high dispersion, which can rapidly decompose H2O2 into ·OH and efficiently achieve NO oxidation. In conclusion, the preparation of fly ash catalysts has great potential for achieving the dual function of waste utilization and pollutant removal. Graphical abstract Image, graphical abstract Keywords Fe-SSZ-13 Isolated Fe3+ species Brønsted acid sites Hydroxyl radicals Catalytic oxidation Data availability No data was used for the research described in the article. 1 Introduction Coal fly ash (CFA) is a solid residual waste from coal combustion in power plants that has caused significant environmental damage, resource waste, and health risks [1]. Fly ash emissions have increased due to the rapid expansion of the economy. However, most fly ash is used in the building materials and road construction industries, and there are limited opportunities for producing high-value commodities from fly ash. The majority of fly ash is composed of silica, alumina, iron oxide, calcium oxide, and unburned carbon. The highest concentrations of SiO2 and Al2O3 are a significant component of this abundant resource. The successful extraction of useful materials from fly ash will help to create a circular economy and save costs while also reducing environmental impact. The production of various zeolites from fly ash is an effective approach to using fly ash. At present, fly ash-based zeolites such as A [2], X [3], Y [4], P [5], ZSM-5 [6], β [7], MCM-41 [8], SBA-15 [9], SSZ-13 [10], and SAPO-34 [11] have been successfully synthesized. The typical structural features of SSZ-13 are CHA cage structured zeolites with 3-dimensional structures, including octet rings and cross channels. It has the advantages of a simple structure, ordered pore structure, good hydrothermal stability, and a large number of surface plasmonic acid centers. However, the challenges in SSZ-13 synthesis are the long crystallization time and the high cost of organic structure-directing agents. Many scholars have synthesized SSZ-13 zeolite using some relatively inexpensive organic structure-directing agents (e.g., TEAOH [12]), but the cost saving is limited, and subsequent calcination is also required to remove the template agent to efficiently nucleate and crystallize SSZ-13. Some researchers have also attempted to synthesize SSZ-13 using different zeolites (β [13], Y [14], ZSM-35 [15], etc.), but the synthesis cost of these parent zeolites is extremely high. However, it is important to use the abundant silica and aluminum sources in fly ash to synthesize SSZ-13 zeolites, both to lower the synthesis costs, to achieve solid waste utilization, and to apply them in catalytic H2O2 oxidation of NO to achieve efficient denitrification. The combination of transition metal elements and zeolites can improve both their catalytic efficiency, as Fe is more easily dispersed onto the zeolite skeleton, and the crystallization process of Fe and zeolite leads to the formation of excellent acidity and redox properties. The preparation process is directly associated with the type, distribution, and form of Fe species present in zeolites, which in turn affects the catalytic properties of Fe-based catalysts. The most commonly used methods for introducing Fe into zeolites include impregnation, ion exchange (liquid/solid states), and hydrothermal synthesis, and good dispersion of Fe species in zeolite pore channels can be achieved by optimizing the preparation process parameters. Furthermore, multiple types of Fe species, such as isolated Fe3+ species, small FexOy clusters, and large Fe2O3 particles are often found in Fe/zeolite catalysts. The preparation method influences the catalytic activity of different types of Fe species in a specific process [16]. Shi et al. [17] used enhanced aqueous ion exchange (IA) and solid state ion exchange (SS) techniques to obtain two Fe-based catalysts (Fe-ZSM-5(IA), Fe-ZSM-5(SS)). The different preparation methods impart different forms of iron ions in catalysts. Fe-ZSM-5(IA) has the largest number of Fe3+ ions, a few α-Fe2O3, Fe3O4 species, and octahedrally symmetrical Fe3+ complexes, whereas Fe-ZSM-5(SS) has α-Fe2O3 and Fe3O4 as the most predominant iron species. Due to the abundance of Fe3+ ions which play an important role as active sites in SCR reactions, Fe-ZSM-5(IA) catalysts exhibit excellent catalytic effects. Romero-Sáez et al. [18] obtained three Fe-ZSM-5 catalysts using liquid ion exchange, impregnation, and solid-state ion exchange methods, and provided a detailed description of the active sites responsible for oxidation. The addition of Fe resulted in increased activity and stability, also, Fe2O3 nanoparticles present in the additional backbone of ZSM-5 zeolite were discovered to be the main active iron species rather than acidic sites. The combined activity of impregnation or solid-state ion exchange catalysts was not as good as that of ion exchange catalysts. Chen et al. [16] used impregnation, ion exchange, and hydrothermal methods to prepare three Fe/Beta catalysts. The experimental results revealed that different preparation methods might yield varied Fe species and amounts of acid sites, with the hydrothermal method yielding the highest content of isolated Fe3+ species with highest acid concentration, resulting in the best catalytic performance. The energy crisis has brought the concept of \"green chemistry\" to the forefront, and the catalytic oxidation of NO by H2O2 using catalysts is a promising green catalytic process. In addition, the synthesis of catalysts from fly ash for denitrification experiments can achieve the purpose of solid waste utilization and accelerate the process of catalytic oxidation, which has important research significance. In this study, the fly ash-based SSZ-13 zeolite was not only successfully prepared using an alkali fusion-assisted hydrothermal method, but also the optimal preparation parameters and the effect of each parameter on the formation of SSZ-13 zeolite was determined. The Fe-SSZ-13 catalysts were also prepared using three preparation methods, and the effects of the different preparation methods on the state and nature of the Fe species present in the zeolites, as well as the nature of the acidic sites in the catalysts were investigated. The properties of these active species were also correlated with the catalytic properties during NO oxidation to determine the catalytic oxidation mechanism. 2 Material and methods 2.1 Chemicals The fly ash used for the synthesis of zeolite was obtained from the Pingshuo thermal power plant in Shanxi Province, and it had the following chemical composition: 51.361% SiO2, 30.371% Al2O3, 4.817% Fe2O3, 1.156% TiO2 and 6.42% CaO, with SiO2 and Al2O3 accounting for more than 80%. Sodium hydroxide (NaOH), N, N, N-Trimethyladamantan (TMAda-OH), ferric nitrate (Fe(NO3)3·9H2O), Aluminum nitrate (Al(NO3)3·9H2O), Sodium silicate (Na2O·3.3SiO2, 34%) and colloidal silica (40%) were purchased from the Aladdin Chemistry Co., Ltd. Commercial SSZ-13 was purchased from Shanghai Macklin Biochemical Co., Ltd. All the chemicals used were of analytical grade and did not require any further special processing. 2.2 Characterization of the catalysts The elemental composition, fly ash content, and synthetic catalysts were determined using an ARL 9900 X-ray fluorescence (XRF) spectrometer (Thermo Scientific, America). The physical phase components of catalysts were analyzed using Powder X-ray diffraction (XRD) performed on an ULTIMA IV X-ray diffractometer (Japan). The microscopic morphology and structure of the sample surface were examined using JSM-IT200 Scanning electronic microscopy (SEM) (Japan). The specific surface areas, pore volume, and textural properties were determined by the nitrogen adsorption-desorption isotherm of the gas adsorption method using a Micromeritics ASAP 2020 gas adsorption analyzer. A Bia-Rad FTS 165 Fourier infrared spectroscopy analyzer (FTIR) was used to determine the oxygen-containing functional groups in catalysts. Temperature-programmed reduction with H2 (H2-TPR) and temperature-programmed desorption with NH3 (NH3-TPD) was analyzed on a chemisorption analyzer (AutoChem II 2920) equipped with a thermal conductivity detector (TCD). To determine the nature and the distribution of Fe, ultraviolet-visible diffuse reflectance spectroscopy (UV-Vis) was performed on a Shimizu UV-3600 spectrophotometer, capturing wavelengths ranging from 190 to 900 nm. X-ray photoelectron spectroscopy (XPS) was performed on a Thermo ESCALAB 250 instrument to qualitatively determine the ionic state of Fe. Electron spin resonance (ESR) spectral acquisition was performed using BMPO as a spin trap on a Bruker A300-10/12 electron paramagnetic resonance spectrometer, which is used to detect reactive oxygen species during the reaction. The Py-FTIR spectra obtained using the Bruker TENSOR 27 spectrometer allowed for the quantification of Brønsted acid sites and Lewis acid sites. 2.3 Synthesis of FA-SSZ-13 zeolite Raw fly ash was ground and sieved using a 75 μm screen for the synthesis of a fly ash-based SSZ-13 zeolite. A mixture of fly ash and NaOH with a mass ratio of 1:1.4 was ground and the homogeneous mixture was calcined in a muffle furnace at 873 K for 2 h, in the alkali fusion process. The alkali-melted product was then cooled to room temperature and ground into a fine powder, transferred to a 500 ml three-mouth beaker. An appropriate amount of deionized water, sodium silicate (Na2O·3.3SiO2), and organic structure directing agents (TMAda-OH) were added sequentially at a constant temperature of 80 °C with continuous stirring in an oil bath for 2 h to obtain the gel solution. Na2O·3.3SiO2 was selected as the silica source in the preparation process because it is cheaper than colloidal silica. The molar ratios of each component were set at 50SiO2: 1Al2O3: 7TMAda-OH: 1800H2O. The suspended solution was then transferred to a Teflon-lined steel autoclave and crystallized in an oven at 160 °C for 48 h. After the autoclave had naturally cooled, it was washed and filtered to approximately neutral pH, then dried for 6 h at 100 °C and calcined at 550 °C for 5 h to remove TMAda-OH and obtain Na-SSZ-13. Finally, the ion exchange process was carried out, which included ion exchange with 1 mol/L NH4Cl solution at 80 °C for 8 h to convert to NH4-SSZ-13, washing multiple times with deionized water to remove chloride ions, drying at 100 °C for 6 h, and calcining at 550 °C for 5 h to obtain H-SSZ-13. Fig. S2 depicts the schematic of the alkali fusion hydrothermal method for preparing H-SSZ-13 from fly ash. 2.4 Synthesis of SSZ-13-seed It is well known that the use of OSDAs has obvious disadvantages:(i) they are expensive; (ii) they require high-temperature calcination for removal and produce harmful gasses such as nitrogen oxides (NOX) and carbon dioxide (CO2); (iii) the use of OSDAs generates large amounts of effluent and pollutes the environment; and (iv) the energy released by high-temperature calcination can combine with the water formed and is extremely harmful to the inorganic structure of zeolites. Several drawbacks impede the practical application OSDAs. The best solution to these problems is to limit the use of OSDAs or to achieve OSDAs-free synthesis of zeolites, which can be accomplished by introducing zeolite seeds. In this study, the crystallization of SSZ-13 was efficiently promoted by introducing SSZ-13 seeds with a small amount of TMAda-OH in synergy with each other. The SSZ-13 seeds were synthesized according to published literature with slight modifications [19]. NaOH was added to deionized water and stirred at room temperature for 1 h. Subsequently, the aluminum source (Al(NO3)3·9H2O), silicon source (colloidal silica), and OSDAs (TMAda-OH) was added slowly and continuously stirred for 3 h at 80 °C. The molar ratio of each part was 34SiO2: 1Al2O3: 6Na2O: 3.6TMAda-OH: 1400H2O. The resultant gel mixture was placed in a Teflon-lined steel autoclave and crystallized at 160 °C in a static oven for 4 days. The solid product was recovered by filtration, washed with deionized water to pH neutrality, dried for 6 h at 100 °C and calcined in air at 550 °C for 5 h. The sample was labeled as SSZ-13-seed. Fig. S3 displays the XRD patterns of self-made SSZ-13-seed and commercial SSZ-13 zeolite, in which it is evident that their characteristic peaks are highly consistent. 2.5 Preparation of Fe-SSZ-13 catalysts 2.5.1 Preparation by impregnation method (IM) The appropriate amount of Fe(NO3)3·9H2O solution was configured and slowly added dropwise to 3.0 g of H-FA-SSZ-13 after the saturated water uptake of 3.0 g of SSZ-13 samples (H-FA-SSZ-13) was calculated. The mixture was left to stand at room temperature for 24 h. Finally, the mixture was dried at 100 °C for 6 h and then placed in a muffle furnace for calcination at 550 °C for 5 h. The obtained sample was labeled as Fe-SSZ-13-IM. 2.5.2 Preparation by liquid ion exchange method (LIE) Na-FA-SSZ-13 (3.0 g) samples were stirred in 300 mL of 1 M NH4Cl solution at 80 °C for 8 h. The NH4-SSZ-13 sample was then stirred in 100 mL of 0.1 M Fe(NO3)3·9H2O solution at 80 °C for 2 h. After that, the mixture was washed, dried and calcined at 550 °C for 5 h. The ion exchange process was performed three times to obtain the final catalyst. The obtained sample was labeled as Fe-SSZ-13-LIE. 2.5.3 Solid state ion exchange method (SSIE) After dissolving 0.36 g of Fe(NO3)3·9H2O in 10 g of distilled water, 3.0 g of NH4-FA-SSZ-13 powder was added while stirring. The mixture was then evaporated under vacuum using a rotary evaporator and dried at 110 °C for 6 h to avoid liquid ion exchange. After drying, the mixture was thoroughly ground using a ball mill for 20 min before being calcined in a muffle furnace at 550 °C for 5 h to obtain Fe-SSZ-13-SSIE, a solid ion exchange sample. 2.6 NO removal performance test The experimental setup for catalytic oxidation is shown in Fig. S4 and consists of four major components: simulated flue gas control, catalytic oxidation reaction, absorption, and exhaust gas detection. The specific NO removal experiments are described in the supplementary data. The corresponding removal efficiency was determined under a steady state based on the concentration of NO in the flue gas analyzer before and after the reaction, and three tests are required each time to ensure more reasonable and accurate experimental results. Eq. (1) shows the calculation formula. (1) η = ( C in − C out C in ) × 100 % Where, η is NO removal efficiency (%), C in is the inlet concentration of NO and C out is the outlet concentration of NO in the simulated flue gas (mg/m3). 3 Results and discussion 3.1 Preparation of fly ash-based SSZ-13 zeolite 3.1.1 XRF Table 1 shows the chemical composition of raw fly ash and the products of alkali fusion with different NaOH/FA ratios, which is important for quantifying SiO2 and Al2O3. The specific content of SiO2 and Al2O3 provides the main source of Si and Al for the synthesis of zeolites. Furthermore, when compared to raw fly ash, the SiO2/Al2O3 ratio increases sharply with increasing NaOH/FA ratios. The SiO2/Al2O3 ratio significantly influences the physico-chemical properties of zeolites and changes the entire zeolite conversion process. However, other trace components (Fe and Ca) are considered as exchangeable cations that not only affect the composition and crystal structure of zeolites but also interfere with their textural properties (pore size and surface area). 3.1.2 XRD The formation of a highly crystalline SSZ-13 zeolite (JCPDS 47-0762) is indicated by the distinctive characteristic peaks at 2θ =9.58°,12.97°,14.01°, 16.16°, 18.00°, 20.82°, 25.21°, 30.94° and 31.41° [1,10]. This is due to the structural rearrangement of FA during alkali fusion and hydrothermal treatment, i.e., the conversion of the main phases quartz and mullite into silicate and aluminate, and the XRD patterns of fly ash before and after alkali fusion are shown in Fig. S1. Consequently, the raw FA was successfully transformed into SSZ-13 zeolite. Too high or too low alkali content is detrimental to zeolite synthesis, as shown in Fig. 1 (a). As the NaOH/FA ratio increased from 1.0 to 1.4, the characteristic peak representing SSZ-13 increased gradually. However, the NaOH/FA ratio increased to 1.6, the synthesis of SSZ-13 failed, probably as a result of the direct transformation of FA into the most stable crystal structure, or even agglomeration. Therefore, NaOH/FA=1.4 is chosen as the optimal alkali to ash ratio. As demonstrated in Fig. 1(b), the SiO2/Al2O3 ratio (30, 50, 80, 100) of the initial sodium aluminosilicate gel composition, had a significant effect on the crystallization process. When the SiO2/Al2O3 ratio increased from 30 to 80, all SSZ-13 characteristic peaks could be observed, and their intensities initially increased and then slightly decreased. As the SiO2/Al2O3 ratio increased to 100, some of the diffraction peaks typical of SSZ-13 were visible on the pattern, along with other impure peaks. Therefore, the optimum ratio of SiO2/Al2O3 was set at 50. H2O is the medium for zeolite synthesis, in which nutrients, including silica and alumina, are dissolved for crystal nucleation and growth. As the results, the effect of the H2O/Al2O3 ratio on the formation of SSZ-13 zeolite was investigated during the preparation process in the range from 900 to 2500, as shown in Fig. 1(c). The characteristic peaks increased as the H2O/Al2O3 ratio varied from 900 to 1800, while only slight changes were shown as the H2O/Al2O3 ratio varied from 1800 to 2500. Therefore, the H2O/Al2O3 ratio was kept at 1800 for the synthesis of SSZ-13. Fig. 1(d) shows the XRD patterns of samples prepared with different concentrations of TMAda-OH. For comparison, the synthesized sample without the addition of OSDAs was also examined, and it was discovered that the characteristic diffraction peaks of the obtained products did not agree with the characteristic peaks of SSZ-13. It can be noticed that the intensity of the characteristic peaks of SSZ-13 molecular sieve increases with the increase of the addition of the template agent. When the molar ratio of TMAda-OH/Al2O3 was increased to 7, a fairly good crystallization effect was already harvested, and the intensity of the characteristic peaks of the samples started to weaken instead when the molar ratio continued to be increased. Therefore, the optimum molar ratio of TMAda-OH/SiO2 is 7. As shown in Fig. 1(e), the amount of seeds under optimal hydrothermal treatment conditions has a significant effect on the crystallization process. It is noteworthy that when there are no crystal seeds in the aluminosilicate gel and the TMAda-OH/Al2O3 ratio is 7, the crystallization products of SSZ-13 have started to appear, but there are also some characteristic peaks that do not belong to SSZ-13. At a seed addition of 2.5%, the typical diffraction peaks belonging to SSZ-13 have become clearly visible, and as the seed amount is increased from 5% to 7.5%, the structures of the prepared samples all show strong diffraction peaks of SSZ-13 with increasing intensity, indicating the successful crystallization of SSZ-13. When the seed amount was further increased, the crystalline intensity did not change much. For economic reasons, the seed amount for further synthesis of SSZ-13 by this seed-assisted process could be set at 7.5%. The introduction of seeds significantly reduces the use of TMAda-OH. The hydrothermal treatment time also affected the synthesis results (Fig. 1(f)). When the hydrothermal temperature was set at 160 °C, the hydrothermal time of the samples ranged from 24 h to 60 h. All samples exhibited typical SSZ-13 characteristic peaks. The XRD peaks with a crystallization time of 24 h had a clear arch, which was likely due to the poor crystallinity. When the crystallization time reached 36 h, the arching disappeared and the pattern became intense and sharp. The intensity of the diffraction peaks increased from 36 to 48 h, and further extension of the hydrothermal time decreased the diffraction peaks to some extent. These findings suggested that SSZ-13 zeolites can be successfully synthesized by crystallization at 160 °C for 48 h. The purpose of introducing SSZ-13-seed is to shorten the synthesis cycle, improve the quality of molecular sieves and reduce the use of expensive template agents (TMAda-OH). Fig. 1(g) shows the effect of the variation of the TMAda-OH/Al2O3 ratio on the synthesis effect when the addition of SSZ-13 seeds is 10% and the synthesis time is reduced to 40 h. It can be found that the presence of SSZ-13 seeds not only reduces the synthesis time, but also greatly reduces the need for a template agent, and the characteristic SSZ-13 zeolite product can be successfully synthesized when the TMAda-OH/Al2O3 ratio is 3, further attaining the goal of cost reduction. 3.1.3 FTIR FTIR spectra were obtained in the 400–4000 cm−1 scan range, providing detailed information on the functional groups present in the prepared samples. Fig. 2 depicts the FTIR results of SSZ-13 samples corresponding to all parameter variations. The band at around 540 cm−1 was interpreted as a double six-membered ring structure forming a CHA framework, while the bands at 640 cm−1 and 680 cm−1 were attributed to stretching and bending T-O vibrations in silicon-oxygen or aluminum-oxide tetrahedrons. The band at 805 cm−1 could be explained as symmetric stretching vibrations of Al-O in SSZ-13, the band at 1077 cm−1 as asymmetric stretching vibrations of O-Si-O or O-Al-O, and the bands at 1635 cm−1 and 3444 cm−1 bands to the stretching and bending vibrations of NH in the ammonium ion of TMAda-OH [20,21]. Therefore, FT-IR analysis confirms that the typical vibrational frequency of SSZ-13 zeolite can be synthesized from fly ash. 3.1.4 Morphological observations SEM was used to determine the microscopic morphology of all samples. Fig. 3 (a) shows the typical smooth spherical shape of the original FA. The presence of spherical particles indicates a higher proportion of Si and Al, both of which are precursors for zeolite synthesis. Fig. 3(b) illustrates that the spherical shape of fly ash is sufficiently disrupted after NaOH treatment and that the alkali fusion treatment effectively promotes the conversion of fly ash to silicates and aluminosilicates. The morphology of fly ash significantly changes after alkali fusion, displaying irregular rough and loose granularity. The action of NaOH at higher temperatures causes Si and Al to dissolve, and subsequent hydrothermal processes induce nucleation, crystal growth, and phase transformation, i.e. internal changes in the crystal structure energy [10,22]. Fig. 3(c) shows a commercial SSZ-13 zeolite product with a typical cubic crystal structure. Fig. 3(d) shows pure phase SSZ-13 zeolite crystals obtained after alkali fusion combined with the hydrothermal process, the rhombic polyhedral structure is visible, and a small amount of other shapes is observed, confirming the formation of zeolite. Fig. 3(e) shows the Fe-SSZ-13 product obtained by the liquid ion exchange method retains the typical CHA topology of SSZ-13 and the elemental distribution mapping (Fig. 3(f)) indicates the successful loading of Fe species into the SSZ-13 zeolite. 3.2 Synthesis and catalytic properties of Fe-SSZ-13 3.2.1 XRF The Si/Al ratios and Fe/Al ratios of the Fe/SSZ-13 catalysts obtained from the different preparation methods were determined by XRF testing and are listed in Table 2 . It is clear that the Si/Al ratios and Fe/Al ratios of the catalysts are similar, facilitating the analysis of their catalytic performance for comparison. 3.2.2 XRD XRD was used to characterize the crystalline structures of the parent SSZ-13 and three Fe-SSZ-13 samples prepared by different methods, and the findings are shown in Fig. 4 . Gratifyingly, the intensities of these diffraction peaks in the XRD patterns of Fe-SSZ-13 samples obtained from various preparations did not differ significantly from those of SSZ-13. This indicates that the introduction of Fe did not result in significant changes in SSZ-13 zeolites. When the Fe loading is more than 5 wt.%, it can be detected by powder X-ray diffraction analysis, and the characteristic peaks (2θ=33° and 36°) of α-Fe2O3 were discovered [23,24]. However, the characteristic peaks on both the Fe-SSZ-13-LIE and Fe-SSZ-13-IM catalysts were weaker, whereas the characteristic peaks on the Fe-SSZ-13-SSIE catalyst were stronger, indicating that the SSZ-13 zeolite can be an ideal carrier for dispersed Fe species and also that Fe species in the form of exchange ions or small agglomerates on the Fe-SSZ-13-LIE and Fe-SSZ-13-IM catalysts are better dispersed. 3.2.3 FTIR Fig. 5 shows the FTIR spectra of the parent SSZ-13 and Fe-SSZ-13 catalysts. Only the Fe-SSZ-13 catalyst can be seen in an IR band at 1262 cm−1, which may be associated with the presence of Fe3+ species [25]. The presence of OH groups and hydroxyl groups bridged with Al-OH-Si or Si-OH-Fe is shown by the peaks centered at 3611 and 3737 cm−1, respectively [10]. The introduction of Fe did not result in significant changes to the SSZ-13 structure, which is consistent with the XRD findings. 3.2.4 N2 adsorption-desorption The N2 adsorption-desorption isotherm can be used to determine the textural properties of different catalysts. Aluminosilicate microporous zeolite is a material with a high specific surface area. Fig. 6 shows that the N2 adsorption and desorption processes are reversible on all catalysts. According to the IUPAC classification, the isotherms of all catalysts are type І, which is a characteristic of microporous materials. Iron incorporation changes the specific surface area and microporous volume of zeolite, and iron incorporation increases the specific surface area and microporous volume of Fe-SSZ-13 zeolite. However, pore size decreases, owing primarily to partial blockage of zeolite pore channels. As shown in Table 2, the Fe-SSZ-13-IM catalyst has the smallest specific surface area and pore volume in Fe-SSZ-13 catalysts because diffusion is the main force for iron loading on SSZ-13 zeolite during the impregnation process, and capillary action attracts large amounts of Fe ions into the zeolite pore channels, making the pore channels prone to partial blocking by Fe species. In contrast, Fe-SSZ-13-LIE has a large specific surface area and pore volume, indicating that the blocking of iron species has no significant effect on its pore structure. Furthermore, the textural properties have a positive effect on the activity of the catalyst. A larger surface area and pore volume can enable better dispersion of active species, which can help to increase the number of active sites in the catalytic reaction process. 3.2.5 H2-TPR H2-TPR measurements were used to determine the reduction of Fe species in different catalysts. The different reduction peaks imply that multiple Fe species coexist in the Fe-SSZ-13 zeolite as shown in Fig. 7 . Isolated Fe3+ is first reduced to Fe2+ at low temperatures before being reduced further to Fe0 at high temperatures. That is, the peaks at 350–640 °C correspond to the partial reduction of Fe3+(Fe2O3) to Fe2+ (Fe3O4/FeO) at different ion exchange sites (extra-framework/framework), assigned to isolated Fe3+ and binuclear/oligomeric Fe-oxygen cations, respectively [24,26]. The peak at about 650 °C can be explained by the reduction of Fe3O4/FeO to Fe0, while the peak above 800 °C may be associated with the reduction of stable Fe2+ to Fe0. Thus, the intensity of the peaks at 426 and 537 °C for the Fe-SSZ-13-LIE catalyst is more pronounced for both peaks, which might be attributed to Fe3+ reduction to Fe2+ under different interactions of Fe2O3 with SSZ-13 zeolite or at different positions in the catalyst structure [27]. The third peak appearing around 760 °C corresponds to Fe2+ reduction to Fe0. Higher temperatures are required to achieve this reduction because Fe2+ corresponds to ions in extra-frame positions, and the reduction of Fe2+ to Fe0 in the framework can easily result in the collapse of the zeolite structure [18]. The Fe-SSZ-13-IM catalyst exhibits a similar display of three reduction signals of similar intensity, with the first two signals appearing at 434 and 518 °C, corresponding to the reduction of Fe2O3 to Fe2+, and the third signal appearing at around 656 °C corresponding to the reduction of magnetite (Fe3O4) to FeO. The Fe-SSZ-13-SSIE catalyst also exhibited three signals centered at 453, 621, and 766 °C corresponding to the reduction of Fe3+ to Fe2+, Fe3O4 to FeO, and Fe2+ to Fe0, respectively. In Fig. 7, the intensity and area of the depletion peaks of Fe-SSZ-13-LIE catalysts are significantly greater, implying a higher amount of monomeric and oligomeric FexOy clusters [28]. 3.2.6 XPS XPS was performed to determine the type and valence state of surface elements in the catalyst Fig. 8 ). From the Fe 2p spectra (Fig. 8(a)), two distinct sets of doublet peaks corresponding to Fe 2p3/2 (708.0–715.0 eV) and Fe 2p1/2 (721.0–730.0 eV) were observed, revealing the presence of Fe3+ originating from Fe2O3 [29,30]. The Fe3+ and Fe2+ on the catalyst surface were obtained by fitting according to different binding energies of Fe elements in Fe 2p3/2. Fitted peaks of Fe 2p3/2 around 710.7 eV and 712.8 eV in Fe-SSZ-13 are respectively attributed to Fe2+ and Fe3+ [31]. The Fe-SSZ-13-LIE catalyst has the highest levels of Fe3+, and the reduction of Fe3+ to Fe2+ is the rate-determining step for decomposition of H2O2 to produce hydroxyl radicals [32], which occupy an important position in oxidation. The lower binding energy of Fe3+ in Fe-SSZ-13-LIE compared to Fe-SSZ-13-IM and Fe-SSZ-13-SSIE indicates that Fe atoms have a lower density of electron clouds, which facilitates electron transfer from H2O2 to Fe3+, thereby promoting the generation of hydroxyl radicals [33]. According to integrated peak areas of Fe-based catalysts (Table 3 ), the Fe3+/Fe2+ ratios are all greater than 1, indicating that Fe3+ is the dominant Fe species on catalysts with Fe2O3 and the Fe3+/Fe2+ ratios for the three Fe-based catalysts are in the order: Fe-SSZ-13-LIE> Fe-SSZ-13-SSIE> Fe-SSZ-13-IM. The higher Fe3+ species levels are reduced to Fe2+, combined with H2O2 to produce hydroxyl radicals through Fenton oxidation reactions, which can be often described via Eqs. (2)–(4) [32,34]. But if the Fe2+ concentration is too high it is not conducive to the oxidation of NO, because too much Fe2+ will not react with H2O2 to produce ·OH, but is more likely to react with ·OH to produce FeOH2+ (Eq. (5))[35]. In Fig. 8(b), two peaks are observed around 530.2 and 532.7 eV, revealing the presence of different oxygen species. The peak around 530.2 eV is allocated to Fe species-associated oxygen, while the peak at 532.7 eV is defined for the Si-O band [16]. For the Fe-SSZ-13-LIE catalyst, the peak around 530.2 eV is the most pronounced, implying the enrichment of the indicated Fe species on the zeolite surface. (2) F e 3 + + H 2 O 2 → F e 2 + + HO 2 · + H + (3) F e 3 + + HO 2 · → F e 2 + + O 2 + H + (4) F e 2 + + H 2 O 2 → F e 3 + + · OH + O H − (5) F e 2 + + · OH → FeO H 2 + 3.2.7 UV-Vis spectroscopy Fig. 9 shows the UV-Vis spectra of Fe-SSZ-13 with different preparation methods. The UV-Vis spectroscopy can be used to assess the nature and distributions of different Fe species. The ligand to metal Bands (O→Fe3+) charge transfer transitions between 200 and 300 nm are defined as isolated Fe3+ ions occupying ion-exchange positions, transitions between 300 and 400 nm are attributed to oligomeric Fe species as FexOy clusters and transitions higher than 400 nm belong to crystalline Fe2O3 particles located outside zeolite pores [36–38]. Sizes of Fe2O3 particles can be reacted according to slopes of spectral bands above 500 nm [39]. The slopes of bands above 500 nm for Fe-based catalysts are arranged as: Fe-SSZ-13-IM>Fe-SSZ-13-LIE>Fe-SSZ-13-SSIE. Therefore, Fe2O3 particles in Fe-based catalysts obtained by impregnation have largest particle sizes. Relative proportions of Fe species in catalysts obtained by different preparation methods were quantified based on deconvolution spectra (Table 4 ). Findings from specific split-peak fit are presented in Fig. S5. The nature and distributions of Fe species are shown. Monomeric Fe3+ materials were predominant in the Fe-SSZ-13-LIE catalyst, while the Fe-SSZ-13-IM catalyst showed a higher percentage of agglomerated Fe2O3, in accordance with H2-TPR findings in Fig. 7. The high percentage of isolated Fe3+ and the low percentage of Fe2O3 particles indicate a high degree of dispersion of Fe species in SSZ-13 zeolites [37]. Findings from UV-Vis spectroscopy, have shown that although isolated Fe3+ ions, Fe(Ⅲ)xOy clusters and Fe2O3 particles co-exist in Fe-SSZ-13 [40].The Fe-SSZ-13 catalysts obtained by three different preparation methods have different redox properties and catalytic activities. Fe-SSZ-13-LIE has the highest catalytic activity, most likely due to the high amount of Fe3+ species it has. 3.2.8 ESR As previously reported [41–43], the introduction of iron enhances the decomposition of H2O2 into hydroxyl radicals, which are important reactive oxygen species involved in oxidation-reaction processes. To determine the reaction mechanisms, DMPO spin-trap ESR was used to monitor the radical species involved in the Fe-SSZ-13+H2O2 system. In Fig. 10 , the ESR spectra in all four measured samples exhibit 4-fold characteristic peaks of typical DMPO-·OH adducts with intensity ratios of 1:2:2:1 and intensity magnitudes in the order: Fe-SSZ-13-LIE>Fe-SSZ-13-IM>Fe-SSZ-13-SSIE. The ·OH yield is proportional to peak intensities of the ESR spectra [44]. That is, more ·OH radicals are produced in the Fe-SSZ-13-LIE+H2O2 system, and the removal efficiency of NO was highest, implying that hydroxyl radicals, which are key reactive oxygen species, achieved NO oxidation. The oxidation of NO with ·OH occurs through the following reactions Eqs. (6)–(9). (6) NO + · OH → HN O 2 (7) NO + · OH → · H + N O 2 (8) N O 2 + · OH → HN O 3 (9) HN O 2 + · OH → HN O 3 + · H 3.2.9 NH3-TPD The acidity of Fe-SSZ-13 catalysts obtained by different preparation methods can be quantified by NH3-TPD measurements (Fig. 11 ), while the amounts of corresponding weak and strong acidic sites are shown in Table 5 . Generally, two NH3 desorption peaks at different temperatures can be seen, indicating the presence of two types of acidic sites. Peaks centered at 140–230 °C are attributed to weakly bound NH3 on weak acid sites, and the peak around 400–550 °C is attributed to NH3 desorption from structural strong acid sites [26,45], which have a close association with catalytic oxidation performance in the NO removal process [44]. The introduction of Fe improved the acidity of SSZ-13 zeolite. The samples obtained by different preparation methods exhibit differences in strengths of weak and strong acids. Combined with findings for different acidity levels in Table 5, where Fe-SSZ-13-IM has the highest total acidity, especially in weak acidity exhibited, but Fe-SSZ-13-LIE has the advantage in terms of strong acidity enhancement. The significant acidic differences among all samples are also probably attributable to the presence and distribution of different Fe species. The role of specific acidic sites in catalysts should be further evaluated. 3.2.10 Py-FTIR Py-FTIR spectra was performed to elucidate on the acidity of the catalyst and to investigate the role of acidity in catalytic oxidation processes. Moreover, Py-FTIR was used to identify the Brønsted and Lewis acid sites of the catalyst. In Fig. 12 , the three intense bands are respectively attributed to Lewis acid site (1445 cm−1), the Brønsted acid site (1549 cm−1), and the superimposed Brønsted and Lewis acid site (1490 cm−1) [46,47]. Quantification of Brønsted acid and Lewis acid sites was performed by Py-FTIR spectroscopy (Table 6 ). The ratios of Brønsted to Lewis acid sites for the catalysts decreased in the order: Fe-SSZ-13-LIE>Fe-SSZ-13-IM>Fe-SSZ-13-SSIE. These findings are in tandem with the experimental results of H2O2 oxidation of NO catalyzed by three iron-based catalysts, from which it can be concluded that the role of Brønsted acid is crucial in oxidative NO removal processes. 3.3 Relationship between active iron species with acidic sites and catalytic activities Catalytic activities of Fe-SSZ-13 catalysts obtained by different preparation methods in the NO oxidation process were investigated. Commercial SSZ-13 without iron loading and fly ash-based SSZ-13 zeolite were added for comparisons (Fig. 13 ). Although the catalytic performance of FA-SSZ-13 zeolite was not as good as that of commercial SSZ-13, it exhibited an NO removal efficiency of 55%, thereby achieving the purpose of “turning waste into treasure”. On the basis of iron loading of fly ash-based zeolite, the NO removal efficiency was significantly improved. In addition, although carrier structures in the three Fe-SSZ-13 catalysts were the same and Fe levels similar, the obtained NO removal efficiencies are not the same. Fe-SSZ-13-LIE showed the most satisfactory catalytic effect. Based on previous characterization analyses of catalysts, the activities of catalysts depend on type and dispersion of iron substances on the zeolite surface as well as acidity and concentration of the catalyst. The Fe-SSZ-13-LIE catalyst contains highly dispersed isolated Fe3+ ions and strong Brønsted acid properties on the SSZ-13 zeolite surface. These properties facilitate rapid decomposition of H2O2 with strong oxidizing abilities of hydroxyl radicals, which in turn enhances NO removal. To reveal the significance of Fe3+ species and Brønsted acid sites as active species and the role of hydroxyl radicals in oxidation processes. We used the Fe-SSZ-13-LIE catalyst as the study object, ·OH scavenging assays were performed to determine catalytic oxidation mechanisms in combination with removal efficiencies of NO. Findings from these assays are shown in supplementary data (Fig. S6). According to ·OH scavenging assays, addition of the ·OH scavenger (isopropanol) markedly suppressed the NO removal efficiency. The introduction of Fe led to different degrees of variations in pore properties, morphology, microstructural stability, acidity, Fe species and distribution, as well as in redox properties of zeolites. When Fe was introduced into zeolites, Fe species with different roles were formed both inside and outside the skeleton. These Fe species play different roles in catalytic reactions. H2-TPR, XPS and UV-vis analyses, showed that different Fe species coexist in Fe-SSZ-13 catalysts, with a slightly higher percentage of Fe2O3 particles in Fe-SSZ-13-IM, probably due to the presence of slight particle agglomeration with a fraction located outside the channels. All Fe-SSZ-13 catalysts with isolated Fe3+ and oligomeric FexOy are overwhelmingly represented, indicating that Fe species are well dispersed on the crystal surface, inside the channels and cages of SSZ-13 zeolites to enhance catalytic activities. The catalysts obtained by ion exchange had a relatively high proportion of Fe3+ ions, however, in Fe-SSZ-13-LIE obtained by liquid ion exchange, Fe mainly exists in form of isolated Fe3+ ions, while Fe-SSZ-13-LIE had the highest removal efficiency. According to a previous study [42] and ESR characterization analysis, it was found that the Fe-based catalysis of H2O2 generates hydroxyl radicals (·OH) with strong oxidizing abilities, and the ·OH can effectively oxidize NO. The NH3-TPD and Py-FTIR assays, combined with removal efficiency experiments, revealed that acidic sites, especially Brønsted acid sites, are of great importance in catalytic processes. In summary, catalytic oxidation mechanisms of NO removal can be described as: the redox cyclic process of Fe2+/Fe3+ occurs simultaneously on catalyst surfaces [48,49], that is, in the presence of H2O2, Fe3+ on the zeolite surface is reduced to Fe2+, which reacts with additional H2O2 to release ·OH, consistent with findings from other studies [25]. Besides, highly dispersed Fe species on the zeolite surface can provide sufficient active sites and large contact surfaces with H2O2 [39], which has a high loading capacity, while stabilizing the Fe species in catalysts. Strong interactions between this Fe species and the carrier has positive effects on catalytic performance. Incorporation of Fe into the zeolite framework enhances the concentration of Brønsted acid sites, which promotes catalytic oxidation reactions. Moreover, Brønsted acidity creates an acidic environment around the catalyst surface, significantly increasing the rate of ·OH generation as the presence of protons to balance the electronegativity of the framework. Therefore, the combination of having more isolated Fe3+ species and Brønsted acid sites endows Fe-SSZ-13-LIE with better catalytic performance. Catalytic oxidation mechanisms of NO removal with Fe-SSZ-13 combined with H2O2 are shown in by Fig. 14 . 4 Conclusions The FA-SSZ-13 zeolite was successfully synthesized from fly ash by alkali fusion combined with hydrothermal treatment. Optimal preparation parameters and the effects of preparation conditions on formation of the SSZ-13 zeolite were determined by XRD, FTIR and SEM characterization to enhance the physico-chemical properties. A series of fly ash-based Fe-SSZ-13 catalysts were obtained by three different methods: impregnation, liquid ion exchange and solid state ion exchange methods. Catalytic performances were assessed using various physicochemical techniques. Even though the distribution and states of Fe species in the Fe-based catalysts differed, as did the amounts of acidic sites, when combined with findings from NO removal experiments, it was established that Fe species and acidic sites affect the catalytic activities of Fe-SSZ-13 in NO oxidation by H2O2. Among them, Fe-SSZ-13-LIE had the best catalytic oxidation performance, which was attributed to abundance of isolated Fe3+ species and Brønsted acid density. Thus, Fe-based catalysts prepared by liquid ion exchange with fly ash-based SSZ-13 zeolite as the carrier are promising for applications, which not only expands the application pathway of high value-added products from fly ash, but also realizes the efficient removal of NO. CRediT authorship contribution statement Jing Li: Conceptualization, Methodology, Validation, Investigation, Data curation, Writing – original draft, Writing – review & editing. Suxia Ma: Writing – review & editing, Supervision, Funding acquisition. Ke Ren: Validation, Formal analysis, Visualization. Nuo Xu: Investigation, Writing – review & editing. Declaration of Competing Interest The authors declare that they have no known competing financial interests or personal relationships that could have appeared to influence the work reported in this paper. Supplementary materials Supplementary material associated with this article can be found, in the online version, at doi:10.1016/j.mcat.2023.112920. Appendix Supplementary materials Image, application 1 References [1] P. Shi B. Wang R. Yin W. Ren J. Wang L. Chang Z. Huang W. Bao L. Han Migration behavior of heavy metals in coal fly ash-derived Cu-SSZ-13 during synthesis and NH3-SCR application Fuel 318 2022 P. Shi, B. Wang, R. Yin, W. Ren, J. Wang, L. Chang, Z. Huang, W. Bao, L. Han, Migration behavior of heavy metals in coal fly ash-derived Cu-SSZ-13 during synthesis and NH3-SCR application, Fuel, 318 (2022). [2] B.C. Amoni A.D.L. Freitas R.A. Bessa C.P. Oliveira M. Bastos-Neto D.C.S. Azevedo S.M.P. Lucena J.M. Sasaki J.B. Soares S.A. Soares A.R. Loiola Effect of coal fly ash treatments on synthesis of high-quality zeolite A as a potential additive for warm mix asphalt Mater. Chem. Phys. 2022 275 B.C. Amoni, A.D.L. Freitas, R.A. Bessa, C.P. Oliveira, M. Bastos-Neto, D.C.S. Azevedo, S.M.P. Lucena, J.M. Sasaki, J.B. Soares, S.A. Soares, A.R. Loiola, Effect of coal fly ash treatments on synthesis of high-quality zeolite A as a potential additive for warm mix asphalt, Mater. Chem. Phys., 275 (2022). [3] M.K. Murukutti H. Jena Synthesis of nano-crystalline zeolite-A and zeolite-X from Indian coal fly ash, its characterization and performance evaluation for the removal of Cs(+) and Sr(2+) from simulated nuclear waste J. Hazard. Mater. 423 2022 127085 M.K. Murukutti, H. Jena, Synthesis of nano-crystalline zeolite-A and zeolite-X from Indian coal fly ash, its characterization and performance evaluation for the removal of Cs(+) and Sr(2+) from simulated nuclear waste, J. Hazard. Mater., 423 (2022) 127085. [4] X. Ren S. Liu R. Qu L. Xiao P. Hu H. Song W. Wu C. Zheng X. Wu X. Gao Synthesis and characterization of single-phase submicron zeolite Y from coal fly ash and its potential application for acetone adsorption Microporous Mesoporous Mater. 2020 295 X. Ren, S. Liu, R. Qu, L. Xiao, P. Hu, H. Song, W. Wu, C. Zheng, X. Wu, X. Gao, Synthesis and characterization of single-phase submicron zeolite Y from coal fly ash and its potential application for acetone adsorption, Microporous Mesoporous Mater., 295 (2020). [5] Y. Liu G. Wang L. Wang X. Li Q. Luo P. Na Zeolite P synthesis based on fly ash and its removal of Cu(II) and Ni(II) ions Chin. J. Chem. Eng. 27 2019 341 348 Y. Liu, G. Wang, L. Wang, X. Li, Q. Luo, P. Na, Zeolite P synthesis based on fly ash and its removal of Cu(II) and Ni(II) ions, Chin. J. Chem. Eng., 27 (2019) 341–348. [6] Y. Chen S. Cong Q. Wang H. Han J. Lu Y. Kang W. Kang H. Wang S. Han H. Song J. Zhang Optimization of crystal growth of sub-micron ZSM-5 zeolite prepared by using Al(OH)3 extracted from fly ash as an aluminum source J. Hazard. Mater. 349 2018 18 26 Y. Chen, S. Cong, Q. Wang, H. Han, J. Lu, Y. Kang, W. Kang, H. Wang, S. Han, H. Song, J. Zhang, Optimization of crystal growth of sub-micron ZSM-5 zeolite prepared by using Al(OH)3 extracted from fly ash as an aluminum source, J. Hazard. Mater., 349 (2018) 18–26. [7] A.E. Ameh C.P. Eze E. Antunes M.L.U. Cornelius N.M. Musyoka L.F. Petrik Stability of fly ash-based BEA-zeolite in hot liquid phase Catal. Today 357 2020 416 424 A.E. Ameh, C.P. Eze, E. Antunes, M.L.U. Cornelius, N.M. Musyoka, L.F. Petrik, Stability of fly ash-based BEA-zeolite in hot liquid phase, Catal. Today, 357 (2020) 416–424. [8] D. Li H. Min X. Jiang X. Ran L. Zou J. Fan One-pot synthesis of Aluminum-containing ordered mesoporous silica MCM-41 using coal fly ash for phosphate adsorption J. Colloid Interface Sci. 404 2013 42 48 D. Li, H. Min, X. Jiang, X. Ran, L. Zou, J. Fan, One-pot synthesis of Aluminum-containing ordered mesoporous silica MCM-41 using coal fly ash for phosphate adsorption, J. Colloid Interface Sci., 404 (2013) 42–48. [9] G. Li B. Wang Q. Sun W.Q. Xu Y. Han Adsorption of lead ion on amino-functionalized fly-ash-based SBA-15 mesoporous molecular sieves prepared via two-step hydrothermal method Microporous Mesoporous Mater. 252 2017 105 115 G. Li, B. Wang, Q. Sun, W.Q. Xu, Y. Han, Adsorption of lead ion on amino-functionalized fly-ash-based SBA-15 mesoporous molecular sieves prepared via two-step hydrothermal method, Microporous Mesoporous Mater., 252 (2017) 105–115. [10] A.R.K. Gollakota V.S. Munagapati V. Volli S. Gautam J.C. Wen C.M. Shu Coal bottom ash derived zeolite (SSZ-13) for the sorption of synthetic anion Alizarin Red S (ARS) dye J. Hazard. Mater. 416 2021 125925 A.R.K. Gollakota, V.S. Munagapati, V. Volli, S. Gautam, J.C. Wen, C.M. Shu, Coal bottom ash derived zeolite (SSZ-13) for the sorption of synthetic anion Alizarin Red S (ARS) dye, J. Hazard. Mater., 416 (2021) 125925. [11] G. Li B. Wang Q. Sun W.Q. Xu Z. Ma H. Wang D. Zhang J. Zhou Novel synthesis of fly-ash-derived Cu-loaded SAPO-34 catalysts and their use in selective catalytic reduction of NO with NH3 Green Energy Environ. 4 2019 470 482 G. Li, B. Wang, Q. Sun, W.Q. Xu, Z. Ma, H. Wang, D. Zhang, J. Zhou, Novel synthesis of fly-ash-derived Cu-loaded SAPO-34 catalysts and their use in selective catalytic reduction of NO with NH3, Green Energy Environ., 4 (2019) 470–482. [12] S. Araki Y. Okubo K. Maekawa S. Imasaka H. Yamamoto Preparation of a high-silica chabazite-type zeolite membrane with high CO2 permeability using tetraethylammonium hydroxide J. Memb. Sci. 2020 613 S. Araki, Y. Okubo, K. Maekawa, S. Imasaka, H. Yamamoto, Preparation of a high-silica chabazite-type zeolite membrane with high CO2 permeability using tetraethylammonium hydroxide, J. Memb. Sci., 613 (2020). [13] L. Tang K.G. Haw Y. Zhang Q. Fang S. Qiu V. Valtchev Fast and efficient synthesis of SSZ-13 by interzeolite conversion of Zeolite Beta and Zeolite L Microporous Mesoporous Mater. 280 2019 306 314 L. Tang, K.G. Haw, Y. Zhang, Q. Fang, S. Qiu, V. Valtchev, Fast and efficient synthesis of SSZ-13 by interzeolite conversion of Zeolite Beta and Zeolite L, Microporous Mesoporous Mater., 280 (2019) 306–314. [14] M. Sarker D.K. Yoo S. Lee T.W. Kim C.U. Kim S.H. Jhung Conversion of Y into SSZ-13 zeolite, in the absence of extra silica, alumina and seed crystals, with N,N,N-dimethylethylcyclohexylammonium bromide, and application of the SSZ-13 zeolite in the propylene production from ethylene Catal. Today 375 2021 94 100 M. Sarker, D.K. Yoo, S. Lee, T.W. Kim, C.U. Kim, S.H. Jhung, Conversion of Y into SSZ-13 zeolite, in the absence of extra silica, alumina and seed crystals, with N,N,N-dimethylethylcyclohexylammonium bromide, and application of the SSZ-13 zeolite in the propylene production from ethylene, Catal. Today, 375 (2021) 94–100. [15] Q. Li W. Cong K. Li C. Xu L. Bing F. Wang D. Han G. Wang Transformation synthesis of SSZ-13 zeolite from ZSM-35 zeolite J. Solid State Chem. 2021 304 Q. Li, W. Cong, K. Li, C. Xu, L. Bing, F. Wang, D. Han, G. Wang, Transformation synthesis of SSZ-13 zeolite from ZSM-35 zeolite, J. Solid State Chem., 304 (2021). [16] L. Chen X. Zhang S. Zhang L. Xu Y. Yuan L. Xu A highly efficient Fe/Beta catalyst for the liquid-phase oxidation of naphthalene: the influence of Fe species and zeolite acidity Mol. Catal. 2021 514 L. Chen, X. Zhang, S. Zhang, L. Xu, Y. Yuan, L. Xu, A highly efficient Fe/Beta catalyst for the liquid-phase oxidation of naphthalene: the influence of Fe species and zeolite acidity, Mol. Catal., 514 (2021). [17] J. Shi Y. Zhang Z. Zhang Z. Fan M. Chen Z. Zhang W. Shangguan Water promotion mechanism on the NH3-SCR over Fe-BEA catalyst Catal. Commun. 115 2018 59 63 J. Shi, Y. Zhang, Z. Zhang, Z. Fan, M. Chen, Z. Zhang, W. Shangguan, Water promotion mechanism on the NH3-SCR over Fe-BEA catalyst, Catal. Commun., 115 (2018) 59–63. [18] M. Romero-Sáez D. Divakar A. Aranzabal J.R. González-Velasco J.A. González-Marcos Catalytic oxidation of trichloroethylene over Fe-ZSM-5: influence of the preparation method on the iron species and the catalytic behavior Appl. Catal. B 180 2016 210 218 M. Romero-Sáez, D. Divakar, A. Aranzabal, J.R. González-Velasco, J.A. González-Marcos, Catalytic oxidation of trichloroethylene over Fe-ZSM-5: influence of the preparation method on the iron species and the catalytic behavior, Appl. Catal. B, 180 (2016) 210–218. [19] H. Zhang Q. Dong P. Shan D. Pan B. Fan R. Li Synthesis of highly crystallized SSZ-13 with a small amount of organic structure-directing agent in the presence of seeds Microporous Mesoporous Mater. 2021 324 H. Zhang, Q. Dong, P. Shan, D. Pan, B. Fan, R. Li, Synthesis of highly crystallized SSZ-13 with a small amount of organic structure-directing agent in the presence of seeds, Microporous Mesoporous Mater., 324 (2021). [20] Y. Wang J. Chen X. Lei Y. Ren J. Wu Preparation of high silica microporous zeolite SSZ-13 using solid waste silica fume as silica source Adv. Powder Technol. 29 2018 1112 1118 Y. Wang, J. Chen, X. Lei, Y. Ren, J. Wu, Preparation of high silica microporous zeolite SSZ-13 using solid waste silica fume as silica source, Adv. Powder Technol., 29 (2018) 1112–1118. [21] R. Xu R. Zhang N. Liu B. Chen S. Zhang Qiao Template design and economical strategy for the synthesis of SSZ-13 (CHA-Type) zeolite as an excellent catalyst for the selective catalytic reduction of NOxby ammonia ChemCatChem 7 2015 3842 3847 R. Xu, R. Zhang, N. Liu, B. Chen, S. Zhang Qiao, Template design and economical strategy for the synthesis of SSZ-13 (CHA-Type) zeolite as an excellent catalyst for the selective catalytic reduction of NOxby ammonia, ChemCatChem, 7 (2015) 3842–3847. [22] L. Bieseki F.G. Penha S.B.C. Pergher Zeolite A synthesis employing a brazilian coal ash as the silicon and aluminum source and its applications in adsorption and pigment formulation Mater. Res. 16 2012 38 43 L. Bieseki, F.G. Penha, S.B.C. Pergher, Zeolite A synthesis employing a brazilian coal ash as the silicon and aluminum source and its applications in adsorption and pigment formulation, Mater. Res., 16 (2012) 38–43. [23] T. Zhang J. Liu D. Wang Z. Zhao Y. Wei K. Cheng G. Jiang A. Duan Selective catalytic reduction of NO with NH3 over HZSM-5-supported Fe–Cu nanocomposite catalysts: the Fe–Cu bimetallic effect Appl. Catal. B 148-149 2014 520 531 T. Zhang, J. Liu, D. Wang, Z. Zhao, Y. Wei, K. Cheng, G. Jiang, A. Duan, Selective catalytic reduction of NO with NH3 over HZSM-5-supported Fe–Cu nanocomposite catalysts: the Fe–Cu bimetallic effect, Appl. Catal. B, 148-149 (2014) 520–531. [24] J. Zhang X. Tang H. Yi Q. Yu Y. Zhang J. Wei Y. Yuan Synthesis, characterization and application of Fe-zeolite: a review Appl. Catal. A 2022 630 J. Zhang, X. Tang, H. Yi, Q. Yu, Y. Zhang, J. Wei, Y. Yuan, Synthesis, characterization and application of Fe-zeolite: a review, Appl. Catal. A, 630 (2022). [25] E.R. Bandala R. Sadek J. Gurgul K. Łątka M. Zimowska L. Valentin O.M. Rodriguez-Narvaez S. Dzwigaj Assessment of the capability of Fe and Al modified BEA zeolites to promote advanced oxidation processes in aqueous phase Chem. Eng. J. 2021 409 E.R. Bandala, R. Sadek, J. Gurgul, K. Łątka, M. Zimowska, L. Valentin, O.M. Rodriguez-Narvaez, S. Dzwigaj, Assessment of the capability of Fe and Al modified BEA zeolites to promote advanced oxidation processes in aqueous phase, Chem. Eng. J., 409 (2021). [26] F. Gao Y. Zheng R.K. Kukkadapu Y. Wang E.D. Walter B. Schwenzer J. Szanyi C.H.F. Peden Iron loading effects in Fe/SSZ-13 NH3-SCR Catalysts: nature of the Fe Ions and structure–function relationships ACS Catal. 6 2016 2939 2954 F. Gao, Y. Zheng, R.K. Kukkadapu, Y. Wang, E.D. Walter, B. Schwenzer, J. Szanyi, C.H.F. Peden, Iron loading effects in Fe/SSZ-13 NH3-SCR Catalysts: nature of the Fe Ions and structure–function relationships, ACS Catal., 6 (2016) 2939–2954. [27] L. Li Q. Shen J. Li Z. Hao Z.P. Xu G.Q.M. Lu Iron-exchanged FAU zeolites: preparation, characterization and catalytic properties for N2O decomposition Appl. Catal. A 344 2008 131 141 L. Li, Q. Shen, J. Li, Z. Hao, Z.P. Xu, G.Q.M. Lu, Iron-exchanged FAU zeolites: preparation, characterization and catalytic properties for N2O decomposition, Appl. Catal. A, 344 (2008) 131–141. [28] K. Niu G. Li J. Liu Y. Wei One step synthesis of Fe-SSZ-13 zeolite by hydrothermal method J. Solid State Chem. 2020 287 K. Niu, G. Li, J. Liu, Y. Wei, One step synthesis of Fe-SSZ-13 zeolite by hydrothermal method, J. Solid State Chem., 287 (2020). [29] Y. Yue B. Liu P. Qin N. Lv T. Wang X. Bi H. Zhu P. Yuan Z. Bai Q. Cui X. Bao One-pot synthesis of FeCu-SSZ-13 zeolite with superior performance in selective catalytic reduction of NO by NH3 from natural aluminosilicates Chem. Eng. J. 2020 398 Y. Yue, B. Liu, P. Qin, N. Lv, T. Wang, X. Bi, H. Zhu, P. Yuan, Z. Bai, Q. Cui, X. Bao, One-pot synthesis of FeCu-SSZ-13 zeolite with superior performance in selective catalytic reduction of NO by NH3 from natural aluminosilicates, Chem. Eng. J., 398 (2020). [30] G. Wu S. Liu Z. Chen Q. Yu Y. Chu H. Xiao H. Peng D. Fang S. Deng Y. Chen Promotion effect of alkaline leaching on the catalytic performance over Cu/Fe-SSZ-13 catalyst for selective catalytic reduction of NOx with NH3 J. Taiwan Inst. Chem. Eng. 2022 134 G. Wu, S. Liu, Z. Chen, Q. Yu, Y. Chu, H. Xiao, H. Peng, D. Fang, S. Deng, Y. Chen, Promotion effect of alkaline leaching on the catalytic performance over Cu/Fe-SSZ-13 catalyst for selective catalytic reduction of NOx with NH3, J. Taiwan Inst. Chem. Eng., 134 (2022). [31] P. Tan Active phase, catalytic activity, and induction period of Fe/zeolite material in nonoxidative aromatization of methane J. Catal. 338 2016 21 29 P. Tan, Active phase, catalytic activity, and induction period of Fe/zeolite material in nonoxidative aromatization of methane, J. Catal., 338 (2016) 21–29. [32] H. Wang B. Zhang H. Yang Q. Bao B. Wu New insights on the effects of SO2 on NO oxidation from flue gas with H2O2 vapor over Fe2O3/SiO2 Process Saf. Environ. Prot. 165 2022 138 150 H. Wang, B. Zhang, H. Yang, Q. Bao, B. Wu, New insights on the effects of SO2 on NO oxidation from flue gas with H2O2 vapor over Fe2O3/SiO2, Process Saf. Environ. Prot., 165 (2022) 138–150. [33] X. Huang J. Ding Q. Zhong Catalytic decomposition of H2O2 over Fe-based catalysts for simultaneous removal of NOX and SO2 Appl. Surf. Sci. 326 2015 66 72 X. Huang, J. Ding, Q. Zhong, Catalytic decomposition of H2O2 over Fe-based catalysts for simultaneous removal of NOX and SO2, Appl. Surf. Sci., 326 (2015) 66–72. [34] B. Wu Y. Xiong Y. Ge Simultaneous removal of SO2 and NO from flue gas with OH from the catalytic decomposition of gas-phase H2O2 over solid-phase Fe2(SO4)3 Chem. Eng. J. 331 2018 343 354 B. Wu, Y. Xiong, Y. Ge, Simultaneous removal of SO2 and NO from flue gas with OH from the catalytic decomposition of gas-phase H2O2 over solid-phase Fe2(SO4)3, Chem. Eng. J., 331 (2018) 343–354. [35] M.D.N. Ramos C.S. Santana C.C.V. Velloso A.H.M. da Silva F. Magalhães A. Aguiar A review on the treatment of textile industry effluents through Fenton processes Process Saf. Environ. Prot. 155 2021 366 386 M.D.N. Ramos, C.S. Santana, C.C.V. Velloso, A.H.M. da Silva, F. Magalhães, A. Aguiar, A review on the treatment of textile industry effluents through Fenton processes, Process Saf. Environ. Prot., 155 (2021) 366–386. [36] J. Wan J. Chen R. Zhao R. Zhou One-pot synthesis of Fe/Cu-SSZ-13 catalyst and its highly efficient performance for the selective catalytic reduction of nitrogen oxide with ammonia J. Environ. Sci. 100 2021 306 316 (China) J. Wan, J. Chen, R. Zhao, R. Zhou, One-pot synthesis of Fe/Cu-SSZ-13 catalyst and its highly efficient performance for the selective catalytic reduction of nitrogen oxide with ammonia, J. Environ. Sci. (China), 100 (2021) 306–316. [37] Z. Chen Q. Liu L. Guo S. Zhang L. Pang Y. Guo T. Li The promoting mechanism of in situ Zr doping on the hydrothermal stability of Fe-SSZ-13 catalyst for NH3-SCR reaction Appl. Catal. B 2021 286 Z. Chen, Q. Liu, L. Guo, S. Zhang, L. Pang, Y. Guo, T. Li, The promoting mechanism of in situ Zr doping on the hydrothermal stability of Fe-SSZ-13 catalyst for NH3-SCR reaction, Appl. Catal. B, 286 (2021). [38] A. Wang Y. Wang E.D. Walter R.K. Kukkadapu Y. Guo G. Lu R.S. Weber Y. Wang C.H.F. Peden F. Gao Catalytic N2O decomposition and reduction by NH3 over Fe/Beta and Fe/SSZ-13 catalysts J. Catal. 358 2018 199 210 A. Wang, Y. Wang, E.D. Walter, R.K. Kukkadapu, Y. Guo, G. Lu, R.S. Weber, Y. Wang, C.H.F. Peden, F. Gao, Catalytic N2O decomposition and reduction by NH3 over Fe/Beta and Fe/SSZ-13 catalysts, J. Catal., 358 (2018) 199–210. [39] X. Yang X. Cheng A.A. Elzatahry J. Chen A. Alghamdi Y. Deng Recyclable Fenton-like catalyst based on zeolite Y supported ultrafine, highly-dispersed Fe2O3 nanoparticles for removal of organics under mild conditions Chin. Chem. Lett. 30 2019 324 330 X. Yang, X. Cheng, A.A. Elzatahry, J. Chen, A. Alghamdi, Y. Deng, Recyclable Fenton-like catalyst based on zeolite Y supported ultrafine, highly-dispersed Fe2O3 nanoparticles for removal of organics under mild conditions, Chin. Chem. Lett., 30 (2019) 324–330. [40] F. Lin T. Andana Y. Wu J. Szanyi Y. Wang F. Gao Catalytic site requirements for N2O decomposition on Cu-, Co-, and Fe-SSZ-13 zeolites J. Catal. 401 2021 70 80 F. Lin, T. Andana, Y. Wu, J. Szanyi, Y. Wang, F. Gao, Catalytic site requirements for N2O decomposition on Cu-, Co-, and Fe-SSZ-13 zeolites, J. Catal., 401 (2021) 70–80. [41] M. Cheng G. Zeng D. Huang C. Lai P. Xu C. Zhang Y. Liu Hydroxyl radicals based advanced oxidation processes (AOPs) for remediation of soils contaminated with organic compounds: a review Chem. Eng. J. 284 2016 582 598 M. Cheng, G. Zeng, D. Huang, C. Lai, P. Xu, C. Zhang, Y. Liu, Hydroxyl radicals based advanced oxidation processes (AOPs) for remediation of soils contaminated with organic compounds: a review, Chem. Eng. J., 284 (2016) 582–598. [42] Z. Shangguan X. Yuan L. Jiang Y. Zhao L. Qin X. Zhou Y. Wu J.W. Chew H. Wang Zeolite-based Fenton-like catalysis for pollutant removal and reclamation from wastewater Chin. Chem. Lett. 2022 Z. Shangguan, X. Yuan, L. Jiang, Y. Zhao, L. Qin, X. Zhou, Y. Wu, J.W. Chew, H. Wang, Zeolite-based Fenton-like catalysis for pollutant removal and reclamation from wastewater, Chin. Chem. Lett., (2022). [43] C. Zhou C. Lai P. Xu G. Zeng D. Huang C. Zhang M. Cheng L. Hu J. Wan Y. Liu W. Xiong Y. Deng M. Wen In situ grown AgI/Bi12O17Cl2 heterojunction photocatalysts for visible light degradation of sulfamethazine: efficiency, pathway, and mechanism ACS Sustain. Chem. Eng. 6 2018 4174 4184 C. Zhou, C. Lai, P. Xu, G. Zeng, D. Huang, C. Zhang, M. Cheng, L. Hu, J. Wan, Y. Liu, W. Xiong, Y. Deng, M. Wen, In situ grown AgI/Bi12O17Cl2 heterojunction photocatalysts for visible light degradation of sulfamethazine: efficiency, pathway, and mechanism, ACS Sustain. Chem. Eng., 6 (2018) 4174–4184. [44] R. Cui S. Ma J. Wang S. Sun NO oxidation over Fe-based catalysts supported on montmorillonite K10, gamma-alumina and ZSM-5 with gas-phase H2O2 Chemosphere 234 2019 302 309 R. Cui, S. Ma, J. Wang, S. Sun, NO oxidation over Fe-based catalysts supported on montmorillonite K10, gamma-alumina and ZSM-5 with gas-phase H2O2, Chemosphere, 234 (2019) 302–309. [45] Q. Li W. Cong J. Zhang C. Xu F. Wang D. Han G. Wang L. Bing Rapid synthesis of hierarchical nanosized SSZ-13 zeolite with excellent MTO catalytic performance Microporous Mesoporous Mater. 2022 331 Q. Li, W. Cong, J. Zhang, C. Xu, F. Wang, D. Han, G. Wang, L. Bing, Rapid synthesis of hierarchical nanosized SSZ-13 zeolite with excellent MTO catalytic performance, Microporous Mesoporous Mater., 331 (2022). [46] H. Xia H. Hu S. Xu K. Xiao S. Zuo Catalytic conversion of glucose to 5-hydroxymethyfural over Fe/β zeolites with extra-framework isolated Fe species in a biphasic reaction system Biomass Bioenergy 108 2018 426 432 H. Xia, H. Hu, S. Xu, K. Xiao, S. Zuo, Catalytic conversion of glucose to 5-hydroxymethyfural over Fe/β zeolites with extra-framework isolated Fe species in a biphasic reaction system, Biomass Bioenergy, 108 (2018) 426–432. [47] P. Xiao Y. Wang R. Osuga J.N. Kondo T. Yokoi One-pot synthesis of highly active Fe-containing MWW zeolite catalyst: elucidation of Fe species and its impact on catalytic performance Adv. Powder Technol. 32 2021 1070 1080 P. Xiao, Y. Wang, R. Osuga, J.N. Kondo, T. Yokoi, One-pot synthesis of highly active Fe-containing MWW zeolite catalyst: elucidation of Fe species and its impact on catalytic performance, Adv. Powder Technol., 32 (2021) 1070–1080. [48] Z. Bencheqroun N.E. Sahin O.S.G.P. Soares M.F.R. Pereira H. Zaitan M. Nawdali E. Rombi A.M. Fonseca P. Parpot I.C. Neves Fe(III)-exchanged zeolites as efficient electrocatalysts for Fenton-like oxidation of dyes in aqueous phase J. Environ. Chem. Eng. 2022 10 Z. Bencheqroun, N.E. Sahin, O.S.G.P. Soares, M.F.R. Pereira, H. Zaitan, M. Nawdali, E. Rombi, A.M. Fonseca, P. Parpot, I.C. Neves, Fe(III)-exchanged zeolites as efficient electrocatalysts for Fenton-like oxidation of dyes in aqueous phase, J. Environ. Chem. Eng., 10 (2022). [49] P. Zhang S. Yuan P. Liao Mechanisms of hydroxyl radical production from abiotic oxidation of pyrite under acidic conditions Geochim. Cosmochim. Acta 172 2016 444 457 P. Zhang, S. Yuan, P. Liao, Mechanisms of hydroxyl radical production from abiotic oxidation of pyrite under acidic conditions, Geochim. Cosmochim. Acta, 172 (2016) 444–457.",
      "scopus-id": "85146259007",
      "coredata": {
        "eid": "1-s2.0-S246882312300007X",
        "dc:description": "SSZ-13 zeolite was synthesized from fly ash using a combined alkali fusion hydrothermal method. The optimal synthesis parameters are as follows: NaOH/FA=1.4, SiO2/Al2O3=50, H2O/SiO2=1800, TMAda-OH/Al2O3=7, the amount of SSZ-13-seed=10%, and crystallization time and temperature were 160 °C and 40 h. Based on this, a series of fly ash-based Fe-SSZ-13 catalysts were prepared using three different methods and tested in catalytic oxidation with H2O2 for NO removal. The experiment results showed that the NO removal efficiency catalyzed by Fe-SSZ-13-SSIE, Fe-SSZ-13-LIE and Fe-SSZ-13-IM were 78%, 87% and 84%, respectively. ESR was used to detect hydroxyl radicals, UV-vis, XPS and H2-TPR were applied to test the composition, state and distribution of iron species, while NH3-TPD and Py-FTIR were performed to analyze the intensity and type of acidic sites, and finally to determine the relationship between catalyst structure, active species and catalytic performance in combination with NO removal experiments. The catalytic oxidation mechanism analysis revealed that the excellent catalytic performance can be attributed to the dual function of strong Brønsted acidity on the surface and isolated Fe3+ with high dispersion, which can rapidly decompose H2O2 into ·OH and efficiently achieve NO oxidation. In conclusion, the preparation of fly ash catalysts has great potential for achieving the dual function of waste utilization and pollutant removal.",
        "openArchiveArticle": "false",
        "prism:coverDate": "2023-02-15",
        "openaccessUserLicense": null,
        "prism:aggregationType": "Journal",
        "prism:url": "https://api.elsevier.com/content/article/pii/S246882312300007X",
        "dc:creator": [
          {
            "@_fa": "true",
            "$": "Li, Jing"
          },
          {
            "@_fa": "true",
            "$": "Ma, Suxia"
          },
          {
            "@_fa": "true",
            "$": "Ren, Ke"
          },
          {
            "@_fa": "true",
            "$": "Xu, Nuo"
          }
        ],
        "link": [
          {
            "@_fa": "true",
            "@rel": "self",
            "@href": "https://api.elsevier.com/content/article/pii/S246882312300007X"
          },
          {
            "@_fa": "true",
            "@rel": "scidir",
            "@href": "https://www.sciencedirect.com/science/article/pii/S246882312300007X"
          }
        ],
        "dc:format": "application/json",
        "openaccessType": null,
        "pii": "S2468-8231(23)00007-X",
        "prism:volume": "537",
        "articleNumber": "112920",
        "prism:publisher": "Elsevier B.V.",
        "dc:title": "Studies on the preparation of fly ash-derived Fe-SSZ-13 catalysts and their performance in the catalytic oxidation of NO by H2O2",
        "prism:copyright": "© 2023 Elsevier B.V. All rights reserved.",
        "openaccess": "0",
        "prism:issn": "24688231",
        "dcterms:subject": [
          {
            "@_fa": "true",
            "$": "Fe-SSZ-13"
          },
          {
            "@_fa": "true",
            "$": "Isolated Fe3+ species"
          },
          {
            "@_fa": "true",
            "$": "Brønsted acid sites"
          },
          {
            "@_fa": "true",
            "$": "Hydroxyl radicals"
          },
          {
            "@_fa": "true",
            "$": "Catalytic oxidation"
          }
        ],
        "openaccessArticle": "false",
        "prism:publicationName": "Molecular Catalysis",
        "openaccessSponsorType": null,
        "prism:pageRange": "112920",
        "pubType": "fla",
        "prism:coverDisplayDate": "15 February 2023",
        "prism:doi": "10.1016/j.mcat.2023.112920",
        "prism:startingPage": "112920",
        "dc:identifier": "doi:10.1016/j.mcat.2023.112920",
        "openaccessSponsorName": null
      },
      "objects": {
        "object": [
          {
            "@category": "standard",
            "@height": "972",
            "@width": "565",
            "@_fa": "true",
            "$": "https://api.elsevier.com/content/object/eid/1-s2.0-S246882312300007X-gr1.jpg?httpAccept=%2A%2F%2A",
            "@multimediatype": "JPEG image file",
            "@type": "IMAGE-DOWNSAMPLED",
            "@size": "135867",
            "@ref": "gr1",
            "@mimetype": "image/jpeg"
          },
          {
            "@category": "standard",
            "@height": "941",
            "@width": "601",
            "@_fa": "true",
            "$": "https://api.elsevier.com/content/object/eid/1-s2.0-S246882312300007X-gr2.jpg?httpAccept=%2A%2F%2A",
            "@multimediatype": "JPEG image file",
            "@type": "IMAGE-DOWNSAMPLED",
            "@size": "165144",
            "@ref": "gr2",
            "@mimetype": "image/jpeg"
          },
          {
            "@category": "standard",
            "@height": "761",
            "@width": "659",
            "@_fa": "true",
            "$": "https://api.elsevier.com/content/object/eid/1-s2.0-S246882312300007X-gr3.jpg?httpAccept=%2A%2F%2A",
            "@multimediatype": "JPEG image file",
            "@type": "IMAGE-DOWNSAMPLED",
            "@size": "151729",
            "@ref": "gr3",
            "@mimetype": "image/jpeg"
          },
          {
            "@category": "standard",
            "@height": "413",
            "@width": "489",
            "@_fa": "true",
            "$": "https://api.elsevier.com/content/object/eid/1-s2.0-S246882312300007X-gr4.jpg?httpAccept=%2A%2F%2A",
            "@multimediatype": "JPEG image file",
            "@type": "IMAGE-DOWNSAMPLED",
            "@size": "55425",
            "@ref": "gr4",
            "@mimetype": "image/jpeg"
          },
          {
            "@category": "standard",
            "@height": "417",
            "@width": "489",
            "@_fa": "true",
            "$": "https://api.elsevier.com/content/object/eid/1-s2.0-S246882312300007X-gr10.jpg?httpAccept=%2A%2F%2A",
            "@multimediatype": "JPEG image file",
            "@type": "IMAGE-DOWNSAMPLED",
            "@size": "55920",
            "@ref": "gr10",
            "@mimetype": "image/jpeg"
          },
          {
            "@category": "standard",
            "@height": "419",
            "@width": "489",
            "@_fa": "true",
            "$": "https://api.elsevier.com/content/object/eid/1-s2.0-S246882312300007X-gr5.jpg?httpAccept=%2A%2F%2A",
            "@multimediatype": "JPEG image file",
            "@type": "IMAGE-DOWNSAMPLED",
            "@size": "50998",
            "@ref": "gr5",
            "@mimetype": "image/jpeg"
          },
          {
            "@category": "standard",
            "@height": "429",
            "@width": "489",
            "@_fa": "true",
            "$": "https://api.elsevier.com/content/object/eid/1-s2.0-S246882312300007X-gr6.jpg?httpAccept=%2A%2F%2A",
            "@multimediatype": "JPEG image file",
            "@type": "IMAGE-DOWNSAMPLED",
            "@size": "54698",
            "@ref": "gr6",
            "@mimetype": "image/jpeg"
          },
          {
            "@category": "standard",
            "@height": "418",
            "@width": "489",
            "@_fa": "true",
            "$": "https://api.elsevier.com/content/object/eid/1-s2.0-S246882312300007X-gr7.jpg?httpAccept=%2A%2F%2A",
            "@multimediatype": "JPEG image file",
            "@type": "IMAGE-DOWNSAMPLED",
            "@size": "44473",
            "@ref": "gr7",
            "@mimetype": "image/jpeg"
          },
          {
            "@category": "standard",
            "@height": "242",
            "@width": "659",
            "@_fa": "true",
            "$": "https://api.elsevier.com/content/object/eid/1-s2.0-S246882312300007X-gr8.jpg?httpAccept=%2A%2F%2A",
            "@multimediatype": "JPEG image file",
            "@type": "IMAGE-DOWNSAMPLED",
            "@size": "53294",
            "@ref": "gr8",
            "@mimetype": "image/jpeg"
          },
          {
            "@category": "standard",
            "@height": "293",
            "@width": "659",
            "@_fa": "true",
            "$": "https://api.elsevier.com/content/object/eid/1-s2.0-S246882312300007X-gr14.jpg?httpAccept=%2A%2F%2A",
            "@multimediatype": "JPEG image file",
            "@type": "IMAGE-DOWNSAMPLED",
            "@size": "44288",
            "@ref": "gr14",
            "@mimetype": "image/jpeg"
          },
          {
            "@category": "standard",
            "@height": "421",
            "@width": "489",
            "@_fa": "true",
            "$": "https://api.elsevier.com/content/object/eid/1-s2.0-S246882312300007X-gr9.jpg?httpAccept=%2A%2F%2A",
            "@multimediatype": "JPEG image file",
            "@type": "IMAGE-DOWNSAMPLED",
            "@size": "49302",
            "@ref": "gr9",
            "@mimetype": "image/jpeg"
          },
          {
            "@category": "standard",
            "@height": "430",
            "@width": "489",
            "@_fa": "true",
            "$": "https://api.elsevier.com/content/object/eid/1-s2.0-S246882312300007X-gr13.jpg?httpAccept=%2A%2F%2A",
            "@multimediatype": "JPEG image file",
            "@type": "IMAGE-DOWNSAMPLED",
            "@size": "34558",
            "@ref": "gr13",
            "@mimetype": "image/jpeg"
          },
          {
            "@category": "standard",
            "@height": "417",
            "@width": "489",
            "@_fa": "true",
            "$": "https://api.elsevier.com/content/object/eid/1-s2.0-S246882312300007X-gr12.jpg?httpAccept=%2A%2F%2A",
            "@multimediatype": "JPEG image file",
            "@type": "IMAGE-DOWNSAMPLED",
            "@size": "50785",
            "@ref": "gr12",
            "@mimetype": "image/jpeg"
          },
          {
            "@category": "standard",
            "@height": "417",
            "@width": "489",
            "@_fa": "true",
            "$": "https://api.elsevier.com/content/object/eid/1-s2.0-S246882312300007X-gr11.jpg?httpAccept=%2A%2F%2A",
            "@multimediatype": "JPEG image file",
            "@type": "IMAGE-DOWNSAMPLED",
            "@size": "48926",
            "@ref": "gr11",
            "@mimetype": "image/jpeg"
          },
          {
            "@category": "standard",
            "@height": "124",
            "@width": "301",
            "@_fa": "true",
            "$": "https://api.elsevier.com/content/object/eid/1-s2.0-S246882312300007X-ga1.jpg?httpAccept=%2A%2F%2A",
            "@multimediatype": "JPEG image file",
            "@type": "IMAGE-DOWNSAMPLED",
            "@size": "21325",
            "@ref": "ga1",
            "@mimetype": "image/jpeg"
          },
          {
            "@category": "thumbnail",
            "@height": "163",
            "@width": "95",
            "@_fa": "true",
            "$": "https://api.elsevier.com/content/object/eid/1-s2.0-S246882312300007X-gr1.sml?httpAccept=%2A%2F%2A",
            "@multimediatype": "GIF image file",
            "@type": "IMAGE-THUMBNAIL",
            "@size": "8210",
            "@ref": "gr1",
            "@mimetype": "image/gif"
          },
          {
            "@category": "thumbnail",
            "@height": "163",
            "@width": "104",
            "@_fa": "true",
            "$": "https://api.elsevier.com/content/object/eid/1-s2.0-S246882312300007X-gr2.sml?httpAccept=%2A%2F%2A",
            "@multimediatype": "GIF image file",
            "@type": "IMAGE-THUMBNAIL",
            "@size": "9444",
            "@ref": "gr2",
            "@mimetype": "image/gif"
          },
          {
            "@category": "thumbnail",
            "@height": "164",
            "@width": "142",
            "@_fa": "true",
            "$": "https://api.elsevier.com/content/object/eid/1-s2.0-S246882312300007X-gr3.sml?httpAccept=%2A%2F%2A",
            "@multimediatype": "GIF image file",
            "@type": "IMAGE-THUMBNAIL",
            "@size": "19028",
            "@ref": "gr3",
            "@mimetype": "image/gif"
          },
          {
            "@category": "thumbnail",
            "@height": "164",
            "@width": "194",
            "@_fa": "true",
            "$": "https://api.elsevier.com/content/object/eid/1-s2.0-S246882312300007X-gr4.sml?httpAccept=%2A%2F%2A",
            "@multimediatype": "GIF image file",
            "@type": "IMAGE-THUMBNAIL",
            "@size": "11061",
            "@ref": "gr4",
            "@mimetype": "image/gif"
          },
          {
            "@category": "thumbnail",
            "@height": "164",
            "@width": "192",
            "@_fa": "true",
            "$": "https://api.elsevier.com/content/object/eid/1-s2.0-S246882312300007X-gr10.sml?httpAccept=%2A%2F%2A",
            "@multimediatype": "GIF image file",
            "@type": "IMAGE-THUMBNAIL",
            "@size": "10583",
            "@ref": "gr10",
            "@mimetype": "image/gif"
          },
          {
            "@category": "thumbnail",
            "@height": "164",
            "@width": "191",
            "@_fa": "true",
            "$": "https://api.elsevier.com/content/object/eid/1-s2.0-S246882312300007X-gr5.sml?httpAccept=%2A%2F%2A",
            "@multimediatype": "GIF image file",
            "@type": "IMAGE-THUMBNAIL",
            "@size": "10535",
            "@ref": "gr5",
            "@mimetype": "image/gif"
          },
          {
            "@category": "thumbnail",
            "@height": "164",
            "@width": "187",
            "@_fa": "true",
            "$": "https://api.elsevier.com/content/object/eid/1-s2.0-S246882312300007X-gr6.sml?httpAccept=%2A%2F%2A",
            "@multimediatype": "GIF image file",
            "@type": "IMAGE-THUMBNAIL",
            "@size": "9299",
            "@ref": "gr6",
            "@mimetype": "image/gif"
          },
          {
            "@category": "thumbnail",
            "@height": "163",
            "@width": "191",
            "@_fa": "true",
            "$": "https://api.elsevier.com/content/object/eid/1-s2.0-S246882312300007X-gr7.sml?httpAccept=%2A%2F%2A",
            "@multimediatype": "GIF image file",
            "@type": "IMAGE-THUMBNAIL",
            "@size": "8936",
            "@ref": "gr7",
            "@mimetype": "image/gif"
          },
          {
            "@category": "thumbnail",
            "@height": "80",
            "@width": "219",
            "@_fa": "true",
            "$": "https://api.elsevier.com/content/object/eid/1-s2.0-S246882312300007X-gr8.sml?httpAccept=%2A%2F%2A",
            "@multimediatype": "GIF image file",
            "@type": "IMAGE-THUMBNAIL",
            "@size": "9719",
            "@ref": "gr8",
            "@mimetype": "image/gif"
          },
          {
            "@category": "thumbnail",
            "@height": "97",
            "@width": "219",
            "@_fa": "true",
            "$": "https://api.elsevier.com/content/object/eid/1-s2.0-S246882312300007X-gr14.sml?httpAccept=%2A%2F%2A",
            "@multimediatype": "GIF image file",
            "@type": "IMAGE-THUMBNAIL",
            "@size": "7744",
            "@ref": "gr14",
            "@mimetype": "image/gif"
          },
          {
            "@category": "thumbnail",
            "@height": "164",
            "@width": "190",
            "@_fa": "true",
            "$": "https://api.elsevier.com/content/object/eid/1-s2.0-S246882312300007X-gr9.sml?httpAccept=%2A%2F%2A",
            "@multimediatype": "GIF image file",
            "@type": "IMAGE-THUMBNAIL",
            "@size": "11153",
            "@ref": "gr9",
            "@mimetype": "image/gif"
          },
          {
            "@category": "thumbnail",
            "@height": "164",
            "@width": "186",
            "@_fa": "true",
            "$": "https://api.elsevier.com/content/object/eid/1-s2.0-S246882312300007X-gr13.sml?httpAccept=%2A%2F%2A",
            "@multimediatype": "GIF image file",
            "@type": "IMAGE-THUMBNAIL",
            "@size": "7372",
            "@ref": "gr13",
            "@mimetype": "image/gif"
          },
          {
            "@category": "thumbnail",
            "@height": "164",
            "@width": "192",
            "@_fa": "true",
            "$": "https://api.elsevier.com/content/object/eid/1-s2.0-S246882312300007X-gr12.sml?httpAccept=%2A%2F%2A",
            "@multimediatype": "GIF image file",
            "@type": "IMAGE-THUMBNAIL",
            "@size": "10089",
            "@ref": "gr12",
            "@mimetype": "image/gif"
          },
          {
            "@category": "thumbnail",
            "@height": "164",
            "@width": "192",
            "@_fa": "true",
            "$": "https://api.elsevier.com/content/object/eid/1-s2.0-S246882312300007X-gr11.sml?httpAccept=%2A%2F%2A",
            "@multimediatype": "GIF image file",
            "@type": "IMAGE-THUMBNAIL",
            "@size": "9937",
            "@ref": "gr11",
            "@mimetype": "image/gif"
          },
          {
            "@category": "thumbnail",
            "@height": "90",
            "@width": "219",
            "@_fa": "true",
            "$": "https://api.elsevier.com/content/object/eid/1-s2.0-S246882312300007X-ga1.sml?httpAccept=%2A%2F%2A",
            "@multimediatype": "GIF image file",
            "@type": "IMAGE-THUMBNAIL",
            "@size": "10906",
            "@ref": "ga1",
            "@mimetype": "image/gif"
          },
          {
            "@category": "high",
            "@height": "4302",
            "@width": "2500",
            "@_fa": "true",
            "$": "https://api.elsevier.com/content/object/eid/1-s2.0-S246882312300007X-gr1_lrg.jpg?httpAccept=%2A%2F%2A",
            "@multimediatype": "JPEG image file",
            "@type": "IMAGE-HIGH-RES",
            "@size": "1192768",
            "@ref": "gr1",
            "@mimetype": "image/jpeg"
          },
          {
            "@category": "high",
            "@height": "4167",
            "@width": "2662",
            "@_fa": "true",
            "$": "https://api.elsevier.com/content/object/eid/1-s2.0-S246882312300007X-gr2_lrg.jpg?httpAccept=%2A%2F%2A",
            "@multimediatype": "JPEG image file",
            "@type": "IMAGE-HIGH-RES",
            "@size": "1371651",
            "@ref": "gr2",
            "@mimetype": "image/jpeg"
          },
          {
            "@category": "high",
            "@height": "3367",
            "@width": "2917",
            "@_fa": "true",
            "$": "https://api.elsevier.com/content/object/eid/1-s2.0-S246882312300007X-gr3_lrg.jpg?httpAccept=%2A%2F%2A",
            "@multimediatype": "JPEG image file",
            "@type": "IMAGE-HIGH-RES",
            "@size": "1357460",
            "@ref": "gr3",
            "@mimetype": "image/jpeg"
          },
          {
            "@category": "high",
            "@height": "1832",
            "@width": "2167",
            "@_fa": "true",
            "$": "https://api.elsevier.com/content/object/eid/1-s2.0-S246882312300007X-gr4_lrg.jpg?httpAccept=%2A%2F%2A",
            "@multimediatype": "JPEG image file",
            "@type": "IMAGE-HIGH-RES",
            "@size": "445762",
            "@ref": "gr4",
            "@mimetype": "image/jpeg"
          },
          {
            "@category": "high",
            "@height": "1850",
            "@width": "2167",
            "@_fa": "true",
            "$": "https://api.elsevier.com/content/object/eid/1-s2.0-S246882312300007X-gr10_lrg.jpg?httpAccept=%2A%2F%2A",
            "@multimediatype": "JPEG image file",
            "@type": "IMAGE-HIGH-RES",
            "@size": "458410",
            "@ref": "gr10",
            "@mimetype": "image/jpeg"
          },
          {
            "@category": "high",
            "@height": "1855",
            "@width": "2167",
            "@_fa": "true",
            "$": "https://api.elsevier.com/content/object/eid/1-s2.0-S246882312300007X-gr5_lrg.jpg?httpAccept=%2A%2F%2A",
            "@multimediatype": "JPEG image file",
            "@type": "IMAGE-HIGH-RES",
            "@size": "411347",
            "@ref": "gr5",
            "@mimetype": "image/jpeg"
          },
          {
            "@category": "high",
            "@height": "1900",
            "@width": "2167",
            "@_fa": "true",
            "$": "https://api.elsevier.com/content/object/eid/1-s2.0-S246882312300007X-gr6_lrg.jpg?httpAccept=%2A%2F%2A",
            "@multimediatype": "JPEG image file",
            "@type": "IMAGE-HIGH-RES",
            "@size": "341530",
            "@ref": "gr6",
            "@mimetype": "image/jpeg"
          },
          {
            "@category": "high",
            "@height": "1854",
            "@width": "2167",
            "@_fa": "true",
            "$": "https://api.elsevier.com/content/object/eid/1-s2.0-S246882312300007X-gr7_lrg.jpg?httpAccept=%2A%2F%2A",
            "@multimediatype": "JPEG image file",
            "@type": "IMAGE-HIGH-RES",
            "@size": "312219",
            "@ref": "gr7",
            "@mimetype": "image/jpeg"
          },
          {
            "@category": "high",
            "@height": "1070",
            "@width": "2917",
            "@_fa": "true",
            "$": "https://api.elsevier.com/content/object/eid/1-s2.0-S246882312300007X-gr8_lrg.jpg?httpAccept=%2A%2F%2A",
            "@multimediatype": "JPEG image file",
            "@type": "IMAGE-HIGH-RES",
            "@size": "415149",
            "@ref": "gr8",
            "@mimetype": "image/jpeg"
          },
          {
            "@category": "high",
            "@height": "1297",
            "@width": "2917",
            "@_fa": "true",
            "$": "https://api.elsevier.com/content/object/eid/1-s2.0-S246882312300007X-gr14_lrg.jpg?httpAccept=%2A%2F%2A",
            "@multimediatype": "JPEG image file",
            "@type": "IMAGE-HIGH-RES",
            "@size": "308979",
            "@ref": "gr14",
            "@mimetype": "image/jpeg"
          },
          {
            "@category": "high",
            "@height": "1866",
            "@width": "2167",
            "@_fa": "true",
            "$": "https://api.elsevier.com/content/object/eid/1-s2.0-S246882312300007X-gr9_lrg.jpg?httpAccept=%2A%2F%2A",
            "@multimediatype": "JPEG image file",
            "@type": "IMAGE-HIGH-RES",
            "@size": "434625",
            "@ref": "gr9",
            "@mimetype": "image/jpeg"
          },
          {
            "@category": "high",
            "@height": "1907",
            "@width": "2167",
            "@_fa": "true",
            "$": "https://api.elsevier.com/content/object/eid/1-s2.0-S246882312300007X-gr13_lrg.jpg?httpAccept=%2A%2F%2A",
            "@multimediatype": "JPEG image file",
            "@type": "IMAGE-HIGH-RES",
            "@size": "234299",
            "@ref": "gr13",
            "@mimetype": "image/jpeg"
          },
          {
            "@category": "high",
            "@height": "1850",
            "@width": "2167",
            "@_fa": "true",
            "$": "https://api.elsevier.com/content/object/eid/1-s2.0-S246882312300007X-gr12_lrg.jpg?httpAccept=%2A%2F%2A",
            "@multimediatype": "JPEG image file",
            "@type": "IMAGE-HIGH-RES",
            "@size": "398766",
            "@ref": "gr12",
            "@mimetype": "image/jpeg"
          },
          {
            "@category": "high",
            "@height": "1850",
            "@width": "2167",
            "@_fa": "true",
            "$": "https://api.elsevier.com/content/object/eid/1-s2.0-S246882312300007X-gr11_lrg.jpg?httpAccept=%2A%2F%2A",
            "@multimediatype": "JPEG image file",
            "@type": "IMAGE-HIGH-RES",
            "@size": "401419",
            "@ref": "gr11",
            "@mimetype": "image/jpeg"
          },
          {
            "@category": "high",
            "@height": "548",
            "@width": "1333",
            "@_fa": "true",
            "$": "https://api.elsevier.com/content/object/eid/1-s2.0-S246882312300007X-ga1_lrg.jpg?httpAccept=%2A%2F%2A",
            "@multimediatype": "JPEG image file",
            "@type": "IMAGE-HIGH-RES",
            "@size": "171057",
            "@ref": "ga1",
            "@mimetype": "image/jpeg"
          },
          {
            "@category": "standard",
            "@_fa": "true",
            "$": "https://api.elsevier.com/content/object/eid/1-s2.0-S246882312300007X-mmc1.docx?httpAccept=%2A%2F%2A",
            "@multimediatype": "Microsoft Word file",
            "@type": "APPLICATION",
            "@size": "2676875",
            "@ref": "mmc1",
            "@mimetype": "application/word"
          },
          {
            "@category": "thumbnail",
            "@_fa": "true",
            "$": "https://api.elsevier.com/content/object/eid/1-s2.0-S246882312300007X-si1.svg?httpAccept=%2A%2F%2A",
            "@multimediatype": "Scalable Vector Graphics file",
            "@type": "ALTIMG",
            "@size": "9185",
            "@ref": "si1",
            "@mimetype": "image/svg+xml"
          },
          {
            "@category": "thumbnail",
            "@_fa": "true",
            "$": "https://api.elsevier.com/content/object/eid/1-s2.0-S246882312300007X-si10.svg?httpAccept=%2A%2F%2A",
            "@multimediatype": "Scalable Vector Graphics file",
            "@type": "ALTIMG",
            "@size": "4640",
            "@ref": "si10",
            "@mimetype": "image/svg+xml"
          },
          {
            "@category": "thumbnail",
            "@_fa": "true",
            "$": "https://api.elsevier.com/content/object/eid/1-s2.0-S246882312300007X-si11.svg?httpAccept=%2A%2F%2A",
            "@multimediatype": "Scalable Vector Graphics file",
            "@type": "ALTIMG",
            "@size": "4844",
            "@ref": "si11",
            "@mimetype": "image/svg+xml"
          },
          {
            "@category": "thumbnail",
            "@_fa": "true",
            "$": "https://api.elsevier.com/content/object/eid/1-s2.0-S246882312300007X-si2.svg?httpAccept=%2A%2F%2A",
            "@multimediatype": "Scalable Vector Graphics file",
            "@type": "ALTIMG",
            "@size": "2351",
            "@ref": "si2",
            "@mimetype": "image/svg+xml"
          },
          {
            "@category": "thumbnail",
            "@_fa": "true",
            "$": "https://api.elsevier.com/content/object/eid/1-s2.0-S246882312300007X-si3.svg?httpAccept=%2A%2F%2A",
            "@multimediatype": "Scalable Vector Graphics file",
            "@type": "ALTIMG",
            "@size": "2768",
            "@ref": "si3",
            "@mimetype": "image/svg+xml"
          },
          {
            "@category": "thumbnail",
            "@_fa": "true",
            "$": "https://api.elsevier.com/content/object/eid/1-s2.0-S246882312300007X-si4.svg?httpAccept=%2A%2F%2A",
            "@multimediatype": "Scalable Vector Graphics file",
            "@type": "ALTIMG",
            "@size": "5979",
            "@ref": "si4",
            "@mimetype": "image/svg+xml"
          },
          {
            "@category": "thumbnail",
            "@_fa": "true",
            "$": "https://api.elsevier.com/content/object/eid/1-s2.0-S246882312300007X-si5.svg?httpAccept=%2A%2F%2A",
            "@multimediatype": "Scalable Vector Graphics file",
            "@type": "ALTIMG",
            "@size": "5876",
            "@ref": "si5",
            "@mimetype": "image/svg+xml"
          },
          {
            "@category": "thumbnail",
            "@_fa": "true",
            "$": "https://api.elsevier.com/content/object/eid/1-s2.0-S246882312300007X-si6.svg?httpAccept=%2A%2F%2A",
            "@multimediatype": "Scalable Vector Graphics file",
            "@type": "ALTIMG",
            "@size": "6115",
            "@ref": "si6",
            "@mimetype": "image/svg+xml"
          },
          {
            "@category": "thumbnail",
            "@_fa": "true",
            "$": "https://api.elsevier.com/content/object/eid/1-s2.0-S246882312300007X-si7.svg?httpAccept=%2A%2F%2A",
            "@multimediatype": "Scalable Vector Graphics file",
            "@type": "ALTIMG",
            "@size": "4706",
            "@ref": "si7",
            "@mimetype": "image/svg+xml"
          },
          {
            "@category": "thumbnail",
            "@_fa": "true",
            "$": "https://api.elsevier.com/content/object/eid/1-s2.0-S246882312300007X-si8.svg?httpAccept=%2A%2F%2A",
            "@multimediatype": "Scalable Vector Graphics file",
            "@type": "ALTIMG",
            "@size": "3772",
            "@ref": "si8",
            "@mimetype": "image/svg+xml"
          },
          {
            "@category": "thumbnail",
            "@_fa": "true",
            "$": "https://api.elsevier.com/content/object/eid/1-s2.0-S246882312300007X-si9.svg?httpAccept=%2A%2F%2A",
            "@multimediatype": "Scalable Vector Graphics file",
            "@type": "ALTIMG",
            "@size": "3873",
            "@ref": "si9",
            "@mimetype": "image/svg+xml"
          },
          {
            "@category": "standard",
            "@_fa": "true",
            "$": "https://api.elsevier.com/content/object/eid/1-s2.0-S246882312300007X-am.pdf?httpAccept=%2A%2F%2A",
            "@multimediatype": "Acrobat PDF file",
            "@type": "AAM-PDF",
            "@size": "5498070",
            "@ref": "am",
            "@mimetype": "application/pdf"
          }
        ]
      },
      "link": {
        "@rel": "abstract",
        "@href": "https://api.elsevier.com/content/abstract/scopus_id/85146259007"
      }
    }
  }
}