{
  "metadata": {
    "title": "Co<ce:sup loc=post>2+</ce:sup> immobilized on highly ordered mesoporous graphitic carbon nitride (ompg-C<ce:inf loc=post>3</ce:inf>N<ce:inf loc=post>4</ce:inf>/Co<ce:sup loc=post>2+</ce:sup>) as an efficient and recyclable heterogeneous catalyst for one-pot tandem selective photo-oxidation/Knoevenagel condensation",
    "authors": "; ; ",
    "journal": "Molecular Catalysis",
    "date": "2019-10-31",
    "doi": "10.1016/j.mcat.2019.110491",
    "abstract": "",
    "uri": "https://api.elsevier.com/content/article/pii/S2468823119303268",
    "pii": "S2468823119303268"
  },
  "fulltext": {
    "full-text-retrieval-response": {
      "scopus-eid": "2-s2.0-85068224407",
      "originalText": "serial JL 315758 291210 291744 291790 291809 31 Molecular Catalysis MOLECULARCATALYSIS 2019-07-03 2019-07-03 2019-07-03 2019-07-03 2019-08-06T07:55:47 1-s2.0-S2468823119303268 S2468-8231(19)30326-8 S2468823119303268 10.1016/j.mcat.2019.110491 S300 S300.1 FULL-TEXT 1-s2.0-S2468823119X00115 2020-07-20T16:18:29.877933Z 0 0 20191001 20191031 2019 2019-07-03T21:25:11.173384Z absattachment articleinfo articlenumber articletitlenorm authfirstinitialnorm authfirstsurnamenorm cid cids contenttype copyright crossmark dateloaded dateloadedtxt datesearch datesort dateupdated dco docsubtype doctype doi eid ewtransactionid hubeid indexeddate issn issnnorm itemstage itemtransactionid itemweight openaccess openarchive pg pgfirst pii piinorm pubdateend pubdatestart pubdatetxt pubyr sectiontitle sortorder srctitle srctitlenorm srctype ssids alllist content subj subheadings suppl tomb volfirst volissue volumelist webpdf webpdfpagecount yearnav figure table e-component body acknowledge affil appendices articletitle auth authfirstini authfull authkeywords authlast grantsponsor highlightsabst orcid primabst ref specialabst 2468-8231 24688231 true 475 475 C Volume 475 29 110491 110491 110491 201910 October 2019 2019-10-01 2019-10-31 2019 Regular Papers article fla © 2019 Elsevier B.V. All rights reserved. CO2IMMOBILIZEDHIGHLYORDEREDMESOPOROUSGRAPHITICCARBONNITRIDEOMPGC3N4CO2EFFICIENTRECYCLABLEHETEROGENEOUSCATALYSTFORONEPOTTANDEMSELECTIVEPHOTOOXIDATIONKNOEVENAGELCONDENSATION GHAFURI H 1 Introduction 2 Experimental 2.1 Materials and devices 2.2 Preparation of SBA-15 ordered mesostructured silica 2.3 Preparation of highly ordered mesoporous graphitic carbon nitride (ompg-C3N4) 2.4 Preparation of ompg-C3N4/Co2+ 2.5 General procedure for one-pot tandem photo-oxidation/Knoevenagel condensation 3 Results and discussion 3.1 Catalyst characterizations 3.2 Catalytic properties 4 Conclusion Acknowledgement Appendix A Supplementary data References ONG 2016 7159 7329 W ZHU 2014 16449 16465 J TAHIR 2013 13949 13955 M ZHENG 2012 6717 6731 Y HONG 2016 663 673 Y CHEN 2009 11658 11659 X WANG 2015 44 52 K YE 2015 15 27 S SADJADI 2018 25 34 S ZHU 2015 16850 16856 Y YAN 2010 3894 3901 S HUMAYUN 2018 139 147 M GE 2011 215 222 L YUAN 2018 129 138 X IQBAL 2019 13 21 W YANG 2017 333 340 H HIRASHITA 2016 2704 2709 T SAHLEDEMESSIE 2000 4858 4864 E LITTLER 1971 81 91 J ZIARATI 2019 72 78 A ZIARATI 2018 8962 8968 A ZIARATI 2019 5903 5910 A ZIARATI 2018 177 183 A SU 2010 16299 16301 F ZHANG 2014 84 92 L HANGARGE 2002 266 268 R YANG 2014 198 205 Y TUCI 2016 30099 30106 G SUN 2015 86082 86087 Y ELHAMIFAR 2016 4318 4326 D HUANG 2015 1000 1007 J RANA 2017 31 34 S RAO 1991 5821 5822 P PULLABHOTLA 2009 365 369 V VISWANADHAM 2016 364 372 B MIAO 2016 13917 13924 Z WANG 2015 1623 1628 D YANG 2018 4199 4212 Q ZOHREH 2017 342 350 N GHAFURI 2016 16046 16054 H GHAFURI 2017 6462 6467 H ZAND 2018 8229 8237 H GHAFURI 2016 2970 2982 H GHAFURI 2016 62916 62922 H GHAFURI 2019 646 653 H FARD 2019 83 93 M ZHAO 2014 3151 3161 Z LIU 2016 59 68 J WANG 2019 954 962 L LIU 2013 3821 3828 Q LI 2007 13109 13116 X ZHANG 2015 941 947 G ZHANG 2017 53861 53870 Q ZHAO 2014 1141 1144 X HAJJAMI 2015 1852 1860 M MALEKI 2018 e3905 R CURINI 2002 355 362 M ROSTAMI 2013 69 74 A SHIRINI 2016 110190 110205 F IVONIN 2017 2477 2480 M YAN 2018 789 806 H WANG 2016 6685 6691 J GHAFURIX2019X110491 GHAFURIX2019X110491XH 2021-07-03T00:00:00.000Z 2021-07-03T00:00:00.000Z http://creativecommons.org/licenses/by-nc-nd/4.0/ © 2019 Elsevier B.V. All rights reserved. 2019-07-05T21:27:32.231Z http://vtw.elsevier.com/data/voc/AddOnTypes/50.7/nlp S2468823119303268 the Research Council TRC The Research Council http://data.elsevier.com/vocabulary/SciValFunders/501100004787 http://sws.geonames.org/286963/ Iran University of Science and Technology IUST Iran University of Science and Technology http://data.elsevier.com/vocabulary/SciValFunders/501100006766 http://sws.geonames.org/130758/ The authors gratefully acknowledge the partial support from the Research Council of the Iran University of Science and Technology . Appendix A item S2468-8231(19)30326-8 S2468823119303268 1-s2.0-S2468823119303268 10.1016/j.mcat.2019.110491 315758 2020-07-20T16:18:29.877933Z 2019-10-01 2019-10-31 1-s2.0-S2468823119303268-main.pdf https://s3.amazonaws.com/prod-ucs-content-store-us-east/content/pii:S2468823119303268/MAIN/application/pdf/913e71557948a10ecaeb42757224e92b/main.pdf main.pdf pdf true 2647510 MAIN 10 1-s2.0-S2468823119303268-main_1.png https://s3.amazonaws.com/prod-ucs-content-store-us-east/content/pii:S2468823119303268/PREVIEW/image/png/0c9865f4d25015f6ea31c7f26fdf9fc0/main_1.png main_1.png png 58456 849 656 IMAGE-WEB-PDF 1 1-s2.0-S2468823119303268-fx1.sml https://s3.amazonaws.com/prod-ucs-content-store-us-east/content/pii:S2468823119303268/fx1/THUMBNAIL/image/gif/46792f3b5d8a9eb70b56d3f72683c1c3/fx1.sml fx1 fx1.sml sml 4399 109 219 IMAGE-THUMBNAIL 1-s2.0-S2468823119303268-fx10.sml https://s3.amazonaws.com/prod-ucs-content-store-us-east/content/pii:S2468823119303268/fx10/THUMBNAIL/image/gif/368364f69b229a36cc6ddbb767657966/fx10.sml fx10 fx10.sml sml 4868 139 219 IMAGE-THUMBNAIL 1-s2.0-S2468823119303268-fx11.sml https://s3.amazonaws.com/prod-ucs-content-store-us-east/content/pii:S2468823119303268/fx11/THUMBNAIL/image/gif/29dd17728f5c46545fb91aeed4b48148/fx11.sml fx11 fx11.sml sml 5060 164 218 IMAGE-THUMBNAIL 1-s2.0-S2468823119303268-fx12.sml https://s3.amazonaws.com/prod-ucs-content-store-us-east/content/pii:S2468823119303268/fx12/THUMBNAIL/image/gif/1c10177f02b5e712869481830b6511f1/fx12.sml fx12 fx12.sml sml 5112 139 219 IMAGE-THUMBNAIL 1-s2.0-S2468823119303268-fx13.sml https://s3.amazonaws.com/prod-ucs-content-store-us-east/content/pii:S2468823119303268/fx13/THUMBNAIL/image/gif/b53cf5bfa17f7ed7f892a3ecd745086a/fx13.sml fx13 fx13.sml sml 3446 84 219 IMAGE-THUMBNAIL 1-s2.0-S2468823119303268-fx14.sml https://s3.amazonaws.com/prod-ucs-content-store-us-east/content/pii:S2468823119303268/fx14/THUMBNAIL/image/gif/bf840a49f074fa2e3a28af06737803b9/fx14.sml fx14 fx14.sml sml 3672 81 219 IMAGE-THUMBNAIL 1-s2.0-S2468823119303268-fx15.sml https://s3.amazonaws.com/prod-ucs-content-store-us-east/content/pii:S2468823119303268/fx15/THUMBNAIL/image/gif/142772b7619814d323cb8a1da7ee7e1a/fx15.sml fx15 fx15.sml sml 3489 87 219 IMAGE-THUMBNAIL 1-s2.0-S2468823119303268-fx16.sml https://s3.amazonaws.com/prod-ucs-content-store-us-east/content/pii:S2468823119303268/fx16/THUMBNAIL/image/gif/52f2990f0b3aaf813be6486277ba211a/fx16.sml fx16 fx16.sml sml 3591 82 219 IMAGE-THUMBNAIL 1-s2.0-S2468823119303268-fx17.sml https://s3.amazonaws.com/prod-ucs-content-store-us-east/content/pii:S2468823119303268/fx17/THUMBNAIL/image/gif/63c21a1e50ff1f1529ec24357bd2bb75/fx17.sml fx17 fx17.sml sml 5346 164 219 IMAGE-THUMBNAIL 1-s2.0-S2468823119303268-fx18.sml https://s3.amazonaws.com/prod-ucs-content-store-us-east/content/pii:S2468823119303268/fx18/THUMBNAIL/image/gif/230d0d4b6a4eb827222d14d86d825d71/fx18.sml fx18 fx18.sml sml 5040 137 219 IMAGE-THUMBNAIL 1-s2.0-S2468823119303268-fx19.sml https://s3.amazonaws.com/prod-ucs-content-store-us-east/content/pii:S2468823119303268/fx19/THUMBNAIL/image/gif/608abd3e8338bbda480e6b6de2c3b00b/fx19.sml fx19 fx19.sml sml 5169 141 216 IMAGE-THUMBNAIL 1-s2.0-S2468823119303268-fx2.sml https://s3.amazonaws.com/prod-ucs-content-store-us-east/content/pii:S2468823119303268/fx2/THUMBNAIL/image/gif/9df7b3b90c5dc04034dd81b22d4387d3/fx2.sml fx2 fx2.sml sml 4296 96 219 IMAGE-THUMBNAIL 1-s2.0-S2468823119303268-fx20.sml https://s3.amazonaws.com/prod-ucs-content-store-us-east/content/pii:S2468823119303268/fx20/THUMBNAIL/image/gif/b0c505f72e390ed656777ad889547e4e/fx20.sml fx20 fx20.sml sml 4901 164 216 IMAGE-THUMBNAIL 1-s2.0-S2468823119303268-fx3.sml https://s3.amazonaws.com/prod-ucs-content-store-us-east/content/pii:S2468823119303268/fx3/THUMBNAIL/image/gif/e5e1f1c942b3e18d7945afe230802ea2/fx3.sml fx3 fx3.sml sml 3482 88 219 IMAGE-THUMBNAIL 1-s2.0-S2468823119303268-fx4.sml https://s3.amazonaws.com/prod-ucs-content-store-us-east/content/pii:S2468823119303268/fx4/THUMBNAIL/image/gif/caaa078d59ebfacc79ff134b5310a6a5/fx4.sml fx4 fx4.sml sml 3672 97 219 IMAGE-THUMBNAIL 1-s2.0-S2468823119303268-fx5.sml https://s3.amazonaws.com/prod-ucs-content-store-us-east/content/pii:S2468823119303268/fx5/THUMBNAIL/image/gif/07d94a4e19c31a26a4e0fe30b6d8005f/fx5.sml fx5 fx5.sml sml 3497 83 219 IMAGE-THUMBNAIL 1-s2.0-S2468823119303268-fx6.sml https://s3.amazonaws.com/prod-ucs-content-store-us-east/content/pii:S2468823119303268/fx6/THUMBNAIL/image/gif/3d6e107485941db9e60f2cc294043d8b/fx6.sml fx6 fx6.sml sml 3581 82 219 IMAGE-THUMBNAIL 1-s2.0-S2468823119303268-fx7.sml https://s3.amazonaws.com/prod-ucs-content-store-us-east/content/pii:S2468823119303268/fx7/THUMBNAIL/image/gif/a72f146f7cd8c3bf6d746b981efe951f/fx7.sml fx7 fx7.sml sml 3390 77 219 IMAGE-THUMBNAIL 1-s2.0-S2468823119303268-fx8.sml https://s3.amazonaws.com/prod-ucs-content-store-us-east/content/pii:S2468823119303268/fx8/THUMBNAIL/image/gif/ce611d001cb99a73236f66fd9482cf25/fx8.sml fx8 fx8.sml sml 3557 76 219 IMAGE-THUMBNAIL 1-s2.0-S2468823119303268-fx9.sml https://s3.amazonaws.com/prod-ucs-content-store-us-east/content/pii:S2468823119303268/fx9/THUMBNAIL/image/gif/e7c9f3258f95b30e34ee71c4d5b562b6/fx9.sml fx9 fx9.sml sml 4751 164 212 IMAGE-THUMBNAIL 1-s2.0-S2468823119303268-ga1.sml https://s3.amazonaws.com/prod-ucs-content-store-us-east/content/pii:S2468823119303268/ga1/THUMBNAIL/image/gif/5a5f35dcb44929f26fe8927ae1bdf116/ga1.sml ga1 true ga1.sml sml 7084 130 219 IMAGE-THUMBNAIL 1-s2.0-S2468823119303268-gr1.sml https://s3.amazonaws.com/prod-ucs-content-store-us-east/content/pii:S2468823119303268/gr1/THUMBNAIL/image/gif/5df23c8d6bea0c5c7500fbca4e59a9ef/gr1.sml gr1 gr1.sml sml 2735 151 219 IMAGE-THUMBNAIL 1-s2.0-S2468823119303268-gr10.sml https://s3.amazonaws.com/prod-ucs-content-store-us-east/content/pii:S2468823119303268/gr10/THUMBNAIL/image/gif/263a4a68bfc770f212b24640c21631ee/gr10.sml gr10 gr10.sml sml 3536 87 219 IMAGE-THUMBNAIL 1-s2.0-S2468823119303268-gr11.sml https://s3.amazonaws.com/prod-ucs-content-store-us-east/content/pii:S2468823119303268/gr11/THUMBNAIL/image/gif/63fd51410eeb3efb41d110b9ab3e2a27/gr11.sml gr11 gr11.sml sml 4539 127 219 IMAGE-THUMBNAIL 1-s2.0-S2468823119303268-gr12.sml https://s3.amazonaws.com/prod-ucs-content-store-us-east/content/pii:S2468823119303268/gr12/THUMBNAIL/image/gif/0b9dae6d123a35e30fb1422a99cde0a2/gr12.sml gr12 gr12.sml sml 4814 119 219 IMAGE-THUMBNAIL 1-s2.0-S2468823119303268-gr2.sml https://s3.amazonaws.com/prod-ucs-content-store-us-east/content/pii:S2468823119303268/gr2/THUMBNAIL/image/gif/2219b08216b6306d0469a5bd4a5e891a/gr2.sml gr2 gr2.sml sml 4925 123 219 IMAGE-THUMBNAIL 1-s2.0-S2468823119303268-gr3.sml https://s3.amazonaws.com/prod-ucs-content-store-us-east/content/pii:S2468823119303268/gr3/THUMBNAIL/image/gif/4998d9e579a253e7ebf4c63a1ffd79ed/gr3.sml gr3 gr3.sml sml 3742 122 219 IMAGE-THUMBNAIL 1-s2.0-S2468823119303268-gr4.sml https://s3.amazonaws.com/prod-ucs-content-store-us-east/content/pii:S2468823119303268/gr4/THUMBNAIL/image/gif/80519afeda0d45beeef4eafe4667aef1/gr4.sml gr4 gr4.sml sml 3941 151 219 IMAGE-THUMBNAIL 1-s2.0-S2468823119303268-gr5.sml https://s3.amazonaws.com/prod-ucs-content-store-us-east/content/pii:S2468823119303268/gr5/THUMBNAIL/image/gif/8b6eb87312e6cd36ed823f32ddd7a394/gr5.sml gr5 gr5.sml sml 5708 125 219 IMAGE-THUMBNAIL 1-s2.0-S2468823119303268-gr6.sml https://s3.amazonaws.com/prod-ucs-content-store-us-east/content/pii:S2468823119303268/gr6/THUMBNAIL/image/gif/04c615491dd9b6cbc3894665aeee5c3c/gr6.sml gr6 gr6.sml sml 3744 108 219 IMAGE-THUMBNAIL 1-s2.0-S2468823119303268-gr7.sml https://s3.amazonaws.com/prod-ucs-content-store-us-east/content/pii:S2468823119303268/gr7/THUMBNAIL/image/gif/9af14eb7af9bf1b11af97380f71593b5/gr7.sml gr7 gr7.sml sml 2845 163 144 IMAGE-THUMBNAIL 1-s2.0-S2468823119303268-gr8.sml https://s3.amazonaws.com/prod-ucs-content-store-us-east/content/pii:S2468823119303268/gr8/THUMBNAIL/image/gif/5be0c4ad8a9fe29df22506399867495d/gr8.sml gr8 gr8.sml sml 10938 164 174 IMAGE-THUMBNAIL 1-s2.0-S2468823119303268-gr9.sml https://s3.amazonaws.com/prod-ucs-content-store-us-east/content/pii:S2468823119303268/gr9/THUMBNAIL/image/gif/cc74f9f778339c889e9004ea32c322ab/gr9.sml gr9 gr9.sml sml 7719 164 188 IMAGE-THUMBNAIL 1-s2.0-S2468823119303268-sc1.sml https://s3.amazonaws.com/prod-ucs-content-store-us-east/content/pii:S2468823119303268/sc1/THUMBNAIL/image/gif/fc8999ded95717b5fe7e85b641885dba/sc1.sml sc1 sc1.sml sml 1642 34 219 IMAGE-THUMBNAIL 1-s2.0-S2468823119303268-sc2.sml https://s3.amazonaws.com/prod-ucs-content-store-us-east/content/pii:S2468823119303268/sc2/THUMBNAIL/image/gif/c3186ded54c93f66355ba552c286653b/sc2.sml sc2 sc2.sml sml 3983 103 219 IMAGE-THUMBNAIL 1-s2.0-S2468823119303268-fx1.jpg https://s3.amazonaws.com/prod-ucs-content-store-us-east/content/pii:S2468823119303268/fx1/DOWNSAMPLED/image/jpeg/cca23bae999e984f15b005caee00f66d/fx1.jpg fx1 fx1.jpg jpg 1144 29 59 IMAGE-DOWNSAMPLED 1-s2.0-S2468823119303268-fx10.jpg https://s3.amazonaws.com/prod-ucs-content-store-us-east/content/pii:S2468823119303268/fx10/DOWNSAMPLED/image/jpeg/1b6991c7388b9584c678ecc4f008f427/fx10.jpg fx10 fx10.jpg jpg 1547 45 70 IMAGE-DOWNSAMPLED 1-s2.0-S2468823119303268-fx11.jpg https://s3.amazonaws.com/prod-ucs-content-store-us-east/content/pii:S2468823119303268/fx11/DOWNSAMPLED/image/jpeg/fc2c700d77836ee20c7961d9b2cbb00c/fx11.jpg fx11 fx11.jpg jpg 1264 47 63 IMAGE-DOWNSAMPLED 1-s2.0-S2468823119303268-fx12.jpg https://s3.amazonaws.com/prod-ucs-content-store-us-east/content/pii:S2468823119303268/fx12/DOWNSAMPLED/image/jpeg/65259aa1594482adde8d08f31d0d7298/fx12.jpg fx12 fx12.jpg jpg 1574 46 73 IMAGE-DOWNSAMPLED 1-s2.0-S2468823119303268-fx13.jpg https://s3.amazonaws.com/prod-ucs-content-store-us-east/content/pii:S2468823119303268/fx13/DOWNSAMPLED/image/jpeg/cd2de5d3582f722b69ff85223b87403f/fx13.jpg fx13 fx13.jpg jpg 1395 33 86 IMAGE-DOWNSAMPLED 1-s2.0-S2468823119303268-fx14.jpg https://s3.amazonaws.com/prod-ucs-content-store-us-east/content/pii:S2468823119303268/fx14/DOWNSAMPLED/image/jpeg/6a3096f6549fee29fce81deab9541fea/fx14.jpg fx14 fx14.jpg jpg 1673 34 93 IMAGE-DOWNSAMPLED 1-s2.0-S2468823119303268-fx15.jpg https://s3.amazonaws.com/prod-ucs-content-store-us-east/content/pii:S2468823119303268/fx15/DOWNSAMPLED/image/jpeg/9526a9fc8ed4ff3951d62a2e766d015d/fx15.jpg fx15 fx15.jpg jpg 1361 33 83 IMAGE-DOWNSAMPLED 1-s2.0-S2468823119303268-fx16.jpg https://s3.amazonaws.com/prod-ucs-content-store-us-east/content/pii:S2468823119303268/fx16/DOWNSAMPLED/image/jpeg/ce34c24e2a70e33d357401fc72341b94/fx16.jpg fx16 fx16.jpg jpg 1693 36 96 IMAGE-DOWNSAMPLED 1-s2.0-S2468823119303268-fx17.jpg https://s3.amazonaws.com/prod-ucs-content-store-us-east/content/pii:S2468823119303268/fx17/DOWNSAMPLED/image/jpeg/44184584f82dd7160003ae79a874013c/fx17.jpg fx17 fx17.jpg jpg 1351 47 63 IMAGE-DOWNSAMPLED 1-s2.0-S2468823119303268-fx18.jpg https://s3.amazonaws.com/prod-ucs-content-store-us-east/content/pii:S2468823119303268/fx18/DOWNSAMPLED/image/jpeg/30d8c8ed85f4827ad8ca3425cee4a6fe/fx18.jpg fx18 fx18.jpg jpg 1741 47 75 IMAGE-DOWNSAMPLED 1-s2.0-S2468823119303268-fx19.jpg https://s3.amazonaws.com/prod-ucs-content-store-us-east/content/pii:S2468823119303268/fx19/DOWNSAMPLED/image/jpeg/64458dcf84583991f12745825f64cb99/fx19.jpg fx19 fx19.jpg jpg 895 31 48 IMAGE-DOWNSAMPLED 1-s2.0-S2468823119303268-fx2.jpg https://s3.amazonaws.com/prod-ucs-content-store-us-east/content/pii:S2468823119303268/fx2/DOWNSAMPLED/image/jpeg/6efd431b908c73663e674442165021dd/fx2.jpg fx2 fx2.jpg jpg 1433 33 74 IMAGE-DOWNSAMPLED 1-s2.0-S2468823119303268-fx20.jpg https://s3.amazonaws.com/prod-ucs-content-store-us-east/content/pii:S2468823119303268/fx20/DOWNSAMPLED/image/jpeg/7ffbd9a57053cebd37896d61025bfb79/fx20.jpg fx20 fx20.jpg jpg 1137 42 55 IMAGE-DOWNSAMPLED 1-s2.0-S2468823119303268-fx3.jpg https://s3.amazonaws.com/prod-ucs-content-store-us-east/content/pii:S2468823119303268/fx3/DOWNSAMPLED/image/jpeg/a49a4a1b777323ec20c8ca80954e1fb6/fx3.jpg fx3 fx3.jpg jpg 1380 33 83 IMAGE-DOWNSAMPLED 1-s2.0-S2468823119303268-fx4.jpg https://s3.amazonaws.com/prod-ucs-content-store-us-east/content/pii:S2468823119303268/fx4/DOWNSAMPLED/image/jpeg/f5e89953143cd2b25adbbf11c3c48500/fx4.jpg fx4 fx4.jpg jpg 1526 40 91 IMAGE-DOWNSAMPLED 1-s2.0-S2468823119303268-fx5.jpg https://s3.amazonaws.com/prod-ucs-content-store-us-east/content/pii:S2468823119303268/fx5/DOWNSAMPLED/image/jpeg/6a87f2f3ce823d2e00f6d14671db592a/fx5.jpg fx5 fx5.jpg jpg 1257 31 81 IMAGE-DOWNSAMPLED 1-s2.0-S2468823119303268-fx6.jpg https://s3.amazonaws.com/prod-ucs-content-store-us-east/content/pii:S2468823119303268/fx6/DOWNSAMPLED/image/jpeg/4002743e5067f9185ea89d91f3869343/fx6.jpg fx6 fx6.jpg jpg 1685 35 93 IMAGE-DOWNSAMPLED 1-s2.0-S2468823119303268-fx7.jpg https://s3.amazonaws.com/prod-ucs-content-store-us-east/content/pii:S2468823119303268/fx7/DOWNSAMPLED/image/jpeg/69bbd6a8677d1303811d753dcff44187/fx7.jpg fx7 fx7.jpg jpg 1381 32 91 IMAGE-DOWNSAMPLED 1-s2.0-S2468823119303268-fx8.jpg https://s3.amazonaws.com/prod-ucs-content-store-us-east/content/pii:S2468823119303268/fx8/DOWNSAMPLED/image/jpeg/e6b685639f74975b96c5d56e379cfb87/fx8.jpg fx8 fx8.jpg jpg 1752 35 101 IMAGE-DOWNSAMPLED 1-s2.0-S2468823119303268-fx9.jpg https://s3.amazonaws.com/prod-ucs-content-store-us-east/content/pii:S2468823119303268/fx9/DOWNSAMPLED/image/jpeg/6f957df71d183ac8b5f567e876045fd0/fx9.jpg fx9 fx9.jpg jpg 1259 48 62 IMAGE-DOWNSAMPLED 1-s2.0-S2468823119303268-ga1.jpg https://s3.amazonaws.com/prod-ucs-content-store-us-east/content/pii:S2468823119303268/ga1/DOWNSAMPLED/image/jpeg/90549159376900f645d597ec016a1fb2/ga1.jpg ga1 true ga1.jpg jpg 15772 200 336 IMAGE-DOWNSAMPLED 1-s2.0-S2468823119303268-gr1.jpg https://s3.amazonaws.com/prod-ucs-content-store-us-east/content/pii:S2468823119303268/gr1/DOWNSAMPLED/image/jpeg/91100ea94b4c5274b5527cecd5185c73/gr1.jpg gr1 gr1.jpg jpg 9417 262 379 IMAGE-DOWNSAMPLED 1-s2.0-S2468823119303268-gr10.jpg https://s3.amazonaws.com/prod-ucs-content-store-us-east/content/pii:S2468823119303268/gr10/DOWNSAMPLED/image/jpeg/55e659615d6174fcf312581ccf91e92f/gr10.jpg gr10 gr10.jpg jpg 16822 224 567 IMAGE-DOWNSAMPLED 1-s2.0-S2468823119303268-gr11.jpg https://s3.amazonaws.com/prod-ucs-content-store-us-east/content/pii:S2468823119303268/gr11/DOWNSAMPLED/image/jpeg/868380477fd1a9f27db83432a184a766/gr11.jpg gr11 gr11.jpg jpg 11718 220 379 IMAGE-DOWNSAMPLED 1-s2.0-S2468823119303268-gr12.jpg https://s3.amazonaws.com/prod-ucs-content-store-us-east/content/pii:S2468823119303268/gr12/DOWNSAMPLED/image/jpeg/a36e6f6d52a14ec31f13fde43735ee2d/gr12.jpg gr12 gr12.jpg jpg 24336 268 492 IMAGE-DOWNSAMPLED 1-s2.0-S2468823119303268-gr2.jpg https://s3.amazonaws.com/prod-ucs-content-store-us-east/content/pii:S2468823119303268/gr2/DOWNSAMPLED/image/jpeg/2d2167c0a7f429989f51800b25f12a4f/gr2.jpg gr2 gr2.jpg jpg 25372 277 492 IMAGE-DOWNSAMPLED 1-s2.0-S2468823119303268-gr3.jpg https://s3.amazonaws.com/prod-ucs-content-store-us-east/content/pii:S2468823119303268/gr3/DOWNSAMPLED/image/jpeg/a29f595e4885b709cccf135e3cbc6e95/gr3.jpg gr3 gr3.jpg jpg 21346 273 492 IMAGE-DOWNSAMPLED 1-s2.0-S2468823119303268-gr4.jpg https://s3.amazonaws.com/prod-ucs-content-store-us-east/content/pii:S2468823119303268/gr4/DOWNSAMPLED/image/jpeg/a512854778e32ae6c6fd8e420246e68d/gr4.jpg gr4 gr4.jpg jpg 10209 261 379 IMAGE-DOWNSAMPLED 1-s2.0-S2468823119303268-gr5.jpg https://s3.amazonaws.com/prod-ucs-content-store-us-east/content/pii:S2468823119303268/gr5/DOWNSAMPLED/image/jpeg/4ec0c57be04280d9fa7b2d5281617b21/gr5.jpg gr5 gr5.jpg jpg 25033 281 492 IMAGE-DOWNSAMPLED 1-s2.0-S2468823119303268-gr6.jpg https://s3.amazonaws.com/prod-ucs-content-store-us-east/content/pii:S2468823119303268/gr6/DOWNSAMPLED/image/jpeg/c7927f56e91a6699353b19328df93c17/gr6.jpg gr6 gr6.jpg jpg 18538 242 492 IMAGE-DOWNSAMPLED 1-s2.0-S2468823119303268-gr7.jpg https://s3.amazonaws.com/prod-ucs-content-store-us-east/content/pii:S2468823119303268/gr7/DOWNSAMPLED/image/jpeg/7fdb845573719b48ef0995972ff0c8c2/gr7.jpg gr7 gr7.jpg jpg 32944 643 567 IMAGE-DOWNSAMPLED 1-s2.0-S2468823119303268-gr8.jpg https://s3.amazonaws.com/prod-ucs-content-store-us-east/content/pii:S2468823119303268/gr8/DOWNSAMPLED/image/jpeg/1abbba29d78c995ce9e1eb8d217ad0b8/gr8.jpg gr8 gr8.jpg jpg 54841 533 567 IMAGE-DOWNSAMPLED 1-s2.0-S2468823119303268-gr9.jpg https://s3.amazonaws.com/prod-ucs-content-store-us-east/content/pii:S2468823119303268/gr9/DOWNSAMPLED/image/jpeg/a3e530caf7c8a486b56d4666b1cc2305/gr9.jpg gr9 gr9.jpg jpg 45264 494 567 IMAGE-DOWNSAMPLED 1-s2.0-S2468823119303268-sc1.jpg https://s3.amazonaws.com/prod-ucs-content-store-us-east/content/pii:S2468823119303268/sc1/DOWNSAMPLED/image/jpeg/0bb801c80bbd844d52e5906f0eec69ab/sc1.jpg sc1 sc1.jpg jpg 9771 87 567 IMAGE-DOWNSAMPLED 1-s2.0-S2468823119303268-sc2.jpg https://s3.amazonaws.com/prod-ucs-content-store-us-east/content/pii:S2468823119303268/sc2/DOWNSAMPLED/image/jpeg/7675eaaa7399566b3c660d371d84702f/sc2.jpg sc2 sc2.jpg jpg 23362 267 567 IMAGE-DOWNSAMPLED 1-s2.0-S2468823119303268-mmc1.doc https://s3.amazonaws.com/prod-ucs-content-store-us-east/content/pii:S2468823119303268/mmc1/MAIN/application/msword/da28044a5d41fac9aeba8597ace7210f/mmc1.doc mmc1 mmc1.doc doc 167936 APPLICATION 1-s2.0-S2468823119303268-am.pdf am am.pdf pdf 895478 AAM-PDF https://s3-eu-west-1.amazonaws.com/prod-ucs-content-store-eu-west/content/egi:10CGJWJQ0SR/MAIN/application/pdf/e3fe4208b275c0a3d44c59cc3333e2cb/am.pdf MCAT 110491 110491 S2468-8231(19)30326-8 10.1016/j.mcat.2019.110491 Elsevier B.V. Scheme 1 The model reaction for tandem one-pot photo-oxidation/ Knoevenagel condensation reaction. Scheme 1 Scheme 2 Proposed mechanism for one-pot photo-oxidation/ Knoevenagel condensation reaction of alcohols catalyzed by ompg-C3N4/Co2+. Scheme 2 Fig. 1 Small-angel XRD pattern of ompg-C3N4. Fig. 1 Fig. 2 Wide-angel XRD pattern of ompg-C3N4 and ompg-C3N4/Co2+. Fig. 2 Fig. 3 FT-IR spectra of ompg-C3N4 and ompg-C3N4/Co2+. Fig. 3 Fig. 4 EDS analysis of ompg-C3N4/Co2+. Fig. 4 Fig. 5 Diffuse reflectance spectrum (DRS) of ompg-C3N4 and ompg-C3N4/Co2+. (Inset) The Tauc plot of (αhυ)1/2 vs hυ of the ompg-C3N4 and ompg-C3N4/Co2+. Fig. 5 Fig. 6 Photoluminescence spectra of ompg-C3N4 and ompg-C3N4/Co2+. Fig. 6 Fig. 7 Thermogravimetric of a) ompg-C3N4 and b) ompg-C3N4/Co2+. Fig. 7 Fig. 8 FESEM images of ompg-C3N4 (a, b) and ompg-C3N4/Co2+ (c). Fig. 8 Fig. 9 High-resolution XPS characterization of Co 2p (a), O 1s (b), C 1s (c), and N 1s (d) for the ompg-C3N4/Co2+. Fig. 9 Fig. 10 Trapping experiment of active species during the photo-oxidation/Knoevenagel condensation reaction. Fig. 10 Fig. 11 Recyclability of the ompg-C3N4/Co2+ in one-pot photo-oxidation/ Knoevenagel condensation reaction. Fig. 11 Fig. 12 FT-IR spectra of fresh and used ompg-C3N4/Co2+. Fig. 12 Table 1 Porous characteristics of ompg-C3N4. Table 1 Sample S BET (m2 g−1) Pore volume a (cm3 g−1) Pore size (nm) ompg-C3N4 73.8 0.128 5.4 a Determined at p/p0  = 0.97, where p is the equilibrium pressure and p0 is the saturation pressure of nitrogen at −196 °C. Table 2 Optimization of the ompg-C3N4/Co2+ catalyzed model reaction for the one-pot photo-oxidation/ Knoevenagel condensation a . Table 2 Entry Catalyst Amount of catalyst (mg) Temp. (oC) Solvent hν LED (W) Condition Yield b (B) % 1 – – r.t. CH3CN – – Air – 2 – – r.t. CH3CN + 70 Air – 3 Bulk g-C3N4 80 r.t. CH3CN – – Air – 4 Bulk g-C3N4 80 r.t. CH3CN + 70 Air 20 5 Bulk g-C3N4 80 100 CH3CN + 70 Air 23 6 Bulk g-C3N4 80 r.t CH3CN + 70 O2 20 7 ompg-C3N4 80 r.t. CH3CN – – Air – 8 ompg-C3N4 80 r.t. CH3CN + 70 Air 35 9 ompg-C3N4 80 100 CH3CN + 70 Air 37 10 ompg-C3N4 80 r.t. CH3CN + 70 O2 35 11 ompg-C3N4/Co2+ 80 r.t. CH3CN – – Air Trace 12 ompg-C3N4/Co2+ 80 r.t. CH3CN + 70 Air 73 13 ompg-C3N4/Co2+ 80 100 CH3CN + 70 Air 60 14 ompg-C3N4/Co2+ 80 r.t. CH3CN + 70 O2 73 15 ompg-C3N4/Co2+ 80 r.t. CH3CN + 70 N2 35 16 ompg-C3N4/Co2+ 60 r.t. CH3CN + 70 Air 50 17 ompg-C3N4/Co2+ 100 r.t. CH3CN + 70 Air 75 18 ompg-C3N4/Co2+ 80 r.t. H2O + 70 Air 35 19 ompg-C3N4/Co2+ 80 r.t. Toluene + 70 Air 20 20 ompg-C3N4/Co2+ 80 r.t. CH3CN – 70 Air, H2O2 – 21 ompg-C3N4/Co2+ 80 r.t. CH3CN – 70 Air, TBHP – 22 ompg-C3N4/Co2+ 80 r.t. CH3CN + 70 Air, H2O2 – 23 ompg-C3N4/Co2+ 80 r.t. CH3CN + 40 Air 56 24 ompg-C3N4/Co2+ 80 r.t. CH3CN + 6 Air 47 25 ompg-C3N4/Co2+ 80 r.t. CH3CN + 100 Air 70 26 c ompg-C3N4/Co2+ 80 r.t. CH3CN + 70 Air 37 27 c ompg-C3N4/Co2+ 100 r.t. CH3CN + 70 Air 40 28 d ompg-C3N4/Co2+ 80 r.t. CH3CN + 70 Air 35 29 d ompg-C3N4/Co2+ 60 r.t. CH3CN + 70 Air 35 30 TiO2 P25 100 r.t. CH3CN + 70 Air Trace a Reaction condition: 4-chlorobenzyl alcohol (1.0 mmol), malononitrile (1.2 mmol), Time A (12.0 h), Time B (6.0 h). b Isolated yield of B, (ompg-C3N4/Co2+, Co2+: 8.04 wt%). c (ompg-C3N4/Co2+, Co2+: 5.36 wt%). d (ompg-C3N4/Co2+, Co2+: 13.4 wt%). Table 3 Tandem one-pot photo-oxidation/ Knoevenagel condensation reaction of alcohols catalyzed by ompg-C3N4/Co2+. a . Table 3 Entry Alcohol Product Yield (%) b M.p (0C) Ref. 1 78 79–80 [53] 2 73 154 [54] 3 80 123–126 [31] 4 85 107–110 [55] 5 50 92–94 [56] 6 75 103–107 [57] 7 N.R – 8 45 158–159 [58] 9 40 138–140 [59] 10 40 172–174 [60] a Reaction condition: alcohols (1.0 mmol), malononitrile (1.2 mmol), acetonitrile (5 mL), ompg-C3N4/Co2+ (80.0 mg), Time A (12.0 h), Time B (6.0 h). b Isolated Yield. Table 4 Comparison of different catalysts for the one-pot tandem oxidation/Knoevenagel condensation between 4-methoxybenzyl alcohol and malononitrile. Table 4 Refs. Time (h) Solvent Condition Catalyst (amount of catalyst) Entry [37] 40 Trifluorotoluene/acetonitrile Visible light (300 W Xe), O2 (1 atm) NH2-MIL-101(Fe) (20 mg) 1 a [61] 25 Toluene O2 (0.2 MPa), 110 °C Fe3O4@SiO2@PEI@Ru(OH)x (100 mg) 2 b [36] 12 CH3CN TEMPO (0.5 equiv.), O2 (1 atm), 75 °C Cu3TATAT-3 (8 mol%) 3 c [62] 23 First step: TolueneSecond step: Methanol 110 °C, in air Au@Cu(II)-MOF (3 mol%) 4 d This work 18 CH3CN Visible light (70 W LED), in air, first step: r.t., second step: 80 °C ompg-C3N4/Co2+ (80 mg) 5 e a Yield(%): 76. b Yield (%); 75.4. c Conversion (%): 97. d Conversion (%): >99. e Yield(%): 85. Co2+ immobilized on highly ordered mesoporous graphitic carbon nitride (ompg-C3N4/Co2+) as an efficient and recyclable heterogeneous catalyst for one-pot tandem selective photo-oxidation/Knoevenagel condensation Hossein Ghafuri ⁎ Ghazaleh Jafari Afsaneh Rashidizadeh Faranak Manteghi Catalysts and Organic Synthesis Research Laboratory, Department of Chemistry, Iran University of Science and Technology, Tehran, 16846-13114, Iran Catalysts and Organic Synthesis Research Laboratory Department of Chemistry Iran University of Science and Technology Tehran 16846-13114 Iran Catalysts and Organic Synthesis Research Laboratory, Department of Chemistry, Iran University of Science and Technology, Tehran16846-13114, Iran ⁎ Corresponding author. Graphical abstract Design and synthesis of efficient heterogeneous photocatalysts is an important task for practical applications due to the increasing environmental challenges and energy crisis. In this work, Co2+ modified highly ordered mesoporous graphitic carbon nitride (ompg-C3N4/Co2+) was prepared through a simple procedure involving sonication treatment. The obtained catalyst was characterized using FT-IR, XRD, ICP-OES, FE-SEM, UV–vis DRS, N2 adsorption-desorption, and TGA. It was found that the ompg-C3N4/Co2+ can function as a multifunctional heterogeneous photocatalyst for the one-pot tandem selective photo-oxidation/ Knoevenagel condensation. More interestingly, the obtained ompg-C3N4/Co2+ represented a high photocatalytic activity in benzyl alcohol oxidation without any oxidant under air atmosphere and visible light irradiation. Keywords Heterogeneous photocatalysis Co2+ modified highly ordered mesoporous graphitic carbon nitride (ompg-C3N4/Co2+) Oxidative tandem reaction Knoevenagel condensation 1 Introduction Over the past decade, designing unique heterogeneous photocatalysis for transformation of solar power to viable forms of energy have attracted worldwide attention due to global warming and energy crisis. Graphitic carbon nitride (g-C3N4) is a green and potential material for photocatalysis with two-dimensional layer structure that can be easily synthesized through thermal polycondensation of the low cost and abundant precursors containing dicyandiamide, urea, melamine, cyanamide, and thiourea. g-C3N4 as an organic and metal-free polymeric semiconductor possesses promising features such as large surface area, high physicochemical and thermal stability, and electronic band structure owing to the sp2 hybridization of nitrogen and carbon atoms to form tri-s-triazine units which are linked by planar amino units generating a stacked two-dimensional π-conjugated graphitic- like layers. Moreover, graphitic carbon nitride with a moderate band gap energy is a valuable semiconductor can adsorb a large fraction of energy in the visible region to produce chemical energy [1,2]. In view of its properties, g-C3N4 has been employed in diverse fields including energy storage, fuel cells, degradation of contaminant, redox reactions, CO2 reduction, water splitting, and heterogeneous catalyst or catalyst supports [3–9]. Nevertheless, due to the low specific surface area, deficient electron-hole pair separation, quick recombination probability of photoinduced carriers, and poor absorption in visible light region, the photocatalytic performance of the pure g-C3N4 was limited. Hence, many attempts have been made to overcome these obstacles and improve the photoactivity of the pristine g-C3N4, which include doping with heteroatoms (such as sulfur, oxygen, boron, phosphorus, and halogen), metal deposition, hybridizing with noble metals, heterogeneous semiconductors, metal oxides, and designing porous textural [10–16]. Selective oxidation reactions are the most essential chemical transformations in organic synthesis. Particularly, the carbonyl compounds obtained from the selective oxidation of hydroxyl groups, are extensively applied as the indispensable intermediates in the synthesis of fine chemicals, agrochemicals, pharmaceuticals, food and fragrances, and vitamins [17,18]. Generally, traditional oxidation reactions involved the use of stoichiometric amount of hazardous or corrosive oxidizing agents (such as MnO2, KMnO4, ClO−, Cr(VI), CrO3, Cl2) under high pressure and temperature conditions, which lead to harmful byproducts and generate tremendous heavy metal wastes [19]. Accordingly, a promising alternative green process for selective oxidation of alcohols under mild conditions is still in demand. Up to date, semiconductor photocatalysts are considered to be the most effective route for using renewable solar energy. Sustainable heterogeneous photocatalysts have attracted extensive application in oxidation reactions due to their selectivity, excellent stability, and use of H2O2, O2 or air as oxidant, which are clearly more environmentally benign than inorganic oxidants [20–23]. Recently, Wang and coworkers employed mpg-C3N4 as a metal-free photocatalyst to active O2 for the selective oxidation of benzyl alcohols under visible light irradiation. They have demonstrated a potential pathway for the selective oxidation reaction of benzyl alcohols to benzaldehydes with avoiding the cost and toxic oxidants [24]. Chen have described acid- modification had a significant influence on the photocatalytic performance of g-C3N4 for the selective aerobic oxidation of benzyl alcohols with dioxygen as the oxidant. We are thus inspired to modify g-C3N4 for selective oxidation of benzyl alcohols to their corresponding aldehydes under visible light source and mild reaction conditions [25]. Consequently, the photocatalytic activity of g-C3N4 remains an attractive subject in the field of material science. We are thus inspired to modify the g-C3N4 for the one-pot tandem aerobic photo-oxidation/Knoevenagel condensation of alcohols with malononitrile. Carbon-carbon bond forming via Knoevenagel condensation between carbonyl compounds and active methylenes is the most important strategies in organic synthesis. The obtained α,β-unsaturated carbonyl compounds through the Knoevenagel condensation have wide applications in natural and biological products synthesis [26]. Various base and acid catalysts have been applied for the Knoevenagel condensation including amine functionalized MOFs, carbon nanotubes, C60, ionic liquids, GO, and also ZnCl2, Ni-SiO2, and Vanadium-substituted phosphomolybdic acid [27–35]. One-pot tandem reactions have received a great deal of attention by reducing energy consumption and production of wastes, optimizing the use of substrates and solvents, and increasing economic efficiency. Therefore, developing an environmentally benign strategy for the one-pot tandem synthesis of benzylidene malononitrile via oxidation-Knoevenagel condensation reaction is a major challenge for scientists. In recent years, several bifunctional catalysts were reported for the preparation of benzylidene malononitrile derivatives through one-pot consecutive oxidation-Knoevenagel condensation reaction such as Cu3TATAT-3, NH2-MIL-101(Fe), Ru/UiO-66, and MNP@PIL/W [36–39]. Following our researchers into the preparation of heterogeneous catalysts [40–46] and with the goal of designing a novel photocatalytic system for the tandem oxidative condensation reactions that require a green oxidant and mild condition to achieve a desirable product, we have prepared the ompg-C3N4/Co2+ as an effective and multifunctional heterogeneous photocatalyst for the one-pot tandem aerobic photo-oxidation/Knoevenagel condensation of alcohols with malononitrile. 2 Experimental 2.1 Materials and devices In this work, all chemicals containing Pluronic P123, TEOS, cyanamide, CoCl2, benzyl alcohols and malononitrile, reagents and solvents are procured from Flucka and Merck companies and utilized without extra purifications. Fourier transform infrared (FT-IR) spectra were obtained by using a Shimadzu 800 IR 100 spectrometer. The powder X-ray diffraction spectra (PXRD) were performed with a PANAlytical X-PERT-PRO MPD diffractometer equipped with Cu Kα (λ = 1.5406 Å, 40 kV/40 mA). The UV–vis diffuse reflection spectra of the ompg-C3N4 and ompg-C3N4/Co2+ was taken on a UV–vis spectrometer (UV-1700 Shimadzu, Japan). Photoluminescence (PL) spectra were collected on RF-6000 Shimadzo Inductively coupled plasma optical emission spectroscopy (ICP-OES) were obtained by VISTA-Pro (Varian-Inc). The morphology and textural properties of the samples were analyzed by MIRA3 TESCAN-XMU. N2 adsorption and desorption measurement were obtained by BET method and BJH model which was conducted on Micromeritics (ASAP 2020) apparatus at −196 °C. STA504 analyzer was used to investigate thermogravimetric and differential thermal analysis of as-prepared samples under N2 at 10 °C/min to 800 °C. EDX spectra were acquired on Numerix DXP-X10P. X-ray photoelectron spectroscopy (XPS) data were done on Bestec GmbH, Berlin, Germany equipped with an Al–Kα X–ray source at energy of 1486.6 eV. A 70 W white LED lamp with a 420 nm wavelength was used a visible light source for photocatalytic activity. Melting-points of the final products were determined using an Electrothermal 9100 apparatus. Proton nuclear magnetic resonance spectra of the products were obtained by Burker DRX-500 Avance spectrometer (500 MHz). 2.2 Preparation of SBA-15 ordered mesostructured silica For the preparation of ompg-C3N4, SBA-15 was utilized as a hard silica template. At first, Pluronic P123 (3.5 g) was dissolved under stirring in HCl (1.6 M) at 38 °C for 24 h, followed by adding 7.5 mL of TEOS (tetraethyl orthosilicate) with strong stirring for another 24 h at 38 °C. The obtained mixture was heated in the Teflon-lined autoclave for 24 h at 150 °C. The resultant white solid was filtered off, then washed by de-ionized water. Finally, the solid was calcined for 5 h at 550 °C in air. 2.3 Preparation of highly ordered mesoporous graphitic carbon nitride (ompg-C3N4) The above obtained SBA-15 (1.0 g) was added in 8.0 mL of aqueous solution including 3.5 g of cyanamide and stirred strongly for 8 h. Then, the dispersed mixture was centrifuged and dried overnight at 60 °C. The resulting powder was heated under N2 atmosphere at 550 °C. Subsequently, to remove the SBA-15 as a silica template, the prepared light- yellow solid material was stirred in NH4HF2 (4.0 M, 40 mL) for 24 h. After filtering the precipitate and washing with de-ionized water and ethanol, the light-yellow powder was dried at 60 °C. 2.4 Preparation of ompg-C3N4/Co2+ Briefly, 50.0 mL of aqueous solution including 0.4 g of prepared ompg-C3N4 was sonicated for 30 min to obtain a uniform suspension, then aqueous solution of CoCl2 (250.0 mL, 0.3 M) was added into the above dispersed mixture. The mixture was sonicated for 4 h at 80 °C, followed by centrifugation and washed by de-ionized water for several times to eliminate the unbound CoCl2, finally the powder dried overnight. 2.5 General procedure for one-pot tandem photo-oxidation/Knoevenagel condensation In a 25.0 mL round-bottomed flask, benzyl alcohol (1.0 mmol), ompg-C3N4/Co2+ (80.0 mg), and acetonitrile as solvent (16.0 mL) without any oxidant were mixed and stirred at room temperature under visible light irradiation (70 W LED) in air atmosphere for 12 h. Completion the reaction was determined by TLC, followed by adding of malononitrile (1.1 mmol) and the mixture was stirred at 80 °C for 6 h until Knoevenagel condensation was completed. The catalyst was separated using centrifuge and washed with ethanol and water, dried overnight and used in another cycle. Finally, the solvent was evaporated via rotary and the desired pure product was obtained by recrystallization at ethanol. 3 Results and discussion 3.1 Catalyst characterizations The ordered mesoporous structure of the ompg-C3N4 was investigated by using small angel region of XRD patterns. As reported in the literature, small-angel XRD pattern of 2D hexagonal SBA-15 demonstrates three characteristic peaks matching to the (100), (110), and (200) planes [47,48]. After removal the SBA-15, the intensity of these peaks for ompg-C3N4 decrease and become broader, implying the ordered mesoporous structure of the ompg-C3N4 is less than SBA-15 and 2D hexagonal framework of the template is retained (Fig. 1 ). The wide angle XRD analysis of the prepared ompg-C3N4 displays two distinct diffraction peaks, which corresponding to the interlayer stacking peak of aromatic rings (2θ = 27.4°) and in-plane ordering of tri-s-triazine blocks (2θ = 13.6°). Compared to ompg-C3N4, the strong peak at 2θ = 27.4° become weaker and shifted to the larger angle (by ˜0.4°) with the increase of cobalt ions (Co2+) content in the ompg-C3N4. It is caused by the formation of Co-N bonds through the coordination interaction of Co ions species with ompg-C3N4 and decrease in the distance between the interplanar ompg–C3N4 layers ascribed to the distortion in the in-plane aromatic stacking by the immobilization of Co ions in the ompg-C3N4/Co2+ catalysts. Also another peak at 13.6° is omitted due to the embedding cobalt ions into in-planes of graphitic carbon nitride layers (Fig. 2 ) [49,50]. The FTIR spectra of ompg-C3N4 and ompg-C3N4/Co2+ (Fig. 3 ) confirms the chemical structure of graphitic carbon nitride. The presence of broad bands at 3000–3500 cm−1 displays NH2 and NH groups. The main bands at 1307 and 1602 cm−1 are caused by the stretching vibrations of C–N/CN. Specifically, the sharp signal at 806 cm−1 manifested the presence of the tri-s-triazine rings. The spectrum of ompg-C3N4/Co2+ exhibited the similar characteristic vibrations, clearly reveal that the graphitic carbon nitride framework remains unchanged after the immobilization of Co ions. For determination of the presence of Co species in the ompg-C3N4/Co2+, EDS and ICP-OES analysis has been employed. As depicted in Fig. 4 , three major elements (C, N, and Co) are contributed in the structure of ompg-C3N4/Co2+. These results suggest that the silica template has been successfully removed by washing with NH4HF2. The exact content of Co in the prepared catalyst (ompg-C3N4/Co2+) was obtained 8.04 wt% by Inductively Coupled Plasma Optical Emission Spectroscopy. The optical features of the synthesized ompg-C3N4 and ompg-C3N4/Co2+ were investigated by UV–vis diffuse reflection spectra (DRS) and room temperature photoluminescence (PL). As can be seen in Fig. 5 , the ompg-C3N4/Co2+ has obvious visible–light absorption. Additionally, the band gap energy (Eg) of the pure ompg-C3N4 and ompg-C3N4/Co2+ were calculated by Taucʼs equation (αhν = B(hν − Eg)n/2) [51] as 2.80 and 2.66 eV respectively. Hence, the ompg-C3N4/Co2+ showed enhanced photocatalytic performance as compared to the ompg-C3N4. To study the charge carrier generation and recombination, the photoluminescence emission spectra (PL) were carried out (Fig. 6 ). The PL spectrum of pristine ompg-C3N4 indicates the maximum PL emission intensity at 480 nm, which related to the high charge recombination. Remarkably, the PL intensity of ompg-C3N4/Co2+ was weaker than ompg-C3N4, implying that the Co species have quenching effect and reduced recombination of the photoinduced electrons and hole pairs. Generally, the narrow band gap and inhibited recombination are vital factors for superior photocatalytic activity. Thermal stability of ompg-C3N4 and ompg-C3N4/Co2+ was examined by thermal gravimetric analysis and differential thermal analysis (Fig. 7 ). The TGA curve of ompg-C3N4 evidence that the catalyst support (ompg-C3N4) is stable up to about 600 °C. The negligible amount of weight loss about 6% at the range of 100–200 °C can be attributed to the evaporation of trapped water molecules by mesopore channels. Also, ompg-C3N4/Co2+ remains stable until 600 °C, which shows a very low loss in the thermal stability with Co immobilization. To further approve the porosity of the prepared ompg-C3N4, the N2 adsorption-desorption analysis were performed. The BET specific surface area, BJH pore size and pore volume of the ompg-C3N4 are shown in Table 1 . The existence of the mosopore structure is confirmed by these results. Moreover, the ompg-C3N4 possess high BET specific surface area (73.8 m2 g−1) and appropriate BJH pore volume (0.128 cm3 g−1) which can provide a promising space for immobilization/ anchoring of Co species. Furthermore, the successful formation of ordered mesoporous graphitic carbon nitride is confirmed by using FESEM. As represented in Fig. 8 , the ompg-C3N4 and ompg-C3N4/Co2+ have rod-like morphology. FESEM images of ompg-C3N4/Co2+ reveal that the surfaces of ompg-C3N4 is decorated with Co species. To further confirm the successful immobilization of Co2+ with ompg-C3N4, the X-ray photoelectron spectroscopy (XPS) was also carried out. In Fig. 9 (a), the high XPS resolution of Co 2p displays that two pairs of individual peaks at 785.1 and 800.3 eV can be corresponded to Co 2p3/2 and Co 2p1/2 orbits respectively, which are assigned to Co2+ in ompg-C3N4/Co2+ [49,52]. The binding energy of O 1s at 534.6 eV is ascribed to the surface adsorption and oxidation (Fig. 9b). We also investigated high-resolution of XPS analysis of C 1s and N 1s. The C 1s spectra of ompg-C3N4/Co2+ illustrates two distinct peaks at 287.4 and 290.9 eV, the first peak can be attributed to carbon species for the surface of ompg-C3N4, whereas the second one represents a typical peak for sp2- hybridized carbon which is determined as the NCN bonding of the ompg-C3N4 (Fig. 9c). The high resolution N 1s photoelectron signal of the ompg-C3N4/Co2+ (Fig. 9d) exhibits four peaks located at 401.8, 402.8, 403.3, and 407.1 eV, which are related to the nitrogen atoms in different functional groups: CNC (sp2- hybridized nitrogen), tertiary nitrogen (N−(C)3), uncondensed CNH functional groups, and charging effects or positive charge localization in the heterocycles. These spectral data in comparison with reported pure g-C3N4 [47] indicate binding energy shift to the higher energy due to the incorporation of Cobalt species on the ompg-C3N4/Co2+. 3.2 Catalytic properties One-pot tandem reactions are the most important strategy for organic transformations in the industry and modern synthesis. This strategy has the advantages such as avoiding isolation and purification of the intermediates, reducing energy consumption and production of wastes. Hence, the development of multifunctional heterogeneous catalysts lead to a greener process. The catalytic performance of ompg-C3N4/Co2+ as a multifunctional catalyst was investigated in tandem photo-oxidation/Knoevenagel condensation between 4-chlorobenzyl alcohol and malononitrile as a model reaction for optimization of the reaction conditions (Scheme 1 ). This reaction occurs in one-pot condition including two steps: first, photocatalytic selective oxidation of alcohols, second, Knoevenagel condensation between aldehydes and malononitrile. To optimize the reaction conditions, a series of control experiments was performed (Table 2 ). In the absence of catalyst 4-chlorobenzyl alcohol was not transformed to the corresponding aldehyde, under visible-light or not (Table 2, entries 1, 2). The bulk g-C3N4 gave very low yield of the product under visible light irradiation, and the ompg-C3N4 afforded the desired product with low yield (Table 2, entries 3–10). In the absence of irradiation of visible light, no oxidation proceeded. These results show that the oxidation of alcohol over ompg-C3N4 and ompg-C3N4/Co2+ is a photocatalytic reaction. After immobilization of Co ions, the yield of the product was significantly increased which suggested the essential role of Co species in the photo-oxidation/Knoevenagel condensation and synergistic effect of Co species and ompg-C3N4 in this reaction (Table 2, entries 12–14). The model reaction was carried out in air, O2 and N2 atmosphere and good yield 73% of the desired product was obtained under air and O2 condition (Table 2, entries 12, 14), however the oxidation could not occur under N2 aeration (Table 2, entry 15). In the next step, the model reaction was also examined in the presence of different oxidants such as H2O2 and TBHP, and the results indicated that photo-oxidation/Knoevenagel condensation did not proceed (Table 2, entries 20–22). Various solvents were studied to find the ideal solvent for the aerobic photo-oxidation/Knoevenagel reaction, the desired product was obtained in good yield in acetonitrile. Although low yields were observed in H2O and toluene (Table 2, entries 12, 18, 19). Also, the influence of temperature was studied in the photo-oxidation step of the model reaction. With increasing temperature from 25 to 100 °C, the conversion of corresponding aldehyde was reduced (Table 2, entries 12, 13). To optimize the amount of ompg-C3N4/Co2+ as the catalyst for the one-pot photo-oxidation/Knoevenagel condensation, the model reaction was examined in acetonitrile under visible light irradiation (LED 70W) (Table 2, entries 12, 16, 17). As indicated in Table 2, the best results were achieved in the presence of 100.0 mg of ompg-C3N4/Co2+. The dependence of photocatalytic activity of the ompg-C3N4/Co2+ on the power LEDs was also investigated, and the good yield of the final product was achieved with LED 70 W (Table 2, entries 12, 23–25). Finally, different Co loadings on ompg-C3N4 (8.04%, 5.36%, and 13.4%) were investigated in the model reaction, ompg-C3N4/Co2+ 8.04% exhibited the best catalytic performance in the one-pot photo-oxidation/Knoevenagel condensation reaction (Table 2, entries 12, 26–29). In order to investigate the photocatalytic performance of ompg-C3N4/Co2+, we also used TiO2 P25 as a well-known heterogeneous photocatalyst in the model reaction under the optimal conditions (Table 2, entry 30). No desired product was formed in the presence of TiO2 P25 under visible light irradiation (70W LED). TiO2 P25 displayed a low photocatalytic activity under visible light irradiation. After optimizing the reaction conditions, to explore the applicability of ompg-C3N4/Co2+ for photo-oxidation/Knoevenagel condensation, a series of benzylidenemalononitriles were synthesized by various alcohols including both electron-rich and electron-deficient alcohols (Table 3 ). It should be noted that benzyl alcohols with electron-withdrawing groups gave lower yield of products. Furthermore, aliphatic alcohol (Table 3, entry 10) was also suitable substrate for photo-oxidation/Knoevenagel reaction under the optimal conditions, and produced the desired Knoevenagel condensation product in 40% yield. Based on the photocatalytic performance of ompg-C3N4/Co2+ under visible light, a possible mechanism for the one-pot alcohol photo-oxidation/Knoevenagel condensation was shown in Scheme 2 . The catalytic cycle initiated by exciting electrons from CB of the ompg-C3N4/Co2+, then the photogenerated holes oxidize Co2+ ions into Co3+ species which is a key step in photo-oxidation of alcohols. The electrons react with O2 in the air and generate O2 −. The existence of O2 − and basic properties of the ordered mesoporous graphitic carbon nitride (ompg-C3N4) can facilitate deprotonation of benzyl alcohol to produce anion (A), which react with the holes (h+) to produce the carbon radical. Finally, the recombination of the radical (B) with the superoxide radical lead to formation aromatic aldehydes. Due to the presence of the amine groups on the surface of ompg-C3N4, deprotonation of malononitrile occurs. In the next step, the catalyst (ompg-C3N4/Co2+) activates CO bond of aldehyde, then nucleophilic addition of carbanion lead to formation intermediate (I) which undergoes protonation and dehydration to afford benzylidenemalononitrile. Furthermore, trapping experiments were performed to investigate the role of reactive oxidative species. Herein, t-butanol (•OH scavenger), nitrogen (O2 scavenger), and ammonium oxalate (h+ scavenger) were respectively added in the model reaction mixture and irradiated under visible light (70 W LED). As shown in Fig. 10 , t-BuOH showed little effect on the yield of the desired product however, N2 aeration and addition of ammonium oxalate significantly reduced the yield of the product. It was found that O2 and h+ are two essential reactive species in the photocatalytic oxidation reaction. To investigate the stability and recyclability of the ompg-C3N4/Co2+ photocatalyst, a set of experiments were carried out for the one-pot tandem photo-oxidation/Knoevenagel condensation between 4-chlorobenzyl alcohol and malononitrile under similar conditions. When the reaction went to completion, the catalyst was collected by centrifuge, washed with ethanol and water and then dried at room temperature for overnight and reused in the other fresh reaction (Fig. 11 ). It was found that the photocatalytic performance of the ompg-C3N4/Co2+ has no evident decrease even after five consecutive runs. In addition, the Co leaching of ompg-C3N4/Co2+ was evaluated using ICP-OES analysis. The Co concentration was found to be 8.04 wt% before the reaction and 8.03 wt% after the fifth cycle of the reaction. Also the Co leaching was <1 mg L−1 during the hot water treatment, which indicated the strong interaction of Co ions with ompg-C3N4 support. Additionally, FTIR spectra of the used catalyst indicates that the ompg-C3N4/Co2+ had no changes in the chemical structure during the reaction (Fig. 12 ). Compared to the other catalytic system reported in the literature for the one-pot tandem oxidation/ Knoevenagel condensation between benzyl alcohols and malononitrile as an active methylene compound, we herein exhibit that the ompg-C3N4/Co2+ is an efficient photocatalyst for this reaction without any oxidant under air atmosphere and visible light irradiation. As is evident from Table 4 , the ompg-C3N4/Co2+ is comparable with others in terms of reaction conditions, reaction time and non-toxicity solvent. 4 Conclusion In conclusion, Co ions were successfully immobilized on the ompg-C3N4 via a facile sonication treatment. The obtained ompg-C3N4/Co2+ as an effective multifunctional heterogeneous catalyst was utilized for promoting one-pot tandem aerobic photo-oxidation/Knoevenagel condensation of alcohols with malononitrile. The reaction performed without any toxic oxidants under visible light irradiation. No cobalt leaching was occurred during the photocatalytic cycle evaluated by using ICP analysis, revealed the stability and reusability of the ompg-C3N4/Co2+. We believe that the multifunctional nature of the heterogeneous photocatalyst (ompg-C3N4/Co2+) provides a green approach with a reduction in production wastes and energy consumption to access a broad scope of organic compounds from low-cost starting materials through one-pot tandem reactions. Acknowledgement The authors gratefully acknowledge the partial support from the Research Council of the Iran University of Science and Technology. Appendix A Supplementary data Supplementary material related to this article can be found, in the online version, at doi:https://doi.org/10.1016/j.mcat.2019.110491. Appendix A Supplementary data The following is Supplementary data to this article: References [1] W.-J. Ong L.-L. Tan Y.H. Ng S.-T. Yong S.-P. Chai Chem. Rev. 116 2016 7159 7329 W.-J. Ong, L.-L. Tan, Y.H. Ng, S.-T. Yong, S.-P. Chai, Chem. Rev. 116 (2016) 7159-7329. [2] J. Zhu P. Xiao H. Li S.A. Carabineiro ACS Appl. Mater. Interfaces 6 2014 16449 16465 J. Zhu, P. Xiao, H. Li, S.A. Carabineiro, ACS Appl. Mater. Interfaces.6 (2014) 16449-16465. [3] M. Tahir C. Cao F.K. Butt F. Idrees N. Mahmood Z. Ali I. Aslam M. Tanveer M. Rizwan T. Mahmood J. Math. Chem. A 1 2013 13949 13955 M. Tahir, C. Cao, F.K. Butt, F. Idrees, N. Mahmood, Z. Ali, I. Aslam, M. Tanveer, M. Rizwan, T. Mahmood, J. Math. Chem. A. 1 (2013) 13949-13955. [4] Y. Zheng J. Liu J. Liang M. Jaroniec S.Z. Qiao Energy Environ. Sci. 5 2012 6717 6731 Y. Zheng, J. Liu, J. Liang, M. Jaroniec, S.Z. Qiao, Energy Environ. Sci. 5 (2012) 6717-6731. [5] Y. Hong Y. Jiang C. Li W. Fan X. Yan M. Yan W. Shi Appl. Catal. B 180 2016 663 673 Y. Hong, Y. Jiang, C. Li, W. Fan, X. Yan, M. Yan, W. Shi, Appl. Catal., B. 180 (2016) 663-673. [6] X. Chen J. Zhang X. Fu M. Antonietti X. Wang J. Am. Chem. Soc. 131 2009 11658 11659 X. Chen, J. Zhang, X. Fu, M. Antonietti, X. Wang, J. Am. Chem. Soc. 131 (2009) 11658-11659. [7] K. Wang Q. Li B. Liu B. Cheng W. Ho J. Yu Appl. Catal. B 176 2015 44 52 K. Wang, Q. Li, B. Liu, B. Cheng, W. Ho, J. Yu, Appl. Catal., B. 176 (2015) 44-52. [8] S. Ye R. Wang M.-Z. Wu Y.-P. Yuan Appl. Surf. Sci. 358 2015 15 27 S. Ye, R. Wang, M.-Z. Wu, Y.-P. Yuan, Appl. Surf. Sci. 358 (2015) 15-27. [9] S. Sadjadi M.M. Heravi M. Malmir Carbohydr. Polym. 186 2018 25 34 S. Sadjadi, M.M. Heravi, M. Malmir, Carbohydr. Polym. 186 (2018) 25-34. [10] Y.-P. Zhu T.-Z. Ren Z.-Y. Yuan ACS Appl. Mater. Interfaces 7 2015 16850 16856 Y.-P. Zhu, T.-Z. Ren, Z.-Y. Yuan, ACS Appl. Mater. Interfaces.7 (2015) 16850-16856. [11] S. Yan Z. Li Z. Zou Langmuir 26 2010 3894 3901 S. Yan, Z. Li, Z. Zou, Langmuir. 26 (2010) 3894-3901. [12] M. Humayun Q. Fu Z. Zheng H. Li W. Luo Appl. Catal. A 568 2018 139 147 M. Humayun, Q. Fu, Z. Zheng, H. Li, W. Luo, Appl. Catal., A. 568 (2018) 139-147. [13] L. Ge C. Han J. Liu Y. Li Appl. Catal. A 409 2011 215 222 L. Ge, C. Han, J. Liu, Y. Li, Appl. Catal., A. 409 (2011) 215-222. [14] X. Yuan S. Duan G. Wu L. Sun G. Cao D. Li H. Xu Q. Li D. Xia Appl. Catal. A 551 2018 129 138 X. Yuan, S. Duan, G. Wu, L. Sun, G. Cao, D. Li, H. Xu, Q. Li, D. Xia, Appl. Catal., A. 551 (2018) 129-138. [15] W. Iqbal B. Yang X. Zhao M. Waqas M. Rauf C. Guo J. Zhang Y. Mao Appl. Catal. A 573 2019 13 21 W. Iqbal, B. Yang, X. Zhao, M. Waqas, M. Rauf, C. Guo, J. Zhang, Y. Mao, Appl. Catal., A. (2019). [16] H. Yang K. Lv J. Zhu Q. Li D. Tang W. Ho M. Li S.A. Carabineiro Appl. Surf. Sci. 401 2017 333 340 H. Yang, K. Lv, J. Zhu, Q. Li, D. Tang, W. Ho, M. Li, S.A. Carabineiro, Appl. Surf. Sci. 401 (2017) 333-340. [17] T. Hirashita M. Nakanishi T. Uchida M. Yamamoto S. Araki I.W. Arends R.A. Sheldon ChemCatChem 8 2016 2704 2709 T. Hirashita, M. Nakanishi, T. Uchida, M. Yamamoto, S. Araki, I.W. Arends, R.A. Sheldon, ChemCatChem, 8 (2016) 2704-2709. [18] E. Sahle-Demessie M.A. Gonzalez J. Enriquez Q. Zhao Ind. Eng. Chem. Res. 39 2000 4858 4864 E. Sahle-Demessie, M.A. Gonzalez, J. Enriquez, Q. Zhao, Ind. Eng. Chem. Res. 39 (2000) 4858-4864. [19] J. Littler Tetrahedron 27 1971 81 91 J. Littler, Tetrahedron. 27 (1971) 81-91. [20] A. Ziarati A. Badiei R. Luque Appl. Catal. B 240 2019 72 78 A. Ziarati, A. Badiei, R. Luque, Appl. Catal., B. 240 (2019) 72-78. [21] A. Ziarati A. Badiei R. Luque W. Ouyang J. Mater. Chem. A 6 2018 8962 8968 A. Ziarati, A. Badiei, R. Luque, W. Ouyang, J. Mater. Chem. A. 6 (2018) 8962-8968. [22] A. Ziarati A. Badiei R. Grillo T. Burgi ACS Appl. Mater. Interfaces 11 2019 5903 5910 A. Ziarati, A. Badiei, R. Grillo, T. Burgi, ACS Appl. Mater. Interfaces.11 (2019) 5903-5910. [23] A. Ziarati A. Badiei R. Luque Appl. Catal. B 238 2018 177 183 A. Ziarati, A. Badiei, R. Luque, Appl. Catal., B. 238 (2018) 177-183. [24] F. Su S.C. Mathew G. Lipner X. Fu M. Antonietti S. Blechert X. Wang J. Am. Chem. Soc. 132 2010 16299 16301 F. Su, S.C. Mathew, G. Lipner, X. Fu, M. Antonietti, S. Blechert, X. Wang, J. Am. Chem. Soc. 132 (2010) 16299-16301. [25] L. Zhang D. Liu J. Guan X. Chen X. Guo F. Zhao T. Hou X. Mu Mater. Res. Bull. 59 2014 84 92 L. Zhang, D. Liu, J. Guan, X. Chen, X. Guo, F. Zhao, T. Hou, X. Mu, Mater. Res. Bull.59 (2014) 84-92. [26] R.V. Hangarge D.V. Jarikote M.S. Shingare Green Chem. 4 2002 266 268 R.V. Hangarge, D.V. Jarikote, M.S. Shingare, Green Chem. 4 (2002) 266-268. [27] Y. Yang H.-F. Yao F.-G. Xi E.-Q. Gao J. Mol. Catal. A Chem. 390 2014 198 205 Y. Yang, H.-F. Yao, F.-G. Xi, E.-Q. Gao, J. Mol. Catal. A: Chem. 390 (2014) 198-205. [28] G. Tuci L. Luconi A. Rossin E. Berretti H. Ba M. Innocenti D. Yakhvarov S. Caporali C. Pham-Huu G. Giambastiani ACS Appl. Mater. Interfaces 8 2016 30099 30106 G. Tuci, L. Luconi, A. Rossin, E. Berretti, H. Ba, M. Innocenti, D. Yakhvarov, S. Caporali, C. Pham-Huu, G. Giambastiani, ACS Appl. Mater. Interfaces. 8 (2016) 30099-30106. [29] Y. Sun C. Cao P. Huang S. Yang W. Song RSC Adv. 5 2015 86082 86087 Y. Sun, C. Cao, P. Huang, S. Yang, W. Song, RSC Adv.5 (2015) 86082-86087. [30] D. Elhamifar S. Kazempoor B. Karimi Catal. Sci. Technol. 6 2016 4318 4326 D. Elhamifar, S. Kazempoor, B. Karimi, Catal. Sci. Technol. 6 (2016) 4318-4326. [31] J. Huang S. Ding W. Xiao Y. Peng S. Deng N. Zhang Catal. Lett. 145 2015 1000 1007 J. Huang, S. Ding, W. Xiao, Y. Peng, S. Deng, N. Zhang, Catal. Lett.145 (2015) 1000-1007. [32] S. Rana S.B. Jonnalagadda Catal. Commun. 92 2017 31 34 S. Rana, S.B. Jonnalagadda, Catal. Commun.92 (2017) 31-34. [33] P.S. Rao R. Venkataratnam Tetrahedron Lett. 32 1991 5821 5822 P.S. Rao, R. Venkataratnam, Tetrahedron Lett. 32 (1991) 5821-5822. [34] V.R. Pullabhotla A. Rahman S. Jonnalagadda Catal. Commun. 10 2009 365 369 V.R. Pullabhotla, A. Rahman, S. Jonnalagadda, Catal. Commun. 10 (2009) 365-369. [35] B. Viswanadham P. Jhansi K.V. Chary H.B. Friedrich S. Singh Catal. Lett. 146 2016 364 372 B. Viswanadham, P. Jhansi, K.V. Chary, H.B. Friedrich, S. Singh, Catal. Lett.146 (2016) 364-372. [36] Z. Miao Y. Luan C. Qi D. Ramella Dalton Trans. 45 2016 13917 13924 Z. Miao, Y. Luan, C. Qi, D. Ramella, Dalton Trans. 45 (2016) 13917-13924. [37] D. Wang Z. Li Catal. Sci. Technol. 5 2015 1623 1628 D. Wang, Z. Li, Catal. Sci. Technol. 5 (2015) 1623-1628. [38] Q. Yang H.-Y. Zhang L. Wang Y. Zhang J. Zhao ACS Omega 3 2018 4199 4212 Q. Yang, H.-Y. Zhang, L. Wang, Y. Zhang, J. Zhao, ACS Omega, 3 (2018) 4199-4212. [39] N. Zohreh M. Tavakolizadeh S.H. Hosseini A. Pourjavadi C. Bennett Polymer 112 2017 342 350 N. Zohreh, M. Tavakolizadeh, S.H. Hosseini, A. Pourjavadi, C. Bennett, Polymer.112 (2017) 342-350. [40] H. Ghafuri A. Rashidizadeh H.R.E. Zand RSC Adv. 6 2016 16046 16054 H. Ghafuri, A. Rashidizadeh, H.R.E. Zand, RSC. Adv. 6 (2016) 16046-16054. [41] H. Ghafuri N. Joorabchi A. Emami H.R. Esmaili Zand Ind. Eng. Chem. Res. 56 2017 6462 6467 H. Ghafuri, N. Joorabchi, A. Emami, H.R. Esmaili Zand, Ind. Eng. Chem. Res. 56 (2017) 6462-6467. [42] H.R.E. Zand H. Ghafuri N. Ghanbari ChemistrySelect 3 2018 8229 8237 H.R.E. Zand, H. Ghafuri, N. Ghanbari, ChemistrySelect. 3 (2018) 8229-8237. [43] H. Ghafuri M. Talebi Ind. Eng. Chem. Res. 55 2016 2970 2982 H. Ghafuri, M. Talebi, Ind. Eng. Chem. Res. 55 (2016) 2970-2982. [44] H. Ghafuri S. Rahmani R. Rahimi E. Mohammadiyan RSC Adv. 6 2016 62916 62922 H. Ghafuri, S. Rahmani, R. Rahimi, E. Mohammadiyan, RSC. Adv. 6 (2016) 62916-62922. [45] H. Ghafuri M. Dehghani A. Rashidizadeh M. Rabbani Optik 179 2019 646 653 H. Ghafuri, M. Dehghani, A. Rashidizadeh, M. Rabbani, Optik 179 (2019) 646-653. [46] M.A.D. Fard H. Ghafuri A. Rashidizadeh Microporous Mesoporous Mater. 274 2019 83 93 M.A.D. Fard, H. Ghafuri, A. Rashidizadeh, Microporous Mesoporous Mater. 274 (2019) 83-93. [47] Z. Zhao Y. Dai J. Lin G. Wang Chem. Mater. 26 2014 3151 3161 Z. Zhao, Y. Dai, J. Lin, G. Wang, Chem. Mater. 26 (2014) 3151-3161. [48] J. Liu J. Yan H. Ji Y. Xu L. Huang Y. Li Y. Song Q. Zhang H. Xu H. Li Mater. Sci. Semicond. Process. 46 2016 59 68 J. Liu, J. Yan, H. Ji, Y. Xu, L. Huang, Y. Li, Y. Song, Q. Zhang, H. Xu, H. Li, Mater. Sci. Semicond. Process. 46 (2016) 59-68. [49] L. Wang X. Guo Y. Chen S. Ai H. Ding Appl. Surf. Sci. 467 2019 954 962 L. Wang, X. Guo, Y. Chen, S. Ai, H. Ding, Appl. Surf. Sci. 467 (2019) 954-962. [50] Q. Liu J. Zhang Langmuir 29 2013 3821 3828 Q. Liu, J. Zhang, Langmuir, 29 (2013) 3821-3828. [51] X. Li J. Ye J. Phys. Chem. C 111 2007 13109 13116 X. Li, J. Ye, J. Phys. Chem. C. 111 (2007) 13109-13116. [52] G. Zhang S. Zang X. Wang ACS Catal. 5 2015 941 947 G. Zhang, S. Zang, X. Wang, ACS Catal. 5 (2015) 941-947. [53] Q. Zhang X.-M. Ma H.-X. Wei X. Zhao J. Luo RSC Adv. 7 2017 53861 53870 Q. Zhang, X.-M. Ma, H.-X. Wei, X. Zhao, J. Luo, RSC. Adv. 7 (2017) 53861-53870. [54] X.-L. Zhao K.-F. Yang Y.-P. Zhang J. Zhu L.-W. Xu Chin. Chem. Lett. 25 2014 1141 1144 X.-L. Zhao, K.-F. Yang, Y.-P. Zhang, J. Zhu, L.-W. Xu, Chin. Chem. Lett. 25 (2014) 1141-1144. [55] M. Hajjami F. Ghorbani S. Rahimipanah S. Roshani Chin. J. Catal. 36 2015 1852 1860 M. Hajjami, F. Ghorbani, S. Rahimipanah, S. Roshani, Chin. J. Catal. 36 (2015) 1852-1860. [56] R. Maleki N. Koukabi E. Kolvari Appl. Organomet. Chem. 32 2018 e3905 R. Maleki, N. Koukabi, E. Kolvari, Appl. Organomet. Chem. 32 (2018) e3905. [57] M. Curini F. Epifano M.C. Marcotullio O. Rosati A. Tsadjout Synth. Commun. 32 2002 355 362 M. Curini, F. Epifano, M.C. Marcotullio, O. Rosati, A. Tsadjout, Synth. Commun. 32 (2002) 355-362. [58] A. Rostami B. Atashkar H. Gholami Catal. Commun. 37 2013 69 74 A. Rostami, B. Atashkar, H. Gholami, Catal. Commun. 37 (2013) 69-74. [59] F. Shirini N. Daneshvar RSC Adv. 6 2016 110190 110205 F. Shirini, N. Daneshvar, RSC. Adv. 6 (2016) 110190-110205. [60] M. Ivonin O.Y. Bychok N. Safarova V. Sorokin Russ. J. Gen. Chem. 87 2017 2477 2480 M. Ivonin, O.Y. Bychok, N. Safarova, V. Sorokin, Russ. J. Gen. Chem. 87 (2017) 2477-2480. [61] H. Yan H.-Y. Zhang L. Wang Y. Zhang J. Zhao React. Kinet. Mech. Catal. 125 2018 789 806 H. Yan, H.-Y. Zhang, L. Wang, Y. Zhang, J. Zhao, React. Kinet. Mech. Catal. 125 (2018) 789-806. [62] J.-S. Wang F.-Z. Jin H.-C. Ma X.-B. Li M.-Y. Liu J.-L. Kan G.-J. Chen Y.-B. Dong Inorg. Chem. 55 2016 6685 6691 J.-S. Wang, F.-Z. Jin, H.-C. Ma, X.-B. Li, M.-Y. Liu, J.-L. Kan, G.-J. Chen, Y.-B. Dong, Inorg. Chem. 55 (2016) 6685-6691.",
      "scopus-id": "85068224407",
      "coredata": {
        "eid": "1-s2.0-S2468823119303268",
        "dc:description": "Design and synthesis of efficient heterogeneous photocatalysts is an important task for practical applications due to the increasing environmental challenges and energy crisis. In this work, Co2+ modified highly ordered mesoporous graphitic carbon nitride (ompg-C3N4/Co2+) was prepared through a simple procedure involving sonication treatment. The obtained catalyst was characterized using FT-IR, XRD, ICP-OES, FE-SEM, UV–vis DRS, N2 adsorption-desorption, and TGA. It was found that the ompg-C3N4/Co2+ can function as a multifunctional heterogeneous photocatalyst for the one-pot tandem selective photo-oxidation/ Knoevenagel condensation. More interestingly, the obtained ompg-C3N4/Co2+ represented a high photocatalytic activity in benzyl alcohol oxidation without any oxidant under air atmosphere and visible light irradiation.",
        "openArchiveArticle": "false",
        "prism:coverDate": "2019-10-31",
        "openaccessUserLicense": null,
        "prism:aggregationType": "Journal",
        "prism:url": "https://api.elsevier.com/content/article/pii/S2468823119303268",
        "dc:creator": [
          {
            "@_fa": "true",
            "$": "Ghafuri, Hossein"
          },
          {
            "@_fa": "true",
            "$": "Jafari, Ghazaleh"
          },
          {
            "@_fa": "true",
            "$": "Rashidizadeh, Afsaneh"
          },
          {
            "@_fa": "true",
            "$": "Manteghi, Faranak"
          }
        ],
        "link": [
          {
            "@_fa": "true",
            "@rel": "self",
            "@href": "https://api.elsevier.com/content/article/pii/S2468823119303268"
          },
          {
            "@_fa": "true",
            "@rel": "scidir",
            "@href": "https://www.sciencedirect.com/science/article/pii/S2468823119303268"
          }
        ],
        "dc:format": "application/json",
        "openaccessType": null,
        "pii": "S2468-8231(19)30326-8",
        "prism:volume": "475",
        "articleNumber": "110491",
        "prism:publisher": "Elsevier B.V.",
        "dc:title": "Co2+ immobilized on highly ordered mesoporous graphitic carbon nitride (ompg-C3N4/Co2+) as an efficient and recyclable heterogeneous catalyst for one-pot tandem selective photo-oxidation/Knoevenagel condensation",
        "prism:copyright": "© 2019 Elsevier B.V. All rights reserved.",
        "openaccess": "0",
        "prism:issn": "24688231",
        "dcterms:subject": [
          {
            "@_fa": "true",
            "$": "Heterogeneous photocatalysis"
          },
          {
            "@_fa": "true",
            "$": "Co2+ modified highly ordered mesoporous graphitic carbon nitride (ompg-C3N4/Co2+)"
          },
          {
            "@_fa": "true",
            "$": "Oxidative tandem reaction"
          },
          {
            "@_fa": "true",
            "$": "Knoevenagel condensation"
          }
        ],
        "openaccessArticle": "false",
        "prism:publicationName": "Molecular Catalysis",
        "openaccessSponsorType": null,
        "prism:pageRange": "110491",
        "pubType": "fla",
        "prism:coverDisplayDate": "October 2019",
        "prism:doi": "10.1016/j.mcat.2019.110491",
        "prism:startingPage": "110491",
        "dc:identifier": "doi:10.1016/j.mcat.2019.110491",
        "openaccessSponsorName": null
      },
      "objects": {
        "object": [
          {
            "@category": "thumbnail",
            "@height": "109",
            "@width": "219",
            "@_fa": "true",
            "$": "https://api.elsevier.com/content/object/eid/1-s2.0-S2468823119303268-fx1.sml?httpAccept=%2A%2F%2A",
            "@multimediatype": "GIF image file",
            "@type": "IMAGE-THUMBNAIL",
            "@size": "4399",
            "@ref": "fx1",
            "@mimetype": "image/gif"
          },
          {
            "@category": "thumbnail",
            "@height": "139",
            "@width": "219",
            "@_fa": "true",
            "$": "https://api.elsevier.com/content/object/eid/1-s2.0-S2468823119303268-fx10.sml?httpAccept=%2A%2F%2A",
            "@multimediatype": "GIF image file",
            "@type": "IMAGE-THUMBNAIL",
            "@size": "4868",
            "@ref": "fx10",
            "@mimetype": "image/gif"
          },
          {
            "@category": "thumbnail",
            "@height": "164",
            "@width": "218",
            "@_fa": "true",
            "$": "https://api.elsevier.com/content/object/eid/1-s2.0-S2468823119303268-fx11.sml?httpAccept=%2A%2F%2A",
            "@multimediatype": "GIF image file",
            "@type": "IMAGE-THUMBNAIL",
            "@size": "5060",
            "@ref": "fx11",
            "@mimetype": "image/gif"
          },
          {
            "@category": "thumbnail",
            "@height": "139",
            "@width": "219",
            "@_fa": "true",
            "$": "https://api.elsevier.com/content/object/eid/1-s2.0-S2468823119303268-fx12.sml?httpAccept=%2A%2F%2A",
            "@multimediatype": "GIF image file",
            "@type": "IMAGE-THUMBNAIL",
            "@size": "5112",
            "@ref": "fx12",
            "@mimetype": "image/gif"
          },
          {
            "@category": "thumbnail",
            "@height": "84",
            "@width": "219",
            "@_fa": "true",
            "$": "https://api.elsevier.com/content/object/eid/1-s2.0-S2468823119303268-fx13.sml?httpAccept=%2A%2F%2A",
            "@multimediatype": "GIF image file",
            "@type": "IMAGE-THUMBNAIL",
            "@size": "3446",
            "@ref": "fx13",
            "@mimetype": "image/gif"
          },
          {
            "@category": "thumbnail",
            "@height": "81",
            "@width": "219",
            "@_fa": "true",
            "$": "https://api.elsevier.com/content/object/eid/1-s2.0-S2468823119303268-fx14.sml?httpAccept=%2A%2F%2A",
            "@multimediatype": "GIF image file",
            "@type": "IMAGE-THUMBNAIL",
            "@size": "3672",
            "@ref": "fx14",
            "@mimetype": "image/gif"
          },
          {
            "@category": "thumbnail",
            "@height": "87",
            "@width": "219",
            "@_fa": "true",
            "$": "https://api.elsevier.com/content/object/eid/1-s2.0-S2468823119303268-fx15.sml?httpAccept=%2A%2F%2A",
            "@multimediatype": "GIF image file",
            "@type": "IMAGE-THUMBNAIL",
            "@size": "3489",
            "@ref": "fx15",
            "@mimetype": "image/gif"
          },
          {
            "@category": "thumbnail",
            "@height": "82",
            "@width": "219",
            "@_fa": "true",
            "$": "https://api.elsevier.com/content/object/eid/1-s2.0-S2468823119303268-fx16.sml?httpAccept=%2A%2F%2A",
            "@multimediatype": "GIF image file",
            "@type": "IMAGE-THUMBNAIL",
            "@size": "3591",
            "@ref": "fx16",
            "@mimetype": "image/gif"
          },
          {
            "@category": "thumbnail",
            "@height": "164",
            "@width": "219",
            "@_fa": "true",
            "$": "https://api.elsevier.com/content/object/eid/1-s2.0-S2468823119303268-fx17.sml?httpAccept=%2A%2F%2A",
            "@multimediatype": "GIF image file",
            "@type": "IMAGE-THUMBNAIL",
            "@size": "5346",
            "@ref": "fx17",
            "@mimetype": "image/gif"
          },
          {
            "@category": "thumbnail",
            "@height": "137",
            "@width": "219",
            "@_fa": "true",
            "$": "https://api.elsevier.com/content/object/eid/1-s2.0-S2468823119303268-fx18.sml?httpAccept=%2A%2F%2A",
            "@multimediatype": "GIF image file",
            "@type": "IMAGE-THUMBNAIL",
            "@size": "5040",
            "@ref": "fx18",
            "@mimetype": "image/gif"
          },
          {
            "@category": "thumbnail",
            "@height": "141",
            "@width": "216",
            "@_fa": "true",
            "$": "https://api.elsevier.com/content/object/eid/1-s2.0-S2468823119303268-fx19.sml?httpAccept=%2A%2F%2A",
            "@multimediatype": "GIF image file",
            "@type": "IMAGE-THUMBNAIL",
            "@size": "5169",
            "@ref": "fx19",
            "@mimetype": "image/gif"
          },
          {
            "@category": "thumbnail",
            "@height": "96",
            "@width": "219",
            "@_fa": "true",
            "$": "https://api.elsevier.com/content/object/eid/1-s2.0-S2468823119303268-fx2.sml?httpAccept=%2A%2F%2A",
            "@multimediatype": "GIF image file",
            "@type": "IMAGE-THUMBNAIL",
            "@size": "4296",
            "@ref": "fx2",
            "@mimetype": "image/gif"
          },
          {
            "@category": "thumbnail",
            "@height": "164",
            "@width": "216",
            "@_fa": "true",
            "$": "https://api.elsevier.com/content/object/eid/1-s2.0-S2468823119303268-fx20.sml?httpAccept=%2A%2F%2A",
            "@multimediatype": "GIF image file",
            "@type": "IMAGE-THUMBNAIL",
            "@size": "4901",
            "@ref": "fx20",
            "@mimetype": "image/gif"
          },
          {
            "@category": "thumbnail",
            "@height": "88",
            "@width": "219",
            "@_fa": "true",
            "$": "https://api.elsevier.com/content/object/eid/1-s2.0-S2468823119303268-fx3.sml?httpAccept=%2A%2F%2A",
            "@multimediatype": "GIF image file",
            "@type": "IMAGE-THUMBNAIL",
            "@size": "3482",
            "@ref": "fx3",
            "@mimetype": "image/gif"
          },
          {
            "@category": "thumbnail",
            "@height": "97",
            "@width": "219",
            "@_fa": "true",
            "$": "https://api.elsevier.com/content/object/eid/1-s2.0-S2468823119303268-fx4.sml?httpAccept=%2A%2F%2A",
            "@multimediatype": "GIF image file",
            "@type": "IMAGE-THUMBNAIL",
            "@size": "3672",
            "@ref": "fx4",
            "@mimetype": "image/gif"
          },
          {
            "@category": "thumbnail",
            "@height": "83",
            "@width": "219",
            "@_fa": "true",
            "$": "https://api.elsevier.com/content/object/eid/1-s2.0-S2468823119303268-fx5.sml?httpAccept=%2A%2F%2A",
            "@multimediatype": "GIF image file",
            "@type": "IMAGE-THUMBNAIL",
            "@size": "3497",
            "@ref": "fx5",
            "@mimetype": "image/gif"
          },
          {
            "@category": "thumbnail",
            "@height": "82",
            "@width": "219",
            "@_fa": "true",
            "$": "https://api.elsevier.com/content/object/eid/1-s2.0-S2468823119303268-fx6.sml?httpAccept=%2A%2F%2A",
            "@multimediatype": "GIF image file",
            "@type": "IMAGE-THUMBNAIL",
            "@size": "3581",
            "@ref": "fx6",
            "@mimetype": "image/gif"
          },
          {
            "@category": "thumbnail",
            "@height": "77",
            "@width": "219",
            "@_fa": "true",
            "$": "https://api.elsevier.com/content/object/eid/1-s2.0-S2468823119303268-fx7.sml?httpAccept=%2A%2F%2A",
            "@multimediatype": "GIF image file",
            "@type": "IMAGE-THUMBNAIL",
            "@size": "3390",
            "@ref": "fx7",
            "@mimetype": "image/gif"
          },
          {
            "@category": "thumbnail",
            "@height": "76",
            "@width": "219",
            "@_fa": "true",
            "$": "https://api.elsevier.com/content/object/eid/1-s2.0-S2468823119303268-fx8.sml?httpAccept=%2A%2F%2A",
            "@multimediatype": "GIF image file",
            "@type": "IMAGE-THUMBNAIL",
            "@size": "3557",
            "@ref": "fx8",
            "@mimetype": "image/gif"
          },
          {
            "@category": "thumbnail",
            "@height": "164",
            "@width": "212",
            "@_fa": "true",
            "$": "https://api.elsevier.com/content/object/eid/1-s2.0-S2468823119303268-fx9.sml?httpAccept=%2A%2F%2A",
            "@multimediatype": "GIF image file",
            "@type": "IMAGE-THUMBNAIL",
            "@size": "4751",
            "@ref": "fx9",
            "@mimetype": "image/gif"
          },
          {
            "@category": "thumbnail",
            "@height": "130",
            "@width": "219",
            "@_fa": "true",
            "$": "https://api.elsevier.com/content/object/eid/1-s2.0-S2468823119303268-ga1.sml?httpAccept=%2A%2F%2A",
            "@multimediatype": "GIF image file",
            "@type": "IMAGE-THUMBNAIL",
            "@size": "7084",
            "@ref": "ga1",
            "@mimetype": "image/gif"
          },
          {
            "@category": "thumbnail",
            "@height": "151",
            "@width": "219",
            "@_fa": "true",
            "$": "https://api.elsevier.com/content/object/eid/1-s2.0-S2468823119303268-gr1.sml?httpAccept=%2A%2F%2A",
            "@multimediatype": "GIF image file",
            "@type": "IMAGE-THUMBNAIL",
            "@size": "2735",
            "@ref": "gr1",
            "@mimetype": "image/gif"
          },
          {
            "@category": "thumbnail",
            "@height": "87",
            "@width": "219",
            "@_fa": "true",
            "$": "https://api.elsevier.com/content/object/eid/1-s2.0-S2468823119303268-gr10.sml?httpAccept=%2A%2F%2A",
            "@multimediatype": "GIF image file",
            "@type": "IMAGE-THUMBNAIL",
            "@size": "3536",
            "@ref": "gr10",
            "@mimetype": "image/gif"
          },
          {
            "@category": "thumbnail",
            "@height": "127",
            "@width": "219",
            "@_fa": "true",
            "$": "https://api.elsevier.com/content/object/eid/1-s2.0-S2468823119303268-gr11.sml?httpAccept=%2A%2F%2A",
            "@multimediatype": "GIF image file",
            "@type": "IMAGE-THUMBNAIL",
            "@size": "4539",
            "@ref": "gr11",
            "@mimetype": "image/gif"
          },
          {
            "@category": "thumbnail",
            "@height": "119",
            "@width": "219",
            "@_fa": "true",
            "$": "https://api.elsevier.com/content/object/eid/1-s2.0-S2468823119303268-gr12.sml?httpAccept=%2A%2F%2A",
            "@multimediatype": "GIF image file",
            "@type": "IMAGE-THUMBNAIL",
            "@size": "4814",
            "@ref": "gr12",
            "@mimetype": "image/gif"
          },
          {
            "@category": "thumbnail",
            "@height": "123",
            "@width": "219",
            "@_fa": "true",
            "$": "https://api.elsevier.com/content/object/eid/1-s2.0-S2468823119303268-gr2.sml?httpAccept=%2A%2F%2A",
            "@multimediatype": "GIF image file",
            "@type": "IMAGE-THUMBNAIL",
            "@size": "4925",
            "@ref": "gr2",
            "@mimetype": "image/gif"
          },
          {
            "@category": "thumbnail",
            "@height": "122",
            "@width": "219",
            "@_fa": "true",
            "$": "https://api.elsevier.com/content/object/eid/1-s2.0-S2468823119303268-gr3.sml?httpAccept=%2A%2F%2A",
            "@multimediatype": "GIF image file",
            "@type": "IMAGE-THUMBNAIL",
            "@size": "3742",
            "@ref": "gr3",
            "@mimetype": "image/gif"
          },
          {
            "@category": "thumbnail",
            "@height": "151",
            "@width": "219",
            "@_fa": "true",
            "$": "https://api.elsevier.com/content/object/eid/1-s2.0-S2468823119303268-gr4.sml?httpAccept=%2A%2F%2A",
            "@multimediatype": "GIF image file",
            "@type": "IMAGE-THUMBNAIL",
            "@size": "3941",
            "@ref": "gr4",
            "@mimetype": "image/gif"
          },
          {
            "@category": "thumbnail",
            "@height": "125",
            "@width": "219",
            "@_fa": "true",
            "$": "https://api.elsevier.com/content/object/eid/1-s2.0-S2468823119303268-gr5.sml?httpAccept=%2A%2F%2A",
            "@multimediatype": "GIF image file",
            "@type": "IMAGE-THUMBNAIL",
            "@size": "5708",
            "@ref": "gr5",
            "@mimetype": "image/gif"
          },
          {
            "@category": "thumbnail",
            "@height": "108",
            "@width": "219",
            "@_fa": "true",
            "$": "https://api.elsevier.com/content/object/eid/1-s2.0-S2468823119303268-gr6.sml?httpAccept=%2A%2F%2A",
            "@multimediatype": "GIF image file",
            "@type": "IMAGE-THUMBNAIL",
            "@size": "3744",
            "@ref": "gr6",
            "@mimetype": "image/gif"
          },
          {
            "@category": "thumbnail",
            "@height": "163",
            "@width": "144",
            "@_fa": "true",
            "$": "https://api.elsevier.com/content/object/eid/1-s2.0-S2468823119303268-gr7.sml?httpAccept=%2A%2F%2A",
            "@multimediatype": "GIF image file",
            "@type": "IMAGE-THUMBNAIL",
            "@size": "2845",
            "@ref": "gr7",
            "@mimetype": "image/gif"
          },
          {
            "@category": "thumbnail",
            "@height": "164",
            "@width": "174",
            "@_fa": "true",
            "$": "https://api.elsevier.com/content/object/eid/1-s2.0-S2468823119303268-gr8.sml?httpAccept=%2A%2F%2A",
            "@multimediatype": "GIF image file",
            "@type": "IMAGE-THUMBNAIL",
            "@size": "10938",
            "@ref": "gr8",
            "@mimetype": "image/gif"
          },
          {
            "@category": "thumbnail",
            "@height": "164",
            "@width": "188",
            "@_fa": "true",
            "$": "https://api.elsevier.com/content/object/eid/1-s2.0-S2468823119303268-gr9.sml?httpAccept=%2A%2F%2A",
            "@multimediatype": "GIF image file",
            "@type": "IMAGE-THUMBNAIL",
            "@size": "7719",
            "@ref": "gr9",
            "@mimetype": "image/gif"
          },
          {
            "@category": "thumbnail",
            "@height": "34",
            "@width": "219",
            "@_fa": "true",
            "$": "https://api.elsevier.com/content/object/eid/1-s2.0-S2468823119303268-sc1.sml?httpAccept=%2A%2F%2A",
            "@multimediatype": "GIF image file",
            "@type": "IMAGE-THUMBNAIL",
            "@size": "1642",
            "@ref": "sc1",
            "@mimetype": "image/gif"
          },
          {
            "@category": "thumbnail",
            "@height": "103",
            "@width": "219",
            "@_fa": "true",
            "$": "https://api.elsevier.com/content/object/eid/1-s2.0-S2468823119303268-sc2.sml?httpAccept=%2A%2F%2A",
            "@multimediatype": "GIF image file",
            "@type": "IMAGE-THUMBNAIL",
            "@size": "3983",
            "@ref": "sc2",
            "@mimetype": "image/gif"
          },
          {
            "@category": "standard",
            "@height": "29",
            "@width": "59",
            "@_fa": "true",
            "$": "https://api.elsevier.com/content/object/eid/1-s2.0-S2468823119303268-fx1.jpg?httpAccept=%2A%2F%2A",
            "@multimediatype": "JPEG image file",
            "@type": "IMAGE-DOWNSAMPLED",
            "@size": "1144",
            "@ref": "fx1",
            "@mimetype": "image/jpeg"
          },
          {
            "@category": "standard",
            "@height": "45",
            "@width": "70",
            "@_fa": "true",
            "$": "https://api.elsevier.com/content/object/eid/1-s2.0-S2468823119303268-fx10.jpg?httpAccept=%2A%2F%2A",
            "@multimediatype": "JPEG image file",
            "@type": "IMAGE-DOWNSAMPLED",
            "@size": "1547",
            "@ref": "fx10",
            "@mimetype": "image/jpeg"
          },
          {
            "@category": "standard",
            "@height": "47",
            "@width": "63",
            "@_fa": "true",
            "$": "https://api.elsevier.com/content/object/eid/1-s2.0-S2468823119303268-fx11.jpg?httpAccept=%2A%2F%2A",
            "@multimediatype": "JPEG image file",
            "@type": "IMAGE-DOWNSAMPLED",
            "@size": "1264",
            "@ref": "fx11",
            "@mimetype": "image/jpeg"
          },
          {
            "@category": "standard",
            "@height": "46",
            "@width": "73",
            "@_fa": "true",
            "$": "https://api.elsevier.com/content/object/eid/1-s2.0-S2468823119303268-fx12.jpg?httpAccept=%2A%2F%2A",
            "@multimediatype": "JPEG image file",
            "@type": "IMAGE-DOWNSAMPLED",
            "@size": "1574",
            "@ref": "fx12",
            "@mimetype": "image/jpeg"
          },
          {
            "@category": "standard",
            "@height": "33",
            "@width": "86",
            "@_fa": "true",
            "$": "https://api.elsevier.com/content/object/eid/1-s2.0-S2468823119303268-fx13.jpg?httpAccept=%2A%2F%2A",
            "@multimediatype": "JPEG image file",
            "@type": "IMAGE-DOWNSAMPLED",
            "@size": "1395",
            "@ref": "fx13",
            "@mimetype": "image/jpeg"
          },
          {
            "@category": "standard",
            "@height": "34",
            "@width": "93",
            "@_fa": "true",
            "$": "https://api.elsevier.com/content/object/eid/1-s2.0-S2468823119303268-fx14.jpg?httpAccept=%2A%2F%2A",
            "@multimediatype": "JPEG image file",
            "@type": "IMAGE-DOWNSAMPLED",
            "@size": "1673",
            "@ref": "fx14",
            "@mimetype": "image/jpeg"
          },
          {
            "@category": "standard",
            "@height": "33",
            "@width": "83",
            "@_fa": "true",
            "$": "https://api.elsevier.com/content/object/eid/1-s2.0-S2468823119303268-fx15.jpg?httpAccept=%2A%2F%2A",
            "@multimediatype": "JPEG image file",
            "@type": "IMAGE-DOWNSAMPLED",
            "@size": "1361",
            "@ref": "fx15",
            "@mimetype": "image/jpeg"
          },
          {
            "@category": "standard",
            "@height": "36",
            "@width": "96",
            "@_fa": "true",
            "$": "https://api.elsevier.com/content/object/eid/1-s2.0-S2468823119303268-fx16.jpg?httpAccept=%2A%2F%2A",
            "@multimediatype": "JPEG image file",
            "@type": "IMAGE-DOWNSAMPLED",
            "@size": "1693",
            "@ref": "fx16",
            "@mimetype": "image/jpeg"
          },
          {
            "@category": "standard",
            "@height": "47",
            "@width": "63",
            "@_fa": "true",
            "$": "https://api.elsevier.com/content/object/eid/1-s2.0-S2468823119303268-fx17.jpg?httpAccept=%2A%2F%2A",
            "@multimediatype": "JPEG image file",
            "@type": "IMAGE-DOWNSAMPLED",
            "@size": "1351",
            "@ref": "fx17",
            "@mimetype": "image/jpeg"
          },
          {
            "@category": "standard",
            "@height": "47",
            "@width": "75",
            "@_fa": "true",
            "$": "https://api.elsevier.com/content/object/eid/1-s2.0-S2468823119303268-fx18.jpg?httpAccept=%2A%2F%2A",
            "@multimediatype": "JPEG image file",
            "@type": "IMAGE-DOWNSAMPLED",
            "@size": "1741",
            "@ref": "fx18",
            "@mimetype": "image/jpeg"
          },
          {
            "@category": "standard",
            "@height": "31",
            "@width": "48",
            "@_fa": "true",
            "$": "https://api.elsevier.com/content/object/eid/1-s2.0-S2468823119303268-fx19.jpg?httpAccept=%2A%2F%2A",
            "@multimediatype": "JPEG image file",
            "@type": "IMAGE-DOWNSAMPLED",
            "@size": "895",
            "@ref": "fx19",
            "@mimetype": "image/jpeg"
          },
          {
            "@category": "standard",
            "@height": "33",
            "@width": "74",
            "@_fa": "true",
            "$": "https://api.elsevier.com/content/object/eid/1-s2.0-S2468823119303268-fx2.jpg?httpAccept=%2A%2F%2A",
            "@multimediatype": "JPEG image file",
            "@type": "IMAGE-DOWNSAMPLED",
            "@size": "1433",
            "@ref": "fx2",
            "@mimetype": "image/jpeg"
          },
          {
            "@category": "standard",
            "@height": "42",
            "@width": "55",
            "@_fa": "true",
            "$": "https://api.elsevier.com/content/object/eid/1-s2.0-S2468823119303268-fx20.jpg?httpAccept=%2A%2F%2A",
            "@multimediatype": "JPEG image file",
            "@type": "IMAGE-DOWNSAMPLED",
            "@size": "1137",
            "@ref": "fx20",
            "@mimetype": "image/jpeg"
          },
          {
            "@category": "standard",
            "@height": "33",
            "@width": "83",
            "@_fa": "true",
            "$": "https://api.elsevier.com/content/object/eid/1-s2.0-S2468823119303268-fx3.jpg?httpAccept=%2A%2F%2A",
            "@multimediatype": "JPEG image file",
            "@type": "IMAGE-DOWNSAMPLED",
            "@size": "1380",
            "@ref": "fx3",
            "@mimetype": "image/jpeg"
          },
          {
            "@category": "standard",
            "@height": "40",
            "@width": "91",
            "@_fa": "true",
            "$": "https://api.elsevier.com/content/object/eid/1-s2.0-S2468823119303268-fx4.jpg?httpAccept=%2A%2F%2A",
            "@multimediatype": "JPEG image file",
            "@type": "IMAGE-DOWNSAMPLED",
            "@size": "1526",
            "@ref": "fx4",
            "@mimetype": "image/jpeg"
          },
          {
            "@category": "standard",
            "@height": "31",
            "@width": "81",
            "@_fa": "true",
            "$": "https://api.elsevier.com/content/object/eid/1-s2.0-S2468823119303268-fx5.jpg?httpAccept=%2A%2F%2A",
            "@multimediatype": "JPEG image file",
            "@type": "IMAGE-DOWNSAMPLED",
            "@size": "1257",
            "@ref": "fx5",
            "@mimetype": "image/jpeg"
          },
          {
            "@category": "standard",
            "@height": "35",
            "@width": "93",
            "@_fa": "true",
            "$": "https://api.elsevier.com/content/object/eid/1-s2.0-S2468823119303268-fx6.jpg?httpAccept=%2A%2F%2A",
            "@multimediatype": "JPEG image file",
            "@type": "IMAGE-DOWNSAMPLED",
            "@size": "1685",
            "@ref": "fx6",
            "@mimetype": "image/jpeg"
          },
          {
            "@category": "standard",
            "@height": "32",
            "@width": "91",
            "@_fa": "true",
            "$": "https://api.elsevier.com/content/object/eid/1-s2.0-S2468823119303268-fx7.jpg?httpAccept=%2A%2F%2A",
            "@multimediatype": "JPEG image file",
            "@type": "IMAGE-DOWNSAMPLED",
            "@size": "1381",
            "@ref": "fx7",
            "@mimetype": "image/jpeg"
          },
          {
            "@category": "standard",
            "@height": "35",
            "@width": "101",
            "@_fa": "true",
            "$": "https://api.elsevier.com/content/object/eid/1-s2.0-S2468823119303268-fx8.jpg?httpAccept=%2A%2F%2A",
            "@multimediatype": "JPEG image file",
            "@type": "IMAGE-DOWNSAMPLED",
            "@size": "1752",
            "@ref": "fx8",
            "@mimetype": "image/jpeg"
          },
          {
            "@category": "standard",
            "@height": "48",
            "@width": "62",
            "@_fa": "true",
            "$": "https://api.elsevier.com/content/object/eid/1-s2.0-S2468823119303268-fx9.jpg?httpAccept=%2A%2F%2A",
            "@multimediatype": "JPEG image file",
            "@type": "IMAGE-DOWNSAMPLED",
            "@size": "1259",
            "@ref": "fx9",
            "@mimetype": "image/jpeg"
          },
          {
            "@category": "standard",
            "@height": "200",
            "@width": "336",
            "@_fa": "true",
            "$": "https://api.elsevier.com/content/object/eid/1-s2.0-S2468823119303268-ga1.jpg?httpAccept=%2A%2F%2A",
            "@multimediatype": "JPEG image file",
            "@type": "IMAGE-DOWNSAMPLED",
            "@size": "15772",
            "@ref": "ga1",
            "@mimetype": "image/jpeg"
          },
          {
            "@category": "standard",
            "@height": "262",
            "@width": "379",
            "@_fa": "true",
            "$": "https://api.elsevier.com/content/object/eid/1-s2.0-S2468823119303268-gr1.jpg?httpAccept=%2A%2F%2A",
            "@multimediatype": "JPEG image file",
            "@type": "IMAGE-DOWNSAMPLED",
            "@size": "9417",
            "@ref": "gr1",
            "@mimetype": "image/jpeg"
          },
          {
            "@category": "standard",
            "@height": "224",
            "@width": "567",
            "@_fa": "true",
            "$": "https://api.elsevier.com/content/object/eid/1-s2.0-S2468823119303268-gr10.jpg?httpAccept=%2A%2F%2A",
            "@multimediatype": "JPEG image file",
            "@type": "IMAGE-DOWNSAMPLED",
            "@size": "16822",
            "@ref": "gr10",
            "@mimetype": "image/jpeg"
          },
          {
            "@category": "standard",
            "@height": "220",
            "@width": "379",
            "@_fa": "true",
            "$": "https://api.elsevier.com/content/object/eid/1-s2.0-S2468823119303268-gr11.jpg?httpAccept=%2A%2F%2A",
            "@multimediatype": "JPEG image file",
            "@type": "IMAGE-DOWNSAMPLED",
            "@size": "11718",
            "@ref": "gr11",
            "@mimetype": "image/jpeg"
          },
          {
            "@category": "standard",
            "@height": "268",
            "@width": "492",
            "@_fa": "true",
            "$": "https://api.elsevier.com/content/object/eid/1-s2.0-S2468823119303268-gr12.jpg?httpAccept=%2A%2F%2A",
            "@multimediatype": "JPEG image file",
            "@type": "IMAGE-DOWNSAMPLED",
            "@size": "24336",
            "@ref": "gr12",
            "@mimetype": "image/jpeg"
          },
          {
            "@category": "standard",
            "@height": "277",
            "@width": "492",
            "@_fa": "true",
            "$": "https://api.elsevier.com/content/object/eid/1-s2.0-S2468823119303268-gr2.jpg?httpAccept=%2A%2F%2A",
            "@multimediatype": "JPEG image file",
            "@type": "IMAGE-DOWNSAMPLED",
            "@size": "25372",
            "@ref": "gr2",
            "@mimetype": "image/jpeg"
          },
          {
            "@category": "standard",
            "@height": "273",
            "@width": "492",
            "@_fa": "true",
            "$": "https://api.elsevier.com/content/object/eid/1-s2.0-S2468823119303268-gr3.jpg?httpAccept=%2A%2F%2A",
            "@multimediatype": "JPEG image file",
            "@type": "IMAGE-DOWNSAMPLED",
            "@size": "21346",
            "@ref": "gr3",
            "@mimetype": "image/jpeg"
          },
          {
            "@category": "standard",
            "@height": "261",
            "@width": "379",
            "@_fa": "true",
            "$": "https://api.elsevier.com/content/object/eid/1-s2.0-S2468823119303268-gr4.jpg?httpAccept=%2A%2F%2A",
            "@multimediatype": "JPEG image file",
            "@type": "IMAGE-DOWNSAMPLED",
            "@size": "10209",
            "@ref": "gr4",
            "@mimetype": "image/jpeg"
          },
          {
            "@category": "standard",
            "@height": "281",
            "@width": "492",
            "@_fa": "true",
            "$": "https://api.elsevier.com/content/object/eid/1-s2.0-S2468823119303268-gr5.jpg?httpAccept=%2A%2F%2A",
            "@multimediatype": "JPEG image file",
            "@type": "IMAGE-DOWNSAMPLED",
            "@size": "25033",
            "@ref": "gr5",
            "@mimetype": "image/jpeg"
          },
          {
            "@category": "standard",
            "@height": "242",
            "@width": "492",
            "@_fa": "true",
            "$": "https://api.elsevier.com/content/object/eid/1-s2.0-S2468823119303268-gr6.jpg?httpAccept=%2A%2F%2A",
            "@multimediatype": "JPEG image file",
            "@type": "IMAGE-DOWNSAMPLED",
            "@size": "18538",
            "@ref": "gr6",
            "@mimetype": "image/jpeg"
          },
          {
            "@category": "standard",
            "@height": "643",
            "@width": "567",
            "@_fa": "true",
            "$": "https://api.elsevier.com/content/object/eid/1-s2.0-S2468823119303268-gr7.jpg?httpAccept=%2A%2F%2A",
            "@multimediatype": "JPEG image file",
            "@type": "IMAGE-DOWNSAMPLED",
            "@size": "32944",
            "@ref": "gr7",
            "@mimetype": "image/jpeg"
          },
          {
            "@category": "standard",
            "@height": "533",
            "@width": "567",
            "@_fa": "true",
            "$": "https://api.elsevier.com/content/object/eid/1-s2.0-S2468823119303268-gr8.jpg?httpAccept=%2A%2F%2A",
            "@multimediatype": "JPEG image file",
            "@type": "IMAGE-DOWNSAMPLED",
            "@size": "54841",
            "@ref": "gr8",
            "@mimetype": "image/jpeg"
          },
          {
            "@category": "standard",
            "@height": "494",
            "@width": "567",
            "@_fa": "true",
            "$": "https://api.elsevier.com/content/object/eid/1-s2.0-S2468823119303268-gr9.jpg?httpAccept=%2A%2F%2A",
            "@multimediatype": "JPEG image file",
            "@type": "IMAGE-DOWNSAMPLED",
            "@size": "45264",
            "@ref": "gr9",
            "@mimetype": "image/jpeg"
          },
          {
            "@category": "standard",
            "@height": "87",
            "@width": "567",
            "@_fa": "true",
            "$": "https://api.elsevier.com/content/object/eid/1-s2.0-S2468823119303268-sc1.jpg?httpAccept=%2A%2F%2A",
            "@multimediatype": "JPEG image file",
            "@type": "IMAGE-DOWNSAMPLED",
            "@size": "9771",
            "@ref": "sc1",
            "@mimetype": "image/jpeg"
          },
          {
            "@category": "standard",
            "@height": "267",
            "@width": "567",
            "@_fa": "true",
            "$": "https://api.elsevier.com/content/object/eid/1-s2.0-S2468823119303268-sc2.jpg?httpAccept=%2A%2F%2A",
            "@multimediatype": "JPEG image file",
            "@type": "IMAGE-DOWNSAMPLED",
            "@size": "23362",
            "@ref": "sc2",
            "@mimetype": "image/jpeg"
          },
          {
            "@category": "standard",
            "@_fa": "true",
            "$": "https://api.elsevier.com/content/object/eid/1-s2.0-S2468823119303268-mmc1.doc?httpAccept=%2A%2F%2A",
            "@multimediatype": "Microsoft Word file",
            "@type": "APPLICATION",
            "@size": "167936",
            "@ref": "mmc1",
            "@mimetype": "application/word"
          },
          {
            "@category": "standard",
            "@_fa": "true",
            "$": "https://api.elsevier.com/content/object/eid/1-s2.0-S2468823119303268-am.pdf?httpAccept=%2A%2F%2A",
            "@multimediatype": "Acrobat PDF file",
            "@type": "AAM-PDF",
            "@size": "895478",
            "@ref": "am",
            "@mimetype": "application/pdf"
          }
        ]
      },
      "link": {
        "@rel": "abstract",
        "@href": "https://api.elsevier.com/content/abstract/scopus_id/85068224407"
      }
    }
  }
}