{
  "metadata": {
    "title": "Catalytic deep combustion characteristics of benzene over cobalt doped Mn-Ce solid solution catalysts at lower temperatures",
    "authors": "; ; ",
    "journal": "Molecular Catalysis",
    "date": "2018-02-28",
    "doi": "10.1016/j.mcat.2017.12.020",
    "abstract": "",
    "uri": "https://api.elsevier.com/content/article/pii/S2468823117306612",
    "pii": "S2468823117306612"
  },
  "fulltext": {
    "full-text-retrieval-response": {
      "scopus-eid": "2-s2.0-85041896882",
      "originalText": "serial JL 315758 291210 291744 291790 291809 31 Molecular Catalysis MOLECULARCATALYSIS 2018-01-04 2018-01-04 2018-01-04 2018-01-04 2020-06-13T11:57:25 1-s2.0-S2468823117306612 S2468-8231(17)30661-2 S2468823117306612 10.1016/j.mcat.2017.12.020 S300 S300.3 FULL-TEXT 1-s2.0-S2468823117X00205 2020-06-13T11:12:18.79378Z 0 0 20180201 20180228 2018 2018-01-04T11:56:49.834288Z absattachment articleinfo articletitlenorm authfirstinitialnorm authfirstsurnamenorm cid cids contenttype copyright crossmark dateloaded dateloadedtxt datesearch datesort dateupdated dco docsubtype doctype doi eid ewtransactionid hubeid indexeddate issn issnnorm itemstage itemtransactionid itemweight openaccess openarchive pg pgfirst pglast pii piinorm pubdateend pubdatestart pubdatetxt pubyr sectiontitle sortorder srctitle srctitlenorm srctype ssids alllist content subj subheadings suppl tomb volfirst volissue volumelist webpdf webpdfpagecount yearnav figure table e-component body mmlmath acknowledge affil appendices articletitle auth authfirstini authfull authkeywords authlast footnotes grantnumber grantsponsor highlightsabst primabst ref specialabst 2468-8231 24688231 true 446 446 C Volume 446 9 72 80 72 80 201802 February 2018 2018-02-01 2018-02-28 2018 Regular Papers article fla © 2017 Elsevier B.V. All rights reserved. CATALYTICDEEPCOMBUSTIONCHARACTERISTICSBENZENEOVERCOBALTDOPEDMNCESOLIDSOLUTIONCATALYSTSLOWERTEMPERATURES DENG L 1 Introduction 2 Experiment 2.1 Catalytic preparation 2.2 Characterization 2.3 Catalytic evaluation 3 Results and discussion 3.1 Characterization studies 3.2 Catalytic activity 4 Conclusions Acknowledgments Appendix A Supplementary data References TANG 2014 134 138 W SANG 2010 180 185 C ZHOU 2015 932 941 G HUANG 2013 124 129 Q LI 2014 2359 2363 B CARABINEIRO 2015 161 171 S ZHANG 2015 8446 P RAO 2007 1743 1747 T TANG 2006 265 273 X DELIMARIS 2008 303 312 D LIAO 2013 220 228 Y SHI 2010 336 342 L QI 2004 93 106 G ZOU 2010 468 477 Z VENKATASWAMY 2015 122 132 P WANG 2013 253 259 Z TANG 2014 1900 1910 W TODOROVA 2010 46 54 S TIAN 2012 125 134 Z AGUILERA 2011 144 150 D CASTANO 2015 48 59 M YAN 2013 561 565 X GOMEZ 2013 5645 5654 L ZHAO 2012 4774 4786 Z GUO 2008 19 26 Q GUO 2010 846 850 Q SUDARSANAM 2014 900 908 P LU 2015 102 107 H BENSALEM 1995 81 93 A WU 2007 430 435 X MENG 2013 491 500 B TANG 2006 119 125 X XU 2015 1648 1654 J GUAN 2011 12850 12863 B LU 2014 4186 4195 Y LORITE 2012 1443 1448 I SI 2015 14977 14980 W YANG 2015 4473 4480 Y SANTOS 2012 165 174 V YAN 2012 385 391 Q WU 2015 1888 1901 H WU 2011 188 195 H TIAN 2012 125 134 Z ZHANG 2013 509 516 C LI 2016 10275 10282 D BAI 2013 677 683 B TANG 2015 62 69 W MU 2008 1874 1877 Z CHEN 2011 12836 12841 C EINAGA 2010 629 634 H LI 2011 143 148 T WANG 2013 253 259 Z LI 2015 260 269 S CHEN 2016 15193 15201 Y WANG 2014 1475 1481 F DENGX2018X72 DENGX2018X72X80 DENGX2018X72XL DENGX2018X72X80XL © 2017 Elsevier B.V. All rights reserved. 2020-03-11T14:00:48.423Z http://vtw.elsevier.com/data/voc/AddOnTypes/50.7/nlp S2468823117306612 Project of Science and Technology Department of Jiangsu Province BE2016769 Priority Academic Program Development of Jiangsu Higher Education Institutions PAPD Priority Academic Program Development of Jiangsu Higher Education Institutions http://data.elsevier.com/vocabulary/SciValFunders/501100012246 http://sws.geonames.org/1814991/ Natural Science Foundation of the Jiangsu Higher Education Institutions of China 14KJB430014 Natural Science Research of Jiangsu Higher Education Institutions of China http://data.elsevier.com/vocabulary/SciValFunders/501100010023 http://sws.geonames.org/1814991/ Jiangsu Engineering Technology Research Center of Environmental Cleaning Materials KFK1503 PAPD PAPD Priority Academic Program Development of Jiangsu Higher Education Institutions http://data.elsevier.com/vocabulary/SciValFunders/501100012246 http://sws.geonames.org/1814991/ Natural Science Foundation of China 51172107 NSFC National Natural Science Foundation of China http://data.elsevier.com/vocabulary/SciValFunders/501100001809 http://sws.geonames.org/1814991/ This research is financially supported by Project of Science and Technology Department of Jiangsu Province ( BE2016769 ), the Natural Science Foundation of China (No. 51172107 ), Natural Science Foundation of the Jiangsu Higher Education Institutions of China (No. 14KJB430014 ), Open fund by Jiangsu Engineering Technology Research Center of Environmental Cleaning Materials ( KFK1503 ) and A Project Funded by the Priority Academic Program Development of Jiangsu Higher Education Institutions (PAPD) . item S2468-8231(17)30661-2 S2468823117306612 1-s2.0-S2468823117306612 10.1016/j.mcat.2017.12.020 315758 2020-06-13T11:12:18.79378Z 2018-02-01 2018-02-28 1-s2.0-S2468823117306612-main.pdf https://s3-eu-west-1.amazonaws.com/prod-ucs-content-store-eu-west/content/pii:S2468823117306612/MAIN/application/pdf/a0203ea7a94997204ea85ca9e2125b1e/main.pdf main.pdf pdf true 3229095 MAIN 9 1-s2.0-S2468823117306612-main_1.png https://s3-eu-west-1.amazonaws.com/prod-ucs-content-store-eu-west/content/pii:S2468823117306612/PREVIEW/image/png/f09a8b145a3e0bf738bf21d0e5d5cf69/main_1.png main_1.png png 58343 849 656 IMAGE-WEB-PDF 1 1-s2.0-S2468823117306612-fx1.jpg https://s3-eu-west-1.amazonaws.com/prod-ucs-content-store-eu-west/content/pii:S2468823117306612/fx1/DOWNSAMPLED/image/jpeg/e048c0afce4aa4f34384e530428d102c/fx1.jpg fx1 true fx1.jpg jpg 16388 199 258 IMAGE-DOWNSAMPLED 1-s2.0-S2468823117306612-gr1.jpg https://s3-eu-west-1.amazonaws.com/prod-ucs-content-store-eu-west/content/pii:S2468823117306612/gr1/DOWNSAMPLED/image/jpeg/d55d556914d5cb8b1a6d079a12a6b666/gr1.jpg gr1 gr1.jpg jpg 47492 275 527 IMAGE-DOWNSAMPLED 1-s2.0-S2468823117306612-gr10.jpg https://s3-eu-west-1.amazonaws.com/prod-ucs-content-store-eu-west/content/pii:S2468823117306612/gr10/DOWNSAMPLED/image/jpeg/c225f21c8fe8547d5c1d383e4b9f131d/gr10.jpg gr10 gr10.jpg jpg 23783 309 376 IMAGE-DOWNSAMPLED 1-s2.0-S2468823117306612-gr2.jpg https://s3-eu-west-1.amazonaws.com/prod-ucs-content-store-eu-west/content/pii:S2468823117306612/gr2/DOWNSAMPLED/image/jpeg/cf54361dcabfd35adc8c91a4c05d885e/gr2.jpg gr2 gr2.jpg jpg 40629 306 376 IMAGE-DOWNSAMPLED 1-s2.0-S2468823117306612-gr3.jpg https://s3-eu-west-1.amazonaws.com/prod-ucs-content-store-eu-west/content/pii:S2468823117306612/gr3/DOWNSAMPLED/image/jpeg/49a6f6502871cbe7458be7b50561acfd/gr3.jpg gr3 gr3.jpg jpg 24781 291 376 IMAGE-DOWNSAMPLED 1-s2.0-S2468823117306612-gr4.jpg https://s3-eu-west-1.amazonaws.com/prod-ucs-content-store-eu-west/content/pii:S2468823117306612/gr4/DOWNSAMPLED/image/jpeg/97130c30f0e20855b8c59370884fac58/gr4.jpg gr4 gr4.jpg jpg 27063 295 376 IMAGE-DOWNSAMPLED 1-s2.0-S2468823117306612-gr5.jpg https://s3-eu-west-1.amazonaws.com/prod-ucs-content-store-eu-west/content/pii:S2468823117306612/gr5/DOWNSAMPLED/image/jpeg/9472ce57fcd0715a3a91215f84a7cdb3/gr5.jpg gr5 gr5.jpg jpg 107584 626 678 IMAGE-DOWNSAMPLED 1-s2.0-S2468823117306612-gr6.jpg https://s3-eu-west-1.amazonaws.com/prod-ucs-content-store-eu-west/content/pii:S2468823117306612/gr6/DOWNSAMPLED/image/jpeg/c9045de9176e32601216ccbc2b3f1335/gr6.jpg gr6 gr6.jpg jpg 22746 290 376 IMAGE-DOWNSAMPLED 1-s2.0-S2468823117306612-gr7.jpg https://s3-eu-west-1.amazonaws.com/prod-ucs-content-store-eu-west/content/pii:S2468823117306612/gr7/DOWNSAMPLED/image/jpeg/d02dc2385c18d384d47c62d01f7e0d14/gr7.jpg gr7 gr7.jpg jpg 50618 428 376 IMAGE-DOWNSAMPLED 1-s2.0-S2468823117306612-gr8.jpg https://s3-eu-west-1.amazonaws.com/prod-ucs-content-store-eu-west/content/pii:S2468823117306612/gr8/DOWNSAMPLED/image/jpeg/3e72c59165d365eaf3d2cbb933596ccd/gr8.jpg gr8 gr8.jpg jpg 28021 307 376 IMAGE-DOWNSAMPLED 1-s2.0-S2468823117306612-gr9.jpg https://s3-eu-west-1.amazonaws.com/prod-ucs-content-store-eu-west/content/pii:S2468823117306612/gr9/DOWNSAMPLED/image/jpeg/97726bbc507a9a590b399205270ad500/gr9.jpg gr9 gr9.jpg jpg 37306 325 489 IMAGE-DOWNSAMPLED 1-s2.0-S2468823117306612-fx1.sml https://s3-eu-west-1.amazonaws.com/prod-ucs-content-store-eu-west/content/pii:S2468823117306612/fx1/THUMBNAIL/image/gif/6818c06df23516be2fda0c1e0ac174c0/fx1.sml fx1 true fx1.sml sml 15754 164 212 IMAGE-THUMBNAIL 1-s2.0-S2468823117306612-gr1.sml https://s3-eu-west-1.amazonaws.com/prod-ucs-content-store-eu-west/content/pii:S2468823117306612/gr1/THUMBNAIL/image/gif/d7f951ee8327e6a52d8f97d00f3e1f20/gr1.sml gr1 gr1.sml sml 11746 114 219 IMAGE-THUMBNAIL 1-s2.0-S2468823117306612-gr10.sml https://s3-eu-west-1.amazonaws.com/prod-ucs-content-store-eu-west/content/pii:S2468823117306612/gr10/THUMBNAIL/image/gif/5b00ff4319c204254cab7e3f30792e0a/gr10.sml gr10 gr10.sml sml 6232 164 199 IMAGE-THUMBNAIL 1-s2.0-S2468823117306612-gr2.sml https://s3-eu-west-1.amazonaws.com/prod-ucs-content-store-eu-west/content/pii:S2468823117306612/gr2/THUMBNAIL/image/gif/725db2566c352bd261aaf67493805072/gr2.sml gr2 gr2.sml sml 14252 164 201 IMAGE-THUMBNAIL 1-s2.0-S2468823117306612-gr3.sml https://s3-eu-west-1.amazonaws.com/prod-ucs-content-store-eu-west/content/pii:S2468823117306612/gr3/THUMBNAIL/image/gif/90e626500fee41190a8058eb9dba22fc/gr3.sml gr3 gr3.sml sml 6807 164 212 IMAGE-THUMBNAIL 1-s2.0-S2468823117306612-gr4.sml https://s3-eu-west-1.amazonaws.com/prod-ucs-content-store-eu-west/content/pii:S2468823117306612/gr4/THUMBNAIL/image/gif/91b1c853165c03b9157890d8efda10ff/gr4.sml gr4 gr4.sml sml 8257 164 209 IMAGE-THUMBNAIL 1-s2.0-S2468823117306612-gr5.sml https://s3-eu-west-1.amazonaws.com/prod-ucs-content-store-eu-west/content/pii:S2468823117306612/gr5/THUMBNAIL/image/gif/8b512697c52465c62098a39707b42e3e/gr5.sml gr5 gr5.sml sml 13067 164 177 IMAGE-THUMBNAIL 1-s2.0-S2468823117306612-gr6.sml https://s3-eu-west-1.amazonaws.com/prod-ucs-content-store-eu-west/content/pii:S2468823117306612/gr6/THUMBNAIL/image/gif/9e231c2d231e0c0ef7930a1c513388c1/gr6.sml gr6 gr6.sml sml 6641 164 212 IMAGE-THUMBNAIL 1-s2.0-S2468823117306612-gr7.sml https://s3-eu-west-1.amazonaws.com/prod-ucs-content-store-eu-west/content/pii:S2468823117306612/gr7/THUMBNAIL/image/gif/12b0dabdf59b821e8dab00157889e7f7/gr7.sml gr7 gr7.sml sml 14026 164 144 IMAGE-THUMBNAIL 1-s2.0-S2468823117306612-gr8.sml https://s3-eu-west-1.amazonaws.com/prod-ucs-content-store-eu-west/content/pii:S2468823117306612/gr8/THUMBNAIL/image/gif/a6468044a18bf296865cd3be590792b6/gr8.sml gr8 gr8.sml sml 10754 164 200 IMAGE-THUMBNAIL 1-s2.0-S2468823117306612-gr9.sml https://s3-eu-west-1.amazonaws.com/prod-ucs-content-store-eu-west/content/pii:S2468823117306612/gr9/THUMBNAIL/image/gif/0b95c02d275cd7f1ca7d58fd9d52b36d/gr9.sml gr9 gr9.sml sml 7545 146 219 IMAGE-THUMBNAIL 1-s2.0-S2468823117306612-mmc1.docx https://s3-eu-west-1.amazonaws.com/prod-ucs-content-store-eu-west/content/pii:S2468823117306612/mmc1/MAIN/application/vnd.openxmlformats-officedocument.wordprocessingml.document/59a4152ebd00a6e1c79eadc5bb6b539f/mmc1.docx mmc1 mmc1.docx docx 1153608 APPLICATION 1-s2.0-S2468823117306612-si1.gif https://s3-eu-west-1.amazonaws.com/prod-ucs-content-store-eu-west/content/pii:S2468823117306612/STRIPIN/image/gif/6b2606b7a5750a3020137d2d15720b3d/si1.gif si1 si1.gif gif 889 30 183 ALTIMG 1-s2.0-S2468823117306612-si2.gif https://s3-eu-west-1.amazonaws.com/prod-ucs-content-store-eu-west/content/pii:S2468823117306612/STRIPIN/image/gif/0e388944fc8af31bd7b89a8600a014aa/si2.gif si2 si2.gif gif 363 25 82 ALTIMG 1-s2.0-S2468823117306612-si3.gif https://s3-eu-west-1.amazonaws.com/prod-ucs-content-store-eu-west/content/pii:S2468823117306612/STRIPIN/image/gif/0c079541bfeb3915a7f0a7052e1b70a5/si3.gif si3 si3.gif gif 202 16 27 ALTIMG 1-s2.0-S2468823117306612-si4.gif https://s3-eu-west-1.amazonaws.com/prod-ucs-content-store-eu-west/content/pii:S2468823117306612/STRIPIN/image/gif/d02c74290963fbe2321a56cb130f35b1/si4.gif si4 si4.gif gif 179 18 18 ALTIMG MCAT 427 S2468-8231(17)30661-2 10.1016/j.mcat.2017.12.020 Elsevier B.V. Fig. 1 Wide-angle(a) and low-angle(b) XRD patterns of pure CeO2 and CMC-R (R = 0, 0.25, 0.5, 0.75, 1). Fig. 1 Fig. 2 The nitrogen adsorption-desorption isotherms and BJH pore size distributions of the as-synthesized CMC-R (R = 0, 0.25, 0.5, 0.75, 1). Fig. 2 Fig. 3 H2-TPR profiles of the CMC-R (R = 0, 0.25, 0.5, 0.75, 1). Fig. 3 Fig. 4 Raman spectra of the CMC-R (R = 0, 0.25, 0.5, 0.75, 1). Fig. 4 Fig. 5 XPS spectra of (a) Ce 3d, (b) Mn 2p (c) Co 2p3/2 and O 1 s (d) for CMC-0.25 and CMC-0 samples. Fig. 5 Fig. 6 O2-TPD patterns of CMC-0.25 and CMC-0 samples. Fig. 6 Fig. 7 TEM and HRTEM images (a–c) of the CMC-0.25 catalyst. The inset is the FFT diffractogram of the corresponding TEM image. Fig. 7 Fig. 8 Catalytic performance of catalysts CMC-R (R = 0, 0.25, 0.5, 0.75, 1). Fig. 8 Fig. 9 Stability and CO2 selectivity of CMC-0.25 catalyst for benzene oxidation at varied temperatures. Fig. 9 Fig. 10 The effect of water vapor with different concentrations (1.5% and 8.0%) on catalytic activity over the CMC-0.25 catalyst at 250 °C. Fig. 10 Table 1 BET surface area (SBET), pore volume (Vp), average pore size (DP), average crystallite size (DC), lattice parameter (LP) and reaction rates based on catalyst surface area (RS ). Table 1 Sample SBET(m2/g) Vp (cm3/g) DP (nm) DC (nm) a LP(Å) b RS at 220 °C(mmol/m2 h−1) c CeO2 39.78 0.12 12.87 10.84 5.4108 / CMC-0 50.19 0.13 10.23 6.72 5.4005 4.567 × 10−3 CMC-0.25 68.47 0.13 7.54 6.03 5.3916 7.811 × 10−3 CMC-0.5 55.51 0.15 10.72 7.05 5.4029 6.737 × 10−3 CMC-0.75 59.95 0.09 5.71 8.76 5.3963 3.615 × 10−3 CMC-1 51.57 0.08 6.12 9.82 5.3996 3.353 × 10−3 a The values of the average crystallite size of CeO2, as calculated using Scherrer’s equation. b Calculated from the CeO2 crystallographic phase. c According to Eq.: R S ( mmol m − 2 h − 1 ) = η Q C f M S B E T where η is the benzene conversion, Q is the volumetric flow rate(ml/min), Cf is the feed concentration of benzene(ppm), M is the weight of the catalysts (g), SBET is the BET surface area of the catalyst (m2/g). Table 2 XPS data of CMC-0 and CMC-0.25 samples. Table 2 Sample Co/(Mn + Co) molar ratio Mn4+/(Mn3+ + Mn2+)molar ratio Ce3+/Ce4+ molar ratio Oβ/Oα molar ratio CMC-0 0 0.34 0.06 1.3 CMC-0.25 0.29 0.17 0.13 1.9 Table 3 Main data of research papers on benzene over the noble-metal-free catalysts. Table 3 Catalysts concentration (ppm) SV(mL g−1 h−1) Conversion of T50 (°C) Conversion of T90 (°C) Refs. Mn-Ce-HL 1000 60000 225 260 [47] Co/CeO2/SBA-15 1000 39600 240 260 [48] Ce0.5Zr0.5O2 2000 155,000 ∼230 300 [49] LaMnO3 1000 60,000 ∼260 ∼320 [50] 7%CuO/Ce0.7Mn0.3O2 1000 120000 175 260–265 [51] Ce0.3Mn0.7 1000 60000 ∼270 ∼340 [52] Cu0.5Co2.5AlO 1000 60,000 ∼250 290 [53] La-Cu-Co-O/cordierite 1500 20000 h−1 275 400 [54] Ti-doped MnO2 1000 60000 217 ∼250 [45] CMC-0.25 1000 90000 235 247 This work Catalytic deep combustion characteristics of benzene over cobalt doped Mn-Ce solid solution catalysts at lower temperatures Lei Deng a b 1 Yaping Ding a b 1 Baoqing Duan a b Yingwen Chen a c ⁎ Peiwen Li d Shemin Zhu a Shubao Shen a a State Key Laboratory of Materials-Oriented Chemical Engineering, Nanjing Tech University, Nanjing 210009, China State Key Laboratory of Materials-Oriented Chemical Engineering Nanjing Tech University Nanjing 210009 China b Jiangsu Collaborative Innovation Center For Advanced Inorganic Function Composites, Nanjing 210009, China Jiangsu Collaborative Innovation Center For Advanced Inorganic Function Composites Nanjing 210009 China c Jiangsu Collaborative Innovation Center of Atmospheric Environment and Equipment Technology (CICAEET), Nanjing University of Information Science & Technology, Jiangsu Engineering Technology Research Center of Environmental Cleaning Materials (ECM), Nanjing 210044, China Jiangsu Collaborative Innovation Center of Atmospheric Environment and Equipment Technology (CICAEET) Nanjing University of Information Science & Technology Jiangsu Engineering Technology Research Center of Environmental Cleaning Materials (ECM) Nanjing 210044 China d Department of Aerospace and Mechanical Engineering, the University of Arizona, Tucson, AZ 85721, USA Department of Aerospace and Mechanical EngineeringDepartment of Aerospace and Mechanical Engineering the University of Arizona Tucson AZ 85721 USA ⁎ Corresponding author at: State Key Laboratory of Materials-Oriented Chemical Engineering, College of Biotechnology and Pharmaceutical Engineering, Nanjing Tech University, Address: No. 5 XinMoFan Road, Nanjing 210009, China. State Key Laboratory of Materials-Oriented Chemical Engineering Nanjing Tech University Nanjing 210009 China 1 These authors contributed equally to the present study. Graphical abstract In this paper, CoxMn1−xCeOδ mixed oxides were synthesized using a co-precipitation method. The catalyst’s performance for the benzene combustion reaction was evaluated, and Co0.25Mn0.75CeOδ (CMC-0.25) exhibited good catalytic activity, stability and CO2 selectivity. The prepared catalysts were characterized and analyzed completely by XRD, BET, Raman, TEM and HRTEM, XPS, H2-TPR, and O2-TPD. The results demonstrated that a solid solution was formed with more active oxygen induced by Co doping. Strong interaction effects among Co-Mn-Ce-O were speculated as the main mechanisms underlying the high-efficiency catalytic capacity. The prepared Co-doped Mn-Ce mixed oxides catalyst may be a potential low-cost catalyst alternative to replace industrial noble metal catalysts. Keywords CoxMn1−xCeOδ Combustion reaction Solid solution Active oxygen Low-cost catalyst 1 Introduction Volatile organic compounds (VOCs) are an unfortunate by-product of rapid industrialization, especially in petrochemistry, the coating and printing industry, medicine and the detergent industry. Strict standards and legislations have been established to control the emission of VOCs because of their contributions to ozone generation and photochemical smog, as well as their harmful properties that can be toxic, mutagenic, malodorous, or carcinogenic [1]. Meanwhile, many treatment techniques such as activated carbon, absorption, non-thermal plasmas, biotricking filter and direct combustion have been adopted to remove them. In recent decades, catalytic combustion has been considered as an ideal way for VOCs to be removed due to its low working temperature, smaller resource consumption, high carbonization efficiency and lack of additional pollution [2]. The development of a high-performance catalyst has attracted significant attention due to its key role in the catalytic oxidation system [3]. In the removal of VOCs, supported noble metals and transition metal oxides catalysts have been commonly studied. From the standpoint of low temperature catalysis for the oxidation of VOCs, supported noble metals catalysts have gained increased research interest [1,4]. However, due to the high cost, poor stability at higher temperature and lower resistance to poisoning, more general applications of precious metal catalysts have been limited [5]. Although transition metal oxides catalysts are lower cost, have a long lifetime and a high resistance to poisoning, they generally are less active than the supported noble metal in purifying VOCs [6]. This conflict has sparked research interest in hybrid oxide catalysts [7]. Recently, MnOx-CeO2 solid solution catalysts [8–12] that possess high oxygen storage capacity (OSC) and multiple valences have exhibited superior performance in various catalytic reactions, such as ammonia oxidation, catalytic reduction of NO by SCR with NH3 in the presence of oxygen [13] and NOx decomposition. Furthermore, MnOx-CeO2 was also found to be highly active in the combustion of CO and VOCs at lower operational temperatures; this result was directly theorized to be caused by the strong interaction effect of MnOx-CeO2 and more reactive oxygen types (O2 −, O2 2− and O−) at the interface between the MnOx and CeO2 lattice [7,14]. Venkataswamy et al. [15] produced a material that demonstrated extraordinary improvement in CO oxidation activity by manganese doped ceria solid solutions. Zhen Wang, et al. [16] also reported that CeO2-MnOx composites exhibited much higher catalytic activity for benzene oxidation, and they attributed this result to a balance in the lattice oxygen atoms between catalytic oxidation and reduction. Cobalt oxides have been widely investigated as catalysts, and Co3O4 has been of particular interest as a p-type semiconductor containing lots of electron deficiencies [17–21] that facilitate oxygen adsorption, because electrons can be transferred from the metal cations easily to form activated species [5]. More recently, Shen and his co-workers [22] synthesized a series of Mn-site partially substituted LaCoxMn1−xO3(x = 0–0.5) catalysts by using an impregnation method with citrate; these catalysts possessed high-valence Mn-site cations and large lattice oxygen content. This catalyst shows obvious advantages in contrast to LaMnO3. They found that doping of Co2+ not only leads to lattice defects in LaMnO3 but also causes distortion in the surface lattice and consequently increases surface energy, which has an appreciable effect on the adsorption ability of the catalyst. In another work [23], Mn-Co-Ce mixed oxides were synthesized, and researchers found that the formation of (Mn,Co)3O4 mixed spinels have remarkable performance for CO preferential oxidation(COPROX). Zhao and co-workers added Co3O4 to CexMn1−xO2 composites to accelerate the COPROX reaction [24]. Guo et al. investigated high Co doping in Co-Mn-Ce mixed oxides and observed good efficiency in CO conversion [25,26]. Based on this background, we, therefore, found it was possible to synthesize Co-doped MnOx-CeO2 catalysts for deep catalytic combustion of VOCs, and these results have great potential for developing noble-metal-free catalysts. In this study, we synthesized a series of Co-doped Mn-Ce (CoxMn1−xCeOδ x = 0–1) catalysts using a co-precipitation method by regulating the Co/(Mn + Co) molar ratio. To produce the most active catalyst, we evaluated the performance of all samples for the total combustion of the typical VOC benzene. Furthermore, the stability and water-resistant of the high-performance catalyst were also investigated at different temperatures for more than 3600 min in the benzene combustion reaction. The techniques of X-ray diffraction (XRD), Brunauer-Emmett-Teller (BET), transmission electron microscopy (TEM), H2 temperature programmed (H2-TPR), O2 temperature-programmed desorption (O2-TPD), high-resolution transmission electron microscopy (HRTEM), Raman spectroscopy, and X-ray photoelectron spectroscopy (XPS) were employed to investigate Co-doped Mn-Ce catalytic performance, the formation of Co-Mn-Ce-O solid solution and the relationships among these properties in the benzene catalytic combustion reaction. 2 Experiment 2.1 Catalytic preparation A series of CoxMn1−xCeOδ catalysts were prepared by a co-precipitation method, The desired amounts solutions of the following nitrates were used: Co(NO3)2·6H2O, Mn(CH3COO)2·4H2O, Ce(NO3)2·6H2O acting as hydrate precursors. Firstly, stoichiometric amount of the precursors were dissolved in deionized water and added dropwise into aqueous ammonia solution (pH = 9.5–10.5) with stirring at room temperature for 12 h. Then, the obtained precipitate was filtered off and repeatedly washed with deionized water until the pH reached 7.0. Finally, the powders were dried at 105 °C for 6 h and further calcined in air at 500 °C for 8 h with a heating rate of 5 °C min−1. Ultimately, the CoxMn1−xCeOδ catalysts were obtained. The synthesized catalysts were designated as CMC-R, where R represents the molar ratio of Co/(Mn + Co) and (Mn + Co)/Ce = 1. 2.2 Characterization To identify the crystal structures of the as-prepared catalysts, XRD was applied in an AXS D8 advance diffractometer equipped with a graphite monochromatic and Cu Kα radiation source(0.15418 nm). The diffraction scattering angle (2θ) was set from 5 to 80° using a scan rate of 0.02° min−1. H2-TPR experiments using an Autochem 2920 (Micromeritics, USA) provided the automated catalyst characterization system. In these tests, 50 mg of the purged samples were used under a flow of a mixture gas (5% H2/Ar, 25 ml/min) with a heating ramp of 10 °C min−1 from room temperature to 700 °C. The Raman spectra of the samples were measured using a DXR532 Laser Raman spectrometer equipped with a 532 nm laser as an excitation and 10 mW laser power. The XPS patterns were operated on a PHI-5000C ESCA system (upgraded by RBD company, America) using a dual Mg/Al Kα anode at 250 W and running at 14KV with a pressure range of 10−8 Torr. Charging of the catalyst samples was corrected by setting the binding energy of adventitious carbon (C1s) to 284.5 eV. The surface area and pore size distribution measurements were carried out on an ASAP 2020 by N2 adsorption-desorption isotherms at liquid nitrogen (−196 °C) using the BET and Barrett-Joyner-Halenda (BJH) methods. Prior to runtime analyses, the samples were previously degassed at 350 °C for 4 h. The O2-TPD was also tested on an Autochem 2920 (Micromeritics, USA), and the samples were pre-treated at 150 °C under Ar flow. The samples were then treated with 30 ml/min of mixture gas (5% O2, 95% Ar) for 2 h at room temperature and then heated up to 800 °C at a rate of 10 °C min−1. The TEM and HRTEM studies were carried out on a JEOL-2010 microscope at a voltage of 200 kV. 2.3 Catalytic evaluation The catalytic deep combustion of benzene was carried out in an experimental system with a continuous-flow fixed bed to allow for efficient data acquisition and activity evaluation under atmospheric pressure. Approximately 500 mg of catalyst (40–60 mesh) was loaded in the middle of the quartz tube (i.d. 7 mm) and placed inside a temperature-controlled thermocouple furnace with a temperature range from 150 °C to 300 °C. The reactant gas was composed of 1000 ppm benzene and air with a WHSV of 90,000 ml g−1 h−1. The inlet and outlet gases were analyzed using an on-line gas chromatograph (Shimazu GC-2014) equipped with a flame ionization detector (FID) and a thermal conductivity detector (TCD) to determine gas compositions. In addition, so as ensure the accuracy of the data purification, each tested temperature was kept constant for approximately 30 min. Selectivity of CO2 was obtained by the following equation: Y CO 2 = F CO 2 ν F VOC where F CO 2 is the outlet molar flow-rate of CO2, and ν is the number of carbon atoms in the VOC molecule (for benzene, ν = 6) and FVOC in is the inlet molar flow-rate of VOC. 3 Results and discussion 3.1 Characterization studies The XRD patterns in the 2θ range of 10–80° are shown in Fig. 1 a for the ceria-based catalysts with different Co/(Mn + Co) atomic ratios. The CMC-0 sample shows a typical cubic fluorite phase of ceria (JCDS 43–1002) and no manganese oxides, such as MnO2, Mn2O3 or other oxide phases. This notable result suggests that Mn ions are possibly substituted for Ce4+ in a fluorite lattice and form a solid solution in the manganese-doped ceria-based samples [27,28]. This suggestion is validated by the decrease in the lattice parameter from 5.4108 Å (for pure CeO2) to 5.4005 Å that is observed on the only Mn-doped ceria catalysts due to the smaller ionic radius of Mnn+ (Mn2+ = 0.081 nm, Mn3+ = 0.072 nm, Mn4+ = 0.067 nm) compared to Ce4+. The diffraction peaks of the CMC-R (R = 0.5, 0.75, 1) catalysts mainly are from the Co3O4 spinel (JCDS 43–1003) and CeO2 phases, which correspond to those found for the single oxides. In contrast, the XRD pattern of the CMC-0.25 catalyst does not show any diffraction by cobalt oxides, and only cubic fluorite structures of CeO2 are observed. This result indicates that the doping of Con+(Co2+ = 0.079 nm, Co3+ = 0.068 nm) ions into the ceria lattice in place of manganese decreases the lattice parameter. There are three kinds of cobalt oxides species likely to be present in the CMC-0.25 samples; (i) highly dispersed CoOx on the surface of MnOx-CeO2, (ii) an amorphous phase and (iii) Co ions dispersed into the ceria lattice in place of Mn ions [15,29]. In addition, compared with CMC-0, the lattice parameter of ceria in CMC-0.25 catalysts exhibits a clear shrinkage along the α axis (from 5.4005 Å to 5.3916 Å), and the diffraction peaks of CeO2 are slightly shifted towards higher values of the Bragg angle for the (111) peak (Fig. 1b). These distinct features indicate that the Mn and Co ions are incorporated into the cubic lattice and form a Co-Mn-CeOδ solid solution. However, the diffraction pattern of the CMC-0.5 catalyst indicates that crystallization of Co3O4 occurred, and this result may be due to phase separation of Co-Mn-CeOδ solid solutions. Co is dispersed in the cubic phase of ceria and also occurred in an individual cubic Co3O4 phase at 2θ = 36.85, 59.35, as shown in Fig. 1a. The weak diffraction peaks of Co3O4 show that the Co3O4 content exceeds the maximum saturated solution of the CeO2 crystal lattice in the catalysts and leads to the formation of a Co3O4 crystal phase in the sample during the calcination process. The experimental results indicate that the phase composition of CoxMn1−xCeOδ oxides strongly depends on the molar ratios of manganese and cobalt oxides. The porous structures of CMC-R samples are further investigated by nitrogen sorption measurements. The N2 adsorption-desorption isotherms and pore-size distributions are displayed in Fig. 2 , and their surface area, pore volume and pore size are summarized in Table 1 . It can been clearly seen that all of the samples showed distorted type-II isotherms with a type H3 hysteresis loop in the relative pressure (p/p0) range of 0.4-0.98. As shown in Table 1, we found that the CMC-0.25 material possessed a larger surface area than CMC-0 and CMC-1; this result suggests that cobalt doping is beneficial for increasing the surface area. To check the redox properties of the new series of CMC-R catalysts, H2-TPR experiments were performed. In Fig. 3 , the reduction curves of all samples are shown. Similar to previous findings [16], CMC-0 solid solution exhibits two overlapped strong reduction peaks at ∼250 and 335 °C, respectively. This observation is the typical characteristic of a two-step reduction of Mn2O3. The low temperature peak is attributed to the reducible manganese species corresponding with the reduction of MnO2 to Mn3O4, and the high temperature peak corresponds to the reduction of Mn3O4 to MnO when the surface capping oxygen of CeO2 is reduced [14,30]. The H2-TPR profile of the CMC-1 oxide shows two reduction peaks at approximately 320 and 360 °C, and this result is also due to a two-step process. The low temperature peak is due to the reduction of Co3O4 to CoO, and the high temperature reduction peak is results from the further reduction of CoO to metallic cobalt along with partial surface Ce4+ reduction [31]. It is noteworthy that the reduction profiles were more complicated as more Co was added into the ceria lattice of the CMC-0 solid solution, and the reduction behaviors of these oxides were dependent on the atomic ratio of Co/(Mn + Co). Accordingly, the increase in reduction temperatures may be attributed to the segregation of Co3O4 and the solid solution at the atomic ratio R > 0.5. As we show, CMC-0.25 displays a lower reduction temperature from other CMC oxides, and three continuous peaks (230, 286, 328 °C) over the temperature range 200–350 °C are clearly detected. This result is attributed to the interaction between MnCeO and CoO of the solid solution. Meanwhile, a peak corresponding to the reduction of CeO2 is also found. Furthermore, the formation of the CMC-0.25 solid solution facilitates the mobility of oxygen species from the bulk to the surface and creates more active sites for the adsorption of hydrogen [32]. Based on these observations, we conclude that Co ion doping in the CMC-0 solid solution can result in a better catalyst for benzene oxidation. The Raman spectra of CMC-R samples are shown in Fig. 4 . The bi-component Mn-Ce shows a single peak at 461 cm−1 that is attributed to the formation of the Mn-Ce-O solid solution. This band exhibited a significantly shift compared with the triply degenerate F 2g (465 cm−1) band of pure CeO2 from previous literature [33]. The CMC-0.25 sample exhibited widening and a slight shift to a lower wavenumber for the F2g band with respect to the CMC-0 spectrum. This may be due to the formation of oxygen vacancies and also suggests the formation of the CMC-0.25 solid solution. As the content of cobalt incorporation increases and manganese decreases, three new bands appear approximately 195 cm−1, 519 cm−1, 687 cm−1 in the CMC-0.5 sample that can be assigned to the Co-O-Co Raman-activated modes of Co3O4 [25]. Furthermore, in the CMC-0.75 spectrum, the intensity of the F 2g band decreased. In contrast, the intensity of the signals of Co3O4 increased, and two new peaks of Co3O4 (at 475 cm−1, 612 cm−1) also are observed. For CMC-1, a material with a spectrum similar to the spectra for the CMC-0.75 system, six distinct modes appear. The F 2g band of CeO2 (∼462 cm−1) and five Raman-active modes (A1g + Eg + 3F2g) of spinel Co3O4 [34,35]. Three bands at 195, 519, 621 cm−1 can be assigned to the F2g mode, whereas the Raman modes at 687 and 484 cm−1 have respective sym-metries of A1g and Eg, and attributed to the octahedral sites [CoO6] in the O h 7 symmetry and the vibration of octahedral site [19]. In order to study the oxidation state and composition of catalyst surface species, XPS spectra for the Ce 3d, Mn 2p, Co 2p and O 1 s core levels of CMC-0 and CMC-0.25 were recorded. These spectra are shown in Fig. 5 , and the surface composition and atomic ratios are compiled in Table 2 . In addition, the Shirley background and Gaussian-Lorenz model functions were used to fit the peak of Ce 3d, Mn 2p, Co 2p and O 1s. The XPS spectra of the Ce 3d core levels of two samples along with the five pairs of spin-orbit components were illustrated in Fig. 5a. In this figure the labels v, v″, v‴, u, u″, u‴ refer to three pairs of spin-orbit doublets that were observed and are consistent with the characteristics of Ce4+ 3d states. The other four peaks, denoted by v°, v′, u°, u′, correspond to the Ce3+ 3d final states. Therefore, it can be inferred that Ce4+ and Ce3+ ions co-exist on the surface of the two samples [36]. Clearly, the incorporation of Co resulted in a high concentration of Ce3+ ions compared to the CMC-0 solid solution and created a charge imbalance, more oxygen vacancies and an unsaturated structure on the catalyst surface. These phenomena might be the reason why the CMC-0.25 sample is more active for the benzene oxidation reaction than CMC-0 catalyst. The XPS spectra of the core levels of the Mn 2p in CMC-0 and CMC-0.25 samples are illustrated in Fig. 5b, in which the Mn 2p doublet can be observed. The Mn 2p exhibited two peaks: a Mn 2p3/2 component at 641.4 eV and a Mn 2p1/2 component at 652.9 eV with a spin-orbit splitting of ΔE = 11.5 eV. According to previous literature, the observed binding energies correspond to a mixed valence of Mn3+ and Mn4+ species [37]. In addition, a distinct identification of Mn2+ and Mn3+ is difficult due to the small difference in their binding energies [15]. It is worth nothing that the Mn4+/(Mn3+ + Mn2+)ratio was decreased due to the doping of cobalt, as shown in Table 2. As showed in Fig. S1 in the supplementary materials, doublet splitting of 4.63 eV was obtained for CMC-0, resulting in an AOS of 3.74, which is higher than the CMC-0.25 of 3.62(△Es = 4.74 eV). The lower AOS implies the higher fraction of Mn2+ and Mn3+ [38,39], which is consistent with the information from Mn 2p. It has been reported that Mn2+ and Mn3+ have better catalytic VOC activity compared to Mn4+ [2]. Fig. 5c shows the Co 2p core level spectra of the CMC-0.25 solid solution catalyst. The XPS spectra of the Co 2p exhibites two spin-orbit doublets and two shake-up satellite peaks. The two spin-orbit doublets in the Co 2p spectra are apparent at binding energies of 779.5 ± 0.4 eV and 795.5 ± 0.4 eV and are attributed to Co 2p3/2 and Co 2p1/2, respectively. Two satellite peaks corresponding to the binding energies appear at approximately 785.5 eV and 801.3 eV. The observed binding energies suggest that Co is in its +2 and +3 oxidation states. According to the literature data [40,41], the spin-orbit value is 15.2 ± 0.2 eV and corresponds to Co3O4. Moreover, the presence of the satellite peaks with a low intensity at approximately 6 eV from the main Co 2p3/2 spin-orbit component is further evidence that Co2+ and Co3+ species are present [42]. Fig. 5d displays the O 1s core level spectra of the CMC-0 and CMC-0.25 samples. The figure shows that the O 1s spectrum can be fit with three peaks at 528.7, 531.1 and 532.58 eV, which can be attributed to lattice oxygen atoms (O2−, denoted as Oα), surface adsorbed oxygen (O2 −, O2 2−, O− denoted as Oβ), chemisorbed water and/or dissociated oxygen and/or hydroxyl species (Oγ), respectively [43,44]. As seen in Fig. 5d and Table 2, after Mn is partially substituted by Co, the concentration of Oβ increases from 40% to 50%; this result indicates that a change in structural arrangement and/or electronic structure has occurred due to the interaction between Ce-O and Co-O. Moreover, the Oβ/Oα molar ratio in CMC-0.25 catalyst was higher than in CMC-0 due to the charge imbalance caused by the doping of Co cations and the resulting neutralization by an increase in Oβ concentration. Thus, the doping of Co into the CMC-0 solid solution induces changes in the O(1s) chemical state and increases the amount of surface adsorbed oxygen on the catalyst surface, which enhanced the Oα mobility, resulting in an improvement in the Mars-van Krevelen mechanism [45]. These effects may be responsible for the high catalytic activity of CMC-0.25 for benzene oxidation. The O2-TPD was used to determine the mobility of oxygen species in CMC-0 and CMC-0.25 catalysts, and the results of which are shown in Fig. 6 . Four desorption peaks can be observed from the CMC-0 sample. The peak at 114 °C corresponds to the oxygen molecule(O2). The peaks at 327 °C and 355 °C correspond to the oxygen molecule anion (O2 −) and oxygen anion (O−), respectively; these peaks arise from the oxygen active on the surface. The final peak at 559 °C may result from the desorption of surface lattice oxygen. The CMC-0.25 catalyst also presented four peaks, and the active oxygen peak intensity was greater than for CMC-0. This result indicates that the CMC-0.25 solid solution surface has abundant surface active oxygen species in the form of O2 −and O−. The CMC-0.25 catalyst has the same O2 desorption peak, but the peaks of the surface active oxygen and surface lattice oxygen were shifted to lower temperatures when compared to CMC-0 sample. This phenomenon is attributed to the lattice defects and oxygen vacancies that result from the interaction between MnOCo and CeO during the formation of the CMC-0.25 solid solution. According to the literature [46], lower oxygen desorption temperatures and larger intensities of desorption peaks contribute to oxygen activation and adsorption onto the oxidant surface and result in higher activity for benzene catalytic oxidation reaction by CMC-0.25 catalyst. In order to establish a correlation between the nanostructure and the catalytic oxidation activity of CMC-0.25 catalyst, the morphology, crystalline structure and particle size of the catalyst was recorded by TEM and is shown in Fig. 7 . Clearly, the catalyst nanocrystals have a hexagonal morphology with apparent nearly monodispersed particles of approximately 6–15 nm. Form high-resolution TEM (HRTEM) images, the lattice spacing of fringes is 0.31 nm, which matches well with the parameters of the (111) plane of a fluorite-structured CMC-0.25 solid solution. It is important to note that the lattice fringes related to MnOx and Co3O4 are not detected from HRTEM images due to the formation of a well-crystallized solid solution, which is consistent with XRD results. 3.2 Catalytic activity The catalytic performance of CoxMn1−xCeOδ catalysts for benzene combustion as a function of reaction temperature is presented in Fig. 8 . CMC-0.25 catalysts appear to be superior for benzene catalytic combustion as compared to CMC-0 and CMC-1 catalysts and achieve complete benzene conversion at approximately 260 °C. It is worth pointing out that the reaction temperature of this sample was much lower than most of the noble-metal-free catalysts displayed in previous literatures, as shown in Table 3 . However, with the increase of Co/(Mn + Co) ratio, the sample exhibited higher T 50 and T 90(temperature at 50% and 90% benzene conversion) than that of CMC-0.25. This result can be attributed to the formation of the solid solution, the existence of the abundant oxygen vacancies, and the interaction effect between components oxides of CMC-0.25 catalyst. Specifically, the reaction rates of benzene oxidation normalized by the specific surface area (RS) of the catalyst were showed in Table 1. CMC-0.25 revealed the increased reaction rate (Rs = 7.811 × 10−3 mmol/m2 h−1) compared with the rates of CMC-0 (Rs = 4.567 × 10−3 mmol/m2 h−1) at 200 °C of the reaction temperature. This result also means that the most abundant active sites might be formed on the surface of CMC-0.25 as evidenced by the results from catalytic performance. The stability and CO2 selectivity represents the important performance of a catalyst for catalytic of VOCs. Therefore, the stability and CO2 selectivity of the CMC-0.25 catalyst were also inspected by analyzing the evolution of conversion over time-on-stream at alternating temperature conditions(250 °C for 1440 min, 240 °C for 1440 min, and 220 °C for 720 min) (Fig. 9 ). This experiment showed that after 3600 min of time-on-stream, the CMC-0.25 catalyst maintained 95–98% of benzene conversion at 250 °C, and the catalyst activity was stable at different temperature. Meanwhile, Benzene was completely oxidized to CO2 and H2O over the CMC-0.25 catalyst at 250 °C, then CO2 selectivity decrease occurred at 250 and 220 °C (still above 99.2%). However, along with the increase of temperature from 220 to 250 °C, no CO and other organic species were observed. To evaluate the effect of water vapor on the catalytic performance, on-stream benzene oxidation experiment was performed with 1.5% and 5.0%, respectively. As shown in Fig. 10 , the CMC-0.25 catalyst presented a better water-resistant with 1.5 vol% water vapor at 250 °C during the 720 min tests repeatedly, but when moisture concentration rose to 8.0 vol%, a small drop in benzene conversion from 95% to 90% took place mainly due to the competitive adsorption of benzene, oxygen and excessive water molecules on the catalysts surfaces [55]. 4 Conclusions We successfully synthesized Co-doped Mn-Ce-O solid solution catalysts, and their catalytic performance for benzene combustion was also tested. The CMC-0.25 catalyst possessed the superior low-temperature oxidation activity among these catalysts, and presented the appropriate for water-resistant, stability and CO2 selectivity. The doping of Co into the lattice of a Mn-Ce-O solid solution lowers the energy of oxygen vacancy and promotes the formation of more oxygen vacancies. Furthermore, increased oxygen vacancies and strong interaction effect among Co3O4 and MnOx and CeO2 species were responsible for the improvement in redox properties; thus, a high-performance CMC-0.25 catalyst was found for VOCs oxidation at low temperatures (∼250 °C). We believe that the efficient and sustainable CMC-0.25 catalyst could be a substitute for noble metal catalysts in oxidation of VOCs. Acknowledgments This research is financially supported by Project of Science and Technology Department of Jiangsu Province (BE2016769), the Natural Science Foundation of China (No. 51172107), Natural Science Foundation of the Jiangsu Higher Education Institutions of China (No. 14KJB430014), Open fund by Jiangsu Engineering Technology Research Center of Environmental Cleaning Materials (KFK1503) and A Project Funded by the Priority Academic Program Development of Jiangsu Higher Education Institutions (PAPD). Appendix A Supplementary data Supplementary data associated with this article can be found, in the online version, at http://dx.doi.org/10.1016/j.mcat.2017.12.020. Appendix A Supplementary data The following is Supplementary data to this article: References [1] W. Tang X. Wu S. Li W. Li Y. Chen Porous Mn-Co mixed oxide nanorod as a novel catalyst with enhanced catalytic activity for removal of VOCs Catal. Commun. 56 2014 134 138 [2] C.K. Sang G.S. Wang Catalytic combustion of VOCs over a series of manganese oxide catalysts Appl. Catal. B Environ. 98 2010 180 185 [3] G. Zhou X. He S. Liu H. Xie M. Fu Phenyl VOCs catalytic combustion on supported CoMn/AC oxide catalyst J. Ind. Eng. Chem. 21 2015 932 941 [4] Q. Huang X. Yan B. Li Y. Chen S. Zhu S. Shen Study on catalytic combustion of benzene over cerium based catalyst supported on cordierite J. Rare Earth 31 2013 124 129 [5] B. Li Q. Huang X.K. Yan X.L. Xu Y. Qiu B. Yang Y.W. Chen S.M. Zhu S.B. Shen Low-temperature catalytic combustion of benzene over Ni-Mn/CeO2/cordierite catalysts J. Ind. Eng. Chem. 20 2014 2359 2363 [6] S.A.C. Carabineiro X. Chen M. Konsolakis A.C. Psarras P.B. Tavares J.J.M. Órfão M.F.R. Pereira J.L. Figueiredo Catalytic oxidation of toluene on Ce-Co and La-Co mixed oxides synthesized by exotemplating and evaporation methods Catal. Today 244 2015 161 171 [7] P. Zhang H. Lu Y. Zhou L. Zhang Z. Wu S. Yang H. Shi Q. Zhu Y. Chen S. Dai Mesoporous MnCeOx solid solutions for low temperature and selective oxidation of hydrocarbons Nat. Commun. 6 2015 8446 [8] T. Rao M. Shen L. Jia J. Hao J. Wang Oxidation of ethanol over Mn-Ce-O and Mn-Ce-Zr-O complex compounds synthesized by sol-gel method Catal. Commun. 8 2007 1743 1747 [9] X.F. Tang Y.G. Li X.M. Huang Y.D. Xu H.Q. Zhu J.G. Wang W.J. Shen MnOx-CeO2 mixed oxide catalysts for complete oxidation of formaldehyde: effect of preparation method and calcination temperature Appl. Catal. B Environ. 62 2006 265 273 [10] D. Delimaris T. Ioannides VOC oxidation over MnOx-CeO2 catalysts prepared by a combustion method Appl. Catal. B Environ. 84 2008 303 312 [11] Y. Liao M. Fu L. Chen J. Wu B. Huang D. Ye Catalytic oxidation of toluene over nanorod-structured Mn-Ce mixed oxides Catal. Today 216 2013 220 228 [12] L. Shi X. Wang Q. Zhao Y. Zhang L. Zhang Y. Ren Z. Chen Low temperature catalytic combustion of chlorobenzene over Mn-Ce-O/γ-Al2O3 mixed oxides catalyst Catal. Today 158 2010 336 342 [13] G. Qi R.T. Yang R. Chang MnOx-CeO2 mixed oxides prepared by co-precipitation for selective catalytic reduction of NO with NH3 at low temperatures Appl. Catal. B Environ. 51 2004 93 106 [14] Z. Zou M. Meng Y. Zha Surfactant-assisted synthesis, characterizations, and catalytic oxidation mechanisms of the mesoporous mnOx-CeO2 and Pd/MnOx-CeO2 catalysts used for CO and C3H8 oxidation J. Phys. Chem. C 114 2010 468 477 [15] P. Venkataswamy K.N. Rao D. Jampaiah B.M. Reddy Nanostructured manganese doped ceria solid solutions for CO oxidation at lower temperatures Appl. Catal. B Environ. 162 2015 122 132 [16] Z. Wang G. Shen J. Li H. Liu Q. Wang Y. Chen Catalytic removal of benzene over CeO2-MnOx composite oxides prepared by hydrothermal method Appl. Catal. B Environ. 138 2013 253 259 [17] W. Tang W. Li D. Li G. Liu X. Wu Y. Chen Synergistic effects in porous Mn-Co mixed oxide nanorods enhance catalytic deep oxidation of benzene Catal. Lett. 144 2014 1900 1910 [18] S. Todorova H. Kolev J.P. Holgado G. Kadinov C. Bonev R. Pereñíguez A. Caballero Complete n –hexane oxidation over supported Mn-Co catalysts Appl. Catal. B Environ. 94 2010 46 54 [19] Z.Y. Tian P.H.T. Ngamou V. Vannier K. Kohse-Höinghaus N. Bahlawane Catalytic oxidation of VOCs over mixed Co-Mn oxides Appl. Catal. B Environ. 117–118 2012 125 134 [20] D.A. Aguilera A. Perez R. Molina S. Moreno Cu-Mn and Co-Mn catalysts synthesized from hydrotalcites and their use in the oxidation of VOCs Appl. Catal. B Environ. 104 2011 144 150 [21] M.H. Castaño R. Molina S. Moreno Cooperative effect of the Co-Mn mixed oxides for the catalytic oxidation of VOCs: influence of the synthesis method Appl. Catal. A 492 2015 48 59 [22] X. Yan Q. Huang B. Li X. Xu Y. Chen S. Zhu S. Shen Catalytic performance of LaCo0.5M0.5O3 (M = Mn, Cr Fe, Ni, Cu) perovskite-type oxides and LaCo0.5Mn0.5O3 supported on cordierite for CO oxidation J. Ind. Eng. Chem. 19 2013 561 565 [23] L.E. Gómez E.E. Miró A.V. Boix Spectroscopic characterization of Mn-Co-Ce mixed oxides: active catalysts for COPROX reaction Int. J. Hydrogen Energy 38 2013 5645 5654 [24] Z. Zhao R. Jin T. Bao H. Yang X. Lin G. Wang Mesoporous CexMn1−xO2 composites as novel alternative carriers of supported Co3O4 catalysts for CO preferential oxidation in H2 stream Int. J. Hydrogen Energy 37 2012 4774 4786 [25] Q. Guo Y. Liu MnOx modified Co3O4-CeO2 catalysts for the preferential oxidation of CO in H2-rich gases Appl. Catal. B Environ. 82 2008 19 26 [26] Q. Guo S. Chen Y. Liu Y. Wang Stability of Co-Ce-Mn mixed-oxide catalysts for CO preferential oxidation in H2-rich gases Chem. Eng. J. 165 2010 846 850 [27] P. Sudarsanam B. Mallesham P.S. Reddy D. Großmann W. Grünert B.M. Reddy Nano-Au/CeO2 catalysts for CO oxidation: influence of dopants (Fe: la and Zr) on the physicochemical properties and catalytic activity Appl. Catal. B Environ. 144 2014 900 908 [28] H. Lu X. Kong H. Huang Y. Zhou Y. Chen Cu-Mn-Ce ternary mixed-oxide catalysts for catalytic combustion of toluene J. Environ. Sci. 32 2015 102 107 [29] A. Bensalem F. Bozon-Verduraz M. Delamar G. Bugli Preparation and characterization of highly dispersed silica-supported ceria Appl. Catal. A 121 1995 81 93 [30] X. Wu Q. Liang D. Weng J. Fan R. Ran Synthesis of CeO2-MnOx mixed oxides and catalytic performance under oxygen-rich condition Catal. Today 126 2007 430 435 [31] B. Meng Z. Zhao X. Wang J. Liang J. Qiu Selective catalytic reduction of nitrogen oxides by ammonia over Co3O4 nanocrystals with different shapes Appl. Catal. B Environ. 129 2013 491 500 [32] X. Tang J. Chen Y. Li Y. Li Y. Xu W. Shen Complete oxidation of formaldehyde over Ag/MnOx-CeO2 catalysts Chem. Eng. J. 118 2006 119 125 [33] J. Xu P. Li X. Song C. He J. Yu Y.F. Han Operando raman spectroscopy for determining the active phase in one- dimensional mn1-xCexO2±y nanorod catalysts during methane combustion J. Phys. Chem. Lett. 1 2015 1648 1654 [34] B. Guan H. Lin L. Zhu Z. Huang Selective catalytic reduction of NOx with NH3 over Mn, Ce substitution Ti0.9V0.1O2−δ nanocomposites catalysts prepared by self-propagating high-temperature synthesis method J. Phys. Chem. C 115 2011 12850 12863 [35] Y. Lü W. Zhan Y. He Y. Wang X. Kong Q. Kuang Z. Xie L. Zheng MOF-templated synthesis of porous Co3O4 concave nanocubes with high specific surface area and their gas sensing properties ACS Appl. Mater. Interface 6 2014 4186 4195 [36] I. Lorite J.J. Romero J.F. Fernández Effects of the agglomeration state on the Raman properties of Co3O4 nanoparticles J. Raman Spectrosc. 43 2012 1443 1448 [37] W. Si Y. Wang Y. Peng X. Li K. Li J. Li A high-efficiency γ-MnO2-like catalyst in toluene combustion Chem. Commun. 51 2015 14977 14980 [38] Y. Yang S. Zhang S. Wang K. Zhang H. Wang J. Huang S. Deng B. Wang Y. Wang G. Yu Ball milling synthesized MnOx as highly active catalyst for gaseous POPs removal: significance of mechanochemically induced oxygen vacancies Environ. Sci. Technol. 49 2015 4473 4480 [39] V.P. Santos Soares O.S.G.P J.J.W. Bakker M.F.R. Pereira J.J.M. Órfão J. Gascon F. Kapteijn J.L. Figueiredo Structural and chemical disorder of cryptomelane promoted by alkali doping: influence on catalytic properties J. Catal. 293 2012 165 174 [40] Q. Yan X. Li Q. Zhao G. Chen Shape-controlled fabrication of the porous Co3O4 nanoflower clusters for efficient catalytic oxidation of gaseous toluene J. Hazard. Mater. 209–210 2012 385 391 [41] H. Wu G. Pantaleo G. Di Carlo S. Guo G. Marci P. Concepcion A.M. Venezia L.F. Liotta Co3O4 particles grown over nanocrystalline CeO2: influence of precipitation agents and calcination temperature on the catalytic activity for methane oxidation Catal. Sci. Technol. 5 2015 1888 1901 [42] H. Wu L. Wang Z. Shen J. Zhao Catalytic oxidation of toluene and p-xylene using gold supported on Co3O4 catalyst prepared by colloidal precipitation method J. Mol. Catal. A-Chem. 351 2011 188 195 [43] Z.Y. Tian P.H.T. Ngamou V. Vannier K. Kohse-Höinghaus N. Bahlawane Catalytic oxidation of VOCs over mixed Co-Mn oxides Appl. Catal. B Environ. 117–118 2012 125 134 [44] C. Zhang C. Wang W. Zhan Y. Guo Y. Guo G. Lu A. Baylet A. Giroir-Fendler Catalytic oxidation of vinyl chloride emission over LaMnO3 and LaB0.2Mn0.8O3 (B = Co, Ni Fe) catalysts Appl. Catal. B Environ. 129 2013 509 516 [45] D. Li W. Li Y. Deng X. Wu N. Han Y. Chen Effective Ti doping of δ-MnO2 via anion route for highly active catalytic combustion of benzene J. Phys. Chem. C 120 2016 10275 10282 [46] B. Bai H. Arandiyan J. Li Comparison of the performance for oxidation of formaldehyde on nano-Co3O4 2D-Co3O4, and 3D-Co3O4 catalysts Appl. Catal. B Environ. 142–143 2013 677 683 [47] W.X. Tang X.F. Wu G. Liu S.D. Li D.Y. Li W.H. Li Y.F. Chen Preparation of hierarchical layer-stacking Mn-Ce composite oxide for catalytic total oxidation of VOCs J. Rare Earth 33 2015 62 69 [48] Z. Mu J.J. Li M.H. Duan Z.P. Hao S.Z. Qiao Catalytic combustion of benzene on Co/CeO2/SBA-15 and Co/SBA-15 catalysts Catal. Commun. 9 2008 1874 1877 [49] C. Chen Y. Yu W. Li C. Cao P. Li Z. Dou W. Song Mesoporous Ce1−xZrxO2 solid solution nanofibers as high efficiency catalysts for the catalytic combustion of VOCs J. Mater. Chem. 21 2011 12836 12841 [50] H. Einaga S. Hyodo Y. Teraoka Complete oxidation of benzene over perovskite-type oxide catalysts Top. Catal. 53 2010 629 634 [51] T. Li S. Chiang B. Liaw Y. Chen Catalytic oxidation of benzene over CuO/Ce1−xMnxO2 catalysts Appl. Catal. B Environ. 103 2011 143 148 [52] Z. Wang G. Shen J. Li H. Liu Q. Wang Y. Chen Catalytic removal of benzene over CeO2-MnOx composite oxides prepared by hydrothermal method Appl. Catal. B Environ. 138 2013 253 259 [53] S. Li H. Wang W. Li X. Wu W. Tang Y. Chen Effect of Cu substitution on promoted benzene oxidation over porous CuCo-based catalysts derived from layered double hydroxide with resistance of water vapor Appl. Catal. B Environ. 166 2015 260 269 [54] Y.W. Chen B. Li Q. Niu L. Li J.W. Kan S.M. Zhu S.B. Shen Combined promoting effects of low-Pd-containing and Cu-doped LaCoO3 perovskite supported on cordierite for the catalytic combustion of benzene Environ. Sci. Pollut. R 23 2016 15193 15201 [55] F. Wang H. Dai J. Deng S. Xie H. Yang W. Han Nanoplate-aggregate Co3O4 microspheres for toluene combustion Chin. J. Catal. 35 2014 1475 1481",
      "scopus-id": "85041896882",
      "coredata": {
        "eid": "1-s2.0-S2468823117306612",
        "dc:description": "In this paper, CoxMn1−xCeOδ mixed oxides were synthesized using a co-precipitation method. The catalyst’s performance for the benzene combustion reaction was evaluated, and Co0.25Mn0.75CeOδ (CMC-0.25) exhibited good catalytic activity, stability and CO2 selectivity. The prepared catalysts were characterized and analyzed completely by XRD, BET, Raman, TEM and HRTEM, XPS, H2-TPR, and O2-TPD. The results demonstrated that a solid solution was formed with more active oxygen induced by Co doping. Strong interaction effects among Co-Mn-Ce-O were speculated as the main mechanisms underlying the high-efficiency catalytic capacity. The prepared Co-doped Mn-Ce mixed oxides catalyst may be a potential low-cost catalyst alternative to replace industrial noble metal catalysts.",
        "openArchiveArticle": "false",
        "prism:coverDate": "2018-02-28",
        "openaccessUserLicense": null,
        "prism:aggregationType": "Journal",
        "prism:url": "https://api.elsevier.com/content/article/pii/S2468823117306612",
        "dc:creator": [
          {
            "@_fa": "true",
            "$": "Deng, Lei"
          },
          {
            "@_fa": "true",
            "$": "Ding, Yaping"
          },
          {
            "@_fa": "true",
            "$": "Duan, Baoqing"
          },
          {
            "@_fa": "true",
            "$": "Chen, Yingwen"
          },
          {
            "@_fa": "true",
            "$": "Li, Peiwen"
          },
          {
            "@_fa": "true",
            "$": "Zhu, Shemin"
          },
          {
            "@_fa": "true",
            "$": "Shen, Shubao"
          }
        ],
        "link": [
          {
            "@_fa": "true",
            "@rel": "self",
            "@href": "https://api.elsevier.com/content/article/pii/S2468823117306612"
          },
          {
            "@_fa": "true",
            "@rel": "scidir",
            "@href": "https://www.sciencedirect.com/science/article/pii/S2468823117306612"
          }
        ],
        "dc:format": "application/json",
        "openaccessType": null,
        "pii": "S2468-8231(17)30661-2",
        "prism:volume": "446",
        "prism:publisher": "Elsevier B.V.",
        "dc:title": "Catalytic deep combustion characteristics of benzene over cobalt doped Mn-Ce solid solution catalysts at lower temperatures",
        "prism:copyright": "© 2017 Elsevier B.V. All rights reserved.",
        "openaccess": "0",
        "prism:issn": "24688231",
        "dcterms:subject": [
          {
            "@_fa": "true",
            "$": "CoxMn1−xCeOδ"
          },
          {
            "@_fa": "true",
            "$": "Combustion reaction"
          },
          {
            "@_fa": "true",
            "$": "Solid solution"
          },
          {
            "@_fa": "true",
            "$": "Active oxygen"
          },
          {
            "@_fa": "true",
            "$": "Low-cost catalyst"
          }
        ],
        "openaccessArticle": "false",
        "prism:publicationName": "Molecular Catalysis",
        "openaccessSponsorType": null,
        "prism:pageRange": "72-80",
        "prism:endingPage": "80",
        "pubType": "fla",
        "prism:coverDisplayDate": "February 2018",
        "prism:doi": "10.1016/j.mcat.2017.12.020",
        "prism:startingPage": "72",
        "dc:identifier": "doi:10.1016/j.mcat.2017.12.020",
        "openaccessSponsorName": null
      },
      "objects": {
        "object": [
          {
            "@category": "standard",
            "@height": "199",
            "@width": "258",
            "@_fa": "true",
            "$": "https://api.elsevier.com/content/object/eid/1-s2.0-S2468823117306612-fx1.jpg?httpAccept=%2A%2F%2A",
            "@multimediatype": "JPEG image file",
            "@type": "IMAGE-DOWNSAMPLED",
            "@size": "16388",
            "@ref": "fx1",
            "@mimetype": "image/jpeg"
          },
          {
            "@category": "standard",
            "@height": "275",
            "@width": "527",
            "@_fa": "true",
            "$": "https://api.elsevier.com/content/object/eid/1-s2.0-S2468823117306612-gr1.jpg?httpAccept=%2A%2F%2A",
            "@multimediatype": "JPEG image file",
            "@type": "IMAGE-DOWNSAMPLED",
            "@size": "47492",
            "@ref": "gr1",
            "@mimetype": "image/jpeg"
          },
          {
            "@category": "standard",
            "@height": "309",
            "@width": "376",
            "@_fa": "true",
            "$": "https://api.elsevier.com/content/object/eid/1-s2.0-S2468823117306612-gr10.jpg?httpAccept=%2A%2F%2A",
            "@multimediatype": "JPEG image file",
            "@type": "IMAGE-DOWNSAMPLED",
            "@size": "23783",
            "@ref": "gr10",
            "@mimetype": "image/jpeg"
          },
          {
            "@category": "standard",
            "@height": "306",
            "@width": "376",
            "@_fa": "true",
            "$": "https://api.elsevier.com/content/object/eid/1-s2.0-S2468823117306612-gr2.jpg?httpAccept=%2A%2F%2A",
            "@multimediatype": "JPEG image file",
            "@type": "IMAGE-DOWNSAMPLED",
            "@size": "40629",
            "@ref": "gr2",
            "@mimetype": "image/jpeg"
          },
          {
            "@category": "standard",
            "@height": "291",
            "@width": "376",
            "@_fa": "true",
            "$": "https://api.elsevier.com/content/object/eid/1-s2.0-S2468823117306612-gr3.jpg?httpAccept=%2A%2F%2A",
            "@multimediatype": "JPEG image file",
            "@type": "IMAGE-DOWNSAMPLED",
            "@size": "24781",
            "@ref": "gr3",
            "@mimetype": "image/jpeg"
          },
          {
            "@category": "standard",
            "@height": "295",
            "@width": "376",
            "@_fa": "true",
            "$": "https://api.elsevier.com/content/object/eid/1-s2.0-S2468823117306612-gr4.jpg?httpAccept=%2A%2F%2A",
            "@multimediatype": "JPEG image file",
            "@type": "IMAGE-DOWNSAMPLED",
            "@size": "27063",
            "@ref": "gr4",
            "@mimetype": "image/jpeg"
          },
          {
            "@category": "standard",
            "@height": "626",
            "@width": "678",
            "@_fa": "true",
            "$": "https://api.elsevier.com/content/object/eid/1-s2.0-S2468823117306612-gr5.jpg?httpAccept=%2A%2F%2A",
            "@multimediatype": "JPEG image file",
            "@type": "IMAGE-DOWNSAMPLED",
            "@size": "107584",
            "@ref": "gr5",
            "@mimetype": "image/jpeg"
          },
          {
            "@category": "standard",
            "@height": "290",
            "@width": "376",
            "@_fa": "true",
            "$": "https://api.elsevier.com/content/object/eid/1-s2.0-S2468823117306612-gr6.jpg?httpAccept=%2A%2F%2A",
            "@multimediatype": "JPEG image file",
            "@type": "IMAGE-DOWNSAMPLED",
            "@size": "22746",
            "@ref": "gr6",
            "@mimetype": "image/jpeg"
          },
          {
            "@category": "standard",
            "@height": "428",
            "@width": "376",
            "@_fa": "true",
            "$": "https://api.elsevier.com/content/object/eid/1-s2.0-S2468823117306612-gr7.jpg?httpAccept=%2A%2F%2A",
            "@multimediatype": "JPEG image file",
            "@type": "IMAGE-DOWNSAMPLED",
            "@size": "50618",
            "@ref": "gr7",
            "@mimetype": "image/jpeg"
          },
          {
            "@category": "standard",
            "@height": "307",
            "@width": "376",
            "@_fa": "true",
            "$": "https://api.elsevier.com/content/object/eid/1-s2.0-S2468823117306612-gr8.jpg?httpAccept=%2A%2F%2A",
            "@multimediatype": "JPEG image file",
            "@type": "IMAGE-DOWNSAMPLED",
            "@size": "28021",
            "@ref": "gr8",
            "@mimetype": "image/jpeg"
          },
          {
            "@category": "standard",
            "@height": "325",
            "@width": "489",
            "@_fa": "true",
            "$": "https://api.elsevier.com/content/object/eid/1-s2.0-S2468823117306612-gr9.jpg?httpAccept=%2A%2F%2A",
            "@multimediatype": "JPEG image file",
            "@type": "IMAGE-DOWNSAMPLED",
            "@size": "37306",
            "@ref": "gr9",
            "@mimetype": "image/jpeg"
          },
          {
            "@category": "thumbnail",
            "@height": "164",
            "@width": "212",
            "@_fa": "true",
            "$": "https://api.elsevier.com/content/object/eid/1-s2.0-S2468823117306612-fx1.sml?httpAccept=%2A%2F%2A",
            "@multimediatype": "GIF image file",
            "@type": "IMAGE-THUMBNAIL",
            "@size": "15754",
            "@ref": "fx1",
            "@mimetype": "image/gif"
          },
          {
            "@category": "thumbnail",
            "@height": "114",
            "@width": "219",
            "@_fa": "true",
            "$": "https://api.elsevier.com/content/object/eid/1-s2.0-S2468823117306612-gr1.sml?httpAccept=%2A%2F%2A",
            "@multimediatype": "GIF image file",
            "@type": "IMAGE-THUMBNAIL",
            "@size": "11746",
            "@ref": "gr1",
            "@mimetype": "image/gif"
          },
          {
            "@category": "thumbnail",
            "@height": "164",
            "@width": "199",
            "@_fa": "true",
            "$": "https://api.elsevier.com/content/object/eid/1-s2.0-S2468823117306612-gr10.sml?httpAccept=%2A%2F%2A",
            "@multimediatype": "GIF image file",
            "@type": "IMAGE-THUMBNAIL",
            "@size": "6232",
            "@ref": "gr10",
            "@mimetype": "image/gif"
          },
          {
            "@category": "thumbnail",
            "@height": "164",
            "@width": "201",
            "@_fa": "true",
            "$": "https://api.elsevier.com/content/object/eid/1-s2.0-S2468823117306612-gr2.sml?httpAccept=%2A%2F%2A",
            "@multimediatype": "GIF image file",
            "@type": "IMAGE-THUMBNAIL",
            "@size": "14252",
            "@ref": "gr2",
            "@mimetype": "image/gif"
          },
          {
            "@category": "thumbnail",
            "@height": "164",
            "@width": "212",
            "@_fa": "true",
            "$": "https://api.elsevier.com/content/object/eid/1-s2.0-S2468823117306612-gr3.sml?httpAccept=%2A%2F%2A",
            "@multimediatype": "GIF image file",
            "@type": "IMAGE-THUMBNAIL",
            "@size": "6807",
            "@ref": "gr3",
            "@mimetype": "image/gif"
          },
          {
            "@category": "thumbnail",
            "@height": "164",
            "@width": "209",
            "@_fa": "true",
            "$": "https://api.elsevier.com/content/object/eid/1-s2.0-S2468823117306612-gr4.sml?httpAccept=%2A%2F%2A",
            "@multimediatype": "GIF image file",
            "@type": "IMAGE-THUMBNAIL",
            "@size": "8257",
            "@ref": "gr4",
            "@mimetype": "image/gif"
          },
          {
            "@category": "thumbnail",
            "@height": "164",
            "@width": "177",
            "@_fa": "true",
            "$": "https://api.elsevier.com/content/object/eid/1-s2.0-S2468823117306612-gr5.sml?httpAccept=%2A%2F%2A",
            "@multimediatype": "GIF image file",
            "@type": "IMAGE-THUMBNAIL",
            "@size": "13067",
            "@ref": "gr5",
            "@mimetype": "image/gif"
          },
          {
            "@category": "thumbnail",
            "@height": "164",
            "@width": "212",
            "@_fa": "true",
            "$": "https://api.elsevier.com/content/object/eid/1-s2.0-S2468823117306612-gr6.sml?httpAccept=%2A%2F%2A",
            "@multimediatype": "GIF image file",
            "@type": "IMAGE-THUMBNAIL",
            "@size": "6641",
            "@ref": "gr6",
            "@mimetype": "image/gif"
          },
          {
            "@category": "thumbnail",
            "@height": "164",
            "@width": "144",
            "@_fa": "true",
            "$": "https://api.elsevier.com/content/object/eid/1-s2.0-S2468823117306612-gr7.sml?httpAccept=%2A%2F%2A",
            "@multimediatype": "GIF image file",
            "@type": "IMAGE-THUMBNAIL",
            "@size": "14026",
            "@ref": "gr7",
            "@mimetype": "image/gif"
          },
          {
            "@category": "thumbnail",
            "@height": "164",
            "@width": "200",
            "@_fa": "true",
            "$": "https://api.elsevier.com/content/object/eid/1-s2.0-S2468823117306612-gr8.sml?httpAccept=%2A%2F%2A",
            "@multimediatype": "GIF image file",
            "@type": "IMAGE-THUMBNAIL",
            "@size": "10754",
            "@ref": "gr8",
            "@mimetype": "image/gif"
          },
          {
            "@category": "thumbnail",
            "@height": "146",
            "@width": "219",
            "@_fa": "true",
            "$": "https://api.elsevier.com/content/object/eid/1-s2.0-S2468823117306612-gr9.sml?httpAccept=%2A%2F%2A",
            "@multimediatype": "GIF image file",
            "@type": "IMAGE-THUMBNAIL",
            "@size": "7545",
            "@ref": "gr9",
            "@mimetype": "image/gif"
          },
          {
            "@category": "standard",
            "@_fa": "true",
            "$": "https://api.elsevier.com/content/object/eid/1-s2.0-S2468823117306612-mmc1.docx?httpAccept=%2A%2F%2A",
            "@multimediatype": "Microsoft Word file",
            "@type": "APPLICATION",
            "@size": "1153608",
            "@ref": "mmc1",
            "@mimetype": "application/word"
          },
          {
            "@category": "thumbnail",
            "@height": "30",
            "@width": "183",
            "@_fa": "true",
            "$": "https://api.elsevier.com/content/object/eid/1-s2.0-S2468823117306612-si1.gif?httpAccept=%2A%2F%2A",
            "@multimediatype": "GIF image file",
            "@type": "ALTIMG",
            "@size": "889",
            "@ref": "si1",
            "@mimetype": "image/gif"
          },
          {
            "@category": "thumbnail",
            "@height": "25",
            "@width": "82",
            "@_fa": "true",
            "$": "https://api.elsevier.com/content/object/eid/1-s2.0-S2468823117306612-si2.gif?httpAccept=%2A%2F%2A",
            "@multimediatype": "GIF image file",
            "@type": "ALTIMG",
            "@size": "363",
            "@ref": "si2",
            "@mimetype": "image/gif"
          },
          {
            "@category": "thumbnail",
            "@height": "16",
            "@width": "27",
            "@_fa": "true",
            "$": "https://api.elsevier.com/content/object/eid/1-s2.0-S2468823117306612-si3.gif?httpAccept=%2A%2F%2A",
            "@multimediatype": "GIF image file",
            "@type": "ALTIMG",
            "@size": "202",
            "@ref": "si3",
            "@mimetype": "image/gif"
          },
          {
            "@category": "thumbnail",
            "@height": "18",
            "@width": "18",
            "@_fa": "true",
            "$": "https://api.elsevier.com/content/object/eid/1-s2.0-S2468823117306612-si4.gif?httpAccept=%2A%2F%2A",
            "@multimediatype": "GIF image file",
            "@type": "ALTIMG",
            "@size": "179",
            "@ref": "si4",
            "@mimetype": "image/gif"
          }
        ]
      },
      "link": {
        "@rel": "abstract",
        "@href": "https://api.elsevier.com/content/abstract/scopus_id/85041896882"
      }
    }
  }
}