{
  "metadata": {
    "title": "Cellulose conversion to ethylene glycol by tungsten oxide-based catalysts",
    "authors": "; ; ",
    "journal": "Molecular Catalysis",
    "date": "2019-08-31",
    "doi": "10.1016/j.mcat.2019.110400",
    "abstract": "",
    "uri": "https://api.elsevier.com/content/article/pii/S2468823119302160",
    "pii": "S2468823119302160"
  },
  "fulltext": {
    "full-text-retrieval-response": {
      "scopus-eid": "2-s2.0-85065772976",
      "originalText": "serial JL 315758 291210 291744 291790 291809 31 90 Molecular Catalysis MOLECULARCATALYSIS 2019-05-20 2019-05-20 2019-05-20 2019-05-20 2019-09-02T15:55:28 1-s2.0-S2468823119302160 S2468-8231(19)30216-0 S2468823119302160 10.1016/j.mcat.2019.110400 S300 S300.2 FULL-TEXT 1-s2.0-S2468823119X00097 2022-06-21T06:48:38.651428Z 0 0 20190801 20190831 2019 2019-05-20T10:42:28.492485Z absattachment articleinfo articlenumber articletitlenorm authfirstinitialnorm authfirstsurnamenorm cid cids contenttype copyright crossmark dateloaded dateloadedtxt datesearch datesort dateupdated dco docsubtype doctype doi eid ewtransactionid fundingbodyid hubeid indexeddate issn issnnorm itemstage itemtransactionid itemweight oauserlicense openaccess openarchive pg pgfirst pii piinorm pubdateend pubdatestart pubdatetxt pubyr sectiontitle sortorder sponsoredaccesstype srctitle srctitlenorm srctype ssids alllist content oa subj subheadings suppl tomb volfirst volissue volumelist webpdf webpdfpagecount yearnav figure table e-component body mmlmath acknowledge affil appendices articletitle auth authfirstini authfull authkeywords authlast grantsponsor highlightsabst orcid primabst ref specialabst 2468-8231 24688231 UNLIMITED VSNUGOLD true 473 473 C Volume 473 12 110400 110400 110400 201908 August 2019 2019-08-01 2019-08-31 2019 Researcher's Paper article fla © 2019 The Author(s). Published by Elsevier B.V. CELLULOSECONVERSIONETHYLENEGLYCOLBYTUNGSTENOXIDEBASEDCATALYSTS WIESFELD J 1 Introduction 2 Experimental methods 2.1 Chemicals 2.2 Catalyst preparation 2.3 Characterization 2.4 Catalytic activity tests 2.5 Product analysis 3 Results and discussion 4 Conclusion Conflicts of interest Acknowledgements Appendix A Supplementary data References YUE 2012 4218 4244 H MONOETHYLENEGLYCOLMEG 2019 PRODUCTIONMARKETPRICEPROPERTIES YABUSHITA 2014 1 9 M GALLEZOT 2012 1538 1558 P MELERO 2012 7393 7420 J CANTERO 2013 48 57 D SHROTRI 2018 761 768 A WANG 2015 737 751 J RINALDI 2009 1096 1107 R ZHAO 2013 9566 9572 G OOMS 2014 695 707 R ZHENG 2017 1939 1954 M CHAI 2017 8567 8574 J WEI 2016 682 691 L FABICOVICOVA 2015 3075 3083 K YUE 2016 C WIESFELD 2018 3093 3101 J WIESFELD 2019 J LIU 2012 3249 3253 Y WIESFELD 2019 7552 7562 J LI 2018 58 65 N ORSINI 2011 14530 14542 G DATKA 1992 186 199 J TAI 2012 7052 7054 Z GEBOERS 2010 3577 3579 J GEBOERS 2011 2167 2174 J PALKOVITS 2011 576 578 R KHOOBIAR 1964 411 412 S WIESFELDX2019X110400 WIESFELDX2019X110400XJ Full 2019-05-10T07:30:30Z FundingBody VSNU http://creativecommons.org/licenses/by/4.0/ 2021-05-20T00:00:00.000Z 2021-05-20T00:00:00.000Z http://creativecommons.org/licenses/by-nc-nd/4.0/ This is an open access article under the CC BY license. © 2019 The Author(s). Published by Elsevier B.V. 2022-06-10T17:27:14.213Z http://vtw.elsevier.com/data/voc/AddOnTypes/50.7/aggregated-refined Ministry of Education, Culture and Science OCW Ministerie van Onderwijs, Cultuur en Wetenschap http://data.elsevier.com/vocabulary/SciValFunders/501100003245 http://sws.geonames.org/2750405/ NWO NWO Nederlandse Organisatie voor Wetenschappelijk Onderzoek http://data.elsevier.com/vocabulary/SciValFunders/501100003246 http://sws.geonames.org/2750405/ MCEC Netherlands Center for Multiscale Catalytic Energy Conversion The authors would like to acknowledge M.W.G.M Verhoeven and J.J.G van Velzen for their invaluable support during construction of the reactor. This work was supported by the Netherlands Center for Multiscale Catalytic Energy Conversion (MCEC) , an NWO Gravitation programme funded by the Ministry of Education, Culture and Science of the government of the Netherlands . item S2468-8231(19)30216-0 S2468823119302160 1-s2.0-S2468823119302160 10.1016/j.mcat.2019.110400 315758 2020-01-27T06:56:21.257479Z 2019-08-01 2019-08-31 UNLIMITED VSNUGOLD 1-s2.0-S2468823119302160-main.pdf https://s3.amazonaws.com/prod-ucs-content-store-us-east/content/pii:S2468823119302160/MAIN/application/pdf/616d00914916b2cbba06336c102cba2b/main.pdf main.pdf pdf true 1770022 MAIN 10 1-s2.0-S2468823119302160-main_1.png https://s3.amazonaws.com/prod-ucs-content-store-us-east/content/pii:S2468823119302160/PREVIEW/image/png/47cfff256e264b48ea2996b7a664925e/main_1.png main_1.png png 56950 849 656 IMAGE-WEB-PDF 1 1-s2.0-S2468823119302160-ga1.sml https://s3.amazonaws.com/prod-ucs-content-store-us-east/content/pii:S2468823119302160/ga1/THUMBNAIL/image/gif/998aee972d2df105c15a8ed7fbd029b4/ga1.sml ga1 true ga1.sml sml 6482 87 219 IMAGE-THUMBNAIL 1-s2.0-S2468823119302160-gr1.sml https://s3.amazonaws.com/prod-ucs-content-store-us-east/content/pii:S2468823119302160/gr1/THUMBNAIL/image/gif/68abe0fc61e9a3ca7081afa2085c8f5b/gr1.sml gr1 gr1.sml sml 11452 107 219 IMAGE-THUMBNAIL 1-s2.0-S2468823119302160-gr2.sml https://s3.amazonaws.com/prod-ucs-content-store-us-east/content/pii:S2468823119302160/gr2/THUMBNAIL/image/gif/a0d8a353a206b66a3b7c2f14a39e407f/gr2.sml gr2 gr2.sml sml 9447 131 219 IMAGE-THUMBNAIL 1-s2.0-S2468823119302160-gr3.sml https://s3.amazonaws.com/prod-ucs-content-store-us-east/content/pii:S2468823119302160/gr3/THUMBNAIL/image/gif/cff66c8c0337d0e95695e52ef8c73c24/gr3.sml gr3 gr3.sml sml 6727 164 107 IMAGE-THUMBNAIL 1-s2.0-S2468823119302160-gr4.sml https://s3.amazonaws.com/prod-ucs-content-store-us-east/content/pii:S2468823119302160/gr4/THUMBNAIL/image/gif/08078594e52f5ee8fc7f0f0eea379452/gr4.sml gr4 gr4.sml sml 5739 163 106 IMAGE-THUMBNAIL 1-s2.0-S2468823119302160-sc1.sml https://s3.amazonaws.com/prod-ucs-content-store-us-east/content/pii:S2468823119302160/sc1/THUMBNAIL/image/gif/1b84fa255d2022cee9a972c4aefa1877/sc1.sml sc1 sc1.sml sml 6418 164 161 IMAGE-THUMBNAIL 1-s2.0-S2468823119302160-ga1.jpg https://s3.amazonaws.com/prod-ucs-content-store-us-east/content/pii:S2468823119302160/ga1/DOWNSAMPLED/image/jpeg/2aa6c7b588c9b7fb18ea80033d836189/ga1.jpg ga1 true ga1.jpg jpg 25432 200 500 IMAGE-DOWNSAMPLED 1-s2.0-S2468823119302160-gr1.jpg https://s3.amazonaws.com/prod-ucs-content-store-us-east/content/pii:S2468823119302160/gr1/DOWNSAMPLED/image/jpeg/53e166cb4e923cdca166fedfa6522f3e/gr1.jpg gr1 gr1.jpg jpg 88667 333 679 IMAGE-DOWNSAMPLED 1-s2.0-S2468823119302160-gr2.jpg https://s3.amazonaws.com/prod-ucs-content-store-us-east/content/pii:S2468823119302160/gr2/DOWNSAMPLED/image/jpeg/5013e858700bee0c7119b80c1633f048/gr2.jpg gr2 gr2.jpg jpg 27975 225 376 IMAGE-DOWNSAMPLED 1-s2.0-S2468823119302160-gr3.jpg https://s3.amazonaws.com/prod-ucs-content-store-us-east/content/pii:S2468823119302160/gr3/DOWNSAMPLED/image/jpeg/de39d48f02e804038b53c21bc85f11cc/gr3.jpg gr3 gr3.jpg jpg 53032 521 340 IMAGE-DOWNSAMPLED 1-s2.0-S2468823119302160-gr4.jpg https://s3.amazonaws.com/prod-ucs-content-store-us-east/content/pii:S2468823119302160/gr4/DOWNSAMPLED/image/jpeg/c02127ff3fb7687934bef84808beb8c8/gr4.jpg gr4 gr4.jpg jpg 46444 524 340 IMAGE-DOWNSAMPLED 1-s2.0-S2468823119302160-sc1.jpg https://s3.amazonaws.com/prod-ucs-content-store-us-east/content/pii:S2468823119302160/sc1/DOWNSAMPLED/image/jpeg/e9f0bd107021a2f2f01b3762a7465aff/sc1.jpg sc1 sc1.jpg jpg 54691 520 510 IMAGE-DOWNSAMPLED 1-s2.0-S2468823119302160-mmc1.docx https://s3.amazonaws.com/prod-ucs-content-store-us-east/content/pii:S2468823119302160/mmc1/MAIN/application/vnd.openxmlformats-officedocument.wordprocessingml.document/17ddc33598c9772a4c083b3479acc091/mmc1.docx mmc1 mmc1.docx docx 261534 APPLICATION 1-s2.0-S2468823119302160-si1.gif https://s3.amazonaws.com/prod-ucs-content-store-us-east/content/pii:S2468823119302160/STRIPIN/image/gif/9ba2381469b7d9138f6c325fc8211a81/si1.gif si1 si1.gif gif 327 42 96 ALTIMG 1-s2.0-S2468823119302160-si10.gif https://s3.amazonaws.com/prod-ucs-content-store-us-east/content/pii:S2468823119302160/STRIPIN/image/gif/26e1fca1b2e1dd2d1964948f853842cb/si10.gif si10 si10.gif gif 355 30 86 ALTIMG 1-s2.0-S2468823119302160-si11.gif https://s3.amazonaws.com/prod-ucs-content-store-us-east/content/pii:S2468823119302160/STRIPIN/image/gif/39e14e8ec29bd27b46e7401289d34d16/si11.gif si11 si11.gif gif 371 30 92 ALTIMG 1-s2.0-S2468823119302160-si2.gif https://s3.amazonaws.com/prod-ucs-content-store-us-east/content/pii:S2468823119302160/STRIPIN/image/gif/e91bd1a46fc26de6e00b28052383a37b/si2.gif si2 si2.gif gif 1072 51 257 ALTIMG 1-s2.0-S2468823119302160-si3.gif https://s3.amazonaws.com/prod-ucs-content-store-us-east/content/pii:S2468823119302160/STRIPIN/image/gif/ebc270f080653fc2dcd2b679ecca1a7d/si3.gif si3 si3.gif gif 1523 53 345 ALTIMG 1-s2.0-S2468823119302160-si4.gif https://s3.amazonaws.com/prod-ucs-content-store-us-east/content/pii:S2468823119302160/STRIPIN/image/gif/111a19f458af15bd97d487feaff3cafb/si4.gif si4 si4.gif gif 1542 55 320 ALTIMG 1-s2.0-S2468823119302160-si5.gif https://s3.amazonaws.com/prod-ucs-content-store-us-east/content/pii:S2468823119302160/STRIPIN/image/gif/fa7b2d85db60c8958c0bc18a4d12778d/si5.gif si5 si5.gif gif 161 30 32 ALTIMG 1-s2.0-S2468823119302160-si6.gif https://s3.amazonaws.com/prod-ucs-content-store-us-east/content/pii:S2468823119302160/STRIPIN/image/gif/01ef1521e45e029b71d9ddf5ba408a94/si6.gif si6 si6.gif gif 173 30 31 ALTIMG 1-s2.0-S2468823119302160-si7.gif https://s3.amazonaws.com/prod-ucs-content-store-us-east/content/pii:S2468823119302160/STRIPIN/image/gif/56f092fd48ef23e68f21a1feb46f8fb6/si7.gif si7 si7.gif gif 166 31 30 ALTIMG 1-s2.0-S2468823119302160-si8.gif https://s3.amazonaws.com/prod-ucs-content-store-us-east/content/pii:S2468823119302160/STRIPIN/image/gif/2c113e5677acd948aed4528be3c491ac/si8.gif si8 si8.gif gif 159 27 30 ALTIMG 1-s2.0-S2468823119302160-si9.gif https://s3.amazonaws.com/prod-ucs-content-store-us-east/content/pii:S2468823119302160/STRIPIN/image/gif/f73c5048f7a5cc3bac9e2150dc49dcb5/si9.gif si9 si9.gif gif 180 30 38 ALTIMG 1-s2.0-S2468823119302160-am.pdf am am.pdf pdf 1075280 AAM-PDF https://s3-eu-west-1.amazonaws.com/prod-ucs-content-store-eu-west/content/egi:105DKMN92NH/MAIN/application/pdf/c40761891092325cb4b0753852356ad7/am.pdf MCAT 110400 110400 S2468-8231(19)30216-0 10.1016/j.mcat.2019.110400 The Author(s) Scheme 1 Simplified reaction scheme of cellulose hydrolysis and further reaction steps. Main reactions include formation of glucose (1), erythrose (2), glycol aldehyde (3) and EG (4), and routes to side-products such as fructose (5), erytritol, (6), sorbitol/mannitol (7), 1,2-butanediol (8), 1,2-hexanediol (9), 1,2-propanediol (10), and glycerol (11). Scheme 1 Fig. 1 Representative images of bulk and mesoporous materials. Bulk materials are contained in the dashed outline with their corresponding mesoporous oxide displayed below the image. Fig. 1 Fig. 2 XRD measurements of bulk and mesoporous materials. Hydrotungstite is abbreviated to H-tungstite. Fig. 2 Fig. 3 XRD measurements of Ru-impregnated b-WO3, m-WO3 and m-NbW5. Diffractograms of bare supports are added as reference. Intended Ru loadings (wt%) are indicated on the right. Fig. 3 Fig. 4 TPR profiles of Ru-impregnated b-WO3, m-WO3 and m-NbW5. TPR of bare supports are added as reference. Numbers on the right denote intended Ru loading as wt%. Fig. 4 Table 1 Physicochemical constants of bulk and mesoporous catalysts. Table 1 Catalyst S BET V pore W/dopant a N LAS b N BAS c m2 g−1 cm3 g−1 – mmol g−1 μmol m−2 mmol g−1 μmol m−2 WO 3 5.0 – – 0.026 6.0 0.006 1.2 b-WO3 17 – – 0.058 3.4 0.029 1.7 b-NbW5 35 – 5.0 0.099 2.8 0.079 2.3 b-TiW5 3.9 – 4.4 0.005 1.4 0.039 9.9 m-WO3 135 0.071 – 0.46 3.3 0.29 2.6 m-NbW5 148 0.090 4.9 0.12 0.78 0.098 0.66 m-TiW5 195 0.33 5.6 0.14 0.76 0.17 0.86 m-VW5 193 0.31 5.7 0.068 0.35 0.02 0.11 m-ZrW5 233 0.30 4.7 0.26 1.1 0.33 1.4 a W/dopant ratio determined by ICP. b Lewis acid site density. c Brønsted acid site density. Table 2 Cellulose conversion activity of various tungstite materials as function of temperature. a Table 2 Selectivity # Catalyst Temp. Conv. EG b PG b BD b HD b C4 b C6 b CB c °C % % % % % % % % 1 WO3 225 39.7 29.5 0.0 0.0 0.0 10.4 11.3 68.3 2 b-WO3 210 44.5 70.2 0.0 8.4 0.0 4.4 12.7 74.5 3 b-WO3 225 75.0 50.6 2.2 8.0 4.2 2.6 6.8 67.4 4 b-WO3 240 100.0 43.2 6.4 8.2 2.6 1.0 3.1 64.4 5 b-NbW5 210 46.9 66.8 0.0 7.4 0.0 4.1 11.4 72.8 6 b-NbW5 225 80.1 44.3 3.3 7.6 3.0 1.7 4.6 61.6 7 b-NbW5 240 100.0 37.9 7.0 8.0 2.4 1.0 2.8 59.0 8 b-TiW5 210 56.7 45.9 5.5 7.3 0.0 1.2 3.0 63.5 9 b-TiW5 225 95.6 34.3 5.3 7.1 1.9 0.7 2.1 51.5 10 b-TiW5 240 100.0 29.2 9.4 10.6 1.5 0.0 1.0 51.6 a Reaction conditions: 0.3 g cellulose, 0.05 g retro-aldol catalyst, 0.01 g 5 wt% Ru/C (1 wt% Ru w.r.t. WO3), 40 mL H2O, 45 bar H2, 600 rpm, 2 h. b EG, PG, BD, HD, C4 and C6 refer to ethylene glycol, 1,2-propylene glycol, 1,2-butanediol, 1,2-hexanediol, erythritol and mannitol + sorbitol, respectively. c Carbon balance. Table 3 Cellulose conversion activity of undoped tungstite as function of time. a Table 3 Selectivity # Catalyst Time Conv. EG b PG b BD b HD b C4 b C6 b CB c min % % % % % % % % 1 b-WO3 30 47.4 63.1 0.0 6.8 0.0 4.4 9.8 72.3 2 b-WO3 60 62.3 60.9 2.7 7.7 4.0 2.3 8.3 72.0 3 b-WO3 120 75.0 50.6 2.2 8.0 4.2 2.6 6.8 67.4 4 b-WO3 180 87.8 50.3 1.9 6.6 3.8 2.2 7.6 68.0 a Reaction conditions: 0.3 g cellulose, 0.05 g retro-aldol catalyst, 0.01 g 5 wt% Ru/C (1 wt% Ru w.r.t. WO3), 40 mL H2O, 45 bar H2, 600 rpm, 225 °C. b EG, PG, BD, HD, C4 and C6 refer to ethylene glycol, 1,2-propylene glycol, 1,2-butanediol, 1,2-hexanediol, erythritol and mannitol + sorbitol respectively. c Carbon balance. Table 4 Cellulose conversion activity of (doped) mesoporous tungsten oxides. a Table 4 Selectivity # Catalyst Temp. Conv. EG b PG b BD b HD b C4 b C6 b Glu b Gas c CB d °C % % % % % % % % % % 1 b-WO3 225 62.3 60.9 2.7 7.7 4.0 2.3 8.3 – – 72.0 2 m-WO3 210 34.6 82.7 0.0 0.0 0.0 1.5 4.2 3.9 2.3 78.9 3 m-WO3 225 66.7 49.5 5.5 7.7 3.1 0.6 1.7 2.7 2.3 74.9 4 m-NbW5 210 34.7 78.8 0.0 0.0 0.0 1.1 6.5 2.9 2.2 78.7 5 m-NbW5 225 64.0 56.7 3.4 7.4 4.3 1.8 8.5 2.2 1.8 71.1 6 m-TiW5 210 36.2 81.4 0.0 3.7 0.0 1.0 3.4 2.2 2.0 78.5 7 m-TiW5 225 70.3 49.0 6.8 9.8 3.1 1.1 2.7 2.7 1.5 67.2 8 m-VW5 210 31.9 89.1 0.0 0.0 0.0 1.6 5.1 2.8 3.6 80.8 9 m-VW5 225 57.2 38.6 1.7 4.5 1.9 2.3 9.4 2.1 1.9 63.2 10 m-ZrW5 210 38.6 59.5 0.0 8.4 0.0 2.2 4.7 5.5 1.8 73.6 11 m-ZrW5 225 74.3 45.0 4.2 6.1 2.4 0.7 1.4 1.6 1.2 60.3 a Reaction conditions: 0.3 g cellulose, 0.05 g retro-aldol catalyst, 0.01 g 5 wt% Ru/C (1 wt% Ru w.r.t. WO3), 40 mL H2O, 45 bar H2, 600 rpm, 1 h. b EG, PG, BD, HD, C4, C6 and Glu refer to ethylene glycol, 1,2-propylene glycol, 1,2-butanediol, 1,2-hexanediol, erythritol, mannitol + sorbitol and glucose respectively. c Combined selectivity towards gaseous products based on total carbon. d Carbon balance. Table 5 Cellulose conversion activity of m-WO3 and m-NbW5 as function of time. a Table 5 Selectivity # Catalyst Time Conv. EG b PG b BD b HDb C4 b C6 b Glu b Gas c CB d min % % % % % % % % % % 1 m-WO3 30 46.6 71.6 0.0 5.1 0.0 0.9 4.3 3.0 0.8 72.2 2 m-WO3 60 66.7 49.5 5.5 7.7 3.1 0.6 1.7 2.7 2.3 74.9 3 m-WO3 120 82.1 49.8 2.3 7.3 2.9 0.5 1.6 1.0 1.4 66.6 4 m-WO3 180 89.3 41.2 1.6 6.8 1.9 0.5 1.8 1.0 1.5 72.7 5 m-NbW5 30 50.0 64.7 3.1 6.6 3.3 1.8 8.1 3.9 0.9 72.9 6 m-NbW5 60 64.0 56.7 3.4 7.4 4.3 1.8 8.5 2.2 1.8 71.1 7 m-NbW5 120 83.5 50.8 3.8 8.2 4.1 1.1 5.9 2.0 1.4 70.0 8 m-NbW5 180 95.2 39.5 2.4 5.7 2.5 0.8 4.8 1.4 1.3 57.8 a Reaction conditions: 0.3 g cellulose, 0.05 g retro-aldol catalyst, 0.01 g 5 wt% Ru/C (1 wt% Ru w.r.t. WO3), 40 mL H2O, 45 bar H2, 600 rpm, 225 °C. b EG, PG, BD, HD, C4, C6 and Glu refer to ethylene glycol, 1,2-propylene glycol, 1,2-butanediol, 1,2-hexanediol, erythritol, mannitol + sorbitol and glucose respectively. c Combined selectivity towards gaseous products based on total carbon. d Carbon balance. Table 6 Physicochemical data of ruthenium-impregnated materials. Table 6 Catalyst Ru loading a d b D b wt% nm % b-WO3 0.25 8.00 16.0 0.51 15.3 8.39 1.08 20.9 6.15 2.28 20.4 6.29 m-WO3 0.23 1.42 90.6 0.47 1.99 64.4 0.86 2.45 52.3 1.34 2.64 48.5 m-NbW5 0.16 1.75 73.9 0.40 2.36 54.4 0.78 2.52 51.1 1.28 2.86 44.8 a Determined by ICP. b Calculated from CO chemisorption. Table 7 Cellulose conversion activity of Ru-impregnated materials. a Table 7 Selectivity # Catalyst Ru b Conv. EG c PG c BD c HD c C4 c C6 c Glu c Gas d CB e wt% % % % % % % % % % % 1 b-WO3 Phys f 62.3 60.9 2.7 7.7 4.0 2.3 8.3 2.5 2.1 72.0 2 b-WO3 0.2 60.7 50.0 0.0 3.6 0.0 0.8 0.7 3.6 2.4 65.0 3 b-WO3 0.5 59.3 51.2 3.3 3.5 0.0 0.6 0.3 2.3 1.8 62.0 4 b-WO3 1.0 49.1 60.2 4.4 4.8 0.0 1.1 0.7 3.1 2.3 60.0 5 b-WO3 2.0 50.5 65.7 5.2 5.9 0.0 1.0 0.5 2.0 1.3 70.3 6 m-WO3 Phys 66.7 49.5 5.5 7.7 3.1 0.6 1.7 2.7 2.3 74.9 7 m-WO3 0.2 50.1 33.1 0.0 0.0 0.0 0.4 0.0 5.5 0.6 59.8 8 m-WO3 0.5 49.8 46.9 0.0 0.0 0.0 0.5 0.6 5.2 1.4 63.8 9 m-WO3 1.0 50.5 56.5 4.6 4.3 0.0 1.0 1.7 5.2 3.1 69.0 10 m-WO3 2.0 52.5 55.8 7.9 6.6 5.2 1.6 5.8 5.6 2.9 72.7 11 m-NbW5 Phys 64.0 56.7 3.4 7.4 4.3 1.8 8.5 2.2 1.8 71.1 12 m-NbW5 0.2 55.0 20.3 0.0 0.0 0.0 0.3 0.0 2.8 0.4 52.2 13 m-NbW5 0.5 58.6 30.8 0.0 0.0 0.0 0.4 0.3 2.8 0.8 53.4 14 m-NbW5 1.0 58.7 48.0 4.3 3.8 0.0 0.7 0.9 2.8 1.2 61.6 15 m-NbW5 2.0 63.0 44.0 8.9 5.5 3.5 1.3 3.9 3.7 2.3 66.1 a Reaction conditions: 0.3 g cellulose, 0.05 g retro-aldol catalyst, 40 mL H2O, 45 bar H2, 600 rpm, 225 °C. b Intended Ru loading. c EG, PG, BD, HD, C4, C6 and Glu refer to ethylene glycol, 1,2-propylene glycol, 1,2-butanediol, 1,2-hexanediol, erythritol, mannitol + sorbitol and glucose respectively. d Combined selectivity towards gaseous products based on total carbon. e Carbon balance. f Phys refers to separate retro-aldol and hydrogenation catalysts, 0.05 g retro-aldol catalyst, 0.01 g 5 wt% Ru/C (1 wt% Ru w.r.t. WO3). Table 8 Cellulose conversion activity of 2 wt% Ru/b-WO3. a Table 8 Selectivity # Catalyst Time min Conv. EG b PG b BD b HD b C4 b C6 b Glu b Gas c CB d % % % % % % % % % % 1 b-WO3 30 37.1 61.2 0.0 0.0 0.0 1.8 1.6 1.4 0.7 72.1 2 b-WO3 60 50.5 65.7 5.2 5.9 0.0 1.0 0.5 2.0 1.3 70.3 3 b-WO3 120 72.3 45.2 1.8 7.0 1.6 0.8 0.6 2.3 1.2 59.6 4 b-WO3 180 82.9 37.0 1.7 7.0 1.6 0.6 0.6 2.2 1.0 52.9 a Reaction conditions: 0.3 g cellulose, 0.05 g retro-aldol catalyst, 40 mL H2O, 45 bar H2, 600 rpm, 225 °C. b EG, PG, BD, HD, C4, C6 and Glu refer to ethylene glycol, 1,2-propylene glycol, 1,2-butanediol, 1,2-hexanediol, erythritol, mannitol + sorbitol and glucose respectively. c Combined selectivity towards gaseous products based on total carbon. d Carbon balance. Cellulose conversion to ethylene glycol by tungsten oxide-based catalysts Jan J. Wiesfeld Peter Peršolja Floriane A. Rollier Adelheid M. Elemans-Mehring Emiel J.M. Hensen ⁎ Laboratory of Inorganic Materials and Catalysis, Schuit Institute of Catalysis, P.O. Box 513, 5600 MB Eindhoven, Eindhoven University of Technology, the Netherlands Laboratory of Inorganic Materials and Catalysis Schuit Institute of Catalysis Eindhoven University of Technology P.O. Box 513 Eindhoven 5600 MB the Netherlands ⁎ Corresponding author. Graphical abstract The conversion of cellulose into ethylene glycol remains a significant challenge in the biobased domain. Here we explored the activity of various bulk and mesoporous (doped) tungsten oxides in combination with carbon-supported ruthenium for obtaining ethylene glycol from cellulose. Tungstite and sub-stoichiometric tungsten oxides are more active and selective than monoclinic WO3. Doping tungstite with early transition metals enhanced the rate of cellulose depolymerization to glucose through a higher Brønsted acidity, although this did not improve the overall performance as the higher acidity resulted in a higher rate of humin formation. The increased acidity of mesoporous sub-stoichiometric tungsten oxide compared to tungstite had a similar adverse effect. Doping this material with niobium improved ethylene glycol selectivity at similar conversion. Kinetic studies showed that the majority of ethylene glycol is produced in the first hour for three optimized catalysts, with undoped bulk tungstite being the most efficient catalytic material. Impregnation of these materials with ruthenium instead of using carbon-supported ruthenium as a co-catalyst was most beneficial for tungstite, as it showed improved ethylene glycol selectivity and lower polyol yields after 1 h of reaction time. Keywords Retro-aldol Biomass valorization Cellulose Tungsten oxide Ethylene glycol 1 Introduction Ethylene glycol (EG) is an important chemical, which is mainly used for anti-freeze purposes and as a raw material for the production of polyester fibers [1]. The annual global production was estimated at 26.9 million tonnes in 2016, which is primarily obtained by hydrolysis of ethylene oxide [2]. Ethylene oxide is exclusively obtained by selective oxidation of fossil-based ethylene. In recent years, production of fuels and chemicals from renewable sources has become a target in order to supplement or replace fossil feedstock on which society currently relies. Cellulose is the most abundant renewable source of biomass and processing it into valuable commodities has attracted much interest from both academia and industry [3–5]. Unlike starch, cellulose is inedible, which makes it a good feedstock for industrial utilization without endangering food supplies. Cellulose is a linear polymer of repeating glucose units, which contains many hydroxyl groups rendering it a potent feedstock for the industrial production of EG, sorbitol and other polyols. The large number of intra- and interchain hydrogen bonds make cellulose recalcitrant to depolymerization to glucose, which is considered the first step towards valorization of cellulose [6–8]. Its depolymerization usually involves harsh conditions (high temperature) and reagents such as strong Brønsted acids are employed [8,9]. The release of glucose under these conditions results in rapid further conversion into humins [10,11]. One approach to cope with this is to rapidly further convert the glucose intermediate. Upgrading glucose to EG involves two basic reaction steps, namely step-wise retro-aldolization of glucose to glycol aldehyde followed by its hydrogenation to EG. The obtained product distribution is governed by the chosen reaction conditions and type of catalyst used [10–14]. The predominant reactions to produce EG and related side-products are laid out in Scheme 1 . The occurring reactions can be classified into cellulose hydrolysis, retro-aldolization of glucose and other saccharides, hydrogenation of aldehydes and ketones, and dehydration of polyols and hydrogenation of the resulting CC bonds. Cellulose hydrolysis is preferably promoted by Brønsted acids, either generated in situ through increased autoprotolysis of hot water or from an external source. Lewis acidic species are responsible for retro-aldol reactions to form shorter aldehydes and can also catalyze isomerization reactions. Hydrogenation of CO and CC species is performed by a metal function using gaseous hydrogen. The metal function can either be present as a separately supported catalyst [10,13], or alternatively is deposited on the retro-aldol catalyst [11,14,15]. Our recent work regarding bulk and mesoporous doped tungsten oxides has shown that these materials possess strong Lewis and Brønsted acid sites [16–18]. This, in theory, makes them potentially suitable to carry out retro-aldolization and to aid in cellulose hydrolysis. These reactions have been evaluated already for supported and unsupported monoclinic WO3 [11,13–15,19]. Our earlier investigation on glucose valorization to 5-hydroxymethylfurfural demonstrated that (doped) tungstite (WO3.H2O) and sub-stoichiometric tungsten oxides are significantly more active compared to monoclinic WO3 [20]. We tested these materials using ruthenium as a hydrogenation co-catalyst, both supported on carbon and directly impregnated on our catalysts. While impregnation of monoclinic WO3 with different metals has already been explored, this has not been studied using tungstite as a support to the best of our knowledge [14,21]. In this work, we explored the activity of various bulk and mesoporous (doped) tungsten oxides in tandem with carbon-supported ruthenium for cellulose conversion into EG. We investigated the influence of temperature and reaction time on the cellulose conversion and the product distribution. We also optimized the ruthenium loading towards optimum EG yield. 2 Experimental methods 2.1 Chemicals Tungsten hexachloride (WCl6, 99%), niobium pentachloride (NbCl5, 99.9%), titanium tetrachloride (TiCl4, 99%), titanium tetrabutoxide (Ti(OBu)4, 99%), zirconium tetrabutoxide (Zr(OBu)4, 80 wt% in 1-butanol), vanadium triisopropoxide oxide (VO(OiPr)3, 96%), ruthenium (III) nitrosyl nitrate (Ru(NO)(NO3)3, 31.3 wt% Ru) and ruthenium (III) chloride hydrate (RuCl3, 99.9%) were obtained from Alfa Aesar and kept in an MBraun glovebox under an inert argon atmosphere. n-butanol (n-BuOH, 99.8%,) and tert-butanol (t-BuOH, ≥99.5%), procured from Sigma-Aldrich, were distilled over CaH2 and stored on freshly activated 3 Å molsieves (Merck) under inert atmosphere. Microcrystalline cellulose powder (cellulose), ruthenium on carbon (Ru/C, 5% wt. loading) and tungsten oxide (WO3, 99.9%) were bought from Sigma-Aldrich. Ethane-1,2-diol (ethylene glycol, 99%), propane-1,2-diol (propylene glycol, 98+%), propane-1,2,3-triol (glycerol, 99+%), meso-erythritol (erythritol, 99%), d-mannitol (mannitol, 99%), d-sorbitol (sorbitol, 98%), butane-1,2-diol (1,2-BD, 98%), hexane-1,2-diol (1,2-HD, 98%) and d-(-)-glucose (glucose, 99) were received from Alfa Aesar and used as chromatography standards. Hydrogen (H2, 5.0), nitrogen (N2, 5.0), helium (He, 5.0) and carbon monoxide (CO, 4.7) were acquired from Linde Gas. 2.2 Catalyst preparation Bulk tungsten oxide (b-WO3) was prepared by hydrolysis of WCl6 (3.97 g; 10.0 mmol) in 160 mL deionized water kept at 50 °C overnight while stirred. The yellow precipitate was collected by filtration and washed several times with deionized water until neutral pH of the filtrate was reached. The residue was then dried at 60 °C in vacuo overnight. b-NbW5 (W/Nb atomic ratio of 5) was prepared in a similar fashion using a physical mixture of appropriate amounts of WCl6 and NbCl5. b-TiW5 (W/Ti atomic ratio of 5) were prepared by adding an appropriate amount of WCl6 to 160 mL water first and injecting the correct amount of TiCl4 within 10 s using a Finn pipette with the tip submerged in the water. After drying, the materials were used without further treatment. Mesoporous tungsten oxide (m-WO3) was prepared using a modified literature procedure [22]. Under inert conditions, WCl6 (7.20 g, 18.2 mmol) was dispersed into a cooled (0 °C) mixture of n-BuOH (10.8 mL) and t-BuOH (10.8 mL). The mixture was stirred vigorously for 10 min until a dark blue solution was obtained, which was then poured into a Teflon-lined autoclave and aged at 100 °C for 24 h. Dark blue solids were collected by filtration, washed several times with ethanol and dried overnight at 110 °C under vacuum to remove residual organics. Doped variants of m-WO3 (m-TiW5, m-VW5, m-ZrW5) were prepared by mixing the appropriate amount of metal alkoxide into the alcohol mixture prior to adding the WCl6 to achieve W/dopant atomic ratios of 5. m-NbW5 was obtained from dispersing a physical mixture of NbCl5 and WCl6 into the alcohol mixture. The mixtures acquired after full dissolution of the metal precursors were treated similarly as for the preparation of m-WO3. Supported Ru catalysts were prepared by wet impregnation. In a typical procedure, an appropriate amount of RuCl3 (for mesoporous oxides) or Ru(NO)(NO3)3 (for bulk oxides) was dissolved in 10 mL demineralized water. The required amount of support was added and the resulting suspension was homogenized for 3 h before evaporation to dryness at 85 °C. The solids were dried further at 110 °C under vacuum overnight, thoroughly grinded and pressed into a sieve fraction (125 μm–500 μm). The sieve fractions were reduced at 200 °C, ramp 2 °C/min, under a flow of 10% H2 in He (100 mL/min) for 4 h, followed by passivation in 1% O2/He (100 mL/min) at room temperature for 6 h. 2.3 Characterization Nitrogen sorption data was acquired from a Micromeritics Tristar 3000 in static measurement mode at −196 °C. The samples (typically 150 mg) were pretreated at 120 °C under a gentle N2 stream overnight prior to the sorption measurements. The Brunauer-Emmett-Teller (BET) equation was used to calculate the specific surface area (SBET) from the adsorption data (p/p0 = 0.05−0.25). Mesopore volumes (Vmeso), if applicable, were calculated by applying the Barrett-Joyner-Halenda (BJH) method on the adsorption branch. Powder X-ray diffraction (XRD) patterns were obtained from a Bruker Endeavour D2 Phaser diffractometer using Cu Kα radiation with a scanning speed of 0.6° min−1 in the range of 5° ≤ 2θ ≤ 60°. Crystal phases were identified using the DIFFRAC.EVA software package and the PDF-2 crystallographic database (version 2008). X-ray photoelectron spectroscopy (XPS) was carried out on a Thermo Scientific K-alpha equipped with a monochromatic small-spot X-ray source and a 180° double focusing hemispherical analyzer with a 128-channel detector. Initial pressure was 8·10−8 mbar or less which increased to 2·10-7 mbar due to the active argon charge compensation dual beam source during measurement. For a typical sample preparation, fresh catalyst was pressed down on carbon tape supported by an aluminium sample plate. Spectra were recorded using an Al Kα X-ray source (1486.6 eV, 72 W) and a spot size of 400 μm. Survey scans were taken at a constant pass energy of 200 eV, 0.5 eV step size, region scans at 50 eV constant pass energy with a step size of 0.1 eV. XP spectra were calibrated to the C-C carbon signal (284.8 eV) obtained from adventitious carbon and deconvoluted with CasaXPS. The peak areas thus obtained were used to estimate surface chemical composition. Infrared (IR) spectroscopy was used to evaluate acidic properties of the materials, using pyridine as probe molecule. Spectra were recorded in the range of 4000−1200 cm−1 at a resolution of 2 cm−1 on a Bruker Vertex V70v Fourier-Transform infrared spectrometer equipped with a DTGS detector and CaF2 windows to separate the environmental cell from the vacuum part. A total of 64 scans were averaged for each spectrum. Typically, finely powdered material was pressed into self-supporting wafers with density ρ ≃ 25 mg cm-2 using a pressing force of 3000 kg and placed inside a variable temperature IR transmission cell coupled to a closed gas circulation system. The samples were then outgassed at 70 °C in vacuo until a pressure of 2·10-6 mbar or lower was reached. Prior to pyridine adsorption, the sample was kept at 70 °C and a sample background was recorded. Pyridine was then introduced into the cell until saturation was reached, and physisorbed pyridine was removed in vacuo for 1 h. A second spectrum was recorded at this point. Difference spectra were obtained by subtraction of the sample background from the recorded spectra. Processing and deconvolution of the signals in the 1600−1400 cm−1 region was performed with Fityk curve fitting program using molar extinction coefficients determined by Datka et al. [23] such that (1) N = A ε ∙ ρ where N is the density of respective acid sites (μmol mg−1), A the integrated peak area (cm−1), ε the integrated molar extinction coefficient (cm μmol−1) and ρ the wafer density (mg cm-2). Elemental analysis was performed on a Spectroblue EOP ICP optical emission spectrometer with axial plasma viewing, equipped with a free-running 27.12 MHz generator operating at 1400 W. Prior to the measurement, the samples were digested using a 4 M KOH solution. For Ti and Zr containing samples, 8 vol. % HF was added to dissolve the dopant under heating (40 °C). Samples for ruthenium analysis were prepared by melt fusion of approximately 25 mg of freshly ground sample in a mixture of KNO3 (1 g) and KOH (0.3 g). Initial solutions are prepared in 2 M KOH and must immediately be diluted further in 0.5 M HCl. Authors advise to analyze the samples immediately after preparation as ruthenium tends to form precipitates in alkaline solutions, while tungsten oxide precipitates from solutions that are too acidic. Calibration lines were prepared using commercial standards. Care was taken that the calibration solutions contained the same concentration of auxiliaries as the analyte solutions. Temperature programmed reduction (TPR) plots were recorded on a Micromeritics Autochem II 2920. Powdered catalyst (100 mg–150 mg) was loaded between two quartz wool plugs in a quartz glass U-tube. Samples were pretreated in a 10 mL/min He flow at 130 °C for 2 h to remove physisorbed water and other adsorbates. TPR was then performed in a 50 mL/min flow of 4% H2 in N2 in a temperature range of 50 °C–750 °C, 10 °C/min. CO chemisorption data was obtained from a Micromeritics ASAP 2020. Powdered Ru-impregnated catalyst (100 mg–150 mg) was loaded between two quartz wool plugs in a quartz glass U-tube. Prior to measurement, the samples were reduced in situ at 200 °C for 4 h, ramp rate 2 °C/min in a flow of pure H2. CO chemisorption was then performed at 35 °C. Ru dispersion was calculated assuming an adsorption stoichiometry of 1.5 CO per surface ruthenium atom. Transmission electron microscopy (TEM) images were obtained in bright field mode from a FEI Tecnai 20 (type Sphera) operating with a LaB6 filament at 200 kV and a bottom mounted 1024 × 1024 Gatan msc 794™ CCD camera. Suitable samples were prepared by dropping a suspension of finely ground material in analytical grade absolute ethanol onto Quantifoil R 1.2/1.3 holey carbon films supported on a copper grid. 2.4 Catalytic activity tests All reactions were performed in a 100 mL high-pressure batch reactor. For a typical experiment, 300 mg of cellulose, an amount of catalyst and 40 mL of water were loaded into the reactor. The catalyst portion either consisted of 50 mg tungsten oxide and 10 mg 5 wt% Ru on carbon, or 50 mg Ru-impregnated tungsten oxide. After sealing, the reactor was purged several times with hydrogen and then pressurized to a final pressure of 45 bar. Stirring was set at 600 rpm and temperature was maintained at 210 °C, 225 °C or 240 °C for 30 min–180 min. The starting point of the reaction was set to when the reaction temperature was reached. After completion, the reactor was cooled to room temperature naturally. Gaseous products were captured in a pre-purged gas cylinder and reactor contents were recovered after addition of n-BuOH as internal standard, added for GC analysis. Solids were separated from the reaction liquor by centrifugation and dried at 110 °C under vacuum overnight. 2.5 Product analysis Cellulose conversion was determined by mass difference of cellulose before and after the reaction. Volatile reaction products (ethylene glycol, 1,2-propylene glycol and glycerol) were analyzed on an Interscience Focus GC-FID over a Stabilwax-DA column (30 m × 0.53 mm I.D., df =1.00 μm) and Shimadzu HPLC equipped with a Rezex-RPM monosaccharide column (300 × 7.8 mm) and ELSD, and milliQ grade water as mobile phase. Quantification was based on mass response factors determined by five-point calibration lines of commercial compounds. Volatile products were additionally referenced to n-BuOH as internal standard. Gaseous products were quantified on an Interscience Compact GC using a Molsieve 5 Å and Porabond Q column, each connected to a TCD, and an Al2O3/KCl column linked to an FID. Identification and quantification of gaseous products was based on a calibration gas standard containing known quantities of a standard gas mixture. Carbon product yields and selectivities, and total carbon balances were calculated from Eqs. (2)–(4). In these calculations, cellulose is regarded as a linear condensation polymer of glucose repeat units having a molar mass of 162 g/mol each. (2) Y i % = 100 * k i * n i k C 6 H 10 O 5 * n C 6 H 10 O 5 , i (3) S i % = 100 * k i * n i * n C 6 H 10 O 5 , i k C 6 H 10 O 5 * n C 6 H 10 O 5 , f - n C 6 H 10 O 5 , i (4) Y C ( % ) = 100 * ∑ k i * n i + k C 6 H 10 O 5 * n C 6 H 10 O 5 , f k C 6 H 10 O 5 * n C 6 H 10 O 5 , i Here, Y i , S i , k i and n i are the yield, selectivity, carbon number and moles of the respective products. Y C represents the carbon balance. n C 6 H 10 O 5 , i and n C 6 H 10 O 5 , f are the initial and final moles of cellulose, computed as moles of glucose repeat units. 3 Results and discussion (Doped) bulk and mesoporous tungsten oxides were synthesized using previously established procedures [16,17,20,22]. These materials have been used to catalyze the upgrading of glucose to 5-HMF and in-depth characterization and related discussions can be found in our earlier works. Main findings relevant to the present study are discussed below. Bulk compositions of the doped materials were determined by ICP and the results are given in Table 1 . We find that the measured tungsten/dopant levels are close to the desired ones. Sorption measurements (Table 1 and Fig. S1) show the difference in surface area and available pore volume between the sets of bulk and mesoporous materials. Lewis and Brønsted acid densities were analyzed by IR spectroscopy with pyridine as a probe molecule and molecular absorption coefficients as established by Datka et al. [23]. Lewis acid densities of the undoped materials (b-WO3 and m-WO3) are similar when normalized by surface area. Upon doping, the LAS density drops invariably as a result of replacing Lewis acidic W6+ cations by dopant cations. The largest decrease in LAS density was observed for m-VW5. The BAS density increases significantly for the doped bulk materials (b-NbW5 and b-TiW5) as a result of introducing elements with a lower valance state than W6+. This introduces a charge defect which is compensated with an acidic proton. This effect, however, was not observed for the mesoporous doped materials and the BAS density instead dropped after doping. We surmise that this particular effect is induced by additional charge compensation effects induced by varying levels of dopants present on the surface. Note that b-WO3 and m-WO3 themselves already possess a substantial number of BAS, resulting from partial reduction of W6+ cations to W5+. TEM micrographs of the bulk and mesoporous oxides are displayed in Fig. 1 and present layered phases for all three bulk materials. The sheets which build up b-WO3 and b-NbW5 have clearly defined plane edges, while the sheet edges of b-TiW5 are very corrugated. XRD analysis (Fig. 2 ) of the bulk materials shows that tungstite constitutes b-WO3 as crystal phase, while b-NbW5 and b-TiW5 mainly consist of hydrotungstite. In contrast to the sheet-like structure of the bulk materials, all mesoporous oxides consist of an aggregation of irregularly shaped nanoparticles, ranging in size between 5 nm–10 nm. The mesoporous materials mainly comprise sub-stoichiometric β-W20O58. This phase comprises a significant fraction of W5+, which is formed during the synthesis procedure. In addition, m-TiW5 and m-VW5 contain a ribbon-like phase. We suspect this might be tungstite, which can also be observed in XRD measurements. Direct upgrading of cellulose to EG is a complex process with many possible undesired side reactions. Cellulose is recalcitrant to depolymerization, which requires high temperatures. As such, cellulose depolymerization or perhaps its hydrolysis to glucose fragments can be considered the rate determining step. This, however, is beneficial as it keeps the glucose concentration low during the reaction, which prevents its degradation to humins to a significant degree. The retro-aldol functionality of tungsten oxide plays a critical role in converting glucose liberated from cellulose to glycol aldehyde (Scheme 1), which is then hydrogenated to EG. From previous research on tungsten oxide materials, we discovered that tungstite was significantly more active catalyst than monoclinic WO3 [20]. As such, we compared the activity of these two materials (Table 2 , entry 1 and 3). We indeed found the performance of tungstite to be superior, both in activity and selectivity towards EG. Monoclinic WO3 contains very few Brønsted acid sites for its surface area, which itself is significantly smaller than that of b-WO3. These factors combined result in its poor activity compared to b-WO3.The difference in activity of tungstite and monoclinic WO3 can also be observed in the distribution of side products. C4 and C6 products are obtained with both catalysts, but the product distribution is different. Monoclinic WO3 produces polyols as C4 and C6 side products, whereas tungstite is more selective towards the corresponding 1,2-diols. The 1,2-diols are formed from their respective polyols by successive dehydration and hydrogenation. It must be noted that all reaction mixtures were faintly blue in color immediately after recovering the reaction mixture, which is probably caused by finely divided catalytic material, but can also result from soluble tungsten oxide species as reported by Tai et al. among others [24]. Soluble HxWO3 species and meta- and paratungstates are known to catalyze the depolymerization and hydrolysis of cellulose [25–27]. This implies that these processes could also be partially homogeneous in nature in our case. However, heterogenic processes cannot be discarded as there is a clear relation between the Brønsted acidity of the material and the level of conversion. This was shown by doping b-WO3 with niobium or titanium, which increases the Brønsted acidity of the material by inducing charge defects which are compensated by acidic protons, which is reported in earlier work [16,17]. Comparing entries 6 and 9 to 3, doping of tungstite indeed accelerated conversion of cellulose. However, the increased acidity had a negative impact on EG selectivity. This is likely caused by humin formation, as the carbon balance is also negatively affected. Increasing the temperature to 240 °C (entries 4, 7 and 10) equally increased conversion while decreasing the EG selectivity and the carbon balance. Lowering the temperature to 210 °C (entries 2, 5 and 8) was beneficial to EG selectivity and improved the carbon balance significantly, but none of the doped materials exceeded the performance of tungstite. b-WO3 was therefore used to perform a kinetic study (Table 3 ). The majority of the EG production occurs in the first hour and the reaction reaches a stable plateau from that point as there is no remarkable change in selectivities towards different side products past one hour of reaction time. A plausible explanation is that during the first half an hour, the amount of free glucose and short-chain cellulose oligomers is still very low, and the catalyst is still active enough to convert these to non-humin forming species. The selectivity to the various hydrogenated species is therefore still high in the first 30 min to 1 h. During the course of the reaction, the amount of soluble short chain cellulose oligomers keeps increasing and so will the apparent conversion, which is purely based on the mass loss of recovered solids. However, these short chains are expected to deposit on the catalytic surface, form humins in the process, and will so deactivate the catalyst. The kinetic data enables us to estimate overall turnover frequencies based on cellulose conversion, assuming that the required Brønsted acidity only stems from the catalyst. With these assumptions in mind, we find an overall TON of 1277 mol cellulose / mol BAS and an overall TOF of 425 mol cellulose / (mol BAS · h). Next, the influence of surface area on the conversion and EG selectivity was evaluated by screening a series of (doped) of mesoporous tungsten oxides using temperatures of 210 °C and 225 °C and a reaction time of 1 h, as longer reaction times were not beneficial for EG production. The results are presented in Table 4 . For this series, we additionally measured the formation of gaseous products, as ethylene and propylene glycol could in theory be dehydrated and hydrogenated as well, forming a number of C1 to C3 gaseous products in the process. m-WO3 is indeed more active than b-WO3 (Table 4, entries 1 and 2), but its use is accompanied with a significant drop in EG selectivity and carbon balance. The higher BAS density of this material is potentially the cause of the unwanted degradation of glucose and glucose oligomers to humins. The benefit of increased surface area is less than expected, but this is likely caused by the inaccessibility of a significant fraction of the material by larger cellulose fragments. Comparing the various dopants to m-WO3, V-doping is most beneficial when operating at 210 °C (entries 2 and 8), as a selectivity of 89% is reached at comparable conversion. At 225 °C, doping with Nb is most effective (entries 3 and 5) as conversion is traded for selectivity. Gaseous products are indeed formed, but only in low quantities and these neither seem to be influenced by temperature nor by dopant. Overall, the temperature has a remarkable effect on the retro-aldol activity of the various materials. At 210 °C, m-WO3 produces C4 and C6 polyols as side-products; at 225 °C, their dehydrated and hydrogenated 1,2-diol analogues are produced. Also of interest here is that m-TiW5 and m-ZrW5 (entries 6 and 10) produced 1,2-butanediol already at 210 °C, but m-WO3, m-NbW5 and m-VW5 (entries 2, 4 and 8) did not. We surmise that tetravalent cations might provide alternative routes to form diols, which are not possible for pentavalent and tungsten cations. Deeming m-WO3 and m-NbW5 the best-performing materials at 225 °C and 1 h, we subjected these oxides to a similar kinetic study as b-WO3. The results are presented in Table 5 and these show trends comparable to tungstite. The majority of EG is again produced in the first hour in either case. C4 and C6 polyols are produced in the first hour and are converted further to 1,2-diols. Interesting here is that m-WO3 seems to outperform b-WO3 in the first 30 min of reaction time as the selectivity towards EG is higher (71% vs. 63%). Comparing the selectivities towards 1,2-diols and C4 and C6 polyols of these materials, m-WO3 produces less of these side products in the first half hour. Only aldehyde or carbonyl-containing fragments can be retro-aldolized into shorter fragments. When these functional groups are hydrogenated prematurely, they will contribute to the yield of C4 and C6 polyols or their 1,2-diol analogues after dehydration and hydrogenation. From this, we can conclude that the retro-aldolization rate of m-WO3 is higher than the hydrogenation rate in this time period when compared to b-WO3. Using the same assumptions as used for TON and TOF calculations of b-WO3, TON and hourly TOF values of m-WO3 and m-NbW5 are respectively 128 mol cellulose / mol BAS and 43 mol cellulose / (mol BAS h), and 378 mol cellulose / mol BAS and 126 mol cellulose / (mol BAS · h). After formation, glycol aldehyde needs to migrate to a metal function for hydrogenated to EG. The distance between retro-aldol and hydrogenation functions will therefore affect the likelihood for the aldehyde to degrade. To shorten the migration time, we impregnated our best-performing materials (b-WO3, m-WO3 and m-NbW5) with ruthenium (0.2 wt%, 0.5 wt%, 1 wt% and 2 wt%). Actual weight loadings, particle sizes and dispersions are summarized in Table 6 . For b-WO3, the measured weight loadings are in good agreement with the desired ones. However, the actual weight loadings for both mesoporous materials deviate significantly from the intended ones. The reason for this is unclear as we could not find any relation between intended and obtained loadings. More importantly, at a loading of 0.25 wt%, particles on b-WO3 are already quite large at 8 nm, exceeding 20 nm at a weight loading of 2.28 wt%. We surmise this is due to the limited surface area of b-WO3 as the average ruthenium particle sizes on the mesoporous materials are small in comparison, i.e. 1.42 nm for m-WO3 and 1.75 nm for m-NbW5. The particle sizes similarly increase with higher weight loadings, but this effect is far less apparent. The effect of ruthenium impregnation and subsequent pretreatment in reducing conditions at elevated temperatures on the support was evaluated with XRD and TPR. Diffractograms are displayed in Fig. 3 . m-WO3 and m-NbW5 stay relatively unaffected with regard to crystal phase and that the peaks become slightly sharper. In contrast, b-WO3 undergoes significant changes in crystal phase under the applied conditions. Tungstite transforms into the same β-W20O58 phase when exposed to the pretreatment conditions and the extent of this transformation seems to depend on the ruthenium loading. This suggests reduction of the tungstite support by hydrogen spillover from the ruthenium metal as a plausible mechanism. A similar mechanism has already been described by Khoobiar et al. for Pt/WO3 [28]. TPR profiles (Fig. 4 ) show that ruthenium reduces earlier on the mesoporous materials than on the bulk tungstite. Ru reducibility on the mesoporous materials depends on the ruthenium loading as peak maxima shift to lower temperatures with increasing ruthenium loading. In contrast, reducibility of the support from β-W20O58 to WO2 (temperature range from 750 °C to 850 °C) increases with increasing Ru loading. For tungstite, ruthenium is reduced in two consecutive steps. This phenomenon is not observed for the mesoporous materials. We then screened these materials using reaction conditions of 225 °C and 1 h. The results are presented in Table 7 . Overall, the Ru-impregnated catalysts achieve lower conversions than the non-impregnated materials + Ru/C. However, impregnating b-WO3 with increasing levels of Ru results in higher EG selectivity (Table 7, entries 1–5), and even exceeds the EG selectivity of the system using separate retro-aldol and hydrogenation functions. Additionally, low loadings of Ru suppress formation of C4 and C6 polyols, but this becomes more favored with increasing Ru loadings, as expected. Interestingly, selectivity towards 1,2-PG also increased with larger Ru amounts. This is likely caused by isomerization reactions promoted by b-WO3. The m-WO3 series (Table 7, entries 6–10) behaves comparable to the b-WO3 series as cellulose conversion drops and EG selectivity increases with increasing Ru loadings. C4 and C6 selectivities are also reduced by impregnation and equally increase with increasing Ru loadings, as does 1,2-propylene glycol selectivity. Impregnation of m-NbW5 (entries 11–15) does not show such a increase in selectivity towards EG, although the trend of the initially low but increasing selectivities towards C3, C4 and C6 compounds is preserved. From this screening, we can conclude that impregnation of b-WO3 with 2 wt% offers significant advantages over separate hydrogenation and retro-aldol functions. Although the conversion is lower, this is more than compensated by lower C4 and C6 side product formation, which facilitates separation of EG from the reaction mixture. A kinetic study was performed to probe the activity of this catalyst over time and the results are displayed in Table 8 . Very little side products are formed within the first half hour of reaction time, with comparable carbon balances as other reactions ran for this time period. The amount of polyols stays low, even after 3 h of reaction time, very different from the separate tungsten oxide and Ru/C systems tested in this work. However, we find here that the majority of EG production again takes place in the first hour of reaction time, with decent carbon balance and low side product formation. 4 Conclusion We investigated the influence of doping tungstite and mesoporous tungsten oxides with early transition metals on the depolymerization of cellulose to glucose and the retro-aldolization of glucose to C2 aldehydes. Both tungstite (b-WO3) and mesoporous tungsten oxide (m-WO3) were more active and EG selective than monoclinic WO3, using carbon-supported ruthenium that provided the hydrogenation function to convert intermediate C2 aldehyde to EG. Monoclinic WO3 reached 40% cellulose conversion with 30% EG selectivity after 2 h of reaction time and was easily surpassed by b-WO3 and m-WO3 in performance, which reached 62% and 67% conversion with EG selectivities of 61% and 50%, respectively, after only 1 h of reaction. Kinetic studies performed with b-WO3 and m-WO3 show that their cellulose conversion rates are comparable, but m-WO3 initially has a higher EG selectivity than b-WO3 (72% vs. 63%). After 1 h, the EG selectivity of m-WO3 drops to 50%, while the EG selectivity of b-WO3 remains steady at 61%. Longer reaction times have a negative effect on EG selectivity, dropping to 50% and 41% for respectively b-WO3 and m-WO3 after 3 h of reaction time. Doping of b-WO3 with niobium (b-NbW5) or titanium (b-TiW5) enhanced the rate of cellulose depolymerization to glucose through a higher Brønsted acidity, but this did not increase the retro-aldol performance as the higher acidity resulted in an increased rate of humin formation, especially noticeable when using b-TiW5. Doping of m-WO3 with niobium (m-NbW5) or titanium (m-TiW5) did not significantly improve the conversion, although a slightly higher EG selectivity was observed when m-NbW5 (57%) was used, compared to m-WO3 (50%). Doping with vanadium (m-VW5) or zirconium (m-ZrW5) lowered and increased cellulose conversion, but neither dopant increased EG selectivity. Since m-NbW5 was slightly more efficient regarding EG selectivity than m-WO3, we also subjected that material to a kinetic study and found that its performance was comparable to that of b-WO3 and m-WO3, especially in the first hour. Impregnation of these three materials (b- and m-WO3, and m-NbW5) with varying levels of ruthenium showed that a weight loading of 2% on tungstite rendered the most effective catalyst, based on EG selectivity and carbon balance. While the total EG yield of the impregnated material is lower (33% vs. 38%), the EG selectivity and significantly lower polyol yield make tungstite impregnated with 2 wt% of ruthenium the promising catalyst in our study. Conflicts of interest There are no conflicts to declare. Acknowledgements The authors would like to acknowledge M.W.G.M Verhoeven and J.J.G van Velzen for their invaluable support during construction of the reactor. This work was supported by the Netherlands Center for Multiscale Catalytic Energy Conversion (MCEC), an NWO Gravitation programme funded by the Ministry of Education, Culture and Science of the government of the Netherlands. Appendix A Supplementary data Supplementary material related to this article can be found, in the online version, at doi:https://doi.org/10.1016/j.mcat.2019.110400. Appendix A Supplementary data The following is Supplementary data to this article: References [1] H. Yue Y. Zhao X. Ma J. Gong Ethylene glycol: properties, synthesis, and applications Chem. Soc. Rev. 41 2012 4218 4244 10.1039/c2cs15359a [2] Mono-Ethylene Glycol (MEG) Production, Market, Price and Its Properties 2019 (Accessed 1 May 2019) https://www.plasticsinsight.com/resin-intelligence/resin-prices/mono-ethylene-glycol-meg/ [3] M. Yabushita H. Kobayashi A. Fukuoka Catalytic transformation of cellulose into platform chemicals Appl. Catal. B Environ. 145 2014 1 9 10.1016/j.apcatb.2013.01.052 [4] P. Gallezot Conversion of biomass to selected chemical products Chem. Soc. Rev. 41 2012 1538 1558 10.1039/C1CS15147A [5] J.A. Melero J. Iglesias A. Garcia Biomass as renewable feedstock in standard refinery units. Feasibility, opportunities and challenges Energy Environ. Sci. 5 2012 7393 7420 10.1039/c2ee21231e [6] D.A. Cantero M.D. Bermejo M.J. Cocero Kinetic analysis of cellulose depolymerization reactions in near critical water J. Supercrit. Fluids 75 2013 48 57 10.1016/j.supflu.2012.12.013 [7] A. Shrotri H. Kobayashi A. Fukuoka Cellulose depolymerization over heterogeneous catalysts Acc. Chem. Res. 51 2018 761 768 10.1021/acs.accounts.7b00614 [8] J. Wang J. Xi Y. Wang Recent advances in the catalytic production of glucose from lignocellulosic biomass Green Chem. 17 2015 737 751 10.1039/C4GC02034K [9] R. Rinaldi F. Schüth Acid hydrolysis of cellulose as the entry point into biorefinery schemes ChemSusChem 2 2009 1096 1107 10.1002/cssc.200900188 [10] G. Zhao M. Zheng J. Zhang A. Wang T. Zhang Catalytic conversion of concentrated glucose to ethylene glycol with semicontinuous reaction system Ind. Eng. Chem. Res. 52 2013 9566 9572 10.1021/ie400989a [11] R. Ooms M. Dusselier J.A. Geboers B. Op De Beeck R. Verhaeven E. Gobechiya J.A. Martens A. Redl B.F. Sels Conversion of sugars to ethylene glycol with nickel tungsten carbide in a fed-batch reactor: high productivity and reaction network elucidation Green Chem. 16 2014 695 707 10.1039/c3gc41431k [12] M. Zheng J. Pang R. Sun A. Wang T. Zhang Selectivity control for cellulose to diols: dancing on eggs ACS Catal. 7 2017 1939 1954 10.1021/acscatal.6b03469 [13] J. Chai S. Zhu Y. Cen J. Guo J. Wang W. Fan Effect of tungsten surface density of WO 3 –ZrO 2 on its catalytic performance in hydrogenolysis of cellulose to ethylene glycol RSC Adv. 7 2017 8567 8574 10.1039/C6RA27524A [14] L. Wei H. Teng J. Zhou N. Li Y. Zheng Metal nanoparticles supported on WO 3 nanosheets for highly selective hydrogenolysis of cellulose to ethylene glycol Green Chem. 19 2016 682 691 10.1039/c6gc01327a [15] K. Fabičovicová M. Lucas P. Claus From microcrystalline cellulose to hard- and softwood-based feedstocks: their hydrogenolysis to polyols over a highly efficient ruthenium-tungsten catalyst Green Chem. 17 2015 3075 3083 10.1039/c5gc00421g [16] C. Yue G. Li E.A. Pidko J.J. Wiesfeld M. Rigutto E.J.M. Hensen Dehydration of glucose to 5-Hydroxymethylfurfural using Nb-doped tungstite ChemSusChem 9 2016 10.1002/cssc.201600649 [17] J.J. Wiesfeld N.A.J.M. Sommerdijk E.J.M. Hensen Early transition metal doped tungstite as an effective catalyst for glucose upgrading to 5-hydroxymethylfurfural Catal. Lett. 148 2018 3093 3101 10.1007/s10562-018-2483-4 [18] J. Wiesfeld R. Gaquere E.J.M. Hensen Mesoporous doped tungsten oxide for glucose dehydration to 5-Hydroxymethylfurfural ACS Sustain. Chem. Eng. 2019 10.1021/acssuschemeng.8b05684 acssuschemeng.8b05684 [19] Y. Liu C. Luo H. Liu Tungsten trioxide promoted selective conversion of cellulose into propylene glycol and ethylene glycol on a ruthenium catalyst Angew. Chemie - Int. Ed. 51 2012 3249 3253 10.1002/anie.201200351 [20] J.J. Wiesfeld R. Gaquere E.J.M. Hensen Mesoporous doped tungsten oxide for glucose dehydration to 5-hydroxymethylfurfural, ACS sustain Chem. Eng. 7 2019 7552 7562 10.1021/acssuschemeng.8b05684 [21] N. Li Z. Ji L. Wei Y. Zheng Q. Shen Q. Ma M. Tan M. Zhan J. Zhou Effect of the surface acid sites of tungsten trioxide for highly selective hydrogenation of cellulose to ethylene glycol Bioresour. Technol. 264 2018 58 65 10.1016/j.biortech.2018.05.026 [22] G. Orsini V. Tricoli Facile nonhydrolytic sol-gel route to mesoporous mixed-conducting tungsten oxide J. Mater. Chem. 21 2011 14530 14542 10.1039/c1jm10777a [23] J. Datka A.M. Turek J.M. Jehng I.E. Wachs Acidic properties of supported niobium oxide catalysts: an infrared spectroscopy investigation J. Catal. 135 1992 186 199 10.1016/0021-9517(92)90279-Q [24] Z. Tai J. Zhang A. Wang M. Zheng T. Zhang Temperature-controlled phase-transfer catalysis for ethylene glycol production from cellulose Chem. Commun. 48 2012 7052 7054 10.1039/c2cc32305b [25] J. Geboers S. Van De Vyver K. Carpentier K. De Blochouse P. Jacobs B. Sels Efficient catalytic conversion of concentrated cellulose feeds to hexitols with heteropoly acids and Ru on carbon Chem. Commun. 46 2010 3577 3579 10.1039/c001096k [26] J. Geboers S. Van De Vyver K. Carpentier P. Jacobs B. Sels Hydrolytic hydrogenation of cellulose with hydrotreated caesium salts of heteropoly acids and Ru/C Green Chem. 13 2011 2167 2174 10.1039/c1gc15350a [27] R. Palkovits K. Tajvidi A.M. Ruppert J. Procelewska Heteropoly acids as efficient acid catalysts in the one-step conversion of cellulose to sugar alcohols Chem. Commun. 47 2011 576 578 10.1039/c0cc02263b [28] S. Khoobiar Particle to particle migration of hydrogen atoms on platinum-alumina catalysts from particle to neighboring particles J. Phys. Chem. 68 1964 411 412 10.1021/j100784a503",
      "scopus-id": "85065772976",
      "coredata": {
        "eid": "1-s2.0-S2468823119302160",
        "dc:description": "The conversion of cellulose into ethylene glycol remains a significant challenge in the biobased domain. Here we explored the activity of various bulk and mesoporous (doped) tungsten oxides in combination with carbon-supported ruthenium for obtaining ethylene glycol from cellulose. Tungstite and sub-stoichiometric tungsten oxides are more active and selective than monoclinic WO3. Doping tungstite with early transition metals enhanced the rate of cellulose depolymerization to glucose through a higher Brønsted acidity, although this did not improve the overall performance as the higher acidity resulted in a higher rate of humin formation. The increased acidity of mesoporous sub-stoichiometric tungsten oxide compared to tungstite had a similar adverse effect. Doping this material with niobium improved ethylene glycol selectivity at similar conversion. Kinetic studies showed that the majority of ethylene glycol is produced in the first hour for three optimized catalysts, with undoped bulk tungstite being the most efficient catalytic material. Impregnation of these materials with ruthenium instead of using carbon-supported ruthenium as a co-catalyst was most beneficial for tungstite, as it showed improved ethylene glycol selectivity and lower polyol yields after 1 h of reaction time.",
        "openArchiveArticle": "false",
        "prism:coverDate": "2019-08-31",
        "openaccessUserLicense": "http://creativecommons.org/licenses/by/4.0/",
        "prism:aggregationType": "Journal",
        "prism:url": "https://api.elsevier.com/content/article/pii/S2468823119302160",
        "dc:creator": [
          {
            "@_fa": "true",
            "$": "Wiesfeld, Jan J."
          },
          {
            "@_fa": "true",
            "$": "Peršolja, Peter"
          },
          {
            "@_fa": "true",
            "$": "Rollier, Floriane A."
          },
          {
            "@_fa": "true",
            "$": "Elemans-Mehring, Adelheid M."
          },
          {
            "@_fa": "true",
            "$": "Hensen, Emiel J.M."
          }
        ],
        "link": [
          {
            "@_fa": "true",
            "@rel": "self",
            "@href": "https://api.elsevier.com/content/article/pii/S2468823119302160"
          },
          {
            "@_fa": "true",
            "@rel": "scidir",
            "@href": "https://www.sciencedirect.com/science/article/pii/S2468823119302160"
          }
        ],
        "dc:format": "application/json",
        "openaccessType": "Full",
        "pii": "S2468-8231(19)30216-0",
        "prism:volume": "473",
        "articleNumber": "110400",
        "prism:publisher": "The Author(s). Published by Elsevier B.V.",
        "dc:title": "Cellulose conversion to ethylene glycol by tungsten oxide-based catalysts",
        "prism:copyright": "© 2019 The Author(s). Published by Elsevier B.V.",
        "openaccess": "1",
        "prism:issn": "24688231",
        "dcterms:subject": [
          {
            "@_fa": "true",
            "$": "Retro-aldol"
          },
          {
            "@_fa": "true",
            "$": "Biomass valorization"
          },
          {
            "@_fa": "true",
            "$": "Cellulose"
          },
          {
            "@_fa": "true",
            "$": "Tungsten oxide"
          },
          {
            "@_fa": "true",
            "$": "Ethylene glycol"
          }
        ],
        "openaccessArticle": "true",
        "prism:publicationName": "Molecular Catalysis",
        "openaccessSponsorType": "FundingBody",
        "prism:pageRange": "110400",
        "pubType": "fla",
        "prism:coverDisplayDate": "August 2019",
        "prism:doi": "10.1016/j.mcat.2019.110400",
        "prism:startingPage": "110400",
        "dc:identifier": "doi:10.1016/j.mcat.2019.110400",
        "openaccessSponsorName": "VSNU"
      },
      "objects": {
        "object": [
          {
            "@category": "thumbnail",
            "@height": "87",
            "@width": "219",
            "@_fa": "true",
            "$": "https://api.elsevier.com/content/object/eid/1-s2.0-S2468823119302160-ga1.sml?httpAccept=%2A%2F%2A",
            "@multimediatype": "GIF image file",
            "@type": "IMAGE-THUMBNAIL",
            "@size": "6482",
            "@ref": "ga1",
            "@mimetype": "image/gif"
          },
          {
            "@category": "thumbnail",
            "@height": "107",
            "@width": "219",
            "@_fa": "true",
            "$": "https://api.elsevier.com/content/object/eid/1-s2.0-S2468823119302160-gr1.sml?httpAccept=%2A%2F%2A",
            "@multimediatype": "GIF image file",
            "@type": "IMAGE-THUMBNAIL",
            "@size": "11452",
            "@ref": "gr1",
            "@mimetype": "image/gif"
          },
          {
            "@category": "thumbnail",
            "@height": "131",
            "@width": "219",
            "@_fa": "true",
            "$": "https://api.elsevier.com/content/object/eid/1-s2.0-S2468823119302160-gr2.sml?httpAccept=%2A%2F%2A",
            "@multimediatype": "GIF image file",
            "@type": "IMAGE-THUMBNAIL",
            "@size": "9447",
            "@ref": "gr2",
            "@mimetype": "image/gif"
          },
          {
            "@category": "thumbnail",
            "@height": "164",
            "@width": "107",
            "@_fa": "true",
            "$": "https://api.elsevier.com/content/object/eid/1-s2.0-S2468823119302160-gr3.sml?httpAccept=%2A%2F%2A",
            "@multimediatype": "GIF image file",
            "@type": "IMAGE-THUMBNAIL",
            "@size": "6727",
            "@ref": "gr3",
            "@mimetype": "image/gif"
          },
          {
            "@category": "thumbnail",
            "@height": "163",
            "@width": "106",
            "@_fa": "true",
            "$": "https://api.elsevier.com/content/object/eid/1-s2.0-S2468823119302160-gr4.sml?httpAccept=%2A%2F%2A",
            "@multimediatype": "GIF image file",
            "@type": "IMAGE-THUMBNAIL",
            "@size": "5739",
            "@ref": "gr4",
            "@mimetype": "image/gif"
          },
          {
            "@category": "thumbnail",
            "@height": "164",
            "@width": "161",
            "@_fa": "true",
            "$": "https://api.elsevier.com/content/object/eid/1-s2.0-S2468823119302160-sc1.sml?httpAccept=%2A%2F%2A",
            "@multimediatype": "GIF image file",
            "@type": "IMAGE-THUMBNAIL",
            "@size": "6418",
            "@ref": "sc1",
            "@mimetype": "image/gif"
          },
          {
            "@category": "standard",
            "@height": "200",
            "@width": "500",
            "@_fa": "true",
            "$": "https://api.elsevier.com/content/object/eid/1-s2.0-S2468823119302160-ga1.jpg?httpAccept=%2A%2F%2A",
            "@multimediatype": "JPEG image file",
            "@type": "IMAGE-DOWNSAMPLED",
            "@size": "25432",
            "@ref": "ga1",
            "@mimetype": "image/jpeg"
          },
          {
            "@category": "standard",
            "@height": "333",
            "@width": "679",
            "@_fa": "true",
            "$": "https://api.elsevier.com/content/object/eid/1-s2.0-S2468823119302160-gr1.jpg?httpAccept=%2A%2F%2A",
            "@multimediatype": "JPEG image file",
            "@type": "IMAGE-DOWNSAMPLED",
            "@size": "88667",
            "@ref": "gr1",
            "@mimetype": "image/jpeg"
          },
          {
            "@category": "standard",
            "@height": "225",
            "@width": "376",
            "@_fa": "true",
            "$": "https://api.elsevier.com/content/object/eid/1-s2.0-S2468823119302160-gr2.jpg?httpAccept=%2A%2F%2A",
            "@multimediatype": "JPEG image file",
            "@type": "IMAGE-DOWNSAMPLED",
            "@size": "27975",
            "@ref": "gr2",
            "@mimetype": "image/jpeg"
          },
          {
            "@category": "standard",
            "@height": "521",
            "@width": "340",
            "@_fa": "true",
            "$": "https://api.elsevier.com/content/object/eid/1-s2.0-S2468823119302160-gr3.jpg?httpAccept=%2A%2F%2A",
            "@multimediatype": "JPEG image file",
            "@type": "IMAGE-DOWNSAMPLED",
            "@size": "53032",
            "@ref": "gr3",
            "@mimetype": "image/jpeg"
          },
          {
            "@category": "standard",
            "@height": "524",
            "@width": "340",
            "@_fa": "true",
            "$": "https://api.elsevier.com/content/object/eid/1-s2.0-S2468823119302160-gr4.jpg?httpAccept=%2A%2F%2A",
            "@multimediatype": "JPEG image file",
            "@type": "IMAGE-DOWNSAMPLED",
            "@size": "46444",
            "@ref": "gr4",
            "@mimetype": "image/jpeg"
          },
          {
            "@category": "standard",
            "@height": "520",
            "@width": "510",
            "@_fa": "true",
            "$": "https://api.elsevier.com/content/object/eid/1-s2.0-S2468823119302160-sc1.jpg?httpAccept=%2A%2F%2A",
            "@multimediatype": "JPEG image file",
            "@type": "IMAGE-DOWNSAMPLED",
            "@size": "54691",
            "@ref": "sc1",
            "@mimetype": "image/jpeg"
          },
          {
            "@category": "standard",
            "@_fa": "true",
            "$": "https://api.elsevier.com/content/object/eid/1-s2.0-S2468823119302160-mmc1.docx?httpAccept=%2A%2F%2A",
            "@multimediatype": "Microsoft Word file",
            "@type": "APPLICATION",
            "@size": "261534",
            "@ref": "mmc1",
            "@mimetype": "application/word"
          },
          {
            "@category": "thumbnail",
            "@height": "42",
            "@width": "96",
            "@_fa": "true",
            "$": "https://api.elsevier.com/content/object/eid/1-s2.0-S2468823119302160-si1.gif?httpAccept=%2A%2F%2A",
            "@multimediatype": "GIF image file",
            "@type": "ALTIMG",
            "@size": "327",
            "@ref": "si1",
            "@mimetype": "image/gif"
          },
          {
            "@category": "thumbnail",
            "@height": "30",
            "@width": "86",
            "@_fa": "true",
            "$": "https://api.elsevier.com/content/object/eid/1-s2.0-S2468823119302160-si10.gif?httpAccept=%2A%2F%2A",
            "@multimediatype": "GIF image file",
            "@type": "ALTIMG",
            "@size": "355",
            "@ref": "si10",
            "@mimetype": "image/gif"
          },
          {
            "@category": "thumbnail",
            "@height": "30",
            "@width": "92",
            "@_fa": "true",
            "$": "https://api.elsevier.com/content/object/eid/1-s2.0-S2468823119302160-si11.gif?httpAccept=%2A%2F%2A",
            "@multimediatype": "GIF image file",
            "@type": "ALTIMG",
            "@size": "371",
            "@ref": "si11",
            "@mimetype": "image/gif"
          },
          {
            "@category": "thumbnail",
            "@height": "51",
            "@width": "257",
            "@_fa": "true",
            "$": "https://api.elsevier.com/content/object/eid/1-s2.0-S2468823119302160-si2.gif?httpAccept=%2A%2F%2A",
            "@multimediatype": "GIF image file",
            "@type": "ALTIMG",
            "@size": "1072",
            "@ref": "si2",
            "@mimetype": "image/gif"
          },
          {
            "@category": "thumbnail",
            "@height": "53",
            "@width": "345",
            "@_fa": "true",
            "$": "https://api.elsevier.com/content/object/eid/1-s2.0-S2468823119302160-si3.gif?httpAccept=%2A%2F%2A",
            "@multimediatype": "GIF image file",
            "@type": "ALTIMG",
            "@size": "1523",
            "@ref": "si3",
            "@mimetype": "image/gif"
          },
          {
            "@category": "thumbnail",
            "@height": "55",
            "@width": "320",
            "@_fa": "true",
            "$": "https://api.elsevier.com/content/object/eid/1-s2.0-S2468823119302160-si4.gif?httpAccept=%2A%2F%2A",
            "@multimediatype": "GIF image file",
            "@type": "ALTIMG",
            "@size": "1542",
            "@ref": "si4",
            "@mimetype": "image/gif"
          },
          {
            "@category": "thumbnail",
            "@height": "30",
            "@width": "32",
            "@_fa": "true",
            "$": "https://api.elsevier.com/content/object/eid/1-s2.0-S2468823119302160-si5.gif?httpAccept=%2A%2F%2A",
            "@multimediatype": "GIF image file",
            "@type": "ALTIMG",
            "@size": "161",
            "@ref": "si5",
            "@mimetype": "image/gif"
          },
          {
            "@category": "thumbnail",
            "@height": "30",
            "@width": "31",
            "@_fa": "true",
            "$": "https://api.elsevier.com/content/object/eid/1-s2.0-S2468823119302160-si6.gif?httpAccept=%2A%2F%2A",
            "@multimediatype": "GIF image file",
            "@type": "ALTIMG",
            "@size": "173",
            "@ref": "si6",
            "@mimetype": "image/gif"
          },
          {
            "@category": "thumbnail",
            "@height": "31",
            "@width": "30",
            "@_fa": "true",
            "$": "https://api.elsevier.com/content/object/eid/1-s2.0-S2468823119302160-si7.gif?httpAccept=%2A%2F%2A",
            "@multimediatype": "GIF image file",
            "@type": "ALTIMG",
            "@size": "166",
            "@ref": "si7",
            "@mimetype": "image/gif"
          },
          {
            "@category": "thumbnail",
            "@height": "27",
            "@width": "30",
            "@_fa": "true",
            "$": "https://api.elsevier.com/content/object/eid/1-s2.0-S2468823119302160-si8.gif?httpAccept=%2A%2F%2A",
            "@multimediatype": "GIF image file",
            "@type": "ALTIMG",
            "@size": "159",
            "@ref": "si8",
            "@mimetype": "image/gif"
          },
          {
            "@category": "thumbnail",
            "@height": "30",
            "@width": "38",
            "@_fa": "true",
            "$": "https://api.elsevier.com/content/object/eid/1-s2.0-S2468823119302160-si9.gif?httpAccept=%2A%2F%2A",
            "@multimediatype": "GIF image file",
            "@type": "ALTIMG",
            "@size": "180",
            "@ref": "si9",
            "@mimetype": "image/gif"
          },
          {
            "@category": "standard",
            "@_fa": "true",
            "$": "https://api.elsevier.com/content/object/eid/1-s2.0-S2468823119302160-am.pdf?httpAccept=%2A%2F%2A",
            "@multimediatype": "Acrobat PDF file",
            "@type": "AAM-PDF",
            "@size": "1075280",
            "@ref": "am",
            "@mimetype": "application/pdf"
          }
        ]
      },
      "link": {
        "@rel": "abstract",
        "@href": "https://api.elsevier.com/content/abstract/scopus_id/85065772976"
      }
    }
  }
}