{
  "metadata": {
    "title": "Photothermal dry reforming of ethanol over rod-like Ni/ZrO<ce:inf loc=post>2</ce:inf> catalysts",
    "authors": "; ; ",
    "journal": "Molecular Catalysis",
    "date": "2024-07-15",
    "doi": "10.1016/j.mcat.2024.114308",
    "abstract": "",
    "uri": "https://api.elsevier.com/content/article/pii/S2468823124004917",
    "pii": "S2468823124004917"
  },
  "fulltext": {
    "full-text-retrieval-response": {
      "scopus-eid": "2-s2.0-85195556811",
      "originalText": "serial JL 315758 291210 291744 291790 291809 31 Molecular Catalysis MOLECULARCATALYSIS 2024-06-12 2024-06-12 2024-06-12 2024-06-12 2024-07-04T11:58:04 1-s2.0-S2468823124004917 S2468-8231(24)00491-7 S2468823124004917 10.1016/j.mcat.2024.114308 S300 S300.1 FULL-TEXT 1-s2.0-S2468823124X00103 2024-08-12T23:50:34.229886Z 0 0 20240715 2024 2024-06-12T07:31:19.073014Z absattachment articleinfo articlenumber articletitlenorm authfirstinitialnorm authfirstsurnamenorm cid cids contenttype copyright crossmark dateloaded dateloadedtxt datesearch datesort dateupdated dco docsubtype doctype doi eid ewtransactionid hubeid indexeddate issn issnnorm itemstage itemtransactionid itemweight openaccess openarchive pg pgfirst pii piinorm pubdatestart pubdatetxt pubyr sectiontitle sortorder srctitle srctitlenorm srctype ssids alllist content subj subheadings suppl tomb volfirst volissue volumelist webpdf webpdfpagecount yearnav figure table e-component body mmlmath acknowledge affil appendices articletitle auth authfirstini authfull authkeywords authlast grantnumber grantsponsor grantsponsorid highlightsabst primabst ref specialabst 2468-8231 24688231 true 564 564 C Volume 564 18 114308 114308 114308 20240715 15 July 2024 2024-07-15 2024 Regular Papers article fla © 2024 Elsevier B.V. All rights are reserved, including those for text and data mining, AI training, and similar technologies. PHOTOTHERMALDRYREFORMINGETHANOLOVERRODLIKENIZRO2CATALYSTS TIAN Y 1 Introduction 2 Experimental 2.1 Materials 2.2 Catalyst preparation 2.3 Catalyst characterization 2.4 Catalytic reactions 3 Results and discussion 4 Conclusions CRediT authorship contribution statement Acknowledgement Appendix Supplementary materials References QIU 2023 113543 P QI 2023 e202311731 M YU 2019 1015 J BAC 2020 1029 1047 S FAYAZ 2023 105671 F RAMKIRAN 2021 24845 24854 A HE 2022 100468 C ZHANG 2023 112971 L WANG 2020 8016 8035 Z TAN 2023 8317 8329 C XIE 2022 106371 L YUAN 2021 21150 21172 L ZHANG 2023 113093 F JIN 2023 13305 L RAO 2021 4730 4738 Z ZHU 2024 114070 Z WANG 2020 1 8 L ZHANG 2021 272 297 F ULLAH 2021 120248 S GAO 2024 113858 L TAKAMI 2020 5811 5814 D GAO 2022 1628 1636 P GAO 2022 16016 16028 Y CHOYA 2024 130166 A PINTO 2023 145641 D ITKULOVA 2018 272 279 S ZHANG 2023 128705 M DONG 2023 1650 1665 J ALMAZAN 2023 720 729 F QUAN 2021 236 Y TA 2012 20585 20588 N SUN 2023 10291 10294 X NETO 2013 131 142 R NABGAN 2020 6302 6317 W SONG 2008 19 28 Y FADDA 2010 064106 G LI 2015 3461 3476 W ELHOSAINY 2022 113011 H LAGUNA 2015 385 395 O ITALIANO 2020 118494 C WEI 2023 13923 13929 Y TANG 2006 265 273 X GUPTA 2010 5184 5198 A SINGHA 2017 473 488 R ZHAO 2020 119307 B CESTEROS 1999 135 147 Y SMEDS 1996 177 194 S LIANG 2020 15183 15193 T DEBEK 2016 6705 6715 R LAI 2019 7963 7971 G LU 2020 5181 K HAN 2021 7962 7970 C XUE 2007 167 174 L ZHAN 2022 18645 18653 Y GOMEZCAZALILLA 2009 101 110 M LI 2018 397 408 W SUN 2020 580 586 H LV 2023 1725 1738 C WEI 2021 111079 X KUMAR 2020 644 D KUMAR 2020 65 74 D DING 2024 129779 X MORETTI 2015 166 175 E LIU 2024 113738 Z QI 2022 121158 M LI 2021 120157 S HAN 2021 421 K SHAO 2024 113991 X ZHANG 2024 114078 S DING 2022 4740 4752 X ZHAO 2023 125748 L LU 2018 424 432 K ZHANG 2021 4872 4878 W TIANX2024X114308 TIANX2024X114308XY 2026-06-12T00:00:00.000Z 2026-06-12T00:00:00.000Z http://creativecommons.org/licenses/by-nc-nd/4.0/ © 2024 Elsevier B.V. All rights are reserved, including those for text and data mining, AI training, and similar technologies. 2024-06-19T16:09:34.016Z http://vtw.elsevier.com/data/voc/AddOnTypes/50.7/aggregated-refined Yulin University 2024GK14 YLU Yulin University http://data.elsevier.com/vocabulary/SciValFunders/501100019282 http://sws.geonames.org/1814991/ Department of Science and Technology of Liaoning Province http://data.elsevier.com/vocabulary/SciValFunders/501100012131 http://sws.geonames.org/1814991 Natural Science Foundation of Liaoning Province 2023-MS-276 Natural Science Foundation of Liaoning Province http://data.elsevier.com/vocabulary/SciValFunders/501100005047 http://sws.geonames.org/1814991/ This work was financially supported by the Natural Science Foundation of Liaoning Province (2023-MS-276) and Doctoral Research Start-up Fund of Yulin University (2024GK14). https://doi.org/10.15223/policy-017 https://doi.org/10.15223/policy-037 https://doi.org/10.15223/policy-012 https://doi.org/10.15223/policy-029 https://doi.org/10.15223/policy-004 item S2468-8231(24)00491-7 S2468823124004917 1-s2.0-S2468823124004917 10.1016/j.mcat.2024.114308 315758 2024-08-12T23:50:34.229886Z 2024-07-15 1-s2.0-S2468823124004917-main.pdf https://s3-eu-west-1.amazonaws.com/prod-ucs-content-store-eu-west/content/pii:S2468823124004917/MAIN/application/pdf/32ee3cf587c382120178521dbda1ebc8/main.pdf main.pdf pdf true 5005383 MAIN 9 1-s2.0-S2468823124004917-main_1.png https://s3-eu-west-1.amazonaws.com/prod-ucs-content-store-eu-west/content/pii:S2468823124004917/PREVIEW/image/png/90e5ac56cf8d1adab3af7b5148254c2c/main_1.png main_1.png png 59700 849 656 IMAGE-WEB-PDF 1 1-s2.0-S2468823124004917-gr5.jpg https://s3-eu-west-1.amazonaws.com/prod-ucs-content-store-eu-west/content/pii:S2468823124004917/gr5/DOWNSAMPLED/image/jpeg/4dc60c666f2ccb570a8ba369d4c07b63/gr5.jpg gr5 gr5.jpg jpg 34325 255 602 IMAGE-DOWNSAMPLED 1-s2.0-S2468823124004917-gr6.jpg https://s3-eu-west-1.amazonaws.com/prod-ucs-content-store-eu-west/content/pii:S2468823124004917/gr6/DOWNSAMPLED/image/jpeg/204126274f99cbe1954249dcbf9389a7/gr6.jpg gr6 gr6.jpg jpg 78659 485 678 IMAGE-DOWNSAMPLED 1-s2.0-S2468823124004917-gr7.jpg https://s3-eu-west-1.amazonaws.com/prod-ucs-content-store-eu-west/content/pii:S2468823124004917/gr7/DOWNSAMPLED/image/jpeg/d058db584a449dc5216f69355b54a726/gr7.jpg gr7 gr7.jpg jpg 26096 253 339 IMAGE-DOWNSAMPLED 1-s2.0-S2468823124004917-gr8.jpg https://s3-eu-west-1.amazonaws.com/prod-ucs-content-store-eu-west/content/pii:S2468823124004917/gr8/DOWNSAMPLED/image/jpeg/d2f4fa0136b71f7c6daf0314919db270/gr8.jpg gr8 gr8.jpg jpg 28585 300 386 IMAGE-DOWNSAMPLED 1-s2.0-S2468823124004917-gr1.jpg https://s3-eu-west-1.amazonaws.com/prod-ucs-content-store-eu-west/content/pii:S2468823124004917/gr1/DOWNSAMPLED/image/jpeg/4338d65ad3a91e37a6dac23424d8e2f7/gr1.jpg gr1 gr1.jpg jpg 75433 481 602 IMAGE-DOWNSAMPLED 1-s2.0-S2468823124004917-gr2.jpg https://s3-eu-west-1.amazonaws.com/prod-ucs-content-store-eu-west/content/pii:S2468823124004917/gr2/DOWNSAMPLED/image/jpeg/c1224472d6c0f256498e3eef828e0b8c/gr2.jpg gr2 gr2.jpg jpg 61759 299 659 IMAGE-DOWNSAMPLED 1-s2.0-S2468823124004917-ga1.jpg https://s3-eu-west-1.amazonaws.com/prod-ucs-content-store-eu-west/content/pii:S2468823124004917/ga1/DOWNSAMPLED/image/jpeg/20f14ad4468ac304a572ebd937535221/ga1.jpg ga1 true ga1.jpg jpg 36749 200 283 IMAGE-DOWNSAMPLED 1-s2.0-S2468823124004917-gr3.jpg https://s3-eu-west-1.amazonaws.com/prod-ucs-content-store-eu-west/content/pii:S2468823124004917/gr3/DOWNSAMPLED/image/jpeg/5f81518223c08a3fa4a7161f40943a56/gr3.jpg gr3 gr3.jpg jpg 61600 495 602 IMAGE-DOWNSAMPLED 1-s2.0-S2468823124004917-gr4.jpg https://s3-eu-west-1.amazonaws.com/prod-ucs-content-store-eu-west/content/pii:S2468823124004917/gr4/DOWNSAMPLED/image/jpeg/0f82eef0d742d6513d126fc2e67056b5/gr4.jpg gr4 gr4.jpg jpg 82780 485 659 IMAGE-DOWNSAMPLED 1-s2.0-S2468823124004917-sc1.jpg https://s3-eu-west-1.amazonaws.com/prod-ucs-content-store-eu-west/content/pii:S2468823124004917/sc1/DOWNSAMPLED/image/jpeg/3b12286309c43921ab59e21ae7a3dc81/sc1.jpg sc1 sc1.jpg jpg 50949 291 659 IMAGE-DOWNSAMPLED 1-s2.0-S2468823124004917-gr5.sml https://s3-eu-west-1.amazonaws.com/prod-ucs-content-store-eu-west/content/pii:S2468823124004917/gr5/THUMBNAIL/image/gif/1342ebd28880f18192be8332c07b2f20/gr5.sml gr5 gr5.sml sml 6221 93 219 IMAGE-THUMBNAIL 1-s2.0-S2468823124004917-gr6.sml https://s3-eu-west-1.amazonaws.com/prod-ucs-content-store-eu-west/content/pii:S2468823124004917/gr6/THUMBNAIL/image/gif/d782f19c9e036fe984f31db60b7a9d0d/gr6.sml gr6 gr6.sml sml 11721 157 219 IMAGE-THUMBNAIL 1-s2.0-S2468823124004917-gr7.sml https://s3-eu-west-1.amazonaws.com/prod-ucs-content-store-eu-west/content/pii:S2468823124004917/gr7/THUMBNAIL/image/gif/6d0327c9d510284c8d18b30fc216cfb3/gr7.sml gr7 gr7.sml sml 10524 163 219 IMAGE-THUMBNAIL 1-s2.0-S2468823124004917-gr8.sml https://s3-eu-west-1.amazonaws.com/prod-ucs-content-store-eu-west/content/pii:S2468823124004917/gr8/THUMBNAIL/image/gif/c4a0b34a0862861267c4f53a6d052f8f/gr8.sml gr8 gr8.sml sml 20289 164 211 IMAGE-THUMBNAIL 1-s2.0-S2468823124004917-gr1.sml https://s3-eu-west-1.amazonaws.com/prod-ucs-content-store-eu-west/content/pii:S2468823124004917/gr1/THUMBNAIL/image/gif/3c5d2ff2fb81026e0a1ee187f01ada13/gr1.sml gr1 gr1.sml sml 11435 164 205 IMAGE-THUMBNAIL 1-s2.0-S2468823124004917-gr2.sml https://s3-eu-west-1.amazonaws.com/prod-ucs-content-store-eu-west/content/pii:S2468823124004917/gr2/THUMBNAIL/image/gif/32129c45353206773e35f1b2aaa219d2/gr2.sml gr2 gr2.sml sml 17404 99 219 IMAGE-THUMBNAIL 1-s2.0-S2468823124004917-ga1.sml https://s3-eu-west-1.amazonaws.com/prod-ucs-content-store-eu-west/content/pii:S2468823124004917/ga1/THUMBNAIL/image/gif/71263414563a6cb3137d8ad739cb7a86/ga1.sml ga1 true ga1.sml sml 29329 155 219 IMAGE-THUMBNAIL 1-s2.0-S2468823124004917-gr3.sml https://s3-eu-west-1.amazonaws.com/prod-ucs-content-store-eu-west/content/pii:S2468823124004917/gr3/THUMBNAIL/image/gif/101b9d83c0822ff7fe76e5dd632a83de/gr3.sml gr3 gr3.sml sml 10816 164 199 IMAGE-THUMBNAIL 1-s2.0-S2468823124004917-gr4.sml https://s3-eu-west-1.amazonaws.com/prod-ucs-content-store-eu-west/content/pii:S2468823124004917/gr4/THUMBNAIL/image/gif/124824fc313a418302966e071382311b/gr4.sml gr4 gr4.sml sml 11860 161 219 IMAGE-THUMBNAIL 1-s2.0-S2468823124004917-sc1.sml https://s3-eu-west-1.amazonaws.com/prod-ucs-content-store-eu-west/content/pii:S2468823124004632/sc1/THUMBNAIL/image/gif/4b396935525356c49fc77aed258ba742/sc1.sml sc1 sc1.sml sml 14681 97 219 IMAGE-THUMBNAIL 1-s2.0-S2468823124004917-gr5_lrg.jpg https://s3-eu-west-1.amazonaws.com/prod-ucs-content-store-eu-west/content/pii:S2468823124004917/HIGHRES/image/jpeg/d11037c52a5783e2305577297e0c47bf/gr5_lrg.jpg gr5 gr5_lrg.jpg jpg 227444 1131 2667 IMAGE-HIGH-RES 1-s2.0-S2468823124004917-gr6_lrg.jpg https://s3-eu-west-1.amazonaws.com/prod-ucs-content-store-eu-west/content/pii:S2468823124004917/HIGHRES/image/jpeg/ba3e40100484fe525cec0709212224e4/gr6_lrg.jpg gr6 gr6_lrg.jpg jpg 553136 2146 3000 IMAGE-HIGH-RES 1-s2.0-S2468823124004917-gr7_lrg.jpg https://s3-eu-west-1.amazonaws.com/prod-ucs-content-store-eu-west/content/pii:S2468823124004917/HIGHRES/image/jpeg/767053b2b69f7f42f832dcd375fcc9f5/gr7_lrg.jpg gr7 gr7_lrg.jpg jpg 178900 1118 1500 IMAGE-HIGH-RES 1-s2.0-S2468823124004917-gr8_lrg.jpg https://s3-eu-west-1.amazonaws.com/prod-ucs-content-store-eu-west/content/pii:S2468823124004917/HIGHRES/image/jpeg/983b24fcfbc6bab6734dc3d69bfe9829/gr8_lrg.jpg gr8 gr8_lrg.jpg jpg 199244 1327 1708 IMAGE-HIGH-RES 1-s2.0-S2468823124004917-gr1_lrg.jpg https://s3-eu-west-1.amazonaws.com/prod-ucs-content-store-eu-west/content/pii:S2468823124004917/HIGHRES/image/jpeg/28c7c3ff0d5e7d92612e2c3bdd6e0edf/gr1_lrg.jpg gr1 gr1_lrg.jpg jpg 519329 2130 2667 IMAGE-HIGH-RES 1-s2.0-S2468823124004917-gr2_lrg.jpg https://s3-eu-west-1.amazonaws.com/prod-ucs-content-store-eu-west/content/pii:S2468823124004917/HIGHRES/image/jpeg/bb7f21ac2be16143b03e661c7ced458c/gr2_lrg.jpg gr2 gr2_lrg.jpg jpg 609052 1323 2917 IMAGE-HIGH-RES 1-s2.0-S2468823124004917-ga1_lrg.jpg https://s3-eu-west-1.amazonaws.com/prod-ucs-content-store-eu-west/content/pii:S2468823124004917/HIGHRES/image/jpeg/e63dcef90f83d01268cc4e4a4f83dd65/ga1_lrg.jpg ga1 true ga1_lrg.jpg jpg 342739 886 1253 IMAGE-HIGH-RES 1-s2.0-S2468823124004917-gr3_lrg.jpg https://s3-eu-west-1.amazonaws.com/prod-ucs-content-store-eu-west/content/pii:S2468823124004632/HIGHRES/image/jpeg/2b24a0bf73d011489f356e721cbbadfb/gr3_lrg.jpg gr3 gr3_lrg.jpg jpg 453391 2192 2667 IMAGE-HIGH-RES 1-s2.0-S2468823124004917-gr4_lrg.jpg https://s3-eu-west-1.amazonaws.com/prod-ucs-content-store-eu-west/content/pii:S2468823124004632/HIGHRES/image/jpeg/5c22c85e9548791feb85ba3e30a41466/gr4_lrg.jpg gr4 gr4_lrg.jpg jpg 608801 2145 2917 IMAGE-HIGH-RES 1-s2.0-S2468823124004917-sc1_lrg.jpg https://s3-eu-west-1.amazonaws.com/prod-ucs-content-store-eu-west/content/pii:S2468823124004632/HIGHRES/image/jpeg/89d7bbaff5e11be159915251371356c5/sc1_lrg.jpg sc1 sc1_lrg.jpg jpg 394947 1287 2917 IMAGE-HIGH-RES 1-s2.0-S2468823124004917-mmc1.docx https://s3-eu-west-1.amazonaws.com/prod-ucs-content-store-eu-west/content/pii:S2468823124004917/mmc1/MAIN/application/vnd.openxmlformats-officedocument.wordprocessingml.document/fe2775805a2afe6bad3669eb9d33b88f/mmc1.docx mmc1 mmc1.docx docx 135841 APPLICATION 1-s2.0-S2468823124004917-si1.svg https://s3-eu-west-1.amazonaws.com/prod-ucs-content-store-eu-west/content/pii:S2468823124004917/image/svg+xml/10209e032b4a11f7e41191d03bdda1c1/si1.svg si1 si1.svg svg 19289 ALTIMG 1-s2.0-S2468823124004917-am.pdf am am.pdf pdf 1405439 AAM-PDF https://s3-eu-west-1.amazonaws.com/prod-ucs-content-store-eu-west/content/egi:10WLFJT4C1N/MAIN/application/pdf/558671932607995eb9e383214bae2ad4/am.pdf MCAT 114308 114308 S2468-8231(24)00491-7 10.1016/j.mcat.2024.114308 Elsevier B.V. Scheme I Synthesis processes of Ni/ZrO2 catalysts. Scheme I Fig. 1 Characterization results of Ni/ZrO2 catalysts (a) XRD patterns; (b) Raman spectra; (c) N2 adsorption-desorption isotherms; (d) Pore size distributions. Fig. 1 Fig. 2 TEM images of catalysts: (a,b) ZrO2; (c,d) I-Ni/ZrO2; (e,f) P-Ni/ZrO2. Fig. 2 Fig. 3 (a) H2-TPR profiles; (b) H2-TPD profiles; (c) CO2-TPD profiles and (d) O2-TPD of the Ni/ZrO2catalysts. Fig. 3 Fig. 4 XPS spectra of Ni/ZrO2 nanocomposites. (a) Survey spectra, (b) Zr 3d spectra, (c) Ni 2p spectra and (d) O 1 s spectra. Fig. 4 Fig. 5 (a) UV–Vis spectra and (b) The plot of (Ahv)2 vs. photon energy of P-Ni/ZrO2 and I-Ni/ZrO2. Fig. 5 Fig. 6 (a) Comparison of I-Ni/ZrO2 catalyst performance under thermal and photothermal conditions; (b) Comparison of performance of catalyst I-Ni/ZrO2 and P-Ni/ZrO2 under photothermal conditions; (c) Effect of temperature on catalyst P-Ni/ZrO2 under photothermal conditions; (d)The Arrhenius graph showing the ethanol conversion rate of P-Ni/ZrO2 with and without light irradiation. Fig. 6 Fig. 7 Influence of space velocity on the catalytic performance of P-Ni/ZrO2 catalyst. Fig. 7 Fig. 8 The proposed reaction mechanism of photothermal EDR reaction over Ni/ZrO2 catalyst. Fig 8 Table 1 Textural properties of the catalysts. Table 1 Catalyst SBET a (m2/g) Pore size a (nm) Pore volume a (cm3/g) dNiO b (nm) I-Ni/ZrO2 7.9 23.9 0.045 16.5 P-Ni/ZrO2 11.6 16.9 0.055 10.3 a Measured by N2 absorption-desorption isotherms. b Calculated from XRD patterns. Table 2 Comparison of band gap energies between Ni/ZrO2 and catalysts in literatures. Table 2 Catalysts Band Gap Energy (eV.) Reference P-Ni/ZrO2 4.58 This work I-Ni/ZrO2 4.82 This work 5%Ni/ZrO2 5.73 [60] 5%Ni/ZrO2 5.33 [61] Ni/ZrO2 5.06 [62] Photothermal dry reforming of ethanol over rod-like Ni/ZrO2 catalysts Yuhao Tian Writing – original draft Investigation a Yixuan Li Writing – review & editing Data curation a Dong Cao Writing – review & editing Data curation b ⁎ Qiying Liu Writing – review & editing Conceptualization c ⁎ Weijie Cai Supervision Funding acquisition a ⁎ a Faculty of Light Industry and Chemical Engineering, Dalian Polytechnic University, 116023, Dalian, PR China Faculty of Light Industry and Chemical Engineering Dalian Polytechnic University Dalian 116023 PR China aFaculty of Light Industry and Chemical Engineering, Dalian Polytechnic University, 116023, Dalian, PR China b Shaanxi Key Laboratory of Low Metamorphic Coal Clean Utilization, School of Chemistry and Chemical Engineering, Yulin University, 719000, Yulin, PR China Shaanxi Key Laboratory of Low Metamorphic Coal Clean Utilization School of Chemistry and Chemical Engineering Yulin University Yulin 719000 PR China bShaanxi Key Laboratory of Low Metamorphic Coal Clean Utilization, School of Chemistry and Chemical Engineering, Yulin University, 719000, Yulin, PR China c Jiangsu co-Innovation Center for Efficient Processing and Utilization of Forest Resources, International Innovation Center for Forest Chemicals and Materials, College of Chemical Engineering, Nanjing Forestry University, 210037, Nanjing, PR China Jiangsu co-Innovation Center for Efficient Processing and Utilization of Forest Resources International Innovation Center for Forest Chemicals and Materials College of Chemical Engineering Nanjing Forestry University Nanjing 210037 PR China cJiangsu co-Innovation Center for Efficient Processing and Utilization of Forest Resources, International Innovation Center for Forest Chemicals and Materials, College of Chemical Engineering, Nanjing Forestry University, 210037, Nanjing, PR China ⁎ Corresponding authors. Photo-assisted ethanol dry reforming (EDR) for syngas production was deeply studied over nanorod-like Ni/ZrO2 catalyst synthesized by precipitation and impregnation technique, respectively. The effect of light irradiation as well as catalyst preparation method on EDR reaction was investigated in detail with the stoichiometric feed ratios, over a temperature region of 350 to 550 °C. Photo-enhancement factor of ethanol conversion greatly increased from 10% (dark) to 40% (light) together with less formation of byproducts. Moreover, the experimental results depicted the better performance of P-Ni/ZrO2 catalyst due to its abundant oxygen vacancies and strong Ni-Zr interaction. Enriched interfacial oxygen defects and more light-excited electrons facilitated the activation/dissociation of ethanol and CO2, thereby enhancing the catalytic activity. In addition, the mean particle size of NiO in P-Ni/ZrO2 was (10.3 nm) which was smaller than that of the I-Ni/ZrO2 (16.5 nm), suggesting its higher dispersion of active metal. The calculated apparent activation energy of P-Ni/ZrO2 was 20.6 eV which was much less than the value of I-Ni/ZrO2 (37.7 eV). This work might provide the valuable insight for the development of highly-efficient photothermal catalyst to enhance the value-added utilization of greenhouse gas CO2. Graphic abstract Image, graphical abstract Keywords Photothermal catalyst Dry reforming of ethanol Ni/ZrO2 Syngas Carbon dioxide Data availability No data was used for the research described in the article. 1 Introduction Up to date, chemical conversion of carbon dioxide (CO2), one of the main greenhouse gases, has achieved great attention in order to eliminate the detrimental impact of global warming and climate change [1,2]. In this regard, thermal catalytic CO2 reforming with renewable bio-ethanol (EDR) is a sustainable approach compared to the common methane dry reforming [3-5]. The reactant ethanol can be easily obtained from the abundant biomass resources and the generated syngas (a mixture of CO and H2) is the suitable feedstock for the down-stream Fischer-Tropsch synthesis. (1) C 2 H 5 OH ( g ) + C O 2 ( g ) → 3 CO ( g ) + 3 H 2 ( g ) Δ H 298 K θ = 296.7 kJ / mol In contrast, certain challenges still need to be resolved before EDR process can be widely applied in an industrial scale. As depicted in Eq (1), EDR is generally operated at high temperature because of its endothermic character which leads to high energy consumption and high-cost [6]. Moreover, the utilization of thermal energy derived from conventional fossil fuels might further reduce the efficiency of the EDR reaction [7]. In this regard, photothermal catalysis has been of great interest where solar energy is utilized to compensate thermal energy [8,9]. In the process of photocatalysis, light irradiation could lead to electron excitation and the generation of holes where various reduction and oxidation reactions occur [10-14]. It is accepted that photothermal catalysis combines the synergistic effect of thermal activation and light promotion. Hence, photothermal catalysis is also defined as photodriven thermal process in which solar energy can not only generate heat energy but form electron/hole pairs. Particularly, photothermal condition is more efficient in energy than the conventional thermal heating [15,16]. In addition, a system that accelerates chemical reactions through photothermal heating and generation of photothermal electrons could result in a higher reaction rate and milder conditions than the traditional thermal system [17]. Many studies have depicted that the surface temperature of metal nanoparticles increases significantly upon light irradiation, thereby facilitating photothermal CO2 hydrogenation and dry reforming of methane reaction [18-21]. Huang et al. [22] elucidated that the reaction rate of methane dry reforming over Ag/AgBr/CsPbBr3 catalyst through photo-thermal catalysis was 79 times higher than the value by pure thermal catalysis. Meanwhile, Jia et al. [23] reported that light irradiation could facilitate the formation of hot electrons and oxygen defects which enhanced the activation/dissociation of CO2 and methane. Therefore, photothermal catalytic EDR reaction might be a promising alternative to the conventional thermal EDR considering its sustainability and the relatively low reaction temperature. To the best of our knowledge, EDR reaction promoted by photothermal catalysis has still not been widely investigated. On the other hand, development of low-cost and efficient catalysts is critical to accelerate EDR process in a pilot-scale application. In recent years, Ni-based catalysts have exhibited great potential in dry reforming reaction because of their low price and high activity [24,25]. The performances of Ni-based catalysts not only rely on the dispersion of active Ni nanoparticles but on the physicochemical properties of support. Generally, support can greatly affect the surface catalysis via electronic interaction between active sites and support [26]. In recent years, ZrO2 has been widely used as a support considering its thermal stability, oxygen mobility and high ionic conductivity [27,28]. Moreover, ZrO2 oxide as a support exhibits good performance in photothermal catalysis [29]. In the present work, Ni nanoparticles supported on ZrO2 nanorods (Ni/ZrO2) was constructed to achieve strong Ni-Zr interaction as an efficient photothermal catalyst for the EDR reaction. To optimize the loading of Ni species, two Ni/ZrO2 catalysts were prepared via the precipitation and impregnation method, respectively. The physicochemical features of the as-prepared catalysts were studied by a series of characterization techniques including spectroscopic tools. Photothermal and pure thermal EDR performances were compared to demonstrate the promotion function by the cooperative effect of photo and thermal for syngas production. Actually, the photothermal catalysis exhibited better EDR activity than that of pure thermal catalysis. The comparison of two Ni/ZrO2 catalysts was also carried out in terms of ethanol conversion, syngas production as well as stability. This work might offer new insights into the design of highly efficient photothermal catalysts for light-assisted EDR reaction. 2 Experimental 2.1 Materials ZrOCl2⋅8H2O (99%), Ni(NO3)2⋅6H2O (99%) and ethyl alcohol were purchased from Shanghai Aladdin Co. Ltd. NaOH (96%), NH3⋅H2O (25%), CH3OH (99%), Na2CO3 (99%) were obtained from Tianjin Kemiou Chemical Reagent Co. Ltd. The chemicals were of analytical grade and directly used without further pretreatment. 2.2 Catalyst preparation Ni/ZrO2 catalysts were prepared as shown in Scheme I . The detailed information was illustrated in Supplementary Material. 2.3 Catalyst characterization The crystalline properties were analyzed by a D/MAX-2500X-ray diffractometer (XRD) with Cu (Kα) radiation and a scanning range of 20–70° The morphology structure was determined by SEM and TEM techniques. X-ray photoelectron spectroscopy (XPS) was selected to depict the surface chemical properties. The pore size distribution and specific surface area were calculated from nitrogen adsorption-desorption isotherms. CO2-TPD, O2-TPD, H2-TPD and H2-TPR were carried out on a ZHD-TPX-6 apparatus equipped with a TCD. 2.4 Catalytic reactions The experimental conditions were depicted in detail in Supplementary Material. 3 Results and discussion The crystalline and phase structures of the samples were analyzed by XRD profiles, as shown in Fig. 1 a. It could be seen that the bands at 24°, 28.2°, 31.5°, and 34.1 °corresponded to monoclinic ZrO2 (JCPDS #37–1484). [30] On the other hand, the small bands associated with NiO phase (JCPDS#47–1049) were observed in all cases. Based on the spectra obtained, the mean particle sizes (dNiO) were calculated using the Scherrer equation, as listed in Table 1 . Evidently, the particle size of NiO in P-Ni/ZrO2 catalyst prepared by precipitation method was (10.3 nm) which was smaller than that of the I-Ni/ZrO2 sample synthesized by impregnation method (16.5 nm). This finding implied the stronger interaction between NiO and ZrO2 support. Similarly, a support anchoring mechanism in Au/CeO2 catalyst was demonstrated by Shen group [31]. It was reported that strong metal-support interaction could greatly enhance the sintering resistance of Ru-based catalysts [32]. Actually, the small particles could facilitate the formation of oxygen defects via reducing its formation enthalpy [33]. As demonstrated by Nabgan et al. [34], small active metal particle size might provide strong resistance to coke accumulation, resulting in excellent catalyst stability. In order to further confirm the crystal structure of the samples, Raman spectroscopy was used as a complementary analysis. As shown in Fig. 1b, several peaks appeared at 177, 190, 221, 302, 346, 382, 475, 558 and 615 cm−1, which corresponded to the characteristic peaks of monoclinic ZrO2 [35]. The Raman peak at 475 cm−1 was assigned to the Eg mode frequency, which was related to the oxygen vacancy of ZrO2. Interestingly, the Egmode frequency of P-Ni/ZrO2 (475 cm−1) was lower than that of I-Ni/ZrO2 (477 cm−1), which could be attributed to a decrease in particle size and an increase in oxygen vacancy [36]. In addition, it was observed that the Raman peaks in P-Ni/ZrO2 catalyst were stronger compared to I-Ni/ZrO2, suggesting that the precipitation method might enhance the metal-carrier interaction. This was in line with the previous literature [37]. Based on the above discussion, the precipitation method could result in stronger metal-carrier interaction compared to the impregnation method. As a consequence, both the smaller particles size and the stronger interaction between active metal and support might facilitate CO2 reforming of ethanol. Fig. 1c shows the N2 adsorption-desorption isotherms of the nanostructured catalysts. In all cases, the isotherms were attributed to type IV curves with a H3 hysteresis loop, indicating the existence of mesoporous structure [38]. As shown in Fig. 1d, P-Ni/ZrO2 catalyst presented the smaller pore size distribution in comparison with I-Ni/ZrO2 sample which was in line with the results in Table 1. Meanwhile, the specific surface area of P-Ni/ZrO2 catalyst was also higher than that of I-Ni/ZrO2 catalyst. This finding was in well agreement with XRD findings. As depicted by Laguna et al. [39], the smaller particle size corresponded to the larger specific surface area. The previous literatures illustrated that the high surface area could provide more active sites for the adsorption of reactants, thereby improving the catalytic performance [40,41]. TEM images (Fig. 2 a and b) show that ZrO2 displays a nanorod morphology with 50–100 nm in width and 200–300 nm in length. After the loading of Ni species, ZrO2 still maintained the initial nanorod morphology in all cases. However, the smaller Ni nanoparticles were observed over the surface of P-Ni/ZrO2 catalyst in comparison with I-Ni/ZrO2. This indirectly implied the stronger metal-support interaction in P-Ni/ZrO2 sample which could efficiently prevent the aggregation of Ni species during the calcinations process. Therefore, the preparation methods might be one of the key factors affecting the dispersion of active metal. H2-TPR profiles were also collected to explore the interaction between NiO and ZrO2. As presented in Fig. 3 a, two obvious reduction peaks were observed for P-Ni/ZrO2 catalyst which might be assigned to the reduction of various NiO nanoparticles. Indeed, ZrO2 was difficult to be reduced at below 600 °C. It should be noted that the reduction peaks of P-Ni/ZrO2 were lower than those of I-Ni/ZrO2, suggesting the better low-temperature reducibility of P-Ni/ZrO2 sample. The observed decline of the reduction temperature implied that the interaction between NiO and ZrO2 might enhance the reduction of nickle oxides via the formation of solid solution to improve the oxygen mobility [42]. Interestingly, the P-Ni/ZrO2 catalyst was reduced at relatively lower temperature in comparison with I-Ni/ZrO2, thereby implying the stronger metal-support interaction in P-Ni/ZrO2 which was consistent with the previous literature [43]. It was also reported that Ni-based catalysts with smaller particles presented the lower reduction temperature [44]. Hence, the observed difference of reduction temperature was in line with XRD results suggesting the smaller NiO particle size in P-Ni/ZrO2 catalyst. This implied that P-Ni/ZrO2 had a higher dispersion which promoted the formation of active sites and facilitated the activation of the reactant molecules. TPR results obviously elucidated that the P-Ni/ZrO2 catalyst was favorable to the low-temperature reducibility. H2-TPD profiles of the catalysts are presented in Fig. 3b. It was noted that both catalysts depicted two peaks. Typically, the first peak could be deconvoluted into two peaks. The peak located at lower temperature might be attributed to the weak adsorption of hydrogen on active metal sites while the high temperature one corresponded to the strong hydrogen adsorption [45]. Indeed, the second peak was attributed to hydrogen spillover (metal to metal and/or metal to support) [46,47]. On the other hand, the temperature of H spillover on P-Ni/ZrO2 catalyst was obviously lower than that of I-Ni/ZrO2, suggesting the facile hydrogen spillover on P-Ni/ZrO2 catalyst. CO2-TPD was selected to determine the catalyst basicity which was important for CO2 adsorption/conversion in dry reforming process [48]. In principle, increasing the basicity could efficiently inhibit the carbon formation via facilitating the oxidation of the coke deposits [49]. As shown in Fig. 3c, all CO2-TPD curves could be deconvoluted into three peaks in the temperature range of 100–500 °C, which corresponded to the weak, moderate and strong basic sites, respectively [50]. Evidently, the peak area of P-Ni/ZrO2 was larger than that of I-Ni/ZrO2, implying more basic sites for P-Ni/ZrO2. Meanwhile, the percentage of moderate and strong basic sites in P-Ni/ZrO2 catalyst was higher which was favorable for CO2 adsorption. [51,52] O2-TPD profiles were collected to evaluate the oxygen mobility of the investigated catalysts. As depicted in Fig. 3d, two obvious peaks were observed in which the lower temperature was attributed to the desorption of surface oxygen and another broad one was in indexed with lattice oxygen species [53]. Based on the difference of peak area, the amount of surface oxygen in P-Ni/ZrO2 catalyst was higher than the value of I-Ni/ZrO2. Actually, more surface oxygen species might result in better activity. XPS measurements were conducted to further understand the chemical states of the as-prepared catalysts. As presented in Fig. 4 a, the survey spectra consisted of different elements such as Ni, O and Zr, indicating the successful synthesis of Ni/ZrO2 catalysts. As shown in Fig. 4b, the peaks at 184.3 eV and 181.9 eV were associated with Zr 3d3/2 and Zr 3d5/2, respectively [54]. More importantly, the binding energy of Zr for P-Ni/ZrO2 shifted to lower binding energy compared to I-Ni/ZrO2, implying the stronger Ni-Zr interaction in P-Ni/ZrO2 catalyst. Meanwhile, two Ni 2p3/2 peaks appeared at ca. 855.6 eV and 852.2 eV (Fig. 4c) which indicated the presence of Ni2+ and Ni0 species [55]. The formation of nickel oxide might be due to the ex-situ operation conditions in XPS tests. On the other hand, the peaks of Ni 2p3/2 for P-Ni/ZrO2 shifted to a higher binding energy compared to I-Ni/ZrO2. This change further evidenced the stronger metal-support interaction in P-Ni/ZrO2. Fig. 4d shows the O1s XPS spectrum. Typically, the peak at 529.3 eV was attributed to the lattice oxygen (Olatt) while the peak at ca.531.4 eV corresponded to the surface oxygen (Osurf) [56]. Indeed, the concentration of Osurf species in P-Ni/ZrO2 (42.8%) was higher than that of I-Ni/ZrO2 (40.3%). It was accepted that surface oxygen (Osurf) such as adsorptive and/or defective species could enhance the catalytic activity [57]. Moreover, more defects might extend the sunlight adsorption capacity of catalyst and improve the photothermal catalytic performance [58]. Wei et al. illustrated that the existence of surface oxygen vacancies on the catalyst surface played an important role in promoting the gas-phase oxygen replenishment, thus enhancing the activity [59]. The UV–Vis diffuse reflectance spectra were collected to investigate the positive effect of photocatalysis in the thermal-catalytic reaction. As depicted in Fig. 5 , both samples showed obvious light absorption in the ultraviolet region of 200–400 nm, indicating the high ultraviolet absorption capacity, which could be attributed to the presence of ZrO2. The bands might be also a contribution of Ni2+→O2− charge transfer transitions [63]. On the other hand, the absorption strength of P-Ni/ZrO2 in the visible region was stronger than that of I-Ni/ZrO2, implying that P-Ni/ZrO2 catalyst exhibited better visible light absorption capacity [64-66]. This positive factor could enhance the generation of electron-hole pairs [67]. The band gaps of the catalysts were calculated according to the Kubelka-Munk equation [68,69]. Indeed, the band gap of P-Ni/ZrO2 (4.58 eV) was narrower than the value of I-Ni/ZrO2 (4.82 eV). This result suggested that P-Ni/ZrO2 presented the wider light adsorption range and harvested more solar energy. Moreover, it was smaller in comparison with the previous literature (Table 2 ). Guo et al. elucidated that the decline of band gap was attributed to the existence of oxygen defects [70]. The band gap decrement was favorable for the formation of photoexcited charge carriers, thereby enhancing the photothermal catalytic reactions. In summary, P-Ni/ZrO2 catalyst enlarged the optical response region and depicted the higher visible-light capture capacity which resulted in better photothermal catalytic behavior. The ethanol conversion and product selectivity of pure thermal catalysis and photothermal catalysis are shown in Fig. 6 . Obviously, ethanol conversion in photothermal dry reforming (40%) was higher than the value in thermal dry reforming (10%). Meanwhile, less byproducts (methane, acetaldehyde acetone) were generated under the irradiation of light (Fig. 6a). The findings indicated the photothermal synergistic effect. The similar synergism in photothermal catalytic methanol steam reforming was proposed in the previous literature [71]. Moreover, as presented in Fig. 6b, P-Ni/ZrO2 catalyst exhibited higher ethanol conversion (70%) and more suitable H2/CO ratio (ca.1.1) in photothermal conditions which was desirable for the downstream Fischer-Tropsch synthesis. On the other hand, P-Ni/ZrO2 greatly prevented the formation of byproducts. This result might be a combination contribution of higher dispersion of active metal and abundance in oxygen defects as well as the stronger Ni-Zr interaction in P-Ni/ZrO2 catalyst [72]. With a further estimation of temperature influence (Fig. 6c), ethanol conversion evidently increased which was in accordance with the thermodynamics. Besides, hydrogen selectivity in the outlet gas increased while CO selectivity followed the reverse trend. This tendency might be attributed to the occurrence of water gas shift reaction. On the other hand, it could not rule out the contribution of methane decomposition which was confirmed by the continuous decline of methane concentration in the outlet gas. In addition, the apparent activation energy of P-Ni/ZrO2 under photothermal conditions was 20.62 eV which was lower compared to the value in the dark conditions (37.74 eV). This result revealed that the illumination could reduce the activation energy barrier, thereby increasing the reaction rate [73]. The effect of gas hourly space velocity (GHSV) on catalytic performance was investigated over P-Ni/ZrO2 catalyst at 450 ℃. As presented in Fig. 7 , increasing GHSV significantly resulted in the decrease of ethanol conversion from 71% to 30%. Meanwhile, the methane selectivity increased from 4 mol% to 26 mol%. The selectivity of acetaldehyde also increased from 2 mol% to 8 mol% and another byproduct acetone increased from 1mol% to 3mol%. The results indicated that the less contact time at higher space velocity caused the decline of reactant conversion while it facilitated the occurrence of side reaction to form more byproducts. Based on the above discussion, the reaction mechanism of photo-induced ethanol dry reforming is proposed, as shown in Fig. 8 . Typically, the excited electrons in ZrO2 were injected into nickel nanoparticles to produce efficient photoelectrons (Fig. 8II). Subsequently, the generated photoelectrons in nickel were trapped by reactant CO2 to form CO and O2− species (Fig. 8III). On the other hand, photo-generated holes in ZrO2 migrated near the interface of the nickel nanoparticles and reacted with ethanol. The residual coke over the catalyst surface might react with O2− species, thereby maintaining the clean surface. 4 Conclusions Photo-assisted ethanol dry reforming reaction over Ni/ZrO2 catalysts were investigated in detail. A deep comprehension of the relationship between the catalytic performance and catalyst properties was depicted via catalyst characterization like TEM, H2-TPR, O2-TPD, CO2-TPD, Raman and UV–Vis technique combined with XPS. Typically, illuminated (light) condition remarkably enhanced the ethanol conversion rate on Ni/ZrO2 catalyst by 4 times. Furthermore, light irradiation retarded the formation rates of byproducts including acetone and methane, suggesting the photothermal synergistic effect. The experimental results indicated that P-Ni/ZrO2 catalyst synthesized by precipitation technique exhibited better performance than I-Ni/ZrO2 prepared by impregnation method. The superior activity of P-Ni/ZrO2 catalyst was partially ascribed to strong NiO-ZrO2 interaction, which facilitated electron transfer from ZrO2 to Ni and the formation of oxygen defects. Moreover, the better reducibility, light absorption efficiency as well as higher Ni dispersion in P-Ni/ZrO2 could also contribute to its good performance. This insight will provide a critical reference to design highly-efficient catalysts for photothermal EDR systems utilizing solar light. CRediT authorship contribution statement Yuhao Tian: Writing – original draft, Investigation. Yixuan Li: Writing – review & editing, Data curation. Dong Cao: Writing – review & editing, Data curation. Qiying Liu: Writing – review & editing, Conceptualization. Weijie Cai: Supervision, Funding acquisition. Declaration of competing interest The authors declare that there is no conflict of interests. Acknowledgement This work was financially supported by the Natural Science Foundation of Liaoning Province (2023-MS-276) and Doctoral Research Start-up Fund of Yulin University (2024GK14). Supplementary materials Supplementary material associated with this article can be found, in the online version, at doi:10.1016/j.mcat.2024.114308. Appendix Supplementary materials Image, application 1 References [1] P. Qiu J. Yuan K. Cheng C. Xiong S. Wu Enhanced catalytic activity for methane dry reforming of Ce-doped Ba0.9Zr0.7Y0.2Ni0.1O3-δ perovskite catalyst Mol. Catal. 549 2023 113543 10.1016/j.mcat.2023.113543 P. Qiu; J. Yuan; K. Cheng; C. Xiong; S. Wu, Enhanced catalytic activity for methane dry reforming of Ce-doped Ba0.9Zr0.7Y0.2Ni0.1O3-δ perovskite catalyst, Mol. Catal. 549 (2023) 113543. https://doi.org/10.1016/j.mcat.2023.113543. [2] M.Y. Qi Y.J. Xu Efficient and direct functionalization of allylic sp3 C-H bonds with concomitant CO2 reduction Angew. Chem. Int. Ed. 135 2023 e202311731 10.1002/ange.202311731 M.Y. Qi; Y.J. Xu, Efficient and direct functionalization of allylic sp3 C-H bonds with concomitant CO2 reduction, Angew. Chem. Int. Ed. 135 (2023) e202311731. https://doi.org/10.1002/ange.202311731. [3] J. Yu J.A. Odriozola T.R. Reina Dry reforming of ethanol and glycerol: mini-review Catalysts 9 2019 1015 10.3390/catal9121015 J. Yu; J.A. Odriozola; T.R. Reina, Dry reforming of ethanol and glycerol: mini-review, Catalysts 9 (2019) 1015. https://doi.org/10.3390/catal9121015. [4] S. Bac S. Keskin A.K. Avci Recent advances in sustainable syngas production by catalytic CO2 reforming of ethanol and glycerol Sustain. Energ. Fuels 4 2020 1029 1047 10.1039/c9se00967a S. Bac; S. Keskin; A.K. Avci, Recent advances in sustainable syngas production by catalytic CO2 reforming of ethanol and glycerol, Sustain. Energ. Fuels 4 (2020) 1029–1047. https://doi.org/10.1039/c9se00967a. [5] F. Fayaz C. He A. Goel J. Rintala J. Konttinen Oxidative ethanol dry reforming for production of syngas over Co-based catalyst: effect of reaction temperature Mater. Today Commun. 35 2023 105671 10.1016/j.mtcomm.2023.105671 F. Fayaz; C. He; A. Goel; J. Rintala; J. Konttinen, Oxidative ethanol dry reforming for production of syngas over Co-based catalyst: effect of reaction temperature, Mater. Today Commun. 35 (2023) 105671. https://doi.org/10.1016/j.mtcomm.2023.105671. [6] A. Ramkiran D.V.N. Vo M.S. Mahmud Syngas production from ethanol dry reforming using Cu-based perovskite catalysts promoted with rare earth metals Int. J. Hydrogen Energy 46 2021 24845 24854 10.1016/j.ijhydene.2021.03.144 A. Ramkiran; D.V.N. Vo; M.S. Mahmud, Syngas production from ethanol dry reforming using Cu-based perovskite catalysts promoted with rare earth metals, Int. J. Hydrogen Energy 46 (2021) 24845–24854. https://doi.org/10.1016/j.ijhydene.2021.03.144. [7] C. He S. Wu L. Wang J. Zhang Recent advances in photo-enhanced dry reforming of methane: a review J. Photoch. Photobio. C 51 2022 100468 10.1016/j.jphotochemrev.2021.100468 C. He; S. Wu; L. Wang; J. Zhang, Recent advances in photo-enhanced dry reforming of methane: a review, J. Photoch. Photobio. C 51 (2022) 100468. https://doi.org/10.1016/j.jphotochemrev.2021.100468. [8] L. Zhang X. Tu Y. Chen W. Han L. Chen C. Sun H. Zheng Photothermal catalysis without solvent for fixing CO2 to cyclic carbonate Mol. Catal. 538 2023 112971 10.1016/j.mcat.2023.112971 L. Zhang; X. Tu; Y. Chen; W. Han; L. Chen; C. Sun; H. Zheng, Photothermal catalysis without solvent for fixing CO2 to cyclic carbonate, Mol. Catal., 538 (2023) 112971. https://doi.org/10.1016/j.mcat.2023.112971. [9] Z.J. Wang H. Song H. Liu J. Ye Coupling of solar energy and thermal energy for carbon dioxide reduction: status and prospects Angew. Chem. Int. Ed. 59 2020 8016 8035 10.1002/anie.201907443 Z.J. Wang; H. Song; H. Liu; J. Ye, Coupling of solar energy and thermal energy for carbon dioxide reduction: status and prospects, Angew. Chem. Int. Ed. 59 (2020) 8016–8035. https://doi.org/10.1002/anie.201907443. [10] C.L. Tan M.Y. Qi Z.R. Tang Y.J. Xu Isolated single-atom cobalt in the ZnIn2S4 monolayer with exposed Zn sites for CO2 photofixation ACS Catal. 13 2023 8317 8329 10.1021/acscatal.3c00992 C.L. Tan; M.Y. Qi; Z.R. Tang; Y.J. Xu, Isolated single-atom cobalt in the ZnIn2S4 monolayer with exposed Zn sites for CO2 photofixation, ACS Catal. 13 (2023) 8317–8329. https://doi.org/10.1021/acscatal.3c00992. [11] L. Xie J.G. Hao H.Q. Chen Z.X. Li S.Y. Ge Y. Mi K.Q. Lu Recent advances of nickel hydroxide-based cocatalysts in heterogeneous photocatalysis Catal. Commun. 162 2022 106371 10.1016/j.catcom.2021.106371 L. Xie; J.G. Hao; H.Q. Chen; Z.X. Li; S.Y. Ge; Y. Mi; K.Q. Lu, Recent advances of nickel hydroxide-based cocatalysts in heterogeneous photocatalysis, Catal. Commun. 162 (2022) 106371. https://doi.org/10.1016/j.catcom.2021.106371. [12] L. Yuan M.Y. Qi Z.R. Tang Y.J. Xu Coupling strategy for CO2 valorization integrated with organic synthesis by heterogeneous photocatalysis Angew. Chem. Int. Ed. 60 2021 21150 21172 10.1002/anie.202101667 L. Yuan; M.Y. Qi; Z.R. Tang; Y.J. Xu, Coupling strategy for CO2 valorization integrated with organic synthesis by heterogeneous photocatalysis, Angew. Chem. Int. Ed. 60 (2021) 21150–21172. https://doi.org/10.1002/anie.202101667. [13] F. Zhang W. Chen W. Li Recent advances in the catalytic conversion of CO2 to chemicals and demonstration projects in China Mol. Catal. 541 2023 113093 10.1016/j.mcat.2023.113093 F. Zhang; W. Chen; W. Li, Recent advances in the catalytic conversion of CO2 to chemicals and demonstration projects in China, Mol. Catal. 541 (2023) 113093. https://doi.org/10.1016/j.mcat.2023.113093. [14] L. Jin X. Chen S. Huang A. Wang Z. Chen Z. Le Z. Xie Selective synthesis of quinazolinones by using fluorescein catalyst under mild conditions Mol. Catal. 547 2023 13305 10.1016/j.mcat.2023.113305 L. Jin; X. Chen; S. Huang; A. Wang; Z. Chen; Z. Le; Z. Xie, Selective synthesis of quinazolinones by using fluorescein catalyst under mild conditions, Mol. Catal. 547 (2023) 13305. https://doi.org/10.1016/j.mcat.2023.113305. [15] Z. Rao Y. Cao Z. Huang Z. Yin W. Wan M. Ma Y. Wu J. Wang G. Yang Y. Cui Z. Gong Y. Zhou Insights into the nonthermal effects of light in dry reforming of methane to enhance the H2/CO Ratio Near Unity over Ni/Ga2O3 ACS Catal. 11 2021 4730 4738 10.1021/acscatal.0c04826 Z. Rao; Y. Cao; Z. Huang; Z. Yin; W. Wan; M. Ma; Y. Wu; J. Wang; G. Yang; Y. Cui; Z. Gong; Y. Zhou, Insights into the nonthermal effects of light in dry reforming of methane to enhance the H2/CO Ratio Near Unity over Ni/Ga2O3, ACS Catal. 11 (2021) 4730–4738. https://doi.org/10.1021/acscatal.0c04826. [16] Z.J. Zhu Z.H. He S.W. Wang B.T. Wu Y. Tian Y.C. Sun Z.T. Liu Photothermal catalytic CO2 oxidative dehydrogenation of propane over Co-Mn bimetallic oxides supported on MCM-41 molecular sieve Mol. Catal. 559 2024 114070 10.1016/j.mcat.2024.114070 Z.J. Zhu; Z.H. He; S.W. Wang; B.T. Wu; Y. Tian; Y.C. Sun; Z.T. Liu, Photothermal catalytic CO2 oxidative dehydrogenation of propane over Co-Mn bimetallic oxides supported on MCM-41 molecular sieve, Mol. Catal. 559 (2024) 114070. https://doi.org/10.1016/j.mcat.2024.114070. [17] L. Wang Y. Dong T. Yan Z. Hu F.M. Ali D.M. Meira P.N. Duchesne J.Y.Y. Loh C. Qiu E.E. Storey Y. Xu W. Sun M. Ghoussoub N.P. Kherani A.S. Helmy G.A. Ozin Black indium oxide a photothermal CO2 hydrogenation catalyst Nat. Commun. 11 2020 1 8 10.1038/s41467-020-16336-z L. Wang; Y. Dong; T. Yan; Z. Hu; F.M. Ali; D.M. Meira; P.N. Duchesne; J.Y.Y. Loh; C. Qiu; E.E. Storey; Y. Xu; W. Sun; M. Ghoussoub; N.P. Kherani; A.S. Helmy; G.A. Ozin, Black indium oxide a photothermal CO2 hydrogenation catalyst, Nat. Commun. 11 (2020) 1–8. https://doi.org/10.1038/s41467-020-16336-z. [18] F. Zhang Y.H. Li M.Y. Qi Y.M. Yamada M. Anpo Z.R. Tang Y.J. Xu Photothermal catalytic CO2 reduction over nanomaterials Chem. Catal. 1 2021 272 297 10.1016/j.checat.2021.01.003 F. Zhang; Y.H. Li; M.Y. Qi; Y.M. Yamada; M. Anpo; Z.R. Tang; Y.J. Xu, Photothermal catalytic CO2 reduction over nanomaterials. Chem. Catal. 1 (2021) 272–297. https://doi.org/10.1016/j.checat.2021.01.003. [19] S. Ullah E.C. Lovell T.H. Tan B. Xie P.V. Kumar R. Amal J. Scott Photenhanced CO2 methanation over La2O3 promoted Co/TiO2 catalysts Appl. Catal. B-Environ. 294 2021 120248 10.1016/j.apcatb.2021.120248 S. Ullah; E.C. Lovell; T.H. Tan; B. Xie; P.V. Kumar; R. Amal; J. Scott, Photenhanced CO2 methanation over La2O3 promoted Co/TiO2 catalysts, Appl. Catal. B-Environ. 294 (2021)120248. https://doi.org/10.1016/j.apcatb.2021.120248. [20] L.H. Gao W.Y. Xiao M.Y. Qi J.Y. Li C.L. Tan Z.R. Tang Photoredox-catalyzed coupling of CO2 reduction and amines oxidation by Cu doped CdS quantum dots Mol. Catal. 554 2024 113858 10.1016/j.mcat.2024.113858 L.H. Gao; W.Y. Xiao; M.Y. Qi; J.Y. Li; C.L. Tan; Z.R. Tang, Photoredox-catalyzed coupling of CO2 reduction and amines oxidation by Cu doped CdS quantum dots, Mol. Catal. 554 (2024) 113858. https://doi.org/10.1016/j.mcat.2024.113858. [21] D. Takami A. Yamamoto H. Yoshida Dry reforming of methane over alumina-supported rhodium catalysts at low temperatures under visible and near-infrared light Catal. Sci. Technol. 10 2020 5811 5814 10.1039/d0cy00858c D. Takami; A. Yamamoto; H. Yoshida, Dry reforming of methane over alumina-supported rhodium catalysts at low temperatures under visible and near-infrared light, Catal. Sci. Technol. 10 (2020) 5811–5814. https://doi.org/10.1039/d0cy00858c. [22] P. Gao P. Wang X. Liu Z. Cui Y. Wu X. Zhang Q. Zhang Z. Wang Z. Zheng H. Cheng Y. Liu Y. Dai B. Huang Photothermal synergy for efficient dry reforming of CH4 by an Ag/AgBr/CsPbBr3 composite Catal. Sci. Technol. 12 2022 1628 1636 10.1039/d1cy02281d P. Gao; P. Wang; X. Liu; Z. Cui; Y. Wu; X. Zhang; Q. Zhang; Z. Wang; Z. Zheng; H. Cheng; Y. Liu; Y. Dai; B. Huang, Photothermal synergy for efficient dry reforming of CH4 by an Ag/AgBr/CsPbBr3 composite, Catal. Sci. Technol. 12 (2022) 1628–1636. https://doi.org/10.1039/d1cy02281d. [23] Y. Gao Q. Li C. Wang D. Yan J. Chen H. Jia Light-driven efficient dry reforming of methane over Pt/La2O3 with long-term durability J. Mater. 10 2022 16016 16028 10.1039/d2ta04246k Y. Gao; Q. Li; C. Wang; D. Yan; J. Chen; H. Jia, Light-driven efficient dry reforming of methane over Pt/La2O3 with long-term durability, J. Mater. 10 (2022) 16016–16028. https://doi.org/10.1039/d2ta04246k. [24] A. Choya B. d. Rivas M.L. No J.I. Gutiérrez-Ortiz R. López-Fonseca Dry reforming of methane over sub-stoichiometric NiAl2O4 mediated Ni/Al2O3 catalysts Fuel 358 2024 130166 10.1016/j/fuel.2023.130166 A. Choya; B. d. Rivas; M.L. No; J.I. Gutiérrez-Ortiz; R. López-Fonseca, Dry reforming of methane over sub-stoichiometric NiAl2O4 mediated Ni/Al2O3 catalysts, Fuel 358 (2024) 130166. https://doi.org/10.1016/j/fuel.2023.130166. [25] D. Pinto L. Hu A. Urakawa Enabling complete conversion of CH4 and CO2 in dynamic coke-mediated dry reforming (DC-DRM) on Ni catalysts Chem. Eng. J. 474 2023 145641 10.1016/j.cej.2023.145641 D. Pinto; L. Hu; A. Urakawa, Enabling complete conversion of CH4 and CO2 in dynamic coke-mediated dry reforming (DC-DRM) on Ni catalysts, Chem. Eng. J. 474 (2023) 145641. https://doi.org/10.1016/j.cej.2023.145641. [26] S.S. Itkulova Y.Y. Nurmakanov S.K. Kussanova Y.A. Boleubayev Production of a hydrogen-enriched syngas by combined CO2-steam reforming of methane over Co-based catalysts supported on alumina modified with zirconia Catal. Today 299 2018 272 279 10.1016/j.cattod.2017.07.014 S.S. Itkulova; Y.Y. Nurmakanov; S.K. Kussanova; Y.A. Boleubayev, Production of a hydrogen-enriched syngas by combined CO2-steam reforming of methane over Co-based catalysts supported on alumina modified with zirconia, Catal. Today 299 (2018) 272–279. https://doi.org/10.1016/j.cattod.2017.07.014. [27] M. Zhang X. Zhou J. Yang T. Yang Z. Liu Y. Han Deciphering the ZrO2 phase engineering effects on dry reforming of methane over the Ni/ZrO2 catalysts Fuel 349 2023 128705 10.1016/j/fuel.2023.128705 M. Zhang; X. Zhou; J. Yang; T. Yang; Z. Liu; Y. Han, Deciphering the ZrO2 phase engineering effects on dry reforming of methane over the Ni/ZrO2 catalysts, Fuel 349 (2023) 128705. https://doi.org/10.1016/j/fuel.2023.128705. [28] J. Dong Y. Peng J. Li Z.W. Liu R. Hu CO2 capture and conversion to syngas via dry reforming of C3H8 over a Pt/ZrO2-CaO catalyst Catal. Sci. Technol. 13 2023 1650 1665 10.1039/d3cy00049d J. Dong; Y. Peng; J. Li; Z.W. Liu; R. Hu, CO2 capture and conversion to syngas via dry reforming of C3H8 over a Pt/ZrO2-CaO catalyst, Catal. Sci. Technol. 13 (2023) 1650–1665. https://doi.org/10.1039/d3cy00049d. [29] F. Almazán M. Lafuente A. Echarte M. Imizcoz I. Pellejero L.M. Gandía UiO-66 MOF-derived Ru@ZrO2 catalysts for photo-thermal CO2hydrogenation Chemistry (Easton) 5 2023 720 729 10.3390/chemistry5020051 F. Almazán; M. Lafuente; A. Echarte; M. Imizcoz; I. Pellejero; L.M. Gandía, UiO-66 MOF-derived Ru@ZrO2 catalysts for photo-thermal CO2hydrogenation, Chemistry (Easton) 5 (2023) 720–729, https://doi.org/10.3390/chemistry5020051. [30] Y. Quan N. Zhang Z. Zhang Y. Han J. Zhao J. Ren Enhanced performance of Ni catalysts supported on ZrO2 nanosheets for CO2 methanation: effects of support morphology and chelating ligands Int. J. Hydrogen Energ. 46 2021 236 10.1016/j.ijhydene.2021.01.236 Y. Quan; N. Zhang; Z. Zhang; Y. Han; J. Zhao; J. Ren, Enhanced performance of Ni catalysts supported on ZrO2 nanosheets for CO2 methanation: effects of support morphology and chelating ligands, Int. J. Hydrogen Energ. 46 (2021) 236. https://doi.org/10.1016/j.ijhydene.2021.01.236. [31] N. Ta J. Liu S. Chenna P.A. Crozier Y. Li A. Chen W. Shen Stabilized gold nanoparticles on ceria nanorods by strong interfacial anchoring J. Am. Chem. Soc. 134 2012 20585 20588 10.1021/ja310341j N. Ta; J. Liu; S. Chenna; P.A. Crozier; Y. Li; A. Chen; W. Shen, Stabilized gold nanoparticles on ceria nanorods by strong interfacial anchoring, J. Am. Chem. Soc. 134 (2012) 20585–20588. https://doi.org/10.1021/ja310341j. [32] X. Sun B. Wu B. Li J. Zhao S. Li M. Zheng J. Chen H. Zhang Strong metal-support interactions for high sintering resistance of Ru-based catalysts toward the HER and ORR Chem. Commun. 59 2023 10291 10294 10.1039/d3cc02529b X. Sun; B. Wu; B. Li; J. Zhao; S. Li; M. Zheng; J. Chen; H. Zhang, Strong metal-support interactions for high sintering resistance of Ru-based catalysts toward the HER and ORR, Chem. Commun. 59 (2023) 10291–10294. https://doi.org/10.1039/d3cc02529b. [33] R.C.R. Neto M. Schmal Synthesis of CeO2 and CeZrO2 mixed oxide nanostructured catalysts for the iso-syntheses reaction Appl Catal. A-Gen. 450 2013 131 142 10.1016/j.apcata.2012.10.002 R.C.R. Neto; M. Schmal, Synthesis of CeO2 and CeZrO2 mixed oxide nanostructured catalysts for the iso-syntheses reaction, Appl Catal. A-Gen. 450 (2013) 131–142. https://doi.org/10.1016/j.apcata.2012.10.002. [34] W. Nabgan B. Nabgan T.A. Tuan Abdullah N. Ngadi A.A. Jalil N.S. Hassan S.M. Izan W.S. Luing S.N. Abdullah F.S.A. Majeed Conversion of polyethylene terephthalate plastic waste and phenol steam reforming to hydrogen and valuable liquid fuel: synthesis effect of Ni-Co/ZrO2 nanostructured catalysts Int. J. Hydrog. Energy 45 2020 6302 6317 10.1016/j.ijhydene.2019.12.103 W. Nabgan; B. Nabgan; T.A. Tuan Abdullah; N. Ngadi; A.A. Jalil; N.S. Hassan; S.M. Izan; W.S. Luing; S.N. Abdullah; F.S.A. Majeed, Conversion of polyethylene terephthalate plastic waste and phenol steam reforming to hydrogen and valuable liquid fuel: synthesis effect of Ni-Co/ZrO2 nanostructured catalysts, Int. J. Hydrog. Energy 45 (2020) 6302–6317. https://doi.org/10.1016/j.ijhydene.2019.12.103. [35] Y.Q. Song D.H. He B.Q. Xu Effects of preparation methods of ZrO2 support on catalytic performances of Ni/ZrO2 catalysts in methane partial oxidation to syngas Appl Catal. A-Gen. 337 2008 19 28 10.1016/j.apcata.2007.11.032 Y.Q. Song; D.H. He; B.Q. Xu, Effects of preparation methods of ZrO2 support on catalytic performances of Ni/ZrO2 catalysts in methane partial oxidation to syngas, Appl Catal. A-Gen. 337 (2008) 19–28. https://doi.org/10.1016/j.apcata.2007.11.032. [36] G. Fadda G. Zanzotto L. Colombo First-principles study of the effect of pressure on the five zirconia polymorphs. II. Static dielectric properties and Raman spectra Phys. Rev. B 82 2010 064106 10.1103/PhysRevB.82.064106 G. Fadda; G. Zanzotto; L. Colombo, First-principles study of the effect of pressure on the five zirconia polymorphs. II. Static dielectric properties and Raman spectra, Phys. Rev. B 82 (2010) 064106. https://doi.org/10.1103/PhysRevB.82.064106. [37] W. Li Z. Zhao F. Ding X. Guo G. Wang Syngas production via steam-CO2 dual reforming of methane over LA-Ni/ZrO2 catalyst prepared by l-arginine ligand-assisted strategy: enhanced activity and stability ACS Sustain. Chem. Eng. 3 2015 3461 3476 10.1021/acssuschemeng.5b01277 W. Li; Z. Zhao; F. Ding; X. Guo; G. Wang, Syngas production via steam-CO2 dual reforming of methane over LA-Ni/ZrO2 catalyst prepared by l-arginine ligand-assisted strategy: enhanced activity and stability, ACS Sustain. Chem. Eng. 3 (2015) 3461–3476. https://doi.org/10.1021/acssuschemeng.5b01277. [38] H. El-Hosainy W.T. Alsaggaf Z.I. Zaki M.H.H. Mahmoud Facile synthesis of S-scheme NiS@ZrO nano-heterostructure for superior degradation of antibiotic under visible light irradiation Opt. Mater. 133 2022 113011 10.1016/j.optmat.2022.113011 H. El-Hosainy; W.T. Alsaggaf; Z.I. Zaki; M.H.H. Mahmoud, Facile synthesis of S-scheme NiS@ZrO nano-heterostructure for superior degradation of antibiotic under visible light irradiation, Opt. Mater. 133 (2022) 113011. https://doi.org/10.1016/j.optmat.2022.113011. [39] O.H. Laguna A. Pérez M.A. Centeno J.A. Odriozola Synergy between gold and oxygen vacancies in gold supported on Zr-doped ceria catalysts for the CO oxidation Appl. Catal. B-Environ. 176-177 2015 385 395 10.1016/j.apcatb.2015.04.019 O.H. Laguna; A. Pérez; M.A. Centeno; J.A. Odriozola, Synergy between gold and oxygen vacancies in gold supported on Zr-doped ceria catalysts for the CO oxidation, Appl. Catal. B-Environ. 176-177 (2015) 385–395. https://doi.org/10.1016/j.apcatb.2015.04.019. [40] C. Italiano J. Llorca L. Pino M. Ferraro V. Antonucci A. Vita CO and CO2 methanation over Ni catalysts supported on CeO2, Al2O3 and Y2O3 oxides Appl. Catal. B-Environ. 264 2020 118494 10.1016/j.apcatb.2019.118494 C. Italiano; J. Llorca; L. Pino; M. Ferraro; V. Antonucci; A. Vita, CO and CO2 methanation over Ni catalysts supported on CeO2, Al2O3 and Y2O3 oxides, Appl. Catal. B-Environ. 264 (2020) 118494. https://doi.org/10.1016/j.apcatb.2019.118494. [41] Y. Wei J.G. Hao J.L. Zhang W.Y. Huang S.B. Ouyang K. Yang K.Q. Lu Integrating Co(OH)2 nanosheet arrays on graphene for efficient noble-metal-free EY-sensitized photocatalytic H2 evolution Dalton Trans 52 2023 13923 13929 10.1039/d3dt02513f Y. Wei; J.G. Hao; J.L. Zhang; W.Y. Huang; S.B. Ouyang; K. Yang; K.Q. Lu, Integrating Co(OH)2 nanosheet arrays on graphene for efficient noble-metal-free EY-sensitized photocatalytic H2 evolution, Dalton Trans. 52 (2023) 13923–13929. https://doi.org/10.1039/d3dt02513f. [42] X. Tang Y. Li X. Huang Y. Xu H. Zhu J. Wang W. Shen MnOx-CeO2 mixed oxide catalysts for complete oxidation of formaldehyde: effect of preparation method and calcination temperature Appl. Catal. B-Environ. 62 2006 265 273 10.1016/j.apcatb.2005.08.004 X. Tang; Y. Li; X. Huang; Y. Xu; H. Zhu; J. Wang; W. Shen, MnOx-CeO2 mixed oxide catalysts for complete oxidation of formaldehyde: effect of preparation method and calcination temperature, Appl. Catal. B-Environ. 62 (2006) 265–273. https://doi.org/10.1016/j.apcatb.2005.08.004. [43] A. Gupta U.V. Waghmare M.S. Hegde Correlation of oxygen storage capacity and structural distortion in transition-metal-, noble-metal-, and rare-earth-ion-substituted CeO2 from first principles calculation Chem. Mater. 22 2010 5184 5198 10.1021/cm101145d A. Gupta; U.V. Waghmare; M.S. Hegde, Correlation of oxygen storage capacity and structural distortion in transition-metal-, noble-metal-, and rare-earth-ion-substituted CeO2 from first principles calculation, Chem. Mater. 22 (2010) 5184–5198. https://doi.org/10.1021/cm101145d. [44] R.K. Singha A. Shukla A. Yadav L.N. Sivakumar Konathala R. Bal Effect of metal-support interaction on activity and stability of Ni-CeO2 catalyst for partial oxidation of methane Appl. Catal. B-Environ. 202 2017 473 488 10.1016/j.apcatb.2016.09.060 R.K. Singha; A. Shukla; A. Yadav; L.N. Sivakumar Konathala; R. Bal, Effect of metal-support interaction on activity and stability of Ni-CeO2 catalyst for partial oxidation of methane, Appl. Catal. B-Environ. 202 (2017) 473–488. https://doi.org/10.1016/j.apcatb.2016.09.060. [45] B. Zhao P. Liu S. Li H. Shi X. Jia Q. Wang F. Yang Z. Song C. Guo J. Hu Z. Chen X. Yan X. Ma Bimetallic Ni-Co nanoparticles on SiO2 as robust catalyst for CO methanation: effect of homogeneity of Ni-Co alloy Appl. Catal. B-Environ. 278 2020 119307 10.1016/j.apcatb.2020.119307 B. Zhao; P. Liu; S. Li; H. Shi; X. Jia; Q. Wang; F. Yang; Z. Song; C. Guo; J. Hu; Z. Chen; X. Yan; X. Ma, Bimetallic Ni-Co nanoparticles on SiO2 as robust catalyst for CO methanation: effect of homogeneity of Ni-Co alloy, Appl. Catal. B-Environ. 278 (2020) 119307. https://doi.org/10.1016/j.apcatb.2020.119307. [46] Y. Cesteros P. Salagre F. Medina J.E. Sueiras Effect of the alumina phase and its modification on Ni/Al2O3 catalysts for the hydrodechlorination of 1,2,4-trichlorobenzene Appl. Catal. B-Environ. 22 1999 135 147 10.1016/S0926-3373(99)00041-7 Y. Cesteros; P. Salagre; F. Medina; J.E. Sueiras, Effect of the alumina phase and its modification on Ni/Al2O3 catalysts for the hydrodechlorination of 1,2,4-trichlorobenzene, Appl. Catal. B-Environ. 22 (1999) 135–147. https://doi.org/10.1016/S0926-3373(99)00041-7 [47] S. Smeds T. Salmi L.P. Lindfors O. Krause Chemisorption and TPD studies of hydrogen on Ni/Al2O3 Appl Catal. A-Gen. 144 1996 177 194 10.1016/0926-860X(96)00103-2 S. Smeds; T. Salmi; L.P. Lindfors; O. Krause, Chemisorption and TPD studies of hydrogen on Ni/Al2O3, Appl Catal. A-Gen. 144 (1996) 177–194. https://doi.org/10.1016/0926-860X(96)00103-2. [48] T.Y. Liang D. Senthil Raja K.C. Chin C.L. Huang S.A.P. Sethupathi L.K. Leong D.H. Tsai S.Y. Lu Bimetallic metal-organic framework-derived hybrid nanostructures as high-performance catalysts for methane dry reforming ACS Appl. Mater. Interface. 12 2020 15183 15193 10.1021/acsami.0c00086 T.Y. Liang; D. Senthil Raja; K.C. Chin; C.L. Huang; S.A.P. Sethupathi; L.K. Leong; D.H. Tsai; S.Y. Lu, Bimetallic metal-organic framework-derived hybrid nanostructures as high-performance catalysts for methane dry reforming, ACS Appl. Mater. Interface. 12 (2020) 15183–15193. https://doi.org/10.1021/acsami.0c00086. [49] R. Dębek M. Motak D. Duraczyska F. Launay M.E. Galvez T. Grzybek P. Da Costa Methane dry reforming over hydrotalcite-derived Ni-Mg-Al mixed oxides: the influence of Ni content on catalytic activity, selectivity and stability Catal. Sci. Technol. 6 2016 6705 6715 10.1039/c6cy00906a R. Dębek; M. Motak; D. Duraczyska; F. Launay; M.E. Galvez; T. Grzybek; P. Da Costa, Methane dry reforming over hydrotalcite-derived Ni-Mg-Al mixed oxides: the influence of Ni content on catalytic activity, selectivity and stability, Catal. Sci. Technol. 6 (2016) 6705–6715. https://doi.org/10.1039/c6cy00906a. [50] G.H. Lai J.H. Lak D.H. Tsai Hydrogen Production via Low-temperature steam–methane reforming using Ni-CeO2-Al2O3 hybrid nanoparticle clusters as catalysts ACS Appl. Energy Mater. 2 2019 7963 7971 10.1021/acsaem.9b01444 G.H. Lai; J.H. Lak; D.H. Tsai, Hydrogen Production via Low-temperature steam–methane reforming using Ni-CeO2-Al2O3 hybrid nanoparticle clusters as catalysts, ACS Appl. Energy Mater. 2 (2019) 7963–7971. https://doi.org/10.1021/acsaem.9b01444. [51] K.Q. Lu Y.H. Li F. Zhang M.Y. Qi X. Chen Z.R. Tang Y.J. Xu Rationally designed transition metal hydroxide nanosheet arrays on graphene for artificial CO2 reduction Nat. Commun. 11 2020 5181 10.1038/s41467-020-18944-1 K.Q. Lu; Y.H. Li; F. Zhang; M.Y. Qi; X. Chen; Z.R. Tang; Y.J. Xu, Rationally designed transition metal hydroxide nanosheet arrays on graphene for artificial CO2 reduction, Nat. Commun. 11 (2020) 5181. https://doi.org/10.1038/s41467-020-18944-1. [52] C. Han Y.H. Li J.Y. Li M.Y. Qi Z.R. Tang Y.J. Xu Cooperative syngas production and C− N bond formation in one photoredox cycle Angew. Chem. Int. Ed. 60 2021 7962 7970 10.1002/anie.202015756 C. Han; Y.H. Li; J.Y. Li; M.Y. Qi; Z.R. Tang; Y.J. Xu, Cooperative syngas production and C− N bond formation in one photoredox cycle, Angew. Chem. Int. Ed. 60 (2021) 7962–7970. https://doi.org/10.1002/anie.202015756. [53] L. Xue C. Zhang H. He Y. Teraoka Catalytic decomposition of N2O over CeO2 promoted Co3O4 spinel catalyst Appl. Catal. B-Environ. 75 2007 167 174 10.1016/j.apcatb.2007.04.013 L. Xue; C. Zhang; H. He; Y. Teraoka, Catalytic decomposition of N2O over CeO2 promoted Co3O4 spinel catalyst, Appl. Catal. B-Environ. 75 (2007) 167–174. https://doi.org/10.1016/j.apcatb.2007.04.013. [54] Y. Zhan Y. Liu Q. Che P. Yang Bright and stable luminescence of CsPbX3 nanocrystals in ZrO2 skeletons for white light emitting diodes ACS Appl. Nano Mater. 5 2022 18645 18653 10.1021/acsanm.2c04425 Y. Zhan; Y. Liu; Q. Che; P. Yang, Bright and stable luminescence of CsPbX3 nanocrystals in ZrO2 skeletons for white light emitting diodes, ACS Appl. Nano Mater. 5 (2022) 18645–18653. https://doi.org/10.1021/acsanm.2c04425. [55] M. Gómez-Cazalilla A. Infantes-Molina J. Mérida-Robles E. Rodríguez-Castellón A. Jiménez-López Chromium species as captors of sulfur molecules on nickel-based hydrotreating catalysts Energy Fuel. 23 2009 101 110 10.1021/ef800741n M. Gómez-Cazalilla; A. Infantes-Molina; J. Mérida-Robles; E. Rodríguez-Castellón; A. Jiménez-López, Chromium species as captors of sulfur molecules on nickel-based hydrotreating catalysts, Energy Fuel. 23 (2009) 101–110. https://doi.org/10.1021/ef800741n. [56] W. Li X. Nie X. Jiang A. Zhang F. Ding M. Liu Z. Liu X. Guo C. Song ZrO2 support imparts superior activity and stability of Co catalysts for CO2 methanation Appl. Catal. B-Environ. 220 2018 397 408 10.1016/j.apcatb.2017.08.048 W. Li; X. Nie; X. Jiang; A. Zhang; F. Ding; M. Liu; Z. Liu; X. Guo; C. Song, ZrO2 support imparts superior activity and stability of Co catalysts for CO2 methanation, Appl. Catal. B-Environ. 220 (2018) 397–408. https://doi.org/10.1016/j.apcatb.2017.08.048. [57] H. Sun X. Yu X. Ma X. Yang M. Lin M. Ge MnO x -CeO2 catalyst derived from metal-organic frameworks for toluene oxidation Catal. Today 355 2020 580 586 10.1016/j.cattod.2019.05.062 H. Sun; X. Yu; X. Ma; X. Yang; M. Lin; M. Ge, MnOx-CeO2 catalyst derived from metal-organic frameworks for toluene oxidation, Catal. Today 355 (2020) 580–586. https://doi.org/10.1016/j.cattod.2019.05.062. [58] C. Lv X. Bai S. Ning C. Song Q. Guan B. Liu Y. Li J. Ye Nanostructured materials for photothermal carbon dioxide hydrogenation: regulating solar utilization and catalytic performance ACS Nano 17 2023 1725 1738 10.1021/acsnano.2c09025 C. Lv; X. Bai; S. Ning; C. Song; Q. Guan; B. Liu; Y. Li; J. Ye, Nanostructured materials for photothermal carbon dioxide hydrogenation: regulating solar utilization and catalytic performance, ACS Nano 17 (2023) 1725–1738. https://doi.org/10.1021/acsnano.2c09025. [59] X. Wei X. Rang W. Zhu M. Xiang Y. Deng F. Jiang R. Mao Z. Zhang X. Kong F. Wang Morphology effect of CeO2 on Ni/CeO2 catalysts for selective hydrogenation of cinnamaldehyde Chem. Phys. 542 2021 111079 10.1016/j.chemphys.2020.111079 X. Wei; X. Rang; W. Zhu; M. Xiang; Y. Deng; F. Jiang; R. Mao; Z. Zhang; X. Kong; F. Wang, Morphology effect of CeO2 on Ni/CeO2 catalysts for selective hydrogenation of cinnamaldehyde, Chem. Phys. 542 (2021)111079. https://doi.org/10.1016/j.chemphys.2020.111079. [60] D. Kumar A. Singh N. Kaur A. Thakur R. Kaur Tailoring structural and optical properties of ZrO2 with nickel doping SN Appl. Sci. 2 2020 644 10.1007/s42452-020-2491-z D. Kumar; A. Singh; N. Kaur; A. Thakur; R. Kaur, Tailoring structural and optical properties of ZrO2 with nickel doping, SN Appl. Sci. 2 (2020) 644. https://doi.org/10.1007/s42452-020-2491-z. [61] D. Kumar A. Singh B.S. Saini B.C. Choudhary V. Shinde R. Kaur Effect of Ni doping on the structural and optical properties of ZrO2 thin films J. Electron. 50 2020 65 74 10.1007/s11664-020-08558-0 D. Kumar; A. Singh; B.S. Saini; B.C. Choudhary; V. Shinde; R. Kaur, Effect of Ni doping on the structural and optical properties of ZrO2 thin films, J. Electron. 50 (2020) 65–74. https://doi.org/10.1007/s11664-020-08558-0. [62] X. Ding X. Liu J. Cheng D. Li T. Li Z. Jiang Y. Guo Boosted photothermal synergistic CO2 methanation over Ru doped Ni/ZrO2 catalyst: from experimental to DFT studies Fuel 357 2024 129779 10.1016/j.fuel.2023.129779 X. Ding; X. Liu; J. Cheng; D. Li; T. Li; Z. Jiang; Y. Guo, Boosted photothermal synergistic CO2 methanation over Ru doped Ni/ZrO2 catalyst: from experimental to DFT studies, Fuel 357 (2024)129779. https://doi.org/10.1016/j.fuel.2023.129779. [63] E. Moretti L. Storaro A. Talon S. Chitsazan G. Garbarino G. Busca E. Finocchio Ceria-zirconia based catalysts for ethanol steam reforming Fuel 153 2015 166 175 10.1016/j.fuel.2015.02.077 E. Moretti; L. Storaro; A. Talon; S. Chitsazan; G. Garbarino; G. Busca; E. Finocchio, Ceria-zirconia based catalysts for ethanol steam reforming, Fuel 153 (2015) 166–175. https://doi.org/10.1016/j.fuel.2015.02.077. [64] Z.G. Liu Y. Wei L. Xie H.Q. Chen J. Wang K. Yang K.Q. Lu Decorating CdS with cobaltous hydroxide and graphene dual cocatalyst for photocatalytic hydrogen production coupled selective benzyl alcohol oxidation Mol. Catal. 553 2024 113738 10.1016/j.mcat.2023.113738 Z.G. Liu; Y. Wei; L. Xie; H.Q. Chen; J. Wang; K. Yang; K.Q. Lu, Decorating CdS with cobaltous hydroxide and graphene dual cocatalyst for photocatalytic hydrogen production coupled selective benzyl alcohol oxidation, Mol. Catal. 553 (2024) 113738. https://doi.org/10.1016/j.mcat.2023.113738. [65] M.Y. Qi Q. Lin Z.R. Tang Y.J. Xu Photoredox coupling of benzyl alcohol oxidation with CO2 reduction over CdS/TiO2 heterostructure under visible light irradiation Appl. Catal. B. 307 2022 121158 10.1016/j.apcatb.2022.121158 M.Y. Qi; Q. Lin; Z.R. Tang; Y.J. Xu, Photoredox coupling of benzyl alcohol oxidation with CO2 reduction over CdS/TiO2 heterostructure under visible light irradiation, Appl. Catal. B. 307 (2022) 121158. https://doi.org/10.1016/j.apcatb.2022.121158. [66] S.H. Li M.Y. Qi Y.Y. Fan Y. Yang M. Anpo Y.M. Yamada Y.J. Xu Modulating photon harvesting through dynamic non-covalent interactions for enhanced photochemical CO2 reduction Appl. Catal. B. 292 2021 120157 10.1016/j.apcatb.2021.120157 S.H. Li; M.Y. Qi; Y.Y. Fan; Y. Yang; M. Anpo; Y.M. Yamada; Y.J. Xu, Modulating photon harvesting through dynamic non-covalent interactions for enhanced photochemical CO2 reduction Appl. Catal. B. 292 (2021) 120157. https://doi.org/10.1016/j.apcatb.2021.120157. [67] K. Han Y. Wang S. Wang Q. Liu Z. Deng F. Wang Narrowing band gap energy of CeO2 in (Ni/CeO2)@SiO2 catalyst for photothermal methane dry reforming Chem. Eng. J. 2021 421 10.1016/j.cej.2021.129989 K. Han; Y. Wang; S. Wang; Q. Liu; Z. Deng; F. Wang, Narrowing band gap energy of CeO2 in (Ni/CeO2)@SiO2 catalyst for photothermal methane dry reforming, Chem. Eng. J. 421 (2021). https://doi.org/10.1016/j.cej.2021.129989. [68] X.N. Shao Y.F. Wang M.Y. Qi Z.R. Tang MoS2 decorated CdS composite catalyst for photoredox-mediated C-N coupling of amines to imines and hydrogen production Mol. Catal. 557 2024 113991 10.1016/j.mcat.2024.113991 X.N. Shao; Y.F. Wang; M.Y. Qi; Z.R. Tang, MoS2 decorated CdS composite catalyst for photoredox-mediated C-N coupling of amines to imines and hydrogen production, Mol. Catal. 557 (2024) 113991. https://doi.org/10.1016/j.mcat.2024.113991. [69] S.M. Zhang Z.H. He J.J. Shi S.W. Wang J. Liu K. Wang Z.T. Liu Photothermal-driven CO2 reduction over Nd2O3/TiO2 heterojunction catalysts in aqueous medium Mol. Catal. 559 2024 114078 10.1016/j.mcat.2024.114078 S.M. Zhang; Z.H. He; J.J. Shi; S.W. Wang; J. Liu; K. Wang; Z.T. Liu, Photothermal-driven CO2 reduction over Nd2O3/TiO2 heterojunction catalysts in aqueous medium, Mol. Catal. 559 (2024) 114078. https://doi.org/10.1016/j.mcat.2024.114078. [70] X. Ding X. Liu J. Cheng L. Kong Y. Guo Advanced catalytic CO2 hydrogenation on Ni/ZrO2 with light induced oxygen vacancy formation in photothermal conditions at medium-low temperatures Catal. Sci. Technol. 12 2022 4740 4752 10.1039/d2cy00439a X. Ding; X. Liu; J. Cheng; L. Kong; Y. Guo, Advanced catalytic CO2 hydrogenation on Ni/ZrO2 with light induced oxygen vacancy formation in photothermal conditions at medium-low temperatures, Catal. Sci. Technol. 12 (2022) 4740–4752. https://doi.org/10.1039/d2cy00439a. [71] L. Zhao M. Tang F. Wang X. Qiu Efficient Cu/CeO2 composites for hydrogen production from photothermal methanol steam reforming: the utility of synergism of photo and thermal catalysis Fuel 2023 125748 10.1016/j/fuel.2022.125748 L. Zhao; M. Tang; F. Wang; X. Qiu, Efficient Cu/CeO2 composites for hydrogen production from photothermal methanol steam reforming: the utility of synergism of photo and thermal catalysis, Fuel. (2023) 125748. https://doi.org/10.1016/j/fuel.2022.125748. [72] K.Q. Lu Y. Chen X. Xin Y.J. Xu Rational utilization of highly conductive, commercial Elicarb graphene to advance the graphene-semiconductor composite photocatalysis Appl. Catal. B. 224 2018 424 432 10.1016/j.apcatb.2017.10.021 K.Q. Lu; Y. Chen; X. Xin; Y.J. Xu, Rational utilization of highly conductive, commercial Elicarb graphene to advance the graphene-semiconductor composite photocatalysis, Appl. Catal. B. 224 (2018) 424–432. https://doi.org/10.1016/j.apcatb.2017.10.021. [73] W. Zhang Y. Chen G. Zhang X. Tan Q. Ji Z. Wang H. Liu J. Qu Hot-electron-induced photothermal catalysis for energy-dependent molecular oxygen activation Angew. Chem. Int. Ed. 60 2021 4872 4878 10.1002/anie.202012306 W. Zhang; Y. Chen; G. Zhang; X. Tan; Q. Ji; Z. Wang; H. Liu; J. Qu, Hot-electron-induced photothermal catalysis for energy-dependent molecular oxygen activation, Angew. Chem. Int. Ed. 60 (2021) 4872–4878. https://doi.org/10.1002/anie.202012306.",
      "scopus-id": "85195556811",
      "coredata": {
        "eid": "1-s2.0-S2468823124004917",
        "dc:description": "Photo-assisted ethanol dry reforming (EDR) for syngas production was deeply studied over nanorod-like Ni/ZrO2 catalyst synthesized by precipitation and impregnation technique, respectively. The effect of light irradiation as well as catalyst preparation method on EDR reaction was investigated in detail with the stoichiometric feed ratios, over a temperature region of 350 to 550 °C. Photo-enhancement factor of ethanol conversion greatly increased from 10% (dark) to 40% (light) together with less formation of byproducts. Moreover, the experimental results depicted the better performance of P-Ni/ZrO2 catalyst due to its abundant oxygen vacancies and strong Ni-Zr interaction. Enriched interfacial oxygen defects and more light-excited electrons facilitated the activation/dissociation of ethanol and CO2, thereby enhancing the catalytic activity. In addition, the mean particle size of NiO in P-Ni/ZrO2 was (10.3 nm) which was smaller than that of the I-Ni/ZrO2 (16.5 nm), suggesting its higher dispersion of active metal. The calculated apparent activation energy of P-Ni/ZrO2 was 20.6 eV which was much less than the value of I-Ni/ZrO2 (37.7 eV). This work might provide the valuable insight for the development of highly-efficient photothermal catalyst to enhance the value-added utilization of greenhouse gas CO2.",
        "openArchiveArticle": "false",
        "prism:coverDate": "2024-07-15",
        "openaccessUserLicense": null,
        "prism:aggregationType": "Journal",
        "prism:url": "https://api.elsevier.com/content/article/pii/S2468823124004917",
        "dc:creator": [
          {
            "@_fa": "true",
            "$": "Tian, Yuhao"
          },
          {
            "@_fa": "true",
            "$": "Li, Yixuan"
          },
          {
            "@_fa": "true",
            "$": "Cao, Dong"
          },
          {
            "@_fa": "true",
            "$": "Liu, Qiying"
          },
          {
            "@_fa": "true",
            "$": "Cai, Weijie"
          }
        ],
        "link": [
          {
            "@_fa": "true",
            "@rel": "self",
            "@href": "https://api.elsevier.com/content/article/pii/S2468823124004917"
          },
          {
            "@_fa": "true",
            "@rel": "scidir",
            "@href": "https://www.sciencedirect.com/science/article/pii/S2468823124004917"
          }
        ],
        "dc:format": "application/json",
        "openaccessType": null,
        "pii": "S2468-8231(24)00491-7",
        "prism:volume": "564",
        "articleNumber": "114308",
        "prism:publisher": "Elsevier B.V. All rights are reserved, including those for text and data mining, AI training, and similar technologies.",
        "dc:title": "Photothermal dry reforming of ethanol over rod-like Ni/ZrO2 catalysts",
        "prism:copyright": "© 2024 Elsevier B.V. All rights are reserved, including those for text and data mining, AI training, and similar technologies.",
        "openaccess": "0",
        "prism:issn": "24688231",
        "dcterms:subject": [
          {
            "@_fa": "true",
            "$": "Photothermal catalyst"
          },
          {
            "@_fa": "true",
            "$": "Dry reforming of ethanol"
          },
          {
            "@_fa": "true",
            "$": "Ni/ZrO2"
          },
          {
            "@_fa": "true",
            "$": "Syngas"
          },
          {
            "@_fa": "true",
            "$": "Carbon dioxide"
          }
        ],
        "openaccessArticle": "false",
        "prism:publicationName": "Molecular Catalysis",
        "openaccessSponsorType": null,
        "prism:pageRange": "114308",
        "pubType": "fla",
        "prism:coverDisplayDate": "15 July 2024",
        "prism:doi": "10.1016/j.mcat.2024.114308",
        "prism:startingPage": "114308",
        "dc:identifier": "doi:10.1016/j.mcat.2024.114308",
        "openaccessSponsorName": null
      },
      "objects": {
        "object": [
          {
            "@category": "standard",
            "@height": "255",
            "@width": "602",
            "@_fa": "true",
            "$": "https://api.elsevier.com/content/object/eid/1-s2.0-S2468823124004917-gr5.jpg?httpAccept=%2A%2F%2A",
            "@multimediatype": "JPEG image file",
            "@type": "IMAGE-DOWNSAMPLED",
            "@size": "34325",
            "@ref": "gr5",
            "@mimetype": "image/jpeg"
          },
          {
            "@category": "standard",
            "@height": "485",
            "@width": "678",
            "@_fa": "true",
            "$": "https://api.elsevier.com/content/object/eid/1-s2.0-S2468823124004917-gr6.jpg?httpAccept=%2A%2F%2A",
            "@multimediatype": "JPEG image file",
            "@type": "IMAGE-DOWNSAMPLED",
            "@size": "78659",
            "@ref": "gr6",
            "@mimetype": "image/jpeg"
          },
          {
            "@category": "standard",
            "@height": "253",
            "@width": "339",
            "@_fa": "true",
            "$": "https://api.elsevier.com/content/object/eid/1-s2.0-S2468823124004917-gr7.jpg?httpAccept=%2A%2F%2A",
            "@multimediatype": "JPEG image file",
            "@type": "IMAGE-DOWNSAMPLED",
            "@size": "26096",
            "@ref": "gr7",
            "@mimetype": "image/jpeg"
          },
          {
            "@category": "standard",
            "@height": "300",
            "@width": "386",
            "@_fa": "true",
            "$": "https://api.elsevier.com/content/object/eid/1-s2.0-S2468823124004917-gr8.jpg?httpAccept=%2A%2F%2A",
            "@multimediatype": "JPEG image file",
            "@type": "IMAGE-DOWNSAMPLED",
            "@size": "28585",
            "@ref": "gr8",
            "@mimetype": "image/jpeg"
          },
          {
            "@category": "standard",
            "@height": "481",
            "@width": "602",
            "@_fa": "true",
            "$": "https://api.elsevier.com/content/object/eid/1-s2.0-S2468823124004917-gr1.jpg?httpAccept=%2A%2F%2A",
            "@multimediatype": "JPEG image file",
            "@type": "IMAGE-DOWNSAMPLED",
            "@size": "75433",
            "@ref": "gr1",
            "@mimetype": "image/jpeg"
          },
          {
            "@category": "standard",
            "@height": "299",
            "@width": "659",
            "@_fa": "true",
            "$": "https://api.elsevier.com/content/object/eid/1-s2.0-S2468823124004917-gr2.jpg?httpAccept=%2A%2F%2A",
            "@multimediatype": "JPEG image file",
            "@type": "IMAGE-DOWNSAMPLED",
            "@size": "61759",
            "@ref": "gr2",
            "@mimetype": "image/jpeg"
          },
          {
            "@category": "standard",
            "@height": "200",
            "@width": "283",
            "@_fa": "true",
            "$": "https://api.elsevier.com/content/object/eid/1-s2.0-S2468823124004917-ga1.jpg?httpAccept=%2A%2F%2A",
            "@multimediatype": "JPEG image file",
            "@type": "IMAGE-DOWNSAMPLED",
            "@size": "36749",
            "@ref": "ga1",
            "@mimetype": "image/jpeg"
          },
          {
            "@category": "standard",
            "@height": "495",
            "@width": "602",
            "@_fa": "true",
            "$": "https://api.elsevier.com/content/object/eid/1-s2.0-S2468823124004917-gr3.jpg?httpAccept=%2A%2F%2A",
            "@multimediatype": "JPEG image file",
            "@type": "IMAGE-DOWNSAMPLED",
            "@size": "61600",
            "@ref": "gr3",
            "@mimetype": "image/jpeg"
          },
          {
            "@category": "standard",
            "@height": "485",
            "@width": "659",
            "@_fa": "true",
            "$": "https://api.elsevier.com/content/object/eid/1-s2.0-S2468823124004917-gr4.jpg?httpAccept=%2A%2F%2A",
            "@multimediatype": "JPEG image file",
            "@type": "IMAGE-DOWNSAMPLED",
            "@size": "82780",
            "@ref": "gr4",
            "@mimetype": "image/jpeg"
          },
          {
            "@category": "standard",
            "@height": "291",
            "@width": "659",
            "@_fa": "true",
            "$": "https://api.elsevier.com/content/object/eid/1-s2.0-S2468823124004917-sc1.jpg?httpAccept=%2A%2F%2A",
            "@multimediatype": "JPEG image file",
            "@type": "IMAGE-DOWNSAMPLED",
            "@size": "50949",
            "@ref": "sc1",
            "@mimetype": "image/jpeg"
          },
          {
            "@category": "thumbnail",
            "@height": "93",
            "@width": "219",
            "@_fa": "true",
            "$": "https://api.elsevier.com/content/object/eid/1-s2.0-S2468823124004917-gr5.sml?httpAccept=%2A%2F%2A",
            "@multimediatype": "GIF image file",
            "@type": "IMAGE-THUMBNAIL",
            "@size": "6221",
            "@ref": "gr5",
            "@mimetype": "image/gif"
          },
          {
            "@category": "thumbnail",
            "@height": "157",
            "@width": "219",
            "@_fa": "true",
            "$": "https://api.elsevier.com/content/object/eid/1-s2.0-S2468823124004917-gr6.sml?httpAccept=%2A%2F%2A",
            "@multimediatype": "GIF image file",
            "@type": "IMAGE-THUMBNAIL",
            "@size": "11721",
            "@ref": "gr6",
            "@mimetype": "image/gif"
          },
          {
            "@category": "thumbnail",
            "@height": "163",
            "@width": "219",
            "@_fa": "true",
            "$": "https://api.elsevier.com/content/object/eid/1-s2.0-S2468823124004917-gr7.sml?httpAccept=%2A%2F%2A",
            "@multimediatype": "GIF image file",
            "@type": "IMAGE-THUMBNAIL",
            "@size": "10524",
            "@ref": "gr7",
            "@mimetype": "image/gif"
          },
          {
            "@category": "thumbnail",
            "@height": "164",
            "@width": "211",
            "@_fa": "true",
            "$": "https://api.elsevier.com/content/object/eid/1-s2.0-S2468823124004917-gr8.sml?httpAccept=%2A%2F%2A",
            "@multimediatype": "GIF image file",
            "@type": "IMAGE-THUMBNAIL",
            "@size": "20289",
            "@ref": "gr8",
            "@mimetype": "image/gif"
          },
          {
            "@category": "thumbnail",
            "@height": "164",
            "@width": "205",
            "@_fa": "true",
            "$": "https://api.elsevier.com/content/object/eid/1-s2.0-S2468823124004917-gr1.sml?httpAccept=%2A%2F%2A",
            "@multimediatype": "GIF image file",
            "@type": "IMAGE-THUMBNAIL",
            "@size": "11435",
            "@ref": "gr1",
            "@mimetype": "image/gif"
          },
          {
            "@category": "thumbnail",
            "@height": "99",
            "@width": "219",
            "@_fa": "true",
            "$": "https://api.elsevier.com/content/object/eid/1-s2.0-S2468823124004917-gr2.sml?httpAccept=%2A%2F%2A",
            "@multimediatype": "GIF image file",
            "@type": "IMAGE-THUMBNAIL",
            "@size": "17404",
            "@ref": "gr2",
            "@mimetype": "image/gif"
          },
          {
            "@category": "thumbnail",
            "@height": "155",
            "@width": "219",
            "@_fa": "true",
            "$": "https://api.elsevier.com/content/object/eid/1-s2.0-S2468823124004917-ga1.sml?httpAccept=%2A%2F%2A",
            "@multimediatype": "GIF image file",
            "@type": "IMAGE-THUMBNAIL",
            "@size": "29329",
            "@ref": "ga1",
            "@mimetype": "image/gif"
          },
          {
            "@category": "thumbnail",
            "@height": "164",
            "@width": "199",
            "@_fa": "true",
            "$": "https://api.elsevier.com/content/object/eid/1-s2.0-S2468823124004917-gr3.sml?httpAccept=%2A%2F%2A",
            "@multimediatype": "GIF image file",
            "@type": "IMAGE-THUMBNAIL",
            "@size": "10816",
            "@ref": "gr3",
            "@mimetype": "image/gif"
          },
          {
            "@category": "thumbnail",
            "@height": "161",
            "@width": "219",
            "@_fa": "true",
            "$": "https://api.elsevier.com/content/object/eid/1-s2.0-S2468823124004917-gr4.sml?httpAccept=%2A%2F%2A",
            "@multimediatype": "GIF image file",
            "@type": "IMAGE-THUMBNAIL",
            "@size": "11860",
            "@ref": "gr4",
            "@mimetype": "image/gif"
          },
          {
            "@category": "thumbnail",
            "@height": "97",
            "@width": "219",
            "@_fa": "true",
            "$": "https://api.elsevier.com/content/object/eid/1-s2.0-S2468823124004917-sc1.sml?httpAccept=%2A%2F%2A",
            "@multimediatype": "GIF image file",
            "@type": "IMAGE-THUMBNAIL",
            "@size": "14681",
            "@ref": "sc1",
            "@mimetype": "image/gif"
          },
          {
            "@category": "high",
            "@height": "1131",
            "@width": "2667",
            "@_fa": "true",
            "$": "https://api.elsevier.com/content/object/eid/1-s2.0-S2468823124004917-gr5_lrg.jpg?httpAccept=%2A%2F%2A",
            "@multimediatype": "JPEG image file",
            "@type": "IMAGE-HIGH-RES",
            "@size": "227444",
            "@ref": "gr5",
            "@mimetype": "image/jpeg"
          },
          {
            "@category": "high",
            "@height": "2146",
            "@width": "3000",
            "@_fa": "true",
            "$": "https://api.elsevier.com/content/object/eid/1-s2.0-S2468823124004917-gr6_lrg.jpg?httpAccept=%2A%2F%2A",
            "@multimediatype": "JPEG image file",
            "@type": "IMAGE-HIGH-RES",
            "@size": "553136",
            "@ref": "gr6",
            "@mimetype": "image/jpeg"
          },
          {
            "@category": "high",
            "@height": "1118",
            "@width": "1500",
            "@_fa": "true",
            "$": "https://api.elsevier.com/content/object/eid/1-s2.0-S2468823124004917-gr7_lrg.jpg?httpAccept=%2A%2F%2A",
            "@multimediatype": "JPEG image file",
            "@type": "IMAGE-HIGH-RES",
            "@size": "178900",
            "@ref": "gr7",
            "@mimetype": "image/jpeg"
          },
          {
            "@category": "high",
            "@height": "1327",
            "@width": "1708",
            "@_fa": "true",
            "$": "https://api.elsevier.com/content/object/eid/1-s2.0-S2468823124004917-gr8_lrg.jpg?httpAccept=%2A%2F%2A",
            "@multimediatype": "JPEG image file",
            "@type": "IMAGE-HIGH-RES",
            "@size": "199244",
            "@ref": "gr8",
            "@mimetype": "image/jpeg"
          },
          {
            "@category": "high",
            "@height": "2130",
            "@width": "2667",
            "@_fa": "true",
            "$": "https://api.elsevier.com/content/object/eid/1-s2.0-S2468823124004917-gr1_lrg.jpg?httpAccept=%2A%2F%2A",
            "@multimediatype": "JPEG image file",
            "@type": "IMAGE-HIGH-RES",
            "@size": "519329",
            "@ref": "gr1",
            "@mimetype": "image/jpeg"
          },
          {
            "@category": "high",
            "@height": "1323",
            "@width": "2917",
            "@_fa": "true",
            "$": "https://api.elsevier.com/content/object/eid/1-s2.0-S2468823124004917-gr2_lrg.jpg?httpAccept=%2A%2F%2A",
            "@multimediatype": "JPEG image file",
            "@type": "IMAGE-HIGH-RES",
            "@size": "609052",
            "@ref": "gr2",
            "@mimetype": "image/jpeg"
          },
          {
            "@category": "high",
            "@height": "886",
            "@width": "1253",
            "@_fa": "true",
            "$": "https://api.elsevier.com/content/object/eid/1-s2.0-S2468823124004917-ga1_lrg.jpg?httpAccept=%2A%2F%2A",
            "@multimediatype": "JPEG image file",
            "@type": "IMAGE-HIGH-RES",
            "@size": "342739",
            "@ref": "ga1",
            "@mimetype": "image/jpeg"
          },
          {
            "@category": "high",
            "@height": "2192",
            "@width": "2667",
            "@_fa": "true",
            "$": "https://api.elsevier.com/content/object/eid/1-s2.0-S2468823124004917-gr3_lrg.jpg?httpAccept=%2A%2F%2A",
            "@multimediatype": "JPEG image file",
            "@type": "IMAGE-HIGH-RES",
            "@size": "453391",
            "@ref": "gr3",
            "@mimetype": "image/jpeg"
          },
          {
            "@category": "high",
            "@height": "2145",
            "@width": "2917",
            "@_fa": "true",
            "$": "https://api.elsevier.com/content/object/eid/1-s2.0-S2468823124004917-gr4_lrg.jpg?httpAccept=%2A%2F%2A",
            "@multimediatype": "JPEG image file",
            "@type": "IMAGE-HIGH-RES",
            "@size": "608801",
            "@ref": "gr4",
            "@mimetype": "image/jpeg"
          },
          {
            "@category": "high",
            "@height": "1287",
            "@width": "2917",
            "@_fa": "true",
            "$": "https://api.elsevier.com/content/object/eid/1-s2.0-S2468823124004917-sc1_lrg.jpg?httpAccept=%2A%2F%2A",
            "@multimediatype": "JPEG image file",
            "@type": "IMAGE-HIGH-RES",
            "@size": "394947",
            "@ref": "sc1",
            "@mimetype": "image/jpeg"
          },
          {
            "@category": "standard",
            "@_fa": "true",
            "$": "https://api.elsevier.com/content/object/eid/1-s2.0-S2468823124004917-mmc1.docx?httpAccept=%2A%2F%2A",
            "@multimediatype": "Microsoft Word file",
            "@type": "APPLICATION",
            "@size": "135841",
            "@ref": "mmc1",
            "@mimetype": "application/word"
          },
          {
            "@category": "thumbnail",
            "@_fa": "true",
            "$": "https://api.elsevier.com/content/object/eid/1-s2.0-S2468823124004917-si1.svg?httpAccept=%2A%2F%2A",
            "@multimediatype": "Scalable Vector Graphics file",
            "@type": "ALTIMG",
            "@size": "19289",
            "@ref": "si1",
            "@mimetype": "image/svg+xml"
          },
          {
            "@category": "standard",
            "@_fa": "true",
            "$": "https://api.elsevier.com/content/object/eid/1-s2.0-S2468823124004917-am.pdf?httpAccept=%2A%2F%2A",
            "@multimediatype": "Acrobat PDF file",
            "@type": "AAM-PDF",
            "@size": "1405439",
            "@ref": "am",
            "@mimetype": "application/pdf"
          }
        ]
      },
      "link": {
        "@rel": "abstract",
        "@href": "https://api.elsevier.com/content/abstract/scopus_id/85195556811"
      }
    }
  }
}