{
  "metadata": {
    "title": "Promotional effects of phosphotungstic acid on CePO<ce:inf loc=post>4</ce:inf> catalyst for the selective catalytic reduction of NO<ce:italic><ce:inf loc=post>x</ce:inf></ce:italic> with NH<ce:inf loc=post>3</ce:inf>",
    "authors": "; ; ",
    "journal": "Molecular Catalysis",
    "date": "2023-12-31",
    "doi": "10.1016/j.mcat.2023.113666",
    "abstract": "",
    "uri": "https://api.elsevier.com/content/article/pii/S2468823123007496",
    "pii": "S2468823123007496"
  },
  "fulltext": {
    "full-text-retrieval-response": {
      "scopus-eid": "2-s2.0-85175353356",
      "originalText": "serial JL 315758 291210 291744 291790 291809 31 Molecular Catalysis MOLECULARCATALYSIS 2023-11-03 2023-11-03 2023-11-03 2023-11-03 2023-11-15T19:32:27 1-s2.0-S2468823123007496 S2468-8231(23)00749-6 S2468823123007496 10.1016/j.mcat.2023.113666 S300 S300.1 FULL-TEXT 1-s2.0-S2468823123X00170 2023-11-20T02:21:01.281528Z 0 0 20231201 20231231 2023 2023-11-03T17:51:33.922074Z absattachment articleinfo articlenumber articletitlenorm authfirstinitialnorm authfirstsurnamenorm cid cids contenttype copyright crossmark dateloaded dateloadedtxt datesearch datesort dateupdated dco docsubtype doctype doi eid ewtransactionid hubeid indexeddate issn issnnorm itemstage itemtransactionid itemweight openaccess openarchive pg pgfirst pii piinorm pubdateend pubdatestart pubdatetxt pubyr sectiontitle sortorder srctitle srctitlenorm srctype ssids alllist content subj subheadings suppl tomb volfirst volissue volumelist webpdf webpdfpagecount yearnav figure table body mmlmath acknowledge affil articletitle auth authfirstini authfull authkeywords authlast grantnumber grantsponsor grantsponsorid highlightsabst primabst ref specialabst 2468-8231 24688231 true 551 551 C Volume 551 37 113666 113666 113666 202312 December 2023 2023-12-01 2023-12-31 2023 Regular Papers article fla © 2023 Elsevier B.V. All rights reserved. PROMOTIONALEFFECTSPHOSPHOTUNGSTICACIDCEPO4CATALYSTFORSELECTIVECATALYTICREDUCTIONNOXNH3 ZHANG L 1 Introduction 2 Experimental 2.1 Catalyst preparation 2.2 Catalyst characterization 2.3 Catalytic performance test 3 Results and discussion 3.1 Catalytic performance 3.2 Catalyst characterization 3.2.1 Structural characteristics XRD 3.2.2 Surface morphology analysis 3.2.3 Microscopic morphology analysis 3.2.4 Specific surface area and pore size analysis 3.3 H2-TPR results 3.4 NH3-TPD results 3.5 Surface element valence analysis 3.6 In-situ DRIFTs studies 3.6.1 Adsorption of NH3/NO+O2 on the catalyst surface 3.6.2 Thermal stability of NH3/NO+O2 on the catalyst surface 3.6.3 Transient DRIFT reaction 4 Conclusion CRediT authorship contribution statement Acknowledgments References ZHOU 2021 97 104 Y CHEN 2022 114 120 Z LI 2023 126103 X LI 2011 147 156 J TANG 2016 1248 1264 C LI 2017 366 375 L SHAO 2019 292 298 X CHA 2013 4415 4418 W ZENG 2020 121212 Y LIU 2019 439 446 C ZHAO 2022 1219 1231 C WU 2021 128712 J TANG 2021 291 306 X WENG 2016 9 14 X HUI 2022 800 806 K SISIRA 2019 197 207 S MA 2016 343 352 T MICEKILNICKA 2021 84 92 A WEI 2018 262 270 Y WANG 2021 322 333 W JIA 2023 112913 Y LIN 2021 118427 Z WANG 2022 4991 5002 S BARDIN 2000 219 231 B CAVKA 2008 13850 13851 J HUANG 2023 135384 J REN 2017 36 45 Z CHEN 2022 123969 L REN 2017 71 75 Z ZENG 2018 8 15 Y CHEN 2022 128148 L WANG 2022 54 59 M LI 2018 814 822 M HUANG 2022 110566 L HENG 2017 51 59 H LIU 2021 105422 G LI 2017 926 935 Y JIA 2021 125258 Y SONG 2017 277 284 Z YOU 2018 47 54 Y YAO 2020 124782 W GONG 2020 144641 P CHEN 2023 123086 C ZENG 2022 1232 1237 Y HAN 2019 133 146 S WU 2021 105426 H ZHENG 2022 118606 Y ZHANG 2023 140391 N ZHAO 2022 112627 R GENG 2020 121032 Y ZHANG 2023 129867 P KE 2019 5774 5785 Y YANG 2022 1245 1256 J ZHANGX2023X113666 ZHANGX2023X113666XL 2025-11-03T00:00:00.000Z 2025-11-03T00:00:00.000Z http://creativecommons.org/licenses/by-nc-nd/4.0/ © 2023 Elsevier B.V. All rights reserved. 2023-11-04T09:09:25.228Z http://vtw.elsevier.com/data/voc/AddOnTypes/50.7/aggregated-refined Inner Mongolia Autonomous Region 2023QNJS009 NMG Government of Inner Mongolia Autonomous Region http://data.elsevier.com/vocabulary/SciValFunders/501100002797 http://sws.geonames.org/1814991/ Inner Mongolia Natural Science Foundation 2021MS02022 Natural Science Foundation of Inner Mongolia Autonomous Region http://data.elsevier.com/vocabulary/SciValFunders/501100004763 http://sws.geonames.org/1814991/ 2022 basic scientific research funds National Natural Science Foundation of China 52362035 NSFC National Natural Science Foundation of China http://data.elsevier.com/vocabulary/SciValFunders/501100001809 http://sws.geonames.org/1814991/ This study was financially supported by 2022 basic scientific research funds for universities directly under the Inner Mongolia Autonomous Region; 2023 basic scientific research funds for universities directly under the Inner Mongolia Autonomous Region ( 2023QNJS009 ); National Natural Science Foundation of China ( 52362035 ); and Inner Mongolia Natural Science Foundation ( 2021MS02022 ). https://doi.org/10.15223/policy-017 https://doi.org/10.15223/policy-037 https://doi.org/10.15223/policy-012 https://doi.org/10.15223/policy-029 https://doi.org/10.15223/policy-004 item S2468-8231(23)00749-6 S2468823123007496 1-s2.0-S2468823123007496 10.1016/j.mcat.2023.113666 315758 2023-11-20T02:21:01.281528Z 2023-12-01 2023-12-31 1-s2.0-S2468823123007496-main.pdf https://s3-eu-west-1.amazonaws.com/prod-ucs-content-store-eu-west/content/pii:S2468823123007496/MAIN/application/pdf/f9f57b9c315ca05594f0a6e996c9f98e/main.pdf main.pdf pdf true 9076246 MAIN 12 1-s2.0-S2468823123007496-main_1.png https://s3-eu-west-1.amazonaws.com/prod-ucs-content-store-eu-west/content/pii:S2468823123007496/PREVIEW/image/png/0d4ace5a66eb6d551f5ed4fceee72032/main_1.png main_1.png png 58544 849 656 IMAGE-WEB-PDF 1 1-s2.0-S2468823123007496-gr4.jpg https://s3-eu-west-1.amazonaws.com/prod-ucs-content-store-eu-west/content/pii:S2468823123007496/gr4/DOWNSAMPLED/image/jpeg/1d6f7a27c3275e0a7e390bf992dd7931/gr4.jpg gr4 gr4.jpg jpg 77655 283 376 IMAGE-DOWNSAMPLED 1-s2.0-S2468823123007496-gr9.jpg https://s3-eu-west-1.amazonaws.com/prod-ucs-content-store-eu-west/content/pii:S2468823123007496/gr9/DOWNSAMPLED/image/jpeg/c32407e6d01cc2614f23b8b0e0abaf45/gr9.jpg gr9 gr9.jpg jpg 207857 692 753 IMAGE-DOWNSAMPLED 1-s2.0-S2468823123007496-gr7.jpg https://s3-eu-west-1.amazonaws.com/prod-ucs-content-store-eu-west/content/pii:S2468823123007496/gr7/DOWNSAMPLED/image/jpeg/7301f563fad4a5d5ad0eee63fab043ed/gr7.jpg gr7 gr7.jpg jpg 51318 280 659 IMAGE-DOWNSAMPLED 1-s2.0-S2468823123007496-gr11.jpg https://s3-eu-west-1.amazonaws.com/prod-ucs-content-store-eu-west/content/pii:S2468823123007496/gr11/DOWNSAMPLED/image/jpeg/eda7c18b90456945c79617aacb5a982d/gr11.jpg gr11 gr11.jpg jpg 57300 257 659 IMAGE-DOWNSAMPLED 1-s2.0-S2468823123007496-gr12.jpg https://s3-eu-west-1.amazonaws.com/prod-ucs-content-store-eu-west/content/pii:S2468823123007496/gr12/DOWNSAMPLED/image/jpeg/06f1a6c84e7d005d825134635e77de35/gr12.jpg gr12 gr12.jpg jpg 67421 254 659 IMAGE-DOWNSAMPLED 1-s2.0-S2468823123007496-gr1.jpg https://s3-eu-west-1.amazonaws.com/prod-ucs-content-store-eu-west/content/pii:S2468823123007496/gr1/DOWNSAMPLED/image/jpeg/46ec41c9c100f1d631d914d5dfbc7269/gr1.jpg gr1 gr1.jpg jpg 133588 610 753 IMAGE-DOWNSAMPLED 1-s2.0-S2468823123007496-gr2.jpg https://s3-eu-west-1.amazonaws.com/prod-ucs-content-store-eu-west/content/pii:S2468823123007496/gr2/DOWNSAMPLED/image/jpeg/33a9da0165e68d61d83a904f3c871b03/gr2.jpg gr2 gr2.jpg jpg 48018 266 339 IMAGE-DOWNSAMPLED 1-s2.0-S2468823123007496-gr5.jpg https://s3-eu-west-1.amazonaws.com/prod-ucs-content-store-eu-west/content/pii:S2468823123007496/gr5/DOWNSAMPLED/image/jpeg/82b3fefc08b8558cda6bc057efd2aca1/gr5.jpg gr5 gr5.jpg jpg 106279 302 791 IMAGE-DOWNSAMPLED 1-s2.0-S2468823123007496-gr6.jpg https://s3-eu-west-1.amazonaws.com/prod-ucs-content-store-eu-west/content/pii:S2468823123007496/gr6/DOWNSAMPLED/image/jpeg/c63d7ce8f4d81bedd86290f952dd5bb7/gr6.jpg gr6 gr6.jpg jpg 128609 434 791 IMAGE-DOWNSAMPLED 1-s2.0-S2468823123007496-gr3.jpg https://s3-eu-west-1.amazonaws.com/prod-ucs-content-store-eu-west/content/pii:S2468823123007496/gr3/DOWNSAMPLED/image/jpeg/88586833001a571b076951a52a1e4e49/gr3.jpg gr3 gr3.jpg jpg 38037 193 376 IMAGE-DOWNSAMPLED 1-s2.0-S2468823123007496-gr8.jpg https://s3-eu-west-1.amazonaws.com/prod-ucs-content-store-eu-west/content/pii:S2468823123007496/gr8/DOWNSAMPLED/image/jpeg/393dc93d4857dfb8eaa01b878115536e/gr8.jpg gr8 gr8.jpg jpg 58825 293 659 IMAGE-DOWNSAMPLED 1-s2.0-S2468823123007496-gr10.jpg https://s3-eu-west-1.amazonaws.com/prod-ucs-content-store-eu-west/content/pii:S2468823123007496/gr10/DOWNSAMPLED/image/jpeg/c4ceff16da138b3c6f65f2b9964b809c/gr10.jpg gr10 gr10.jpg jpg 68102 255 659 IMAGE-DOWNSAMPLED 1-s2.0-S2468823123007496-ga1.jpg https://s3-eu-west-1.amazonaws.com/prod-ucs-content-store-eu-west/content/pii:S2468823123007496/ga1/DOWNSAMPLED/image/jpeg/1284564d89fdfe9ecc631f01844b5836/ga1.jpg ga1 true ga1.jpg jpg 20247 200 306 IMAGE-DOWNSAMPLED 1-s2.0-S2468823123007496-gr13.jpg https://s3-eu-west-1.amazonaws.com/prod-ucs-content-store-eu-west/content/pii:S2468823123007496/gr13/DOWNSAMPLED/image/jpeg/02fbbc26a6c1e0dda4c209899ceedf43/gr13.jpg gr13 gr13.jpg jpg 26985 247 376 IMAGE-DOWNSAMPLED 1-s2.0-S2468823123007496-gr4.sml https://s3-eu-west-1.amazonaws.com/prod-ucs-content-store-eu-west/content/pii:S2468823123007496/gr4/THUMBNAIL/image/gif/6cd03ecefd913e94033dc8df7164ae75/gr4.sml gr4 gr4.sml sml 20887 164 218 IMAGE-THUMBNAIL 1-s2.0-S2468823123007496-gr9.sml https://s3-eu-west-1.amazonaws.com/prod-ucs-content-store-eu-west/content/pii:S2468823123007496/gr9/THUMBNAIL/image/gif/ab094f466a5288b50d6e4a57a57d1cf4/gr9.sml gr9 gr9.sml sml 17549 164 178 IMAGE-THUMBNAIL 1-s2.0-S2468823123007496-gr7.sml https://s3-eu-west-1.amazonaws.com/prod-ucs-content-store-eu-west/content/pii:S2468823123007496/gr7/THUMBNAIL/image/gif/3c25a5392e6082ba74a6d6b3e3b26517/gr7.sml gr7 gr7.sml sml 9343 93 219 IMAGE-THUMBNAIL 1-s2.0-S2468823123007496-gr11.sml https://s3-eu-west-1.amazonaws.com/prod-ucs-content-store-eu-west/content/pii:S2468823123007496/gr11/THUMBNAIL/image/gif/fd6f826c602efa58c1f3b3e2227ea914/gr11.sml gr11 gr11.sml sml 8659 85 219 IMAGE-THUMBNAIL 1-s2.0-S2468823123007496-gr12.sml https://s3-eu-west-1.amazonaws.com/prod-ucs-content-store-eu-west/content/pii:S2468823123007496/gr12/THUMBNAIL/image/gif/0e06ff446d722c18909a13047e384df5/gr12.sml gr12 gr12.sml sml 9908 84 219 IMAGE-THUMBNAIL 1-s2.0-S2468823123007496-gr1.sml https://s3-eu-west-1.amazonaws.com/prod-ucs-content-store-eu-west/content/pii:S2468823123007496/gr1/THUMBNAIL/image/gif/90ec5d74813305abf1136fec22bfd3b2/gr1.sml gr1 gr1.sml sml 13509 164 202 IMAGE-THUMBNAIL 1-s2.0-S2468823123007496-gr2.sml https://s3-eu-west-1.amazonaws.com/prod-ucs-content-store-eu-west/content/pii:S2468823123007496/gr2/THUMBNAIL/image/gif/e0eae0f0c0f197329f8e50299e6f07f1/gr2.sml gr2 gr2.sml sml 13769 164 209 IMAGE-THUMBNAIL 1-s2.0-S2468823123007496-gr5.sml https://s3-eu-west-1.amazonaws.com/prod-ucs-content-store-eu-west/content/pii:S2468823123007496/gr5/THUMBNAIL/image/gif/41ce1115e831d7dfc7446a8378053f05/gr5.sml gr5 gr5.sml sml 16240 84 219 IMAGE-THUMBNAIL 1-s2.0-S2468823123007496-gr6.sml https://s3-eu-west-1.amazonaws.com/prod-ucs-content-store-eu-west/content/pii:S2468823123007496/gr6/THUMBNAIL/image/gif/652d83e63f57b331a85afed0c688ce54/gr6.sml gr6 gr6.sml sml 13390 120 219 IMAGE-THUMBNAIL 1-s2.0-S2468823123007496-gr3.sml https://s3-eu-west-1.amazonaws.com/prod-ucs-content-store-eu-west/content/pii:S2468823123007496/gr3/THUMBNAIL/image/gif/405880c9aeec45b3056b3acdf5a39dc0/gr3.sml gr3 gr3.sml sml 20138 112 219 IMAGE-THUMBNAIL 1-s2.0-S2468823123007496-gr8.sml https://s3-eu-west-1.amazonaws.com/prod-ucs-content-store-eu-west/content/pii:S2468823123007496/gr8/THUMBNAIL/image/gif/29ad1132e3eb1bc241946641417169dc/gr8.sml gr8 gr8.sml sml 10336 97 219 IMAGE-THUMBNAIL 1-s2.0-S2468823123007496-gr10.sml https://s3-eu-west-1.amazonaws.com/prod-ucs-content-store-eu-west/content/pii:S2468823123007496/gr10/THUMBNAIL/image/gif/98e67cd421356f9244f363e41cc2122f/gr10.sml gr10 gr10.sml sml 10026 85 219 IMAGE-THUMBNAIL 1-s2.0-S2468823123007496-ga1.sml https://s3-eu-west-1.amazonaws.com/prod-ucs-content-store-eu-west/content/pii:S2468823123007496/ga1/THUMBNAIL/image/gif/5af84f5122d9a7ccd147fa97823b4a49/ga1.sml ga1 true ga1.sml sml 12552 143 219 IMAGE-THUMBNAIL 1-s2.0-S2468823123007496-gr13.sml https://s3-eu-west-1.amazonaws.com/prod-ucs-content-store-eu-west/content/pii:S2468823123007496/gr13/THUMBNAIL/image/gif/3583ae6a122514d8251caf5cc1917884/gr13.sml gr13 gr13.sml sml 12347 144 219 IMAGE-THUMBNAIL 1-s2.0-S2468823123007496-gr4_lrg.jpg https://s3-eu-west-1.amazonaws.com/prod-ucs-content-store-eu-west/content/pii:S2468823123007496/HIGHRES/image/jpeg/07c1291a972e03d62819336d631af8a5/gr4_lrg.jpg gr4 gr4_lrg.jpg jpg 572727 1254 1667 IMAGE-HIGH-RES 1-s2.0-S2468823123007496-gr9_lrg.jpg https://s3-eu-west-1.amazonaws.com/prod-ucs-content-store-eu-west/content/pii:S2468823123007496/HIGHRES/image/jpeg/79f209c667e381a963691237a32d8ca2/gr9_lrg.jpg gr9 gr9_lrg.jpg jpg 1299309 3064 3333 IMAGE-HIGH-RES 1-s2.0-S2468823123007496-gr7_lrg.jpg https://s3-eu-west-1.amazonaws.com/prod-ucs-content-store-eu-west/content/pii:S2468823123007496/HIGHRES/image/jpeg/ff3224afb522512073ab9814730d4a41/gr7_lrg.jpg gr7 gr7_lrg.jpg jpg 326858 1241 2917 IMAGE-HIGH-RES 1-s2.0-S2468823123007496-gr11_lrg.jpg https://s3-eu-west-1.amazonaws.com/prod-ucs-content-store-eu-west/content/pii:S2468823123007496/HIGHRES/image/jpeg/980b67c55571ccd13fcbfc2892c314fd/gr11_lrg.jpg gr11 gr11_lrg.jpg jpg 346226 1137 2917 IMAGE-HIGH-RES 1-s2.0-S2468823123007496-gr12_lrg.jpg https://s3-eu-west-1.amazonaws.com/prod-ucs-content-store-eu-west/content/pii:S2468823123007496/HIGHRES/image/jpeg/563529347b3fda0da3714687625940b7/gr12_lrg.jpg gr12 gr12_lrg.jpg jpg 394971 1123 2917 IMAGE-HIGH-RES 1-s2.0-S2468823123007496-gr1_lrg.jpg https://s3-eu-west-1.amazonaws.com/prod-ucs-content-store-eu-west/content/pii:S2468823123007496/HIGHRES/image/jpeg/49ea10be437e3c4360c729105da14e81/gr1_lrg.jpg gr1 gr1_lrg.jpg jpg 837975 2700 3333 IMAGE-HIGH-RES 1-s2.0-S2468823123007496-gr2_lrg.jpg https://s3-eu-west-1.amazonaws.com/prod-ucs-content-store-eu-west/content/pii:S2468823123007496/HIGHRES/image/jpeg/9b90784fd68364f19915a9bc3b30aba4/gr2_lrg.jpg gr2 gr2_lrg.jpg jpg 324273 1178 1500 IMAGE-HIGH-RES 1-s2.0-S2468823123007496-gr5_lrg.jpg https://s3-eu-west-1.amazonaws.com/prod-ucs-content-store-eu-west/content/pii:S2468823123007496/HIGHRES/image/jpeg/8ccc9a314e1d49f87cfe201a89d3fe0d/gr5_lrg.jpg gr5 gr5_lrg.jpg jpg 957603 1338 3500 IMAGE-HIGH-RES 1-s2.0-S2468823123007496-gr6_lrg.jpg https://s3-eu-west-1.amazonaws.com/prod-ucs-content-store-eu-west/content/pii:S2468823123007496/HIGHRES/image/jpeg/5e8ce32496b4a23e7d9d216dc5dd07d2/gr6_lrg.jpg gr6 gr6_lrg.jpg jpg 791747 1922 3500 IMAGE-HIGH-RES 1-s2.0-S2468823123007496-gr3_lrg.jpg https://s3-eu-west-1.amazonaws.com/prod-ucs-content-store-eu-west/content/pii:S2468823123007496/HIGHRES/image/jpeg/a9af1d50e0926d16b81724c538a8d263/gr3_lrg.jpg gr3 gr3_lrg.jpg jpg 391088 855 1667 IMAGE-HIGH-RES 1-s2.0-S2468823123007496-gr8_lrg.jpg https://s3-eu-west-1.amazonaws.com/prod-ucs-content-store-eu-west/content/pii:S2468823123007496/HIGHRES/image/jpeg/0471a46236abd68373a2a5c726d771f5/gr8_lrg.jpg gr8 gr8_lrg.jpg jpg 358259 1295 2917 IMAGE-HIGH-RES 1-s2.0-S2468823123007496-gr10_lrg.jpg https://s3-eu-west-1.amazonaws.com/prod-ucs-content-store-eu-west/content/pii:S2468823123007496/HIGHRES/image/jpeg/baea86a7bbea538e830b88442a312f90/gr10_lrg.jpg gr10 gr10_lrg.jpg jpg 397373 1128 2917 IMAGE-HIGH-RES 1-s2.0-S2468823123007496-ga1_lrg.jpg https://s3-eu-west-1.amazonaws.com/prod-ucs-content-store-eu-west/content/pii:S2468823123007496/HIGHRES/image/jpeg/b3afcc3c2dbff68d78565440d3651dc7/ga1_lrg.jpg ga1 true ga1_lrg.jpg jpg 133143 886 1356 IMAGE-HIGH-RES 1-s2.0-S2468823123007496-gr13_lrg.jpg https://s3-eu-west-1.amazonaws.com/prod-ucs-content-store-eu-west/content/pii:S2468823123007496/HIGHRES/image/jpeg/b74fe2592915cf29fab2f6701bc96019/gr13_lrg.jpg gr13 gr13_lrg.jpg jpg 190788 1093 1667 IMAGE-HIGH-RES 1-s2.0-S2468823123007496-si1.svg https://s3-eu-west-1.amazonaws.com/prod-ucs-content-store-eu-west/content/pii:S2468823123007496/image/svg+xml/bd25347fbb6aec0c3dc60a09a83ca6b0/si1.svg si1 si1.svg svg 15610 ALTIMG 1-s2.0-S2468823123007496-si2.svg https://s3-eu-west-1.amazonaws.com/prod-ucs-content-store-eu-west/content/pii:S2468823123007496/image/svg+xml/eab9c35f3eaaab2b062e353f592b558c/si2.svg si2 si2.svg svg 19926 ALTIMG 1-s2.0-S2468823123007496-si3.svg https://s3-eu-west-1.amazonaws.com/prod-ucs-content-store-eu-west/content/pii:S2468823123007496/image/svg+xml/53c6821213a7b2d03189139abaef799a/si3.svg si3 si3.svg svg 11373 ALTIMG 1-s2.0-S2468823123007496-si4.svg https://s3-eu-west-1.amazonaws.com/prod-ucs-content-store-eu-west/content/pii:S2468823123007496/image/svg+xml/e7034ee74161f6c8a4c117436c7df940/si4.svg si4 si4.svg svg 13905 ALTIMG 1-s2.0-S2468823123007496-si5.svg https://s3-eu-west-1.amazonaws.com/prod-ucs-content-store-eu-west/content/pii:S2468823123007496/image/svg+xml/bafa3c46a5f0ad034e9da2cddc141d5b/si5.svg si5 si5.svg svg 10055 ALTIMG 1-s2.0-S2468823123007496-si6.svg https://s3-eu-west-1.amazonaws.com/prod-ucs-content-store-eu-west/content/pii:S2468823123007496/image/svg+xml/3b5e16b7bf5b59a574dbb388426fa411/si6.svg si6 si6.svg svg 7545 ALTIMG 1-s2.0-S2468823123007496-si7.svg https://s3-eu-west-1.amazonaws.com/prod-ucs-content-store-eu-west/content/pii:S2468823123007496/image/svg+xml/37f5b60dbbd9abbbe6fe8c120db950f3/si7.svg si7 si7.svg svg 7193 ALTIMG 1-s2.0-S2468823123007496-si8.svg https://s3-eu-west-1.amazonaws.com/prod-ucs-content-store-eu-west/content/pii:S2468823123007496/image/svg+xml/a894e5d8952d62107ce89bc94a96c337/si8.svg si8 si8.svg svg 4121 ALTIMG 1-s2.0-S2468823123007496-am.pdf am am.pdf pdf 3203938 AAM-PDF https://s3-eu-west-1.amazonaws.com/prod-ucs-content-store-eu-west/content/egi:10WCGM463L7/MAIN/application/pdf/6c802148d7a5e1975c90d2aa92d085b0/am.pdf MCAT 113666 113666 S2468-8231(23)00749-6 10.1016/j.mcat.2023.113666 Elsevier B.V. Fig. 1 Catalytic performance of the prepared samples (a) NO x conversion; (b) N2 selectivity; (c) Stability of W: Ce 0.05; (d) Resistance to H2O+SO2 of W: Ce 0.05 catalyst at 250 °C. Fig 1 Fig. 2 XRD patterns of prepared catalysts. Fig 2 Fig. 3 SEM images of catalysts (a): CePO4 (b): W: Ce 0.05. Fig 3 Fig. 4 EDS-mapping image of W: Ce 0.05 catalyst. Fig 4 Fig. 5 TEM images of (a-d) and HRTEM images of (e-h) catalysts (a, e) CePO4, (b, f) W: Ce 0.05, (c, g) W: Ce 0.1, (d, h) W: Ce 0.2. Fig 5 Fig. 6 N2 adsorption-desorption isotherms and pore-size distribution curves (a): CePO4 (b): W: Ce 0.01 (c): W: Ce 0.05 (d): W: Ce 0.1 (e): W: Ce 0.15 (f): W: Ce 0.2. Fig 6 Fig. 7 The H2-TPR results of the catalysts (a) H2-TPR profiles (b) H2 consumption. Fig 7 Fig. 8 The NH3-TPD results of the catalysts (a) NH3-TPD profiles (b) NH3 desorption. Fig 8 Fig. 9 XPS spectra of HPW/CePO4 catalysts with different W/Ce modifications (a): Ce 3d (b): O 1 s (c): P 2p (d): W 4f. Fig 9 Fig. 10 In situ DRIFTs spectra of (a) NH3 adsorption and (b) NO+O2 adsorption recorded at 300 °C over W: Ce 0.05. Fig 10 Fig. 11 In situ DRIFTs spectra of (a) NH3 adsorption and (b) NO+O2 adsorption recorded over W: Ce 0.05 at different temperatures. Fig 11 Fig. 12 In-situ DRIFTs spectra of (a) NO+O2 after pre-adsorption of NH3 and (b) NH3 after pre-adsorption of NO+O2 recorded at 300 °C over W: Ce 0.05. Fig 12 Fig. 13 Reaction mechanism of W: Ce 0.05 catalyst. Fig 13 Table 1 Cell parameters and grain size of catalysts. Table 1 sample Lattice parameters (Å) a Grain size (nm) b CePO4 7.4 11.2 W: Ce 0.01 7.2 9.8 W: Ce 0.05 6.9 10.7 W: Ce 0.1 7.1 10.3 W: Ce 0.15 6.1 9.3 W: Ce 0.2 7.4 10.6 a Lattice parameter obtained from the equations: 2dsinθ=n λ, a = d (h2 + k2 + l2) 1/2. b Grain size calculated by Scherrer's equation from the crystal plane (100) of CePO4. Table 2 Analysis of specific surface area of catalysts. Table 2 sample specific surface area (m2/g) pore volume (mL/g) Average pore size (nm) CePO4 91.5 0.29 13.8 W: Ce 0.01 71.3 0.24 12.2 W: Ce 0.05 77.2 0.21 12.2 W: Ce 0.1 69.4 0.18 11.9 W: Ce 0.15 63.7 0.19 10.6 W: Ce 0.2 56.4 0.21 10.1 Table 3 XPS data of catalysts. Table 3 sample Ce4+/(Ce3++Ce4+) (%) Oα/(Oα+Oβ+Oγ) (%) P2O5/(P2O5+PO3 −) (%) CePO4 8.8 41.3 48.1 W: Ce 0.01 10.5 47.5 61.4 W: Ce 0.05 17.9 49.9 69.9 W: Ce 0.1 15.5 48.1 64.8 W: Ce 0.15 13.8 47.1 62.3 W: Ce 0.2 12.5 45.5 59.7 Promotional effects of phosphotungstic acid on CePO4 catalyst for the selective catalytic reduction of NO x with NH3 Lantian Zhang Investigation Writing – original draft Data curation Writing – review & editing a Ran Zhao Conceptualization Writing – review & editing a b c ⁎ Hongxia Li Resources Investigation a Jinxiao Bao Formal analysis Supervision a Qingchun Wang Funding acquisition Validation a a School of Materials and Metallurgy, Inner Mongolia University of Science and Technology, Baotou, Inner Mongolia 014000, China School of Materials and Metallurgy Inner Mongolia University of Science and Technology Baotou Inner Mongolia 014000 China aSchool of Materials and Metallurgy, Inner Mongolia University of Science and Technology, Baotou, Inner Mongolia 014000, China b College of Environment and Energy, Inner Mongolia University of Science and Technology, Baotou, Inner Mongolia 014000, China College of Environment and Energy Inner Mongolia University of Science and Technology Baotou Inner Mongolia 014000 China bCollege of Environment and Energy, Inner Mongolia University of Science and Technology, Baotou, Inner Mongolia 014000, China c Inner Mongolia Autonomous Region Carbon Neutrality Collaborative Innovation Center, Inner Mongolia University of Science & Technology, Baotou 014010, China Inner Mongolia Autonomous Region Carbon Neutrality Collaborative Innovation Center Inner Mongolia University of Science & Technology Baotou 014010 China cInner Mongolia Autonomous Region Carbon Neutrality Collaborative Innovation Center, Inner Mongolia University of Science & Technology, Baotou 014010, China ⁎ Corresponding author at: School of Materials and Metallurgy, Inner Mongolia University of Science and Technology, Baotou, Inner Mongolia 014000, China. School of Materials and Metallurgy Inner Mongolia University of Science and Technology Baotou Inner Mongolia 014000 China CePO4 was prepared using the co-precipitation method. Recognizing the bifunctional nature of hetero-polyacid (salt), with both acidic and redox properties, it was modified by using phosphotungstic acid (HPW), and the HPW/CePO4 catalysts were synthesized using the impregnation technique. Various advanced techniques were employed to investigate aspects such as catalytic activity, microstructure, surface properties, and reaction mechanisms. These methods included NH3-SCR, XRD, XPS, SEM, BET, NH3-TPD, H2-TPR, and In-situ DRIFTs. Experimental findings indicated that the HPW-modified CePO4 catalysts exhibited enhanced SCR activity. Among them, the reaction activity window for NO x conversion of the W: Ce 0.05 catalyst was found to be 300∼400 °C, which represented the best activity temperature window. Following the incorporation of HPW, the HPW/CePO4 catalysts demonstrated an increased presence of Brønsted acidic sites, which concurrently led to a significant reduction in SO2 adsorption. The W: Ce 0.05 catalyst possessed the highest ratios of Oα/(Oα+Oβ+Oγ) and Ce4+/(Ce3++Ce4+). These ratios effectively regulated the sequestration and release of reactive oxygen species, thereby enhancing the activation of NH3. Consequently, this promoted the catalyst's low-temperature NH3-SCR reactivity. Lastly, the reaction process was examined using in-situ DRIFTs. The study revealed the generation of -NH2 intermediates at the Lewis acid sites of the W: Ce 0.05 catalyst. These intermediates subsequently underwent reactions with gaseous NO via the Eley-Rideal mechanism. This approach not only amplified the low-temperature catalytic efficacy of the catalysts but also bolstered their resilience to SO2, thereby fostering the long-term stability of the NH3-SCR reaction. Graphical abstract Image, graphical abstract Keywords CePo4 Phosphotungstic acid NH3-Scr In-situ DRIFTs Data availability Data will be made available on request. 1 Introduction As socioeconomic development progresses and human production activities expand, the increased consumption of coal, diesel, and gasoline results in elevated NO x emissions. These emissions are implicated in various environmental concerns, such as ozone layer depletion, acid rain, photochemical smog, the greenhouse effect, and haze [1–3]. These emissions not only hinder sustainable socioeconomic development but also pose a significant health threat to the populace. NO x can cause irreparable damage to the human respiratory system and impede the healthy development of children's lungs [4–6]. To mitigate NO x emissions, selective catalytic reduction (SCR) is the predominant approach employed for flue gas denitrification. Among the well-recognized SCR catalysts are those based on vanadium. However, they have notable disadvantages, including a requirement for high operating temperatures, limited activity at low temperatures, biotoxicity, and potential hazards to both environmental and human health [7,8]. Consequently, the advancement of novel and efficient NH3-SCR catalysts has emerged as a central focus in research. Recently, CePO4 catalysts have garnered attention due to their enhanced resistance to water and sulfur. Zeng et al. [9] employed the co-precipitation method to fabricate a series of CePO4, FePO4, and Fe x Ce1- x catalysts to investigate their catalytic performance in the NH3-SCR process. At 330 °C, the NO x conversion of both the CePO4 and Fe0.3Ce0.7 catalysts remained unaffected by the presence of H2O and SO2. Furthermore, both the CePO4 and the Fe x Ce1- x catalysts adhered to the E-R reaction mechanism during transient reactions. Liu et al. [10] employed the hydrothermal impregnation technique to synthesize MO x (M = Cu, Mn, Co) on CePO4 supports. The characterization results indicated that the carrier, namely CePO4, served as an acidic site, resulting in the generation of highly active NH4 + ions. These ions then interacted synergistically with MnO x , enhancing the NH3-SCR catalytic activity. Furthermore, the MO x /CePO4 catalyst demonstrated outstanding resistance to water. Zhao et al. [11] synthesized CePO4 catalysts with various crystalline phases. They discovered that the catalysts with a pure hexagonal phase of CePO4 showcased a greater abundance of Brønsted acidic sites, superior activity stability, and enhanced resistance to both water and sulfur compared to those with a pure monoclinic phase. Modification with hetero-polyacid enhances the acidic sites of the catalysts and the efficiency of NO x catalysis. Wu et al. [12] utilized H3PW12O40 (HPW) to modify Fe2O3 catalysts via the impregnation method. They examined the influence of HPW modification on the NH3-SCR catalytic performance of the catalysts. Following modification with HPW, there was a marked increase in the quantity of Brønsted and Lewis acid sites on the surface of the catalysts. This led to greater oxygen adsorption, enhancing NH3 adsorption. Consequently, the catalysts demonstrated outstanding resistance to SO2 and selectivity for N2. The HPW/Fe2O3–350–0.5 catalyst attained near-total NO x conversion within the temperature range of 240 to 460 °C. In-situ DRIFTs findings indicated that the NH3-SCR reaction on these catalysts predominantly followed the Eley-Rideal mechanism. Tang et al. [13] reported a mechanistic study on Mn-Ce-Co catalysts modified with HPW. The HPW-Mn-Ce-Co catalysts achieved a NO x conversion rate of up to 100 % within the temperature range of 100 to 250 °C. The incorporation of HPW enhanced the surface acidity of the catalysts and increased oxygen vacancies, leading to heightened redox capacity. Findings from in-situ DRIFTs suggested that the HPW-Mn-Ce-Co catalysts largely followed the Eley-Rideal mechanism. Weng et al. [14] modified a CeO2 catalyst using HPW. HPW can absorb NO2, inhibiting its further oxidation to nitrate. This process enriches the catalyst's surface with Brønsted acidic sites, significantly enhancing its catalytic performance for SCR. HPW served as a protective layer for CeO2, imparting the catalyst with robust SO2 resistance. In this study, a CePO4 catalyst was fabricated using the co-precipitation technique to improve its resistance to sulfur and water, as well as boost its NO x catalytic efficiency. Subsequently, this catalyst was modified using HPW acidification to produce HPW/CePO4 catalysts. A series of experiments were conducted to explore the enhancement mechanism of the HPW-modified catalysts. Catalytic performance tests revealed that HPW modification effectively increased the acidic sites and oxygen vacancies on the CePO4 catalyst, thereby boosting its NH3-SCR activity. Using in-situ DRIFTs, the key reactive oxygen and nitrate species were identified on the W: Ce 0.05 catalyst. Based on these findings, a plausible reaction mechanism for the W: Ce 0.05 catalyst in the NH3-SCR process was postulated. 2 Experimental 2.1 Catalyst preparation Ce (NO3)3·6H2O was dissolved in 200 mL of deionized water and subjected to stirring on a magnetic hotplate stirrer for 30 min, using the co-precipitation technique. A stoichiometric solution of phosphoric acid, maintaining a n Ce: n P ratio of 1, was subsequently introduced. The pH of the mixture was brought to 5 by the addition of ammonia. After this adjustment, the solution was subjected to intense stirring for an additional 2 h and subsequently permitted to age at ambient temperature for 24 h. Following the aging process, the mixture was isolated and subjected to four washes. The resultant solid was dried in an oven at 80 °C and subsequently calcined in a muffle furnace at 400 °C for a duration of 4 h, producing the CePO4 catalyst. HPW was dissolved in a suitable volume of deionized water at stoichiometric ratios (n W: n Ce of 0.01, 0.05, 0.1, 0.15, and 0.2) using the impregnation technique. CePO4 was subsequently added to this solution, and the mixture was subjected to stirring on a magnetic hotplate stirrer for 2 h, after which it was allowed to stand for 24 h. The catalysts were then dried in an oven at 105 °C for a duration of 12 h, followed by calcination in a muffle furnace at 500 °C for 5 h, yielding the HPW/CePO4 catalysts. The products thus obtained were designated as W: Ce (X), with X representing 0.01, 0.05, 0.1, 0.15, or 0.2. 2.2 Catalyst characterization An X-ray diffraction analyzer (XRD) was employed to characterize the lattice structure of the catalyst's physical phase. The instrument employed was an Axios type from Panalytical, Netherlands. The analyzer operated with a stepwise scanning method, a voltage and current of 40 kV and 40 mA were employed, respectively, along with a scanning speed of 3°/min and a 2θ scanning range from 10° to 80° The morphology of the catalyst was investigated using a Sigma-500 scanning electron microscope (SEM) manufactured by Zeiss, Germany. Additionally, an energy-dispersive spectrometer (EDS) was integrated with the SEM, employing characteristic X-ray wavelengths for both quantitative and qualitative analysis of the catalyst's elemental composition. Observations were conducted at magnifications ranging from 10 to 1,000kx. The catalyst's microscopic morphology and surface elemental composition were examined using a JEM-2100 (HR) transmission electron microscope (TEM) from Nihon Electronics Corporation. The specific surface area, pore volume, and pore size distribution of the catalyst were evaluated using a 3S-2000PS1 analyzer provided by Best Instruments Inc. The specific surface area of the catalyst was ascertained utilizing the BET equation, whereas its pore size and volume were determined based on the BJH method. The catalyst's redox properties were assessed using a PCA-1200 chemisorbentimeter from Beijing Piande Electronics Corporation, designed for H2-programmed temperature chemisorption. H2 consumption signals were recorded using a thermal conductivity detector (TCD). The strength and quantity of the catalyst surface acidic sites were analyzed using a PCA-1200 chemisorption instrument from Beijing Piande Company, designed for NH3-programmed temperature desorption. The effluent gas was detected using a Hiden QIC-200 mass spectrometer, and the NH3 desorption curve was captured via the TCD signal. An ESCALAB250ZI high-performance imaging X-ray photoelectron spectrometer (XPS) from Thermo Fisher, USA, was employed to analyze the valence and content of elements present on the catalyst surface. The binding energy of C 1 s, recorded at 284.8 eV, was used as the calibration reference for each element. An in-situ diffuse reflectance infrared spectrometer recorded real-time alterations in the surface species of the catalyst, contributing to insights into the mechanism of its catalytic reaction. The spectrometer employed was a VERTEX70 from Bruker, Germany, equipped with a PIKE DRIFT catalyst cell and a high-precision MCT detector that was cooled with liquid nitrogen. 2.3 Catalytic performance test In this study, the denitrification activity of the catalyst was assessed using an apparatus designed for NH3-SCR activity testing. This apparatus encompasses a gas distribution system, a temperature control system, and an exhaust gas analysis system. The simulated flue gas mixture consisted of 500 ppm NH3, 500 ppm NO, and 6 vol.% O2, with the remainder being N2. The total flow rate was 300 mL/min, and the gas hourly space velocity (GHSV) was 36,000 h−1. Experiment parameters were set via the thermostat. Subsequently, 0.2 g of the catalyst sample was measured and placed in a quartz glass tube, anchored at the bottom with quartz wool. Beginning at 100 °C and escalating at a rate of 10 °C/min, the NO concentration of the gas at the reactor's inlet and outlet was documented. Temperature observation points were established every 50 °C, continuing up to 500 °C. In the SCR activity test, the NO x conversion and N2 selectivity of the catalyst were determined using Eqs. (1) and (2), respectively: (1) N O x conversion % = ( [ N O x ] in − [ N O x ] out [ N O x ] in ) × 100 % (2) N 2 selectivity % = ( 1 − [ N O 2 ] out + 2 [ N 2 O ] out [ N O x ] in + [ N H 3 ] in − [ N O x ] out − [ N H 3 ] out ) × 100 % In the equation presented earlier, the terms [NO2]out, [N2O]out, and [NH3]out respectively signify the concentrations of NO2, N2O, and NH3 at the reactor's exit, quantified in ppm. In a parallel context, [NH3]in designates the concentration of NH3 at the reactor's entry, also expressed in ppm. It should be noted that the total [NO x ] is the summation of [NO] and [NO2]. 3 Results and discussion 3.1 Catalytic performance As depicted in Fig. 1 (a) and (b), the graphs display the NH3-SCR activity test data and N2 selectivity test results for the CePO4 catalyst and HPW/CePO4 catalysts with various W/Ce ratios for HPW treatment, respectively. As evident from Fig. 1(a), the NO x conversion of the CePO4 catalyst exhibited the poorest performance in the temperature range of 200∼500 °C, with the SCR activity being the best when the temperature reached 350 °C, and the NO x conversion was only 80.4 %. After modification with HPW, the CePO4 catalysts exhibited a significant enhancement in their catalytic activity. The activity window of the catalysts broadened, exhibiting improved catalytic performance within the temperature range of 250∼500 °C. The W: Ce 0.05 catalyst, in particular, demonstrated the widest activity temperature window and superior low-temperature activity, achieving a NO x conversion rate of 94.1 % within the temperature range of 300∼400 °C. At 350 °C, the NO x conversion rates were 84.2 % for W: Ce 0.01, 86.7 % for W: Ce 0.1, and 83.2 % for W: Ce 0.15. The W: Ce 0.2 catalyst showed suboptimal NH3-SCR activity. These results indicate that HPW modification enhanced the catalytic activity and expanded the operational temperature range. However, excessive HPW reduced high-temperature activity. Fig. 1(b) revealed that the HPW-treated catalysts demonstrated superior performance compared to the CePO4 catalysts. This indicates that HPW modification not only expanded the temperature range for SCR catalytic activity but also markedly enhanced N2 selectivity, a crucial factor for reducing the environmental impact of greenhouse gasses. In addition to the above studies, the activity stability and water and sulfur poisoning resistance of W: Ce 0.05 catalyst were further investigated, as depicted in Fig. 1(c) and (d), respectively. From Fig. 1(c), it was evident that the W: Ce 0.05 catalyst sustained a catalytic activity of approximately 94.1 % for 50 h at 300 °C. Moreover, during four-cycle tests with temperatures ranging from 210 °C to 340 °C, its NO x conversion remained consistent, underscoring the catalyst's robust activity stability. In Fig. 1(d), it was observed that introducing 5 vol% H2O led to a slight reduction in NO x conversion efficiency, dropping from an initial 85.4 % to approximately 82.6 % at 250 °C. Notably, once water exposure ceased, its performance promptly returned to baseline within an hour. Furthermore, when exposed to 100 ppm SO2, NO x conversion modestly declined to around 82.1 %. Remarkably, after discontinuing SO2 exposure, efficiency swiftly rebounded, reaching nearly 85.1 % within an hour. In a combined environment of 5 vol% H2O and 100 ppm SO2, the W: Ce 0.05 catalyst experienced a gradual dip in its NO x conversion but consistently maintained a level above 80.6 %. These results underscore the remarkable robustness and resilience of the W: Ce 0.05 catalyst, even when facing potentially detrimental factors such as H2O and SO2. 3.2 Catalyst characterization 3.2.1 Structural characteristics XRD Fig. 2 displays the XRD spectra of both CePO4 and HPW/CePO4 catalysts. This aimed to explore the alterations in the crystalline phases of the catalysts’ surface materials due to HPW modification. All samples exhibited distinct characteristic peaks at 2θ values of 14.5°, 20.0°, 25.2°, 29.2°, 31.4°, 37.8°, 42.1°, 46.7°, and 48.5°, corresponding to the (100), (101), (110), (200), (102), (112), (211), (301), and (212) crystal planes, respectively. The CePO4 matched the standard spectrum for the hexagonal crystal system (PDF 34–1380) [15]. No diffraction peaks attributable to HPW were evident in the HPW/CePO4 catalysts, suggesting a high degree of HPW dispersion on the catalysts’ surface [16]. Using Scherrer's formula, the average cell parameters and grain sizes of the (100) crystalline surfaces for the various samples were calculated, as detailed in Table 1 . The lattice parameter for CePO4 was found to be 7.4 Å, while the lattice parameters of HPW/CePO4 catalysts with different W/Ce ratios were smaller than those of the CePO4 catalyst. The grain size for CePO4 was measured at 11.2 nm, in contrast to 9.8 nm for W: Ce 0.01, 10.7 nm for W: Ce 0.05, 10.3 nm for W: Ce 0.1, 9.3 nm for W: Ce 0.15, and 10.6 nm for W: Ce 0.2 catalysts. Compared to the pristine CePO4 catalyst, the HPW/CePO4 composites demonstrated notably finer grain structures. This enhanced microstructural refinement, a direct consequence of incorporating HPW, corroborated previous studies [17] highlighting its role in curbing undue grain enlargement and inducing crystallographic alterations in the catalysts’ matrix. 3.2.2 Surface morphology analysis Fig. 3 displayed the microzone SEM patterns of the CePO4 and W: Ce 0.05 catalysts. In Fig. 3(a), the CePO4 catalyst was shown to possess a large, spherical granular structure with an uneven surface morphology, resembling a honeycomb pattern. Fig. 3(b) showcased the catalyst after HPW loading. While it still consisted of agglomerated large spheres, there was evident shedding from these larger particles, resulting in the formation of finer particles. Notable acid erosion traces were present on the surface. The introduction of HPW led to a looser, more porous structure [18], giving the surface a fluffy appearance and revealing more surface defects. These defects offered ample reaction sites for catalytic experiments, potentially enhancing the catalyst's denitrification efficiency. Fig. 4 displayed the EDS-Mapping pattern of the W: Ce 0.05 catalyst, illustrating the distribution of elements on its surface. The elements Ce, P, and O, constituting the catalyst, were present in high concentrations and were uniformly distributed throughout. Similarly, the element W exhibited a uniform distribution, suggesting that HPW was well-dispersed across the W: Ce 0.05 catalyst's surface [19]. This observation aligned with the XRD findings. The introduction of HPW altered the surface properties of the catalyst, thereby enhancing its activity. 3.2.3 Microscopic morphology analysis Fig. 5 displays the TEM images (a-d) and HRTEM images (e-h) of the catalysts. In Fig. 5(a), CePO4 was shown to possess a nanorod-like structure, consistent with observations from the SEM morphology. From Fig. 5(b-d), the W: Ce 0.05, W: Ce 0.1, and W: Ce 0.2 catalysts maintained their nanorod-like structures. However, these structures appeared more fibrous and extended, potentially accounting for the heightened catalytic activity observed in the HPW-modified catalysts [20]. From Fig. 5(e–h), the lattice fringe spacings for the CePO4, W: Ce 0.05, W: Ce 0.1, and W: Ce 0.2 catalysts were measured as 0.6172 nm, 0.6135 nm, 0.6126 nm, and 0.6153 nm, respectively. These values correspond to the hexagonal crystalline system of the cerium (100) phosphate crystal planes, aligning with the XRD data (PDF 34–1380). Additionally, the lattice spacings of the W: Ce 0.05, W: Ce 0.1, and W: Ce 0.2 catalysts were smaller than that of the CePO4 catalyst. This observation was likely due to the effects of the HPW treatment, including thermal impacts, leading to alterations in the crystal structures and consequently, a reduction in lattice spacing. Post-HPW treatment, the respective peak positions in the XRD patterns shifted to higher angles, mirroring the lattice spacing decrease. This alignment was further corroborated by experimental data. 3.2.4 Specific surface area and pore size analysis Fig. 6 presents the N2 adsorption and desorption isotherms of the CePO4 and HPW/CePO4 catalysts, accompanied by their respective BJH pore distribution curves. As classified by the International Union of Pure and Applied Chemistry (IUPAC), all six catalysts displayed characteristic type IV isotherms with H3 hysteresis loops [21]. From Fig. 6(a), it was evident that the CePO4 catalyst exhibited increased nitrogen adsorption at relative pressures above 0.9, suggesting the existence of mesoporous and macroporous structures on its surface. Figs. 6(b–f) demonstrated that the HPW-treated catalysts (W: Ce 0.01, W: Ce 0.05, W: Ce 0.1, W: Ce 0.15, and W: Ce 0.2) all exhibited pronounced hysteresis and heightened volumetric nitrogen adsorption, akin to that observed in the CePO4 catalyst. This suggests that the meso‑ and macroporous structures remained intact even after HPW modification [22]. The inset of Fig. 6 presented the BJH pore size distribution curve, indicating that the CePO4 catalyst predominantly featured macropores. In contrast, the HPW/CePO4 catalysts exhibited a significant increase in mesopores quantities. Table 2 presents the specific surface area, pore volume, and average pore size metrics of CePO4 and its variants modified with HPW. Notably, the unadulterated CePO4 catalyst stood out with a remarkable specific surface area of 91.5 m2/g. In contrast, the catalyst variants W: Ce 0.01 through W: Ce 0.2 consistently showed a decrease in their specific surface areas. Furthermore, the dataset highlighted the pore volume and average pore size of the pristine CePO4 catalyst, measured at 0.29 mL/g and 13.8 nm, respectively. Intriguingly, after HPW incorporation, a consistent decline in both pore volume and average pore size was discernible across all modified catalysts’ variants. Generally, enhancements in both specific surface area and pore volume are positively correlated with catalytic efficacy [23]. However, despite demonstrating superior catalytic activity, the W: Ce 0.05 catalyst possessed a specific surface area that was smaller than that of the unmodified CePO4 catalyst. This could be potentially explained by HPW's characteristic as a “pseudo-liquid phase” [24,25]. Upon gas absorption, heteropolymeric compounds in HPW transformed into a structure reminiscent of a concentrated solution. Consequently, the catalytic reaction might occur not only on the surface but also within the interior of the acid. The data indicated that the specific surface area of the W: Ce 0.05 catalyst was not the critical factor influencing the NH3-SCR catalytic process. 3.3 H2-TPR results Fig. 7 (a) and (b) show the redox characteristics and H2 consumption of the CePO4 catalyst and HPW/CePO4 catalysts with different W/Ce ratios, respectively. As can be seen from Fig. 7(a), the CePO4 catalyst displayed almost no reduction peak, indicating its high structural stability. This also implied that Ce3+ ions were resistant to reduction [26]. Following the modifications with HPW, there were notable alterations in the reduction behavior of the CePO4 catalysts. From the figure, it was observed that for all HPW-treated catalysts, a reduction peak emerges between 500 and 600 °C. Given that HPW undergoes decomposition to form WO3 at 572 °C, this observed reduction peak was attributed to the reduction of W6+ to W4+ [12]. Fig. 7(b) delineated the redox prowess of the four distinct catalysts, as evidenced by the variations in their H2 consumption rates. The sequence of their redox capabilities was delineated as follows: W: Ce 0.05 outperformed W: Ce 0.15, which in turn surpassed W: Ce 0.01, followed by W: Ce 0.2, with W: Ce 0.1 exhibiting the least activity. The improved redox capacity resulted in a marked enhancement of the NH3-SCR reaction, leading to a substantial increase in NO x conversion as well as an optimized activity temperature range. Furthermore, after the incorporation of HPW, all catalysts exhibited superior SCR activity compared to that exhibited by the CePO4 catalyst. This indicated that the SCR activity was not solely reliant on its redox properties, but was also closely associated with both the abundance and strength of its acidity. 3.4 NH3-TPD results Fig. 8 (a) and (b) illustrate the surface acidity distribution and NH3 desorption of the CePO4 catalyst and HPW/CePO4 catalysts with different W/Ce ratios, respectively. Desorption occurring within the temperature range of 25 to 200 °C is typically categorized as low-temperature desorption and is attributed to the presence of Brønsted weak acid centers [27]. Meanwhile, desorption detected between 200 and 450 °C is categorized as medium-temperature desorption and is associated with both medium Brønsted and Lewis acid centers [28]. Desorption taking place at temperatures above 450 °C is typically classified as high-temperature desorption and is attributed to the presence of Lewis strong acid centers [29]. As can be seen from Fig. 8(a), the CePO4 catalyst demonstrated a distinct NH3 desorption peak in the temperature range of 100 to 300 °C. This phenomenon was ascribed to the desorption of NH3 from the P-site on the surface of the CePO4 catalyst [30]. Following the incorporation of HPW, a pronounced initial NH3 desorption peak was observed for the HPW/CePO4 catalysts, centered approximately at 190 °C. These desorption phenomena could be ascribed to the liberation of NH3 from the Brønsted weak acidic centers. Upon the incorporation of HPW, the W6+ species within HPW engaged in a dynamic electronic interplay with the Ce ions inherent to CePO4. This intricate interaction resulted in the formation of novel acidic sites. Notably, HPW acted as a reservoir of Brønsted acidic moieties, whereas the Ce entities in CePO4, through their liaison with W6+, morphed into Lewis acidic epicenters. This harmonious synergy amplified the catalysts’ intrinsic acidity, giving rise to discernible desorption peaks proximate to 350 °C. Therefore, the desorption peaks that appeared at around 350 °C could be attributed to the synergistic interaction of moderate-intensity Brønsted and Lewis acidic sites. As can be seen from Fig. 8(b), the CePO4 catalyst only had weak acids. Upon the inclusion of HPW, there was a notable emergence of medium acid sites across the catalysts. The integration of HPW into the CePO4 framework not only augmented its inherent weak acid potential but also introduced a pronounced medium acid characteristic to the composite. Based on the data provided, introducing an optimal amount of HPW to the CePO4 catalyst enhanced its medium-strong acidic sites. Enhanced medium-strong acidic sites played a crucial role in boosting the denitrification efficiency of selective catalytic reduction SCR catalysts. 3.5 Surface element valence analysis Fig. 9 depicts the X-ray photoelectron spectroscopy (XPS) profiles for the Ce 3d, O 1 s, P 2p, and W 4f elements in HPW/CePO4 catalysts with varying W/Ce ratios. As illustrated in Fig. 9(a), the split-peak fitting for the Ce 3d orbitals revealed peaks at V1 (881.7 eV), V2 (882.6 eV), V3 (886.8 eV), V4 (900.1 eV), V5 (901.3 eV), V6 (901.7 eV), V7 (907.7 eV), and V8 (914.7 eV), which are characteristic of Ce4+. The peaks at U1 (885.4 eV) and U2 (904.3 eV) were associated with the characteristic peaks of Ce3+ [9]. The proportion of Ce4+ was determined by calculating the peak area, and the findings are presented in Table 3 . Upon the incorporation of HPW into the CePO4 catalyst matrix, electronic interplay emerged between the introduced W6+ species from HPW and the cerium ions. This synergistic interaction culminated in an accentuated presence of surface Ce4+. Intriguingly, when the W/Ce molar ratio attained 0.05, the HPW/CePO4 catalyst manifested an apex in its Ce4+ content, reaching an impressive 17.9 %. The concurrent existence of Ce3+ and Ce4+ on the catalysts’ surface facilitated the dynamic capture and liberation of reactive oxygen species. This molecular ballet significantly augmented the catalysts’ efficacy in the NH3-SCR reactions. Fig. 9(b) illustrates the analysis of surface oxygen on the catalyst, as conducted by X-ray photoelectron spectroscopy (XPS). The O 1 s spectrum could be decomposed into three distinct peaks: one spanning from 530.5 to 530.9 eV, associated with lattice oxygen (Oβ) in metal oxides; a second peak from 531.1 to 531.6 eV, attributed to surface-adsorbed oxygen (Oα); and a third peak in the range of 532.6 to 532.9 eV, corresponding to hydroxyl oxygen in water molecules (Oγ) [31]. The relative content of Oα was determined by calculating the peak area, and the findings are presented in Table 3. The amount of chemisorbed oxygen on the HPW/CePO4 catalysts’ surface increased after HPW was added. At a W/Ce ratio of 0.05, the proportion of Oα/(Oα+Oβ+Oγ) reached its peak at 49.9 %. A high Oα/(Oα+Oβ+Oγ) ratio promoted NO oxidation, contributing to the “fast SCR reaction” [32] and improving the catalysts’ denitrification efficiency. As shown in Fig. 9(c), the P 2p spectrum of the catalyst featured two prominent peaks: one at about 133.8 eV, attributed to P2O5, and another at approximately 132.9 eV, linked to PO3 − [33]. Using the calculated peak areas, the relative contents of PO3 − and P2O5 were determined. As delineated in Table 3, upon employing the HPW/CePO4 catalysts with a W/Ce molar ratio of 0.05, the fraction of P2O5 relative to the combined presence of P2O5 and PO3 − reached an apex of 69.9 %. This indicated that the inclusion of HPW encouraged the development of P2O5 on the catalysts’ surface, which in turn boosted the catalysts’ NH3-SCR denitrification efficiency [34]. Fig. 9(d) displayed the XPS spectrum of W 4f, revealing two peaks with characteristic binding energies at 35.9 and 37.8 eV, corresponding to W 4f7/2 and W 4f5/2, respectively [35]. The binding energy difference of 1.9 eV between these peaks suggested that the W species on the catalysts’ surface predominantly existed as W6+. Interactions between W6+ and Ce3+ played a role in enhancing the catalytic performance of the catalysts [36]. 3.6 In-situ DRIFTs studies 3.6.1 Adsorption of NH3/NO+O2 on the catalyst surface Fig. 10 (a) presents the NH3 adsorption spectra of the W: Ce 0.05 catalyst over various time intervals. Upon introducing NH3, prominent peaks emerged at 1303, 1347, 1360, 3519, 3529, and 3626 cm−1. Up to 50 min after introducing NH3, the intensity of these peaks did not diminish or vanish, and no new peaks emerged. The peaks at 1303 and 1347 cm−1 were attributed to the chemisorption of NH3 on Lewis acid sites through co-adsorption [37]. The peak at 1360 cm−1 was ascribed to the asymmetric bending vibration of NH4 + on the Brønsted acid site [38]. Furthermore, in the 3400 to 3600 cm−1 range, two peaks appeared at 3519 and 3529 cm−1. Both peaks were ascribed to the NH stretching vibration of NH3 adsorption [39], suggesting NH3 dissociation on the catalyst surface. A hydroxyl group appeared at 3626 cm−1 [40]. In-situ DRIFTs results for NH3 adsorption revealed that NH3 molecules could stably chemisorb onto both Lewis and Brønsted acid sites of the W: Ce 0.05 catalyst. In particular, NH3 interacted with Lewis acid sites, whereas Brønsted acid sites resulted in the formation of NH4 +. Both ionic NH4 + and ligand NH3 were known to play crucial roles in the NH3-SCR reaction. Additionally, the coexistence of both L and B acid sites on the catalyst was observed, a result that aligned with findings from NH3-TPD. Fig. 10(b) displays the in-situ DRIFTs spectra of NO+O2 co-adsorbed on the surface of the W: Ce 0.05 catalyst over different adsorption periods. Co-adsorption of NO+O2 on the W: Ce 0.05 catalyst yielded adsorption peaks at four distinct locations. Peaks at 1292 and 3529 cm−1 were attributed to monodentate nitrate species [41], while the peak at 1306 cm−1 was associated with bidentate nitrate species [42]. Additionally, the peak at 1357 cm−1 corresponded to free-state NO3 − [43]. As the adsorption time lengthened, the intensity of the peak at 1306 cm−1, representing bidentate nitrate species, increased, while the intensity of the peak at 1292 cm−1, corresponding to monodentate nitrate species, decreased. Although the peak intensity at 1292 cm−1 relatively decreased, the intensity of the monodentate nitrate remained higher than that of the bidentate nitrate. Additionally, the intensities of other peaks remained relatively stable after 5 min. Based on these observations, it was inferred that NO2 was generated during the co-adsorption of NO+O2 on the HPW-treated W: Ce 0.05 catalyst. This implied that NO was oxidized to NO2 on the surface of the catalyst, enabling either gaseous or weakly adsorbed NO2 to participate in the NH3-SCR reaction. On the catalyst surface, various nitrates could form, among which monodentate nitrate and NO2 were particularly active in the SCR reaction. The formation of these species undoubtedly boosted the NH3-SCR catalytic performance of the W: Ce 0.05 catalyst. 3.6.2 Thermal stability of NH3/NO+O2 on the catalyst surface Fig. 11 (a) presents the in-situ DRIFTs spectra of NH3 adsorption on the W: Ce 0.05 catalyst surface over a range of temperatures. On the W: Ce 0.05 catalyst, two distinct peaks were observed. The broader peak at 3541 cm−1 was ascribed to the NH4 + species formed on the Brønsted acid site [44]. The more prominent peak at 1622 cm−1 was associated with asymmetric and symmetric bending vibrations of the NH bond, indicating NH3 coordination with the Lewis acid site [45]. From the figure, it was evident that the intensities of the peaks at 1622 and 3541 cm−1 decreased with increasing temperature. At 250 °C, the peak at 3541 cm−1 disappeared, while the peak at 1622 cm−1 remained visible, suggesting the continued presence of NH3 at the Lewis acid site. These results indicated that the adsorption energy of NH3 on Lewis acid sites was substantially greater than that on Brønsted acid sites. Fig. 11(b) presents the in-situ DRIFTs spectra of NO+O2 adsorption on the W: Ce 0.05 catalyst surface over a range of temperatures. Adsorption peaks for NO were observed at 1566, 1620, and 3540 cm−1. The peak at 1566 cm−1 corresponded to the characteristic of monodentate nitrate [46]. The peak at 1620 cm−1 was associated with the characteristic peak of cis-N2O2 adsorbed on Ce in the W: Ce 0.05 catalyst [47]. Finally, the peak at 3540 cm−1 represented the characteristic bidentate nitrate [48]. With increasing temperature, all peaks diminished gradually. By 250 °C, the characteristic peaks of both monodentate nitrate at 1566 cm−1 and bidentate nitrate at 3540 cm−1 had disappeared. However, the characteristic peak of cis-N2O2 at 1620 cm−1 remained. These findings demonstrated that cis-N2O2 species are highly stable, remaining undisturbed below 300 °C. An increased presence of NO x species on the W: Ce 0.05 catalyst surface enhanced their involvement in the NH3-SCR reaction, thus boosting the catalytic activity. 3.6.3 Transient DRIFT reaction Fig. 12 (a) presents the in-situ DRIFTs spectra for the NO+O2 reaction on the W: Ce 0.05 catalyst with pre-adsorbed NH3 species. After purging with NH3 for 50 min, peaks corresponding to both the Lewis and Brønsted acid sites predominated in the spectrum. Specifically, NH4 + was associated with the Brønsted acid site, as evidenced by peaks at 1299 and 1361 cm−1 [49], while NH2 corresponded to the Lewis acid site with a peak at 1347 cm−1 [50]. After introducing NO+O2, the adsorption peaks for NH4 + at the Brønsted site of the W: Ce 0.05 catalyst, found at 1299 and 1361 cm−1, disappeared. The peak corresponding to NH2 at the Lewis acid site, observed at 1347 cm−1, diminished. At the same time, several new peaks appeared, associated with the presence of monodentate nitrate (3519 cm−1), bidentate nitrite (1306 cm−1), bridged nitrate (1354 cm−1), and free-state NO3 − (3626 cm−1) [51]. This observation implied a swift reaction between pre-adsorbed NH3 and gaseous NO+O2. The appearance of nitrate species further suggests complete consumption of the pre-adsorbed NH3. Moreover, the involvement of NH2 from the Lewis acid site in the NH3-SCR reaction aligned with the E-R mechanism. Fig. 12(b) presents the in-situ DRIFTs spectra elucidating the reaction of NH3 on the W: Ce 0.05 catalyst following pre-adsorption of NO+O2. Upon inspecting the spectrum for the W: Ce 0.05 catalyst that had undergone NO+O2 pre-treatment, distinctive peaks corresponding to adsorbed NO2 were evident at 1306 cm−1 and 1363 cm−1, while monodentate nitrate manifested at 1296 cm−1, and the free nitrate ion resonated at 3624 cm−1 [52,53]. After the introduction of gaseous NH3, there was a notable diminution in the intensity of the NO2 adsorption peak at 1306 cm−1. Concurrently, pronounced NH3 adsorption peaks emerged at 1354 cm−1 and 3529 cm−1. These spectral observations substantiated that the adsorbed nitrates did not engage in reactions with either gaseous NH3 or the adsorbed NH3 species. Such findings lend credence to the hypothesis that the NH3-SCR reaction on the W: Ce 0.05 catalyst is predominantly governed by the E-R mechanism. Based on the analysis provided, we examine the reaction mechanism over the W: Ce 0.05 catalyst. Fig. 13 illustrates the influence of the reaction pathway. The intermediates observed during the transient reaction suggest that the NH3-SCR reaction on the catalyst surface follows the E-R mechanism. The corresponding reaction equations are as follows: (3) N H 3 ( g ) → N H 3 ( ad ) ( Lewis ) (4) N H 3 ( g ) → NH 4 ( ad ) + ( Br ø nsted ) (5) N H 3 ( ad ) + C e 4 + = O → N H 2 + C e 3 + − OH (6) C e 3 + − OH + 1 / 4 O 2 → C e 4 + = O + 1 / 2 H 2 O (7) NH 4 ( ad ) + → − N H 2 + 2 H + + e − (8) − N H 2 + NO → N H 2 NO → N 2 + H 2 O 4 Conclusion In this study, we prepared a CePO4 catalyst using the co-precipitation technique, aiming to develop a low-temperature denitrification catalyst through the addition of HPW. Activity tests revealed that the NO x conversion rate of the CePO4 catalyst was constrained between 200 °C and 500 °C. However, the reaction activity saw a notable enhancement after introducing HPW. The most effective W: Ce 0.05 catalyst achieved a 61.5 % NO x conversion at 200 °C and an impressive 94.1 % NO x conversion between 300 °C and 400 °C. Among all tested catalysts, the W: Ce 0.05 catalyst exhibited the best performance. SEM and TEM analyses revealed that the HPW/CePO4 catalysts possess a rod-like structure. XRD results further revealed that HPW is finely dispersed on the catalysts’ surface. NH3-TPD analysis showed that the integration of HPW into the CePO4 framework not only augments its inherent weak acid potential but also introduces a pronounced medium acid characteristic to the composite. Based on the findings from the H2-TPR analysis, it is evident that the reduction of W plays a pivotal role in augmenting the adsorption and subsequent activation of NH3. XPS analysis revealed that the W: Ce 0.05 catalyst displayed the highest ratios of Oα/(Oα+Oβ+Oγ) and Ce4+/(Ce3++Ce4+). The increase in Ce4+ content favored the formation of redox pairs of Ce3+/Ce4+, contributing to the catalyst's exceptional NH3-SCR catalytic activity. An in-situ DRIFTs study of the W: Ce 0.05 catalyst revealed that the reduction of NH4 + species on Brønsted acid sites enhances NH3-SCR activity. This reduction also promotes the formation of -NH2 intermediates, which react with gas-phase NO through the E-R mechanism. All the above-mentioned characteristics play a positive role in enhancing the anti-SO2 performance of HPW-modified CePO4 catalysts. Moreover, these insights provided a foundation for the further development of CePO4-based catalysts. CRediT authorship contribution statement Lantian Zhang: Investigation, Writing – original draft, Data curation, Writing – review & editing. Ran Zhao: Conceptualization, Writing – review & editing. Hongxia Li: Resources, Investigation. Jinxiao Bao: Formal analysis, Supervision. Qingchun Wang: Funding acquisition, Validation. Declaration of Competing Interest We declare that we have no conflict of interest. Acknowledgments This study was financially supported by 2022 basic scientific research funds for universities directly under the Inner Mongolia Autonomous Region; 2023 basic scientific research funds for universities directly under the Inner Mongolia Autonomous Region (2023QNJS009); National Natural Science Foundation of China (52362035); and Inner Mongolia Natural Science Foundation (2021MS02022). References [1] Y. Zhou S. Ren M. Wang J. Yang Z. Chen L. Chen Mn and Fe oxides co-effect on nanopolyhedron CeO2 catalyst for NH3-SCR of NO J. Energy Inst. 99 2021 97 104 Y. Zhou, S. Ren, M. Wang, J. Yang, Z. Chen, L. Chen, Mn and Fe oxides co-effect on nanopolyhedron CeO2 catalyst for NH3-SCR of NO, J. Energy Inst.. 99 (2021) 97–104. [2] Z. Chen S. Ren Y. Zhou X. Li M. Wang L. Chen Comparison of Mn doped CeO2 with different exposed facets for NH3-SCR at low temperature J. Energy Inst. 105 2022 114 120 Z. Chen, S. Ren, Y. Zhou, X. Li, M. Wang, L. Chen, Comparison of Mn doped CeO2 with different exposed facets for NH3-SCR at low temperature, J. Energy Inst.. 105 (2022) 114–120. [3] X. Li S. Ren L. Liu X. Xing L. Chen J. Li J. Yang Q. Liu Superior PbO-resistance of CeO2/ZrO2 catalyst promoted by solid superacid SO4 2−/ZrO2 for selective catalytic reduction of NOx with NH3 Fuel 332 2023 126103 X. Li, S. Ren, L. Liu, X. Xing, L. Chen, J. Li, J. Yang, Q. Liu, Superior PbO-resistance of CeO2/ZrO2 catalyst promoted by solid superacid SO42−/ZrO2 for selective catalytic reduction of NOx with NH3, Fuel. 332 (2023) 126103. [4] J. Li H. Chang L. Ma J. Hao R.T. Yang Low-temperature selective catalytic reduction of NOx with NH3 over metal oxide and zeolite catalysts—a review Catal. Today 175 2011 147 156 J. Li, H. Chang, L. Ma, J. Hao, R.T. Yang, Low-temperature selective catalytic reduction of NOx with NH3 over metal oxide and zeolite catalysts—a review, Catal. Today. 175 (2011) 147–156. [5] C. Tang H. Zhang L. Dong Ceria-based catalysts for low-temperature selective catalytic reduction of NO with NH3 Catal. Sci. Technol. 6 2016 1248 1264 C. Tang, H. Zhang, L. Dong, Ceria-based catalysts for low-temperature selective catalytic reduction of NO with NH3, Catal. Sci. Technol.. 6 (2016) 1248–1264. [6] L. Li L. Zhang K. Ma W. Zou Y. Cao Y. Xiong C. Tang L. Dong Ultra-low loading of copper modified TiO2/CeO2 catalysts for low-temperature selective catalytic reduction of NO by NH3 Appl. Catal. B 207 2017 366 375 L. Li, L. Zhang, K. Ma, W. Zou, Y. Cao, Y. Xiong, C. Tang, L. Dong, Ultra-low loading of copper modified TiO2/CeO2 catalysts for low-temperature selective catalytic reduction of NO by NH3, Appl. Catal. B. 207 (2017) 366–375. [7] X.Z. Shao H.Y. Wang M.L. Yuan J. Yang W.C. Zhan L. Wang Y. Guo G.Z. Lu Thermal stability of Si-doped V2O5/WO3–TiO2 for selective catalytic reduction of NOx by NH3 Rare Met. 38 2019 292 298 X.Z. Shao, H.Y. Wang, M.L. Yuan, J. Yang, W.C. Zhan, L. Wang, Y. Guo, G.Z. Lu, Thermal stability of Si-doped V2O5/WO3–TiO2 for selective catalytic reduction of NOx by NH3, Rare Met.. 38 (2019) 292–298. [8] W. Cha H.A. Le S. Chin M. Kim H. Jung S.T. Yun J. Jurng Enhanced low-temperature NH3-SCR activity of a V2O5/TiO2 composite prepared via chemical vapor condensation and impregnation method Mater. Res. Bull. 48 2013 4415 4418 W. Cha, H.A. Le, S. Chin, M. Kim, H. Jung, S.T. Yun, J. Jurng, Enhanced low-temperature NH3-SCR activity of a V2O5/TiO2 composite prepared via chemical vapor condensation and impregnation method, Mater. Res. Bull.. 48 (2013) 4415–4418. [9] Y. Zeng W. Song Y. Wang S. Zhang T. Wang Q. Zhong Novel Fe-doped CePO4 catalyst for selective catalytic reduction of NO with NH3: the role of Fe3+ ions J. Hazard. Mater. 383 2020 121212 Y. Zeng, W. Song, Y. Wang, S. Zhang, T. Wang, Q. Zhong, Novel Fe-doped CePO4 catalyst for selective catalytic reduction of NO with NH3: the role of Fe3+ ions, J. Hazard. Mater.. 383 (2020) 121212. [10] C. Liu F. Li J. Wu X. Hou W. Huang Y. Zhang X. Yang A comparative study of MOx (M= Mn, Co and Cu) modifications over CePO4 catalysts for selective catalytic reduction of NO with NH3 J. Hazard. Mater. 363 2019 439 446 C. Liu, F. Li, J. Wu, X. Hou, W. Huang, Y. Zhang, X. Yang, A comparative study of MOx (M= Mn, Co and Cu) modifications over CePO4 catalysts for selective catalytic reduction of NO with NH3, J. Hazard. Mater.. 363 (2019) 439–446. [11] C. Zhao Y. Li Z. Zhang H. Tan F. Yuan Y. Zhu Influence of CePO4 with different crystalline phase on selective catalytic reduction of NOx with ammonia J. Rare Earths 40 2022 1219 1231 C. Zhao, Y. Li, Z. Zhang, H. Tan, F. Yuan, Y. Zhu, Influence of CePO4 with different crystalline phase on selective catalytic reduction of NOx with ammonia, J. Rare Earths. 40 (2022) 1219–1231. [12] J. Wu S. Jin X. Wei F. Gu Q. Han Y. Lan C. Qian J. Li X. Wang R. Zhang others Enhanced sulfur resistance of H3PW12O40-modified Fe2O3 catalyst for NH3-SCR: synergistic effect of surface acidity and oxidation ability Chem. Eng. J. 412 2021 128712 J. Wu, S. Jin, X. Wei, F. Gu, Q. Han, Y. Lan, C. Qian, J. Li, X. Wang, R. Zhang, others, Enhanced sulfur resistance of H3PW12O40-modified Fe2O3 catalyst for NH3-SCR: synergistic effect of surface acidity and oxidation ability, Chem. Eng. J.. 412 (2021) 128712. [13] X. Tang C. Wang F. Gao R. Zhang Y. Shi H. Yi Acid modification enhances selective catalytic reduction activity and sulfur dioxide resistance of manganese-cerium-cobalt catalysts: insight into the role of phosphotungstic acid J. Colloid Interface Sci. 603 2021 291 306 X. Tang, C. Wang, F. Gao, R. Zhang, Y. Shi, H. Yi, Acid modification enhances selective catalytic reduction activity and sulfur dioxide resistance of manganese-cerium-cobalt catalysts: insight into the role of phosphotungstic acid, J. Colloid Interface Sci.. 603 (2021) 291–306. [14] X. Weng X. Dai Q. Zeng Y. Liu Z. Wu DRIFT studies on promotion mechanism of H3PW12O40 in selective catalytic reduction of NO with NH3 J. Colloid Interface Sci. 461 2016 9 14 X. Weng, X. Dai, Q. Zeng, Y. Liu, Z. Wu, DRIFT studies on promotion mechanism of H3PW12O40 in selective catalytic reduction of NO with NH3, J. Colloid Interface Sci.. 461 (2016) 9–14. [15] K. Hui W. Dong J. Fu M. Tang Q. Wei C. Li H. Zhang Dual-enhancement of chromaticity and thermal stability: in-situ synthesis of core–shell γ-Ce2S3@ CePO4 configuration J. Rare Earths 40 2022 800 806 K. Hui, W. Dong, J. Fu, M. Tang, Q. Wei, C. Li, H. Zhang, Dual-enhancement of chromaticity and thermal stability: in-situ synthesis of core–shell γ-Ce2S3@ CePO4 configuration, J. Rare Earths. 40 (2022) 800–806. [16] S. Sisira L.A. Jacob K. Thomas D. Alexander P. Biju N. Unnikrishnan C. Joseph Effect of doping concentration and annealing temperature on the luminescence of novel orange red emitting CePO4: sm3+ nanocrystals J. Lumin. 209 2019 197 207 S. Sisira, L.A. Jacob, K. Thomas, D. Alexander, P. Biju, N. Unnikrishnan, C. Joseph, Effect of doping concentration and annealing temperature on the luminescence of novel orange red emitting CePO4: sm3+ nanocrystals, J. Lumin.. 209 (2019) 197–207. [17] T. Ma Z. Yun W. Xu L. Chen L. Li J. Ding R. Shao Pd-H3PW12O40/Zr-MCM-41: an efficient catalyst for the sustainable dehydration of glycerol to acrolein Chem. Eng. J. 294 2016 343 352 T. Ma, Z. Yun, W. Xu, L. Chen, L. Li, J. Ding, R. Shao, Pd-H3PW12O40/Zr-MCM-41: an efficient catalyst for the sustainable dehydration of glycerol to acrolein, Chem. Eng. J.. 294 (2016) 343–352. [18] A. Micek-Ilnicka N. Ogrodowicz U. Filek A. Kusior The role of TiO2 polymorphs as support for the Keggin-type tungstophosphoric heteropolyacid as catalysts for n-butanol dehydration Catal. Today 380 2021 84 92 A. Micek-Ilnicka, N. Ogrodowicz, U. Filek, A. Kusior, The role of TiO2 polymorphs as support for the Keggin-type tungstophosphoric heteropolyacid as catalysts for n-butanol dehydration, Catal. Today. 380 (2021) 84–92. [19] Y. Wei Y. Chen R. Wang Rare earth salt of 12-tungstophosphoric acid supported on iron oxide as a catalyst for selective catalytic reduction of NOx Fuel Process. Technol. 178 2018 262 270 Y. Wei, Y. Chen, R. Wang, Rare earth salt of 12-tungstophosphoric acid supported on iron oxide as a catalyst for selective catalytic reduction of NOx, Fuel Process. Technol.. 178 (2018) 262–270. [20] W. Wang Z. Xiong W. He W. Lu H. Shi Influence of thiourea modification on the NH3-SCR activity of CeO2: simultaneous tuning morphology and surface acidity J. Energy Inst. 98 2021 322 333 W. Wang, Z. Xiong, W. He, W. Lu, H. Shi, Influence of thiourea modification on the NH3-SCR activity of CeO2: simultaneous tuning morphology and surface acidity, J. Energy Inst.. 98 (2021) 322–333. [21] Y. Jia R. Zheng J. Yuan X. Zhang R. Wang M. Gu S. Zhang Y. Chen L. Guo Promoting catalytic performance by balancing acid and redox sites on Mn3O4–Mn2P2O7/TiO2 for selective catalytic reduction of NO by NH3 at low temperature Mol. Catal. 536 2023 112913 Y. Jia, R. Zheng, J. Yuan, X. Zhang, R. Wang, M. Gu, S. Zhang, Y. Chen, L. Guo, Promoting catalytic performance by balancing acid and redox sites on Mn3O4–Mn2P2O7/TiO2 for selective catalytic reduction of NO by NH3 at low temperature, Mol. Catal.. 536 (2023) 112913. [22] Z. Lin J. Huang A hierarchical H3PW12O40/TiO2 nanocomposite with cellulose as scaffold for photocatalytic degradation of organic pollutants Sep. Purif. Technol. 264 2021 118427 Z. Lin, J. Huang, A hierarchical H3PW12O40/TiO2 nanocomposite with cellulose as scaffold for photocatalytic degradation of organic pollutants, Sep. Purif. Technol.. 264 (2021) 118427. [23] S. Wang X. Li S. Ren X. Xing L. Chen J. Yang M. Liu Y. Xie Effects of different exposed crystal surfaces of CeO2 loaded on an MnO2/X catalyst for the NH3-SCR reaction CrystEngComm 24 2022 4991 5002 S. Wang, X. Li, S. Ren, X. Xing, L. Chen, J. Yang, M. Liu, Y. Xie, Effects of different exposed crystal surfaces of CeO2 loaded on an MnO2/X catalyst for the NH3-SCR reaction, CrystEngComm. 24 (2022) 4991–5002. [24] B.B. Bardin R.J. Davis Effect of water on silica-supported phosphotungstic acid catalysts for 1-butene double bond shift and alkane skeletal isomerization Appl. Catal. Gen. 200 2000 219 231 B.B. Bardin, R.J. Davis, Effect of water on silica-supported phosphotungstic acid catalysts for 1-butene double bond shift and alkane skeletal isomerization, Appl. Catal. Gen.. 200 (2000) 219–231. [25] J.H. Cavka S. Jakobsen U. Olsbye N. Guillou C. Lamberti S. Bordiga K.P. Lillerud A new zirconium inorganic building brick forming metal organic frameworks with exceptional stability J. Am. Chem. Soc. 130 2008 13850 13851 J.H. Cavka, S. Jakobsen, U. Olsbye, N. Guillou, C. Lamberti, S. Bordiga, K.P. Lillerud, A new zirconium inorganic building brick forming metal organic frameworks with exceptional stability, J. Am. Chem. Soc.. 130 (2008) 13850–13851. [26] J. Huang J. Chen J. Yao S. Zhao X. Wu Q. Xia Novel regenerated V-and Ce-mixed oxide modified catalysts for the NH3-SCR of NOx displaying a distinctive broad temperature window J. Clean. Prod. 382 2023 135384 J. Huang, J. Chen, J. Yao, S. Zhao, X. Wu, Q. Xia, Novel regenerated V-and Ce-mixed oxide modified catalysts for the NH3-SCR of NOx displaying a distinctive broad temperature window, J. Clean. Prod.. 382 (2023) 135384. [27] Z. Ren Y. Teng L. Zhao R. Wang Keggin-tungstophosphoric acid decorated Fe2O3 nanoring as a new catalyst for selective catalytic reduction of NOx with ammonia Catal. Today 297 2017 36 45 Z. Ren, Y. Teng, L. Zhao, R. Wang, Keggin-tungstophosphoric acid decorated Fe2O3 nanoring as a new catalyst for selective catalytic reduction of NOx with ammonia, Catal. Today. 297 (2017) 36–45. [28] L. Chen S. Ren Y. Jiang L. Liu M. Wang J. Yang Z. Chen W. Liu Q. Liu Effect of Mn and Ce oxides on low-temperature NH3-SCR performance over blast furnace slag-derived zeolite X supported catalysts Fuel 320 2022 123969 L. Chen, S. Ren, Y. Jiang, L. Liu, M. Wang, J. Yang, Z. Chen, W. Liu, Q. Liu, Effect of Mn and Ce oxides on low-temperature NH3-SCR performance over blast furnace slag-derived zeolite X supported catalysts, Fuel. 320 (2022) 123969. [29] Z. Ren H. Fan R. Wang A novel ring-like Fe2O3-based catalyst: tungstophosphoric acid modification, NH3-SCR activity and tolerance to H2O and SO2 Catal. Commun. 100 2017 71 75 Z. Ren, H. Fan, R. Wang, A novel ring-like Fe2O3-based catalyst: tungstophosphoric acid modification, NH3-SCR activity and tolerance to H2O and SO2, Catal. Commun.. 100 (2017) 71–75. [30] Y. Zeng Y. Wang S. Zhang Q. Zhong W. Rong X. Li One-pot synthesis of ceria and cerium phosphate (CeO2-CePO4) nanorod composites for selective catalytic reduction of NO with NH3: active sites and reaction mechanism J. Colloid Interface Sci. 524 2018 8 15 Y. Zeng, Y. Wang, S. Zhang, Q. Zhong, W. Rong, X. Li, One-pot synthesis of ceria and cerium phosphate (CeO2-CePO4) nanorod composites for selective catalytic reduction of NO with NH3: active sites and reaction mechanism, J. Colloid Interface Sci.. 524 (2018) 8–15. [31] L. Chen Y. Shen Q. Wang X. Wang Y. Wang B. Li S. Li S. Zhang W. Li Phosphate on ceria with controlled active sites distribution for wide temperature NH3-SCR J. Hazard. Mater. 427 2022 128148 L. Chen, Y. Shen, Q. Wang, X. Wang, Y. Wang, B. Li, S. Li, S. Zhang, W. Li, Phosphate on ceria with controlled active sites distribution for wide temperature NH3-SCR, J. Hazard. Mater.. 427 (2022) 128148. [32] M. Wang S. Ren X. Xing Y. Zhou J. Yang L. Chen X. Li Catalytic performance of CeO2-NPs and α-MnO2 mixed oxides catalysts for low-temperature NH3-SCR of NO J. Energy Inst. 103 2022 54 59 M. Wang, S. Ren, X. Xing, Y. Zhou, J. Yang, L. Chen, X. Li, Catalytic performance of CeO2-NPs and α-MnO2 mixed oxides catalysts for low-temperature NH3-SCR of NO, J. Energy Inst.. 103 (2022) 54–59. [33] M. Li R. Guo C. Hu P. Sun W. Pan S. Liu X. Sun S. Liu J. Liu The enhanced resistance to K deactivation of Ce/TiO2 catalyst for NH3-SCR reaction by the modification with P Appl. Surf. Sci. 436 2018 814 822 M. Li, R. Guo, C. Hu, P. Sun, W. Pan, S. Liu, X. Sun, S. Liu, J. Liu, The enhanced resistance to K deactivation of Ce/TiO2 catalyst for NH3-SCR reaction by the modification with P, Appl. Surf. Sci.. 436 (2018) 814–822. [34] L. Huang Y. Zeng Y. Gao H. Wang Y. Zong Z. Chang S. Zhang P. Han Y. Yu Promotional effect of phosphorus addition on improving the SO2 resistance of V2O5-MoO3/TiO2 catalyst for NH3-SCR of NO J. Phys. Chem. Solids 163 2022 110566 L. Huang, Y. Zeng, Y. Gao, H. Wang, Y. Zong, Z. Chang, S. Zhang, P. Han, Y. Yu, Promotional effect of phosphorus addition on improving the SO2 resistance of V2O5-MoO3/TiO2 catalyst for NH3-SCR of NO, J. Phys. Chem. Solids. 163 (2022) 110566. [35] H. Heng Q. Gan P. Meng X. Liu The visible-light-driven type III heterojunction H3PW12O40/TiO2-In2S3: a photocatalysis composite with enhanced photocatalytic activity J. Alloys Compd. 696 2017 51 59 H. Heng, Q. Gan, P. Meng, X. Liu, The visible-light-driven type III heterojunction H3PW12O40/TiO2-In2S3: a photocatalysis composite with enhanced photocatalytic activity, J. Alloys Compd.. 696 (2017) 51–59. [36] G. Liu M. Chen X. Jin C. Song F. He Q. Huang Combination of H3PW12O40-TiO2 catalysts for photo-thermal oxidation of cyclohexene to adipic acid by 30% H2O2 J. Environ. Chem. Eng. 9 2021 105422 G. Liu, M. Chen, X. Jin, C. Song, F. He, Q. Huang, Combination of H3PW12O40-TiO2 catalysts for photo-thermal oxidation of cyclohexene to adipic acid by 30% H2O2, J. Environ. Chem. Eng.. 9 (2021) 105422. [37] Y. Li W. Song J. Liu Z. Zhao M. Gao Y. Wei Q. Wang J. Deng The protection of CeO2 thin film on Cu-SAPO-18 catalyst for highly stable catalytic NH3-SCR performance Chem. Eng. J. 330 2017 926 935 Y. Li, W. Song, J. Liu, Z. Zhao, M. Gao, Y. Wei, Q. Wang, J. Deng, The protection of CeO2 thin film on Cu-SAPO-18 catalyst for highly stable catalytic NH3-SCR performance, Chem. Eng. J.. 330 (2017) 926–935. [38] Y. Jia J. Jiang R. Zheng L. Guo J. Yuan S. Zhang M. Gu Insight into the reaction mechanism over PMoA for low temperature NH3-SCR: a combined In-situ DRIFTs and DFT transition state calculations J. Hazard. Mater. 412 2021 125258 Y. Jia, J. Jiang, R. Zheng, L. Guo, J. Yuan, S. Zhang, M. Gu, Insight into the reaction mechanism over PMoA for low temperature NH3-SCR: a combined In-situ DRIFTs and DFT transition state calculations, J. Hazard. Mater.. 412 (2021) 125258. [39] Z. Song Q. Zhang Y. Ma Q. Liu P. Ning X. Liu J. Wang B. Zhao J. Huang Z. Huang Mechanism-dependent on the different CeO2 supports of phosphotungstic acid modification CeO2 catalysts for the selective catalytic reduction of NO with NH3 J. Taiwan Inst. Chem. Eng. 71 2017 277 284 Z. Song, Q. Zhang, Y. Ma, Q. Liu, P. Ning, X. Liu, J. Wang, B. Zhao, J. Huang, Z. Huang, Mechanism-dependent on the different CeO2 supports of phosphotungstic acid modification CeO2 catalysts for the selective catalytic reduction of NO with NH3, J. Taiwan Inst. Chem. Eng.. 71 (2017) 277–284. [40] Y. You C. Shi H. Chang L. Guo L. Xu J. Li The promoting effects of amorphous CePO4 species on phosphorus-doped CeO2/TiO2 catalysts for selective catalytic reduction of NOx by NH3 Mol. Catal. 453 2018 47 54 Y. You, C. Shi, H. Chang, L. Guo, L. Xu, J. Li, The promoting effects of amorphous CePO4 species on phosphorus-doped CeO2/TiO2 catalysts for selective catalytic reduction of NOx by NH3, Mol. Catal.. 453 (2018) 47–54. [41] W. Yao L. Gang-gang Z. Shao-qing Z. Xin-yan Z. Xin H. Zheng-ping Promoting effect of Ce and Mn addition on Cu-SSZ-39 zeolites for NH3-SCR reaction: activity, hydrothermal stability, and mechanism study Chem. Eng. J. 393 2020 124782 W. Yao, L. Gang-gang, Z. Shao-qing, Z. Xin-yan, Z. Xin, H. Zheng-ping, Promoting effect of Ce and Mn addition on Cu-SSZ-39 zeolites for NH3-SCR reaction: activity, hydrothermal stability, and mechanism study, Chem. Eng. J.. 393 (2020) 124782. [42] P. Gong J. Xie D. Fang F. He F. Li K. Qi Enhancement of the NH3-SCR property of Ce-Zr-Ti by surface and structure modification with P Appl. Surf. Sci. 505 2020 144641 P. Gong, J. Xie, D. Fang, F. He, F. Li, K. Qi, Enhancement of the NH3-SCR property of Ce-Zr-Ti by surface and structure modification with P, Appl. Surf. Sci.. 505 (2020) 144641. [43] C. Chen Y. Wang J. Li F. Tian W. Chen C. Feng Y. Pan Y. Liu In situ construction of heteroatom F-doped Mn3O4 spinel catalysts with robust activity and SO2 resistance for NH3-SCR at low temperature Appl. Catal. B 338 2023 123086 C. Chen, Y. Wang, J. Li, F. Tian, W. Chen, C. Feng, Y. Pan, Y. Liu, In situ construction of heteroatom F-doped Mn3O4 spinel catalysts with robust activity and SO2 resistance for NH3-SCR at low temperature, Appl. Catal. B. 338 (2023) 123086. [44] Y. Zeng S. Zhang Revealing active species of CePO4 catalyst for selective catalytic reduction of NOx with NH3 J. Rare Earths 40 2022 1232 1237 Y. Zeng, S. Zhang, Revealing active species of CePO4 catalyst for selective catalytic reduction of NOx with NH3, J. Rare Earths. 40 (2022) 1232–1237. [45] S. Han J. Cheng Q. Ye S. Cheng T. Kang H. Dai Ce doping to Cu-SAPO-18: enhanced catalytic performance for the NH3-SCR of NO in simulated diesel exhaust Microporous Mesoporous Mater. 276 2019 133 146 S. Han, J. Cheng, Q. Ye, S. Cheng, T. Kang, H. Dai, Ce doping to Cu-SAPO-18: enhanced catalytic performance for the NH3-SCR of NO in simulated diesel exhaust, Microporous Mesoporous Mater.. 276 (2019) 133–146. [46] H. Wu M. He W. Liu L. Jiang J. Cao C. Yang J. Yang J. Peng Y. Liu Q. Liu Application of manganese-containing soil as novel catalyst for low-temperature NH3-SCR of NO J. Environ. Chem. Eng. 9 2021 105426 H. Wu, M. He, W. Liu, L. Jiang, J. Cao, C. Yang, J. Yang, J. Peng, Y. Liu, Q. Liu, Application of manganese-containing soil as novel catalyst for low-temperature NH3-SCR of NO, J. Environ. Chem. Eng.. 9 (2021) 105426. [47] Y. Zheng Y. Guo W. Shan Z. Lian T. Zhu Revealing the Ca resistance enhancement mechanism for the NH3-SCR reaction over VTi catalyst by CuO modification Appl. Catal. A 637 2022 118606 Y. Zheng, Y. Guo, W. Shan, Z. Lian, T. Zhu, Revealing the Ca resistance enhancement mechanism for the NH3-SCR reaction over VTi catalyst by CuO modification, Appl. Catal. A. 637 (2022) 118606. [48] N. Zhang Y. Guo Y. Guo Q. Dai L. Wang S. Dai W. Zhan Synchronously constructing the optimal redox-acidity of sulfate and RuOx Co-modified CeO2 for catalytic combustion of chlorinated VOCs Chem. Eng. J. 454 2023 140391 N. Zhang, Y. Guo, Y. Guo, Q. Dai, L. Wang, S. Dai, W. Zhan, Synchronously constructing the optimal redox-acidity of sulfate and RuOx Co-modified CeO2 for catalytic combustion of chlorinated VOCs, Chem. Eng. J.. 454 (2023) 140391. [49] R. Zhao R. Pang Y. Wang Z. Zhao Effect of metal elements doping on the CePO4 catalysts for selective catalytic reduction of NO with NH3 Mol. Catal. 530 2022 112627 R. Zhao, R. Pang, Y. Wang, Z. Zhao, Effect of metal elements doping on the CePO4 catalysts for selective catalytic reduction of NO with NH3, Mol. Catal.. 530 (2022) 112627. [50] Y. Geng K. Jin J. Mei G. Su L. Ma S. Yang CeO2 grafted with different heteropoly acids for selective catalytic reduction of NO x with NH3 J. Hazard. Mater. 382 2020 121032 Y. Geng, K. Jin, J. Mei, G. Su, L. Ma, S. Yang, CeO2 grafted with different heteropoly acids for selective catalytic reduction of NOx with NH3, J. Hazard. Mater.. 382 (2020) 121032. [51] P. Zhang A. Chen T. Lan X. Liu T. Yan W. Ren D. Zhang Balancing acid and redox sites of phosphorylated CeO2 catalysts for NOx reduction: the promoting and inhibiting mechanism of phosphorus J. Hazard. Mater. 441 2023 129867 P. Zhang, A. Chen, T. Lan, X. Liu, T. Yan, W. Ren, D. Zhang, Balancing acid and redox sites of phosphorylated CeO2 catalysts for NOx reduction: the promoting and inhibiting mechanism of phosphorus, J. Hazard. Mater.. 441 (2023) 129867. [52] Y. Ke W. Huang S. Li Y. Liao J. Li Z. Qu N. Yan Surface acidity enhancement of CeO2 catalysts via modification with a heteropoly acid for the selective catalytic reduction of NO with ammonia Catal. Sci. Technol. 9 2019 5774 5785 Y. Ke, W. Huang, S. Li, Y. Liao, J. Li, Z. Qu, N. Yan, Surface acidity enhancement of CeO2 catalysts via modification with a heteropoly acid for the selective catalytic reduction of NO with ammonia, Catal. Sci. Technol.. 9 (2019) 5774–5785. [53] J. Yang S. Ren M. Wang Z. Chen L. Chen L. Liu Time-resolved in situ DRIFTs study on NH3-SCR of NO on a CeO2/TiO2 catalyst Catal. Sci. Technol. 12 2022 1245 1256 J. Yang, S. Ren, M. Wang, Z. Chen, L. Chen, L. Liu, Time-resolved in situ DRIFTs study on NH3-SCR of NO on a CeO2/TiO2 catalyst, Catal. Sci. Technol.. 12 (2022) 1245–1256.",
      "scopus-id": "85175353356",
      "coredata": {
        "eid": "1-s2.0-S2468823123007496",
        "dc:description": "CePO4 was prepared using the co-precipitation method. Recognizing the bifunctional nature of hetero-polyacid (salt), with both acidic and redox properties, it was modified by using phosphotungstic acid (HPW), and the HPW/CePO4 catalysts were synthesized using the impregnation technique. Various advanced techniques were employed to investigate aspects such as catalytic activity, microstructure, surface properties, and reaction mechanisms. These methods included NH3-SCR, XRD, XPS, SEM, BET, NH3-TPD, H2-TPR, and In-situ DRIFTs. Experimental findings indicated that the HPW-modified CePO4 catalysts exhibited enhanced SCR activity. Among them, the reaction activity window for NO x conversion of the W: Ce 0.05 catalyst was found to be 300∼400 °C, which represented the best activity temperature window. Following the incorporation of HPW, the HPW/CePO4 catalysts demonstrated an increased presence of Brønsted acidic sites, which concurrently led to a significant reduction in SO2 adsorption. The W: Ce 0.05 catalyst possessed the highest ratios of Oα/(Oα+Oβ+Oγ) and Ce4+/(Ce3++Ce4+). These ratios effectively regulated the sequestration and release of reactive oxygen species, thereby enhancing the activation of NH3. Consequently, this promoted the catalyst's low-temperature NH3-SCR reactivity. Lastly, the reaction process was examined using in-situ DRIFTs. The study revealed the generation of -NH2 intermediates at the Lewis acid sites of the W: Ce 0.05 catalyst. These intermediates subsequently underwent reactions with gaseous NO via the Eley-Rideal mechanism. This approach not only amplified the low-temperature catalytic efficacy of the catalysts but also bolstered their resilience to SO2, thereby fostering the long-term stability of the NH3-SCR reaction.",
        "openArchiveArticle": "false",
        "prism:coverDate": "2023-12-31",
        "openaccessUserLicense": null,
        "prism:aggregationType": "Journal",
        "prism:url": "https://api.elsevier.com/content/article/pii/S2468823123007496",
        "dc:creator": [
          {
            "@_fa": "true",
            "$": "Zhang, Lantian"
          },
          {
            "@_fa": "true",
            "$": "Zhao, Ran"
          },
          {
            "@_fa": "true",
            "$": "Li, Hongxia"
          },
          {
            "@_fa": "true",
            "$": "Bao, Jinxiao"
          },
          {
            "@_fa": "true",
            "$": "Wang, Qingchun"
          }
        ],
        "link": [
          {
            "@_fa": "true",
            "@rel": "self",
            "@href": "https://api.elsevier.com/content/article/pii/S2468823123007496"
          },
          {
            "@_fa": "true",
            "@rel": "scidir",
            "@href": "https://www.sciencedirect.com/science/article/pii/S2468823123007496"
          }
        ],
        "dc:format": "application/json",
        "openaccessType": null,
        "pii": "S2468-8231(23)00749-6",
        "prism:volume": "551",
        "articleNumber": "113666",
        "prism:publisher": "Elsevier B.V.",
        "dc:title": "Promotional effects of phosphotungstic acid on CePO4 catalyst for the selective catalytic reduction of NO x with NH3",
        "prism:copyright": "© 2023 Elsevier B.V. All rights reserved.",
        "openaccess": "0",
        "prism:issn": "24688231",
        "dcterms:subject": [
          {
            "@_fa": "true",
            "$": "CePo4"
          },
          {
            "@_fa": "true",
            "$": "Phosphotungstic acid"
          },
          {
            "@_fa": "true",
            "$": "NH3-Scr"
          },
          {
            "@_fa": "true",
            "$": "In-situ DRIFTs"
          }
        ],
        "openaccessArticle": "false",
        "prism:publicationName": "Molecular Catalysis",
        "openaccessSponsorType": null,
        "prism:pageRange": "113666",
        "pubType": "fla",
        "prism:coverDisplayDate": "December 2023",
        "prism:doi": "10.1016/j.mcat.2023.113666",
        "prism:startingPage": "113666",
        "dc:identifier": "doi:10.1016/j.mcat.2023.113666",
        "openaccessSponsorName": null
      },
      "objects": {
        "object": [
          {
            "@category": "standard",
            "@height": "283",
            "@width": "376",
            "@_fa": "true",
            "$": "https://api.elsevier.com/content/object/eid/1-s2.0-S2468823123007496-gr4.jpg?httpAccept=%2A%2F%2A",
            "@multimediatype": "JPEG image file",
            "@type": "IMAGE-DOWNSAMPLED",
            "@size": "77655",
            "@ref": "gr4",
            "@mimetype": "image/jpeg"
          },
          {
            "@category": "standard",
            "@height": "692",
            "@width": "753",
            "@_fa": "true",
            "$": "https://api.elsevier.com/content/object/eid/1-s2.0-S2468823123007496-gr9.jpg?httpAccept=%2A%2F%2A",
            "@multimediatype": "JPEG image file",
            "@type": "IMAGE-DOWNSAMPLED",
            "@size": "207857",
            "@ref": "gr9",
            "@mimetype": "image/jpeg"
          },
          {
            "@category": "standard",
            "@height": "280",
            "@width": "659",
            "@_fa": "true",
            "$": "https://api.elsevier.com/content/object/eid/1-s2.0-S2468823123007496-gr7.jpg?httpAccept=%2A%2F%2A",
            "@multimediatype": "JPEG image file",
            "@type": "IMAGE-DOWNSAMPLED",
            "@size": "51318",
            "@ref": "gr7",
            "@mimetype": "image/jpeg"
          },
          {
            "@category": "standard",
            "@height": "257",
            "@width": "659",
            "@_fa": "true",
            "$": "https://api.elsevier.com/content/object/eid/1-s2.0-S2468823123007496-gr11.jpg?httpAccept=%2A%2F%2A",
            "@multimediatype": "JPEG image file",
            "@type": "IMAGE-DOWNSAMPLED",
            "@size": "57300",
            "@ref": "gr11",
            "@mimetype": "image/jpeg"
          },
          {
            "@category": "standard",
            "@height": "254",
            "@width": "659",
            "@_fa": "true",
            "$": "https://api.elsevier.com/content/object/eid/1-s2.0-S2468823123007496-gr12.jpg?httpAccept=%2A%2F%2A",
            "@multimediatype": "JPEG image file",
            "@type": "IMAGE-DOWNSAMPLED",
            "@size": "67421",
            "@ref": "gr12",
            "@mimetype": "image/jpeg"
          },
          {
            "@category": "standard",
            "@height": "610",
            "@width": "753",
            "@_fa": "true",
            "$": "https://api.elsevier.com/content/object/eid/1-s2.0-S2468823123007496-gr1.jpg?httpAccept=%2A%2F%2A",
            "@multimediatype": "JPEG image file",
            "@type": "IMAGE-DOWNSAMPLED",
            "@size": "133588",
            "@ref": "gr1",
            "@mimetype": "image/jpeg"
          },
          {
            "@category": "standard",
            "@height": "266",
            "@width": "339",
            "@_fa": "true",
            "$": "https://api.elsevier.com/content/object/eid/1-s2.0-S2468823123007496-gr2.jpg?httpAccept=%2A%2F%2A",
            "@multimediatype": "JPEG image file",
            "@type": "IMAGE-DOWNSAMPLED",
            "@size": "48018",
            "@ref": "gr2",
            "@mimetype": "image/jpeg"
          },
          {
            "@category": "standard",
            "@height": "302",
            "@width": "791",
            "@_fa": "true",
            "$": "https://api.elsevier.com/content/object/eid/1-s2.0-S2468823123007496-gr5.jpg?httpAccept=%2A%2F%2A",
            "@multimediatype": "JPEG image file",
            "@type": "IMAGE-DOWNSAMPLED",
            "@size": "106279",
            "@ref": "gr5",
            "@mimetype": "image/jpeg"
          },
          {
            "@category": "standard",
            "@height": "434",
            "@width": "791",
            "@_fa": "true",
            "$": "https://api.elsevier.com/content/object/eid/1-s2.0-S2468823123007496-gr6.jpg?httpAccept=%2A%2F%2A",
            "@multimediatype": "JPEG image file",
            "@type": "IMAGE-DOWNSAMPLED",
            "@size": "128609",
            "@ref": "gr6",
            "@mimetype": "image/jpeg"
          },
          {
            "@category": "standard",
            "@height": "193",
            "@width": "376",
            "@_fa": "true",
            "$": "https://api.elsevier.com/content/object/eid/1-s2.0-S2468823123007496-gr3.jpg?httpAccept=%2A%2F%2A",
            "@multimediatype": "JPEG image file",
            "@type": "IMAGE-DOWNSAMPLED",
            "@size": "38037",
            "@ref": "gr3",
            "@mimetype": "image/jpeg"
          },
          {
            "@category": "standard",
            "@height": "293",
            "@width": "659",
            "@_fa": "true",
            "$": "https://api.elsevier.com/content/object/eid/1-s2.0-S2468823123007496-gr8.jpg?httpAccept=%2A%2F%2A",
            "@multimediatype": "JPEG image file",
            "@type": "IMAGE-DOWNSAMPLED",
            "@size": "58825",
            "@ref": "gr8",
            "@mimetype": "image/jpeg"
          },
          {
            "@category": "standard",
            "@height": "255",
            "@width": "659",
            "@_fa": "true",
            "$": "https://api.elsevier.com/content/object/eid/1-s2.0-S2468823123007496-gr10.jpg?httpAccept=%2A%2F%2A",
            "@multimediatype": "JPEG image file",
            "@type": "IMAGE-DOWNSAMPLED",
            "@size": "68102",
            "@ref": "gr10",
            "@mimetype": "image/jpeg"
          },
          {
            "@category": "standard",
            "@height": "200",
            "@width": "306",
            "@_fa": "true",
            "$": "https://api.elsevier.com/content/object/eid/1-s2.0-S2468823123007496-ga1.jpg?httpAccept=%2A%2F%2A",
            "@multimediatype": "JPEG image file",
            "@type": "IMAGE-DOWNSAMPLED",
            "@size": "20247",
            "@ref": "ga1",
            "@mimetype": "image/jpeg"
          },
          {
            "@category": "standard",
            "@height": "247",
            "@width": "376",
            "@_fa": "true",
            "$": "https://api.elsevier.com/content/object/eid/1-s2.0-S2468823123007496-gr13.jpg?httpAccept=%2A%2F%2A",
            "@multimediatype": "JPEG image file",
            "@type": "IMAGE-DOWNSAMPLED",
            "@size": "26985",
            "@ref": "gr13",
            "@mimetype": "image/jpeg"
          },
          {
            "@category": "thumbnail",
            "@height": "164",
            "@width": "218",
            "@_fa": "true",
            "$": "https://api.elsevier.com/content/object/eid/1-s2.0-S2468823123007496-gr4.sml?httpAccept=%2A%2F%2A",
            "@multimediatype": "GIF image file",
            "@type": "IMAGE-THUMBNAIL",
            "@size": "20887",
            "@ref": "gr4",
            "@mimetype": "image/gif"
          },
          {
            "@category": "thumbnail",
            "@height": "164",
            "@width": "178",
            "@_fa": "true",
            "$": "https://api.elsevier.com/content/object/eid/1-s2.0-S2468823123007496-gr9.sml?httpAccept=%2A%2F%2A",
            "@multimediatype": "GIF image file",
            "@type": "IMAGE-THUMBNAIL",
            "@size": "17549",
            "@ref": "gr9",
            "@mimetype": "image/gif"
          },
          {
            "@category": "thumbnail",
            "@height": "93",
            "@width": "219",
            "@_fa": "true",
            "$": "https://api.elsevier.com/content/object/eid/1-s2.0-S2468823123007496-gr7.sml?httpAccept=%2A%2F%2A",
            "@multimediatype": "GIF image file",
            "@type": "IMAGE-THUMBNAIL",
            "@size": "9343",
            "@ref": "gr7",
            "@mimetype": "image/gif"
          },
          {
            "@category": "thumbnail",
            "@height": "85",
            "@width": "219",
            "@_fa": "true",
            "$": "https://api.elsevier.com/content/object/eid/1-s2.0-S2468823123007496-gr11.sml?httpAccept=%2A%2F%2A",
            "@multimediatype": "GIF image file",
            "@type": "IMAGE-THUMBNAIL",
            "@size": "8659",
            "@ref": "gr11",
            "@mimetype": "image/gif"
          },
          {
            "@category": "thumbnail",
            "@height": "84",
            "@width": "219",
            "@_fa": "true",
            "$": "https://api.elsevier.com/content/object/eid/1-s2.0-S2468823123007496-gr12.sml?httpAccept=%2A%2F%2A",
            "@multimediatype": "GIF image file",
            "@type": "IMAGE-THUMBNAIL",
            "@size": "9908",
            "@ref": "gr12",
            "@mimetype": "image/gif"
          },
          {
            "@category": "thumbnail",
            "@height": "164",
            "@width": "202",
            "@_fa": "true",
            "$": "https://api.elsevier.com/content/object/eid/1-s2.0-S2468823123007496-gr1.sml?httpAccept=%2A%2F%2A",
            "@multimediatype": "GIF image file",
            "@type": "IMAGE-THUMBNAIL",
            "@size": "13509",
            "@ref": "gr1",
            "@mimetype": "image/gif"
          },
          {
            "@category": "thumbnail",
            "@height": "164",
            "@width": "209",
            "@_fa": "true",
            "$": "https://api.elsevier.com/content/object/eid/1-s2.0-S2468823123007496-gr2.sml?httpAccept=%2A%2F%2A",
            "@multimediatype": "GIF image file",
            "@type": "IMAGE-THUMBNAIL",
            "@size": "13769",
            "@ref": "gr2",
            "@mimetype": "image/gif"
          },
          {
            "@category": "thumbnail",
            "@height": "84",
            "@width": "219",
            "@_fa": "true",
            "$": "https://api.elsevier.com/content/object/eid/1-s2.0-S2468823123007496-gr5.sml?httpAccept=%2A%2F%2A",
            "@multimediatype": "GIF image file",
            "@type": "IMAGE-THUMBNAIL",
            "@size": "16240",
            "@ref": "gr5",
            "@mimetype": "image/gif"
          },
          {
            "@category": "thumbnail",
            "@height": "120",
            "@width": "219",
            "@_fa": "true",
            "$": "https://api.elsevier.com/content/object/eid/1-s2.0-S2468823123007496-gr6.sml?httpAccept=%2A%2F%2A",
            "@multimediatype": "GIF image file",
            "@type": "IMAGE-THUMBNAIL",
            "@size": "13390",
            "@ref": "gr6",
            "@mimetype": "image/gif"
          },
          {
            "@category": "thumbnail",
            "@height": "112",
            "@width": "219",
            "@_fa": "true",
            "$": "https://api.elsevier.com/content/object/eid/1-s2.0-S2468823123007496-gr3.sml?httpAccept=%2A%2F%2A",
            "@multimediatype": "GIF image file",
            "@type": "IMAGE-THUMBNAIL",
            "@size": "20138",
            "@ref": "gr3",
            "@mimetype": "image/gif"
          },
          {
            "@category": "thumbnail",
            "@height": "97",
            "@width": "219",
            "@_fa": "true",
            "$": "https://api.elsevier.com/content/object/eid/1-s2.0-S2468823123007496-gr8.sml?httpAccept=%2A%2F%2A",
            "@multimediatype": "GIF image file",
            "@type": "IMAGE-THUMBNAIL",
            "@size": "10336",
            "@ref": "gr8",
            "@mimetype": "image/gif"
          },
          {
            "@category": "thumbnail",
            "@height": "85",
            "@width": "219",
            "@_fa": "true",
            "$": "https://api.elsevier.com/content/object/eid/1-s2.0-S2468823123007496-gr10.sml?httpAccept=%2A%2F%2A",
            "@multimediatype": "GIF image file",
            "@type": "IMAGE-THUMBNAIL",
            "@size": "10026",
            "@ref": "gr10",
            "@mimetype": "image/gif"
          },
          {
            "@category": "thumbnail",
            "@height": "143",
            "@width": "219",
            "@_fa": "true",
            "$": "https://api.elsevier.com/content/object/eid/1-s2.0-S2468823123007496-ga1.sml?httpAccept=%2A%2F%2A",
            "@multimediatype": "GIF image file",
            "@type": "IMAGE-THUMBNAIL",
            "@size": "12552",
            "@ref": "ga1",
            "@mimetype": "image/gif"
          },
          {
            "@category": "thumbnail",
            "@height": "144",
            "@width": "219",
            "@_fa": "true",
            "$": "https://api.elsevier.com/content/object/eid/1-s2.0-S2468823123007496-gr13.sml?httpAccept=%2A%2F%2A",
            "@multimediatype": "GIF image file",
            "@type": "IMAGE-THUMBNAIL",
            "@size": "12347",
            "@ref": "gr13",
            "@mimetype": "image/gif"
          },
          {
            "@category": "high",
            "@height": "1254",
            "@width": "1667",
            "@_fa": "true",
            "$": "https://api.elsevier.com/content/object/eid/1-s2.0-S2468823123007496-gr4_lrg.jpg?httpAccept=%2A%2F%2A",
            "@multimediatype": "JPEG image file",
            "@type": "IMAGE-HIGH-RES",
            "@size": "572727",
            "@ref": "gr4",
            "@mimetype": "image/jpeg"
          },
          {
            "@category": "high",
            "@height": "3064",
            "@width": "3333",
            "@_fa": "true",
            "$": "https://api.elsevier.com/content/object/eid/1-s2.0-S2468823123007496-gr9_lrg.jpg?httpAccept=%2A%2F%2A",
            "@multimediatype": "JPEG image file",
            "@type": "IMAGE-HIGH-RES",
            "@size": "1299309",
            "@ref": "gr9",
            "@mimetype": "image/jpeg"
          },
          {
            "@category": "high",
            "@height": "1241",
            "@width": "2917",
            "@_fa": "true",
            "$": "https://api.elsevier.com/content/object/eid/1-s2.0-S2468823123007496-gr7_lrg.jpg?httpAccept=%2A%2F%2A",
            "@multimediatype": "JPEG image file",
            "@type": "IMAGE-HIGH-RES",
            "@size": "326858",
            "@ref": "gr7",
            "@mimetype": "image/jpeg"
          },
          {
            "@category": "high",
            "@height": "1137",
            "@width": "2917",
            "@_fa": "true",
            "$": "https://api.elsevier.com/content/object/eid/1-s2.0-S2468823123007496-gr11_lrg.jpg?httpAccept=%2A%2F%2A",
            "@multimediatype": "JPEG image file",
            "@type": "IMAGE-HIGH-RES",
            "@size": "346226",
            "@ref": "gr11",
            "@mimetype": "image/jpeg"
          },
          {
            "@category": "high",
            "@height": "1123",
            "@width": "2917",
            "@_fa": "true",
            "$": "https://api.elsevier.com/content/object/eid/1-s2.0-S2468823123007496-gr12_lrg.jpg?httpAccept=%2A%2F%2A",
            "@multimediatype": "JPEG image file",
            "@type": "IMAGE-HIGH-RES",
            "@size": "394971",
            "@ref": "gr12",
            "@mimetype": "image/jpeg"
          },
          {
            "@category": "high",
            "@height": "2700",
            "@width": "3333",
            "@_fa": "true",
            "$": "https://api.elsevier.com/content/object/eid/1-s2.0-S2468823123007496-gr1_lrg.jpg?httpAccept=%2A%2F%2A",
            "@multimediatype": "JPEG image file",
            "@type": "IMAGE-HIGH-RES",
            "@size": "837975",
            "@ref": "gr1",
            "@mimetype": "image/jpeg"
          },
          {
            "@category": "high",
            "@height": "1178",
            "@width": "1500",
            "@_fa": "true",
            "$": "https://api.elsevier.com/content/object/eid/1-s2.0-S2468823123007496-gr2_lrg.jpg?httpAccept=%2A%2F%2A",
            "@multimediatype": "JPEG image file",
            "@type": "IMAGE-HIGH-RES",
            "@size": "324273",
            "@ref": "gr2",
            "@mimetype": "image/jpeg"
          },
          {
            "@category": "high",
            "@height": "1338",
            "@width": "3500",
            "@_fa": "true",
            "$": "https://api.elsevier.com/content/object/eid/1-s2.0-S2468823123007496-gr5_lrg.jpg?httpAccept=%2A%2F%2A",
            "@multimediatype": "JPEG image file",
            "@type": "IMAGE-HIGH-RES",
            "@size": "957603",
            "@ref": "gr5",
            "@mimetype": "image/jpeg"
          },
          {
            "@category": "high",
            "@height": "1922",
            "@width": "3500",
            "@_fa": "true",
            "$": "https://api.elsevier.com/content/object/eid/1-s2.0-S2468823123007496-gr6_lrg.jpg?httpAccept=%2A%2F%2A",
            "@multimediatype": "JPEG image file",
            "@type": "IMAGE-HIGH-RES",
            "@size": "791747",
            "@ref": "gr6",
            "@mimetype": "image/jpeg"
          },
          {
            "@category": "high",
            "@height": "855",
            "@width": "1667",
            "@_fa": "true",
            "$": "https://api.elsevier.com/content/object/eid/1-s2.0-S2468823123007496-gr3_lrg.jpg?httpAccept=%2A%2F%2A",
            "@multimediatype": "JPEG image file",
            "@type": "IMAGE-HIGH-RES",
            "@size": "391088",
            "@ref": "gr3",
            "@mimetype": "image/jpeg"
          },
          {
            "@category": "high",
            "@height": "1295",
            "@width": "2917",
            "@_fa": "true",
            "$": "https://api.elsevier.com/content/object/eid/1-s2.0-S2468823123007496-gr8_lrg.jpg?httpAccept=%2A%2F%2A",
            "@multimediatype": "JPEG image file",
            "@type": "IMAGE-HIGH-RES",
            "@size": "358259",
            "@ref": "gr8",
            "@mimetype": "image/jpeg"
          },
          {
            "@category": "high",
            "@height": "1128",
            "@width": "2917",
            "@_fa": "true",
            "$": "https://api.elsevier.com/content/object/eid/1-s2.0-S2468823123007496-gr10_lrg.jpg?httpAccept=%2A%2F%2A",
            "@multimediatype": "JPEG image file",
            "@type": "IMAGE-HIGH-RES",
            "@size": "397373",
            "@ref": "gr10",
            "@mimetype": "image/jpeg"
          },
          {
            "@category": "high",
            "@height": "886",
            "@width": "1356",
            "@_fa": "true",
            "$": "https://api.elsevier.com/content/object/eid/1-s2.0-S2468823123007496-ga1_lrg.jpg?httpAccept=%2A%2F%2A",
            "@multimediatype": "JPEG image file",
            "@type": "IMAGE-HIGH-RES",
            "@size": "133143",
            "@ref": "ga1",
            "@mimetype": "image/jpeg"
          },
          {
            "@category": "high",
            "@height": "1093",
            "@width": "1667",
            "@_fa": "true",
            "$": "https://api.elsevier.com/content/object/eid/1-s2.0-S2468823123007496-gr13_lrg.jpg?httpAccept=%2A%2F%2A",
            "@multimediatype": "JPEG image file",
            "@type": "IMAGE-HIGH-RES",
            "@size": "190788",
            "@ref": "gr13",
            "@mimetype": "image/jpeg"
          },
          {
            "@category": "thumbnail",
            "@_fa": "true",
            "$": "https://api.elsevier.com/content/object/eid/1-s2.0-S2468823123007496-si1.svg?httpAccept=%2A%2F%2A",
            "@multimediatype": "Scalable Vector Graphics file",
            "@type": "ALTIMG",
            "@size": "15610",
            "@ref": "si1",
            "@mimetype": "image/svg+xml"
          },
          {
            "@category": "thumbnail",
            "@_fa": "true",
            "$": "https://api.elsevier.com/content/object/eid/1-s2.0-S2468823123007496-si2.svg?httpAccept=%2A%2F%2A",
            "@multimediatype": "Scalable Vector Graphics file",
            "@type": "ALTIMG",
            "@size": "19926",
            "@ref": "si2",
            "@mimetype": "image/svg+xml"
          },
          {
            "@category": "thumbnail",
            "@_fa": "true",
            "$": "https://api.elsevier.com/content/object/eid/1-s2.0-S2468823123007496-si3.svg?httpAccept=%2A%2F%2A",
            "@multimediatype": "Scalable Vector Graphics file",
            "@type": "ALTIMG",
            "@size": "11373",
            "@ref": "si3",
            "@mimetype": "image/svg+xml"
          },
          {
            "@category": "thumbnail",
            "@_fa": "true",
            "$": "https://api.elsevier.com/content/object/eid/1-s2.0-S2468823123007496-si4.svg?httpAccept=%2A%2F%2A",
            "@multimediatype": "Scalable Vector Graphics file",
            "@type": "ALTIMG",
            "@size": "13905",
            "@ref": "si4",
            "@mimetype": "image/svg+xml"
          },
          {
            "@category": "thumbnail",
            "@_fa": "true",
            "$": "https://api.elsevier.com/content/object/eid/1-s2.0-S2468823123007496-si5.svg?httpAccept=%2A%2F%2A",
            "@multimediatype": "Scalable Vector Graphics file",
            "@type": "ALTIMG",
            "@size": "10055",
            "@ref": "si5",
            "@mimetype": "image/svg+xml"
          },
          {
            "@category": "thumbnail",
            "@_fa": "true",
            "$": "https://api.elsevier.com/content/object/eid/1-s2.0-S2468823123007496-si6.svg?httpAccept=%2A%2F%2A",
            "@multimediatype": "Scalable Vector Graphics file",
            "@type": "ALTIMG",
            "@size": "7545",
            "@ref": "si6",
            "@mimetype": "image/svg+xml"
          },
          {
            "@category": "thumbnail",
            "@_fa": "true",
            "$": "https://api.elsevier.com/content/object/eid/1-s2.0-S2468823123007496-si7.svg?httpAccept=%2A%2F%2A",
            "@multimediatype": "Scalable Vector Graphics file",
            "@type": "ALTIMG",
            "@size": "7193",
            "@ref": "si7",
            "@mimetype": "image/svg+xml"
          },
          {
            "@category": "thumbnail",
            "@_fa": "true",
            "$": "https://api.elsevier.com/content/object/eid/1-s2.0-S2468823123007496-si8.svg?httpAccept=%2A%2F%2A",
            "@multimediatype": "Scalable Vector Graphics file",
            "@type": "ALTIMG",
            "@size": "4121",
            "@ref": "si8",
            "@mimetype": "image/svg+xml"
          },
          {
            "@category": "standard",
            "@_fa": "true",
            "$": "https://api.elsevier.com/content/object/eid/1-s2.0-S2468823123007496-am.pdf?httpAccept=%2A%2F%2A",
            "@multimediatype": "Acrobat PDF file",
            "@type": "AAM-PDF",
            "@size": "3203938",
            "@ref": "am",
            "@mimetype": "application/pdf"
          }
        ]
      },
      "link": {
        "@rel": "abstract",
        "@href": "https://api.elsevier.com/content/abstract/scopus_id/85175353356"
      }
    }
  }
}