{
  "metadata": {
    "title": "Effects of the preparation methods of Co<ce:inf loc=post>3</ce:inf>O<ce:inf loc=post>4</ce:inf> catalysts on catalytic oxidization performance toward o-xylene",
    "authors": "; ; ",
    "journal": "Molecular Catalysis",
    "date": "2025-05-15",
    "doi": "10.1016/j.mcat.2025.115095",
    "abstract": "",
    "uri": "https://api.elsevier.com/content/article/pii/S2468823125002810",
    "pii": "S2468823125002810"
  },
  "fulltext": {
    "full-text-retrieval-response": {
      "scopus-eid": "2-s2.0-105001730447",
      "originalText": "serial JL 315758 291210 291744 291790 291809 31 Molecular Catalysis MOLECULARCATALYSIS 2025-04-04 2025-04-04 2025-04-04 2025-04-04 2025-04-12T03:56:21 1-s2.0-S2468823125002810 S2468-8231(25)00281-0 S2468823125002810 10.1016/j.mcat.2025.115095 S300 S300.1 FULL-TEXT 1-s2.0-S2468823125X00067 2025-04-12T03:20:31.455648Z 0 0 20250515 2025 2025-04-04T12:57:03.529734Z absattachment articleinfo articlenumber articletitlenorm authfirstinitialnorm authfirstsurnamenorm cid cids contenttype copyright crossmark dateloaded dateloadedtxt datesearch datesort dateupdated dco docsubtype doctype doi eid ewtransactionid hubeid indexeddate issn issnnorm itemstage itemtransactionid itemweight openaccess openarchive pg pgfirst pii piinorm pubdatestart pubdatetxt pubyr sectiontitle sortorder srctitle srctitlenorm srctype ssids alllist content subj subheadings suppl tomb volfirst volissue volumelist webpdf webpdfpagecount yearnav figure table e-component body mmlmath acknowledge affil appendices articletitle auth authfirstini authfull authkeywords authlast grantnumber grantsponsor highlightsabst orcid primabst pubtype ref specialabst 2468-8231 24688231 true 579 579 C Volume 579 42 115095 115095 115095 20250515 15 May 2025 2025-05-15 2025 Regular Papers article fla © 2025 Elsevier B.V. All rights are reserved, including those for text and data mining, AI training, and similar technologies. EFFECTSPREPARATIONMETHODSCO3O4CATALYSTSCATALYTICOXIDIZATIONPERFORMANCETOWARDOXYLENE YANG Z 1 Introduction 2 Materials and methods 2.1 Catalyst preparation 2.2 Catalyst characterization 2.3 Evaluation of catalyst activity 3 Results and discussion 3.1 Catalytic oxidation of o-xylene 3.2 Morphology, crystalline phase and specific surface area 3.3 Chemical valence 3.4 Redox ability 3.5 In situ DRIFTS study 3.6 Proposed reaction mechanism 4 Conclusions CRediT authorship contribution statement Acknowledgements Appendix Supplementary materials References MA 2021 6614 6625 Y MEI 2022 133442 J WANG 2017 419 429 F LIU 2024 209 229 W BAI 2013 677 683 B WANG 2013 72 79 Y WANG 2017 16128 16137 K GILBARBARIN 2023 109841 A XIA 2009 8355 8360 Y XIE 2009 746 749 X MA 2010 2469 2846 C KRUK 2001 3169 3183 M ZHANG 2023 22301 22310 J YU 2009 121 128 Y SOLSONA 2008 176 184 B TENG 2011 133 140 F CHAGAS 2016 139 145 C CHEN 2015 1653 1662 S HUAN 2019 656 663 W ESCALANTE 2024 114575 Y MONTEMORE 2018 2816 2862 M LI 2019 117191 J WANG 2017 1626 1636 X WANG 2024 7662 7671 H ARANDIYAN 2018 3429 3434 H ZHONG 2020 121957 J ZHONG 2020 125375 J LUO 2008 310 324 J CHEN 2022 129109 Y SUN 2015 58 65 H YANG 2018 730 739 X YANGX2025X115095 YANGX2025X115095XZ 2027-04-04T00:00:00.000Z 2027-04-04T00:00:00.000Z http://creativecommons.org/licenses/by-nc-nd/4.0/ © 2025 Elsevier B.V. All rights are reserved, including those for text and data mining, AI training, and similar technologies. 2025-04-08T02:42:57.316Z http://vtw.elsevier.com/data/voc/AddOnTypes/50.7/aggregated-refined National Natural Science Foundation of China 52470114 National Natural Science Foundation of China http://data.elsevier.com/vocabulary/SciValFunders/501100001809 http://sws.geonames.org/1814991 This work was supported by the National Natural Science Foundation of China (No. 52470114). https://doi.org/10.15223/policy-017 https://doi.org/10.15223/policy-037 https://doi.org/10.15223/policy-012 https://doi.org/10.15223/policy-029 https://doi.org/10.15223/policy-004 item S2468-8231(25)00281-0 S2468823125002810 1-s2.0-S2468823125002810 10.1016/j.mcat.2025.115095 315758 2025-04-12T03:20:31.455648Z 2025-05-15 1-s2.0-S2468823125002810-main.pdf https://s3-eu-west-1.amazonaws.com/prod-ucs-content-store-eu-west/content/pii:S2468823125002810/MAIN/application/pdf/437ce8c7973f63fbaffa95a2c6407514/main.pdf main.pdf pdf true 8097822 MAIN 9 1-s2.0-S2468823125002810-main_1.png https://s3-eu-west-1.amazonaws.com/prod-ucs-content-store-eu-west/content/pii:S2468823125002810/PREVIEW/image/png/23964b979863385e6a638a09a337ca48/main_1.png main_1.png png 59514 849 656 IMAGE-WEB-PDF 1 1-s2.0-S2468823125002810-gr6.jpg https://s3-eu-west-1.amazonaws.com/prod-ucs-content-store-eu-west/content/pii:S2468823125002810/gr6/DOWNSAMPLED/image/jpeg/c092aed52e127f5b34721aa8d0517adc/gr6.jpg gr6 gr6.jpg jpg 97420 728 565 IMAGE-DOWNSAMPLED 1-s2.0-S2468823125002810-gr7.jpg https://s3-eu-west-1.amazonaws.com/prod-ucs-content-store-eu-west/content/pii:S2468823125002810/gr7/DOWNSAMPLED/image/jpeg/03823d36d15a59e24cb95dae2ff106cc/gr7.jpg gr7 gr7.jpg jpg 60282 379 565 IMAGE-DOWNSAMPLED 1-s2.0-S2468823125002810-gr8.jpg https://s3-eu-west-1.amazonaws.com/prod-ucs-content-store-eu-west/content/pii:S2468823125002810/gr8/DOWNSAMPLED/image/jpeg/b50d32a5fd72423dd4bfc17031a6fc82/gr8.jpg gr8 gr8.jpg jpg 98200 491 565 IMAGE-DOWNSAMPLED 1-s2.0-S2468823125002810-gr9.jpg https://s3-eu-west-1.amazonaws.com/prod-ucs-content-store-eu-west/content/pii:S2468823125002810/gr9/DOWNSAMPLED/image/jpeg/f4e24e84a33b2589663b6447a4a63904/gr9.jpg gr9 gr9.jpg jpg 25703 248 508 IMAGE-DOWNSAMPLED 1-s2.0-S2468823125002810-gr2.jpg https://s3-eu-west-1.amazonaws.com/prod-ucs-content-store-eu-west/content/pii:S2468823125002810/gr2/DOWNSAMPLED/image/jpeg/2c83ef15155b2928849d1cd901af5481/gr2.jpg gr2 gr2.jpg jpg 44704 223 565 IMAGE-DOWNSAMPLED 1-s2.0-S2468823125002810-ga1.jpg https://s3-eu-west-1.amazonaws.com/prod-ucs-content-store-eu-west/content/pii:S2468823125002810/ga1/DOWNSAMPLED/image/jpeg/fa5185a3a35cad446a66f9160bf5ca8e/ga1.jpg ga1 true ga1.jpg jpg 32720 200 409 IMAGE-DOWNSAMPLED 1-s2.0-S2468823125002810-gr3.jpg https://s3-eu-west-1.amazonaws.com/prod-ucs-content-store-eu-west/content/pii:S2468823125002810/gr3/DOWNSAMPLED/image/jpeg/92f6dbb13fd31ea23fb5935ad8062b4e/gr3.jpg gr3 gr3.jpg jpg 249541 998 692 IMAGE-DOWNSAMPLED 1-s2.0-S2468823125002810-gr4.jpg https://s3-eu-west-1.amazonaws.com/prod-ucs-content-store-eu-west/content/pii:S2468823125002810/gr4/DOWNSAMPLED/image/jpeg/00b568f602daee308741eff4e14a0ec5/gr4.jpg gr4 gr4.jpg jpg 46127 325 376 IMAGE-DOWNSAMPLED 1-s2.0-S2468823125002810-gr5.jpg https://s3-eu-west-1.amazonaws.com/prod-ucs-content-store-eu-west/content/pii:S2468823125002810/gr5/DOWNSAMPLED/image/jpeg/3dd3f9e01d2ebb21dee25389dd811559/gr5.jpg gr5 gr5.jpg jpg 43055 219 565 IMAGE-DOWNSAMPLED 1-s2.0-S2468823125002810-gr1.jpg https://s3-eu-west-1.amazonaws.com/prod-ucs-content-store-eu-west/content/pii:S2468823125002810/gr1/DOWNSAMPLED/image/jpeg/740f0663566514904e804af6be8e2c79/gr1.jpg gr1 gr1.jpg jpg 45482 323 565 IMAGE-DOWNSAMPLED 1-s2.0-S2468823125002810-gr6.sml https://s3-eu-west-1.amazonaws.com/prod-ucs-content-store-eu-west/content/pii:S2468823125002810/gr6/THUMBNAIL/image/gif/0e0e14e4f02c47937e32dc0b4bcc92b0/gr6.sml gr6 gr6.sml sml 9685 164 127 IMAGE-THUMBNAIL 1-s2.0-S2468823125002810-gr7.sml https://s3-eu-west-1.amazonaws.com/prod-ucs-content-store-eu-west/content/pii:S2468823125002810/gr7/THUMBNAIL/image/gif/186153213118f9a951d0682084d76873/gr7.sml gr7 gr7.sml sml 10527 147 219 IMAGE-THUMBNAIL 1-s2.0-S2468823125002810-gr8.sml https://s3-eu-west-1.amazonaws.com/prod-ucs-content-store-eu-west/content/pii:S2468823125002810/gr8/THUMBNAIL/image/gif/419fe5267a9f85ee87f8f403c55631fe/gr8.sml gr8 gr8.sml sml 14745 164 189 IMAGE-THUMBNAIL 1-s2.0-S2468823125002810-gr9.sml https://s3-eu-west-1.amazonaws.com/prod-ucs-content-store-eu-west/content/pii:S2468823125002810/gr9/THUMBNAIL/image/gif/af469488637440f075ca8302ab893459/gr9.sml gr9 gr9.sml sml 10833 107 219 IMAGE-THUMBNAIL 1-s2.0-S2468823125002810-gr2.sml https://s3-eu-west-1.amazonaws.com/prod-ucs-content-store-eu-west/content/pii:S2468823125002810/gr2/THUMBNAIL/image/gif/e9ce262236720e257e3dc353befee5f7/gr2.sml gr2 gr2.sml sml 8406 86 219 IMAGE-THUMBNAIL 1-s2.0-S2468823125002810-ga1.sml https://s3-eu-west-1.amazonaws.com/prod-ucs-content-store-eu-west/content/pii:S2468823125002810/ga1/THUMBNAIL/image/gif/83191ba75cfc566b96dd3495e9ac3bdc/ga1.sml ga1 true ga1.sml sml 11266 107 219 IMAGE-THUMBNAIL 1-s2.0-S2468823125002810-gr3.sml https://s3-eu-west-1.amazonaws.com/prod-ucs-content-store-eu-west/content/pii:S2468823125002810/gr3/THUMBNAIL/image/gif/83ee9907e15576e7822d20c7d4761a5f/gr3.sml gr3 gr3.sml sml 11636 163 113 IMAGE-THUMBNAIL 1-s2.0-S2468823125002810-gr4.sml https://s3-eu-west-1.amazonaws.com/prod-ucs-content-store-eu-west/content/pii:S2468823125002810/gr4/THUMBNAIL/image/gif/ae4050a13613878c54b1dc68004469f4/gr4.sml gr4 gr4.sml sml 12314 164 190 IMAGE-THUMBNAIL 1-s2.0-S2468823125002810-gr5.sml https://s3-eu-west-1.amazonaws.com/prod-ucs-content-store-eu-west/content/pii:S2468823125002810/gr5/THUMBNAIL/image/gif/dd5eac3a4cbfc7ebdf5f4d5b2943ac4c/gr5.sml gr5 gr5.sml sml 8428 85 219 IMAGE-THUMBNAIL 1-s2.0-S2468823125002810-gr1.sml https://s3-eu-west-1.amazonaws.com/prod-ucs-content-store-eu-west/content/pii:S2468823125002457/gr1/THUMBNAIL/image/gif/dc0750d226ce0ac150312cbb3f2639fe/gr1.sml gr1 gr1.sml sml 14332 125 219 IMAGE-THUMBNAIL 1-s2.0-S2468823125002810-gr6_lrg.jpg https://s3-eu-west-1.amazonaws.com/prod-ucs-content-store-eu-west/content/pii:S2468823125002810/HIGHRES/image/jpeg/9d492efe3d9fe23cb1280c2115f43414/gr6_lrg.jpg gr6 gr6_lrg.jpg jpg 636120 3221 2500 IMAGE-HIGH-RES 1-s2.0-S2468823125002810-gr7_lrg.jpg https://s3-eu-west-1.amazonaws.com/prod-ucs-content-store-eu-west/content/pii:S2468823125002810/HIGHRES/image/jpeg/0862cda91ed0dbed4666f02192564342/gr7_lrg.jpg gr7 gr7_lrg.jpg jpg 328363 1675 2500 IMAGE-HIGH-RES 1-s2.0-S2468823125002810-gr8_lrg.jpg https://s3-eu-west-1.amazonaws.com/prod-ucs-content-store-eu-west/content/pii:S2468823125002810/HIGHRES/image/jpeg/2a29749886f535b8412bc7ed22ae0f7f/gr8_lrg.jpg gr8 gr8_lrg.jpg jpg 605876 2171 2500 IMAGE-HIGH-RES 1-s2.0-S2468823125002810-gr9_lrg.jpg https://s3-eu-west-1.amazonaws.com/prod-ucs-content-store-eu-west/content/pii:S2468823125002810/HIGHRES/image/jpeg/ad1f3028e9e7a54931ee666f8d9de81a/gr9_lrg.jpg gr9 gr9_lrg.jpg jpg 176567 1100 2250 IMAGE-HIGH-RES 1-s2.0-S2468823125002810-gr2_lrg.jpg https://s3-eu-west-1.amazonaws.com/prod-ucs-content-store-eu-west/content/pii:S2468823125002810/HIGHRES/image/jpeg/514fdaedb2f538e844fc2a46a48399b9/gr2_lrg.jpg gr2 gr2_lrg.jpg jpg 237291 986 2500 IMAGE-HIGH-RES 1-s2.0-S2468823125002810-ga1_lrg.jpg https://s3-eu-west-1.amazonaws.com/prod-ucs-content-store-eu-west/content/pii:S2468823125002810/HIGHRES/image/jpeg/4ab518a227239c855ddf2ba938bbc05a/ga1_lrg.jpg ga1 true ga1_lrg.jpg jpg 211227 886 1811 IMAGE-HIGH-RES 1-s2.0-S2468823125002810-gr3_lrg.jpg https://s3-eu-west-1.amazonaws.com/prod-ucs-content-store-eu-west/content/pii:S2468823125002457/HIGHRES/image/jpeg/4f98ed1ee6c543d22223bd05484e0100/gr3_lrg.jpg gr3 gr3_lrg.jpg jpg 2474968 4417 3064 IMAGE-HIGH-RES 1-s2.0-S2468823125002810-gr4_lrg.jpg https://s3-eu-west-1.amazonaws.com/prod-ucs-content-store-eu-west/content/pii:S2468823125002810/HIGHRES/image/jpeg/e2cddcf35bbe3ceb8acc57c99217d36a/gr4_lrg.jpg gr4 gr4_lrg.jpg jpg 301019 1439 1667 IMAGE-HIGH-RES 1-s2.0-S2468823125002810-gr5_lrg.jpg https://s3-eu-west-1.amazonaws.com/prod-ucs-content-store-eu-west/content/pii:S2468823125002457/HIGHRES/image/jpeg/fa1bb54ca9aff019d16acff11730c7cc/gr5_lrg.jpg gr5 gr5_lrg.jpg jpg 245355 970 2500 IMAGE-HIGH-RES 1-s2.0-S2468823125002810-gr1_lrg.jpg https://s3-eu-west-1.amazonaws.com/prod-ucs-content-store-eu-west/content/pii:S2468823125002457/HIGHRES/image/jpeg/a006a98a77fd1838b7063a4475bac355/gr1_lrg.jpg gr1 gr1_lrg.jpg jpg 304769 1429 2500 IMAGE-HIGH-RES 1-s2.0-S2468823125002810-mmc1.docx https://s3-eu-west-1.amazonaws.com/prod-ucs-content-store-eu-west/content/pii:S2468823125002810/mmc1/MAIN/application/vnd.openxmlformats-officedocument.wordprocessingml.document/101d0e121a7d779389ffa18306413eb4/mmc1.docx mmc1 mmc1.docx docx 586806 APPLICATION 1-s2.0-S2468823125002810-si1.svg https://s3-eu-west-1.amazonaws.com/prod-ucs-content-store-eu-west/content/pii:S2468823125002810/image/svg+xml/bdf7284b4624a85046cfeb1a749e9b18/si1.svg si1 si1.svg svg 5676 ALTIMG 1-s2.0-S2468823125002810-si2.svg https://s3-eu-west-1.amazonaws.com/prod-ucs-content-store-eu-west/content/pii:S2468823125002810/image/svg+xml/6641fffceee534bbb0567bec37748319/si2.svg si2 si2.svg svg 13738 ALTIMG 1-s2.0-S2468823125002810-si3.svg https://s3-eu-west-1.amazonaws.com/prod-ucs-content-store-eu-west/content/pii:S2468823125002810/image/svg+xml/23199358fef4b52931cf70eeb892a80c/si3.svg si3 si3.svg svg 6506 ALTIMG 1-s2.0-S2468823125002810-si4.svg https://s3-eu-west-1.amazonaws.com/prod-ucs-content-store-eu-west/content/pii:S2468823125002810/image/svg+xml/b558d634a32b443cf95d0873cc3fe049/si4.svg si4 si4.svg svg 7180 ALTIMG MCAT 115095 115095 S2468-8231(25)00281-0 10.1016/j.mcat.2025.115095 Elsevier B.V. Fig. 1 Schematic diagram of experimental set-up (a. O2, b. N2, c. Mass Flow Controllers, d. Stop Valve, e. Anti-suckback Device, f. Gas-blowing Device, g. Reactor, h. Gas Chromatographyas, i. (Computer) Workstation, j. Temperature Controller and k. Fiberglass Heating Tape). Fig 1 Fig. 2 Conversion of o-xylene as a function of reaction temperature over the Co3O4 catalysts with (a) Na2CO3 and (b) CH4N2O as precipitant (Reaction conditions: 50 ppm o-xylene, 20 % O2, 15 % H2O, GHSV 60,000 mL/(g·hr)). Fig 2 Fig. 3 Shows (A-F) TEM images, (A´-F´) HRTEM, and the size distribution of Co3O4 nanoparticles (A´´-F´´). Fig 3 Fig. 4 XRD patterns of the synthesized Co3O4 samples. Fig 4 Fig. 5 N2 adsorption–desorption isotherms of the Co3O4 catalysts with (a) Na2CO3 and (b) CH4N2O as precipitant at different calcination temperatures. Fig 5 Fig. 6 (a) O 1 s and (b) Co 2p XPS spectra of Co3O4 catalysts with CH4N2O as precipitant and (c) O 1 s and (d) Co 2p XPS spectra of Co3O4 catalysts Na2CO3 as precipitant. Fig 6 Fig. 7 H2-TPR profiles of the Co3O4 catalysts with (a) Na2CO3 and (b) CH4N2O as precipitant at different calcination temperatures. Fig 7 Fig. 8 The in situ DRIFTS spectra of (a) CO and (b) o-xylene on Co3O4 catalysts during the heating process with Na2CO3 as precipitant, and (c) CO and (d) o-xylene on Co3O4 catalysts during the heating process with CH4N2O as precipitant. Fig 8 Fig. 9 The proposed reaction mechanisms for o-xylene oxidation over different Co3O4 catalysts. Fig 9 Table 1 Crystallite size and textural properties on the as-synthesized Co3O4 catalysts. Table 1 Sample Surface area (m2 g−1) Pore volume (cm3 g−1) XRD a (nm) TEM b (nm) Na2CO3-300 °C 63.0 0.34 14.6 ± 2.6 13.5 ± 3.8 Na2CO3-400 °C 39.4 0.28 17.2 ± 1.9 16.7 ± 4.5 Na2CO3-500 °C 24.2 0.13 24.9 ± 5.6 25.8 ± 8.3 CH4N2O-300 °C 52.6 0.24 17.4 ± 1.1 16.8 ± 5.5 CH4N2O-400 °C 28.0 0.19 27.5 ± 3.5 27.2 ± 7.2 CH4N2O-500 °C 14.9 0.12 42.5 ± 8.9 43.8 ± 11.6 a Data was determined based on the XRD results according to the Scherrer equation using the full width at half maxima (FWHM)of the (311) line of Co3O4. b Estimated according to the TEM images. Table 2 XPS results for the Co 2p and O 1 s of Co3O4 catalysts prepared at different calcination temperatures. Table 2 Samples Co3+/(Co3++Co2+) Oads/(Oads+Olatt) Co3O4 N-300 °C 0.53 0.55 Co3O4 N-400 °C 0.51 0.51 Co3O4 N-500 °C 0.48 0.49 Co3O4 C-300 °C 0.54 0.60 Co3O4 C-400 °C 0.52 0.56 Co3O4 C-500 °C 0.50 0.52 Table 3 Hydrogen consumption per unit of sample obtained from H2-TPR result. Table 3 Samples Hydrogen consumption (mmol∙g−1) Na2CO3-300 °C 1.229 Na2CO3-400 °C 1.217 Na2CO3-500 °C 1.122 CH4N2O-300 °C 1.134 CH4N2O-400 °C 1.117 CH4N2O-500 °C 1.010 Research Paper Effects of the preparation methods of Co3O4 catalysts on catalytic oxidization performance toward o-xylene Zeyu Yang Writing – review & editing Writing – original draft Methodology Investigation Formal analysis Data curation a Qianqian Qi Methodology Data curation a Mingyu Fan Data curation a Yafei Wang Supervision Project administration Funding acquisition Conceptualization a ⁎ Li Tong Writing – review & editing Investigation Data curation b ⁎ a Beijing Institute of Petrochemical Technology, Beijing 102617, PR China Beijing Institute of Petrochemical Technology Beijing 102617 PR China aBeijing Institute of Petrochemical Technology, Beijing 102617, PR China b Institute of Urban Safety and Environmental Science, Beijing Academy of Science and Technology, Beijing 100054, PR China Institute of Urban Safety and Environmental Science Beijing Academy of Science and Technology Beijing 100054 PR China bInstitute of Urban Safety and Environmental Science, Beijing Academy of Science and Technology, Beijing 100054, PR China ⁎ Corresponding authors. The Co3O4 catalysts with different precursors (Na2CO3, CH4N2O) were synthesized and evaluated for its o-xylene catalytic oxidation performance. A series of techniques including BET, XRD, TEM, XPS, H2-TPR were employed to characterize the physical and chemical properties of catalysts under various preparation conditions. The results indicated that physisorption played an important role in the o-xylene removal and higher calcination temperature destructed the specific surface areas of the Co3O4 samples. The enhanced catalytic performance of Co3O4 N catalyst was mainly attributed to be abundance in active Co3+ and lattice oxygen species, while that of Co3O4 C catalyst was ascribed to the formation of superoxide anion, especially the lower calcination temperature facilitated the generation of active species. In addition, the reaction mechanisms toward o-xylene oxidation over Co3O4 catalysts obtained by different preparation methods were explored in detail. The o-xylene molecule preferentially adsorbed onto the Co3+ ion sites, and was further oxidized by the lattice oxygen or superoxide anion with the product being o-methyl benzyl alcohol. Soon the benzyl alcohol was transformed into the o-methyl benzaldehyde, and afterward to form benzoic acid. Later, the benzoic acid was converted into small-molecule carboxylate for Co3O4 N catalyst, whereas for Co3O4 C catalysts, the benzoic acid was further turned into maleic acid subsequently into acetone. Finally, both the small-molecule carboxylate and acetone species were oxidized to CO2 and H2O. This finding offers some valuable insights for designing efficient o-xylene oxidation catalysts and mitigating industrial air pollution. Graphical abstract Image, graphical abstract Keywords O-xylene Co3O4 Preparation method Catalytic oxidation Reaction mechanism Data availability Data will be made available on request. 1 Introduction Volatile organic compounds (VOCs) are a class of organic compounds with a boiling point of 50 ∼ 260 °C at atmospheric pressure and room temperature. These VOCs, especially BTX (benzene, toluene, and xylene), could not only induce a variety of diseases, and also participate in the formation of ozone and photochemical smog formation [1]. Among the three types of BTX substances, the degradation of o-xylene is more difficult because of the spatial site resistance of the bis-methyl group [2]. Therefore, there are urgent requirements to develop effective o-xylene treatment methods. Catalytic oxidation is considered the most economically effective method for treating VOCs due to its reduction of reaction activation energy and generation of non-toxic products—H2O and CO2 [3,4]. Transition metal oxides have gradually substituted noble metals owing to their high oxidizing capacity, low price, not prone to poisoning or sintered [1]. Cobalt oxide (Co3O4), a spinel-structure oxide with one Co2+ tetrahedron and two Co3+ octahedrons in coordination, are widely used in the catalytic oxidation of VOCs and shows high activity [1]. Bai et al. [5] had synthesized nano-Co3O4, 2D-Co3O4, and 3D-Co3O4 catalysts, respectively and found out that 3D-Co3O4 catalysts vis the hard template method performed the best catalytic activity for formaldehyde due to the clear channel structure, larger specific surface area, abundant active Co3+ ions as well as the active surface oxygen. Asimilar finding was reported by Wang et al., who studied ordered mesoporous Co3O4 supported palladium catalysts for the oxidation of o-xylene and pointed out that the good catalytic performance of Pd/porous Co3O4 was related to the particle size of palladium, the species of palladium oxide and the oxygen vacancy in Co3O4 [6]. Wang et al. [7] reported a facile solvent-free reaction process to prepare Co3O4-octahedrons, -plates, and -rods, and the Co3+ cations were verified as the active sites for CO oxidation. Gil-Barbarin et al. [8] structured Co3O4 catalysts with hollow nanotube morphology through the Kirkendall effect, which exhibited highly active for C2-chlorinated VOCs due to the formation of a large number of oxygen-vacancy defects. It is thereby an urgent demand, but it is still a momentous challenge to obtain a deeper fundamental understanding of catalytic oxidation mechanisms by establishing a correlation between the performance and the corresponding surface properties over Co3O4 catalyst. Based on the above-mentioned statement, this work focuses on the differences in the catalytic oxidation of o-xylene by Co3O4 catalysts obtained by two different homogeneous precipitation methods. O-xylene was selected as the target pollutant for catalytic oxidation performance evaluation. The relationship between the structure and performance, including critical role of morphology, specific surface area, reducing power, the valence state of Co, and the number of active oxygen species of Co3O4 in enhanced catalytic oxidation, was further revealed through a comparative study of Co3O4 catalysts prepared under various conditions via a series of designed experiments. Furthermore, the deeper mechanisms of the enhanced catalytic oxidation performance toward o-xylene over different Co3O4 catalysts were finally proposed. 2 Materials and methods 2.1 Catalyst preparation The Co(NO3)2·6H2O reagents in this study were purchased from Macklin Corporation (Shanghai, China). 17.46 g Co(NO3)2·6H2O were dissolved in 150 mL deionized water under stirring to form a clear solution at 50 °C. Subsequently, Na2CO3 solution (150 mL) was introduced into this solution, which was then stirred for an additional 3 h. After that, the mixture was filtered, washed with deionized water, and dried at 100 °C for 12 h. After naturally cooling down to room temperature (RT), the samples were calcined in static air at a heating ramp of 5 °C·min−1 from RT to 300 °C/400 °C/500 °C and maintained at the target temperature for 6 h. The obtained samples were coded as Co3O4 N-T, where T refers to the calcination temperature. 17.46 g Co(NO3)2·6H2O were dissolved in 150 mL deionized water under stirring to form a clear solution at 80 °C. CH4N2O solution (150 mL, excessive precipitation) was added to the above solution. Then, the resulting solution was continuously stirred for 12 h. After that, the mixture was filtered, washed with deionized water, and dried at 100 °C for 12 h. After naturally cooling down to RT, the products were calcined in static air at a heating ramp of 5 °C min−1 from RT to 300 °C/400 °C/500 °C and maintained at the target temperature for 6 h. The obtained samples were named Co3O4 C-T, where T refers to the calcination temperature. 2.2 Catalyst characterization X-ray diffraction(XRD) was used to identify the crystalline phase present in the catalysts. X-ray diffractometer (D8 Advance, Bruker, Germany) with monochromatic Cu Kα source operated at 40 kV and 40 mA was used in the diffraction angle range (10∼90°) at a scan rate of 6° min−1. A transmission electron microscopy (TEM) (JEM-2100, JEOL, Japan) was used for obtaining the images for particle size. The catalysts' specific surface areas and pore volumes were measured using an N2 physical adsorption apparatus (QuadraSorb SI, Quantachrome, USA). Hydrogen temperature-programmed reduction(H2-TPR)was performed by automatic chemical adsorption instrument (BELCAT II, MicrotracBEL, Japan). During the operation of H2-TPR, 50 mg samples in a three-layer tubular reactor were heated to 300 °C at the rate of 10 °C min−1 in Ar (50 mL min−1) for 30 min, then sustained for 20 min after being cooled to RT with Ar (50 mL min−1). Then, the temperature was increased to 750 °C with 5 % H2/Ar (30 mL min−1) at 10 °C min−1. Consumption of H2 was recorded by the Thermal Conductivity Detector (TCD) after the water was removed by a cooling trap. In-situ DRIFTS spectra of CO or o-xylene oxidation without O2 were measured on a Nicolet IS 50 spectrometer. Typically, a 50 mg sample without diluents was placed into the DRIFTS cell, flushed with N2 at 30 °C for 1 h and a reference spectrum was taken. During the CO or o-xylene adsorption, the sample was exposed to 1000 ppm CO or 100 ppm o-xylene gas flow for 0.5 h. Then the DRIFTS spectra were subsequently collected by accumulating 128 scans in the temperature range from 25 to 150 °C (CO) or 250 °C (o-xylene). 2.3 Evaluation of catalyst activity The catalytic oxidation performance of o-xylene was tested in a fixed-bed micro-reactor evaluation unit (i.d. = 4.0 mm), as shown in Fig. 1 . The sealed bubbling bottle containing the o-xylene immersed in the water bath at about 4 °C was employed to provide a constant o-xylene concentration. The feed gas is composed of the oxygen and nitrogen. gas chromatograph (GC7820, Agilent, USA) with a Carbo PLOT P7 column and two flame ionization detectors (FID) monitors the outlet o-xylene concentration. In each run, 100 mg of catalyst (40–60mesh) was filled into a microreactor with the reactant feed composed of 50 ppm o-xylene, 20.0 vol % O2 and N2 (balance) in terms of flow rate at 100 mL/min. The gas hourly space velocity (GHSV) is calculated to be 60,000 mL/(g·hr). To prevent anomalous temperature fluctuations, the thermal insulation device was opened before the commencement of the reaction, and the mixed gas was injected over eight hours. Then, the resistance furnace heated slowly from room temperature to the target temperature at 5 °C·min−1. The catalyst activity was evaluated by measuring the peak area of o-xylene in different reaction temperatures (from 120 to 280 °C). The conversion of o-xylene ( η o − xylene ) was calculated in Eqs. (1) : (1) η o − y x l e n e = C o − x y l e n e , i n − C o − x y l e n e , o u t C o − x y l e n e , i n × 100 Where, C o − xylene , in (ppm) and C o − xylene , out (ppm) are the concentrations of o-xylene in the inlet and outlet gas, respectively. 3 Results and discussion 3.1 Catalytic oxidation of o-xylene Fig. 2 shows the catalytic performances of the Co3O4 catalysts toward o-xylene conversion as a function of reaction temperature with Na2CO3 and CH4N2O as precipitant, respectively. The 100 % o-xylene conversion(T100) was used to evaluate the catalytic performances. The catalytic performance for the oxidation of o-xylene over different catalysts follows the order: Na2CO3-300 °C>Na2CO3-400 °C>Na2CO3-500 °C, CH4N2O-300 °C>CH4N2O-400 °C>CH4N2O-500 °C. The Co3O4 C-300 °C catalyst exhibited the best activity, giving complete oxidation of 50 ppm o-xylene at 200 °C, whereas the T100 was 220 °C for Co3O4 N-300 °C catalyst. In addition, it was noteworthy that the water resistance of Co3O4 catalyst with CH4N2O as precipitant showed better water resisting property than that of Co3O4 with Na2CO3 as precipitant. 3.2 Morphology, crystalline phase and specific surface area To visualize the calcination temperature effect on Co3O4 catalysts, the Na2CO3 and CH4N2O as precipitant were investigated by TEM and HRTEM. As observed in Fig. 3 A´-F´ for the HRTEM images of catalysts of as-prepared Co3O4, the lattice fringe spacings are determined to be 0.244 nm, 0.286 nm, and 0.467 nm, corresponding to the (311), (220), and (111) planes of the Co3O4 crystals in the spinel phase, respectively [9]. Usually, the (111) crystal plane composed of Co2+ on nano-Co3O4 is believed not the active surface, while the (220) planes of the Co3O4 crystal is believed to be effective for the catalytic oxidation of CO, CH4 and VOCs [10]. That is probably because the (220) crystal planes are predominantly populated by abundant Co3+ species, and these exposed Co3+ ions on the (220) faces offer ample active sites for the oxidation reaction [10,11]. The reactant molecules diffuse in the pores and are activated by Co3+ in the (220) faces, consequently the amount of Co3+ in the (220) facet is critical for the oxidation performance [5]. Furthermore, >100 nanoparticles were measured for each sample and the results were statistically analysed. As illustrated in Table 1 , as the calcination temperature increased, the crystal size exhibited a gradual increase. This phenomenon could be attributed to the fact that as the calcination temperature rises, the nucleation rate rises as well, leading to an increase in particle aggregation and, consequently, an overall increase in the average particle size. Fig. 4 shows the XRD patterns of Co3O4 catalysts derived from different preparation methods. The characteristic diffraction peaks at 2θ values of 19.0°, 31.3°, 36.8°, 38.5°, 44.8°, 55.6°, 59.4°, and 65.2° are consistently observed across all the samples, which are assigned to the (111), (220), (311), (222), (400), (422), (511), and (440) planes of the Co3O4 spinel structure according to the Joint Committee on Powder Diffraction Standards (JCPDS No. 43–1003), and no peaks from other phase or impurity are detected. As depicted in Fig. 4, the intensities of the diffraction peaks become sharper and more pronounced with the calcination temperature increasing, especially evident in the peak at 31.3° This suggests that crystallite sizes and crystallinity improved as the calcination temperature rises, as inferred from the narrowing of the diffraction peaks as well. This result indicates that the smaller the particle size, the higher the catalytic activity, which is accordance with previous results [6]. The N2 adsorption-desorption isotherms of the different Co3O4 catalysts are illuminated in Fig. 5 . Type-IV isotherms of the adsorption curves of the catalysts confirmed the existence of mesopores [1]. As shown in Fig. 5, the other all the Co3O4 catalysts belonged to the H3 Hysteresis Loops representative of the particle-piled pores [12]. The specific surface areas (SSAs) of the synthesized catalysts are listed in Table 1. As can be seen, the Co3O4–300 °C catalyst exhibited the highest SSA, and the SSAs decreased as the calcination temperature increased for a same precursor. Physisorption theory assumed that larger SSA was beneficial for the mass transfer and gas molecule adsorption over the catalyst surface [13]. The apparent inhibition in o-xylene catalytical oxidation performance with SSA decreasing in Fig. 2 suggested that physisorption participated in the reaction of o-xylene removal over the Co3O4 samples. 3.3 Chemical valence The O 1 s and Co 2p XPS spectra were measured to verify their chemical valence states. As shown in Fig. 6 a, c, the peak of O 1 s were resolved into three peaks, including lattice oxygen (Olatt), surface adsorbed oxygen Oads (O2−, O2 2−, O−), and -OH. The value of Oads/(Oads+Olatt) ratio usually was indicative of the adsorbed reactive oxygen concentration on the catalyst surface, as listed in Table 2 . It can be seen that the Oads/(Oads+Olatt) ratio of Co3O4-x follows the order: Co3O4-300 °C>Co3O4-400 °C>Co3O4-500 °C, suggesting that as the increase of calcination temperature, the amount of reactive oxygen species adsorbed on the catalyst surface decreases. The peaks located at 777.5 ∼ 778.0 eV and 780.05 ∼ 780.35 eV is associated with Co3+ 2p3/2 and Co2+2p3/2, respectively. The other spin orbits located at 794.35–794.45 eV, could be attributed to Co3+2p1/2 and Co2+2p1/2, respectively. Therefore, the XPS profile of Co species over different catalysts did not change significantly, implying that the chemical state of Co species was almost the same [6]. As seen from Table 2, the Co3+/(Co3++Co2+) ratio gradually declined with the rise of calcination temperature. It was reported that the ion Co3+ is generally recognized as active adsorption site, so low-temperature calcination can help improve the catalytic activity of the catalyst [14]. 3.4 Redox ability The reducibility of all the Co3O4 nanomaterials was characterized by H2-TPR. As shown in Fig. 7 , there were two distinct H2 consumption peaks (designated as I and II) ranging from 200 to 600 °C, attributed to the reduction of Co3O4 to CoO (Co3+→Co2+) and CoO to cobalt (Co2+→Co0), respectively [15,16]. Obvious, the H2 consumption peaks shifted to the higher temperature as the calcination temperature increased, indicating that calcination at low temperature (300 °C) favored the reduction of Co3O4, thus showing the best catalytic performance toward o-xylene. The reduction capability of the Co3O4 catalysts were further quantified by integrating the peak area of H2-TPR profiles and then normalizing it to the mass of the sample. As detailed in Table 3 , the adsorbed hydrogen amount per unit mass of the catalyst decreased as the calcination temperature increased, demonstrating that the catalysts calcined at 300 °C exhibited the best reducibility. This might be because the low temperature roasting process can maintain a high specific surface area of the Co3O4 catalyst and was therefore more conducive to the loading of the active component [9]. 3.5 In situ DRIFTS study The in situ DRIFTS tests were performed to investigate the catalytic mechanism of o-xylene oxidation over Co3O4 catalysts at different reaction temperatures. Firstly, CO oxidation without O2 as a probe reaction was used to analyze the carbonate types further to reveal the reaction sites of Co3O4 [17]. It can be observed from Fig. 8 a that a weak peak band located at 1036 cm−1 appeared initially after CO inlet, which should be attributed to the ν1 vibration of monodentate carbonate species [18]. In addition, the peak bands at 1303 cm−1, 1346 cm−1, 1464 cm−1, 1773 cm−1, and 1578 cm−1 grew in with time on stream, which could be attributed to the ν3 vibrational splitting of bidentate carbonate species [19]. The gradual growth of bidentate carbonate species suggested that CO oxidation over the Co3O4 catalysts with Na2CO3 as a precipitant mainly occurred at the surface lattice oxygen sites with bidentate carbonates as intermediates. Due to confirmed by XPS characterization results that more lattice oxygen existed in the Co3O4 N, the potential reaction pathways for CO oxidation over the Co3O4 N catalyst was proposed: ① The gaseous CO was adsorbed onto the catalysts’ surface to form the bidentate carbonates. ② As the reaction temperature increased, the bidentate carbonates extracted the surface lattice oxygen further to produce CO2 and oxygen cavities . Fig. 8c shows the DRIFTS spectra for CO oxidation ranging from 30 °C to 150 °C in the absence of O2 over the Co3O4 C catalysts. The peaks around 1036 cm−1 and 1082 cm−1 were assigned to the vibrations of the monodentate carbonate species, while the peaks at 1580 cm−1, 1438 cm−1, 1359 cm−1, 1264 cm−1, and 1170 cm−1 corresponded to the ν3 vibrational splitting of the bidentate carbonate species [18,20]. Thus, it could be presumed the carbonate species are formed by the reactive oxygen species interacted with adsorbed CO. Notably, two new peak bands located at 973 and 997 cm−1 appeared and were assigned to the OO vibration of superoxide, indicating that the surface of Co3O4 synthesized with CH4N2O as precipitant contained superoxide anion (-O2 −) [21]. Therefore, it could be inferred that the reaction of CO with superoxide anion over the Co3O4 C catalysts to generate CO2 and oxygen vacancies is the essence of the mechanism [14,22]. In brief, the oxidation of CO occurred via several pathways depending upon the different preparation methods for Co3O4 catalysts. The adsorption and oxidation reaction mechanisms of o-xylene on the Co3O4 catalysts were examined using in situ DRIFTS. As shown in Fig. 8b, the peaks associated with o-xylene adsorption gradually increased under the N2 atmosphere. The band located at 1035 cm−1 could be attributed to the lattice vibration of the cobalt-based spine [23], and the band at 1653 cm−1 to the backbone υ (C=C) vibration of the aryl ring [24]. The peak bands at 2800 and 2875 cm−1 could be assigned to the CH symmetric stretching vibrations of the -CH3 group, indicating the adsorption reaction toward o-xylene occurred on the Co3O4 N catalysts [1,25]. The adsorption band at 1097 cm−1 might be a characteristic peak of the alcohol salt species (-OH) [1]. This implies that the adsorbed o-xylene can interact with the catalyst to break the CH bond of methyl (-CH3) to produce benzyl alcohol. In addition, the benzaldehyde species (1533 and 1585 cm−1) and benzoic acid species (1462 and 1794 cm−1) were formed [26]. It was noted that new small-molecule carboxylate and anhydride peak bands located at 1265 cm−1 and 1735 cm−1 appeared when the temperature increased to 110 °C [24]. This indicated that the catalyst with CH4N2O as precipitant tended to degrade benzaldehyde and benzoic acid into small-molecule carboxylate species [27]. At the same time, the carbon dioxide bands around at 2336 and 2360 cm−1 were observed [28]. Based on the fact that the appearance of benzaldehyde and benzoic acid molecules and the depletion of hydroxyl species, the oxidation reaction mechanism of o-xylene with the lattice oxygen over the Co3O4 catalyst with Na2CO3 as precipitant might be as follows: o-xylene → o-methyl benzyl alcohol → o-methyl benzaldehyde (benzaldehyde) → benzoic acid →small-molecule carboxylate→ H2O and CO2. The in situ DRIFTS tests were performed to investigate the reaction mechanism of o-xylene adsorption and oxidation over Co3O4 C catalysts as well. As depicted in Fig. 8d, a small peak around 2937 cm−1 was observed, which was ascribed to the CH symmetric stretching vibration of -CH3 [1]. The appearance of new bands at 1034 and 1166 cm−1 were associated with the alcohol salt substances [26]. As temperature increased, the aldehyde group (-CHO) (1400 and 1430 cm−1) and carboxylate species (1765 cm−1) were formed [1,29], indicating that aldehyde species were further oxidized to carboxylate species. In addition, the benzoic acid species (1582 cm−1), maleic anhydride (1267 and 1474 cm−1) and ketone species (1660 cm−1) were observed [30,31], implying that all of them were critical intermediates in the oxidation of o-xylene. Furthermore, absorption bands designated as metal-OH or water molecules coordinated to the surface metal cations (3380 cm−1) and carbon dioxide (2338 and 2360 cm−1) were also observed [26]. Therefore, the oxidation reaction mechanism of o-xylene with the reactive superoxide anion over the Co3O4 catalyst with CH4N2O as precipitant might be as follows: o-xylene → o-methyl benzyl alcohol → o-methyl benzaldehyde (benzaldehyde) → benzoic acid → maleic acid → acetone → H2O and CO2. 3.6 Proposed reaction mechanism In this study, smaller grain size, larger specific surface area, higher valence state of Co and the content of lattice oxygen/active superoxide anion the over the Co3O4 catalysts were identified to be beneficial to increasing the catalysts’ efficiency toward o-xylene oxidation. Based on the above discussions, two distinct reaction pathways toward o-xylene oxidation processes were proposed over the two kinds of Co3O4 catalysts (Fig. 9 ). Firstly, the methyl group of the o-xylene was adsorbed onto the Co3+ ion, then the activated the o-xylene molecules on Co3+ cation site was further oxidized by the surface lattice oxygen or superoxide anion to form o-methyl benzyl alcohol, leading to active Co3+ sites that were partially reduced to Co2+ and neighboring oxygen vacancies being generated, and then the oxygen vacancies were replenished by the gaseous oxygen, resulting in the regeneration of active Co3+ sites. Later the benzyl alcohol was oxidized to o-methyl benzaldehyde, and afterward to generate benzoic acid. It was noteworthy that a significant accumulation of carboxylate species (benzoic acid) occurred over the two kinds of Co3O4 catalysts, suggesting that further degradation of the carboxylate species became a rate-determining step. The later reaction product varied in the type of catalyst. For Co3O4 N catalyst, the benzoic acid was further degraded into small-molecule carboxylate, while for Co3O4 C catalysts, it was further degraded into maleic acid subsequently into acetone. However, the final products were the same, both were CO2 and H2O. 4 Conclusions The Co3O4 catalysts with pure phase and characteristic spinel structure were successfully prepared by using two different homogeneous precipitation methods, respectively, and a series of characterization techniques and bench-scale experiments were performed to gain insights into the essence for o-xylene oxidation over the Co3O4 N and Co3O4 C catalysts. The main conclusions from this experimental study are summarized as follows: (1) As the calcination temperature increased, the particle tended to sinter, resulting in the SSA of the catalysts gradually decreased. The positive correlation between o-xylene catalytical oxidation efficiency and SSA indicated that physisorption contributed to the o-xylene removal efficiency over the Co3O4 samples. (2) The Co3O4 N catalyst was more abundant in Co3+ and Oads active species, while that of Co3O4 C catalyst was rich in the active superoxide anion. Among the different kinds of catalysts, Co3O4 C-300 °C catalyst exhibited the best activity toward o-xylene oxidation. In addition, it was found that lower calcination temperature was beneficial to the formation of surface lattice oxygen as well as the active superoxide anion than that of higher temperature. (3) The oxidation mechanism of o-xylene over Co3O4 catalysts obtained by different preparation methods were revealed in detail: The characterization results indicated that o-xylene molecule preferentially adsorbed on Co3+ cation sites, then it was further oxidized by the surface lattice oxygen or superoxide anion to form o-methyl benzyl alcohol. Subsequently the benzyl alcohol was oxidized to o-methyl benzaldehyde, and afterward to generate benzoic acid. For Co3O4 N catalyst, the benzoic acid converted into small-molecule carboxylate, while for Co3O4 C catalysts, it was further converted into maleic acid subsequently into acetone. Finally, both small-molecule carboxylate and acetone products converted to CO2 and H2O. CRediT authorship contribution statement Zeyu Yang: Writing – review & editing, Writing – original draft, Methodology, Investigation, Formal analysis, Data curation. Qianqian Qi: Methodology, Data curation. Mingyu Fan: Data curation. Yafei Wang: Supervision, Project administration, Funding acquisition, Conceptualization. Li Tong: Writing – review & editing, Investigation, Data curation. Declaration of competing interest The authors declare that they have no known competing financial interests or personal relationships that could have appeared to influence the work reported in this paper. Acknowledgements This work was supported by the National Natural Science Foundation of China (No. 52470114). Supplementary materials Supplementary material associated with this article can be found, in the online version, at doi:10.1016/j.mcat.2025.115095. Appendix Supplementary materials Image, application 1 References [1] Y. Ma L. Wang J. Ma H. Wang C. Zhang H. Deng H. He Investigation into the enhanced catalytic oxidation of o-xylene over MOF-derived Co3O4 with different shapes: the role of surface twofold-coordinate lattice oxygen (O2f) ACS Catal. 11 2021 6614 6625 Y. Ma, L. Wang, J. Ma, H. Wang, C. Zhang, H. Deng, H. He, Investigation into the enhanced catalytic oxidation of o-xylene over MOF-derived Co3O4 with different shapes: the role of surface twofold-coordinate lattice oxygen (O2f), ACS Catal.. 11 (2021) 6614–6625. [2] J. Mei Y. Shen Y. Li S. Zhang Y. Shen W. Li Z. Cheng J. Zhao J. Chen Combined experimental and theoretical study of o-xylene elimination on Fe–Mn oxides catalysts Chemosphere 292 2022 133442 J. Mei, Y. Shen, Y. Li, S. Zhang, Y. Shen, W. Li, Z. Cheng, J. Zhao, J. Chen, Combined experimental and theoretical study of o-xylene elimination on Fe–Mn oxides catalysts, Chemosphere. 292 (2022) 133442. [3] F. Wang L. Zhang L. Xu Z. Deng W. Shi Low temperature CO oxidation and CH4 combustion over Co3O4 nanosheets Fuel 203 2017 419 429 F. Wang, L. Zhang, L. Xu, Z. Deng, W. Shi, Low temperature CO oxidation and CH4 combustion over Co3O4 nanosheets, Fuel. 203 (2017) 419–429. [4] W. Liu Z. Zhang K. Yuan D. Dang P. Jin X. Han Q. Ge Catalytic oxidation degradation of volatile organic compounds (VOCs) – a review Rev. Inorg. Chem. 44 2024 209 229 W. Liu, Z. Zhang, K. Yuan, D. Dang, P. Jin, X. Han, Q. Ge, Catalytic oxidation degradation of volatile organic compounds (VOCs) – a review, Rev. Inorg. Chem. 44 (2024) 209–229. [5] B. Bai H. Arandiyan J. Li Comparison of the performance for oxidation of formaldehyde on nano-Co3O4, 2D-Co3O4, and 3D-Co3O4 catalysts Appl. Catal. B: Environ. 142-143 2013 677 683 B. Bai, H. Arandiyan, J. Li, Comparison of the performance for oxidation of formaldehyde on nano-Co3O4, 2D-Co3O4, and 3D-Co3O4 catalysts, Appl. Catal. B: Environ. 142-143 (2013) 677–683. [6] Y. Wang C. Zhang F. Liu H. He Well-dispersed palladium supported on ordered mesoporous Co3O4 for catalytic oxidation of o-xylene Appl. Catal. B: Environ. 142-143 2013 72 79 Y. Wang, C. Zhang, F. Liu, H. He, Well-dispersed palladium supported on ordered mesoporous Co3O4 for catalytic oxidation of o-xylene, Appl. Catal. B: Environ. 142-143 (2013) 72–79. [7] K. Wang Y. Cao J. Hu Y. Li J. Xie D. Jia Solvent-free chemical approach to synthesize various morphological Co3O4 for CO oxidation ACS Appl. Mater. Interfaces 9 2017 16128 16137 K. Wang, Y. Cao, J. Hu, Y. Li, J. Xie, D. Jia, Solvent-free chemical approach to synthesize various morphological Co3O4 for CO oxidation, ACS Appl. Mater. Interfaces 9 (2017) 16128–16137. [8] A. Gil-Barbarin J.I. Gutiérrez-Ortiz R. López-Fonseca B. de Rivas Co3O4 hollow nanotubes for the catalytic oxidation of C2-chlorinated VOCs J. Environ. Chem. Eng. 11 2023 109841 A. Gil-Barbarin, J.I. Gutiérrez-Ortiz, R. López-Fonseca, B. de Rivas, Co3O4 hollow nanotubes for the catalytic oxidation of C2-chlorinated VOCs, J. Environ. Chem. Eng. 11 (2023) 109841. [9] Y. Xia H.x. Dai H. Jiang J. Jiang H. He C.T. Au Mesoporous chromia with ordered three-dimensional structures forthe complete oxidation of Tolueneand ethyl acetate Environ. Sci. Technol. 43 2009 8355 8360 Y. Xia, H.x. Dai, H. Jiang, J. Jiang, H. He, C.T. Au, Mesoporous chromia with ordered three-dimensional structures forthe complete oxidation of Tolueneand ethyl acetate, Environ. Sci. Technol. 43 (2009) 8355–8360. [10] X. Xie Y. Li Z.-Q. Liu M. Haruta W. Shen Low-temperature oxidation of CO catalysed by Co3O4 nanorods Nature 458 2009 746 749 X. Xie, Y. Li, Z.-Q. Liu, M. Haruta, W. Shen, Low-temperature oxidation of CO catalysed by Co3O4 nanorods, Nature. 458 (2009) 746–749. [11] C. Ma Z. Mu J. Li Y. Jin Mesoporous Co3O4 and AuCo3O4 catalysts for low-temperature oxidation of trace ethylene J. Am. Chem. Soc. 132 2010 2469 2846 C. Ma, Z. Mu, J. Li, Y. Jin, Mesoporous Co3O4 and AuCo3O4 catalysts for low-temperature oxidation of trace ethylene, J. Am. Chem. Soc.. 132 (2010) 2469–2846. [12] M. Kruk M. Jaroniec Gas adsorption characterization-of ordered organic-inorganic nanocomposite materials Chem. Mater. 13 2001 3169 3183 M. Kruk, M. Jaroniec, Gas adsorption characterization-of ordered organic-inorganic nanocomposite materials, Chem. Mater. 13 (2001) 3169–3183. [13] J. Zhang Y. Fang Y. Zhang Y. Lin Y. Gui L. Liu Photocatalytic degradation of volatile organic compounds over WO2/SnS2 nanofibers ACS Appl. Nano Mater. 6 2023 22301 22310 J. Zhang, Y. Fang, Y. Zhang, Y. Lin, Y. Gui, L. Liu, Photocatalytic degradation of volatile organic compounds over WO2/SnS2 nanofibers, ACS Appl. Nano Mater. 6 (2023) 22301–22310. [14] Y. Yu T. Takei H. Ohashi H. He X. Zhang M. Haruta Pretreatments of Co3O4 at moderate temperature for CO oxidation at −80 °C J. Catal. 267 2009 121 128 Y. Yu, T. Takei, H. Ohashi, H. He, X. Zhang, M. Haruta, Pretreatments of Co3O4 at moderate temperature for CO oxidation at −80 °C, J. Catal. 267 (2009) 121–128. [15] B. Solsona T.E. Davies T. Garcia I. Vázquez A. Dejoz S.H. Taylor Total oxidation of propane using nanocrystalline cobalt oxide and supported cobalt oxide catalysts Appl. Catal. B: Environ. 84 2008 176 184 B. Solsona, T.E. Davies, T. Garcia, I. Vázquez, A. Dejoz, S.H. Taylor, Total oxidation of propane using nanocrystalline cobalt oxide and supported cobalt oxide catalysts, Appl. Catal. B: Environ. 84 (2008) 176–184. [16] F. Teng M. Chen G. Li Y. Teng T. Xu Y. Hang W. Yao S. Santhanagopalan D.D. Meng Y. Zhu High combustion activity of CH4 and catalluminescence properties of CO oxidation over porous Co3O4 nanorods Appl. Catal. B: Environ. 110 2011 133 140 F. Teng, M. Chen, G. Li, Y. Teng, T. Xu, Y. Hang, W. Yao, S. Santhanagopalan, D.D. Meng, Y. Zhu, High combustion activity of CH4 and catalluminescence properties of CO oxidation over porous Co3O4 nanorods, Appl. Catal. B: Environ. 110 (2011) 133–140. [17] C.A. Chagas E.F. de Souza M.C.N.A. de Carvalho R.L. Martins M. Schmal Cobalt ferrite nanoparticles for the preferential oxidation of CO Appl. Catal. A-Gen. 519 2016 139 145 C.A. Chagas, E.F. de Souza, M.C.N.A. de Carvalho, R.L. Martins, M. Schmal, Cobalt ferrite nanoparticles for the preferential oxidation of CO, Appl. Catal. A-Gen.. 519 (2016) 139–145. [18] S. Chen L. Luo Z. Jiang W. Huang Size-dependent reaction pathways of low-temperature CO oxidation on Au/CeO2 catalysts ACS Catal. 5 2015 1653 1662 S. Chen, L. Luo, Z. Jiang, W. Huang, Size-dependent reaction pathways of low-temperature CO oxidation on Au/CeO2 catalysts, ACS Catal.. 5 (2015) 1653–1662. [19] W. Huan J. Li J. Ji M. Xing In situ studies on ceria promoted cobalt oxide for CO oxidation Chin. J. Catal. 40 2019 656 663 W. Huan, J. Li, J. Ji, M. Xing, In situ studies on ceria promoted cobalt oxide for CO oxidation, Chin. J. Catal. 40 (2019) 656–663. [20] Y. Escalante M.N. Barroso A.M. Tarditi J. Múnera Exploring the potential of cobalt-based catalysts in the methane dry reforming for sustainable energy applications Mol. Catal. 569 2024 114575 Y. Escalante, M.N. Barroso, A.M. Tarditi, J. Múnera, Exploring the potential of cobalt-based catalysts in the methane dry reforming for sustainable energy applications, Mol. Catal. 569 (2024) 114575. [21] M.M. Montemore M.A. van Spronsen R.J. Madix C.M. Friend O2 activation by metal surfaces: implications for bonding and reactivity on heterogeneous catalysts Chem. Rev. 118 2018 2816 2862 M.M. Montemore, M.A. van Spronsen, R.J. Madix, C.M. Friend, O2 activation by metal surfaces: implications for bonding and reactivity on heterogeneous catalysts, Chem. Rev. 118 (2018) 2816–2862. [22] J. Li Y. Lei Z. Guo G. Li X. Chen F. Zhou Temperature-dependent reaction pathways of CO oxidation and the application as monolithic catalysts for Co3O4 nanorods Appl. Catal. A-Gen. 587 2019 117191 J. Li, Y. Lei, Z. Guo, G. Li, X. Chen, F. Zhou, Temperature-dependent reaction pathways of CO oxidation and the application as monolithic catalysts for Co3O4 nanorods, Appl. Catal. A-Gen.. 587 (2019) 117191. [23] X. Wang Y. Liu T. Zhang Y. Luo Z. Lan K. Zhang J. Zuo L. Jiang R. Wang Geometrical-site-dependent catalytic activity of ordered mesoporous Co-based spinel for benzene oxidation: in situ DRIFTS study coupled with raman and XAFS spectroscopy ACS Catal. 7 2017 1626 1636 X. Wang, Y. Liu, T. Zhang, Y. Luo, Z. Lan, K. Zhang, J. Zuo, L. Jiang, R. Wang, Geometrical-site-dependent catalytic activity of ordered mesoporous Co-based spinel for benzene oxidation: in situ DRIFTS study coupled with raman and XAFS spectroscopy, ACS Catal. 7 (2017) 1626–1636. [24] H. Wang Q. Zhao D. Li Z. Zhang Y. Liu X. Guo X. Li Z. Liu L. Wang J. Ma H. He Boosting photothermocatalytic oxidation of toluene over Pt/N-TiO2: the gear effect of light and heat Environ. Sci. Technol. 58 2024 7662 7671 H. Wang, Q. Zhao, D. Li, Z. Zhang, Y. Liu, X. Guo, X. Li, Z. Liu, L. Wang, J. Ma, H. He, Boosting photothermocatalytic oxidation of toluene over Pt/N-TiO2: the gear effect of light and heat, Environ. Sci. Technol. 58 (2024) 7662–7671. [25] H. Arandiyan Y. Wang Y. Liu Y. Liang Y. Peng S. Bartlett H. Dai S. Rostamnia J. Li Template-free scalable synthesis of flower-like Co3-xMnxO4 spinel catalysts for toluene oxidation ChemCatChem 10 2018 3429 3434 H. Arandiyan, Y. Wang, Y. Liu, Y. Liang, Y. Peng, S. Bartlett, H. Dai, S. Rostamnia, J. Li, Template-free scalable synthesis of flower-like Co3-xMnxO4 spinel catalysts for toluene oxidation, ChemCatChem. 10 (2018) 3429–3434. [26] J. Zhong Y. Zeng D. Chen S. Mo M. Zhang M. Fu J. Wu Z. Su P. Chen D. Ye Toluene oxidation over Co3+-rich spinel Co3O4: evaluation of chemical and by-product species identified by in situ DRIFTS combined with PTR-TOF-MS J. Hazard. Mater. 386 2020 121957 J. Zhong, Y. Zeng, D. Chen, S. Mo, M. Zhang, M. Fu, J. Wu, Z. Su, P. Chen, D. Ye, Toluene oxidation over Co3+-rich spinel Co3O4: evaluation of chemical and by-product species identified by in situ DRIFTS combined with PTR-TOF-MS, J. Hazard. Mater. 386 (2020) 121957. [27] J. Zhong Y. Zeng M. Zhang W. Feng D. Xiao J. Wu P. Chen M. Fu D. Ye Toluene oxidation process and proper mechanism over Co3O4 nanotubes: investigation through in-situ DRIFTS combined with PTR-TOF-MS and quasi in-situ XPS Chem. Eng. J. 397 2020 125375 J. Zhong, Y. Zeng, M. Zhang, W. Feng, D. Xiao, J. Wu, P. Chen, M. Fu, D. Ye, Toluene oxidation process and proper mechanism over Co3O4 nanotubes: investigation through in-situ DRIFTS combined with PTR-TOF-MS and quasi in-situ XPS, Chem. Eng. J. 397 (2020) 125375. [28] J.-Y. Luo M. Meng X. Li X.-G. Li Y.-Q. Zha T.-D. Hu Y.-N. Xie J. Zhang Mesoporous Co3O4–CeO2 and Pd/Co3O4–CeO2 catalysts: synthesis, characterization and mechanistic study of their catalytic properties for low-temperature CO oxidation J. Catal. 254 2008 310 324 J.-Y. Luo, M. Meng, X. Li, X.-G. Li, Y.-Q. Zha, T.-D. Hu, Y.-N. Xie, J. Zhang, Mesoporous Co3O4–CeO2 and Pd/Co3O4–CeO2 catalysts: synthesis, characterization and mechanistic study of their catalytic properties for low-temperature CO oxidation, J. Catal. 254 (2008) 310–324. [29] Y. Chen K. Yao X. Zhang B. Shen R.L. Smith H. Guo Siloxane-modified MnOx catalyst for oxidation of coal-related o-xylene in presence of water vapor J. Hazard. Mater. 436 2022 129109 Y. Chen, K. Yao, X. Zhang, B. Shen, R.L. Smith, H. Guo, Siloxane-modified MnOx catalyst for oxidation of coal-related o-xylene in presence of water vapor, J. Hazard. Mater. 436 (2022) 129109. [30] H. Sun Z. Liu S. Chen X. Quan The role of lattice oxygen on the activity and selectivity of the OMS-2 catalyst for the total oxidation of toluene Chem. Eng. J. 270 2015 58 65 H. Sun, Z. Liu, S. Chen, X. Quan, The role of lattice oxygen on the activity and selectivity of the OMS-2 catalyst for the total oxidation of toluene, Chem. Eng. J. 270 (2015) 58–65. [31] X. Yang X. Yu M. Jing W. Song J. Liu M. Ge Defective MnxZr1–xO2 solid solution for the catalytic oxidation of toluene: insights into the oxygen vacancy contribution ACS Appl. Mater. Interfaces 11 2018 730 739 X. Yang, X. Yu, M. Jing, W. Song, J. Liu, M. Ge, Defective MnxZr1–xO2 solid solution for the catalytic oxidation of toluene: insights into the oxygen vacancy contribution, ACS Appl. Mater. Interfaces 11 (2018) 730–739.",
      "scopus-id": "105001730447",
      "coredata": {
        "eid": "1-s2.0-S2468823125002810",
        "dc:description": "The Co3O4 catalysts with different precursors (Na2CO3, CH4N2O) were synthesized and evaluated for its o-xylene catalytic oxidation performance. A series of techniques including BET, XRD, TEM, XPS, H2-TPR were employed to characterize the physical and chemical properties of catalysts under various preparation conditions. The results indicated that physisorption played an important role in the o-xylene removal and higher calcination temperature destructed the specific surface areas of the Co3O4 samples. The enhanced catalytic performance of Co3O4 N catalyst was mainly attributed to be abundance in active Co3+ and lattice oxygen species, while that of Co3O4 C catalyst was ascribed to the formation of superoxide anion, especially the lower calcination temperature facilitated the generation of active species. In addition, the reaction mechanisms toward o-xylene oxidation over Co3O4 catalysts obtained by different preparation methods were explored in detail. The o-xylene molecule preferentially adsorbed onto the Co3+ ion sites, and was further oxidized by the lattice oxygen or superoxide anion with the product being o-methyl benzyl alcohol. Soon the benzyl alcohol was transformed into the o-methyl benzaldehyde, and afterward to form benzoic acid. Later, the benzoic acid was converted into small-molecule carboxylate for Co3O4 N catalyst, whereas for Co3O4 C catalysts, the benzoic acid was further turned into maleic acid subsequently into acetone. Finally, both the small-molecule carboxylate and acetone species were oxidized to CO2 and H2O. This finding offers some valuable insights for designing efficient o-xylene oxidation catalysts and mitigating industrial air pollution.",
        "openArchiveArticle": "false",
        "prism:coverDate": "2025-05-15",
        "openaccessUserLicense": null,
        "prism:aggregationType": "Journal",
        "prism:url": "https://api.elsevier.com/content/article/pii/S2468823125002810",
        "dc:creator": [
          {
            "@_fa": "true",
            "$": "Yang, Zeyu"
          },
          {
            "@_fa": "true",
            "$": "Qi, Qianqian"
          },
          {
            "@_fa": "true",
            "$": "Fan, Mingyu"
          },
          {
            "@_fa": "true",
            "$": "Wang, Yafei"
          },
          {
            "@_fa": "true",
            "$": "Tong, Li"
          }
        ],
        "link": [
          {
            "@_fa": "true",
            "@rel": "self",
            "@href": "https://api.elsevier.com/content/article/pii/S2468823125002810"
          },
          {
            "@_fa": "true",
            "@rel": "scidir",
            "@href": "https://www.sciencedirect.com/science/article/pii/S2468823125002810"
          }
        ],
        "dc:format": "application/json",
        "openaccessType": null,
        "pii": "S2468-8231(25)00281-0",
        "prism:volume": "579",
        "articleNumber": "115095",
        "prism:publisher": "Elsevier B.V. All rights are reserved, including those for text and data mining, AI training, and similar technologies.",
        "dc:title": "Effects of the preparation methods of Co3O4 catalysts on catalytic oxidization performance toward o-xylene",
        "prism:copyright": "© 2025 Elsevier B.V. All rights are reserved, including those for text and data mining, AI training, and similar technologies.",
        "openaccess": "0",
        "prism:issn": "24688231",
        "dcterms:subject": [
          {
            "@_fa": "true",
            "$": "O-xylene"
          },
          {
            "@_fa": "true",
            "$": "Co3O4"
          },
          {
            "@_fa": "true",
            "$": "Preparation method"
          },
          {
            "@_fa": "true",
            "$": "Catalytic oxidation"
          },
          {
            "@_fa": "true",
            "$": "Reaction mechanism"
          }
        ],
        "openaccessArticle": "false",
        "prism:publicationName": "Molecular Catalysis",
        "openaccessSponsorType": null,
        "prism:pageRange": "115095",
        "pubType": "fla",
        "prism:coverDisplayDate": "15 May 2025",
        "prism:doi": "10.1016/j.mcat.2025.115095",
        "prism:startingPage": "115095",
        "dc:identifier": "doi:10.1016/j.mcat.2025.115095",
        "openaccessSponsorName": null
      },
      "objects": {
        "object": [
          {
            "@category": "standard",
            "@height": "728",
            "@width": "565",
            "@_fa": "true",
            "$": "https://api.elsevier.com/content/object/eid/1-s2.0-S2468823125002810-gr6.jpg?httpAccept=%2A%2F%2A",
            "@multimediatype": "JPEG image file",
            "@type": "IMAGE-DOWNSAMPLED",
            "@size": "97420",
            "@ref": "gr6",
            "@mimetype": "image/jpeg"
          },
          {
            "@category": "standard",
            "@height": "379",
            "@width": "565",
            "@_fa": "true",
            "$": "https://api.elsevier.com/content/object/eid/1-s2.0-S2468823125002810-gr7.jpg?httpAccept=%2A%2F%2A",
            "@multimediatype": "JPEG image file",
            "@type": "IMAGE-DOWNSAMPLED",
            "@size": "60282",
            "@ref": "gr7",
            "@mimetype": "image/jpeg"
          },
          {
            "@category": "standard",
            "@height": "491",
            "@width": "565",
            "@_fa": "true",
            "$": "https://api.elsevier.com/content/object/eid/1-s2.0-S2468823125002810-gr8.jpg?httpAccept=%2A%2F%2A",
            "@multimediatype": "JPEG image file",
            "@type": "IMAGE-DOWNSAMPLED",
            "@size": "98200",
            "@ref": "gr8",
            "@mimetype": "image/jpeg"
          },
          {
            "@category": "standard",
            "@height": "248",
            "@width": "508",
            "@_fa": "true",
            "$": "https://api.elsevier.com/content/object/eid/1-s2.0-S2468823125002810-gr9.jpg?httpAccept=%2A%2F%2A",
            "@multimediatype": "JPEG image file",
            "@type": "IMAGE-DOWNSAMPLED",
            "@size": "25703",
            "@ref": "gr9",
            "@mimetype": "image/jpeg"
          },
          {
            "@category": "standard",
            "@height": "223",
            "@width": "565",
            "@_fa": "true",
            "$": "https://api.elsevier.com/content/object/eid/1-s2.0-S2468823125002810-gr2.jpg?httpAccept=%2A%2F%2A",
            "@multimediatype": "JPEG image file",
            "@type": "IMAGE-DOWNSAMPLED",
            "@size": "44704",
            "@ref": "gr2",
            "@mimetype": "image/jpeg"
          },
          {
            "@category": "standard",
            "@height": "200",
            "@width": "409",
            "@_fa": "true",
            "$": "https://api.elsevier.com/content/object/eid/1-s2.0-S2468823125002810-ga1.jpg?httpAccept=%2A%2F%2A",
            "@multimediatype": "JPEG image file",
            "@type": "IMAGE-DOWNSAMPLED",
            "@size": "32720",
            "@ref": "ga1",
            "@mimetype": "image/jpeg"
          },
          {
            "@category": "standard",
            "@height": "998",
            "@width": "692",
            "@_fa": "true",
            "$": "https://api.elsevier.com/content/object/eid/1-s2.0-S2468823125002810-gr3.jpg?httpAccept=%2A%2F%2A",
            "@multimediatype": "JPEG image file",
            "@type": "IMAGE-DOWNSAMPLED",
            "@size": "249541",
            "@ref": "gr3",
            "@mimetype": "image/jpeg"
          },
          {
            "@category": "standard",
            "@height": "325",
            "@width": "376",
            "@_fa": "true",
            "$": "https://api.elsevier.com/content/object/eid/1-s2.0-S2468823125002810-gr4.jpg?httpAccept=%2A%2F%2A",
            "@multimediatype": "JPEG image file",
            "@type": "IMAGE-DOWNSAMPLED",
            "@size": "46127",
            "@ref": "gr4",
            "@mimetype": "image/jpeg"
          },
          {
            "@category": "standard",
            "@height": "219",
            "@width": "565",
            "@_fa": "true",
            "$": "https://api.elsevier.com/content/object/eid/1-s2.0-S2468823125002810-gr5.jpg?httpAccept=%2A%2F%2A",
            "@multimediatype": "JPEG image file",
            "@type": "IMAGE-DOWNSAMPLED",
            "@size": "43055",
            "@ref": "gr5",
            "@mimetype": "image/jpeg"
          },
          {
            "@category": "standard",
            "@height": "323",
            "@width": "565",
            "@_fa": "true",
            "$": "https://api.elsevier.com/content/object/eid/1-s2.0-S2468823125002810-gr1.jpg?httpAccept=%2A%2F%2A",
            "@multimediatype": "JPEG image file",
            "@type": "IMAGE-DOWNSAMPLED",
            "@size": "45482",
            "@ref": "gr1",
            "@mimetype": "image/jpeg"
          },
          {
            "@category": "thumbnail",
            "@height": "164",
            "@width": "127",
            "@_fa": "true",
            "$": "https://api.elsevier.com/content/object/eid/1-s2.0-S2468823125002810-gr6.sml?httpAccept=%2A%2F%2A",
            "@multimediatype": "GIF image file",
            "@type": "IMAGE-THUMBNAIL",
            "@size": "9685",
            "@ref": "gr6",
            "@mimetype": "image/gif"
          },
          {
            "@category": "thumbnail",
            "@height": "147",
            "@width": "219",
            "@_fa": "true",
            "$": "https://api.elsevier.com/content/object/eid/1-s2.0-S2468823125002810-gr7.sml?httpAccept=%2A%2F%2A",
            "@multimediatype": "GIF image file",
            "@type": "IMAGE-THUMBNAIL",
            "@size": "10527",
            "@ref": "gr7",
            "@mimetype": "image/gif"
          },
          {
            "@category": "thumbnail",
            "@height": "164",
            "@width": "189",
            "@_fa": "true",
            "$": "https://api.elsevier.com/content/object/eid/1-s2.0-S2468823125002810-gr8.sml?httpAccept=%2A%2F%2A",
            "@multimediatype": "GIF image file",
            "@type": "IMAGE-THUMBNAIL",
            "@size": "14745",
            "@ref": "gr8",
            "@mimetype": "image/gif"
          },
          {
            "@category": "thumbnail",
            "@height": "107",
            "@width": "219",
            "@_fa": "true",
            "$": "https://api.elsevier.com/content/object/eid/1-s2.0-S2468823125002810-gr9.sml?httpAccept=%2A%2F%2A",
            "@multimediatype": "GIF image file",
            "@type": "IMAGE-THUMBNAIL",
            "@size": "10833",
            "@ref": "gr9",
            "@mimetype": "image/gif"
          },
          {
            "@category": "thumbnail",
            "@height": "86",
            "@width": "219",
            "@_fa": "true",
            "$": "https://api.elsevier.com/content/object/eid/1-s2.0-S2468823125002810-gr2.sml?httpAccept=%2A%2F%2A",
            "@multimediatype": "GIF image file",
            "@type": "IMAGE-THUMBNAIL",
            "@size": "8406",
            "@ref": "gr2",
            "@mimetype": "image/gif"
          },
          {
            "@category": "thumbnail",
            "@height": "107",
            "@width": "219",
            "@_fa": "true",
            "$": "https://api.elsevier.com/content/object/eid/1-s2.0-S2468823125002810-ga1.sml?httpAccept=%2A%2F%2A",
            "@multimediatype": "GIF image file",
            "@type": "IMAGE-THUMBNAIL",
            "@size": "11266",
            "@ref": "ga1",
            "@mimetype": "image/gif"
          },
          {
            "@category": "thumbnail",
            "@height": "163",
            "@width": "113",
            "@_fa": "true",
            "$": "https://api.elsevier.com/content/object/eid/1-s2.0-S2468823125002810-gr3.sml?httpAccept=%2A%2F%2A",
            "@multimediatype": "GIF image file",
            "@type": "IMAGE-THUMBNAIL",
            "@size": "11636",
            "@ref": "gr3",
            "@mimetype": "image/gif"
          },
          {
            "@category": "thumbnail",
            "@height": "164",
            "@width": "190",
            "@_fa": "true",
            "$": "https://api.elsevier.com/content/object/eid/1-s2.0-S2468823125002810-gr4.sml?httpAccept=%2A%2F%2A",
            "@multimediatype": "GIF image file",
            "@type": "IMAGE-THUMBNAIL",
            "@size": "12314",
            "@ref": "gr4",
            "@mimetype": "image/gif"
          },
          {
            "@category": "thumbnail",
            "@height": "85",
            "@width": "219",
            "@_fa": "true",
            "$": "https://api.elsevier.com/content/object/eid/1-s2.0-S2468823125002810-gr5.sml?httpAccept=%2A%2F%2A",
            "@multimediatype": "GIF image file",
            "@type": "IMAGE-THUMBNAIL",
            "@size": "8428",
            "@ref": "gr5",
            "@mimetype": "image/gif"
          },
          {
            "@category": "thumbnail",
            "@height": "125",
            "@width": "219",
            "@_fa": "true",
            "$": "https://api.elsevier.com/content/object/eid/1-s2.0-S2468823125002810-gr1.sml?httpAccept=%2A%2F%2A",
            "@multimediatype": "GIF image file",
            "@type": "IMAGE-THUMBNAIL",
            "@size": "14332",
            "@ref": "gr1",
            "@mimetype": "image/gif"
          },
          {
            "@category": "high",
            "@height": "3221",
            "@width": "2500",
            "@_fa": "true",
            "$": "https://api.elsevier.com/content/object/eid/1-s2.0-S2468823125002810-gr6_lrg.jpg?httpAccept=%2A%2F%2A",
            "@multimediatype": "JPEG image file",
            "@type": "IMAGE-HIGH-RES",
            "@size": "636120",
            "@ref": "gr6",
            "@mimetype": "image/jpeg"
          },
          {
            "@category": "high",
            "@height": "1675",
            "@width": "2500",
            "@_fa": "true",
            "$": "https://api.elsevier.com/content/object/eid/1-s2.0-S2468823125002810-gr7_lrg.jpg?httpAccept=%2A%2F%2A",
            "@multimediatype": "JPEG image file",
            "@type": "IMAGE-HIGH-RES",
            "@size": "328363",
            "@ref": "gr7",
            "@mimetype": "image/jpeg"
          },
          {
            "@category": "high",
            "@height": "2171",
            "@width": "2500",
            "@_fa": "true",
            "$": "https://api.elsevier.com/content/object/eid/1-s2.0-S2468823125002810-gr8_lrg.jpg?httpAccept=%2A%2F%2A",
            "@multimediatype": "JPEG image file",
            "@type": "IMAGE-HIGH-RES",
            "@size": "605876",
            "@ref": "gr8",
            "@mimetype": "image/jpeg"
          },
          {
            "@category": "high",
            "@height": "1100",
            "@width": "2250",
            "@_fa": "true",
            "$": "https://api.elsevier.com/content/object/eid/1-s2.0-S2468823125002810-gr9_lrg.jpg?httpAccept=%2A%2F%2A",
            "@multimediatype": "JPEG image file",
            "@type": "IMAGE-HIGH-RES",
            "@size": "176567",
            "@ref": "gr9",
            "@mimetype": "image/jpeg"
          },
          {
            "@category": "high",
            "@height": "986",
            "@width": "2500",
            "@_fa": "true",
            "$": "https://api.elsevier.com/content/object/eid/1-s2.0-S2468823125002810-gr2_lrg.jpg?httpAccept=%2A%2F%2A",
            "@multimediatype": "JPEG image file",
            "@type": "IMAGE-HIGH-RES",
            "@size": "237291",
            "@ref": "gr2",
            "@mimetype": "image/jpeg"
          },
          {
            "@category": "high",
            "@height": "886",
            "@width": "1811",
            "@_fa": "true",
            "$": "https://api.elsevier.com/content/object/eid/1-s2.0-S2468823125002810-ga1_lrg.jpg?httpAccept=%2A%2F%2A",
            "@multimediatype": "JPEG image file",
            "@type": "IMAGE-HIGH-RES",
            "@size": "211227",
            "@ref": "ga1",
            "@mimetype": "image/jpeg"
          },
          {
            "@category": "high",
            "@height": "4417",
            "@width": "3064",
            "@_fa": "true",
            "$": "https://api.elsevier.com/content/object/eid/1-s2.0-S2468823125002810-gr3_lrg.jpg?httpAccept=%2A%2F%2A",
            "@multimediatype": "JPEG image file",
            "@type": "IMAGE-HIGH-RES",
            "@size": "2474968",
            "@ref": "gr3",
            "@mimetype": "image/jpeg"
          },
          {
            "@category": "high",
            "@height": "1439",
            "@width": "1667",
            "@_fa": "true",
            "$": "https://api.elsevier.com/content/object/eid/1-s2.0-S2468823125002810-gr4_lrg.jpg?httpAccept=%2A%2F%2A",
            "@multimediatype": "JPEG image file",
            "@type": "IMAGE-HIGH-RES",
            "@size": "301019",
            "@ref": "gr4",
            "@mimetype": "image/jpeg"
          },
          {
            "@category": "high",
            "@height": "970",
            "@width": "2500",
            "@_fa": "true",
            "$": "https://api.elsevier.com/content/object/eid/1-s2.0-S2468823125002810-gr5_lrg.jpg?httpAccept=%2A%2F%2A",
            "@multimediatype": "JPEG image file",
            "@type": "IMAGE-HIGH-RES",
            "@size": "245355",
            "@ref": "gr5",
            "@mimetype": "image/jpeg"
          },
          {
            "@category": "high",
            "@height": "1429",
            "@width": "2500",
            "@_fa": "true",
            "$": "https://api.elsevier.com/content/object/eid/1-s2.0-S2468823125002810-gr1_lrg.jpg?httpAccept=%2A%2F%2A",
            "@multimediatype": "JPEG image file",
            "@type": "IMAGE-HIGH-RES",
            "@size": "304769",
            "@ref": "gr1",
            "@mimetype": "image/jpeg"
          },
          {
            "@category": "standard",
            "@_fa": "true",
            "$": "https://api.elsevier.com/content/object/eid/1-s2.0-S2468823125002810-mmc1.docx?httpAccept=%2A%2F%2A",
            "@multimediatype": "Microsoft Word file",
            "@type": "APPLICATION",
            "@size": "586806",
            "@ref": "mmc1",
            "@mimetype": "application/word"
          },
          {
            "@category": "thumbnail",
            "@_fa": "true",
            "$": "https://api.elsevier.com/content/object/eid/1-s2.0-S2468823125002810-si1.svg?httpAccept=%2A%2F%2A",
            "@multimediatype": "Scalable Vector Graphics file",
            "@type": "ALTIMG",
            "@size": "5676",
            "@ref": "si1",
            "@mimetype": "image/svg+xml"
          },
          {
            "@category": "thumbnail",
            "@_fa": "true",
            "$": "https://api.elsevier.com/content/object/eid/1-s2.0-S2468823125002810-si2.svg?httpAccept=%2A%2F%2A",
            "@multimediatype": "Scalable Vector Graphics file",
            "@type": "ALTIMG",
            "@size": "13738",
            "@ref": "si2",
            "@mimetype": "image/svg+xml"
          },
          {
            "@category": "thumbnail",
            "@_fa": "true",
            "$": "https://api.elsevier.com/content/object/eid/1-s2.0-S2468823125002810-si3.svg?httpAccept=%2A%2F%2A",
            "@multimediatype": "Scalable Vector Graphics file",
            "@type": "ALTIMG",
            "@size": "6506",
            "@ref": "si3",
            "@mimetype": "image/svg+xml"
          },
          {
            "@category": "thumbnail",
            "@_fa": "true",
            "$": "https://api.elsevier.com/content/object/eid/1-s2.0-S2468823125002810-si4.svg?httpAccept=%2A%2F%2A",
            "@multimediatype": "Scalable Vector Graphics file",
            "@type": "ALTIMG",
            "@size": "7180",
            "@ref": "si4",
            "@mimetype": "image/svg+xml"
          }
        ]
      },
      "link": {
        "@rel": "abstract",
        "@href": "https://api.elsevier.com/content/abstract/scopus_id/105001730447"
      }
    }
  }
}