{
  "metadata": {
    "title": "Effect of the loading sequence of CeO<ce:inf loc=post>2</ce:inf> and Pd over Al<ce:inf loc=post>2</ce:inf>O<ce:inf loc=post>3</ce:inf> on the catalytic performance of Pd-only close-coupled catalysts",
    "authors": "; ; ",
    "journal": "Molecular Catalysis",
    "date": "2020-02-29",
    "doi": "10.1016/j.mcat.2017.10.002",
    "abstract": "",
    "uri": "https://api.elsevier.com/content/article/pii/S246882311730528X",
    "pii": "S246882311730528X"
  },
  "fulltext": {
    "full-text-retrieval-response": {
      "scopus-eid": "2-s2.0-85044962504",
      "originalText": "serial JL 315758 291210 291744 291790 291809 31 Molecular Catalysis MOLECULARCATALYSIS 2018-01-12 2018-01-12 2020-02-01 2020-02-01 2020-05-23T11:56:15 1-s2.0-S246882311730528X S2468-8231(17)30528-X S246882311730528X 10.1016/j.mcat.2017.10.002 S300 S300.4 FULL-TEXT 1-s2.0-S2468823119X00188 2020-05-23T11:06:30.263712Z 0 0 20200201 20200229 2020 2018-01-12T03:44:27.491896Z absattachment articleinfo articlenumber articletitlenorm authfirstinitialnorm authfirstsurnamenorm cid cids contenttype copyright crossmark dateloaded dateloadedtxt datesearch datesort dateupdated dco docsubtype doctype doi eid ewtransactionid hubeid indexeddate issn issnnorm itemstage itemtransactionid itemweight openaccess openarchive pg pgfirst pii piinorm pubdateend pubdatestart pubdatetxt pubyr sectiontitle sortorder srctitle srctitlenorm srctype ssids alllist content subj subheadings suppl tomb volfirst volissue volumelist webpdf webpdfpagecount yearnav figure table e-component body acknowledge affil appendices articletitle auth authfirstini authfull authkeywords authlast grantnumber grantsponsor highlightsabst primabst pubtype ref specialabst 2468-8231 24688231 true 482 482 C Volume 482 39 100332 100332 100332 202002 February 2020 2020-02-01 2020-02-29 2020 Special Issue on Acid-Base Catalysis ABC8 article fla © 2017 Elsevier B.V. All rights reserved. EFFECTLOADINGSEQUENCECEO2PDOVERAL2O3CATALYTICPERFORMANCEPDONLYCLOSECOUPLEDCATALYSTS SUN M 1 Introduction 2 Experimental 2.1 Preparation of Pd/Ce/Al and Ce/Pd/Al catalysts 2.2 Catalytic activity test 2.3 Characterization techniques 3 Results and discussion 3.1 Textural properties 3.2 XRD characterization 3.3 H2-TPR results 3.4 XPS results and ICP-AES 3.5 CO adsorption 3.6 TEM 3.7 In situ DRIFTS results 3.8 Schematic diagram of Pd dispersion 3.9 Catalytic performances 4 Conclusions Acknowledgments Appendix A Supplementary data References KASPAR 2003 419 449 J FARRAUTO 1999 351 360 R JOHNSON 2014 1207 1227 T LI 2015 322 328 M TIMOTHY 2016 18 J NAKATSUJI 2013 88 94 T CHEN 2013 109 115 C GUO 2011 870 874 X COLUSSI 2009 8633 8636 S CARGNELLO 2012 713 717 M HINOKUMA 2014 2990 2996 S COLUSSIA 2010 1 10 S YUE 2005 31 39 B WU 2004 375 381 J MORIKAWA 2008 210 221 A YANG 2014 1267 1280 X CRACIUN 2002 153 168 R PRIOLKAR 2002 2120 2128 K LAN 2014 10 21 L WANG 2011 132 137 Q WAN 2015 51 56 J PAPAVASILIOU 2009 162 174 A KAMIUCHI 2015 100 106 N BOZO 2001 69 77 C WILSON 1980 315 322 S COLUSSI 2010 59 65 S GUO 2007 296 302 Y LI 2010 41 48 G WANG 2014 1482 1491 S LIN 2015 335 343 S COSTA 2003 259 272 C CHRISTOU 2004 325 331 S GIORDANO 2000 273 282 F LAMBROU 2006 182 193 S ZHANG 2006 25782 25790 G RAO 1996 1 9 R VIDMAR 1997 160 168 P HU 1996 83 89 Z FAN 2008 177 186 J FAN 2008 38 48 J BENSALEM 1996 3233 3237 A HIRANO 2007 1249 1254 T FRANCHINI 2010 45 54 C THOMAS 2006 71 79 C ZHU 2014 137 144 B DIAO 2015 128 136 Y VHZQUEZ 1996 213 220 A LIU 2014 3 13 C KIM 2000 285 289 D COLUSSI 2009 8481 8484 S CIUPARU 2000 241 255 D IGLESIASJUEZ 2004 148 161 A YANG 2015 1 25 Y IGLESIASJUEZ 2009 195 202 A LAN 2015 404 416 L VIDMAR 1997 160 168 P LONG 2017 271 280 L HUANG 2017 149 157 M FANG 2015 994 1000 R PADILLA 2008 541 547 J SUNX2020X100332 SUNX2020X100332XM 2022-02-01T00:00:00.000Z 2022-02-01T00:00:00.000Z http://creativecommons.org/licenses/by-nc-nd/4.0/ © 2017 Elsevier B.V. All rights reserved. 2019-03-01T22:02:37.816Z http://vtw.elsevier.com/data/voc/AddOnTypes/50.7/nlp S246882311730528X National Hi-tech Research and Development Program of China 2015AA034603 We gratefully acknowledge the National Hi-tech Research and Development Program of China (863 Program, 2015AA034603 ) for their generous financial support for our research here. Appendix A item S2468-8231(17)30528-X S246882311730528X 1-s2.0-S246882311730528X 10.1016/j.mcat.2017.10.002 315758 2020-05-23T11:06:30.263712Z 2020-02-01 2020-02-29 1-s2.0-S246882311730528X-main.pdf https://s3-eu-west-1.amazonaws.com/prod-ucs-content-store-eu-west/content/pii:S246882311730528X/MAIN/application/pdf/addbe6e9c7c70b09334cb2a2026f6cbb/main.pdf main.pdf pdf true 3770281 MAIN 14 1-s2.0-S246882311730528X-main_1.png https://s3-eu-west-1.amazonaws.com/prod-ucs-content-store-eu-west/content/pii:S246882311730528X/PREVIEW/image/png/85dd31b289432ccc5bfd3a3ffff76bd0/main_1.png main_1.png png 59385 849 656 IMAGE-WEB-PDF 1 1-s2.0-S246882311730528X-fx1.jpg https://s3-eu-west-1.amazonaws.com/prod-ucs-content-store-eu-west/content/pii:S246882311730528X/fx1/DOWNSAMPLED/image/jpeg/77df1aed8969ad39390f98fb94d01b3c/fx1.jpg fx1 true fx1.jpg jpg 17177 200 266 IMAGE-DOWNSAMPLED 1-s2.0-S246882311730528X-fx1.sml https://s3-eu-west-1.amazonaws.com/prod-ucs-content-store-eu-west/content/pii:S246882311730528X/fx1/THUMBNAIL/image/gif/bc49ccb3ee3f1a466b2512260dc02d19/fx1.sml fx1 true fx1.sml sml 12534 164 218 IMAGE-THUMBNAIL 1-s2.0-S246882311730528X-gr1.jpg https://s3-eu-west-1.amazonaws.com/prod-ucs-content-store-eu-west/content/pii:S246882311730528X/gr1/DOWNSAMPLED/image/jpeg/6f894717368ee10edb1c758ba46c52ab/gr1.jpg gr1 gr1.jpg jpg 37269 332 376 IMAGE-DOWNSAMPLED 1-s2.0-S246882311730528X-gr1.sml https://s3-eu-west-1.amazonaws.com/prod-ucs-content-store-eu-west/content/pii:S246882311730528X/gr1/THUMBNAIL/image/gif/06ac0b0ffe6c1e9775cccff889e13ee4/gr1.sml gr1 gr1.sml sml 10410 163 185 IMAGE-THUMBNAIL 1-s2.0-S246882311730528X-gr10.jpg https://s3-eu-west-1.amazonaws.com/prod-ucs-content-store-eu-west/content/pii:S246882311730528X/gr10/DOWNSAMPLED/image/jpeg/05b836d2ae6a5a6b7fade3cccf5cbf0c/gr10.jpg gr10 gr10.jpg jpg 27938 282 376 IMAGE-DOWNSAMPLED 1-s2.0-S246882311730528X-gr10.sml https://s3-eu-west-1.amazonaws.com/prod-ucs-content-store-eu-west/content/pii:S246882311730528X/gr10/THUMBNAIL/image/gif/1b01a6ac817b18c95766997598ece9b2/gr10.sml gr10 gr10.sml sml 13909 164 218 IMAGE-THUMBNAIL 1-s2.0-S246882311730528X-gr11.jpg https://s3-eu-west-1.amazonaws.com/prod-ucs-content-store-eu-west/content/pii:S246882311730528X/gr11/DOWNSAMPLED/image/jpeg/b46e44cc08fe1c5bdb417d6682851f83/gr11.jpg gr11 gr11.jpg jpg 80382 789 638 IMAGE-DOWNSAMPLED 1-s2.0-S246882311730528X-gr11.sml https://s3-eu-west-1.amazonaws.com/prod-ucs-content-store-eu-west/content/pii:S246882311730528X/gr11/THUMBNAIL/image/gif/4fd173995b544d1b54f1f72deb659174/gr11.sml gr11 gr11.sml sml 5001 163 132 IMAGE-THUMBNAIL 1-s2.0-S246882311730528X-gr12.jpg https://s3-eu-west-1.amazonaws.com/prod-ucs-content-store-eu-west/content/pii:S246882311730528X/gr12/DOWNSAMPLED/image/jpeg/fec29363f7b95a56f2459d6212d2ec26/gr12.jpg gr12 gr12.jpg jpg 25521 242 677 IMAGE-DOWNSAMPLED 1-s2.0-S246882311730528X-gr12.sml https://s3-eu-west-1.amazonaws.com/prod-ucs-content-store-eu-west/content/pii:S246882311730528X/gr12/THUMBNAIL/image/gif/eea088d49a303a3677bcdcf4bbe901cf/gr12.sml gr12 gr12.sml sml 5608 78 219 IMAGE-THUMBNAIL 1-s2.0-S246882311730528X-gr2.jpg https://s3-eu-west-1.amazonaws.com/prod-ucs-content-store-eu-west/content/pii:S246882311730528X/gr2/DOWNSAMPLED/image/jpeg/69ee97a4ac0df67f6fbddaaa73b83e9f/gr2.jpg gr2 gr2.jpg jpg 14209 205 489 IMAGE-DOWNSAMPLED 1-s2.0-S246882311730528X-gr2.sml https://s3-eu-west-1.amazonaws.com/prod-ucs-content-store-eu-west/content/pii:S246882311730528X/gr2/THUMBNAIL/image/gif/320a0a1b58aa4bfcb9b8430bf01fd92a/gr2.sml gr2 gr2.sml sml 3254 92 219 IMAGE-THUMBNAIL 1-s2.0-S246882311730528X-gr3.jpg https://s3-eu-west-1.amazonaws.com/prod-ucs-content-store-eu-west/content/pii:S246882311730528X/gr3/DOWNSAMPLED/image/jpeg/113c86977bf5eea96e18adb10e2e52a9/gr3.jpg gr3 gr3.jpg jpg 102967 574 678 IMAGE-DOWNSAMPLED 1-s2.0-S246882311730528X-gr3.sml https://s3-eu-west-1.amazonaws.com/prod-ucs-content-store-eu-west/content/pii:S246882311730528X/gr3/THUMBNAIL/image/gif/f10820b3c8d86d138b2eab81b0c502ad/gr3.sml gr3 gr3.sml sml 12027 163 193 IMAGE-THUMBNAIL 1-s2.0-S246882311730528X-gr4.jpg https://s3-eu-west-1.amazonaws.com/prod-ucs-content-store-eu-west/content/pii:S246882311730528X/gr4/DOWNSAMPLED/image/jpeg/6f7b13bd7f75210197b0af4a99c17b0e/gr4.jpg gr4 gr4.jpg jpg 34271 269 640 IMAGE-DOWNSAMPLED 1-s2.0-S246882311730528X-gr4.sml https://s3-eu-west-1.amazonaws.com/prod-ucs-content-store-eu-west/content/pii:S246882311730528X/gr4/THUMBNAIL/image/gif/398759beb3dd2310587311d6da248ad3/gr4.sml gr4 gr4.sml sml 4919 92 219 IMAGE-THUMBNAIL 1-s2.0-S246882311730528X-gr5.jpg https://s3-eu-west-1.amazonaws.com/prod-ucs-content-store-eu-west/content/pii:S246882311730528X/gr5/DOWNSAMPLED/image/jpeg/de5b376e3da7089fc38f69a7501c85b9/gr5.jpg gr5 gr5.jpg jpg 41992 229 489 IMAGE-DOWNSAMPLED 1-s2.0-S246882311730528X-gr5.sml https://s3-eu-west-1.amazonaws.com/prod-ucs-content-store-eu-west/content/pii:S246882311730528X/gr5/THUMBNAIL/image/gif/15cc7a63ceb20d9a54bf4f735b286011/gr5.sml gr5 gr5.sml sml 16058 102 219 IMAGE-THUMBNAIL 1-s2.0-S246882311730528X-gr6.jpg https://s3-eu-west-1.amazonaws.com/prod-ucs-content-store-eu-west/content/pii:S246882311730528X/gr6/DOWNSAMPLED/image/jpeg/685da281a7bf7f33424a3a46cc982b5e/gr6.jpg gr6 gr6.jpg jpg 111018 547 565 IMAGE-DOWNSAMPLED 1-s2.0-S246882311730528X-gr6.sml https://s3-eu-west-1.amazonaws.com/prod-ucs-content-store-eu-west/content/pii:S246882311730528X/gr6/THUMBNAIL/image/gif/e9a94852d8fde5364b8f015b43e0774c/gr6.sml gr6 gr6.sml sml 22327 164 169 IMAGE-THUMBNAIL 1-s2.0-S246882311730528X-gr7.jpg https://s3-eu-west-1.amazonaws.com/prod-ucs-content-store-eu-west/content/pii:S246882311730528X/gr7/DOWNSAMPLED/image/jpeg/d0514d012fd365b359906c79d38d2f6a/gr7.jpg gr7 gr7.jpg jpg 9103 192 367 IMAGE-DOWNSAMPLED 1-s2.0-S246882311730528X-gr7.sml https://s3-eu-west-1.amazonaws.com/prod-ucs-content-store-eu-west/content/pii:S246882311730528X/gr7/THUMBNAIL/image/gif/be6960213e2305a0fa3c36ae94b29a4d/gr7.sml gr7 gr7.sml sml 3646 115 219 IMAGE-THUMBNAIL 1-s2.0-S246882311730528X-gr8.jpg https://s3-eu-west-1.amazonaws.com/prod-ucs-content-store-eu-west/content/pii:S246882311730528X/gr8/DOWNSAMPLED/image/jpeg/670c85c7fe15c2cbfe8c43770b31ffaa/gr8.jpg gr8 gr8.jpg jpg 81755 768 565 IMAGE-DOWNSAMPLED 1-s2.0-S246882311730528X-gr8.sml https://s3-eu-west-1.amazonaws.com/prod-ucs-content-store-eu-west/content/pii:S246882311730528X/gr8/THUMBNAIL/image/gif/639b91edf5b3f4d7791332ffa0113144/gr8.sml gr8 gr8.sml sml 10408 163 120 IMAGE-THUMBNAIL 1-s2.0-S246882311730528X-gr9.jpg https://s3-eu-west-1.amazonaws.com/prod-ucs-content-store-eu-west/content/pii:S246882311730528X/gr9/DOWNSAMPLED/image/jpeg/f167f864848ce38f3a35e1b46d80e687/gr9.jpg gr9 gr9.jpg jpg 99615 496 622 IMAGE-DOWNSAMPLED 1-s2.0-S246882311730528X-gr9.sml https://s3-eu-west-1.amazonaws.com/prod-ucs-content-store-eu-west/content/pii:S246882311730528X/gr9/THUMBNAIL/image/gif/9466e07614c4682b0746c40badd70f83/gr9.sml gr9 gr9.sml sml 11227 164 205 IMAGE-THUMBNAIL 1-s2.0-S246882311730528X-mmc1.doc https://s3-eu-west-1.amazonaws.com/prod-ucs-content-store-eu-west/content/pii:S246882311730528X/mmc1/MAIN/application/msword/94a9243e1a690ecd7ca8034f7c1e36fb/mmc1.doc mmc1 mmc1.doc doc 578560 APPLICATION 1-s2.0-S246882311730528X-am.pdf https://s3-eu-west-1.amazonaws.com/prod-ucs-content-store-eu-west/content/egi:10XN5QMN84F/MAIN/application/pdf/444dd0fb07b37e85b3be6c6114423a85/am.pdf am am.pdf pdf false 1808508 AAM-PDF MCAT 332 100332 S2468-8231(17)30528-X 10.1016/j.mcat.2017.10.002 Elsevier B.V. Fig. 1 XRD patterns of fresh and aged catalysts. Fig. 1 Fig. 2 H2-TPR profiles of the (a) fresh and (b) aged catalysts. Fig. 2 Fig. 3 XPS spectra of Pd 3d (a and c) and Ce 3d (b and d). Fig. 3 Fig. 4 CO adsorption curves of Pd/Al, Pd/Ce/Al and Ce/Pd/Al reduced by H2 before and after aging treatment. Fig. 4 Fig. 5 HRTEM images of Pd/Ce/Al-a catalyst (a) PdO particles in contact with CeO2; (b) dispersion image of PdO particles. Fig. 5 Fig. 6 HRTEM images of Ce/Pd/Al-a catalyst (a) CeO2 (200) in contact with Al2O3; (b) Pd0 in contact with Al2O3; (c) PdO particle incontact with CeO2 and Al2O3; (d) dispersion image of PdO particles. Fig. 6 Fig. 7 Palladium particle size distribution bar chart of the aged catalysts obtained by HRTEM. Fig. 7 Fig. 8 EDS images of Pd/Ce/Al-a (a–d) and Ce/Pd/Al-a (e–h). Fig. 8 Fig. 9 DRIFTS spectra of (a) Pd/Ce/Al-f, (b) Ce/Pd/Al-f, (c) Pd/Ce/Al-a, (d) Ce/Pd/Al-a under stoichiometric CO + NO + C3H8 + O2 reaction condition. Spectra were taken from 50 °C to 400 °C. Fig. 9 Fig. 10 Brief modes of Pd dispersion on the Al2O3 support at different impregnation sequence. Fig. 10 Fig. 11 Conversion curves of C3H8, NO and CO as a function of temperature at stoichiometry (λ = 1) over the supported fresh (a, c and e) and aged catalysts (b, d and f). Fig. 11 Fig. 12 Conversion temperature of Pd/Ce/Al-a, Ce/Pd/Al-a and Pd/CZ/Al-a catalyst: (a) light-off temperature and (b) full-conversion temperature. Fig. 12 Table 1 Textural property of fresh and aged catalysts. Table 1 Catalysts Surface Area (m2 g−1) Pore Volume (cc g−1) Pore Diameter (nm) Pd/Al-f 96 0.31 14.8 Pd/Ce/Al-f 104 0.38 14.6 Ce/Pd/Al-f 115 0.38 13.0 Pd/Al-a 71 0.32 18.8 Pd/Ce/Al-a 83 0.39 19.0 Ce/Pd/Al-a 84 0.42 19.8 Table 2 CeO2 crystallite sizes and lattice parameters of fresh and aged catalysts. Table 2 Catalysts CeO2 Crystal size (nm) Lattice constants a Pd/Ce/Al2O3-f 9.1 0.5403 Ce/Pd/Al2O3-f 7.0 0.5397 Pd/Ce/Al2O3-a 13.0 0.5413 Ce/Pd/Al2O3-a 11.5 0.5404 a As calculated by scherrer equation, based on the reflection of fluorite CeO2. Table 3 Surface elemental composition and atomic ratio over catalysts measured by XPS. Table 3 Catalysts Relative amount (%) Pd2+in total (%) Ce3+ in Ce (%) Pd 3d Ce 3d Al 2p O 1s Pd/Ce/Al-f 1.59 16.57 9.51 72.33 0.91 17.5 Ce/Pd/Al-f 1.53 17.29 9.13 72.05 0.74 16.7 Pd/Ce/Al-a 0.88 8.9 10.9 79.32 0.59 24.9 Ce/Pd/Al-a 0.76 9.5 10.8 78.94 0.42 19.2 Table 4 Elemental content of palladium species over catalysts measured by XPS and ICP. Table 4 samples Pd surface content a (wt%) Pd total content b (wt%) Pd/Ce/Al-f 4.3 1.7 Ce/Pd/Al-f 4.1 1.5 Pd/Ce/Al-a 3.2 1.5 Ce/Pd/Al-a 2.7 1.4 a Probed by X-ray photoelectron spectroscopy. b Measured by Inductively Coupled Plasma-Atomic Emission Spectrometry. Table 5 Elements content in Pd/Ce/Al-a and Ce/Pd/Al-a by EDS point-analysis. Table 5 sample Pd (wt%) Ce (wt%) Al (wt%) O (wt%) Pd/Ce/Al-a a1 10.41 47.1 14.65 27.82 c1 0 38.98 12.4 48.61 Ce/Pd/Al-a g1 9.46 11.25 37.3 41.97 h1 0 12.64 33.79 53.56 Table 6 Light-off temperature (T 50) and full conversion temperature (T 90) of fresh and aged catalysts. Table 6 Catalysts C3H8 NO CO T 50 T 90 T 50 T 90 T 50 T 90 Pd/Ce/Al-f 293 323 174 210 160 176 Ce/Pd/Al-f 281 316 153 180 140 151 Pd/Ce/Al-a 333 361 234 264 200 212 Ce/Pd/Al-a 318 351 207 244 180 202 Editor’s choice paper Effect of the loading sequence of CeO2 and Pd over Al2O3 on the catalytic performance of Pd-only close-coupled catalysts Min Sun a Wei Hu b Shandong Yuan c Hailong Zhang b Tianqiong Cheng a Jianli Wang a * Yaoqiang Chen a * a College of Chemistry, Sichuan University, Chengdu 610064, China College of Chemistry Sichuan University Chengdu 610064 China b College of Chemical Engineering, Sichuan University, Chengdu, Sichuan 610064, China College of Chemical Engineering Sichuan University Chengdu Sichuan 610064 China c Institute of New Energy and Low-Carbon Technology, Sichuan University, Chengdu, Sichuan 610064, China Institute of New Energy and Low-Carbon Technology Sichuan University Chengdu Sichuan 610064 China ⁎ Corresponding authors. Graphical abstract The different loading sequence CeO2 and Pd over Al2O3 support influences palladium dispersion by the interaction, which is main factor in influencing the catalytic activity. Ce/Pd/Al catalyst owns smaller palladium particle size and higher palladium dispersion than Pd/Ce/Al catalyst, which is considered as active site. A simple process is described as is shown above, and specific process is illustrated in my article. The Pd-only close-coupled catalysts of the different loading sequence of CeO2 and Pd over Al2O3 were prepared using consecutive wetness impregnation method. Differences in structural, surface properties and catalytic performance, together with the thermal aging behaviors of catalyst at 1000 °C were investigated systematically by XRD, TPR, XPS, ICP, CO adsorption and TEM. Consequently, the Ce/Pd/Al catalysts loaded Ce after Pd over the alumina show superior structural properties before and after aging treatment, suggesting the Ce/Pd/Al catalysts possess better thermal resistance than Pd/Ce/Al catalysts loaded Pd after Ce. Moreover, the aged Ce/Pd/Al catalysts possess stronger reducible probed by TPR, and HRTEM and CO adsorption show smaller particles size of Pd and higher palladium dispersion. As a result, for Ce/Pd/Al catalysts, more palladium sites play a role as active site, which promotes low temperature conversion of pollutants effectively. The catalytic performance of the catalysts is forcefully subject to palladium dispersion and reduction property, especially for NO conversion, and the light-off temperature of NO over aged Ce/Pd/Al is 27 °C lower than aged Pd/Ce/Al. The results have demonstrated that novel loading sequence is beneficial to catalytic activity which is maintained even after aging treatment. Keywords Loading sequence Pd-only close-coupled catalysts Palladium dispersion Thermal stability Catalytic performance 1 Introduction With the wide usage of automobiles in recent years, emissions from gasoline engine-powered vehicles have been considered as one of the main source for air pollution [1–3]. The close-coupled catalyst (CCC), which is typically installed close to engine, is used to reduce the cold-tart emission. Hence, the CCC is usually employed during high temperature operation. Furthermore, Tightened standards for contaminants including unburned hydrocarbons (HCs), carbon monoxide (CO) and nitrogen oxide (nitric oxide and nitrogen dioxide) are being taken into account. Therefore, the low temperature catalytic activity and thermal stability are two great challenges [1,4]. Generally, catalytic converters are regarded as the most sufficient solution for emission reduction [5]. Known close-coupled catalyst generally comprises one or more platinum group metals, and normally located upon high surface area, refractory oxide support like gamma-Al2O3 (γ-Al2O3). Extensive investigations concerning Pd-only catalysts are made for its favorable performance in hydrocarbon oxidation [6–8]. It was reported that among Pd0, PdO and PdO2, PdO is considered as the most active species in the conversion of hydrocarbons [9,10]. However, it is hard to maintain PdO at such a high temperature (higher than 1000 °C) which close-coupled catalyst must be exposed to, and the decomposition of PdO into Pd0 at 750 °C could aggravate the agglomeration of Pd species. [11] As a result, the sintered bulk Pd0 is hard to be fully reoxidated during cooling process and leads to decrease effective content of PdO (so-called “dispersion”) [12]. To maintain more active sites over Pd/Al2O3 loaded Pd over alumina, additives are commonly adopted, such as ceria, zirconia, while the catalysts still keep lower palladium dispersion which the catalytic activity is sensitive to. According to relative literatures [13–15], ceria is an effective promoter in catalytic reaction for its oxygen storage capacity, and CeO2-based systems can promote PdO formation during cooling at higher temperature and stabilize PdO species effectively through an interaction via surface oxygen. In addition, ceria could suppress the agglomeration of palladium species by an intimate interaction and accelerate the reoxidation properties of Pd0 [12]. Nowadays, various addition manners of ceria and Pd has been explored, including co-impregnation [16], step-wise impregnation [17], combustion [18] and the like, and diverse addition ways lead to different the nature of precious metal supported on supports because of the interaction between Pd and ceria. Traditionally, for step-wise impregnation method, ceria is generally loaded over Al2O3, and then Pd is as the second layer [19,20], aiming at containing higher surface Pd concentration. It’s assumed that palladium species which are exposed on the surface of the catalyst would provide more active sites for catalytic reaction. Besides, the most of Pd would interact with ceria instead of Al2O3 under this loading sequence. Recently, many investigations carried out on the influence of the support concluded that catalytic properties and stability under reaction of Pd-based catalyst strongly depend on the nature of the support, and on the interaction that exists between the palladium particles and the support. In this work, in order to decrease the sintering of the palladium species and increase the palladium dispersion, ceria as the second loading layer named as Ce/Pd/Al catalyst was investigated systematically, can suppress the sintering of palladium species by the interaction which may be the formation of PdOCe bond [21] and occupy the different space site with palladium species over the alumina which is called diffusion barrier [15]. However, the reference sample is prepared by traditional loading order designed as Pd/Ce/Al catalyst. Astoundingly, we find that leaving ceria instead of Pd as the second layer is favorable for the catalytic performance, and is demonstrated to be a more excellent loading sequence than Pd instead of ceria as the second layer simultaneously. The effect of the loading sequence of Pd and ceria was investigated from textural, structural, morphological and reduction properties after aging. N2-adsoprtion, power X-ray diffraction (XRD) and high resolution transmission electron microscopy (HRTEM) were carried out. Concurrently, elements composition and adsorption character were measured by X-ray photoelectron spectroscopy (XPS), inductively coupled plasma-atomic emission spectrometry (ICP-AES) and in situ diffuse reflectance infrared Fourier transform spectroscopy (DRIFTS). The stability of PdO and palladium dispersion were tested by H2 temperature programed reduction (H2-TPR) and CO adsorption method, respectively. 2 Experimental 2.1 Preparation of Pd/Ce/Al and Ce/Pd/Al catalysts All the catalysts were obtained by wetness impregnation method. Firstly, the Al2O3 powders (SBET = 111 m2 g−1, Paterson) were impregnated with the aqueous solution of Ce(NO3)3·6H2O (Keshi, 99 wt%). According to our previous work, the appropriate amount of CeO2 loading was chosen as 17.5 wt% (Fig. S1). Afterwards, the impregnated sample was dried at 100 °C and then calcined at 600 °C for 3 h. Secondly, aqueous Pd(NO3)2 solution (Heraeus, 15.50 wt% Pd) was impregnated onto the obtained supports, then, the impregnated powder was submitted to drying at 120 °C and calcining at 550 °C for 3 h. Finally, the catalyst powders are ball milled with a binder to form slurry and coated on a commercial monolithic cordierite (2.5 cm3, Corning, China) containing Pd 2 g L−1. The washcoat loading was obtained based on the difference in the weight of the monolith before washcoating and calcining, and the loading amounts for the catalysts were 120 g L−1. The monolithic catalyst was calcined at 550 °C for 3 h, and the obtained fresh catalyst was named as Pd/Ce/Al-f. After 1000 °C calcination in air for 5 h the aged catalyst was obtained, which is labeled as Pd/Ce/Al-a. The synthesis of Ce/Pd/Al was the same as the synthesis of Pd/Ce/Al stating above except for the sequence of the first step and the second step exchanged. The fresh catalyst was labeled as Ce/Pd/Al-f and the aged catalyst was named as Ce/Pd/Al-a. 2.2 Catalytic activity test The activities of these catalysts for eliminating target pollutants were tested in a multiple fixed-bed flow microreactor, and the gas mixture similar to gasoline engine exhaust was passed through the reactor continuously. The simulated exhaust gas contained a mixture gas of CO (0.6%), C3H8 (0.06%), NO (0.06%), CO2 (12%), H2O (10%), and N2 (balance) and O2 (adjustable). The gas hourly space velocity (GHSV) was 40,000 h−1. The concentration of C3H8, NO and CO was analyzed online by a five-component analyzer (FGA-4100, Foshan Analytical Instrument Co., Ltd., China) before and after the simulated gas was passed through the microreactor. The catalysts were pretreated under the reaction condition at 550 °C for 1 h prior to the measurement, and the catalytic performance was tested during temperature programmed cooling process. 2.3 Characterization techniques The textual properties were measured by N2 adsorption–desorption at −196 °C on Quantachrome automated surface area & pore size analyzer (Autosorb SI). The samples were degassed at 300 °C for 3 h under vacuum before measurement, and the specific surface areas of the samples were calculated by the Brunauer–Emmett–Teller (BET) method. To investigate the phase changes occurred on samples, X-Ray Diffraction (XRD) of the catalysts were carried out on a Rigaku DX-2500 diffractometer equipped with Cu Kα (λ = 0.15406 nm) as radiation, the interval of the spectra was 0.03°. X-ray photoelectron spectroscopy (XPS) analysis results were recorded on a British Kratos XSAM-800 electron spectrometer equipped with Mg Kα (1253.6 eV) as the radiation. The XPS data associated with Pd 3d, Al 2p, O 1 s and Ce 3d core levels were collected for all samples. The binding energies of the elements were calibrated using the C 1 s peak at 284.6 eV as the internal standard reference. Elemental composition was determined by inductively coupled plasma-atomic emission spectrometry (ICP-AES) using a Varian 715-ES. Temperature Programmed Reduction (H2-TPR) was carried out on a self-assembled equipment. Before TPR measurement, the samples were dried at 120 °C to remove water. The reduction reaction was performed using a mixture of 5% H2/N2 (v/v) at a heating rate of 9 °C/min from RT to 600 °C. The up-take amounts of H2 were detected by TCD during this process. The microstructures of catalysts were observed by transmission electron microscopy equipped with field emission gun (FE-TEM) (JEM2100F, JEOL) at the accelerating voltage of 200 kV. TEM images were recorded by CCD camera. The elemental distribution of the samples was analyzed by the energy dispersive spectrometer (EDS) to show the element distribution at lower magnification. The CO-Pd adsorption method was performed to estimate the dispersion of palladium particles. Before the measurement, the samples were reduced at 450 °C for 40 min using 5% H2/N2 (v/v) at a heating rate of 10 °C/min from RT to 450 °C, and then using N2 at a decreasing rate of 10 °C/min from 450 °C to RT. Finally, the samples were carried out at RT using 2% CO/N2 for 30 min. DRIFTS spectra were collected using a Nicolet 6700 FTIR with a MCT detector. All spectra were obtained with a resolution of 4 cm−1 and an accumulation of 100 scans. The samples were in situ pretreated for 0.5 h in N2 (30 ml min−1) stream at 50 °C. Subsequently, the system was cooled down to 50 °C in N2 and the background spectra were recorded. Two types of DRIFTS experiments were performed: (1) CO adsorption experiments were performed at 30 °C with a flow of 0.75% CO/Ar. Prior to CO adsorption, the catalyst was first reduced by purified H2 at 350 °C for 0.5 h and then purged with Ar for 0.5 h. (2) DRIFTS reaction experiments corresponding to the simulated reaction mixture were conducted, and the spectra were recorded as a function of temperature. Except for water vapor, the gas concentration of the gas mixture was the same as those in the catalytic activity tests. 3 Results and discussion 3.1 Textural properties The specific surface area, average pore size and total pore volume of the catalysts were measurement by N2 adsorption-desorption experiments at the temperature of the liquid nitrogen. The specific surface area and total pore volume were calculated according to the BET and BJH method, respectively, and the results, including surface area, pore volume and average pore radius, are demonstrated in Table 1 . As shown in Table 1, the surface area of fresh catalysts is larger than that of aged, indicating that a certain degree of sintering occurs obviously [19] during the aging treatment, leading to a conspicuous loss of specific surface. For fresh catalysts, Ce/Pd/Al-f shows higher specific area and lower pore diameter than that of Pd/Ce/Al-f, and it suggests that palladium species may occupy a part of pore volume of alumina and CeO2 over the surface of the catalyst could offer some specific area. However, barely no distinction of the specific areas is observed over the two aged catalysts while disparity of the catalytic performance still exists after thermal aging which will be discussed behind, implying that the specific area is not the critical factor in this system, which is advantageous to enhance the catalytic performance of the supported catalyst and the sintering degree of alumina is almost the same, as discussed in the following section. As is well known, aging treatment often results in the collapse of small pores and the formation of larger ones, leading to form a larger pore size [22], which can well accounts for the larger pore radius of the aged samples compared with the corresponding fresh ones. In summation, different loading sequence has not a conspicuous effect on the textural property of the catalysts. 3.2 XRD characterization The part results of XRD were summarized in Table 2 . Fig. 1 shows the XRD patterns of all catalysts, and CeO2 crystallite sizes and lattice parameters of fresh and aged catalysts are illustrated in Table 2. For fresh catalysts, the diffraction peaks at 28.6°, 33.1°, 47.5°, 56.3° and 76.7° are observed over both catalysts, which are assigned to the cubic fluoride CeO2 crystal phase [12]. The diffraction peaks of CeO2 over Pd/Ce/Al-f are obviously sharper than that of Ce/Pd/Al-f, implying that the crystallite size of CeO2 is larger by directly introducing ceria on the Al2O3 surface. The mean crystallite size of CeO2 calculated by the Scherrer equation confirms the statement (see in Table 2), and the crystallite sizes of CeO2 of Ce/Pd/Al and Pd/Ce/Al were 7.0 and 9.1 nm, respectively. Other than CeO2 species, there are diffraction peaks corresponding to Al2O3 which is located at 45.8° and 66.8°. However, no peaks correlated to PdO or Pd was observed, a possible reason is that Pd species are amorphous particles and well dispersed on the surface [23] or is incorporated into the CeO2 lattice [18], and furthermore, the grain might be too small to be observed by XRD which corresponds to the small Pd loadings [19,24]. To investigate the effect of the double thermal treatment and make the result convincing, the Ce/Pd/Al-f sample is calcined again at 550 °C labeled as Ce/Pd/Al-f-550 behind. The part results of XRD were summarized in Table S2, and Fig. S2 shows the XRD patterns of the both samples. Ce/Pd/Al-f-550 sample presents almost the same peak intensity and shape as Ce/Pd/Al-f sample. Meanwhile, as is shown in Table S2, the change of ceria particle size is signifcantly small before and after calcined at 550 °C again, whose particles size are obviously smaller than that of Pd/Ce/Al2O3-f, suggesting that Ce/Pd/Al-f sample reveals more preferable heat-resisting property and structural stability. The aforementioned observation further declares that the novel loading sequence processes more excellent thermal resistance. After aging treatment, all XRD profiles show a peak sharpening to a certain extent on account of the grain growth during the aging process. Meanwhile, Al2O3 usually transforms from gamma phase to theta, delta, or alpha phase after themral treatment at 1000 °C [25], and visible γ-Al2O3 phases can be observed for all samples, but peak intensity of alumina keeps the same and no obvious transformation of γ-Al2O3 to θ-Al2O3 or δ-Al2O3 is displayed after aging, suggesting that the heating-resisting property of Al2O3 is improved by the presence of cerium [15], thus Al2O3 crystallites may keep nearly amorphous structure [23] or gamma phase. However, an obvious peak at 34.0° is detected over both catalysts, which is ascribed to the diffraction peak of PdO (101) (110), suggesting that a severe agglomeration of Pd species occurs during aging process, and the tiny Pd particles in the fresh catalysts are apt to grow up upon thermal treatment, and subsequently lose atomic dispersion on the support. From Fig. 1, analysing the peak FWHM value of the two samples, we can obtain that the peak FWHM value of Ce/Pd/Al-a (circa 0.288°) is obviously larger than that of Pd/Ce/Al-a (circa 0.224°), declaring that the peak assigned to PdO species of Pd/Ce/Al-a becomes more sharpened than that of Ce/Pd/Al-a and the sintering of Pd/Ce/Al is more serious than Ce/Pd/Al during the aging process. I.e., Ce/Pd/Al catalyst possesses better structural stability than Pd/Ce/Al catalyst upon thermal aging. In addition, the phase of Pd0 is not detected, suggesting that a portion of the Pd0 formed during high temperature is reoxidized during cooling process [26] and another portion of Pd including metal palladium and palladium oxide can disperse on the support well in the form of amorphous particles. It is also worth noting that the crystallite size of the catalysts follows a sequence of Pd/Ce/Al > Ce/Pd/Al, irrespective of the fresh or thermal treated samples, declaring that ceria instead of Pd as the second layer has a positive influence on maintaining a comparatively small crystallite size, the grain growth upon with strong interaction between Pd and Al2O3 is retarded, and the particle aggregation can be effectively suppressed for Ce/Pd/Al-a. It is concluded again that Ce/Pd/Al possesses better structural stability than Pd/Ce/Al upon thermal aging. Moreover, after the aging, the lattice constants of Pd/Ce/Al-a was larger than that of Ce/Pd/Al-a, and the variation of lattice structure was induced by the loading of palladium component and calcination at high temperature, declaring that Ce/Pd/Al catalyst forms more oxygen vacancies during the thermal aging, which are in favor of catalytic activity. In other words, more palladium component might dissolve into the lattice of ceria for Pd/Ce/Al-a. The possible reason is that Pd instead of ceria as the second layer only forms interaction with ceria. 3.3 H2-TPR results The oxidation-reduction property of PdO x was characterized by H2-temperature programmed reduction technique, and the results were illustrated in Fig. 2 . According to relevant literatures [27,28], the low temperature peaks below 200 °C are ascribed to the reduction of PdO species, and the reducibility of palladium oxide is an important factor influencing the catalytic performance [29], especially under insufficient oxygen condition. As shown in Fig. 2(a), obvious differences among the both are found for fresh catalysts. Pd/Ce/Al-f and Ce/Pd/Al-f feature only one reduction peak, and the reduction temperature of Ce/Pd/Al-f is 17 °C higher than that of Pd/Ce/Al-f. Meanwhile, the hydrogen consumption in terms of the integral peak areas of Pd/Ce/Al-f is relatively larger than that of Ce/Pd/Al-f. From the above mentioned phenomenom, Pd/Ce/Al-f exhibits the excellent reducibility due to its lower reduction temperature and the hydrogen consumption, suggesting a favorable stability of PdO x exposed to outermost layer directly is achieved when ceria is loaded after Pd. In fact, in the complex catalytic reaction system, the redox properties of active palladium species are not the main factors in influencing catalytic performance, other factors such as Pd dispersion, configuration and morphology of active Pd sites, and the interaction between Pd and supports may play a more significant role [30]. The intensity of reduction peak decreases obviously owing to the lower dispersion of active PdO species caused by the serious sintering during the aging process. As we could see in Fig. 2(b), the reduction temperature of Pd/Ce/Al-a is 97 °C while Ce/Pd/Al-a possess two reduction temperatures at 93 °C and 115 °C respectively, suggesting that most of PdO x over Ce/Pd/Al-a is easier to be reduced than that of Pd/Ce/Al-a and a small portion of reduction peak is assigned to the occurrence of back-spillover poccess of oxygen from ceria to PdO [31,32]. In other words, a part of cerium oxide is reduced by H2 at lower temperature, and as is well known, reduction temperature of ceria is more than 500 °C under hydrogen atmosphere [19,33], suggesting that ceria of the catalysts loaded Ce after Pd can show more reducible than that of the catalysts loaded Pd after Ce and oxygen storage-release can proceed better at lower temperature, which may facilitate the conversion of CH and CO effectively. According to the literatures [19,20], the reduction temperature for PdO species of Ce/Pd/Al-a is lower than that of Pd/Ce/Al-a, since the hydrogen consumption in terms of the integral peak areas is almost the same for the aging samples, proving the result that the reduction performance of Ce/Pd/Al-a is relatively better than Pd/Ce/Al-a. The gap of reduction temperature is slightly smaller, declaring that the redox properties of active palladium species are not the main factors in influencing catalytic performance. After thermal aging, the reduction temperature of all catalysts shifts to lower temperature, which illustrates that the reduction ability of the catalyst is improved. There may be two reasons to explain this result. The first possible explanation is that the interaction between cerium species and PdO is enhanced by forming CeOPd bonds during thermal aging which can restrain the sintering of palladium species and makes the Ce/Pd/Al-a catalyst keep relatively higher palladium dispersion [21] than the catalyst no adopting any promoter, which is further verified by CO adsorption. There exists spillover phenomenon of adsorption hydrogen. Metal palladium can transfer adsorption hydrogen to ceria better under the hydrogen atmosphere, and ceria is easily reduced at lower temperature [28,30,34]. The second cause is the decomposition of PdO during thermal aging, leading to more metal palladium particles. Metal palladium can assist the dissociation and spillover of hydrogen, resulting in the decrease of reduction temperature [23]. 3.4 XPS results and ICP-AES The surface elemental composition and atomic ratio of the catalysts were analyzed by XPS. The surface elemental contents were calculated from Ce 3d, Al 2p, O 1s and Pd 3d core level spectra and the results are listed in Table 3 . The obtained XPS spectra of Pd 3d and Ce 3d are plotted in Fig. 3 . Eight peaks can be observed in the spectra of Ce 3d, those labeled “u” arise from 3d3/2, and the others marked as “v” are attributed to 3d5/2. The doublet (u’, v’) is characteristic of Ce3+, while the others are all assigned to the diversified states of Ce4+ [35]. For the supported Pd catalysts, the oxygen vacancies related to the Ce3+ species close to the noble metal particles are universally considered as active sites for NO reduction, and hence the higher proportion of Ce3+ can contribute to improved NO catalytic activity [36,37]. As shown in Table 4 , slight differences are observed between the theoretical amount of palladium (1.64 wt%), and the experiment dates are evaluated by mean of ICP-AES. Amounts of palladium vary then between 1.7 wt% and 1.4 wt%. Regardless of the fresh and aged catalysts, as Pd/Ce/Al catalyst possesses the larger proportion of Ce3+ in Ce, which does not accord with the XRD result obviously, the surface Ce3+ atomic content of Ce/Pd/Al catalyst is almost the same as that of Pd/Ce/Al catalyst from Table 4, suggesting that for Ce/Pd/Al catalyst more oxygen vacancies exist in the bulk phase and the surface oxygen vacancies may be not main factor in infulencing the catalytic performance. PdO particles are universally considered as the actve site of catalytic activity, while the Pd/Ce/Al catalyst possesses slightly higher surface PdO content than Ce/Pd/Al catalyst. As for this condition, we know that surface content of Pd species over Ce/Pd/Al is lower slightly and total content of Pd is almost the same obtained by ICP-AES. From Table 5 , the ratio of surface PdO content is larger than the amounts ratio of palladium species, and the aged catalysts are in possession of lower surface Pd content than the corresponding catalysts, suggesting that part of Pd is dispersed in the bulk phase of the catalyst after the aging treatment. Meanwhile, the lattice constant of Ce/Pd/Al is smaller than that of Pd/Ce/Al before and after the aging, which is not in accordance with the XPS result. It is generally accepted that the coexistence of Ce3+ and Ce4+ is indicative of oxygen vacancies, which is of great importance to the redox properties and the corresponding catalytic activity [38]. The cause for this discrepancy is that the result probed with XPS finds surface content of various elements on account of the finite electron mean free path [12], while the results detected by XRD and ICP reflect overall average condition. According to relevant works reported [13,14], CeO2-based systems can effectively stabilize PdO species through an interaction with surface oxygen. Concerning the fresh and aging Ce/Pd/Al catalyst, although its total surface content of palladium species is slightly lower than the corresponding Pd/Ce/Al catalyst, according to calculation its metal palladium content is higher than the Pd/Ce/Al obviously. XRD result declares that Pd/Ce/Al displays the worser thermal stability, which could be possible that Pd as second loading layer makes the surface possess higher content of precious metal, leading to the severer sintering of particles exposed at high temperature directly during aging process and the worser dispersion of noble metal. However, for Ce/Pd/Al catalyst, ceria as the second layer acts as diffsion barrizer [15] and can impede the direct contaction of palladium particles, implying that the sintering of palladium particles requires higher temperature. Hence, the truth that Pd/Ce/Al catalyst owning higher surface PdO content than Ce/Pd/Al catalyst is not in agreement with the catalytic activity can be explained by the dispersion of palladium species. The Ce/Pd/Al catalyst is in possession of the higher dispersion, leading to more active sites dispersed on the surface of the support and showing more promiment catalytic activity, which will be further confirmed by the HRTEM and CO adsorption. After the aging treatment, the catalysts own smaller surface palladium species and ceria, and there are two accounts to explain the change. The first cause may be the migration of atom at higher temperature, and the suface palladium species and ceria particles enter into the bulk phase and alumina migrates from the inner to the surface, which corresponds with the datas in Table 4, leading to the diminution of palladium species and cerium content and the increase of aluminum after aging [19,39]. The other account is the decomposition of PdO into metal palladium and the agglomeration of palladium species by the structural collapse of supports during the aging treatment [21,40]. The palladium species are encapsulated in the bulk and beyond the electron mean free path probed with XPS. As a result, surface palladium content detected by XPS is smaller obviouly. 3.5 CO adsorption The chemical states of palladium species in fresh and aged Pd/Ce/Al and Ce/Pd/Al catalysts were investigated by FT-IR measurements. FT-IR spectra of CO species adsorbed on the all catalysts heat-treated at 450 °C in H2 gas atmosphere are shown in Fig. 4 . For fresh catalysts, two kinds of IR bands (1960–1990, 2090 cm−1) are separately ascribed to bridged CO adsorbed to Pd0, linear CO on Pd0 [41,42]. For Pd/Al-f catalyst, the IR band intensity of linearly adsorbed CO is obviously weaker than that of bridged CO. This result indicates that palladium species in Pd/Al-f catalysts without Ce loading were worse dispersed. For Ce/Pd/Al-f and Pd/Ce/Al-f catalysts, the IR band intensity of linearly adsorbed CO was obviously stronger than that of bridged CO, which indicates that palladium species in Ce/Pd/Al-f and Pd/Ce/Al-f catalysts with Ce addition were highly dispersed and ceria can improve the dispersion of Pd species well, due to the interaction between PdO and cerium species [30]. Moreover, for Ce/Pd/Al-f, the fact that the IR band intensity of linearly adsorbed CO was relatively stronger than that of bridged CO is more obvious than Pd/Ce/Al-f catalyst. This result further implies that palladium species in the catalysts loaded Ce after Pd were dispersed better than the catalysts loaded Pd after Ce, which is due to the sintering of higher surface Pd concentration of the catalysts loaded Pd after Ce, which is sufficiently in accordance with the result probed with XPS. As is well known, CO adsorption can reflect the surface Pd dispersion of catalysts. After thermal treatment at 1000 °C, particles size became larger obviously and the palladium dispersion decreased significantly [43,44]. For Pd/Ce/Al-a, the IR band intensity of linearly adsorbed CO (2094 cm−1) was obviously weaker than that of bridged CO (1997 cm−1), which declares that palladium species in Pd/Ce/Al were worse dispersed after thermal treatment. However, for Ce/Pd/Al-a catalyst, the IR band intensity of linearly adsorbed CO (1967 cm−1) was obviously stronger than that of bridged CO (2090 cm−1), which shows that linearly adsorbed CO of catalyst loaded Ce after Pd is dominating and palladium species in Ce/Pd/Al-a catalysts were better dispersed on the support, indicating that the catalysts loaded Ce after Pd show more excellent thermal stability than the catalysts loaded Pd after Ce after aging treatment, which is in better accordance with XRD and XPS results. Aiming at above-mentioned result, it results from higher surface Pd content of Pd/Ce/Al verified by XPS, which facilitates Pd serious agglomerate during high temperature treatment and some part of palladium components seem not to play a role as active site [23], leading lower deispersion than Ce/Pd/Al-a catalyst and showing lower catalytic activity. Therefore, regardless of the fresh and aged catalysts, Ce/Pd/Al is in possession of larger palladium dispersion than Pd/Ce/Al, and exhibits more desirable catalytic activity. It is noteworthy that the shifts of wavenumber position for these bands are observed distinctly in Fig. 4. According to previous work reported [42,45,46], the shift in the peak position reflects the intensity of interaction that PdO particles undergo with support, suggesting that different loading sequences of CeO2 and Pd(NO3)2 can affect the interaction between PdO particles and support. Hence, the shifts of peak position declare that the different loading sequences have a great effect on the strong metal-support interaction (SMSI), showing different resistance to thermal deactivation during the thermal treatment, leading to different the dispersion of palladium species and with large Pd dispersion to clear superiority on catalytic performance. 3.6 TEM HRTEM images of aged catalysts are showed in Figs. 5 and 6 , respectively. For Pd/Ce/Al-a catalyst, as is shown in Fig. 5, PdO (110) plane [47] and CeO2 (220) plane are detected as inferred from the measured lattice spacing values, and alumina is almost amorphous. From Fig. 5(a), we see obviously that PdO particles are found in contact with the ceria, and do not obtain sufficient dispersion on the Al2O3, which is consistent with the result of the other literatures [12]. However, for Ce/Pd/Al-a catalyst, PdO (110), Pd (111) [48] and CeO2 (200) [39] planes are obtained respectively by HRTEM. From Fig. 6(a)–(c), PdO particles are well distributed and stabilized on the alumina and ceria, and CeO2 particles are dispersed on the alumina, suggesting that PdO particles still interact with ceria and alumina after aging thermal treatment by forming PdOCe bonds [21] and PdOAl bonds [49], respectively. Therefore, palladium species can keep higher dispersion by the interaction and the decreasing dispersion by sintering could strongly deteriorate the catalytic activity of supported Pd catalysts. From Figs. 5 (b) and 6 (b) and (d), the catalyst loaded Pd after Ce obviously possesses higher surface PdO content than the catalyst loaded Ce after Pd, which is in accordance with the result probed by XPS. PdO particles mean size of Pd/Ce/Al-a catalyst is about 5.64 nm, which is obviously larger than PdO particles size of Ce/Pd/Al-a catalyst whose particles mean size is about 5.28 nm calculated by TEM images. Meanwhile, as is showed in Fig. 7 , we can also obtain that the particles size of Ce/Pd/Al-a catalyst mainly focuses on 2–6 nm, while for Pd/Ce/Al-a catalyst the particles size mainly ranges from 4 to 8 nm, declaring that after aging treatment Ce/Pd/Al catalyst still keeps smaller PdO particles size and can distribute PdO particles well on the support, and it is possibility that PdO particles are stabilized on the ceria and alumina by forming strong interaction and ceria with palladium species can occupy the different space site over the alumina, leading to no direct contaction of palladium species (i.e. “diffusion barrier”), which can restrict the agglomeration of particles during the high temperature aging effectively [50]. It also explained that Ce/Pd/Al-a catalyst keeps stronger reducibility due to its smaller particles size versus Pd/Ce/Al-a catalyst [23]. As a result, Ce as second loading layer shows higher thermal stability and palladium dispersion, which verifies the result of CO adsorption again. Ciuparu et al. have reported that reduced Pd is more effective for NO decomposition than oxidized Pd in the interface of CeO2 [51]. Combining the TEM photographes with relative works, the active component palladium as second layer closely contacts with ceria, and its content of metal palladium is lower than the Pd catalyst that palladium component is loaded on the Al2O3, which is obtained by XPS. From many HRTEM images, we can see that for Pd/Ce/Al-a catalyst, PdO particles are mainly in contact with CeO2 and dispersed on CeO2, while for Ce/Pd/Al-a catalyst, PdO particles contact with CeO2 and Al2O3 and metal Pd is detected on the alumina. Therefore, Ce/Pd/Al-a catalyst owns higher palladium despersion than Pd/Ce/Al-a catalyst, which can promote the conversion of C3H8, NO and CO. As a result, Ce/Pd/Al-a catalyst shows higher catalytic activity, especially NO conversion. The reason why Ce/Pd/Al-a catalyst has a so great advantage for NO is that not only does it own higher palladium dispersion, but slso higher metal palladium content, which is active site of NO conversion [12]. The discrepancy obtained by XPS can be explained here. Both of the external surface oxygen vacancies are very close by calculating, while the gap of the catalytic activity is significantly obvious, demonstrating that the influencing the catalytic performance is not the surface oxygen vacancies but other factors, i.e. the dispersion of palladium species. To further get more information about the distribution of the different chemical elements at lower magnification, the EDS points-canning was carried out on the aged Pd/Ce/Al and Ce/Pd/Al samples (Fig. 8 ) and the results of elementals content are shown in Table 5. For the Pd/Ce/Al-a sample, the elemental content of Pd is 10.41 wt% in point a1 while no palladium exists in point c1. Meanwhile, for the Ce/Pd/Al-a catalyst, the elemental content of Pd is 9.46 wt% in point e1 whereas palladium species are not detected in point g1, suggesting that there are palladium species in the black areas, and white areas are mainly composed of non-noble metal species, which directly proves the above lattice fringe analysis detected by the HRTEM. Noticeable difference can be found among the four elements, and the precious metal distributions are obviously not homogeneous on the support surface, demonstrating that the palladium species have experienced the serious sintering after the thermal treatment, which can explain why palladium species are not detected in point c1 and g1. 3.7 In situ DRIFTS results Detailed DRIFTS were carried out over the fresh and aged catalysts. Time-course spectra for the catalysts in the range of 2500 cm−1 to 500 cm−1 are shown in Fig. 9 . For Pd/Ce/Al-f (Fig. 9(a)), the adsorption peaks at 1540 cm−1 and 1390 cm−1 are observed, which are assigned to the vibration of carbonate, suggesting that surface ceria of Pd/Ce/Al-f easily reacts with CO and the generation of carbonate. In comparison, the two peaks concerning the vibration of carbonate over Ce/Pd/Al-f (Fig. 9(b)) are not evident, which reveals that surface ceria of Ce/Pd/Al-f reacts with CO difficultly or surface carbon dioxide generated possesses stronger desorption property and seems to be adverse to forming carbonate. However, the peaks around 2097 cm−1 and 1976 cm−1 associating with the linear (Pd0-CO) and bridged carbonyls (Pd0-CO-Pd0), are found, indicating that Pd0 contacts with CO at 50 °C or lower immediately. After aging treatment, more Pd0 species existed over the surface of the catalysts and the on-top adsorption of CO was found on both of the aged catalysts, which is benefit to the conversion of CO at room temperature. However, the fact that desorption of CO2 is harder than the corresponding fresh one declares that the coverage of the active sites is severer. The band at 1598 cm−1 ascribed to acetate is obviously detected at 150 °C for Ce/Pd/Al-f and 170 °C for Pd/Ce/Al-f. Acetate is an intermediate product during C3H8 oxidation, suggesting that part of the C3H8 starts to convert, and the conversion of C3H8 over Ce/Pd/Al-f is at relatively lower temperature, which declares that catalytic activity of Ce/Pd/Al-f for the conversion of C3H8 is better than that of Pd/Ce/Al-f. It is noteworthy that the onset conversion temperature of C3H8 is above 250 °C, higher than that of revealed in DRIFTS, a possible explanation is that the existence of competitive adsorption of water vapor and C3H8 in the activity test process whereas no water vapor existed in the gas mixture of DRIFTS. After aging treatment, the formation temperature of acetate over the two aged catalysts is not observed, and this may result from unfitted temperature interval. The formation of isocyanate is crucially labeled as NO reduction, as we can see in Fig. 9(a and b), and there is a distinct difference between the two fresh samples. For Pd/Ce/Al-f, bands ascribed to isocyanate chemisorbed at Pd0 and Al3+ (at ∼2143 cm−1 and 2228 cm−1) appeared, suggesting that the NO + CO reaction starts to take place [52,53]. In addition, the presence of Pd0-NCO also revealed the decomposition of PdO x . Comparatively speaking, no significant peak concerning Pd0-NCO is detected over Ce/Pd/Al-f, and the intensity of 2228 cm−1 is very weak. There might be three reasons for this phenomenon. Firstly, ceria is covered over the surface of Pd, thus Pd species which are exposed to the surface are limited, leading to the absence of Pd0-NCO adsorption peak. Secondly, just as H2-TPR revealed, PdO x species are more stable and the reduction temperature was higher over Ce/Pd/Al-f, which could also result in the nonexistence of Pd0-NCO. Thirdly, it is assumed that surface oxygen over CeO2 would accelerate the reduction of NO. The NO conversion performance over Ce/Pd/Al-f is preferable and the content of ceria on the surface of Ce/Pd/Al-f is higher than that of Pd/Ce/Al-f, thus it is reasonable that the weak signal of Al3+-NCO is due to the fast reduction of NO. For aged catalysts, the adsorption of isocyanate over Al3+ is much lower than that of fresh ones, indicating that the aging treatment may causes a sintering of the active sites. In addition, it’s remarkable that a band at ∼1888 cm−1 [54] was observed when reaction temperature elevated to 330 °C for Pd/Ce/Al-f and 350 °C for Ce/Pd/Al-f, and the peak is more significant over the former catalyst. 3.8 Schematic diagram of Pd dispersion According to the characterization results mentioned above, especially CO adsorption and HRTEM, brief mode of palladium dispersion on the Al2O3 support at different impregnation sequence is shown in Fig. 10 . For the Ce/Pd/Al catalysts, firstly ca. 1.5 wt% Pd2+ (theoretical value: 1.64 wt%) is loaded on the Al2O3 support, and then Ce is supported. Pd2+ is dispersed on the Al2O3, and their interaction is formed by Al-O-Pd bonds which are weaker than CeOPd bonds obviously [30]. The addition of ceria in the nanometer scale separates palladium particles in space, which acts as a diffusion barrier [15]. As a result, the direct contact of palladium particles is restricted due to the addition of ceria by forming strong interaction of CeOPd bonds [21] and growth of the particles can be inhibited during the aging treatment, which could minish the decrease of palldium dispersion and palladium size siginificantly. Therefore, for the Ce/Pd/Al catalysts, more active sites play a significant role on catalytic performance. However, for the Pd/Ce/Al catalysts, firstly 17.5 wt% Ce is loaded on the Al2O3 support, and then Pd2+ is loaded by consecutive wetness impregnation method. Al2O3 and cerium are Lewis acid and base, respectively, and their interaction is stronger than that between palladium species and alumina distinctly [30] and the content of cerium is relatively more, which can render cerium that can be dispersed on the Al2O3 support surface closely. The addition of palladium particles is stabilized on the surface of cerium, and the surface palladium concentration is higher than the catalysts loaded Ce after Pd apparently in accordance with XPS result, while the contact of palladium particles isn’t restricted effectively and directly. As a result, the growth of the particles cannot be inhibited effectively during the aging treatment, which decreases palladium dispersion to some extent. Hence, as HRTEM shows, we can see that PdO particles are fixed on the ceria. 3.9 Catalytic performances Fig. 11 depicts the conversion curve of C3H8, NO and CO for fresh and aged catalysts. The corresponding light-off temperature (T 50) and full conversion temperature (T 90) were summarized in Table 6 . For fresh catalysts (Fig. 11a, c and e), Ce/Pd/Al-f displays a superior catalytic activity for C3H8, NO and CO eliminations compared with Pd/Ce/Al-f, and the light-off temperatures for all target pollutants over Ce/Pd/Al-f are obviously lower than that of Pd/Ce/Al-f. After aging treatment (presented in Fig. 11b, d and f), a notable decline of catalytic activity was observed in both of two aged catalysts. The T 50 for all target pollutants increases almost for 40 °C in comparison with the corresponding fresh one, and this phenomenon is familiar with literature reported before. The possible reason might correlate to the deterioration of support structure and sintering of active components [44,55]. It is generally thought that the coexistence of Ce3+ and Ce4+ is an indication of oxygen vacancies, which is of prime importance to the redox properties and the corresponding close coupled catalystic activity. It is noteworthy that the onset conversion temperature of C3H8 is above 250 °C, much higher than that of revealed in DRIFTS, and a possible explanation is that the existence of competitive adsorption of water vapor and C3H8 in the activity test process whereas no water vapor existed in the gas mixture of DRIFTS. For the fresh catalysts, Ce/Pd/Al-f pocesses relatively lower lattice constants and forms more oxygen vacancies related to the Ce3+ species in the lattice [40]. For Pd supported catalysts, the oxygen vacancies related to the Ce3+ species close to the noble metal particles are proposed to be active sites for NO activation, so the higher proportion of Ce3+ can facilitate NO catalytic activity [56]. In other words, Ce/Pd/Al-f owns more oxygen vacancies which can contribute to the catalytic activity, whereas both of oxygen vacancies are extraordinarily close, suggesting that oxygen vacancies are excluded from influencing the catalytic performance. From the above discussion, we can know that Ce/Pd/Al-f catalyst is in possession of lower surface PdO content probed by XPS and presents the larger dispersion of palladium species acquired by CO adsorption. Meanwhile, Ce/Pd/Al-f catalyst possesses larger surface area and smaller CeO2 partice size obtained by BET and XRD results, and the interaction between ceria and palladium species facilitates the dispersion of PdOX on the support surface by forming the PdOCe bonds [21]. Therefore, Ce/Pd/Al-f shows superior catalytic activity than Pd/Ce/Al-f due to its better palladium dispersion. For the aged catalysts, Ce/Pd/Al-a displays a superior catalytic activity for C3H8, NO and CO eliminations than Pd/Ce/Al-a, especially NO conversion. However, the catalyst loaded Ce after Pd owns lower Pd2+, Ce3+ and surface palladium species content after the aging treatment verified by XPS, which are considered as the active site of C3H8, NO and CO, while it shows more excellent catalytic activity for C3H8, NO and CO, whose activity result is the same as that of fresh catalysts. Underlying reasons may be responsible to explain this phenomenon: (i) As is well known, the redox property of the catalyst is crucial to its catalytic performance, and the excellent low temperature reduction ability of Ce/Pd/Al-a contributes well to its conversions of C3H8 and CO tested by H2-TPR. From the H2-TPR result, we can conclude that reduction temperature at 93 °C of Ce/Pd/Al-a assigned to PdO reduction peak is slightly lower than that of Pd/Ce/Al-a, but the reduction temperatre at 115 °C of Ce/Pd/Al-a is assigned to ceria reduction peak which is obviously lower than that of Pd/Ce/Al-a, declaring that Ce/Pd/Al-a can release oxygen atom at lower temperature and excel at the oxidation activity for C3H8 and CO. (ii) It is clarified that the oxidation activity for C3H8 and CO strongly relies on the finely dispersed PdO species and Ce/Pd/Al-a catalyst possesses smaller palladium particle size and ceria crystal than Pd/Ce/Al-a mentioned by TEM and XRD characterization, leading to higher Pd dispersion on the support surface, which is in better accordance with the result measured by CO adsorption method. As a result, more palladium oxide particles seem to play a role as active site. (iii) As we can see in Fig. 10 and Table 5, Ce/Pd/Al-a possesses better catalytic performance than that of Pd/Ce/Al-a, especially for NO conversion. It’s possibility that Ce/Pd/Al-a holds higher despersion and higher metal palladium content obtained by XPS due to palladium component contacting with the alumina, regardless of the fresh and aging catalysts, and more metal palladium sites play an active site of NO conversion [12]. With both of two factors, Ce/Pd/Al catalyst shows more excellent catalytic property for NO conversion. In sunmary, the catalytic activity of the fresh and the aged catalysts is strongly dependent on the palladium dispersion while the reduction property by H2-TPR is not main factor in influencing the catalytic performance. It can explain that Ce/Pd/Al-f catalyst shows more excellent catalytic activity, but it possesses lower reduction property. For the fresh catalysts, other factors such as textural and structure properties seem to facilitate the catalytic performance. However, for the aged catalysts, the catalytic performance is also subject to reduction property and surface metal palladium content, especially for NO conversion, and the T 50 of NO over Ce/Pd/Al-a is 27 °C lower than that of Pd/Ce/Al-a. The above results demonstrate that covering ceria over Pd and Al2O3 is beneficial to promote the catalytic activity and the promoted effect is maintained even after aging treatment. Fig. 12 depicts the light-off temperatures and full-conversion temperatures of C3H8, NO and CO for the aged Pd/Ce/Al, Ce/Pd/Al and Pd/CZ/Al close coupled catalysts. The Pd/CZ/Al catalyst is prepared by the same traditional stepwise impregnation method as the preparation of Pd/Ce/Al catalyst, while differently the former promoter is ceria-zircinia solution solid and ceria as additive is adopted by the latter. According to the expriments known, when the mass ratio of CZ (the molar ratio, 4:1) and Al2O3 is 3:7, the catalyst performs the most prominent catalytic activity. It can be seen in Fig. 12(a) that for Pd/CZ/Al-a catalyst, the light-off temperature of C3H8, NO and CO is 326 °C, 208 °C and 181 °C, respectively, while the value of the full-conversion temperature is 350 °C, 244 °C and 200 °C, respectively. With regard to the aged catalysts, greater distinction can be observed between the Pd/Ce/Al-a and Pd/CZ/Al-a catalysts. The Pd/CZ/Al-a catalyst presents more favorable catalytic activity than the Pd/Ce/Al-a catalyst, regardless of C3H8, NO and CO conversion, which is consistent with the literatures [19,57]. However, the Ce/Pd/Al catalyst performs almost the same catalytic performance as the Pd/CZ/Al catalyst, suggesting that the novel loading sequence can improve the catalytic activity and show higher thermal stability with Pd/CZ/Al catalyst before and after thermal deactivation. We reasonably assume that ceria-zirconia solid solution as promoter is adopted, and the catalyst prepared by novel loading sequence will present more remarkable catalytic performance which is promoted in the larger space. The latest literatures about the close coupled catalyst [16,58,59], have reported that for the best aged catalytic activity, T50 and T90 of C3H8 conversion are 320 °C and 351 °C, respectively, T50 and T90 are 226 °C and 250 °C for NO conversion, and 185 °C and 211 °C are ascribed to T50 and T90 of CO conversion. These values are distinctly higher than those of Ce/Pd/Al-a catalyst in this study, suggesting that Ce/Pd/Al-a catalyst exhibits significantly improved catalytic activity and breaks the record of close couple catalyst. In conclusion, the loading sequence makes a great progress in close coupled catalytic activity compared with the previous reported results. 4 Conclusions In this study, the effect of the different loading sequence of CeO2 and Pd over Al2O3 on the catalytic performance of Pd-only close-coupled catalysts is compared and the catalysts obtained by consecutive incipient wetness impregnation method show different catalytic performances obviously. The following conclusons can be obtained according to Section 3 mentioned above: The catalysts loaded Ce after Pd present higher catalytic activity of the elimination of NO, CO and C3H8 than the catalysts loaded Pd after Ce, especially NO conversion, irrespctively of the fresh and the aging catalysts. Ce/Pd/Al catalysts show superior structural properties before and after aging treatment at 1000 °C, suggesting that the catalysts loaded Ce after Pd manifest better thermal resistance and stability with the interaction due to CeOPd bonds [21,51], PdOAl bonds [49] and CeOAl bonds [60], leading to the results that Ce/Pd/Al catalysts possess higher palladium dispersion than Pd/Ce/Al catalysts on the support surface verified by CO adsorption method and HRTEM images, as is showed in schematic diagram. As a result, more palladium species of the catalysts loaded Ce after Pd seems to play a role as acive site, which promotes low temperature conversion of C3H8 and CO better. Meanwhile, the Ce/Pd/Al catalyst possesses higher metal palladium content, which can also facilitate catalytic activity of NO conversion to a large extent. Acknowledgments We gratefully acknowledge the National Hi-tech Research and Development Program of China (863 Program, 2015AA034603) for their generous financial support for our research here. Appendix A Supplementary data Supplementary data associated with this article can be found, in the online version, at http://dx.doi.org/10.1016/j.mcat.2017.10.002. Appendix A Supplementary data The following is Supplementary data to this article: References [1] J. Kašpar N. Hickey Automotive catalytic converters: current status and some perspectives Catal. Today 77 2003 419 449 [2] R.J. Farrauto R.M. Heck Catalytic converters: state of the art and perspectives Catal. Today 51 1999 351 360 [3] T. Johnson Vehicular emissions in review SAE Int. J. Eng. 7 2014 1207 1227 [4] M. Li X. Wu J. Wan S. Liu R. Ran D. Weng Pd-Ce0.33Zr0.67O2-Al2O3 catalyst for propane oxidation: interactions between the precious metal and support under the hydrothermal ageing Catal. Today 242 2015 322 328 [5] J. Timothy Vehicular emissions in review SAE Int. J. Eng. 9 2016 18 [6] T. Nakatsuji M. Kunishige J. Li M. Hashimoto Y. Matsuzono Effect of CeO2 addition into Pd/Zr-Pr mixed oxide on three-way catalysis and thermal durability Catal. Commun. 35 2013 88 94 [7] C. Chen J. Cao M. Cargnello P. Fornasiero R.J. Gorte High-temperature calcination improves the catalytic properties of alumina-supported Pd@ceria prepared by self assembly J. Catal. 306 2013 109 115 [8] X. Guo G. Zhi X. Yan G. Jin X. Guo P. Brault Methane combustion over Pd/ZrO2/SiC Pd/CeO2/SiC, and Pd/Zr0.5Ce0.5O2/SiC catalysts Catal. Commun. 12 2011 870 874 [9] S. Colussi A. Gayen M. Farnesi Camellone M. Boaro J. Llorca S. Fabris A. Trovarelli Nanofaceted Pd-O sites in Pd-Ce surface superstructures: enhanced activity in catalytic combustion of methane Angew. Chem. 121 2009 8633 8636 [10] M. Cargnello J.J.D. Jaén J.C.H. Garrido K. Bakhmutsky T. Montini J.J.C. Gámez R.J. Gorte P. Fornasiero Exceptional activity for methane combustion over modular Pd@CeO2 subunits on functionalized Al2O3 Science 337 2012 713 717 [11] S. Hinokuma H. Fujii Y. Katsuhara K. Ikeue M. Machida Effect of thermal ageing on the structure and catalytic activity of Pd/CeO2 prepared using arc-plasma process Catal. Sci. Technol. 4 2014 2990 2996 [12] S. Colussia E. Vesselli A. Baraldi G. Comelli G. Groppid J. Llorca Structure and morphology of Pd/Al2O3 and Pd/CeO2/Al2O3 combustion catalysts in Pd-PdO transformation hysteresis Appl. Catal. A: Gen. 390 2010 1 10 [13] B. Yue R. Zhou Y. Wang X. Zheng Effect of rare earths (La, Pr Nd, Sm and Y) on the methane combustion over Pd/Ce-Zr/Al2O3 catalysts Appl. Catal. A: Gen. 295 2005 31 39 [14] J. a. L.X. Wu Adaptive control of uncertain Lü system Chaos Soliton Fractal 22 2004 375 381 [15] A. Morikawa T. Kanazawa K. Kikuta A. Suda H. Shinjo A new concept in high performance ceria-zirconia oxygen storage capacity material with Al2O3 as a diffusion barrier Appl. Catal. B: Environ. 78 2008 210 221 [16] X. Yang S. Lin R. Zhou Effects of the addition of small quantities of ceria on the catalytic behavior of Pd-only close-coupled catalysts during automobile exhaust elimination Chin. J. Catal. 35 2014 1267 1280 [17] R. Craciun W. Daniell H. Knözinger The effect of CeO2 structure on the activity of supported Pd catalysts used for methane steam reforming Appl. Catal. A: Gen. 230 2002 153 168 [18] K.R. Priolkar P. Bera P.R. Sarode M.S. Hegde S. Emura R. Kumashiro N.P. Lalla Formation of Ce1-xPdxO2-δ solid solution in combustion-synthesized Pd/CeO2 catalyst: XRD, XPS, and EXAFS investigation Chem. Mater. 14 2002 2120 2128 [19] L. Lan M. Zhao M. Gong Y. Chen The effect of synthesis method on the properties and catalytic performance of Pd/Ce0.5Zr0.5O2-Al2O3 three-way catalyst J. Mol. Catal. A: Chem. 394 2014 10 21 [20] Q. Wang B. Zhao G. Li R. Zhou Effect of synthesis method on the properties of ceria-zirconia modified alumina and the catalytic performance of its supported Pd-only three-way catalyst J. Mol. Catal. A: Chem. 344 2011 132 137 [21] J. Wan X. Wu Y. Cao M. Li D. Weng K. Huang Re-dispersion of Pd on Ce0.5Zr0.5O2 upon cooling in the presence of oxygen Catal. Today 253 2015 51 56 [22] A. Papavasiliou A. Tsetsekou V. Matsouka M. Konsolakis I.V. Yentekakis N. Boukos Development of a Ce-Zr-La modified Pt/γ-Al2O3 TWCs’ washcoat: effect of synthesis procedure on catalytic behaviour and thermal durability Appl. Catal. B: Environ. 90 2009 162 174 [23] N. Kamiuchi M. Ozawa Propene oxidation over palladium catalysts supported on zirconium rich ceria-zirconia Catal. Today 241 2015 100 106 [24] C. Bozo N. Guilhaume Characterisation of ceria-zirconia solid solutions after hydrothermal ageing Appl. Catal. A: Gen. 220 2001 69 77 [25] S.J. Wilson A kinetic study of the system γ-AIOOH/Al2O3 J. Solid State Chem. 34 1980 315 322 [26] S. Colussi F. Arosio T. Montanari G. Busca G. Groppi A. Trovarelli Study of sulfur poisoning on Pd/Al2O3 and Pd/CeO2/Al2O3 methane combustion catalysts Catal. Today 155 2010 59 65 [27] Y. Guo Z. Zhang S. Zhang Y. Qi Y. Liu Preparation of CexZr1-xO2 (x = 0.75, 0.62) solid solution and its application in Pd-only three-way catalysts Catal. Today 126 2007 296 302 [28] G. Li B. Zhao Q. Wang R. Zhou The effect of Ni on the structure and catalytic behavior of model Pd/Ce0.67Zr0.33O2 three-way catalyst before and after aging Appl. Catal. B: Environ. 97 2010 41 48 [29] S. Wang L. Lan Z. Shi M. Zhao M. Gong R. Fang S. Chen Y. Chen A new monolithic Pt-Pd-Rh motorcycle exhaust catalyst to meet future emission standards Chin. J. Catal. 35 2014 1482 1491 [30] S. Lin L. Yang R. Zhou Three-way catalytic performance of Pd/Ce0.67Zr0.33O2-Al2O3 catalysts: role of the different Pd precursors Appl. Surf. Sci. 327 2015 335 343 [31] C. Costa G. Georgiou A. Efstathiou Mathematical modeling of the oxygen storage capacity phenomenon studied by CO pulse transient experiments over Pd/CeO2 catalyst J. Catal. 219 2003 259 272 [32] S. Christou A. Efstathiou A two-step reaction mechanism of oxygen release from Pd/CeO2: mathematical modelling based on step gas concentration experiments Top. Catal. 30/31 2004 325 331 [33] F. Giordano C. Leitenburg M. Giona A model for the temperature-programmed reduction of low and high surface area ceria J. Catal. 193 2000 273 282 [34] S. Lambrou The effects of Fe on the oxygen storage and release properties of model Pd-Rh/CeO2-Al2O3 three-way catalyst J. Catal. 240 2006 182 193 [35] G. Zhang M. Liu C. Guo P. Sun Z. Yuan B. Li D. Ding T. Chen Synthesis and characterization of mesoporous ceria with hierarchical nanoarchitecture controlled by amino acids J. Phys. Chem. 110 2006 25782 25790 [36] R. Rao R. Monte J. Kaspar G. Vlaic G. Balducci S. Meriani G. Gubitosa A. Cremona M. Graziani Reduction of NO over partially reduced metal-loaded CeO2-ZrO2 solid solutions J. Catal. 162 1996 1 9 [37] P. Vidmar J. Kaspar G. Gubitosa M. Graziani Effects of trivalent dopants on the redox properties of Ce0.6Zr0.4O2 mixed oxide J. Catal. 171 1997 160 168 [38] Z. Hu Y. Lui J. Dettling J. Steger Design of a novel Pd three-way catalyst: integration of catalytic functions in three dimensions Catal. Today 30 1996 83 89 [39] J. Fan X. Wu X. Wu R. Ran Modification of CeO2-ZrO2 mixed oxides by coprecipitated/impregnated Sr: effect on the microstructure and oxygen storage capacity J. Catal. 258 2008 177 186 [40] J. Fan X. Wu X. Wu Q. Liang R. Ran D. Weng Thermal ageing of Pt on low-surface-area CeO2-ZrO2-La2O3 mixed oxides: effect on the OSC performance Appl. Catal. B: Environ. 81 2008 38 48 [41] A. Bensalem D. Tessier F. Bozon-Verduraz Spectroscopic study of CO adsorption on palladium-ceria catalysts J. Chem. Soc. 92 1996 3233 3237 [42] T. Hirano Y. Ozawa T. Sekido T. Ogino T. Miyao S. Naito Marked effect of In, Pb and Ce addition upon the reduction of NO by CO over SiO2 supported Pd catalysts Catal. Commun. 8 2007 1249 1254 [43] C. Franchini D. Cesar M. Schmal The interaction of oxides of the Pd/Ce/Zr/Al2O3 catalysts prepared by impregnation over alumina and promoting effects on surface properties Catal. Lett. 137 2010 45 54 [44] C. Thomas O. Gorce F. Villain G. Djéga-Mariadassou Influence of the nature of the noble metal on the lean C3H6-assisted decomposition of NO on Ce0.68Zr0.32O2-supported catalysts J. Mol. Catal. A: Chem. 249 2006 71 79 [45] B. Zhu B.W.L. Jang Insights into surface properties of non-thermal RF plasmas treated Pd/TiO2 in acetylene hydrogenation J. Mol. Catal. A: Chem. 395 2014 137 144 [46] Y. Diao H. He P. Yang L. Wang S. Zhang Optimizing the structure of supported Pd catalyst for direct oxidative esterification of methacrolein with methanol Chem. Eng. Sci. 135 2015 128 136 [47] A. Vhzquez High resolution electron microscopy characterization of small Pt-Pd/SiO2 particles in oxide-reducing cycles Appl. Surf. Sci. 99 1996 213 220 [48] C. Liu Y. Zhao Y. Li D. Zhang Z. Chang X. Bu Perspectives on electron-assisted reduction for preparation of highly dispersed noble metal catalysts ACS Sustain. Chem. Eng. 2 2014 3 13 [49] D. Kim O. Yang Effect of pH in a sol-gel synthesis on the physicochemical properties of Pd-alumina three-way catalyst Appl. Catal. B: Environ. 26 2000 285 289 [50] S. Colussi A. Gayen M. Camellone M. Boaro J. Llorca S. Fabris A. Trovarelli Nanofaceted Pd-O sites in Pd-Ce surface superstructures: enhanced activity in catalytic combustion of methane Angew. Chem. Int. Eng. 48 2009 8481 8484 [51] D. Ciuparu L. Pfefferle Pd-Ce interactions and adsorption properties of palladium: CO and NO TPD studies over Pd-Ce/Al2O3 catalysts Appl. Catal. B: Environ. 26 2000 241 255 [52] A. Iglesias-Juez A. Martínez-Arias M. Fernández-García Metal-promoter interface in Pd/(Ce,Zr)Ox/Al2O3 catalysts: effect of thermal aging J. Catal. 221 2004 148 161 [53] Y. Yang G. Cho C. Rutland Model based study of DeNOx characteristics for integrated DPF/SCR system over Cu-zeolite SAE Int. J. Eng. 1 2015 1 25 [54] A. Iglesias-Juez A.B. Hungría A. Martínez-Arias J.A. Anderson M. Fernández-García Pd-based (Ce,Zr)Ox-supported catalysts: promoting effect of base metals (Cr, Cu, Ni) in CO and NO elimination Catal. Today 143 2009 195 202 [55] L. Lan S. Chen Y. Cao M. Zhao M. Gong Y. Chen Preparation of ceria-zirconia by modified coprecipitation method and its supported Pd-only three-way catalyst J. Colloid Interface Sci. 450 2015 404 416 [56] P. Vidmar J. Kaspar G. Gubitosa M. Graziani Effects of trivalent dopants on the redox properties of Ce0.6Zr0.4O2 mixed oxide J. Catal. 171 1997 160 168 [57] L. Long K. Xia W. Lang L. Shen Q. Yang X. Yan Y. Guo The comparison and optimization of zirconia, alumina, and zirconia-alumina supported PtSnIn trimetallic catalysts for propane dehydrogenation reaction J. Ind. Eng. Chem. 51 2017 271 280 [58] M. Huang S. Wang L. Li H. Zhang Z. Shi Y. Chen Effect of high temperature pretreatment on the thermal resistance properties of Pd/CeO2/Al2O3 close-coupled catalysts J. Rare Earth 35 2017 149 157 [59] R. Fang Y. Cui Z. Shi M. Gong Y. Chen Promotion of a Pd/Al2O3 close-coupled catalyst by Ni Chin. J. Catal. 36 2015 994 1000 [60] J. Padilla G. Angel J. Navarrete Improved Pd/γ-Al2O3-Ce catalysts for benzene combustion Catal. Today 133–135 2008 541 547",
      "scopus-id": "85044962504",
      "coredata": {
        "eid": "1-s2.0-S246882311730528X",
        "dc:description": "The Pd-only close-coupled catalysts of the different loading sequence of CeO2 and Pd over Al2O3 were prepared using consecutive wetness impregnation method. Differences in structural, surface properties and catalytic performance, together with the thermal aging behaviors of catalyst at 1000 °C were investigated systematically by XRD, TPR, XPS, ICP, CO adsorption and TEM. Consequently, the Ce/Pd/Al catalysts loaded Ce after Pd over the alumina show superior structural properties before and after aging treatment, suggesting the Ce/Pd/Al catalysts possess better thermal resistance than Pd/Ce/Al catalysts loaded Pd after Ce. Moreover, the aged Ce/Pd/Al catalysts possess stronger reducible probed by TPR, and HRTEM and CO adsorption show smaller particles size of Pd and higher palladium dispersion. As a result, for Ce/Pd/Al catalysts, more palladium sites play a role as active site, which promotes low temperature conversion of pollutants effectively. The catalytic performance of the catalysts is forcefully subject to palladium dispersion and reduction property, especially for NO conversion, and the light-off temperature of NO over aged Ce/Pd/Al is 27 °C lower than aged Pd/Ce/Al. The results have demonstrated that novel loading sequence is beneficial to catalytic activity which is maintained even after aging treatment.",
        "openArchiveArticle": "false",
        "prism:coverDate": "2020-02-29",
        "openaccessUserLicense": null,
        "prism:aggregationType": "Journal",
        "prism:url": "https://api.elsevier.com/content/article/pii/S246882311730528X",
        "dc:creator": [
          {
            "@_fa": "true",
            "$": "Sun, Min"
          },
          {
            "@_fa": "true",
            "$": "Hu, Wei"
          },
          {
            "@_fa": "true",
            "$": "Yuan, Shandong"
          },
          {
            "@_fa": "true",
            "$": "Zhang, Hailong"
          },
          {
            "@_fa": "true",
            "$": "Cheng, Tianqiong"
          },
          {
            "@_fa": "true",
            "$": "Wang, Jianli"
          },
          {
            "@_fa": "true",
            "$": "Chen, Yaoqiang"
          }
        ],
        "link": [
          {
            "@_fa": "true",
            "@rel": "self",
            "@href": "https://api.elsevier.com/content/article/pii/S246882311730528X"
          },
          {
            "@_fa": "true",
            "@rel": "scidir",
            "@href": "https://www.sciencedirect.com/science/article/pii/S246882311730528X"
          }
        ],
        "dc:format": "application/json",
        "openaccessType": null,
        "pii": "S2468-8231(17)30528-X",
        "prism:volume": "482",
        "articleNumber": "100332",
        "prism:publisher": "Elsevier B.V.",
        "dc:title": "Effect of the loading sequence of CeO2 and Pd over Al2O3 on the catalytic performance of Pd-only close-coupled catalysts",
        "prism:copyright": "© 2017 Elsevier B.V. All rights reserved.",
        "openaccess": "0",
        "prism:issn": "24688231",
        "dcterms:subject": [
          {
            "@_fa": "true",
            "$": "Loading sequence"
          },
          {
            "@_fa": "true",
            "$": "Pd-only close-coupled catalysts"
          },
          {
            "@_fa": "true",
            "$": "Palladium dispersion"
          },
          {
            "@_fa": "true",
            "$": "Thermal stability"
          },
          {
            "@_fa": "true",
            "$": "Catalytic performance"
          }
        ],
        "openaccessArticle": "false",
        "prism:publicationName": "Molecular Catalysis",
        "openaccessSponsorType": null,
        "prism:pageRange": "100332",
        "pubType": "fla",
        "prism:coverDisplayDate": "February 2020",
        "prism:doi": "10.1016/j.mcat.2017.10.002",
        "prism:startingPage": "100332",
        "dc:identifier": "doi:10.1016/j.mcat.2017.10.002",
        "openaccessSponsorName": null
      },
      "objects": {
        "object": [
          {
            "@category": "standard",
            "@height": "200",
            "@width": "266",
            "@_fa": "true",
            "$": "https://api.elsevier.com/content/object/eid/1-s2.0-S246882311730528X-fx1.jpg?httpAccept=%2A%2F%2A",
            "@multimediatype": "JPEG image file",
            "@type": "IMAGE-DOWNSAMPLED",
            "@size": "17177",
            "@ref": "fx1",
            "@mimetype": "image/jpeg"
          },
          {
            "@category": "thumbnail",
            "@height": "164",
            "@width": "218",
            "@_fa": "true",
            "$": "https://api.elsevier.com/content/object/eid/1-s2.0-S246882311730528X-fx1.sml?httpAccept=%2A%2F%2A",
            "@multimediatype": "GIF image file",
            "@type": "IMAGE-THUMBNAIL",
            "@size": "12534",
            "@ref": "fx1",
            "@mimetype": "image/gif"
          },
          {
            "@category": "standard",
            "@height": "332",
            "@width": "376",
            "@_fa": "true",
            "$": "https://api.elsevier.com/content/object/eid/1-s2.0-S246882311730528X-gr1.jpg?httpAccept=%2A%2F%2A",
            "@multimediatype": "JPEG image file",
            "@type": "IMAGE-DOWNSAMPLED",
            "@size": "37269",
            "@ref": "gr1",
            "@mimetype": "image/jpeg"
          },
          {
            "@category": "thumbnail",
            "@height": "163",
            "@width": "185",
            "@_fa": "true",
            "$": "https://api.elsevier.com/content/object/eid/1-s2.0-S246882311730528X-gr1.sml?httpAccept=%2A%2F%2A",
            "@multimediatype": "GIF image file",
            "@type": "IMAGE-THUMBNAIL",
            "@size": "10410",
            "@ref": "gr1",
            "@mimetype": "image/gif"
          },
          {
            "@category": "standard",
            "@height": "282",
            "@width": "376",
            "@_fa": "true",
            "$": "https://api.elsevier.com/content/object/eid/1-s2.0-S246882311730528X-gr10.jpg?httpAccept=%2A%2F%2A",
            "@multimediatype": "JPEG image file",
            "@type": "IMAGE-DOWNSAMPLED",
            "@size": "27938",
            "@ref": "gr10",
            "@mimetype": "image/jpeg"
          },
          {
            "@category": "thumbnail",
            "@height": "164",
            "@width": "218",
            "@_fa": "true",
            "$": "https://api.elsevier.com/content/object/eid/1-s2.0-S246882311730528X-gr10.sml?httpAccept=%2A%2F%2A",
            "@multimediatype": "GIF image file",
            "@type": "IMAGE-THUMBNAIL",
            "@size": "13909",
            "@ref": "gr10",
            "@mimetype": "image/gif"
          },
          {
            "@category": "standard",
            "@height": "789",
            "@width": "638",
            "@_fa": "true",
            "$": "https://api.elsevier.com/content/object/eid/1-s2.0-S246882311730528X-gr11.jpg?httpAccept=%2A%2F%2A",
            "@multimediatype": "JPEG image file",
            "@type": "IMAGE-DOWNSAMPLED",
            "@size": "80382",
            "@ref": "gr11",
            "@mimetype": "image/jpeg"
          },
          {
            "@category": "thumbnail",
            "@height": "163",
            "@width": "132",
            "@_fa": "true",
            "$": "https://api.elsevier.com/content/object/eid/1-s2.0-S246882311730528X-gr11.sml?httpAccept=%2A%2F%2A",
            "@multimediatype": "GIF image file",
            "@type": "IMAGE-THUMBNAIL",
            "@size": "5001",
            "@ref": "gr11",
            "@mimetype": "image/gif"
          },
          {
            "@category": "standard",
            "@height": "242",
            "@width": "677",
            "@_fa": "true",
            "$": "https://api.elsevier.com/content/object/eid/1-s2.0-S246882311730528X-gr12.jpg?httpAccept=%2A%2F%2A",
            "@multimediatype": "JPEG image file",
            "@type": "IMAGE-DOWNSAMPLED",
            "@size": "25521",
            "@ref": "gr12",
            "@mimetype": "image/jpeg"
          },
          {
            "@category": "thumbnail",
            "@height": "78",
            "@width": "219",
            "@_fa": "true",
            "$": "https://api.elsevier.com/content/object/eid/1-s2.0-S246882311730528X-gr12.sml?httpAccept=%2A%2F%2A",
            "@multimediatype": "GIF image file",
            "@type": "IMAGE-THUMBNAIL",
            "@size": "5608",
            "@ref": "gr12",
            "@mimetype": "image/gif"
          },
          {
            "@category": "standard",
            "@height": "205",
            "@width": "489",
            "@_fa": "true",
            "$": "https://api.elsevier.com/content/object/eid/1-s2.0-S246882311730528X-gr2.jpg?httpAccept=%2A%2F%2A",
            "@multimediatype": "JPEG image file",
            "@type": "IMAGE-DOWNSAMPLED",
            "@size": "14209",
            "@ref": "gr2",
            "@mimetype": "image/jpeg"
          },
          {
            "@category": "thumbnail",
            "@height": "92",
            "@width": "219",
            "@_fa": "true",
            "$": "https://api.elsevier.com/content/object/eid/1-s2.0-S246882311730528X-gr2.sml?httpAccept=%2A%2F%2A",
            "@multimediatype": "GIF image file",
            "@type": "IMAGE-THUMBNAIL",
            "@size": "3254",
            "@ref": "gr2",
            "@mimetype": "image/gif"
          },
          {
            "@category": "standard",
            "@height": "574",
            "@width": "678",
            "@_fa": "true",
            "$": "https://api.elsevier.com/content/object/eid/1-s2.0-S246882311730528X-gr3.jpg?httpAccept=%2A%2F%2A",
            "@multimediatype": "JPEG image file",
            "@type": "IMAGE-DOWNSAMPLED",
            "@size": "102967",
            "@ref": "gr3",
            "@mimetype": "image/jpeg"
          },
          {
            "@category": "thumbnail",
            "@height": "163",
            "@width": "193",
            "@_fa": "true",
            "$": "https://api.elsevier.com/content/object/eid/1-s2.0-S246882311730528X-gr3.sml?httpAccept=%2A%2F%2A",
            "@multimediatype": "GIF image file",
            "@type": "IMAGE-THUMBNAIL",
            "@size": "12027",
            "@ref": "gr3",
            "@mimetype": "image/gif"
          },
          {
            "@category": "standard",
            "@height": "269",
            "@width": "640",
            "@_fa": "true",
            "$": "https://api.elsevier.com/content/object/eid/1-s2.0-S246882311730528X-gr4.jpg?httpAccept=%2A%2F%2A",
            "@multimediatype": "JPEG image file",
            "@type": "IMAGE-DOWNSAMPLED",
            "@size": "34271",
            "@ref": "gr4",
            "@mimetype": "image/jpeg"
          },
          {
            "@category": "thumbnail",
            "@height": "92",
            "@width": "219",
            "@_fa": "true",
            "$": "https://api.elsevier.com/content/object/eid/1-s2.0-S246882311730528X-gr4.sml?httpAccept=%2A%2F%2A",
            "@multimediatype": "GIF image file",
            "@type": "IMAGE-THUMBNAIL",
            "@size": "4919",
            "@ref": "gr4",
            "@mimetype": "image/gif"
          },
          {
            "@category": "standard",
            "@height": "229",
            "@width": "489",
            "@_fa": "true",
            "$": "https://api.elsevier.com/content/object/eid/1-s2.0-S246882311730528X-gr5.jpg?httpAccept=%2A%2F%2A",
            "@multimediatype": "JPEG image file",
            "@type": "IMAGE-DOWNSAMPLED",
            "@size": "41992",
            "@ref": "gr5",
            "@mimetype": "image/jpeg"
          },
          {
            "@category": "thumbnail",
            "@height": "102",
            "@width": "219",
            "@_fa": "true",
            "$": "https://api.elsevier.com/content/object/eid/1-s2.0-S246882311730528X-gr5.sml?httpAccept=%2A%2F%2A",
            "@multimediatype": "GIF image file",
            "@type": "IMAGE-THUMBNAIL",
            "@size": "16058",
            "@ref": "gr5",
            "@mimetype": "image/gif"
          },
          {
            "@category": "standard",
            "@height": "547",
            "@width": "565",
            "@_fa": "true",
            "$": "https://api.elsevier.com/content/object/eid/1-s2.0-S246882311730528X-gr6.jpg?httpAccept=%2A%2F%2A",
            "@multimediatype": "JPEG image file",
            "@type": "IMAGE-DOWNSAMPLED",
            "@size": "111018",
            "@ref": "gr6",
            "@mimetype": "image/jpeg"
          },
          {
            "@category": "thumbnail",
            "@height": "164",
            "@width": "169",
            "@_fa": "true",
            "$": "https://api.elsevier.com/content/object/eid/1-s2.0-S246882311730528X-gr6.sml?httpAccept=%2A%2F%2A",
            "@multimediatype": "GIF image file",
            "@type": "IMAGE-THUMBNAIL",
            "@size": "22327",
            "@ref": "gr6",
            "@mimetype": "image/gif"
          },
          {
            "@category": "standard",
            "@height": "192",
            "@width": "367",
            "@_fa": "true",
            "$": "https://api.elsevier.com/content/object/eid/1-s2.0-S246882311730528X-gr7.jpg?httpAccept=%2A%2F%2A",
            "@multimediatype": "JPEG image file",
            "@type": "IMAGE-DOWNSAMPLED",
            "@size": "9103",
            "@ref": "gr7",
            "@mimetype": "image/jpeg"
          },
          {
            "@category": "thumbnail",
            "@height": "115",
            "@width": "219",
            "@_fa": "true",
            "$": "https://api.elsevier.com/content/object/eid/1-s2.0-S246882311730528X-gr7.sml?httpAccept=%2A%2F%2A",
            "@multimediatype": "GIF image file",
            "@type": "IMAGE-THUMBNAIL",
            "@size": "3646",
            "@ref": "gr7",
            "@mimetype": "image/gif"
          },
          {
            "@category": "standard",
            "@height": "768",
            "@width": "565",
            "@_fa": "true",
            "$": "https://api.elsevier.com/content/object/eid/1-s2.0-S246882311730528X-gr8.jpg?httpAccept=%2A%2F%2A",
            "@multimediatype": "JPEG image file",
            "@type": "IMAGE-DOWNSAMPLED",
            "@size": "81755",
            "@ref": "gr8",
            "@mimetype": "image/jpeg"
          },
          {
            "@category": "thumbnail",
            "@height": "163",
            "@width": "120",
            "@_fa": "true",
            "$": "https://api.elsevier.com/content/object/eid/1-s2.0-S246882311730528X-gr8.sml?httpAccept=%2A%2F%2A",
            "@multimediatype": "GIF image file",
            "@type": "IMAGE-THUMBNAIL",
            "@size": "10408",
            "@ref": "gr8",
            "@mimetype": "image/gif"
          },
          {
            "@category": "standard",
            "@height": "496",
            "@width": "622",
            "@_fa": "true",
            "$": "https://api.elsevier.com/content/object/eid/1-s2.0-S246882311730528X-gr9.jpg?httpAccept=%2A%2F%2A",
            "@multimediatype": "JPEG image file",
            "@type": "IMAGE-DOWNSAMPLED",
            "@size": "99615",
            "@ref": "gr9",
            "@mimetype": "image/jpeg"
          },
          {
            "@category": "thumbnail",
            "@height": "164",
            "@width": "205",
            "@_fa": "true",
            "$": "https://api.elsevier.com/content/object/eid/1-s2.0-S246882311730528X-gr9.sml?httpAccept=%2A%2F%2A",
            "@multimediatype": "GIF image file",
            "@type": "IMAGE-THUMBNAIL",
            "@size": "11227",
            "@ref": "gr9",
            "@mimetype": "image/gif"
          },
          {
            "@category": "standard",
            "@_fa": "true",
            "$": "https://api.elsevier.com/content/object/eid/1-s2.0-S246882311730528X-mmc1.doc?httpAccept=%2A%2F%2A",
            "@multimediatype": "Microsoft Word file",
            "@type": "APPLICATION",
            "@size": "578560",
            "@ref": "mmc1",
            "@mimetype": "application/word"
          },
          {
            "@category": "standard",
            "@_fa": "true",
            "$": "https://api.elsevier.com/content/object/eid/1-s2.0-S246882311730528X-am.pdf?httpAccept=%2A%2F%2A",
            "@multimediatype": "Acrobat PDF file",
            "@type": "AAM-PDF",
            "@size": "1808508",
            "@ref": "am",
            "@mimetype": "application/pdf"
          }
        ]
      },
      "link": {
        "@rel": "abstract",
        "@href": "https://api.elsevier.com/content/abstract/scopus_id/85044962504"
      }
    }
  }
}