{
  "metadata": {
    "title": "Niobium exchanged tungstophosphoric acid supported on titania catalysts for selective synthesis of 5-ethoxymethylfurfural from fructose",
    "authors": "; ; ",
    "journal": "Molecular Catalysis",
    "date": "2021-05-31",
    "doi": "10.1016/j.mcat.2021.111607",
    "abstract": "",
    "uri": "https://api.elsevier.com/content/article/pii/S2468823121002248",
    "pii": "S2468823121002248"
  },
  "fulltext": {
    "full-text-retrieval-response": {
      "scopus-eid": "2-s2.0-85105480821",
      "originalText": "serial JL 315758 291210 291744 291790 291809 31 Molecular Catalysis MOLECULARCATALYSIS 2021-05-10 2021-05-10 2021-05-10 2021-05-10 2021-05-24T15:55:04 1-s2.0-S2468823121002248 S2468-8231(21)00224-8 S2468823121002248 10.1016/j.mcat.2021.111607 S300 S300.1 FULL-TEXT 1-s2.0-S2468823121X00089 2024-06-26T17:47:42.305855Z 0 0 20210501 20210531 2021 2021-05-10T10:01:13.075943Z absattachment articleinfo articlenumber articletitlenorm authfirstinitialnorm authfirstsurnamenorm cid cids contenttype copyright crossmark dateloaded dateloadedtxt datesearch datesort dateupdated dco docsubtype doctype doi eid ewtransactionid hubeid indexeddate issn issnnorm itemstage itemtransactionid itemweight openaccess openarchive pg pgfirst pii piinorm pubdateend pubdatestart pubdatetxt pubyr sectiontitle sortorder srctitle srctitlenorm srctype ssids alllist content subj subheadings suppl tomb volfirst volissue volumelist webpdf webpdfpagecount yearnav figure table body acknowledge affil articletitle auth authfirstini authfull authkeywords authlast grantnumber grantsponsor highlightsabst orcid primabst ref specialabst 2468-8231 24688231 true 508 508 C Volume 508 16 111607 111607 111607 202105 May 2021 2021-05-01 2021-05-31 2021 Regular Papers article fla © 2021 Elsevier B.V. All rights reserved. NIOBIUMEXCHANGEDTUNGSTOPHOSPHORICACIDSUPPORTEDTITANIACATALYSTSFORSELECTIVESYNTHESIS5ETHOXYMETHYLFURFURALFRUCTOSE KUMARI P 1 Introduction 2 Experimental 2.1 Catalyst preparation 2.2 Catalysts characterization 2.3 Reaction procedure and analysis methods 3 Results and discussion 3.1 Catalyst characterization 3.2 Activity results 3.2.1 Screening of NBXTPA/TiO2 catalysts for dehydrative etherification of fructose to EMF 3.2.2 Solvent screening over 20wt% Nb0.4TPA/TiO2 catalyst 3.2.3 Effect of THF volume 3.2.4 Influence of reaction time 3.2.5 Influence of reaction temperature 3.2.6 Catalyst dosage effect 3.2.7 Merits of the current catalyst over other catalysts 3.2.8 Reusability 4 Conclusions Credit author statement Acknowledgements References THOMAS 2015 7554 7565 F LEI 2017 230 257 H GUNNUR 2013 900 916 K ANGELES 2015 6811 6853 F TIANFU 2014 548 572 W RAO 2017 80 86 B SHUGUO 2013 2104 2112 W KUMARI 2019 53 60 P SIAMAK 2017 908 926 A HAMID 2015 635 647 O HAFIZI 2020 111176 H BERNARDO 2019 87 94 J KARNJANAKOM 2019 110632 S YANG 2012 80 84 Y BALAKRISHNAN 2012 1626 1634 M LIU 2013 625 631 B LIU 2012 20 24 J LANZAFAME 2011 435 441 P WANG 2013 2379 2383 H BING 2012 15331 15336 L REN 2015 1127 1131 Y RAVEENDRA 2016 105 113 G LIU 2014 68 73 A LIU 2014 1977 1984 A LIU 2013 2081 2089 B VIIL 2014 5689 5693 I YIN 2015 4992 4999 S LI 2014 1245 1251 H LI 2014 1 7 H RAO 2019 52 59 B AZIZI 2006 4275 4277 N RAO 2018 269 275 B LIU 2013 2174 2182 R SANKAR 2017 2807 2816 E DAS 2006 70 78 D SRINIVAS 2016 7 14 M RAO 2009 1394 1397 K YANG 2017 30843 30850 T KUMAR 2014 1 11 C MU 2015 8893 8899 M KUMAR 2011 83 90 C RAO 2020 3428 3437 B KUMARI 2018 108 115 P KONG 2017 180 185 X LANZAFAMEA 2011 435 441 P ZHANG 2019 39 47 L PATRICIA 2014 4292 4305 A CHEN 2019 503 511 B LIU 2016 523 530 X YUAN 2015 236 242 Z CHETANA 2018 38 44 R KUMARIX2021X111607 KUMARIX2021X111607XP 2023-05-10T00:00:00.000Z 2023-05-10T00:00:00.000Z http://creativecommons.org/licenses/by-nc-nd/4.0/ © 2021 Elsevier B.V. All rights reserved. 2021-06-05T11:42:46.709Z http://vtw.elsevier.com/data/voc/AddOnTypes/50.7/aggregated-refined CSIR-IICT /2021/050 Author P. Krishna Kumari acknowledge to UGC-New Delhi, India for financial support in the form of Senior Research Fellowship. We thank Director, CSIR-IICT for permitting to publish our results (IICT Communication No: IICT/Pubs./2021/050) https://doi.org/10.15223/policy-017 https://doi.org/10.15223/policy-037 https://doi.org/10.15223/policy-012 https://doi.org/10.15223/policy-029 https://doi.org/10.15223/policy-004 item S2468-8231(21)00224-8 S2468823121002248 1-s2.0-S2468823121002248 10.1016/j.mcat.2021.111607 315758 2021-06-07T06:36:24.391224Z 2021-05-01 2021-05-31 1-s2.0-S2468823121002248-main.pdf https://s3-eu-west-1.amazonaws.com/prod-ucs-content-store-eu-west/content/pii:S2468823121002248/MAIN/application/pdf/d90074268398a05ceca7c56fd87e9bcc/main.pdf main.pdf pdf true 2086710 MAIN 9 1-s2.0-S2468823121002248-main_1.png https://s3-eu-west-1.amazonaws.com/prod-ucs-content-store-eu-west/content/pii:S2468823121002248/PREVIEW/image/png/901b9557b32087a433fdd2b2065c278e/main_1.png main_1.png png 61459 849 656 IMAGE-WEB-PDF 1 1-s2.0-S2468823121002248-sc1.jpg https://s3-eu-west-1.amazonaws.com/prod-ucs-content-store-eu-west/content/pii:S2468823121002248/sc1/DOWNSAMPLED/image/jpeg/72a9a3ef2e42a3fbcaa8b07d5e6f7051/sc1.jpg sc1 sc1.jpg jpg 20323 185 565 IMAGE-DOWNSAMPLED 1-s2.0-S2468823121002248-gr11.jpg https://s3-eu-west-1.amazonaws.com/prod-ucs-content-store-eu-west/content/pii:S2468823121002248/gr11/DOWNSAMPLED/image/jpeg/498b4b1bdb102cddba92cb8324730cc4/gr11.jpg gr11 gr11.jpg jpg 17400 271 339 IMAGE-DOWNSAMPLED 1-s2.0-S2468823121002248-gr10.jpg https://s3-eu-west-1.amazonaws.com/prod-ucs-content-store-eu-west/content/pii:S2468823121002248/gr10/DOWNSAMPLED/image/jpeg/665c5d0762b6c5c6b3d42810a35b7737/gr10.jpg gr10 gr10.jpg jpg 27312 336 339 IMAGE-DOWNSAMPLED 1-s2.0-S2468823121002248-gr2.jpg https://s3-eu-west-1.amazonaws.com/prod-ucs-content-store-eu-west/content/pii:S2468823121002248/gr2/DOWNSAMPLED/image/jpeg/a273b50baf8d7294b9179f2ec0d55a0e/gr2.jpg gr2 gr2.jpg jpg 47311 337 339 IMAGE-DOWNSAMPLED 1-s2.0-S2468823121002248-gr1.jpg https://s3-eu-west-1.amazonaws.com/prod-ucs-content-store-eu-west/content/pii:S2468823121002248/gr1/DOWNSAMPLED/image/jpeg/e359405498461b232b545bd5b3bb7adc/gr1.jpg gr1 gr1.jpg jpg 47517 341 339 IMAGE-DOWNSAMPLED 1-s2.0-S2468823121002248-gr12.jpg https://s3-eu-west-1.amazonaws.com/prod-ucs-content-store-eu-west/content/pii:S2468823121002248/gr12/DOWNSAMPLED/image/jpeg/9ef52a4b892336c00e3f61be7ea174e9/gr12.jpg gr12 gr12.jpg jpg 53802 709 339 IMAGE-DOWNSAMPLED 1-s2.0-S2468823121002248-fx1.jpg https://s3-eu-west-1.amazonaws.com/prod-ucs-content-store-eu-west/content/pii:S2468823121002248/fx1/DOWNSAMPLED/image/jpeg/8be26bef864e50d2f6c037aabe81993f/fx1.jpg fx1 true fx1.jpg jpg 25555 200 266 IMAGE-DOWNSAMPLED 1-s2.0-S2468823121002248-gr6.jpg https://s3-eu-west-1.amazonaws.com/prod-ucs-content-store-eu-west/content/pii:S2468823121002248/gr6/DOWNSAMPLED/image/jpeg/ee48f1f22ad235667ebd33997f7bfe30/gr6.jpg gr6 gr6.jpg jpg 26092 305 339 IMAGE-DOWNSAMPLED 1-s2.0-S2468823121002248-gr5.jpg https://s3-eu-west-1.amazonaws.com/prod-ucs-content-store-eu-west/content/pii:S2468823121002248/gr5/DOWNSAMPLED/image/jpeg/03ae5cc337c950aaaefec2916fe1aa11/gr5.jpg gr5 gr5.jpg jpg 36573 338 339 IMAGE-DOWNSAMPLED 1-s2.0-S2468823121002248-gr4.jpg https://s3-eu-west-1.amazonaws.com/prod-ucs-content-store-eu-west/content/pii:S2468823121002248/gr4/DOWNSAMPLED/image/jpeg/321b2fb190cda526593d753f23e8fe58/gr4.jpg gr4 gr4.jpg jpg 50775 341 339 IMAGE-DOWNSAMPLED 1-s2.0-S2468823121002248-gr3.jpg https://s3-eu-west-1.amazonaws.com/prod-ucs-content-store-eu-west/content/pii:S2468823121002248/gr3/DOWNSAMPLED/image/jpeg/932969c3af446dcd5cce13f73d86087a/gr3.jpg gr3 gr3.jpg jpg 60145 344 489 IMAGE-DOWNSAMPLED 1-s2.0-S2468823121002248-gr9.jpg https://s3-eu-west-1.amazonaws.com/prod-ucs-content-store-eu-west/content/pii:S2468823121002248/gr9/DOWNSAMPLED/image/jpeg/aec36ee7741fb4e57144312d016b21d9/gr9.jpg gr9 gr9.jpg jpg 29939 326 339 IMAGE-DOWNSAMPLED 1-s2.0-S2468823121002248-gr8.jpg https://s3-eu-west-1.amazonaws.com/prod-ucs-content-store-eu-west/content/pii:S2468823121002248/gr8/DOWNSAMPLED/image/jpeg/c29921802a6cff7d22a0b8d8ff12dfd0/gr8.jpg gr8 gr8.jpg jpg 32023 324 339 IMAGE-DOWNSAMPLED 1-s2.0-S2468823121002248-gr7.jpg https://s3-eu-west-1.amazonaws.com/prod-ucs-content-store-eu-west/content/pii:S2468823121002248/gr7/DOWNSAMPLED/image/jpeg/137986f36b92c241104dda55810c4952/gr7.jpg gr7 gr7.jpg jpg 29066 329 339 IMAGE-DOWNSAMPLED 1-s2.0-S2468823121002248-sc1.sml https://s3-eu-west-1.amazonaws.com/prod-ucs-content-store-eu-west/content/pii:S2468823121002248/sc1/THUMBNAIL/image/gif/57bd96f6337850b496e5c75e04a281a3/sc1.sml sc1 sc1.sml sml 5349 72 219 IMAGE-THUMBNAIL 1-s2.0-S2468823121002248-gr11.sml https://s3-eu-west-1.amazonaws.com/prod-ucs-content-store-eu-west/content/pii:S2468823121002248/gr11/THUMBNAIL/image/gif/ae37f27a67676f1af6e0d2febd95f6f6/gr11.sml gr11 gr11.sml sml 6353 164 205 IMAGE-THUMBNAIL 1-s2.0-S2468823121002248-gr10.sml https://s3-eu-west-1.amazonaws.com/prod-ucs-content-store-eu-west/content/pii:S2468823121002248/gr10/THUMBNAIL/image/gif/d46c01e75f3929f7c5916bd6394bafb1/gr10.sml gr10 gr10.sml sml 7265 164 165 IMAGE-THUMBNAIL 1-s2.0-S2468823121002248-gr2.sml https://s3-eu-west-1.amazonaws.com/prod-ucs-content-store-eu-west/content/pii:S2468823121002248/gr2/THUMBNAIL/image/gif/b68366af83e3b9077bfae8660bd19c17/gr2.sml gr2 gr2.sml sml 10421 164 165 IMAGE-THUMBNAIL 1-s2.0-S2468823121002248-gr1.sml https://s3-eu-west-1.amazonaws.com/prod-ucs-content-store-eu-west/content/pii:S2468823121002248/gr1/THUMBNAIL/image/gif/538dd4384defa2bfed238cda2126cbb4/gr1.sml gr1 gr1.sml sml 10456 164 163 IMAGE-THUMBNAIL 1-s2.0-S2468823121002248-gr12.sml https://s3-eu-west-1.amazonaws.com/prod-ucs-content-store-eu-west/content/pii:S2468823121002248/gr12/THUMBNAIL/image/gif/47738e8b299be838603d88999a60d975/gr12.sml gr12 gr12.sml sml 6510 163 78 IMAGE-THUMBNAIL 1-s2.0-S2468823121002248-fx1.sml https://s3-eu-west-1.amazonaws.com/prod-ucs-content-store-eu-west/content/pii:S2468823121002248/fx1/THUMBNAIL/image/gif/ac74e571767b8b99a35e12490dcf87ef/fx1.sml fx1 true fx1.sml sml 21454 164 218 IMAGE-THUMBNAIL 1-s2.0-S2468823121002248-gr6.sml https://s3-eu-west-1.amazonaws.com/prod-ucs-content-store-eu-west/content/pii:S2468823121002248/gr6/THUMBNAIL/image/gif/d6261609451632a533725a2ff3e87b5d/gr6.sml gr6 gr6.sml sml 7807 164 182 IMAGE-THUMBNAIL 1-s2.0-S2468823121002248-gr5.sml https://s3-eu-west-1.amazonaws.com/prod-ucs-content-store-eu-west/content/pii:S2468823121002248/gr5/THUMBNAIL/image/gif/fb0b5c3135e4c8ca1f9c1c6c6ec46668/gr5.sml gr5 gr5.sml sml 8659 164 164 IMAGE-THUMBNAIL 1-s2.0-S2468823121002248-gr4.sml https://s3-eu-west-1.amazonaws.com/prod-ucs-content-store-eu-west/content/pii:S2468823121002248/gr4/THUMBNAIL/image/gif/e17ee21b7492435f8e7192ca2d80a82d/gr4.sml gr4 gr4.sml sml 10655 164 163 IMAGE-THUMBNAIL 1-s2.0-S2468823121002248-gr3.sml https://s3-eu-west-1.amazonaws.com/prod-ucs-content-store-eu-west/content/pii:S2468823121002248/gr3/THUMBNAIL/image/gif/805c8af52505dd8b3fc35402887054ec/gr3.sml gr3 gr3.sml sml 12729 154 219 IMAGE-THUMBNAIL 1-s2.0-S2468823121002248-gr9.sml https://s3-eu-west-1.amazonaws.com/prod-ucs-content-store-eu-west/content/pii:S2468823121002248/gr9/THUMBNAIL/image/gif/6bfda6d0832977b8345ff74a05f4135f/gr9.sml gr9 gr9.sml sml 8157 164 170 IMAGE-THUMBNAIL 1-s2.0-S2468823121002248-gr8.sml https://s3-eu-west-1.amazonaws.com/prod-ucs-content-store-eu-west/content/pii:S2468823121002248/gr8/THUMBNAIL/image/gif/fb12b25b9066180128e5932be340032d/gr8.sml gr8 gr8.sml sml 8458 163 171 IMAGE-THUMBNAIL 1-s2.0-S2468823121002248-gr7.sml https://s3-eu-west-1.amazonaws.com/prod-ucs-content-store-eu-west/content/pii:S2468823121002248/gr7/THUMBNAIL/image/gif/0c2ffd76b1c7fc76b924d319e38c38ec/gr7.sml gr7 gr7.sml sml 7898 164 169 IMAGE-THUMBNAIL 1-s2.0-S2468823121002248-am.pdf am am.pdf pdf 1278156 AAM-PDF https://s3-eu-west-1.amazonaws.com/prod-ucs-content-store-eu-west/content/egi:10P7KGPBHJG/MAIN/application/pdf/bd3200535021010ccd04326c00414312/am.pdf MCAT 111607 111607 S2468-8231(21)00224-8 10.1016/j.mcat.2021.111607 Scheme 1 Dehydrative etherification of fructose to EMF. Scheme 1 Fig. 1 XRD patterns of Nb0.4TPA/TiO2 catalysts. (a) TiO2 (b) 5 (c) 10 (d) 15 (e) 20 (f) 25wt% Nb0.4TPA/TiO2. Fig 1 Fig. 2 FT-IR spectra of Nb0.4TPA/TiO2 catalysts. (a) TiO2 (b) 5 (c) 10 (d) 15 (e) 20 (f) 25wt% Nb0.4TPA/TiO2 (g) TPA. Fig 2 Fig. 3 Raman spectra of Nb0.4TPA/TiO2 catalysts. (a) TiO2 (b) 5 (c) 10 (d) 15 (e) 20 (f) 25wt% Nb0.4TPA/TiO2. Fig 3 Fig. 4 Pyridine adsorbed FT-IR spectra of Nb0.4TPA/TiO2 catalysts. (a) TiO2 (b) 5 (c) 10 (d) 15 (e) 20 (f) 25wt% Nb0.4TPA/TiO2 (g) 20wt% TPA/TiO2. Fig 4 Fig. 5 NH3-TPD of Nb0.4TPA/TiO2 catalysts. (a) TiO2 (b) 5 (c) 10 (d) 15 (e) 20 (f) 25wt% Nb0.4TPA/TiO2. Fig 5 Fig. 6 Influence of THF volume on fructose dehydrative etherification to EMF over 20wt% Nb0.4TPA/TiO2 catalyst. Reaction conditions: Fructose: 0.180 g; Ethanol/THF: 5 mL; Catalyst wt%: 3.35; Temperature: 130 °C; Time: 6 h. Fig 6 Fig. 7 Influence of residence time on dehydrative etherification of fructose to EMF over 20wt% Nb0.4TPA/TiO2 catalyst. Reaction conditions: Fructose: 0.180 g; 5 mL Ethanol/THF: (3:2); Catalyst wt%: 3.35; Temperature: 130 °C. Fig 7 Fig. 8 Influence of reaction temperature on dehydrative etherification of fructose to EMF over 20wt% Nb0.4TPA/TiO2 catalyst. Reaction conditions: Fructose: 0.180 g; 5 mL Ethanol/THF: (3:2); Catalyst wt%: 3.35; Time: 6 h. Fig 8 Fig. 9 Influence of catalyst dosage on fructose dehydrative etherification to EMF over 20wt% Nb0.4TPA/TiO2 catalyst. Reaction conditions: Fructose: 0.180 g; 5 mL Ethanol/THF: (3:2); Catalyst wt%: 0.57–4.42; Temperature: 130 °C; Time: 6 h. Fig 9 Fig. 10 Recycle test results of 20wt% Nb0.4TPA/TiO2 catalyst. Reaction conditions: Fructose: 0.180 g; 5 mL Ethanol/THF: (3:2); Catalyst wt%: 3.35; Temperature: 130 °C; Time: 6 h. Fig 10 Fig. 11 Hot filtration test over 20wt% Nb0.4TPA/TiO2 catalyst. Reaction conditions: Fructose: 0.180 g; 5 mL Ethanol/THF: (3:2); Catalyst wt%: 3.35; Temperature: 130 °C. Fig 11 Fig. 12 (A) XRD patterns and (B) FT-IR spectra of 20wt% Nb0.4TPA/TiO2 catalyst. (a) fresh (b) used catalysts. Fig 12 Table 1 Textural possessions and acidity values of the Nb0.4TPA/TiO2 catalysts. Table 1 Catalyst SBET (m2g−1) a Total pore volume (cm3/g) × 10−2 Mean pore Diameter (nm) Acidity (m.mol/g) b Weak Strong Total TiO2 58.6 3.02 2.21 0.049 0.008 0.057 5wt% Nb0.4TPA/TiO2 55.6 2.99 2.20 0.052 0.039 0.091 10wt% Nb0.4TPA/TiO2 50.5 2.77 2.19 0.068 0.050 0.118 15wt% Nb0.4TPA/TiO2 47.0 2.52 2.18 0.084 0.058 0.142 20wt% Nb0.4TPA/TiO2 44.8 2.38 2.17 0.103 0.081 0.184 25wt% Nb0.4TPA/TiO2 41.2 2.24 2.15 0.083 0.116 0.199 Nb0.4TPA 8.5 0.3 1.70 0.032 0.789 0.821 a BET Surface area. b Total acidity values measured by NH3-TPD. Table 2 Production of EMF from fructose over NbxTPA/TiO2 catalysts. Table 2 Catalyst Conv. (%) Fructose Yield (%) L/B ratio Total acidity (m.mol/g) HMF EMF EL Nb0.2TPA 100 11 57 28 0.81 0.821 Nb0.4TPA 100 0 63 23 1.07 0.960 Nb0.6TPA 96 3 58 17 1.43 0.900 20wt% TPA/TiO2 91 8 58 22 0.56 0.159 20wt% Nb0.2TPA/TiO2 94 5 67 16 0.73 0.173 20wt% Nb0.4TPA/TiO2 99 1 76 12 1.27 0.184 20wt% Nb0.6TPA/TiO2 97 2 70 09 1.66 0.181 Reaction conditions: Fructose: 0.180 g; 5 mL Ethanol/THF: (3:2); Catalyst wt%: 3.35; Temperature: 130 °C; Time: 6 h. Table 3 Effect of different loadings of Nb0.4TPA on TiO2 for EMF production from fructose. Table 3 Catalyst Conv. (%) Fructose Yield (%) Carbon balance (%) HMF EMF EL Without catalyst – – – – – TiO2 33 23 5 0 92 Nb0.4TPA 100 0 63 23 91 5wt% Nb0.4TPA/TiO2 57 37 18 0 96 10wt% Nb0.4TPA/TiO2 79 24 48 3 95 15wt% Nb0.4TPA/TiO2 87 10 62 7 91 20wt% Nb0.4TPA/TiO2 99 1 76 12 93 25wt% Nb0.4TPA/TiO2 100 0 67 19 91 Reaction conditions: Fructose: 0.180 g; 5 mL Ethanol/THF: (3:2); Catalyst wt%: 3.35; Temperature: 130 °C; Time: 6 h. Table 4 Effect of co-solvent on EMF production over 20wt% Nb0.4TPA/TiO2 catalyst. Table 4 Entry Solvent Conv. (%) Fructose Yield (%) HMF EMF EL 1 EtOH 98 1 67 11 2 EtOH+THF 99 1 76 12 3 EtOH+DMSO 98 34 45 7 4 EtOH+H2O 96 27 41 6 Reaction conditions: Fructose: 0.180 g; 5 mL Ethanol/Co-solvent: (3:2); Catalyst wt%: 3.35; Temperature: 130 °C; Time: 6 h. Table 5 Literature summary on dehydrative etherification of fructose to EMF over different acid catalysts. Table 5 S. No Catalyst Solvent Reaction conditions EMF HMF EL Ref. Yield (%) 1 Poly (VMPS)-PW Ethanol 110οC, 10h 73 – – [29] 2 20wt%PWA-SBA15 Ethanol 100οC, 24h 67 – 12 [51] 3 Fe3O4@C-SO3H Ethanol 140οC, 24h 68 2 – [50] 4 C/SBA (45) Water/Ethanol 140οC, 24h 33 17 11 [47] 5 Lys/PW Ethanol/DMSO 120οC, 15 h 76 9 – [28] 6 MIL-101-SO3H (100) Ethanol/THF 130οC, 15 h 68 0.1 8 [49] 7 20wt%Nb0.4TPA/TiO2 Ethanol/THF 130οC, 6 h 76 1 12 Present work Niobium exchanged tungstophosphoric acid supported on titania catalysts for selective synthesis of 5-ethoxymethylfurfural from fructose P. Krishna Kumari a b B. Srinivasa Rao a b D. Mallesh a b N. Lingaiah a b ⁎ a Department of Catalysis and Fine Chemicals, CSIR-Indian Institute of Chemical Technology, Hyderabad 500 007, India Department of Catalysis and Fine Chemicals CSIR-Indian Institute of Chemical Technology Hyderabad 500 007 India aDepartment of Catalysis and Fine Chemicals, CSIR-Indian Institute of Chemical Technology, Hyderabad 500 007, India b Academy of Scientific and Innovative Research (CSIR-AcSIR), Ghaziabad 201002, India Academy of Scientific and Innovative Research (CSIR-AcSIR) Ghaziabad 201002 India bAcademy of Scientific and Innovative Research (CSIR-AcSIR), Ghaziabad 201002, India ⁎ Corresponding author at: Department of Catalysis and Fine Chemicals, CSIR-Indian Institute of Chemical Technology, Hyderabad 500 007, India. Department of Catalysis and Fine Chemicals CSIR-Indian Institute of Chemical Technology Hyderabad 500 007 India Various niobium contained tungstophosphoric acid (NbTPA) supported on titania catalysts were prepared and investigated their activity for selective synthesis of 5-ethoxymethylfurfural (EMF) from fructose in ethanol/THF solvent system. Physico-chemical properties of the catalysts were assessed by different spectroscopic approaches like X-ray diffraction, Laser Raman, BET-surface area, FT-IR, pyridine adsorbed FT-IR and temperature programmed desorption of ammonia. The results of characterization direct the existence of firm Keggin ion structure of Nb exchanged TPA and its well dispersed state on support. Lewis acidic sites were induced with the existence of Nb ions. The catalytic activity was interrelated to the catalyst acidity which was liable on the number of Nb ions present in TPA and the amount of NbxTPA supported on TiO2. Among all catalysts 20wt% Nb0.4TPA/TiO2 catalyst showed best catalytic performance towards EMF with a yield of 76% at 130 οC after 6 h. The catalyst is recyclable without any depletion of activity. Graphical abstract Image, graphical abstract Keywords Fructose Biomass 5-ethoxymethylfurfural Ethyl levulinate Tungstophosphoric acid 1 Introduction The down fall of fossil fuel resources, accompanied by raised call for conventional fuels and intensifying alarms about unfriendly environment, strains the world towards the discover of replenishment renewable feedstocks [1,2]. In this context, biomass may partially substitute and balance the non-renewable fossil incomes envisioned for the wide-ranging manufacture of fuels and chemicals [3,4]. Growing consideration has been put on resourceful valorisation of biomass derived carbohydrates to valuable platform molecules such as 5-hydroxymethyfurfural (HMF), furfural and liquid fuels [5,6]. Among several biomass derived products, 5-ethoxymethylfurfural (EMF) have been received extensive attention, which is generated through acid-catalysed etherification of 5-hydroxymethyfurfural with ethanol [7,8]. EMF has greater fuel properties like high energy density, high cetane number, good stability and low toxicity. Owing to its good fuel properties, EMF can be used as a good fuel additive. When blending with diesel creates fewer fine particles and SO2 emissions [9–11]. Right now, different approaches on EMF production were accessible such as treatment of 5-(chloromethyl) furfural (CMF), direct HMF etherification with ethanol and dehydrative etherification of hexoses like fructose and glucose [12,13]. Numerous catalysts, such as poly oxometallates [14], mineral acids [15] and inorganic salts [16,17] were experimented for EMF synthesis. However, most of these catalysts are soluble in reaction mixture makes tough job in recovery process. Instead of that, use of heterogeneous catalysts makes the process simple and facile. Consequently, many research groups developed heterogeneous catalytic systems for selective synthesis of EMF from different biomass products. Solid acid catalysts such as ZrO2/SBA-15, SO4-ZrO2/SBA-15 [18], graphene oxide (GO) [19] and HPA based catalysts like [BmimSO3H]3PW12O40 [20] Ag1H2PW [21], Cs2STA [22] and immobilized HPAs on different supports like K-10 clay [23], MCM-41 [24], cellulose-SO3H [25] were tested for EMF production from HMF. Etherification of HMF and nucleophilic substitution of 5-(chloromethyl) furfural with ethanol [26] are most effective ways to get more yield of EMF. However, large scale production of EMF from catalytic systems for HMF etherification and CMF treatment were inadequate owing to the high price of HMF, issue of harmful nature of HCl generation after nucleophilic substitution of Cl with ethanol in CMF. In this scenario, hexoses are favoured feedstocks to produce EMF through one-pot approach. As the use of glucose feedstock necessitates an isomerization step of glucose to fructose, it’s a difficult approach, needs specific properties of catalysts and gives lesser EMF yield. Both fructose dehydration into HMF and subsequently HMF etherification into EMF are acid catalysed reactions, gives better yield of EMF compared to glucose as a feedstock. It is rational to integrate the two discrete reactions into one-pot reaction by using fructose as feed to produce EMF. The two step dehydrative etherification of fructose to EMF reaction is shown in Scheme 1 . Many researchers have premeditated for one pot synthesis of EMF from fructose along with HMF. Recently, Yin et al. [27] studied Fe3O4@SiO2-SH-Im-HSO4 catalyst for synthesis of EMF from fructose and they reported 60% of EMF at 120 °C after 24 h. Balakrishnan et al. [15] testified silica sulfuric acid and Amberlyst-15 resin catalysts in order to produce EMF from fructose and attained around 69, 71% of EMF yields respectively at 110 °C after 30 h. Hu Li et al. [28] reached comparatively more produce of EMF with about 77% yield from fructose at 120 °C after 15 h in EtOH/DMSO solvent system by using acid–base hybrid nanosphere catalyst, together with heteropoly tungstate and amino acids. Different catalytic systems like Ag1H2PW [21], cellulose-SO3H [25], MCM-41-HPW [24], K-10 clay-HPW [23], poly (VMPS)-PW [29] were also assessed for EMF production from both fructose and HMF. In the direction of EMF synthesis from fructose by earlier reported systems required longer reaction time and high catalyst loadings. In this context, development of effective catalysts is still required for selective production of EMF from fructose. Along with various capable acid catalysts, heteropoly acids (HPAs) also can be used as a good applicant for acid catalysed reactions [30,31]. However, the nature of solubility in polar solvent system makes problematic in parting of catalyst from reaction mixture. To avoid these issues, renovate the HPAs into heterogeneous by replacing the protons with metal ions (Ta, Ti, Cs, Fe, Ag) [32,33] and diffusing them on various supports like SiO2 based mesoporous materials (SBA-15, SBA-16, MCM-41) [34,24], zeolites, metal phosphates (NbP, TiP, ZrP) [35] and metal oxides (Nb2O5, ZrO2, TiO2, SnO2) etc. [33,36]. Based on the nature of the reaction and reported catalysts, it is essential that the catalyst should have both Lewis and Bronsted acidic sites to obtain better activity in the synthesis of EMF directly from fructose. It is planned to modify the Bronsted acidic heteropolytungstate with Nb ions to create Lewis acidic sites to be used as catalyst for EMF synthesis. In present study, niobium (Nb) exchanged tungstophosphoric acid (TPA) was prepared by replacing the protons of TPA with Nb metal ions and dispersing them on titania (TiO2) support. These catalysts were studied for selective preparation of EMF from fructose in one-pot strategy. The various characterization techniques were used to recognize the catalysts properties and their activity was correlated based on their characteristic data. 2 Experimental 2.1 Catalyst preparation Nb exchanged TPA dispersed on TiO2 catalysts were developed in two steps by impregnation approach [37]. Firstly, tungstophosphoric acid dispersed on titania (TPA/TiO2) samples were prepared. The requisite quantity of TPA was dissolved in distilled water and this solution was added to TiO2 in drop wise with stirring. Subsequently stirring continued for 30 min, then the excess water was vanished by rota evaporator, dried in oven for overnight at100 οC and the samples were calcined at 300 οC for 2 h. Finally, Nb exchanged with protons of TPA dispersed on TiO2 catalysts were prepared as above stated description of impregnation method. Planned quantity of niobium chloride (NbCl5) dissolved in distilled water was added to the TPA dispersed on TiO2 sample prepared as mention above. After exchange of Nb the sample is dried on a hot plate and finally calcined at 300 οC for 2 h. The amount of NbCl5 is fixed based on the number of TPA protons to be replaced. Then, obtained the Nb5+ metal ions replaced by the protons of TPA supported TiO2 catalysts. These were labelled as 5–25 wt% Nb x TPA/TiO2 (x = 0.2, 0.4, 0.6) and the numbers indicate the weight percentage of Nb x TPA on support. 2.2 Catalysts characterization X-ray diffraction patterns were obtained on Rigaku Miniflex diffractometer with Cu Kα radiation (0.15406 nm) at 40 Kv voltage and 30 mA current. Patterns were recorded in 2θ range of 10.0–80.0° Raman spectra of catalysts were recorded on Raman spectroscopy (Horiba Jobin-Yvon Lab Ram HR spectrometer) equipped with a 17-mW internal He/Ne laser, operated at 633 nm of excitation wavelength. The powdered catalyst was spread over a glass slide and measurements were recorded by focusing at different spots in the range of 200–1200 cm−1. Fourier-transform infrared (FT-IR) spectral measurements were recorded by KBr disk technique on DIGILAB IR spectrometer (USA). Pyridine adsorbed IR spectra were attained on diffuse reflectance infrared Fourier Transform (DRIFT) mode. Proceeding to the assessment, the catalyst sample was pre-treated at 200 °C for 3 h under vacuum and pyridine was introduced. Afterwards, the sample heated for 1 h at 120 °C to get rid of any physiosorbed pyridine. Then, the sample cooled to room temperature and recorded the spectrum. Temperature programmed desorption of NH3 was attained on BELCAT-II instrument (Belsorb, Japan). Prior to the assessment, about 50 mg of sample was pre-treated for 1 h at 300 °C in 30 mL/min flow of pure He gas (99.9%). Then, the pre-treated sample was saturated by anhydrous NH3 (90% He −10% NH3 mixture gas) for 1 h at 100 °C. After that, the sample flushed with He gas at similar temperature to get rid of any physiosorbed NH3. The temperature program was performed from 100 to 800 °C with 10 °C/min elevation in temperature. The evolved quantity of NH3 was considered and calibrated via thermal conductivity detector (TCD) of the instrument. BET surface area of the prepared samples were calculated by N2 physisorption-desorption studies recorded by BEL Sorb II Instruments (Japan) at −196 οC. Before proceeding to the analysis, degassed the samples for 2 h at 200 °C. 2.3 Reaction procedure and analysis methods In a typical method of EMF synthesis from fructose, 0.180 g of fructose, ethanol/THF mixture solution (VEthanol:VTHF=3:2) and 3.35wt% of catalyst with respect to reaction mixture were added in to a 15 mL thick-enclosed glass apparatus. The reaction mixture was heated for specified reaction time at set temperature with stirring speed of 500 rpm. After desired time, the reaction was ended by placing the vessel into a cooled water bath. Then the sample was filtered, diluted and used for products investigation. The reaction mixture analysed by using a manual sampler HPLC system (SHIMADZU) equipped with binary LC-20AD pumps, and refractive index detector (RID-20A) maintained at 60 °C. The products were separated in Shodex SC1011 sugar column by using H2O as mobile phase with 0.8 mL/min flow rate. Calibration was done by using standard solutions of carbohydrates, EL, HMF and EMF. Prior to the test, samples were diluted with a known volume of millipore water and analysis was done for 3 times and testified within standard deviations of triplicates within 1.0%. 3 Results and discussion 3.1 Catalyst characterization XRD patterns of bare TiO2 and Nb0.4TPA/TiO2 catalysts are presented in Fig. 1 . Characteristic peaks at 2θ of 25.50ο, 37.83ο, 48.07ο, 53.88ο, 55.02ο and 62.70ο related to the anatase form of TiO2. Furthermore, small intense peaks apparent at 27.4ο, 36.08ο, 54.3ο represents the presence of rutile form of TiO2 [38]. Representative peaks of Nb0.4TPA Keggin ion were observed at 2θ of 14.6, 30.0, 34.5 [39] for the samples with above 20wt% of Nb0.4TPA on TiO2. This outcome suggests that Nb0.4TPA was well spread on the support at lower loadings and turn out to be crystalline phase when exceeding the 20wt% Nb0.4TPA, which informs the attainment of bulk constitution on the support [8]. FT-IR spectral patterns of TPA and Nb0.4TPA/TiO2 catalysts are showed in Fig. 2 . The Keggin heteropoly TPA displayed four characteristic bands of Keggin ion at 815, 891, 986 and 1080 cm−1 allied to the asymmetric stretching vibrations of W−Oe−W, W−Oc−W, W−Ot and P − O correspondingly [6, 40]. These peaks were observed for all the Nb modified TPA supported on TiO2 catalysts. FTIR results showed that Nb0.4TPA Keggin ion structure remains intact even after its dispersion on the support. Fig. 3 a shows the Raman spectra of the catalysts. The important bands of TiO2 are observed at 394, 515 and 638 cm−1 for all the catalysts. The representative bands of Keggin ion perceived at 991 and 1009 cm−1 allied to asymmetric and symmetric stretching modes of W=Ot of steady Keggin ion [41]. The respective Keggin ion bands were clearly observed in Fig. 3b for the catalysts with above 15wt% loading indicates that structure of Keggin heteropoly tungstate was not damaged after its modifications. The characterization findings from XRD, FT-IR and laser Raman spectral studies propose the preserve of stable Nb0.4TPA Keggin ion which was well spread over the support. Pyridine adsorbed FT-IR spectra were used to distinguish the classes of acidic sites existing in catalysts and the results are revealed in Fig. 4 . The samples exhibited bands at 1440, 1540 and 1490 cm−1, ascribed to Lewis, Brønsted and mix of both acidic sites correspondingly. It is well known that TPA contains only Bronsted acidic sites due to the presence of protons in its secondary structure of Keggin ion. The support TiO2 displayed the existence of small amount of Lewis acidity (Fig. 5 a). When the protons of TPA are exchanged with the Nb ions the catalysts showed the existence of Lewis acidity as shown ion Fig. 5. The IR band intensity of pyridine ion adsorbed on Lewis acidic sites are increased with rise in the loading of Nb0.4TPA on TiO2 [42]. The results indicate that the support TiO2 and Nb ions in TPA responsible for Lewis acidity and Bronsted acidity was mainly generated from TPA. NH3-TPD technique was facilitated to recognize the acidic strength of existing sites and total quantity of acidity. The results are displayed in Fig. 5 and total acidity of the samples are shown in Table 1 . Ammonia desorption peak for TiO2 was observed around 200 °C which was treated as week acidic sites. All the catalysts exhibited a broad desorption peak around 200 °C, signifying that the weak acidic sites which were created from support TiO2. A high temperature desorption peaks was appeared around 450–500 °C allied to medium-strong acidic sites and their intensity was increased with increase in Nb0.4TPA loading [40,43]. The total acidity of catalysts was increased with rise in Nb0.4TPA loading and maximum acidity value was observed for 25wt% of Nb0.4TPA on TiO2. Surface area along with pore size and pore volume values of TiO2, bulk Nb0.4TPA and Nb0.4TPA dispersed on TiO2 catalysts are given in Table 1. Compared with the support TiO2, surface area of the Nb0.4TPA/TiO2 catalysts was low. Surface area, pore size and pore volume were reduced as Nb0.4TPA loading increased on the support. The reduction in surface area, pore volume and pore diameter were attributed to the settling of Nb0.4TPA species inside the support pores and was finely spread on outward surface of the support, which results in fractional blockage in pore walls of the support [44]. Obviously, the support and prepared Nb0.4TPA/TiO2 catalysts showed higher surface area than bulk Nb0.4TPA (SBET = 8.5 m2g−1). 3.2 Activity results 3.2.1 Screening of NBXTPA/TiO2 catalysts for dehydrative etherification of fructose to EMF Initially the reaction was carried over Nb exchanged TPA catalysts containing different amount of Nb. All these catalysts showed good activity towards targeted product EMF as presented in Table 2 . However, these catalysts are homogeneous in reaction mixture. In order to make these catalysts heterogeneous in nature, supported on TiO2. Different quantities of Nb exchanged with protons of TPA supported on TiO2 (20wt% NbxTPA/TiO2 where x = 0, 0.2, 0.4 and 0.6) catalysts were prepared. These prepared catalysts were tested for fructose dehydrative etherification in ethanol/THF medium and their activity outcomes are portrayed in Table 2. TPA supported TiO2 (without Nb) catalyst also studied to clearly know the influence of Nb in the catalysts. All the catalysts including TPA/TiO2 showed high conversion of fructose. However, the selectivity towards desired EMF is more for Nb containing TPA/TiO2 catalysts. When compared to all other catalysts, Nb0.4TPA/TiO2 showed the highest yield of EMF. Catalytic activities of all these catalysts towards EMF are ensuing in the order of Nb0.4TPA/TiO2 > Nb0.6TPA/TiO2 > Nb0.2TPA/TiO2 > TPA/TiO2. The discrepancy in catalytic activity of all these catalysts are directed by the amount of Nb exchanged with the protons of TPA. The increase in amount of Nb presence in TPA increased the Lewis acidity in catalyst thereby the activity towards the targeted product EMF is high. The formation of EMF from fructose was depend on the total acidity and L/B ratio of the catalysts (type of acidic sites). The impact of Lewis to Bronsted acidic sites ratio on the product distribution in dehydrative etherification of fructose was clearly showed in earlier reports [42, 45]. According to these reports Lewis acidic sites more favourable for the formation of EMF than strong Bronsted acids which are favourable for further development of EL. The dehydration of fructose was favoured on Bronsted acidic sites and the etherification was followed on both acidic sites. The greater number of Bronsted acidic sites drives further ring opening product of EL. Pyridine adsorbed FT-IR spectral analysis suggest that the catalyst with low content of Nb has possessed more Bronsted acidity and the creation of Lewis acidic sites was increased with increase in Nb content in catalyst i.e., the L/B ratio was increased with increase in Nb content. The catalyst with reasonable amount of Lewis and Bronsted acidic sites can selectively produce the EMF with more yield. This could be the reason for the high yield of EMF over Nb0.4TPA/TiO2 catalyst. Based on these initial results Nb0.4TPA is taken as active composition and the catalysts are prepared with varying the content of it on TiO2. The catalytic activity outcomes of different loadings of Nb0.4TPA on TiO2 catalysts are depicted in Table 3 . For the sake of assessment, the reaction was performed in the absence of catalyst at 130 °C for 6 h and no EMF was observed. When the reaction was performed with bare Nb0.4TPA, complete conversion of fructose with 63% of EMF yield was obtained. Even though, Nb0.4TPA showed better activity in dehydrative etherification of fructose to EMF it is partially miscible in reaction mixture and makes difficult in catalyst separation for recycle. This bulk catalyst showed more amount of EL, which forms from EMF. The support TiO2 displayed 33% of fructose conversion with 5% of EMF yield. The catalysts activity towards the conversion of fructose improved with enhancement in the Nb0.4TPA loading on TiO2. However, the selectivity towards EMF is increased and reached maximum EMF yield (76%) for the catalyst with 20wt% Nb0.4TPA on TiO2. Further increase in active component to 25wt% produced more EL at the expense of EMF. The discrepancy in activity of 25wt% Nb0.4TPA/TiO2 catalyst might be owed to the being of a greater number of acidic sites which stimulated further EMF transformation to EL. Whereas, 20wt% Nb0.4TPA/TiO2 catalyst have reasonable amount of strong and weak acidic sites which directs the highest yield of EMF. The activity outcomes of the catalysts best coincided with the acidity measures of NH3-TPD and their acidity values signifying that the total acidity of Nb0.4TPA supported catalysts improved with increase in their quantity on the support TiO2. The yield of EMF was relied on the total acidity of catalysts and it was directly proportional to the acidity of catalyst up to 20wt%. Further increase in Nb0.4TPA quantity to 25wt%, decrease in EMF yield and increase in EL yield was detected, the presence of more acidity together with a greater number of strong acidic sites in 25wt% Nb0.4TPA catalyst than balanced amount as in 20wt% favoured for the formation of ring opening product (EL). 3.2.2 Solvent screening over 20wt% Nb0.4TPA/TiO2 catalyst To know the effect of solvent on synthesis of EMF, different solvent systems are examined and the results are presented in Table 4 . The catalyst showed almost complete conversion in all the solvents studied. However, the selectivity to desired product EMF was varied for these solvents. When the experiment was conducted in pure ethanol, EMF and EL are the main products with 67% and 11% yields, respectively. When the DMSO, water and THF as co-solvents along with ethanol (EtOH) the yields of EMF were 45%, 41% and 76% respectively. Compared with ethanol system the yield of EMF was improved when THF used as co-solvent. In case of DMSO and water the produce of EMF was reduced considerably. Water/ethanol or DMSO/ethanol solvent systems may promote the inverse “EMF-HMF” process, as reported earlier [46, 47]. It can be recognized that THF possibly will provide a more hydrophobic atmosphere than ethanol, can separate the products from reactant. This reduces the formation of humins and leads to maximum EMF yield (76%). In case of pure ethanol side reactions such as HMF rehydration and polymerization may occur [48]. In view of the higher EMF yield in ethanol/THF solvent system, THF was used as an effective co-solvent in further studies. 3.2.3 Effect of THF volume As already addressed earlier that the addition of THF as a co-solvent in ethanol medium can enhanced the yield of EMF from fructose over 20wt% Nb0.4TPA/TiO2 catalyst, consequently, we examined the effect of THF volume in ethanol medium towards EMF yield and the results are displayed in Fig. 6 . The introduction of THF could not change in fructose conversion. However, its existence boosted the EMF yield. The maximum yield of EMF was 67% in pure ethanol medium. When 2 mL of THF introduced in to ethanol medium with ethanol/THF volume ratio (VEthanol:VTHF) of 3:2 the yield of EMF was increased to 76%. Further rise in THF amount there was no considerable increase in EMF yield. This might be due to accumulation of HMF and subsequently accessibility of ethanol decreased for etherification. Accordingly, ethanol/THF volume ratio of 3:2 was preferred as the optimum in 5 mL of total solvent. THF presence did not have any noticeable effect on EL yield and it mainly contribute towards hydrophobic atmosphere than ethanol, which can decrease the humins formation by the separation of products from fructose. 3.2.4 Influence of reaction time The progression of fructose dehydrative etherification with 20wt% Nb0.4TPA/TiO2 catalyst at different intervals of time was examined. As shown in Fig. 7 , conversion of fructose and EMF yield were improved by means of time from 1 to 6 h. At early 1 h of reaction time attained only 45% of fructose conversion with 28% and 14% of HMF and EMF yields, respectively. Initially HMF was the major product in the reaction mixture and it was further converted to EMF with increasing the time from 1 to 6 h. Optimal performance was observed at 6 h of reaction time with 99% of fructose conversion and 76% of EMF yield. Further extension of experiment over 6 h led to entire conversion of fructose and the yield EMF was declined. The reduction in EMF yield associated to further ethanolysis of EMF to EL. Above discussion suggests that 6 h of reaction time is optimal for best production of EMF over the present catalyst. 3.2.5 Influence of reaction temperature As established in Fig. 8 , the dehydrative etherification of fructose was carried in the temperature range of 70–150 °C. The conversion and yield of EMF was improved with raising the reaction temperature. At 70 °C of temperature the fructose conversion was only 35%, and reached to 100% when the temperature elevated up to 150 °C. The increase in temperature from 70 to130 °C, EMF yield also progressively improved from 10 to 76% and comparatively reduced to 62% at high temperature i.e.150 °C. At elevated temperatures the reduction in EMF yield might be a result of formation of EL. It indicates that 130 °C is an optimum reaction temperature to get good amount of EMF yield from fructose over 20wt% Nb0.4TPA/TiO2 catalyst. 3.2.6 Catalyst dosage effect The influence of catalyst weight on the dehydrative etherification of fructose was screened and the outcomes are shown in Fig. 9 . Fructose conversion was raised continually by increase in catalyst weight from 0.57 to 4.42 wt%. This might be due to the available number of active sites were increased with increase in catalyst weight. Ideal activity achieved at 3.35 wt% of catalyst weight with 99% and 76% of fructose conversion and EMF yield, respectively. As further raise in catalyst amount to 4.42 wt% complete conversion was noted with reduced EMF yield. The acidity of the catalyst was increased with increase in the amount of catalyst and the high acidity may led to further transformation of EMF to EL. 3.2.7 Merits of the current catalyst over other catalysts In order to explore the advantages of the current catalyst towards dehydrative etherification of fructose to EMF with other catalytic systems, a comparison was made based on the reported catalysts and presented in Table 5 . Different researchers developed acidic catalytic systems containing HPAs and SO3H active components for synthesis of EMF from fructose dehydrative etherification. Liu et al. [49] reported nearly 68% of EMF at 130 οC after 15 h using MIL-101-SO3H catalyst in ethanol/THF medium. Yuan et al. [50] made sulfonated Fe3O4@C catalyst, produced 68% of EMF at 140 οC in longer reaction time of 24 h. Li et al. [29] reported poly (VMPS)-PW catalyst for successive production of EMF, which gave highest yield of EMF (73%) under optimal conditions of 110 οC after 10 h. Acid–base hybrid nanosphere catalyst prepared with heteropoly tungstate and amino acids, reported 76% of EMF yield in ethanol/DMSO solvent system in 15 h reaction time at 120 οC [28]. PWA incorporated SBA-15 catalyst [51] showed 67% of EMF at 100 οC after 24 h. Patrícia A. Russo et al. [46] experimented carbon/silica functionalised with SO3H catalyst in ethanol/water medium for synthesis of EMF from fructose and they reported moderate yields of 33% EMF at 140 οC after 24 h. All the above reported catalytic systems, comparatively produced good amount of EMF. However, they required higher reaction time at moderate to high temperature. Most of these catalysts have issues such as, leaching of active component from the catalyst. Compared to above systems, the present 20wt% Nb0.4TPA/TiO2 catalyst was not leaching and presented higher yield of EMF (76%) within reasonable reaction time. 3.2.8 Reusability The reusability of the 20wt% Nb0.4TPA/TiO2 catalyst was studied under equivalent conditions as done in earlier experiments. Upon end of the experiment, the used catalyst was parted from reaction mixture by centrifugation and washed with ethanol. Dried the collected catalyst at 100 °C and evaluated for recycling experiments under optimum reaction conditions and the outcomes are presented in Fig. 10 . A steady activity of catalyst perceived up to five cycles without major loss in activity. A hot filtration test was performed to identify any active component of the catalyst is leached or not. Fig. 11 shows the results of leaching test. The test results confirmed that there is no leach of active component from the catalyst as there was no conversion after removal of catalyst from reaction mixture. In order to know any structural changes in the catalyst after reuse the used catalyst was examined by XRD and FT-IR. The results are shown in Fig. 12 a and b suggest that the catalyst structure was intact even after repeated use. 4 Conclusions Titania supported Nb exchanged tungstophosphoric acid catalysts were prepared with retention of Keggin ion structure. The catalyst with 20wt% Nb0.4TPA/TiO2 is efficient to produce EMF with 76% yield from fructose in one-pot strategy. Activity of the catalysts was depended on the quantity of Nb ions exchanged with TPA and its content on the support. Lewis acidic sites were created with the replacement of TPA protons with Nb, which are highly influential in the overall acidity of the catalyst. The yield of EMF also be reliant on the reaction time, amount of catalyst and reaction temperature. The catalyst is reproducible and recyclable without any considerable loss in its activity. Credit author statement P. Krishna Kumari: Synthesis of catalysts, Data acquisition by experimentation B. Srinivasa Rao: Characterization and draft preparation D. Mallesh: Characterization N. Lingaiah*: Conceptualization, Reviewing and Editing Declaration of Competing Interest The authors declare that they have no known competing financial interests or personal relationships that could have appeared to influence the work reported in this paper. Acknowledgements Author P. Krishna Kumari acknowledge to UGC-New Delhi, India for financial support in the form of Senior Research Fellowship. We thank Director, CSIR-IICT for permitting to publish our results (IICT Communication No: IICT/Pubs./2021/050) References [1] F. Thomas D. Stephen J.J. Leahy Energy Fuels 29 2015 7554 7565 F. Thomas, D. Stephen, J.J. Leahy, Energy Fuels29 (2015) 7554–7565. [2] H. Lei L. Lu W. Zhen Z. Shouyong L. Shijie Renew. Sustain. Energy Rev. 74 2017 230 257 H. Lei, L. Lu, W. Zhen, Z. Shouyong, L. Shijie, Renew. Sustain. Energy Rev.74 (2017) 230–257. [3] K. Günnur C. Nilgün Renew. Sustain. Energy Rev. 28 2013 900 916 K. Günnur, C. Nilgün, Renew. Sustain. Energy Rev.28 (2013) 900–916. [4] F. Angeles C. Chao S. Manuel X. Yongmei L. Jian J.H. María J.L. Robert Chem. Rev. 115 2015 6811 6853 F. Angeles, C. Chao, S. Manuel, X. Yongmei, L. Jian, J.H. María, J.L. Robert, Chem. Rev.115 (2015) 6811–6853. [5] W. Tianfu W.N. Michael H.S. Brent Green Chem 16 2014 548 572 W. Tianfu, W.N. Michael, H.S. Brent, Green Chem. 16 (2014) 548–72. [6] B.S. Rao P.K. Kumari D.D. Lakshmi N. Lingaiah Mol. Catal. 427 2017 80 86 B.S. Rao, P.K. Kumari, D.D. Lakshmi, N. Lingaiah, Mol. Catal.427 (2017) 80–86. [7] W. Shuguo Z. Zehui L. Bing L. Jinlin Catal. Sci. Technol. 3 2013 2104 2112 W. Shuguo, Z. Zehui, L. Bing, L. Jinlin, Catal. Sci. Technol.3 (2013) 2104–2112. [8] P.K. Kumari B.S. Rao D.D. Lakshmi N.R.S. Paramesh C. Sumana N. Lingaiah Catal. Today 325 2019 53 60 P.K. Kumari, B.S. Rao, D.D. Lakshmi, N.R.S. Paramesh, C. Sumana, N. Lingaiah, Catal. Today325 (2019) 53–60. [9] A. Siamak O. Hamid D.S. Kim Renew. Sustain. Energy Rev. 71 2017 908 926 A. Siamak, O. Hamid, D.S. Kim, Renew. Sustain. Energy Rev.71 (2017) 908–926. [10] O. Hamid A. Kumar D.S. Kim Renew. Sustain. Energy Rev. 48 2015 635 647 O. Hamid, A. Kumar, D.S. Kim, Renew. Sustain. Energy Rev.48 (2015) 635–647. [11] H. Hafizi G. Walker J. Iqbal J.J. Leahy M.N. Collins Mol. Catal. 496 2020 111176 H. Hafizi, G. Walker, J. Iqbal, J.J. Leahy, M.N. Collins, Mol. Catal.496 (2020) 111176. [12] J.R. Bernardo M.C. Oliveira A.C. Fernandes Mol. Catal. 465 2019 87 94 J.R. Bernardo, M.C. Oliveira, A.C. Fernandes, Mol. Catal.465 (2019) 87–94. [13] S. Karnjanakom P. Maneechakr C. Samart G. Guan Mol. Catal. Mol. Catal. 479 2019 110632 S. Karnjanakom, P. Maneechakr, C. Samart, G. Guan, Mol. Catal. Mol. Catal.479 (2019) 110632. [14] Y. Yang M.M. Abu-Omar C. Hu Appl. Energy 99 2012 80 84 Y. Yang, M.M. Abu-Omar, C. Hu, Appl. Energy99 (2012) 80–84. [15] M. Balakrishnan E.R. Sacia A.T. Bell Green Chem 14 2012 1626 1634 M. Balakrishnan, E.R. Sacia, A.T. Bell, Green Chem. 14 (2012) 1626–1634. [16] B. Liu Z. Zhang K. Huang Z. Fang, Fuel 113 2013 625 631 B. Liu, Z. Zhang, K. Huang, Z. Fang, Fuel113 (2013) 625–631. [17] J. Liu Y. Tang K. Wu C. Bi Q. Cui Carbohydr. Res. 350 2012 20 24 J. Liu, Y. Tang, K. Wu, C. Bi, Q. Cui, Carbohydr. Res.350 (2012) 20–24. [18] P. Lanzafame D.M. Temi S. Perathoner G. Centi A. Macario A. Aloise G. Giordano Catal. Today 175 2011 435 441 P. Lanzafame, D.M. Temi, S. Perathoner, G. Centi, A. Macario, A. Aloise, G. Giordano, Catal. Today175 (2011) 435–441. [19] H. Wang T. Deng Y. Wang X. Cui Y. Qi X. Mu X. Hou Y. Zhu Green Chem 15 2013 2379 2383 H. Wang, T. Deng, Y. Wang, X. Cui, Y. Qi, X. Mu, X. Hou, Y. Zhu, Green Chem. 15 (2013) 2379–2383. [20] L. Bing Z. Zhang K. Deng Ind. Eng. Chem. Res. 51 2012 15331 15336 L. Bing, Z. Zhang, K. Deng, Ind. Eng. Chem. Res.51 (2012) 15331–15336. [21] Y. Ren B. Liu Z. Zhang J. Lin J. Ind. Eng. Chem. 21 2015 1127 1131 Y. Ren, B. Liu, Z. Zhang, J. Lin, J. Ind. Eng. Chem.21 (2015) 1127–31. [22] G. Raveendra A. Rajasekhar M. Srinivas P.S.S. Prasad N. Lingaiah Appl. Catal. A: Gen. 520 2016 105 113 G. Raveendra, A. Rajasekhar, M. Srinivas, P.S.S. Prasad, N. Lingaiah, Appl. Catal. A: Gen.520 (2016) 105–113. [23] A. Liu B. Liu Y. Wang R. Ren Z. Zhang Fuel 117 2014 68 73 A. Liu, B. Liu, Y. Wang, R. Ren, Z. Zhang, Fuel117 (2014) 68–73. [24] A. Liu Z. Zhang Z. Fang B. Liu K. Huang J. Ind. Eng. Chem. 20 2014 1977 1984 A. Liu, Z. Zhang, Z. Fang, B. Liu, K. Huang, J. Ind. Eng. Chem.20 (2014) 1977–1984. [25] B. Liu Z. Zhang K. Huang Cellulose 20 2013 2081 2089 B. Liu, Z. Zhang, K. Huang, Cellulose20 (2013) 2081–2089. [26] I. Viil A. Bredihhin U. Maeorg L. Vares RSC Adv. 4 2014 5689 5693 I. Viil, A. Bredihhin, U. Maeorg, L. Vares, RSC Adv.4 (2014) 5689–5693. [27] S. Yin J. Sun B. Liu Z. Zhang J. Mater. Chem. A 3 2015 4992 4999 S. Yin, J. Sun, B. Liu, Z. Zhang, J. Mater. Chem. A3 (2015) 4992–4999. [28] H. Li K.S. Govind R. Kotni S. Shunmugavel A. Riisager S. Yang Energy Convers. Manag. 88 2014 1245 1251 H. Li, K.S. Govind, R. Kotni, S. Shunmugavel, A. Riisager, S. Yang, Energy Convers. Manag.88 (2014) 1245–1251. [29] H. Li Q. Zhang S. Yang Int. J. Chem. Eng. 2014 2014 1 7 H. Li, Q. Zhang, S. Yang, Int. J. Chem. Eng.2014 (2014) 1–7. [30] B.S. Rao P.K. Kumaria K. Paramita J. Tardio N. Lingaiah Mol. Catal. 466 2019 52 59 B.S. Rao, P.K. Kumaria, K. Paramita, J. Tardio, N. Lingaiah, Mol. Catal.466 (2019) 52–59. [31] N. Azizi F. Arynasab M.R. Saidi Org. Biomol. Chem. 4 2006 4275 4277 N. Azizi, F. Arynasab, M.R. Saidi, Org. Biomol. Chem.4 (2006) 4275–4277. [32] B.S. Rao P.K. Kumari D.D. Lakshmi N. Lingaiah Catal. Today 309 2018 269 275 B.S. Rao, P.K. Kumari, D.D. Lakshmi, N. Lingaiah, Catal. Today309 (2018) 269–275. [33] R. Liu T. Wang C. Liu Y. Jin Chinese J. Catal. 34 2013 2174 2182 R. Liu, T. Wang, C. Liu, Y. Jin, Chinese J. Catal.34 (2013) 2174–2182. [34] E.S. Sankar K.S. Reddy Y. Jyothi B.D. Raju K.S.R. Rao Catal. Lett. 147 2017 2807 2816 E.S. Sankar, K.S. Reddy, Y. Jyothi, B.D. Raju, K.S.R. Rao, Catal. Lett.147 (2017) 2807–2816. [35] D.P. Das K.M. Parida J. Mol. Catal. A Chem. 253 2006 70 78 D.P. Das, K.M. Parida, J. Mol. Catal. A Chem.253 (2006) 70–78. [36] M. Srinivas G. Raveendra G. Parameswaram P.S.S. Prasad N. Lingaiah J. Mol. Catal. A Chem. 413 2016 7 14 M. Srinivas, G. Raveendra, G. Parameswaram, P.S.S. Prasad, N. Lingaiah, J. Mol. Catal. A Chem.413 (2016) 7–14. [37] K.T.V. Rao P.S.N. Rao P.S.S. Prasad N. Lingaiah Catal. Commun. 10 2009 1394 1397 K.T.V. Rao, P.S.N. Rao, P.S.S. Prasad, N. Lingaiah, Catal. Commun.10 (2009) 1394–1397. [38] T. Yang S.J. Park T.G. Kim D.S. Shin K.D. Suh J. Park Opt. Express 25 2017 30843 30850 T. Yang, S.J. Park, T.G. Kim, D.S. Shin, K.D. Suh, J. Park, Opt. Express25 (2017) 30843–30850. [39] Ch.R. Kumar N. Rambabu N. Lingaiah P.S.S. Prasad A.K. Dalai Appl. Catal A: Gen. 471 2014 1 11 Ch.R. Kumar, N. Rambabu, N. Lingaiah, P.S.S. Prasad, A.K. Dalai, Appl. Catal A: Gen.471 (2014) 1–11. [40] M. Mu W. Fang Y. Liu L. Chen Ind. Eng. Chem. Res. 54 2015 8893 8899 M. Mu, W. Fang, Y. Liu, L. Chen, Ind. Eng. Chem. Res.54 (2015) 8893–8899. [41] Ch.R. Kumar P.S.S. Prasad N. Lingaiah J. Mol. Catal. A Chem. 350 2011 83 90 Ch.R. Kumar, P.S.S. Prasad, N. Lingaiah, J. Mol. Catal. A Chem.350 (2011) 83–90. [42] B.S. Rao D.D. Lakshmi P.K. Kumari P. Rajitha N. Lingaiah Sustain. Energy Fuels 4 2020 3428 3437 B.S. Rao, D.D. Lakshmi, P.K. Kumari, P. Rajitha, N. Lingaiah, Sustain. Energy Fuels4 (2020) 3428–3437. [43] P.K. Kumari B.S. Rao D. Padmakar N. Pasha N. Lingaiah Mol. Catal. 448 2018 108 115 P.K. Kumari, B.S. Rao, D. Padmakar, N. Pasha, N. Lingaiah, Mol. Catal.448 (2018) 108–115. [44] X. Kong S. Wu L. Liu S. Li J. Liu Mol. Catal. 439 2017 180 185 X. Kong, S. Wu, L. Liu, S. Li, J. Liu, Mol. Catal.439 (2017) 180–185. [45] P. Lanzafamea D.M. Temia S. Perathonera G. Centia A. Macariob A. Aloiseb G. Giordano Catal. Today 175 2011 435 441 P. Lanzafamea, D.M. Temia, S. Perathonera, G. Centia, A. Macariob, A. Aloiseb, G. Giordano, Catal. Today175 (2011) 435–441. [46] L. Zhang Y. Zhu L. Tian Y. He H. Wang F. Deng Fuel Process. Technol. 193 2019 39 47 L. Zhang, Y. Zhu, L. Tian, Y. He, H. Wang, F. Deng, Fuel Process. Technol.193 (2019) 39–47. [47] A.R. Patrícia M.A. Margarida N. Patrícia V.W. Paul F. Enza N. Fortunato B. Francesco M. Luís P. Martyn P. Nicola A.V. Anabela Green Chem 16 2014 4292 4305 A.R. Patrícia, M.A. Margarida, N. Patrícia, V.W. Paul, F. Enza, N. Fortunato, B. Francesco, M. Luís, P. Martyn, P. Nicola, A.V. Anabela, Green Chem. 16 (2014) 4292–4305. [48] B. Chen G. Xu Z. Zheng D. Wang C. Zou C. Chang Ind. Crops Prod. 129 2019 503 511 B. Chen, G. Xu, Z. Zheng, D. Wang, C. Zou, C. Chang, Ind. Crops Prod.129 (2019) 503–511. [49] X. Liu H. Li H. Pan H. Zhang S. Huang K. Yang W. Xue S. Yang J. Energy Chem. 25 2016 523 530 X. Liu, H. Li, H. Pan, H. Zhang, S. Huang, K. Yang, W. Xue, S. Yang, J. Energy Chem.25 (2016) 523–530. [50] Z. Yuan Z. Zhang J. Zheng J. Lin Fuel 150 2015 236 242 Z. Yuan, Z. Zhang, J. Zheng, J. Lin, Fuel150 (2015) 236–242. [51] R.P. Chetana Ch.V. Rode Fuel 217 2018 38 44 R.P. Chetana, Ch.V. Rode, Fuel217 (2018) 38–44.",
      "scopus-id": "85105480821",
      "coredata": {
        "eid": "1-s2.0-S2468823121002248",
        "dc:description": "Various niobium contained tungstophosphoric acid (NbTPA) supported on titania catalysts were prepared and investigated their activity for selective synthesis of 5-ethoxymethylfurfural (EMF) from fructose in ethanol/THF solvent system. Physico-chemical properties of the catalysts were assessed by different spectroscopic approaches like X-ray diffraction, Laser Raman, BET-surface area, FT-IR, pyridine adsorbed FT-IR and temperature programmed desorption of ammonia. The results of characterization direct the existence of firm Keggin ion structure of Nb exchanged TPA and its well dispersed state on support. Lewis acidic sites were induced with the existence of Nb ions. The catalytic activity was interrelated to the catalyst acidity which was liable on the number of Nb ions present in TPA and the amount of NbxTPA supported on TiO2. Among all catalysts 20wt% Nb0.4TPA/TiO2 catalyst showed best catalytic performance towards EMF with a yield of 76% at 130 οC after 6 h. The catalyst is recyclable without any depletion of activity.",
        "openArchiveArticle": "false",
        "prism:coverDate": "2021-05-31",
        "openaccessUserLicense": null,
        "prism:aggregationType": "Journal",
        "prism:url": "https://api.elsevier.com/content/article/pii/S2468823121002248",
        "dc:creator": [
          {
            "@_fa": "true",
            "$": "Kumari, P. Krishna"
          },
          {
            "@_fa": "true",
            "$": "Rao, B. Srinivasa"
          },
          {
            "@_fa": "true",
            "$": "Mallesh, D."
          },
          {
            "@_fa": "true",
            "$": "Lingaiah, N."
          }
        ],
        "link": [
          {
            "@_fa": "true",
            "@rel": "self",
            "@href": "https://api.elsevier.com/content/article/pii/S2468823121002248"
          },
          {
            "@_fa": "true",
            "@rel": "scidir",
            "@href": "https://www.sciencedirect.com/science/article/pii/S2468823121002248"
          }
        ],
        "dc:format": "application/json",
        "openaccessType": null,
        "pii": "S2468-8231(21)00224-8",
        "prism:volume": "508",
        "articleNumber": "111607",
        "prism:publisher": "Elsevier B.V.",
        "dc:title": "Niobium exchanged tungstophosphoric acid supported on titania catalysts for selective synthesis of 5-ethoxymethylfurfural from fructose",
        "prism:copyright": "© 2021 Elsevier B.V. All rights reserved.",
        "openaccess": "0",
        "prism:issn": "24688231",
        "dcterms:subject": [
          {
            "@_fa": "true",
            "$": "Fructose"
          },
          {
            "@_fa": "true",
            "$": "Biomass"
          },
          {
            "@_fa": "true",
            "$": "5-ethoxymethylfurfural"
          },
          {
            "@_fa": "true",
            "$": "Ethyl levulinate"
          },
          {
            "@_fa": "true",
            "$": "Tungstophosphoric acid"
          }
        ],
        "openaccessArticle": "false",
        "prism:publicationName": "Molecular Catalysis",
        "openaccessSponsorType": null,
        "prism:pageRange": "111607",
        "pubType": "fla",
        "prism:coverDisplayDate": "May 2021",
        "prism:doi": "10.1016/j.mcat.2021.111607",
        "prism:startingPage": "111607",
        "dc:identifier": "doi:10.1016/j.mcat.2021.111607",
        "openaccessSponsorName": null
      },
      "objects": {
        "object": [
          {
            "@category": "standard",
            "@height": "185",
            "@width": "565",
            "@_fa": "true",
            "$": "https://api.elsevier.com/content/object/eid/1-s2.0-S2468823121002248-sc1.jpg?httpAccept=%2A%2F%2A",
            "@multimediatype": "JPEG image file",
            "@type": "IMAGE-DOWNSAMPLED",
            "@size": "20323",
            "@ref": "sc1",
            "@mimetype": "image/jpeg"
          },
          {
            "@category": "standard",
            "@height": "271",
            "@width": "339",
            "@_fa": "true",
            "$": "https://api.elsevier.com/content/object/eid/1-s2.0-S2468823121002248-gr11.jpg?httpAccept=%2A%2F%2A",
            "@multimediatype": "JPEG image file",
            "@type": "IMAGE-DOWNSAMPLED",
            "@size": "17400",
            "@ref": "gr11",
            "@mimetype": "image/jpeg"
          },
          {
            "@category": "standard",
            "@height": "336",
            "@width": "339",
            "@_fa": "true",
            "$": "https://api.elsevier.com/content/object/eid/1-s2.0-S2468823121002248-gr10.jpg?httpAccept=%2A%2F%2A",
            "@multimediatype": "JPEG image file",
            "@type": "IMAGE-DOWNSAMPLED",
            "@size": "27312",
            "@ref": "gr10",
            "@mimetype": "image/jpeg"
          },
          {
            "@category": "standard",
            "@height": "337",
            "@width": "339",
            "@_fa": "true",
            "$": "https://api.elsevier.com/content/object/eid/1-s2.0-S2468823121002248-gr2.jpg?httpAccept=%2A%2F%2A",
            "@multimediatype": "JPEG image file",
            "@type": "IMAGE-DOWNSAMPLED",
            "@size": "47311",
            "@ref": "gr2",
            "@mimetype": "image/jpeg"
          },
          {
            "@category": "standard",
            "@height": "341",
            "@width": "339",
            "@_fa": "true",
            "$": "https://api.elsevier.com/content/object/eid/1-s2.0-S2468823121002248-gr1.jpg?httpAccept=%2A%2F%2A",
            "@multimediatype": "JPEG image file",
            "@type": "IMAGE-DOWNSAMPLED",
            "@size": "47517",
            "@ref": "gr1",
            "@mimetype": "image/jpeg"
          },
          {
            "@category": "standard",
            "@height": "709",
            "@width": "339",
            "@_fa": "true",
            "$": "https://api.elsevier.com/content/object/eid/1-s2.0-S2468823121002248-gr12.jpg?httpAccept=%2A%2F%2A",
            "@multimediatype": "JPEG image file",
            "@type": "IMAGE-DOWNSAMPLED",
            "@size": "53802",
            "@ref": "gr12",
            "@mimetype": "image/jpeg"
          },
          {
            "@category": "standard",
            "@height": "200",
            "@width": "266",
            "@_fa": "true",
            "$": "https://api.elsevier.com/content/object/eid/1-s2.0-S2468823121002248-fx1.jpg?httpAccept=%2A%2F%2A",
            "@multimediatype": "JPEG image file",
            "@type": "IMAGE-DOWNSAMPLED",
            "@size": "25555",
            "@ref": "fx1",
            "@mimetype": "image/jpeg"
          },
          {
            "@category": "standard",
            "@height": "305",
            "@width": "339",
            "@_fa": "true",
            "$": "https://api.elsevier.com/content/object/eid/1-s2.0-S2468823121002248-gr6.jpg?httpAccept=%2A%2F%2A",
            "@multimediatype": "JPEG image file",
            "@type": "IMAGE-DOWNSAMPLED",
            "@size": "26092",
            "@ref": "gr6",
            "@mimetype": "image/jpeg"
          },
          {
            "@category": "standard",
            "@height": "338",
            "@width": "339",
            "@_fa": "true",
            "$": "https://api.elsevier.com/content/object/eid/1-s2.0-S2468823121002248-gr5.jpg?httpAccept=%2A%2F%2A",
            "@multimediatype": "JPEG image file",
            "@type": "IMAGE-DOWNSAMPLED",
            "@size": "36573",
            "@ref": "gr5",
            "@mimetype": "image/jpeg"
          },
          {
            "@category": "standard",
            "@height": "341",
            "@width": "339",
            "@_fa": "true",
            "$": "https://api.elsevier.com/content/object/eid/1-s2.0-S2468823121002248-gr4.jpg?httpAccept=%2A%2F%2A",
            "@multimediatype": "JPEG image file",
            "@type": "IMAGE-DOWNSAMPLED",
            "@size": "50775",
            "@ref": "gr4",
            "@mimetype": "image/jpeg"
          },
          {
            "@category": "standard",
            "@height": "344",
            "@width": "489",
            "@_fa": "true",
            "$": "https://api.elsevier.com/content/object/eid/1-s2.0-S2468823121002248-gr3.jpg?httpAccept=%2A%2F%2A",
            "@multimediatype": "JPEG image file",
            "@type": "IMAGE-DOWNSAMPLED",
            "@size": "60145",
            "@ref": "gr3",
            "@mimetype": "image/jpeg"
          },
          {
            "@category": "standard",
            "@height": "326",
            "@width": "339",
            "@_fa": "true",
            "$": "https://api.elsevier.com/content/object/eid/1-s2.0-S2468823121002248-gr9.jpg?httpAccept=%2A%2F%2A",
            "@multimediatype": "JPEG image file",
            "@type": "IMAGE-DOWNSAMPLED",
            "@size": "29939",
            "@ref": "gr9",
            "@mimetype": "image/jpeg"
          },
          {
            "@category": "standard",
            "@height": "324",
            "@width": "339",
            "@_fa": "true",
            "$": "https://api.elsevier.com/content/object/eid/1-s2.0-S2468823121002248-gr8.jpg?httpAccept=%2A%2F%2A",
            "@multimediatype": "JPEG image file",
            "@type": "IMAGE-DOWNSAMPLED",
            "@size": "32023",
            "@ref": "gr8",
            "@mimetype": "image/jpeg"
          },
          {
            "@category": "standard",
            "@height": "329",
            "@width": "339",
            "@_fa": "true",
            "$": "https://api.elsevier.com/content/object/eid/1-s2.0-S2468823121002248-gr7.jpg?httpAccept=%2A%2F%2A",
            "@multimediatype": "JPEG image file",
            "@type": "IMAGE-DOWNSAMPLED",
            "@size": "29066",
            "@ref": "gr7",
            "@mimetype": "image/jpeg"
          },
          {
            "@category": "thumbnail",
            "@height": "72",
            "@width": "219",
            "@_fa": "true",
            "$": "https://api.elsevier.com/content/object/eid/1-s2.0-S2468823121002248-sc1.sml?httpAccept=%2A%2F%2A",
            "@multimediatype": "GIF image file",
            "@type": "IMAGE-THUMBNAIL",
            "@size": "5349",
            "@ref": "sc1",
            "@mimetype": "image/gif"
          },
          {
            "@category": "thumbnail",
            "@height": "164",
            "@width": "205",
            "@_fa": "true",
            "$": "https://api.elsevier.com/content/object/eid/1-s2.0-S2468823121002248-gr11.sml?httpAccept=%2A%2F%2A",
            "@multimediatype": "GIF image file",
            "@type": "IMAGE-THUMBNAIL",
            "@size": "6353",
            "@ref": "gr11",
            "@mimetype": "image/gif"
          },
          {
            "@category": "thumbnail",
            "@height": "164",
            "@width": "165",
            "@_fa": "true",
            "$": "https://api.elsevier.com/content/object/eid/1-s2.0-S2468823121002248-gr10.sml?httpAccept=%2A%2F%2A",
            "@multimediatype": "GIF image file",
            "@type": "IMAGE-THUMBNAIL",
            "@size": "7265",
            "@ref": "gr10",
            "@mimetype": "image/gif"
          },
          {
            "@category": "thumbnail",
            "@height": "164",
            "@width": "165",
            "@_fa": "true",
            "$": "https://api.elsevier.com/content/object/eid/1-s2.0-S2468823121002248-gr2.sml?httpAccept=%2A%2F%2A",
            "@multimediatype": "GIF image file",
            "@type": "IMAGE-THUMBNAIL",
            "@size": "10421",
            "@ref": "gr2",
            "@mimetype": "image/gif"
          },
          {
            "@category": "thumbnail",
            "@height": "164",
            "@width": "163",
            "@_fa": "true",
            "$": "https://api.elsevier.com/content/object/eid/1-s2.0-S2468823121002248-gr1.sml?httpAccept=%2A%2F%2A",
            "@multimediatype": "GIF image file",
            "@type": "IMAGE-THUMBNAIL",
            "@size": "10456",
            "@ref": "gr1",
            "@mimetype": "image/gif"
          },
          {
            "@category": "thumbnail",
            "@height": "163",
            "@width": "78",
            "@_fa": "true",
            "$": "https://api.elsevier.com/content/object/eid/1-s2.0-S2468823121002248-gr12.sml?httpAccept=%2A%2F%2A",
            "@multimediatype": "GIF image file",
            "@type": "IMAGE-THUMBNAIL",
            "@size": "6510",
            "@ref": "gr12",
            "@mimetype": "image/gif"
          },
          {
            "@category": "thumbnail",
            "@height": "164",
            "@width": "218",
            "@_fa": "true",
            "$": "https://api.elsevier.com/content/object/eid/1-s2.0-S2468823121002248-fx1.sml?httpAccept=%2A%2F%2A",
            "@multimediatype": "GIF image file",
            "@type": "IMAGE-THUMBNAIL",
            "@size": "21454",
            "@ref": "fx1",
            "@mimetype": "image/gif"
          },
          {
            "@category": "thumbnail",
            "@height": "164",
            "@width": "182",
            "@_fa": "true",
            "$": "https://api.elsevier.com/content/object/eid/1-s2.0-S2468823121002248-gr6.sml?httpAccept=%2A%2F%2A",
            "@multimediatype": "GIF image file",
            "@type": "IMAGE-THUMBNAIL",
            "@size": "7807",
            "@ref": "gr6",
            "@mimetype": "image/gif"
          },
          {
            "@category": "thumbnail",
            "@height": "164",
            "@width": "164",
            "@_fa": "true",
            "$": "https://api.elsevier.com/content/object/eid/1-s2.0-S2468823121002248-gr5.sml?httpAccept=%2A%2F%2A",
            "@multimediatype": "GIF image file",
            "@type": "IMAGE-THUMBNAIL",
            "@size": "8659",
            "@ref": "gr5",
            "@mimetype": "image/gif"
          },
          {
            "@category": "thumbnail",
            "@height": "164",
            "@width": "163",
            "@_fa": "true",
            "$": "https://api.elsevier.com/content/object/eid/1-s2.0-S2468823121002248-gr4.sml?httpAccept=%2A%2F%2A",
            "@multimediatype": "GIF image file",
            "@type": "IMAGE-THUMBNAIL",
            "@size": "10655",
            "@ref": "gr4",
            "@mimetype": "image/gif"
          },
          {
            "@category": "thumbnail",
            "@height": "154",
            "@width": "219",
            "@_fa": "true",
            "$": "https://api.elsevier.com/content/object/eid/1-s2.0-S2468823121002248-gr3.sml?httpAccept=%2A%2F%2A",
            "@multimediatype": "GIF image file",
            "@type": "IMAGE-THUMBNAIL",
            "@size": "12729",
            "@ref": "gr3",
            "@mimetype": "image/gif"
          },
          {
            "@category": "thumbnail",
            "@height": "164",
            "@width": "170",
            "@_fa": "true",
            "$": "https://api.elsevier.com/content/object/eid/1-s2.0-S2468823121002248-gr9.sml?httpAccept=%2A%2F%2A",
            "@multimediatype": "GIF image file",
            "@type": "IMAGE-THUMBNAIL",
            "@size": "8157",
            "@ref": "gr9",
            "@mimetype": "image/gif"
          },
          {
            "@category": "thumbnail",
            "@height": "163",
            "@width": "171",
            "@_fa": "true",
            "$": "https://api.elsevier.com/content/object/eid/1-s2.0-S2468823121002248-gr8.sml?httpAccept=%2A%2F%2A",
            "@multimediatype": "GIF image file",
            "@type": "IMAGE-THUMBNAIL",
            "@size": "8458",
            "@ref": "gr8",
            "@mimetype": "image/gif"
          },
          {
            "@category": "thumbnail",
            "@height": "164",
            "@width": "169",
            "@_fa": "true",
            "$": "https://api.elsevier.com/content/object/eid/1-s2.0-S2468823121002248-gr7.sml?httpAccept=%2A%2F%2A",
            "@multimediatype": "GIF image file",
            "@type": "IMAGE-THUMBNAIL",
            "@size": "7898",
            "@ref": "gr7",
            "@mimetype": "image/gif"
          },
          {
            "@category": "standard",
            "@_fa": "true",
            "$": "https://api.elsevier.com/content/object/eid/1-s2.0-S2468823121002248-am.pdf?httpAccept=%2A%2F%2A",
            "@multimediatype": "Acrobat PDF file",
            "@type": "AAM-PDF",
            "@size": "1278156",
            "@ref": "am",
            "@mimetype": "application/pdf"
          }
        ]
      },
      "link": {
        "@rel": "abstract",
        "@href": "https://api.elsevier.com/content/abstract/scopus_id/85105480821"
      }
    }
  }
}