{
  "metadata": {
    "title": "Highly dispersed Ni nanoparticles encapsulated in hollow mesoporous silica spheres as an efficient catalyst for quinoline hydrogenation",
    "authors": "; ; ",
    "journal": "Molecular Catalysis",
    "date": "2021-09-30",
    "doi": "10.1016/j.mcat.2021.111855",
    "abstract": "",
    "uri": "https://api.elsevier.com/content/article/pii/S2468823121004727",
    "pii": "S2468823121004727"
  },
  "fulltext": {
    "full-text-retrieval-response": {
      "scopus-eid": "2-s2.0-85114675849",
      "originalText": "serial JL 315758 291210 291744 291790 291809 31 Molecular Catalysis MOLECULARCATALYSIS 2021-09-10 2021-09-10 2021-09-10 2021-09-10 2021-09-28T07:55:37 1-s2.0-S2468823121004727 S2468-8231(21)00472-7 S2468823121004727 10.1016/j.mcat.2021.111855 S300 S300.1 FULL-TEXT 1-s2.0-S2468823121X00144 2022-12-12T23:36:21.627889Z 0 0 20210901 20210930 2021 2021-09-10T23:04:11.29462Z absattachment articleinfo articlenumber articletitlenorm authfirstinitialnorm authfirstsurnamenorm cid cids contenttype copyright crossmark dateloaded dateloadedtxt datesearch datesort dateupdated dco docsubtype doctype doi eid ewtransactionid hubeid indexeddate issn issnnorm itemstage itemtransactionid itemweight openaccess openarchive pg pgfirst pii piinorm pubdateend pubdatestart pubdatetxt pubyr sectiontitle sortorder srctitle srctitlenorm srctype ssids alllist content subj subheadings suppl tomb volfirst volissue volumelist webpdf webpdfpagecount yearnav figure table e-component body acknowledge affil appendices articletitle auth authfirstini authfull authkeywords authlast grantnumber grantsponsor grantsponsorid highlightsabst primabst ref specialabst 2468-8231 24688231 true 514 514 C Volume 514 31 111855 111855 111855 202109 September 2021 2021-09-01 2021-09-30 2021 Regular Papers article fla © 2021 Elsevier B.V. All rights reserved. HIGHLYDISPERSEDNINANOPARTICLESENCAPSULATEDINHOLLOWMESOPOROUSSILICASPHERESEFFICIENTCATALYSTFORQUINOLINEHYDROGENATION NIU L Introduction Experimental Materials The detailed fabrication process of Ni@hw-mSiO2 Catalyst activity test Catalyst characterization Results and discussion Conclusions CRediT authorship contribution statement Acknowledgments Appendix Supplementary materials Reference WEI 2019 980 1002 Z HE 2019 120 126 Z PEREZZUNIGA 2019 126 131 C WANG 2011 9878 9891 T ZHANG 2015 3529 3537 L TU 2012 11346 11349 X DOBEREINER 2011 7547 7562 G HE 2020 111192 Z ZHANG 2018 101 111 S WANG 2017 9419 9422 X GUO 2017 2221 2227 M ZHANG 2018 145 153 F YAN 2013 1484 1487 M LI 2019 176 182 K WEI 2016 5816 5822 Z FOPPA 2017 17128 17139 L RILEY 2018 12964 12973 C RUAN 2020 110639 L JI 2020 111155 N OSAWA 2018 131 136 T WANG 2018 231 241 X LI 2017 683 694 X WEN 2018 26 33 Z SOGHRATI 2018 130 142 E ZHANG 2017 5993 5999 H NIE 2020 111156 S QIAO 2019 118111 X SUN 2019 63 75 H KONISHCHEVA 2018 413 421 M RICHARD 2017 5679 5692 A DONG 2019 14688 14694 J LI 2020 2086 2096 K FANG 2013 2205 2218 X SONG 2007 11850 11856 X PHAAHLAMOHLAKKA 2020 117617 T MA 2016 1738 1745 J KUWAHARA 2019 1993 2006 Y YAN 2020 125484 P YANG 2021 119628 G LU 2021 65 80 Y FENG 2015 19807 19814 W YANG 2020 111094 X LU 2018 190 199 Y YANG 2020 117868 W ZHAO 2017 759 768 Y DONG 2020 110846 J QIN 2019 110561 J BUDI 2019 274 288 C ZHANG 2019 258 265 H HE 2017 87 95 J YE 2020 2000194 H HU 2001 6099 6104 S ZHANG 2014 1939 1948 L NIUX2021X111855 NIUX2021X111855XL 2023-09-10T00:00:00.000Z 2023-09-10T00:00:00.000Z http://creativecommons.org/licenses/by-nc-nd/4.0/ © 2021 Elsevier B.V. All rights reserved. 2021-09-14T22:52:09.173Z http://vtw.elsevier.com/data/voc/AddOnTypes/50.7/aggregated-refined Natural Science Foundation of Hebei Province B2019201341 Natural Science Foundation of Hebei Province http://data.elsevier.com/vocabulary/SciValFunders/501100003787 http://sws.geonames.org/1814991/ Hebei University 050001/521000981226 Hebei University http://data.elsevier.com/vocabulary/SciValFunders/501100008047 http://sws.geonames.org/1814991/ National Natural Science Foundation of China 21676068 22078080 NNSFC National Natural Science Foundation of China http://data.elsevier.com/vocabulary/SciValFunders/501100001809 http://sws.geonames.org/1814991/ Financial supports from the National Natural Science Foundation of China ( 22078080 , 21676068 ), Natural Science Foundation of Hebei Province ( B2019201341 ) and the Advanced Talents Incubation Program of Hebei University (050001/521000981226) are gratefully acknowledged 0 https://doi.org/10.15223/policy-017 https://doi.org/10.15223/policy-037 https://doi.org/10.15223/policy-012 https://doi.org/10.15223/policy-029 https://doi.org/10.15223/policy-004 item S2468-8231(21)00472-7 S2468823121004727 1-s2.0-S2468823121004727 10.1016/j.mcat.2021.111855 315758 2021-09-28T07:57:11.823713Z 2021-09-01 2021-09-30 1-s2.0-S2468823121004727-main.pdf https://s3-eu-west-1.amazonaws.com/prod-ucs-content-store-eu-west/content/pii:S2468823121004727/MAIN/application/pdf/e7e3b9669285b78cdf094fb574f0cebf/main.pdf main.pdf pdf true 10724426 MAIN 9 1-s2.0-S2468823121004727-main_1.png https://s3-eu-west-1.amazonaws.com/prod-ucs-content-store-eu-west/content/pii:S2468823121004727/PREVIEW/image/png/9aaf7a4008cc65de706b60ce8dd6844e/main_1.png main_1.png png 61795 849 656 IMAGE-WEB-PDF 1 1-s2.0-S2468823121004727-gr8.jpg https://s3-eu-west-1.amazonaws.com/prod-ucs-content-store-eu-west/content/pii:S2468823121004727/gr8/DOWNSAMPLED/image/jpeg/1f242d2984608f5f2be5b572908a199c/gr8.jpg gr8 gr8.jpg jpg 82237 464 678 IMAGE-DOWNSAMPLED 1-s2.0-S2468823121004727-gr7.jpg https://s3-eu-west-1.amazonaws.com/prod-ucs-content-store-eu-west/content/pii:S2468823121004727/gr7/DOWNSAMPLED/image/jpeg/1daf522ad3ce370ac43e8f15b994adc3/gr7.jpg gr7 gr7.jpg jpg 37710 355 527 IMAGE-DOWNSAMPLED 1-s2.0-S2468823121004727-gr2.jpg https://s3-eu-west-1.amazonaws.com/prod-ucs-content-store-eu-west/content/pii:S2468823121004727/gr2/DOWNSAMPLED/image/jpeg/28d088fdab4683630fd55242483ba556/gr2.jpg gr2 gr2.jpg jpg 113151 585 565 IMAGE-DOWNSAMPLED 1-s2.0-S2468823121004727-ga1.jpg https://s3-eu-west-1.amazonaws.com/prod-ucs-content-store-eu-west/content/pii:S2468823121004727/ga1/DOWNSAMPLED/image/jpeg/5959df9b7e0d4bfd51c33db942a80705/ga1.jpg ga1 true ga1.jpg jpg 20308 200 231 IMAGE-DOWNSAMPLED 1-s2.0-S2468823121004727-gr1.jpg https://s3-eu-west-1.amazonaws.com/prod-ucs-content-store-eu-west/content/pii:S2468823121004727/gr1/DOWNSAMPLED/image/jpeg/a976b25ff1a353f76460078ac5d8429f/gr1.jpg gr1 gr1.jpg jpg 98569 673 659 IMAGE-DOWNSAMPLED 1-s2.0-S2468823121004727-gr6.jpg https://s3-eu-west-1.amazonaws.com/prod-ucs-content-store-eu-west/content/pii:S2468823121004727/gr6/DOWNSAMPLED/image/jpeg/87599f84a789448ff2a36b14abd6d403/gr6.jpg gr6 gr6.jpg jpg 62363 377 527 IMAGE-DOWNSAMPLED 1-s2.0-S2468823121004727-gr5.jpg https://s3-eu-west-1.amazonaws.com/prod-ucs-content-store-eu-west/content/pii:S2468823121004727/gr5/DOWNSAMPLED/image/jpeg/363141598e8a58a2e513ade8da81ff9b/gr5.jpg gr5 gr5.jpg jpg 41727 398 527 IMAGE-DOWNSAMPLED 1-s2.0-S2468823121004727-gr4.jpg https://s3-eu-west-1.amazonaws.com/prod-ucs-content-store-eu-west/content/pii:S2468823121004727/gr4/DOWNSAMPLED/image/jpeg/8cc405408681fd14b3bde57afc7ddb5a/gr4.jpg gr4 gr4.jpg jpg 65654 261 677 IMAGE-DOWNSAMPLED 1-s2.0-S2468823121004727-gr3.jpg https://s3-eu-west-1.amazonaws.com/prod-ucs-content-store-eu-west/content/pii:S2468823121004727/gr3/DOWNSAMPLED/image/jpeg/da4cb921158e85a85edb5695281792bd/gr3.jpg gr3 gr3.jpg jpg 126167 485 678 IMAGE-DOWNSAMPLED 1-s2.0-S2468823121004727-gr8.sml https://s3-eu-west-1.amazonaws.com/prod-ucs-content-store-eu-west/content/pii:S2468823121004727/gr8/THUMBNAIL/image/gif/3b6b239dbec12472aaee4d25aaa28b70/gr8.sml gr8 gr8.sml sml 15170 150 219 IMAGE-THUMBNAIL 1-s2.0-S2468823121004727-gr7.sml https://s3-eu-west-1.amazonaws.com/prod-ucs-content-store-eu-west/content/pii:S2468823121004727/gr7/THUMBNAIL/image/gif/209f4cb23d216b04a44df23f01f970dd/gr7.sml gr7 gr7.sml sml 9394 148 219 IMAGE-THUMBNAIL 1-s2.0-S2468823121004727-gr2.sml https://s3-eu-west-1.amazonaws.com/prod-ucs-content-store-eu-west/content/pii:S2468823121004727/gr2/THUMBNAIL/image/gif/92eca546d9c92d2cd653d959172d3756/gr2.sml gr2 gr2.sml sml 14959 164 158 IMAGE-THUMBNAIL 1-s2.0-S2468823121004727-ga1.sml https://s3-eu-west-1.amazonaws.com/prod-ucs-content-store-eu-west/content/pii:S2468823121004727/ga1/THUMBNAIL/image/gif/934a460513a2e1c9bb58541ee5bf088e/ga1.sml ga1 true ga1.sml sml 24598 164 189 IMAGE-THUMBNAIL 1-s2.0-S2468823121004727-gr1.sml https://s3-eu-west-1.amazonaws.com/prod-ucs-content-store-eu-west/content/pii:S2468823121004727/gr1/THUMBNAIL/image/gif/68c29d8fc607e58cf16c0805e78ad08d/gr1.sml gr1 gr1.sml sml 17944 163 160 IMAGE-THUMBNAIL 1-s2.0-S2468823121004727-gr6.sml https://s3-eu-west-1.amazonaws.com/prod-ucs-content-store-eu-west/content/pii:S2468823121004727/gr6/THUMBNAIL/image/gif/d029debec51b8ee9ac4c2922f9b8f796/gr6.sml gr6 gr6.sml sml 12964 157 219 IMAGE-THUMBNAIL 1-s2.0-S2468823121004727-gr5.sml https://s3-eu-west-1.amazonaws.com/prod-ucs-content-store-eu-west/content/pii:S2468823121004727/gr5/THUMBNAIL/image/gif/275134ae18c3a5b42a9ff762e17ad775/gr5.sml gr5 gr5.sml sml 9570 164 217 IMAGE-THUMBNAIL 1-s2.0-S2468823121004727-gr4.sml https://s3-eu-west-1.amazonaws.com/prod-ucs-content-store-eu-west/content/pii:S2468823121004727/gr4/THUMBNAIL/image/gif/06ef6fa7ef463a4ef77d940e29fb01f2/gr4.sml gr4 gr4.sml sml 9256 84 219 IMAGE-THUMBNAIL 1-s2.0-S2468823121004727-gr3.sml https://s3-eu-west-1.amazonaws.com/prod-ucs-content-store-eu-west/content/pii:S2468823121004727/gr3/THUMBNAIL/image/gif/bef0f69cecc9d7d4cd0b35b9f7e2eb16/gr3.sml gr3 gr3.sml sml 27113 157 219 IMAGE-THUMBNAIL 1-s2.0-S2468823121004727-gr8_lrg.jpg https://s3-eu-west-1.amazonaws.com/prod-ucs-content-store-eu-west/content/pii:S2468823121004727/gr8/HIGHRES/image/jpeg/0aa798d7d81600fb74c785935f57bbad/gr8_lrg.jpg gr8 gr8_lrg.jpg jpg 817924 2055 3000 IMAGE-HIGH-RES 1-s2.0-S2468823121004727-gr7_lrg.jpg https://s3-eu-west-1.amazonaws.com/prod-ucs-content-store-eu-west/content/pii:S2468823121004727/gr7/HIGHRES/image/jpeg/52990f131aebc40a552edd8601d30ef9/gr7_lrg.jpg gr7 gr7_lrg.jpg jpg 276175 1573 2333 IMAGE-HIGH-RES 1-s2.0-S2468823121004727-gr2_lrg.jpg https://s3-eu-west-1.amazonaws.com/prod-ucs-content-store-eu-west/content/pii:S2468823121004727/gr2/HIGHRES/image/jpeg/1f647d4d9fdfd02c62e9241ed54f9d8a/gr2_lrg.jpg gr2 gr2_lrg.jpg jpg 1255111 2589 2500 IMAGE-HIGH-RES 1-s2.0-S2468823121004727-ga1_lrg.jpg https://s3-eu-west-1.amazonaws.com/prod-ucs-content-store-eu-west/content/pii:S2468823121004727/ga1/HIGHRES/image/jpeg/c557e63127eefc0927ecbf8958f41f71/ga1_lrg.jpg ga1 true ga1_lrg.jpg jpg 153068 886 1024 IMAGE-HIGH-RES 1-s2.0-S2468823121004727-gr1_lrg.jpg https://s3-eu-west-1.amazonaws.com/prod-ucs-content-store-eu-west/content/pii:S2468823121004727/gr1/HIGHRES/image/jpeg/31d0d53f5a5cfc478c20039d3d6f8f48/gr1_lrg.jpg gr1 gr1_lrg.jpg jpg 855104 2980 2917 IMAGE-HIGH-RES 1-s2.0-S2468823121004727-gr6_lrg.jpg https://s3-eu-west-1.amazonaws.com/prod-ucs-content-store-eu-west/content/pii:S2468823121004727/gr6/HIGHRES/image/jpeg/6ab65159ad45e9aa3259e73dc56a3b7a/gr6_lrg.jpg gr6 gr6_lrg.jpg jpg 499670 1669 2334 IMAGE-HIGH-RES 1-s2.0-S2468823121004727-gr5_lrg.jpg https://s3-eu-west-1.amazonaws.com/prod-ucs-content-store-eu-west/content/pii:S2468823121004727/gr5/HIGHRES/image/jpeg/8f1b7dd7c8155e8a299342f8b60a13a3/gr5_lrg.jpg gr5 gr5_lrg.jpg jpg 316475 1763 2333 IMAGE-HIGH-RES 1-s2.0-S2468823121004727-gr4_lrg.jpg https://s3-eu-west-1.amazonaws.com/prod-ucs-content-store-eu-west/content/pii:S2468823121004727/gr4/HIGHRES/image/jpeg/1fdfa92e48c04eb4a6873778c281af88/gr4_lrg.jpg gr4 gr4_lrg.jpg jpg 461411 1154 2999 IMAGE-HIGH-RES 1-s2.0-S2468823121004727-gr3_lrg.jpg https://s3-eu-west-1.amazonaws.com/prod-ucs-content-store-eu-west/content/pii:S2468823121004727/gr3/HIGHRES/image/jpeg/e0bdc5308c90743bb5d26b8f6d435a4d/gr3_lrg.jpg gr3 gr3_lrg.jpg jpg 1190660 2147 3000 IMAGE-HIGH-RES 1-s2.0-S2468823121004727-mmc1.doc https://s3-eu-west-1.amazonaws.com/prod-ucs-content-store-eu-west/content/pii:S2468823121004727/mmc1/MAIN/application/msword/a730f2ed9a2497921acfbd707c2755ac/mmc1.doc mmc1 mmc1.doc doc 2166272 APPLICATION 1-s2.0-S2468823121004727-am.pdf am am.pdf pdf 4549124 AAM-PDF https://s3-eu-west-1.amazonaws.com/prod-ucs-content-store-eu-west/content/egi:10QHTJV90R5/MAIN/application/pdf/5390328b4f23d76db6278b24ff249491/am.pdf MCAT 111855 111855 S2468-8231(21)00472-7 10.1016/j.mcat.2021.111855 Fig. 1 Preparation procedure of Ni@hw-mSiO2 and the SEM images of carbon sphere template (b,c), C@Ni@SiO2 (d) and Ni@hw-mSiO2 (e). Fig 1 Fig. 2 TEM images and particle size distribution of Ni@hw-mSiO2 (a,b), Ni/hw-mSiO2 (c,d) and Ni/mSiO2 (e,f). Fig 2 Fig. 3 STEM and EDX mapping of Ni@hw-mSiO2 catalyst. Fig 3 Fig. 4 XRD patterns of (A) calcined and (B) reduced catalysts: (a) Ni@hw-mSiO2, (b) Ni/hw-mSiO2 and (c) Ni/mSiO2. Fig 4 Fig. 5 H2-TPR profiles of Ni@hw-mSiO2, Ni/hw-mSiO2 and Ni/mSiO2. Fig 5 Fig. 6 Ni 2p3/2 XPS spectra of Ni@hw-mSiO2, Ni/hw-mSiO2 and Ni/mSiO2. Fig 6 Fig. 7 The relationship between the quinoline conversion with Ni active sites in the different catalysts (Ni active sites was determined by H2-chemisorption). Fig 7 Fig. 8 Catalytic stability of (a) Ni@hw-mSiO2, (b) Ni/hw-mSiO2 and (c) Ni/mSiO2 (Reaction conditions: 100 °C, 3 MPa H2, 300 rpm, 2 h). Fig 8 Table 1 Physicochemical properties of Ni@hw-mSiO2, Ni/hw-mSiO2 and Ni/mSiO2. Table 1 Catalysis Ni content(wt%) BET Surface area (m2 g−1) Pore volume (cm3 g−1) H2-chemisorption (cm3 g−1) Mental dispersion (%) Ni@hw-mSiO2 12.37 873 0.46 0.82 3.28 Ni/hw-mSiO2 17.54 399 0.27 0.54 2.17 Ni/mSiO2 16.40 218 0.17 0.48 1.59 Table 2 Hydrogenation performance of prepared catalysts. Table 2 Catalysis Conv./% Sel./% [a] Yield/% py-THQ bz-THQ others py-THQ Ni@hw-mSiO2 98.9 97.1 1.9 1.0 96.0 Ni/hw-mSiO2 44.9 96.2 2.2 1.6 43.2 Ni/mSiO2 21.5 95.3 1.1 3.6 20.5 Reaction condition:1 mL quinoline, 0.12 g catalysis, 30 mL EtOH, P(H2) 3 MPa,reaction at 100 °C for 2 h. [a] py-THQ:1–4- tetrahydroquinoline;bz-THQ:5–8- tetrahydroquinoline;others: decahydroquinoline and 1-Ethyl-1–4-tetrahydroquinoline. Highly dispersed Ni nanoparticles encapsulated in hollow mesoporous silica spheres as an efficient catalyst for quinoline hydrogenation Libo Niu Writing – original draft Supervision Resources ⁎ Yadan An Methodology Investigation Writing – original draft Xiaowei Yang Investigation Gang Bian Formal analysis Writing – review & editing Qi Wu Formal analysis Zhanghui Xia Validation Guoyi Bai Conceptualization Resources Supervision Writing – review & editing ⁎ Key Laboratory of Chemical Biology of Hebei Province, College of Chemistry and Environmental Science, Hebei University, Baoding 071002, PR China Key Laboratory of Chemical Biology of Hebei Province College of Chemistry and Environmental Science Hebei University Baoding 071002 PR China Key Laboratory of Chemical Biology of Hebei Province, College of Chemistry and Environmental Science, Hebei University, Baoding 071002, PR China ⁎ Corresponding author. With the aim of studying the effect of support structure and preparation method on the hydrogenation performance of Ni-based catalysts. Hollow mesoporous silica spheres (hw-mSiO2) containing tiny Ni nanoparticles highly dispersed on the inner surface (Ni@hw-mSiO2) were synthesized by using carbon sphere as template with four continuous procedures, containing Ni deposition, silica shell coating, calcination and reduction. As demonstrated by SEM and TEM, the hollow structure was successfully obtained after calcination and the active Ni species was highly dispersed inside the porous silica shell, which is much smaller than the Ni-based catalysts prepared by a conventional impregnation method using hw-mSiO2 (Ni/hw-mSiO2) or commercial SiO2 (Ni/mSiO2) as supports. TPR and H2-chemisorption results revealed the existence of strong metal-interaction and more hydrogenation sites in Ni@hw-mSiO2. Therefore, Ni@hw-mSiO2 catalyst achieved an excellent catalytic activity and stability in the selective hydrogenation of quinoline into 1–4-tetrahydroquinoline (py-THQ), due to the more dispersed Ni species, strong metal-support interaction and confinement effect of porous silica shell. Graphical abstract A novel yolk-shell Ni@hw-mSiO2 catalyst showed outstanding activity and stability in quinoline hydrogenation into 1–4-tetrahydroquinoline Image, graphical abstract Keywords Quinoline hydrogenation Hollow silica sphere Ni dispersion Confinement effect Stability Introduction The selective hydrogenation of quinoline and its derivatives is a high atom efficient and convenient route to produce 1–4-tetrahydroquinolines (py-THQ), which is an important synthetic intermediate for pharmaceuticals, agrochemicals and other applications [1–3]. Large number of homogeneous catalysts based on Ru [4], Rh [5], Au [6] and Ir [7] have been studied in the selective hydrogenation of quinoline, but the difficulties in their separation and recovery also affected the application of such catalysts. Therefore, heterogeneous catalysts play an important role in this transformation [8]. However, most of the high-performance heterogeneous catalysts for quinoline hydrogenation are also noble metal, including Pt [9], Ru [10], Pd [11,12] and Au [13] based catalysts. For example, Mao and co-workers prepared a Pd@CNTs catalyst by confining Pd nanoparticles into the channels of CNTs. The as-prepared catalyst showed exceptional catalytic activity and selectivity in atmospheric hydrogenation of quinoline [14]. Although noble metal catalysts showed excellent activity in quinoline hydrogenation, the scarcity and high cost of such precious metals limited their practical applications. The development of cheap and earth abundant non-noble metal-based catalysts is of high importance for the selective hydrogenation of quinoline and its derivatives, as well as in many other applications [15]. Recently, Ni-based catalysts have been widely used in many catalytic transformations especially as catalyst in hydrogenation due to their reasonable price, availability and activity [16–20]. For example, Lv and co-workers designed a confined Ni/SiO2-AEH catalyst by an ammonia evaporation hydrothermal method and showed good activity in guaiacol hydrogenation [21]. However, the Ni metal nanoparticles constructed from high temperature pyrolysis often induce the metal aggregation and then lead to the reduction of metal dispersion and active sites, further affecting the performance of the catalyst [22–24]. At the meanwhile, the leaching of the active Ni during reaction also decreased the stability of the Ni based catalysts [25–27]. To prevent these drawbacks, several methods, such as promoter addition and in-situ generation of Ni nanoparticles, have been studied [28–30]. In addition, the design of hierarchical structure Ni-based catalyst is also an efficient way to improve the catalytic performance [31]. Nowadays, the synthesis of metal nanoparticles encapsulated inside hollow porous spheres (HPS) has received much attention because this kind of material has several advantages, such as a long life, high activity and stability in harsh reaction conditions [32]. Two general methods have been used for the loading of a metal into HPS. One is to synthesize the HPS first and then introduce the metal into the HPS. Another is to deposit the metal on the surface of template, cover the surface with corresponding shell and then remove the template, leaving the metal inside the HPS. Silica [33], titania [34], carbon [35] and alumina [36] have been synthesized as HPS and noble metal nanoparticles such as Pd [37], Rh [38], Au [36] and Ag [39] have been successfully encapsulated inside them. As expected, the obtained yolk-shell catalysts exhibited better activity than the traditional supported catalysts in corresponding reactions. In addition, Ni-based yolk-shell catalysts were also prepared as effective catalysts with superior ability to avoid Ni sintering and carbon resistance. For example, Lu et al. fabricated the Ni@HSS catalyst with the promotion of VOx, which exhibited high stability for the dry reforming of methane reaction [40]. However, few pieces of literature have reported the use of Ni-based yolk-shell catalyst in the hydrogenation of organic unsaturated compounds, and the effect of preparation method on their catalytic activity had not been studied. In our previous work, a core-shell Fe3O4@nSiO2@NiPd–PVP@mSiO2 catalyst was prepared and the highly-dispersed Ni particles sandwiched between two slilica shells displayed superb catalytic activity in cinnamic acid hydrogenation [41]. As a continuous work to develop high efficiency Ni-based catalysts based on the confinement effect [42]. A yolk-shell Ni@hw-mSiO2 catalyst was designed and prepared using nano carbon sphere as template and applied in quinoline hydrogenation. For comparison, Ni/hw-mSiO2 and Ni/mSiO2 prepared by an impregnation method were also used in this transformation. Interestingly, Ni@hw-mSiO2 showed not only better Ni dispersion, but also good catalytic stability in quinoline hydrogenation. Hence, a series of characterization were performed to demonstrate the effect of preparation method and support structure on the catalytic performance. Experimental Materials Unless otherwise stated, all reagents were analytical or technical grades purchased from Baoding Huaxin Reagent and Apparatus Co. Ltd and were used without further purification. Fumed silica (mSiO2) was obtained from Qingdao Haiyang Chemical Co. Ltd. Deionized water was used in all the experiments where water was used. The detailed fabrication process of Ni@hw-mSiO2 Synthesis of carbon spheres: carbon spheres were synthesized as templates by a hydrothermal method. First, 7.20 g glucose was dissolved in 80 mL water by sonication and then transferred to 100 mL Teflon-lined autoclave for heat treatment at 180 °C for 10 h under autogenous pressure. The obtained solid samples were washed several times with water, filtered and separated, and dried at 80 °C for 12 h to obtain carbon spheres. Synthesis of C@Ni: typically, carbon sphere (0.50 g) and Ni(NO3)2•6H2O (0.28 g) were dispersed and dissolved respectively in 50 mL water by sonication and then stirred for 20 min at 80 °C. A sodium hydroxide solution (1 mol L−1) was added to this solution until pH = 11 while stirring. The mixture was then stirred and refluxed at 80 °C for 5 h. After cooling, the product was the filtered and washed repeatedly using water. Synthesis of Ni@hw-mSiO2: 0.40 g C@Ni composites were dispersed in 80 mL water and sonicated for 20 min, denoted as solution A. At the meanwhile, 0.35 g cetyltrimethylammonium bromide (CTAB) was dissolved in 60 mL water and stirred at room temperature for 5 min. After the addition of 2.5 mL ammonia solution (1 mol•L−1), the obtained mixture was denoted as solution B. Solution B was added dropwise into solution A and stirred for another 30 min. Then, 0.6 mL tetraethyl orthosilicate (TEOS) was added drop by drop and stirred for 12 h. Finally, the resulting solid was filtered and calcined at 673 K for 4 h using a heating ramp of 2 K•min−1 in a muffle furnace and reduced at 723 K for 2 h under H2. As comparison, Ni/hw-mSiO2 and Ni/mSiO2 was prepared using hw-mSiO2 and the fumed silica (mSiO2) as support by an impregnation method. The hw-mSiO2 was prepared under the same procedure as Ni/hw-mSiO2 except the Ni deposition on carbon sphere. Catalyst activity test The performance of prepared catalyst was carried out in a 50 mL stainless steel autoclave equipped with a mechanical stirrer and an electric heating system. The catalyst (0.16 g), quinoline (1 mL) and ethanol (30 mL) were successively added into the reactor and the autoclave was filled with H2 three times followed by evacuation, pressurized with H2 to 2 MPa and heated to 100 °C for 2 h. When the reaction was completed, the reaction mixtures were analyzed by Agilent 7820 A gas chromatography and the structures of the products were identified by gas chromatography-mass spectroscopy (GC-MS) on a Thermofisher 1300+ISQ LT spectrometer. Catalyst characterization Ni content of the prepared catalysts was measured by the inductively coupled plasma microscopy (ICP) on an Agilent 7700 spectrometer. The Brunauer-Emmett-Teller (BET) surface area and pore volume were identified on a Micromeritics Tristar II 3020 apparatus surface area and pore analyzer. X-Ray diffraction (XRD) patterns were performed on a Bruker D8 diffractometer using a Cu Ka radiation source. Transmission electron microscopy (TEM) analysis was performed on a FEI Tecnai G2 F20 S-TWIN microscope. The samples were dispersed in ethanol by ultrasonication and loaded on a copper grid for analysis. The particle size distributions and the mean size of the catalysts are derived by measuring 100 randomly distributed Ni particles. Scanning electron microscopy (SEM) analysis was performed on a FEI Nova 600 instrument. Temperature-programmed reduction, H2-chemisorption and H2 temperature-programmed desorption were performed using a Micromeritics Autochem II 2920 instrument. The Ni dispersion was calculated based on the absorbed H2 volume. Thermogravimetric Analysis was performed on a NETZSCH STA449F3-QMS403D instrument under an air flow from 25–800 °C at a heating rate of 10 K min−1. Results and discussion The schematic sketch of the synthetic process of Ni@hw-mSiO2 is displayed in Fig. 1 a. Carbon spheres were made by a classical route and used as template for the preparation of Ni@hw-mSiO2. Ni nanoparticles were deposited on the surface of carbon spheres by using a co-precipitation method in aqueous solution. The coverage of C@Ni was performed with SiO2 using tetraethoxy orthosilicate (TEOS) as silica source. The Ni nanoparticles were sandwiched between carbon template and silica shell and anchored on the inner surface of hw-mSiO2. The confinement effect could make the Ni nanoparticles highly-dispersed and generate strong interaction with silica during calcination, which is benefit for the formation of small Ni particles. This synthetic method is believed to be environmental friendly and have good economics due to nonuse of large amounts of expensive organic solvents and surfactants. In addition, compared with the yolk-shell catalysts prepared by the impregnation method, this process also provides an efficient way to make the Ni species more dispersed on the inner surface of support. The calcination temperature of C@Ni@SiO2 precursor was determined by TGA characterization. As shown in Fig. S1, the thermal profile of C@Ni@SiO2 exhibited a two-step weight loss process with the first at a temperature below 110 °C corresponding to loss of the adsorbed water. The main weight loss occurred in the temperature range of 200–400 °C, which was corresponded to the decomposition of carbon sphere template in C@Ni@SiO2. The total weight loss of the second step was 64.9%, which was close to the weight percentage of carbon template in C@Ni@SiO2 (66.5 %), indicating the complete decomposition of carbon template. Therefore, 400 °C was selected as the calcination temperature because the carbon template could be completely removed after calcination. In addition, TGA result of Ni@hw-mSiO2 further indicated the totally removal of the carbon template, as no significant weight loss occurred when the temperature was higher than 100 °C. (Fig. S1). In order to study whether structure collapse occurred during calcination, the morphologies of different samples during preparation are displayed in Fig. 1b–e. The average diameter of the carbon spheres is 500 nm (Fig. 1b and c). As Ni@hw-mSiO2 were made with a prior step involving the deposition of Ni particles and silica coating. The C@Ni@SiO2, which made from the silica coating had a wall thickness of ca. 50 nm and the total diameter of this sample is about 590 nm (Fig. 1d). Following the removal of carbon template by heating at 400 °C in air, the resulting Ni@hw-mSiO2 took the shape of the template and had an average diameter of 300 nm. This phenomenon may attribute to the removal of carbon template and formation of cavity structure in Ni@hw-mSiO2, thus diminished the shape of obtained hollow sphere. In addition, the hollow structure could be observed in the obtained samples from the breakage of one special sphere (Fig. 1e). Therefore, it could be concluded that the structure collapse was not happened during calcination. TEM images together with particle size distributions of the Ni@hw-mSiO2, Ni/hw-mSiO2 and Ni/mSiO2 catalysts are shown in Fig. 2 . The hollow structure of Ni@hw-mSiO2 could be observed in panoramic picture (Fig. S2), which is in line with the SEM results. As can be seen from Fig. 2a, with the uniform distributed Ni particles, the size of the Ni particles in Ni@hw-mSiO2 were extraordinarily small than the other two catalysts. The encapsulated Ni nanoparticles are well dispersed inside the hollow silica spheres and no Ni nanoparticles are found on the outside of silica shell using this procedure. The particle size distribution histogram indicates that the Ni nanoparticles present a small and narrow distribution of size from 2.5 to 6.5 nm with average particle size of 4.4 nm. STEM analysis was also performed to further study the morphology of Ni@hw-mSiO2. It appears that Ni nanoparticles are inside the hollow silica spheres. The EDX elemental analysis and EDX line mapping of Ni@hw-mSiO2 shows the distribution of Ni, Si and O in the catalyst structure, with the core rich in Ni and the shell rich in Si and O, demonstrating the existence of the Ni nanoparticles inside the silica spheres (Fig. 3 ) [43]. Considering the Ni/hw-mSiO2 catalyst, it is clear that most of Ni nanoparticles were load inside the silica sphere support, while others aggregated on the outside of hw-mSiO2. Ni nanoparticles of Ni/hw-mSiO2 have a broad size distribution and the mean size is 6.4 nm (Fig. 2d). As for Ni/mSiO2, Ni nanoparticles distributed on the surface of support and the size distribution is more broad from 7 to 14 nm (Fig. 2 e and f). The average particle size is around 9 nm, which is generally larger than Ni@hw-mSiO2 and Ni/hw-mSiO2. The nitrogen adsorption-desorption isotherms of the three catalysts suggest that the silica shell had a pore structure of type I/IV, containing both micropores and mesopores (Fig. S3) [35]. This porosity was also proved by the pore size distribution plots, as the nitrogen desorption of pore diameter is major in the range of 2–50 nm, indicating the mesoporous structure is dominant in the three catalysts. Table 1 shows the specific surface area and pore volume values of Ni@hw-mSiO2, Ni/hw-mSiO2 and Ni/mSiO2. For comparison, the corresponding values of hw-mSiO2 and mSiO2 were also measured (not shown in Table 1). The hw-mSiO2 has a specific surface area of 829 m2 g−1 and pore volume of 0.47 cm3 g−1. In contrast, the same values of mSiO2 are 250 m2 g−1 and 0.27 cm3 g−1, respectively. These values for Ni/hw-mSiO2 and Ni/mSiO2 were both decreased due to the occupying of channels by the introduction of Ni nanoparticles. However, the surface area of Ni@hw-mSiO2 has a slightly increase to 873 m2 g−1 with an almost unchanged pore volume (0.46 cm3 g−1), implying that the encapsulated tiny Ni nanoparticles did not alter the porosity of the silica shell in Ni@hw-mSiO2 and the high dispersed Ni particles on the inner surface resulted the slightly increase of surface area. In addition, hydrogen plus chemisorption experimental data was also collected and shown in Table 1. Ni@hw-mSiO2 and Ni/hw-mSiO2 both showed higher values of H2-chemisorption and Ni dispersion than Ni/mSiO2, and Ni@hw-mSiO2 exhibited the largest values among the three catalysts. These results indicate that the structure and preparation method of Ni@hw-mSiO2 are more conductive to the dispersion of the active Ni species. The textural property of Ni@hw-mSiO2 can facilitate the diffusion of the reactants to the Ni active site surface in the cavity and avoid the loss of the Ni species during reaction [44]. The powder XRD patterns of the calcined and reduced catalysts are shown in Fig. 4 . As can be seen, all samples exhibit a broad diffraction peak at the range from 15 to 30 o, which can be attributed to the amorphous SiO2 [45]. All the three catalysts after calcination show the FCC-NiO phase (JCPDS No. 78–0429), with the typical reflection peaks at 2θ = 37.2, 43.3 and 62.9 °, attributed to the (111), (200) and (220) planes [46]. Fig. 4B displays the XRD spectra of the three catalysts after reduction, which show visible different peak patterns. The pattern of Ni/mSiO2 exhibits obvious peaks at 2θ = 44.3, 51.8 and 76.4 °, together with the disappearance of the peaks of NiO, indicating the full reduction of Ni in this sample [47]. In contrast, the peaks of the other two samples are much wider and smaller, suggesting that the crystal size of Ni should be smaller in them (especially for Ni@hw-mSiO2) [48]. Therefore, by considering the previous reports [42], the more dispersed Ni species in Ni@hw-mSiO2 may generate more strong interaction between metal and support, thus the agglomeration of Ni species is inhibited during reduction. The interaction between nickel and support is investigated by H2-TPR. As shown in Fig. 5 , Ni/mSiO2 presents one main reduction peak between 250 and 350 °C, which was caused by the reduction of the bulk NiO or NiO weakly interacted with the silica support [49]. At the meanwhile, Ni/hw-mSiO2 also shows an obvious reduction peak at 316 °C together with a shoulder reduction peak centered at 396 °C. As the higher reduction temperature illustrates the stronger metal support interaction [50], therefore, this result indicates the existence of a little amount Ni nanoparticles have stronger interaction with support in Ni/hw-mSiO2. In contrast, Ni@hw-mSiO2 shows distinct type of reduction peaks, as one main broad peak centered around 451 °C appeared in this sample, which is attributed to stronger interaction between NiO and the support. The strong metal support interaction could prevent the agglomeration of the small Ni nanoparticles during reduction, thus generate more active site for hydrogenation. Additionally, a lower reduction peak (278 °C) is also found in Ni@hw-mSiO2, which may be attributed to some small Ni nanoparticles have weaker interaction with support. In order to further study the interaction between Ni and support, XPS measurements were performed on the reduced Ni@hw-mSiO2, Ni/hw-mSiO2 and Ni/mSiO2. As shown in Fig. 6 , the Ni 2p3/2 presented two valence states. As previously reported, the binding energies of metallic Ni and NiO are around 852 and 855 eV [42]. Therefore, the peaks at about 852.6–852.9 eV could be attributed to metallic Ni and the peaks in the range of 855.2–856.1 eV demonstrated the presence of NiO in the three samples. The existence of NiO may be caused by the partly oxidation of metallic Ni during the sample transfer and settlement before XPS test. Notably, the binding energies of metallic and NiO in Ni@hw-mSiO2 were higher than that of Ni/mSiO2 and Ni/hw-mSiO2, indicating the stronger metal-support interaction in Ni@hw-mSiO2 [47]. Combined with TEM and TPR results, we can demonstrate that the more dispersed Ni nanoparticles in Ni@hw-mSiO2 could enhance the interaction between Ni and SiO2 support, which can effectively suppress the agglomeration and loss of active Ni, thus improve the hydrogenation performance of Ni@hw-mSiO2. Fig. S4 shows the H2-TPD profiles of Ni@hw-mSiO2, Ni/hw-mSiO2 and Ni/mSiO2, with all the profiles demonstrating two main desorption peaks. One is in the range of 50–200 °C and the other is in a higher rang of 300–450 °C. This indicates two types of hydrogenation active sites in these catalysts [51]. Compared with Ni/mSiO2, the integrated area of the low temperature peak in Ni@hw-mSiO2 and Ni/hw-mSiO2 decreased, while the high temperature peak increased. As previously reported, the low temperature desorption peak is related to the H2 desorption from free metal surface of weak hydrogenation sites, and the latter is related to the H2 desorption from the strong hydrogenation sites [52]. Therefore, it could be concluded that with the decrease in Ni particle size and increase in Ni dispersion, the amount of the relative weak hydrogenation sites decreased and that of strong hydrogenation sites increased in Ni@hw-mSiO2 and Ni/hw-mSiO2. Moreover, for Ni@hw-mSiO2, the high temperature peak is larger than that of Ni/hw-mSiO2, indicating more strong hydrogenation sites existed in this catalyst. The catalytic performance of the prepared catalysts was studied in the hydrogenation of quinoline, and the results are shown in Table 2 . As can be seen, the conversion of quinoline was 23.7% over Ni/mSiO2, indicating its low activity toward hydrogenation. However, the conversion of quinoline increased to 33.9% over Ni/hw-mSiO2, lower than our initial expectation for the introduction of hollow structure supports. In contrast, the conversion was 98.9% over Ni@hw-mSiO2, which can be attributed to the better dispersion of Ni nanoparticles in the silica cavity and the appropriate porous structure of silica shell. The conversion of quinoline versus metallic Ni active sites (calculated based on H2-chemisorption results) is shown in Fig. 7 . It is distinct that the quinoline conversion over the three catalysts increased with the increase of Ni active sites. This explained the varied activity of the three catalysts with similar Ni content on quinoline hydrogenation: higher Ni dispersion resulted in smaller Ni nanoparticles and more metallic Ni active sites in Ni@hw-mSiO2, thus led to higher hydrogenation activity of Ni@hw-mSiO2. Notably, the selectivity for 1–4-tetrahydroquinoline was all over 95% for these three catalysts. This may be due to the abundant –OH groups on the surface of SiO2, which are benefit for adsorption of quinoline by the hydrogen bonding between –OH and N atom in quinoline molecular [53]. In the stability tests of the three catalysts (Fig. 8 ), the conversion decreased obviously only after 4 cycles over Ni/mSiO2 and Ni/hw-mSiO2 with the lower initial activity, whereas Ni@hw-mSiO2 could maintain high activity after 6 cycles with the conversion of quinoline over 85%, indicating the better stability of Ni@hw-mSiO2. The XRD patterns of the used catalysts were basically consistent with the fresh samples, indicating there was no obvious change in diffraction of the main crystal phase and the oxidation of Ni was not happened during reaction (Fig. S5). In addition, the ICP results of the used Ni@hw-mSiO2 showed that the Ni loading only dropped from 12.37 to 12.07% after 6 cycles (Table S1). The slow rate of Ni loss may be one reason to explain the better stability of Ni@hw-mSiO2, which attributed to the stronger metal-support interaction and the confinement effect of mSiO2 cavity. The inconspicuous change in Ni content of fresh and used catalysts also indicated the heterogenous catalytic process in this work. Moreover, as shown in Table S2, Ni@hw-mSiO2 exhibited better catalytic performance than the most reported non-noble metal catalysts in the quinoline hydrogenation and even comparable to most reported noble metal catalysts, indicating the potential application of such kind of Ni-based catalyst. Conclusions In this work, a Ni-based catalyst with hollow silica spheres containing highly dispersed Ni nanoparticles on the inner surface (Ni@hw-SiO2) was synthesized and tested in the selective hydrogenation of quinoline. In comparison to Ni/mSiO2 and Ni/hw-mSiO2, the Ni@hw-mSiO2 catalyst showed excellent activity and stability, affording 98.9% quinoline conversion and 97.1% py-THQ selectivity under the selected reaction conditions. The unique preparation method was believed to be the decisive factor for its good catalytic performance. On the one hand, the existence of sandwiched structure during preparation promoted the dispersion of Ni nanoparticles on silica shell. After calcination, a strong interaction between Ni and support could be generated. On the other hand, owing to the strong metal-support interaction and hierarchical structure, the stability of the Ni species could be maintained during reaction. Therefore, the small Ni nanoparticles and strong metal-support interactions existed in Ni@hw-mSiO2 resulted in its better catalytic performance. This work provides a fundamental understanding on how to fabricate the active sites in yolk-shell structure material and then enhance the activity in corresponding reactions, which is referential for the rational design of efficient catalysts for utilization. CRediT authorship contribution statement Libo Niu: Writing – original draft, Supervision, Resources. Yadan An: Methodology, Investigation, Writing – original draft. Xiaowei Yang: Investigation. Gang Bian: Formal analysis, Writing – review & editing. Qi Wu: Formal analysis. Zhanghui Xia: Validation. Guoyi Bai: Conceptualization, Resources, Supervision, Writing – review & editing. Declaration of Competing Interest The authors declare that they have no known competing financial interests or personal relationships that could have appeared to influence the work reported in this paper. Acknowledgments Financial supports from the National Natural Science Foundation of China (22078080, 21676068), Natural Science Foundation of Hebei Province (B2019201341) and the Advanced Talents Incubation Program of Hebei University (050001/521000981226) are gratefully acknowledged Supplementary materials Supplementary material associated with this article can be found, in the online version, at doi:10.1016/j.mcat.2021.111855. Appendix Supplementary materials Image, application 1 Reference [1] Z. Wei F.J. Shao J. Wang Recent advances in heterogeneous catalytic hydrogenation and dehydrogenation of N-heterocycles Chinese J. Catal. 40 2019 980 1002 Z. Wei, F. J. Shao, J. Wang, Recent advances in heterogeneous catalytic hydrogenation and dehydrogenation of N-heterocycles, Chinese J. Catal.40 (2019) 980-1002. [2] Z.H. He N. Li K. Wang W.T. Wang Z.T. Liu Selective hydrogenation of quinolines over a CoCu bimetallic catalyst at low temperature Mol. Catal. 470 2019 120 126 Z. H. He, N. Li, K. Wang, W. T. Wang, Z. T. Liu, Selective hydrogenation of quinolines over a CoCu bimetallic catalyst at low temperature, Mol. Catal.470 (2019) 120-126. [3] C. Pérez-Zúñiga C. Negrete-Vergara V. Guerchais H.Le Bozec S.A. Moya P. Aguirre Hydrogenation of N-benzylideneaniline by palladium (II) catalysts with phosphorus-nitrogen ligands using formic acid as a renewable hydrogen source Mol. Catal. 462 2019 126 131 C. Pérez-Zúñiga, C. Negrete-Vergara, V. Guerchais, H. Le Bozec, S. A. Moya, P. Aguirre, Hydrogenation of N-benzylideneaniline by palladium (II) catalysts with phosphorus-nitrogen ligands using formic acid as a renewable hydrogen source, Mol. Catal.462 (2019) 126-131. [4] T. Wang L.G. Zhuo Z. Li F. Chen Z. Ding Y. He Q. Fan J. Xiang Z. Yu A. Chan Review of Aqueous Microwave Assisted Chemistry: Synthesis and Catalysis J. Am. Chem. Soc. 133 2011 9878 9891 T. Wang, L. G. Zhuo, Z. Li, F. Chen, Z. Ding, Y. He, Q. Fan, J. Xiang, Z. Yu, A. Chan, Review of Aqueous Microwave Assisted Chemistry: Synthesis and Catalysis, J. Am. Chem. Soc.133 (2011) 9878–9891. [5] L. Zhang R. Qiu X. Xue Y. Pan C. Xu H. Li L. Xu Versatile (Pentamethylcyclopentadienyl)rhodium-2,2′-Bipyridine (Cp*Rh-bpy) Catalyst for Transfer Hydrogenation of N-Heterocycles in Water Adv. Synth. Catal. 357 2015 3529 3537 L. Zhang, R. Qiu, X. Xue, Y. Pan, C. Xu, H. Li, L. Xu, Versatile (Pentamethylcyclopentadienyl)rhodium-2,2′-Bipyridine (Cp*Rh-bpy) Catalyst for Transfer Hydrogenation of N-Heterocycles in Water, Adv. Synth. Catal.357 (2015) 3529-3537. [6] X. Tu L.Z. Gong Highly Enantioselective Transfer Hydrogenation of Quinolines Catalyzed by Gold Phosphates: Achiral Ligand Tuning and Chiral-Anion Control of Stereoselectivity Angew. Chem. Int. Ed. 51 2012 11346 11349 X. Tu, L. Z. Gong, Highly Enantioselective Transfer Hydrogenation of Quinolines Catalyzed by Gold Phosphates: Achiral Ligand Tuning and Chiral-Anion Control of Stereoselectivity, Angew. Chem. Int. Ed.51 (2012) 11346-11349. [7] G.E. Dobereiner A. Nova N.D. Schley N. Hazari S.J. Miller O. Eisenstein R.H. Crabtree Iridium-Catalyzed Hydrogenation of N-Heterocyclic Compounds under Mild Conditions by an Outer-Sphere Pathway J. Am. Chem. Soc. 133 2011 7547 7562 G. E. Dobereiner, A. Nova, N. D. Schley, N. Hazari, S. J. Miller, O. Eisenstein, R. H. Crabtree, Iridium-Catalyzed Hydrogenation of N-Heterocyclic Compounds under Mild Conditions by an Outer-Sphere Pathway, J. Am. Chem. Soc.133 (2011) 7547-7562. [8] Z.H. He Y.C. Sun K. Wang Z.Y. Wang P.P. Guo C.S. Jiang M.Q. Yao Z.H. Li Z.T. Liu Reversible aerobic oxidative dehydrogenation/hydrogenation of N-heterocycles over AlN supported redox cobalt catalysts Mol. Catal. 496 2020 111192 Z. H. He, Y. C. Sun, K. Wang, Z. Y. Wang, P. P. Guo, C. S. Jiang, M. Q. Yao, Z. H. Li, Z. T. Liu, Reversible aerobic oxidative dehydrogenation/hydrogenation of N-heterocycles over AlN supported redox cobalt catalysts, Mol. Catal.496 (2020) 111192. [9] S. Zhang Z. Xia T. Ni Z. Zhang Y. Ma Y. Qu Strong electronic metal-support interaction of Pt/CeO2 enables efficient and selective hydrogenation of quinolines at room temperature J. Catal. 359 2018 101 111 S. Zhang, Z. Xia, T. Ni, Z. Zhang, Y. Ma, Y. Qu, Strong electronic metal-support interaction of Pt/CeO2 enables efficient and selective hydrogenation of quinolines at room temperature, J. Catal.359 (2018) 101-111. [10] X. Wang W. Chen L. Zhang T. Yao W. Liu Y. Lin H. Ju J.C. Dong L. Zheng W. Yan X. Zheng Z. Li X. Wang J. Yang D. He Y. Wang Z. Deng Y. Wu Y. Li Uncoordinated Amine Groups of Metal–Organic Frameworks to Anchor Single Ru Sites as Chemoselective Catalysts toward the Hydrogenation of Quinoline J. Am. Chem. Soc. 139 2017 9419 9422 X. Wang, W. Chen, L. Zhang, T. Yao, W. Liu, Y. Lin, H. Ju, J. C. Dong, L. Zheng, W. Yan, X. Zheng, Z. Li, X. Wang, J. Yang, D. He, Y. Wang, Z. Deng, Y. Wu. Y. Li, Uncoordinated Amine Groups of Metal–Organic Frameworks to Anchor Single Ru Sites as Chemoselective Catalysts toward the Hydrogenation of Quinoline, J. Am. Chem. Soc.139 (2017) 9419-9422. [11] M. Guo C. Li Q. Yang Accelerated catalytic activity of Pd NPs supported on amine-rich silica hollow nanospheres for quinoline hydrogenation Catal. Sci. Technol. 7 2017 2221 2227 M. Guo, C. Li, Q. Yang, Accelerated catalytic activity of Pd NPs supported on amine-rich silica hollow nanospheres for quinoline hydrogenation, Catal. Sci. Technol.7 (2017) 2221-2227. [12] F. Zhang C. Ma S. Chen J. Zhang Z. Lia X. Zhang N-doped hierarchical porous carbon anchored tiny Pd NPs: A mild and efficient quinolines selective hydrogenation catalyst Mol. Catal. 452 2018 145 153 F. Zhang, C. Ma, S. Chen, J. Zhang, Z. Lia, X. Zhang, N-doped hierarchical porous carbon anchored tiny Pd NPs: A mild and efficient quinolines selective hydrogenation catalyst, Mol. Catal.452 (2018) 145–153. [13] M. Yan T. Jin Q. Chen H. Ho T. Fujita L. Chen M. Bao M. Chen N. Asao Unsupported Nanoporous Gold Catalyst for Highly Selective Hydrogenation of Quinolines Y. Yamamoto, Org. Lett. 15 2013 1484 1487 M. Yan, T. Jin, Q. Chen, H. Ho, T. Fujita, L. Chen, M. Bao, M. Chen, N. Asao, Unsupported Nanoporous Gold Catalyst for Highly Selective Hydrogenation of Quinolines, Y. Yamamoto, Org. Lett.15 (2013) 1484-1487. [14] K. Li B. Hao M. Xiao Y. Kuang H. Shang J. Ma Y. Liao H. Mao Encapsulated metal catalyst for selective hydrogenation of quinoline under atmospheric conditions Appl. Surf. Sci. 478 2019 176 182 K. Li, B. Hao, M. Xiao, Y. Kuang, H. Shang, J. Ma, Y. Liao, H. Mao, Encapsulated metal catalyst for selective hydrogenation of quinoline under atmospheric conditions, Appl. Surf. Sci.478 (2019) 176-182. [15] Z. Wei Y. Chen J. Wang D. Su M. Tang S. Mao Y. Wang Cobalt Encapsulated in N-Doped Graphene Layers: An Efficient and Stable Catalyst for Hydrogenation of Quinoline Compounds ACS Catal 6 2016 5816 5822 Z. Wei, Y. Chen, J. Wang, D. Su, M. Tang, S. Mao, Y. Wang, Cobalt Encapsulated in N-Doped Graphene Layers: An Efficient and Stable Catalyst for Hydrogenation of Quinoline Compounds, ACS Catal. 6 (2016) 5816-5822. [16] L. Foppa T. Margossian S.M. Kim C. Müller C. Coperet K. Larmier A. Comas-Vives Contrasting the Role of Ni/Al2O3 Interfaces in Water–Gas Shift and Dry Reforming of Methane J. Am. Chem. Soc. 139 2017 17128 17139 L. Foppa, T. Margossian, S. M. Kim, C. Müller, C. Coperet, K. Larmier, A. Comas-Vives, Contrasting the Role of Ni/Al2O3 Interfaces in Water–Gas Shift and Dry Reforming of Methane, J. Am. Chem. Soc.139 (2017) 17128-17139. [17] C. Riley S. Zhou D. Kunwar A.D.L. Riva E. Peterson R. Payne L. Gao S. Lin H. Guo A. Datye Design of Effective Catalysts for Selective Alkyne Hydrogenation by Doping of Ceria with a Single-Atom Promotor J. Am. Chem. Soc. 140 2018 12964 12973 C. Riley, S. Zhou, D. Kunwar, A. D. L. Riva, E. Peterson, R. Payne, L. Gao, S. Lin, H. Guo, A. Datye, Design of Effective Catalysts for Selective Alkyne Hydrogenation by Doping of Ceria with a Single-Atom Promotor, J. Am. Chem. Soc.140 (2018) 12964-12973. [18] L. Ruan H. Zhang M. Zhou L. Zhu A. Pei J. Wang K. Yang C. Zhang S. Xiao B.H. Chen A highly selective and efficient Pd/Ni/Ni(OH)2/C catalyst for furfural hydrogenation at low temperatures Mol. Catal. 480 2020 110639 L. Ruan, H. Zhang, M. Zhou, L. Zhu, A. Pei, J. Wang, K. Yang, C. Zhang, S. Xiao, B. H. Chen, A highly selective and efficient Pd/Ni/Ni(OH)2/C catalyst for furfural hydrogenation at low temperatures, Mol. Catal.480 (2020) 110639. [19] N. Ji Z. Liu X. Diao J. Bao Z. Yu C. Song Q. Liu D. Ma X. Lu A novel Ni/AC catalyst prepared by MOCVD method for hydrogenation of ethyl levulinate to γ-valerolactone Mol. Catal. 495 2020 111155 N. Ji, Z. Liu, X. Diao, J. Bao, Z. Yu, C. Song, Q. Liu, D. Ma, X. Lu, A novel Ni/AC catalyst prepared by MOCVD method for hydrogenation of ethyl levulinate to γ-valerolactone, Mol. Catal.495 (2020) 111155. [20] T. Osawa M. Wakasugi T. Kizawa V. Borovkov Y. Inoue Enantio-differentiating hydrogenation of alkyl 3-oxobutanoates over tartaric acid-modified Ni catalyst: Enthalpy-entropy compensation effect as a tool for elucidating mechanistic features Mol. Catal. 449 2018 131 136 T. Osawa, M. Wakasugi, T. Kizawa, V. Borovkov, Y. Inoue, Enantio-differentiating hydrogenation of alkyl 3-oxobutanoates over tartaric acid-modified Ni catalyst: Enthalpy-entropy compensation effect as a tool for elucidating mechanistic features, Mol. Catal.449 (2018) 131–136. [21] X. Wang S. Zhu S. Wang J. Wang W. Fan Y. Lv Ni nanoparticles entrapped in nickel phyllosilicate for selective hydrogenation of guaiacol to 2-methoxycyclohexanol Appl. Catal. A Gen. 568 2018 231 241 X. Wang, S. Zhu, S. Wang, J. Wang, W. Fan, Y. Lv, Ni nanoparticles entrapped in nickel phyllosilicate for selective hydrogenation of guaiacol to 2-methoxycyclohexanol, Appl. Catal. A Gen.568 (2018) 231-241. [22] X. Li D. Li H. Tian L. Zeng Z. Zhao J. Gong Dry reforming of methane over Ni/La2O3 nanorod catalysts with stabilized Ni nanoparticles Appl. Catal. B Environ. 202 2017 683 694 X. Li, D. Li, H. Tian, L. Zeng, Z. Zhao, J. Gong, Dry reforming of methane over Ni/La2O3 nanorod catalysts with stabilized Ni nanoparticles, Appl. Catal. B Environ.202 (2017) 683-694. [23] Z. Wen Z. Li Q. Ge Y. Zhou J. Sun H. Abroshan G. Li Robust nickel cluster@Mes-HZSM-5 composite nanostructure with enhanced catalytic activity in the DTG reaction J. Catal. 363 2018 26 33 Z. Wen, Z. Li, Q. Ge, Y. Zhou, J. Sun, H. Abroshan, G. Li, Robust nickel cluster@Mes-HZSM-5 composite nanostructure with enhanced catalytic activity in the DTG reaction, J. Catal.363 (2018) 26-33. [24] E. Soghrati T.K.C. Ong C.K. Poh S. Kawi A. Borgna Zeolite–supported nickel phyllosilicate catalyst for Csingle bondO hydrogenolysis of cyclic ethers and polyols Appl. Catal. B Environ. 235 2018 130 142 E. Soghrati, T. K. C. Ong, C. K. Poh, S. Kawi, A. Borgna, Zeolite–supported nickel phyllosilicate catalyst for Csingle bondO hydrogenolysis of cyclic ethers and polyols, Appl. Catal. B Environ.235 (2018) 130-142. [25] H. Zhang X. Gao Y. Ma X. Han L. Niu G. Bai A highly dispersed and stable Ni/mSiO2-AE nanocatalyst for benzoic acid hydrogenation Catal. Sci. Technol. 7 2017 5993 5999 H. Zhang, X. Gao, Y. Ma, X. Han, L. Niu, G. Bai, A highly dispersed and stable Ni/mSiO2-AE nanocatalyst for benzoic acid hydrogenation, Catal. Sci. Technol.7 (2017) 5993–5999. [26] S. Nie J.Qin H.Li Y. Wang L. Niu L. Chen G. Bai An active and stable Ni/MMT-AE catalyst for dioctyl phthalate hydrogenation Mol. Catal. 495 2020 111156 S. Nie, H.Li, J. Qin, Y. Wang, L. Niu, L. Chen, G. Bai, An active and stable Ni/MMT-AE catalyst for dioctyl phthalate hydrogenation, Mol. Catal.495 (2020) 111156. [27] X. Qiao T. She H. Zhang X. Wen L. Niu L. Ricardez-Sandoval J. Li G. Bai One-pot synthesis of porous silica-supported ultrafine Ni nanoparticles as efficient and stable catalyst for selective hydrogenation of benzophenone Appl. Catal. B Environ. 259 2019 118111 X. Qiao, T. She, H. Zhang, X. Wen, L. Niu, L. Ricardez-Sandoval. J. Li, G. Bai, One-pot synthesis of porous silica-supported ultrafine Ni nanoparticles as efficient and stable catalyst for selective hydrogenation of benzophenone, Appl. Catal. B Environ.259 (2019) 118111. [28] H. Sun J. Wang J. Zhao B. Shen J. Shi J. Huang C. Wu Dual functional catalytic materials of Ni over Ce-modified CaO sorbents for integrated CO2 capture and conversion Appl. Catal. B Envrion. 244 2019 63 75 H. Sun, J. Wang, J. Zhao, B. Shen, J. Shi, J. Huang, C. Wu, Dual functional catalytic materials of Ni over Ce-modified CaO sorbents for integrated CO2 capture and conversion, Appl. Catal. B Envrion.244 (2019) 63-75. [29] M.V. Konishcheva D.I. Potemkin P.V. Snytnikov O.A. Stonkus V.D. Belyaev V.A. Sobyanin The insights into chlorine doping effect on performance of ceria supported nickel catalysts for selective CO methanation Appl. Catal. B Environ. 221 2018 413 421 M. V. Konishcheva, D. I. Potemkin, P. V. Snytnikov, O. A. Stonkus, V. D. Belyaev, V. A. Sobyanin, The insights into chlorine doping effect on performance of ceria supported nickel catalysts for selective CO methanation, Appl. Catal. B Environ.221 (2018) 413-421. [30] A.R. Richard M. Fan Low-Pressure Hydrogenation of CO2 to CH3OH Using Ni-In-Al/SiO2 Catalyst Synthesized via a Phyllosilicate Precursor ACS Catal 7 2017 5679 5692 A. R. Richard, M. Fan, Low-Pressure Hydrogenation of CO2 to CH3OH Using Ni-In-Al/SiO2 Catalyst Synthesized via a Phyllosilicate Precursor, ACS Catal. 7 (2017) 5679-5692. [31] J. Dong T. Zhu H. Li H. Sun Y. Wang L. Niu X. Wen G. Bai Biotemplate-Assisted Synthesis of Layered Double Oxides Confining Ultrafine Ni Nanoparticles as a Stable Catalyst for Phenol Hydrogenation Ind. Eng. Chem. Res. 58 2019 14688 14694 J. Dong, T. Zhu, H. Li, H. Sun, Y. Wang, L. Niu, X. Wen, G. Bai, Biotemplate-Assisted Synthesis of Layered Double Oxides Confining Ultrafine Ni Nanoparticles as a Stable Catalyst for Phenol Hydrogenation, Ind. Eng. Chem. Res.58 (2019) 14688-14694. [32] K. Li C. Yang H. Yu T. Xiao W. Guan P. Ding H. Yin M.A.C. Stuart J. Wang S. Zhou Coordination-Enhanced Synthesis for Hollow Mesoporous Silica Nanoreactors Chem. Mater. 32 2020 2086 2096 K. Li, C. Yang, H. Yu, T. Xiao, W. Guan, P. Ding, H. Yin, M. A. C. Stuart, J. Wang, S. Zhou, Coordination-Enhanced Synthesis for Hollow Mesoporous Silica Nanoreactors, Chem. Mater.32 (2020) 2086-2096. [33] X. Fang X. Zhao W. Fang C. Chen N. Zheng Self-templating synthesis of hollow mesoporous silica and their applications in catalysis and drug delivery Nanoscale 5 2013 2205 2218 X. Fang, X. Zhao, W. Fang, C. Chen, N. Zheng, Self-templating synthesis of hollow mesoporous silica and their applications in catalysis and drug delivery, Nanoscale5 (2013) 2205–2218. [34] X. Song L. Gao Synthesis, Characterization, and Optical Properties of Well-Defined N-Doped, Hollow Silica/Titania Hybrid Microspheres Langmuir 23 2007 11850 11856 X. Song, L. Gao, Synthesis, Characterization, and Optical Properties of Well-Defined N-Doped, Hollow Silica/Titania Hybrid Microspheres, Langmuir23 (2007) 11850–11856. [35] T.N. Phaahlamohlakka M.W. Dlamini D.O. Kumi R. Forbes L.L. Jewell N.J. Coville Co inside hollow carbon spheres as a Fischer-Tropsch catalyst: Spillover effects from Ru placed inside and outside the HCS Appl. Catal. A Gen. 599 2020 117617 T. N. Phaahlamohlakka, M. W. Dlamini, D. O. Kumi, R. Forbes, L. L. Jewell, N. J. Coville, Co inside hollow carbon spheres as a Fischer-Tropsch catalyst: Spillover effects from Ru placed inside and outside the HCS, Appl. Catal. A Gen.599 (2020) 117617. [36] J. Ma Z. Liu J. Song L. Zhong D. Xiao H. Xi X. Li R. Sun X. Peng Co inside hollow carbon spheres as a Fischer-Tropsch catalyst: Spillover effects from Ru placed inside and outside the HCS Green Chem 18 2016 1738 1745 J. Ma, Z. Liu, J. Song, L. Zhong, D. Xiao, H. Xi, X. Li, R. Sun, X. Peng, Co inside hollow carbon spheres as a Fischer-Tropsch catalyst: Spillover effects from Ru placed inside and outside the HCS, Green Chem. 18 (2016) 1738-1745. [37] Y. Kuwahara H. Kango H. Yamashita Pd Nanoparticles and Aminopolymers Confined in Hollow Silica Spheres as Efficient and Reusable Heterogeneous Catalysts for Semihydrogenation of Alkynes ACS Catal 9 2019 1993 2006 Y. Kuwahara, H. Kango, H. Yamashita, Pd Nanoparticles and Aminopolymers Confined in Hollow Silica Spheres as Efficient and Reusable Heterogeneous Catalysts for Semihydrogenation of Alkynes, ACS Catal. 9 (2019) 1993-2006. [38] P. Yan P. Tian K. Li M.A. Cohen Stuart J. Wang X. Yu S. Zhou Rh nanoclusters encaged in hollow mesoporous silica nanoreactors with enhanced catalytic performance for phenol selective hydrogenation Chem. Eng. J. 397 2020 125484 P. Yan, P. Tian, K. Li, M. A. Cohen Stuart, J. Wang, X. Yu, S. Zhou, Rh nanoclusters encaged in hollow mesoporous silica nanoreactors with enhanced catalytic performance for phenol selective hydrogenation, Chem. Eng. J.397 (2020) 125484. [39] G. Yang Y. Kuwahara K. Mori C. Louis H. Yamashita PdAg alloy nanoparticles encapsulated in N-doped microporous hollow carbon spheres for hydrogenation of CO2 to formate Appl. Catal. B Environ. 283 2021 119628 G. Yang, Y. Kuwahara, K. Mori, C. Louis, H. Yamashita, PdAg alloy nanoparticles encapsulated in N-doped microporous hollow carbon spheres for hydrogenation of CO2 to formate, Appl. Catal. B Environ.283 (2021) 119628. [40] Y. Lu D. Guo Y. Zhao P.S. Moyo Y. Zhao S. Wang X. Ma Enhanced catalytic performance of Nix-V@HSS catalysts for the DRM reaction: The study of interfacial effects on Ni-VOx structure with a unique yolk-shell structure J. Catal. 396 2021 65 80 Y. Lu, D. Guo, Y. Zhao, P. S. Moyo, Y. Zhao, S. Wang, X. Ma, Enhanced catalytic performance of Nix-V@HSS catalysts for the DRM reaction: The study of interfacial effects on Ni-VOx structure with a unique yolk-shell structure, J. Catal.396 (2021) 65-80. [41] W. Feng H. Dong L. Niu X. Wen L. Huo G. Bai A novel Fe3O4@nSiO2@NiPd–PVP@mSiO2 multi-shell core–shell nanocomposite for cinnamic acid hydrogenation in water J. Mater. Chem. A 3 2015 19807 19814 W. Feng, H. Dong, L. Niu, X. Wen, L. Huo, G. Bai, A novel Fe3O4@nSiO2@NiPd–PVP@mSiO2 multi-shell core–shell nanocomposite for cinnamic acid hydrogenation in water, J. Mater. Chem. A3 (2015) 19807-19814. [42] X. Yang L. Niu Z. Xia X. Yan G. Bai Preparation of Ni/mSiO2 with the existence of hydrogelator: Insight into hydrogelator self-assembly on metal dispersion and catalytic performance in quinoline hydrogenation Mol. Catal. 493 2020 111094 X. Yang, L. Niu, Z. Xia, X. Yan, G. Bai, Preparation of Ni/mSiO2 with the existence of hydrogelator: Insight into hydrogelator self-assembly on metal dispersion and catalytic performance in quinoline hydrogenation, Mol. Catal.493 (2020) 111094. [43] Y. Lu D. Guo Y. Ruan Y. Zhao S. Wang X. Ma Facile one-pot synthesis of Ni@HSS as a novel yolk-shell structure catalyst for dry reforming of methane J. CO2 Util. 24 2018 190 199 Y. Lu, D. Guo, Y. Ruan, Y. Zhao, S. Wang, X. Ma, Facile one-pot synthesis of Ni@HSS as a novel yolk-shell structure catalyst for dry reforming of methane, J. CO2 Util.24 (2018) 190-199. [44] W. Yang M. Chen J. Zhou Y. Duan Y. An M. Liu M. Tian Preparation and evaluation of highly dispersed HHSS supported Cu-Fe bimetallic catalysts for higher alcohols synthesis from syngas Appl. Catal. A Gen. 608 2020 117868 W. Yang, M. Chen, J. Zhou, Y. Duan, Y. An, M. Liu, M. Tian, Preparation and evaluation of highly dispersed HHSS supported Cu-Fe bimetallic catalysts for higher alcohols synthesis from syngas, Appl. Catal. A Gen.608 (2020) 117868. [45] Y. Zhao S. Li Y. Wang B. Shan J. Zhang S. Wang X. Ma Efficient tuning of surface copper species of Cu/SiO2 catalyst for hydrogenation of dimethyl oxalate to ethylene glycol Chem. Eng. J. 313 2017 759 768 Y. Zhao, S. Li, Y. Wang, B. Shan, J. Zhang, S. Wang, X. Ma, Efficient tuning of surface copper species of Cu/SiO2 catalyst for hydrogenation of dimethyl oxalate to ethylene glycol, Chem. Eng. J.313 (2017) 759–768. [46] J. Dong X. Wen T. Zhu J. Qin Z. Wu L. Chen G. Bai Hierarchically nanostructured bimetallic NiCo/MgxNiyO catalyst with enhanced activity for phenol hydrogenation Mol. Catal. 485 2020 110846 J. Dong, X. Wen, T. Zhu, J. Qin, Z. Wu, L. Chen, G. Bai, Hierarchically nanostructured bimetallic NiCo/MgxNiyO catalyst with enhanced activity for phenol hydrogenation, Mol. Catal.485 (2020) 110846. [47] J. Qin H. Zhang H. Sun Y. Wang L. Niu X. Lan G. Bai In situ fabrication of nickel-based layered double hydroxides catalysts with carboxymethyl chitosan as biomass template for hydrogenation Mol. Catal. 478 2019 110561 J. Qin, H. Zhang, H. Sun, Y. Wang, L. Niu, X. Lan, G. Bai, In situ fabrication of nickel-based layered double hydroxides catalysts with carboxymethyl chitosan as biomass template for hydrogenation, Mol. Catal.478 (2019) 110561. [48] C.S. Budi D. Saikia C.S. Chen H.M. Kao Catalytic evaluation of tunable Ni nanoparticles embedded in organic functionalized 2D and 3D ordered mesoporous silicas from the hydrogenation of nitroarenes J. Catal. 370 2019 274 288 C. S. Budi, D. Saikia, C. S. Chen, H. M. Kao, Catalytic evaluation of tunable Ni nanoparticles embedded in organic functionalized 2D and 3D ordered mesoporous silicas from the hydrogenation of nitroarenes, J. Catal.370 (2019) 274–288. [49] H. Zhang J. Dong X. Qiao J. Qin H. Sun A. Wang L. Niu G. Bai In-situ generated highly dispersed nickel nanoclusters confined in MgAl mixed metal oxide platelets for benzoic acid hydrogenation J. Catal. 372 2019 258 265 H. Zhang, J. Dong, X. Qiao, J. Qin, H. Sun, A. Wang, L. Niu, G. Bai, In-situ generated highly dispersed nickel nanoclusters confined in MgAl mixed metal oxide platelets for benzoic acid hydrogenation, J. Catal.372 (2019) 258-265. [50] J. He X. Lu Y. Shen R. Jing R. Nie D. Zhou Q. Xia Highly selective hydrogenation of phenol to cyclohexanol over nano silica supported Ni catalysts in aqueous medium Mol. Catal. 440 2017 87 95 J. He, X. Lu, Y. Shen, R. Jing, R. Nie, D. Zhou, Q. Xia, Highly selective hydrogenation of phenol to cyclohexanol over nano silica supported Ni catalysts in aqueous medium, Mol. Catal.440 (2017) 87–95. [51] H. Ye W. Na W. Gao H. Wang Carbon-Modified CuO/ZnO Catalyst with High Oxygen Vacancy for CO2 Hydrogenation to Methanol Energy Technol. 8 2020 2000194 H. Ye, W. Na, W. Gao, H. Wang, Carbon-Modified CuO/ZnO Catalyst with High Oxygen Vacancy for CO2 Hydrogenation to Methanol, Energy Technol.8 (2020) 2000194 [52] S. Hu Y. Chen Partial Hydrogenation of Benzene on Ru−Zn/SiO2 Catalysts Ind. Eng. Chem. Res. 40 2001 6099 6104 S. Hu, Y. Chen, Partial Hydrogenation of Benzene on Ru−Zn/SiO2 Catalysts, Ind. Eng. Chem. Res.40 (2001) 6099-6104. [53] L. Zhang X. Wang Y. Xue X. Zeng H. Chen R. Li S. Wang Cooperation between the surface hydroxyl groups of Ru–SiO2@mSiO2 and water for good catalytic performance for hydrogenation of quinoline Catal. Sci. Technol. 4 2014 1939 1948 L. Zhang, X. Wang, Y. Xue, X. Zeng, H. Chen, R. Li, S. Wang, Cooperation between the surface hydroxyl groups of Ru–SiO2@mSiO2 and water for good catalytic performance for hydrogenation of quinoline, Catal. Sci. Technol.4 (2014) 1939-1948.",
      "scopus-id": "85114675849",
      "coredata": {
        "eid": "1-s2.0-S2468823121004727",
        "dc:description": "With the aim of studying the effect of support structure and preparation method on the hydrogenation performance of Ni-based catalysts. Hollow mesoporous silica spheres (hw-mSiO2) containing tiny Ni nanoparticles highly dispersed on the inner surface (Ni@hw-mSiO2) were synthesized by using carbon sphere as template with four continuous procedures, containing Ni deposition, silica shell coating, calcination and reduction. As demonstrated by SEM and TEM, the hollow structure was successfully obtained after calcination and the active Ni species was highly dispersed inside the porous silica shell, which is much smaller than the Ni-based catalysts prepared by a conventional impregnation method using hw-mSiO2 (Ni/hw-mSiO2) or commercial SiO2 (Ni/mSiO2) as supports. TPR and H2-chemisorption results revealed the existence of strong metal-interaction and more hydrogenation sites in Ni@hw-mSiO2. Therefore, Ni@hw-mSiO2 catalyst achieved an excellent catalytic activity and stability in the selective hydrogenation of quinoline into 1–4-tetrahydroquinoline (py-THQ), due to the more dispersed Ni species, strong metal-support interaction and confinement effect of porous silica shell.",
        "openArchiveArticle": "false",
        "prism:coverDate": "2021-09-30",
        "openaccessUserLicense": null,
        "prism:aggregationType": "Journal",
        "prism:url": "https://api.elsevier.com/content/article/pii/S2468823121004727",
        "dc:creator": [
          {
            "@_fa": "true",
            "$": "Niu, Libo"
          },
          {
            "@_fa": "true",
            "$": "An, Yadan"
          },
          {
            "@_fa": "true",
            "$": "Yang, Xiaowei"
          },
          {
            "@_fa": "true",
            "$": "Bian, Gang"
          },
          {
            "@_fa": "true",
            "$": "Wu, Qi"
          },
          {
            "@_fa": "true",
            "$": "Xia, Zhanghui"
          },
          {
            "@_fa": "true",
            "$": "Bai, Guoyi"
          }
        ],
        "link": [
          {
            "@_fa": "true",
            "@rel": "self",
            "@href": "https://api.elsevier.com/content/article/pii/S2468823121004727"
          },
          {
            "@_fa": "true",
            "@rel": "scidir",
            "@href": "https://www.sciencedirect.com/science/article/pii/S2468823121004727"
          }
        ],
        "dc:format": "application/json",
        "openaccessType": null,
        "pii": "S2468-8231(21)00472-7",
        "prism:volume": "514",
        "articleNumber": "111855",
        "prism:publisher": "Elsevier B.V.",
        "dc:title": "Highly dispersed Ni nanoparticles encapsulated in hollow mesoporous silica spheres as an efficient catalyst for quinoline hydrogenation",
        "prism:copyright": "© 2021 Elsevier B.V. All rights reserved.",
        "openaccess": "0",
        "prism:issn": "24688231",
        "dcterms:subject": [
          {
            "@_fa": "true",
            "$": "Quinoline hydrogenation"
          },
          {
            "@_fa": "true",
            "$": "Hollow silica sphere"
          },
          {
            "@_fa": "true",
            "$": "Ni dispersion"
          },
          {
            "@_fa": "true",
            "$": "Confinement effect"
          },
          {
            "@_fa": "true",
            "$": "Stability"
          }
        ],
        "openaccessArticle": "false",
        "prism:publicationName": "Molecular Catalysis",
        "openaccessSponsorType": null,
        "prism:pageRange": "111855",
        "pubType": "fla",
        "prism:coverDisplayDate": "September 2021",
        "prism:doi": "10.1016/j.mcat.2021.111855",
        "prism:startingPage": "111855",
        "dc:identifier": "doi:10.1016/j.mcat.2021.111855",
        "openaccessSponsorName": null
      },
      "objects": {
        "object": [
          {
            "@category": "standard",
            "@height": "464",
            "@width": "678",
            "@_fa": "true",
            "$": "https://api.elsevier.com/content/object/eid/1-s2.0-S2468823121004727-gr8.jpg?httpAccept=%2A%2F%2A",
            "@multimediatype": "JPEG image file",
            "@type": "IMAGE-DOWNSAMPLED",
            "@size": "82237",
            "@ref": "gr8",
            "@mimetype": "image/jpeg"
          },
          {
            "@category": "standard",
            "@height": "355",
            "@width": "527",
            "@_fa": "true",
            "$": "https://api.elsevier.com/content/object/eid/1-s2.0-S2468823121004727-gr7.jpg?httpAccept=%2A%2F%2A",
            "@multimediatype": "JPEG image file",
            "@type": "IMAGE-DOWNSAMPLED",
            "@size": "37710",
            "@ref": "gr7",
            "@mimetype": "image/jpeg"
          },
          {
            "@category": "standard",
            "@height": "585",
            "@width": "565",
            "@_fa": "true",
            "$": "https://api.elsevier.com/content/object/eid/1-s2.0-S2468823121004727-gr2.jpg?httpAccept=%2A%2F%2A",
            "@multimediatype": "JPEG image file",
            "@type": "IMAGE-DOWNSAMPLED",
            "@size": "113151",
            "@ref": "gr2",
            "@mimetype": "image/jpeg"
          },
          {
            "@category": "standard",
            "@height": "200",
            "@width": "231",
            "@_fa": "true",
            "$": "https://api.elsevier.com/content/object/eid/1-s2.0-S2468823121004727-ga1.jpg?httpAccept=%2A%2F%2A",
            "@multimediatype": "JPEG image file",
            "@type": "IMAGE-DOWNSAMPLED",
            "@size": "20308",
            "@ref": "ga1",
            "@mimetype": "image/jpeg"
          },
          {
            "@category": "standard",
            "@height": "673",
            "@width": "659",
            "@_fa": "true",
            "$": "https://api.elsevier.com/content/object/eid/1-s2.0-S2468823121004727-gr1.jpg?httpAccept=%2A%2F%2A",
            "@multimediatype": "JPEG image file",
            "@type": "IMAGE-DOWNSAMPLED",
            "@size": "98569",
            "@ref": "gr1",
            "@mimetype": "image/jpeg"
          },
          {
            "@category": "standard",
            "@height": "377",
            "@width": "527",
            "@_fa": "true",
            "$": "https://api.elsevier.com/content/object/eid/1-s2.0-S2468823121004727-gr6.jpg?httpAccept=%2A%2F%2A",
            "@multimediatype": "JPEG image file",
            "@type": "IMAGE-DOWNSAMPLED",
            "@size": "62363",
            "@ref": "gr6",
            "@mimetype": "image/jpeg"
          },
          {
            "@category": "standard",
            "@height": "398",
            "@width": "527",
            "@_fa": "true",
            "$": "https://api.elsevier.com/content/object/eid/1-s2.0-S2468823121004727-gr5.jpg?httpAccept=%2A%2F%2A",
            "@multimediatype": "JPEG image file",
            "@type": "IMAGE-DOWNSAMPLED",
            "@size": "41727",
            "@ref": "gr5",
            "@mimetype": "image/jpeg"
          },
          {
            "@category": "standard",
            "@height": "261",
            "@width": "677",
            "@_fa": "true",
            "$": "https://api.elsevier.com/content/object/eid/1-s2.0-S2468823121004727-gr4.jpg?httpAccept=%2A%2F%2A",
            "@multimediatype": "JPEG image file",
            "@type": "IMAGE-DOWNSAMPLED",
            "@size": "65654",
            "@ref": "gr4",
            "@mimetype": "image/jpeg"
          },
          {
            "@category": "standard",
            "@height": "485",
            "@width": "678",
            "@_fa": "true",
            "$": "https://api.elsevier.com/content/object/eid/1-s2.0-S2468823121004727-gr3.jpg?httpAccept=%2A%2F%2A",
            "@multimediatype": "JPEG image file",
            "@type": "IMAGE-DOWNSAMPLED",
            "@size": "126167",
            "@ref": "gr3",
            "@mimetype": "image/jpeg"
          },
          {
            "@category": "thumbnail",
            "@height": "150",
            "@width": "219",
            "@_fa": "true",
            "$": "https://api.elsevier.com/content/object/eid/1-s2.0-S2468823121004727-gr8.sml?httpAccept=%2A%2F%2A",
            "@multimediatype": "GIF image file",
            "@type": "IMAGE-THUMBNAIL",
            "@size": "15170",
            "@ref": "gr8",
            "@mimetype": "image/gif"
          },
          {
            "@category": "thumbnail",
            "@height": "148",
            "@width": "219",
            "@_fa": "true",
            "$": "https://api.elsevier.com/content/object/eid/1-s2.0-S2468823121004727-gr7.sml?httpAccept=%2A%2F%2A",
            "@multimediatype": "GIF image file",
            "@type": "IMAGE-THUMBNAIL",
            "@size": "9394",
            "@ref": "gr7",
            "@mimetype": "image/gif"
          },
          {
            "@category": "thumbnail",
            "@height": "164",
            "@width": "158",
            "@_fa": "true",
            "$": "https://api.elsevier.com/content/object/eid/1-s2.0-S2468823121004727-gr2.sml?httpAccept=%2A%2F%2A",
            "@multimediatype": "GIF image file",
            "@type": "IMAGE-THUMBNAIL",
            "@size": "14959",
            "@ref": "gr2",
            "@mimetype": "image/gif"
          },
          {
            "@category": "thumbnail",
            "@height": "164",
            "@width": "189",
            "@_fa": "true",
            "$": "https://api.elsevier.com/content/object/eid/1-s2.0-S2468823121004727-ga1.sml?httpAccept=%2A%2F%2A",
            "@multimediatype": "GIF image file",
            "@type": "IMAGE-THUMBNAIL",
            "@size": "24598",
            "@ref": "ga1",
            "@mimetype": "image/gif"
          },
          {
            "@category": "thumbnail",
            "@height": "163",
            "@width": "160",
            "@_fa": "true",
            "$": "https://api.elsevier.com/content/object/eid/1-s2.0-S2468823121004727-gr1.sml?httpAccept=%2A%2F%2A",
            "@multimediatype": "GIF image file",
            "@type": "IMAGE-THUMBNAIL",
            "@size": "17944",
            "@ref": "gr1",
            "@mimetype": "image/gif"
          },
          {
            "@category": "thumbnail",
            "@height": "157",
            "@width": "219",
            "@_fa": "true",
            "$": "https://api.elsevier.com/content/object/eid/1-s2.0-S2468823121004727-gr6.sml?httpAccept=%2A%2F%2A",
            "@multimediatype": "GIF image file",
            "@type": "IMAGE-THUMBNAIL",
            "@size": "12964",
            "@ref": "gr6",
            "@mimetype": "image/gif"
          },
          {
            "@category": "thumbnail",
            "@height": "164",
            "@width": "217",
            "@_fa": "true",
            "$": "https://api.elsevier.com/content/object/eid/1-s2.0-S2468823121004727-gr5.sml?httpAccept=%2A%2F%2A",
            "@multimediatype": "GIF image file",
            "@type": "IMAGE-THUMBNAIL",
            "@size": "9570",
            "@ref": "gr5",
            "@mimetype": "image/gif"
          },
          {
            "@category": "thumbnail",
            "@height": "84",
            "@width": "219",
            "@_fa": "true",
            "$": "https://api.elsevier.com/content/object/eid/1-s2.0-S2468823121004727-gr4.sml?httpAccept=%2A%2F%2A",
            "@multimediatype": "GIF image file",
            "@type": "IMAGE-THUMBNAIL",
            "@size": "9256",
            "@ref": "gr4",
            "@mimetype": "image/gif"
          },
          {
            "@category": "thumbnail",
            "@height": "157",
            "@width": "219",
            "@_fa": "true",
            "$": "https://api.elsevier.com/content/object/eid/1-s2.0-S2468823121004727-gr3.sml?httpAccept=%2A%2F%2A",
            "@multimediatype": "GIF image file",
            "@type": "IMAGE-THUMBNAIL",
            "@size": "27113",
            "@ref": "gr3",
            "@mimetype": "image/gif"
          },
          {
            "@category": "high",
            "@height": "2055",
            "@width": "3000",
            "@_fa": "true",
            "$": "https://api.elsevier.com/content/object/eid/1-s2.0-S2468823121004727-gr8_lrg.jpg?httpAccept=%2A%2F%2A",
            "@multimediatype": "JPEG image file",
            "@type": "IMAGE-HIGH-RES",
            "@size": "817924",
            "@ref": "gr8",
            "@mimetype": "image/jpeg"
          },
          {
            "@category": "high",
            "@height": "1573",
            "@width": "2333",
            "@_fa": "true",
            "$": "https://api.elsevier.com/content/object/eid/1-s2.0-S2468823121004727-gr7_lrg.jpg?httpAccept=%2A%2F%2A",
            "@multimediatype": "JPEG image file",
            "@type": "IMAGE-HIGH-RES",
            "@size": "276175",
            "@ref": "gr7",
            "@mimetype": "image/jpeg"
          },
          {
            "@category": "high",
            "@height": "2589",
            "@width": "2500",
            "@_fa": "true",
            "$": "https://api.elsevier.com/content/object/eid/1-s2.0-S2468823121004727-gr2_lrg.jpg?httpAccept=%2A%2F%2A",
            "@multimediatype": "JPEG image file",
            "@type": "IMAGE-HIGH-RES",
            "@size": "1255111",
            "@ref": "gr2",
            "@mimetype": "image/jpeg"
          },
          {
            "@category": "high",
            "@height": "886",
            "@width": "1024",
            "@_fa": "true",
            "$": "https://api.elsevier.com/content/object/eid/1-s2.0-S2468823121004727-ga1_lrg.jpg?httpAccept=%2A%2F%2A",
            "@multimediatype": "JPEG image file",
            "@type": "IMAGE-HIGH-RES",
            "@size": "153068",
            "@ref": "ga1",
            "@mimetype": "image/jpeg"
          },
          {
            "@category": "high",
            "@height": "2980",
            "@width": "2917",
            "@_fa": "true",
            "$": "https://api.elsevier.com/content/object/eid/1-s2.0-S2468823121004727-gr1_lrg.jpg?httpAccept=%2A%2F%2A",
            "@multimediatype": "JPEG image file",
            "@type": "IMAGE-HIGH-RES",
            "@size": "855104",
            "@ref": "gr1",
            "@mimetype": "image/jpeg"
          },
          {
            "@category": "high",
            "@height": "1669",
            "@width": "2334",
            "@_fa": "true",
            "$": "https://api.elsevier.com/content/object/eid/1-s2.0-S2468823121004727-gr6_lrg.jpg?httpAccept=%2A%2F%2A",
            "@multimediatype": "JPEG image file",
            "@type": "IMAGE-HIGH-RES",
            "@size": "499670",
            "@ref": "gr6",
            "@mimetype": "image/jpeg"
          },
          {
            "@category": "high",
            "@height": "1763",
            "@width": "2333",
            "@_fa": "true",
            "$": "https://api.elsevier.com/content/object/eid/1-s2.0-S2468823121004727-gr5_lrg.jpg?httpAccept=%2A%2F%2A",
            "@multimediatype": "JPEG image file",
            "@type": "IMAGE-HIGH-RES",
            "@size": "316475",
            "@ref": "gr5",
            "@mimetype": "image/jpeg"
          },
          {
            "@category": "high",
            "@height": "1154",
            "@width": "2999",
            "@_fa": "true",
            "$": "https://api.elsevier.com/content/object/eid/1-s2.0-S2468823121004727-gr4_lrg.jpg?httpAccept=%2A%2F%2A",
            "@multimediatype": "JPEG image file",
            "@type": "IMAGE-HIGH-RES",
            "@size": "461411",
            "@ref": "gr4",
            "@mimetype": "image/jpeg"
          },
          {
            "@category": "high",
            "@height": "2147",
            "@width": "3000",
            "@_fa": "true",
            "$": "https://api.elsevier.com/content/object/eid/1-s2.0-S2468823121004727-gr3_lrg.jpg?httpAccept=%2A%2F%2A",
            "@multimediatype": "JPEG image file",
            "@type": "IMAGE-HIGH-RES",
            "@size": "1190660",
            "@ref": "gr3",
            "@mimetype": "image/jpeg"
          },
          {
            "@category": "standard",
            "@_fa": "true",
            "$": "https://api.elsevier.com/content/object/eid/1-s2.0-S2468823121004727-mmc1.doc?httpAccept=%2A%2F%2A",
            "@multimediatype": "Microsoft Word file",
            "@type": "APPLICATION",
            "@size": "2166272",
            "@ref": "mmc1",
            "@mimetype": "application/word"
          },
          {
            "@category": "standard",
            "@_fa": "true",
            "$": "https://api.elsevier.com/content/object/eid/1-s2.0-S2468823121004727-am.pdf?httpAccept=%2A%2F%2A",
            "@multimediatype": "Acrobat PDF file",
            "@type": "AAM-PDF",
            "@size": "4549124",
            "@ref": "am",
            "@mimetype": "application/pdf"
          }
        ]
      },
      "link": {
        "@rel": "abstract",
        "@href": "https://api.elsevier.com/content/abstract/scopus_id/85114675849"
      }
    }
  }
}