{
  "metadata": {
    "title": "The water assisted vinylene mechanism for cobalt Fischer-Tropsch synthesis assessed by multi-catalyst modelling of kinetics and deactivation",
    "authors": "; ; ",
    "journal": "Molecular Catalysis",
    "date": "2022-09-30",
    "doi": "10.1016/j.mcat.2022.112489",
    "abstract": "",
    "uri": "https://api.elsevier.com/content/article/pii/S2468823122003753",
    "pii": "S2468823122003753"
  },
  "fulltext": {
    "full-text-retrieval-response": {
      "scopus-eid": "2-s2.0-85136647093",
      "originalText": "serial JL 315758 291210 291744 291790 291809 31 90 Molecular Catalysis MOLECULARCATALYSIS 2022-08-29 2022-08-29 2022-08-29 2022-08-29 2023-05-22T03:39:53 1-s2.0-S2468823122003753 S2468-8231(22)00375-3 S2468823122003753 10.1016/j.mcat.2022.112489 S300 S300.2 FULL-TEXT 1-s2.0-S2468823122X00138 2024-06-26T17:47:42.372199Z 0 0 20220901 20220930 2022 2022-08-29T16:58:19.872288Z absattachment articleinfo articlenumber articletitlenorm authfirstinitialnorm authfirstsurnamenorm cid cids contenttype copyright crossmark dateloaded dateloadedtxt datesearch datesort dateupdated dco docsubtype doctype doi eid ewtransactionid fundingbodyid hubeid indexeddate issn issnnorm itemstage itemtransactionid itemweight oauserlicense openaccess openarchive pg pgfirst pii piinorm pubdateend pubdatestart pubdatetxt pubyr sectiontitle sortorder sponsoredaccesstype srctitle srctitlenorm srctype ssids alllist content oa subj subheadings suppl tomb volfirst volissue volumelist webpdf webpdfpagecount yearnav figure table body mmlmath acknowledge affil articletitle auth authfirstini authfull authkeywords authlast footnotes highlightsabst primabst ref specialabst 2468-8231 24688231 UNLIMITED UNIT2022 true 530 530 C Volume 530 44 112489 112489 112489 202209 September 2022 2022-09-01 2022-09-30 2022 Regular Papers article fla © 2022 The Author(s). Published by Elsevier B.V. WATERASSISTEDVINYLENEMECHANISMFORCOBALTFISCHERTROPSCHSYNTHESISASSESSEDBYMULTICATALYSTMODELLINGKINETICSDEACTIVATION RYTTER E 1 Introduction 2 Experimental 2.1 Catalyst preparation 2.2 Catalyst characterization 2.3 Fixed-bed catalyst testing 3 Mechanistic framework 3.1 The water assisted vinylene mechanism 3.2 Chain propagation probability 3.3 Formation of methane 4 Kinetic modelling 4.1 Fischer-Tropsch reactions 4.2 Deactivation 5 Results and discussion 5.1 Activity response 5.2 Deactivation 5.3 Selectivity 5.4 Parameter estimation 6 Conclusions Justification for publication CRediT authorship contribution statement Acknowledgements References RYTTER 2017 5321 5328 E RYTTER 2018 334 343 E RYTTER 2019 13 24 E STORSAETER 2005 343 347 S JACOBS 2003 335 343 G SCHANKE 1995 269 284 D BLEKKAN 2007 13 32 E CATALYSIS SYNTHESISCOBALTCATALYSTSEFFECTWATER TSAKOUMIS 2019 511 520 N KRISHNAMOORTHY 2002 422 433 S ANDERSON 1951 313 319 R SAIB 2002 395 402 A FRATALOCCHI 2016 6431 6440 L FISCHER 1926 97 104 F BELL 1981 203 232 A DRY 1996 319 344 M ELIASON 1999 229 243 S QUYOUM 1998 355 365 R GAUBE 2010 120 125 J VANDERLAAN 2000 39 53 G HALL 1960 1027 1037 W PICHLER 1970 1162 1174 H HINDERMANN 1993 1 127 J ZHUO 2009 8357 8365 M STORCH 1951 H FISCHERTROPSCHRELATEDSYNTHESES STORSAETER 2006 2051 2063 S HUO 2008 14108 14116 C INDERWILDI 2008 1305 1307 O OJEDA 2010 287 297 M VANHELDEN 2012 491 494 P VISCONTI 2011 786 800 C RYTTER 2018 1024 1034 E BERTOLE 2004 191 203 C KRISHNANMOORTHY 2002 422 433 S HIBBITS 2013 12273 12278 D VANSANTEN 2013 4488 4504 R KEYVANLOO 2016 9 18 K OSTADI 2016 236 246 M TODIC 2014 32 39 B MOSAYEBI 2015 191 204 A VANSANTEN 2013 17038 17063 R VISCONTI 2007 5338 5343 C VANNICE 2005 M KINETICSCATALYTICREACTIONS OOSTERBEEK 2016 H EXTENDEDABSTRACT99211THNATURALGASCONVERSIONSYMPOSIUM59JUNE EFFECTCOCOVERAGEPRODUCTSLATEINFTS WITHERS 1990 1807 1814 H VANSTEEN 1999 309 320 E DAS 2005 1430 1439 T BHATELIA 2011 707 712 T QIAN 2013 526 534 W MA 2014 158 166 W TSAKOUMIS 2010 162 182 N RYTTER 2015 478 499 E MOODLEY 2009 102 110 D KLIEVER 2006 135 144 C KUBASCHEWSKI 1979 O METALLURGICALTHERMOCHEMISTRY TSAKOUMIS 2017 3706 3715 N SADEQZADEH 2012 11955 11964 M SADEQZADEH 2013 52 59 M DAVIS 2002 1474 1572 B TECHNOLOGYDEVELOPMENTFORIRONCOBALTFISCHERTROPSCHCATALYSTSFINALTECHNICALREPORT TSAKOUMIS 2014 59 89 N KRISHNAMURTHY 2015 123 129 D MAULDIN 2001 417 422 C HILMEN 1986 143 147 A DIEHL 2009 11 24 F BORG 2007 89 100 O BORG 2009 70 77 O VISCONTI 2009 61 68 C HILLESTAD 2015 147 159 M RYTTER 2016 11 19 E BEZEMER 2006 3956 3964 G BORG 2008 161 164 O RYTTERX2022X112489 RYTTERX2022X112489XE Full 2022-07-07T09:24:58Z FundingBody Norway institutions 2022 http://creativecommons.org/licenses/by/4.0/ 2024-08-29T00:00:00.000Z 2024-08-29T00:00:00.000Z http://creativecommons.org/licenses/by-nc-nd/4.0/ This is an open access article under the CC BY license. © 2022 The Author(s). Published by Elsevier B.V. 2022-09-02T10:00:59.462Z http://vtw.elsevier.com/data/voc/AddOnTypes/50.7/aggregated-refined NTNU Norwegian University of Science and Technology http://data.elsevier.com/vocabulary/SciValFunders/100009123 http://sws.geonames.org/3144096 Research Council of Norway 228741 280846 Norges Forskningsråd http://data.elsevier.com/vocabulary/SciValFunders/501100005416 http://sws.geonames.org/3144096/ Financial support from The Research Council of Norway under Contracts no. 228741 and 280846 is gratefully acknowledged. The experimental work was conducted by Øyvind Borg in connection with his Ph.D. thesis as reported previosly 3,67,68,74 . The present work relies on the actual recorded reaction profiles as TOS. item S2468-8231(22)00375-3 S2468823122003753 1-s2.0-S2468823122003753 10.1016/j.mcat.2022.112489 315758 2023-05-22T04:01:38.109239Z 2022-09-01 2022-09-30 UNLIMITED UNIT2022 1-s2.0-S2468823122003753-main.pdf https://s3-eu-west-1.amazonaws.com/prod-ucs-content-store-eu-west/content/pii:S2468823122003753/MAIN/application/pdf/c9299f1574a4646dd6939342df7210b1/main.pdf main.pdf pdf true 2907599 MAIN 11 1-s2.0-S2468823122003753-main_1.png https://s3-eu-west-1.amazonaws.com/prod-ucs-content-store-eu-west/content/pii:S2468823122003753/PREVIEW/image/png/69ff4e3c692cea210440a66c002d1db4/main_1.png main_1.png png 59244 849 656 IMAGE-WEB-PDF 1 1-s2.0-S2468823122003753-gr4.jpg https://s3-eu-west-1.amazonaws.com/prod-ucs-content-store-eu-west/content/pii:S2468823122003753/gr4/DOWNSAMPLED/image/jpeg/4a6f53443efefb50771a7f27846484ff/gr4.jpg gr4 gr4.jpg jpg 38179 306 386 IMAGE-DOWNSAMPLED 1-s2.0-S2468823122003753-gr5.jpg https://s3-eu-west-1.amazonaws.com/prod-ucs-content-store-eu-west/content/pii:S2468823122003753/gr5/DOWNSAMPLED/image/jpeg/fcdf870fbcda67d525d4c7c76cc0218c/gr5.jpg gr5 gr5.jpg jpg 38893 299 533 IMAGE-DOWNSAMPLED 1-s2.0-S2468823122003753-gr6.jpg https://s3-eu-west-1.amazonaws.com/prod-ucs-content-store-eu-west/content/pii:S2468823122003753/gr6/DOWNSAMPLED/image/jpeg/ae68c69f56901d266e15d8d9abc063fa/gr6.jpg gr6 gr6.jpg jpg 38570 303 386 IMAGE-DOWNSAMPLED 1-s2.0-S2468823122003753-gr10.jpg https://s3-eu-west-1.amazonaws.com/prod-ucs-content-store-eu-west/content/pii:S2468823122003753/gr10/DOWNSAMPLED/image/jpeg/2bbac22096434881a76115351af82b60/gr10.jpg gr10 gr10.jpg jpg 26887 253 386 IMAGE-DOWNSAMPLED 1-s2.0-S2468823122003753-gr7.jpg https://s3-eu-west-1.amazonaws.com/prod-ucs-content-store-eu-west/content/pii:S2468823122003753/gr7/DOWNSAMPLED/image/jpeg/d50385565398bdf07d872c0015711a93/gr7.jpg gr7 gr7.jpg jpg 36694 297 386 IMAGE-DOWNSAMPLED 1-s2.0-S2468823122003753-gr8.jpg https://s3-eu-west-1.amazonaws.com/prod-ucs-content-store-eu-west/content/pii:S2468823122003753/gr8/DOWNSAMPLED/image/jpeg/2388d76ea09c7551d2d57d0312e99889/gr8.jpg gr8 gr8.jpg jpg 35762 295 386 IMAGE-DOWNSAMPLED 1-s2.0-S2468823122003753-gr9.jpg https://s3-eu-west-1.amazonaws.com/prod-ucs-content-store-eu-west/content/pii:S2468823122003753/gr9/DOWNSAMPLED/image/jpeg/f6a689e1a87b00230698613bbc57e57d/gr9.jpg gr9 gr9.jpg jpg 37022 296 386 IMAGE-DOWNSAMPLED 1-s2.0-S2468823122003753-gr1.jpg https://s3-eu-west-1.amazonaws.com/prod-ucs-content-store-eu-west/content/pii:S2468823122003753/gr1/DOWNSAMPLED/image/jpeg/1998effc54cc7deed7193a06a84d0d64/gr1.jpg gr1 gr1.jpg jpg 74456 669 615 IMAGE-DOWNSAMPLED 1-s2.0-S2468823122003753-gr2.jpg https://s3-eu-west-1.amazonaws.com/prod-ucs-content-store-eu-west/content/pii:S2468823122003753/gr2/DOWNSAMPLED/image/jpeg/24ca0a0f1aad17b2e553bdab69cb9761/gr2.jpg gr2 gr2.jpg jpg 27159 273 386 IMAGE-DOWNSAMPLED 1-s2.0-S2468823122003753-ga1.jpg https://s3-eu-west-1.amazonaws.com/prod-ucs-content-store-eu-west/content/pii:S2468823122003753/ga1/DOWNSAMPLED/image/jpeg/2ebb8d0d450f8527cbba4c7a4054f545/ga1.jpg ga1 true ga1.jpg jpg 19888 244 225 IMAGE-DOWNSAMPLED 1-s2.0-S2468823122003753-gr3.jpg https://s3-eu-west-1.amazonaws.com/prod-ucs-content-store-eu-west/content/pii:S2468823122003753/gr3/DOWNSAMPLED/image/jpeg/629862dd04390efcdbd2fc57aa31cb09/gr3.jpg gr3 gr3.jpg jpg 35263 377 386 IMAGE-DOWNSAMPLED 1-s2.0-S2468823122003753-gr4.sml https://s3-eu-west-1.amazonaws.com/prod-ucs-content-store-eu-west/content/pii:S2468823122003753/gr4/THUMBNAIL/image/gif/227a680e912904b9b73901d594927d72/gr4.sml gr4 gr4.sml sml 11292 164 207 IMAGE-THUMBNAIL 1-s2.0-S2468823122003753-gr5.sml https://s3-eu-west-1.amazonaws.com/prod-ucs-content-store-eu-west/content/pii:S2468823122003753/gr5/THUMBNAIL/image/gif/6294c9c41a8975ae08a7e3ec37a60c11/gr5.sml gr5 gr5.sml sml 8814 123 219 IMAGE-THUMBNAIL 1-s2.0-S2468823122003753-gr6.sml https://s3-eu-west-1.amazonaws.com/prod-ucs-content-store-eu-west/content/pii:S2468823122003753/gr6/THUMBNAIL/image/gif/e6dee3688fb8b24e5c69ed8b37760c02/gr6.sml gr6 gr6.sml sml 12206 164 209 IMAGE-THUMBNAIL 1-s2.0-S2468823122003753-gr10.sml https://s3-eu-west-1.amazonaws.com/prod-ucs-content-store-eu-west/content/pii:S2468823122003753/gr10/THUMBNAIL/image/gif/d8bb3eebefabee4f3fbd26a118db6ece/gr10.sml gr10 gr10.sml sml 9111 144 219 IMAGE-THUMBNAIL 1-s2.0-S2468823122003753-gr7.sml https://s3-eu-west-1.amazonaws.com/prod-ucs-content-store-eu-west/content/pii:S2468823122003753/gr7/THUMBNAIL/image/gif/c43abe8a1ef86eca27fa46acb7ad62f4/gr7.sml gr7 gr7.sml sml 11920 164 213 IMAGE-THUMBNAIL 1-s2.0-S2468823122003753-gr8.sml https://s3-eu-west-1.amazonaws.com/prod-ucs-content-store-eu-west/content/pii:S2468823122003753/gr8/THUMBNAIL/image/gif/825cbc1d13a8d93d626ac8212e594245/gr8.sml gr8 gr8.sml sml 11598 164 214 IMAGE-THUMBNAIL 1-s2.0-S2468823122003753-gr9.sml https://s3-eu-west-1.amazonaws.com/prod-ucs-content-store-eu-west/content/pii:S2468823122003753/gr9/THUMBNAIL/image/gif/d25ab27ab4cc66fb38223ecb4fbcd479/gr9.sml gr9 gr9.sml sml 12163 164 214 IMAGE-THUMBNAIL 1-s2.0-S2468823122003753-gr1.sml https://s3-eu-west-1.amazonaws.com/prod-ucs-content-store-eu-west/content/pii:S2468823122003753/gr1/THUMBNAIL/image/gif/b3ccc55ce111614d01a286958aeb7f17/gr1.sml gr1 gr1.sml sml 8006 164 151 IMAGE-THUMBNAIL 1-s2.0-S2468823122003753-gr2.sml https://s3-eu-west-1.amazonaws.com/prod-ucs-content-store-eu-west/content/pii:S2468823122003753/gr2/THUMBNAIL/image/gif/fbade05bcf224fdc48310019a66b453f/gr2.sml gr2 gr2.sml sml 9975 155 219 IMAGE-THUMBNAIL 1-s2.0-S2468823122003753-ga1.sml https://s3-eu-west-1.amazonaws.com/prod-ucs-content-store-eu-west/content/pii:S2468823122003753/ga1/THUMBNAIL/image/gif/c9223b079c185bc8782c89b7190a4b2d/ga1.sml ga1 true ga1.sml sml 8070 164 151 IMAGE-THUMBNAIL 1-s2.0-S2468823122003753-gr3.sml https://s3-eu-west-1.amazonaws.com/prod-ucs-content-store-eu-west/content/pii:S2468823122003753/gr3/THUMBNAIL/image/gif/75226fd7f3e794a6677869ef9c239340/gr3.sml gr3 gr3.sml sml 9114 164 168 IMAGE-THUMBNAIL 1-s2.0-S2468823122003753-gr4_lrg.jpg https://s3-eu-west-1.amazonaws.com/prod-ucs-content-store-eu-west/content/pii:S2468823122003753/HIGHRES/image/jpeg/6fce397e60f1b546d9f53e150f9fb4cc/gr4_lrg.jpg gr4 gr4_lrg.jpg jpg 250076 1356 1709 IMAGE-HIGH-RES 1-s2.0-S2468823122003753-gr5_lrg.jpg https://s3-eu-west-1.amazonaws.com/prod-ucs-content-store-eu-west/content/pii:S2468823122003753/HIGHRES/image/jpeg/501943ea62b406e8853c02f68817febd/gr5_lrg.jpg gr5 gr5_lrg.jpg jpg 268475 1323 2360 IMAGE-HIGH-RES 1-s2.0-S2468823122003753-gr6_lrg.jpg https://s3-eu-west-1.amazonaws.com/prod-ucs-content-store-eu-west/content/pii:S2468823122003753/HIGHRES/image/jpeg/1d0ea76b4f80c77c949ac5c41c366914/gr6_lrg.jpg gr6 gr6_lrg.jpg jpg 271568 1343 1709 IMAGE-HIGH-RES 1-s2.0-S2468823122003753-gr10_lrg.jpg https://s3-eu-west-1.amazonaws.com/prod-ucs-content-store-eu-west/content/pii:S2468823122003753/HIGHRES/image/jpeg/16d91ea11300affbc9ca748055eb770b/gr10_lrg.jpg gr10 gr10_lrg.jpg jpg 164745 1120 1709 IMAGE-HIGH-RES 1-s2.0-S2468823122003753-gr7_lrg.jpg https://s3-eu-west-1.amazonaws.com/prod-ucs-content-store-eu-west/content/pii:S2468823122003753/HIGHRES/image/jpeg/c92a4722663ddc867988fef16a7d9b08/gr7_lrg.jpg gr7 gr7_lrg.jpg jpg 251059 1317 1709 IMAGE-HIGH-RES 1-s2.0-S2468823122003753-gr8_lrg.jpg https://s3-eu-west-1.amazonaws.com/prod-ucs-content-store-eu-west/content/pii:S2468823122003753/HIGHRES/image/jpeg/4e9f3831c00bdfae2913c0fb8ec4de74/gr8_lrg.jpg gr8 gr8_lrg.jpg jpg 246090 1307 1709 IMAGE-HIGH-RES 1-s2.0-S2468823122003753-gr9_lrg.jpg https://s3-eu-west-1.amazonaws.com/prod-ucs-content-store-eu-west/content/pii:S2468823122003753/HIGHRES/image/jpeg/0019c28ca37412d3aef75e427d7d190f/gr9_lrg.jpg gr9 gr9_lrg.jpg jpg 267147 1309 1709 IMAGE-HIGH-RES 1-s2.0-S2468823122003753-gr1_lrg.jpg https://s3-eu-west-1.amazonaws.com/prod-ucs-content-store-eu-west/content/pii:S2468823122003753/HIGHRES/image/jpeg/fc50f8776e6c7422bbe5fb448311c27f/gr1_lrg.jpg gr1 gr1_lrg.jpg jpg 513000 2961 2724 IMAGE-HIGH-RES 1-s2.0-S2468823122003753-gr2_lrg.jpg https://s3-eu-west-1.amazonaws.com/prod-ucs-content-store-eu-west/content/pii:S2468823122003753/HIGHRES/image/jpeg/0e7aa2a589d5fe7ce65e67aefa51e3aa/gr2_lrg.jpg gr2 gr2_lrg.jpg jpg 208283 1207 1709 IMAGE-HIGH-RES 1-s2.0-S2468823122003753-ga1_lrg.jpg https://s3-eu-west-1.amazonaws.com/prod-ucs-content-store-eu-west/content/pii:S2468823122003753/HIGHRES/image/jpeg/cdb31df811338a4fd65e3fcb5087fd6b/ga1_lrg.jpg ga1 true ga1_lrg.jpg jpg 116570 1085 999 IMAGE-HIGH-RES 1-s2.0-S2468823122003753-gr3_lrg.jpg https://s3-eu-west-1.amazonaws.com/prod-ucs-content-store-eu-west/content/pii:S2468823122003753/HIGHRES/image/jpeg/25f4e69d425d5676277b37fbe2fcbf99/gr3_lrg.jpg gr3 gr3_lrg.jpg jpg 270071 1667 1709 IMAGE-HIGH-RES 1-s2.0-S2468823122003753-si1.svg https://s3-eu-west-1.amazonaws.com/prod-ucs-content-store-eu-west/content/pii:S2468823122003753/image/svg+xml/d6458e68a8871f76150059ba98bfb675/si1.svg si1 si1.svg svg 14746 ALTIMG 1-s2.0-S2468823122003753-am.pdf https://s3-eu-west-1.amazonaws.com/prod-ucs-content-store-eu-west/content/egi:10WXN4HZNCK/MAIN/application/pdf/0394cecb1aeb694916e4f3621dc9888d/am.pdf am am.pdf pdf false 1373524 AAM-PDF MCAT 112489 112489 S2468-8231(22)00375-3 10.1016/j.mcat.2022.112489 The Author(s) Fig. 1 CO activation, CHx monomer pool, chain growth and termination framework on the cobalt surface. Fig 1 Fig. 2 CO conversion for catalyst C3. Crosses: experimental data. Line: model. Fig 2 Fig. 3 CO conversion for catalysts C10, C11 and C14. Crosses: experimental data. Line: model. Fig 3 Fig. 4 Modelled deactivation of investigated catalysts (upper half) and resulting conversion corrected for deactivation. Fig 4 Fig. 5 Deactivation rate constant kd and gas-hourly-space-velocity as a function of cobalt dispersion measured by hydrogen chemisorption. Fig 5 Fig. 6 Comparison of experimental (circles) and modelled (solid line) selectivities to C5+ (blue) and CH4 (brown) for catalyst C3. Fig 6 Fig. 7 Comparison of experimental (circles) and modelled (solid line) selectivities to C5+ (blue) and CH4 (brown) for catalyst C10. Fig 7 Fig. 8 Comparison of experimental (circles) and modelled (solid line) selectivities to C5+ (blue) and CH4 (brown) for catalyst C11. Fig 8 Fig. 9 Comparison of experimental (circles) and modelled (solid line) selectivities to C5+ (blue) and CH4 (brown) for catalyst C14. Fig 9 Fig. 10 Comparison of estimated kinetic parameters for cobalt FT catalysts C3, C10, C11 and C14 encompassing the direct water sensitive parameters f, PH2Oᵒ and y. Fig 10 Table 1 Published rate equations containing water for CO consumption in Fischer-Tropsch synthesis on cobalt; excluding water assisted CO-activation [ref. 31]. Table 1 Rate expression a -rCO Catalyst Mechanism Kinetics Conditions Ref. Reactor type Tempera-ture (°C) Pressure(bar) % COconv. H2/CO feed aP H2 /{1+bP H2O/P CO P H2} Co/Zr/SiO2 Carbide CSTRb 240-280 30 n.a. 1.0-2.0 Withers et al. [44] a{P H2 1.5 P CO/P H2O} / {1+bP H2 P CO/P H2O}[2] Co/MgO/ ThO2/SiO2 CarbideMicro CSTR 190-210 2.7-6.2 n.a. Wide + H2O van Steen and Schulz [45] a{P H2 0.5/P CO 0.25} /{1-bP H2O/P H2} Co/SiO2 Empirical Macro CSTR 210 21.6 12.2-37.7 1.0-2.4 + H2O Das et al. [46] aP H2 0.5 P CO /{1-bP H2 0.5+cP CO-dP H2O} [2] Co/Ru/Al2O3 CarbideLH CSTR 205-220 14-24 n.a. 1.4-2.1 Bhatelia et al. [47] aP H2/{1+bP H2 0.5+cP CO+dP H2O/ P H2 0.5+ eP H2O/ P H2 1.5} [2] Co/activ. carbon CO insertionLH Fixed-bed 220-250 20-40 10-53 1.0-2.5 Qian et al. [48] c a{P H2 0.88/P CO 0.31} /{1-bP H2O/P H2} Co/Al2O3 Empirical Macro CSTR 205-230 14-25 3-59 1.0-2.5 Ma et al. [49] a Coefficients are positive. b Continuously stirred tank reactor. c Simplified expression for paraffins. n.a.: not available. Table 2 Implementation of deactivation in kinetic studies considering water. Table 2 Catalyst Time on stream (h) Deactivation type Deactivation correction Reference Co/Zr/SiO2 2188-4417 Variable Linear interpolation Withers et al. [44] Co/MgO/ ThO2/SiO2 n.a. n.a. n.a. van Steen and Schulz, [45] Co/SiO2 350-2450 Exponential decay Linear interpolation Das et al., [46] Co/Ru/Al2O3 n.a. n.a. n.a. Bhatelia et al. [47] Co/activ. carbon 230-1350 Considered stable No implementation Qian et al. [48] Co/Al2O3 365-918 Linear 1.4% in 553 h Ma et al., [49] Table 3 Properties of investigated catalysts. Table 3 Catalyst sample Type of support Surface area (m2/g) Pore diameter(nm) Pore volume(cm3/g) Pore size distribution Co particle size (nm) a Degree of reduction(%) b C3 γ-Puralox SCCa 40/195 143 7.1 0.30 Sharp 8.3 56 C7 γ-Pural NG 136 8.2 0.30 Broad 12.4 59 C10 γ-Puralox SCCa 20/190 149 11.6 0.51 Broad(Low poresize shoulder) 10.2 60 C11 γ-Puralox SCCa 45/190 148 11.6 0.50 Medium broad(Slightly bimodal) 9.5 61 C12 γ-Puralox TH 100-150 123 18.3 0.62 Medium broad 11.3 70 C14 α-alumina(84%) 23.5 ∼150 ∼0.8 - 19.0 > 90 γ: γ-alumina. a By hydrogen chemisorption. b By oxygen titration. Table 4 Estimated kinetic model parameters for Fischer-Tropsch synthesis based on the vinylene mechanism. Parameters directly coupled to the partial pressure of water are f, P and y a . Table 4 Parameter Catalyst C3 C10 C11 C14 kFT 1.68 1.56 2.13 1.17 a 3.5 3.5 3.5 3,5 b 1.50 1.0 1.15 1.67 f 0.103 1.24 1.86 1.06 PH2Oᵒ 1 0.94 0.67 0.49 kCH4 0,107 0,096 0,094 0,071 kd 0.0090 0.0170 0.0144 0.0079 kα 0.057 0.024 0.0033 0.0102 y 0.107 0.422 0.252 0.60 GHSV (mL/g*h) @ 50% conv. 9480 8947 7536 3231 a Units are based on reaction rates in ghydrocarbon/gcat*h and pressures in bar. The water assisted vinylene mechanism for cobalt Fischer-Tropsch synthesis assessed by multi-catalyst modelling of kinetics and deactivation Erling Rytter Conceptualization Methodology Writing – original draft Visualization ⁎ Anders Runningen Formal analysis Investigation 1 Edd Blekkan Validation Supervision Project administration Funding acquisition Magne Hillestad Methodology Supervision Resources Department of Chemical Engineering, Norwegian University of Science and Technology (NTNU), Sem Sæland vei 4, NO-7491, Trondheim, Norway Department of Chemical Engineering Norwegian University of Science and Technology (NTNU) Sem Sæland vei 4 Trondheim NO-7491 Norway Department of Chemical Engineering, Norwegian University of Science and Technology (NTNU), Sem Sæland vei 4, NO-7491, Trondheim, Norway ⁎ Corresponding author. 1 Present address: Citec Norway AS, Strandveien 37, 1366 Lysaker; anders.runningen@citec.com The paper describes development of a mechanism and a consistent rate expression for Fischer-Tropsch (FT) synthesis over cobalt-based catalysts. The developed mechanism relies on a two-step hydrogen assisted activation of CO. The carbon atom of CO is first hydrogenated by surface hydrogen to formyl; followed by the rate-limiting step whereby the oxygen atom is hydrogenated by adsorbed water. The produced CH* monomer is incorporated into the growing chain giving vinylene intermediate. The vinylene intermediate is either terminated to an olefin by adding hydrogen to the α-carbon atom or propagates by adding hydrogen to the β-carbon position. The resulting expression for CO consumption, the Fischer-Tropsch rate, can respond positively or negatively to the partial pressure of water, in agreement with experimental observations. A special feature is that the chain propagation probability does not depend on the partial pressure of hydrogen. The resulting kinetic model is tested on several cobalt catalysts supported on alumina; spanning from γ-alumina with average pore sizes ranging from 6.1 to 18.3 nm to α-alumina with a wide pore structure; and with cobalt particle sizes from 8 to 19 nm. Water was added sequentially to the syngas feed, causing enhanced deactivation, for testing the water response on activity and selectivity. A deactivation model comprising sintering and cobalt oxidation, and the FT-kinetics, describe the observed CO conversions with great precision for all catalysts. Selectivities are also well described, but with slight deviations at least partly due the effect of deactivation. Trends in some of the kinetic parameters are rationalized in terms of cobalt crystallite and pore sizes. Graphical abstract Image, graphical abstract Keywords Fischer-Tropsch Kinetics Deactivation Mechanism Cobalt catalyst Data availability Data will be made available on request. 1 Introduction The overall reaction in low-temperature Fischer-Tropsch synthesis (FTS) from synthesis gas (syngas) can be described as (1) n CO + 2n H2 → CnH2n + n H2O assuming a general chain length and the primary product to be an olefin. Stoichiometric amount of water is produced for each carbon atom in the product. In a recent series of papers on cobalt catalyzed FTS we have demonstrated that water is not a silent spectator but plays a significant role in all parts of FTS [1–3]. Type and structure of the support is an important parameter in developing an FT-catalyst system. Frequently used support materials are alumina, silica and titania [4]; they behave differently when cobalt is deposited. Furthermore, there are huge differences in properties within each class of support that result in variations in activity and polymerization probability, e.g., as detected by the C5+ selectivity [5–8]. Without exception, for all catalyst systems and process conditions, water added to the syngas feed and water produced during FT synthesis, improve selectivity to higher hydrocarbons. It follows that the C5+ selectivity increases with CO conversion due to positive effect of indigenously produced water. Krishnamoorthy et al. investigated cobalt supported on silica and found that both C5+ selectivity and CO activation rate increase by adding water to the feed [9]. Correlations were found by adding water during FTS for more than ten different γ-alumina supported cobalt FT catalysts, with large variations in pore sizes [3]. It was shown that due to positive correlation between pore size and cobalt crystallite size, there is a concurrent increase in C5+ with pore diameter. This increase in selectivity was found to be due to higher Anderson-Schultz-Flory chain propagation probabilities; α [10]. High α values were ascribed to larger cobalt crystallites that promote CO activation with consequently higher surface coverage of CHx polymerization monomers. Increase in cobalt crystallite size with increasing pore diameter was also detected when using silica supports [11]. Importantly, close correlation was found between positive responses to water for C5+ selectivity and CO conversion [3], pointing at the same mechanistic origin. Analyses showed that added water imposes a significantly enhanced probability for chain initiation vs. termination to methane. This was attributed to higher relative cobalt surface coverage of water or hydroxyl and CHx monomers relative to hydrogen. Visconti and co-workers tested a Co on γ-alumina catalyst in extended runs with added water [12]. Their results comply with the observations above, and they interpreted the data in terms of water suppressing hydrogen activity. Several mechanisms for activation of CO and insertion into the growing chain have been scrutinized. This comprises the carbide mechanism or unassisted CO dissociation [13–18] hydrogen assisted CO dissociation [19,20], direct CO insertion [21–23], and the enol mechanism [24]. The latter two mechanisms appear more relevant for iron catalysts and formation of oxygenates. Comparative microkinetic [25], and DFT calculations [26–29], indicate that the energy barrier for activation is significantly higher for the carbide route than for hydrogenation of the carbon atom in adsorbed CO. Therefore, hydrogen assisted CO dissociation has gained widespread attention in later years [30], and is the basis for the present work. It was suggested recently that water plays a key role in activation of CO by providing hydrogen to the oxygen atom of CO [31]; thereby enhancing the surface coverage of polymerization monomers CHx. Indeed, previous SSITKA (Steady-State Isotopic Transient Kinetic Analysis) studies showed enhanced water induced surface coverage of polymerization intermediates [32], and generation of a CHx surface pool. However, added water to the syngas feed may increase or decrease observed catalyst activity. More inert supports and large pore sizes have positive response, while medium to narrow pore size γ-alumina and silica have negative CO conversion response to water. Furthermore, there is a limit to the positive effect of water on activity. Too high amounts result in decreased activity; most likely due to oversaturation of the cobalt surface with water molecules. In a similar approach, Iglesia and co-workers suggested that water acts as a “hydrogen shuttling mediator” that facilitates hydrogenation of CO through a H3Oδ+ intermediate [33,34]. There are numerous published kinetic models for cobalt FTS, and surveys have been given by van Santen et al.[35], Keyvanloo et al.[36], and Ostadi et al. [37]. Some of the micro kinetic models proposed for Fischer Tropsch synthesis are by Storsæter et al.[25], Todic et al. [38], Mosayebi and Haghtalab [39], Van Santen et al. [40], and Visconti et al. [41]. The present work is based on a microkinetic approach and the Langmuir-Hinshelwood (LH)[42] formalism. The LH kinetic constants are lumped and estimated by adjustments to experimentally observed rates. Further, simplifications are made by only considering coverage of the surface by species that are expected to be most abundant. As described above, it appears reasonable that water is participating in the rate-limiting step of FTS, either directly as adsorbed water or after dissociation to hydroxyl. Chain growth; (2) CnH2n + CH2 → Cn+1H2n+2, here approximated by a growing chain by adding a CH2 unit, as well as chain termination, need to be addressed on a micro-kinetic scale with due consideration of the water present. A unique feature of the developed consorted vinylene mechanism is invariance of the ASF α on the partial pressure of hydrogen [31]. Indeed, Oosterbeek and van Bavel have shown that α does not change with pressure of hydrogen; when the pressure of CO is being kept constant [43]. Only a few of previously available rate expressions contain water as part of the kinetic expression; see Table 1 . Each published rate expression has only been fitted to a single catalyst composition, meaning that the general applicability is questionable Two of the investigations comprise testing of added water. Only one formulation include water in the principal nominator, and then as a negative response (van Steen and Schulz [45]). Bukur, Davis, Jacobs and co-workers published three expressions for standard catalysts, but behaving opposite as to the effect of water [46,47,49]. The two additional investigations comprise water as a term in the denominator giving a negative effect on rate [44,48]. All in all, it means that only the two expressions with -bPH2O term in the denominator respond positively to the partial pressure of water. Addition of this term was done to fit the data and was not mechanistically based. A negative term in the denominator has no rationale in the LH formulation, as all terms define surface coverage of a given specie. Reviews on deactivation of FT catalysts appeared a few years ago [50,51]. The papers discuss a wide variety of deactivation mechanisms comprising sintering; re-oxidation of cobalt, including surface oxidation; formation of stable compounds between cobalt and the support, e.g., cobalt aluminate; surface reconstruction; formation of carbon species on the cobalt surface; carburization; and poisoning. Only two reports on deactivation during extended testing have been found. Sasol with partners have published extensively on deactivation at industrial conditions focusing on a polycarbon deposition mechanism [52]. In contrast, Exxon scientists claim oxidation to be the most pronounced mechanism. Kliewer et al. studied redox transformations of cobalt catalysts by TEM in terms of agglomeration of the metal, mixed-oxide formation with the support and reversible oxidation [53]. Reactor studies supported by TEM showed that nanoscale Co particles can oxidize to CoO during FT synthesis conditions in spite of bulk thermodynamic data suggesting otherwise [54]. The propensity for oxidation is enhanced by small Co particles and high degree of CO conversion; promoting oxidative conditions due to high concentration of water vapor [6]. Thresholds for re-oxidation were studied by Tsakoumis et al. by in situ XANES [55]; concluding that cobalt nanoparticles in the outset should be larger than 5 nm to avoid oxidation. Sintering of cobalt sites are shown to be particularly important in the first days or weeks of an FT run [56,57,58]. Characterization of a commercial catalyst after ca. one month operation in a 600 bpd slurry-bubble column showed initial increase in the degree of reduction of cobalt, followed by sintering attributed to crystallite migration [59]. Another sintering mechanism that has been considered is Ostwald ripening, where cobalt atoms are transported from smaller to larger crystallites [60]. It is beyond the scope of the present work to study deactivation and deactivation mechanisms per se, but modelling decline in observed rate is a necessity to be able to fit kinetic parameters. Handling of deactivation in the studies shown in Table 1 are summarized in Table 2 . To our knowledge, no explicit expression for deactivation of a cobalt Fischer-Tropsch catalyst has been published previously; neither mechanistically based nor purely empirical. The present work encompasses kinetic modelling of a series of rhenium promoted cobalt Fischer-Tropsch catalysts supported on γ-alumina with a large variety in pore sizes, to the inert α-alumina. Rhenium was first reported added to a Co/titania catalyst [61], and shortly after to Co/γ-alumina [62]. Mauldin and Varnado concluded that for the former system rhenium increases cobalt oxide dispersion and promote reduction of cobalt oxide [63]. The same conclusion was reached for alumina supported catalysts by Hilmen et al. [64]. Diehl and Khodakov have reviewed promotion of cobalt FT-catalysts with noble metals [65]. All in all, the present work focuses on a novel mechanism that is able to describe a multitude of cobalt Fischer-Tropsch catalysts with varying responses to water, and with a concurrent model for deactivation. 2 Experimental 2.1 Catalyst preparation Laboratory catalysts were prepared as described previously [66,67], including one-step incipient wetness co-impregnation with an aqueous solution of cobalt nitrate hexahydrate and perrhenic acid. One α-Al2O3 support was prepared by calcination of γ- Al2O3 (Puralox SCCa). After impregnation the catalyst was dried in a stationary oven at 110-120°C for 3 h; followed by calcination at 300°C for 16 h. 6 catalysts were prepared and numbered as shown in Table 3 and in accordance with a previous study [66,68]. The C14 α-alumina sample corresponds to Cα1 [3]. The catalyst supports span a variety of kinetic properties where the response of water on activity is very negative (C11), slightly negative (C3), neutral (C10) or positive (C14). The latter catalyst has also significantly improved selectivity to C5+. 2.2 Catalyst characterization Key characterization data are found in Table 3. Powder X-ray diffraction patterns and temperature-programmed reduction (TPR) can be found in previous reports[66,67]. As shown in Table 3, the investigated catalysts span wide ranges of pore diameters, pore size distributions, and cobalt particle size; giving very different Fischer-Tropsch performances in terms of activities, selectivities and water responses. 2.3 Fixed-bed catalyst testing FT reactions were conducted in fixed-bed reactors of stainless steel with 10 mm inner diameter. Further details are given in previous reports [67,68]. Sieved samples (53-90 μm) were diluted with silicon carbide and reduced in situ in hydrogen at ambient pressure and 350°C. Gas flow was adjusted to give CO conversion level between 45 and 50 percent after 26 h time on stream (TOS). All experiments where run at 20 bar total pressure and 210°C. Water was vaporized and added at 4.25 bar and 7.06 bar; simulating 46 and 64% conversion at the inlet, respectively. Liquid products were collected in a heated trap followed by a cold trap, and the gaseous product was analyzed for hydrogen, nitrogen, carbon monoxide, carbon dioxide, water, and C1 to C9 hydrocarbons by a gas chromatograph. Activity is reported as hydrocarbon formation rate (g hydrocarbon/(g catalyst h)) with precision (2σ) of 3% 3 Mechanistic framework 3.1 The water assisted vinylene mechanism Present kinetic modelling is based on the consorted vinylene mechanism for cobalt Fischer-Tropsch synthesis. Key element of the mechanism is water assisted CO-activation. Description of the mechanism and derived kinetics have been reported previously [31]. There are, however, several variations to the mechanism, including activation by adsorbed water or hydroxyl, and certain variations in necessary assumptions of intermediates; notably whether formyl (CHO) is in a steady state condition or in equilibrium, and if hydroxycarbene (HCOH) is included as an intermediate. Summary of the adopted mechanism is shown in Fig. 1 . Principles of the mechanism comprise the following features: the carbon atom of CO is activated by hydrogen; the oxygen atom of CO is activated by H2O (alternatively: by OH*); formyl may dissociate spontaneously upon hydrogenation, methylidyne (CH*) is the main monomer building the chain; hydrogenation of the β-carbon of the chain completes the propagation step, whereas hydrogenation of the α-carbon atom terminates chain growth; the primary product is an α-olefin. This formalism complies with key observations in FTS synthesis, summarized to be: the existence of a CHx pool; water enhancing CO activation and long-chain selectivity; α-olefins as primary product; chain growth probability independent of hydrogen partial pressure. The mechanism, in its basic form, does not encompass formation of oxygenates. It can, however, easily be extended to include short chain branching and higher order alcohols by addition of methyl or hydroxyl, respectively, in the beta-position instead of hydrogen. It is necessary to develop a kinetic expression that can model both negative and positive activity responses to added water, and also give rise to chain growth probability α that increases with partial pressure of water. In addition, α should not depend on the partial pressure of hydrogen; all other partial pressures being constant. This leaves two expressions of the six reported previously [31]; both requiring that formyl is in equilibrium with adsorbed CO. We have selected the one that does not contain hydroxycarbene as an intermediate as outlined on Fig. 1. Note that simplifications of the rate equation used should be made anyway to reduce the number of variables. Derivation of the applied FT rate equation is given below. Water, hydrogen and carbon monoxide adsorption follow [68] (3) H2O(g) + * ↔ H2O* KH2O = θH2O/(PH2O θv) θH2O = KH2O PH2O θv (4) H2(g) + 2* ↔ 2 H* KH2 = θH 2/(PH2 θv 2) θH = KH2 ½ PH2 ½ θv (5) CO(g) + * ↔ CO* KCO = θCO/(PCO θv) θCO = KCO PCO θv Adsorbed CO is assumed to be hydrogenated directly in an equilibrium reaction; CO* + H* ↔ CHO* + * KCHO = θCHO θv/(θCO θH) (6) θCHO = KCHO KCO KH2 ½ PCO PH2 ½ θv with formation of a formyl specie. We presume that hydrogenation by H* is to a carbon atom whereas hydrogenation from H2O* is to an oxygen atom, in accordance with the higher electronegativity of oxygen and general hydrogen bonding experience. The present mechanism calls for water activation of formyl yielding the CH* monomer as rate limiting step: (7) CHO* + H2O* → 2 OH* + CH* (8) r FT = − r CO = r CH = k CH θ CHO θ H 2 O = k CH K CHO K CO K H 2 1 / 2 K H 2 O P CO P H 2 1 / 2 P H 2 O θ v 2 | An estimate for the monomer CH* in the overall LH site conservation equation is included by deduction from the stoichiometry of the FT reaction; see Eqs. (1) and (2). Further CHx, x>1, species are neglected in this context, but can easily be derived from a CHx surface pool in equilibrium if desired. Approximately, equal amounts of water and -CH2- chain building blocks are produced from CO. The latter can be formulated as (9) CH* + H* → -CH2-* + * This reaction is a confined representation of the propagation steps shown in Fig. 1. Oxygen follows the pathway CO → CHO* → OH* with depletion of CHO* as rate limiting. Therefore, by combining Eqs. (9), (8) and (4), (10) r -CH2- = r CH θCH = (kCH/k-CH2-) KCHO KCO KH2O PCO PH2O θv and from (11) 1 = θCO + θH + θCHO + θCH + θOH + θH2O + θv the water-assisted Langmuir-Hinshelwood rate equation becomes (12) r FT = k PCO PH2 ½ PH2O/(1 + aPCO + bPH2 ½ + c(PCO PH2 ½) + d(PCO PH2O) + e(PH2O/PH2 ½) + fPH2O)2 where k = kCH KCHO KCO KH2 ½ KH2O and the coefficients in the denominator represent coverage of the individual surface species: a = KCO [θCO]; b = KH2 ½ [θH]; c = KCHO KCO KH2 ½ [θCHO]; d = (kCH/k-CH2-) KCHO KCO KH2O [θCH]; e = (KOH KH2O/ KH2 ½) [θOH]; f = KH2O [θH2O]. Eq. 12 is impractical for fitting to observed rates or conversions, and two types of modifications are made. First, the denominator is simplified to only account for surface species that are assumed to be major occupants of surface sites. The only carbon entity left is CO, and hydroxyl is deemed less important than water; meaning that terms c, d and e are removed. Second, there is a fundamental issue related to modelling of fixed-bed reactors as feeding dry syngas might mean that the reaction will not start due to the proportionality of rate with partial pressure of water. However, it is argued that there anyway is some water on the cobalt surface after reduction of cobalt oxide with hydrogen. Besides, we do not claim that the present route for activation of CO is exclusive; some initial activation can stem from other mechanisms and sites. The practical equation for modelling therefore is (13) r FT = kFT PCO PH2 ½ (Pᵒ + PH2O)/(1 + aPCO + bPH2 ½ + f PH2O)2 with only five adjustable parameters reflecting, respectively; overall activity level, initial activity, and the stickiness of CO, hydrogen, and water. Note that the equation can account for both positive and negative effects of water depending on the parameter f and the partial pressure of water. In particular, overloading the catalyst with water suppresses coverage of other critical species with consequent reduction in Fischer-Tropsch rate. It is expected that f reflects properties of the support like inertness and pore size. 3.2 Chain propagation probability Main effort has been put on modelling rates, but selectivities to C5+ and methane have been calculated as well; see the section on kinetic modelling. It is therefore of interest to derive an expression for chain growth probability from the water assisted vinylene mechanism. The chain growth selectivity, as described by the Anderson-Schultz-Flory (ASF) polymerization probability α, is (14) α = r p/(r p + r t) = 1/(1+ r t/ r p) where r p is chain propagation rate and r t is chain termination rate, or the sum of chain termination rates. In addition, separate models are required for methane and C2 products that deviate severely from the ASF distribution. According to the present mechanism, propagation is composed of two consecutive reactions, insertion of methylidyne (-CH) into the RCH chain followed by vinylene hydrogenation: (15) r p(CH) = k p CH θRCH θCH (16) r p(H) = k p H θRCHCH θH, whereas termination of RCHCH is described by (17) r t = k t θRCHCH θH It appears reasonable that hydrogenation of vinylene to vinylidene is an equilibrium reaction: (18) KRCH2CH = (θRCH2CH θv/(θRCHCH θH) forcing enhanced chain growth when the insertion rate toward RCHCH increases. The resulting expression for α, with r p = r p(CH), is (19) αn = 1/{1 + (k t θRCH2CH θv)/(k p CH KRCH2CH θRCH θCH)} The expression for α is intuitively reasonable as it depends on the relative propensity for vinylene to be hydrogenated toward an α-olefin product or to a vinylidene ready for further chain growth. Living polymerization with kt = 0 corresponds to α = 1. Introducing the surface coverage of CH* from Eq. 10 gives (20) αn = 1/{1 + kα (θRCH2CH)/θRCH)/(PCO PH2O)} with kα = k t /k p CH KRCH2CH (kCH/k-CH2-) KCHO KCO KH2O. For two consecutive chain lengths, θRCH2CH ≈ θRCH and (21) αn ≈ 1/{1 + kα/(PCO PH2O)} At first sight, it is astonishing that αn does not depend on the partial pressure of hydrogen. This agrees with the work of Oosterbeek et al. [43]. It is well known that lower H2/CO feed ratio lifts α. A reduced partial pressure in hydrogen is, however, reflected in enhanced pressures of CO and H2O, giving the expected response. The mechanistic rationale is that more CO or H2O is available for generation of CH* monomers meaning that θCH and the propagation rate increase. Alternative assumptions, like CHO* being in a steady state, give invariance to PH2O. In practice, we adopt the following modified dependency of water, where y is a variable that accounts for the mentioned variations of the reaction mechanism: (22) αn ≈ 1/{1 + kα/(PCO PH2O y)} n >1; 0 < y ≤ 1 3.3 Formation of methane Formation of methane is derived similarly from surface coverages of the CHx surface pool. (23) CH* + H* ↔ CH2* + * KCH2 = θCH2 θv/(θCH θH) (24) CH2* + H* ↔ CH3* + * KCH3 = θCH3 θv/(θCH2 θH) (25) CH3* + H*→ CH4 (g) + 2* rCH4 = kCH4̓ θCH3 θH Eliminating the surface concentrations of CH2* and CH3* yields (26) rCH4 = kCH4̓ KCH2 KCH3 θCH θH 3/ θv 2 with substitutions from Eqs. (4), (10), (11) and (12); (27) rCH4 = rFT (kCH4̓/k-CH2-) KCH2 KCH3 PH2 = rFT kCH4 PH2 where the explicit expression is obtained by using rFT from Eq. (12) or (13). The first propagation probability, α1, is defined by; rCH4 as termination reaction, and the chain initiation reaction; see Fig. 1: (28) r1p = k1p θCH θCH2; α1 = 1/{1 + (kCH4̓ KCH3/k1p) (θH 2/(θCH θv))} giving (29) α1 = 1/{1 + kα1 PH2/(PCO PH2O)} where kα1 is a function of four rate constants and five equilibrium constants. Interestingly, Eq. 29 is equivalent to the general αn expression in Eq. 21 with the added PH2 dependency. This complies with the extra PH2 term for rCH4 compared to rFT and complies with methane selectivity depending on the hydrogen partial pressure. 4 Kinetic modelling 4.1 Fischer-Tropsch reactions The kinetic modelling is based on derivations described previously where components of five carbon atoms and more are lumped into two lumps, one for the paraffins and one for the olefins, while the rest are individual components: (30) r1: CO + U1 H2 → ѵ1,1CH4 + ѵ2,1C2H6 + ѵ3,1C3H8 + ѵ4,1C4H10 + ѵ[5,∞],1C5 p + H2O (31) r2: CO + U2 H2 → ѵ1,2CH4 + ѵ2,2C2H6 + ѵ3,2C3H8 + ѵ4,2C4H10 + ѵ[5,∞],2C5 o + H2O (32) r3: CO + 3 H2 → CH4 + H2O (33) r4: C2H4 + 2 H2 + CO → Ʃѵi,4C2i+1H2i+4 + H2O Here, U1 and U2 are consumption ratios of hydrogen uniquely defined by the stoichiometric coefficients ѵ and the chain propagation probabilities αp and αo for paraffins and olefins, respectively [69]. The relationship between these stoichiometric equations and the mechanistic framework developed above is the following: r1: The rate for reaction r1 making paraffins is approximated by rFT of Eq. 13 with the chain propagation probability given by αn of Eq. 22 using the notations rFT p and αn p. r2: Similarly, the olefin rate for reaction r2 also is approximated by rFT of Eq. 13 with the chain propagation probability given by αn of Eq. 22, but now using the notations rFT o and αn o. Scaling factors are used such that (34) rFT o = 0.1 rFT p and αn o = αn p e−0.27. r3: Methane rate is modelled by Eq. 27, but with subtraction of the methane already accounted for by the reactions of Eqs. 30 and 31. r4: Reaction for further insertion and polymerization of ethene is applied to account for the abnormally very low concentration of C2 components; but do not rely on a specific mechanism. In fact, an alternative possibility is that the C2 intermediate is less prone to termination for energetic reasons and preferably proceed to chain initiation; see Fig. 1. (35) rC2 = 0.5 PCO*PC2H4*PH2 2 (rate constant = 0.25 for C14); αC2 = 0.7 αn p. Note that in the present simulations, formation of olefins and paraffins are modelled as the individual reactions r1 and r2 and are not linked to any detailed mechanism like paraffins being a secondary product of hydrogenation. This is of no consequence for the focus of the present work; fitting CO conversion, and C5+ and CH4 selectivities, to observed data and testing key elements of the mechanism. 4.2 Deactivation To model real data, deactivation has to be taken into account. We have implemented a conceivably simple deactivation function (36) da/dt = −kd an PH2O γ with n = 2; γ ≈1 with only one variable parameter, kd, that changes from catalyst to catalyst. As shown below, this parameter describes the data well. Although a detailed mechanistic interpretation of deactivation is not under scrutiny, the a2 term can be visualized as sintering where two cobalt sites collapse into one, while PH2O takes care of cobalt oxidation under enhanced water vapor pressures: (37) Co* + Co* → 2Co* and Co* + H2O → CoO + H2 5 Results and discussion 5.1 Activity response The investigated γ-alumina supports span a variety in pore sizes and pore size distributions as these characteristics severely influence both selectivity and water responses; see the Introduction and references [3,66]. Experimental and modelled activity responses for the narrow pore catalyst C3 are compared in Fig. 2 . Conversion is lifted to 50% from period A to B by adjusting Gas-Hourly-Space-Velocity (GHSV). The observed deactivation in period B is accelerated by adding water in period C and even more by adding a significant amount of water in period D. Note the abrupt negative response to water in the start of these periods, showing that the coefficient f of Eq. 13 outweighs the positive water response in the nominator of the equation. Returning to the initial conditions of period B in period E quantifies the deactivation of the interjacent periods, and shows that deactivation is reduced as the reaction proceeds. According to the model, the main cause of deactivation is oxidation in the periods where water is added, and sintering in the dry syngas periods. It is gratifying that the observed conversion is captured well by using the water assisted vinylene mechanism and a simplified deactivation model. Some deviations are seen in the beginning of each period, most noticeable for period C, that are ascribed to slow diffusion of water into the pores of the catalyst until a steady gas composition is attained. Added water feed is stopped at the start of period E. That the present mechanistic framework is capable of modelling activity responses for catalysts with different pore structures and on different substrate materials is illustrated in Fig. 3 . For all the catalysts a reasonable fit is achieved. Catalyst C14 on α-alumina, and to a minor extent catalyst C10, show positive responses to added water in period C, while excess water in period D evidently overloads the cobalt surface with water; leaving too little space for hydrogen and CO. The water assisted CO dissociation model supports previously reported trends in water response [2]. Period C indicates that FT-activity improves with water concentration, - as pores becomes larger, - as the pore size distribution becomes narrower, and - as the support becomes more inert, e.g., γ-alumina → α-alumina. Therefore, we infer that activity responds positively to water for more inert supports, this originating in the material composition or in the crystallite size. Note that narrow pores are associated with smaller alumina crystallites and higher roughness of the surface. The mentioned overloading with possible condensation of water, i.e., period D and possibly period C for catalyst C3, is expected to be more severe for narrow pores and surfaces containing high concentration of hydroxyl groups. 5.2 Deactivation The deactivation function of Eq. 36 is analyzed further in Fig. 4 . Upper curves show deactivation as modelled; supporting the previous statements of accelerated deactivation when water is added. Expected relaxed deactivation with TOS is seen by comparing period E with period B. At first sight, it is astonishing that the deactivation rate is practically unchanged when going from the first to the second water addition period, i.e., from period C to D, with larger addition of water to the syngas. One possible explanation is that water condenses giving no additional change in fugacity. After all, the water vapor pressure is 7 bar at the inlet to the reactor, increasing typically to 10.5 bar at the exit in period D; meaning more than half the total pressure. An additional factor is self-compensation as the deactivation rate is reduced when the catalyst already is deactivated; both due to lower water vapor pressure at lower conversion levels, and that the catalyst becomes less prone to sintering and oxidation with time. Deactivation evidently also depends on the catalyst formulation. As might be expected, the catalyst on α-alumina, C14, deactivates the least. This catalyst has the largest and most regular crystallites suppressing both oxidation and sintering, in contrast to catalysts C10 and C11 (yellow and blue lines). It is highly surprising that the catalyst on narrow pore γ-alumina, with the smallest and presumably most distorted cobalt crystallites, C3, has deactivation comparable to C14. Previously we attributed abnormal behavior of the C3 catalyst to condensation of water in narrow pores [2]. Indeed, this interpretation falls in line with the statement above that condensation of water can suppress deactivation. Observed conversion corrected for deactivation is shown in the bottom half of Fig. 4. Now, the qualitative statements on how the different catalysts respond to water addition becomes self-evident. First, let us re-establish that crowding the surface with water in period D suppresses syngas conversion. Still, the effect is moderate for catalysts C14 and to some extent for C10. Significant differences with catalyst support are exhibited in period C with more moderate water addition to syngas. The most significant conclusion is that the α-alumina supported catalyst C14 responds very favorably to water; on par with titania as support [70]. Further, it is evident that γ-alumina can give rise to very different behavior of the catalyst with respect to water. In other words, there is no universal γ-alumina supported catalyst or properties that can be ascribed to γ-alumina. These variations for γ-alumina based catalysts are highlighted when comparing catalysts C10 and C11; two catalysts with similarities in overall average characteristics, see Table 3, but with very different performances. Additional insight into deactivation is attempted in Fig. 5 where the derived deactivation rate constant, kd, is plotted as a function of cobalt dispersion. Note that it has been possible to assign a single value for kd through the entire experimental sequence for a given catalyst. This constant is compared with the space velocity needed to achieve 50% CO conversion. There is approximate linear correlation between GHSV and cobalt dispersion, indicating that the turn-over-frequency (TOF) per exposed cobalt atom is constant. The lower-than-expected GHSV needed for C3 complies with detected structure sensitivity for Co FT-catalysts observed for crystallite sizes below 8 nm [71]. As foreseen, deactivation increases with dispersion, i.e., when cobalt is well dispersed on the surface of the support and more exposed to sintering and oxidation. Again, the disruption for C3 is evident. 5.3 Selectivity Selectivities to methane an C5+ are compared in Figs. 6– 9 for the four catalysts. The model fit represents the experimental values rather well in light of the large variation in catalyst properties, experimental conditions during a run and the deactivation that takes place. For all changes in experimental conditions, i.e., going from one of the periods A-D to the next period, the responses on methane and C5+ are reciprocal. This is partly a consequence of the carbon balance, but not entirely. Most remarkable is the ability of the mechanism to represent these variations with an expression for the chain propagation probability α that does not contain the partial pressure of hydrogen. Another feature of both the experimental data and the model prediction is that addition of water to the reactor in period C improves the selectivity to C5+, and reduces the selectivity to methane; even more so in period D with higher water level. Deactivation was analyzed in some detail above, and we now also experience a significant impact of deactivation on selectivities. Most distinct is the effects in periods B and C. In period B it is expected that sintering is the main mechanism, while oxidation plays a significant role in period C. Sintering reduces the C5+ selectivity for catalysts C3, C10 and C11, see Figs. 6–8. The effect is very significant for catalyst C3 as is expected from the small average Co crystallite size of this catalyst; cf. Table 3. In contrast, no sintering is observed for catalyst C14 on α- alumina support; Fig. 9. This apparent lack of sintering is expected from the large Co crystallite size of 19 nm, but alternatively follows from the structure insensitivity to cobalt crystallite size in the region from 15 nm and above. In fact, the effect of Co crystallite size on selectivities was studied previously is some detail. It was found, for γ-alumina as catalyst support, that the C5+ selectivity increases from 3 nm to 8 nm, followed by decrease to ca. 12 nm, followed by leveling out for larger crystallites [72]. Thus, the present observations are in good compliance with literature data. Structure sensitivity from sintering is also apparent in the CO-conversion plots on Figs. 2 and 3 where catalyst C3 shows largest effect and C14 the least. All data are on the right-hand side of the volcano plot for TOF as a function of Co size [72]. There is also a minor synergistic effect in that lower conversion produces less water that again has a negative effect on production of higher hydrocarbons. The present selectivity model does not include any correction for deactivation and, therefore, some deviations from experimental data are expected. The model catches variations in CO-conversion; see the downward trend of the C5+ line in period B (Fig. 7), and the difference in selectivity between periods B and E. On the other hand, it has presently not been possible to include sintering or oxidation as part of the selectivity simulations. It follows that largest deviations between experiments and model predictions in period E are found for the most deactivated catalysts C10 and C11. The effect on selectivity by the strong deactivation in period C is less evident, partly due to overlapping with a transient period where water diffuses into the pores of the catalyst. 5.4 Parameter estimation The estimated parameters are summarized in Table 4 . These encompasses the overall rate constant kFT ; CO and hydrogen coverage parameters a and b, respectively, with a kept constant; direct water parameter f for water coverage; PH2Oᵒ for initial water concentration; y for water sensitivity of α; rate constant kCH4 for methane formation; deactivation constant kd ; and chain termination to propagation constant kα . The initial observation is that all constants have reasonable values. In contrast to other reports on kinetics, there is no need for extreme values to fit the data. No negative parameters are inferred from the fitting algorithm. However, due to the complex relationships to individual rate constants for specific reactions, adsorption coefficients and equilibrium constants, no attempt has been made to deduce such fundamental data. It is worthwhile to analyze some of the parameters in detail. The three parameters reflecting the effect of water are plotted in Fig. 10 for the four catalysts at hand. The linear relationships for PH2Oᵒ and y with dispersion, i.e., inverse cobalt crystallite size based on hydrogen chemisorption, is remarkable. Evidently, the lowest initial water pressure PH2Oᵒ is needed for C14; large crystallites require low GHSV for 50% conversion (Table 4), and therefore might be less sensitive to start-up conditions. However, it should be realized that the model is based on steady-state conditions, and the mechanism cold be somewhat different during start-up. Simultaneously, the large well-shaped cobalt crystallites of C14 respond most strongly to water vapor pressure, parameter y, for the ASF α-value. Recall that α does not depend on the hydrogen partial pressure, but is favored by conditions that facilitate activation of CO with subsequent production of CH* monomers. It appears as if water is most effective for activation of CO when there is a well-defined lateral surface of cobalt. The variations in the water coverage parameter f are more erratic. Nevertheless, it is consistent with the other observations for the high dispersion catalyst C3 that water plays a minor role when it presumably is in condensed form. 6 Conclusions • The water assisted vinylene mechanism for cobalt Fischer-Tropsch synthesis have been detailed for CH* as monomer and expanded to include selectivity to methane. • Langmuir-Hinshelwood kinetic expression has been developed based on formyl in equilibrium with CO and direct dissociation of formyl with water. • The selected mechanism follows from the associated chain propagation probability α being independent of hydrogen partial pressure, but dependent on water partial pressure. • Activity data for 4 FT-catalyst with varying properties have been corrected for deactivation using a sintering/oxidation model. • Derived deactivation constant for sintering correlates with cobalt dispersion; except for a narrow pore alumina where condensation of water appears to inhibit deactivation. • Kinetic simulations for CO-conversion, C5+ selectivity and methane selectivity show good fit with experimental data. • In particular, the effect of indigenous and added water is well described by the model. The C5+ selectivity response to water follows inversely cobalt dispersion; large cobalt crystallites respond more positively to water. This is caught in the adjustable water parameter in the expression for α. Justification for publication We find this journal to be of high quality and very suitable for publishing the work as it contains both mechanistic features, kinetics, experimental work and modelling, including deactivation. It therefore is both of fundamental nature and contains useful insight and formulations for application of Fischer-Tropsch (FT) synthesis. Novel aspects of the work comprise: - Full mechanistic (LH) formulation of the previously proposed vinylene mechanism for cobalt FT synthesis, including reaction rate, the α-chain propagation probability, and methane selectivity. - First expression and kinetic modelling that take into account both positive and negative effects of produced water for FT-synthesis. - First multi catalyst FT kinetic modelling; includes a large variety of responses to process conditions. - First kinetic FT modelling that includes mechanistic based deactivation mechanisms. CRediT authorship contribution statement Erling Rytter: Conceptualization, Methodology, Writing – original draft, Visualization. Anders Runningen: Formal analysis, Investigation. Edd Blekkan: Validation, Supervision, Project administration, Funding acquisition. Magne Hillestad: Methodology, Supervision, Resources. Declaration of Competing Interest The authors declare that they have no known competing financial interests or personal relationships that could have appeared to influence the work reported in this paper. Acknowledgements Financial support from The Research Council of Norway under Contracts no. 228741 and 280846 is gratefully acknowledged. The experimental work was conducted by Øyvind Borg in connection with his Ph.D. thesis as reported previosly3,67,68,74. The present work relies on the actual recorded reaction profiles as TOS. References [1] E. Rytter A. Holmen Perspectives on the effect of water in cobalt Fischer-Tropsch synthesis ACS Catal. 7 8 2017 5321 5328 E. Rytter, A. Holmen, Perspectives on the effect of water in cobalt Fischer-Tropsch synthesis,ACS Catal.7(8) (2017) 5321–5328. [2] E. Rytter N. Tsakoumis A. Holmen Water as key to activity and selectivity in Co Fischer-Tropsch synthesis: γ–alumina based structure-performance relationships J. Catal. 365 2018 334 343 E. Rytter, N. Tsakoumis, A. Holmen, Water as key to activity and selectivity in Co Fischer-Tropsch synthesis: γ–alumina based structure-performance relationships, J. Catal.365 (2018) 334–343. [3] E. Rytter Ø. Borg B.C. Enger A. Holmen, α-alumina as catalyst support in Co Fischer-Tropsch synthesis and the effect of added water; encompassing transient effects J. Catal. 373 2019 13 24 E. Rytter, Ø. Borg, B.C. Enger, A. Holmen, α-alumina as catalyst support in Co Fischer-Tropsch synthesis and the effect of added water; encompassing transient effects, J. Catal.373 (2019) 13–24. [4] S. Storsæter Ø. Borg E.A. Blekkan B. Tøtdal A. Holmen Fischer-Tropsch synthesis over Re-promoted Co supported on Al2O3, SiO2 and TiO2: effect of water Catal. Today 100 2005 343 347 S. Storsæter, Ø. Borg, E.A. Blekkan, B. Tøtdal, A. Holmen, Fischer-Tropsch synthesis over Re-promoted Co supported on Al2O3, SiO2 and TiO2: effect of water, Catal. Today, 100 (2005) 343–347. [5] G. Jacobs T.K. Das P.M. Patterson J. Li L. Sanches B.H. Davis Fischer-Tropsch synthesis: XAFS studies of the effect of water on a Pt-promoted Co/Al2O3 catalyst Appl. Catal. A 247 2003 335 343 G. Jacobs, T.K. Das, P.M. Patterson, J. Li, L. Sanches, B.H. Davis, Fischer-Tropsch synthesis: XAFS studies of the effect of water on a Pt-promoted Co/Al2O3 catalyst, Appl. Catal. A247 (2003) 335–343. [6] D. Schanke A.-M. Hilmen E. Bergene K. Kinnari E. Rytter E. Ådnanes A. Holmen Study of the deactivation mechanism of Al2O3-supported cobalt Fischer-Tropsch catalyst Catal. Lett. 34 1995 269 284 D. Schanke, A.-M. Hilmen, E. Bergene, K. Kinnari, E. Rytter, E. Ådnanes, A. Holmen, Study of the deactivation mechanism of Al2O3-supported cobalt Fischer-Tropsch catalyst, Catal. Lett.34 (1995) 269–284. [7] E.A. Blekkan Ø. Borg V. Frøseth A. Holmen A. Fischer-Tropsch synthesis on cobalt catalysts: the effect of water Catalysis 2007 The Royal Society Cambridge, UK 13 32 vol.20 E.A. Blekkan, Ø. Borg, V. Frøseth, A. Holmen, A. Fischer-Tropschsynthesis on cobalt catalysts: the effect of water, in: Catalysis, vol.20, The Royal Society, Cambridge, UK, 2007, pp. 13–32. [8] N.E. Tsakoumis E. Patanou S. Lögdberg R.E. Johnsen R. Myrstad W. van Beek E. Rytter E.A. Blekkan Structure-performance relationships on Co based Fischer-Tropsch synthesis catalysts; the more defect free the better ACS Catalysis, ACS Catal. 9 2019 511 520 N.E. Tsakoumis, E. Patanou, S. Lögdberg, R.E. Johnsen, R. Myrstad, W. van Beek, E. Rytter, E.A. Blekkan, Structure-performance relationships on Co based Fischer-Tropsch synthesis catalysts; the more defect free the better, ACS Catalysis, ACS Catal., 9 (2019) 511–520. [9] S. Krishnamoorthy M. Tu M.P. Ojeda D. Pinna E. Iglesia An investigation of the effects of water on rate and selectivity for the Fischer-Tropsch synthesis on cobalt-based catalysts J. Catal. 211 2002 422 433 S. Krishnamoorthy, M. Tu, M.P. Ojeda, D. Pinna, E. Iglesia, An investigation of the effects of water on rate and selectivity for the Fischer-Tropsch synthesis on cobalt-based catalysts, J. Catal.211 (2002) 422–433. [10] R.B. Anderson R.A. Friedel H.H. Storch Fischer-Tropsch reaction mechanism involving stepwise growth of carbon chain J. Chem. Phys. 19 1951 313 319 R.B. Anderson, R.A. Friedel, H.H. Storch, Fischer-Tropsch reaction mechanism involving stepwise growth of carbon chain, J. Chem. Phys.19 (1951) 313–319. [11] A.M. Saib M. Claeys E. van Steen Silica supported cobalt Fischer-Tropsch catalysts: effect of pore diameter of support Catal. Today 71 2002 395 402 A.M. Saib, M. Claeys, E. van Steen, Silica supported cobalt Fischer-Tropsch catalysts: effect of pore diameter of support, Catal. Today71 (2002) 395–402. [12] L. Fratalocchi C.G Visconti L. Lietti G. Groppi E. Tronconi E. Roccaro R. Zennaroi On the performance of a Co-based catalyst supported on modified γ-Al2O3 during Fischer-Tropsch synthesis in the presence of co-fed water Catal. Sci. Technol. 6 2016 6431 6440 L. Fratalocchi, C.G Visconti, L. Lietti, G. Groppi, E. Tronconi, E. Roccaro, R. Zennaroi, On the performance of a Co-based catalyst supported on modified γ-Al2O3 during Fischer-Tropsch synthesis in the presence of co-fed water, Catal. Sci. Technol.6 (2016) 6431–6440. [13] F. Fischer H. Tropsch Uber die Herstellung synthetischer olgemische durch Aufbau aus Kohlenoxyd und Wasserstoff Brennst. Chem. 7 1926 97 104 F. Fischer, H. Tropsch, Uber die Herstellung synthetischer olgemische durch Aufbau aus Kohlenoxyd und Wasserstoff, Brennst. Chem.7 (1926) 97–104 [14] A.T. Bell Catalytic synthesis of hydrocarbons over group VIII metals. A discussion of the reaction mechanism Catal. Rev. Sci. Eng. 23 1981 203 232 A.T. Bell, Catalytic synthesis of hydrocarbons over group VIII metals. A discussion of the reaction mechanism, Catal. Rev. Sci. Eng.23 (1981) 203–232. [15] M.E. Dry Practical and theoretical aspects of the catalytic Fischer-Tropsch process Appl. Catal. A 138 1996 319 344 M.E. Dry, Practical and theoretical aspects of the catalytic Fischer-Tropsch process, Appl. Catal. A138 (1996) 319–344. [16] S.A. Eliason C.H. Bartholomew Reaction and deactivation kinetics for Fischer-Tropsch synthesis on unpromoted and potassium-promoted iron catalysts Appl. Catal. A 186 1999 229 243 S.A. Eliason, C.H. Bartholomew, Reaction and deactivation kinetics for Fischer-Tropsch synthesis on unpromoted and potassium-promoted iron catalysts, Appl. Catal. A186 (1999) 229–243. [17] R. Quyoum V. Berdini L.M. Turner C.H. Long M.P. Maitlis Mechanistic studies of methylene chain propagation in the Fischer–Tropsch synthesis J. Catal. 173 1998 355 365 R. Quyoum, V. Berdini, L.M. Turner, C.H. Long, M.P. Maitlis, Mechanistic studies of methylene chain propagation in the Fischer–Tropsch synthesis, J. Catal.173 (1998) 355–365. [18] J. Gaube H.F. Klein Further support for the two-mechanisms hypothesis of Fischer–Tropsch synthesis Appl. Catal. A 374 2010 120 125 J. Gaube, H.F. Klein, Further support for the two-mechanisms hypothesis of Fischer–Tropsch synthesis, Appl. Catal. A374 (2010) 120–125. [19] G.P. van der Laan A.A.C.M. Beenackers Intrinsic kinetics of the gas-solid Fischer-Tropsch and water gas shift reactions over a precipitated iron catalyst Appl. Catal. A 193 2000 39 53 G.P. van der Laan, A.A.C.M. Beenackers, Intrinsic kinetics of the gas-solid Fischer-Tropsch and water gas shift reactions over a precipitated iron catalyst, Appl. Catal. A193 (2000) 39–53. [20] W.K. Hall R.J. Kokes P.H. Emmett Mechanism studies of the Fischer-Tropsch synthesis: the incorporation of radioactive ethylene, propionaldehyde and propanol J. Am. Chem. Soc. 82 1960 1027 1037 W.K. Hall, R.J. Kokes, P.H. Emmett, Mechanism studies of the Fischer-Tropsch synthesis: the incorporation of radioactive ethylene, propionaldehyde and propanol, J. Am. Chem. Soc.82 (1960) 1027–1037. [21] H. Pichler H. Schulz Neuere Erkenntnisse auf dem Gebiet der Synthese von Kohlenwasserstoffen aus CO und H2 Chem. Ing. Technol. 42 1970 1162 1174 H. Pichler, H. Schulz, Neuere Erkenntnisse auf dem Gebiet der Synthese von Kohlenwasserstoffen aus CO und H2, Chem. Ing. Technol.42 (1970) 1162–1174. [22] J.P. Hindermann G.J. Hutchings A. Kiennemann Mechanistic aspects of the formation of hydrocarbons and alcohols from CO hydrogenation Catal. Rev. Sci. Eng. 35 1993 1 127 J.P. Hindermann, G.J. Hutchings, A. Kiennemann, Mechanistic aspects of the formation of hydrocarbons and alcohols from CO hydrogenation, Catal. Rev. Sci. Eng.35 (1993) 1–127. [23] M. Zhuo K.F. Tan A. Borgna M. Saeys Density functional theory study of the CO insertion mechanism for Fischer-Tropsch synthesis over Co catalysts J. Phys. Chem. C 113 2009 8357 8365 M. Zhuo, K.F. Tan, A. Borgna, M. Saeys, Density functional theory study of the CO insertion mechanism for Fischer-Tropsch synthesis over Co catalysts, J. Phys. Chem. C113 (2009) 8357–8365. [24] H.H. Storch N. Golumbic R.B. Anderson The Fischer–Tropsch and related syntheses 1951 Wiley New York H.H. Storch, N. Golumbic, R.B. Anderson, The Fischer–Tropsch and related syntheses, Wiley, New York, 1951. [25] S. Storsæter D. Chen A. Holmen Microkinetic modelling of the formation of C1 and C2 products in the Fischer-Tropsch synthesis over cobalt catalysts Surf. Sci. 600 2006 2051 2063 S. Storsæter, D. Chen, A. Holmen, Microkinetic modelling of the formation of C1 and C2 products in the Fischer-Tropsch synthesis over cobalt catalysts, Surf. Sci., 600 (2006) 2051–2063. [26] C.F. Huo Y.W. Li J. Wang H. Jiao Formation of CHx species from CO dissociation on double-stepped Co(0001): exploring Fischer-Tropsch mechanism J. Phys. Chem. C 112 2008 14108 14116 C.F. Huo, Y.W. Li, J. Wang, H. Jiao, Formation of CHx species from CO dissociation on double-stepped Co(0001): exploring Fischer-Tropsch mechanism, J. Phys. Chem. C112 (2008) 14108–14116. [27] O.R. Inderwildi S.J. Jenkins D.A. King Fischer-Tropsch mechanism revisited: alternative pathways for the production of higher hydrocarbons from synthesis gas J. Phys. Chem. C 112 2008 1305 1307 O.R. Inderwildi, S.J. Jenkins, D.A. King, Fischer-Tropsch mechanism revisited: alternative pathways for the production of higher hydrocarbons from synthesis gas, J. Phys. Chem. C112 (2008) 1305–1307. [28] M. Ojeda R. Nabar A.U. Nilikar A. Ishikawa M. Mavrikakis E. Iglesia CO activation pathways and the mechanism of Fischer-Tropsch synthesis J. Catal. 272 2010 287 297 M. Ojeda, R. Nabar, A.U. Nilikar, A. Ishikawa, M. Mavrikakis, E. Iglesia, CO activation pathways and the mechanism of Fischer-Tropsch synthesis, J. Catal.272 (2010) 287–297. [29] P. van Helden J.A. van den Berg Ciobica I.M Hydrogen-assisted CO dissociation on the Co(211) stepped surface Catal. Sci. Technol. 2 2012 491 494 P. van Helden, J.A. van den Berg, I.M, Ciobica, Hydrogen-assisted CO dissociation on the Co(211) stepped surface, Catal. Sci. Technol.2 (2012) 491–494. [30] C.G. Visconti E. Tronconi L. Lietti P. Forzatti S. Rossini R. Zennaro Detailed kinetics of the Fischer-Tropsch synthesis on cobalt catalysts based on H-assisted CO activation Top. Catal. 54 2011 786 800 C.G. Visconti, E. Tronconi, L. Lietti, P. Forzatti, S. Rossini, R. Zennaro, Detailed kinetics of the Fischer-Tropsch synthesis on cobalt catalysts based on H-assisted CO activation, Top. Catal.54 (2011) 786–800. [31] E. Rytter A. Holmen Consorted vinylene mechanism for cobalt Fischer-Tropsch synthesis encompassing water or hydroxyl assisted CO-activation Topics Catal. 61 2018 1024 1034 E. Rytter, A. Holmen, Consorted vinylene mechanism for cobalt Fischer-Tropsch synthesis encompassing water or hydroxyl assisted CO-activation, Topics Catal., 61 (2018) 1024–1034. [32] C.J. Bertole C.A. Mims G. Kiss Support and rhenium effects on the intrinsic site activity and methane selectivity of cobalt Fischer-Tropsch catalysts J. Catal. 221 2004 191 203 C.J. Bertole, C.A. Mims, G. Kiss, Support and rhenium effects on the intrinsic site activity and methane selectivity of cobalt Fischer-Tropsch catalysts, J. Catal.221 (2004) 191–203. [33] S. Krishnanmoorthy M. Tu M.P. Ojeda D. Pinna E. Iglesia An investigation on the effects of water on the rate and selectivity for the Fischer-Tropsch synthesis on cobalt-based catalysts J. Catal. 211 2 2002 422 433 S. Krishnanmoorthy, M. Tu, M.P. Ojeda, D. Pinna, E. Iglesia, An investigation on the effects of water on the rate and selectivity for the Fischer-Tropsch synthesis on cobalt-based catalysts, J. Catal.211(2) (2002) 422–433 [34] D.D. Hibbits B.T. Loveless M. Neurock E. Iglesia Mechanistic impact of water during Fischer-Tropsch synthesis on Ru catalysts Angew. Chem. Int. Ed. 20 2013 12273 12278 D.D. Hibbits, B.T. Loveless, M. Neurock, E. Iglesia, Mechanistic impact of water during Fischer-Tropsch synthesis on Ru catalysts, Angew. Chem. Int. Ed.20 (2013) 12273–12278 [35] R.A. van Santen A.J. Markvoort M.M. Ghouri P.A.J. Hilbers E.J.M. Hensen Monomer formation model versus chain growth model of the Fischer-Tropsch reaction J. Phys. Chem. C 117 2013 4488 4504 R.A. van Santen, A.J. Markvoort, M.M. Ghouri, P.A.J. Hilbers, E.J.M. Hensen, Monomer formation model versus chain growth model of the Fischer-Tropsch reaction, J. Phys. Chem. C117 (2013) 4488–4504. [36] K. Keyvanloo S.J. Lanham W.C. Hecker Kinetics of Fischer-Tropsch synthesis on supported cobalt: effect of temperature on CO and H2 partial pressure dependencies Catal. Today 270 2016 9 18 K. Keyvanloo, S.J. Lanham, W.C. Hecker, Kinetics of Fischer-Tropsch synthesis on supported cobalt: effect of temperature on CO and H2 partial pressure dependencies, Catal. Today270 (2016) 9–18. [37] M. Ostadi E. Rytter M. Hillestad Evaluation of kinetic models for Fischer-Tropsch cobalt catalysts in a plug flow reactor Chem. Eng. Res. Des. 114 2016 236 246 M. Ostadi, E. Rytter, M. Hillestad, Evaluation of kinetic models for Fischer-Tropsch cobalt catalysts in a plug flow reactor, Chem. Eng. Res. Des., 114 (2016) 236–246 [38] B. Todic W. Ma G. Jacobs B.H. Davis D.B. Bukur CO-insertion mechanism based kinetic model of the Fischer-Tropsch synthesis reaction over Re-promoted Co catalyst Catal. Today 228 2014 32 39 B. Todic, W. Ma, G. Jacobs, B.H. Davis, D.B. Bukur, CO-insertion mechanism based kinetic model of the Fischer-Tropsch synthesis reaction over Re-promoted Co catalyst, Catal. Today, 228 (2014) 32–39. [39] A. Mosayebi A. Haghtalab The comprehensive kinetic modeling of the Fischer-Tropsch synthesis over Co@Ru/g-Al2O3 core-shell structure catalyst Chem. Eng. J. 259 2015 191 204 A. Mosayebi, A. Haghtalab, The comprehensive kinetic modeling of the Fischer-Tropsch synthesis over Co@Ru/g-Al2O3 core-shell structure catalyst, Chem. Eng. J., 259 (2015) 191–204. [40] R.A. van Santen A.J. Markvoort I.A.W. Filot M.M. Ghouri E.J.M. Hensen Mechanism and micro-kinetics of the Fischer-Tropsch reaction Phys. Chem. Chem. Phys. 15 2013 17038 17063 R.A. van Santen, A.J. Markvoort, I.A.W. Filot, M.M. Ghouri, E.J.M. Hensen, Mechanism and micro-kinetics of the Fischer-Tropsch reaction, Phys. Chem. Chem. Phys., 15 (2013) 17038–17063. [41] C.G. Visconti E. Tronconi L. Lietti R. Zennaro P. Forzatti Development of a complete kinetic model for the Fischer-Tropsch synthesis over Co/Al2O3 catalysts Chem. Eng. Sci. 62 2007 5338 5343 C.G. Visconti, E. Tronconi, L. Lietti, R. Zennaro, P. Forzatti, Development of a complete kinetic model for the Fischer-Tropsch synthesis over Co/Al2O3 catalysts, Chem. Eng. Sci., 62 (2007) 5338–5343 [42] M.A. Vannice Kinetics of Catalytic Reactions 2005 Springer New York M.A. Vannice, Kinetics of Catalytic Reactions, Springer, New York, 2005. [43] H. Oosterbeek A.P. van Bavel Effect of CO coverage on the product slate in FTS Extended abstract 992, 11th Natural Gas Conversion Symposium, 5-9 June Tromsø, Norway 2016 H. Oosterbeek, A.P. van Bavel, Effect of CO coverage on the product slate in FTS, Extended abstract 992, 11th Natural Gas Conversion Symposium, 5-9 June, Tromsø, Norway, 2016. [44] H.P. Withers Jr. K.F. Eliezer J.W. Mitchell Slurry-phase Fischer-Tropsch synthesis and kinetic studies over supported cobalt carbonyl derived catalysts Ind. Eng. Chem. Res. 29 1990 1807 1814 H.P. Withers Jr., K.F. Eliezer, J.W. Mitchell, Slurry-phase Fischer-Tropsch synthesis and kinetic studies over supported cobalt carbonyl derived catalysts, Ind. Eng. Chem. Res.29 (1990) 1807–1814. [45] E. van Steen H. Schulz Polymerisation kinetics of the Fischer-Tropsch CO hydrogenation using iron and cobalt-based catalysts Appl. Catal. A 186 1999 309 320 E. van Steen, H. Schulz, Polymerisation kinetics of the Fischer-Tropsch CO hydrogenation using iron and cobalt-based catalysts, Appl. Catal. A186 (1999) 309–320. [46] T.K. Das W.A. Conner J. Li G. Jacobs M.E. Dry B.H. Davis Fischer-Tropsch synthesis: kinetics and effect of water for a Co/SiO2 catalyst Energy Fuels 10 2005 1430 1439 T.K. Das, W.A. Conner, J. Li, G. Jacobs, M.E. Dry, B.H. Davis, Fischer-Tropsch synthesis: kinetics and effect of water for a Co/SiO2 catalyst, Energy Fuels10 (2005) 1430–1439. [47] T. Bhatelia W. Ma G. Jacobs B.H. Davis D.B. Bukur Kinetics of the Fischer-Tropsch reaction over a Ru promoted Co/Al2O3 catalyst Chem. Eng. Trans. 25 2011 707 712 T. Bhatelia, W. Ma, G. Jacobs, B.H. Davis, D.B. Bukur, Kinetics of the Fischer-Tropsch reaction over a Ru promoted Co/Al2O3 catalyst, Chem. Eng. Trans.25 (2011) 707–712. [48] W. Qian H. Zhang W. Ying D. Fang The comprehensive kinetics of Fischer-Tropsch synthesis over a Co/AC catalyst on the basis of CO insertion mechanism Chem. Eng. J. 228 2013 526 534 W. Qian, H. Zhang, W. Ying, D. Fang, The comprehensive kinetics of Fischer-Tropsch synthesis over a Co/AC catalyst on the basis of CO insertion mechanism, Chem. Eng. J.228 (2013) 526–534. [49] W. Ma G. Jacobs D.E. Sparks R.L. Spicer B.H. Davis J.L.S. Klettlinger C.H. Yen Fischer-Tropsch synthesis: kinetics and water effect study over 25%Co/Al2O3 catalysts Catal. Today 228 2014 158 166 W. Ma, G. Jacobs, D.E. Sparks, R.L. Spicer, B.H. Davis, J.L.S. Klettlinger, C.H. Yen, Fischer-Tropsch synthesis: kinetics and water effect study over 25%Co/Al2O3 catalysts, Catal. Today228 (2014) 158–166. [50] N.E. Tsakoumis M. Rønning Ø. Borg E. Rytter Deactivation of cobalt-based Fischer-Tropsch catalysts: a review, A. Holmen Catal. Today 154 2010 162 182 N.E. Tsakoumis, M. Rønning, Ø. Borg, E. Rytter, Deactivation of cobalt-based Fischer-Tropsch catalysts: a review, A. Holmen, Catal. Today154 (2010) 162–182. [51] E. Rytter A. Holmen Deactivation and rejuvenation of commercial type Fischer-Tropsch Co-catalysts. A mini-review Catalysts 5 2015 478 499 E. Rytter, A. Holmen, Deactivation and rejuvenation of commercial type Fischer-Tropsch Co-catalysts. A mini-review, Catalysts5 (2015) 478–499. [52] D.J. Moodley J. van de Loosdrecht A.M. Saib M.J. Overett A.K. Datye J.W. Niemantsverdriet Carbon deposition as a deactivation mechanism of cobalt-based Fischer-Tropsch synthesis catalysts under realistic conditions Appl. Catal. A 354 2009 102 110 D.J. Moodley, J. van de Loosdrecht, A.M. Saib, M.J. Overett, A.K. Datye, J.W. Niemantsverdriet, Carbon deposition as a deactivation mechanism of cobalt-based Fischer-Tropsch synthesis catalysts under realistic conditions, Appl. Catal. A354 (2009) 102–110. [53] C.E. Kliever G. Kiss G.J. DeMartin Ex situ transmission electron microscopy: a fixed-bed approach Microsc. Microanal. 12 2006 135 144 C.E. Kliever, G. Kiss, G.J. DeMartin, Ex situ transmission electron microscopy: a fixed-bed approach, Microsc. Microanal.12 (2006) 135–144. [54] O. Kubaschewski C.B. Alcock Metallurgical Thermochemistry 5th ed. 1979 Pergamon New York O. Kubaschewski, C.B. Alcock, Metallurgical Thermochemistry, 5th ed.Pergamon, New York, 1979. [55] N.E. Tsakoumis J.C. Walmsley M. Rønning W. van Beek E. Rytter A. Holmen Evaluation of reoxidation thresholds for γ-Al2O3-supported cobalt catalysts under Fischer-Tropsch synthesis conditions J. Am. Chem. Soc. 139 2017 3706 3715 N.E. Tsakoumis, J.C. Walmsley, M. Rønning, W. van Beek, E. Rytter, A. Holmen, Evaluation of reoxidation thresholds for γ-Al2O3-supported cobalt catalysts under Fischer-Tropsch synthesis conditions, J. Am. Chem. Soc.139 (2017) 3706–3715. [56] M. Sadeqzadeh J. Hong P. Fongarland D. Curulla-Ferré F. Luck J. Bousquet D. Schweich A.Y. Khodakov Mechanistic modeling of cobalt-based catalyst sintering in a fixed bed reactor under different conditions of Fischer-Tropsch synthesis Ind. Eng. Chem. Res. 51 2012 11955 11964 M. Sadeqzadeh, J. Hong, P. Fongarland, D. Curulla-Ferré, F. Luck, J. Bousquet, D. Schweich, A.Y. Khodakov, Mechanistic modeling of cobalt-based catalyst sintering in a fixed bed reactor under different conditions of Fischer-Tropsch synthesis, Ind. Eng. Chem. Res.51 (2012) 11955–11964. [57] M. Sadeqzadeh S. Chambrey S. Piché P. Fongarland F. Luck D. Curulla-Ferré D. Schweich J. Bousquet A. Khodakov Deactivation of a Co/Al2O3 Fischer-Tropsch catalyst by water-induced sintering in slurry reactor: Modeling and experimental investigations Catal. Today 215 2013 52 59 M. Sadeqzadeh, S. Chambrey, S. Piché, P. Fongarland, F. Luck, D. Curulla-Ferré, D. Schweich, J. Bousquet, A. Khodakov, Deactivation of a Co/Al2O3 Fischer-Tropsch catalyst by water-induced sintering in slurry reactor: Modeling and experimental investigations, Catal. Today215 (2013) 52–59. [58] B.H. Davis E. Iglesia Technology development for iron and cobalt Fischer-Tropsch catalysts; Final technical report June 30, 2002 Univ. Kentucky Research Foundation 1474 1572 http://www.fischer-tropsch.org/DOE/DOE_reports/40308/FC26-98FT40308-f/FC26-98FT40308-f_toc.htm (accessed 4 May, 2022) B.H. Davis, E. Iglesia, Technology development for iron and cobalt Fischer-Tropsch catalysts; Final technical report, Univ. Kentucky Research Foundation, June 30, 2002, pp. 1474–1572. http://www.fischer-tropsch.org/DOE/DOE_reports/40308/FC26-98FT40308-f/FC26-98FT40308-f_toc.htm(accessed 4 May, 2022). [59] N.E. Tsakoumis R. Dehghan-Niri M. Rønning J.C. Walmsley Ø. Borg E. Rytter A. Holmen X-ray absorption, X-ray diffraction and electronic microscopy study of spent cobalt-based catalyst in semi-commercial scale Fischer-Tropsch synthesis Appl. Catal. A 479 2014 59 89 N.E. Tsakoumis, R. Dehghan-Niri, M. Rønning, J.C. Walmsley, Ø. Borg, E. Rytter, A. Holmen, X-ray absorption, X-ray diffraction and electronic microscopy study of spent cobalt-based catalyst in semi-commercial scale Fischer-Tropsch synthesis, Appl. Catal. A479 (2014) 59–89. [60] D. Krishnamurthy A.M. Saib D.J. Moodley J.W. Niemantsverdriet C.J. Weststrate Ostwald ripening on a planar Co/SiO2 catalyst exposed to model Fischer-Tropsch synthesis conditions J. Catal. 328 2015 123 129 D. Krishnamurthy, A.M. Saib, D.J. Moodley, J.W. Niemantsverdriet, C.J. Weststrate, Ostwald ripening on a planar Co/SiO2 catalyst exposed to model Fischer-Tropsch synthesis conditions, J. Catal.328 (2015) 123–129. [61] C.H. Mauldin, Cobalt catalysts for the conversion of methanol to hydrocarbons and for Fischer-Tropsch synthesis, United States patent 4,568,663, 1986. [62] S. Eri, J. Goodwin, G. Marcelin, T. Riis, Catalyst for production of hydrocarbons, United States patent 4.801.573, 1987. [63] C.H. Mauldin D.E. Varnado Rhenium as a promoter of titania-supported cobalt Fischer-Tropsch catalysts Stud. Surf. Sci. Catal. 136 2001 417 422 C.H. Mauldin, D.E. Varnado, Rhenium as a promoter of titania-supported cobalt Fischer-Tropsch catalysts, Stud. Surf. Sci. Catal.136 (2001) 417–422. [64] A.-M. Hilmen D. Schanke A. Holmen TPR study of the mechanism of rhenium promotion of alumina-supported cobalt Fischer-Tropsch catalysts Catal. Lett. 38 1986 143 147 A.-M. Hilmen, D. Schanke, A. Holmen, TPR study of the mechanism of rhenium promotion of alumina-supported cobalt Fischer-Tropsch catalysts, Catal. Lett.38 (1986) 143-147. [65] F. Diehl A.Y. Khodakov Promotion of cobalt Fischer-Tropsch catalysts with noble metals: a review Oil Gas Sci. Technol.-Rev. IFP 64 2009 11 24 F. Diehl, A.Y. Khodakov, Promotion of cobalt Fischer-Tropsch catalysts with noble metals: a review, Oil Gas Sci. Technol.-Rev. IFP64 (2009) 11–24. [66] Ø. Borg S. Eri E.A. Blekkan S. Storsæter H. Wigum E. Rytter A. Holmen Fischer-Tropsch synthesis over γ-alumina-supported cobalt catalysts: effect of support variables J. Catal. 248 2007 89 100 Ø. Borg, S. Eri, E.A. Blekkan, S. Storsæter, H. Wigum, E. Rytter, A. Holmen, Fischer-Tropsch synthesis over γ-alumina-supported cobalt catalysts: effect of support variables, J. Catal.248 (2007) 89–100. [67] Ø. Borg N. Hammer S. Eri O.A. Lindvåg R. Myrstad E.A. Blekkan M. Rønning E. Rytter A. Holmen Fischer-Tropsch synthesis over un-promoted and Re-Promoted γ–Al2O3 supported cobalt catalysts with different pore sizes Catal. Today 142 2009 70 77 Ø. Borg, N. Hammer, S. Eri, O.A. Lindvåg, R. Myrstad, E.A. Blekkan, M. Rønning, E. Rytter, A. Holmen, Fischer-Tropsch synthesis over un-promoted and Re-Promoted γ–Al2O3 supported cobalt catalysts with different pore sizes, Catal. Today142 (2009) 70–77. [68] C.G. Visconti L. Lietti E. Tronconi E P. Forzatti R. Zennaro E. Finocchio Fischer-Tropsch synthesis on a Co/Al2O3 catalyst with CO2 containing syngas Appl. Catal. A 355 2009 61 68 C.G. Visconti, L. Lietti, E. Tronconi E, P. Forzatti, R. Zennaro, E. Finocchio, Fischer-Tropsch synthesis on a Co/Al2O3 catalyst with CO2 containing syngas, Appl. Catal. A355 (2009) 61–68. [69] M. Hillestad Modeling the Fischer–Tropsch product distribution and model implementation Chem. Prod. Proc. Model. 10 2015 147 159 M. Hillestad, Modeling the Fischer–Tropsch product distribution and model implementation, Chem. Prod. Proc. Model., 10 (2015) 147–159. [70] E. Rytter A. Holmen On the support in cobalt Fischer-Tropsch: emphasis on alumina and aluminates Catal. Today 275 2016 11 19 E. Rytter, A. Holmen, On the support in cobalt Fischer-Tropsch: emphasis on alumina and aluminates, Catal. Today275 (2016) 11–19. [71] G.L. Bezemer J.H. Bitter H.P.C.E. Kuipers H. Oosterbeek J.E. Holewijn X- Xu F. Kapteijn A.J. van Dillen K.P. de Jong Cobalt particle size effects in the Fischer-Tropsch reaction studied with carbon nanofiber supported catalysts J. Am. Chem. Soc. 128 2006 3956 3964 G.L. Bezemer, J.H. Bitter, H.P.C.E. Kuipers, H. Oosterbeek, J.E. Holewijn, X- Xu, F. Kapteijn, A.J. van Dillen, K.P. de Jong, Cobalt particle size effects in the Fischer-Tropsch reaction studied with carbon nanofiber supported catalysts, J. Am. Chem. Soc.128 (2006) 3956–3964. [72] Ø. Borg P.D.C. Dietzel A.I. Spjelkavik E.Z. Tveten J.C. Walmsley S. Diplas S. Eri A. Holmen E. Rytter Fischer-Tropsch synthesis: cobalt particle size and support effects on intrinsic activity and product distribution J. Catal. 259 2008 161 164 Ø. Borg, P.D.C. Dietzel, A.I. Spjelkavik, E.Z. Tveten, J.C. Walmsley, S. Diplas, S. Eri, A. Holmen, E. Rytter, Fischer-Tropsch synthesis: cobalt particle size and support effects on intrinsic activity and product distribution, J. Catal.259 (2008) 161–164.",
      "scopus-id": "85136647093",
      "coredata": {
        "eid": "1-s2.0-S2468823122003753",
        "dc:description": "The paper describes development of a mechanism and a consistent rate expression for Fischer-Tropsch (FT) synthesis over cobalt-based catalysts. The developed mechanism relies on a two-step hydrogen assisted activation of CO. The carbon atom of CO is first hydrogenated by surface hydrogen to formyl; followed by the rate-limiting step whereby the oxygen atom is hydrogenated by adsorbed water. The produced CH* monomer is incorporated into the growing chain giving vinylene intermediate. The vinylene intermediate is either terminated to an olefin by adding hydrogen to the α-carbon atom or propagates by adding hydrogen to the β-carbon position. The resulting expression for CO consumption, the Fischer-Tropsch rate, can respond positively or negatively to the partial pressure of water, in agreement with experimental observations. A special feature is that the chain propagation probability does not depend on the partial pressure of hydrogen. The resulting kinetic model is tested on several cobalt catalysts supported on alumina; spanning from γ-alumina with average pore sizes ranging from 6.1 to 18.3 nm to α-alumina with a wide pore structure; and with cobalt particle sizes from 8 to 19 nm. Water was added sequentially to the syngas feed, causing enhanced deactivation, for testing the water response on activity and selectivity. A deactivation model comprising sintering and cobalt oxidation, and the FT-kinetics, describe the observed CO conversions with great precision for all catalysts. Selectivities are also well described, but with slight deviations at least partly due the effect of deactivation. Trends in some of the kinetic parameters are rationalized in terms of cobalt crystallite and pore sizes.",
        "openArchiveArticle": "false",
        "prism:coverDate": "2022-09-30",
        "openaccessUserLicense": "http://creativecommons.org/licenses/by/4.0/",
        "prism:aggregationType": "Journal",
        "prism:url": "https://api.elsevier.com/content/article/pii/S2468823122003753",
        "dc:creator": [
          {
            "@_fa": "true",
            "$": "Rytter, Erling"
          },
          {
            "@_fa": "true",
            "$": "Runningen, Anders"
          },
          {
            "@_fa": "true",
            "$": "Blekkan, Edd"
          },
          {
            "@_fa": "true",
            "$": "Hillestad, Magne"
          }
        ],
        "link": [
          {
            "@_fa": "true",
            "@rel": "self",
            "@href": "https://api.elsevier.com/content/article/pii/S2468823122003753"
          },
          {
            "@_fa": "true",
            "@rel": "scidir",
            "@href": "https://www.sciencedirect.com/science/article/pii/S2468823122003753"
          }
        ],
        "dc:format": "application/json",
        "openaccessType": "Full",
        "pii": "S2468-8231(22)00375-3",
        "prism:volume": "530",
        "articleNumber": "112489",
        "prism:publisher": "The Author(s). Published by Elsevier B.V.",
        "dc:title": "The water assisted vinylene mechanism for cobalt Fischer-Tropsch synthesis assessed by multi-catalyst modelling of kinetics and deactivation",
        "prism:copyright": "© 2022 The Author(s). Published by Elsevier B.V.",
        "openaccess": "1",
        "prism:issn": "24688231",
        "dcterms:subject": [
          {
            "@_fa": "true",
            "$": "Fischer-Tropsch"
          },
          {
            "@_fa": "true",
            "$": "Kinetics"
          },
          {
            "@_fa": "true",
            "$": "Deactivation"
          },
          {
            "@_fa": "true",
            "$": "Mechanism"
          },
          {
            "@_fa": "true",
            "$": "Cobalt catalyst"
          }
        ],
        "openaccessArticle": "true",
        "prism:publicationName": "Molecular Catalysis",
        "openaccessSponsorType": "FundingBody",
        "prism:pageRange": "112489",
        "pubType": "fla",
        "prism:coverDisplayDate": "September 2022",
        "prism:doi": "10.1016/j.mcat.2022.112489",
        "prism:startingPage": "112489",
        "dc:identifier": "doi:10.1016/j.mcat.2022.112489",
        "openaccessSponsorName": "Norway institutions 2022"
      },
      "objects": {
        "object": [
          {
            "@category": "standard",
            "@height": "306",
            "@width": "386",
            "@_fa": "true",
            "$": "https://api.elsevier.com/content/object/eid/1-s2.0-S2468823122003753-gr4.jpg?httpAccept=%2A%2F%2A",
            "@multimediatype": "JPEG image file",
            "@type": "IMAGE-DOWNSAMPLED",
            "@size": "38179",
            "@ref": "gr4",
            "@mimetype": "image/jpeg"
          },
          {
            "@category": "standard",
            "@height": "299",
            "@width": "533",
            "@_fa": "true",
            "$": "https://api.elsevier.com/content/object/eid/1-s2.0-S2468823122003753-gr5.jpg?httpAccept=%2A%2F%2A",
            "@multimediatype": "JPEG image file",
            "@type": "IMAGE-DOWNSAMPLED",
            "@size": "38893",
            "@ref": "gr5",
            "@mimetype": "image/jpeg"
          },
          {
            "@category": "standard",
            "@height": "303",
            "@width": "386",
            "@_fa": "true",
            "$": "https://api.elsevier.com/content/object/eid/1-s2.0-S2468823122003753-gr6.jpg?httpAccept=%2A%2F%2A",
            "@multimediatype": "JPEG image file",
            "@type": "IMAGE-DOWNSAMPLED",
            "@size": "38570",
            "@ref": "gr6",
            "@mimetype": "image/jpeg"
          },
          {
            "@category": "standard",
            "@height": "253",
            "@width": "386",
            "@_fa": "true",
            "$": "https://api.elsevier.com/content/object/eid/1-s2.0-S2468823122003753-gr10.jpg?httpAccept=%2A%2F%2A",
            "@multimediatype": "JPEG image file",
            "@type": "IMAGE-DOWNSAMPLED",
            "@size": "26887",
            "@ref": "gr10",
            "@mimetype": "image/jpeg"
          },
          {
            "@category": "standard",
            "@height": "297",
            "@width": "386",
            "@_fa": "true",
            "$": "https://api.elsevier.com/content/object/eid/1-s2.0-S2468823122003753-gr7.jpg?httpAccept=%2A%2F%2A",
            "@multimediatype": "JPEG image file",
            "@type": "IMAGE-DOWNSAMPLED",
            "@size": "36694",
            "@ref": "gr7",
            "@mimetype": "image/jpeg"
          },
          {
            "@category": "standard",
            "@height": "295",
            "@width": "386",
            "@_fa": "true",
            "$": "https://api.elsevier.com/content/object/eid/1-s2.0-S2468823122003753-gr8.jpg?httpAccept=%2A%2F%2A",
            "@multimediatype": "JPEG image file",
            "@type": "IMAGE-DOWNSAMPLED",
            "@size": "35762",
            "@ref": "gr8",
            "@mimetype": "image/jpeg"
          },
          {
            "@category": "standard",
            "@height": "296",
            "@width": "386",
            "@_fa": "true",
            "$": "https://api.elsevier.com/content/object/eid/1-s2.0-S2468823122003753-gr9.jpg?httpAccept=%2A%2F%2A",
            "@multimediatype": "JPEG image file",
            "@type": "IMAGE-DOWNSAMPLED",
            "@size": "37022",
            "@ref": "gr9",
            "@mimetype": "image/jpeg"
          },
          {
            "@category": "standard",
            "@height": "669",
            "@width": "615",
            "@_fa": "true",
            "$": "https://api.elsevier.com/content/object/eid/1-s2.0-S2468823122003753-gr1.jpg?httpAccept=%2A%2F%2A",
            "@multimediatype": "JPEG image file",
            "@type": "IMAGE-DOWNSAMPLED",
            "@size": "74456",
            "@ref": "gr1",
            "@mimetype": "image/jpeg"
          },
          {
            "@category": "standard",
            "@height": "273",
            "@width": "386",
            "@_fa": "true",
            "$": "https://api.elsevier.com/content/object/eid/1-s2.0-S2468823122003753-gr2.jpg?httpAccept=%2A%2F%2A",
            "@multimediatype": "JPEG image file",
            "@type": "IMAGE-DOWNSAMPLED",
            "@size": "27159",
            "@ref": "gr2",
            "@mimetype": "image/jpeg"
          },
          {
            "@category": "standard",
            "@height": "244",
            "@width": "225",
            "@_fa": "true",
            "$": "https://api.elsevier.com/content/object/eid/1-s2.0-S2468823122003753-ga1.jpg?httpAccept=%2A%2F%2A",
            "@multimediatype": "JPEG image file",
            "@type": "IMAGE-DOWNSAMPLED",
            "@size": "19888",
            "@ref": "ga1",
            "@mimetype": "image/jpeg"
          },
          {
            "@category": "standard",
            "@height": "377",
            "@width": "386",
            "@_fa": "true",
            "$": "https://api.elsevier.com/content/object/eid/1-s2.0-S2468823122003753-gr3.jpg?httpAccept=%2A%2F%2A",
            "@multimediatype": "JPEG image file",
            "@type": "IMAGE-DOWNSAMPLED",
            "@size": "35263",
            "@ref": "gr3",
            "@mimetype": "image/jpeg"
          },
          {
            "@category": "thumbnail",
            "@height": "164",
            "@width": "207",
            "@_fa": "true",
            "$": "https://api.elsevier.com/content/object/eid/1-s2.0-S2468823122003753-gr4.sml?httpAccept=%2A%2F%2A",
            "@multimediatype": "GIF image file",
            "@type": "IMAGE-THUMBNAIL",
            "@size": "11292",
            "@ref": "gr4",
            "@mimetype": "image/gif"
          },
          {
            "@category": "thumbnail",
            "@height": "123",
            "@width": "219",
            "@_fa": "true",
            "$": "https://api.elsevier.com/content/object/eid/1-s2.0-S2468823122003753-gr5.sml?httpAccept=%2A%2F%2A",
            "@multimediatype": "GIF image file",
            "@type": "IMAGE-THUMBNAIL",
            "@size": "8814",
            "@ref": "gr5",
            "@mimetype": "image/gif"
          },
          {
            "@category": "thumbnail",
            "@height": "164",
            "@width": "209",
            "@_fa": "true",
            "$": "https://api.elsevier.com/content/object/eid/1-s2.0-S2468823122003753-gr6.sml?httpAccept=%2A%2F%2A",
            "@multimediatype": "GIF image file",
            "@type": "IMAGE-THUMBNAIL",
            "@size": "12206",
            "@ref": "gr6",
            "@mimetype": "image/gif"
          },
          {
            "@category": "thumbnail",
            "@height": "144",
            "@width": "219",
            "@_fa": "true",
            "$": "https://api.elsevier.com/content/object/eid/1-s2.0-S2468823122003753-gr10.sml?httpAccept=%2A%2F%2A",
            "@multimediatype": "GIF image file",
            "@type": "IMAGE-THUMBNAIL",
            "@size": "9111",
            "@ref": "gr10",
            "@mimetype": "image/gif"
          },
          {
            "@category": "thumbnail",
            "@height": "164",
            "@width": "213",
            "@_fa": "true",
            "$": "https://api.elsevier.com/content/object/eid/1-s2.0-S2468823122003753-gr7.sml?httpAccept=%2A%2F%2A",
            "@multimediatype": "GIF image file",
            "@type": "IMAGE-THUMBNAIL",
            "@size": "11920",
            "@ref": "gr7",
            "@mimetype": "image/gif"
          },
          {
            "@category": "thumbnail",
            "@height": "164",
            "@width": "214",
            "@_fa": "true",
            "$": "https://api.elsevier.com/content/object/eid/1-s2.0-S2468823122003753-gr8.sml?httpAccept=%2A%2F%2A",
            "@multimediatype": "GIF image file",
            "@type": "IMAGE-THUMBNAIL",
            "@size": "11598",
            "@ref": "gr8",
            "@mimetype": "image/gif"
          },
          {
            "@category": "thumbnail",
            "@height": "164",
            "@width": "214",
            "@_fa": "true",
            "$": "https://api.elsevier.com/content/object/eid/1-s2.0-S2468823122003753-gr9.sml?httpAccept=%2A%2F%2A",
            "@multimediatype": "GIF image file",
            "@type": "IMAGE-THUMBNAIL",
            "@size": "12163",
            "@ref": "gr9",
            "@mimetype": "image/gif"
          },
          {
            "@category": "thumbnail",
            "@height": "164",
            "@width": "151",
            "@_fa": "true",
            "$": "https://api.elsevier.com/content/object/eid/1-s2.0-S2468823122003753-gr1.sml?httpAccept=%2A%2F%2A",
            "@multimediatype": "GIF image file",
            "@type": "IMAGE-THUMBNAIL",
            "@size": "8006",
            "@ref": "gr1",
            "@mimetype": "image/gif"
          },
          {
            "@category": "thumbnail",
            "@height": "155",
            "@width": "219",
            "@_fa": "true",
            "$": "https://api.elsevier.com/content/object/eid/1-s2.0-S2468823122003753-gr2.sml?httpAccept=%2A%2F%2A",
            "@multimediatype": "GIF image file",
            "@type": "IMAGE-THUMBNAIL",
            "@size": "9975",
            "@ref": "gr2",
            "@mimetype": "image/gif"
          },
          {
            "@category": "thumbnail",
            "@height": "164",
            "@width": "151",
            "@_fa": "true",
            "$": "https://api.elsevier.com/content/object/eid/1-s2.0-S2468823122003753-ga1.sml?httpAccept=%2A%2F%2A",
            "@multimediatype": "GIF image file",
            "@type": "IMAGE-THUMBNAIL",
            "@size": "8070",
            "@ref": "ga1",
            "@mimetype": "image/gif"
          },
          {
            "@category": "thumbnail",
            "@height": "164",
            "@width": "168",
            "@_fa": "true",
            "$": "https://api.elsevier.com/content/object/eid/1-s2.0-S2468823122003753-gr3.sml?httpAccept=%2A%2F%2A",
            "@multimediatype": "GIF image file",
            "@type": "IMAGE-THUMBNAIL",
            "@size": "9114",
            "@ref": "gr3",
            "@mimetype": "image/gif"
          },
          {
            "@category": "high",
            "@height": "1356",
            "@width": "1709",
            "@_fa": "true",
            "$": "https://api.elsevier.com/content/object/eid/1-s2.0-S2468823122003753-gr4_lrg.jpg?httpAccept=%2A%2F%2A",
            "@multimediatype": "JPEG image file",
            "@type": "IMAGE-HIGH-RES",
            "@size": "250076",
            "@ref": "gr4",
            "@mimetype": "image/jpeg"
          },
          {
            "@category": "high",
            "@height": "1323",
            "@width": "2360",
            "@_fa": "true",
            "$": "https://api.elsevier.com/content/object/eid/1-s2.0-S2468823122003753-gr5_lrg.jpg?httpAccept=%2A%2F%2A",
            "@multimediatype": "JPEG image file",
            "@type": "IMAGE-HIGH-RES",
            "@size": "268475",
            "@ref": "gr5",
            "@mimetype": "image/jpeg"
          },
          {
            "@category": "high",
            "@height": "1343",
            "@width": "1709",
            "@_fa": "true",
            "$": "https://api.elsevier.com/content/object/eid/1-s2.0-S2468823122003753-gr6_lrg.jpg?httpAccept=%2A%2F%2A",
            "@multimediatype": "JPEG image file",
            "@type": "IMAGE-HIGH-RES",
            "@size": "271568",
            "@ref": "gr6",
            "@mimetype": "image/jpeg"
          },
          {
            "@category": "high",
            "@height": "1120",
            "@width": "1709",
            "@_fa": "true",
            "$": "https://api.elsevier.com/content/object/eid/1-s2.0-S2468823122003753-gr10_lrg.jpg?httpAccept=%2A%2F%2A",
            "@multimediatype": "JPEG image file",
            "@type": "IMAGE-HIGH-RES",
            "@size": "164745",
            "@ref": "gr10",
            "@mimetype": "image/jpeg"
          },
          {
            "@category": "high",
            "@height": "1317",
            "@width": "1709",
            "@_fa": "true",
            "$": "https://api.elsevier.com/content/object/eid/1-s2.0-S2468823122003753-gr7_lrg.jpg?httpAccept=%2A%2F%2A",
            "@multimediatype": "JPEG image file",
            "@type": "IMAGE-HIGH-RES",
            "@size": "251059",
            "@ref": "gr7",
            "@mimetype": "image/jpeg"
          },
          {
            "@category": "high",
            "@height": "1307",
            "@width": "1709",
            "@_fa": "true",
            "$": "https://api.elsevier.com/content/object/eid/1-s2.0-S2468823122003753-gr8_lrg.jpg?httpAccept=%2A%2F%2A",
            "@multimediatype": "JPEG image file",
            "@type": "IMAGE-HIGH-RES",
            "@size": "246090",
            "@ref": "gr8",
            "@mimetype": "image/jpeg"
          },
          {
            "@category": "high",
            "@height": "1309",
            "@width": "1709",
            "@_fa": "true",
            "$": "https://api.elsevier.com/content/object/eid/1-s2.0-S2468823122003753-gr9_lrg.jpg?httpAccept=%2A%2F%2A",
            "@multimediatype": "JPEG image file",
            "@type": "IMAGE-HIGH-RES",
            "@size": "267147",
            "@ref": "gr9",
            "@mimetype": "image/jpeg"
          },
          {
            "@category": "high",
            "@height": "2961",
            "@width": "2724",
            "@_fa": "true",
            "$": "https://api.elsevier.com/content/object/eid/1-s2.0-S2468823122003753-gr1_lrg.jpg?httpAccept=%2A%2F%2A",
            "@multimediatype": "JPEG image file",
            "@type": "IMAGE-HIGH-RES",
            "@size": "513000",
            "@ref": "gr1",
            "@mimetype": "image/jpeg"
          },
          {
            "@category": "high",
            "@height": "1207",
            "@width": "1709",
            "@_fa": "true",
            "$": "https://api.elsevier.com/content/object/eid/1-s2.0-S2468823122003753-gr2_lrg.jpg?httpAccept=%2A%2F%2A",
            "@multimediatype": "JPEG image file",
            "@type": "IMAGE-HIGH-RES",
            "@size": "208283",
            "@ref": "gr2",
            "@mimetype": "image/jpeg"
          },
          {
            "@category": "high",
            "@height": "1085",
            "@width": "999",
            "@_fa": "true",
            "$": "https://api.elsevier.com/content/object/eid/1-s2.0-S2468823122003753-ga1_lrg.jpg?httpAccept=%2A%2F%2A",
            "@multimediatype": "JPEG image file",
            "@type": "IMAGE-HIGH-RES",
            "@size": "116570",
            "@ref": "ga1",
            "@mimetype": "image/jpeg"
          },
          {
            "@category": "high",
            "@height": "1667",
            "@width": "1709",
            "@_fa": "true",
            "$": "https://api.elsevier.com/content/object/eid/1-s2.0-S2468823122003753-gr3_lrg.jpg?httpAccept=%2A%2F%2A",
            "@multimediatype": "JPEG image file",
            "@type": "IMAGE-HIGH-RES",
            "@size": "270071",
            "@ref": "gr3",
            "@mimetype": "image/jpeg"
          },
          {
            "@category": "thumbnail",
            "@_fa": "true",
            "$": "https://api.elsevier.com/content/object/eid/1-s2.0-S2468823122003753-si1.svg?httpAccept=%2A%2F%2A",
            "@multimediatype": "Scalable Vector Graphics file",
            "@type": "ALTIMG",
            "@size": "14746",
            "@ref": "si1",
            "@mimetype": "image/svg+xml"
          },
          {
            "@category": "standard",
            "@_fa": "true",
            "$": "https://api.elsevier.com/content/object/eid/1-s2.0-S2468823122003753-am.pdf?httpAccept=%2A%2F%2A",
            "@multimediatype": "Acrobat PDF file",
            "@type": "AAM-PDF",
            "@size": "1373524",
            "@ref": "am",
            "@mimetype": "application/pdf"
          }
        ]
      },
      "link": {
        "@rel": "abstract",
        "@href": "https://api.elsevier.com/content/abstract/scopus_id/85136647093"
      }
    }
  }
}