{
  "metadata": {
    "title": "Catalytic amination of 1,6-hexanediol for synthesis of N, N, N’, N’-tetramethyl-1,6-hexanediamine over Cu/Ni/Zn catalysts",
    "authors": "; ; ",
    "journal": "Molecular Catalysis",
    "date": "2024-12-31",
    "doi": "10.1016/j.mcat.2024.114601",
    "abstract": "",
    "uri": "https://api.elsevier.com/content/article/pii/S2468823124007831",
    "pii": "S2468823124007831"
  },
  "fulltext": {
    "full-text-retrieval-response": {
      "scopus-eid": "2-s2.0-85205931911",
      "originalText": "serial JL 315758 291210 291744 291790 291809 31 Molecular Catalysis MOLECULARCATALYSIS 2024-10-08 2024-10-08 2024-10-08 2024-10-08 2024-11-15T16:17:10 1-s2.0-S2468823124007831 S2468-8231(24)00783-1 S2468823124007831 10.1016/j.mcat.2024.114601 S300 S300.1 FULL-TEXT 1-s2.0-S2468823124X00152 2024-12-26T11:12:57.224584Z 0 0 20241201 20241231 2024 2024-10-08T06:29:30.755132Z absattachment articleinfo articlenumber articletitlenorm authfirstinitialnorm authfirstsurnamenorm cid cids contenttype copyright crossmark dateloaded dateloadedtxt datesearch datesort dateupdated dco docsubtype doctype doi eid ewtransactionid hubeid indexeddate issn issnnorm itemstage itemtransactionid itemweight openaccess openarchive pg pgfirst pii piinorm pubdateend pubdatestart pubdatetxt pubyr sectiontitle sortorder srctitle srctitlenorm srctype ssids alllist content subj subheadings suppl tomb volfirst volissue volumelist webpdf webpdfpagecount yearnav figure e-component body acknowledge affil appendices articletitle auth authfirstini authfull authkeywords authlast grantnumber grantsponsor grantsponsorid highlightsabst orcid primabst pubtype ref specialabst 2468-8231 24688231 true 569 569 C Volume 569 69 114601 114601 114601 202412 December 2024 2024-12-01 2024-12-31 2024 Regular Papers article fla © 2024 Elsevier B.V. All rights are reserved, including those for text and data mining, AI training, and similar technologies. CATALYTICAMINATION16HEXANEDIOLFORSYNTHESISNNNNTETRAMETHYL16HEXANEDIAMINEOVERCUNIZNCATALYSTS WANG Z 1 Introduction 2 Experimental section 2.1 Materials 2.2 Catalyst preparation 2.3 Catalytic tests 2.4 Characterization 3 Results and discussion 3.1 Characterization of Cu/Ni/Zn/γ-Al2O3 composite 3.2 Catalytic performance 3.3 Catalytic reusability 4 Conclusion and perspective CRediT authorship contribution statement Acknowledgments Appendix Supplementary materials References BAHN 2011 1853 1864 S WANG 2019 311 335 Y NG 2023 572 580 X HAMEURY 2022 1306 S BAIKER 1984 2331 2341 A ABE 1989 171 179 H KIMURA 2005 281 286 H GUILLENA 2010 1611 1641 G LI 2017 920 926 Y ZHANG 2024 119509 L VULTIER 1987 167 176 R NIEMEIER 2017 2839 2845 J XIE 2022 112492 Z FISCHER 1997 167 189 A DROS 2015 4760 4772 A HUANG 2023 1350 H WU 2024 152457 Y FU 2021 121 131 X SALARINEJAD 2022 106529 N SWAIN 2021 111576 S JIA 2024 115407 S WANG 2019 773 779 T ZENG 2022 2084 2096 Y BEEPALA 2022 100451 S CAI 2021 111608 X CARSON 2024 W TOMER 2017 111 124 A YUE 2022 103865 C ZHAO 2010 449 457 G KUMAR 2024 98 109 R JUE 2022 e202201241 Z NIU 2020 4270 4278 F SHIMIZU 2011 1310 1317 K MA 2018 8152 8163 L YANG 2023 7172 7178 J ABE 1988 519 523 H QIUXIAO 2002 229 233 L KIMURA 2011 1 90 H HOU 2023 130523 S JIN 2024 122933 Q DING 2021 50201 A RUNEBERG 1985 309 319 J NATESAKHAWAT 2012 1667 1676 S THOMMES 2015 1051 1069 M LI 2011 1635 1642 Y WANG 2015 6200 6208 Y PEI 2022 5419 5428 F JURGEN 2000 229 238 B IMABEPPU 2009 753 757 M BAIKER 1978 1169 1174 A WANGX2024X114601 WANGX2024X114601XZ 2026-10-08T00:00:00.000Z 2026-10-08T00:00:00.000Z http://creativecommons.org/licenses/by-nc-nd/4.0/ © 2024 Elsevier B.V. All rights are reserved, including those for text and data mining, AI training, and similar technologies. 2024-10-22T12:18:23.439Z http://vtw.elsevier.com/data/voc/AddOnTypes/50.7/aggregated-refined ZQ2022JC-QN07 http://sws.geonames.org/1814991 Project of Science and Technology Innovation Fund of China Research Institute of Daily Chemical Industry CX202203 http://sws.geonames.org/1814991 This work has been financially supported by the Basic Research Project of POLY Sinolight (ZQ2022JC-QN07) and Project of Science and Technology Innovation Fund of China Research Institute of Daily Chemical Industry (CX202203). https://doi.org/10.15223/policy-017 https://doi.org/10.15223/policy-037 https://doi.org/10.15223/policy-012 https://doi.org/10.15223/policy-029 https://doi.org/10.15223/policy-004 item S2468-8231(24)00783-1 S2468823124007831 1-s2.0-S2468823124007831 10.1016/j.mcat.2024.114601 315758 2024-12-26T11:12:57.224584Z 2024-12-01 2024-12-31 1-s2.0-S2468823124007831-main.pdf https://s3-eu-west-1.amazonaws.com/prod-ucs-content-store-eu-west/content/pii:S2468823124007831/MAIN/application/pdf/b2651133fbb509b3787dc88a1e6364a8/main.pdf main.pdf pdf true 8671765 MAIN 9 1-s2.0-S2468823124007831-main_1.png https://s3-eu-west-1.amazonaws.com/prod-ucs-content-store-eu-west/content/pii:S2468823124007831/PREVIEW/image/png/113f5ac52536f02bebda95e3e2dab178/main_1.png main_1.png png 60691 849 656 IMAGE-WEB-PDF 1 1-s2.0-S2468823124007831-gr6.jpg https://s3-eu-west-1.amazonaws.com/prod-ucs-content-store-eu-west/content/pii:S2468823124007831/gr6/DOWNSAMPLED/image/jpeg/8f576a3ddffeed759f5e1cd132f9e853/gr6.jpg gr6 gr6.jpg jpg 39560 292 753 IMAGE-DOWNSAMPLED 1-s2.0-S2468823124007831-gr5.jpg https://s3-eu-west-1.amazonaws.com/prod-ucs-content-store-eu-west/content/pii:S2468823124007831/gr5/DOWNSAMPLED/image/jpeg/4c096d6cff0eed6fe17cc49775af29a4/gr5.jpg gr5 gr5.jpg jpg 81908 314 753 IMAGE-DOWNSAMPLED 1-s2.0-S2468823124007831-gr8.jpg https://s3-eu-west-1.amazonaws.com/prod-ucs-content-store-eu-west/content/pii:S2468823124007831/gr8/DOWNSAMPLED/image/jpeg/0ae8ff581f042c9674a139a0b012b957/gr8.jpg gr8 gr8.jpg jpg 94306 405 791 IMAGE-DOWNSAMPLED 1-s2.0-S2468823124007831-gr7.jpg https://s3-eu-west-1.amazonaws.com/prod-ucs-content-store-eu-west/content/pii:S2468823124007831/gr7/DOWNSAMPLED/image/jpeg/95505d76b211e73d26ec862017ded4e0/gr7.jpg gr7 gr7.jpg jpg 44760 195 791 IMAGE-DOWNSAMPLED 1-s2.0-S2468823124007831-gr9.jpg https://s3-eu-west-1.amazonaws.com/prod-ucs-content-store-eu-west/content/pii:S2468823124007831/gr9/DOWNSAMPLED/image/jpeg/cd88f7ca0a551ebc3f4042455b7e9225/gr9.jpg gr9 gr9.jpg jpg 27398 277 376 IMAGE-DOWNSAMPLED 1-s2.0-S2468823124007831-sc1.jpg https://s3-eu-west-1.amazonaws.com/prod-ucs-content-store-eu-west/content/pii:S2468823124007831/sc1/DOWNSAMPLED/image/jpeg/6f504c198989fa6d7f8ccf37871acd4e/sc1.jpg sc1 sc1.jpg jpg 73726 467 715 IMAGE-DOWNSAMPLED 1-s2.0-S2468823124007831-gr2.jpg https://s3-eu-west-1.amazonaws.com/prod-ucs-content-store-eu-west/content/pii:S2468823124007831/gr2/DOWNSAMPLED/image/jpeg/f687783be846ac55af790c177b1bce1c/gr2.jpg gr2 gr2.jpg jpg 60729 301 753 IMAGE-DOWNSAMPLED 1-s2.0-S2468823124007831-ga1.jpg https://s3-eu-west-1.amazonaws.com/prod-ucs-content-store-eu-west/content/pii:S2468823124007831/ga1/DOWNSAMPLED/image/jpeg/9c2271a77b807542abad38f93f54c772/ga1.jpg ga1 true ga1.jpg jpg 24277 200 308 IMAGE-DOWNSAMPLED 1-s2.0-S2468823124007831-gr1.jpg https://s3-eu-west-1.amazonaws.com/prod-ucs-content-store-eu-west/content/pii:S2468823124007831/gr1/DOWNSAMPLED/image/jpeg/d9960582078a6b7c86ea4ece158ead1e/gr1.jpg gr1 gr1.jpg jpg 141383 567 565 IMAGE-DOWNSAMPLED 1-s2.0-S2468823124007831-gr4.jpg https://s3-eu-west-1.amazonaws.com/prod-ucs-content-store-eu-west/content/pii:S2468823124007831/gr4/DOWNSAMPLED/image/jpeg/207ff98da7a8d6af3f0c365c9e45261d/gr4.jpg gr4 gr4.jpg jpg 23996 320 376 IMAGE-DOWNSAMPLED 1-s2.0-S2468823124007831-gr3.jpg https://s3-eu-west-1.amazonaws.com/prod-ucs-content-store-eu-west/content/pii:S2468823124007831/gr3/DOWNSAMPLED/image/jpeg/4a8ba529bd75b2e15cce30b8d307285e/gr3.jpg gr3 gr3.jpg jpg 84937 296 753 IMAGE-DOWNSAMPLED 1-s2.0-S2468823124007831-gr6.sml https://s3-eu-west-1.amazonaws.com/prod-ucs-content-store-eu-west/content/pii:S2468823124007831/gr6/THUMBNAIL/image/gif/c70f0e9dda3cace3edc09f2d328a403b/gr6.sml gr6 gr6.sml sml 6916 85 219 IMAGE-THUMBNAIL 1-s2.0-S2468823124007831-gr5.sml https://s3-eu-west-1.amazonaws.com/prod-ucs-content-store-eu-west/content/pii:S2468823124007831/gr5/THUMBNAIL/image/gif/07aaa4e7cbbd6256a504ef38f7c2a78c/gr5.sml gr5 gr5.sml sml 11458 91 219 IMAGE-THUMBNAIL 1-s2.0-S2468823124007831-gr8.sml https://s3-eu-west-1.amazonaws.com/prod-ucs-content-store-eu-west/content/pii:S2468823124007831/gr8/THUMBNAIL/image/gif/a8c5582baee2cc73dd73b8c64bbae909/gr8.sml gr8 gr8.sml sml 15960 112 219 IMAGE-THUMBNAIL 1-s2.0-S2468823124007831-gr7.sml https://s3-eu-west-1.amazonaws.com/prod-ucs-content-store-eu-west/content/pii:S2468823124007831/gr7/THUMBNAIL/image/gif/394ace933d58d88957eda66270b7a5ae/gr7.sml gr7 gr7.sml sml 6895 54 219 IMAGE-THUMBNAIL 1-s2.0-S2468823124007831-gr9.sml https://s3-eu-west-1.amazonaws.com/prod-ucs-content-store-eu-west/content/pii:S2468823124007831/gr9/THUMBNAIL/image/gif/6295eeed5b63d80bc526c602dfea4ca6/gr9.sml gr9 gr9.sml sml 13959 161 219 IMAGE-THUMBNAIL 1-s2.0-S2468823124007831-sc1.sml https://s3-eu-west-1.amazonaws.com/prod-ucs-content-store-eu-west/content/pii:S2468823124007831/sc1/THUMBNAIL/image/gif/9724dc812bcf1c21556f933e1f88ecff/sc1.sml sc1 sc1.sml sml 10726 143 219 IMAGE-THUMBNAIL 1-s2.0-S2468823124007831-gr2.sml https://s3-eu-west-1.amazonaws.com/prod-ucs-content-store-eu-west/content/pii:S2468823124007831/gr2/THUMBNAIL/image/gif/8d10a90de8c83f7ef97de47898ecb692/gr2.sml gr2 gr2.sml sml 8811 88 219 IMAGE-THUMBNAIL 1-s2.0-S2468823124007831-ga1.sml https://s3-eu-west-1.amazonaws.com/prod-ucs-content-store-eu-west/content/pii:S2468823124007831/ga1/THUMBNAIL/image/gif/c3b1fb01f1c0375f2b729187dc91063a/ga1.sml ga1 true ga1.sml sml 10672 142 219 IMAGE-THUMBNAIL 1-s2.0-S2468823124007831-gr1.sml https://s3-eu-west-1.amazonaws.com/prod-ucs-content-store-eu-west/content/pii:S2468823124007831/gr1/THUMBNAIL/image/gif/1b1217371b2e57ce838de98cc3577fae/gr1.sml gr1 gr1.sml sml 23075 163 163 IMAGE-THUMBNAIL 1-s2.0-S2468823124007831-gr4.sml https://s3-eu-west-1.amazonaws.com/prod-ucs-content-store-eu-west/content/pii:S2468823124007831/gr4/THUMBNAIL/image/gif/6d5eca1bf8e9fae2f44b3ddd443a5f16/gr4.sml gr4 gr4.sml sml 8159 164 193 IMAGE-THUMBNAIL 1-s2.0-S2468823124007831-gr3.sml https://s3-eu-west-1.amazonaws.com/prod-ucs-content-store-eu-west/content/pii:S2468823124007831/gr3/THUMBNAIL/image/gif/16cb208bf99dd8d73e7c70c95f8c708e/gr3.sml gr3 gr3.sml sml 11035 86 219 IMAGE-THUMBNAIL 1-s2.0-S2468823124007831-gr6_lrg.jpg https://s3-eu-west-1.amazonaws.com/prod-ucs-content-store-eu-west/content/pii:S2468823124007831/HIGHRES/image/jpeg/84d98f9b2f4f0fa9bb2ccea158a139ab/gr6_lrg.jpg gr6 gr6_lrg.jpg jpg 251321 1293 3333 IMAGE-HIGH-RES 1-s2.0-S2468823124007831-gr5_lrg.jpg https://s3-eu-west-1.amazonaws.com/prod-ucs-content-store-eu-west/content/pii:S2468823124007831/HIGHRES/image/jpeg/eb0ad845e136af815ab700e22a475e61/gr5_lrg.jpg gr5 gr5_lrg.jpg jpg 545558 1388 3333 IMAGE-HIGH-RES 1-s2.0-S2468823124007831-gr8_lrg.jpg https://s3-eu-west-1.amazonaws.com/prod-ucs-content-store-eu-west/content/pii:S2468823124007831/HIGHRES/image/jpeg/9954ca7c449d6fefca355b9c57d0d9f0/gr8_lrg.jpg gr8 gr8_lrg.jpg jpg 611761 1791 3500 IMAGE-HIGH-RES 1-s2.0-S2468823124007831-gr7_lrg.jpg https://s3-eu-west-1.amazonaws.com/prod-ucs-content-store-eu-west/content/pii:S2468823124007831/HIGHRES/image/jpeg/2bd8e955791d247f7a68ee073d8f7244/gr7_lrg.jpg gr7 gr7_lrg.jpg jpg 276502 863 3500 IMAGE-HIGH-RES 1-s2.0-S2468823124007831-gr9_lrg.jpg https://s3-eu-west-1.amazonaws.com/prod-ucs-content-store-eu-west/content/pii:S2468823124007831/HIGHRES/image/jpeg/9ea66e2d1e193c8a1056390e538a4320/gr9_lrg.jpg gr9 gr9_lrg.jpg jpg 165871 1227 1667 IMAGE-HIGH-RES 1-s2.0-S2468823124007831-sc1_lrg.jpg https://s3-eu-west-1.amazonaws.com/prod-ucs-content-store-eu-west/content/pii:S2468823124007831/HIGHRES/image/jpeg/090c333238f996a93a851f97132eb1ee/sc1_lrg.jpg sc1 sc1_lrg.jpg jpg 495947 2069 3167 IMAGE-HIGH-RES 1-s2.0-S2468823124007831-gr2_lrg.jpg https://s3-eu-west-1.amazonaws.com/prod-ucs-content-store-eu-west/content/pii:S2468823124007831/HIGHRES/image/jpeg/919ec3addcedff803e60279609dc48a6/gr2_lrg.jpg gr2 gr2_lrg.jpg jpg 403650 1332 3333 IMAGE-HIGH-RES 1-s2.0-S2468823124007831-ga1_lrg.jpg https://s3-eu-west-1.amazonaws.com/prod-ucs-content-store-eu-west/content/pii:S2468823124007831/HIGHRES/image/jpeg/0409c9cacf38109f8e08e1fb7bfb46b8/ga1_lrg.jpg ga1 true ga1_lrg.jpg jpg 161164 886 1365 IMAGE-HIGH-RES 1-s2.0-S2468823124007831-gr1_lrg.jpg https://s3-eu-west-1.amazonaws.com/prod-ucs-content-store-eu-west/content/pii:S2468823124007831/HIGHRES/image/jpeg/bd00d106ede7236cca7fb0f5f0ac7328/gr1_lrg.jpg gr1 gr1_lrg.jpg jpg 1494853 2507 2500 IMAGE-HIGH-RES 1-s2.0-S2468823124007831-gr4_lrg.jpg https://s3-eu-west-1.amazonaws.com/prod-ucs-content-store-eu-west/content/pii:S2468823124007831/HIGHRES/image/jpeg/052e2df701eb090fdf81a1fef5139a14/gr4_lrg.jpg gr4 gr4_lrg.jpg jpg 150989 1418 1667 IMAGE-HIGH-RES 1-s2.0-S2468823124007831-gr3_lrg.jpg https://s3-eu-west-1.amazonaws.com/prod-ucs-content-store-eu-west/content/pii:S2045232217008732/HIGHRES/image/jpeg/7549bdbb3b4b0ca2dee670046e777099/gr3_lrg.jpg gr3 gr3_lrg.jpg jpg 541941 1310 3333 IMAGE-HIGH-RES 1-s2.0-S2468823124007831-mmc1.docx https://s3-eu-west-1.amazonaws.com/prod-ucs-content-store-eu-west/content/pii:S2468823124007831/mmc1/MAIN/application/vnd.openxmlformats-officedocument.wordprocessingml.document/724c2d99214e22db87a44bab1eeba506/mmc1.docx mmc1 mmc1.docx docx 2087857 APPLICATION 1-s2.0-S2468823124007831-am.pdf am am.pdf pdf 992914 AAM-PDF https://s3-eu-west-1.amazonaws.com/prod-ucs-content-store-eu-west/content/egi:10KPM2TBD3V/MAIN/application/pdf/90ff773e99bcca450cd89f7dce5cd16c/am.pdf MCAT 114601 114601 S2468-8231(24)00783-1 10.1016/j.mcat.2024.114601 Elsevier B.V. Fig. 1 TEM images of catalysts (A. Cu/γ-Al2O3, B. Ni/γ-Al2O3, C. Cu/Ni/γ-Al2O3, D. Cu/Ni/Zn/γ-Al2O3 after reduction). Fig 1 Fig. 2 (A) N2 adsorption and desorption isotherm curves and (B) pore size distribution of catalysts (a. Cu/γ-Al2O3, b. Ni/γ-Al2O3, c. Cu/Ni/γ-Al2O3, d. Cu/Ni/Zn/γ-Al2O3 after reduction). Fig 2 Fig. 3 XRD patterns of catalysts (A) after calcination and (B) after reduction (a. Cu/γ-Al2O3, b. Ni/γ-Al2O3, c. Cu/Ni/γ-Al2O3, d. Cu/Ni/Zn/γ-Al2O3). Fig 3 Fig. 4 H2-TPR profiles of catalysts (a. Cu/γ-Al2O3, b. Ni/γ-Al2O3, c. Cu/Ni/γ-Al2O3, d. Cu/Ni/Zn/γ-Al2O3). Fig 4 Fig. 5 (A) Cu 2p and (B) Ni 2p XPS spectra of catalysts after reduction (a. Cu/γ-Al2O3, b. Ni/γ-Al2O3, c. Cu/Ni/γ-Al2O3, d. Cu/Ni/Zn/γ-Al2O3). Fig 5 Fig. 6 HDO conversion and TMHDA selectivity over four catalysts (a. Cu/γ-Al2O3, b. Ni/γ-Al2O3, c. Cu/Ni/γ-Al2O3, d. Cu/Ni/Zn/γ-Al2O3). Reaction conditions: 150 g HDO, 2 g catalyst, 0.6 L/min DMA, 0.4 L/min H2, 200 ℃, 8 h. Fig 6 Fig. 7 (A) Effect of the support on HDO conversion and TMHDA selectivity over three catalysts. Reaction conditions: 150 g HDO, 2 g catalyst, 0.6 L/min DMA, 0.4 L/min H2, 200 ℃, 8 h. (B) N2 adsorption and desorption isotherm curves of catalysts. (C) pore size distribution of catalysts (catalysts: Cu/Ni/CaCO3, Cu/Ni/Diatomite, Cu/Ni/γ-Al2O3). Fig 7 Fig. 8 Effect of the Cu/Ni molar ratio (n(Cu)/n(Ni)=5:1, 4:1, 3:1, 2:1, 1:1) in the amination of HDO with different reaction time (A 4 h, B 6 h, C 8 h). Effect of the Cu/Ni/Zn molar ratio (n(Cu)/n(Ni)/n(Zn)= 28:7:6, 28:7:12, 28:7:20, 28:7:28) in the amination of HDO with different reaction time (A 4 h, B 6 h, C 8 h). Reaction conditions: 150 g HDO, 2 g catalyst, 0.6 L/min DMA, 0.4 L/min H2, 200 ℃. Fig 8 Fig. 9 The reusability of the Cu/Ni/Zn/γ-Al2O3 catalyst (n(Cu)/n(Ni)/n(Zn)=28:7:12) for HDO amination. Reaction conditions: 150 g HDO, 2 g catalyst, 0.6 L/min DMA, 0.4 L/min H2, 200 ℃, 8 h. Fig 9 Scheme 1 The related reaction mechanism for the formation of TMHDA by amination of HDO and DMA. Scheme 1 Research Paper Catalytic amination of 1,6-hexanediol for synthesis of N, N, N’, N’-tetramethyl-1,6-hexanediamine over Cu/Ni/Zn catalysts Zhifei Wang Writing – original draft Visualization Methodology Conceptualization a b Jun Li Writing – review & editing Formal analysis a b Yakui Wang Resources Methodology a b Hongbin Ju Validation Project administration Conceptualization a b Lu Zhang Writing – review & editing Project administration Data curation a b Yajie Jiang Supervision Funding acquisition a b ⁎ a China Research Institute of Daily Chemistry Co., Ltd., Taiyuan 030001, Shanxi, China China Research Institute of Daily Chemistry Co., Ltd Taiyuan Shanxi 030001 China aChina Research Institute of Daily Chemistry Co., Ltd., Taiyuan 030001, Shanxi, China b Shanxi Key Laboratory of Functional Surfactants, Taiyuan 030001, Shanxi, China Shanxi Key Laboratory of Functional Surfactants Taiyuan Shanxi 030001 China bShanxi Key Laboratory of Functional Surfactants, Taiyuan 030001, Shanxi, China ⁎ Corresponding author. Synthesis of N, N, N’, N’-tetramethyl-1,6-hexanediamine(TMHDA) by the amination of 1,6-hexanediol(HDO) and dimethylamine(DMA) at normal pressure over an outstanding Cu/Ni/Zn catalyst supported on aluminum oxide(γ-Al2O3) was studied in this article. Cu/Ni/Zn/γ-Al2O3(Cu: Ni: Zn = 28: 7: 12) exhibited excellent catalytic performance, which HDO was almost completely transformed and TMHDA reached 85 % selectivity at 200 °C. The amination of HDO required two hydrogenations and two dehydrogenations, and the selectivity of the amination catalyst depended on the balance of dehydrogenation and hydrogenation. Various characterization (TEM, BET, XRD, H2-TPR, XPS) demonstrated that the addition of Zn to the Cu/Ni catalyst could reduce the agglomeration of Cu/Ni particles and change the valence distribution of Cu. The Cu/Ni/Zn/γ-Al2O3 catalyst was a very promising and green method for the synthesis of tertiary diamines through amination of diols. Graphical abstract Image, graphical abstract Keywords N,N, N’, N’-tetramethyl-1,6-hexanediamine Catalytic amination 1,6-hexanediol Cu/Ni/Zn/γ-Al2O3 catalysts Characterization Data availability Data will be made available on request. 1 Introduction As important fine chemical intermediates, fatty amines and their derivatives are widely used in dyes, pesticides, pharmaceuticals and other fields, and the catalytic amination of alcohols is one of the most important methods to prepare such compounds [1-4]. Over the past century, the researches on catalytic amination of mono-functional alcohols have achieved remarkable results, and a series of high-efficiency catalysts have been developed for this reaction [5-8]. There is little research on the catalytic amination of diols, mainly because when diols are used as raw materials, the reaction with ammonia (amine) is more complex than that with mono-functional alcohols. It is very easy for diols to occur intramolecular or intermolecular tandem reactions to generate a series of chain or ring products, which reduces the selectivity of the reaction and prevents the production of high-yield compounds [9-13]. Li et al. applied Ru/Al2O3 catalyst to the amination reaction of 1,6-hexanediol. Under the optimal reaction conditions, 1,6-hexanediol was almost completely converted, but the selectivity of 1,6-hexamethylene diamine was only 38.4 % [9]. Therefore, the method of preparing diamine by catalytic amination of diols is rarely used in industry at present, and only part of ethylenediamine is prepared by the catalytic amination of ethanolamine [14]. In industry, most diamines are still synthesized from dihalides and cyanide, which involves a serious corrosion of equipment and a heavy environmental pollution [14,15]. The catalytic amination reaction of diols does not have the above disadvantages, and the rest products of the reaction can be sold as products after separation, with little environmental pollution. At present, the main difficulty lies in the low selectivity of the catalyst towards the target compound. If the problem can be solved, this will be a very promising and green synthesis route. The catalysts used to catalyze the amination reaction of alcohols can be generally divided into two categories: noble metal catalysts and non-noble metal catalysts [16]. Noble metals like Ru [17,18], Pd [19], Ir [20], Pt [21] have been employed in the reaction, which are efficient, stable, selective and generally exhibit excellent catalytic activity. However, the noble metals are relatively scarce and very expensive, which greatly limited the industrial application. In contrast, non-noble metals are abundant on the earth. Over the decades, people have increasingly replaced noble metals with more economical metals [22-30]. The research of non-noble metal catalysts mainly focused Cu [23-26], Ni [27,28] and Co [29,30], etc. Beepala et al. synthesized a series of Cu/SBA-15 catalysts used to synthesize cyclohexylamine from cyclohexanol, which showed the best catalytic performance when loaded with 5 wt% Cu on SBA-15 [24]. Tomer et al. added β-cyclodextrin to the Ni/Al2O3 catalyst, showing high conversion and primary amine selectivity in the amination reaction between n-octanol and ammonia [27]. A great deal of studies has shown that doping other metals (Fe [29,31], Zn [25], Bi [32], Ag [33], Re [34], V[35], etc.) into metal catalysts has a significant impact to the activity and selectivity of catalysts in alcohol reduction amination reaction. Cai et al. studied that Zn can enhance the catalytic selectivity of Cu/γ-Al2O3 in the amination process of HDO reduction to N, N, N’, N’-tetramethyl-1,6-hexanediamine (TMHDA), which was due to the strong electron interaction between Zn and Cu nanoparticles to decrease the average particle size and improve the dispersion of Cu [25]. In addition, the valence of the active component also affects the selectivity of the catalyst in the amination reaction. Abe et al. found some differences in the valence states of Ni in catalysts with different Cu/Ni ratios on the reduction of fatty alcohols to tertiary amines. The higher the Cu/Ni ratio, the more biased its valence state to Ni3+, the higher the selectivity [6,36]. Li et al. reported that the catalyst selectivity was affected by the reducibility of Ni2+, and lower Ni2+ reducibility resulted in higher catalyst selectivity [37]. Actually, the majority of studies focus on the preparation of primary diamines and secondary diamines by catalytic amination, and there are only few researches on the preparation of tertiary diamines directly from the reductive amination of diols. Tetramethyl diamines (Me2N-(CH2)n-NMe2) are an important organic synthesis intermediate in the industrial production of polyurethane [38], multiheaded cationic surfactants [39] and anion exchange membranes [40,41]. Runeberg et al. reported that the main product of the vapor amination reaction between ethylene glycol and DMA was 2-dimethylaminoethanol, and the selectivity of tetramethyl diamine was less than 20 % [42]. BASF patented the amination reaction of diols with DMA under pressure on a Cu/Cr catalyst, with the conversion rate was 15 % and the selectivity of the intermediate and tertiary diamines was 30 % and 20 %, respectively [43]. Hence, it is meaningful to develop efficient synthesis of tetramethyl diamines. Herein, we prepared a battery of Cu/Ni/Zn catalysts with different supports, different components and different proportions by co-precipitation method, and the catalytic performance for HDO and DMA catalytic synthesis to TMHDA was evaluated. Compared to previous studies, in this research, non-noble metallic elements such as Cu, Ni and Zn are used, which have low cost and can be reused many times. The HDO conversion and goal product TMHDA have been greatly improved. Furthermore, the reaction mechanism of tertiary diamine by amination of diols was also explored. The catalyst structure (dispersion, electron interaction, reduction degree, etc.) was investigated by transmission electron microscopy (TEM), nitrogen adsorption–desorption experiments, X-ray diffraction (XRD), hydrogen temperature programmed reduction (H2-TPR), X-ray photoelectron spectroscopy (XPS), etc. The results showed that smaller Cu and Ni particles and suitable Cu+ and Cu0 mixture facilitated the formation of TMHDA. The Cu/Ni/Zn catalysts for synthesis of TMHDA is of a great potential application as a green and effective route to produce tertiary diamine. 2 Experimental section 2.1 Materials 1,6-Hexanediol (99.1 %, A.R.) was obtained from Shanghai Haohong Scientific Co., Ltd., Shanghai, China. Dimethylamine with a purity of >99.5 % was purchased from Zibo Huibao Chemical Co., Ltd., Shandong, China. High purity H2 with a purity of >99.99 % was provided by Taiyuan Taineng Gas Co., Ltd., Taiyuan, China. Cu(NO3)2•3H2O (98.5 %, A.R.), Ni(NO3)2•6H2O (98.0 %, A.R.), Zn(NO3)2•6H2O (99.0 %, A.R.), and Na2CO3 (99.0 %, A.R.) were purchased from Sinopharm Chemical Reagent Co., Ltd., Shanghai, China. Pseudo boehmite (AlOOH· nH2O, n = 0.08∼0.62, Nitric acid preparation, A.R.), light calcium carbonate and diatomite were supplied by Shanghai Macklin Biochemical Technology Co., Ltd., Shanghai, China. All experiments used the Millipore water with 18.2 MΩ•cm. 2.2 Catalyst preparation The catalysts were prepared by co-precipitation method. A calculated amount of pseudo boehmite and deionized water were prepared 10 wt.% solution. A calculated amount of Cu(NO3)2•3H2O, Ni(NO3)2•6H2O, Zn(NO3)2•6H2O were also dissolved in deionized water to prepare solution. Then the solutions of Cu/Ni/Zn nitrates and Na2CO3 were added dropwise to the above pseudo boehmite solution under 45 °C with the solution pH around 7∼8. After there was no Cu/Ni/Zn nitrates solution left, the mixture was kept stirring for 2 h with the stirring speed around 300 rpm. The filter cake was filtrated and washed until the pH dropped to weakly alkalescent. Finally, the filter cake was dried at 120 °C for 6 h and calcined in a muffle furnace at 400 °C for 3 h. Before used, the prepared catalyst was crushed into 200 mesh. The other two CaCO3 and diatomite supported catalysts were also prepared by the above method. 2.3 Catalytic tests The catalytic reaction was carried out in a round bottom flask and a reflux condenser with a triangular flask was used to collect the reaction water. In order to collect as much the reaction water as possible while minimizing volatilization of the other reactants and products, the condensate tube was filled with stainless steel θ ring helices and the temperature of the condensate water was set at 50 °C. 1,6-hexanediol and catalyst were put into the flask. The catalyst was reduced in H2 flow (0.8 L/min) at 170 °C for 40 min. Then the mixture of dimethylamine (DMA, 60 vol %, 0.6 L/min) and H2 (40 vol %, 0.4 L/min) was fed into the reactor. The liquid mixtures for analysis were taken at 4 h, 6 h, 8 h of reaction at 200 °C. The liquid mixtures from the amination reaction were analyzed by a gas chromatography (GC8860A, Agilent) with a flame ionization detector and a capillary column (HP-5 column). The conversion of HDO and selectivity of TMHDA were calculated according to the formula below: Conversion (%) =(C0-Ct)/C0, C0, Ct represent the initial concentration and the concentration at time t of HDO, respectively. Yield (%) =Cpt/Cp0, Cpt, Cp0 represent the concentration at time t and theoretical concentration of TMHDA, respectively. Selectivity (%) = Yield/Conversion. 2.4 Characterization Transmission electron microscopy (TEM) was collected on a FEI-Talos F200S with a 200-kV electron source. Scanning electron microscopy (SEM) was performed on a HITACHI SU8010 with an accelerating voltage of 5 kV. Nitrogen adsorption–desorption experiments were carried out on a Micromeritics ASAP 2020 surface area and porosity analyzer. The X-ray diffraction (XRD) patterns were determined via a German Bruker D8 ADVANCE X-ray diffractometer equipped with a Cu Kα radiation source in a 2θ range from 10° to 80° Hydrogen temperature-programmed reduction (H2-TPR) was tested in a flow of 10 vol% H2/Ar (25 mL/min) on a Microtrac BelCata II instrument equipped with a thermal conductivity detector (TCD). X–ray photoelectron spectroscopy (XPS) measurements were performed on Thermo Fisher Scientific K-Alpha. The C1s peak at 284.8 eV was used as a reference for charge–up correction. 3 Results and discussion 3.1 Characterization of Cu/Ni/Zn/γ-Al2O3 composite Four catalysts with different Cu, Ni and Zn contents were prepared by the method mentioned in 2.2. Cu/γ-Al2O3 and Ni/γ-Al2O3 were single-element catalysts supported on γ-Al2O3. Cu/Ni/γ-Al2O3 contained Cu and Ni two elements, which the molar ratio of Cu and Ni was 4:1. Cu/Ni/Zn/γ-Al2O3 contained Cu, Ni and Zn three elements, which the molar ratio of Cu, Ni and Zn was 28:7:12. Different characterization was carried out for the four catalysts. TEM images of Cu/γ-Al2O3, Ni/γ-Al2O3, Cu/Ni/γ-Al2O3, Cu/Ni/Zn/γ-Al2O3 were shown in Fig. 1 . As shown in Fig. 1, the particle agglomeration of Cu/γ-Al2O3 (Fig. 1A) and Ni/γ-Al2O3 (Fig. 1B) containing was quite serious. When Ni and Cu were loaded on the carrier at the same time, Ni can be well dispersed between Cu particles, which was the basis for the excellent catalytic properties of Cu/Ni/γ-Al2O3 (Fig. 1C). After adding Zn, the average size of catalyst decreased from 21.382 nm to 15.648 nm, which indicated that Zn can reduce the agglomeration of Cu, thus promote the homogeneous distribution of Cu particles (Fig. 1D) [44]. The EDS elemental mapping of Cu/Ni/Zn/γ-Al2O3 in SEM images (Fig.S1) displayed the uniform dispersion of Cu, Ni, Zn elements on Al2O3 support, implying that there might be good interaction among Cu, Ni and Zn in Cu/Ni/Zn/γ-Al2O3. The specific surface area (Brunauer–Emmett–Teller method) and pore distribution of four catalysts were performed. All N2 adsorption/desorption isotherms (Fig. 2 A) showed a typical Type IV model with H3-type hysteresis loops [45]. The H3-type hysteresis loop showed no adsorption saturation in the region of higher relative pressure, which indicated Al2O3 was suitable for the support of the amination catalyst. In Fig. 2B, all samples exhibited a unimodal distribution and the pore width distributed at about 3∼4 nm, indicating that the pore size distribution of four catalysts were relatively uniform. In Table S1, Cu/γ-Al2O3 (212.9 m2/g) had a larger surface area than Cu/Ni/γ-Al2O3 (188.1 m2/g) and Cu/Ni/Zn/γ-Al2O3(184.1 m2/g). Meanwhile, the pore volumes exhibited the same tendency, which decreased from 0.311 to 0.275 cm3/g and 0.267 cm3/g. This phenomenon suggested that Ni and Zn may be deposited in pores [25]. The XRD patterns were also performed to record the crystallinity of the four catalysts after calcination and reduction in Fig. 3 A and B, respectively. In Fig. 3A, two strong peaks of Cu/γ-Al2O3(a) appeared at 35.5° and 38.7°, corresponding to the (002) and (111) planes of the diffraction peak of CuO (PDF No 45–0937), indicating that CuO existed as relatively large particles. When Ni and Cu were combined(c), the peak of CuO becomed broader and weaker. It indicated that the higher dispersion of Cu in Cu/Ni/γ-Al2O3. With the addition of Zn, the diffraction peak appeared at 36.3°, corresponding to (101) plane of ZnO (PDF No 80–0047). Fig. 3B was XRD patterns of the catalysts after reduction. The diffraction peak of CuO was disappeared in Cu/γ-Al2O3(a), Cu/Ni/γ-Al2O3 (c), Cu/Ni/Zn/γ-Al2O3 (d), but the common diffraction peaks of 43.3°, 50.4° and 74.1° were assigned to the (111) (200) and (220) facets of metal Cu (PDF No 99–0034), respectively. This confirmed that CuO was reduced to Cu. In addition, the Cu diffraction peaks of Cu/Ni/Zn/γ-Al2O3 (d) were significantly weaker than that of Cu/γ-Al2O3 (a), indicating that existed a better dispersion of Cu particles in Cu/Ni/Zn/γ-Al2O3. Furthermore, the crystal size of both calcined and reduced materials from the XRD diffractograms were estimated calculated by Debye-Scherrer equation (Table S1), which the trend was similar to the average size of TEM. H2-TPR of the four catalysts (Cu/γ-Al2O3, Ni/γ-Al2O3, Cu/Ni/γ-Al2O3, Cu/Ni/Zn/γ-Al2O3) were performed to investigate the reduction behavior, and the results were shown in Fig. 4 . The reduction temperature of Ni/γ-Al2O3 (b) was 302 ℃, corresponding to the Ni2+ to Ni0 reduction process in the catalyst. The reduction temperature of Cu/γ-Al2O3 (a) was 197 ℃, corresponding to the reduction process of Cu2+ to Cu0. These results showed that the reduction of Ni2+ was much more difficult than that of Cu2+. For the Cu reduction center, with the addition of Ni and Zn in turn(c and d), the hydrogen consumption peak of CuO shifted to lower temperature, and the reduction temperature decreased to 194 ℃, 190 ℃, respectively. For the Ni reduction center, the reduction temperature of NiO decreased significantly after adding Cu and Zn. The decline of reduction temperature could be ascribed to a strong synergism among Cu, Ni and Zn [46]. The hydrogen consumption of Cu/Ni/γ-Al2O3 was less than that of Cu/Ni/Zn/γ-Al2O3. This could be attributed to the non-reduction of the added ZnO. Since the standard reduction potential of Zn2+(E0 = −0.763) was lower than that of Ni2+(E0 = −0.246) and Cu2+(E0 = 0.337), it was difficult to reduce ZnO with H2 under the TPR conditions. In order to observe the chemical states and electronic structures of four catalysts, XPS measurements were carried out. In Fig. S2 and S3, the full XPS spectra of four catalysts after calcination (Fig. S2) and after reduction (Fig. S3) contained the corresponding C, O, Cu, Ni, Zn and Al elements. The excrescent Na could be attributed to residual Na2CO3 on the catalysts. In the catalysts, the strongest energy absorption of Cu and Ni were the absorption of 2p electrons. Therefore, XPS spectra after deconvolution and binding energy of Cu 2p and Ni 2p of four catalysts after calcination were shown in Fig. S4 and Table S2, respectively. Cu 2p in a, c, d catalysts and Ni 2p in b, c, d catalysts after calcination both showed obvious Cu2+ characteristics (strong satellites) and Ni2+ characteristics (multiplet-split Ni 2p3/2). In Fig. S5, after calcination and after reduction, the binding energy and the peak intensity of Zn 2p were basically unchanged, indicating ZnO had not been reduced, which was in accord with the results of TPR. The XPS spectra of Cu 2p and Ni 2p in Fig. 5 A and B were subjected to peak fitting processing. For Cu 2p of catalysts after reduction, we could confirm the valence state of Cu was Cu0/Cu+. Firstly, the binding energy of Cu 2p3/2 in a, c, d catalysts (Table S3) were close to the binding energy of Cu metal (932.6 eV) and Cu (I) oxide (932.7 eV) instead of Cu (II) oxide (933.1 eV). Secondly, all three Cu 2p XPS spectra of a, c, d catalysts had weak satellites, which was accordant with Cu metal (no satellites) and Cu (I) oxide (weak satellites) instead of Cu (II) oxide (strong satellites). To further distinguish Cu0 and Cu+, the Cu LMM Auger were also tested and the peaks belonging to Cu+ and Cu0 were obtained by peak separation processing (Fig. S6). It was worth noting that the Cu° contents increased with adding Ni and Zn (Table S3). Wang et al. believed that both Cu0 and Cu+ have catalytic effects in hydrogenation reaction and these two active Cu sites on enhancing the catalytic performance play different roles [47,48]. For Ni 2p of catalysts after reduction, we could confirm the valence state of Ni was Ni2+. Firstly, the binding energy of Ni 2p3/2 in b, c, d catalysts (Table S3) were close to the binding energy of NiO (853.7 eV) instead of Ni metal (852.6 eV). Secondly, all three Ni 2p XPS spectra of b, c, d catalysts had multiplet-split Ni 2p3/2 and strong satellites, which was accordant with NiO instead of Ni metal (no multiplet-split Ni 2p3/2 and weak satellites). On one hand, the valence state of Cu and Ni were Cu2+ and Ni2+ after calcination while the valence state of Cu and Ni were Cu0/Cu+ and Ni2+ after reduction, indicating that Cu2+ was easier to reduce than Ni2+, which was also confirmed by XRD and H2-TPR. On the other hand, a certain proportion of Cu0 and Cu+ could promote the activity and selectivity of the catalyst achieve the best effect. The catalysts composition of four catalysts after reduction were characterized by ICP-OES. The ICP-OES analysis data were added to Table S1. ICP-OES results indicated the contents of Cu, Ni and Zn were slightly less than default values, but the overall differences were not much. 3.2 Catalytic performance In order to investigate the catalytic performance of the as-prepared catalysts, the amination experiments of HDO and DMA were carried out according to method 2.3. The relationship between HDO conversion and TMHDA selectivity and reaction time for four catalysts was in Fig. 6 . For Cu/γ-Al2O3 and Ni/γ-Al2O3, the TMHDA contents at 8 h were 3.6 % and 4.9 %, while for Cu/Ni/γ-Al2O3 and Cu/Ni/Zn/γ-Al2O3, the TMHDA contents at 8 h reached about 65.9 % and 85.6 %, respectively. Catalytic performances of other three catalysts (Cu/Zn/γ-Al2O3, Ni/Zn/γ-Al2O3, Zn/γ-Al2O3) were evaluated for further investigating the catalytic performance of Cu, Ni and Zn (Fig. S7). The TMHDA selectivity of Cu/Zn/γ-Al2O3 and Ni/Zn/γ-Al2O3 did not reach 20 % after 8 h. What's more, the yield of TMHDA was only about 1 % over Zn/γ-Al2O3 catalyst. All catalytic results of seven catalysts indicated that coexistence of Cu and Ni was essential in the amination catalyst for the synthesis of TMHDA by catalyzed amination of HDO and DMA [46]. The results demonstrated the strong interaction between Cu, Ni and Zn on the surface of Al2O3 was the critical role in the improvement of catalytic activity. In essence, the formation process of TMHDA requires two hydrogenations and two dehydrogenations (Scheme 1 ) [25,49]. On one hand, it requires the catalyst possesses the capability of dehydrogenation and hydrogenation at the same time. In Cu/Ni-based supported amination catalysts, copper mainly played a dehydrogenation role while nickel mainly played a hydrogenation role, and copper and nickel must be contained to make the catalyst have dehydrogenation and hydrogenation at the same time [50]. On the other hand, the selectivity of the amination catalyst depended on the balance of dehydrogenation and hydrogenation, which required the catalyst structure and reaction conditions to be appropriate [36]. Therefore, the catalyst support, component ratio, reaction temperature and reaction time were further studied. The most widely used catalyst in catalytic amination is the supported catalyst. On one hand, the support can prevent the evolution of copper and improve the stability of the catalyst. On the other hand, adding the support can reduce the cost, which has economic significance. The commonly used catalyst supports include alumina, silica gel, activated carbon, diatomaceous earth, calcium carbonate and so on [51]. In order to obtain the catalyst with better performance, three different catalyst supports were studied. According to the method mentioned in 2.2, catalysts with CaCO3, diatomaceous earth and γ-Al2O3 as supports were prepared respectively, and then amination experiments were performed. The experimental results were in Fig. 7 A. As shown in Fig. 7A, compared with CaCO3 and diatomite, γ-Al2O3 as the catalyst support had relatively superior performance, which the TMHDA content was much higher than that of the other two supports. BET tests were conducted on three different supported catalysts to study the physicochemical properties of catalyst samples. The results were shown in Table S4, Fig. 7B and C. As shown in Table S4, the surface area and pore volume of the γ-Al2O3 supported catalyst were much larger than those of the other two supported catalysts, indicating that the Cu and Ni were well dispersed on the γ-Al2O3 catalyst surface, which was favorable for amination reaction. The N2 adsorption isotherms and pore size distribution curves were shown in Fig. 7B and C. The γ-Al2O3 supported catalyst had a typical type IV isotherm with a H3-type hysteresis loop, indicating that the holes of γ-Al2O3 supported catalyst were uniform size and regular shape. The CaCO3 and diatomite supported catalysts showed characteristic III isotherms with H4-type hysteresis loops. The BET surface areas and pore volumes of the two supported catalysts were both very small, which indicated the two catalyst support were almost solid particles and few channels existed. The pore size distribution of the γ-Al2O3 supported catalyst are unimodal and narrow, so the pore size distribution was more uniform. The influence of reaction temperature on the TMHDA selectivity was explored, as shown in Fig. S8. At 180 ℃, the TMHDA content was relatively low, while the content of intermediate product DMAHO (6-dimethylamino-1-hexanol) was high. With the rise of temperature, DMAHO continued to transform into TMHDA. The reason was that the preparation of diamine catalyzed by diol was a dehydration reaction, which required two dehydrations to obtain the target product TMHDA. Under higher temperature, the water removed from the dehydration reaction can be taken away thus the reaction can continue to proceed. Therefore, 200 ℃ was a more appropriate reaction temperature for the amination reaction of HDO and DMA to TMHDA. Then, five different Cu/Ni molar ratios catalysts (n(Cu)/n(Ni) = 5:1, 4:1, 3:1, 2:1, 1:1) using γ-Al2O3 as supports were prepared, and then amination experiments were conducted. The experimental results are shown in Fig. 8 A, B and C. When the reaction time was 4 h (Fig. 8A), all TMHDA contents were relatively low while the intermediate product DMAHO contents were higher. As reaction time extended to 6 h (Fig. 8B), TMHDA contents were on the rise. For the 4:1 Cu/Ni catalyst, the reaction results reached a high level at 8 h, which the selectivity of TMHDA reached 69 % with only 2 % DMAHO remaining (Fig. 8C). It confirmed that the Cu-Ni ratio should be appropriate, and excess Cu or Ni were unfavorable to the experimental process, which was consistent with the view that the selectivity of the amination catalyst depends on the balance of dehydrogenation and hydrogenation [36]. In view of the good performance of Zn in amination catalysts, four different Cu/Ni/Zn molar ratios catalysts (n(Cu)/n(Ni)/n(Zn)= 28:7:6, 28:7:12, 28:7:20, 28:7:28) were prepared, and then amination experiments were conducted [25,48]. The experimental results were shown in Fig. 8D, E and F. On the basis of the optimized Cu/Ni catalyst, the selectivity of TMHDA could be greatly improved by adding the third component Zn. Compared with the 4:1 Cu/Ni catalyst of 69 %, the Cu/Ni/Zn catalyst (n(Cu)/n(Ni)/n(Zn) = 28:7:12) had a higher TMHDA selectivity of 85 %. Hence, the introduction of Zn was effective for the Cu/Ni/γ-Al2O3 catalyst to enhance the catalytic capability. 3.3 Catalytic reusability The reusability of Cu/Ni/Zn/γ-Al2O3 catalyst (n(Cu)/n(Ni)/n(Zn)=28:7:12) was evaluated (Fig. 9 ). Before used in next cycle, the catalyst was washed with ethanol and deionized water three times and dry in vacuum oven 60 ℃ for 12 h. Besides 5 % new catalyst was added for replenishing the loss. The Cu/Ni/Zn/γ-Al2O3 catalyst could keep the content of TMHDA above 85 % during the first four cycles. In fifth cycle, the yield of TMHDA had been reduced to 75 %, which the sintering of Cu and Ni particles leading the increase of average particle size should be the reason for the decrease of catalytic activity according to the TEM images Cu/Ni/Zn/γ-Al2O3 catalyst after the fifth cycle (Fig. S9) [10]. 4 Conclusion and perspective We developed a series of Cu/Ni/Zn/γ-Al2O3 catalysts by co-precipitation, which was used for HDO and DMA catalytic synthesis to TMHDA, and the structure-activity relationship was studied. The formation process of TMHDA required two hydrogenations and two dehydrogenations. The selectivity of catalysts depended on the balance of dehydrogenation and hydrogenation. The gain effect of Zn on the Cu/Ni dehydrogenation-hydrogenation catalyst can be attributed to two aspects. On one hand, there was a strong synergistic effect among Cu, Ni and Zn, which was conducive to the dispersion of Cu, Ni particles and the generation of more active sites. On the other hand, Zn had an effect on the valence states of Cu after reduction, and a certain proportion of Cu+ and Cu0 would produce a synergistic effect, thus improving the activity and selectivity of the catalyst. In this work, an optimized effective Cu/Ni/Zn/γ-Al2O3 catalyst was used to synthesis tetramethylenediamine, and a promising idea was supplied for industrial production of tertiary diamine by amination of diols on non-noble metal catalysts. CRediT authorship contribution statement Zhifei Wang: Writing – original draft, Visualization, Methodology, Conceptualization. Jun Li: Writing – review & editing, Formal analysis. Yakui Wang: Resources, Methodology. Hongbin Ju: Validation, Project administration, Conceptualization. Lu Zhang: Writing – review & editing, Project administration, Data curation. Yajie Jiang: Supervision, Funding acquisition. Declaration of competing interest The authors declare that they have no known competing financial interests or personal relationships that could have appeared to influence the work reported in this paper. Acknowledgments This work has been financially supported by the Basic Research Project of POLY Sinolight (ZQ2022JC-QN07) and Project of Science and Technology Innovation Fund of China Research Institute of Daily Chemical Industry (CX202203). Supplementary materials Supplementary material associated with this article can be found, in the online version, at doi:10.1016/j.mcat.2024.114601. Appendix Supplementary materials Image, application 1 References [1] S. Bähn S. Imm L. Neubert M. Zhang H. Neumann M. Beller The catalytic amination of alcohols ChemCatChem. 3 2011 1853 1864 10.1002/cctc.201100255 S. Bähn, S. Imm, L. Neubert, M. Zhang, H. Neumann, M. Beller, The catalytic amination of alcohols, ChemCatChem., 3 (2011) 1853–1864, https://doi.org/10.1002/cctc.201100255. [2] Y. Wang S. Furukawa X. Fu N. Yan Organonitrogen chemicals from oxygen-containing feedstock over heterogeneous catalysts ACS Catal. 10 2019 311 335 10.1021/acscatal.9b03744 Y. Wang, S. Furukawa, X. Fu, N. Yan, Organonitrogen chemicals from oxygen-containing feedstock over heterogeneous catalysts, ACS Catal., 10 (2019) 311–335, https://doi.org/10.1021/acscatal.9b03744. [3] X.Q. Ng C.S. Lim M.W. Liaw T.T. Quach B.-M. Yang V. Isoni J. Wu Y. Zhao Direct access to chiral aliphatic amines by catalytic enantioconvergent redox-neutral amination of alcohols Nat. Synth. 2 2023 572 580 10.1038/s44160-023-00264-z X.Q. Ng, C.S. Lim, M.W. Liaw, T.T. Quach, B.-M. Yang, V. Isoni, J. Wu, Y. Zhao, Direct access to chiral aliphatic amines by catalytic enantioconvergent redox-neutral amination of alcohols, Nat. Synth., 2 (2023) 572–580, https://doi.org/10.1038/s44160-023-00264-z. [4] S. Hameury H. Bensalem K. De Oliveira Vigier Sustainable amination of bio-based alcohols by hydrogen borrowing catalysis Catalysts 12 2022 1306 10.3390/catal12111306 S. Hameury, H. Bensalem, K. De Oliveira Vigier, Sustainable amination of bio-based alcohols by hydrogen borrowing catalysis, Catalysts, 12 (2022) 1306, https://doi.org/10.3390/catal12111306. [5] A. Baiker M. Maciejewski Formation and thermal stability of copper and nickel nitrides J. Chem. Soc., Faraday Trans. 1 80 1984 2331 2341 10.1039/F19848002331 A. Baiker, M. Maciejewski, Formation and thermal stability of copper and nickel nitrides, J. Chem. Soc., Faraday Trans. 1, 80 (1984) 2331–2341, https://doi.org/10.1039/F19848002331. [6] H. Abe Y. Yokota K. Okabe Amination catalysts for the production of N, N-dimethyldodecylamine from dodecyl alcohol and dimethylamine Appl. Catal. 52 1989 171 179 10.1016/0166-9834(89)80001-6 H. Abe, Y. Yokota, K. Okabe, Amination catalysts for the production of N, N-dimethyldodecylamine from dodecyl alcohol and dimethylamine, Appl. Catal., 52 (1989) 171–179, https://doi.org/10.1016/0166-9834(89)80001-6. [7] H. Kimura S.-I. Tsutsumi K. Tsukada Reusability of the Cu/Ni-based colloidal catalysts stabilized by carboxylates of alkali-earth metals for the one-step amination of dodecyl alcohol and dimethylamine Appl. Catal. A 292 2005 281 286 10.1016/j.apcata.2005.06.009 H. Kimura, S.-I. Tsutsumi, K. Tsukada, Reusability of the Cu/Ni-based colloidal catalysts stabilized by carboxylates of alkali-earth metals for the one-step amination of dodecyl alcohol and dimethylamine, Appl. Catal. A, 292 (2005) 281–286, https://doi.org/10.1016/j.apcata.2005.06.009. [8] G. Guillena D.J. Ramon M. Yus Hydrogen autotransfer in the N-alkylation of amines and related compounds using alcohols and amines as electrophiles Chem. Rev. 110 2010 1611 1641 10.1021/cr9002159 G. Guillena, D.J. Ramon, M. Yus, Hydrogen autotransfer in the N-alkylation of amines and related compounds using alcohols and amines as electrophiles, Chem. Rev., 110 (2010) 1611–1641, https://doi.org/10.1021/cr9002159. [9] Y. Li H. Cheng C. Zhang B. Zhang T. Liu Q. Wu X. Su W. Lin F. Zhao Reductive amination of 1, 6-hexanediol with Ru/Al 2 O 3 catalyst in supercritical ammonia Sci. China Chem. 60 2017 920 926 10.1007/s11426-017-9049-5 Y. Li, H. Cheng, C. Zhang, B. Zhang, T. Liu, Q. Wu, X. Su, W. Lin, F. Zhao, Reductive amination of 1, 6-hexanediol with Ru/Al 2 O 3 catalyst in supercritical ammonia, Sci. China Chem., 60 (2017) 920–926, https://doi.org/10.1007/s11426-017-9049-5. [10] L. Zhang Y. Yang L. Zhou F. Zhao H. Cheng Reductive amination of 1, 6-hexanediol with a modified Ru/Al2O3 catalyst Appl. Catal. A 669 2024 119509 10.1016/j.apcata.2023.119509 L. Zhang, Y. Yang, L. Zhou, F. Zhao, H. Cheng, Reductive amination of 1, 6-hexanediol with a modified Ru/Al2O3 catalyst, Appl. Catal. A, 669 (2024) 119509, https://doi.org/10.1016/j.apcata.2023.119509. [11] R. Vultier A. Baikera A. Wokaunb Copper catalyzed amination of 1, 6-hexanediol Appl. Catal. 30 1987 167 176 10.1016/S0166-9834(00)81021- R. Vultier, A. Baikera, A. Wokaunb, Copper catalyzed amination of 1, 6-hexanediol, Appl. Catal., 30 (1987) 167–176, https://doi.org/10.1016/S0166-9834(00)81021-. [12] J. Niemeier R.V. Engel M. Rose Is water a suitable solvent for the catalytic amination of alcohols? Green Chem. 19 2017 2839 2845 10.1039/C7GC00422B J. Niemeier, R.V. Engel, M. Rose, Is water a suitable solvent for the catalytic amination of alcohols?, Green Chem., 19 (2017) 2839–2845, https://doi.org/10.1039/C7GC00422B. [13] Z. Xie H. An X. Zhao Y. Wang Insight into highly catalytic performance of Co/γ-Al2O3 for ethylene glycol amination: promotion of catalytic activity of Co by acid sites and base sites Mol. Catal. 528 2022 112492 10.1016/j.mcat.2022.112492 Z. Xie, H. An, X. Zhao, Y. Wang, Insight into highly catalytic performance of Co/γ-Al2O3 for ethylene glycol amination: promotion of catalytic activity of Co by acid sites and base sites, Mol. Catal., 528 (2022) 112492, https://doi.org/10.1016/j.mcat.2022.112492. [14] A. Fischer T. Mallat A. Baiker Amination of diols and polyols to acyclic amines Catal. Today 37 1997 167 189 10.1016/S0920-5861(97)00009-6 A. Fischer, T. Mallat, A. Baiker, Amination of diols and polyols to acyclic amines, Catal. Today, 37 (1997) 167–189, https://doi.org/10.1016/S0920-5861(97)00009-6. [15] A.B. Dros O. Larue A. Reimond F. De Campo M. Pera-Titus Hexamethylenediamine (HMDA) from fossil-vs. bio-based routes: an economic and life cycle assessment comparative study Green Chem. 17 2015 4760 4772 10.1039/C5GC01549A A.B. Dros, O. Larue, A. Reimond, F. De Campo, M. Pera-Titus, Hexamethylenediamine (HMDA) from fossil-vs. bio-based routes: an economic and life cycle assessment comparative study, Green Chem., 17 (2015) 4760–4772, https://doi.org/10.1039/C5GC01549A. [16] H. Huang Y. Wei Y. Cheng S. Xiao M. Chen Z. Wei The acquisition of primary amines from alcohols through reductive amination over heterogeneous catalysts Catalysts. 13 2023 1350 10.3390/catal13101350 H. Huang, Y. Wei, Y. Cheng, S. Xiao, M. Chen, Z. Wei, The acquisition of primary amines from alcohols through reductive amination over heterogeneous catalysts, Catalysts., 13 (2023) 1350, https://doi.org/10.3390/catal13101350. [17] Y. Wu C. Chen Z. Xiong M. Xu Y. Zhao Y. Dai Y. Han Y. Zhou X. Liu J. Wang Metal-acid synergistic catalysis accelerates the hydrogen borrowing amination of alcohols by confining Ru sites in Beta zeolite Chem. Eng. J. 493 2024 152457 10.1016/j.cej.2024.152457 Y. Wu, C. Chen, Z. Xiong, M. Xu, Y. Zhao, Y. Dai, Y. Han, Y. Zhou, X. Liu, J. Wang, Metal-acid synergistic catalysis accelerates the hydrogen borrowing amination of alcohols by confining Ru sites in Beta zeolite, Chem. Eng. J., 493 (2024) 152457, https://doi.org/10.1016/j.cej.2024.152457. [18] X.-P. Fu P. Han Y.-Z. Wang S. Wang N. Yan Insight into the roles of ammonia during direct alcohol amination over supported Ru catalysts J. Catal. 399 2021 121 131 10.1016/j.jcat.2021.05.002 X.-P. Fu, P. Han, Y.-Z. Wang, S. Wang, N. Yan, Insight into the roles of ammonia during direct alcohol amination over supported Ru catalysts, J. Catal., 399 (2021) 121–131, https://doi.org/10.1016/j.jcat.2021.05.002. [19] N. Salarinejad M. Dabiri S.K. Movahed A novel core@ double shell magnetic nitrogen-doped carbon nanotubes as a support for palladium nanoparticles: a highly efficient magnetic catalyst in the direct reductive coupling of nitroarenes and alcohols Catal. Commun. 172 2022 106529 10.1016/j.catcom.2022.106529 N. Salarinejad, M. Dabiri, S.K. Movahed, A novel core@ double shell magnetic nitrogen-doped carbon nanotubes as a support for palladium nanoparticles: a highly efficient magnetic catalyst in the direct reductive coupling of nitroarenes and alcohols, Catal. Commun., 172 (2022) 106529, https://doi.org/10.1016/j.catcom.2022.106529. [20] S.P. Swain O. Shri V. Ravichandiran Iridium and bis (4-nitrophenyl) phosphoric acid catalysed amination of diol by hydrogen-borrowing methodology for the synthesis of cyclic amine: synthesis of clopidogrel Mol. Catal. 508 2021 111576 10.1016/j.mcat.2021.111576 S.P. Swain, O. Shri, V. Ravichandiran, Iridium and bis (4-nitrophenyl) phosphoric acid catalysed amination of diol by hydrogen-borrowing methodology for the synthesis of cyclic amine: synthesis of clopidogrel, Mol. Catal., 508 (2021) 111576, https://doi.org/10.1016/j.mcat.2021.111576. [21] S. Jia T. Tong X. Liu Y. Guo L. Dong Z. Chen Y. Wang Identifying a superior Ptδ+ species for the hydrogen-borrowing amination of alcohol at low temperature J. Catal. 432 2024 115407 10.1016/j.jcat.2024.115407 S. Jia, T. Tong, X. Liu, Y. Guo, L. Dong, Z. Chen, Y. Wang, Identifying a superior Ptδ+ species for the hydrogen-borrowing amination of alcohol at low temperature, J. Catal., 432 (2024) 115407, https://doi.org/10.1016/j.jcat.2024.115407. [22] T. Wang J. Ibañez K. Wang L. Fang M. Sabbe C. Michel S. Paul M. Pera-Titus P. Sautet Rational design of selective metal catalysts for alcohol amination with ammonia Nat. Catal. 2 2019 773 779 10.1038/s41929-019-0327-2 T. Wang, J. Ibañez, K. Wang, L. Fang, M. Sabbe, C. Michel, S. Paul, M. Pera-Titus, P. Sautet, Rational design of selective metal catalysts for alcohol amination with ammonia, Nat. Catal., 2 (2019) 773–779, https://doi.org/10.1038/s41929-019-0327-2. [23] Y. Zeng B. Wang W. Xu X. Yan Y. Li G. Bai L. Chen Cr and Co-modified Cu/Al 2 O 3 as an efficient catalyst for the continuous synthesis of bis (2-dimethylaminoethyl) ether Catal. Sci. Technol. 12 2022 2084 2096 10.1039/D1CY02155A Y. Zeng, B. Wang, W. Xu, X. Yan, Y. Li, G. Bai, L. Chen, Cr and Co-modified Cu/Al 2 O 3 as an efficient catalyst for the continuous synthesis of bis (2-dimethylaminoethyl) ether, Catal. Sci. Technol., 12 (2022) 2084–2096, https://doi.org/10.1039/D1CY02155A. [24] S.K. Beepala H. Mitta H. Sk P. Balla V.R.C. Komandur Reductive amination of cyclohexanol/cyclohexanone to cyclohexylamine using SBA-15 supported copper catalysts J. Indian Chem. Soc. 99 2022 100451 10.1016/j.jics.2022.100451 S.K. Beepala, H. Mitta, H. Sk, P. Balla, V.R.C. Komandur, Reductive amination of cyclohexanol/cyclohexanone to cyclohexylamine using SBA-15 supported copper catalysts, J. Indian Chem. Soc., 99 (2022) 100451, https://doi.org/10.1016/j.jics.2022.100451. [25] X. Cai Y. Ke B. Wang Y. Zeng L. Chen Y. Li G. Bai X. Yan Efficient catalytic amination of diols to diamines over Cu/ZnO/γ-Al2O3 Mol. Catal. 508 2021 111608 10.1016/j.mcat.2021.111608 X. Cai, Y. Ke, B. Wang, Y. Zeng, L. Chen, Y. Li, G. Bai, X. Yan, Efficient catalytic amination of diols to diamines over Cu/ZnO/γ-Al2O3, Mol. Catal., 508 (2021) 111608, https://doi.org/10.1016/j.mcat.2021.111608. [26] W.P. Carson A.V. Tsymbal R.W. Pipal G.A. Edwards J.R. Martinelli A. Cabré D.W.C. MacMillan Free-radical deoxygenative amination of alcohols via copper metallaphotoredox catalysis J. Am. Chem. Soc. 2024 10.1021/jacs.4c04477 W.P. Carson, A.V. Tsymbal, R.W. Pipal, G.A. Edwards, J.R. Martinelli, A. Cabré, D.W.C. MacMillan, Free-radical deoxygenative amination of alcohols via copper metallaphotoredox catalysis, J. Am. Chem. Soc., (2024), https://doi.org/10.1021/jacs.4c04477. [27] A. Tomer F. Wyrwalski C. Przybylski J.-F. Paul E. Monflier M. Pera-Titus A. Ponchel Facile preparation of Ni/Al2O3 catalytic formulations with the aid of cyclodextrin complexes: towards highly active and robust catalysts for the direct amination of alcohols J. Catal. 356 2017 111 124 10.1016/j.jcat.2017.10.006 A. Tomer, F. Wyrwalski, C. Przybylski, J.-F. Paul, E. Monflier, M. Pera-Titus, A. Ponchel, Facile preparation of Ni/Al2O3 catalytic formulations with the aid of cyclodextrin complexes: towards highly active and robust catalysts for the direct amination of alcohols, J. Catal., 356 (2017) 111–124, https://doi.org/10.1016/j.jcat.2017.10.006. [28] C. Yue L. Gu Z. Zhang X. Wei H. Yang Nickel-and cobalt-based heterogeneous catalytic systems for selective primary amination of alcohol with ammonia Arab. J. Chem. 15 2022 103865 10.1016/j.arabjc.2022.103865 C. Yue, L. Gu, Z. Zhang, X. Wei, H. Yang, Nickel-and cobalt-based heterogeneous catalytic systems for selective primary amination of alcohol with ammonia, Arab. J. Chem., 15 (2022) 103865, https://doi.org/10.1016/j.arabjc.2022.103865. [29] G. Zhao L. Yu X. Yan Y. Li D. Wang L. Chen The role of iron in the selective amination of 1, 2-butanediol to 2-amino-1-butanol over Co–Ba–Fe/γ-Al 2 O 3 React. Kinetics, Mech. Catal. 100 2010 449 457 10.1007/s11144-010-0203-1 G. Zhao, L. Yu, X. Yan, Y. Li, D. Wang, L. Chen, The role of iron in the selective amination of 1, 2-butanediol to 2-amino-1-butanol over Co–Ba–Fe/γ-Al 2 O 3, React. Kinetics, Mech. Catal., 100 (2010) 449–457, https://doi.org/10.1007/s11144-010-0203-1. [30] R. Kumar A.K. Srivastava P. Nagarasu V. Madhu E. Balaraman A general and expedient amination of alcohols catalysed by a single-site (NN) Co (ii)-bidentate complex under solventless conditions Catal. Sci. Technol. 14 2024 98 109 10.1039/d3cy00809f R. Kumar, A.K. Srivastava, P. Nagarasu, V. Madhu, E. Balaraman, A general and expedient amination of alcohols catalysed by a single-site (NN) Co (ii)-bidentate complex under solventless conditions, Catal. Sci. Technol., 14 (2024) 98–109, https://doi.org/10.1039/d3cy00809f. [31] Z. Jue Y. Huang J. Qian P. Hu Visible light-induced unactivated δ-C (sp3)− H amination of alcohols catalyzed by iron ChemSusChem. 15 2022 e202201241 10.1002/cssc.202201241 Z. Jue, Y. Huang, J. Qian, P. Hu, Visible light-induced unactivated δ-C (sp3)− H amination of alcohols catalyzed by iron, ChemSusChem., 15 (2022) e202201241, https://doi.org/10.1002/cssc.202201241. [32] F. Niu M. Bahri O. Ersen Z. Yan B.T. Kusema A.Y. Khodakov V.V. Ordomsky A multifaceted role of a mobile bismuth promoter in alcohol amination over cobalt catalysts Green Chem. 22 2020 4270 4278 10.1039/D0GC00937G F. Niu, M. Bahri, O. Ersen, Z. Yan, B.T. Kusema, A.Y. Khodakov, V.V. Ordomsky, A multifaceted role of a mobile bismuth promoter in alcohol amination over cobalt catalysts, Green Chem., 22 (2020) 4270–4278, https://doi.org/10.1039/D0GC00937G. [33] K.-I. Shimizu K. Shimura M. Nishimura A. Satsuma Silver cluster-promoted heterogeneous copper catalyst for N-alkylation of amines with alcohols RSC Adv. 1 2011 1310 1317 10.1039/C1RA00560J K.-I. Shimizu, K. Shimura, M. Nishimura, A. Satsuma, Silver cluster-promoted heterogeneous copper catalyst for N-alkylation of amines with alcohols, RSC Adv., 1 (2011) 1310–1317, https://doi.org/10.1039/C1RA00560J. [34] L. Ma L. Yan A.-H. Lu Y. Ding Effect of Re promoter on the structure and catalytic performance of Ni–Re/Al 2 O 3 catalysts for the reductive amination of monoethanolamine RSC Adv. 8 2018 8152 8163 10.1039/C7RA12891F L. Ma, L. Yan, A.-H. Lu, Y. Ding, Effect of Re promoter on the structure and catalytic performance of Ni–Re/Al 2 O 3 catalysts for the reductive amination of monoethanolamine, RSC Adv., 8 (2018) 8152–8163, https://doi.org/10.1039/C7RA12891F. [35] J. Yang Y.-D. Wu M. Pu Direct amination of α-triaryl alcohols via vanadium catalysis J. Org. Chem. 88 2023 7172 7178 10.1021/acs.joc.3c00414 J. Yang, Y.-D. Wu, M. Pu, Direct amination of α-triaryl alcohols via vanadium catalysis, J. Org. Chem., 88 (2023) 7172–7178, https://doi.org/10.1021/acs.joc.3c00414. [36] H. Abe K. Hashiba Y. Yokota K. Okabe Studies on the catalyst for the production of N, N-dimethyl (long-chain alkyl amines) J. Jpn. Oil Chemists' Soc. 37 1988 519 523 10.5650/jos1956.37.519 H. Abe, K. Hashiba, Y. Yokota, K. Okabe, Studies on the catalyst for the production of N, N-dimethyl (long-chain alkyl amines), J. Jpn. Oil Chemists' Soc., 37 (1988) 519–523, https://doi.org/10.5650/jos1956.37.519. [37] L. Qiuxiao Z. Gaoyong P. Shaoyi Study of the amination of fatty alcohols catalyzed by Cu− Ni catalysts J. Surfactants Deterg. 5 2002 229 233 10.1007/s11743-002-0222-0 L. Qiuxiao, Z. Gaoyong, P. Shaoyi, Study of the amination of fatty alcohols catalyzed by Cu− Ni catalysts, J. Surfactants Deterg., 5 (2002) 229–233, https://doi.org/10.1007/s11743-002-0222-0. [38] H. Kimura Progress in one-step amination of long-chain fatty alcohols with dimethylamine—development of key technologies for industrial applications, innovations, and future outlook Catal. Rev. 53 2011 1 90 10.1080/01614940.2011.556913 H. Kimura, Progress in one-step amination of long-chain fatty alcohols with dimethylamine—development of key technologies for industrial applications, innovations, and future outlook, Catal. Rev., 53 (2011) 1–90, https://doi.org/10.1080/01614940.2011.556913. [39] S. Hou Y. Wang J. Li Z. Wang Y. Jiang T. Geng Effects of the number of cationic sites on the surface/interfacial activity and application properties of quaternary ammonium surfactants Colloids Surf. A 656 2023 130523 10.1016/j.colsurfa.2022.130523 S. Hou, Y. Wang, J. Li, Z. Wang, Y. Jiang, T. Geng, Effects of the number of cationic sites on the surface/interfacial activity and application properties of quaternary ammonium surfactants, Colloids Surf. A, 656 (2023) 130523, https://doi.org/10.1016/j.colsurfa.2022.130523. [40] Q. Jin Y. Ren L. Ma A. Zhang M. Yang S. Gong X. Zhang G. He F. Zhang Cyclodextrin-alkyldiamine rotaxane cross-linked anion exchange membranes for electrodialysis J. Memb. Sci. 2024 122933 10.1016/j.memsci.2024.122933 Q. Jin, Y. Ren, L. Ma, A. Zhang, M. Yang, S. Gong, X. Zhang, G. He, F. Zhang, Cyclodextrin-alkyldiamine rotaxane cross-linked anion exchange membranes for electrodialysis, J. Memb. Sci., (2024) 122933, https://doi.org/10.1016/j.memsci.2024.122933. [41] A. Ding J. Zhou X. Cheng C. Shen S. Gao Quaternized poly (2, 6-dimethyl-1, 4-phenylene oxide) crosslinked by tertiary amine and siloxane for anion exchange membranes J. Appl. Polym. Sci. 138 2021 50201 10.1002/app.50201 A. Ding, J. Zhou, X. Cheng, C. Shen, S. Gao, Quaternized poly (2, 6-dimethyl-1, 4-phenylene oxide) crosslinked by tertiary amine and siloxane for anion exchange membranes, J. Appl. Polym. Sci., 138 (2021) 50201, https://doi.org/10.1002/app.50201. [42] J. Runeberg A. Baiker J. Kijenski Copper catalyzed amination of ethylene glycol Appl. Catal. 17 1985 309 319 10.1016/S0166-9834(00)83211-X J. Runeberg, A. Baiker, J. Kijenski, Copper catalyzed amination of ethylene glycol, Appl. Catal., 17 (1985) 309–319, https://doi.org/10.1016/S0166-9834(00)83211-X. [43] D.C. Mesch, Process for the manufacture of w,w,'-diamino alkanes, oxa alkanes or aza alkanes, EP0006454A1, 1980. [44] S. Natesakhawat J.W. Lekse J.P. Baltrus P.R. Ohodnicki B.H. Howard X. Deng C. Matranga Active sites and structure–activity relationships of copper-based catalysts for carbon dioxide hydrogenation to methanol ACS Catal. 2 2012 1667 1676 10.1021/cs300008g S. Natesakhawat, J.W. Lekse, J.P. Baltrus, P.R. Ohodnicki, B.H. Howard, X. Deng, C. Matranga, Active sites and structure–activity relationships of copper-based catalysts for carbon dioxide hydrogenation to methanol, ACS Catal., 2 (2012) 1667–1676, https://doi.org/10.1021/cs300008g. [45] M. Thommes K. Kaneko A.V. Neimark J.P. Olivier F. Rodriguez-Reinoso J. Rouquerol K.S.W. Sing Physisorption of gases, with special reference to the evaluation of surface area and pore size distribution (IUPAC Technical Report) Pure Appl. Chem. 87 2015 1051 1069 10.1515/pac-2014-1117 M. Thommes, K. Kaneko, A.V. Neimark, J.P. Olivier, F. Rodriguez-Reinoso, J. Rouquerol, K.S.W. Sing, Physisorption of gases, with special reference to the evaluation of surface area and pore size distribution (IUPAC Technical Report), Pure Appl. Chem., 87 (2015) 1051–1069, https://doi.org/10.1515/pac-2014-1117. [46] Y. Li Q. Li L. Zhi M. Zhang Catalytic amination of octanol for synthesis of trioctylamine and catalyst characterization Catal. Lett. 141 2011 1635 1642 10.1007/s10562-011-0686-z Y. Li, Q. Li, L. Zhi, M. Zhang, Catalytic amination of octanol for synthesis of trioctylamine and catalyst characterization, Catal. Lett., 141 (2011) 1635–1642, https://doi.org/10.1007/s10562-011-0686-z. [47] Y. Wang Y. Shen Y. Zhao J. Lv S. Wang X. Ma Insight into the balancing effect of active Cu species for hydrogenation of carbon–oxygen bonds ACS Catal. 5 2015 6200 6208 10.1021/acscatal.5b01678 Y. Wang, Y. Shen, Y. Zhao, J. Lv, S. Wang, X. Ma, Insight into the balancing effect of active Cu species for hydrogenation of carbon–oxygen bonds, ACS Catal., 5 (2015) 6200–6208, https://doi.org/10.1021/acscatal.5b01678. [48] F. Pei Z. Wang J. Lv F. Li W. Xue Efficient catalytic transfer hydrogenation of acetophenone to 1-phenylethanol over Cu–Zn–Al catalysts Ind. Eng. Chem. Res. 61 2022 5419 5428 10.1021/acs.iecr.2c00003 F. Pei, Z. Wang, J. Lv, F. Li, W. Xue, Efficient catalytic transfer hydrogenation of acetophenone to 1-phenylethanol over Cu–Zn–Al catalysts, Ind. Eng. Chem. Res., 61 (2022) 5419–5428, https://doi.org/10.1021/acs.iecr.2c00003. [49] B. Jürgen J.P.M. Niederer M. Keller W.F. Hlderich Amination of cyclohexanone and cyclohexanol/cyclohexanone in the presence of ammonia and hydrogen using copper or a group VIII metal supported on a carrier as the catalyst Appl. Catal. A General 197 2000 229 238 10.1016/S0926-860X(99)00482-2 B. Jürgen, J.P.M. Niederer, M. Keller, W.F. Hlderich, Amination of cyclohexanone and cyclohexanol/cyclohexanone in the presence of ammonia and hydrogen using copper or a group VIII metal supported on a carrier as the catalyst, Appl. Catal. A General, 197 (2000) 229–238, https://doi.org/10.1016/S0926-860X(99)00482-2. [50] M. Imabeppu K. Kiyoga S. Okamura H. Shoho H. Kimura One-step amination of α,ω-alkylenediols over Cu/Ni-based catalysts Catal. Commun. 10 2009 753 757 10.1016/j.catcom.2008.10.046 M. Imabeppu, K. Kiyoga, S. Okamura, H. Shoho, H. Kimura, One-step amination of α,ω-alkylenediols over Cu/Ni-based catalysts, Catal. Commun., 10 (2009) 753–757, https://doi.org/10.1016/j.catcom.2008.10.046. [51] A. Baiker W. Richarz Activity, selectivity, decay and long-term behaviour of amination catalysts Helv. Chim. Acta 61 1978 1169 1174 10.1002/hlca.19780610332 A. Baiker, W. Richarz, Activity, selectivity, decay and long-term behaviour of amination catalysts, Helv. Chim. Acta, 61 (1978) 1169–1174, https://doi.org/10.1002/hlca.19780610332.",
      "scopus-id": "85205931911",
      "coredata": {
        "eid": "1-s2.0-S2468823124007831",
        "dc:description": "Synthesis of N, N, N’, N’-tetramethyl-1,6-hexanediamine(TMHDA) by the amination of 1,6-hexanediol(HDO) and dimethylamine(DMA) at normal pressure over an outstanding Cu/Ni/Zn catalyst supported on aluminum oxide(γ-Al2O3) was studied in this article. Cu/Ni/Zn/γ-Al2O3(Cu: Ni: Zn = 28: 7: 12) exhibited excellent catalytic performance, which HDO was almost completely transformed and TMHDA reached 85 % selectivity at 200 °C. The amination of HDO required two hydrogenations and two dehydrogenations, and the selectivity of the amination catalyst depended on the balance of dehydrogenation and hydrogenation. Various characterization (TEM, BET, XRD, H2-TPR, XPS) demonstrated that the addition of Zn to the Cu/Ni catalyst could reduce the agglomeration of Cu/Ni particles and change the valence distribution of Cu. The Cu/Ni/Zn/γ-Al2O3 catalyst was a very promising and green method for the synthesis of tertiary diamines through amination of diols.",
        "openArchiveArticle": "false",
        "prism:coverDate": "2024-12-31",
        "openaccessUserLicense": null,
        "prism:aggregationType": "Journal",
        "prism:url": "https://api.elsevier.com/content/article/pii/S2468823124007831",
        "dc:creator": [
          {
            "@_fa": "true",
            "$": "Wang, Zhifei"
          },
          {
            "@_fa": "true",
            "$": "Li, Jun"
          },
          {
            "@_fa": "true",
            "$": "Wang, Yakui"
          },
          {
            "@_fa": "true",
            "$": "Ju, Hongbin"
          },
          {
            "@_fa": "true",
            "$": "Zhang, Lu"
          },
          {
            "@_fa": "true",
            "$": "Jiang, Yajie"
          }
        ],
        "link": [
          {
            "@_fa": "true",
            "@rel": "self",
            "@href": "https://api.elsevier.com/content/article/pii/S2468823124007831"
          },
          {
            "@_fa": "true",
            "@rel": "scidir",
            "@href": "https://www.sciencedirect.com/science/article/pii/S2468823124007831"
          }
        ],
        "dc:format": "application/json",
        "openaccessType": null,
        "pii": "S2468-8231(24)00783-1",
        "prism:volume": "569",
        "articleNumber": "114601",
        "prism:publisher": "Elsevier B.V. All rights are reserved, including those for text and data mining, AI training, and similar technologies.",
        "dc:title": "Catalytic amination of 1,6-hexanediol for synthesis of N, N, N’, N’-tetramethyl-1,6-hexanediamine over Cu/Ni/Zn catalysts",
        "prism:copyright": "© 2024 Elsevier B.V. All rights are reserved, including those for text and data mining, AI training, and similar technologies.",
        "openaccess": "0",
        "prism:issn": "24688231",
        "dcterms:subject": [
          {
            "@_fa": "true",
            "$": "N,N, N’, N’-tetramethyl-1,6-hexanediamine"
          },
          {
            "@_fa": "true",
            "$": "Catalytic amination"
          },
          {
            "@_fa": "true",
            "$": "1,6-hexanediol"
          },
          {
            "@_fa": "true",
            "$": "Cu/Ni/Zn/γ-Al2O3 catalysts"
          },
          {
            "@_fa": "true",
            "$": "Characterization"
          }
        ],
        "openaccessArticle": "false",
        "prism:publicationName": "Molecular Catalysis",
        "openaccessSponsorType": null,
        "prism:pageRange": "114601",
        "pubType": "fla",
        "prism:coverDisplayDate": "December 2024",
        "prism:doi": "10.1016/j.mcat.2024.114601",
        "prism:startingPage": "114601",
        "dc:identifier": "doi:10.1016/j.mcat.2024.114601",
        "openaccessSponsorName": null
      },
      "objects": {
        "object": [
          {
            "@category": "standard",
            "@height": "292",
            "@width": "753",
            "@_fa": "true",
            "$": "https://api.elsevier.com/content/object/eid/1-s2.0-S2468823124007831-gr6.jpg?httpAccept=%2A%2F%2A",
            "@multimediatype": "JPEG image file",
            "@type": "IMAGE-DOWNSAMPLED",
            "@size": "39560",
            "@ref": "gr6",
            "@mimetype": "image/jpeg"
          },
          {
            "@category": "standard",
            "@height": "314",
            "@width": "753",
            "@_fa": "true",
            "$": "https://api.elsevier.com/content/object/eid/1-s2.0-S2468823124007831-gr5.jpg?httpAccept=%2A%2F%2A",
            "@multimediatype": "JPEG image file",
            "@type": "IMAGE-DOWNSAMPLED",
            "@size": "81908",
            "@ref": "gr5",
            "@mimetype": "image/jpeg"
          },
          {
            "@category": "standard",
            "@height": "405",
            "@width": "791",
            "@_fa": "true",
            "$": "https://api.elsevier.com/content/object/eid/1-s2.0-S2468823124007831-gr8.jpg?httpAccept=%2A%2F%2A",
            "@multimediatype": "JPEG image file",
            "@type": "IMAGE-DOWNSAMPLED",
            "@size": "94306",
            "@ref": "gr8",
            "@mimetype": "image/jpeg"
          },
          {
            "@category": "standard",
            "@height": "195",
            "@width": "791",
            "@_fa": "true",
            "$": "https://api.elsevier.com/content/object/eid/1-s2.0-S2468823124007831-gr7.jpg?httpAccept=%2A%2F%2A",
            "@multimediatype": "JPEG image file",
            "@type": "IMAGE-DOWNSAMPLED",
            "@size": "44760",
            "@ref": "gr7",
            "@mimetype": "image/jpeg"
          },
          {
            "@category": "standard",
            "@height": "277",
            "@width": "376",
            "@_fa": "true",
            "$": "https://api.elsevier.com/content/object/eid/1-s2.0-S2468823124007831-gr9.jpg?httpAccept=%2A%2F%2A",
            "@multimediatype": "JPEG image file",
            "@type": "IMAGE-DOWNSAMPLED",
            "@size": "27398",
            "@ref": "gr9",
            "@mimetype": "image/jpeg"
          },
          {
            "@category": "standard",
            "@height": "467",
            "@width": "715",
            "@_fa": "true",
            "$": "https://api.elsevier.com/content/object/eid/1-s2.0-S2468823124007831-sc1.jpg?httpAccept=%2A%2F%2A",
            "@multimediatype": "JPEG image file",
            "@type": "IMAGE-DOWNSAMPLED",
            "@size": "73726",
            "@ref": "sc1",
            "@mimetype": "image/jpeg"
          },
          {
            "@category": "standard",
            "@height": "301",
            "@width": "753",
            "@_fa": "true",
            "$": "https://api.elsevier.com/content/object/eid/1-s2.0-S2468823124007831-gr2.jpg?httpAccept=%2A%2F%2A",
            "@multimediatype": "JPEG image file",
            "@type": "IMAGE-DOWNSAMPLED",
            "@size": "60729",
            "@ref": "gr2",
            "@mimetype": "image/jpeg"
          },
          {
            "@category": "standard",
            "@height": "200",
            "@width": "308",
            "@_fa": "true",
            "$": "https://api.elsevier.com/content/object/eid/1-s2.0-S2468823124007831-ga1.jpg?httpAccept=%2A%2F%2A",
            "@multimediatype": "JPEG image file",
            "@type": "IMAGE-DOWNSAMPLED",
            "@size": "24277",
            "@ref": "ga1",
            "@mimetype": "image/jpeg"
          },
          {
            "@category": "standard",
            "@height": "567",
            "@width": "565",
            "@_fa": "true",
            "$": "https://api.elsevier.com/content/object/eid/1-s2.0-S2468823124007831-gr1.jpg?httpAccept=%2A%2F%2A",
            "@multimediatype": "JPEG image file",
            "@type": "IMAGE-DOWNSAMPLED",
            "@size": "141383",
            "@ref": "gr1",
            "@mimetype": "image/jpeg"
          },
          {
            "@category": "standard",
            "@height": "320",
            "@width": "376",
            "@_fa": "true",
            "$": "https://api.elsevier.com/content/object/eid/1-s2.0-S2468823124007831-gr4.jpg?httpAccept=%2A%2F%2A",
            "@multimediatype": "JPEG image file",
            "@type": "IMAGE-DOWNSAMPLED",
            "@size": "23996",
            "@ref": "gr4",
            "@mimetype": "image/jpeg"
          },
          {
            "@category": "standard",
            "@height": "296",
            "@width": "753",
            "@_fa": "true",
            "$": "https://api.elsevier.com/content/object/eid/1-s2.0-S2468823124007831-gr3.jpg?httpAccept=%2A%2F%2A",
            "@multimediatype": "JPEG image file",
            "@type": "IMAGE-DOWNSAMPLED",
            "@size": "84937",
            "@ref": "gr3",
            "@mimetype": "image/jpeg"
          },
          {
            "@category": "thumbnail",
            "@height": "85",
            "@width": "219",
            "@_fa": "true",
            "$": "https://api.elsevier.com/content/object/eid/1-s2.0-S2468823124007831-gr6.sml?httpAccept=%2A%2F%2A",
            "@multimediatype": "GIF image file",
            "@type": "IMAGE-THUMBNAIL",
            "@size": "6916",
            "@ref": "gr6",
            "@mimetype": "image/gif"
          },
          {
            "@category": "thumbnail",
            "@height": "91",
            "@width": "219",
            "@_fa": "true",
            "$": "https://api.elsevier.com/content/object/eid/1-s2.0-S2468823124007831-gr5.sml?httpAccept=%2A%2F%2A",
            "@multimediatype": "GIF image file",
            "@type": "IMAGE-THUMBNAIL",
            "@size": "11458",
            "@ref": "gr5",
            "@mimetype": "image/gif"
          },
          {
            "@category": "thumbnail",
            "@height": "112",
            "@width": "219",
            "@_fa": "true",
            "$": "https://api.elsevier.com/content/object/eid/1-s2.0-S2468823124007831-gr8.sml?httpAccept=%2A%2F%2A",
            "@multimediatype": "GIF image file",
            "@type": "IMAGE-THUMBNAIL",
            "@size": "15960",
            "@ref": "gr8",
            "@mimetype": "image/gif"
          },
          {
            "@category": "thumbnail",
            "@height": "54",
            "@width": "219",
            "@_fa": "true",
            "$": "https://api.elsevier.com/content/object/eid/1-s2.0-S2468823124007831-gr7.sml?httpAccept=%2A%2F%2A",
            "@multimediatype": "GIF image file",
            "@type": "IMAGE-THUMBNAIL",
            "@size": "6895",
            "@ref": "gr7",
            "@mimetype": "image/gif"
          },
          {
            "@category": "thumbnail",
            "@height": "161",
            "@width": "219",
            "@_fa": "true",
            "$": "https://api.elsevier.com/content/object/eid/1-s2.0-S2468823124007831-gr9.sml?httpAccept=%2A%2F%2A",
            "@multimediatype": "GIF image file",
            "@type": "IMAGE-THUMBNAIL",
            "@size": "13959",
            "@ref": "gr9",
            "@mimetype": "image/gif"
          },
          {
            "@category": "thumbnail",
            "@height": "143",
            "@width": "219",
            "@_fa": "true",
            "$": "https://api.elsevier.com/content/object/eid/1-s2.0-S2468823124007831-sc1.sml?httpAccept=%2A%2F%2A",
            "@multimediatype": "GIF image file",
            "@type": "IMAGE-THUMBNAIL",
            "@size": "10726",
            "@ref": "sc1",
            "@mimetype": "image/gif"
          },
          {
            "@category": "thumbnail",
            "@height": "88",
            "@width": "219",
            "@_fa": "true",
            "$": "https://api.elsevier.com/content/object/eid/1-s2.0-S2468823124007831-gr2.sml?httpAccept=%2A%2F%2A",
            "@multimediatype": "GIF image file",
            "@type": "IMAGE-THUMBNAIL",
            "@size": "8811",
            "@ref": "gr2",
            "@mimetype": "image/gif"
          },
          {
            "@category": "thumbnail",
            "@height": "142",
            "@width": "219",
            "@_fa": "true",
            "$": "https://api.elsevier.com/content/object/eid/1-s2.0-S2468823124007831-ga1.sml?httpAccept=%2A%2F%2A",
            "@multimediatype": "GIF image file",
            "@type": "IMAGE-THUMBNAIL",
            "@size": "10672",
            "@ref": "ga1",
            "@mimetype": "image/gif"
          },
          {
            "@category": "thumbnail",
            "@height": "163",
            "@width": "163",
            "@_fa": "true",
            "$": "https://api.elsevier.com/content/object/eid/1-s2.0-S2468823124007831-gr1.sml?httpAccept=%2A%2F%2A",
            "@multimediatype": "GIF image file",
            "@type": "IMAGE-THUMBNAIL",
            "@size": "23075",
            "@ref": "gr1",
            "@mimetype": "image/gif"
          },
          {
            "@category": "thumbnail",
            "@height": "164",
            "@width": "193",
            "@_fa": "true",
            "$": "https://api.elsevier.com/content/object/eid/1-s2.0-S2468823124007831-gr4.sml?httpAccept=%2A%2F%2A",
            "@multimediatype": "GIF image file",
            "@type": "IMAGE-THUMBNAIL",
            "@size": "8159",
            "@ref": "gr4",
            "@mimetype": "image/gif"
          },
          {
            "@category": "thumbnail",
            "@height": "86",
            "@width": "219",
            "@_fa": "true",
            "$": "https://api.elsevier.com/content/object/eid/1-s2.0-S2468823124007831-gr3.sml?httpAccept=%2A%2F%2A",
            "@multimediatype": "GIF image file",
            "@type": "IMAGE-THUMBNAIL",
            "@size": "11035",
            "@ref": "gr3",
            "@mimetype": "image/gif"
          },
          {
            "@category": "high",
            "@height": "1293",
            "@width": "3333",
            "@_fa": "true",
            "$": "https://api.elsevier.com/content/object/eid/1-s2.0-S2468823124007831-gr6_lrg.jpg?httpAccept=%2A%2F%2A",
            "@multimediatype": "JPEG image file",
            "@type": "IMAGE-HIGH-RES",
            "@size": "251321",
            "@ref": "gr6",
            "@mimetype": "image/jpeg"
          },
          {
            "@category": "high",
            "@height": "1388",
            "@width": "3333",
            "@_fa": "true",
            "$": "https://api.elsevier.com/content/object/eid/1-s2.0-S2468823124007831-gr5_lrg.jpg?httpAccept=%2A%2F%2A",
            "@multimediatype": "JPEG image file",
            "@type": "IMAGE-HIGH-RES",
            "@size": "545558",
            "@ref": "gr5",
            "@mimetype": "image/jpeg"
          },
          {
            "@category": "high",
            "@height": "1791",
            "@width": "3500",
            "@_fa": "true",
            "$": "https://api.elsevier.com/content/object/eid/1-s2.0-S2468823124007831-gr8_lrg.jpg?httpAccept=%2A%2F%2A",
            "@multimediatype": "JPEG image file",
            "@type": "IMAGE-HIGH-RES",
            "@size": "611761",
            "@ref": "gr8",
            "@mimetype": "image/jpeg"
          },
          {
            "@category": "high",
            "@height": "863",
            "@width": "3500",
            "@_fa": "true",
            "$": "https://api.elsevier.com/content/object/eid/1-s2.0-S2468823124007831-gr7_lrg.jpg?httpAccept=%2A%2F%2A",
            "@multimediatype": "JPEG image file",
            "@type": "IMAGE-HIGH-RES",
            "@size": "276502",
            "@ref": "gr7",
            "@mimetype": "image/jpeg"
          },
          {
            "@category": "high",
            "@height": "1227",
            "@width": "1667",
            "@_fa": "true",
            "$": "https://api.elsevier.com/content/object/eid/1-s2.0-S2468823124007831-gr9_lrg.jpg?httpAccept=%2A%2F%2A",
            "@multimediatype": "JPEG image file",
            "@type": "IMAGE-HIGH-RES",
            "@size": "165871",
            "@ref": "gr9",
            "@mimetype": "image/jpeg"
          },
          {
            "@category": "high",
            "@height": "2069",
            "@width": "3167",
            "@_fa": "true",
            "$": "https://api.elsevier.com/content/object/eid/1-s2.0-S2468823124007831-sc1_lrg.jpg?httpAccept=%2A%2F%2A",
            "@multimediatype": "JPEG image file",
            "@type": "IMAGE-HIGH-RES",
            "@size": "495947",
            "@ref": "sc1",
            "@mimetype": "image/jpeg"
          },
          {
            "@category": "high",
            "@height": "1332",
            "@width": "3333",
            "@_fa": "true",
            "$": "https://api.elsevier.com/content/object/eid/1-s2.0-S2468823124007831-gr2_lrg.jpg?httpAccept=%2A%2F%2A",
            "@multimediatype": "JPEG image file",
            "@type": "IMAGE-HIGH-RES",
            "@size": "403650",
            "@ref": "gr2",
            "@mimetype": "image/jpeg"
          },
          {
            "@category": "high",
            "@height": "886",
            "@width": "1365",
            "@_fa": "true",
            "$": "https://api.elsevier.com/content/object/eid/1-s2.0-S2468823124007831-ga1_lrg.jpg?httpAccept=%2A%2F%2A",
            "@multimediatype": "JPEG image file",
            "@type": "IMAGE-HIGH-RES",
            "@size": "161164",
            "@ref": "ga1",
            "@mimetype": "image/jpeg"
          },
          {
            "@category": "high",
            "@height": "2507",
            "@width": "2500",
            "@_fa": "true",
            "$": "https://api.elsevier.com/content/object/eid/1-s2.0-S2468823124007831-gr1_lrg.jpg?httpAccept=%2A%2F%2A",
            "@multimediatype": "JPEG image file",
            "@type": "IMAGE-HIGH-RES",
            "@size": "1494853",
            "@ref": "gr1",
            "@mimetype": "image/jpeg"
          },
          {
            "@category": "high",
            "@height": "1418",
            "@width": "1667",
            "@_fa": "true",
            "$": "https://api.elsevier.com/content/object/eid/1-s2.0-S2468823124007831-gr4_lrg.jpg?httpAccept=%2A%2F%2A",
            "@multimediatype": "JPEG image file",
            "@type": "IMAGE-HIGH-RES",
            "@size": "150989",
            "@ref": "gr4",
            "@mimetype": "image/jpeg"
          },
          {
            "@category": "high",
            "@height": "1310",
            "@width": "3333",
            "@_fa": "true",
            "$": "https://api.elsevier.com/content/object/eid/1-s2.0-S2468823124007831-gr3_lrg.jpg?httpAccept=%2A%2F%2A",
            "@multimediatype": "JPEG image file",
            "@type": "IMAGE-HIGH-RES",
            "@size": "541941",
            "@ref": "gr3",
            "@mimetype": "image/jpeg"
          },
          {
            "@category": "standard",
            "@_fa": "true",
            "$": "https://api.elsevier.com/content/object/eid/1-s2.0-S2468823124007831-mmc1.docx?httpAccept=%2A%2F%2A",
            "@multimediatype": "Microsoft Word file",
            "@type": "APPLICATION",
            "@size": "2087857",
            "@ref": "mmc1",
            "@mimetype": "application/word"
          },
          {
            "@category": "standard",
            "@_fa": "true",
            "$": "https://api.elsevier.com/content/object/eid/1-s2.0-S2468823124007831-am.pdf?httpAccept=%2A%2F%2A",
            "@multimediatype": "Acrobat PDF file",
            "@type": "AAM-PDF",
            "@size": "992914",
            "@ref": "am",
            "@mimetype": "application/pdf"
          }
        ]
      },
      "link": {
        "@rel": "abstract",
        "@href": "https://api.elsevier.com/content/abstract/scopus_id/85205931911"
      }
    }
  }
}