{
  "metadata": {
    "title": "Copper(I) complexes of 1,2-bis(diphenylphosphino)benzene as efficient catalysts for alkyne hydroamination and azide-alkyne cycloaddition",
    "authors": "; ; ",
    "journal": "Molecular Catalysis",
    "date": "2024-01-15",
    "doi": "10.1016/j.mcat.2023.113575",
    "abstract": "",
    "uri": "https://api.elsevier.com/content/article/pii/S2468823123006582",
    "pii": "S2468823123006582"
  },
  "fulltext": {
    "full-text-retrieval-response": {
      "scopus-eid": "2-s2.0-85185830283",
      "originalText": "serial JL 315758 291210 291744 291790 291809 31 Molecular Catalysis MOLECULARCATALYSIS 2023-12-18 2023-12-18 2023-12-18 2023-12-18 2024-01-14T03:56:07 1-s2.0-S2468823123006582 S2468-8231(23)00658-2 S2468823123006582 10.1016/j.mcat.2023.113575 S300 S300.1 FULL-TEXT 1-s2.0-S2468823123X00194 2024-02-29T12:07:27.454365Z 0 0 20240115 2024 2023-12-18T12:00:38.02716Z absattachment articleinfo articlenumber articletitlenorm authfirstinitialnorm authfirstsurnamenorm cid cids contenttype copyright crossmark dateloaded dateloadedtxt datesearch datesort dateupdated dco docsubtype doctype doi eid ewtransactionid hubeid indexeddate issn issnnorm itemstage itemtransactionid itemweight openaccess openarchive pg pgfirst pii piinorm pubdatestart pubdatetxt pubyr sectiontitle sortorder srctitle srctitlenorm srctype ssids alllist content subj subheadings suppl tomb volfirst volissue volumelist webpdf webpdfpagecount yearnav figure table e-component body acknowledge affil appendices articletitle auth authfirstini authfull authkeywords authlast grantsponsor highlightsabst orcid primabst ref specialabst 2468-8231 24688231 true 553 553 C Volume 553 56 113575 113575 113575 20240115 15 January 2024 2024-01-15 2024 Regular Papers article fla © 2023 Elsevier B.V. All rights reserved. COPPERICOMPLEXES12BISDIPHENYLPHOSPHINOBENZENEEFFICIENTCATALYSTSFORALKYNEHYDROAMINATIONAZIDEALKYNECYCLOADDITION MUKHERJEE A 1 Introduction 2 Experimental 2.1 Materials and methods 2.2 Computational details 2.3 Syntheses of complexes 2.3.1 [Cu(dppbz)2]ClO4 2.3.2 [{Cu(dppbz)I}2] 2.3.3 [{Cu(dppbz)(SCN)}2] 2.4 X-ray crystallography 2.5 Application as catalysts 2.5.1 General procedure for hydroamination reactions 2.5.2 General procedure for click reactions 3 Results and discussion 3.1 Synthesis and characterization 3.2 Catalytic activity 4 Conclusions Credit author statement Supplementary materials Acknowledgements Appendix Supplementary materials References KUMAR 2023 215176 M KOWALSKI 2023 214996 K ASHRAF 2023 214928 M NARAYAN 2019 259 313 R COPPERICHEMISTRYPHOSPHINESFUNCTIONALIZEDPHOSPHINESPHOSPHORUSHETEROCYCLES ENANTIOSELECTIVECATALYSISUSINGCOPPERIPHOSPHINECOMPLEXES RAJABIMOGHADAM 2018 16625 16634 K MCCANN 2015 1756 1766 S ALLEN 2013 6234 6458 S PUNNIYAMURTHY 2008 134 154 T YAMADA 2008 2874 2886 K GAMEZ 2001 376 385 P REN 2019 4067 4071 J AHMAD 2012 180 187 J LIU 2012 4666 4676 Q YANG 2009 6460 6462 L PATIL 2005 2101 2103 N RAPPOPORT 1994 Z CHEMISTRYENAMINES HUO 2019 89 J KATAM 2017 16615 16622 S LU 2017 16548 16555 G PIRNOT 2016 48 57 M BLIECK 2016 1482 1485 R SHI 2015 38 44 S HUANG 2015 2596 2697 L BAHRI 2015 11210 11212 J POUY 2012 2182 2193 M CHEN 2013 18359 18366 Q KLINKENBERG 2011 86 95 J PATTANASATTAYAVONG 2019 12907 12917 P WANG 2016 118 132 X THIRUMURUGAN 2013 4905 4979 P BERNDL 2009 558 564 S HONG 2009 9879 9883 V TRON 2008 278 308 G MOSES 2007 1249 1262 J CAVALLI 2006 3193 3195 S WHITE 2006 11356 11357 M DIRKS 2005 4172 4174 A HAWKER 2005 1200 1205 C KOLB 2003 1128 1137 H ALKARAWI 2021 115084 A ATTANASI 2010 468 471 O WANG 2011 1534 1542 Y AGRAHARI 2021 7638 7956 A DOHLER 2017 2610 2620 D TIWARI 2016 3086 3240 V WANG 2016 1 20 C WANG 2021 3571 3578 Z NAYAK 2021 8075 8084 M NAYAL 2020 152509 A LIN 2019 223 230 Y SAREEN 2017 12705 12710 N MICHAEL 2015 14124 14128 P COLLINS 2014 5882 5887 L WORRELL 2013 457 460 B LAZREG 2012 7969 7975 F AHLQUIST 2007 4389 4391 M HUISGEN 1961 357 R PROCEEDINGSCHEMICALSOCIETYLONDON CENTENARYLECTURE13DIPOLARCYCLOADDITIONS KOLB 2001 2004 2021 H ROSTOVTSEV 2002 2708 2711 V TORNOE 2002 3057 3064 C KHANETSKYY 2004 884 892 B APPUKKUTTAN 2004 4223 4225 P NEARY 2018 374 391 M MUKHERJEE 2018 10264 10272 A KAMECKA 2013 138 141 A WATSON 2007 1648 1652 W GUAN 2003 4084 4089 H MUKHERJEE 2017 47 57 A DOSSANTOS 2013 292 297 E WEBSTER 2010 752 760 M FOURNIER 2004 1491 1501 E ASLANIDIS 2004 2677 2686 P KUBAS 1979 90 G SMITH 1982 907 909 D FRISCH 2010 M GAUSSIAN09REVISIONB01 BECKE 1988 3098 3100 A BECKE 1993 5648 5652 A LEE 1988 785 789 C HAY 1985 270 283 P PETERSON 1988 2193 2218 G PETERSON 1991 6081 6090 G HELGREN 1977 225 232 T BARONE 1998 1995 2001 V COSSI 2001 4708 4717 M COSSI 2003 669 681 M TELES 1998 1475 J SHELDRICK 1997 G FORTRANPROGRAMSFORCRYSTALSTRUCTURESOLUTIONREFINEMENT SHELXS97SHELXL97 TSUBOYAMA 2007 1992 2001 A MOUDAM 2007 3077 3079 O OKANO 2016 5227 5236 Y WIDENHOEFER 2006 4555 4563 R HASHMI 2000 2285 2288 A KENNEDYSMITH 2004 4526 4527 J ZHANG 2006 1798 1799 J LIU 2005 5409 5412 Y LI 2012 5564 5572 L GURBANOV 2023 7965 7974 A MAHMOUD 2021 6109 6125 A LIBRANDO 2021 185 I LIBRANDO 2021 2702 I MAHMOUD 2020 5479 A MUKHERJEEX2024X113575 MUKHERJEEX2024X113575XA 2025-12-18T00:00:00.000Z 2025-12-18T00:00:00.000Z http://creativecommons.org/licenses/by-nc-nd/4.0/ © 2023 Elsevier B.V. All rights reserved. 2024-02-29T12:05:08.833Z http://vtw.elsevier.com/data/voc/AddOnTypes/50.7/aggregated-refined Jadavpur University JU Jadavpur University http://data.elsevier.com/vocabulary/SciValFunders/100009589 http://sws.geonames.org/1269750/ DST-FIST DST Department of Science and Technology, Ministry of Science and Technology, India http://data.elsevier.com/vocabulary/SciValFunders/501100001409 http://sws.geonames.org/1269750/ The authors thank the reviewers for their constructive comments, which have been very helpful in preparing the revised manuscript. The Department of Chemistry, Jadavpur University , and the DST-FIST program of the Department of Chemistry, Jadavpur University, are gratefully acknowledged for providing financial and infrastructural supports. The authors thank Prof. Saurabh Das (Department of Chemistry, Jadavpur University) for his help in recording the UV–vis spectra of the complexes. https://doi.org/10.15223/policy-017 https://doi.org/10.15223/policy-037 https://doi.org/10.15223/policy-012 https://doi.org/10.15223/policy-029 https://doi.org/10.15223/policy-004 item S2468-8231(23)00658-2 S2468823123006582 1-s2.0-S2468823123006582 10.1016/j.mcat.2023.113575 315758 2024-01-24T16:37:20.853586Z 2024-01-15 1-s2.0-S2468823123006582-main.pdf https://s3-eu-west-1.amazonaws.com/prod-ucs-content-store-eu-west/content/pii:S2468823123006582/MAIN/application/pdf/b579881fff9540913f22c8b301f48e40/main.pdf main.pdf pdf true 6467673 MAIN 14 1-s2.0-S2468823123006582-main_1.png https://s3-eu-west-1.amazonaws.com/prod-ucs-content-store-eu-west/content/pii:S2468823123006582/PREVIEW/image/png/2cebd62daed74c7634fd2473cf325209/main_1.png main_1.png png 57387 849 656 IMAGE-WEB-PDF 1 1-s2.0-S2468823123006582-fx3.jpg https://s3-eu-west-1.amazonaws.com/prod-ucs-content-store-eu-west/content/pii:S2468823123006582/fx3/DOWNSAMPLED/image/jpeg/e7e35074c107273a332a290555fbc9b7/fx3.jpg fx3 fx3.jpg jpg 92736 852 470 IMAGE-DOWNSAMPLED 1-s2.0-S2468823123006582-gr3.jpg https://s3-eu-west-1.amazonaws.com/prod-ucs-content-store-eu-west/content/pii:S2468823123006582/gr3/DOWNSAMPLED/image/jpeg/a97f70bfc3dfdf1594bff30328b3dc52/gr3.jpg gr3 gr3.jpg jpg 39619 361 538 IMAGE-DOWNSAMPLED 1-s2.0-S2468823123006582-sc1.jpg https://s3-eu-west-1.amazonaws.com/prod-ucs-content-store-eu-west/content/pii:S2468823123006582/sc1/DOWNSAMPLED/image/jpeg/cb1c79e7d797d368b4479020511eca09/sc1.jpg sc1 sc1.jpg jpg 23298 327 470 IMAGE-DOWNSAMPLED 1-s2.0-S2468823123006582-gr2.jpg https://s3-eu-west-1.amazonaws.com/prod-ucs-content-store-eu-west/content/pii:S2468823123006582/gr2/DOWNSAMPLED/image/jpeg/cc2405b8e93f1fb03b918d95aac2b89e/gr2.jpg gr2 gr2.jpg jpg 30036 324 386 IMAGE-DOWNSAMPLED 1-s2.0-S2468823123006582-sc2.jpg https://s3-eu-west-1.amazonaws.com/prod-ucs-content-store-eu-west/content/pii:S2468823123006582/sc2/DOWNSAMPLED/image/jpeg/f2b4991294f24c78e9ac981728f3a6ef/sc2.jpg sc2 sc2.jpg jpg 23233 243 470 IMAGE-DOWNSAMPLED 1-s2.0-S2468823123006582-gr1.jpg https://s3-eu-west-1.amazonaws.com/prod-ucs-content-store-eu-west/content/pii:S2468823123006582/gr1/DOWNSAMPLED/image/jpeg/6d95baec736a75469d879d3a1e8cfffd/gr1.jpg gr1 gr1.jpg jpg 31566 369 373 IMAGE-DOWNSAMPLED 1-s2.0-S2468823123006582-sc3.jpg https://s3-eu-west-1.amazonaws.com/prod-ucs-content-store-eu-west/content/pii:S2468823123006582/sc3/DOWNSAMPLED/image/jpeg/c948d93879dd9c7c6f8b2125aaee8d2c/sc3.jpg sc3 sc3.jpg jpg 42040 512 470 IMAGE-DOWNSAMPLED 1-s2.0-S2468823123006582-gr7.jpg https://s3-eu-west-1.amazonaws.com/prod-ucs-content-store-eu-west/content/pii:S2468823123006582/gr7/DOWNSAMPLED/image/jpeg/b1cc36a1e53f3e6bdbf8e8da32a229e7/gr7.jpg gr7 gr7.jpg jpg 63509 512 470 IMAGE-DOWNSAMPLED 1-s2.0-S2468823123006582-gr6.jpg https://s3-eu-west-1.amazonaws.com/prod-ucs-content-store-eu-west/content/pii:S2468823123006582/gr6/DOWNSAMPLED/image/jpeg/7541489f9f4b7e68d3f9528edcee175d/gr6.jpg gr6 gr6.jpg jpg 65678 572 470 IMAGE-DOWNSAMPLED 1-s2.0-S2468823123006582-gr4.jpg https://s3-eu-west-1.amazonaws.com/prod-ucs-content-store-eu-west/content/pii:S2468823123006582/gr4/DOWNSAMPLED/image/jpeg/91d28305f6558548f7274fa5d016a6ab/gr4.jpg gr4 gr4.jpg jpg 32593 370 527 IMAGE-DOWNSAMPLED 1-s2.0-S2468823123006582-gr5a.jpg https://s3-eu-west-1.amazonaws.com/prod-ucs-content-store-eu-west/content/pii:S2468823123006582/gr5a/DOWNSAMPLED/image/jpeg/efe3a68cbbd3e8ed07d7108e6ccfb762/gr5a.jpg gr5a gr5a.jpg jpg 126416 878 565 IMAGE-DOWNSAMPLED 1-s2.0-S2468823123006582-gr5b.jpg https://s3-eu-west-1.amazonaws.com/prod-ucs-content-store-eu-west/content/pii:S2468823123006582/gr5b/DOWNSAMPLED/image/jpeg/840042c89699d856ade170c8a41e61da/gr5b.jpg gr5b gr5b.jpg jpg 23778 279 456 IMAGE-DOWNSAMPLED 1-s2.0-S2468823123006582-gr8.jpg https://s3-eu-west-1.amazonaws.com/prod-ucs-content-store-eu-west/content/pii:S2468823123006582/gr8/DOWNSAMPLED/image/jpeg/34844171c58e48bf5c80b5ae47ede9fb/gr8.jpg gr8 gr8.jpg jpg 49793 403 527 IMAGE-DOWNSAMPLED 1-s2.0-S2468823123006582-fx1b.jpg https://s3-eu-west-1.amazonaws.com/prod-ucs-content-store-eu-west/content/pii:S2468823123006582/fx1b/DOWNSAMPLED/image/jpeg/8462dc7c6edbf70a7bbcb546b6828207/fx1b.jpg fx1b fx1b.jpg jpg 38378 434 357 IMAGE-DOWNSAMPLED 1-s2.0-S2468823123006582-ga1.jpg https://s3-eu-west-1.amazonaws.com/prod-ucs-content-store-eu-west/content/pii:S2468823123006582/ga1/DOWNSAMPLED/image/jpeg/76126fd8fe1061ca6dfc27c583ff4388/ga1.jpg ga1 true ga1.jpg jpg 22229 200 298 IMAGE-DOWNSAMPLED 1-s2.0-S2468823123006582-fx1a.jpg https://s3-eu-west-1.amazonaws.com/prod-ucs-content-store-eu-west/content/pii:S2468823123006582/fx1a/DOWNSAMPLED/image/jpeg/f2977b3c5d64902ff755b097c2575867/fx1a.jpg fx1a fx1a.jpg jpg 43866 539 357 IMAGE-DOWNSAMPLED 1-s2.0-S2468823123006582-gr12.jpg https://s3-eu-west-1.amazonaws.com/prod-ucs-content-store-eu-west/content/pii:S2468823123006582/gr12/DOWNSAMPLED/image/jpeg/6edc40b4e5d856a2ca3e99d3bcafd9e9/gr12.jpg gr12 gr12.jpg jpg 9561 148 386 IMAGE-DOWNSAMPLED 1-s2.0-S2468823123006582-fx2.jpg https://s3-eu-west-1.amazonaws.com/prod-ucs-content-store-eu-west/content/pii:S2468823123006582/fx2/DOWNSAMPLED/image/jpeg/fbd57d7c83d84a4ee2dcd56b749715d9/fx2.jpg fx2 fx2.jpg jpg 61172 792 470 IMAGE-DOWNSAMPLED 1-s2.0-S2468823123006582-fx3.sml https://s3-eu-west-1.amazonaws.com/prod-ucs-content-store-eu-west/content/pii:S2468823123006582/fx3/THUMBNAIL/image/gif/f360765bd0dac348804a2441f67e2182/fx3.sml fx3 fx3.sml sml 5998 163 90 IMAGE-THUMBNAIL 1-s2.0-S2468823123006582-gr3.sml https://s3-eu-west-1.amazonaws.com/prod-ucs-content-store-eu-west/content/pii:S2468823123006582/gr3/THUMBNAIL/image/gif/51abfb3d2ed2f97528e12de77985c93e/gr3.sml gr3 gr3.sml sml 10287 147 219 IMAGE-THUMBNAIL 1-s2.0-S2468823123006582-sc1.sml https://s3-eu-west-1.amazonaws.com/prod-ucs-content-store-eu-west/content/pii:S2468823123006582/sc1/THUMBNAIL/image/gif/d77488438f8c021c06c3cdba0d95203f/sc1.sml sc1 sc1.sml sml 6000 152 219 IMAGE-THUMBNAIL 1-s2.0-S2468823123006582-gr2.sml https://s3-eu-west-1.amazonaws.com/prod-ucs-content-store-eu-west/content/pii:S2468823123006582/gr2/THUMBNAIL/image/gif/e134950afa3d5efc9d3d52781a246fc5/gr2.sml gr2 gr2.sml sml 11319 164 195 IMAGE-THUMBNAIL 1-s2.0-S2468823123006582-sc2.sml https://s3-eu-west-1.amazonaws.com/prod-ucs-content-store-eu-west/content/pii:S2468823123006582/sc2/THUMBNAIL/image/gif/cfbf887e2e880be3c82da9b1d192272f/sc2.sml sc2 sc2.sml sml 6010 113 219 IMAGE-THUMBNAIL 1-s2.0-S2468823123006582-gr1.sml https://s3-eu-west-1.amazonaws.com/prod-ucs-content-store-eu-west/content/pii:S2468823123006582/gr1/THUMBNAIL/image/gif/c65b9ff40af083ee503ed93d81a84aa0/gr1.sml gr1 gr1.sml sml 9939 164 166 IMAGE-THUMBNAIL 1-s2.0-S2468823123006582-sc3.sml https://s3-eu-west-1.amazonaws.com/prod-ucs-content-store-eu-west/content/pii:S2468823123006582/sc3/THUMBNAIL/image/gif/7f4cf3589e981e5fdd7a390a5d7e47f4/sc3.sml sc3 sc3.sml sml 7466 163 150 IMAGE-THUMBNAIL 1-s2.0-S2468823123006582-gr7.sml https://s3-eu-west-1.amazonaws.com/prod-ucs-content-store-eu-west/content/pii:S2468823123006582/gr7/THUMBNAIL/image/gif/cfdb48d1a760457c287197a472f0e779/gr7.sml gr7 gr7.sml sml 9312 163 150 IMAGE-THUMBNAIL 1-s2.0-S2468823123006582-gr6.sml https://s3-eu-west-1.amazonaws.com/prod-ucs-content-store-eu-west/content/pii:S2468823123006582/gr6/THUMBNAIL/image/gif/72f22b1b61e7c1e5552a75793e5a0595/gr6.sml gr6 gr6.sml sml 9019 163 134 IMAGE-THUMBNAIL 1-s2.0-S2468823123006582-gr4.sml https://s3-eu-west-1.amazonaws.com/prod-ucs-content-store-eu-west/content/pii:S2468823123006582/gr4/THUMBNAIL/image/gif/8bab8597dbf7e15b6effda9de115aa37/gr4.sml gr4 gr4.sml sml 8028 154 219 IMAGE-THUMBNAIL 1-s2.0-S2468823123006582-gr5a.sml https://s3-eu-west-1.amazonaws.com/prod-ucs-content-store-eu-west/content/pii:S2468823123006582/gr5a/THUMBNAIL/image/gif/cc66353884a8e69678dd73f6e0e7672d/gr5a.sml gr5a gr5a.sml sml 8834 163 105 IMAGE-THUMBNAIL 1-s2.0-S2468823123006582-gr5b.sml https://s3-eu-west-1.amazonaws.com/prod-ucs-content-store-eu-west/content/pii:S2468823123006582/gr5b/THUMBNAIL/image/gif/5c03dc6124a65aa94845e7e7c2f9c35f/gr5b.sml gr5b gr5b.sml sml 7816 134 219 IMAGE-THUMBNAIL 1-s2.0-S2468823123006582-gr8.sml https://s3-eu-west-1.amazonaws.com/prod-ucs-content-store-eu-west/content/pii:S2468823123006582/gr8/THUMBNAIL/image/gif/d9d4d0730eb51b8212044b87d0e520c6/gr8.sml gr8 gr8.sml sml 11488 164 214 IMAGE-THUMBNAIL 1-s2.0-S2468823123006582-fx1b.sml https://s3-eu-west-1.amazonaws.com/prod-ucs-content-store-eu-west/content/pii:S2468823123006582/fx1b/THUMBNAIL/image/gif/aaf39a8a8d8bbf2445887b2360712e45/fx1b.sml fx1b fx1b.sml sml 6684 164 135 IMAGE-THUMBNAIL 1-s2.0-S2468823123006582-ga1.sml https://s3-eu-west-1.amazonaws.com/prod-ucs-content-store-eu-west/content/pii:S2468823123006582/ga1/THUMBNAIL/image/gif/a0712bf0383cb207c2fc360f18ea82b9/ga1.sml ga1 true ga1.sml sml 11492 147 219 IMAGE-THUMBNAIL 1-s2.0-S2468823123006582-fx1a.sml https://s3-eu-west-1.amazonaws.com/prod-ucs-content-store-eu-west/content/pii:S2468823123006582/fx1a/THUMBNAIL/image/gif/37da9a8b83287a8e96caf9917015cf5a/fx1a.sml fx1a fx1a.sml sml 5940 163 108 IMAGE-THUMBNAIL 1-s2.0-S2468823123006582-gr12.sml https://s3-eu-west-1.amazonaws.com/prod-ucs-content-store-eu-west/content/pii:S2468823123006582/gr12/THUMBNAIL/image/gif/5a0409e6186f4f4170d13af2c6a4cd69/gr12.sml gr12 gr12.sml sml 3287 84 219 IMAGE-THUMBNAIL 1-s2.0-S2468823123006582-fx2.sml https://s3-eu-west-1.amazonaws.com/prod-ucs-content-store-eu-west/content/pii:S2468823123006582/fx2/THUMBNAIL/image/gif/c06c12e6f06450548742610e5554deff/fx2.sml fx2 fx2.sml sml 5496 163 97 IMAGE-THUMBNAIL 1-s2.0-S2468823123006582-fx3_lrg.jpg https://s3-eu-west-1.amazonaws.com/prod-ucs-content-store-eu-west/content/pii:S2468823123006582/HIGHRES/image/jpeg/a0b357d647573a3b90561af47d6f697d/fx3_lrg.jpg fx3 fx3_lrg.jpg jpg 712906 3776 2083 IMAGE-HIGH-RES 1-s2.0-S2468823123006582-gr3_lrg.jpg https://s3-eu-west-1.amazonaws.com/prod-ucs-content-store-eu-west/content/pii:S2468823123006582/HIGHRES/image/jpeg/9b392a64f325fd309c80bc23c901e97a/gr3_lrg.jpg gr3 gr3_lrg.jpg jpg 384509 1597 2381 IMAGE-HIGH-RES 1-s2.0-S2468823123006582-sc1_lrg.jpg https://s3-eu-west-1.amazonaws.com/prod-ucs-content-store-eu-west/content/pii:S2468823123006582/HIGHRES/image/jpeg/ba1ad858028f6907747d85380f93cfa1/sc1_lrg.jpg sc1 sc1_lrg.jpg jpg 168931 1448 2083 IMAGE-HIGH-RES 1-s2.0-S2468823123006582-gr2_lrg.jpg https://s3-eu-west-1.amazonaws.com/prod-ucs-content-store-eu-west/content/pii:S2468823123006582/HIGHRES/image/jpeg/2549460dbc9652e35b59b4745ca0ebd7/gr2_lrg.jpg gr2 gr2_lrg.jpg jpg 256728 1433 1708 IMAGE-HIGH-RES 1-s2.0-S2468823123006582-sc2_lrg.jpg https://s3-eu-west-1.amazonaws.com/prod-ucs-content-store-eu-west/content/pii:S2468823123006582/HIGHRES/image/jpeg/b42e89f36a5e8567bd8db40ff32f3461/sc2_lrg.jpg sc2 sc2_lrg.jpg jpg 155564 1078 2083 IMAGE-HIGH-RES 1-s2.0-S2468823123006582-gr1_lrg.jpg https://s3-eu-west-1.amazonaws.com/prod-ucs-content-store-eu-west/content/pii:S2468823123006582/HIGHRES/image/jpeg/360c6e030ecfa7fd1801123306f526c3/gr1_lrg.jpg gr1 gr1_lrg.jpg jpg 296025 1633 1652 IMAGE-HIGH-RES 1-s2.0-S2468823123006582-sc3_lrg.jpg https://s3-eu-west-1.amazonaws.com/prod-ucs-content-store-eu-west/content/pii:S2468823123006582/HIGHRES/image/jpeg/9d2117fa7d3316bd28dc38749d79cede/sc3_lrg.jpg sc3 sc3_lrg.jpg jpg 343524 2268 2083 IMAGE-HIGH-RES 1-s2.0-S2468823123006582-gr7_lrg.jpg https://s3-eu-west-1.amazonaws.com/prod-ucs-content-store-eu-west/content/pii:S2468823123006582/HIGHRES/image/jpeg/0953d68bb4d84ca3f323856aaee58ef9/gr7_lrg.jpg gr7 gr7_lrg.jpg jpg 467181 2269 2083 IMAGE-HIGH-RES 1-s2.0-S2468823123006582-gr6_lrg.jpg https://s3-eu-west-1.amazonaws.com/prod-ucs-content-store-eu-west/content/pii:S2468823123006582/HIGHRES/image/jpeg/23e16b79ae7e026457b0d59cc1cf38fd/gr6_lrg.jpg gr6 gr6_lrg.jpg jpg 483680 2536 2083 IMAGE-HIGH-RES 1-s2.0-S2468823123006582-gr4_lrg.jpg https://s3-eu-west-1.amazonaws.com/prod-ucs-content-store-eu-west/content/pii:S2468823123006582/HIGHRES/image/jpeg/f2d3c39f0c2fdb98b74bbdd06c16286c/gr4_lrg.jpg gr4 gr4_lrg.jpg jpg 221389 1639 2333 IMAGE-HIGH-RES 1-s2.0-S2468823123006582-gr5a_lrg.jpg https://s3-eu-west-1.amazonaws.com/prod-ucs-content-store-eu-west/content/pii:S2468823123006582/HIGHRES/image/jpeg/63f13f01ee63984a88ab002366b1779c/gr5a_lrg.jpg gr5a gr5a_lrg.jpg jpg 933833 3884 2500 IMAGE-HIGH-RES 1-s2.0-S2468823123006582-gr5b_lrg.jpg https://s3-eu-west-1.amazonaws.com/prod-ucs-content-store-eu-west/content/pii:S2468823123006582/HIGHRES/image/jpeg/86fe994aaf400c2e0a132bfd56a926cb/gr5b_lrg.jpg gr5b gr5b_lrg.jpg jpg 165016 1235 2020 IMAGE-HIGH-RES 1-s2.0-S2468823123006582-gr8_lrg.jpg https://s3-eu-west-1.amazonaws.com/prod-ucs-content-store-eu-west/content/pii:S2468823123006582/HIGHRES/image/jpeg/cc868e86a4efd2c1fc1e00e04763add1/gr8_lrg.jpg gr8 gr8_lrg.jpg jpg 321486 1785 2333 IMAGE-HIGH-RES 1-s2.0-S2468823123006582-fx1b_lrg.jpg https://s3-eu-west-1.amazonaws.com/prod-ucs-content-store-eu-west/content/pii:S2468823123006582/HIGHRES/image/jpeg/cd74cb298cb0f6f9e69865be1dd511b3/fx1b_lrg.jpg fx1b fx1b_lrg.jpg jpg 277134 1924 1583 IMAGE-HIGH-RES 1-s2.0-S2468823123006582-ga1_lrg.jpg https://s3-eu-west-1.amazonaws.com/prod-ucs-content-store-eu-west/content/pii:S2468823123006582/HIGHRES/image/jpeg/003fc2fc47f7c1503234cf3e5eadb288/ga1_lrg.jpg ga1 true ga1_lrg.jpg jpg 155058 886 1321 IMAGE-HIGH-RES 1-s2.0-S2468823123006582-fx1a_lrg.jpg https://s3-eu-west-1.amazonaws.com/prod-ucs-content-store-eu-west/content/pii:S2468823123006582/HIGHRES/image/jpeg/e1b0cded9db47fe3c8ef3073f17446fd/fx1a_lrg.jpg fx1a fx1a_lrg.jpg jpg 332354 2392 1583 IMAGE-HIGH-RES 1-s2.0-S2468823123006582-gr12_lrg.jpg https://s3-eu-west-1.amazonaws.com/prod-ucs-content-store-eu-west/content/pii:S2468823123006582/HIGHRES/image/jpeg/02ae9d640e4ba25ca6247eb6f5250dbd/gr12_lrg.jpg gr12 gr12_lrg.jpg jpg 71445 655 1708 IMAGE-HIGH-RES 1-s2.0-S2468823123006582-fx2_lrg.jpg https://s3-eu-west-1.amazonaws.com/prod-ucs-content-store-eu-west/content/pii:S2468823123006582/HIGHRES/image/jpeg/3efdb72a16793677b91c03f1ffa01f1e/fx2_lrg.jpg fx2 fx2_lrg.jpg jpg 463662 3510 2083 IMAGE-HIGH-RES 1-s2.0-S2468823123006582-mmc1.docx https://s3-eu-west-1.amazonaws.com/prod-ucs-content-store-eu-west/content/pii:S2468823123006582/mmc1/MAIN/application/vnd.openxmlformats-officedocument.wordprocessingml.document/78d3017032f4bca8e8268cf4763a4ff9/mmc1.docx mmc1 mmc1.docx docx 635536 APPLICATION 1-s2.0-S2468823123006582-am.pdf am am.pdf pdf 1721141 AAM-PDF https://s3-eu-west-1.amazonaws.com/prod-ucs-content-store-eu-west/content/egi:10TMWP7CM1R/MAIN/application/pdf/509bfdae679b90eca34aad614f1b9b39/am.pdf MCAT 113575 113575 S2468-8231(23)00658-2 10.1016/j.mcat.2023.113575 Elsevier B.V. Fig. 1 Crystal structure of complex 1 (the perchlorate ion outside the coordination sphere is not shown). Fig 1 Fig. 2 Crystal structure of complex 2. Fig 2 Fig. 3 Crystal structure of complex 3. Fig 3 Fig. 4 Energy profile for hydroamination reaction of phenylacetylene with aniline. Fig 4 Here P depicts the enamine isomer of the product. Fig. 5 Optimized structures of intermediates, transition states and products of the [Cu(dppbz)2] catalyzed hydroamination reaction of phenylacetylene with aniline. Selected distances and angles are given in angstroms and degrees. Fig 5 Fig. 6 Energy profile diagram of hydroamination reaction of aniline with phenyl acetylene. Fig 6 Fig. 7 Energy profile diagram of hydroamination reaction of benzylamine with phenyl acetylene. Fig 7 Fig. 8 Geometric structures of the selected intermediates and transition states of the [Cu(dppbz)2] catalyzed hydroamination reaction of phenylacetylene by benzylamine. Selected distances and angles are given in angstroms and degrees. Fig 8 Scheme 1 Formation summary of the three complexes. Scheme 1 Scheme 2 Four possible products from the hydroamination of alkyne [92]. Scheme 2 Scheme 3 Plausible catalytic cycle for the hydroamination reaction. Scheme 3 Chart 1 The dppbz ligand and its binding mode. Chart 1 Table 1 Selected bond distances and bond angles for [{Cu(dppbz)SCN}2]. Table 1 Bond distance (Å) Cu1-S1 2.395(4) S1-C7 1.615(12) Cu1-P1 2.262(3) C7-N1 1.171(11) Cu1-P2 2.264(3) C1-P1 1.820(10) Cu1-N1 1.990(10) C2-P2 1.844(10) C1-C2 1.411(13) Bond angle (°) P1-Cu1-P2 90.07(11) S1-C7-N1 175.0(10) S1-Cu1-N1a 104.6(3) Table 2 Hydroamination of aryl alkynes a , b . Table 2 Image, table 2 Image, table 2 a Reaction conditions: Catalyst 1: [Cu(dppbz)2]ClO4 (2.0 mol%); phenylactylenes (1.0 mmol), aryl/alkyl amines (1.2 mmol), solvent (5 mL). b Yield determined by GCMS, TON is given within () and isolated yield is given within []. Table 3 Hydroamination of aryl alkynes a . Table 3 Image, table 3 a Reaction conditions: Catalyst 1: [Cu(dppbz)2]ClO4 (2.0 mol%); phenylactylenes (1.0 mmol), aryl/alkyl amines (1.2 mmol), solvent (5 mL). Table 4 Examples for cycloaddition of phenyl azide with phenyl acetylene. a , b . Table 4 Image, table 4 a Reaction conditions: Catalyst 3: [{Cu(dppbz)SCN}2] (0.25 mol%); aryl amines (1.0 mmol), t-BuONO (1.5 mmol), TMSN3 (1.2 mmol), phenylacetylene (1.2 mmol), solvent (5 mL). b Yield determined by GCMS, TON is given within () and isolated yield is given within []. Copper(I) complexes of 1,2-bis(diphenylphosphino)benzene as efficient catalysts for alkyne hydroamination and azide-alkyne cycloaddition Aparajita Mukherjee a Anannya Saha b Samaresh Bhattacharya a ⁎ a Department of Chemistry, Inorganic Chemistry Section, Jadavpur University, Kolkata 700 032, India Department of Chemistry Inorganic Chemistry Section Jadavpur University Kolkata 700 032 India aDepartment of Chemistry, Inorganic Chemistry Section, Jadavpur University, Kolkata 700 032, India b Department of Chemical Sciences, Indian Institute of Science Education and Research Mohali, Mohali 140306, India Department of Chemical Sciences Indian Institute of Science Education and Research Mohali Mohali 140306 India bDepartment of Chemical Sciences, Indian Institute of Science Education and Research Mohali, Mohali 140306, India ⁎ Corresponding author. This paper reports the synthesis of a small group of three copper(I) complexes using 1,2-bis(diphenylphosphino)benzene, abbreviated as dppbz, and their utilization as catalyst for CN bond formation reactions. Reaction of dppbz has been carried out with three different copper(I) sources. While reaction with [Cu(CH3CN)4]ClO4 affords [CuI(dppbz)2]ClO4 (complex 1), that with CuI and CuSCN affords di-copper complexes [{CuI(dppbz)I}2] and [{CuI(dppbz)(SCN)}2] (complexes 2 and 3) respectively. Bulk characterization on the complexes has been done by elemental (C, H, N) analysis, magnetic susceptibility measurement, and spectroscopic (IR, NMR and UV–vis) methods. Crystal structures of all three complexes have been determined. In [CuI(dppbz)2]ClO4, copper(I) is having a highly distorted tetrahedral CuP4 core. In [{CuI(dppbz)I}2] and [{CuI(dppbz)(SCN)}2], the tetrahedral CuP2I2 and CuP2SN cores are relatively less distorted. These copper complexes have been found to serve as efficient catalyst precursors for two types of CN bond formation reactions, viz. hydroamination and click reaction. Hydroamination of aryl alkynes with aryl amines has afforded selectively imine products of a single type (Markownikov product) in good yields under relatively mild condition. However, similar hydroamination with benzyl amines or alkyl amines has afforded selectively anti-Markownikov imine products. Click reaction between aryl alkynes and aryl azides yielding the cycloaddition products has also been brought about successfully with remarkable catalytic efficiency. Graphical abstract A group of three diphos-chelated copper(I) complexes were synthesized, which served as efficient catalyst for (i) hydroamination of aryl alkynes with aryl amines yielding selectively the Markownikov imine products, (ii) hydroamination of aryl alkynes with benzyl or alkyl amines affording only anti-Markownikov imine products, and (iii) click reaction between aryl alkynes and aryl azides yielding the triazoles. Image, graphical abstract Keywords 1,2-bis(diphenylphosphino)benzene coordinated copper(I) complexes Catalytic alkyne hydroamination Azide-alkyne cycloaddition Data availability No data was used for the research described in the article. 1 Introduction There has been considerable attention towards utilization of copper complexes as catalyst precursor for useful chemical transformation of a wide variety of organic substrates [1–10]. The catalytic utility of copper complexes is attributable primarily to: (i) relatively easy synthesis of the targeted complexes with desired coordination environment, and (ii) the ability of the metal center to exist in, as well as interconvert between, different oxidation states. The latter aspect is of particular importance for catalytic reactions which proceed though steps involving redox changes at the metal center [6–8,10–14]. Though complexes containing copper in either of the two common oxidation states, viz. +1 and +2, are found to have wide application in catalysis, herein we decided to restrict ourselves to exploration of catalytic potential of a selected group of copper(I) complexes towards CN coupling reaction of two types, viz. hydroamination of alkynes and 1,3-dipolar azide-alkyne cycloaddition, popularly referred to as the click reaction. Hydroamination is basically a CN bond forming reaction between unsaturated hydrocarbons and amines, and is heavily utilized for the synthesis of several molecular compounds that are of significant industrial importance, such as: natural products, agrochemicals, pharmaceuticals, etc. [15,16]. The other highlighting aspect of hydroamination is that it does not generate any byproduct, and hence it is atom economical. This CN coupling reaction requires a metal-catalyst, the main task of which is to reduce repulsion between the two electron rich reactants, viz. the alkyne and the amine, by attracting electron density from the substrate. While several metal-catalysts are known to be employed for this reaction [17–27], utilization of copper(I)-based systems for catalytic hydroamination of alkynes, which is one primary objective of our present study, appears to have remained relatively less explored [18,22,25]. Click reaction, on the other hand, is a highly popular CN bond forming reaction that can efficiently connect two molecular species to form a new molecule, and finds wide application in organic synthesis, bio‐conjugation, drug discovery, material science, etc. [28–39]. While limited examples of copper(II)-catalyzed click reaction are available in the literature [40–42], copper(I) systems are known to catalyze such cycloaddition reaction very efficiently [43–56]. Though discovery of this remarkable azide-alkyne cycloaddition reaction was made by Rolf Huisgen in 1961 [57], the spotlight actually turned to this reaction since coinage of the term “click reaction” by Barry Sharpless [58], and his notable contribution in this area along with Meldal and many others [33,37,43–56,59–62]. And there has been continuous effort towards the synthesis of new copper(I) complexes by planned variation of coordination environment around the metal center, and assess their catalytic efficiency in click reaction [43–56], and this is the other objective of our present study as well. Herein our initial aim was to synthesize a small group of copper(I) complexes using 1,2-bis(diphenylphosphino)benzene, abbreviated as dppbz (see Chart 1 ), as the main ligand. This particular diphos ligand was chosen because of its soft nature and demonstrated ability to stabilize relatively lower oxidation states of transition metals [63–67]. The other notable attribute of this ligand is its uncomplicated mode of binding (shown in I, Chart 1). By virtue of having the rigid P-C6H4-P fragment, this diphos ligand is capable of forming only five-membered chelate ring (I), and unable to display any bridging mode of binding that is known for diphos ligands with flexible -(CH2) n- spacer between the phosphorus atoms [68–72]. In order to synthesize the complexes we selected three different sources of copper(I), viz. [Cu(CH3CN)4]ClO4, CuI and CuSCN. In this paper we describe our observation on the interaction of the dppbz ligand with the chosen copper(I) sources towards affording homoleptic and mixed-ligand complexes, their characterization, and exploration of their catalytic efficiency in alkyne hydroamination and azide-alkyne cycloaddition. 2 Experimental 2.1 Materials and methods [Cu(CH3CN)4]ClO4 and CuSCN were prepared by following reported procedures [73,74]. 1,2-Bis(diphenylphosphino)benzene (dppbz) and azidotrimethylsilane (TMSN3) were procured from Aldrich. All other chemicals and solvents were reagent grade commercial materials and were used as received. Microanalyses (C, H, N) were performed using a Heraeus Carlo Erba 1108 elemental analyzer. Magnetic susceptibilities were measured using a Sherwood MK-1 balance. The 1H NMR spectra were recorded in CDCl3 solution on a Bruker Avance DPX 300 NMR spectrometer using TMS as the internal standard. IR spectra were obtained on a Perkin Elmer Spectrum Two IR spectrometer as KBr pellets. Electronic spectra were recorded on a JASCO V-630 spectrophotometer. GC-MS analyses were performed using a Perkin Elmer CLARUS 680 instrument. 2.2 Computational details All DFT calculations were performed using Gaussian09 package [75]. Optimization calculations were carried out using Becke's three parameter hybrid-exchange functional with the Lee–Yang–Parr correlation function (B3LYP) based on the energetic minima results [76–78]. In the optimization calculations, Hay and Wadt basis-set LANL2DZ were used for Cu considering the pseudo core potential [79], the 6–311+G(d) basis-set was used for C, H, and N atoms [80], and all other atoms were described by 6–31G(d,p) [81]. The nature of the ground-state of each optimized-structures has been verified by their respective calculated frequencies under same level of theory as of geometry-optimization. In addition, each transition state has been located using the LST (linear synchronous transit) method, where the reaction axis was restricted at several distances and the other degrees of freedom were remained relaxed [82]. After attainment of the requisite linear transit point, the transition-states were optimized employing the default Berny algorithm implemented in the Gaussian09 code [75]. Each transition-state was supported by only one imaginary frequency. Along with this, intrinsic reaction coordinate (IRC) calculations were performed for all transition-states to ensure the connectivity of these transition states to the respective reactants and products related to it. In these overall calculations related to the catalytic cycle, the polarizable conductor calculation model (CPCM) was employed for the surrounding solvent molecules, acetonitrile (ε = 37.5) giving the bulk solvent effects [83–85]. Chemcraft was used for graphics visualization [86]. 2.3 Syntheses of complexes 2.3.1 [Cu(dppbz)2]ClO4 Nitrogen gas was purged through a solution of 1,2-bis(diphenylphosphino)benzene (275 mg, 0.62 mmol) in chloroform (25 mL) for 5 min, and then [Cu(CH3CN)4]ClO4 (100 mg, 0.31 mmol) was added. The mixture was stirred at ambient temperature under nitrogen for an additional 30 min and then stirring was continued, without nitrogen purging, for 6 h, whereby a colorless solution was obtained. The solution was kept in a refrigerator for 48 h. [Cu(dppbz)2]ClO4 separated as a white crystalline solid, which was collected by filtration, washed with cold diethyl ether and dried in air. Yield: 280 mg, 87 %. Anal. Calc. for C60H48P4O4ClCu: C, 68.25; H, 4.55. Found: C, 68.09; H, 4.57 %. 1H NMR (400 MHz, CDCl3):[87] δ 6.85–7.60 (24H)*. IR (KBr, cm−1): 479, 497, 519, 624, 664, 697, 725, 740, 753, 764, 998, 1025, 1094, 1121, 1160, 1437, 1480, 1638 and 1708. Electronic spectral data: λ, nm (ε, M−1cm−1): 270* (32,900). 2.3.2 [{Cu(dppbz)I}2] To a solution of 1,2-bis(diphenylphosphino)benzene (236 mg, 0.53 mmol) in chloroform (25 mL) was added CuI (100 mg, 0.53 mmol). The mixture was stirred for 6 h under warm condition, whereby a light yellow solution was obtained. The solution was kept in a refrigerator for 48 h. [{Cu(dppbz)I}2] separated as a yellow crystalline solid, which was collected by filtration, washed with cold diethyl ether and dried in air. Yield: 270 mg, 81 %. Anal. Calc. for C60H48P4I2Cu2: C, 56.56; H, 3.77. Found: C, 56.66; H, 3.73 %. 1H NMR (400 MHz, CDCl3): δ 6.95–7.35 (48H)*. IR (KBr, cm−1): 482, 497, 518, 661, 692, 730, 742, 759, 998, 1027, 1096, 1184, 1157, 1384, 1435, 1480, 1585, 1638 and 1709. Electronic spectral data: λ, nm (ε, M−1cm−1): 296 (26,500), 243*(62,000). 2.3.3 [{Cu(dppbz)(SCN)}2] To a solution of 1,2-bis(diphenylphosphino)benzene (370 mg, 0.83 mmol) in chloroform (20 mL) was added to the suspension of CuSCN (100 mg, 0.83 mmol) in ethanol (10 mL). The mixture was stirred for 10 h under warm condition, whereby a light yellow solution was obtained. The solution was kept in a refrigerator for 48 h. [{Cu(dppbz)(SCN)}2] separated as a light yellow crystalline solid, which was collected by filtration, washed with cold diethyl ether and dried in air. Yield: 350 mg, 75 %. Anal. Calc. for C62H48P4S2N2Cu2: C, 65.55; H, 4.22. Found: C, 65.34; H, 4.27 %. 1H NMR (400 MHz, CDCl3): δ 7.10–7.40 (48H)* (Fig. S1; Supplementary material). IR (KBr, cm−1): 484, 495, 516, 662, 692, 742, 998, 1026, 1069, 1095, 1158, 1181, 1221, 1384, 1435, 1480, 1585, 1638, 1710 and 2111 (Fig. S2; Supplementary material). Electronic spectral data: λ, nm (ε, M−1cm−1): 285 (26,600), 228*(69,700) (Fig. S3; Supplementary material). 2.4 X-ray crystallography Single crystals of [Cu(dppbz)2]ClO4, [{Cu(dppbz)I}2] and [{Cu(dppbz)(SCN)}2] were harvested upon cooling their chloroform solutions, obtained directly from the synthetic reaction, in the refrigerator for 48 h. Selected crystal data and data collection parameters are given in Table S1 (Supplementary material). Data on the crystals were collected on a Bruker SMART CCD diffractometer. X-ray data reduction and, structure solution and refinement were done using the SHELXS-97 and SHELXL-97 packages [88]. The structures were solved by the direct methods. 2.5 Application as catalysts 2.5.1 General procedure for hydroamination reactions In a typical run, an oven-dried 10 mL round bottom flask was charged with a known mole percent of catalyst and phenyl acetylene (1.0 mmol) and aryl amine (1.2 mmol) with acetonitrile (5 mL). The mixture was stirred at ambient temp (25 °C). After the specified time (4 h) stirring was stopped, water (20 mL) was added, and extraction with ethyl acetate (2 × 10 mL) was done. The combined ethyl acetate extract was washed with water (3 × 10 mL), dried over anhydrous Na2SO4, and filtered. Solvent was removed under vacuum. The residue was dissolved in hexane and analyzed by GC–MS. 2.5.2 General procedure for click reactions In a typical run, an oven-dried 10 mL round bottom flask was charged with a selected aryl amine (1.0 mmol), t-BuONO (1.5 mmol) and TMSN3 (1.2 mmol) with acetonitrile (5 mL). The mixture was stirred at 0 °C for 2 h. Then a known mole percent of catalyst and phenyl acetylene (1.2 mmol) was added to the mixture and the mixture was allowed to stir at ambient temperature. After the specified time stirring was stopped, water (20 mL) was added, and extraction with ethyl acetate (2 × 10 mL) was done. The combined ethyl acetate extract was washed with water (3 × 10 mL), dried over anhydrous Na2SO4, and filtered. Solvent was removed under vacuum. The residue was dissolved in acetonitrile and analyzed by GC–MS. 3 Results and discussion 3.1 Synthesis and characterization The first task of this study was to synthesize a group of copper(I) complexes using 1,2-bis(diphenylphosphino)benzene (dppbz) as the main ligand. In order to achieve this goal we selected three different sources of copper(I), viz. [Cu(CH3CN)4]ClO4, CuI and CuSCN. Reaction of [Cu(CH3CN)4]ClO4 with dppbz in 1:2 mole ratio in chloroform under stirring condition at ambient temperature afforded the bis-complex, [Cu(dppbz)2]+, which was isolated as its perchlorate salt in good yield. The [Cu(dppbz)2]ClO4 complex will henceforth be referred to as complex 1. It is interesting to mention that on decreasing the Cu(I):dppbz ratio to 1:1, to examine whether a mono-dppbz chelated copper(I) complex can be isolated, the same bis-complex 1 was obtained, but in much lower yield. Crystal structure of complex 1 was determined, which is shown in Fig. 1 and selected bond parameters are presented in Table S2 (Supplementary material). The CuP4 core in this complex is distorted significantly from ideal tetrahedral geometry. Similar reaction between equimolar dppbz and copper(I) iodide or copper(I) thiocyanate, both of which are polymeric in nature, afforded dinuclear complexes of type [{Cu(dppbz)I}2] (complex 2) and [{Cu(dppbz)(SCN)}2] (complex 3) respectively. It is worth mentioning here that even on increasing the Cu(I):dppbz ratio to 1:2, no bis-complex was obtained. Instead, the same dicopper complexes were obtained in similar yields. Crystal structures of complexes 2 and 3 were also determined, which are shown in Figs. 2 and 3 . While reports on the bis-complex 1 and iodo-bridged dicopper complex 2 are available in the literature [89–91], the thiocyanato-bridged dicopper complex 3 is new. In complex 2 the P2I2 environment around each copper is distorted tetrahedral in nature, and the observed bond parameters (Table S3, Supplementary material) are found to be comparable to those reported earlier [91]. Structure of complex 3 shows that the two copper centers are bridged by two thiocyanate ions that are almost linear. Each diphos ligand is chelated to one copper center forming usual five membered ring (I, MCu). Some selected bond parameters are given in Table 1 . Each copper is having a distorted tetrahedral P2NS coordination sphere around it. The CuS, CuP and CuN bond lengths are all found to be quite usual [28,89–91]. Formation of the three complexes is summarized in Scheme 1 . 3.2 Catalytic activity As outlined earlier, our second objective was to evaluate catalytic potential of the synthesized copper(I) complexes towards CN bond formation reactions of two types viz. hydroamination and azide-alkyne cycloaddition or click reaction. We began our exploration with hydroamination of phenylacetylene with 2,4,6-trimethylaniline using complex 1 as the catalyst to yield new CN coupled product(s). After extensive optimization (Table S4, Supplementary material) it was found that 2 mol% catalyst, acetonitrile as the solvent, and 4 h stirring at 25 °C furnished the CN bonded product in excellent yield (Table S4, entry 6). Considering the two different modes of addition of amine across a CC bond, viz. Markownikov and anti-Markownikov modes, four possible CN coupled products may result (Scheme 2 ) [92]. It is interesting to note that, from our reaction using complex 1 as the catalyst, only the Markownikov imine product (P 2b ; Ar = 2,4,6-trimethylphenyl) was obtained. The two di-copper complexes (2 and 3) were also found to furnish only the Markownikov imine product, but compared to the mono-copper complex (1) they show much less catalytic efficiency (Table S4, entries 12–20), and hence only the results obtained with complex 1 as the catalyst precursor are presented here. Scope of the hydroamination of alkynes is summarized in Table 2 . Using the optimized the reaction conditions, hydroamination of phenylacetylene was performed with aniline and eight substituted anilines, and the expected imines (P1 – P9 ) were obtained in very good (87 – 99 %) yields. With 2-hydroxyphenylacetylene as substrate, hydroamination was attempted with four arylamines, and the corresponding imines (P10 – P13 ) were obtained, but in lesser yields. The decrease in yield is primarily attributable to poisoning of the active catalyst through coordination of the phenolic oxygen in the arylacetylene. Besides, steric problem posed by substituents in the aniline moiety seems to be responsible also for the significantly low yields of P12 – P13 . However, when phenylacetylene having electron-donating or electron-withdrawing substituent at the para-position was used, yield of the products (P14 – P20 ) was good (90 – 96 %) with anilines bearing substituents with varying steric bulk. On moving to 1-naphthylamine, yield of the product imines (P21 – P24 ) was found to decrease again, which is due, presumably, to the larger size of 1-naphthylamine relative to the phenylamines. Here again, the imine (P22 ) from reaction with 2-hydroxyphenylacetylene was obtained in lowest yield. To gain a clear insight into the observed hydroamination reaction, the mechanistic details for the complex 1 catalyzed hydroamination of phenylacetylene with aniline were probed computationally by DFT [75]. The plausible mechanism is shown in Scheme 3 , and the associated free energy profile is depicted in Fig. 4 . DFT-optimized structures of all the relevant transition states and intermediates are presented in Fig. 5 , and their calculated Gibbs free energies are listed in Table S5 (Supplementary material). As illustrated in Scheme 3 and Fig. 4, the reaction gets initiated via coordination of phenylacetylene to the Cu(P-P) moiety, provided by the catalyst precursor, leading to formation of a π-complex (INT-1), and this marks the entry into the catalytic cycle [93]. In INT-1, the CC fragment is bonded asymmetrically to the copper-center with Cu–C distances of 2.23 and 2.08 Ả (Fig. 5). In the following CN bond-formation process two probable pathways for Markownikov addition were considered: (i) aniline approaching trans to the acetylenic hydrogen, and (ii) aniline approaching cis to the acetylenic hydrogen [94–99]. DFT results indicate that energy barrier for the C–N bond-formation via the cis approach passes through a transition state (TS1A) that lies 3.19 kcal/mol lower than the corresponding transition state (TS1B) associated with the trans approach. The possibility of CN bond-formation via anti-Markownikov addition was also examined, and the free energy barrier of the corresponding transition state (TS′-anti ) is found to be 10.79 kcal/mol higher than that of TS1A related to the Markownikov product (Fig. 6 ). This corroborates an exclusive Markownikov selectivity observed in the hydroamination reactions with arylamines. The zwitterionic intermediate INT-2A thus formed through TS-1A is endergonic by 12.47 kcal/mol with respect to INT-1 and aniline. In the next step, one possibility of subsequent intramolecular proton-transfer in INT-2A via transition state TS2′ was found to be kinetically unfavorable with an activation energy barrier of 39.41 kcal/mol, which basically rules out the probable intramolecular proton-transfer from coordinated anilinium fragment to the acetylenic carbon (C1) (Fig. 5). In this context, another possible intermolecular proton-transfer pathway could be realized by considering the assistance of another external aniline molecule in a stepwise manner [99]. In this process, the generation of the intermediate INT-3 from INT-2A and aniline is slightly exergonic by 3.23 kcal/mol. In the subsequent transition state TS2 via INT-3, the hydrogen-transfer from the N1 atom to the N2 atom of external aniline involves 4.82 kcal/mol transition state energy barrier compare to INT-3. Thus this path is energetically quite facile compared to the previously discussed one including TS2′. TS2 leads to another zwitterionic intermediate INT-4, which is 1.99 kcal/mol higher in energy than INT-3. Thus, the hydroamination product is formed through proton-donation by the external anilinium moiety involving INT-5 generated from INT-4 with subsequent loss of an aniline molecule. Finally, interaction of phenylacetylene with the copper center in INT-5 leads to elimination of the hydroaminated product in enamine form and regeneration of the catalytically active species INT-1, and the catalytic cycle thus continues. The enamine form of the product isomerizes into the thermodynamically more stable ketimine form (Fig. S4; Supplementary material). We next attempted hydroamination of four substituted phenylacetylenes with benzylamine, instead of arylamine, using the same optimized reaction conditions as before, and the results are presented in Table 3 . The expected imine products (P25 – P28 ) were all obtained in good (88 – 93 %) yields. However, it is interesting to highlight that, contrary to the earlier Markownikov imine products (P1 – P24 ) obtained from reactions with arylamines, these four imines (P25 – P28 ) are all anti-Markownikov products. Finally we tried hydroamination of the same four phenylacetylenes with cyclohexylmethanamine and again the corresponding anti-Markownikov imine products (P29 – P32 ) were obtained in decent (69 – 77 %) yields. This observed difference in the nature of hydroamination product, viz. Markownikov versus anti-Markownikov, on moving from arylamines to alkylamines is believed to result from the difference in nature of the amines that enables them to attack the acetylene moiety differently (vide infra). We have also tried to probe into the probable cause behind formation of the anti-Markownikov imine product by DFT method, taking the hydroamination of phenylacetylene with benzylamine as the representative. As depicted earlier in Scheme 3, the key step in these reactions is the initial attack by the amine on the copper-bound acetylene moiety in INT-1, which is basically the controlling factor for the following steps. In our calculations, we considered both Markownikov and anti-Markownikov interaction of benzylamine with the acetylinic carbons in INT-1 leading to formation of the corresponding transitions states (TS1ʹ and TS-1ʹʹ) and next intermediates (INT-2Bʹ and INT-2Bʹʹ), and the associated free energy diagram is shown in Fig. 7 . The activation energy barrier for the transition states TS1′ for Markownikov addition and TS1′′ for anti-Markownikov addition are 26.13 and 20.12 kcal/mol, respectively, which indicates that the hydroamination reaction of phenylacetylene with benzylamine occurs following an energetically facile anti-Markownikov pathway. DFT-optimized structures of all the five species (Fig. 7) relevant in this reaction are shown in Fig. 8 and their respective calculated Gibbs free energies are given in Table S6 (Supplementary material). Here, the primary factor behind the observed difference in the nature of hydroamination product, viz. Markownikov versus anti-Markownikov, appears to be the steric influence of the primary amines. The interesting aspect of hydroamination reaction catalyzed by our dppbz coordinated Cu(I) complexes is that, it can selectively produce anti-Markownikov imine product from reactions with aryl amines and Markownikov imine product from reactions with alkyl amines, among the four possible products (Scheme 2). Cu(I)-catalyzed hydroamination reactions are not very well known, expect three reported cases [18,22,25]. The observed catalytic efficiency of complex 1 towards the imine formation is better than that of other Cu(I)-catalysts [18–25], and comparable to that of one Cu(I)-catalyst [22]. The observed efficiency of the present group of diphos-coordinated copper(I) complexes in catalyzing hydroamination reactions, via activation of phenyl acetylene, prompted us to examine their catalytic efficiency towards another CN bond forming reaction, viz. the 1,3-dipolar cycloaddition, involving the same substrate. Copper(I) species are well known to catalyze the 1,3-dipolar cycloaddition between an organic azide and an alkyne, popularly known as the click reaction, to furnish 1,2,3-triazoles as the sole product [43–56]. To assess the efficiency of our present group of copper(I) complexes, we started with the cycloaddition reaction between phenylacetylene and in situ generated phenyl azide, and after screening the different reaction parameters it was observed that the best result is obtained with acetonitrile as solvent, 0.25 mol% of complex 3 as catalyst, ambient temperature and 2 h reaction time (entry 1; Table S7, Supplementary material). Using the optimized reaction condition, click reactions were performed with several substituted phenyl azides and phenylacetylenes, and the expected triazoles (P1 – P16 ) were obtained in all the cases (Table 4 ). Phenyl azides having different substituent (-H, OCH3–, -CH3, -Cl and -NO2) at the para-position, produced the corresponding trizoles (P1 – P5 ) in excellent (93 - 99 %) yields. However, for reactions with phenyl azides bearing substituents at both the ortho positions, yields of the corresponding triazoles (P6 - P9 ) were found to be slightly less, which is attributable to steric effect. Upon using 1-naphthyl azide instead of phenyl azide the yield of the product (P10 ) did not differ much. Similarly, on replacing phenylacetylene by 2-hydroxyphenylacetylene or 4-methyl/-chlorophenylacetylene, the yields of the products (P11 – P16 ) were observed to be comparable (92 – 98 %). It is interesting to note that, compared to the mono-copper complex 1, the di-copper complexes (2 and 3) turned out to be more efficient catalyst towards click reaction (Table S7, entries 2, 7 and 12). This is probably due to favorable charge delocalization over the di-copper-acetylide-azide moiety in the intermediate, formed in situ during the catalytic reaction, as observed by others [48,51,56]. Catalytic efficiency of our di-copper complexes towards click reaction is found to be better than that of many reported copper(I) catalysts [48–53,56,100–104], and comparable to that of few [54,55]. 4 Conclusions The 1,2-bis(diphenylphosphino)benzene chelated copper(I) complexes (1 – 3) are found to represent a family of efficient catalysts for two types of CN coupling reactions, viz. hydroamination and 1,3-cycloaddition, via activation of phenylacetylene as the common substrate. For the hydroamination reactions the mono-copper complex 1 was found to be the best catalyst, while the di-copper complexes 2 and 3 were found to be more efficient towards catalytic click reaction. The most notable aspect of our catalytic hydroamination is the predictable site selectivity of CN coupling based on the nature of amine; anti-Markownikov coupling for aryl amines and Markownikov coupling for alkyl amines. It also worth noting that apart from this present hydroamination reaction catalyzed by our copper(I) complex, reports on copper(I)-catalyzed hydroamination is rare in the literature. For click reaction, our complex 3 appears to be a much superior catalyst, particularly in terms of lower catalyst loading and shorter reaction time. Credit author statement There is no specific statement to make. Supplementary materials X-ray diffraction and processing parameters (Table S1); selected bond parameters for [Cu(dppbz)2]ClO4 (Table S2) and for [{CuI(dppbz)I}2] (Table S3); optimization for catalytic hydroamination reaction (Table S4); energies of intermediates and transition states for the hydroamination reaction with aniline (Table S5); energy difference between the enamine and ketimine isomers of the hydroamination product (Fig. S4); energies of intermediates and transition states for the hydroamination reaction with benzylamine (Table S6); optimization for catalytic click reaction (Table S7); Cartesian coordinates for the optimized geometries of all the species involved in the DFT calculations (Table S8). CCDC deposition numbers 2268980–2268982 contain the supplementary crystallographic data for 1, 2 and 3. Declaration of Competing Interest There is no specific declaration to make. Acknowledgements The authors thank the reviewers for their constructive comments, which have been very helpful in preparing the revised manuscript. The Department of Chemistry, Jadavpur University, and the DST-FIST program of the Department of Chemistry, Jadavpur University, are gratefully acknowledged for providing financial and infrastructural supports. The authors thank Prof. Saurabh Das (Department of Chemistry, Jadavpur University) for his help in recording the UV–vis spectra of the complexes. Supplementary materials Supplementary material associated with this article can be found, in the online version, at doi:10.1016/j.mcat.2023.113575. Appendix Supplementary materials Image, application 1 References [1] M. Kumar A.K. Singh A.K. Singh R.K. Yadav S. Singh A.P. Singh A. Chauhan Coord. Chem. Rev. 488 2023 215176 M. Kumar, A.K. Singh, A.K. Singh, R.K. Yadav, S. Singh, A.P. Singh, A. Chauhan, Coord. Chem. Rev. 488 (2023) 215176. [2] K. Kowalski Coord. Chem. Rev. 479 2023 214996 K. Kowalski, Coord. Chem. Rev. 479 (2023) 214996. [3] M. Ashraf M.S. Ahmad Y. Inomata N. Ullah M.N. Tahir T. Kida Coord. Chem. Rev. 476 2023 214928 M. Ashraf, M.S. Ahmad, Y. Inomata, N. Ullah, M.N. Tahir, T. Kida, Coord. Chem. Rev. 476 (2023) 214928. [4] Editor R. Narayan Enantioselective catalysis using copper (I)–phosphine complexes Balakrishna M. Copper(I) Chemistry of Phosphines, Functionalized Phosphines and Phosphorus Heterocycles 2019 Elsevier 259 313 Editor R. Narayan, Enantioselective catalysis using copper (I)–phosphine complexes, in: Copper(I) Chemistry of Phosphines, Functionalized Phosphines and Phosphorus Heterocycles, Editor: M. Balakrishna, Elsevier, 2019, pp 259–313. [5] K. Rajabimoghadam Y. Darwish U. Bashir D. Pitman S. Eichelberger M.A. Siegler M. Swart I. Garcia-Bosch J. Am. Chem. Soc. 140 2018 16625 16634 K. Rajabimoghadam, Y. Darwish, U. Bashir, D. Pitman, S. Eichelberger, M.A. Siegler, M. Swart, I. Garcia-Bosch, J. Am. Chem. Soc. 140 (2018) 16625–16634. [6] S.D. McCann S.S. Stahl Acc. Chem. Res. 48 2015 1756 1766 S.D. McCann, S.S. Stahl, Acc. Chem. Res. 48 (2015) 1756–1766. [7] S.E. Allen R.R. Walvoord R. Padilla-Salinas M.C. Kozlowski Chem. Rev. 113 2013 6234 6458 S.E. Allen, R.R. Walvoord, R. Padilla-Salinas, M.C. Kozlowski, Chem. Rev. 113 (2013) 6234–6458. [8] T. Punniyamurthy L. Rout Coord. Chem. Rev. 252 2008 134 154 T. Punniyamurthy, L. Rout, Coord. Chem. Rev. 252 (2008) 134–154. [9] K-i Yamada K. Tomioka Chem. Rev. 108 2008 2874 2886 K-i Yamada, K. Tomioka, Chem. Rev. 108 (2008) 2874–2886. [10] P. Gamez P.G. Aubel W.L. Driessen J. Reedijk Chem. Soc. Rev. 30 2001 376 385 P. Gamez, P.G. Aubel, W.L. Driessen, J. Reedijk, Chem. Soc. Rev. 30 (2001) 376–385. [11] J. Ren C. Pi Y. Wu X. Cui Org. Lett. 21 2019 4067 4071 J. Ren, C. Pi, Y. Wu, X. Cui, Org. Lett. 21 (2019) 4067–4071. [12] J.U. Ahmad M.T. Räisänen M. Leskelä T. Repo Appl. Catal. A: General 411-412 2012 180 187 J.U. Ahmad, M.T. Räisänen, M. Leskelä, T. Repo, Appl. Catal. A: General 411-412 (2012) 180–187. [13] Q. Liu P. Wu Y. Yang Z. Zeng J. Liu H. Yi A. Lei Angew. Chem. Int. Ed. 51 2012 4666 4676 Q. Liu, P. Wu, Y. Yang, Z. Zeng, J. Liu, H. Yi, A. Lei, Angew. Chem. Int. Ed. 51 (2012) 4666–4676 [14] L. Yang Z. Lu S.S. Stahl Chem. Commun. 2009 6460 6462 L. Yang, Z. Lu, S.S. Stahl, Chem. Commun. (2009) 6460–6462. [15] N.T. Patil N.K. Pahadi Y.A. Yamamoto Tetrahedron Lett. 46 2005 2101 2103 N.T. Patil, N.K. Pahadi, Y.A. Yamamoto, Tetrahedron Lett.. 46 (2005) 2101–2103. [16] Z. Rappoport The Chemistry of Enamines 2 1994 Wiley & Sons New York Z. Rappoport, The Chemistry of Enamines; Wiley & Sons: New York, 1994; Vol. 2. [17] J. Huo G. He W. Chen X. Hu Q. Deng D. Chen BMC Chem. 13 2019 89 J. Huo, G. He, W. Chen, X. Hu, Q. Deng, D. Chen, BMC Chem. 13 (2019) 89. [18] S. Katam P. Ganesan Dalton Trans. 46 2017 16615 16622 S. Katam, P. Ganesan, Dalton Trans. 46 (2017) 16615–16622. [19] G. Lu R.Y. Liu Y. Yang C. Fang D.S. Lambrecht S.L. Buchwald P. Liu J. Am. Chem. Soc. 139 2017 16548 16555 G. Lu, R.Y. Liu, Y. Yang, C. Fang, D.S. Lambrecht, S.L. Buchwald, P. Liu, J. Am. Chem. Soc. 139 (2017) 16548–16555. [20] M.T. Pirnot Y.-M. Wang S.L. Buchwald Angew. Chem. Int. Ed. 55 2016 48 57 M.T. Pirnot, Y.-M. Wang, S.L. Buchwald, Angew. Chem. Int. Ed. 55 (2016) 48–57. [21] R. Blieck J. Bahri M. Taillefer F. Monnier Org. Lett. 18 2016 1482 1485 R. Blieck, J. Bahri, M. Taillefer, F. Monnier, Org. Lett. 18 (2016) 1482–1485. [22] S.-L. Shi S.L. Buchwald Nat. Chem. 7 2015 38 44 S.-L. Shi, S.L. Buchwald, Nat. Chem. 7 (2015) 38–44. [23] L. Huang M. Arndt K. Gooßen H. Heydt L.J. Gooßen Chem. Rev. 115 2015 2596 2697 L. Huang, M. Arndt, K. Gooßen, H. Heydt, L.J. Gooßen, Chem. Rev. 115 (2015) 2596–2697. [24] J. Bahri R. Blieck B. Jamoussi M. Taillefer F. Monnier Chem. Commun. 51 2015 11210 11212 J. Bahri, R. Blieck, B. Jamoussi, M. Taillefer, F. Monnier, Chem. Commun. 51 (2015) 11210–11212. [25] M.J. Pouy S.A. Delp J. Uddin V.M. Ramdeen N.A. Cochrane G.C. Fortman T.B. Gunnoe T.R. Cundari M. Sabat W.H. Myers ACS Catal. 2 2012 2182 2193 M.J. Pouy, S.A. Delp, J. Uddin, V.M. Ramdeen, N.A. Cochrane, G.C. Fortman, T.B. Gunnoe, T.R. Cundari, M. Sabat, W.H. Myers, ACS Catal.. 2 (2012) 2182–2193. [26] Q. Chen L. Lv M. Yu Y. Shi Y. Li G. Pang C. Cao RSC Adv. 3 2013 18359 18366 Q. Chen, L. Lv, M. Yu, Y. Shi, Y. Li, G. Pang C. Cao, RSC Adv. 3 (2013) 18359–18366. [27] J.L. Klinkenberg J.F. Hartwig Angew. Chem., Int. Ed. 50 2011 86 95 J.L. Klinkenberg, J.F. Hartwig, Angew. Chem., Int. Ed. 50 (2011) 86–95. [28] P. Pattanasattayavong D.M. Packwood D.J. Harding J. Mater. Chem. C 7 2019 12907 12917 P. Pattanasattayavong, D.M. Packwood, D.J. Harding, J. Mater. Chem. C 7 (2019) 12907–12917. [29] X. Wang B. Huang X. Liu P. Zhan Drug Discov. Today 21 2016 118 132 X. Wang, B. Huang, X. Liu, P. Zhan, Drug Discov. Today 21 (2016) 118–132. [30] P. Thirumurugan D. Matosiuk K. Jozwiak Chem. Rev. 113 2013 4905 4979 P. Thirumurugan, D. Matosiuk, K. Jozwiak, Chem. Rev. 113 (2013) 4905–4979. [31] S. Berndl N. Herzig P. Kele D. Lachmann X. Li O.S. Wolfbeis H.-A. Wagenknecht Bioconjugate Chem. 20 2009 558 564 S. Berndl, N. Herzig, P. Kele, D. Lachmann, X. Li, O.S. Wolfbeis, H.-A. Wagenknecht, Bioconjugate Chem.. 20 (2009) 558–564. [32] V. Hong S.I. Presolski C. Ma M.G. Finn Angew. Chem. Int. Ed. 48 2009 9879 9883 V. Hong, S.I. Presolski, C. Ma, M.G. Finn, Angew. Chem. Int. Ed. 48 (2009) 9879–9883. [33] G.C. Tron T. Pirali R.A. Billington P.L. Canonico G. Sorba A.A. Genazzani Med. Res. Rev. 28 2008 278 308 G.C. Tron, T. Pirali, R.A. Billington, P.L. Canonico, G. Sorba, A.A. Genazzani, Med. Res. Rev. 28 (2008) 278–308. [34] J.E. Moses A.D. Moorhouse Chem. Soc. Rev. 36 2007 1249 1262 J.E. Moses, A.D. Moorhouse, Chem. Soc. Rev. 36 (2007) 1249–1262. [35] S. Cavalli A.R. Tipton M. Overhand A. Kros Chem. Commun. 2006 3193 3195 S. Cavalli, A.R. Tipton, M. Overhand, A. Kros, Chem. Commun. (2006) 3193–3195. [36] M.A. White J.A. Johnson J.T. Koberstein N.J. Turro J. Am. Chem. Soc. 128 2006 11356 11357 M.A. White, J.A. Johnson, J.T. Koberstein, N.J. Turro, J. Am. Chem. Soc. 128 (2006) 11356–11357. [37] A.J. Dirks S.S. van Berkel N.S. Hatzakis J.A. Opsteen F.L. van Delft J.J.L.M. Cornelissen A.E. Rowan J.C.M. van Hest F.P.J.T. Rutjes R.J.M. Nolte Chem. Commun. 2005 4172 4174 A.J. Dirks, S.S. van Berkel, N.S. Hatzakis, J.A. Opsteen, F.L. van Delft, J.J.L.M. Cornelissen, A.E. Rowan, J.C.M. van Hest, F.P.J.T. Rutjes, R.J.M. Nolte, Chem. Commun. (2005) 4172–4174. [38] C.J. Hawker K.L. Wooley Science 309 2005 1200 1205 C.J. Hawker, K.L. Wooley, Science 309 (2005) 1200–1205. [39] H.C. Kolb K.B. Sharpless Drug Discov. Today 8 2003 1128 1137 H.C. Kolb, K.B. Sharpless, Drug Discov. Today 8 (2003) 1128–1137. [40] A.J.M. Al-Karawi A-A B. OmarAli S. Mangelsen N. Dege S. Kansız P. Breuninger C. Baydere O.B. OmarAli Polyhedron 198 2021 115084 A.J.M. Al-Karawi, A-A B. OmarAli, S. Mangelsen, N. Dege, S. Kansız, P. Breuninger, C. Baydere, O.B. OmarAli, Polyhedron 198 (2021) 115084. [41] O.A. Attanasi G. Favi P. Filippone F. Mantellini G. Moscatelli F.R. Perrulli Org. Lett. 12 2010 468 471 O.A. Attanasi, G. Favi, P. Filippone, F. Mantellini, G. Moscatelli, F.R. Perrulli, Org. Lett. 12 (2010) 468–471. [42] Y. Wang J. Liu C. Xia Adv. Synth. Catal. 353 2011 1534 1542 Y. Wang, J. Liu, C. Xia, Adv. Synth. Catal. 353 (2011) 1534–1542. [43] A.K. Agrahari P. Bose M.K. Jaiswal S. Rajkhowa A.S. Singh S. Hotha N. Mishra V.K. Tiwari Chem. Rev. 121 2021 7638 7956 A.K. Agrahari, P. Bose, M.K. Jaiswal, S. Rajkhowa, A.S. Singh, S. Hotha, N. Mishra, V.K. Tiwari, Chem. Rev. 121 (2021) 7638–7956. [44] D. Döhler P. Michael W.H. Binder Acc. Chem. Res. 50 2017 2610 2620 D. Döhler, P. Michael, W.H. Binder, Acc. Chem. Res. 50 (2017) 2610–2620. [45] V.K. Tiwari B.B. Mishra K.B. Mishra N. Mishra A.S. Singh X. Chen Chem. Rev. 116 2016 3086 3240 V.K. Tiwari, B.B. Mishra, K.B. Mishra, N. Mishra, A.S. Singh, X. Chen, Chem. Rev. 116 (2016) 3086–3240. [46] C. Wang D. Ikhlef S. Kahlal J.-Y. Saillard D. Astruc Coord. Chem. Rev. 316 2016 1 20 C. Wang, D. Ikhlef, S. Kahlal, J.-Y. Saillard, D. Astruc, Coord. Chem. Rev. 316 (2016) 1–20. [47] Z. Wang N. Jia X. Zhou J. Han H. Bu ACS Appl. Bio Mater. 4 2021 3571 3578 Z. Wang, N. Jia, X. Zhou, J. Han, H. Bu, ACS Appl. Bio Mater. 4 (2021) 3571–3578. [48] M. Nayak D.K. Joshi K. Kumar A.S. Singh V.K. Tiwari S. Bhattacharya Inorg. Chem. 60 2021 8075 8084 M. Nayak, D.K. Joshi, K. Kumar, A.S. Singh, V.K. Tiwari, S. Bhattacharya, Inorg. Chem. 60 (2021) 8075–8084. [49] A. Nayal P.S. Pandey Tetrahedron Lett. 61 2020 152509 A. Nayal, P.S. Pandey, Tetrahedron Lett.. 61 (2020) 152509. [50] Y.-C. Lin Y.-J. Chen T-Yu Shih Y.-H. Chen Y.-C. Lai M.Y. Chiang G.C. Senadi H.-Y. Chen H.-Y. Chen Organometallics 38 2019 223 230 Y.-C. Lin, Y.-J. Chen, T-Yu Shih, Y.-H. Chen, Y.-C. Lai, M.Y. Chiang, G.C. Senadi, H.-Y. Chen, H.-Y. Chen, Organometallics 38 (2019) 223–230. [51] N. Sareen A.S. Singh V.K. Tiwari R. Kant S. Bhattacharya Dalton Trans. 46 2017 12705 12710 N. Sareen, A.S. Singh, V.K. Tiwari, R. Kant, S. Bhattacharya, Dalton Trans.. 46 (2017) 12705–12710. [52] P. Michael W.H. Binder Angew. Chem. 127 2015 14124 14128 P. Michael, W.H. Binder, Angew. Chem. 127 (2015) 14124–14128. [53] L.R. Collins T.M. Rookes M.F. Mahon I.M. Riddlestone M.K. Whittlesey Organometallics 33 2014 5882 5887 L.R. Collins, T.M. Rookes, M.F. Mahon, I.M. Riddlestone, M.K. Whittlesey, Organometallics 33 (2014) 5882–5887. [54] B.T. Worrell J.A. Malik V.V. Fokin Science 340 2013 457 460 B.T. Worrell, J.A. Malik, V.V. Fokin, Science, 340 (2013) 457–460. [55] F. Lazreg A.M.Z. Slawin C.S.J. Cazin Organometallics 31 2012 7969 7975 F. Lazreg, A.M.Z. Slawin, C.S.J. Cazin, Organometallics 31 (2012) 7969–7975. [56] M. Ahlquist V.V. Fokin Organometallics 26 2007 4389 4391 M. Ahlquist, V.V. Fokin, Organometallics 26 (2007) 4389–4391. [57] R. Huisgen Centenary Lecture - 1,3-dipolar cycloadditions Proceedings of the Chemical Society of London 1961 357 R. Huisgen, \"Centenary Lecture - 1,3-dipolar cycloadditions\", Proceedings of the Chemical Society of London: 1961, 357. [58] H.C. Kolb M.G. Finn K.B. Sharpless Angew. Chem. Int. Ed Engl. 40 2001 2004 2021 H.C. Kolb, M.G. Finn, K.B. Sharpless, Angew. Chem. Int. Ed Engl. 40 (2001) 2004–2021. [59] V.V. Rostovtsev L.G. Green V.V. Fokin K.B. Sharpless Angew. Chem. Int. Ed Engl. 114 2002 2708 2711 V.V. Rostovtsev, L.G. Green, V.V. Fokin, K.B. Sharpless, Angew. Chem. Int. Ed Engl. 114 (2002) 2708–2711. [60] C.W. Tornøe C. Christensen M. Meldal J. Org. Chem. 67 2002 3057 3064 C.W. Tornøe, C. Christensen, M. Meldal, J. Org. Chem. 67 (2002) 3057–3064. [61] B. Khanetskyy D. Dallinger C.O. Kappe J. Comb. Chem. 6 2004 884 892 B. Khanetskyy, D. Dallinger, C.O. Kappe, J. Comb. Chem. 6 (2004) 884–892. [62] P. Appukkuttan W. Dehaen V.V. Fokin E.V.d. Eycken Org. Lett. 6 2004 4223 4225 P. Appukkuttan, W. Dehaen, V.V. Fokin, E.V.d. Eycken, Org. Lett. 6 (2004) 4223–4225. [63] M.C. Neary P.J. Quinlivan G. Parkin Inorg. Chem. 57 2018 374 391 M.C. Neary, P.J. Quinlivan, G. Parkin, Inorg. Chem. 57 (2018) 374–391. [64] A. Mukherjee D.A. Hrovat M.G. Richmond S. Bhattacharya Dalton Trans. 47 2018 10264 10272 A. Mukherjee, D.A. Hrovat, M.G. Richmond, S. Bhattacharya, Dalton Trans.. 47 (2018) 10264–10272. [65] A. Kamecka A. Kapturkiewicz Z. Karczmarzyk W. Wysocki Inorg. Chem. Commun. 27 2013 138 141 A. Kamecka, A. Kapturkiewicz, Z. Karczmarzyk, W. Wysocki, Inorg. Chem. Commun. 27 (2013) 138–141. [66] W.H. Watson S. Kandala M.G. Richmond J. Organomet. Chem. 692 2007 1648 1652 W.H. Watson, S. Kandala, M.G. Richmond, J. Organomet. Chem. 692 (2007) 1648–1652. [67] H. Guan M. Iimura M.P. Magee J.R. Norton K.E. Janak Organometallics 22 2003 4084 4089 H. Guan, M. Iimura, M.P. Magee, J.R. Norton, K.E. Janak, Organometallics 22 (2003) 4084–4089. [68] A. Mukherjee P. Paul S. Bhattacharya J. Organomet. Chem. 834 2017 47 57 A. Mukherjee, P. Paul, S. Bhattacharya, J. Organomet. Chem. 834 (2017) 47–57. [69] E.R. dos Santos M.A. Mondelli L.V. Pozzi R.S. Correa H.S. Salistre-de Araujo F.R. Pavan C.Q.F. Leite J. Ellena V.R.S. Malta S.P. Machado d A.A. Batista Polyhedron 51 2013 292 297 E.R. dos Santos, M.A. Mondelli, L.V. Pozzi, R.S. Correa, H.S. Salistre-de Araujo, F.R. Pavan, C.Q.F. Leite, J. Ellena, V.R.S. Malta, S.P. Machado, d A.A. Batista, Polyhedron 51 (2013) 292–297. [70] M. Webster W. Zhang Inorg. Chem. 49 2010 752 760 M. Webster, W. Zhang, Inorg. Chem. 49 (2010) 752–760. [71] E. Fournier S. Sicard A. Decken P.D. Harvey Inorg. Chem. 43 2004 1491 1501 E. Fournier, S. Sicard, A. Decken, P.D. Harvey, Inorg. Chem. 43 (2004) 1491–1501. [72] P. Aslanidis P.J. Cox S. Divanidis P. Karagiannidis Inorg. Chim. Acta 357 2004 2677 2686 P. Aslanidis, P.J. Cox, S. Divanidis, P. Karagiannidis, Inorg. Chim. Acta 357 (2004) 2677–2686. [73] G.J. Kubas Inorg. Synth. 19 1979 90 G.J. Kubas, Inorg. Synth. 19 (1979) 90. [74] D.L. Smith V.I. Saunders Acta Cryst. B38 1982 907 909 D.L. Smith, V.I. Saunders, Acta Cryst.. B38 (1982) 907–909. [75] M.J. Frisch G.W. Trucks H.B. Schlegel G.E. Scuseria M.A. Robb J.R. Cheeseman G. Scalmani V. Barone G.A. Petersson H. Nakatsuji X. Li M. Caricato A. Marenich J. Bloino B.G. Janesko R. Gomperts B. Mennucci H.P. Hratchian J.V. Ortiz A.F. Izmaylov J.L. Sonnenberg D. Williams-Young F. Ding F. Lipparini F. Egidi J. Goings B. Peng A. Petrone T. Henderson D. Ranasinghe V.G. Zakrzewski J. Gao N. Rega G. Zheng W. Liang M. Hada M. Ehara K. Toyota R. Fukuda J. Hasegawa M. Ishida T. Nakajima Y. Honda O. Kitao H. Nakai T. Vreven K. Throssell J.A. Montgomery Jr. J.E. Peralta F. Ogliaro M. Bearpark J.J. Heyd E. Brothers K.N. Kudin V.N. Staroverov T. Keith R. Kobayashi J. Normand K. Raghavachari A. Rendell J.C. Burant S.S. Iyengar J. Tomasi M. Cossi J.M. Millam M. Klene C. Adamo R. Cammi J.W. Ochterski R.L. Martin K. Morokuma O. Farkas J.B. Foresman D.J. Fox Gaussian 09, Revision B.01 2010 Gaussian, Inc. Wallingford, CT M.J. Frisch, G.W. Trucks, H.B. Schlegel, G.E. Scuseria, M.A. Robb, J.R. Cheeseman, G. Scalmani, V. Barone, G.A. Petersson, H. Nakatsuji, X. Li, M. Caricato, A. Marenich, J. Bloino, B.G. Janesko, R. Gomperts, B. Mennucci, H.P. Hratchian, J.V. Ortiz, A.F. Izmaylov, J.L. Sonnenberg, D. Williams-Young, F. Ding, F. Lipparini, F. Egidi, J. Goings, B. Peng, A. Petrone, T. Henderson, D. Ranasinghe, V.G. Zakrzewski, J. Gao, N. Rega, G. Zheng, W. Liang, M. Hada, M. Ehara, K. Toyota, R. Fukuda, J. Hasegawa, M. Ishida, T. Nakajima, Y. Honda, O. Kitao, H. Nakai, T. Vreven, K. Throssell, J.A. Montgomery, Jr., J.E. Peralta, F. Ogliaro, M. Bearpark, J.J. Heyd, E. Brothers, K.N. Kudin, V.N. Staroverov, T. Keith, R. Kobayashi, J. Normand, K. Raghavachari, A. Rendell, J.C. Burant, S.S. Iyengar, J. Tomasi, M. Cossi, J.M. Millam, M. Klene, C. Adamo, R. Cammi, J.W. Ochterski, R.L. Martin, K. Morokuma, O. Farkas, J.B. Foresman, and D.J. Fox, Gaussian 09, Revision B.01; Gaussian, Inc.: Wallingford, CT, 2010. [76] A.D. Becke Phys. Rev. A 38 1988 3098 3100 A.D. Becke, Phys. Rev. A 38 (1988) 3098–3100. [77] A.D. Becke J. Chem. Phys. 98 1993 5648 5652 A.D. Becke, J. Chem. Phys. 98 (1993) 5648–5652. [78] C. Lee W. Yang R.G. Parr Phys. Rev. B: Condens. Matter 37 1988 785 789 C. Lee, W. Yang, R.G. Parr, Phys. Rev. B: Condens. Matter 37 (1988) 785–789. [79] P.J. Hay W.R. Wadt J. Chem. Phys. 82 1985 270 283 P.J. Hay, W.R. Wadt, J. Chem. Phys. 82 (1985) 270–283. [80] G.A. Peterson A. Bennett T.G. Tensfeldt M.A. Al-Laham W.A. Shirley J. Mantzaris J. Chem. Phys. 89 1988 2193 2218 G.A. Peterson, A. Bennett, T.G. Tensfeldt, M.A. Al-Laham, W.A. Shirley, J. Mantzaris, J. Chem. Phys. 89 (1988) 2193–2218. [81] G.A. Peterson M.A. Al-Laham J. Chem. Phys. 94 1991 6081 6090 G.A. Peterson, M.A. Al-Laham, J. Chem. Phys. 94 (1991) 6081–6090. [82] T.A. Helgren W.N. Lipscomb Chem. Phys. Lett. 49 1977 225 232 T.A. Helgren, W.N. Lipscomb, Chem. Phys. Lett. 49 (1977) 225–232. [83] V. Barone M. Cossi J. Phys. Chem. A 102 1998 1995 2001 V. Barone, M. Cossi, J. Phys. Chem. A 102 (1998) 1995–2001. [84] M. Cossi V. Barone J. Chem. Phys. 115 2001 4708 4717 M. Cossi, V. Barone, J. Chem. Phys. 115 (2001) 4708–4717. [85] M. Cossi N. Rega G. Scalmani V. Barone J. Comput. Chem. 24 2003 669 681 M. Cossi, N. Rega, G. Scalmani, V. Barone, J. Comput. Chem. 24 (2003) 669–681. [86] J.H. Teles S. Brode M. Chabanas Angew. Chem. 110 1998 1475 Angew. Chem. Int. Ed. 37 (1998) 1415–1418 J.H. Teles, S. Brode, M. Chabanas, Angew. Chem. 110 (1998) 1475; Angew. Chem. Int. Ed. 37 (1998) 1415–1418. [87] Chemical shifts for all NMR data are given as δ (ppm) and the multiplicity of the signals, along with the associated coupling constant(s), is given in parentheses. Overlapping signals are marked with an asterisk (*). [88] G.M. Sheldrick SHELXS-97 and SHELXL-97 Fortran Programs For Crystal Structure Solution and Refinement 1997 University of Göttingen Göttingen, Germany G.M. Sheldrick, SHELXS-97 and SHELXL-97, Fortran Programs For Crystal Structure Solution and Refinement, University of Göttingen: Göttingen, Germany 1997. [89] A. Tsuboyama K. Kuje M. Furugori S. Okada M. Hoshino K. Ueno Inorg. Chem. 46 2007 1992 2001 A. Tsuboyama, K. Kuje, M. Furugori, S. Okada, M. Hoshino, K. Ueno, Inorg. Chem. 46 (2007) 1992–2001. [90] O. Moudam A. Kaeser B. Delavaux-Nicot C. Duhayon M. Holler G. Accorsi N. Armaroli I. Se´guy J. Navarro P. Destruel J.-F. Nierengarten Chem. Commun. 2007 3077 3079 O. Moudam, A. Kaeser, B. Delavaux-Nicot, C. Duhayon, M. Holler, G. Accorsi, N. Armaroli, I. Se´guy, J. Navarro, P. Destruel, J.-F. Nierengarten, Chem. Commun. (2007) 3077–3079. [91] Y. Okano H. Ohara A. Kobayashi M. Yoshida M. Kato Inorg. Chem. 55 2016 5227 5236 Y. Okano, H. Ohara, A. Kobayashi, M. Yoshida, M. Kato, Inorg. Chem. 55 (2016) 5227–5236. [92] The geometric isomers of P1a are possible, but are not included here. [93] The same species, INT-1, can also originate from complex 2 or 3 via bridge splitting and halide or thiocyanate dissociation, which seems to be unfavourable compared to dissociation of a diphos from complex 1. [94] R.A. Widenhoefer Q. Han Eur. J. Org. Chem. 2006 4555 4563 R.A. Widenhoefer, Q. Han, Eur. J. Org. Chem. (2006) 4555–4563. [95] A.S.K. Hashmi L. Schwarz J.-H. Choi T.M. Frost Angew. Chem. Int. Ed. 39 2000 2285 2288 A.S.K. Hashmi, L. Schwarz, J.-H. Choi, T.M. Frost, Angew. Chem. Int. Ed. 39 (2000) 2285–2288. [96] J.J. Kennedy-Smith S.T. Staben F.D. Toste J. Am. Chem. Soc. 126 2004 4526 4527 J.J. Kennedy-Smith, S.T. Staben, F.D. Toste, J. Am. Chem. Soc. 126 (2004) 4526–4527. [97] J. Zhang C.-G. Yang C. He J. Am. Chem. Soc. 128 2006 1798 1799 J. Zhang, C.-G. Yang, C. He, J. Am. Chem. Soc. 128 (2006) 1798–1799. [98] Y. Liu F. Song Z. Song M. Liu B. Yan Org. Lett. 7 2005 5409 5412 Y. Liu, F. Song, Z. Song, M. Liu, B. Yan, Org. Lett. 7 (2005) 5409–5412. [99] L. Li G. Huang Z. Chen W. Liu X. Wang Y. Chen L. Yang W. Li Y. Li Eur. J. Org. Chem. 2012 5564 5572 L. Li, G. Huang, Z. Chen, W. Liu, X. Wang, Y. Chen, L. Yang, W. Li, Y. Li, Eur. J. Org. Chem. (2012) 5564–5572. [100] A.V. Gurbanov A.G. Mahmoud V.A. Aliyeva M.F.C.G. d. Silva A.J.L. Pombeiro New J. Chem. 47 2023 7965 7974 A.V. Gurbanov, A.G. Mahmoud, V.A. Aliyeva, M.F.C.G. d. Silva, A.J.L. Pombeiro, New J. Chem. 47 (2023) 7965–7974. [101] A.G. Mahmoud M.F.C.G. d. Silva A.J.L. Pombeiro Dalton Trans. 50 2021 6109 6125 A.G. Mahmoud, M.F.C.G. d. Silva, A.J.L. Pombeiro, Dalton Trans.. 50 (2021) 6109–6125. [102] I.L. Librando A.G. Mahmoud S.A.C. Carabineiro M.F.C.G. d. Silva C.F.G.C. Geraldes A.J.L. Pombeiro Catalysts 11 2021 185 I.L. Librando, A.G. Mahmoud, S.A.C. Carabineiro, M.F.C.G. d. Silva, C.F.G.C. Geraldes, A.J.L. Pombeiro, Catalysts 11 (2021) 185. [103] I.L. Librando A.G. Mahmoud S.A.C. Carabineiro M.F.C.G. d. Silva C.F.G.C. Geraldes A.J.L. Pombeiro Nanomaterials 11 2021 2702 I.L. Librando, A.G. Mahmoud, S.A.C. Carabineiro, M.F.C.G. d. Silva, C.F.G.C. Geraldes, A.J.L. Pombeiro, Nanomaterials 11 (2021) 2702. [104] A.G. Mahmoud P. Smoleński M.F.C.G. d. Silva A.J.L. Pombeiro Molecules 25 2020 5479 A.G. Mahmoud, P. Smoleński, M.F.C.G. d. Silva, A.J.L. Pombeiro, Molecules 25 (2020) 5479.",
      "scopus-id": "85185830283",
      "coredata": {
        "eid": "1-s2.0-S2468823123006582",
        "dc:description": "This paper reports the synthesis of a small group of three copper(I) complexes using 1,2-bis(diphenylphosphino)benzene, abbreviated as dppbz, and their utilization as catalyst for CN bond formation reactions. Reaction of dppbz has been carried out with three different copper(I) sources. While reaction with [Cu(CH3CN)4]ClO4 affords [CuI(dppbz)2]ClO4 (complex 1), that with CuI and CuSCN affords di-copper complexes [{CuI(dppbz)I}2] and [{CuI(dppbz)(SCN)}2] (complexes 2 and 3) respectively. Bulk characterization on the complexes has been done by elemental (C, H, N) analysis, magnetic susceptibility measurement, and spectroscopic (IR, NMR and UV–vis) methods. Crystal structures of all three complexes have been determined. In [CuI(dppbz)2]ClO4, copper(I) is having a highly distorted tetrahedral CuP4 core. In [{CuI(dppbz)I}2] and [{CuI(dppbz)(SCN)}2], the tetrahedral CuP2I2 and CuP2SN cores are relatively less distorted. These copper complexes have been found to serve as efficient catalyst precursors for two types of CN bond formation reactions, viz. hydroamination and click reaction. Hydroamination of aryl alkynes with aryl amines has afforded selectively imine products of a single type (Markownikov product) in good yields under relatively mild condition. However, similar hydroamination with benzyl amines or alkyl amines has afforded selectively anti-Markownikov imine products. Click reaction between aryl alkynes and aryl azides yielding the cycloaddition products has also been brought about successfully with remarkable catalytic efficiency.",
        "openArchiveArticle": "false",
        "prism:coverDate": "2024-01-15",
        "openaccessUserLicense": null,
        "prism:aggregationType": "Journal",
        "prism:url": "https://api.elsevier.com/content/article/pii/S2468823123006582",
        "dc:creator": [
          {
            "@_fa": "true",
            "$": "Mukherjee, Aparajita"
          },
          {
            "@_fa": "true",
            "$": "Saha, Anannya"
          },
          {
            "@_fa": "true",
            "$": "Bhattacharya, Samaresh"
          }
        ],
        "link": [
          {
            "@_fa": "true",
            "@rel": "self",
            "@href": "https://api.elsevier.com/content/article/pii/S2468823123006582"
          },
          {
            "@_fa": "true",
            "@rel": "scidir",
            "@href": "https://www.sciencedirect.com/science/article/pii/S2468823123006582"
          }
        ],
        "dc:format": "application/json",
        "openaccessType": null,
        "pii": "S2468-8231(23)00658-2",
        "prism:volume": "553",
        "articleNumber": "113575",
        "prism:publisher": "Elsevier B.V.",
        "dc:title": "Copper(I) complexes of 1,2-bis(diphenylphosphino)benzene as efficient catalysts for alkyne hydroamination and azide-alkyne cycloaddition",
        "prism:copyright": "© 2023 Elsevier B.V. All rights reserved.",
        "openaccess": "0",
        "prism:issn": "24688231",
        "dcterms:subject": [
          {
            "@_fa": "true",
            "$": "1,2-bis(diphenylphosphino)benzene coordinated copper(I) complexes"
          },
          {
            "@_fa": "true",
            "$": "Catalytic alkyne hydroamination"
          },
          {
            "@_fa": "true",
            "$": "Azide-alkyne cycloaddition"
          }
        ],
        "openaccessArticle": "false",
        "prism:publicationName": "Molecular Catalysis",
        "openaccessSponsorType": null,
        "prism:pageRange": "113575",
        "pubType": "fla",
        "prism:coverDisplayDate": "15 January 2024",
        "prism:doi": "10.1016/j.mcat.2023.113575",
        "prism:startingPage": "113575",
        "dc:identifier": "doi:10.1016/j.mcat.2023.113575",
        "openaccessSponsorName": null
      },
      "objects": {
        "object": [
          {
            "@category": "standard",
            "@height": "852",
            "@width": "470",
            "@_fa": "true",
            "$": "https://api.elsevier.com/content/object/eid/1-s2.0-S2468823123006582-fx3.jpg?httpAccept=%2A%2F%2A",
            "@multimediatype": "JPEG image file",
            "@type": "IMAGE-DOWNSAMPLED",
            "@size": "92736",
            "@ref": "fx3",
            "@mimetype": "image/jpeg"
          },
          {
            "@category": "standard",
            "@height": "361",
            "@width": "538",
            "@_fa": "true",
            "$": "https://api.elsevier.com/content/object/eid/1-s2.0-S2468823123006582-gr3.jpg?httpAccept=%2A%2F%2A",
            "@multimediatype": "JPEG image file",
            "@type": "IMAGE-DOWNSAMPLED",
            "@size": "39619",
            "@ref": "gr3",
            "@mimetype": "image/jpeg"
          },
          {
            "@category": "standard",
            "@height": "327",
            "@width": "470",
            "@_fa": "true",
            "$": "https://api.elsevier.com/content/object/eid/1-s2.0-S2468823123006582-sc1.jpg?httpAccept=%2A%2F%2A",
            "@multimediatype": "JPEG image file",
            "@type": "IMAGE-DOWNSAMPLED",
            "@size": "23298",
            "@ref": "sc1",
            "@mimetype": "image/jpeg"
          },
          {
            "@category": "standard",
            "@height": "324",
            "@width": "386",
            "@_fa": "true",
            "$": "https://api.elsevier.com/content/object/eid/1-s2.0-S2468823123006582-gr2.jpg?httpAccept=%2A%2F%2A",
            "@multimediatype": "JPEG image file",
            "@type": "IMAGE-DOWNSAMPLED",
            "@size": "30036",
            "@ref": "gr2",
            "@mimetype": "image/jpeg"
          },
          {
            "@category": "standard",
            "@height": "243",
            "@width": "470",
            "@_fa": "true",
            "$": "https://api.elsevier.com/content/object/eid/1-s2.0-S2468823123006582-sc2.jpg?httpAccept=%2A%2F%2A",
            "@multimediatype": "JPEG image file",
            "@type": "IMAGE-DOWNSAMPLED",
            "@size": "23233",
            "@ref": "sc2",
            "@mimetype": "image/jpeg"
          },
          {
            "@category": "standard",
            "@height": "369",
            "@width": "373",
            "@_fa": "true",
            "$": "https://api.elsevier.com/content/object/eid/1-s2.0-S2468823123006582-gr1.jpg?httpAccept=%2A%2F%2A",
            "@multimediatype": "JPEG image file",
            "@type": "IMAGE-DOWNSAMPLED",
            "@size": "31566",
            "@ref": "gr1",
            "@mimetype": "image/jpeg"
          },
          {
            "@category": "standard",
            "@height": "512",
            "@width": "470",
            "@_fa": "true",
            "$": "https://api.elsevier.com/content/object/eid/1-s2.0-S2468823123006582-sc3.jpg?httpAccept=%2A%2F%2A",
            "@multimediatype": "JPEG image file",
            "@type": "IMAGE-DOWNSAMPLED",
            "@size": "42040",
            "@ref": "sc3",
            "@mimetype": "image/jpeg"
          },
          {
            "@category": "standard",
            "@height": "512",
            "@width": "470",
            "@_fa": "true",
            "$": "https://api.elsevier.com/content/object/eid/1-s2.0-S2468823123006582-gr7.jpg?httpAccept=%2A%2F%2A",
            "@multimediatype": "JPEG image file",
            "@type": "IMAGE-DOWNSAMPLED",
            "@size": "63509",
            "@ref": "gr7",
            "@mimetype": "image/jpeg"
          },
          {
            "@category": "standard",
            "@height": "572",
            "@width": "470",
            "@_fa": "true",
            "$": "https://api.elsevier.com/content/object/eid/1-s2.0-S2468823123006582-gr6.jpg?httpAccept=%2A%2F%2A",
            "@multimediatype": "JPEG image file",
            "@type": "IMAGE-DOWNSAMPLED",
            "@size": "65678",
            "@ref": "gr6",
            "@mimetype": "image/jpeg"
          },
          {
            "@category": "standard",
            "@height": "370",
            "@width": "527",
            "@_fa": "true",
            "$": "https://api.elsevier.com/content/object/eid/1-s2.0-S2468823123006582-gr4.jpg?httpAccept=%2A%2F%2A",
            "@multimediatype": "JPEG image file",
            "@type": "IMAGE-DOWNSAMPLED",
            "@size": "32593",
            "@ref": "gr4",
            "@mimetype": "image/jpeg"
          },
          {
            "@category": "standard",
            "@height": "878",
            "@width": "565",
            "@_fa": "true",
            "$": "https://api.elsevier.com/content/object/eid/1-s2.0-S2468823123006582-gr5a.jpg?httpAccept=%2A%2F%2A",
            "@multimediatype": "JPEG image file",
            "@type": "IMAGE-DOWNSAMPLED",
            "@size": "126416",
            "@ref": "gr5a",
            "@mimetype": "image/jpeg"
          },
          {
            "@category": "standard",
            "@height": "279",
            "@width": "456",
            "@_fa": "true",
            "$": "https://api.elsevier.com/content/object/eid/1-s2.0-S2468823123006582-gr5b.jpg?httpAccept=%2A%2F%2A",
            "@multimediatype": "JPEG image file",
            "@type": "IMAGE-DOWNSAMPLED",
            "@size": "23778",
            "@ref": "gr5b",
            "@mimetype": "image/jpeg"
          },
          {
            "@category": "standard",
            "@height": "403",
            "@width": "527",
            "@_fa": "true",
            "$": "https://api.elsevier.com/content/object/eid/1-s2.0-S2468823123006582-gr8.jpg?httpAccept=%2A%2F%2A",
            "@multimediatype": "JPEG image file",
            "@type": "IMAGE-DOWNSAMPLED",
            "@size": "49793",
            "@ref": "gr8",
            "@mimetype": "image/jpeg"
          },
          {
            "@category": "standard",
            "@height": "434",
            "@width": "357",
            "@_fa": "true",
            "$": "https://api.elsevier.com/content/object/eid/1-s2.0-S2468823123006582-fx1b.jpg?httpAccept=%2A%2F%2A",
            "@multimediatype": "JPEG image file",
            "@type": "IMAGE-DOWNSAMPLED",
            "@size": "38378",
            "@ref": "fx1b",
            "@mimetype": "image/jpeg"
          },
          {
            "@category": "standard",
            "@height": "200",
            "@width": "298",
            "@_fa": "true",
            "$": "https://api.elsevier.com/content/object/eid/1-s2.0-S2468823123006582-ga1.jpg?httpAccept=%2A%2F%2A",
            "@multimediatype": "JPEG image file",
            "@type": "IMAGE-DOWNSAMPLED",
            "@size": "22229",
            "@ref": "ga1",
            "@mimetype": "image/jpeg"
          },
          {
            "@category": "standard",
            "@height": "539",
            "@width": "357",
            "@_fa": "true",
            "$": "https://api.elsevier.com/content/object/eid/1-s2.0-S2468823123006582-fx1a.jpg?httpAccept=%2A%2F%2A",
            "@multimediatype": "JPEG image file",
            "@type": "IMAGE-DOWNSAMPLED",
            "@size": "43866",
            "@ref": "fx1a",
            "@mimetype": "image/jpeg"
          },
          {
            "@category": "standard",
            "@height": "148",
            "@width": "386",
            "@_fa": "true",
            "$": "https://api.elsevier.com/content/object/eid/1-s2.0-S2468823123006582-gr12.jpg?httpAccept=%2A%2F%2A",
            "@multimediatype": "JPEG image file",
            "@type": "IMAGE-DOWNSAMPLED",
            "@size": "9561",
            "@ref": "gr12",
            "@mimetype": "image/jpeg"
          },
          {
            "@category": "standard",
            "@height": "792",
            "@width": "470",
            "@_fa": "true",
            "$": "https://api.elsevier.com/content/object/eid/1-s2.0-S2468823123006582-fx2.jpg?httpAccept=%2A%2F%2A",
            "@multimediatype": "JPEG image file",
            "@type": "IMAGE-DOWNSAMPLED",
            "@size": "61172",
            "@ref": "fx2",
            "@mimetype": "image/jpeg"
          },
          {
            "@category": "thumbnail",
            "@height": "163",
            "@width": "90",
            "@_fa": "true",
            "$": "https://api.elsevier.com/content/object/eid/1-s2.0-S2468823123006582-fx3.sml?httpAccept=%2A%2F%2A",
            "@multimediatype": "GIF image file",
            "@type": "IMAGE-THUMBNAIL",
            "@size": "5998",
            "@ref": "fx3",
            "@mimetype": "image/gif"
          },
          {
            "@category": "thumbnail",
            "@height": "147",
            "@width": "219",
            "@_fa": "true",
            "$": "https://api.elsevier.com/content/object/eid/1-s2.0-S2468823123006582-gr3.sml?httpAccept=%2A%2F%2A",
            "@multimediatype": "GIF image file",
            "@type": "IMAGE-THUMBNAIL",
            "@size": "10287",
            "@ref": "gr3",
            "@mimetype": "image/gif"
          },
          {
            "@category": "thumbnail",
            "@height": "152",
            "@width": "219",
            "@_fa": "true",
            "$": "https://api.elsevier.com/content/object/eid/1-s2.0-S2468823123006582-sc1.sml?httpAccept=%2A%2F%2A",
            "@multimediatype": "GIF image file",
            "@type": "IMAGE-THUMBNAIL",
            "@size": "6000",
            "@ref": "sc1",
            "@mimetype": "image/gif"
          },
          {
            "@category": "thumbnail",
            "@height": "164",
            "@width": "195",
            "@_fa": "true",
            "$": "https://api.elsevier.com/content/object/eid/1-s2.0-S2468823123006582-gr2.sml?httpAccept=%2A%2F%2A",
            "@multimediatype": "GIF image file",
            "@type": "IMAGE-THUMBNAIL",
            "@size": "11319",
            "@ref": "gr2",
            "@mimetype": "image/gif"
          },
          {
            "@category": "thumbnail",
            "@height": "113",
            "@width": "219",
            "@_fa": "true",
            "$": "https://api.elsevier.com/content/object/eid/1-s2.0-S2468823123006582-sc2.sml?httpAccept=%2A%2F%2A",
            "@multimediatype": "GIF image file",
            "@type": "IMAGE-THUMBNAIL",
            "@size": "6010",
            "@ref": "sc2",
            "@mimetype": "image/gif"
          },
          {
            "@category": "thumbnail",
            "@height": "164",
            "@width": "166",
            "@_fa": "true",
            "$": "https://api.elsevier.com/content/object/eid/1-s2.0-S2468823123006582-gr1.sml?httpAccept=%2A%2F%2A",
            "@multimediatype": "GIF image file",
            "@type": "IMAGE-THUMBNAIL",
            "@size": "9939",
            "@ref": "gr1",
            "@mimetype": "image/gif"
          },
          {
            "@category": "thumbnail",
            "@height": "163",
            "@width": "150",
            "@_fa": "true",
            "$": "https://api.elsevier.com/content/object/eid/1-s2.0-S2468823123006582-sc3.sml?httpAccept=%2A%2F%2A",
            "@multimediatype": "GIF image file",
            "@type": "IMAGE-THUMBNAIL",
            "@size": "7466",
            "@ref": "sc3",
            "@mimetype": "image/gif"
          },
          {
            "@category": "thumbnail",
            "@height": "163",
            "@width": "150",
            "@_fa": "true",
            "$": "https://api.elsevier.com/content/object/eid/1-s2.0-S2468823123006582-gr7.sml?httpAccept=%2A%2F%2A",
            "@multimediatype": "GIF image file",
            "@type": "IMAGE-THUMBNAIL",
            "@size": "9312",
            "@ref": "gr7",
            "@mimetype": "image/gif"
          },
          {
            "@category": "thumbnail",
            "@height": "163",
            "@width": "134",
            "@_fa": "true",
            "$": "https://api.elsevier.com/content/object/eid/1-s2.0-S2468823123006582-gr6.sml?httpAccept=%2A%2F%2A",
            "@multimediatype": "GIF image file",
            "@type": "IMAGE-THUMBNAIL",
            "@size": "9019",
            "@ref": "gr6",
            "@mimetype": "image/gif"
          },
          {
            "@category": "thumbnail",
            "@height": "154",
            "@width": "219",
            "@_fa": "true",
            "$": "https://api.elsevier.com/content/object/eid/1-s2.0-S2468823123006582-gr4.sml?httpAccept=%2A%2F%2A",
            "@multimediatype": "GIF image file",
            "@type": "IMAGE-THUMBNAIL",
            "@size": "8028",
            "@ref": "gr4",
            "@mimetype": "image/gif"
          },
          {
            "@category": "thumbnail",
            "@height": "163",
            "@width": "105",
            "@_fa": "true",
            "$": "https://api.elsevier.com/content/object/eid/1-s2.0-S2468823123006582-gr5a.sml?httpAccept=%2A%2F%2A",
            "@multimediatype": "GIF image file",
            "@type": "IMAGE-THUMBNAIL",
            "@size": "8834",
            "@ref": "gr5a",
            "@mimetype": "image/gif"
          },
          {
            "@category": "thumbnail",
            "@height": "134",
            "@width": "219",
            "@_fa": "true",
            "$": "https://api.elsevier.com/content/object/eid/1-s2.0-S2468823123006582-gr5b.sml?httpAccept=%2A%2F%2A",
            "@multimediatype": "GIF image file",
            "@type": "IMAGE-THUMBNAIL",
            "@size": "7816",
            "@ref": "gr5b",
            "@mimetype": "image/gif"
          },
          {
            "@category": "thumbnail",
            "@height": "164",
            "@width": "214",
            "@_fa": "true",
            "$": "https://api.elsevier.com/content/object/eid/1-s2.0-S2468823123006582-gr8.sml?httpAccept=%2A%2F%2A",
            "@multimediatype": "GIF image file",
            "@type": "IMAGE-THUMBNAIL",
            "@size": "11488",
            "@ref": "gr8",
            "@mimetype": "image/gif"
          },
          {
            "@category": "thumbnail",
            "@height": "164",
            "@width": "135",
            "@_fa": "true",
            "$": "https://api.elsevier.com/content/object/eid/1-s2.0-S2468823123006582-fx1b.sml?httpAccept=%2A%2F%2A",
            "@multimediatype": "GIF image file",
            "@type": "IMAGE-THUMBNAIL",
            "@size": "6684",
            "@ref": "fx1b",
            "@mimetype": "image/gif"
          },
          {
            "@category": "thumbnail",
            "@height": "147",
            "@width": "219",
            "@_fa": "true",
            "$": "https://api.elsevier.com/content/object/eid/1-s2.0-S2468823123006582-ga1.sml?httpAccept=%2A%2F%2A",
            "@multimediatype": "GIF image file",
            "@type": "IMAGE-THUMBNAIL",
            "@size": "11492",
            "@ref": "ga1",
            "@mimetype": "image/gif"
          },
          {
            "@category": "thumbnail",
            "@height": "163",
            "@width": "108",
            "@_fa": "true",
            "$": "https://api.elsevier.com/content/object/eid/1-s2.0-S2468823123006582-fx1a.sml?httpAccept=%2A%2F%2A",
            "@multimediatype": "GIF image file",
            "@type": "IMAGE-THUMBNAIL",
            "@size": "5940",
            "@ref": "fx1a",
            "@mimetype": "image/gif"
          },
          {
            "@category": "thumbnail",
            "@height": "84",
            "@width": "219",
            "@_fa": "true",
            "$": "https://api.elsevier.com/content/object/eid/1-s2.0-S2468823123006582-gr12.sml?httpAccept=%2A%2F%2A",
            "@multimediatype": "GIF image file",
            "@type": "IMAGE-THUMBNAIL",
            "@size": "3287",
            "@ref": "gr12",
            "@mimetype": "image/gif"
          },
          {
            "@category": "thumbnail",
            "@height": "163",
            "@width": "97",
            "@_fa": "true",
            "$": "https://api.elsevier.com/content/object/eid/1-s2.0-S2468823123006582-fx2.sml?httpAccept=%2A%2F%2A",
            "@multimediatype": "GIF image file",
            "@type": "IMAGE-THUMBNAIL",
            "@size": "5496",
            "@ref": "fx2",
            "@mimetype": "image/gif"
          },
          {
            "@category": "high",
            "@height": "3776",
            "@width": "2083",
            "@_fa": "true",
            "$": "https://api.elsevier.com/content/object/eid/1-s2.0-S2468823123006582-fx3_lrg.jpg?httpAccept=%2A%2F%2A",
            "@multimediatype": "JPEG image file",
            "@type": "IMAGE-HIGH-RES",
            "@size": "712906",
            "@ref": "fx3",
            "@mimetype": "image/jpeg"
          },
          {
            "@category": "high",
            "@height": "1597",
            "@width": "2381",
            "@_fa": "true",
            "$": "https://api.elsevier.com/content/object/eid/1-s2.0-S2468823123006582-gr3_lrg.jpg?httpAccept=%2A%2F%2A",
            "@multimediatype": "JPEG image file",
            "@type": "IMAGE-HIGH-RES",
            "@size": "384509",
            "@ref": "gr3",
            "@mimetype": "image/jpeg"
          },
          {
            "@category": "high",
            "@height": "1448",
            "@width": "2083",
            "@_fa": "true",
            "$": "https://api.elsevier.com/content/object/eid/1-s2.0-S2468823123006582-sc1_lrg.jpg?httpAccept=%2A%2F%2A",
            "@multimediatype": "JPEG image file",
            "@type": "IMAGE-HIGH-RES",
            "@size": "168931",
            "@ref": "sc1",
            "@mimetype": "image/jpeg"
          },
          {
            "@category": "high",
            "@height": "1433",
            "@width": "1708",
            "@_fa": "true",
            "$": "https://api.elsevier.com/content/object/eid/1-s2.0-S2468823123006582-gr2_lrg.jpg?httpAccept=%2A%2F%2A",
            "@multimediatype": "JPEG image file",
            "@type": "IMAGE-HIGH-RES",
            "@size": "256728",
            "@ref": "gr2",
            "@mimetype": "image/jpeg"
          },
          {
            "@category": "high",
            "@height": "1078",
            "@width": "2083",
            "@_fa": "true",
            "$": "https://api.elsevier.com/content/object/eid/1-s2.0-S2468823123006582-sc2_lrg.jpg?httpAccept=%2A%2F%2A",
            "@multimediatype": "JPEG image file",
            "@type": "IMAGE-HIGH-RES",
            "@size": "155564",
            "@ref": "sc2",
            "@mimetype": "image/jpeg"
          },
          {
            "@category": "high",
            "@height": "1633",
            "@width": "1652",
            "@_fa": "true",
            "$": "https://api.elsevier.com/content/object/eid/1-s2.0-S2468823123006582-gr1_lrg.jpg?httpAccept=%2A%2F%2A",
            "@multimediatype": "JPEG image file",
            "@type": "IMAGE-HIGH-RES",
            "@size": "296025",
            "@ref": "gr1",
            "@mimetype": "image/jpeg"
          },
          {
            "@category": "high",
            "@height": "2268",
            "@width": "2083",
            "@_fa": "true",
            "$": "https://api.elsevier.com/content/object/eid/1-s2.0-S2468823123006582-sc3_lrg.jpg?httpAccept=%2A%2F%2A",
            "@multimediatype": "JPEG image file",
            "@type": "IMAGE-HIGH-RES",
            "@size": "343524",
            "@ref": "sc3",
            "@mimetype": "image/jpeg"
          },
          {
            "@category": "high",
            "@height": "2269",
            "@width": "2083",
            "@_fa": "true",
            "$": "https://api.elsevier.com/content/object/eid/1-s2.0-S2468823123006582-gr7_lrg.jpg?httpAccept=%2A%2F%2A",
            "@multimediatype": "JPEG image file",
            "@type": "IMAGE-HIGH-RES",
            "@size": "467181",
            "@ref": "gr7",
            "@mimetype": "image/jpeg"
          },
          {
            "@category": "high",
            "@height": "2536",
            "@width": "2083",
            "@_fa": "true",
            "$": "https://api.elsevier.com/content/object/eid/1-s2.0-S2468823123006582-gr6_lrg.jpg?httpAccept=%2A%2F%2A",
            "@multimediatype": "JPEG image file",
            "@type": "IMAGE-HIGH-RES",
            "@size": "483680",
            "@ref": "gr6",
            "@mimetype": "image/jpeg"
          },
          {
            "@category": "high",
            "@height": "1639",
            "@width": "2333",
            "@_fa": "true",
            "$": "https://api.elsevier.com/content/object/eid/1-s2.0-S2468823123006582-gr4_lrg.jpg?httpAccept=%2A%2F%2A",
            "@multimediatype": "JPEG image file",
            "@type": "IMAGE-HIGH-RES",
            "@size": "221389",
            "@ref": "gr4",
            "@mimetype": "image/jpeg"
          },
          {
            "@category": "high",
            "@height": "3884",
            "@width": "2500",
            "@_fa": "true",
            "$": "https://api.elsevier.com/content/object/eid/1-s2.0-S2468823123006582-gr5a_lrg.jpg?httpAccept=%2A%2F%2A",
            "@multimediatype": "JPEG image file",
            "@type": "IMAGE-HIGH-RES",
            "@size": "933833",
            "@ref": "gr5a",
            "@mimetype": "image/jpeg"
          },
          {
            "@category": "high",
            "@height": "1235",
            "@width": "2020",
            "@_fa": "true",
            "$": "https://api.elsevier.com/content/object/eid/1-s2.0-S2468823123006582-gr5b_lrg.jpg?httpAccept=%2A%2F%2A",
            "@multimediatype": "JPEG image file",
            "@type": "IMAGE-HIGH-RES",
            "@size": "165016",
            "@ref": "gr5b",
            "@mimetype": "image/jpeg"
          },
          {
            "@category": "high",
            "@height": "1785",
            "@width": "2333",
            "@_fa": "true",
            "$": "https://api.elsevier.com/content/object/eid/1-s2.0-S2468823123006582-gr8_lrg.jpg?httpAccept=%2A%2F%2A",
            "@multimediatype": "JPEG image file",
            "@type": "IMAGE-HIGH-RES",
            "@size": "321486",
            "@ref": "gr8",
            "@mimetype": "image/jpeg"
          },
          {
            "@category": "high",
            "@height": "1924",
            "@width": "1583",
            "@_fa": "true",
            "$": "https://api.elsevier.com/content/object/eid/1-s2.0-S2468823123006582-fx1b_lrg.jpg?httpAccept=%2A%2F%2A",
            "@multimediatype": "JPEG image file",
            "@type": "IMAGE-HIGH-RES",
            "@size": "277134",
            "@ref": "fx1b",
            "@mimetype": "image/jpeg"
          },
          {
            "@category": "high",
            "@height": "886",
            "@width": "1321",
            "@_fa": "true",
            "$": "https://api.elsevier.com/content/object/eid/1-s2.0-S2468823123006582-ga1_lrg.jpg?httpAccept=%2A%2F%2A",
            "@multimediatype": "JPEG image file",
            "@type": "IMAGE-HIGH-RES",
            "@size": "155058",
            "@ref": "ga1",
            "@mimetype": "image/jpeg"
          },
          {
            "@category": "high",
            "@height": "2392",
            "@width": "1583",
            "@_fa": "true",
            "$": "https://api.elsevier.com/content/object/eid/1-s2.0-S2468823123006582-fx1a_lrg.jpg?httpAccept=%2A%2F%2A",
            "@multimediatype": "JPEG image file",
            "@type": "IMAGE-HIGH-RES",
            "@size": "332354",
            "@ref": "fx1a",
            "@mimetype": "image/jpeg"
          },
          {
            "@category": "high",
            "@height": "655",
            "@width": "1708",
            "@_fa": "true",
            "$": "https://api.elsevier.com/content/object/eid/1-s2.0-S2468823123006582-gr12_lrg.jpg?httpAccept=%2A%2F%2A",
            "@multimediatype": "JPEG image file",
            "@type": "IMAGE-HIGH-RES",
            "@size": "71445",
            "@ref": "gr12",
            "@mimetype": "image/jpeg"
          },
          {
            "@category": "high",
            "@height": "3510",
            "@width": "2083",
            "@_fa": "true",
            "$": "https://api.elsevier.com/content/object/eid/1-s2.0-S2468823123006582-fx2_lrg.jpg?httpAccept=%2A%2F%2A",
            "@multimediatype": "JPEG image file",
            "@type": "IMAGE-HIGH-RES",
            "@size": "463662",
            "@ref": "fx2",
            "@mimetype": "image/jpeg"
          },
          {
            "@category": "standard",
            "@_fa": "true",
            "$": "https://api.elsevier.com/content/object/eid/1-s2.0-S2468823123006582-mmc1.docx?httpAccept=%2A%2F%2A",
            "@multimediatype": "Microsoft Word file",
            "@type": "APPLICATION",
            "@size": "635536",
            "@ref": "mmc1",
            "@mimetype": "application/word"
          },
          {
            "@category": "standard",
            "@_fa": "true",
            "$": "https://api.elsevier.com/content/object/eid/1-s2.0-S2468823123006582-am.pdf?httpAccept=%2A%2F%2A",
            "@multimediatype": "Acrobat PDF file",
            "@type": "AAM-PDF",
            "@size": "1721141",
            "@ref": "am",
            "@mimetype": "application/pdf"
          }
        ]
      },
      "link": {
        "@rel": "abstract",
        "@href": "https://api.elsevier.com/content/abstract/scopus_id/85185830283"
      }
    }
  }
}