{
  "metadata": {
    "title": "Interfacial synergistic catalysis of Cu<ce:inf loc=post>n</ce:inf> single-cluster catalysts anchored on α-Al<ce:inf loc=post>2</ce:inf>O<ce:inf loc=post>3</ce:inf>(0001) for promoting hydrogenation of CO<ce:inf loc=post>2</ce:inf> to methanol",
    "authors": "; ; ",
    "journal": "Molecular Catalysis",
    "date": "2023-12-31",
    "doi": "10.1016/j.mcat.2023.113646",
    "abstract": "",
    "uri": "https://api.elsevier.com/content/article/pii/S2468823123007290",
    "pii": "S2468823123007290"
  },
  "fulltext": {
    "full-text-retrieval-response": {
      "scopus-eid": "2-s2.0-85174804692",
      "originalText": "serial JL 315758 291210 291744 291790 291809 31 Molecular Catalysis MOLECULARCATALYSIS 2023-10-27 2023-10-27 2023-10-27 2023-10-27 2023-11-15T19:32:27 1-s2.0-S2468823123007290 S2468-8231(23)00729-0 S2468823123007290 10.1016/j.mcat.2023.113646 S300 S300.1 FULL-TEXT 1-s2.0-S2468823123X00170 2023-11-15T21:08:15.205396Z 0 0 20231201 20231231 2023 2023-10-27T05:04:39.192896Z absattachment articleinfo articlenumber articletitlenorm authfirstinitialnorm authfirstsurnamenorm cid cids contenttype copyright crossmark dateloaded dateloadedtxt datesearch datesort dateupdated dco docsubtype doctype doi eid ewtransactionid hubeid indexeddate issn issnnorm itemstage itemtransactionid itemweight openaccess openarchive pg pgfirst pii piinorm pubdateend pubdatestart pubdatetxt pubyr sectiontitle sortorder srctitle srctitlenorm srctype ssids alllist content subj subheadings suppl tomb volfirst volissue volumelist webpdf webpdfpagecount yearnav figure table e-component body mmlmath acknowledge affil appendices articletitle auth authfirstini authfull authkeywords authlast grantnumber grantsponsor grantsponsorid highlightsabst orcid primabst ref specialabst 2468-8231 24688231 true 551 551 C Volume 551 20 113646 113646 113646 202312 December 2023 2023-12-01 2023-12-31 2023 Regular Papers article fla © 2023 Elsevier B.V. All rights reserved. INTERFACIALSYNERGISTICCATALYSISCUNSINGLECLUSTERCATALYSTSANCHOREDAL2O30001FORPROMOTINGHYDROGENATIONCO2METHANOL ZHOU H Introduction Computational details Results and discussion Structures and stability of Cun/α-Al2O3 (0001) surfaces CO2 adsorption on the interfacial site of the Cun/α-Al2O3(0001) surfaces CO2 synthesis to methanol on the interfacial site of the Cu5/α-Al2O3 (0001) Formate pathway RWGS + CO-hydrogenation pathway Direct CO bond cleavage pathway Conclusion CRediT authorship contribution statement Acknowledgments Appendix Supplementary materials References LIM 2015 628 630 X HANSEN 2007 1925 1954 J ZHOU 2023 113288 Y PAHIJA 2022 6887 6905 E SONG 2022 14162 14172 X CHEN 2023 113123 Q SHEN 2021 4036 4046 C GUNASEKAR 2016 882 895 G BAIANO 2020 111181 C SANG 2022 112477 G XU 2021 5762 5775 X XU 2021 118867 X GUAN 2021 111725 Y ZHOU 2023 113288 Y POROSOFF 2016 62 73 M KATTEL 2017 9739 9754 S POLIERER 2019 26904 26911 S YE 2014 44 53 J ZHOU 2023 156492 Y SUN 2015 1 6 K RODRIGUEZ 2015 6696 6706 J ZHANG 2019 11763 11771 W BART 1987 1 124 J BEHRENS 2012 893 897 M GRACIANI 2014 546 550 J KARELOVIC 2015 869 881 A LI 2023 e202301901 X QIU 2015 902 912 M RUI 2017 488 497 N LI 2018 411 417 H MEUNIER 2023 e202303939 F CHEN 2023 6169 6184 F MAO 2023 113574 D LIU 2016 797 800 P QIAO 2011 634 641 B KAISER 2020 11703 11809 S LIU 2017 6190 6199 J LIU 2023 152 163 J WANG 2023 8413 8422 G ZHANG 2017 42529 42540 H YANG 2017 10406 10412 B FU 2023 9540 9547 N LIU 2015 8676 8679 C KRESSE 1999 1758 1775 G KRESSE 1996 11169 11186 G BLOCHL 1994 17953 17979 P PERDEW 1996 3865 3868 J GRIMME 2010 154104 S SOARES 2002 195405 E CHIANG 2016 636 643 H GAUTIERSOYER 1996 755 759 M NOSE 1984 511 519 S ZHANG 2008 191 200 Y HENKELMAN 2000 9901 9904 G HENKELMAN 2000 9978 9985 G CAMPBELL 1994 353 366 C CAMPBELL 2001 520 524 C COGOLLOOLIVO 2015 20 24 B JUG 2002 4497 4507 K FERNANDEZ 2004 165403 E NIGAM 2017 1075 1081 S YANG 2010 9909 9917 Y ZHOUX2023X113646 ZHOUX2023X113646XH 2025-10-27T00:00:00.000Z 2025-10-27T00:00:00.000Z http://creativecommons.org/licenses/by-nc-nd/4.0/ © 2023 Elsevier B.V. All rights reserved. 2023-10-29T04:41:30.394Z http://vtw.elsevier.com/data/voc/AddOnTypes/50.7/aggregated-refined National Natural Science Foundation of China 21373048 21703036 21773030 21863004 21973014 NSFC National Natural Science Foundation of China http://data.elsevier.com/vocabulary/SciValFunders/501100001809 http://sws.geonames.org/1814991/ Natural Science Foundation of Fujian Province 2022J01066 Natural Science Foundation of Fujian Province http://data.elsevier.com/vocabulary/SciValFunders/501100003392 http://sws.geonames.org/1814991/ Natural Science Foundation of Jiangxi Province 20192BAB206035 Natural Science Foundation of Jiangxi Province http://data.elsevier.com/vocabulary/SciValFunders/501100004479 http://sws.geonames.org/1814991/ This work was supported by National Natural Science Foundation of China (Grant Nos. 21773030 , 21973014 , 21863004 , 21703036 , and 21373048 ), the Natural Science Foundation of Fujian Province (No. 2022J01066), the Natural Science Foundation of Jiangxi Province (No. 20192BAB206035), the numerical calculations in this paper have been done on the supercomputing system in the Supercomputing Center of Fujian of China. https://doi.org/10.15223/policy-017 https://doi.org/10.15223/policy-037 https://doi.org/10.15223/policy-012 https://doi.org/10.15223/policy-029 https://doi.org/10.15223/policy-004 item S2468-8231(23)00729-0 S2468823123007290 1-s2.0-S2468823123007290 10.1016/j.mcat.2023.113646 315758 2023-11-15T21:08:15.205396Z 2023-12-01 2023-12-31 1-s2.0-S2468823123007290-main.pdf https://s3-eu-west-1.amazonaws.com/prod-ucs-content-store-eu-west/content/pii:S2468823123007290/MAIN/application/pdf/8e249e0e313174a76d65060bbb8dff32/main.pdf main.pdf pdf true 10199966 MAIN 12 1-s2.0-S2468823123007290-main_1.png https://s3-eu-west-1.amazonaws.com/prod-ucs-content-store-eu-west/content/pii:S2468823123007290/PREVIEW/image/png/c0e32139c2961ef8422d00cbbb07f449/main_1.png main_1.png png 57882 849 656 IMAGE-WEB-PDF 1 1-s2.0-S2468823123007290-gr9.jpg https://s3-eu-west-1.amazonaws.com/prod-ucs-content-store-eu-west/content/pii:S2468823123007290/gr9/DOWNSAMPLED/image/jpeg/77b340477ca94803a5f22c083df7fd36/gr9.jpg gr9 gr9.jpg jpg 84285 504 659 IMAGE-DOWNSAMPLED 1-s2.0-S2468823123007290-gr3.jpg https://s3-eu-west-1.amazonaws.com/prod-ucs-content-store-eu-west/content/pii:S2468823123007290/gr3/DOWNSAMPLED/image/jpeg/fd04b3c54971749a5e07159583ac0271/gr3.jpg gr3 gr3.jpg jpg 230729 950 659 IMAGE-DOWNSAMPLED 1-s2.0-S2468823123007290-gr5.jpg https://s3-eu-west-1.amazonaws.com/prod-ucs-content-store-eu-west/content/pii:S2468823123007290/gr5/DOWNSAMPLED/image/jpeg/d98831d744cf30aa7930f8298d08d028/gr5.jpg gr5 gr5.jpg jpg 57555 373 659 IMAGE-DOWNSAMPLED 1-s2.0-S2468823123007290-gr6.jpg https://s3-eu-west-1.amazonaws.com/prod-ucs-content-store-eu-west/content/pii:S2468823123007290/gr6/DOWNSAMPLED/image/jpeg/8c518438e7b8d8d221f61ca6f7c01fdd/gr6.jpg gr6 gr6.jpg jpg 43709 270 659 IMAGE-DOWNSAMPLED 1-s2.0-S2468823123007290-ga1.jpg https://s3-eu-west-1.amazonaws.com/prod-ucs-content-store-eu-west/content/pii:S2468823123007290/ga1/DOWNSAMPLED/image/jpeg/d6fe35959a3982b33b2c44204b31beda/ga1.jpg ga1 true ga1.jpg jpg 52277 200 474 IMAGE-DOWNSAMPLED 1-s2.0-S2468823123007290-gr7.jpg https://s3-eu-west-1.amazonaws.com/prod-ucs-content-store-eu-west/content/pii:S2468823123007290/gr7/DOWNSAMPLED/image/jpeg/56895065bbce2b440d79b6a87d914314/gr7.jpg gr7 gr7.jpg jpg 32412 241 659 IMAGE-DOWNSAMPLED 1-s2.0-S2468823123007290-gr8.jpg https://s3-eu-west-1.amazonaws.com/prod-ucs-content-store-eu-west/content/pii:S2468823123007290/gr8/DOWNSAMPLED/image/jpeg/f0b1ab7969478e3738efb61d18abaf6d/gr8.jpg gr8 gr8.jpg jpg 53817 322 659 IMAGE-DOWNSAMPLED 1-s2.0-S2468823123007290-gr4.jpg https://s3-eu-west-1.amazonaws.com/prod-ucs-content-store-eu-west/content/pii:S2468823123007290/gr4/DOWNSAMPLED/image/jpeg/292b98092b2f231d017643ef2b017085/gr4.jpg gr4 gr4.jpg jpg 67368 569 659 IMAGE-DOWNSAMPLED 1-s2.0-S2468823123007290-gr1.jpg https://s3-eu-west-1.amazonaws.com/prod-ucs-content-store-eu-west/content/pii:S2468823123007290/gr1/DOWNSAMPLED/image/jpeg/5da68282f517eb039e58cbb13384f421/gr1.jpg gr1 gr1.jpg jpg 177401 789 659 IMAGE-DOWNSAMPLED 1-s2.0-S2468823123007290-gr2.jpg https://s3-eu-west-1.amazonaws.com/prod-ucs-content-store-eu-west/content/pii:S2468823123007290/gr2/DOWNSAMPLED/image/jpeg/da2bb71ba4c0e6266168bcfa619c8a2f/gr2.jpg gr2 gr2.jpg jpg 142394 660 659 IMAGE-DOWNSAMPLED 1-s2.0-S2468823123007290-gr9.sml https://s3-eu-west-1.amazonaws.com/prod-ucs-content-store-eu-west/content/pii:S2468823123007290/gr9/THUMBNAIL/image/gif/30df63cc4c51e52aab197033d726a558/gr9.sml gr9 gr9.sml sml 10258 164 214 IMAGE-THUMBNAIL 1-s2.0-S2468823123007290-gr3.sml https://s3-eu-west-1.amazonaws.com/prod-ucs-content-store-eu-west/content/pii:S2468823123007290/gr3/THUMBNAIL/image/gif/a2fadf1d2212d64ddf794438c0ea4a15/gr3.sml gr3 gr3.sml sml 13245 163 113 IMAGE-THUMBNAIL 1-s2.0-S2468823123007290-gr5.sml https://s3-eu-west-1.amazonaws.com/prod-ucs-content-store-eu-west/content/pii:S2468823123007290/gr5/THUMBNAIL/image/gif/a0ec399daf7497113a9ac44722200ddf/gr5.sml gr5 gr5.sml sml 6677 124 219 IMAGE-THUMBNAIL 1-s2.0-S2468823123007290-gr6.sml https://s3-eu-west-1.amazonaws.com/prod-ucs-content-store-eu-west/content/pii:S2468823123007290/gr6/THUMBNAIL/image/gif/cd840b051dcb2a410a378cbd66eed0fe/gr6.sml gr6 gr6.sml sml 6449 90 219 IMAGE-THUMBNAIL 1-s2.0-S2468823123007290-ga1.sml https://s3-eu-west-1.amazonaws.com/prod-ucs-content-store-eu-west/content/pii:S2468823123007290/ga1/THUMBNAIL/image/gif/25b385eaa0761b597d1d4a7ed9e60f53/ga1.sml ga1 true ga1.sml sml 12971 92 219 IMAGE-THUMBNAIL 1-s2.0-S2468823123007290-gr7.sml https://s3-eu-west-1.amazonaws.com/prod-ucs-content-store-eu-west/content/pii:S2468823123007290/gr7/THUMBNAIL/image/gif/1cbc0bfe1c6b49499047dd0a266bde5b/gr7.sml gr7 gr7.sml sml 6483 80 219 IMAGE-THUMBNAIL 1-s2.0-S2468823123007290-gr8.sml https://s3-eu-west-1.amazonaws.com/prod-ucs-content-store-eu-west/content/pii:S2468823123007290/gr8/THUMBNAIL/image/gif/86b7ac0dda44169b87133cbbc7b96a4a/gr8.sml gr8 gr8.sml sml 7487 107 219 IMAGE-THUMBNAIL 1-s2.0-S2468823123007290-gr4.sml https://s3-eu-west-1.amazonaws.com/prod-ucs-content-store-eu-west/content/pii:S2468823123007290/gr4/THUMBNAIL/image/gif/99728e98ae60f74f125554fcd99519c8/gr4.sml gr4 gr4.sml sml 8072 164 190 IMAGE-THUMBNAIL 1-s2.0-S2468823123007290-gr1.sml https://s3-eu-west-1.amazonaws.com/prod-ucs-content-store-eu-west/content/pii:S2468823123007290/gr1/THUMBNAIL/image/gif/51c17043a421c4902b6560e873f39cbf/gr1.sml gr1 gr1.sml sml 13301 164 137 IMAGE-THUMBNAIL 1-s2.0-S2468823123007290-gr2.sml https://s3-eu-west-1.amazonaws.com/prod-ucs-content-store-eu-west/content/pii:S2468823123007290/gr2/THUMBNAIL/image/gif/d6ee32a48dbb114c8c4656c85355b106/gr2.sml gr2 gr2.sml sml 12959 164 164 IMAGE-THUMBNAIL 1-s2.0-S2468823123007290-gr9_lrg.jpg https://s3-eu-west-1.amazonaws.com/prod-ucs-content-store-eu-west/content/pii:S2468823123007290/HIGHRES/image/jpeg/982d3821db27821f460a2fb29156a638/gr9_lrg.jpg gr9 gr9_lrg.jpg jpg 577438 2232 2917 IMAGE-HIGH-RES 1-s2.0-S2468823123007290-gr3_lrg.jpg https://s3-eu-west-1.amazonaws.com/prod-ucs-content-store-eu-west/content/pii:S2468823123007290/HIGHRES/image/jpeg/d1046f3cee03b4ab7bcac4eff24a1332/gr3_lrg.jpg gr3 gr3_lrg.jpg jpg 1842361 4205 2917 IMAGE-HIGH-RES 1-s2.0-S2468823123007290-gr5_lrg.jpg https://s3-eu-west-1.amazonaws.com/prod-ucs-content-store-eu-west/content/pii:S2468823123007290/HIGHRES/image/jpeg/bfb099d3eacde788de5ab54057cd27ed/gr5_lrg.jpg gr5 gr5_lrg.jpg jpg 435568 1653 2917 IMAGE-HIGH-RES 1-s2.0-S2468823123007290-gr6_lrg.jpg https://s3-eu-west-1.amazonaws.com/prod-ucs-content-store-eu-west/content/pii:S2468823123007290/HIGHRES/image/jpeg/e702a3a84627e980282c8ab2b96e0dc4/gr6_lrg.jpg gr6 gr6_lrg.jpg jpg 380299 1196 2917 IMAGE-HIGH-RES 1-s2.0-S2468823123007290-ga1_lrg.jpg https://s3-eu-west-1.amazonaws.com/prod-ucs-content-store-eu-west/content/pii:S2468823123007290/HIGHRES/image/jpeg/6f8be5b889809abda3bdd648747a1f9b/ga1_lrg.jpg ga1 true ga1_lrg.jpg jpg 362477 886 2100 IMAGE-HIGH-RES 1-s2.0-S2468823123007290-gr7_lrg.jpg https://s3-eu-west-1.amazonaws.com/prod-ucs-content-store-eu-west/content/pii:S2468823123007290/HIGHRES/image/jpeg/8a3fe369b6f6cd79d9d34c8adc3923cb/gr7_lrg.jpg gr7 gr7_lrg.jpg jpg 262505 1066 2917 IMAGE-HIGH-RES 1-s2.0-S2468823123007290-gr8_lrg.jpg https://s3-eu-west-1.amazonaws.com/prod-ucs-content-store-eu-west/content/pii:S2468823123007290/HIGHRES/image/jpeg/330173984532e465506e08e973835e97/gr8_lrg.jpg gr8 gr8_lrg.jpg jpg 471443 1424 2917 IMAGE-HIGH-RES 1-s2.0-S2468823123007290-gr4_lrg.jpg https://s3-eu-west-1.amazonaws.com/prod-ucs-content-store-eu-west/content/pii:S2468823123007290/HIGHRES/image/jpeg/3c5918da9807c6153851ebc2a89ecd04/gr4_lrg.jpg gr4 gr4_lrg.jpg jpg 492432 2517 2917 IMAGE-HIGH-RES 1-s2.0-S2468823123007290-gr1_lrg.jpg https://s3-eu-west-1.amazonaws.com/prod-ucs-content-store-eu-west/content/pii:S2468823123007290/HIGHRES/image/jpeg/359f3e1d8b608d6ce963ccc131fb9d89/gr1_lrg.jpg gr1 gr1_lrg.jpg jpg 1430906 3494 2917 IMAGE-HIGH-RES 1-s2.0-S2468823123007290-gr2_lrg.jpg https://s3-eu-west-1.amazonaws.com/prod-ucs-content-store-eu-west/content/pii:S2468823123007290/HIGHRES/image/jpeg/9a58bb2b36a6fb77715a6aac76b22a7b/gr2_lrg.jpg gr2 gr2_lrg.jpg jpg 1122126 2920 2917 IMAGE-HIGH-RES 1-s2.0-S2468823123007290-mmc1.docx https://s3-eu-west-1.amazonaws.com/prod-ucs-content-store-eu-west/content/pii:S2468823123007290/mmc1/MAIN/application/vnd.openxmlformats-officedocument.wordprocessingml.document/250b29d3f16892fa1ca05ce01dbe6644/mmc1.docx mmc1 mmc1.docx docx 12368659 APPLICATION 1-s2.0-S2468823123007290-si1.svg https://s3-eu-west-1.amazonaws.com/prod-ucs-content-store-eu-west/content/pii:S2468823123007290/image/svg+xml/a38aef7208743e8242db0f1918ef0146/si1.svg si1 si1.svg svg 12185 ALTIMG 1-s2.0-S2468823123007290-si2.svg https://s3-eu-west-1.amazonaws.com/prod-ucs-content-store-eu-west/content/pii:S2468823123007290/image/svg+xml/ad2c97eb5a4d82c0b70a54d0690d7bd9/si2.svg si2 si2.svg svg 14528 ALTIMG 1-s2.0-S2468823123007290-si3.svg https://s3-eu-west-1.amazonaws.com/prod-ucs-content-store-eu-west/content/pii:S2468823123007290/image/svg+xml/0c1c90f91ce0c8b868e4611722ba1ada/si3.svg si3 si3.svg svg 5517 ALTIMG 1-s2.0-S2468823123007290-si4.svg https://s3-eu-west-1.amazonaws.com/prod-ucs-content-store-eu-west/content/pii:S2468823123007290/image/svg+xml/8e7ba8c9214988ff2eb801d57be54e8c/si4.svg si4 si4.svg svg 5268 ALTIMG 1-s2.0-S2468823123007290-am.pdf https://s3-eu-west-1.amazonaws.com/prod-ucs-content-store-eu-west/content/egi:10CNXJXZXBP/MAIN/application/pdf/df68c072473567d416b5ef4736becaff/am.pdf am am.pdf pdf false 1711480 AAM-PDF MCAT 113646 113646 S2468-8231(23)00729-0 10.1016/j.mcat.2023.113646 Fig. 1 Top and side views of the most stable configurations of Cun clusters anchored on α-Al2O3(0001) surface. The sienna, red, and purple balls represent Cu, O and Al atoms, respectively. Fig 1 Fig. 2 The charge density difference of Cu5/α-Al2O3(0001) (a) and CO2/Cu5/α-Al2O3(0001) (b), The DOS before and after CO2 adsorption with Cu5/α-Al2O3(0001) (c). The yellow and cyan regions represent the positive (electron accumulation) and negative (electron depletion) values, respectively. The isosurface value is 0.004 e/Å3. Fig 2 Fig. 3 Top and side views of optimized structures of the adsorption of CO2 on Cun/α-Al2O3 (0001) surface. The sienna, red, gray and purple balls represent Cu, O, C and Al atoms, respectively. For clarity, the symbols Oa and Ob are used to distinguish two oxygen atoms of CO2 moiety. Fig 3 Fig. 4 Deviation of the average length of two CO bonds (a), OC-O angle from free CO2 (b), the value of average d -band center (c) as a function of charge of CO2 moiety on Cun/α-Al2O3 (0001) surfaces. Fig 4 Fig. 5 Potential reaction network for CO2 hydrogenation to methanol at the Cu5/α-Al2O3 (0001) interface. Fig 5 Fig. 6 Potential energy diagram for CH3OH synthesis from CO2 and H2 through the formate pathway on the Cu5/α-Al2O3 (0001) surface. Blue line shows a route for the OH adsorbed on two Cu atoms, black line shows a route for it adsorbed between Cu and Al atoms. Fig 6 Fig. 7 Potential energy diagram for CH3OH synthesis from CO2 and H2 through the RWGS + CO-hydrogenation pathway on the Cu5/α-Al2O3 (0001) surface. Fig 7 Fig. 8 Potential energy diagram for CH3OH synthesis from CO2 and H2 through the direct CO bond cleavage pathway on the Cu5/α-Al2O3 (0001) surface. Black line shows H2CO pathway, pink line shows HCOH pathway. Fig 8 Fig. 9 Degree of rate control (DRC) of methanol synthesis as a function of temperatures through (a) the formate pathway and (b) RGWS+CO-hydrogenation pathway (c) Direct CO bond cleavage pathway on the Cu5/α-Al2O3 (0001) surface with a mixture of CO2 and H2 feed gasses in a 1:3 ratio at 1 atm total pressure. Fig 9 Table 1 Calculated binding energy per Cu atom (E b), average Cu-O, Cu-Cu bond lengths, the Bader charge of Cun cluster, the work function change, Cun clusters supported on α-Al2O3(0001) surface with respect to the pristine α-Al2O3 surface, and the average of D-band center of the Cun/α-Al2O3(0001) catalyst. Table 1 Systems E b(eV) d Cu-O(Å) d Cu-Cu(Å) Bader charge(e) a Work function(eV) b d-band center (average) Cu1 2.84 2.085 — + 0.88 −0.95 −3.01 Cu2 1.70 2.114 2.332 + 0.37 −1.36 −1.99 Cu3 1.46 2.217 2.396 + 0.69 −1.88 −1.63 Cu4 1.12 2.116 2.445 + 0.45 −1.98 −1.53 Cu5 0.97 2.195 2.483 + 0.89 −2.02 −1.43 Cu6 0.96 2.038 2.431 + 1.44 −1.60 −1.56 Cu7 0.88 2.124 2.485 + 1.98 −1.92 −1.70 Cu8 0.79 2.098 2.470 + 1.52 −1.77 −1.96 Cu9 0.78 2.121 2.488 + 1.34 −1.96 −1.75 a The positive value denotes the loss of electrons for copper cluster after deposition. b The negative value means the decrease of surface work function with respect to the pristine surface. Table 2 Calculated adsorption energy (E ads) (in eV), the lengths of two CO bonds (in Å), the ∠OC-O bond angle (in degree), the lengths of CO2 adsorption bonds, Bader charge of CO2 moiety (QCO2 moiety ), C and O atoms in CO2 (QC, QO ) a for CO2 adsorption on pristine α-Al2O3 (0001) and Cun/α-Al2O3 (0001) surface. Table 2 Systems E ads dCOa dCOb ∠OC-O QCO2 moiety QC in CO2 QOa /QOb in CO2 Pristine surface 0.36 1.163 1.191 176.1 −0.01 +0.01 +0.02/−0.04 Cu1 1.00 1.219 1.247 144.7 −0.47 −0.41 +0.06/−0.12 Cu2 1.27 1.281 1.293 124.6 −0.85 −0.91 +0.14/−0.08 Cu3 1.20 1.243 1.291 128.7 −0.86 −0.65 −0.02/−0.19 Cu4 1.03 1.256 1.300 125.5 −0.93 −0.69 −0.04/−0.20 Cu5 1.43 1.276 1.324 119.8 −1.14 −0.83 −0.08/−0.23 Cu6 1.37 1.271 1.293 121.8 −0.95 −0.67 −0.07/−0.21 Cu7 1.33 1.263 1.294 124.1 −0.93 −0.75 −0.05/−0.20 Cu8 1.13 1.261 1.309 124.0 −1.03 −0.70 −0.08/−0.20 Cu9 1.37 1.260 1.294 125.8 −0.94 −0.71 −0.05/−0.18 a The positive and negative values denote the loss and obtaining of electrons after CO2 adsorption, respectively. Table 3 Calculated reaction energy (Er ) and the activation barrier (Ea ) of each elementary reaction steps involved in methanol synthesis on the Cu5/α-Al2O3 (0001) surface. Table 3 Step Elementary reaction Er (eV) Ea (eV) R1 CO2* + H* → HCOO* + * −0.57 0.76 R2 HCOO* + H* → H2COO* + * +0.49 1.28 R3 H2COO* + H* → H2CO* + OH*(Cu-Al) −0.65 0.94 R4 H2COO* + H* → H2CO* + OH*(Cu-Cu) +0.01 0.92 R5 H2CO* + H* + OH*(Cu-Al) → H3CO* + OH*(Cu-Al) + * −0.96 0.11 R6 H3CO* + *H + OH*(Cu-Al) → H3CO* + H2O*(Al) + * +0.58 0.70 R7 H3CO* + H* → H3COH*+ * +0.72 0.87 R8 H2CO* + H* + OH*(Cu-Cu) → H2CO* + H2O*(Cu) + * +0.58 1.51 R9 H2CO* + H* → H3CO* + * −0.19 0.37 R10 CO2* + H* → COOH* + * +0.04 1.21 R11 COOH* + H* → CO*+ H2O(g) + * +1.02 1.95 R12 CO* + H* → HCO* + * +0.12 0.51 R13 HCO* + H* → H2CO* + * −0.17 0.31 R14 CO2* + * → COa* + Ob* −0.06 0.81 R15 CO* + O* + H* → CO* + OH* + * −1.01 0.76 R16 CO* + OH* + H* → HCO* + OH* + * −0.66 0.64 R17 HCO* + OH* + H* → H2CO* + OH* + * −0.50 0.36 R18 H2CO* + OH* + H* → H3CO* + OH* + * −0.34 0.15 R19 H3CO* + OH* + H* → H3COH* + OH* + * +0.05 0.29 R20 HCO* + OH* + H* → HCOH* + OH* + * +0.39 1.52 R21 HCOH* + OH* + H* → H2COH* + OH* + * −0.80 0.22 R22 H2COH* + OH* + H* → H3COH* + OH* + * −0.28 0.44 R23 OH* + H3COH* + H* → H2O* + H3COH* + * +0.71 1.10 R24 H2CO* + OH* + H* → H2COH* + OH* + * +0.03 1.01 R25 CO* + OH* + H* → COH* + OH* + * +0.35 2.09 R26 CO2* + * → COb* + Oa* +1.77 2.43 Interfacial synergistic catalysis of Cun single-cluster catalysts anchored on α-Al2O3(0001) for promoting hydrogenation of CO2 to methanol Hegen Zhou Conceptualization Investigation Writing – original draft Formal analysis a b Jia Zhu Writing – review & editing Supervision Funding acquisition c ⁎ Hua Jin Investigation Formal analysis b Yanli Li Investigation Formal analysis a Bin Wang Conceptualization Investigation a Shuping Huang Writing – review & editing Funding acquisition a Wei Lin Conceptualization Resources a d Yi Li Methodology Funding acquisition a d Wenkai Chen Methodology Funding acquisition a d Yongfan Zhang Writing – review & editing Methodology Supervision Software Funding acquisition a d ⁎⁎ a State Key Laboratory of Photocatalysis on Energy and Environment, College of Chemistry, Fuzhou University, Fuzhou, Fujian 350116, China State Key Laboratory of Photocatalysis on Energy and Environment College of Chemistry Fuzhou University Fuzhou Fujian 350116 China aState Key Laboratory of Photocatalysis on Energy and Environment, College of Chemistry, Fuzhou University, Fuzhou, Fujian 350116, China b College of Chemical and Biological Engineering, Yichun University, Yichun, Jiangxi 336000, China College of Chemical and Biological Engineering Yichun University Yichun Jiangxi 336000 China bCollege of Chemical and Biological Engineering, Yichun University, Yichun, Jiangxi 336000, China c Key Lab of Fluorine and Silicon for Energy Materials and Chemistry of Ministry of Education, College of Chemistry and Chemical Engineering and Nanofiber Engineering Center of Jiangxi Province, Jiangxi Normal University, Nanchang 330022, China Key Lab of Fluorine and Silicon for Energy Materials and Chemistry of Ministry of Education College of Chemistry and Chemical Engineering and Nanofiber Engineering Center of Jiangxi Province Jiangxi Normal University Nanchang 330022 China cKey Lab of Fluorine and Silicon for Energy Materials and Chemistry of Ministry of Education, College of Chemistry and Chemical Engineering and Nanofiber Engineering Center of Jiangxi Province, Jiangxi Normal University, Nanchang 330022, China d Fujian Provincial Key Laboratory of Theoretical and Computational Chemistry, Xiamen, Fujian 361005, China Fujian Provincial Key Laboratory of Theoretical and Computational Chemistry Xiamen Fujian 361005 China dFujian Provincial Key Laboratory of Theoretical and Computational Chemistry, Xiamen, Fujian 361005, China ⁎ Corresponding author at: Key Lab of Fluorine and Silicon for Energy Materials and Chemistry of Ministry of Education, College of Chemistry and Chemical Engineering and Nanofiber Engineering Center of Jiangxi Province, Jiangxi Normal University, Nanchang 330022, China. Key Lab of Fluorine and Silicon for Energy Materials and Chemistry of Ministry of Education College of Chemistry and Chemical Engineering and Nanofiber Engineering Center of Jiangxi Province Jiangxi Normal University Nanchang 330022 China. ⁎⁎ Corresponding author at: State Key Laboratory of Photocatalysis on Energy and Environment, College of Chemistry, Fuzhou University, Fuzhou, Fujian 350116, China. State Key Laboratory of Photocatalysis on Energy and Environment College of Chemistry Fuzhou University Fuzhou Fujian 350116 China The size-selected copper single-cluster catalysts(SCCs) play a crucial role in catalyzing of CO2 hydrogenation. However, nature of size effect and hydrogenation mechanism is still unclear. Here, Density functional theory(DFT) calculations were performed to investigate activation and reaction mechanism of CO2 hydrogenation to methanol over copper single-clusters catalyst anchored on α-Al2O3(0001). Our results show that Cun(n = 1–9)/Al2O3 catalysts significantly promote activation of CO2 in a bent configuration due to the synergistic interaction associated with Cun-Al2O3(0001) interfacial site. Bader charge analysis suggested electron transfer occurring from Cun-Al2O3(0001) interface to CO2, leading to negatively charged CO2. We find descriptors of deviation of CO2 bonds length and bonds angle, d -band center of Cun(n = 1–9) cluster that can well descript for determining activation degree of CO2. Especially, the Cu5/α-Al2O3(0001) has the best activity for CO2 hydrogenation among them. Furthermore, reaction mechanism of CO2 hydrogenation at Cu5/Al2O3 interface have been explored. Methanol synthesis takes formate route and direct CO bond cleavage route competitive with rate-dominant step of HCOO* and HO* hydrogenation, respectively. While CO-hydrogenation produced by RWGS route is not feasible because of high activation barrier of formed CO intermediate(1.95 eV). This study will provide insight into designing and application of ultrahigh-performance Cu-based single-cluster catalysts for CO2 hydrogenation. Graphical abstract Image, graphical abstract Keywords Synergistic catalysis Cu single-cluster catalyst Supported α-Al2O3(0001) Interfacial site CO2 hydrogenation Data availability Data will be made available on request. Introduction With the increasing of CO2 emission caused by burning of fossil fuels, environment change and energy crisis worldwide have become gradually serious facing us today [1,2]. Recently, strategies to capture and recycling utilize of CO2 into chemicals and fuels have received enormous attention [3–8]. CO2 reduction to formic acid [9,10], methane [11,12] and methanol [13,14] are important and attractive solution for CO2 conversion. Among them, the hydrogenation of CO2 into methanol is a crucial sustainable technology which is even considered as a great substitute fuel for gasoline and key chemical intermediates for industrial processes [15–19]. However, exploring highly active catalysts with efficient transformation of CO2 into methanol is still a major challenge because of the difficulties with the chemical inertness of CO2 [20–22]. Since 1960s, the chemical processes of CO2 hydrogenation to methanol have been performed by Cu/ZnO/Al2O3 catalysts at high pressures (50 − 100 atm) and temperatures (450 − 600 ℃) [23–25]. Recently, developing effective low-pressure catalysts to modification and improvement of the activity performance for methanol synthesis from CO2 has become the focus of the interest [26–28]. Rui et al. [29] reported that noble metal Pd nanoparticles dispersed on In2O3 was beneficial for dissociation of hydrogen and hydrogenation of CO2, providing a super-performance of high CO2 conversion (>20 %) and methanol selectivity (>70 %). Zeng et al. [30] presented neighboring Pt monomers dispersed on MoS2 greatly improved the catalytic activity of CO2 hydrogenation to methanol without the formation of formic acid due to the synergy between neighboring Pt monomers. Moreover, extensive researches have been focused on the non-noble Cu-based catalysts. Meunier et al. [31] reported that Cu/ZrO2 as a potential catalyst for CO2 hydrogenation to methanol. Copper surface play a crucial role which can not only effectively activate H2, but also further bears main reaction intermediates. Graciani et al. [25] demonstrated Cu/CeO2 catalysts is highly efficient for CO2 reduction to methanol, which attributed catalytic activity to the synergistic interaction at the copper-ceria interface. Chen et al. [32] obtained metallic (Cu/ZnO/Al2O3) catalysts by a facile alcohol solvent assisted method. The catalyst exhibit a much higher methanol yield than other catalysts synthesized by conventional method. Mao et al. [33] prepared a Cu-ZnO/Cu@Si catalyst which was significantly promoted CO2 hydrogenation to methanol, due to the synergistic effects between Cu-O-Si structure and Cu-ZnO interface. Despite enormous studies and development, the active site and the reaction mechanism in catalytic process are still unclear. The activity and selectivity of catalyst for CO2 conversion to methanol are still less than satisfactory. Recently, single-atom catalysts (SAC) and single-cluster catalysts (SCC), as forefronts of heterogeneous catalysts, have attracted increasing attention due to their unique physical and chemical properties and excellent catalytic efficiency [34–36]. A number of experimental and theoretical studies have proved that small-sized metal cluster catalysts appear to exhibit excellent catalytic activity for complex reactions, which are significantly different from those of the conventional bulk metal surface and supported nanoparticle catalyst [37–40]. What's more, the catalytic performances are also closely related to the size of supported single-cluster [41]. Fu et al. [42] introduced different size of Pt nanoparticles and Pt single atoms onto CeO2 via a laser ablation method, which revealed that synergistic effect of nano-single-atom catalyst greatly improved catalytic activity. The Pt10 was regarded as the major active center while Pt1 decreased the energy barrier for CO oxidation by lattice oxygen and leaded to an overall performance improvement. Liu et al. [43] reported that Cu cluster on amorphous Al2O3 catalysts exhibit unexpected high CO2 conversion and selectivity to CH3OH at low pressure. However, determined active site of catalyst and understanding the promotion of different size effect remain controversial, and the reaction mechanism in the catalytic process is still unclear. Herein, in this paper, we systematically investigate a series of Cun(n = 1 − 9) clusters supported on α-Al2O3(0001) surface as model catalysts for CO2 hydrogenation to methanol and focus on the size effect on CO2 activation and reaction mechanism based on the van der Waals-corrected density functional theory (DFT-D3) calculations. Our result provide an understanding for the design and development of high-efficiency Cu-based single-cluster catalysts for CO2 hydrogenation. Computational details All the spin-polarized DFT calculations were performed by the Vienna ab-initio Simulation Package [44,45]. The projector-augmented plane wave (PAW) [46] was set to describe electron-ion interactions, and the generalized gradient approximation(GGA) with the Perdew-Burke- Ernzerhof(PBE) exchange-correlation functional was employed [47]. A 450 eV plane-wave cutoff energy was used. A 3 × 3 × 1 Γ-centered k-points was used for structural relaxation and electronic property calculations. A vacuum space of 15 Å was set to avoid interactions between the adjacent slabs. The energy convergence was set to 1 × 10−5 eV. The force convergence was set to 0.03 eV/Å. The effects of van der Waals forces were considered by vdw-DF3 method [48]. The dipole correction was included for slab model. The structures of α-Al2O3(0001) surface with Al-terminated was modeled by a nine-layer slab in which the bottom three layers were fixed and the top six layers were relaxed, which is consistent with previous works [49–51]. A (2 × 2) supercell (consisting of 24 Al and 36 O atoms) and a (3 × 3) supercell of α-Al2O3(0001) surface (consisting of 54 Al and 81 O atoms) were adopted for the supported small Cun (n = 1 – 5) and large Cun (n = 6 – 9) clusters, respectively. Because there are many possible structures of the copper clusters anchored on the α-Al2O3(0001) surface, an ab initio molecular dynamics (AIMD) simulation using the Nosé algorithm [52] was used to screen possible structures of Cun/α-Al2O3(0001). 10 ps simulation with a time step of 1 fs at temperature of 600 K and 300 eV low cutoff energy was used. Typical structures were further screened from the results of AIMD simulations. Finally further structural optimizations using above accurate settings were used to examine the most stable structure of Cun/Al2O3(0001). This approach was verified in our previous work such as Ann/MoS2 and Au/TiOx/Mo(112) [40,53]. The transition states (TS) were searched by the climbing-image nudged elastic band method with 8 images and further verified by a single imaginary frequency [54,55]. The microkinetic simulations were conducted to investigate the rate-limiting step with the evaluating of degree of rate control (DRC) proposed by Campbell [56,57]. The binding energy per Cu atom(E b) for Cun cluster supported on the α-Al2O3(0001) surface was calculated by following equation, E b = [ E ( α − A l 2 O 3 ) + E ( C u n ) − E ( C u n / α − A l 2 O 3 ) ] / n Where E(Cun/α-Al2O3), E(Cun), and E(α-Al2O3) refer to the total energies of Cun/α-Al2O3(0001) system, Cun cluster in gas phase and pristine α-Al2O3(0001) surface, respectively. For the chemisorption of CO2 molecule on the Cun/α-Al2O3(0001) surface, the adsorption energy (E ads) was defined as, E ads = [ E ( C u n / α − A l 2 O 3 ) + E ( C O 2 ) − E ( C O 2 / C u n / α − A l 2 O 3 ) ] Where E(CO2/Cun/α-Al2O3), E(Cun/α-Al2O3), and E(CO2) denote the total energies of CO2 adsorbed on Cun/α-Al2O3(0001), the pristine Cun/α-Al2O3(0001), and free CO2 molecule in the gas phase, respectively. The activation barrier (E a) of elementary reaction step for the CO2 synthesis to methanol is defined as E a = E ( TS ) − E ( IS ) Where E(TS) and E(IS) refer to the total energies of transition state and initial structure, respectively. The associated reaction energy (E r) of each step is defined as E r = E ( FS ) − E ( IS ) Where E(FS) and E(IS) refer to the total energies of final structure and initial structure, respectively. Results and discussion Structures and stability of Cun/α-Al2O3 (0001) surfaces Before considering the case of deposition of copper clusters, we first discuss the configurations of Cun clusters in gas phase. The structures of Cun clusters with different sizes in gas phase have been studied using DFT calculations combined with the random search algorithm in previous studies [58–60]. Here the structure and the stability of Cun clusters (placed in a 20 × 20 × 20 cubic box) are reexamined at PBE level with plane-wave basis set (Fig. S1 and Table S1). The results show that the ground state structures of Cun clusters (n = 3–6) are all planar with triangle, rhombus, half-hexagon and triangular, respectively. While different from the hexamer, the most stable configuration of Cu7, Cu8 and Cu9 exhibit a three-dimensional structure with symmetry of D5h, C2v and Cs, respectively. The cohesive energy of Cun that is defined as E c = [E(Cun) − n × E(Cu)]/n was calculated to evaluate the stability of cluster. As shown in Table S1, it can be found that the cohesive energy gradually increased from 1.13 to 2.20 eV with the number of the Cu atoms, indicating the Cu-Cu bonds of the Cun clusters become stronger. Moreover, average Cu-Cu bond length also presents an increasing trend from 2.336 to 2.436 Å as number of the Cu atoms varies from 2 to 9. The above results are consistent with those obtained in previous study [59]. Although several studies have explored metal clusters supported on Al2O3, only a few researches focused on different size of Cun clusters anchored on the α-Al2O3 (0001) surface. Different Cun clusters anchored on α-Al2O3 (0001) surface are screened based on the AIMD simulations. The most stable configurations of Cun(n = 1–9)/α-Al2O3 (0001) are provided in Fig. 1 . Some structural parameters and the binding energy per Cu atom (E b) are shown in Table 1 . As shown in Fig. 1, our results show that most of Cu clusters are anchored on the substrate via Cu-O and Cu-Al bonds. Taking the stability of Cun/α-Al2O3 (0001) into consideration, binding energy is applied to evaluate thermodynamically stability of each system. It can be found that all the binding energies of Cun/α-Al2O3 (0001) are positive, indicated that the deposition of copper clusters are exothermic process for all systems due to the presence of strong metal-support interaction (SMSI) (Table 1). For Cu1 (Fig. 1a), a single Cu atom prefers to be adsorbed at the center of three surface O atoms to form a tetrahedron structure with E b = 2.84 eV, which is larger than the Pd atom on α-Al2O3 (0001) surface (1.49 eV) [61]. All bond lengths of Cu-O were 2.085 Å. For Cu2, one Cu atom still favors to bond to three surface O atoms with average Cu-O bond length of 2.114 Å (Fig. 1b). In addition, one Cu-Al bond with a length of 2.494 Å is formed, and the Cu-Cu bond length slightly increases to 2.332 Å. The binding energy of copper dimer is calculated to be 1.70 eV. As shown in Fig. 1c, the Cu3 cluster can be anchored on the Al2O3 (0001) by the formations of Cu-O and Cu-Al bonds. The average Cu-Cu bond length is obvious increased to 2.396 Å. On the contrary, after depositions on the Al2O3 (0001), the original planar configurations of Cun clusters with n = 4 − 6 are destroyed. Now Cu4 is anchored by a tetrahedral structure with five Cu-O bonds (2.116 Å) at the interface (Fig. 1d). The average Cu-Cu bonds distance is 2.445 Å and the binding energy per Cu atom is 1.12 eV. While for Cu5 cluster, it shows a trigonal bipyramid arrangement with four Cu-O and one Cu-Al bond. The average Cu-Cu bond length slightly enlarges to 2.195 Å and the binding energy is 0.97 eV. In the case of Cu6, it places on the surface via the formation of five Cu-O bonds with an average length of 2.038 Å (Fig. 1f). For those Cun clusters with large sizes (namely, n = 7 − 9), although the Cun clusters remain the original 3D stacking structure, depositions on Al2O3 substrate lead to obvious changes of their configurations compared with that in gas phase. For Cu7, six Cu-O bonds with an average bond length of 2.124 Å are observed at interface (Fig. 1g). The Cu8 cluster is supported on Al2O3 substrate by five Cu-O bonds (2.098 Å) and one Cu-Al bond (2.527 Å) (Fig. 1h). For comparison, there are five Cu-O bonds and three Cu-Al bonds at the interface between Cu9 cluster and the substrate (Fig. 1i). The E b values of Cu7, Cu8 and Cu9 clusters are predicted to be 0.88, 0.79 and 0.78 eV, respectively. To investigate the effect of deposition of Cun clusters with different size on the electronic structure, the variations of the Bader charge, d -band center and surface work function of Cun/α-Al2O3 (0001) system were determined as shown in Table 1. The total charges of all Cun clusters supported on the Al2O3(0001) are positive, indicating the electron transfer occurring from copper cluster to the substrate. Moreover, the charge transfer of Cu5/Al2O3(0001) can also be verified by the result of the charge density difference (CDD) as shown in Fig. 2 a. It is can be seen that the lost electrons of Cu5 cluster transfer to the interface near the Al2O3(0001) surface. Interestingly, the value of average d-band center of Cu5/α-Al2O3(0001) is −1.43 eV, which is the highest among Cun(n = 1–9)/α-Al2O3(0001) systems considered in here (−3.01 eV – −1.53 eV). The d -band center of supported Cu5 cluster shifts closer to the Fermi level, result in stronger activation ability to CO2. Therefore, the position of d -band center implies that binding of Cu5 cluster will facilitate the activation of CO2 molecule at the interface, due to the strong metal-support interaction (SMSI) between Cu5 cluster and the substrate. Furthermore, the change of surface work function with respect to the pristine Al2O3(0001) surface was calculated to further understand the effect of supported Cun cluster on the activation of CO2 as displayed in Table 1. Work function is decreased with different degrees in all cases due to the transfer of electrons from copper cluster to Al2O3(0001) surface. Notably, the most obvious reduction of work function (−2.02 eV) is predicted for Cu5-supported surface, suggested that the Cu5/Al2O3(0001) has the strongest ability to donate electrons and is most favorable for CO2 activation. CO2 adsorption on the interfacial site of the Cun/α-Al2O3(0001) surfaces The adsorption activiation of CO2 molecules on the Cun(n = 1–9)/α-Al2O3 (0001) surface was further investigated. The most stable configurations of CO2 adsorption on the Cun(n = 1–9)/α-Al2O3(0001) are shown in Fig. 3 . The adsorption energy as well as some structural parameters are presented in Table 2 . On the pristine α-Al2O3(0001) surface, the CO2 molecule weakly binds to one surface Al atom with a small adsorption energy of E ads = 0.36 eV (see Table 2), and CO2 still maintains a linear structure (not shown). While bent CO2 molecules were adsorbed on the surface with the deposition of Cun clusters at interfacial site between Cun cluster and Al2O3(0001) surface, resulting from synergistic catalysis associated with Cun-Al2O3 interface (Fig. 3). As the number of Cu atom in the cluster increases from n = 1 to 9, the calculated E ads are 1.00, 1.27, 1.20, 1.03, 1.43, 1.37, 1.33, 1.13 and 1.37 eV, respectively (Table 2). And corresponding CO bond lengths of adsorbed CO2 have been enlarged in varying degree (1.219 Å–1.281 Å). These divergence in E ads and CO bond lengths indicates that the degree of CO2 activation is sensitive to the size of Cun cluster anchored on α-Al2O3(0001) surface. To understand the effect of size and interface of the Cun/α-Al2O3 (0001) on CO2 activation, Bader charge of CO2 adsorption on the Cun/α-Al2O3(0001) is analysis as listed in Table 2. It can be seen that the net charge of CO2 molecule at the interface of Cun(n = 1–9)/α-Al2O3 (0001) is −0.47, −0.85, −0.86, −0.93, −1.14, −0.95, −0.93, −1.03 and −0.94 e, respectively. These results indicated the electron transfer from the Cun(n = 1–9)/α-Al2O3 (0001) substrate to the adsorbed CO2 molecule, leading to the negatively charged CO2. Furthermore, we investigated the possible descripts for determining the activation degree of CO2. From Fig. 4 a-b, we can clearly see that the deviation of CO bond lengths and ∠OC-O bond angles is closely related to the charge of CO2 moiety. The larger the deviation of CO bond length and ∠OC-O bond angle, the larger the magnitutes of charge of CO2 moiety, the better the CO2 activation. We also investigated the relationship between the average d -band center and charge of CO2 moiety. As shown in Fig. 4c, εd of Cun clusters exhibit linear relationships with the charge of CO2 moiety. The larger the εd, the larger charge of CO2 moiety, the better activate CO2 to promote hydrogenation. Hence, we can find that the deviation of CO bond lengths, OC-O bond angles from free CO2, and the average d-band center of Cun cluster can well descript for determining the activation degree of CO2. It is noted that, among the Cun(n = 1–9)/α-Al2O3 (0001), the largest value of E ads (1.43 eV) is obtained for the Cu5/α-Al2O3 surface (COa = 1.276 Å, COb = 1.324 Å, CCu = 1.938 Å, Oa-Cu = 2.050 Å, Ob-Al = 1.276 Å, ∠OC-O = 119.8⁰). And the activated CO2 on the Cu5/α-Al2O3 surface possess the longest bond length of CO bond (1.276 Å, 1.324 Å) and smallest bond angle of ∠OC-O (119.8⁰), which can be seen as CO2 − anion. All mentioned above indicates that the adsorbed CO2 on the Cu5/α-Al2O3 (0001) is more stable and is beneficial for the subsequent hydrogenation step (Fig. 3e, Tables 2, S2). The results were consistent with above analysis of the Cu5/α-Al2O3 (0001) (Table 1, Fig. 2a). To understand the nature of the activation for CO2 adsorption on the Cu5/Al2O3, electronic properties analysis, including the projected densities of states (pDOS), Bader charge and charge density difference (CDD) were further performed. DOS of CO2 molecule in gas phase, Cu-3d orbital, Al-3p orbital before and after CO2 adsorption on Cu5/Al2O3 were presented in Fig. 2c. As shown in Fig. 2c, there are Cu-3d and Al-3p orbital occurring near the Fermi level for Cu5/Al2O3. After being adsorption of CO2, the Cu-3d orbital of the supported Cu5 cluster was overlapped with the CO2 molecule. The Cu-3d orbital became delocalization, and then shifted to higher energy level. And 2πu orbital of CO2 shifted to lower energy level from near 8.0 eV to around 2.5 eV, indicating formation of d-πu interaction. Besides, partial delocalization of Al-3p orbital components and somewhat overlapped with CO2 orbital are also been observed. Overall, such synergistic interactions among the CO2 and the Cu5/Al2O3 effectively activated the CO2, which have a deep impact on further hydrogenation process. Further analysis of Bader charge shows that, among them all the Cun(n = 1–9)/α-Al2O3 (0001), adsorbed CO2 obtained the most electron from Cu5/Al2O3 (0001) (−1.14 e), result in the best CO2 activation on the Cu5/Al2O3 (0001) to CO2 δ− species (Table 2). Particularly, the obtained electrons of CO2 are significantly more than the lost electrons of supported Cu cluster, suggested that CO2 molecule was not only obtained electron from Cu cluster but also some transfer from Al2O3 due to the synergistic effect between Cu cluster and Al2O3. Additionally, the C atom in CO2 bonded with Cu atom obtained more electrons than that of O atoms in CO2, indicated that H atom will perfect to migrate to the activated C atom in CO2 for the information of HCOO*. Further charge density difference (CDD) of CO2/Cu5/Al2O3 (Fig. 2b) demonstrated that the obtained electrons of CO2 transfer from surface Al atom and Cu atoms of Cu5 cluster simultaneously, especially C atom obtained more electron. This was consistent with above Bader charge analysis (Table 2). CO2 synthesis to methanol on the interfacial site of the Cu5/α-Al2O3 (0001) The above-mentioned analysis presented that the synergistic catalytic between the Cu5 cluster and α-Al2O3 plays an important role for the enhanced activity of CO2. Next studies mainly focus on the reaction pathways of CO2 synthesis to methanol on the interfacial site of the Cu5/α-Al2O3 (0001). The potential reaction network for CO2 hydrogenation to methanol at the Cu5/α-Al2O3 (0001) interface is summarized in Fig. 5 . This network includes the formate route, the reverse water-gas shift (RWGS) route and the direct CO bond cleavage route. Formate route firstly form HCOO* intermediate, then through a series of hydrogenation processes to form CH3OH. The RWGS route is initialized by formation of COOH*, next through RWGS process to generate CO*, then undergoes hydrogenation to CH3OH. While for the direct CO bond cleavage route, CO* intermediate is generated through the direct cleavage of CO bond of CO2, then further hydrogenation to produce CH3OH. All the reaction energies and activation barriers of the elementary reaction steps for these three pathways are summarized in Table 3 . Corresponding structures of intermediates and transition states are given in Fig. S2. Formate pathway The formate pathway of CO2 hydrogenation to CH3OH on Cu5/α-Al2O3 (0001) is shown in Fig. 6 , and corresponding structures are displayed in Fig. S2. The reaction starts with the adsorption of CO2 and H2 on the interfacial sites of the Cu5/α-Al2O3 (0001) surface. The dissociative adsorption energy of adsorbed H2 is −1.18 eV, indicated that Cu5/α-Al2O3 (0001) surface can easily activate H2 to form H adatoms (Fig. S3). Then the C atom of activated CO2* with bent structure is attacked by the dissociated H atom to form HCOO* though reaction R1 (CO2* + H* → HCOO* + *), which is in line with above analysis of electronic structure (Table 2, Fig. 2b). This process is thermodynamically easy to occur with the reaction energy (Er ) of −0.57 eV and a low activation energy (Ea ) of 0.76 eV. Continued hydrogenation of HCOO* to H2COO* requires to undergo a high activation energy of 1.28 eV, which is endothermic with Er of +0.49 eV. It can be observed that the formation of H2COO* lead to CO bond length of CO2 elongation from 1.264 to 1.452 Å, indicating the weakening of CO bond. Thus, the third H tends to attack O atom of H2COO*, results in weakened CO bond break, then generates H2CO* and OH* which just need to overcome a small activation energy. In this reaction step, two possible structures of adsorbed OH* are found. One structure is the adsorbed OH* bonds with Cu atom and Al atom at the Cu5/α-Al2O3 (0001) interface simultaneously (R3: H2COO* + H* → H2CO* + OH*(Cu-Al)). The other one is the adsorbed OH* group bonds with two Cu atoms on the copper cluster (R4: H2COO* + H* → H2CO* + OH*(Cu-Cu)). It must be mentioned that, although these two possible steps have almost the same activation barrier, the reaction energy of R3 is lower 0.66 eV than that in R4, indicating OH* at the Cu5/α-Al2O3 (0001) interface more energetically stable. Next reaction pathway branches into two different routes, which is labelled by black line and blue line in Fig. 6, respectively. For the case of OH*(Cu-Al) and H2CO* at the interface, H2CO* is preferentially hydrogenated to H3CO* which is bonded with surface Al atom (labelled as mono-H3CO*) with low Ea of 0.11 eV and Er of −0.96 eV, followed OH*(Cu-Al) hydrogenated to form H2O* with Ea of 0.70 eV (black line). While for OH*(Cu-cu) and H2CO* on the supported Cu5 cluster, OH*(Cu-cu) firstly hydrogenates to form H2O with Ea of 1.51 eV, implying kinetically difficult for OH*(Cu-cu) hydrogenation (R8). Next H2CO* hydrogenate to produce H3CO* (R9) followed by the desorption of formed H2O with an activation energy of 0.37 eV (blue line). Compared with above two branch paths, the route with OH*(Cu-Al) and H2CO* at the interface is more like to occur due to lower energy barrier and energetically more favorable. To convenient for the later hydrogenation process, mono-H3CO* rotates to adsorb with surface Al atom and Cu atom simultaneously at the interface (labelled as bi-H3CO*) without energy barrier. Afterward, final hydrogenation of bi-H3CO* to produced methanol (R7: H3CO* + H* → H3COH*+ *) overcome an Ea of 0.87 eV with a reaction energy of +0.72 eV. In summary, hydrogenation of HCOO* to produce H2COO* is the rate-limiting step with activation energy of 1.28 eV, which is much lower than that of Cu(111) surface (1.60 eV) and Cu29 nanoparticle (1.41 eV) [62], indicated that the Cu5/Al2O3 catalyst exhibit excellent catalytic activity with respect to the conventional metal bulk surface and supported large nanoparticle. The H2COO* species adsorbed at the Cu5/Al2O3 interface by formation of 2 Cu-O bonds and 1 Al-O bond has high stability, due to the synergistic catalysis associated with interfacial site between Cu cluster and α-Al2O3(0001) surface. This was consistent with previous work for CO2 conversion on Pt4/In2O3 model [18]. Additionally, to further identify the rate-controlling step, DRC analysis was performed for microkinetic simulation with feed gasses mixture of CO2 and H2 in a 1:3 ratio under 1 atm pressure in 400−650 K as displayed in Fig. 9a. The hydrogenation of HCOO* is the rate-controlling step at the temperature over 550 K. While the generation of H3CO* becomes the key step to affect the rate of methanol synthesis at the temperature ranging from 500 to 540 K. At lower temperature (T< 490 K) the process of CH3OH* desorption become the rate-controlling step. RWGS + CO-hydrogenation pathway The RWGS+CO-hydrogenation pathway for methanol synthesis is also investigated (Figs. 7 , S3). The H atom firstly attack the O atom of activated CO2* into COOH* (R10) with higher energy barrier of 1.21 eV than that of formed *HCOO in formate pathway (0.76 eV). Then corresponding bond length of CO bond elongated from 1.292 Å to 1.374 Å, indicating weakening of the CO bond of CO2*. Then the weakening CO bond is broken, dissociated to CO* and H2O(g), with Ea of 1.95 eV and endothermic Er of +1.02 eV. Results reveal that it is difficult for the dissociation processes both in kinetics and thermodynamics views. Subsequently, dissociated CO* is hydrogenated to HCO* with a low Ea of 0.51 eV (R12). HCO* continuously hydrogenated to form H2CO* (R13: HCO* + H* → H2CO* + *, Er = −0.17 eV, Ea = 0.31 eV). Notably, now the structure of H2CO* intermediate was found the same as that in formate pathway. Hence, the following steps are all consistent with those in formate pathway (Fig. 6). The reaction intermediates for the whole catalytic process is in sequence of COOH*, CO*, HCO*, H2CO* and H3CO*, with binding energies of −3.84, −2.48, −3.93, −3.12 and −3.05/−4.20 eV, respectively. In summary, for the RWGS + CO-hydrogenation pathway the rate-limiting step is the hydrogenation of COOH* to CO*, which is endothermic and need to overcome much high energy barrier (1.95 eV), indicating the RWGS + CO-hydrogenation pathway is unlikely to happen. Further results of DRC analysis (Fig. 9b) shows that the desorption of CH3OH* is the rate-determining step at lower temperature (T< 450 K). When the temperature is above 470 K, the hydrogenation of COOH* to form CO* and H2O becomes the absolutely dominant step to affect the rate of methanol synthesis. Direct CO bond cleavage pathway In addition, direct CO bond cleavage pathway is also studied as shown in Figs. 8 and S3. In comparison, CO2* is more prone to cleave COb bond, which not only has a lower energy barrier of 0.81 eV than that of COa bond cleavage (2.43 eV), but also thermodynamically more likely to occur, probably due to the larger COb bond length (1.324 Å) than that of COa bond (1.276 Å). Then, the dissociated Ob* is hydrogenated to form OH* with low energy barrier of 0.76 eV and reaction energy of −1.01 eV. Followed hydrogenated of COa* to HCOa* has a low Ea of 0.64 eV (R16). In comparison, sequentially hydrogenation of HCOa* is more prone to form H2CO* which has lower energy barrier of 0.36 eV than that of formed HCOH* (1.52 eV). Subsequently, H2CO* is hydrogenated to form H3CO* which interact with Al2O3 by one Oa-Al bond (labelled as mono-H3CO*) (R18, Ea = 0.15 eV). To convenient for later hydrogenation process, mono-H3CO* rotates to bond with one surface Al atom and one Cu atom at the interface simultaneously (labelled as bi-H3CO*) without an energy barrier. Bi-H3CO* species is continuously hydrogenated to form methanol, and the adsorbed OH* species is hydrogenated to H2O* with an energy barrier of 1.10 eV (T23). Finally, formed H2O* and H3COH* is desorbed to the product CH3OH. In summary, for the direct CO bond cleavage pathway, the hydrogenation of OH* to form H2O* is the rate-limiting step with activation energy of 1.10 eV. The intermediates of whole catalytic process accord to the order of CO*, HCO*, H2CO*, H3CO* and H3COH*. Further DRC analysis displayed in Fig. 9 c show that the cleavage of CO2* is the rate-determining step at lower temperature, while the hydrogenation of OH* to produce H2O* control the rate of methanol synthesis at higher temperature. According to all of mentioned-above analysis, it can be concluded that the formate pathway and the direct CO bond cleavage pathway are competitive. While the RWGS + CO-hydrogenation pathway is impossible due to the high activation barrier. For the formate pathway, the hydrogenation of HCOO* to form H2COO* is the rate-limiting step with the Ea of 1.28 eV. The reactive intermediates for CO2 conversion to CH3OH accord to the order of HCOO*, H2COO*, H2CO* and H3CO*. Further DRC confirmed this step is the rate-dominant step when temperature is above 550 K. While for the direct CO bond cleavage pathway, reactive intermediates are in sequence of CO*, HCO*, H2CO* and H3CO*. The process of hydrogenation of OH* to H2O* has the highest activation barrier. Further DRC analysis suggests that this process is the rate-limiting step for CO2 synthesis at higher temperature. Conclusion Efficient converting CO2 into methanol has triggered enormous research due to mitigation of greenhouse effect and reducing of fossil fuels. While exploring highly active catalysts with efficient transformation of CO2 into methanol is a major challenge due to the difficulties with the chemical inertness of CO2. Single-atom catalysts (SAC) and single-cluster catalysts (SCC) in heterogeneous catalysts have attracted increasing attention due to its unique physical and chemical properties, and excellent catalytic performance. However, determined the active site of catalyst and understanding the promotional of different size effect are controversial, and reaction mechanism in the catalytic process is still unclear. In the present work, density functional theory calculations have been performed to study the size effects of sub-nanometer copper clusters anchored on α-Al2O3 (0001) system for CO2 activation and reaction mechanism of CO2 hydrogenation to methanol. Our results show that CO2 was activated at interfaces between Cun(n = 1–9) cluster and α-Al2O3(0001) surface in a bent configuration, indicating synergistic catalysis associated with Cun -Al2O3 interfacial site. The introducing of Cun clusters anchored on α-Al2O3 (0001) surface can greatly improve the thermodynamic stability of CO2 chemisorption. Analysis of Bader charge show that there are charge transfer occurring from Cun/Al2O3 (0001) to CO2, leading to the negatively charged CO2 δ− moiety. The deviation of CO bonds length, ∠OC-O angle from free CO2, and average d -band center of supported Cu cluster could be excellent descripts for determining the activation degree of CO2. Especially, among all size of Cun cluster, Cu5/α-Al2O3(0001) system exhibit significantly higher activity for CO2 hydrogenation. The formats route, the CO bond cleavage route and the reverse water gas shift (RWGS)+CO-hydrogenation route of CO2 conversion at Cu5-Al2O3 interface was further examined. It is confirmed that the formate and the direct CO bond cleavage route are competitive, in which hydrogenation of HCOO* and HO* at the Cu5-Al2O3 interface is the rate-dominant step with an Ea of 1.28 eV and 1.10 eV, respectively. While the RWGS + CO-hydrogenation route is not feasible because of the high Ea of the hydrogenation of CO intermediate (1.95 eV). Therefore, controlling size and dispersion of copper cluster with optimized metal/oxide interface has great potential in designing excellent Cu-based catalysts for CO2 conversion to methanol. However, more works are also required to investigate the effects of larger size of supported Cun cluster (n ≥ 10) for the CO2 conversion. CRediT authorship contribution statement Hegen Zhou: Conceptualization, Investigation, Writing – original draft, Formal analysis. Jia Zhu: Writing – review & editing, Supervision, Funding acquisition. Hua Jin: Investigation, Formal analysis. Yanli Li: Investigation, Formal analysis. Bin Wang: Conceptualization, Investigation. Shuping Huang: Writing – review & editing, Funding acquisition. Wei Lin: Conceptualization, Resources. Yi Li: Methodology, Funding acquisition. Wenkai Chen: Methodology, Funding acquisition. Yongfan Zhang: Writing – review & editing, Methodology, Supervision, Software, Funding acquisition. Declaration of Competing Interest The authors declare that they have no known competing financial interests or personal relationships that could have appeared to influence the work reported in this paper. Acknowledgments This work was supported by National Natural Science Foundation of China (Grant Nos. 21773030, 21973014, 21863004, 21703036, and 21373048), the Natural Science Foundation of Fujian Province (No. 2022J01066), the Natural Science Foundation of Jiangxi Province (No. 20192BAB206035), the numerical calculations in this paper have been done on the supercomputing system in the Supercomputing Center of Fujian of China. Supplementary materials Supplementary material associated with this article can be found, in the online version, at doi:10.1016/j.mcat.2023.113646. Appendix Supplementary materials Image, application 1 References [1] X.Z. Lim How to make the most of carbon dioxide Nature 526 2015 628 630 10.1038/526628a X.Z. Lim, How to make the most of carbon dioxide, Nature 526(2015) 628–630, 10.1038/526628a. [2] J. Hansen M. Sato P. Kharecha G. Russell D.W. Lea M. Siddall Climate change and trace gases Philos. T. R. Soc. A 365 2007 1925 1954 10.1098/rsta.2007.2052 J. Hansen, M. Sato, P. Kharecha, G. Russell, D.W. Lea, M. Siddall, Climate change and trace gases, Philos. T. R. Soc. A 365(2007) 1925–1954, 10.1098/rsta.2007.2052. [3] Y. Zhou F. Liu S. Geng M. Yao J. Ma J. Cao Tuning the content of S vacancies in MoS2 by Cu doping for enhancing catalytic hydrogenation of CO2 to methanol Mol. Catal. 547 2023 113288 10.1016/j.mcat.2023.113288 Y. Zhou, F. Liu, S. Geng, M. Yao, J. Ma, J. Cao, Tuning the content of S vacancies in MoS2 by Cu doping for enhancing catalytic hydrogenation of CO2 to methanol, Mol. Catal. 547(2023) 113288. 10.1016/j.mcat.2023.113288. [4] E. Pahija C. Panaritis S. Gusarov J. Shadbahr F. Bensebaa G. Patience D.C. Boffito Experimental and computational synergistic design of Cu and Fe catalysts for the reverse water-gas shift: a review ACS Catal. 12 2022 6887 6905 10.1021/acscatal.2c01099 E. Pahija, C. Panaritis, S. Gusarov, J. Shadbahr, F. Bensebaa, G. Patience, D.C. Boffito, Experimental and computational synergistic design of Cu and Fe catalysts for the reverse water-gas shift: a review, ACS Catal.. 12(2022) 6887–6905, 10.1021/acscatal.2c01099. [5] X. Song C. Yang X. Li Z. Wang C. Pei Z. Zhao J. Gong On the role of hydroxyl groups on Cu/Al2O3 in CO2 hydrogenation ACS Catal. 12 2022 14162 14172 10.1021/acscatal.2c03591 X. Song, C. Yang, X. Li, Z. Wang, C. Pei, Z. Zhao, J. Gong, On the role of hydroxyl groups on Cu/Al2O3 in CO2 hydrogenation, ACS Catal. 12(2022) 14162–14172, 10.1021/acscatal.2c03591. [6] Q. Chen Q. Ke X. Zhao X. Chen Enhanced catalytic activity for methanol synthesis from CO2 hydrogenation by doping indium into the step edge of Rh(211): a theoretical study Mol. Catal. 542 2023 113123 10.1016/j.mcat.2023.113123 Q. Chen, Q. Ke, X. Zhao, X. Chen, Enhanced catalytic activity for methanol synthesis from CO2 hydrogenation by doping indium into the step edge of Rh(211): a theoretical study, Mol. Catal. 542(2023) 113123. 10.1016/j.mcat.2023.113123. [7] C. Shen K. Sun Z. Zhang Z. Rui X. Jia D. Mei C. Liu Highly active Ir/In2O3 catalysts for selective hydrogenation of CO2 to methanol: experimental and theoretical studies ACS Catal. 11 2021 4036 4046 10.1021/acscatal.0c05628 C. Shen, K. Sun, Z. Zhang, Z. Rui, X. Jia, D. Mei, C. Liu, Highly active Ir/In2O3 catalysts for selective hydrogenation of CO2 to methanol: experimental and theoretical studies, ACS Catal.. 11(2021) 4036–4046, 10.1021/acscatal.0c05628. [8] G.H. Gunasekar K. Park K.D. Jung S. Yoon Recent developments in the catalytic hydrogenation of CO2 to formic acid/formate using heterogeneous catalysts Inorg. Chem. Front. 3 2016 882 895 10.1039/C5QI00231A G.H. Gunasekar, K. Park, K.D. Jung, S. Yoon, Recent developments in the catalytic hydrogenation of CO2 to formic acid/formate using heterogeneous catalysts, Inorg. Chem. Front. 3(2016) 882–895, 10.1039/C5QI00231A. [9] C. Baiano E. Schiavo C. Gerbaldi F. Bella G. Meligrana G. Talarico P. Maddalena M. Pavone B. Muñoz-García Role of surface defects in CO2 adsorption and activation on CuFeO2 delafossite oxide Mol. Catal. 496 2020 111181 10.1016/j.mcat.2020.111181 C. Baiano, E. Schiavo, C. Gerbaldi, F. Bella, G. Meligrana, G. Talarico, P. Maddalena, M. Pavone, B. Muñoz-García, Role of surface defects in CO2 adsorption and activation on CuFeO2 delafossite oxide, Mol. Catal. 496 (2020) 111181, 10.1016/j.mcat.2020.111181. [10] G. Sang J. Ran X. Huang Z. Ou L. Tang Understanding the role of Ga on the activation mechanism of CO2 over modified Cu surface by DFT calculation Mol. Catal. 528 2022 112477 10.1016/j.mcat.2022.112477 G. Sang, J. Ran, X. Huang, Z. Ou, L. Tang, Understanding the role of Ga on the activation mechanism of CO2 over modified Cu surface by DFT calculation, Mol. Catal. 528 (2022) 112477. 10.1016/j.mcat.2022.112477. [11] X. Xu L. Liu Y. Tong X. Fang J. Xu D. Jiang X. Wang Facile Cr3+-Doping strategy dramatically promoting Ru/CeO2 for low-temperature CO2 methanation: unraveling the roles of surface oxygen vacancies and hydroxyl groups ACS Catal. 11 2021 5762 5775 10.1021/acscatal.0c05468 X. Xu, L. Liu, Y. Tong, X. Fang, J. Xu, D. Jiang, X. Wang, Facile Cr3+-Doping strategy dramatically promoting Ru/CeO2 for low-temperature CO2 methanation: unraveling the roles of surface oxygen vacancies and hydroxyl groups, ACS Catal.. 11(2021) 5762–5775, 10.1021/acscatal.0c05468. [12] X. Xu Y. Tong J. Huang J. Zhu X. Fang J. Xu X. Wang Insights into CO2 methanation mechanism on cubic ZrO2 supported Ni catalyst via a combination of experiments and DFT calculations Fuel 283 2021 118867 10.1016/j.fuel.2020.118867 X. Xu, Y. Tong, J. Huang, J. Zhu, X. Fang, J. Xu, X. Wang, Insights into CO2 methanation mechanism on cubic ZrO2 supported Ni catalyst via a combination of experiments and DFT calculations, Fuel 283(2021) 118867. 10.1016/j.fuel.2020.118867. [13] Y. Guan W. Suo Z. Zhang Y. Wang S. Sun G. Liu Insights on the catalytic active site for CO2 reduction on copper-based catalyst: a DFT study Mol. Catal. 511 2021 111725 10.1016/j.mcat.2021.111725 Y. Guan, W. Suo, Z. Zhang, Y. Wang, S. Sun, G. Liu, Insights on the catalytic active site for CO2 reduction on copper-based catalyst: a DFT study, Mol. Catal. 511 (2021) 111725, 10.1016/j.mcat.2021.111725. [14] Y. Zhou F. Liu S. Geng M. Yao J. Ma J. Cao Tuning the content of S vacancies in MoS2 by Cu doping for enhancin catalytic hydrogenation of CO2 to methanol Mol. Catal. 547 2023 113288 10.1016/j.mcat.2023.113288 Y. Zhou, F. Liu, S. Geng, M. Yao, J. Ma, J. Cao, Tuning the content of S vacancies in MoS2 by Cu doping for enhancin catalytic hydrogenation of CO2 to methanol, Mol. Catal. 547 (2023) 113288, 10.1016/j.mcat.2023.113288. [15] M.D. Porosoff B. Yan J.G. Chen Catalytic reduction of CO2 by H2 for synthesis of CO, methanol and hydrocarbons: challenges and opportunities Energy Environ. Sci. 9 2016 62 73 10.1039/C5EE02657A M.D. Porosoff, B. Yan, J.G. Chen, Catalytic reduction of CO2 by H2 for synthesis of CO, methanol and hydrocarbons: challenges and opportunities, Energy Environ. Sci. 9(2016) 62–73, 10.1039/C5EE02657A. [16] S. Kattel P. Liu J.G. Chen Tuning selectivity of CO2 hydrogenation reactions at the metal/oxide interface J. Am. Chem. Soc. 139 2017 9739 9754 10.1021/jacs.7b05362 S. Kattel, P. Liu, J.G. Chen, Tuning selectivity of CO2 hydrogenation reactions at the metal/oxide interface, J. Am. Chem. Soc. 139(2017) 9739–9754, 10.1021/jacs.7b05362. [17] S. Polierer J. Jelic S. Pitter F. Studt On the reactivity of the Cu/ZrO2 system for the hydrogenation of CO2 to methanol: a density functional theory study J. Phys. Chem. C 123 2019 26904 26911 10.1021/acs.jpcc.9b06500 S. Polierer, J. Jelic, S. Pitter, F. Studt, On the reactivity of the Cu/ZrO2 system for the hydrogenation of CO2 to methanol: a density functional theory study, J. Phys. Chem. C 123(2019) 26904–26911. 10.1021/acs.jpcc.9b06500. [18] J. Ye C.J. Liu D. Mei Q. Ge Methanol synthesis from CO2 hydrogenation over a Pd4/In2O3 model catalyst: a combined DFT and kinetic study J. Catal. 317 2014 44 53 10.1016/j.jcat.2014.06.002 J. Ye, C.J. Liu, D. Mei, Q. Ge, Methanol synthesis from CO2 hydrogenation over a Pd4/In2O3 model catalyst: a combined DFT and kinetic study, J. Catal. 317(2014) 44–53, 10.1016/j.jcat.2014.06.002. [19] Y. Zhou Z. An M. Li Y. Huo J. Jiang J. Xie M. He Efficient electrocatalytic CO2 reduction on Ti3C2O2 surfaces: the effect of single-atom TM anchoring on product selectivity Appli. Surf. Sci. 616 2023 156492 10.1016/j.apsusc.2023.156492 Y. Zhou, Z. An, M. Li, Y. Huo, J. Jiang, J. Xie, M. He, Efficient electrocatalytic CO2 reduction on Ti3C2O2 surfaces: the effect of single-atom TM anchoring on product selectivity, Appli. Surf. Sci. 616 (2023) 156492, 10.1016/j.apsusc.2023.156492. [20] K. Sun Z. Fan J. Ye J. Yan Q. Ge Y. Li W. He W. Yang C.J. Liu Hydrogenation of CO2 to methanol over In2O3 catalyst J. CO2 Util. 12 2015 1 6 10.1016/j.jcou.2015.09.002 K. Sun, Z. Fan, J. Ye, J. Yan, Q. Ge, Y. Li, W. He, W. Yang, C.J. Liu, Hydrogenation of CO2 to methanol over In2O3 catalyst, J. CO2 Util. 12(2015) 1–6, 10.1016/j.jcou.2015.09.002. [21] J.A. Rodriguez P. Liu D.J. Stacchiola S.D. Senanayake M.G. White J.G.G. Chen Hydrogenation of CO2 to methanol: importance of metal-oxide and metal-carbide interfaces in the activation of CO2 ACS Catal. 5 2015 6696 6706 10.1021/acscatal.5b01755 J.A. Rodriguez, P. Liu, D.J. Stacchiola, S.D. Senanayake, M.G. White, J.G.G. Chen, Hydrogenation of CO2 to methanol: importance of metal-oxide and metal-carbide interfaces in the activation of CO2, ACS Catal.. 5(2015) 6696–6706, 10.1021/acscatal.5b01755. [22] W. Zhang X. Ma H. Xiao M. Lei J. Li Mechanistic investigations on thermal hydrogenation of CO2 to methanol by nanostructured CeO2(100): the crystal-plane effect on catalytic reactivity J. Phys. Chem. C 123 2019 11763 11771 10.1021/acs.jpcc.9b02120 W. Zhang, X. Ma, H. Xiao, M. Lei, J. Li, Mechanistic investigations on thermal hydrogenation of CO2 to methanol by nanostructured CeO2(100): the crystal-plane effect on catalytic reactivity, J. Phys. Chem. C 123(2019) 11763–11771, 10.1021/acs.jpcc.9b02120. [23] J.C.J. Bart R.P.A. Sneeden Copper-zinc oxide-alumina methanol catalysts revisited Catal. Today 2 1987 1 124 10.1016/0920-5861(87)80001-9 J.C.J. Bart, R.P.A. Sneeden, Copper-zinc oxide-alumina methanol catalysts revisited, Catal. Today 2(1987) 1–124, 10.1016/0920-5861(87)80001-9. [24] M. Behrens F. Studt The active site of methanol synthesis over Cu/ZnO/Al2O3 industrial catalysts Science 336 2012 893 897 10.1126/science.1219831 M. Behrens, F. Studt, et al., The active site of methanol synthesis over Cu/ZnO/Al2O3 industrial catalysts, Science 336(2012) 893–897, https://www.science.org/doi/10.1126/science.1219831. [25] J. Graciani K. Mudiyanselage Catalysis. Highly active copper-ceria and copper-ceria-titania catalysts for methanol synthesis from CO2 Science 345 2014 546 550 10.1126/science.1253057 J. Graciani, K. Mudiyanselage, et al., Catalysis. Highly active copper-ceria and copper-ceria-titania catalysts for methanol synthesis from CO2, Science 345(2014) 546–550, https://www.science.org/doi/10.1126/science.1253057. [26] A. Karelovic P. Ruiz The role of copper particle size in low pressure methanol synthesis via CO2 hydrogenation over Cu/ZnO catalysts Catal. Sci. Technol. 5 2015 869 881 10.1039/C4CY00848K A. Karelovic, P. Ruiz, The role of copper particle size in low pressure methanol synthesis via CO2 hydrogenation over Cu/ZnO catalysts, Catal. Sci. Technol. 5(2015) 869–881, 10.1039/C4CY00848K. [27] X.H. Li P. Zhang C.S. Yang Z.Y. Wang X.W. Song T. Wang J.L. Gong Fast-response nickel-promoted indium oxide catalysts for carbon dioxide hydrogenation from intermittent colar hydrogen Angew. Chem. Int. Ed. 62 2023 e202301901 10.1002/anie.202301901 X.H. Li, P. Zhang, C.S. Yang, Z.Y. Wang, X.W. Song, T. Wang, J.L. Gong, Fast-response nickel-promoted indium oxide catalysts for carbon dioxide hydrogenation from intermittent colar hydrogen, Angew. Chem. Int. Ed. 62(2023) e202301901, 10.1002/anie.202301901. [28] M. Qiu Z. Fang Y. Li J. Zhu X. Huang K. Ding W. Chen Y. Zhang First-principles investigation of the activation of CO2 molecule on Tm/Cu (Tm=Fe, Co and Ni) surface alloys Appl. Surf. Sci. 353 2015 902 912 10.1016/j.apsusc.2015.06.165 M. Qiu, Z. Fang, Y. Li, J. Zhu, X. Huang, K. Ding, W. Chen, Y. Zhang, First-principles investigation of the activation of CO2 molecule on Tm/Cu (Tm=Fe, Co and Ni) surface alloys, Appl. Surf. Sci. 353(2015) 902–912, 10.1016/j.apsusc.2015.06.165. [29] N. Rui Z. Wang K. Sun J. Ye Q. Ge C.-j. Liu CO2 hydrogenation to methanol over Pd/In2O3: effects of Pd and oxygen vacancy Appl. Catal. B Environ. 218 2017 488 497 10.1016/j.apcatb.2017.06.069 N. Rui, Z. Wang, K. Sun, J. Ye, Q. Ge, C.-j. Liu, CO2 hydrogenation to methanol over Pd/In2O3: effects of Pd and oxygen vacancy, Appl. Catal. B Environ. 218(2017) 488–497, 10.1016/j.apcatb.2017.06.069. [30] H. Li L. Wang Y. Dai Z. Pu Z. Lao Y. Chen M. Wang X. Zheng J. Zhu W. Zhang R. Si C. Ma J. Zeng Synergetic interaction between neighbouring platinum monomers in CO2 interaction between neighbouring platinum mon hydrogenation Nat. Nanotechnol. 13 2018 411 417 10.1038/s41565-018-0089-z H. Li, L. Wang, Y. Dai, Z. Pu, Z. Lao, Y. Chen, M. Wang, X. Zheng, J. Zhu, W. Zhang, R. Si, C. Ma, J. Zeng, Synergetic interaction between neighbouring platinum monomers in CO2 interaction between neighbouring platinum mon hydrogenation, Nat. Nanotechnol. 13(2018) 411–417, 10.1038/s41565-018-0089-z. [31] F.C. Meunier I. Dansette A. Paredes-Nunez Y. Schuurman Cu-bound formates are main reaction intermediates during CO2 hydrogenation to methanol over Cu/ZrO2 Angew. Chem. Int. Ed. 62 2023 e202303939 10.1002/anie.202303939 F.C. Meunier, I. Dansette, A. Paredes-Nunez, Y. Schuurman, Cu-bound formates are main reaction intermediates during CO2 hydrogenation to methanol over Cu/ZrO2, Angew. Chem. Int. Ed. 62(2023)e202303939, 10.1002/anie.202303939. [32] F. Chen J. Liang F. Wang W. Gao Y. Kugue Y. He X. Guo G. Yang G. Liu J. Wu P. Reubroycharoen T. Vitidsant N. Tsubaki Alcohol solvent assisted synthesis of metallic and metal oxide catalysts: as-prepared Cu/ZnO/Al2O3 catalysts for low-temperature methanol synthesis with an ultrahigh yield ACS Catal. 13 2023 6169 6184 10.1021/acscatal.3c00199 F. Chen, J. Liang, F. Wang, W. Gao, Y. Kugue, Y. He, X. Guo, G. Yang, G. Liu, J. Wu, Reubroycharoen, P.; Vitidsant, T.; Tsubaki, N., Alcohol solvent assisted synthesis of metallic and metal oxide catalysts: as-prepared Cu/ZnO/Al2O3 catalysts for low-temperature methanol synthesis with an ultrahigh yield, ACS Catal.. 13(2023) 6169–6184, 10.1021/acscatal.3c00199. [33] D. Mao H. Zhang J. Zhang D. Wu A dual-site Cu-ZnO/Cu@Si catalyst boosts CO2 hydrogenation to CH3OH Mol. Catal. 550 2023 113574 10.1016/j.mcat.2023.113574 D. Mao, H. Zhang, J. Zhang, D. Wu, A dual-site Cu-ZnO/Cu@Si catalyst boosts CO2 hydrogenation to CH3OH, Mol. Catal. 550 (2023) 113574, 10.1016/j.mcat.2023.113574. [34] P. Liu Y. Zhao R. Qin S. Mo G. Chen L. Gu D.M. Chevrier P. Zhang Q. Guo D. Zang Photochemical route for synthesizing atomically dispersed palladium catalysts Science 352 2016 797 800 10.1126/science.aaf5251 P. Liu, Y. Zhao, R. Qin, S. Mo, G. Chen, L. Gu, D.M. Chevrier, P. Zhang, Q. Guo, D. Zang, Photochemical route for synthesizing atomically dispersed palladium catalysts, Science 352(2016) 797–800, https://www.science.org/doi/10.1126/science.aaf5251. [35] B. Qiao A. Wang X. Yang L.F. Allard Z. Jiang Y. Cui J. Liu J. Li T. Zhang Single-atom catalysis of CO oxidation using Pt1/FeOx Nat. Chem. 3 2011 634 641 10.1038/nchem.1095 B. Qiao, A. Wang, X. Yang, L.F. Allard, Z. Jiang, Y. Cui, J. Liu, J. Li, T. Zhang, Single-atom catalysis of CO oxidation using Pt1/FeOx, Nat. Chem. 3(2011) 634–641, 10.1038/nchem.1095. [36] S.K. Kaiser Z. Chen D. Faust Akl S. Mitchell J. Pérez- Ramírez Single-atomcatalysts across the periodic table Chem. Rev. 120 2020 11703 11809 10.1021/acs.chemrev.0c00576 S.K. Kaiser, Z. Chen, D. Faust Akl, S. Mitchell, J. Pérez- Ramírez, Single-atomcatalysts across the periodic table, Chem. Rev. 120(2020) 11703–11809, 10.1021/acs.chemrev.0c00576. [37] J. Liu Y. Wang J. Li Toward rational fesign of oxide-supported single-atom catalysts: atomic dispersion of gold on ceria J. Am. Chem. Soc. 139 2017 6190 6199 10.1021/jacs.7b01602 J. Liu, Y. Wang, J. Li, Toward rational fesign of oxide-supported single-atom catalysts: atomic dispersion of gold on ceria, J. Am. Chem. Soc. 139(2017) 6190–6199, 10.1021/jacs.7b01602. [38] J.C. Liu H. Xiao X.K. Zhao N.N. Zhang Y. Liu D.H. Xing X. Yu H.S. Hu J. Li Computational prediction of graphdiyne-supported three-atom single-cluster catalysts CCS Chem. 5 2023 152 163 10.31635/ccschem.022.202201796 J.C. Liu, H. Xiao, X.K. Zhao, N.N. Zhang, Y. Liu, D.H. Xing, X. Yu, H.S. Hu, J. Li, Computational prediction of graphdiyne-supported three-atom single-cluster catalysts, CCS Chem.. 5(2023) 152–163, 10.31635/ccschem.022.202201796. [39] G. Wang X. Jiang Y. Jiang Y. Wang J. Li Screened Fe3 and Ru3 single-cluster catalysts anchored on MoS2 supports for selective hydrogenation of CO2 ACS Catal. 13 2023 8413 8422 10.1021/acscatal.3c00617 G. Wang, X. Jiang, Y. Jiang, Y. Wang, J. Li, Screened Fe3 and Ru3 single-cluster catalysts anchored on MoS2 supports for selective hydrogenation of CO2, ACS Catal.. 13(2023) 8413–8422, 10.1021/acscatal.3c00617. [40] H. Zhang J. Zhu H. Zhang Y.Z. J.Zhang Z.H. Lu The structural, electronic and catalytic properties of Aun(n = 1–4) nanoclusters on monolayer MoS2 RSC Adv. 7 2017 42529 42540 10.1039/C7RA07591J H. Zhang, J. Zhu, H. Zhang, J.Zhang, Y.Z., Z.H. Lu, The structural, electronic and catalytic properties of Aun(n = 1–4) nanoclusters on monolayer MoS2, RSC Adv.. 7(2017) 42529–42540, 10.1039/C7RA07591J. [41] B. Yang C. Liu A. Halder E.C. Tyo A.B.F. Martinson S. Seifert P. Zapol L.A. Curtiss S. Vajda Copper cluster size effect in methanol synthesis from CO2 J. Phys. Chem. C 121 2017 10406 10412 10.1021/acs.jpcc.7b01835 B. Yang, C. Liu, A. Halder, E.C. Tyo, A.B.F. Martinson, S. Seifert, P. Zapol, L.A. Curtiss, S. Vajda, Copper cluster size effect in methanol synthesis from CO2, J. Phys. Chem. C 121(2017)10406–10412, 10.1021/acs.jpcc.7b01835. [42] N. Fu X. Liang X. Wang T. Gan C. Ye Z. Li J. Liu Y. Li Controllable conversion of platinum nanoparticles to single atoms in Pt/CeO2 by laser ablation for efficient CO oxidation J. Am. Chem. Soc. 145 2023 9540 9547 10.1021/jacs.2c11739 N. Fu, X. Liang, X. Wang, T. Gan, C. Ye, Z. Li, J. Liu, Y. Li, Controllable conversion of platinum nanoparticles to single atoms in Pt/CeO2 by laser ablation for efficient CO oxidation, J. Am. Chem. Soc. 145(2023) 9540–9547, 10.1021/jacs.2c11739. [43] C. Liu B. Yang E. Tyo S. Seifert J. DeBartolo B. Issendorff P. Zapol S. Vajda L.A. Curtiss Carbon dioxide conversion to methanol over size-selected Cu4 clusters at low pressures J. Am. Chem. Soc. 137 2015 8676 8679 10.1021/jacs.5b03668 C. Liu, B. Yang, E. Tyo, S. Seifert, J. DeBartolo, B. Issendorff, P. Zapol, S. Vajda, L.A. Curtiss, Carbon dioxide conversion to methanol over size-selected Cu4 clusters at low pressures, J. Am. Chem. Soc. 137(2015) 8676–8679, 10.1021/jacs.5b03668. [44] G. Kresse D. Joubert From ultrasoft pseudopotentials to the projector augmented-wave method Phys. Rev. B 59 1999 1758 1775 10.1103/PhysRevB.59.1758 G. Kresse, D. Joubert, From ultrasoft pseudopotentials to the projector augmented-wave method, Phys. Rev. B 59(1999) 1758–1775, 10.1103/PhysRevB.59.1758. [45] G. Kresse J. Furthmuller Efficient iterative schemes for ab initio total-energy calculations using a plane-wave basis set Phys. Rev. B 54 1996 11169 11186 10.1103/PhysRevB.54.11169 G. Kresse, J. Furthmuller, Efficient iterative schemes for ab initio total-energy calculations using a plane-wave basis set, Phys. Rev. B 54(1996) 11169–11186, 10.1103/PhysRevB.54.11169. [46] P.E. Blochl Projector augmented-wave method Phys. Rev. B 50 1994 17953 17979 10.1103/PhysRevB.50.17953 P.E. Blochl, Projector augmented-wave method, Phys. Rev. B 50(1994) 17953–17979, 10.1103/PhysRevB.50.17953. [47] J.P. Perdew K. Burke M. Ernzerhof Generalized gradient approximation made simple Phys. Rev. Lett. 77 1996 3865 3868 10.1103/PhysRevLett.77.3865 J.P. Perdew, K. Burke, M. Ernzerhof, Generalized gradient approximation made simple, Phys. Rev. Lett. 77(1996) 3865–3868, 10.1103/PhysRevLett.77.3865. [48] S. Grimme J. Antony S. Ehrlich H. Krieg A consistent and accurate ab initio parametrization of density functional dispersion correction (DFT-D) for the 94 elements H-Pu J. Chem. Phys. 132 2010 154104 10.1063/1.3382344 S. Grimme, J. Antony, S. Ehrlich, H. Krieg, A consistent and accurate ab initio parametrization of density functional dispersion correction (DFT-D) for the 94 elements H-Pu, J. Chem. Phys. 132(2010) 154104, 10.1063/1.3382344. [49] E.A. Soares M.A. Van Hove C.F. Walters K.F. McCarty Structure of the α-Al2O3(0001) surface from low-Energy electron diffraction: al termination and evidence for anomalously large thermal vibrations Phys. Rev. B 65 2002 195405 10.1103/PhysRevB.65.195405 E.A. Soares, M.A. Van Hove, C.F. Walters, K.F. McCarty, Structure of the α-Al2O3(0001) surface from low-Energy electron diffraction: al termination and evidence for anomalously large thermal vibrations, Phys. Rev. B 65(2002) 195405, 10.1103/PhysRevB.65.195405. [50] H.N. Chiang S. Nachimuthu Y.C. Cheng N.P. Damayanti J.C. Jiang DFT study of ethanol adsorption and decomposition on alpha-Al2O3(0001) surface Appl. Surf. Sci. 363 2016 636 643 10.1016/j.apsusc.2015.11.260 H.N. Chiang, S. Nachimuthu, Y.C. Cheng, N.P. Damayanti, J.C. Jiang, DFT study of ethanol adsorption and decomposition on alpha-Al2O3(0001) surface, Appl. Surf. Sci. 363(2016) 636–643, 10.1016/j.apsusc.2015.11.260. [51] M. Gautier-Soyer F. Jollet C. Noguera Influence of surface relaxation on the electronic states of the alpha-Al2O3(0001) surface: a self-consistent tight-binding approach Surf. Sci. 352 1996 755 759 10.1016/0039-6028(95)01242-7 M. Gautier-Soyer, F. Jollet, C. Noguera, Influence of surface relaxation on the electronic states of the alpha-Al2O3(0001) surface: a self-consistent tight-binding approach, Surf. Sci. 352(1996) 755–759, 10.1016/0039-6028(95)01242-7. [52] S. Nosé A unified formulation of the constant temperature molecular dynamics method J. Chem. Phys. 81 1984 511 519 10.1063/1.447334 S. Nosé, A unified formulation of the constant temperature molecular dynamics method, J. Chem. Phys. 81(1984) 511–519, 10.1063/1.447334. [53] Y. Zhang L. Giordano G. Pacchioni Gold nanostructures on TiOx/Mo(112) thin films J. Phys. Chem. C 112 2008 191 200 10.1021/jp074837t Y. Zhang, L. Giordano, G. Pacchioni, Gold nanostructures on TiOx/Mo(112) thin films, J. Phys. Chem. C 112(2008) 191–200, 10.1021/jp074837t. [54] G. Henkelman B.P. Uberuaga H. Jónsson A climbing image nudged elastic band method for finding saddle points and minimum energy paths J. Chem. Phys. 113 2000 9901 9904 10.1063/1.1329672 G. Henkelman, B.P. Uberuaga, H. Jónsson, A climbing image nudged elastic band method for finding saddle points and minimum energy paths, J. Chem. Phys. 113(2000) 9901–9904, 10.1063/1.1329672. [55] G. Henkelman H. Jónsson Improved tangent estimate in the nudged elastic band method for finding minimum energy paths and saddle points J. Chem. Phys. 113 2000 9978 9985 10.1063/1.1323224 G. Henkelman, H. Jónsson, Improved tangent estimate in the nudged elastic band method for finding minimum energy paths and saddle points, J. Chem. Phys. 113(2000) 9978–9985, 10.1063/1.1323224. [56] C.T. Campbell Future directions and industrial perspectives micro- and macro-kinetics: their relationship in heterogeneous catalysis Top. Catal. 1 1994 353 366 10.1007/BF01492288 C.T. Campbell, Future directions and industrial perspectives micro- and macro-kinetics: their relationship in heterogeneous catalysis, Top. Catal. 1(1994) 353–366, 10.1007/BF01492288. [57] C.T. Campbell Finding the rate-determining step in a mechanism: comparing DeDonder relations with the “degree of rate control J. Catal. 204 2001 520 524 10.1006/jcat.2001.3396 C.T. Campbell, Finding the rate-determining step in a mechanism: comparing DeDonder relations with the “degree of rate control”, J. Catal. 204(2001) 520–524, 10.1006/jcat.2001.3396. [58] B.H. Cogollo-Olivo N. Seriani J.A. Montoya Unbiased structural search of small copper clusters within DFT Chem. Phys. 461 2015 20 24 10.1016/j.chemphys.2015.08.023 B.H. Cogollo-Olivo, N. Seriani, J.A. Montoya, Unbiased structural search of small copper clusters within DFT, Chem. Phys. 461(2015) 20–24, 10.1016/j.chemphys.2015.08.023. [59] K. Jug B. Zimmermann P. Calaminici A.M. Köster Structure and stability of small copper clusters J. Chem. Phys. 116 2002 4497 4507 10.1063/1.1436465 K. Jug, B. Zimmermann, P. Calaminici, A.M. Köster, Structure and stability of small copper clusters, J. Chem. Phys. 116(2002) 4497–4507, 10.1063/1.1436465. [60] E.M. Fernández J.M. Soler I.L. Garzón L.C. Balbás Trends in the structure and bonding of noble metal clusters Phys. Rev. B 70 2004 165403 10.1103/PhysRevB.70.165403 E.M. Fernández, J.M. Soler, I.L. Garzón, L.C. Balbás, Trends in the structure and bonding of noble metal clusters, Phys. Rev. B 70(2004) 165403, 10.1103/PhysRevB.70.165403. [61] S. Nigam C. Majumder Substrate induced reconstruction and activation of platinum clusters: a systematic DFT study Appl. Surf. Sci. 422 2017 1075 1081 10.1016/j.apsusc.2017.06.041 S. Nigam, C. Majumder, Substrate induced reconstruction and activation of platinum clusters: a systematic DFT study, Appl. Surf. Sci. 422(2017) 1075–1081, 10.1016/j.apsusc.2017.06.041. [62] Y. Yang J. Evans J.A. Rodriguez M.G. White P. Liu Fundamental studies of methanol synthesis from CO2 hydrogenation on Cu(111), Cu clusters, and Cu/ZnO(0001) Phys. Chem. Chem. Phys. 12 2010 9909 9917 10.1039/C001484B Y. Yang, J. Evans, J.A. Rodriguez, White, M.G.; Liu, P. Fundamental studies of methanol synthesis from CO2 hydrogenation on Cu(111), Cu clusters, and Cu/ZnO(0001), Phys. Chem. Chem. Phys. 12(2010) 9909–9917, 10.1039/C001484B.",
      "scopus-id": "85174804692",
      "coredata": {
        "eid": "1-s2.0-S2468823123007290",
        "dc:description": "The size-selected copper single-cluster catalysts(SCCs) play a crucial role in catalyzing of CO2 hydrogenation. However, nature of size effect and hydrogenation mechanism is still unclear. Here, Density functional theory(DFT) calculations were performed to investigate activation and reaction mechanism of CO2 hydrogenation to methanol over copper single-clusters catalyst anchored on α-Al2O3(0001). Our results show that Cun(n = 1–9)/Al2O3 catalysts significantly promote activation of CO2 in a bent configuration due to the synergistic interaction associated with Cun-Al2O3(0001) interfacial site. Bader charge analysis suggested electron transfer occurring from Cun-Al2O3(0001) interface to CO2, leading to negatively charged CO2. We find descriptors of deviation of CO2 bonds length and bonds angle, d -band center of Cun(n = 1–9) cluster that can well descript for determining activation degree of CO2. Especially, the Cu5/α-Al2O3(0001) has the best activity for CO2 hydrogenation among them. Furthermore, reaction mechanism of CO2 hydrogenation at Cu5/Al2O3 interface have been explored. Methanol synthesis takes formate route and direct CO bond cleavage route competitive with rate-dominant step of HCOO* and HO* hydrogenation, respectively. While CO-hydrogenation produced by RWGS route is not feasible because of high activation barrier of formed CO intermediate(1.95 eV). This study will provide insight into designing and application of ultrahigh-performance Cu-based single-cluster catalysts for CO2 hydrogenation.",
        "openArchiveArticle": "false",
        "prism:coverDate": "2023-12-31",
        "openaccessUserLicense": null,
        "prism:aggregationType": "Journal",
        "prism:url": "https://api.elsevier.com/content/article/pii/S2468823123007290",
        "dc:creator": [
          {
            "@_fa": "true",
            "$": "Zhou, Hegen"
          },
          {
            "@_fa": "true",
            "$": "Zhu, Jia"
          },
          {
            "@_fa": "true",
            "$": "Jin, Hua"
          },
          {
            "@_fa": "true",
            "$": "Li, Yanli"
          },
          {
            "@_fa": "true",
            "$": "Wang, Bin"
          },
          {
            "@_fa": "true",
            "$": "Huang, Shuping"
          },
          {
            "@_fa": "true",
            "$": "Lin, Wei"
          },
          {
            "@_fa": "true",
            "$": "Li, Yi"
          },
          {
            "@_fa": "true",
            "$": "Chen, Wenkai"
          },
          {
            "@_fa": "true",
            "$": "Zhang, Yongfan"
          }
        ],
        "link": [
          {
            "@_fa": "true",
            "@rel": "self",
            "@href": "https://api.elsevier.com/content/article/pii/S2468823123007290"
          },
          {
            "@_fa": "true",
            "@rel": "scidir",
            "@href": "https://www.sciencedirect.com/science/article/pii/S2468823123007290"
          }
        ],
        "dc:format": "application/json",
        "openaccessType": null,
        "pii": "S2468-8231(23)00729-0",
        "prism:volume": "551",
        "articleNumber": "113646",
        "prism:publisher": "Elsevier B.V.",
        "dc:title": "Interfacial synergistic catalysis of Cun single-cluster catalysts anchored on α-Al2O3(0001) for promoting hydrogenation of CO2 to methanol",
        "prism:copyright": "© 2023 Elsevier B.V. All rights reserved.",
        "openaccess": "0",
        "prism:issn": "24688231",
        "dcterms:subject": [
          {
            "@_fa": "true",
            "$": "Synergistic catalysis"
          },
          {
            "@_fa": "true",
            "$": "Cu single-cluster catalyst"
          },
          {
            "@_fa": "true",
            "$": "Supported α-Al2O3(0001)"
          },
          {
            "@_fa": "true",
            "$": "Interfacial site"
          },
          {
            "@_fa": "true",
            "$": "CO2 hydrogenation"
          }
        ],
        "openaccessArticle": "false",
        "prism:publicationName": "Molecular Catalysis",
        "openaccessSponsorType": null,
        "prism:pageRange": "113646",
        "pubType": "fla",
        "prism:coverDisplayDate": "December 2023",
        "prism:doi": "10.1016/j.mcat.2023.113646",
        "prism:startingPage": "113646",
        "dc:identifier": "doi:10.1016/j.mcat.2023.113646",
        "openaccessSponsorName": null
      },
      "objects": {
        "object": [
          {
            "@category": "standard",
            "@height": "504",
            "@width": "659",
            "@_fa": "true",
            "$": "https://api.elsevier.com/content/object/eid/1-s2.0-S2468823123007290-gr9.jpg?httpAccept=%2A%2F%2A",
            "@multimediatype": "JPEG image file",
            "@type": "IMAGE-DOWNSAMPLED",
            "@size": "84285",
            "@ref": "gr9",
            "@mimetype": "image/jpeg"
          },
          {
            "@category": "standard",
            "@height": "950",
            "@width": "659",
            "@_fa": "true",
            "$": "https://api.elsevier.com/content/object/eid/1-s2.0-S2468823123007290-gr3.jpg?httpAccept=%2A%2F%2A",
            "@multimediatype": "JPEG image file",
            "@type": "IMAGE-DOWNSAMPLED",
            "@size": "230729",
            "@ref": "gr3",
            "@mimetype": "image/jpeg"
          },
          {
            "@category": "standard",
            "@height": "373",
            "@width": "659",
            "@_fa": "true",
            "$": "https://api.elsevier.com/content/object/eid/1-s2.0-S2468823123007290-gr5.jpg?httpAccept=%2A%2F%2A",
            "@multimediatype": "JPEG image file",
            "@type": "IMAGE-DOWNSAMPLED",
            "@size": "57555",
            "@ref": "gr5",
            "@mimetype": "image/jpeg"
          },
          {
            "@category": "standard",
            "@height": "270",
            "@width": "659",
            "@_fa": "true",
            "$": "https://api.elsevier.com/content/object/eid/1-s2.0-S2468823123007290-gr6.jpg?httpAccept=%2A%2F%2A",
            "@multimediatype": "JPEG image file",
            "@type": "IMAGE-DOWNSAMPLED",
            "@size": "43709",
            "@ref": "gr6",
            "@mimetype": "image/jpeg"
          },
          {
            "@category": "standard",
            "@height": "200",
            "@width": "474",
            "@_fa": "true",
            "$": "https://api.elsevier.com/content/object/eid/1-s2.0-S2468823123007290-ga1.jpg?httpAccept=%2A%2F%2A",
            "@multimediatype": "JPEG image file",
            "@type": "IMAGE-DOWNSAMPLED",
            "@size": "52277",
            "@ref": "ga1",
            "@mimetype": "image/jpeg"
          },
          {
            "@category": "standard",
            "@height": "241",
            "@width": "659",
            "@_fa": "true",
            "$": "https://api.elsevier.com/content/object/eid/1-s2.0-S2468823123007290-gr7.jpg?httpAccept=%2A%2F%2A",
            "@multimediatype": "JPEG image file",
            "@type": "IMAGE-DOWNSAMPLED",
            "@size": "32412",
            "@ref": "gr7",
            "@mimetype": "image/jpeg"
          },
          {
            "@category": "standard",
            "@height": "322",
            "@width": "659",
            "@_fa": "true",
            "$": "https://api.elsevier.com/content/object/eid/1-s2.0-S2468823123007290-gr8.jpg?httpAccept=%2A%2F%2A",
            "@multimediatype": "JPEG image file",
            "@type": "IMAGE-DOWNSAMPLED",
            "@size": "53817",
            "@ref": "gr8",
            "@mimetype": "image/jpeg"
          },
          {
            "@category": "standard",
            "@height": "569",
            "@width": "659",
            "@_fa": "true",
            "$": "https://api.elsevier.com/content/object/eid/1-s2.0-S2468823123007290-gr4.jpg?httpAccept=%2A%2F%2A",
            "@multimediatype": "JPEG image file",
            "@type": "IMAGE-DOWNSAMPLED",
            "@size": "67368",
            "@ref": "gr4",
            "@mimetype": "image/jpeg"
          },
          {
            "@category": "standard",
            "@height": "789",
            "@width": "659",
            "@_fa": "true",
            "$": "https://api.elsevier.com/content/object/eid/1-s2.0-S2468823123007290-gr1.jpg?httpAccept=%2A%2F%2A",
            "@multimediatype": "JPEG image file",
            "@type": "IMAGE-DOWNSAMPLED",
            "@size": "177401",
            "@ref": "gr1",
            "@mimetype": "image/jpeg"
          },
          {
            "@category": "standard",
            "@height": "660",
            "@width": "659",
            "@_fa": "true",
            "$": "https://api.elsevier.com/content/object/eid/1-s2.0-S2468823123007290-gr2.jpg?httpAccept=%2A%2F%2A",
            "@multimediatype": "JPEG image file",
            "@type": "IMAGE-DOWNSAMPLED",
            "@size": "142394",
            "@ref": "gr2",
            "@mimetype": "image/jpeg"
          },
          {
            "@category": "thumbnail",
            "@height": "164",
            "@width": "214",
            "@_fa": "true",
            "$": "https://api.elsevier.com/content/object/eid/1-s2.0-S2468823123007290-gr9.sml?httpAccept=%2A%2F%2A",
            "@multimediatype": "GIF image file",
            "@type": "IMAGE-THUMBNAIL",
            "@size": "10258",
            "@ref": "gr9",
            "@mimetype": "image/gif"
          },
          {
            "@category": "thumbnail",
            "@height": "163",
            "@width": "113",
            "@_fa": "true",
            "$": "https://api.elsevier.com/content/object/eid/1-s2.0-S2468823123007290-gr3.sml?httpAccept=%2A%2F%2A",
            "@multimediatype": "GIF image file",
            "@type": "IMAGE-THUMBNAIL",
            "@size": "13245",
            "@ref": "gr3",
            "@mimetype": "image/gif"
          },
          {
            "@category": "thumbnail",
            "@height": "124",
            "@width": "219",
            "@_fa": "true",
            "$": "https://api.elsevier.com/content/object/eid/1-s2.0-S2468823123007290-gr5.sml?httpAccept=%2A%2F%2A",
            "@multimediatype": "GIF image file",
            "@type": "IMAGE-THUMBNAIL",
            "@size": "6677",
            "@ref": "gr5",
            "@mimetype": "image/gif"
          },
          {
            "@category": "thumbnail",
            "@height": "90",
            "@width": "219",
            "@_fa": "true",
            "$": "https://api.elsevier.com/content/object/eid/1-s2.0-S2468823123007290-gr6.sml?httpAccept=%2A%2F%2A",
            "@multimediatype": "GIF image file",
            "@type": "IMAGE-THUMBNAIL",
            "@size": "6449",
            "@ref": "gr6",
            "@mimetype": "image/gif"
          },
          {
            "@category": "thumbnail",
            "@height": "92",
            "@width": "219",
            "@_fa": "true",
            "$": "https://api.elsevier.com/content/object/eid/1-s2.0-S2468823123007290-ga1.sml?httpAccept=%2A%2F%2A",
            "@multimediatype": "GIF image file",
            "@type": "IMAGE-THUMBNAIL",
            "@size": "12971",
            "@ref": "ga1",
            "@mimetype": "image/gif"
          },
          {
            "@category": "thumbnail",
            "@height": "80",
            "@width": "219",
            "@_fa": "true",
            "$": "https://api.elsevier.com/content/object/eid/1-s2.0-S2468823123007290-gr7.sml?httpAccept=%2A%2F%2A",
            "@multimediatype": "GIF image file",
            "@type": "IMAGE-THUMBNAIL",
            "@size": "6483",
            "@ref": "gr7",
            "@mimetype": "image/gif"
          },
          {
            "@category": "thumbnail",
            "@height": "107",
            "@width": "219",
            "@_fa": "true",
            "$": "https://api.elsevier.com/content/object/eid/1-s2.0-S2468823123007290-gr8.sml?httpAccept=%2A%2F%2A",
            "@multimediatype": "GIF image file",
            "@type": "IMAGE-THUMBNAIL",
            "@size": "7487",
            "@ref": "gr8",
            "@mimetype": "image/gif"
          },
          {
            "@category": "thumbnail",
            "@height": "164",
            "@width": "190",
            "@_fa": "true",
            "$": "https://api.elsevier.com/content/object/eid/1-s2.0-S2468823123007290-gr4.sml?httpAccept=%2A%2F%2A",
            "@multimediatype": "GIF image file",
            "@type": "IMAGE-THUMBNAIL",
            "@size": "8072",
            "@ref": "gr4",
            "@mimetype": "image/gif"
          },
          {
            "@category": "thumbnail",
            "@height": "164",
            "@width": "137",
            "@_fa": "true",
            "$": "https://api.elsevier.com/content/object/eid/1-s2.0-S2468823123007290-gr1.sml?httpAccept=%2A%2F%2A",
            "@multimediatype": "GIF image file",
            "@type": "IMAGE-THUMBNAIL",
            "@size": "13301",
            "@ref": "gr1",
            "@mimetype": "image/gif"
          },
          {
            "@category": "thumbnail",
            "@height": "164",
            "@width": "164",
            "@_fa": "true",
            "$": "https://api.elsevier.com/content/object/eid/1-s2.0-S2468823123007290-gr2.sml?httpAccept=%2A%2F%2A",
            "@multimediatype": "GIF image file",
            "@type": "IMAGE-THUMBNAIL",
            "@size": "12959",
            "@ref": "gr2",
            "@mimetype": "image/gif"
          },
          {
            "@category": "high",
            "@height": "2232",
            "@width": "2917",
            "@_fa": "true",
            "$": "https://api.elsevier.com/content/object/eid/1-s2.0-S2468823123007290-gr9_lrg.jpg?httpAccept=%2A%2F%2A",
            "@multimediatype": "JPEG image file",
            "@type": "IMAGE-HIGH-RES",
            "@size": "577438",
            "@ref": "gr9",
            "@mimetype": "image/jpeg"
          },
          {
            "@category": "high",
            "@height": "4205",
            "@width": "2917",
            "@_fa": "true",
            "$": "https://api.elsevier.com/content/object/eid/1-s2.0-S2468823123007290-gr3_lrg.jpg?httpAccept=%2A%2F%2A",
            "@multimediatype": "JPEG image file",
            "@type": "IMAGE-HIGH-RES",
            "@size": "1842361",
            "@ref": "gr3",
            "@mimetype": "image/jpeg"
          },
          {
            "@category": "high",
            "@height": "1653",
            "@width": "2917",
            "@_fa": "true",
            "$": "https://api.elsevier.com/content/object/eid/1-s2.0-S2468823123007290-gr5_lrg.jpg?httpAccept=%2A%2F%2A",
            "@multimediatype": "JPEG image file",
            "@type": "IMAGE-HIGH-RES",
            "@size": "435568",
            "@ref": "gr5",
            "@mimetype": "image/jpeg"
          },
          {
            "@category": "high",
            "@height": "1196",
            "@width": "2917",
            "@_fa": "true",
            "$": "https://api.elsevier.com/content/object/eid/1-s2.0-S2468823123007290-gr6_lrg.jpg?httpAccept=%2A%2F%2A",
            "@multimediatype": "JPEG image file",
            "@type": "IMAGE-HIGH-RES",
            "@size": "380299",
            "@ref": "gr6",
            "@mimetype": "image/jpeg"
          },
          {
            "@category": "high",
            "@height": "886",
            "@width": "2100",
            "@_fa": "true",
            "$": "https://api.elsevier.com/content/object/eid/1-s2.0-S2468823123007290-ga1_lrg.jpg?httpAccept=%2A%2F%2A",
            "@multimediatype": "JPEG image file",
            "@type": "IMAGE-HIGH-RES",
            "@size": "362477",
            "@ref": "ga1",
            "@mimetype": "image/jpeg"
          },
          {
            "@category": "high",
            "@height": "1066",
            "@width": "2917",
            "@_fa": "true",
            "$": "https://api.elsevier.com/content/object/eid/1-s2.0-S2468823123007290-gr7_lrg.jpg?httpAccept=%2A%2F%2A",
            "@multimediatype": "JPEG image file",
            "@type": "IMAGE-HIGH-RES",
            "@size": "262505",
            "@ref": "gr7",
            "@mimetype": "image/jpeg"
          },
          {
            "@category": "high",
            "@height": "1424",
            "@width": "2917",
            "@_fa": "true",
            "$": "https://api.elsevier.com/content/object/eid/1-s2.0-S2468823123007290-gr8_lrg.jpg?httpAccept=%2A%2F%2A",
            "@multimediatype": "JPEG image file",
            "@type": "IMAGE-HIGH-RES",
            "@size": "471443",
            "@ref": "gr8",
            "@mimetype": "image/jpeg"
          },
          {
            "@category": "high",
            "@height": "2517",
            "@width": "2917",
            "@_fa": "true",
            "$": "https://api.elsevier.com/content/object/eid/1-s2.0-S2468823123007290-gr4_lrg.jpg?httpAccept=%2A%2F%2A",
            "@multimediatype": "JPEG image file",
            "@type": "IMAGE-HIGH-RES",
            "@size": "492432",
            "@ref": "gr4",
            "@mimetype": "image/jpeg"
          },
          {
            "@category": "high",
            "@height": "3494",
            "@width": "2917",
            "@_fa": "true",
            "$": "https://api.elsevier.com/content/object/eid/1-s2.0-S2468823123007290-gr1_lrg.jpg?httpAccept=%2A%2F%2A",
            "@multimediatype": "JPEG image file",
            "@type": "IMAGE-HIGH-RES",
            "@size": "1430906",
            "@ref": "gr1",
            "@mimetype": "image/jpeg"
          },
          {
            "@category": "high",
            "@height": "2920",
            "@width": "2917",
            "@_fa": "true",
            "$": "https://api.elsevier.com/content/object/eid/1-s2.0-S2468823123007290-gr2_lrg.jpg?httpAccept=%2A%2F%2A",
            "@multimediatype": "JPEG image file",
            "@type": "IMAGE-HIGH-RES",
            "@size": "1122126",
            "@ref": "gr2",
            "@mimetype": "image/jpeg"
          },
          {
            "@category": "standard",
            "@_fa": "true",
            "$": "https://api.elsevier.com/content/object/eid/1-s2.0-S2468823123007290-mmc1.docx?httpAccept=%2A%2F%2A",
            "@multimediatype": "Microsoft Word file",
            "@type": "APPLICATION",
            "@size": "12368659",
            "@ref": "mmc1",
            "@mimetype": "application/word"
          },
          {
            "@category": "thumbnail",
            "@_fa": "true",
            "$": "https://api.elsevier.com/content/object/eid/1-s2.0-S2468823123007290-si1.svg?httpAccept=%2A%2F%2A",
            "@multimediatype": "Scalable Vector Graphics file",
            "@type": "ALTIMG",
            "@size": "12185",
            "@ref": "si1",
            "@mimetype": "image/svg+xml"
          },
          {
            "@category": "thumbnail",
            "@_fa": "true",
            "$": "https://api.elsevier.com/content/object/eid/1-s2.0-S2468823123007290-si2.svg?httpAccept=%2A%2F%2A",
            "@multimediatype": "Scalable Vector Graphics file",
            "@type": "ALTIMG",
            "@size": "14528",
            "@ref": "si2",
            "@mimetype": "image/svg+xml"
          },
          {
            "@category": "thumbnail",
            "@_fa": "true",
            "$": "https://api.elsevier.com/content/object/eid/1-s2.0-S2468823123007290-si3.svg?httpAccept=%2A%2F%2A",
            "@multimediatype": "Scalable Vector Graphics file",
            "@type": "ALTIMG",
            "@size": "5517",
            "@ref": "si3",
            "@mimetype": "image/svg+xml"
          },
          {
            "@category": "thumbnail",
            "@_fa": "true",
            "$": "https://api.elsevier.com/content/object/eid/1-s2.0-S2468823123007290-si4.svg?httpAccept=%2A%2F%2A",
            "@multimediatype": "Scalable Vector Graphics file",
            "@type": "ALTIMG",
            "@size": "5268",
            "@ref": "si4",
            "@mimetype": "image/svg+xml"
          },
          {
            "@category": "standard",
            "@_fa": "true",
            "$": "https://api.elsevier.com/content/object/eid/1-s2.0-S2468823123007290-am.pdf?httpAccept=%2A%2F%2A",
            "@multimediatype": "Acrobat PDF file",
            "@type": "AAM-PDF",
            "@size": "1711480",
            "@ref": "am",
            "@mimetype": "application/pdf"
          }
        ]
      },
      "link": {
        "@rel": "abstract",
        "@href": "https://api.elsevier.com/content/abstract/scopus_id/85174804692"
      }
    }
  }
}