{
  "metadata": {
    "title": "Environment-friendly heterogeneous poly(ionic liquid)s immobilized polyoxometalate catalysts towards the efficient oxidation of alkenes",
    "authors": "; ; ",
    "journal": "Molecular Catalysis",
    "date": "2024-12-31",
    "doi": "10.1016/j.mcat.2024.114572",
    "abstract": "",
    "uri": "https://api.elsevier.com/content/article/pii/S2468823124007545",
    "pii": "S2468823124007545"
  },
  "fulltext": {
    "full-text-retrieval-response": {
      "scopus-eid": "2-s2.0-85204724711",
      "originalText": "serial JL 315758 291210 291744 291790 291809 31 Molecular Catalysis MOLECULARCATALYSIS 2024-09-25 2024-09-25 2024-09-25 2024-09-25 2024-11-15T16:17:10 1-s2.0-S2468823124007545 S2468-8231(24)00754-5 S2468823124007545 10.1016/j.mcat.2024.114572 S300 S300.1 FULL-TEXT 1-s2.0-S2468823124X00152 2024-11-15T17:47:59.133994Z 0 0 20241201 20241231 2024 2024-09-25T10:38:20.962583Z absattachment articleinfo articlenumber articletitlenorm authfirstinitialnorm authfirstsurnamenorm cid cids contenttype copyright crossmark dateloaded dateloadedtxt datesearch datesort dateupdated dco docsubtype doctype doi eid ewtransactionid hubeid indexeddate issn issnnorm itemstage itemtransactionid itemweight openaccess openarchive pg pgfirst pii piinorm pubdateend pubdatestart pubdatetxt pubyr sectiontitle sortorder srctitle srctitlenorm srctype ssids alllist content subj subheadings suppl tomb volfirst volissue volumelist webpdf webpdfpagecount yearnav figure table e-component body acknowledge affil appendices articletitle auth authfirstini authfull authkeywords authlast grantnumber grantsponsor grantsponsorid highlightsabst orcid primabst pubtype ref specialabst 2468-8231 24688231 true 569 569 C Volume 569 42 114572 114572 114572 202412 December 2024 2024-12-01 2024-12-31 2024 Regular Papers article fla © 2024 Elsevier B.V. All rights are reserved, including those for text and data mining, AI training, and similar technologies. ENVIRONMENTFRIENDLYHETEROGENEOUSPOLYIONICLIQUIDSIMMOBILIZEDPOLYOXOMETALATECATALYSTSTOWARDSEFFICIENTOXIDATIONALKENES LIU Q 1 Introduction 2 Experimental section 2.1 Reagents 2.2 Synthesis of quaternization reagents 1,4-bis((1H-imidazol-1-yl)methyl)benzene (BB), (1E,1′E)−1,1′-(1,4-phenylene)bis(N-(3-(1H-imidazol-1-yl)propyl)methanimine) (PP), and 2,4,6-tri(1H-imidazol-1-yl)−1,3,5-triazine (TT) 2.3 Preparation of different catalysts 2.4 Catalysts characterization 2.5 Catalytic tests 3 Results and discussion 3.1 Catalysts characterization 3.2 Catalytic activity 4 Conclusions CRediT authorship contribution statement Acknowledgements Appendix Supplementary materials References LENG 2015 170 176 Y RADMAN 2020 265 274 R YUANA 2012 56 60 C CHANG 2022 Y ZHAO 2020 X BREGANTE 2020 10169 10184 D MAKSIMCHUK 2018 9722 9737 N ZHANG 2010 318 322 Z MIALANE 2021 6152 6220 P SAMANIYAN 2019 10174 10191 M CAI 2018 4869 4876 L LIU 2024 C JIN 2019 33 M MAKSIMCHUK 2010 2920 2930 N WANG 2019 Y EVTUSHOK 2022 V LI 2018 188 197 T WANG 2023 1271 L LIU 2021 147 152 J SHI 2017 4426 4436 Y ZHAO 2016 1022 1028 J LENG 2015 17709 17715 Y HOU 2021 3059 3063 S LI 2022 3433 3460 G HOU 2019 1455 1460 S YU 2018 867 871 X LI 2021 1251 1260 J JIAO 2021 39404 39413 S WANG 2023 30312 30319 S SARKAR 2022 3070 3083 S YANG 2015 19613 19619 Z PETTERSSON 2008 1549 1557 S ZHANG 2021 2833 3841 R WANG 2020 Y YANG 2014 3724 3728 Z ISHIKAWA 2022 7693 7708 S PAN 2019 886 895 H SONG 2016 32 39 X MOHAMED 2022 S YU 2022 442 Q YADAV 2022 769 778 C LENG 2016 99 103 Y ZHANG 2023 146 154 Z DING 2004 161 170 Y WATANABE 1999 281 289 Y YANG 2021 8474 8487 L LIUX2024X114572 LIUX2024X114572XQ 2026-09-25T00:00:00.000Z 2026-09-25T00:00:00.000Z http://creativecommons.org/licenses/by-nc-nd/4.0/ © 2024 Elsevier B.V. All rights are reserved, including those for text and data mining, AI training, and similar technologies. 2024-09-21T08:21:47.447Z http://vtw.elsevier.com/data/voc/AddOnTypes/50.7/aggregated-refined Natural Science Foundation of China 22102198 22272187 NSFC National Natural Science Foundation of China http://data.elsevier.com/vocabulary/SciValFunders/501100001809 http://sws.geonames.org/1814991 Science and Technology Plan of Gansu Province 23JRRA568 Science and Technology Program of Gansu Province http://data.elsevier.com/vocabulary/SciValFunders/501100018554 http://sws.geonames.org/1814991/ Chinese Academy of Science CAS Chinese Academy of Sciences http://data.elsevier.com/vocabulary/SciValFunders/501100002367 http://sws.geonames.org/1814991/ Major Science and Technology Projects of Gansu Province 22ZD6GA003 23ZDFA016 Major Science and Technology Project of Hainan Province http://data.elsevier.com/vocabulary/SciValFunders/501100013072 http://sws.geonames.org/1814991/ This work was funded by the Natural Science Foundation of China ( 22272187 and 22102198 ), the Major Science and Technology Projects of Gansu Province ( 22ZD6GA003, 23ZDFA016 ), the Basic Research Creative Groups Project of the Science and Technology Plan of Gansu Province ( 23JRRA568 ) and the Light of West China of the Chinese Academy of Science (CAS) . https://doi.org/10.15223/policy-017 https://doi.org/10.15223/policy-037 https://doi.org/10.15223/policy-012 https://doi.org/10.15223/policy-029 https://doi.org/10.15223/policy-004 item S2468-8231(24)00754-5 S2468823124007545 1-s2.0-S2468823124007545 10.1016/j.mcat.2024.114572 315758 2024-11-15T17:47:59.133994Z 2024-12-01 2024-12-31 1-s2.0-S2468823124007545-main.pdf https://s3-eu-west-1.amazonaws.com/prod-ucs-content-store-eu-west/content/pii:S2468823124007545/MAIN/application/pdf/4a5b296ae0721f928ebf0db59c60af08/main.pdf main.pdf pdf true 4714658 MAIN 10 1-s2.0-S2468823124007545-main_1.png https://s3-eu-west-1.amazonaws.com/prod-ucs-content-store-eu-west/content/pii:S2468823124007545/PREVIEW/image/png/2f21069f5af651f2596e6815190ba7ff/main_1.png main_1.png png 61182 849 656 IMAGE-WEB-PDF 1 1-s2.0-S2468823124007545-fx10.jpg https://s3-eu-west-1.amazonaws.com/prod-ucs-content-store-eu-west/content/pii:S2468823124007545/fx10/DOWNSAMPLED/image/jpeg/958604a5dd6127509e58fd63fcc46565/fx10.jpg fx10 fx10.jpg jpg 1340 35 66 IMAGE-DOWNSAMPLED 1-s2.0-S2468823124007545-ga1.jpg https://s3-eu-west-1.amazonaws.com/prod-ucs-content-store-eu-west/content/pii:S2468823124007545/ga1/DOWNSAMPLED/image/jpeg/6f4a3f634cc8b183d45b757e3c4a4641/ga1.jpg ga1 true ga1.jpg jpg 46965 200 452 IMAGE-DOWNSAMPLED 1-s2.0-S2468823124007545-fx13.jpg https://s3-eu-west-1.amazonaws.com/prod-ucs-content-store-eu-west/content/pii:S2468823124007545/fx13/DOWNSAMPLED/image/jpeg/3ed6810ea3a3be50d8050acf583417bf/fx13.jpg fx13 fx13.jpg jpg 943 33 55 IMAGE-DOWNSAMPLED 1-s2.0-S2468823124007545-fx11.jpg https://s3-eu-west-1.amazonaws.com/prod-ucs-content-store-eu-west/content/pii:S2468823124007545/fx11/DOWNSAMPLED/image/jpeg/bc2206dd67e8918d76f8ee47630522b6/fx11.jpg fx11 fx11.jpg jpg 1166 29 65 IMAGE-DOWNSAMPLED 1-s2.0-S2468823124007545-fx12.jpg https://s3-eu-west-1.amazonaws.com/prod-ucs-content-store-eu-west/content/pii:S2468823124007545/fx12/DOWNSAMPLED/image/jpeg/66a21464b03ee6669e249c1c0c55bfb5/fx12.jpg fx12 fx12.jpg jpg 1115 29 73 IMAGE-DOWNSAMPLED 1-s2.0-S2468823124007545-gr7.jpg https://s3-eu-west-1.amazonaws.com/prod-ucs-content-store-eu-west/content/pii:S2468823124007545/gr7/DOWNSAMPLED/image/jpeg/4137c24e9ae896f23ab60a344f661919/gr7.jpg gr7 gr7.jpg jpg 40890 180 752 IMAGE-DOWNSAMPLED 1-s2.0-S2468823124007545-gr8.jpg https://s3-eu-west-1.amazonaws.com/prod-ucs-content-store-eu-west/content/pii:S2468823124007545/gr8/DOWNSAMPLED/image/jpeg/031a290cd669c47e5aa35df1f5b2804c/gr8.jpg gr8 gr8.jpg jpg 46535 231 627 IMAGE-DOWNSAMPLED 1-s2.0-S2468823124007545-gr5.jpg https://s3-eu-west-1.amazonaws.com/prod-ucs-content-store-eu-west/content/pii:S2468823124007545/gr5/DOWNSAMPLED/image/jpeg/eb6df2116660326053a41819202e1d3a/gr5.jpg gr5 gr5.jpg jpg 97856 394 597 IMAGE-DOWNSAMPLED 1-s2.0-S2468823124007545-gr6.jpg https://s3-eu-west-1.amazonaws.com/prod-ucs-content-store-eu-west/content/pii:S2468823124007545/gr6/DOWNSAMPLED/image/jpeg/23ded0ac0c5098104bb22ea1f797530c/gr6.jpg gr6 gr6.jpg jpg 51039 440 603 IMAGE-DOWNSAMPLED 1-s2.0-S2468823124007545-gr3.jpg https://s3-eu-west-1.amazonaws.com/prod-ucs-content-store-eu-west/content/pii:S2468823124007545/gr3/DOWNSAMPLED/image/jpeg/50721284787020bffd3e9aa0463706aa/gr3.jpg gr3 gr3.jpg jpg 63172 340 666 IMAGE-DOWNSAMPLED 1-s2.0-S2468823124007545-gr4.jpg https://s3-eu-west-1.amazonaws.com/prod-ucs-content-store-eu-west/content/pii:S2468823124007545/gr4/DOWNSAMPLED/image/jpeg/3cbe82045327f52b4abe5f918e5d7b1a/gr4.jpg gr4 gr4.jpg jpg 48471 187 762 IMAGE-DOWNSAMPLED 1-s2.0-S2468823124007545-gr1.jpg https://s3-eu-west-1.amazonaws.com/prod-ucs-content-store-eu-west/content/pii:S2468823124007545/gr1/DOWNSAMPLED/image/jpeg/a0ff720669bd80c660e2008510cb2443/gr1.jpg gr1 gr1.jpg jpg 35830 322 493 IMAGE-DOWNSAMPLED 1-s2.0-S2468823124007545-fx8.jpg https://s3-eu-west-1.amazonaws.com/prod-ucs-content-store-eu-west/content/pii:S2468823124007545/fx8/DOWNSAMPLED/image/jpeg/51e9cd9c2a296f72bf644e7f8dd62cee/fx8.jpg fx8 fx8.jpg jpg 1270 35 67 IMAGE-DOWNSAMPLED 1-s2.0-S2468823124007545-gr2.jpg https://s3-eu-west-1.amazonaws.com/prod-ucs-content-store-eu-west/content/pii:S2468823124007545/gr2/DOWNSAMPLED/image/jpeg/d3cbe6a60bc23a8f0353ef925883f855/gr2.jpg gr2 gr2.jpg jpg 38901 314 593 IMAGE-DOWNSAMPLED 1-s2.0-S2468823124007545-fx9.jpg https://s3-eu-west-1.amazonaws.com/prod-ucs-content-store-eu-west/content/pii:S2468823124007545/fx9/DOWNSAMPLED/image/jpeg/7ea220fdd46b9e257022c9e251b19045/fx9.jpg fx9 fx9.jpg jpg 1236 33 74 IMAGE-DOWNSAMPLED 1-s2.0-S2468823124007545-fx6.jpg https://s3-eu-west-1.amazonaws.com/prod-ucs-content-store-eu-west/content/pii:S2468823124007545/fx6/DOWNSAMPLED/image/jpeg/b41b75afb34a849e4f00cc0899a38140/fx6.jpg fx6 fx6.jpg jpg 1144 43 36 IMAGE-DOWNSAMPLED 1-s2.0-S2468823124007545-fx7.jpg https://s3-eu-west-1.amazonaws.com/prod-ucs-content-store-eu-west/content/pii:S2468823124007545/fx7/DOWNSAMPLED/image/jpeg/1271cd5c3d362c265ebaf4d545077516/fx7.jpg fx7 fx7.jpg jpg 1313 41 56 IMAGE-DOWNSAMPLED 1-s2.0-S2468823124007545-fx4.jpg https://s3-eu-west-1.amazonaws.com/prod-ucs-content-store-eu-west/content/pii:S2468823124007545/fx4/DOWNSAMPLED/image/jpeg/1d89575330a9ab56d5fa51f87a333cb5/fx4.jpg fx4 fx4.jpg jpg 952 47 40 IMAGE-DOWNSAMPLED 1-s2.0-S2468823124007545-fx5.jpg https://s3-eu-west-1.amazonaws.com/prod-ucs-content-store-eu-west/content/pii:S2468823124007545/fx5/DOWNSAMPLED/image/jpeg/92cfa63067a1814ab9a904e752a379f3/fx5.jpg fx5 fx5.jpg jpg 1076 39 53 IMAGE-DOWNSAMPLED 1-s2.0-S2468823124007545-fx2.jpg https://s3-eu-west-1.amazonaws.com/prod-ucs-content-store-eu-west/content/pii:S2468823124007545/fx2/DOWNSAMPLED/image/jpeg/af9d0ff2368dfd49d997d2e3724c24b6/fx2.jpg fx2 fx2.jpg jpg 840 34 32 IMAGE-DOWNSAMPLED 1-s2.0-S2468823124007545-sc1.jpg https://s3-eu-west-1.amazonaws.com/prod-ucs-content-store-eu-west/content/pii:S2468823124007545/sc1/DOWNSAMPLED/image/jpeg/f5ef5e4ecbbeddb0f9fe91041b66c97b/sc1.jpg sc1 sc1.jpg jpg 21094 151 762 IMAGE-DOWNSAMPLED 1-s2.0-S2468823124007545-fx3.jpg https://s3-eu-west-1.amazonaws.com/prod-ucs-content-store-eu-west/content/pii:S2468823124007545/fx3/DOWNSAMPLED/image/jpeg/2ec057cf5600877afaf0d1871b760ec0/fx3.jpg fx3 fx3.jpg jpg 1152 35 54 IMAGE-DOWNSAMPLED 1-s2.0-S2468823124007545-fx1.jpg https://s3-eu-west-1.amazonaws.com/prod-ucs-content-store-eu-west/content/pii:S2468823124007545/fx1/DOWNSAMPLED/image/jpeg/ffe87957eb1958639a495a2add45eae8/fx1.jpg fx1 fx1.jpg jpg 10461 106 470 IMAGE-DOWNSAMPLED 1-s2.0-S2468823124007545-fx10.sml https://s3-eu-west-1.amazonaws.com/prod-ucs-content-store-eu-west/content/pii:S2468823124007545/fx10/THUMBNAIL/image/gif/888f4673d180364bd9a65947e0c4ba8c/fx10.sml fx10 fx10.sml sml 4400 117 219 IMAGE-THUMBNAIL 1-s2.0-S2468823124007545-ga1.sml https://s3-eu-west-1.amazonaws.com/prod-ucs-content-store-eu-west/content/pii:S2468823124007545/ga1/THUMBNAIL/image/gif/fb99508a2429cff544ec98d177b12379/ga1.sml ga1 true ga1.sml sml 11883 97 219 IMAGE-THUMBNAIL 1-s2.0-S2468823124007545-fx13.sml https://s3-eu-west-1.amazonaws.com/prod-ucs-content-store-eu-west/content/pii:S2468823124007545/fx13/THUMBNAIL/image/gif/c75d1123924216da02018b13720fa5a2/fx13.sml fx13 fx13.sml sml 4164 133 219 IMAGE-THUMBNAIL 1-s2.0-S2468823124007545-fx11.sml https://s3-eu-west-1.amazonaws.com/prod-ucs-content-store-eu-west/content/pii:S2468823124007545/fx11/THUMBNAIL/image/gif/81286f9ba6db7c05bf7b40481e241e75/fx11.sml fx11 fx11.sml sml 3941 98 219 IMAGE-THUMBNAIL 1-s2.0-S2468823124007545-fx12.sml https://s3-eu-west-1.amazonaws.com/prod-ucs-content-store-eu-west/content/pii:S2468823124007545/fx12/THUMBNAIL/image/gif/1fedb1d76f0d657c8d178a3137a920a5/fx12.sml fx12 fx12.sml sml 3477 88 219 IMAGE-THUMBNAIL 1-s2.0-S2468823124007545-gr7.sml https://s3-eu-west-1.amazonaws.com/prod-ucs-content-store-eu-west/content/pii:S2468823124007545/gr7/THUMBNAIL/image/gif/0a06f43c15d253adbc879bc7f2014bd6/gr7.sml gr7 gr7.sml sml 6551 52 219 IMAGE-THUMBNAIL 1-s2.0-S2468823124007545-gr8.sml https://s3-eu-west-1.amazonaws.com/prod-ucs-content-store-eu-west/content/pii:S2468823124007545/gr8/THUMBNAIL/image/gif/f336010fac956cf8c341587d4153bf14/gr8.sml gr8 gr8.sml sml 8198 81 219 IMAGE-THUMBNAIL 1-s2.0-S2468823124007545-gr5.sml https://s3-eu-west-1.amazonaws.com/prod-ucs-content-store-eu-west/content/pii:S2468823124007545/gr5/THUMBNAIL/image/gif/c4dc8aaa78c75b05a742ea36ac2c1290/gr5.sml gr5 gr5.sml sml 26471 144 219 IMAGE-THUMBNAIL 1-s2.0-S2468823124007545-gr6.sml https://s3-eu-west-1.amazonaws.com/prod-ucs-content-store-eu-west/content/pii:S2468823124007545/gr6/THUMBNAIL/image/gif/3afbe3eff5972183b2cc4800c3c6834f/gr6.sml gr6 gr6.sml sml 9139 160 219 IMAGE-THUMBNAIL 1-s2.0-S2468823124007545-gr3.sml https://s3-eu-west-1.amazonaws.com/prod-ucs-content-store-eu-west/content/pii:S2468823124007545/gr3/THUMBNAIL/image/gif/9134f74d0ebd6e19163d28a11c414ec8/gr3.sml gr3 gr3.sml sml 10101 112 219 IMAGE-THUMBNAIL 1-s2.0-S2468823124007545-gr4.sml https://s3-eu-west-1.amazonaws.com/prod-ucs-content-store-eu-west/content/pii:S2468823124007545/gr4/THUMBNAIL/image/gif/d4995f1659e2557bf8953963722e95c2/gr4.sml gr4 gr4.sml sml 6868 54 219 IMAGE-THUMBNAIL 1-s2.0-S2468823124007545-gr1.sml https://s3-eu-west-1.amazonaws.com/prod-ucs-content-store-eu-west/content/pii:S2468823124007545/gr1/THUMBNAIL/image/gif/44fd0f229d1e5779adc3f845cafa8240/gr1.sml gr1 gr1.sml sml 9103 143 219 IMAGE-THUMBNAIL 1-s2.0-S2468823124007545-fx8.sml https://s3-eu-west-1.amazonaws.com/prod-ucs-content-store-eu-west/content/pii:S2468823124007545/fx8/THUMBNAIL/image/gif/8b55ab73ec6b9758d7999331e0b03829/fx8.sml fx8 fx8.sml sml 3895 115 219 IMAGE-THUMBNAIL 1-s2.0-S2468823124007545-gr2.sml https://s3-eu-west-1.amazonaws.com/prod-ucs-content-store-eu-west/content/pii:S2468823124007545/gr2/THUMBNAIL/image/gif/8eda43eb878db4d6300c81845f252b3a/gr2.sml gr2 gr2.sml sml 10664 116 219 IMAGE-THUMBNAIL 1-s2.0-S2468823124007545-fx9.sml https://s3-eu-west-1.amazonaws.com/prod-ucs-content-store-eu-west/content/pii:S2468823124007545/fx9/THUMBNAIL/image/gif/964b0afe598745f682818e494f43ced1/fx9.sml fx9 fx9.sml sml 3750 96 219 IMAGE-THUMBNAIL 1-s2.0-S2468823124007545-fx6.sml https://s3-eu-west-1.amazonaws.com/prod-ucs-content-store-eu-west/content/pii:S2468823124007545/fx6/THUMBNAIL/image/gif/e857390b648fc188d4d24bb5ae2ce5a5/fx6.sml fx6 fx6.sml sml 4277 191 161 IMAGE-THUMBNAIL 1-s2.0-S2468823124007545-fx7.sml https://s3-eu-west-1.amazonaws.com/prod-ucs-content-store-eu-west/content/pii:S2468823124007545/fx7/THUMBNAIL/image/gif/e3667f98a6380a6bb5180ea50cef5a38/fx7.sml fx7 fx7.sml sml 5322 162 219 IMAGE-THUMBNAIL 1-s2.0-S2468823124007545-fx4.sml https://s3-eu-west-1.amazonaws.com/prod-ucs-content-store-eu-west/content/pii:S2468823124007545/fx4/THUMBNAIL/image/gif/8bacb870054d0ca5de55d9ace76c4ab6/fx4.sml fx4 fx4.sml sml 3898 206 177 IMAGE-THUMBNAIL 1-s2.0-S2468823124007545-fx5.sml https://s3-eu-west-1.amazonaws.com/prod-ucs-content-store-eu-west/content/pii:S2468823124007545/fx5/THUMBNAIL/image/gif/1d1ef5ad07626065b16c443f8dbfaffd/fx5.sml fx5 fx5.sml sml 4543 161 219 IMAGE-THUMBNAIL 1-s2.0-S2468823124007545-fx2.sml https://s3-eu-west-1.amazonaws.com/prod-ucs-content-store-eu-west/content/pii:S2468823124007545/fx2/THUMBNAIL/image/gif/c3ef370b74e0c36cc5ab3f68f5b2cbc9/fx2.sml fx2 fx2.sml sml 3594 151 143 IMAGE-THUMBNAIL 1-s2.0-S2468823124007545-sc1.sml https://s3-eu-west-1.amazonaws.com/prod-ucs-content-store-eu-west/content/pii:S2468823124007545/sc1/THUMBNAIL/image/gif/bd7a4b08e4e244e6ed9203698f3e20dd/sc1.sml sc1 sc1.sml sml 4877 43 219 IMAGE-THUMBNAIL 1-s2.0-S2468823124007545-fx3.sml https://s3-eu-west-1.amazonaws.com/prod-ucs-content-store-eu-west/content/pii:S2468823124007545/fx3/THUMBNAIL/image/gif/b7e9819a1f2031269314cda92cfa7cdc/fx3.sml fx3 fx3.sml sml 4841 141 219 IMAGE-THUMBNAIL 1-s2.0-S2468823124007545-fx1.sml https://s3-eu-west-1.amazonaws.com/prod-ucs-content-store-eu-west/content/pii:S2045232217019940/fx1/THUMBNAIL/image/gif/86d95b4d5d05509fecba0bdd6afba062/fx1.sml fx1 fx1.sml sml 2682 50 219 IMAGE-THUMBNAIL 1-s2.0-S2468823124007545-fx10_lrg.jpg https://s3-eu-west-1.amazonaws.com/prod-ucs-content-store-eu-west/content/pii:S2468823124007545/HIGHRES/image/jpeg/a0d9499b6e62233d665d242aaa45aed1/fx10_lrg.jpg fx10 fx10_lrg.jpg jpg 7519 156 293 IMAGE-HIGH-RES 1-s2.0-S2468823124007545-ga1_lrg.jpg https://s3-eu-west-1.amazonaws.com/prod-ucs-content-store-eu-west/content/pii:S2468823124007545/HIGHRES/image/jpeg/b13ae036783de409361f7aae07fdf71b/ga1_lrg.jpg ga1 true ga1_lrg.jpg jpg 367037 886 2000 IMAGE-HIGH-RES 1-s2.0-S2468823124007545-fx13_lrg.jpg https://s3-eu-west-1.amazonaws.com/prod-ucs-content-store-eu-west/content/pii:S2468823124007545/HIGHRES/image/jpeg/973967f8006a146d8d735343ebf306fd/fx13_lrg.jpg fx13 fx13_lrg.jpg jpg 5172 149 245 IMAGE-HIGH-RES 1-s2.0-S2468823124007545-fx11_lrg.jpg https://s3-eu-west-1.amazonaws.com/prod-ucs-content-store-eu-west/content/pii:S2468823124007545/HIGHRES/image/jpeg/1ee502a5c220bfb4dd5366b53ca5b60a/fx11_lrg.jpg fx11 fx11_lrg.jpg jpg 6690 130 291 IMAGE-HIGH-RES 1-s2.0-S2468823124007545-fx12_lrg.jpg https://s3-eu-west-1.amazonaws.com/prod-ucs-content-store-eu-west/content/pii:S2468823124007545/HIGHRES/image/jpeg/2b8b638e5491dad064b508fb75a43f57/fx12_lrg.jpg fx12 fx12_lrg.jpg jpg 6696 130 324 IMAGE-HIGH-RES 1-s2.0-S2468823124007545-gr7_lrg.jpg https://s3-eu-west-1.amazonaws.com/prod-ucs-content-store-eu-west/content/pii:S2468823124007545/HIGHRES/image/jpeg/346214662751d060e0c015abc1d370bc/gr7_lrg.jpg gr7 gr7_lrg.jpg jpg 246990 797 3330 IMAGE-HIGH-RES 1-s2.0-S2468823124007545-gr8_lrg.jpg https://s3-eu-west-1.amazonaws.com/prod-ucs-content-store-eu-west/content/pii:S2468823124007545/HIGHRES/image/jpeg/1c91138940dfed2ea266ba06082b99d7/gr8_lrg.jpg gr8 gr8_lrg.jpg jpg 348230 1024 2776 IMAGE-HIGH-RES 1-s2.0-S2468823124007545-gr5_lrg.jpg https://s3-eu-west-1.amazonaws.com/prod-ucs-content-store-eu-west/content/pii:S2468823124007545/HIGHRES/image/jpeg/7ec66e1db05215fbab476894b983d324/gr5_lrg.jpg gr5 gr5_lrg.jpg jpg 956615 1742 2642 IMAGE-HIGH-RES 1-s2.0-S2468823124007545-gr6_lrg.jpg https://s3-eu-west-1.amazonaws.com/prod-ucs-content-store-eu-west/content/pii:S2468823124007545/HIGHRES/image/jpeg/f6864e4ec0c7e58a3d680fe870eeb364/gr6_lrg.jpg gr6 gr6_lrg.jpg jpg 383587 1951 2671 IMAGE-HIGH-RES 1-s2.0-S2468823124007545-gr3_lrg.jpg https://s3-eu-west-1.amazonaws.com/prod-ucs-content-store-eu-west/content/pii:S2468823124007545/HIGHRES/image/jpeg/43069b81b1899fa82cb87c96d30182d3/gr3_lrg.jpg gr3 gr3_lrg.jpg jpg 475459 1506 2950 IMAGE-HIGH-RES 1-s2.0-S2468823124007545-gr4_lrg.jpg https://s3-eu-west-1.amazonaws.com/prod-ucs-content-store-eu-west/content/pii:S2468823124007545/HIGHRES/image/jpeg/0fd3a36d2b8f43670b5e1be2b11ac42a/gr4_lrg.jpg gr4 gr4_lrg.jpg jpg 353233 830 3374 IMAGE-HIGH-RES 1-s2.0-S2468823124007545-gr1_lrg.jpg https://s3-eu-west-1.amazonaws.com/prod-ucs-content-store-eu-west/content/pii:S2468823124007545/HIGHRES/image/jpeg/1f6cec55125ba082d91545c6057f6643/gr1_lrg.jpg gr1 gr1_lrg.jpg jpg 296585 1428 2185 IMAGE-HIGH-RES 1-s2.0-S2468823124007545-fx8_lrg.jpg https://s3-eu-west-1.amazonaws.com/prod-ucs-content-store-eu-west/content/pii:S2468823124007545/HIGHRES/image/jpeg/04529e6a933de8f8ef519ec3f7c79bc0/fx8_lrg.jpg fx8 fx8_lrg.jpg jpg 6939 156 298 IMAGE-HIGH-RES 1-s2.0-S2468823124007545-gr2_lrg.jpg https://s3-eu-west-1.amazonaws.com/prod-ucs-content-store-eu-west/content/pii:S2468823124007545/HIGHRES/image/jpeg/90603c34b5c89fdcdf9c9263da5577b1/gr2_lrg.jpg gr2 gr2_lrg.jpg jpg 284959 1392 2628 IMAGE-HIGH-RES 1-s2.0-S2468823124007545-fx9_lrg.jpg https://s3-eu-west-1.amazonaws.com/prod-ucs-content-store-eu-west/content/pii:S2468823124007545/HIGHRES/image/jpeg/d10322f8e848b29243a1316ddf2433b0/fx9_lrg.jpg fx9 fx9_lrg.jpg jpg 7523 145 330 IMAGE-HIGH-RES 1-s2.0-S2468823124007545-fx6_lrg.jpg https://s3-eu-west-1.amazonaws.com/prod-ucs-content-store-eu-west/content/pii:S2468823124007545/HIGHRES/image/jpeg/36e4f404a9556f623a227edbf52a57ab/fx6_lrg.jpg fx6 fx6_lrg.jpg jpg 5809 191 161 IMAGE-HIGH-RES 1-s2.0-S2468823124007545-fx7_lrg.jpg https://s3-eu-west-1.amazonaws.com/prod-ucs-content-store-eu-west/content/pii:S2468823124007545/HIGHRES/image/jpeg/f8525d9600891dba771664f708524d71/fx7_lrg.jpg fx7 fx7_lrg.jpg jpg 7338 183 248 IMAGE-HIGH-RES 1-s2.0-S2468823124007545-fx4_lrg.jpg https://s3-eu-west-1.amazonaws.com/prod-ucs-content-store-eu-west/content/pii:S2468823124007545/HIGHRES/image/jpeg/9de3eebfda08b47e00985b5fb50b98ff/fx4_lrg.jpg fx4 fx4_lrg.jpg jpg 5146 206 177 IMAGE-HIGH-RES 1-s2.0-S2468823124007545-fx5_lrg.jpg https://s3-eu-west-1.amazonaws.com/prod-ucs-content-store-eu-west/content/pii:S2468823124007545/HIGHRES/image/jpeg/89b7672e349b446e4ed20041a60141c8/fx5_lrg.jpg fx5 fx5_lrg.jpg jpg 5800 175 238 IMAGE-HIGH-RES 1-s2.0-S2468823124007545-fx2_lrg.jpg https://s3-eu-west-1.amazonaws.com/prod-ucs-content-store-eu-west/content/pii:S2468823124007545/HIGHRES/image/jpeg/0ce0995706b94607639d43e26168b564/fx2_lrg.jpg fx2 fx2_lrg.jpg jpg 4255 151 143 IMAGE-HIGH-RES 1-s2.0-S2468823124007545-sc1_lrg.jpg https://s3-eu-west-1.amazonaws.com/prod-ucs-content-store-eu-west/content/pii:S2045232217019940/HIGHRES/image/jpeg/294c9a2490bf6be34ade0bd7af5dc9b6/sc1_lrg.jpg sc1 sc1_lrg.jpg jpg 163767 668 3372 IMAGE-HIGH-RES 1-s2.0-S2468823124007545-fx3_lrg.jpg https://s3-eu-west-1.amazonaws.com/prod-ucs-content-store-eu-west/content/pii:S2045232217019940/HIGHRES/image/jpeg/874213779134880d65908b9a170d75c2/fx3_lrg.jpg fx3 fx3_lrg.jpg jpg 6293 156 243 IMAGE-HIGH-RES 1-s2.0-S2468823124007545-fx1_lrg.jpg https://s3-eu-west-1.amazonaws.com/prod-ucs-content-store-eu-west/content/pii:S2045232217019940/HIGHRES/image/jpeg/693c82c495f182b2b1c98a39ad86934e/fx1_lrg.jpg fx1 fx1_lrg.jpg jpg 76828 471 2083 IMAGE-HIGH-RES 1-s2.0-S2468823124007545-mmc1.docx https://s3-eu-west-1.amazonaws.com/prod-ucs-content-store-eu-west/content/pii:S2468823124007545/mmc1/MAIN/application/vnd.openxmlformats-officedocument.wordprocessingml.document/6d6c51df56ed22bfcd16a1663fc25467/mmc1.docx mmc1 mmc1.docx docx 8535411 APPLICATION MCAT 114572 114572 S2468-8231(24)00754-5 10.1016/j.mcat.2024.114572 Elsevier B.V. Fig. 1 The comparison of different methods for immobilizing polyoxometalates immobilized onto PILs. Fig 1 Fig. 2 The structure of quaternization reagents BB, PP, and TT. Fig 2 Fig. 3 (a), (b) and (c) XPS spectrum of N 1 s for PP, PIL-TB-2PP and PW-PIL-TB-2PP; (d), (e) and (f) XPS survey spectrum of PP, PIL-TB-2PP and PW-PIL-TB-2PP. Fig 3 Fig. 4 (a) FT-IR spectrum of PIL-TB-2PP and PW-PIL-TB-2PP. (b) XRD patterns of H3PW12O40, PIL-TB-2PP and PW-PIL-TB-2PP. (c) TG curves for PIL-TB-2PP and PW-PIL-TB-2PP. Fig 4 Fig. 5 SEM and elemental mapping images of PIL-TB-2PP and PW-PIL-TB-2PP. Fig 5 Fig. 6 (a) Effect of catalyst amount. cyclooctene (2.5 mmol, 0.29 g), H2O2 (4 mmol, 0.45 g), acetonitrile (3 mL), PW-PIL-TB-2PP, 70 °C, 4 h. (b) Effect of temperature. cyclooctene (2.5 mmol, 0.29 g), H2O2 (4 mmol, 0.45 g), acetonitrile (3 mL), PW-PIL-TB-2PP (0.1 g), 4 h. (c) Effect of reaction time. cyclooctene (2.5 mmol, 0.29 g), H2O2 (4 mmol, 0.45 g), acetonitrile (3 mL), PW-PIL-TB-2PP (0.1 g), 70 °C. (d) Effect of H2O2 amount. cyclooctene (2.5 mmol, 0.29 g), acetonitrile (3 mL), PW-PIL-TB-2PP (0.1 g), 70 °C, 4 h. Fig 6 Fig. 7 (a) Reusability of PW-PIL-TB-2PP: cyclooctene (2.5 mmol, 0.29 g), H2O2 (4 mmol, 0.45 g), acetonitrile (3 mL), catalyst (0.1 g), 70 °C, 4 h. (b) Reusability of PW-PIL-TB-2PP: cyclooctene (2.5 mmol, 0.29 g), H2O2 (4 mmol, 0.45 g), acetonitrile (3 mL), PW-PIL-TB-2PP (0.1 g), 1 h. (c) Heat filtration experiment of PW-PIL-TB-2PP. Fig 7 Fig. 8 (a) FT-IR spectra of PW-PIL-TB-2PP before and after utilization. (b) XRD patterns of PW-PIL-TB-2PP before and after utilization. Fig 8 Scheme 1 Schematic illustration of synthesis process of the PW-PIL-TB-2PP catalysts. Scheme 1 Table 1 Loading amount of polyoxometalates and textural properties of different catalysts. Table 1 Entry Catalyst Loading amount ration (%) SBET (m2g−1) a Vp (cm3g-1) b Dav (nm) c 1 PW-PIL-TB-2BB 125 0.06 0.00 430.6 2 PW-PIL-TB-2TT 270 5.07 0.02 185.8 3 PW-PIL-TB-2PP 455 9.90 0.04 160.2 4 SiW-PIL-TB-2PP 395 0.52 0.00 152.7 5 PMo-PIL-TB-2PP 273 13.97 0.05 149.9 6 PW-PIL-TB-4PP 534 8.85 0.04 189.5 7 PW-PIL-TM-2PP 542 11.31 0.07 251.2 8 PW@PDD (4) [ 20 ] 90 38 0.17 17.8 Loading amount ratio: mass of loaded polyoxometalates/mass of carriers. a BET surface area. b Total pore volume. c Average pore diameter. Table 2 The oxidation of cyclooctene over different catalysts a . Table 2 Entry Catalyst Conversion of cyclooctene (%) Selectivity of products (%) a b c 1 PW-PIL-TB-2PP b 0 0 0 0 2 PW-PIL-TB-2PP c 99 92 6 2 3 PMo-PIL-TB-2PP c 97 87 9 4 4 SiW-PIL-TB-2PP c 28 100 0 0 5 PW-PIL-TB-2PP d 99 98 1 0 6 PW-PIL-TB-2PP e 97 99 1 0 7 PW-PIL-TB-4PP e 99 91 6 3 8 PW-PIL-TB-2BB e 86 99 1 0 9 PW-PIL-TB-2TT e 90 99 1 0 10 PW-PIL-TM-2PP e 99 93 4 3 11 H3PW12O40 f 49 74 21 4 Reaction condition:. a Cyclooctene (2.5 mmol, 0.29 g), H2O2 (4 mmol, 0.45 g), acetonitrile (3 mL), 70 °C, 4 h;. b Adding 0.6 g PW-PIL-TB-2PP without H2O2;. c Catalyst: 0.3 g; d Catalyst: 0.2 g; e Catalyst: 0.1 g; f Catalyst: 0.084 g. Table 3 The oxidation of various substrates with H2O2 catalyzed by PW-PIL-TB-2P Table 3 Entry Substrate Product Temperature ( °C) Time (h) Amount of catalyst (g) Amount of H2O2 (mmol) Conversion (%) Selectivity (%) 1 60 4 0.05 1 33 99 2 70 4 0.1 4 99 0 (98 a ) 3 60 4 0.1 1 52 97 4 70 4 0.1 4 99 1 (64 b ) 5 60 4 0.1 1 41 99 6 70 4 0.1 4 99 43 (48 c ) 7 50 2 0.3 4 37 54 (40 d ) 8 70 4 0.2 4 89 22 (40 d ) 9 60 4 0.2 2 52 67 10 70 4 0.4 4 93 61 11 70 4 0.1 4 77 71 Reaction condition: substrate (2.5 mmol), acetonitrile (3 mL). a 1,2-Cyclopentanediol; b 1,2-Cyclohexanediol; c bicyclo[2.2.1]heptane-2,3-diol; d benzaldehyde. Research Paper Environment-friendly heterogeneous poly(ionic liquid)s immobilized polyoxometalate catalysts towards the efficient oxidation of alkenes Qiao Liu Writing – original draft Methodology Investigation Conceptualization a b Meirong Kang Validation a Weiguo Fang Validation a Hailong Liu Writing – review & editing Supervision a ⁎ Zhiwei Huang Writing – review & editing Supervision a ⁎ a State Key Laboratory of Low Carbon Catalysis and Carbon Dioxide Utilization, State Key Laboratory for Oxo Synthesis and Selective Oxidation, Lanzhou Institute of Chemical Physics, Chinese Academy of Sciences, Lanzhou 730000, China State Key Laboratory of Low Carbon Catalysis and Carbon Dioxide Utilization State Key Laboratory for Oxo Synthesis and Selective Oxidation Lanzhou Institute of Chemical Physics, Chinese Academy of Sciences Lanzhou 730000 China aState Key Laboratory of Low Carbon Catalysis and Carbon Dioxide Utilization, State Key Laboratory for Oxo Synthesis and Selective Oxidation, Lanzhou Institute of Chemical Physics, Chinese Academy of Sciences, Lanzhou 730000, China b University of Chinese Academy of Sciences, Beijing 100049, China University of Chinese Academy of Sciences Beijing 100049 China bUniversity of Chinese Academy of Sciences, Beijing 100049, China ⁎ Corresponding authors. A novel quaternization reagent of (1E,1′E)-1,1′-(1,4-phenylene)bis(N-(3-(1H-imidazol-1-yl)propyl)methanimine) (PP) was synthesized and used for the preparation of a series of poly(ionic liquid)s (PILs) via the quaternization reaction. These PILs were subsequently loaded with polyoxometalates (POMs) to create innovative catalysts for the oxidation of alkenes. Comprehensive structural analysis of the catalysts showed that these PILs exhibited a high loading amount ratio of up to 542 % for POMs, which were well-dispersed on the surface of PILs. The PILs loaded POMs catalysts, especially for PW-PIL-TB-2PP with H3PW12O40 as the POMs, displayed remarkable activity and stability in oxidizing cyclooctene, achieving a conversion rate of 97 % and a selectivity of 99 % for 1,2-epoxycyclooctane over six consecutive runs without notable loss. Furthermore, the PW-PIL-TB-2PP catalyst could also be used for the oxidation of a wide range of cyclic, linear, and aromatic alkenes. Graphical abstract Poly(ionic liquid)s-loaded polyoxometalates prepared via quaternization reaction are efficient and stable heterogeneous catalysts for clean oxidation of alkenes using H2O2 as the oxidant. Image, graphical abstract Keywords Quaternization reaction Poly(ionic liquid)s Polyoxometalates Alkenes Oxidation Data availability Data will be made available on request. 1 Introduction Oxidation of alkenes is a critical reaction for producing epoxy compounds [1], 1,2-diol compounds [2], aldehydes [3], and carboxylic acids [4], which are important raw materials in the chemical industry due to their wide range of applications. One of the primary methods for catalyzing alkene oxidation is the H2O2 oxidation method. H₂O₂ stands out as an exemplary oxidant due to its high active oxygen content, strong oxidizing capacity, and environmentally benign with the generation of water as byproduct. Therefore, the green oxidation of alkenes via H2O2 oxidation methods has attracted increasing attention in recent years [5–8]. Polyoxometalates (POMs) have garnered considerable attention as environmentally friendly catalysts within the catalysis research community [9–12]. Particularly, POMs have been proved to be high-efficiency homogeneous catalysts for the H₂O₂-based oxidation of alkenes [1]. To improve the catalysts recovery and reuse, significant efforts have been made to develop heterogeneous catalysts by immobilizing POMs [13,14]. Traditionally, the POMs were immobilized on various modified silicas and diverse molecular sieves [13,15], suffering from the limited number of silanol (Si–OH) groups on the surface of these carriers, which restricts the loading number of POMs (Fig. 1 (1)). To date, a range of novel carriers have been reported to enhance the loading of POMs, including carbon materials [16], metal oxides [17], organic framework materials [18], and polymeric materials [19]. Considering the limited assortment of carriers, it is still necessary to develop new carriers for POMs and to improve both their loading capacity and reusability. Poly(ionic liquid)s (PILs), characterized by their diverse types of ionic liquids and adjustable structures, coupled with the ease of separation and recovery of multiphase catalysts, are also employed as effective carriers for immobilizing POMs (Fig. 1(2)) [1,20–22]. Shi et al. synthesized tunable hydrophobic mesoporous PILs via free-radical polymerization, with POMs immobilized on these PILs with high dispersion and density. Because of strong cation-anion interactions and the affinity of catalyst with both substrate and oxidant, this system effectively epoxidized cyclooctene, achieving yields over 98 % with stable activity upon recovery [20]. Zhao et al. synthesized thermally stable amphiphilic POM-paired ionic hybrid catalysts via free radical polymerization. Their amphiphilic nature and mesoporous structure resulted in excellent performance, achieving over 99 % selectivity and conversion in the epoxidation of cyclooctene [21]. Leng et al. developed thermally stable, amphiphilic mesoporous POM-based ionic hybrid catalysts via free radical polymerization, achieving 100 % selectivity and 99 % conversion in the epoxidation of cyclooctene [1]. Despite the success of these PILs-based catalysts, the variety of reported PILs prepared through free-radical polymerization is relatively limited. Thus, it is still highly attractive to prepare more diverse and structurally adjustable PILs through alternative methods to expand the range of PILs-based carriers. Compared with free-radical polymerization, quaternization reaction can achieve simultaneous polymerization and ionization, thus offering an additive-free method to prepare PILs [23]. The ionic sites in PILs prepared via quaternization reaction typically reside at the junctions between monomers, existing in the form of pyridine or imidazole salts [24]. PILs prepared through quaternization reaction have been applied in catalysis [25], carbon dioxide fixation [26], radioactive ion and organic dye adsorption [27,28], and other fields [29]. Yu et al. reported an ionic porous organic framework with high ionic density and a nitrogen content of 20.3 wt%, catalyzing the CO2 cycloaddition of propylene oxide with 99 % yield at mild conditions of 25 °C and 0.1 MPa CO2 [26]. Suman et al. synthesized a thermally and chemically robust ionic porous organic polymer, which efficiently captured toxic oxo-anions and anionic dyes, and demonstrated effective photocatalytic degradation of cationic dyes under solar irradiation [30]. Given the relatively limited number of quaternization reaction monomers reported to date, it is imperative to design and synthesize novel quaternization reaction monomers for synthesizing PILs with unique structure and property. To the best of our knowledge, there are currently no reports in the literature on PILs, prepared via quaternization reaction, loaded POMs for catalyzing the oxidation of alkenes using H₂O₂ as the oxidant. Herein, we successfully synthesized a diverse range of quaternization reagents, which effectively reacted with cross-linkers, thereby enable the preparation of a series of PILs microspheres via a one-step quaternization reaction. These PILs exhibited a high loading amount ratio for POMs, which were well-dispersed on the surface of PILs. These catalysts, POMs, especially obtained by loading H3PW12O40 onto PILs, exhibited remarkable activity in the oxidation of cyclooctene using H2O2 as the oxidant. The structural characterization and evaluation of the recycling performance of the reused catalyst revealed that the catalyst possesses high stability and good reusability. As far as we know, this is the first example on using this method to prepare efficient heterogenous catalysts for the oxidation of alkenes. This work broadens the range of carriers for reactive POMs and creates novel catalysts for the oxidation of alkenes to produce useful oxygen-containing compounds. 2 Experimental section 2.1 Reagents N-(3-Aminopropyl)-imidazole (98 %) and 1,4-Phthalaldehyde (98 %) were obtained from Annaiji chemical reagent (Shanghai, China). Glyoxaline (99 %), Cyanuric chloride (99 %) and 1,4-Bis(chloromethyl)benzene (98 %) were obtained from Innochem chemical reagent (Beijing, China). Cyclooctene (95 %) were purchased from Aladdin Biochemical Technology Co., Ltd (Shanghai, China). 2,4,6-Tris(bromomethyl)mesitylene (98 %) and 1,2,4,5-Tetrakis(Bromomenthyl)benzene (98 %) were obtained from Adamas chemical reagent (Shanghai, China). H3PW12O40 (PW, AR) was purchased from Kunshan Xingbang Tungsten and Molybdenum Technology Co., Ltd (China). H3PMo12O40 (PMo, AR) was purchased from Sinopharm Chemical Reagent Co., Ltd. (China). H4SiW12O40 (SiW, AR) was obtained from Kermel Chemical Reagent Co., Ltd (China). All the reagents are used directly without further pretreatment. 2.2 Synthesis of quaternization reagents 1,4-bis((1H-imidazol-1-yl)methyl)benzene (BB), (1E,1′E)−1,1′-(1,4-phenylene)bis(N-(3-(1H-imidazol-1-yl)propyl)methanimine) (PP), and 2,4,6-tri(1H-imidazol-1-yl)−1,3,5-triazine (TT) The BB was prepared according to the literature with slight modifications [31]. Initially, NaOH (3 g, 75 mmol) was added to a solution of imidazole (4.08 g, 60 mmol) in THF. The resulting suspension was then refluxed at 70 °C for 2 h. Subsequently, 1,4-bis(chloromethyl)benzene (3.51 g, 20 mmol) was added to the residue and stirred at room temperature for 10 h, followed by an additional 14 h of stirring at 70 °C. After filtering the product, BB was obtained by removing the solvent under vacuum. 1H NMR (400 MHz, CD3OD): δ 7.71 (s, 2H), 7.23 (s, 4H), 7.07 (s, 2H), 6.96 (s, 2H), 5.19 (s, 4H). 13C NMR (101 MHz, CD3OD): δ 137.24 (s), 136.96 (s), 127.99 (s), 127.79 (s), 119.52 (s), 49.75 (s). Theoretical molecular weight of C14H14N4: 238.12. HRMS found C14H15N4: 239.12 [M + H]+. The PP was prepared according to the literature with minor modifications [32]. A mixture of 1,4-phthalaldehyde (10.73 g, 80 mmol) and N-(3-aminopropyl)-imidazole (20 g, 160 mmol) was dissolved in anhydrous MeOH (150 mL) and refluxed for 24 h. Subsequently, the product was obtained by removing the solvent under vacuum. 1H NMR (400 MHz, CD3OD): δ 8.34 (s, 1H), 7.81 (s, 2H), 7.67 (s, 1H), 7.16 (s, 1H), 6.96 (s, 1H), 4.14 (t, J = 6.9 Hz, 2H), 3.60 (t, J = 6.5 Hz, 2H), 2.30- 2.03 (m, 2H). 13C NMR (101 MHz, CD3OD): δ 162.42 (s), 138.05 (s), 137.10 (s), 128.21 (s), 127.76 (s), 119.23 (s), 57.47 (s), 44.49 (s), 31.59 (s). Theoretical molecular weight of C20H24N6: 348.21. HRMS found C20H25N6: 349.21 [M + H]+. The TT was synthesized according to the literature and the structure was accurately confirmed by 1H NMR, 13C NMR and HRMS [33]. 1H NMR (400 MHz, DMSO): δ 9.10 (s, 3H), 8.35 (s, 3H), 7.27 (s, 3H). 13C NMR (101 MHz, DMSO): δ 162.57 (s), 138.05 (s), 131.82 (s), 117.84 (s). Theoretical molecular weight of C12H9N9: 279.10. HRMS found C12H10N9: 280.10 [M + H]+. 2.3 Preparation of different catalysts The synthesis of the PILs loaded POMs catalysts is illustrated in Scheme 1 . As a representative example, the synthesis of PIL-TB-2PP support is described (TB=1,2,4,5-Tetrakis(Bromomenthyl)benzene, and the 2 represents the molar ratio of TB: PP=1:2 during the quaternization reaction. Others are similar). Typically, TB (2.29 g, 5 mmol) and PP (3.48 g, 10 mmol) were dissolved in a 100 mL mixture of solvents consisting of 50 mL of ethyl acetate and 50 mL of DMF. The reaction mixture was vigorously stirred at room temperature for 4 h, followed by stirring at 50 °C for 10 h, and then at 90 °C for another 10 h. Upon completion of the reaction, the solid product was filtered, washed with ethyl acetate three times, and dried at 70 °C overnight. For the preparation of the POMs-loaded catalyst, PIL-TB-2PP (2.0 g) and H3PW12O40 (PW, 20 g) or H3PMo12O40 (PMo, 20 g) or H4SiW12O40 (SiW, 20 g) were dissolved in a 200 mL mixture of solvents (consisting of 100 mL of ethanol and 100 mL of deionized water). The mixture was stirred at 80 °C for 24 h. The resulting solid product was filtered, washed with boiled water three times, and dried at 70 °C overnight, yielding the corresponding catalyst of PW-PIL-TB-2PP or PMo-PIL-TB-2PP or SiW-PIL-TB-2PP. Similar synthetic procedures were employed for the preparation of other catalysts, with adjustments made only to the quaternization reagents and cross-linkers (see Scheme S1 and S2 for details). 2.4 Catalysts characterization Fourier transform infrared (FT-IR) spectra were obtained on a Bruker V70 system with a scan range of 400–4000 cm−1 using anhydrous KBr as pellets. Thermogravimetric (TG) analysis was conducted with a TGA/DSC 2 analyzer on the Netzsch STA 449 F3 simultaneous thermal analysis system between 30 and 800 °C in N2 atmosphere with a heating rate of 10 °C/min. The BET isotherms were recorded at 77 K with Micromeritics ASAP2460 apparatus. The samples were degassed for 8 h at 120 °C before the measurements. The pore size and volumes distributions were calculated by the Barrett-Joyner-Halenda (BJH) technique and the surface areas were estimated using the BET method. The scanning electron microscope (SEM) images were recorded on a ZEISS Sigma 300 (10 KV) to assess the particle dimensions and morphology. The transmission electron microscopy (TEM) images were obtained on a FEI Talos F200X. X-ray powder diffraction (XRD) analysis was performed on a Rigaku D/MAX-2400 diffractometer scanning 2θ from 5 to 80° Cu Kα radiation obtained at 40 kV and 30 mA was used as the X-ray source. The BET isotherms were recorded at 77 K with Micromeritics TriStar II 3020 apparatus. The samples were degassed for 10 h at 120 °C before the measurements. The XPS spectra were obtained using an Thermo Scientific K-Alpha X-ray photoelectron spectrometer with Al Kα X-rays as the excitation source. 2.5 Catalytic tests The catalytic activity was evaluated in the oxidation of the probe substrate cis-cyclooctene, using H2O2 as the oxidant and acetonitrile as the solvent. In a typical procedure, a mixture comprising cis-cyclooctene (2.5 mmol), acetonitrile (3 mL), H2O2 (30 %, 4 mmol), and the catalyst (0.1 g) was charged into a 20 mL thick-wall pressure bottle and stirred at 70 °C for 4 h. After reaction, the liquid phase was separated by centrifugation and quantitatively analyzed using mesitylene as the internal standard on a gas chromatograph (GC, Agilent 6820) equipped with a flame ionization detector (FID) and a capillary column (OV-1701, 30 m × 0.32 mm × 0.5 μm). 3 Results and discussion 3.1 Catalysts characterization X-ray photoelectron spectroscopy (XPS) tests were conducted to assess the composition and valence states of the elements in the catalysts. The N1s spectrum of PP can be deconvoluted into three peaks at 398.08 eV, 399.92 eV, and 400.68 eV, corresponding to N=C (Schiff base), N-C (imidazole), and N=C (imidazole) bonds, respectively (Fig. 3(a)) [28]. The N1s spectrum of PW-PIL-TB-2PP appears a new peak at 401.54 eV, which can be attributed to the N+=C (imidazole) formed after the quaternization reaction. Upon loading of POMs, the binding energy of N=C (Schiff base) and NC (imidazole) increased by 0.8 and 1.1 eV, respectively, which certified the strong chemical interaction between PW12O40 3− and PILs carriers (Fig. 3(c)) [20,28]. The XPS wide scan spectrum of PW-PIL‐TB-2PP showed the presence of C, N, O, P, and W (Fig. 3(f)), confirming the successful loading of POMs onto PILs. Similarly, the XPS survey spectra of other catalysts also affirmed the successful synthesis of various PILs through quaternization reaction, and the effective loading of POMs onto PILs (Fig. S10). Fig. 4(a) shows the Fourier transform infrared spectroscopy (FT-IR) spectra of PIL-TB-2PP and PW-PIL-TB-2PP. For PIL-TB-2PP, the vibrational bands at 1153 and 1635 cm−1 can be assigned to the C-N+ and C=N in the imidazolium rings, respectively [34,35]. Upon loading POMs, characteristic vibration bands for the Keggin structure of PW12O40 3− anion emerged at 1080, 978, 896, and 805 cm−1, assignable to the stretching vibration of the central oxygen ν(P-Oa), terminal oxygen ν(W=Ot), interoctahedral oxygen ν(W-Ob-W), and intraoctahedral oxygen ν(W-Oc-W), respectively [36]. Similar characteristic vibration bands were observed for other catalysts (Fig. S11), such as PMo12O40 3− and SiW12O40 4−. These results also confirm the successful synthesis of PILs via quaternization reaction and the loading of POMs onto PILs. Furthermore, the identical peaks obtained for heterogenized catalysts indicate the preservation of the primary Keggin structure of the POMs after immobilization on PILs, thereby retaining the original properties of the parent catalysts. Powder X-ray diffraction (XRD) measurements of H3PW12O40, PIL-TB-2PP, and PW-PIL-TB-2PP are presented in Fig. 4(b). The XRD pattern of PIL-TB-2PP displays broad reflections at 2θ of 23°, indicating its predominantly amorphous nature. Conversely, the pattern of pristine heteropoly acid exhibits typical diffraction peaks characteristic of the Keggin structure. After immobilization H3PW12O40 onto the PIL-TB-2PP network, the distinct crystalline peaks of the H3PW12O40 vanished, likely due to some disordering of its amorphous material structure trigger by the quaternization reaction of the quaternization reagents and cross-linkers [37], and POM is relatively uniformly distributed in the carrier [38]. Similar results were observed for other PILs and catalysts, as depicted in Fig. S12. The thermal stability of catalysts was assessed using thermogravimetric analysis (TG), and the weight loss curves are depicted in Fig. 4(c). PIL-TB-2PP exhibited slight weight loss from room temperature to 100 °C, probably attributing to desorption of the physical adsorbed trace amounts of solvents and water in the pores. A significant weight loss occurred in the range of 250–400 °C, associating with the degradation of the organic polymeric framework. Upon loading POMs, the thermal stability of PIL-TB-2PP improved markedly, with PW-PIL-TB-2PP starting to decompose at around 400 °C. The TG curves of other PILs and catalysts are presented in Fig. S13, indicating that all PILs exhibit good thermal stability suitable for using as carriers and the catalysts derived from various PILs loaded with POMs demonstrate commendable thermal stability. The textural properties of different PILs and catalysts were also examined by scanning electron microscopy (SEM) and N2 sorption isotherms. SEM images revealed that the surfaces of different PILs prepared via quaternization reactions appeared relatively smooth. However, upon loading with POMs, the catalyst surfaces became noticeably rougher (Figs. 5 and S14). This observation infers the successful loading of POMs onto the PILs, thereby altering their morphological structure. The alteration in catalyst morphology invariably results in a change in the specific surface area. For instance, the surface area of PIL-TB-2PP was very small (<1 m2g−1). Remarkably, the surface area of PW-PIL-TB-2PP increased significantly to 9.9 m2g−1 after the loading of POMs. The textural properties of other catalysts were shown in Table 1 , the low specific surface area of these catalysts (<15 m2g−1) is in line with previous reports on the PILs prepared through quaternization reaction [39–42]. The black portion in the TEM images of catalysts indicates that the introduced POMs had been dispersed in the PILs (Fig. S15). The elemental mapping images further confirm the successful loading of POMs into the PILs, with the POMs uniformly distributed into PIL-TB-2PP (Fig. 5). Moreover, the significant reduction in Br anion content from 40.44 % to 0.22 % suggests that POMs were immobilized into the PIL through an ion-exchange process with Br anions, as depicted in Scheme S2. Table 1 provides details about the loading amounts of POMs on various PILs. The PILs synthesized via quaternization reactions exhibited a higher loading capacity for POMs (loading amount ratio up to 534 %), which is close to 6 times that of the supported H3PW12O40 produced through free radical polymerization method as reported previously [20]. The loading amounts of POMs on PILs prepared by quaternization reactions also show substantial differences due to variations in the structures of quaternization reagents and cross-linkers. Compared with the quaternization reagents with shorter molecular, such as BB (12.43 Å) and TT (12.89 Å) (Fig. 2 ), the PIL, synthesized using PP with longer molecular size (25.32 Å), exhibited much higher loading amounts of POMs (up to 455 %, 3.6 and 1.7 times higher than the corresponding formers, entries 1–3, Table 1). The greater molecular size of quaternization reagents allows for a longer distance between the quaternary ammonium sites after the quaternization reaction, facilitating the loading of POMs. Moreover, the nature of the heteropoly acid itself influences the loading amount. Under the same carrier of PIL-TB-2PP, as the acidity of the heteropoly acid decreased, the loading amounts of POMs decreased from 455 % to 273 % (entries 3–4, Table 1). This trend arises from the fact that stronger acidity promotes ionic exchange reactions between the heteropoly acid and PILs. Furthermore, under identical quaternization reagents and cross-linkers, increasing the molar ratio of quaternization reagents to cross-linkers from 2 to 4 resulted in an increase in the loading of POMs from 455 % to 534 % (entries 2 and 4, Table 1). This increase is attributed to the higher number of quaternary ammonium sites. The high loading capacity of PILs with POMs is anticipated to offer promising applications in the areas of catalysis for active metal loading, carbon dioxide fixation, and radioactive ion adsorption. 3.2 Catalytic activity The catalytic activity of various PILs supported POMs catalysts was assessed in the oxidation of the probe substrate of cyclooctene with aqueous H2O2 as an oxidant and acetonitrile as a solvent. As shown in Table 2 , up to 99 % cyclooctene conversion and 92 % selectivity to the target 1,2-epoxycyclooctane could be attained in the presence of the PW-PIL-TB-2PP catalyst (entry 2). However, almost no reaction took place without H2O2, even doubled the amount of the PW-PIL-TB-2PPcatalyst (entry 1). This finding reveals that the oxidation of cyclooctene proceeds via the generation of reactive oxygen species by H2O2 in the presence of catalyst [43]. Note that no reaction took place as well in the presence of H2O2 but the absence of catalyst (not shown), showing the importance of the H2O2 in activation of the catalyst. Among the PILs supported heteropoly acids, PW-PIL-TB-2PP presented the best performance, followed by PMo-PIL-TB-2PP and SiW-PIL-TB-2PP (entries 2–4, Table 2). Such finding may associate with that the electrons of the alkene can fill the vacant 4f, 4d, and 5 s orbitals of Mo for PMo-based catalyst, resulting in a comparatively more stable intermediate than with PW-based catalysts, where the electrons of the alkene can only fill the vacant 5d and 6 s orbitals of W [44]. Consequently, the transfer of active oxygen to the C=C moiety of the alkene in the latter catalyst is retarded. The rather poor performance of SiW-PIL-TB-2PP (with only 28 % cyclooctene conversion) is consistent with research by Ding et al. [44], which is due to the decomposition of H2O2 by SiW12O40 4− and the extremely low specific surface area of catalyst (<1 m2g−1) [45]. The catalytic performance of the PILs supported H3PW12O40 catalyst also effected by the quaternization reagents and cross-linkers (entries 2, 5–9, Table 2). The conversion of cyclooctene in the trend of PW-PIL-TB-2BB<PW-PIL-TB-2TT<PW-PIL-TB-4PP ≈ PW-PIL-TB-2PP, which is line with the trend of their phosphotungstate loading amount shown in Table 1. It seems that high loading amount of phosphotungstate in the catalyst benefits the conversion of cyclooctene. This is because high amount of PW12O40 3− could be converted to the catalytic active species of {PO4[WO(O2)2]4}3− under the oxidation of H2O2, and thus contributed to their high activity [46]. Nonetheless, high amount of phosphotungstate would result in the further transformation of the target 1,2-epoxycyclooctane into the byproducts of cyclooctane-1,2-diol and 2-hydroxycyclooctan-1-one under the same reaction conditions, as up to 99 % selectivity to the target 1,2-epoxycyclooctane was obtained over PW-PIL-TB-2BB and PW-PIL-TB-2TT, while up to above 7 % cyclooctane-1,2-diol and 2-hydroxycyclooctan-1-one byproducts were detected over PW-PIL-TB-4PP and PW-PIL-TM-2PP. Clearly, to obtain high yield of 1,2-epoxycyclooctane from cyclooctene epoxidation, it requires to suppress the over transformation of target product. Note that all the PIL supported PW catalysts presented superior cyclooctene conversion and 1,2-epoxycyclooctane selectivity than that of the pure PW, which is a homogeneous catalytic reaction. To our delight, high yield of 1,2-epoxycyclooctane (up to above 97 %) could be attained via optimizing the catalyst amount (Table 2, entries 2, 4 and 5, Fig. 6 a), reaction temperature (Fig. 6b) and reaction time (Fig. 6c). The catalytic performance of the PW-PIL-TB-2PP catalyst is also affected by the amount of H2O2. Increasing H₂O₂ amount from 1 to 8 mmol led to a rapid increase in cyclooctene conversion from 47 to 99 %, accompanied by a gradual decrease in 1,2-epoxycyclooctane selectivity from 99 to 90 % (Fig. 6d), achieving a maximum 1,2-epoxycyclooctane yield of 96 % at around 1.5–2 times of H2O2 to the substrate. Notably, the turnover frequency (TOF) value for the epoxidation of cyclooctene over PW-PIL-TB-2PP catalyst is much higher than that of the heterogeneous catalysts reported previously (Table S1), demonstrating the outstanding performance of the PILs supported POMs catalyst. Encouraged by the above results, the scope of the PW-PIL-TB-2PP catalyst for other substrates was investigated, and the results are summarized in Table 3 . For cyclic alkenes, the epoxide products are prone to ring-opening reactions, with the main by-products being 1,2-diols. By reducing the reaction temperature and the amount of hydrogen peroxide, the selectivity for epoxide compounds can reach 99 % (entries 1–6). For aromatic alkenes, in addition to the formation of epoxide compounds, due to the presence of competing reactions such as C = C bond cleavage and isomerization reactions, the generation of aldehyde and ketone compounds was also observed (entries 7–10). In a word, the catalyst demonstrated versatility in the oxidation of cyclic, linear, and aromatic alkenes using H₂O₂ as the oxidant [47]. The reusability of the PW-PIL-TB-2PP catalyst was assessed through the oxidation of cyclooctene. After each cycle, the catalyst was separated from the reaction system by centrifugation and dried at 60 °C. The results depicted in Fig. 7 (a) and (b) demonstrate that the catalyst exhibited excellent stability during six consecutive reuse cycles, maintaining cyclooctene conversion and 1,2-epoxycyclooctane selectivity without appreciable deactivation no matter at high or low cyclooctene conversion. FT-IR (Fig. 8 a) spectroscopy and XRD (Fig. 8b) characterization of the used catalyst showed that the structure of the PW-PIL-TB-2PP catalyst remained essentially unchanged after six reuses, further supporting the good stability of the catalyst under reaction conditions. In addition, the hot filtration experiment confirms the heterogeneous catalysis of PW-PIL-TB-2PP catalyst in the catalytic oxidation of cyclooctene, as no further conversion of cyclooctene could be detected after filtering of the catalyst (Fig. 7c). Obviously, the above findings showcase the novel catalytic performance of the PILs supported H3PW12O40 catalyst, which holds promising potential for industrial applications. 4 Conclusions In conclusion, a new quaternization reagent PP that has not been previously reported in the literature was synthesized and a series of novel PILs were prepared via a one-step quaternization reaction using PP reacted with cross-linkers. POMs were subsequently loaded into these PILs through ion exchange method to synthesize innovative catalysts, and their catalytic activity was evaluated for the oxidation of alkenes. The catalysts, especially PW-PIL-TB-2PP, exhibited remarkable activity for the oxidation of various cyclic, linear, and aromatic alkenes, due to the high loading amount ratio of the PILs for POMs. And the novel PW-PIL-TB-2PP catalyst could be facilely recovered and reused for six runs without significant loss in catalytic activity. The high loading capacity of the PILs for POMs is likely owing to the high content of quaternary ammonium sites and the long distance between them. This work not only provides a simple method for the preparation of novel PILs without additional additives, such as metal or free-radical initiator, but also broadens the range of carriers for reactive POMs and creates novel catalysts for the oxidation of alkenes. Additionally, this study may also offer valuable guidance for the design and preparation of heterogeneous materials with outstanding performances, such as active metal loading, carbon dioxide fixation, and radioactive ion adsorption. CRediT authorship contribution statement Qiao Liu: Writing – original draft, Methodology, Investigation, Conceptualization. Meirong Kang: Validation. Weiguo Fang: Validation. Hailong Liu: Writing – review & editing, Supervision. Zhiwei Huang: Writing – review & editing, Supervision. Declaration of competing interest We declare that we have no financial and personal relationships with other people or organizations that can inappropriately influence our work. Acknowledgements This work was funded by the National Natural Science Foundation of China (22272187 and 22102198), the Major Science and Technology Projects of Gansu Province (22ZD6GA003, 23ZDFA016), the Basic Research Creative Groups Project of the Science and Technology Plan of Gansu Province (23JRRA568) and the Light of West China of the Chinese Academy of Science (CAS). Supplementary materials Supplementary material associated with this article can be found, in the online version, at doi:10.1016/j.mcat.2024.114572. Appendix Supplementary materials Image, application 1 References [1] Y. Leng J. Liu P. Jiang J. Wang POSS-derived mesostructured amphiphilic polyoxometalate-based ionic hybrids as highly efficient epoxidation catalysts ACS Sustain. Chem. Eng. 3 2015 170 176 10.1021/sc500674q Y. Leng, J. Liu, P. Jiang, J. Wang, POSS-derived mesostructured amphiphilic polyoxometalate-based ionic hybrids as highly efficient epoxidation catalysts, ACS Sustain. Chem. Eng. 3 (2015) 170–176. 10.1021/sc500674q. [2] R. Radman A. Aouissi A.A. Al-Kahtani W.K. Mekhamer A.Y.B.H. Ahmed Activated carbon supported Co1.5PW12O40 as efficient catalyst for the production of 1, 2 cyclohexane diol by oxidation of cyclohexene with H2O2 in the presence of CO2 Green Chem. Lett. Rev. 13 2020 265 274 10.1080/17518253.2020.1813811 R. Radman, A. Aouissi, A.A. Al-Kahtani, W.K. Mekhamer, A.Y.B.H. Ahmed, Activated carbon supported Co1.5PW12O40 as efficient catalyst for the production of 1, 2 cyclohexane diol by oxidation of cyclohexene with H2O2 in the presence of CO2, Green Chem. Lett. Rev. 13 (2020) 265–274. 10.1080/17518253.2020.1813811. [3] C. Yuana H. Zhiwei J. Chen Basic ionic liquid supported on mesoporous SBA-15: an efficient heterogeneous catalyst for epoxidation of olefins with H2O2 as oxidant Catal. Commun. 24 2012 56 60 10.1016/j.catcom.2012.03.003 C. Yuana, H. Zhiwei, J. Chen, Basic ionic liquid supported on mesoporous SBA-15: an efficient heterogeneous catalyst for epoxidation of olefins with H2O2 as oxidant, Catal. Commun. 24 (2012) 56–60. 10.1016/j.catcom.2012.03.003. [4] Y. Chang Y. Xie C. Zhao J. Ren W. Su W. Zhao L. Wu H. Yu Selective oxidation of olefins to aldehydes/ketones/ carboxylic acids with an efficient and practical polyoxometalate-based iron catalyst ChemCatChem 14 2022 10.1002/cctc.202200209 Y. Chang, Y. Xie, C. Zhao, J. Ren, W. Su, W. Zhao, L. Wu, H. Yu, Selective oxidation of olefins to aldehydes/ketones/ carboxylic acids with an efficient and practical polyoxometalate-based iron catalyst, ChemCatChem 14 (2022). 10.1002/cctc.202200209. [5] X. Zhao J. Sun G. Sun Q. You X. Jiang Y. Cui Epoxidation of allyl chloride with H2O2 catalyzed by three structurally related quaternary ammonium modified polyoxophosphotungstates Appl. Catal. A-Gen. 608 2020 10.1016/j.apcata.2020.117846 X. Zhao, J. Sun, G. Sun, Q. You, X. Jiang, Y. Cui, Epoxidation of allyl chloride with H2O2 catalyzed by three structurally related quaternary ammonium modified polyoxophosphotungstates, Appl. Catal. A-Gen. 608 (2020). 10.1016/j.apcata.2020.117846. [6] D.T. Bregante J.Z. Tan R.L. Schultz E.Z. Ayla D.S. Potts C. Torres D.W. Flaherty Catalytic consequences of oxidant, alkene, and pore structures on alkene epoxidations within titanium silicates ACS Catal. 10 2020 10169 10184 10.1021/acscatal.0c02183 D.T. Bregante, J.Z. Tan, R.L. Schultz, E.Z. Ayla, D.S. Potts, C. Torres, D.W. Flaherty, Catalytic consequences of oxidant, alkene, and pore structures on alkene epoxidations within titanium silicates, ACS Catal.. 10 (2020) 10169–10184. 10.1021/acscatal.0c02183. [7] N.V. Maksimchuk G.M. Maksimov V.Y. Evtushok I.D. Ivanchikova Y.A. Chesalov R.I. Maksimovskaya O.A. Kholdeeva A. Sole-Daura J.M. Poblet J.J. Carbo Relevance of protons in heterolytic activation of H2O2 over Nb(V): insights from model studies on Nb-substituted polyoxometalates ACS Catal. 8 2018 9722 9737 10.1021/acscatal.8b02761 N.V. Maksimchuk, G.M. Maksimov, V.Y. Evtushok, I.D. Ivanchikova, Y.A. Chesalov, R.I. Maksimovskaya, O.A. Kholdeeva, A. Sole-Daura, J.M. Poblet, J.J. Carbo, Relevance of protons in heterolytic activation of H2O2 over Nb(V): insights from model studies on Nb-substituted polyoxometalates, ACS Catal.. 8 (2018) 9722–9737. 10.1021/acscatal.8b02761. [8] Z. Zhang W. Zhao B. Ma Y. Ding The epoxidation of olefins catalyzed by a new heterogeneous polyoxometalate-based catalyst with hydrogen peroxide Catal. Commun. 12 2010 318 322 10.1016/j.catcom.2010.09.026 Z. Zhang, W. Zhao, B. Ma, Y. Ding, The epoxidation of olefins catalyzed by a new heterogeneous polyoxometalate-based catalyst with hydrogen peroxide, Catal. Commun. 12 (2010) 318–322. 10.1016/j.catcom.2010.09.026. [9] P. Mialane C. Mellot-Draznieks P. Gairola M. Duguet Y. Benseghir O. Oms A. Dolbecq Heterogenisation of polyoxometalates and other metal-based complexes in metal-organic frameworks: from synthesis to characterisation and applications in catalysis Chem. Soc. Rev. 50 2021 6152 6220 10.1039/d0cs00323a P. Mialane, C. Mellot-Draznieks, P. Gairola, M. Duguet, Y. Benseghir, O. Oms, A. Dolbecq, Heterogenisation of polyoxometalates and other metal-based complexes in metal-organic frameworks: from synthesis to characterisation and applications in catalysis, Chem. Soc. Rev. 50 (2021) 6152–6220. 10.1039/d0cs00323a. [10] M. Samaniyan M. Mirzaei R. Khajavian H. Eshtiagh-Hosseini C. Streb Heterogeneous catalysis by polyoxometalates in metal-organic frameworks ACS Catal. 9 2019 10174 10191 10.1021/acscatal.9b03439 M. Samaniyan, M. Mirzaei, R. Khajavian, H. Eshtiagh-Hosseini, C. Streb, Heterogeneous catalysis by polyoxometalates in metal-organic frameworks, ACS Catal.. 9 (2019) 10174–10191. 10.1021/acscatal.9b03439. [11] L. Cai S. Li D. Yan L. Zhou F. Guo Q. Sun Water-soluble redox-active cage hosting polyoxometalates for selective desulfurization catalysis J. Am. Chem. Soc. 140 2018 4869 4876 10.1021/jacs.8b00394 L. Cai, S. Li, D. Yan, L. Zhou, F. Guo, Q. Sun, Water-soluble redox-active cage hosting polyoxometalates for selective desulfurization catalysis, J. Am. Chem. Soc. 140 (2018) 4869–4876. 10.1021/jacs.8b00394. [12] C. Liu M.A. Moussawi G. Kalandia D.E.S. Marcano W.E. Shepard T.N. Parac-Vogt Cavity-directed synthesis of labile polyoxometalates for catalysis in confined spaces Angew. Chem. Int. Ed. Engl. 2024 10.1002/anie.202401940 C. Liu, M.A. Moussawi, G. Kalandia, D.E.S. Marcano, W.E. Shepard, T.N. Parac-Vogt, Cavity-directed synthesis of labile polyoxometalates for catalysis in confined spaces, Angew. Chem. Int. Ed. Engl. (2024). 10.1002/anie.202401940. [13] M. Jin Q. Niu Z. Guo Z. Lv Epoxidation of cyclohexene with H2O2 over efficient water-tolerant heterogeneous catalysts composed of mono-substituted phosphotungstic acid on co-functionalized SBA-15 Appl. Organomet. Chem. 2019 33 10.1002/aoc.5115 M. Jin, Q. Niu, Z. Guo, Z. Lv, Epoxidation of cyclohexene with H2O2 over efficient water-tolerant heterogeneous catalysts composed of mono-substituted phosphotungstic acid on co-functionalized SBA-15, Appl. Organomet. Chem. 33 (2019). 10.1002/aoc.5115. [14] N.V. Maksimchuk K.A. Kovalenko S.S. Arzumanov Y.A. Chesalov M.S. Melgunov A.G. Stepanov V.P. Fedin O.A. Kholdeeva Hybrid polyoxotungstate/MIL-101 materials: synthesis, characterization, and catalysis of H2O2-based alkene epoxidation Inorg. Chem. 49 2010 2920 2930 10.1021/ic902459f N.V. Maksimchuk, K.A. Kovalenko, S.S. Arzumanov, Y.A. Chesalov, M.S. Melgunov, A.G. Stepanov, V.P. Fedin, O.A. Kholdeeva, Hybrid polyoxotungstate/MIL-101 materials: synthesis, characterization, and catalysis of H2O2-based alkene epoxidation, Inorg. Chem. 49 (2010) 2920–2930. 10.1021/ic902459f. [15] Y. Wang F. Gayet P. Guillo D. Agustin Organic solvent-free olefins and alcohols (ep)oxidation using recoverable catalysts based on [PM12O40]3− (M = Mo or W) ionically grafted on amino functionalized silica nanobeads Materials 12 2019 10.3390/ma12203278 (Basel) Y. Wang, F. Gayet, P. Guillo, D. Agustin, Organic solvent-free olefins and alcohols (ep)oxidation using recoverable catalysts based on [PM12O40]3− (M = Mo or W) ionically grafted on amino functionalized silica nanobeads, Materials. (Basel) 12 (2019). 10.3390/ma12203278. [16] V.Y. Evtushok V.A. Lopatkin O.Y. Podyacheva O.A. Kholdeeva Immobilization of polyoxometalates on carbon nanotubes: tuning catalyst activity, selectivity and stability in H2O2-based oxidations Catalysts 12 2022 10.3390/catal12050472 V.Y. Evtushok, V.A. Lopatkin, O.Y. Podyacheva, O.A. Kholdeeva, Immobilization of polyoxometalates on carbon nanotubes: tuning catalyst activity, selectivity and stability in H2O2-based oxidations, Catalysts 12 (2022). 10.3390/catal12050472. [17] T. Li W. Zhang W. Chen H.N. Miras Y. Song Modular polyoxometalate-layered double hydroxides as efficient heterogeneous sulfoxidation and epoxidation catalysts ChemCatChem 10 2018 188 197 10.1002/cctc.201701056 T. Li, W. Zhang, W. Chen, H.N. Miras, Y. Song, Modular polyoxometalate-layered double hydroxides as efficient heterogeneous sulfoxidation and epoxidation catalysts, ChemCatChem 10 (2018) 188–197. 10.1002/cctc.201701056. [18] L. Wang J. Lu Y. Wang H. Wang J. Wang T. Ren Preparation and characterization of novel cyclohexene-to-adipic acid catalyst with ionic liquid phosphotungstate immobilized on MIL-101 nanocages based on Cr-N coordination J. Mol. Struct. 2023 1271 10.1016/j.molstruc.2022.133973 L. Wang, J. Lu, Y. Wang, H. Wang, J. Wang, T. Ren, Preparation and characterization of novel cyclohexene-to-adipic acid catalyst with ionic liquid phosphotungstate immobilized on MIL-101 nanocages based on Cr-N coordination, J. Mol. Struct. 1271 (2023). 10.1016/j.molstruc.2022.133973. [19] J. Liu G. Yang Y. Liu Z. Zhou Z. Zhang X. Hu Selective oxidation of cyclohexene with H2O2 catalyzed by resin supported peroxo phosphotungstic acid under mild conditions Catal. Lett. 151 2021 147 152 10.1007/s10562-020-03273-1 J. Liu, G. Yang, Y. Liu, Z. Zhou, Z. Zhang, X. Hu, Selective oxidation of cyclohexene with H2O2 catalyzed by resin supported peroxo phosphotungstic acid under mild conditions, Catal. Lett. 151 (2021) 147–152. 10.1007/s10562-020-03273-1. [20] Y. Shi Z. Guo Q. Wang L. Zhang J. Li Y. Zhou J. Wang Amphiphilic mesoporous poly(ionic liquid) immobilized heteropolyanions towards the efficient heterogeneous epoxidation of alkenes with stoichiometric hydrogen peroxide ChemCatChem 9 2017 4426 4436 10.1002/cctc.201700906 Y. Shi, Z. Guo, Q. Wang, L. Zhang, J. Li, Y. Zhou, J. Wang, Amphiphilic mesoporous poly(ionic liquid) immobilized heteropolyanions towards the efficient heterogeneous epoxidation of alkenes with stoichiometric hydrogen peroxide, ChemCatChem 9 (2017) 4426–4436. 10.1002/cctc.201700906. [21] J. Zhao Y. Leng P. Jiang J. Wang C. Zhang POSS-derived mesoporous ionic copolymer-polyoxometalate catalysts with a surfactant function for epoxidation reactions New J. Chem. 40 2016 1022 1028 10.1039/c5nj01541c J. Zhao, Y. Leng, P. Jiang, J. Wang, C. Zhang, POSS-derived mesoporous ionic copolymer-polyoxometalate catalysts with a surfactant function for epoxidation reactions, New J. Chem. 40 (2016) 1022–1028. 10.1039/c5nj01541c. [22] Y. Leng J. Zhao P. Jiang J. Wang Amphiphilic porous polyhedral oligomeric silsesquioxanes (POSS) incorporated polyoxometalate-paired polymeric hybrids: interfacial catalysts for epoxidation reactions RSC Adv. 5 2015 17709 17715 10.1039/c4ra16956e Y. Leng, J. Zhao, P. Jiang, J. Wang, Amphiphilic porous polyhedral oligomeric silsesquioxanes (POSS) incorporated polyoxometalate-paired polymeric hybrids: interfacial catalysts for epoxidation reactions, RSC Adv.. 5 (2015) 17709–17715. 10.1039/c4ra16956e. [23] S. Hou M. Meng D. Liu P. Zhang Mechanochemical process to construct porous ionic polymers by menshutkin reaction ChemSusChem 14 2021 3059 3063 10.1002/cssc.202101093 S. Hou, M. Meng, D. Liu, P. Zhang, Mechanochemical process to construct porous ionic polymers by menshutkin reaction, ChemSusChem 14 (2021) 3059–3063. 10.1002/cssc.202101093. [24] G. Li S. Dong P. Fu Q. Yue Y. Zhou J. Wang Synthesis of porous poly (ionic liquid) s for chemical CO2 fixation with epoxides Green Chem. 24 2022 3433 3460 10.1039/d2gc00324d G. Li, S. Dong, P. Fu, Q. Yue, Y. Zhou, J. Wang, Synthesis of porous poly (ionic liquid) s for chemical CO2 fixation with epoxides, Green Chem.. 24 (2022) 3433–3460. 10.1039/d2gc00324d. [25] S. Hou N. Chen P. Zhang S. Dai Heterogeneous viologen catalysts for metal-free and selective oxidations Green Chem. 21 2019 1455 1460 10.1039/c8gc03772h S. Hou, N. Chen, P. Zhang, S. Dai, Heterogeneous viologen catalysts for metal-free and selective oxidations, Green Chem.. 21 (2019) 1455–1460. 10.1039/c8gc03772h. [26] X. Yu J. Sun J. Yuan W. Zhang C. Pan Y. Liu G. Yu One-pot synthesis of an ionic porous organic framework for metal-free catalytic CO2 fixation under ambient conditions Chem. Eng. J. 350 2018 867 871 10.1016/j.cej.2018.05.175 X. Yu, J. Sun, J. Yuan, W. Zhang, C. Pan, Y. Liu, G. Yu, One-pot synthesis of an ionic porous organic framework for metal-free catalytic CO2 fixation under ambient conditions, Chem. Eng. J. 350 (2018) 867–871. 10.1016/j.cej.2018.05.175. [27] J. Li L. Chen N. Shen R. Xie M. Sheridan X. Chen D. Sheng D. Zhang Z. Chai S. Wang Rational design of a cationic polymer network towards record high uptake of 99TcO4 − in nuclear waste Sci. China Chem. 64 2021 1251 1260 10.1007/s11426-020-9962-9 J. Li, L. Chen, N. Shen, R. Xie, M. Sheridan, X. Chen, D. Sheng, D. Zhang, Z. Chai, S. Wang, Rational design of a cationic polymer network towards record high uptake of 99TcO4− in nuclear waste, Sci. China Chem. 64 (2021) 1251–1260. 10.1007/s11426-020-9962-9. [28] S. Jiao L. Deng X. Zhang Y. Zhang K. Liu S. Li L. Wang D. Ma Evaluation of an ionic porous organic polymer for water remediation ACS Appl. Mater. Interfaces 13 2021 39404 39413 10.1021/acsami.1c10464 S. Jiao, L. Deng, X. Zhang, Y. Zhang, K. Liu, S. Li, L. Wang, D. Ma, Evaluation of an ionic porous organic polymer for water remediation, ACS Appl. Mater. Interfaces 13 (2021) 39404–39413. 10.1021/acsami.1c10464. [29] S. Wang Y. Wu X. Li W. Zhang H. Ma Trace SO2 Gas Capture in STable 3D viologen ionic porous organic framework microsphere ACS Appl. Mater. Interfaces 15 2023 30312 30319 10.1021/acsami.3c05288 S. Wang, Y. Wu, X. Li, W. Zhang, H. Ma, Trace SO2 Gas Capture in STable 3D viologen ionic porous organic framework microsphere, ACS Appl. Mater. Interfaces 15 (2023) 30312–30319. 10.1021/acsami.3c05288. [30] S. Sarkar A. Chakraborty R. Ranjan P. Nag S.R. Vennapusa S. Mukhopadhyay A bifunctional imidazolium-functionalized ionic porous organic polymer in water remediation Mater. Chem. Front. 6 2022 3070 3083 10.1039/d2qm00636g S. Sarkar, A. Chakraborty, R. Ranjan, P. Nag, S.R. Vennapusa, S. Mukhopadhyay, A bifunctional imidazolium-functionalized ionic porous organic polymer in water remediation, Mater. Chem. Front. 6 (2022) 3070–3083. 10.1039/d2qm00636g. [31] Z. Yang B. Yu H. Zhang Y. Zhao G. Ji Z. Liu Fluoro-functionalized polymeric N-heterocyclic carbene-zinc complexes: efficient catalyst for formylation and methylation of amines with CO2 as a C1-building block RSC Adv. 5 2015 19613 19619 10.1039/c5ra00380f Z. Yang, B. Yu, H. Zhang, Y. Zhao, G. Ji, Z. Liu, Fluoro-functionalized polymeric N-heterocyclic carbene-zinc complexes: efficient catalyst for formylation and methylation of amines with CO2 as a C1-building block, RSC Adv.. 5 (2015) 19613–19619. 10.1039/c5ra00380f. [32] S. Pettersson V.I. Perez-Nueno L. Ros-Blanco D.L.B.R. Puig M.O. Rabal X. Batllori B. Clotet I. Clotet-Codina M. Armand-Ugon J. Este J.I. Borrell J. Teixido Discovery of novel non-cyclam polynitrogenated CXCR4 coreceptor inhibitors ChemMedChem 3 2008 1549 1557 10.1002/cmdc.200800145 S. Pettersson, V.I. Perez-Nueno, L. Ros-Blanco, D.L.B.R. Puig, M.O. Rabal, X. Batllori, B. Clotet, I. Clotet-Codina, M. Armand-Ugon, J. Este, J.I. Borrell, J. Teixido, Discovery of novel non-cyclam polynitrogenated CXCR4 coreceptor inhibitors, ChemMedChem 3 (2008) 1549–1557. 10.1002/cmdc.200800145. [33] R.Y. Zhang Y. Zhang J. Tong L. Liu Z.B. Han A Bifunctional cationic covalent organic polymer for cooperative conversion of CO2 to cyclic carbonate without Co‑catalyst Catal. Lett. 151 2021 2833 3841 10.1007/s10562-021-03534-7 R.Y. Zhang, Y. Zhang, J. Tong, L. Liu, Z.B. Han, A Bifunctional cationic covalent organic polymer for cooperative conversion of CO2 to cyclic carbonate without Co‑catalyst, Catal. Lett. 151 (2021) 2833–3841. 10.1007/s10562-021-03534-7. [34] Y. Wang J. Nie C. Lu F. Wang C. Ma Z. Chen G. Yang Imidazolium-based polymeric ionic liquids for heterogeneous catalytic conversion of CO2 into cyclic carbonates Microporous Mesoporous Mater. 292 2020 10.1016/j.micromeso.2019.109751 Y. Wang, J. Nie, C. Lu, F. Wang, C. Ma, Z. Chen, G. Yang, Imidazolium-based polymeric ionic liquids for heterogeneous catalytic conversion of CO2 into cyclic carbonates, Microporous Mesoporous Mater.. 292 (2020). 10.1016/j.micromeso.2019.109751. [35] Z. Yang Y. Zhao G. Ji Fluoro-functionalized polymeric ionic liquids: highly efficient catalysts for CO2 cycloaddition to cyclic carbonates under mild conditions Green Chem. 16 8 2014 3724 3728 10.1039/c4gc00730a Z. Yang, Y. Zhao, G. Ji, Fluoro-functionalized polymeric ionic liquids: highly efficient catalysts for CO2 cycloaddition to cyclic carbonates under mild conditions. Green Chem.. 2014, 16(8): 3724–3728. 10.1039/c4gc00730a. [36] S. Ishikawa T. Ikeda M. Koutani S. Yasumura K. Amakawa K. Shimoda Y. Jing T. Toyao M. Sadakane K. Shimizu W. Ueda Oxidation catalysis over solid-state keggin-type phosphomolybdicacid with oxygen defects J. Am. Chem. Soc. 144 2022 7693 7708 10.1021/jacs.2c00125 S. Ishikawa, T. Ikeda, M. Koutani, S. Yasumura, K. Amakawa, K. Shimoda, Y. Jing, T. Toyao, M. Sadakane, K. Shimizu, W. Ueda, Oxidation catalysis over solid-state keggin-type phosphomolybdicacid with oxygen defects, J. Am. Chem. Soc. 144 (2022) 7693–7708. 10.1021/jacs.2c00125. [37] H. Pan H. Li H. Zhang A. Wang S. Yang Acidic ionic liquid-functionalized mesoporous melamine-formaldehyde polymer as heterogeneous catalyst for biodiesel production Fuel 239 2019 886 895 10.1016/j.fuel.2018.11.093 H. Pan, H. Li, H. Zhang, A. Wang, S. Yang, Acidic ionic liquid-functionalized mesoporous melamine-formaldehyde polymer as heterogeneous catalyst for biodiesel production, Fuel 239 (2019) 886–895. 10.1016/j.fuel.2018.11.093. [38] X. Song W. Zhu Y. Yan Selective oxidation of olefins with aqueous hydrogen peroxide over phosphomolybdic acid functionalized knitting aryl network polymer J. Mol. Catal. A Chem. 413 2016 32 39 10.1016/j.molcata.2015.12.012 X. Song, W. Zhu, Y. Yan, Selective oxidation of olefins with aqueous hydrogen peroxide over phosphomolybdic acid functionalized knitting aryl network polymer. J. Mol. Catal. A Chem.. 2016, 413: 32–39. 10.1016/j.molcata.2015.12.012. [39] S.I.G.P. Mohamed T. Nguyen M. Bavarian S. Nejati One-step synthesis of an ionic covalent organic polymer for CO2 capture ACS Appl. Polym. Mater. 2022 10.1021/acsapm.2c01436 S.I.G.P. Mohamed, T. Nguyen, M. Bavarian, S. Nejati, One-step synthesis of an ionic covalent organic polymer for CO2 capture, ACS Appl. Polym. Mater.. (2022). 10.1021/acsapm.2c01436. [40] Q. Yu Y. Cheng Z. Li D. Yang Q.B. Meng B. Han Constructing ionic porous organic polymers with high specific surface area through crosslinking strategy Chem. Eng. J. 2022 442 10.1016/j.cej.2022.136275 Q. Yu, Y. Cheng, Z. Li, D. Yang, Q.B. Meng, B. Han, Constructing ionic porous organic polymers with high specific surface area through crosslinking strategy, Chem. Eng. J. 442 (2022). 10.1016/j.cej.2022.136275. [41] C. Yadav S. Payra J.N. Moorthy Ionic porous organic polymer (IPOP) based on twisted biphenyl Scaffold: green and efficient heterogeneous catalytic synthesis of β-Arylthioketones and biscoumarins J. Catal. 413 2022 769 778 10.1016/j.jcat.2022.07.012 C. Yadav, S. Payra, J.N. Moorthy, Ionic porous organic polymer (IPOP) based on twisted biphenyl Scaffold: green and efficient heterogeneous catalytic synthesis of β-Arylthioketones and biscoumarins, J. Catal. 413 (2022) 769–778. 10.1016/j.jcat.2022.07.012. [42] Y. Leng D. Lu P. Jiang C. Zhang J. Zhao W. Zhang Highly cross-linked cationic polymer microspheres as an efficient catalyst for facile CO2 fixation Catal. Commun. 74 2016 99 103 10.1016/j.catcom.2015.11.006 Y. Leng, D. Lu, P. Jiang, C. Zhang, J. Zhao, W. Zhang, Highly cross-linked cationic polymer microspheres as an efficient catalyst for facile CO2 fixation, Catal. Commun. 74 (2016) 99–103. 10.1016/j.catcom.2015.11.006. [43] Z. Zhang Q. Zha Y. Liu Z. Zhang J. Liu Z. Zhou Study on the epoxidation of olefins with H2O2 catalyzed by biquaternary ammonium phosphotungstic acid Chin. J. Chem. Eng. 58 2023 146 154 10.1016/j.cjche.2022.11.009 Z. Zhang, Q. Zha, Y. Liu, Z. Zhang, J. Liu, Z. Zhou, Study on the epoxidation of olefins with H2O2 catalyzed by biquaternary ammonium phosphotungstic acid, Chin. J. Chem. Eng. 58 (2023) 146–154. 10.1016/j.cjche.2022.11.009. [44] Y. Ding Q. Gao G.X. Li H.P. Zhang J.M. Wang L. Yan J.S. Suo Selective epoxidation of cyclohexene to cyclohexene oxide catalyzed by Keggin-type heteropoly compounds using anhydrous urea-hydrogen peroxide as oxidizing reagent and acetonitrile as the solvent J. Mol. Catal. A-Chem. 218 2004 161 170 10.1016/j.molcata.2004.04.019 Y. Ding, Q. Gao, G.X. Li, H.P. Zhang, J.M. Wang, L. Yan, J.S. Suo, Selective epoxidation of cyclohexene to cyclohexene oxide catalyzed by Keggin-type heteropoly compounds using anhydrous urea-hydrogen peroxide as oxidizing reagent and acetonitrile as the solvent, J. Mol. Catal. A-Chem. 218 (2004) 161–170. 10.1016/j.molcata.2004.04.019. [45] Y. Watanabe K. Yamamoto T. Tatsumi Epoxidation of alkenes catalyzed by heteropolyoxometalate as pillars in layered double hydroxides J. Mol. Catal. A-Chem. 145 1999 281 289 10.1016/S1381-1169(99)00012-6 Y. Watanabe, K. Yamamoto, T. Tatsumi, Epoxidation of alkenes catalyzed by heteropolyoxometalate as pillars in layered double hydroxides, J. Mol. Catal. A-Chem. 145 (1999) 281–289. 10.1016/S1381-1169(99)00012-6. [46] D.C. Duncan, R.C. Chambers, E. Hecht, C.L. Hill, Mechanism and dynamics in the H3[PW12O40]-catalyzed selective epoxidation of terminal olefins by H2O2. Formation, Reactivity, and Stability of {PO4[WO(O2)2]4}3−, 1995, pp. 681–691. 10.1021/ja00107a012. [47] L. Yang H. Zhang P. Tao X. Lu X. Li C. Wang B. Wang F. Yue D. Zhou Q. Xia Microwave-assisted air epoxidation of mixed biolefins over a spherical bimetal ZnCo-MOF catalyst ACS Appl. Mater. Interfaces 13 2021 8474 8487 10.1021/acsami.0c22317 L. Yang, H. Zhang, P. Tao, X. Lu, X. Li, C. Wang, B. Wang, F. Yue, D. Zhou, Q. Xia, Microwave-assisted air epoxidation of mixed biolefins over a spherical bimetal ZnCo-MOF catalyst, ACS Appl. Mater. Interfaces 13 (2021) 8474–8487. 10.1021/acsami.0c22317.",
      "scopus-id": "85204724711",
      "coredata": {
        "eid": "1-s2.0-S2468823124007545",
        "dc:description": "A novel quaternization reagent of (1E,1′E)-1,1′-(1,4-phenylene)bis(N-(3-(1H-imidazol-1-yl)propyl)methanimine) (PP) was synthesized and used for the preparation of a series of poly(ionic liquid)s (PILs) via the quaternization reaction. These PILs were subsequently loaded with polyoxometalates (POMs) to create innovative catalysts for the oxidation of alkenes. Comprehensive structural analysis of the catalysts showed that these PILs exhibited a high loading amount ratio of up to 542 % for POMs, which were well-dispersed on the surface of PILs. The PILs loaded POMs catalysts, especially for PW-PIL-TB-2PP with H3PW12O40 as the POMs, displayed remarkable activity and stability in oxidizing cyclooctene, achieving a conversion rate of 97 % and a selectivity of 99 % for 1,2-epoxycyclooctane over six consecutive runs without notable loss. Furthermore, the PW-PIL-TB-2PP catalyst could also be used for the oxidation of a wide range of cyclic, linear, and aromatic alkenes.",
        "openArchiveArticle": "false",
        "prism:coverDate": "2024-12-31",
        "openaccessUserLicense": null,
        "prism:aggregationType": "Journal",
        "prism:url": "https://api.elsevier.com/content/article/pii/S2468823124007545",
        "dc:creator": [
          {
            "@_fa": "true",
            "$": "Liu, Qiao"
          },
          {
            "@_fa": "true",
            "$": "Kang, Meirong"
          },
          {
            "@_fa": "true",
            "$": "Fang, Weiguo"
          },
          {
            "@_fa": "true",
            "$": "Liu, Hailong"
          },
          {
            "@_fa": "true",
            "$": "Huang, Zhiwei"
          }
        ],
        "link": [
          {
            "@_fa": "true",
            "@rel": "self",
            "@href": "https://api.elsevier.com/content/article/pii/S2468823124007545"
          },
          {
            "@_fa": "true",
            "@rel": "scidir",
            "@href": "https://www.sciencedirect.com/science/article/pii/S2468823124007545"
          }
        ],
        "dc:format": "application/json",
        "openaccessType": null,
        "pii": "S2468-8231(24)00754-5",
        "prism:volume": "569",
        "articleNumber": "114572",
        "prism:publisher": "Elsevier B.V. All rights are reserved, including those for text and data mining, AI training, and similar technologies.",
        "dc:title": "Environment-friendly heterogeneous poly(ionic liquid)s immobilized polyoxometalate catalysts towards the efficient oxidation of alkenes",
        "prism:copyright": "© 2024 Elsevier B.V. All rights are reserved, including those for text and data mining, AI training, and similar technologies.",
        "openaccess": "0",
        "prism:issn": "24688231",
        "dcterms:subject": [
          {
            "@_fa": "true",
            "$": "Quaternization reaction"
          },
          {
            "@_fa": "true",
            "$": "Poly(ionic liquid)s"
          },
          {
            "@_fa": "true",
            "$": "Polyoxometalates"
          },
          {
            "@_fa": "true",
            "$": "Alkenes"
          },
          {
            "@_fa": "true",
            "$": "Oxidation"
          }
        ],
        "openaccessArticle": "false",
        "prism:publicationName": "Molecular Catalysis",
        "openaccessSponsorType": null,
        "prism:pageRange": "114572",
        "pubType": "fla",
        "prism:coverDisplayDate": "December 2024",
        "prism:doi": "10.1016/j.mcat.2024.114572",
        "prism:startingPage": "114572",
        "dc:identifier": "doi:10.1016/j.mcat.2024.114572",
        "openaccessSponsorName": null
      },
      "objects": {
        "object": [
          {
            "@category": "standard",
            "@height": "35",
            "@width": "66",
            "@_fa": "true",
            "$": "https://api.elsevier.com/content/object/eid/1-s2.0-S2468823124007545-fx10.jpg?httpAccept=%2A%2F%2A",
            "@multimediatype": "JPEG image file",
            "@type": "IMAGE-DOWNSAMPLED",
            "@size": "1340",
            "@ref": "fx10",
            "@mimetype": "image/jpeg"
          },
          {
            "@category": "standard",
            "@height": "200",
            "@width": "452",
            "@_fa": "true",
            "$": "https://api.elsevier.com/content/object/eid/1-s2.0-S2468823124007545-ga1.jpg?httpAccept=%2A%2F%2A",
            "@multimediatype": "JPEG image file",
            "@type": "IMAGE-DOWNSAMPLED",
            "@size": "46965",
            "@ref": "ga1",
            "@mimetype": "image/jpeg"
          },
          {
            "@category": "standard",
            "@height": "33",
            "@width": "55",
            "@_fa": "true",
            "$": "https://api.elsevier.com/content/object/eid/1-s2.0-S2468823124007545-fx13.jpg?httpAccept=%2A%2F%2A",
            "@multimediatype": "JPEG image file",
            "@type": "IMAGE-DOWNSAMPLED",
            "@size": "943",
            "@ref": "fx13",
            "@mimetype": "image/jpeg"
          },
          {
            "@category": "standard",
            "@height": "29",
            "@width": "65",
            "@_fa": "true",
            "$": "https://api.elsevier.com/content/object/eid/1-s2.0-S2468823124007545-fx11.jpg?httpAccept=%2A%2F%2A",
            "@multimediatype": "JPEG image file",
            "@type": "IMAGE-DOWNSAMPLED",
            "@size": "1166",
            "@ref": "fx11",
            "@mimetype": "image/jpeg"
          },
          {
            "@category": "standard",
            "@height": "29",
            "@width": "73",
            "@_fa": "true",
            "$": "https://api.elsevier.com/content/object/eid/1-s2.0-S2468823124007545-fx12.jpg?httpAccept=%2A%2F%2A",
            "@multimediatype": "JPEG image file",
            "@type": "IMAGE-DOWNSAMPLED",
            "@size": "1115",
            "@ref": "fx12",
            "@mimetype": "image/jpeg"
          },
          {
            "@category": "standard",
            "@height": "180",
            "@width": "752",
            "@_fa": "true",
            "$": "https://api.elsevier.com/content/object/eid/1-s2.0-S2468823124007545-gr7.jpg?httpAccept=%2A%2F%2A",
            "@multimediatype": "JPEG image file",
            "@type": "IMAGE-DOWNSAMPLED",
            "@size": "40890",
            "@ref": "gr7",
            "@mimetype": "image/jpeg"
          },
          {
            "@category": "standard",
            "@height": "231",
            "@width": "627",
            "@_fa": "true",
            "$": "https://api.elsevier.com/content/object/eid/1-s2.0-S2468823124007545-gr8.jpg?httpAccept=%2A%2F%2A",
            "@multimediatype": "JPEG image file",
            "@type": "IMAGE-DOWNSAMPLED",
            "@size": "46535",
            "@ref": "gr8",
            "@mimetype": "image/jpeg"
          },
          {
            "@category": "standard",
            "@height": "394",
            "@width": "597",
            "@_fa": "true",
            "$": "https://api.elsevier.com/content/object/eid/1-s2.0-S2468823124007545-gr5.jpg?httpAccept=%2A%2F%2A",
            "@multimediatype": "JPEG image file",
            "@type": "IMAGE-DOWNSAMPLED",
            "@size": "97856",
            "@ref": "gr5",
            "@mimetype": "image/jpeg"
          },
          {
            "@category": "standard",
            "@height": "440",
            "@width": "603",
            "@_fa": "true",
            "$": "https://api.elsevier.com/content/object/eid/1-s2.0-S2468823124007545-gr6.jpg?httpAccept=%2A%2F%2A",
            "@multimediatype": "JPEG image file",
            "@type": "IMAGE-DOWNSAMPLED",
            "@size": "51039",
            "@ref": "gr6",
            "@mimetype": "image/jpeg"
          },
          {
            "@category": "standard",
            "@height": "340",
            "@width": "666",
            "@_fa": "true",
            "$": "https://api.elsevier.com/content/object/eid/1-s2.0-S2468823124007545-gr3.jpg?httpAccept=%2A%2F%2A",
            "@multimediatype": "JPEG image file",
            "@type": "IMAGE-DOWNSAMPLED",
            "@size": "63172",
            "@ref": "gr3",
            "@mimetype": "image/jpeg"
          },
          {
            "@category": "standard",
            "@height": "187",
            "@width": "762",
            "@_fa": "true",
            "$": "https://api.elsevier.com/content/object/eid/1-s2.0-S2468823124007545-gr4.jpg?httpAccept=%2A%2F%2A",
            "@multimediatype": "JPEG image file",
            "@type": "IMAGE-DOWNSAMPLED",
            "@size": "48471",
            "@ref": "gr4",
            "@mimetype": "image/jpeg"
          },
          {
            "@category": "standard",
            "@height": "322",
            "@width": "493",
            "@_fa": "true",
            "$": "https://api.elsevier.com/content/object/eid/1-s2.0-S2468823124007545-gr1.jpg?httpAccept=%2A%2F%2A",
            "@multimediatype": "JPEG image file",
            "@type": "IMAGE-DOWNSAMPLED",
            "@size": "35830",
            "@ref": "gr1",
            "@mimetype": "image/jpeg"
          },
          {
            "@category": "standard",
            "@height": "35",
            "@width": "67",
            "@_fa": "true",
            "$": "https://api.elsevier.com/content/object/eid/1-s2.0-S2468823124007545-fx8.jpg?httpAccept=%2A%2F%2A",
            "@multimediatype": "JPEG image file",
            "@type": "IMAGE-DOWNSAMPLED",
            "@size": "1270",
            "@ref": "fx8",
            "@mimetype": "image/jpeg"
          },
          {
            "@category": "standard",
            "@height": "314",
            "@width": "593",
            "@_fa": "true",
            "$": "https://api.elsevier.com/content/object/eid/1-s2.0-S2468823124007545-gr2.jpg?httpAccept=%2A%2F%2A",
            "@multimediatype": "JPEG image file",
            "@type": "IMAGE-DOWNSAMPLED",
            "@size": "38901",
            "@ref": "gr2",
            "@mimetype": "image/jpeg"
          },
          {
            "@category": "standard",
            "@height": "33",
            "@width": "74",
            "@_fa": "true",
            "$": "https://api.elsevier.com/content/object/eid/1-s2.0-S2468823124007545-fx9.jpg?httpAccept=%2A%2F%2A",
            "@multimediatype": "JPEG image file",
            "@type": "IMAGE-DOWNSAMPLED",
            "@size": "1236",
            "@ref": "fx9",
            "@mimetype": "image/jpeg"
          },
          {
            "@category": "standard",
            "@height": "43",
            "@width": "36",
            "@_fa": "true",
            "$": "https://api.elsevier.com/content/object/eid/1-s2.0-S2468823124007545-fx6.jpg?httpAccept=%2A%2F%2A",
            "@multimediatype": "JPEG image file",
            "@type": "IMAGE-DOWNSAMPLED",
            "@size": "1144",
            "@ref": "fx6",
            "@mimetype": "image/jpeg"
          },
          {
            "@category": "standard",
            "@height": "41",
            "@width": "56",
            "@_fa": "true",
            "$": "https://api.elsevier.com/content/object/eid/1-s2.0-S2468823124007545-fx7.jpg?httpAccept=%2A%2F%2A",
            "@multimediatype": "JPEG image file",
            "@type": "IMAGE-DOWNSAMPLED",
            "@size": "1313",
            "@ref": "fx7",
            "@mimetype": "image/jpeg"
          },
          {
            "@category": "standard",
            "@height": "47",
            "@width": "40",
            "@_fa": "true",
            "$": "https://api.elsevier.com/content/object/eid/1-s2.0-S2468823124007545-fx4.jpg?httpAccept=%2A%2F%2A",
            "@multimediatype": "JPEG image file",
            "@type": "IMAGE-DOWNSAMPLED",
            "@size": "952",
            "@ref": "fx4",
            "@mimetype": "image/jpeg"
          },
          {
            "@category": "standard",
            "@height": "39",
            "@width": "53",
            "@_fa": "true",
            "$": "https://api.elsevier.com/content/object/eid/1-s2.0-S2468823124007545-fx5.jpg?httpAccept=%2A%2F%2A",
            "@multimediatype": "JPEG image file",
            "@type": "IMAGE-DOWNSAMPLED",
            "@size": "1076",
            "@ref": "fx5",
            "@mimetype": "image/jpeg"
          },
          {
            "@category": "standard",
            "@height": "34",
            "@width": "32",
            "@_fa": "true",
            "$": "https://api.elsevier.com/content/object/eid/1-s2.0-S2468823124007545-fx2.jpg?httpAccept=%2A%2F%2A",
            "@multimediatype": "JPEG image file",
            "@type": "IMAGE-DOWNSAMPLED",
            "@size": "840",
            "@ref": "fx2",
            "@mimetype": "image/jpeg"
          },
          {
            "@category": "standard",
            "@height": "151",
            "@width": "762",
            "@_fa": "true",
            "$": "https://api.elsevier.com/content/object/eid/1-s2.0-S2468823124007545-sc1.jpg?httpAccept=%2A%2F%2A",
            "@multimediatype": "JPEG image file",
            "@type": "IMAGE-DOWNSAMPLED",
            "@size": "21094",
            "@ref": "sc1",
            "@mimetype": "image/jpeg"
          },
          {
            "@category": "standard",
            "@height": "35",
            "@width": "54",
            "@_fa": "true",
            "$": "https://api.elsevier.com/content/object/eid/1-s2.0-S2468823124007545-fx3.jpg?httpAccept=%2A%2F%2A",
            "@multimediatype": "JPEG image file",
            "@type": "IMAGE-DOWNSAMPLED",
            "@size": "1152",
            "@ref": "fx3",
            "@mimetype": "image/jpeg"
          },
          {
            "@category": "standard",
            "@height": "106",
            "@width": "470",
            "@_fa": "true",
            "$": "https://api.elsevier.com/content/object/eid/1-s2.0-S2468823124007545-fx1.jpg?httpAccept=%2A%2F%2A",
            "@multimediatype": "JPEG image file",
            "@type": "IMAGE-DOWNSAMPLED",
            "@size": "10461",
            "@ref": "fx1",
            "@mimetype": "image/jpeg"
          },
          {
            "@category": "thumbnail",
            "@height": "117",
            "@width": "219",
            "@_fa": "true",
            "$": "https://api.elsevier.com/content/object/eid/1-s2.0-S2468823124007545-fx10.sml?httpAccept=%2A%2F%2A",
            "@multimediatype": "GIF image file",
            "@type": "IMAGE-THUMBNAIL",
            "@size": "4400",
            "@ref": "fx10",
            "@mimetype": "image/gif"
          },
          {
            "@category": "thumbnail",
            "@height": "97",
            "@width": "219",
            "@_fa": "true",
            "$": "https://api.elsevier.com/content/object/eid/1-s2.0-S2468823124007545-ga1.sml?httpAccept=%2A%2F%2A",
            "@multimediatype": "GIF image file",
            "@type": "IMAGE-THUMBNAIL",
            "@size": "11883",
            "@ref": "ga1",
            "@mimetype": "image/gif"
          },
          {
            "@category": "thumbnail",
            "@height": "133",
            "@width": "219",
            "@_fa": "true",
            "$": "https://api.elsevier.com/content/object/eid/1-s2.0-S2468823124007545-fx13.sml?httpAccept=%2A%2F%2A",
            "@multimediatype": "GIF image file",
            "@type": "IMAGE-THUMBNAIL",
            "@size": "4164",
            "@ref": "fx13",
            "@mimetype": "image/gif"
          },
          {
            "@category": "thumbnail",
            "@height": "98",
            "@width": "219",
            "@_fa": "true",
            "$": "https://api.elsevier.com/content/object/eid/1-s2.0-S2468823124007545-fx11.sml?httpAccept=%2A%2F%2A",
            "@multimediatype": "GIF image file",
            "@type": "IMAGE-THUMBNAIL",
            "@size": "3941",
            "@ref": "fx11",
            "@mimetype": "image/gif"
          },
          {
            "@category": "thumbnail",
            "@height": "88",
            "@width": "219",
            "@_fa": "true",
            "$": "https://api.elsevier.com/content/object/eid/1-s2.0-S2468823124007545-fx12.sml?httpAccept=%2A%2F%2A",
            "@multimediatype": "GIF image file",
            "@type": "IMAGE-THUMBNAIL",
            "@size": "3477",
            "@ref": "fx12",
            "@mimetype": "image/gif"
          },
          {
            "@category": "thumbnail",
            "@height": "52",
            "@width": "219",
            "@_fa": "true",
            "$": "https://api.elsevier.com/content/object/eid/1-s2.0-S2468823124007545-gr7.sml?httpAccept=%2A%2F%2A",
            "@multimediatype": "GIF image file",
            "@type": "IMAGE-THUMBNAIL",
            "@size": "6551",
            "@ref": "gr7",
            "@mimetype": "image/gif"
          },
          {
            "@category": "thumbnail",
            "@height": "81",
            "@width": "219",
            "@_fa": "true",
            "$": "https://api.elsevier.com/content/object/eid/1-s2.0-S2468823124007545-gr8.sml?httpAccept=%2A%2F%2A",
            "@multimediatype": "GIF image file",
            "@type": "IMAGE-THUMBNAIL",
            "@size": "8198",
            "@ref": "gr8",
            "@mimetype": "image/gif"
          },
          {
            "@category": "thumbnail",
            "@height": "144",
            "@width": "219",
            "@_fa": "true",
            "$": "https://api.elsevier.com/content/object/eid/1-s2.0-S2468823124007545-gr5.sml?httpAccept=%2A%2F%2A",
            "@multimediatype": "GIF image file",
            "@type": "IMAGE-THUMBNAIL",
            "@size": "26471",
            "@ref": "gr5",
            "@mimetype": "image/gif"
          },
          {
            "@category": "thumbnail",
            "@height": "160",
            "@width": "219",
            "@_fa": "true",
            "$": "https://api.elsevier.com/content/object/eid/1-s2.0-S2468823124007545-gr6.sml?httpAccept=%2A%2F%2A",
            "@multimediatype": "GIF image file",
            "@type": "IMAGE-THUMBNAIL",
            "@size": "9139",
            "@ref": "gr6",
            "@mimetype": "image/gif"
          },
          {
            "@category": "thumbnail",
            "@height": "112",
            "@width": "219",
            "@_fa": "true",
            "$": "https://api.elsevier.com/content/object/eid/1-s2.0-S2468823124007545-gr3.sml?httpAccept=%2A%2F%2A",
            "@multimediatype": "GIF image file",
            "@type": "IMAGE-THUMBNAIL",
            "@size": "10101",
            "@ref": "gr3",
            "@mimetype": "image/gif"
          },
          {
            "@category": "thumbnail",
            "@height": "54",
            "@width": "219",
            "@_fa": "true",
            "$": "https://api.elsevier.com/content/object/eid/1-s2.0-S2468823124007545-gr4.sml?httpAccept=%2A%2F%2A",
            "@multimediatype": "GIF image file",
            "@type": "IMAGE-THUMBNAIL",
            "@size": "6868",
            "@ref": "gr4",
            "@mimetype": "image/gif"
          },
          {
            "@category": "thumbnail",
            "@height": "143",
            "@width": "219",
            "@_fa": "true",
            "$": "https://api.elsevier.com/content/object/eid/1-s2.0-S2468823124007545-gr1.sml?httpAccept=%2A%2F%2A",
            "@multimediatype": "GIF image file",
            "@type": "IMAGE-THUMBNAIL",
            "@size": "9103",
            "@ref": "gr1",
            "@mimetype": "image/gif"
          },
          {
            "@category": "thumbnail",
            "@height": "115",
            "@width": "219",
            "@_fa": "true",
            "$": "https://api.elsevier.com/content/object/eid/1-s2.0-S2468823124007545-fx8.sml?httpAccept=%2A%2F%2A",
            "@multimediatype": "GIF image file",
            "@type": "IMAGE-THUMBNAIL",
            "@size": "3895",
            "@ref": "fx8",
            "@mimetype": "image/gif"
          },
          {
            "@category": "thumbnail",
            "@height": "116",
            "@width": "219",
            "@_fa": "true",
            "$": "https://api.elsevier.com/content/object/eid/1-s2.0-S2468823124007545-gr2.sml?httpAccept=%2A%2F%2A",
            "@multimediatype": "GIF image file",
            "@type": "IMAGE-THUMBNAIL",
            "@size": "10664",
            "@ref": "gr2",
            "@mimetype": "image/gif"
          },
          {
            "@category": "thumbnail",
            "@height": "96",
            "@width": "219",
            "@_fa": "true",
            "$": "https://api.elsevier.com/content/object/eid/1-s2.0-S2468823124007545-fx9.sml?httpAccept=%2A%2F%2A",
            "@multimediatype": "GIF image file",
            "@type": "IMAGE-THUMBNAIL",
            "@size": "3750",
            "@ref": "fx9",
            "@mimetype": "image/gif"
          },
          {
            "@category": "thumbnail",
            "@height": "191",
            "@width": "161",
            "@_fa": "true",
            "$": "https://api.elsevier.com/content/object/eid/1-s2.0-S2468823124007545-fx6.sml?httpAccept=%2A%2F%2A",
            "@multimediatype": "GIF image file",
            "@type": "IMAGE-THUMBNAIL",
            "@size": "4277",
            "@ref": "fx6",
            "@mimetype": "image/gif"
          },
          {
            "@category": "thumbnail",
            "@height": "162",
            "@width": "219",
            "@_fa": "true",
            "$": "https://api.elsevier.com/content/object/eid/1-s2.0-S2468823124007545-fx7.sml?httpAccept=%2A%2F%2A",
            "@multimediatype": "GIF image file",
            "@type": "IMAGE-THUMBNAIL",
            "@size": "5322",
            "@ref": "fx7",
            "@mimetype": "image/gif"
          },
          {
            "@category": "thumbnail",
            "@height": "206",
            "@width": "177",
            "@_fa": "true",
            "$": "https://api.elsevier.com/content/object/eid/1-s2.0-S2468823124007545-fx4.sml?httpAccept=%2A%2F%2A",
            "@multimediatype": "GIF image file",
            "@type": "IMAGE-THUMBNAIL",
            "@size": "3898",
            "@ref": "fx4",
            "@mimetype": "image/gif"
          },
          {
            "@category": "thumbnail",
            "@height": "161",
            "@width": "219",
            "@_fa": "true",
            "$": "https://api.elsevier.com/content/object/eid/1-s2.0-S2468823124007545-fx5.sml?httpAccept=%2A%2F%2A",
            "@multimediatype": "GIF image file",
            "@type": "IMAGE-THUMBNAIL",
            "@size": "4543",
            "@ref": "fx5",
            "@mimetype": "image/gif"
          },
          {
            "@category": "thumbnail",
            "@height": "151",
            "@width": "143",
            "@_fa": "true",
            "$": "https://api.elsevier.com/content/object/eid/1-s2.0-S2468823124007545-fx2.sml?httpAccept=%2A%2F%2A",
            "@multimediatype": "GIF image file",
            "@type": "IMAGE-THUMBNAIL",
            "@size": "3594",
            "@ref": "fx2",
            "@mimetype": "image/gif"
          },
          {
            "@category": "thumbnail",
            "@height": "43",
            "@width": "219",
            "@_fa": "true",
            "$": "https://api.elsevier.com/content/object/eid/1-s2.0-S2468823124007545-sc1.sml?httpAccept=%2A%2F%2A",
            "@multimediatype": "GIF image file",
            "@type": "IMAGE-THUMBNAIL",
            "@size": "4877",
            "@ref": "sc1",
            "@mimetype": "image/gif"
          },
          {
            "@category": "thumbnail",
            "@height": "141",
            "@width": "219",
            "@_fa": "true",
            "$": "https://api.elsevier.com/content/object/eid/1-s2.0-S2468823124007545-fx3.sml?httpAccept=%2A%2F%2A",
            "@multimediatype": "GIF image file",
            "@type": "IMAGE-THUMBNAIL",
            "@size": "4841",
            "@ref": "fx3",
            "@mimetype": "image/gif"
          },
          {
            "@category": "thumbnail",
            "@height": "50",
            "@width": "219",
            "@_fa": "true",
            "$": "https://api.elsevier.com/content/object/eid/1-s2.0-S2468823124007545-fx1.sml?httpAccept=%2A%2F%2A",
            "@multimediatype": "GIF image file",
            "@type": "IMAGE-THUMBNAIL",
            "@size": "2682",
            "@ref": "fx1",
            "@mimetype": "image/gif"
          },
          {
            "@category": "high",
            "@height": "156",
            "@width": "293",
            "@_fa": "true",
            "$": "https://api.elsevier.com/content/object/eid/1-s2.0-S2468823124007545-fx10_lrg.jpg?httpAccept=%2A%2F%2A",
            "@multimediatype": "JPEG image file",
            "@type": "IMAGE-HIGH-RES",
            "@size": "7519",
            "@ref": "fx10",
            "@mimetype": "image/jpeg"
          },
          {
            "@category": "high",
            "@height": "886",
            "@width": "2000",
            "@_fa": "true",
            "$": "https://api.elsevier.com/content/object/eid/1-s2.0-S2468823124007545-ga1_lrg.jpg?httpAccept=%2A%2F%2A",
            "@multimediatype": "JPEG image file",
            "@type": "IMAGE-HIGH-RES",
            "@size": "367037",
            "@ref": "ga1",
            "@mimetype": "image/jpeg"
          },
          {
            "@category": "high",
            "@height": "149",
            "@width": "245",
            "@_fa": "true",
            "$": "https://api.elsevier.com/content/object/eid/1-s2.0-S2468823124007545-fx13_lrg.jpg?httpAccept=%2A%2F%2A",
            "@multimediatype": "JPEG image file",
            "@type": "IMAGE-HIGH-RES",
            "@size": "5172",
            "@ref": "fx13",
            "@mimetype": "image/jpeg"
          },
          {
            "@category": "high",
            "@height": "130",
            "@width": "291",
            "@_fa": "true",
            "$": "https://api.elsevier.com/content/object/eid/1-s2.0-S2468823124007545-fx11_lrg.jpg?httpAccept=%2A%2F%2A",
            "@multimediatype": "JPEG image file",
            "@type": "IMAGE-HIGH-RES",
            "@size": "6690",
            "@ref": "fx11",
            "@mimetype": "image/jpeg"
          },
          {
            "@category": "high",
            "@height": "130",
            "@width": "324",
            "@_fa": "true",
            "$": "https://api.elsevier.com/content/object/eid/1-s2.0-S2468823124007545-fx12_lrg.jpg?httpAccept=%2A%2F%2A",
            "@multimediatype": "JPEG image file",
            "@type": "IMAGE-HIGH-RES",
            "@size": "6696",
            "@ref": "fx12",
            "@mimetype": "image/jpeg"
          },
          {
            "@category": "high",
            "@height": "797",
            "@width": "3330",
            "@_fa": "true",
            "$": "https://api.elsevier.com/content/object/eid/1-s2.0-S2468823124007545-gr7_lrg.jpg?httpAccept=%2A%2F%2A",
            "@multimediatype": "JPEG image file",
            "@type": "IMAGE-HIGH-RES",
            "@size": "246990",
            "@ref": "gr7",
            "@mimetype": "image/jpeg"
          },
          {
            "@category": "high",
            "@height": "1024",
            "@width": "2776",
            "@_fa": "true",
            "$": "https://api.elsevier.com/content/object/eid/1-s2.0-S2468823124007545-gr8_lrg.jpg?httpAccept=%2A%2F%2A",
            "@multimediatype": "JPEG image file",
            "@type": "IMAGE-HIGH-RES",
            "@size": "348230",
            "@ref": "gr8",
            "@mimetype": "image/jpeg"
          },
          {
            "@category": "high",
            "@height": "1742",
            "@width": "2642",
            "@_fa": "true",
            "$": "https://api.elsevier.com/content/object/eid/1-s2.0-S2468823124007545-gr5_lrg.jpg?httpAccept=%2A%2F%2A",
            "@multimediatype": "JPEG image file",
            "@type": "IMAGE-HIGH-RES",
            "@size": "956615",
            "@ref": "gr5",
            "@mimetype": "image/jpeg"
          },
          {
            "@category": "high",
            "@height": "1951",
            "@width": "2671",
            "@_fa": "true",
            "$": "https://api.elsevier.com/content/object/eid/1-s2.0-S2468823124007545-gr6_lrg.jpg?httpAccept=%2A%2F%2A",
            "@multimediatype": "JPEG image file",
            "@type": "IMAGE-HIGH-RES",
            "@size": "383587",
            "@ref": "gr6",
            "@mimetype": "image/jpeg"
          },
          {
            "@category": "high",
            "@height": "1506",
            "@width": "2950",
            "@_fa": "true",
            "$": "https://api.elsevier.com/content/object/eid/1-s2.0-S2468823124007545-gr3_lrg.jpg?httpAccept=%2A%2F%2A",
            "@multimediatype": "JPEG image file",
            "@type": "IMAGE-HIGH-RES",
            "@size": "475459",
            "@ref": "gr3",
            "@mimetype": "image/jpeg"
          },
          {
            "@category": "high",
            "@height": "830",
            "@width": "3374",
            "@_fa": "true",
            "$": "https://api.elsevier.com/content/object/eid/1-s2.0-S2468823124007545-gr4_lrg.jpg?httpAccept=%2A%2F%2A",
            "@multimediatype": "JPEG image file",
            "@type": "IMAGE-HIGH-RES",
            "@size": "353233",
            "@ref": "gr4",
            "@mimetype": "image/jpeg"
          },
          {
            "@category": "high",
            "@height": "1428",
            "@width": "2185",
            "@_fa": "true",
            "$": "https://api.elsevier.com/content/object/eid/1-s2.0-S2468823124007545-gr1_lrg.jpg?httpAccept=%2A%2F%2A",
            "@multimediatype": "JPEG image file",
            "@type": "IMAGE-HIGH-RES",
            "@size": "296585",
            "@ref": "gr1",
            "@mimetype": "image/jpeg"
          },
          {
            "@category": "high",
            "@height": "156",
            "@width": "298",
            "@_fa": "true",
            "$": "https://api.elsevier.com/content/object/eid/1-s2.0-S2468823124007545-fx8_lrg.jpg?httpAccept=%2A%2F%2A",
            "@multimediatype": "JPEG image file",
            "@type": "IMAGE-HIGH-RES",
            "@size": "6939",
            "@ref": "fx8",
            "@mimetype": "image/jpeg"
          },
          {
            "@category": "high",
            "@height": "1392",
            "@width": "2628",
            "@_fa": "true",
            "$": "https://api.elsevier.com/content/object/eid/1-s2.0-S2468823124007545-gr2_lrg.jpg?httpAccept=%2A%2F%2A",
            "@multimediatype": "JPEG image file",
            "@type": "IMAGE-HIGH-RES",
            "@size": "284959",
            "@ref": "gr2",
            "@mimetype": "image/jpeg"
          },
          {
            "@category": "high",
            "@height": "145",
            "@width": "330",
            "@_fa": "true",
            "$": "https://api.elsevier.com/content/object/eid/1-s2.0-S2468823124007545-fx9_lrg.jpg?httpAccept=%2A%2F%2A",
            "@multimediatype": "JPEG image file",
            "@type": "IMAGE-HIGH-RES",
            "@size": "7523",
            "@ref": "fx9",
            "@mimetype": "image/jpeg"
          },
          {
            "@category": "high",
            "@height": "191",
            "@width": "161",
            "@_fa": "true",
            "$": "https://api.elsevier.com/content/object/eid/1-s2.0-S2468823124007545-fx6_lrg.jpg?httpAccept=%2A%2F%2A",
            "@multimediatype": "JPEG image file",
            "@type": "IMAGE-HIGH-RES",
            "@size": "5809",
            "@ref": "fx6",
            "@mimetype": "image/jpeg"
          },
          {
            "@category": "high",
            "@height": "183",
            "@width": "248",
            "@_fa": "true",
            "$": "https://api.elsevier.com/content/object/eid/1-s2.0-S2468823124007545-fx7_lrg.jpg?httpAccept=%2A%2F%2A",
            "@multimediatype": "JPEG image file",
            "@type": "IMAGE-HIGH-RES",
            "@size": "7338",
            "@ref": "fx7",
            "@mimetype": "image/jpeg"
          },
          {
            "@category": "high",
            "@height": "206",
            "@width": "177",
            "@_fa": "true",
            "$": "https://api.elsevier.com/content/object/eid/1-s2.0-S2468823124007545-fx4_lrg.jpg?httpAccept=%2A%2F%2A",
            "@multimediatype": "JPEG image file",
            "@type": "IMAGE-HIGH-RES",
            "@size": "5146",
            "@ref": "fx4",
            "@mimetype": "image/jpeg"
          },
          {
            "@category": "high",
            "@height": "175",
            "@width": "238",
            "@_fa": "true",
            "$": "https://api.elsevier.com/content/object/eid/1-s2.0-S2468823124007545-fx5_lrg.jpg?httpAccept=%2A%2F%2A",
            "@multimediatype": "JPEG image file",
            "@type": "IMAGE-HIGH-RES",
            "@size": "5800",
            "@ref": "fx5",
            "@mimetype": "image/jpeg"
          },
          {
            "@category": "high",
            "@height": "151",
            "@width": "143",
            "@_fa": "true",
            "$": "https://api.elsevier.com/content/object/eid/1-s2.0-S2468823124007545-fx2_lrg.jpg?httpAccept=%2A%2F%2A",
            "@multimediatype": "JPEG image file",
            "@type": "IMAGE-HIGH-RES",
            "@size": "4255",
            "@ref": "fx2",
            "@mimetype": "image/jpeg"
          },
          {
            "@category": "high",
            "@height": "668",
            "@width": "3372",
            "@_fa": "true",
            "$": "https://api.elsevier.com/content/object/eid/1-s2.0-S2468823124007545-sc1_lrg.jpg?httpAccept=%2A%2F%2A",
            "@multimediatype": "JPEG image file",
            "@type": "IMAGE-HIGH-RES",
            "@size": "163767",
            "@ref": "sc1",
            "@mimetype": "image/jpeg"
          },
          {
            "@category": "high",
            "@height": "156",
            "@width": "243",
            "@_fa": "true",
            "$": "https://api.elsevier.com/content/object/eid/1-s2.0-S2468823124007545-fx3_lrg.jpg?httpAccept=%2A%2F%2A",
            "@multimediatype": "JPEG image file",
            "@type": "IMAGE-HIGH-RES",
            "@size": "6293",
            "@ref": "fx3",
            "@mimetype": "image/jpeg"
          },
          {
            "@category": "high",
            "@height": "471",
            "@width": "2083",
            "@_fa": "true",
            "$": "https://api.elsevier.com/content/object/eid/1-s2.0-S2468823124007545-fx1_lrg.jpg?httpAccept=%2A%2F%2A",
            "@multimediatype": "JPEG image file",
            "@type": "IMAGE-HIGH-RES",
            "@size": "76828",
            "@ref": "fx1",
            "@mimetype": "image/jpeg"
          },
          {
            "@category": "standard",
            "@_fa": "true",
            "$": "https://api.elsevier.com/content/object/eid/1-s2.0-S2468823124007545-mmc1.docx?httpAccept=%2A%2F%2A",
            "@multimediatype": "Microsoft Word file",
            "@type": "APPLICATION",
            "@size": "8535411",
            "@ref": "mmc1",
            "@mimetype": "application/word"
          }
        ]
      },
      "link": {
        "@rel": "abstract",
        "@href": "https://api.elsevier.com/content/abstract/scopus_id/85204724711"
      }
    }
  }
}