{
  "metadata": {
    "title": "Aerobic epoxidation of α-pinene using Mn/SAPO-34 catalyst: Optimization via Response Surface Methodology (RSM)",
    "authors": "; ; ",
    "journal": "Molecular Catalysis",
    "date": "2023-01-15",
    "doi": "10.1016/j.mcat.2022.112872",
    "abstract": "",
    "uri": "https://api.elsevier.com/content/article/pii/S2468823122007581",
    "pii": "S2468823122007581"
  },
  "fulltext": {
    "full-text-retrieval-response": {
      "scopus-eid": "2-s2.0-85144495865",
      "originalText": "serial JL 315758 291210 291744 291790 291809 31 Molecular Catalysis MOLECULARCATALYSIS 2022-12-21 2022-12-21 2022-12-21 2022-12-21 2023-01-07T15:56:45 1-s2.0-S2468823122007581 S2468-8231(22)00758-1 S2468823122007581 10.1016/j.mcat.2022.112872 S300 S300.1 FULL-TEXT 1-s2.0-S2468823122X00187 2024-06-26T17:47:58.012062Z 0 0 20230115 2023 2022-12-21T23:54:59.309519Z absattachment articleinfo articlenumber articletitlenorm authfirstinitialnorm authfirstsurnamenorm cid cids contenttype copyright crossmark dateloaded dateloadedtxt datesearch datesort dateupdated dco docsubtype doctype doi eid ewtransactionid hubeid indexeddate issn issnnorm itemstage itemtransactionid itemweight openaccess openarchive pg pgfirst pii piinorm pubdatestart pubdatetxt pubyr sectiontitle sortorder srctitle srctitlenorm srctype ssids alllist content subj subheadings suppl tomb volfirst volissue volumelist webpdf webpdfpagecount yearnav figure table e-component body mmlmath acknowledge affil appendices articletitle auth authfirstini authfull authkeywords authlast grantnumber grantsponsor highlightsabst orcid primabst ref specialabst 2468-8231 24688231 true 535 535 C Volume 535 60 112872 112872 112872 20230115 15 January 2023 2023-01-15 2023 Regular Papers article fla © 2022 Elsevier B.V. All rights reserved. AEROBICEPOXIDATIONPINENEUSINGMNSAPO34CATALYSTOPTIMIZATIONVIARESPONSESURFACEMETHODOLOGYRSM HUANG P 1 Introduction 2 Experimental 2.1 Materials 2.2 Preparation of catalysts 2.3 Characterization of catalysts 2.4 Catalytic reaction tests 2.5 Optimization of process 3 Results and discussion 3.1 Single-factor experiments 3.2 Optimization of epoxidation conditions by RSM 3.2.1 Model design 3.2.2 Data analysis 3.2.3 Effect of factors and optimal conditions 3.3 Reusability investigation of the catalyst 3.4 Characterization of catalyst structure 3.5 The investigation of reaction products and mechanism 3.6 Comparison of Mn-SAPO-34 with literature report 4 Conclusion CRediT authorship contribution statement Acknowledgments Appendix Supplementary materials References LU 2022 134582 C MUZYKA 2022 15 C YACOUB 2022 K HUANG 2022 2352 2365 P CAO 2015 3935 3944 Y GRZESZCZAK 2022 J NABAE 2013 230 236 Y ZHAO 2018 1901 1908 X MIRKHANI 2007 49 57 V MAVUSO 2020 9775 9788 M RAYATI 2017 7987 7991 S TANG 2012 68 71 B ZHOU 2010 411 417 X PHILIP 2021 1272 1289 R MAKSIMCHUK 2007 241 248 N YAN 2019 16827 16843 W NODZEWSKA 2019 181 216 A YAN 2016 75 84 W MASTERIFARAHANI 2013 39 42 M YOON 2012 1196 1231 M STUBBS 2018 596 601 A CHATTERJEE 2018 791 798 S PANG 2017 32146 32154 C TANG 2013 42 47 B HU 2017 5785 5794 B REN 2017 123 130 S CANEPA 2015 65 73 A RAUPP 2017 1 6 Y BHUNIA 2013 1986 1995 A YANG 2018 409 420 C DARLLAN 2021 111250 R WEIHSIN 2022 112917 C VANTOAN 2022 121328 N MADADI 2020 118049 S HUANG 2016 54 57 L YU 2014 6565 6575 T JI 2022 1 10 C YAO 2021 1381 1393 J CHEN 2015 2375 2385 F GOSTYNSKI 2017 27718 27728 R WANG 2019 151 160 Y WANG 2020 227505 Y QI 2011 44 51 B SALADINO 2005 1069 1075 R QI 2005 45 49 J HUANGX2023X112872 HUANGX2023X112872XP 2024-12-21T00:00:00.000Z 2024-12-21T00:00:00.000Z http://creativecommons.org/licenses/by-nc-nd/4.0/ © 2022 Elsevier B.V. All rights reserved. 2022-12-28T00:44:11.157Z http://vtw.elsevier.com/data/voc/AddOnTypes/50.7/aggregated-refined Kunming University of Science and Technology Analysis and Testing Foundation of Kunming University of Science and Technology http://data.elsevier.com/vocabulary/SciValFunders/501100005194 http://sws.geonames.org/1814991/ National Natural Science Foundation of China 21266012 21706108 21766016 22068023 NSFC National Natural Science Foundation of China http://data.elsevier.com/vocabulary/SciValFunders/501100001809 http://sws.geonames.org/1814991/ The authors thank the financial supports by the National Natural Science Foundation of China (Nos. 21266012 , 22068023 , 21766016 and 21706108 ) and the Analysis and Testing Center of Kunming University of Science and Technology. 0 https://doi.org/10.15223/policy-017 https://doi.org/10.15223/policy-037 https://doi.org/10.15223/policy-012 https://doi.org/10.15223/policy-029 https://doi.org/10.15223/policy-004 item S2468-8231(22)00758-1 S2468823122007581 1-s2.0-S2468823122007581 10.1016/j.mcat.2022.112872 315758 2023-01-07T16:15:48.580262Z 2023-01-15 1-s2.0-S2468823122007581-main.pdf https://s3-eu-west-1.amazonaws.com/prod-ucs-content-store-eu-west/content/pii:S2468823122007581/MAIN/application/pdf/54db5abaf9ef880d52657dd645055b3f/main.pdf main.pdf pdf true 11515324 MAIN 12 1-s2.0-S2468823122007581-main_1.png https://s3-eu-west-1.amazonaws.com/prod-ucs-content-store-eu-west/content/pii:S2468823122007581/PREVIEW/image/png/dcb3a6d61a88856dcae8c064514906a2/main_1.png main_1.png png 59312 849 656 IMAGE-WEB-PDF 1 1-s2.0-S2468823122007581-gr3.jpg https://s3-eu-west-1.amazonaws.com/prod-ucs-content-store-eu-west/content/pii:S2468823122007581/gr3/DOWNSAMPLED/image/jpeg/c60aef0e31ad003a877251b2987c82a9/gr3.jpg gr3 gr3.jpg jpg 28788 311 339 IMAGE-DOWNSAMPLED 1-s2.0-S2468823122007581-gr4.jpg https://s3-eu-west-1.amazonaws.com/prod-ucs-content-store-eu-west/content/pii:S2468823122007581/gr4/DOWNSAMPLED/image/jpeg/160c041a2ebe5884cc766aa0c2718735/gr4.jpg gr4 gr4.jpg jpg 54832 228 659 IMAGE-DOWNSAMPLED 1-s2.0-S2468823122007581-gr5.jpg https://s3-eu-west-1.amazonaws.com/prod-ucs-content-store-eu-west/content/pii:S2468823122007581/gr5/DOWNSAMPLED/image/jpeg/bc11c2849aa897615315e2c2a4b01649/gr5.jpg gr5 gr5.jpg jpg 49115 227 659 IMAGE-DOWNSAMPLED 1-s2.0-S2468823122007581-gr6.jpg https://s3-eu-west-1.amazonaws.com/prod-ucs-content-store-eu-west/content/pii:S2468823122007581/gr6/DOWNSAMPLED/image/jpeg/59d8fb4a48074d0318fb277c951c174c/gr6.jpg gr6 gr6.jpg jpg 53597 231 659 IMAGE-DOWNSAMPLED 1-s2.0-S2468823122007581-gr1.jpg https://s3-eu-west-1.amazonaws.com/prod-ucs-content-store-eu-west/content/pii:S2468823122007581/gr1/DOWNSAMPLED/image/jpeg/5f7ae947ce028f357c3f97ab190d88bd/gr1.jpg gr1 gr1.jpg jpg 49833 454 659 IMAGE-DOWNSAMPLED 1-s2.0-S2468823122007581-gr2.jpg https://s3-eu-west-1.amazonaws.com/prod-ucs-content-store-eu-west/content/pii:S2468823122007581/gr2/DOWNSAMPLED/image/jpeg/42c45b9c1cb50e22c21cb70b99f5202d/gr2.jpg gr2 gr2.jpg jpg 125500 887 565 IMAGE-DOWNSAMPLED 1-s2.0-S2468823122007581-gr7.jpg https://s3-eu-west-1.amazonaws.com/prod-ucs-content-store-eu-west/content/pii:S2468823122007581/gr7/DOWNSAMPLED/image/jpeg/b1189b1e53fbf01b98de018fe75b7246/gr7.jpg gr7 gr7.jpg jpg 30196 281 339 IMAGE-DOWNSAMPLED 1-s2.0-S2468823122007581-gr12.jpg https://s3-eu-west-1.amazonaws.com/prod-ucs-content-store-eu-west/content/pii:S2468823122007581/gr12/DOWNSAMPLED/image/jpeg/b5754e11ca7768876444e569be32278e/gr12.jpg gr12 gr12.jpg jpg 34431 525 565 IMAGE-DOWNSAMPLED 1-s2.0-S2468823122007581-gr8.jpg https://s3-eu-west-1.amazonaws.com/prod-ucs-content-store-eu-west/content/pii:S2468823122007581/gr8/DOWNSAMPLED/image/jpeg/10fadcdb05e42d3ce0d010fe462dec8e/gr8.jpg gr8 gr8.jpg jpg 55751 323 339 IMAGE-DOWNSAMPLED 1-s2.0-S2468823122007581-gr9.jpg https://s3-eu-west-1.amazonaws.com/prod-ucs-content-store-eu-west/content/pii:S2468823122007581/gr9/DOWNSAMPLED/image/jpeg/23774890743750d86d6bfc88e67374e5/gr9.jpg gr9 gr9.jpg jpg 162627 499 659 IMAGE-DOWNSAMPLED 1-s2.0-S2468823122007581-gr10.jpg https://s3-eu-west-1.amazonaws.com/prod-ucs-content-store-eu-west/content/pii:S2468823122007581/gr10/DOWNSAMPLED/image/jpeg/e6d079acfe84161db27eea05559eda2b/gr10.jpg gr10 gr10.jpg jpg 32138 293 339 IMAGE-DOWNSAMPLED 1-s2.0-S2468823122007581-gr11.jpg https://s3-eu-west-1.amazonaws.com/prod-ucs-content-store-eu-west/content/pii:S2468823122007581/gr11/DOWNSAMPLED/image/jpeg/f3136bc4164a2bf026165627659b8518/gr11.jpg gr11 gr11.jpg jpg 68478 309 659 IMAGE-DOWNSAMPLED 1-s2.0-S2468823122007581-ga1.jpg https://s3-eu-west-1.amazonaws.com/prod-ucs-content-store-eu-west/content/pii:S2468823122007581/ga1/DOWNSAMPLED/image/jpeg/9280038d6875994ad5f22107d70d176c/ga1.jpg ga1 true ga1.jpg jpg 26760 200 273 IMAGE-DOWNSAMPLED 1-s2.0-S2468823122007581-gr3.sml https://s3-eu-west-1.amazonaws.com/prod-ucs-content-store-eu-west/content/pii:S2468823122007581/gr3/THUMBNAIL/image/gif/04127b7aaa4445699f6f076cc9ab06b6/gr3.sml gr3 gr3.sml sml 8271 164 178 IMAGE-THUMBNAIL 1-s2.0-S2468823122007581-gr4.sml https://s3-eu-west-1.amazonaws.com/prod-ucs-content-store-eu-west/content/pii:S2468823122007581/gr4/THUMBNAIL/image/gif/8ebec9efbe71aa30b92dd7189c00d5ae/gr4.sml gr4 gr4.sml sml 11157 76 219 IMAGE-THUMBNAIL 1-s2.0-S2468823122007581-gr5.sml https://s3-eu-west-1.amazonaws.com/prod-ucs-content-store-eu-west/content/pii:S2468823122007581/gr5/THUMBNAIL/image/gif/8deb1bd8319dd66b8372883fe9e090ca/gr5.sml gr5 gr5.sml sml 10475 75 219 IMAGE-THUMBNAIL 1-s2.0-S2468823122007581-gr6.sml https://s3-eu-west-1.amazonaws.com/prod-ucs-content-store-eu-west/content/pii:S2468823122007581/gr6/THUMBNAIL/image/gif/e781ddd1870b1a6f636ecc58f93dd53f/gr6.sml gr6 gr6.sml sml 11160 77 219 IMAGE-THUMBNAIL 1-s2.0-S2468823122007581-gr1.sml https://s3-eu-west-1.amazonaws.com/prod-ucs-content-store-eu-west/content/pii:S2468823122007581/gr1/THUMBNAIL/image/gif/eb8d2c4aa364fcec6875e02784eedcbb/gr1.sml gr1 gr1.sml sml 10266 151 219 IMAGE-THUMBNAIL 1-s2.0-S2468823122007581-gr2.sml https://s3-eu-west-1.amazonaws.com/prod-ucs-content-store-eu-west/content/pii:S2468823122007581/gr2/THUMBNAIL/image/gif/2b6d1021ddf866857228db51e4da50c2/gr2.sml gr2 gr2.sml sml 9314 163 104 IMAGE-THUMBNAIL 1-s2.0-S2468823122007581-gr7.sml https://s3-eu-west-1.amazonaws.com/prod-ucs-content-store-eu-west/content/pii:S2468823122007581/gr7/THUMBNAIL/image/gif/be98eb6f1941ce39514af610131d05b8/gr7.sml gr7 gr7.sml sml 12774 164 198 IMAGE-THUMBNAIL 1-s2.0-S2468823122007581-gr12.sml https://s3-eu-west-1.amazonaws.com/prod-ucs-content-store-eu-west/content/pii:S2468823122007581/gr12/THUMBNAIL/image/gif/a823808f405cad5440fd26748b1856ab/gr12.sml gr12 gr12.sml sml 4120 164 176 IMAGE-THUMBNAIL 1-s2.0-S2468823122007581-gr8.sml https://s3-eu-west-1.amazonaws.com/prod-ucs-content-store-eu-west/content/pii:S2468823122007581/gr8/THUMBNAIL/image/gif/5485380720715100d967c75163781205/gr8.sml gr8 gr8.sml sml 14187 164 172 IMAGE-THUMBNAIL 1-s2.0-S2468823122007581-gr9.sml https://s3-eu-west-1.amazonaws.com/prod-ucs-content-store-eu-west/content/pii:S2468823122007581/gr9/THUMBNAIL/image/gif/4e2260db039e32e186d794e5582db20a/gr9.sml gr9 gr9.sml sml 34416 164 216 IMAGE-THUMBNAIL 1-s2.0-S2468823122007581-gr10.sml https://s3-eu-west-1.amazonaws.com/prod-ucs-content-store-eu-west/content/pii:S2468823122007581/gr10/THUMBNAIL/image/gif/f1df66bb4264579b231d166ca9216f9b/gr10.sml gr10 gr10.sml sml 12021 163 189 IMAGE-THUMBNAIL 1-s2.0-S2468823122007581-gr11.sml https://s3-eu-west-1.amazonaws.com/prod-ucs-content-store-eu-west/content/pii:S2468823122007581/gr11/THUMBNAIL/image/gif/4e2a94d1177f6fe3b190ed03c9c02326/gr11.sml gr11 gr11.sml sml 12622 103 219 IMAGE-THUMBNAIL 1-s2.0-S2468823122007581-ga1.sml https://s3-eu-west-1.amazonaws.com/prod-ucs-content-store-eu-west/content/pii:S2468823122007581/ga1/THUMBNAIL/image/gif/c8d49ba644305bc7cd8ddc009b6bb5eb/ga1.sml ga1 true ga1.sml sml 18646 160 219 IMAGE-THUMBNAIL 1-s2.0-S2468823122007581-gr3_lrg.jpg https://s3-eu-west-1.amazonaws.com/prod-ucs-content-store-eu-west/content/pii:S2468823122007581/HIGHRES/image/jpeg/05d15199066ea6b6f4f870bc12c5ab4a/gr3_lrg.jpg gr3 gr3_lrg.jpg jpg 511575 1378 1500 IMAGE-HIGH-RES 1-s2.0-S2468823122007581-gr4_lrg.jpg https://s3-eu-west-1.amazonaws.com/prod-ucs-content-store-eu-west/content/pii:S2468823122007581/HIGHRES/image/jpeg/e40367c5a1eda9d92c54457a3d22e3b7/gr4_lrg.jpg gr4 gr4_lrg.jpg jpg 441375 1010 2917 IMAGE-HIGH-RES 1-s2.0-S2468823122007581-gr5_lrg.jpg https://s3-eu-west-1.amazonaws.com/prod-ucs-content-store-eu-west/content/pii:S2468823122007581/HIGHRES/image/jpeg/ffa377d7a1a1033822a7c9e53dacc65b/gr5_lrg.jpg gr5 gr5_lrg.jpg jpg 392644 1003 2917 IMAGE-HIGH-RES 1-s2.0-S2468823122007581-gr6_lrg.jpg https://s3-eu-west-1.amazonaws.com/prod-ucs-content-store-eu-west/content/pii:S2468823122007581/HIGHRES/image/jpeg/0c5454a46155e1b20a8e0ad8fce718cf/gr6_lrg.jpg gr6 gr6_lrg.jpg jpg 431222 1024 2917 IMAGE-HIGH-RES 1-s2.0-S2468823122007581-gr1_lrg.jpg https://s3-eu-west-1.amazonaws.com/prod-ucs-content-store-eu-west/content/pii:S2468823122007581/HIGHRES/image/jpeg/45a9d9d2dc3d23555f8b05e49f0d04f7/gr1_lrg.jpg gr1 gr1_lrg.jpg jpg 453862 2010 2917 IMAGE-HIGH-RES 1-s2.0-S2468823122007581-gr2_lrg.jpg https://s3-eu-west-1.amazonaws.com/prod-ucs-content-store-eu-west/content/pii:S2468823122007581/HIGHRES/image/jpeg/793e69db1e3045022b4acf85291b1ab6/gr2_lrg.jpg gr2 gr2_lrg.jpg jpg 1088003 3926 2500 IMAGE-HIGH-RES 1-s2.0-S2468823122007581-gr7_lrg.jpg https://s3-eu-west-1.amazonaws.com/prod-ucs-content-store-eu-west/content/pii:S2468823122007581/HIGHRES/image/jpeg/7ade319c88aa4f508987e90fa22efe78/gr7_lrg.jpg gr7 gr7_lrg.jpg jpg 636393 1243 1500 IMAGE-HIGH-RES 1-s2.0-S2468823122007581-gr12_lrg.jpg https://s3-eu-west-1.amazonaws.com/prod-ucs-content-store-eu-west/content/pii:S2468823122007581/HIGHRES/image/jpeg/44749ca4d2c9c9b53e9b723b43715fd3/gr12_lrg.jpg gr12 gr12_lrg.jpg jpg 262592 2323 2500 IMAGE-HIGH-RES 1-s2.0-S2468823122007581-gr8_lrg.jpg https://s3-eu-west-1.amazonaws.com/prod-ucs-content-store-eu-west/content/pii:S2468823122007581/HIGHRES/image/jpeg/1972af84e49f0461590bc105008d50ce/gr8_lrg.jpg gr8 gr8_lrg.jpg jpg 411479 1429 1500 IMAGE-HIGH-RES 1-s2.0-S2468823122007581-gr9_lrg.jpg https://s3-eu-west-1.amazonaws.com/prod-ucs-content-store-eu-west/content/pii:S2468823122007581/HIGHRES/image/jpeg/23fce159f96dfd9a848c2a40f08995ba/gr9_lrg.jpg gr9 gr9_lrg.jpg jpg 1376644 2209 2917 IMAGE-HIGH-RES 1-s2.0-S2468823122007581-gr10_lrg.jpg https://s3-eu-west-1.amazonaws.com/prod-ucs-content-store-eu-west/content/pii:S2468823122007581/HIGHRES/image/jpeg/17e779c0e7641dc290bfdfc18842cce4/gr10_lrg.jpg gr10 gr10_lrg.jpg jpg 197904 1297 1500 IMAGE-HIGH-RES 1-s2.0-S2468823122007581-gr11_lrg.jpg https://s3-eu-west-1.amazonaws.com/prod-ucs-content-store-eu-west/content/pii:S2468823122007581/HIGHRES/image/jpeg/83186cec4f1cbe58e6179ab6ee78dde3/gr11_lrg.jpg gr11 gr11_lrg.jpg jpg 501255 1369 2917 IMAGE-HIGH-RES 1-s2.0-S2468823122007581-ga1_lrg.jpg https://s3-eu-west-1.amazonaws.com/prod-ucs-content-store-eu-west/content/pii:S2468823122007581/HIGHRES/image/jpeg/fae459aa7889ab40e2e648b10c56b32e/ga1_lrg.jpg ga1 true ga1_lrg.jpg jpg 199406 886 1210 IMAGE-HIGH-RES 1-s2.0-S2468823122007581-mmc1.docx https://s3-eu-west-1.amazonaws.com/prod-ucs-content-store-eu-west/content/pii:S2468823122007581/mmc1/MAIN/application/vnd.openxmlformats-officedocument.wordprocessingml.document/4250f96fe194910e3e3a3d6d7342a303/mmc1.docx mmc1 mmc1.docx docx 7657316 APPLICATION 1-s2.0-S2468823122007581-si1.svg https://s3-eu-west-1.amazonaws.com/prod-ucs-content-store-eu-west/content/pii:S2468823122007581/image/svg+xml/9af1ddf748d4a7a7731a66245386c0b4/si1.svg si1 si1.svg svg 15726 ALTIMG 1-s2.0-S2468823122007581-si2.svg https://s3-eu-west-1.amazonaws.com/prod-ucs-content-store-eu-west/content/pii:S2468823122007581/image/svg+xml/d8c5b0cef5c6ee35bb575ca8fb1a6c39/si2.svg si2 si2.svg svg 21479 ALTIMG 1-s2.0-S2468823122007581-si3.svg https://s3-eu-west-1.amazonaws.com/prod-ucs-content-store-eu-west/content/pii:S2468823122007581/image/svg+xml/c7da49da4edf0b754bdc73711154575d/si3.svg si3 si3.svg svg 15915 ALTIMG 1-s2.0-S2468823122007581-si4.svg https://s3-eu-west-1.amazonaws.com/prod-ucs-content-store-eu-west/content/pii:S2468823122007581/image/svg+xml/6e573fc09d2d96658e4d1fa19495a83c/si4.svg si4 si4.svg svg 11174 ALTIMG 1-s2.0-S2468823122007581-si5.svg https://s3-eu-west-1.amazonaws.com/prod-ucs-content-store-eu-west/content/pii:S2468823122007581/image/svg+xml/84ba7ed04195e8947a053c11e5807e30/si5.svg si5 si5.svg svg 19647 ALTIMG 1-s2.0-S2468823122007581-am.pdf https://s3-eu-west-1.amazonaws.com/prod-ucs-content-store-eu-west/content/egi:10LN8DQ6ZRT/MAIN/application/pdf/c4987e4a15a009c2ca584d6699c11cd9/am.pdf am am.pdf pdf false 1561656 AAM-PDF MCAT 112872 112872 S2468-8231(22)00758-1 10.1016/j.mcat.2022.112872 Elsevier B.V. Fig. 1 Experimental setup for epoxidation of α-pinene. Fig 1 Fig. 2 The influence of solvent type (a), solvent dosage (b), Mn loading amount (c), air flow rate (d), reaction temperature (e), reaction time (f), catalyst amount (g), and co-reductant amount (h) on epoxidation of α-pinene over Mn-SAPO-34. reaction conditions: α-pinene (1.0 g), acetonitrile (20 g), Mn loading amount (3 wt%), air flow rate (70 mL/min), 12 °C, 3 h, catalyst amount (120 mg) and co-reductant amount (0.8 g). Fig 2 Fig. 3 Diagnostic plots of optimization process: predicated vs actual value for 2,3-epoxy-pinane yield model. Fig 3 Fig. 4 Response surface plot (a) and contour lines diagram (b) of the effect of co-reductant amount and Mn loading amount on the yield of 2,3-epoxy-pinane. Fig 4 Fig. 5 Response surface plots (a) and contour lines diagram (b) of the effect of co-reductant and catalyst amount on the yield of 2,3-epoxy-pinane. Fig 5 Fig. 6 Response surface plots (a) and contour lines diagram (b) of the effect of Mn loading amount and catalyst amount on the yield of 2,3-epoxy-pinane. Fig 6 Fig. 7 Reusability investigation of Mn-SAPO-34 in the epoxidation of α-pinene. Fig 7 Fig. 8 XRD patterns of Mn-SAPO-34 (fresh) (a), Mn-SAPO-34 (1st) (b), Mn-SAPO-34 (2nd) (c), Mn-SAPO-34 (3rd) (d), Mn-SAPO-34 (4th) (e), Mn-SAPO-34 (5th) (f), Mn-SAPO-34 (6th) (g), Mn-SAPO-34 (7th) (h), Mn-SAPO-34 (8th) (i) and SAPO-34 (pure) (j). Fig 8 Fig. 9 SEM and TEM images of SAPO-34 (pure) (a), Mn-SAPO-34 (fresh) (b), Mn-SAPO-34 (1st) (c), Mn-SAPO-34 (3rd) (d), Mn-SAPO-34 (6th) (e) and Mn-SAPO-34 (8th) (f). Fig 9 Fig. 10 N2 adsorption-desorption isotherms and pore size distribution of SAPO-34 (pure) (a), Mn-SAPO-34 (fresh) (b) and Mn-SAPO-34 (8th) (c). Fig 10 Fig. 11 Mn 2p3/2 and O 1s XPS spectra of Mn-SAPO-34 (fresh) (a) and Mn-SAPO-34 (8th) (i). Fig 11 Fig. 12 The mechanism of α-pinene epoxidation over Mn-SAPO-34 catalyst. Fig 12 Table 1 Box-Behnken Design and experimental result values. Table 1 Run X1 X2 X3 A B C Yield (%) 1 0 1 -1 1 3.5 90 73.45 2 0 0 0 1 3 100 92.39 3 0 1 1 1 3.5 110 82.97 4 1 -1 0 1.1 2.5 100 88.57 5 0 0 0 1 3 100 90.79 6 0 -1 1 1 2.5 110 77.62 7 0 0 0 1 3 100 91.93 8 -1 0 1 0.9 3 110 87.72 9 0 0 0 1 3 100 93.13 10 1 0 -1 1.1 3 90 86.94 11 -1 -1 0 0.9 2.5 100 80.12 12 -1 0 -1 0.9 3 90 82.96 13 0 0 0 1 3 100 91.33 14 1 0 1 1.1 3 110 94.09 15 0 -1 -1 1 2.5 90 83.89 16 -1 1 0 0.9 3.5 100 79.83 17 1 1 1 1.1 3.5 100 83.41 Table 2 Analysis of variance (AVOVA) for the yield of 2,3-epoxy-pinane. Table 2 Source Sum of Squares DF Mean Square F-value P-value(Prob > F) Result Model 570.94 9 63.44 34.02 < 0.0001 significant A 62.61 1 62.61 33.57 0.0007 – B 13.89 1 13.89 7.45 0.0294 – C 28.73 1 28.73 15.41 0.0057 – AB 5.93 1 5.93 3.18 0.1178 – AC 1.43 1 1.43 0.7658 0.4105 – BC 62.33 1 62.33 33.43 0.0007 – A2 0.2491 1 0.2491 0.1336 0.7255 – B2 317.83 1 317.83 170.44 < 0.0001 – C2 59.00 1 59.00 31.64 0.0008 – Residual 13.05 7 1.86 – – Lack of Fit 9.74 3 3.25 3.92 0.1098 not significant Pure Error 3.31 4 0.8275 Cor Total 583.99 16 R2 =0.9776, Adj-R2 = 0.9489, Pred-R2 = 0.7242, Adeq Precision = 19.9505. Table 3 Textural properties and chemical composition of SAPO-34 and Mn-SAPO-34. Table 3 Samples SBET (m2·g−1) Vpore (cm3·g−1) Pore size(nm) Atomic weight (wt%) Yield(%) P Al Si Mn SAPO-34 (pure) 563 0.263 2.34 20.3 21.4 3.9 0 – Mn-SAPO-34(fresh) 532 0.258 2.37 19.6 20.6 3.7 2.67 90.47 Mn-SAPO-34 (1st) 528 0.252 2.37 19.6 20.6 3.7 2.62 90.37 Mn-SAPO-34(2nd) 526 0.247 2.38 19.6 20.6 3.7 2.58 89.88 Mn-SAPO-34(3rd) 534 0.251 2.36 19.6 20.6 3.7 2.54 88.39 Mn-SAPO-34 (4th) 530 0.240 2.46 19.6 20.6 3.7 2.40 87.71 Mn-SAPO-34 (5th) 541 0.244 2.51 19.6 20.6 3.7 2.43 86.97 Mn-SAPO-34 (6th) 520 0.221 2.63 19.6 20.6 3.7 2.39 85.09 Mn-SAPO-34 (7th) 476 0.197 3.20 19.6 20.6 3.7 2.10 73.92 Mn-SAPO-34 (8th) 433 0.153 4.63 19.6 20.6 3.7 1.84 59.03 Table 4 Surface atomic concentrations of Mn-SAPO-34 molecular sieves. Table 4 Mn-SAPO-34 Atomic comp (%) x(Mn) (%) Mn3+/Mn4+ (%) Oxygen species (%) OⅡ/OⅠ O 1s Mn 2p Mn2+ Mn3+ Mn4+ OⅠ OⅡ a (Fresh) 36.12 3.8 36.7017.98 9.65 53.45 18.0539.26 88.13 11.87 0.13 i (8th) 41.87 0.85 23.12 58.89 93.06 6.94 0.07 Table 5 Eight groups experiment for investigating epoxidation products. Table 5 Conditions Conversion (%) Yield (%) Verbenol Verbenone 2,3-epoxy-pinane Mn-SAPO-34, air, IBA 100 2.53 3.37 90.43 Mn-SAPO-34, O2, IBAa 100 2.71 3.88 90.87 Mn-SAPO-34, IBA 1.23 - - - Mn-SAPO-34, air 38.8 6.32 5.78 21.26 air, IBA 4.11 - - 1.08 SAPO-34, air, IBA 6.8 - - 1.17 Mn-SAPO-34, air, IBA,p-benzoquinoneb 1.35 - - - (1)All the reaction conditions were optimized in Sections 3.1 and Section 3.2. (2)a: the oxidant was high-purity oxygen. (3)b: p-benzoquinone was a radical scavenger. Table 6 Comparison with the results of using different catalysts for α-pinene epoxidation. Table 6 No Catalyst Reaction condition Reusability Yield (%) Literature 1 Mn-SAPO-34 O2, IBA, acetonitrile, 15 °C, 2.5 h 6 90.47 This work 2 Co-POM/NH2-SBA-15 O2, IBA, acetonitrile, 25°C, 1 h 5 90.20 [15] 3 Co-ZSM-5(L1) Air, IBA, DFM, TBHP, 90°C, 5 h 6 84.25 [45] 4 MTO mIII H2O2, CH2Cl2/MeCN, -10°C, 1 h - 96.04 [46] 5 cis- [Mn(HL)2Cl2] O2, IBA, ClCH2CH2Cl, room temperature, 11 h - 98.01 [47] 6 Co-SAPO-34 Air, CHP, DFM, 90°C, 6 h 5 76.00 [25] Aerobic epoxidation of α-pinene using Mn/SAPO-34 catalyst: Optimization via Response Surface Methodology (RSM) Pengpeng Huang Methodology Investigation Writing – original draft a Tinghui Chen Methodology Investigation Writing – original draft a Yane Zheng Conceptualization Resources Validation a ⁎ Chen Yang Methodology Investigation Writing – original draft a b Yaming Wang Supervision a Suoyu Ran Software Data curation a Yunfei Zhi Software Data curation a Shaoyun Shan Funding acquisition a Lihong Jiang Writing – review & editing a ⁎ a Faculty of Chemical Engineering, Kunming University of Science and Technology, Kunming 650093, China Faculty of Chemical Engineering Kunming University of Science and Technology Kunming 650093 China aFaculty of Chemical Engineering, Kunming University of Science and Technology, Kunming 650093, China b Yunnan Key Laboratory of Tobacco Chemistry, China Tobacco Yunnan Industrial Co. Ltd., Kunming 650231, China Yunnan Key Laboratory of Tobacco Chemistry China Tobacco Yunnan Industrial Co. Ltd. Kunming 650231 China bYunnan Key Laboratory of Tobacco Chemistry, China Tobacco Yunnan Industrial Co. Ltd., Kunming 650231, China ⁎ Corresponding authors. Aerobic epoxidation of bio-based olefins is an important topic in green and sustainable chemistry. In this work, an Mn/SAPO-34 catalyst was prepared by ion-exchange method for the epoxidation of α-pinene in presence of molecular oxygen and iso-butyraldehyde. The factors influencing α-pinene epoxidation were determined and the conditions were optimized by response surface methodology (RSM). The result showed that the sensitive conditions were co-reductant amount, Mn loading amount and catalyst amount. After optimization, α-pinene was completely converted and a 90.47% yield of 2,3-epoxy-pinane was obtained. The result showed that the catalyst was reusable for six cycles. In addition, the support and catalysts were characterized by XRD, BET, ICP-OES, SEM-EDS, TEM and XPS, and it was confirmed the reasons for the degradation of the catalyst activity were the damage of crystal particles, the decrease in specific surface area of catalyst, the loss of active components and the irreversible oxidation of Mn2+ Graphical abstract Image, graphical abstract Keywords α-Pinene Aerobic epoxidation Response surface methodology Mn-SAPO-34 catalyst Data availability The authors are unable or have chosen not to specify which data has been used. 1 Introduction Aerobic epoxidation of bio-based olefins has attracted tremendous interest in the fine chemicals and pharmaceutical industries, as epoxides are essential intermediates in the production of oxygenated natural and non-natural compounds [1–3]. α-pinene is a popular renewable bio-based olefin derived from rectified component turpentine oil of pine trees, which has attracted much attention in recent years [4]. Aerobic epoxidation of α-pinene can produce valuable fine chemicals, including verbenone, verbenol, and 2,3-epoxy-pinane. As an important epoxide, 2,3-epoxy-pinane can be used for the preparation of campholenic aldehyde, trans-carveol, isopinocamphone, and sobrerol [5,6]. These products are key components in the fields of biopharmaceutical, flavor and fragrance. Therefore, the benign and efficient synthesis of 2,3-epoxy-pinane by aerobic epoxidation of α-pinene is very critical. Traditionally, 2,3-epoxy-pinane is produced by the epoxidation of α-pinene with stoichiometric amount of peracid as oxidant, which is poisonous, hazardous and environmentally undesirable [7]. To overcome this drawback, several researchers have been devoted to the epoxidation of α-pinene with oxidants such as TBHP, H2O2, NaIO4, and O2 [8,9]. Among them, TBHP and H2O2 have the disadvantages of being expensive and excessive by-products generated, while molecular oxygen is the most favored oxidant due to its advantage of being cheap, environmentally friendly and easily available. However, in most cases, the epoxidation of α-pinene with oxygen is usually limited by extreme reaction conditions, and some by-products are formed resulting in a decreased yield of 2,3-epoxy-pinane since the epoxidation occurs through an uncontrolled free radical mechanism [10–12]. It has been reported that high yields of epoxy products can be obtained by catalytic epoxidation systems in the presence of aldehyde which is used here as a co-reductant for the reduction of activated oxygen [13]. Mukaiyama et al. investigated the epoxidation of olefins to epoxides with high yields and selectivity in the co-existence of O2/aldehyde and metal catalysts inclusive of Ni, Co, Mn, and Fe with variable valence [14,15]. However, these catalysts are usually homogeneous transition metal complexes and are limited in large-scale applications due to lack of stability, and the homogeneous nature of the reaction so that separation of the products is difficult [16]. Thus, to overcome this disadvantage, recent research effort has concentrated on the preparation of efficient heterogeneous catalyst. Immobilization of transition metal complexes on solid supports is one of the effective ways to prepare heterogeneous catalysts. Nodzewska and Yan et al reviewed the catalytic applications of immobilized transition metal complexes in detail over the past two decades [17,18]. Many solid supports, including carbon nanotubes, molecular sieves, metal-organic frameworks (MOF), and graphene, have been reported to be used to anchor transition metal complexes [19–21]. However, the leaching of active species during the reaction and the low selectivity of epoxides in the product are still the real challenges at present, so there is an urgent need for us to develop more efficient heterogeneous catalysts for aerobic epoxidation. Recent relevant works suggest that Mn species appear to be required to enhance olefins epoxidation reaction. The generation of intermediates of high-spin Mn4+-oxo species is the reason for the high catalytic activity of Mn-based heterogeneous catalysts, which facilitate oxygen atom transfer and promote the formation of epoxides from olefins [22]. Chatterjee and co-workers propose a new synthetic approach by incorporating Mn into porous nanomaterials via framework substitution to produce Mn-APO-5 catalyst [23]. Recently, Pang et al. prepared an Mn-SAPO-11 catalyst by impregnating the support with NH4Cl solution and then replacing NH4+ with Mn solution instead of a one-step synthesis of Mn-based catalyst [24]. These techniques have been shown to generate efficient solid catalysts for the epoxidation of olefins in the presence of oxygen [25]. CHA topological SAPO-34 molecular sieve has received much interest in catalysis fields due to its high specific surface area and good hydrothermal stability. In addition, SAPO-34 has an interconnected three-dimensional pore network and super cages which are equivalent to independent reactors to facilitate the reaction of substrates without immediate clogging of pores [26]. In this work, an Mn-SAPO-34 catalyst was synthesized by ion-exchange method with SAPO-34 molecular sieve as a support and manganese acetate as the active component for the epoxidation of α-pinene. The effects of different reaction conditions on the conversion and yield were explored, and the sensitive factors were optimized by response surface method (RSM) to get high yields of 2,3-epoxy-pinane in the presence of O2 and iso-butyraldehyde. To the best of our knowledge, this is the first time that Mn-SAPO-34 catalyst has been used for the epoxidation of α-pinene. 2 Experimental 2.1 Materials α-Pinene was purchased from Chuxiong Hong Bang Industry & Trade Co., Ltd., iso-butyraldehyde was purchased from Sinopharm Group Chemical Reagent Co., Ltd., and the other chemicals were purchased from Guangdong Guanghua Technology Co., Ltd and used without further purification. All chemicals were analytical grade without further treatment. 2.2 Preparation of catalysts SAPO-34 support was prepared by hydrothermal method [27]. The synthesis gel molar composition was Al2O3: SiO2: P2O5: triethylamine: H2O = 1: 0.6: 1: 3: 50. The sources of Al, Si and P were Pseudo-boehmite, silica sol and phosphoric acid, respectively. The pseudo-boehmite was mixed with H2O, and subsequently phosphoric acid, silica sol and diethylamine were added to the gel. The gel was transferred to a closed Teflon bottle at 200 °C for 48 h under static conditions. The solid product was filtered, washed and dried at 120 °C for 5 h, and followed by calcination in air atmosphere at 500 °C for 5 h with a heating rate of 1 °C/min to obtain SAPO-34 support. Mn-SAPO-34 catalyst was prepared by two-step ion-exchange method, as described in the literature [24]. First, the H-SAPO-34 was converted to NH4-SAPO-34 by ion exchange with NH4NO3 solution at 80 °C for 2 h. Then the material was filtered and washed with deionized water. Mn ion-exchange was performed by mixing NH4-SAPO-34 with Mn(CH3COO)2·4H2O solution at 90 °C for 6 h. then it was filtration, washed with deionized water, and followed by drying at 110 °C for 6 h in an oven and finally Mn-SAPO-34 catalyst was obtained by calcined at 550 °C for 4 h. The Mn loading in the catalyst was expected to be 3 wt%. 2.3 Characterization of catalysts X-ray diffraction (XRD) patterns were recorded on a diffractometer (Rigaku, D/max-2200) with Cu Ka radiation (λ = 1.54056 Å) from 2θ = 5° to 90° with a scan speed of 5°/min. Textural properties were determined by N2 adsorption-desorption isotherms at 77 K using a Quantachrome Nova 4200e instrument, and specific surface area and average pore size were determined by the BET method and BJH method, respectively. Inductively coupled plasma optical emission spectrometry (ICP-OES) was conducted on an instrument (Leeman, PROFILE SPEC) to analyze the contents of Mn, Al, Si, and P in samples. Scanning electron microscope (SEM) equipped with an energy-dispersive X-ray spectrometer (EDX) point-scan analysis was obtained on a Nova Nanosem scanning electron microscope at 200 kV. Transmission electron microscopy (TEM) images were taken by using a Tecnai G2 F20 S-TWIN. The chemical valence states and elements present in the catalyst surface were analyzed through X-ray photoelectron spectrometry (XPS) equipped with Al/Κα radiation (Thermo, ESCALAB 250XI). The obtained binding energies were referenced to the C 1s peak at 284.8 eV. 2.4 Catalytic reaction tests The epoxidation reaction was carried out in a circulating condensing system and an air oxidation environment, as presented in Fig. 1 . In a typical experiment [12], 1 g α-pinene and 120 mg Mn-SAPO-34 (catalyst) were mixed with 20 g acetonitrile (solvent) in a round-bottom glass flask, followed by addition of 0.8 g iso-butyraldehyde (co-reductant). the mixture was then reacted at 12 °C for 3 h while air was bubbled to the bottom of reactor by an air pump. The moisture in air entering the reactor was absorbed by sulfuric acid and the flow rate was controlled with an air flow valve. The solid catalyst was centrifugation after the completion of the reaction, and the liquid organic products were identified by a gas chromatograph (Agilent, 7890GC-5975MS) equipped with an HP-5 quartz capillary column (30 m × 0.25 μm × 0.32 mm), and the primary product quantitatively analyzed by a gas chromatograph (Shimadzu, GC-2014) equipped with a flame ionization detector (FID) using a DB-5 capillary column (30 m × 0.25 μm × 0.32 mm). The selectivity, yield of 2,3-epoxy-pinane and the conversion of α-pinene were calculated using the following equation. (1) C o n v e r s i o n ( % ) = n 0 ( α − p i n e n e ) − n t ( α − p i n e n e ) n 0 ( α − p i n e n e ) × 100 (2) S e l e c t i v i t y ( % ) = n ( 2 , 3 − e p o x y − p i n a n e ) n 0 ( α − p i n e n e ) − n t ( α − p i n e n e ) × 100 (3) Y i e l d ( % ) = C o n v e r s i o n × S e l e c t i v i t y × 100 2.5 Optimization of process The epoxidation reaction affecting the yield of 2,3-epoxy-pinane was optimized by response surface method (RSM) combined with Box-Behnken design (BBD) in Design Expert V12.0.3.0 software. Since it is impossible to determine the impact of all factors on yield, it is necessary to select factors that are sensitive to the impact of yield. First, the effect of different reaction conditions on the yield of 2,3-epoxy-pinane was investigated by single-factor experiments (SFE), including solvent type, solvent dosage, Mn loading amount, air flow rate, reaction temperature, reaction time, catalyst amount, and co-reductant amount. Then, sensitive conditions were screened out, and BBD was used for experimental design and data analysis. 3 Results and discussion 3.1 Single-factor experiments Since conversion and yield generally are related to reaction conditions, a single-factor experiment was performed to determine suitable conditions. Table S1 shows the effect of catalytic activity under different synthesis conditions. It can be seen that the activity of 2,3-epoxy-pinane obtained from the catalyst prepared by two-step ion-exchange is higher than that of the catalyst prepared by direct ion-exchange. In addition, the pore size and Mn content of the catalyst prepared by two-step ion-exchange are also higher than those of the catalyst prepared by direct ion-exchange method. This may be due to the small channels of the catalyst synthesized by direct ion-exchange limiting the diffusion of metal ions in the crystals. Table S2 shows the effects of various metal-SAPO-34 catalysts on the epoxidation activity of α-pinene. It can be seen that the effect of different metal-SAPO-34 catalysts on the yield of 2,3-epoxy-pinane was Mn-SAPO-34>Fe-SAPO-34>Co-SAPO-34>Ru-SAPO-34>Cu-SAPO-34. Among them, Mn-SAPO-34, Fe-SAPO-34 and Co-SAPO-34 showed good catalytic activity for the epoxidation of α-pinene under the present reaction condition, while Ru-SAPO-34 and Cu-SAPO-34 showed lower activity for the epoxidation of α-pinene with yields of 72.00% and 67.01%, respectively. The reason for this phenomenon may be related to the interaction of molecular oxygen with metal precursors. Of these, the metal Mn2+ appears to be the most promising catalyst, as Mn catalyst may involve high-valent manganese-oxy intermediate formed by oxo-metal IV cations. Table S3 shows the effects of various oxidants on the epoxidation of α-pinene over Mn-SAPO-34. Since the reason for choosing molecular oxygen as oxidant has been described in the introduction, we did not explain it too much here. Table S4 shows the effect of different co-reductants on the epoxidation of α-pinene over Mn-SAPO-34. It can be seen that the addition of reductants can effectively improve the yield of 2,3-epoxy-pinane. Among them, iso-butyraldehyde and 2-ethyl hexanol were excellent reductants in this system, and the activities of 2,3-epoxy-pinane obtained using them as reductants were both higher than 80%. However, crotonaldehyde and n-hexanal as reductants had poor catalytic effects, and the yield of 2,3-epoxy-pinane was 49.66% and 23.62%, respectively. Fig. 2 showed the effects of several reaction conditions on the epoxidation of α-pinene. The optimal condition of each factor was evaluated by 2,3-epoxy-pinane yield. First, the influence of the solvent and solvent dosage was studied. The reaction system with acetonitrile (20 g) as a solvent exhibited the highest catalytic activity (Fig. 2(a-b)), which may be related to the polarity of the solvent (acetonitrile possessed the highest polarity among all solvents examined). It is well known that polar solvents contribute to the desorption of polar epoxidation products and thus accelerate the renewal of the catalyst surface. As acetonitrile was incompatible with α-pinene, the formed intermediate products on catalyst surfaces are quickly transferred to solvent, avoiding excessive oxidation [28]. Then, the influence of Mn loading amount was examined (Fig. 2(c)). The yield of 2,3-epoxy-pinane first increased and then decreased upon increasing the Mn loading amount. This was because proper active component Mn loading on the support was conducive to the reaction, while excessive Mn species on the support leads to the aggregation of Mn species on the catalyst surface as well as decreases its dispersion resulting in the inhibition of α-pinene conversion. Next, the influence of the air flow rate was subject of investigation (Fig. 2(d)). An increase in air flow from 30 to 80 mL/min improved the α-pinene conversion from 68.30% to 94.48% and the yield of 2,3-epoxy-pinane increased to 86.16%. However, the catalytic effect was not significantly changed by increasing the flow rate from 80 to 100 mL/min. This result indicated that a high oxygen level was essential for the reaction [29]. In further experiments, the dependence of catalytic activity on the reaction temperature was studied (Fig. 2(e)). With the increase in reaction temperature, the conversion and yield increased from 72.34% and 64.51% to 96.63% and 86.32%, respectively. As expected, the increase in reaction temperature could accelerate the motion of α-pinene and oxygen molecules to make them easier to contact [30]. However, the yield of 2,3-epoxy-pinane began to decline as the temperature was higher than 15 °C, which was attributed to the product 2,3-epoxy-pinane with ternary ring and tetra-atomic ring being more active in nature and can easily open the ring to generate other by-products, as confirmed by GC chromatograms. Next, the reaction times ranging from 0.5 to 4 h were tested (Fig. 2(f)). The analysis showed that longer reaction times were instrumental in the conversion. By increasing the reaction time from 0.5 to 2.5 h, the conversion and yield could be improved from 57.59% and 52.77% to 97.25% and 89.36%, respectively. However, the continued extension of the time from 2.5 to 4 h did not increase the conversion and slightly decreased the selectivity of 2,3-epoxy-pinane. This result was consistent with the phenomenon observed by Cao, who suggested that excessive reaction time would allow further reaction of 2,3-epoxy-pinane to form isomerization products [5]. Subsequent work concentrated on the effect of catalyst amount (Fig. 2(g)). In terms of high yield and selectivity, a catalyst amount of 100 mg was found to be favorable. This is because fewer amounts of catalysts had fewer active sites resulting in an incomplete epoxidation reaction in the system, while excessive amounts of catalysts could generate side reactions that leading to a decrease in selectivity. Finally, the amount of co-reductant used was examined (Fig. 2(h)). The experimental results showed that the addition of co-reductant (iso-butyraldehyde) can significantly improve the α-pinene conversion and 2,3-epoxy-pinane selectivity. The highest result was obtained at the co-reductant amount was 1 g. Based on the above analysis results, the suitable experimental conditions were selected as follows: 20 g acetonitrile solvent, 3 wt% Mn loading amount, 80 mL/min, 15 °C, 2.5 h, 100 mg catalyst, and 1 g co-reductant. Among them, the amount of catalyst and co-reductant, as well as Mn loading amount, have a great influence on the yield of 2,3-epoxy-pinane, which were sensitive conditions for the epoxidation of α-pinene. Thus, these three sensitive conditions were further optimized to obtain the best results. 3.2 Optimization of epoxidation conditions by RSM 3.2.1 Model design RSM is a common and reliable method for process optimization [31]. Thus, 2,3-epoxy-pinane synthesis was optimized via a three-level-three-factor Box-Behnken design (BBD) combined with RSM. According to the results of SFE (Section 3.1), the three levels were coded as -1, 0, and +1, and 17 runs were carried out to investigate the effect of operating parameters such as co-reductant amount (0.9-1.1 g) (X1), Mn loading amount (2.5-3.5 wt%) (X2) and catalyst amount (90-110 mg) (X3). The experimental design matrix and result were represented in Table 1 . Analysis of variance (ANOVA), coefficient of determination (R 2), residual analysis and response plots were used to analyze the results. The quadratic polynomial equation was used to predict the performance of the factors and their interaction with the production efficiency (Eq. 4). (4) Y = α 0 + ∑ i = 1 3 α i X i + ∑ i = 1 3 α i i X i 2 + ∑ i = 1 3 ∑ i < j 3 α i j X i X j + ε Where the predicted response is represented by Y, i.e. the yield of 2,3-epoxy-pinane; Xi and Xj are the values of independent variables; α0 is the model constant; αi, αii , and αij are the linear coefficient, quadratic coefficient and interaction coefficients, respectively; ε is the error of the model between the predicted and measured values [32]. For these experiments, a random experimental order was used to minimize errors due to latent variables. The optimization equation of yield prediction is as follows: (5) Y i e l d ( % ) = 91.914 + 2.7975 A − 1.3175 B + 1.895 C − 1.2175 A B + 0.5975 A C + 3.9475 B C − 0.24325 A 2 − 8.68825 B 2 − 3.74325 C 2 Where, A, B and C are the coded forms of co-reductant amount, Mn loading amount and catalyst amount, respectively. 3.2.2 Data analysis ANOVA is the most reliable way to evaluate the quality of the fitted model [33]. Table 2 shows the ANOVA results for the yield. The significance of each coefficient was determined by F-value and P-value. A greater F-value and smaller P-value indicated the greater model significance of the corresponding variable, where the P-value < 0.05 revealed the model was significant at the 95% confidence level [34]. In the primary item, items of A, B, C, BC, B2, and C2 were less than 0.05 suggesting that each had a significant impact on yield. Other items were not statistically significant. Regarding lack of fit, which measures the sum of squared deviations between the mean response at each factor level and the corresponding fitted value, P-value > 0.05 corresponds to insignificant response. It can be observed that the lack of fit P-value = 0.1011 > 0.05 is not significant, which indicated that the model fitted to all data (not significant lack of fit is good) [35]. A good model fit requires a coefficient of determination (R 2) of at least 0.8. Thus, the model was also evaluated based on R 2 (Table 2). The multiple correlation coefficient R 2 was 0.9776, which means that the response model can explain 97.76% of the behavior of the conversion of the α-pinene into 2,3-epoxy-pinane. And adjusted R 2 was high (Adj-R 2=0.9489), which is very close to R 2, suggesting that the levels used are consistent. Adeq precision (a measure of signal-to-noise ratio, and according to the model requirement, its value should exceed 4) was 19.9505, indicating adequate model discrimination [34]. Consequently, the above analysis confirmed that the model could be used to predict the yield of 2,3-epoxy-pinane from the epoxidation of α-pinene. Residual analysis was performed on the yield of 2,3-epoxy-pinane to further verify the applicability of the regression equation [Eq. (5)]. Fig. S1 shows residual sequence diagram of 2,3-epoxy-pinane yield. Each point in the diagram conformed to the error independence principle and had no positive and negative residual trend, which is a satisfactory model. Fig. 3 shows the predicated versus actual value 2,3-epoxy-pinane yield model. It can be observed that the predicted yield was similar to the actual yield, and the comparison points were evenly distributed on both sides of the fitted line. In addition, the residual normality of the prediction model was confirmed by the positive probability distribution plot of the residuals, which was shown in Fig. S2. Therefore, it can be concluded that the regression equation [Eq. (5)] provided a good fit to the data and could be used to predict the uninvestigated experimental variables. 3.2.3 Effect of factors and optimal conditions Response surface plots and contour line diagrams are used to select the optimal reaction conditions and understand how factors affect response variables. The response surface plots and contour lines diagram are shown in Figs. 4-6 . This is obtained by changing two factors while keeping the others remain constant. It is worth noting that the elliptical contour line suggests that the interactions between the factors were significant, while an open arc contour line indicates non-significant interactions [36]. Fig. 4 illustrates the joint effect of co-reductant and Mn loading amount on 2,3-epoxy-pinane yield. It can be observed that the contour line diagram is open arc shape, which indicates that the interaction between the co-reductant amount and Mn loading amount is non-significant (Fig. 4(b)). For constant co-reductant amount, the yield of 2,3-epoxy-pinane continued to increase as the Mn loading amount increased to 3.33 wt%, but beyond this value, the yield of the process decreased because moderate Mn loadings amount is beneficial to the good dispersion of active components, while excessive Mn loading amount will cause agglomeration resulting in decreases the interaction between reactants. On the other hand, at a constant Mn loading amount, the yield continued to increase with the increasing co-reductant amount. At the minimum value of the co-reductant amount and the Mn loading amount, the yield of 2,3-epoxy-pinane turns to its minimum value because the few co-reductant amounts do not form enough intermediates and thus the reaction is made incompletely. Fig. 5 defines the joint effect of co-reductant and catalyst on 2,3-epoxy-pinane yield. The contour line diagram is open arc shape indicating that the interaction between the two factors is non-significant, which can also be proved from variance analysis, F-value is 0.7658 and P-value is 0.4105 > 0.05. Combining Fig. 5 (a), the effect of the co-reductant amount on the yield is consistent with the previous results, which is a positive correlation. However, the effect of catalyst amount on yield is not linear. With the increase of catalyst amount, the yield first increased and then decreased. Fig. 6 shows the effect of Mn loading amount and catalyst amount on 2,3-epoxy-pinane yield. As shown in Fig. 6(b), the contour is elliptical and dense as well as steep, suggesting that the interaction between the Mn loading amount and the catalyst amount is significant. Combined with the analysis of variance, the F-value is 33.43 and the P-value is 0.0007 < 0.05, which further confirmed this conclusion. In Fig. 6(a), Similar trends to the results discussed previously can be observed concerning the effect of Mn loading amount and catalyst amount on the yield of 2,3-epoxy-pinane. Based on the above analysis, it can be concluded that only the interaction of Mn loading amount and catalyst amount is significant and the predicted optimum theoretical conditions are as follows: co-reductant amount of 1.1 g, Mn loading amount of 3.33 wt%, and catalyst amount of 110 mg. The predicted yield of 2,3-epoxy-pinane at this optimum condition was 90.32%. This optimization process takes into account all the interactions between different sensitive factors and their effect on the response. To verify the reliability of the model provided by RSM-BBD, the actual test conditions adopted are as follows: co-reductant amount of 1.1 g, Mn loading amount of 3.3 wt%, and catalyst amount of 110 mg. The test results revealed that the average yield of 2,3-epoxy-pinane was 90.47%, with only a small relative error (0.15%) from the predicted value (Fig. S3). The similarity between the predicted and tested results confirms the good satisfaction of the model. 3.3 Reusability investigation of the catalyst One key advantage of heterogeneous catalysts is their reusability. Herein, the catalyst was separated by centrifugation, washed with ethanol, and dried at 100 °C for the next run. As shown in Fig. 7 , a minor change in 2,3-epoxy-pinane yield was observed for the first six cycles, followed by a significant decrease from 85.09% to 59.03% in the last two cycles. The results revealed that the catalyst could be reused for six runs with 85.09% efficiency. Moreover, a hot filtration experiment for α-pinene epoxidation was carried out and the result was shown in Fig. S4. As expected, no reaction precedes after the removal of the catalyst, which demonstrates that the α-pinene epoxidation was intrinsically heterogeneous. In addition, to investigate whether there is metal leaching in the reaction solution, the catalyst after six cycles was studied. According to the method described in literature [12], the solid catalyst was filtered out, and then the reaction was continued for 2 h after epoxidation reaction was conducted for 1 h. The final yields were detected by GC, and it was found that 2.13% of 2,3-epoxy-pinane was still obtained. This phenomenon may be due to the contribution of a small amount of Mn2+ ions leached from Mn-SAPO-34 and the autoxidation of α-pinene by O2, which further confirmed the characteristics of heterogeneous catalysis. 3.4 Characterization of catalyst structure Fig. 8 shows the XRD patterns of the different samples. The diffraction peak located at 9.57°, 12.98°, 14.03°, 16.12°, 20.83°, 22.13°, 25.17°, 26.15°, 28.49°, 30.87°, and 32.07°, are all assigned to SAPO-34 molecular sieve with a CHA topology (PDF#47-0429). The intensity of the diffraction peaks was greatly decreased when the Mn species was loaded into SAPO-34, probably due to the slight change of the unit cell parameters by the introduction of Mn species [37]. Mn-SAPO-34 contained regular crystal particles with a size of 1∼6 μm (Fig. S5). In Fig. 8, the diffraction peak intensity gradually decreased with the increase of the catalyst usage times, which might be due to the partial destruction of the structure of the catalyst after repeated use. This phenomenon could be proved by SEM and TEM. As shown in Fig. 9 , the crystal particles started to be destroyed when the catalyst was used 6 times, and the number of damaged crystal particles was more obvious when the catalyst was used 8 times. In addition, no characteristic peaks of MnOx were observed in the XRD patterns of the samples. This phenomenon might be due to the good dispersion of Mn species, which was confirmed by the EDS diagram of the samples (Fig. S6), It is also possible that the content of MnOx was too low to be detected by XRD [38]. Fig. 10 shows the N2 adsorption-desorption isotherms and pore size distributions of the different samples. The samples showed type-IV isotherms according to the IUPAC with H4-type hysteresis loops and sharp capillary condensation steps in the range of 0.4-1.0 P/P0, demonstrating the presence of mesopores structure [39]. In addition, the isotherms revealed a sharp uptake in the region of P/P0 < 0.1, suggesting that microporous structural units were present on the surface of the SAPO-34 molecular sieves [40]. Compared with Mn-SAPO-34 (fresh), a wider hysteresis loop was observed in the isotherms of Mn-SAPO-34 (8th), which may be ascribed to more serious hysteresis caused by the blockage of the pores by excess Mn species. The textural data of the different samples were shown in Table 3 . Compared to SAPO-34 molecular sieves, the surface area and pore volume of Mn-SAPO-34 catalyst decreased slightly, indicating Mn species were successfully supported on the SAPO-34 molecular sieves' surface. The surface area and pore volume of these samples were essentially stable when the catalyst was used for the first 6 times, but that decreased obviously after 6 times, which suggested that multiple reuses of the catalyst may affect their textural properties. In addition, the Mn species content on the catalyst surface gradually decreased with the increase of catalyst usage times. It is worth noting that the Mn species content decreased slowly for the first 6 times and then decreases significantly, which was in agreement with the yields shown in Table 3. This indicated that the loss of Mn species content was one of the major reasons for catalyst deactivation. Moreover, the ratios of P, Al and Si remained constant, suggesting that the composition of the support was not affected by the reaction process. The chemical states of the surface species of the samples were investigated by XPS, as shown in Fig. 11 . For the Mn 2p, the spectrum presented two pairs of 2p3/2-2p1/2 spin-orbit split peaks, labeled as U and V, in which U′, U″, and U‴ were assigned to Mn2+, Mn3+, and Mn4+, respectively, and U⁗ represented the shake-up satellite peak of paramagnetic Mn2+ species [24,41,42]. For the O 1s, the curves contained a major peak and a shoulder peak. The major peak at 531.99 eV (labeled OⅠ) was assigned to surface oxygen species and surface hydroxide species (Os+OHs). The shoulder peak at 529.63 eV (labeled OⅡ) was assigned to lattice oxygen species (O2−) [43]. The detailed data from the spectra are presented in Table 4 . It can be observed that the molar ratio of Mn(a)/Mn(i) was 4.47, suggesting that the surface Mn species was lost during catalyst deactivation, which decreased the contact between surface Mn species and the reactants. This phenomenon was consistent with ICP analysis. Comparing the fresh catalyst and catalyst after 8 uses, the Mn2+ content decreased from 36.70% to 17.89%, the Mn3+ content increased from 9.65% to 23.12%, the Mn4+ content hardly changed and the Mn3+/Mn4+ molar ratio increased from 18.05% to 39.26%. This indicated that Mn3+ was obtained from the oxidation of Mn2+ and the reaction was irreversible, which was further confirmed by the trend of the oxygen vacancy content [44]. Therefore, it can be concluded that irreversible oxidation of Mn2+ leads to the deactivation of the catalyst. 3.5 The investigation of reaction products and mechanism To determine the epoxidation products and the epoxidation mechanism of α-pinene, eight parallel control tests were performed and the results were analyzed by GC-MS, as shown in Table 5 . When no catalyst was added to the reaction system, almost no conversion was observed. According to the GC-MS data, the major epoxidation products detected in the system without iso-butyraldehyde (IBA) were verbenol, verbenone, and 2,3-epoxy-pinane. However, when IBA was present, the main epoxidation product was 2,3-epoxy-pinane. Therefore, it can be concluded that IBA improves the selectivity of 2,3-epoxy-pinane. Other substances, such as the products of α-pinene rearrangement (oligomers and polymers) were ignored and were not listed in Table 5. In addition, we also observed that high-purity oxygen and air had the same effect on this reaction system. The conversion of α-pinene decreased sharply after the addition of benzoquinone, suggesting that radicals were involved in the reaction. Based on previous studies and the experimental results of this work, the aerobic epoxidation reaction mechanism of α-pinane on the Mn-SAPO-34 catalyst was proposed (Fig. 12 ). The mechanism was mainly carried out through the free radical pathway, and the acyl peroxy radical produced in the reaction plays the role of oxidant. RCHO (iso-butyraldehyde) preferentially forms the RC(O)● (isobutyryl) in the presence of molecular oxygen initiated by Mn2+, and then RC(O)● was oxidized by oxygen to form RC(O)-O-O• (isobutyryl peroxy radical) [7]. The subsequent introduction of α-pinene into RC(O)-O-O• to form 2,3-epoxy-pinane can be divided into two pathways. One pathway (route A) involves the reaction of RC(O)-O-O• with RCHO to form RC(O)-O-OH (peroxyisobutyric acid), followed by reacting RC(O)-O-OH with Mn2+ to form high-valent manganese-oxy intermediate. Finally, the introduction of α-pinene to produce 2,3-epoxy-pinane, which step is easily performed due to the presence of reactive high-valent metal-oxygen intermediate [11]. Another route (route B) involves the reaction of RC(O)-O-O• with α-pinene to get 2,3-epoxy-pinane directly (route B1) [5], or with Mn2+ to form manganese-peroxy complexes (route B2). Then, manganese-peroxides transfer oxygen atoms directly to α-pinene to form 2,3-epoxy-pinane and regenerate the catalytic site of Mn2+ [13]. 3.6 Comparison of Mn-SAPO-34 with literature report To further compare the results of the other catalysts used in the literature for the epoxidation of α-pinene, the relevant epoxidation data are presented in Table 6 . As can be seen from Table 6, all catalysts exhibited certain deficiencies in terms of reusability and yield. Among them, the MTO mIII and cis- [Mn(HL)2Cl2] catalyst with the highest yield are homogeneous, which is not conducive to multiple uses and requires a long reaction time. The Co-ZSM-5(L1) catalyst with the best reusable requires high temperature and tert-butyl hydroperoxide (TBHP) which is an organic oxidant and expensive. In addition, the catalytic effect of the Co-POM/NH2-SBA-15 catalyst is satisfactory, but its synthesis step is complex and requires modification of the support. In contrast to these catalysts, Mn-SAPO-34 is an environmentally friendly catalyst that is easy to prepare, achieves a high yield of 2,3-epoxy-pinane under relatively mild preparation conditions and exhibited excellent stability. Moreover, the catalyst Mn-SAPO-34 was also used to catalyze the epoxidation of other olefins to extend its application, and the results are shown in Table S5. The Mn-SAPO-34 catalyst showed good catalytic activity for styrene and α-methyl styrene, but poor catalytic activity for cyclooctene and dicyclopentadiene. This may be due to the diffusion limitation of the larger cyclooctene and dicyclopentadiene molecules in small pores of SAPO-34 resulting in difficulties for the substrate to contact the active center. 4 Conclusion Mn-SAPO-34 catalyst was synthesized by an ion-exchange method and used for the epoxidation reaction of α-pinene in the presence of oxygen and iso-butyraldehyde. Single-factor experiments confirmed that Mn loading amount, catalyst and co-reductant amount were sensitive factors for this epoxidation reaction, and these sensitive factors were optimized by the response surface experiments. The results showed Mn-SAPO-34 catalyst had excellent catalytic activity. In the optimal conditions, α-pinene was completely converted and 90.47% yield of 2,3-epoxy-pinane was obtained. The reusability test exhibited Mn-SAPO-34 catalyst could be effectively used 6 times without sacrificing activity and selectivity, demonstrating its recoverability and emphasizing its stability under these reaction conditions. The structural characterization experiments confirmed the reasons for the degradation of the catalyst activity were the damage of crystal particles, the decrease in specific surface area of catalyst, the loss of active components Mn and the irreversible oxidation of Mn2+. Based on the above research results, Mn-SAPO-34 catalyst with excellent activity and stability will be a very prospective catalyst for the epoxidation of α-pinene. CRediT authorship contribution statement Pengpeng Huang: Methodology, Investigation, Writing – original draft. Tinghui Chen: Methodology, Investigation, Writing – original draft. Yane Zheng: Conceptualization, Resources, Validation. Chen Yang: Methodology, Investigation, Writing – original draft. Yaming Wang: Supervision. Suoyu Ran: Software, Data curation. Yunfei Zhi: Software, Data curation. Shaoyun Shan: Funding acquisition. Lihong Jiang: Writing – review & editing. Declaration of Competing Interest There are no conflicts of interest to declare. Acknowledgments The authors thank the financial supports by the National Natural Science Foundation of China (Nos. 21266012, 22068023, 21766016 and 21706108) and the Analysis and Testing Center of Kunming University of Science and Technology. Supplementary materials Supplementary material associated with this article can be found, in the online version, at doi:10.1016/j.mcat.2022.112872. Appendix Supplementary materials Image, application 1 References [1] C.W. Lu Y.P. Liu C.P. Wang Q. Yong J.F. Wang F.X. Chu An integrated strategy to fabricate bio-based dual-cure and toughened epoxy thermosets with photothermal conversion property Chem. Eng. J. 433 2022 134582 10.1016/j.cej.2022.134582 C.W. Lu, Y.P. Liu, C.P. Wang, Q. Yong, J.F. Wang, F.X. Chu, An integrated strategy to fabricate bio-based dual-cure and toughened epoxy thermosets with photothermal conversion property, Chem. Eng. J.. 433 (2022) 134582. 10.1016/j.cej.2022.134582. [2] C. Muzyka J.-C.M. Monbaliu Perspectives for the Upgrading of Bio-Based Vicinal Diols within the Developing European Bioeconomy ChemSusChem 2022 15 10.1002/cssc.202102391 C. Muzyka, J.-C.M. Monbaliu, Perspectives for the Upgrading of Bio-Based Vicinal Diols within the Developing European Bioeconomy, ChemSusChem. 15 (2022). 10.1002/cssc.202102391. [3] K.Serge Yacoub Epoxidation of limonene and pinenes by dimethyldioxirane in microemulsions Catal. Today 2022 10.1016/j.cattod.2022.01.023 Yacoub, K. Serge, Epoxidation of limonene and pinenes by dimethyldioxirane in microemulsions, Catal. Today. (2022). https://doi.org/10.1016/j.cattod.2022.01.023. [4] P. Huang Q. Deng L. Jiang Y. Zhi W. Yang J. Huang Y. Zheng Y. Wang S. Shan T. Hu H. Su The Exploration of Sensitive Factors for the Selective Hydrogenation of α-Pinene Over Recyclable Ni-B/KIT-6 Catalyst Catal. Lett. 152 2022 2352 2365 10.1007/s10562-021-03811-5 P. Huang, Q. Deng, L. Jiang, Y. Zhi, W. Yang, J. Huang, Y. Zheng, Y. Wang, S. Shan, T. Hu, H. Su, The Exploration of Sensitive Factors for the Selective Hydrogenation of α-Pinene Over Recyclable Ni-B/KIT-6 Catalyst, Catal. Lett.. 152 (2022) 2352-2365. 10.1007/s10562-021-03811-5. [5] Y. Cao Y. Li H. Yu F. Peng H. Wang Aerobic oxidation of α-pinene catalyzed by carbon nanotubes Catal. Sci. Tech. 5 2015 3935 3944 10.1039/C5CY00136F Y. Cao, Y. Li, H. Yu, F. Peng, H. Wang, Aerobic oxidation of α-pinene catalyzed by carbon nanotubes, Catal. Sci. Tech.. 5 (2015) 3935-3944. https://doi.org/10.1039/C5CY00136F. [6] J. Grzeszczak A. Wróblewska A. Kamińska P. Miądlicki J. Sreńscek-Nazzal R.J. Wróbel C.K. Zvi B. Michalkiewicz Carbon catalysts from pine cones-Synthesis and testing of their activities Catal. Today 2022 10.1016/j.cattod.2022.08.024 J. Grzeszczak, A. Wróblewska, A. Kamińska, P. Miądlicki, J. Sreńscek-Nazzal, R.J. Wróbel, C.K. Zvi, B. Michalkiewicz, Carbon catalysts from pine cones-Synthesis and testing of their activities, Catal. Today. (2022). https://doi.org/10.1016/j.cattod.2022.08.024. [7] Y. Nabae H. Rokubuichi M. Mikuni Y. Kuang T. Hayakawa M.-a. Kakimoto Catalysis by Carbon Materials for the Aerobic Baeyer-Villiger Oxidation in the Presence of Aldehydes ACS Catal 3 2013 230 236 10.1021/cs3007928 Y. Nabae, H. Rokubuichi, M. Mikuni, Y. Kuang, T. Hayakawa, M.-a. Kakimoto, Catalysis by Carbon Materials for the Aerobic Baeyer-Villiger Oxidation in the Presence of Aldehydes, ACS Catal. 3 (2013) 230-236. https://doi.org/10.1021/cs3007928. [8] X. Zhao Y. Zhou K. Huang C. Li D.-J. Tao Ultralow loading cobalt-based nanocatalyst for benign and efficient aerobic oxidation of allylic alcohols and biobased olefins ACS Sustain. Chem. Eng. 7 2018 1901 1908 10.1021/acssuschemeng.8b03678 X. Zhao, Y. Zhou, K. Huang, C. Li, D.-J. Tao, Ultralow loading cobalt-based nanocatalyst for benign and efficient aerobic oxidation of allylic alcohols and biobased olefins, ACS Sustain. Chem. Eng.. 7 (2018) 1901-1908. https://doi.org/10.1021/acssuschemeng.8b03678. [9] V. Mirkhani M. Moghadam S. Tangestaninejad B. Bahramian A. Mallekpoor-Shalamzari Host (nanocavity of zeolite-Y)–guest (manganese (III) salophen complex) nanocomposite materials: an efficient catalyst for biomimetic alkene epoxidation and alkane hydroxylation with sodium periodate Appl. Catal. A 321 2007 49 57 10.1016/j.apcata.2007.01.032 V. Mirkhani, M. Moghadam, S. Tangestaninejad, B. Bahramian, A. Mallekpoor-Shalamzari, Host (nanocavity of zeolite-Y)–guest (manganese (III) salophen complex) nanocomposite materials: an efficient catalyst for biomimetic alkene epoxidation and alkane hydroxylation with sodium periodate, Appl. Catal. A. 321 (2007) 49-57. https://doi.org/10.1016/j.apcata.2007.01.032. [10] M.A. Mavuso P.R. Makgwane S.S. Ray Heterostructured CeO2-M (M = Co, Cu, Mn, Fe, Ni) Oxide Nanocatalysts for the Visible-Light Photooxidation of Pinene to Aroma Oxygenates ACS Omega 5 2020 9775 9788 10.1021/acsomega.9b04396 M.A. Mavuso, P.R. Makgwane, S.S. Ray, Heterostructured CeO2-M (M = Co, Cu, Mn, Fe, Ni) Oxide Nanocatalysts for the Visible-Light Photooxidation of Pinene to Aroma Oxygenates, ACS Omega. 5 (2020) 9775-9788. https://doi.org/10.1021/acsomega.9b04396. [11] S. Rayati F. Nejabat The catalytic efficiency of Fe-porphyrins supported on multi-walled carbon nanotubes in the oxidation of olefins and sulfides with molecular oxygen New J. Chem. 41 2017 7987 7991 10.1039/C7NJ01530E S. Rayati, F. Nejabat, The catalytic efficiency of Fe-porphyrins supported on multi-walled carbon nanotubes in the oxidation of olefins and sulfides with molecular oxygen, New J. Chem.. 41 (2017) 7987-7991. https://doi.org/10.1039/C7NJ01530E. [12] B. Tang X.-H. Lu D. Zhou J. Lei Z.-H. Niu J. Fan Q.-H. Xia Highly efficient epoxidation of styrene and α-pinene with air over Co2+-exchanged ZSM-5 and Beta zeolites Catal. Commun. 21 2012 68 71 10.1016/j.catcom.2012.01.029 B. Tang, X.-H. Lu, D. Zhou, J. Lei, Z.-H. Niu, J. Fan, Q.-H. Xia, Highly efficient epoxidation of styrene and α-pinene with air over Co2+-exchanged ZSM-5 and Beta zeolites, Catal. Commun.. 21 (2012) 68-71. https://doi.org/10.1016/j.catcom.2012.01.029. [13] X. Zhou H. Ji Biomimetic kinetics and mechanism of cyclohexene epoxidation catalyzed by metalloporphyrins Chem. Eng. J. 156 2010 411 417 10.1016/j.cej.2009.10.066 X. Zhou, H. Ji, Biomimetic kinetics and mechanism of cyclohexene epoxidation catalyzed by metalloporphyrins, Chem. Eng. J.. 156 (2010) 411-417. https://doi.org/10.1016/j.cej.2009.10.066. [14] R.M. Philip S. Radhika C.A. Abdulla G. Anilkumar Recent Trends and Prospects in Homogeneous Manganese-Catalysed Epoxidation Adv. Synth. Catal. 363 2021 1272 1289 10.1002/adsc.202001073 R.M. Philip, S. Radhika, C.A. Abdulla, G. Anilkumar, Recent Trends and Prospects in Homogeneous Manganese-Catalysed Epoxidation, Adv. Synth. Catal.. 363 (2021) 1272-1289. https://doi.org/10.1002/adsc.202001073. [15] N. Maksimchuk M. Melgunov Y.A. Chesalov J. Mrowiec-Białoń A. Jarzębski O. Kholdeeva Aerobic oxidations of α-pinene over cobalt-substituted polyoxometalate supported on amino-modified mesoporous silicates J. Catal. 246 2007 241 248 10.1016/j.jcat.2006.11.026 N. Maksimchuk, M. Melgunov, Y.A. Chesalov, J. Mrowiec-Białoń, A. Jarzębski, O. Kholdeeva, Aerobic oxidations of α-pinene over cobalt-substituted polyoxometalate supported on amino-modified mesoporous silicates, J. Catal.. 246 (2007) 241-248. https://doi.org/10.1016/j.jcat.2006.11.026. [16] X.-H. Lu, Q.-H. Xia, S.-Y. Fang, B. Xie, B. Qi, Z.-R. Tang, Highly Selective Epoxidation of α-Pinene and Cinnamyl Chloride with Dry Air over Nanosized Metal Oxides, Catalysis letters. 131 (2009) 517-525. https://doi.org/10.1007/s10562-009-9943-9. [17] W. Yan J. Wang J. Ding P. Sun S. Zhang J. Shen X. Jin Catalytic epoxidation of olefins in liquid phase over manganese based magnetic nanoparticles Dalton Trans. 48 2019 16827 16843 10.1039/C9DT03456K W. Yan, J. Wang, J. Ding, P. Sun, S. Zhang, J. Shen, X. Jin, Catalytic epoxidation of olefins in liquid phase over manganese based magnetic nanoparticles, Dalton Trans.. 48 (2019) 16827-16843. https://doi.org/10.1039/C9DT03456K. [18] A. Nodzewska A. Wadolowska M. Watkinson Recent advances in the catalytic oxidation of alkene and alkane substrates using immobilized manganese complexes with nitrogen containing ligands Coord. Chem. Rev. 382 2019 181 216 10.1016/j.ccr.2018.12.004 A. Nodzewska, A. Wadolowska, M. Watkinson, Recent advances in the catalytic oxidation of alkene and alkane substrates using immobilized manganese complexes with nitrogen containing ligands, Coord. Chem. Rev.. 382 (2019) 181-216. https://doi.org/10.1016/j.ccr.2018.12.004. [19] W. Yan A. Ramanathan P.D. Patel S.K. Maiti B.B. Laird W.H. Thompson B. Subramaniam Mechanistic insights for enhancing activity and stability of Nb-incorporated silicates for selective ethylene epoxidation J. Catal. 336 2016 75 84 10.1016/j.jcat.2015.12.022 W. Yan, A. Ramanathan, P.D. Patel, S.K. Maiti, B.B. Laird, W.H. Thompson, B. Subramaniam, Mechanistic insights for enhancing activity and stability of Nb-incorporated silicates for selective ethylene epoxidation, J. Catal.. 336 (2016) 75-84. https://doi.org/10.1016/j.jcat.2015.12.022. [20] M. Masteri-Farahani S. Abednatanzi Immobilized molybdenum–Schiff base complex on the surface of multi-wall carbon nanotubes as a new heterogeneous epoxidation catalyst Inorg. Chem. Commun. 37 2013 39 42 10.1016/j.inoche.2013.09.054 M. Masteri-Farahani, S. Abednatanzi, Immobilized molybdenum–Schiff base complex on the surface of multi-wall carbon nanotubes as a new heterogeneous epoxidation catalyst, Inorg. Chem. Commun.. 37 (2013) 39-42. https://doi.org/10.1016/j.inoche.2013.09.054. [21] M. Yoon R. Srirambalaji K. Kim Homochiral metal-organic frameworks for asymmetric heterogeneous catalysis Chem. Rev. 112 2012 1196 1231 10.1021/cr2003147 M. Yoon, R. Srirambalaji, K. Kim, Homochiral metal-organic frameworks for asymmetric heterogeneous catalysis, Chem. Rev. 112 (2012) 1196-1231. https://doi.org/10.1021/cr2003147. [22] A.W. Stubbs L. Braglia E. Borfecchia R.J. Meyer Y. Román-Leshkov C. Lamberti M. Dincă Selective catalytic olefin epoxidation with MnII-exchanged MOF-5 ACS Catal 8 2018 596 601 10.1021/acscatal.7b02946 A.W. Stubbs, L. Braglia, E. Borfecchia, R.J. Meyer, Y. Román-Leshkov, C. Lamberti, M. Dincă, Selective catalytic olefin epoxidation with MnII-exchanged MOF-5, ACS Catal. 8 (2018) 596-601. https://doi.org/10.1021/acscatal.7b02946. [23] S. Chatterjee P. Bhanja L. Paul M. Ali A. Bhaumik MnAPO-5 as an efficient heterogeneous catalyst for selective liquid phase partial oxidation reactions Dalton Trans. 47 2018 791 798 10.1039/C7DT03897F S. Chatterjee, P. Bhanja, L. Paul, M. Ali, A. Bhaumik, MnAPO-5 as an efficient heterogeneous catalyst for selective liquid phase partial oxidation reactions, Dalton Trans.. 47 (2018) 791-798. https://doi.org/10.1039/C7DT03897F. [24] C. Pang Y. Zhuo Q. Weng Mn/SAPO-34 as an efficient catalyst for the low-temperature selective catalytic reduction of NOx with NH3 RSC Adv. 7 2017 32146 32154 10.1039/C7RA05165D C. Pang, Y. Zhuo, Q. Weng, Mn/SAPO-34 as an efficient catalyst for the low-temperature selective catalytic reduction of NOx with NH3, RSC Adv.. 7 (2017) 32146-32154. doi: 10.1039/C7RA05165D. [25] B. Tang X.-H. Lu D. Zhou P. Tian Z.-H. Niu J.-L. Zhang X. Chen Q.-H. Xia Co2+-exchanged SAPO-5 and SAPO-34 as efficient heterogeneous catalysts for aerobic epoxidation of alkenes Catal. Commun. 31 2013 42 47 10.1016/j.catcom.2012.11.011 B. Tang, X.-H. Lu, D. Zhou, P. Tian, Z.-H. Niu, J.-L. Zhang, X. Chen, Q.-H. Xia, Co2+-exchanged SAPO-5 and SAPO-34 as efficient heterogeneous catalysts for aerobic epoxidation of alkenes, Catal. Commun.. 31 (2013) 42-47. https://doi.org/10.1016/j.catcom.2012.11.011. [26] B. Hu G.L. Mao D.K. Wang Y.D. Fu B.H. Wang M.J. Luo Conversion and coking of olefins on SAPO-34 Catal. Sci. Tech. 7 2017 5785 5794 10.1039/c7cy01898c B. Hu, G.L. Mao, D.K. Wang, Y.D. Fu, B.H. Wang, M.J. Luo, Conversion and coking of olefins on SAPO-34, Catal. Sci. Tech.. 7 (2017) 5785-5794. 10.1039/c7cy01898c. [27] S. Ren G. Liu X. Wu X. Chen M. Wu G. Zeng Z. Liu Y. Sun Enhanced MTO performance over acid treated hierarchical SAPO-34 Chin. J. Catal. 38 2017 123 130 10.1016/S1872-2067(16)62557-3 S. Ren, G. Liu, X. Wu, X. Chen, M. Wu, G. Zeng, Z. Liu, Y. Sun, Enhanced MTO performance over acid treated hierarchical SAPO-34, Chin. J. Catal.. 38 (2017) 123-130. https://doi.org/10.1016/S1872-2067(16)62557-3. [28] A.L. Cánepa C.M. Chanquía V.M. Vaschetti G.A. Eimer S.G. Casuscelli Biomass toward fine chemical products: Oxidation of α-pinene over sieves nanostructured modified with vanadium J. Mol. Catal. A Chem. 404 2015 65 73 10.1016/j.molcata.2015.04.009 A.L. Cánepa, C.M. Chanquía, V.M. Vaschetti, G.A. Eimer, S.G. Casuscelli, Biomass toward fine chemical products: Oxidation of α-pinene over sieves nanostructured modified with vanadium, J. Mol. Catal. A Chem.. 404 (2015) 65-73. https://doi.org/10.1016/j.molcata.2015.04.009. [29] Y.S. Raupp C. Yildiz W. Kleist M.A. Meier Aerobic oxidation of α-pinene catalyzed by homogeneous and MOF-based Mn catalysts Appl. Catal. A 546 2017 1 6 10.1016/j.apcata.2017.07.047 Y.S. Raupp, C. Yildiz, W. Kleist, M.A. Meier, Aerobic oxidation of α-pinene catalyzed by homogeneous and MOF-based Mn catalysts, Appl. Catal. A. 546 (2017) 1-6. https://doi.org/10.1016/j.apcata.2017.07.047. [30] A. Bhunia M.A. Gotthardt M. Yadav M.T. Gamer A. Eichhöfer W. Kleist P.W. Roesky Salen-Based Coordination Polymers of Manganese and the Rare-Earth Elements: Synthesis and Catalytic Aerobic Epoxidation of Olefins Chemistry 19 2013 1986 1995 10.1002/chem.201203636 A. Bhunia, M.A. Gotthardt, M. Yadav, M.T. Gamer, A. Eichhöfer, W. Kleist, P.W. Roesky, Salen-Based Coordination Polymers of Manganese and the Rare-Earth Elements: Synthesis and Catalytic Aerobic Epoxidation of Olefins, Chemistry. 19 (2013) 1986-1995. https://doi.org/10.1002/chem.201203636. [31] C. Yang L. Jiang H. Wang Y. Zheng Y. Wang Process optimization for selective hydrogenation of α-pinene over Ni/AlPO4 Korean J. Chem. Eng. 35 2018 409 420 10.1007/s11814-017-0307-7 C. Yang, L. Jiang, H. Wang, Y. Zheng, Y. Wang, Process optimization for selective hydrogenation of α-pinene over Ni/AlPO4, Korean J. Chem. Eng.. 35 (2018) 409-420. https://doi.org/10.1007/s11814-017-0307-7. [32] R.P. Darllan F.N. Roberto de P.A.P. Simone A sequential Box-Behnken Design (BBD) and Response Surface Methodology (RSM) to optimize SAPO-34 synthesis from kaolin waste Microporous Mesoporous Mater. 323 2021 111250 10.1016/j.micromeso.2021.111250 R.P. Darllan, F.N. Roberto de, P.A.P. Simone, A sequential Box-Behnken Design (BBD) and Response Surface Methodology (RSM) to optimize SAPO-34 synthesis from kaolin waste, Microporous Mesoporous Mater.. 323 (2021) 111250. https://doi.org/10.1016/j.micromeso.2021.111250. [33] C. Wei-Hsin E.K.Eilhann Manuel L. Kun-Yi Andrew P. Young-Kwon D. Lu S. Lip Huat A comprehensive review of thermoelectric generation optimization by statistical approach: Taguchi method, analysis of variance (ANOVA), and response surface methodology (RSM) Renewable Sustainable Energy Rev. 169 2022 112917 10.1016/j.rser.2022.112917 C. Wei-Hsin, Manuel, E.K. Eilhann, L. Kun-Yi Andrew, P. Young-Kwon, D. Lu, S. Lip Huat, A comprehensive review of thermoelectric generation optimization by statistical approach: Taguchi method, analysis of variance (ANOVA), and response surface methodology (RSM), Renewable Sustainable Energy Rev.. 169 (2022) 112917. https://doi.org/10.1016/j.rser.2022.112917. [34] N. Van Toan D. Duy Khoe M. Young Sun Y. Kyeong Hwan D. Van Duong H. Md. Mokter S. Shirjana S. Teke High-throughput volatile organic compounds removal in a sandwich-type honeycomb catalyst system combined with plasma Appl. Catal. B 310 2022 121328 10.1016/j.apcatb.2022.121328 N. Van Toan, D. Duy Khoe, M. Young Sun, Y. Kyeong Hwan, D. Van Duong, H. Md. Mokter, S. Shirjana, S. Teke, High-throughput volatile organic compounds removal in a sandwich-type honeycomb catalyst system combined with plasma, Appl. Catal. B. 310 (2022) 121328. https://doi.org/10.1016/j.apcatb.2022.121328. [35] S. Madadi L. Charbonneau J.-Y. Bergeron S. Kaliaguine Aerobic epoxidation of limonene using cobalt substituted mesoporous SBA-16 Part 1: Optimization via Response Surface Methodology (RSM) Appl. Catal. B 260 2020 118049 10.1016/j.apcatb.2019.118049 S. Madadi, L. Charbonneau, J.-Y. Bergeron, S. Kaliaguine, Aerobic epoxidation of limonene using cobalt substituted mesoporous SBA-16 Part 1: Optimization via Response Surface Methodology (RSM), Appl. Catal. B. 260 (2020) 118049. https://doi.org/10.1016/j.apcatb.2019.118049. [36] X. Li, T. Lei, Z. Wang, X. Li, M. Wen, M. Yang, G. Chen, X. He, Q. Guan, Z. Li, Catalytic pyrolysis of corn straw with magnetic solid acid catalyst to prepare levulinic acid by response surface methodology, Industrial Crops Products. 116 (2018) 73-80. https://doi.org/10.1016/j.indcrop.2018.02.049. [37] L. Huang X. Wang S. Yao B. Jiang X. Chen X. Wang Cu-Mn bimetal ion-exchanged SAPO-34 as an active SCR catalyst for removal of NOx from diesel engine exhausts Catal. Commun. 81 2016 54 57 10.1016/j.catcom.2016.03.010 L. Huang, X. Wang, S. Yao, B. Jiang, X. Chen, X. Wang, Cu-Mn bimetal ion-exchanged SAPO-34 as an active SCR catalyst for removal of NOx from diesel engine exhausts, Catal. Commun.. 81 (2016) 54-57. https://doi.org/10.1016/j.catcom.2016.03.010. [38] T. Yu T. Hao D. Fan J. Wang M. Shen W. Li Recent NH3-SCR mechanism research over Cu/SAPO-34 catalyst J. Phys. Chem. C 118 2014 6565 6575 10.1021/jp4114199 T. Yu, T. Hao, D. Fan, J. Wang, M. Shen, W. Li, Recent NH3-SCR mechanism research over Cu/SAPO-34 catalyst, J. Phys. Chem. C. 118 (2014) 6565-6575. https://doi.org/10.1021/jp4114199. [39] C. Ji H.B. Yu J.Z. Zang L.M. Wu Synthesis of Low Silicon Submicron-Sized SAPO-34 Molecular Sieve by Micron Seed Activation Method to Improve the Performance of MTO Catal. Lett. 2022 1 10 10.1007/s10562-022-03975-8 C. Ji, H.B. Yu, J.Z. Zang, L.M. Wu, Synthesis of Low Silicon Submicron-Sized SAPO-34 Molecular Sieve by Micron Seed Activation Method to Improve the Performance of MTO, Catal. Lett.. (2022) 1-10. 10.1007/s10562-022-03975-8. [40] J. Yao J. Jiao R. Liu F. Zha X. Guo X. Tang H. Tian Y. Chang Template-assisted preparation of metal-modified SAPO-34 molecular sieves for the catalysis of methanol-to-olefins Korean J. Chem. Eng. 38 2021 1381 1393 10.1007/s11814-021-0793-5 J. Yao, J. Jiao, R. Liu, F. Zha, X. Guo, X. Tang, H. Tian, Y. Chang, Template-assisted preparation of metal-modified SAPO-34 molecular sieves for the catalysis of methanol-to-olefins, Korean J. Chem. Eng.. 38 (2021) 1381-1393. https://doi.org/10.1007/s11814-021-0793-5. [41] F. Chen B.-C. Huang Y.-X. Yang X.-Q. Liu C.-L. Yu Synthesis, characterization and NH3-SCR activity of MnSAPO-34 molecular sieves Acta Phys. Chim. Sin. 31 2015 2375 2385 10.3866/PKU.WHXB201510201 F. Chen, B.-C. Huang, Y.-X. Yang, X.-Q. Liu, C.-L. Yu, Synthesis, characterization and NH3-SCR activity of MnSAPO-34 molecular sieves, Acta Phys. Chim. Sin.. 31 (2015) 2375-2385. https://doi.org/10.3866/PKU.WHXB201510201. [42] R. Gostynski J. Conradie E. Erasmus Significance of the electron-density of molecular fragments on the properties of manganese (iii) β-diketonato complexes: an XPS and DFT study RSC Adv. 7 2017 27718 27728 10.1039/C7RA04921H R. Gostynski, J. Conradie, E. Erasmus, Significance of the electron-density of molecular fragments on the properties of manganese (iii) β-diketonato complexes: an XPS and DFT study, RSC Adv.. 7 (2017) 27718-27728. doi: 10.1039/C7RA04921H. [43] Y. Wang Y. Zheng Y. Wang K. Li Y. Wang L. Jiang X. Zhu Y. Wei H. Wang Syngas production modified by oxygen vacancies over CeO2-ZrO2-CuO oxygen carrier via chemical looping reforming of methane Appl. Surf. Sci. 481 2019 151 160 10.1016/j.apsusc.2019.03.050 Y. Wang, Y. Zheng, Y. Wang, K. Li, Y. Wang, L. Jiang, X. Zhu, Y. Wei, H. Wang, Syngas production modified by oxygen vacancies over CeO2-ZrO2-CuO oxygen carrier via chemical looping reforming of methane, Appl. Surf. Sci.. 481 (2019) 151-160. https://doi.org/10.1016/j.apsusc.2019.03.050. [44] Y. Wang Y. Zheng Y. Wang H. Wang X. Zhu Y. Wei Y. Wang L. Jiang Z. Yang K. Li Evaluation of Fe substitution in perovskite LaMnO3 for the production of high purity syngas and hydrogen J. Power Sources 449 2020 227505 10.1016/j.jpowsour.2019.227505 Y. Wang, Y. Zheng, Y. Wang, H. Wang, X. Zhu, Y. Wei, Y. Wang, L. Jiang, Z. Yang, K. Li, Evaluation of Fe substitution in perovskite LaMnO3 for the production of high purity syngas and hydrogen, J. Power Sources. 449 (2020) 227505. https://doi.org/10.1016/j.jpowsour.2019.227505. [45] B. Qi X.-H. Lu S.-Y. Fang J. Lei Y.-L. Dong D. Zhou Q.-H. Xia Aerobic epoxidation of olefins over the composite catalysts of Co-ZSM-5 (L) with bi-/tridentate Schiff-base ligands J. Mol. Catal. A Chem. 334 2011 44 51 10.1016/j.molcata.2010.10.021 B. Qi, X.-H. Lu, S.-Y. Fang, J. Lei, Y.-L. Dong, D. Zhou, Q.-H. Xia, Aerobic epoxidation of olefins over the composite catalysts of Co-ZSM-5 (L) with bi-/tridentate Schiff-base ligands, J. Mol. Catal. A Chem.. 334 (2011) 44-51. https://doi.org/10.1016/j.molcata.2010.10.021. [46] R. Saladino A. Andreoni V. Neri C. Crestini A novel and efficient catalytic epoxidation of olefins and monoterpenes with microencapsulated Lewis base adducts of methyltrioxorhenium Tetrahedron 61 2005 1069 1075 10.1016/j.tet.2004.11.065 R. Saladino, A. Andreoni, V. Neri, C. Crestini, A novel and efficient catalytic epoxidation of olefins and monoterpenes with microencapsulated Lewis base adducts of methyltrioxorhenium, Tetrahedron. 61 (2005) 1069-1075. https://doi.org/10.1016/j.tet.2004.11.065. [47] J.Y. Qi Y.M. Li Z.Y. Zhou C.M. Che C.H. Yeung A.S. Chan Novel Manganese Complex as an Efficient Catalyst for the Isobutyraldehyde-Mediated Epoxidation of Cyclic Alkenes with Dioxygen Adv. Synth. Catal. 347 2005 45 49 10.1002/adsc.200404224 J.Y. Qi, Y.M. Li, Z.Y. Zhou, C.M. Che, C.H. Yeung, A.S. Chan, Novel Manganese Complex as an Efficient Catalyst for the Isobutyraldehyde-Mediated Epoxidation of Cyclic Alkenes with Dioxygen, Adv. Synth. Catal.. 347 (2005) 45-49. https://doi.org/10.1002/adsc.200404224.",
      "scopus-id": "85144495865",
      "coredata": {
        "eid": "1-s2.0-S2468823122007581",
        "dc:description": "Aerobic epoxidation of bio-based olefins is an important topic in green and sustainable chemistry. In this work, an Mn/SAPO-34 catalyst was prepared by ion-exchange method for the epoxidation of α-pinene in presence of molecular oxygen and iso-butyraldehyde. The factors influencing α-pinene epoxidation were determined and the conditions were optimized by response surface methodology (RSM). The result showed that the sensitive conditions were co-reductant amount, Mn loading amount and catalyst amount. After optimization, α-pinene was completely converted and a 90.47% yield of 2,3-epoxy-pinane was obtained. The result showed that the catalyst was reusable for six cycles. In addition, the support and catalysts were characterized by XRD, BET, ICP-OES, SEM-EDS, TEM and XPS, and it was confirmed the reasons for the degradation of the catalyst activity were the damage of crystal particles, the decrease in specific surface area of catalyst, the loss of active components and the irreversible oxidation of Mn2+",
        "openArchiveArticle": "false",
        "prism:coverDate": "2023-01-15",
        "openaccessUserLicense": null,
        "prism:aggregationType": "Journal",
        "prism:url": "https://api.elsevier.com/content/article/pii/S2468823122007581",
        "dc:creator": [
          {
            "@_fa": "true",
            "$": "Huang, Pengpeng"
          },
          {
            "@_fa": "true",
            "$": "Chen, Tinghui"
          },
          {
            "@_fa": "true",
            "$": "Zheng, Yane"
          },
          {
            "@_fa": "true",
            "$": "Yang, Chen"
          },
          {
            "@_fa": "true",
            "$": "Wang, Yaming"
          },
          {
            "@_fa": "true",
            "$": "Ran, Suoyu"
          },
          {
            "@_fa": "true",
            "$": "Zhi, Yunfei"
          },
          {
            "@_fa": "true",
            "$": "Shan, Shaoyun"
          },
          {
            "@_fa": "true",
            "$": "Jiang, Lihong"
          }
        ],
        "link": [
          {
            "@_fa": "true",
            "@rel": "self",
            "@href": "https://api.elsevier.com/content/article/pii/S2468823122007581"
          },
          {
            "@_fa": "true",
            "@rel": "scidir",
            "@href": "https://www.sciencedirect.com/science/article/pii/S2468823122007581"
          }
        ],
        "dc:format": "application/json",
        "openaccessType": null,
        "pii": "S2468-8231(22)00758-1",
        "prism:volume": "535",
        "articleNumber": "112872",
        "prism:publisher": "Elsevier B.V.",
        "dc:title": "Aerobic epoxidation of α-pinene using Mn/SAPO-34 catalyst: Optimization via Response Surface Methodology (RSM)",
        "prism:copyright": "© 2022 Elsevier B.V. All rights reserved.",
        "openaccess": "0",
        "prism:issn": "24688231",
        "dcterms:subject": [
          {
            "@_fa": "true",
            "$": "α-Pinene"
          },
          {
            "@_fa": "true",
            "$": "Aerobic epoxidation"
          },
          {
            "@_fa": "true",
            "$": "Response surface methodology"
          },
          {
            "@_fa": "true",
            "$": "Mn-SAPO-34 catalyst"
          }
        ],
        "openaccessArticle": "false",
        "prism:publicationName": "Molecular Catalysis",
        "openaccessSponsorType": null,
        "prism:pageRange": "112872",
        "pubType": "fla",
        "prism:coverDisplayDate": "15 January 2023",
        "prism:doi": "10.1016/j.mcat.2022.112872",
        "prism:startingPage": "112872",
        "dc:identifier": "doi:10.1016/j.mcat.2022.112872",
        "openaccessSponsorName": null
      },
      "objects": {
        "object": [
          {
            "@category": "standard",
            "@height": "311",
            "@width": "339",
            "@_fa": "true",
            "$": "https://api.elsevier.com/content/object/eid/1-s2.0-S2468823122007581-gr3.jpg?httpAccept=%2A%2F%2A",
            "@multimediatype": "JPEG image file",
            "@type": "IMAGE-DOWNSAMPLED",
            "@size": "28788",
            "@ref": "gr3",
            "@mimetype": "image/jpeg"
          },
          {
            "@category": "standard",
            "@height": "228",
            "@width": "659",
            "@_fa": "true",
            "$": "https://api.elsevier.com/content/object/eid/1-s2.0-S2468823122007581-gr4.jpg?httpAccept=%2A%2F%2A",
            "@multimediatype": "JPEG image file",
            "@type": "IMAGE-DOWNSAMPLED",
            "@size": "54832",
            "@ref": "gr4",
            "@mimetype": "image/jpeg"
          },
          {
            "@category": "standard",
            "@height": "227",
            "@width": "659",
            "@_fa": "true",
            "$": "https://api.elsevier.com/content/object/eid/1-s2.0-S2468823122007581-gr5.jpg?httpAccept=%2A%2F%2A",
            "@multimediatype": "JPEG image file",
            "@type": "IMAGE-DOWNSAMPLED",
            "@size": "49115",
            "@ref": "gr5",
            "@mimetype": "image/jpeg"
          },
          {
            "@category": "standard",
            "@height": "231",
            "@width": "659",
            "@_fa": "true",
            "$": "https://api.elsevier.com/content/object/eid/1-s2.0-S2468823122007581-gr6.jpg?httpAccept=%2A%2F%2A",
            "@multimediatype": "JPEG image file",
            "@type": "IMAGE-DOWNSAMPLED",
            "@size": "53597",
            "@ref": "gr6",
            "@mimetype": "image/jpeg"
          },
          {
            "@category": "standard",
            "@height": "454",
            "@width": "659",
            "@_fa": "true",
            "$": "https://api.elsevier.com/content/object/eid/1-s2.0-S2468823122007581-gr1.jpg?httpAccept=%2A%2F%2A",
            "@multimediatype": "JPEG image file",
            "@type": "IMAGE-DOWNSAMPLED",
            "@size": "49833",
            "@ref": "gr1",
            "@mimetype": "image/jpeg"
          },
          {
            "@category": "standard",
            "@height": "887",
            "@width": "565",
            "@_fa": "true",
            "$": "https://api.elsevier.com/content/object/eid/1-s2.0-S2468823122007581-gr2.jpg?httpAccept=%2A%2F%2A",
            "@multimediatype": "JPEG image file",
            "@type": "IMAGE-DOWNSAMPLED",
            "@size": "125500",
            "@ref": "gr2",
            "@mimetype": "image/jpeg"
          },
          {
            "@category": "standard",
            "@height": "281",
            "@width": "339",
            "@_fa": "true",
            "$": "https://api.elsevier.com/content/object/eid/1-s2.0-S2468823122007581-gr7.jpg?httpAccept=%2A%2F%2A",
            "@multimediatype": "JPEG image file",
            "@type": "IMAGE-DOWNSAMPLED",
            "@size": "30196",
            "@ref": "gr7",
            "@mimetype": "image/jpeg"
          },
          {
            "@category": "standard",
            "@height": "525",
            "@width": "565",
            "@_fa": "true",
            "$": "https://api.elsevier.com/content/object/eid/1-s2.0-S2468823122007581-gr12.jpg?httpAccept=%2A%2F%2A",
            "@multimediatype": "JPEG image file",
            "@type": "IMAGE-DOWNSAMPLED",
            "@size": "34431",
            "@ref": "gr12",
            "@mimetype": "image/jpeg"
          },
          {
            "@category": "standard",
            "@height": "323",
            "@width": "339",
            "@_fa": "true",
            "$": "https://api.elsevier.com/content/object/eid/1-s2.0-S2468823122007581-gr8.jpg?httpAccept=%2A%2F%2A",
            "@multimediatype": "JPEG image file",
            "@type": "IMAGE-DOWNSAMPLED",
            "@size": "55751",
            "@ref": "gr8",
            "@mimetype": "image/jpeg"
          },
          {
            "@category": "standard",
            "@height": "499",
            "@width": "659",
            "@_fa": "true",
            "$": "https://api.elsevier.com/content/object/eid/1-s2.0-S2468823122007581-gr9.jpg?httpAccept=%2A%2F%2A",
            "@multimediatype": "JPEG image file",
            "@type": "IMAGE-DOWNSAMPLED",
            "@size": "162627",
            "@ref": "gr9",
            "@mimetype": "image/jpeg"
          },
          {
            "@category": "standard",
            "@height": "293",
            "@width": "339",
            "@_fa": "true",
            "$": "https://api.elsevier.com/content/object/eid/1-s2.0-S2468823122007581-gr10.jpg?httpAccept=%2A%2F%2A",
            "@multimediatype": "JPEG image file",
            "@type": "IMAGE-DOWNSAMPLED",
            "@size": "32138",
            "@ref": "gr10",
            "@mimetype": "image/jpeg"
          },
          {
            "@category": "standard",
            "@height": "309",
            "@width": "659",
            "@_fa": "true",
            "$": "https://api.elsevier.com/content/object/eid/1-s2.0-S2468823122007581-gr11.jpg?httpAccept=%2A%2F%2A",
            "@multimediatype": "JPEG image file",
            "@type": "IMAGE-DOWNSAMPLED",
            "@size": "68478",
            "@ref": "gr11",
            "@mimetype": "image/jpeg"
          },
          {
            "@category": "standard",
            "@height": "200",
            "@width": "273",
            "@_fa": "true",
            "$": "https://api.elsevier.com/content/object/eid/1-s2.0-S2468823122007581-ga1.jpg?httpAccept=%2A%2F%2A",
            "@multimediatype": "JPEG image file",
            "@type": "IMAGE-DOWNSAMPLED",
            "@size": "26760",
            "@ref": "ga1",
            "@mimetype": "image/jpeg"
          },
          {
            "@category": "thumbnail",
            "@height": "164",
            "@width": "178",
            "@_fa": "true",
            "$": "https://api.elsevier.com/content/object/eid/1-s2.0-S2468823122007581-gr3.sml?httpAccept=%2A%2F%2A",
            "@multimediatype": "GIF image file",
            "@type": "IMAGE-THUMBNAIL",
            "@size": "8271",
            "@ref": "gr3",
            "@mimetype": "image/gif"
          },
          {
            "@category": "thumbnail",
            "@height": "76",
            "@width": "219",
            "@_fa": "true",
            "$": "https://api.elsevier.com/content/object/eid/1-s2.0-S2468823122007581-gr4.sml?httpAccept=%2A%2F%2A",
            "@multimediatype": "GIF image file",
            "@type": "IMAGE-THUMBNAIL",
            "@size": "11157",
            "@ref": "gr4",
            "@mimetype": "image/gif"
          },
          {
            "@category": "thumbnail",
            "@height": "75",
            "@width": "219",
            "@_fa": "true",
            "$": "https://api.elsevier.com/content/object/eid/1-s2.0-S2468823122007581-gr5.sml?httpAccept=%2A%2F%2A",
            "@multimediatype": "GIF image file",
            "@type": "IMAGE-THUMBNAIL",
            "@size": "10475",
            "@ref": "gr5",
            "@mimetype": "image/gif"
          },
          {
            "@category": "thumbnail",
            "@height": "77",
            "@width": "219",
            "@_fa": "true",
            "$": "https://api.elsevier.com/content/object/eid/1-s2.0-S2468823122007581-gr6.sml?httpAccept=%2A%2F%2A",
            "@multimediatype": "GIF image file",
            "@type": "IMAGE-THUMBNAIL",
            "@size": "11160",
            "@ref": "gr6",
            "@mimetype": "image/gif"
          },
          {
            "@category": "thumbnail",
            "@height": "151",
            "@width": "219",
            "@_fa": "true",
            "$": "https://api.elsevier.com/content/object/eid/1-s2.0-S2468823122007581-gr1.sml?httpAccept=%2A%2F%2A",
            "@multimediatype": "GIF image file",
            "@type": "IMAGE-THUMBNAIL",
            "@size": "10266",
            "@ref": "gr1",
            "@mimetype": "image/gif"
          },
          {
            "@category": "thumbnail",
            "@height": "163",
            "@width": "104",
            "@_fa": "true",
            "$": "https://api.elsevier.com/content/object/eid/1-s2.0-S2468823122007581-gr2.sml?httpAccept=%2A%2F%2A",
            "@multimediatype": "GIF image file",
            "@type": "IMAGE-THUMBNAIL",
            "@size": "9314",
            "@ref": "gr2",
            "@mimetype": "image/gif"
          },
          {
            "@category": "thumbnail",
            "@height": "164",
            "@width": "198",
            "@_fa": "true",
            "$": "https://api.elsevier.com/content/object/eid/1-s2.0-S2468823122007581-gr7.sml?httpAccept=%2A%2F%2A",
            "@multimediatype": "GIF image file",
            "@type": "IMAGE-THUMBNAIL",
            "@size": "12774",
            "@ref": "gr7",
            "@mimetype": "image/gif"
          },
          {
            "@category": "thumbnail",
            "@height": "164",
            "@width": "176",
            "@_fa": "true",
            "$": "https://api.elsevier.com/content/object/eid/1-s2.0-S2468823122007581-gr12.sml?httpAccept=%2A%2F%2A",
            "@multimediatype": "GIF image file",
            "@type": "IMAGE-THUMBNAIL",
            "@size": "4120",
            "@ref": "gr12",
            "@mimetype": "image/gif"
          },
          {
            "@category": "thumbnail",
            "@height": "164",
            "@width": "172",
            "@_fa": "true",
            "$": "https://api.elsevier.com/content/object/eid/1-s2.0-S2468823122007581-gr8.sml?httpAccept=%2A%2F%2A",
            "@multimediatype": "GIF image file",
            "@type": "IMAGE-THUMBNAIL",
            "@size": "14187",
            "@ref": "gr8",
            "@mimetype": "image/gif"
          },
          {
            "@category": "thumbnail",
            "@height": "164",
            "@width": "216",
            "@_fa": "true",
            "$": "https://api.elsevier.com/content/object/eid/1-s2.0-S2468823122007581-gr9.sml?httpAccept=%2A%2F%2A",
            "@multimediatype": "GIF image file",
            "@type": "IMAGE-THUMBNAIL",
            "@size": "34416",
            "@ref": "gr9",
            "@mimetype": "image/gif"
          },
          {
            "@category": "thumbnail",
            "@height": "163",
            "@width": "189",
            "@_fa": "true",
            "$": "https://api.elsevier.com/content/object/eid/1-s2.0-S2468823122007581-gr10.sml?httpAccept=%2A%2F%2A",
            "@multimediatype": "GIF image file",
            "@type": "IMAGE-THUMBNAIL",
            "@size": "12021",
            "@ref": "gr10",
            "@mimetype": "image/gif"
          },
          {
            "@category": "thumbnail",
            "@height": "103",
            "@width": "219",
            "@_fa": "true",
            "$": "https://api.elsevier.com/content/object/eid/1-s2.0-S2468823122007581-gr11.sml?httpAccept=%2A%2F%2A",
            "@multimediatype": "GIF image file",
            "@type": "IMAGE-THUMBNAIL",
            "@size": "12622",
            "@ref": "gr11",
            "@mimetype": "image/gif"
          },
          {
            "@category": "thumbnail",
            "@height": "160",
            "@width": "219",
            "@_fa": "true",
            "$": "https://api.elsevier.com/content/object/eid/1-s2.0-S2468823122007581-ga1.sml?httpAccept=%2A%2F%2A",
            "@multimediatype": "GIF image file",
            "@type": "IMAGE-THUMBNAIL",
            "@size": "18646",
            "@ref": "ga1",
            "@mimetype": "image/gif"
          },
          {
            "@category": "high",
            "@height": "1378",
            "@width": "1500",
            "@_fa": "true",
            "$": "https://api.elsevier.com/content/object/eid/1-s2.0-S2468823122007581-gr3_lrg.jpg?httpAccept=%2A%2F%2A",
            "@multimediatype": "JPEG image file",
            "@type": "IMAGE-HIGH-RES",
            "@size": "511575",
            "@ref": "gr3",
            "@mimetype": "image/jpeg"
          },
          {
            "@category": "high",
            "@height": "1010",
            "@width": "2917",
            "@_fa": "true",
            "$": "https://api.elsevier.com/content/object/eid/1-s2.0-S2468823122007581-gr4_lrg.jpg?httpAccept=%2A%2F%2A",
            "@multimediatype": "JPEG image file",
            "@type": "IMAGE-HIGH-RES",
            "@size": "441375",
            "@ref": "gr4",
            "@mimetype": "image/jpeg"
          },
          {
            "@category": "high",
            "@height": "1003",
            "@width": "2917",
            "@_fa": "true",
            "$": "https://api.elsevier.com/content/object/eid/1-s2.0-S2468823122007581-gr5_lrg.jpg?httpAccept=%2A%2F%2A",
            "@multimediatype": "JPEG image file",
            "@type": "IMAGE-HIGH-RES",
            "@size": "392644",
            "@ref": "gr5",
            "@mimetype": "image/jpeg"
          },
          {
            "@category": "high",
            "@height": "1024",
            "@width": "2917",
            "@_fa": "true",
            "$": "https://api.elsevier.com/content/object/eid/1-s2.0-S2468823122007581-gr6_lrg.jpg?httpAccept=%2A%2F%2A",
            "@multimediatype": "JPEG image file",
            "@type": "IMAGE-HIGH-RES",
            "@size": "431222",
            "@ref": "gr6",
            "@mimetype": "image/jpeg"
          },
          {
            "@category": "high",
            "@height": "2010",
            "@width": "2917",
            "@_fa": "true",
            "$": "https://api.elsevier.com/content/object/eid/1-s2.0-S2468823122007581-gr1_lrg.jpg?httpAccept=%2A%2F%2A",
            "@multimediatype": "JPEG image file",
            "@type": "IMAGE-HIGH-RES",
            "@size": "453862",
            "@ref": "gr1",
            "@mimetype": "image/jpeg"
          },
          {
            "@category": "high",
            "@height": "3926",
            "@width": "2500",
            "@_fa": "true",
            "$": "https://api.elsevier.com/content/object/eid/1-s2.0-S2468823122007581-gr2_lrg.jpg?httpAccept=%2A%2F%2A",
            "@multimediatype": "JPEG image file",
            "@type": "IMAGE-HIGH-RES",
            "@size": "1088003",
            "@ref": "gr2",
            "@mimetype": "image/jpeg"
          },
          {
            "@category": "high",
            "@height": "1243",
            "@width": "1500",
            "@_fa": "true",
            "$": "https://api.elsevier.com/content/object/eid/1-s2.0-S2468823122007581-gr7_lrg.jpg?httpAccept=%2A%2F%2A",
            "@multimediatype": "JPEG image file",
            "@type": "IMAGE-HIGH-RES",
            "@size": "636393",
            "@ref": "gr7",
            "@mimetype": "image/jpeg"
          },
          {
            "@category": "high",
            "@height": "2323",
            "@width": "2500",
            "@_fa": "true",
            "$": "https://api.elsevier.com/content/object/eid/1-s2.0-S2468823122007581-gr12_lrg.jpg?httpAccept=%2A%2F%2A",
            "@multimediatype": "JPEG image file",
            "@type": "IMAGE-HIGH-RES",
            "@size": "262592",
            "@ref": "gr12",
            "@mimetype": "image/jpeg"
          },
          {
            "@category": "high",
            "@height": "1429",
            "@width": "1500",
            "@_fa": "true",
            "$": "https://api.elsevier.com/content/object/eid/1-s2.0-S2468823122007581-gr8_lrg.jpg?httpAccept=%2A%2F%2A",
            "@multimediatype": "JPEG image file",
            "@type": "IMAGE-HIGH-RES",
            "@size": "411479",
            "@ref": "gr8",
            "@mimetype": "image/jpeg"
          },
          {
            "@category": "high",
            "@height": "2209",
            "@width": "2917",
            "@_fa": "true",
            "$": "https://api.elsevier.com/content/object/eid/1-s2.0-S2468823122007581-gr9_lrg.jpg?httpAccept=%2A%2F%2A",
            "@multimediatype": "JPEG image file",
            "@type": "IMAGE-HIGH-RES",
            "@size": "1376644",
            "@ref": "gr9",
            "@mimetype": "image/jpeg"
          },
          {
            "@category": "high",
            "@height": "1297",
            "@width": "1500",
            "@_fa": "true",
            "$": "https://api.elsevier.com/content/object/eid/1-s2.0-S2468823122007581-gr10_lrg.jpg?httpAccept=%2A%2F%2A",
            "@multimediatype": "JPEG image file",
            "@type": "IMAGE-HIGH-RES",
            "@size": "197904",
            "@ref": "gr10",
            "@mimetype": "image/jpeg"
          },
          {
            "@category": "high",
            "@height": "1369",
            "@width": "2917",
            "@_fa": "true",
            "$": "https://api.elsevier.com/content/object/eid/1-s2.0-S2468823122007581-gr11_lrg.jpg?httpAccept=%2A%2F%2A",
            "@multimediatype": "JPEG image file",
            "@type": "IMAGE-HIGH-RES",
            "@size": "501255",
            "@ref": "gr11",
            "@mimetype": "image/jpeg"
          },
          {
            "@category": "high",
            "@height": "886",
            "@width": "1210",
            "@_fa": "true",
            "$": "https://api.elsevier.com/content/object/eid/1-s2.0-S2468823122007581-ga1_lrg.jpg?httpAccept=%2A%2F%2A",
            "@multimediatype": "JPEG image file",
            "@type": "IMAGE-HIGH-RES",
            "@size": "199406",
            "@ref": "ga1",
            "@mimetype": "image/jpeg"
          },
          {
            "@category": "standard",
            "@_fa": "true",
            "$": "https://api.elsevier.com/content/object/eid/1-s2.0-S2468823122007581-mmc1.docx?httpAccept=%2A%2F%2A",
            "@multimediatype": "Microsoft Word file",
            "@type": "APPLICATION",
            "@size": "7657316",
            "@ref": "mmc1",
            "@mimetype": "application/word"
          },
          {
            "@category": "thumbnail",
            "@_fa": "true",
            "$": "https://api.elsevier.com/content/object/eid/1-s2.0-S2468823122007581-si1.svg?httpAccept=%2A%2F%2A",
            "@multimediatype": "Scalable Vector Graphics file",
            "@type": "ALTIMG",
            "@size": "15726",
            "@ref": "si1",
            "@mimetype": "image/svg+xml"
          },
          {
            "@category": "thumbnail",
            "@_fa": "true",
            "$": "https://api.elsevier.com/content/object/eid/1-s2.0-S2468823122007581-si2.svg?httpAccept=%2A%2F%2A",
            "@multimediatype": "Scalable Vector Graphics file",
            "@type": "ALTIMG",
            "@size": "21479",
            "@ref": "si2",
            "@mimetype": "image/svg+xml"
          },
          {
            "@category": "thumbnail",
            "@_fa": "true",
            "$": "https://api.elsevier.com/content/object/eid/1-s2.0-S2468823122007581-si3.svg?httpAccept=%2A%2F%2A",
            "@multimediatype": "Scalable Vector Graphics file",
            "@type": "ALTIMG",
            "@size": "15915",
            "@ref": "si3",
            "@mimetype": "image/svg+xml"
          },
          {
            "@category": "thumbnail",
            "@_fa": "true",
            "$": "https://api.elsevier.com/content/object/eid/1-s2.0-S2468823122007581-si4.svg?httpAccept=%2A%2F%2A",
            "@multimediatype": "Scalable Vector Graphics file",
            "@type": "ALTIMG",
            "@size": "11174",
            "@ref": "si4",
            "@mimetype": "image/svg+xml"
          },
          {
            "@category": "thumbnail",
            "@_fa": "true",
            "$": "https://api.elsevier.com/content/object/eid/1-s2.0-S2468823122007581-si5.svg?httpAccept=%2A%2F%2A",
            "@multimediatype": "Scalable Vector Graphics file",
            "@type": "ALTIMG",
            "@size": "19647",
            "@ref": "si5",
            "@mimetype": "image/svg+xml"
          },
          {
            "@category": "standard",
            "@_fa": "true",
            "$": "https://api.elsevier.com/content/object/eid/1-s2.0-S2468823122007581-am.pdf?httpAccept=%2A%2F%2A",
            "@multimediatype": "Acrobat PDF file",
            "@type": "AAM-PDF",
            "@size": "1561656",
            "@ref": "am",
            "@mimetype": "application/pdf"
          }
        ]
      },
      "link": {
        "@rel": "abstract",
        "@href": "https://api.elsevier.com/content/abstract/scopus_id/85144495865"
      }
    }
  }
}