{
  "metadata": {
    "title": "Immobilization poly(ionic liquid)s into hierarchical porous covalent organic frameworks as heterogeneous catalyst for cycloaddition of CO<ce:inf loc=post>2</ce:inf> with epoxides",
    "authors": "; ; ",
    "journal": "Molecular Catalysis",
    "date": "2022-03-31",
    "doi": "10.1016/j.mcat.2022.112164",
    "abstract": "",
    "uri": "https://api.elsevier.com/content/article/pii/S2468823122000529",
    "pii": "S2468823122000529"
  },
  "fulltext": {
    "full-text-retrieval-response": {
      "scopus-eid": "2-s2.0-85124236854",
      "originalText": "serial JL 315758 291210 291744 291790 291809 31 Molecular Catalysis MOLECULARCATALYSIS 2022-02-05 2022-02-05 2022-02-05 2022-02-05 2022-04-07T00:08:44 1-s2.0-S2468823122000529 S2468-8231(22)00052-9 S2468823122000529 10.1016/j.mcat.2022.112164 S300 S300.1 FULL-TEXT 1-s2.0-S2468823122X00035 2022-12-12T23:36:31.133437Z 0 0 20220301 20220331 2022 2022-02-05T16:59:26.822205Z absattachment articleinfo articlenumber articletitlenorm authfirstinitialnorm authfirstsurnamenorm cid cids contenttype copyright crossmark dateloaded dateloadedtxt datesearch datesort dateupdated dco docsubtype doctype doi eid ewtransactionid hubeid indexeddate issn issnnorm itemstage itemtransactionid itemweight openaccess openarchive pg pgfirst pii piinorm pubdateend pubdatestart pubdatetxt pubyr sectiontitle sortorder srctitle srctitlenorm srctype ssids alllist content subj subheadings suppl tomb volfirst volissue volumelist webpdf webpdfpagecount yearnav figure table e-component body acknowledge affil appendices articletitle auth authfirstini authfull authkeywords authlast footnotes grantnumber grantsponsor grantsponsorid highlightsabst primabst ref specialabst 2468-8231 24688231 true 520 520 C Volume 520 5 112164 112164 112164 202203 March 2022 2022-03-01 2022-03-31 2022 Regular Papers article fla © 2022 Elsevier B.V. All rights reserved. IMMOBILIZATIONPOLYIONICLIQUIDSHIERARCHICALPOROUSCOVALENTORGANICFRAMEWORKSHETEROGENEOUSCATALYSTFORCYCLOADDITIONCO2EPOXIDES DU Y 1 Introduction 2 Experiment 2.1 Preparation of catalysts 2.1.1 Synthesis of colloidal PS 2.1.2 Synthesis of HP-TpBD 2.1.3 Synthesis of PIL-HPCOF hybrids 2.1.4 Synthesis of PIL-COF-100 hybrids 2.2 Catalytic performance evaluation and recyclable experiment 3 Results and discussion 3.1 Characterization of PIL-HPCOF hybrids 3.2 Catalytic evaluation of PIL-HPCOF composites 4 Conclusions CRediT authorship contribution statement Acknowledgement Appendix Supplementary materials References LIU 2017 7425 7429 X RINTJEMA 2016 3972 3976 J ZHOU 2020 1906048 1906058 W ZHOU 2020 2001041 2001051 Y COKOJA 2015 2436 2454 M XU 2015 108 122 B KIATKITTIPONG 2020 548 569 K LOPES 2020 479 492 E GUO 2017 6770 6780 Z ZHONG 2017 4855 4863 H YING 2019 2352 2361 T JIA 2020 124652 124664 D DAI 2010 74 80 W YUE 2014 1313 1321 C ZHANG 2012 3951 3957 Y ZHANG 2014 4767 4774 W HE 2020 5192 5199 H SHI 2013 3726 3732 T ANTHOFER 2015 94 98 M ZHI 2018 374 382 Y LUO 2020 3945 3966 R BUYUKCAKIR 2017 7209 7216 O DING 2018 3194 3201 M LIU 2018 2036 2040 T CAO 2019 6031 6041 J DING 2019 4689 4698 L CUI 2020 180 187 C WANG 2015 6916 6924 X ZHANG 2020 341 350 W ZHOU 2020 4481 4489 W SUN 2016 15790 15796 Q ZHOU 2019 9387 9398 Y ZHONG 2020 6323 6329 H QIAN 2017 1124 1159 W BISWAS 2019 935 941 T ZHOU 2019 39 46 X SEGURA 2019 3903 3945 J WANG 2020 4135 4165 H ZHI 2020 2001070 2001090 Y DU 2021 2411 2419 Y PEREZRAMIREZ 2008 2530 2542 J ZHAO 2019 6623 6630 X SHEN 2018 206 210 K CHANDRA 2013 17853 17861 S MA 2016 5897 5903 H DAI 2020 295 305 W YAN 2020 17396 17403 Q YANG 2021 1026 1033 C YE 2020 3636 3645 Y LIU 2022 131633 131643 C DUX2022X112164 DUX2022X112164XY 2024-02-05T00:00:00.000Z 2024-02-05T00:00:00.000Z http://creativecommons.org/licenses/by-nc-nd/4.0/ © 2022 Elsevier B.V. All rights reserved. 0 https://doi.org/10.15223/policy-017 https://doi.org/10.15223/policy-037 https://doi.org/10.15223/policy-012 https://doi.org/10.15223/policy-029 https://doi.org/10.15223/policy-004 item S2468-8231(22)00052-9 S2468823122000529 1-s2.0-S2468823122000529 10.1016/j.mcat.2022.112164 315758 2022-07-08T04:53:21.639223Z 2022-03-01 2022-03-31 1-s2.0-S2468823122000529-main.pdf https://s3-eu-west-1.amazonaws.com/prod-ucs-content-store-eu-west/content/pii:S2468823122000529/MAIN/application/pdf/e41747a2447bead456673f7de14d517e/main.pdf main.pdf pdf true 6021433 MAIN 10 1-s2.0-S2468823122000529-main_1.png https://s3-eu-west-1.amazonaws.com/prod-ucs-content-store-eu-west/content/pii:S2468823122000529/PREVIEW/image/png/9eba4582ce88711a70d3f961686f45dc/main_1.png main_1.png png 55598 849 656 IMAGE-WEB-PDF 1 1-s2.0-S2468823122000529-ga1.jpg https://s3-eu-west-1.amazonaws.com/prod-ucs-content-store-eu-west/content/pii:S2468823122000529/ga1/DOWNSAMPLED/image/jpeg/5d7d7edde99d99750e2ef943d4d4205e/ga1.jpg ga1 true ga1.jpg jpg 15673 110 301 IMAGE-DOWNSAMPLED 1-s2.0-S2468823122000529-gr6.jpg https://s3-eu-west-1.amazonaws.com/prod-ucs-content-store-eu-west/content/pii:S2468823122000529/gr6/DOWNSAMPLED/image/jpeg/fecd390dd0afe9610718bc398ba894bb/gr6.jpg gr6 gr6.jpg jpg 45553 209 489 IMAGE-DOWNSAMPLED 1-s2.0-S2468823122000529-gr7.jpg https://s3-eu-west-1.amazonaws.com/prod-ucs-content-store-eu-west/content/pii:S2468823122000529/gr7/DOWNSAMPLED/image/jpeg/68ab7af2a30c0439959940ffc422044c/gr7.jpg gr7 gr7.jpg jpg 83179 439 626 IMAGE-DOWNSAMPLED 1-s2.0-S2468823122000529-gr8.jpg https://s3-eu-west-1.amazonaws.com/prod-ucs-content-store-eu-west/content/pii:S2468823122000529/gr8/DOWNSAMPLED/image/jpeg/f54b1c75ced3262946e954e4fccff5e0/gr8.jpg gr8 gr8.jpg jpg 73130 408 565 IMAGE-DOWNSAMPLED 1-s2.0-S2468823122000529-gr9.jpg https://s3-eu-west-1.amazonaws.com/prod-ucs-content-store-eu-west/content/pii:S2468823122000529/gr9/DOWNSAMPLED/image/jpeg/83461260057306c60b80e9c55cfe7607/gr9.jpg gr9 gr9.jpg jpg 30048 280 339 IMAGE-DOWNSAMPLED 1-s2.0-S2468823122000529-gr10.jpg https://s3-eu-west-1.amazonaws.com/prod-ucs-content-store-eu-west/content/pii:S2468823122000529/gr10/DOWNSAMPLED/image/jpeg/a12192f88475a95d941d4cd178998d81/gr10.jpg gr10 gr10.jpg jpg 22728 230 301 IMAGE-DOWNSAMPLED 1-s2.0-S2468823122000529-gr2.jpg https://s3-eu-west-1.amazonaws.com/prod-ucs-content-store-eu-west/content/pii:S2468823122000529/gr2/DOWNSAMPLED/image/jpeg/06106f15b29109c17d027781290bcd0d/gr2.jpg gr2 gr2.jpg jpg 80911 363 565 IMAGE-DOWNSAMPLED 1-s2.0-S2468823122000529-gr3.jpg https://s3-eu-west-1.amazonaws.com/prod-ucs-content-store-eu-west/content/pii:S2468823122000529/gr3/DOWNSAMPLED/image/jpeg/d4c76e43b0f86988bb169db6b25ff22d/gr3.jpg gr3 gr3.jpg jpg 26297 225 263 IMAGE-DOWNSAMPLED 1-s2.0-S2468823122000529-gr4.jpg https://s3-eu-west-1.amazonaws.com/prod-ucs-content-store-eu-west/content/pii:S2468823122000529/gr4/DOWNSAMPLED/image/jpeg/bdcb60c9811a1715d1fe084622ffc15d/gr4.jpg gr4 gr4.jpg jpg 40028 245 301 IMAGE-DOWNSAMPLED 1-s2.0-S2468823122000529-gr5.jpg https://s3-eu-west-1.amazonaws.com/prod-ucs-content-store-eu-west/content/pii:S2468823122000529/gr5/DOWNSAMPLED/image/jpeg/75c11c8ead066ab56f283cff313d6f4b/gr5.jpg gr5 gr5.jpg jpg 30366 231 376 IMAGE-DOWNSAMPLED 1-s2.0-S2468823122000529-gr1.jpg https://s3-eu-west-1.amazonaws.com/prod-ucs-content-store-eu-west/content/pii:S2468823122000529/gr1/DOWNSAMPLED/image/jpeg/b75e12e7df379b7638a66768ee25b7c0/gr1.jpg gr1 gr1.jpg jpg 119152 443 565 IMAGE-DOWNSAMPLED 1-s2.0-S2468823122000529-fx1.jpg https://s3-eu-west-1.amazonaws.com/prod-ucs-content-store-eu-west/content/pii:S2468823122000529/fx1/DOWNSAMPLED/image/jpeg/8e144d083d6fba591d7653576770d39b/fx1.jpg fx1 fx1.jpg jpg 3814 65 268 IMAGE-DOWNSAMPLED 1-s2.0-S2468823122000529-sc1.jpg https://s3-eu-west-1.amazonaws.com/prod-ucs-content-store-eu-west/content/pii:S2468823122000529/sc1/DOWNSAMPLED/image/jpeg/df5c2b349a8671840c6ba46daf1f3d8f/sc1.jpg sc1 sc1.jpg jpg 44679 282 565 IMAGE-DOWNSAMPLED 1-s2.0-S2468823122000529-ga1.sml https://s3-eu-west-1.amazonaws.com/prod-ucs-content-store-eu-west/content/pii:S2468823122000529/ga1/THUMBNAIL/image/gif/558466160e5460a995895b042d2c427b/ga1.sml ga1 true ga1.sml sml 9206 80 219 IMAGE-THUMBNAIL 1-s2.0-S2468823122000529-gr6.sml https://s3-eu-west-1.amazonaws.com/prod-ucs-content-store-eu-west/content/pii:S2468823122000529/gr6/THUMBNAIL/image/gif/232e164ba3a87d855538ac7166f91d56/gr6.sml gr6 gr6.sml sml 10674 93 219 IMAGE-THUMBNAIL 1-s2.0-S2468823122000529-gr7.sml https://s3-eu-west-1.amazonaws.com/prod-ucs-content-store-eu-west/content/pii:S2468823122000529/gr7/THUMBNAIL/image/gif/38cdefe0ca4cd46c7123e3315421b56e/gr7.sml gr7 gr7.sml sml 11747 154 219 IMAGE-THUMBNAIL 1-s2.0-S2468823122000529-gr8.sml https://s3-eu-west-1.amazonaws.com/prod-ucs-content-store-eu-west/content/pii:S2468823122000529/gr8/THUMBNAIL/image/gif/e0266784ea635890d5f791e052422f9c/gr8.sml gr8 gr8.sml sml 14090 158 219 IMAGE-THUMBNAIL 1-s2.0-S2468823122000529-gr9.sml https://s3-eu-west-1.amazonaws.com/prod-ucs-content-store-eu-west/content/pii:S2468823122000529/gr9/THUMBNAIL/image/gif/376717738be0b2d5fa345fde248d28b2/gr9.sml gr9 gr9.sml sml 8073 164 198 IMAGE-THUMBNAIL 1-s2.0-S2468823122000529-gr10.sml https://s3-eu-west-1.amazonaws.com/prod-ucs-content-store-eu-west/content/pii:S2468823122000529/gr10/THUMBNAIL/image/gif/896629749d79bac22eca9ae7bfa0a37c/gr10.sml gr10 gr10.sml sml 12167 164 215 IMAGE-THUMBNAIL 1-s2.0-S2468823122000529-gr2.sml https://s3-eu-west-1.amazonaws.com/prod-ucs-content-store-eu-west/content/pii:S2468823122000529/gr2/THUMBNAIL/image/gif/f73ca7eb8ed1d89e5e51f264574279c7/gr2.sml gr2 gr2.sml sml 26230 141 219 IMAGE-THUMBNAIL 1-s2.0-S2468823122000529-gr3.sml https://s3-eu-west-1.amazonaws.com/prod-ucs-content-store-eu-west/content/pii:S2468823122000529/gr3/THUMBNAIL/image/gif/270ff5518771b3719a234dd71a6b3697/gr3.sml gr3 gr3.sml sml 10620 164 191 IMAGE-THUMBNAIL 1-s2.0-S2468823122000529-gr4.sml https://s3-eu-west-1.amazonaws.com/prod-ucs-content-store-eu-west/content/pii:S2468823122000529/gr4/THUMBNAIL/image/gif/52b7042150db82bcd3786efb8ad725e1/gr4.sml gr4 gr4.sml sml 12795 163 201 IMAGE-THUMBNAIL 1-s2.0-S2468823122000529-gr5.sml https://s3-eu-west-1.amazonaws.com/prod-ucs-content-store-eu-west/content/pii:S2468823122000529/gr5/THUMBNAIL/image/gif/175a2ece0bc80c72e13e5e51999cca39/gr5.sml gr5 gr5.sml sml 10214 135 219 IMAGE-THUMBNAIL 1-s2.0-S2468823122000529-gr1.sml https://s3-eu-west-1.amazonaws.com/prod-ucs-content-store-eu-west/content/pii:S2468823122000529/gr1/THUMBNAIL/image/gif/7eddcd38ff4715ccb43bc71680cb28ef/gr1.sml gr1 gr1.sml sml 32304 164 209 IMAGE-THUMBNAIL 1-s2.0-S2468823122000529-fx1.sml https://s3-eu-west-1.amazonaws.com/prod-ucs-content-store-eu-west/content/pii:S2468823122000529/fx1/THUMBNAIL/image/gif/c2cf09d358ac1243344953d9c1d126a5/fx1.sml fx1 fx1.sml sml 2351 53 219 IMAGE-THUMBNAIL 1-s2.0-S2468823122000529-sc1.sml https://s3-eu-west-1.amazonaws.com/prod-ucs-content-store-eu-west/content/pii:S2468823122000529/sc1/THUMBNAIL/image/gif/e3ea704b4dd4cb5954fb38bb8f2ba309/sc1.sml sc1 sc1.sml sml 10337 109 219 IMAGE-THUMBNAIL 1-s2.0-S2468823122000529-ga1_lrg.jpg https://s3-eu-west-1.amazonaws.com/prod-ucs-content-store-eu-west/content/pii:S2468823122000529/ga1/HIGHRES/image/jpeg/ee1c61da51f6a6d0a49697b22ecf35f4/ga1_lrg.jpg ga1 true ga1_lrg.jpg jpg 115116 489 1333 IMAGE-HIGH-RES 1-s2.0-S2468823122000529-gr6_lrg.jpg https://s3-eu-west-1.amazonaws.com/prod-ucs-content-store-eu-west/content/pii:S2468823122000529/gr6/HIGHRES/image/jpeg/6e0542d61973fe98a93693e5cc75aeee/gr6_lrg.jpg gr6 gr6_lrg.jpg jpg 351494 924 2167 IMAGE-HIGH-RES 1-s2.0-S2468823122000529-gr7_lrg.jpg https://s3-eu-west-1.amazonaws.com/prod-ucs-content-store-eu-west/content/pii:S2468823122000529/gr7/HIGHRES/image/jpeg/1d523ab229e0aca58c3399aadb800c55/gr7_lrg.jpg gr7 gr7_lrg.jpg jpg 648777 1942 2770 IMAGE-HIGH-RES 1-s2.0-S2468823122000529-gr8_lrg.jpg https://s3-eu-west-1.amazonaws.com/prod-ucs-content-store-eu-west/content/pii:S2468823122000529/gr8/HIGHRES/image/jpeg/261cb39de4bb57f41175a6e54195127a/gr8_lrg.jpg gr8 gr8_lrg.jpg jpg 557742 1804 2500 IMAGE-HIGH-RES 1-s2.0-S2468823122000529-gr9_lrg.jpg https://s3-eu-west-1.amazonaws.com/prod-ucs-content-store-eu-west/content/pii:S2468823122000529/gr9/HIGHRES/image/jpeg/0a9f9b9bdd703a58c0b8312b233ee75b/gr9_lrg.jpg gr9 gr9_lrg.jpg jpg 216509 1239 1500 IMAGE-HIGH-RES 1-s2.0-S2468823122000529-gr10_lrg.jpg https://s3-eu-west-1.amazonaws.com/prod-ucs-content-store-eu-west/content/pii:S2468823122000529/gr10/HIGHRES/image/jpeg/7e444977e092c33be8ac800dc8e7a7df/gr10_lrg.jpg gr10 gr10_lrg.jpg jpg 157951 1017 1333 IMAGE-HIGH-RES 1-s2.0-S2468823122000529-gr2_lrg.jpg https://s3-eu-west-1.amazonaws.com/prod-ucs-content-store-eu-west/content/pii:S2468823122000529/gr2/HIGHRES/image/jpeg/5e6576994d75897692d33094a195d64c/gr2_lrg.jpg gr2 gr2_lrg.jpg jpg 754766 1604 2500 IMAGE-HIGH-RES 1-s2.0-S2468823122000529-gr3_lrg.jpg https://s3-eu-west-1.amazonaws.com/prod-ucs-content-store-eu-west/content/pii:S2468823122000529/gr3/HIGHRES/image/jpeg/109ad9fa746dabe9790ab576b69ee401/gr3_lrg.jpg gr3 gr3_lrg.jpg jpg 188092 999 1167 IMAGE-HIGH-RES 1-s2.0-S2468823122000529-gr4_lrg.jpg https://s3-eu-west-1.amazonaws.com/prod-ucs-content-store-eu-west/content/pii:S2468823122000529/gr4/HIGHRES/image/jpeg/301de3da909b568c8f1fe70a45f5c8f3/gr4_lrg.jpg gr4 gr4_lrg.jpg jpg 311549 1084 1333 IMAGE-HIGH-RES 1-s2.0-S2468823122000529-gr5_lrg.jpg https://s3-eu-west-1.amazonaws.com/prod-ucs-content-store-eu-west/content/pii:S2468823122000529/gr5/HIGHRES/image/jpeg/929d491a67c03df1e3ce5395af26d97a/gr5_lrg.jpg gr5 gr5_lrg.jpg jpg 215186 1026 1667 IMAGE-HIGH-RES 1-s2.0-S2468823122000529-gr1_lrg.jpg https://s3-eu-west-1.amazonaws.com/prod-ucs-content-store-eu-west/content/pii:S2468823122000529/gr1/HIGHRES/image/jpeg/6f2016be8e0fbcd42a01299f00acb4b4/gr1_lrg.jpg gr1 gr1_lrg.jpg jpg 1131502 1959 2500 IMAGE-HIGH-RES 1-s2.0-S2468823122000529-fx1_lrg.jpg https://s3-eu-west-1.amazonaws.com/prod-ucs-content-store-eu-west/content/pii:S2468823122000529/fx1/HIGHRES/image/jpeg/4f8ef69fbf4762d1308808807648b3f1/fx1_lrg.jpg fx1 fx1_lrg.jpg jpg 26564 289 1188 IMAGE-HIGH-RES 1-s2.0-S2468823122000529-sc1_lrg.jpg https://s3-eu-west-1.amazonaws.com/prod-ucs-content-store-eu-west/content/pii:S2468823122000529/sc1/HIGHRES/image/jpeg/84186778983cb5b62435b5bfce63a6f7/sc1_lrg.jpg sc1 sc1_lrg.jpg jpg 373041 1246 2500 IMAGE-HIGH-RES 1-s2.0-S2468823122000529-mmc1.docx https://s3-eu-west-1.amazonaws.com/prod-ucs-content-store-eu-west/content/pii:S2468823122000529/mmc1/MAIN/application/vnd.openxmlformats-officedocument.wordprocessingml.document/debd1831b33d98904eab27315d5f1b65/mmc1.docx mmc1 mmc1.docx docx 1294369 APPLICATION 1-s2.0-S2468823122000529-am.pdf am am.pdf pdf 1423752 AAM-PDF https://s3-eu-west-1.amazonaws.com/prod-ucs-content-store-eu-west/content/egi:1067H9TMT1S/MAIN/application/pdf/0e318f32c9b30debd491603732e682de/am.pdf MCAT 112164 112164 S2468-8231(22)00052-9 10.1016/j.mcat.2022.112164 Elsevier B.V. Scheme 1 The synthetic diagram of hierarchical porous PIL-HPCOF hybrids. Scheme 1 Fig. 1 The SEM images of pristine TpBD, PS and HP-TpBD. Fig 1 Fig. 2 The SEM images, TEM images of HP-TpBD-320/160–10, PIL-HPCOF-320/160–10–100 and corresponding element mapping of PIL-HPCOF-320–10–100. Fig 2 Fig. 3 PXRD studies of representative samples. Fig 3 Fig. 4 N2 sorption isotherms of representative samples. Fig 4 Fig. 5 The 13C solid-state NMR spectra of HP-TpBD-320–10 and PIL-HPCOF-320–10–100. Fig 5 Fig. 6 (a) N1s XPS spectrum of PIL, HP-TpBD-320–10 and PIL-HPCOF-320–10–100 and (b) Br 3d XPS spectrum of PIL and PIL-HPCOF-320–10–100. Fig 6 Fig. 7 CO2 adsorption isotherms of PIL, HP-TpBD-320–10 and PIL-HPCOF-320–10–100 at (a) 273 K and (b) 298 K. (c) N2 adsorption isotherms of PIL, HP-TpBD-320–10 and PIL-HPCOF-320–10–100 at 273 K. (d) Cyclic CO2 adsorption of PIL-HPCOF-320–10–100. Fig 7 Fig. 8 Influences of (a) catalyst dosage, (b) reaction temperature, (c) CO2 pressure, and (d) reaction time on the performance of PIL-HPCOF-320–10–100. Fig 8 Fig. 9 Coupling reactions of CO2 with different epoxides: epoxides (5 mmol), 90 °C, CO2 (1 MPa), PIL-HPCOF-320–10–100 (15 mg). Fig 9 Fig. 10 Recycle experiments of the PIL-HPCOF-320–10–100. Reaction conditions: propylene oxide (5 mmol), PIL-HPCOF-320–10–100 (15 mg), 90 °C, 24 h, CO2 (1.0 MPa). Fig 10 Table 1 Porosity of the representative samples. Table 1 Entry Sample SBET⁠ (m2⁠/g) V (cm3⁠/g) D⁠p (nm) 1 TpBD 572 0.37 2.0 2 HP-TpBD-320–10 535 0.78 2.0 3 PIL-COF-100 222 0.16 1.4 4 PIL-HPCOF-320–10–100 174 0.39 1.3 5 PIL 1 0.01 – Table 2 Catalytic evaluation of the coupling reactions between propylene oxide and CO2 a . Table 2 Image, table 2 Entry Catalyst Yield/% b 1 PIL-HPCOF-320–10–100 99 2 PIL-COF-100 c 84 3 PIL d 69 4 PIL-HPCOF-320–10–50 80 5 PIL-HPCOF-160–10–100 e 91 6 PIL-HPCOF-160–10–50 e 77 7 PIL + HP-TpBD-320–10 f 78 8 HP-TpBD-320–10 25 9 TpBD 18 10 – 13 a Reaction conditions: propylene oxide (5 mmol), CO2 (1.0 MPa), 90 °C, 24 h, catalyst (15 mg, 19.7 umol Br−for PIL-HPCOF-320–10–100 and 12.0 umol Br−for PIL-HPCOF-320–10–50). b Isolated yield. c catalyst 14.6 mg (19.7 umol Br−). d catalyst (5 mg, 19.7 umol Br−). e catalyst (15.6 mg, 19.7 umol Br− for PIL-HPCOF-160-10-100 and 11.9 umol Br− for PIL-HPCOF-160-10-50);. f a physical mixture of PIL (5 mg) and HP-TpBD-320–10 (10 mg) (19.7 umol Br−). Table 3 Comparison of previously reported heterogeneous catalysts towards cycloaddition reaction of CO2 with epoxides. Table 3 Entry Catalyst Epoxide T/°C P/MPa t/h Yield/% TOF/h−1 Ref. 1 Co2+@TFPPy–PyTTA–COF PO 100 3.0 48 99 10.3 [47] 2 COF-JLU7/TBAB ECH 80 0.1 12 96 4.0 [20] 3 DB10%-Pa-Tp ECH 120 0.1 48 99 9.4 [25] 4 COF-IL ECH 80 0.1 48 98 0.7 [26] 5 PDVB-AEIMBr PO 140 2.0 4 83 47.3 [13] 6 PBIL-3 PO 100 2.0 4 99 17.2 [48] 7 B-SBA-15-NH2/KI PO 120 2.0 6 95 18.1 [49] 8 Py-HCP-Br PO 120 2.0 8 97 – [50] 9 PPIL@COFA-40 PO 100 2.0 24 96 39.2 [40] 10 PIL-HPCOF-320–10–100 PO 90 1.0 24 99 10.5 This work 11 PIL-HPCOF-320–10–100 ECH 90 1.0 24 95 10.0 This work PO: propylene oxide; ECH: epichlorohydrin; TBAB: tetrabutylammonium bromide. Immobilization poly(ionic liquid)s into hierarchical porous covalent organic frameworks as heterogeneous catalyst for cycloaddition of CO2 with epoxides Yi-Ran Du Data curation Formal analysis Visualization Writing – original draft a b 1 Xin Yang Data curation Formal analysis Visualization a c 1 Yao-Feng Wang Supervision Formal analysis a b ⁎ Peng-Xin Guan Data curation Formal analysis a b Rui Wang Data curation Formal analysis a d Bao-Hua Xu Conceptualization Methodology Writing – review & editing Supervision Project administration a b ⁎ a Beijing Key Laboratory of Ionic Liquids Clean Processes, Institute of Process Engineering, Innovation Academy for Green Manufacture, Chinese Academy of Sciences, Beijing 100190, China Beijing Key Laboratory of Ionic Liquids Clean Processes Institute of Process Engineering Innovation Academy for Green Manufacture Chinese Academy of Sciences Beijing 100190 China aBeijing Key Laboratory of Ionic Liquids Clean Processes, Institute of Process Engineering, Innovation Academy for Green Manufacture, Chinese Academy of Sciences, Beijing 100190, China b School of Chemistry and Chemical Engineering, University of Chinese Academy of Sciences, Beijing 100049, China School of Chemistry and Chemical Engineering University of Chinese Academy of Sciences Beijing 100049 China bSchool of Chemistry and Chemical Engineering, University of Chinese Academy of Sciences, Beijing 100049, China c School of Chemistry and Environment Engineering, China University of Mining and Technology (Beijing), Beijing 100083, China School of Chemistry and Environment Engineering China University of Mining and Technology (Beijing) Beijing 100083 China cSchool of Chemistry and Environment Engineering, China University of Mining and Technology (Beijing), Beijing 100083, China d State Key Laboratory of Chemical Engineering, East China University of Science and Technology, Shanghai 200237, China State Key Laboratory of Chemical Engineering East China University of Science and Technology Shanghai 200237 China dState Key Laboratory of Chemical Engineering, East China University of Science and Technology, Shanghai 200237, China ⁎ Corresponding authors. 1 These authors contribute this article equally. The chemical fixation of CO2 into high value-added chemicals is of significant potential and sustainability to address the energy and ecological issues. To achieve great catalytic performance on the transformation of CO2, it is pivotal to strategically integrating several multifunctional and synergetic functionalities into the catalyst design and catalytic system construction. Herein, the poly(ionic liquid)-hierarchical porous covalent organic framework (PIL-HPCOF) hybrids were successfully synthesized via the formation of HPCOF through hard-template method, followed by in-situ polymerization of mono-vinyl decorated ionic liquids (ILs). The resultant PIL-HPCOF hybrids possess excellent versatility, with micropores providing high surface area to enhance CO2 uptake capacity and macropores supplying sufficient pore volume to promote mass transport of substrates. As a proof of concept, the conversion of CO2 with epoxides to produce cyclic carbonates was selected as a model reaction, which catalytic performance was obviously promoted by using PIL-HPCOF hybrids as the catalyst as compared to those of independent PIL and the PIL-COF hybrids with only micropores. Thus, it enables such a metal-free catalysis proceeds under much mild conditions (CO2 (1 MPa), 90 °C) and with broad substrates tolerance. These results supply the basis to design efficient and stable catalysts for CO2 conversion. Graphical abstract Image, graphical abstract Keywords Poly(ionic liquid)s Covalent organic frameworks Hierarchical pores CO2 conversion Cycloaddition reaction 1 Introduction Carbon dioxide (CO2), known as a typical greenhouse gas, is also an abundant, nontoxic, and inexpensive C1 feedstock [1,2]. In the past decades, great efforts have been dedicated to convert CO2 into highly value-added fine chemicals in both academic and industrial fields [3,4]. Owing to its naturally thermodynamic stability and kinetic inertness, however, a large amount of energy investment is required to convert CO2 and the development of efficient chemical fixation process for CO2 remains a huge challenge [5,6]. In this domain, the coupling reaction of CO2 with epoxides is identified as excellent strategy for CO2 utilization with 100% atom efficiency, which also represents the greener replacement of traditional phosgene in the synthesis of cyclic carbonates functioning as valuable solvents and intermediates in industry [7,8]. To date, the documented catalytic systems without metal and co-catalyst generally require rigorous reaction conditions because of the thermodynamically stable and chemical inertness of CO2. The strategies to promote the performance in the metal-free catalyzed cycloaddition of CO2 with epoxides could be classified into two general types: (a) Introduce various hydrogen bond donor groups (hydroxy [9–12], amino [13,14] and carboxyl [15–17]) into the ionic catalyst (mainly the cation counterpart), which cooperates with the anion (mainly the halides) in accelerating the rate-limiting step of ring-opening epoxides [18]. The decorated hydrogen bond donors can also stabilize the potential transition states and intermediates during the reaction process [19,20]. Such a method for designing well-defined molecular catalysts has also been widely used in constructing the structural motifs of highly efficient heterogeneous catalysts. (b) Enrich CO2 concentration around the catalytic sites to improve the cycloaddition efficiency since the cycloaddition exhibits a first-order dependence on the concentration of CO2 and epoxides [21]. In this respect, the introduction of ionic moieties and Brønsted base sites, such as amines, imines, imidazoles, and triazines, have been documented to increase the affinity of CO2, thus facilitating its conversion [22–27]. Besides, the reaction efficiency can be adjusted by the specific surface area and porous skeleton of a heterogeneous catalyst, which differs in the CO2 uptake capacity [12,28–30]. It is the consensus that strategically integrating several multifunctional and synergetic components into one system can achieve greater catalytic performance [31–33]. To this end, our laboratory had covalently integrated porous poly(ionic liquid)s (PPIL) [34–36] with covalent organic frameworks (COF) [37–39] to construct PPIL@COF hybrids of a core-shell structure that exhibits bifunctionality of enhancing CO2 uptake capacity and providing hydrogen bond donor groups at the interface to activate epoxides, thus promoting the catalytic performance of cycloaddition CO2 with epoxides [40] (Fig. S1). However, it's still worthy to be further improved. For instance, the mass transport within the catalyst of a mesoporous structure, especially that between the COF shell and PPIL core, is insufficient. Consequently, the accessibility of PPIL moieties functioning the catalytic active sites is highly limited since they were buried as a core inside the COF shell. We, therefore, envisioned the introduction of proper macropores in the PIL-COF hybrids to construct hierarchical porous structure may both promote the mass transfer on the surface and interface of the catalysts, thus delivering a more efficient catalytic system [41,42]. Herein, we contribute hierarchical porous poly(ionic liquid)s-covalent organic framework (PIL-HPCOF) hybrids as the candidates. The HPCOF backbone therein possesses high surface area and hierarchical porosity to enhance CO2 uptake capacity and facilitate mass transport of either substrates or intermediates, while the linear PIL bearing the catalytic sites threaded throughout to trigger the conversion of CO2 with epoxides. The preparation of such PIL-HPCOF hybrids was accessed via the formation of HPCOF through hard-template method [42], followed by in-situ polymerization of mono-vinyl decorated ILs (Scheme 1 ). Specifically, the polystyrene spheres (PSs) were used as templates to enable the preparation of HPCOF bearing interconnected macropores and intrinsic micropores. In the second step, amino-functionalized linear PIL with abundant bromide anions were introduced into the channels of HPCOF through in-situ free radical polymerization of the corresponding IL monomers. The crystallinity, high surface area and hierarchical porous structure of HPCOF was retained in the resultant PIL-HPCOF hybrids. In particular, the hierarchical porosity could be tuned through the size of PSs launched, while the concentration of catalytic sites per mass could be modulated by the ratio of IL monomer to HPCOF. As a proof of concept, the PIL-HPCOF hybrids displayed excellent catalytic performance, broad applicability, and recyclability in cycloaddition of CO2 and epoxides without metal, solvents, or co-catalyst under mild conditions with outstanding yields of selected cyclic carbonate (95∼99%). We attributed the positive effects of such PIL-HPCOF hybrids on the catalytic performance into two aspects. First, the inherent micropores with high surface area and rich nitrogen sites (secondary amine) of COF host improved CO2 concentration around the catalytic sites. Second, the template-induced and interconnected macropores in COF host increased the total pore volume that significantly promoted the mass transfer of substrates and provided more active sites. These results supply the basis to design IL catalysts with high efficiency and stability in the CO2 conversion. 2 Experiment 2.1 Preparation of catalysts 2.1.1 Synthesis of colloidal PS Colloidal PS was prepared according to the literature [43]. Typically, styrene (35 g, 0.34 mol) was purified with aqueous sodium hydroxide (12 mL, 10 wt%) and deionized water (50 mL) before use. Under nitrogen atmosphere, the purified styrene, polyvinylpyrrolidone (1.5 g) and deionized water (300 mL) were added into flask (500 mL) and then reacted at 60 °C for 30 min. Then K2S2O8 (0.5 g) dissolved in deionized water (50 mL) were added into the flask and reacted at 60 °C for 24 h (< 500 r.p.m.). Upon cooling, the PS (320 nm) suspension with a solid content ∼5 wt% were obtained. The colloidal PS was poured into a petri dish at 80 °C to gain the colloidal PS with a solid content ∼10 wt%. Similarly, the colloidal PS with sizes of 160 nm were synthesized by changing the reaction conditions (Table S1). 2.1.2 Synthesis of HP-TpBD HP-TpBD was prepared according to the literature [42]. A mixture of colloidal PS (5 mL, ∼5/10 wt%), p-toluenesulfonic acid (PTSA, 500 mg, 2.5 mmol) and benzidine (BD, 82.9 mg, 0.45 mmol) in a vial was mixed thoroughly in a vortex shaker for 10 min, followed by adding triformylphloroglucinol (Tp, 0.30 mmol, 63.0 mg) to the vial and further shaking for 30 min. The above yellow mixture was transformed into an open petri dish to evaporate the water naturally and reacted at 120 °C for 48 h in an oven. The red precipitate was washed with hot water (6 × 30 mL) to remove PTSA and then further purified via Soxhlet extraction in THF (100 mL) for 12 h. The dark orange product was dried under vacuum at 80 °C overnight to obtain the hierarchical porous TpBD (HP-TpBD-X-Y, X: different sizes of PS spheres; Y: mass fraction of PS spheres). For example, colloidal PS (320 nm) with a solid content of ∼10 wt% were used as template to produce HP-TpBD-320–10. 2.1.3 Synthesis of PIL-HPCOF hybrids To a mixture of HP-TpBD-X-Y (X = 320/160, Y = 5/10) (100 mg) and [AVIM]Br (100/50 mg, 0.46/0.23 mmol) in DMF (2 mL) was added AIBN (10.0 mg) under nitrogen atmosphere. The mixture was stirred at room temperature for 12 h, followed by heating at 90 °C for 72 h. Upon cooling, the solid was collected via filtration, washed thoroughly with DMF (3 × 30 mL), methanol (3 × 30 mL) and acetone (3 × 30 mL), and dried in vacuum oven at 80 °C for 12 h, which was named as PIL-HPCOF-X-Y-Z (Z: the mass of added [AVIM]Br (mg), 100/50). 2.1.4 Synthesis of PIL-COF-100 hybrids Under nitrogen atmosphere, the mixture of pristine TpBD (100 mg), [AVIM]Br (100.0 mg) and AIBN (10.0 mg) in DMF (2 mL) was stirred at room temperature for 12 h, followed by heating at 90 °C for 72 h. The precipitate was collected via filtration, washed with DMF (3 × 30 mL), methanol (3 × 30 mL) and acetone (3 × 30 mL), and dried under vacuum at 80 °C overnight, which was named as PIL-COF-100. 2.2 Catalytic performance evaluation and recyclable experiment Typically, propylene oxide (5.0 mmol) and PIL-HPCOF hybrids (5, 10, 15 or 20 mg) were added in a stainless-steel autoclave reactor (20 mL), which was flushed with CO2 for three times and stirred under appointed CO2 atmosphere (0.1, 1.0 or 1.5 MPa) at the required temperature (70, 80 or 90 °C) for a certain time (12, 16, 20 or 24 h). After cool-down, the CO2 in autoclave was gradually released, and PIL-HPCOF hybrids were recovered via centrifugation, washing with dichloromethane and dried under vacuum at 80 °C for 6 h. The liquid phase was evaporated, collected and analyzed. 3 Results and discussion 3.1 Characterization of PIL-HPCOF hybrids The hierarchical porous PIL-HPCOF hybrids were prepared via two steps of hard template method and in-situ polymerization. Initially, the hierarchical porous TpBD (HP-TpBD) was synthesized by the Schiff condensation of 1,3,5-triformylphloroglucinol (Tp) and benzidine (BD) in the presence of p-toluenesulfonic acid (PTSA) and polystyrene spheres (PSs), wherein PS functions as a hard template and PTSA reacts as a catalyst for the formation of COF skeleton. Next, the HP-TpBD was dispersed in DMF solution containing [AVIM]Br, followed by free-radical polymerization using azobisisobutyronitrile (AIBN) to produce PIL-HPCOF hybrids. The as-synthesized PIL-HPCOF hybrids were denoted as PIL-HPCOF-X-Y-Z, wherein X denotes the average diameter of PSs (160/320 nm), Y denotes the mass fraction of PSs (5/10), and Z denotes the mass of ILs monomer (50/100 mg) added in the second step. Besides, the pristine TpBD and microporous PIL-COF-Z (Z = 100) were synthesized for comparison. Firstly, the morphology of pristine TpBD, PS and HP-TpBD were studied by scanning electron microscopy (SEM) (Fig. 1 ). The pristine TpBD displays random bulk particles with no obvious characteristic morphology (Fig. 1a). The synthetic PSs beads exhibits uniform size at average diameter of ∼160 nm and 320 nm (Fig. 1b and 1c), respectively, suggesting the successful synthesis of PSs template. Using PS beads as the templating agent with a size of 320 nm and a content of 10 wt%, the as-synthesized HP-TpBD-320–10 shows a uniform interconnected macroporous structure after removing PS by Soxhlet extraction with THF (Fig. 1d and 1e). In contrast, the HP-TpBD-320–5 exhibits an inhomogeneous microporous structure with large bulk particle imposed by the less PSs used (Fig. 1f). Similarly, the HP-TpBD-160–10 contains a uniform interconnected macroporous structure by changing the PS templates of different average diameter (Fig. 1g and 1h), which however disappears in the case of small dosage of the same PSs (HP-TpBD-160–5, Fig. 1i). This result indicates a proper amount PSs is crucial to deliver the desired uniform macroporous structure to TpBD skeleton. The SEM analysis on PIL-HPCOF-320/160–10 was next performed (Fig. 2 a and 2b) and compared with the parent HP-TPBD-320/160–10 (Fig. 1d and 1g). Evidently, the morphologic changes are indistinguishable by introducing the guest PIL, preliminarily indicating the polymerization of IL monomer ([AVIM]Br) occurs mostly within the microporous channels of HP-TPBD rather than outside the surface or at the macroporous sites. The transmission electron microscopy (TEM) measurements on PIL-HPCOF-320/160–10 further illustrates the interconnected porous structures (Fig. 2c and 2d), which is supposed beneficial to the mass diffusion of substrates for a heterogeneous catalysis. Moreover, the elemental mapping characterization via TEM corresponds the homogeneously distributed bromine element (Fig. 2e), indicating that PIL were uniformly distributed in the HP-TpBD. The crystallinity of these materials was also investigated by powder X-ray diffraction (PXRD) measurements. To investigate the effects of hierarchical porosity and PIL laying within the channel on the crystallinity, porosity, composition of PIL-HPCOF hybrids, the pristine TpBD, HP-TpBD-320–10, PIL-COF-100, PIL-HPCOF-320–10–100 and individual PIL were taken as the representative samples and were discussed thoroughly. As shown in Fig. 3 , both pristine TpBD and HP-TpBD-320–10 exhibits intensive peaks at 3.6° assigned to the (100) facet, indicating the introduction of macroporous structure via the PS template strategy does not destroy the crystallinity of TpBD. Besides, the PXRD pattern of PIL-HPCOF-320–10–100 matches with that of the parent HP-TpBD-320–10, while the intensity of the (100) peak relatively decreases for the PIL-HPCOF hybrids. It demonstrates the crystalline structure of HP-TpBD preserves in the PIL-HPCOF hybrids after introducing the linear PIL. However, the presence of flexible carbon chains of PIL in the pores of HP-TpBD slightly distorts the long-range order of crystalline material. Likewise, PIL-COF-100 without macroporous structure also displays weak intensity at (100) peak. In contrast, the individual PIL shows an amorphous feature. N2 sorption analysis at 77 K was conducted to inspect the porosity of representative samples (Fig. 4 and Table 1 ). As expected, the isotherm of pristine TpBD displays type I isotherm representing rapid N2 uptake at P/P0 < 0.1, indicating its microporosity. As for HP-TpBD-320–10, it shows type I isotherm at the lower-pressure range, while the adsorption of N2 is obviously increased at the higher-pressure range. It's attributed to that the presence of additional macropores through PS-template methods. Correspondingly, the pore volume at P/P0 = 0.99 of HP-TpBD-320–10 (0.78 cm3/g) increases significantly as compared to that of pristine TpBD (0.37 cm3/g). However, the Brunauer-Emmett-Teller (BET) surface area in the case of HP-TpBD-320–10 (535 m2/g) is almost the same as that of pristine TpBD (572 m2/g). These results suggest the porosity of pristine TpBD in HP-TpBD is preserved. Next, the decreased values in BET surface area, pore size and total volume for PIL-HPCOF-320–10–100 (174 m2/g, 1.3 nm, and 0.39 cm3/g) confirms that the channel of HP-TpBD-320–10 (535 m2/g, 2.0 nm, and 0.78 cm3/g) is partially occupied by PIL (Fig. S2). Still, PIL-HPCOF-320–10–100 displays an obvious hierarchical porosity as that of HP-TpBD-320–10. In comparison, PIL-COF-100 behaves comparable values of BET surface area, pore size and pore volume (222 m2/g, 1.4 nm, and 0.16 cm3/g). But it consists of no macroporous structure. Besides, the amorphous linear PIL displays the lowest uptake of N2 and possesses poor BET surface area and pore volume of only 1 m2/g and 0.01 cm3/g, respectively. The structure of PIL-HPCOF hybrids were further investigated by solid state 13C NMR spectroscopy (Fig. 5 ). HP-TpBD-320–10 features two typical 13C resonances assigned to the CO and CN of the keto form at about 184 and 147 ppm, respectively [44, 45]. Besides these peaks, PIL-HPCOF-320–10–100 still contains high-field peaks at 54, 49 and 40 ppm originated from the alkyl-C species of PIL, indicating the successful integration of PIL with HP-TpBD. The X-ray photoelectron spectroscopy (XPS) measurement was thereafter conducted for PIL, HP-TpBD-320–10 and PIL-HPCOF-320–10–100 (Fig. 6 ). The N 1 s spectra of PIL features two peaks located at 401.5 eV and 399.2 eV originated from the nitrogen atoms of imidazolium and amino, respectively (Fig. 6a) [32]. As expected, that of HP-TpBD-320–10 shows one peak centered at 399.6 eV assigned to the secondary N. In comparison, the N1s spectrum of PIL-HPCOF-320–10–100 can be resolved into three components attributed to the N atoms of imidazolium at 401.5 eV, amino groups at 399.2 eV originated from PIL, and secondary N at 399.6 eV from HP-TpBD-320–10, respectively. Besides, the Br 3d XPS spectra of PIL-HPCOF-320–10–100 was compared with that of PIL (Fig. 6b). Both feature the characteristic band at 68.8 eV (Br 3d5/2) and 67.8 eV (Br 3d3/2), confirming the presence of bromide anion in PIL-HPCOF hybrids [46]. The content of catalytic sites (bromide anions) in PIL-HPCOF hybrids was also investigated by elemental analysis (Table S2). Moreover, the value of an individual PIL and COF was also examined for comparison. The mass fraction of bromine in PIL is up to 31.45 wt%, while no bromine was detected in HP-TpBD. For the PIL-HPCOF hybrids, the bromine content depends on the dosage of [AVIM]Br for polymerization, also corresponding to the mass fraction of PIL loaded. Specifically, the bromine content of PIL-HPCOF-X-10–100 (X = 320, 10.47 wt%; X = 160, 10.09 wt%) outweighs that of PIL-HPCOF-X-10–50 (X = 320, 6.36 wt%; X = 160, 6.11 wt%). As a result, the calculated loadings of IL unit therein for PIL-HPCOF-320–10–100, PIL-HPCOF-320–10–50, PIL-HPCOF-160–10–100 and PIL-HPCOF-160–10–50 were 1.31 mmol/g, 0.80 mmol/g, 1.26 mmol/g and 0.76 mmol/g, respectively. We also found the absence of macroporous structure does not affect the content of bromine per unit. For example, PIL-COF-100 contains bromine with 1.35 mmol/g, which is equivalent to that of PIL-HPCOF-320–10–100. The thermal stability of PIL-HPCOF composite was examined using thermogravimetric analysis (TGA) under nitrogen environment (Fig. S3). Both PIL and HP-TpBD-320–10 show a single weight-loss stage at 260∼350 °C and 345∼460 °C, which attributed to the decomposition of ionic moieties in PIL and TpBD backbone, respectively. By contrast, two apparent weight loss stages were found in the TGA curves of PIL-HPCOF-320–10–100. The first weight loss in the range of 255∼340 °C is attributed to loss of ionic moieties, while the second weight loss within the scope of 340∼470 °C is imposed by the disintegration of skeleton. The gas adsorption properties of PIL, HP-TpBD-320–10 and PIL-HPCOF-320–10–100 in terms of CO2 and N2 were examined at the relative pressures of up to 1.0 bar at 273 K and 298 K (Fig. 7 ). As illustrated in Fig. 7a, HP-TpBD-320–10 exhibits the highest CO2 adsorption performance with 1.75 mmol/g at 273 K and 1.0 bar, while PIL-HPCOF-320–10–100 performs poorly with 0.73 mmol/g. The relatively decreased CO2 adsorption capacity for the latter is mainly attributed to both partial pore filling and mass increment upon the introduction of PIL. Moreover, the individual PIL shows the lowest CO2 uptake amount of 0.14 mmol/g at 273 K under 1.0 bar due to its low BET surface area and poor porosity. For all samples, the CO2 uptake amount was obviously reduced at 298 K and 1.0 bar (Fig. 7b). Besides, they display lower uptake capacity toward N2 as compared to that of CO2 under identical conditions. Specifically, the N2 uptake values for PIL, HP-TpBD-320–10 and PIL-HPCOF-320–10–100 at 273 K under 1 bar (Fig. 7c) are recoded as 0.02, 0.04 and 0.10 mmol/g, respectively. To our delight, PIL-HPCOF-320–10–100 behaves excellent CO2 absorption cycle-ability (Fig. 7d). Collectively, compared with the individual PIL, PIL-HPCOF hybrids exhibits superior uptake and selectivity toward CO2. It's not only because of the good crystallinity, proper surface area, and the presence of microporosity in space but also the high density of Lewis basic N sites therein to enhance the interaction with acidic CO2 on a molecular level. 3.2 Catalytic evaluation of PIL-HPCOF composites The catalytic evaluation of hierarchical porous PIL-HPCOF composites were subsequently investigated for the cycloaddition reaction between epoxides and CO2 without any solvents, co-catalysts, and additives. Herein, the coupling of propylene oxide (5 mmol) with CO2 catalyzed by PIL-HPCOF-320–10–100 was taken as the benchmark reaction. The reaction conditions including catalyst dosage (5∼20 mg), reaction temperature (70∼90 °C), CO2 pressure (0.1∼1.5 MPa) and reaction time (12∼24 h) were preliminary examined to obtain the optimum performance in the formation of propylene carbonate. The catalyst dosage (5∼20 mg) on the performance of PIL-HPCOF-320–10–100 was first examined under 1.5 MPa CO2 at 90 °C for 24 h. As shown in Fig. 8 a, the yield of propylene carbonate increased from 65% to 99% as the amount of catalyst increased from 5 mg to 15 mg, followed by reaching to equilibrium though increasing the amount of catalyst. An excellent result was obtained when 15 mg PIL-HPCOF-320–10–100 was used, providing propylene carbonate with 99% yield after 24 h under 1.5 MPa CO2 pressure. Next, the varying temperature in the range of 70∼90 °C was tested under 1.5 MPa CO2 for 24 h with 15 mg catalyst loading. The yield of propylene carbonate was significantly enhanced from 58% to 99% with reaction temperature from 70 °C to 90 °C (Fig. 8b). Furthermore, the effects of the CO2 pressure on the cycloaddition reaction performance were also studied at 90 °C for 24 h with 15 mg catalyst and the results were shown in Fig. 8c. The yield of product had reached a better value (90%) under 0.1 MPa CO2 pressure in the model reaction. It was found that catalytic performance improved with raising CO2 pressure from 0.1 MPa to 1.0 MPa. It provided propylene carbonate with a yield above 99% under 1.0 MPa. Subsequently, the reaction time with 12∼24 h was investigated at 90 °C under 1.0 MPa (Fig. 8d). With the extension of the reaction time (12∼24 h), the yield (75%∼99%) of propylene carbonate increased gradually. As a result, propylene carbonate was obtained with an excellent yield of 99% from propylene oxide (5 mmol) and CO2 (1.0 MPa) in the presence of PIL-HPCOF-320–10–100 (15 mg) at 90 °C for 24 h. Next, cross experiments on investigating the performance of various PIL-COF hybrids with different catalytic sites content and porosity were conducted under the optimized reaction conditions (Table 2 ). Meanwhile, the catalytic performance of individual PIL and TpBD were also evaluated for comparation. For PIL-HPCOF hybrids, PIL-HPCOF-320–10–100 exhibits the best catalytic performance, delivering propylene carbonate with 99% yield (entry 1). In comparison, the performance of PIL-COF-100, which contains the same bromide content as that of PIL-HPCOF-320–10–100, decreases slightly (entry 2). It suggests the presence of homogeneously dispersed but interconnected macropores in the catalyst structure positively influences the catalytic efficiency probably by enhancing the mass transfer and the accessibility of catalytic sites to reactants during the reaction. Likewise, PIL-HPCOF-320–10–100 remarkably outperforms the amorphous PIL with the same bromide content (entry 1 vs. 3). The catalytic performance of PIL-COF-100 was significantly improved compared to pure PIL (entry 2 vs. 3), which was mainly attributed to high BET surface area (222 m2/g vs. 1 m2/g), pore volume (0.16 cm3/g vs. 0.01 cm3/g) and CO2 uptake (0.80 mmol/g (Fig. S4) vs. 0.14 mmol/g at 273 K under 1.0 bar). It further demonstrates that the performance of PIL-HPCOF hybrids depends on a combination of the porosity, CO2 uptake and the content of active sites therein. For instance, both PIL-HPCOF-320–10–50 (entry 4) and PIL-HPCOF-160–10–50 (entry 6) provide propylene carbonate with decreased yields due to the less catalytic sites decorated (entry 4 vs. 1; entry 6 vs. 1). Besides, PIL-HPCOF-160–10–100 with different size of macropores displays a comparable reactivity to that of PIL-HPCOF-320–10–100 (entry 5 vs. 1), suggesting the macropores in both cases are sufficient for mass transfer. Moreover, the performance of a physical mixture of HP-TpBD-320–10 and PIL is also examined, which offers propylene carbonate with only 78% yield due to the incompetent cooperation between two parts by spatial segmentation (entry 7). This result also demonstrates the homogeneous distribution of PIL consisting of active sites into the channels of hierarchical porous TpBD by in-situ polymerization is conductive to the cyclization efficiency. As expected, both HP-TpBD-320–10 and pristine TpBD perform poorly (entries 8 and 9), which is comparable to that without catalyst (entry 10). In conclusion, PIL-HPCOF-320–10–100 displays the best catalytic performance among all samples, producing propylene carbonate with 99% yield at 90 °C for 24 h with 1.0 MPa CO2 pressure. Noteworthily, compared with the previously reported core-shell PPIL@COF (PPIL@COFA-40) hybrids by our laboratory [40], the performance of PIL-HPCOF-320–10–100 is much better with the same catalyst dosage. Remarkably, it enables the reaction proceeds at the reduction of temperature by 10 °C and under lower CO2 pressure of 1 MPa. We attribute this improvement to the versatility of hierarchical porous of PIL-HPCOF hybrids to enhance CO2 enrichment around catalytic centers and accelerate mass transfer of substrates. The substrate scope of this newly developed protocol was next studied using PIL-HPCOF-320–10–100 as the catalyst (Fig. 9 ). The cyclization of ethylene oxide, epichlorohydrin and epibromohydrin with CO2 at 90 °C for 24 h provides the respective product with excellent yields of 99%, 95% and 96%. Dimethyl, ethyl and phenyl substituted epoxides are also found tolerated. However, it is necessary to extend the reaction time to obtain high yields. Besides, the comparison of the catalytic performance of the previously reported COF-based heterogeneous catalysts, amino-PIL catalysts, heterogeneous catalysts with other carriers and the optimum PIL-HPCOF-320–10–100 was conducted as that Table 3 shows. Evidently, PIL-HPCOF-320–10–100 offers the better turnover frequency value under relatively mild conditions among COF-based heterogeneous catalysts (entry 1∼4). Compared to amino-PIL catalysts (entry 5∼6), catalysts with other carrier (entry 7∼8) and our previous work (entry 9), PIL-HPCOF-320–10–100 produces excellent yield of propylene carbonate under milder CO2 pressure and reaction temperature, although it possesses lower TOF. A hot leaching test was performed on this catalytic system to investigate the heterogeneous nature of PIL-HPCOF-320–10–100. The catalytic reaction was stopped after 12 h, followed by the filtration to remove the PIL-HPCOF-320–10–100. No further reaction occurred in the absence of PIL-HPCOF-320–10–100 with additional 12 h, indicative of heterogeneous nature of PIL-HPCOF-320–10–100 (Fig. S5). The recyclability of PIL-HPCOF-320–10–100 was investigated taking the benchmark reaction of propylene oxide with CO2 in consideration (Fig. 10 ). The PIL-HPCOF-320–10–100 was separated from reaction solution by centrifugation, washing with CH2Cl2 and drying under vacuum at 80 °C for 6 h for the next run. To our delight, PIL-HPCOF-320–10–100 can retain its catalytic activity and provide propylene carbonate with a yield up to 94% after five runs. Additionally, the XRD, SEM, N2 sorption and TGA results indicated the crystallinity, morphology, porosity and stability of used PIL-HPCOF-320–10–100 were preserved and considered as a renewable and stable catalyst (Fig. S6∼S9). Based on the theoretical basis and our results [14,48], a speculative mechanism for the cycloaddition of epoxides with CO2 catalyzed by PIL-HPCOF hybrids is presented in Fig. S10. Initially, the epoxide was activated through hydrogen bond of PIL. Meanwhile, the nucleophilic bromide anions attacked the β-carbon of the epoxide. Subsequently, CO2 enriched from COF host with porosity and rich basic sites was activated by amino groups, followed by the reaction between activated CO2 and ring-opened epoxide to form the intermediate. Finally, the ring-closing reaction occurred to produce the corresponding cyclic carbonate and regenerated catalyst for the next cycle. 4 Conclusions In summary, the fabrication of poly(ionic liquid)-hierarchical porous covalent organic framework (PIL-HPCOF) hybrids was accessed through the construction of hierarchical porous COF skeleton via hard-template method, followed by introduction of linear PILs into the channels via in-situ free-radical polymerization. The numbers per volume and size of the macropores in PIL-HPCOF hybrids can be adjusted by the average diameter and mass percentage of the PS templates, while the buried catalytic sites per mass unit is modulated by the dosage of IL monomer for polymerization. Taking the cyclization of epoxides with CO2 as the benchmark reaction, PIL-HPCOF-320–10–100 displays excellent catalytic performance under mild conditions in the absence of any co-catalyst, which delivers cyclic carbonates with high yields (95∼99%) and broad functionality scope. As confirmed by experiments, the excellent versatility possessed by PIL-HPCOF hybrids is mainly attributed to the hierarchical porous structures, with micropores providing high surface area to enhance CO2 uptake capacity and macropores supplying sufficient pore volume to promote mass transport of substrates. Remarkably, it offers high reactivity over previously reported core-shell PPIL@COF hybrids, which signifies the importance of the mass transfer for the benchmark reaction. Besides, PIL-HPCOF-320–10–100 behaves good reusability without significant activity loss via simple separation process. The construction of efficient IL-based catalysts towards CO2 conversion based on this newly developed novel design concept is now carried out in our lab. CRediT authorship contribution statement Yi-Ran Du: Data curation, Formal analysis, Visualization, Writing – original draft. Xin Yang: Data curation, Formal analysis, Visualization. Yao-Feng Wang: Supervision, Formal analysis. Peng-Xin Guan: Data curation, Formal analysis. Rui Wang: Data curation, Formal analysis. Bao-Hua Xu: Conceptualization, Methodology, Writing – review & editing, Supervision, Project administration. Declaration of Competing Interest The authors declare that they have no known competing financial interests or personal relationships that could have appeared to influence the work reported in this paper. Acknowledgement Financial support from National Natural Science Foundation of China Youth Fund (22022815), National Natural Science Foundation of China (U1704251, 22078337), Key Research Program of Frontier Sciences, CAS (ZDBS-LY-JSC022), Zhengzhou High Level Talent Certificate (20180200052), and K. C. Wong Education Foundation (GJTD-2018–04) is gratefully acknowledged. Supplementary materials Supplementary material associated with this article can be found, in the online version, at doi:10.1016/j.mcat.2022.112164. Appendix Supplementary materials Image, application 1 References [1] X.F. Liu X.Y. Li C. Qiao H.C. Fu L.N. He Betaine catalysis for hierarchical reduction of CO2 with amines and hydrosilane to form formamides, aminals, and methylamines Angew. Chem., Int. Ed. 56 2017 7425 7429 X.F. Liu, X.Y. Li, C. Qiao, H.C. Fu, L.N. He, Betaine catalysis for hierarchical reduction of CO2 with amines and hydrosilane to form formamides, aminals, and methylamines, Angew. Chem., Int. Ed.56 (2017) 7425–7429. [2] J. Rintjema R. Epping G. Fiorani E. Martin E.C. Escudero-Adan A.W. Kleij Substrate-controlled product divergence: conversion of CO2 into heterocyclic products Angew. Chem., Int. Ed. 55 2016 3972 3976 J. Rintjema, R. Epping, G. Fiorani, E. Martin, E.C. Escudero-Adan, A.W. Kleij, Substrate-controlled product divergence: conversion of CO2 into heterocyclic products, Angew. Chem., Int. Ed.55 (2016) 3972–3976. [3] W. Zhou J.-.K. Guo S. Shen J. Pan J. Tang L. Chen C.-.T. Au S.-F. Yin Progress in photoelectrocatalytic reduction of carbon dioxide Acta Phys. -Chim. Sin. 36 2020 1906048 1906058 W. Zhou, J.-.K. Guo, S. Shen, J. Pan, J. Tang, L. Chen, C.-.T. Au, S.-F. Yin, Progress in photoelectrocatalytic reduction of carbon dioxide, Acta Phys. -Chim. Sin.36 (2020) 1906048–1906058. [4] Y. Zhou N. Han Y. Li Recent progress on Pd-based nanomaterials for electrochemical CO2 reduction Acta Phys. -Chim. Sin. 36 2020 2001041 2001051 Y. Zhou, N. Han, Y. Li, Recent progress on Pd-based nanomaterials for electrochemical CO2 reduction, Acta Phys. -Chim. Sin.36 (2020) 2001041–2001051. [5] M. Cokoja M.E. Wilhelm M.H. Anthofer W.A. Herrmann F.E. Kuhn Synthesis of cyclic carbonates from epoxides and carbon dioxide by using organocatalysts ChemSusChem. 8 2015 2436 2454 M. Cokoja, M.E. Wilhelm, M.H. Anthofer, W.A. Herrmann, F.E. Kuhn, Synthesis of cyclic carbonates from epoxides and carbon dioxide by using organocatalysts, ChemSusChem.8 (2015) 2436–2454. [6] B.H. Xu J.Q. Wang J. Sun Y. Huang J.P. Zhang X.P. Zhang S.J. Zhang Fixation of CO2 into cyclic carbonates catalyzed by ionic liquids: a multi-scale approach Green Chem. 17 2015 108 122 B.H. Xu, J.Q. Wang, J. Sun, Y. Huang, J.P. Zhang, X.P. Zhang, S.J. Zhang, Fixation of CO2 into cyclic carbonates catalyzed by ionic liquids: a multi-scale approach, Green Chem.17 (2015) 108–122. [7] K. Kiatkittipong M.A.A. Mohamad Shukri W. Kiatkittipong J.W. Lim P.L. Show M.K. Lam S. Assabumrungrat Green pathway in utilizing CO2 via cycloaddition reaction with epoxide-A mini review Processes 8 2020 548 569 K. Kiatkittipong, M.A.A. Mohamad Shukri, W. Kiatkittipong, J.W. Lim, P.L. Show, M.K. Lam, S. Assabumrungrat, Green pathway in utilizing CO2 via cycloaddition reaction with epoxide-A mini review, Processes8 (2020) 548–569. [8] E.J.C. Lopes A.P.C. Ribeiro L.M.D.R.S. Martins New trends in the conversion of CO2 to cyclic carbonates Catalysts 10 2020 479 492 E.J.C. Lopes, A.P.C. Ribeiro, L.M.D.R.S. Martins, New trends in the conversion of CO2 to cyclic carbonates, Catalysts10 (2020) 479–492. [9] Z. Guo Q. Jiang Y. Shi J. Li X. Yang W. Hou Y. Zhou J. Wang Tethering dual hydroxyls into mesoporous poly(ionic liquid)s for chemical fixation of CO2 at ambient conditions: a combined experimental and theoretical study ACS Catal. 7 2017 6770 6780 Z. Guo, Q. Jiang, Y. Shi, J. Li, X. Yang, W. Hou, Y. Zhou, J. Wang, Tethering dual hydroxyls into mesoporous poly(ionic liquid)s for chemical fixation of CO2 at ambient conditions: a combined experimental and theoretical study, ACS Catal.7 (2017) 6770–6780. [10] H. Zhong Y. Su X. Chen X. Li R. Wang Imidazolium- and triazine-based porous organic polymers for heterogeneous catalytic conversion of CO2 into cyclic carbonates ChemSusChem 10 2017 4855 4863 H. Zhong, Y. Su, X. Chen, X. Li, R. Wang, Imidazolium- and triazine-based porous organic polymers for heterogeneous catalytic conversion of CO2 into cyclic carbonates, ChemSusChem10 (2017) 4855–4863. [11] T. Ying X. Tan Q. Su W. Cheng L. Dong S. Zhang Polymeric ionic liquids tailored by different chain groups for the efficient conversion of CO2 into cyclic carbonates Green Chem. 21 2019 2352 2361 T. Ying, X. Tan, Q. Su, W. Cheng, L. Dong, S. Zhang, Polymeric ionic liquids tailored by different chain groups for the efficient conversion of CO2 into cyclic carbonates, Green Chem.21 (2019) 2352–2361. [12] D. Jia L. Ma Y. Wang W. Zhang J. Li Y. Zhou J. Wang Efficient CO2 enrichment and fixation by engineering micropores of multifunctional hypercrosslinked ionic polymers Chem. Eng. J. 390 2020 124652 124664 D. Jia, L. Ma, Y. Wang, W. Zhang, J. Li, Y. Zhou, J. Wang, Efficient CO2 enrichment and fixation by engineering micropores of multifunctional hypercrosslinked ionic polymers, Chem. Eng. J.390 (2020) 124652–124664. [13] W.-.L. Dai L. Chen S.-F. Yin W.-.H. Li Y.-Y. Zhang S.-.L. Luo C.-.T. Au High-efficiency synthesis of cyclic carbonates from epoxides and CO2 over hydroxyl ionic liquid catalyst grafted onto cross-linked polymer Catal. Lett. 137 2010 74 80 W.-.L. Dai, L. Chen, S.-F. Yin, W.-.H. Li, Y.-Y. Zhang, S.-.L. Luo, C.-.T. Au, High-efficiency synthesis of cyclic carbonates from epoxides and CO2 over hydroxyl ionic liquid catalyst grafted onto cross-linked polymer, Catal. Lett.137 (2010) 74–80. [14] C. Yue D. Su X. Zhang W. Wu L. Xiao Amino-functional imidazolium ionic liquids for CO2 activation and conversion to form cyclic carbonate Catal. Lett. 144 2014 1313 1321 C. Yue, D. Su, X. Zhang, W. Wu, L. Xiao, Amino-functional imidazolium ionic liquids for CO2 activation and conversion to form cyclic carbonate, Catal. Lett.144 (2014) 1313–1321. [15] Y. Zhang S. Yin S. Luo C.T. Au Cycloaddition of CO2 to epoxides catalyzed by carboxyl-functionalized imidazolium-based ionic liquid grafted onto cross-linked polymer Ind. Eng. Chem. Res. 51 2012 3951 3957 Y. Zhang, S. Yin, S. Luo, C.T. Au, Cycloaddition of CO2 to epoxides catalyzed by carboxyl-functionalized imidazolium-based ionic liquid grafted onto cross-linked polymer, Ind. Eng. Chem. Res.51 (2012) 3951–3957. [16] W. Zhang Q. Wang H. Wu P. Wu M. He A highly ordered mesoporous polymer supported imidazolium-based ionic liquid: an efficient catalyst for cycloaddition of CO2 with epoxides to produce cyclic carbonates Green Chem. 16 2014 4767 4774 W. Zhang, Q. Wang, H. Wu, P. Wu, M. He, A highly ordered mesoporous polymer supported imidazolium-based ionic liquid: an efficient catalyst for cycloaddition of CO2 with epoxides to produce cyclic carbonates, Green Chem.16 (2014) 4767–4774. [17] H. He Q.Q. Zhu W.W. Zhang H.W. Zhang J. Chen C.P. Li M. Du Metal and co-catalyst free CO2 conversion with a bifunctional covalent organic framework (COF) ChemCatChem 12 2020 5192 5199 H. He, Q.Q. Zhu, W.W. Zhang, H.W. Zhang, J. Chen, C.P. Li, M. Du, Metal and co-catalyst free CO2 conversion with a bifunctional covalent organic framework (COF), ChemCatChem12 (2020) 5192–5199. [18] T.-.Y. Shi J.-.Q. Wang J. Sun M.-H. Wang W.-G. Cheng S.-J. Zhang Efficient fixation of CO2 into cyclic carbonates catalyzed by hydroxyl-functionalized poly(ionic liquids) RSC Adv. 3 2013 3726 3732 T.-.Y. Shi, J.-.Q. Wang, J. Sun, M.-H. Wang, W.-G. Cheng, S.-J. Zhang, Efficient fixation of CO2 into cyclic carbonates catalyzed by hydroxyl-functionalized poly(ionic liquids), RSC Adv.3 (2013) 3726–3732. [19] M.H. Anthofer M.E. Wilhelm M. Cokoja M. Drees W.A. Herrmann F.E. Kuehn Hydroxy-functionalized imidazolium bromides as catalysts for the cycloaddition of CO2 and epoxides to cyclic carbonates ChemCatChem 7 2015 94 98 M.H. Anthofer, M.E. Wilhelm, M. Cokoja, M. Drees, W.A. Herrmann, F.E. Kuehn, Hydroxy-functionalized imidazolium bromides as catalysts for the cycloaddition of CO2 and epoxides to cyclic carbonates, ChemCatChem7 (2015) 94–98. [20] Y. Zhi P. Shao X. Feng H. Xia Y. Zhang Z. Shi Y. Mu X. Liu Covalent organic frameworks: efficient, metal-free, heterogeneous organocatalysts for chemical fixation of CO2 under mild conditions J. Mater. Chem. A 6 2018 374 382 Y. Zhi, P. Shao, X. Feng, H. Xia, Y. Zhang, Z. Shi, Y. Mu, X. Liu, Covalent organic frameworks: efficient, metal-free, heterogeneous organocatalysts for chemical fixation of CO2 under mild conditions, J. Mater. Chem. A6 (2018) 374–382. [21] R. Luo X. Liu M. Chen B. Liu Y. Fang Recent advances on imidazolium-functionalized organic cationic polymers for CO2 adsorption and simultaneous conversion into cyclic carbonates ChemSusChem 13 2020 3945 3966 R. Luo, X. Liu, M. Chen, B. Liu, Y. Fang, Recent advances on imidazolium-functionalized organic cationic polymers for CO2 adsorption and simultaneous conversion into cyclic carbonates, ChemSusChem13 (2020) 3945–3966. [22] O. Buyukcakir S.H. Je S.N. Talapaneni D. Kim A. Coskun Charged covalent triazine frameworks for CO2 capture and conversion ACS Appl. Mater. Inter. 9 2017 7209 7216 O. Buyukcakir, S.H. Je, S.N. Talapaneni, D. Kim, A. Coskun, Charged covalent triazine frameworks for CO2 capture and conversion, ACS Appl. Mater. Inter.9 (2017) 7209–7216. [23] M. Ding H.-L. Jiang Incorporation of imidazolium-based poly(ionic liquid)s into a metal–organic framework for CO2 capture and conversion ACS Catal. 8 2018 3194 3201 M. Ding, H.-L. Jiang, Incorporation of imidazolium-based poly(ionic liquid)s into a metal–organic framework for CO2 capture and conversion, ACS Catal.8 (2018) 3194–3201. [24] T.-T. Liu R. Xu J.-D. Yi J. Liang X.-S. Wang P.-C. Shi Y.-B. Huang R. Cao Imidazolium-based cationic covalent triazine frameworks for highly efficient cycloaddition of carbon dioxide ChemCatChem 10 2018 2036 2040 T.-T. Liu, R. Xu, J.-D. Yi, J. Liang, X.-S. Wang, P.-C. Shi, Y.-B. Huang, R. Cao, Imidazolium-based cationic covalent triazine frameworks for highly efficient cycloaddition of carbon dioxide, ChemCatChem10 (2018) 2036–2040. [25] J. Cao W. Shan Q. Wang X. Ling G. Li Y. Lyu Y. Zhou J. Wang Ordered porous poly(ionic liquid) crystallines: spacing confined ionic surface enhancing selective CO2 capture and fixation ACS Appl. Mater. Inter. 11 2019 6031 6041 J. Cao, W. Shan, Q. Wang, X. Ling, G. Li, Y. Lyu, Y. Zhou, J. Wang, Ordered porous poly(ionic liquid) crystallines: spacing confined ionic surface enhancing selective CO2 capture and fixation, ACS Appl. Mater. Inter.11 (2019) 6031–6041. [26] L.-G. Ding B.-J. Yao F. Li S.-C. Shi N. Huang H.-.B. Yin Q. Guan Y.-B. Dong Ionic liquid-decorated COF and its covalent composite aerogel for selective CO2 adsorption and catalytic conversion J. Mater. Chem. A 7 2019 4689 4698 L.-G. Ding, B.-J. Yao, F. Li, S.-C. Shi, N. Huang, H.-.B. Yin, Q. Guan, Y.-B. Dong, Ionic liquid-decorated COF and its covalent composite aerogel for selective CO2 adsorption and catalytic conversion, J. Mater. Chem. A7 (2019) 4689–4698. [27] C. Cui R. Sa Z. Hong H. Zhong R. Wang Ionic-liquid-modified click-based porous organic polymers for controlling capture and catalytic conversion of CO2 ChemSusChem 13 2020 180 187 C. Cui, R. Sa, Z. Hong, H. Zhong, R. Wang, Ionic-liquid-modified click-based porous organic polymers for controlling capture and catalytic conversion of CO2, ChemSusChem13 (2020) 180–187. [28] X. Wang Y. Zhou Z. Guo G. Chen J. Li Y. Shi Y. Liu J. Wang Heterogeneous conversion of CO2 into cyclic carbonates at ambient pressure catalyzed by ionothermal-derived meso-macroporous hierarchical poly(ionic liquid)s Chem. Sci. 6 2015 6916 6924 X. Wang, Y. Zhou, Z. Guo, G. Chen, J. Li, Y. Shi, Y. Liu, J. Wang, Heterogeneous conversion of CO2 into cyclic carbonates at ambient pressure catalyzed by ionothermal-derived meso-macroporous hierarchical poly(ionic liquid)s, Chem. Sci.6 (2015) 6916–6924. [29] W. Zhang F. Ma L. Ma Y. Zhou J. Wang Imidazolium-functionalized ionic hypercrosslinked porous polymers for efficient synthesis of cyclic carbonates from simulated flue gas ChemSusChem 13 2020 341 350 W. Zhang, F. Ma, L. Ma, Y. Zhou, J. Wang, Imidazolium-functionalized ionic hypercrosslinked porous polymers for efficient synthesis of cyclic carbonates from simulated flue gas, ChemSusChem13 (2020) 341–350. [30] W. Zhou Q.W. Deng G.Q. Ren L. Sun L. Yang Y.M. Li D. Zhai Y.H. Zhou W.Q. Deng Enhanced carbon dioxide conversion at ambient conditions via a pore enrichment effect Nat. Commun. 11 2020 4481 4489 W. Zhou, Q.W. Deng, G.Q. Ren, L. Sun, L. Yang, Y.M. Li, D. Zhai, Y.H. Zhou, W.Q. Deng, Enhanced carbon dioxide conversion at ambient conditions via a pore enrichment effect, Nat. Commun.11 (2020) 4481–4489. [31] Q. Sun B. Aguila J. Perman N. Nguyen S. Ma Flexibility matters: cooperative active sites in covalent organic framework and threaded ionic polymer J. Am. Chem. Soc. 138 2016 15790 15796 Q. Sun, B. Aguila, J. Perman, N. Nguyen, S. Ma, Flexibility matters: cooperative active sites in covalent organic framework and threaded ionic polymer, J. Am. Chem. Soc.138 (2016) 15790–15796. [32] Y. Zhou W. Zhang L. Ma Y. Zhou J. Wang Amino acid anion paired mesoporous poly(ionic liquids) as metal-/halogen-free heterogeneous catalysts for carbon dioxide fixation ACS Sustain. Chem. Eng. 7 2019 9387 9398 Y. Zhou, W. Zhang, L. Ma, Y. Zhou, J. Wang, Amino acid anion paired mesoporous poly(ionic liquids) as metal-/halogen-free heterogeneous catalysts for carbon dioxide fixation, ACS Sustain. Chem. Eng.7 (2019) 9387–9398. [33] H. Zhong J. Gao R. Sa S. Yang Z. Wu R. Wang Carbon dioxide conversion upgraded by host-guest cooperation between nitrogen-rich covalent organic framework and imidazolium-based ionic polymer ChemSusChem 13 2020 6323 6329 H. Zhong, J. Gao, R. Sa, S. Yang, Z. Wu, R. Wang, Carbon dioxide conversion upgraded by host-guest cooperation between nitrogen-rich covalent organic framework and imidazolium-based ionic polymer, ChemSusChem13 (2020) 6323–6329. [34] W. Qian J. Texter F. Yan Frontiers in poly(ionic liquid)s: syntheses and applications Chem. Soc. Rev. 46 2017 1124 1159 W. Qian, J. Texter, F. Yan, Frontiers in poly(ionic liquid)s: syntheses and applications, Chem. Soc. Rev.46 (2017) 1124–1159. [35] T. Biswas V. Mahalingam Efficient CO2 fixation under ambient pressure using poly(ionic liquid)-based heterogeneous catalysts Sustain. Energ. Fuels 3 2019 935 941 T. Biswas, V. Mahalingam, Efficient CO2 fixation under ambient pressure using poly(ionic liquid)-based heterogeneous catalysts, Sustain. Energ. Fuels3 (2019) 935–941. [36] X. Zhou J. Weber J. Yuan Poly(ionic liquid)s: platform for CO2 capture and catalysis Curr. Opin. Green Sustain. Chem. 16 2019 39 46 X. Zhou, J. Weber, J. Yuan, Poly(ionic liquid)s: platform for CO2 capture and catalysis, Curr. Opin. Green Sustain. Chem.16 (2019) 39–46. [37] J.L. Segura S. Royuela M.Mar Ramos Post-synthetic modification of covalent organic frameworks Chem. Soc. Rev. 48 2019 3903 3945 J.L. Segura, S. Royuela, M. Mar Ramos, Post-synthetic modification of covalent organic frameworks, Chem. Soc. Rev.48 (2019) 3903–3945. [38] H. Wang H. Wang Z. Wang L. Tang G. Zeng P. Xu M. Chen T. Xiong C. Zhou X. Li D. Huang Y. Zhu Z. Wang J. Tang Covalent organic framework photocatalysts: structures and applications Chem. Soc. Rev. 49 2020 4135 4165 H. Wang, H. Wang, Z. Wang, L. Tang, G. Zeng, P. Xu, M. Chen, T. Xiong, C. Zhou, X. Li, D. Huang, Y. Zhu, Z. Wang, J. Tang, Covalent organic framework photocatalysts: structures and applications, Chem. Soc. Rev.49 (2020) 4135–4165. [39] Y. Zhi Z. Wang H.L. Zhang Q. Zhang Recent progress in metal-free covalent organic frameworks as heterogeneous catalysts Small 16 2020 2001070 2001090 Y. Zhi, Z. Wang, H.L. Zhang, Q. Zhang, Recent progress in metal-free covalent organic frameworks as heterogeneous catalysts, Small16 (2020) 2001070–2001090. [40] Y.-R. Du G.-R. Ding Y.-F. Wang B.-H. Xu S.-J. Zhang Construction of a PPIL@COF core-shell composite with enhanced catalytic activity for CO2 conversion Green Chem. 23 2021 2411 2419 Y.-R. Du, G.-R. Ding, Y.-F. Wang, B.-H. Xu, S.-J. Zhang, Construction of a PPIL@COF core-shell composite with enhanced catalytic activity for CO2 conversion, Green Chem.23 (2021) 2411–2419. [41] J. Perez-Ramirez C.H. Christensen K. Egeblad C.H. Christensen J.C. Groen Hierarchical zeolites: enhanced utilisation of microporous crystals in catalysis by advances in materials design Chem. Soc. Rev. 37 2008 2530 2542 J. Perez-Ramirez, C.H. Christensen, K. Egeblad, C.H. Christensen, J.C. Groen, Hierarchical zeolites: enhanced utilisation of microporous crystals in catalysis by advances in materials design, Chem. Soc. Rev.37 (2008) 2530–2542. [42] X. Zhao P. Pachfule S. Li T. Langenhahn M. Ye C. Schlesiger S. Praetz J. Schmidt A. Thomas Macro/microporous covalent organic frameworks for efficient electrocatalysis J. Am. Chem. Soc. 141 2019 6623 6630 X. Zhao, P. Pachfule, S. Li, T. Langenhahn, M. Ye, C. Schlesiger, S. Praetz, J. Schmidt, A. Thomas, Macro/microporous covalent organic frameworks for efficient electrocatalysis, J. Am. Chem. Soc.141 (2019) 6623–6630. [43] K. Shen L. Zhang X. Chen L. Liu D. Zhang Y. Han J. Chen J. Long R. Luque Y. Li B. Chen Ordered macro-microporous metal-organic framework single crystals Science 359 2018 206 210 K. Shen, L. Zhang, X. Chen, L. Liu, D. Zhang, Y. Han, J. Chen, J. Long, R. Luque, Y. Li, B. Chen, Ordered macro-microporous metal-organic framework single crystals, Science359 (2018) 206–210. [44] S. Chandra S. Kandambeth B.P. Biswal B. Lukose S.M. Kunjir M. Chaudhary R. Babarao T. Heine R. Banerjee Chemically stable multilayered covalent organic nanosheets from covalent organic frameworks via mechanical delamination J. Am. Chem. Soc. 135 2013 17853 17861 S. Chandra, S. Kandambeth, B.P. Biswal, B. Lukose, S.M. Kunjir, M. Chaudhary, R. Babarao, T. Heine, R. Banerjee, Chemically stable multilayered covalent organic nanosheets from covalent organic frameworks via mechanical delamination, J. Am. Chem. Soc.135 (2013) 17853–17861. [45] H. Ma B. Liu B. Li L. Zhang Y.G. Li H.Q. Tan H.Y. Zang G. Zhu Cationic covalent organic frameworks: a simple platform of anionic exchange for porosity tuning and proton conduction J. Am. Chem. Soc. 138 2016 5897 5903 H. Ma, B. Liu, B. Li, L. Zhang, Y.G. Li, H.Q. Tan, H.Y. Zang, G. Zhu, Cationic covalent organic frameworks: a simple platform of anionic exchange for porosity tuning and proton conduction, J. Am. Chem. Soc.138 (2016) 5897–5903. [46] W. Dai P. Mao Y. Liu S. Zhang B. Li L. Yang X. Luo J. Zou Quaternary phosphonium salt-functionalized Cr-MIL-101: a bifunctional and efficient catalyst for CO2 cycloaddition with epoxides J. CO2 Util. 36 2020 295 305 W. Dai, P. Mao, Y. Liu, S. Zhang, B. Li, L. Yang, X. Luo, J. Zou, Quaternary phosphonium salt-functionalized Cr-MIL-101: a bifunctional and efficient catalyst for CO2 cycloaddition with epoxides, J. CO2 Util.36 (2020) 295–305. [47] Q. Yan H. Xu X. Jing H. Hu S. Wang C. Zeng Y. Gao Post-synthetic modification of imine linkages of a covalent organic framework for its catalysis application RSC Adv. 10 2020 17396 17403 Q. Yan, H. Xu, X. Jing, H. Hu, S. Wang, C. Zeng, Y. Gao, Post-synthetic modification of imine linkages of a covalent organic framework for its catalysis application, RSC Adv.10 (2020) 17396–17403. [48] C. Yang Y. Chen Y. Qu J. Zhang J. Sun Phase-controllable polymerized ionic liquids for CO2 fixation into cyclic carbonates Sustain. Energ. Fuels 5 2021 1026 1033 C. Yang, Y. Chen, Y. Qu, J. Zhang, J. Sun, Phase-controllable polymerized ionic liquids for CO2 fixation into cyclic carbonates, Sustain. Energ. Fuels5 (2021) 1026–1033. [49] Y. Ye D. Li P. Xu J. Sun B-Doped and NH2-functionalized SBA-15 with hydrogen bond donor groups for effective catalysis of CO2 cycloaddition to epoxides Inorg. Chem. Front. 7 2020 3636 3645 Y. Ye, D. Li, P. Xu, J. Sun, B-Doped and NH2-functionalized SBA-15 with hydrogen bond donor groups for effective catalysis of CO2 cycloaddition to epoxides, Inorg. Chem. Front.7 (2020) 3636–3645. [50] C. Liu L. Shi J. Zhang J. Sun One-pot synthesis of pyridine-based ionic hyper-cross-linked polymers with hierarchical pores for efficient CO2 capture and catalytic conversion Chem. Eng. J. 427 2022 131633 131643 C. Liu, L. Shi, J. Zhang, J. Sun, One-pot synthesis of pyridine-based ionic hyper-cross-linked polymers with hierarchical pores for efficient CO2 capture and catalytic conversion, Chem. Eng. J.427 (2022) 131633–131643.",
      "scopus-id": "85124236854",
      "coredata": {
        "eid": "1-s2.0-S2468823122000529",
        "dc:description": "The chemical fixation of CO2 into high value-added chemicals is of significant potential and sustainability to address the energy and ecological issues. To achieve great catalytic performance on the transformation of CO2, it is pivotal to strategically integrating several multifunctional and synergetic functionalities into the catalyst design and catalytic system construction. Herein, the poly(ionic liquid)-hierarchical porous covalent organic framework (PIL-HPCOF) hybrids were successfully synthesized via the formation of HPCOF through hard-template method, followed by in-situ polymerization of mono-vinyl decorated ionic liquids (ILs). The resultant PIL-HPCOF hybrids possess excellent versatility, with micropores providing high surface area to enhance CO2 uptake capacity and macropores supplying sufficient pore volume to promote mass transport of substrates. As a proof of concept, the conversion of CO2 with epoxides to produce cyclic carbonates was selected as a model reaction, which catalytic performance was obviously promoted by using PIL-HPCOF hybrids as the catalyst as compared to those of independent PIL and the PIL-COF hybrids with only micropores. Thus, it enables such a metal-free catalysis proceeds under much mild conditions (CO2 (1 MPa), 90 °C) and with broad substrates tolerance. These results supply the basis to design efficient and stable catalysts for CO2 conversion.",
        "openArchiveArticle": "false",
        "prism:coverDate": "2022-03-31",
        "openaccessUserLicense": null,
        "prism:aggregationType": "Journal",
        "prism:url": "https://api.elsevier.com/content/article/pii/S2468823122000529",
        "dc:creator": [
          {
            "@_fa": "true",
            "$": "Du, Yi-Ran"
          },
          {
            "@_fa": "true",
            "$": "Yang, Xin"
          },
          {
            "@_fa": "true",
            "$": "Wang, Yao-Feng"
          },
          {
            "@_fa": "true",
            "$": "Guan, Peng-Xin"
          },
          {
            "@_fa": "true",
            "$": "Wang, Rui"
          },
          {
            "@_fa": "true",
            "$": "Xu, Bao-Hua"
          }
        ],
        "link": [
          {
            "@_fa": "true",
            "@rel": "self",
            "@href": "https://api.elsevier.com/content/article/pii/S2468823122000529"
          },
          {
            "@_fa": "true",
            "@rel": "scidir",
            "@href": "https://www.sciencedirect.com/science/article/pii/S2468823122000529"
          }
        ],
        "dc:format": "application/json",
        "openaccessType": null,
        "pii": "S2468-8231(22)00052-9",
        "prism:volume": "520",
        "articleNumber": "112164",
        "prism:publisher": "Elsevier B.V.",
        "dc:title": "Immobilization poly(ionic liquid)s into hierarchical porous covalent organic frameworks as heterogeneous catalyst for cycloaddition of CO2 with epoxides",
        "prism:copyright": "© 2022 Elsevier B.V. All rights reserved.",
        "openaccess": "0",
        "prism:issn": "24688231",
        "dcterms:subject": [
          {
            "@_fa": "true",
            "$": "Poly(ionic liquid)s"
          },
          {
            "@_fa": "true",
            "$": "Covalent organic frameworks"
          },
          {
            "@_fa": "true",
            "$": "Hierarchical pores"
          },
          {
            "@_fa": "true",
            "$": "CO2 conversion"
          },
          {
            "@_fa": "true",
            "$": "Cycloaddition reaction"
          }
        ],
        "openaccessArticle": "false",
        "prism:publicationName": "Molecular Catalysis",
        "openaccessSponsorType": null,
        "prism:pageRange": "112164",
        "pubType": "fla",
        "prism:coverDisplayDate": "March 2022",
        "prism:doi": "10.1016/j.mcat.2022.112164",
        "prism:startingPage": "112164",
        "dc:identifier": "doi:10.1016/j.mcat.2022.112164",
        "openaccessSponsorName": null
      },
      "objects": {
        "object": [
          {
            "@category": "standard",
            "@height": "110",
            "@width": "301",
            "@_fa": "true",
            "$": "https://api.elsevier.com/content/object/eid/1-s2.0-S2468823122000529-ga1.jpg?httpAccept=%2A%2F%2A",
            "@multimediatype": "JPEG image file",
            "@type": "IMAGE-DOWNSAMPLED",
            "@size": "15673",
            "@ref": "ga1",
            "@mimetype": "image/jpeg"
          },
          {
            "@category": "standard",
            "@height": "209",
            "@width": "489",
            "@_fa": "true",
            "$": "https://api.elsevier.com/content/object/eid/1-s2.0-S2468823122000529-gr6.jpg?httpAccept=%2A%2F%2A",
            "@multimediatype": "JPEG image file",
            "@type": "IMAGE-DOWNSAMPLED",
            "@size": "45553",
            "@ref": "gr6",
            "@mimetype": "image/jpeg"
          },
          {
            "@category": "standard",
            "@height": "439",
            "@width": "626",
            "@_fa": "true",
            "$": "https://api.elsevier.com/content/object/eid/1-s2.0-S2468823122000529-gr7.jpg?httpAccept=%2A%2F%2A",
            "@multimediatype": "JPEG image file",
            "@type": "IMAGE-DOWNSAMPLED",
            "@size": "83179",
            "@ref": "gr7",
            "@mimetype": "image/jpeg"
          },
          {
            "@category": "standard",
            "@height": "408",
            "@width": "565",
            "@_fa": "true",
            "$": "https://api.elsevier.com/content/object/eid/1-s2.0-S2468823122000529-gr8.jpg?httpAccept=%2A%2F%2A",
            "@multimediatype": "JPEG image file",
            "@type": "IMAGE-DOWNSAMPLED",
            "@size": "73130",
            "@ref": "gr8",
            "@mimetype": "image/jpeg"
          },
          {
            "@category": "standard",
            "@height": "280",
            "@width": "339",
            "@_fa": "true",
            "$": "https://api.elsevier.com/content/object/eid/1-s2.0-S2468823122000529-gr9.jpg?httpAccept=%2A%2F%2A",
            "@multimediatype": "JPEG image file",
            "@type": "IMAGE-DOWNSAMPLED",
            "@size": "30048",
            "@ref": "gr9",
            "@mimetype": "image/jpeg"
          },
          {
            "@category": "standard",
            "@height": "230",
            "@width": "301",
            "@_fa": "true",
            "$": "https://api.elsevier.com/content/object/eid/1-s2.0-S2468823122000529-gr10.jpg?httpAccept=%2A%2F%2A",
            "@multimediatype": "JPEG image file",
            "@type": "IMAGE-DOWNSAMPLED",
            "@size": "22728",
            "@ref": "gr10",
            "@mimetype": "image/jpeg"
          },
          {
            "@category": "standard",
            "@height": "363",
            "@width": "565",
            "@_fa": "true",
            "$": "https://api.elsevier.com/content/object/eid/1-s2.0-S2468823122000529-gr2.jpg?httpAccept=%2A%2F%2A",
            "@multimediatype": "JPEG image file",
            "@type": "IMAGE-DOWNSAMPLED",
            "@size": "80911",
            "@ref": "gr2",
            "@mimetype": "image/jpeg"
          },
          {
            "@category": "standard",
            "@height": "225",
            "@width": "263",
            "@_fa": "true",
            "$": "https://api.elsevier.com/content/object/eid/1-s2.0-S2468823122000529-gr3.jpg?httpAccept=%2A%2F%2A",
            "@multimediatype": "JPEG image file",
            "@type": "IMAGE-DOWNSAMPLED",
            "@size": "26297",
            "@ref": "gr3",
            "@mimetype": "image/jpeg"
          },
          {
            "@category": "standard",
            "@height": "245",
            "@width": "301",
            "@_fa": "true",
            "$": "https://api.elsevier.com/content/object/eid/1-s2.0-S2468823122000529-gr4.jpg?httpAccept=%2A%2F%2A",
            "@multimediatype": "JPEG image file",
            "@type": "IMAGE-DOWNSAMPLED",
            "@size": "40028",
            "@ref": "gr4",
            "@mimetype": "image/jpeg"
          },
          {
            "@category": "standard",
            "@height": "231",
            "@width": "376",
            "@_fa": "true",
            "$": "https://api.elsevier.com/content/object/eid/1-s2.0-S2468823122000529-gr5.jpg?httpAccept=%2A%2F%2A",
            "@multimediatype": "JPEG image file",
            "@type": "IMAGE-DOWNSAMPLED",
            "@size": "30366",
            "@ref": "gr5",
            "@mimetype": "image/jpeg"
          },
          {
            "@category": "standard",
            "@height": "443",
            "@width": "565",
            "@_fa": "true",
            "$": "https://api.elsevier.com/content/object/eid/1-s2.0-S2468823122000529-gr1.jpg?httpAccept=%2A%2F%2A",
            "@multimediatype": "JPEG image file",
            "@type": "IMAGE-DOWNSAMPLED",
            "@size": "119152",
            "@ref": "gr1",
            "@mimetype": "image/jpeg"
          },
          {
            "@category": "standard",
            "@height": "65",
            "@width": "268",
            "@_fa": "true",
            "$": "https://api.elsevier.com/content/object/eid/1-s2.0-S2468823122000529-fx1.jpg?httpAccept=%2A%2F%2A",
            "@multimediatype": "JPEG image file",
            "@type": "IMAGE-DOWNSAMPLED",
            "@size": "3814",
            "@ref": "fx1",
            "@mimetype": "image/jpeg"
          },
          {
            "@category": "standard",
            "@height": "282",
            "@width": "565",
            "@_fa": "true",
            "$": "https://api.elsevier.com/content/object/eid/1-s2.0-S2468823122000529-sc1.jpg?httpAccept=%2A%2F%2A",
            "@multimediatype": "JPEG image file",
            "@type": "IMAGE-DOWNSAMPLED",
            "@size": "44679",
            "@ref": "sc1",
            "@mimetype": "image/jpeg"
          },
          {
            "@category": "thumbnail",
            "@height": "80",
            "@width": "219",
            "@_fa": "true",
            "$": "https://api.elsevier.com/content/object/eid/1-s2.0-S2468823122000529-ga1.sml?httpAccept=%2A%2F%2A",
            "@multimediatype": "GIF image file",
            "@type": "IMAGE-THUMBNAIL",
            "@size": "9206",
            "@ref": "ga1",
            "@mimetype": "image/gif"
          },
          {
            "@category": "thumbnail",
            "@height": "93",
            "@width": "219",
            "@_fa": "true",
            "$": "https://api.elsevier.com/content/object/eid/1-s2.0-S2468823122000529-gr6.sml?httpAccept=%2A%2F%2A",
            "@multimediatype": "GIF image file",
            "@type": "IMAGE-THUMBNAIL",
            "@size": "10674",
            "@ref": "gr6",
            "@mimetype": "image/gif"
          },
          {
            "@category": "thumbnail",
            "@height": "154",
            "@width": "219",
            "@_fa": "true",
            "$": "https://api.elsevier.com/content/object/eid/1-s2.0-S2468823122000529-gr7.sml?httpAccept=%2A%2F%2A",
            "@multimediatype": "GIF image file",
            "@type": "IMAGE-THUMBNAIL",
            "@size": "11747",
            "@ref": "gr7",
            "@mimetype": "image/gif"
          },
          {
            "@category": "thumbnail",
            "@height": "158",
            "@width": "219",
            "@_fa": "true",
            "$": "https://api.elsevier.com/content/object/eid/1-s2.0-S2468823122000529-gr8.sml?httpAccept=%2A%2F%2A",
            "@multimediatype": "GIF image file",
            "@type": "IMAGE-THUMBNAIL",
            "@size": "14090",
            "@ref": "gr8",
            "@mimetype": "image/gif"
          },
          {
            "@category": "thumbnail",
            "@height": "164",
            "@width": "198",
            "@_fa": "true",
            "$": "https://api.elsevier.com/content/object/eid/1-s2.0-S2468823122000529-gr9.sml?httpAccept=%2A%2F%2A",
            "@multimediatype": "GIF image file",
            "@type": "IMAGE-THUMBNAIL",
            "@size": "8073",
            "@ref": "gr9",
            "@mimetype": "image/gif"
          },
          {
            "@category": "thumbnail",
            "@height": "164",
            "@width": "215",
            "@_fa": "true",
            "$": "https://api.elsevier.com/content/object/eid/1-s2.0-S2468823122000529-gr10.sml?httpAccept=%2A%2F%2A",
            "@multimediatype": "GIF image file",
            "@type": "IMAGE-THUMBNAIL",
            "@size": "12167",
            "@ref": "gr10",
            "@mimetype": "image/gif"
          },
          {
            "@category": "thumbnail",
            "@height": "141",
            "@width": "219",
            "@_fa": "true",
            "$": "https://api.elsevier.com/content/object/eid/1-s2.0-S2468823122000529-gr2.sml?httpAccept=%2A%2F%2A",
            "@multimediatype": "GIF image file",
            "@type": "IMAGE-THUMBNAIL",
            "@size": "26230",
            "@ref": "gr2",
            "@mimetype": "image/gif"
          },
          {
            "@category": "thumbnail",
            "@height": "164",
            "@width": "191",
            "@_fa": "true",
            "$": "https://api.elsevier.com/content/object/eid/1-s2.0-S2468823122000529-gr3.sml?httpAccept=%2A%2F%2A",
            "@multimediatype": "GIF image file",
            "@type": "IMAGE-THUMBNAIL",
            "@size": "10620",
            "@ref": "gr3",
            "@mimetype": "image/gif"
          },
          {
            "@category": "thumbnail",
            "@height": "163",
            "@width": "201",
            "@_fa": "true",
            "$": "https://api.elsevier.com/content/object/eid/1-s2.0-S2468823122000529-gr4.sml?httpAccept=%2A%2F%2A",
            "@multimediatype": "GIF image file",
            "@type": "IMAGE-THUMBNAIL",
            "@size": "12795",
            "@ref": "gr4",
            "@mimetype": "image/gif"
          },
          {
            "@category": "thumbnail",
            "@height": "135",
            "@width": "219",
            "@_fa": "true",
            "$": "https://api.elsevier.com/content/object/eid/1-s2.0-S2468823122000529-gr5.sml?httpAccept=%2A%2F%2A",
            "@multimediatype": "GIF image file",
            "@type": "IMAGE-THUMBNAIL",
            "@size": "10214",
            "@ref": "gr5",
            "@mimetype": "image/gif"
          },
          {
            "@category": "thumbnail",
            "@height": "164",
            "@width": "209",
            "@_fa": "true",
            "$": "https://api.elsevier.com/content/object/eid/1-s2.0-S2468823122000529-gr1.sml?httpAccept=%2A%2F%2A",
            "@multimediatype": "GIF image file",
            "@type": "IMAGE-THUMBNAIL",
            "@size": "32304",
            "@ref": "gr1",
            "@mimetype": "image/gif"
          },
          {
            "@category": "thumbnail",
            "@height": "53",
            "@width": "219",
            "@_fa": "true",
            "$": "https://api.elsevier.com/content/object/eid/1-s2.0-S2468823122000529-fx1.sml?httpAccept=%2A%2F%2A",
            "@multimediatype": "GIF image file",
            "@type": "IMAGE-THUMBNAIL",
            "@size": "2351",
            "@ref": "fx1",
            "@mimetype": "image/gif"
          },
          {
            "@category": "thumbnail",
            "@height": "109",
            "@width": "219",
            "@_fa": "true",
            "$": "https://api.elsevier.com/content/object/eid/1-s2.0-S2468823122000529-sc1.sml?httpAccept=%2A%2F%2A",
            "@multimediatype": "GIF image file",
            "@type": "IMAGE-THUMBNAIL",
            "@size": "10337",
            "@ref": "sc1",
            "@mimetype": "image/gif"
          },
          {
            "@category": "high",
            "@height": "489",
            "@width": "1333",
            "@_fa": "true",
            "$": "https://api.elsevier.com/content/object/eid/1-s2.0-S2468823122000529-ga1_lrg.jpg?httpAccept=%2A%2F%2A",
            "@multimediatype": "JPEG image file",
            "@type": "IMAGE-HIGH-RES",
            "@size": "115116",
            "@ref": "ga1",
            "@mimetype": "image/jpeg"
          },
          {
            "@category": "high",
            "@height": "924",
            "@width": "2167",
            "@_fa": "true",
            "$": "https://api.elsevier.com/content/object/eid/1-s2.0-S2468823122000529-gr6_lrg.jpg?httpAccept=%2A%2F%2A",
            "@multimediatype": "JPEG image file",
            "@type": "IMAGE-HIGH-RES",
            "@size": "351494",
            "@ref": "gr6",
            "@mimetype": "image/jpeg"
          },
          {
            "@category": "high",
            "@height": "1942",
            "@width": "2770",
            "@_fa": "true",
            "$": "https://api.elsevier.com/content/object/eid/1-s2.0-S2468823122000529-gr7_lrg.jpg?httpAccept=%2A%2F%2A",
            "@multimediatype": "JPEG image file",
            "@type": "IMAGE-HIGH-RES",
            "@size": "648777",
            "@ref": "gr7",
            "@mimetype": "image/jpeg"
          },
          {
            "@category": "high",
            "@height": "1804",
            "@width": "2500",
            "@_fa": "true",
            "$": "https://api.elsevier.com/content/object/eid/1-s2.0-S2468823122000529-gr8_lrg.jpg?httpAccept=%2A%2F%2A",
            "@multimediatype": "JPEG image file",
            "@type": "IMAGE-HIGH-RES",
            "@size": "557742",
            "@ref": "gr8",
            "@mimetype": "image/jpeg"
          },
          {
            "@category": "high",
            "@height": "1239",
            "@width": "1500",
            "@_fa": "true",
            "$": "https://api.elsevier.com/content/object/eid/1-s2.0-S2468823122000529-gr9_lrg.jpg?httpAccept=%2A%2F%2A",
            "@multimediatype": "JPEG image file",
            "@type": "IMAGE-HIGH-RES",
            "@size": "216509",
            "@ref": "gr9",
            "@mimetype": "image/jpeg"
          },
          {
            "@category": "high",
            "@height": "1017",
            "@width": "1333",
            "@_fa": "true",
            "$": "https://api.elsevier.com/content/object/eid/1-s2.0-S2468823122000529-gr10_lrg.jpg?httpAccept=%2A%2F%2A",
            "@multimediatype": "JPEG image file",
            "@type": "IMAGE-HIGH-RES",
            "@size": "157951",
            "@ref": "gr10",
            "@mimetype": "image/jpeg"
          },
          {
            "@category": "high",
            "@height": "1604",
            "@width": "2500",
            "@_fa": "true",
            "$": "https://api.elsevier.com/content/object/eid/1-s2.0-S2468823122000529-gr2_lrg.jpg?httpAccept=%2A%2F%2A",
            "@multimediatype": "JPEG image file",
            "@type": "IMAGE-HIGH-RES",
            "@size": "754766",
            "@ref": "gr2",
            "@mimetype": "image/jpeg"
          },
          {
            "@category": "high",
            "@height": "999",
            "@width": "1167",
            "@_fa": "true",
            "$": "https://api.elsevier.com/content/object/eid/1-s2.0-S2468823122000529-gr3_lrg.jpg?httpAccept=%2A%2F%2A",
            "@multimediatype": "JPEG image file",
            "@type": "IMAGE-HIGH-RES",
            "@size": "188092",
            "@ref": "gr3",
            "@mimetype": "image/jpeg"
          },
          {
            "@category": "high",
            "@height": "1084",
            "@width": "1333",
            "@_fa": "true",
            "$": "https://api.elsevier.com/content/object/eid/1-s2.0-S2468823122000529-gr4_lrg.jpg?httpAccept=%2A%2F%2A",
            "@multimediatype": "JPEG image file",
            "@type": "IMAGE-HIGH-RES",
            "@size": "311549",
            "@ref": "gr4",
            "@mimetype": "image/jpeg"
          },
          {
            "@category": "high",
            "@height": "1026",
            "@width": "1667",
            "@_fa": "true",
            "$": "https://api.elsevier.com/content/object/eid/1-s2.0-S2468823122000529-gr5_lrg.jpg?httpAccept=%2A%2F%2A",
            "@multimediatype": "JPEG image file",
            "@type": "IMAGE-HIGH-RES",
            "@size": "215186",
            "@ref": "gr5",
            "@mimetype": "image/jpeg"
          },
          {
            "@category": "high",
            "@height": "1959",
            "@width": "2500",
            "@_fa": "true",
            "$": "https://api.elsevier.com/content/object/eid/1-s2.0-S2468823122000529-gr1_lrg.jpg?httpAccept=%2A%2F%2A",
            "@multimediatype": "JPEG image file",
            "@type": "IMAGE-HIGH-RES",
            "@size": "1131502",
            "@ref": "gr1",
            "@mimetype": "image/jpeg"
          },
          {
            "@category": "high",
            "@height": "289",
            "@width": "1188",
            "@_fa": "true",
            "$": "https://api.elsevier.com/content/object/eid/1-s2.0-S2468823122000529-fx1_lrg.jpg?httpAccept=%2A%2F%2A",
            "@multimediatype": "JPEG image file",
            "@type": "IMAGE-HIGH-RES",
            "@size": "26564",
            "@ref": "fx1",
            "@mimetype": "image/jpeg"
          },
          {
            "@category": "high",
            "@height": "1246",
            "@width": "2500",
            "@_fa": "true",
            "$": "https://api.elsevier.com/content/object/eid/1-s2.0-S2468823122000529-sc1_lrg.jpg?httpAccept=%2A%2F%2A",
            "@multimediatype": "JPEG image file",
            "@type": "IMAGE-HIGH-RES",
            "@size": "373041",
            "@ref": "sc1",
            "@mimetype": "image/jpeg"
          },
          {
            "@category": "standard",
            "@_fa": "true",
            "$": "https://api.elsevier.com/content/object/eid/1-s2.0-S2468823122000529-mmc1.docx?httpAccept=%2A%2F%2A",
            "@multimediatype": "Microsoft Word file",
            "@type": "APPLICATION",
            "@size": "1294369",
            "@ref": "mmc1",
            "@mimetype": "application/word"
          },
          {
            "@category": "standard",
            "@_fa": "true",
            "$": "https://api.elsevier.com/content/object/eid/1-s2.0-S2468823122000529-am.pdf?httpAccept=%2A%2F%2A",
            "@multimediatype": "Acrobat PDF file",
            "@type": "AAM-PDF",
            "@size": "1423752",
            "@ref": "am",
            "@mimetype": "application/pdf"
          }
        ]
      },
      "link": {
        "@rel": "abstract",
        "@href": "https://api.elsevier.com/content/abstract/scopus_id/85124236854"
      }
    }
  }
}