{
  "metadata": {
    "title": "Density functional theory study of P-embedded SiC monolayer as a robust metal free catalyst for N<ce:inf loc=post>2</ce:inf>O reduction and CO oxidation",
    "authors": "; ; ",
    "journal": "Molecular Catalysis",
    "date": "2022-07-31",
    "doi": "10.1016/j.mcat.2022.112392",
    "abstract": "",
    "uri": "https://api.elsevier.com/content/article/pii/S2468823122002784",
    "pii": "S2468823122002784"
  },
  "fulltext": {
    "full-text-retrieval-response": {
      "scopus-eid": "2-s2.0-85131442374",
      "originalText": "serial JL 315758 291210 291744 291790 291809 31 Molecular Catalysis MOLECULARCATALYSIS 2022-06-04 2022-06-04 2022-06-04 2022-06-04 2022-12-24T23:55:43 1-s2.0-S2468823122002784 S2468-8231(22)00278-4 S2468823122002784 10.1016/j.mcat.2022.112392 S300 S300.2 FULL-TEXT 1-s2.0-S2468823122X00102 2024-09-04T14:44:12.613756Z 0 0 20220701 20220731 2022 2022-06-04T18:01:29.372841Z absattachment articleinfo articlenumber articletitlenorm authfirstinitialnorm authfirstsurnamenorm cid cids contenttype copyright crossmark dateloaded dateloadedtxt datesearch datesort dateupdated dco docsubtype doctype doi eid ewtransactionid hubeid indexeddate issn issnnorm itemstage itemtransactionid itemweight openaccess openarchive pg pgfirst pii piinorm pubdateend pubdatestart pubdatetxt pubyr sectiontitle sortorder srctitle srctitlenorm srctype ssids alllist content subj subheadings suppl tomb volfirst volissue volumelist webpdf webpdfpagecount yearnav figure table e-component body mmlmath acknowledge affil appendices articletitle auth authfirstini authfull authkeywords authlast highlightsabst primabst ref specialabst 2468-8231 24688231 true 527 527 C Volume 527 7 112392 112392 112392 202207 July 2022 2022-07-01 2022-07-31 2022 Regular Papers article fla © 2022 Elsevier B.V. All rights reserved. DENSITYFUNCTIONALTHEORYSTUDYPEMBEDDEDSICMONOLAYERAROBUSTMETALFREECATALYSTFORN2OREDUCTIONCOOXIDATION KHAN A 1 Introduction 2 Computational details 3 Result and discussion 3.1 Structural properties and adsorption behavior of N2O onto pristine SiC monolayer 3.2 Structural, energetic and electronic properties of P-SiC layer 3.3 Adsorption properties of N2O and CO over P-SiC monolayer 3.4 Catalyst recovery 3.5 Effect of O2 and H2O molecules on catalyst 4 Conclusion CRediT authorship contribution statement Acknowledgment Appendix Supplementary materials References LIU 2019 J LIU 2021 J PORTMANN 2012 367 R HARTER 2016 J ESRAFILI 2019 M DAVIDSON 2014 E 2013 DRAWINGDOWNN2OPROTECTCLIMATEOZONELAYERAUNEPSYNTHESISREPORT ESRAFILI 2021 M KONSOLAKIS 2015 M LIU 2020 J WALTHER 2008 G KONSOLAKIS 2012 M WEI 2012 X SADHANKAR 1994 R HOLLES 2000 J NEMATOLLAHI 2016 P ESRAFILI 2018 M ESRAFILI 2018 M JUNKAEW 2018 A GRANGER 1999 P KONDRATENKO 2004 V ESRAFILI 2018 284 286 M HORINO 2002 H PARRESESCLAPEZ 2010 S YAN 2002 L CHAU 2004 85 87 T SOBOLEV 2012 147 150 V HARDIKAR 2014 R NAYEBZADEH 2014 M XING 2003 Y PEYGHAN 2014 A YIN 2005 213 217 D ZHAO 2020 Z HOSSEINIAN 2017 A KHAN 2021 A WANG 2018 D ZHANG 2014 P WANG 2016 N DELLEY 1990 508 517 B DELLEY 2000 7756 7764 B PERDEW 1996 3865 3868 J GRIMME 2006 1787 1799 S GRIMME 2004 1463 1473 S JOHNSONIII 2020 R NISTCOMPUTATIONALCHEMISTRYCOMPARISONBENCHMARKDATABASE GOVIND 2003 N ISLAM 2020 M YAGHOUBI 2018 A LIN 2012 S YAN 2017 X ESRAFILI 2018 M ESRAFILI 2019 M ESRAFILI 2021 M MOUSAVIAN 2020 122 P ESRAFILI 2019 2267 2274 M ESRAFILI 2019 M ESRAFILI 2018 M HAMADI 2019 H TANG 2011 D TANG 2012 D GONG 2004 X KHANX2022X112392 KHANX2022X112392XA 2024-06-04T00:00:00.000Z 2024-06-04T00:00:00.000Z http://creativecommons.org/licenses/by-nc-nd/4.0/ © 2022 Elsevier B.V. All rights reserved. 2022-06-12T07:03:54.700Z http://vtw.elsevier.com/data/voc/AddOnTypes/50.7/aggregated-refined King Saud University RSP-2021/399 KSU King Saud University http://data.elsevier.com/vocabulary/SciValFunders/501100002383 http://sws.geonames.org/102358/ The authors sincerely appreciate funding from Researchers Supporting Project number (RSP-2021/399), King Saud University, Riyadh, Saudi Arabia. 0 https://doi.org/10.15223/policy-017 https://doi.org/10.15223/policy-037 https://doi.org/10.15223/policy-012 https://doi.org/10.15223/policy-029 https://doi.org/10.15223/policy-004 item S2468-8231(22)00278-4 S2468823122002784 1-s2.0-S2468823122002784 10.1016/j.mcat.2022.112392 315758 2024-09-04T14:44:12.613756Z 2022-07-01 2022-07-31 1-s2.0-S2468823122002784-mainext.pdf https://s3-eu-west-1.amazonaws.com/prod-ucs-content-store-eu-west/content/egi:10B949783L3/MAIN/application/pdf/c2886da4888958de9bd243215fa507e9/mainext.pdf mainext.pdf pdf true 7832641 MAIN 12 1-s2.0-S2468823122002784-main_1.png https://s3-eu-west-1.amazonaws.com/prod-ucs-content-store-eu-west/content/pii:S2468823122002784/PREVIEW/image/png/8f05adbdb28e5bbc6d5811d4ff504cb8/main_1.png main_1.png png 57509 849 656 IMAGE-WEB-PDF 1 1-s2.0-S2468823122002784-main.pdf https://s3-eu-west-1.amazonaws.com/prod-ucs-content-store-eu-west/content/pii:S2468823122002784/MAIN/application/pdf/bc2eaea0ad9ed5219c2b5318e2a6d630/main.pdf main.pdf pdf true 7631624 MAIN 10 1-s2.0-S2468823122002784-main_1.png https://s3-eu-west-1.amazonaws.com/prod-ucs-content-store-eu-west/content/pii:S2468823122002784/PREVIEW/image/png/8f05adbdb28e5bbc6d5811d4ff504cb8/main_1.png main_1.png png 57509 849 656 IMAGE-WEB-PDF 1 1-s2.0-S2468823122002784-gr5.jpg https://s3-eu-west-1.amazonaws.com/prod-ucs-content-store-eu-west/content/pii:S2468823122002784/gr5/DOWNSAMPLED/image/jpeg/662f68d74deaf6d93acae515af7a2f14/gr5.jpg gr5 gr5.jpg jpg 83283 399 715 IMAGE-DOWNSAMPLED 1-s2.0-S2468823122002784-gr6.jpg https://s3-eu-west-1.amazonaws.com/prod-ucs-content-store-eu-west/content/pii:S2468823122002784/gr6/DOWNSAMPLED/image/jpeg/03341bb94af6dec86721a853a6363d45/gr6.jpg gr6 gr6.jpg jpg 55699 415 809 IMAGE-DOWNSAMPLED 1-s2.0-S2468823122002784-gr7.jpg https://s3-eu-west-1.amazonaws.com/prod-ucs-content-store-eu-west/content/pii:S2468823122002784/gr7/DOWNSAMPLED/image/jpeg/a0c0fb176bc2b525b369188a3e4f63aa/gr7.jpg gr7 gr7.jpg jpg 76673 457 809 IMAGE-DOWNSAMPLED 1-s2.0-S2468823122002784-gr8.jpg https://s3-eu-west-1.amazonaws.com/prod-ucs-content-store-eu-west/content/pii:S2468823122002784/gr8/DOWNSAMPLED/image/jpeg/175b268e640f6434210105419c0beb60/gr8.jpg gr8 gr8.jpg jpg 87094 563 809 IMAGE-DOWNSAMPLED 1-s2.0-S2468823122002784-gr9.jpg https://s3-eu-west-1.amazonaws.com/prod-ucs-content-store-eu-west/content/pii:S2468823122002784/gr9/DOWNSAMPLED/image/jpeg/9646624bbb44048960ad5d82ec9f8c5c/gr9.jpg gr9 gr9.jpg jpg 31322 237 301 IMAGE-DOWNSAMPLED 1-s2.0-S2468823122002784-gr1.jpg https://s3-eu-west-1.amazonaws.com/prod-ucs-content-store-eu-west/content/pii:S2468823122002784/gr1/DOWNSAMPLED/image/jpeg/f5dcfae06583d3a30934b0461200ab40/gr1.jpg gr1 gr1.jpg jpg 73175 354 809 IMAGE-DOWNSAMPLED 1-s2.0-S2468823122002784-gr2.jpg https://s3-eu-west-1.amazonaws.com/prod-ucs-content-store-eu-west/content/pii:S2468823122002784/gr2/DOWNSAMPLED/image/jpeg/71bbe7fba60d4f4d7fac490fb2e48458/gr2.jpg gr2 gr2.jpg jpg 128231 502 809 IMAGE-DOWNSAMPLED 1-s2.0-S2468823122002784-ga1.jpg https://s3-eu-west-1.amazonaws.com/prod-ucs-content-store-eu-west/content/pii:S2468823122002784/ga1/DOWNSAMPLED/image/jpeg/26446435a9d16b77acc4a7c4fc77d231/ga1.jpg ga1 true ga1.jpg jpg 34322 190 301 IMAGE-DOWNSAMPLED 1-s2.0-S2468823122002784-gr3.jpg https://s3-eu-west-1.amazonaws.com/prod-ucs-content-store-eu-west/content/pii:S2468823122002784/gr3/DOWNSAMPLED/image/jpeg/6383ffab32e8596132c56acdda8d72c7/gr3.jpg gr3 gr3.jpg jpg 61941 309 809 IMAGE-DOWNSAMPLED 1-s2.0-S2468823122002784-gr4.jpg https://s3-eu-west-1.amazonaws.com/prod-ucs-content-store-eu-west/content/pii:S2468823122002784/gr4/DOWNSAMPLED/image/jpeg/eef49d798077e6021d9e8d61a739e1e8/gr4.jpg gr4 gr4.jpg jpg 124387 539 809 IMAGE-DOWNSAMPLED 1-s2.0-S2468823122002784-gr5.sml https://s3-eu-west-1.amazonaws.com/prod-ucs-content-store-eu-west/content/pii:S2468823122002784/gr5/THUMBNAIL/image/gif/5840a7e5c82faf73669edd18ab6edc50/gr5.sml gr5 gr5.sml sml 11961 122 219 IMAGE-THUMBNAIL 1-s2.0-S2468823122002784-gr6.sml https://s3-eu-west-1.amazonaws.com/prod-ucs-content-store-eu-west/content/pii:S2468823122002784/gr6/THUMBNAIL/image/gif/82adb52facf0f29852e6be6c995be8d7/gr6.sml gr6 gr6.sml sml 7145 112 219 IMAGE-THUMBNAIL 1-s2.0-S2468823122002784-gr7.sml https://s3-eu-west-1.amazonaws.com/prod-ucs-content-store-eu-west/content/pii:S2468823122002784/gr7/THUMBNAIL/image/gif/960c8dadc262d164d6a82a2ec3c3fceb/gr7.sml gr7 gr7.sml sml 8689 124 219 IMAGE-THUMBNAIL 1-s2.0-S2468823122002784-gr8.sml https://s3-eu-west-1.amazonaws.com/prod-ucs-content-store-eu-west/content/pii:S2468823122002784/gr8/THUMBNAIL/image/gif/cc61d55fc28facd198eb7cc3d823ef7f/gr8.sml gr8 gr8.sml sml 10567 152 219 IMAGE-THUMBNAIL 1-s2.0-S2468823122002784-gr9.sml https://s3-eu-west-1.amazonaws.com/prod-ucs-content-store-eu-west/content/pii:S2468823122002784/gr9/THUMBNAIL/image/gif/f7b4e69cb838fd6da76986ad1767394a/gr9.sml gr9 gr9.sml sml 13762 164 208 IMAGE-THUMBNAIL 1-s2.0-S2468823122002784-gr1.sml https://s3-eu-west-1.amazonaws.com/prod-ucs-content-store-eu-west/content/pii:S2468823122002784/gr1/THUMBNAIL/image/gif/1a9b0da254a14e78399a0ad2e22b7679/gr1.sml gr1 gr1.sml sml 9588 96 219 IMAGE-THUMBNAIL 1-s2.0-S2468823122002784-gr2.sml https://s3-eu-west-1.amazonaws.com/prod-ucs-content-store-eu-west/content/pii:S2468823122002784/gr2/THUMBNAIL/image/gif/d6b30ddf7d07c50322049e0031077867/gr2.sml gr2 gr2.sml sml 14520 136 219 IMAGE-THUMBNAIL 1-s2.0-S2468823122002784-ga1.sml https://s3-eu-west-1.amazonaws.com/prod-ucs-content-store-eu-west/content/pii:S2468823122002784/ga1/THUMBNAIL/image/gif/f3f3dad87a2d0b4aa5e7350accf171be/ga1.sml ga1 true ga1.sml sml 15230 138 219 IMAGE-THUMBNAIL 1-s2.0-S2468823122002784-gr3.sml https://s3-eu-west-1.amazonaws.com/prod-ucs-content-store-eu-west/content/pii:S2468823122002784/gr3/THUMBNAIL/image/gif/eb81502a1da4a6672c88e2dfe985b5ee/gr3.sml gr3 gr3.sml sml 8250 84 219 IMAGE-THUMBNAIL 1-s2.0-S2468823122002784-gr4.sml https://s3-eu-west-1.amazonaws.com/prod-ucs-content-store-eu-west/content/pii:S2468823122002784/gr4/THUMBNAIL/image/gif/402a0ffd96ac2079a6df10ba1e39ccdb/gr4.sml gr4 gr4.sml sml 14126 146 219 IMAGE-THUMBNAIL 1-s2.0-S2468823122002784-gr5_lrg.jpg https://s3-eu-west-1.amazonaws.com/prod-ucs-content-store-eu-west/content/pii:S2468823122002784/HIGHRES/image/jpeg/c51a6a0102de893842f5864c6738e312/gr5_lrg.jpg gr5 gr5_lrg.jpg jpg 548139 1767 3167 IMAGE-HIGH-RES 1-s2.0-S2468823122002784-gr6_lrg.jpg https://s3-eu-west-1.amazonaws.com/prod-ucs-content-store-eu-west/content/pii:S2468823122002784/HIGHRES/image/jpeg/a64d67dee6222c4ecc46949a79bd99da/gr6_lrg.jpg gr6 gr6_lrg.jpg jpg 387895 1838 3583 IMAGE-HIGH-RES 1-s2.0-S2468823122002784-gr7_lrg.jpg https://s3-eu-west-1.amazonaws.com/prod-ucs-content-store-eu-west/content/pii:S2468823122002784/HIGHRES/image/jpeg/69dd5fdd5a75a940580dad5013ed55fb/gr7_lrg.jpg gr7 gr7_lrg.jpg jpg 523495 2025 3583 IMAGE-HIGH-RES 1-s2.0-S2468823122002784-gr8_lrg.jpg https://s3-eu-west-1.amazonaws.com/prod-ucs-content-store-eu-west/content/pii:S2468823122002784/HIGHRES/image/jpeg/94d38b2ab3fc60d2ddd929218b1b1f4e/gr8_lrg.jpg gr8 gr8_lrg.jpg jpg 598800 2495 3583 IMAGE-HIGH-RES 1-s2.0-S2468823122002784-gr9_lrg.jpg https://s3-eu-west-1.amazonaws.com/prod-ucs-content-store-eu-west/content/pii:S2468823122002784/HIGHRES/image/jpeg/a461959a2c6634d091a72243739b9327/gr9_lrg.jpg gr9 gr9_lrg.jpg jpg 223748 1050 1333 IMAGE-HIGH-RES 1-s2.0-S2468823122002784-gr1_lrg.jpg https://s3-eu-west-1.amazonaws.com/prod-ucs-content-store-eu-west/content/pii:S2468823122002784/HIGHRES/image/jpeg/3105fa33787a78702cadbb4c5a7075ad/gr1_lrg.jpg gr1 gr1_lrg.jpg jpg 471075 1568 3583 IMAGE-HIGH-RES 1-s2.0-S2468823122002784-gr2_lrg.jpg https://s3-eu-west-1.amazonaws.com/prod-ucs-content-store-eu-west/content/pii:S2468823122002784/HIGHRES/image/jpeg/27d889d6e6113f7ade103f84bc252d77/gr2_lrg.jpg gr2 gr2_lrg.jpg jpg 870190 2225 3583 IMAGE-HIGH-RES 1-s2.0-S2468823122002784-ga1_lrg.jpg https://s3-eu-west-1.amazonaws.com/prod-ucs-content-store-eu-west/content/pii:S2468823122002784/HIGHRES/image/jpeg/5229b9f31e9164ce23ee6b8faf71cf65/ga1_lrg.jpg ga1 true ga1_lrg.jpg jpg 300359 840 1333 IMAGE-HIGH-RES 1-s2.0-S2468823122002784-gr3_lrg.jpg https://s3-eu-west-1.amazonaws.com/prod-ucs-content-store-eu-west/content/pii:S2468823122002784/HIGHRES/image/jpeg/06115f6a27557e7870b49e999435d729/gr3_lrg.jpg gr3 gr3_lrg.jpg jpg 404089 1368 3583 IMAGE-HIGH-RES 1-s2.0-S2468823122002784-gr4_lrg.jpg https://s3-eu-west-1.amazonaws.com/prod-ucs-content-store-eu-west/content/pii:S2468823122002784/HIGHRES/image/jpeg/a3b3230cc9a9f02d1447b60168ca10db/gr4_lrg.jpg gr4 gr4_lrg.jpg jpg 1048344 2385 3583 IMAGE-HIGH-RES 1-s2.0-S2468823122002784-mmc1.docx https://s3-eu-west-1.amazonaws.com/prod-ucs-content-store-eu-west/content/pii:S2468823122002784/mmc1/MAIN/application/vnd.openxmlformats-officedocument.wordprocessingml.document/417e359e9e7d4d70fa16cb10720b96c4/mmc1.docx mmc1 mmc1.docx docx 1567207 APPLICATION 1-s2.0-S2468823122002784-am.pdf https://s3-eu-west-1.amazonaws.com/prod-ucs-content-store-eu-west/content/egi:10RKHCM1NWN/MAIN/application/pdf/74844d1fb2bde602867b713f67c81a29/am.pdf am am.pdf pdf false 1984509 AAM-PDF MCAT 112392 112392 S2468-8231(22)00278-4 10.1016/j.mcat.2022.112392 Elsevier B.V. Fig. 1 (a, b) Top and side views of the optimized structure of N2O adsorbed onto pristine SiC, and (c) corresponding PDOS plots and (d) electron density map (isovalue = 0.03 au). The Fermi level is shown by the dashed line in the PDOS graphs (set to zero energy). Golden, gray, blue and red ball represent silicon, carbon, nitrogen, and oxygen atoms. All bond lengths are in Å. Fig. 1 Fig. 2 (a) Optimized geometry of P-SiC monolayer, and corresponding (b) PDOS, (c) electron density difference plot and (d) pin density (isovalue = 0.04 au). Bond distances are in Å. Golden, gray and pink ball represent silicon, carbon and phosphorous atom. Fig. 2 Fig. 3 (a) Geometry of the P-SiC monolayer after the AIMD simulation (b) potential energy diagram during the AIMD simulation at 1000 K and (c) phonon dispersion plot. Fig. 3 Fig. 4 The relaxed structures, corresponding PDOS and electron density difference plot of N2O (a, b) and CO molecule adsorbed over P-SiC surface at site-1. Bond distances are in Å. Blue, pink, red, gray and golden ball represent nitrogen, phosphorous, oxygen, carbon and silicon atom. Fig. 4 Fig. 5 The relaxed structure of N2O molecule adsorbed over P-SiC surface at site-2 (a) top view (b) side view (c) corresponding PDOS and (d) electron density difference plot. Bond distances are in Å. Blue, pink, red, gray and golden ball represent nitrogen, phosphorous, oxygen, carbon and silicon atom. Fig. 5 Fig. 6 The energy profile and bond lengths (Å) for the CO + Oad → CO2 reaction over P-SiC surface. All bond distances are in Å. Fig. 6 Fig. 7 The energy profile and bond lengths (Å) for the N2O + Oad → N2 + O2, ad reaction over P-SiC surface. All bond distances are in Å. Fig. 7 Fig. 8 PDOS plots of (a) IS-1 and (b) TS-1, and (c) the interaction of the 2π* orbital of a free CO with the HOMO of the Oad pre-adsorbed P-SiC surface and electron density difference plot (d) IS-1(e) TS-1. Fig. 8 Fig. 9 The optimized geometries and bond lengths of (a) H2O and (b, c) O2 species adsorbed over P-SiC surface. All bond distances are in Å. Fig. 9 Table 1 Computed adsorption energy (E ad eV), Gibbs free energy (ΔG) and Hirshfeld charge transfer (QCT, e) values of the adsorbed molecules over P-SiC. Table 1 Molecule adsorbed E ad ΔG QCT N2O (N-site) −0.18 −0.12 0.005 N2O (O-site) −2.59 −2.25 0.10 CO −0.19 −0.13 0.04 O2 (end-on) −1.89 −1.38 0.07, 0.09 O2 (side-on) −1.38 −0.93 0.04 H2O −0.20 +0.27 0.007 Table 2 Comparative analysis of various catalyst used for the reduction of N2O and oxidation of CO (energy values are in eV). Table 2 Catalyst Dissociation energy* Catalyst Energy barrier ⁎⁎ BN-doped graphene −2.25 [14] Si-N4 graphene 0.66 [16] C-doped BN-nanosheet −1.41 [19] Si-C24N24 fullerene 0.37 [57] Fe@C24N24 −1.08 [54] Au55 cluster 0.79 [58] Co@C24N24 −1.02 [54] Ag55 cluster 0.53 [59] Ni@C24N24 −0.98 [54] Pd 0.91 [60] Si@C59 fullerene −1.73 [55] Pt 0.79 [60] This Study −2.59 This study 0.33 ⁎ Catalyst used for the N2O reduction. ⁎⁎ Catalyst used for the CO oxidation. Density functional theory study of P-embedded SiC monolayer as a robust metal free catalyst for N2O reduction and CO oxidation Adnan Ali Khan Conceptualization Software Validation Writing – original draft a b ⁎ Ashfaq Ahmad Conceptualization Software Validation c Hassan M. Al-Swaidan Project administration Supervision c Sajjad Haider Writing – review & editing d ⁎ Muhammad Saeed Akhtar Writing – review & editing e Salah Uddin Khan Writing – review & editing f a Center for Computational Materials Science, University of Malakand, Pakistan Center for Computational Materials Science University of Malakand Pakistan aCenter for Computational Materials Science, University of Malakand, Pakistan b Department of Chemistry, University of Malakand, Pakistan Department of Chemistry University of Malakand Pakistan bDepartment of Chemistry, University of Malakand, Pakistan c Chemistry Department, College of Science, King Saud University, P.O. Box, 2455, Riyadh 11451, Saudi Arabia Chemistry Department College of Science King Saud University P.O. Box, 2455 Riyadh 11451 Saudi Arabia cChemistry Department, College of Science, King Saud University, P.O. Box, 2455, Riyadh 11451, Saudi Arabia d Department of Chemical Engineering, College of Engineering, King Saud University, P.O. Box 800, Riyadh 11421, Saudi Arabia Department of Chemical Engineering College of Engineering King Saud University P.O. Box 800 Riyadh 11421 Saudi Arabia dDepartment of Chemical Engineering, College of Engineering, King Saud University, P.O. Box 800, Riyadh 11421, Saudi Arabia e School of Chemical Engineering, Yeungnam University, Gyeongsan 38541, Republic of Korea School of Chemical Engineering Yeungnam University Gyeongsan 38541 Republic of Korea eSchool of Chemical Engineering, Yeungnam University, Gyeongsan 38541, Republic of Korea f College of Engineering, King Saud University, P.O. Box 800, Riyadh 11421, Saudi Arabia College of Engineering King Saud University P.O. Box 800 Riyadh 11421 Saudi Arabia fCollege of Engineering, King Saud University, P.O. Box 800, Riyadh 11421, Saudi Arabia ⁎ Corresponding authors. In this work, spin-polarized density functional theory calculations are conducted to evaluate the possible applicability of a single P atom doped silicon carbide (P-SiC) monolayer for reduction of nitrous oxide (N2O). The calculations show that P-doping in SiC monolayer is energetically favorable, and the resulting P-SiC is both dynamically and thermodynamically stable. According to our findings, N2O spontaneously dissociates when it interacts with the P-SiC from its O site without the need for an energy barrier, releasing -2.59 eV of energy. The adsorption energy of CO molecule on the P-SiC is less negative than that of N2O, implying that N2O will predominately occupy the catalyst surface. The CO + Oad reaction is used to remove the remaining oxygen atom (Oad) from the P-SiC surface. The calculations show that the reaction proceeds through a low activation energy barrier of 0.33 eV, which is much lower than the previously reported catalysts. This demonstrates the high catalytic activity of P-SiC surface. Furthermore, the adsorption of H2O and O2 species on the P-SiC nanosheet is investigated. The results show that the presence of these species has no effect on the catalytic activity of the P-SiC surface for N2O reduction. These results show that the proposed novel P-SiC catalyst can be regarded as an efficient material in the development of promising active catalysts for N2O elimination from the environment. Graphical abstract Image, graphical abstract . Keywords Density functional theory P-SiC surface N2O Dissociation Energy barrier 1 Introduction Nowadays, the environmental pollution is enormously increased, which greatly received scientists’ attention. Therefore, the primary efforts to protect environment is mostly focused on the control emission of toxic pollutants from various sources e.g. combustion of fossil fuels in automotive engines and industrial sectors [1]. The nitrogen oxides (NOx), originating from power plants, mobile sources etc. have been identified to be the main causes of greenhouse effect, ozone depletion, acid rain, haze and photochemical smog [2]. In NOx, nitrous oxide (N2O) is an important greenhouse gas that is mainly produced during microbial nitrogen transformation processes in natural and agricultural soils [3–5]. Natural emissions of N2O is about 11 Mt N2O-N/yr (megatons of N2O in equivalent nitrogen per-year) while 6 Mt N2O-N/yr emitted by anthropogenic activities [6,7]. The natural N2O emission sources are atmospheric, marine and terrestrial sources while anthropogenic activities that contribute to its emissions mainly include the transformation of fertilizers nitrogen into N2O, fossil fuels combustion, biomass burning, wastewater treatment, industrial activities and aquaculture [5,6,8]. N2O is the largest stratospheric ozone depleting substance, being concomitantly the third most potent greenhouse gas [9]. Specifically, N2O has approximately 310 times higher global potential than CO2, while exhausting at the same time ozone layer in a similar way to chlorofluorocarbons [9]. More worrisome, the continuous N2O emission due to the anthropogenic activities are greatly increasing and are imaged to almost double by 2050, unless remission schemes put forward by each country [7,9]. Recently, novel and efficient catalysts are reported, which are widely used to reduce the emissions of NOx, carbon monoxide and other pollutants [10]. Thus, to control the N2O emissions to the environment, the direct catalytic dissociation process is one of the most popular technologies. Thus, the understanding of N2O origin and its control should noticeably contribute to the Earth's climate stabilization [9]. The reduction of N2O by carbon monoxide (CO) has gained a lot of interest in recent decades because it offers a simple and promising method of removing dangerous CO and N2O molecules from waste gasses at a single process [11–13]. Both experimental [12,14,15] and theoretical studies [16–19] have suggested that the main underlying mechanism for the reduction of N2O by CO is the decomposition of N2O molecules on the catalyst surfaces into N2 and Oad moieties, followed by the elimination of Oad by CO. The important aspect of this process is that the formed products, N2 and CO2, are less harmful than CO and N2O, implying that it can provide a good solution for cleaning the atmosphere from the latter toxic gasses. The only challenge is that N2O decomposition generally requires active catalysts for activation of the N‒O bond, where noble metal-based catalysts play a critical role. Numerous studies have shown that N2O decomposition can be easily catalyzed over noble metals like Pt [20–22], Pd [13,23,24], or Au [25–27] or their alloys. Though the CO molecules may remove the produced Oad species left over the catalyst, this reaction is identified as the rate-limiting step of the entire N2O reduction process due to the strong binding of Oad to the catalyst surface. Furthermore, noble metals are expensive, rare, and generally require high temperatures for optimal performance, all of which limit their large-scale application in N2O reduction. As a result, it is desirable to seek for and develop noble metal-free catalysts for N2O reduction with CO. Literature reveals that carbon-nanomaterials including graphene and graphene like 2D materials have attracted enormous attention because of their unique structures, tunable physical and chemical properties and best electrical conductivity. Particularly, various types inorganic 2D nanosheet like magnesium oxide (MgO), aluminum nitride (AlN), boron nitride (BN) and silicon carbide (SiC) have earned substantial interest due to their large specific area, wide band gap and cost effective synthetic route [28–33]. SiC nanomaterial with wonderful physical, chemical and thermal properties is a good alternative to graphene, which can be utilized in high frequency and high temperature environments [33,34]. Recently, researchers used SiC as gas sensor [33], as anode materials for alkali ion and magnesium ion batteries [34,35] and as catalyst [36,37]. Using density functional theory (DFT) simulations Zhao et al. [33] investigated SiC as gas sensor. There results demonstrates that the SiC nanosheet shows an excellent adsorption performance for NO, NO2 and NH3 molecules with fast recovery time. DFT study [35] evince high theoretical capacity of SiC nanosheet as an anode materials in magnesium ion battery. Wang et al. [38] explored the catalytic properties of SiC monolayer for the CO oxidation reaction. The results suggested that the 2D SiC nanosheet is a promising metal free catalyst for CO oxidation process. Similarly layered SiC nano-sheets exhibits a good catalytic activity for the oxygen reduction reaction [37]. The study of Wang et al. [36] reveal that SiC is an efficient catalyst for carbon dioxide conversion with high efficiency and selectivity. Motivated by the previous studies, we aimed to study the possible application of phosphorous (P) doped SiC monolayer as a metal-free catalyst for N2O reduction using density functional theory (DFT) approach. P atom was chosen because it is inexpensive and plentiful in the earth's crust and in phosphate minerals. Using DFT suitable adsorption configurations of N2O and CO molecules over the P-SiC catalyst are studied. The basic mechanism for the reduction of N2O and oxidation of CO is then studied carefully. Since H2O and O2 species are present in waste gasses, the effect of these molecules on the N2O reduction process is also investigated. The results show that doping of SiC with P atom transforms it into an active catalyst to reduce N2O molecules. 2 Computational details The DMol3 code was employed for spin-polarized DFT computations [39,40]. All the computations were performed using the PBE functional and a double numerical plus polarization function (DNP) basis set [41]. To ensure the dynamic stability of the examined structures, vibrational frequency simulations were performed at the same level of theory. The basis set cutoff and thermal smearing were set at 4.6 Å and 0.005 au, respectively. To compensate van der Waals interactions, the Grimme's scheme DFT-D2 method was used [42,43]. The Brillouin-zone was integrated to 3 × 3 × 1 Monkhorst-Pack k-points for geometry relaxations, while 5 × 5 × 1 k-points for the electronic properties calculations. The adsorption energies (E ad) of all complexes were calculated using the equation: (1) E a d = E c o m p l e x − ( E a d s o r b e n t + E a d s o r b a t e ) where E complex, E adsorbent and E adsorbate are the total electronic energies of the relaxed structure of the complex system (gas adsorbed over the nanosheet) and bare nanosheet and reactant species i.e., N2O, CO, O2 and H2O, respectively. Gibbs free energy changes (ΔG) were obtained using the following equation to determine if adsorption of reaction species is achievable at normal temperature: (2) Δ G = Δ E + Δ E Z P E − T Δ S wherein ΔE is energy released during the adsorption process at T = 0 K. The ΔEZPE and ΔS are the changes in zero-point energy and entropy during complex formation as derived from the vibrational frequency calculations. The zero-point energy and entropy values of the isolated molecules were obtained using the NIST standard reference database [44]. The reaction barriers were obtained from the linear synchronous transit/quadratic synchronous transit [45], while nudge elastic band [46] method was used to derive minimum energy pathways. 3 Result and discussion 3.1 Structural properties and adsorption behavior of N2O onto pristine SiC monolayer The relaxed geometry of silicon carbide (SiC) monolayer is represened in Fig. S1. The Si—C bond length in 2D monolayer is 1.77 Å, which is in good agreement with earlier studied [33,37]. As previous stduies shows that the 2D silicon carbide nanosheet is energeticall, dynamically and thermally is stable [33,47–50]. The adsorption behavior of a N2O molecule on pure SiC monolayer is initially examined. Fig. 1 depicts the optimized geometry of N2O on SiC monolayer, as well as the related partial density of states (PDOS) and electron density plots (Panels a–d). The geometry relaxation shows that N2O is weakly adsorbed over the pristine SiC monolayer, with a large binding distance of 3.31 Å, and that there are no significant variations in the N‒O or N‒N bond length of N2O due to its physisorption (Fig. 1(a, b)). The E ad value of N2O in this obtained complex is −0.17 eV, confirming the physisorption. Furthermore, the Hirshfeld analysis demonstrates that there was a minor charge transfer (< 0.003 electrons) between the N2O and SiC monolayer during the adsorption process. The PDOS plot in Fig. 1c shows that there is no considerable overlap between the electronic states of N2O and SiC monolayer at the Fermi level, implying that there is no strong interaction between them. This is supported by electron density isosurfaces (Fig. 1d), which demonstrate that in the N2O adsorbed structure, electrons are mostly localized over the adsorbate (N2O) and adsorbent (SiC monolayer) independently, showing the lack of a chemical bonding between them. These findings suggest that the pure SiC monolayer sheet has a low proclivity to activate the N2O molecule. 3.2 Structural, energetic and electronic properties of P-SiC layer Recent studies shows that doping nanostructures with various atoms singificanlty activated the N2O molecule [8,51–53]. Therefore, we doped the SiC monolayer with the phosporous (P) atom. The optimized geometries of the P-embedded SiC (P-SiC) mono layer, corresponding density of states, electron density difference (EDD) and spin density plot is illustrated Fig. 2 (a–d). Two different doping sites were considered for the P doping into the SiC monolayer that is site-1(Si atom of hexagonal ring was replaced by P atom) and site-2 (C atom of hexagonal ring was replaced by P atom), as shown in Fig. S1. Then fully geometry relaxation simulations were performed for both sites. The formation energy (E f) value for P doping at site-1 is noticed as 2.11 eV while that for site-2 is 5.52 eV, respectively. The E f value demonstrates that the doping of P atom into site-1 is energetically more favourable than site-2. In site-1 doping, the P—C bond length is calculated is 1.77 Å, which is almost equivalent to the Si—C bond length. While due to larger atomic radius of P atom than the C atom, there is smaller distortion occurred in the geometry of SiC monolayer and the P atom is bulges out from the plan. The Hirshfeld surface charge analysis shows that the P atoms carries positive charge of 0.21e which can be attributed to its lower electronegativity (2.19) than C atoms (2.55). The total density of states analysis (Fig. S2) shows that at Fermi level of P-SiC monolayer there is a distinct peak, assigned to the P-3p states. The appearance of this peak results to a significant decrease (1.25 eV) in the band gap of the SiC monolayer (2.85 eV) as shown in the band strucutrues (Fig. S2). This result together with the PDOS analysis (Fig. 2b) show that 3p state of P atom is strongly overlap with the 2p state of C atoms at Fermi level, suggesting a stronger covalent bond formation beween the P atom and C atom of the monolayer. The EDD plot (Fig. 1c) are in agreement with the PDOS analysis, which shows that a relatively larger-positive charge is accumulated on the P atom hence it formed stronger covalent bonds with the neighbouring electronegative C atoms. The spin electron density map (Fig. 2d) shows tha there is a high spin density localized over the P atom as compared to neighbor atoms, depicts the enhanced chemical-reactivity of the P doped surface. Furhtermore, to check the dynamic and thermal stabilty of the P doped SiC monlayer we computed the phono spectrum for doped surface and performed the ab initio molecular dynamics (AIMD) simulations at 1000 K for period of 2 fs. The plots of phonon spectra and AIMD analysis are illustrated in Figs. S and 3 (a, b). The phonon analysis indicates that all the vibration modes (Fig. S3) are rea in the entire Brillouin zones confirming the dynamical stability of P-SiC monolayer. The AIMD calculations shows that the potential energy variates around a certain magnitude while there is negligbile variations occurred in the bond lengths and the P atom is fixed at its posoition, suggesting that this system is able to withstand high temperature up to 1000 K. The optimized geomrty and corresponding PDOS plot of P doping at site-2 is shown in Fig. S4. Compared to site-1, larger distrotion is observed after P doping at site-2, resulted the P—C bond elongation to 2.27 Å. The PDOS analysis display that there is considrible overlaping exits between the p states of P and Si atoms at Fermi level. Hirsfeld charge transfer analysis shows that there is −0.05 e charge is present over P atom after doping at site-2. 3.3 Adsorption properties of N2O and CO over P-SiC monolayer The adsorption of reactant species onto the catalyst is critical in the N2O reduction process, as it is in any other catalytic process. Hence, the DFT calculations are conducted to explore the potential adsorption properties of N2O and CO molecules over the P-SiC monolayer. Fig. 4 (a–c) depicts the optimized geometries of N2O and CO adsorbed onto the P-SiC monolayer, as well as the associated PDOS plots and electron density difference (EDD) graphs (Panels a–c). Table 1 shows the minimum binding distances (R min), adsorption energies (E ad), charger-transfer (Q CT) values and Gibbs free energy change (ΔG). According to the literature, N2O can bind to the active sites of the catalyst in a variety of ways. As a result, several initial configurations are considered to locate the most stable (energetically favorable) adsorption configurations, including those in which N2O approaches the different sites of P-SiC monolayer from its N, O sites, or through its N‒O and N‒N bonds. Our calculations show that N2O interacted with the P atom via its N site with binding distance of 3.76 Å and an E ad value of −0.18 eV and a ΔG value of −0.12 eV (Table 1). The larger binding distance and E ad value of N2O on P-SiC monolayer demonstrate that the N2O removal by P-SiC via its N site is not favorable. According to the Hirshfeld analysis, there is no significant charge transfer observed between the catalyst surface and N2O molecule due to weak interaction. The PDOS plot in Fig. 4(a) supports this finding, in which no mixing among 3p states of P atom are noticed with the lowest unoccupied molecular orbital (LUMO) of N2O at Fermi level. As a result, no substantial hybridization between the P and N atoms occurs, resulting physisorption. The EDD analysis (Fig. 4(a)) demonstrates that the concentration of electron density near the P—N bond is absent which validates the physisorption nature between the N2O and P-SiC monolayer. A dissociative N2O adsorption has been reported on the other P doped nanostructure, as the N2O molecule approaches the surface from its O site [51]. This might be ascribed to the newly formed strong P-O bond as well as the substantial polarization of the N‒O bond of N2O in the presence of a positive P atom. As Table 1 indicates, the E ads value for N2O adsorption from its O site is −2.59 eV, which is better than the previously reported single atom doped catalysts for N2O dissociation (Table 2 ) [17,22,54,55]. The calculated ΔG value for the N2O dissociative reaction is −2.25 eV, suggesting that the process occurs spontaneously at normal temperature and that the resultant species (Oad and N2) are thermodynamically stable. To see the effect of temperature on the N2O reduction, the ΔG values are calculated for N2O dissociation step using the following Eq. (2) at various temperature (298.15 – 800 K) as reported earlier [56]. Table S1 lists the ΔG values of N2O dissociation step at various temperature. From Table S1, it is seen that the reduction of N2O is exothermic over a wide range of temperature. While an increase in the temperature makes a decrease in the ΔG values of N2O reduction process. The negative ΔG values along with no energy barrier discussed above indicate that N2O reduction over P-SiC catalyst is a thermodynamically and kinetically favored process over a wide range of temperature. Furthermore, the charge transfer analysis shows that the Hirshfeld charges on the P and Oad atoms are +0.31 and −0.36 |e|, respectively. The PDOS analysis (Fig. 4(b)) shows that the electronic states of Oad and P are mixed at the Fermi level, but no mixing is evident for the electronic states of Oad and N2, confirming the dissociation of the N2O specie over the P-SiC sheet. This is further supported by the EDD analysis in Fig. 4(b), which shows that the electron density is concentrated between the P atom and the Oad, with no overlapping between the EDD of N2 and the Oad, indicating the N2O dissociation. Another critical step in the N2O reduction process is the adsorption of CO molecules onto the catalyst surface. As a result, in this investigation, the adsorption of CO on the P-SiCis also investigated. The most energetically stable adsorption structure of CO is depicted in Fig. 4(c). The geometry optimization reveals that the CO molecule attaches to the P atom from its C site, adopting an end-on configuration. The calculated P—CO bond length is 2.63 Å, evince weak adsorption which is consistent with the previously reported P doped catalysts [51,55,57]. The E ad value of CO over P-SiC monolayer is −0.19 eV, which is less than that of the N2O molecule dissociation energy, indicating that CO adsorption is less favorable. The ΔG value for the CO adsorption is negative (−0.13 eV), implying that CO adsorption is possible at room temperature. Following the adsorption, CO molecule gains 0.04 electrons from the surface, resulting in a negligible (0.01 Å) elongation in the C‒O bond. Meanwhile, the PDOS plots in Fig. 4(c) demonstrate that there is no significant hybridization at the Fermi level between the CO-5σ and vacant 3p orbitals of the P atom. Furthermore, the empty CO-2π* states accept some charge from the CO-5σ, therefore CO-5σ moved to Fermi-level and CO-2π* energy level enhanced above Fermi level. The weak interaction of CO over the P-SiC is also justified by the corresponding EDD isosurface (Fig. 4(c)), where there is a negligible electron density mixing observed between them. To gain more insights into the selectivity of P-SiC catalyst for N2O reduction in presence of CO molecule. The co-adsorption of N2O and CO molecules over the catalyst surface are investigated. The optimized geometry of N2O and CO molecule co-adsorption over P-SiC is shown in Fig. S5. The geometry relaxation revealed that the N2O is spontaneously dissociated over the P-SiC surface from its O site as found for separately N2O molecule adsorption over the catalyst surface. While the CO molecule is moved away from the P atom of the surface and shows physisorption nature. The bond distance between the O and N atom after dissociation is 3.24 Å and P—O bond distance is 1.52 Å, respectively. On the other hand, the distance between the C atom of CO molecule and O atom attached at surface is 2.94 Å while between C and P atom the binding distance is 3.74 Å. The adsorption energy value obtained for N2O/CO co-adsorption is −2.77 eV (Fig. S5). Thus, the co-adsorption study shows that the P-SiC catalyst can selectively reduce N2O molecule. The interaction of N2O molecule at site-2 is also considered in the preset study, the optimized geometry and corresponding PDOS and EDD plots are illustrated in Fig. 5 (a–d). As the above information exposed that the N2O molecule strongly interacted with P atom from its O site, therefore for site-2 we just simulated the N2O interaction from O site (Fig. 5(a, b)). The geometry optimization depicted that there is no significant interaction is observed between the N2O molecule and catalyst surface the binding distance is noticed is 3.71 Å, while the E ad value obtained for this interaction is −0.091 eV, which is comparatively very small, signifying that site-2 of the catalyst surface is not favorable for N2O + P → N2 + O*P reaction. This is further confirmed by PDOS (Fig. 5(c)) analysis which shows that there is no hybridization exist between the p states of P and O atom at Fermi-level. The EDD analysis (Fig. 5(d)) demonstrates that there no overlapping of electron density appeared between the N2O molecule and catalyst surface, evidence of weak bonding between them. 3.4 Catalyst recovery To prevent the catalyst from poising due to the presence of the Oad moiety, the interaction of the CO molecule with the Oad should be examined. This is accomplished by allowing the CO molecule to react with the Oad. The potential energy diagram for the reaction of the CO molecule with the Oad is shown in Fig. 6 . The CO molecule has an intermolecular bond distance of 2.92 Å and an E ad value of −0.14 eV at the initial state (IS-1), showing that it weakly interacts with the Oad. Based on the Hirshfeld analysis, CO adsorption is followed by a minor charge shift from Oad to CO. To complete the process, the CO molecule is moved closer to the Oad until the formation of C-O and C-Si bond is occurred, resulting in the formation a CO2 molecule (IM in Fig. 6) over the catalyst surface. According to the IR frequency analysis, the transition state TS-1, which involves the weakening of the P‒Oad bond and the formation of a new C=O bond, is associated with an imaginary frequency of 136.85i cm−1 (Fig. S4). A very low energy barrier of 0.28 eV is required for this reaction step, which is readily available at room temperature. This barrier is quite similar to that of the previously reported catalysts for N2O reduction. Furthermore, with a reaction energy of −0.26 eV, this reaction is exothermic. It must be noticed that the observed energy barrier of this reaction is much smaller than those reported (Table 2) for Si@N4-grpahene (0.66 eV) [19], Si@C24N24 (0.37 eV) [58], Au55 (0.79 eV) [59], Ag55 (0.53 eV) [60], Pd (0.91 eV) [61] and Pt (0.79 eV) [61], respectively. This demonstrates that the catalytic performance of the P-SiC is superior to that of the catalysts mentioned. Meanwhile, the binding distance between of P and Si atom with O and C atom is increased as the IM converted to FS-1 (released CO2 molecule from surface) by overcoming a small activation energy (0.33 eV). Furthermore, the adsorption energy value of CO2 over the P-SiC surface is very low (−0.17 eV), suggesting that catalyst recovery is quite feasible at room temperature. In addition to the CO molecule, N2O may attack the Oad species and form N2 and O2 molecules. Hence, the N2O + Oad → N2 + O2, ad is investigated on the catalyst surface. Fig. 7 depicts the relevant potential energy diagram for this process. In IS-2, N2O is weakly adsorbed over the Oad moiety with a binding distance of 3.31 Å and an E ad value of −0.18 eV, indicating its physisorption. As the N2O approached the Oad to generate N2 and O2, it passes through the TS-2 with an energy barrier of 0.87 eV. The reaction energy for this process is 0.39 eV, suggesting that it is not kinetically feasible under normal conditions. The PDOS, molecular orbital and EDD analyses of the initial and transition states involved in the CO + Oad → CO2 reaction are performed to get a better understanding of the high catalytic activity of the P@SiC. The obtained findings are depicted in Fig. 8 (a–e). The findings demonstrate that in the IS-1, the empty 2π* orbital of CO overlaps with the HOMO of O-preadsorbed P@SiC. With the progress of the reaction, electrons are moved from the surface to the CO, as seen by the significant overlap of electronic states at the Fermi level in TS-1. The molecular orbital analysis in Fig. 8(c)) supports this finding, where the 2π* orbital of the CO molecule is mixed with the HOMO of the Oad covered P@SiC. Consequently, the C‒O and P‒Oad bonds are elongated as the reaction progresses from IS-1 to TS-1. Furthermore, the EDD plots Fig. 8(d, e) show that as the reaction proceeds from IS-1 to TS-1, a considerable electron density buildup between the P atom and CO molecule confirms the formation of bond between them. So, the outstanding catalytic activity of P-SiC might be related to the substantial hybridization of electronic states of Oad and CO molecule. 3.5 Effect of O2 and H2O molecules on catalyst The adsorption of oxygen (O2) and water (H2O) molecules on the Si-doped BN-yne is also investigated to see whether their presence would interfere with N2O reduction. Fig. 9 (a–c) depicts the most energetically advantageous adsorption configurations of O2 and H2O, as well as the associated intermolecular distances. It is found that the H2O is physisorbed over the catalyst surface, with an E ad value of −0.20 eV and a minimum binding distance of 2.39 Å (Table 1). Considering the Hirshfeld analysis, there is very small charge transfer between H2O molecule and the surface. Furthermore, the calculated ΔG value for H2O adsorption is positive (+0.27 eV), suggesting that the adsorption process is not feasible at normal temperatures. Two different adsorption configurations for O2 are investigated i.e., side-on configuration (Fig. 9(b)) in which O2 is adsorbed on the top of P and Si atom, parallel to the SiC surface and end-on configuration (Fig. 9(c)) in which one of the O atoms of O2 is attached to the P atom and O2 is placed almost perpendicular to the SiC surface. The calculated E ad value for the side-on configuration onto the catalyst surface is −1.89 eV, with Si‒O and P‒O bond lengths of 1.79 and 1.73 Å, respectively. The Hirshfeld analysis indicates that a charge of 0.07 and 0.09 electrons is moved from the Si and P atom to the O2 molecule. The obtained ΔG value for side-on configuration is −1.38 eV, showing the exothermic nature. The E ad value, P‒O bond length and ΔG value calculated for end-on adsorption configuration is −1.38 eV, 1.83 Å and −0.93 eV. There is 0.04 e charge transferred from the P atom to the O atom of the O2 molecule. However, comparing the adsorption energies of H2O and O2 molecules to those of N2O molecule clearly suggests that the latter species cannot interrupt the N2O reduction reaction. Furthermore, the larger dissociation energy of N2O compared to O2 adsorption energy suggests that the competing CO + O2 process cannot take place in the presence of N2O molecules. 4 Conclusion The N2O reduction over P-SiC monolayer was investigated using the quantum chemical calculations. It was revealed that replacing a Si atom in the hexagon ring of SiC with a P atom is more energetically advantageous than other sites. The P-SiC surface is dynamically and thermodynamically stable, according to phonon dispersion vibration analysis and AIMD simulations. It is discovered that the active catalytic site for dissociated N2O molecule is P@SiC. Furthermore, the P-SiC demonstrated rapid catalytic activity in the CO + Oad → CO2 process. The activation energy for this reaction is relatively small (0.33 eV), indicating that this process is comparably more favorable than the previously reported. Comparing the adsorption energies of H2O and O2 molecules with that of N2O, it is found that the presence of H2O or O2 molecules cannot interrupt the N2O reduction process. Based on these exciting findings, P-SiC is suggested as a highly active, low-cost and environmentally friendly catalyst for eliminating N2O and CO molecules from waste gasses. CRediT authorship contribution statement Adnan Ali Khan: Conceptualization, Software, Validation, Writing – original draft. Ashfaq Ahmad: Conceptualization, Software, Validation. Hassan M. Al-Swaidan: Project administration, Supervision. Sajjad Haider: Writing – review & editing. Muhammad Saeed Akhtar: Writing – review & editing. Salah Uddin Khan: Writing – review & editing. Declaration of Competing Interest The authors declare they have no conflict of interest. Acknowledgment The authors sincerely appreciate funding from Researchers Supporting Project number (RSP-2021/399), King Saud University, Riyadh, Saudi Arabia. Supplementary materials Supplementary material associated with this article can be found, in the online version, at doi:10.1016/j.mcat.2022.112392. Appendix Supplementary materials Image, application 1 References [1] J. Liu Z. Zhao C. Xu J. Liu Structure, synthesis, and catalytic properties of nanosize cerium-zirconium-based solid solutions in environmental catalysis Chin. J. Catal. 40 2019 10.1016/S1872-2067(19)63400-5 J. Liu, Z. Zhao, C. Xu, J. Liu, Structure, synthesis, and catalytic properties of nanosize cerium-zirconium-based solid solutions in environmental catalysis, Chin. J. Catal.40 (2019). 10.1016/S1872-2067(19)63400-5. [2] J. Liu H. Cheng H. Zheng L. Zhang B. Liu W. Song J. Liu W. Zhu H. Li Z. Zhao Insight into the potassium poisoning effect for selective catalytic reduction of NOx with NH3 over Fe/Beta ACS Catal. 11 2021 10.1021/acscatal.1c04497 J. Liu, H. Cheng, H. Zheng, L. Zhang, B. Liu, W. Song, J. Liu, W. Zhu, H. Li, Z. Zhao, Insight into the potassium poisoning effect for selective catalytic reduction of NOx with NH3 over Fe/Beta, ACS Catal.11 (2021). 10.1021/acscatal.1c04497. [3] R.W. Portmann J.S. Daniel A.R. Ravishankara Stratospheric ozone depletion due to nitrous oxide: influences of other gases Philos. Trans. R. Soc. B Biol. Sci. 2012 367 10.1098/rstb.2011.0377 R.W. Portmann, J.S. Daniel, A.R. Ravishankara, Stratospheric ozone depletion due to nitrous oxide: influences of other gases, Philos. Trans. R. Soc. B Biol. Sci.367 (2012). 10.1098/rstb.2011.0377. [4] J. Harter I. Guzman-Bustamante S. Kuehfuss R. Ruser R. Well O. Spott A. Kappler S. Behrens Gas entrapment and microbial N2O reduction reduce N2O emissions from a biochar-amended sandy clay loam soil Sci. Rep. 6 2016 10.1038/srep39574 J. Harter, I. Guzman-Bustamante, S. Kuehfuss, R. Ruser, R. Well, O. Spott, A. Kappler, S. Behrens, Gas entrapment and microbial N2O reduction reduce N2O emissions from a biochar-amended sandy clay loam soil, Sci. Rep.6 (2016). 10.1038/srep39574. [5] M.D. Esrafili Catalytic reduction of N2O over Si-embedded MoS2 monolayer: a single-atom catalyst approach Inorg. Chem. Commun. 108 2019 10.1016/j.inoche.2019.107504 M.D. Esrafili, Catalytic reduction of N2O over Si-embedded MoS2 monolayer: a single-atom catalyst approach, Inorg. Chem. Commun.108 (2019). 10.1016/j.inoche.2019.107504. [6] E.A. Davidson D. Kanter Inventories and scenarios of nitrous oxide emissions Environ. Res. Lett. 9 2014 10.1088/1748-9326/9/10/105012 E.A. Davidson, D. Kanter, Inventories and scenarios of nitrous oxide emissions, Environ. Res. Lett.9 (2014). 10.1088/1748-9326/9/10/105012. [7] UNEP Drawing Down N2O to Protect Climate and the Ozone Layer. A UNEP Synthesis Report 2013 United Nations Environment Programme (UNEP Nairobi, Kenya UNEP, Drawing Down N2O to Protect Climate and the Ozone Layer. A UNEP Synthesis Report, United Nations Environment Programme (UNEP, Nairobi, Kenya, 2013. [8] M.D. Esrafili A.A. Khan P. Mousavian Synergic effects between boron and nitrogen atoms in BN-codoped C59-nBNnfullerenes (n = 1-3) for metal-free reduction of greenhouse N2O gas RSC Adv. 11 2021 10.1039/d1ra04046d M.D. Esrafili, A.A. Khan, P. Mousavian, Synergic effects between boron and nitrogen atoms in BN-codoped C59-nBNnfullerenes (n = 1-3) for metal-free reduction of greenhouse N2O gas, RSC Adv.11 (2021). 10.1039/d1ra04046d. [9] M. Konsolakis Recent advances on nitrous oxide (N2O) decomposition over non-noble-metal oxide catalysts: catalytic performance, mechanistic considerations, and surface chemistry aspects ACS Catal. 5 2015 10.1021/acscatal.5b01605 M. Konsolakis, Recent advances on nitrous oxide (N2O) decomposition over non-noble-metal oxide catalysts: catalytic performance, mechanistic considerations, and surface chemistry aspects, ACS Catal.5 (2015). 10.1021/acscatal.5b01605. [10] J. Liu L. Wang F. Okejiri J. Luo J. Zhao P. Zhang M. Liu S. Yang Z. Zhang W. Song W. Zhu J. Liu Z. Zhao G. Feng C. Xu S. Dai Deep understanding of strong metal interface confinement: a journey of Pd/FeOxCatalysts ACS Catal. 10 2020 10.1021/acscatal.0c01447 J. Liu, L. Wang, F. Okejiri, J. Luo, J. Zhao, P. Zhang, M. Liu, S. Yang, Z. Zhang, W. Song, W. Zhu, J. Liu, Z. Zhao, G. Feng, C. Xu, S. Dai, Deep understanding of strong metal interface confinement: a journey of Pd/FeOxCatalysts, ACS Catal.10 (2020). 10.1021/acscatal.0c01447. [11] G. Walther D.J. Mowbray T. Jiang G. Jones S. Jensen U.J. Quaade S. Horch Oxidation of CO and H2 by O2 and N2O on Au/TiO2 catalysts in microreactors J. Catal. 260 2008 10.1016/j.jcat.2008.09.003 G. Walther, D.J. Mowbray, T. Jiang, G. Jones, S. Jensen, U.J. Quaade, S. Horch, Oxidation of CO and H2 by O2 and N2O on Au/TiO2 catalysts in microreactors, J. Catal.260 (2008). 10.1016/j.jcat.2008.09.003. [12] M. Konsolakis C. Drosou I.V. Yentekakis Support mediated promotional effects of rare earth oxides (CeO2 and La2O3) on N2O decomposition and N2O reduction by CO or C3H6 over Pt/Al2O3 structured catalysts Appl. Catal. B Environ. 123–124 2012 10.1016/j.apcatb.2012.04.048 M. Konsolakis, C. Drosou, I.V. Yentekakis, Support mediated promotional effects of rare earth oxides (CeO2 and La2O3) on N2O decomposition and N2O reduction by CO or C3H6 over Pt/Al2O3 structured catalysts, Appl. Catal. B Environ.123–124 (2012). 10.1016/j.apcatb.2012.04.048. [13] X. Wei X.F. Yang A.Q. Wang L. Li X.Y. Liu T. Zhang C.Y. Mou J. Li Bimetallic Au-Pd alloy catalysts for N2O decomposition: effects of surface structures on catalytic activity J. Phys. Chem. C 116 2012 10.1021/jp210555s X. Wei, X.F. Yang, A.Q. Wang, L. Li, X.Y. Liu, T. Zhang, C.Y. Mou, J. Li, Bimetallic Au-Pd alloy catalysts for N2O decomposition: effects of surface structures on catalytic activity, J. Phys. Chem. C116 (2012). 10.1021/jp210555s. [14] R.R. Sadhankar D.T. Lynch N2O reduction by CO over an alumina-supported Pt catalyst: forced composition cycling J. Catal. 149 1994 10.1006/jcat.1994.1296 R.R. Sadhankar, D.T. Lynch, N2O reduction by CO over an alumina-supported Pt catalyst: forced composition cycling, J. Catal.149 (1994). 10.1006/jcat.1994.1296. [15] J.H. Holles M.A. Switzer R.J. Davis Influence of ceria and lanthana promoters on the kinetics of NO and N2O reduction by CO over alumina-supported palladium and rhodium J. Catal. 190 2000 10.1006/jcat.1999.2780 J.H. Holles, M.A. Switzer, R.J. Davis, Influence of ceria and lanthana promoters on the kinetics of NO and N2O reduction by CO over alumina-supported palladium and rhodium, J. Catal.190 (2000). 10.1006/jcat.1999.2780. [16] P. Nematollahi M.D. Esrafili A DFT study on the N2O reduction by CO molecule over silicon carbide nanotubes and nanosheets RSC Adv. 6 2016 10.1039/c6ra07548g P. Nematollahi, M.D. Esrafili, A DFT study on the N2O reduction by CO molecule over silicon carbide nanotubes and nanosheets, RSC Adv.6 (2016). 10.1039/c6ra07548g. [17] M.D. Esrafili BN co-doped graphene monolayers as promising metal-free catalysts for N2O reduction: a DFT study Chem. Phys. Lett. 705 2018 10.1016/j.cplett.2018.05.054 M.D. Esrafili, BN co-doped graphene monolayers as promising metal-free catalysts for N2O reduction: a DFT study, Chem. Phys. Lett.705 (2018). 10.1016/j.cplett.2018.05.054. [18] M.D. Esrafili N. Saeidi Carbon-doped boron nitride nanosheet as a promising catalyst for N2O reduction by CO or SO2 molecule: a comparative DFT study Appl. Surf. Sci. 444 2018 10.1016/j.apsusc.2018.03.107 M.D. Esrafili, N. Saeidi, Carbon-doped boron nitride nanosheet as a promising catalyst for N2O reduction by CO or SO2 molecule: a comparative DFT study, Appl. Surf. Sci.444 (2018). 10.1016/j.apsusc.2018.03.107. [19] A. Junkaew S. Namuangruk P. Maitarad M. Ehara Silicon-coordinated nitrogen-doped graphene as a promising metal-free catalyst for N2O reduction by CO: a theoretical study RSC Adv. 8 2018 10.1039/c8ra03265c A. Junkaew, S. Namuangruk, P. Maitarad, M. Ehara, Silicon-coordinated nitrogen-doped graphene as a promising metal-free catalyst for N2O reduction by CO: a theoretical study, RSC Adv.8 (2018). 10.1039/c8ra03265c. [20] P. Granger P. Malfoy P. Esteves L. Leclercq G. Leclercq Kinetics of the CO + N2O reaction over noble metals: I. Pt/Al2O3 J. Catal. 187 1999 10.1006/jcat.1999.2606 P. Granger, P. Malfoy, P. Esteves, L. Leclercq, G. Leclercq, Kinetics of the CO + N2O reaction over noble metals: I. Pt/Al2O3, J. Catal.187 (1999). 10.1006/jcat.1999.2606. [21] V.A. Kondratenko M. Baerns Mechanistic and kinetic insights into N2O decomposition over Pt gauze J. Catal. 225 2004 10.1016/j.jcat.2004.03.038 V.A. Kondratenko, M. Baerns, Mechanistic and kinetic insights into N2O decomposition over Pt gauze, J. Catal.225 (2004). 10.1016/j.jcat.2004.03.038. [22] M.D. Esrafili Epoxidation of ethylene over carbon and silicon-doped boron nitride sheets: a comparative DFT study Solid State Commun. 2018 284 286 10.1016/j.ssc.2018.09.007 M.D. Esrafili, Epoxidation of ethylene over carbon and silicon-doped boron nitride sheets: a comparative DFT study, Solid State Commun.284–286 (2018). 10.1016/j.ssc.2018.09.007. [23] H. Horino I. Rzeźnicka A. Kokalj I. Kobal Y. Ohno A. Hiratsuka T. Matsushima Two-directional N2 desorption in thermal dissociation of N2O on Rh(110), Ir(110), and Pd(110) at low temperatures J. Vac. Sci. Technol. A Vac. Surf. Film 20 2002 10.1116/1.1495507 H. Horino, I. Rzeźnicka, A. Kokalj, I. Kobal, Y. Ohno, A. Hiratsuka, T. Matsushima, Two-directional N2 desorption in thermal dissociation of N2O on Rh(110), Ir(110), and Pd(110) at low temperatures, J. Vac. Sci. Technol. A Vac. Surf. Film20 (2002). 10.1116/1.1495507. [24] S. Parres-Esclapez M.J. Illán-Gómez C.S.M. de Lecea A. Bueno-López On the importance of the catalyst redox properties in the N2O decomposition over alumina and ceria supported Rh, Pd and Pt Appl. Catal. B Environ. 96 2010 10.1016/j.apcatb.2010.02.034 S. Parres-Esclapez, M.J. Illán-Gómez, C.S.M. de Lecea, A. Bueno-López, On the importance of the catalyst redox properties in the N2O decomposition over alumina and ceria supported Rh, Pd and Pt, Appl. Catal. B Environ.96 (2010). 10.1016/j.apcatb.2010.02.034. [25] L. Yan X. Zhang T. Ren H. Zhang X. Wang J. Suo Superior performance of nano-Au supported over Co3O4 catalyst in direct N2O decomposition Chem. Commun. 8 2002 10.1039/b201237e L. Yan, X. Zhang, T. Ren, H. Zhang, X. Wang, J. Suo, Superior performance of nano-Au supported over Co3O4 catalyst in direct N2O decomposition, Chem. Commun.8 (2002). 10.1039/b201237e. [26] T.D. Chau T. Visart De Bocarmé N. Kruse Formation of N2O and (NO)2 during NO adsorption on Au 3D crystals Catal. Lett. 98 2004 85 87 10.1007/s10562-004-7918-4 T.D. Chau, T. Visart De Bocarmé, N. Kruse, Formation of N2O and (NO)2 during NO adsorption on Au 3D crystals, Catal. Lett. 98 (2004) 85–87, doi:10.1007/s10562-004-7918-4. [27] V.I. Sobolev L.V. Pirutko Room temperature reduction of N2O by CO over Au/TiO2 Catal. Commun. 18 2012 147 150 10.1016/j.catcom.2011.11.034 V.I. Sobolev, L.V. Pirutko, Room temperature reduction of N2O by CO over Au/TiO2, Catal. Commun.18 (2012) 147–150. 10.1016/j.catcom.2011.11.034. [28] R.P. Hardikar D. Das S.S. Han K.R. Lee A.K. Singh Boron doped defective graphene as a potential anode material for Li-ion batteries Phys. Chem. Chem. Phys. 16 2014 10.1039/c4cp01412j R.P. Hardikar, D. Das, S.S. Han, K.R. Lee, A.K. Singh, Boron doped defective graphene as a potential anode material for Li-ion batteries, Phys. Chem. Chem. Phys.16 (2014). 10.1039/c4cp01412j. [29] M. Nayebzadeh A.A. Peyghan H. Soleymanabadi Density functional study on the adsorption and dissociation of nitroamine over the nanosized tube of MgO Phys. E Low Dimens. Syst. Nanostruct. 62 2014 10.1016/j.physe.2014.04.016 M. Nayebzadeh, A.A. Peyghan, H. Soleymanabadi, Density functional study on the adsorption and dissociation of nitroamine over the nanosized tube of MgO, Phys. E Low Dimens. Syst. Nanostruct.62 (2014). 10.1016/j.physe.2014.04.016. [30] Y.J. Xing Z.H. Xi Z.Q. Xue X.D. Zhang J.H. Song R.M. Wang J. Xu Y. Song S.L. Zhang D.P. Yu Optical properties of the ZnO nanotubes synthesized via vapor phase growth Appl. Phys. Lett. 83 2003 10.1063/1.1605808 Y.J. Xing, Z.H. Xi, Z.Q. Xue, X.D. Zhang, J.H. Song, R.M. Wang, J. Xu, Y. Song, S.L. Zhang, D.P. Yu, Optical properties of the ZnO nanotubes synthesized via vapor phase growth, Appl. Phys. Lett.83 (2003). 10.1063/1.1605808. [31] A.A. Peyghan S.A. Aslanzadeh A. Samiei Ammonia borane reaction with a BN nanotube: a hydrogen storage route Monatsh. Chem. 145 2014 10.1007/s00706-014-1173-1 A.A. Peyghan, S.A. Aslanzadeh, A. Samiei, Ammonia borane reaction with a BN nanotube: a hydrogen storage route, Monatsh. Chem.145 (2014). 10.1007/s00706-014-1173-1. [32] D.G.L.W. Yin Y. Bando Y.C. Zhu M.S. Li C.C. Tang Single-crystalline AlN nanotubes with carbon-layer coatings on the outer and inner surfaces via a multiwalled-carbon-nanotube-template-induced route Adv. Mater. 17 2005 213 217 10.1002/adma.200400105 D.G.L.W. Yin, Y. Bando, Y.C. Zhu, M.S. Li, C.C. Tang, Single-crystalline AlN nanotubes with carbon-layer coatings on the outer and inner surfaces via a multiwalled-carbon-nanotube-template-induced route, Adv. Mater.17 (2005) 213–217. 10.1002/adma.200400105. [33] Z. Zhao Y. Yong Q. Zhou Y. Kuang X. Li Gas-sensing properties of the SiC monolayer and bilayer: a density functional theory study ACS Omega 5 2020 10.1021/acsomega.0c01084 Z. Zhao, Y. Yong, Q. Zhou, Y. Kuang, X. Li, Gas-sensing properties of the SiC monolayer and bilayer: a density functional theory study, ACS Omega5 (2020). 10.1021/acsomega.0c01084. [34] A. Hosseinian E.S. Khosroshahi K. Nejati E. Edjlali E. Vessally A DFT study on graphene, SiC, BN, and AlN nanosheets as anodes in Na-ion batteries J. Mol. Model. 23 2017 10.1007/s00894-017-3527-1 A. Hosseinian, E.S. Khosroshahi, K. Nejati, E. Edjlali, E. Vessally, A DFT study on graphene, SiC, BN, and AlN nanosheets as anodes in Na-ion batteries, J. Mol. Model.23 (2017). 10.1007/s00894-017-3527-1. [35] A.A. Khan R. Ahmad I. Ahmad Silicon carbide and III-Nitrides nanosheets: promising anodes for Mg-ion batteries Mater. Chem. Phys. 257 2021 10.1016/j.matchemphys.2020.123785 A.A. Khan, R. Ahmad, I. Ahmad, Silicon carbide and III-Nitrides nanosheets: promising anodes for Mg-ion batteries, Mater. Chem. Phys.257 (2021). 10.1016/j.matchemphys.2020.123785. [36] D. Wang L. Zhang D. Han L. Niu X. Zhong X. Qu L. Yang J. Zhao H. Li C-O bond activation and splitting behaviours of CO2 on a 4H-SiC surface: a DFT study Phys. Chem. Chem. Phys. 20 2018 10.1039/c8cp04438d D. Wang, L. Zhang, D. Han, L. Niu, X. Zhong, X. Qu, L. Yang, J. Zhao, H. Li, C-O bond activation and splitting behaviours of CO2 on a 4H-SiC surface: a DFT study, Phys. Chem. Chem. Phys.20 (2018). 10.1039/c8cp04438d. [37] P. Zhang B.B. Xiao X.L. Hou Y.F. Zhu Q. Jiang Layered SiC sheets: a potential catalyst for oxygen reduction reaction Sci. Rep. 4 2014 10.1038/srep03821 P. Zhang, B.B. Xiao, X.L. Hou, Y.F. Zhu, Q. Jiang, Layered SiC sheets: a potential catalyst for oxygen reduction reaction, Sci. Rep.4 (2014). 10.1038/srep03821. [38] N. Wang Y. Tian J. Zhao P. Jin CO oxidation catalyzed by silicon carbide (SiC) monolayer: a theoretical study J. Mol. Graph. Model. 66 2016 10.1016/j.jmgm.2016.04.009 N. Wang, Y. Tian, J. Zhao, P. Jin, CO oxidation catalyzed by silicon carbide (SiC) monolayer: a theoretical study, J. Mol. Graph. Model.66 (2016). 10.1016/j.jmgm.2016.04.009. [39] B. Delley An all-electron numerical method for solving the local density functional for polyatomic molecules J. Chem. Phys. 92 1990 508 517 10.1063/1.458452 B. Delley, An all-electron numerical method for solving the local density functional for polyatomic molecules, J. Chem. Phys.92 (1990) 508–517. 10.1063/1.458452. [40] B. Delley From molecules to solids with the DMol3 approach J. Chem. Phys. 113 2000 7756 7764 10.1063/1.1316015 B. Delley, From molecules to solids with the DMol3 approach, J. Chem. Phys.113 (2000) 7756–7764. 10.1063/1.1316015. [41] J.P. Perdew K. Burke M. Ernzerhof Generalized gradient approximation made simple Phys. Rev. Lett. 77 1996 3865 3868 10.1103/PhysRevLett.77.3865 J.P. Perdew, K. Burke, M. Ernzerhof, Generalized gradient approximation made simple, Phys. Rev. Lett.77 (1996) 3865–3868. 10.1103/PhysRevLett.77.3865. [42] S. Grimme Semiempirical GGA-type density functional constructed with a long-range dispersion correction J. Comput. Chem. 27 2006 1787 1799 10.1002/jcc.20495 S. Grimme, Semiempirical GGA-type density functional constructed with a long-range dispersion correction, J. Comput. Chem.27 (2006) 1787–1799. 10.1002/jcc.20495. [43] S. Grimme Accurate description of van der Waals complexes by density functional theory including empirical corrections J. Comput. Chem. 25 2004 1463 1473 10.1002/jcc.20078 S. Grimme, Accurate description of van der Waals complexes by density functional theory including empirical corrections, J. Comput. Chem.25 (2004) 1463–1473. 10.1002/jcc.20078. [44] R.D. Johnson III NIST Computational Chemistry Comparison and Benchmark Database 101 2020 NIST Standard Reference Data Number R.D. Johnson III, NIST Computational Chemistry Comparison and Benchmark Database, NIST Standard Reference Data Number 101. (2020). [45] N. Govind M. Petersen G. Fitzgerald D. King-Smith J. Andzelm A generalized synchronous transit method for transition state location Comput. Mater. Sci. 2003 10.1016/S0927-0256(03)00111-3 N. Govind, M. Petersen, G. Fitzgerald, D. King-Smith, J. Andzelm, A generalized synchronous transit method for transition state location, in: Comput. Mater. Sci., 2003. 10.1016/S0927-0256(03)00111-3. [46] H. Jónsson, G. Mills, K.W. Jacobsen, Nudged elastic band method for finding minimum energy paths of transitions, Classical and Quantum Dynamics in Condensed Phase Simulations (1998), chapter 16, pp. 385-404, World Scientific, doi:10.1142/9789812839664_0016. [47] M.S. Islam A.S.M.J. Islam O. Mahamud A. Saha N. Ferdous J. Park A. Hashimoto Molecular dynamics study of thermal transport in single-layer silicon carbide nanoribbons AIP Adv. 10 2020 10.1063/1.5131296 M.S. Islam, A.S.M.J. Islam, O. Mahamud, A. Saha, N. Ferdous, J. Park, A. Hashimoto, Molecular dynamics study of thermal transport in single-layer silicon carbide nanoribbons, AIP Adv.10 (2020). 10.1063/1.5131296. [48] A. Yaghoubi K. Masenelli-Varlot O. Boisron S. Ramesh P. Melinon Is graphitic silicon carbide (Silagraphene) stable? Chem. Mater. 30 2018 10.1021/acs.chemmater.8b03293 A. Yaghoubi, K. Masenelli-Varlot, O. Boisron, S. Ramesh, P. Melinon, Is graphitic silicon carbide (Silagraphene) stable?, Chem. Mater.30 (2018). 10.1021/acs.chemmater.8b03293. [49] S.S. Lin Light-emitting two-dimensional ultrathin silicon carbide J. Phys. Chem. C 116 2012 10.1021/jp210536m S.S. Lin, Light-emitting two-dimensional ultrathin silicon carbide, J. Phys. Chem. C116 (2012). 10.1021/jp210536m. [50] X. Yan Z. Xin J. Liu G. Yang L. Tian M. Yu The structural stability and the strain-induced electronic properties of α-Si1C7-graphyne like monolayer Comput. Mater. Sci. 135 2017 10.1016/j.commatsci.2017.04.002 X. Yan, Z. Xin, J. Liu, G. Yang, L. Tian, M. Yu, The structural stability and the strain-induced electronic properties of α-Si1C7-graphyne like monolayer, Comput. Mater. Sci.135 (2017). 10.1016/j.commatsci.2017.04.002. [51] M.D. Esrafili N2O + CO reaction over a single Si or P atom incorporated nitrogen-doped graphene: a comparative DFT study Chem. Phys. Lett. 708 2018 10.1016/j.cplett.2018.08.006 M.D. Esrafili, N2O + CO reaction over a single Si or P atom incorporated nitrogen-doped graphene: a comparative DFT study, Chem. Phys. Lett.708 (2018). 10.1016/j.cplett.2018.08.006. [52] M.D. Esrafili S. Asadollahi S. Heydari A DFT study on NO reduction to N2O using Al- and P-doped hexagonal boron nitride nanosheets J. Mol. Graph. Model. 89 2019 10.1016/j.jmgm.2019.02.013 M.D. Esrafili, S. Asadollahi, S. Heydari, A DFT study on NO reduction to N2O using Al- and P-doped hexagonal boron nitride nanosheets, J. Mol. Graph. Model.89 (2019). 10.1016/j.jmgm.2019.02.013. [53] M.D. Esrafili H. Janebi P. Mousavian Single Al atom anchored on defective MoS2: an efficient catalytic site for reduction of greenhouse N2O gas by CO or C2H4 molecules Appl. Surf. Sci. 569 2021 10.1016/j.apsusc.2021.151001 M.D. Esrafili, H. Janebi, P. Mousavian, Single Al atom anchored on defective MoS2: an efficient catalytic site for reduction of greenhouse N2O gas by CO or C2H4 molecules, Appl. Surf. Sci.569 (2021). 10.1016/j.apsusc.2021.151001. [54] P. Mousavian M.D. Esrafili Methane oxidation into methanol catalyzed by TM-anchored C24N24 nanoclusters (TM = Fe, Co and Ni): a DFT study Inorg. Chem. Commun. 2020 122 10.1016/j.inoche.2020.108317 P. Mousavian, M.D. Esrafili, Methane oxidation into methanol catalyzed by TM-anchored C24N24 nanoclusters (TM = Fe, Co and Ni): a DFT study, Inorg. Chem. Commun.122 (2020). 10.1016/j.inoche.2020.108317. [55] M.D. Esrafili S. Heydari C 59X heterofullerenes (X= N, B, Si, P and S) as catalysts for reduction of N2O: a comparative DFT study Electro, Phys. Theor. Chem. 4 2019 2267 2274 10.1002/slct.201803541 M.D. Esrafili and S. Heydari, C 59X heterofullerenes (X= N, B, Si, P and S) as catalysts for reduction of N2O: a comparative DFT study, Electro, Phys. Theor. Chem.4 (2019) 2267–2274. 10.1002/slct.201803541. [56] M.D. Esrafili M. Vatanzadeh Si-coordinated nitrogen doped graphene: a robust and highly active catalyst for NO + CO reaction Appl. Surf. Sci. 494 2019 10.1016/j.apsusc.2019.07.217 M.D. Esrafili, M. Vatanzadeh, Si-coordinated nitrogen doped graphene: a robust and highly active catalyst for NO + CO reaction, Appl. Surf. Sci.494 (2019). 10.1016/j.apsusc.2019.07.217. [57] M.D. Esrafili S. Asadollahi A comparative DFT study on single-atom catalysis of CO oxidation over Al- and P-embedded hexagonal boron-nitride nanosheets J. Mol. Graph. Model. 85 2018 10.1016/j.jmgm.2018.09.012 M.D. Esrafili, S. Asadollahi, A comparative DFT study on single-atom catalysis of CO oxidation over Al- and P-embedded hexagonal boron-nitride nanosheets, J. Mol. Graph. Model.85 (2018). 10.1016/j.jmgm.2018.09.012. [58] H. Hamadi E. Shakerzadeh M.D. Esrafili A DFT study on the potential application of Si@C24N24 porous fullerene as an innovative and highly active catalyst for NO reduction Chem. Phys. Lett. 724 2019 10.1016/j.cplett.2019.03.057 H. Hamadi, E. Shakerzadeh, M.D. Esrafili, A DFT study on the potential application of Si@C24N24 porous fullerene as an innovative and highly active catalyst for NO reduction, Chem. Phys. Lett.724 (2019). 10.1016/j.cplett.2019.03.057. [59] D. Tang C. Hu DFT insight into CO oxidation catalyzed by gold nanoclusters: charge effect and multi-state reactivity J. Phys. Chem. Lett. 2 2011 10.1021/jz201290x D. Tang, C. Hu, DFT insight into CO oxidation catalyzed by gold nanoclusters: charge effect and multi-state reactivity, J. Phys. Chem. Lett.2 (2011). 10.1021/jz201290x. [60] D. Tang Z. Chen J. Hu G. Sun S. Lu C. Hu CO oxidation catalyzed by silver nanoclusters: mechanism and effects of charge Phys. Chem. Chem. Phys. 14 2012 10.1039/c2cp41845b D. Tang, Z. Chen, J. Hu, G. Sun, S. Lu, C. Hu, CO oxidation catalyzed by silver nanoclusters: mechanism and effects of charge, Phys. Chem. Chem. Phys.14 (2012). 10.1039/c2cp41845b. [61] X.Q. Gong Z.P. Liu R. Raval P. Hu A systematic study of CO oxidation on metals and metal oxides: density functional theory calculations J. Am. Chem. Soc. 126 2004 10.1021/ja030392k X.Q. Gong, Z.P. Liu, R. Raval, P. Hu, A systematic study of CO oxidation on metals and metal oxides: density functional theory calculations, J. Am. Chem. Soc.126 (2004). 10.1021/ja030392k.",
      "scopus-id": "85131442374",
      "coredata": {
        "eid": "1-s2.0-S2468823122002784",
        "dc:description": "In this work, spin-polarized density functional theory calculations are conducted to evaluate the possible applicability of a single P atom doped silicon carbide (P-SiC) monolayer for reduction of nitrous oxide (N2O). The calculations show that P-doping in SiC monolayer is energetically favorable, and the resulting P-SiC is both dynamically and thermodynamically stable. According to our findings, N2O spontaneously dissociates when it interacts with the P-SiC from its O site without the need for an energy barrier, releasing -2.59 eV of energy. The adsorption energy of CO molecule on the P-SiC is less negative than that of N2O, implying that N2O will predominately occupy the catalyst surface. The CO + Oad reaction is used to remove the remaining oxygen atom (Oad) from the P-SiC surface. The calculations show that the reaction proceeds through a low activation energy barrier of 0.33 eV, which is much lower than the previously reported catalysts. This demonstrates the high catalytic activity of P-SiC surface. Furthermore, the adsorption of H2O and O2 species on the P-SiC nanosheet is investigated. The results show that the presence of these species has no effect on the catalytic activity of the P-SiC surface for N2O reduction. These results show that the proposed novel P-SiC catalyst can be regarded as an efficient material in the development of promising active catalysts for N2O elimination from the environment.",
        "openArchiveArticle": "false",
        "prism:coverDate": "2022-07-31",
        "openaccessUserLicense": null,
        "prism:aggregationType": "Journal",
        "prism:url": "https://api.elsevier.com/content/article/pii/S2468823122002784",
        "dc:creator": [
          {
            "@_fa": "true",
            "$": "Khan, Adnan Ali"
          },
          {
            "@_fa": "true",
            "$": "Ahmad, Ashfaq"
          },
          {
            "@_fa": "true",
            "$": "Al-Swaidan, Hassan M."
          },
          {
            "@_fa": "true",
            "$": "Haider, Sajjad"
          },
          {
            "@_fa": "true",
            "$": "Akhtar, Muhammad Saeed"
          },
          {
            "@_fa": "true",
            "$": "Khan, Salah Uddin"
          }
        ],
        "link": [
          {
            "@_fa": "true",
            "@rel": "self",
            "@href": "https://api.elsevier.com/content/article/pii/S2468823122002784"
          },
          {
            "@_fa": "true",
            "@rel": "scidir",
            "@href": "https://www.sciencedirect.com/science/article/pii/S2468823122002784"
          }
        ],
        "dc:format": "application/json",
        "openaccessType": null,
        "pii": "S2468-8231(22)00278-4",
        "prism:volume": "527",
        "articleNumber": "112392",
        "prism:publisher": "Elsevier B.V.",
        "dc:title": "Density functional theory study of P-embedded SiC monolayer as a robust metal free catalyst for N2O reduction and CO oxidation",
        "prism:copyright": "© 2022 Elsevier B.V. All rights reserved.",
        "openaccess": "0",
        "prism:issn": "24688231",
        "dcterms:subject": [
          {
            "@_fa": "true",
            "$": "Density functional theory"
          },
          {
            "@_fa": "true",
            "$": "P-SiC surface"
          },
          {
            "@_fa": "true",
            "$": "N2O"
          },
          {
            "@_fa": "true",
            "$": "Dissociation"
          },
          {
            "@_fa": "true",
            "$": "Energy barrier"
          }
        ],
        "openaccessArticle": "false",
        "prism:publicationName": "Molecular Catalysis",
        "openaccessSponsorType": null,
        "prism:pageRange": "112392",
        "pubType": "fla",
        "prism:coverDisplayDate": "July 2022",
        "prism:doi": "10.1016/j.mcat.2022.112392",
        "prism:startingPage": "112392",
        "dc:identifier": "doi:10.1016/j.mcat.2022.112392",
        "openaccessSponsorName": null
      },
      "objects": {
        "object": [
          {
            "@category": "standard",
            "@height": "399",
            "@width": "715",
            "@_fa": "true",
            "$": "https://api.elsevier.com/content/object/eid/1-s2.0-S2468823122002784-gr5.jpg?httpAccept=%2A%2F%2A",
            "@multimediatype": "JPEG image file",
            "@type": "IMAGE-DOWNSAMPLED",
            "@size": "83283",
            "@ref": "gr5",
            "@mimetype": "image/jpeg"
          },
          {
            "@category": "standard",
            "@height": "415",
            "@width": "809",
            "@_fa": "true",
            "$": "https://api.elsevier.com/content/object/eid/1-s2.0-S2468823122002784-gr6.jpg?httpAccept=%2A%2F%2A",
            "@multimediatype": "JPEG image file",
            "@type": "IMAGE-DOWNSAMPLED",
            "@size": "55699",
            "@ref": "gr6",
            "@mimetype": "image/jpeg"
          },
          {
            "@category": "standard",
            "@height": "457",
            "@width": "809",
            "@_fa": "true",
            "$": "https://api.elsevier.com/content/object/eid/1-s2.0-S2468823122002784-gr7.jpg?httpAccept=%2A%2F%2A",
            "@multimediatype": "JPEG image file",
            "@type": "IMAGE-DOWNSAMPLED",
            "@size": "76673",
            "@ref": "gr7",
            "@mimetype": "image/jpeg"
          },
          {
            "@category": "standard",
            "@height": "563",
            "@width": "809",
            "@_fa": "true",
            "$": "https://api.elsevier.com/content/object/eid/1-s2.0-S2468823122002784-gr8.jpg?httpAccept=%2A%2F%2A",
            "@multimediatype": "JPEG image file",
            "@type": "IMAGE-DOWNSAMPLED",
            "@size": "87094",
            "@ref": "gr8",
            "@mimetype": "image/jpeg"
          },
          {
            "@category": "standard",
            "@height": "237",
            "@width": "301",
            "@_fa": "true",
            "$": "https://api.elsevier.com/content/object/eid/1-s2.0-S2468823122002784-gr9.jpg?httpAccept=%2A%2F%2A",
            "@multimediatype": "JPEG image file",
            "@type": "IMAGE-DOWNSAMPLED",
            "@size": "31322",
            "@ref": "gr9",
            "@mimetype": "image/jpeg"
          },
          {
            "@category": "standard",
            "@height": "354",
            "@width": "809",
            "@_fa": "true",
            "$": "https://api.elsevier.com/content/object/eid/1-s2.0-S2468823122002784-gr1.jpg?httpAccept=%2A%2F%2A",
            "@multimediatype": "JPEG image file",
            "@type": "IMAGE-DOWNSAMPLED",
            "@size": "73175",
            "@ref": "gr1",
            "@mimetype": "image/jpeg"
          },
          {
            "@category": "standard",
            "@height": "502",
            "@width": "809",
            "@_fa": "true",
            "$": "https://api.elsevier.com/content/object/eid/1-s2.0-S2468823122002784-gr2.jpg?httpAccept=%2A%2F%2A",
            "@multimediatype": "JPEG image file",
            "@type": "IMAGE-DOWNSAMPLED",
            "@size": "128231",
            "@ref": "gr2",
            "@mimetype": "image/jpeg"
          },
          {
            "@category": "standard",
            "@height": "190",
            "@width": "301",
            "@_fa": "true",
            "$": "https://api.elsevier.com/content/object/eid/1-s2.0-S2468823122002784-ga1.jpg?httpAccept=%2A%2F%2A",
            "@multimediatype": "JPEG image file",
            "@type": "IMAGE-DOWNSAMPLED",
            "@size": "34322",
            "@ref": "ga1",
            "@mimetype": "image/jpeg"
          },
          {
            "@category": "standard",
            "@height": "309",
            "@width": "809",
            "@_fa": "true",
            "$": "https://api.elsevier.com/content/object/eid/1-s2.0-S2468823122002784-gr3.jpg?httpAccept=%2A%2F%2A",
            "@multimediatype": "JPEG image file",
            "@type": "IMAGE-DOWNSAMPLED",
            "@size": "61941",
            "@ref": "gr3",
            "@mimetype": "image/jpeg"
          },
          {
            "@category": "standard",
            "@height": "539",
            "@width": "809",
            "@_fa": "true",
            "$": "https://api.elsevier.com/content/object/eid/1-s2.0-S2468823122002784-gr4.jpg?httpAccept=%2A%2F%2A",
            "@multimediatype": "JPEG image file",
            "@type": "IMAGE-DOWNSAMPLED",
            "@size": "124387",
            "@ref": "gr4",
            "@mimetype": "image/jpeg"
          },
          {
            "@category": "thumbnail",
            "@height": "122",
            "@width": "219",
            "@_fa": "true",
            "$": "https://api.elsevier.com/content/object/eid/1-s2.0-S2468823122002784-gr5.sml?httpAccept=%2A%2F%2A",
            "@multimediatype": "GIF image file",
            "@type": "IMAGE-THUMBNAIL",
            "@size": "11961",
            "@ref": "gr5",
            "@mimetype": "image/gif"
          },
          {
            "@category": "thumbnail",
            "@height": "112",
            "@width": "219",
            "@_fa": "true",
            "$": "https://api.elsevier.com/content/object/eid/1-s2.0-S2468823122002784-gr6.sml?httpAccept=%2A%2F%2A",
            "@multimediatype": "GIF image file",
            "@type": "IMAGE-THUMBNAIL",
            "@size": "7145",
            "@ref": "gr6",
            "@mimetype": "image/gif"
          },
          {
            "@category": "thumbnail",
            "@height": "124",
            "@width": "219",
            "@_fa": "true",
            "$": "https://api.elsevier.com/content/object/eid/1-s2.0-S2468823122002784-gr7.sml?httpAccept=%2A%2F%2A",
            "@multimediatype": "GIF image file",
            "@type": "IMAGE-THUMBNAIL",
            "@size": "8689",
            "@ref": "gr7",
            "@mimetype": "image/gif"
          },
          {
            "@category": "thumbnail",
            "@height": "152",
            "@width": "219",
            "@_fa": "true",
            "$": "https://api.elsevier.com/content/object/eid/1-s2.0-S2468823122002784-gr8.sml?httpAccept=%2A%2F%2A",
            "@multimediatype": "GIF image file",
            "@type": "IMAGE-THUMBNAIL",
            "@size": "10567",
            "@ref": "gr8",
            "@mimetype": "image/gif"
          },
          {
            "@category": "thumbnail",
            "@height": "164",
            "@width": "208",
            "@_fa": "true",
            "$": "https://api.elsevier.com/content/object/eid/1-s2.0-S2468823122002784-gr9.sml?httpAccept=%2A%2F%2A",
            "@multimediatype": "GIF image file",
            "@type": "IMAGE-THUMBNAIL",
            "@size": "13762",
            "@ref": "gr9",
            "@mimetype": "image/gif"
          },
          {
            "@category": "thumbnail",
            "@height": "96",
            "@width": "219",
            "@_fa": "true",
            "$": "https://api.elsevier.com/content/object/eid/1-s2.0-S2468823122002784-gr1.sml?httpAccept=%2A%2F%2A",
            "@multimediatype": "GIF image file",
            "@type": "IMAGE-THUMBNAIL",
            "@size": "9588",
            "@ref": "gr1",
            "@mimetype": "image/gif"
          },
          {
            "@category": "thumbnail",
            "@height": "136",
            "@width": "219",
            "@_fa": "true",
            "$": "https://api.elsevier.com/content/object/eid/1-s2.0-S2468823122002784-gr2.sml?httpAccept=%2A%2F%2A",
            "@multimediatype": "GIF image file",
            "@type": "IMAGE-THUMBNAIL",
            "@size": "14520",
            "@ref": "gr2",
            "@mimetype": "image/gif"
          },
          {
            "@category": "thumbnail",
            "@height": "138",
            "@width": "219",
            "@_fa": "true",
            "$": "https://api.elsevier.com/content/object/eid/1-s2.0-S2468823122002784-ga1.sml?httpAccept=%2A%2F%2A",
            "@multimediatype": "GIF image file",
            "@type": "IMAGE-THUMBNAIL",
            "@size": "15230",
            "@ref": "ga1",
            "@mimetype": "image/gif"
          },
          {
            "@category": "thumbnail",
            "@height": "84",
            "@width": "219",
            "@_fa": "true",
            "$": "https://api.elsevier.com/content/object/eid/1-s2.0-S2468823122002784-gr3.sml?httpAccept=%2A%2F%2A",
            "@multimediatype": "GIF image file",
            "@type": "IMAGE-THUMBNAIL",
            "@size": "8250",
            "@ref": "gr3",
            "@mimetype": "image/gif"
          },
          {
            "@category": "thumbnail",
            "@height": "146",
            "@width": "219",
            "@_fa": "true",
            "$": "https://api.elsevier.com/content/object/eid/1-s2.0-S2468823122002784-gr4.sml?httpAccept=%2A%2F%2A",
            "@multimediatype": "GIF image file",
            "@type": "IMAGE-THUMBNAIL",
            "@size": "14126",
            "@ref": "gr4",
            "@mimetype": "image/gif"
          },
          {
            "@category": "high",
            "@height": "1767",
            "@width": "3167",
            "@_fa": "true",
            "$": "https://api.elsevier.com/content/object/eid/1-s2.0-S2468823122002784-gr5_lrg.jpg?httpAccept=%2A%2F%2A",
            "@multimediatype": "JPEG image file",
            "@type": "IMAGE-HIGH-RES",
            "@size": "548139",
            "@ref": "gr5",
            "@mimetype": "image/jpeg"
          },
          {
            "@category": "high",
            "@height": "1838",
            "@width": "3583",
            "@_fa": "true",
            "$": "https://api.elsevier.com/content/object/eid/1-s2.0-S2468823122002784-gr6_lrg.jpg?httpAccept=%2A%2F%2A",
            "@multimediatype": "JPEG image file",
            "@type": "IMAGE-HIGH-RES",
            "@size": "387895",
            "@ref": "gr6",
            "@mimetype": "image/jpeg"
          },
          {
            "@category": "high",
            "@height": "2025",
            "@width": "3583",
            "@_fa": "true",
            "$": "https://api.elsevier.com/content/object/eid/1-s2.0-S2468823122002784-gr7_lrg.jpg?httpAccept=%2A%2F%2A",
            "@multimediatype": "JPEG image file",
            "@type": "IMAGE-HIGH-RES",
            "@size": "523495",
            "@ref": "gr7",
            "@mimetype": "image/jpeg"
          },
          {
            "@category": "high",
            "@height": "2495",
            "@width": "3583",
            "@_fa": "true",
            "$": "https://api.elsevier.com/content/object/eid/1-s2.0-S2468823122002784-gr8_lrg.jpg?httpAccept=%2A%2F%2A",
            "@multimediatype": "JPEG image file",
            "@type": "IMAGE-HIGH-RES",
            "@size": "598800",
            "@ref": "gr8",
            "@mimetype": "image/jpeg"
          },
          {
            "@category": "high",
            "@height": "1050",
            "@width": "1333",
            "@_fa": "true",
            "$": "https://api.elsevier.com/content/object/eid/1-s2.0-S2468823122002784-gr9_lrg.jpg?httpAccept=%2A%2F%2A",
            "@multimediatype": "JPEG image file",
            "@type": "IMAGE-HIGH-RES",
            "@size": "223748",
            "@ref": "gr9",
            "@mimetype": "image/jpeg"
          },
          {
            "@category": "high",
            "@height": "1568",
            "@width": "3583",
            "@_fa": "true",
            "$": "https://api.elsevier.com/content/object/eid/1-s2.0-S2468823122002784-gr1_lrg.jpg?httpAccept=%2A%2F%2A",
            "@multimediatype": "JPEG image file",
            "@type": "IMAGE-HIGH-RES",
            "@size": "471075",
            "@ref": "gr1",
            "@mimetype": "image/jpeg"
          },
          {
            "@category": "high",
            "@height": "2225",
            "@width": "3583",
            "@_fa": "true",
            "$": "https://api.elsevier.com/content/object/eid/1-s2.0-S2468823122002784-gr2_lrg.jpg?httpAccept=%2A%2F%2A",
            "@multimediatype": "JPEG image file",
            "@type": "IMAGE-HIGH-RES",
            "@size": "870190",
            "@ref": "gr2",
            "@mimetype": "image/jpeg"
          },
          {
            "@category": "high",
            "@height": "840",
            "@width": "1333",
            "@_fa": "true",
            "$": "https://api.elsevier.com/content/object/eid/1-s2.0-S2468823122002784-ga1_lrg.jpg?httpAccept=%2A%2F%2A",
            "@multimediatype": "JPEG image file",
            "@type": "IMAGE-HIGH-RES",
            "@size": "300359",
            "@ref": "ga1",
            "@mimetype": "image/jpeg"
          },
          {
            "@category": "high",
            "@height": "1368",
            "@width": "3583",
            "@_fa": "true",
            "$": "https://api.elsevier.com/content/object/eid/1-s2.0-S2468823122002784-gr3_lrg.jpg?httpAccept=%2A%2F%2A",
            "@multimediatype": "JPEG image file",
            "@type": "IMAGE-HIGH-RES",
            "@size": "404089",
            "@ref": "gr3",
            "@mimetype": "image/jpeg"
          },
          {
            "@category": "high",
            "@height": "2385",
            "@width": "3583",
            "@_fa": "true",
            "$": "https://api.elsevier.com/content/object/eid/1-s2.0-S2468823122002784-gr4_lrg.jpg?httpAccept=%2A%2F%2A",
            "@multimediatype": "JPEG image file",
            "@type": "IMAGE-HIGH-RES",
            "@size": "1048344",
            "@ref": "gr4",
            "@mimetype": "image/jpeg"
          },
          {
            "@category": "standard",
            "@_fa": "true",
            "$": "https://api.elsevier.com/content/object/eid/1-s2.0-S2468823122002784-mmc1.docx?httpAccept=%2A%2F%2A",
            "@multimediatype": "Microsoft Word file",
            "@type": "APPLICATION",
            "@size": "1567207",
            "@ref": "mmc1",
            "@mimetype": "application/word"
          },
          {
            "@category": "standard",
            "@_fa": "true",
            "$": "https://api.elsevier.com/content/object/eid/1-s2.0-S2468823122002784-am.pdf?httpAccept=%2A%2F%2A",
            "@multimediatype": "Acrobat PDF file",
            "@type": "AAM-PDF",
            "@size": "1984509",
            "@ref": "am",
            "@mimetype": "application/pdf"
          }
        ]
      },
      "link": {
        "@rel": "abstract",
        "@href": "https://api.elsevier.com/content/abstract/scopus_id/85131442374"
      }
    }
  }
}