{
  "metadata": {
    "title": "Environmentally friendly high-efficient metal-free catalyst for acetylene hydrochlorination derived from walnut shell-based N-doped biochar",
    "authors": "; ; ",
    "journal": "Molecular Catalysis",
    "date": "2022-11-30",
    "doi": "10.1016/j.mcat.2022.112719",
    "abstract": "",
    "uri": "https://api.elsevier.com/content/article/pii/S2468823122006058",
    "pii": "S2468823122006058"
  },
  "fulltext": {
    "full-text-retrieval-response": {
      "scopus-eid": "2-s2.0-85139858678",
      "originalText": "serial JL 315758 291210 291744 291790 291809 31 Molecular Catalysis MOLECULARCATALYSIS 2022-10-14 2022-10-14 2022-10-14 2022-10-14 2023-02-17T16:11:58 1-s2.0-S2468823122006058 S2468-8231(22)00605-8 S2468823122006058 10.1016/j.mcat.2022.112719 S300 S300.1 FULL-TEXT 1-s2.0-S2468823122X00151 2024-06-26T17:47:42.363978Z 0 0 20221101 20221130 2022 2022-10-14T07:17:06.785863Z absattachment articleinfo articlenumber articletitlenorm authfirstinitialnorm authfirstsurnamenorm cid cids contenttype copyright crossmark dateloaded dateloadedtxt datesearch datesort dateupdated dco docsubtype doctype doi eid ewtransactionid hubeid indexeddate issn issnnorm itemstage itemtransactionid itemweight openaccess openarchive pg pgfirst pii piinorm pubdateend pubdatestart pubdatetxt pubyr sectiontitle sortorder srctitle srctitlenorm srctype ssids alllist content subj subheadings suppl tomb volfirst volissue volumelist webpdf webpdfpagecount yearnav figure table e-component body acknowledge affil appendices articletitle auth authfirstini authfull authkeywords authlast grantnumber grantsponsor grantsponsorid highlightsabst primabst ref specialabst 2468-8231 24688231 true 532 532 C Volume 532 16 112719 112719 112719 202211 November 2022 2022-11-01 2022-11-30 2022 Regular Papers article fla © 2022 Elsevier B.V. All rights reserved. ENVIRONMENTALLYFRIENDLYHIGHEFFICIENTMETALFREECATALYSTFORACETYLENEHYDROCHLORINATIONDERIVEDWALNUTSHELLBASEDNDOPEDBIOCHAR WU S 1 Introduction 2 Experimental 2.1 Materials 2.2 Catalyst fabrication 2.3 Characterization 2.4 Catalytic experiment 3 Results and discussion 3.1 Catalytic performance of BC-T 3.2 Catalytic performance of xD/BC-850 and xDF/BC-850 3.3 Catalyst characterization 4 Conclusions CRediT authorship contribution statement Acknowledgments Appendix Supplementary materials References YAN 2012 33 47 B MALTA 2017 11733 11746 G LIU 2020 106147 106151 X SHINODA 1975 219 220 K HUTCHINGS 1985 292 295 G YE 2019 914 L HU 2018 45 48 D DONG 2016 177 184 Y PU 2014 4426 4432 Y WANG 2017 1069 1075 L WANG 2020 1683 1691 X DONG 2016 7946 7955 Y KE 2017 1083 1091 J HUANG 2014 61 65 C LI 2020 117431 117440 J LI 2018 1770 1781 H ZHAO 2017 175 183 J ZHAO 2016 3263 3270 J QI 2019 21931 21938 X WANG 2021 9 14 B SHANG 2017 3510 3520 S LI 2017 220 227 Y HAN 2020 205 213 Y DAI 2015 472 478 B ZHAO 2015 1152 1160 J LIU 2018 1664 1671 J KAISER 2019 2 10 S WANG 2019 110612 110622 Y HU 2020 117408 117417 Y HU 2018 1413 1416 D LIAN 2020 14961 14968 L LIU 2020 1218 1246 Y ZHONG 2018 2412 2427 J ASAHI 2001 269 271 R LI 2014 131 135 X YANG 2016 1242 1248 Y LIU 2018 20131 20136 W LI 2017 4913 4926 X CHAO 2017 39789 S LI 2016 146 154 X LIN 2018 1114 1121 R QIAO 2021 2327 2339 X LU 2020 198 203 Y MEI 2019 118 129 S LAN 2018 623 626 G SHEN 2020 14556 14569 Z JIA 2020 12743 12756 L WANG 2020 2908 2920 H ZHANG 2014 69 73 Y WU 2021 1 9 C WANG 2018 72 78 J HU 2021 105221 Y HAMEED 2016 39 45 N ZHAN 2019 012004 H GODINOSALIDO 2014 1489 1499 M HUAI 2021 1217 1229 X DONG 2019 1900015 Y HULICOVAJURCAKOVA 2009 438 447 D LI 2015 310 319 M HORIKAWA 2012 1833 1842 T DONG 2018 161 170 X WANG 2020 20995 20999 B LI 2017 116 120 X ZHANG 2016 56 64 H WUX2022X112719 WUX2022X112719XS 2024-10-14T00:00:00.000Z 2024-10-14T00:00:00.000Z http://creativecommons.org/licenses/by-nc-nd/4.0/ © 2022 Elsevier B.V. All rights reserved. 2022-10-21T07:34:57.523Z http://vtw.elsevier.com/data/voc/AddOnTypes/50.7/aggregated-refined Education Department of Henan Province 22A430008 Education Department of Henan Province http://data.elsevier.com/vocabulary/SciValFunders/501100009101 http://sws.geonames.org/1814991/ Henan Province 19030020 ZZU Zhengzhou University http://data.elsevier.com/vocabulary/SciValFunders/501100004605 http://sws.geonames.org/1814991 We greatly thank the financial support from the postdoctoral research grant in Henan Province ( 19030020 ) and the Science & Technology Key Project by Education Department of Henan Province ( 22A430008 ). 0 https://doi.org/10.15223/policy-017 https://doi.org/10.15223/policy-037 https://doi.org/10.15223/policy-012 https://doi.org/10.15223/policy-029 https://doi.org/10.15223/policy-004 item S2468-8231(22)00605-8 S2468823122006058 1-s2.0-S2468823122006058 10.1016/j.mcat.2022.112719 315758 2023-02-17T18:49:41.149798Z 2022-11-01 2022-11-30 1-s2.0-S2468823122006058-main.pdf https://s3-eu-west-1.amazonaws.com/prod-ucs-content-store-eu-west/content/pii:S2468823122006058/MAIN/application/pdf/b330ac1f94ba5f861ea8032b452326b3/main.pdf main.pdf pdf true 4112893 MAIN 9 1-s2.0-S2468823122006058-main_1.png https://s3-eu-west-1.amazonaws.com/prod-ucs-content-store-eu-west/content/pii:S2468823122006058/PREVIEW/image/png/6d066e33b25db0151c7ff7d445160a9b/main_1.png main_1.png png 60169 849 656 IMAGE-WEB-PDF 1 1-s2.0-S2468823122006058-gr5.jpg https://s3-eu-west-1.amazonaws.com/prod-ucs-content-store-eu-west/content/pii:S2468823122006058/gr5/DOWNSAMPLED/image/jpeg/b401e790fab8fe021e1e57a0fb4afb69/gr5.jpg gr5 gr5.jpg jpg 85075 423 565 IMAGE-DOWNSAMPLED 1-s2.0-S2468823122006058-gr6.jpg https://s3-eu-west-1.amazonaws.com/prod-ucs-content-store-eu-west/content/pii:S2468823122006058/gr6/DOWNSAMPLED/image/jpeg/10157ee2f1e9ef7521c2e2edbef8f839/gr6.jpg gr6 gr6.jpg jpg 112858 465 565 IMAGE-DOWNSAMPLED 1-s2.0-S2468823122006058-gr7.jpg https://s3-eu-west-1.amazonaws.com/prod-ucs-content-store-eu-west/content/pii:S2468823122006058/gr7/DOWNSAMPLED/image/jpeg/be094728cb3559b4226c23336e632bd6/gr7.jpg gr7 gr7.jpg jpg 32503 327 339 IMAGE-DOWNSAMPLED 1-s2.0-S2468823122006058-gr8.jpg https://s3-eu-west-1.amazonaws.com/prod-ucs-content-store-eu-west/content/pii:S2468823122006058/gr8/DOWNSAMPLED/image/jpeg/0c191fcc51fb49d8924508b56ad1995c/gr8.jpg gr8 gr8.jpg jpg 51705 201 565 IMAGE-DOWNSAMPLED 1-s2.0-S2468823122006058-gr1.jpg https://s3-eu-west-1.amazonaws.com/prod-ucs-content-store-eu-west/content/pii:S2468823122006058/gr1/DOWNSAMPLED/image/jpeg/aa2cd4116d182d31c5ce0a33ea97cec3/gr1.jpg gr1 gr1.jpg jpg 45720 200 489 IMAGE-DOWNSAMPLED 1-s2.0-S2468823122006058-gr2.jpg https://s3-eu-west-1.amazonaws.com/prod-ucs-content-store-eu-west/content/pii:S2468823122006058/gr2/DOWNSAMPLED/image/jpeg/b2aba581d881005e71201521ba1f1deb/gr2.jpg gr2 gr2.jpg jpg 45032 210 565 IMAGE-DOWNSAMPLED 1-s2.0-S2468823122006058-ga1.jpg https://s3-eu-west-1.amazonaws.com/prod-ucs-content-store-eu-west/content/pii:S2468823122006058/ga1/DOWNSAMPLED/image/jpeg/89463b5c5da5163dc54cc0594fcda8fb/ga1.jpg ga1 true ga1.jpg jpg 19412 166 301 IMAGE-DOWNSAMPLED 1-s2.0-S2468823122006058-gr3.jpg https://s3-eu-west-1.amazonaws.com/prod-ucs-content-store-eu-west/content/pii:S2468823122006058/gr3/DOWNSAMPLED/image/jpeg/c227ad96658ff0aee788946530881cea/gr3.jpg gr3 gr3.jpg jpg 42456 223 565 IMAGE-DOWNSAMPLED 1-s2.0-S2468823122006058-gr4.jpg https://s3-eu-west-1.amazonaws.com/prod-ucs-content-store-eu-west/content/pii:S2468823122006058/gr4/DOWNSAMPLED/image/jpeg/dc3139e08cea0827b371eb2147370d89/gr4.jpg gr4 gr4.jpg jpg 37257 184 565 IMAGE-DOWNSAMPLED 1-s2.0-S2468823122006058-sc1.jpg https://s3-eu-west-1.amazonaws.com/prod-ucs-content-store-eu-west/content/pii:S2468823122006058/sc1/DOWNSAMPLED/image/jpeg/a023d370d7a01735ba31d90e84ba4c3e/sc1.jpg sc1 sc1.jpg jpg 39597 252 565 IMAGE-DOWNSAMPLED 1-s2.0-S2468823122006058-gr5.sml https://s3-eu-west-1.amazonaws.com/prod-ucs-content-store-eu-west/content/pii:S2468823122006058/gr5/THUMBNAIL/image/gif/38b25f304b7c4a2100c82eae7a9e4d2c/gr5.sml gr5 gr5.sml sml 12992 164 219 IMAGE-THUMBNAIL 1-s2.0-S2468823122006058-gr6.sml https://s3-eu-west-1.amazonaws.com/prod-ucs-content-store-eu-west/content/pii:S2468823122006058/gr6/THUMBNAIL/image/gif/900813a75103fe89a33be3e75b49dc04/gr6.sml gr6 gr6.sml sml 15299 164 199 IMAGE-THUMBNAIL 1-s2.0-S2468823122006058-gr7.sml https://s3-eu-west-1.amazonaws.com/prod-ucs-content-store-eu-west/content/pii:S2468823122006058/gr7/THUMBNAIL/image/gif/a6b2bbc2507e3d034724d6ec3d46b494/gr7.sml gr7 gr7.sml sml 18452 164 170 IMAGE-THUMBNAIL 1-s2.0-S2468823122006058-gr8.sml https://s3-eu-west-1.amazonaws.com/prod-ucs-content-store-eu-west/content/pii:S2468823122006058/gr8/THUMBNAIL/image/gif/d88ad342cea5b2fb922f0d834f6155f2/gr8.sml gr8 gr8.sml sml 8883 78 219 IMAGE-THUMBNAIL 1-s2.0-S2468823122006058-gr1.sml https://s3-eu-west-1.amazonaws.com/prod-ucs-content-store-eu-west/content/pii:S2468823122006058/gr1/THUMBNAIL/image/gif/ec53c1edbc3d7ad91f793037648f1338/gr1.sml gr1 gr1.sml sml 9561 90 219 IMAGE-THUMBNAIL 1-s2.0-S2468823122006058-gr2.sml https://s3-eu-west-1.amazonaws.com/prod-ucs-content-store-eu-west/content/pii:S2468823122006058/gr2/THUMBNAIL/image/gif/7513c20ccff5754d2a0d5d391562a59d/gr2.sml gr2 gr2.sml sml 8400 81 219 IMAGE-THUMBNAIL 1-s2.0-S2468823122006058-ga1.sml https://s3-eu-west-1.amazonaws.com/prod-ucs-content-store-eu-west/content/pii:S2468823122006058/ga1/THUMBNAIL/image/gif/2674b31d48691bb5f14fb82a255f5abb/ga1.sml ga1 true ga1.sml sml 11720 121 219 IMAGE-THUMBNAIL 1-s2.0-S2468823122006058-gr3.sml https://s3-eu-west-1.amazonaws.com/prod-ucs-content-store-eu-west/content/pii:S2468823122006058/gr3/THUMBNAIL/image/gif/8771c804093c04f097aa6d2bd8f900b8/gr3.sml gr3 gr3.sml sml 8072 86 219 IMAGE-THUMBNAIL 1-s2.0-S2468823122006058-gr4.sml https://s3-eu-west-1.amazonaws.com/prod-ucs-content-store-eu-west/content/pii:S2468823122006058/gr4/THUMBNAIL/image/gif/fb37b1343b3fc3fe2f25da14f3535861/gr4.sml gr4 gr4.sml sml 12069 71 219 IMAGE-THUMBNAIL 1-s2.0-S2468823122006058-sc1.sml https://s3-eu-west-1.amazonaws.com/prod-ucs-content-store-eu-west/content/pii:S2468823122006058/sc1/THUMBNAIL/image/gif/b7d2429d0068975ddf67531321901e86/sc1.sml sc1 sc1.sml sml 10670 98 219 IMAGE-THUMBNAIL 1-s2.0-S2468823122006058-gr5_lrg.jpg https://s3-eu-west-1.amazonaws.com/prod-ucs-content-store-eu-west/content/pii:S2468823122006058/HIGHRES/image/jpeg/d5f3ed9a9bfb7c45ad63bb175e1dc2b6/gr5_lrg.jpg gr5 gr5_lrg.jpg jpg 557905 1870 2500 IMAGE-HIGH-RES 1-s2.0-S2468823122006058-gr6_lrg.jpg https://s3-eu-west-1.amazonaws.com/prod-ucs-content-store-eu-west/content/pii:S2468823122006058/HIGHRES/image/jpeg/b8b9e5f2abfa200b56ba4d0263b53552/gr6_lrg.jpg gr6 gr6_lrg.jpg jpg 872182 2059 2500 IMAGE-HIGH-RES 1-s2.0-S2468823122006058-gr7_lrg.jpg https://s3-eu-west-1.amazonaws.com/prod-ucs-content-store-eu-west/content/pii:S2468823122006058/HIGHRES/image/jpeg/4ced3fe154f810c7f9b595c3ac461278/gr7_lrg.jpg gr7 gr7_lrg.jpg jpg 299259 1447 1500 IMAGE-HIGH-RES 1-s2.0-S2468823122006058-gr8_lrg.jpg https://s3-eu-west-1.amazonaws.com/prod-ucs-content-store-eu-west/content/pii:S2468823122006058/HIGHRES/image/jpeg/84ed312a437f09a07fc106b3b4a8ffca/gr8_lrg.jpg gr8 gr8_lrg.jpg jpg 360176 891 2500 IMAGE-HIGH-RES 1-s2.0-S2468823122006058-gr1_lrg.jpg https://s3-eu-west-1.amazonaws.com/prod-ucs-content-store-eu-west/content/pii:S2468823122006058/HIGHRES/image/jpeg/9cbc9a82a95e0e278653ce3c1792395b/gr1_lrg.jpg gr1 gr1_lrg.jpg jpg 306545 888 2167 IMAGE-HIGH-RES 1-s2.0-S2468823122006058-gr2_lrg.jpg https://s3-eu-west-1.amazonaws.com/prod-ucs-content-store-eu-west/content/pii:S2468823122006058/HIGHRES/image/jpeg/773d12a49e3d31aeacff0a068887b931/gr2_lrg.jpg gr2 gr2_lrg.jpg jpg 285904 928 2500 IMAGE-HIGH-RES 1-s2.0-S2468823122006058-ga1_lrg.jpg https://s3-eu-west-1.amazonaws.com/prod-ucs-content-store-eu-west/content/pii:S2468823122006058/HIGHRES/image/jpeg/985d880294477eac030c30124f020713/ga1_lrg.jpg ga1 true ga1_lrg.jpg jpg 126840 737 1333 IMAGE-HIGH-RES 1-s2.0-S2468823122006058-gr3_lrg.jpg https://s3-eu-west-1.amazonaws.com/prod-ucs-content-store-eu-west/content/pii:S2468823122006058/HIGHRES/image/jpeg/106f44f88315c528b04d73f783a59d0f/gr3_lrg.jpg gr3 gr3_lrg.jpg jpg 274395 986 2500 IMAGE-HIGH-RES 1-s2.0-S2468823122006058-gr4_lrg.jpg https://s3-eu-west-1.amazonaws.com/prod-ucs-content-store-eu-west/content/pii:S2468823122006058/HIGHRES/image/jpeg/3961b85bebac57cfbab6cc8a101c6041/gr4_lrg.jpg gr4 gr4_lrg.jpg jpg 352892 813 2500 IMAGE-HIGH-RES 1-s2.0-S2468823122006058-sc1_lrg.jpg https://s3-eu-west-1.amazonaws.com/prod-ucs-content-store-eu-west/content/pii:S2468823122006058/HIGHRES/image/jpeg/54add625bd666326b0fc4574da825990/sc1_lrg.jpg sc1 sc1_lrg.jpg jpg 323325 1117 2500 IMAGE-HIGH-RES 1-s2.0-S2468823122006058-mmc1.docx https://s3-eu-west-1.amazonaws.com/prod-ucs-content-store-eu-west/content/pii:S2468823122006058/mmc1/MAIN/application/vnd.openxmlformats-officedocument.wordprocessingml.document/3c708137d3839874b9529b9db0129bc8/mmc1.docx mmc1 mmc1.docx docx 15415442 APPLICATION 1-s2.0-S2468823122006058-am.pdf https://s3-eu-west-1.amazonaws.com/prod-ucs-content-store-eu-west/content/egi:10C4VKNRB1R/MAIN/application/pdf/979d48f3f27f19d14130b040f30adb2a/am.pdf am am.pdf pdf false 924819 AAM-PDF MCAT 112719 112719 S2468-8231(22)00605-8 10.1016/j.mcat.2022.112719 Elsevier B.V. Scheme 1 Schematic illustration to synthesize the N-doped biochar from walnut shells. Scheme 1 Fig. 1 Raman (a) and FTIR spectra (b) of BC-T. Fig 1 Fig. 2 Catalytic activities of BC-T for acetylene hydrochlorination: (a) acetylene conversion; (b) VCM selectivity (Reaction temperature: 180°C; GHSV of C2H2: 45 h−1; v(HCl) /v(C2H2) = 1.1∼1.2). Fig 2 Fig. 3 TGA curves of dicyandiamide and dicyandiamide-formaldehyde resin powder (a); FTIR spectra of BC-850, 6D/BC-850 and 2.5DF/BC-850 (b). Fig 3 Fig. 4 SEM images of BC-850 (a), 6D/BC-850 (b) and2.5DF/BC-850 (c). Fig 4 Fig. 5 Effect of N-loading dosage in xD/BC-850 (a,b) and xDF/BC-850 (c,d) on the catalytic activity (Reaction temperature: 220°C; GHSV of C2H2: 45h−1; v(HCl) /v(C2H2) = 1.1∼1.2). Fig 5 Fig. 6 XPS survey spectra (a) of BC-850, xD/BC-850 and xDF/BC-850; High-resolved N1s spectra of BC-850 (b), 6D/BC-850 (c) and 2.5DF/BC-850 (d). Fig 6 Fig. 7 SEM images of 6D/BC-850 (a, b) and 2.5DF/BC-850 (c, d) (Pristine: a, c; Used: b, d). Fig 7 Fig. 8 TGA and DTG curves of pristine/used 6D/BC-850 (a) and 2.5DF/BC-850 (b). Fig 8 Table 1 XPS data of BC-850, 6D/BC-850 and 2.5DF/BC-850. Table 1 Samples C/at% O/at% N/at% Npyridinic/% Npyrrolic/% Nquaternary/% BC-850 84.90 10.97 4.13 60.56 22.54 16.90 6D/BC-850 87.51 8.73 3.76 29.10 11.82 59.08 2.5DF/BC-850 87.98 9.50 2.52 25.45 13.29 61.26 Table 2 BET data of pristine/used BC-850, 6D/BC-850 and 2.5DF/BC-850. Table 2 Samples BET/m2·g−1 Vtotal /cm3·g−1 Vmicro /cm3·g−1 Daverage /nm BC-850 550.43 0.22 0.19 0.68 6D/BC-850 461.19 0.19 0.16 0.70 6D/BC-850-used 199.98 0.09 0.06 0.88 2.5DF/BC-850 541.64 0.22 0.19 0.69 2.5DF/BC-850-used 388.39 0.16 0.12 0.74 Table 3 Weight-losing ratio of pristine/used 6D/BC-850 and 2.5DF/BC-850. Table 3 Samples <150 °C/% <400 (300) °C/% 150∼400 (300) °C/% Carbon deposition/% 6D/BC-850 1.50 2.67 1.17 3.58 6D/BC-850-used 1.40 6.15 4.75 2.5DF/BC-850 1.26 2.18 0.92 0.76 2.5DF/BC-850-used 1.66 3.34 1.68 Environmentally friendly high-efficient metal-free catalyst for acetylene hydrochlorination derived from walnut shell-based N-doped biochar Shuwen Wu Investigation Methodology Formal analysis Validation Data curation Writing – original draft Writing – review & editing a Aiyun Jiang Methodology Formal analysis Validation b Xiaofei Zhou Investigation Methodology Formal analysis Validation Data curation Writing – original draft Writing – review & editing a Yingliang Liu Supervision Conceptualization Writing – original draft Writing – review & editing Funding acquisition a c ⁎ Shaokui Cao Supervision Conceptualization a b a School of Materials Science and Engineering, Zhengzhou University, Zhengzhou 450001, PR China School of Materials Science and Engineering Zhengzhou University Zhengzhou 450001 PR China aSchool of Materials Science and Engineering, Zhengzhou University, Zhengzhou 450001, People's Republic ofR China b Huanghe Science and Technology College, Zhengzhou, Henan 450063, PR China Huanghe Science and Technology College Zhengzhou Henan 450063 PR China bHuanghe Science and Technology College, Zhengzhou, Henan 450063, People's Republic ofR China c Henan Key Laboratory of Advanced Nylon Materials and Application, Zhengzhou University, Zhengzhou 450001, PR China Henan Key Laboratory of Advanced Nylon Materials and Application Zhengzhou University Zhengzhou 450001 PR China cHenan Key Laboratory of Advanced Nylon Materials and Application, Zhengzhou University, Zhengzhou 450001, People's Republic ofR China ⁎ Corresponding author at: Zhengzhou University, China. Zhengzhou University China. Mercuric chloride as main catalyst for acetylene hydrochlorination poses a serious hazard to the environment due to its easily volatilizing and highly toxic characteristics. Mercuric-free catalysts, especially metal-free catalysts, are quite intriguing in the industrial production of acetylene hydrochlorination. In this work, nitrogen-doped biochar is prepared as green metal-free catalyst for acetylene hydrochlorination with natural walnut shells as starting material, in which the condensation product of dicyandiamide or dicyandiamide-formaldehyde is applied as nitrogen source. The 2.5DF/BC-850 catalyst exhibits superior catalytic activity with C2H2 conversion of 94.5% at 220°C and 45 h−1, which is attributed to the high content of quaternary nitrogen as active center. The introduction of formaldehyde effectively inhibits the carbon deposition in the catalytic reaction and improves the thermal stability of metal-free nitrogen-doped biochar catalyst. This work provides a significant insight into the design of environmentally friendly metal-free nitrogen-doped biochar catalysts for acetylene hydrochlorination. Graphical abstract Image, graphical abstract Keywords Biomass Walnut shell Acetylene hydrochlorination Metal-free catalyst Quaternary nitrogen Data Availability No data was used for the research described in the article. 1 Introduction In China, vinylchloride monomer (VCM), as the raw material of polyvinylchloride (PVC), is mainly manufactured through the method of coal-based acetylene hydrochlorination due to the coal-rich and oil-poor situation [1]. Since VCM is industrialized in Germany, the best catalyst in the process of acetylene hydrochlorination is the activated carbon supported mercuric catalyst, which adopts the highly toxic and volatile mercuric chloride as active component. However, the discharged mercury in the air poses a serious risk to human health and environment [2]. In response, more than 140 countries signed the Minamata Convention in 2013 with the purpose to limit the exploration and release of mercury [3]. Therefore, the development of environmentally friendly low-cost mercury-free catalysts becomes a vital subject for the sustainable production of VCM. Precious metal catalysis for acetylene hydrochlorination gradually becomes the research focus along with the pioneering work of Shinoda and Hutchings based on the correlation of catalytic activity with the intrinsic character of metal chloride on activated carbon [4,5]. Carbon-supported gold/ruthenium-based catalysts are proven to be the most promising alternative catalysts. And, the deactivation problem caused by the reduction of high valence has been essentially resolved by different approaches, such as additional metals and/or promoters [6–10], ligand-containing soft donor atoms [11–16], ionic liquids [17–23] and functionalized carbon carriers [24–27]. Unfortunately, the expensive cost of noble metals inevitably restricts their industrial application. Meanwhile, non-precious metal catalysis for acetylene hydrochlorination has also been developed with the purpose to replace mercuric catalysts. Based on a lot of optimized experiments, copper/bismuth-based catalysts reveal the outstanding activity and thermal stability beyond gold and mercury catalysts [28–31]. The researches on non-precious metal catalysts is still ongoing in the laboratory up to now [32]. More interestingly, heteroatom-doped carbon materials as metal-free catalysts also reveal excellent catalytic performance for acetylene hydrochlorination in recent years through the modification of carrier surface and the regulation of electron affinity [33]. The introduction of heteroatoms into carbon materials is extensively studied in photolytic water [34]. In particular, the nearly close electronegativity and electron affinity of nitrogen atom to carbon atom, together with its coordination action of lone pair electrons, have enabled nitrogen-doped carbon materials to exhibit excellent photocatalytic property. In acetylene hydrochlorination, numerous metal-free catalysts have been successively reported, such as nitrogen-doped carbon nanotubes [35], nitrogen-doped porous carbon [36,37], nitrogen-containing MOF/polymer-derived nitrogen-doped carbon materials (such as ZIF-8 [38–40], polyaniline [41], poly(o-phenylenediamine) [42]), and different nitrogen source-loading activated carbon [43,44]. These metal-free catalysts for acetylene hydrochlorination are usually prepared by chemical vapor deposition, direct carbonization of nitrogen-containing precursors, or the impregnation of nitrogen source into porous carbon. In these catalysts, quaternary nitrogen, pyridinic nitrogen, pyrrolic nitrogen or carbon atoms adjacent to nitrogen atoms have proven to be the active centers for acetylene hydrochlorination. It is more noteworthy that biomass-derived carbon materials are applied to the fabrication of nitrogen-doped metal-free catalysts for acetylene hydrochlorination due to their low cost and environmental friendliness. In this regard, flour/soybean-derived nitrogen-doped carbon materials have respectively achieved the acetylene conversion of ∼85% and ∼99% under optimal conditions [45,46]. In view of abundant nitrogen content of natural walnut shells together with porous morphological structure, biomass carbon materials derived from walnut shells are expected to have more excellent performance for acetylene hydrochlorination. In China, there are an abundant of walnut shells as biomass wastes every year owing to the demands of kernel through walnut processing. These walnut shells present a wrinkled surface and a pore-rich structure for a huge specific surface area, which favors the achievement of extraordinary adsorption and catalytic performance on the basis of their biomass carbon materials. Besides, the abundant nitrogen content of natural walnut shells presents a large number of active catalytic sites inside their biochar. Therefore, many researchers have focused on the effective use of walnut shells in the catalysis and absorption fields. For example, Jin and coworkers used the walnut shell biochar for the adsorption of Hg0. In this case, the specific chemical structure of biochar surface guarantees the stable presence of Hg0, while the large amount of adsorption sites facilitate the adsorption of Hg0 [47]. Li and coworkers prepared a series of biomass carbon starting from walnut shells, which load the copper catalysts for the wet oxidation performance of phenol. Wherein, the large specific surface area and micropore volume of biomass carbon ensure a high copper-loading amount [48]. Notably, the walnut shell biomass carbons are not yet applied for acetylene hydrochlorination in spite of excellent adsorption and catalytic characteristics. In this work, environmentally friendly natural walnut shells are applied as the feedstock of nitrogen-doped biomass carbon materials to make the full use of abundant nitrogen sources for more active catalytic sites and porous morphological structure for larger specific surface area. Simultaneously, dicyandiamide-formaldehyde solution is also introduced as nitrogen resource by wetness impregnation method to further enhance the nitrogen content on the surface of biomass carbon materials as illustrated in Scheme 1 , which is attributed to the relatively enhanced thermal stability of polymers generated by formaldehyde and dicyandiamide. As a result, the grainy metal-free catalyst for acetylene hydrochlorination is fabricated through the precursor carbonization in the one-step synthetic reaction. The BET results suggest that the grainy shape of N-doped biochar provides the larger specific surface area compared with powder-shaped carbon materials. Especially, the XPS result provides a powerful evidence that the superior catalytic activity of as-prepared metal-free catalyst for acetylene hydrochlorination, such as the C2H2 conversion of 94.5% at 220°C and 45 h−1, is mainly caused by the high content of quaternary nitrogen in the nitrogen-doped biomass carbon materials. This work paves a new pathway for the utilization of walnut shells and also promotes the sustainable development of PVC industry through the application of high active metal-free catalyst for acetylene hydrochlorination derived from environmentally friendly biomass carbon materials. 2 Experimental 2.1 Materials Walnut shells with a particle size of 1∼2 mm are used in this work. Dicyandiamide, formaldehyde and triethanolamine (TEA) are purchased from Shanghai Aladdin Biochemical Technology Co., Ltd and used as received. C2H2 (99.5%) and HCl (99.998%) are purchased from Jingong Special Gas Co., Ltd. 2.2 Catalyst fabrication Walnut shells are firstly carbonized at different temperatures for 4 h in a tubular furnace under argon atmosphere, denoted by BC-T where T is the carbonization temperature. Then, the N-doped biochar is prepared by an incipient wetness impregnation method to further enhance the surficial nitrogen content as described in Scheme 1. Firstly, the dicyandiamide and formaldehyde (molar ratio 1:2) solution is agitated at room temperature till the impregnating solution become transparent. Then, after the solution is adjusted to pH=9∼10, walnut shells are fed, followed by agitating for 1 h, being aged for 16 h at room temperature and being dried at 125 °C. Finally, the N-doped biochar catalyst is gained by calcining the precursor at 850°C for 4 h in a tubular furnace under argon atmosphere, denoted as xDF/BC-850, where x is the mass ratio of dicyandiamide to walnut shell. Besides, another N-doped biochar is prepared using aqueous dicyandiamide solution as nitrogen source, denoted as xD/BC. Their difference is that the dissolving and impregnation temperature of dicyandiamide is carried out at 60 °C instead of room temperature. 2.3 Characterization Elemental analysis (EA) was conducted using a Vario EL/micro cube analysis instrument. Surface morphology was observed by a FEI Quanta 250 FEG scanning electronic microscopy (SEM). Raman spectra were tested using 532nm laser on Thermofisher DXRxi Raman imaging microscope. The functional groups on the surface of carbon materials were identified by AVATAR 370 via FTIR, in which the sample and KBr were mixed into a disc and pressed into a sheet. Thermogravimetric analysis (TGA) was performed on NETZSCH TGA instrument under nitrogen atmosphere at a flow rate of 50 mL∙ min−1 while the temperature increased from 30 to 600°C with a heating rate of 10°C∙min−1. X-ray photoelectron spectra (XPS) was recorded with a Thermo ESCALAB 250Xi with monochromatic Al Kα X-ray as an excitation source to determine the surface chemical elements of the samples. The C1s signal at 284.8 eV was adopted to calibrate the binding energies. The N2 adsorption/desorption experiments of the catalysts were performed by Quantachrome Autosorb-iQ2 instrument. The BET measurements and DFT calculations were performed to obtain the specific surface areas and pore size distribution. 2.4 Catalytic experiment The catalytic performance of N-doped biochar for acetylene hydrochlorination was investigated in a fixed bed microreactor with a 10-mm-diameter quartz tube as illustrated in Fig. S1. About 10 mL of catalyst was placed in the reactor, followed by purging nitrogen gas to remove air and water at 120°C. HCl gas was then passed through the reactor at a flow rate of 0.5L·h−1 for 0.5 h to activate the catalyst. Finally, the reactor is heated to reaction temperature, and the mixed gases of HCl and C2H2(v(HCl)/v(C2H2) = 1.1∼1.2) were fed through the reactor with a gaseous hourly space velocity (GHSV) of 45 h−1. The gas products were passed through an adsorption bottle filled with NaOH aqueous solution and analyzed by SRI 310C gas chromatograph equipped with a flame ionization detector. 3 Results and discussion 3.1 Catalytic performance of BC-T Walnut shells, as the lignified endocarp of walnuts, are an abundant waste material from the walnut processing procedure. Although their bulk density is low due to porous and wrinkled surface morphology as shown in Fig. S2a-c, they bear a hard texture structure for excellent mechanical characteristics, for example, the walnut shell particle of 1.25-1.60 mm in size is able to resist a compression power of 0.2295 KN. This compression-resistant feature provides a possibility for an outstanding mechanical intensity of walnut shell-based biochar. The porous and wrinkled morphology of walnut shells also indicates a large specific surface area in their biochar, which could be used as highly effective adsorbent to remove heavy metal ions from wastewater [49]. This feature is also a necessary precondition to achieve an excellent supporting material for highly efficient catalysts in acetylene hydrochlorination. On the other hand, the chemical components of walnut shells mainly include lignin, cellulose and some organic aromatic compounds, which are the essential precursors being carbonized at different temperatures for the biochar (BC-T). During the carbonization of walnut shells, cellulose is aromatized by pyrolysis to form the carbon network planes, which are then stacked forming the carbon crystallites, i.e., the crystalline zone in the biochar. Lignin is difficult to undergo an effective structural rearrangement in the pyrolysis process. So, it is mainly melted and softened to form the amorphous carbon as the biochar skeleton [50]. The biochar surface presents an irregular perforated porous structure, whose pores are connected by membrane-like dense carbon as shown in Fig. S2d-e. In this way, the large specific surface area of as-fabricated biochar is propitious to the reactant adsorption and the increase of active sites. Finally, pristine or pyrolytic organic nitrogen-containing components in walnut shells, such as amino acids and piperidine/diazepine derivatives, are thermally polymerized to form the nitrogen-doped two-dimensional carbon materials on the biochar surface, presenting many quaternary nitrogen atoms as active sites for the catalytic reaction of acetylene hydrochlorination. The surficial deposition of pyrolytic nitrogen elements is proved by the higher surficial nitrogen content in Table S1 than the bulk nitrogen content in Table S2. As shown in the data in Table S2, the surficial nitrogen content of biochar is nearly increased about 13 times compared with pristine walnut shells. Simultaneously, the quaternary nitrogen ratio in the total nitrogen atoms is largely increased to 41.85at%.The pyrolysis of organic components in the carbonization process of walnut shells not only changes the proportion of nitrogen species in the biochar, which plays a key role in the acetylene hydrochlorination reaction, but also changes the elemental content of the biochar due to the gas emission, such as water, carbon dioxide and small molecule hydrocarbons, as illustrated in Tables S1-2. All these results are very propitious to the improvement of catalytic efficiency for acetylene hydrochlorination. The elemental mapping derived from EDS is provided in Fig. S3-4 to exhibit the uniform distribution of oxygen, carbon and nitrogen in walnut shells and BC-850. The structure and catalytic performance of biochar BC-T being carbonized at different temperatures are firstly investigated in detail. The Raman spectra of biochar BC-T are shown in Fig. 1 a. The D band at 1335 cm−1 exhibits the degree of disordered defects in the carbon materials while the G band at 1583 cm−1 reveals the graphitization degree of sp2 carbon atoms in the carbon framework. The intensity ratio of these two peaks (ID/IG) is considered to be a parameter of disorder degree associated with the carbon structure. Evidently, the more constructed defects at the high temperature favors the increase of catalytic activity for acetylene hydrochlorination [43,51], which will be proved by the following investigation of catalytic performance. Similarly, their FTIR spectra in Fig. 1b suggest the obvious weakened intensity of C=O peak at 1705 cm−1 after carbonization, including the new peak appearance at 1584 cm−1 being attributed to C=N [52, 53]. This result implies that the biochar BC-T derived from walnut shells forms a carbon and nitrogen framework, i.e., nitrogen-doped biochar. Notably, the catalytic performance at 180°C of BC-T for acetylene hydrochlorination in Fig. 2 a presents the evident relationship of acetylene conversion with nitrogen contents. The highest surficial nitrogen content of 4.13at% in BC-850 calcinated at the temperature of 850 °C as shown in Table S1 induces the highest acetylene conversion of ∼48% while its VCM selectivity is up to 99.85%, showing the best catalytic activity. Hence, the catalytic performance of biochar BC-T for acetylene hydrochlorination could be theoretically promoted by further enhancing the nitrogen content and active N site through the surface modification with definite nitrogen sources to impregnate walnut shells. 3.2 Catalytic performance of xD/BC-850 and xDF/BC-850 Based on the above conclusion, dicyandiamide with high nitrogen content is used as nitrogen source to dope the biomass activated carbon BC-T [54–56]. Due to the inadequate solubility in water of dicyandiamide at room temperature, the stoichiometric formaldehyde solution diluted with deionized water is introduced as solvent to generate the hydrophilic dicyandiamide-formaldehyde condensation product (molar ratio 1:2) with TEA to adjust to pH=9∼10. Thereby, the much larger content of dicyandiamide in the transparent impregnation solution is even acquired at room temperature. Except to promote the dispersion of dicyandiamide in the aqueous solution, the oxygen species in formaldehyde can also adjust the distribution of nitrogen species in the N-doped biochar [57,58]. Herein, the biochar BC-850 with the best catalytic performance is selected as the substrate to prepare the N-doped biochar, denoted as xDF/BC-850. Different mass ratio (x) of dicyandiamide and walnut shell is adopted to adjust the nitrogen content on the surface of biochar BC-850 with an aim to further regulate the catalytic activity of N-doped biochar xDF/BC-850. The thermal gravimetric analysis is firstly used to investigate the residual weight of dicyandiamide and dicyandiamide-formaldehyde resin powder after the calcination at high temperature. From the curves in Fig. 3 a, the rapid decomposition of dicyandiamide occurs between 232 °C and 385 °C, while the polycondensation for dicyandiamide-formaldehyde resin occurs below 274 °C with the emission of water, followed by a quick decomposition in higher temperature. At 600 °C, the residual weight percentages of dicyandiamide and dicyandiamide-formaldehyde resin powder are about 21.7wt% and 47.5wt%, respectively. Undoubtedly, the better thermal stability of dicyandiamide-formaldehyde resin than dicyandiamide provides a precondition to more efficiently fix the nitrogen atoms on the surface of as-fabricated N-doped biochar. The FTIR spectra of BC-850, 6D/BC-850 and 2.5DF/BC-850 in Fig. 3b illustrates that the peak at 3428 cm−1, associated with the amino (-NH2) and imino (-NH-) stretching vibration, overlaps with the stretching vibration corresponding to hydroxyl group (-OH) [59]. In addition, the peaks at 1737 cm−1 and 1567 cm−1 are attributed to C=O and C=N, respectively. And, the peak intensities at these positions for both 6D/BC-850 and 2.5DF/BC-850 are higher than pristine BC-850, indicating the possibility of successful nitrogen-doping towards the biochar. Besides, the SEM images of BC-850, 6D/BC-850 and 2.5DF/BC-850 in Fig. 4 indicates that, compared to the pristine biomass carbon Fig. 4a, many microspheres are formed on the biochar surface after loading the nitrogen species as shown in Fig. 4b,c.The SEM image of 6D/BC-850 in Fig. 4b suggests the serious microsphere aggregation on the biochar surface due to the formaldehyde absence. With the addition of formaldehyde, the microsphere aggregation is evidently alleviated as shown in Fig. 4c. This point is in accord with the above material design, that the introduction of formaldehyde could enhance the thermal stability of polymers generated by formaldehyde and dicyandiamide and then adjust the content and distribution of nitrogen species on the surface of N-doped biochar. This change of surficial morphology is very good for the improvement of catalytic activity due to the effective absorption and collision of reactive precursors in acetylene hydrochlorination, which is the extensively accepted reaction mechanism between hydrogen chloride and acetylene up to now. First of all, the catalytic performance at 220°C of formaldehyde-free xD/BC-850 with different dicyandiamide-loading amounts is evaluated with C2H2 GHSV of 45 h−1 at reaction temperature of 220°C as shown in Fig. 5 a,b. It can be obviously seen that dicyandiamide is an excellent choice of nitrogen sources. With the dicyandiamide-loading amount increasing from 1% to 6%, the acetylene conversion is gradually promoted to 94.92% in the 6D/BC-850 catalyst, which is considerably higher than ∼70% of BC-850. At the same time, the VCM selectivity is also increased to a certain extent and turns to be stable. However, excessive dicyandiamide-loading amount, more than 6%, causes acetylene conversion to drop quickly including the more instable and worse VCM selectivity. Herein, the deterioration of catalytic performance is probably caused by the deficient contact between active sites and reactant gases, which is caused by the pore blockage and the above serious microsphere aggregation at the high nitrogen-loading amount. To make clear the action of formaldehyde on the catalytic activity of acetylene hydrochlorination, the catalytic performance of xDF/BC-850 catalysts at the same reaction condition is also provided in Fig. 5c,d. Obviously, xDF/BC-850 displays much higher catalytic activity than BC-850, too. When the loading dosage of dicyandiamide-formaldehyde is 2.5%, the obtained 2.5DF/BC-850 catalyst shows the best catalytic activity, such as the acetylene conversion of 94.45% and the VCM selectivity of 99.9%. Through the comparation of catalytic performance for xD/BC-850 and xDF/BC-850, the similar catalytic activity is achieved except for the dosage of dicyandiamide nitrogen source in the present of formaldehyde. Evidently, the formaldehyde solution is not only an effective solvent for dicyandiamide, but also effectively participates in the polycarbonization reaction in the preparation of N-doped biochar catalysts. This result further proves that the formaldehyde could adjust the distribution of nitrogen species on the surface of N-doped biochar. The 20-hour catalytic reactions with 6D/BC-850 and 2.5DF/BC-850 catalysts under the reaction conditions of C2H2 GHSV 45h−1 and 220°C, as shown in Fig. S5, suggest that the acetylene conversion of 2.5DF/BC-850 catalyst is more stable than 6D/BC-850 catalyst with the conversion decline of 2.5DF/BC-850 from 94.45% to 90.54%, but that of 6D/BC-850 from 94.92% to 87.43%. The deactivation reason of catalytic activity is mainly attributed to the carbon deposition producing the loss of active sites. The calculated deactivation rate of 2.5DF/BC-850 catalyst is about 0.19% h−1, which is compared to the previous studies [40,43,51]. Out of question, the introduction of formaldehyde is quite beneficial to the catalytic stability of N-doped biochar catalyst. 3.3 Catalyst characterization The XPS measurements are performed to evaluate the N-doping content on the surface of N-doped biochar catalysts, including the nitrogen elemental types, which are some important active sites for acetylene hydrochlorination [44]. Fig. 6 a shows the binding energies of C1s (284.8 eV), N1s (400.8 eV) and O1s (532.8 eV), in which the high-resolved N1s spectra of BC-850, 6D/BC-850 and 2.5DF/BC-850 are respectively fitted in Fig. 6b-d. The fitting results exhibit three main peaks, such as pyridinic nitrogen (399.3 ± 0.3 eV), pyrrolic nitrogen (400.9 ± 0.3 eV) and quaternary nitrogen (401.9 ± 0.3 eV), respectively [60,61]. Differently from BC-850 in the Table 1 , the 6D/BC-850 and 2.5DF/BC-850 catalysts bear the similar proportion of nitrogen species on the surface although the nitrogen content is decreased to a certain extent, proving the successful modification of walnut shell-based biochar by dicyandiamide. One of them, the quaternary nitrogen is the main nitrogen species with a high proportion of ∼60%, which is considered to be the main active center for acetylene hydrochlorination. Of course, other nitrogen species, such as pyridinic and pyrrolic nitrogen, can also exhibit a certain catalytic activity as reported in the literature [42,62]. In this case, the calcination temperature is speculated to another important factor to determine the formation of different nitrogen species in the N-doped biochar except for the application of formaldehyde in the biochar fabrication. The oxygen element derived from the introduction of formaldehyde might impact the catalytic activity by tuning the distribution of different nitrogen species on the N-doped biochar surface. The N2 adsorption/desorption experiment is performed by the Brunauer-Emmett-Teller (BET) measurement to understand the effect of formaldehyde on the pore structure in the biochar catalysts. The nitrogen adsorption isothermal curves in Fig. S6 illustrate that the pristine/used 6D/BC-850 and 2.5DF/BC-850 catalysts follow the I-type isotherms according to the IUPAC classification. The unclosed hysteresis loop indicates that the microporous structure of biochar catalysts contributes to the major specific surface area. As shown in the BET data of Table 2 , pristine 2.5DF/BC-850 catalyst basically shows a unchangeable specific surface area (541.64 m2·g−1) after the introduction of formaldehyde compared to BC-850 (550.43 m2·g−1) while pristine 6D/BC-850 catalyst (461.19 m2·g−1) takes on a decrease of 16.2% (approximately 90 m2∙g−1). After the 20-hour reaction, the specific surface area of 2.5DF/BC-850 catalyst decreases about 28.3% from 541.64 m2∙g−1 to 388.39 m2∙g−1, while the specific surface area of 6D/BC-850 catalyst more largely decreases about 56.6% from 461.19 m2∙g−1 to 199.98 m2∙g−1. The macroporous data in Table S3, which are tested by mercury porosimeter as shown in Figs. S7-11, reveal the same trend as the BET data in Table 2. These results confirm that the formation of carbon deposition causes the pore-plugging in the biochar catalyst, resulting in the decline of catalytic activity [63]. However, this situation could be remarkably improved by the application of formaldehyde in the process of dicyandiamide dissolution. The change of specific surface area in the pristine/used 6D/BC-850 and 2.5DF/BC-850 catalysts is investigated by observing the residual natural pores via the scanning electron microscopy as shown in Fig. 7 . It is seen from Fig. 7a,b that many agglomerated particles are distributed on the surface of pristine 6D/BC-850 catalyst and the serious carbon deposition blocks the pores on the biochar surface after the catalytic reaction, which not only cover the active sites but also hinder the transfer and diffusion of reactant gases. As a result, the acetylene conversion of 6D/BC-850 will be decreased till the catalyst deactivation. On the contrary, there is no serious carbon deposition to be found on the used 2.5DF/BC-850 catalyst after the catalytic reaction as displayed in Fig. 7c,d. This result verifies that the introduction of formaldehyde effectively solidifies the biochar surface and then inhibits the generation of carbon deposition, which is consistent with the BET analytic result. The level of carbon deposition on the catalyst surface is evaluated by thermogravimetric analysis, which is calculated according to the weight-losing ratio over an appropriate temperature range as reported in the literature [51,64]. As illustrated in Fig. 8 , the catalyst weight-losing before 150°C is attributed to the water evaporation in the catalyst surface and the weight-losing between 150°C to 400°C is mainly caused by the combustion of carbon deposition on the catalyst surface. Table 3 provides the weight-losing ratio up to 400°C of pristine/used 6D/BC-850 and 2.5DF/BC-850 catalysts, together with the amount of carbon deposition on the catalyst surface. Evidently, the carbon deposition for 2.5DF/BC-850 catalyst is 0.76%, which is much lower than 3.58% of 6D/BC-850 catalyst. This result directly indicates that the addition of formaldehyde effectively inhibits the formation of carbon deposition and then greatly improves the stability of N-doped biochar catalyst, which is completely consistent with the results of catalytic performance. Undoubtedly, this work provides an environmentally friendly metal-free N-doped biochar catalyst for acetylene hydrochlorination, whose high-efficient and stable features pave the way for the green mass-production of acetylene hydrochlorination. 4 Conclusions The walnut shell-based N-doped biochar catalysts are prepared via a wetness impregnation method, followed by being carbonized in the inert atmosphere at a certain calcination temperature. Compared with the single dicyandiamide nitrogen source, the introduction of formaldehyde into the hydrous dicyandiamide solution not only promotes the dicyandiamide dispersion in the water solution, but also effectively alleviates the generation of carbon deposition on the biochar surface. The XPS result indicates that the quaternary nitrogen species is the main active sites in the N-doped biochar catalysts for acetylene hydrochlorination. This work provides an environmentally friendly metal-free N-doped biochar catalyst for acetylene hydrochlorination. Especially, the high-efficient and stable characteristics of as-fabricated N-doped biochar catalyst have the intriguing potential for the green mass-production of acetylene hydrochlorination. CRediT authorship contribution statement Shuwen Wu: Investigation, Methodology, Formal analysis, Validation, Data curation, Writing – original draft, Writing – review & editing. Aiyun Jiang: Methodology, Formal analysis, Validation. Xiaofei Zhou: Investigation, Methodology, Formal analysis, Validation, Data curation, Writing – original draft, Writing – review & editing. Yingliang Liu: Supervision, Conceptualization, Writing – original draft, Writing – review & editing, Funding acquisition. Shaokui Cao: Supervision, Conceptualization. Declaration of Competing Interest The authors declare that they have no known competing financial interests or personal relationships that could have appeared to influence the work reported in this paper. Acknowledgments We greatly thank the financial support from the postdoctoral research grant in Henan Province (19030020) and the Science & Technology Key Project by Education Department of Henan Province (22A430008). Supplementary materials Supplementary material associated with this article can be found, in the online version, at doi:10.1016/j.mcat.2022.112719. Appendix Supplementary materials Image, application 1 References [1] B. Yan W. Lu Y. Cheng China goes green: cleaner production of chemicals Green Process Synth. 1 2012 33 47 10.1515/greenps-2011-0024 B. Yan, W. Lu, Y. Cheng, China goes green: cleaner production of chemicals, Green Process Synth., 1 (2012) 33-47. https://doi.org/10.1515/greenps-2011-0024. [2] G. Malta S.J. Freakley S.A. Kondrat G.J. Hutchings Acetylene hydrochlorination using Au/carbon: a journey towards single site catalysis Chem. Commun. (Camb.) 53 2017 11733 11746 10.1039/C7CC05986H G. Malta, S.J. Freakley, S.A. Kondrat, G.J. Hutchings, Acetylene hydrochlorination using Au/carbon: a journey towards single site catalysis, Chem. Commun. (Camb.), 53 (2017) 11733-11746. https://doi.org/10.1039/C7CC05986H. [3] X. Liu X. Qiao Z. Zhou C. Zhao Q. Guan W. Li Mechanism exploring of acetylene hydrochlorination using hexamethylenetetramine as a single active site metal-free catalyst Catal. Commun. 147 2020 106147 106151 10.1016/j.catcom.2020.106147 X. Liu, X. Qiao, Z. Zhou, C. Zhao, Q. Guan, W. Li, Mechanism exploring of acetylene hydrochlorination using hexamethylenetetramine as a single active site metal-free catalyst, Catal. Commun., 147 (2020) 106147-106151. https://doi.org/10.1016/j.catcom.2020.106147. [4] K. Shinoda The vapor-phase hydrochlorination of acetylene over metal chlorides supported on activated carbon Chem. Lett. 4 1975 219 220 10.1246/cl.1975.219 doi.org/ K. Shinoda, The vapor-phase hydrochlorination of acetylene over metal chlorides supported on activated carbon, Chem. Lett., 4 (1975) 219-220. https://doi.org/doi.org/10.1246/cl.1975.219. [5] G.J. Hutchings Vapor Phase Hydrochlorination of acetylene: correlation of catalytic activity of supported metal chloride catalysts J. Catal. 96 1985 292 295 10.1016/0021-9517(85)90383-5 G.J. Hutchings, Vapor Phase Hydrochlorination of acetylene: correlation of catalytic activity of supported metal chloride catalysts, J. Catal., 96 (1985) 292-295. https://doi.org/10.1016/0021-9517(85)90383-5. [6] L. Ye X. Duan S. Wu T. Wu Y. Zhao AW. Robertson H. Chou J. Zheng T. Ayvali S. Day C. Tang Y.L. Soo Y. Yuan S.C.E. Tsang Self- regeneration of Au/CeO2 based catalysts with enhanced activity and ultra-stability for acetylene hydrochlorination Nat. Commun. 10 2019 914 10.1038/s41467-019-08827-5 L. Ye, X. Duan, S. Wu, T. Wu, Y. Zhao, AW. Robertson, H. Chou, J. Zheng, T. Ayvali, S. Day, C. Tang, Y.L. Soo, Y. Yuan, S.C.E. Tsang, Self- regeneration of Au/CeO2 based catalysts with enhanced activity and ultra-stability for acetylene hydrochlorination, Nat. Commun., 10 (2019) 914. https://doi.org/10.1038/s41467-019-08827-5. [7] D. Hu L. Wang F. Wang J. Wang Bimetallic Au-Li/SAC catalysts for acetylene hydrochlorination Catal. Commun. 115 2018 45 48 10.1016/j.catcom.2018.06.025 D. Hu, L. Wang, F. Wang, J. Wang, Bimetallic Au-Li/SAC catalysts for acetylene hydrochlorination, Catal. Commun., 115 (2018) 45-48. https://doi.org/10.1016/j.catcom.2018.06.025. [8] Y. Dong H. Zhang W. Li M. Sun C. Guo J. Zhang Bimetallic Au-Sn/AC catalysts for acetylene hydrochlorination J. Ind. Eng. Chem. 35 2016 177 184 10.1016/j.jiec.2015.12.031 Y. Dong, H. Zhang, W. Li, M. Sun, C. Guo, J. Zhang, Bimetallic Au-Sn/AC catalysts for acetylene hydrochlorination, J. Ind. Eng. Chem., 35 (2016) 177-184. https://doi.org/10.1016/j.jiec.2015.12.031. [9] Y. Pu J. Zhang X. Wang H. Zhang L. Yu Y. Dong W. Li Bimetallic Au-Ni/CSs catalysts for acetylene hydrochlorination Catal. Sci. Technol. 4 2014 4426 4432 10.1039/c4cy00769g Y. Pu, J. Zhang, X. Wang, H. Zhang, L. Yu, Y. Dong, W. Li, Bimetallic Au-Ni/CSs catalysts for acetylene hydrochlorination, Catal. Sci. Technol., 4 (2014) 4426-4432. https://doi.org/10.1039/c4cy00769g. [10] L. Wang B. Shen J. Zhao X. Bi Trimetallic Au-Cu-K/AC for acetylene hydrochlorination Can. J. Chem. Eng. 95 2017 1069 1075 10.1002/cjce.22754 L. Wang, B. Shen, J. Zhao, X. Bi, Trimetallic Au-Cu-K/AC for acetylene hydrochlorination, Can. J. Chem. Eng., 95 (2017) 1069-1075. https://doi.org/10.1002/cjce.22754. [11] X. Wang G. Lan Z. Cheng W. Han H. Tang H. Liu Y. Li Carbon-supported ruthenium catalysts prepared by a coordination strategy for acetylene hydrochlorination Chin. J. Catal. 41 2020 1683 1691 10.1016/s1872-2067(20)63616-6 X. Wang, G. Lan, Z. Cheng, W. Han, H. Tang, H. Liu, Y. Li, Carbon-supported ruthenium catalysts prepared by a coordination strategy for acetylene hydrochlorination, Chin. J. Catal., 41 (2020) 1683-1691. https://doi.org/10.1016/s1872-2067(20)63616-6. [12] Y. Dong W. Li Z. Yan J. Zhang Hydrochlorination of acetylene catalyzed by an activated carbon supported chlorotriphenylphosphine gold complex Catal. Sci. Technol. 6 2016 7946 7955 10.1039/c6cy01241h Y. Dong, W. Li, Z. Yan, J. Zhang, Hydrochlorination of acetylene catalyzed by an activated carbon supported chlorotriphenylphosphine gold complex, Catal. Sci. Technol., 6 (2016) 7946-7955. https://doi.org/10.1039/c6cy01241h. [13] J. Ke Y. Zhao Y. Yin K. Chen X. Duan L. Ye Y. Yuan Yttrium chloride-modified Au/AC catalysts for acetylene hydrochlorination with improved activity and stability J. Rare Earths 35 2017 1083 1091 10.1016/j.jre.2017.04.008 J. Ke, Y. Zhao, Y. Yin, K. Chen, X. Duan, L. Ye, Y. Yuan, Yttrium chloride-modified Au/AC catalysts for acetylene hydrochlorination with improved activity and stability, J. Rare Earths, 35 (2017) 1083-1091. https://doi.org/10.1016/j.jre.2017.04.008. [14] C. Huang M. Zhu L. Kang B. Dai A novel high-stability Au(III)/Schiff-based catalyst for acetylene hydrochlorination reaction Catal. Commun. 54 2014 61 65 10.1016/j.catcom.2014.05.024 C. Huang, M. Zhu, L. Kang, B. Dai, A novel high-stability Au(III)/Schiff-based catalyst for acetylene hydrochlorination reaction, Catal. Commun., 54 (2014) 61-65. https://doi.org/10.1016/j.catcom.2014.05.024. [15] J. Li H. Zhang M. Cai L. Li Y. Li R. Zhao J. Zhang Enhanced catalytic performance of activated carbon-supported ru-based catalysts for acetylene hydrochlorination by azole ligands Appl. Catal. A-Gen. 592 2020 117431 117440 10.1016/j.apcata.2020.117431 J. Li, H. Zhang, M. Cai, L. Li, Y. Li, R. Zhao, J. Zhang, Enhanced catalytic performance of activated carbon-supported ru-based catalysts for acetylene hydrochlorination by azole ligands, Appl. Catal. A-Gen., 592 (2020) 117431-117440. https://doi.org/10.1016/j.apcata.2020.117431. [16] H. Li B. Wu J. Wang F. Wang X. Zhang G. Wang H. Li Efficient and stable Ru(III)-choline chloride catalyst system with low Ru content for non-mercury acetylene hydrochlorination, Chin J. Catal. 39 2018 1770 1781 10.1016/s1872-2067(18)63121-3 H. Li, B. Wu, J. Wang, F. Wang, X. Zhang, G. Wang, H. Li, Efficient and stable Ru(III)-choline chloride catalyst system with low Ru content for non-mercury acetylene hydrochlorination, Chin. J. Catal., 39 (2018) 1770-1781. https://doi.org/10.1016/s1872-2067(18)63121-3. [17] J. Zhao Y. Yu X. Xu S. Di B. Wang H. Xu J. Ni L. Guo Z. Pan X. Li Stabilizing Au(III) in supported-ionic-liquid-phase (SILP) catalyst using CuCl2 via a redox mechanism Appl. Catal., B 206 2017 175 183 10.1016/j.apcatb.2017.01.026 J. Zhao, Y. Yu, X. Xu, S. Di, B. Wang, H. Xu, J. Ni, L. Guo, Z. Pan, X. Li, Stabilizing Au(III) in supported-ionic-liquid-phase (SILP) catalyst using CuCl2 via a redox mechanism, Appl. Catal., B, 206 (2017) 175-183. https://doi.org/10.1016/j.apcatb.2017.01.026. [18] J. Zhao S. Gu X. Xu T. Zhang Y. Yu X. Di J. Ni Z. Pan X. Li Supported ionic-liquid-phase-stabilized Au(III) catalyst for acetylene hydrochlorination Catal. Sci. Technol. 6 2016 3263 3270 10.1039/c5cy02045j J. Zhao, S. Gu, X. Xu, T. Zhang, Y. Yu, X. Di, J. Ni, Z. Pan, X. Li, Supported ionic-liquid-phase-stabilized Au(III) catalyst for acetylene hydrochlorination, Catal. Sci. Technol., 6 (2016) 3263-3270. https://doi.org/10.1039/c5cy02045j. [19] X. Qi W. Chen J. Zhang Highly effective carbon-supported gold-ionic liquid catalyst for acetylene hydrochlorination RSC Adv. 9 2019 21931 21938 10.1039/c9ra04082j X. Qi, W. Chen, J. Zhang, Highly effective carbon-supported gold-ionic liquid catalyst for acetylene hydrochlorination, RSC Adv.., 9 (2019) 21931-21938. https://doi.org/10.1039/c9ra04082j. [20] B. Wang Y. Yue S. Wang S. Shao Z. Chen X. Fang X. Pang Z. Pan J. Zhao X. Li Stabilizing supported gold catalysts in acetylene hydrochlorination by constructing an acetylene–deficient reaction phase Green Energy Environ. 6 2021 9 14 10.1016/j.gee.2020.06.012 B. Wang, Y. Yue, S. Wang, S. Shao, Z. Chen, X. Fang, X. Pang, Z. Pan, J. Zhao, X. Li, Stabilizing supported gold catalysts in acetylene hydrochlorination by constructing an acetylene–deficient reaction phase, Green Energy Environ., 6 (2021) 9-14. https://doi.org/10.1016/j.gee.2020.06.012. [21] S. Shang W. Zhao Y. Wang X. Li J. Zhang Y. Han W. Li Highly efficient Ru@IL/AC to substitute mercuric catalyst for acetylene hydrochlorination ACS Catal. 7 2017 3510 3520 10.1021/acscatal.7b00057 S. Shang, W. Zhao, Y. Wang, X. Li, J. Zhang, Y. Han, W. Li, Highly efficient Ru@IL/AC to substitute mercuric catalyst for acetylene hydrochlorination, ACS Catal., 7 (2017) 3510-3520. https://doi.org/10.1021/acscatal.7b00057. [22] Y. Li Y. Dong W. Li Y. Han J. Zhang Improvement of imidazolium-based ionic liquids on the activity of ruthenium catalyst for acetylene hydrochlorination Mol. Catal. 443 2017 220 227 10.1016/j.mcat.2017.09.021 Y. Li, Y. Dong, W. Li, Y. Han, J. Zhang, Improvement of imidazolium-based ionic liquids on the activity of ruthenium catalyst for acetylene hydrochlorination, Mol. Catal., 443 (2017) 220-227. https://doi.org/10.1016/j.mcat.2017.09.021. [23] Y. Han H. Zhang Y. Li Y. Nian W. Li J. Zhang Ruthenium catalyst coordinated with [N4444 +][PF6 −] ionic liquid for acetylene hydrochlorination Catal. Today 355 2020 205 213 10.1016/j.cattod.2019.03.042 Y. Han, H. Zhang, Y. Li, Y. Nian, W. Li, J. Zhang, Ruthenium catalyst coordinated with [N4444+][PF6−] ionic liquid for acetylene hydrochlorination, Catal. Today, 355 (2020) 205-213. https://doi.org/10.1016/j.cattod.2019.03.042 [24] B. Dai X. Li J. Zhang F. Yu M. Zhu Application of mesoporous carbon nitride as a support for an Au catalyst for acetylene hydrochlorination Chem. Eng. Sci. 135 2015 472 478 10.1016/j.ces.2014.12.017 B. Dai, X. Li, J. Zhang, F. Yu, M. Zhu, Application of mesoporous carbon nitride as a support for an Au catalyst for acetylene hydrochlorination, Chem. Eng. Sci., 135 (2015) 472-478. https://doi.org/10.1016/j.ces.2014.12.017. [25] J. Zhao J. Xu J. Xu T. Zhang X. Di J. Ni X. Li Enhancement of Au/AC acetylene hydrochlorination catalyst activity and stability via nitrogen-modified activated carbon support Chem. Eng. J. 262 2015 1152 1160 10.1016/j.cej.2014.10.071 J. Zhao, J. Xu, J. Xu, T. Zhang, X. Di, J. Ni, X. Li, Enhancement of Au/AC acetylene hydrochlorination catalyst activity and stability via nitrogen-modified activated carbon support, Chem. Eng. J., 262 (2015) 1152-1160. https://doi.org/10.1016/j.cej.2014.10.071. [26] J. Liu G. Lan Y. Qiu X. Wang Y. Li Wheat flour-derived N-doped mesoporous carbon extrudes as an efficient support for Au catalyst in acetylene hydrochlorination Chin. J. Catal. 39 2018 1664 1671 10.1016/s1872-2067(18)63109-2 J. Liu, G. Lan, Y. Qiu, X. Wang, Y. Li, Wheat flour-derived N-doped mesoporous carbon extrudes as an efficient support for Au catalyst in acetylene hydrochlorination, Chin. J. Catal., 39 (2018) 1664-1671. https://doi.org/10.1016/s1872-2067(18)63109-2. [27] S.K. Kaiser Preserved in a shell: high-performance graphene-confined ruthenium nanoparticles in acetylene hydrochlorination Angew. Chem. Int. Edit. 131 2019 2 10 10.1002/ange.201906916 S.K. Kaiser, Preserved in a shell: high-performance graphene-confined ruthenium nanoparticles in acetylene hydrochlorination, Angew. Chem. Int. Edit., 131 (2019) 2-10. https://doi.org/10.1002/ange.201906916. [28] Y. Wang Y. Nian J. Zhang W. Li Y. Han MOMTPPC improved Cu-based heterogeneous catalyst with high efficiency for acetylene hydrochlorination Mol. Catal. 479 2019 110612 110622 10.1016/j.mcat.2019.110612 Y. Wang, Y. Nian, J. Zhang, W. Li, Y. Han, MOMTPPC improved Cu-based heterogeneous catalyst with high efficiency for acetylene hydrochlorination, Mol. Catal., 479 (2019) 110612-110622. https://doi.org/10.1016/j.mcat.2019.110612. [29] Y. Hu Y. Wang Y. Wang W. Li J. Zhang Y. Han High performance of supported Cu-based catalysts modulated via phosphamide coordination in acetylene hydrochlorination Appl. Catal. A 591 2020 117408 117417 10.1016/j.apcata.2020.117408 Y. Hu, Y. Wang, Y. Wang, W. Li, J. Zhang, Y. Han, High performance of supported Cu-based catalysts modulated via phosphamide coordination in acetylene hydrochlorination, Appl. Catal. A, 591 (2020) 117408-117417. https://doi.org/10.1016/j.apcata.2020.117408. [30] D. Hu L. Wang F. Wang J. Wang Active carbon supported S-promoted Bi catalysts for acetylene hydrochlorination reaction Chin. Chem. Lett. 29 2018 1413 1416 10.1016/j.cclet.2017.12.017 D. Hu, L. Wang, F. Wang, J. Wang, Active carbon supported S-promoted Bi catalysts for acetylene hydrochlorination reaction, Chin. Chem. Lett., 29 (2018) 1413-1416. https://doi.org/10.1016/j.cclet.2017.12.017. [31] L. Lian L. Wang H. Yan S. Ali J. Wang L. Zhao C. Yang R. Wu L. Ma Non-mercury catalytic acetylene hydrochlorination over Bi/CNTs catalysts for vinyl chloride monomer production J. Mater. Res. Technol. 9 2020 14961 14968 10.1016/j.jmrt.2020.10.072 L. Lian, L. Wang, H. Yan, S. Ali, J. Wang, L. Zhao, C. Yang, R. Wu, L. Ma, Non-mercury catalytic acetylene hydrochlorination over Bi/CNTs catalysts for vinyl chloride monomer production, J. Mater. Res. Technol., 9 (2020) 14961-14968. https://doi.org/10.1016/j.jmrt.2020.10.072. [32] Y. Liu L. Zhao Y. Zhang L. Zhang X. Zan Progress and challenges of mercury-free catalysis for acetylene hydrochlorination Catalysts 10 2020 1218 1246 10.3390/catal10101218 Y. Liu, L. Zhao, Y. Zhang, L. Zhang, X. Zan, Progress and challenges of mercury-free catalysis for acetylene hydrochlorination, Catalysts, 10 (2020) 1218-1246. https://doi.org/10.3390/catal10101218. [33] J. Zhong Y. Xu Z. Liu Heterogeneous non-mercury catalysts for acetylene hydrochlorination: progress, challenges, and opportunities Green Chem. 20 2018 2412 2427 10.1039/c8gc00768c J. Zhong, Y. Xu, Z. Liu, Heterogeneous non-mercury catalysts for acetylene hydrochlorination: progress, challenges, and opportunities, Green Chem., 20 (2018) 2412-2427. https://doi.org/10.1039/c8gc00768c. [34] R. Asahi T. Morikawa T. Ohwaki K. Aoki Y. Taga Visible-light photocatalysis in nitrogen-doped titanium oxides Sci 293 2001 269 271 10.1126/science.1061051 R. Asahi, T. Morikawa, T. Ohwaki, K. Aoki, Y. Taga, Visible-light photocatalysis in nitrogen-doped titanium oxides, Sci, 293 (2001) 269-271. https://doi.org/10.1126/science.1061051. [35] X. Li X. Pan X. Bao Nitrogen doped carbon catalyzing acetylene conversion to vinyl chloride J. Energy Chem. 23 2014 131 135 10.1016/s2095-4956(14)60126-1 X. Li, X. Pan, X. Bao, Nitrogen doped carbon catalyzing acetylene conversion to vinyl chloride, J. Energy Chem., 23 (2014) 131-135. https://doi.org/10.1016/s2095-4956(14)60126-1. [36] Y. Yang G. Lan X. Wang Y. Li Direct synthesis of nitrogen-doped mesoporous carbons for acetylene hydrochlorination Chin. J. Catal. 37 2016 1242 1248 10.1016/s1872-2067(16)62459-2 Y. Yang, G. Lan, X. Wang, Y. Li, Direct synthesis of nitrogen-doped mesoporous carbons for acetylene hydrochlorination, Chin. J. Catal., 37 (2016) 1242-1248. https://doi.org/10.1016/s1872-2067(16)62459-2. [37] W. Liu M. Zhu B. Dai Nitrogen doped nanoflower porous carbon as a nonmetal catalyst for acetylene hydrochlorination New J. Chem. 42 2018 20131 20136 10.1039/c8nj04410d W. Liu, M. Zhu, B. Dai, Nitrogen doped nanoflower porous carbon as a nonmetal catalyst for acetylene hydrochlorination, New J. Chem., 42 (2018) 20131-20136. https://doi.org/10.1039/c8nj04410d. [38] X. Li J. Zhang Y. Han M. Zhu S. Shang W. Li MOF-derived various morphologies of N-doped carbon composites for acetylene hydrochlorination J. Mater. Sci. 53 2017 4913 4926 10.1007/s10853-017-1951-3 X. Li, J. Zhang, Y. Han, M. Zhu, S. Shang, W. Li, MOF-derived various morphologies of N-doped carbon composites for acetylene hydrochlorination, J. Mater. Sci., 53 (2017) 4913-4926. https://doi.org/10.1007/s10853-017-1951-3. [39] S. Chao F. Zou F. Wan X. Dong Y. Wang Y. Wang Q. Guan G. Wang W. Li Nitrogen-doped carbon derived from ZIF-8 as a high-performance metal-free catalyst for acetylene hydrochlorination Sci. Rep. 7 2017 39789 10.1038/srep39789 S. Chao, F. Zou, F. Wan, X. Dong, Y. Wang, Y. Wang, Q. Guan, G. Wang, W. Li, Nitrogen-doped carbon derived from ZIF-8 as a high-performance metal-free catalyst for acetylene hydrochlorination, Sci. Rep., 7 (2017) 39789. https://doi.org/10.1038/srep39789. [40] X. Li J. Zhang W. Li MOF-derived nitrogen-doped porous carbon as metal-free catalysts for acetylene hydrochlorination J. Ind. Eng. Chem. 44 2016 146 154 10.1016/j.jiec.2016.08.024 X. Li, J. Zhang, W. Li, MOF-derived nitrogen-doped porous carbon as metal-free catalysts for acetylene hydrochlorination, J. Ind. Eng. Chem., 44 (2016) 146-154. https://doi.org/10.1016/j.jiec.2016.08.024. [41] R. Lin S.K. Kaiser R. Hauert J. Pérez-Ramírez Descriptors for high-performance nitrogen-doped carbon catalysts in acetylene hydrochlorination ACS Catal. 8 2018 1114 1121 10.1021/acscatal.7b03031 R. Lin, S.K. Kaiser, R. Hauert, J. Pérez-Ramírez, Descriptors for high-performance nitrogen-doped carbon catalysts in acetylene hydrochlorination, ACS Catal., 8 (2018) 1114-1121. https://doi.org/10.1021/acscatal.7b03031. [42] X. Qiao X. Liu Z. Zhou Q. Guan W. Li Constructing green mercury-free catalysts with single pyridinic N species for acetylene hydrochlorination and mechanism investigation Catal. Sci. Technol. 11 2021 2327 2339 10.1039/d0cy01950j X. Qiao, X. Liu, Z. Zhou, Q. Guan, W. Li, Constructing green mercury-free catalysts with single pyridinic N species for acetylene hydrochlorination and mechanism investigation, Catal. Sci. Technol., 11 (2021) 2327-2339. https://doi.org/10.1039/d0cy01950j. [43] Y. Lu F. Lu M. Zhu Nitrogen-modified metal-free carbon materials for acetylene hydrochlorination J. Taiwan Inst. Chem. Eng. 113 2020 198 203 10.1016/j.jtice.2020.08.008 Y. Lu, F. Lu, M. Zhu, Nitrogen-modified metal-free carbon materials for acetylene hydrochlorination, J. Taiwan Inst. Chem. Eng., 113 (2020) 198-203. https://doi.org/10.1016/j.jtice.2020.08.008. [44] S. Mei J. Gu T. Ma X. Li Y. Hu W. Li J. Zhang Y. Han N-doped activated carbon from used dyeing wastewater adsorbent as a metal-free catalyst for acetylene hydrochlorination Chem. Eng. J. 371 2019 118 129 10.1016/j.cej.2019.04.008 S. Mei, J. Gu, T. Ma, X. Li, Y. Hu, W. Li, J. Zhang, Y. Han, N-doped activated carbon from used dyeing wastewater adsorbent as a metal-free catalyst for acetylene hydrochlorination, Chem. Eng. J., 371 (2019) 118-129. https://doi.org/10.1016/j.cej.2019.04.008. [45] G. Lan Y. Wang Y. Qiu X. Wang J. Liang W. Han H. Tang H. Liu J. Liu Y. Li Wheat flour-derived N-doped mesoporous carbon extrudate as superior metal-free catalysts for acetylene hydrochlorination Chem. Commun. (Camb.) 54 2018 623 626 10.1039/c7cc09370e G. Lan, Y. Wang, Y. Qiu, X. Wang, J. Liang, W. Han, H. Tang, H. Liu, J. Liu, Y. Li, Wheat flour-derived N-doped mesoporous carbon extrudate as superior metal-free catalysts for acetylene hydrochlorination, Chem. Commun. (Camb.), 54 (2018) 623-626. https://doi.org/10.1039/c7cc09370e. [46] Z. Shen Y. Liu Y. Han Y. Qin J. Li P. Xing B. Jiang Nitrogen-doped porous carbon from biomass with superior catalytic performance for acetylene hydrochlorination RSC Adv. 10 2020 14556 14569 10.1039/d0ra00475h Z. Shen, Y. Liu, Y. Han, Y. Qin, J. Li, P. Xing, B. Jiang, Nitrogen-doped porous carbon from biomass with superior catalytic performance for acetylene hydrochlorination, RSC Adv.., 10 (2020) 14556-14569. https://doi.org/10.1039/d0ra00475h. [47] L. Jia Y. Yu J.-R. Guo S.-N. Qin Y.-L. Wang X. Shen B. Fan Y. Jin Study of the molecular structure and elemental mercury adsorption mechanism of biomass char Energy Fuel 34 2020 12743 12756 10.1021/acs.energyfuels.0c02626 L. Jia, Y. Yu, J.-R. Guo, S.-N. Qin, Y.-L. Wang, X. Shen, B. Fan, Y. Jin, Study of the molecular structure and elemental mercury adsorption mechanism of biomass char, Energy Fuel, 34 (2020) 12743-12756. https://doi.org/10.1021/acs.energyfuels.0c02626. [48] H. Wang G. Li S. Zhang Y. Li Y. Zhao L. Duan Y. Zhang Preparation of Cu-loaded biomass-derived activated carbon catalysts for catalytic wet air oxidation of phenol Ind. Eng. Chem. Res. 59 2020 2908 2920 10.1021/acs.iecr.9b05750 H. Wang, G. Li, S. Zhang, Y. Li, Y. Zhao, L. Duan, Y. Zhang, Preparation of Cu-loaded biomass-derived activated carbon catalysts for catalytic wet air oxidation of phenol, Ind. Eng. Chem. Res., 59 (2020) 2908-2920. https://doi.org/10.1021/acs.iecr.9b05750. [49] Y. Zhang X. Zhang B. Qing M. Xia Y. Yan Adsorption of heavy metal ions from wastewater using walnut shell-based adsorbent J. Yanan Univ. (Natural Science Edition) 33 2014 69 73 10.3969/J Y. Zhang, X. Zhang, B. Qing, M. Xia, Y. Yan, Adsorption of heavy metal ions from wastewater using walnut shell-based adsorbent, J. Yanan Univ. (Natural Science Edition), 33 (2014) 69-73. https://doi.org/10.3969/J. [50] C.C.D. Wu X. Hou K. Sun Effect of pyrolysis temperature on structures of chars forming from cellulose and lignin Biomass Chem. Eng. 55 2021 1 9 https://d.wanfangdata.com.cn/periodical/lchgtx202103001 C.C.D. Wu, X. Hou, K. Sun, Effect of pyrolysis temperature on structures of chars forming from cellulose and lignin, Biomass Chem. Eng., 55 (2021) 1-9. https://d.wanfangdata.com.cn/periodical/lchgtx202103001 [51] J. Wang W. Gong M. Zhu B. Dai Effect of carbon defects on the nitrogen-doped carbon catalytic performance for acetylene hydrochlorination Appl. Catal., A 564 2018 72 78 10.1016/j.apcata.2018.07.025 J. Wang, W. Gong, M. Zhu, B. Dai, Effect of carbon defects on the nitrogen-doped carbon catalytic performance for acetylene hydrochlorination, Appl. Catal., A, 564 (2018) 72-78. https://doi.org/10.1016/j.apcata.2018.07.025. [52] Y. Hu K. Xie H. Wang C. Yuan B. Cao L. Qian S. Wang F. Fazeli Zafar K. Ding Q. Wang Preparation and property of N-doped porous carbon material by one-step pyrolysis of protein-rich algal biomass J. Anal. Appl. Pyrolysis 157 2021 105221 10.1016/j.jaap.2021.105221 Y. Hu, K. Xie, H. Wang, C. Yuan, B. Cao, L. Qian, S. Wang, F. Fazeli Zafar, K. Ding, Q. Wang, Preparation and property of N-doped porous carbon material by one-step pyrolysis of protein-rich algal biomass, J. Anal. Appl. Pyrolysis, 157 (2021) 105221. https://doi.org/10.1016/j.jaap.2021.105221. [53] N. Hameed J. Sharp S. Nunna C. Creighton K. Magniez P. Jyotishkumar N.V. Salim B. Fox Structural transformation of polyacrylonitrile fibers during stabilization and low temperature carbonization Polym. Degrad. Stability 128 2016 39 45 10.1016/j.polymdegradstab.2016.02.029 N. Hameed, J. Sharp, S. Nunna, C. Creighton, K. Magniez, P. Jyotishkumar, N.V. Salim, B. Fox, Structural transformation of polyacrylonitrile fibers during stabilization and low temperature carbonization, Polym. Degrad. Stability, 128 (2016) 39-45. https://doi.org/10.1016/j.polymdegradstab.2016.02.029. [54] H.J. Zhan W.H. Yang M.Q. An N. Zeng Y.R. Hu X.T. Ma L. Zhao Microwave irradiation synthesized Cobalt-loaded nitrogen-doped active carbon as an efficient catalyst for selective oxidation of ethylbenzene IOP Conf. Ser. 562 2019 012004 10.1088/1757-899X/562/1/012004 H.J. Zhan, W.H. Yang, M.Q. An, N. Zeng, Y.R. Hu, X.T. Ma, L. Zhao, Microwave irradiation synthesized Cobalt-loaded nitrogen-doped active carbon as an efficient catalyst for selective oxidation of ethylbenzene, IOP Conf. Ser., 562 (2019) 012004. DOI:10.1088/1757-899X/562/1/012004 [55] M.L. Godino-Salido R. López-Garzón M.D. Gutiérrez-Valero P. Arranz-Mascarós M. Melguizo-Guijarro M.D. López de la Torre V. Gómez-Serrano M. Alexandre-Franco D. Lozano-Castelló D. Cazorla-Amorós M. Domingo-García Effect of the surface chemical groups of activated carbons on their surface adsorptivity to aromatic adsorbates based on π-π interactions Mater. Chem. Phys. 143 2014 1489 1499 10.1016/j.matchemphys.2013.12.005 M.L. Godino-Salido, R. López-Garzón, M.D. Gutiérrez-Valero, P. Arranz-Mascarós, M. Melguizo-Guijarro, M.D. López de la Torre, V. Gómez-Serrano, M. Alexandre-Franco, D. Lozano-Castelló, D. Cazorla-Amorós, M. Domingo-García, Effect of the surface chemical groups of activated carbons on their surface adsorptivity to aromatic adsorbates based on π-π interactions, Mater. Chem. Phys., 143 (2014) 1489-1499. https://doi.org/10.1016/j.matchemphys.2013.12.005. [56] X. Huai W. Duan J. Li Q. Zhang Q. Dong Y. Cao T. Wang Z. Zhang Z. Hang Facile one-step synthesis and fluorescence performance study of nitrogen-doped carbon quantum dots Funct. Mater. Lett. 14 2021 1217 1229 10.1142/S1793604721500090 X. Huai, W. Duan, J. Li, Q. Zhang, Q. Dong, Y. Cao, T. Wang, Z. Zhang, Z. Hang, Facile one-step synthesis and fluorescence performance study of nitrogen-doped carbon quantum dots, Funct. Mater. Lett., 14 (2021) 1217-1229. https://doi.org/10.1142/S1793604721500090 [57] Y. Dong M. Zhou W. Tu E. Zhu Y. Chen Y. Zhao S. Liao Y. Huang Q. Chen Y. Li Hollow loofah-like N, O-Co-doped carbon tube for electrocatalysis of oxygen reduction Adv. Funct. Mater. 29 2019 1900015 10.1002/adfm.201900015 Y. Dong, M. Zhou, W. Tu, E. Zhu, Y. Chen, Y. Zhao, S. Liao, Y. Huang, Q. Chen, Y. Li, Hollow loofah-like N, O-Co-doped carbon tube for electrocatalysis of oxygen reduction, Adv. Funct. Mater., 29 (2019) 1900015. https://doi.org/10.1002/adfm.201900015. [58] D. Hulicova-Jurcakova M. Seredych G.Q. Lu T.J. Bandosz Combined Effect of nitrogen- and oxygen-containing functional groups of microporous activated carbon on its electrochemical performance in supercapacitors Adv. Funct. Mater. 19 2009 438 447 10.1002/adfm.200801236 D. Hulicova-Jurcakova, M. Seredych, G.Q. Lu, T.J. Bandosz, Combined Effect of nitrogen- and oxygen-containing functional groups of microporous activated carbon on its electrochemical performance in supercapacitors, Adv. Funct. Mater., 19 (2009) 438-447. https://doi.org/10.1002/adfm.200801236. [59] M. Li Y. Zhang L. Yang Y. Liu J. Yao Hollow melamine resin-based carbon spheres/graphene composite with excellent performance for supercapacitors Electrochim. Acta 166 2015 310 319 10.1016/j.electacta.2015.03.078 M. Li, Y. Zhang, L. Yang, Y. Liu, J. Yao, Hollow melamine resin-based carbon spheres/graphene composite with excellent performance for supercapacitors, Electrochim. Acta, 166 (2015) 310-319. https://doi.org/10.1016/j.electacta.2015.03.078. [60] T. Horikawa N. Sakao T. Sekida J.i. Hayashi D.D. Do M. Katoh Preparation of nitrogen-doped porous carbon by ammonia gas treatment and the effects of N-doping on water adsorption Carbon 50 2012 1833 1842 10.1016/j.carbon.2011.12.033 T. Horikawa, N. Sakao, T. Sekida, J.i. Hayashi, D.D. Do, M. Katoh, Preparation of nitrogen-doped porous carbon by ammonia gas treatment and the effects of N-doping on water adsorption, Carbon, 50 (2012) 1833-1842. https://doi.org/10.1016/j.carbon.2011.12.033. [61] X. Dong S. Chao F. Wan Q. Guan G. Wang W. Li Sulfur and nitrogen co-doped mesoporous carbon with enhanced performance for acetylene hydrochlorination J. Catal. 359 2018 161 170 10.1016/j.jcat.2017.12.016 X. Dong, S. Chao, F. Wan, Q. Guan, G. Wang, W. Li, Sulfur and nitrogen co-doped mesoporous carbon with enhanced performance for acetylene hydrochlorination, J. Catal., 359 (2018) 161-170. https://doi.org/10.1016/j.jcat.2017.12.016. [62] B. Wang Y. Yue X. Pang W. Zhu Z. Chen S. Shao T. Wang Z. Pan X. Li J. Zhao Synergistic effect of two action sites on a nitrogen-doped carbon catalyst towards acetylene hydrochlorination Phys. Chem. Chem. Phys. 22 2020 20995 20999 10.1039/D0CP04043F B. Wang, Y. Yue, X. Pang, W. Zhu, Z. Chen, S. Shao, T. Wang, Z. Pan, X. Li, J. Zhao, Synergistic effect of two action sites on a nitrogen-doped carbon catalyst towards acetylene hydrochlorination, Phys. Chem. Chem. Phys., 22 (2020) 20995-20999. https://doi.org/10.1039/D0CP04043F. [63] X. Li P. Li X. Pan H. Ma X. Bao Deactivation mechanism and regeneration of carbon nanocomposite catalyst for acetylene hydrochlorination Appl. Catal., B 210 2017 116 120 10.1016/j.apcatb.2017.03.046 X. Li, P. Li, X. Pan, H. Ma, X. Bao, Deactivation mechanism and regeneration of carbon nanocomposite catalyst for acetylene hydrochlorination, Appl. Catal., B, 210 (2017) 116-120. https://doi.org/10.1016/j.apcatb.2017.03.046. [64] H. Zhang W. Li Y. Jin W. Sheng M. Hu X. Wang J. Zhang Ru-Co(III)-Cu(II)/SAC catalyst for acetylene hydrochlorination Appl. Catal., B 189 2016 56 64 10.1016/j.apcatb.2016.02.030 H. Zhang, W. Li, Y. Jin, W. Sheng, M. Hu, X. Wang, J. Zhang, Ru-Co(III)-Cu(II)/SAC catalyst for acetylene hydrochlorination, Appl. Catal., B, 189 (2016) 56-64. https://doi.org/10.1016/j.apcatb.2016.02.030.",
      "scopus-id": "85139858678",
      "coredata": {
        "eid": "1-s2.0-S2468823122006058",
        "dc:description": "Mercuric chloride as main catalyst for acetylene hydrochlorination poses a serious hazard to the environment due to its easily volatilizing and highly toxic characteristics. Mercuric-free catalysts, especially metal-free catalysts, are quite intriguing in the industrial production of acetylene hydrochlorination. In this work, nitrogen-doped biochar is prepared as green metal-free catalyst for acetylene hydrochlorination with natural walnut shells as starting material, in which the condensation product of dicyandiamide or dicyandiamide-formaldehyde is applied as nitrogen source. The 2.5DF/BC-850 catalyst exhibits superior catalytic activity with C2H2 conversion of 94.5% at 220°C and 45 h−1, which is attributed to the high content of quaternary nitrogen as active center. The introduction of formaldehyde effectively inhibits the carbon deposition in the catalytic reaction and improves the thermal stability of metal-free nitrogen-doped biochar catalyst. This work provides a significant insight into the design of environmentally friendly metal-free nitrogen-doped biochar catalysts for acetylene hydrochlorination.",
        "openArchiveArticle": "false",
        "prism:coverDate": "2022-11-30",
        "openaccessUserLicense": null,
        "prism:aggregationType": "Journal",
        "prism:url": "https://api.elsevier.com/content/article/pii/S2468823122006058",
        "dc:creator": [
          {
            "@_fa": "true",
            "$": "Wu, Shuwen"
          },
          {
            "@_fa": "true",
            "$": "Jiang, Aiyun"
          },
          {
            "@_fa": "true",
            "$": "Zhou, Xiaofei"
          },
          {
            "@_fa": "true",
            "$": "Liu, Yingliang"
          },
          {
            "@_fa": "true",
            "$": "Cao, Shaokui"
          }
        ],
        "link": [
          {
            "@_fa": "true",
            "@rel": "self",
            "@href": "https://api.elsevier.com/content/article/pii/S2468823122006058"
          },
          {
            "@_fa": "true",
            "@rel": "scidir",
            "@href": "https://www.sciencedirect.com/science/article/pii/S2468823122006058"
          }
        ],
        "dc:format": "application/json",
        "openaccessType": null,
        "pii": "S2468-8231(22)00605-8",
        "prism:volume": "532",
        "articleNumber": "112719",
        "prism:publisher": "Elsevier B.V.",
        "dc:title": "Environmentally friendly high-efficient metal-free catalyst for acetylene hydrochlorination derived from walnut shell-based N-doped biochar",
        "prism:copyright": "© 2022 Elsevier B.V. All rights reserved.",
        "openaccess": "0",
        "prism:issn": "24688231",
        "dcterms:subject": [
          {
            "@_fa": "true",
            "$": "Biomass"
          },
          {
            "@_fa": "true",
            "$": "Walnut shell"
          },
          {
            "@_fa": "true",
            "$": "Acetylene hydrochlorination"
          },
          {
            "@_fa": "true",
            "$": "Metal-free catalyst"
          },
          {
            "@_fa": "true",
            "$": "Quaternary nitrogen"
          }
        ],
        "openaccessArticle": "false",
        "prism:publicationName": "Molecular Catalysis",
        "openaccessSponsorType": null,
        "prism:pageRange": "112719",
        "pubType": "fla",
        "prism:coverDisplayDate": "November 2022",
        "prism:doi": "10.1016/j.mcat.2022.112719",
        "prism:startingPage": "112719",
        "dc:identifier": "doi:10.1016/j.mcat.2022.112719",
        "openaccessSponsorName": null
      },
      "objects": {
        "object": [
          {
            "@category": "standard",
            "@height": "423",
            "@width": "565",
            "@_fa": "true",
            "$": "https://api.elsevier.com/content/object/eid/1-s2.0-S2468823122006058-gr5.jpg?httpAccept=%2A%2F%2A",
            "@multimediatype": "JPEG image file",
            "@type": "IMAGE-DOWNSAMPLED",
            "@size": "85075",
            "@ref": "gr5",
            "@mimetype": "image/jpeg"
          },
          {
            "@category": "standard",
            "@height": "465",
            "@width": "565",
            "@_fa": "true",
            "$": "https://api.elsevier.com/content/object/eid/1-s2.0-S2468823122006058-gr6.jpg?httpAccept=%2A%2F%2A",
            "@multimediatype": "JPEG image file",
            "@type": "IMAGE-DOWNSAMPLED",
            "@size": "112858",
            "@ref": "gr6",
            "@mimetype": "image/jpeg"
          },
          {
            "@category": "standard",
            "@height": "327",
            "@width": "339",
            "@_fa": "true",
            "$": "https://api.elsevier.com/content/object/eid/1-s2.0-S2468823122006058-gr7.jpg?httpAccept=%2A%2F%2A",
            "@multimediatype": "JPEG image file",
            "@type": "IMAGE-DOWNSAMPLED",
            "@size": "32503",
            "@ref": "gr7",
            "@mimetype": "image/jpeg"
          },
          {
            "@category": "standard",
            "@height": "201",
            "@width": "565",
            "@_fa": "true",
            "$": "https://api.elsevier.com/content/object/eid/1-s2.0-S2468823122006058-gr8.jpg?httpAccept=%2A%2F%2A",
            "@multimediatype": "JPEG image file",
            "@type": "IMAGE-DOWNSAMPLED",
            "@size": "51705",
            "@ref": "gr8",
            "@mimetype": "image/jpeg"
          },
          {
            "@category": "standard",
            "@height": "200",
            "@width": "489",
            "@_fa": "true",
            "$": "https://api.elsevier.com/content/object/eid/1-s2.0-S2468823122006058-gr1.jpg?httpAccept=%2A%2F%2A",
            "@multimediatype": "JPEG image file",
            "@type": "IMAGE-DOWNSAMPLED",
            "@size": "45720",
            "@ref": "gr1",
            "@mimetype": "image/jpeg"
          },
          {
            "@category": "standard",
            "@height": "210",
            "@width": "565",
            "@_fa": "true",
            "$": "https://api.elsevier.com/content/object/eid/1-s2.0-S2468823122006058-gr2.jpg?httpAccept=%2A%2F%2A",
            "@multimediatype": "JPEG image file",
            "@type": "IMAGE-DOWNSAMPLED",
            "@size": "45032",
            "@ref": "gr2",
            "@mimetype": "image/jpeg"
          },
          {
            "@category": "standard",
            "@height": "166",
            "@width": "301",
            "@_fa": "true",
            "$": "https://api.elsevier.com/content/object/eid/1-s2.0-S2468823122006058-ga1.jpg?httpAccept=%2A%2F%2A",
            "@multimediatype": "JPEG image file",
            "@type": "IMAGE-DOWNSAMPLED",
            "@size": "19412",
            "@ref": "ga1",
            "@mimetype": "image/jpeg"
          },
          {
            "@category": "standard",
            "@height": "223",
            "@width": "565",
            "@_fa": "true",
            "$": "https://api.elsevier.com/content/object/eid/1-s2.0-S2468823122006058-gr3.jpg?httpAccept=%2A%2F%2A",
            "@multimediatype": "JPEG image file",
            "@type": "IMAGE-DOWNSAMPLED",
            "@size": "42456",
            "@ref": "gr3",
            "@mimetype": "image/jpeg"
          },
          {
            "@category": "standard",
            "@height": "184",
            "@width": "565",
            "@_fa": "true",
            "$": "https://api.elsevier.com/content/object/eid/1-s2.0-S2468823122006058-gr4.jpg?httpAccept=%2A%2F%2A",
            "@multimediatype": "JPEG image file",
            "@type": "IMAGE-DOWNSAMPLED",
            "@size": "37257",
            "@ref": "gr4",
            "@mimetype": "image/jpeg"
          },
          {
            "@category": "standard",
            "@height": "252",
            "@width": "565",
            "@_fa": "true",
            "$": "https://api.elsevier.com/content/object/eid/1-s2.0-S2468823122006058-sc1.jpg?httpAccept=%2A%2F%2A",
            "@multimediatype": "JPEG image file",
            "@type": "IMAGE-DOWNSAMPLED",
            "@size": "39597",
            "@ref": "sc1",
            "@mimetype": "image/jpeg"
          },
          {
            "@category": "thumbnail",
            "@height": "164",
            "@width": "219",
            "@_fa": "true",
            "$": "https://api.elsevier.com/content/object/eid/1-s2.0-S2468823122006058-gr5.sml?httpAccept=%2A%2F%2A",
            "@multimediatype": "GIF image file",
            "@type": "IMAGE-THUMBNAIL",
            "@size": "12992",
            "@ref": "gr5",
            "@mimetype": "image/gif"
          },
          {
            "@category": "thumbnail",
            "@height": "164",
            "@width": "199",
            "@_fa": "true",
            "$": "https://api.elsevier.com/content/object/eid/1-s2.0-S2468823122006058-gr6.sml?httpAccept=%2A%2F%2A",
            "@multimediatype": "GIF image file",
            "@type": "IMAGE-THUMBNAIL",
            "@size": "15299",
            "@ref": "gr6",
            "@mimetype": "image/gif"
          },
          {
            "@category": "thumbnail",
            "@height": "164",
            "@width": "170",
            "@_fa": "true",
            "$": "https://api.elsevier.com/content/object/eid/1-s2.0-S2468823122006058-gr7.sml?httpAccept=%2A%2F%2A",
            "@multimediatype": "GIF image file",
            "@type": "IMAGE-THUMBNAIL",
            "@size": "18452",
            "@ref": "gr7",
            "@mimetype": "image/gif"
          },
          {
            "@category": "thumbnail",
            "@height": "78",
            "@width": "219",
            "@_fa": "true",
            "$": "https://api.elsevier.com/content/object/eid/1-s2.0-S2468823122006058-gr8.sml?httpAccept=%2A%2F%2A",
            "@multimediatype": "GIF image file",
            "@type": "IMAGE-THUMBNAIL",
            "@size": "8883",
            "@ref": "gr8",
            "@mimetype": "image/gif"
          },
          {
            "@category": "thumbnail",
            "@height": "90",
            "@width": "219",
            "@_fa": "true",
            "$": "https://api.elsevier.com/content/object/eid/1-s2.0-S2468823122006058-gr1.sml?httpAccept=%2A%2F%2A",
            "@multimediatype": "GIF image file",
            "@type": "IMAGE-THUMBNAIL",
            "@size": "9561",
            "@ref": "gr1",
            "@mimetype": "image/gif"
          },
          {
            "@category": "thumbnail",
            "@height": "81",
            "@width": "219",
            "@_fa": "true",
            "$": "https://api.elsevier.com/content/object/eid/1-s2.0-S2468823122006058-gr2.sml?httpAccept=%2A%2F%2A",
            "@multimediatype": "GIF image file",
            "@type": "IMAGE-THUMBNAIL",
            "@size": "8400",
            "@ref": "gr2",
            "@mimetype": "image/gif"
          },
          {
            "@category": "thumbnail",
            "@height": "121",
            "@width": "219",
            "@_fa": "true",
            "$": "https://api.elsevier.com/content/object/eid/1-s2.0-S2468823122006058-ga1.sml?httpAccept=%2A%2F%2A",
            "@multimediatype": "GIF image file",
            "@type": "IMAGE-THUMBNAIL",
            "@size": "11720",
            "@ref": "ga1",
            "@mimetype": "image/gif"
          },
          {
            "@category": "thumbnail",
            "@height": "86",
            "@width": "219",
            "@_fa": "true",
            "$": "https://api.elsevier.com/content/object/eid/1-s2.0-S2468823122006058-gr3.sml?httpAccept=%2A%2F%2A",
            "@multimediatype": "GIF image file",
            "@type": "IMAGE-THUMBNAIL",
            "@size": "8072",
            "@ref": "gr3",
            "@mimetype": "image/gif"
          },
          {
            "@category": "thumbnail",
            "@height": "71",
            "@width": "219",
            "@_fa": "true",
            "$": "https://api.elsevier.com/content/object/eid/1-s2.0-S2468823122006058-gr4.sml?httpAccept=%2A%2F%2A",
            "@multimediatype": "GIF image file",
            "@type": "IMAGE-THUMBNAIL",
            "@size": "12069",
            "@ref": "gr4",
            "@mimetype": "image/gif"
          },
          {
            "@category": "thumbnail",
            "@height": "98",
            "@width": "219",
            "@_fa": "true",
            "$": "https://api.elsevier.com/content/object/eid/1-s2.0-S2468823122006058-sc1.sml?httpAccept=%2A%2F%2A",
            "@multimediatype": "GIF image file",
            "@type": "IMAGE-THUMBNAIL",
            "@size": "10670",
            "@ref": "sc1",
            "@mimetype": "image/gif"
          },
          {
            "@category": "high",
            "@height": "1870",
            "@width": "2500",
            "@_fa": "true",
            "$": "https://api.elsevier.com/content/object/eid/1-s2.0-S2468823122006058-gr5_lrg.jpg?httpAccept=%2A%2F%2A",
            "@multimediatype": "JPEG image file",
            "@type": "IMAGE-HIGH-RES",
            "@size": "557905",
            "@ref": "gr5",
            "@mimetype": "image/jpeg"
          },
          {
            "@category": "high",
            "@height": "2059",
            "@width": "2500",
            "@_fa": "true",
            "$": "https://api.elsevier.com/content/object/eid/1-s2.0-S2468823122006058-gr6_lrg.jpg?httpAccept=%2A%2F%2A",
            "@multimediatype": "JPEG image file",
            "@type": "IMAGE-HIGH-RES",
            "@size": "872182",
            "@ref": "gr6",
            "@mimetype": "image/jpeg"
          },
          {
            "@category": "high",
            "@height": "1447",
            "@width": "1500",
            "@_fa": "true",
            "$": "https://api.elsevier.com/content/object/eid/1-s2.0-S2468823122006058-gr7_lrg.jpg?httpAccept=%2A%2F%2A",
            "@multimediatype": "JPEG image file",
            "@type": "IMAGE-HIGH-RES",
            "@size": "299259",
            "@ref": "gr7",
            "@mimetype": "image/jpeg"
          },
          {
            "@category": "high",
            "@height": "891",
            "@width": "2500",
            "@_fa": "true",
            "$": "https://api.elsevier.com/content/object/eid/1-s2.0-S2468823122006058-gr8_lrg.jpg?httpAccept=%2A%2F%2A",
            "@multimediatype": "JPEG image file",
            "@type": "IMAGE-HIGH-RES",
            "@size": "360176",
            "@ref": "gr8",
            "@mimetype": "image/jpeg"
          },
          {
            "@category": "high",
            "@height": "888",
            "@width": "2167",
            "@_fa": "true",
            "$": "https://api.elsevier.com/content/object/eid/1-s2.0-S2468823122006058-gr1_lrg.jpg?httpAccept=%2A%2F%2A",
            "@multimediatype": "JPEG image file",
            "@type": "IMAGE-HIGH-RES",
            "@size": "306545",
            "@ref": "gr1",
            "@mimetype": "image/jpeg"
          },
          {
            "@category": "high",
            "@height": "928",
            "@width": "2500",
            "@_fa": "true",
            "$": "https://api.elsevier.com/content/object/eid/1-s2.0-S2468823122006058-gr2_lrg.jpg?httpAccept=%2A%2F%2A",
            "@multimediatype": "JPEG image file",
            "@type": "IMAGE-HIGH-RES",
            "@size": "285904",
            "@ref": "gr2",
            "@mimetype": "image/jpeg"
          },
          {
            "@category": "high",
            "@height": "737",
            "@width": "1333",
            "@_fa": "true",
            "$": "https://api.elsevier.com/content/object/eid/1-s2.0-S2468823122006058-ga1_lrg.jpg?httpAccept=%2A%2F%2A",
            "@multimediatype": "JPEG image file",
            "@type": "IMAGE-HIGH-RES",
            "@size": "126840",
            "@ref": "ga1",
            "@mimetype": "image/jpeg"
          },
          {
            "@category": "high",
            "@height": "986",
            "@width": "2500",
            "@_fa": "true",
            "$": "https://api.elsevier.com/content/object/eid/1-s2.0-S2468823122006058-gr3_lrg.jpg?httpAccept=%2A%2F%2A",
            "@multimediatype": "JPEG image file",
            "@type": "IMAGE-HIGH-RES",
            "@size": "274395",
            "@ref": "gr3",
            "@mimetype": "image/jpeg"
          },
          {
            "@category": "high",
            "@height": "813",
            "@width": "2500",
            "@_fa": "true",
            "$": "https://api.elsevier.com/content/object/eid/1-s2.0-S2468823122006058-gr4_lrg.jpg?httpAccept=%2A%2F%2A",
            "@multimediatype": "JPEG image file",
            "@type": "IMAGE-HIGH-RES",
            "@size": "352892",
            "@ref": "gr4",
            "@mimetype": "image/jpeg"
          },
          {
            "@category": "high",
            "@height": "1117",
            "@width": "2500",
            "@_fa": "true",
            "$": "https://api.elsevier.com/content/object/eid/1-s2.0-S2468823122006058-sc1_lrg.jpg?httpAccept=%2A%2F%2A",
            "@multimediatype": "JPEG image file",
            "@type": "IMAGE-HIGH-RES",
            "@size": "323325",
            "@ref": "sc1",
            "@mimetype": "image/jpeg"
          },
          {
            "@category": "standard",
            "@_fa": "true",
            "$": "https://api.elsevier.com/content/object/eid/1-s2.0-S2468823122006058-mmc1.docx?httpAccept=%2A%2F%2A",
            "@multimediatype": "Microsoft Word file",
            "@type": "APPLICATION",
            "@size": "15415442",
            "@ref": "mmc1",
            "@mimetype": "application/word"
          },
          {
            "@category": "standard",
            "@_fa": "true",
            "$": "https://api.elsevier.com/content/object/eid/1-s2.0-S2468823122006058-am.pdf?httpAccept=%2A%2F%2A",
            "@multimediatype": "Acrobat PDF file",
            "@type": "AAM-PDF",
            "@size": "924819",
            "@ref": "am",
            "@mimetype": "application/pdf"
          }
        ]
      },
      "link": {
        "@rel": "abstract",
        "@href": "https://api.elsevier.com/content/abstract/scopus_id/85139858678"
      }
    }
  }
}