{
  "metadata": {
    "title": "A magnetically-separable H<ce:inf loc=post>3</ce:inf>PW<ce:inf loc=post>12</ce:inf>O<ce:inf loc=post>40</ce:inf>@Fe<ce:inf loc=post>3</ce:inf>O<ce:inf loc=post>4</ce:inf>/EN-MIL-101 catalyst for the one-pot solventless synthesis of 2H-indazolo[2,1-<ce:italic>b</ce:italic>] phthalazine-triones",
    "authors": "; ; ",
    "journal": "Molecular Catalysis",
    "date": "2017-10-31",
    "doi": "10.1016/j.mcat.2017.07.010",
    "abstract": "",
    "uri": "https://api.elsevier.com/content/article/pii/S2468823117304005",
    "pii": "S2468823117304005"
  },
  "fulltext": {
    "full-text-retrieval-response": {
      "scopus-eid": "2-s2.0-85029588833",
      "originalText": "serial JL 315758 291210 291744 291790 291809 31 Molecular Catalysis MOLECULARCATALYSIS 2017-08-05 2017-08-05 2017-08-05 2017-08-05 2018-07-09T20:04:52 1-s2.0-S2468823117304005 S2468-8231(17)30400-5 S2468823117304005 10.1016/j.mcat.2017.07.010 S300 S300.2 FULL-TEXT 1-s2.0-S2468823117X0014X 2018-07-09T21:52:14.092726Z 0 0 20171001 20171031 2017 2017-08-05T10:37:18.216785Z absattachment articleinfo articletitlenorm authfirstinitialnorm authfirstsurnamenorm cid cids contenttype copyright crossmark dateloaded dateloadedtxt datesearch datesort dateupdated dco docsubtype doctype doi eid ewtransactionid hubeid indexeddate issn issnnorm itemstage itemtransactionid itemweight openaccess openarchive pg pgfirst pglast pii piinorm pubdateend pubdatestart pubdatetxt pubyr sectiontitle sortorder srctitle srctitlenorm srctype ssids alllist content subj subheadings suppl tomb volfirst volissue volumelist webpdf webpdfpagecount yearnav figure table e-component body acknowledge affil appendices articletitle auth authfirstini authfull authkeywords authlast grantsponsor highlightsabst primabst pubtype ref specialabst 2468-8231 24688231 true 440 440 C Volume 440 14 96 106 96 106 201710 October 2017 2017-10-01 2017-10-31 2017 Regular Papers article fla © 2017 Elsevier B.V. All rights reserved. AMAGNETICALLYSEPARABLEH3PW12O40FE3O4ENMIL101CATALYSTFORONEPOTSOLVENTLESSSYNTHESIS2HINDAZOLO21BPHTHALAZINETRIONES HASHEMZADEH A 1 Introduction 2 Experimental section 2.1 Materials and methods 2.2 Preparation of chromium(III) terephthalate metal organic framework [MIL-101(Cr)] 2.3 Synthesis of EN-MIL-101 2.4 Synthesis of Fe3O4/EN-MIL-101 2.5 Synthesis of PTA@Fe3O4/EN-MIL-101 2.6 General procedure for the preparation of 2H-indazolo-[2,1-b]phthalazine-1,6,11(13H)-triones 3 Results and discussion 3.1 Structural characterization 3.2 Catalytic tests 3.3 Impact of catalyst components 3.4 Phthalhydrazide and benzaldehyde condensation with diverse diketones 3.5 Benchmarking of PTA@Fe3O4/EN-MIL-101 against literature 3.6 Synthesis of different phthalazine-triones 3.7 Leaching test 3.8 Recyclability of PTA@Fe3O4/EN-MIL-101 3.9 Proposed reaction pathway for a heterogeneous catalytic system 4 Conclusions Acknowledgments Appendix A Supplementary data References CHUGHTAI 2015 6804 6849 A OARARTETA 2017 L ZHAO 2014 1199 1207 M ZHAO 2017 80 96 S DHANALAXMI 2017 1033 1045 K ARANDIYAN 2016 2457 2463 H NGNIE 2016 9065 9072 G XUAN 2012 1677 1695 W CZAJA 2009 1284 1293 A HWANG 2008 4144 4148 Y LI 2012 6151 6153 B DIETZEL 2009 7362 7370 P LEE 2009 1450 1459 J VALVEKENS 2013 1435 1445 P HONG 2009 1537 1552 D KURMOO 2009 1353 1379 M ZHAO 2015 11849 X DUNN 2012 1452 1461 P DUNN 2013 3099 3104 P TUCKER 2016 27 29 J ASIF 2016 397 409 M HEGDE 2016 6308 6319 M ASIF 2012 2984 2991 M DAM 2016 B DAM 2016 54768 54776 B DAVOD 2016 58 66 F NIKOORAZM 2016 56549 56561 M VEKARIYA 2016 197 219 R ZHANG 2017 658 666 H CHNG 2013 1825 1837 L LI 2015 7482 7501 S TAI 2017 56 60 Z TAYEBEE 2012 962 969 R TAYEBEE 2013 1014 1018 R TAYEBEE 2013 140 148 R TAYEBEE 2014 1550 1563 R MALEKI 2016 96644 96661 B TAYEBEE 2016 55319 55326 R SHATERIAN 2009 59 67 H KIDWAI 2012 1728 1731 M HASANINEJED 2012 148 155 A WANG 2010 1341 1345 X FEREY 2005 2040 2042 G BROMBERG 2012 1664 1675 L LIU 2012 8431 8433 H SAIKIA 2015 64 67 M NEWMAN 2006 2893 2902 A FRATTINI 2017 10 18 L MAKSIMCHUK 2012 2017 2034 N KNAPPETT 2013 5765 5772 B VARGA 1970 662 667 G QIAN 2012 9897 9900 X JHUNG 2007 121 124 S LIU 2013 2916 Q BHATTACHARJEE 2014 52500 52525 S HWANG 2008 4144 4148 Y DAVARPANAH 2013 78 89 J HUANG 2016 15362 15369 Y LI 2017 216 222 X CALIMAN 2005 816 825 E JULIAO 2015 78 86 D XU 2015 43473 43479 Y TAYEBEE 2015 5888 5897 R KHURANA 2009 7300 7303 J MAZAAHIR 2012 2273 2279 K SAYYAFI 2008 2375 2378 M YANG 2011 1884 1887 F ADVANCEDMATERIALSRESEARCH SHATERIAN 2008 128 133 H KIASAT 2013 46 54 A JANSSENS 2012 1847 1850 N SHATERIAN 2011 340 346 H HASHEMZADEHX2017X96 HASHEMZADEHX2017X96X106 HASHEMZADEHX2017X96XA HASHEMZADEHX2017X96X106XA 2019-08-05T00:00:00Z Open http://creativecommons.org/licenses/by-nc-nd/4.0/ © 2017 Elsevier B.V. All rights reserved. item S2468-8231(17)30400-5 S2468823117304005 1-s2.0-S2468823117304005 10.1016/j.mcat.2017.07.010 315758 2018-07-09T21:52:14.092726Z 2017-10-01 2017-10-31 1-s2.0-S2468823117304005-main.pdf https://s3-eu-west-1.amazonaws.com/prod-ucs-content-store-eu-west/content/pii:S2468823117304005/MAIN/application/pdf/fe3f51c851b7e230528e677e37177389/main.pdf https://s3.amazonaws.com/prod-ucs-content-store-us-east/content/pii:S2468823117304005/MAIN/application/pdf/fe3f51c851b7e230528e677e37177389/main.pdf main.pdf pdf true 3507949 MAIN 11 1-s2.0-S2468823117304005-main_1.png https://s3-eu-west-1.amazonaws.com/prod-ucs-content-store-eu-west/content/pii:S2468823117304005/PREVIEW/image/png/ef4f70520c9e71e1b6d3329ce4112434/main_1.png https://s3.amazonaws.com/prod-ucs-content-store-us-east/content/pii:S2468823117304005/PREVIEW/image/png/ef4f70520c9e71e1b6d3329ce4112434/main_1.png main_1.png png 54140 849 656 IMAGE-WEB-PDF 1 1-s2.0-S2468823117304005-fx1.sml https://s3-eu-west-1.amazonaws.com/prod-ucs-content-store-eu-west/content/pii:S2468823117304005/fx1/THUMBNAIL/image/gif/c342de6f7a89f9d99a5d776b91593251/fx1.sml https://s3.amazonaws.com/prod-ucs-content-store-us-east/content/pii:S2468823117304005/fx1/THUMBNAIL/image/gif/c342de6f7a89f9d99a5d776b91593251/fx1.sml fx1 true fx1.sml sml 5478 88 219 IMAGE-THUMBNAIL 1-s2.0-S2468823117304005-fx2.sml https://s3-eu-west-1.amazonaws.com/prod-ucs-content-store-eu-west/content/pii:S2468823117304005/fx2/THUMBNAIL/image/gif/bf3e2e7919e950bd7adecbba92ccf9b3/fx2.sml https://s3.amazonaws.com/prod-ucs-content-store-us-east/content/pii:S2468823117304005/fx2/THUMBNAIL/image/gif/bf3e2e7919e950bd7adecbba92ccf9b3/fx2.sml fx2 fx2.sml sml 2090 88 219 IMAGE-THUMBNAIL 1-s2.0-S2468823117304005-fx3.sml https://s3-eu-west-1.amazonaws.com/prod-ucs-content-store-eu-west/content/pii:S2468823117304005/fx3/THUMBNAIL/image/gif/c95324066bb6df28a160cf8ad7f846dc/fx3.sml https://s3.amazonaws.com/prod-ucs-content-store-us-east/content/pii:S2468823117304005/fx3/THUMBNAIL/image/gif/c95324066bb6df28a160cf8ad7f846dc/fx3.sml fx3 fx3.sml sml 2770 88 219 IMAGE-THUMBNAIL 1-s2.0-S2468823117304005-fx4.sml https://s3-eu-west-1.amazonaws.com/prod-ucs-content-store-eu-west/content/pii:S2468823117304005/fx4/THUMBNAIL/image/gif/f621d6df508d27a35c072c35e5b36d1a/fx4.sml https://s3.amazonaws.com/prod-ucs-content-store-us-east/content/pii:S2468823117304005/fx4/THUMBNAIL/image/gif/f621d6df508d27a35c072c35e5b36d1a/fx4.sml fx4 fx4.sml sml 2009 88 219 IMAGE-THUMBNAIL 1-s2.0-S2468823117304005-fx5.sml https://s3-eu-west-1.amazonaws.com/prod-ucs-content-store-eu-west/content/pii:S2468823117304005/fx5/THUMBNAIL/image/gif/67e52781cc4cd99567c4c279ea455409/fx5.sml https://s3.amazonaws.com/prod-ucs-content-store-us-east/content/pii:S2468823117304005/fx5/THUMBNAIL/image/gif/67e52781cc4cd99567c4c279ea455409/fx5.sml fx5 fx5.sml sml 1924 88 219 IMAGE-THUMBNAIL 1-s2.0-S2468823117304005-gr1.sml https://s3-eu-west-1.amazonaws.com/prod-ucs-content-store-eu-west/content/pii:S2468823117304005/gr1/THUMBNAIL/image/gif/6481488254ef96957b667f86868797fa/gr1.sml https://s3.amazonaws.com/prod-ucs-content-store-us-east/content/pii:S2468823117304005/gr1/THUMBNAIL/image/gif/6481488254ef96957b667f86868797fa/gr1.sml gr1 gr1.sml sml 6308 164 147 IMAGE-THUMBNAIL 1-s2.0-S2468823117304005-gr2.sml https://s3-eu-west-1.amazonaws.com/prod-ucs-content-store-eu-west/content/pii:S2468823117304005/gr2/THUMBNAIL/image/gif/1147e6fde2297a782859a0c6116561ff/gr2.sml https://s3.amazonaws.com/prod-ucs-content-store-us-east/content/pii:S2468823117304005/gr2/THUMBNAIL/image/gif/1147e6fde2297a782859a0c6116561ff/gr2.sml gr2 gr2.sml sml 7271 163 158 IMAGE-THUMBNAIL 1-s2.0-S2468823117304005-gr3.sml https://s3-eu-west-1.amazonaws.com/prod-ucs-content-store-eu-west/content/pii:S2468823117304005/gr3/THUMBNAIL/image/gif/671f68712b02ed84b4de255528e7f355/gr3.sml https://s3.amazonaws.com/prod-ucs-content-store-us-east/content/pii:S2468823117304005/gr3/THUMBNAIL/image/gif/671f68712b02ed84b4de255528e7f355/gr3.sml gr3 gr3.sml sml 9942 152 219 IMAGE-THUMBNAIL 1-s2.0-S2468823117304005-gr4.sml https://s3-eu-west-1.amazonaws.com/prod-ucs-content-store-eu-west/content/pii:S2468823117304005/gr4/THUMBNAIL/image/gif/babf3423d9180afa35359213172ba22f/gr4.sml https://s3.amazonaws.com/prod-ucs-content-store-us-east/content/pii:S2468823117304005/gr4/THUMBNAIL/image/gif/babf3423d9180afa35359213172ba22f/gr4.sml gr4 gr4.sml sml 13225 164 110 IMAGE-THUMBNAIL 1-s2.0-S2468823117304005-gr5.sml https://s3-eu-west-1.amazonaws.com/prod-ucs-content-store-eu-west/content/pii:S2468823117304005/gr5/THUMBNAIL/image/gif/ac8477553601169a3a3d68d0f2d26fe9/gr5.sml https://s3.amazonaws.com/prod-ucs-content-store-us-east/content/pii:S2468823117304005/gr5/THUMBNAIL/image/gif/ac8477553601169a3a3d68d0f2d26fe9/gr5.sml gr5 gr5.sml sml 8004 163 160 IMAGE-THUMBNAIL 1-s2.0-S2468823117304005-gr6.sml https://s3-eu-west-1.amazonaws.com/prod-ucs-content-store-eu-west/content/pii:S2468823117304005/gr6/THUMBNAIL/image/gif/40241245fdbeb22493c15f61994b1981/gr6.sml https://s3.amazonaws.com/prod-ucs-content-store-us-east/content/pii:S2468823117304005/gr6/THUMBNAIL/image/gif/40241245fdbeb22493c15f61994b1981/gr6.sml gr6 gr6.sml sml 5336 164 94 IMAGE-THUMBNAIL 1-s2.0-S2468823117304005-gr7.sml https://s3-eu-west-1.amazonaws.com/prod-ucs-content-store-eu-west/content/pii:S2468823117304005/gr7/THUMBNAIL/image/gif/0b72adb56ecb2495ef63b1f1bbe4a140/gr7.sml https://s3.amazonaws.com/prod-ucs-content-store-us-east/content/pii:S2468823117304005/gr7/THUMBNAIL/image/gif/0b72adb56ecb2495ef63b1f1bbe4a140/gr7.sml gr7 gr7.sml sml 6400 164 154 IMAGE-THUMBNAIL 1-s2.0-S2468823117304005-gr8.sml https://s3-eu-west-1.amazonaws.com/prod-ucs-content-store-eu-west/content/pii:S2468823117304005/gr8/THUMBNAIL/image/gif/6cfcc663489c9d2717645cf47a87802b/gr8.sml https://s3.amazonaws.com/prod-ucs-content-store-us-east/content/pii:S2468823117304005/gr8/THUMBNAIL/image/gif/6cfcc663489c9d2717645cf47a87802b/gr8.sml gr8 gr8.sml sml 6924 152 219 IMAGE-THUMBNAIL 1-s2.0-S2468823117304005-gr9.sml https://s3-eu-west-1.amazonaws.com/prod-ucs-content-store-eu-west/content/pii:S2468823117304005/gr9/THUMBNAIL/image/gif/c628d6c7129dc8bbe7e4766fec00c3e3/gr9.sml https://s3.amazonaws.com/prod-ucs-content-store-us-east/content/pii:S2468823117304005/gr9/THUMBNAIL/image/gif/c628d6c7129dc8bbe7e4766fec00c3e3/gr9.sml gr9 gr9.sml sml 4543 139 219 IMAGE-THUMBNAIL 1-s2.0-S2468823117304005-sc1.sml https://s3-eu-west-1.amazonaws.com/prod-ucs-content-store-eu-west/content/pii:S2468823117304005/sc1/THUMBNAIL/image/gif/1ccc5d2eb1971b2b20b514cffd25e8c6/sc1.sml https://s3.amazonaws.com/prod-ucs-content-store-us-east/content/pii:S2468823117304005/sc1/THUMBNAIL/image/gif/1ccc5d2eb1971b2b20b514cffd25e8c6/sc1.sml sc1 sc1.sml sml 10228 164 161 IMAGE-THUMBNAIL 1-s2.0-S2468823117304005-sc2.sml https://s3-eu-west-1.amazonaws.com/prod-ucs-content-store-eu-west/content/pii:S2468823117304005/sc2/THUMBNAIL/image/gif/64cd6355cab7b0265c6ea6d007d99692/sc2.sml https://s3.amazonaws.com/prod-ucs-content-store-us-east/content/pii:S2468823117304005/sc2/THUMBNAIL/image/gif/64cd6355cab7b0265c6ea6d007d99692/sc2.sml sc2 sc2.sml sml 4587 164 140 IMAGE-THUMBNAIL 1-s2.0-S2468823117304005-fx1.jpg https://s3-eu-west-1.amazonaws.com/prod-ucs-content-store-eu-west/content/pii:S2468823117304005/fx1/DOWNSAMPLED/image/jpeg/90ad132ee19862ffe9bec382f212218e/fx1.jpg https://s3.amazonaws.com/prod-ucs-content-store-us-east/content/pii:S2468823117304005/fx1/DOWNSAMPLED/image/jpeg/90ad132ee19862ffe9bec382f212218e/fx1.jpg fx1 true fx1.jpg jpg 20902 200 500 IMAGE-DOWNSAMPLED 1-s2.0-S2468823117304005-fx2.jpg https://s3-eu-west-1.amazonaws.com/prod-ucs-content-store-eu-west/content/pii:S2468823117304005/fx2/DOWNSAMPLED/image/jpeg/e2c9a1a7e83c6d8f097b3e9d1eaf07ff/fx2.jpg https://s3.amazonaws.com/prod-ucs-content-store-us-east/content/pii:S2468823117304005/fx2/DOWNSAMPLED/image/jpeg/e2c9a1a7e83c6d8f097b3e9d1eaf07ff/fx2.jpg fx2 fx2.jpg jpg 5592 200 500 IMAGE-DOWNSAMPLED 1-s2.0-S2468823117304005-fx3.jpg https://s3-eu-west-1.amazonaws.com/prod-ucs-content-store-eu-west/content/pii:S2468823117304005/fx3/DOWNSAMPLED/image/jpeg/7ac1a527a92f557d3eb7c3061804dc87/fx3.jpg https://s3.amazonaws.com/prod-ucs-content-store-us-east/content/pii:S2468823117304005/fx3/DOWNSAMPLED/image/jpeg/7ac1a527a92f557d3eb7c3061804dc87/fx3.jpg fx3 fx3.jpg jpg 8438 200 500 IMAGE-DOWNSAMPLED 1-s2.0-S2468823117304005-fx4.jpg https://s3-eu-west-1.amazonaws.com/prod-ucs-content-store-eu-west/content/pii:S2468823117304005/fx4/DOWNSAMPLED/image/jpeg/725bbcbb978cc3cc6a62106d95c11e23/fx4.jpg https://s3.amazonaws.com/prod-ucs-content-store-us-east/content/pii:S2468823117304005/fx4/DOWNSAMPLED/image/jpeg/725bbcbb978cc3cc6a62106d95c11e23/fx4.jpg fx4 fx4.jpg jpg 5575 200 500 IMAGE-DOWNSAMPLED 1-s2.0-S2468823117304005-fx5.jpg https://s3-eu-west-1.amazonaws.com/prod-ucs-content-store-eu-west/content/pii:S2468823117304005/fx5/DOWNSAMPLED/image/jpeg/eeae739fa7f02df73b2010d8102bae55/fx5.jpg https://s3.amazonaws.com/prod-ucs-content-store-us-east/content/pii:S2468823117304005/fx5/DOWNSAMPLED/image/jpeg/eeae739fa7f02df73b2010d8102bae55/fx5.jpg fx5 fx5.jpg jpg 5292 200 500 IMAGE-DOWNSAMPLED 1-s2.0-S2468823117304005-gr1.jpg https://s3-eu-west-1.amazonaws.com/prod-ucs-content-store-eu-west/content/pii:S2468823117304005/gr1/DOWNSAMPLED/image/jpeg/ce302fcaa81965f69507863d71b088a0/gr1.jpg https://s3.amazonaws.com/prod-ucs-content-store-us-east/content/pii:S2468823117304005/gr1/DOWNSAMPLED/image/jpeg/ce302fcaa81965f69507863d71b088a0/gr1.jpg gr1 gr1.jpg jpg 22275 335 301 IMAGE-DOWNSAMPLED 1-s2.0-S2468823117304005-gr2.jpg https://s3-eu-west-1.amazonaws.com/prod-ucs-content-store-eu-west/content/pii:S2468823117304005/gr2/DOWNSAMPLED/image/jpeg/0c64cbf21de41e2d77725cc4ae023ff8/gr2.jpg https://s3.amazonaws.com/prod-ucs-content-store-us-east/content/pii:S2468823117304005/gr2/DOWNSAMPLED/image/jpeg/0c64cbf21de41e2d77725cc4ae023ff8/gr2.jpg gr2 gr2.jpg jpg 29213 311 301 IMAGE-DOWNSAMPLED 1-s2.0-S2468823117304005-gr3.jpg https://s3-eu-west-1.amazonaws.com/prod-ucs-content-store-eu-west/content/pii:S2468823117304005/gr3/DOWNSAMPLED/image/jpeg/5231fc31bfa2570b233f9ec43f597d78/gr3.jpg https://s3.amazonaws.com/prod-ucs-content-store-us-east/content/pii:S2468823117304005/gr3/DOWNSAMPLED/image/jpeg/5231fc31bfa2570b233f9ec43f597d78/gr3.jpg gr3 gr3.jpg jpg 58591 471 678 IMAGE-DOWNSAMPLED 1-s2.0-S2468823117304005-gr4.jpg https://s3-eu-west-1.amazonaws.com/prod-ucs-content-store-eu-west/content/pii:S2468823117304005/gr4/DOWNSAMPLED/image/jpeg/55b16f09bf958e088215ba7fc63213b4/gr4.jpg https://s3.amazonaws.com/prod-ucs-content-store-us-east/content/pii:S2468823117304005/gr4/DOWNSAMPLED/image/jpeg/55b16f09bf958e088215ba7fc63213b4/gr4.jpg gr4 gr4.jpg jpg 117756 702 470 IMAGE-DOWNSAMPLED 1-s2.0-S2468823117304005-gr5.jpg https://s3-eu-west-1.amazonaws.com/prod-ucs-content-store-eu-west/content/pii:S2468823117304005/gr5/DOWNSAMPLED/image/jpeg/0ffd85cebd2b35c20b7f049332b7a342/gr5.jpg https://s3.amazonaws.com/prod-ucs-content-store-us-east/content/pii:S2468823117304005/gr5/DOWNSAMPLED/image/jpeg/0ffd85cebd2b35c20b7f049332b7a342/gr5.jpg gr5 gr5.jpg jpg 57664 480 470 IMAGE-DOWNSAMPLED 1-s2.0-S2468823117304005-gr6.jpg https://s3-eu-west-1.amazonaws.com/prod-ucs-content-store-eu-west/content/pii:S2468823117304005/gr6/DOWNSAMPLED/image/jpeg/b0831c79b91a91b772cfed2f996dec32/gr6.jpg https://s3.amazonaws.com/prod-ucs-content-store-us-east/content/pii:S2468823117304005/gr6/DOWNSAMPLED/image/jpeg/b0831c79b91a91b772cfed2f996dec32/gr6.jpg gr6 gr6.jpg jpg 39925 590 339 IMAGE-DOWNSAMPLED 1-s2.0-S2468823117304005-gr7.jpg https://s3-eu-west-1.amazonaws.com/prod-ucs-content-store-eu-west/content/pii:S2468823117304005/gr7/DOWNSAMPLED/image/jpeg/edb5a42d2355b66f45265cbaf4903c65/gr7.jpg https://s3.amazonaws.com/prod-ucs-content-store-us-east/content/pii:S2468823117304005/gr7/DOWNSAMPLED/image/jpeg/edb5a42d2355b66f45265cbaf4903c65/gr7.jpg gr7 gr7.jpg jpg 33715 501 470 IMAGE-DOWNSAMPLED 1-s2.0-S2468823117304005-gr8.jpg https://s3-eu-west-1.amazonaws.com/prod-ucs-content-store-eu-west/content/pii:S2468823117304005/gr8/DOWNSAMPLED/image/jpeg/783aa8309671926cd2ea5577405ffb44/gr8.jpg https://s3.amazonaws.com/prod-ucs-content-store-us-east/content/pii:S2468823117304005/gr8/DOWNSAMPLED/image/jpeg/783aa8309671926cd2ea5577405ffb44/gr8.jpg gr8 gr8.jpg jpg 15777 235 339 IMAGE-DOWNSAMPLED 1-s2.0-S2468823117304005-gr9.jpg https://s3-eu-west-1.amazonaws.com/prod-ucs-content-store-eu-west/content/pii:S2468823117304005/gr9/DOWNSAMPLED/image/jpeg/3117b649821c4822d75abc482008a747/gr9.jpg https://s3.amazonaws.com/prod-ucs-content-store-us-east/content/pii:S2468823117304005/gr9/DOWNSAMPLED/image/jpeg/3117b649821c4822d75abc482008a747/gr9.jpg gr9 gr9.jpg jpg 17959 299 470 IMAGE-DOWNSAMPLED 1-s2.0-S2468823117304005-sc1.jpg https://s3-eu-west-1.amazonaws.com/prod-ucs-content-store-eu-west/content/pii:S2468823117304005/sc1/DOWNSAMPLED/image/jpeg/7b921aa8f97dc74aaa2ec427fcee6cd9/sc1.jpg https://s3.amazonaws.com/prod-ucs-content-store-us-east/content/pii:S2468823117304005/sc1/DOWNSAMPLED/image/jpeg/7b921aa8f97dc74aaa2ec427fcee6cd9/sc1.jpg sc1 sc1.jpg jpg 61061 479 470 IMAGE-DOWNSAMPLED 1-s2.0-S2468823117304005-sc2.jpg https://s3-eu-west-1.amazonaws.com/prod-ucs-content-store-eu-west/content/pii:S2468823117304005/sc2/DOWNSAMPLED/image/jpeg/a1f40594af1caf931d9d5fa7a5d85bcd/sc2.jpg https://s3.amazonaws.com/prod-ucs-content-store-us-east/content/pii:S2468823117304005/sc2/DOWNSAMPLED/image/jpeg/a1f40594af1caf931d9d5fa7a5d85bcd/sc2.jpg sc2 sc2.jpg jpg 50109 662 565 IMAGE-DOWNSAMPLED 1-s2.0-S2468823117304005-mmc1.docx https://s3-eu-west-1.amazonaws.com/prod-ucs-content-store-eu-west/content/pii:S2468823117304005/mmc1/MAIN/application/vnd.openxmlformats-officedocument.wordprocessingml.document/2371b990cc4a89de2f14cdb4da90f774/mmc1.docx https://s3.amazonaws.com/prod-ucs-content-store-us-east/content/pii:S2468823117304005/mmc1/MAIN/application/vnd.openxmlformats-officedocument.wordprocessingml.document/2371b990cc4a89de2f14cdb4da90f774/mmc1.docx mmc1 mmc1.docx docx 3832109 APPLICATION MCAT 253 S2468-8231(17)30400-5 10.1016/j.mcat.2017.07.010 Elsevier B.V. Scheme 1 Synthetic route to PTA@Fe3O4/EN-MIL-101. Scheme 1 Scheme 2 Proposed mechanism for the synthesis of 2H-indazolo[1,2-b]phthalazine-triones. Scheme 2 Fig. 1 X-ray diffraction patterns of parent and functionalized MOFs. Fig. 1 Fig. 2 N2 adsorption-desorption isotherms for parent and functionalized MOFs. Fig. 2 Fig. 3 FESEM images of MIL-101 (a), PTA@Fe3O4/EN-MIL-101 in low and high magnification (b and c), and EDX analyses of PTA@Fe3O4/EN-MIL-101 (d). Fig. 3 Fig. 4 Dark and bright-field TEM images parent and functionalized MOFs. Fig. 4 Fig. 5 Background-subtracted XP spectra of MIL-101, EN-MIL-101, Fe3O4/EN-MIL-101, and PTA@Fe3O4/EN-MIL-101. Fig. 5 Fig. 6 TGA-DTA curves of MIL-101, EN-MIL-101, Fe3O4/EN-MIL-101, and PTA@Fe3O4/EN-MIL-101. Fig. 6 Fig. 7 (a) Effect of reaction temperature, and (b) effect of reaction time on catalytic synthesis of 2,2-dimethyl-13-phenyl-2,3-dihydro-1H-indazolo[2,1-b]phthalazine-4,6,11(13H)-trione with PTA@Fe3O4/EN-MIL-101. Reaction condition is described in 2.6. Fig. 7 Fig. 8 Effect of catalyst components on isolated product yields. Reaction condition given in the footnote to Table 1. Fig. 8 Fig. 9 Product yield as a function of reusability of PTA@Fe3O4/EN-MIL-101 catalyst. Fig. 9 Table 1 Reactivity of PTA@Fe3O4/EN-MIL-101 for one-pot condensation. Table 1 Diketone Structure Time (min) Yield (%) 5,5-dimethyl-1,3-cyclohexane-dione 20 94 ethyl acetoacetate 60 31 2,5-hexane-dione 40 52 3,4-hexane-dione 40 69 Reaction conditions: Aldehyde (0.25mmol), phthalhydrazide (0.25mmol) and dimedone (0.25mmol), catalyst (0.02g) at 100°C. Yields determined by TLC. Work-up performed as described in Experimental. Table 2 Catalytic performance of PTA@Fe3O4/EN-MIL-101 against literature catalysts. Table 2 Entry Catalyst and conditions Catalyst mass(mg) Time (min) Aldehyde Amount (mmol) Yield (%) Refs. 1 Ceric ammonium nitrate, solvent-free, 50°C 27 120 1 94 [67] 2 p-toluenesulfonic acid (p-TSA), solvent-free, 80°C 52 10 1.2 86 [68] 3 [[(CH2)4SO3HMIM][HSO4], solvent-free, 100°C 47 10 1 81 [69] 4 Silica sulfuric acid, solvent-free, 100°C 25 8 12 87 [70] 5 Fe3O4@silica sulfuric acid, solvent-free,100°C 75 35 1 88 [71] 6 PTA@Fe3O4/EN-MIL-101, solvent-free, 100°C 20 20 1 94 This work In each case, the optimum reaction condition is stated. Table 3 Synthesis of different 2H-indazolo[2,1-b]phthalazine-1,6,11(13H)-triones. Table 3 Entry R1 R Time (min) Yield (%) 1 Ph Me 20 94 2 4-Br-ph Me 60 60 3 4-NO2-Ph Me 80 50 4 2-Cl-Ph Me 40 65 5 2,6-(Cl)2-Ph Me 60 70 7 4-(CH3)2N-Ph Me 80 81 8 4-Me-Ph Me 60 70 9 Pyridinecarbaldehyde Me 40 22 10 terephthalaldehyde Me 60 10 11 Butyraldehyde Me 60 24 Yields refer to the isolated pure products. The desired pure products were characterized by comparison of their physical data with those of known compounds [65]. Editor’s choice paper A magnetically-separable H3PW12O40@Fe3O4/EN-MIL-101 catalyst for the one-pot solventless synthesis of 2H-indazolo[2,1-b] phthalazine-triones Alireza Hashemzadeh a Mostafa M. Amini a Reza Tayebee b c ⁎ Atefeh Sadeghian c Lee J. Durndell d Mark A. Isaacs d Amin Osatiashtiani d Christopher M.A. Parlett d Adam F. Lee d ⁎⁎ a Department of Chemistry, Shahid Beheshti University, G.C., Tehran 1983963113, Iran Department of Chemistry Shahid Beheshti University G.C. Tehran 1983963113 Iran b Department of Chemistry, School of Sciences, Hakim Sabzevari University, Sabzevar 96179-76487, Iran Department of Chemistry School of Sciences Hakim Sabzevari University Sabzevar 96179-76487 Iran c Department of Chemistry, Payam Noor University, Tehran 19395-4697, Iran Department of Chemistry Payam Noor University Tehran 19395-4697 Iran d European Bioenergy Research Institute, Aston University, Birmingham B4 7ET, UK European Bioenergy Research Institute Aston University Birmingham B4 7ET UK ⁎ Corresponding author at: Department of Chemistry, School of Sciences, Hakim Sabzevari University, Sabzevar 96179-76487, Iran. ⁎⁎ Corresponding author. Graphical abstract A magnetic inorganic-organic catalyst, PTA@Fe3O4/EN-MIL-101 (EN=ethylenediamine, PTA=phosphotungstic acid) was fabricated and characterized by XRD, HRTEM, FESEM, UV–vis, TGA-DTA, FT-IR, XPS and porosimetry. PTA retained the parent Keggin structure upon dispersion throughout the amine-functionalized chromium terephthalate metal-organic framework, over which magnetic Fe3O4 nanoparticles were previously introduced. The resulting composite heterogeneous solid acid was an active catalyst for the one-pot synthesis of diverse 2H-indazolo[2,1-b] phthalazine-triones in good→excellent yields under mild, solventless condition, and offers facile separation and excellent recyclability. Keywords Metal-organic framework Magnetic nanoparticles Heteropolyacid Phthalazine-trione 1 Introduction The design, synthesis and application of active and selective heterogeneous catalysts inspired by molecular analogues has been the focus of intensive recent research, resulting in the fabrication of diverse nanocomposites and nanoporous frameworks [1–4]. Critical design parameters for nanocomposite catalysts include ease of fabrication, separation and recycle and on-stream stability, which together influence their suitability for the large-scale commercial production of bulk and speciality chemicals and pharmaceuticals [5–7]. Of the many naturally occurring and synthetic catalytic materials available, metal-organic frameworks (MOFs) have risen in prominence for applications in organic synthesis due to their tunable microporosity (and more recently micro/mesoporosity [8]), extremely high surface areas, and wide range of pre- and post-synthetic routes to incorporate different chemical functionality [9–11]. Some MOFs offer vacant metal atom coordination sites which can be activated thermally, under vacuum, or through solvent exchange to enable their post-functionalization. Such coordinatively unsaturated MOFs are potential Lewis acid catalysts, and can act as structural building blocks in synergy with co-catalysts to generate multifunctional catalysts [12–15]. The attachment of magnetic nanoparticles to inorganic and organic backbones and fabrication of magnetic metal-organic frameworks (MMOFs) [16] unlocks opportunities to create novel multifunctional catalysts [17] amenable to facile separation and recycling. The evolution of benign catalytic routes to the synthesis of structurally diverse active compounds for new therapeutic uses remains challenging [18–21]. Recently, phthalazine heterocyclic derivatives have attracted attention due to their high therapeutic value in analgesic, anti-inflammatory, antimicrobial, antithrombotic, antidepressant, diuretics, antihypertensive, antitubercular, and anti-HIV treatments [22]. Flexible synthetic routes to new scaffolds for generating various drug-based phthalazines thus represent a high of priority for catalyst design [22–24]. In this context, previous research has focused on catalytic functions immobilized on nanoparticles [25–30], wherein the catalytic surface area is related to the particle size and shape, and is generally too low to provide high activity. Nanoparticle catalysts may also require costly separation methods such as ultracentrifugation, although the application of magnetic Fe3O4 nanoparticles as a template can circumvent this issue [31–33]. Briefly, new composites made by immobilizing Fe3O4 nanoparticles onto functional MOFs could help in meeting the preceding goals, a high area catalyst offering facile, magnetic separation. Here, we extend our recent efforts to develop efficient catalysts prepared from simple, low cost materials for atom economical and energy efficient organic synthesis [34–39], through the design of a MMOF incorporating H3PW12O40 (phosphotungstic acid, PTA) guest molecules to introduce the Brönsted acidity required for one-pot 2H-indazolo[2,1-b]phthalazine-triones synthesis [40–43]. Chromium(III) terephthalate MOF, MIL-101(Cr) is a promising framework upon which to fabricate such catalysts, since it possesses a high surface area, good thermal and chemical stability, large mesopore channels (∼2.9 and 3.4nm) and wide pentagonal and hexagonal microporous windows (1.2 and 1.6nm respectively) which facilitate rapid in-pore transport of substrate and products [15]. In MIL-101(Cr), Lewis acidic chromium vertices enable the coordination of ethylenediamine (EN) via simple post-modification. The large pore windows and channels facilitate subsequent in-pore anchoring of PTA to the amine moieties within EN-MIL-101(Cr) and hence Brønsted acidity, and the introduction of Fe3O4 nanoparticles which confer strong ferromagnetism and hence aid catalyst separation and re-use. This approach affords a magnetically separable, inorganic-organic hybrid catalyst for the one-pot condensation of phthalhydrazide, aromatic aldehydes, and dimedone to 2H-indazolo[2,1-b] phthalazine-trione derivatives (Scheme S1). 2 Experimental section 2.1 Materials and methods All chemicals were obtained from commercial sources (Aldrich and Merck) and used without further purification. Scanning electron microscope (SEM) micrographs were taken using a KYKY-EM3200 microscope (acceleration voltage 26kV). HRTEM measurements were performed on a Philips TECNAI-20T electronic microscope operated at 200kV. Fourier transform infrared (FT-IR) spectra were recorded on a Bomem MB-Series FT-IR spectrometer. Ultraviolet–visible (UV–vis) spectra were obtained on a Shimadzu Model UV-2550 spectrophotometer. Melting points were recorded on a Barnstead electrothermal type 9200 melting point apparatus. 1H- and 13C NMR spectra were recorded on a Bruker AVANCE 300MHz spectrometer. Typical 1H NMR parameters were 10 scans averaged, 2s delay time, 14.6μs pulse length; and for 13C NMR 1024 scans averaged; 2s delay time, and 130μs pulse length, using TMS as an internal reference. Thermal analysis (TGA-DTA) was carried out using a Bahr STA-503 instrument at a heating rate of 10°Cmin−1 in air. Powder X-ray diffraction (XRD) patterns were obtained on a STOE diffractometer using Cu Kα radiation (λ=0.15418nm). XPS analysis was performed on a Kratos Axis HSi photoelectron spectrometer equipped with a charge neutralizer and magnetic focusing lenses, employing monochromatic Al Kα radiation (1486.6eV) with energy referencing to the C 1s peak at 284.8eV. Porosimetry measurements were conducted by N2 physisorption on a Quantachrome Nova 4200e porosimeter with data analysis employing Novawin v11.0 software. Samples were degassed at 120°C for 4h prior to analysis by nitrogen adsorption at −196°C, with BET surface areas calculated over the range P/P0 =0.05–0.35 where a linear relationship was maintained, while pore size distributions were calculated using the BJH model from the desorption isotherm. A freeze dryer (Model FD-10, Pishtaz Equipment Engineering Co, Iran) was utilized for occasional drying of samples if needed. Elemental analysis was performed with a Varian Vista-PRO ICP-OES and Thermo Scientific Flash 2000 organic elemental analyzer. Synthesis of MIL-101(Cr) was confirmed by comparison of its spectral and physical data with those of previously reported [44]. All prepared indazolophthalazine-triones were known compounds and their spectral data was compared with the literature to confirm successful synthesis [36]. 2.2 Preparation of chromium(III) terephthalate metal organic framework [MIL-101(Cr)] MIL-101(Cr) was synthesized and purified according to the reported literature [45]. Briefly, 40mL of deionized water was added to a mixture of ground, powdered terephthalic acid (1.66g, 10mmol) and Cr(NO3)3·9H2O (4.0g, 10mmol). The mixture was sonicated resulting in a dark-blue suspension, which was then poured into a 100mL Teflon-lined stainless steel autoclave; the autoclave was then sealed and heated to 220°C (heating rate 1°/min) for 24h. After hydrothermal processing, the autoclave was slowly cooled to ambient temperature, and the green suspension of MIL-101(Cr) thus obtained then separated by centrifugation (at 9000rpm for 10min). The crude product was rinsed with water, methanol, and acetone, then centrifuged and purified by 10min ultrasonication with 25mL N,N-dimethylformamide after which it was kept at 70°C overnight. The final pure solid was obtained following additional centrifugation and repeated washing with methanol and acetone, and further overnight drying at 75°C. The final isolated yield was 42%. MIL-101(Cr) was characterized by powder XRD and compared with the simulated single-crystal pattern from Mercury 3.8 software (Fig. 1 ) [44]. ICP-OES analysis gave the bulk Cr loading as 21wt%. 2.3 Synthesis of EN-MIL-101 MIL-101 grafted with ethylenediamine (EN) was synthesized according to a previously reported procedure [46]. 1.0g of MIL-101 was activated at 150°C for 24h and then added to anhydrous toluene (60mL) and ethylenediamine (0.09g, 1.4mmol). The mixture was stirred under reflux for 12h and then centrifuged and washed repeatedly with deionized water/ethanol (1:1) and finally dried at room temperature for 24h. The bulk N loading by elemental analysis was 8.1wt%. 2.4 Synthesis of Fe3O4/EN-MIL-101 Fe3O4/EN-MIL-101 was prepared adapting a literature synthesis of Fe3O4/MIL-101 [47]. 0.40g (2mmol) of FeCl2·4H2O and 0.65g (4mmol) FeCl3 were added to an aqueous suspension (200mL) of 1.0g EN-MIL-101. The mixture was briefly sonicated and then vigorously stirred and degassed with nitrogen for 1h. Aqueous NH4OH (15mL, 25%) was then added resulting in a black suspension which was magnetically separated and washed with copious deionized water until the washing were pH 7. The final nanocomposite was dried at room temperature in air and designated Fe3O4/EN-MIL-101. The bulk Fe loading by ICP-OES was 37wt%. 2.5 Synthesis of PTA@Fe3O4/EN-MIL-101 1.0g Fe3O4/EN-MIL-101 was suspended in a methanolic solution of phosphotungstic acid (1.0g in 50mL), and the mixture briefly sonicated and then stirred at ambient temperature for 6h. The resulting solid was separated and repeatedly washed with methanol and water, then dried under reduced pressure and designated PTA@Fe3O4/EN-MIL-101. The bulk W loading from ICP-OES was 12.9wt% (equivalent to 16.9wt% PTA), with loadings of other elements as follows: Cr 9.7wt% and Fe 29.1wt%. The overall synthesis is summarized in Scheme 1 . 2.6 General procedure for the preparation of 2H-indazolo-[2,1-b]phthalazine-1,6,11(13H)-triones To a mixture of aldehyde (0.25mmol), phthalhydrazide (0.25mmol) and dimedone (0.25mmol), PTA@Fe3O4/EN-MIL-101 (0.02g) was added and the mixture warmed to 100°C to initiate reaction whose progress was followed by TLC. After reaction, hot ethanol (5mL) was added to the reaction mixture and stirred for 5min. The heterogeneous solid catalyst was then quickly filtered off, and the filtrate cooled to 5°C to precipitate the desired product. The resulting solid product was further purified by recrystallization in aqueous ethanol (25%). Pure products were identified by comparison of their physical data with those of known 2H-indazolo[2,1-b]phthalazine-1,6,11-(13H)-triones. 3 Results and discussion 3.1 Structural characterization X-ray diffraction patterns of MIL-101, EN-MIL-101, Fe3O4/EN-MIL-101 and PTA@Fe3O4/EN-MIL-101 are shown in Fig. 1. In all cases the diffractograms were consistent with the simulated single crystal pattern for MIL-101, evidencing retention of the parent MOF framework throughout the synthesis. However, the peak width and intensities of (notably low angle) reflections for the synthetic MOFs increased and decreased respectively following each synthetic step, indicating a progressive decrease in crystallinity. Although nearly all simulated (hkl) reflections of MIL-101(Cr) were conserved in the experimental powder XRD pattern of the final PTA@Fe3O4/EN-MIL-101, no reflections characteristic of the free phosphotungstic acid were observed in the PTA@Fe3O4/EN-MIL-101 sample, indicative of a high dispersion, since PTA reflections would only be observed from an extended crystalline network of Keggins. The absence of PTA reflections for silica supported analogues has likewise previously been attributed to highly dispersed (isolated or a 2D monolayer) Keggins [48,49], even for loadings approaching 26wt% (versus ∼17wt% PTA in this work). Characteristic reflections of magnetite (Fe3O4) were observed for Fe3O4/EN-MIL-101 and PTA@Fe3O4/EN-MIL-101 (Fig. 1). Note that the overall crystallinity decreased following PTA incorporation into the magnetic composite, presumably due to structural distortions arising from accommodating the bulky anion within the small mesopores and/or microporous windows. Note that MIL-101(Cr) possesses 1.6nm hexagonal windows [50] and hence is certainly able to accommodate individual Keggin units of PTA (diameter ∼1.2nm), and that Fe3O4 nanoparticles have also previously been accommodated in MIL-101(Cr) following the same synthetic route adopted in our work [47]. Nitrogen porosimetry of the parent and functionalized MOFs revealed a significant decrease in the surface area from around 2000m2 g−1 for MIL-101 to <150m2 g−1 (accompanied by a similar magnitude decrease in the pore volume), even following the first ethylenediamine functionalization step, evidencing significant pore blockage (Fig. 2 ) and hence in-pore incorporation of the various functionalities consistent with the structural distortion of the parent MIL-101(Cr) observed by XRD. As expected, FESEM images of MIL-101 (Fig. 3 a) exhibited well-defined double pyramidal crystallites; however, post-modification the final material (Fig. 3b and c) revealed micron-scale aggregates of semi-spherical particles of approximately 25nm diameter. Bulk elemental mapping by energy dispersive X-ray (EDX) analysis revealed a uniform distribution of tungsten (Fig. S1). TEM of the parent and functionalized MOFs highlighted the ordered mesopore channels within the MIL-101 crystallites and their preservation following amine functionalization (Fig. 4 ). Bright and dark-field TEM of the iron oxide functionalized EN-MIL-101 sample revealed the presence of high contrast nanoparticles with a relatively broad size distribution between 5 and 50nm, and lattice fringes of 0.25nm consistent with Fe3O4 (Fig. S2) [51]. Subsequent heteropolyacid addition resulted in a uniform distribution of high contrast features throughout the Fe3O4/EN-MIL-101 sample. The UV–vis spectrum of phosphotungstic acid exhibits characteristic features arising from two types of ligand→metal charge-transfer bands involving different oxygen atoms. The Keggin unit comprises twelve terminal oxygen atoms (Ot) coordinated to tungsten, while each oxygen atom from the central PO4 tetrahedron (Oc) is bonded to three different tungsten atoms. There are also two types of bridging oxygen; twelve bridged between the four different W3O13 sub-units (Ob1) in which each sub-unit comprises three WO6 connected by three other oxygen atoms (Ob2) resulting in a total of 24 O bridging atoms (Fig. S3a). PTA therefore possesses four unique oxygen species. Characteristic charge-transfer bands were observed in the spectrum of phosphotungstic acid at 213 and 266nm (Fig. S3b): that around 213nm is assigned to Ot →W LMCT (ligand-to-metal-charge-transfer) and that around 266nm is assigned to Ob1,b2 →W LMCT band [52,53]. The PTA loading was quantified from the intensity of the 266nm absorption band following the suspension of 1.0g of Fe3O4/EN-MIL-101 in a 20mL methanolic solution of PTA (initial concentration 5×104 ppm) and stirred at ambient temperature for 6h to equilibrate adsorption on the MOF. The resulting UV–vis spectrum of the diluted sample after magnetic separation from the solution was compared with calibration curves for PTA solutions, and indicated a PTA loading of ∼21wt% (6.2mol%) on the MOF, close to that of 16.9wt% determined by ICP-OES. Fourier transform infrared (FT-IR) spectra of MIL-101, EN-MIL-101, Fe3O4/EN-MIL-101, and PTA@Fe3O4/EN-MIL-101 are shown in Fig. S4. MIL-101 exhibited bands around 3432 and 1627cm−1 associated with water. The band at 1666cm−1 was due to the presence of DMF guest molecules, while bands at 1404 and 1546cm−1 corresponded to the symmetric and asymmetric O−C−O stretching vibrations of carboxylates in the MOF framework [54,55]. The CC stretching vibration of the aromatic ring in terephthalic acid was observed at 1504cm−1. The other bands around 1168, 1103, 883 and 748cm−1 can be attributed to CH deformations [55]. In the spectrum of as-synthesized EN-MIL-101, both NH stretches spanning 3100–3600cm−1 exhibited changes relative to the parent MIL-101 spectrum, while the CH stretches between 2890 and 2950cm−1 indicated the presence of framework ethylenediamine [56,57]. Following iron oxide functionalization, a band characteristic of Fe3O4 appeared at 580cm−1 evidencing the incorporation of magnetic nanoparticles into MIL-101 consistent with XRD [58,59]. The [PW12O40]3− Keggin anion exhibits four characteristic bands arising from ν as(P-Oa), ν as(W-Ot), ν as(W-Ob1) and ν as(W-Ob2) vibrations [60]. The latter three are apparent at 983, 891 and 806cm−1 in the spectrum of PTA@Fe3O4/EN-MIL-101, while the ν as(P-Oa) band appears split into two bands at 1080 and 1053cm−1, possibly due to formation of the lacunary species [PW11O39]7− species [61]. The appearance of phosphotungstic acid characteristic bands in the FT-IR spectrum of PTA@Fe3O4/EN-MIL-101 confirms that the primary Keggin structure of the heteropolyacid was retained after immobilization. For the parent MIL-101, the Cr 2p XP spectrum showed a doublet with 2p3/2 binding energy of 575.6eV (Fig. 5 a) characteristic of the expected Cr3+ vertex species [62]. Ethylenediamine functionalization resulted in the appearance of a N 1s chemical environment at 399.0eV binding energy (Fig. 5b), consistent with amine incorporation [62]. This was accompanied by an increase in Cr 2p energy to 576.7eV, indicating direct coordination between the diamine and Cr3+ sites. Subsequent iron oxide addition had minimal impact on either Cr 2p or N 1s environments, suggesting only weak interactions between Fe3O4 nanoparticles and the amine-functionalized MOF framework, with a Fe 2p doublet 710.5eV consistent with magnetite (Fig. 5c) [62]. The tungsten 4f XP spectrum of PTA@Fe3O4/EN-MIL-101 (Fig. 5d) revealed a doublet with W 4f7/2 binding energy of 35.6eV and spin-orbit splitting of 2.14eV consistent with that of silica supported H3PW12O40 (35.3eV) [48] and hence retention of the Keggin structure. Note that silica supported PTA exhibits two distinct chemical environments [48]: a minority component arising from three terminal W=O units directly coordinated (probably via hydrogen bonding to silanols) to silica giving rise to a low binding energy doublet at 33.5eV; and a majority component arising from nine terminal W=O units unperturbed by the silica surface (characteristic of the parent PTA) at 35.3eV. If PTA Keggin units coordinate to ethylenediamine within the MIL-101 pore network via a single W=O unit then only 1/12th of the W atoms would be perturbed relative to the parent acid, and hence the W 4f XP spectrum would be dominated by the high binding energy environment giving rise to a 4f7/2 envelope centred at 35.3eV as seen in Fig. 5d. PTA incorporation had no impact on the Cr or Fe chemical environments as expected, however the N 1s peak shifted from 399.0 to 399.9eV, confirming coordination of the heteropolyacid to the amine linker. The thermal stability of MIL-101, EN-MIL-101, Fe3O4/EN-MIL-101, and PTA@Fe3O4/EN-MIL-101 was assessed by TGA-DTA (Fig. 6 ). The resulting DTA profiles only exhibited exothermic peaks below 400°C. The TGA profile of MIL-101 showed two major mass losses in the range of 25–300°C and 300–500°C. The first is attributed to the loss of guest water molecules and DMF from the larger mesopore cage of MIL-101(Cr) below 200°C [44,63] and that between 200 and 300°C from the smaller mesoporous cage [54,55] Higher temperature loss is attributed to collapse of the MIL-101 framework between 300 and 500°C due to decomposition of the dicarboxylate linkers and OH elimination [15,44]. MIL-101(Cr) thus appears thermally stable to 300°C in accordance with the literature report of Xu et al. [64], with a total mass loss approaching 90% by 800°C. The TGA-DTA profiles of EN-MIL-101 were similar pattern to the parent MOF, but with a 12% greater overall mass loss reflecting the additional organic (ethylenediamine) functionality present. Fe3O4/EN-MIL-101 exhibited a similar pattern to MIL-101 and EN-MIL-101, albeit in this instance a lower mass loss (∼58% total) due to the presence of dense, inorganic Fe3O4 nanoparticles. PTA incorporation into the Fe3O4/EN-MIL-101 further decreased the total mass loss to only 40% due to the incorporation of additional thermally stable (inorganic) components and associated displacement of in-pore (thermally unstable) solvent guest molecules. These changes mirror the decrease in bulk C content (from elemental analysis), which fell from 31wt% for MIL-101 to 12wt% for Fe3O4-EN-MIL-101 (for which the Fe loading was 37wt%), and reached only 9wt% for PTA@Fe3O4-EN-MIL-101. 3.2 Catalytic tests The effect of reaction temperature was first examined to optimize the catalytic activity of PTA@Fe3O4/EN-MIL-101 for the condensation of benzaldehyde, phthalhydrazide, and dimedone (Fig. 7 a). The reaction was slow at room temperature, resulting in only 55% isolated product yield after 140min, whereas at 60°C a 79% yield was attained after 75min, with 94% yield obtained at 100°C after only 20min reaction. Further temperature increases had no impact on activity. The effect of reaction time at the optimum temperature (100°C) was subsequently examined to determine the minimum reaction time to reach optimal yield (Fig. 7b), with 20min required to reach the limiting 94% conversion. The mass of PTA@Fe3O4/EN-MIL-101 was then optimized employing the reaction temperature and time identified above (Fig. S5). A maximum yield of 94% was obtained for 0.02g of PTA@Fe3O4/EN-MIL-101 (representing only 4mg of H3PW12O40) in 20min, highlighting the efficacy of PTA@Fe3O4/EN-MIL-101 for this condensation reaction. 3.3 Impact of catalyst components The impact of each component of the PTA@Fe3O4/EN-MIL-101 catalyst on reactivity was subsequently assessed for the condensation reaction (Fig. 8 ). Lewis acidic Fe3O4 showed modest activity (44% yield), comparable to the Lewis acidic MIL-101 and mixed Lewis acid/Brønsted basic EN-MIL-101 supports, which gave 59 and 54% yields respectively after 20min. In contrast, the (homogeneous) pure Brønsted acid PTA offered 67% yield. The combination of Lewis and Brønsted acidity in the PTA@Fe3O4/EN-MIL-101 composite significantly enhanced activity above that achievable with either individual acid, delivering a 94% yield. 3.4 Phthalhydrazide and benzaldehyde condensation with diverse diketones Phthalhydrazide and aromatic aldehyde condensation with a range of cyclic and acyclic diketones was subsequently explored catalyzed by PTA@Fe3O4/EN-MIL-101. Among the investigated diketones (Table 1 ), dimedone (5,5-dimethyl-1,3-cyclohexane-dione) gave the highest product yield. The electron releasing nature of the two methyl substituents in dimedone appears desirable to activate the diketone for this condensation reaction [65,66]. The linear hexanediones (2,5-hexane-dione and 3,4-hexane-dione) were less efficient than their cyclic counterpart, resulting in lower product yields of 52–69% after 40min. 3.5 Benchmarking of PTA@Fe3O4/EN-MIL-101 against literature Table 2 provides a semi-quantitative comparison of the performance of PTA@Fe3O4/EN-MIL-101 catalyst with several literature catalyst systems for the reaction of dimedone, phthalhydrazide, and benzaldehyde as a representative model reaction. Although the wide variation in catalyst:reactant stoichiometries employed in the literature, and lack of detailed information on the acid site loading of each catalyst in Table 2 hinders a quantitative comparison, it is clear that PTA@Fe3O4/EN-MIL-101 outperforms all but entry 4 in Table 2 for which catalyst recovery/re-use is difficult due to leaching of sulfonic acid groups. The heterogeneous nature of the present Lewis/Brönsted acid catalyst supported on a magnetic MIL-101 nanostructure is in line with the efforts on the development of new eco-compatible strategies for the synthesis of 2H-indazolo[2,1-b]phthalazine-1,6,11(13H)-trione derivatives, and offers facile product separation and catalyst recycling in contrast to entries 1–3. 3.6 Synthesis of different phthalazine-triones Following optimization of the reaction conditions, the substrate scope of PTA@Fe3O4/EN-MIL-101 was explored for various aromatic aldehydes in the preparation of diverse substituted 2H-indazolo [2,1-b]phthalazine-triones. Ortho-, meta-, and para-substituted aryl aldehydes all gave the corresponding 2H-indazolo [2,1-b]phthalazine-trione derivatives in good→excellent yields (Table 3 ). High yields were obtained for aldehydes possessing electron-withdrawing and with electron-donating substituents. Aromatic aldehydes were more reactive than aliphatic analogues which gave poor yields even over longer reaction times. 3.7 Leaching test To ensure that the catalytic activity was only generated from immobilized functions within PTA@Fe3O4/EN-MIL-101, and not from PTA leached during reaction, a hot filtration test was conducted. The condensation reaction was performed at 100°C for 10min in the presence of the PTA@Fe3O4/EN-MIL-101 catalyst, at which stage the product yield has reached 68% compared with 94% after 20min). The catalyst was then magnetically-separated from the hot supernatant which was immediately decanted, and the latter monitored for another 10min, however the product yield remained at 68%. This result confirmed that condensation was catalyzed solely by the heterogeneous solid acid. 3.8 Recyclability of PTA@Fe3O4/EN-MIL-101 The reusability of the catalyst was arranged to be tested in the synthesis of 2,2-dimethyl-13-phenyl-2,3-dihydro-1H-indazolo[2,1-b]phthalazine-4,6,11(13H)-trione, as shown in Fig. 9 , employing magnetic separation of the catalyst and subsequent ethanol washing and drying at 90°C for 4h in between each reaction. The product yield (and hence catalytic activity) remained almost constant over eight consecutive reactions, demonstrating excellent stability, reflecting the relatively mild, and crucially solvent free, reaction conditions. Deactivation of supported heteropolyacids most commonly arises from their leaching in polar media [72], which is minimised in this work by the absence of solvent and low reactant polarity. Powder XRD of the spent catalyst confirmed negligible structural changes to the MOF framework following one reaction (Fig. S6). 3.9 Proposed reaction pathway for a heterogeneous catalytic system In agreement with the literature, the following mechanism, as shown in Scheme 2 , is suggested for the formation of 2H-indazolo [2,1-b]phthalazine-triones. At the beginning, it was started by a Knoevenagel condensation reaction of 1,3-dione and the aldehyde which subsequently pursued by a Michael addition of phthalhydrazide, and later cyclization. The catalyst activity was interpreted by donating H+ from the heteropolyacid and Lewis acid sites on Fe3O4 and MIL-101fragments which was initially bound to the carbonyl oxygen of the aldehyde. Finally, (I) was generated by nucleophilic addition of dimedone to the carbonyl group of aldehyde and provoked by loss of H2O which affords (II) [65,73]. 4 Conclusions A magnetically-separable heterogeneous catalyst, PTA@Fe3O4/EN-MIL-101 was prepared and characterized by bulk and surface sensitive analytical methods, comprising Fe3O4 nanoparticles (likely distributed over the external surfaces of MOF crystallites) and phosphotungstic acid Keggin units uniformly distributed throughout the pore network tethered to amine linkers which themselves coordinate to Lewis acid Cr3+ vertices. This catalyst was investigated for the one-pot synthesis of 2H-indazolo[2,1-b]phthalazine-1,6,11(13H)-trione derivatives, exhibiting excellent activity and stability, and good to excellent yields under mild and environmentally benign (solventless) conditions. This catalyst, and design strategy, afford new and green routes to pharmacologically important 2H-indazolo[2,1-b]phthalazine-triones. Acknowledgments Partial financial support of the Research Councils of Shahid Beheshti and Hakim Sabzevari Universities is gratefully acknowledged. Appendix A Supplementary data Supplementary data associated with this article can be found, in the online version, at http://dx.doi.org/10.1016/j.mcat.2017.07.010. Appendix A Supplementary data The following is Supplementary data to this article: References [1] A.H. Chughtai N. Ahmad H.A. Younus A. Laypkov F. Verpoort Chem. Soc. Rev. 44 2015 6804 6849 [2] L. Oar-Arteta T. Wezendonk X. Sun F. Kapteijn J. Gascon Mater. Chem. Front. 2017 10.1039/C7QM00007C [3] M. Zhao S. Ou C.D. Wu Acc. Chem. Res. 47 2014 1199 1207 [4] S.-N. Zhao X.-Z. Song S.-Y. Song H.-j. Zhang Coord. Chem. Rev. 337 2017 80 96 [5] K. Dhanalaxmi R. Singuru S. Mondal L. Bai B.M. Reddy A. Bhaumik J. Mondal ACS Sustain. Chem. Eng. 5 1 2017 1033 1045 [6] H. Arandiyan J. Scott Y. Wang H. Dai H. Sun R. Amal ACS Appl. Mater. Interfaces 8 2016 2457 2463 [7] G. Ngnie G.K. Dedzo C. Detellier Dalton Trans. 45 2016 9065 9072 [8] W. Xuan C. Zhu Y. Liu Y. Cui Chem. Soc. Rev. 41 2012 1677 1695 [9] A.U. Czaja N. Trukhan U. Muller Chem. Soc. Rev. 38 2009 1284 1293 [10] Y.K. Hwang D.-Y. Hong J.-S. Chang S.H. Jhung Y.-K. Seo J. Kim A. Vimont M. Daturi C. Serre G. Férey Angew. Chem. Int. Ed. 47 2008 4144 4148 [11] B. Li Y. Zhang D. Ma L. Li G. Li G. Li Z. Shi S. Feng Chem. Commun. 48 2012 6151 6153 [12] P.D.C. Dietzel V. Besikiotis R. Blom J. Mater. Chem. 19 2009 7362 7370 [13] J. Lee O.K. Farha J. Roberts K.A. Scheidt S.T. Nguyen J.T. Hupp Chem. Soc. Rev. 38 2009 1450 1459 [14] P. Valvekens F. Vermoortele D. De Vos Catal. Sci. Technol. 3 2013 1435 1445 [15] D.-Y. Hong Y.K. Hwang C. Serre G. Férey J.-S. Chang Adv. Funct. Mater. 19 2009 1537 1552 [16] M. Kurmoo Chem. Soc. Rev. 38 2009 1353 1379 [17] X. Zhao S. Liu Z. Tang H. Niu Y. Cai W. Meng F. Wu J.P. Giesy Sci. Rep. 5 2015 11849 [18] M. Sapna, in Greener reactions under solvent free conditions, Thapar University, Patiala, 2009. [19] P.J. Dunn Chem. Soc. Rev. 41 2012 1452 1461 [20] P.J. Dunn Green Chem. 15 2013 3099 3104 [21] J.L. Tucker M.M. Faul Nature 534 2016 27 29 [22] M. Asif Int. J. Pharm. Chem. 5 2016 397 409 [23] M. Hegde K. Mantelingu H.A. Swarup C.S. Pavankumar I. Qamar S.C. Raghavan K.S. Rangappa RSC Adv. 6 2016 6308 6319 [24] M. Asif Curr. Med. Chem. 19 2012 2984 2991 [25] B. Dam M. Saha R. Jamatia A. Pal Synfacts 12 2016 0992–0992 [26] B. Dam M. Saha R. Jamatia A.K. Pal RSC Adv. 6 2016 54768 54776 [27] F. Davod A.R. Kiasat M. Enjilzadeh M. Cheraghchi Lett. Org. Chem. 13 2016 58 66 [28] M. Nikoorazm A. Ghorbani-Choghamarani M. Khanmoradi RSC Adv. 6 2016 56549 56561 [29] R.H. Vekariya N.P. Prajapati H.D. Patel Synth. Commun. 46 2016 197 219 [30] H. Zhang J. Deng Y. Wu ACS Sustain. Chem. Eng. 5 1 2017 658 666 [31] L.L. Chng N. Erathodiyil J.Y. Ying Acc. Chem. Res. 46 2013 1825 1837 [32] S. Li F. Huo Nanoscale 7 2015 7482 7501 [33] Z. Tai M.A. Isaacs C.M.A. Parlett A.F. Lee K. Wilson Catal. Commun. 92 2017 56 60 [34] R. Tayebee S. Tizabi Chin. J. Catal. 33 2012 962 969 [35] R. Tayebee N. Abdollahi M. Ghadamgahi J. Chin. Chem. Soc. 60 2013 1014 1018 [36] R. Tayebee M.M. Amini F. Nehzat O. Sadeghi M. Armaghan J. Mol. Catal. A: Chem. 366 2013 140 148 [37] R. Tayebee M.M. Amini H. Rostamian A. Aliakbari Dalton Trans. 43 2014 1550 1563 [38] B. Maleki M. Baghayeri S.A. Jannat Abadi R. Tayebee A. Khojastehnezhad RSC Adv. 6 2016 96644 96661 [39] R. Tayebee K. Savoji M.K. Razi B. Maleki RSC Adv. 6 2016 55319 55326 [40] H.R. Shaterian A. Hosseinian M. Ghashang Arkivoc 2 2009 59 67 [41] M. Kidwai A. Jahan R. Chauhan N.K. Mishra Tetrahedron Lett. 53 2012 1728 1731 [42] A. Hasaninejed M.R. Kazerooni A. Zare Catal. Today 196 2012 148 155 [43] X. Wang W.-W. Ma L.-Q. Wu F.-L. Yan J. Chin. Chem. Soc. 57 2010 1341 1345 [44] G. Ferey C. Mellot-Draznieks C. Serre F. Millange J. Dutour S. Surble I. Margiolaki Science 309 2005 2040 2042 [45] L. Bromberg Y. Diao H. Wu S.A. Speakman T.A. Hatton Chem. Mater. 24 2012 1664 1675 [46] H. Liu Y. Li H. Jiang C. Vargas R. Luque Chem. Commun. 48 2012 8431 8433 [47] M. Saikia D. Bhuyan L. Saikia New J. Chem. 39 2015 64 67 [48] A.D. Newman D.R. Brown P. Siril A.F. Lee K. Wilson Phys. Chem. Chem. Phys. 8 2006 2893 2902 [49] L. Frattini M.A. Isaacs C.M.A. Parlett K. Wilson G. Kyriakou A.F. Lee Appl. Catal. B: Environ. 200 2017 10 18 [50] N.V. Maksimchuk O.V. Zalomaeva I.Y. Skobelev K.A. Kovalenko V.P. Fedin O.A. Kholdeeva Proc. R. Soc. A: Math. Phys. Eng. Sci. 468 2012 2017 2034 [51] B.R. Knappett P. Abdulkin E. Ringe D.A. Jefferson S. Lozano-Perez T.C. Rojas A. Fernandez A.E.H. Wheatley Nanoscale 5 2013 5765 5772 [52] G.M. Varga E. Papaconstantinou M.T. Pope Inorg. Chem. 9 1970 662 667 [53] X. Qian X. Tong Q. Wu Z. He F. Cao W. Yan Dalton Trans. 41 2012 9897 9900 [54] S.H. Jhung J.H. Lee J.W. Yoon C. Serre G. Férey J.S. Chang Adv. Mater. 19 2007 121 124 [55] Q. Liu L. Ning S. Zheng M. Tao Y. Shi Y. He Sci. Rep. 3 2013 2916 [56] S. Bhattacharjee C. Chen W.-S. Ahn RSC Adv. 4 2014 52500 52525 [57] Y.K. Hwang D.Y. Hong J.S. Chang S.H. Jhung Y.K. Seo J. Kim A. Vimont M. Daturi C. Serre G. Ferey Angew. Chem. 47 2008 4144 4148 [58] J. Davarpanah A.R. Kiasat S. Noorizadeh M. Ghahremani J. Mol. Catal. A: Chem. 376 2013 78 89 [59] Y.-F. Huang M. Liu Y.-Q. Wang Y. Li J.-M. Zhang S.-H. Huo RSC Adv. 6 2016 15362 15369 [60] X. Li H. Xue H. Pang Nanoscale 9 2017 216 222 [61] E. Caliman J.A. Dias S.C.L. Dias A.G.S. Prado Catal. Today 107 2005 816 825 [62] N.I.o.S.a. Technology, in, Gaithersburg, 2012. [63] D. Julião A.C. Gomes M. Pillinger L. Cunha-Silva B. de Castro I.S. Gonçalves S.S. Balula Fuel Process. Technol. 131 2015 78 86 [64] Y. Xu M. Lv H. Yang Q. Chen X. Liu W. Fengyu RSC Adv. 5 2015 43473 43479 [65] R. Tayebee M.M. Amini S. Pouyamanesh A. Aliakbari Dalton Trans. 44 2015 5888 5897 [66] J.M. Khurana D. Magoo Tetrahedron Lett. 50 2009 7300 7303 [67] K. Mazaahir C. Ritika J. Anwar Chin. Sci. Bull. 57 2012 2273 2279 [68] M. Sayyafi M. Seyyedhamzeh H.R. Khavasi A. Bazgir Tetrahedron 64 2008 2375 2378 [69] F. Yang H.J. Zang Q.K. Wang B.W. Cheng Y.L. Ren X.L. Xu Advanced Materials Research 2011 Trans Tech Publ. 1884 1887 [70] H.R. Shaterian M. Ghashang M. Feyzi Appl. Catal. A: Gen. 345 2008 128 133 [71] A.R. Kiasat J. Davarpanah J. Mol. Catal. A: Chem. 373 2013 46 54 [72] N. Janssens L.H. Wee S. Bajpe E. Breynaert C.E.A. Kirschhock J.A. Martens Chem. Sci. 3 2012 1847 1850 [73] H.R. Shaterian F. Rigi Starch-Stärke 63 2011 340 346",
      "scopus-id": "85029588833",
      "coredata": {
        "eid": "1-s2.0-S2468823117304005",
        "dc:description": "A magnetic inorganic-organic catalyst, PTA@Fe3O4/EN-MIL-101 (EN=ethylenediamine, PTA=phosphotungstic acid) was fabricated and characterized by XRD, HRTEM, FESEM, UV–vis, TGA-DTA, FT-IR, XPS and porosimetry. PTA retained the parent Keggin structure upon dispersion throughout the amine-functionalized chromium terephthalate metal-organic framework, over which magnetic Fe3O4 nanoparticles were previously introduced. The resulting composite heterogeneous solid acid was an active catalyst for the one-pot synthesis of diverse 2H-indazolo[2,1-b] phthalazine-triones in good→excellent yields under mild, solventless condition, and offers facile separation and excellent recyclability.",
        "openArchiveArticle": "false",
        "prism:coverDate": "2017-10-31",
        "openaccessUserLicense": null,
        "prism:aggregationType": "Journal",
        "prism:url": "https://api.elsevier.com/content/article/pii/S2468823117304005",
        "dc:creator": [
          {
            "@_fa": "true",
            "$": "Hashemzadeh, Alireza"
          },
          {
            "@_fa": "true",
            "$": "Amini, Mostafa M."
          },
          {
            "@_fa": "true",
            "$": "Tayebee, Reza"
          },
          {
            "@_fa": "true",
            "$": "Sadeghian, Atefeh"
          },
          {
            "@_fa": "true",
            "$": "Durndell, Lee J."
          },
          {
            "@_fa": "true",
            "$": "Isaacs, Mark A."
          },
          {
            "@_fa": "true",
            "$": "Osatiashtiani, Amin"
          },
          {
            "@_fa": "true",
            "$": "Parlett, Christopher M.A."
          },
          {
            "@_fa": "true",
            "$": "Lee, Adam F."
          }
        ],
        "link": [
          {
            "@_fa": "true",
            "@rel": "self",
            "@href": "https://api.elsevier.com/content/article/pii/S2468823117304005"
          },
          {
            "@_fa": "true",
            "@rel": "scidir",
            "@href": "https://www.sciencedirect.com/science/article/pii/S2468823117304005"
          }
        ],
        "dc:format": "application/json",
        "openaccessType": null,
        "pii": "S2468-8231(17)30400-5",
        "prism:volume": "440",
        "prism:publisher": "Elsevier B.V.",
        "dc:title": "A magnetically-separable H3PW12O40@Fe3O4/EN-MIL-101 catalyst for the one-pot solventless synthesis of 2H-indazolo[2,1-b] phthalazine-triones",
        "prism:copyright": "© 2017 Elsevier B.V. All rights reserved.",
        "openaccess": "0",
        "prism:issn": "24688231",
        "dcterms:subject": [
          {
            "@_fa": "true",
            "$": "Metal-organic framework"
          },
          {
            "@_fa": "true",
            "$": "Magnetic nanoparticles"
          },
          {
            "@_fa": "true",
            "$": "Heteropolyacid"
          },
          {
            "@_fa": "true",
            "$": "Phthalazine-trione"
          }
        ],
        "openaccessArticle": "false",
        "prism:publicationName": "Molecular Catalysis",
        "openaccessSponsorType": null,
        "prism:pageRange": "96-106",
        "prism:endingPage": "106",
        "pubType": "fla",
        "prism:coverDisplayDate": "October 2017",
        "prism:doi": "10.1016/j.mcat.2017.07.010",
        "prism:startingPage": "96",
        "dc:identifier": "doi:10.1016/j.mcat.2017.07.010",
        "openaccessSponsorName": null
      },
      "objects": {
        "object": [
          {
            "@category": "thumbnail",
            "@height": "88",
            "@width": "219",
            "@_fa": "true",
            "$": "https://api.elsevier.com/content/object/eid/1-s2.0-S2468823117304005-fx1.sml?httpAccept=%2A%2F%2A",
            "@multimediatype": "GIF image file",
            "@type": "IMAGE-THUMBNAIL",
            "@size": "5478",
            "@ref": "fx1",
            "@mimetype": "image/gif"
          },
          {
            "@category": "thumbnail",
            "@height": "88",
            "@width": "219",
            "@_fa": "true",
            "$": "https://api.elsevier.com/content/object/eid/1-s2.0-S2468823117304005-fx2.sml?httpAccept=%2A%2F%2A",
            "@multimediatype": "GIF image file",
            "@type": "IMAGE-THUMBNAIL",
            "@size": "2090",
            "@ref": "fx2",
            "@mimetype": "image/gif"
          },
          {
            "@category": "thumbnail",
            "@height": "88",
            "@width": "219",
            "@_fa": "true",
            "$": "https://api.elsevier.com/content/object/eid/1-s2.0-S2468823117304005-fx3.sml?httpAccept=%2A%2F%2A",
            "@multimediatype": "GIF image file",
            "@type": "IMAGE-THUMBNAIL",
            "@size": "2770",
            "@ref": "fx3",
            "@mimetype": "image/gif"
          },
          {
            "@category": "thumbnail",
            "@height": "88",
            "@width": "219",
            "@_fa": "true",
            "$": "https://api.elsevier.com/content/object/eid/1-s2.0-S2468823117304005-fx4.sml?httpAccept=%2A%2F%2A",
            "@multimediatype": "GIF image file",
            "@type": "IMAGE-THUMBNAIL",
            "@size": "2009",
            "@ref": "fx4",
            "@mimetype": "image/gif"
          },
          {
            "@category": "thumbnail",
            "@height": "88",
            "@width": "219",
            "@_fa": "true",
            "$": "https://api.elsevier.com/content/object/eid/1-s2.0-S2468823117304005-fx5.sml?httpAccept=%2A%2F%2A",
            "@multimediatype": "GIF image file",
            "@type": "IMAGE-THUMBNAIL",
            "@size": "1924",
            "@ref": "fx5",
            "@mimetype": "image/gif"
          },
          {
            "@category": "thumbnail",
            "@height": "164",
            "@width": "147",
            "@_fa": "true",
            "$": "https://api.elsevier.com/content/object/eid/1-s2.0-S2468823117304005-gr1.sml?httpAccept=%2A%2F%2A",
            "@multimediatype": "GIF image file",
            "@type": "IMAGE-THUMBNAIL",
            "@size": "6308",
            "@ref": "gr1",
            "@mimetype": "image/gif"
          },
          {
            "@category": "thumbnail",
            "@height": "163",
            "@width": "158",
            "@_fa": "true",
            "$": "https://api.elsevier.com/content/object/eid/1-s2.0-S2468823117304005-gr2.sml?httpAccept=%2A%2F%2A",
            "@multimediatype": "GIF image file",
            "@type": "IMAGE-THUMBNAIL",
            "@size": "7271",
            "@ref": "gr2",
            "@mimetype": "image/gif"
          },
          {
            "@category": "thumbnail",
            "@height": "152",
            "@width": "219",
            "@_fa": "true",
            "$": "https://api.elsevier.com/content/object/eid/1-s2.0-S2468823117304005-gr3.sml?httpAccept=%2A%2F%2A",
            "@multimediatype": "GIF image file",
            "@type": "IMAGE-THUMBNAIL",
            "@size": "9942",
            "@ref": "gr3",
            "@mimetype": "image/gif"
          },
          {
            "@category": "thumbnail",
            "@height": "164",
            "@width": "110",
            "@_fa": "true",
            "$": "https://api.elsevier.com/content/object/eid/1-s2.0-S2468823117304005-gr4.sml?httpAccept=%2A%2F%2A",
            "@multimediatype": "GIF image file",
            "@type": "IMAGE-THUMBNAIL",
            "@size": "13225",
            "@ref": "gr4",
            "@mimetype": "image/gif"
          },
          {
            "@category": "thumbnail",
            "@height": "163",
            "@width": "160",
            "@_fa": "true",
            "$": "https://api.elsevier.com/content/object/eid/1-s2.0-S2468823117304005-gr5.sml?httpAccept=%2A%2F%2A",
            "@multimediatype": "GIF image file",
            "@type": "IMAGE-THUMBNAIL",
            "@size": "8004",
            "@ref": "gr5",
            "@mimetype": "image/gif"
          },
          {
            "@category": "thumbnail",
            "@height": "164",
            "@width": "94",
            "@_fa": "true",
            "$": "https://api.elsevier.com/content/object/eid/1-s2.0-S2468823117304005-gr6.sml?httpAccept=%2A%2F%2A",
            "@multimediatype": "GIF image file",
            "@type": "IMAGE-THUMBNAIL",
            "@size": "5336",
            "@ref": "gr6",
            "@mimetype": "image/gif"
          },
          {
            "@category": "thumbnail",
            "@height": "164",
            "@width": "154",
            "@_fa": "true",
            "$": "https://api.elsevier.com/content/object/eid/1-s2.0-S2468823117304005-gr7.sml?httpAccept=%2A%2F%2A",
            "@multimediatype": "GIF image file",
            "@type": "IMAGE-THUMBNAIL",
            "@size": "6400",
            "@ref": "gr7",
            "@mimetype": "image/gif"
          },
          {
            "@category": "thumbnail",
            "@height": "152",
            "@width": "219",
            "@_fa": "true",
            "$": "https://api.elsevier.com/content/object/eid/1-s2.0-S2468823117304005-gr8.sml?httpAccept=%2A%2F%2A",
            "@multimediatype": "GIF image file",
            "@type": "IMAGE-THUMBNAIL",
            "@size": "6924",
            "@ref": "gr8",
            "@mimetype": "image/gif"
          },
          {
            "@category": "thumbnail",
            "@height": "139",
            "@width": "219",
            "@_fa": "true",
            "$": "https://api.elsevier.com/content/object/eid/1-s2.0-S2468823117304005-gr9.sml?httpAccept=%2A%2F%2A",
            "@multimediatype": "GIF image file",
            "@type": "IMAGE-THUMBNAIL",
            "@size": "4543",
            "@ref": "gr9",
            "@mimetype": "image/gif"
          },
          {
            "@category": "thumbnail",
            "@height": "164",
            "@width": "161",
            "@_fa": "true",
            "$": "https://api.elsevier.com/content/object/eid/1-s2.0-S2468823117304005-sc1.sml?httpAccept=%2A%2F%2A",
            "@multimediatype": "GIF image file",
            "@type": "IMAGE-THUMBNAIL",
            "@size": "10228",
            "@ref": "sc1",
            "@mimetype": "image/gif"
          },
          {
            "@category": "thumbnail",
            "@height": "164",
            "@width": "140",
            "@_fa": "true",
            "$": "https://api.elsevier.com/content/object/eid/1-s2.0-S2468823117304005-sc2.sml?httpAccept=%2A%2F%2A",
            "@multimediatype": "GIF image file",
            "@type": "IMAGE-THUMBNAIL",
            "@size": "4587",
            "@ref": "sc2",
            "@mimetype": "image/gif"
          },
          {
            "@category": "standard",
            "@height": "200",
            "@width": "500",
            "@_fa": "true",
            "$": "https://api.elsevier.com/content/object/eid/1-s2.0-S2468823117304005-fx1.jpg?httpAccept=%2A%2F%2A",
            "@multimediatype": "JPEG image file",
            "@type": "IMAGE-DOWNSAMPLED",
            "@size": "20902",
            "@ref": "fx1",
            "@mimetype": "image/jpeg"
          },
          {
            "@category": "standard",
            "@height": "200",
            "@width": "500",
            "@_fa": "true",
            "$": "https://api.elsevier.com/content/object/eid/1-s2.0-S2468823117304005-fx2.jpg?httpAccept=%2A%2F%2A",
            "@multimediatype": "JPEG image file",
            "@type": "IMAGE-DOWNSAMPLED",
            "@size": "5592",
            "@ref": "fx2",
            "@mimetype": "image/jpeg"
          },
          {
            "@category": "standard",
            "@height": "200",
            "@width": "500",
            "@_fa": "true",
            "$": "https://api.elsevier.com/content/object/eid/1-s2.0-S2468823117304005-fx3.jpg?httpAccept=%2A%2F%2A",
            "@multimediatype": "JPEG image file",
            "@type": "IMAGE-DOWNSAMPLED",
            "@size": "8438",
            "@ref": "fx3",
            "@mimetype": "image/jpeg"
          },
          {
            "@category": "standard",
            "@height": "200",
            "@width": "500",
            "@_fa": "true",
            "$": "https://api.elsevier.com/content/object/eid/1-s2.0-S2468823117304005-fx4.jpg?httpAccept=%2A%2F%2A",
            "@multimediatype": "JPEG image file",
            "@type": "IMAGE-DOWNSAMPLED",
            "@size": "5575",
            "@ref": "fx4",
            "@mimetype": "image/jpeg"
          },
          {
            "@category": "standard",
            "@height": "200",
            "@width": "500",
            "@_fa": "true",
            "$": "https://api.elsevier.com/content/object/eid/1-s2.0-S2468823117304005-fx5.jpg?httpAccept=%2A%2F%2A",
            "@multimediatype": "JPEG image file",
            "@type": "IMAGE-DOWNSAMPLED",
            "@size": "5292",
            "@ref": "fx5",
            "@mimetype": "image/jpeg"
          },
          {
            "@category": "standard",
            "@height": "335",
            "@width": "301",
            "@_fa": "true",
            "$": "https://api.elsevier.com/content/object/eid/1-s2.0-S2468823117304005-gr1.jpg?httpAccept=%2A%2F%2A",
            "@multimediatype": "JPEG image file",
            "@type": "IMAGE-DOWNSAMPLED",
            "@size": "22275",
            "@ref": "gr1",
            "@mimetype": "image/jpeg"
          },
          {
            "@category": "standard",
            "@height": "311",
            "@width": "301",
            "@_fa": "true",
            "$": "https://api.elsevier.com/content/object/eid/1-s2.0-S2468823117304005-gr2.jpg?httpAccept=%2A%2F%2A",
            "@multimediatype": "JPEG image file",
            "@type": "IMAGE-DOWNSAMPLED",
            "@size": "29213",
            "@ref": "gr2",
            "@mimetype": "image/jpeg"
          },
          {
            "@category": "standard",
            "@height": "471",
            "@width": "678",
            "@_fa": "true",
            "$": "https://api.elsevier.com/content/object/eid/1-s2.0-S2468823117304005-gr3.jpg?httpAccept=%2A%2F%2A",
            "@multimediatype": "JPEG image file",
            "@type": "IMAGE-DOWNSAMPLED",
            "@size": "58591",
            "@ref": "gr3",
            "@mimetype": "image/jpeg"
          },
          {
            "@category": "standard",
            "@height": "702",
            "@width": "470",
            "@_fa": "true",
            "$": "https://api.elsevier.com/content/object/eid/1-s2.0-S2468823117304005-gr4.jpg?httpAccept=%2A%2F%2A",
            "@multimediatype": "JPEG image file",
            "@type": "IMAGE-DOWNSAMPLED",
            "@size": "117756",
            "@ref": "gr4",
            "@mimetype": "image/jpeg"
          },
          {
            "@category": "standard",
            "@height": "480",
            "@width": "470",
            "@_fa": "true",
            "$": "https://api.elsevier.com/content/object/eid/1-s2.0-S2468823117304005-gr5.jpg?httpAccept=%2A%2F%2A",
            "@multimediatype": "JPEG image file",
            "@type": "IMAGE-DOWNSAMPLED",
            "@size": "57664",
            "@ref": "gr5",
            "@mimetype": "image/jpeg"
          },
          {
            "@category": "standard",
            "@height": "590",
            "@width": "339",
            "@_fa": "true",
            "$": "https://api.elsevier.com/content/object/eid/1-s2.0-S2468823117304005-gr6.jpg?httpAccept=%2A%2F%2A",
            "@multimediatype": "JPEG image file",
            "@type": "IMAGE-DOWNSAMPLED",
            "@size": "39925",
            "@ref": "gr6",
            "@mimetype": "image/jpeg"
          },
          {
            "@category": "standard",
            "@height": "501",
            "@width": "470",
            "@_fa": "true",
            "$": "https://api.elsevier.com/content/object/eid/1-s2.0-S2468823117304005-gr7.jpg?httpAccept=%2A%2F%2A",
            "@multimediatype": "JPEG image file",
            "@type": "IMAGE-DOWNSAMPLED",
            "@size": "33715",
            "@ref": "gr7",
            "@mimetype": "image/jpeg"
          },
          {
            "@category": "standard",
            "@height": "235",
            "@width": "339",
            "@_fa": "true",
            "$": "https://api.elsevier.com/content/object/eid/1-s2.0-S2468823117304005-gr8.jpg?httpAccept=%2A%2F%2A",
            "@multimediatype": "JPEG image file",
            "@type": "IMAGE-DOWNSAMPLED",
            "@size": "15777",
            "@ref": "gr8",
            "@mimetype": "image/jpeg"
          },
          {
            "@category": "standard",
            "@height": "299",
            "@width": "470",
            "@_fa": "true",
            "$": "https://api.elsevier.com/content/object/eid/1-s2.0-S2468823117304005-gr9.jpg?httpAccept=%2A%2F%2A",
            "@multimediatype": "JPEG image file",
            "@type": "IMAGE-DOWNSAMPLED",
            "@size": "17959",
            "@ref": "gr9",
            "@mimetype": "image/jpeg"
          },
          {
            "@category": "standard",
            "@height": "479",
            "@width": "470",
            "@_fa": "true",
            "$": "https://api.elsevier.com/content/object/eid/1-s2.0-S2468823117304005-sc1.jpg?httpAccept=%2A%2F%2A",
            "@multimediatype": "JPEG image file",
            "@type": "IMAGE-DOWNSAMPLED",
            "@size": "61061",
            "@ref": "sc1",
            "@mimetype": "image/jpeg"
          },
          {
            "@category": "standard",
            "@height": "662",
            "@width": "565",
            "@_fa": "true",
            "$": "https://api.elsevier.com/content/object/eid/1-s2.0-S2468823117304005-sc2.jpg?httpAccept=%2A%2F%2A",
            "@multimediatype": "JPEG image file",
            "@type": "IMAGE-DOWNSAMPLED",
            "@size": "50109",
            "@ref": "sc2",
            "@mimetype": "image/jpeg"
          },
          {
            "@category": "standard",
            "@_fa": "true",
            "$": "https://api.elsevier.com/content/object/eid/1-s2.0-S2468823117304005-mmc1.docx?httpAccept=%2A%2F%2A",
            "@multimediatype": "Microsoft Word file",
            "@type": "APPLICATION",
            "@size": "3832109",
            "@ref": "mmc1",
            "@mimetype": "application/word"
          }
        ]
      },
      "link": {
        "@rel": "abstract",
        "@href": "https://api.elsevier.com/content/abstract/scopus_id/85029588833"
      }
    }
  }
}