{
  "metadata": {
    "title": "Silver- and gold-catalyzed azide−alkyne cycloaddition by functionalized NHC-based polynuclear catalysts: Computational investigation and mechanistic insights",
    "authors": "; ; ",
    "journal": "Molecular Catalysis",
    "date": "2025-01-31",
    "doi": "10.1016/j.mcat.2024.114708",
    "abstract": "",
    "uri": "https://api.elsevier.com/content/article/pii/S2468823124008903",
    "pii": "S2468823124008903"
  },
  "fulltext": {
    "full-text-retrieval-response": {
      "scopus-eid": "2-s2.0-85209689239",
      "originalText": "serial JL 315758 291210 291744 291790 291809 31 Molecular Catalysis MOLECULARCATALYSIS 2024-11-22 2024-11-22 2024-11-22 2024-11-22 2024-11-29T03:58:10 1-s2.0-S2468823124008903 S2468-8231(24)00890-3 S2468823124008903 10.1016/j.mcat.2024.114708 S300 S300.1 FULL-TEXT 1-s2.0-S2468823124X00164 2024-11-29T05:30:15.778016Z 0 0 20250101 20250131 2025 2024-11-22T05:42:23.722223Z absattachment articleinfo articlenumber articletitlenorm authfirstinitialnorm authfirstsurnamenorm cid cids contenttype copyright crossmark dateloaded dateloadedtxt datesearch datesort dateupdated dco docsubtype doctype doi eid ewtransactionid hubeid indexeddate issn issnnorm itemstage itemtransactionid itemweight openaccess openarchive pg pgfirst pii piinorm pubdateend pubdatestart pubdatetxt pubyr sectiontitle sortorder srctitle srctitlenorm srctype ssids alllist content subj subheadings suppl tomb volfirst volissue volumelist webpdf webpdfpagecount yearnav figure e-component body acknowledge affil appendices articletitle auth authfirstini authfull authkeywords authlast grantnumber grantsponsor highlightsabst orcid primabst ref specialabst 2468-8231 24688231 true 570 570 C Volume 570 43 114708 114708 114708 202501 January 2025 2025-01-01 2025-01-31 2025 Regular Papers article fla © 2024 Elsevier B.V. All rights are reserved, including those for text and data mining, AI training, and similar technologies. SILVERGOLDCATALYZEDAZIDEALKYNECYCLOADDITIONBYFUNCTIONALIZEDNHCBASEDPOLYNUCLEARCATALYSTSCOMPUTATIONALINVESTIGATIONMECHANISTICINSIGHTS KHAIRBEK A Introduction Computational details Results and discussions NCI and RDG analysis ELF and LOL analysis Conclusion CRediT authorship contribution statement Acknowledgement Appendix Supplementary materials References SEO 2021 16 22 C BADAWI 2023 3683 3691 M KHAIRBEK 2023 69 81 A GOMES 2024 874 886 C GOVDI 2024 4831 4845 A KHAIRBEK 2023 57 69 A KHAIRBEK 2024 777 790 A WEI 2023 9973 9986 Q SINGH 2023 2912 2936 G GOMES 2019 3697 3712 R KHAIRBEK 2024 114412 A KHAIRBEK 2024 1 13 A KHAIRBEK 2024 16635 16646 A HUISGEN 1968 2291 2297 R KENDALL 2019 2499 2505 N DANESE 2019 19281 19287 M WORRELL 2013 457 460 B LI 2016 1393 L JAISWAL 2024 513 558 M ARAGAOLEONETI 2010 9475 9492 V BLASTIK 2017 346 349 Z TOUJ 2017 49 63 N JAHAN 2023 1 38 N PINEDACASTANEDA 2022 3650 3666 H PEERAPPAYADAV 2024 e202303058 S SHEN 2022 214425 H LAMBERTI 2012 756 767 M HUANG 2021 4185 4190 H SAU 2020 1233 1252 S GONZALEZLAINEZ 2022 2154 2169 M POWERS 2015 14747 14752 A ELAYOUCHIA 2020 956 H ELMAHMOUDI 2022 100552 A BENMOUSSA 2023 2379 2396 S TURUKARABETTU 2023 2638 2644 V SULTANA 2019 1117 1121 J BENELAYOUCHIA 2018 7670 7678 H SARALA 2021 1 34 S MORALESPUMARINO 2023 e27051 D CONTRERASGARCIA 2011 12983 12990 J JOHNSON 2010 6498 6506 E SAVIN 1997 1808 1832 A STEINMANN 2011 20584 20592 S GULDE 2012 4062 4068 R PEVERATI 2012 13171 13174 R WEIGEND 2005 3297 3305 F FRISCH 2016 M GAUSSIAN16REVISIONC01 COSSI 2003 669 681 M LU 2012 580 592 T KHAIRBEKX2025X114708 KHAIRBEKX2025X114708XA 2026-11-22T00:00:00.000Z 2026-11-22T00:00:00.000Z http://creativecommons.org/licenses/by-nc-nd/4.0/ © 2024 Elsevier B.V. All rights are reserved, including those for text and data mining, AI training, and similar technologies. 2024-11-24T04:44:03.000Z http://vtw.elsevier.com/data/voc/AddOnTypes/50.7/aggregated-refined C23-1708759250 RSC Royal Society of Chemistry http://data.elsevier.com/vocabulary/SciValFunders/501100000704 http://sws.geonames.org/2635167 RT thanks Royal Society of Chemistry, London for support through RSC Researcher Collaborations Grant (C23-1708759250). SEAGrid (http:www.seagrid.org) is acknowledged for computational resources and services for the selected results used in this publication. https://doi.org/10.15223/policy-017 https://doi.org/10.15223/policy-037 https://doi.org/10.15223/policy-012 https://doi.org/10.15223/policy-029 https://doi.org/10.15223/policy-004 item S2468-8231(24)00890-3 S2468823124008903 1-s2.0-S2468823124008903 10.1016/j.mcat.2024.114708 315758 2024-11-29T05:30:15.778016Z 2025-01-01 2025-01-31 1-s2.0-S2468823124008903-main.pdf https://s3-eu-west-1.amazonaws.com/prod-ucs-content-store-eu-west/content/pii:S2468823124008903/MAIN/application/pdf/9c0124f513fa5143624ed021663f20ee/main.pdf main.pdf pdf true 12122299 MAIN 9 1-s2.0-S2468823124008903-main_1.png https://s3-eu-west-1.amazonaws.com/prod-ucs-content-store-eu-west/content/pii:S2468823124008903/PREVIEW/image/png/2b2f24e74177b904bdf98daa0484a4cf/main_1.png main_1.png png 57354 849 656 IMAGE-WEB-PDF 1 1-s2.0-S2468823124008903-sc1.jpg https://s3-eu-west-1.amazonaws.com/prod-ucs-content-store-eu-west/content/pii:S2468823124008903/sc1/DOWNSAMPLED/image/jpeg/97e8e930a7ccf4a67222909997ed0d6e/sc1.jpg sc1 sc1.jpg jpg 37396 383 376 IMAGE-DOWNSAMPLED 1-s2.0-S2468823124008903-sc2.jpg https://s3-eu-west-1.amazonaws.com/prod-ucs-content-store-eu-west/content/pii:S2468823124008903/sc2/DOWNSAMPLED/image/jpeg/5515e2f2c70efcc09196f658e4c6adb5/sc2.jpg sc2 sc2.jpg jpg 93777 534 791 IMAGE-DOWNSAMPLED 1-s2.0-S2468823124008903-gr1.jpg https://s3-eu-west-1.amazonaws.com/prod-ucs-content-store-eu-west/content/pii:S2468823124008903/gr1/DOWNSAMPLED/image/jpeg/6b371d248c6203893e7931fa07281d5d/gr1.jpg gr1 gr1.jpg jpg 68200 410 678 IMAGE-DOWNSAMPLED 1-s2.0-S2468823124008903-gr2.jpg https://s3-eu-west-1.amazonaws.com/prod-ucs-content-store-eu-west/content/pii:S2468823124008903/gr2/DOWNSAMPLED/image/jpeg/8b36e3d3b62702a9639ff79b1cfe0728/gr2.jpg gr2 gr2.jpg jpg 98107 453 791 IMAGE-DOWNSAMPLED 1-s2.0-S2468823124008903-ga1.jpg https://s3-eu-west-1.amazonaws.com/prod-ucs-content-store-eu-west/content/pii:S2468823124008903/ga1/DOWNSAMPLED/image/jpeg/812ddd689a2c44336e7d59143b332ba8/ga1.jpg ga1 true ga1.jpg jpg 21120 200 330 IMAGE-DOWNSAMPLED 1-s2.0-S2468823124008903-gr3.jpg https://s3-eu-west-1.amazonaws.com/prod-ucs-content-store-eu-west/content/pii:S2468823124008903/gr3/DOWNSAMPLED/image/jpeg/d599d31eeb8bbe914bf7ad19179cc0ba/gr3.jpg gr3 gr3.jpg jpg 71974 494 791 IMAGE-DOWNSAMPLED 1-s2.0-S2468823124008903-gr4.jpg https://s3-eu-west-1.amazonaws.com/prod-ucs-content-store-eu-west/content/pii:S2468823124008903/gr4/DOWNSAMPLED/image/jpeg/b24ccafa22d5192698e76123e0146541/gr4.jpg gr4 gr4.jpg jpg 59460 482 678 IMAGE-DOWNSAMPLED 1-s2.0-S2468823124008903-gr5.jpg https://s3-eu-west-1.amazonaws.com/prod-ucs-content-store-eu-west/content/pii:S2468823124008903/gr5/DOWNSAMPLED/image/jpeg/2c05ee5e91bce4a33a1f3b15041ce051/gr5.jpg gr5 gr5.jpg jpg 198664 774 791 IMAGE-DOWNSAMPLED 1-s2.0-S2468823124008903-gr6.jpg https://s3-eu-west-1.amazonaws.com/prod-ucs-content-store-eu-west/content/pii:S2468823124008903/gr6/DOWNSAMPLED/image/jpeg/11983f04929bd566ad372821b27a3561/gr6.jpg gr6 gr6.jpg jpg 277997 864 791 IMAGE-DOWNSAMPLED 1-s2.0-S2468823124008903-sc1.sml https://s3-eu-west-1.amazonaws.com/prod-ucs-content-store-eu-west/content/pii:S2468823124008903/sc1/THUMBNAIL/image/gif/9a1e5a8954df1366b1013b6f05f26fdc/sc1.sml sc1 sc1.sml sml 7064 164 161 IMAGE-THUMBNAIL 1-s2.0-S2468823124008903-sc2.sml https://s3-eu-west-1.amazonaws.com/prod-ucs-content-store-eu-west/content/pii:S2468823124008903/sc2/THUMBNAIL/image/gif/3672888c5870355f88e1390327b7b6cc/sc2.sml sc2 sc2.sml sml 8791 148 219 IMAGE-THUMBNAIL 1-s2.0-S2468823124008903-gr1.sml https://s3-eu-west-1.amazonaws.com/prod-ucs-content-store-eu-west/content/pii:S2468823124008903/gr1/THUMBNAIL/image/gif/1b8ab69cc49fed8b4f37805a6bb95cb7/gr1.sml gr1 gr1.sml sml 13202 133 219 IMAGE-THUMBNAIL 1-s2.0-S2468823124008903-gr2.sml https://s3-eu-west-1.amazonaws.com/prod-ucs-content-store-eu-west/content/pii:S2468823124008903/gr2/THUMBNAIL/image/gif/adddf692914e48e5b3db1854b0a08b25/gr2.sml gr2 gr2.sml sml 14993 125 219 IMAGE-THUMBNAIL 1-s2.0-S2468823124008903-ga1.sml https://s3-eu-west-1.amazonaws.com/prod-ucs-content-store-eu-west/content/pii:S2468823124008903/ga1/THUMBNAIL/image/gif/829366573bd2f83321c9c08182883e50/ga1.sml ga1 true ga1.sml sml 8413 133 219 IMAGE-THUMBNAIL 1-s2.0-S2468823124008903-gr3.sml https://s3-eu-west-1.amazonaws.com/prod-ucs-content-store-eu-west/content/pii:S2468823124008903/gr3/THUMBNAIL/image/gif/c0ea26a9596140c4bb5464905671f226/gr3.sml gr3 gr3.sml sml 8540 137 219 IMAGE-THUMBNAIL 1-s2.0-S2468823124008903-gr4.sml https://s3-eu-west-1.amazonaws.com/prod-ucs-content-store-eu-west/content/pii:S2468823124008903/gr4/THUMBNAIL/image/gif/8f774a092c7055efc7332258749f8d12/gr4.sml gr4 gr4.sml sml 12483 156 219 IMAGE-THUMBNAIL 1-s2.0-S2468823124008903-gr5.sml https://s3-eu-west-1.amazonaws.com/prod-ucs-content-store-eu-west/content/pii:S246882312400885X/gr5/THUMBNAIL/image/gif/bda2396da9bfb351ad5bef5397f581cb/gr5.sml gr5 gr5.sml sml 15336 163 167 IMAGE-THUMBNAIL 1-s2.0-S2468823124008903-gr6.sml https://s3-eu-west-1.amazonaws.com/prod-ucs-content-store-eu-west/content/pii:S246882312400885X/gr6/THUMBNAIL/image/gif/d3937b402e414b581c9c15738fed753f/gr6.sml gr6 gr6.sml sml 19595 164 150 IMAGE-THUMBNAIL 1-s2.0-S2468823124008903-sc1_lrg.jpg https://s3-eu-west-1.amazonaws.com/prod-ucs-content-store-eu-west/content/pii:S2468823124008903/HIGHRES/image/jpeg/eff155e0c201005e3dd9e0918b06af32/sc1_lrg.jpg sc1 sc1_lrg.jpg jpg 243419 1699 1667 IMAGE-HIGH-RES 1-s2.0-S2468823124008903-sc2_lrg.jpg https://s3-eu-west-1.amazonaws.com/prod-ucs-content-store-eu-west/content/pii:S2468823124008903/HIGHRES/image/jpeg/6ce85680abc4b0b4444c1d6b68368b0a/sc2_lrg.jpg sc2 sc2_lrg.jpg jpg 690466 2364 3500 IMAGE-HIGH-RES 1-s2.0-S2468823124008903-gr1_lrg.jpg https://s3-eu-west-1.amazonaws.com/prod-ucs-content-store-eu-west/content/pii:S2468823124008903/HIGHRES/image/jpeg/1249ade1cea293db749ce3cc2e25c228/gr1_lrg.jpg gr1 gr1_lrg.jpg jpg 423077 1816 3000 IMAGE-HIGH-RES 1-s2.0-S2468823124008903-gr2_lrg.jpg https://s3-eu-west-1.amazonaws.com/prod-ucs-content-store-eu-west/content/pii:S2468823124008903/HIGHRES/image/jpeg/340b0c283d6ac775fb4b96a232c87560/gr2_lrg.jpg gr2 gr2_lrg.jpg jpg 612557 2003 3500 IMAGE-HIGH-RES 1-s2.0-S2468823124008903-ga1_lrg.jpg https://s3-eu-west-1.amazonaws.com/prod-ucs-content-store-eu-west/content/pii:S2468823124008903/HIGHRES/image/jpeg/3ae19dd536f6fae0da2c1d1332f916a3/ga1_lrg.jpg ga1 true ga1_lrg.jpg jpg 122355 886 1463 IMAGE-HIGH-RES 1-s2.0-S2468823124008903-gr3_lrg.jpg https://s3-eu-west-1.amazonaws.com/prod-ucs-content-store-eu-west/content/pii:S2468823124008903/HIGHRES/image/jpeg/0aab00b18733d8f4bf86684b830fb548/gr3_lrg.jpg gr3 gr3_lrg.jpg jpg 535389 2190 3504 IMAGE-HIGH-RES 1-s2.0-S2468823124008903-gr4_lrg.jpg https://s3-eu-west-1.amazonaws.com/prod-ucs-content-store-eu-west/content/pii:S246882312400885X/HIGHRES/image/jpeg/df464882cd09dd7fd93744b47c380fdf/gr4_lrg.jpg gr4 gr4_lrg.jpg jpg 380056 2131 3000 IMAGE-HIGH-RES 1-s2.0-S2468823124008903-gr5_lrg.jpg https://s3-eu-west-1.amazonaws.com/prod-ucs-content-store-eu-west/content/pii:S246882312400885X/HIGHRES/image/jpeg/48da4792e7561352dae6baeee3b8a3b6/gr5_lrg.jpg gr5 gr5_lrg.jpg jpg 1393341 3425 3500 IMAGE-HIGH-RES 1-s2.0-S2468823124008903-gr6_lrg.jpg https://s3-eu-west-1.amazonaws.com/prod-ucs-content-store-eu-west/content/pii:S246882312400885X/HIGHRES/image/jpeg/a72982f842ca1e987e7c5b5a583ed5d6/gr6_lrg.jpg gr6 gr6_lrg.jpg jpg 2044757 3824 3500 IMAGE-HIGH-RES 1-s2.0-S2468823124008903-mmc1.docx https://s3-eu-west-1.amazonaws.com/prod-ucs-content-store-eu-west/content/pii:S2468823124008903/mmc1/MAIN/application/vnd.openxmlformats-officedocument.wordprocessingml.document/5828148290a02ea6cccee115da66536b/mmc1.docx mmc1 mmc1.docx docx 23991 APPLICATION 1-s2.0-S2468823124008903-mmc2.zip https://s3-eu-west-1.amazonaws.com/prod-ucs-content-store-eu-west/content/pii:S2468823124008903/mmc2/MAIN/application/zip/d895540db91887a3a82696361c2c40cf/mmc2.zip mmc2 mmc2.zip zip 32966 APPLICATION MCAT 114708 114708 S2468-8231(24)00890-3 10.1016/j.mcat.2024.114708 Elsevier B.V. Fig. 1 Optimized structures of A ([M 2(μ-Br)2(tBuImCH2pyCH2NEt2)]2; (M= Cu, Ag, Au)) and the transition state TSB-C . The calculated distance (Å) (see Scheme 2). Fig 1 Fig. 2 Optimized structures of the transition states TSD-E and TSE-F . The calculated distance (Å) (see Scheme 2). Fig 2 Fig. 3 Structures of the L1 to L11 ligands used in the MAAC reactions reported in previous works [2,3,6,7,11,12]. Fig 3 Fig. 4 Optimized structures of triazolyl F. Calculated distance (Å) (see Scheme 2). Fig 4 Fig. 5 NCI and RDG plots of A ([M 2(μ-Br)2(tBuImCH2pyCH2NEt2)]2; (M=Cu, Ag, Au)). Fig 5 Fig. 6 ELF and LOL plots of A ([M 2(μ-Br)2(tBuImCH2pyCH2NEt2)]2; (M=Cu, Ag, Au)). Fig 6 Scheme 1 The proposed mechanism for the CuAAC reaction was described by Fokin et al. [19]. Scheme 1 Scheme 2 DFT-calculated Gibbs free energy profile (ΔG298 , in kcal/mol) and activation energy ( E # ) for transition state TS1 in acetonitrile. Scheme 2 Silver- and gold-catalyzed azide−alkyne cycloaddition by functionalized NHC-based polynuclear catalysts: Computational investigation and mechanistic insights Ali A Khairbek Writing – original draft Visualization Validation Methodology Investigation Formal analysis Data curation Conceptualization a b ⁎ Mohammad Abd Al-Hakim Badawi Writing – original draft Validation Formal analysis Data curation b Abdullah Yahya Abdullah Alzahrani Validation Supervision Formal analysis c Rajimon KJ Visualization Validation Formal analysis Data curation d e Renjith Thomas Writing – original draft Supervision Software Resources Methodology Investigation d e ⁎ a Centre of Molecular Medicine and Diagnostics (COMManD), Saveetha Dental College and Hospitals, Saveetha Institute of Medical and Technical Sciences, Saveetha University, Chennai 600 077, India Centre of Molecular Medicine and Diagnostics (COMManD) Saveetha Dental College and Hospitals Saveetha Institute of Medical and Technical Sciences Saveetha University Chennai 600 077 India aCentre of Molecular Medicine and Diagnostics (COMManD), Saveetha Dental College and Hospitals, Saveetha Institute of Medical and Technical Sciences, Saveetha University, Chennai 600 077, India b Department of Chemistry, Faculty of Science, Tishreen University, Latakia, Syrian Arab Republic Department of Chemistry Faculty of Science Tishreen University Latakia Syrian Arab Republic bDepartment of Chemistry, Faculty of Science, Tishreen University, Latakia, Syrian Arab Republic c Department of Chemistry, Faculty of Science and Arts, King Khalid University, Mohail Assir, Saudi Arabia Department of Chemistry Faculty of Science and Arts King Khalid University Mohail Assir Saudi Arabia cDepartment of Chemistry, Faculty of Science and Arts, King Khalid University, Mohail Assir, Saudi Arabia d Department of Chemistry, St Berchmans College (Autonomous), Changanassery, Kerala 686101, India Department of Chemistry St Berchmans College (Autonomous) Changanassery Kerala 686101 India dDepartment of Chemistry, St Berchmans College (Autonomous), Changanassery, Kerala 686101, India e Centre for Theoretical and Computational Chemistry, St Berchmans College (Autonomous), Changanassery, Kerala 686101, India Centre for Theoretical and Computational Chemistry St Berchmans College (Autonomous) Changanassery Kerala 686101 India eCentre for Theoretical and Computational Chemistry, St Berchmans College (Autonomous), Changanassery, Kerala 686101, India ⁎ Corresponding authors. This study evaluated the catalytic efficiency of Au(I), Ag(I), and Cu(I) complexes in the azide‒alkyne cycloaddition (AAC) reaction through density functional theory (DFT) calculations. Cu(I) complexes exhibit superior catalytic performance, with lower energy barriers (8.8 kcal/mol) and a favorable Gibbs free energy of -0.9 kcal/mol in the key cycloaddition step, significantly outperforming Ag and Au complexes. Structural analysis revealed that shorter M−C bond lengths in the Cu complex contributed to increased stability. Additionally, the copper complex has a more negative Gibbs free energy for the formed metallacycle, indicating a thermodynamically favorable reaction pathway. Noncovalent interaction (NCI) and reduced density gradient (RDG) analyses of the Cu, Ag, and Au systems highlighted distinct interaction patterns influencing the reactivity. Furthermore, electron localization function (ELF) and localized orbital locator (LOL) analyses revealed bonding characteristics in those complexes. This study offers valuable insights into the mechanistic differences among Au(I), Ag(I), and Cu(I) complexes, paving the way for future research on enhancing the catalytic activity of copper, silver and gold complexes through ligand modification. Graphical abstract Image, graphical abstract Keywords Density functional theory (DFT) CuAAC AgAAC AuAAC Triazoles NHC ligands Data availability Data will be made available on request. Introduction Copper-catalyzed azide‒alkyne cycloaddition (CuAAC) reactions constitute a cornerstone of \"click chemistry,\" a powerful synthetic strategy used to create 1,2,3-substituted triazoles from azides and terminal alkynes [1–13]. Unlike uncatalyzed Huisgen cycloaddition, which requires high temperatures and yields a mixture of 1,4- and 1,5-triazole isomers, CuAAC occurs under mild conditions, producing a 1,4-regioisomer with high selectivity [14–19]. This specificity and mild reaction environment make CuAAC a valuable tool in various fields, including organic synthesis, nanotechnology, chemical biology, medicinal chemistry, drug discovery, and materials science [20–26]. N-heterocyclic carbenes (NHCs) have become increasingly important in organometallic chemistry, particularly in CuAAC reactions, owing to their strong σ-donating ability and the stability they impart to metal complexes [27–31]. NHCs are known for their ability to form robust bonds with metals, which enhances the stability of the resulting complexes and can significantly influence the reactivity and selectivity of catalytic processes. In the study by González-Lainez et al. (2022) [32], new polynuclear catalysts based on N-heterocyclic carbenes (NHCs) were developed and applied to CuAAC reactions. These catalysts, such as [Cu2(μ-Br)2(tBuImCH2pyCH2NEt2)]2, offer enhanced stability to reactive copper species, which are typically prone to disproportionation and degradation. This study utilized density functional theory (DFT) to investigate the catalytic mechanism, revealing that the NHC ligands not only stabilize the active copper centers but also play a crucial role in the activation of the alkyne substrate. To explore the potential for the substitution of copper with other metals, such as silver and gold, the initial aim was to assess whether these metals could exhibit unique reactivity or catalytic properties [3,33–39]. However, our computational analysis indicated that compared with copper, silver and gold do not enhance the activity or alter the reaction mechanism. Silver, despite its similar ionic radius and electronic configuration, did not demonstrate improved catalytic efficiency. Similarly, although gold is known for its ability to activate alkynes through π-coordination, which can increase the electrophilicity of alkynes and facilitate nucleophilic attack by azides, our analysis did not reveal any new reaction pathways or increased efficiency compared with copper. Therefore, while these metals offer interesting theoretical possibilities, our results underscore the effectiveness of copper within the [Cu2(μ-Br)2(tBuImCH2pyCH2NEt2)]2 complex for CuAAC reactions, confirming its stability and catalytic properties in this reaction pathway. Using computational methods such as DFT, we can understand the electronic structure of active sites, transition states, and energy profiles of reaction pathways, helping to determine how different metals affect the kinetics and thermodynamics of the reaction, as well as the stability and reactivity of catalysts. This research can offer valuable guidelines for designing new catalysts that leverage the unique properties of different metals by modifying the properties of NHC ligands or the coordination environment of metal centers to increase the reactivity or selectivity for specific substrates. Studying AgAAC and AuAAC catalysts contributes to the development of catalytic systems for other reactions in organic synthesis and materials science, thereby enhancing catalytic performance. We performed NCI (Noncovalent Interactions), RDG (Reduced Density Gradient) [40–43], ELF (Electron Localization Function) [44], and LOL (Localized Orbital Locator) [45] analyses on silver and gold catalysts to gain deeper insights into their electronic structures and interactions. NCI and RDG analyses are tools used to visualize and quantify weak noncovalent interactions, such as van der Waals forces and hydrogen bonds, within catalytic systems, revealing differences in interaction strength and nature between the two metals. ELF and LOL, on the other hand, are used to provide detailed visualizations of electron localization and orbital interactions, offering insights into electron pairing and bonding characteristics. Together, these analyses provide a comprehensive understanding of the catalytic behavior and stability of the two systems. Computational details The MN12-L/Def2-SVP basis set was selected for all the elements [46,47], whereas the Def2-TZVP basis sets, which incorporate pseudopotentials for Ag and Au, were employed for the transition metals (M) [48]. This approach was chosen for its computational accuracy, ability to meet convergence criteria, success in obtaining RC structures in our previous studies [2,3,6,7,11,12], and alignment with experimental data. Calculations were performed via Gaussian 16 RevC.01 [49], with the \"integral=grid=ultrafine\" setting to ensure high precision. These calculations were supplemented with single-point calculations via the conductor-like polarizable continuum model (CPCM) at the same theoretical level [50], which uses acetonitrile to simulate real conditions and study the MAAC reaction mechanisms. Vibrational frequency analyses confirmed the presence of one imaginary frequency in the transition states. The electronic energies (E o ), G corr , and optimized geometries of the catalytic cycle components were obtained via the MN12-L method in the gas phase. NCI, RDG, ELF, and LOL analyses were conducted via Multiwfn 3.8 software [51], and the colored plots were visualized via visual molecular dynamics (VMD). Results and discussions Sharpless and colleagues first explored the CuAAC mechanism in 2002 [17], with further insights provided by theoretical and experimental studies. Fokin's DFT studies suggested that a second copper atom enhances reaction Scheme 1 [19], a finding that was later supported by experiments. The proposed mechanism, which was later refined, highlights the importance of azide coordination with the copper atom bound to the alkynyl group. This study presents novel Ag(I) and Au(I) coordination polymers with tridentate NHC-py-L ligands. This work examines their application in base-free AAC reactions and conducts DFT studies to better understand the reaction mechanism. The Gibbs free energy (ΔG298 ) landscape for the CuAAC reaction catalyzed by A and the selected transition state structures are detailed in Scheme 2 and Fig. 1 . Initially, the alkyne undergoes π-coordination to the M1−M2 center, forming intermediate B. This step results in energy increases of 2.3 (Cu), 8.1 (Ag), and 12.2 (Au) kcal/mol. This coordination decreases the M1−M2 distance from 2.629 (Cu), 2.929 (Ag), and 3.127 (Au) Å to 2.561 (Cu), 2.791 (Ag), and 2.763 (Au) Å. This initial interaction highlights the relatively more significant stabilizing effect in the copper complex. The more significant energy increase in the gold complex indicates that, compared with copper and silver, gold is less efficient at stabilizing alkyne coordination. The NHC moiety subsequently facilitates the deprotonation of the alkyne via TSB-C , producing zwitterionic intermediate C. This step results in effective energy barriers of 25.2 (Cu), 27.6 (Ag), and 33.2 (Au) kcal/mol under reaction conditions in neat phenylacetylene, and the M1−M2 distances of TSB-C are 2.496 (Cu), 2.835 (Ag), and 3.047 (Au) Å (Fig. 1). Intermediate C, which corresponds to a σ,π-bis(metal)acetylide complex, is more stable than intermediate A by -9.7 (Cu), -7.8 (Ag), and -5.8 (Au) kcal/mol. This stabilization is consistent with experimental observations [32], such as the formation of [(CuBr)2(CCPh)(tBuHImCH2pyCH2NEt2)] upon the reaction of A with phenylacetylene. The lower energy barriers and greater stability of the copper complex suggest that copper is more effective at promoting this step than silver and gold are. In the following step, the azide coordinates to the metal center associated with the alkynyl moiety, forming intermediate D. The ΔG298 values for this intermediate are -5.9 (Cu), -3.4 (Ag), and -0.9 (Au) kcal/mol. This coordination causes the mode of the alkynyl ligand to change to μ2-η1, reducing the M1−M2 distance from 2.994 (Cu), 3.035 (Ag), and 3.478 (Au) Å in C to 2.479 (Cu), 2.943 (Ag), and 3.412 (Au) Å in D. A more significant reduction in the M1−M2 distance in the copper complex indicates stronger metal‒metal interactions, contributing to the overall stability of the intermediate. The cycloaddition step between the azide and alkyne, mediated by the metal active center, results in the formation of six-membered metallacycle E. This step occurs via TSD-E , dictating the regioselectivity of the process and the formation of the 1,4-disubstituted 1,2,3-triazole product. The activation energy ( E # ) barriers for this step are 8.8 (Cu), 20.6 (Ag), and 24.3 (Au) kcal/mol, indicating the superiority of copper in facilitating this transformation (Scheme 2). During this step, both metal atoms actively participate, as evidenced by the M1−C distances of 1.909 (Cu), 2.042 (Ag), and 1.998 (Au) Å and M2−C distances of 1.924 (Cu), 2.091 (Ag), and 2.040 (Au) Å, along with M1−M2 distances of 2.445 (Cu), 2.687 (Ag), and 2.770 (Au) Å (Fig. 2 ). The ΔG298 values for TSD-E are -0.9 (Cu), 12.7 (Ag), and 18.5 (Au) kcal/mol. These values are notably lower for copper, demonstrating its efficiency in the cycloaddition step. When the binuclear pathway for TS1Bi with different ligands was compared (Fig. 3 ), for copper, the ΔG298 values for L1, L2, L5, L6, L7, L8 and L9 [2,6,11,12] were 8.5 kcal/mol, 2.3 kcal/mol (L2), 7.6 kcal/mol (L5), 9.9 kcal/mol (L6), 8.8 kcal/mol (L7), 9.3 kcal/mol (L8), and 16.8 kcal/mol (L9), respectively. The TSD-E energy for copper (-0.9 kcal/mol) is lower than that of these TS1Bi barriers, highlighting the efficiency of the TSD-E transition state in the copper-mediated reaction. For silver, the ΔG298 values for L1, L2, L3, L4, L9, L10, and L11 [3,11,12] were 18.8 (L1), 11.9 (L2), 9.8 (L3), 14.6 (L4), 22.8 (L9), 28.4 (L10), and 18.7 (L11) kcal/mol, respectively. These values are greater than the TSD-E energy (12.7 kcal/mol), indicating that the transition state for TS1Bi is more challenging for silver complexes, particularly those with L10. For gold, the ΔG298 for L1 [11] in the binuclear pathway is 20.7 kcal/mol, which is higher than the TSD-E energy of 18.5 kcal/mol. This suggests that while gold is less efficient overall, the energy barrier for the TS1Bi binuclear pathway is somewhat closer to that of TSD-E , reflecting a comparably higher energy landscape. The resulting metallacycle E has ΔG298 values of -19.6 (Cu), -1.9 (Ag), and -4.4 (Au) kcal/mol. The lower energy barrier and greater stability of the copper complex in TSD-E and TS1Bi indicate that copper is more efficient in this step than silver and gold are. The final contraction of the six-membered metallacycle E, which forms the second C−N bond and yields the triazolyl species F, proceeds via TSE-F (Fig. 2 and Scheme 2). The energy barriers for this step are 1.9 (Cu), 5 (Ag), and 5.5 (Au) kcal/mol. This step is highly exergonic, with F being 32.7 (Cu), 55.2 (Ag), and 46.4 (Au) kcal/mol more stable than E is, corresponding to relative ΔG298 values of -52.3 (Cu), -57.1 (Ag), and -50.9 (Au) kcal/mol, respectively. The M1−M2 distances in F, indicative of strong metallophilic interactions, are 2.452 (Cu), 2.732 (Ag), and 2.708 Å (Au). The triazolyl moiety bridges both metal atoms with M1−C distances of 1.914 Å (Cu), 2.081 Å (Ag), and 2.107 (Au) Å and M2−C distances of 2.137 (Cu), 2.302 (Ag), and 2.040 (Au) Å (Fig. 4 ). The significant stabilization and shorter M1−M2 distances in the copper complex again suggest that copper is more effective in stabilizing the final product. The comparative analysis of the ΔG298 profiles and bond lengths across the copper-, silver-, and gold-catalyzed reactions indicates that copper is the most efficient catalyst for the CuAAC reaction. Copper complexes consistently exhibit lower energy barriers and greater stability throughout the reaction steps. The shorter M1−M2 distances in the copper complexes also highlight stronger metal‒metal interactions, which contribute to the overall stability and efficiency of the catalytic process. This insight underscores the potential of copper in CuAAC applications and provides valuable guidelines for designing effective silver and gold catalysts for similar reactions. The unique electronic properties and coordination environments of different metals can be further exploited to enhance their catalytic performance in various organic synthesis and material science applications. NCI and RDG analysis Based on the NCI (noncovalent interaction) and RDG (reduced density gradient) plots for catalysts A with (Ag) and (Au), we can observe distinct noncovalent interaction patterns and interaction intensities associated with each metal center (Fig. 5 ). The NCI plots illustrate the noncovalent interaction regions in the molecular structure, with the green regions indicating weak van der Waals interactions, the blue regions representing attractive interactions, and the red regions showing repulsive interactions. In the copper complex, strong attractive interactions between the copper and surrounding ligands are visible, suggesting relatively stable bonding facilitated by balanced attractive and repulsive forces. In contrast, the interaction patterns of the gold and silver complexes differ. The silver complex has a reduced intensity in attractive interactions, as indicated by the blue–green regions in the NCI plot. This change may imply a weaker or more diffuse interaction with ligands, possibly leading to lower stability or catalytic efficiency than those of copper. The gold complex displays unique interaction features with slightly higher repulsive forces, as shown by the distinct red regions, possibly resulting from the larger atomic radius and different electronic properties of gold. These factors could contribute to a less efficient catalytic process, as observed in the RDG analysis, which further confirms the qualitative differences in the electronic environments and noncovalent interactions around each metal center. The RDG scatter plots further support these observations by illustrating the variation in the reduced density gradients for each catalyst. The copper complex shows a balanced profile with significant interaction density, whereas the silver and gold complexes show lower overall densities, indicating less effective stabilization through noncovalent interactions. This difference may contribute to the observed catalytic behavior, where copper demonstrates superior activity due to the optimized balance of interaction forces, whereas silver and gold show relatively lower activities and stability due to their altered noncovalent interaction profiles. ELF and LOL analysis The electron localization function (ELF) and localized orbital locator (LOL) plots are valuable for assessing the electronic characteristics and bonding interactions within complexes of copper (Cu), silver (Ag), and gold (Au) with bromine atoms and the surrounding ligands (Fig. 6 ). These visualizations help reveal how electron localization and bonding strength vary with each metal, which can significantly impact their catalytic properties. In the ELF plots, shown in light blue, areas with high electron localization highlight regions where electron pairs are strongly concentrated, indicating covalent-like interactions. The copper complex exhibited dense ELF regions around both the copper and bromine atoms, suggesting that the electron density was well distributed across the bonds. This high degree of electron localization around copper indicates stronger, more stable covalent interactions than the other metals do. Silver, on the other hand, shows slightly less electron density around its metal center, indicating somewhat weaker interactions with bromine, although it still has some covalent character. Gold displays the least electron localization in the ELF plots, suggesting weaker bonding interactions with bromine and potentially more polarized or ionic character in its bonds. This trend suggests that copper complexes may be more robust and less prone to degradation under catalytic conditions because of these stronger interactions. The LOL plots, illustrated in light red, offer additional insights into the spatial localization of orbitals and orbital stability. Copper again shows higher orbital localization, indicating that the orbitals around copper are well confined and stable, which could support greater reactivity and selectivity in catalytic processes. The LOL regions around silver are slightly more diffuse, which is consistent with weaker orbital interactions than those of copper, while still forming relatively stable bonds. Gold, however, shows much more dispersed LOL regions, reflecting a lower degree of orbital localization, which could imply a greater likelihood of bond rearrangements or weaker retention of its surrounding ligands. However, silver and gold may have niche applications where their specific electronic properties are advantageous, albeit potentially less stable than those of copper. Conclusion This study provides a comprehensive DFT analysis of the cycloaddition reactions mediated by Au(I) and Ag(I) complexes, emphasizing the differences in their catalytic efficiencies compared with that of Cu(I). The results demonstrate that copper has a significantly lower energy barrier and greater thermodynamic stability in forming the key metallacycle, reaffirming its position as the most effective catalyst among the three. The higher energy barriers associated with silver and gold indicate that although they are viable catalysts, their practical utility is limited relative to that of copper. Additionally, noncovalent interaction (NCI) and reduced density gradient (RDG) analyses for the Ag and Au systems reveal specific interaction patterns that influence the stability and reactivity of these complexes, whereas electron localization function (ELF) and localized orbital locator (LOL) analyses illustrate differences in electron distribution that further impact bonding characteristics. These insights contribute to a deeper understanding of the mechanistic pathways of metal-catalyzed cycloadditions and underscore the superior performance of copper in synthetic applications. Future studies may focus on modifying ligands to improve the catalytic activity of copper, silver and gold complexes, potentially broadening their use in organic synthesis. CRediT authorship contribution statement Ali A Khairbek: Writing – original draft, Visualization, Validation, Methodology, Investigation, Formal analysis, Data curation, Conceptualization. Mohammad Abd Al-Hakim Badawi: Writing – original draft, Validation, Formal analysis, Data curation. Abdullah Yahya Abdullah Alzahrani: Validation, Supervision, Formal analysis. Rajimon KJ: Visualization, Validation, Formal analysis, Data curation. Renjith Thomas: Writing – original draft, Supervision, Software, Resources, Methodology, Investigation. Declaration of competing interest The authors declare that they have no known competing financial interests or personal relationships that could have appeared to influence the work reported in this paper. Acknowledgement RT thanks Royal Society of Chemistry, London for support through RSC Researcher Collaborations Grant (C23-1708759250). SEAGrid (http:www.seagrid.org) is acknowledged for computational resources and services for the selected results used in this publication. Supplementary materials Supplementary material associated with this article can be found, in the online version, at doi:10.1016/j.mcat.2024.114708. Appendix Supplementary materials Image, application 1 Image, application 2 References [1] C. Seo Y.J. Cheong W. Yoon J. Kim J. Shin H. Yun S.J. Kim H.Y. Jang Mononuclear copper complexes with tridentate tris(N-heterocyclic carbene): synthesis and catalysis of alkyne-azide cycloaddition Organometallics 40 2021 16 22 10.1021/ACS.ORGANOMET.0C00457/SUPPL_FILE/OM0C00457_SI_001.PDF C. Seo, Y.J. Cheong, W. Yoon, J. Kim, J. Shin, H. Yun, S.J. Kim, H.Y. Jang, Mononuclear copper complexes with tridentate tris(N-heterocyclic carbene): synthesis and catalysis of alkyne-azide cycloaddition, Organometallics. 40 (2021) 16–22. https://doi.org/10.1021/ACS.ORGANOMET.0C00457/SUPPL_FILE/OM0C00457_SI_001.PDF. [2] M.A.A.H. Badawi A.A. Khairbek R. Thomas Computational studies of the CuAAC reaction mechanism with diimine and phosphorus ligands for the synthesis of 1,4-disubstituted 1,2,3-triazoles N. J. Chem. 47 2023 3683 3691 10.1039/D2NJ06173B M.A.A.H. Badawi, A.A. Khairbek, R. Thomas, Computational studies of the CuAAC reaction mechanism with diimine and phosphorus ligands for the synthesis of 1,4-disubstituted 1,2,3-triazoles, N. J. Chem. 47 (2023) 3683–3691. https://doi.org/10.1039/D2NJ06173B. [3] A.A. Khairbek M.A.A.H. Badawi Mechanism of Ag(I)-catalyzed azide-alkyne cycloaddition reaction: a quantum mechanical investigation React. Kinet., Mech. Catal. 136 2023 69 81 10.1007/S11144-022-02316-5/METRICS A.A. Khairbek, M.A.A.H. Badawi, Mechanism of Ag(I)-catalyzed azide-alkyne cycloaddition reaction: a quantum mechanical investigation, React. Kinet., Mech. Catal. 136 (2023) 69–81. https://doi.org/10.1007/S11144-022-02316-5/METRICS. [4] C. Gomes M. Costa S.M.M. Lopes B.A. Nogueira R. Fausto J.A. Paixão T.M.V.D. Pinho e Melo L.M.D.R.S. Martins M. Pineiro On the mechanochemical synthesis of C-scorpionates with an oxime moiety and their application in the copper-catalyzed azide–alkyne cycloaddition (CuAAC) reaction N. J. Chem. 48 2024 874 886 10.1039/D3NJ05017C C. Gomes, M. Costa, S.M.M. Lopes, B.A. Nogueira, R. Fausto, J.A. Paixão, T.M.V.D. Pinho e Melo, L.M.D.R.S. Martins, M. Pineiro, On the mechanochemical synthesis of C-scorpionates with an oxime moiety and their application in the copper-catalyzed azide–alkyne cycloaddition (CuAAC) reaction, N. J. Chem. 48 (2024) 874–886. https://doi.org/10.1039/D3NJ05017C. [5] A.I. Govdi N.A. Danilkina A.A. Shtyrov M.N. Ryazantsev M.D. Kim M.A. Kryukova I.A. Balova Cu-catalyzed cycloaddition of aryl azides to 1-iodobuta-1,3-diynes: an experimental and quantum chemical study of unusual regiochemistry N. J. Chem. 48 2024 4831 4845 10.1039/D3NJ03823H A.I. Govdi, N.A. Danilkina, A.A. Shtyrov, M.N. Ryazantsev, M.D. Kim, M.A. Kryukova, I.A. Balova, Cu-catalyzed cycloaddition of aryl azides to 1-iodobuta-1,3-diynes: an experimental and quantum chemical study of unusual regiochemistry, N. J. Chem. 48 (2024) 4831–4845. https://doi.org/10.1039/D3NJ03823H. [6] A. khairbek M. Badawi Mechanism of copper (I)-catalyzed cycloaddition of azides to terminal alkynes: a quantum mechanical investigation Tishreen Univ. J. -Basic Sci. Ser. 45 2023 57 69 https://journal.tishreen.edu.sy/index.php/bassnc/article/view/13475 A. khairbek, M. Badawi, Mechanism of copper (I)-catalyzed cycloaddition of azides to terminal alkynes: a quantum mechanical investigation, Tishreen Univ. J. -Basic Sci. Ser. 45 (2023) 57–69. https://journal.tishreen.edu.sy/index.php/bassnc/article/view/13475. [7] A.A. Khairbek A.Y. Alzahrani M.A.A.H. Badawi R. Thomas Computational studies on CuAAC reaction mechanism with [CuX(PPh3)]; X = I, Br, Cl for the synthesis of 4- and 5-halo-1,2,3-triazoles React. Kinet., Mech. Catal. 137 2024 777 790 10.1007/S11144-023-02548-Z/METRICS A.A. Khairbek, A.Y. Alzahrani, M.A.A.H. Badawi, R. Thomas, Computational studies on CuAAC reaction mechanism with [CuX(PPh3)]; X = I, Br, Cl for the synthesis of 4- and 5-halo-1,2,3-triazoles, React. Kinet., Mech. Catal. 137 (2024) 777–790. https://doi.org/10.1007/S11144-023-02548-Z/METRICS. [8] Q. Wei Y. Zhang C. Lv C. Hu Z. Su Theoretical study on cooperation catalysis of chiral guanidine/copper(I) in asymmetric azide-alkyne cycloaddition/[2 + 2] cascade reaction J. Organ. Chem. 88 2023 9973 9986 10.1021/ACS.JOC.3C00758/SUPPL_FILE/JO3C00758_SI_001.PDF Q. Wei, Y. Zhang, C. Lv, C. Hu, Z. Su, Theoretical study on cooperation catalysis of chiral guanidine/copper(I) in asymmetric azide-alkyne cycloaddition/[2 + 2] cascade reaction, J. Organ. Chem. 88 (2023) 9973–9986. https://doi.org/10.1021/ACS.JOC.3C00758/SUPPL_FILE/JO3C00758_SI_001.PDF. [9] G. Singh A. Majeed R. Singh N. George G. Singh N. Sophia H. Singh G. Kaur J. Singh CuAAC ensembled 1,2,3-triazole linked nanogels for targeted drug delivery: a review RSC Adv. 13 2023 2912 2936 10.1039/D2RA05592A G. Singh, A. Majeed, R. Singh, N. George, G. Singh, N. Sophia, H. Singh, G. Kaur, J. Singh, CuAAC ensembled 1,2,3-triazole linked nanogels for targeted drug delivery: a review, RSC Adv. 13 (2023) 2912–2936. https://doi.org/10.1039/D2RA05592A. [10] R.S. Gomes G.A.M. Jardim R.L. de Carvalho M.H. Araujo E.N. da Silva Júnior Beyond copper-catalyzed azide-alkyne 1,3-dipolar cycloaddition: synthesis and mechanism insights Tetrahedron 75 2019 3697 3712 10.1016/J.TET.2019.05.046 R.S. Gomes, G.A.M. Jardim, R.L. de Carvalho, M.H. Araujo, E.N. da Silva Júnior, Beyond copper-catalyzed azide-alkyne 1,3-dipolar cycloaddition: synthesis and mechanism insights, Tetrahedron. 75 (2019) 3697–3712. https://doi.org/10.1016/J.TET.2019.05.046. [11] A.A. Khairbek M.I. Al-Zaben R. Puchta M.A.A.H. Badawi R. Thomas Investigation of Huisgen's Noble metal catalyst click reaction mechanism for the synthesis of 1,4-disubstituted 1,2,3-triazoles Mol. Catal. 566 2024 114412 10.1016/J.MCAT.2024.114412 A.A. Khairbek, M.I. Al-Zaben, R. Puchta, M.A.A.H. Badawi, R. Thomas, Investigation of Huisgen's Noble metal catalyst click reaction mechanism for the synthesis of 1,4-disubstituted 1,2,3-triazoles, Mol. Catal. 566 (2024) 114412. https://doi.org/10.1016/J.MCAT.2024.114412. [12] A.A. Khairbek M.I. Al-Zaben F. Abbas M.A.A.-H. Badawi R. Thomas Exploring the potential of metal-catalysis with N, N-type ligands in [3+2] cycloaddition reactions of azides and alkynes using theoretical tools React. Kinet., Mech. Catal. 2024 2024 1 13 10.1007/S11144-024-02696-W A.A. Khairbek, M.I. Al-Zaben, F. Abbas, M.A.A.-H. Badawi, R. Thomas, Exploring the potential of metal-catalysis with N, N-type ligands in [3+2] cycloaddition reactions of azides and alkynes using theoretical tools, React. Kinet., Mech. Catal. 2024 (2024) 1–13. https://doi.org/10.1007/S11144-024-02696-W. [13] A.A. Khairbek M.A.A.H. Badawi A.Y. Alzahrani R. Thomas Assessing the catalytic potential of novel halogen substituted carbene NHC (F, Cl, Br, I) catalysts in [3 + 2] cycloaddition reactions: a computational investigation Dalton Trans. 53 2024 16635 16646 10.1039/D4DT02225D A.A. Khairbek, M.A.A.H. Badawi, A.Y. Alzahrani, R. Thomas, Assessing the catalytic potential of novel halogen substituted carbene NHC (F, Cl, Br, I) catalysts in [3 + 2] cycloaddition reactions: a computational investigation, Dalton Trans. 53 (2024) 16635–16646. https://doi.org/10.1039/D4DT02225D. [14] Proceedings of the Chemical Society. October 1961, Proceedings of the chemical society (1961) 357–396. https://doi.org/10.1039/PS9610000357. [15] R. Huisgen Mechanism of 1,3-dipolar cycloadditions. Reply J. Org. Chem. 33 1968 2291 2297 10.1021/jo01270a024 R. Huisgen, Mechanism of 1,3-dipolar cycloadditions. Reply, J. Org. Chem. 33 (1968) 2291–2297. https://doi.org/10.1021/jo01270a024. [16] N. Kendall H.-U. Houk Reissig, Rolf Huisgen's legacy Chem. 5 2019 2499 2505 10.1016/j.chempr.2019.09.009 Kendall N. Houk, H.-U. Reissig, Rolf Huisgen's legacy, Chem. 5 (2019) 2499–2505. https://doi.org/10.1016/j.chempr.2019.09.009. [17] M. Danese M. Bon G. Piccini D. Passerone The reaction mechanism of the azide–alkyne Huisgen cycloaddition Phys. Chem. Chem. Phys. 21 2019 19281 19287 10.1039/C9CP02386K M. Danese, M. Bon, G. Piccini, D. Passerone, The reaction mechanism of the azide–alkyne Huisgen cycloaddition, Phys. Chem. Chem. Phys. 21 (2019) 19281–19287. https://doi.org/10.1039/C9CP02386K. [18] A Stepwise Huisgen cycloaddition process: copper(I)-catalyzed regioselective “ligation” of azides and terminal alkynes - Rostovtsev - 2002 - Angewandte Chemie - Wiley Online Library, (n.d.). https://onlinelibrary.wiley.com/doi/abs/10.1002/1521-3757(20020715)114:14%3C2708::AID-ANGE2708%3E3.0.CO;2-0 (accessed July 20, 2024). [19] B.T. Worrell J.A. Malik V.V. Fokin Direct evidence of a dinuclear copper intermediate in Cu(I)-catalyzed azide-alkyne cycloadditions Science 340 2013 457 460 10.1126/SCIENCE.1229506/SUPPL_FILE/WORRELL.SM.PDF B.T. Worrell, J.A. Malik, V. V. Fokin, Direct evidence of a dinuclear copper intermediate in Cu(I)-catalyzed azide-alkyne cycloadditions, Science 340 (2013) 457–460. https://doi.org/10.1126/SCIENCE.1229506/SUPPL_FILE/WORRELL.SM.PDF. [20] L. Li Z. Zhang Development and applications of the Copper-Catalyzed Azide-Alkyne Cycloaddition (CuAAC) as a bioorthogonal reaction Molecules 21 2016 1393 10.3390/MOLECULES21101393 Vol. 21, Page 1393 L. Li, Z. Zhang, Development and applications of the Copper-Catalyzed Azide-Alkyne Cycloaddition (CuAAC) as a bioorthogonal reaction, Molecules, Vol. 21, Page 1393 21 (2016) 1393. https://doi.org/10.3390/MOLECULES21101393. [21] M.K. Jaiswal A. Gupta F.J. Ansari V.K. Pandey V.K. Tiwari Recent progress on synthesis of functionalized 1,5-disubstituted triazoles Curr. Org. Synth. 21 2024 513 558 10.2174/1570179420666230418123350 M.K. Jaiswal, A. Gupta, F.J. Ansari, V.K. Pandey, V.K. Tiwari, Recent progress on synthesis of functionalized 1,5-disubstituted triazoles, Curr. Org. Synth. 21 (2024) 513–558. https://doi.org/10.2174/1570179420666230418123350. [22] V. Aragão-Leoneti V.L. Campo A.S. Gomes R.A. Field I. Carvalho Application of copper(I)-catalysed azide/alkyne cycloaddition (CuAAC) ‘click chemistry’ in carbohydrate drug and neoglycopolymer synthesis Tetrahedron 66 2010 9475 9492 10.1016/J.TET.2010.10.001 V. Aragão-Leoneti, V.L. Campo, A.S. Gomes, R.A. Field, I. Carvalho, Application of copper(I)-catalysed azide/alkyne cycloaddition (CuAAC) ‘click chemistry’ in carbohydrate drug and neoglycopolymer synthesis, Tetrahedron. 66 (2010) 9475–9492. https://doi.org/10.1016/J.TET.2010.10.001. [23] Z.E. Blastik S. Voltrová V. Matoušek B. Jurásek D.W. Manley B. Klepetářová P. Beier Azidoperfluoroalkanes: synthesis and application in copper(I)-catalyzed azide–alkyne cycloaddition Angew. Chem. Int. Ed. 56 2017 346 349 10.1002/ANIE.201609715 Z.E. Blastik, S. Voltrová, V. Matoušek, B. Jurásek, D.W. Manley, B. Klepetářová, P. Beier, Azidoperfluoroalkanes: synthesis and application in copper(I)-catalyzed azide–alkyne cycloaddition, Angew. Chem. Int. Ed. 56 (2017) 346–349. https://doi.org/10.1002/ANIE.201609715. [24] N. Touj A. Chakchouk-Mtibaa L. Mansour A.H. Harrath J.H. Al-Tamimi I. Özdemir L. Mellouli S. Yaşar N. Hamdi Copper-catalyzed azide–alkyne cycloaddition (CuAAC) under mild condition in water: synthesis, catalytic application and biological activities J. Organomet. Chem. 853 2017 49 63 10.1016/J.JORGANCHEM.2017.09.024 N. Touj, A. Chakchouk-Mtibaa, L. Mansour, A.H. Harrath, J.H. Al-Tamimi, I. Özdemir, L. Mellouli, S. Yaşar, N. Hamdi, Copper-catalyzed azide–alkyne cycloaddition (CuAAC) under mild condition in water: synthesis, catalytic application and biological activities, J. Organomet. Chem. 853 (2017) 49–63. https://doi.org/10.1016/J.JORGANCHEM.2017.09.024. [25] N. Jahan A. Pal I. Ansary Synthesis of bioactive 1,2,3-triazole-fused macrocycles via azide-alkyne cycloaddition SynOpen. 8 2023 1 38 10.1055/A-2212-0996/ID/JR000-28/BIB N. Jahan, A. Pal, I. Ansary, Synthesis of bioactive 1,2,3-triazole-fused macrocycles via azide-alkyne cycloaddition, SynOpen. 8 (2023) 1–38. https://doi.org/10.1055/A-2212-0996/ID/JR000-28/BIB. [26] H.M. Pineda-Castañeda Z.J. Rivera-Monroy M. Maldonado Copper(I)-Catalyzed Alkyne-Azide Cycloaddition (CuAAC) “click” reaction: a powerful tool for functionalizing polyhydroxylated platforms ACS Omega 8 2022 3650 3666 10.1021/ACSOMEGA.2C06269/ASSET/IMAGES/MEDIUM/AO2C06269_0024.GIF H.M. Pineda-Castañeda, Z.J. Rivera-Monroy, M. Maldonado, Copper(I)-Catalyzed Alkyne-Azide Cycloaddition (CuAAC) “click” reaction: a powerful tool for functionalizing polyhydroxylated platforms, ACS Omega 8 (2022) 3650–3666. https://doi.org/10.1021/ACSOMEGA.2C06269/ASSET/IMAGES/MEDIUM/AO2C06269_0024.GIF. [27] S. Peerappa Yadav D. Sahil R. Singh Chauhan R.J. Butcher A. Tyagi G. Karmakar C. Dash N-heterocyclic thiols based copper complexes: syntheses, structure and catalytic studies for azide-alkyne cycloaddition reaction ChemistrySelect 9 2024 e202303058 10.1002/SLCT.202303058 S. Peerappa Yadav, D. Sahil, R. Singh Chauhan, R.J. Butcher, A. Tyagi, G. Karmakar, C. Dash, N-heterocyclic thiols based copper complexes: syntheses, structure and catalytic studies for azide-alkyne cycloaddition reaction, ChemistrySelect 9 (2024) e202303058. https://doi.org/10.1002/SLCT.202303058. [28] H. Shen G. Tian Z. Xu L. Wang Q. Wu Y. Zhang B.K. Teo N. Zheng N-heterocyclic carbene coordinated metal nanoparticles and nanoclusters Coord. Chem. Rev. 458 2022 214425 10.1016/J.CCR.2022.214425 H. Shen, G. Tian, Z. Xu, L. Wang, Q. Wu, Y. Zhang, B.K. Teo, N. Zheng, N-heterocyclic carbene coordinated metal nanoparticles and nanoclusters, Coord. Chem. Rev. 458 (2022) 214425. https://doi.org/10.1016/J.CCR.2022.214425. [29] M. Lamberti G.C. Fortman A. Poater J. Broggi A.M.Z. Slawin L. Cavallo S.P. Nolan Coordinatively unsaturated ruthenium complexes as efficient alkyneazide cycloaddition catalysts Organometallics 31 2012 756 767 10.1021/OM2012425/SUPPL_FILE/OM2012425_SI_001.PDF M. Lamberti, G.C. Fortman, A. Poater, J. Broggi, A.M.Z. Slawin, L. Cavallo, S.P. Nolan, Coordinatively unsaturated ruthenium complexes as efficient alkyneazide cycloaddition catalysts, Organometallics 31 (2012) 756–767. https://doi.org/10.1021/OM2012425/SUPPL_FILE/OM2012425_SI_001.PDF. [30] H. Huang X. Zou S. Cao Z. Peng Y. Peng X. Wang N-heterocyclic carbene-catalyzed cyclization of aldehydes with α-diazo iodonium triflate: facile access to 2,5-disubstituted 1,3,4-oxadiazoles Org. Lett. 23 2021 4185 4190 10.1021/ACS.ORGLETT.1C01128/SUPPL_FILE/OL1C01128_SI_001.PDF H. Huang, X. Zou, S. Cao, Z. Peng, Y. Peng, X. Wang, N-heterocyclic carbene-catalyzed cyclization of aldehydes with α-diazo iodonium triflate: facile access to 2,5-disubstituted 1,3,4-oxadiazoles, Org. Lett. 23 (2021) 4185–4190. https://doi.org/10.1021/ACS.ORGLETT.1C01128/SUPPL_FILE/OL1C01128_SI_001.PDF. [31] S.C. Sau P.K. Hota S.K. Mandal M. Soleilhavoup G. Bertrand Stable abnormal N-heterocyclic carbenes and their applications Chem. Soc. Rev. 49 2020 1233 1252 10.1039/C9CS00866G S.C. Sau, P.K. Hota, S.K. Mandal, M. Soleilhavoup, G. Bertrand, Stable abnormal N-heterocyclic carbenes and their applications, Chem. Soc. Rev. 49 (2020) 1233–1252. https://doi.org/10.1039/C9CS00866G. [32] M. González-Lainez M. Gallegos J. Munarriz R. Azpiroz V. Passarelli M.V. Jiménez J.J. Pérez-Torrente Copper-Catalyzed Azide-Alkyne Cycloaddition (CuAAC) by functionalized NHC-based polynuclear catalysts: scope and mechanistic insights Organometallics 41 2022 2154 2169 10.1021/ACS.ORGANOMET.2C00246/SUPPL_FILE/OM2C00246_SI_002.XYZ M. González-Lainez, M. Gallegos, J. Munarriz, R. Azpiroz, V. Passarelli, M.V. Jiménez, J.J. Pérez-Torrente, Copper-Catalyzed Azide-Alkyne Cycloaddition (CuAAC) by functionalized NHC-based polynuclear catalysts: scope and mechanistic insights, Organometallics. 41 (2022) 2154–2169. https://doi.org/10.1021/ACS.ORGANOMET.2C00246/SUPPL_FILE/OM2C00246_SI_002.XYZ. [33] A.R. Powers I. Ghiviriga K.A. Abboud A.S. Veige Au-iClick mirrors the mechanism of copper catalyzed azide–alkyne cycloaddition (CuAAC) Dalton Trans. 44 2015 14747 14752 10.1039/C5DT02405F A.R. Powers, I. Ghiviriga, K.A. Abboud, A.S. Veige, Au-iClick mirrors the mechanism of copper catalyzed azide–alkyne cycloaddition (CuAAC), Dalton Trans. 44 (2015) 14747–14752. https://doi.org/10.1039/C5DT02405F. [34] H.B. El Ayouchia L. Bahsis I. Fichtali L.R. Domingo M. Ríos-Gutiérrez M. Julve S.E. Stiriba Deciphering the mechanism of silver catalysis of “click” chemistry in water by combining experimental and MEDT studies Catalysts 10 2020 956 10.3390/CATAL10090956 2020, Vol. 10, Page 956 H.B. El Ayouchia, L. Bahsis, I. Fichtali, L.R. Domingo, M. Ríos-Gutiérrez, M. Julve, S.E. Stiriba, Deciphering the mechanism of silver catalysis of “click” chemistry in water by combining experimental and MEDT studies, Catalysts. 2020, Vol. 10, Page 956 10 (2020) 956. https://doi.org/10.3390/CATAL10090956. [35] A. El Mahmoudi H. El Masaoudi H. Tachallait A. Talha S. Arshad R. Benhida B. Jaber M. Benaissa K. Bougrin Selective silver (I)-catalyzed four-component gram-scale synthesis of novel 1,4-disubstituted 1,2,3-triazole-sulfonamides under heterogeneous catalysis and microwave irradiation in water Results Chem. 4 2022 100552 10.1016/J.RECHEM.2022.100552 A. El Mahmoudi, H. El Masaoudi, H. Tachallait, A. Talha, S. Arshad, R. Benhida, B. Jaber, M. Benaissa, K. Bougrin, Selective silver (I)-catalyzed four-component gram-scale synthesis of novel 1,4-disubstituted 1,2,3-triazole-sulfonamides under heterogeneous catalysis and microwave irradiation in water, Results Chem. 4 (2022) 100552. https://doi.org/10.1016/J.RECHEM.2022.100552. [36] S. Ben Moussa Activity of bimetallic gold–copper catalysts in the photodegradation of malachite green and the photosynthesis of 1,2,3-triazole derivatives React. Kinet., Mech. Catal. 136 2023 2379 2396 10.1007/S11144-023-02451-7/METRICS S. Ben Moussa, Activity of bimetallic gold–copper catalysts in the photodegradation of malachite green and the photosynthesis of 1,2,3-triazole derivatives, React. Kinet., Mech. Catal. 136 (2023) 2379–2396. https://doi.org/10.1007/S11144-023-02451-7/METRICS. [37] V. Turukarabettu B. Kalluraya P. Kumar R.B. Chandrashekarappa S.V. Raghu Nano Au/TiO2 catalyzed click synthesis of novel 1,2,3-triazoles from S-propargyl-1,2,4-triazole: antibacterial activity, toxicity, and docking analysis Russ. J. Gen. Chem. 93 2023 2638 2644 10.1134/S1070363223100183/METRICS V. Turukarabettu, B. Kalluraya, P. Kumar, R.B. Chandrashekarappa, S.V. Raghu, Nano Au/TiO2 catalyzed click synthesis of novel 1,2,3-triazoles from S-propargyl-1,2,4-triazole: antibacterial activity, toxicity, and docking analysis, Russ. J. Gen. Chem. 93 (2023) 2638–2644. https://doi.org/10.1134/S1070363223100183/METRICS. [38] J. Sultana N.D. Khupse S. Chakrabarti P. Chattopadhyay D. Sarma Ag2CO3-catalyzed cycloaddition of organic azides onto terminal alkynes: a green and sustainable protocol accelerated by aqueous micelles of CPyCl Tetrahedron Lett. 60 2019 1117 1121 10.1016/J.TETLET.2019.03.036 J. Sultana, N.D. Khupse, S. Chakrabarti, P. Chattopadhyay, D. Sarma, Ag2CO3-catalyzed cycloaddition of organic azides onto terminal alkynes: a green and sustainable protocol accelerated by aqueous micelles of CPyCl, Tetrahedron Lett. 60 (2019) 1117–1121. https://doi.org/10.1016/J.TETLET.2019.03.036. [39] H. Ben El Ayouchia L. Bahsis H. Anane L.R. Domingo S.E. Stiriba Understanding the mechanism and regioselectivity of the copper(I) catalyzed [3 + 2] cycloaddition reaction between azide and alkyne: a systematic DFT study RSC Adv. 8 2018 7670 7678 10.1039/C7RA10653J H. Ben El Ayouchia, L. Bahsis, H. Anane, L.R. Domingo, S.E. Stiriba, Understanding the mechanism and regioselectivity of the copper(I) catalyzed [3 + 2] cycloaddition reaction between azide and alkyne: a systematic DFT study, RSC Adv. 8 (2018) 7670–7678. https://doi.org/10.1039/C7RA10653J. [40] S. Sarala S.K. Geetha S. Muthu A. Irfan Computational investigation, comparative approaches, molecular structural, vibrational spectral, non-covalent interaction (NCI), and electron excitations analysis of benzodiazepine derivatives J. Mol. Model. 27 2021 1 34 10.1007/S00894-021-04877-Z/METRICS S. Sarala, S.K. Geetha, S. Muthu, A. Irfan, Computational investigation, comparative approaches, molecular structural, vibrational spectral, non-covalent interaction (NCI), and electron excitations analysis of benzodiazepine derivatives, J. Mol. Model. 27 (2021) 1–34. https://doi.org/10.1007/S00894-021-04877-Z/METRICS. [41] D. Morales-Pumarino J.E. Barquera-Lozada C.E. José Barquera-Lozada Electron density and its reduced density gradient in the study of π–π interactions Int. J. Quantum. Chem. 123 2023 e27051 10.1002/QUA.27051 D. Morales-Pumarino, J.E. Barquera-Lozada, C.E. José Barquera-Lozada, Electron density and its reduced density gradient in the study of π–π interactions, Int. J. Quantum. Chem. 123 (2023) e27051. https://doi.org/10.1002/QUA.27051. [42] J. Contreras-García W. Yang E.R. Johnson Analysis of hydrogen-bond interaction potentials from the electron density: integration of noncovalent interaction regions J. Phys. Chem. A 115 2011 12983 12990 10.1021/JP204278K/SUPPL_FILE/JP204278K_SI_001.PDF J. Contreras-García, W. Yang, E.R. Johnson, Analysis of hydrogen-bond interaction potentials from the electron density: integration of noncovalent interaction regions, J. Phys. Chem. A 115 (2011) 12983–12990. https://doi.org/10.1021/JP204278K/SUPPL_FILE/JP204278K_SI_001.PDF. [43] E.R. Johnson S. Keinan P. Mori-Sánchez J. Contreras-García A.J. Cohen W. Yang Revealing noncovalent interactions J. Am. Chem. Soc. 132 2010 6498 6506 10.1021/JA100936W/SUPPL_FILE/JA100936W_SI_002.PDF E.R. Johnson, S. Keinan, P. Mori-Sánchez, J. Contreras-García, A.J. Cohen, W. Yang, Revealing noncovalent interactions, J. Am. Chem. Soc. 132 (2010) 6498–6506. https://doi.org/10.1021/JA100936W/SUPPL_FILE/JA100936W_SI_002.PDF. [44] A. Savin R. Nesper S. Wengert T.F. Fässler ELF: the electron localization function Angew. Chem. Int. Ed. English 36 1997 1808 1832 10.1002/ANIE.199718081 A. Savin, R. Nesper, S. Wengert, T.F. Fässler, ELF: the electron localization function, Angew. Chem. Int. Ed. English 36 (1997) 1808–1832. https://doi.org/10.1002/ANIE.199718081. [45] S.N. Steinmann Y. Mo C. Corminboeuf How do electron localization functions describe π-electron delocalization? Phys. Chem. Chem. Phys. 13 2011 20584 20592 10.1039/C1CP21055F S.N. Steinmann, Y. Mo, C. Corminboeuf, How do electron localization functions describe π-electron delocalization?, Phys. Chem. Chem. Phys. 13 (2011) 20584–20592. https://doi.org/10.1039/C1CP21055F. [46] R. Gulde P. Pollak F. Weigend Error-balanced segmented contracted basis sets of double-ζ to quadruple-ζ valence quality for the lanthanides J. Chem. Theory Comput. 8 2012 4062 4068 10.1021/CT300302U/SUPPL_FILE/CT300302U_SI_001.PDF R. Gulde, P. Pollak, F. Weigend, Error-balanced segmented contracted basis sets of double-ζ to quadruple-ζ valence quality for the lanthanides, J. Chem. Theory Comput. 8 (2012) 4062–4068. https://doi.org/10.1021/CT300302U/SUPPL_FILE/CT300302U_SI_001.PDF. [47] R. Peverati D.G. Truhlar An improved and broadly accurate local approximation to the exchange–correlation density functional: the MN12-L functional for electronic structure calculations in chemistry and physics Phys. Chem. Chem. Phys. 14 2012 13171 13174 10.1039/C2CP42025B R. Peverati, D.G. Truhlar, An improved and broadly accurate local approximation to the exchange–correlation density functional: the MN12-L functional for electronic structure calculations in chemistry and physics, Phys. Chem. Chem. Phys. 14 (2012) 13171–13174. https://doi.org/10.1039/C2CP42025B. [48] F. Weigend R. Ahlrichs Balanced basis sets of split valence, triple zeta valence and quadruple zeta valence quality for H to Rn: Design and assessment of accuracy Phys. Chem. Chem. Phys. 7 2005 3297 3305 10.1039/B508541A F. Weigend, R. Ahlrichs, Balanced basis sets of split valence, triple zeta valence and quadruple zeta valence quality for H to Rn: Design and assessment of accuracy, Phys. Chem. Chem. Phys. 7 (2005) 3297–3305. https://doi.org/10.1039/B508541A. [49] M.J. Frisch G.W. Trucks H.B. Schlegel G.E. Scuseria M.A. Robb J.R. Cheeseman G. Scalmani V. Barone G.A. Petersson H. Nakatsuji X. Li M. Caricato A.V. Marenich J. Bloino B.G. Janesko R. Gomperts B. Mennucci H.P. Hratchian J.V. Ortiz A.F. Izmaylov J.L. Sonnenberg D. Williams-Young F. Ding F. Lipparini F. Egidi J. Goings B. Peng A. Petrone T. Henderson D. Ranasinghe V.G. Zakrzewski J. Gao N. Rega G. Zheng W. Liang M. Hada M. Ehara K. Toyota R. Fukuda J. Hasegawa M. Ishida T. Nakajima Y. Honda O. Kitao H. Nakai T. Vreven K. Throssell J.A. Montgomery Jr. J.E. Peralta F. Ogliaro M.J. Bearpark J.J. Heyd E.N. Brothers K.N. Kudin V.N. Staroverov T.A. Keith R. Kobayashi J. Normand K. Raghavachari A.P. Rendell J.C. Burant S.S. Iyengar J. Tomasi M. Cossi J.M. Millam M. Klene C. Adamo R. Cammi J.W. Ochterski R.L. Martin K. Morokuma O. Farkas J.B. Foresman D.J. Fox Gaussian 16, Revision C.01 2016 Gaussian, Inc. Wallingford CT Gaussian 16, Revision C.01, M. J. Frisch, G. W. Trucks, H. B. Schlegel, G. E. Scuseria, M. A. Robb, J. R. Cheeseman, G. Scalmani, V. Barone, G. A. Petersson, H. Nakatsuji, X. Li, M. Caricato, A. V. Marenich, J. Bloino, B. G. Janesko, R. Gomperts, B. Mennucci, H. P. Hratchian, J. V. Ortiz, A. F. Izmaylov, J. L. Sonnenberg, D. Williams-Young, F. Ding, F. Lipparini, F. Egidi, J. Goings, B. Peng, A. Petrone, T. Henderson, D. Ranasinghe, V. G. Zakrzewski, J. Gao, N. Rega, G. Zheng, W. Liang, M. Hada, M. Ehara, K. Toyota, R. Fukuda, J. Hasegawa, M. Ishida, T. Nakajima, Y. Honda, O. Kitao, H. Nakai, T. Vreven, K. Throssell, J. A. Montgomery, Jr., J. E. Peralta, F. Ogliaro, M. J. Bearpark, J. J. Heyd, E. N. Brothers, K. N. Kudin, V. N. Staroverov, T. A. Keith, R. Kobayashi, J. Normand, K. Raghavachari, A. P. Rendell, J. C. Burant, S. S. Iyengar, J. Tomasi, M. Cossi, J. M. Millam, M. Klene, C. Adamo, R. Cammi, J. W. Ochterski, R. L. Martin, K. Morokuma, O. Farkas, J. B. Foresman, and D. J. Fox, Gaussian, Inc., Wallingford CT, 2016. [50] M. Cossi N. Rega G. Scalmani V. Barone Energies, structures, and electronic properties of molecules in solution with the C-PCM solvation model J. Comput. Chem. 24 2003 669 681 10.1002/JCC.10189 M. Cossi, N. Rega, G. Scalmani, V. Barone, Energies, structures, and electronic properties of molecules in solution with the C-PCM solvation model, J. Comput. Chem. 24 (2003) 669–681. https://doi.org/10.1002/JCC.10189. [51] T. Lu F. Chen Multiwfn: a multifunctional wavefunction analyzer J. Comput. Chem. 33 2012 580 592 10.1002/JCC.22885 T. Lu, F. Chen, Multiwfn: a multifunctional wavefunction analyzer, J. Comput. Chem. 33 (2012) 580–592. https://doi.org/10.1002/JCC.22885.",
      "scopus-id": "85209689239",
      "coredata": {
        "eid": "1-s2.0-S2468823124008903",
        "dc:description": "This study evaluated the catalytic efficiency of Au(I), Ag(I), and Cu(I) complexes in the azide‒alkyne cycloaddition (AAC) reaction through density functional theory (DFT) calculations. Cu(I) complexes exhibit superior catalytic performance, with lower energy barriers (8.8 kcal/mol) and a favorable Gibbs free energy of -0.9 kcal/mol in the key cycloaddition step, significantly outperforming Ag and Au complexes. Structural analysis revealed that shorter M−C bond lengths in the Cu complex contributed to increased stability. Additionally, the copper complex has a more negative Gibbs free energy for the formed metallacycle, indicating a thermodynamically favorable reaction pathway. Noncovalent interaction (NCI) and reduced density gradient (RDG) analyses of the Cu, Ag, and Au systems highlighted distinct interaction patterns influencing the reactivity. Furthermore, electron localization function (ELF) and localized orbital locator (LOL) analyses revealed bonding characteristics in those complexes. This study offers valuable insights into the mechanistic differences among Au(I), Ag(I), and Cu(I) complexes, paving the way for future research on enhancing the catalytic activity of copper, silver and gold complexes through ligand modification.",
        "openArchiveArticle": "false",
        "prism:coverDate": "2025-01-31",
        "openaccessUserLicense": null,
        "prism:aggregationType": "Journal",
        "prism:url": "https://api.elsevier.com/content/article/pii/S2468823124008903",
        "dc:creator": [
          {
            "@_fa": "true",
            "$": "Khairbek, Ali A"
          },
          {
            "@_fa": "true",
            "$": "Badawi, Mohammad Abd Al-Hakim"
          },
          {
            "@_fa": "true",
            "$": "Alzahrani, Abdullah Yahya Abdullah"
          },
          {
            "@_fa": "true",
            "$": "KJ, Rajimon"
          },
          {
            "@_fa": "true",
            "$": "Thomas, Renjith"
          }
        ],
        "link": [
          {
            "@_fa": "true",
            "@rel": "self",
            "@href": "https://api.elsevier.com/content/article/pii/S2468823124008903"
          },
          {
            "@_fa": "true",
            "@rel": "scidir",
            "@href": "https://www.sciencedirect.com/science/article/pii/S2468823124008903"
          }
        ],
        "dc:format": "application/json",
        "openaccessType": null,
        "pii": "S2468-8231(24)00890-3",
        "prism:volume": "570",
        "articleNumber": "114708",
        "prism:publisher": "Elsevier B.V. All rights are reserved, including those for text and data mining, AI training, and similar technologies.",
        "dc:title": "Silver- and gold-catalyzed azide−alkyne cycloaddition by functionalized NHC-based polynuclear catalysts: Computational investigation and mechanistic insights",
        "prism:copyright": "© 2024 Elsevier B.V. All rights are reserved, including those for text and data mining, AI training, and similar technologies.",
        "openaccess": "0",
        "prism:issn": "24688231",
        "dcterms:subject": [
          {
            "@_fa": "true",
            "$": "Density functional theory (DFT)"
          },
          {
            "@_fa": "true",
            "$": "CuAAC"
          },
          {
            "@_fa": "true",
            "$": "AgAAC"
          },
          {
            "@_fa": "true",
            "$": "AuAAC"
          },
          {
            "@_fa": "true",
            "$": "Triazoles"
          },
          {
            "@_fa": "true",
            "$": "NHC ligands"
          }
        ],
        "openaccessArticle": "false",
        "prism:publicationName": "Molecular Catalysis",
        "openaccessSponsorType": null,
        "prism:pageRange": "114708",
        "pubType": "fla",
        "prism:coverDisplayDate": "January 2025",
        "prism:doi": "10.1016/j.mcat.2024.114708",
        "prism:startingPage": "114708",
        "dc:identifier": "doi:10.1016/j.mcat.2024.114708",
        "openaccessSponsorName": null
      },
      "objects": {
        "object": [
          {
            "@category": "standard",
            "@height": "383",
            "@width": "376",
            "@_fa": "true",
            "$": "https://api.elsevier.com/content/object/eid/1-s2.0-S2468823124008903-sc1.jpg?httpAccept=%2A%2F%2A",
            "@multimediatype": "JPEG image file",
            "@type": "IMAGE-DOWNSAMPLED",
            "@size": "37396",
            "@ref": "sc1",
            "@mimetype": "image/jpeg"
          },
          {
            "@category": "standard",
            "@height": "534",
            "@width": "791",
            "@_fa": "true",
            "$": "https://api.elsevier.com/content/object/eid/1-s2.0-S2468823124008903-sc2.jpg?httpAccept=%2A%2F%2A",
            "@multimediatype": "JPEG image file",
            "@type": "IMAGE-DOWNSAMPLED",
            "@size": "93777",
            "@ref": "sc2",
            "@mimetype": "image/jpeg"
          },
          {
            "@category": "standard",
            "@height": "410",
            "@width": "678",
            "@_fa": "true",
            "$": "https://api.elsevier.com/content/object/eid/1-s2.0-S2468823124008903-gr1.jpg?httpAccept=%2A%2F%2A",
            "@multimediatype": "JPEG image file",
            "@type": "IMAGE-DOWNSAMPLED",
            "@size": "68200",
            "@ref": "gr1",
            "@mimetype": "image/jpeg"
          },
          {
            "@category": "standard",
            "@height": "453",
            "@width": "791",
            "@_fa": "true",
            "$": "https://api.elsevier.com/content/object/eid/1-s2.0-S2468823124008903-gr2.jpg?httpAccept=%2A%2F%2A",
            "@multimediatype": "JPEG image file",
            "@type": "IMAGE-DOWNSAMPLED",
            "@size": "98107",
            "@ref": "gr2",
            "@mimetype": "image/jpeg"
          },
          {
            "@category": "standard",
            "@height": "200",
            "@width": "330",
            "@_fa": "true",
            "$": "https://api.elsevier.com/content/object/eid/1-s2.0-S2468823124008903-ga1.jpg?httpAccept=%2A%2F%2A",
            "@multimediatype": "JPEG image file",
            "@type": "IMAGE-DOWNSAMPLED",
            "@size": "21120",
            "@ref": "ga1",
            "@mimetype": "image/jpeg"
          },
          {
            "@category": "standard",
            "@height": "494",
            "@width": "791",
            "@_fa": "true",
            "$": "https://api.elsevier.com/content/object/eid/1-s2.0-S2468823124008903-gr3.jpg?httpAccept=%2A%2F%2A",
            "@multimediatype": "JPEG image file",
            "@type": "IMAGE-DOWNSAMPLED",
            "@size": "71974",
            "@ref": "gr3",
            "@mimetype": "image/jpeg"
          },
          {
            "@category": "standard",
            "@height": "482",
            "@width": "678",
            "@_fa": "true",
            "$": "https://api.elsevier.com/content/object/eid/1-s2.0-S2468823124008903-gr4.jpg?httpAccept=%2A%2F%2A",
            "@multimediatype": "JPEG image file",
            "@type": "IMAGE-DOWNSAMPLED",
            "@size": "59460",
            "@ref": "gr4",
            "@mimetype": "image/jpeg"
          },
          {
            "@category": "standard",
            "@height": "774",
            "@width": "791",
            "@_fa": "true",
            "$": "https://api.elsevier.com/content/object/eid/1-s2.0-S2468823124008903-gr5.jpg?httpAccept=%2A%2F%2A",
            "@multimediatype": "JPEG image file",
            "@type": "IMAGE-DOWNSAMPLED",
            "@size": "198664",
            "@ref": "gr5",
            "@mimetype": "image/jpeg"
          },
          {
            "@category": "standard",
            "@height": "864",
            "@width": "791",
            "@_fa": "true",
            "$": "https://api.elsevier.com/content/object/eid/1-s2.0-S2468823124008903-gr6.jpg?httpAccept=%2A%2F%2A",
            "@multimediatype": "JPEG image file",
            "@type": "IMAGE-DOWNSAMPLED",
            "@size": "277997",
            "@ref": "gr6",
            "@mimetype": "image/jpeg"
          },
          {
            "@category": "thumbnail",
            "@height": "164",
            "@width": "161",
            "@_fa": "true",
            "$": "https://api.elsevier.com/content/object/eid/1-s2.0-S2468823124008903-sc1.sml?httpAccept=%2A%2F%2A",
            "@multimediatype": "GIF image file",
            "@type": "IMAGE-THUMBNAIL",
            "@size": "7064",
            "@ref": "sc1",
            "@mimetype": "image/gif"
          },
          {
            "@category": "thumbnail",
            "@height": "148",
            "@width": "219",
            "@_fa": "true",
            "$": "https://api.elsevier.com/content/object/eid/1-s2.0-S2468823124008903-sc2.sml?httpAccept=%2A%2F%2A",
            "@multimediatype": "GIF image file",
            "@type": "IMAGE-THUMBNAIL",
            "@size": "8791",
            "@ref": "sc2",
            "@mimetype": "image/gif"
          },
          {
            "@category": "thumbnail",
            "@height": "133",
            "@width": "219",
            "@_fa": "true",
            "$": "https://api.elsevier.com/content/object/eid/1-s2.0-S2468823124008903-gr1.sml?httpAccept=%2A%2F%2A",
            "@multimediatype": "GIF image file",
            "@type": "IMAGE-THUMBNAIL",
            "@size": "13202",
            "@ref": "gr1",
            "@mimetype": "image/gif"
          },
          {
            "@category": "thumbnail",
            "@height": "125",
            "@width": "219",
            "@_fa": "true",
            "$": "https://api.elsevier.com/content/object/eid/1-s2.0-S2468823124008903-gr2.sml?httpAccept=%2A%2F%2A",
            "@multimediatype": "GIF image file",
            "@type": "IMAGE-THUMBNAIL",
            "@size": "14993",
            "@ref": "gr2",
            "@mimetype": "image/gif"
          },
          {
            "@category": "thumbnail",
            "@height": "133",
            "@width": "219",
            "@_fa": "true",
            "$": "https://api.elsevier.com/content/object/eid/1-s2.0-S2468823124008903-ga1.sml?httpAccept=%2A%2F%2A",
            "@multimediatype": "GIF image file",
            "@type": "IMAGE-THUMBNAIL",
            "@size": "8413",
            "@ref": "ga1",
            "@mimetype": "image/gif"
          },
          {
            "@category": "thumbnail",
            "@height": "137",
            "@width": "219",
            "@_fa": "true",
            "$": "https://api.elsevier.com/content/object/eid/1-s2.0-S2468823124008903-gr3.sml?httpAccept=%2A%2F%2A",
            "@multimediatype": "GIF image file",
            "@type": "IMAGE-THUMBNAIL",
            "@size": "8540",
            "@ref": "gr3",
            "@mimetype": "image/gif"
          },
          {
            "@category": "thumbnail",
            "@height": "156",
            "@width": "219",
            "@_fa": "true",
            "$": "https://api.elsevier.com/content/object/eid/1-s2.0-S2468823124008903-gr4.sml?httpAccept=%2A%2F%2A",
            "@multimediatype": "GIF image file",
            "@type": "IMAGE-THUMBNAIL",
            "@size": "12483",
            "@ref": "gr4",
            "@mimetype": "image/gif"
          },
          {
            "@category": "thumbnail",
            "@height": "163",
            "@width": "167",
            "@_fa": "true",
            "$": "https://api.elsevier.com/content/object/eid/1-s2.0-S2468823124008903-gr5.sml?httpAccept=%2A%2F%2A",
            "@multimediatype": "GIF image file",
            "@type": "IMAGE-THUMBNAIL",
            "@size": "15336",
            "@ref": "gr5",
            "@mimetype": "image/gif"
          },
          {
            "@category": "thumbnail",
            "@height": "164",
            "@width": "150",
            "@_fa": "true",
            "$": "https://api.elsevier.com/content/object/eid/1-s2.0-S2468823124008903-gr6.sml?httpAccept=%2A%2F%2A",
            "@multimediatype": "GIF image file",
            "@type": "IMAGE-THUMBNAIL",
            "@size": "19595",
            "@ref": "gr6",
            "@mimetype": "image/gif"
          },
          {
            "@category": "high",
            "@height": "1699",
            "@width": "1667",
            "@_fa": "true",
            "$": "https://api.elsevier.com/content/object/eid/1-s2.0-S2468823124008903-sc1_lrg.jpg?httpAccept=%2A%2F%2A",
            "@multimediatype": "JPEG image file",
            "@type": "IMAGE-HIGH-RES",
            "@size": "243419",
            "@ref": "sc1",
            "@mimetype": "image/jpeg"
          },
          {
            "@category": "high",
            "@height": "2364",
            "@width": "3500",
            "@_fa": "true",
            "$": "https://api.elsevier.com/content/object/eid/1-s2.0-S2468823124008903-sc2_lrg.jpg?httpAccept=%2A%2F%2A",
            "@multimediatype": "JPEG image file",
            "@type": "IMAGE-HIGH-RES",
            "@size": "690466",
            "@ref": "sc2",
            "@mimetype": "image/jpeg"
          },
          {
            "@category": "high",
            "@height": "1816",
            "@width": "3000",
            "@_fa": "true",
            "$": "https://api.elsevier.com/content/object/eid/1-s2.0-S2468823124008903-gr1_lrg.jpg?httpAccept=%2A%2F%2A",
            "@multimediatype": "JPEG image file",
            "@type": "IMAGE-HIGH-RES",
            "@size": "423077",
            "@ref": "gr1",
            "@mimetype": "image/jpeg"
          },
          {
            "@category": "high",
            "@height": "2003",
            "@width": "3500",
            "@_fa": "true",
            "$": "https://api.elsevier.com/content/object/eid/1-s2.0-S2468823124008903-gr2_lrg.jpg?httpAccept=%2A%2F%2A",
            "@multimediatype": "JPEG image file",
            "@type": "IMAGE-HIGH-RES",
            "@size": "612557",
            "@ref": "gr2",
            "@mimetype": "image/jpeg"
          },
          {
            "@category": "high",
            "@height": "886",
            "@width": "1463",
            "@_fa": "true",
            "$": "https://api.elsevier.com/content/object/eid/1-s2.0-S2468823124008903-ga1_lrg.jpg?httpAccept=%2A%2F%2A",
            "@multimediatype": "JPEG image file",
            "@type": "IMAGE-HIGH-RES",
            "@size": "122355",
            "@ref": "ga1",
            "@mimetype": "image/jpeg"
          },
          {
            "@category": "high",
            "@height": "2190",
            "@width": "3504",
            "@_fa": "true",
            "$": "https://api.elsevier.com/content/object/eid/1-s2.0-S2468823124008903-gr3_lrg.jpg?httpAccept=%2A%2F%2A",
            "@multimediatype": "JPEG image file",
            "@type": "IMAGE-HIGH-RES",
            "@size": "535389",
            "@ref": "gr3",
            "@mimetype": "image/jpeg"
          },
          {
            "@category": "high",
            "@height": "2131",
            "@width": "3000",
            "@_fa": "true",
            "$": "https://api.elsevier.com/content/object/eid/1-s2.0-S2468823124008903-gr4_lrg.jpg?httpAccept=%2A%2F%2A",
            "@multimediatype": "JPEG image file",
            "@type": "IMAGE-HIGH-RES",
            "@size": "380056",
            "@ref": "gr4",
            "@mimetype": "image/jpeg"
          },
          {
            "@category": "high",
            "@height": "3425",
            "@width": "3500",
            "@_fa": "true",
            "$": "https://api.elsevier.com/content/object/eid/1-s2.0-S2468823124008903-gr5_lrg.jpg?httpAccept=%2A%2F%2A",
            "@multimediatype": "JPEG image file",
            "@type": "IMAGE-HIGH-RES",
            "@size": "1393341",
            "@ref": "gr5",
            "@mimetype": "image/jpeg"
          },
          {
            "@category": "high",
            "@height": "3824",
            "@width": "3500",
            "@_fa": "true",
            "$": "https://api.elsevier.com/content/object/eid/1-s2.0-S2468823124008903-gr6_lrg.jpg?httpAccept=%2A%2F%2A",
            "@multimediatype": "JPEG image file",
            "@type": "IMAGE-HIGH-RES",
            "@size": "2044757",
            "@ref": "gr6",
            "@mimetype": "image/jpeg"
          },
          {
            "@category": "standard",
            "@_fa": "true",
            "$": "https://api.elsevier.com/content/object/eid/1-s2.0-S2468823124008903-mmc1.docx?httpAccept=%2A%2F%2A",
            "@multimediatype": "Microsoft Word file",
            "@type": "APPLICATION",
            "@size": "23991",
            "@ref": "mmc1",
            "@mimetype": "application/word"
          },
          {
            "@category": "standard",
            "@_fa": "true",
            "$": "https://api.elsevier.com/content/object/eid/1-s2.0-S2468823124008903-mmc2.zip?httpAccept=%2A%2F%2A",
            "@multimediatype": "ZIP file",
            "@type": "APPLICATION",
            "@size": "32966",
            "@ref": "mmc2",
            "@mimetype": "application/zip"
          }
        ]
      },
      "link": {
        "@rel": "abstract",
        "@href": "https://api.elsevier.com/content/abstract/scopus_id/85209689239"
      }
    }
  }
}