{
  "metadata": {
    "title": "Dehydration of 2,3-butanediol to produce 1,3-butadiene over Sc<ce:inf loc=post>2</ce:inf>O<ce:inf loc=post>3</ce:inf> catalyst prepared through hydrothermal aging",
    "authors": "; ; ",
    "journal": "Molecular Catalysis",
    "date": "2021-11-30",
    "doi": "10.1016/j.mcat.2021.111996",
    "abstract": "",
    "uri": "https://api.elsevier.com/content/article/pii/S2468823121006131",
    "pii": "S2468823121006131"
  },
  "fulltext": {
    "full-text-retrieval-response": {
      "scopus-eid": "2-s2.0-85118712936",
      "originalText": "serial JL 315758 291210 291744 291790 291809 31 Molecular Catalysis MOLECULARCATALYSIS 2021-11-10 2021-11-10 2021-11-10 2021-11-10 2021-12-01T15:55:50 1-s2.0-S2468823121006131 S2468-8231(21)00613-1 S2468823121006131 10.1016/j.mcat.2021.111996 S300 S300.1 FULL-TEXT 1-s2.0-S2468823121X00168 2022-12-12T23:36:31.133437Z 0 0 20211101 20211130 2021 2021-11-10T12:56:47.914492Z absattachment articleinfo articlenumber articletitlenorm authfirstinitialnorm authfirstsurnamenorm cid cids contenttype copyright crossmark dateloaded dateloadedtxt datesearch datesort dateupdated dco docsubtype doctype doi eid ewtransactionid hubeid indexeddate issn issnnorm itemstage itemtransactionid itemweight openaccess openarchive pg pgfirst pii piinorm pubdateend pubdatestart pubdatetxt pubyr sectiontitle sortorder srctitle srctitlenorm srctype ssids alllist content subj subheadings suppl tomb volfirst volissue volumelist webpdf webpdfpagecount yearnav figure table e-component body acknowledge affil appendices articletitle auth authfirstini authfull authkeywords authlast primabst ref specialabst 2468-8231 24688231 true 516 516 C Volume 516 44 111996 111996 111996 202111 November 2021 2021-11-01 2021-11-30 2021 Regular Papers article fla © 2021 Elsevier B.V. All rights reserved. DEHYDRATION23BUTANEDIOLPRODUCE13BUTADIENEOVERSC2O3CATALYSTPREPAREDTHROUGHHYDROTHERMALAGING NAKAZONO K 1 Introduction 2 Experimental 2.1 Samples 2.2 Characterization of catalysts 2.3 Catalytic reaction 3 Results and discussions 3.1 Dehydration of 2,3-BDO over various catalysts 3.2 Structural property of HT-Sc2O3 catalysts 3.3 Acid-base property of Sc2O3 catalysts 3.4 Dehydration of 2,3-BDO to form 3B2OL over HT-Sc2O3 catalysts 3.5 Effect of carrier gas on the dehydration of 2,3-BDO over HT-Sc2O3 catalysts 3.6 Dehydration of 2,3-BDO to form BD over HT-Sc2O3 catalysts 3.7 Discussion on the active center for the dehydration of 2,3-BDO 4 Conclusions CRediT authorship contribution statement Acknowledgment Appendix Supplementary materials References JI 2011 351 364 X ZENG 2011 749 757 A JANG 2012 2437 2459 Y JIANG 2014 165 Y SABRA 2016 165 197 W YANG 2017 990 1005 T TINOCO 2021 44 62 D WINFIELD 1945 412 423 M SUN 2020 106193 D DUAN 2017 53 56 H ZHANG 2020 1776 1779 H DUAN 2016 1036 1047 H ZENG 2019 1 36 F DUAN 2015 163 169 H DUAN 2014 1 4 H LIU 2016 12290 12294 X ZENG 2016 77 89 F ZHANG 2012 3441 3450 W NIKITINA 2016 1346 1353 M TSUKAMOTO 2016 831 833 D KIM 2016 156 167 W KIM 2019 148 163 W SONG 2016 11664 11671 D NGUYEN 2019 62 68 N HUCHEDE 2020 2060 2069 M SONG 2021 999 D DUAN 2014 1773 1775 H DUAN 2014 226 233 H DUAN 2017 66 74 H OHTSUKA 2019 48 57 S ABE 2011 419 424 K SEGAWA 2009 166 173 M TAKAHASHI 2010 134 140 R NEMOTO 2019 110399 T MATSUMURA 2021 1651 1658 Y SATO 2012 593 594 F SATO 2009 57 63 S SATO 2013 721 734 S MATSUDA 2020 1392 A LIDE 2001 D CRCHANDBOOKCHEMISTRYPHYSICS MOMMA 2011 1272 1276 K XU 2011 11RH02 Y SCHLEID 1989 73 80 T GERMAN 1982 1492 1494 V TAYLOR 1984 92 98 D FRISCH 2016 M GAUSSIAN16REVISIONC01 ZENG 2018 387 395 F SATO 2006 649 655 S DUAN 2017 9 16 H GOTOH 2010 92 98 H ICHIKAWA 2005 181 189 N ICHIKAWA 2006 13 22 N SATO 2009 64 71 S SATO 2003 77 81 S MATSUDA 2021 111853 A NAKAZONOX2021X111996 NAKAZONOX2021X111996XK 2023-11-10T00:00:00.000Z 2023-11-10T00:00:00.000Z http://creativecommons.org/licenses/by-nc-nd/4.0/ © 2021 Elsevier B.V. All rights reserved. 2021-11-13T22:52:29.630Z http://vtw.elsevier.com/data/voc/AddOnTypes/50.7/aggregated-refined JSPS JP18H01784 JP21H01711 KAKEN Japan Society for the Promotion of Science http://data.elsevier.com/vocabulary/SciValFunders/501100001691 http://sws.geonames.org/1861060/ This work was supported by JSPS KAKENHI KIBAN B Grant Numbers JP18H01784 and JP21H01711. 0 https://doi.org/10.15223/policy-017 https://doi.org/10.15223/policy-037 https://doi.org/10.15223/policy-012 https://doi.org/10.15223/policy-029 https://doi.org/10.15223/policy-004 item S2468-8231(21)00613-1 S2468823121006131 1-s2.0-S2468823121006131 10.1016/j.mcat.2021.111996 315758 2022-03-27T15:41:50.247912Z 2021-11-01 2021-11-30 1-s2.0-S2468823121006131-main.pdf https://s3-eu-west-1.amazonaws.com/prod-ucs-content-store-eu-west/content/pii:S2468823121006131/MAIN/application/pdf/f84fec76ac7364d4904cb1800cd4548e/main.pdf main.pdf pdf true 6352134 MAIN 14 1-s2.0-S2468823121006131-main_1.png https://s3-eu-west-1.amazonaws.com/prod-ucs-content-store-eu-west/content/pii:S2468823121006131/PREVIEW/image/png/f39cca6aa9d009e768cec34a9c68116c/main_1.png main_1.png png 60998 849 656 IMAGE-WEB-PDF 1 1-s2.0-S2468823121006131-ga1.jpg https://s3-eu-west-1.amazonaws.com/prod-ucs-content-store-eu-west/content/pii:S2468823121006131/ga1/DOWNSAMPLED/image/jpeg/6670226810f98dddda1f32e3961511ad/ga1.jpg ga1 true ga1.jpg jpg 20324 165 301 IMAGE-DOWNSAMPLED 1-s2.0-S2468823121006131-gr11.jpg https://s3-eu-west-1.amazonaws.com/prod-ucs-content-store-eu-west/content/pii:S2468823121006131/gr11/DOWNSAMPLED/image/jpeg/f4dcff655c4c989350c18921d1ebf6b8/gr11.jpg gr11 gr11.jpg jpg 43703 297 557 IMAGE-DOWNSAMPLED 1-s2.0-S2468823121006131-gr12.jpg https://s3-eu-west-1.amazonaws.com/prod-ucs-content-store-eu-west/content/pii:S2468823121006131/gr12/DOWNSAMPLED/image/jpeg/586374aa1330ea35c9f96c281382f443/gr12.jpg gr12 gr12.jpg jpg 155850 581 715 IMAGE-DOWNSAMPLED 1-s2.0-S2468823121006131-gr10.jpg https://s3-eu-west-1.amazonaws.com/prod-ucs-content-store-eu-west/content/pii:S2468823121006131/gr10/DOWNSAMPLED/image/jpeg/ec939d91f7c05b39cb5f33e3bb128412/gr10.jpg gr10 gr10.jpg jpg 26438 306 320 IMAGE-DOWNSAMPLED 1-s2.0-S2468823121006131-gr9.jpg https://s3-eu-west-1.amazonaws.com/prod-ucs-content-store-eu-west/content/pii:S2468823121006131/gr9/DOWNSAMPLED/image/jpeg/f679df8a8d372526aa90e61b81603ab3/gr9.jpg gr9 gr9.jpg jpg 27423 319 316 IMAGE-DOWNSAMPLED 1-s2.0-S2468823121006131-gr8.jpg https://s3-eu-west-1.amazonaws.com/prod-ucs-content-store-eu-west/content/pii:S2468823121006131/gr8/DOWNSAMPLED/image/jpeg/a9badd93f5bf2cae2d70e0f51ca82e89/gr8.jpg gr8 gr8.jpg jpg 33739 314 317 IMAGE-DOWNSAMPLED 1-s2.0-S2468823121006131-gr7.jpg https://s3-eu-west-1.amazonaws.com/prod-ucs-content-store-eu-west/content/pii:S2468823121006131/gr7/DOWNSAMPLED/image/jpeg/ac20c3e4750beb4a94847018d98d30bc/gr7.jpg gr7 gr7.jpg jpg 24296 306 302 IMAGE-DOWNSAMPLED 1-s2.0-S2468823121006131-gr6.jpg https://s3-eu-west-1.amazonaws.com/prod-ucs-content-store-eu-west/content/pii:S2468823121006131/gr6/DOWNSAMPLED/image/jpeg/9a7b2aff761b538760474929553d5bf9/gr6.jpg gr6 gr6.jpg jpg 35681 320 317 IMAGE-DOWNSAMPLED 1-s2.0-S2468823121006131-gr5.jpg https://s3-eu-west-1.amazonaws.com/prod-ucs-content-store-eu-west/content/pii:S2468823121006131/gr5/DOWNSAMPLED/image/jpeg/cf09d6b142593f795f7294366dfa0a36/gr5.jpg gr5 gr5.jpg jpg 104022 668 745 IMAGE-DOWNSAMPLED 1-s2.0-S2468823121006131-gr4.jpg https://s3-eu-west-1.amazonaws.com/prod-ucs-content-store-eu-west/content/pii:S2468823121006131/gr4/DOWNSAMPLED/image/jpeg/ee47ffa6c1dd8aca32e06f21f9a631a7/gr4.jpg gr4 gr4.jpg jpg 59563 339 389 IMAGE-DOWNSAMPLED 1-s2.0-S2468823121006131-gr3.jpg https://s3-eu-west-1.amazonaws.com/prod-ucs-content-store-eu-west/content/pii:S2468823121006131/gr3/DOWNSAMPLED/image/jpeg/a10426737cf8d125326c350f722d6f52/gr3.jpg gr3 gr3.jpg jpg 22978 280 301 IMAGE-DOWNSAMPLED 1-s2.0-S2468823121006131-gr2.jpg https://s3-eu-west-1.amazonaws.com/prod-ucs-content-store-eu-west/content/pii:S2468823121006131/gr2/DOWNSAMPLED/image/jpeg/8894bcfd63cd43c2524d3d54adb68ff3/gr2.jpg gr2 gr2.jpg jpg 96875 734 659 IMAGE-DOWNSAMPLED 1-s2.0-S2468823121006131-gr1.jpg https://s3-eu-west-1.amazonaws.com/prod-ucs-content-store-eu-west/content/pii:S2468823121006131/gr1/DOWNSAMPLED/image/jpeg/89ced966b2d913e4e5679ea4f77c670d/gr1.jpg gr1 gr1.jpg jpg 90037 645 678 IMAGE-DOWNSAMPLED 1-s2.0-S2468823121006131-sc1.jpg https://s3-eu-west-1.amazonaws.com/prod-ucs-content-store-eu-west/content/pii:S2468823121006131/sc1/DOWNSAMPLED/image/jpeg/f7a173f9ba2c3074651ea7388f2132d6/sc1.jpg sc1 sc1.jpg jpg 14343 224 487 IMAGE-DOWNSAMPLED 1-s2.0-S2468823121006131-sc2.jpg https://s3-eu-west-1.amazonaws.com/prod-ucs-content-store-eu-west/content/pii:S2468823121006131/sc2/DOWNSAMPLED/image/jpeg/993d419d74a037df9ecc7ada74b3ed7f/sc2.jpg sc2 sc2.jpg jpg 76981 349 753 IMAGE-DOWNSAMPLED 1-s2.0-S2468823121006131-ga1.sml https://s3-eu-west-1.amazonaws.com/prod-ucs-content-store-eu-west/content/pii:S2468823121006131/ga1/THUMBNAIL/image/gif/ab2c6d26118de08127da2d8b4f755965/ga1.sml ga1 true ga1.sml sml 20617 120 219 IMAGE-THUMBNAIL 1-s2.0-S2468823121006131-gr11.sml https://s3-eu-west-1.amazonaws.com/prod-ucs-content-store-eu-west/content/pii:S2468823121006131/gr11/THUMBNAIL/image/gif/38b6d55e067171316d9eeb805ce228d8/gr11.sml gr11 gr11.sml sml 8114 117 219 IMAGE-THUMBNAIL 1-s2.0-S2468823121006131-gr12.sml https://s3-eu-west-1.amazonaws.com/prod-ucs-content-store-eu-west/content/pii:S2468823121006131/gr12/THUMBNAIL/image/gif/ae95063209c0558a32d84e593e720de7/gr12.sml gr12 gr12.sml sml 19296 164 202 IMAGE-THUMBNAIL 1-s2.0-S2468823121006131-gr10.sml https://s3-eu-west-1.amazonaws.com/prod-ucs-content-store-eu-west/content/pii:S2468823121006131/gr10/THUMBNAIL/image/gif/12f2f6f06fe653c940974f8d75dbd039/gr10.sml gr10 gr10.sml sml 7775 164 171 IMAGE-THUMBNAIL 1-s2.0-S2468823121006131-gr9.sml https://s3-eu-west-1.amazonaws.com/prod-ucs-content-store-eu-west/content/pii:S2468823121006131/gr9/THUMBNAIL/image/gif/dfaec775a994c8e8065cc60d7e9a9707/gr9.sml gr9 gr9.sml sml 7507 164 162 IMAGE-THUMBNAIL 1-s2.0-S2468823121006131-gr8.sml https://s3-eu-west-1.amazonaws.com/prod-ucs-content-store-eu-west/content/pii:S2468823121006131/gr8/THUMBNAIL/image/gif/bc3bac1b8fc346c0558eede9677c7cb8/gr8.sml gr8 gr8.sml sml 8728 164 166 IMAGE-THUMBNAIL 1-s2.0-S2468823121006131-gr7.sml https://s3-eu-west-1.amazonaws.com/prod-ucs-content-store-eu-west/content/pii:S2468823121006131/gr7/THUMBNAIL/image/gif/57edc0b1c9ab372eff60bf3c15a60d6a/gr7.sml gr7 gr7.sml sml 6858 164 162 IMAGE-THUMBNAIL 1-s2.0-S2468823121006131-gr6.sml https://s3-eu-west-1.amazonaws.com/prod-ucs-content-store-eu-west/content/pii:S2468823121006131/gr6/THUMBNAIL/image/gif/32c2564bf4e82d2f6a57c1e8427c22c6/gr6.sml gr6 gr6.sml sml 8959 163 162 IMAGE-THUMBNAIL 1-s2.0-S2468823121006131-gr5.sml https://s3-eu-west-1.amazonaws.com/prod-ucs-content-store-eu-west/content/pii:S2468823121006131/gr5/THUMBNAIL/image/gif/d81fca64d0996362ad6d3d2734ba833b/gr5.sml gr5 gr5.sml sml 8449 164 183 IMAGE-THUMBNAIL 1-s2.0-S2468823121006131-gr4.sml https://s3-eu-west-1.amazonaws.com/prod-ucs-content-store-eu-west/content/pii:S2468823121006131/gr4/THUMBNAIL/image/gif/1dd2f10ae7d39b8395aae3dd81d13b72/gr4.sml gr4 gr4.sml sml 11995 164 188 IMAGE-THUMBNAIL 1-s2.0-S2468823121006131-gr3.sml https://s3-eu-west-1.amazonaws.com/prod-ucs-content-store-eu-west/content/pii:S2468823121006131/gr3/THUMBNAIL/image/gif/f729357879fb832459f6413feb8d4fa4/gr3.sml gr3 gr3.sml sml 7958 164 176 IMAGE-THUMBNAIL 1-s2.0-S2468823121006131-gr2.sml https://s3-eu-west-1.amazonaws.com/prod-ucs-content-store-eu-west/content/pii:S2468823121006131/gr2/THUMBNAIL/image/gif/1900c2bc5a2c8c73d7c2ea68c9c83fde/gr2.sml gr2 gr2.sml sml 12971 164 147 IMAGE-THUMBNAIL 1-s2.0-S2468823121006131-gr1.sml https://s3-eu-west-1.amazonaws.com/prod-ucs-content-store-eu-west/content/pii:S2468823121006131/gr1/THUMBNAIL/image/gif/ef8d00a493a6ee15efb8138cd6508aa9/gr1.sml gr1 gr1.sml sml 7417 164 172 IMAGE-THUMBNAIL 1-s2.0-S2468823121006131-sc1.sml https://s3-eu-west-1.amazonaws.com/prod-ucs-content-store-eu-west/content/pii:S2468823121006131/sc1/THUMBNAIL/image/gif/c37816c2525a56628fd5d993f9395dab/sc1.sml sc1 sc1.sml sml 3127 101 219 IMAGE-THUMBNAIL 1-s2.0-S2468823121006131-sc2.sml https://s3-eu-west-1.amazonaws.com/prod-ucs-content-store-eu-west/content/pii:S2468823121006131/sc2/THUMBNAIL/image/gif/770263d3d763463ad85f3f51a2d5535e/sc2.sml sc2 sc2.sml sml 8771 101 219 IMAGE-THUMBNAIL 1-s2.0-S2468823121006131-ga1_lrg.jpg https://s3-eu-west-1.amazonaws.com/prod-ucs-content-store-eu-west/content/pii:S2468823121006131/ga1/HIGHRES/image/jpeg/29e7c1613e3c4a583230b8f98f64ab00/ga1_lrg.jpg ga1 true ga1_lrg.jpg jpg 143901 731 1333 IMAGE-HIGH-RES 1-s2.0-S2468823121006131-gr11_lrg.jpg https://s3-eu-west-1.amazonaws.com/prod-ucs-content-store-eu-west/content/pii:S2468823121006131/gr11/HIGHRES/image/jpeg/3edacbaea3a0d2a50f3605a96607acdd/gr11_lrg.jpg gr11 gr11_lrg.jpg jpg 301736 1318 2469 IMAGE-HIGH-RES 1-s2.0-S2468823121006131-gr12_lrg.jpg https://s3-eu-west-1.amazonaws.com/prod-ucs-content-store-eu-west/content/pii:S2468823121006131/gr12/HIGHRES/image/jpeg/47d4069adde4a5030d1e62c8a364865b/gr12_lrg.jpg gr12 gr12_lrg.jpg jpg 1162738 2572 3167 IMAGE-HIGH-RES 1-s2.0-S2468823121006131-gr10_lrg.jpg https://s3-eu-west-1.amazonaws.com/prod-ucs-content-store-eu-west/content/pii:S2468823121006131/gr10/HIGHRES/image/jpeg/3d0bf1e774579f56a8bc492d831ee5bc/gr10_lrg.jpg gr10 gr10_lrg.jpg jpg 175775 1357 1419 IMAGE-HIGH-RES 1-s2.0-S2468823121006131-gr9_lrg.jpg https://s3-eu-west-1.amazonaws.com/prod-ucs-content-store-eu-west/content/pii:S2468823121006131/gr9/HIGHRES/image/jpeg/241cd75d48ac5f4cd80b8d66856a5df7/gr9_lrg.jpg gr9 gr9_lrg.jpg jpg 181458 1417 1402 IMAGE-HIGH-RES 1-s2.0-S2468823121006131-gr8_lrg.jpg https://s3-eu-west-1.amazonaws.com/prod-ucs-content-store-eu-west/content/pii:S2468823121006131/gr8/HIGHRES/image/jpeg/4afe9e872a1939f09dcf09e839332a70/gr8_lrg.jpg gr8 gr8_lrg.jpg jpg 238360 1390 1405 IMAGE-HIGH-RES 1-s2.0-S2468823121006131-gr7_lrg.jpg https://s3-eu-west-1.amazonaws.com/prod-ucs-content-store-eu-west/content/pii:S2468823121006131/gr7/HIGHRES/image/jpeg/71fb6ee200ac5a71ce8cd652c459e50d/gr7_lrg.jpg gr7 gr7_lrg.jpg jpg 157499 1357 1339 IMAGE-HIGH-RES 1-s2.0-S2468823121006131-gr6_lrg.jpg https://s3-eu-west-1.amazonaws.com/prod-ucs-content-store-eu-west/content/pii:S2468823121006131/gr6/HIGHRES/image/jpeg/e7a49604c1e4716239f0ec18db36a502/gr6_lrg.jpg gr6 gr6_lrg.jpg jpg 240209 1420 1407 IMAGE-HIGH-RES 1-s2.0-S2468823121006131-gr5_lrg.jpg https://s3-eu-west-1.amazonaws.com/prod-ucs-content-store-eu-west/content/pii:S2468823121006131/gr5/HIGHRES/image/jpeg/437992d6790c008ca58672f52813b13e/gr5_lrg.jpg gr5 gr5_lrg.jpg jpg 732584 2955 3298 IMAGE-HIGH-RES 1-s2.0-S2468823121006131-gr4_lrg.jpg https://s3-eu-west-1.amazonaws.com/prod-ucs-content-store-eu-west/content/pii:S2468823121006131/gr4/HIGHRES/image/jpeg/9843cfc0c4e74347686d5bcb59118be4/gr4_lrg.jpg gr4 gr4_lrg.jpg jpg 491369 1502 1725 IMAGE-HIGH-RES 1-s2.0-S2468823121006131-gr3_lrg.jpg https://s3-eu-west-1.amazonaws.com/prod-ucs-content-store-eu-west/content/pii:S2468823121006131/gr3/HIGHRES/image/jpeg/98cb10c282c27d372a43988b70b98f5c/gr3_lrg.jpg gr3 gr3_lrg.jpg jpg 161422 1239 1333 IMAGE-HIGH-RES 1-s2.0-S2468823121006131-gr2_lrg.jpg https://s3-eu-west-1.amazonaws.com/prod-ucs-content-store-eu-west/content/pii:S2468823121006131/gr2/HIGHRES/image/jpeg/7f953cc569dfd6a26a7301db97376c68/gr2_lrg.jpg gr2 gr2_lrg.jpg jpg 1121106 3251 2917 IMAGE-HIGH-RES 1-s2.0-S2468823121006131-gr1_lrg.jpg https://s3-eu-west-1.amazonaws.com/prod-ucs-content-store-eu-west/content/pii:S2468823121006131/gr1/HIGHRES/image/jpeg/efbbc30f38776d0aa2e5fd0de6695a4f/gr1_lrg.jpg gr1 gr1_lrg.jpg jpg 732717 2855 3000 IMAGE-HIGH-RES 1-s2.0-S2468823121006131-sc1_lrg.jpg https://s3-eu-west-1.amazonaws.com/prod-ucs-content-store-eu-west/content/pii:S2468823121006131/sc1/HIGHRES/image/jpeg/fd62e41fc5844b6e78ce3b334f58b953/sc1_lrg.jpg sc1 sc1_lrg.jpg jpg 110933 991 2157 IMAGE-HIGH-RES 1-s2.0-S2468823121006131-sc2_lrg.jpg https://s3-eu-west-1.amazonaws.com/prod-ucs-content-store-eu-west/content/pii:S2468823121006131/sc2/HIGHRES/image/jpeg/7e31705c41202fcb54cc6c3878a9be72/sc2_lrg.jpg sc2 sc2_lrg.jpg jpg 564858 1543 3333 IMAGE-HIGH-RES 1-s2.0-S2468823121006131-mmc1.docx https://s3-eu-west-1.amazonaws.com/prod-ucs-content-store-eu-west/content/pii:S2468823121006131/mmc1/MAIN/application/vnd.openxmlformats-officedocument.wordprocessingml.document/918deaeb959bc14cd8cf8238e22801ea/mmc1.docx mmc1 mmc1.docx docx 505703 APPLICATION 1-s2.0-S2468823121006131-am.pdf am am.pdf pdf 1739730 AAM-PDF https://s3-eu-west-1.amazonaws.com/prod-ucs-content-store-eu-west/content/egi:10156SLB6V7/MAIN/application/pdf/e146c19a7bffb43c7b07a42c675c86cc/am.pdf MCAT 111996 111996 S2468-8231(21)00613-1 10.1016/j.mcat.2021.111996 Elsevier B.V. Scheme 1 Reaction route from 2,3-BDO to BD via 3B2OL. Scheme 1 Scheme 2 Proposed mechanism in the dehydration of 2,3-BDO to BD through 3B2OL over Sc3+ and O2− ions exposed on the oxygen defect site of Sc2O3 shown in Fig. 12f. Some of O2− and Sc3+ ions in Fig. 12f were removed for clarity. Scheme 2 Fig. 1 XRD profiles of HT-Sc2O3 (a) and PC-Sc2O3 (b) samples calcined at different temperatures. Fig 1 Fig. 2 FE-SEM images of HT-Sc2O3 (a, b, c) and PC-Sc2O3 (d, e). As-prepared Sc2O3 (a, d); Sc2O3 calcined at 800 °C (b, e) and 1000 °C (c). A scale bar in the SEM images indicates 100 nm. Fig 2 Fig. 3 TG profiles of as-prepared ScOOH via HT aging for 0 (a), 4 (b), and 24 h (c) and HT-Sc2O3–400 (d). Fig 3 Fig. 4 TPD profiles of adsorbed NH3 (red) and CO2 (blue) on HT-Sc2O3 calcined at 600 (a) and 800 °C (b) together with PC-Sc2O3 calcined at 800 °C (c). (For interpretation of the references to color in this figure legend, the reader is referred to the web version of this article.) Fig 4 Fig. 5 Effect of calcination temperature of HT-Sc2O3 (a) and PC-Sc2O3 (b) on the catalytic activity and effect of specific surface area of Sc2O3 (c). Reaction conditions are the same as those in Table 1. Fig 5 Fig. 6 Effect of reaction temperature on the conversion of 2,3-BDO and selectivity over HT-Sc2O3 calcined at 800 °C. Reaction conditions are the same as those in Table 1. Fig 6 Fig. 7 Effect of space time, W/F, on the conversion of 2,3-BDO (closed symbol) and 3B2OL selectivity (open symbol) over HT-Sc2O3 calcined at 800 °C. Reaction conditions are the same as those in Table 1. Fig 7 Fig. 8 Stability in the conversion of 2,3-BDO (closed symbol) and 3B2OL selectivity (open symbol) over HT-Sc2O3 calcined at 800 °C in N2 flow (circle) and in H2 flow (triangle) at 325 °C. Reaction conditions: W/F = 0.31 h, carrier gas, 1.8 dm3 h−1. Fig 8 Fig. 9 Effect of space time in the dehydration of 2,3-BDO over HT-Sc2O3-800 at 411 °C. The 2,3-BDO conversion was 100%. Fig 9 Fig. 10 Effect of reaction temperature on the conversion of 2,3-BDO over HT-Sc2O3-800 at a high space time of W/F = 2.5 h. The 2,3-BDO conversion was 100%. Fig 10 Fig. 11 Change in the activity over HT-Sc2O3-800 on the conversion of 2,3-BDO with time on stream at a high space time and different temperatures. Reaction conditions: W/F = 2.5 h. The 2,3-BDO conversion was 100%. (A color version of this figure can be viewed online). Fig 11 Fig. 12 Crystalline models of Sc2O3 cube with (100) faces (a), slice at a (222) face (b), top view of (222) face (c), top view of (222) face with large area and clusters of 4-oxygen defect sites, which are indicated by blue circles (d), an expanded view of a cluster of 4-oxygen defect site with bars that indicate the length between Sc-Sc cations of 3.76 (a1) and 3.74 Å (a2) (e), and a proposed active site with 2 Sc3+ cations and an O2− anion shown by an Sc-O-Sc triangle with the length between Sc-O of 4.66 (b1) and 5.75 Å (b2) (f) modeled by VESTA 3 [41] using the National Institute for Materials Science (NIMS) AtomWork Database [42,43]. (For interpretation of the references to color in this figure legend, the reader is referred to the web version of this article.) Large balls represent O2−, large white circles indicate oxygen vacancies, and small red balls are Sc3+. In the (222) face (c–f), the top and the third layers are composed of O2− anions, and the second layer is composed of Sc3+ cations. (A color version of this figure can be viewed online). Fig 12 Table 1 Catalytic conversion of 2,3-BDO over various catalysts at 325 °C. Table 1 Catalyst SA (m2 g−1) Conv. (%) Selectivity (mol%) 3B2OL MEK Acetoin BD Butenes Others SiO2 (as-received) a 295 0 - - - - - - Al2O3 (as-received) b 180 97.0 f 2.8 70.6 2.1 1.6 0.4 22.5 HT-ZrO2–900 10.0 9.6 33.9 36.3 18.1 0 0 11.7 HT-Y2O3–900 9.3 3.5 19.3 2.5 63.3 0 0 14.9 HT-Dy2O3–900 7.0 2.4 16.1 3.0 59.4 0 0 21.5 HT-Yb2O3–900 11.9 4.5 44.1 2.0 40.5 0 0 13.4 ScZrO-900 c 23.0 18.4 47.4 18.7 16.0 0 0 17.9 YbZrO-900 c 27.4 12.2 46.9 7.3 28.4 0 0 17.4 LuZrO-900 c 26.3 11.3 50.8 10.1 24.2 0 0 14.9 HT-Sc2O3–900 16.6 61.3 93.4 1.8 2.3 0 0 2.5 HT-Sc2O3–800 33.1 68.8 95.1 1.2 1.3 0 0 2.4 PC-Sc2O3–800 d 29.9 28.8 85.4 4.9 4.7 0 0 5.0 CM-Sc2O3–800 e 10.7 25.3 90.0 3.9 3.5 0 0 2.6 HT-In2O3–900 6.6 77.5 77.5 2.2 4.6 1.5 1.5 12.7 HT-In2O3–800 8.0 74.0 74.7 2.6 5.9 1.2 1.4 14.2 HT-In2O3–400 17.8 58.1 45.0 6.1 34.8 0.2 0.3 19.7 W/F = 0.31 h; N2 carrier gas, 1.8 dm3 h−1. Averaged conversion and selectivity between 1 and 5 h. 3B2OL, 3-buten-2-ol; MEK, butanone; Acetoin, 3-hydroxy-2-butanone; BD, 1,3-butadiene; Butenes, 1-butene and 2-butene. Others include 2-methyl-1-propanol, 2-methylpropanal, 2-butanol, ethanol, acetone, etc. a CARiACT Q10, supplied by Fuji Silycia Chemical Ltd. b JRC-ALO-6, supplied by the Reference Catalyst Division, the Catalysis Society of Japan. c The data cited from Ref. [39]. d Sample prepared by precipitation without HT treatment. e Commercially available Sc2O3, Sigma-Aldrich Co., Ltd. f Reacted at 250 °C. Table 2 Physical properties of Sc2O3 calcined at different temperatures. Table 2 Catalyst Calcination (°C) SA (m2 g−1) FWHM b (degree) Particle size, D BET (nm) Crystallite size, D XRD (nm) HT-Sc2O3 As-prepared 58.5 - - - 300 52.5 - - - 400 58.3 0.367 26.7 22.5 600 52.5 0.354 29.6 23.3 700 47.1 0.278 33.0 29.7 800 33.1 0.259 47.0 31.8 900 16.6 0.216 93.6 38.2 1000 15.8 0.199 98.4 41.5 PC-Sc2O3 a As-prepared 76.3 - - - 300 81.7 - - - 400 148.4 0.621 10.5 13.3 600 71.9 0.508 21.6 16.2 700 48.4 0.402 32.1 20.5 800 29.9 0.308 51.9 26.7 a Samples were prepared by precipitation without HT aging. b Calculated from the FWHM of Sc2O3 (222) peak shown in Fig. 1. Table 3 Dehydration of 2,3-BDO over Sc2O3–800 prepared by different HT aging periods. Table 3 HT time (h) SA (m2 g−1) Conversion (%) Selectivity (mol%) 3B2OL MEK Acetoin Others 0 (PC-Sc2O3) 29.9 28.8 85.4 4.9 4.7 5.0 4 38.5 77.4 93.0 1.3 1.8 3.9 8 36.5 80.4 93.4 1.3 1.8 3.5 24 33.1 68.8 95.1 1.2 1.3 2.4 72 32.5 48.5 89.3 2.4 4.2 4.1 Reaction conditions are the same as those in Table 1. Table 4 Effects of carrier gas to the dehydration of 2,3-BDO over Sc2O3–800. Table 4 Carrier gas Conversion (%) Selectivity (mol%) 3B2OL MEK Acetoin Others N2 68.8 95.1 1.2 1.3 2.4 NH3 55.0 92.6 2.0 0 5.4 CO2 44.4 81.4 5.7 4.4 8.5 Reaction conditions are the same as those in Table 1; carrier gas, 1.8 dm3 h−1. Table 5 Dehydration of 2,3-BDO over Sc2O3-800. Table 5 Catalyst SA (m2 g−1) Conv. (%) Selectivity (mol%) BD 3B2OL MEK MPA MPO Butenes Others HT-Sc2O3 33.1 100 57.1 11.1 10.5 1.5 2.0 1.2 16.6 PC-Sc2O3 29.9 100 46.4 15.4 12.8 1.6 2.5 1.4 19.9 CM-Sc2O3 10.7 100 34.4 31.0 11.3 1.1 1.6 0 20.6 Reaction temperature, 411 °C; W/F = 0.94 h. Averaged conversion and selectivity averaged at TOS from 1 to 5 h. MPA, 2-methylpropanal; MPO, 2-methyl-1-propanol. Others include 2-butanol, ethanol, acetone, etc. Table 6 Lengths of M-M and M-O in the bixbyite M2O3 modeled by VESTA 3 [41]. Table 6 Catalyst I.R. a (Å) M-M b (Å) M-O, b1 b (Å) M-O, b2 b (Å) SA c (m2 g−1) Conv. c (mol%) 3B2OL select. c (%) 3B2OL yield c (%) Formation rate d Sc2O3 0.75 3.76 4.66 5.75 16.6 61.3 93.4 57.3 1.22 In2O3 0.80 3.85 4.76 5.87 6.6 77.5 77.5 60.1 3.23 Yb2O3 0.99 3.96 4.88 6.03 11.9 4.5 44.1 2.0 0.06 Y2O3 1.02 4.04 4.98 6.15 9.3 3.5 19.3 0.7 0.03 Dy2O3 1.03 4.05 5.00 6.17 7.0 2.4 16.1 0.4 0.02 a I.R, Ionic radius of cation used for the modeling [43–45]. b M-M, length between cations (a1); M-O, length between a cation and an O2− anion (b1, b2) shown in Fig. 12f. c Catalyst calcined at 900 °C. The data are the same as those in Table 1. d Formation rate of 3B2OL (mmol m−2 h−1). Dehydration of 2,3-butanediol to produce 1,3-butadiene over Sc2O3 catalyst prepared through hydrothermal aging Kazuki Nakazono Conceptualization Data curation Visualization Writing – original draft a Ryoji Takahashi Data curation Writing – review & editing b Yasuhiro Yamada Supervision Validation a Satoshi Sato Project administration Funding acquisition Writing – review & editing a ⁎ a Graduate School of Engineering, Chiba University, Yayoi, Inage, Chiba 263-8522, Japan Graduate School of Engineering Chiba University Yayoi, Inage Chiba 263-8522 Japan aGraduate School of Engineering, Chiba University, Yayoi, Inage, Chiba 263-8522, Japan b Graduate School of Science and Engineering, Ehime University, 2-5 Bunkyocho, Matsuyama, Ehime 790-8577, Japan Graduate School of Science and Engineering Ehime University 2-5 Bunkyocho Matsuyama Ehime 790-8577 Japan bGraduate School of Science and Engineering, Ehime University, 2-5 Bunkyocho, Matsuyama, Ehime 790-8577, Japan ⁎ Corresponding author. Vapor-phase catalytic dehydration of 2,3-butanediol (2,3-BDO) to form 1,3-butadiene (BD) via 3-buten-2-ol (3B2OL) was studied over various single metal oxide catalysts. Among the catalysts, Sc2O3 prepared under hydrothermal (HT) conditions at 200 °C followed by 800 °C calcination showed the most excellent catalytic activity. The crystallization of precursor ScOOH during HT aging noticeably enhances the catalytic activity of the resulting Sc2O3 for the formation of 3B2OL in the dehydration of 2,3-BDO. The formation rate of 3B2OL from 2,3-BDO over the HT-aged Sc2O3 was twice as high as Sc2O3 without HT aging. Calcination temperatures of Sc2O3 are also important: calcination at 800 °C is efficient for the selective formation of 3B2OL from 2,3-BDO. The HT-aged Sc2O3 also showed an excellent catalytic activity for the formation of BD with the yield higher than 80% in the dehydration of 2,3-BDO at 411 °C. Graphical abstract Image, graphical abstract Keywords Dehydration of 2,3-butanediol 1,3-butadiene Unsaturated alcohol Hydrothermally aged Sc2O3 Cubic bixbyite with high crystallinity 1 Introduction In the petrochemical industry, transform of raw materials from oil to carbon-neutral renewable resources such as biomass has been required due to global warming. Butanediols (BDOs) such as 2,3-butanediol (2,3-BDO) [1–7], 1,4-BDO [2–5], and 1,3-BDO [5] are derivable from biomass via metabolic conversion of carbohydrates. The formation of 2,3-BDO was studied for the production of 1,3-butadiene (BD) as a strategic compound for the synthetic rubber during the World War II [1,8]. In 2019, the number of reports on the metabolic formation of 2,3-BDO is about three hundred, which is much larger than those of the other BDOs [9]. Recently, chemical production of 2,3-BDO from biomass-derived chemicals is reported in the hydrogenation of 3-hydroxy-2-butanone (acetoin) and 2,3-butanedione (diacetyl) [10] and the photoreductive dimerization of ethanol [11]. The bio-based 2,3-BDO can be utilized as a chemical raw material for the production of variable chemicals such as BD, 3-buten-2-ol (3B2OL), butanone (MEK), butene isomers, and so on [12,13]. In 1945, it was reported that a radioactive ThO2 showed a catalytic activity for the dehydration of 2,3-BDO to form 3B2OL, which can be further dehydrated into BD [8]. Sc2O3 catalyst has recently been found to exhibit high selectivity to BD in the dehydration of 2,3-BDO through 3B2OL [14]. γ-Al2O3 has catalytic activity in the vapor-phase dehydration of 2,3-BDO to form BD and MEK [15–17]: γ-Al2O3 produces MEK preferentially at high conversions and BD increases with increasing the reaction temperature [17]. Acidic catalysts with Brønsted acid sites such as boron-modified HZSM-5 [18] and aluminum phosphate [19] effectively convert 2,3-BDO into MEK along with 2-methylpropanal (MPA) led by pinacol rearrangement. In contrast, weakly acidic SiO2-supported phosphates [20–22] and unsupported phosphates [23–26] are reported to be effective for the dehydration of 2,3-BDO to form BD together with MEK. We have previously reported that 2,3-BDO can be preferentially dehydrated to 3B2OL over Sc2O3 [14,27], In2O3 [27], and modified ZrO2 catalysts [28,29] at 300 °C or higher. Since 3B2OL is a significant intermediate to form BD from 2,3-BDO, the selective formation of 3B2OL from 2,3-BDO is a crucial step to improve the selectivity to BD (Scheme 1 ). The reactivity of BDOs, which depends on the catalyst, varies with the position of OH groups of BDOs. An yttria-stabilized zirconia shows an excellent stable catalytic activity for the dehydration of 1,3- and 1,4-BDO, but the addition of Y into ZrO2 decreases the selectivity to 3B2OL in the dehydration of 2,3-BDO [30]. In the rare earth oxides, Sc2O3 has moderate catalytic activity in the dehydration of 1,3-and 1,4-BDO, in which Lu2O3 and Yb2O3 are more active than Sc2O3 [12]. As far as we know, however, Sc2O3 has the highest activity for the dehydration of 2,3-BDO to form 3B2OL with high selectivity [9,27]. Sc2O3 is also active for the dehydration of long-chain terminal diols such as 1,6-hexanediol and 1,ω-alkanediols (ω= 7, 8, 9, 10, and 12) [31]. In2O3, which has the same crystal structure of cubic bixbyite Sc2O3, shows the second-highest selectivity to 3B2OL in the dehydration of 2,3-BDO [27], while In2O3 is also active for the dehydration of 1,3-BDO, 1,4-BDO, and 1,5-pentanediol [32,33]. Recently, we have reported an excellent Yb2Zr2O7 catalyst for the vapor-phase dehydration of 1,3-BDO to produce unsaturated alcohols [34]. A Yb2Zr2O7 prepared through hydrothermal (HT) aging is more active than the precipitated samples without HT aging. The specific surface areas of Yb2Zr2O7 are as high as 40 m2 g−1 even after being calcined at a temperature of 800 °C, in contrast to the fact that the precipitated catalysts without HT aging are readily sintered at the temperature. Also, Y2Zr2O7 prepared through HT aging efficiently catalyzed the formation of BD from 1,3-BDO at 360 °C [35]. In addition, HT-aged Er2O3 shows excellent catalytic activity in the dehydration of 1,4-BDO to form 3-buten-1-ol [36]. It should be noticed that Lu2O3, Yb2O3, and Er2O3, which show high selectivity to unsaturated alcohols in the dehydration of 1,3- and 1,4-BDOs, have the same cubic crystalline structure of bixbyite Sc2O3 [37,38]. We expect that such an HT aging of a hydroxide precipitate precursor could enhance the crystallinity of the resulting oxide with improved catalytic activity. Therefore, in this study, we firstly focused on the efficient production of 3B2OL from 2,3-BDO over various HT-aged oxide samples. In the preliminary catalyst screening, we selected Sc2O3 as a candidate catalyst in the dehydration of 2,3-BDO to produce 3B2OL. In addition, the dehydration of 2,3-BDO to efficiently form BD was investigated over the HT-aged Sc2O3 catalysts. 2 Experimental 2.1 Samples Scandium(III) nitrate, Sc(NO3)3·nH2O (n = 5, which was determined by weight loss in thermogravimetry (TG) analysis) and other nitrates such as Y(NO3)3·6H2O, Dy(NO3)3·nH2O, Yb(NO3)3·6H2O, were purchased from Sigma-Aldrich. In(NO3)3·3H2O, ZrO(NO3)2·2H2O, and an internal standard of 1-hexanol were purchased from Wako Pure Chemicals Industries, Ltd. A commercial Sc2O3 as a reference catalyst was purchased from Sigma-Aldrich Co., Ltd., which is named CM-Sc2O3. Al2O3 (JRC-ALO-6) was supplied by the Reference Catalyst Division, the Catalysis Society of Japan. SiO2 (CARiACT Q10 with mean pore diameters of 10 nm) was supplied by Fuji Silycia Chemical Ltd. A reactant 2,3-BDO was purchased from Tokyo Chemical Industry, Co., Ltd. It was used for the catalytic reaction without any further purification. Sc2O3 was prepared through an HT aging of a precipitate prepared as follows. In a typical preparation, 5.00 g of Sc(NO3)3·5H2O was dissolved in 50 cm3 of distilled water, and the pH of the solution was adjusted to 9.8 with 25 wt.% aqueous ammonia under stirring to form a hydroxide precipitate. The solution together with the precipitate was heated in a 100 cm3 Teflon-lined autoclave at 200 °C for 24 h. The recovered precipitate was centrifuged, washed with distilled water three times, dried at 110 °C for 24 h, and finally calcined at the prescribed temperature for 3 h. The resulting Sc2O3 is denoted as HT-Sc2O3. The other Sc2O3 catalyst was prepared by a precipitation method in the same way as the procedure described above without HT aging, and the resulting Sc2O3 was expressed as PC-Sc2O3. The sample name was also denoted, including the calcination temperature, T (°C), as Sc2O3-T. The other oxide samples were prepared in the same manner as the preparation of Sc2O3 using the corresponding nitrate. In the preparation of rare earth zirconate catalysts (REZrO), such as Sc2O3-ZrO2 (ScZrO), Yb2O3-ZrO2 (YbZrO), and Lu2O3-ZrO2 (LuZrO), the corresponding nitrates were used in a similar manner to that of Sc2O3, which was described in a previous paper [39]. 2.2 Characterization of catalysts The powder X-ray diffraction (XRD) was recorded on New D8 ADVANCE (Bruker) with Cu Kα radiation (λ = 0.154 nm) to identify the crystal phase of each sample. A crystallite size, D XRD , of Sc2O3 sample was estimated by calculating from the full width at half maximum (FWHM) by Scherrer equation: D XRD = Kλ/(βcosθ), where K (= 0.9), λ, β, and θ are shape factor, X-ray wavelength, FWHM, and Bragg's diffraction angle, respectively. A particle size, D BET, of Sc2O3 was calculated by the following equation, D BET = 6/d/SA, assuming that the particles are spherical where d and SA are the density of Sc2O3 (d = 3.864 g cm−3 [40]) and the specific surface area, respectively. To characterize the crystal structure of rare earth oxides such as Sc2O3, Yb2O3, Y2O3, and Dy2O3, including In2O3, crystal structure modeling was performed using VESTA 3 software [41] with the National Institute for Materials Science (NIMS) AtomWork Database [42] including crystallographic data of Sc2O3 [43], Yb2O3, Y2O3, Dy2O3 [44], and In2O3 [45]. A structure of reactant meso-2,3-BDO with a gauche-type configuration was optimized with Gaussian 16 (B3LYP/6–31 g(d) integral = grid = ultrafine) [46] to determine the distances between reactive atoms of the optimized model meso-2,3-BDO. In the optimized model of meso-2,3-BDO, which is displayed in Fig. S1, the O-O distance between the OH groups, the O-H distance between the position-1 hydrogen and the position-2 OH group, and the other O-H distance between the position-1 hydrogen and the position-3 OH group were determined to be 2.95, 2.69, and 2.47 Å, respectively. The other methods for characterization on N2 adsorption for calculation of SA, high-resolution field emission scanning electron microscope (FE-SEM) image, TG, and temperature-programmed desorption (TPD) of adsorbed NH3 and CO2 were described in the supplementary information (SI) file. 2.3 Catalytic reaction The vapor-phase catalytic dehydration of 2,3-BDO was performed in a fixed-bed flow reactor at atmospheric pressure. After a catalyst (typically catalyst weight, W = 0.5 g) had been heated at the prescribed reaction temperature for 1 h, 2,3-BDO was fed into the reactor at a feed rate, F, of 1.60 g h−1, and continued for time on stream (TOS) of typically 5 h. Unless otherwise described, N2 was flowed as a carrier gas at a rate of 1.8 dm3 h−1. The details of the procedure were described in SI file. 3 Results and discussions 3.1 Dehydration of 2,3-BDO over various catalysts We have previously reported that a commercial Sc2O3 (purchased from KANTOCHEMICAL CO., INC.) with an SA of 51.5 m2 g−1, which was prepared by decomposing the corresponding chlorides at temperatures above 2000 °C for ca. 2 s in the vapor phase [37], achieved a BD yield of 67% in N2 and 88% in H2 at 411 °C and a space time, W/F, of 0.94 h [14]. However, the excellent results have not been reproduced by the other commercial ones: Zeng et al. reported that CM-Sc2O3 achieved the BD selectivity of about 30% at 411 °C and a W/F = 0.93 h [47]. We also obtained a similar poor result over CM-Sc2O3 obtained from the same supplier, as described in Section 3.6 of this study. Therefore, we have to establish a method for preparing an active Sc2O3 catalyst. Thus, we adopted a method of HT aging of the hydroxide precursor in this study to obtain catalysts with high crystallinity. In the beginning, we screened various candidate oxide catalysts prepared through HT aging. Table 1 shows the conversion of 2,3-BDO over metal oxide catalysts prepared via HT aging at 200 °C for 24 h under the reaction conditions in N2 flow at 325 °C and a W/F= 0.31 h. Over a SiO2, the conversion of 2,3-BDO was zero. This indicates that no catalytic dehydration of 2,3-BDO proceeds in a blank test without catalysts. Over a reference Al2O3, the conversion of 2,3-BDO was relatively high; the primary product was MEK together with by-products such as ethanol, 2-butanol, 2-methyl-1-propanol, and MPA at 250 °C. It is known that 2,3-BDO converts into MEK along with MPA through pinacol rearrangement over acidic catalysts such as Al2O3 [15–17], B-modified HZSM-5 [18], and aluminum phosphate [19]. In contrast, over rare earth oxide catalysts such as Yb2O3, Y2O3, and Dy2O3, the conversion levels of 2,3-BDO were low even at 325 °C and 2,3-BDO competitively converted to form 3B2OL and acetoin, suggesting that the catalysts also promote the dehydrogenation of 2,3-BDO in addition to the dehydration. In addition, ZrO2 was as active as the rare earth oxides, as reported previously [15]. REZrO catalysts, which are recently reported to be active in the dehydration of 1,3- and 1,4-BDO [39], were also active in the dehydration of 2,3-BDO with the 3B2OL selectivity of ca. 50% at the 2,3-BDO conversions less than 20%, while REZrO showed higher 2,3-BDO conversions and higher 3B2OL selectivity than rare earth oxides such as Yb2O3 and Y2O3. However, the 3B2OL selectivity of the HT-aged samples is unfortunately unsatisfied. Sc2O3 catalysts showed high activity to produce 3B2OL with high selectivity in the dehydration of 2,3-BDO at 325 °C. In particular, HT-Sc2O3 attained the highest 3B2OL selectivity of 95.1% at the 2,3-BDO conversion of 68.8%. Thus, HT-Sc2O3 was more active than PC-Sc2O3 without HT aging and CM-Sc2O3. The activity of PC-Sc2O3 was comparable to that of CM-Sc2O3, in which the selectivity to 3B2OL was 90.0% at the 2,3-BDO conversion of 25.3%. We have previously tested the same CM-Sc2O3 under different conditions [27]: the selectivity to 3B2OL is 88.2% at the 2,3-BDO conversion of 96.5% at a high W/F of 0.94 h. It is reasonable that the present conversion level of CM-Sc2O3 is low at a low W/F of 0.31 h. HT-In2O3 also had a high dehydration ability to 3B2OL, but the 3B2OL selectivity was ca. 75%. In2O3, which has the same crystal structure of bixbyite Sc2O3, is known as an effective catalyst for the dehydration of 1,4-BDO to 3-buten-1-ol [32,33]. The SA values of HT-In2O3 samples were as low as 6–18 m2 g−1. Calcination at 800 °C or higher enhanced the catalytic activity of In2O3. HT-In2O3–900 showed the highest 2,3-BDO conversion and high 3B2OL selectivity, irrespective of low SA. The conversion and selectivity levels of HT-In2O3–900 are higher than those of a commercially available In2O3 reported in a previous work [27]. 3.2 Structural property of HT-Sc2O3 catalysts Fig. 1 shows continuous scanning XRD analysis of HT- and PC-Sc2O3 samples calcined at different temperatures. As-prepared samples are the resulting precipitate dried at 110 °C for 24 h without calcination. The as-prepared sample of HT series, as well as the samples heated at 200 ad 300 °C, was composed of orthorhombic ScOOH (PDF 00–017–0941, Amcm, No.63). The peak intensity did not change by heating at 300 °C or lower. This suggests that crystal growth well proceeds during HT aging. The as-prepared sample of PC series was also composed of orthorhombic ScOOH. However, the diffraction peaks of the as-prepared PC samples were broad indicating the presence of amorphous scandium oxyhydroxides and/or not enough growth of ScOOH. It is reasonable that the crystallites of ScOOH as primary particles are grown during HT aging. Calcination at 400 °C or higher changes the crystal phase from ScOOH to cubic bixbyite Sc2O3 (PDF 01–074–1210, Ia-3, No.206) in both HT and PC samples. The diffraction peaks of bixbyite Sc2O3 became stronger and sharper with raising the calcination temperature. On the other hand, the diffraction peaks of HT samples are sharper and stronger than those of PC samples at the same calcination temperature. This means that the crystallite size of HT catalysts is larger than PC ones at the same calcination conditions. Table 2 summarizes the SA of HT- and PC-Sc2O3 catalysts calcined at different temperatures together with the particle size, D BET and crystallite size, D XRD. The SA of as-prepared HT-Sc2O3 was 58.5 m2 g−1. The SA of HT-Sc2O3 decreased gradually from 58.3 to 15.8 m2 g−1 with increasing the calcination temperature from 400 to 1000 °C. In the HT-Sc2O3, particle size, D BET, and crystallite size, D XRD, well coincide each other at all calcination temperatures. This suggests that HT-Sc2O3 samples consist of well-grown crystallites which exist as primally particles. It should be noted, however, that D XRD calculated from FWHM of diffraction peaks underestimates the crystallite size when the peaks become sharp because of the broadening of incident beam. In the PC-Sc2O3, while the SA of as-prepared sample was 76.3 m2 g−1 and the SA of PC-Sc2O3 increased rapidly to 148.4 m2 g−1 at a calcination of 400 °C. Because there are no large ScOOH crystallites observed in the as-prepared PC-Sc2O3 as shown in XRD pattern, this change can be attributed to the crystallization of amorphous scandium oxyhydroxides rather than the decomposition of a large ScOOH particle into small Sc2O3 crystallites. An increase in the SA observed at 400 °C is attributed to the transition from amorphous scandium oxyhydroxides to Sc2O3. A similar change in SA has been reported in an alumina sample with the transition from Al(OH)3 to Al2O3 [48], where the SA of as-prepared Al(OH)3 was as small as 40 m2 g−1 but increased to 450 m2 g−1 after calcination at 300 °C. The SA of PC-Sc2O3 decreased rapidly from 148.4 to 29.9 m2 g−1 from 400 to 800 °C. During the significant decrease in SA upon calcination, a change in crystallite size is not so large compared to the change in D BET. Therefore, the decrease in SA can be attributed to the aggregation of primally crystallites rather than the crystal growth. In contrast, there observed negligible change in SA in HT samples after calcination at 400 °C irrespective of the occurrence of complete crystal phase change. This suggests that the phase change does not affect the morphology of crystallites in the HT-Sc2O3 samples. Although both HT- and PC-Sc2O3–800 have the same crystal structure, bixbyite Sc2O3, they show different change in the relation between SA and D XRD upon calcination. In order to clarify the reason, we adopted FE-SEM observation. Fig. 2 shows FE-SEM images of several Sc2O3 samples to confirm the morphology of Sc2O3. As-prepared HT sample consists with square-shape thick plates with the size of ca. 50 nm. It is reasonable to grow in plate-shape morphology in orthorhombic ScOOH under HT aging because it has layered structures. In the HT-Sc2O3–800 sample, rounded square plates whose size are similar to those observed in as-aged HT sample remain and they are a main component of the samples. The particle size observed in SEM agrees well with the values of D XRD and D BET (Table 2) so that each particle observed in HT-Sc2O3–800 was composed of single crystallites. That is, ScOOH crystallite grown under HT aging changes to Sc2O3 without the change in morphology. Besides, the fusion of crystallites proceeded when samples were calcined at 900 °C or higher, and then the crystallite size was different from the particle size. On the other hand, the as-prepared PC sample seems to be aggregates of small particles. Most of them would be amorphous scandium oxyhydroxides. In the PC-Sc2O3–800, the sample seems to be a sintered body rather than the aggregates of particles. The size of spherical particles with the plane structure composed the sintered body was 20–30 nm, which agrees with only D XRD but not with D BET (Table 2) because of sintering. The surface of the PC-Sc2O3 sample was flat, and holes were scarcely formed; therefore, the SA decreased, and the crystallite size did not agree with the particle size. It is confirmed that the HT aging of hydroxide precursor results in the growth of ScOOH crystallites and the control of crystallo-morphology of calcined Sc2O3. In our previous report, the morphology of Er2O3 is controlled by HT aging [36]. Er2O3 crystal prepared by HT aging becomes a nanorod structure, while Er2O3 crystals are generally spheres or octahedrons and are called nanoparticles. Table 3 summarizes the SA of the Sc2O3 catalysts prepared at different HT aging periods. The SA of the resulting Sc2O3–800 samples was slightly decreased with extending HT aging time from 4 h. Fig. S2 shows the XRD patterns of the Sc2O3 catalysts prepared in different HT aging periods. Although the patterns of the Sc2O3–800 samples were similar to each other, the peak intensity of the as-prepared samples was increased with extending HT aging time. The D BET and D XRD values slightly increased with extending HT aging time (Table S1), suggesting that the crystallites of ScOOH grew by HT aging and maintained the morphology with high crystallinity after the calcination at 800 °C. The SA of Sc2O3 after calcination was related to that of as-prepared, suggesting that the SA of Sc2O3 decreased with extending HT aging time due to the growth of crystallites. The D BET of PC-Sc2O3 at HT time of 0 h was the largest, and the D BET of HT-Sc2O3 increased as the HT aging time extended. Although sintering of PC-Sc2O3 between primary particles progresses together with the crystallization during the calcination at 800 °C, HT-Sc2O3 showed the growth of ScOOH crystallites during HT aging. This indicates that the large crystallites suppress the sintering between primary particles during calcination. Fig. 3 shows TG profiles of as-prepared ScOOH with different HT aging periods. In the HT samples, the decrease in weight at temperatures below 400 °C is smaller than that of the PC sample at HT time of 0 h. This suggests that HT aging converts amorphous scandium oxyhydroxides into ScOOH single phase and allows growth of ScOOH into plate-like shape, and that amorphous scandium oxyhydroxides in PC sample lose their excess H2O during heating up to 400 °C. It is confirmed that the HT aging promotes crystallization and suppresses the sintering between particles during calcination. Consequently, Sc2O3 with high crystallinity was successfully prepared without a significant decrease in SA even after calcination at 800 °C. 3.3 Acid-base property of Sc2O3 catalysts Fig. 4 shows temperature-programmed desorption (TPD) profiles of CO2 and NH3 adsorbed on HT-Sc2O3–600, HT-Sc2O3–800, and PC-Sc2O3–800 catalysts, where original data are displayed in Fig. S3. Strength distributions of acid and base sites were similar to each other in each Sc2O3 sample. In HT samples, the amounts of acid and base sites decrease with raising the calcination temperature and decreasing the SA. In Fig. 4a, the amount of NH3 desorbed from HT-Sc2O3–600 is larger than the amount of CO2. The amounts of acid and base sites were calculated to be 0.156 and 0.136 mmol g−1 from the profiles up to the desorption temperature of 600 °C, respectively. On the other hand, the amounts of acid and base sites of HT-Sc2O3–800 are very similar (Fig. 4b): the amounts of acid and base sites were calculated to be 0.070 and 0.068 mmol g−1, respectively. Since the adsorption of NH3 and CO2 has been observed at temperatures above 325 °C, the acid and base sites could be poisoned by the probes of NH3 and CO2 during the reaction at 325 °C, respectively. In PC-Sc2O3–800, the amounts of acid and base sites were calculated to be 0.062 and 0.048 mmol g−1, respectively (Fig. 4c). The amounts of acid and base sites were higher in HT-Sc2O3–800 than those of PC-Sc2O3–800. The densities of acid and base sites calculated by dividing the amounts of acid and base sites by the SA were 2.10 and 2.05 μmol m−2 for HT-Sc2O3–800 and 2.06 and 1.60 μmol m−2 for PC-Sc2O3–800, respectively. HT-Sc2O3 could have a higher density of acid and base sites than PC-Sc2O3 due to its high crystallinity leading to better acid-base balance compared to PC-Sc2O3 with rough surfaces. On the other hand, the densities of acid and base sites of HT-Sc2O3–600 were 2.97 and 2.59 μmol m−2, respectively, which are higher than those of HT-Sc2O3–800. Since HT-Sc2O3–800 was more favorable for the dehydration of 2,3-BDO to 3B2OL than HT-Sc2O3–600 (Fig. 5 ), the catalytic activity cannot be explained by only the amount and the density of the acid and base sites. This issue is discussed in the following section related to the reaction mechanism on a specific adsorption site. 3.4 Dehydration of 2,3-BDO to form 3B2OL over HT-Sc2O3 catalysts Fig. 5 shows the effect of calcination temperature of HT- and PC-Sc2O3 catalyst on the SA and the conversion of 2,3-BDO at 325 °C and a W/F of 0.31 h, where the numerical data are summarized in Table S2. The conversion of 2,3-BDO and the selectivity to 3B2OL increased with raising the calcination temperature irrespective of the decrease in the SA. HT-Sc2O3–800 showed the highest 2,3-BDO conversion as well as the highest 3B2OL selectivity (Fig. 5a). Although the 3B2OL selectivity was high over HT-Sc2O3 calcined at 900 °C or higher, the 2,3-BDO conversion decreased, owing to the decrease in the SA. Similarly, in PC-Sc2O3 samples, the 2,3-BDO conversion and the 3B2OL selectivity increased with raising the calcination temperature, regardless of the decrease in SA (Fig. 5b). On the other hand, the highest 2,3-BDO conversion and 3B2OL selectivity were observed for PC-Sc2O3–700. HT-Sc2O3 showed higher 3B2OL selectivity than PC-Sc2O3 at all calcination temperatures (Fig. 5c). Similarly, the effect of calcination temperature on the 2,3-BDO conversion has also been observed in the other commercially available Sc2O3 catalyst [27]. It is indicated that the calcination at high temperatures induces the growth of well-crystallized Sc2O3 particles and the construction of effective surfaces for the dehydration of 2,3-BDO to 3B2OL. To investigate the effect of HT aging time, we conducted activity tests using Sc2O3 prepared in different aging periods (Table 3). As the HT aging time extended, the 3B2OL selectivity increased, and the conversion decreased. At a long aging time of 72 h, on the other hand, the 3B2OL selectivity decreased. However, both the conversion and the 3B2OL selectivity were higher than those of PC-Sc2O3 with the aging time of 0 h. As shown in Table S1, the D XRD increases with extending the HT aging time, suggesting that the crystallites grew during the HT aging, and the high crystallinity was maintained after calcination. As a result, the HT-aged catalysts showed high 3B2OL selectivity. As the HT aging time extended, the SA of HT-Sc2O3–800 decreased. The longer the HT aging time, the smaller the SA becomes due to the growth of crystallites. Thus, the shorter HT aging time results in a larger SA and thus provided a higher conversion. We performed catalytic reactions over HT-Sc2O3–800 at a constant W/F = 0.31 h and different temperatures (Fig. 6 and Table S3). The 2,3-BDO conversion increased with increasing the reaction temperature, and the complete conversion was attained at 375 °C or higher. The 3B2OL selectivity decreased with increasing the temperature through a maximum of 325 °C, while the selectivity to BD, MEK, and ethanol increased. It is suggested that high temperatures promote the consecutive dehydration and the decomposition of 3B2OL. At temperatures of 375 and 400 °C, the MEK selectivity was higher than 350 and 411 °C. Fig. S4 shows the changes in catalytic activity with TOS at 350, 375, 400, and 411 °C. The MEK selectivity increased with TOS, and the BD selectivity decreased at 375 and 400 °C, and the 3B2OL selectivity also decreased with TOS at 400 °C. It has been reported that the dehydration of MEK to BD does not proceed in the reaction of MEK at 425 °C over Sc2O3 catalyst [14], and thus MEK is not an intermediate to BD at temperatures of 425 °C and lower. These results suggest that the active sites for the formation of 3B2OL and BD deactivate with TOS and that the MEK formation proceeds at different active sites, which could increase the MEK selectivity. At a reaction temperature of 411 °C, the MEK selectivity was stable and remained low during the initial 5 h; at 425 °C or higher, the MEK selectivity increased with TOS, suggesting that a reaction temperature lower than 425 °C is preferable for the selective formation of BD. At a reaction temperature of 475 °C, the BD selectivity decreased in favor of the MEK formation. Fig. 7 shows the effect of space time, W/F, on the 2,3-BDO conversion and the 3B2OL selectivity over HT-Sc2O3–800 at 325 °C, where the numerical data are listed in Table S4. The space time, W/F, was controlled by the variation of W at a constant F. The 2,3-BDO conversion increased with increasing the space time. At a W/F = 0.94 h, the 2,3-BDO conversion of 98.7% was attained with the highest 3B2OL yield of 81.9%. However, the 3B2OL selectivity was decreased with a further increase in the space time, and the selectivity to MEK, BD, and ethanol increased. Thus, the high space time at 325 °C would induce the sequential dehydration and the decomposition of 3B2OL. Fig. 8 shows the changes in the 2,3-BDO conversion and the 3B2OL selectivity with TOS in the extended run test over HT-Sc2O3–800 at 325 °C and a W/F = 0.31 h. Both the 2,3-BDO conversion and the 3B2OL selectivity were gradually decreased in an N2 flow all through the run of 30 h. In an H2 carrier gas, the 2,3-BDO conversion was relatively stable, whereas the decrease in the conversion for the initial 10 h. In the H2 flow, the 3B2OL selectivity was maintained at a high level of 90% for 30 h. Although the 2,3-BDO conversion in H2 flow was lower than that in N2 flow in the initial reaction period, that in H2 flow became higher than that in N2 flow at TOS longer than 15 h. An H2 carrier gas sometimes accelerates the formation rate, and sometimes depressed it. It has been reported in the literature that the acceleration by H2 in the formation of unsaturated alcohols (UOLs) in the dehydration of 1,4-BDO over Y2Zr2O7 [39] and CaO-modified ZrO2 (CaO/ZrO2) [49]. In contrast, the formation rate of UOLs is depressed in H2 flow in the dehydration of 1,3-BDO over Er2O3 and CeO2 [50]. Besides, in the formation of BD from 2,3-BDO over Sc2O3 [14], H2 accelerates the formation. In Fig. 8, however, H2 depressed the initial catalytic activity of Sc2O3 in the formation of 3B2OL from 2,3-BDO, but it decreased the depression rate resulting in the stable catalytic activity in a long run compared to N2 carrier gas. It is not easy to explain the effect of H2 carrier gas, because the effect of H2 carrier gas depends on the types of reactants and catalysts. 3.5 Effect of carrier gas on the dehydration of 2,3-BDO over HT-Sc2O3 catalysts In our previous report, a poisoning experiment using NH3 and CO2 carrier gas is performed in the dehydration of 2,3-BDO over CaO/ZrO2 [28]: the formation of 3B2OL decreased in both gases. The poisoning results indicate that the dehydration of 2,3-BDO to 3B2OL is catalyzed by acid and base sites of the CaO/ZrO2 via a base-acid concerted mechanism. Furthermore, it should be noticed that the dehydration of 2,3-BDO also proceeds over strong acidic alumina and zeolites, and the stepwise dehydration of 3B2OL to BD was promoted by the acid sites in addition to the formation of 3B2OL [15,18]. The TPD profiles displayed in Fig. 4 show that NH3 and CO2 are adsorbed even at temperatures higher than the reaction temperature of 325 °C. Therefore, during the reaction at 325 °C, the acid and base sites on the Sc2O3 surface are poisoned in the presence of NH3 and CO2, respectively. To clarify the functions of acid and base of the Sc2O3 catalyst, we examined the poisoning experiments using NH3 and CO2 carrier gases. Table 4 summarizes the average conversion in the catalytic activities with different poisoning gases at 325 °C, while Fig. S5 shows the changes in the conversion and the selectivity with TOS. The 2,3-BDO conversion was partially reduced in both CO2 and NH3 carrier gases. The 3B2OL selectivity significantly decreased in the CO2 carrier gas, while the selectivity in the NH3 carrier gas was close to the level in the N2 carrier gas. The fact that both the conversion and the 3B2OL selectivity significantly decreased with CO2 indicates that the poisoning effect of CO2 is higher than that of NH3. The basic site of the catalyst plays the most significant role in the formation of 3B2OL from 2,3-BDO, while the acid site also supports the dehydration of 2,3-BDO. It is suggested that the dehydration of 2,3-BDO to 3B2OL on the HT-Sc2O3 catalyst proceeds in a base-acid concerted reaction, in which the surface Sc3+ (acid site) trapped the OH group of 2,3-BDO and the surface O2− (basic site) withdrew the H at position 1 of 2,3-BDO, as previously reported [28]. The results of the poisoning experiment are consistent with those obtained for the dehydration of 2,3-BDO to 3B2OL [28] and 1,4-BDO to 3-buten-1-ol over CaO/ZrO2 catalyst [49]. 3.6 Dehydration of 2,3-BDO to form BD over HT-Sc2O3 catalysts In the conversion of 2,3-BDO at 325 °C, HT-Sc2O3 showed the highest conversion and 3B2OL selectivity due to its high crystallinity and SA. PC-Sc2O3 and CM-Sc2O3 have lower activity than HT-Sc2O3, as presented in Table 1. Table 5 shows the comparison at 411 °C and a W/F = 0.94 h with 100% conversion. HT-Sc2O3 showed the highest BD yield and the order of BD yield was HT-Sc2O3 > PC-Sc2O3 > CM-Sc2O3. PC-Sc2O3 showed higher BD yield than CM-Sc2O3 due to the higher SA of PC-Sc2O3. The HT-Sc2O3 achieved a BD yield of 57.1%, which is comparable to the BD yield of 67% under the same conditions: in N2 flow at 411 °C and a W/F = 0.94 h [14]. Thus, we successfully prepared Sc2O3 with high crystallinity without a significant decrease in SA even after calcination at 800 °C (Table 2). Therefore, HT-Sc2O3 is advantageous for the dehydration of 2,3-BDO to BD through 3B2OL due to its high crystallinity and SA. To achieve high BD yields, activity tests at different W/F were performed over HT-Sc2O3 at a high temperature of 411 °C (Fig. 9 ), where the numerical data are listed in Table S5. At 411 °C, the complete conversion of 2,3-BDO was attained regardless of the W/F. The BD yield increased with increasing W/F, and the 3B2OL yield decreased, suggesting that BD is obviously a secondary product obtained in the dehydration of 3B2OL. However, the MEK yield was almost constant when the W/F was changed. These results suggest that the dehydration to MEK is a concurrent reaction with the dehydration to 3B2OL and BD, and thus 3B2OL and MEK are primary products. At a W/F = 2.5 h, most of the 3B2OL were consumed, and a BD yield of 80.0% was achieved. We investigated the effect of reaction temperature over HT-Sc2O3–800 at a high space time, W/F = 2.5 h (Fig. 10 ). As the reaction temperature increased, the BD yield increased, while the 3B2OL yield decreased. The highest BD yield of 81.6% was achieved at 400 °C. At a reaction temperature of 411 °C or higher, 3B2OL was completely consumed, but the BD yield decreased slightly due to the increase in the yields of butenes and CO2. Fig. 11 shows the change in the BD yield with TOS in an extended run test over HT-Sc2O3–800 at different reaction temperatures and a W/F = 2.5 h, where the numerical data are listed in Table S6. At reaction temperatures lower than 400 °C, deactivation was observed in the early stages of 6 h, after which the stabilization of the activity. At 411 °C, the activity was stable for 10 h. Before the reaction, the color of the catalyst was white. After the reaction, the color was gray at all reaction temperatures, suggesting that the deactivation was caused by coke deposition. 3.7 Discussion on the active center for the dehydration of 2,3-BDO In the dehydration of 1,3-BDO, it has been reported that the most stable surface of Yb2Zr2O7 [34] and CeO2 [51,52] with a cubic fluorite-type structure is (111), and the oxygen defect point on the (111) surface acts as the active site. To explain the active site in the dehydration of 2,3-BDO, crystal models of cubic Sc2O3 are shown in Fig. 12 [41–43]. Since the most stable plane of bixbyite structures such as rare earth oxides and In2O3 is reported to be the (222) plane [32,38], the most stable plane of bixbyite Sc2O3 is also considered to be the (222) plane. Fig. 12a shows a cube of Sc2O3 with (100) planes, and Fig. 12b shows a cross-section of a (222) plane of the Sc2O3 cube. Fig. 12c illustrates the top view of the (222) plane of bixbyite Sc2O3, the upper three layers of the (222) plane shown in Fig. 12b. In a large (222) surface shown in Fig. 12d, six oxygen-vacancy clusters, which are composed of four oxygen vacancies gathered in three-rayed star-shape, are observed, and nine Sc3+ cations are regularly exposed on an oxygen-vacancy cluster (Fig. 12e), as surrounded by the large blue dotted circles in Fig. 12d. In Section 3.5, it is suggested that the dehydration of 2,3-BDO to 3B2OL over Sc2O3 catalyst proceeds by a base-acid concerted reaction in which the surface Sc3+ cations (acid sites) adsorb two OH groups of 2,3-BDO and the surface O2− (basic site) withdraws the position-1 H of 2,3-BDO (Scheme 2 a). The active site could be provided by the three-rayed star-shaped oxygen vacancies on the surface of Sc2O3 (Fig. 12d), on which two Sc3+ cations and a surface O2− were exposed (Fig. 12f). In yttrium zirconate, Y2Zr2O7, with a cubic fluorite structure, 1/8 of the oxygen-occupied sites on the surface are oxygen vacancies [39], but Y2Zr2O7 is not active in the dehydration of 2,3-BDO to 3B2OL (Table 1). On the other hand, Sc2O3 and In2O3 with a bixbyite structure showed high activity in the dehydration of 2,3-BDO in this study. The increased activity over Sc2O3 is probably due to four oxygen vacancies in the form of a three-rayed star and a specific length between Sc3+ cations, facilitating the adsorption of 2,3-BDO on the exposed cation sites due to their spatial extent. Correlation between the ionic radius of cation in the oxide and the catalytic activity has been discussed in the dehydration of BDOs over rare earth oxides [9,53] and rare earth zirconate catalysts [39]. Therefore, we further discuss the correlation between the ionic radius and the catalytic activity on four rare earth oxides and In2O3 used in this study. Since the reaction is expected to be accelerated through the adsorption of the two OH groups of 2,3-BDO (Scheme 2a) on any of the three central cations (triangle in Fig. 12e) among nine exposed cations (Fig. 12e), the length between the central cations in the rare earth oxides and In2O3 (a1 in Fig. 12e) was determined by the VESTA modeling [41]. Table 6 summarizes the length in M-M (a1 in Fig. 12e) and M-O (b1 and b2 in Fig. 12f) of bixbyite-type oxides such as Sc2O3, In2O3, Yb2O3, Y2O3, and Dy2O3, where M is a metal cation. The M-M length varied from the smallest 3.76 Å in Sc2O3 to the largest 4.05 Å in Dy2O3. On the other hand, in an optimized model structure of meso-2,3-BDO (Fig. S1, as described in Section 2.2), the O-O length between the OH groups and the O-H length between the position-1 hydrogen and the position-2 OH group were determined to be 2.95 and 2.69 Å, respectively. The optimized O-O distance between OH groups in meso-2,3-BDO, 2.95 Å is smaller than the M-M lengths of the catalysts. The M-M length of 3.76 Å for Sc2O3 is the closest value to the O-O distance, 2.95 Å among the five oxides listed in Table 6. Sc2O3 and In2O3 with short M-M lengths could be well fitted to the optimized O-O distance of OH groups in meso-2,3-BDO, while Yb2O3, Y2O3, and Dy2O3 with long M-M lengths would be misfitted. We think that this could be the most crucial reason that Sc2O3 and In2O3 are only active for the dehydration of 2,3-BDO. Besides, the M-O length, b1 (shown in Fig. 12f), might be necessary for the adsorption of 2,3-BDO. The b1 length varied from 4.66 Å of Sc2O3 to 5.00 Å of Dy2O3, and the length should be fitted to the OH distance between the position-1 hydrogen and the position-2 OH group, 2.69 Å (Section 2.2 and Fig. S1). Even in Sc2O3, the b1 length of 4.66 Å would be long to fit with the OH distance of 2.69 Å in 2,3-BDO, but the b1 length of 5.00 Å in Dy2O3 is too long to create enough interaction between 2,3-BDO and Dy2O3 surface. In the actual reaction, the OO distance between the OH groups of 2,3-BDO can vary from the optimized value. In addition, the dehydration of 1,4-BDO can be effectively catalyzed by Yb2O3, Y2O3, and Dy2O3 rather than by Sc2O3 [37]. The OH distance between the position-2 hydrogen and the position-1 OH group of 1,4-BDO would be close to that of 2,3-BDO. Thus, the OH distance could be fitted to the M-O lengths in the range between 4.66 and 5.00 Å. Also, in the adsorption of 1,4-BDO with a flexible structure, the OO distance between the OH groups could be tunable to the M-M length. Therefore, we can conclude that cubic bixbyite Sc2O3 with the smallest M-M length as well as In2O3 with the second smallest one is the most active in the dehydration of 2,3-BDO and that the other rare earth oxides with the large M-M lengths are scarcely active (Table 6). This geometric consideration could explain that the well-crystallized bixbyite Sc2O3 has high activity in the dehydration of 2,3-BDO because the (222) plane, on which oxygen vacancies are arranged symmetrically, is the most stable plane. Oxygen-vacancy clusters with exposed Sc3+ cations on the surface would provide uniform active sites for the dehydration of 2,3-BDO, as shown in Fig. 12f. HT-Sc2O3 was highly crystallized so that the surface oxygen-deficient clusters are spread homogeneously on the surface, leading to high selectivity to a specific product, 3B2OL. Since the ionic radius of Sc is the smallest in the rare earth cations [9,12], the smallest Sc-Sc length in Sc2O3 among the rare earth oxides with a bixbyite structure is suggested to be the most favorable for the adsorption site of 2,3-BDO to activate the dehydration. There is an exception: In2O3 exhibits the highest formation rate of 3B2OL with a moderate selectivity (Table 6), indicating that the redox property of In2O3 may concern the activation of 2,3-BDO, as observed in the dehydration of 1,4-BDO over In2O3 [32] and 1,3-BDO over cubic fluorite CeO2 [38,54]. Finally, we discussed the formation of BD from 3B2OL. In the comparison of dehydration of 3B2OL with 2-butanol, 3B2OL had higher reactivity to form BD than 2-butanol to form butene isomers over Sc2O3 at 350 °C (Fig. S6), while both of the reactions were deactivated in the initial period for 5 h. This is harmonized with a recent report [55]: the reactivity of UOLs such as 3B2OL, 2-buten-1-ol, and 3-buten-1-ol is higher than that of saturated alcohols such as 1-butanol and 2-butanol in the dehydration of C4 monoalcohol over Y2Zr2O7. The C=C double bond of 3B2OL could have an attractive interaction with Sc3+ cation of Sc2O3 surface (Scheme 2b), thereby promoting the dehydration to BD. Because the strength of the interaction of 2,3-BDO with Sc3+ cation is higher than that between 3B2OL and Sc3+ cation, it is probable that the dehydration of 2,3-BDO proceeds stepwise: the dehydration of 2,3-BDO to 3B2OL proceeds preferentially at < 350 °C (Scheme 2a) and the following dehydration of 3B2OL to BD proceeds at > 350 °C (Scheme 2b) in Figs. 6 and 11. 4 Conclusions Vapor-phase catalytic dehydration of 2,3-BDO to form BD through 3B2OL was studied over Sc2O3 catalysts prepared through hydrothermal aging. Crystallization of ScOOH during HT aging significantly affected the catalytic activity of the resulting Sc2O3 catalysts in the dehydration of 2,3-BDO: the catalytic activity of HT-aged Sc2O3 was twice as high as that of non-hydrothermal samples and a commercial one irrespective of the specific surface areas. Calcination at 800 °C or higher is also efficient for the selective formation of 2,3-BDO to form 3B2OL. In the formation of BD from 2,3-BDO at 411 °C, Sc2O3 aged at 200 °C followed by the calcination at 800 °C showed excellent catalytic activity with the BD yield of 80%. The catalytic activity of Sc2O3 was reduced in acidic and basic carrier gases such as CO2 and NH3, and thus the dehydration of 2,3-BDO proceeds via a base-acid concerted mechanism over Sc2O3 catalysts. In a (222) plane model of bixbyite Sc2O3, it was concluded that oxygen-deficient clusters provided uniform active sites for the dehydration of 2,3-BDO to BD through 3B2OL in the vapor phase. The importance of the distance of Sc-Sc of the Sc2O3 surface was discussed on the activation of the 2,3-BDO molecule. The active sites for the dehydration were proposed to be a triangle of two Sc3+ and an O2− on the oxygen vacancy of Sc2O3. CRediT authorship contribution statement Kazuki Nakazono: Conceptualization, Data curation, Visualization, Writing – original draft. Ryoji Takahashi: Data curation, Writing – review & editing. Yasuhiro Yamada: Supervision, Validation. Satoshi Sato: Project administration, Funding acquisition, Writing – review & editing. Declaration of Competing Interest We declare no conflict of interest. We have no known competing financial interests or personal relationships that could have appeared to influence the work reported in this paper. Acknowledgment This work was supported by JSPS KAKENHI KIBAN B Grant Numbers JP18H01784 and JP21H01711. Supplementary materials Supplementary material associated with this article can be found, in the online version, at doi:10.1016/j.mcat.2021.111996. Appendix Supplementary materials Image, application 1 References [1] X.J. Ji H. Huang P.K. Ouyang Microbial 2,3-butanediol production: a state-of-the-art review Biotechnol. Adv. 29 2011 351 364 X.J. Ji, H. Huang, P.K. Ouyang, Biotechnol. Adv.29 (2011) 351–364. [2] A.P. Zeng W. Sabra Microbial production of diols as platform chemicals: Recent progresses Curr. Opin. Biotechnol. 22 2011 749 757 A.P. Zeng, W. Sabra, Curr. Opin. Biotechnol.22 (2011) 749–757. [3] Y.S. Jang B. Kim J.H. Shin Y.J. Choi S. Choi C.W. Song J. Lee H.G. Park S.Y. Lee Bio-based production of C2–C6 platform chemicals Biotechnol. Bioeng. 109 2012 2437 2459 Y.S. Jang, B. Kim, J.H. Shin, Y.J. Choi, S. Choi, C.W. Song, J. Lee, H.G. Park, S.Y. Lee, Biotechnol. Bioeng.109 (2012) 2437–2459. [4] Y. Jiang Liu W H. Zou T. Cheng N. Tian Xian M Microbial production of short chain diols Microb. Cell Factories 13 2014 165 Y. Jiang, W, Liu, H. Zou, T. Cheng, N. Tian, M, Xian, Microb. Cell Factories13 (2014) 165. [5] W. Sabra C. Groeger A.P. Zeng Microbial Cell Factories for Diol Production Adv. Biochem. Eng. Biotechnol. 155 2016 165 197 W. Sabra, C. Groeger, A.P. Zeng, Adv. Biochem. Eng. Biotechnol.155 (2016) 165–197. [6] T. Yang Z. Rao X. Zhang M. Xu Z. Xu S.T. Yang Metabolic engineering strategies for acetoin and 2,3-butanediol production: advances and prospects Crit. Rev. Biotechnol. 37 2017 990 1005 T. Yang, Z. Rao, X. Zhang, M. Xu, Z. Xu, S.T. Yang, Crit. Rev. Biotechnol.37 (2017) 990–1005. [7] D. Tinoco C. Pateraki A.A. Koutinas D.M.G. Freire Bioprocess Development for 2,3-Butanediol Production by Paenibacillus Strains ChemBioEng Rev 8 2021 44 62 D. Tinoco, C. Pateraki, A.A. Koutinas, D.M.G. Freire, ChemBioEng Rev. 8 (2021) 44–62. [8] M.E. Winfield The catalytic dehydration of 2,3-butanediol to 1,3-butadiene J. Council Sci. Ind. Res. 18 1945 412 423 Winfield M.E., J. Council Sci. Ind. Res.18 (1945) 412–423. [9] D. Sun Y. Li C. Yang Y. Su Y. Yamada S. Sato Production of 1,3-butadiene from biomass-derived C4 alcohols Fuel Process. Technol. 179 2020 106193 D. Sun, Y. Li, C. Yang, Y. Su, Y. Yamada, S. Sato, Fuel Process. Technol.179 (2020) 106193. [10] H. Duan Y. Yamada S. Sato Vapor-phase hydrogenation of acetoin and diacetyl into 2,3-butanediol over supported metal catalysts Catal. Commun. 99 2017 53 56 H. Duan, Y. Yamada, S. Sato, Catal. Commun.99 (2017) 53–56. [11] H. Zhang S. Xie J. Hu X. Wu Q. Zhang J. Cheng Y. Wang C–H activations of methanol and ethanol and C–C couplings into diols by zinc–indium–sulfide under visible light Chem. Commun. 56 2020 1776 1779 H. Zhang, S. Xie, J. Hu, X. Wu, Q. Zhang, J. Cheng, Y. Wang, Chem. Commun.56 (2020) 1776–1779. [12] H. Duan Y. Yamada S. Sato Future Prospect of the Production of 1,3-Butadiene from Butanediols Chem. Lett. 45 2016 1036 1047 H. Duan, Y. Yamada, S. Sato, Chem. Lett.45 (2016) 1036–1047. [13] F. Zeng K. Hohn Catalytic Conversion of Biomass-derived Compounds to C4 Chemicals Catalysis 31 2019 1 36 F. Zeng, K. Hohn, Catalysis31 (2019) 1–36. [14] H. Duan Y. Yamada S. Sato Efficient production of 1,3-butadiene in the catalytic dehydration of 2,3-butanediol Appl. Catal. A Gen. 491 2015 163 169 H. Duan, Y. Yamada, S. Sato, Appl. Catal. A Gen.491 (2015) 163–169. [15] H. Duan D. Sun Y. Yamada S. Sato Dehydration of 2,3-butanediol into 3-buten-2-ol catalyzed by ZrO2 Catal. Commun. 48 2014 1 4 H. Duan, D. Sun, Y. Yamada, S. Sato, Catal. Commun.48 (2014) 1–4. [16] X. Liu V. Fabos S. Taylor D.W. Knight K. Whiston G.J. Hutchings One-step production of 1,3-butadiene from 2,3-butanediol Dehydration Chem. Eur. J. 22 2016 12290 12294 X. Liu, V. Fabos, S. Taylor, D.W. Knight, K. Whiston, G.J. Hutchings, Chem. Eur. J.22 (2016) 12290–12294. [17] F. Zeng W.J. Tenn S.N.V.K. Aki J. Xu B. Liu K.L. Hohn Influence of basicity on 1,3-butadiene formation from catalytic 2,3-butanediol dehydration over γ-alumina J. Catal. 344 2016 77 89 F. Zeng, W.J. Tenn, S.N.V.K. Aki, J. Xu, B. Liu, K.L. Hohn, J. Catal.344 (2016) 77–89. [18] W. Zhang D. Yu X. Jia H. Huang Efficient dehydration of bio-based 2,3-butanediol to butanone over boric acid modified HZSM-5 zeolitesEfficient dehydration of bio-based 2,3-butanediol to butanone over boric acid modified HZSM-5 zeolites Green Chem. 14 2012 3441 3450 W. Zhang, D. Yu, X. Jia, H. Huang, Green Chem.14 (2012) 3441–3450. [19] M.A. Nikitina I.I. Ivanova Conversion of 2,3-Butanediol over Phosphate Catalysts ChemCatChem 8 2016 1346 1353 M.A. Nikitina, I.I. Ivanova, ChemCatChem8 (2016) 1346–1353. [20] D. Tsukamoto S. Sakami M. Ito K. Yamada T. Yonehara Production of Bio-based 1,3-Butadiene by Highly Selective Dehydration of 2,3-Butanediol over SiO2-supported Cesium Dihydrogen Phosphate Catalyst Chem. Lett. 45 2016 831 833 D. Tsukamoto, S. Sakami, M. Ito, K. Yamada, T. Yonehara, Chem. Lett.45 (2016) 831–833. [21] W. Kim W. Shin K.J. Lee H. Song H.S. Kim D. Seung I.N. Filimonov 2,3-Butanediol dehydration catalyzed by silica-supported sodium phosphates Appl. Catal. A Gen. 511 2016 156 167 W. Kim, W. Shin, K.J. Lee, H. Song, H.S. Kim, D. Seung, I.N. Filimonov, Appl. Catal. A Gen.511 (2016) 156–167. [22] W. Kim W. Shin K.J. Lee Y.S. Cho H.S. Kim I.N. Filimonov 2,3-Butanediol dehydration catalyzed by silica-supported alkali phosphates Appl. Catal. A Gen. 570 2019 148 163 W. Kim, W. Shin, K.J. Lee, Y.S. Cho, H.S. Kim, I.N. Filimonov, Appl. Catal. A Gen.570 (2019) 148–163. [23] D. Song Kinetic Model Development for Dehydration of 2,3-Butanediol to 1,3-Butadiene and Methyl Ethyl Ketone over an Amorphous Calcium Phosphate Catalyst Ind. Eng. Chem. Res. 55 2016 11664 11671 D. Song, Ind. Eng. Chem. Res.55 (2016) 11664–11671. [24] N.T.T. Nguyen F. Matei-Rutkovska M. Huchede K. Jaillardon G. Qingyi C. Michel J.M.M. Millet Production of 1,3-butadiene in one step catalytic dehydration of 2,3-butanediol Catal. Today 323 2019 62 68 N.T.T. Nguyen, F. Matei-Rutkovska, M. Huchede, K. Jaillardon, G. Qingyi, C. Michel, J.M.M. Millet, Catal. Today323 (2019) 62–68. [25] M. Huchede N.T.T. Nguyen L. Cardenas M. Aouine K. Jaillardon J.M.M. Millet Structure Sensitivity of 2,3-Butanediol Dehydration to Butadiene over Rare Earth Orthophosphate Catalysts J. Phys. Chem. C 124 2020 2060 2069 M. Huchede, N.T.T. Nguyen, L. Cardenas, M. Aouine, K. Jaillardon, J.M.M. Millet, J. Phys. Chem. C124 (2020) 2060–2069. [26] D. Song S.Y. Cho T.T. Vu H.P.Y. Duong E. Kim Dehydration of 2,3-Butanediol to 1,3-Butadiene and Methyl Ethyl Ketone: Modeling, Numerical Analysis and Validation Using Pilot-Scale Reactor Data Catalysts 11 2021 999 D. Song, S.Y. Cho, T.T. Vu, H.P.Y. Duong, E. Kim, Catalysts11 (2021) 999. [27] H. Duan Y. Yamada S. Sato Vapor-phase Catalytic Dehydration of 2,3-Butanediol into 3-Buten-2-ol over Sc2O3 Chem. Lett. 43 2014 1773 1775 H. Duan, Y. Yamada, S. Sato, Chem. Lett.43 (2014) 1773–1775. [28] H. Duan Y. Yamada S. Sato Selective dehydration of 2,3-butanediol to 3-buten-2-ol over ZrO2 modified with CaO Appl. Catal. A Gen. 487 2014 226 233 H. Duan, Y. Yamada, S. Sato, Appl. Catal. A Gen.487 (2014) 226–233. [29] H. Duan Y. Yamada S. Kubo S. Sato Vapor-phase catalytic dehydration of 2,3-butanediol to 3-buten-2-ol over ZrO2 modified with alkaline earth metal oxides Appl. Catal. A Gen. 530 2017 66 74 H. Duan, Y. Yamada, S. Kubo, S. Sato, Appl. Catal. A Gen.530 (2017) 66–74. [30] S. Ohtsuka T. Nemoto R. Yotsumoto Y. Yamada F. Sato R. Takahashi S. Sato Vapor-phase catalytic dehydration of butanediols to unsaturated alcohols over yttria-stabilized zirconia catalysts Appl. Catal. A Gen. 575 2019 48 57 S. Ohtsuka, T. Nemoto, R. Yotsumoto, Y. Yamada, F. Sato, R. Takahashi, S. Sato, Appl. Catal. A Gen.575 (2019) 48–57. [31] K. Abe Y. Ohishi T. Okada Y. Yamada S. Sato Vapor-phase catalytic dehydration of terminal diols Catal. Today 164 2011 419 424 K. Abe, Y. Ohishi, T. Okada, Y. Yamada, S. Sato, Catal. Today164 (2011) 419–424. [32] M. Segawa S. Sato M. Kobune T. Sodesawa T. Kojima S. Nishiyama N. Ishizawa Vapor-phase catalytic reactions of alcohols over bixbyite indium oxide J. Mol. Catal. A Chem. 310 2009 166 173 M. Segawa, S. Sato, M. Kobune, T. Sodesawa, T. Kojima, S. Nishiyama, N. Ishizawa, J. Mol. Catal. A Chem.310 (2009) 166–173. [33] R. Takahashi I. Yamada A. Iwata N. Kurahashi S. Yoshida S. Sato Synthesis of 3-buten-1-ol from 1,4-butanediol over indium oxide Appl. Catal. A Gen. 383 2010 134 140 R. Takahashi, I. Yamada, A. Iwata, N. Kurahashi, S. Yoshida, S. Sato, Appl. Catal. A Gen.383 (2010) 134–140. [34] T. Nemoto Y. Yamada F. Sato R. Takahashi S. Sato Catalytic dehydration of 1,3-butanediol over oxygen-defected fluorite Yb2Zr2O7 Mol. Catal. 473 2019 110399 T. Nemoto, Y. Yamada, F. Sato, R. Takahashi, S. Sato, Mol. Catal.473 (2019) 110399. [35] Y. Matsumura A. Matsuda Y. Yamada S. Sato Selective Production of 1,3-Butadiene from 1,3-Butanediol over Y2Zr2O7 Catalyst Bull. Chem. Soc. Jpn. 94 2021 1651 1658 Y. Matsumura, A. Matsuda, Y. Yamada, S. Sato, Bull. Chem. Soc. Jpn.94 (2021) 1651–1658. [36] F. Sato Y. Yamada S. Sato Preparation of Er2O3 Nanorod Catalyst without Using Organic Additive and Its Application to Catalytic Dehydration of 1,4-Butanediol Chem. Lett. 41 2012 593 594 F. Sato, Y. Yamada, S. Sato, Chem. Lett.41 (2012) 593–594. [37] S. Sato R. Takahashi M. Kobune H. Gotoh Basic properties of rare earth oxides Appl. Catal. A Gen. 356 2009 57 63 S. Sato, R. Takahashi, M. Kobune, H. Gotoh, Appl. Catal. A Gen.356 (2009) 57–63. [38] S. Sato F. Sato H. Gotoh Y. Yamada Selective Dehydration of Alkanediols into Unsaturated Alcohols over Rare Earth Oxide Catalysts ACS Catal. 3 2013 721 734 S. Sato, F. Sato, H. Gotoh, Y. Yamada, ACS Catal.3 (2013) 721–734. [39] A. Matsuda Y. Matsumura K. Nakazono F. Sato R. Takahashi Y. Yamada S. Sato Dehydration of Biomass-Derived Butanediols over Rare Earth Zirconate Catalysts Catalysts 10 2020 1392 A. Matsuda, Y. Matsumura, K. Nakazono, F. Sato, R. Takahashi, Y. Yamada, S. Sato, Catalysts10 (2020) 1392. [40] D.R. Lide CRC Handbook of Chemistry and Physics 82th Ed. 2001 CRC Press D.R. Lide, CRC Handbook of Chemistry and Physics82th Ed. (2001) CRC Press. [41] K. Momma F. Izumi VESTA 3 for three-dimensional visualization of crystal, volumetric and morphology data J. Appl. Crystallogr. 44 2011 1272 1276 K. Momma, F. Izumi, J. Appl. Crystallogr.44 (2011) 1272–1276. [42] Y. Xu M. Yamazaki P. Villars Inorganic Materials Database for Exploring the Nature of Material Jpn. J. Appl. Phys. 50 2011 11RH02 Y. Xu, M. Yamazaki, P. Villars, Jpn. J. Appl. Phys.50 (2011) 11RH02. [43] T. Schleid G. Meyer Inorganic Materials Database for Exploring the Nature of Material J. Less Common Met. 149 1989 73 80 T. Schleid, G. Meyer, J. Less Common Met.149 (1989) 73–80. [44] V.N. German A.M. Podurets L.A. Tarasova Single crystals of rare earth oxides from reducing halide melts Inorg. Mater. 18 1982 1492 1494 V.N. German, A.M. Podurets, L.A. Tarasova, Inorg. Mater.18 (1982) 1492–1494. [45] D. Taylor Br. Ceram. Trans. J. 83 1984 92 98 D. Taylor, Br. Ceram. Trans. J.83 (1984) 92–98. [46] M.J. Frisch G.W. Trucks H.B. Schlegel G.E. Scuseria M.A. Robb J.R. Cheeseman G. Scalmani V. Barone G.A. Petersson H. Nakatsuji X. Li M. Caricato A.V. Marenich J. Bloino B.G. Janesko R. Gomperts B. Mennucci H.P. Hratchian J.V. Ortiz A.F. Izmaylov J.L. Sonnenberg D. Williams-Young F. Ding F. Lipparini F. Egidi J. Goings B. Peng A. Petrone T. Henderson D. Ranasinghe V.G. Zakrzewski J. Gao N. Rega G. Zheng W. Liang M. Hada M. Ehara K. Toyota R. Fukuda J. Hasegawa M. Ishida T. Nakajima Y. Honda O. Kitao H. Nakai T. Vreven K. Throssell J.A. Montgomery J.E. Peralta F. Ogliaro M.J. Bearpark J.J. Heyd E.N. Brothers K.N. Kudin V.N. Staroverov T.A. Keith R. Kobayashi J. Normand K. Raghavachari A.P. Rendell J.C. Burant S.S. Iyengar J. Tomasi M. Cossi J.M. Millam M. Klene C. Adamo R. Cammi J.W. Ochterski R.L. Martin K. Morokuma O. Farkas J.B. Foresman D.J. Fox Gaussian 16, Revision C.01 2016 Gaussian Inc. Wallingford CT M.J. Frisch, G.W. Trucks, H.B. Schlegel, G.E. Scuseria, M.A. Robb, J.R. Cheeseman, G. Scalmani, V. Barone, G.A. Petersson, H. Nakatsuji, X. Li, M. Caricato, A.V. Marenich, J. Bloino, B.G. Janesko, R. Gomperts, B. Mennucci, H.P. Hratchian, J.V. Ortiz, A.F. Izmaylov, J.L. Sonnenberg, D. Williams-Young, F. Ding, F. Lipparini, F. Egidi, J. Goings, B. Peng, A. Petrone, T. Henderson, D. Ranasinghe, V.G. Zakrzewski, J. Gao, N. Rega, G. Zheng, W. Liang, M. Hada, M. Ehara, K. Toyota, R. Fukuda, J. Hasegawa, M. Ishida, T. Nakajima, Y. Honda, O. Kitao, H. Nakai, T. Vreven, K. Throssell, J.A. Montgomery, J.E. Peralta, F. Ogliaro, M.J. Bearpark, J.J. Heyd, E.N. Brothers, K.N. Kudin, V.N. Staroverov, T.A. Keith, R. Kobayashi, J. Normand, K. Raghavachari, A.P. Rendell, J.C. Burant, S.S. Iyengar, J. Tomasi, M. Cossi, J.M. Millam, M. Klene, C. Adamo, R. Cammi, J.W. Ochterski, R.L. Martin, K. Morokuma, O. Farkas, J.B. Foresman, D.J. Fox, Gaussian 16, Revision C.01. Gaussian Inc., Wallingford CT, (2016). [47] F. Zeng S.H. Bossmann M.G. Heidlage K.L. Hohn Transformation of 2,3-butanediol in a dual bed catalyst system Chem. Eng. Sci. 175 2018 387 395 F. Zeng, S.H. Bossmann, M.G. Heidlage, K.L. Hohn, Chem. Eng. Sci.175 (2018) 387–395. [48] S. Sato R. Takahashi T. Sodesawa D. Shin N. Ichikawa K. Ogura Structural and Catalytic Properties of Silica-Coated Alumina Bull. Chem. Soc. Jpn. 79 2006 649 655 S. Sato, R. Takahashi, T. Sodesawa, D. Shin, N. Ichikawa, K. Ogura, Bull. Chem. Soc. Jpn.79 (2006) 649–655. [49] H. Duan T. Hirota S. Ohtsuka Y. Yamada S. Sato Vapor-phase catalytic dehydration of 1,4-butanediol to 3-buten-1-ol over modified ZrO2 catalysts Appl. Catal. A Gen. 535 2017 9 16 H. Duan, T. Hirota, S. Ohtsuka, Y. Yamada, S. Sato, Appl. Catal. A Gen.535 (2017) 9–16. [50] H. Gotoh Y. Yamada S. Sato Dehydration of 1,3-butanediol over rare earth oxides Appl. Catal. A Gen. 377 2010 92 98 H. Gotoh, Y. Yamada, S. Sato, Appl. Catal. A Gen.377 (2010) 92–98. [51] N. Ichikawa S. Sato R. Takahashi T. Sodesawa PIO study on 1,3-butanediol dehydration over CeO2 (1 1 1) surface J. Mol. Catal. A Chem. 231 2005 181 189 N. Ichikawa, S. Sato, R. Takahashi, T. Sodesawa, J. Mol. Catal. A Chem.231 (2005) 181–189. [52] N. Ichikawa S. Sato R. Takahashi T. Sodesawa H. Fujita T. Atoguchi A. Shiga Theoretical investigation of 1,3-butanediol adsorption on an oxygen-defected CeO2(111) surface J. Catal. 239 2006 13 22 N. Ichikawa, S. Sato, R. Takahashi, T. Sodesawa, H. Fujita, T. Atoguchi, A. Shiga, J. Catal.239 (2006) 13–22. [53] S. Sato R. Takahashi M. Kobune H. Inoue Y. Izawa H. Ohno K. Takahashi Dehydration of 1,4-butanediol over rare earth oxides Appl. Catal. A Gen. 356 2009 64 71 S. Sato, R. Takahashi, M. Kobune, H. Inoue, Y. Izawa, H. Ohno, K. Takahashi, Appl. Catal. A Gen.356 (2009) 64–71. [54] S. Sato R. Takahashi T. Sodesawa N. Honda H. Shimizu Selective dehydration of diols to allylic alcohols catalyzed by ceria Catal. Commun. 4 2003 77 81 S. Sato, R. Takahashi, T. Sodesawa, N. Honda, H. Shimizu, Catal. Commun.4 (2003) 77–81. [55] A. Matsuda Y. Matsumura Y. Yamada S. Sato Vapor-phase dehydration of 1,4-butanediol to 1,3-butadiene over Y2Zr2O7 catalyst Mol. Catal. 514 2021 111853 A. Matsuda, Y. Matsumura, Y. Yamada, S. Sato, Mol. Catal.514 (2021) 111853.",
      "scopus-id": "85118712936",
      "coredata": {
        "eid": "1-s2.0-S2468823121006131",
        "dc:description": "Vapor-phase catalytic dehydration of 2,3-butanediol (2,3-BDO) to form 1,3-butadiene (BD) via 3-buten-2-ol (3B2OL) was studied over various single metal oxide catalysts. Among the catalysts, Sc2O3 prepared under hydrothermal (HT) conditions at 200 °C followed by 800 °C calcination showed the most excellent catalytic activity. The crystallization of precursor ScOOH during HT aging noticeably enhances the catalytic activity of the resulting Sc2O3 for the formation of 3B2OL in the dehydration of 2,3-BDO. The formation rate of 3B2OL from 2,3-BDO over the HT-aged Sc2O3 was twice as high as Sc2O3 without HT aging. Calcination temperatures of Sc2O3 are also important: calcination at 800 °C is efficient for the selective formation of 3B2OL from 2,3-BDO. The HT-aged Sc2O3 also showed an excellent catalytic activity for the formation of BD with the yield higher than 80% in the dehydration of 2,3-BDO at 411 °C.",
        "openArchiveArticle": "false",
        "prism:coverDate": "2021-11-30",
        "openaccessUserLicense": null,
        "prism:aggregationType": "Journal",
        "prism:url": "https://api.elsevier.com/content/article/pii/S2468823121006131",
        "dc:creator": [
          {
            "@_fa": "true",
            "$": "Nakazono, Kazuki"
          },
          {
            "@_fa": "true",
            "$": "Takahashi, Ryoji"
          },
          {
            "@_fa": "true",
            "$": "Yamada, Yasuhiro"
          },
          {
            "@_fa": "true",
            "$": "Sato, Satoshi"
          }
        ],
        "link": [
          {
            "@_fa": "true",
            "@rel": "self",
            "@href": "https://api.elsevier.com/content/article/pii/S2468823121006131"
          },
          {
            "@_fa": "true",
            "@rel": "scidir",
            "@href": "https://www.sciencedirect.com/science/article/pii/S2468823121006131"
          }
        ],
        "dc:format": "application/json",
        "openaccessType": null,
        "pii": "S2468-8231(21)00613-1",
        "prism:volume": "516",
        "articleNumber": "111996",
        "prism:publisher": "Elsevier B.V.",
        "dc:title": "Dehydration of 2,3-butanediol to produce 1,3-butadiene over Sc2O3 catalyst prepared through hydrothermal aging",
        "prism:copyright": "© 2021 Elsevier B.V. All rights reserved.",
        "openaccess": "0",
        "prism:issn": "24688231",
        "dcterms:subject": [
          {
            "@_fa": "true",
            "$": "Dehydration of 2,3-butanediol"
          },
          {
            "@_fa": "true",
            "$": "1,3-butadiene"
          },
          {
            "@_fa": "true",
            "$": "Unsaturated alcohol"
          },
          {
            "@_fa": "true",
            "$": "Hydrothermally aged Sc2O3"
          },
          {
            "@_fa": "true",
            "$": "Cubic bixbyite with high crystallinity"
          }
        ],
        "openaccessArticle": "false",
        "prism:publicationName": "Molecular Catalysis",
        "openaccessSponsorType": null,
        "prism:pageRange": "111996",
        "pubType": "fla",
        "prism:coverDisplayDate": "November 2021",
        "prism:doi": "10.1016/j.mcat.2021.111996",
        "prism:startingPage": "111996",
        "dc:identifier": "doi:10.1016/j.mcat.2021.111996",
        "openaccessSponsorName": null
      },
      "objects": {
        "object": [
          {
            "@category": "standard",
            "@height": "165",
            "@width": "301",
            "@_fa": "true",
            "$": "https://api.elsevier.com/content/object/eid/1-s2.0-S2468823121006131-ga1.jpg?httpAccept=%2A%2F%2A",
            "@multimediatype": "JPEG image file",
            "@type": "IMAGE-DOWNSAMPLED",
            "@size": "20324",
            "@ref": "ga1",
            "@mimetype": "image/jpeg"
          },
          {
            "@category": "standard",
            "@height": "297",
            "@width": "557",
            "@_fa": "true",
            "$": "https://api.elsevier.com/content/object/eid/1-s2.0-S2468823121006131-gr11.jpg?httpAccept=%2A%2F%2A",
            "@multimediatype": "JPEG image file",
            "@type": "IMAGE-DOWNSAMPLED",
            "@size": "43703",
            "@ref": "gr11",
            "@mimetype": "image/jpeg"
          },
          {
            "@category": "standard",
            "@height": "581",
            "@width": "715",
            "@_fa": "true",
            "$": "https://api.elsevier.com/content/object/eid/1-s2.0-S2468823121006131-gr12.jpg?httpAccept=%2A%2F%2A",
            "@multimediatype": "JPEG image file",
            "@type": "IMAGE-DOWNSAMPLED",
            "@size": "155850",
            "@ref": "gr12",
            "@mimetype": "image/jpeg"
          },
          {
            "@category": "standard",
            "@height": "306",
            "@width": "320",
            "@_fa": "true",
            "$": "https://api.elsevier.com/content/object/eid/1-s2.0-S2468823121006131-gr10.jpg?httpAccept=%2A%2F%2A",
            "@multimediatype": "JPEG image file",
            "@type": "IMAGE-DOWNSAMPLED",
            "@size": "26438",
            "@ref": "gr10",
            "@mimetype": "image/jpeg"
          },
          {
            "@category": "standard",
            "@height": "319",
            "@width": "316",
            "@_fa": "true",
            "$": "https://api.elsevier.com/content/object/eid/1-s2.0-S2468823121006131-gr9.jpg?httpAccept=%2A%2F%2A",
            "@multimediatype": "JPEG image file",
            "@type": "IMAGE-DOWNSAMPLED",
            "@size": "27423",
            "@ref": "gr9",
            "@mimetype": "image/jpeg"
          },
          {
            "@category": "standard",
            "@height": "314",
            "@width": "317",
            "@_fa": "true",
            "$": "https://api.elsevier.com/content/object/eid/1-s2.0-S2468823121006131-gr8.jpg?httpAccept=%2A%2F%2A",
            "@multimediatype": "JPEG image file",
            "@type": "IMAGE-DOWNSAMPLED",
            "@size": "33739",
            "@ref": "gr8",
            "@mimetype": "image/jpeg"
          },
          {
            "@category": "standard",
            "@height": "306",
            "@width": "302",
            "@_fa": "true",
            "$": "https://api.elsevier.com/content/object/eid/1-s2.0-S2468823121006131-gr7.jpg?httpAccept=%2A%2F%2A",
            "@multimediatype": "JPEG image file",
            "@type": "IMAGE-DOWNSAMPLED",
            "@size": "24296",
            "@ref": "gr7",
            "@mimetype": "image/jpeg"
          },
          {
            "@category": "standard",
            "@height": "320",
            "@width": "317",
            "@_fa": "true",
            "$": "https://api.elsevier.com/content/object/eid/1-s2.0-S2468823121006131-gr6.jpg?httpAccept=%2A%2F%2A",
            "@multimediatype": "JPEG image file",
            "@type": "IMAGE-DOWNSAMPLED",
            "@size": "35681",
            "@ref": "gr6",
            "@mimetype": "image/jpeg"
          },
          {
            "@category": "standard",
            "@height": "668",
            "@width": "745",
            "@_fa": "true",
            "$": "https://api.elsevier.com/content/object/eid/1-s2.0-S2468823121006131-gr5.jpg?httpAccept=%2A%2F%2A",
            "@multimediatype": "JPEG image file",
            "@type": "IMAGE-DOWNSAMPLED",
            "@size": "104022",
            "@ref": "gr5",
            "@mimetype": "image/jpeg"
          },
          {
            "@category": "standard",
            "@height": "339",
            "@width": "389",
            "@_fa": "true",
            "$": "https://api.elsevier.com/content/object/eid/1-s2.0-S2468823121006131-gr4.jpg?httpAccept=%2A%2F%2A",
            "@multimediatype": "JPEG image file",
            "@type": "IMAGE-DOWNSAMPLED",
            "@size": "59563",
            "@ref": "gr4",
            "@mimetype": "image/jpeg"
          },
          {
            "@category": "standard",
            "@height": "280",
            "@width": "301",
            "@_fa": "true",
            "$": "https://api.elsevier.com/content/object/eid/1-s2.0-S2468823121006131-gr3.jpg?httpAccept=%2A%2F%2A",
            "@multimediatype": "JPEG image file",
            "@type": "IMAGE-DOWNSAMPLED",
            "@size": "22978",
            "@ref": "gr3",
            "@mimetype": "image/jpeg"
          },
          {
            "@category": "standard",
            "@height": "734",
            "@width": "659",
            "@_fa": "true",
            "$": "https://api.elsevier.com/content/object/eid/1-s2.0-S2468823121006131-gr2.jpg?httpAccept=%2A%2F%2A",
            "@multimediatype": "JPEG image file",
            "@type": "IMAGE-DOWNSAMPLED",
            "@size": "96875",
            "@ref": "gr2",
            "@mimetype": "image/jpeg"
          },
          {
            "@category": "standard",
            "@height": "645",
            "@width": "678",
            "@_fa": "true",
            "$": "https://api.elsevier.com/content/object/eid/1-s2.0-S2468823121006131-gr1.jpg?httpAccept=%2A%2F%2A",
            "@multimediatype": "JPEG image file",
            "@type": "IMAGE-DOWNSAMPLED",
            "@size": "90037",
            "@ref": "gr1",
            "@mimetype": "image/jpeg"
          },
          {
            "@category": "standard",
            "@height": "224",
            "@width": "487",
            "@_fa": "true",
            "$": "https://api.elsevier.com/content/object/eid/1-s2.0-S2468823121006131-sc1.jpg?httpAccept=%2A%2F%2A",
            "@multimediatype": "JPEG image file",
            "@type": "IMAGE-DOWNSAMPLED",
            "@size": "14343",
            "@ref": "sc1",
            "@mimetype": "image/jpeg"
          },
          {
            "@category": "standard",
            "@height": "349",
            "@width": "753",
            "@_fa": "true",
            "$": "https://api.elsevier.com/content/object/eid/1-s2.0-S2468823121006131-sc2.jpg?httpAccept=%2A%2F%2A",
            "@multimediatype": "JPEG image file",
            "@type": "IMAGE-DOWNSAMPLED",
            "@size": "76981",
            "@ref": "sc2",
            "@mimetype": "image/jpeg"
          },
          {
            "@category": "thumbnail",
            "@height": "120",
            "@width": "219",
            "@_fa": "true",
            "$": "https://api.elsevier.com/content/object/eid/1-s2.0-S2468823121006131-ga1.sml?httpAccept=%2A%2F%2A",
            "@multimediatype": "GIF image file",
            "@type": "IMAGE-THUMBNAIL",
            "@size": "20617",
            "@ref": "ga1",
            "@mimetype": "image/gif"
          },
          {
            "@category": "thumbnail",
            "@height": "117",
            "@width": "219",
            "@_fa": "true",
            "$": "https://api.elsevier.com/content/object/eid/1-s2.0-S2468823121006131-gr11.sml?httpAccept=%2A%2F%2A",
            "@multimediatype": "GIF image file",
            "@type": "IMAGE-THUMBNAIL",
            "@size": "8114",
            "@ref": "gr11",
            "@mimetype": "image/gif"
          },
          {
            "@category": "thumbnail",
            "@height": "164",
            "@width": "202",
            "@_fa": "true",
            "$": "https://api.elsevier.com/content/object/eid/1-s2.0-S2468823121006131-gr12.sml?httpAccept=%2A%2F%2A",
            "@multimediatype": "GIF image file",
            "@type": "IMAGE-THUMBNAIL",
            "@size": "19296",
            "@ref": "gr12",
            "@mimetype": "image/gif"
          },
          {
            "@category": "thumbnail",
            "@height": "164",
            "@width": "171",
            "@_fa": "true",
            "$": "https://api.elsevier.com/content/object/eid/1-s2.0-S2468823121006131-gr10.sml?httpAccept=%2A%2F%2A",
            "@multimediatype": "GIF image file",
            "@type": "IMAGE-THUMBNAIL",
            "@size": "7775",
            "@ref": "gr10",
            "@mimetype": "image/gif"
          },
          {
            "@category": "thumbnail",
            "@height": "164",
            "@width": "162",
            "@_fa": "true",
            "$": "https://api.elsevier.com/content/object/eid/1-s2.0-S2468823121006131-gr9.sml?httpAccept=%2A%2F%2A",
            "@multimediatype": "GIF image file",
            "@type": "IMAGE-THUMBNAIL",
            "@size": "7507",
            "@ref": "gr9",
            "@mimetype": "image/gif"
          },
          {
            "@category": "thumbnail",
            "@height": "164",
            "@width": "166",
            "@_fa": "true",
            "$": "https://api.elsevier.com/content/object/eid/1-s2.0-S2468823121006131-gr8.sml?httpAccept=%2A%2F%2A",
            "@multimediatype": "GIF image file",
            "@type": "IMAGE-THUMBNAIL",
            "@size": "8728",
            "@ref": "gr8",
            "@mimetype": "image/gif"
          },
          {
            "@category": "thumbnail",
            "@height": "164",
            "@width": "162",
            "@_fa": "true",
            "$": "https://api.elsevier.com/content/object/eid/1-s2.0-S2468823121006131-gr7.sml?httpAccept=%2A%2F%2A",
            "@multimediatype": "GIF image file",
            "@type": "IMAGE-THUMBNAIL",
            "@size": "6858",
            "@ref": "gr7",
            "@mimetype": "image/gif"
          },
          {
            "@category": "thumbnail",
            "@height": "163",
            "@width": "162",
            "@_fa": "true",
            "$": "https://api.elsevier.com/content/object/eid/1-s2.0-S2468823121006131-gr6.sml?httpAccept=%2A%2F%2A",
            "@multimediatype": "GIF image file",
            "@type": "IMAGE-THUMBNAIL",
            "@size": "8959",
            "@ref": "gr6",
            "@mimetype": "image/gif"
          },
          {
            "@category": "thumbnail",
            "@height": "164",
            "@width": "183",
            "@_fa": "true",
            "$": "https://api.elsevier.com/content/object/eid/1-s2.0-S2468823121006131-gr5.sml?httpAccept=%2A%2F%2A",
            "@multimediatype": "GIF image file",
            "@type": "IMAGE-THUMBNAIL",
            "@size": "8449",
            "@ref": "gr5",
            "@mimetype": "image/gif"
          },
          {
            "@category": "thumbnail",
            "@height": "164",
            "@width": "188",
            "@_fa": "true",
            "$": "https://api.elsevier.com/content/object/eid/1-s2.0-S2468823121006131-gr4.sml?httpAccept=%2A%2F%2A",
            "@multimediatype": "GIF image file",
            "@type": "IMAGE-THUMBNAIL",
            "@size": "11995",
            "@ref": "gr4",
            "@mimetype": "image/gif"
          },
          {
            "@category": "thumbnail",
            "@height": "164",
            "@width": "176",
            "@_fa": "true",
            "$": "https://api.elsevier.com/content/object/eid/1-s2.0-S2468823121006131-gr3.sml?httpAccept=%2A%2F%2A",
            "@multimediatype": "GIF image file",
            "@type": "IMAGE-THUMBNAIL",
            "@size": "7958",
            "@ref": "gr3",
            "@mimetype": "image/gif"
          },
          {
            "@category": "thumbnail",
            "@height": "164",
            "@width": "147",
            "@_fa": "true",
            "$": "https://api.elsevier.com/content/object/eid/1-s2.0-S2468823121006131-gr2.sml?httpAccept=%2A%2F%2A",
            "@multimediatype": "GIF image file",
            "@type": "IMAGE-THUMBNAIL",
            "@size": "12971",
            "@ref": "gr2",
            "@mimetype": "image/gif"
          },
          {
            "@category": "thumbnail",
            "@height": "164",
            "@width": "172",
            "@_fa": "true",
            "$": "https://api.elsevier.com/content/object/eid/1-s2.0-S2468823121006131-gr1.sml?httpAccept=%2A%2F%2A",
            "@multimediatype": "GIF image file",
            "@type": "IMAGE-THUMBNAIL",
            "@size": "7417",
            "@ref": "gr1",
            "@mimetype": "image/gif"
          },
          {
            "@category": "thumbnail",
            "@height": "101",
            "@width": "219",
            "@_fa": "true",
            "$": "https://api.elsevier.com/content/object/eid/1-s2.0-S2468823121006131-sc1.sml?httpAccept=%2A%2F%2A",
            "@multimediatype": "GIF image file",
            "@type": "IMAGE-THUMBNAIL",
            "@size": "3127",
            "@ref": "sc1",
            "@mimetype": "image/gif"
          },
          {
            "@category": "thumbnail",
            "@height": "101",
            "@width": "219",
            "@_fa": "true",
            "$": "https://api.elsevier.com/content/object/eid/1-s2.0-S2468823121006131-sc2.sml?httpAccept=%2A%2F%2A",
            "@multimediatype": "GIF image file",
            "@type": "IMAGE-THUMBNAIL",
            "@size": "8771",
            "@ref": "sc2",
            "@mimetype": "image/gif"
          },
          {
            "@category": "high",
            "@height": "731",
            "@width": "1333",
            "@_fa": "true",
            "$": "https://api.elsevier.com/content/object/eid/1-s2.0-S2468823121006131-ga1_lrg.jpg?httpAccept=%2A%2F%2A",
            "@multimediatype": "JPEG image file",
            "@type": "IMAGE-HIGH-RES",
            "@size": "143901",
            "@ref": "ga1",
            "@mimetype": "image/jpeg"
          },
          {
            "@category": "high",
            "@height": "1318",
            "@width": "2469",
            "@_fa": "true",
            "$": "https://api.elsevier.com/content/object/eid/1-s2.0-S2468823121006131-gr11_lrg.jpg?httpAccept=%2A%2F%2A",
            "@multimediatype": "JPEG image file",
            "@type": "IMAGE-HIGH-RES",
            "@size": "301736",
            "@ref": "gr11",
            "@mimetype": "image/jpeg"
          },
          {
            "@category": "high",
            "@height": "2572",
            "@width": "3167",
            "@_fa": "true",
            "$": "https://api.elsevier.com/content/object/eid/1-s2.0-S2468823121006131-gr12_lrg.jpg?httpAccept=%2A%2F%2A",
            "@multimediatype": "JPEG image file",
            "@type": "IMAGE-HIGH-RES",
            "@size": "1162738",
            "@ref": "gr12",
            "@mimetype": "image/jpeg"
          },
          {
            "@category": "high",
            "@height": "1357",
            "@width": "1419",
            "@_fa": "true",
            "$": "https://api.elsevier.com/content/object/eid/1-s2.0-S2468823121006131-gr10_lrg.jpg?httpAccept=%2A%2F%2A",
            "@multimediatype": "JPEG image file",
            "@type": "IMAGE-HIGH-RES",
            "@size": "175775",
            "@ref": "gr10",
            "@mimetype": "image/jpeg"
          },
          {
            "@category": "high",
            "@height": "1417",
            "@width": "1402",
            "@_fa": "true",
            "$": "https://api.elsevier.com/content/object/eid/1-s2.0-S2468823121006131-gr9_lrg.jpg?httpAccept=%2A%2F%2A",
            "@multimediatype": "JPEG image file",
            "@type": "IMAGE-HIGH-RES",
            "@size": "181458",
            "@ref": "gr9",
            "@mimetype": "image/jpeg"
          },
          {
            "@category": "high",
            "@height": "1390",
            "@width": "1405",
            "@_fa": "true",
            "$": "https://api.elsevier.com/content/object/eid/1-s2.0-S2468823121006131-gr8_lrg.jpg?httpAccept=%2A%2F%2A",
            "@multimediatype": "JPEG image file",
            "@type": "IMAGE-HIGH-RES",
            "@size": "238360",
            "@ref": "gr8",
            "@mimetype": "image/jpeg"
          },
          {
            "@category": "high",
            "@height": "1357",
            "@width": "1339",
            "@_fa": "true",
            "$": "https://api.elsevier.com/content/object/eid/1-s2.0-S2468823121006131-gr7_lrg.jpg?httpAccept=%2A%2F%2A",
            "@multimediatype": "JPEG image file",
            "@type": "IMAGE-HIGH-RES",
            "@size": "157499",
            "@ref": "gr7",
            "@mimetype": "image/jpeg"
          },
          {
            "@category": "high",
            "@height": "1420",
            "@width": "1407",
            "@_fa": "true",
            "$": "https://api.elsevier.com/content/object/eid/1-s2.0-S2468823121006131-gr6_lrg.jpg?httpAccept=%2A%2F%2A",
            "@multimediatype": "JPEG image file",
            "@type": "IMAGE-HIGH-RES",
            "@size": "240209",
            "@ref": "gr6",
            "@mimetype": "image/jpeg"
          },
          {
            "@category": "high",
            "@height": "2955",
            "@width": "3298",
            "@_fa": "true",
            "$": "https://api.elsevier.com/content/object/eid/1-s2.0-S2468823121006131-gr5_lrg.jpg?httpAccept=%2A%2F%2A",
            "@multimediatype": "JPEG image file",
            "@type": "IMAGE-HIGH-RES",
            "@size": "732584",
            "@ref": "gr5",
            "@mimetype": "image/jpeg"
          },
          {
            "@category": "high",
            "@height": "1502",
            "@width": "1725",
            "@_fa": "true",
            "$": "https://api.elsevier.com/content/object/eid/1-s2.0-S2468823121006131-gr4_lrg.jpg?httpAccept=%2A%2F%2A",
            "@multimediatype": "JPEG image file",
            "@type": "IMAGE-HIGH-RES",
            "@size": "491369",
            "@ref": "gr4",
            "@mimetype": "image/jpeg"
          },
          {
            "@category": "high",
            "@height": "1239",
            "@width": "1333",
            "@_fa": "true",
            "$": "https://api.elsevier.com/content/object/eid/1-s2.0-S2468823121006131-gr3_lrg.jpg?httpAccept=%2A%2F%2A",
            "@multimediatype": "JPEG image file",
            "@type": "IMAGE-HIGH-RES",
            "@size": "161422",
            "@ref": "gr3",
            "@mimetype": "image/jpeg"
          },
          {
            "@category": "high",
            "@height": "3251",
            "@width": "2917",
            "@_fa": "true",
            "$": "https://api.elsevier.com/content/object/eid/1-s2.0-S2468823121006131-gr2_lrg.jpg?httpAccept=%2A%2F%2A",
            "@multimediatype": "JPEG image file",
            "@type": "IMAGE-HIGH-RES",
            "@size": "1121106",
            "@ref": "gr2",
            "@mimetype": "image/jpeg"
          },
          {
            "@category": "high",
            "@height": "2855",
            "@width": "3000",
            "@_fa": "true",
            "$": "https://api.elsevier.com/content/object/eid/1-s2.0-S2468823121006131-gr1_lrg.jpg?httpAccept=%2A%2F%2A",
            "@multimediatype": "JPEG image file",
            "@type": "IMAGE-HIGH-RES",
            "@size": "732717",
            "@ref": "gr1",
            "@mimetype": "image/jpeg"
          },
          {
            "@category": "high",
            "@height": "991",
            "@width": "2157",
            "@_fa": "true",
            "$": "https://api.elsevier.com/content/object/eid/1-s2.0-S2468823121006131-sc1_lrg.jpg?httpAccept=%2A%2F%2A",
            "@multimediatype": "JPEG image file",
            "@type": "IMAGE-HIGH-RES",
            "@size": "110933",
            "@ref": "sc1",
            "@mimetype": "image/jpeg"
          },
          {
            "@category": "high",
            "@height": "1543",
            "@width": "3333",
            "@_fa": "true",
            "$": "https://api.elsevier.com/content/object/eid/1-s2.0-S2468823121006131-sc2_lrg.jpg?httpAccept=%2A%2F%2A",
            "@multimediatype": "JPEG image file",
            "@type": "IMAGE-HIGH-RES",
            "@size": "564858",
            "@ref": "sc2",
            "@mimetype": "image/jpeg"
          },
          {
            "@category": "standard",
            "@_fa": "true",
            "$": "https://api.elsevier.com/content/object/eid/1-s2.0-S2468823121006131-mmc1.docx?httpAccept=%2A%2F%2A",
            "@multimediatype": "Microsoft Word file",
            "@type": "APPLICATION",
            "@size": "505703",
            "@ref": "mmc1",
            "@mimetype": "application/word"
          },
          {
            "@category": "standard",
            "@_fa": "true",
            "$": "https://api.elsevier.com/content/object/eid/1-s2.0-S2468823121006131-am.pdf?httpAccept=%2A%2F%2A",
            "@multimediatype": "Acrobat PDF file",
            "@type": "AAM-PDF",
            "@size": "1739730",
            "@ref": "am",
            "@mimetype": "application/pdf"
          }
        ]
      },
      "link": {
        "@rel": "abstract",
        "@href": "https://api.elsevier.com/content/abstract/scopus_id/85118712936"
      }
    }
  }
}