{
  "metadata": {
    "title": "Highly efficient solvent-free oxidation of cyclohexanol to cyclohexanone over nanocrystalline CaO–MgO binary metal-oxide catalysts",
    "authors": "; ; ",
    "journal": "Molecular Catalysis",
    "date": "2022-12-31",
    "doi": "10.1016/j.mcat.2022.112759",
    "abstract": "",
    "uri": "https://api.elsevier.com/content/article/pii/S2468823122006459",
    "pii": "S2468823122006459"
  },
  "fulltext": {
    "full-text-retrieval-response": {
      "scopus-eid": "2-s2.0-85140784615",
      "originalText": "serial JL 315758 291210 291744 291790 291809 31 Molecular Catalysis MOLECULARCATALYSIS 2022-10-28 2022-10-28 2022-10-28 2022-10-28 2022-11-21T15:56:55 1-s2.0-S2468823122006459 S2468-8231(22)00645-9 S2468823122006459 10.1016/j.mcat.2022.112759 S300 S300.1 FULL-TEXT 1-s2.0-S2468823122X00163 2024-06-26T17:47:42.363978Z 0 0 20221201 20221231 2022 2022-10-28T10:46:12.897256Z absattachment articleinfo articlenumber articletitlenorm authfirstinitialnorm authfirstsurnamenorm cid cids contenttype copyright crossmark dateloaded dateloadedtxt datesearch datesort dateupdated dco docsubtype doctype doi eid ewtransactionid hubeid indexeddate issn issnnorm itemstage itemtransactionid itemweight openaccess openarchive pg pgfirst pii piinorm pubdateend pubdatestart pubdatetxt pubyr sectiontitle sortorder srctitle srctitlenorm srctype ssids alllist content subj subheadings suppl tomb volfirst volissue volumelist webpdf webpdfpagecount yearnav figure table e-component body mmlmath acknowledge affil appendices articletitle auth authfirstini authfull authkeywords authlast highlightsabst orcid primabst ref specialabst 2468-8231 24688231 true 533 533 C Volume 533 18 112759 112759 112759 202212 December 2022 2022-12-01 2022-12-31 2022 Regular Papers article fla © 2022 Published by Elsevier B.V. HIGHLYEFFICIENTSOLVENTFREEOXIDATIONCYCLOHEXANOLCYCLOHEXANONEOVERNANOCRYSTALLINECAOMGOBINARYMETALOXIDECATALYSTS BANDALLA S 1 Introduction 2 Experimental section 2.1 Materials and chemicals 2.2 Catalyst preparation 2.3 Catalyst characterization 2.4 Catalytic oxidation of cyclohexanol 3 Results and discussion 3.1 Catalyst characterization 3.2 Catalytic activity studies 3.2.1 Catalysts screening test 3.2.2 Effect of reaction temperature 3.2.3 Effect of reaction time 3.2.4 Influence of cyclohexanol/TBHP molar ratio 3.2.5 Effect of catalyst loading 3.2.6 Effect of solvent 3.2.7 Structure-activity relationship 3.2.8 Plausible reaction mechanism 3.2.9 Catalytic oxidation of different alcohols 3.2.10 Reusability 3.2.11 Comparison of CaO-MgO with reported catalysts 4 Conclusion CRediT authorship contribution statement Acknowledgments Appendix Supplementary materials References WU 2022 82 90 Q CHEN 2021 78 91 H TANGALE 2013 421 429 N ADAM 2009 93 99 F XIE 2020 C SIMON 2012 150 158 E GAO 2020 218 230 Y BIRADAR 2009 2885 2888 A POKUTSA 2007 26 31 A MARELLA 2012 1833 1838 R LI 2014 31 37 K ZHAO 2017 G CHEN 2011 9354 9356 L ZHANG 2019 13876 13883 F NIWA 2020 T LI 2017 269 275 R SANCHETI 2021 S RASHID 2016 H GAO 2019 11104 11115 Y GAO 2018 53 56 Y ZHAO 2017 305 314 Y XUE 2020 Y SRIDEVI 2017 601 608 B WU 2017 M DESHPANDE 2008 186 193 S GAWANDE 2012 1113 1125 M NAGAIAH 2018 3042 3050 P BAITHY 2022 1428 1440 M NGAMCHARUSSRIVICHAI 2010 1409 1415 C NGAMCHARUSSRIVICHAI 2007 24 33 C MALLESHAM 2013 478 489 B MALLESHAM 2014 803 813 B MAHDAVI 2016 114 122 V HORNAK 2021 J YADAGIRI 2018 8473 8478 J SIDDIQUI 2021 N PRZEPIORSKI 2013 6669 6677 J MANRIQUEZRAMIREZ 2020 417 431 M MIRGHIASI 2014 113 117 Z WANG 2009 574 578 Y TESTA 2013 69 76 M BALAKRISHNAN 2020 G ANAND 2021 409 422 K IBRAHIM 2020 781 787 Y GOMEZRODRIGUEZ 2020 13 C ZITANI 2020 234 244 M STEFFEN 2008 41 44 R ANDRADE 2020 M SUTRADHAR 2015 50 57 M REDDY 2004 3561 3564 S CHEN 2013 4408 4413 B ROSTAMI 2017 435 439 A NAJAFISHIRTARI 2021 16809 16833 S EMAYAVARAMBAN 2016 2517 2526 P FARHADI 2018 6768 6780 S PRATHIBHA 2020 988 993 E ZHAO 2021 2366 2375 Y MOHAMED 2008 O MAGEED 2019 878 885 A BANDALLAX2022X112759 BANDALLAX2022X112759XS 2024-10-28T00:00:00.000Z 2024-10-28T00:00:00.000Z http://creativecommons.org/licenses/by-nc-nd/4.0/ © 2022 Published by Elsevier B.V. 2022-11-02T00:06:55.980Z http://vtw.elsevier.com/data/voc/AddOnTypes/50.7/nlp-car The authors acknowledge the Indo-South Africa joint project Ref. No. DST/INT/SA/P-15/2011. 0 https://doi.org/10.15223/policy-017 https://doi.org/10.15223/policy-037 https://doi.org/10.15223/policy-012 https://doi.org/10.15223/policy-029 https://doi.org/10.15223/policy-004 item S2468-8231(22)00645-9 S2468823122006459 1-s2.0-S2468823122006459 10.1016/j.mcat.2022.112759 315758 2022-11-21T16:12:27.649048Z 2022-12-01 2022-12-31 1-s2.0-S2468823122006459-main.pdf https://s3-eu-west-1.amazonaws.com/prod-ucs-content-store-eu-west/content/pii:S2468823122006459/MAIN/application/pdf/6f8141edb58f9497fe50fd64542f22c9/main.pdf main.pdf pdf true 5963983 MAIN 12 1-s2.0-S2468823122006459-main_1.png https://s3-eu-west-1.amazonaws.com/prod-ucs-content-store-eu-west/content/pii:S2468823122006459/PREVIEW/image/png/841f62f1ef59e77507cbebf4cdef1d79/main_1.png main_1.png png 56889 849 656 IMAGE-WEB-PDF 1 1-s2.0-S2468823122006459-fx1.jpg https://s3-eu-west-1.amazonaws.com/prod-ucs-content-store-eu-west/content/pii:S2468823122006459/fx1/DOWNSAMPLED/image/jpeg/b939baaf74c71e57ee11a79cda872ee4/fx1.jpg fx1 fx1.jpg jpg 66758 959 376 IMAGE-DOWNSAMPLED 1-s2.0-S2468823122006459-gr1.jpg https://s3-eu-west-1.amazonaws.com/prod-ucs-content-store-eu-west/content/pii:S2468823122006459/gr1/DOWNSAMPLED/image/jpeg/ff6e8905e0b1501aa2e09b21b984f273/gr1.jpg gr1 gr1.jpg jpg 35748 213 339 IMAGE-DOWNSAMPLED 1-s2.0-S2468823122006459-gr10.jpg https://s3-eu-west-1.amazonaws.com/prod-ucs-content-store-eu-west/content/pii:S2468823122006459/gr10/DOWNSAMPLED/image/jpeg/7766e1e55d0bb00d50b48891f659b951/gr10.jpg gr10 gr10.jpg jpg 24848 239 339 IMAGE-DOWNSAMPLED 1-s2.0-S2468823122006459-gr2.jpg https://s3-eu-west-1.amazonaws.com/prod-ucs-content-store-eu-west/content/pii:S2468823122006459/gr2/DOWNSAMPLED/image/jpeg/77c1a01407532e76bfcd703d2caf0e96/gr2.jpg gr2 gr2.jpg jpg 43704 331 339 IMAGE-DOWNSAMPLED 1-s2.0-S2468823122006459-gr3.jpg https://s3-eu-west-1.amazonaws.com/prod-ucs-content-store-eu-west/content/pii:S2468823122006459/gr3/DOWNSAMPLED/image/jpeg/074719c7bd3418113b4d9df6c0eaacb2/gr3.jpg gr3 gr3.jpg jpg 93192 390 489 IMAGE-DOWNSAMPLED 1-s2.0-S2468823122006459-sc1.jpg https://s3-eu-west-1.amazonaws.com/prod-ucs-content-store-eu-west/content/pii:S2468823122006459/sc1/DOWNSAMPLED/image/jpeg/0d2c285e7527c6425cc9739feb643979/sc1.jpg sc1 sc1.jpg jpg 20443 136 659 IMAGE-DOWNSAMPLED 1-s2.0-S2468823122006459-gr13.jpg https://s3-eu-west-1.amazonaws.com/prod-ucs-content-store-eu-west/content/pii:S2468823122006459/gr13/DOWNSAMPLED/image/jpeg/a3c3fcbed3f121f91814e979a4ff4272/gr13.jpg gr13 gr13.jpg jpg 94604 593 659 IMAGE-DOWNSAMPLED 1-s2.0-S2468823122006459-sc2.jpg https://s3-eu-west-1.amazonaws.com/prod-ucs-content-store-eu-west/content/pii:S2468823122006459/sc2/DOWNSAMPLED/image/jpeg/d9fafd76b3c7ecadf5d0ea9c71309856/sc2.jpg sc2 sc2.jpg jpg 39632 306 339 IMAGE-DOWNSAMPLED 1-s2.0-S2468823122006459-gr11.jpg https://s3-eu-west-1.amazonaws.com/prod-ucs-content-store-eu-west/content/pii:S2468823122006459/gr11/DOWNSAMPLED/image/jpeg/c1b958be99b50abd7d430ffa897b8d19/gr11.jpg gr11 gr11.jpg jpg 39352 257 339 IMAGE-DOWNSAMPLED 1-s2.0-S2468823122006459-gr12.jpg https://s3-eu-west-1.amazonaws.com/prod-ucs-content-store-eu-west/content/pii:S2468823122006459/gr12/DOWNSAMPLED/image/jpeg/4eb2987628dd4208d6ccc31af2a1a9bf/gr12.jpg gr12 gr12.jpg jpg 24618 208 339 IMAGE-DOWNSAMPLED 1-s2.0-S2468823122006459-gr8.jpg https://s3-eu-west-1.amazonaws.com/prod-ucs-content-store-eu-west/content/pii:S2468823122006459/gr8/DOWNSAMPLED/image/jpeg/45a4681097ca35d0670064cb4da75ba0/gr8.jpg gr8 gr8.jpg jpg 31986 277 339 IMAGE-DOWNSAMPLED 1-s2.0-S2468823122006459-gr9.jpg https://s3-eu-west-1.amazonaws.com/prod-ucs-content-store-eu-west/content/pii:S2468823122006459/gr9/DOWNSAMPLED/image/jpeg/472812d9ba895864d36d9233620ff9bf/gr9.jpg gr9 gr9.jpg jpg 32162 321 339 IMAGE-DOWNSAMPLED 1-s2.0-S2468823122006459-gr4.jpg https://s3-eu-west-1.amazonaws.com/prod-ucs-content-store-eu-west/content/pii:S2468823122006459/gr4/DOWNSAMPLED/image/jpeg/b6a8eca4b9eb988850ac3fe72d0f3150/gr4.jpg gr4 gr4.jpg jpg 93408 411 489 IMAGE-DOWNSAMPLED 1-s2.0-S2468823122006459-gr5.jpg https://s3-eu-west-1.amazonaws.com/prod-ucs-content-store-eu-west/content/pii:S2468823122006459/gr5/DOWNSAMPLED/image/jpeg/ad3152055b318dfaea0e314c60c605aa/gr5.jpg gr5 gr5.jpg jpg 31930 287 339 IMAGE-DOWNSAMPLED 1-s2.0-S2468823122006459-gr6.jpg https://s3-eu-west-1.amazonaws.com/prod-ucs-content-store-eu-west/content/pii:S2468823122006459/gr6/DOWNSAMPLED/image/jpeg/a771fe5c481d5cff22cb7183dbdccaa7/gr6.jpg gr6 gr6.jpg jpg 32751 323 339 IMAGE-DOWNSAMPLED 1-s2.0-S2468823122006459-gr7.jpg https://s3-eu-west-1.amazonaws.com/prod-ucs-content-store-eu-west/content/pii:S2468823122006459/gr7/DOWNSAMPLED/image/jpeg/c105cb7d9e9363fbc55cfcf18b2e4ff1/gr7.jpg gr7 gr7.jpg jpg 29819 285 339 IMAGE-DOWNSAMPLED 1-s2.0-S2468823122006459-ga1.jpg https://s3-eu-west-1.amazonaws.com/prod-ucs-content-store-eu-west/content/pii:S2468823122006459/ga1/DOWNSAMPLED/image/jpeg/2ecbd32fd7108b1054467864edb815ba/ga1.jpg ga1 true ga1.jpg jpg 28919 125 301 IMAGE-DOWNSAMPLED 1-s2.0-S2468823122006459-fx1.sml https://s3-eu-west-1.amazonaws.com/prod-ucs-content-store-eu-west/content/pii:S2468823122006459/fx1/THUMBNAIL/image/gif/4cf886be385908d7e9e97581fbaf9fbe/fx1.sml fx1 fx1.sml sml 4205 163 64 IMAGE-THUMBNAIL 1-s2.0-S2468823122006459-gr1.sml https://s3-eu-west-1.amazonaws.com/prod-ucs-content-store-eu-west/content/pii:S2468823122006459/gr1/THUMBNAIL/image/gif/c6056e12bacd1b5e19432c16e349b3a5/gr1.sml gr1 gr1.sml sml 12206 138 219 IMAGE-THUMBNAIL 1-s2.0-S2468823122006459-gr10.sml https://s3-eu-west-1.amazonaws.com/prod-ucs-content-store-eu-west/content/pii:S2468823122006459/gr10/THUMBNAIL/image/gif/d9b5d3a334c6e5f7ff4e05b6090c44ca/gr10.sml gr10 gr10.sml sml 11338 154 219 IMAGE-THUMBNAIL 1-s2.0-S2468823122006459-gr2.sml https://s3-eu-west-1.amazonaws.com/prod-ucs-content-store-eu-west/content/pii:S2468823122006459/gr2/THUMBNAIL/image/gif/67eaeaec19cf3293cbd9eedd106437da/gr2.sml gr2 gr2.sml sml 10314 164 168 IMAGE-THUMBNAIL 1-s2.0-S2468823122006459-gr3.sml https://s3-eu-west-1.amazonaws.com/prod-ucs-content-store-eu-west/content/pii:S2468823122006459/gr3/THUMBNAIL/image/gif/f8c9ff8ed77c63c6c0875e8c442edf69/gr3.sml gr3 gr3.sml sml 22083 164 205 IMAGE-THUMBNAIL 1-s2.0-S2468823122006459-sc1.sml https://s3-eu-west-1.amazonaws.com/prod-ucs-content-store-eu-west/content/pii:S2468823122006459/sc1/THUMBNAIL/image/gif/6e022c120c6335764f6b346624c3eda6/sc1.sml sc1 sc1.sml sml 5129 45 219 IMAGE-THUMBNAIL 1-s2.0-S2468823122006459-gr13.sml https://s3-eu-west-1.amazonaws.com/prod-ucs-content-store-eu-west/content/pii:S2468823122006459/gr13/THUMBNAIL/image/gif/559eb86fb5d56d680fb8de607f723ce6/gr13.sml gr13 gr13.sml sml 10237 164 182 IMAGE-THUMBNAIL 1-s2.0-S2468823122006459-sc2.sml https://s3-eu-west-1.amazonaws.com/prod-ucs-content-store-eu-west/content/pii:S2468823122006459/sc2/THUMBNAIL/image/gif/865a41015f8992751095e31ab9aeb064/sc2.sml sc2 sc2.sml sml 12482 164 182 IMAGE-THUMBNAIL 1-s2.0-S2468823122006459-gr11.sml https://s3-eu-west-1.amazonaws.com/prod-ucs-content-store-eu-west/content/pii:S2468823122006459/gr11/THUMBNAIL/image/gif/b40ff8c14d33177ad0c37441d01242e7/gr11.sml gr11 gr11.sml sml 11453 164 217 IMAGE-THUMBNAIL 1-s2.0-S2468823122006459-gr12.sml https://s3-eu-west-1.amazonaws.com/prod-ucs-content-store-eu-west/content/pii:S2468823122006459/gr12/THUMBNAIL/image/gif/37fa03f8769a3037339a37c0ea609858/gr12.sml gr12 gr12.sml sml 11077 135 219 IMAGE-THUMBNAIL 1-s2.0-S2468823122006459-gr8.sml https://s3-eu-west-1.amazonaws.com/prod-ucs-content-store-eu-west/content/pii:S2468823122006459/gr8/THUMBNAIL/image/gif/a5ddeed1aac65334fa6a3824f31314f4/gr8.sml gr8 gr8.sml sml 9069 163 200 IMAGE-THUMBNAIL 1-s2.0-S2468823122006459-gr9.sml https://s3-eu-west-1.amazonaws.com/prod-ucs-content-store-eu-west/content/pii:S2468823122006459/gr9/THUMBNAIL/image/gif/8385d527c84a5aa8c960cd4e37856ec2/gr9.sml gr9 gr9.sml sml 8418 164 173 IMAGE-THUMBNAIL 1-s2.0-S2468823122006459-gr4.sml https://s3-eu-west-1.amazonaws.com/prod-ucs-content-store-eu-west/content/pii:S2468823122006459/gr4/THUMBNAIL/image/gif/d933e83c9559c1565dc6992784e8ec3a/gr4.sml gr4 gr4.sml sml 22209 164 195 IMAGE-THUMBNAIL 1-s2.0-S2468823122006459-gr5.sml https://s3-eu-west-1.amazonaws.com/prod-ucs-content-store-eu-west/content/pii:S2468823122006459/gr5/THUMBNAIL/image/gif/0763dcbad85a4b66b0fa8ac58c5addef/gr5.sml gr5 gr5.sml sml 9147 164 193 IMAGE-THUMBNAIL 1-s2.0-S2468823122006459-gr6.sml https://s3-eu-west-1.amazonaws.com/prod-ucs-content-store-eu-west/content/pii:S2468823122006459/gr6/THUMBNAIL/image/gif/db8cfaafc1939b75a999363c3bad0544/gr6.sml gr6 gr6.sml sml 8241 164 172 IMAGE-THUMBNAIL 1-s2.0-S2468823122006459-gr7.sml https://s3-eu-west-1.amazonaws.com/prod-ucs-content-store-eu-west/content/pii:S2468823122006459/gr7/THUMBNAIL/image/gif/8023fc826e7d89309e2bf951dbdebd35/gr7.sml gr7 gr7.sml sml 8798 164 195 IMAGE-THUMBNAIL 1-s2.0-S2468823122006459-ga1.sml https://s3-eu-west-1.amazonaws.com/prod-ucs-content-store-eu-west/content/pii:S2468823122006459/ga1/THUMBNAIL/image/gif/a193e0451beaad5bfb99599c0db5324d/ga1.sml ga1 true ga1.sml sml 10999 91 219 IMAGE-THUMBNAIL 1-s2.0-S2468823122006459-fx1_lrg.jpg https://s3-eu-west-1.amazonaws.com/prod-ucs-content-store-eu-west/content/pii:S2468823122006459/HIGHRES/image/jpeg/1b79416a4bf202c54d5090c0f67f4cd6/fx1_lrg.jpg fx1 fx1_lrg.jpg jpg 526211 4250 1666 IMAGE-HIGH-RES 1-s2.0-S2468823122006459-gr1_lrg.jpg https://s3-eu-west-1.amazonaws.com/prod-ucs-content-store-eu-west/content/pii:S2468823122006459/HIGHRES/image/jpeg/8337e689f687708a4b6824d5fe18d2ec/gr1_lrg.jpg gr1 gr1_lrg.jpg jpg 252839 944 1500 IMAGE-HIGH-RES 1-s2.0-S2468823122006459-gr10_lrg.jpg https://s3-eu-west-1.amazonaws.com/prod-ucs-content-store-eu-west/content/pii:S2468823122006459/HIGHRES/image/jpeg/45f6f226963de7aad980dce925f6c45f/gr10_lrg.jpg gr10 gr10_lrg.jpg jpg 179474 1058 1500 IMAGE-HIGH-RES 1-s2.0-S2468823122006459-gr2_lrg.jpg https://s3-eu-west-1.amazonaws.com/prod-ucs-content-store-eu-west/content/pii:S2468823122006459/HIGHRES/image/jpeg/2ee24d05985c70bd29c3764f5d321d8e/gr2_lrg.jpg gr2 gr2_lrg.jpg jpg 302880 1464 1500 IMAGE-HIGH-RES 1-s2.0-S2468823122006459-gr3_lrg.jpg https://s3-eu-west-1.amazonaws.com/prod-ucs-content-store-eu-west/content/pii:S2468823122006459/HIGHRES/image/jpeg/7b324559cdd86bda01e46c6ae1eaa83f/gr3_lrg.jpg gr3 gr3_lrg.jpg jpg 800760 1730 2167 IMAGE-HIGH-RES 1-s2.0-S2468823122006459-sc1_lrg.jpg https://s3-eu-west-1.amazonaws.com/prod-ucs-content-store-eu-west/content/pii:S2468823122006459/HIGHRES/image/jpeg/7d07d6755b8c44bed7cbc9f9249f8b45/sc1_lrg.jpg sc1 sc1_lrg.jpg jpg 119425 600 2917 IMAGE-HIGH-RES 1-s2.0-S2468823122006459-gr13_lrg.jpg https://s3-eu-west-1.amazonaws.com/prod-ucs-content-store-eu-west/content/pii:S2468823122006459/HIGHRES/image/jpeg/1b437af0c65d0dc64b516a4e48ad4304/gr13_lrg.jpg gr13 gr13_lrg.jpg jpg 594217 2626 2917 IMAGE-HIGH-RES 1-s2.0-S2468823122006459-sc2_lrg.jpg https://s3-eu-west-1.amazonaws.com/prod-ucs-content-store-eu-west/content/pii:S2468823122006459/HIGHRES/image/jpeg/899d46682e9103df8a4a8e8a86f6be49/sc2_lrg.jpg sc2 sc2_lrg.jpg jpg 263763 1353 1500 IMAGE-HIGH-RES 1-s2.0-S2468823122006459-gr11_lrg.jpg https://s3-eu-west-1.amazonaws.com/prod-ucs-content-store-eu-west/content/pii:S2468823122006459/HIGHRES/image/jpeg/8313c0e8662d4c60fe784b076ddd2cea/gr11_lrg.jpg gr11 gr11_lrg.jpg jpg 270865 1135 1500 IMAGE-HIGH-RES 1-s2.0-S2468823122006459-gr12_lrg.jpg https://s3-eu-west-1.amazonaws.com/prod-ucs-content-store-eu-west/content/pii:S2468823122006459/HIGHRES/image/jpeg/555d43572cd40a5c22abb2a6c40d2046/gr12_lrg.jpg gr12 gr12_lrg.jpg jpg 152614 922 1500 IMAGE-HIGH-RES 1-s2.0-S2468823122006459-gr8_lrg.jpg https://s3-eu-west-1.amazonaws.com/prod-ucs-content-store-eu-west/content/pii:S2468823122006459/HIGHRES/image/jpeg/4403ab6087360569713e13a49822b5b5/gr8_lrg.jpg gr8 gr8_lrg.jpg jpg 205563 1226 1500 IMAGE-HIGH-RES 1-s2.0-S2468823122006459-gr9_lrg.jpg https://s3-eu-west-1.amazonaws.com/prod-ucs-content-store-eu-west/content/pii:S2468823122006459/HIGHRES/image/jpeg/9590fb7cce92319e3ac95824025025b1/gr9_lrg.jpg gr9 gr9_lrg.jpg jpg 207984 1422 1500 IMAGE-HIGH-RES 1-s2.0-S2468823122006459-gr4_lrg.jpg https://s3-eu-west-1.amazonaws.com/prod-ucs-content-store-eu-west/content/pii:S2468823122006459/HIGHRES/image/jpeg/c853a48df087e0edaa63c6c003816bb3/gr4_lrg.jpg gr4 gr4_lrg.jpg jpg 854209 1822 2167 IMAGE-HIGH-RES 1-s2.0-S2468823122006459-gr5_lrg.jpg https://s3-eu-west-1.amazonaws.com/prod-ucs-content-store-eu-west/content/pii:S2468823122006459/HIGHRES/image/jpeg/94d8566bebd12b7bd846e6b7a97c11d6/gr5_lrg.jpg gr5 gr5_lrg.jpg jpg 217711 1271 1500 IMAGE-HIGH-RES 1-s2.0-S2468823122006459-gr6_lrg.jpg https://s3-eu-west-1.amazonaws.com/prod-ucs-content-store-eu-west/content/pii:S2468823122006459/HIGHRES/image/jpeg/003d2685664091462747575f24a19bdb/gr6_lrg.jpg gr6 gr6_lrg.jpg jpg 214834 1430 1500 IMAGE-HIGH-RES 1-s2.0-S2468823122006459-gr7_lrg.jpg https://s3-eu-west-1.amazonaws.com/prod-ucs-content-store-eu-west/content/pii:S2468823122006459/HIGHRES/image/jpeg/e609e9b1c60a288b00ea9b0c490ecad6/gr7_lrg.jpg gr7 gr7_lrg.jpg jpg 191661 1259 1500 IMAGE-HIGH-RES 1-s2.0-S2468823122006459-ga1_lrg.jpg https://s3-eu-west-1.amazonaws.com/prod-ucs-content-store-eu-west/content/pii:S2468823122006459/HIGHRES/image/jpeg/96c139778120fe2aaa7f46c5c9b669ec/ga1_lrg.jpg ga1 true ga1_lrg.jpg jpg 176774 555 1333 IMAGE-HIGH-RES 1-s2.0-S2468823122006459-mmc1.docx https://s3-eu-west-1.amazonaws.com/prod-ucs-content-store-eu-west/content/pii:S2468823122006459/mmc1/MAIN/application/vnd.openxmlformats-officedocument.wordprocessingml.document/627da494d8f7e4213e15b25d4f8c1fae/mmc1.docx mmc1 mmc1.docx docx 2352861 APPLICATION 1-s2.0-S2468823122006459-am.pdf https://s3-eu-west-1.amazonaws.com/prod-ucs-content-store-eu-west/content/egi:1043VXGRTL4/MAIN/application/pdf/08d945ef6ab92068d416497d6b52ac57/am.pdf am am.pdf pdf false 1918101 AAM-PDF MCAT 112759 112759 S2468-8231(22)00645-9 10.1016/j.mcat.2022.112759 Scheme 1 Catalytic selective oxidation of CyOH to CyONE over CaO-MgO catalyst with TBHP oxidant under solvent-free conditions. Scheme 1 Scheme 2 Plausible mechanistic pathway of catalytic selective oxidation of CyOH to CyONE over CaO-MgO catalyst with TBHP oxidant under solvent-free conditions. Scheme 2 Fig. 1 X-ray diffraction pattern of all the synthesized BMO mixed-oxide catalysts. Fig 1 Fig. 2 CO2–TPD curves of all the synthesized BMO mixed-oxide catalysts. Fig 2 Fig. 3 (A) SEM images of 1CaO-1.5MgO (CM-4), (B) particle size distribution of 1CaO-1.5MgO (CM-4), and (C) SEM images of 1.5CaO-1MgO (CM-2), (D) particle size distribution of 1.5CaO-1MgO (CM-2) catalysts calcined at 773 K / 5 h. Fig 3 Fig. 4 (A) TEM images of 1.5CaO-1MgO (CM-2) and (B) particle size distribution of 1.5CaO-1MgO (CM-2), and (C) TEM images of 1CaO-1.5MgO (CM-4) and (D) particle size distribution of 1CaO-1.5MgO (CM-4) catalysts calcined at 773 K / 5 h. Fig 4 Fig. 5 The selective catalytic oxidation of CyOH with TBHP over a series of CaO–MgO mixed oxide catalysts. Reaction conditions: 13 mmol of CyOH, 78 mmol of TBHP, 413 K of reaction temperature, 150 mg of catalyst, 15 h of reaction time, and 800 rpm of stirring speed. Fig 5 Fig. 6 Effect of reaction temperature on selective oxidation CyOH to CyONE under solvent-free–conditions. Reaction conditions: 13 mmol of CyOH, 78 mmol of TBHP, 150 mg of catalyst loading (CM–4), 15 h of reaction time, and 800 rpm of stirring speed. Fig 6 Fig. 7 Influence of reaction time on the selective oxidation of CyOH to CyONE under solvent-free–conditions. Reaction conditions: 13 mmol of CyOH, 150 mg of catalyst loading (CM–4), 78 mmol of TBHP, 413 K of reaction temperature, and 800 rpm of stirring speed. Fig 7 Fig. 8 Influence of Cyclohexanol/TBHP ratio on selective catalytic oxidation of CyOH to CyONE under solvent-free–conditions. Reaction conditions: 333 K of temperature, 13 mmol of CyOH, 78 mmol of TBHP, 150 mg of catalyst loading (CM–4), 15 h of reaction time, and 800 rpm of stirring speed. Fig 8 Fig. 9 Effect of catalyst weight (CM–4) on the selective oxidation of CyOH to CyONE under solvent-free–conditions. Reaction conditions: 13 mmol of CyOH, 78 mmol of TBHP, 413 K of reaction temperature, 15 h of reaction time, and 800 rpm of stirring speed. Fig 9 Fig. 10 The effect of the solvent on the conversion of CyOH and selectivity. Reaction conditions: 13 mmol of CyOH, 78 mmol of TBHP, 413 K of reaction temperature, 150 mg of catalyst loading (CM–4), 15 h of reaction time, and 800 rpm of stirring speed. Fig 10 Fig. 11 Structure-activity relationship between specific surface area and basic sites, and areal activity of 2CaO-1MgO (CM–1), 1.5CaO-1MgO (CM–2), 1CaO-1MgO (CM–3), 1CaO-1.5MgO (CM–4), and 1CaO-2MgO (CM–5) catalysts for selective oxidation CyOH to CyONE under solvent-free–conditions. Fig 11 Fig. 12 The recyclability of the 1CaO-1.5MgO (CM–4) catalysts regarding the stability to CyOH oxidation with TBHP under solvent-free–conditions. Reaction conditions: 13 mmol of CyOH, 78 mmol of TBHP, 413 K of reaction temperature, 150 mg of catalyst loading (CM–4), 15 h of reaction time, and 800 rpm of stirring speed. Fig 12 Fig. 13 (A) XRD pattern, (B) CO2-TPD and (C) FTIR spectra of fresh and used 1CaO-1.5MgO (CM-4) catalyst. Fig 13 Table 1 The physicochemical properties of all the prepared catalysts. Crystallite size (D) and Basic sites (BS). Table 1 Catalyst D (nm) a SBET (m2/g) b BS (μmol/g) c Composition (wt.%) d Calculated Measured CaO MgO CaO MgO CaO –– 30.4 –– –– –– –– –– 2CaO – 1MgO 20.39 77.1 93.1 66.7 33.3 65.9 34.1 1.5CaO – 1MgO 23.42 81.4 115.8 60.0 40.0 59.3 40.7 1CaO – 1MgO 22.61 86.5 122.0 50.0 50 48.6 51.4 1CaO – 1.5MgO 19.02 97.6 152.4 40.0 60.0 41.0 59.0 1CaO – 2MgO 21.72 88.6 129.4 33.3 66.7 32.9 67.1 MgO –– 52.1 –– –– –– –– –– 1CaO – 1.5MgO e 31.51 63.2 98.7 40.0 60.0 35.7 55.9 a from XRD analysis. b from BET analysis. c from CO2-TPD results. d from ICP-OES analysis. e spent catalyst (after the 4th cycle). Table 2 The Catalytic oxidation of different alcohols to aldehydes over CaO-MgO (CM-4) catalyst with TBHP oxidant under solvent-free conditions. Reaction conditions: 13 mmol of alcohol, 78 mmol of TBHP, 413 K of reaction temperature, 150 mg of catalyst, 15 h of reaction time, and 800 rpm of stirring speed. Table 2 Image, table 2 Table 3 Assignment of IR bands in the cyclohexanol, cyclohexanone adsorbed, and spent CM-4 catalysts. Table 3 Vibrations (cm−1) Assignments 1064, 1165 the stretching vibrations of CO related to phenolate species 1325, 1582 assigned to CC bond symmetric and asymmetric stretching vibrations in aromatic ring 1712 Stretching vibration of carbonyl group (C=O) 2867, 2937 C-H stretching vibrations of the aromatic ring 3258 correspond to the OH stretching vibration of the hydroxyl group Table 4 Comparison of performance of the CaO-MgO (CM-4) solid base catalyst with reported catalysts for catalytic oxidation of CyOH reaction. Table 4 S. No Catalyst T (K) t (h) Conversion% Selectivity% Refs. 1 Au/Mg1-xCu1-xCr2O4 573 40 99 90 [7] 2 Au/CuMnAlOx 343 6 96 100 [14] 3 (Au/n-MOs) 523 15 48 96 [15] 4 Au/MgCuCr2O4 533 20 81 86 [20] 5 V2O5/(Bmim)Br 343 2 70 85 [57] 6 TiO2 – 20 71 85 [58] 7 CuO-ZnO-MgO 533 2.5 55 99 [17] 8 Na2WO4 353 5 65 80 [21] 9 Fe (III)-substituted polyoxotungstates 353 12 92 99 [22] 10 Graphene/CuNiRu 545 8 95 86 [59] 11 Cu/ZrO2 523 2 62 93 [27] 12 CaO-MgO 413 15 85.3 90.9 Thiswork Highly efficient solvent-free oxidation of cyclohexanol to cyclohexanone over nanocrystalline CaO–MgO binary metal-oxide catalysts Siddaramagoud Bandalla Methodology Data curation Investigation a b Vijaykumar Dosarapu Methodology Data curation Investigation a Ganesh Babu Bathula Methodology Data curation Investigation a Madhu Ravula Methodology Data curation Investigation a Jyothi Yadagiri Methodology Formal analysis Data curation Investigation b Parikshit Gogoi Methodology Data curation Investigation c Mallesham Baithy Supervision Conceptualization Methodology Validation Formal analysis Investigation Data curation Writing – review & editing Visualization d ⁎ Sreekantha B Jonnalagadda Conceptualization Data curation Visualization e ⁎ Chandra Shekar Vasam Supervision a ⁎ a Department of Pharmaceutical Chemistry, Telangana University, Nizamabad 503322, India Department of Pharmaceutical Chemistry Telangana University Nizamabad 503322 India aDepartment of Pharmaceutical Chemistry, Telangana University, Nizamabad 503322, India b Department of Integrated Chemistry, Palamuru University, Mahbubnagar 509001, India Department of Integrated Chemistry Palamuru University Mahbubnagar 509001 India bDepartment of Integrated Chemistry, Palamuru University, Mahbubnagar 509001, India c Department of Chemistry, Nowgong College (Autonomous), Nagaon, Assam, India Department of Chemistry Nowgong College (Autonomous) Nagaon Assam India cDepartment of Chemistry, Nowgong College (Autonomous), Nagaon, Assam, India d Department of Chemistry, School of Science, Gandhi Institute of Technology and Management (GITAM) University, Hyderabad, Telangana 502329, India Department of Chemistry, School of Science Gandhi Institute of Technology and Management (GITAM) University Hyderabad Telangana 502329 India dDepartment of Chemistry, School of Science, Gandhi Institute of Technology and Management (GITAM) University, Hyderabad, Telangana 502329, India e School of Chemistry & Physics, University of KwaZulu-Natal, Durban, South Africa School of Chemistry & Physics University of KwaZulu-Natal Durban South Africa eSchool of Chemistry & Physics, University of KwaZulu-Natal, Durban, South Africa ⁎ Corresponding authors. The development of inexpensive solid-base CaO–MgO binary metal oxides (BMOs) as efficient and reusable heterogeneous catalysts was reported for the selective production of cyclohexanone (CyONE) from cyclohexanol (CyOH) oxidation under solvent-free conditions. These BMOs were prepared by ultra–diluted co-precipitation procedure and characterized by several sophisticated techniques, such as XRD, BET, CO2–TPD, FTIR, SEM, EDX, TEM, and ICP-OES. The crystallinity of the BMO samples was found from the XRD analysis and the estimated crystalline size range of the samples is 19.02–23.42 nm. The BET and CO2–TPD analysis of prepared samples gave information regarding the specific surface area and basicity (concentration and strength). The morphology and particle size of the 1CaO–1.5MgO sample were obtained from the SEM (61.8 nm) and TEM (55.2 nm) analyzes. Among all the catalysts, the 1CaO–1.5MgO catalyst displayed a higher conversion of CyOH (∼85%) with superior selectivity to CyONE product (∼90.97). The greater catalytic efficiency of the 1CaO–1.5MgO catalyst was attributed to the greater specific surface area, the smaller particle size of the MgO, the optimized composition of CaO–MgO (1:1.5), and higher basic strength along with a large number of basic sites. We have also optimized various reaction parameters including reaction temperature, time, catalyst weight, and solvent. Catalyst recyclability experiments were carried out to disclose that the catalyst has more robust, stable, and easily recyclable. The 1CaO–1.5MgO catalyst was very stable up to the 4th cycle. We also studied the spent catalyst characterization (XRD, BET, FTIR, SEM, TEM, and ICP-OES) to know the fundamental reason for the deactivation of the CM-4 catalyst. Graphical abstract Image, graphical abstract Keywords Cyclohexanol Cyclohexanone TBHP CaO–MgO Basic sites Solvent-free Data Availability No data was used for the research described in the article. 1 Introduction In recent years, CyONE has become an important precursor for the production of nylon polymer in various industries. According to literature, CyONE is manufactured on a large scale with the (i) catalytic oxidation of cyclohexane through the formation of CyOH, (ii) hydration of cyclohexene, (iii) partial hydrogenation of phenol, (iv) oxidative dehydrogenation or direct oxidation of CyOH in the presence of an oxidant and (v) hydro-alkylation of benzene [1–5] Depending on the reaction process, the use of catalysts was demonstrated. Considering the various practical difficulties in the methods. The conversion of CyOH to CyONE via oxidative dehydrogenation or direct oxidation provides more opportunities to further scale up the manufacturing process by exploring appropriate catalysts. However, the catalytic oxidative-dehydrogenation of the cyclohexanol process may be restricted by thermodynamic equilibrium for practical conditions [6] Moreover, the catalysts investigated for this reaction are gradually deactivated through blocking of the active sites present on the catalyst surface by the side–products [7]. Therefore, the use of an oxidant was suggested in the direct catalytic oxidation of CyOH to suppress significantly the formation of carbonaceous species deposits on the active sites. Several types of homogeneous- and heterogeneous-based catalysts are reported for the selective oxidation of CyOH to CyONE [8–10]. Owing to practical problems such as recyclability and stability of homogeneous catalysts, heterogeneous catalysts are promoted as a suitable alternative to homogeneous catalysts [11–13]. A variety of heterogeneous catalytic systems including noble metal-supported catalysts, single/ binary/ mixed metal oxides, promoted oxide catalysts, zeolites, etc. are described in the earlier literature for selective oxidation of CyOH to produce CyONE product [14,15]. Li et al. prepared gold nanoparticles (AuNPs) encapsulated in the extra-large spherical cages of ordered mesoporous silica EP-FDU-12 for the gas-phase oxidation of CyOH 939 h−1 at 230°C and examined the particle size effect of catalytic activity [16]. Sancheti and co-workers have reported vapor phase dehydrogenation of CyOH to CyONE was carried out over monovalent copper using CuO-ZnO-MgO catalyst. The catalyst was prepared by co-precipitation CyOH conversion of 55.0% resulting in 99.2% selectivity of CyONE at 260 °C [17]. Nevertheless, the cost, preparation method, thermal stability of the catalyst, solvent for oxidation, use of the external base, and nature of the active sites of catalyst are the important concerns in promoting a suitable heterogeneous catalyst for selective oxidations [18–24]. Binary metal oxides (BMOs) are a class of heterogeneous catalysts, easy to synthesize, exhibits good thermal stability, and are found to exhibit good productivity and selectivity for the catalytic oxidation of alcohols including CyOH [3,17,25,26]. BMOs can be obtained easily from different types of metallic combinations with the periodic groups (for example alkali metals, alkali-earth metals, transition metals, rare-earth metals, or noble metals) via different preparation methods, viz., co-precipitation, wet impregnation, sol-gel, and solid-state mixing. A variation in the catalyst preparation method may provide different physicochemical properties and diversity in active sites that would be beneficial for intended catalysis [25–27]. Furthermore, BMOs can exhibit appreciable synergistic effects during catalytic transformation. We are interested to explore the catalytic potential of BMOs of inexpensive and earth-abundant alkaline-earth metals in organic oxidations. So far, these oxides (single or binary) are mainly used as catalyst supports for transition and inner-transition metal-based heterogeneous catalysts [28,29]. However, few reports disclosed the suitability of structural features of individual and mixed oxides of alkaline earth metals to function directly as main catalysts for certain organic transformations. They can catalyze all most base-catalyzed reactions. The arrangement of M+2 cation and O−2 anion and the surface defects are found to be crucial concerns about the catalytic efficiency of these alkaline earth metal oxides. As compared, their BMOs are thermally stable and surface basic strength will be superior to individual alkaline-earth metal oxides [30–32]. Herein we describe the catalytic efficiency of a series of inexpensive binary oxides CaO-MgO towards the selective oxidation of CyOH to CyONE in high yields in the presence of TBHP oxidant under solventless conditions. Synthesis of a series of CaO-MgO mixed oxides by co-precipitation method and their characterization by various analysis techniques, including X-ray diffraction (XRD), BET specific surface area, Fourier Transform Infrared Spectroscopy (FT–IR), Scanning Electron Microscopy-EDX (SEM), Transmission Electron Microscopy (TEM), CO2–Temperature Programmed Desorption (CO2–TPD) and Inductively Coupled Plasma - Optical Emission Spectrometry (ICP-OES) was performed. Reaction parameters like the molar ratio of CaO and MgO, reaction temperature, reaction time, the molar ratio of cyclohexanol to TBHP, structure-activity relationship between the basic sites, and catalytic efficiency were optimized. 2 Experimental section 2.1 Materials and chemicals Mg(NO3)2·6H2O (Analytical grade, S.D fine Chemicals), Ca(NO3)2·4H2O (Analytical grade, Avra chemicals), NaOH (Analytical grade, S.D fine Chemicals) used were of laboratory grade, TBHP and Cyclohexanol (Analytical grade, Sigma Aldrich), India and we used without further purification. 2.2 Catalyst preparation A series of CaO–MgO composition-based BMOs with different mass ratios (2:1, 1.5:1, 1:1, 1:1.5, 1:2) were prepared by the ultra-high dilution co-precipitation method. In this procedure, the appropriate amounts of respective soluble metal salts of Mg(NO3)2·6H2O, and Ca(NO3)2·4H2O were slowly dissolved in a minimum quantity of de-ionized water with magnetic stirring. This mixture was diluted with 1000 mL of de-ionized water for 1 g of the catalyst. Later, 0.1 M NaOH solution was slowly added to the above reaction mixture with magnetic stirring until pH=12 was reached. The obtained precipitate was continuously stirred for 24 h at room temperature and then aged for another 24 h. Thereafter, a precipitated solution was filtered off by Whatman filter paper under the vacuum pump and washed with deionized water several times to neutralize the products. The solid sample obtained was kept in a hot air oven and dried at 383 K for 12 h and finally calcined at 773 K for 5 h with a temperature rate of 5 K/min under static air conditions. As well, individual MgO and CaO oxide samples were also prepared by the same procedure. For our convenience, all the prepared BMOs in different mass ratios viz., CaO–MgO (2:1), CaO–MgO (1.5:1), CaO–MgO (1:1), CaO–MgO (1:1.5) and CaO–MgO (1:2) are designated as CM–1, CM–2, CM–3, CM–4, and CM–5, respectively. 2.3 Catalyst characterization The structural properties of the above BMO catalysts were studied with different sophisticated characterization techniques. The powder X-Ray diffraction (XRD) was collected using X–pert pro-X-ray diffractometer (P analytical BV, Netherlands) operating with a Ni filter and Cu Kα radiation source (=1.5406 Å) with a range of scan 2θ=0–80˚ at 40 Kv and 30 mA. The crystallite size of BMO samples was calculated with help of the Debye–Scherrer equation. The specific surface area of BMO catalysts was determined by a single-point BET analysis of the N2 adsorption isotherms using the Micromeritics ASAP 2020 device at 77 K of temperature through a thermal conductivity detector. Initially, all the BMO catalysts were subjected to heating for 3 h at 413 K to remove the physisorbed surplus moisture from the catalyst surface. A Micrometrics AutoChem 2910 instrument equipped with a TCD is performed to calculate the basic strength and concentration of catalysts using the CO2-TPD technique. Before the studies, the BMO catalyst is loaded and pre-treated in an inert gas flow (He was 99.9%, 50 mL min–1) at 573 K of temperature for 2 h. After pre-treatment, the catalyst was soaked with 5% CO2 at 373 K of temperature for 1 h, and afterward, the helium gas was passed through the sample at the same temperature for 1 h to remove the physisorbed carbon dioxide from the catalyst surface. This experiment was performed from 373 to 1200 K of heating in a helium gas flow of 30 ml min–1 with a heating rate of 10 K min–1. The IR results were obtained on an FT–IR spectrometer (M/s. Perkin–Elmer) at ambient experimental conditions using KBr discs in the scan range 4000–400 cm–1. For cyclohexanol and cyclohexanone adsorbed-FTIR analysis, the CM-4 catalyst was dried at 373 K for 1 h. The oven-dried sample (∼100 mg), was contacted with 0.1 mL of adsorbates directly. The adsorbed sample vial was kept in a vacuum dried at 393 K for 1 h to remove the physisorbed adsorbates from the catalyst surface. Then, the FTIR spectrum was performed with a nominal resolution of 4 cm−1 in the spectral range of 400−4000 cm−1. The morphology of particles was investigated by ZEISS EVO18 model Scanning Electron Microscopy (SEM), imaging at 40 Kv and 30 mA at a scan rate of 0.38 min–1. TEM images are recorded on a JEM–2010 (JEOL) equipped with a slow-scan CCD camera at an accelerated voltage of 200 kV. Before the TEM analysis, the BMO catalysts were ultrasonicated in ethanol solvent and placed on a copper grid and then the solvent was removed in a hot air oven at 353 K. 2.4 Catalytic oxidation of cyclohexanol The simple liquid-phase selective oxidation of the CyOH reaction was performed in a 50 ml of RB flask with a temperature controller magnetic stirrer under refluxed conditions. The RB flask was charged with CyOH (13 mmol), 70% aqueous TBHP (78 mmol), and 150 mg of catalyst (BMO or single metal oxide), and the mixture was stirred aggressively at ∼800 rpm in an oil bath. After each run, the catalyst was removed by centrifugation, and obtained liquid products were analyzed by a GC (M/S. SHIMADZU Instruments, Japan, model: QP–5050) equipped with a DB–5 MS capillary column and an FID detector. The used catalyst was washed with deionized water and oven-dried at 373 K for 12 h for further use. Finally, the conversion of CyOH and the selectivity of products were estimated using the following equations. Conversion ( % ) = n R t = 0 − n R t n R t = 0 × 100 Selectivity ( % ) = n i t n R t = 0 − n R t × 100 Where, n i t → moles of product \"i\" formed n R t = 0 → initial moles of reactant \"R\" n R t → final moles of reactamt \"R\" 3 Results and discussion 3.1 Catalyst characterization The powder X-ray diffraction (XRD) pattern of BMOs (CaO–MgO) provided information about their crystallinity. As shown in Fig. 1 , the peaks observed at 2θ values of 30.0°, 37.5°, 43.0° 62.5°, 75.45°, and 79.5° could index the cubic crystal system of CaO–MgO which is consistent with reported literature. The XRD pattern indicates that the peaks can be attributed to the MgO, Mg(OH)2, CaO, Ca(OH)2, and CaCO3 phases [33–36]. Interestingly, all the prepared BMO samples exhibited a dominant cubic phase of MgO. Our closer observation discloses that the XRD results of the BMO samples are broad and shifted to lower 2θ angles in comparison to pure MgO (2θ = 43.0°). The broadening of the XRD peaks can highlight the nanocrystalline nature of the BMO samples, which is more pronounced in the CM-4 sample. As well, the intensity of the CaO peaks was decreased in the BMO samples, which could be notable either due to the doping of Ca2+ ions into the MgO lattice or the amorphous nature of the calcium species. In addition, we also calculated the lattice parameter of the high-intensity peak of the MgO (200) plane, and obtained results are listed in Table 1 . Evidently, the lattice parameter was shown to increase after the incorporation of Ca2+ ions into the MgO lattice. These dissimilar results, like peak shift, variation in the lattice parameter, and reduction of peak intensity due to calcium species obviously confirm the formation of some portion of Ca2+ ion-doped MgO solid solutions. The crystalline size of MgO for each BMO sample was also estimated using the high-intense peak (2θ = 43.0°) in the XRD pattern by the Scherrer equation and the results are provided in Table 1. The crystallite size calculated from XRD data using the Scherrerۥ s equation was found to be in the range of 23.42–19.02 nm. The presence of different phases (metal oxides and hydroxides) led to the hypothesis that the CaO-MgO-based BMOs are capable of serving as effective solid-base catalysts for organic oxidations [37,38]. The calculated BET-specific surface area of all the BMOs and individual metal oxides (MgO and CaO) are shown in Table 1. The BET-specific surface area of the pristine MgO and CaO samples are ∼52.1 and 30.4 m2/g, respectively. However, the specific surface area of the CM-1, CM-2, CM-3, CM-4, and CM-5 samples was found to be ∼77.1, 81.4, 86.5, 97.6, and 88.6 m2/g, respectively. These results indicate that the BMOs have a larger specific surface area than their individual metal oxides i.e., MgO and CaO [39,40]. The single metal oxide particles may agglomerate to form bigger particles and display smaller surface areas. On the other hand, among the BMOs, the one designated as CM–4 with a Ca/Mg mass ratio of 1:1.5 showed a higher BET-specific surface area than other BMOs. This result indicated that the optimum molar ratio for the CaO–MgO was 1:1.5. Further increase in the mass ratio i.e., 1:2 resulted in a decrease in surface area. Fig. 2 represents the CO2–TPD experiment results of all the synthesized BMOs catalysts obtained in the temperature region of 323−1073 K. It may be attributable to the changes in the activation energy of CO2 desorption from the different basic sites present in the BMO samples. The estimated number of basic sites was listed in Table 1. The CO2–desorption peaks observed at 〈 473 and 673−473 K, and 〉 673 K are attributed to weak, medium, and strong basic sites, respectively [41]. The CO2–TPD results demonstrated the key role of the mass ratio of the MgO to CaO towards enhancement in the total number of basic sites (Table 1). Generally, the individual CaO oxide sample showed higher basic strength than the pure MgO oxide sample, and the mixed metal oxides of the CaO-MgO sample showed more basic strength in comparison to individual oxide samples. From the CO2-TPD results, the high amount of CaO present in the CaO-MgO sample exhibits lower basicity in comparison to the high amount of MgO present in the CaO-MgO samples. At higher CaO-loading, the BMO sample was easily agglomerated and formed larger particles, which resulted in the blockage of the basic sites. These results have well coincided with the BET-specific surface area and crystallite size of the BMO catalysts (Table 1). Hence, the total basic sites decreased with increasing in the CaO-loadings, but the strength of the basic sites of BMO samples is improved (Fig. 2). As well, at optimum CaO-loading, the BMO sample exhibited a lower crystallite size of the MgO and higher specific surface area due to the synergetic interaction between the CaO and MgO in the BMOs. Specifically, the BMO catalyst (CM–4) showed a CO2 desorption peak at > 673 K which is attributable to the strongly bound basic sites of the sample. The increasing basic sites of the catalysts are found in the order of MgO < CaO < CM–1 < CM–2 < CM–3 < CM–5 < CM–4. The BMO catalyst of CM-4 has the highest number of basic sites in which the mass ratio of the Ca: Mg is 1:1.5. The FTIR spectra of BMOs are shown in Fig. S1. The IR bands observed in the region of the 650–850 cm–1are ascribed to different vibrational modes of Mg–O, Ca–O, and Mg–O–Mg groups [42]. The band at ∼2340 cm–1 is assigned to the strong interaction between Ca and CO2 species. The band at ∼1750 cm–1 indicates the formation of polydentate carbonate with calcium. The typical Ca–O–Mg modes are assigned to a band at 860 cm−1. The broad IR band observed in the region of 3600–3000 cm−1 is mainly corresponding to the H–bonded hydroxyl groups. On the other hand, the IR band observed in the region of ∼3790–3634 cm−1 is due to hydroxyl groups from the surface of the CaO-MgO catalysts [33]. These hydroxyl groups play a key role in the improvement of basic sites of BMO catalysts. The IR band observed at ∼1100 cm−1 is assigned to the Ca–O stretching interaction. Further, IR bands detected at 1389–1470 cm−1 and 870 cm−1 belong to the stretching and bending modes of calcium carbonate species [33,42,43]. By SEM analysis, the information about the morphology and particle size distribution of the MgO particles in the CM–4 and CM-2 catalysts were obtained and shown in Fig. 3 . The SEM image of the catalyst indicated that the structural morphology of the synthesized CM–4 was slightly agglomerated particle with an average particle size of 61.8 nm, whereas the CM-2 catalyst was exhibited a bulky group of the nanoparticles with an average particle size of 69.9 nm. This image represents a lump of organized grains. The analysis gives information regarding the dimension of the grains to be in the order of a hundred nanometres [44–46]. TEM analysis was also carried out to investigate the structural evolution of the BMO at the atomic level and obtained images were represented in Fig. 4 . It was difficult to estimate the particle size of BMOs from TEM images because they were prepared by the precipitation procedure without a protective agent. We have estimated the average particle size of the CM-4 and CM-2 catalysts. The TEM images of the CM–4 and CM-2 samples indicate that most grains exhibit irregular shapes with an average particle size of 55.2 and 63.8 nm, respectively, which is consistent with the result of the XRD and BET analysis. 3.2 Catalytic activity studies 3.2.1 Catalysts screening test The selective catalytic oxidation of CyOH was performed over BMO (CaO–MgO) catalysts under solvent-free conditions in the batch reactor and the results obtained are presented in Fig. 5 (Scheme 1 ). The oxidative conversion results obtained with single metal oxides under solvent-free conditions are included. Results of oxidation conducted in organic solvents are discussed separately in the next sections (3.2.6). In each experiment, 13 mmol of cyclohexanol, 78 mmol of TBHP, 413 K of reaction temperature, 10 wt.% of catalyst (BMO or pure MgO or CaO) concerning cyclohexanol, 15 h of reaction time, and ∼800 rpm of stirring speed is used as standard characteristics under solvent-free conditions. In Fig. 5, the individual MgO and CaO metal oxide catalysts showed lower conversion of CyOH (56.3 and 52.0%) with selective toward the CyONE (55.0 and 57.9%) product, respectively. On the other hand, the BMOs composed of various mass ratios of MgO and CaO catalysts have shown a higher conversion of CyOH and selectivity towards CyONE product in comparison to that of individual single metal oxide catalysts. Among all the BMO catalysts, the CM–4 catalyst exhibited superior catalytic efficiency due to the greater specific surface area, optimal CaO–MgO composition (1:1.5), and a large number of basic sites. Therefore, the concentration and strength of the basic sites are played a significant role in the selective transformation of CyOH to CyONE. The CyOH conversions were found to be 52.06, 68.46, 70.56, 75.21, 85.36, 77.58, 56.36%, and the selectivity of CyONE towards 55.05, 68.5, 70.54, 79.37, 90.97, 81.25, 57.92% for the CaO, CM–1, CM–2, CM–3, CM–4, CM–5, MgO, catalysts, respectively. 3.2.2 Effect of reaction temperature In each catalytic reaction, the reaction temperature has played a significant role because the rate constants are significantly influenced by the reaction temperature. The effect of temperature on CyOH oxidation reaction was investigated at different temperatures of 333, 353, 373, 393, 413, and 433 K over CM–4 catalysts, and remain conditions were kept constant (Fig. 6 ). There was no conversion of CyOH between RT to 313 K. By increasing temperature from 313 to 333 K, lower conversion of CyOH ∼27% with ∼99% of selectivity towards CyONE was noticed. However, when the oxidation experiment was monitored at four different temperatures 353, 373, 393, and 413 K, the conversion of CyOH was increased gradually but no considerable change in the selectivity of CyONE. It is also noticeable that when the temperature was further increased to 433 K, the selectivity towards CyONE was reduced, possibly due to the over oxidation of CyOH to produce the by-products. Moreover, higher reaction rates were attained at a high reaction temperature of 433 K. This observation reveals the activation of various basic sites at higher reaction temperatures excluding the main active sites producing CyONE. These activated basic sites become responsible for the production of various side products, such as cyclohexenone, ɛ–caprolactone, and adipic acid as by-products [7,20,47,48]. Therefore, the reaction temperature of 413 K with the maximum yield of the desired product was measured as the optimum temperature to study the oxidation reaction. 3.2.3 Effect of reaction time Reaction time was also considered another important reaction parameter in CyOH oxidation that improved the yield of CyONE. The reaction times varied between 1 and 18 h and the obtained results are represented in Fig. 7 . The CyOH conversion rate was observed as 9.1% and selectivity 98.5% at 1 h, whereas the reaction time was raised to 15 h, then the conversion rate increased significantly. Further increase in reaction time (>15 h) resulted in a decrease in selectivity to 71.2%. This may be due to the over-oxidation of the CyONE in the presence of TBHP taking place to produce by-products with a longer reaction time. Therefore, 15 h of reaction time is observed as optimum reaction time to produce selectively the CyONE. 3.2.4 Influence of cyclohexanol/TBHP molar ratio Fig. 8 illustrates the oxidation of CyOH reaction examined over CM–4 BMO catalyst at various molar ratios of the substrate to oxidant from 1:0 to 1:12. There was no oxidation when this reaction was carried out in the absence of the oxidant. As we increase the molar ratio of CyOH to TBHP to 1:6, the CyOH conversion increased gradually without a significant decrease in the selectivity of the CyONE product. However, when the substrate to oxidant ratio was increased to 1:12, a decrease in the selectivity was noticed without considerable change in conversion. This observation also supports the over-oxidation of CyOH at higher CyOH/TBHP molar ratios. 3.2.5 Effect of catalyst loading The influence of catalyst loading on the catalytic oxidation of CyOH to CyONE was investigated (Fig. 9 ). These reactions were carried out using a high-performance CM–4 catalyst at 413 K, 1:6 molar ratio of CyOH to TBHP, 15 h of reaction time, and 800 rpm of stirring speed. As the catalyst loading increased from 75 mg to 150 mg, the conversion also enhanced from 37.3% to 91.4%, whereas the selectivity decreased from 98.1 to 91.3%. This observation reveals that there is an increase in the number of catalytically active sites present on the catalyst surface. Further, an increase in the catalyst loading to 200 mg has led to a drastic decrease in the selectivity of CyONE (Fig. 9). This phenomenon indicates that as the catalyst loading increases, the residence time of CyOH on the surface of the catalyst also improves and favors the over oxidation to by-products (cyclohexenone, ɛ–caprolactone, adipic acid) and resulting in decreased CyONE selectivity. Therefore, a catalyst loading of 150 mg resulted in 83.2% of conversion, and 90.1% of selectivity was considered the best choice for this reaction. 3.2.6 Effect of solvent We have also investigated the influence of organic solvents such as acetonitrile, and ethanol on the oxidation of CyOH over CM–4 catalysts. As shown in Fig. 10 , the effect of solvent on the conversion of CyOH is minimal, but slightly changed in the selectivity of the desired product. These results indicate that there is no significant variation in the activity performance of the catalyst in the presence and absence of the solvent. Therefore, we propose that this oxidation reaction under solvent-free conditions over the CM–4 catalyst is advantageous. 3.2.7 Structure-activity relationship We have shown the important role of specific surface area and surface basic sites in catalyzing the oxidation of CyOH reaction (Fig. 11 ). The nature of the active catalytic site was determined by the CO2–TPD technique. The optimum amount of MgO in the CaO–MgO-based BMO catalyst indicates the beneficial effect of increasing the number of basic sites on the catalyst surface. Fig. 11 clearly shows a clear correlation between the increasing trend of catalytic activity and the order of increasing basic sites and the specific surface area of the catalysts studied. The concentration and strength of the basic sites of the synthesized catalyst are in the order of CM–1 〈 CM–2 < CM–3 < CM–5 〉 CM–4. These results demonstrate the important role of basic sites of the catalyst in the selective oxidation of CyOH reaction. 3.2.8 Plausible reaction mechanism Generally, the liquid-phase alcohol oxidation reactions could be examined under the various types of solvents, such as aqueous, organic, and solvent-free. Irrespective of the solvent environment used, the key rate-determining step is commonly recognized to be the activation C–H bond on the accompanying α–carbon, even though few reports have shown the initial dissociation of the alcohol molecule also controls the rate. As per previous reports, the proposed reaction mechanism for the oxidation of alcohol using peroxides (i.e., TBHP or H2O2) as oxidants over the solid catalysts, involved radical intermediates [49]. On the other hand, the TBHP is adsorbed on the catalyst surface to form the active peroxide-metal oxide as an intermediate, which can easily oxidize the alcohol functional group in the substrate and return to the TBHP [50–52] .Owing to these reports, it was found that the addition of scavengers has no considerable effect on product distribution over solid catalysts. Mainly, the catalytic oxidation of alcohol proceeds in three steps: i) the dissociative adsorption of the alcohol moiety on the catalyst surface to produce a surface alkoxy intermediate; ii) activation of the C–H bond on the accompanying α–carbon of alcohol to form carbonyl product and iii) desorption of the carbonyl compound from the catalyst surface and produce fresh catalyst [11,20,53]. We made efforts to retrieve a plausible reaction mechanism for the catalytic oxidation of CyOH to CyONE over the CaO–MgO-based BMO catalyst (Scheme 2 ). Initially, the TBHP oxidant adsorbs on the BMO catalyst surface to produce a peroxide ion (–OOH). Then, the reaction can be initiated through the O–H bond interaction of CyOH with surface basic sites (i.e., surface hydroxyl groups) present on the CaO–MgO catalyst, which will produce the alkoxide ion of the CyOH [54]. The peroxide ion then interacts with the alkoxide of the CyOH on the catalyst surface to form six-membered transition states. In the next step, the tertiary butyl alcohol desorption takes place from the catalyst surface. Finally, the desired CyONE product can desorb from the catalyst surface along with H2O molecules followed by the regeneration of the fresh catalyst. Therefore, the concentration and strength of the basic sites play a key role to produce a high yield of CyONE in the oxidation of CyOH. This observation suggests that the mechanism involves the TBHP activation by CaO-MgO active center to produce a peroxy intermediate. Yet, the exact mechanism of this reaction is not clear and the role of the catalyst should be further required to investigate in detail. We also performed the FTIR spectra of adsorbed reactant and product on the catalyst surface and the results are shown in Fig. 13C. The adsorption study of CyOH and CyONE on CM-4 catalyst at room temperature has displayed a series of IR bands at ∼1064, 1165, 1325, 1582, 1712, 2867, 2937, 3258 cm−1 and corresponding information is given in Table 3. From these analyzes, FTIR spectra of CyONE adsorbed on the catalyst surface were shown a sharp peak at ∼1750 cm−1, which is attributed to the existence of the ketone functional group (C=O) on the catalyst surface. The CyOH adsorbed FTIR spectrum of catalyst exhibit a distinct broad peak between 3500 and 3050 cm−1, which is due to the OH stretching vibrational frequencies of the CyOH on the catalyst surface. The CH stretching vibrational frequencies of adsorbed catalyst were found between 2950 and 2850 cm−1, which is corresponding to the saturated hydrocarbon without any double or triple bond in both cases. 3.2.9 Catalytic oxidation of different alcohols To explore the substrate scope and wider applicability of the catalyst, a series of structurally diverse aromatic primary and secondary alcohols were subjected to oxidation over a high-performance CM-4 catalyst under the optimized reaction conditions. The TBHP-mediated oxidation of different alcohols has various substituents, such as -CH3, –OCH3, -OH, -NO2, -Cl, -Br, etc. The obtained results are represented in Table 2 . As we clearly see from Table 2, we found that various substituents (electron-withdrawing and donating groups) played a key role in the conversion and selectivity of products. The electron-donating groups on the alcohol showed improved CyOH conversion and enhanced selectivity of CyONE product whereas electron-withdrawing groups on the alcohol exhibited diminishing conversion and selectivity of compounds. This can be explained by the fact that the electron-donating groups increases the electron density at the -OH group of the compound and easily produces the alkoxide ion of the CyOH, then activation of the C–H bond on the accompanying α–carbon of alcohol to form carbonyl functional group. In case of the presence of electron-withdrawing group on the alcohol, decreases the electron density on the oxygen of the -OH group and then it does not form alkoxide ion easily from alcohols [entry 3–13]. In general, electron density on the aromatic ring is important in the oxidation reaction, electron-donating groups increase electron density on the benzyl ring and vice versa. The slight improvement of conversion and selectivity in halogen at para-position than ortho-position this probably due to the positive resonance effect of halide groups at para-position, activating the benzene ring [entry 9,11]. Steric hindrance (ortho-effect) is another important factor that affects the reactivity as -NO2 and -Br groups attached to the aromatic ring at ortho-position decreased the efficiency of the reaction [entry 3,11,12]. Secondary benzylic alcohols are also converted to corresponding aldehydes with high selectivity [entry 14,15] [52,55,56]. 3.2.10 Reusability To understand the robustness and recyclability, we have carried out the selective oxidation of CyOH over high-performance CM-4 catalyst up to 5th cycles at optimized reaction conditions, and obtained data are presented in Fig. 12 . The CM–4 catalysts can be reused for up to 5 catalytic runs. After each run, the heterogeneous CM-4 catalyst recovered, washed several times with methanol to eliminate the substrate or product remains from the catalyst surface and pre-activated the catalyst at 423 K for 2 h in the hot air oven. As we clearly noticed from Fig. 12, there is no considerable decrease was observed in the CyOH conversion and CyONE selectivity up to the 4th cycle. In the 5th cycle, the catalytic efficiency of the CM–4 solid base catalyst was drastically reduced, and 55.83% of CyOH conversion was obtained. This could be due to the deactivation of the CM-4 catalyst after the 4th cycle. We have used the data of some characterization techniques (XRD, BET, CO2-TPD, FTIR, SEM, and TEM) to comprehend the physicochemical properties that are responsible for the deactivation of the CM-4 catalyst after the 4th run. The obtained physicochemical properties of the spent catalyst are listed in Table 1. The XRD pattern of the spent CM-4 catalyst indicates that the intensities of the various phases are drastically changed. As noticed in Fig. 13 A, the intensity of MgO peaks was significantly lower in comparison with Ca(OH)2 peaks in the spent catalyst. These results indicated the considerable variation in the crystallinity of the metal oxides of the catalyst during the reaction. This variation in the crystallinity of the metal oxides may be explained by the incorporated Ca2+ ions left from the MgO lattice to form the Ca(OH)2 phases. The average crystallite size of the MgO was increased (31.51 nm) in the spent catalyst. The BET-specific surface area of the spent CM-4 catalyst was significantly decreased (63.2 m2/g) after the 4th cycle of the reaction, which is in well-agreement with the SEM, TEM, and XRD results of the spent catalyst. The CO2-TPD profile provides information regarding the number of basic sites in the spent catalyst (Fig. 13B and Table 1). The spent catalyst significantly reduced the basic sites with strength, which may be due to either a decrease in BET surface area or strongly adsorbed CyONE species on the catalyst surface (Fig. 13B) and increased crystallite size of the MgO and CaO species. The FTIR spectrum of the spent catalyst clearly shows that the adsorbed species are strongly interacting with active sites of the catalyst surface (Fig. 13C). Fig. S3 shows the SEM images of the fresh and spent CM-4 catalyst. It showed that the spent catalyst exhibited agglomerated bulk MgO particles with sizes of 82.3 nm, indicating the sintering of the nanoparticles took place during the reaction (after the 4th run). The TEM images also suggest that the spent CM-4 catalyst displayed bigger particles after the 4th cycle. The average particle size of the MgO species increased in the spent catalyst (∼ 67.9 nm). We also performed the ICP-OES analysis of the spent catalyst, and the reaction mixture showed that the catalyst was leaching by 8.4 wt% by both metal ions after the 4th run. Based on the above aforementioned, variations in the physicochemical properties of the spent CM-4 catalyst are a fundamental reason for the deactivation of the catalyst after 4th run. We have performed all these characterization techniques under ex-situ conditions. 3.2.11 Comparison of CaO-MgO with reported catalysts In this mini-comparison study, we summarize the various catalysts and optimized conditions for the oxidation of CyOH to CyONE under liquid and vapor phases (Table 4 ). From Table 4, we noticed various catalytic systems were applied for this reaction, such as noble metal-based and non-noble metal-based catalysts. Briefly, Gao et al. are investigated the Au nanoparticles supported on the Cu doped-MgCr2O4 catalyst for the catalytic oxidation of CyOH to CyONE with 99.1% of CyOH conversion in combination with 90.2% of CyONE selectivity at 573 K of reaction temperature. Niwa et al. reported that the synthesized Au nanoparticles-loaded n-type semiconducting metal oxides (Au/MTiO3, M = Ca, Sr, Ba) for solvent-free liquid phase oxidation of CyOH to CyONE was studied at 344 K and 1 atm of O2 pressure as an oxidant, exhibits high catalytic activity for the selective liquid-phase oxidation of CyOH to CyONE even at such a low temperature. Zhang and his co-workers studied a series of Cu-containing tri-component mixed metal oxides supported nano-Au catalysts for the selective catalytic oxidation of CyOH with 3% H2O2 and/or O2 as oxidants. Au/CuMnAlO catalyst has exhibited high active sites and it showed more catalytic efficiency in presence of the O2 as an oxidant in comparison to H2O2. the worst H2O2 Efficiency and catalytic performance. The Au/CuMnAlO catalyst has shown superior activity for this reaction under the base condition (NaOH) and the conversion of CyOH and selectivity of CyONE reached 96% and 100%, respectively. Mageed and co-workers also reported the multi-metallic supported N-rGO (CuNiRu/N-rGO) catalysts for the catalytic dehydrogenation of CyOH to CyONE and 95% of conversion with 86% of selectivity was observed at optimized reaction conditions. As well, the non-noble-based catalysts (including Cu, Zn, Mn, V, Zr, Ti, W, etc.) were also investigated for this reaction and achieved good conversions and selectivity toward the CyONE product (entry 5–11). In this present work, we synthesized a CaO-MgO binary mixed metal oxide catalyst in a simple precipitation technique for solvent-free oxidation of CyOH and the catalyst demonstrated relatively high activity with other catalysts. 4 Conclusion The CaO-MgO binary metal oxides displayed excellent catalytic performance in the solvent-free oxidation of CyOH selectively to produce CyONE. These alkaline earth metal oxide composites are good solid-base catalysts and hence no external base is needed for this reaction. Among all the catalysts, the CM–4 catalyst exhibited higher conversion of CyOH (∼85%) with superior selectivity toward CyONE product (∼92%). The greater catalytic efficiency of the CM–4 catalysts is attributed to the greater specific surface area, the smaller particle size of the MgO, the optimized composition of CaO–MgO (1:1.5), and higher basic strength along with a large number of basic sites. The basic sites have played a key role in the alcohol deprotonation and activation of the C–H bond on the accompanying α–carbon of the alcohol. The high catalyst stability was estimated by performing catalyst recyclability experiments and the catalytic efficiency was unchanged up to the 4th cycle. Finally, we made some effort to comprehend the variation in the physicochemical properties (surface area, particle size, and basic sites) that are responsible for the deactivation of the CM-4 catalyst. CRediT authorship contribution statement Siddaramagoud Bandalla: Methodology, Data curation, Investigation. Vijaykumar Dosarapu: Methodology, Data curation, Investigation. Ganesh Babu Bathula: Methodology, Data curation, Investigation. Madhu Ravula: Methodology, Data curation, Investigation. Jyothi Yadagiri: Methodology, Formal analysis, Data curation, Investigation. Parikshit Gogoi: Methodology, Data curation, Investigation. Mallesham Baithy: Supervision, Conceptualization, Methodology, Validation, Formal analysis, Investigation, Data curation, Writing – review & editing, Visualization. Sreekantha B Jonnalagadda: Conceptualization, Data curation, Visualization. Chandra Shekar Vasam: Supervision. Declaration of Competing Interest The authors declare that they have no known competing financial interests or personal relationships that could have appeared to influence the work reported in this paper. Acknowledgments The authors acknowledge the Indo-South Africa joint project Ref. No. DST/INT/SA/P-15/2011. Supplementary materials Supplementary material associated with this article can be found, in the online version, at doi:10.1016/j.mcat.2022.112759. Appendix Supplementary materials Image, application 1 References [1] Q. Wu L. Wang B. Zhao L. Huang S. Yu A.J. Ragauskas Highly selective hydrogenation of phenol to cyclohexanone over a Pd-loaded N-doped carbon catalyst derived from chitosan J. Colloid Interface Sci. 605 2022 82 90 10.1016/j.jcis.2021.07.077 Q. Wu, L. Wang, B. Zhao, L. Huang, S. Yu, A.J. Ragauskas, Highly selective hydrogenation of phenol to cyclohexanone over a Pd-loaded N-doped carbon catalyst derived from chitosan, J. Colloid Interface Sci. 605 (2022) 82–90. 10.1016/j.jcis.2021.07.077. [2] H. Chen J. Sun Selective hydrogenation of phenol for cyclohexanone: a review J. Ind. Eng. Chem. 94 2021 78 91 10.1016/j.jiec.2020.11.022 H. Chen, J. Sun, Selective hydrogenation of phenol for cyclohexanone: a review, J. Ind. Eng. Chem. 94 (2021) 78–91. 10.1016/j.jiec.2020.11.022. [3] N.P. Tangale P.S. Niphadkar S.S. Deshpande P.N. Joshi Dehydrogenation of cyclohexanol over Cu/Al2O3 catalysts prepared with different precipitating agents Appl. Catal. A Gen. 467 2013 421 429 10.1016/j.apcata.2013.07.063 N.P. Tangale, P.S. Niphadkar, S.S. Deshpande, P.N. Joshi, Dehydrogenation of cyclohexanol over Cu/Al2O3 catalysts prepared with different precipitating agents, Appl. Catal. A Gen. 467 (2013) 421–429. 10.1016/j.apcata.2013.07.063. [4] F. Adam P. Retnam A. Iqbal The complete conversion of cyclohexane into cyclohexanol and cyclohexanone by a simple silica-chromium heterogeneous catalyst Appl. Catal. A Gen. 357 2009 93 99 10.1016/j.apcata.2009.01.017 F. Adam, P. Retnam, A. Iqbal, The complete conversion of cyclohexane into cyclohexanol and cyclohexanone by a simple silica-chromium heterogeneous catalyst, Appl. Catal. A Gen. 357 (2009) 93–99. 10.1016/j.apcata.2009.01.017. [5] C. Xie W. Wang Y. Yang L. Jiang Y. Chen J. He J. Wang Enhanced stability and activity for solvent-free selective oxidation of cyclohexane over Cu2O/CuO fabricated by facile alkali etching method Mol. Catal. 495 2020 10.1016/j.mcat.2020.111134 C. Xie, W. Wang, Y. Yang, L. Jiang, Y. Chen, J. He, J. Wang, Enhanced stability and activity for solvent-free selective oxidation of cyclohexane over Cu2O/CuO fabricated by facile alkali etching method, Mol. Catal. 495 (2020). 10.1016/j.mcat.2020.111134. [6] E. Simón J.M. Rosas A. Santos A. Romero Study of the deactivation of copper-based catalysts for dehydrogenation of cyclohexanol to cyclohexanone Catal. Today 187 2012 150 158 10.1016/j.cattod.2011.10.010 E. Simón, J.M. Rosas, A. Santos, A. Romero, Study of the deactivation of copper-based catalysts for dehydrogenation of cyclohexanol to cyclohexanone, Catal. Today 187 (2012) 150–158. 10.1016/j.cattod.2011.10.010. [7] Y. Gao E.J.M. Hensen Gas-phase selective oxidation of cyclohexanol to cyclohexanone over Au/Mg1-xCuxCr2O4 catalysts: on the role of Cu doping J. Catal. 384 2020 218 230 10.1016/j.jcat.2020.02.025 Y. Gao, E.J.M. Hensen, Gas-phase selective oxidation of cyclohexanol to cyclohexanone over Au/Mg1-xCuxCr2O4 catalysts: on the role of Cu doping, J. Catal. 384 (2020) 218–230. 10.1016/j.jcat.2020.02.025. [8] A.V. Biradar M.K. Dongare S.B. Umbarkar Selective oxidation of aromatic primary alcohols to aldehydes using molybdenum acetylide oxo-peroxo complex as catalyst Tetrahedron Lett. 50 2009 2885 2888 10.1016/j.tetlet.2009.03.178 A.V. Biradar, M.K. Dongare, S.B. Umbarkar, Selective oxidation of aromatic primary alcohols to aldehydes using molybdenum acetylide oxo-peroxo complex as catalyst, Tetrahedron Lett. 50 (2009) 2885–2888. 10.1016/j.tetlet.2009.03.178. [9] A. Pokutsa J. le Bras J. Muzart Benign homogeneous catalytic oxidation of cyclohexane promoted with glyoxal Kinet. Catal. 48 2007 26 31 10.1134/S0023158407010041 A. Pokutsa, J. le Bras, J. Muzart, Benign homogeneous catalytic oxidation of cyclohexane promoted with glyoxal, Kinet. Catal. 48 (2007) 26–31. 10.1134/S0023158407010041. [10] R.K. Marella C.K.P. Neeli S.R.R. Kamaraju D.R. Burri Highly active Cu/MgO catalysts for selective dehydrogenation of benzyl alcohol into benzaldehyde using neither O2 nor H2 acceptor Catal. Sci. Technol. 2 2012 1833 1838 10.1039/c2cy20222k R.K. Marella, C.K.P. Neeli, S.R.R. Kamaraju, D.R. Burri, Highly active Cu/MgO catalysts for selective dehydrogenation of benzyl alcohol into benzaldehyde using neither O2 nor H2 acceptor, Catal. Sci. Technol. 2 (2012) 1833–1838. 10.1039/c2cy20222k. [11] K. Li D. Zhou J. Deng X. Lu Q. Xia Highly efficient catalytic oxidation of cyclohexanol with TBHP over Cr-13X catalysts in a solvent-free system J. Mol. Catal. A Chem. 387 2014 31 37 10.1016/j.molcata.2014.02.015 K. Li, D. Zhou, J. Deng, X. Lu, Q. Xia, Highly efficient catalytic oxidation of cyclohexanol with TBHP over Cr-13X catalysts in a solvent-free system, J. Mol. Catal. A Chem. 387 (2014) 31–37. 10.1016/j.molcata.2014.02.015. [12] G. Zhao F. Yang Z. Chen Q. Liu Y. Ji Y. Zhang Z. Niu J. Mao X. Bao P. Hu Y. Li Metal/oxide interfacial effects on the selective oxidation of primary alcohols Nat. Commun. 8 2017 10.1038/ncomms14039 G. Zhao, F. Yang, Z. Chen, Q. Liu, Y. Ji, Y. Zhang, Z. Niu, J. Mao, X. Bao, P. Hu, Y. Li, Metal/oxide interfacial effects on the selective oxidation of primary alcohols, Nat. Commun. 8 (2017). 10.1038/ncomms14039. [13] L. Chen T. Zhou L. Chen Y. Ye Z. Qi H. Freund K. Sundmacher Selective oxidation of cyclohexanol to cyclohexanone in the ionic liquid 1-octyl-3-methylimidazolium chloride Chem. Commun. 47 2011 9354 9356 10.1039/c1cc12989a L. Chen, T. Zhou, L. Chen, Y. Ye, Z. Qi, H. Freund, K. Sundmacher, Selective oxidation of cyclohexanol to cyclohexanone in the ionic liquid 1-octyl-3-methylimidazolium chloride, Chem. Commun. 47 (2011) 9354–9356. 10.1039/c1cc12989a. [14] F. Zhang X. Wang G. Wu C. Zhang S. Song J. Lan Selective oxidation of alcohols catalyzed by supported nano-Au catalysts ChemistrySelect 4 2019 13876 13883 10.1002/slct.201904004 F. Zhang, X. Wang, G. Wu, C. Zhang, S. Song, J. Lan, Selective oxidation of alcohols catalyzed by supported nano-Au catalysts, ChemistrySelect. 4 (2019) 13876–13883. 10.1002/slct.201904004. [15] T. Niwa S.I. Naya H. Tada Low-temperature selective aerobic oxidation of cyclohexanol to cyclohexanone over n-type metal oxide-supported Au nanoparticles Catal. Commun. 144 2020 10.1016/j.catcom.2020.106089 T. Niwa, S.I. Naya, H. Tada, Low-temperature selective aerobic oxidation of cyclohexanol to cyclohexanone over n-type metal oxide-supported Au nanoparticles, Catal. Commun. 144 (2020). 10.1016/j.catcom.2020.106089. [16] R. Li X. Yan X. Zhu D. Shou X. Zhou Y. Dai Y. Yang Gold nanoparticles confined in ordered mesopores: size effect and enhanced stability during gas-phase selective oxidation of cyclohexanol Catal. Today 298 2017 269 275 10.1016/j.cattod.2016.12.045 R. Li, X. Yan, X. Zhu, D. Shou, X. Zhou, Y. Dai, Y. Yang, Gold nanoparticles confined in ordered mesopores: size effect and enhanced stability during gas-phase selective oxidation of cyclohexanol, Catal. Today. 298 (2017) 269–275. 10.1016/j.cattod.2016.12.045. [17] S.V. Sancheti G.D. Yadav CuO-ZnO-MgO as sustainable and selective catalyst towards synthesis of cyclohexanone by dehydrogenation of cyclohexanol over monovalent copper Mol. Catal. 506 2021 10.1016/j.mcat.2021.111534 S.V. Sancheti, G.D. Yadav, CuO-ZnO-MgO as sustainable and selective catalyst towards synthesis of cyclohexanone by dehydrogenation of cyclohexanol over monovalent copper, Mol. Catal. 506 (2021). 10.1016/j.mcat.2021.111534. [18] H.U. Rashid M.S. Ahmad M. Sadiq R. Aman Potent heterogeneous catalyst for low temperature selective oxidation of cyclohexanol by molecular oxygen J. Chem. 2016 2016 10.1155/2016/1254796 H.U. Rashid, M.S. Ahmad, M. Sadiq, R. Aman, Potent heterogeneous catalyst for low temperature selective oxidation of cyclohexanol by molecular oxygen, J. Chem. 2016 (2016). 10.1155/2016/1254796. [19] Y. Gao L. Zhang A.J.F. van Hoof H. Friedrich E.J.M. Hensen A Robust Au/ZnCr2O4 catalyst with highly dispersed gold nanoparticles for gas-phase selective oxidation of cyclohexanol to cyclohexanone ACS Catal. 9 2019 11104 11115 10.1021/acscatal.9b02821 Y. Gao, L. Zhang, A.J.F. van Hoof, H. Friedrich, E.J.M. Hensen, A Robust Au/ZnCr2O4 catalyst with highly dispersed gold nanoparticles for gas-phase selective oxidation of cyclohexanol to cyclohexanone, ACS Catal. 9 (2019) 11104–11115. 10.1021/acscatal.9b02821. [20] Y. Gao E.J.M. Hensen Highly active and stable spinel-oxide supported gold catalyst for gas-phase selective aerobic oxidation of cyclohexanol to cyclohexanone Catal. Commun. 117 2018 53 56 10.1016/j.catcom.2018.07.019 Y. Gao, E.J.M. Hensen, Highly active and stable spinel-oxide supported gold catalyst for gas-phase selective aerobic oxidation of cyclohexanol to cyclohexanone, Catal. Commun. 117 (2018) 53–56. 10.1016/j.catcom.2018.07.019. [21] Y.H. Zhao G.Q. Huang C.Y. Cao Catalytic oxidation of cyclohexanol to cyclohexanone with H2O2 using Na2WO4 as a catalytic system React. Kinet. Mech. Catal. 122 2017 305 314 10.1007/s11144-017-1226-7 Y.H. Zhao, G.Q. Huang, C.Y. Cao, Catalytic oxidation of cyclohexanol to cyclohexanone with H2O2 using Na2WO4 as a catalytic system, React. Kinet. Mech. Catal. 122 (2017) 305–314. 10.1007/s11144-017-1226-7. [22] Y. Xue J. Chen J. Shao L. Han W. Li C. Sui Synthesis, catalytic activity and the structural transformation of dimeric mono-Fe (Ⅲ)-substituted Keggin-type polyoxotungstates in the oxidation of cyclohexanol with H2O2 Mol. Catal. 492 2020 10.1016/j.mcat.2020.111010 Y. Xue, J. Chen, J. Shao, L. Han, W. Li, C. Sui, Synthesis, catalytic activity and the structural transformation of dimeric mono-Fe (Ⅲ)-substituted Keggin-type polyoxotungstates in the oxidation of cyclohexanol with H2O2, Mol. Catal. 492 (2020). 10.1016/j.mcat.2020.111010. [23] B. Sridevi P. Nagaiah A.H. Padmasri B.D. Raju K.S.R. Rao Studies on dehydrogenation of cyclohexanol to cyclohexanone over mesoporous SiO2 supported copper catalysts J. Chem. Sci. 129 2017 601 608 10.1007/s12039-017-1271-9 B. Sridevi, P. Nagaiah, A.H. Padmasri, B.D. Raju, K.S.R. Rao, Studies on dehydrogenation of cyclohexanol to cyclohexanone over mesoporous SiO2 supported copper catalysts, J. Chem. Sci. 129 (2017) 601–608. 10.1007/s12039-017-1271-9. [24] M. Wu Y. Fu W. Zhan Y. Guo Y. Guo Y. Wang G. Lu Catalytic performance of MgO-supported Co catalyst for the liquid phase oxidation of cyclohexane with molecular oxygen Catalysts 7 2017 10.3390/catal7050155 M. Wu, Y. Fu, W. Zhan, Y. Guo, Y. Guo, Y. Wang, G. Lu, Catalytic performance of MgO-supported Co catalyst for the liquid phase oxidation of cyclohexane with molecular oxygen, Catalysts 7 (2017). 10.3390/catal7050155. [25] S.S. Deshpande R.V. Jayaram Liquid phase catalytic oxidation of alcohols over mixed metal oxides Catal. Commun. 9 2008 186 193 10.1016/j.catcom.2007.05.024 S.S. Deshpande, R.V. Jayaram, Liquid phase catalytic oxidation of alcohols over mixed metal oxides, Catal. Commun. 9 (2008) 186–193. 10.1016/j.catcom.2007.05.024. [26] M.B. Gawande R.K. Pandey R.V. Jayaram Role of mixed metal oxides in catalysis science - versatile applications in organic synthesis Catal. Sci. Technol. 2 2012 1113 1125 10.1039/c2cy00490a M.B. Gawande, R.K. Pandey, R.V. Jayaram, Role of mixed metal oxides in catalysis science - versatile applications in organic synthesis, Catal. Sci. Technol. 2 (2012) 1113–1125. 10.1039/c2cy00490a. [27] P. Nagaiah C.V. Pramod M.V. Rao B.D. Raju K.S.R. Rao Product selectivity as a function of ZrO2 phase in Cu/ZrO2 catalysts in the conversion of cyclohexanol Catal. Lett. 148 2018 3042 3050 10.1007/s10562-018-2473-6 P. Nagaiah, C.V. Pramod, M.V. Rao, B.D. Raju, K.S.R. Rao, Product selectivity as a function of ZrO2 phase in Cu/ZrO2 catalysts in the conversion of cyclohexanol, Catal. Lett. 148 (2018) 3042–3050. 10.1007/s10562-018-2473-6. [28] M. Baithy D. Mukherjee A. Rangaswamy B.M. Reddy Structure–activity relationships of WOx-promoted TiO2–ZrO solid acid catalyst for acetalization and ketalization of glycerol towards biofuel additives Catal. Lett. 152 2022 1428 1440 10.1007/s10562-021-03733-2 M. Baithy, D. Mukherjee, A. Rangaswamy, B.M. Reddy, Structure–activity relationships of WOx-promoted TiO2–ZrO solid acid catalyst for acetalization and ketalization of glycerol towards biofuel additives, Catal. Lett. 152 (2022) 1428–1440. 10.1007/s10562-021-03733-2. [29] C. Ngamcharussrivichai P. Nunthasanti S. Tanachai K. Bunyakiat Biodiesel production through transesterification over natural calciums Fuel Process. Technol. 91 2010 1409 1415 10.1016/j.fuproc.2010.05.014 C. Ngamcharussrivichai, P. Nunthasanti, S. Tanachai, K. Bunyakiat, Biodiesel production through transesterification over natural calciums, Fuel Process. Technol. 91 (2010) 1409–1415. 10.1016/j.fuproc.2010.05.014. [30] C. Ngamcharussrivichai W. Wiwatnimit S. Wangnoi Modified dolomites as catalysts for palm kernel oil transesterification J. Mol. Catal. A Chem. 276 2007 24 33 10.1016/j.molcata.2007.06.015 C. Ngamcharussrivichai, W. Wiwatnimit, S. Wangnoi, Modified dolomites as catalysts for palm kernel oil transesterification, J. Mol. Catal. A Chem. 276 (2007) 24–33. 10.1016/j.molcata.2007.06.015. [31] B. Mallesham P. Sudarsanam G. Raju B.M. Reddy Design of highly efficient Mo and W-promoted SnO2 solid acids for heterogeneous catalysis: acetalization of bio-glycerol Green Chem. 15 2013 478 489 10.1039/c2gc36152c B. Mallesham, P. Sudarsanam, G. Raju, B.M. Reddy, Design of highly efficient Mo and W-promoted SnO2 solid acids for heterogeneous catalysis: acetalization of bio-glycerol, Green Chem. 15 (2013) 478–489. 10.1039/c2gc36152c. [32] B. Mallesham P. Sudarsanam B.M. Reddy Eco-friendly synthesis of bio-additive fuels from renewable glycerol using nanocrystalline SnO2-based solid acids Catal. Sci. Technol. 4 2014 803 813 10.1039/c3cy00825h B. Mallesham, P. Sudarsanam, B.M. Reddy, Eco-friendly synthesis of bio-additive fuels from renewable glycerol using nanocrystalline SnO2-based solid acids, Catal. Sci. Technol. 4 (2014) 803–813. 10.1039/c3cy00825h. [33] V. Mahdavi F. Abedini Preparation and characterization of CaO/MgO catalyst and its application for transesterification of n-Butyl acetate with methanol Chem. Eng. Commun. 203 2016 114 122 10.1080/00986445.2014.962688 V. Mahdavi, F. Abedini, Preparation and characterization of CaO/MgO catalyst and its application for transesterification of n-Butyl acetate with methanol, Chem. Eng. Commun. 203 (2016) 114–122. 10.1080/00986445.2014.962688. [34] J. Hornak Synthesis, properties and selected technical applications of magnesium oxide nanoparticles: a review Int. J. Mol. Sci. 22 2021 10.3390/ijms222312752 J. Hornak, Synthesis, properties and selected technical applications of magnesium oxide nanoparticles: a review, Int. J. Mol. Sci. 22 (2021). 10.3390/ijms222312752. [35] J. Yadagiri H.P.R. Kannapu Y.W. Suh V.S. Puppala S.R.R. Kamaraju D.R. Burri An efficient catalytic approach for epoxidation of styrene over activated marble powder ChemistrySelect 3 2018 8473 8478 10.1002/slct.201801055 J. Yadagiri, H.P.R. Kannapu, Y.W. Suh, V.S. Puppala, S.R.R. Kamaraju, D.R. Burri, An efficient catalytic approach for epoxidation of styrene over activated marble powder, ChemistrySelect. 3 (2018) 8473–8478. 10.1002/slct.201801055. [36] N. Siddiqui R. Khatun V.K. Mishra T.S. Khan C. Samanta R. Bal Selective transfer hydrogenation of biomass derived furanic molecules using cyclohexanol as a hydrogen donor over nanostructured Cu/MgO catalyst Mol. Catal. 513 2021 10.1016/j.mcat.2021.111812 N. Siddiqui, R. Khatun, V.K. Mishra, T.S. Khan, C. Samanta, R. Bal, Selective transfer hydrogenation of biomass derived furanic molecules using cyclohexanol as a hydrogen donor over nanostructured Cu/MgO catalyst, Mol. Catal. 513 (2021). 10.1016/j.mcat.2021.111812. [37] J. Przepiórski A. Czyzewski R. Pietrzak A.W. Morawski MgO/CaO-loaded activated carbon for carbon dioxide capture: practical aspects of use Ind. Eng. Chem. Res. 52 2013 6669 6677 10.1021/ie302848r J. Przepiórski, A. Czyzewski, R. Pietrzak, A.W. Morawski, MgO/CaO-loaded activated carbon for carbon dioxide capture: practical aspects of use, Ind. Eng. Chem. Res. 52 (2013) 6669–6677. 10.1021/ie302848r. [38] M.E. Manríquez-Ramírez I. Elizalde R. Ramírez-López M. Trejo-Valdez M. Estrada-Flores Acetylation of glycerol using MgO–CaO catalysts with different CaO loadings React. Kinet. Mech. Catal. 130 2020 417 431 10.1007/s11144-020-01774-z M.E. Manríquez-Ramírez, I. Elizalde, R. Ramírez-López, M. Trejo-Valdez, M. Estrada-Flores, Acetylation of glycerol using MgO–CaO catalysts with different CaO loadings, React. Kinet. Mech. Catal. 130 (2020) 417–431. 10.1007/s11144-020-01774-z. [39] Z. Mirghiasi F. Bakhtiari E. Darezereshki E. Esmaeilzadeh Preparation and characterization of CaO nanoparticles from Ca(OH)2 by direct thermal decomposition method J. Ind. Eng. Chem. 20 2014 113 117 10.1016/j.jiec.2013.04.018 Z. Mirghiasi, F. Bakhtiari, E. Darezereshki, E. Esmaeilzadeh, Preparation and characterization of CaO nanoparticles from Ca(OH)2 by direct thermal decomposition method, J. Ind. Eng. Chem. 20 (2014) 113–117. 10.1016/j.jiec.2013.04.018. [40] Y. Wang S.Y. Hu Y.P. Guan L.B. Wen H.Y. Han Preparation of mesoporous nanosized KF/CaO-MgO catalyst and its application for biodiesel production by transesterification Catal. Lett. 131 2009 574 578 10.1007/s10562-009-9972-4 Y. Wang, S.Y. Hu, Y.P. Guan, L.B. Wen, H.Y. Han, Preparation of mesoporous nanosized KF/CaO-MgO catalyst and its application for biodiesel production by transesterification, Catal. Lett. 131 (2009) 574–578. 10.1007/s10562-009-9972-4. [41] M.L. Testa V.L. Parola L.F. Liotta A.M. Venezia Screening of different solid acid catalysts for glycerol acetylation J. Mol. Catal. A Chem. 367 2013 69 76 10.1016/j.molcata.2012.10.027 M.L. Testa, V.L. Parola, L.F. Liotta, A.M. Venezia, Screening of different solid acid catalysts for glycerol acetylation, J. Mol. Catal. A Chem. 367 (2013) 69–76. 10.1016/j.molcata.2012.10.027. [42] G. Balakrishnan R. Velavan K.M. Batoo E.H. Raslan Microstructure, optical and photocatalytic properties of MgO nanoparticles Results Phys. 16 2020 10.1016/j.rinp.2020.103013 G. Balakrishnan, R. Velavan, K.M. Batoo, E.H. Raslan, Microstructure, optical and photocatalytic properties of MgO nanoparticles, Results Phys. 16 (2020). 10.1016/j.rinp.2020.103013. [43] K.V. Anand M. Reshma M. Kannan S. Muthamil Selvan S. Chaturvedi A.E. Shalan K. Govindaraju Preparation and characterization of calcium oxide nanoparticles from marine molluscan shell waste as nutrient source for plant growth J. Nanostruct. Chem. 11 2021 409 422 10.1007/s40097-020-00376-4 K.V. Anand, M. Reshma, M. Kannan, S. Muthamil Selvan, S. Chaturvedi, A.E. Shalan, K. Govindaraju, Preparation and characterization of calcium oxide nanoparticles from marine molluscan shell waste as nutrient source for plant growth, J. Nanostruct. Chem. 11 (2021) 409–422. 10.1007/s40097-020-00376-4. [44] Y. Ibrahim J. Idris Z. Muhammed A.M. Danlami Synthesis, characterization and formation of KNO3 treated CaO-MgO composite catalysts for biodiesel production using neem seed oil J. Mater. Environ. Sci. 2020 2020 781 787 http://www.jmaterenvironsci.com Y. Ibrahim, J. Idris, Z. Muhammed, A.M. Danlami, Synthesis, characterization and formation of KNO3 treated CaO-MgO composite catalysts for biodiesel production using neem seed oil, J. Mater. Environ. Sci. 2020 (2020) 781–787. http://www.jmaterenvironsci.com. [45] C. Gómez-Rodríguez G.A. Castillo-Rodríguez E.A. Rodríguez-Castellanos F.J. Vázquez-Rodríguez J.F. López-Perales J.A. Aguilar-Martínez D. Fernández-González L.V. García-Quiñonez T.K. Das-Roy L.F. Verdeja Development of an ultra-low carbon MgO refractory doped with α-Al2O3 nanoparticles for the steelmaking industry: a microstructural and thermo-mechanical study Materials 2020 13 10.3390/ma13030715 (Basel) C. Gómez-Rodríguez, G.A. Castillo-Rodríguez, E.A. Rodríguez-Castellanos, F.J. Vázquez-Rodríguez, J.F. López-Perales, J.A. Aguilar-Martínez, D. Fernández-González, L.V. García-Quiñonez, T.K. Das-Roy, L.F. Verdeja, Development of an ultra-low carbon MgO refractory doped with α-Al2O3 nanoparticles for the steelmaking industry: a microstructural and thermo-mechanical study, Materials (Basel). 13 (2020). 10.3390/ma13030715. [46] M.K. Zitani S. Banijamali C. Rüssel S. Khabbaz Abkenar P. Mokhtari H. Ren T. Ebadzadeh Concurrent sinter-crystallization and microwave dielectric characterization of CaO-MgO-TiO2-SiO2 glass-ceramics J. Asian Ceram. Soc. 8 2020 234 244 10.1080/21870764.2020.1725258 M.K. Zitani, S. Banijamali, C. Rüssel, S. Khabbaz Abkenar, P. Mokhtari, H. Ren, T. Ebadzadeh, Concurrent sinter-crystallization and microwave dielectric characterization of CaO-MgO-TiO2-SiO2 glass-ceramics, J. Asian Ceram. Soc. 8 (2020) 234–244. 10.1080/21870764.2020.1725258. [47] R.A. Steffen S. Teixeira J. Sepulveda R. Rinaldi U. Schuchardt Alumina-catalyzed Baeyer-Villiger oxidation of cyclohexanone with hydrogen peroxide J. Mol. Catal. A Chem. 287 2008 41 44 10.1016/j.molcata.2008.02.021 R.A. Steffen, S. Teixeira, J. Sepulveda, R. Rinaldi, U. Schuchardt, Alumina-catalyzed Baeyer-Villiger oxidation of cyclohexanone with hydrogen peroxide, J. Mol. Catal. A Chem. 287 (2008) 41–44. 10.1016/j.molcata.2008.02.021. [48] M.A. Andrade L.M.D.R.S. Martins Sustainability in catalytic cyclohexane oxidation: the contribution of porous support materials Catalysts 10 2020 10.3390/catal10010002 M.A. Andrade, L.M.D.R.S. Martins, Sustainability in catalytic cyclohexane oxidation: the contribution of porous support materials, Catalysts 10 (2020). 10.3390/catal10010002. [49] M. Sutradhar L.M.D.R.S. Martins M.F.C.G. da Silva A.J.L. Pombeiro Oxidovanadium complexes with tridentate aroylhydrazone as catalyst precursors for solvent-free microwave-assisted oxidation of alcohols Appl. Catal. A Gen. 493 2015 50 57 10.1016/j.apcata.2015.01.005 M. Sutradhar, L.M.D.R.S. Martins, M.F.C.G. da Silva, A.J.L. Pombeiro, Oxidovanadium complexes with tridentate aroylhydrazone as catalyst precursors for solvent-free microwave-assisted oxidation of alcohols, Appl. Catal. A Gen. 493 (2015) 50–57. 10.1016/j.apcata.2015.01.005. [50] S.R. Reddy S. Das T. Punniyamurthy Polyaniline supported vanadium catalyzed aerobic oxidation of alcohols to aldehydes and ketones Tetrahedron Lett. 45 2004 3561 3564 10.1016/j.tetlet.2004.03.056 S.R. Reddy, S. Das, T. Punniyamurthy, Polyaniline supported vanadium catalyzed aerobic oxidation of alcohols to aldehydes and ketones, Tetrahedron Lett. 45 (2004) 3561–3564. 10.1016/j.tetlet.2004.03.056. [51] B. Chen X. Huang B. Wang Z. Lin J. Hu Y. Chi C. Hu Three new imidazole-functionalized hexanuclear oxidovanadium clusters with exceptional catalytic oxidation properties for alcohols Chem. A Eur. J. 19 2013 4408 4413 10.1002/chem.201203854 B. Chen, X. Huang, B. Wang, Z. Lin, J. Hu, Y. Chi, C. Hu, Three new imidazole-functionalized hexanuclear oxidovanadium clusters with exceptional catalytic oxidation properties for alcohols, Chem. A Eur. J. 19 (2013) 4408–4413. 10.1002/chem.201203854. [52] A. Rostami O. Pourshiani N. Darvishi B. Atashkar Efficient and green oxidation of alcohols with tert-butyl hydrogenperoxide catalyzed by a recyclable magnetic core-shell nanoparticle-supported oxo-vanadium ephedrine complex Comptes Rendus Chim. 20 2017 435 439 10.1016/j.crci.2016.08.003 A. Rostami, O. Pourshiani, N. Darvishi, B. Atashkar, Efficient and green oxidation of alcohols with tert-butyl hydrogenperoxide catalyzed by a recyclable magnetic core-shell nanoparticle-supported oxo-vanadium ephedrine complex, Comptes Rendus Chim. 20 (2017) 435–439. 10.1016/j.crci.2016.08.003. [53] S. Najafishirtari K. Friedel Ortega M. Douthwaite S. Pattisson G.J. Hutchings C.J. Bondue K. Tschulik D. Waffel B. Peng M. Deitermann G.W. Busser M. Muhler M. Behrens A perspective on heterogeneous catalysts for the selective oxidation of alcohols Chem. A Eur. J. 27 2021 16809 16833 10.1002/chem.202102868 S. Najafishirtari, K. Friedel Ortega, M. Douthwaite, S. Pattisson, G.J. Hutchings, C.J. Bondue, K. Tschulik, D. Waffel, B. Peng, M. Deitermann, G.W. Busser, M. Muhler, M. Behrens, A perspective on heterogeneous catalysts for the selective oxidation of alcohols, Chem. A Eur. J. 27 (2021) 16809–16833. 10.1002/chem.202102868. [54] P. Emayavaramban S.G. Babu R. Karvembu K. Kadirvelu N. Dharmaraj Gold nanoparticles supported on magnesium oxide nanorods for oxidation of alcohols J. Nanosci. Nanotechnol. 16 2016 2517 2526 10.1166/jnn.2016.10778 P. Emayavaramban, S.G. Babu, R. Karvembu, K. Kadirvelu, N. Dharmaraj, Gold nanoparticles supported on magnesium oxide nanorods for oxidation of alcohols, J. Nanosci. Nanotechnol. 16 (2016) 2517–2526. 10.1166/jnn.2016.10778. [55] S. Farhadi M. Hakimi M. Maleki 12-Molybdophosphoric acid anchored on aminopropylsilanized magnetic graphene oxide nanosheets (Fe3O4/GrOSi(CH2)3-NH2/H3PMo12O40): a novel magnetically recoverable solid catalyst for H2O2-mediated oxidation of benzylic alcohols under solvent-free conditions RSC Adv. 8 2018 6768 6780 10.1039/c8ra00312b S. Farhadi, M. Hakimi, M. Maleki, 12-Molybdophosphoric acid anchored on aminopropylsilanized magnetic graphene oxide nanosheets (Fe3O4/GrOSi(CH2)3-NH2/H3PMo12O40): a novel magnetically recoverable solid catalyst for H2O2-mediated oxidation of benzylic alcohols under solvent-free conditions, RSC Adv. 8 (2018) 6768–6780. 10.1039/c8ra00312b. [56] E. Prathibha R. Rangasamy A. Sridhar K. Lakshmi Synthesis and characterization of Fe3O4/carbon dot supported MnO2 nanoparticles for the controlled oxidation of benzyl alcohols ChemistrySelect 5 2020 988 993 10.1002/slct.201903706 E. Prathibha, R. Rangasamy, A. Sridhar, K. Lakshmi, Synthesis and characterization of Fe3O4/carbon dot supported MnO2 nanoparticles for the controlled oxidation of benzyl alcohols, ChemistrySelect 5 (2020) 988–993. 10.1002/slct.201903706. [57] Y. Zhao W. Zhang S. Wang P. Dong G. Li J. Shen Ionic liquid-assisted synthesis of vanadium phosphate catalysts from phosphorous acid for selective oxidation reactions Catal. Lett. 151 2021 2366 2375 10.1007/s10562-020-03469-5 Y. Zhao, W. Zhang, S. Wang, P. Dong, G. Li, J. Shen, Ionic liquid-assisted synthesis of vanadium phosphate catalysts from phosphorous acid for selective oxidation reactions, Catal. Lett. 151 (2021) 2366–2375. 10.1007/s10562-020-03469-5. [58] O.S. Mohamed S.A. Ahmed M.F. Mostafa A.M.A. Abdel-Wahab TiO2 nanoparticles-photocatalytic oxidation of selected cycloalkanols Int. J. Photoenergy 2008 2008 10.1155/2008/205358 O.S. Mohamed, S.A. Ahmed, M.F. Mostafa, A.M.A. Abdel-Wahab, TiO2 nanoparticles-photocatalytic oxidation of selected cycloalkanols, Int. J. Photoenergy 2008 (2008). 10.1155/2008/205358. [59] A.K. Mageed A.B. Dayang Radiah A. Salmiaton S. Izhar M.A. Razak Nitrogen doped graphene-supported trimetallic CuNiRu nanoparticles catalyst for catalytic dehydrogenation of cyclohexanol to cyclohexanone J. King Saud Univ. Sci. 31 2019 878 885 10.1016/j.jksus.2018.08.007 A.K. Mageed, A.B. Dayang Radiah, A. Salmiaton, S. Izhar, M.A. Razak, Nitrogen doped graphene-supported trimetallic CuNiRu nanoparticles catalyst for catalytic dehydrogenation of cyclohexanol to cyclohexanone, J. King Saud Univ. Sci. 31 (2019) 878–885. 10.1016/j.jksus.2018.08.007.",
      "scopus-id": "85140784615",
      "coredata": {
        "eid": "1-s2.0-S2468823122006459",
        "dc:description": "The development of inexpensive solid-base CaO–MgO binary metal oxides (BMOs) as efficient and reusable heterogeneous catalysts was reported for the selective production of cyclohexanone (CyONE) from cyclohexanol (CyOH) oxidation under solvent-free conditions. These BMOs were prepared by ultra–diluted co-precipitation procedure and characterized by several sophisticated techniques, such as XRD, BET, CO2–TPD, FTIR, SEM, EDX, TEM, and ICP-OES. The crystallinity of the BMO samples was found from the XRD analysis and the estimated crystalline size range of the samples is 19.02–23.42 nm. The BET and CO2–TPD analysis of prepared samples gave information regarding the specific surface area and basicity (concentration and strength). The morphology and particle size of the 1CaO–1.5MgO sample were obtained from the SEM (61.8 nm) and TEM (55.2 nm) analyzes. Among all the catalysts, the 1CaO–1.5MgO catalyst displayed a higher conversion of CyOH (∼85%) with superior selectivity to CyONE product (∼90.97). The greater catalytic efficiency of the 1CaO–1.5MgO catalyst was attributed to the greater specific surface area, the smaller particle size of the MgO, the optimized composition of CaO–MgO (1:1.5), and higher basic strength along with a large number of basic sites. We have also optimized various reaction parameters including reaction temperature, time, catalyst weight, and solvent. Catalyst recyclability experiments were carried out to disclose that the catalyst has more robust, stable, and easily recyclable. The 1CaO–1.5MgO catalyst was very stable up to the 4th cycle. We also studied the spent catalyst characterization (XRD, BET, FTIR, SEM, TEM, and ICP-OES) to know the fundamental reason for the deactivation of the CM-4 catalyst.",
        "openArchiveArticle": "false",
        "prism:coverDate": "2022-12-31",
        "openaccessUserLicense": null,
        "prism:aggregationType": "Journal",
        "prism:url": "https://api.elsevier.com/content/article/pii/S2468823122006459",
        "dc:creator": [
          {
            "@_fa": "true",
            "$": "Bandalla, Siddaramagoud"
          },
          {
            "@_fa": "true",
            "$": "Dosarapu, Vijaykumar"
          },
          {
            "@_fa": "true",
            "$": "Bathula, Ganesh Babu"
          },
          {
            "@_fa": "true",
            "$": "Ravula, Madhu"
          },
          {
            "@_fa": "true",
            "$": "Yadagiri, Jyothi"
          },
          {
            "@_fa": "true",
            "$": "Gogoi, Parikshit"
          },
          {
            "@_fa": "true",
            "$": "Baithy, Mallesham"
          },
          {
            "@_fa": "true",
            "$": "Jonnalagadda, Sreekantha B"
          },
          {
            "@_fa": "true",
            "$": "Vasam, Chandra Shekar"
          }
        ],
        "link": [
          {
            "@_fa": "true",
            "@rel": "self",
            "@href": "https://api.elsevier.com/content/article/pii/S2468823122006459"
          },
          {
            "@_fa": "true",
            "@rel": "scidir",
            "@href": "https://www.sciencedirect.com/science/article/pii/S2468823122006459"
          }
        ],
        "dc:format": "application/json",
        "openaccessType": null,
        "pii": "S2468-8231(22)00645-9",
        "prism:volume": "533",
        "articleNumber": "112759",
        "prism:publisher": "Published by Elsevier B.V.",
        "dc:title": "Highly efficient solvent-free oxidation of cyclohexanol to cyclohexanone over nanocrystalline CaO–MgO binary metal-oxide catalysts",
        "prism:copyright": "© 2022 Published by Elsevier B.V.",
        "openaccess": "0",
        "prism:issn": "24688231",
        "dcterms:subject": [
          {
            "@_fa": "true",
            "$": "Cyclohexanol"
          },
          {
            "@_fa": "true",
            "$": "Cyclohexanone"
          },
          {
            "@_fa": "true",
            "$": "TBHP"
          },
          {
            "@_fa": "true",
            "$": "CaO–MgO"
          },
          {
            "@_fa": "true",
            "$": "Basic sites"
          },
          {
            "@_fa": "true",
            "$": "Solvent-free"
          }
        ],
        "openaccessArticle": "false",
        "prism:publicationName": "Molecular Catalysis",
        "openaccessSponsorType": null,
        "prism:pageRange": "112759",
        "pubType": "fla",
        "prism:coverDisplayDate": "December 2022",
        "prism:doi": "10.1016/j.mcat.2022.112759",
        "prism:startingPage": "112759",
        "dc:identifier": "doi:10.1016/j.mcat.2022.112759",
        "openaccessSponsorName": null
      },
      "objects": {
        "object": [
          {
            "@category": "standard",
            "@height": "959",
            "@width": "376",
            "@_fa": "true",
            "$": "https://api.elsevier.com/content/object/eid/1-s2.0-S2468823122006459-fx1.jpg?httpAccept=%2A%2F%2A",
            "@multimediatype": "JPEG image file",
            "@type": "IMAGE-DOWNSAMPLED",
            "@size": "66758",
            "@ref": "fx1",
            "@mimetype": "image/jpeg"
          },
          {
            "@category": "standard",
            "@height": "213",
            "@width": "339",
            "@_fa": "true",
            "$": "https://api.elsevier.com/content/object/eid/1-s2.0-S2468823122006459-gr1.jpg?httpAccept=%2A%2F%2A",
            "@multimediatype": "JPEG image file",
            "@type": "IMAGE-DOWNSAMPLED",
            "@size": "35748",
            "@ref": "gr1",
            "@mimetype": "image/jpeg"
          },
          {
            "@category": "standard",
            "@height": "239",
            "@width": "339",
            "@_fa": "true",
            "$": "https://api.elsevier.com/content/object/eid/1-s2.0-S2468823122006459-gr10.jpg?httpAccept=%2A%2F%2A",
            "@multimediatype": "JPEG image file",
            "@type": "IMAGE-DOWNSAMPLED",
            "@size": "24848",
            "@ref": "gr10",
            "@mimetype": "image/jpeg"
          },
          {
            "@category": "standard",
            "@height": "331",
            "@width": "339",
            "@_fa": "true",
            "$": "https://api.elsevier.com/content/object/eid/1-s2.0-S2468823122006459-gr2.jpg?httpAccept=%2A%2F%2A",
            "@multimediatype": "JPEG image file",
            "@type": "IMAGE-DOWNSAMPLED",
            "@size": "43704",
            "@ref": "gr2",
            "@mimetype": "image/jpeg"
          },
          {
            "@category": "standard",
            "@height": "390",
            "@width": "489",
            "@_fa": "true",
            "$": "https://api.elsevier.com/content/object/eid/1-s2.0-S2468823122006459-gr3.jpg?httpAccept=%2A%2F%2A",
            "@multimediatype": "JPEG image file",
            "@type": "IMAGE-DOWNSAMPLED",
            "@size": "93192",
            "@ref": "gr3",
            "@mimetype": "image/jpeg"
          },
          {
            "@category": "standard",
            "@height": "136",
            "@width": "659",
            "@_fa": "true",
            "$": "https://api.elsevier.com/content/object/eid/1-s2.0-S2468823122006459-sc1.jpg?httpAccept=%2A%2F%2A",
            "@multimediatype": "JPEG image file",
            "@type": "IMAGE-DOWNSAMPLED",
            "@size": "20443",
            "@ref": "sc1",
            "@mimetype": "image/jpeg"
          },
          {
            "@category": "standard",
            "@height": "593",
            "@width": "659",
            "@_fa": "true",
            "$": "https://api.elsevier.com/content/object/eid/1-s2.0-S2468823122006459-gr13.jpg?httpAccept=%2A%2F%2A",
            "@multimediatype": "JPEG image file",
            "@type": "IMAGE-DOWNSAMPLED",
            "@size": "94604",
            "@ref": "gr13",
            "@mimetype": "image/jpeg"
          },
          {
            "@category": "standard",
            "@height": "306",
            "@width": "339",
            "@_fa": "true",
            "$": "https://api.elsevier.com/content/object/eid/1-s2.0-S2468823122006459-sc2.jpg?httpAccept=%2A%2F%2A",
            "@multimediatype": "JPEG image file",
            "@type": "IMAGE-DOWNSAMPLED",
            "@size": "39632",
            "@ref": "sc2",
            "@mimetype": "image/jpeg"
          },
          {
            "@category": "standard",
            "@height": "257",
            "@width": "339",
            "@_fa": "true",
            "$": "https://api.elsevier.com/content/object/eid/1-s2.0-S2468823122006459-gr11.jpg?httpAccept=%2A%2F%2A",
            "@multimediatype": "JPEG image file",
            "@type": "IMAGE-DOWNSAMPLED",
            "@size": "39352",
            "@ref": "gr11",
            "@mimetype": "image/jpeg"
          },
          {
            "@category": "standard",
            "@height": "208",
            "@width": "339",
            "@_fa": "true",
            "$": "https://api.elsevier.com/content/object/eid/1-s2.0-S2468823122006459-gr12.jpg?httpAccept=%2A%2F%2A",
            "@multimediatype": "JPEG image file",
            "@type": "IMAGE-DOWNSAMPLED",
            "@size": "24618",
            "@ref": "gr12",
            "@mimetype": "image/jpeg"
          },
          {
            "@category": "standard",
            "@height": "277",
            "@width": "339",
            "@_fa": "true",
            "$": "https://api.elsevier.com/content/object/eid/1-s2.0-S2468823122006459-gr8.jpg?httpAccept=%2A%2F%2A",
            "@multimediatype": "JPEG image file",
            "@type": "IMAGE-DOWNSAMPLED",
            "@size": "31986",
            "@ref": "gr8",
            "@mimetype": "image/jpeg"
          },
          {
            "@category": "standard",
            "@height": "321",
            "@width": "339",
            "@_fa": "true",
            "$": "https://api.elsevier.com/content/object/eid/1-s2.0-S2468823122006459-gr9.jpg?httpAccept=%2A%2F%2A",
            "@multimediatype": "JPEG image file",
            "@type": "IMAGE-DOWNSAMPLED",
            "@size": "32162",
            "@ref": "gr9",
            "@mimetype": "image/jpeg"
          },
          {
            "@category": "standard",
            "@height": "411",
            "@width": "489",
            "@_fa": "true",
            "$": "https://api.elsevier.com/content/object/eid/1-s2.0-S2468823122006459-gr4.jpg?httpAccept=%2A%2F%2A",
            "@multimediatype": "JPEG image file",
            "@type": "IMAGE-DOWNSAMPLED",
            "@size": "93408",
            "@ref": "gr4",
            "@mimetype": "image/jpeg"
          },
          {
            "@category": "standard",
            "@height": "287",
            "@width": "339",
            "@_fa": "true",
            "$": "https://api.elsevier.com/content/object/eid/1-s2.0-S2468823122006459-gr5.jpg?httpAccept=%2A%2F%2A",
            "@multimediatype": "JPEG image file",
            "@type": "IMAGE-DOWNSAMPLED",
            "@size": "31930",
            "@ref": "gr5",
            "@mimetype": "image/jpeg"
          },
          {
            "@category": "standard",
            "@height": "323",
            "@width": "339",
            "@_fa": "true",
            "$": "https://api.elsevier.com/content/object/eid/1-s2.0-S2468823122006459-gr6.jpg?httpAccept=%2A%2F%2A",
            "@multimediatype": "JPEG image file",
            "@type": "IMAGE-DOWNSAMPLED",
            "@size": "32751",
            "@ref": "gr6",
            "@mimetype": "image/jpeg"
          },
          {
            "@category": "standard",
            "@height": "285",
            "@width": "339",
            "@_fa": "true",
            "$": "https://api.elsevier.com/content/object/eid/1-s2.0-S2468823122006459-gr7.jpg?httpAccept=%2A%2F%2A",
            "@multimediatype": "JPEG image file",
            "@type": "IMAGE-DOWNSAMPLED",
            "@size": "29819",
            "@ref": "gr7",
            "@mimetype": "image/jpeg"
          },
          {
            "@category": "standard",
            "@height": "125",
            "@width": "301",
            "@_fa": "true",
            "$": "https://api.elsevier.com/content/object/eid/1-s2.0-S2468823122006459-ga1.jpg?httpAccept=%2A%2F%2A",
            "@multimediatype": "JPEG image file",
            "@type": "IMAGE-DOWNSAMPLED",
            "@size": "28919",
            "@ref": "ga1",
            "@mimetype": "image/jpeg"
          },
          {
            "@category": "thumbnail",
            "@height": "163",
            "@width": "64",
            "@_fa": "true",
            "$": "https://api.elsevier.com/content/object/eid/1-s2.0-S2468823122006459-fx1.sml?httpAccept=%2A%2F%2A",
            "@multimediatype": "GIF image file",
            "@type": "IMAGE-THUMBNAIL",
            "@size": "4205",
            "@ref": "fx1",
            "@mimetype": "image/gif"
          },
          {
            "@category": "thumbnail",
            "@height": "138",
            "@width": "219",
            "@_fa": "true",
            "$": "https://api.elsevier.com/content/object/eid/1-s2.0-S2468823122006459-gr1.sml?httpAccept=%2A%2F%2A",
            "@multimediatype": "GIF image file",
            "@type": "IMAGE-THUMBNAIL",
            "@size": "12206",
            "@ref": "gr1",
            "@mimetype": "image/gif"
          },
          {
            "@category": "thumbnail",
            "@height": "154",
            "@width": "219",
            "@_fa": "true",
            "$": "https://api.elsevier.com/content/object/eid/1-s2.0-S2468823122006459-gr10.sml?httpAccept=%2A%2F%2A",
            "@multimediatype": "GIF image file",
            "@type": "IMAGE-THUMBNAIL",
            "@size": "11338",
            "@ref": "gr10",
            "@mimetype": "image/gif"
          },
          {
            "@category": "thumbnail",
            "@height": "164",
            "@width": "168",
            "@_fa": "true",
            "$": "https://api.elsevier.com/content/object/eid/1-s2.0-S2468823122006459-gr2.sml?httpAccept=%2A%2F%2A",
            "@multimediatype": "GIF image file",
            "@type": "IMAGE-THUMBNAIL",
            "@size": "10314",
            "@ref": "gr2",
            "@mimetype": "image/gif"
          },
          {
            "@category": "thumbnail",
            "@height": "164",
            "@width": "205",
            "@_fa": "true",
            "$": "https://api.elsevier.com/content/object/eid/1-s2.0-S2468823122006459-gr3.sml?httpAccept=%2A%2F%2A",
            "@multimediatype": "GIF image file",
            "@type": "IMAGE-THUMBNAIL",
            "@size": "22083",
            "@ref": "gr3",
            "@mimetype": "image/gif"
          },
          {
            "@category": "thumbnail",
            "@height": "45",
            "@width": "219",
            "@_fa": "true",
            "$": "https://api.elsevier.com/content/object/eid/1-s2.0-S2468823122006459-sc1.sml?httpAccept=%2A%2F%2A",
            "@multimediatype": "GIF image file",
            "@type": "IMAGE-THUMBNAIL",
            "@size": "5129",
            "@ref": "sc1",
            "@mimetype": "image/gif"
          },
          {
            "@category": "thumbnail",
            "@height": "164",
            "@width": "182",
            "@_fa": "true",
            "$": "https://api.elsevier.com/content/object/eid/1-s2.0-S2468823122006459-gr13.sml?httpAccept=%2A%2F%2A",
            "@multimediatype": "GIF image file",
            "@type": "IMAGE-THUMBNAIL",
            "@size": "10237",
            "@ref": "gr13",
            "@mimetype": "image/gif"
          },
          {
            "@category": "thumbnail",
            "@height": "164",
            "@width": "182",
            "@_fa": "true",
            "$": "https://api.elsevier.com/content/object/eid/1-s2.0-S2468823122006459-sc2.sml?httpAccept=%2A%2F%2A",
            "@multimediatype": "GIF image file",
            "@type": "IMAGE-THUMBNAIL",
            "@size": "12482",
            "@ref": "sc2",
            "@mimetype": "image/gif"
          },
          {
            "@category": "thumbnail",
            "@height": "164",
            "@width": "217",
            "@_fa": "true",
            "$": "https://api.elsevier.com/content/object/eid/1-s2.0-S2468823122006459-gr11.sml?httpAccept=%2A%2F%2A",
            "@multimediatype": "GIF image file",
            "@type": "IMAGE-THUMBNAIL",
            "@size": "11453",
            "@ref": "gr11",
            "@mimetype": "image/gif"
          },
          {
            "@category": "thumbnail",
            "@height": "135",
            "@width": "219",
            "@_fa": "true",
            "$": "https://api.elsevier.com/content/object/eid/1-s2.0-S2468823122006459-gr12.sml?httpAccept=%2A%2F%2A",
            "@multimediatype": "GIF image file",
            "@type": "IMAGE-THUMBNAIL",
            "@size": "11077",
            "@ref": "gr12",
            "@mimetype": "image/gif"
          },
          {
            "@category": "thumbnail",
            "@height": "163",
            "@width": "200",
            "@_fa": "true",
            "$": "https://api.elsevier.com/content/object/eid/1-s2.0-S2468823122006459-gr8.sml?httpAccept=%2A%2F%2A",
            "@multimediatype": "GIF image file",
            "@type": "IMAGE-THUMBNAIL",
            "@size": "9069",
            "@ref": "gr8",
            "@mimetype": "image/gif"
          },
          {
            "@category": "thumbnail",
            "@height": "164",
            "@width": "173",
            "@_fa": "true",
            "$": "https://api.elsevier.com/content/object/eid/1-s2.0-S2468823122006459-gr9.sml?httpAccept=%2A%2F%2A",
            "@multimediatype": "GIF image file",
            "@type": "IMAGE-THUMBNAIL",
            "@size": "8418",
            "@ref": "gr9",
            "@mimetype": "image/gif"
          },
          {
            "@category": "thumbnail",
            "@height": "164",
            "@width": "195",
            "@_fa": "true",
            "$": "https://api.elsevier.com/content/object/eid/1-s2.0-S2468823122006459-gr4.sml?httpAccept=%2A%2F%2A",
            "@multimediatype": "GIF image file",
            "@type": "IMAGE-THUMBNAIL",
            "@size": "22209",
            "@ref": "gr4",
            "@mimetype": "image/gif"
          },
          {
            "@category": "thumbnail",
            "@height": "164",
            "@width": "193",
            "@_fa": "true",
            "$": "https://api.elsevier.com/content/object/eid/1-s2.0-S2468823122006459-gr5.sml?httpAccept=%2A%2F%2A",
            "@multimediatype": "GIF image file",
            "@type": "IMAGE-THUMBNAIL",
            "@size": "9147",
            "@ref": "gr5",
            "@mimetype": "image/gif"
          },
          {
            "@category": "thumbnail",
            "@height": "164",
            "@width": "172",
            "@_fa": "true",
            "$": "https://api.elsevier.com/content/object/eid/1-s2.0-S2468823122006459-gr6.sml?httpAccept=%2A%2F%2A",
            "@multimediatype": "GIF image file",
            "@type": "IMAGE-THUMBNAIL",
            "@size": "8241",
            "@ref": "gr6",
            "@mimetype": "image/gif"
          },
          {
            "@category": "thumbnail",
            "@height": "164",
            "@width": "195",
            "@_fa": "true",
            "$": "https://api.elsevier.com/content/object/eid/1-s2.0-S2468823122006459-gr7.sml?httpAccept=%2A%2F%2A",
            "@multimediatype": "GIF image file",
            "@type": "IMAGE-THUMBNAIL",
            "@size": "8798",
            "@ref": "gr7",
            "@mimetype": "image/gif"
          },
          {
            "@category": "thumbnail",
            "@height": "91",
            "@width": "219",
            "@_fa": "true",
            "$": "https://api.elsevier.com/content/object/eid/1-s2.0-S2468823122006459-ga1.sml?httpAccept=%2A%2F%2A",
            "@multimediatype": "GIF image file",
            "@type": "IMAGE-THUMBNAIL",
            "@size": "10999",
            "@ref": "ga1",
            "@mimetype": "image/gif"
          },
          {
            "@category": "high",
            "@height": "4250",
            "@width": "1666",
            "@_fa": "true",
            "$": "https://api.elsevier.com/content/object/eid/1-s2.0-S2468823122006459-fx1_lrg.jpg?httpAccept=%2A%2F%2A",
            "@multimediatype": "JPEG image file",
            "@type": "IMAGE-HIGH-RES",
            "@size": "526211",
            "@ref": "fx1",
            "@mimetype": "image/jpeg"
          },
          {
            "@category": "high",
            "@height": "944",
            "@width": "1500",
            "@_fa": "true",
            "$": "https://api.elsevier.com/content/object/eid/1-s2.0-S2468823122006459-gr1_lrg.jpg?httpAccept=%2A%2F%2A",
            "@multimediatype": "JPEG image file",
            "@type": "IMAGE-HIGH-RES",
            "@size": "252839",
            "@ref": "gr1",
            "@mimetype": "image/jpeg"
          },
          {
            "@category": "high",
            "@height": "1058",
            "@width": "1500",
            "@_fa": "true",
            "$": "https://api.elsevier.com/content/object/eid/1-s2.0-S2468823122006459-gr10_lrg.jpg?httpAccept=%2A%2F%2A",
            "@multimediatype": "JPEG image file",
            "@type": "IMAGE-HIGH-RES",
            "@size": "179474",
            "@ref": "gr10",
            "@mimetype": "image/jpeg"
          },
          {
            "@category": "high",
            "@height": "1464",
            "@width": "1500",
            "@_fa": "true",
            "$": "https://api.elsevier.com/content/object/eid/1-s2.0-S2468823122006459-gr2_lrg.jpg?httpAccept=%2A%2F%2A",
            "@multimediatype": "JPEG image file",
            "@type": "IMAGE-HIGH-RES",
            "@size": "302880",
            "@ref": "gr2",
            "@mimetype": "image/jpeg"
          },
          {
            "@category": "high",
            "@height": "1730",
            "@width": "2167",
            "@_fa": "true",
            "$": "https://api.elsevier.com/content/object/eid/1-s2.0-S2468823122006459-gr3_lrg.jpg?httpAccept=%2A%2F%2A",
            "@multimediatype": "JPEG image file",
            "@type": "IMAGE-HIGH-RES",
            "@size": "800760",
            "@ref": "gr3",
            "@mimetype": "image/jpeg"
          },
          {
            "@category": "high",
            "@height": "600",
            "@width": "2917",
            "@_fa": "true",
            "$": "https://api.elsevier.com/content/object/eid/1-s2.0-S2468823122006459-sc1_lrg.jpg?httpAccept=%2A%2F%2A",
            "@multimediatype": "JPEG image file",
            "@type": "IMAGE-HIGH-RES",
            "@size": "119425",
            "@ref": "sc1",
            "@mimetype": "image/jpeg"
          },
          {
            "@category": "high",
            "@height": "2626",
            "@width": "2917",
            "@_fa": "true",
            "$": "https://api.elsevier.com/content/object/eid/1-s2.0-S2468823122006459-gr13_lrg.jpg?httpAccept=%2A%2F%2A",
            "@multimediatype": "JPEG image file",
            "@type": "IMAGE-HIGH-RES",
            "@size": "594217",
            "@ref": "gr13",
            "@mimetype": "image/jpeg"
          },
          {
            "@category": "high",
            "@height": "1353",
            "@width": "1500",
            "@_fa": "true",
            "$": "https://api.elsevier.com/content/object/eid/1-s2.0-S2468823122006459-sc2_lrg.jpg?httpAccept=%2A%2F%2A",
            "@multimediatype": "JPEG image file",
            "@type": "IMAGE-HIGH-RES",
            "@size": "263763",
            "@ref": "sc2",
            "@mimetype": "image/jpeg"
          },
          {
            "@category": "high",
            "@height": "1135",
            "@width": "1500",
            "@_fa": "true",
            "$": "https://api.elsevier.com/content/object/eid/1-s2.0-S2468823122006459-gr11_lrg.jpg?httpAccept=%2A%2F%2A",
            "@multimediatype": "JPEG image file",
            "@type": "IMAGE-HIGH-RES",
            "@size": "270865",
            "@ref": "gr11",
            "@mimetype": "image/jpeg"
          },
          {
            "@category": "high",
            "@height": "922",
            "@width": "1500",
            "@_fa": "true",
            "$": "https://api.elsevier.com/content/object/eid/1-s2.0-S2468823122006459-gr12_lrg.jpg?httpAccept=%2A%2F%2A",
            "@multimediatype": "JPEG image file",
            "@type": "IMAGE-HIGH-RES",
            "@size": "152614",
            "@ref": "gr12",
            "@mimetype": "image/jpeg"
          },
          {
            "@category": "high",
            "@height": "1226",
            "@width": "1500",
            "@_fa": "true",
            "$": "https://api.elsevier.com/content/object/eid/1-s2.0-S2468823122006459-gr8_lrg.jpg?httpAccept=%2A%2F%2A",
            "@multimediatype": "JPEG image file",
            "@type": "IMAGE-HIGH-RES",
            "@size": "205563",
            "@ref": "gr8",
            "@mimetype": "image/jpeg"
          },
          {
            "@category": "high",
            "@height": "1422",
            "@width": "1500",
            "@_fa": "true",
            "$": "https://api.elsevier.com/content/object/eid/1-s2.0-S2468823122006459-gr9_lrg.jpg?httpAccept=%2A%2F%2A",
            "@multimediatype": "JPEG image file",
            "@type": "IMAGE-HIGH-RES",
            "@size": "207984",
            "@ref": "gr9",
            "@mimetype": "image/jpeg"
          },
          {
            "@category": "high",
            "@height": "1822",
            "@width": "2167",
            "@_fa": "true",
            "$": "https://api.elsevier.com/content/object/eid/1-s2.0-S2468823122006459-gr4_lrg.jpg?httpAccept=%2A%2F%2A",
            "@multimediatype": "JPEG image file",
            "@type": "IMAGE-HIGH-RES",
            "@size": "854209",
            "@ref": "gr4",
            "@mimetype": "image/jpeg"
          },
          {
            "@category": "high",
            "@height": "1271",
            "@width": "1500",
            "@_fa": "true",
            "$": "https://api.elsevier.com/content/object/eid/1-s2.0-S2468823122006459-gr5_lrg.jpg?httpAccept=%2A%2F%2A",
            "@multimediatype": "JPEG image file",
            "@type": "IMAGE-HIGH-RES",
            "@size": "217711",
            "@ref": "gr5",
            "@mimetype": "image/jpeg"
          },
          {
            "@category": "high",
            "@height": "1430",
            "@width": "1500",
            "@_fa": "true",
            "$": "https://api.elsevier.com/content/object/eid/1-s2.0-S2468823122006459-gr6_lrg.jpg?httpAccept=%2A%2F%2A",
            "@multimediatype": "JPEG image file",
            "@type": "IMAGE-HIGH-RES",
            "@size": "214834",
            "@ref": "gr6",
            "@mimetype": "image/jpeg"
          },
          {
            "@category": "high",
            "@height": "1259",
            "@width": "1500",
            "@_fa": "true",
            "$": "https://api.elsevier.com/content/object/eid/1-s2.0-S2468823122006459-gr7_lrg.jpg?httpAccept=%2A%2F%2A",
            "@multimediatype": "JPEG image file",
            "@type": "IMAGE-HIGH-RES",
            "@size": "191661",
            "@ref": "gr7",
            "@mimetype": "image/jpeg"
          },
          {
            "@category": "high",
            "@height": "555",
            "@width": "1333",
            "@_fa": "true",
            "$": "https://api.elsevier.com/content/object/eid/1-s2.0-S2468823122006459-ga1_lrg.jpg?httpAccept=%2A%2F%2A",
            "@multimediatype": "JPEG image file",
            "@type": "IMAGE-HIGH-RES",
            "@size": "176774",
            "@ref": "ga1",
            "@mimetype": "image/jpeg"
          },
          {
            "@category": "standard",
            "@_fa": "true",
            "$": "https://api.elsevier.com/content/object/eid/1-s2.0-S2468823122006459-mmc1.docx?httpAccept=%2A%2F%2A",
            "@multimediatype": "Microsoft Word file",
            "@type": "APPLICATION",
            "@size": "2352861",
            "@ref": "mmc1",
            "@mimetype": "application/word"
          },
          {
            "@category": "standard",
            "@_fa": "true",
            "$": "https://api.elsevier.com/content/object/eid/1-s2.0-S2468823122006459-am.pdf?httpAccept=%2A%2F%2A",
            "@multimediatype": "Acrobat PDF file",
            "@type": "AAM-PDF",
            "@size": "1918101",
            "@ref": "am",
            "@mimetype": "application/pdf"
          }
        ]
      },
      "link": {
        "@rel": "abstract",
        "@href": "https://api.elsevier.com/content/abstract/scopus_id/85140784615"
      }
    }
  }
}