{
  "metadata": {
    "title": "Metal-contaminated biochars as cheap and more sustainable catalysts for furfural conversion to value-added compounds",
    "authors": "; ; ",
    "journal": "Molecular Catalysis",
    "date": "2022-10-31",
    "doi": "10.1016/j.mcat.2022.112692",
    "abstract": "",
    "uri": "https://api.elsevier.com/content/article/pii/S2468823122005788",
    "pii": "S2468823122005788"
  },
  "fulltext": {
    "full-text-retrieval-response": {
      "scopus-eid": "2-s2.0-85138184708",
      "originalText": "serial JL 315758 291210 291744 291790 291809 31 Molecular Catalysis MOLECULARCATALYSIS 2022-09-20 2022-09-20 2022-09-20 2022-09-20 2023-04-12T11:58:50 1-s2.0-S2468823122005788 S2468-8231(22)00578-8 S2468823122005788 10.1016/j.mcat.2022.112692 S300 S300.1 FULL-TEXT 1-s2.0-S2468823122X0014X 2024-06-26T17:47:42.309552Z 0 0 20221001 20221031 2022 2022-09-20T17:10:00.904828Z absattachment articleinfo articlenumber articletitlenorm authfirstinitialnorm authfirstsurnamenorm cid cids contenttype copyright crossmark dateloaded dateloadedtxt datesearch datesort dateupdated dco docsubtype doctype doi eid ewtransactionid hubeid indexeddate issn issnnorm itemstage itemtransactionid itemweight openaccess openarchive pg pgfirst pii piinorm pubdateend pubdatestart pubdatetxt pubyr sectiontitle sortorder srctitle srctitlenorm srctype ssids alllist content subj subheadings suppl tomb volfirst volissue volumelist webpdf webpdfpagecount yearnav figure table e-component body mmlmath acknowledge affil appendices articletitle auth authfirstini authfull authkeywords authlast grantnumber grantsponsor highlightsabst orcid primabst ref specialabst 2468-8231 24688231 true 531 531 C Volume 531 38 112692 112692 112692 202210 October 2022 2022-10-01 2022-10-31 2022 Regular Papers article fla © 2022 Elsevier B.V. All rights reserved. METALCONTAMINATEDBIOCHARSCHEAPMORESUSTAINABLECATALYSTSFORFURFURALCONVERSIONVALUEADDEDCOMPOUNDS MADRIAGA V 1 Introduction 2 Experimental section 2.1 Chemicals 2.2 Biochar obtention 2.3 Characterization 2.4 Catalytic evaluation 3 Results and discussion 3.1 Biochar characterization 3.2 Catalytic evaluation 4 Conclusions Supplementary materials CRediT authorship contribution statement Acknowledgment Appendix Supplementary materials References HUBER 2006 4044 4098 G CORMA 2007 2411 2502 A BESSON 2014 1827 1870 M WANG 2021 111199 Y DELBECQ 2018 F LANGE 2012 150 166 J ZHANG 2021 27042 27058 X NIKULSHIN 2020 720 725 P HAGEN 2005 J INDUSTRIALCATALYSIS JORGE 2017 3856 3868 E LIMA 2016 5586 5593 T JORGE 2020 1754 1762 E CHODIMELLA 2020 161 185 V ADVANCEDFUNCTIONALSOLIDCATALYSTSFORBIOMASSVALORIZATION MESOPOROUSSILICARELATEDCATALYSTSFORBIOMASSVALORIZATION NASROLLAHZADEH 2021 59 64 M ESTEVES 2020 117524 L CHEN 2020 122755 N GUPTA 2020 118111 D MONDELLI 2020 3764 3782 C LU 2021 120162 Y TEKIN 2022 129728 G GHOLIZADEH 2021 229 258 M SHRESTHA 2022 797 822 P CONTE 2021 615 P LEE 2017 70 79 J FUENTEHERNANDEZ 2017 286 A FYTILI 2008 116 140 D CHRISTODOULOU 2016 453 462 A PECCIA 2015 8271 8276 J BUI 2013 8022 8025 L AGRAFIOTI 2013 72 78 E LI 2014 2501 2509 M SILVA 2012 459 465 R FIDEL 2013 1771 1778 R SCHMAL 2016 M HETEROGENEOUSCATALYSISINDUSTRIALAPPLICATIONS GARCIA 2007 101 107 F TAMURA 2012 135 145 M LEHMANN 2012 J BIOCHARFORENVIRONMENTALMANAGEMENT TIAN 2019 156 Y CHA 2010 321 327 J KANNGIEER 2006 B HANDBOOKPRACTICALXRAYFLUORESCENCEANALYSIS FAN 2020 136663 J RAJPUT 2022 V SUSTAINABLEMANAGEMENTUTILIZATIONSEWAGESLUDGE REHMAN 2021 1779 R FREITAS 2020 A BODACHIVSKYI 2018 642 660 I LI 2020 X ZIELINSKA 2015 201 213 A THOMMES 2015 M LU 2013 137 143 H LIU 2009 482 484 W ABREGO 2009 3211 3221 J KIM 2013 58 64 H NENADOVIC 2015 299 309 S DEMCHENKO 2018 17 22 I HUO 2015 3682 C YARWOOD 2010 J SPECTROSCOPICPROPERTIESINORGANICORGANOMETALLICCOMPOUNDS RACEK 2020 3677 3709 J VANDERHEIDE 2011 P XRAYPHOTOELECTRONSPECTROSCOPY MOULDER 1992 J HANDBOOKXRAYPHOTOELECTRONSPECTROSCOPYAREFERENCEBOOKSTANDARDSPECTRAFORIDENTIFICATIONINTERPRETATIONXPSDATA JAFARINEJAD 2017 2513 2521 S ZHANG 2020 484 J LIU 2019 9548 X ZHOU 2019 117767 H FANG 2021 670 688 W ASSARY 2013 2694 2704 R DESAI 2019 16096 16105 D DOUTHWAITE 2017 5284 5293 M GRANADOS 2018 M FURFURALENTRYPOINTLIGNOCELLULOSEINBIOREFINERIESPRODUCERENEWABLECHEMICALSPOLYMERSBIOFUELS CLAYDEN 2012 J ORGANICCHEMISTRY TIAN 2008 948 957 Q WANG 2019 796 Y IGLESIAS 2015 1911 1927 J KIKHTYANIN 2014 154 162 O CHAFFEY 2018 4996 5002 D WANG 2021 111199 Y BARTHOLOMEW 2001 17 60 C LIU 2020 112248 C OSTROVSKII 2001 326 333 N MADRIAGAX2022X112692 MADRIAGAX2022X112692XV 2024-09-20T00:00:00.000Z 2024-09-20T00:00:00.000Z http://creativecommons.org/licenses/by-nc-nd/4.0/ © 2022 Elsevier B.V. All rights reserved. 2022-09-24T04:21:23.961Z http://vtw.elsevier.com/data/voc/AddOnTypes/50.7/aggregated-refined Laboratório de Microscopia Eletrônica de Alta Resolução FAPESP 2014/50249-8 FAPESP Fundação de Amparo à Pesquisa do Estado de São Paulo http://data.elsevier.com/vocabulary/SciValFunders/501100001807 http://sws.geonames.org/3469034/ CAPES CAPES Coordenação de Aperfeiçoamento de Pessoal de Nível Superior http://data.elsevier.com/vocabulary/SciValFunders/501100002322 http://sws.geonames.org/3469034/ CNPq CNPq Conselho Nacional de Desenvolvimento Científico e Tecnológico http://data.elsevier.com/vocabulary/SciValFunders/501100003593 http://sws.geonames.org/3469034/ FAPERJ E-26/210.315/2022 E-26/010.000.984/2019 E-26/201.358/2021 E-26/210.385/2018 E-26/211.575/2019 FAPERJ Fundação Carlos Chagas Filho de Amparo à Pesquisa do Estado do Rio de Janeiro http://data.elsevier.com/vocabulary/SciValFunders/501100004586 http://sws.geonames.org/3469034/ All authors gratefully acknowledge CNPq, FAPERJ (E-26/210.385/2018, E-26/211.575/2019, E-26/010.000.984/2019, E-26/201.358/2021, E-26/210.315/2022) and FAPESP (2014/50249-8). This study was financed in part by the Coordenação de Aperfeiçoamento de Pessoal de Nível Superior - Brasil (CAPES) - Finance Code 001. The authors are also grateful to Laboratório de Microscopia Eletrônica de Alta Resolução (LaMAR/CAIPE-UFF). All authors gratefully acknowledge CNPq, FAPERJ ( E-26/210.385/2018 , E-26/211.575/2019 , E-26/010.000.984/2019 , E-26/201.358/2021 , E-26/210.315/2022 ) and FAPESP ( 2014/50249-8 ). This study was financed in part by the Coordenação de Aperfeiçoamento de Pessoal de Nível Superior - Brasil (CAPES) - Finance Code 001. The authors are also grateful to Laboratório de Microscopia Eletrônica de Alta Resolução (LaMAR/CAIPE-UFF). https://doi.org/10.15223/policy-017 https://doi.org/10.15223/policy-037 https://doi.org/10.15223/policy-012 https://doi.org/10.15223/policy-029 https://doi.org/10.15223/policy-004 item S2468-8231(22)00578-8 S2468823122005788 1-s2.0-S2468823122005788 10.1016/j.mcat.2022.112692 315758 2023-04-12T12:18:01.948725Z 2022-10-01 2022-10-31 1-s2.0-S2468823122005788-main.pdf https://s3-eu-west-1.amazonaws.com/prod-ucs-content-store-eu-west/content/pii:S2468823122005788/MAIN/application/pdf/dfa4e0853351a15e978ce02eff22e581/main.pdf main.pdf pdf true 8057280 MAIN 12 1-s2.0-S2468823122005788-main_1.png https://s3-eu-west-1.amazonaws.com/prod-ucs-content-store-eu-west/content/pii:S2468823122005788/PREVIEW/image/png/7a465dc03dbf716969abef7203337ce1/main_1.png main_1.png png 57752 849 656 IMAGE-WEB-PDF 1 1-s2.0-S2468823122005788-gr5.jpg https://s3-eu-west-1.amazonaws.com/prod-ucs-content-store-eu-west/content/pii:S2468823122005788/gr5/DOWNSAMPLED/image/jpeg/fbe7d84e53c05e9b1b1331fff19fa313/gr5.jpg gr5 gr5.jpg jpg 145753 826 659 IMAGE-DOWNSAMPLED 1-s2.0-S2468823122005788-gr4.jpg https://s3-eu-west-1.amazonaws.com/prod-ucs-content-store-eu-west/content/pii:S2468823122005788/gr4/DOWNSAMPLED/image/jpeg/a02ac3830de7dd27304af9918ab2afae/gr4.jpg gr4 gr4.jpg jpg 45464 608 395 IMAGE-DOWNSAMPLED 1-s2.0-S2468823122005788-gr6.jpg https://s3-eu-west-1.amazonaws.com/prod-ucs-content-store-eu-west/content/pii:S2468823122005788/gr6/DOWNSAMPLED/image/jpeg/17549026acef11c851fdd2195d472d75/gr6.jpg gr6 gr6.jpg jpg 60725 269 659 IMAGE-DOWNSAMPLED 1-s2.0-S2468823122005788-gr1.jpg https://s3-eu-west-1.amazonaws.com/prod-ucs-content-store-eu-west/content/pii:S2468823122005788/gr1/DOWNSAMPLED/image/jpeg/8e81d60ff6b4fe146ca1d0570c03c46b/gr1.jpg gr1 gr1.jpg jpg 46605 336 809 IMAGE-DOWNSAMPLED 1-s2.0-S2468823122005788-gr2.jpg https://s3-eu-west-1.amazonaws.com/prod-ucs-content-store-eu-west/content/pii:S2468823122005788/gr2/DOWNSAMPLED/image/jpeg/d19083595e2ec19b4497cb719632e26f/gr2.jpg gr2 gr2.jpg jpg 71813 439 565 IMAGE-DOWNSAMPLED 1-s2.0-S2468823122005788-ga1.jpg https://s3-eu-west-1.amazonaws.com/prod-ucs-content-store-eu-west/content/pii:S2468823122005788/ga1/DOWNSAMPLED/image/jpeg/5acd8184cd7a1f3b00718a73e1a92158/ga1.jpg ga1 true ga1.jpg jpg 15369 118 301 IMAGE-DOWNSAMPLED 1-s2.0-S2468823122005788-sc1.jpg https://s3-eu-west-1.amazonaws.com/prod-ucs-content-store-eu-west/content/pii:S2468823122005788/sc1/DOWNSAMPLED/image/jpeg/d1cbc77e3f5171a128a93cd579894d90/sc1.jpg sc1 sc1.jpg jpg 67830 470 626 IMAGE-DOWNSAMPLED 1-s2.0-S2468823122005788-gr3.jpg https://s3-eu-west-1.amazonaws.com/prod-ucs-content-store-eu-west/content/pii:S2468823122005788/gr3/DOWNSAMPLED/image/jpeg/bc449483d7db8cd2e21515653cc0c3df/gr3.jpg gr3 gr3.jpg jpg 226669 998 806 IMAGE-DOWNSAMPLED 1-s2.0-S2468823122005788-gr5.sml https://s3-eu-west-1.amazonaws.com/prod-ucs-content-store-eu-west/content/pii:S2468823122005788/gr5/THUMBNAIL/image/gif/b2234d51aab9e5fb35b26905ff51044e/gr5.sml gr5 gr5.sml sml 11533 163 130 IMAGE-THUMBNAIL 1-s2.0-S2468823122005788-gr4.sml https://s3-eu-west-1.amazonaws.com/prod-ucs-content-store-eu-west/content/pii:S2468823122005788/gr4/THUMBNAIL/image/gif/baa52169d96b1518e8a38eb8a582e121/gr4.sml gr4 gr4.sml sml 7040 163 106 IMAGE-THUMBNAIL 1-s2.0-S2468823122005788-gr6.sml https://s3-eu-west-1.amazonaws.com/prod-ucs-content-store-eu-west/content/pii:S2468823122005788/gr6/THUMBNAIL/image/gif/92038810719332bc33d3890e7ec0eef1/gr6.sml gr6 gr6.sml sml 11660 89 219 IMAGE-THUMBNAIL 1-s2.0-S2468823122005788-gr1.sml https://s3-eu-west-1.amazonaws.com/prod-ucs-content-store-eu-west/content/pii:S2468823122005788/gr1/THUMBNAIL/image/gif/6a9c2013cf0013d739af60daa2387977/gr1.sml gr1 gr1.sml sml 6969 91 219 IMAGE-THUMBNAIL 1-s2.0-S2468823122005788-gr2.sml https://s3-eu-west-1.amazonaws.com/prod-ucs-content-store-eu-west/content/pii:S2468823122005788/gr2/THUMBNAIL/image/gif/4913a729009ced411b610d0524f51a50/gr2.sml gr2 gr2.sml sml 13822 164 211 IMAGE-THUMBNAIL 1-s2.0-S2468823122005788-ga1.sml https://s3-eu-west-1.amazonaws.com/prod-ucs-content-store-eu-west/content/pii:S2468823122005788/ga1/THUMBNAIL/image/gif/be5315ffad5ab2b34ba43d98abc95a05/ga1.sml ga1 true ga1.sml sml 9337 86 219 IMAGE-THUMBNAIL 1-s2.0-S2468823122005788-sc1.sml https://s3-eu-west-1.amazonaws.com/prod-ucs-content-store-eu-west/content/pii:S2468823122005788/sc1/THUMBNAIL/image/gif/f84ba671400997397b47de0c21e245b6/sc1.sml sc1 sc1.sml sml 12229 164 218 IMAGE-THUMBNAIL 1-s2.0-S2468823122005788-gr3.sml https://s3-eu-west-1.amazonaws.com/prod-ucs-content-store-eu-west/content/pii:S2468823122005788/gr3/THUMBNAIL/image/gif/757691f9cd9ce1a9590edd285873840f/gr3.sml gr3 gr3.sml sml 17282 163 132 IMAGE-THUMBNAIL 1-s2.0-S2468823122005788-gr5_lrg.jpg https://s3-eu-west-1.amazonaws.com/prod-ucs-content-store-eu-west/content/pii:S2468823122005788/HIGHRES/image/jpeg/a3b791587160a23f0a58e3b19a3d374e/gr5_lrg.jpg gr5 gr5_lrg.jpg jpg 1070944 3658 2917 IMAGE-HIGH-RES 1-s2.0-S2468823122005788-gr4_lrg.jpg https://s3-eu-west-1.amazonaws.com/prod-ucs-content-store-eu-west/content/pii:S2468823122005788/HIGHRES/image/jpeg/8e06003b9747c9a7557db3f7a18dc52d/gr4_lrg.jpg gr4 gr4_lrg.jpg jpg 319648 2691 1749 IMAGE-HIGH-RES 1-s2.0-S2468823122005788-gr6_lrg.jpg https://s3-eu-west-1.amazonaws.com/prod-ucs-content-store-eu-west/content/pii:S2468823122005788/HIGHRES/image/jpeg/08adb60244e492288249b7761f02d02f/gr6_lrg.jpg gr6 gr6_lrg.jpg jpg 390306 1189 2917 IMAGE-HIGH-RES 1-s2.0-S2468823122005788-gr1_lrg.jpg https://s3-eu-west-1.amazonaws.com/prod-ucs-content-store-eu-west/content/pii:S2468823122005788/HIGHRES/image/jpeg/2a6b68dbaa02d4547a0e467355d6be2a/gr1_lrg.jpg gr1 gr1_lrg.jpg jpg 304922 1490 3583 IMAGE-HIGH-RES 1-s2.0-S2468823122005788-gr2_lrg.jpg https://s3-eu-west-1.amazonaws.com/prod-ucs-content-store-eu-west/content/pii:S2468823122005788/HIGHRES/image/jpeg/6ac55e800946010c20b0970773a98526/gr2_lrg.jpg gr2 gr2_lrg.jpg jpg 564823 1943 2500 IMAGE-HIGH-RES 1-s2.0-S2468823122005788-ga1_lrg.jpg https://s3-eu-west-1.amazonaws.com/prod-ucs-content-store-eu-west/content/pii:S2468823122005788/HIGHRES/image/jpeg/115e3ccf85371e014313c933b2a4b475/ga1_lrg.jpg ga1 true ga1_lrg.jpg jpg 107281 523 1333 IMAGE-HIGH-RES 1-s2.0-S2468823122005788-sc1_lrg.jpg https://s3-eu-west-1.amazonaws.com/prod-ucs-content-store-eu-west/content/pii:S2468823122005788/HIGHRES/image/jpeg/d5932f5ee4ed48ff1694e0c49e998ab2/sc1_lrg.jpg sc1 sc1_lrg.jpg jpg 458685 2082 2774 IMAGE-HIGH-RES 1-s2.0-S2468823122005788-gr3_lrg.jpg https://s3-eu-west-1.amazonaws.com/prod-ucs-content-store-eu-west/content/pii:S2468823122005788/HIGHRES/image/jpeg/61e424676cc6f19ab42c051dbd20619d/gr3_lrg.jpg gr3 gr3_lrg.jpg jpg 1931038 4417 3568 IMAGE-HIGH-RES 1-s2.0-S2468823122005788-mmc1.docx https://s3-eu-west-1.amazonaws.com/prod-ucs-content-store-eu-west/content/pii:S2468823122005788/mmc1/MAIN/application/vnd.openxmlformats-officedocument.wordprocessingml.document/f9a94a918d9792015e6f62a25ad694f8/mmc1.docx mmc1 mmc1.docx docx 9876579 APPLICATION 1-s2.0-S2468823122005788-si1.svg https://s3-eu-west-1.amazonaws.com/prod-ucs-content-store-eu-west/content/pii:S2468823122005788/image/svg+xml/d1bc71cba8b135ab212d657de2f628fd/si1.svg si1 si1.svg svg 9648 ALTIMG 1-s2.0-S2468823122005788-am.pdf https://s3-eu-west-1.amazonaws.com/prod-ucs-content-store-eu-west/content/egi:10W9BV8R1V5/MAIN/application/pdf/4f9fa60ea7ef8c0f56cc03c549c87fa5/am.pdf am am.pdf pdf false 3372199 AAM-PDF MCAT 112692 112692 S2468-8231(22)00578-8 10.1016/j.mcat.2022.112692 Elsevier B.V. Scheme 1 Reaction pathway for the valorization of furfural using biochars as catalysts. Scheme 1 Fig. 1 FTIR spectra (a) and TGA analyses (b) of the RSB and TSB biochars. Fig 1 Fig. 2 XRD patterns of the RSB and TSB biochars. Fig 2 Fig. 3 Illustrative SEM images and chemical mapping of the (a) RSB and (b) TSB biochars. Fig 3 Fig. 4 Survey XPS spectra of the RSB and TSB biochars. Fig 4 Fig. 5 Reaction parameters studied employing the biochars RSB (a,c and e) and TSB (b, d and f) as catalysts. Fig 5 Fig. 6 Reuse reactions employing the biochars RSB (a) and TSB (b) as catalysts. Fig 6 Table 1 Pyrolysis yield and biochars compositions. Table 1 Yield (%) C (%) N (%) H (%) O a (%) Ash b (%) H/C ratio O/C ratio RSB 68.0 20.88 1.99 1.75 10.30 63 0.98 0.36 TSB 68.1 21.77 2.00 1.62 4.20 58 0.90 0.14 a The O contents were calculated by subtraction of ash, N, C, H, and S content, as proposed by EBC.[38]. b The ash contents were obtained from TGA analyses after organic matter decomposition. [38]. Table 2 Metals content in RSB and TSB biochars determined by the MIP OES technique after microwave-assisted acid digestion. Table 2 Metals RSB (wt.%) TSB (wt.%) Limit content a (wt.%) Ca 1.05 1.89 – Fe 4.84 4.53 – Zn 0.15 0.20 0.4 K 0.34 0.13 – Al 8.04 4.31 – Ba 0.04 0.04 – Cu 0.04 0.06 0.1 Mn 0.03 0.03 – Ni 0.00 0.00 0.42 Pb 0.02 0.04 0.15 Cr 0.01 0.02 0.09 a Metal limit content established to EBC [38]. Table 3 Textural and acid characterization of the RSB and TSB biochars. Table 3 SB.E.T. (m2/g) Pore volume (cm3/g) Pore diameter (nm) Total acidity (mmol/g) a L/B ratio b Lewis acidity (mmol/g) c Brønsted acidity (mmol/g) c RSB 9.1 0.032 20.7 0.55 0.86 0.29 0.26 TSB 9.0 0.035 16.3 0.36 0.94 0.19 0.17 a Total acidity obtained by liquid pyridine adsorption followed by TGA analyses [35]. b Lewis/ Brønsted ratio obtained from FTIR-pyridine spectra (Fig. S2). c Lewis and Brønsted acidity crossing the total acidity data and L/B ratio [35]. Metal-contaminated biochars as cheap and more sustainable catalysts for furfural conversion to value-added compounds Vinicius G.C. Madriaga Data curation Formal analysis Investigation Methodology Conceptualization Writing – original draft a João Pedro R. Mattos Data curation Formal analysis Investigation Methodology Conceptualization Writing – original draft a Vinicius Rossa Data curation Formal analysis Investigation Methodology Conceptualization Writing – original draft a Luanne E.M. Ferreira Data curation Formal analysis Investigation Methodology Conceptualization Writing – original draft a Sancler C. Vasconcelos Data curation Formal analysis Investigation Methodology Conceptualization Writing – original draft a Domingos S.A. Silva Formal analysis Investigation Methodology b Pamela S.M. Rocha Formal analysis Investigation Methodology a Rodrigo D. dos Santos Formal analysis Investigation Methodology c Ludmila P.C. Silva Formal analysis Investigation Methodology d Joyce R. Araujo Formal analysis Investigation Methodology e Ernesto A. Urquieta-González Funding acquisition Writing – review & editing b Gilberto A. Romeiro Funding acquisition Writing – review & editing a Ricardo J. Cassella Funding acquisition Writing – review & editing a Thiago M. Lima Funding acquisition Project administration Supervision Writing – review & editing a ⁎ Fabio B. Passos Funding acquisition Project administration Supervision Writing – review & editing d ⁎ a Instituto de Química, Outeiro São João Batista, Universidade Federal Fluminense, s/n, Campus do Valonguinho, Centro, Niterói, Rio de Janeiro 24020-141, Brazil Instituto de Química, Outeiro São João Batista Universidade Federal Fluminense s/n, Campus do Valonguinho, Centro, Niterói Rio de Janeiro 24020-141 Brazil aInstituto de Química, Outeiro São João Batista, Universidade Federal Fluminense, s/n, Campus do Valonguinho, Centro, Niterói, Rio de Janeiro 24020-141, Brazil b Departamento de Engenharia Química, Universidade Federal de São Carlos, Rod. Washington Luis, km 235, São Carlos, São Paulo 13565-905, Brazil Departamento de Engenharia Química Universidade Federal de São Carlos Rod. Washington Luis, km 235, São Carlos São Paulo 13565-905 Brazil bDepartamento de Engenharia Química, Universidade Federal de São Carlos, Rod. Washington Luis, km 235, São Carlos, São Paulo 13565-905, Brazil c Instituto de Física, Universidade Federal Fluminense, Av. Gal. Milton Tavares de Souza, s/n, Campus da Praia Vermelha, Niterói, Rio de Janeiro 24210-346, Brazil Instituto de Física Universidade Federal Fluminense Av. Gal. Milton Tavares de Souza, s/n, Campus da Praia Vermelha, Niterói Rio de Janeiro 24210-346 Brazil cInstituto de Física, Universidade Federal Fluminense, Av. Gal. Milton Tavares de Souza, s/n, Campus da Praia Vermelha, Niterói, Rio de Janeiro 24210-346, Brazil d Departamento de Engenharia Química e de Petróleo, Universidade Federal Fluminense, Rua Passo da Pátria, 156, Niterói, Rio de Janeiro 24210-240, Brazil Departamento de Engenharia Química e de Petróleo Universidade Federal Fluminense Rua Passo da Pátria, 156, Niterói Rio de Janeiro 24210-240 Brazil dDepartamento de Engenharia Química e de Petróleo, Universidade Federal Fluminense, Rua Passo da Pátria, 156, Niterói, Rio de Janeiro 24210-240, Brazil e Divisão de Metrologia de Materiais, Instituto Nacional de Metrologia, Qualidade e Tecnologia, Av. Nossa Senhora das Graças, 50, Duque de Caxias, Rio de Janeiro 25250-020, Brazil Divisão de Metrologia de Materiais Instituto Nacional de Metrologia, Qualidade e Tecnologia Av. Nossa Senhora das Graças, 50, Duque de Caxias Rio de Janeiro 25250-020 Brazil eDivisão de Metrologia de Materiais, Instituto Nacional de Metrologia, Qualidade e Tecnologia, Av. Nossa Senhora das Graças, 50, Duque de Caxias, Rio de Janeiro 25250-020, Brazil ⁎ Corresponding authors. Furfural is an important biobased building block molecule to produce several value-added compounds for the fine chemical industry, biofuels, and biopolymers through a catalytic pathway. Developing cheaper and more sustainable catalysts to promote furfural conversion reactions is imperative to meet the Green Chemistry principles and obtain biobased products through greener routes. In this sense, sewage sludge-derived biochars emerge as promising materials that catalyze furfural conversion reactions since they possess acid and basic surface sites due to their high metal content and organic structure. This paper reports the employment of two sewage sludge-derived biochars as catalysts for furfural conversion, an encouraging application for these solids with severe environmental concerns. These materials were fully characterized regarding their composition, structure, textural, morphological, acidic, and surface properties, displaying the presence of acid (Lewis and Brønsted) and basic sites. These biochars presented good activity for converting furfural (26.5–68.8%) and high selectivity to furfuryl alcohol (43.6–90.6%). In addition, other value-added products were observed, such as furfural-derived ethers, ester, and ketone. Graphical abstract Image, graphical abstract Keywords Sewage sludge Biochar Furfural Biomass Furfuryl alcohol Data Availability Data will be made available on request. 1 Introduction In recent years, biomass valorization has become an important research field since the demand for clean technologies and pathways to obtain chemicals has grown fast, especially to substitute petroleum derivatives. In that approach, biomass can be chemically converted into several essential products for industry, such as furfuryl alcohol, levulinic acid, furoic acid, and many others that can be applied in fuel production and construction, pharmaceutical, and many others industrials sectors [1–3]. Several platform molecules can be obtained from different lignocellulosic biomass fractions, and one of the most promising building blocks is furfural (FUR) [4–6]. This compound is a precursor in several value-added chemical syntheses, for example, furfuryl alcohol (FA), used mainly in the fuel industry and can produce resins for the construction sector. Furfuryl esters produced by FUR oxidation are essential flavoring agents in the food industry [7]. Some larger molecules derived from FUR, such as furfuryl ethers, are critical for developing fuels, especially biodiesel, aviation, and rocket fuel production [8]. In this way, heterogeneous catalysts increase these processes' sustainable character and should be highly efficient, stable, and reusable [9]. A wide range of materials have been proposed in the literature for FUR conversion, such as zeolites [10,11], silicas- [12,13] and carbon-based materials [14], metal nanoparticles [15–17], and single-atom catalysts [18,19]. Nevertheless, manufacturing these catalysts is often difficult, expensive, generates hazardous residues, and uses reactants and methods with considerable environmental concerns. Within this scenario of reducing these concerns, biomass also emerges as a promising feedstock to produce more sustainable catalysts [20,21,19]. In this context, biochars are remarkable materials because of their facile synthesis. These materials have a unique structure and desired properties for their application as catalysts, such as porous structures and functional groups [22,23]. Biochars are materials produced from the biomass pyrolysis process under controlled conditions, and their structure comprises organic (polycondensed rings and aliphatic moieties) and ash. These solids are found in the literature for the conversion of biomass-derived compounds, in which they are mainly applied as support. For instance, Lee and co-workers reviewed different biochars for biomass conversion reactions as catalysts for transesterification, tar removal, and xylose hydrolysis [24]. In addition, Fuente-Hernández and co-workers also reported a platinum catalyst supported on biochar for FUR hydrogenation to FA [25]. However, those authors applied harsh conditions such as temperature and hydrogen pressure to achieve a high selectivity to FA. The obtention of sewage sludge biochar (SSB) is a promising pathway to solve a crucial environmental issue assigned to this type of biomass since several tons of this material are produced annually in highly developed cities [26,27]. In addition, this biomass is typically recognized for possessing a high heavy metal and microbial content and thus being a hazardous chemical and pathogen source [28]. The sustainable handling of sewage sludge using recycling alternatives is imperative to minimize the risks to human health and the environment. The SSBs are promising materials for catalysis due to Lewis and Brønsted acid sites, which are typically required for FUR conversion [29]. In such a manner, Agrafioti and co-workers described that these materials usually have high metal contents and an organic porous structure, showing that SSB has an intrinsic Lewis acidity [31]. Besides, the organic fraction of biochar also presents Brønsted acid and basic sites, as reported by Li and co-workers [31]. Considering the above explanations and the promising application of SSBs as catalysts, this work aims to explore two different SSBs as more sustainable catalysts for FUR conversion. It is essential to mention that, to the best of our knowledge, SSBs have never been reported as catalysts for FUR upgrading before, opening a window of new possibilities. This study proposes the achievement of greener catalysts for lignocellulosic biomass-derived compounds and solves a substantial environmental issue regarding the correct disposal of these sludges. 2 Experimental section 2.1 Chemicals Except for pyridine (previously distilled), all chemicals used in this study were purchased from Sigma-Aldrich® and employed without further treatment or purification. 2.2 Biochar obtention The sewage sludges were collected from the Rio de Janeiro treatment station in two distinct stages: before (raw sewage sludge) and after (treated sewage sludge) flocculation. These sewage sludges originated their respective biochars: raw sewage sludge biochar (RSB) and treated sludge biochar (TSB). Both biochars were obtained by a previously reported method [32]; the sludges were dried at 105 °C until no variation in their mass was observed. Then, the pyrolysis was performed at the following conditions: 380 °C, 15 °C/min, N2 atmosphere, and 2 h of reaction, generating RSB and TSB. 2.3 Characterization The biochars’ overall metal contents were determined by microwave-induced optical emission spectrometry (MIP OES) using an Agilent 4210 MP AES spectrometer after microwave-assisted sample digestion with concentrated nitric acid. Sample digestion was performed in a Berghof (Eningen, Germany) microwave oven, model Speedwave, equipped with TFM® DAK-100 flasks, using a method proposed by own Berghof (and stored in the instrument memory) for digestion of coal (Table S1). In addition, to identify other elements in biochars, the X-ray fluorescence technique (EDX-720 Shimadzu) was employed with a step of 0.02 under vacuum with an Rh source at 50 kV, 30 μA, and 100 s of irradiation. X-ray diffraction patterns were obtained using a Bruker D8 diffractometer with a CuKα source (1.5406 Å) ranging from 5 to 90° with a 0.01°/s step. The crystalline phases were identified using the method Crystal Match!© software. The samples were characterized by attenuated total reflection infrared spectroscopy (FTIR-ATR) in a Varian 660 – IR spectrometer. The spectra were collected between 600 and 4000 cm−1 with a resolution of 4 cm−1. Thermogravimetric Analysis (TGA) was performed in Shimadzu DTG-60 equipment, using alumina crucibles in a synthetic air atmosphere (50 mL/min) at a heating rate of 10 °C/min. The elemental analysis was performed to quantify carbon, nitrogen, hydrogen, and oxygen (obtained by subtracting the masses) using a Perkin Elmer Elementary Analysis 2400 pre-calibrated with an acetanilide standard. The textural properties were assessed by N2 physisorption at 77 K using a Micromeritics ASAP 2420 apparatus. Before the analyses, the samples were dried at 200 °C for 24 h under vacuum to remove water and other adsorbed gasses. Scanning Electronic Microscopy (SEM) coupled with Energy Dispersive Spectroscopy was performed using JEOL 7100F microscope. The XPS analyses were performed in ultra-high vacuum equipment (pressure: 10–7 Pa; Scienta Omicron GmbH, Taunusstein, Germany), using a non-monochromatic Al Kα (hν = 1486.6 eV) X-ray source, operated at the anode voltage of 15 kV and filament current of 20 mA. The high-resolution spectra for the O, N, Ca, C, Si, Fe, and Al were obtained with a pass energy of 20 eV. A charge neutralizer system, i.e., a flood gun operated at 3 V tension, emission current 1 μA, was used to eliminate charge accumulation effects. The C1s signal in aliphatic molecules (285 eV) was used for calibration using CasaXPS® software. Characterizing and estimating acidity values in biochars, especially those from sewage sludge is a challenging task for two reasons: (i) the acidity of these materials is not as high as in zeolites or functionalized silicas, and the use of conventional benchtop titration methods are complex [33]; (ii) the thermal stability of biochars is low and thus turning difficult to apply some standard techniques, such as TPD-NH3 or FTIR-pyridine with temperature programming [34]. This way, alternatives for quantifying the total acidity of SSBs, including the Lewis and Brønsted acid site speciation, are necessary to estimate such values. Here, we combined qualitative speciation of acid sites through FTIR-pyridine adsorption and quantitative total acid determination using liquid pyridine adsorption followed by TGA/DTA analyses already reported by Garcia and co-workers [35]. This method is based on the weight loss difference between the material before and after the adsorption of liquid pyridine, thus allowing the calculation of the amount of chemisorbed pyridine. The acidities of biochars were obtained as follows: 100 mg of each biochar were dispersed in 6.5 mL of distilled pyridine for 24 h at room temperature. The samples were filtered and dried, and then thermogravimetric analysis was employed. The acidity values were calculated using Eq. (1). (1) A c i d i t y ( m o l g ) Where wcatpy is the total weight loss of the catalyst after pyridine adsorption (neglecting the physisorbed pyridine, i.e., at temperature lower than 200 °C), wcat is the weight loss before pyridine adsorption, MMpy is the molar mass of pyridine and wdcat is the mass of dried catalyst (obtained at 200 °C). It is worth mentioning that physisorbed pyridine (values below 300 °C) was not used for the total acidity calculations for both biochars. The amount of Brønsted (B) and Lewis (L) acid sites of the biochars was determined by FTIR analysis of in situ adsorbed pyridine using a Bruker spectrometer (Vertex 70) equipped with an MCT detector and a transmission cell with a CaF2 window. For the analyses, a 10 mg sample pellet (pressed with 5 tons) was pre-treated at 250 °C under an argon atmosphere (100 mL/min) for 1 h. Then, the system was cooled to 150 °C, and the sample was saturated with pyridine vapor. The excess and physically adsorbed pyridine were purged with argon (100 mL/min). FTIR spectra were collected at 150 °C with a resolution of 4 cm−1 in the region of 4000 to 1000 cm−1. Next, the spectra from samples with and without adsorbed pyridine were subtracted [36]. 2.4 Catalytic evaluation A typical catalytic evaluation was performed according to a previous procedure reported in the literature [10–12]. For that, 50 mg of each biochar was added to 750 μL of isopropanol, 28 μL of FUR at 130 °C for 24 h in an Ace pressure tube®. Next, the liquid fraction was analyzed by GC-MS (GC-MS QP2010 Plus Shimadzu using a Supelcowax 8 column), and the following products were identified: (i) furfuryl alcohol (FA), (ii) 2-(isopropoxymethyl)furan (PMF), (iii) isopropyl furan-2-carboxylate (IPF), (iv) 2,2′-(oxybis(methylene))difuran (DFE), (v) (E)−4-(furan-2-yl)but-3-en-2-one (FBA). The recycled catalysts were also characterized by thermogravimetric analysis, N2 physisorption, X-ray diffraction, and Infrared spectroscopy. An initial catalytic run was performed employing RSB and TSB biochars as catalysts following a previously reported procedure [10–12]. 3 Results and discussion 3.1 Biochar characterization The FTIR experiments (Fig. 1a) confirm the formation of an organic biochar structure since both materials (RSB and TSB) presented bands assigned to stretching and bending, such as aromatic C=C (1614 and 1580 cm−1), aliphatic CH (2990 cm−1), and oxygenated CO (1020 cm−1) and OH (3610 cm−1) groups [23,37]. TGA measurements for both materials showed an initial mass loss from 25 °C to 150 °C assigned to the desorption of physisorbed water molecules from the biochar structure, and the mass loss from 150 °C to 560 °C was due to organic matter oxidation representing a 30.4% loss for RSB and 32.5% for TSB. From the TGA curves, it is possible to observe a slight difference between RSB and TSB ash contents showing that pre-treatment employed to produce TSB (flocculation and centrifugation in the sewage treatment station) can reduce the organic matter in the sewage sludge, as expected. In addition, lower thermal stability of the TSB material can be observed compared to the RSB due to a higher ash content in the latter material [31,33]. Both biochars were evaluated regarding their composition and pyrolysis yield as shown in Table 1 . The results demonstrate that these materials are mainly comprised of ash, i.e., inorganic compounds, as expected. However, both materials have a significant carbon content, suggesting that biochar organic structures were formed due to pyrolysis. Previous studies show similar values for SSB materials, in which the organic portion commonly represents the minor part of the biochar structure [30,38–40,23]. The aromaticity values (H/C ratios) were higher than 0.7, indicating that these materials do not have high concentrations of aromatic and polycondensate organic compounds. According to the European Biochar Certificate, these values suggest that the biochars structures might contain some residual sewage sludge agreeing with the pyrolisis yield observed for both materials [38]. This behavior is related to the low-temperature pyrolysis producing biochar with lower concentrations of aromatic compounds while the pyrolysis yield increases. Furthermore, the stability values (O/C ratios) follow the EBC parameter of 0.4, suggesting that no unstable oxygenated compounds were formed instead of the typical biochar structure [30,38–40,23]. Since the RSB and TSB biochars presented a high ashes content, the XRF analyses were employed to identify other elements in samples, and the results are displayed in Table S2. The analyses showed relevant contents of silicon, aluminum, iron, calcium, sulfur, phosphorous, potassium, titanium, and zinc. All these elements were reported for similar SSBs, especially sulfur, phosphorous, and potassium which are common in several biochars [37,38]. The MIP OES technique was employed to quantify the overall metal content in biochars. As Table 2 shows, a significant range of calcium, iron, and aluminum was found in both biochars, whereas some other metals (Zn, K, Ba, Cu, Mn, Ni, Pb, and Cr) were present in lower concentrations. Since XRF analyses present a more superficial scanning of the catalysts’ composition [41], we could observe a difference in the composition of the values and elements detected in Table S2 and Table 2. The MIP OES technique detected a more comprehensive metal composition due to the complete sample digestion in an acid medium and furnished a global sample composition. TSB and RSB presented different contents of these metals, and the biochar RSB showed higher values in good agreement with the ash content (Table 1) [30,39,42]. These results indicate that some of the species were removed from the sewage sludge during its treatment (TSB biochar): especially aluminum, which decreased its concentration [43]. These differences might be related to water-soluble compounds in raw sewage sludge. After the flocculation procedure, some of these compounds are not present in the sewage sludge due to their high solubility and thus reducing the ash content [43]. Besides these differences in concentrations, the structural compositions are similar for both biochars, and the materials agreed with EBC parameters [38]. Next, RSB and TSB biochars were characterized regarding their crystalline phases using the XRD technique, as shown in Fig. 2. A complete identification of the diffraction peaks in the RSB and TSB XRD patterns is problematic since these materials comprise several crystalline phases with overlapped peaks and present low intensities [44,45]. In such a manner, the identification was based primarily on the XRF contents and the use of the software Crystal Match®. The most intense peaks were analyzed and assigned according to the high similarity with the suggested crystallographic cards. In both samples, some phases were identified, such as SiO2 (quartz and cristoballite), calcium sulfate, zinc sulfate and hydroxide, aluminosilicates containing calcium and sodium, titanium dioxide, iron carbide, and silicon carbide. Here is worth mentioning that some of these structures can act as acid sites for FUR valorization: metal oxides which may function as Lewis sites, and aluminosilicates, which act as Brønsted acid sites [46,47]. The textural properties of these biochars were evaluated by N2 physisorption. The isotherms (Fig. S1) were very similar and classified as type II, characteristic of nonporous or macroporous solids with low porosity and slight adsorption [48]. In addition, hysteresis loops were observed at high p/p0 pressures and assigned to the N2 condensation in the mesopores created from interparticular aggregates [49]. Both biochars presented virtually the same B.E.T. specific surface area, and the pore diameters obtained by the B.J.H. method (Fig. S1 and Table 3 ) indicate a large pore distribution, including meso and macropores. It is important to note that sewage sludge biochars often do not display high specific surface areas due to their porous structure. Since these materials are mainly comprised of inorganic compounds, a low amount of pores is formed after the pyrolysis and thus leading to macroporous solids with low surface area [30,42,43,48,50]. In the acidic characterization, a difference in the weight loss between the pure biochars (RSB and TSB) and the biochars containing adsorbed pyridine (RSB – Pyridine, and TSB – Pyridine) was observed. Considering that the pyridine adsorption increased the weight loss value, and from this difference, it was possible to estimate the acidity values (Table 3) [35]. It can be seen from the graphs (Fig. S3) and also from the results presented in Table 3 that RSB presented a more pronounced acidity than TSB. This difference in total acidity is assigned to aspects already addressed in chemical characterization (XRF, MIP OES, and FTIR). The RSB biochar possesses carbonyl groups (associated with carboxylic acid groups) and compounds containing transition metals such as Al and Si (as aluminosilicates), which led to a significant part of the total acidity [37,23]. From the TGA curves (Fig. S3), it is possible to observe a weight loss in the range of 80–100 °C referring to physisorbed gasses and water, having a slight change in the TGA signal for the solid with and without adsorbed pyridine. Comparing the curves for pure biochars and the pyridine adsorbed ones, it is possible to note a signal in the DTA around 400 °C assigned to the oxidation of organic matter. In addition, a new peak was formed around 550 °C for the biochars with adsorbed pyridine. These two differences are attributed to the chemisorption of pyridine on the acid sites; in which the first difference at 400 °C is assigned to the pyridine desorption from weak acid sites (occurring with the oxidation of organic matter), while the weight loss at 550 °C is related to the desorption of pyridine from strong acid sites [35,51]. Furthermore, it is relevant to specify the site type (Brønsted and Lewis), and for this purpose, the FTIR-Py technique was used (Fig. S2). The results show the characteristic bands of Brønsted acidity at 1550 cm−1 and Lewis acidity at 1450 cm−1. These bands refer to the stretching of the C=C bonds of pyridine in the pyridinium ion (interaction with Brønsted acid sites) and the complex formed between pyridine and Lewis acid sites [36]. From Table 3, it is possible to observe a higher acidity for the RSB biochar, which can be assigned to the higher aluminum content, as observed in Table 2. A higher aluminum content might be associated with more aluminosilicates in the RSB biochar and significantly contribute to forming more Brønsted acid sites, as corroborated by a lower L/B ratio. The morphological characteristics of the sewage sludge biochars were evaluated using the SEM-EDS technique and the images shown in Figs. 3 and S4–S7. These images are comprised of grains with heterogeneous sizes and several morphologies and compositions, which is more evident in the chemical mapping images displayed in Figs. S4–S7. Several morphologies were detected, and their composition agrees with the data observed in the XRF and MIP OES results. Furthermore, this heterogeneous composition and morphology are often observed for sewage sludge-derived biochars [52,53]. A dense and wrinkled grain structure comprised of aluminosilicates appears in both biochars, thus corroborating the XRD results (Fig. 2). In addition, the two biochars have grains of micrometers, which directly relates to the heating rate and pyrolysis temperature. It is important to emphasize that the formation of small grains deposited on larger grains occurs due to biochar formation in slow pyrolysis and low temperatures [43]. In TSB SEM images and chemical mapping, it is possible to observe small particles containing titanium and oxygen deposited in larger grains containing sulfur and calcium assigned as calcium sulfate. Regarding the RSB SEM images and chemical mapping, it was possible to observe a porous structure (with diameters in the range of 120–200 nm) comprised of silicon dioxide, typical of the diatomite morphology [54]. In addition, it was observed that some elements typically contribute to the generation of most of the acid sites, such as aluminum, silicon, and iron. The first two elements might significantly contribute to the Brønsted acidity of these biochars, whereas iron can be related to the Lewis acid sites. Also was observed the presence of calcium and magnesium was also observed, corroborating with the XRD patterns. These elements associated with sulfates, carbonates, and oxides might also furnish basic sites for both biochars. The surface chemical composition was analyzed using the XPS technique, and the RSB and TSB survey spectra are presented in Fig. 4. Table S3 shows the surface composition of each biochar material. These results indicate that both surfaces have high carbon, nitrogen, and oxygen concentrations related to the pyrolysis process of the organic matter. In addition, the inorganic ash was also detected by XPS through the peaks assigned to the presence of silicon, aluminum, iron, and calcium, which also were observed in the MIP OES, XRF, and SEM-EDS analyses [23]. Figs. S8 and S9 show the deconvolution of the high-resolution XPS spectra for different signals detected in the survey. The Si2p spectra showed two components, in which the first signal at 100.4 eV for RSB (38.8%) and 98.6 eV (19.9%) for TSB is assigned as elemental silicon [55]. In addition, a signal in 103.2 eV (61.2%, RSB) and 102.2 eV (80.1%, TSB) was detected and is characteristic of aluminosilicates [56]. In the C1s spectra, the deconvolution for both biochars showed different contributions as inorganic carbon in the form of carbide (282.5 eV), sp3 carbon (284.1–284.6 eV), oxygenated organic groups as C=O (288.0–288.1 eV) and COC (286.0 eV), and the aromatic π-π* structure (292.0 eV) [55,57]. Moreover, the signal referring to C=O appears in a higher proportion in the RSB (9.87%) than TSB (5.18%), suggesting a higher amount of carbonyl compounds in the former material, which can significantly contribute to its Brønsted acidity [23]. The signals assigned to inorganic carbon as carbides observed in the XPS spectra were in good agreement with the results shown by the XRD patterns, in which crystalline phases as SiC and Fe3C were observed for both biochars. The signal related to Ca2p for the RSB biochar showed a component attributed to the presence of Ca(OH)2/CaO (346.0 eV, 18.14%), while in the TSB spectrum, this signal was not observed. This Ca(OH)2/CaO signal suggests that RSB also might present basic sites on its surface [57,58]. In the O1s spectra, the RSB and TSB presented three main components: (i) metallic oxides (532.8–529. 9 eV), (ii) oxygen in the organic structure (531.0–530.8 eV), and (iii) silicon oxides as quartz or aluminosilicates (527.9–531.7 eV) [59,60]. In the TSB spectrum, a higher amount of oxygen in the organic structure (31.18%) was observed compared to the RSB material (29.30%), which is in good agreement with a higher C=O content observed in the C1s analyses. In addition, the components related to metallic oxides were 60.92% and 3.77% for RSB and TSB, respectively. A higher amount of metallic oxides in the RSB surface is ascribed to the sewage sludge treatment stage in which the raw biomasses were collected, and no previous treatment was employed [61,62]. The N1s spectra of both biochars presented two components, in which the first is assigned to NC groups (399.3 eV) and the second one to NH groups (400.5 eV) [63]. RSB biochar presented 51.67% for the NH component, whereas the TSB one presented 19.89%. For the component assigned to CN in the biochar structure, the compositions were 48.33% and 80.11% for RSB and TSB, respectively. It is important to note that the higher amount of NH groups in the RSB might act as basic sites in this material. The Fe2p spectra revealed the presence of two species on the surface of both materials and assigned to Fe(II) and Fe(III). The compositions were 61.0% and 86.1% for Fe (II) in the RSB and in the TSB, respectively, while for Fe (III), the compositions were 39.0% and 13.8% [50,64]. It is worth mentioning that only TSB material presented a signal related to the presence of Al. This signal deconvolution revealed only the presence of aluminosilicate, which might be fundamental for creating Brønsted acid sites [56]. 3.2 Catalytic evaluation An initial catalytic run was performed employing RSB and TSB biochars as catalysts following a previously reported procedure [10–12]. Scheme 1 illustrates a simplified reaction pathway for the obtention of the products observed from FUR upgrading. Figs. S10 and S11 show typical chromatograms and the mass spectra used to identify all the products, respectively. Considering all the products mentioned in Scheme 1, all the mechanisms will be explored next. In this context, FUR conversion to FA occurs through catalytic transfer hydrogenation following a mechanism derived from a Meerwein–Ponndorf–Verley (MPV) reduction. This mechanism involves the hydrogen transfer as a hydride from isopropanol to FUR and thus yielding the hydrogenated product FA and acetone [65,66]. The mechanistic proposal for forming FBA occurs through an aldol condensation reaction. Initially, as FUR is a non-enolizable aldehyde, the enolate intermediate is formed from the acetone (found in the reaction medium as a product of the MPV reaction). Once the enolate ion is created, the reaction follows a classical condensation mechanism, and FUR undergoes an aldol addition to form the aldol adduct. In addition, at the temperature of a typical reaction (130 °C) this intermediate follows dehydration by the elimination mechanism and thus generates FBA. It is important to note that this mechanistic proposal requires a catalyst that contains acid or basic Brønsted sites to guarantee the enolate ion formation. These sites are present in both biochars and justify the presence of this product for both catalysts. Furyldiene ketones, such as FBA are essential in the fuel industry, and this proposal is highly relevant due to their ability to add carbon to the furanic structure [67]. The IPF obtention occurs through Cannizzaro's mechanism, which occurs in the formation of furoic acid followed by esterification with isopropanol. Non-enolizable aldehydes such as FUR in an alkaline medium are oxidized to their respective esters (if alkoxides are formed) or acids (in the case of hydroxides). For the formation of the IPF in this scenario, the hydroxide anion needs to be generated in the medium. Then a nucleophilic attack on a FUR molecule occurs, producing a charged intermediate. Next, the disproportionation happens when this intermediate donates hydrogen as a hydride to another FUR molecule, thus creating a FA and furoic acid molecule [68]. The presence of the Brønsted acid sites, the excess of isopropanol in the reaction medium, and the favorable temperature condition promote a quick furoic acid conversion to IPF. This reaction follows a classic esterification mechanism in which isopropanol attacks carboxyl moiety and, after successive acid-base reactions, gives rise to IPF. It is interesting to note that GC-MS did not identify furoic acid due to the equilibrium and temperature conditions of the system, which favor its total conversion into other products [69]. An important observation about this mechanistic proposal was reported by Douthwaite and co-workers [68]. The transformation of FUR to its oxidized derivatives usually forms a more significant amount of the oxidized derivative IPF than FA (although the reaction stoichiometry is 1:1). This transformation occurs because FUR reduction to FA is reversible and follows an oxidative dehydrogenation reaction. There are still uncertainties regarding this mechanism, and it is generally accepted that this reaction undergoes a redox process involving metal ions such as Fe+3, Mn+4, and Ti+4. In particular, iron oxide was identified in the biochars studied in this paper, which can significantly contribute to this reversible process [64]. The DFE formation from FA has already been reported in other studies using biochar as a catalyst [25]. Etherification reactions occur in the presence of Brønsted acid sites. The proposed mechanisms for DFE and PMF formation proceed by a classic nucleophilic substitution whereby a carbocation derived from FA suffers a nucleophilic attack by another FA molecule and yields a DFE molecule. When this attack occurs by an isopropanol molecule, the PMF is formed [70]. Unlike the other mentioned reactions, these dehydration reactions occur after MPV reaction, i.e., the FA molecule generated from FUR is the starting material. Therefore, the etherification reaction does not compete for FUR molecules, contrasting with the formation mechanisms of FBA and IPF [68]. Understanding these mechanisms above allows a better comprehension of the conversion and selectivity values presented in Table S4. For instance, when analyzing FUR conversion in both biochars, the data refer to the same trend for acidity. The RSB total acidity led to a higher FUR conversion. Strong basic sites (such as calcium hydroxide or sulfate observed in XPS analyses) also contribute to this result as they promote FUR conversion to FBA and IPF. The lower acidity of the TSB biochar led to a lower conversion of FUR, in which XPS identified no soluble and basic materials. The absence of these sites explains the lack of IPF in the reaction catalyzed by the TSB biochar. Moreover, FBA was identified in the TSB-catalyzed reaction because this product can also be formed through Brønsted acid sites [71]. The studied biochar presented FA as the primary product in the applied reaction conditions. Despite the higher acidity of RSB, its FA selectivity was lower than TSB, and the reaction catalyzed by the former catalysts had an expressive selectivity to DFE due to its higher Brønsted acidity. These observations are correlated with the B/L ratio values (Table 3), where TSB having a lower value of that ration had affected the further reaction of FA to the PMF and DFE ethers [72]. Regarding FBA and IPF, only RSB provided a significant formation of the Cannizzaro's product (IPF), while TSB showed a higher selectivity to FBA. From the discussed characterization data of these biochars, it is possible to infer that IPF formation is related to the presence of calcium hydroxide on the RSB surface [67,68]. Therefore, since the products' mechanisms were proposed and their formation properly elucidated, it is necessary to understand how the reaction parameters (temperature, mass, and isopropanol volume) affect FUR conversion and selectivity to these compounds (Fig. 5 ). It is essential to mention that all the reaction parameters were kept constant, alternating only one at a time, to understand their influence on the process. Other parameters, such as FUR volume (28 μL) and reaction time (24 h), were constant during all the catalytic runs [10–12]. The highest FUR conversion using TSB biochar (Fig. 5b, d, and f) as catalyst was observed in a more concentrated reaction medium, i.e., lower volume of isopropanol, and at 130 °C, and 75 mg of catalyst loading. A higher catalyst loading furnishes more active sites for FUR conversion. In addition, increasing the reaction temperature led to a FUR conversion increase due to the barrier energy in the catalytic hydrogen transfer to form a transition state in which FUR and IPA are bonded to a Lewis acid site [66]. However, the increase in the temperature also led to a lower FA selectivity because this molecule is highly susceptible to reacting with IPA and forming the etherification product PMF [73]. A higher selectivity to FBA was observed at 130 °C, being assigned to the enolate formation in the aldol reaction that is favored at higher temperatures [74]. This product was also preferred when the catalyst loading increased to 75 mg and assigned to a higher amount of Brønsted acid sites to promote the intermediate formation of enolate. The opposite behavior was observed for the RSB biochar (Fig. 5a, c, and d) compared to TSB material. A drastic decrease in FUR conversion was observed at a higher temperature, lower isopropanol volume, and higher catalyst loading. This can be associated with the Cannizzaro's reaction mechanism, in which IPF was the primary product detected for the reaction catalyzed by the RSB biochar. The temperature increase led to a higher IPF selectivity, while a lower FUR conversion was observed. It seems inconsistent that FUR conversion decreased at a higher temperature since this condition is often reported for upgrading this compound (considering an MPV reaction) [10–12]. However, the FA formed in the reaction medium can be oxidatively dehydrogenated back to FUR catalyzed by the iron oxide in this catalyst surface [64]. This FA reconversion to FUR affects its global conversion and thus presents a lower value. In addition, also there was a decrease in FA selectivity due to the Cannizzaro's reaction - competing with the MPV reaction [68]. It is possible to notice that the DFE and PMF selectivities were also influenced by the IPF formation, which is assigned to the low availability of FA in the medium as it is oxidized back to FUR [75]. Since RSB biochar is more acidic than TSB, an increase in the catalyst loading from 25 to 75 mg led to a higher number of active sites to promote the conversion of FA to FUR, thus representing a marked decrease in the global transformation of the latter compound. A more concentrated reaction medium led to a higher selectivity for the MPV products FA and PMF. On the other hand, a diluted reaction medium led to a marked decrease in the FUR conversion and favored the formation of IPF [10–12]. Here it is worth mentioning that despite low FUR conversion values mainly observed for both biochars compared to conventional catalysts described in the literature for this compound upgrading, in this study, we are suggesting a new application of metal-contaminated solids created in sewage treatment processes. The specialized literature for FUR conversion in high selectivity to FA often employs zeolites [30], supported metal oxides [26] and other materials that lead to the quantitative conversion of this reactant [76,18]. However, these materials might process sustainability drawbacks since several synthesis steps are used, and some of them can use molecular hydrogen for this conversion. In that way, using a biochar residue is a step forward for a more sustainable obtention of FA and other value-added compounds. After evaluating the influence of reaction parameters on the FUR conversion and product selectivities, the recyclabilities of the biochars RSB and TSB were assessed, as shown in Fig. 6 . Both biochars presented a marked decrease in FUR conversion for the reuse reactions, in which the RSB biochar presented the highest deactivation degree. It is essential to mention that none of the catalysts were washed or thermally treated after the catalytic runs. In contrast, the literature often reports these treatments, but we decided not to apply them for simplicity of reuse [29,73]. The deactivation of these catalysts might be inferred to occur through two main mechanisms: active phase leaching and polymerization product deposition over the catalyst surface [77]. The latter is well reported in the literature for FUR conversion through acid-catalyzed reactions and aldol condensation [74]. In this sense, we performed characterization studies in the recovered biochars and the reaction medium after the reuse reactions to investigate possible leaching of the active phase. Fig. S12 presents the XRD patterns of the fresh and recovered biochars after the reuse reactions. It is possible to observe the intensity decrease of some peaks assigned to SiO2, α-Fe2O3, CaSO4, and gaultite, thus suggesting the potential leaching of these compounds to the reaction medium. The reaction media were recovered, the organic solvent evaporated, resuspended in water, and followed by MIP OES analyses (Table S5). It can be observed that the active phase from both biochars suffered leaching to the reaction media, in which Al, Ca, Fe, K and Zn were detected in higher amounts. However, no differences were observed in XRD patterns assigned to Al and K crystalline phases. The humin formation over both biochars was analyzed using FTIR, TGA, and N2-physisorption (Figs. S13–S15). In the FTIR spectra (Fig. S13), most of the bands observed for the fresh catalyst were also observed after the reuse reactions, suggesting no degradation of the biochars’ organic structure. However, the rising of new bands in the region between 3000 and 3500 cm−1 and 1700–1800 cm−1 might be associated with the formation of humins. These two regions are typically used in the literature to monitor the humin formation over solid acid catalysts [78]. However, TGA analyses (Fig. S14) show that even after the reuse cycles, the formation of carbonaceous compounds was not significant. There was a slight difference in weight loss of 5% between fresh TSB and after reuse; for the RSB this difference was 3%. These differences are directly related to an increase in the organic fraction of biochar at the expense of the deposition of humins on the surface, thus corroborating with the FTIR results [23]. Regarding the N2 physisorption data (Fig. S15), the isotherms kept the same profile as the fresh biochars. Consequently, they are classified as type II, revealing no significant changes in their porous structure occurred after the reuse reactions [48]. Regarding the specific surface areas, the RSB biochar after the reuse showed virtually the same value compared to the fresh sample (9.5 m2.g−1), while the TSB after reuse there was a slight increase 13.0 m2/g, in which this increase can be related to the deposition of humin on the catalyst surface [79]. Considering the FUR conversion decrease and the characterizations done and discussed above of the reused biochars, it is proposed that both humin deposition and active phase leaching coincide. Despite the partial biochars deactivation in the FUR upgrading reactions, it is essential to highlight that a more sustainable use for sewage sludge was proposed, thus opening a broad range of opportunities for value-added compounds obtention. 4 Conclusions In this study, two biochars from sewage sludge were obtained through the pyrolysis process, extensively characterized, and tested in furfural upgrading. The characterization showed that these materials have a mixed organic matrix composition and inorganic compounds, contributing to Lewis and Brønsted acid sites and basicity. The catalytic runs showed that these materials could promote the production of different value-added products, and four mechanisms were proposed to explain their formation. In particular, furfuryl alcohol was detected as the primary product, and ethers, ketones, and ester derived from furfural were observed by GC-MS. Biochar derived from raw sewage sludge showed higher acidity than treated sewage sludge. Consequently, the former material showed a higher furfural conversion due to its higher ash content of inorganic compounds, which furnish a significant part of its acidity. However, the TSB material presented a higher selectivity to furfuryl alcohol due to its lower B/L ratio, which limited the furfuryl alcohol etherification process. Furthermore, the presence of basic sites led to the formation of other value-added compounds, such as isopropyl furan-2-carboxylate and (E)-4-(furan-2-yl)but-3-en-2-one. The evaluation of reaction parameters showed that treated sewage sludge biochar favored the formation of furfuryl alcohol while the biochar derived from raw sewage sludge led to the formation of isopropyl furan-2-carboxylate. These particularities are closely related to the mechanism of these reactions and the structure of the biochar catalysts. In addition, the reuse of both biochars displayed a marked decrease in furfural conversion, which was assigned to the partial leaching of the active phase as observed by MIP OES measurements and the formation of humin as evidenced by FTIR and TGA analyses. This study demonstrated the favorable characteristics of sewage sludge-derived biochars to be used as catalysts for both acid (Lewis and Brønsted) and base-promoted reactions for upgrading lignocellulosic biomass-derived compounds such as the platform furfural molecule. Although some deactivation was observed, it is noteworthy that even after five reuse reactions, the building-block furfuryl alcohol was the primary product obtained. Moreover, the search for new sewage sludge applications represents an advance in solving an environmental issue while also moving forward in achieving more sustainable and cheaper catalysts for producing bio-derived compounds. Supplementary materials Supplementary material associated to this article can be found with additional experimental details and results. CRediT authorship contribution statement Vinicius G.C. Madriaga: Data curation, Formal analysis, Investigation, Methodology, Conceptualization, Writing – original draft. João Pedro R. Mattos: Data curation, Formal analysis, Investigation, Methodology, Conceptualization, Writing – original draft. Vinicius Rossa: Data curation, Formal analysis, Investigation, Methodology, Conceptualization, Writing – original draft. Luanne E.M. Ferreira: Data curation, Formal analysis, Investigation, Methodology, Conceptualization, Writing – original draft. Sancler C. Vasconcelos: Data curation, Formal analysis, Investigation, Methodology, Conceptualization, Writing – original draft. Domingos S.A. Silva: Formal analysis, Investigation, Methodology. Pamela S.M. Rocha: Formal analysis, Investigation, Methodology. Rodrigo D. dos Santos: Formal analysis, Investigation, Methodology. Ludmila P.C. Silva: Formal analysis, Investigation, Methodology. Joyce R. Araujo: Formal analysis, Investigation, Methodology. Ernesto A. Urquieta-González: Funding acquisition, Writing – review & editing. Gilberto A. Romeiro: Funding acquisition, Writing – review & editing. Ricardo J. Cassella: Funding acquisition, Writing – review & editing. Thiago M. Lima: Funding acquisition, Project administration, Supervision, Writing – review & editing. Fabio B. Passos: Funding acquisition, Project administration, Supervision, Writing – review & editing. Declaration of Competing Interest The authors declare that they have no competing interest in this paper. Acknowledgment All authors gratefully acknowledge CNPq, FAPERJ (E-26/210.385/2018, E-26/211.575/2019, E-26/010.000.984/2019, E-26/201.358/2021, E-26/210.315/2022) and FAPESP (2014/50249-8). This study was financed in part by the Coordenação de Aperfeiçoamento de Pessoal de Nível Superior - Brasil (CAPES) - Finance Code 001. The authors are also grateful to Laboratório de Microscopia Eletrônica de Alta Resolução (LaMAR/CAIPE-UFF). Supplementary materials Supplementary material associated with this article can be found, in the online version, at doi:10.1016/j.mcat.2022.112692. Appendix Supplementary materials Image, application 1 References [1] G.W. Huber S. Iborra A. Corma Synthesis of transportation fuels from biomass: chemistry, catalysts, and engineering Chem. Rev. 106 2006 4044 4098 10.1021/cr068360d G.W. Huber, S. Iborra, A. Corma, Synthesis of transportation fuels from biomass: chemistry, catalysts, and engineering, Chem. Rev.106 (2006) 4044–4098. 10.1021/cr068360d. [2] A. Corma S. Iborra A. Velty Chemical routes for the transformation of biomass into chemicals Chem. Rev. 107 2007 2411 2502 10.1021/cr050989d A. Corma, S. Iborra, A. Velty, Chemical routes for the transformation of biomass into chemicals, Chem. Rev.107 (2007) 2411–2502. 10.1021/cr050989d. [3] M. Besson P. Gallezot C. Pinel Conversion of biomass into chemicals over metal catalysts Chem. Rev. 114 2014 1827 1870 10.1021/cr4002269 M. Besson, P. Gallezot, C. Pinel, Conversion of biomass into chemicals over metal catalysts, Chem. Rev.114 (2014) 1827–1870. 10.1021/cr4002269. [4] Y. Wang D. Zhao R. Liang K.S. Triantafyllidis W. Yang C. Len Transfer hydrogenation of furfural to furfuryl alcohol over modified Zr-based catalysts using primary alcohols as H-donors Mol. Catal. 499 2021 111199 10.1016/j.mcat.2020.111199 Y. Wang, D. Zhao, R. Liang, K.S. Triantafyllidis, W. Yang, C. Len, Transfer hydrogenation of furfural to furfuryl alcohol over modified Zr-based catalysts using primary alcohols as H-donors, Mol. Catal.. 499 (2021) 111199. 10.1016/j.mcat.2020.111199. [5] F. Delbecq Y. Wang A. Muralidhara K. el Ouardi G. Marlair C. Len Hydrolysis of hemicellulose and derivatives—a review of recent advances in the production of furfural Front. Chem. 6 2018 10.3389/fchem.2018.00146 F. Delbecq, Y. Wang, A. Muralidhara, K. el Ouardi, G. Marlair, C. Len, Hydrolysis of hemicellulose and derivatives—a review of recent advances in the production of furfural, Front. Chem.6 (2018). 10.3389/fchem.2018.00146. [6] J.P. Lange E. van der Heide J. van Buijtenen R. Price Furfural-A promising platform for lignocellulosic biofuels ChemSusChem 5 2012 150 166 10.1002/cssc.201100648 J.P. Lange, E. van der Heide, J. van Buijtenen, R. Price, Furfural-A promising platform for lignocellulosic biofuels, ChemSusChem. 5 (2012) 150–166. 10.1002/cssc.201100648. [7] X. Zhang S. Xu Q. Li G. Zhou H. Xia Recent advances in the conversion of furfural into bio-chemicals through chemo- and bio-catalysis RSC Adv. 11 2021 27042 27058 10.1039/D1RA04633K X. Zhang, S. Xu, Q. Li, G. Zhou, H. Xia, Recent advances in the conversion of furfural into bio-chemicals through chemo- and bio-catalysis, RSC Adv.11 (2021) 27042–27058. 10.1039/D1RA04633K. [8] P.A. Nikul'shin M.A. Ershov E.V. Grigor'yeva S.V. Tarazanov S.N. Kuznetsova O.V. Repina Furfural Derivatives as Fuel Components Chem. Technol. Fuels Oils 55 2020 720 725 10.1007/s10553-020-01087-w P.A. Nikul'shin, M.A. Ershov, E.V. Grigor'yeva, S.V. Tarazanov, S.N. Kuznetsova, O.V. Repina, Furfural Derivatives as Fuel Components, Chem. Technol. Fuels Oils. 55 (2020) 720–725. 10.1007/s10553-020-01087-w. [9] J. Hagen Industrial Catalysis 2005 Wiley 10.1002/3527607684 J. Hagen, Industrial Catalysis, Wiley, 2005. 10.1002/3527607684. [10] E.Y.C. Jorge T. de M. Lima C.G.S. Lima L. Marchini W.N. Castelblanco D.G. Rivera E.A. Urquieta-González R.S. Varma M.W. Paixão Metal-exchanged magnetic β-zeolites: valorization of lignocellulosic biomass-derived compounds to platform chemicals Green Chem. 19 2017 3856 3868 10.1039/C7GC01178D E.Y.C. Jorge, T. de M. Lima, C.G.S. Lima, L. Marchini, W.N. Castelblanco, D.G. Rivera, E.A. Urquieta-González, R.S. Varma, M.W. Paixão, Metal-exchanged magnetic β-zeolites: valorization of lignocellulosic biomass-derived compounds to platform chemicals, Green Chem.19 (2017) 3856–3868. 10.1039/C7GC01178D. [11] T.M. Lima C.G.S. Lima A.K. Rathi M.B. Gawande J. Tucek E.A. Urquieta-González R. Zbořil M.W. Paixão R.S. Varma Magnetic ZSM-5 zeolite: a selective catalyst for the valorization of furfuryl alcohol to γ-valerolactone, alkyl levulinates or levulinic acid Green Chem. 18 2016 5586 5593 10.1039/C6GC01296E T.M. Lima, C.G.S. Lima, A.K. Rathi, M.B. Gawande, J. Tucek, E.A. Urquieta-González, R. Zbořil, M.W. Paixão, R.S. Varma, Magnetic ZSM-5 zeolite: a selective catalyst for the valorization of furfuryl alcohol to γ-valerolactone, alkyl levulinates or levulinic acid, Green Chem.18 (2016) 5586–5593. 10.1039/C6GC01296E. [12] E.Y.C. Jorge C.G.S. Lima T.M. Lima L. Marchini M.B. Gawande O. Tomanec R.S. Varma M.W. Paixão Sulfonated dendritic mesoporous silica nanospheres: a metal-free lewis acid catalyst for the upgrading of carbohydrates Green Chem. 22 2020 1754 1762 10.1039/C9GC03489G E.Y.C. Jorge, C.G.S. Lima, T.M. Lima, L. Marchini, M.B. Gawande, O. Tomanec, R.S. Varma, M.W. Paixão, Sulfonated dendritic mesoporous silica nanospheres: a metal-free lewis acid catalyst for the upgrading of carbohydrates, Green Chem.22 (2020) 1754–1762. 10.1039/C9GC03489G. [13] V.P. Chodimella Mesoporous silica-related catalysts for biomass valorization Advanced Functional Solid Catalysts for Biomass Valorization 2020 Elsevier 161 185 10.1016/B978-0-12-820236-4.00007-6 V.P. Chodimella, Mesoporous silica-related catalysts for biomass valorization, in: Advanced Functional Solid Catalysts for Biomass Valorization, Elsevier, 2020: pp. 161–185. 10.1016/B978-0-12-820236-4.00007-6. [14] M. Nasrollahzadeh N.S.S. Bidgoli N. Shafiei F. Momenbeik Biomass valorization: sulfated lignin-catalyzed production of 5-hydroxymethylfurfural from fructose Int. J. Biol. Macromol. 182 2021 59 64 10.1016/j.ijbiomac.2021.03.191 M. Nasrollahzadeh, N.S.S. Bidgoli, N. Shafiei, F. Momenbeik, Biomass valorization: sulfated lignin-catalyzed production of 5-hydroxymethylfurfural from fructose, Int. J. Biol. Macromol.182 (2021) 59–64. 10.1016/j.ijbiomac.2021.03.191. [15] L.M. Esteves M.H. Brijaldo E.G. Oliveira J.J. Martinez H. Rojas A. Caytuero F.B. Passos Effect of support on selective 5-hydroxymethylfurfural hydrogenation towards 2,5-dimethylfuran over copper catalysts Fuel 270 2020 117524 10.1016/j.fuel.2020.117524 L.M. Esteves, M.H. Brijaldo, E.G. Oliveira, J.J. Martinez, H. Rojas, A. Caytuero, F.B. Passos, Effect of support on selective 5-hydroxymethylfurfural hydrogenation towards 2,5-dimethylfuran over copper catalysts, Fuel270 (2020) 117524. 10.1016/j.fuel.2020.117524. [16] N. Chen Z. Zhu T. Su W. Liao C. Deng W. Ren Y. Zhao H. Lü Catalytic hydrogenolysis of hydroxymethylfurfural to highly selective 2,5-dimethylfuran over FeCoNi/h-BN catalyst Chem. Eng. J. 381 2020 122755 10.1016/j.cej.2019.122755 N. Chen, Z. Zhu, T. Su, W. Liao, C. Deng, W. Ren, Y. Zhao, H. Lü, Catalytic hydrogenolysis of hydroxymethylfurfural to highly selective 2,5-dimethylfuran over FeCoNi/h-BN catalyst, Chem. Eng. J.381 (2020) 122755. 10.1016/j.cej.2019.122755. [17] D. Gupta R. Kumar K.K. Pant Hydrotalcite supported bimetallic (Ni-Cu) catalyst: a smart choice for one-pot conversion of biomass-derived platform chemicals to hydrogenated biofuels Fuel 277 2020 118111 10.1016/j.fuel.2020.118111 D. Gupta, R. Kumar, K.K. Pant, Hydrotalcite supported bimetallic (Ni-Cu) catalyst: a smart choice for one-pot conversion of biomass-derived platform chemicals to hydrogenated biofuels, Fuel277 (2020) 118111. 10.1016/j.fuel.2020.118111. [18] C. Mondelli G. Gözaydın N. Yan J. Pérez-Ramírez Biomass valorisation over metal-based solid catalysts from nanoparticles to single atoms Chem. Soc. Rev. 49 2020 3764 3782 10.1039/D0CS00130A C. Mondelli, G. Gözaydın, N. Yan, J. Pérez-Ramírez, Biomass valorisation over metal-based solid catalysts from nanoparticles to single atoms, Chem. Soc. Rev.49 (2020) 3764–3782. 10.1039/D0CS00130A. [19] Y. Lu Z. Zhang H. Wang Y. Wang Toward efficient single-atom catalysts for renewable fuels and chemicals production from biomass and CO2 Appl. Catal. B 292 2021 120162 10.1016/j.apcatb.2021.120162 Y. Lu, Z. Zhang, H. Wang, Y. Wang, Toward efficient single-atom catalysts for renewable fuels and chemicals production from biomass and CO2, Appl. Catal. B292 (2021) 120162. 10.1016/j.apcatb.2021.120162. [20] G. Tekin G. Ersöz S. Atalay Valorization of biomass as co-catalyst for simultaneous remediation and hydrogen production from sugar industry wastewater by catalytic wet air oxidation J. Clean. Prod. 330 2022 129728 10.1016/j.jclepro.2021.129728 G. Tekin, G. Ersöz, S. Atalay, Valorization of biomass as co-catalyst for simultaneous remediation and hydrogen production from sugar industry wastewater by catalytic wet air oxidation, J. Clean. Prod.330 (2022) 129728. 10.1016/j.jclepro.2021.129728. [21] M. Gholizadeh X. Hu Q. Liu Progress of using biochar as a catalyst in thermal conversion of biomass Rev. Chem. Eng. 37 2021 229 258 10.1515/revce-2018-0070 M. Gholizadeh, X. Hu, Q. Liu, Progress of using biochar as a catalyst in thermal conversion of biomass, Rev. Chem. Eng.37 (2021) 229–258. 10.1515/revce-2018-0070. [22] P. Shrestha D.D. Chun K. Kang A.E. Simson N.B. Klinghoffer Role of metals in biochar production and utilization in catalytic applications: a review Waste Biomass Valoriz. 13 2022 797 822 10.1007/s12649-021-01519-6 P. Shrestha, D.D. Chun, K. Kang, A.E. Simson, N.B. Klinghoffer, Role of metals in biochar production and utilization in catalytic applications: a review, Waste Biomass Valoriz.13 (2022) 797–822. 10.1007/s12649-021-01519-6. [23] P. Conte R. Bertani P. Sgarbossa P. Bambina H.P. Schmidt R. Raga G. lo Papa D.F. Chillura Martino P. lo Meo Recent developments in understanding biochar's physical–chemistry Agronomy 11 2021 615 10.3390/agronomy11040615 P. Conte, R. Bertani, P. Sgarbossa, P. Bambina, H.P. Schmidt, R. Raga, G. lo Papa, D.F. Chillura Martino, P. lo Meo, Recent developments in understanding biochar's physical–chemistry, Agronomy11 (2021) 615. 10.3390/agronomy11040615. [24] J. Lee K.H. Kim E.E. Kwon Biochar as a catalyst Renew. Sustain. Energy Rev. 77 2017 70 79 10.1016/j.rser.2017.04.002 J. Lee, K.H. Kim, E.E. Kwon, Biochar as a catalyst, Renew. Sustain. Energy Rev.77 (2017) 70–79. 10.1016/j.rser.2017.04.002. [25] A. Fuente-Hernández R. Lee N. Béland I. Zamboni J.M. Lavoie Reduction of furfural to furfuryl alcohol in liquid phase over a biochar-supported platinum catalyst Energies 10 2017 286 10.3390/en10030286 (Basel) A. Fuente-Hernández, R. Lee, N. Béland, I. Zamboni, J.M. Lavoie, Reduction of furfural to furfuryl alcohol in liquid phase over a biochar-supported platinum catalyst, Energies(Basel). 10 (2017) 286. 10.3390/en10030286. [26] D. Fytili A. Zabaniotou Utilization of sewage sludge in EU application of old and new methods—a review Renew. Sustain. Energy Rev. 12 2008 116 140 10.1016/j.rser.2006.05.014 D. Fytili, A. Zabaniotou, Utilization of sewage sludge in EU application of old and new methods—a review, Renew. Sustain. Energy Rev.12 (2008) 116–140. 10.1016/j.rser.2006.05.014. [27] A. Christodoulou K. Stamatelatou Overview of legislation on sewage sludge management in developed countries worldwide Water Sci. Technol. 73 2016 453 462 10.2166/wst.2015.521 A. Christodoulou, K. Stamatelatou, Overview of legislation on sewage sludge management in developed countries worldwide, Water Sci. Technol.73 (2016) 453–462. 10.2166/wst.2015.521. [28] J. Peccia P. Westerhoff We should expect more out of our sewage sludge Environ. Sci. Technol. 49 2015 8271 8276 10.1021/acs.est.5b01931 J. Peccia, P. Westerhoff, We should expect more out of our sewage sludge, Environ. Sci. Technol.49 (2015) 8271–8276. 10.1021/acs.est.5b01931. [29] L. Bui H. Luo W.R. Gunther Y. Román-Leshkov Domino reaction catalyzed by zeolites with brønsted and lewis acid sites for the production of γ-valerolactone from furfural Angew. Chem. Int. Ed. 52 2013 8022 8025 10.1002/anie.201302575 L. Bui, H. Luo, W.R. Gunther, Y. Román-Leshkov, Domino reaction catalyzed by zeolites with brønsted and lewis acid sites for the production of γ-valerolactone from furfural, Angew. Chem. Int. Ed.52 (2013) 8022–8025. 10.1002/anie.201302575. [30] E. Agrafioti G. Bouras D. Kalderis E. Diamadopoulos Biochar production by sewage sludge pyrolysis J. Anal. Appl. Pyrolysis 101 2013 72 78 10.1016/j.jaap.2013.02.010 E. Agrafioti, G. Bouras, D. Kalderis, E. Diamadopoulos, Biochar production by sewage sludge pyrolysis, J. Anal. Appl. Pyrolysis101 (2013) 72–78. 10.1016/j.jaap.2013.02.010. [31] M. Li Q. Liu Z. Lou Y. Wang Y. Zhang G. Qian Method to characterize acid–base behavior of biochar: site modeling and theoretical simulation ACS Sustain. Chem. Eng. 2 2014 2501 2509 10.1021/sc500432d M. Li, Q. Liu, Z. Lou, Y. Wang, Y. Zhang, G. Qian, Method to characterize acid–base behavior of biochar: site modeling and theoretical simulation, ACS Sustain. Chem. Eng.2 (2014) 2501–2509. 10.1021/sc500432d. [32] R.V.S. Silva G.A. Romeiro M.C.C. Veloso M.K.K. Figueiredo P.A. Pinto A.F. Ferreira M.L.A. Gonçalves A.M. Teixeira R.N. Damasceno Fractions composition study of the pyrolysis oil obtained from sewage sludge treatment plant Bioresour. Technol. 103 2012 459 465 10.1016/j.biortech.2011.10.007 R.V.S. Silva, G.A. Romeiro, M.C.C. Veloso, M.K.K. Figueiredo, P.A. Pinto, A.F. Ferreira, M.L.A. Gonçalves, A.M. Teixeira, R.N. Damasceno, Fractions composition study of the pyrolysis oil obtained from sewage sludge treatment plant, Bioresour. Technol.103 (2012) 459–465. 10.1016/j.biortech.2011.10.007. [33] R.B. Fidel D.A. Laird M.L. Thompson Evaluation of modified boehm titration methods for use with biochars J. Environ. Qual. 42 2013 1771 1778 10.2134/jeq2013.07.0285 R.B. Fidel, D.A. Laird, M.L. Thompson, Evaluation of modified boehm titration methods for use with biochars, J. Environ. Qual.42 (2013) 1771–1778. 10.2134/jeq2013.07.0285. [34] M. Schmal Heterogeneous Catalysis and Its Industrial Applications 2016 Springer International Publishing Cham 10.1007/978-3-319-09250-8 M. Schmal, Heterogeneous Catalysis and Its Industrial Applications, Springer International Publishing, Cham, 2016. 10.1007/978-3-319-09250-8. [35] F.A.C. Garcia V.S. Braga J.C.M. Silva J.A. Dias S.C.L. Dias J.L.B. Davo Acidic characterization of copper oxide and niobium pentoxide supported on silica–alumina Catal. Lett. 119 2007 101 107 10.1007/s10562-007-9204-8 F.A.C. Garcia, V.S. Braga, J.C.M. Silva, J.A. Dias, S.C.L. Dias, J.L.B. Davo, Acidic characterization of copper oxide and niobium pentoxide supported on silica–alumina, Catal. Lett.119 (2007) 101–107. 10.1007/s10562-007-9204-8. [36] M. Tamura K. Shimizu A. Satsuma Comprehensive IR study on acid/base properties of metal oxides Appl. Catal. A Gen. 433–434 2012 135 145 10.1016/j.apcata.2012.05.008 M. Tamura, K. Shimizu, A. Satsuma, Comprehensive IR study on acid/base properties of metal oxides, Appl. Catal. A Gen.433–434 (2012) 135–145. 10.1016/j.apcata.2012.05.008. [37] J. Lehmann S. Joseph Biochar For Environmental Management 2012 Routledge 10.4324/9781849770552 J. Lehmann, S. Joseph, eds., Biochar For Environmental Management, Routledge, 2012. 10.4324/9781849770552. [38] EBC (2012-2022) 'European Biochar Certificate - Guidelines for a Sustainable Production of Biochar.' European Biochar Foundation (EBC), Arbaz, Switzerland. Available from: http://european-biochar.org. Version 10.1. [39] Y. Tian L. Cui Q. Lin G. Li X. Zhao The sewage sludge biochar at low pyrolysis temperature had better improvement in urban soil and turf grass Agronomy 9 2019 156 10.3390/agronomy9030156 Y. Tian, L. Cui, Q. Lin, G. Li, X. Zhao, The sewage sludge biochar at low pyrolysis temperature had better improvement in urban soil and turf grass, Agronomy. 9 (2019) 156. 10.3390/agronomy9030156. [40] J.S. Cha J.C. Choi J.H. Ko Y.K. Park S.H. Park K.E. Jeong S.S. Kim J.K. Jeon The low-temperature SCR of NO over rice straw and sewage sludge derived char Chem. Eng. J. 156 2010 321 327 10.1016/j.cej.2009.10.027 J.S. Cha, J.C. Choi, J.H. Ko, Y.K. Park, S.H. Park, K.E. Jeong, S.S. Kim, J.K. Jeon, The low-temperature SCR of NO over rice straw and sewage sludge derived char, Chem. Eng. J.156 (2010) 321–327. 10.1016/j.cej.2009.10.027. [41] B. Kanngießer B. Beckhoff N. Langhoff R. Wedell H. Wolff Handbook of Practical X-Ray Fluorescence Analysis 2006 Springer B. Kanngießer, B. Beckhoff, N. Langhoff, R. Wedell, H. Wolff, Handbook of Practical X-Ray Fluorescence Analysis, 2006. [42] J. Fan Y. Li H. Yu Y. Li Q. Yuan H. Xiao F. Li B. Pan Using sewage sludge with high ash content for biochar production and Cu(II) sorption Sci. Total Environ. 713 2020 136663 10.1016/j.scitotenv.2020.136663 J. Fan, Y. Li, H. Yu, Y. Li, Q. Yuan, H. Xiao, F. Li, B. Pan, Using sewage sludge with high ash content for biochar production and Cu(II) sorption, Sci. Total Environ.713 (2020) 136663. 10.1016/j.scitotenv.2020.136663. [43] V.D. Rajput A.N. Yadav H.S. Jatav S.K. Singh T. Minkina Sustainable Management and Utilization of Sewage Sludge 2022 Springer International Publishing Cham 10.1007/978-3-030-85226-9 V.D. Rajput, A.N. Yadav, H.S. Jatav, S.K. Singh, T. Minkina, eds., Sustainable Management and Utilization of Sewage Sludge, Springer International Publishing, Cham, 2022. 10.1007/978-3-030-85226-9. [44] R.A. Rehman M.F. Qayyum G. Haider K. Schofield M. Abid M. Rizwan S. Ali The sewage sludge biochar and its composts influence the phosphate sorption in an alkaline–calcareous soil Sustainability 13 2021 1779 10.3390/su13041779 R.A. Rehman, M.F. Qayyum, G. Haider, K. Schofield, M. Abid, M. Rizwan, S. Ali, The sewage sludge biochar and its composts influence the phosphate sorption in an alkaline–calcareous soil, Sustainability13 (2021) 1779. 10.3390/su13041779. [45] A.M. Freitas V.D. Nair W.G. Harris Biochar as influenced by feedstock variability: implications and opportunities for phosphorus management Front. Sustain. Food Syst. 4 2020 10.3389/fsufs.2020.510982 A.M. Freitas, V.D. Nair, W.G. Harris, Biochar as influenced by feedstock variability: implications and opportunities for phosphorus management, Front. Sustain. Food Syst.4 (2020). 10.3389/fsufs.2020.510982. [46] I. Bodachivskyi U. Kuzhiumparambil D.B.G. Williams Acid-catalyzed conversion of carbohydrates into value-added small molecules in aqueous media and ionic liquids ChemSusChem 11 2018 642 660 10.1002/cssc.201702016 I. Bodachivskyi, U. Kuzhiumparambil, D.B.G. Williams, Acid-catalyzed conversion of carbohydrates into value-added small molecules in aqueous media and ionic liquids, ChemSusChem11 (2018) 642–660. 10.1002/cssc.201702016. [47] X. Li L. Zhang S. Wang Y. Wu Recent advances in aqueous-phase catalytic conversions of biomass platform chemicals over heterogeneous catalysts Front. Chem. 7 2020 10.3389/fchem.2019.00948 X. Li, L. Zhang, S. Wang, Y. Wu, Recent advances in aqueous-phase catalytic conversions of biomass platform chemicals over heterogeneous catalysts, Front. Chem.7 (2020). 10.3389/fchem.2019.00948. [48] A. Zielińska P. Oleszczuk B. Charmas J. Skubiszewska-Zięba S. Pasieczna-Patkowska Effect of sewage sludge properties on the biochar characteristic J. Anal. Appl. Pyrolysis 112 2015 201 213 10.1016/j.jaap.2015.01.025 A. Zielińska, P. Oleszczuk, B. Charmas, J. Skubiszewska-Zięba, S. Pasieczna-Patkowska, Effect of sewage sludge properties on the biochar characteristic, J. Anal. Appl. Pyrolysis112 (2015) 201–213. 10.1016/j.jaap.2015.01.025. [49] M. Thommes K. Kaneko A.V. Neimark J.P. Olivier F. Rodriguez-Reinoso J. Rouquerol K.S.W. Sing Physisorption of gases, with special reference to the evaluation of surface area and pore size distribution (IUPAC Technical Report) Pure Appl. Chem. 87 2015 10.1515/pac-2014-1117 M. Thommes, K. Kaneko, A.V. Neimark, J.P. Olivier, F. Rodriguez-Reinoso, J. Rouquerol, K.S.W. Sing, Physisorption of gases, with special reference to the evaluation of surface area and pore size distribution (IUPAC Technical Report), Pure Appl. Chem.87 (2015). 10.1515/pac-2014-1117. [50] H. Lu W. Zhang S. Wang L. Zhuang Y. Yang R. Qiu Characterization of sewage sludge-derived biochars from different feedstocks and pyrolysis temperatures J. Anal. Appl. Pyrolysis 102 2013 137 143 10.1016/j.jaap.2013.03.004 H. Lu, W. Zhang, S. Wang, L. Zhuang, Y. Yang, R. Qiu, Characterization of sewage sludge-derived biochars from different feedstocks and pyrolysis temperatures, J. Anal. Appl. Pyrolysis102 (2013) 137–143. 10.1016/j.jaap.2013.03.004. [51] W. Liu P. Guo J. Su J. Hu Y. Wang N. Liu H. Guo Acidity characterization and acid catalysis performance of titanium silicalite (TS-1) Chin. J. Catal. 30 2009 482 484 10.1016/S1872-2067(08)60113-8 W. Liu, P. Guo, J. Su, J. Hu, Y. Wang, N. Liu, H. Guo, Acidity characterization and acid catalysis performance of titanium silicalite (TS-1), Chin. J. Catal.30 (2009) 482–484. 10.1016/S1872-2067(08)60113-8. [52] J. Ábrego J. Arauzo J.L. Sánchez A. Gonzalo T. Cordero J. Rodríguez-Mirasol Structural changes of sewage sludge char during fixed-bed pyrolysis Ind. Eng. Chem. Res. 48 2009 3211 3221 10.1021/ie801366t J. Ábrego, J. Arauzo, J.L. Sánchez, A. Gonzalo, T. Cordero, J. Rodríguez-Mirasol, Structural changes of sewage sludge char during fixed-bed pyrolysis, Ind. Eng. Chem. Res.48 (2009) 3211–3221. 10.1021/ie801366t. [53] H.W. Kim S. Bae J.Y. Lee A study on the removal of heavy metals in soil by sewage sludge biochar J. Soil Groundw. Environ. 18 2013 58 64 10.7857/JSGE.2013.18.3.058 H.W. Kim, S. Bae, J.Y. Lee, A study on the removal of heavy metals in soil by sewage sludge biochar, J. Soil Groundw. Environ.18 (2013) 58–64. 10.7857/JSGE.2013.18.3.058. [54] S. Nenadovic Lj. Kljajevic S. Markovic M. Omerasevic U. Jovanovic V. Andric I. Vukanac Natural diatomite (Rudovci, Serbia) as adsorbent for removal Cs from radioactive waste liquids Sci. Sinter. 47 2015 299 309 10.2298/SOS1503299N S. Nenadovic, Lj. Kljajevic, S. Markovic, M. Omerasevic, U. Jovanovic, V. Andric, I. Vukanac, Natural diatomite (Rudovci, Serbia) as adsorbent for removal Cs from radioactive waste liquids, Sci. Sinter.47 (2015) 299–309. 10.2298/SOS1503299N. [55] I.N. Demchenko Y. Melikhov Y. Syryanyy I. Zaytseva P. Konstantynov M. Chernyshova Effect of argon sputtering on XPS depth-profiling results of Si/Nb/Si J. Electron Spectrosc. Relat. Phenom. 224 2018 17 22 10.1016/j.elspec.2017.09.009 I.N. Demchenko, Y. Melikhov, Y. Syryanyy, I. Zaytseva, P. Konstantynov, M. Chernyshova, Effect of argon sputtering on XPS depth-profiling results of Si/Nb/Si, J. Electron Spectrosc. Relat. Phenom.224 (2018) 17–22. 10.1016/j.elspec.2017.09.009. [56] C. Huo J. Ouyang H. Yang CuO nanoparticles encapsulated inside Al-MCM-41 mesoporous materials via direct synthetic route Sci. Rep. 4 2015 3682 10.1038/srep03682 C. Huo, J. Ouyang, H. Yang, CuO nanoparticles encapsulated inside Al-MCM-41 mesoporous materials via direct synthetic route, Sci. Rep.4 (2015) 3682. 10.1038/srep03682. [57] J. Yarwood R. Douthwaite S. Duckett Spectroscopic Properties of Inorganic and Organometallic Compounds 2010 Royal Society of Chemistry Cambridge 10.1039/9781849730853 J. Yarwood, R. Douthwaite, S. Duckett, eds., Spectroscopic Properties of Inorganic and Organometallic Compounds, Royal Society of Chemistry, Cambridge, 2010. 10.1039/9781849730853. [58] J. Racek J. Sevcik T. Chorazy J. Kucerik P. Hlavinek Biochar – recovery material from pyrolysis of sewage sludge: a review Waste Biomass Valoriz. 11 2020 3677 3709 10.1007/s12649-019-00679-w J. Racek, J. Sevcik, T. Chorazy, J. Kucerik, P. Hlavinek, Biochar – recovery material from pyrolysis of sewage sludge: a review, Waste Biomass Valoriz.11 (2020) 3677–3709. 10.1007/s12649-019-00679-w. [59] P. van der Heide X-Ray Photoelectron Spectroscopy 2011 John Wiley & Sons, Inc. Hoboken, NJ, USA 10.1002/9781118162897 P. van der Heide, X-Ray Photoelectron Spectroscopy, John Wiley & Sons, Inc., Hoboken, NJ, USA, 2011. 10.1002/9781118162897. [60] JohnF. Moulder Handbook of X-ray Photoelectron Spectroscopy: a Reference Book of Standard Spectra for Identification and Interpretation of XPS Data 1992 Perkin-Elmer Corporation Physical Electronics Division JohnF. Moulder, Handbook of X-ray Photoelectron Spectroscopy: a Reference Book of Standard Spectra for Identification and Interpretation of XPS Data, Physical Electronics Division, Perkin-Elmer Corporation, 1992. [61] S. Jafarinejad Cost estimation and economical evaluation of three configurations of activated sludge process for a wastewater treatment plant (WWTP) using simulation Appl. Water Sci. 7 2017 2513 2521 10.1007/s13201-016-0446-8 S. Jafarinejad, Cost estimation and economical evaluation of three configurations of activated sludge process for a wastewater treatment plant (WWTP) using simulation, Appl. Water Sci.7 (2017) 2513–2521. 10.1007/s13201-016-0446-8. [62] J. Zhang L. Ma Environmental sustainability assessment of a new sewage treatment plant in China based on infrastructure construction and operation phases emergy analysis Water 12 2020 484 10.3390/w12020484 (Basel) J. Zhang, L. Ma, Environmental sustainability assessment of a new sewage treatment plant in China based on infrastructure construction and operation phases emergy analysis, Water(Basel). 12 (2020) 484. 10.3390/w12020484. [63] X. Liu J. Liao H. Song Y. Yang C. Guan Z. Zhang A biochar-based route for environmentally friendly controlled release of nitrogen: urea-loaded biochar and bentonite composite Sci. Rep. 9 2019 9548 10.1038/s41598-019-46065-3 X. Liu, J. Liao, H. Song, Y. Yang, C. Guan, Z. Zhang, A biochar-based route for environmentally friendly controlled release of nitrogen: urea-loaded biochar and bentonite composite, Sci. Rep.9 (2019) 9548. 10.1038/s41598-019-46065-3. [64] H. Zhou S. Hong H. Zhang Y. Chen H. Xu X. Wang Z. Jiang S. Chen Y. Liu Toward biomass-based single-atom catalysts and plastics: highly active single-atom Co on N-doped carbon for oxidative esterification of primary alcohols Appl. Catal. B 256 2019 117767 10.1016/j.apcatb.2019.117767 H. Zhou, S. Hong, H. Zhang, Y. Chen, H. Xu, X. Wang, Z. Jiang, S. Chen, Y. Liu, Toward biomass-based single-atom catalysts and plastics: highly active single-atom Co on N-doped carbon for oxidative esterification of primary alcohols, Appl. Catal. B256 (2019) 117767. 10.1016/j.apcatb.2019.117767. [65] W. Fang A. Riisager Recent advances in heterogeneous catalytic transfer hydrogenation/hydrogenolysis for valorization of biomass-derived furanic compounds Green Chem. 23 2021 670 688 10.1039/D0GC03931D W. Fang, A. Riisager, Recent advances in heterogeneous catalytic transfer hydrogenation/hydrogenolysis for valorization of biomass-derived furanic compounds, Green Chem.23 (2021) 670–688. 10.1039/D0GC03931D. [66] R.S. Assary L.A. Curtiss J.A. Dumesic Exploring meerwein–ponndorf–verley reduction chemistry for biomass catalysis using a first-principles approach ACS Catal. 3 2013 2694 2704 10.1021/cs400479m R.S. Assary, L.A. Curtiss, J.A. Dumesic, Exploring meerwein–ponndorf–verley reduction chemistry for biomass catalysis using a first-principles approach, ACS Catal.3 (2013) 2694–2704. 10.1021/cs400479m. [67] D.S. Desai G.D. Yadav Green synthesis of furfural acetone by solvent-free aldol condensation of furfural with acetone over La2O3 –MgO mixed oxide catalyst Ind. Eng. Chem. Res. 58 2019 16096 16105 10.1021/acs.iecr.9b01138 D.S. Desai, G.D. Yadav, Green synthesis of furfural acetone by solvent-free aldol condensation of furfural with acetone over La2O3 –MgO mixed oxide catalyst, Ind. Eng. Chem. Res.58 (2019) 16096–16105. 10.1021/acs.iecr.9b01138. [68] M. Douthwaite X. Huang S. Iqbal P.J. Miedziak G.L. Brett S.A. Kondrat J.K. Edwards M. Sankar D.W. Knight D. Bethell G.J. Hutchings The controlled catalytic oxidation of furfural to furoic acid using AuPd/Mg(OH)2 Catal. Sci. Technol. 7 2017 5284 5293 10.1039/C7CY01025G M. Douthwaite, X. Huang, S. Iqbal, P.J. Miedziak, G.L. Brett, S.A. Kondrat, J.K. Edwards, M. Sankar, D.W. Knight, D. Bethell, G.J. Hutchings, The controlled catalytic oxidation of furfural to furoic acid using AuPd/Mg(OH)2, Catal. Sci. Technol.7 (2017) 5284–5293. 10.1039/C7CY01025G. [69] M.L. Granados D.M. Alonso Furfural: an Entry Point of Lignocellulose in Biorefineries to Produce Renewable Chemicals, Polymers, and Biofuels 2018 World Scientific Publishing Europe Ltd 10.1142/q0142 M.L. Granados, D.M. Alonso, Furfural: an Entry Point of Lignocellulose in Biorefineries to Produce Renewable Chemicals, Polymers, and Biofuels, World Scientific Publishing Europe Ltd, 2018. 10.1142/q0142. [70] J. Clayden N. Greeves S. Warren Organic Chemistry 2nd ed. 2012 Oxford University Press USA J. Clayden, N. Greeves, S. Warren, Organic Chemistry, 2nd ed., Oxford University Press, USA, 2012. [71] Q. Tian D. Shi Y. Sha CuO and Ag2O/CuO catalyzed oxidation of aldehydes to the corresponding carboxylic acids by molecular oxygen Molecules 13 2008 948 957 10.3390/molecules13040948 Q. Tian, D. Shi, Y. Sha, CuO and Ag2O/CuO catalyzed oxidation of aldehydes to the corresponding carboxylic acids by molecular oxygen, Molecules13 (2008) 948–957. 10.3390/molecules13040948. [72] Y. Wang D. Zhao D. Rodríguez-Padrón C. Len Recent advances in catalytic hydrogenation of furfural Catalysts 9 2019 796 10.3390/catal9100796 Y. Wang, D. Zhao, D. Rodríguez-Padrón, C. Len, Recent advances in catalytic hydrogenation of furfural, Catalysts9 (2019) 796. 10.3390/catal9100796. [73] J. Iglesias J. Melero G. Morales J. Moreno Y. Segura M. Paniagua A. Cambra B. Hernández Zr-SBA-15 lewis acid catalyst: activity in meerwein ponndorf verley reduction Catalysts 5 2015 1911 1927 10.3390/catal5041911 J. Iglesias, J. Melero, G. Morales, J. Moreno, Y. Segura, M. Paniagua, A. Cambra, B. Hernández, Zr-SBA-15 lewis acid catalyst: activity in meerwein ponndorf verley reduction, Catalysts5 (2015) 1911–1927. 10.3390/catal5041911. [74] O. Kikhtyanin V. Kelbichová D. Vitvarová M. Kubů D. Kubička Aldol condensation of furfural and acetone on zeolites Catal. Today 227 2014 154 162 10.1016/j.cattod.2013.10.059 O. Kikhtyanin, V. Kelbichová, D. Vitvarová, M. Kubů, D. Kubička, Aldol condensation of furfural and acetone on zeolites, Catal. Today227 (2014) 154–162. 10.1016/j.cattod.2013.10.059. [75] D.R. Chaffey T.E. Davies S.H. Taylor A.E. Graham Etherification reactions of furfuryl alcohol in the presence of orthoesters and ketals: application to the synthesis of furfuryl ether biofuels ACS Sustain. Chem. Eng. 6 2018 4996 5002 10.1021/acssuschemeng.7b04636 D.R. Chaffey, T.E. Davies, S.H. Taylor, A.E. Graham, Etherification reactions of furfuryl alcohol in the presence of orthoesters and ketals: application to the synthesis of furfuryl ether biofuels, ACS Sustain. Chem. Eng.6 (2018) 4996–5002. 10.1021/acssuschemeng.7b04636. [76] Y. Wang D. Zhao R. Liang K.S. Triantafyllidis W. Yang C. Len Transfer hydrogenation of furfural to furfuryl alcohol over modified Zr-based catalysts using primary alcohols as H-donors Mol. Catal. 499 2021 111199 10.1016/j.mcat.2020.111199 Y. Wang, D. Zhao, R. Liang, K.S. Triantafyllidis, W. Yang, C. Len, Transfer hydrogenation of furfural to furfuryl alcohol over modified Zr-based catalysts using primary alcohols as H-donors, Mol. Catal.499 (2021) 111199. 10.1016/j.mcat.2020.111199. [77] C.H. Bartholomew Mechanisms of catalyst deactivation Appl. Catal. A Gen. 212 2001 17 60 10.1016/S0926-860X(00)00843-7 C.H. Bartholomew, Mechanisms of catalyst deactivation, Appl. Catal. A Gen.212 (2001) 17–60. 10.1016/S0926-860X(00)00843-7. [78] C. Liu L. Wei X. Yin M. Wei J. Xu J. Jiang K. Wang Selective conversion of hemicellulose into furfural over low-cost metal salts in a γ-valerolactone/water solution Ind. Crops Prod. 147 2020 112248 10.1016/j.indcrop.2020.112248 C. Liu, L. Wei, X. Yin, M. Wei, J. Xu, J. Jiang, K. Wang, Selective conversion of hemicellulose into furfural over low-cost metal salts in a γ-valerolactone/water solution, Ind. Crops Prod.147 (2020) 112248. 10.1016/j.indcrop.2020.112248. [79] N.M. Ostrovskii New models of catalyst deactivation by coke: II. Coking of supported platinum catalysts Kinet. Catal. 42 2001 326 333 N.M. Ostrovskii, New models of catalyst deactivation by coke: II. Coking of supported platinum catalysts, Kinet. Catal.. 42 (2001) 326–333.",
      "scopus-id": "85138184708",
      "coredata": {
        "eid": "1-s2.0-S2468823122005788",
        "dc:description": "Furfural is an important biobased building block molecule to produce several value-added compounds for the fine chemical industry, biofuels, and biopolymers through a catalytic pathway. Developing cheaper and more sustainable catalysts to promote furfural conversion reactions is imperative to meet the Green Chemistry principles and obtain biobased products through greener routes. In this sense, sewage sludge-derived biochars emerge as promising materials that catalyze furfural conversion reactions since they possess acid and basic surface sites due to their high metal content and organic structure. This paper reports the employment of two sewage sludge-derived biochars as catalysts for furfural conversion, an encouraging application for these solids with severe environmental concerns. These materials were fully characterized regarding their composition, structure, textural, morphological, acidic, and surface properties, displaying the presence of acid (Lewis and Brønsted) and basic sites. These biochars presented good activity for converting furfural (26.5–68.8%) and high selectivity to furfuryl alcohol (43.6–90.6%). In addition, other value-added products were observed, such as furfural-derived ethers, ester, and ketone.",
        "openArchiveArticle": "false",
        "prism:coverDate": "2022-10-31",
        "openaccessUserLicense": null,
        "prism:aggregationType": "Journal",
        "prism:url": "https://api.elsevier.com/content/article/pii/S2468823122005788",
        "dc:creator": [
          {
            "@_fa": "true",
            "$": "Madriaga, Vinicius G.C."
          },
          {
            "@_fa": "true",
            "$": "Mattos, João Pedro R."
          },
          {
            "@_fa": "true",
            "$": "Rossa, Vinicius"
          },
          {
            "@_fa": "true",
            "$": "Ferreira, Luanne E.M."
          },
          {
            "@_fa": "true",
            "$": "Vasconcelos, Sancler C."
          },
          {
            "@_fa": "true",
            "$": "Silva, Domingos S.A."
          },
          {
            "@_fa": "true",
            "$": "Rocha, Pamela S.M."
          },
          {
            "@_fa": "true",
            "$": "dos Santos, Rodrigo D."
          },
          {
            "@_fa": "true",
            "$": "Silva, Ludmila P.C."
          },
          {
            "@_fa": "true",
            "$": "Araujo, Joyce R."
          },
          {
            "@_fa": "true",
            "$": "Urquieta-González, Ernesto A."
          },
          {
            "@_fa": "true",
            "$": "Romeiro, Gilberto A."
          },
          {
            "@_fa": "true",
            "$": "Cassella, Ricardo J."
          },
          {
            "@_fa": "true",
            "$": "Lima, Thiago M."
          },
          {
            "@_fa": "true",
            "$": "Passos, Fabio B."
          }
        ],
        "link": [
          {
            "@_fa": "true",
            "@rel": "self",
            "@href": "https://api.elsevier.com/content/article/pii/S2468823122005788"
          },
          {
            "@_fa": "true",
            "@rel": "scidir",
            "@href": "https://www.sciencedirect.com/science/article/pii/S2468823122005788"
          }
        ],
        "dc:format": "application/json",
        "openaccessType": null,
        "pii": "S2468-8231(22)00578-8",
        "prism:volume": "531",
        "articleNumber": "112692",
        "prism:publisher": "Elsevier B.V.",
        "dc:title": "Metal-contaminated biochars as cheap and more sustainable catalysts for furfural conversion to value-added compounds",
        "prism:copyright": "© 2022 Elsevier B.V. All rights reserved.",
        "openaccess": "0",
        "prism:issn": "24688231",
        "dcterms:subject": [
          {
            "@_fa": "true",
            "$": "Sewage sludge"
          },
          {
            "@_fa": "true",
            "$": "Biochar"
          },
          {
            "@_fa": "true",
            "$": "Furfural"
          },
          {
            "@_fa": "true",
            "$": "Biomass"
          },
          {
            "@_fa": "true",
            "$": "Furfuryl alcohol"
          }
        ],
        "openaccessArticle": "false",
        "prism:publicationName": "Molecular Catalysis",
        "openaccessSponsorType": null,
        "prism:pageRange": "112692",
        "pubType": "fla",
        "prism:coverDisplayDate": "October 2022",
        "prism:doi": "10.1016/j.mcat.2022.112692",
        "prism:startingPage": "112692",
        "dc:identifier": "doi:10.1016/j.mcat.2022.112692",
        "openaccessSponsorName": null
      },
      "objects": {
        "object": [
          {
            "@category": "standard",
            "@height": "826",
            "@width": "659",
            "@_fa": "true",
            "$": "https://api.elsevier.com/content/object/eid/1-s2.0-S2468823122005788-gr5.jpg?httpAccept=%2A%2F%2A",
            "@multimediatype": "JPEG image file",
            "@type": "IMAGE-DOWNSAMPLED",
            "@size": "145753",
            "@ref": "gr5",
            "@mimetype": "image/jpeg"
          },
          {
            "@category": "standard",
            "@height": "608",
            "@width": "395",
            "@_fa": "true",
            "$": "https://api.elsevier.com/content/object/eid/1-s2.0-S2468823122005788-gr4.jpg?httpAccept=%2A%2F%2A",
            "@multimediatype": "JPEG image file",
            "@type": "IMAGE-DOWNSAMPLED",
            "@size": "45464",
            "@ref": "gr4",
            "@mimetype": "image/jpeg"
          },
          {
            "@category": "standard",
            "@height": "269",
            "@width": "659",
            "@_fa": "true",
            "$": "https://api.elsevier.com/content/object/eid/1-s2.0-S2468823122005788-gr6.jpg?httpAccept=%2A%2F%2A",
            "@multimediatype": "JPEG image file",
            "@type": "IMAGE-DOWNSAMPLED",
            "@size": "60725",
            "@ref": "gr6",
            "@mimetype": "image/jpeg"
          },
          {
            "@category": "standard",
            "@height": "336",
            "@width": "809",
            "@_fa": "true",
            "$": "https://api.elsevier.com/content/object/eid/1-s2.0-S2468823122005788-gr1.jpg?httpAccept=%2A%2F%2A",
            "@multimediatype": "JPEG image file",
            "@type": "IMAGE-DOWNSAMPLED",
            "@size": "46605",
            "@ref": "gr1",
            "@mimetype": "image/jpeg"
          },
          {
            "@category": "standard",
            "@height": "439",
            "@width": "565",
            "@_fa": "true",
            "$": "https://api.elsevier.com/content/object/eid/1-s2.0-S2468823122005788-gr2.jpg?httpAccept=%2A%2F%2A",
            "@multimediatype": "JPEG image file",
            "@type": "IMAGE-DOWNSAMPLED",
            "@size": "71813",
            "@ref": "gr2",
            "@mimetype": "image/jpeg"
          },
          {
            "@category": "standard",
            "@height": "118",
            "@width": "301",
            "@_fa": "true",
            "$": "https://api.elsevier.com/content/object/eid/1-s2.0-S2468823122005788-ga1.jpg?httpAccept=%2A%2F%2A",
            "@multimediatype": "JPEG image file",
            "@type": "IMAGE-DOWNSAMPLED",
            "@size": "15369",
            "@ref": "ga1",
            "@mimetype": "image/jpeg"
          },
          {
            "@category": "standard",
            "@height": "470",
            "@width": "626",
            "@_fa": "true",
            "$": "https://api.elsevier.com/content/object/eid/1-s2.0-S2468823122005788-sc1.jpg?httpAccept=%2A%2F%2A",
            "@multimediatype": "JPEG image file",
            "@type": "IMAGE-DOWNSAMPLED",
            "@size": "67830",
            "@ref": "sc1",
            "@mimetype": "image/jpeg"
          },
          {
            "@category": "standard",
            "@height": "998",
            "@width": "806",
            "@_fa": "true",
            "$": "https://api.elsevier.com/content/object/eid/1-s2.0-S2468823122005788-gr3.jpg?httpAccept=%2A%2F%2A",
            "@multimediatype": "JPEG image file",
            "@type": "IMAGE-DOWNSAMPLED",
            "@size": "226669",
            "@ref": "gr3",
            "@mimetype": "image/jpeg"
          },
          {
            "@category": "thumbnail",
            "@height": "163",
            "@width": "130",
            "@_fa": "true",
            "$": "https://api.elsevier.com/content/object/eid/1-s2.0-S2468823122005788-gr5.sml?httpAccept=%2A%2F%2A",
            "@multimediatype": "GIF image file",
            "@type": "IMAGE-THUMBNAIL",
            "@size": "11533",
            "@ref": "gr5",
            "@mimetype": "image/gif"
          },
          {
            "@category": "thumbnail",
            "@height": "163",
            "@width": "106",
            "@_fa": "true",
            "$": "https://api.elsevier.com/content/object/eid/1-s2.0-S2468823122005788-gr4.sml?httpAccept=%2A%2F%2A",
            "@multimediatype": "GIF image file",
            "@type": "IMAGE-THUMBNAIL",
            "@size": "7040",
            "@ref": "gr4",
            "@mimetype": "image/gif"
          },
          {
            "@category": "thumbnail",
            "@height": "89",
            "@width": "219",
            "@_fa": "true",
            "$": "https://api.elsevier.com/content/object/eid/1-s2.0-S2468823122005788-gr6.sml?httpAccept=%2A%2F%2A",
            "@multimediatype": "GIF image file",
            "@type": "IMAGE-THUMBNAIL",
            "@size": "11660",
            "@ref": "gr6",
            "@mimetype": "image/gif"
          },
          {
            "@category": "thumbnail",
            "@height": "91",
            "@width": "219",
            "@_fa": "true",
            "$": "https://api.elsevier.com/content/object/eid/1-s2.0-S2468823122005788-gr1.sml?httpAccept=%2A%2F%2A",
            "@multimediatype": "GIF image file",
            "@type": "IMAGE-THUMBNAIL",
            "@size": "6969",
            "@ref": "gr1",
            "@mimetype": "image/gif"
          },
          {
            "@category": "thumbnail",
            "@height": "164",
            "@width": "211",
            "@_fa": "true",
            "$": "https://api.elsevier.com/content/object/eid/1-s2.0-S2468823122005788-gr2.sml?httpAccept=%2A%2F%2A",
            "@multimediatype": "GIF image file",
            "@type": "IMAGE-THUMBNAIL",
            "@size": "13822",
            "@ref": "gr2",
            "@mimetype": "image/gif"
          },
          {
            "@category": "thumbnail",
            "@height": "86",
            "@width": "219",
            "@_fa": "true",
            "$": "https://api.elsevier.com/content/object/eid/1-s2.0-S2468823122005788-ga1.sml?httpAccept=%2A%2F%2A",
            "@multimediatype": "GIF image file",
            "@type": "IMAGE-THUMBNAIL",
            "@size": "9337",
            "@ref": "ga1",
            "@mimetype": "image/gif"
          },
          {
            "@category": "thumbnail",
            "@height": "164",
            "@width": "218",
            "@_fa": "true",
            "$": "https://api.elsevier.com/content/object/eid/1-s2.0-S2468823122005788-sc1.sml?httpAccept=%2A%2F%2A",
            "@multimediatype": "GIF image file",
            "@type": "IMAGE-THUMBNAIL",
            "@size": "12229",
            "@ref": "sc1",
            "@mimetype": "image/gif"
          },
          {
            "@category": "thumbnail",
            "@height": "163",
            "@width": "132",
            "@_fa": "true",
            "$": "https://api.elsevier.com/content/object/eid/1-s2.0-S2468823122005788-gr3.sml?httpAccept=%2A%2F%2A",
            "@multimediatype": "GIF image file",
            "@type": "IMAGE-THUMBNAIL",
            "@size": "17282",
            "@ref": "gr3",
            "@mimetype": "image/gif"
          },
          {
            "@category": "high",
            "@height": "3658",
            "@width": "2917",
            "@_fa": "true",
            "$": "https://api.elsevier.com/content/object/eid/1-s2.0-S2468823122005788-gr5_lrg.jpg?httpAccept=%2A%2F%2A",
            "@multimediatype": "JPEG image file",
            "@type": "IMAGE-HIGH-RES",
            "@size": "1070944",
            "@ref": "gr5",
            "@mimetype": "image/jpeg"
          },
          {
            "@category": "high",
            "@height": "2691",
            "@width": "1749",
            "@_fa": "true",
            "$": "https://api.elsevier.com/content/object/eid/1-s2.0-S2468823122005788-gr4_lrg.jpg?httpAccept=%2A%2F%2A",
            "@multimediatype": "JPEG image file",
            "@type": "IMAGE-HIGH-RES",
            "@size": "319648",
            "@ref": "gr4",
            "@mimetype": "image/jpeg"
          },
          {
            "@category": "high",
            "@height": "1189",
            "@width": "2917",
            "@_fa": "true",
            "$": "https://api.elsevier.com/content/object/eid/1-s2.0-S2468823122005788-gr6_lrg.jpg?httpAccept=%2A%2F%2A",
            "@multimediatype": "JPEG image file",
            "@type": "IMAGE-HIGH-RES",
            "@size": "390306",
            "@ref": "gr6",
            "@mimetype": "image/jpeg"
          },
          {
            "@category": "high",
            "@height": "1490",
            "@width": "3583",
            "@_fa": "true",
            "$": "https://api.elsevier.com/content/object/eid/1-s2.0-S2468823122005788-gr1_lrg.jpg?httpAccept=%2A%2F%2A",
            "@multimediatype": "JPEG image file",
            "@type": "IMAGE-HIGH-RES",
            "@size": "304922",
            "@ref": "gr1",
            "@mimetype": "image/jpeg"
          },
          {
            "@category": "high",
            "@height": "1943",
            "@width": "2500",
            "@_fa": "true",
            "$": "https://api.elsevier.com/content/object/eid/1-s2.0-S2468823122005788-gr2_lrg.jpg?httpAccept=%2A%2F%2A",
            "@multimediatype": "JPEG image file",
            "@type": "IMAGE-HIGH-RES",
            "@size": "564823",
            "@ref": "gr2",
            "@mimetype": "image/jpeg"
          },
          {
            "@category": "high",
            "@height": "523",
            "@width": "1333",
            "@_fa": "true",
            "$": "https://api.elsevier.com/content/object/eid/1-s2.0-S2468823122005788-ga1_lrg.jpg?httpAccept=%2A%2F%2A",
            "@multimediatype": "JPEG image file",
            "@type": "IMAGE-HIGH-RES",
            "@size": "107281",
            "@ref": "ga1",
            "@mimetype": "image/jpeg"
          },
          {
            "@category": "high",
            "@height": "2082",
            "@width": "2774",
            "@_fa": "true",
            "$": "https://api.elsevier.com/content/object/eid/1-s2.0-S2468823122005788-sc1_lrg.jpg?httpAccept=%2A%2F%2A",
            "@multimediatype": "JPEG image file",
            "@type": "IMAGE-HIGH-RES",
            "@size": "458685",
            "@ref": "sc1",
            "@mimetype": "image/jpeg"
          },
          {
            "@category": "high",
            "@height": "4417",
            "@width": "3568",
            "@_fa": "true",
            "$": "https://api.elsevier.com/content/object/eid/1-s2.0-S2468823122005788-gr3_lrg.jpg?httpAccept=%2A%2F%2A",
            "@multimediatype": "JPEG image file",
            "@type": "IMAGE-HIGH-RES",
            "@size": "1931038",
            "@ref": "gr3",
            "@mimetype": "image/jpeg"
          },
          {
            "@category": "standard",
            "@_fa": "true",
            "$": "https://api.elsevier.com/content/object/eid/1-s2.0-S2468823122005788-mmc1.docx?httpAccept=%2A%2F%2A",
            "@multimediatype": "Microsoft Word file",
            "@type": "APPLICATION",
            "@size": "9876579",
            "@ref": "mmc1",
            "@mimetype": "application/word"
          },
          {
            "@category": "thumbnail",
            "@_fa": "true",
            "$": "https://api.elsevier.com/content/object/eid/1-s2.0-S2468823122005788-si1.svg?httpAccept=%2A%2F%2A",
            "@multimediatype": "Scalable Vector Graphics file",
            "@type": "ALTIMG",
            "@size": "9648",
            "@ref": "si1",
            "@mimetype": "image/svg+xml"
          },
          {
            "@category": "standard",
            "@_fa": "true",
            "$": "https://api.elsevier.com/content/object/eid/1-s2.0-S2468823122005788-am.pdf?httpAccept=%2A%2F%2A",
            "@multimediatype": "Acrobat PDF file",
            "@type": "AAM-PDF",
            "@size": "3372199",
            "@ref": "am",
            "@mimetype": "application/pdf"
          }
        ]
      },
      "link": {
        "@rel": "abstract",
        "@href": "https://api.elsevier.com/content/abstract/scopus_id/85138184708"
      }
    }
  }
}