{
  "metadata": {
    "title": "Facile synthesis and synergistically acting catalytic performance of supported bimetallic PdNi nanoparticle catalysts for selective hydrogenation of citral",
    "authors": "; ; ",
    "journal": "Molecular Catalysis",
    "date": "2017-07-31",
    "doi": "10.1016/j.mcat.2017.04.025",
    "abstract": "",
    "uri": "https://api.elsevier.com/content/article/pii/S2468823117302328",
    "pii": "S2468823117302328"
  },
  "fulltext": {
    "full-text-retrieval-response": {
      "scopus-eid": "2-s2.0-85029626478",
      "originalText": "serial JL 315758 291210 291744 291790 291809 31 Molecular Catalysis MOLECULARCATALYSIS 2017-05-03 2017-05-03 2017-05-03 2017-05-03 2017-05-22T19:23:15 1-s2.0-S2468823117302328 S2468-8231(17)30232-8 S2468823117302328 10.1016/j.mcat.2017.04.025 S300 S300.1 FULL-TEXT 1-s2.0-S2468823117X00102 2021-10-25T09:17:11.654594Z 0 0 20170701 20170731 2017 2017-05-03T16:31:38.769985Z absattachment articleinfo articletitlenorm authfirstinitialnorm authfirstsurnamenorm cid cids contenttype copyright crossmark dateloaded dateloadedtxt datesearch datesort dateupdated dco docsubtype doctype doi eid ewtransactionid hubeid indexeddate issn issnnorm itemstage itemtransactionid itemweight openaccess openarchive pg pgfirst pglast pii piinorm pubdateend pubdatestart pubdatetxt pubyr sectiontitle sortorder srctitle srctitlenorm srctype ssids alllist content subj subheadings suppl tomb volfirst volissue volumelist webpdf webpdfpagecount yearnav figure table body mmlmath acknowledge affil articletitle auth authfirstini authfull authkeywords authlast grantsponsor highlightsabst primabst pubtype ref specialabst 2468-8231 24688231 true 436 436 C Volume 436 28 237 247 237 247 201707 July 2017 2017-07-01 2017-07-31 2017 Regular Papers article fla © 2017 Elsevier B.V. All rights reserved. FACILESYNTHESISSYNERGISTICALLYACTINGCATALYTICPERFORMANCESUPPORTEDBIMETALLICPDNINANOPARTICLECATALYSTSFORSELECTIVEHYDROGENATIONCITRAL LIU C 1 Introduction 2 Experimental 2.1 Synthesis of supported catalysts 2.2 Characterization 2.3 Catalytic hydrogenation test 3 Results and discussion 3.1 Structural characterization 3.2 Liquid phase hydrogenation of citral 4 Conclusion Acknowledgement References YOON 2005 17174 17175 B DRAGOI 2015 92 102 B KANG 2016 206 213 K MERTENS 2009 176 183 P BEAMSON 2011 228 238 G HE 2016 1038 1044 L ALNAJI 2016 145 152 M WU 2012 8975 8981 Y NAKAMULA 2011 5830 5833 I YU 2012 5780 5817 W DUAN 2013 303 305 H CAI 2013 608 612 S CAMPO 2009 10234 10239 B TRASARTI 2007 155 165 A HAO 2008 6796 6800 J WORZ 2011 319 324 N DONATO 1990 1766 1770 A HIDALGOCARRILLO 2010 190 200 J HSU 2010 4502 4510 C ZHU 2013 737 744 J ALVAREZRODRIGUEZ 2009 114 121 J FUJITA 2004 95 104 S EKOU 2012 148 155 T ZGOLICZ 2012 37 54 P BURGENER 2004 1 8 M STOLLE 2013 2112 2153 A STEFFAN 2007 481 486 M LASHDAF 2003 65 75 M CABIAC 2008 229 235 A YILMAZ 2005 261 266 S VICENTE 2011 133 142 A FAN 2014 7040 7066 G WANG 2012 9976 9985 J HAN 2015 33199 33207 R ROUCOUX 2002 3757 3788 A WANG 2008 4016 4022 D SAU 2010 1781 1804 T BANIN 2007 625 626 U HAO 2010 2729 2742 R PARYJCZAK 1975 443 447 T TANKSALE 2008 366 377 A CHOUDARY 2002 14127 14132 B ZHAO 2013 5840 5846 J SINGHA 2011 7130 7132 S BARON 2009 6042 6049 M KOVNIR 2009 1784 1792 K MOHR 2001 311 334 C DENMARK 2008 1560 1638 S SINGH 2001 1 24 U TANG 2009 2279 2284 Y CERRONALARCON 2006 221 230 M ARAMENDIA 1997 46 54 M WANG 2010 10135 10140 Z GALLETTI 2012 49 59 A ZHU 2011 655 660 J SCHMOGER 2009 77 82 C BOUDJAHEM 2004 325 334 A CONNER 1995 759 788 W COQ 2001 117 134 B LIU 2001 3814 3818 P LIUX2017X237 LIUX2017X237X247 LIUX2017X237XC LIUX2017X237X247XC 2019-05-03T00:00:00Z http://creativecommons.org/licenses/by-nc-nd/4.0/ © 2017 Elsevier B.V. All rights reserved. 0 item S2468-8231(17)30232-8 S2468823117302328 1-s2.0-S2468823117302328 10.1016/j.mcat.2017.04.025 315758 2017-05-22T14:51:53.417982-04:00 2017-07-01 2017-07-31 1-s2.0-S2468823117302328-main.pdf https://s3-eu-west-1.amazonaws.com/prod-ucs-content-store-eu-west/content/pii:S2468823117302328/MAIN/application/pdf/42c4c1308b4d0958dae30bd6a3ddf94e/main.pdf https://s3.amazonaws.com/prod-ucs-content-store-us-east/content/pii:S2468823117302328/MAIN/application/pdf/42c4c1308b4d0958dae30bd6a3ddf94e/main.pdf main.pdf pdf true 6557724 MAIN 11 1-s2.0-S2468823117302328-main_1.png https://s3-eu-west-1.amazonaws.com/prod-ucs-content-store-eu-west/content/pii:S2468823117302328/PREVIEW/image/png/0b24e55a3e4f2c3a0e16959f55ff359c/main_1.png https://s3.amazonaws.com/prod-ucs-content-store-us-east/content/pii:S2468823117302328/PREVIEW/image/png/0b24e55a3e4f2c3a0e16959f55ff359c/main_1.png main_1.png png 57494 849 656 IMAGE-WEB-PDF 1 1-s2.0-S2468823117302328-fx1.sml https://s3-eu-west-1.amazonaws.com/prod-ucs-content-store-eu-west/content/pii:S2468823117302328/fx1/THUMBNAIL/image/gif/1d50fededb5206c5e5e004aeaa2eaed7/fx1.sml https://s3.amazonaws.com/prod-ucs-content-store-us-east/content/pii:S2468823117302328/fx1/THUMBNAIL/image/gif/1d50fededb5206c5e5e004aeaa2eaed7/fx1.sml fx1 true fx1.sml sml 7192 164 201 IMAGE-THUMBNAIL 1-s2.0-S2468823117302328-gr1.sml https://s3-eu-west-1.amazonaws.com/prod-ucs-content-store-eu-west/content/pii:S2468823117302328/gr1/THUMBNAIL/image/gif/9b37af592f43d81023dc7df831352f5c/gr1.sml https://s3.amazonaws.com/prod-ucs-content-store-us-east/content/pii:S2468823117302328/gr1/THUMBNAIL/image/gif/9b37af592f43d81023dc7df831352f5c/gr1.sml gr1 gr1.sml sml 7040 164 175 IMAGE-THUMBNAIL 1-s2.0-S2468823117302328-gr10.sml https://s3-eu-west-1.amazonaws.com/prod-ucs-content-store-eu-west/content/pii:S2468823117302328/gr10/THUMBNAIL/image/gif/dac73e96aae13646ee8e34e69e84e0f3/gr10.sml https://s3.amazonaws.com/prod-ucs-content-store-us-east/content/pii:S2468823117302328/gr10/THUMBNAIL/image/gif/dac73e96aae13646ee8e34e69e84e0f3/gr10.sml gr10 gr10.sml sml 5970 164 197 IMAGE-THUMBNAIL 1-s2.0-S2468823117302328-gr11.sml https://s3-eu-west-1.amazonaws.com/prod-ucs-content-store-eu-west/content/pii:S2468823117302328/gr11/THUMBNAIL/image/gif/e1cf4b9d6d2b60695f57a4d6216fb2d5/gr11.sml https://s3.amazonaws.com/prod-ucs-content-store-us-east/content/pii:S2468823117302328/gr11/THUMBNAIL/image/gif/e1cf4b9d6d2b60695f57a4d6216fb2d5/gr11.sml gr11 gr11.sml sml 6140 164 211 IMAGE-THUMBNAIL 1-s2.0-S2468823117302328-gr2.sml https://s3-eu-west-1.amazonaws.com/prod-ucs-content-store-eu-west/content/pii:S2468823117302328/gr2/THUMBNAIL/image/gif/4410d19df444ccc4ab419591361094ba/gr2.sml https://s3.amazonaws.com/prod-ucs-content-store-us-east/content/pii:S2468823117302328/gr2/THUMBNAIL/image/gif/4410d19df444ccc4ab419591361094ba/gr2.sml gr2 gr2.sml sml 6452 164 148 IMAGE-THUMBNAIL 1-s2.0-S2468823117302328-gr3.sml https://s3-eu-west-1.amazonaws.com/prod-ucs-content-store-eu-west/content/pii:S2468823117302328/gr3/THUMBNAIL/image/gif/57216946b74a8ebd197861a6537193d0/gr3.sml https://s3.amazonaws.com/prod-ucs-content-store-us-east/content/pii:S2468823117302328/gr3/THUMBNAIL/image/gif/57216946b74a8ebd197861a6537193d0/gr3.sml gr3 gr3.sml sml 13141 164 109 IMAGE-THUMBNAIL 1-s2.0-S2468823117302328-gr4.sml https://s3-eu-west-1.amazonaws.com/prod-ucs-content-store-eu-west/content/pii:S2468823117302328/gr4/THUMBNAIL/image/gif/c3d4fd038e6555e2b14b22e8c41c7f08/gr4.sml https://s3.amazonaws.com/prod-ucs-content-store-us-east/content/pii:S2468823117302328/gr4/THUMBNAIL/image/gif/c3d4fd038e6555e2b14b22e8c41c7f08/gr4.sml gr4 gr4.sml sml 7091 164 146 IMAGE-THUMBNAIL 1-s2.0-S2468823117302328-gr5.sml https://s3-eu-west-1.amazonaws.com/prod-ucs-content-store-eu-west/content/pii:S2468823117302328/gr5/THUMBNAIL/image/gif/3271aab51cb6c55aad712ad529aab99b/gr5.sml https://s3.amazonaws.com/prod-ucs-content-store-us-east/content/pii:S2468823117302328/gr5/THUMBNAIL/image/gif/3271aab51cb6c55aad712ad529aab99b/gr5.sml gr5 gr5.sml sml 18001 163 210 IMAGE-THUMBNAIL 1-s2.0-S2468823117302328-gr6.sml https://s3-eu-west-1.amazonaws.com/prod-ucs-content-store-eu-west/content/pii:S2468823117302328/gr6/THUMBNAIL/image/gif/a8001f0e6aedac110c90d04abc6ef75f/gr6.sml https://s3.amazonaws.com/prod-ucs-content-store-us-east/content/pii:S2468823117302328/gr6/THUMBNAIL/image/gif/a8001f0e6aedac110c90d04abc6ef75f/gr6.sml gr6 gr6.sml sml 8228 163 169 IMAGE-THUMBNAIL 1-s2.0-S2468823117302328-gr7.sml https://s3-eu-west-1.amazonaws.com/prod-ucs-content-store-eu-west/content/pii:S2468823117302328/gr7/THUMBNAIL/image/gif/69f9a199b1406d011143420e40ecca52/gr7.sml https://s3.amazonaws.com/prod-ucs-content-store-us-east/content/pii:S2468823117302328/gr7/THUMBNAIL/image/gif/69f9a199b1406d011143420e40ecca52/gr7.sml gr7 gr7.sml sml 5084 164 104 IMAGE-THUMBNAIL 1-s2.0-S2468823117302328-gr8.sml https://s3-eu-west-1.amazonaws.com/prod-ucs-content-store-eu-west/content/pii:S2468823117302328/gr8/THUMBNAIL/image/gif/bfe68d1aaa28d776b8608fb3be11eada/gr8.sml https://s3.amazonaws.com/prod-ucs-content-store-us-east/content/pii:S2468823117302328/gr8/THUMBNAIL/image/gif/bfe68d1aaa28d776b8608fb3be11eada/gr8.sml gr8 gr8.sml sml 5946 164 208 IMAGE-THUMBNAIL 1-s2.0-S2468823117302328-gr9.sml https://s3-eu-west-1.amazonaws.com/prod-ucs-content-store-eu-west/content/pii:S2468823117302328/gr9/THUMBNAIL/image/gif/a9a99929c8df2565930bb56fa8b571b9/gr9.sml https://s3.amazonaws.com/prod-ucs-content-store-us-east/content/pii:S2468823117302328/gr9/THUMBNAIL/image/gif/a9a99929c8df2565930bb56fa8b571b9/gr9.sml gr9 gr9.sml sml 7168 164 188 IMAGE-THUMBNAIL 1-s2.0-S2468823117302328-sc1.sml https://s3-eu-west-1.amazonaws.com/prod-ucs-content-store-eu-west/content/pii:S2468823117302328/sc1/THUMBNAIL/image/gif/123aa8534540baf7fa67b4860225d0be/sc1.sml https://s3.amazonaws.com/prod-ucs-content-store-us-east/content/pii:S2468823117302328/sc1/THUMBNAIL/image/gif/123aa8534540baf7fa67b4860225d0be/sc1.sml sc1 sc1.sml sml 3427 121 219 IMAGE-THUMBNAIL 1-s2.0-S2468823117302328-fx1.jpg https://s3-eu-west-1.amazonaws.com/prod-ucs-content-store-eu-west/content/pii:S2468823117302328/fx1/DOWNSAMPLED/image/jpeg/20bfb589fcfa40a7e4bf0ce8b2af06fc/fx1.jpg https://s3.amazonaws.com/prod-ucs-content-store-us-east/content/pii:S2468823117302328/fx1/DOWNSAMPLED/image/jpeg/20bfb589fcfa40a7e4bf0ce8b2af06fc/fx1.jpg fx1 true fx1.jpg jpg 16795 245 301 IMAGE-DOWNSAMPLED 1-s2.0-S2468823117302328-gr1.jpg https://s3-eu-west-1.amazonaws.com/prod-ucs-content-store-eu-west/content/pii:S2468823117302328/gr1/DOWNSAMPLED/image/jpeg/be8acb6017278b1f4b9dbce718e2b7c3/gr1.jpg https://s3.amazonaws.com/prod-ucs-content-store-us-east/content/pii:S2468823117302328/gr1/DOWNSAMPLED/image/jpeg/be8acb6017278b1f4b9dbce718e2b7c3/gr1.jpg gr1 gr1.jpg jpg 29568 317 339 IMAGE-DOWNSAMPLED 1-s2.0-S2468823117302328-gr10.jpg https://s3-eu-west-1.amazonaws.com/prod-ucs-content-store-eu-west/content/pii:S2468823117302328/gr10/DOWNSAMPLED/image/jpeg/516c4eb5b4fec8fd545255b2c8f77146/gr10.jpg https://s3.amazonaws.com/prod-ucs-content-store-us-east/content/pii:S2468823117302328/gr10/DOWNSAMPLED/image/jpeg/516c4eb5b4fec8fd545255b2c8f77146/gr10.jpg gr10 gr10.jpg jpg 20497 283 339 IMAGE-DOWNSAMPLED 1-s2.0-S2468823117302328-gr11.jpg https://s3-eu-west-1.amazonaws.com/prod-ucs-content-store-eu-west/content/pii:S2468823117302328/gr11/DOWNSAMPLED/image/jpeg/09b396f983e0435d4a0c39aa7d60a3fc/gr11.jpg https://s3.amazonaws.com/prod-ucs-content-store-us-east/content/pii:S2468823117302328/gr11/DOWNSAMPLED/image/jpeg/09b396f983e0435d4a0c39aa7d60a3fc/gr11.jpg gr11 gr11.jpg jpg 21017 291 376 IMAGE-DOWNSAMPLED 1-s2.0-S2468823117302328-gr2.jpg https://s3-eu-west-1.amazonaws.com/prod-ucs-content-store-eu-west/content/pii:S2468823117302328/gr2/DOWNSAMPLED/image/jpeg/f470c69e9d52bbc7c12fcac297a1c037/gr2.jpg https://s3.amazonaws.com/prod-ucs-content-store-us-east/content/pii:S2468823117302328/gr2/DOWNSAMPLED/image/jpeg/f470c69e9d52bbc7c12fcac297a1c037/gr2.jpg gr2 gr2.jpg jpg 33533 375 339 IMAGE-DOWNSAMPLED 1-s2.0-S2468823117302328-gr3.jpg https://s3-eu-west-1.amazonaws.com/prod-ucs-content-store-eu-west/content/pii:S2468823117302328/gr3/DOWNSAMPLED/image/jpeg/6e4a8db6f3dced72e2879d5698079378/gr3.jpg https://s3.amazonaws.com/prod-ucs-content-store-us-east/content/pii:S2468823117302328/gr3/DOWNSAMPLED/image/jpeg/6e4a8db6f3dced72e2879d5698079378/gr3.jpg gr3 gr3.jpg jpg 280810 962 640 IMAGE-DOWNSAMPLED 1-s2.0-S2468823117302328-gr4.jpg https://s3-eu-west-1.amazonaws.com/prod-ucs-content-store-eu-west/content/pii:S2468823117302328/gr4/DOWNSAMPLED/image/jpeg/a3c8a1aff411e7e06aa350a805db571b/gr4.jpg https://s3.amazonaws.com/prod-ucs-content-store-us-east/content/pii:S2468823117302328/gr4/DOWNSAMPLED/image/jpeg/a3c8a1aff411e7e06aa350a805db571b/gr4.jpg gr4 gr4.jpg jpg 43148 421 376 IMAGE-DOWNSAMPLED 1-s2.0-S2468823117302328-gr5.jpg https://s3-eu-west-1.amazonaws.com/prod-ucs-content-store-eu-west/content/pii:S2468823117302328/gr5/DOWNSAMPLED/image/jpeg/e3985f333a7c75f9b637a208dca4d2ab/gr5.jpg https://s3.amazonaws.com/prod-ucs-content-store-us-east/content/pii:S2468823117302328/gr5/DOWNSAMPLED/image/jpeg/e3985f333a7c75f9b637a208dca4d2ab/gr5.jpg gr5 gr5.jpg jpg 87763 513 659 IMAGE-DOWNSAMPLED 1-s2.0-S2468823117302328-gr6.jpg https://s3-eu-west-1.amazonaws.com/prod-ucs-content-store-eu-west/content/pii:S2468823117302328/gr6/DOWNSAMPLED/image/jpeg/3d1338dce280d1e3d0815ce376f35e47/gr6.jpg https://s3.amazonaws.com/prod-ucs-content-store-us-east/content/pii:S2468823117302328/gr6/DOWNSAMPLED/image/jpeg/3d1338dce280d1e3d0815ce376f35e47/gr6.jpg gr6 gr6.jpg jpg 35222 328 339 IMAGE-DOWNSAMPLED 1-s2.0-S2468823117302328-gr7.jpg https://s3-eu-west-1.amazonaws.com/prod-ucs-content-store-eu-west/content/pii:S2468823117302328/gr7/DOWNSAMPLED/image/jpeg/f8f159d5faa547e09bbd040efe20e5ec/gr7.jpg https://s3.amazonaws.com/prod-ucs-content-store-us-east/content/pii:S2468823117302328/gr7/DOWNSAMPLED/image/jpeg/f8f159d5faa547e09bbd040efe20e5ec/gr7.jpg gr7 gr7.jpg jpg 117145 978 621 IMAGE-DOWNSAMPLED 1-s2.0-S2468823117302328-gr8.jpg https://s3-eu-west-1.amazonaws.com/prod-ucs-content-store-eu-west/content/pii:S2468823117302328/gr8/DOWNSAMPLED/image/jpeg/04783de15d74877e832a8589b03951dd/gr8.jpg https://s3.amazonaws.com/prod-ucs-content-store-us-east/content/pii:S2468823117302328/gr8/DOWNSAMPLED/image/jpeg/04783de15d74877e832a8589b03951dd/gr8.jpg gr8 gr8.jpg jpg 21075 296 376 IMAGE-DOWNSAMPLED 1-s2.0-S2468823117302328-gr9.jpg https://s3-eu-west-1.amazonaws.com/prod-ucs-content-store-eu-west/content/pii:S2468823117302328/gr9/DOWNSAMPLED/image/jpeg/49cfe9f26e27483a04a0828a7e02ac5d/gr9.jpg https://s3.amazonaws.com/prod-ucs-content-store-us-east/content/pii:S2468823117302328/gr9/DOWNSAMPLED/image/jpeg/49cfe9f26e27483a04a0828a7e02ac5d/gr9.jpg gr9 gr9.jpg jpg 22429 295 339 IMAGE-DOWNSAMPLED 1-s2.0-S2468823117302328-sc1.jpg https://s3-eu-west-1.amazonaws.com/prod-ucs-content-store-eu-west/content/pii:S2468823117302328/sc1/DOWNSAMPLED/image/jpeg/e4ce35b5c0c18d5b1122d2551f4bbfac/sc1.jpg https://s3.amazonaws.com/prod-ucs-content-store-us-east/content/pii:S2468823117302328/sc1/DOWNSAMPLED/image/jpeg/e4ce35b5c0c18d5b1122d2551f4bbfac/sc1.jpg sc1 sc1.jpg jpg 15450 271 489 IMAGE-DOWNSAMPLED 1-s2.0-S2468823117302328-si1.gif https://s3-eu-west-1.amazonaws.com/prod-ucs-content-store-eu-west/content/pii:S2468823117302328/STRIPIN/image/gif/31b520752302eace727b09a53bab5f4d/si1.gif https://s3.amazonaws.com/prod-ucs-content-store-us-east/content/pii:S2468823117302328/STRIPIN/image/gif/31b520752302eace727b09a53bab5f4d/si1.gif si1 si1.gif gif 4128 65 349 ALTIMG MCAT 161 S2468-8231(17)30232-8 10.1016/j.mcat.2017.04.025 Elsevier B.V. Fig. 1 TG-MS profiles of the representative PdNi-LDH-67-C composite precursor. Fig. 1 Fig. 2 The release profiles of CO generated in the TG-MS tests over different LDH-C precursors: Pd-LDH-C (a), PdNi-LDH-80-C (b), PdNi-LDH-67-C (c), PdNi-55-LDH-C (d), Ni-LDH-C (e). Fig. 2 Fig. 3 TEM and HRTEM images of Pd/C (a,b), PdNi-67/C (c,d) and Ni/C (e,f). Fig. 3 Fig. 4 XRD patterns of Pd/C (a), PdNi-80/C(b), PdNi-67/C (c), PdNi-55/C, (d) Ni/C(e) and XRD card of metallic Pd (JCPDS no. 88–2335) and Ni (JCPDS no. 04-0850). Fig. 4 Fig. 5 STEM images (A,D) of representative PdNi-67/C sample, the elemental mapping of Pd−K (B) and Ni−K (C), and EDX spectrum (E) of the sample. The inset in (E) shows EDX lines of Pd-K and Ni-K along the yellow line in (D) over an individual NP. (For interpretation of the references to colour in this figure legend, the reader is referred to the web version of this article.) Fig. 5 Fig. 6 Pd 3d XPS of different supported samples: Pd/C (a), PdNi-80/C (b), PdNi-67/C (c), and PdNi-55/C (d). Fig. 6 Fig. 7 Catalytic performance in citral hydrogenation as a function of reaction time over different catalysts: Pd/C (A), PdNi-80/C (B), PdNi-67/C (C), PdNi-55/C (D) and Ni/C (E). Reaction conditions: H2 pressure, 1.0MPa; 100°C. Fig. 7 Fig. 8 Comparison of conversions and CAL selectivities over catalysts with different Ni/(Ni+Pd) mass ratios. Reaction conditions: H2 pressure, 1MPa; 100°C; 30min. Fig. 8 Fig. 9 Initial citral conversion rate (molgPdNi −1 s−1) and TOF (s−1) value of citral converted catalyzed by supported catalysts with different Ni/(Ni+Pd) mass ratio. Reaction condition: H2 pressure, 1MPa; 100°C. Fig. 9 Fig. 10 H2-TPD profiles of representative Pd/C (a), PdNi-67/C (b) and Ni/C samples. Fig. 10 Fig. 11 The reusability of PdNi-67/C catalyst in the hydrogenation of citral. Reaction conditions: H2 pressure, 1MPa; 100°C; 1h. Fig. 11 Scheme 1 Reaction pathways for the selective hydrogenation of citral. Scheme 1 Table 1 Analytical, structural and catalytic data of different supported reduced samples. Table 1 Samples Pd a (wt%) Ni a (wt%) RPd b (%) RNi c (%) SBET d (m2/g) D e (nm) Dis. f (%) SB g (mmol/g) SA h (mmol/g) R i (molgPdNi −1 s−1) TOF j (s−1) Pd/C 2.9 0 90.3 – 221 5.5 33.1 0.183 0.031 0.167 0.417 PdNi-80/C 2.2 0.6 84.1 90.6 224 5.9 36.7 0.176 0.025 0.196 0.438 PdNi-67/C 2.0 1.0 89.8 89.5 229 6.0 37.3 0.167 0.019 0.244 0.541 PdNi-55/C 1.6 1.5 90.7 87.2 232 5.8 35.4 0.158 0.024 0.174 0.344 Ni/C 0 3.2 – 83.3 218 5.7 27.9 0.141 0.012 0.104 0.306 a determined by ICP-AES. b Reduction degree of Pd species determined by XPS analysis. c Reduction degree of Ni species determined by H2-TPR. d BET surface area. e Particle size of metal NPs obtained by TEM analysis. f Degree of metal dispersion determined by H2-O2 titration. g The density of surface basic sites determined by CO2-TPD. h The density of surface acidic sites determined by NH3-TPD. i Initial hydrogenation reaction rate of citral hydrogenation. j Turnover frequency (TOF) of citral hydrogenation, which was given as the overall rate of citral conversion normalized by the number of surface active Pd and Ni sites within the initial 15min. Research paper Facile synthesis and synergistically acting catalytic performance of supported bimetallic PdNi nanoparticle catalysts for selective hydrogenation of citral Chunling Liu a Chunshi Nan a Guoli Fan a Lan Yang a Feng Li a b ⁎ a State Key Laboratory of Chemical Resource Engineering, Beijing University of Chemical Technology, Beijing 100029, China State Key Laboratory of Chemical Resource Engineering Beijing University of Chemical Technology Beijing 100029 China b Beijing Advanced Innovation Center for Soft Matter Science and Engineering, Beijing 100029, China Beijing Advanced Innovation Center for Soft Matter Science and Engineering Beijing 100029 China ⁎ Corresponding author at: Beijing Advanced Innovation Center for Soft Matter Science and Engineering, Beijing 100029, China. Graphical abstract Because of sustainable development in the field of heterogeneous catalysis, it is of paramount importance to the design and synthesis of high-performance supported metal nanoparticle catalyst systems for various catalytic reactions. Herein, new carbon-supported bimetallic PdNi nanoparticles (NPs) were facilely synthesized using our developed “carbonization-in situ self reduction” strategy based on hybrid composite precursors of PdCl4 2−-containing Mg-Ni-Al layered double hydroxide and amorphous carbon (LDH-C) and employed for selective hydrogenation of citral. The incorporation of PdCl4 2− complex ions into the LDH structure facilitated the dispersion of Pd species, and subsequently highly dispersed bimetallic PdNi NPs could be formed on the support surface. The bimetallic PdNi nanocatalyst with the Pd/Ni mass ratio of 67:33 showed higher catalytic activity than supported monometallic counterparts prepared by the same method, which could be ascribed to a synergistic effect between Pd and Ni in PdNi NPs. Furthermore, as-formed supported bimetallic PdNi nanocatalyst possessed excellent structural stability, owing to strong metal-support interactions stemming from the perfectible hybrid nanostructure of LDH-C composite precursors. Keywords Bimetallic nanoparticles Synergistic effect Layered double hydroxide Selective hydrogenation Citral 1 Introduction Currently, bimetallic nanoparticles (NPs) as high-performance catalysts are intensively investigated in a wide range of heterogeneous catalytic reactions [1–7], because of their superior properties to corresponding monometallic counterparts attributable to synergistic effects between two metals [8,9]. Meanwhile, incorporating a base metal into precious-metal-based bimetallic NPs can greatly lower the cost of catalysts [10]. For instance, dendrimer-stabilized bimetallic RhFe NPs were reported to show a more inspiring performance in the nitroarene hydrogenation with the introduction of Fe [9]. Especially, the dendrimer matrices supplied a favorable reaction interface, thus preventing the aggregation of bimetallic NPs. Also, Li and co-workers reported that the composition of bimetallic RhNi NPs played an important role in governing catalytic performance in the hydrogenation of nitroarenes [11,12]. Selective hydrogenation of α,β-unsaturated aldehydes to produce industrially important chemicals is of particular importance in terms of several advantages of environmental friendliness, low cost, and economic sustainability [13–17]. At present, precious metal catalysts (e.g., Pt [18,19], Pd [13,20], and Rh [21]) have been explored extensively. Generally, these catalysts are known to be highly selective toward the CC bond using hydrogen as a reducing agent, leading to the formation of saturated aldehydes [22]. Typically, citronellal (CAL), which is an industrially important intermediate in the production of fine chemicals used in the food, fragrance, and pharmaceutical industries, can be produced by hydrogenating the CC bond in citral with a conjugated CC double bond, a carbonyl group and an isolated CC double bond [23–26]. In contrast, geraniol/nerol isomers may be formed by hydrogenating the conjugated CO bond in citral. In this regard, palladium especially appears to be selective for the hydrogenation of the CC bond [20,27–31]. Thus, it is important to design stable, low-cost and highly efficient Pd-based catalysts for the sake of the production of desired CAL product in terms of economic and sustainable development. On the other side, layered double hydroxides (LDHs) with the formula [M1−x 2+Mx 3+(OH)2]x+[Ax/n]n−·mH2O, well known as a class of two-dimensional layered clay materials [32], act widely as catalyst precursors owing to their structural versatility and flexibility. Specially, the host structure of LDHs can accommodate different divalent or trivalent metal cations on the brucite-like layers or various metal complex anions within the interlayer to achieve highly dispersed and stable metal NPs through structural transformation, which makes LDHs extremely attractive in the synthesis of a variety of robust supported catalyst systems. Recently, we explored the generation of supported Ni or Pd NPs based on LDH-carbon composite precursors (LDH-C) [33,34]. In comparison to traditional impregnation and coprecipitation methods for the synthesis of supported catalysts, the LDH-C precursor route is of great advantage especially in terms of the significantly high metal dispersion and the formation of strong metal-support interactions (SMSI). In spite of a variety of successful synthesis of unsupported precious monometallic and bimetallic NPs [35–39], controlling the dispersion of NPs in supported bimetallic catalysts remains challenging. Herein, we report the synthesis of new carbon-supported bimetallic PdNi NPs with different Pd/Ni mass ratios by our developed “carbonization-in situ self reduction” strategy, which involves the assembly of PdCl4 2−-containing ternary MgNiAl-LDHs and amorphous carbon composite precursors through the carbonization of glucose, followed by an in situ self-reduction process using the carbon component as reducing agent. The dilution of costly Pd by inexpensive Ni is economical. The results indicate that as-formed bimetallic PdNi nanocatalyst with the Pd/Ni mass ratio of 67:33 shows higher catalytic activity in the selective hydrogenation of citral than monometallic counterparts prepared by the same method, attributable to the synergy between Pd and Ni in PdNi NPs. Furthermore, the present supported PdNi nanocatalyst also possesses excellent structural stability, due to the presence of SMSI originating from the perfectible hybrid nanostructure of LDH-C composite precursors 2 Experimental 2.1 Synthesis of supported catalysts MgNiAl-LDH precursors containing PdCl4 2− anion were prepared through coprecipitation method. Typically, Mg(NO3)2·6H2O, Ni(NO3)2·6H2O, Al(NO3)3·9H2O and desired amount of H2PdCl4 were dissolved in decarbonated deionized water, where the (Mg2+ +Ni2+)/Al3+ molar ratio is 2:1 and the mass percentage of Pd in total amount of Pd and Ni is x% (x =80, 67, 55). Subsequently, the above salt solution was titrated by NaOH solution (0.2M) under vigorous agitation at N2 atmosphere at room temperature, until the pH value reaches 10.0. The resulting suspension was aged at 70°C overnight, centrifuged and washed with deionized water for several times. Then, the obtained precipitant was transferred into Teflon-lined autoclave, mixed with 60mL of glucose solution (5[Mg2+ +Ni2+ +Al3+]=2 [C6H12O6]), and kept at 150°C for 12h to obtain LDH-C composite (denoted as PdNi-LDH-x-C). At last, PdNi-LDH-x-C was heated to 600°C at a rate of 5°Cmin−1 under N2 atmosphere in a tube furnace reactor and held for 2h to obtain supported samples (denoted as PdNi-x/C). Similarly, Pd-LDH-C and Ni-LDH-C with the same metal loading of about 3.0wt% also were prepared using to the above identical procedure in the presence of H2PdCl4 or Ni(NO3)2·6H2O. Subsequently, obtained composites were calcined at 600°C for Pd-LDH-C and 700°C for Ni-LDH-C under N2 atmosphere for 2 to obtain Pd/C and Ni/C samples. In addition, pure carbon support was prepared through the hydrothermal treatment using glucose solution (0.15M) and following calcination at 600°C for 2h under N2 atmosphere. 2.2 Characterization Powder X-ray diffraction (XRD) patterns of samples were collected using Shimadzu XRD-6000 diffractometer using Cu Kα radiation with λ = 0.15418nm. Elemental analysis was carried out on Shimadzu ICPS-7500 inductively coupled plasma atomic emission spectroscopy (ICP-AES). Thermogravimetric analysis and mass spectrometry (TG-MS) of samples were carried out using PerkinElmer Diamond TG/DTA instrument connected to a Pfeiffer ThermoStar MS analyzer under argon flow (300mLmin−1) at a heating rate of 5°Cmin−1. Transmission electron microscopy (TEM) and high-resolution transmission electron microscopy (HRTEM) images were observed using JEOL JEM-2010 electron microscope with an accelerating voltage of 200kV. Scanning transmission electron microscopy (STEM) experiments were carried out using a HITACHI S-5500 STEM equipped with an Oxford INCA-450 energy dispersive X-ray (EDX) spectrometer detector. Low temperature N2 adsorption-desorption experiments of samples were performed using Micromeritics ASAP 2020 sorptometer. The specific surface area was determined based on the multipoint Brunauer–Emmett–Teller (BET) method. X-ray photoelectron spectroscopy (XPS) data was collected on a Thermo VG ESCALAB250 X-ray photoelectron spectrometer with a monochromatic Al Kα X-ray radiation of 1486.6eV photons. H2 temperature-programmed reduction (H2-TPR) and temperature programmed desorption of hydrogen (H2-TPD) experiments were conducted over reduced samples on a Micrometric ChemiSorb 2920 chemisorption instrument equipped with a thermal conductivity detector (TCD). First of all, the reduced sample (0.1g) was degassed under a flow of Ar (40mLmin−1) at 500°C for 1h. For TPR, the reduced sample was further treated in a H2/Ar flow (1:9, v/v; 40mLmin−1) at a heating rate of 10°Cmin−1 from 500 to 1000°C. The reduction degree of Ni species in reduced samples was calculated by the percentage of the difference value to the theoretical hydrogen consumption for the reduction of Ni2+ species. Herein, the difference value was the theoretical hydrogen consumption for the reduction of Ni2+ species minus the hydrogen consumption for the reduction of unreduced Ni2+ species in the TPR from 500 to 1000°C, considering that the amount of hydrogen consumption for the reduction of unreduced Pd2+ species in reduced samples could be estimated by XPS results of Pd 3d core level. For H2-TPD, the reduced sample was treated in a flow of a H2/Ar flow (1:9, v/v; 40mLmin−1) at room temperature and held for 2h. At last, chemisorbed H2 was desorbed from room temperature to 700°C in a flow of Ar at a rate of 10°Cmin−1. The dispersion degree of metal NPs was estimated by H2–O2 titration using Micromeritics ChemiSorb 2720. First, LDH-C composite sample (100mg) underwent a reduction in a N2 flow (40mLmin−1) from 50°C to 600°C for Pd-containing samples or to 700°C for Ni-LDH-C sample at a heating rate of 5°C and held for 2h, which was the same condition as that for preparing reduced samples. After the sample was cooled to 120°C, the sample was switched to a H2/Ar mixture flow (1:9, v/v; 40mLmin−1) and maintained for 1h, and then purged by an Ar flow (40mLmin−1) for 1h to ensure the desorption of physically adsorbed hydrogen on its surface. Subsequently, pulses of oxygen were introduced into the sample until the signal area was constant. Finally, the chemisorbed oxygen was titrated by pulses of H2. The dispersion degree of metal (Dis, %) on reduced samples was determined according to the following equation [40]: (1) D i s ( % ) = 2 × V T H × 10 − 3 3 × 22.4 × W × ( P P d × R P d M P d + P N i × R N i M N i ) × 100 where MPd and MNi are the formula weight of Pd (MPd =106.42gmol−1) and Ni (MNi =58.69gmol−1), respectively; VT H is the volume of H2 used for the titration of O2 (mL); W is the mass of catalyst (g); PPd and PNi are the weight percentage of Pd and Ni species in the LDH-C composite sample as determined by ICP-AES, respectively; RPd is the reduction degree of Pd species determined by the XPS results of Pd 3d core level; RNi is the reduction degree of Ni species determined by the H2-TPR results of reduced samples. Temperature-programmed desorption (TPD) experiments were carried out on Chemisorb 2720 instrument with a TCD. First, the sample (100mg) was first heated at 200°C in a He flow (40mL/min) and held for 1h. After cooling to 50°C, pure CO2 (or NH3) was introduced for 1h, and the sample tube was purged with a He flow for 1h. At last, Chemisorbed CO2 (or NH3) was desorbed with the increased temperature to 700°C at a rate of 5°Cmin−1. 2.3 Catalytic hydrogenation test The selective hydrogenation of citral was performed in a 200mL stainless steel autoclave, where citral (5.85mmol), the catalyst with the citral/(Pd+Ni) mass ratio of 68.4, and 100mL isopropanol was charged. Afterward, the reactor was flushed by the nitrogen to exclude the air, sealed and then introduced by the H2 of 2.0MPa for ten times. The reactor was placed into an oil bath and preheated to certain reaction. H2 was fed into the reactor to certain pressure and then the hydrogenation of citral was carried out under stirring at a speed of 900rpm. After reaction, the reactor was cooled with an ice-water bath, and depressurized carefully. Finally, the products were quantitatively analyzed by gas chromatography (Agilent GC-7890B) equipped with a flame ionization detector and a DB-WAX capillary column (30.0m×250μm×0.25μm). The conversions and selectivities were obtained based on at least 3 parallel experiments with experimental errors of less than 3%. 3 Results and discussion 3.1 Structural characterization The thermal evolution of the representative PdNi-LDH-67-C composite precursor was analyzed by TG-MS technique. As shown in Fig. 1 , there are three weight loss steps in the temperature range of 80–700°C. The first step at ca. 80–275°C is correlated with the release of physisorbed water and CO2 on the layers and the desorption of interlayer water in the structure of LDH component, as clearly reflected by two H2O peaks at about 92°C and 250°C and a CO2 peak at 204°C in the corresponding MS profiles. The second one in the range of 275–400°C is assigned to the dehydroxylation of the LDH lattices (360°C) and the release of CO2 (345°C) due to decomposition of interlayer carbonate anions. The third one above 400°C involves the release of CO (413, 460 and 552°C) and CO2 (462°C) due to the reduction of metal oxide phases containing Ni and Pd by the carbon component, which corresponds to the following two reactions: MO+C→CO+M and CO+O→CO2, as clearly observed by the appearance of CO and CO2 peaks in the MS profiles. Accordingly, in combination with the above TG-MS results, the reduction temperatures of LDH-C composites under inert atmosphere should be in accordance with the peak temperatures for the release of CO gas in the TG-MS profiles. Fig. 2 shows the release profiles of CO generated in the TG-MS tests over different LDH-C precursors. According to the release of CO generated, the reduction temperatures for two Pd-LDH-C and Ni-LDH-C precursors appear in the temperature ranges of 300–475°C and 500–700°C, respectively. The reduction temperatures for other composite precursors containing Pd and Ni, which are lower than that for Ni-LDHC but higher than that for Pd-LDH-C, increase gradually with the decreasing Pd/Ni mass ratio in samples, probably due to the hydrogen spillover from the reduced Pd thereby easily reducing nickel oxide species [41]. The aforementioned results imply the presence of the interactions between Pd and Ni species in composites, thus easily forming bimetallic PdNi NPs. In addition, the reduction of partial Pd2+ species by glucose during the hydrothermal step for the formation of LDH-C composites can occur. Correspondingly, the presence of reduced Pd00 species in LDH-C composites as growth centers may facilitate the formation of bimetallic PdNi NPs upon heating under N2 atmosphere. The morphology and microstructure of supported monometallic and representative bimetallic PdNi samples were examined by TEM measurements (Fig. 3 ). In each case, uniform and spheroidal NPs are well dispersed over the support. The average crystallite size of NPs determined from more than 200 individual metal particles is in the range of 5.5–6.0nm (Table 1 ), indicating a slight difference in the particle size of monometallic and bimetallic NPs regardless of the compositions of metallic NPs and the Pd loadings. Furthermore, a typical HRTEM image of the representative PdNi-67/C reveals that the lattice image of a single NP shows an interplanar spacing of about 0.215nm. Such value of interplanar spacing is smaller than that for the (111) plane of metallic Pd phase (0.225nm) and larger than that for the (111) plane of metallic Ni phase (0.203nm), strongly mirroring the formation of bimetallic PdNi NPs in the PdNi-67/C sample. Further, XRD characterizations were carried out. Fig. 4 shows the XRD patterns of different supported samples. In the case of supported monometallic Pd and Ni samples, the XRD lines indicate the characteristic (111), (200), and (220) diffractions for metallic Pd (JCPDS 88-2335) and metallic Ni (JCPDS 04-0850), respectively, except for MgO phase and amorphous carbon. Interestingly, in the cases of supported bimetallic PdNi NPs, their (111), (200), and (220) planes appear between those of metallic Pd and Ni peaks and their positions gradually shift to the higher values of 2θ with the decreasing Pd/Ni mass ratios. The results demonstrate the formation of bimetallic PdNi phase.. To determine the elemental distributions of Pd and Ni over the support, STEM characterization was further examined. Fig. 5 shows STEM images and resulting Pd and Ni elemental mapping in the representative PdNi-67/C sample. Noticeably, two Pd and Ni elements are distributed uniformly over an individual NP. The elemental analysis by ICP-AES shows that the Pd/Ni mass ratios are well consistent with the designed compositions of bimetallic PdNi NPs (Table 1). As a result, above TG-MS, HRTEM, XRD and STEM results strongly confirm the formation bimetallic PdNi NPs in supported samples. In order to determine surface electronic structures of active metal species in supported samples, XPS measurements were conducted. Due to quite low content of Ni species (0.6–1.5wt%), however, no discernible Ni 2p signals can be detected in all Pd- and Ni-containing samples. As shown in Fig. 6 , the signals centered at about 335.5 and 340.8eV for Pd/C sample are ascribed to Pd 3d 5/2 and Pd 3d3/2 core levels, respectively, reflecting the character of metallic Pd0 [42]. Besides, there are another two very small peaks centered at about 336.7eV and 342.0eV, respectively, which is the character of unreduced Pd(II) species in samples. Clearly, the small Pd(II) to Pd(0) peak area ratio reveals that most of Pd species should be reduced upon heating under the present inert atmosphere. It is interesting to note that the binding energy (BE) value of Pd 3d 5/2 region is higher than that (335.0eV) reported in the literature for Pd0 [43,44], due to the presence of the electronic interaction between the metallic Pd and the support, thus leading to the transfer of partial charge from the Pd to the support. With the introduction of Ni, the Pd 3d 5/2 peak for Pd0 shows a gradual shift toward the higher BE value of ∼336.1eV for PdNi-55/C, indicative of the presence of interactions between Pd and Ni in bimetallic samples. Commonly, it is believed that the BE shifts for metal species can be affected by both the initial and final state effects. Due to higher electronegativity of Pd atom (2.2) than that of Ni atom (1.8) [45], palladium atoms in bimetallic PdNi NPs should be negatively polarized and thus negatively charged according to the initial state effect. Based on the final state effect, the filling of the valence d-band in Pd atoms can cause a different screening of the core hole [46], thereby causing the shift of the Pd 3d levels to higher BE values. In addition, the dispersion degree of metal NPs can be determined by using H2-O2 titration technique, considering that the reduction degree of Pd species or Ni species in reduced samples may be estimated by XPS or H2-TPR results for reduced samples. As shown in Table 1, the dispersion degree of metal NPs is slightly enhanced with the increasing Ni/(Pd+Ni) mass ratio from 0 to 0.33. However, further introduction of Ni results in the slight decline in the dispersion of metallic NPs. Among all reduced sample, Ni/C presents a smallest dispersion degree of metal NPs (Table 1), which is probably associated with the presence of more surface unreduced NiO species, thus leading to the lower reduction degree of Ni species. 3.2 Liquid phase hydrogenation of citral As shown in Scheme 1 , first, either the CO group or the conjugated CC group can be hydrogenated to generate geraniol/nerol isomers or CAL, respectively, in the course of citral hydrogenation. In addition, in some cases, isolated CC group in citral may be hydrogenated to 3,7-dimethyl-2-octenal. Subsequently, geraniol/nerol isomers and CAL are consecutively hydrogenated to citronellol (COL). Finally, formed COL is further hydrogenated to 3,7-dimethyloctanol. In our case, undesired acetalization by-products cannot be found. Fig. 7 shows the change in the compositions of main products (geraniol/nerol, CAL, and COL) with reaction time over different supported catalysts in the course of citral hydrogenation. In the presence of pure carbon support, no citral conversion is observed, indicating that the support is inactive for the hydrogenation of citral. Obviously, CAL generated is major product under present reaction conditions, except for COL and allylic alcohols (geraniol and nerol). No 3,7-dimethyloctanol and 3,7-dimethyl-2-octenal are formed in all cases, demonstrating that only the CO and conjugated CC double bond can be hydrogenated over all catalysts. It implies that the adsorption of CC group on the catalyst surface should be more favorable in comparison with that of the carbonyl bond in citral, thereby resulting in easier activation of the CC bond. In addition, it is found that the amount of citral almost linearly drops at the initial period of reaction. Especially, over the PdNi-67/C, the concentration of citral declines dramatically and a complete conversion is achieved within 2h. According to the calculated initial hydrogenation rates (Table 1), the catalytic activity of catalysts increases gradually in the following order: Ni/C<Pd/C<PdNi-55/C<PdNi-80/C<PdNi-67/C. In addition, the reaction was carried out conducted over the PdNi-67/C under the same reaction conditions and stopped after reaction for 30min. After the catalyst was removed quickly, the reaction continued to proceed for another 2h. However, no further citral conversion is found, reflecting the heterogeneity of the present reaction. Fig. 8 shows the comparison of conversions and CAL selectivities over different catalysts at a reaction time of 30min. Clearly, a pronounced synergistic effect of between Pd and Ni atoms in catalysts is observed. Bimetallic PdNi catalysts are definitely more active than monometallic Pd/C and Ni/C catalysts. With the introduction of Ni into catalysts, the catalytic activity of bimetallic PdNi catalysts is improved gradually. Especially, the combination of Pd and Ni metals in the bimetallic PdNi-67/C catalyst leads to a highest CAL yield of 64% under the conditions used. Specially, the initial hydrogenation rate over the PdNi-67/C is almost 1.5 times as that over the Pd/C (Table 1). The further increase in the Ni content results in a decline in the activity in the case of PdNi-55/C. In contrast, Ni/C catalyst yields a lowest yield of CAL. It reflects that the appropriate amount of introduction of Ni into catalysts facilitates the formation of CAL. However, the evolution of catalytic activity within the series is not associated with the number of accessible catalytically active metallic Pd and/or Ni atoms. In the cases of the present Pd-containing catalysts, the concentration of CAL rapidly increase at the initial period of reaction and finally remains high over Pd/C, PdNi-80/C and PdNi-67/C (>75%) at high conversion levels. Although the CO group in citral can be hydrogenated to produce geraniol and nerol, the final selectivity to allylic alcohols is very low (<10%). Meanwhile, CAL and allylic alcohols can be further converted to COL by hydrogenating the CO bond within the whole reaction time, in spite of relatively small amount of COL. Here, owing to the presence of the electrostatic interaction between catalysts and reactants, the CCCO structure in citral may be delocalized as the Cδ+–Cδ––Cδ+–Oδ– one. Correspondingly, the adsorption of reactants on the catalyst surface is weakened gradually in the following order: citral>CAL>>allylic alcohols, thereby resulting in the easier hydrogenation of CAL than that of geraniol and nerol. Therefore, the hydrogenation of the conjugated CC group is always dominant in the course of reaction process, regardless of the difference in the activity of catalysts with the increasing Ni content. Correspondingly, the CAL selectivity is dramatically increased at the intital reaction period and changed a little at the late stage of the reaction, whereas the COL selectivity is slowly increased with the whole reaction process. The above results signify the preferential hydrogenation of the conjugated CC group in citral, because hydrogenating the CC bond is thermodynamically favorable over that of the CO bond by about 35kJmol−1 [47]. As for Ni/C catalyst, citral is selectively hydrogenated to CAL at the initial reaction period. With the reaction time, CAL produced is further hydrogenated to produce COL, and correspondingly, the concentration COL is gradually enhanced and reaches 48% at about 90% conversion. In addition, it was reported that surface basic sites may interact with the π* acceptor orbital of carbonyl group [48], probably favoring the adsorption of substrate molecules containing carbonyl groups. As shown in Table 1, the density of surface basic sites for reduced samples determined by CO2-TPD slightly decreases with the increasing Ni content, due to the slight decrease in the amount of MgO phase in samples. In addition, surface acidity of all samples determined by NH3-TPD is found to be weak (Table 1), and the difference in the density of surface acidic sites is not significant. It suggests that a small amount of Cl-containing species may be present over the support surface. Therefore, in our case, it is likely that surface acid-base property of catalysts is not the critical factor in the higher citral conversion over the PdNi-67/C sample than those over other samples, while the weak acid-base property of all samples can have a role in suppressing side reaction, namely acetalization. On the other side, as shown in Table 1, the initial rate of citral hydrogenation seems to increase gradually with the increasing dispersion degree of metal NPs. As for metal-catalyzed hydrogenation reactions, the metal dispersion usually can play an important role in governing the catalytic performance. As a result, the higher dispersion of metallic species, the more amount of dissociative H2 generated on catalytically active metallic Pd0 and Ni0 sites in the course of hydrogenation and thus the higher rate of citral hydrogenation [49], in spite of the difference in the capability of the dissociation of H2 to atomic H between metallic Pd0 and Ni0 species. According to the XPS and H2-TPR results for reduced catalysts, metallic Pd0 and Ni0 species exist as major components on the surface of bimetallic or monometallic NPs. Noticeably, although the metal dispersion degree of PdNi-67/C is about 12.6% higher than that of Pd/C, the initial rate of citral hydrogenation is increased by about 46.0%. The above results indicate that the dispersion of metal NPs is not the only important factor in improving the catalytic performance of catalysts. In order to gain the intrinsic activity of metallic Pd and/or Ni sites on supported metal catalysts, the turnover frequency (TOF) was calculated according to the moles of converted citral per mole surface metallic Pd and Ni in the initial 15min. Note that from Fig. 9 that the TOF values present a volcano-like shape with the Ni/(Pd+Ni) mass ratio, well consistent with the change in the initial hydrogenation reaction rate. That is, the TOF value increases gradually with the introduction of Ni and reaches the maximum in the case of PdNi-67/C (0.541s−1), and then begins to drop as the Ni content further increases. Therefore, all Pd-containing catalysts exhibit higher activity than Ni/C catalyst, demonstrating that the introduction of Pd can improve the activity of bimetallic PdNi catalysts in comparison to Ni/C catalyst. In particular, the activities of PdNi-67/C and PdNi-80/C catalysts are even higher than that of monometallic Pd/C catalyst. The above result evidently confirms a synergistic effect between Pd and Ni on enhancing the citral conversion, and the importance of having an appropriate Pd:Ni mass ratio, especially 67:33 in catalysts, in order to achieve the desired catalytic activity in the selective hydrogenation of citral. We believe that the proper electronic and geometric structure of PdNi NPs in the PdNi-67/C catalyst may be more beneficial for the progress of the reaction. More importantly, despite different reaction parameters (i.e., hydrogen pressure, reaction temperature), the activity of the present PdNi-67/C catalyst is comparable to those of other some supported Ni- and Pd-based catalysts reported previously and even much better, such as Pd/C/TiO2 (TOF: 0.1s−1)[20], Ni-Sn/Al2O3 [27], Ni/multi-walled carbon nanotubes [50], Ni/graphite (reaction rate: 0.187mmolgNi −1 s−1) [51], Pd/(SiO2/AlPO4) (reaction rate: 17.8mmolgPd −1 s−1)[52], Pd/Fe7Co3/carbon [53], Pd/polyketones (TOF: 0.343s−1)[54], Pd/C [55], and Pd/porous glass [56]. In order to illuminate the nature of the interactions between the catalyst surface and hydrogen species and between metals and the support, H2-TPD experiments of representative supported samples were carried out. As shown in Fig. 10 , Pd/C sample presents a strong hydrogen desorption in the temperature range of 70–350°C, with the desorption peak of about 196°C, which is due to the release of chemisorbed H2 on the surface of Pd atoms. Hydrogen desorption over the Ni/C sample lies in a broad temperature range of 250–700°C and can be fitted to two peaks centered at 435 and 540°C, respectively, which are associated with the desorption of H2 bound to the Ni0 atoms and hydrogen spillover on the support [57,58]. Interestingly, in the case of bimetallic PdNi-67/C sample, there are two fitted hydrogen desorption peaks centered at 167°C and 288°C, respectively. Compared with those for Pd/C and Ni/C samples, low-temperature desorption and high temperature desorption peaks of hydrogen obviously shift to lower temperatures, demonstrating more easier desorption of hydrogen from surface metal atoms due to the presence of the electronic interaction between Pd and Ni in the PdNi-67/C sample. Traditionally, compared with oxides supported Pd catalysts, supported Ni ones are less active for the hydrogenation of α,β-unsaturated aldehydes regardless of the selectivities to products. Previously, it was reported that the electronic modifications by a second metal upon alloying Pd could greatly affect the adsorption of alkenes in the hydrogenation reactions [59], and the geometrical (or ensemble) effect on bimetallic alloy surfaces could significantly determine the adsorption properties of carbon monoxide, oxygen and nitrogen [60]. Based on the positively shifted BE value as evidenced by the above XPS results of Pd 3d regions for the present bimetallic PdNi catalyst system, the strength of electronic interaction between Pd and Ni presents an increasing trend with the increase in the Ni content. In addition, it is generally accepted that an optimum strength of adsorption for reactants, neither too weak nor too strong, can enhance the catalytic activity. Correspondingly, an enhanced catalytic activity of PdNi-67/C catalyst probably suggests a more favorable adsorption of citral molecule on the surface of bimetallic PdNi catalysts. On the other side, it also was found that quasi-equilibrium for dissociative hydrogen adsorption, competitive adsorption between hydrogen and citral, and the addition of the first H atom could be considered as the rate determining steps for the selective hydrogenation of citral over supported Pt-based catalysts [49]. As a result, the enhanced ability for the dissociation of H2 and appropriate adsorption strength for reactants stemming from the electrostatic and ensemble effects in present bimetallic PdNi-67/C catalyst may account for its enhanced hydrogenation activity to a large extent. As for supported metal catalysts, the stability of catalysts in the heterogeneous reaction processes is of vital importance for their potential applications. Therefore, the reusability of the PdNi-67/C catalyst was further studied. After each catalytic reaction, the used catalyst was washed with ethanol and deionized water for several times, and then dried at 70°C for 12h. As shown in Fig. 11 , both the high conversion and the high CAL selectivity still can be achieved over the PdNi-67/C catalyst after six consecutive cycles, indicative of no significant decrease in the catalytic performance. Elemental analysis by ICP-AES indicates that the amount of Pd leaching in the reactant mixture is negligible. The above results demonstrate the excellent stability of the PdNi-67/C catalyst, due to strong interactions between metal and support stemming from the perfectible hybrid nanostructure of LDH-C precursor, thus preventing the leaching, aggregation and growth of PdNi NPs during the reaction. In general, the present LDH-C precursor route for the synthesis of supported bimetallic PdNi nanocatalysts is an economical and effective strategy for finely adjusting the compositions of bimetallic catalysts and thus reasonably constructing favorable synergistic effects between Pd and Ni atoms to facilitate the adsorption of reactants. Moreover, in view of catalytic applications, the carbon matrix is well-suited to stabilize metal NPs through SMSI, and simultaneously high surface area of catalysts guarantees the accessibility of catalytically active sites of metal NPs. 4 Conclusion In summary, we reported new carbon-supported bimetallic PdNi nanocatalysts via a carbonization-in situ self reduction route based on LDH-C composite precursors and their synergistically acting catalyst system in liquid-phase hydrogenation of citral. A series of characterizations revealed that the introduction of Ni into catalysts effectively modifies the structures of PdNi NPs, thus greatly improving the adsorption of CC bond in citral and the dissociation of H2 in the hydrogenation. The bimetallic PdNi catalyst with the Pd/Ni mass ratio of 67:33 showed much higher catalytic activity than supported monometallic Pd and Ni catalysts. The excellent catalytic efficiency of bimetallic PdNi catalyst was ascribed to a synergistic effect between Pd and Ni atoms in bimetallic NPs. Moreover, the carbon support ideally combined high stability and good access of reactants to active sites on PdNi NPs. Such flexible, high-efficient and stable supported bimetallic PdNi nanocatalyst system offers new and promising potential for the hydrogenation of α,β-unsaturated aldehydes in terms of sustainable chemistry. Acknowledgement This study was funded through National Natural Science Foundation of China and Fundamental Research Funds for the Central Universities (buctrc201528). References [1] B. Yoon C.M. Wai J. Am. Chem. Soc. 127 2005 17174 17175 [2] B. Dragoi A. Ungureanu A. Chirieac C. Ciotonea C. Rudolf S. Royer E. Dumitriu Appl. Catal. A: Gen. 504 2015 92 102 [3] K.H. Kang S.J. Han J.W. Lee T.H. Kim I.K. Song Appl. Catal. A: Gen. 524 2016 206 213 [4] P.G.N. Mertens P. Vandezande X. Ye H. Poelman I.F.J. Vankelecom D.E. De Vos Appl. Catal. A: Gen. 355 2009 176 183 [5] G. Beamson A.J. Papworth C. Philipps A.M. Smith R. Whyman J. Catal. 278 2011 228 238 [6] L. He X. Gong L. Ye X. Duan Y. Yuan J. Energy Chem. 25 2016 1038 1044 [7] M. Al-Naji A. Yepez A.M. Balu A.A. Romero Z. Chen N. Wilde H. Li K. Shih R. Gläser R. Luqueb J. Mol. Catal. A: Chem. 417 2016 145 152 [8] Y. Wu S. Cai D. Wang W. He Y. Li J. Am. Chem. Soc. 134 2012 8975 8981 [9] I. Nakamula Y. Yamanoi T. Imaoka K. Yamamoto H. Nishihara Angew. Chem. 50 2011 5830 5833 [10] W. Yu M.D. Porosoff J.G. Chen Chem. Rev. 112 2012 5780 5817 [11] H. Duan D. Wang Y. Kou Y. Li Chem. Commun. 49 2013 303 305 [12] S. Cai H. Duan H. Rong D. Wang L. Li W. He Y. Li ACS Catal. 3 2013 608 612 [13] B.C. Campo M.A. Volpe C.E. Gigola Ind. Eng. Chem. Res. 48 2009 10234 10239 [14] A.F. Trasarti A.J. Marchi C.R. Apesteguía J. Catal. 247 2007 155 165 [15] J. Hao C. Xi H. Cheng R. Liu S. Cai M. Arai F. Zhao Ind. Eng. Chem. Res. 47 2008 6796 6800 [16] N. Wörz J. Arras P. Claus Appl. Catal. A: Gen. 391 2011 319 324 [17] A. Donato G. Neri R. Pietropaolo Ind. Eng. Chem. Res. 29 1990 1766 1770 [18] J. Hidalgo-Carrillo M.A. Aramendía A. Marinas J.M. Marinas F.J. Urbano Appl. Catal. A Gen. 385 2010 190 200 [19] C.-Y. Hsu T.-C. Chiu M.-H. Shih W.-J. Tsai W.-Y. Chen C.-H. Lin J. Phys. Chem. C 114 2010 4502 4510 [20] J. Zhu M. Li M. Lu J. Zhu Catal. Sci. Technol. 3 2013 737 744 [21] J. Álvarez-Rodríguez I. Rodríguez-Ramos A. Guerrero-Ruiz A. Arcoya Appl. Catal. A: Gen. 366 2009 114 121 [22] S. Fujita Y. Sano B.M. Bhanage M. Arai J. Catal. 225 2004 95 104 [23] T. Ekou A. Flura L. Ekou C. Especel S. Royer J. Mol. Catal. A: Chem. 353–354 2012 148 155 [24] P.D. Zgolicz J.P. Stassi M.J. Yanez O.A. Scelza S.R. Miguel J., Catal. 290 2012 37 54 [25] M. Burgener R. Furrer T. Mallat A. Baiker Appl. Catal. A: Gen. 268 2004 1 8 [26] A. Stolle T. Gallert C. Schmöger B. Ondruschka RSC Adv. 3 2013 2112 2153 [27] M. Steffan M. Lucas A. Brandner M. Wollny N. Oldenburg P. Claus Chem. Eng. Technol. 30 2007 481 486 [28] M. Lashdaf A. Krause M. Lindblad M. Tiitta T. Venalainen Appl. Catal. A: Gen. 241 2003 65 75 [29] A. Cabiac T. Cacciaguerra P. Trens R. Durand G. Delahay A. Medevielle D. Plée B. Coq Appl. Catal. A: Gen. 340 2008 229 235 [30] S. Yilmaz S. Ucar L. Artok H. Gulec Appl. Catal. A: Gen. 287 2005 261 266 [31] A. Vicente G. Lafaye C. Especel P. Marécot C.T. Williams J. Catal. 283 2011 133 142 [32] G. Fan F. Li D.G. Evans X. Duan Chem. Soc. Rev. 43 2014 7040 7066 [33] J. Wang G. Fan F. Li RSC Adv. 2 2012 9976 9985 [34] R. Han C. Nan L. Yang G. Fan Feng Li RSC Adv. 5 2015 33199 33207 [35] A. Roucoux J. Schulz H. Patin Chem. Rev. 102 2002 3757 3788 [36] D. Wang T. Xie Q. Peng Y. Li J. Am. Chem. Soc. 130 2008 4016 4022 [37] T.K. Sau A.L. Rogach Adv. Mater. 22 2010 1781 1804 [38] U. Banin Nat. Mater. 6 2007 625 626 [39] R. Hao R. Xing Z. Xu Y. Hou S. Gao S. Sun Adv. Mater. 22 2010 2729 2742 [40] T. Paryjczak K. Jó’zwiak J. Chromatogr. 111 1975 443 447 [41] A. Tanksale J.N. Beltramini J.A. Dumesic J. Catal. 258 2008 366 377 [42] B.M. Choudary S. Madhi N.S. Chowdari M.L. Kantam B. Sreedhar J. Am. Chem. Soc. 124 2002 14127 14132 [43] J. Zhao M. Shao D. Yan S. Zhang Z. Lu Z. Li X. Cao B. Wang M. Wei D.G. Evans X. Duan J. Mater. Chem. A 1 2013 5840 5846 [44] S. Singha M. Sahoo K.M. Parida Dalton Trans. 40 2011 7130 7132 [45] M. Baron O. Bondarchuk D. Stacchiola S. Shaikhutdinov H.-J. Freund J. Phys.Chem. C 113 2009 6042 6049 [46] K. Kovnir M. Armbrüster D. Teschner T. Venkov L. Szentmiklósi F. Jentoft A. Knop-Gericke Y. Grin R. Schlögl Surf. Sci. 603 2009 1784 1792 [47] C. Mohr P. Claus Sci. Prog. 84 2001 311 334 [48] S.E. Denmark G.L. Beutner Angew. Chem. Int. Ed. 47 2008 1560 1638 [49] U.K. Singh M.A. Vannice Appl. Catal. A: Gen. 213 2001 1 24 [50] Y. Tang D. Yang F. Qin J. Hu C. Wang H. Xu J. Solid State Chem. 182 2009 2279 2284 [51] M. Cerron-Alarcón B. Bachiller-Baeza A. Rodríguez-Ramos I. Rodríguez-Ramos J. Mol. Catal. A: Chem. 258 2006 221 230 [52] M.A. Aramendía V. Borau C. Jiménez J.M. Marinas A. Porras F.J. Urbano J. Catal. 172 1997 46 54 [53] Z. Wang R. Liu F. Zhao X. Liu M. Lv J. Meng Langmuir 26 2010 10135 10140 [54] A.M.R. Galletti L. Toniolo C. Antonetti C. Evangelisti C. Forte Appl. Catal. A: Gen. 447–448 2012 49 59 [55] J. Zhu M. Lu M. Li J. Zhu Y. Shan Chin. J. Chem. 29 2011 655 660 [56] C. Schmöger A. Stolle W. Bonrath B. Ondruschka T. Keller K.D. Jandt ChemSusChem 2 2009 77 82 [57] A.G. Boudjahem S. Monteverdi M. Mercy M.M. Bettahar J. Catal. 221 2004 325 334 [58] W.C. Conner Jr. J.L. Falconer Chem. Rev. 95 1995 759 788 [59] B. Coq F. Figueras J. Mol. Catal. A: Chem. 173 2001 117 134 [60] P. Liu J.K. Nørskova Phys. Chem. Chem. Phys. 3 2001 3814 3818",
      "scopus-id": "85029626478",
      "coredata": {
        "eid": "1-s2.0-S2468823117302328",
        "dc:description": "Because of sustainable development in the field of heterogeneous catalysis, it is of paramount importance to the design and synthesis of high-performance supported metal nanoparticle catalyst systems for various catalytic reactions. Herein, new carbon-supported bimetallic PdNi nanoparticles (NPs) were facilely synthesized using our developed “carbonization-in situ self reduction” strategy based on hybrid composite precursors of PdCl4 2−-containing Mg-Ni-Al layered double hydroxide and amorphous carbon (LDH-C) and employed for selective hydrogenation of citral. The incorporation of PdCl4 2− complex ions into the LDH structure facilitated the dispersion of Pd species, and subsequently highly dispersed bimetallic PdNi NPs could be formed on the support surface. The bimetallic PdNi nanocatalyst with the Pd/Ni mass ratio of 67:33 showed higher catalytic activity than supported monometallic counterparts prepared by the same method, which could be ascribed to a synergistic effect between Pd and Ni in PdNi NPs. Furthermore, as-formed supported bimetallic PdNi nanocatalyst possessed excellent structural stability, owing to strong metal-support interactions stemming from the perfectible hybrid nanostructure of LDH-C composite precursors.",
        "openArchiveArticle": "false",
        "prism:coverDate": "2017-07-31",
        "openaccessUserLicense": null,
        "prism:aggregationType": "Journal",
        "prism:url": "https://api.elsevier.com/content/article/pii/S2468823117302328",
        "dc:creator": [
          {
            "@_fa": "true",
            "$": "Liu, Chunling"
          },
          {
            "@_fa": "true",
            "$": "Nan, Chunshi"
          },
          {
            "@_fa": "true",
            "$": "Fan, Guoli"
          },
          {
            "@_fa": "true",
            "$": "Yang, Lan"
          },
          {
            "@_fa": "true",
            "$": "Li, Feng"
          }
        ],
        "link": [
          {
            "@_fa": "true",
            "@rel": "self",
            "@href": "https://api.elsevier.com/content/article/pii/S2468823117302328"
          },
          {
            "@_fa": "true",
            "@rel": "scidir",
            "@href": "https://www.sciencedirect.com/science/article/pii/S2468823117302328"
          }
        ],
        "dc:format": "application/json",
        "openaccessType": null,
        "pii": "S2468-8231(17)30232-8",
        "prism:volume": "436",
        "prism:publisher": "Elsevier B.V.",
        "dc:title": "Facile synthesis and synergistically acting catalytic performance of supported bimetallic PdNi nanoparticle catalysts for selective hydrogenation of citral",
        "prism:copyright": "© 2017 Elsevier B.V. All rights reserved.",
        "openaccess": "0",
        "prism:issn": "24688231",
        "dcterms:subject": [
          {
            "@_fa": "true",
            "$": "Bimetallic nanoparticles"
          },
          {
            "@_fa": "true",
            "$": "Synergistic effect"
          },
          {
            "@_fa": "true",
            "$": "Layered double hydroxide"
          },
          {
            "@_fa": "true",
            "$": "Selective hydrogenation"
          },
          {
            "@_fa": "true",
            "$": "Citral"
          }
        ],
        "openaccessArticle": "false",
        "prism:publicationName": "Molecular Catalysis",
        "openaccessSponsorType": null,
        "prism:pageRange": "237-247",
        "prism:endingPage": "247",
        "pubType": "fla",
        "prism:coverDisplayDate": "July 2017",
        "prism:doi": "10.1016/j.mcat.2017.04.025",
        "prism:startingPage": "237",
        "dc:identifier": "doi:10.1016/j.mcat.2017.04.025",
        "openaccessSponsorName": null
      },
      "objects": {
        "object": [
          {
            "@category": "thumbnail",
            "@height": "164",
            "@width": "201",
            "@_fa": "true",
            "$": "https://api.elsevier.com/content/object/eid/1-s2.0-S2468823117302328-fx1.sml?httpAccept=%2A%2F%2A",
            "@multimediatype": "GIF image file",
            "@type": "IMAGE-THUMBNAIL",
            "@size": "7192",
            "@ref": "fx1",
            "@mimetype": "image/gif"
          },
          {
            "@category": "thumbnail",
            "@height": "164",
            "@width": "175",
            "@_fa": "true",
            "$": "https://api.elsevier.com/content/object/eid/1-s2.0-S2468823117302328-gr1.sml?httpAccept=%2A%2F%2A",
            "@multimediatype": "GIF image file",
            "@type": "IMAGE-THUMBNAIL",
            "@size": "7040",
            "@ref": "gr1",
            "@mimetype": "image/gif"
          },
          {
            "@category": "thumbnail",
            "@height": "164",
            "@width": "197",
            "@_fa": "true",
            "$": "https://api.elsevier.com/content/object/eid/1-s2.0-S2468823117302328-gr10.sml?httpAccept=%2A%2F%2A",
            "@multimediatype": "GIF image file",
            "@type": "IMAGE-THUMBNAIL",
            "@size": "5970",
            "@ref": "gr10",
            "@mimetype": "image/gif"
          },
          {
            "@category": "thumbnail",
            "@height": "164",
            "@width": "211",
            "@_fa": "true",
            "$": "https://api.elsevier.com/content/object/eid/1-s2.0-S2468823117302328-gr11.sml?httpAccept=%2A%2F%2A",
            "@multimediatype": "GIF image file",
            "@type": "IMAGE-THUMBNAIL",
            "@size": "6140",
            "@ref": "gr11",
            "@mimetype": "image/gif"
          },
          {
            "@category": "thumbnail",
            "@height": "164",
            "@width": "148",
            "@_fa": "true",
            "$": "https://api.elsevier.com/content/object/eid/1-s2.0-S2468823117302328-gr2.sml?httpAccept=%2A%2F%2A",
            "@multimediatype": "GIF image file",
            "@type": "IMAGE-THUMBNAIL",
            "@size": "6452",
            "@ref": "gr2",
            "@mimetype": "image/gif"
          },
          {
            "@category": "thumbnail",
            "@height": "164",
            "@width": "109",
            "@_fa": "true",
            "$": "https://api.elsevier.com/content/object/eid/1-s2.0-S2468823117302328-gr3.sml?httpAccept=%2A%2F%2A",
            "@multimediatype": "GIF image file",
            "@type": "IMAGE-THUMBNAIL",
            "@size": "13141",
            "@ref": "gr3",
            "@mimetype": "image/gif"
          },
          {
            "@category": "thumbnail",
            "@height": "164",
            "@width": "146",
            "@_fa": "true",
            "$": "https://api.elsevier.com/content/object/eid/1-s2.0-S2468823117302328-gr4.sml?httpAccept=%2A%2F%2A",
            "@multimediatype": "GIF image file",
            "@type": "IMAGE-THUMBNAIL",
            "@size": "7091",
            "@ref": "gr4",
            "@mimetype": "image/gif"
          },
          {
            "@category": "thumbnail",
            "@height": "163",
            "@width": "210",
            "@_fa": "true",
            "$": "https://api.elsevier.com/content/object/eid/1-s2.0-S2468823117302328-gr5.sml?httpAccept=%2A%2F%2A",
            "@multimediatype": "GIF image file",
            "@type": "IMAGE-THUMBNAIL",
            "@size": "18001",
            "@ref": "gr5",
            "@mimetype": "image/gif"
          },
          {
            "@category": "thumbnail",
            "@height": "163",
            "@width": "169",
            "@_fa": "true",
            "$": "https://api.elsevier.com/content/object/eid/1-s2.0-S2468823117302328-gr6.sml?httpAccept=%2A%2F%2A",
            "@multimediatype": "GIF image file",
            "@type": "IMAGE-THUMBNAIL",
            "@size": "8228",
            "@ref": "gr6",
            "@mimetype": "image/gif"
          },
          {
            "@category": "thumbnail",
            "@height": "164",
            "@width": "104",
            "@_fa": "true",
            "$": "https://api.elsevier.com/content/object/eid/1-s2.0-S2468823117302328-gr7.sml?httpAccept=%2A%2F%2A",
            "@multimediatype": "GIF image file",
            "@type": "IMAGE-THUMBNAIL",
            "@size": "5084",
            "@ref": "gr7",
            "@mimetype": "image/gif"
          },
          {
            "@category": "thumbnail",
            "@height": "164",
            "@width": "208",
            "@_fa": "true",
            "$": "https://api.elsevier.com/content/object/eid/1-s2.0-S2468823117302328-gr8.sml?httpAccept=%2A%2F%2A",
            "@multimediatype": "GIF image file",
            "@type": "IMAGE-THUMBNAIL",
            "@size": "5946",
            "@ref": "gr8",
            "@mimetype": "image/gif"
          },
          {
            "@category": "thumbnail",
            "@height": "164",
            "@width": "188",
            "@_fa": "true",
            "$": "https://api.elsevier.com/content/object/eid/1-s2.0-S2468823117302328-gr9.sml?httpAccept=%2A%2F%2A",
            "@multimediatype": "GIF image file",
            "@type": "IMAGE-THUMBNAIL",
            "@size": "7168",
            "@ref": "gr9",
            "@mimetype": "image/gif"
          },
          {
            "@category": "thumbnail",
            "@height": "121",
            "@width": "219",
            "@_fa": "true",
            "$": "https://api.elsevier.com/content/object/eid/1-s2.0-S2468823117302328-sc1.sml?httpAccept=%2A%2F%2A",
            "@multimediatype": "GIF image file",
            "@type": "IMAGE-THUMBNAIL",
            "@size": "3427",
            "@ref": "sc1",
            "@mimetype": "image/gif"
          },
          {
            "@category": "standard",
            "@height": "245",
            "@width": "301",
            "@_fa": "true",
            "$": "https://api.elsevier.com/content/object/eid/1-s2.0-S2468823117302328-fx1.jpg?httpAccept=%2A%2F%2A",
            "@multimediatype": "JPEG image file",
            "@type": "IMAGE-DOWNSAMPLED",
            "@size": "16795",
            "@ref": "fx1",
            "@mimetype": "image/jpeg"
          },
          {
            "@category": "standard",
            "@height": "317",
            "@width": "339",
            "@_fa": "true",
            "$": "https://api.elsevier.com/content/object/eid/1-s2.0-S2468823117302328-gr1.jpg?httpAccept=%2A%2F%2A",
            "@multimediatype": "JPEG image file",
            "@type": "IMAGE-DOWNSAMPLED",
            "@size": "29568",
            "@ref": "gr1",
            "@mimetype": "image/jpeg"
          },
          {
            "@category": "standard",
            "@height": "283",
            "@width": "339",
            "@_fa": "true",
            "$": "https://api.elsevier.com/content/object/eid/1-s2.0-S2468823117302328-gr10.jpg?httpAccept=%2A%2F%2A",
            "@multimediatype": "JPEG image file",
            "@type": "IMAGE-DOWNSAMPLED",
            "@size": "20497",
            "@ref": "gr10",
            "@mimetype": "image/jpeg"
          },
          {
            "@category": "standard",
            "@height": "291",
            "@width": "376",
            "@_fa": "true",
            "$": "https://api.elsevier.com/content/object/eid/1-s2.0-S2468823117302328-gr11.jpg?httpAccept=%2A%2F%2A",
            "@multimediatype": "JPEG image file",
            "@type": "IMAGE-DOWNSAMPLED",
            "@size": "21017",
            "@ref": "gr11",
            "@mimetype": "image/jpeg"
          },
          {
            "@category": "standard",
            "@height": "375",
            "@width": "339",
            "@_fa": "true",
            "$": "https://api.elsevier.com/content/object/eid/1-s2.0-S2468823117302328-gr2.jpg?httpAccept=%2A%2F%2A",
            "@multimediatype": "JPEG image file",
            "@type": "IMAGE-DOWNSAMPLED",
            "@size": "33533",
            "@ref": "gr2",
            "@mimetype": "image/jpeg"
          },
          {
            "@category": "standard",
            "@height": "962",
            "@width": "640",
            "@_fa": "true",
            "$": "https://api.elsevier.com/content/object/eid/1-s2.0-S2468823117302328-gr3.jpg?httpAccept=%2A%2F%2A",
            "@multimediatype": "JPEG image file",
            "@type": "IMAGE-DOWNSAMPLED",
            "@size": "280810",
            "@ref": "gr3",
            "@mimetype": "image/jpeg"
          },
          {
            "@category": "standard",
            "@height": "421",
            "@width": "376",
            "@_fa": "true",
            "$": "https://api.elsevier.com/content/object/eid/1-s2.0-S2468823117302328-gr4.jpg?httpAccept=%2A%2F%2A",
            "@multimediatype": "JPEG image file",
            "@type": "IMAGE-DOWNSAMPLED",
            "@size": "43148",
            "@ref": "gr4",
            "@mimetype": "image/jpeg"
          },
          {
            "@category": "standard",
            "@height": "513",
            "@width": "659",
            "@_fa": "true",
            "$": "https://api.elsevier.com/content/object/eid/1-s2.0-S2468823117302328-gr5.jpg?httpAccept=%2A%2F%2A",
            "@multimediatype": "JPEG image file",
            "@type": "IMAGE-DOWNSAMPLED",
            "@size": "87763",
            "@ref": "gr5",
            "@mimetype": "image/jpeg"
          },
          {
            "@category": "standard",
            "@height": "328",
            "@width": "339",
            "@_fa": "true",
            "$": "https://api.elsevier.com/content/object/eid/1-s2.0-S2468823117302328-gr6.jpg?httpAccept=%2A%2F%2A",
            "@multimediatype": "JPEG image file",
            "@type": "IMAGE-DOWNSAMPLED",
            "@size": "35222",
            "@ref": "gr6",
            "@mimetype": "image/jpeg"
          },
          {
            "@category": "standard",
            "@height": "978",
            "@width": "621",
            "@_fa": "true",
            "$": "https://api.elsevier.com/content/object/eid/1-s2.0-S2468823117302328-gr7.jpg?httpAccept=%2A%2F%2A",
            "@multimediatype": "JPEG image file",
            "@type": "IMAGE-DOWNSAMPLED",
            "@size": "117145",
            "@ref": "gr7",
            "@mimetype": "image/jpeg"
          },
          {
            "@category": "standard",
            "@height": "296",
            "@width": "376",
            "@_fa": "true",
            "$": "https://api.elsevier.com/content/object/eid/1-s2.0-S2468823117302328-gr8.jpg?httpAccept=%2A%2F%2A",
            "@multimediatype": "JPEG image file",
            "@type": "IMAGE-DOWNSAMPLED",
            "@size": "21075",
            "@ref": "gr8",
            "@mimetype": "image/jpeg"
          },
          {
            "@category": "standard",
            "@height": "295",
            "@width": "339",
            "@_fa": "true",
            "$": "https://api.elsevier.com/content/object/eid/1-s2.0-S2468823117302328-gr9.jpg?httpAccept=%2A%2F%2A",
            "@multimediatype": "JPEG image file",
            "@type": "IMAGE-DOWNSAMPLED",
            "@size": "22429",
            "@ref": "gr9",
            "@mimetype": "image/jpeg"
          },
          {
            "@category": "standard",
            "@height": "271",
            "@width": "489",
            "@_fa": "true",
            "$": "https://api.elsevier.com/content/object/eid/1-s2.0-S2468823117302328-sc1.jpg?httpAccept=%2A%2F%2A",
            "@multimediatype": "JPEG image file",
            "@type": "IMAGE-DOWNSAMPLED",
            "@size": "15450",
            "@ref": "sc1",
            "@mimetype": "image/jpeg"
          },
          {
            "@category": "thumbnail",
            "@height": "65",
            "@width": "349",
            "@_fa": "true",
            "$": "https://api.elsevier.com/content/object/eid/1-s2.0-S2468823117302328-si1.gif?httpAccept=%2A%2F%2A",
            "@multimediatype": "GIF image file",
            "@type": "ALTIMG",
            "@size": "4128",
            "@ref": "si1",
            "@mimetype": "image/gif"
          }
        ]
      },
      "link": {
        "@rel": "abstract",
        "@href": "https://api.elsevier.com/content/abstract/scopus_id/85029626478"
      }
    }
  }
}