{
  "metadata": {
    "title": "Highly selective hydrogenation of phenol to cyclohexanol over nano silica supported Ni catalysts in aqueous medium",
    "authors": "; ; ",
    "journal": "Molecular Catalysis",
    "date": "2017-10-31",
    "doi": "10.1016/j.mcat.2017.07.016",
    "abstract": "",
    "uri": "https://api.elsevier.com/content/article/pii/S2468823117304066",
    "pii": "S2468823117304066"
  },
  "fulltext": {
    "full-text-retrieval-response": {
      "scopus-eid": "2-s2.0-85029586422",
      "originalText": "serial JL 315758 291210 291744 291790 291809 31 Molecular Catalysis MOLECULARCATALYSIS 2017-08-05 2017-08-05 2017-08-05 2017-08-05 2018-07-09T20:04:52 1-s2.0-S2468823117304066 S2468-8231(17)30406-6 S2468823117304066 10.1016/j.mcat.2017.07.016 S300 S300.2 FULL-TEXT 1-s2.0-S2468823117X0014X 2025-07-16T18:54:01.246284Z 0 0 20171001 20171031 2017 2017-08-05T02:16:11.244663Z absattachment articleinfo articletitlenorm authfirstinitialnorm authfirstsurnamenorm cid cids contenttype copyright crossmark dateloaded dateloadedtxt datesearch datesort dateupdated dco docsubtype doctype doi eid ewtransactionid hubeid indexeddate issn issnnorm itemstage itemtransactionid itemweight openaccess openarchive pg pgfirst pglast pii piinorm pubdateend pubdatestart pubdatetxt pubyr sectiontitle sortorder srctitle srctitlenorm srctype ssids alllist content subj subheadings suppl tomb volfirst volissue volumelist webpdf webpdfpagecount yearnav figure table body mmlmath acknowledge affil articletitle auth authfirstini authfull authkeywords authlast grantnumber grantsponsor grantsponsorid highlightsabst primabst pubtype ref specialabst 2468-8231 24688231 true 440 440 C Volume 440 13 87 95 87 95 201710 October 2017 2017-10-01 2017-10-31 2017 Regular Papers article fla © 2017 Elsevier B.V. All rights reserved. HIGHLYSELECTIVEHYDROGENATIONPHENOLCYCLOHEXANOLOVERNANOSILICASUPPORTEDNICATALYSTSINAQUEOUSMEDIUM HE J 1 Introduction 2 Experimental 2.1 Materials 2.2 Preparation of catalysts 2.3 Characterization of catalyst 2.4 Catalytic activity tests 3 Results and discussion 3.1 Catalyst characterization 3.2 Catalytic hydrogenation of phenol 4 Conclusion Acknowledgements References ZHANG 2014 1793 1799 Q XIANG 2008 939 943 Y XIANG 2014 2197 2203 Y SONG 2016 94 98 Z SIKHWIVHILU 2007 52 61 L LONG 2015 570 577 J LIN 2015 4121 4129 C CHATTERJEE 2009 1912 1924 M FRIDMAN 2000 20 30 V MAHATA 2001 2712 2719 N WANG 2011 2362 2365 Y MATOS 2011 103 112 J LI 2013 2440 2448 Z CHARY 2007 471 477 K NELSON 2015 2051 2061 N PEREZ 2011 1071 1074 Y LI 2015 2009 2016 G YOON 2014 10287 10298 Y NAKAGAWA 2014 2197 2203 Y WANG 2015 2727 2734 L ERTAS 2015 209 220 I RODE 2003 1960 C LI 2008 3235 3241 H WANG 2011 2362 2365 Y YANG 2013 1932 1940 Y LU 2016 15354 15361 X RODRIGUEZ 2013 162 169 J NIE 2016 1913 1920 R LIANG 2014 468 476 G LU 2015 196 206 X XIA 2003 74 84 Q XIA 2001 255 262 Q MOHAN 2014 9660 9668 V HOU 2003 121 127 Z CZEKAJ 2007 68 78 I YAN 2013 12132 12138 X MA 2013 430 438 Q MORTENSEN 2013 1774 1785 P DIMONDO 2013 6541 6554 D HEX2017X87 HEX2017X87X95 HEX2017X87XJ HEX2017X87X95XJ 2019-08-05T00:00:00Z http://creativecommons.org/licenses/by-nc-nd/4.0/ © 2017 Elsevier B.V. All rights reserved. item S2468-8231(17)30406-6 S2468823117304066 1-s2.0-S2468823117304066 10.1016/j.mcat.2017.07.016 315758 2018-07-09T21:52:14.11984Z 2017-10-01 2017-10-31 1-s2.0-S2468823117304066-main.pdf https://s3-eu-west-1.amazonaws.com/prod-ucs-content-store-eu-west/content/pii:S2468823117304066/MAIN/application/pdf/119e523c537e2310d75918e24bb59773/main.pdf https://s3.amazonaws.com/prod-ucs-content-store-us-east/content/pii:S2468823117304066/MAIN/application/pdf/119e523c537e2310d75918e24bb59773/main.pdf main.pdf pdf true 3967683 MAIN 9 1-s2.0-S2468823117304066-main_1.png https://s3-eu-west-1.amazonaws.com/prod-ucs-content-store-eu-west/content/pii:S2468823117304066/PREVIEW/image/png/f9d3f70f5cfd7f073467110693040320/main_1.png https://s3.amazonaws.com/prod-ucs-content-store-us-east/content/pii:S2468823117304066/PREVIEW/image/png/f9d3f70f5cfd7f073467110693040320/main_1.png main_1.png png 59166 849 656 IMAGE-WEB-PDF 1 1-s2.0-S2468823117304066-fx1.sml https://s3-eu-west-1.amazonaws.com/prod-ucs-content-store-eu-west/content/pii:S2468823117304066/fx1/THUMBNAIL/image/gif/3bd298260a39f9688370da24f43f73c9/fx1.sml https://s3.amazonaws.com/prod-ucs-content-store-us-east/content/pii:S2468823117304066/fx1/THUMBNAIL/image/gif/3bd298260a39f9688370da24f43f73c9/fx1.sml fx1 true fx1.sml sml 4583 88 219 IMAGE-THUMBNAIL 1-s2.0-S2468823117304066-fx10.sml https://s3-eu-west-1.amazonaws.com/prod-ucs-content-store-eu-west/content/pii:S2468823117304066/fx10/THUMBNAIL/image/gif/cd0ff469d10fc07e0da0257a868d480d/fx10.sml https://s3.amazonaws.com/prod-ucs-content-store-us-east/content/pii:S2468823117304066/fx10/THUMBNAIL/image/gif/cd0ff469d10fc07e0da0257a868d480d/fx10.sml fx10 fx10.sml sml 3400 88 219 IMAGE-THUMBNAIL 1-s2.0-S2468823117304066-fx11.sml https://s3-eu-west-1.amazonaws.com/prod-ucs-content-store-eu-west/content/pii:S2468823117304066/fx11/THUMBNAIL/image/gif/841d8ce0219b021ba460e17ed3fbca3d/fx11.sml https://s3.amazonaws.com/prod-ucs-content-store-us-east/content/pii:S2468823117304066/fx11/THUMBNAIL/image/gif/841d8ce0219b021ba460e17ed3fbca3d/fx11.sml fx11 fx11.sml sml 2871 88 219 IMAGE-THUMBNAIL 1-s2.0-S2468823117304066-fx2.sml https://s3-eu-west-1.amazonaws.com/prod-ucs-content-store-eu-west/content/pii:S2468823117304066/fx2/THUMBNAIL/image/gif/24d2cc9bd0f45519f61c15ab10cdac70/fx2.sml https://s3.amazonaws.com/prod-ucs-content-store-us-east/content/pii:S2468823117304066/fx2/THUMBNAIL/image/gif/24d2cc9bd0f45519f61c15ab10cdac70/fx2.sml fx2 fx2.sml sml 4053 88 219 IMAGE-THUMBNAIL 1-s2.0-S2468823117304066-fx3.sml https://s3-eu-west-1.amazonaws.com/prod-ucs-content-store-eu-west/content/pii:S2468823117304066/fx3/THUMBNAIL/image/gif/44c28307749a046fe293ee03dc499bb5/fx3.sml https://s3.amazonaws.com/prod-ucs-content-store-us-east/content/pii:S2468823117304066/fx3/THUMBNAIL/image/gif/44c28307749a046fe293ee03dc499bb5/fx3.sml fx3 fx3.sml sml 3900 88 219 IMAGE-THUMBNAIL 1-s2.0-S2468823117304066-fx4.sml https://s3-eu-west-1.amazonaws.com/prod-ucs-content-store-eu-west/content/pii:S2468823117304066/fx4/THUMBNAIL/image/gif/a1f6c850541b818986c5488bc542b98d/fx4.sml https://s3.amazonaws.com/prod-ucs-content-store-us-east/content/pii:S2468823117304066/fx4/THUMBNAIL/image/gif/a1f6c850541b818986c5488bc542b98d/fx4.sml fx4 fx4.sml sml 3118 88 219 IMAGE-THUMBNAIL 1-s2.0-S2468823117304066-fx5.sml https://s3-eu-west-1.amazonaws.com/prod-ucs-content-store-eu-west/content/pii:S2468823117304066/fx5/THUMBNAIL/image/gif/a5afc158d659bbabac9424042f30322a/fx5.sml https://s3.amazonaws.com/prod-ucs-content-store-us-east/content/pii:S2468823117304066/fx5/THUMBNAIL/image/gif/a5afc158d659bbabac9424042f30322a/fx5.sml fx5 fx5.sml sml 3765 88 219 IMAGE-THUMBNAIL 1-s2.0-S2468823117304066-fx6.sml https://s3-eu-west-1.amazonaws.com/prod-ucs-content-store-eu-west/content/pii:S2468823117304066/fx6/THUMBNAIL/image/gif/6098d6beadb6e2f0513da60ad8dc761a/fx6.sml https://s3.amazonaws.com/prod-ucs-content-store-us-east/content/pii:S2468823117304066/fx6/THUMBNAIL/image/gif/6098d6beadb6e2f0513da60ad8dc761a/fx6.sml fx6 fx6.sml sml 3169 88 219 IMAGE-THUMBNAIL 1-s2.0-S2468823117304066-fx7.sml https://s3-eu-west-1.amazonaws.com/prod-ucs-content-store-eu-west/content/pii:S2468823117304066/fx7/THUMBNAIL/image/gif/2132dc4e885b670ae2d819a37a14d240/fx7.sml https://s3.amazonaws.com/prod-ucs-content-store-us-east/content/pii:S2468823117304066/fx7/THUMBNAIL/image/gif/2132dc4e885b670ae2d819a37a14d240/fx7.sml fx7 fx7.sml sml 3500 88 219 IMAGE-THUMBNAIL 1-s2.0-S2468823117304066-fx8.sml https://s3-eu-west-1.amazonaws.com/prod-ucs-content-store-eu-west/content/pii:S2468823117304066/fx8/THUMBNAIL/image/gif/3709517b54858baa54a2caa2583bfcbe/fx8.sml https://s3.amazonaws.com/prod-ucs-content-store-us-east/content/pii:S2468823117304066/fx8/THUMBNAIL/image/gif/3709517b54858baa54a2caa2583bfcbe/fx8.sml fx8 fx8.sml sml 3428 88 219 IMAGE-THUMBNAIL 1-s2.0-S2468823117304066-fx9.sml https://s3-eu-west-1.amazonaws.com/prod-ucs-content-store-eu-west/content/pii:S2468823117304066/fx9/THUMBNAIL/image/gif/34abdcb601874c3d46fbfdcf79bae1c5/fx9.sml https://s3.amazonaws.com/prod-ucs-content-store-us-east/content/pii:S2468823117304066/fx9/THUMBNAIL/image/gif/34abdcb601874c3d46fbfdcf79bae1c5/fx9.sml fx9 fx9.sml sml 2833 88 219 IMAGE-THUMBNAIL 1-s2.0-S2468823117304066-gr1.sml https://s3-eu-west-1.amazonaws.com/prod-ucs-content-store-eu-west/content/pii:S2468823117304066/gr1/THUMBNAIL/image/gif/77768d6d37193e28c586b2ee05d14b97/gr1.sml https://s3.amazonaws.com/prod-ucs-content-store-us-east/content/pii:S2468823117304066/gr1/THUMBNAIL/image/gif/77768d6d37193e28c586b2ee05d14b97/gr1.sml gr1 gr1.sml sml 7858 164 155 IMAGE-THUMBNAIL 1-s2.0-S2468823117304066-gr10.sml https://s3-eu-west-1.amazonaws.com/prod-ucs-content-store-eu-west/content/pii:S2468823117304066/gr10/THUMBNAIL/image/gif/3d3dcd901b5d4fd2594d593330b83e83/gr10.sml https://s3.amazonaws.com/prod-ucs-content-store-us-east/content/pii:S2468823117304066/gr10/THUMBNAIL/image/gif/3d3dcd901b5d4fd2594d593330b83e83/gr10.sml gr10 gr10.sml sml 7264 164 174 IMAGE-THUMBNAIL 1-s2.0-S2468823117304066-gr2.sml https://s3-eu-west-1.amazonaws.com/prod-ucs-content-store-eu-west/content/pii:S2468823117304066/gr2/THUMBNAIL/image/gif/06baebf2973e1463cdfd9be17430654a/gr2.sml https://s3.amazonaws.com/prod-ucs-content-store-us-east/content/pii:S2468823117304066/gr2/THUMBNAIL/image/gif/06baebf2973e1463cdfd9be17430654a/gr2.sml gr2 gr2.sml sml 8248 164 156 IMAGE-THUMBNAIL 1-s2.0-S2468823117304066-gr3.sml https://s3-eu-west-1.amazonaws.com/prod-ucs-content-store-eu-west/content/pii:S2468823117304066/gr3/THUMBNAIL/image/gif/5a192572a1cc6be00b6a94d5c314de3c/gr3.sml https://s3.amazonaws.com/prod-ucs-content-store-us-east/content/pii:S2468823117304066/gr3/THUMBNAIL/image/gif/5a192572a1cc6be00b6a94d5c314de3c/gr3.sml gr3 gr3.sml sml 16275 132 219 IMAGE-THUMBNAIL 1-s2.0-S2468823117304066-gr4.sml https://s3-eu-west-1.amazonaws.com/prod-ucs-content-store-eu-west/content/pii:S2468823117304066/gr4/THUMBNAIL/image/gif/162532f52999863dc4e3f205073a87c9/gr4.sml https://s3.amazonaws.com/prod-ucs-content-store-us-east/content/pii:S2468823117304066/gr4/THUMBNAIL/image/gif/162532f52999863dc4e3f205073a87c9/gr4.sml gr4 gr4.sml sml 23036 146 219 IMAGE-THUMBNAIL 1-s2.0-S2468823117304066-gr5.sml https://s3-eu-west-1.amazonaws.com/prod-ucs-content-store-eu-west/content/pii:S2468823117304066/gr5/THUMBNAIL/image/gif/ff4001b69fdedac03a43628bc01ac9fb/gr5.sml https://s3.amazonaws.com/prod-ucs-content-store-us-east/content/pii:S2468823117304066/gr5/THUMBNAIL/image/gif/ff4001b69fdedac03a43628bc01ac9fb/gr5.sml gr5 gr5.sml sml 9133 164 132 IMAGE-THUMBNAIL 1-s2.0-S2468823117304066-gr6.sml https://s3-eu-west-1.amazonaws.com/prod-ucs-content-store-eu-west/content/pii:S2468823117304066/gr6/THUMBNAIL/image/gif/e746108da73b8e71c50bafcf39011837/gr6.sml https://s3.amazonaws.com/prod-ucs-content-store-us-east/content/pii:S2468823117304066/gr6/THUMBNAIL/image/gif/e746108da73b8e71c50bafcf39011837/gr6.sml gr6 gr6.sml sml 5614 164 163 IMAGE-THUMBNAIL 1-s2.0-S2468823117304066-gr7.sml https://s3-eu-west-1.amazonaws.com/prod-ucs-content-store-eu-west/content/pii:S2468823117304066/gr7/THUMBNAIL/image/gif/2a258b7720959b8bcd4da1e6f9dbf688/gr7.sml https://s3.amazonaws.com/prod-ucs-content-store-us-east/content/pii:S2468823117304066/gr7/THUMBNAIL/image/gif/2a258b7720959b8bcd4da1e6f9dbf688/gr7.sml gr7 gr7.sml sml 5646 164 187 IMAGE-THUMBNAIL 1-s2.0-S2468823117304066-gr8.sml https://s3-eu-west-1.amazonaws.com/prod-ucs-content-store-eu-west/content/pii:S2468823117304066/gr8/THUMBNAIL/image/gif/11d52a921f650141c82dc0d7fc4c75bf/gr8.sml https://s3.amazonaws.com/prod-ucs-content-store-us-east/content/pii:S2468823117304066/gr8/THUMBNAIL/image/gif/11d52a921f650141c82dc0d7fc4c75bf/gr8.sml gr8 gr8.sml sml 5777 164 192 IMAGE-THUMBNAIL 1-s2.0-S2468823117304066-gr9.sml https://s3-eu-west-1.amazonaws.com/prod-ucs-content-store-eu-west/content/pii:S2468823117304066/gr9/THUMBNAIL/image/gif/c645ca686a48aed6a324dbf3b8de5af2/gr9.sml https://s3.amazonaws.com/prod-ucs-content-store-us-east/content/pii:S2468823117304066/gr9/THUMBNAIL/image/gif/c645ca686a48aed6a324dbf3b8de5af2/gr9.sml gr9 gr9.sml sml 5008 164 191 IMAGE-THUMBNAIL 1-s2.0-S2468823117304066-sc1.sml https://s3-eu-west-1.amazonaws.com/prod-ucs-content-store-eu-west/content/pii:S2468823117304066/sc1/THUMBNAIL/image/gif/261a3d597d24c58a04be52c9d321ba6f/sc1.sml https://s3.amazonaws.com/prod-ucs-content-store-us-east/content/pii:S2468823117304066/sc1/THUMBNAIL/image/gif/261a3d597d24c58a04be52c9d321ba6f/sc1.sml sc1 sc1.sml sml 8493 142 219 IMAGE-THUMBNAIL 1-s2.0-S2468823117304066-fx1.jpg https://s3-eu-west-1.amazonaws.com/prod-ucs-content-store-eu-west/content/pii:S2468823117304066/fx1/DOWNSAMPLED/image/jpeg/349a4d483f7b7192c896abf9a9866dff/fx1.jpg https://s3.amazonaws.com/prod-ucs-content-store-us-east/content/pii:S2468823117304066/fx1/DOWNSAMPLED/image/jpeg/349a4d483f7b7192c896abf9a9866dff/fx1.jpg fx1 true fx1.jpg jpg 19302 200 500 IMAGE-DOWNSAMPLED 1-s2.0-S2468823117304066-fx10.jpg https://s3-eu-west-1.amazonaws.com/prod-ucs-content-store-eu-west/content/pii:S2468823117304066/fx10/DOWNSAMPLED/image/jpeg/5438f5ae5d241f4ac3be5440537ddc5e/fx10.jpg https://s3.amazonaws.com/prod-ucs-content-store-us-east/content/pii:S2468823117304066/fx10/DOWNSAMPLED/image/jpeg/5438f5ae5d241f4ac3be5440537ddc5e/fx10.jpg fx10 fx10.jpg jpg 8691 200 500 IMAGE-DOWNSAMPLED 1-s2.0-S2468823117304066-fx11.jpg https://s3-eu-west-1.amazonaws.com/prod-ucs-content-store-eu-west/content/pii:S2468823117304066/fx11/DOWNSAMPLED/image/jpeg/8b1f26335fbcbcb812db513cef468b6f/fx11.jpg https://s3.amazonaws.com/prod-ucs-content-store-us-east/content/pii:S2468823117304066/fx11/DOWNSAMPLED/image/jpeg/8b1f26335fbcbcb812db513cef468b6f/fx11.jpg fx11 fx11.jpg jpg 6972 200 500 IMAGE-DOWNSAMPLED 1-s2.0-S2468823117304066-fx2.jpg https://s3-eu-west-1.amazonaws.com/prod-ucs-content-store-eu-west/content/pii:S2468823117304066/fx2/DOWNSAMPLED/image/jpeg/645dda6b5e8a19f9af812e8a6c62887b/fx2.jpg https://s3.amazonaws.com/prod-ucs-content-store-us-east/content/pii:S2468823117304066/fx2/DOWNSAMPLED/image/jpeg/645dda6b5e8a19f9af812e8a6c62887b/fx2.jpg fx2 fx2.jpg jpg 9843 200 500 IMAGE-DOWNSAMPLED 1-s2.0-S2468823117304066-fx3.jpg https://s3-eu-west-1.amazonaws.com/prod-ucs-content-store-eu-west/content/pii:S2468823117304066/fx3/DOWNSAMPLED/image/jpeg/34af9eebbf6e0e2bae45717c852062aa/fx3.jpg https://s3.amazonaws.com/prod-ucs-content-store-us-east/content/pii:S2468823117304066/fx3/DOWNSAMPLED/image/jpeg/34af9eebbf6e0e2bae45717c852062aa/fx3.jpg fx3 fx3.jpg jpg 9901 200 500 IMAGE-DOWNSAMPLED 1-s2.0-S2468823117304066-fx4.jpg https://s3-eu-west-1.amazonaws.com/prod-ucs-content-store-eu-west/content/pii:S2468823117304066/fx4/DOWNSAMPLED/image/jpeg/d8cf0e03c49d74d2fb3e071e2afe8ac9/fx4.jpg https://s3.amazonaws.com/prod-ucs-content-store-us-east/content/pii:S2468823117304066/fx4/DOWNSAMPLED/image/jpeg/d8cf0e03c49d74d2fb3e071e2afe8ac9/fx4.jpg fx4 fx4.jpg jpg 7913 200 500 IMAGE-DOWNSAMPLED 1-s2.0-S2468823117304066-fx5.jpg https://s3-eu-west-1.amazonaws.com/prod-ucs-content-store-eu-west/content/pii:S2468823117304066/fx5/DOWNSAMPLED/image/jpeg/df8da26e4d88641e37363c086b735bde/fx5.jpg https://s3.amazonaws.com/prod-ucs-content-store-us-east/content/pii:S2468823117304066/fx5/DOWNSAMPLED/image/jpeg/df8da26e4d88641e37363c086b735bde/fx5.jpg fx5 fx5.jpg jpg 10211 200 500 IMAGE-DOWNSAMPLED 1-s2.0-S2468823117304066-fx6.jpg https://s3-eu-west-1.amazonaws.com/prod-ucs-content-store-eu-west/content/pii:S2468823117304066/fx6/DOWNSAMPLED/image/jpeg/851564cebd6b882ce4bce6d1dd690cb7/fx6.jpg https://s3.amazonaws.com/prod-ucs-content-store-us-east/content/pii:S2468823117304066/fx6/DOWNSAMPLED/image/jpeg/851564cebd6b882ce4bce6d1dd690cb7/fx6.jpg fx6 fx6.jpg jpg 8115 200 500 IMAGE-DOWNSAMPLED 1-s2.0-S2468823117304066-fx7.jpg https://s3-eu-west-1.amazonaws.com/prod-ucs-content-store-eu-west/content/pii:S2468823117304066/fx7/DOWNSAMPLED/image/jpeg/8e67e5a85baa6468cb49798e58f49b99/fx7.jpg https://s3.amazonaws.com/prod-ucs-content-store-us-east/content/pii:S2468823117304066/fx7/DOWNSAMPLED/image/jpeg/8e67e5a85baa6468cb49798e58f49b99/fx7.jpg fx7 fx7.jpg jpg 8056 200 500 IMAGE-DOWNSAMPLED 1-s2.0-S2468823117304066-fx8.jpg https://s3-eu-west-1.amazonaws.com/prod-ucs-content-store-eu-west/content/pii:S2468823117304066/fx8/DOWNSAMPLED/image/jpeg/8ad4b65c76ccd8a948e40b7c705ac9d4/fx8.jpg https://s3.amazonaws.com/prod-ucs-content-store-us-east/content/pii:S2468823117304066/fx8/DOWNSAMPLED/image/jpeg/8ad4b65c76ccd8a948e40b7c705ac9d4/fx8.jpg fx8 fx8.jpg jpg 8330 200 500 IMAGE-DOWNSAMPLED 1-s2.0-S2468823117304066-fx9.jpg https://s3-eu-west-1.amazonaws.com/prod-ucs-content-store-eu-west/content/pii:S2468823117304066/fx9/DOWNSAMPLED/image/jpeg/a68458932c2e74f4cb9f5e1a051d9efa/fx9.jpg https://s3.amazonaws.com/prod-ucs-content-store-us-east/content/pii:S2468823117304066/fx9/DOWNSAMPLED/image/jpeg/a68458932c2e74f4cb9f5e1a051d9efa/fx9.jpg fx9 fx9.jpg jpg 6803 200 500 IMAGE-DOWNSAMPLED 1-s2.0-S2468823117304066-gr1.jpg https://s3-eu-west-1.amazonaws.com/prod-ucs-content-store-eu-west/content/pii:S2468823117304066/gr1/DOWNSAMPLED/image/jpeg/cea35eb86de4795e4d307cf4b5050adf/gr1.jpg https://s3.amazonaws.com/prod-ucs-content-store-us-east/content/pii:S2468823117304066/gr1/DOWNSAMPLED/image/jpeg/cea35eb86de4795e4d307cf4b5050adf/gr1.jpg gr1 gr1.jpg jpg 139975 838 791 IMAGE-DOWNSAMPLED 1-s2.0-S2468823117304066-gr10.jpg https://s3-eu-west-1.amazonaws.com/prod-ucs-content-store-eu-west/content/pii:S2468823117304066/gr10/DOWNSAMPLED/image/jpeg/4682b0e19775b2faccff4e96382ddaa1/gr10.jpg https://s3.amazonaws.com/prod-ucs-content-store-us-east/content/pii:S2468823117304066/gr10/DOWNSAMPLED/image/jpeg/4682b0e19775b2faccff4e96382ddaa1/gr10.jpg gr10 gr10.jpg jpg 32436 354 376 IMAGE-DOWNSAMPLED 1-s2.0-S2468823117304066-gr2.jpg https://s3-eu-west-1.amazonaws.com/prod-ucs-content-store-eu-west/content/pii:S2468823117304066/gr2/DOWNSAMPLED/image/jpeg/bc94c5af84971138e8f0f6e23bf30cc0/gr2.jpg https://s3.amazonaws.com/prod-ucs-content-store-us-east/content/pii:S2468823117304066/gr2/DOWNSAMPLED/image/jpeg/bc94c5af84971138e8f0f6e23bf30cc0/gr2.jpg gr2 gr2.jpg jpg 45220 394 376 IMAGE-DOWNSAMPLED 1-s2.0-S2468823117304066-gr3.jpg https://s3-eu-west-1.amazonaws.com/prod-ucs-content-store-eu-west/content/pii:S2468823117304066/gr3/DOWNSAMPLED/image/jpeg/dc076573c7f0c26e8f7c978b0e09bb02/gr3.jpg https://s3.amazonaws.com/prod-ucs-content-store-us-east/content/pii:S2468823117304066/gr3/DOWNSAMPLED/image/jpeg/dc076573c7f0c26e8f7c978b0e09bb02/gr3.jpg gr3 gr3.jpg jpg 113623 408 678 IMAGE-DOWNSAMPLED 1-s2.0-S2468823117304066-gr4.jpg https://s3-eu-west-1.amazonaws.com/prod-ucs-content-store-eu-west/content/pii:S2468823117304066/gr4/DOWNSAMPLED/image/jpeg/e75a32e4cec7ac8baefa17c645e08317/gr4.jpg https://s3.amazonaws.com/prod-ucs-content-store-us-east/content/pii:S2468823117304066/gr4/DOWNSAMPLED/image/jpeg/e75a32e4cec7ac8baefa17c645e08317/gr4.jpg gr4 gr4.jpg jpg 104952 451 678 IMAGE-DOWNSAMPLED 1-s2.0-S2468823117304066-gr5.jpg https://s3-eu-west-1.amazonaws.com/prod-ucs-content-store-eu-west/content/pii:S2468823117304066/gr5/DOWNSAMPLED/image/jpeg/66ff06d904749528e6e97956df8eda9a/gr5.jpg https://s3.amazonaws.com/prod-ucs-content-store-us-east/content/pii:S2468823117304066/gr5/DOWNSAMPLED/image/jpeg/66ff06d904749528e6e97956df8eda9a/gr5.jpg gr5 gr5.jpg jpg 122028 819 659 IMAGE-DOWNSAMPLED 1-s2.0-S2468823117304066-gr6.jpg https://s3-eu-west-1.amazonaws.com/prod-ucs-content-store-eu-west/content/pii:S2468823117304066/gr6/DOWNSAMPLED/image/jpeg/bdd63c13263afe99d2b031d6452814d2/gr6.jpg https://s3.amazonaws.com/prod-ucs-content-store-us-east/content/pii:S2468823117304066/gr6/DOWNSAMPLED/image/jpeg/bdd63c13263afe99d2b031d6452814d2/gr6.jpg gr6 gr6.jpg jpg 29628 379 376 IMAGE-DOWNSAMPLED 1-s2.0-S2468823117304066-gr7.jpg https://s3-eu-west-1.amazonaws.com/prod-ucs-content-store-eu-west/content/pii:S2468823117304066/gr7/DOWNSAMPLED/image/jpeg/ca5f1f8bbafd3d589cfe1dfe0cb19b88/gr7.jpg https://s3.amazonaws.com/prod-ucs-content-store-us-east/content/pii:S2468823117304066/gr7/DOWNSAMPLED/image/jpeg/ca5f1f8bbafd3d589cfe1dfe0cb19b88/gr7.jpg gr7 gr7.jpg jpg 24998 329 376 IMAGE-DOWNSAMPLED 1-s2.0-S2468823117304066-gr8.jpg https://s3-eu-west-1.amazonaws.com/prod-ucs-content-store-eu-west/content/pii:S2468823117304066/gr8/DOWNSAMPLED/image/jpeg/2398ef146ac6ef6b219db9cb464b8741/gr8.jpg https://s3.amazonaws.com/prod-ucs-content-store-us-east/content/pii:S2468823117304066/gr8/DOWNSAMPLED/image/jpeg/2398ef146ac6ef6b219db9cb464b8741/gr8.jpg gr8 gr8.jpg jpg 24838 321 376 IMAGE-DOWNSAMPLED 1-s2.0-S2468823117304066-gr9.jpg https://s3-eu-west-1.amazonaws.com/prod-ucs-content-store-eu-west/content/pii:S2468823117304066/gr9/DOWNSAMPLED/image/jpeg/9fa9c9b4f4d199b05e76342a0aeb8b7d/gr9.jpg https://s3.amazonaws.com/prod-ucs-content-store-us-east/content/pii:S2468823117304066/gr9/DOWNSAMPLED/image/jpeg/9fa9c9b4f4d199b05e76342a0aeb8b7d/gr9.jpg gr9 gr9.jpg jpg 22301 323 376 IMAGE-DOWNSAMPLED 1-s2.0-S2468823117304066-sc1.jpg https://s3-eu-west-1.amazonaws.com/prod-ucs-content-store-eu-west/content/pii:S2468823117304066/sc1/DOWNSAMPLED/image/jpeg/df1253798b77bd49320e843f1c5c49a5/sc1.jpg https://s3.amazonaws.com/prod-ucs-content-store-us-east/content/pii:S2468823117304066/sc1/DOWNSAMPLED/image/jpeg/df1253798b77bd49320e843f1c5c49a5/sc1.jpg sc1 sc1.jpg jpg 24287 244 376 IMAGE-DOWNSAMPLED 1-s2.0-S2468823117304066-si1.gif https://s3-eu-west-1.amazonaws.com/prod-ucs-content-store-eu-west/content/pii:S2468823117304066/STRIPIN/image/gif/f3e22f35b4b11bde09ca7d64d2e5e38f/si1.gif https://s3.amazonaws.com/prod-ucs-content-store-us-east/content/pii:S2468823117304066/STRIPIN/image/gif/f3e22f35b4b11bde09ca7d64d2e5e38f/si1.gif si1 si1.gif gif 2344 40 446 ALTIMG 1-s2.0-S2468823117304066-si2.gif https://s3-eu-west-1.amazonaws.com/prod-ucs-content-store-eu-west/content/pii:S2468823117304066/STRIPIN/image/gif/08a80c06798f7468d4893b98441c73ce/si2.gif https://s3.amazonaws.com/prod-ucs-content-store-us-east/content/pii:S2468823117304066/STRIPIN/image/gif/08a80c06798f7468d4893b98441c73ce/si2.gif si2 si2.gif gif 2342 61 308 ALTIMG MCAT 259 S2468-8231(17)30406-6 10.1016/j.mcat.2017.07.016 Elsevier B.V. Scheme 1 The hydrogenated processes of phenol. Scheme 1 Fig. 1 N2 adsorption–desorption isotherms of 10%Ni/SiO2 (a—10%Ni/SiO2-1, b—10%Ni/SiO2-2, c—10%Ni/SiO2-3, d—10%Ni/SiO2-4, e—10%Ni/SiO2-5, f—10%Ni/SiO2-6). Fig. 1 Fig. 2 XRD patterns of 10%Ni/SiO2 (a—10%Ni/SiO2-1, b—10%Ni/SiO2-2, c—10%Ni/SiO2-3, d—10%Ni/SiO2-4, e—10%Ni/SiO2-5, f—10%Ni/SiO2-6). Fig. 2 Fig. 3 SEM images of 10%Ni/SiO2 catalysts (a—10%Ni/SiO2-1, b—10%Ni/SiO2-2, c—10%Ni/SiO2-3, d—10%Ni/SiO2-4, e—10%Ni/SiO2-5, f—10%Ni/SiO2-6). Fig. 3 Fig. 4 The TEM image of 10%Ni/SiO2 catalysts (a—10%Ni/SiO2-1, b—10%Ni/SiO2-2, c—10%Ni/SiO2-3, d—10%Ni/SiO2-4, e—10%Ni/SiO2-5, f—10%Ni/SiO2-6). Fig. 4 Fig. 5 Ni2p XPS spectra of 10%Ni/SiO2 (a—10%Ni/SiO2-1, b—10%Ni/SiO2-2, c—10%Ni/SiO2-3, d—10%Ni/SiO2-4, e—10%Ni/SiO2-5, f—10%Ni/SiO2-6). Fig. 5 Fig. 6 H2-TPR profiles of 10%Ni/SiO2 catalysts (a—10%Ni/SiO2-1, b—10%Ni/SiO2-2, c—10%Ni/SiO2-3, d—10%Ni/SiO2-4, e—10%Ni/SiO2-5). Fig. 6 Fig. 7 Effect of Ni loading on hydrogenation of phenol over Ni/SiO2-1. (Reaction conditions: phenol 5mmol, catalyst 100mg, 9.5g H2O, 200°C, 1.0MPa H2, 4h.). Fig. 7 Fig. 8 Effect of reaction temperature on hydrogenation of phenol over 10%Ni/SiO2-1. (Reaction conditions: phenol 5mmol, catalyst 100mg, 9.5g H2O, 1.0MPa H2, 4h.). Fig. 8 Fig. 9 Effect of reaction time on hydrogenation of phenol over 10%Ni/SiO2-1. (Reaction conditions: phenol 5mmol, catalyst 100mg, 9.5g H2O, 200°C, 1.0MPa H2.). Fig. 9 Fig. 10 Recycling of the catalyst 10%Ni/SiO2-1. (Reaction conditions: 10%Ni/SiO2-1 catalyst 100mg, 9.5g H2O, 200°C, 1.0MPa H2, 4h.). Fig. 10 Table 1 The structural and textural data of the supported Ni/SiO2 samples. Table 1 Catalyst Silicon Source Surface Area (m2 g−1) Pore Volume (cm3 g−1) Pore Radius (nm) 10%Ni/SiO2-1 Aerosil-200 215.6 0.998 8.771 10%Ni/SiO2-2 CT-200 202.5 0.926 8.747 10%Ni/SiO2-3 CT-150 161.2 0.985 8.638 10%Ni/SiO2-4 CT-380 338.7 0.913 8.732 10%Ni/SiO2-5 Gel silica 444.3 0.932 3.268 10%Ni/SiO2-6 AS-40 214.0 0.749 4.745 Table 2 Chemical compositions of different silica sources obtained by XPS. Table 2 Sample Relative Atomic Percentage (%) Ni0 NiO 10%Ni/SiO2-1 59.3 40.7 10%Ni/SiO2-2 35.2 64.8 10%Ni/SiO2-3 32.0 68.0 10%Ni/SiO2-4 9.0 91.0 10%Ni/SiO2-5 13.9 86.1 10%Ni/SiO2-6 4.8 95.2 Table 3 Hydrogenation of phenol over different supported Ni catalysts. Table 3 Catalyst Conversion (mol%) Selectivity (%) Cyclohexanol Cyclohexanone Raney Ni 100 92.5 7.5 10%Ni/SiO2 a 100 43.2 56.8 10%Ni/SiO2-1 100 100 0 10%Ni/SiO2-2 100 95.2 4.8 10%Ni/SiO2-3 81.5 90.2 9.8 10%Ni/SiO2-4 78.7 94.6 5.4 10%Ni/SiO2-5 69.0 96.7 3.3 10%Ni/SiO2-6 38.5 88.6 11.4 Reaction conditions: phenol 5mmol, 100mg catalyst, 9.5g H2O, 200°C, 1.0MPa H2, 4h. a Purchased from Sigma-Aldrich. Table 4 The effect of different metals on the hydrogenation. Table 4 Catalyst Conversion (mol%) Selectivity (%) Cyclohexanol Cyclohexanone 10%Ni/SiO2-1 100 100 0 10%Co/SiO2-1 10.0 86.1 13.9 10%Cu/SiO2-1 8.2 73.9 26.1 10%Sn/SiO2-1 2.3 54.6 45.4 2.2%Ru/SiO2-1 100 97.7 4.3 Reaction conditions: phenol 5mmol, catalyst 100mg, 9.5g H2O, 200°C, 1.0MPa H2, 4h. Table 5 The concentration effect on the hydrogenation of phenol. Table 5 Catalyst Phenol Amount (g) Conversion (mol%) Selectivity (%) Cyclohexanol Cyclohexanone 10%Ni/SiO2-1 0.3 100 100 0 10%Ni/SiO2-1 0.5 100 100 0 10%Ni/SiO2-1 0.7 92.6 91.1 8.9 10%Ni/SiO2-1 1.0 45.0 88.9 11.1 10%Ni/SiO2-1 5.0 37.2 41.5 58.5 10%Ni/SiO2-1 10.0 33.5 15.9 84.1 Reaction conditions: 100mg catalyst, 9.5g H2O, 200°C, 1.0MPa H2, 4h. Table 6 Hydrogenation of phenol derivatives over 10%Ni/SiO2-1. Table 6 Entry Catalyst Substrate Product Conversion (mol%) Selectivity (%) 1 10%Ni/SiO2-1 100 100 2 81.3 91.6 3 42.8 81.9 4 63.2 61.3 5 35.3 56.5 Reaction conditions: substrate 5mmol, catalyst 100mg, 9.5g H2O, 200°C, 1.0MPa H2, 4h. Editor’s choice paper Highly selective hydrogenation of phenol to cyclohexanol over nano silica supported Ni catalysts in aqueous medium J. He a b X.-H. Lu a b ⁎ Y. Shen a b R. Jing a b R.-F. Nie a b D. Zhou a b Q.-H. Xia a b ⁎ a Hubei Collaborative Innovation Center for Advanced Organic Chemical Materials, Hubei University, Wuhan 430062, PR China Hubei Collaborative Innovation Center for Advanced Organic Chemical Materials Hubei University Wuhan 430062 PR China b Ministry-of-Education Key Laboratory for the Synthesis and Application of Organic Functional Molecules, Hubei University, Wuhan 430062, PR China Ministry-of-Education Key Laboratory for the Synthesis and Application of Organic Functional Molecules Hubei University Wuhan 430062 PR China ⁎ Corresponding authors at: Hubei Collaborative Innovation Center for Advanced Organic Chemical Materials, Hubei University, Wuhan 430062, PR China. Graphical abstract The hydrogenation results show that 10%Ni/SiO2-1 catalyst exhibits an excellent performance to achieve 100mol% conversion of phenol and 100% selectivity of cyclohexanol under conditions of 1.0MPa H2 and 4h. Cyclohexanol is an excellent starting material for fuel production, but direct selective hydrogenation of phenol to cyclohexanol under mild conditions is a challenge. Herein we report a catalyst made of Ni nanoparticles supported on high-surface silica, which is highly active for selective formation of cyclohexanol under 1.0Mpa pressure of hydrogen in aqueous medium without additives. Conversion of 100mol% and selectivity up to 100% are achieved within 4h and 1.0MPa H2. Some factors such as the type of the source of silica, the loading of Ni, the reaction temperature and time, the H2 pressure play important roles in controlling the selective hydrogenation. The generality of the 10%Ni/SiO2-1 catalyst for this reaction is demonstrated by selective hydrogenation of other hydroxylated aromatic compounds as well. Keywords Nano silica Ni catalyst Selective hydrogenation Phenol Cyclohexanol 1 Introduction Hydrogenation of phenol has attracted much attention both in industry and in the synthesis-oriented research laboratory in recent years [1]. The reason for this interest lies in one fact that the hydrogenation of phenol is an industrially important reaction required for the production of caprolactam and adipic acid used to manufacture nylon 6 and nylon 66 [2,3]. Particularly, cyclohexanol could also be used in pharmaceuticals, plasticizers, surfactant, paint, industrial solvent. And it is also an excellent starting material for fuel production [4,5]. For instance, cyclohexane, which can be obtained from cyclohexanol through dehydration and hydrogenation under mild conditions, is one of main components of gasoline. The dimer of cyclohexanol can be used as a precursor for jet fuel. Cyclohexanol can also be converted to cyclohexanone and then with high quality fuel through consecutive aldol condensation and HDO processes [6]. Furthermore, cyclohexanol is also an excellent oxygenate additive in enhanced multi-component diesel fuel used to improve emissions. Industrially, cyclohexanol can be produced either by the oxidation of cyclohexane or via the hydrogenation of phenol. The oxidation of cyclohexane requires high temperatures and high pressures and suffers from low product yields and complicated recovery/separation steps [7]. In the latter route, the hydrogenation of phenol to cyclohexanol may take place in a ‘two-step’ process [8–10], which involves hydrogenation of phenol to cyclohexanone followed by hydrogenation to cyclohexanol [1,7,11–13]. Traditionally, phenol hydrogenation can be conducted in gas [14] or liquid phase [15]. The reaction has been carried out in the gas phase, with supported Pd [16], Pt [17,18], Ru [19,20], Rh [21] catalysts as the most efficient systems and different supports for this reaction. However, high temperatures are normally required for this process (300°C) [8,14,22], and the generation of carbonaceous deposits (coking) in the course of the reaction leads to deactivation of the catalyst. Liquid-phase phenol hydrogenation offers energy savings, because the reaction can be performed at relatively low temperatures [9,13,23,24]. Up to now, many researchers have contributed to this area, and many catalysts have been screened; however, an important drawback of current liquid-phase hydrogenation protocols relates to the use of noble metals. So exploring the substitution of precious metal catalysts with earth-abundant and less toxic cheap metals thus occupies the forefront of contemporary molecular catalysis research. Nowadays hydrogenation of phenol with non-noble metal catalyst is becoming the preferred industrial process for the production of cyclohexanol, more advantageous in terms of capital costs and energy savings than the two-steps process via cyclohexanone. Especially, the supported nickel catalysts have been widely applied in industrially important chemical processes, such as hydrogenation [25–28], dehydrogenation [29], methanation, reforming, hydrocracking and so on. To obtain the supported nickel catalysts with high activity, some approaches and techniques have been developed, in which aqueous chelated metal complexes and organic nickel precursors are supported by a wet impregnation and directly reduced with hydrogen without calcination in air [30]. As part of our continuing interest in the development of supported metal Ni NPs on SiO2 for hydrogenation of dinitro-naphthalene [30], herein we report the synthesis of nickel supported on high-surface silica (Ni/SiO2) and its exceptional performance for the selective hydrogenation of phenol to cyclohexanol in the liquid phase at low temperature and H2 pressure. The 10%Ni/SiO2-1 catalyst exhibits superior conversion of phenol (100mol%) and high selectivity of cyclohexanol (100%) at 1.0MPa H2, and remains highly active even after eight reuse cycles. Furthermore, the catalyst can also catalyze selective hydrogenation of a variety of phenol derivatives under mild conditions. 2 Experimental 2.1 Materials Nickel (II) nitrate hexahydrate (Ni(NO3)2·6H2O 98%), Cobalt (II) nitrate hexahydrate (Co(NO3)2·6H2O 98%), Copper (II) chloride dehydrate (CuCl2·2H2O 98%), Tin (II) chloride dehydrate (SnCl2·2H2O 98%), Ruthenium (III) chloride trihydrate (RuCl3·3H2O Ru 45%), Coconut Shell Charcoal (CSC) (98%) were purchased from Shanghai Aladdin Chemical Co. Aerosil-200 was obtained from Degussa Co., and CT-150 (98.5%), CT-200 (99%), CT-380 (99.9%) silica from Shan Dong Shou Guang Chemical Co. Gel silica was obtained from Tian Jin Long Hua Chemical Co. (China). Ludox AS-40 colloidal silica was purchased from Sigma Aldrich Co. The main reagents used in the hydrogenation were phenol (AR), tetrahydrofuran (THF) (99.0%), which was purchased from Shanghai Aladdin Chemical Co. 2.2 Preparation of catalysts Silica-supported nickel, with various Ni loadings, were prepared by incipient-wetness impregnation with different silica sources like aerosil-200 silica (SiO2-1), CT-150 silica (SiO2-2), CT-200 silica (SiO2-3), CT-380 silica (SiO2-4), Gel silica (SiO2-5) and AS-40 colloidal silica (SiO2-6). These catalysts were prepared via the following procedure. Typically, 1.082g of Ni(NO3)2·6H2O was dissolved in 80mL of deionized water, followed by the addition of 2.0g silica. Then, the resulting mixture was heated to 90°C in a microwave reactor with magnetic stirring. Then water was completely evaporated off by rotary evaporator, and the recovered solid was dried overnight at 100°C. Separated precipitate was then converted to nickel oxide/SiO2 by calcination at 400°C for 3h in air. The resulting powder was transferred into a crucible, heated to 400°C at a rate of 5°Cmin−1 under a flow of hydrogen and kept for 3h in a tube furnace. The catalysts were denoted as x wt% Ni/SiO2-m, where x represents the loading of Ni in wt% and m stands for different silica. Other metal catalysts were also prepared through the same method of incipient-wetness impregnation, which was designated as 10%Co/SiO2-1, 10%Cu/SiO2-1, 10%Sn/SiO2-1 and 2.2%Ru/SiO2-1. 2.3 Characterization of catalyst Powder X-ray diffraction (XRD) was performed on a Bruker D8A25 diffractometer with using the Ni filtered Cu Kα radiation (λ =1.54184Å) operating at 40kV and 40mA with scan the range of 5–80° 2θ. The surface area and pore volume and pore radius of samples were used to determine from the N2 adsorption–desorption properties of the samples. The specific surface area was determined from isotherms using the BET equation at the relative pressure between 0.05 and 0.25. The Barrett–Joyner–Halenda (BJH) method was used to measure the pore volume. Prior to the measurements, the samples were degassed at 300°C under vacuum of 10−2 Mbar for 10h. The morphologies and sizes of all samples were obtained by field-emission scanning electron microscope (SEM) (JEOLJSM-6510A). Ni particles morphology was obtained by Tecnai G20 transmission electron microscope operated at an accelerating voltage of 200kV. The temperature-programmed reduction (TPR) with H2 was performed on a TP-5076 automatic gas sorption analyzer, the catalyst was carried out with N2 flow of 50mL/min (10vol% H2), from room temperature to 600°C at a heating rate of 10°C/min. The content and chemical states of Ni were performed by X-ray photoelectron spectroscopy (XPS) with Perkin-Elmer PHI ESCA system. The dispersion of Ni metal species on the support was determined by equilibrium hydrogen chemisorption at room temperature in Quantachrome iQ-MP. Prior to H2 chemisorption analysis, the samples were evacuated at 200°C for 1h, then exposed to static H2 at 300°C for 2h and finally placed under dynamic vacuum at 300°C for 3h [31,32]. 2.4 Catalytic activity tests Catalytic tests were conducted in a 100mL stainless steel autoclave with a magnetic agitator. 100mg heterogeneous Ni catalyst, 0.5g phenol, and 9.5g water were introduced into the autoclave, which was then vacuumed and purged three times with H2 before it was finally pressurized with 1.0MPa of H2 gas. Subsequently, the reaction mixture was stirred at a given temperature. After being cooled down to room temperature (RT), excess H2 was carefully released, and the mixture was filtered through centrifugation to separate the catalyst. The resultant product mixtures were analyzed by gas chromatograph to determine the conversion of products. The results were calculated using the follow equations: Conversion Phenol = ( 1 − mol of Phenol after reaction m o l o f P h e n o l i n t i a l ) × 100 % Selectivity of Cyclohexanol = m o l o f C y c l o h e x a n o l mol of the amounts of products × 100 % s 3 Results and discussion 3.1 Catalyst characterization The Nitrogen adsorption and desorption isotherms and pore distribution of 10%Ni/SiO2 are shown in Fig. 1 . The N2 adsorption isotherms of the catalysts show the presence of a hysteresis loop, associated with capillary condensation, which indicates the formation of the mesoporous structure [33]. The result was attributed to mesoporous materials with cylindrical pores and a narrow pore size distribution. The surface area, pore volume and average pore radius of samples are given in Table 1 . It is clear that all of the materials different in the specific pore size that decreases in the follow order: 10%Ni/SiO2-1>10%Ni/SiO2-2>10%Ni/SiO2-4>10%Ni/SiO2-3>10%Ni/SiO2-6>10%Ni/SiO2-5. The pore radius of Aerosil-200 is almost 2.7 times higher than that of Gel silica. The XRD patterns of different SiO2 supports and the supported Ni catalysts are shown in Fig. 2 . It is found that typical broad characteristic peak at around 2θ =22° is assigned to the [002] plane reflection of amorphous SiO2. For all of the prepared 10%Ni/SiO2 catalyst, a group of diffraction peaks at 44.5°, 51.8° and 76.4° are observed, which corresponding respectively to the [111], [200] and [220] diffraction of the Ni (PDF# 04-0850). In addition, the peak at 37.4° is assigned to the [111] diffraction of NiO (PDF# 02-0406). The result can be attributed to the fact that a small part of NiO species may not yet be reduced completely, and some cationic Ni species and the reduced Ni metals exposed to air, may be re-oxidized. The morphology of SiO2-supported Ni catalysts (different sources of silica) were presented in Fig. 3 . Apparently, SEM images of the front four samples exhibit regular spherical morphologies, different from fine particles of SiO2, Ni components dispersed highly on the support. The latter two catalysts show an irregular spherical morphology. The sharp boundaries of the particles demonstrate crystalline characteristics of these samples, in which the particle shape and size of different catalysts are decided by the morphology of different carriers, further affecting catalytic activities. Fig. 4 shows TEM images of SiO2 supported Ni catalysts. The TEM image of 10%Ni/SiO2-1 shows that there is no significant particle aggregation, the particle size of Ni is very small with high dispersion on the SiO2 support (Aerosil-200). When the Aerosil-200 SiO2 carrier is replaced by CT-200 (2), CT-150 (3) and CT-380 (4), respectively, it is found that Ni has obvious aggregation and the particle size becomes significantly larger. When the carrier is respectively by Gel SiO2 (5) and AS-40 colloidal silica (6), it is shows clear aggregation of Ni particles and Ni particle size increases. Similar to the characterization results of SEM, the dispersion and size of active metal observed by TEM are very important for the catalytic activity. The X-ray photoelectron spectroscopy (XPS) spectra of the 10%Ni/SiO2 show strong signals of nickel, carbon and oxygen elements. Fig. 5 shows the example of Ni 2p spectra. Ni 2p3/2 spectra of reduced catalysts are consisted of two spin-orbit doublets that are peaks of metallic nickel and NiO as well as shakeup satellites. The peak centered at 853.4eV is assigned to Ni0. Although there are some difference in relative ratio of metallic Ni between bulk and surface, the result is comparable with XRD test. While nickel is in the oxidation state, the fitting peak at 856.4eV with shakeup satellite is at around 861.7eV, which is assigned to the presence of NiO [34–37]. Through calculating the relative area in Ni 2p of 10%Ni/SiO2-1 catalyst, the percentage of Ni0 is 59.3%, which is the highest in the 10%Ni/SiO2 catalysts (Table 2 ). This result is in accordance with H2-TPR results. As compared with 10%Ni/SiO2-1, the percentage of Ni0 decreases from 59.3% to 35.2% for 10%Ni/SiO2-2 and 32.0% for 10%Ni/SiO2-3. Especially, the latter three materials CT-380, Gel silica and AS-40 are used as the support, the content of Ni0 is much lower than those of the front three. The difference of Ni0 content can affect catalytic activity of the catalyst for phenol hydrogenation. In addition, the dispersion of Ni supported on SiO2-1 (Aerosil-200) materials is determined to be about 33.3%, and that on SiO2-6 (AS-40 colloidal silica) is about 21.5%, which depends on the content and particle size of Ni on the support. The reducibility and interactions between metal and support are further studied by H2-TPR as shown in Fig. 6 . According to the data, the different reduction temperature regions are due to the interaction strength between Ni and supports [33]. For 10%NiO/SiO2-1 material, the TPR profile has three TPR signals at 303, 331 and 426°C, ascribable to the reduction of NiO particles to metal Ni0 without interaction with the support [28], and to the reduction of Ni2+ with medium interaction (at 426°C), in which the first reduction peak appears at lower temperature than the other four samples. For 10%NiO/SiO2-2, 10%NiO/SiO2-3 and 10%NiO/SiO2-4 supported by different silica sources, there are three TPR reduction peaks at low temperature of 309–313 and 331–341°C ascribable to the reduction of NiO particles to metal Ni0, and one peak at 420–431°C attributable to the reduction of Ni2+ with strong interaction. For 10%NiO/SiO2-5, the low reduction peak is not detected in it, and two reduction peaks in the H2-TPR profile shift to higher temperatures with maximal signals at 327 and 432°C. 3.2 Catalytic hydrogenation of phenol The catalytic activity of silica-supported Ni catalysts were carried out at 200°C under 1.0MPa and the results are depicted in Table 3 . When commercial Raney Ni and 10%Ni/SiO2 were used in catalytic hydrogenation of phenol [38,39], the conversion of phenol can reach 100%, but the selectivity of cyclohexanol was not the same. Using Raney Ni as the catalyst, the selectivity of cyclohexanol reached 92.5%; however, the selectivity of cyclohexanol over 10%Ni/SiO2 was only 43.2%. It is clearly investigated that the best catalytic performance in terms of conversion and selectivity was obtained over 10% Ni/SiO2-1, in which the conversion of phenol was 100mol% and the selectivity of cyclohexanol was 100%. In contrast, 10%Ni/SiO2-2 obtained high activity (100mol% conversion), but low selectivity of cyclohexanol (95.2%). However, 10%Ni/SiO2-6 with AS-40 as the support only afforded 38.5mol% conversion of phenol and 88.6% selectivity of cyclohexanol. Catalysts prepared in the same way using other silica sources (Gel silica, CT-150 and CT-380) gave significantly lower conversions (<81.5mol%) than Aerosil-200 under the same reaction conditions. This could be due to the weak interactions between the supports and Ni, which led to low catalyst dispersion (Fig. 3), further limiting the influence on catalytic turnover. Table 4 presents the behaviors of different metal catalysts in the hydrogenation reaction. The conversion of phenol was in the range 2.3–100mol%. As expected, the catalyst 10%Ni/SiO2-1 achieved the highest cyclohexanol selectivity of 100% with 100mol% conversion of phenol under optimal reaction conditions, even higher than 97.7% selectivity on 2.2%Ru/SiO2-1 catalyst. When Co, Cu or Sn was used as the supported metal, the catalytic activity of the catalyst was poor, and the conversion of phenol was not higher than 10%. The effect of nickel metal loading on SiO2 on the conversion to phenol and the selectivity to cyclohexanol was also studied, and the results are shown in Fig. 7 . The catalytic activities of the supported Ni catalysts were increased with the increase of loading from 3 to 15wt%. For all the metal loadings, the selectivity to cyclohexanol increased from 72.2% to 75.4% as the metal loading increased from 3% to 5%. At a higher metal loading of 7%, the selectivity to cyclohexanol quickly increased to 95.4%. The conversion of phenol was lifted to 100mol% when the Ni loading was raised to 10%, meanwhile the selectivity of cyclohexanol was also increased to 100%. At a higher metal loading of 15%, the selectivity to cyclohexanol decreased to 98.2%. 10%Ni/SiO2-1 catalyst showed the better activity with the selectivity of 100% to cyclohexanol. Therefore, it is very critical to control the hydrogenation rate of phenol to cyclohexanol by maintaining an appropriate Ni metal loading. Variations in reaction temperature had considerable effects on both catalytic activity and selectivity. The effect of temperature on the conversion and selectivity for 10%Ni/SiO2-1 catalyst was studied in the temperature range of 150–200°C, and the results are presented in Fig. 8 . The conversion to phenol was found to increase from 40.6mol% (at 150°C) to 93.5mol% (at 190°C), and then to 100mol% with further temperature increase from 190 to 200°C. And, the selectivity of cyclohexanol did not significantly increase with the temperature lift. The selectivity to cyclohexanol was found to increase from 94.7 to 100% with an increase of temperature to 200°C. The effect of reaction time on catalytic performance for 10%Ni/SiO2-1 catalyst was studied in the range of 1–6h at 200°C under H2 partial pressure of 1.0MPa. As shown in Fig. 9 , the conversion of phenol increased from 33.8mol% at 1h to 100mol% at 4.0h and remained 100mol% with further increasing reaction time. The selectivity of cyclohexanol is lower than 70% within 1h, which is increased to 89.8% in 2h, and to the maximum of 100% in 4h. As the reaction time is prolonged to above 5h, the selectivity of cyclohexanol is slightly decreased to 99.5%. Meanwhile, the hydrogenation of cyclohexanone was also carried out under the same reaction conditions (200°C, 1.0MPa H2). Within 1h, the conversion of cyclohexanone is only 36.2mol% and the selectivity of cyclohexanol is 100%. Therefore, catalytic hydrogenation process of phenol is not entirely in accordance with the sequence of traditional two-step route, i.e. phenol is hydrogenated to cyclohexanone [13] and then to cyclohexanol [40]. The current hydrogenation reaction may proceed with one combination of one-step and two-step processes, as illustrated in Scheme 1 . The impact of the phenol concentration on the hydrogenation reaction has been studied, and the corresponding results are shown in the following Table 5 . The catalytic activities of the 10%Ni/SiO2-1 catalyst were maintained at 100mol% with the increase of phenol amount from 0.3 to 0.5g, and the selectivity to cyclohexanol were also maintained at 100%. The catalytic activities of the supported Ni catalysts were decreased with the increase of phenol amount from 0.7 to 10.0g (phenol), and the conversion of phenol were decreased from 92.6 to 33.5mol%. At the same time, the selectivity to cyclohexanol quickly decreased from 91.1 to 15.9%. To test the stability of this series of 10%Ni/SiO2 catalysts under hydrogenation conditions, 10%Ni/SiO2-1 was selected as the representative to investigate its recyclability in the hydrogenation of phenol in water. The recycling data in Fig. 10 show that almost quantitative conversions of phenol to cyclohexanol are maintained within 8 reaction runs. Ni concentration of the liquid reaction solution was determined by ICP-AES to be less than 0.1–0.3ppm, indicating that the leaching of Ni into the liquid phase is negligible. To demonstrate the applicability of the 10%Ni/SiO2-1 catalyst, we further studied the hydrogenation of phenol derivatives over this catalyst under the same reaction condition (Table 6 ). Phenol with an electron-donating group on the ring of p-methylphenol (entry 2) affords slightly lower conversions (81.3mol%) compared to phenol. For the example of o-methylphenol (entry 3), a relatively low conversion (42.8mol%) is obtained. The hydrogenation of p-chlorophenol reaches 63.2mol% conversion in 4h (entry 4) and 61.3% selectivity of the corresponding cyclohexanol. Furthermore, 35.3mol% conversion of p-chlorophenol (entry 5) is obtained over 10%Ni/SiO2-1 in 4h. 4 Conclusion Hydrogenation of phenol was carried out using Ni/SiO2 as catalyst to give cyclohexanol as a major product and cyclohexanone as a byproduct. 10%Ni/SiO2-1 was identified as a suitable catalyst among several heterogeneous transition metal catalysts because its catalyst activity is the best. An investigation on the effect of silicon source on the hydrogenation rate and average catalytic activity was also carried out. It was found that the increase in hydrogenation rate and catalytic activity was not directly related to the change in the radius of the silica pores. The effect of metal, Ni loading content, reaction temperature was investigated at different temperatures. In addition, the present catalyst showed good stability and could be reused eight times without loss of product yields. Acknowledgements This work was supported by National Natural Science Foundation of China (21503074, 21571055, 21603066, 21673069), by Natural Science Fund for Creative Research Groups of Hubei Province of China (2014CFA015), and by 2014 Sci-tech Sup-port Project of the Science and Technology Department of Hubei Province of China (2014BAA098). References [1] Q. Zhang H. Li P. Gao L. Wang Chin. J. Catal. 35 2014 1793 1799 [2] Y. Xiang L. Ma C. Lu Q. Zhang X. Li Green Chem. 10 2008 939 943 [3] Y. Xiang L. Kong P. Xie T. Xu J. Wang X. Li Ind. Eng. Chem. Res. 53 2014 2197 2203 [4] Z. Song D. Ren T. Wang F. Jin Q. Jiang Z. Huo Catal. Today 274 2016 94 98 [5] L.M. Sikhwivhilu N.J. Coville D. Naresh K.V.R. Chary V. Vishwanathan Appl. Catal. A Gen. 324 2007 52 61 [6] J. Long S. Shu Q. Wu Z. Yuan T. Wang Y. Xu X. Zhang Q. Zhang L. Ma Energy Convers. Manage. 105 2015 570 577 [7] C.J. Lin S.H. Huang N.C. Lai C.M. Yang ACS Catal. 5 2015 4121 4129 [8] M. Chatterjee H. Kawanami M. Sato A. Chatterjee T. Yokoyama T. Suzuki Adv. Synth. Catal. 351 2009 1912 1924 [9] V.Z. Fridman A.A. Davydov J. Catal. 195 2000 20 30 [10] N. Mahata K.V. Raghavan V. Vishwanathan C. Park M.A. Keane Phys. Chem. Chem. Phys. 3 2001 2712 2719 [11] Y. Wang J. Yao H. Li D. Su M. Antonietti J. Am. Chem. Soc. 133 2011 2362 2365 [12] J. Matos A. Corma Appl. Catal. A Gen. 404 2011 103 112 [13] Z.L. Li J.H. Liu C.G. Xia F.W. Li ACS Catal. 3 2013 2440 2448 [14] K.V.R. Chary D. Naresh V. Vishwanathan M. Sadakane W. Ueda Catal. Commun. 8 2007 471 477 [15] N.C. Nelson J.S. Manzano A.D. Sadow S.H. Overbury I.I. Slowing ACS Catal. 5 2015 2051 2061 [16] Y. Pérez M. Fajardo A. Corma Catal. Commun. 12 2011 1071 1074 [17] G. Li J. Han H. Wang X. Zhu Q. Ge ACS Catal. 5 2015 2009 2016 [18] Y. Yoon R. Rousseau R.S. Weber D. Mei J.A. Lercher J. Am. Chem. Soc. 136 2014 10287 10298 [19] Y. Nakagawa M. Ishikawa M. Tamura K. Tomishige Green Chem. 16 2014 2197 2203 [20] L. Wang J. Zhang X. Yi A. Zheng F. Deng C. Chen Y. Ji F. Liu X. Meng F.-S. Xiao ACS Catal. 5 2015 2727 2734 [21] I.E. Ertas M. Gulcan A. Bulut M. Yurderi M. Zahmakiran J. Mol. Catal. A Chem. 410 2015 209 220 [22] C.V. Rode U.D. Joshi O. Sato M. Shirai Chem. Commun. 2003 1960 [23] H. Li J. Liu S. Xie M. Qiao W. Dai Y. Lu H. Li Adv. Funct. Mater. 18 2008 3235 3241 [24] Y. Wang J. Yao H.R. Li D.S. Su M. Antonoetti J. Am. Chem. Soc. 133 2011 2362 2365 [25] Y. Yang Z. Du Y. Huang F. Lu F. Wang J. Gao J. Xu Green Chem. 15 2013 1932 1940 [26] X.H. Lu Y. Chen Z.S. Zhao H. Deng D. Zhou C.C. Wei R.F. Nie Q.H. Xia RSC Adv. 6 2016 15354 15361 [27] J.A. Rodriguez J. Evans L. Feria A.B. Vidal P. Liu K. Nakamura F. Illas J. Catal. 307 2013 162 169 [28] R.F. Nie H.Z. Jiang X.H. Lu D. Zhou Q.H. Xia Catal. Sci. Technol. 6 2016 1913 1920 [29] G. Liang L. He H. Cheng W. Li X. Li C. Zhang Y. Yu F. Zhao J. Catal. 309 2014 468 476 [30] X.H. Lu X.L. Wei D. Zhou H.Z. Jiang Y.W. Sun Q.H. Xia J. Mol. Catal. A 396 2015 196 206 [31] Q.H. Xia S.C. Shen J. Song S. Kawi K. Hidajat J. Catal. 219 2003 74 84 [32] Q.H. Xia K. Hidajat S. Kawi Catal. Today 68 2001 255 262 [33] V. Mohan C. Raghavendra C.V. Pramod B.D. Raju K.S. Rama Rao RSC Adv. 4 2014 9660 9668 [34] Z.Y. Hou O. Yokota T. Tanaka T. Yashima Catal. Lett. 89 2003 121 127 [35] I. Czekaj F. Loviat F. Raimondi J. Wambach S. Biollaz A. Wokaun Appl. Catal. A Gen. 329 2007 68 78 [36] X. Yan Y. Liu B. Zhao Y. Wang C.J. Liu Phys. Chem. Chem. Phys. 15 2013 12132 12138 [37] Q. Ma D. Wang M. Wu T. Zhao Y. Yoneyama N. Tsubaki Fuel 108 2013 430 438 [38] P.M. Mortensen J.D. Grunwaldt P.A. Jensen A.D. Jensen ACS Catal. 3 2013 1774 1785 [39] J.F. van Peppen, United States Patent 5,015,787, 1991. [40] D. DiMondo M.E. Thibault J. Britten M. Schlaf Organometallic 32 2013 6541 6554",
      "scopus-id": "85029586422",
      "coredata": {
        "eid": "1-s2.0-S2468823117304066",
        "dc:description": "Cyclohexanol is an excellent starting material for fuel production, but direct selective hydrogenation of phenol to cyclohexanol under mild conditions is a challenge. Herein we report a catalyst made of Ni nanoparticles supported on high-surface silica, which is highly active for selective formation of cyclohexanol under 1.0Mpa pressure of hydrogen in aqueous medium without additives. Conversion of 100mol% and selectivity up to 100% are achieved within 4h and 1.0MPa H2. Some factors such as the type of the source of silica, the loading of Ni, the reaction temperature and time, the H2 pressure play important roles in controlling the selective hydrogenation. The generality of the 10%Ni/SiO2-1 catalyst for this reaction is demonstrated by selective hydrogenation of other hydroxylated aromatic compounds as well.",
        "openArchiveArticle": "false",
        "prism:coverDate": "2017-10-31",
        "openaccessUserLicense": null,
        "prism:aggregationType": "Journal",
        "prism:url": "https://api.elsevier.com/content/article/pii/S2468823117304066",
        "dc:creator": [
          {
            "@_fa": "true",
            "$": "He, J."
          },
          {
            "@_fa": "true",
            "$": "Lu, X.-H."
          },
          {
            "@_fa": "true",
            "$": "Shen, Y."
          },
          {
            "@_fa": "true",
            "$": "Jing, R."
          },
          {
            "@_fa": "true",
            "$": "Nie, R.-F."
          },
          {
            "@_fa": "true",
            "$": "Zhou, D."
          },
          {
            "@_fa": "true",
            "$": "Xia, Q.-H."
          }
        ],
        "link": [
          {
            "@_fa": "true",
            "@rel": "self",
            "@href": "https://api.elsevier.com/content/article/pii/S2468823117304066"
          },
          {
            "@_fa": "true",
            "@rel": "scidir",
            "@href": "https://www.sciencedirect.com/science/article/pii/S2468823117304066"
          }
        ],
        "dc:format": "application/json",
        "openaccessType": null,
        "pii": "S2468-8231(17)30406-6",
        "prism:volume": "440",
        "prism:publisher": "Elsevier B.V.",
        "dc:title": "Highly selective hydrogenation of phenol to cyclohexanol over nano silica supported Ni catalysts in aqueous medium",
        "prism:copyright": "© 2017 Elsevier B.V. All rights reserved.",
        "openaccess": "0",
        "prism:issn": "24688231",
        "dcterms:subject": [
          {
            "@_fa": "true",
            "$": "Nano silica"
          },
          {
            "@_fa": "true",
            "$": "Ni catalyst"
          },
          {
            "@_fa": "true",
            "$": "Selective hydrogenation"
          },
          {
            "@_fa": "true",
            "$": "Phenol"
          },
          {
            "@_fa": "true",
            "$": "Cyclohexanol"
          }
        ],
        "openaccessArticle": "false",
        "prism:publicationName": "Molecular Catalysis",
        "openaccessSponsorType": null,
        "prism:pageRange": "87-95",
        "prism:endingPage": "95",
        "pubType": "fla",
        "prism:coverDisplayDate": "October 2017",
        "prism:doi": "10.1016/j.mcat.2017.07.016",
        "prism:startingPage": "87",
        "dc:identifier": "doi:10.1016/j.mcat.2017.07.016",
        "openaccessSponsorName": null
      },
      "objects": {
        "object": [
          {
            "@category": "thumbnail",
            "@height": "88",
            "@width": "219",
            "@_fa": "true",
            "$": "https://api.elsevier.com/content/object/eid/1-s2.0-S2468823117304066-fx1.sml?httpAccept=%2A%2F%2A",
            "@multimediatype": "GIF image file",
            "@type": "IMAGE-THUMBNAIL",
            "@size": "4583",
            "@ref": "fx1",
            "@mimetype": "image/gif"
          },
          {
            "@category": "thumbnail",
            "@height": "88",
            "@width": "219",
            "@_fa": "true",
            "$": "https://api.elsevier.com/content/object/eid/1-s2.0-S2468823117304066-fx10.sml?httpAccept=%2A%2F%2A",
            "@multimediatype": "GIF image file",
            "@type": "IMAGE-THUMBNAIL",
            "@size": "3400",
            "@ref": "fx10",
            "@mimetype": "image/gif"
          },
          {
            "@category": "thumbnail",
            "@height": "88",
            "@width": "219",
            "@_fa": "true",
            "$": "https://api.elsevier.com/content/object/eid/1-s2.0-S2468823117304066-fx11.sml?httpAccept=%2A%2F%2A",
            "@multimediatype": "GIF image file",
            "@type": "IMAGE-THUMBNAIL",
            "@size": "2871",
            "@ref": "fx11",
            "@mimetype": "image/gif"
          },
          {
            "@category": "thumbnail",
            "@height": "88",
            "@width": "219",
            "@_fa": "true",
            "$": "https://api.elsevier.com/content/object/eid/1-s2.0-S2468823117304066-fx2.sml?httpAccept=%2A%2F%2A",
            "@multimediatype": "GIF image file",
            "@type": "IMAGE-THUMBNAIL",
            "@size": "4053",
            "@ref": "fx2",
            "@mimetype": "image/gif"
          },
          {
            "@category": "thumbnail",
            "@height": "88",
            "@width": "219",
            "@_fa": "true",
            "$": "https://api.elsevier.com/content/object/eid/1-s2.0-S2468823117304066-fx3.sml?httpAccept=%2A%2F%2A",
            "@multimediatype": "GIF image file",
            "@type": "IMAGE-THUMBNAIL",
            "@size": "3900",
            "@ref": "fx3",
            "@mimetype": "image/gif"
          },
          {
            "@category": "thumbnail",
            "@height": "88",
            "@width": "219",
            "@_fa": "true",
            "$": "https://api.elsevier.com/content/object/eid/1-s2.0-S2468823117304066-fx4.sml?httpAccept=%2A%2F%2A",
            "@multimediatype": "GIF image file",
            "@type": "IMAGE-THUMBNAIL",
            "@size": "3118",
            "@ref": "fx4",
            "@mimetype": "image/gif"
          },
          {
            "@category": "thumbnail",
            "@height": "88",
            "@width": "219",
            "@_fa": "true",
            "$": "https://api.elsevier.com/content/object/eid/1-s2.0-S2468823117304066-fx5.sml?httpAccept=%2A%2F%2A",
            "@multimediatype": "GIF image file",
            "@type": "IMAGE-THUMBNAIL",
            "@size": "3765",
            "@ref": "fx5",
            "@mimetype": "image/gif"
          },
          {
            "@category": "thumbnail",
            "@height": "88",
            "@width": "219",
            "@_fa": "true",
            "$": "https://api.elsevier.com/content/object/eid/1-s2.0-S2468823117304066-fx6.sml?httpAccept=%2A%2F%2A",
            "@multimediatype": "GIF image file",
            "@type": "IMAGE-THUMBNAIL",
            "@size": "3169",
            "@ref": "fx6",
            "@mimetype": "image/gif"
          },
          {
            "@category": "thumbnail",
            "@height": "88",
            "@width": "219",
            "@_fa": "true",
            "$": "https://api.elsevier.com/content/object/eid/1-s2.0-S2468823117304066-fx7.sml?httpAccept=%2A%2F%2A",
            "@multimediatype": "GIF image file",
            "@type": "IMAGE-THUMBNAIL",
            "@size": "3500",
            "@ref": "fx7",
            "@mimetype": "image/gif"
          },
          {
            "@category": "thumbnail",
            "@height": "88",
            "@width": "219",
            "@_fa": "true",
            "$": "https://api.elsevier.com/content/object/eid/1-s2.0-S2468823117304066-fx8.sml?httpAccept=%2A%2F%2A",
            "@multimediatype": "GIF image file",
            "@type": "IMAGE-THUMBNAIL",
            "@size": "3428",
            "@ref": "fx8",
            "@mimetype": "image/gif"
          },
          {
            "@category": "thumbnail",
            "@height": "88",
            "@width": "219",
            "@_fa": "true",
            "$": "https://api.elsevier.com/content/object/eid/1-s2.0-S2468823117304066-fx9.sml?httpAccept=%2A%2F%2A",
            "@multimediatype": "GIF image file",
            "@type": "IMAGE-THUMBNAIL",
            "@size": "2833",
            "@ref": "fx9",
            "@mimetype": "image/gif"
          },
          {
            "@category": "thumbnail",
            "@height": "164",
            "@width": "155",
            "@_fa": "true",
            "$": "https://api.elsevier.com/content/object/eid/1-s2.0-S2468823117304066-gr1.sml?httpAccept=%2A%2F%2A",
            "@multimediatype": "GIF image file",
            "@type": "IMAGE-THUMBNAIL",
            "@size": "7858",
            "@ref": "gr1",
            "@mimetype": "image/gif"
          },
          {
            "@category": "thumbnail",
            "@height": "164",
            "@width": "174",
            "@_fa": "true",
            "$": "https://api.elsevier.com/content/object/eid/1-s2.0-S2468823117304066-gr10.sml?httpAccept=%2A%2F%2A",
            "@multimediatype": "GIF image file",
            "@type": "IMAGE-THUMBNAIL",
            "@size": "7264",
            "@ref": "gr10",
            "@mimetype": "image/gif"
          },
          {
            "@category": "thumbnail",
            "@height": "164",
            "@width": "156",
            "@_fa": "true",
            "$": "https://api.elsevier.com/content/object/eid/1-s2.0-S2468823117304066-gr2.sml?httpAccept=%2A%2F%2A",
            "@multimediatype": "GIF image file",
            "@type": "IMAGE-THUMBNAIL",
            "@size": "8248",
            "@ref": "gr2",
            "@mimetype": "image/gif"
          },
          {
            "@category": "thumbnail",
            "@height": "132",
            "@width": "219",
            "@_fa": "true",
            "$": "https://api.elsevier.com/content/object/eid/1-s2.0-S2468823117304066-gr3.sml?httpAccept=%2A%2F%2A",
            "@multimediatype": "GIF image file",
            "@type": "IMAGE-THUMBNAIL",
            "@size": "16275",
            "@ref": "gr3",
            "@mimetype": "image/gif"
          },
          {
            "@category": "thumbnail",
            "@height": "146",
            "@width": "219",
            "@_fa": "true",
            "$": "https://api.elsevier.com/content/object/eid/1-s2.0-S2468823117304066-gr4.sml?httpAccept=%2A%2F%2A",
            "@multimediatype": "GIF image file",
            "@type": "IMAGE-THUMBNAIL",
            "@size": "23036",
            "@ref": "gr4",
            "@mimetype": "image/gif"
          },
          {
            "@category": "thumbnail",
            "@height": "164",
            "@width": "132",
            "@_fa": "true",
            "$": "https://api.elsevier.com/content/object/eid/1-s2.0-S2468823117304066-gr5.sml?httpAccept=%2A%2F%2A",
            "@multimediatype": "GIF image file",
            "@type": "IMAGE-THUMBNAIL",
            "@size": "9133",
            "@ref": "gr5",
            "@mimetype": "image/gif"
          },
          {
            "@category": "thumbnail",
            "@height": "164",
            "@width": "163",
            "@_fa": "true",
            "$": "https://api.elsevier.com/content/object/eid/1-s2.0-S2468823117304066-gr6.sml?httpAccept=%2A%2F%2A",
            "@multimediatype": "GIF image file",
            "@type": "IMAGE-THUMBNAIL",
            "@size": "5614",
            "@ref": "gr6",
            "@mimetype": "image/gif"
          },
          {
            "@category": "thumbnail",
            "@height": "164",
            "@width": "187",
            "@_fa": "true",
            "$": "https://api.elsevier.com/content/object/eid/1-s2.0-S2468823117304066-gr7.sml?httpAccept=%2A%2F%2A",
            "@multimediatype": "GIF image file",
            "@type": "IMAGE-THUMBNAIL",
            "@size": "5646",
            "@ref": "gr7",
            "@mimetype": "image/gif"
          },
          {
            "@category": "thumbnail",
            "@height": "164",
            "@width": "192",
            "@_fa": "true",
            "$": "https://api.elsevier.com/content/object/eid/1-s2.0-S2468823117304066-gr8.sml?httpAccept=%2A%2F%2A",
            "@multimediatype": "GIF image file",
            "@type": "IMAGE-THUMBNAIL",
            "@size": "5777",
            "@ref": "gr8",
            "@mimetype": "image/gif"
          },
          {
            "@category": "thumbnail",
            "@height": "164",
            "@width": "191",
            "@_fa": "true",
            "$": "https://api.elsevier.com/content/object/eid/1-s2.0-S2468823117304066-gr9.sml?httpAccept=%2A%2F%2A",
            "@multimediatype": "GIF image file",
            "@type": "IMAGE-THUMBNAIL",
            "@size": "5008",
            "@ref": "gr9",
            "@mimetype": "image/gif"
          },
          {
            "@category": "thumbnail",
            "@height": "142",
            "@width": "219",
            "@_fa": "true",
            "$": "https://api.elsevier.com/content/object/eid/1-s2.0-S2468823117304066-sc1.sml?httpAccept=%2A%2F%2A",
            "@multimediatype": "GIF image file",
            "@type": "IMAGE-THUMBNAIL",
            "@size": "8493",
            "@ref": "sc1",
            "@mimetype": "image/gif"
          },
          {
            "@category": "standard",
            "@height": "200",
            "@width": "500",
            "@_fa": "true",
            "$": "https://api.elsevier.com/content/object/eid/1-s2.0-S2468823117304066-fx1.jpg?httpAccept=%2A%2F%2A",
            "@multimediatype": "JPEG image file",
            "@type": "IMAGE-DOWNSAMPLED",
            "@size": "19302",
            "@ref": "fx1",
            "@mimetype": "image/jpeg"
          },
          {
            "@category": "standard",
            "@height": "200",
            "@width": "500",
            "@_fa": "true",
            "$": "https://api.elsevier.com/content/object/eid/1-s2.0-S2468823117304066-fx10.jpg?httpAccept=%2A%2F%2A",
            "@multimediatype": "JPEG image file",
            "@type": "IMAGE-DOWNSAMPLED",
            "@size": "8691",
            "@ref": "fx10",
            "@mimetype": "image/jpeg"
          },
          {
            "@category": "standard",
            "@height": "200",
            "@width": "500",
            "@_fa": "true",
            "$": "https://api.elsevier.com/content/object/eid/1-s2.0-S2468823117304066-fx11.jpg?httpAccept=%2A%2F%2A",
            "@multimediatype": "JPEG image file",
            "@type": "IMAGE-DOWNSAMPLED",
            "@size": "6972",
            "@ref": "fx11",
            "@mimetype": "image/jpeg"
          },
          {
            "@category": "standard",
            "@height": "200",
            "@width": "500",
            "@_fa": "true",
            "$": "https://api.elsevier.com/content/object/eid/1-s2.0-S2468823117304066-fx2.jpg?httpAccept=%2A%2F%2A",
            "@multimediatype": "JPEG image file",
            "@type": "IMAGE-DOWNSAMPLED",
            "@size": "9843",
            "@ref": "fx2",
            "@mimetype": "image/jpeg"
          },
          {
            "@category": "standard",
            "@height": "200",
            "@width": "500",
            "@_fa": "true",
            "$": "https://api.elsevier.com/content/object/eid/1-s2.0-S2468823117304066-fx3.jpg?httpAccept=%2A%2F%2A",
            "@multimediatype": "JPEG image file",
            "@type": "IMAGE-DOWNSAMPLED",
            "@size": "9901",
            "@ref": "fx3",
            "@mimetype": "image/jpeg"
          },
          {
            "@category": "standard",
            "@height": "200",
            "@width": "500",
            "@_fa": "true",
            "$": "https://api.elsevier.com/content/object/eid/1-s2.0-S2468823117304066-fx4.jpg?httpAccept=%2A%2F%2A",
            "@multimediatype": "JPEG image file",
            "@type": "IMAGE-DOWNSAMPLED",
            "@size": "7913",
            "@ref": "fx4",
            "@mimetype": "image/jpeg"
          },
          {
            "@category": "standard",
            "@height": "200",
            "@width": "500",
            "@_fa": "true",
            "$": "https://api.elsevier.com/content/object/eid/1-s2.0-S2468823117304066-fx5.jpg?httpAccept=%2A%2F%2A",
            "@multimediatype": "JPEG image file",
            "@type": "IMAGE-DOWNSAMPLED",
            "@size": "10211",
            "@ref": "fx5",
            "@mimetype": "image/jpeg"
          },
          {
            "@category": "standard",
            "@height": "200",
            "@width": "500",
            "@_fa": "true",
            "$": "https://api.elsevier.com/content/object/eid/1-s2.0-S2468823117304066-fx6.jpg?httpAccept=%2A%2F%2A",
            "@multimediatype": "JPEG image file",
            "@type": "IMAGE-DOWNSAMPLED",
            "@size": "8115",
            "@ref": "fx6",
            "@mimetype": "image/jpeg"
          },
          {
            "@category": "standard",
            "@height": "200",
            "@width": "500",
            "@_fa": "true",
            "$": "https://api.elsevier.com/content/object/eid/1-s2.0-S2468823117304066-fx7.jpg?httpAccept=%2A%2F%2A",
            "@multimediatype": "JPEG image file",
            "@type": "IMAGE-DOWNSAMPLED",
            "@size": "8056",
            "@ref": "fx7",
            "@mimetype": "image/jpeg"
          },
          {
            "@category": "standard",
            "@height": "200",
            "@width": "500",
            "@_fa": "true",
            "$": "https://api.elsevier.com/content/object/eid/1-s2.0-S2468823117304066-fx8.jpg?httpAccept=%2A%2F%2A",
            "@multimediatype": "JPEG image file",
            "@type": "IMAGE-DOWNSAMPLED",
            "@size": "8330",
            "@ref": "fx8",
            "@mimetype": "image/jpeg"
          },
          {
            "@category": "standard",
            "@height": "200",
            "@width": "500",
            "@_fa": "true",
            "$": "https://api.elsevier.com/content/object/eid/1-s2.0-S2468823117304066-fx9.jpg?httpAccept=%2A%2F%2A",
            "@multimediatype": "JPEG image file",
            "@type": "IMAGE-DOWNSAMPLED",
            "@size": "6803",
            "@ref": "fx9",
            "@mimetype": "image/jpeg"
          },
          {
            "@category": "standard",
            "@height": "838",
            "@width": "791",
            "@_fa": "true",
            "$": "https://api.elsevier.com/content/object/eid/1-s2.0-S2468823117304066-gr1.jpg?httpAccept=%2A%2F%2A",
            "@multimediatype": "JPEG image file",
            "@type": "IMAGE-DOWNSAMPLED",
            "@size": "139975",
            "@ref": "gr1",
            "@mimetype": "image/jpeg"
          },
          {
            "@category": "standard",
            "@height": "354",
            "@width": "376",
            "@_fa": "true",
            "$": "https://api.elsevier.com/content/object/eid/1-s2.0-S2468823117304066-gr10.jpg?httpAccept=%2A%2F%2A",
            "@multimediatype": "JPEG image file",
            "@type": "IMAGE-DOWNSAMPLED",
            "@size": "32436",
            "@ref": "gr10",
            "@mimetype": "image/jpeg"
          },
          {
            "@category": "standard",
            "@height": "394",
            "@width": "376",
            "@_fa": "true",
            "$": "https://api.elsevier.com/content/object/eid/1-s2.0-S2468823117304066-gr2.jpg?httpAccept=%2A%2F%2A",
            "@multimediatype": "JPEG image file",
            "@type": "IMAGE-DOWNSAMPLED",
            "@size": "45220",
            "@ref": "gr2",
            "@mimetype": "image/jpeg"
          },
          {
            "@category": "standard",
            "@height": "408",
            "@width": "678",
            "@_fa": "true",
            "$": "https://api.elsevier.com/content/object/eid/1-s2.0-S2468823117304066-gr3.jpg?httpAccept=%2A%2F%2A",
            "@multimediatype": "JPEG image file",
            "@type": "IMAGE-DOWNSAMPLED",
            "@size": "113623",
            "@ref": "gr3",
            "@mimetype": "image/jpeg"
          },
          {
            "@category": "standard",
            "@height": "451",
            "@width": "678",
            "@_fa": "true",
            "$": "https://api.elsevier.com/content/object/eid/1-s2.0-S2468823117304066-gr4.jpg?httpAccept=%2A%2F%2A",
            "@multimediatype": "JPEG image file",
            "@type": "IMAGE-DOWNSAMPLED",
            "@size": "104952",
            "@ref": "gr4",
            "@mimetype": "image/jpeg"
          },
          {
            "@category": "standard",
            "@height": "819",
            "@width": "659",
            "@_fa": "true",
            "$": "https://api.elsevier.com/content/object/eid/1-s2.0-S2468823117304066-gr5.jpg?httpAccept=%2A%2F%2A",
            "@multimediatype": "JPEG image file",
            "@type": "IMAGE-DOWNSAMPLED",
            "@size": "122028",
            "@ref": "gr5",
            "@mimetype": "image/jpeg"
          },
          {
            "@category": "standard",
            "@height": "379",
            "@width": "376",
            "@_fa": "true",
            "$": "https://api.elsevier.com/content/object/eid/1-s2.0-S2468823117304066-gr6.jpg?httpAccept=%2A%2F%2A",
            "@multimediatype": "JPEG image file",
            "@type": "IMAGE-DOWNSAMPLED",
            "@size": "29628",
            "@ref": "gr6",
            "@mimetype": "image/jpeg"
          },
          {
            "@category": "standard",
            "@height": "329",
            "@width": "376",
            "@_fa": "true",
            "$": "https://api.elsevier.com/content/object/eid/1-s2.0-S2468823117304066-gr7.jpg?httpAccept=%2A%2F%2A",
            "@multimediatype": "JPEG image file",
            "@type": "IMAGE-DOWNSAMPLED",
            "@size": "24998",
            "@ref": "gr7",
            "@mimetype": "image/jpeg"
          },
          {
            "@category": "standard",
            "@height": "321",
            "@width": "376",
            "@_fa": "true",
            "$": "https://api.elsevier.com/content/object/eid/1-s2.0-S2468823117304066-gr8.jpg?httpAccept=%2A%2F%2A",
            "@multimediatype": "JPEG image file",
            "@type": "IMAGE-DOWNSAMPLED",
            "@size": "24838",
            "@ref": "gr8",
            "@mimetype": "image/jpeg"
          },
          {
            "@category": "standard",
            "@height": "323",
            "@width": "376",
            "@_fa": "true",
            "$": "https://api.elsevier.com/content/object/eid/1-s2.0-S2468823117304066-gr9.jpg?httpAccept=%2A%2F%2A",
            "@multimediatype": "JPEG image file",
            "@type": "IMAGE-DOWNSAMPLED",
            "@size": "22301",
            "@ref": "gr9",
            "@mimetype": "image/jpeg"
          },
          {
            "@category": "standard",
            "@height": "244",
            "@width": "376",
            "@_fa": "true",
            "$": "https://api.elsevier.com/content/object/eid/1-s2.0-S2468823117304066-sc1.jpg?httpAccept=%2A%2F%2A",
            "@multimediatype": "JPEG image file",
            "@type": "IMAGE-DOWNSAMPLED",
            "@size": "24287",
            "@ref": "sc1",
            "@mimetype": "image/jpeg"
          },
          {
            "@category": "thumbnail",
            "@height": "40",
            "@width": "446",
            "@_fa": "true",
            "$": "https://api.elsevier.com/content/object/eid/1-s2.0-S2468823117304066-si1.gif?httpAccept=%2A%2F%2A",
            "@multimediatype": "GIF image file",
            "@type": "ALTIMG",
            "@size": "2344",
            "@ref": "si1",
            "@mimetype": "image/gif"
          },
          {
            "@category": "thumbnail",
            "@height": "61",
            "@width": "308",
            "@_fa": "true",
            "$": "https://api.elsevier.com/content/object/eid/1-s2.0-S2468823117304066-si2.gif?httpAccept=%2A%2F%2A",
            "@multimediatype": "GIF image file",
            "@type": "ALTIMG",
            "@size": "2342",
            "@ref": "si2",
            "@mimetype": "image/gif"
          }
        ]
      },
      "link": {
        "@rel": "abstract",
        "@href": "https://api.elsevier.com/content/abstract/scopus_id/85029586422"
      }
    }
  }
}