{
  "metadata": {
    "title": "Influence of nickel loading on the hydroisomerization of <ce:italic>n</ce:italic>-dodecane with nickel-tungsten oxide-alumina supported catalysts",
    "authors": "; ; ",
    "journal": "Molecular Catalysis",
    "date": "2022-08-31",
    "doi": "10.1016/j.mcat.2022.112556",
    "abstract": "",
    "uri": "https://api.elsevier.com/content/article/pii/S2468823122004424",
    "pii": "S2468823122004424"
  },
  "fulltext": {
    "full-text-retrieval-response": {
      "scopus-eid": "2-s2.0-85135395218",
      "originalText": "serial JL 315758 291210 291744 291790 291809 31 90 Molecular Catalysis MOLECULARCATALYSIS 2022-08-03 2022-08-03 2022-08-03 2022-08-03 2023-04-07T15:56:21 1-s2.0-S2468823122004424 S2468-8231(22)00442-4 S2468823122004424 10.1016/j.mcat.2022.112556 S300 S300.1 FULL-TEXT 1-s2.0-S2468823122X00126 2024-06-26T17:47:42.395391Z 0 0 20220801 20220831 2022 2022-08-03T23:13:52.806536Z absattachment articleinfo articlenumber articletitlenorm authfirstinitialnorm authfirstsurnamenorm cid cids contenttype copyright crossmark dateloaded dateloadedtxt datesearch datesort dateupdated dco docsubtype doctype doi eid ewtransactionid fundingbodyid hubeid indexeddate issn issnnorm itemstage itemtransactionid itemweight oauserlicense openaccess openarchive pg pgfirst pii piinorm pubdateend pubdatestart pubdatetxt pubyr sectiontitle sortorder sponsoredaccesstype srctitle srctitlenorm srctype ssids alllist content oa subj subheadings suppl tomb volfirst volissue volumelist webpdf webpdfpagecount yearnav figure table e-component body mmlmath acknowledge affil appendices articletitle auth authfirstini authfull authlast footnotes highlightsabst orcid primabst ref specialabst 2468-8231 24688231 UNLIMITED SPAIN2022 true 529 529 C Volume 529 24 112556 112556 112556 202208 August 2022 2022-08-01 2022-08-31 2022 Regular Papers article fla © 2022 The Author(s). Published by Elsevier B.V. INFLUENCENICKELLOADINGHYDROISOMERIZATIONNDODECANENICKELTUNGSTENOXIDEALUMINASUPPORTEDCATALYSTS GARCIAPEREZ D 1 Introduction 2 Materials and methods 2.1 Materials 2.2 Preparation of catalysts 2.3 Catalyst characterization methods 2.4 Catalytic activity test 3 Results and discussion 4 Conclusions CRediT authorship contribution statement Acknowledgments Appendix Supplementary materials References GARCIAPEREZ 2022 319 D KIM 2018 10545 10554 J TIAN 2014 120 128 S FANG 2005 51 58 K LYU 2019 208 216 Y AHMED 2017 5482 5490 M GARCIAPEREZ 2021 1 16 D REZGUI 2007 602 609 Y REZGUI 2005 45 53 Y GARCIAPEREZ 2021 43 50 D WAGNER 1981 211 225 C SING 2004 773 782 K NAYAK 2016 11 N THOMMES 2015 1051 1069 M ZARUBINA 2014 179 187 V PEREZ 2013 3971 3978 L PEREZ 2013 848 855 L MITRAN 2015 275 281 G CAN 2021 F KARAKOULIA 2020 746 756 S BARTON 1998 87 99 D LIU 2008 5066 5073 X LARSEN 1996 57 59 G SHOZI 2016 5752 5760 M PENKOVA 2014 241 251 A ALVAREZGALVAN 2018 242 249 M AI 2019 23975 23982 H KATRIB 1994 589 595 A IBRAHIM 2020 012007 M MOCHIZUKI 2009 143 144 T PARK 2000 201 209 K BERTEAU 1989 121 137 P JAROSZEWSKA 2021 1 22 K YANG 2021 727 736 Y DING 1997 1219 1223 W MAKIARVELA 2018 P REZGUI 2010 31 40 Y GARCIAPEREZX2022X112556 GARCIAPEREZX2022X112556XD Full 2022-07-27T19:26:45Z FundingBody Spanish Institutions 2022 http://creativecommons.org/licenses/by/4.0/ 2024-08-03T00:00:00.000Z 2024-08-03T00:00:00.000Z http://creativecommons.org/licenses/by-nc-nd/4.0/ This is an open access article under the CC BY license. © 2022 The Author(s). Published by Elsevier B.V. 2022-08-10T01:28:32.079Z http://vtw.elsevier.com/data/voc/AddOnTypes/50.7/aggregated-refined AEI BES-2017-079679 ENE2016-74889-C4-3-R AEI Agencia Estatal de Investigación http://data.elsevier.com/vocabulary/SciValFunders/501100011033 http://sws.geonames.org/2510769/ CSIC TRE2021-03-012 CSIC Consejo Superior de Investigaciones Científicas http://data.elsevier.com/vocabulary/SciValFunders/501100003339 http://sws.geonames.org/2510769/ MICIN MICINN Ministerio de Ciencia e Innovación http://data.elsevier.com/vocabulary/SciValFunders/501100004837 http://sws.geonames.org/2510769/ The support of MICIN/AEI (Spain) through project ENE2016-74889-C4-3-R is acknowledged. DGP acknowledges MICIN/AEI for her contract (BES-2017-079679) (Spain). This research is part of the CSIC program for the Spanish Recovery, Transformation, and Resilience Plan funded by the Recovery and Resilience Facility of the European Union, established by Regulation (EU) 2020/2094 (TRE2021-03-012). We acknowledge the support of the publication fee by the CSIC Open Access Publication Support Initiative through its Unit of Information Resources for Research (URICI). The support of MICIN/AEI (Spain) through project ENE2016-74889-C4-3-R is acknowledged. DGP acknowledges MICIN/AEI for her contract (BES-2017-079679) (Spain). This research is part of the CSIC program for the Spanish Recovery, Transformation, and Resilience Plan funded by the Recovery and Resilience Facility of the European Union, established by Regulation (EU) 2020/2094 (TRE2021-03-012). We acknowledge the support of the publication fee by the CSIC Open Access Publication Support Initiative through its Unit of Information Resources for Research (URICI). item S2468-8231(22)00442-4 S2468823122004424 1-s2.0-S2468823122004424 10.1016/j.mcat.2022.112556 315758 2023-04-07T15:11:53.207972Z 2022-08-01 2022-08-31 UNLIMITED SPAIN2022 1-s2.0-S2468823122004424-main.pdf https://s3-eu-west-1.amazonaws.com/prod-ucs-content-store-eu-west/content/pii:S2468823122004424/MAIN/application/pdf/3cda30ca8958707d9e2a0bbf9d387eac/main.pdf main.pdf pdf true 832744 MAIN 8 1-s2.0-S2468823122004424-main_1.png https://s3-eu-west-1.amazonaws.com/prod-ucs-content-store-eu-west/content/pii:S2468823122004424/PREVIEW/image/png/be49b6dcc014f293f6bfd9767ce11248/main_1.png main_1.png png 63544 849 656 IMAGE-WEB-PDF 1 1-s2.0-S2468823122004424-gr2.jpg https://s3-eu-west-1.amazonaws.com/prod-ucs-content-store-eu-west/content/pii:S2468823122004424/gr2/DOWNSAMPLED/image/jpeg/872b1f14ed8ec58d1670aba503395fdc/gr2.jpg gr2 gr2.jpg jpg 70183 413 659 IMAGE-DOWNSAMPLED 1-s2.0-S2468823122004424-ga1.jpg https://s3-eu-west-1.amazonaws.com/prod-ucs-content-store-eu-west/content/pii:S2468823122004424/ga1/DOWNSAMPLED/image/jpeg/e59ec7518de250986877bdfc5196c505/ga1.jpg ga1 true ga1.jpg jpg 14490 145 301 IMAGE-DOWNSAMPLED 1-s2.0-S2468823122004424-gr3.jpg https://s3-eu-west-1.amazonaws.com/prod-ucs-content-store-eu-west/content/pii:S2468823122004424/gr3/DOWNSAMPLED/image/jpeg/d3053e5e2fde6d1978b1a18655325e19/gr3.jpg gr3 gr3.jpg jpg 49104 414 301 IMAGE-DOWNSAMPLED 1-s2.0-S2468823122004424-gr1.jpg https://s3-eu-west-1.amazonaws.com/prod-ucs-content-store-eu-west/content/pii:S2468823122004424/gr1/DOWNSAMPLED/image/jpeg/a91644342ebc92184cb0767c08a392dc/gr1.jpg gr1 gr1.jpg jpg 38340 434 320 IMAGE-DOWNSAMPLED 1-s2.0-S2468823122004424-gr6.jpg https://s3-eu-west-1.amazonaws.com/prod-ucs-content-store-eu-west/content/pii:S2468823122004424/gr6/DOWNSAMPLED/image/jpeg/2e3bc2cc5e24d344fe384ee83cae08a4/gr6.jpg gr6 gr6.jpg jpg 34697 308 395 IMAGE-DOWNSAMPLED 1-s2.0-S2468823122004424-gr7.jpg https://s3-eu-west-1.amazonaws.com/prod-ucs-content-store-eu-west/content/pii:S2468823122004424/gr7/DOWNSAMPLED/image/jpeg/e7b01a82e8d8892cebc1def627cf58f9/gr7.jpg gr7 gr7.jpg jpg 40271 427 357 IMAGE-DOWNSAMPLED 1-s2.0-S2468823122004424-gr4.jpg https://s3-eu-west-1.amazonaws.com/prod-ucs-content-store-eu-west/content/pii:S2468823122004424/gr4/DOWNSAMPLED/image/jpeg/948a0c91f2c753f33f1011e05e9b1ea8/gr4.jpg gr4 gr4.jpg jpg 48426 417 301 IMAGE-DOWNSAMPLED 1-s2.0-S2468823122004424-gr5.jpg https://s3-eu-west-1.amazonaws.com/prod-ucs-content-store-eu-west/content/pii:S2468823122004424/gr5/DOWNSAMPLED/image/jpeg/ee3eaf0fa9de80741af12510cdacc0ec/gr5.jpg gr5 gr5.jpg jpg 59347 495 339 IMAGE-DOWNSAMPLED 1-s2.0-S2468823122004424-gr2.sml https://s3-eu-west-1.amazonaws.com/prod-ucs-content-store-eu-west/content/pii:S2468823122004424/gr2/THUMBNAIL/image/gif/cb0d1ae16831aa4d6a1aa980ba30e009/gr2.sml gr2 gr2.sml sml 10221 137 219 IMAGE-THUMBNAIL 1-s2.0-S2468823122004424-ga1.sml https://s3-eu-west-1.amazonaws.com/prod-ucs-content-store-eu-west/content/pii:S2468823122004424/ga1/THUMBNAIL/image/gif/e9bc769634e5612ed2b8afcc59e68799/ga1.sml ga1 true ga1.sml sml 7257 105 219 IMAGE-THUMBNAIL 1-s2.0-S2468823122004424-gr3.sml https://s3-eu-west-1.amazonaws.com/prod-ucs-content-store-eu-west/content/pii:S2468823122004424/gr3/THUMBNAIL/image/gif/ff60a634859e578bc3afd3a942f47e70/gr3.sml gr3 gr3.sml sml 9196 164 119 IMAGE-THUMBNAIL 1-s2.0-S2468823122004424-gr1.sml https://s3-eu-west-1.amazonaws.com/prod-ucs-content-store-eu-west/content/pii:S2468823122004424/gr1/THUMBNAIL/image/gif/a01e479196afddafd3cd1a084b9be59c/gr1.sml gr1 gr1.sml sml 7844 164 121 IMAGE-THUMBNAIL 1-s2.0-S2468823122004424-gr6.sml https://s3-eu-west-1.amazonaws.com/prod-ucs-content-store-eu-west/content/pii:S2468823122004424/gr6/THUMBNAIL/image/gif/1ee4dd854597c1c6c4e5eee6e0af12b1/gr6.sml gr6 gr6.sml sml 10037 164 210 IMAGE-THUMBNAIL 1-s2.0-S2468823122004424-gr7.sml https://s3-eu-west-1.amazonaws.com/prod-ucs-content-store-eu-west/content/pii:S2468823122004424/gr7/THUMBNAIL/image/gif/55739c5bb35ca5ef6a45b8c77dfd92b1/gr7.sml gr7 gr7.sml sml 7612 164 137 IMAGE-THUMBNAIL 1-s2.0-S2468823122004424-gr4.sml https://s3-eu-west-1.amazonaws.com/prod-ucs-content-store-eu-west/content/pii:S2468823122004424/gr4/THUMBNAIL/image/gif/a58b75eb6a195c17a96d8871fa08cf69/gr4.sml gr4 gr4.sml sml 9428 164 118 IMAGE-THUMBNAIL 1-s2.0-S2468823122004424-gr5.sml https://s3-eu-west-1.amazonaws.com/prod-ucs-content-store-eu-west/content/pii:S2468823122004424/gr5/THUMBNAIL/image/gif/988c44b40c626f400c707332b92e41ef/gr5.sml gr5 gr5.sml sml 9251 163 112 IMAGE-THUMBNAIL 1-s2.0-S2468823122004424-gr2_lrg.jpg https://s3-eu-west-1.amazonaws.com/prod-ucs-content-store-eu-west/content/pii:S2468823122004424/gr2/HIGHRES/image/jpeg/0c4a468e4e5fa2af400ec49a0c1ea5c6/gr2_lrg.jpg gr2 gr2_lrg.jpg jpg 524483 1827 2917 IMAGE-HIGH-RES 1-s2.0-S2468823122004424-ga1_lrg.jpg https://s3-eu-west-1.amazonaws.com/prod-ucs-content-store-eu-west/content/pii:S2468823122004424/ga1/HIGHRES/image/jpeg/d37c1174c36069e0588ac27537c76e16/ga1_lrg.jpg ga1 true ga1_lrg.jpg jpg 94647 640 1333 IMAGE-HIGH-RES 1-s2.0-S2468823122004424-gr3_lrg.jpg https://s3-eu-west-1.amazonaws.com/prod-ucs-content-store-eu-west/content/pii:S2468823122004424/gr3/HIGHRES/image/jpeg/8090c0cd5141bf24968924435131050f/gr3_lrg.jpg gr3 gr3_lrg.jpg jpg 353152 1833 1333 IMAGE-HIGH-RES 1-s2.0-S2468823122004424-gr1_lrg.jpg https://s3-eu-west-1.amazonaws.com/prod-ucs-content-store-eu-west/content/pii:S2468823122004424/gr1/HIGHRES/image/jpeg/b25e344b3b2099bde802d5751aca7944/gr1_lrg.jpg gr1 gr1_lrg.jpg jpg 283339 1921 1417 IMAGE-HIGH-RES 1-s2.0-S2468823122004424-gr6_lrg.jpg https://s3-eu-west-1.amazonaws.com/prod-ucs-content-store-eu-west/content/pii:S2468823122004424/gr6/HIGHRES/image/jpeg/fce8a498662ef09b9039c3f63d42fbb6/gr6_lrg.jpg gr6 gr6_lrg.jpg jpg 215264 1364 1750 IMAGE-HIGH-RES 1-s2.0-S2468823122004424-gr7_lrg.jpg https://s3-eu-west-1.amazonaws.com/prod-ucs-content-store-eu-west/content/pii:S2468823122004424/gr7/HIGHRES/image/jpeg/d5e31ed31ac39d67dd5ba7c42d340f22/gr7_lrg.jpg gr7 gr7_lrg.jpg jpg 227907 1892 1583 IMAGE-HIGH-RES 1-s2.0-S2468823122004424-gr4_lrg.jpg https://s3-eu-west-1.amazonaws.com/prod-ucs-content-store-eu-west/content/pii:S2468823122004424/gr4/HIGHRES/image/jpeg/47660cfac5087ce9c0d2c5ec626f135d/gr4_lrg.jpg gr4 gr4_lrg.jpg jpg 357695 1847 1333 IMAGE-HIGH-RES 1-s2.0-S2468823122004424-gr5_lrg.jpg https://s3-eu-west-1.amazonaws.com/prod-ucs-content-store-eu-west/content/pii:S2468823122004424/gr5/HIGHRES/image/jpeg/4338ecb210a9705f2fbf891e33418550/gr5_lrg.jpg gr5 gr5_lrg.jpg jpg 479458 2192 1502 IMAGE-HIGH-RES 1-s2.0-S2468823122004424-mmc1.docx https://s3-eu-west-1.amazonaws.com/prod-ucs-content-store-eu-west/content/pii:S2468823122004424/mmc1/MAIN/application/vnd.openxmlformats-officedocument.wordprocessingml.document/473d1de53e634aa9eac3f0001a2182f2/mmc1.docx mmc1 mmc1.docx docx 936103 APPLICATION 1-s2.0-S2468823122004424-si1.svg https://s3-eu-west-1.amazonaws.com/prod-ucs-content-store-eu-west/content/pii:S2468823122004424/STRIPIN/image/svg+xml/ae4bd0dd1d40e463a7cce3b391b336aa/si1.svg si1 si1.svg svg 9265 ALTIMG 1-s2.0-S2468823122004424-am.pdf https://s3-eu-west-1.amazonaws.com/prod-ucs-content-store-eu-west/content/egi:10F6CFZV2P8/MAIN/application/pdf/416d9ca8eb2be949f82283ce158c6618/am.pdf am am.pdf pdf false 829420 AAM-PDF MCAT 112556 112556 S2468-8231(22)00442-4 10.1016/j.mcat.2022.112556 The Author(s) Fig. 1 XRD patterns of the Al2O3 support, WO3-Al2O3 and NiW/Al-10 catalyst. Fig. 1 Fig. 2 Temperature programmed reduction profiles for NiW/Al-0.5 to 10 catalysts and WO3/Al2O3 sample. (Fig. 2B is an enlargement of Fig. 2A up to 500 °C). Fig. 2 Fig. 3 Temperature programmed ammonia desorption profiles for NiW/Al-0.5 to 10 catalysts and WO3-Al2O3 sample. Fig. 3 Fig. 4 FTIR pyridine (DRIFT) adsorption spectra for NiW/Al-0.5 to 10 catalysts. Fig. 4 Fig. 5 XPS spectra of Ni 2p region for the nickel containing catalysts. Fig. 5 Fig. 6 n-C12 conversion, (branched-C12), and i-C12+branched-C12 yields of n-dodecane for the NiW/Al-0.5 to 10 catalysts. (Tr = 300 °C, P = 2.0 MPa, liquid flow = 0.1 mL·min−1, H2 flow = 340 mLN·min−1). Fig. 6 Fig. 7 Selectivity trends: i-C12, branched-C12 and C6-10 selectivity of n-dodecane for NiW/Al-0.5 to 10 catalysts. (Tr = 300 °C, P = 2.0 MPa, liquid flow = 0.1 mL·min−1, H2 flow = 340 mLN·min−1). Fig. 7 Table 1 Chemical composition of prepared catalysts determined by ICP–OES. Table 1 Catalysts Ni wt% W wt% WO3/Al2O3 – 14.4 NiW/Al-1 1.1 12.5 NiW/Al-2 1.9 13.4 NiW/Al-4 3.2 13.1 NiW/Al-6 5.6 12.9 NiW/Al-8 8.4 13.0 NiW/Al-10 9.8 13.0 Table 2 Supports and catalysts textural properties. Table 2 Catalyst Specific Surface Area (BET) (m2/g) Pore volume(cm3/g) Pore diameter(nm) Al2O3 244 0.75 7.9 WO3/Al2O3 210 0.61 7.8 NiW/Al-0.5 202 0.61 7.6 NiW/Al-1 205 0.60 7.6 NiW/Al-2 205 0.58 7.8 NiW/Al-4 206 0.57 7.7 NiW/Al-6 201 0.55 7.6 NiW/Al-8 196 0.54 7.5 NiW/Al-10 190 0.52 7.3 Table 3 XPS results of the prepared catalysts: core level binding energy (eV) and atomic surface ratios. Table 3 Catalyst Ni 2p3/2 W4f7/2 Ni/W(at) Ni/W(bulk) Ni/Al(at) Ni/Al(bulk) W/Al(at) ( Ni / W ) xps ( Ni / W ) bulk NiW/Al-2 856.7 35.136.0 1.0 0.418 0.032 0.026 0.031 2.4 NiW/Al-4 856.7 35.1 36.0 1.4 0.835 0.044 0.052 0.030 1.9 NiW/Al-6 856.8 35.1 36.0 2.6 1.253 0.074 0.078 0.030 2.0 NiW/Al-8 856.8 35.136.0 3.2 1.670 0.094 0.105 0.029 1.9 NiW/Al-10 856.7 35.1 36.0 3.2 2.088 0.092 0.131 0.028 1.5 Table 4 Comparison of the catalytic activity results of similar catalysts described in Bibliography. Table 4 Catalyst Ni wt.% WHSV (h−1) Alkane conversion (%) Selectivity to isomers (%) Yields to isomers(%) Reaction temperature(°C) Alkane Ref. Ni/WOx/Al2O3 6 4.5 28 94 26 300 n-dodecane This work Pt/WOx/Al2O3 Pt: 0.3 4.5 67 87 58 350 n-dodecane [1] 2Ni/N-MFI 2 3 97 20 19 270 n‑dodecane [2] Ni2P/SAPO-11 3 3 83 72 60 350 n-dodecane [3] Ni(cit)/AlMCM-41 2 – 18 90 16 300 n-dodecane [4] Pt/WOx/Al2O3 Pt: 0.3 4.5 67 87 58 350 n-dodecane [8] Ni-WOx/SiO2-Al2O3 15 4 33 69 23 250 n-octane [9] Ni/WOx/SiO2-Al2O3 15 4 42 55 23 250 n-decane [10] Ni-/H-Beta 10 10 91 68 62 300 n-octane [21] Ni–Pt–WO x /SiO2–Al2O3 12 4 47 56 26 250 n-decane [38] Influence of nickel loading on the hydroisomerization of n-dodecane with nickel-tungsten oxide-alumina supported catalysts D. García-Pérez Investigation Formal analysis Writing – original draft A. Lopez-Garcia Investigation Formal analysis 1 P. Reñones Investigation Formal analysis Writing – original draft M.C. Alvarez-Galvan Supervision Writing – review & editing Funding acquisition ⁎ J.M. Campos-Martin Conceptualization Supervision Writing – review & editing Project administration Funding acquisition ⁎ Sustainable Energy and Chemistry Group (EQS), Instituto de Catálisis y Petroleoquímica, CSIC, c/Marie Curie, 2, Cantoblanco, Madrid 28049, Spain Sustainable Energy and Chemistry Group (EQS) Instituto de Catálisis y Petroleoquímica CSIC, c/Marie Curie, 2, Cantoblanco Madrid 28049 Spain Sustainable Energy and Chemistry Group (EQS), Instituto de Catálisis y Petroleoquímica, CSIC, c/Marie Curie, 2, Cantoblanco, Madrid 28049, Spain ⁎ Corresponding authors. 1 Present address: Instituto de Tecnología Química (CSIC-UPV), Av. dels Tarongers, s/n, 46022 Valencia, Spain Heterogeneous catalysts based on alumina-supported tungsten oxides (15 wt% W) with different loadings of nickel (0.5, 1, 2, 4, 6, 8 and 10 wt% Ni) were selected to study the influence of Ni loading on the hydroisomerization of n-dodecane. The catalysts were prepared by applying the wetness impregnation method on the supports to introduce W and Ni. The characterization techniques applied for determining physicochemical properties of the catalysts were N2 adsorption-desorption at 77 K (textural properties), X-ray diffraction (structure and crystalline phases), H2-TPR (redox properties), FTIR, NH3-TPD (acid sites analyses) and XPS (chemical surface analysis). The catalytic properties of such catalysts were found to be crucial in the n-dodecane conversion. The NH3-TPD profiles indicate that the medium acid sites are the main sites responsible for the reaction performance. The formation of bulky crystal structures of nickel species in the high nickel loading catalyst (10 wt% Ni) was confirmed by XRD and XPS results, resulting in the largest cracking activity. The conversion of n-dodecane and selectivity to i-C12+branched C12 tend to increase with Ni loading until the catalyst contains 6 wt% Ni (28% n-C12 conversion and 94% of branched C12 selectivity). The lower selectivity at high nickel loading is due to metal-based cracking reaction. An optimum balance between metal and acid centers is needed to achieve a compromise between conversion and selectivity, avoiding or minimizing cracking reactions. Graphical abstract Image, graphical abstract Data availability Data will be made available on request. 1 Introduction There are several serious disadvantages to use fossil fuels. These are especially worrying for the environment (global warming) and for the energy independence of nonproducing countries. The transport sector is one of the main consumers of fossil fuels and a key point for the decarbonization strategies of economies. Thus, there is great interest in the production of alternative fuels based on renewable sources and residues. The hydroconversion of vegetable oils, fats and used vegetable oils and Fischer-Tropsch synthesis are two routes for the synthesis of clean fuels. However, both processes yield a mix of linear hydrocarbons that cannot be used directly as fuels; in both cases, a hydroisomerization step is necessary to produce green fuel with physicochemical properties to be used as fuels [1]. Hydroisomerization is a process for converting linear paraffins (n-alkanes) into branched isomers [2]. This process is needed to produce high-quality gasoline (clean gasoline) with improved octane number and jet/diesel fuels as well as lubricant oils with improved low-temperature performance to comply with the cold flow properties of diesel fuel specifications such as the pour point (low-temperature freezing) and viscosity index [2–4]. In addition, an increasing proportion of isomerized gasoline in the gasoline pool contributes to environmental protection and product upgrades [5]. The hydroisomerization process is generally performed on bifunctional catalysts with metallic sites for hydrogenation/dehydrogenation and acidic sites for isomerization through carbenium ions [3,6,7]. Among several options, WO 3 supported in Al2O3 or ZrO 2 is a good option for the acidic function, including noble metals in the metal components (platinum, palladium), with Pt being the most active [3,5]. Based on the good previous results we obtained on similar systems, we selected Al2O3 as a support and WO3 as an acidic functional group [1,8]. The proper acid/metal content is decisive in achieving high activity, stability and product selectivity of these catalysts and in obtaining ideal hydroisomerization-cracking behavior of hydrocarbons [4,6,7]. The high cost of noble metals and their limited availability limit their use and applications [3,5]. The hydroisomerization performance (catalyst activity and isomerization selectivity) of bifunctional catalysts is influenced by another important factor: the acidity and pore structure of the support. Hydrocracking is promoted by a strong acidity, whereas high isomerization selectivity is obtained with medium strength acidity [3]. In addition, the hydrocracking of monobranched isomers is more difficult than that of multibranched isomers. Nickel-supported catalysts are used in the oil refining industry to produce high-quality gasoline and diesel fuels and lubricating oils [4] because among the nonnoble metals, nickel has shown the best catalytic activity for hydroisomerization of n-alkanes [2]. These catalysts cost less than noble metal catalysts, are less likely to poison, and have more availability, but the high tendency for hydrocracking reduces the hydroisomerization yield [3,4]. Other disadvantages are the tendency to deactivate by coking and the excess cracking producing a large amount of gasses [4]. The preparation of nonnoble metal catalysts (for instance, nickel) is important to avoid large metal particle formation, however, the high metal loadings are necessary due to the low specific activity of these metals with respect to the noble metals. This problem restricts the optimization of the existing nonnoble catalysts [5]. This means that there is a need for high nickel loading to be active. An increase in the metal particle size is produced by this loading, and pore opening could be restricted [4]. Therefore, it is an appealing task to look for a novel strategy to prepare nonnoble metal-based catalysts with reduced particle size for the hydroisomerization reaction [5]. This means that novel bifunctional catalysts with improved stability and diffusion properties can improve the capacity in the conversion of heavy paraffin fractions [4]. To our knowledge, there have been a few reports about the influence of nickel loading on the hydroisomerization of n-dodecane. Some groups have studied higher nickel content [9,10] than we reported here. In a previous work [8], we studied n-dodecane hydroisomerization with zirconia- and alumina-supported Pt. The present work introduces Ni as a metal to replace Pt in alumina-supported WO3 catalysts for the hydroisomerization of n-dodecane due to the high cost and limited availability of noble metals previously mentioned. However, the low activity of Ni compared to that of Pt, makes that nickel still cannot compete with Pt when the general economy of the process is considered. It seems that the problem of the low catalytic activity could be easily resolved by increasing the Ni loading on the support since nickel is approximately 1000 times cheaper than Pt [2]. 2 Materials and methods 2.1 Materials The employed tungsten precursor was ammonium metatungstate hydrate ((NH4)6(H2W12O40)·xH2O) (99%) purchased from Honeywell, and the nickel precursor was nickel(II) nitrate hexahydrate (Ni(NO3)2·6H2O) (99%) from Sigma-Aldrich. Alumina (γ-Al2O3) was purchased from Saint Gobain-NORPRO (1.5 × 4 mm trilobes, SA6975) and used as support. 2.2 Preparation of catalysts The catalysts were prepared by applying the wetness impregnation method on the supports to introduce W and Ni. In order to remove the moisture of the support, it was treated overnight at 120 °C before any impregnation. The following procedure was used to incorporate W in the γ-Al2O3 pellets by wet impregnation: a round flask was used to place the pellets in contact with an aqueous solution of ammonium metatungstate hydrate ((NH4)6(H2W12O40)·xH2O) (20 ml for 6 g of Al2O3). The mixture was stirred for 1 h, followed by the evaporation of the solvent under reduced pressure for 20 min. Finally, the solid was calcined in an oven at 500 °C for 2 h [8]. The following protocol was used to incorporate Ni by wet impregnation: a round flask was used to place the pellets in contact with an aqueous solution of nickel (II) nitrate hexahydrate (Ni(NO3)2·6H2O) (20 ml for 6 g Al2O3). Pellets and solution were stirred for 1 h after that time, the solvent was eliminated by evaporation at reduced pressure for 20 min. Finally, the solid was calcined at 400 °C for 2 h in an over under static air conditions. Following these procedures, the catalysts were prepared and labeled as Al2O3, WO3-Al2O3, and Ni/WO3/Al2O3= NiW/Al-[wt%] catalysts, where [wt%] indicates the wt% of Ni on the catalysts. The W loading was 15 wt% in all catalysts and the WO3-Al2O3 sample. 2.3 Catalyst characterization methods The textural properties were determined with a Micromeritics ASAP 2420 from the adsorption–desorption experiments [1,8]. The X-ray diffraction patterns were recorded with a X'Pert Pro PANalytical to identify the crystalline phases in the catalysts. The equipment have a CuKα radiation source (λ = 0.15418 nm) and X'Celerator detector based on RTMS (Real Time Multiple Strip) [1,11]. Temperature-programmed desorption and the acidity of the catalysts were performed on a Micromeritics TPD/TPR 2900 apparatus with a thermal conductivity detector (TCD) [8]. The nature of the acidity (Brønsted and Lewis acid sites) was determined by in situ IR spectroscopy of chemisorbed pyridine. The measurements of the IR spectra have been done in a DRIFT cell installed in a 6700 Nicolet FTIR spectrometer [1]. XPS spectra were obtained with a SPECS GmbH electron spectroscopy system with a PHOIBOS 150 9MCD energy analyzer, and Mg X-ray source [8,12].The metal contents of the catalysts were determined by elemental analysis via ICP–OES [8]. 2.4 Catalytic activity test The hydroisomerization performance of n-dodecane was tested with the prepared catalysts. A trickled-bed mode reactor worked in parallel flow and at high pressure to ensure close contact between the gas, the liquid, and the solid. The calcined catalyst pellets (1 g) diluted in 8 g of inert support were reduced in the reactor at 425 °C and atmospheric pressure. After the reduction, the reaction conditions were set to pressure of 2.0 MPa, reaction temperature of 300 °C, and the reactor was fed by a liquid flow of 0.1 mL·min−1 of n-dodecane and hydrogen flow of 340 mLN·min−1. The gas outlet was measured online with a µ-GC and the liquid samples were collected and analyzed offline. The time-on-stream was 24 h. More detailed information about the catalyst characterization methods and reaction conditions is included in the supplementary information. 3 Results and discussion The chemical compositions of the catalysts were confirmed by ICP analysis, as shown in Table 1 . The measured chemical composition is very close to the nominal values. The textural properties were studied by N2 adsorption-desorption. Table 2 shows the BET surface area, average pore volume and average pore diameter of alumina, support, and catalysts. The surface areas decrease firstly when WO3 is incorporated by impregnation onto the support (Al2O3) to obtain WO3-Al2O3. Then surface areas decrease more when nickel is impregnated onto WO3-Al2O3. The support surface is partially covered by the incorporation of WO3 and NiO as particles which block the support pores and reduce nitrogen access and adsorption capacity. But the variation with respect to WO3/Al2O3 is small, indicating that all catalyst samples have similar textural properties. The porosity of the samples was studied with the N2 adsorption-desorption isotherms of the support and catalysts. According to the IUPAC 2015 classification or Brunauer, Deming, Deming, and Teller (BDDT) classification for mesoporous materials all isotherms can be classified mainly by type IV (Fig. 1S) with hysteresis H1 due to mesoporous aggregates and in the high P/Po there is a small contribution of type II character due to unfilled macroporosity, since the isotherms do not level off entirely. Thus, the materials are formed by mesoporous and somewhat macroporous aggregates [13–18]. Isotherms are very similar in the support and catalysts indicating a high dispersion of the tungsten and nickel active phases on the support. The pore size distributions (Fig. 2S) were located in the mesopore range from 2 to 50 nm for the support and catalysts. The crystalline phases present in the catalysts were studied by X-ray diffraction. All PDF cards belong to ICDD database. The XRD profile of Al2O3 presents three main peaks located at 37.1° (with a shoulder at 39.4°), 46.0° and 66.7°, corresponding to the (110), (111) and (211) planes of γ-Al2O3, respectively, of the cubic crystal system (PDF card 00-001-1303). The WO3/Al2O3 sample profile shows the same peak structure as the Al2O3 sample. Nonobvious diffraction peaks were found for WO3 (PDF card 00-005-0388) or other tungsten oxides which indicates a high dispersion of tungsten oxide in the support and/or a domain size smaller than ∼2 nm for WO3 crystallites [19]. The structure of tungsten species dispersed on oxide supports depends on both the nature of the support and the concentration of tungsten [20]. The X-ray profiles of the Ni catalysts show the same diffraction lines from the support except for the NiW/Al-10 catalysts (Figs. 1 and 3S), which shows a new peak at 43.3° due to NiO associated with the (012) plane of the rhombohedral crystal system (PDF card 00-044-1159). It can be deduced that there is a high dispersion of NiO on the surface forming particles that are too small to diffract except for the catalyst with the highest loading (10% wt Ni). The TPR profiles are compiled on Fig. 2 (A and B). Fig. 2B is an enlargement of Fig. 2A up to 500 °C. As the nickel content increases, the reduction peak due to NiO (approximately 400 °C) is shifted to lower temperatures. This is because with low Ni concentrations, NiO particles are smaller, meaning that more species are in close contact with the support (greater interaction) and therefore are more difficult to be reduced. This is also reflected in the XRD diffractograms of the catalysts, which indicate that catalysts with higher Ni loadings present a lower dispersion. In the reduction profile of the NiW/Al-10 catalyst, there is a second peak at approximately 425 °C (Fig. 2B) that is due to NiO reduction to metallic Ni when nickel oxide interacts with WO3 sites. There is a second peak at high temperatures (750 °C) due to partial reduction of tungstate oxide. In the WO3-Al2O3 support, the tungsten oxide band at high temperatures is not visible. This is because metallic nickel activates hydrogen, and through the spill-over process, it facilitates tungsten oxide reduction. Considering these results, 425 °C is the reduction temperature for the activation of the catalysts before the reaction because all NiO will be reduced to metallic Ni. The acidity is an important factor that determines the reactivity of the catalysts used in the hydroisomerization reaction. NH3-TPD was applied to study the acid properties of the catalyst surface, evaluating the total acid site amount, and the distribution of acid sites by strength. Ammonia is a suitable probe molecule for acidity because its small size and basicity allow the interaction with most of the acid sites. The temperature of desorption is indicative of the acid site strength, while the amount of adsorbed ammonia is proportional to the number of acid centers [21]. The NH3-TPD profiles for all catalysts are shown in Fig. 3 . There are three different desorption peaks corresponding to different acid strengths: (a) desorption a lower temperature than 250 °C: weak acid sites, (b) desorption temperature from 250 to 400 °C: intermediate strength and (c) desorption at higher temperature than 400 °C: strong. WO3-Al2O3 exhibits two main desorption peaks at 155 and 555 °C corresponding to weak and strong acid sites. WOx species appear to interact strongly with sites on the surface of γ-Al2O3 [22]. At low nickel loadings (0.5 wt.% Ni), the catalysts have features similar to those of WO3-Al2O3. When nickel loading increases, the low-acid site peaks are moved to higher temperatures, and medium-acid sites appear [9]. All catalysts show a peak (520–550 °C) of strong acid sites, which is divided into two peaks at high nickel loadings (6–10 wt%), appearing as a new peak at approximately 470 °C. The acidity was introduced through WOx, so it was expected that all samples show a similar value of total acidity because all samples had a comparable W loading (ca.15% wt). This value was measured and was approximately 1.6 mmol NH3/g. The nature of the surface acid sites was studied of IR of adsorbed pyridine. IR spectroscopy of adsorbed pyridine facilitates the distinction of different acid sites. The catalysts were reduced at 425 °C and then the FTIR pyridine (DRIFT) adsorption spectra (Fig. 4 ) were measured at room temperature. The FTIR spectra show adsorption bands centered at approximately 1610, 1575 and 1448 cm−1, which correspond to adsorbed pyridine on Lewis acid sites (L) [23,24]. The alumina support has three possible Al3+ coordination with Lewis acidity: five, four and three [23]. A small band at 1540 cm−1, which is not visible in some catalysts, can be attributed to vibration modes of pyridinium ions on Brønsted acid sites (B) [24]. The nonobvious band at 1540 cm−1 for some catalysts is ascribed to the coverage of Brønsted acid sites with NiO at high content [3]. The absorption band at approximately 1490 cm−1 is due to a combination of signals of pyridine absorbed on Lewis or Brønsted acid sites. Brønsted acid sites are due to the reducible domains that act as redox sites required for the formation of H+species from H2 [25]. A shoulder at 1622 cm−1 is observed in the samples without nickel or with low nickel content, whose intensity decreases with increasing nickel loading. This signal corresponds to adsorbed Py on very strong Lewis acid sites, which are considered tetrahedral sites with cationic vacancies in close proximity. These species are covered by nickel species [26]. The nature and dispersion of nickel and tungsten species on the surface of the catalysts were studied by XPS analysis. Fig. 5 shows the Ni 2p XPS spectra for the NiW/Al-2 to 10 catalysts, Fig. 4S shows the W 4f XPS spectra for the NiW/Al-0.5 to 10 catalysts and Table 3 lists the binding energies (eV) (W 4f7/2 and Ni2p) and atomic surface ratios of the present elements. Al 2p signal at 74.5 eV [8] was the reference for the binding energies to correct for charging effects. In Fig. 5, the signal at approximately 856.7 eV is attributed to Ni2+species (NiO) and are accompanied by a satellite signal at approximately 862.9 eV, characteristic of this oxidation state [4,27,28]. The peak due to metallic nickel is not found because metallic nickel is formed in the reduction process before the reaction. Prior to this reduction, nickel is in the oxide form (NiO). The W 4f signal presents two contributions of the typical doublet corresponding to spin-orbital splitting (W4f7/2 and W4f5/2). One component is attributed to the WO3 species at approximately 35 eV for W4f7/2 [8,25] and 38.2 eV for W4f5/2. A second component at approximately 36 eV for W4f7/2 and 37.3 eV for W4f5/2 can be assigned to Al2(WO4)3, aluminum tungstate [8,29]. The surface atomic ratios of Ni/W or Ni/Al generally increase with Ni loading (Table 3), but this increase is lower than the corresponding increase in the nickel bulk concentration. This implies a decrease in the nickel dispersion as the nickel loading is higher. The most evident case is the absence of change in the Ni/Al surface atomic ratio between NiW/Al-8 and NiW/Al-10 catalysts, a clear indication of the formation of bulky crystal structures of nickel species as was detected by XRD. The Ni/W surface atomic ratio is higher than the Ni/W bulk atomic ratio. This effect can be due to the preferential deposition of nickel on tungsten moieties, which reduces the W signal with respect to the expected chemical composition. The lower (Ni/W) xps/(Ni/W) bulk ratio is for the NiW/Al-10 catalyst in which the nickel species start to form bulky structures, implying a lower Ni coverture of W with respect to the other catalysts without the development of bulky structures of nickel species. In conclusion, the characterization techniques applied for studying the catalysts, i.e., tN2 adsorption-desorption, XRD, H2-TPR, FTIR, NH3-TPD and XPS, indicated that there is a high dispersion of NiO and WO3 on the support surface revealed by the absence of NiO and WO3 diffraction peaks except for the NiW/Al-10 catalyst, which shows NiO peaks seen in XRD analysis. The XPS data also showed a decrease in the nickel dispersion with increasing nickel loading, indicating the formation of bulky crystal structures of nickel species, as was detected by XRD. Nickel deposits preferentially on tungsten moieties as the surface Ni/W atomic surface ratio is higher than the Ni/W atomic bulk ratio. The similarity between the support and catalyst textural properties in combination with XRD and XPS results indicates a high dispersion of the tungsten and nickel active phases on the samples. Medium acid sites (moderate acidity) are the main sites responsible for the reaction performance [30–32]. FTIR spectra show that more Lewis acid sites are present than Brønsted acid sites. It is worth noting the shoulder at 1622 cm−1 observed in the samples without nickel or low nickel loading corresponds to adsorbed Py on very strong Lewis acid sites. These species disappear because they are covered by the presence of nickel species. The hydroisomerization of n-dodecane was tested with the series of NiW/Al-x catalysts (x = 0.5, 1, 2, 4, 6, 8, 10). The time on stream was 24 h and the displayed results (conversion and selectivity) are the average of these 24 h. The samples were first reduced at 425 °C, this reduction temperature was deduced from TPR results since at 425 °C NiO will be reduced to metallic Ni. The experimental results show that all catalysts are active for the hydroisomerization of n-dodecane (Treaction = 300 °C, P = 2.0 MPa). The GC analyses show that the products contain iso-dodecane (i-C12), branched C12 and cracked products (C6-10) under the applied reaction conditions. Fig. 6 shows the n-C12 conversions and (i-C12+branched C12) yields for all catalysts studied. The conversion of n-dodecane and selectivity to branched-C12 tends to increase with Ni loading until the catalyst contains 6 wt% Ni. This catalyst shows the highest conversion (28%) obtained, and the XPS analysis showed that this catalyst has a higher Ni loading, and that the Ni/Al surface ratio increases before stabilizing (Table 3). Above this Ni loading, the conversion and selectivity to branched-C12 started to decrease. The enhanced activity with the presence of nickel is related to the location of Ni centers near the acid centers, which favors a fast desorption rate of the intermediates involved in the isomerization reactions [9] due to the higher amount of surface Ni species. It can also be correlated with the acidity of the catalysts. In the TPD measurements, it can be seen that with an increase in the nickel percentage in the catalysts, the intermediate acidity centers grow, which are directly related to the activity [33–35]. Such a catalytic behavior is typical for bifunctional catalysts. The higher accessibility of Ni sites in the proximity of acid sites enables that carbenium ions and olefins dehydrogenate rapidly and desorbs them as alkanes before they undergo cracking reactions. This effect is due to a lower metallic site/acid site ratio than the optimal for isomerization. If the catalysts metal function (in this case nickel) is increased, the formation of isomers via a decrease in the diffusion path between two metallic sites, will be promoted. This is because the proximity of metallic sites reduces the probability of the intermediate species interacting with acid sites and in consequence the crack of these species. For all that, there is an initial increase in isomerization selectivity (isomerized/cracked ratio) with increasing Ni loading from 0.5 to 6% [9,10]. In contrast, in the range of 8–10% Ni, metallic sites are enough to form olefins covering all the acid sites, and the increase in metal function (nickel loading) avoids the isomerization reaction and increases the cracking reactions [9,10] due to its low dispersion. The generation of the acid sites and the elimination of ionic intermediates from the surface before β-scission reactions occur depends on the accessibility of the dissociated hydrogen. Metallic nickel ensures the formation of this dissociated hydrogen needed to generate active acid sites. This avoids polymerization and cracking reactions and increases the isomerization selectivity [9]. The selectivity (Fig. 7 ) also changes as a function of the nickel loading in the catalysts. The maximum selectivity toward iso-C12 and toward branched-C12 was obtained with the NiW/Al-2 catalyst. Higher loads of nickel revealed a change in the selectivity toward cracking products. This trend increases with the quantity of nickel, showing a similar tendency to that observed in the conversion results. Although the NiW/Al-2 catalyst offers the highest selectivity toward the desired products, the NiW/Al-6 catalyst presents the highest yield of the reaction because of the high conversion and selectivity to iso-C12 and to branched-C12 (Fig. 6). This change in the selectivity, observed when a high amount of nickel (> 6 wt%) is employed, can be related to a mismatch between metal/acid centers that contain the catalysts (hydrogenation ability and acidity) [36]. This can be associated with the growth of strong acidity centers for high metal loading, as can be observed in the TPD analysis, which can favor cracking reactions and at the same time reduce the yield of the reaction owing to a slower desorption rate of intermediates [33,34]. Additionally, this can be explained by the metal distribution. A high nickel content can promote cracking reactions due to the worse metal dispersion caused by sintering or the presence of larger nickel particles, as seen in the XRD analysis for the NiW/Al-10 catalyst [9,10,35,37]. The obtained data show a compromise between conversion and selectivity, which is a characteristic behavior of bifunctional catalysts [9,35,37], with NiW/Al-6 being the most active catalyst attributable to an optimum balance between metal and acid centers. XPS data showed a good dispersion, and FTIR of adsorbed pyridine showed that this is the first sample without the 1622 cm−1 signal, a clear indication of a good balance between metal and acid centers. Table 4 compares the results we have obtained with similar reactions published in the bibliography. Hydroisomerization reactions varied in the temperature range of 250–350 °C. In general, zeolites are clearly more active in hydroisomerization reactions but with lower selectivity with respect to the catalytic system presented in this work; see Refs. [2,21]. Several reactions with catalysts supported on SiO2-WO3 [9,10,38] were carried out at 250 °C, and the results show that these catalysts are less selective than our catalytic system. Our catalytic system reaches a very high selectivity to long chain hydrocarbons with respect to the state of the art (Table 4), with a moderate conversion level, similar to previous works with nickel on amorphous supports. The acid/metal balance of the catalytic system presented in this work seems very efficient for the hydroisomerization of long chain hydrocarbons as a balance between conversion and selectivity results is derired and obtained. 4 Conclusions The conversion of n-dodecane and selectivity to branched C12 trends to increase with Ni loading in the nickel containing catalysts prepared by the wetness impregnation method. The highest conversion (28%) was achieved with the NiW/Al-6 catalyst (6% wt. Ni). Above 6 wt% Ni loading, a decrease in conversion and increase in selectivity toward cracking products were observed. This trend is more pronounced when the nickel loading rises. By increasing the nickel content to 6 wt%, the intermediate acidity was enlarged, which is directly correlated with the activity performance, increasing the yield toward branched-C12. However, above 6 wt% Ni, the formation of larger metal particles and the strong acidity increased, both factors promoting cracking reactions instead of isomerization reactions. At high nickel loading (10% wt. Ni), XPS and XRD data showed a decrease in nickel dispersion which was deposited preferentially on tungsten moieties forming bulky crystal structures. The obtained data confirm the role of an optimum balance between metal and medium-strength acid centers in the catalysts, which is the bottleneck for maximizing the yield in this kind of reaction. CRediT authorship contribution statement D. García-Pérez: Investigation, Formal analysis, Writing – original draft. A. Lopez-Garcia: Investigation, Formal analysis. P. Reñones: Investigation, Formal analysis, Writing – original draft. M.C. Alvarez-Galvan: Supervision, Writing – review & editing, Funding acquisition. J.M. Campos-Martin: Conceptualization, Supervision, Writing – review & editing, Project administration, Funding acquisition. Declaration of Competing Interest The authors declare that they have no known competing financial interests or personal relationships that could have appeared to influence the work reported in this paper. Acknowledgments The support of MICIN/AEI (Spain) through project ENE2016-74889-C4-3-R is acknowledged. DGP acknowledges MICIN/AEI for her contract (BES-2017-079679) (Spain). This research is part of the CSIC program for the Spanish Recovery, Transformation, and Resilience Plan funded by the Recovery and Resilience Facility of the European Union, established by Regulation (EU) 2020/2094 (TRE2021-03-012). We acknowledge the support of the publication fee by the CSIC Open Access Publication Support Initiative through its Unit of Information Resources for Research (URICI). Supplementary materials Supplementary material associated with this article can be found, in the online version, at doi:10.1016/j.mcat.2022.112556. Appendix Supplementary materials Image, application 1 References [1] D. García-Pérez G. Blanco-Brieva M.C. Alvarez-Galvan J.M. Campos-Martin Influence of W loading, support type, and preparation method on the performance of zirconia or alumina-supported Pt catalysts for n-dodecane hydroisomerization Fuel 2022 319 10.1016/j.fuel.2022.123704 D. García-Pérez, G. Blanco-Brieva, M.C. Alvarez-Galvan, J.M. Campos-Martin, Influence of W loading, support type, and preparation method on the performance of zirconia or alumina-supported Pt catalysts for n-dodecane hydroisomerization, Fuel. 319 (2022). 10.1016/j.fuel.2022.123704. [2] J. Kim S.W. Han J.C. Kim R. Ryoo Supporting nickel to replace platinum on zeolite nanosponges for catalytic hydroisomerization of n-dodecane ACS Catal. 8 2018 10545 10554 10.1021/ACSCATAL.8B03301 J. Kim, S.W. Han, J.C. Kim, R. Ryoo, Supporting nickel to replace platinum on zeolite nanosponges for catalytic hydroisomerization of n-dodecane, ACS Catal.8 (2018) 10545–10554. 10.1021/ACSCATAL.8B03301. [3] S. Tian J. Chen Hydroisomerization of n-dodecane on a new kind of bifunctional catalyst: nickel phosphide supported on SAPO-11 molecular sieve Fuel Process. Technol. 122 2014 120 128 10.1016/J.FUPROC.2014.01.031 S. Tian, J. Chen, Hydroisomerization of n-dodecane on a new kind of bifunctional catalyst: nickel phosphide supported on SAPO-11 molecular sieve, Fuel Process. Technol.122 (2014) 120–128. 10.1016/J.FUPROC.2014.01.031. [4] K. Fang J. Ren Y. Sun Effect of nickel precursors on the performance of Ni/AlMCM-41 catalysts for n-dodecane hydroconversion J. Mol. Catal. A Chem. 229 2005 51 58 10.1016/J.MOLCATA.2004.10.055 K. Fang, J. Ren, Y. Sun, Effect of nickel precursors on the performance of Ni/AlMCM-41 catalysts for n-dodecane hydroconversion, J. Mol. Catal. A Chem.229 (2005) 51–58. 10.1016/J.MOLCATA.2004.10.055. [5] Y. Lyu Z. Yu Y. Yang Y. Liu X. Zhao X. Liu S. Mintova Z. Yan G. Zhao Metal and acid sites instantaneously prepared over Ni/SAPO-11 bifunctional catalyst J. Catal. 374 2019 208 216 10.1016/j.jcat.2019.04.031 Y. Lyu, Z. Yu, Y. Yang, Y. Liu, X. Zhao, X. Liu, S. Mintova, Z. Yan, G. Zhao, Metal and acid sites instantaneously prepared over Ni/SAPO-11 bifunctional catalyst, J. Catal.374 (2019) 208–216. 10.1016/j.jcat.2019.04.031. [6] K. Fang, W. Wei, J. Ren, Y. Sun, n-dodecane hydroconversion over Ni/AlMCM-41 catalysts, 93 (2004) 235–242. [7] M.H.M. Ahmed O. Muraza A.K. Jamil E.N. Shafei Z.H. Yamani K.H. Choi Steam catalytic cracking of n-dodecane over Ni and Ni/Co bimetallic catalyst supported on hierarchical BEA zeolite Energy Fuels 31 2017 5482 5490 10.1021/ACS.ENERGYFUELS.7B00468 M.H.M. Ahmed, O. Muraza, A.K. Jamil, E.N. Shafei, Z.H. Yamani, K.H. Choi, Steam catalytic cracking of n-dodecane over Ni and Ni/Co bimetallic catalyst supported on hierarchical BEA zeolite, Energy Fuels. 31 (2017) 5482–5490. 10.1021/ACS.ENERGYFUELS.7B00468. [8] D. García-Pérez M.C. Alvarez-Galvan J.M. Campos-Martin J.L.G. Fierro Influence of the reduction temperature and the nature of the support on the performance of zirconia and alumina-supported pt catalysts for n-dodecane hydroisomerization Catalysts 11 2021 1 16 10.3390/catal11010088 D. García-Pérez, M.C. Alvarez-Galvan, J.M. Campos-Martin, J.L.G. Fierro, Influence of the reduction temperature and the nature of the support on the performance of zirconia and alumina-supported pt catalysts for n-dodecane hydroisomerization, Catalysts. 11 (2021) 1–16. 10.3390/catal11010088. [9] Y. Rezgui M. Guemini Hydroisomerization of n-octane over nickel - tungsten supported on silica - alumina catalysts Energy Fuels 21 2007 602 609 10.1021/ef060430w Y. Rezgui, M. Guemini, Hydroisomerization of n-octane over nickel - tungsten supported on silica - alumina catalysts, Energy Fuels. 21 (2007) 602–609. 10.1021/ef060430w. [10] Y. Rezgui M. Guemini Effect of acidity and metal content on the activity and product selectivity for n-decane hydroisomerization and hydrocracking over nickel-tungsten supported on silica-alumina catalysts Appl. Catal. A Gen. 282 2005 45 53 10.1016/j.apcata.2004.11.044 Y. Rezgui, M. Guemini, Effect of acidity and metal content on the activity and product selectivity for n-decane hydroisomerization and hydrocracking over nickel-tungsten supported on silica-alumina catalysts, Appl. Catal. A Gen.282 (2005) 45–53. 10.1016/j.apcata.2004.11.044. [11] D. García-Pérez M.C. Alvarez-Galvan M.C. Capel-Sanchez G. Blanco-Brieva S. Morales-delaRosa J.M. Campos-Martin J.L.G. Fierro Influence of bimetallic characteristics on the performance of MoCoP and MoFeP catalysts for methyl laurate hydrodeoxygenation Catal. Today 367 2021 43 50 10.1016/j.cattod.2020.09.034 D. García-Pérez, M.C. Alvarez-Galvan, M.C. Capel-Sanchez, G. Blanco-Brieva, S. Morales-delaRosa, J.M. Campos-Martin, J.L.G. Fierro, Influence of bimetallic characteristics on the performance of MoCoP and MoFeP catalysts for methyl laurate hydrodeoxygenation, Catal. Today367 (2021) 43–50. 10.1016/j.cattod.2020.09.034. [12] C.D. Wagner L.E. Davis M.V. Zeller J.A. Taylor R.H. Raymond L.H. Gale Empirical atomic sensitivity factors for quantitative analysis by electron spectroscopy for chemical analysis Surf. Interface Anal. 3 1981 211 225 10.1002/sia.740030506 C.D. Wagner, L.E. Davis, M.V. Zeller, J.A. Taylor, R.H. Raymond, L.H. Gale, Empirical atomic sensitivity factors for quantitative analysis by electron spectroscopy for chemical analysis, Surf. Interface Anal.3 (1981) 211–225. 10.1002/sia.740030506. [13] K.S.W. Sing R.T. Williams Physisorption hysteresis loops and the characterization of nanoporous materials Adsorpt. Sci. Technol. 22 2004 773 782 10.1260/0263617053499032 K.S.W. Sing, R.T. Williams, Physisorption hysteresis loops and the characterization of nanoporous materials, Adsorpt. Sci. Technol.22 (2004) 773–782. 10.1260/0263617053499032. [14] N.B. Nayak B.B. Nayak Temperature-mediated phase transformation, pore geometry and pore hysteresis transformation of borohydride derived in-born porous zirconium hydroxide nanopowders Sci. Rep. 6 2016 11 10.1038/srep26404 N.B. Nayak, B.B. Nayak, Temperature-mediated phase transformation, pore geometry and pore hysteresis transformation of borohydride derived in-born porous zirconium hydroxide nanopowders, Sci. Rep.6 (2016) 11. 10.1038/srep26404. [15] M. Thommes K. Kaneko A.V. Neimark J.P. Olivier F. Rodriguez-Reinoso K.S.W.W. Sing J.P. Olivier F. Rodriguez-Reinoso J. Rouquerol K.S.W.W. Sing Physisorption of gases, with special reference to the evaluation of surface area and pore size distribution (IUPAC technical report) Pure Appl. Chem. 87 2015 1051 1069 10.1515/PAC-2014-1117 M. Thommes, K. Kaneko, A.V. Neimark, J.P. Olivier, F. Rodriguez-Reinoso, K.S.W.W. Sing, J.P. Olivier, F. Rodriguez-Reinoso, J. Rouquerol, K.S.W.W. Sing, Physisorption of gases, with special reference to the evaluation of surface area and pore size distribution (IUPAC technical report), Pure Appl. Chem.87 (2015) 1051–1069. 10.1515/PAC-2014-1117. [16] V. Zarubina C. Nederlof B. Van Der Linden F. Kapteijn H.J. Heeres M. Makkee I. Melián-Cabrera Making coke a more efficient catalyst in the oxidative dehydrogenation of ethylbenzene using wide-pore transitional aluminas J. Mol. Catal. A Chem. 381 2014 179 187 10.1016/j.molcata.2013.10.010 V. Zarubina, C. Nederlof, B. Van Der Linden, F. Kapteijn, H.J. Heeres, M. Makkee, I. Melián-Cabrera, Making coke a more efficient catalyst in the oxidative dehydrogenation of ethylbenzene using wide-pore transitional aluminas, J. Mol. Catal. A Chem.381 (2014) 179–187. 10.1016/j.molcata.2013.10.010. [17] L.L. Pérez V. Zarubina H.J. Heeres I. Melián-Cabrera Condensation-enhanced self-assembly as a route to high surface area α-aluminas Chem. Mater. 25 2013 3971 3978 10.1021/cm401443b L.L. Pérez, V. Zarubina, H.J. Heeres, I. Melián-Cabrera, Condensation-enhanced self-assembly as a route to high surface area α-aluminas, Chem. Mater.25 (2013) 3971–3978. 10.1021/cm401443b. [18] L.L. Pérez S. Perdriau G. Ten Brink B.J. Kooi H.J. Heeres I. Melián-Cabrera Stabilization of self-assembled alumina mesophases Chem. Mater. 25 2013 848 855 10.1021/cm303174r L.L. Pérez, S. Perdriau, G. Ten Brink, B.J. Kooi, H.J. Heeres, I. Melián-Cabrera, Stabilization of self-assembled alumina mesophases, Chem. Mater.25 (2013) 848–855. 10.1021/cm303174r. [19] G. Mitran T. Yuzhakova I. Popescu I.C. Marcu Study of the esterification reaction of acetic acid with n-butanol over supported WO3 catalysts J. Mol. Catal. A Chem. 396 2015 275 281 10.1016/j.molcata.2014.10.014 G. Mitran, T. Yuzhakova, I. Popescu, I.C. Marcu, Study of the esterification reaction of acetic acid with n-butanol over supported WO3 catalysts, J. Mol. Catal. A Chem.396 (2015) 275–281. 10.1016/j.molcata.2014.10.014. [20] F. Can X. Courtois D. Duprez Tungsten-based catalysts for environmental applications Catalysts 11 2021 10.3390/CATAL11060703 F. Can, X. Courtois, D. Duprez, Tungsten-based catalysts for environmental applications, Catalysts. 11 (2021). 10.3390/CATAL11060703. [21] S.A. Karakoulia E. Heracleous A.A. Lappas Mild hydroisomerization of heavy naphtha on mono- and bi-metallic Pt and Ni catalysts supported on beta zeolite Catal. Today 355 2020 746 756 10.1016/J.CATTOD.2019.04.072 S.A. Karakoulia, E. Heracleous, A.A. Lappas, Mild hydroisomerization of heavy naphtha on mono- and bi-metallic Pt and Ni catalysts supported on beta zeolite, Catal. Today355 (2020) 746–756. 10.1016/J.CATTOD.2019.04.072. [22] D.G. Barton S.L. Soled E. Iglesia Solid acid catalysts based on supported tungsten oxides Top. Catal. 61 6 1998 87 99 10.1023/A:1019126708945 1998 D.G. Barton, S.L. Soled, E. Iglesia, Solid acid catalysts based on supported tungsten oxides, Top. Catal.199861. 6 (1998) 87–99. 10.1023/A:1019126708945. [23] X. Liu DRIFTS study of surface of γ-alumina and its dehydroxylation J. Phys. Chem. C 112 2008 5066 5073 10.1021/jp711901s X. Liu, DRIFTS study of surface of γ-alumina and its dehydroxylation, J. Phys. Chem. C112 (2008) 5066–5073. 10.1021/jp711901s. [24] G. Larsen S. Raghavan M. Mirquez E. Lotero Tungsta supported on zirconia and alumina catalysts: temperature-programmed desorption/reaction of methanol and pyridine DRIFTS studies Catal. Lett. 37 1996 57 59 G. Larsen, S. Raghavan, M. Mirquez, E. Lotero, Tungsta supported on zirconia and alumina catalysts: temperature-programmed desorption/reaction of methanol and pyridine DRIFTS studies, Catal. Lett.37 (1996) 57–59. [25] M.L. Shozi V.D.B.C. Dasireddy S. Singh P. Mohlala D.J. Morgan H.B. Friedrich Hydrogenolysis of glycerol to monoalcohols over supported Mo and W catalysts ACS Sustain. Chem. Eng. 4 2016 5752 5760 10.1021/acssuschemeng.6b01675 M.L. Shozi, V.D.B.C. Dasireddy, S. Singh, P. Mohlala, D.J. Morgan, H.B. Friedrich, Hydrogenolysis of glycerol to monoalcohols over supported Mo and W catalysts, ACS Sustain. Chem. Eng.4 (2016) 5752–5760. 10.1021/acssuschemeng.6b01675. [26] A. Penkova L.F. Bobadilla F. Romero-Sarria M.A. Centeno J.A. Odriozola Pyridine adsorption on NiSn/MgO–Al2O3: an FTIR spectroscopic study of surface acidity Appl. Surf. Sci. 317 2014 241 251 10.1016/J.APSUSC.2014.08.093 A. Penkova, L.F. Bobadilla, F. Romero-Sarria, M.A. Centeno, J.A. Odriozola, Pyridine adsorption on NiSn/MgO–Al2O3: an FTIR spectroscopic study of surface acidity, Appl. Surf. Sci.317 (2014) 241–251. 10.1016/J.APSUSC.2014.08.093. [27] M.C. Alvarez-Galvan G. Blanco-Brieva M. Capel-Sanchez S. Morales-delaRosa J.M. Campos-Martin J.L.G.G. Fierro Metal phosphide catalysts for the hydrotreatment of non-edible vegetable oils Catal. Today 302 2018 242 249 10.1016/j.cattod.2017.03.031 M.C. Alvarez-Galvan, G. Blanco-Brieva, M. Capel-Sanchez, S. Morales-delaRosa, J.M. Campos-Martin, J.L.G.G. Fierro, Metal phosphide catalysts for the hydrotreatment of non-edible vegetable oils, Catal. Today302 (2018) 242–249. 10.1016/j.cattod.2017.03.031. [28] H. Ai Q. Liu H. Yang W-doped ordered mesoporous Ni–Al2O3 catalyst for methanation of carbon monoxide Int. J. Hydrog. Energy 44 2019 23975 23982 10.1016/j.ijhydene.2019.07.115 H. Ai, Q. Liu, H. Yang, W-doped ordered mesoporous Ni–Al2O3 catalyst for methanation of carbon monoxide, Int. J. Hydrog. Energy44 (2019) 23975–23982. 10.1016/j.ijhydene.2019.07.115. [29] A. Katrib F. Hemming L. Hilaire P. Wehrer G. Maire XPS studies of suppoorted tungsten carbide(s) J. Electron Spectrosc. Relat. Phenom. 68 1994 589 595 10.1016/0368-2048(94)02162-7 A. Katrib, F. Hemming, L. Hilaire, P. Wehrer, G. Maire, XPS studies of suppoorted tungsten carbide(s), J. Electron Spectros. Relat. Phenom.68 (1994) 589–595. 10.1016/0368-2048(94)02162-7. [30] M. Ibrahim A.A. Jalil W.F.W. Zakaria M. Izan A.A. Fauzi I. Hussain Hydroconversion of n-hexane over Pt-supported on fibrous silica mordenite catalysts: effect of transition metals on acidity and activity IOP Conf. Ser. Mater. Sci. Eng. 808 2020 012007 10.1088/1757-899X/808/1/012007 M. Ibrahim, A.A. Jalil, W.F.W. Zakaria, M. Izan, A.A. Fauzi, I. Hussain, Hydroconversion of n-hexane over Pt-supported on fibrous silica mordenite catalysts: effect of transition metals on acidity and activity, IOP Conf. Ser. Mater. Sci. Eng.808 (2020) 012007. 10.1088/1757-899X/808/1/012007. [31] T. Mochizuki M. Toba Y. Abe Y. Yoshimura Hydroisomerization of n-hexadecane over Pt/beta and Pt/USY zeolite catalysts J. Jpn. Pet. Inst. 52 2009 143 144 10.1627/JPI.52.143 T. Mochizuki, M. Toba, Y. Abe, Y. Yoshimura, Hydroisomerization of n-hexadecane over Pt/beta and Pt/USY zeolite catalysts, J. Jpn. Pet. Inst.52 (2009) 143–144. 10.1627/JPI.52.143. [32] K.C. Park S.K. Ihm Comparison of Pt/zeolite catalysts for n-hexadecane hydroisomerization Appl. Catal. A Gen. 203 2000 201 209 10.1016/S0926-860X(00)00490-7 K.C. Park, S.K. Ihm, Comparison of Pt/zeolite catalysts for n-hexadecane hydroisomerization, Appl. Catal. A Gen.203 (2000) 201–209. 10.1016/S0926-860X(00)00490-7. [33] P. Berteau B. Delmon Modified aluminas : relationship between activity in 1-butanol dehydration and acidity measured by NH3 TPD Catal. Today 5 1989 121 137 10.1016/0920-5861(89)80020-3 P. Berteau, B. Delmon, Modified aluminas : relationship between activity in 1-butanol dehydration and acidity measured by NH3 TPD, Catal. Today5 (1989) 121–137. 10.1016/0920-5861(89)80020-3. [34] K. Jaroszewska M. Fedyna A. Masalska R. Łużny J. Trawczyński Promotional effect of pd addition on the catalytic activity of composite pt-pd/alsba-15–β catalyst for enhanced n-heptane hydroisomerization Catalysts 11 2021 1 22 10.3390/catal11030377 K. Jaroszewska, M. Fedyna, A. Masalska, R. Łużny, J. Trawczyński, Promotional effect of pd addition on the catalytic activity of composite pt-pd/alsba-15–β catalyst for enhanced n-heptane hydroisomerization, Catalysts. 11 (2021) 1–22. 10.3390/catal11030377. [35] Y. Yang X. Liu Y. Lyu Y. Liu W. Zhan Z. Yu L. Fan Z. Yan Enhanced dispersion of nickel nanoparticles on SAPO-5 for boosting hydroisomerization of n-hexane J. Colloid Interface Sci. 604 2021 727 736 10.1016/j.jcis.2021.07.039 Y. Yang, X. Liu, Y. Lyu, Y. Liu, W. Zhan, Z. Yu, L. Fan, Z. Yan, Enhanced dispersion of nickel nanoparticles on SAPO-5 for boosting hydroisomerization of n-hexane, J. Colloid Interface Sci.604 (2021) 727–736. 10.1016/j.jcis.2021.07.039. [36] W. Ding J. Liang L.L. Anderson Hydrocracking and hydroisomerization of high-density polyethylene and waste plastic over zeolite and silica - alumina-supported Ni and Ni-Mo sulfides Energy Fuels 11 1997 1219 1223 10.1021/ef970051q W. Ding, J. Liang, L.L. Anderson, Hydrocracking and hydroisomerization of high-density polyethylene and waste plastic over zeolite and silica - alumina-supported Ni and Ni-Mo sulfides, Energy Fuels. 11 (1997) 1219–1223. 10.1021/ef970051q. [37] P. Mäki-Arvela T.A.K. Khel M. Azkaar S. Engblom D.Y. Murzin Catalytic hydroisomerization of long-chain hydrocarbons for the production of fuels Catalysts 8 2018 10.3390/catal8110534 P. Mäki-Arvela, T.A.K. Khel, M. Azkaar, S. Engblom, D.Y. Murzin, Catalytic hydroisomerization of long-chain hydrocarbons for the production of fuels, Catalysts. 8 (2018). 10.3390/catal8110534. [38] Y. Rezgui M. Guemini Hydroisomerization of n-decane over Ni–Pt–W supported on amorphous silica–alumina catalysts Appl. Catal. A Gen. 374 2010 31 40 10.1016/J.APCATA.2009.11.021 Y. Rezgui, M. Guemini, Hydroisomerization of n-decane over Ni–Pt–W supported on amorphous silica–alumina catalysts, Appl. Catal. A Gen.374 (2010) 31–40. 10.1016/J.APCATA.2009.11.021.",
      "scopus-id": "85135395218",
      "coredata": {
        "eid": "1-s2.0-S2468823122004424",
        "dc:description": "Heterogeneous catalysts based on alumina-supported tungsten oxides (15 wt% W) with different loadings of nickel (0.5, 1, 2, 4, 6, 8 and 10 wt% Ni) were selected to study the influence of Ni loading on the hydroisomerization of n-dodecane. The catalysts were prepared by applying the wetness impregnation method on the supports to introduce W and Ni. The characterization techniques applied for determining physicochemical properties of the catalysts were N2 adsorption-desorption at 77 K (textural properties), X-ray diffraction (structure and crystalline phases), H2-TPR (redox properties), FTIR, NH3-TPD (acid sites analyses) and XPS (chemical surface analysis). The catalytic properties of such catalysts were found to be crucial in the n-dodecane conversion. The NH3-TPD profiles indicate that the medium acid sites are the main sites responsible for the reaction performance. The formation of bulky crystal structures of nickel species in the high nickel loading catalyst (10 wt% Ni) was confirmed by XRD and XPS results, resulting in the largest cracking activity. The conversion of n-dodecane and selectivity to i-C12+branched C12 tend to increase with Ni loading until the catalyst contains 6 wt% Ni (28% n-C12 conversion and 94% of branched C12 selectivity). The lower selectivity at high nickel loading is due to metal-based cracking reaction. An optimum balance between metal and acid centers is needed to achieve a compromise between conversion and selectivity, avoiding or minimizing cracking reactions.",
        "openArchiveArticle": "false",
        "prism:coverDate": "2022-08-31",
        "openaccessUserLicense": "http://creativecommons.org/licenses/by/4.0/",
        "prism:aggregationType": "Journal",
        "prism:url": "https://api.elsevier.com/content/article/pii/S2468823122004424",
        "dc:creator": [
          {
            "@_fa": "true",
            "$": "García-Pérez, D."
          },
          {
            "@_fa": "true",
            "$": "Lopez-Garcia, A."
          },
          {
            "@_fa": "true",
            "$": "Reñones, P."
          },
          {
            "@_fa": "true",
            "$": "Alvarez-Galvan, M.C."
          },
          {
            "@_fa": "true",
            "$": "Campos-Martin, J.M."
          }
        ],
        "link": [
          {
            "@_fa": "true",
            "@rel": "self",
            "@href": "https://api.elsevier.com/content/article/pii/S2468823122004424"
          },
          {
            "@_fa": "true",
            "@rel": "scidir",
            "@href": "https://www.sciencedirect.com/science/article/pii/S2468823122004424"
          }
        ],
        "dc:format": "application/json",
        "openaccessType": "Full",
        "pii": "S2468-8231(22)00442-4",
        "prism:volume": "529",
        "articleNumber": "112556",
        "prism:publisher": "The Author(s). Published by Elsevier B.V.",
        "dc:title": "Influence of nickel loading on the hydroisomerization of n-dodecane with nickel-tungsten oxide-alumina supported catalysts",
        "prism:copyright": "© 2022 The Author(s). Published by Elsevier B.V.",
        "openaccess": "1",
        "prism:issn": "24688231",
        "openaccessArticle": "true",
        "prism:publicationName": "Molecular Catalysis",
        "openaccessSponsorType": "FundingBody",
        "prism:pageRange": "112556",
        "pubType": "fla",
        "prism:coverDisplayDate": "August 2022",
        "prism:doi": "10.1016/j.mcat.2022.112556",
        "prism:startingPage": "112556",
        "dc:identifier": "doi:10.1016/j.mcat.2022.112556",
        "openaccessSponsorName": "Spanish Institutions 2022"
      },
      "objects": {
        "object": [
          {
            "@category": "standard",
            "@height": "413",
            "@width": "659",
            "@_fa": "true",
            "$": "https://api.elsevier.com/content/object/eid/1-s2.0-S2468823122004424-gr2.jpg?httpAccept=%2A%2F%2A",
            "@multimediatype": "JPEG image file",
            "@type": "IMAGE-DOWNSAMPLED",
            "@size": "70183",
            "@ref": "gr2",
            "@mimetype": "image/jpeg"
          },
          {
            "@category": "standard",
            "@height": "145",
            "@width": "301",
            "@_fa": "true",
            "$": "https://api.elsevier.com/content/object/eid/1-s2.0-S2468823122004424-ga1.jpg?httpAccept=%2A%2F%2A",
            "@multimediatype": "JPEG image file",
            "@type": "IMAGE-DOWNSAMPLED",
            "@size": "14490",
            "@ref": "ga1",
            "@mimetype": "image/jpeg"
          },
          {
            "@category": "standard",
            "@height": "414",
            "@width": "301",
            "@_fa": "true",
            "$": "https://api.elsevier.com/content/object/eid/1-s2.0-S2468823122004424-gr3.jpg?httpAccept=%2A%2F%2A",
            "@multimediatype": "JPEG image file",
            "@type": "IMAGE-DOWNSAMPLED",
            "@size": "49104",
            "@ref": "gr3",
            "@mimetype": "image/jpeg"
          },
          {
            "@category": "standard",
            "@height": "434",
            "@width": "320",
            "@_fa": "true",
            "$": "https://api.elsevier.com/content/object/eid/1-s2.0-S2468823122004424-gr1.jpg?httpAccept=%2A%2F%2A",
            "@multimediatype": "JPEG image file",
            "@type": "IMAGE-DOWNSAMPLED",
            "@size": "38340",
            "@ref": "gr1",
            "@mimetype": "image/jpeg"
          },
          {
            "@category": "standard",
            "@height": "308",
            "@width": "395",
            "@_fa": "true",
            "$": "https://api.elsevier.com/content/object/eid/1-s2.0-S2468823122004424-gr6.jpg?httpAccept=%2A%2F%2A",
            "@multimediatype": "JPEG image file",
            "@type": "IMAGE-DOWNSAMPLED",
            "@size": "34697",
            "@ref": "gr6",
            "@mimetype": "image/jpeg"
          },
          {
            "@category": "standard",
            "@height": "427",
            "@width": "357",
            "@_fa": "true",
            "$": "https://api.elsevier.com/content/object/eid/1-s2.0-S2468823122004424-gr7.jpg?httpAccept=%2A%2F%2A",
            "@multimediatype": "JPEG image file",
            "@type": "IMAGE-DOWNSAMPLED",
            "@size": "40271",
            "@ref": "gr7",
            "@mimetype": "image/jpeg"
          },
          {
            "@category": "standard",
            "@height": "417",
            "@width": "301",
            "@_fa": "true",
            "$": "https://api.elsevier.com/content/object/eid/1-s2.0-S2468823122004424-gr4.jpg?httpAccept=%2A%2F%2A",
            "@multimediatype": "JPEG image file",
            "@type": "IMAGE-DOWNSAMPLED",
            "@size": "48426",
            "@ref": "gr4",
            "@mimetype": "image/jpeg"
          },
          {
            "@category": "standard",
            "@height": "495",
            "@width": "339",
            "@_fa": "true",
            "$": "https://api.elsevier.com/content/object/eid/1-s2.0-S2468823122004424-gr5.jpg?httpAccept=%2A%2F%2A",
            "@multimediatype": "JPEG image file",
            "@type": "IMAGE-DOWNSAMPLED",
            "@size": "59347",
            "@ref": "gr5",
            "@mimetype": "image/jpeg"
          },
          {
            "@category": "thumbnail",
            "@height": "137",
            "@width": "219",
            "@_fa": "true",
            "$": "https://api.elsevier.com/content/object/eid/1-s2.0-S2468823122004424-gr2.sml?httpAccept=%2A%2F%2A",
            "@multimediatype": "GIF image file",
            "@type": "IMAGE-THUMBNAIL",
            "@size": "10221",
            "@ref": "gr2",
            "@mimetype": "image/gif"
          },
          {
            "@category": "thumbnail",
            "@height": "105",
            "@width": "219",
            "@_fa": "true",
            "$": "https://api.elsevier.com/content/object/eid/1-s2.0-S2468823122004424-ga1.sml?httpAccept=%2A%2F%2A",
            "@multimediatype": "GIF image file",
            "@type": "IMAGE-THUMBNAIL",
            "@size": "7257",
            "@ref": "ga1",
            "@mimetype": "image/gif"
          },
          {
            "@category": "thumbnail",
            "@height": "164",
            "@width": "119",
            "@_fa": "true",
            "$": "https://api.elsevier.com/content/object/eid/1-s2.0-S2468823122004424-gr3.sml?httpAccept=%2A%2F%2A",
            "@multimediatype": "GIF image file",
            "@type": "IMAGE-THUMBNAIL",
            "@size": "9196",
            "@ref": "gr3",
            "@mimetype": "image/gif"
          },
          {
            "@category": "thumbnail",
            "@height": "164",
            "@width": "121",
            "@_fa": "true",
            "$": "https://api.elsevier.com/content/object/eid/1-s2.0-S2468823122004424-gr1.sml?httpAccept=%2A%2F%2A",
            "@multimediatype": "GIF image file",
            "@type": "IMAGE-THUMBNAIL",
            "@size": "7844",
            "@ref": "gr1",
            "@mimetype": "image/gif"
          },
          {
            "@category": "thumbnail",
            "@height": "164",
            "@width": "210",
            "@_fa": "true",
            "$": "https://api.elsevier.com/content/object/eid/1-s2.0-S2468823122004424-gr6.sml?httpAccept=%2A%2F%2A",
            "@multimediatype": "GIF image file",
            "@type": "IMAGE-THUMBNAIL",
            "@size": "10037",
            "@ref": "gr6",
            "@mimetype": "image/gif"
          },
          {
            "@category": "thumbnail",
            "@height": "164",
            "@width": "137",
            "@_fa": "true",
            "$": "https://api.elsevier.com/content/object/eid/1-s2.0-S2468823122004424-gr7.sml?httpAccept=%2A%2F%2A",
            "@multimediatype": "GIF image file",
            "@type": "IMAGE-THUMBNAIL",
            "@size": "7612",
            "@ref": "gr7",
            "@mimetype": "image/gif"
          },
          {
            "@category": "thumbnail",
            "@height": "164",
            "@width": "118",
            "@_fa": "true",
            "$": "https://api.elsevier.com/content/object/eid/1-s2.0-S2468823122004424-gr4.sml?httpAccept=%2A%2F%2A",
            "@multimediatype": "GIF image file",
            "@type": "IMAGE-THUMBNAIL",
            "@size": "9428",
            "@ref": "gr4",
            "@mimetype": "image/gif"
          },
          {
            "@category": "thumbnail",
            "@height": "163",
            "@width": "112",
            "@_fa": "true",
            "$": "https://api.elsevier.com/content/object/eid/1-s2.0-S2468823122004424-gr5.sml?httpAccept=%2A%2F%2A",
            "@multimediatype": "GIF image file",
            "@type": "IMAGE-THUMBNAIL",
            "@size": "9251",
            "@ref": "gr5",
            "@mimetype": "image/gif"
          },
          {
            "@category": "high",
            "@height": "1827",
            "@width": "2917",
            "@_fa": "true",
            "$": "https://api.elsevier.com/content/object/eid/1-s2.0-S2468823122004424-gr2_lrg.jpg?httpAccept=%2A%2F%2A",
            "@multimediatype": "JPEG image file",
            "@type": "IMAGE-HIGH-RES",
            "@size": "524483",
            "@ref": "gr2",
            "@mimetype": "image/jpeg"
          },
          {
            "@category": "high",
            "@height": "640",
            "@width": "1333",
            "@_fa": "true",
            "$": "https://api.elsevier.com/content/object/eid/1-s2.0-S2468823122004424-ga1_lrg.jpg?httpAccept=%2A%2F%2A",
            "@multimediatype": "JPEG image file",
            "@type": "IMAGE-HIGH-RES",
            "@size": "94647",
            "@ref": "ga1",
            "@mimetype": "image/jpeg"
          },
          {
            "@category": "high",
            "@height": "1833",
            "@width": "1333",
            "@_fa": "true",
            "$": "https://api.elsevier.com/content/object/eid/1-s2.0-S2468823122004424-gr3_lrg.jpg?httpAccept=%2A%2F%2A",
            "@multimediatype": "JPEG image file",
            "@type": "IMAGE-HIGH-RES",
            "@size": "353152",
            "@ref": "gr3",
            "@mimetype": "image/jpeg"
          },
          {
            "@category": "high",
            "@height": "1921",
            "@width": "1417",
            "@_fa": "true",
            "$": "https://api.elsevier.com/content/object/eid/1-s2.0-S2468823122004424-gr1_lrg.jpg?httpAccept=%2A%2F%2A",
            "@multimediatype": "JPEG image file",
            "@type": "IMAGE-HIGH-RES",
            "@size": "283339",
            "@ref": "gr1",
            "@mimetype": "image/jpeg"
          },
          {
            "@category": "high",
            "@height": "1364",
            "@width": "1750",
            "@_fa": "true",
            "$": "https://api.elsevier.com/content/object/eid/1-s2.0-S2468823122004424-gr6_lrg.jpg?httpAccept=%2A%2F%2A",
            "@multimediatype": "JPEG image file",
            "@type": "IMAGE-HIGH-RES",
            "@size": "215264",
            "@ref": "gr6",
            "@mimetype": "image/jpeg"
          },
          {
            "@category": "high",
            "@height": "1892",
            "@width": "1583",
            "@_fa": "true",
            "$": "https://api.elsevier.com/content/object/eid/1-s2.0-S2468823122004424-gr7_lrg.jpg?httpAccept=%2A%2F%2A",
            "@multimediatype": "JPEG image file",
            "@type": "IMAGE-HIGH-RES",
            "@size": "227907",
            "@ref": "gr7",
            "@mimetype": "image/jpeg"
          },
          {
            "@category": "high",
            "@height": "1847",
            "@width": "1333",
            "@_fa": "true",
            "$": "https://api.elsevier.com/content/object/eid/1-s2.0-S2468823122004424-gr4_lrg.jpg?httpAccept=%2A%2F%2A",
            "@multimediatype": "JPEG image file",
            "@type": "IMAGE-HIGH-RES",
            "@size": "357695",
            "@ref": "gr4",
            "@mimetype": "image/jpeg"
          },
          {
            "@category": "high",
            "@height": "2192",
            "@width": "1502",
            "@_fa": "true",
            "$": "https://api.elsevier.com/content/object/eid/1-s2.0-S2468823122004424-gr5_lrg.jpg?httpAccept=%2A%2F%2A",
            "@multimediatype": "JPEG image file",
            "@type": "IMAGE-HIGH-RES",
            "@size": "479458",
            "@ref": "gr5",
            "@mimetype": "image/jpeg"
          },
          {
            "@category": "standard",
            "@_fa": "true",
            "$": "https://api.elsevier.com/content/object/eid/1-s2.0-S2468823122004424-mmc1.docx?httpAccept=%2A%2F%2A",
            "@multimediatype": "Microsoft Word file",
            "@type": "APPLICATION",
            "@size": "936103",
            "@ref": "mmc1",
            "@mimetype": "application/word"
          },
          {
            "@category": "thumbnail",
            "@_fa": "true",
            "$": "https://api.elsevier.com/content/object/eid/1-s2.0-S2468823122004424-si1.svg?httpAccept=%2A%2F%2A",
            "@multimediatype": "Scalable Vector Graphics file",
            "@type": "ALTIMG",
            "@size": "9265",
            "@ref": "si1",
            "@mimetype": "image/svg+xml"
          },
          {
            "@category": "standard",
            "@_fa": "true",
            "$": "https://api.elsevier.com/content/object/eid/1-s2.0-S2468823122004424-am.pdf?httpAccept=%2A%2F%2A",
            "@multimediatype": "Acrobat PDF file",
            "@type": "AAM-PDF",
            "@size": "829420",
            "@ref": "am",
            "@mimetype": "application/pdf"
          }
        ]
      },
      "link": {
        "@rel": "abstract",
        "@href": "https://api.elsevier.com/content/abstract/scopus_id/85135395218"
      }
    }
  }
}