{
  "metadata": {
    "title": "The synthesis of β-enaminones using trialkylamines and a Pd/DNA catalyst",
    "authors": "; ",
    "journal": "Molecular Catalysis",
    "date": "2021-02-28",
    "doi": "10.1016/j.mcat.2020.111365",
    "abstract": "",
    "uri": "https://api.elsevier.com/content/article/pii/S2468823120306283",
    "pii": "S2468823120306283"
  },
  "fulltext": {
    "full-text-retrieval-response": {
      "scopus-eid": "2-s2.0-85100115383",
      "originalText": "serial JL 315758 291210 291744 291790 291809 31 Molecular Catalysis MOLECULARCATALYSIS 2021-01-19 2021-01-19 2021-01-19 2021-01-19 2021-02-09T07:55:55 1-s2.0-S2468823120306283 S2468-8231(20)30628-3 S2468823120306283 10.1016/j.mcat.2020.111365 S300 S300.1 FULL-TEXT 1-s2.0-S2468823121X00028 2022-12-12T23:36:07.91775Z 0 0 20210201 20210228 2021 2021-01-19T17:01:11.308638Z absattachment articleinfo articlenumber articletitlenorm authfirstinitialnorm authfirstsurnamenorm cid cids contenttype copyright crossmark dateloaded dateloadedtxt datesearch datesort dateupdated dco docsubtype doctype doi eid ewtransactionid hubeid indexeddate issn issnnorm itemstage itemtransactionid itemweight openaccess openarchive pg pgfirst pii piinorm pubdateend pubdatestart pubdatetxt pubyr sectiontitle sortorder srctitle srctitlenorm srctype ssids alllist content subj subheadings suppl tomb volfirst volissue volumelist webpdf webpdfpagecount yearnav figure table e-component body affil appendices articletitle auth authfirstini authfull authkeywords authlast highlightsabst orcid primabst ref specialabst 2468-8231 24688231 true 502 502 C Volume 502 20 111365 111365 111365 202102 February 2021 2021-02-01 2021-02-28 2021 Regular Papers article fla © 2021 Elsevier B.V. All rights reserved. SYNTHESISENAMINONESUSINGTRIALKYLAMINESAPDDNACATALYST MART M 1 Introduction 2 Results and discussions 2.1 Pd/DNA catalyzed four-component synthesis of β-enaminones 2.2 Effect of the tertiary amine structure 2.3 The method applicability to different derivatives of iodobenzene and phenylacetylene 2.4 Catalyst recycling 2.5 Studies on the reaction mechanism 2.5.1 Effect of O2 2.5.2 Influence of water 2.6 The plausible mechanism of β-enaminones formation in the presence of Pd/DNA 3 Conclusions 4 Experimental 4.1 Preparation of Pd/DNA catalysts 4.2 Pyrolysis of C2 4.3 General procedure for synthesis of β-enaminones 4.4 Procedure for C2 reuse 4.5 Pd leaching test 4.6 Hot filtration test Appendix A Supplementary data References GADGE 2014 10367 10389 S GAUTAM 2015 4663 4702 P BRENNFUHRER 2009 4114 4133 A WU 2011 4986 5009 X WU 2013 1 35 X WU 2014 1041 1053 X RAMESH 2003 501 504 C MORIMOTO 2004 5580 5588 T KONISHI 2014 1971 1986 H ALEXANDER 2013 3272 3279 M SHI 2018 2959 2970 L ZHAO 2016 2177 2181 Y WAN 2016 6034 6037 J QUINONES 2017 3568 3571 R SRIDHARAN 2007 2133 2142 V XU 2009 818 822 S ZENG 2019 3656 3661 X WANG 2019 2223 2226 L WU 2019 6753 6756 W CACCHI 2008 2629 2632 S ROY 2011 7482 7490 S CHISHOLM 2016 7557 7565 D WU 2011 106 110 X KARPOV 2013 2815 2826 A WANG 2017 2680 2684 L SHI 2014 2560 2566 L TANG 2012 3423 3428 L CAMACHO 2017 2262 2273 A WANG 2010 7912 7914 Y ITOH 2012 1737 1740 H KANDATHIL 2020 e5357 V MART 2018 552 M MART 2019 28 36 M MART 2020 111124 M MANE 2016 4974 4980 R SHI 2015 3247 3250 R LING 2013 4214 4216 Z FANG 2014 14775 14777 T MANE 2018 160 164 R MANE 2017 2621 2629 R BAO 2014 803 808 Y LIU 2011 2184 2187 Y MANE 2016 1223 1228 R MARTX2021X111365 MARTX2021X111365XM 2023-01-19T00:00:00.000Z 2023-01-19T00:00:00.000Z http://creativecommons.org/licenses/by-nc-nd/4.0/ © 2021 Elsevier B.V. All rights reserved. https://doi.org/10.15223/policy-017 https://doi.org/10.15223/policy-037 https://doi.org/10.15223/policy-012 https://doi.org/10.15223/policy-029 https://doi.org/10.15223/policy-004 item S2468-8231(20)30628-3 S2468823120306283 1-s2.0-S2468823120306283 10.1016/j.mcat.2020.111365 315758 2021-04-15T12:43:26.902219Z 2021-02-01 2021-02-28 1-s2.0-S2468823120306283-main.pdf https://s3-eu-west-1.amazonaws.com/prod-ucs-content-store-eu-west/content/pii:S2468823120306283/MAIN/application/pdf/b65bbb62f485d9066f986a6206d98899/main.pdf main.pdf pdf true 2672048 MAIN 7 1-s2.0-S2468823120306283-main_1.png https://s3-eu-west-1.amazonaws.com/prod-ucs-content-store-eu-west/content/pii:S2468823120306283/PREVIEW/image/png/645b03e1472371fc59521c3ac2bd611e/main_1.png main_1.png png 56366 849 656 IMAGE-WEB-PDF 1 1-s2.0-S2468823120306283-ga1.jpg https://s3-eu-west-1.amazonaws.com/prod-ucs-content-store-eu-west/content/pii:S2468823120306283/ga1/DOWNSAMPLED/image/jpeg/66dad8102b99f39bdf39f2bc3e70e7b3/ga1.jpg ga1 true ga1.jpg jpg 19178 200 330 IMAGE-DOWNSAMPLED 1-s2.0-S2468823120306283-gr4.jpg https://s3-eu-west-1.amazonaws.com/prod-ucs-content-store-eu-west/content/pii:S2468823120306283/gr4/DOWNSAMPLED/image/jpeg/59a59be3f610be7feb7e53d5cc60e11f/gr4.jpg gr4 gr4.jpg jpg 18408 261 340 IMAGE-DOWNSAMPLED 1-s2.0-S2468823120306283-sc1.jpg https://s3-eu-west-1.amazonaws.com/prod-ucs-content-store-eu-west/content/pii:S2468823120306283/sc1/DOWNSAMPLED/image/jpeg/670d298adcabd114fc0626d02fb45b51/sc1.jpg sc1 sc1.jpg jpg 19720 249 491 IMAGE-DOWNSAMPLED 1-s2.0-S2468823120306283-sc2.jpg https://s3-eu-west-1.amazonaws.com/prod-ucs-content-store-eu-west/content/pii:S2468823120306283/sc2/DOWNSAMPLED/image/jpeg/048cae53af7447968255b19c9e43cdbe/sc2.jpg sc2 sc2.jpg jpg 11250 74 566 IMAGE-DOWNSAMPLED 1-s2.0-S2468823120306283-sc3.jpg https://s3-eu-west-1.amazonaws.com/prod-ucs-content-store-eu-west/content/pii:S2468823120306283/sc3/DOWNSAMPLED/image/jpeg/bece11b40cb693d1dc2a1a17063dfc2f/sc3.jpg sc3 sc3.jpg jpg 10447 134 491 IMAGE-DOWNSAMPLED 1-s2.0-S2468823120306283-sc4.jpg https://s3-eu-west-1.amazonaws.com/prod-ucs-content-store-eu-west/content/pii:S2468823120306283/sc4/DOWNSAMPLED/image/jpeg/c2bc5cec6dd405e7c99a219692587734/sc4.jpg sc4 sc4.jpg jpg 12063 78 566 IMAGE-DOWNSAMPLED 1-s2.0-S2468823120306283-sc5.jpg https://s3-eu-west-1.amazonaws.com/prod-ucs-content-store-eu-west/content/pii:S2468823120306283/sc5/DOWNSAMPLED/image/jpeg/43a40a080321e61e59edc7af010a5226/sc5.jpg sc5 sc5.jpg jpg 10705 137 491 IMAGE-DOWNSAMPLED 1-s2.0-S2468823120306283-sc6.jpg https://s3-eu-west-1.amazonaws.com/prod-ucs-content-store-eu-west/content/pii:S2468823120306283/sc6/DOWNSAMPLED/image/jpeg/bf01b8a0ad2a1333f6bfb5f7b93eb782/sc6.jpg sc6 sc6.jpg jpg 12137 65 566 IMAGE-DOWNSAMPLED 1-s2.0-S2468823120306283-gr1.jpg https://s3-eu-west-1.amazonaws.com/prod-ucs-content-store-eu-west/content/pii:S2468823120306283/gr1/DOWNSAMPLED/image/jpeg/bc7286ed066dbc4c3bba49b62fe65b5c/gr1.jpg gr1 gr1.jpg jpg 15195 277 339 IMAGE-DOWNSAMPLED 1-s2.0-S2468823120306283-sc7.jpg https://s3-eu-west-1.amazonaws.com/prod-ucs-content-store-eu-west/content/pii:S2468823120306283/sc7/DOWNSAMPLED/image/jpeg/4ad13fbed50f4a4cbfa0a2791548f69d/sc7.jpg sc7 sc7.jpg jpg 23185 221 566 IMAGE-DOWNSAMPLED 1-s2.0-S2468823120306283-gr2.jpg https://s3-eu-west-1.amazonaws.com/prod-ucs-content-store-eu-west/content/pii:S2468823120306283/gr2/DOWNSAMPLED/image/jpeg/4984c2fbf2dc0e821bb8336ab4dc0f35/gr2.jpg gr2 gr2.jpg jpg 33806 218 679 IMAGE-DOWNSAMPLED 1-s2.0-S2468823120306283-sc8.jpg https://s3-eu-west-1.amazonaws.com/prod-ucs-content-store-eu-west/content/pii:S2468823120306283/sc8/DOWNSAMPLED/image/jpeg/1db6e50299e4302d3ed988a56714f5c6/sc8.jpg sc8 sc8.jpg jpg 16055 125 566 IMAGE-DOWNSAMPLED 1-s2.0-S2468823120306283-gr3.jpg https://s3-eu-west-1.amazonaws.com/prod-ucs-content-store-eu-west/content/pii:S2468823120306283/gr3/DOWNSAMPLED/image/jpeg/74a4643153ea21875c9f622e00048442/gr3.jpg gr3 gr3.jpg jpg 40026 182 679 IMAGE-DOWNSAMPLED 1-s2.0-S2468823120306283-fx1.jpg https://s3-eu-west-1.amazonaws.com/prod-ucs-content-store-eu-west/content/pii:S2468823120306283/fx1/DOWNSAMPLED/image/jpeg/b4468433f020a1d0d6fb73d160c97121/fx1.jpg fx1 fx1.jpg jpg 35565 324 474 IMAGE-DOWNSAMPLED 1-s2.0-S2468823120306283-ga1.sml https://s3-eu-west-1.amazonaws.com/prod-ucs-content-store-eu-west/content/pii:S2468823120306283/ga1/THUMBNAIL/image/gif/d936fcf743696647e26799dd811cb43f/ga1.sml ga1 true ga1.sml sml 10646 133 219 IMAGE-THUMBNAIL 1-s2.0-S2468823120306283-gr4.sml https://s3-eu-west-1.amazonaws.com/prod-ucs-content-store-eu-west/content/pii:S2468823120306283/gr4/THUMBNAIL/image/gif/b30f05139f2e6ea0b3dd668bb5ef5076/gr4.sml gr4 gr4.sml sml 6665 164 214 IMAGE-THUMBNAIL 1-s2.0-S2468823120306283-sc1.sml https://s3-eu-west-1.amazonaws.com/prod-ucs-content-store-eu-west/content/pii:S2468823120306283/sc1/THUMBNAIL/image/gif/ab0ad006597105cdc1bf5c0c301acb2a/sc1.sml sc1 sc1.sml sml 4390 111 219 IMAGE-THUMBNAIL 1-s2.0-S2468823120306283-sc2.sml https://s3-eu-west-1.amazonaws.com/prod-ucs-content-store-eu-west/content/pii:S2468823120306283/sc2/THUMBNAIL/image/gif/07976fc6da74fbd348c2ff8385c20afa/sc2.sml sc2 sc2.sml sml 2457 29 219 IMAGE-THUMBNAIL 1-s2.0-S2468823120306283-sc3.sml https://s3-eu-west-1.amazonaws.com/prod-ucs-content-store-eu-west/content/pii:S2468823120306283/sc3/THUMBNAIL/image/gif/374a64e4e0a69c01d33079083957d3ac/sc3.sml sc3 sc3.sml sml 2769 60 219 IMAGE-THUMBNAIL 1-s2.0-S2468823120306283-sc4.sml https://s3-eu-west-1.amazonaws.com/prod-ucs-content-store-eu-west/content/pii:S2468823120306283/sc4/THUMBNAIL/image/gif/6a9956599c28ed133a9fc240d89016a1/sc4.sml sc4 sc4.sml sml 2556 30 219 IMAGE-THUMBNAIL 1-s2.0-S2468823120306283-sc5.sml https://s3-eu-west-1.amazonaws.com/prod-ucs-content-store-eu-west/content/pii:S2468823120306283/sc5/THUMBNAIL/image/gif/fbc66348ecbfae72c1a31a2e94ff2b8b/sc5.sml sc5 sc5.sml sml 2847 61 219 IMAGE-THUMBNAIL 1-s2.0-S2468823120306283-sc6.sml https://s3-eu-west-1.amazonaws.com/prod-ucs-content-store-eu-west/content/pii:S2468823120306283/sc6/THUMBNAIL/image/gif/bf02dabecd40ea868bb1fb5f31706287/sc6.sml sc6 sc6.sml sml 2470 25 219 IMAGE-THUMBNAIL 1-s2.0-S2468823120306283-gr1.sml https://s3-eu-west-1.amazonaws.com/prod-ucs-content-store-eu-west/content/pii:S2468823120306283/gr1/THUMBNAIL/image/gif/4e119abf19eb1de22c58326a1ef8063c/gr1.sml gr1 gr1.sml sml 5042 164 200 IMAGE-THUMBNAIL 1-s2.0-S2468823120306283-sc7.sml https://s3-eu-west-1.amazonaws.com/prod-ucs-content-store-eu-west/content/pii:S2468823120306283/sc7/THUMBNAIL/image/gif/22a2428809620f4d01ef55a2013af7f3/sc7.sml sc7 sc7.sml sml 4105 86 219 IMAGE-THUMBNAIL 1-s2.0-S2468823120306283-gr2.sml https://s3-eu-west-1.amazonaws.com/prod-ucs-content-store-eu-west/content/pii:S2468823120306283/gr2/THUMBNAIL/image/gif/ee6bb0ecf9b434b88f01ce295afdf1f4/gr2.sml gr2 gr2.sml sml 10546 70 219 IMAGE-THUMBNAIL 1-s2.0-S2468823120306283-sc8.sml https://s3-eu-west-1.amazonaws.com/prod-ucs-content-store-eu-west/content/pii:S2468823120306283/sc8/THUMBNAIL/image/gif/360261d33030bf92d38165e9bfb3259f/sc8.sml sc8 sc8.sml sml 3022 48 219 IMAGE-THUMBNAIL 1-s2.0-S2468823120306283-gr3.sml https://s3-eu-west-1.amazonaws.com/prod-ucs-content-store-eu-west/content/pii:S2468823120306283/gr3/THUMBNAIL/image/gif/83d32605f77e924ef4ba64e4615c98a0/gr3.sml gr3 gr3.sml sml 9028 59 219 IMAGE-THUMBNAIL 1-s2.0-S2468823120306283-fx1.sml https://s3-eu-west-1.amazonaws.com/prod-ucs-content-store-eu-west/content/pii:S2468823120306283/fx1/THUMBNAIL/image/gif/81e310c82cdb554579ed954a1f6deedd/fx1.sml fx1 fx1.sml sml 7281 150 219 IMAGE-THUMBNAIL 1-s2.0-S2468823120306283-mmc1.docx https://s3-eu-west-1.amazonaws.com/prod-ucs-content-store-eu-west/content/pii:S2468823120306283/mmc1/MAIN/application/vnd.openxmlformats-officedocument.wordprocessingml.document/0873e90ba74d6d40781624cb56379c35/mmc1.docx mmc1 mmc1.docx docx 3236518 APPLICATION 1-s2.0-S2468823120306283-am.pdf am am.pdf pdf 934600 AAM-PDF https://s3-eu-west-1.amazonaws.com/prod-ucs-content-store-eu-west/content/egi:10S0LVH38CJ/MAIN/application/pdf/6a754ac2d9eeecbf4b8cc6e61837c200/am.pdf MCAT 111365 111365 S2468-8231(20)30628-3 10.1016/j.mcat.2020.111365 Elsevier B.V. Scheme 1 Palladium-catalyzed four-component one-pot synthesis of enaminones. Scheme 1 Scheme 2 Pd/DNA catalyzed four-component synthesis of β-enaminone 1a. Scheme 2 Scheme 3 Formation of β-enaminones by the Michael addition. Scheme 3 Scheme 4 Four-component synthesis of β-enaminones with HNEt2. Scheme 4 Scheme 5 Reaction of alkynone with NEt3. Scheme 5 Scheme 6 Four-component synthesis of β-enaminones with a different alkyl bearing amine. Scheme 6 Scheme 7 Effect of O2 on the synthesis of β-enaminone. Scheme 7 Scheme 8 Influence of water on β-enaminone formation. Scheme 8 Fig. 1 Recycling of the Pd/DNA (C2) in the four-component synthesis of β-enaminone 1c. Fig. 1 Fig. 2 Morphology and size distribution of C2 as prepared. Fig. 2 Fig. 3 Morphology of the C2 recovered after recycling experiments. Fig. 3 Fig. 4 Postulated reaction mechanism. Fig. 4 Table 1 Optimization of the reaction conditionsa (Scheme 2). Table 1 Entry T [oC] Solvent Amount of NEt3 [equiv.] Time [h] Conv. [%] b Yield 1a [%] b Yield 2a [%] b Yield 3a [%] b 1 c 100 DMF 3 16 72 8 27 22 2 100 DMF 3 24 99 39 56 1 3 100 CH3CN 3 16 76 6 47 21 4 100 Dioxane 4 24 80 30 35 4 5 120 DMF 3 3 60 15 38 3 6 120 DMF 3 6 68 19 24 8 7 120 DMF 3 16 83 62 10 2 8 120 DMF 3 24 97 57 28 3 9 120 DMF 4 24 99 67 (60) d 12 6 10 120 DMF/Dioxane (1/1) 4 24 82 24 n.d. 11 11 120 Ethylene Glycol 4 16 99 n.d. n.d. 44 a[Pd] (2 mol %), solvent (3 mL), iodobenzene (1 mmol), phenylacetylene (1.2 mmol), CO (balloon pressure). b Conversions and yields were determined by GC using mesitylene as an internal standard. c 15 mmol of H2O was added. d Isolated yield. Table 2 Different palladium catalysts in the synthesis of β-enaminones[ a,b ]. Table 2 Entry Source of Pd Time [h] Temp. [T oC] Conv. [%] b Yield 1a [%] b Yield 2a [%] b Yield 3a [%] b 1 Pd/DNA (C1) 24 100 99 22 75 (68) c 2 2 Pd/DNA (C1) 24 120 99 67 (60) c 12 6 3 Pd/DNA (C2) 24 100 99 31 56 (50) c 7 4 Pd/DNA (C2) 16 120 99 57 (51) c 20 4 5 Pd/DNA (C2) 24 120 99 71 (67) c 6 5 6 d Pd/DNA (C2) 24 120 99 68 9 5 7 e Pd/DNA (C2) 24 120 91 57 11 5 8 C2-P 24 100 38 8 25 3 9 C2-P 24 120 80 28 46 1 10 Pd(OAc)2 24 100 99 n.d. n.d. 38 11 Pd(OAc)2 16 120 99 n.d. n.d. 10 12 Pd/C (10 %wt) 24 100 99 21 6 29 13 Pd/C (10 %wt) 16 120 99 7 2 29 a [Pd] (2 mol %), DMF (3 mL), iodobenzene (1 mmol), phenylacetylene (1.2 mmol), NEt3 (4 mmol), CO (balloon pressure). b Conversions and yields were determined by GC using mesitylene as an internal standard. c Isolated yield. d 1 mol % of Pd was used. e 0.5 mol % of Pd was used. Table 3 The yield of β-enaminones using different tertiary amines[ a,b ]. Table 3 Entry Amine derivative Temp. [T oC] Conv. [%] b Yield 1a-1d [%] b Yield 2a [%] b Yield 3a [%] b 1 Triethylamine 100 99 31 (1a) 56 (50) c 7 2 Triethylamine 120 99 71 (1a) (67) c 6 5 3 Tri-n-propylamine 100 99 93 (1b) (88) c n.d. n.d. 4 Tri-n-propylamine 120 99 80 (1b) (72) c n.d. n.d. 5 Tri-n-butylamine 100 99 90 (1c) (85) c n.d. n.d. 6 d Tri-n-butylamine 100 99 71 (1c) n.d. 7 7 Tri-n-butylamine 120 99 87 (1c) (80) c n.d. n.d 8 Tribenzylamine 120 0 n.d. (1d) n.d. n.d. a Catalyst C2 [Pd] (2 mol %), DMF (3 mL), iodobenzene (1 mmol), phenylacetylene (1.2 mmol), amine (4 mmol), CO (balloon pressure). b Conversions and yields were determined by GC using mesitylene as an internal standard. c Isolated yield. d Pd/C (10 wt%) was used instead of Pd/DNA. Table 4 The yield of β-enaminones obtained from different iodobenzenes and phenylacetylenes[a, b]. Table 4 a Catalyst C2 [Pd] (2 mol %), DMF (3 mL), aryl iodide (1 mmol), terminal alkyne (1.2 mmol), NBu3 (4 mmol), 120 °C, CO (balloon pressure); b Yields were determined by GC using mesitylene as an internal standard; c Isolated yield. The synthesis of β-enaminones using trialkylamines and a Pd/DNA catalyst M. Mart A.M. Trzeciak * University of Wrocław, Faculty of Chemistry, 14 F. Joliot-Curie, 50-383, Wrocław, Poland University of Wrocław Faculty of Chemistry 14 F. Joliot-Curie Wrocław 50-383 Poland University of Wrocław, Faculty of Chemistry, 14 F. Joliot-Curie, 50-383 Wrocław, Poland ⁎ Corresponding author. Graphical abstract A new one-pot procedure leading to β-enaminones has been developed. The elaborated methodology involves the cascade sequencing of carbonylative Sonogashira coupling of aryl iodide with a terminal alkyne and the oxidative dealkylation of tertiary amines. The efficient syntheses of β-enaminones were performed with a Pd/DNA catalyst, with NEt3, NPr3 and NBu3 used as amine sources. The catalyst was successfully recovered and used in several subsequent tests with the same results. The reaction mechanism, summarizing the activity of immobilized Pd NPs (palladium nanoparticles), was proposed. Keywords Palladium nanoparticles Carbonylative coupling Enaminones Oxidative amine dealkylation 1 Introduction Palladium-catalyzed carbonylation reactions present a very important methodology leading to carbonyl compounds broadly applied in the pharmaceutical and agrochemical industries [1–7]. Carbonylative coupling can be used for the synthesis of ketones, amides, esters, carboxylic acids and other valuable derivatives, starting with aryl halides as substrates. The Pd catalyzed double carbonylation is a one-step pathway to α-ketoamides and oxamates. The oxidative carbonylation performed in the presence of CO and O2 produced carbamates [8,9]. β-Enaminones belong to biologically active compounds which have anti-inflammatory activity [10]. They are also attractive substrates for the synthesis of various heterocyclic compounds [11–13]. Enaminones can be obtained by the nucleophilic addition of secondary amines to 1,2,3-triazine [14] or by the amination of 1,3-dicarbonyl compounds with primary amines or ammonium salts [15,16]. Moreover, these compounds can be obtained through a reaction of α−keto acids with iodoalkyne [17] and by the oxyaminalization of alkenes using amines, oxygen and Togni’s reagent [18]. Iron catalyzed synthesis using ketones and amines was also reported [19]. β-Enaminones are formed at high yields and regioselectivity during the Michael addition of an amine to an alkynone [20–22]. In this context, an important step of this procedure consists of the preparation of alkynones by the palladium-catalyzed carbonylative Sonogashira coupling of aryl iodide and the alkyne [23]. Alternatively, an acid chloride and a terminal alkyne can be coupled under Sonogashira conditions to form an alkynone [24]. On the basis of these results, secondary amines were employed in a four-component or three-component one-pot syntheses of enaminones [25]. However, there is no example of a palladium-catalyzed synthesis of β-enaminones with tertiary amines. Typical palladium catalysts used in β-enaminone synthesis contain nitrogen ligands (bipyridine, phenantroline, imidazole), phosphorus ligands (triphenylphosphine, bis(diphenylphosphino)ferrocene, Xantphos) or N-heterocyclic carbene (NHC) [26]. The mechanism of enaminone formation has been scarcely discussed, however, a homogeneous pathway with a soluble palladium species as a catalytically active form seems to be most likely. In contrast, immobilized or heterogeneous palladium catalysts have not yet been tested in the synthesis of β-enaminones. Therefore, we decided to use our experience with a Pd/DNA catalyst and apply it to this reaction. The peculiar structure, non-toxic properties and low price of DNA motivate its use as a support for palladium catalysts [27–34]. In this paper, we report the first example of a highly efficient four-component synthesis of β-enaminones using trialkyl amines and an immobilized Pd/DNA catalyst (Scheme 1 ). 2 Results and discussions 2.1 Pd/DNA catalyzed four-component synthesis of β-enaminones The formation of a trace amount of enaminone 1a was first observed in the carbonylative Sonogashira reaction performed with NEt3 as a base (Scheme 2 ) [34]. After identification of 1a, attempts were undertaken to change the reaction selectivity and increase its yield. Variations of solvent, temperature and reaction time allowed 1a to be obtained with a 67 % yield in DMF, at a temperature of 120 °C. Moreover, analysis of the product composition at different periods of time indicated that 1a was formed from alkynone 2a, the product of carbonylative Sonogashira coupling (Table 1 ). Concerning the solvent, it was found that DMF and dioxane produced better results than acetonitrile, therefore, DMF was used for further studies. The reaction carried out at 100 °C, according to Scheme 1, provided a total conversion of PhI, however, 2a was the main product while the yield of 1a was only 39 %. The transformation of 2a to 1a was more efficient at 120 °C, when 1a became the predominant product. Different amounts of NEt3 were tested, such as three, four and six equivalents, and it was found that four equivalents was the optimal amount for the formation of 1a. Next, the same reaction was performed using various sources of palladium to compare their usefulness in the synthesis of enaminone 1a. Thus, for this test, two Pd/DNA catalysts were selected, each containing different amounts of Pd. For comparison, the composite obtained by pyrolysis of Pd/DNA (C2-P) was also tested (Table 2 ). The Pd/DNA was found to be superior to commercial catalysts Pd(OAc)2 and Pd/C. Under the applied conditions, Pd(OAc)2 catalyzed only Sonogashira coupling leading to diphenylacetylene 3a. With Pd/C, the maximum yield of 1a was 21 % at 100 °C, whereas at 120 °C, the reaction selectivity significantly decreased. The positive effect of the DNA polymer on the reaction course was therefore clearly evident. In addition, the activity of Pd/DNA visibly decreased after pyrolysis at 800 °C, probably due to damage of the DNA structure. The pyrolyzed catalyst, C2-P, formed only 28 % of 1a at 120 °C. The comparison of the two Pd/DNA catalysts indicated the impact of the Pd content, and better results were obtained for the C2 catalyst containing less palladium. While the size of the Pd nanoparticles in both catalysts was similar at 10–21 nm vs. 11–13 nm, it could be assumed that better separation of the palladium active centers in the DNA support in the C2 catalyst was more favorable for yielding more 1a. The Pd loading experiments were carried out using 1 mol % and 0.5 % of palladium with the C2 catalyst (Table 2). When 1 mol % of palladium was used, the yield of 1a (68 %) was slighly lower than by using 2 mol % (71 %). Further decrease in the yield, to 57 %, was observed with 0.5 mol % of palladium. Some decrease in selectivity to the desired product 1a was observed at the lower Pd loading. 2.2 Effect of the tertiary amine structure Afterward, other tertiary amines were tested with the C2 catalyst (Scheme 2, Table 3 ). Enaminones (1a–1c) were formed at a high yield when NPr3 and NBu3 were used instead of NEt3. In these reactions, better results were obtained at 100 °C than at 120 °C. In contrast, tribenzylamine did not provide any products. In the reaction with NBu3 catalyst Pd/C produced 71 % of 1c and 7 % of 3a, while Pd/DNA formed selectively 90 % of 1c under the same conditions. These results showed that the structure of tertiary amine had a high impact on the reaction course. This is probably because in the studied system amine played a dual role as the base in the formation of the product 2a and as a substrate in the formation of the desired product 1a. 2.3 The method applicability to different derivatives of iodobenzene and phenylacetylene NBu3 was used in the next series of experiments employing various aryl iodides and substituted phenylacetylenes. In most cases, the relevant enaminones were obtained with a good or very good yield (Table 4 ). While good results were achieved with aromatic alkyne derivatives, in the case of an aliphatic alkyne only trace amount of the desired product (10c) was obtained. The reason for this is that activation of the less nucleophilic substrate, 1-pentyne, was not efficient in the applied catalytic conditions. 2.4 Catalyst recycling The C2 catalyst was separated from the reaction mixture and successfully reused in five subsequent tests without any significant loss of activity (Fig. 1 ). The TEM analysis of the catalyst recovered after the recycling experiment showed some aggregates of palladium and individual Pd nanoparticles, 4–10 nm in diameter. The size of the nanoparticles was similar to that before the reaction (Figs. 2 and 3 ). Promising results obtained in the recycling experiment indicated on the good stability of the catalyst and possible heterogeneous reaction pathway. In order to prove this assumption, a leaching test and a hot filtration test were performed. According to the ICP analysis, 0.37 wt % of Pd was leached to the solution. However, the solution obtained after catalyst separation by hot filtration, did not show any catalytic activity. Thus, the studied reaction proceeds according to the heterogenous mechanism. 2.5 Studies on the reaction mechanism According to the literature, alkynones formed in carbonylative Sonogashira coupling reacted with diamine, according to the Michael addition, forming enaminones [20–22]. It was checked that in our conditions the same yield of 1a was formed in both the presence and absence of a catalyst when HNEt2 was used (99 %) (Scheme 3 ). Moreover, it was possible to obtain 75 % of 1a in six hours following a four-component one-pot procedure. This result is similar to those obtained with other palladium catalysts used with HNEt2 (Scheme 4 ). However, the test reaction of alkynone 2a with NEt3 produced a much lower yield of 1a, up to 18 % in the presence of the Pd/DNA catalyst (Scheme 5 ). Therefore, it was assumed that dealkylation of NR3 is a key issue for forming β-enaminones in the studied system. In the control experiment, an NEtiPr2 amine was used to confirm the occurrence of the dealkylation process (Scheme 6 ). Analysis of the reaction products revealed the presence of similar amounts of two enaminones containing NEtiPr and NiPr2 substituents. The formation of these products was slower than with other NR3 amines, most likely due to the steric hindrance of the iPr group. A similar observation was also made for amides formation with these amines [43]. 2.5.1 Effect of O2 The literature examples of oxidative dealkylation of tertiary amines reported the application of Cu salts or O2 as oxidative agents [35–37]. In these reactions, dealkylation of NR3 amines enabled the formation of amides with high yields [38–41]. In the studied system, the most probable pathway of amine dealkylation is the process catalyzed by Pd/DNA with air/oxygen as an oxidant. In order to prove the effect of O2 on the reaction course, a two-step experiment was performed. First, under air-free conditions, the reaction was carried out for five hours. The reaction products contained 89 % alkynones and only 9 % 1a. Next, the balloon with CO was removed and a balloon filled with O2 was connected to the Schlenk vessel. After five hours, the yield of 1a increased to 59 % (Scheme 7 ). A similar result was observed in reactions performed according to the same procedure for three hours, where an increase of the yield of 1a from 6 % to 31 % was obtained (ESI, Scheme 1). Next, two reactions were performed for comparison. The reference reaction was carried out with CO only, while in the second experiment, CO and O2 were supplied to the Schlenk tube. In the first case, the ratio of 1a to 2a was 31–56, while the presence of O2 changed this ratio to 55 to 27. Thus, the yield of 1a increased in the presence of O2 due to the more efficient dealkylation of NEt3. 2.5.2 Influence of water To check the influence of water on the reaction course, additional experiments were undertaken using pre-dried reagents. The yield of β-enaminones varied from 7 % for NiPr3 and NBu3 to 12 % for NEt3 and it was significantly lower than the yield achieved with non-dried DMF and amines (71–93 %, Tables 2 and 3). However, the addition of a controlled amount of water, 2–4 mmol, to the reaction with NBu3 resulted in an increase in the yield of β-enaminone to 87 % (Scheme 8 ). On the other hand, it should be pointed out that an increase in the amount of water to 10 mmol caused a significant decrease in the yield of 1c to 59 %. Thus, the amount of water in the reaction mixture should be precisely controlled to obtain a high yield of the product. 2.6 The plausible mechanism of β-enaminones formation in the presence of Pd/DNA Based on the obtained results, we propose that the catalytic reaction occurs according to the heterogeneous pathway on the catalyst surface (Fig. 4 ). The main steps of the proposed mechanism involve the formation of alkynones by the carbonylative coupling of iodobenzene with phenylacetylene according to the Sonogashira path. Recently we evidenced the high catalytic ability of Pd/DNA in the synthesis of alkynones in the presence of NEt3 base [34]. The same catalytic system was applied now to form β-enaminones by using a higher temperature and longer reaction time. The original step of the presented procedure is formation of secondary amines by the oxidative dealkylation of tertiary amines on the same catalyst in the presence of water. We assume that not only Pd, but also DNA, play an important role in this reaction. In particular, the ability of DNA to form specific hydrogen bonds with amines and water facilitated the activation of the substrates. This is in agreement with the lower ability of Pd/C, as well as pyrolyzed Pd/DNA, to efficiently conduct the formation of β-enaminones with tertiary amines. The proposed pathway of N-dealkylation of tertiary amines was inspired by other studies [39,42,43]. The catalytic cycle begins with an oxidative addition of ArI to Pd(0) supported on DNA (Fig. 4). Insertion of CO forms a Pd-acyl intermediate and in the same time iodide bonded to Pd reacts with coordinated amine with elimination of HI. The HI reacts then with O2 to produce a water molecule which contributes to the formation of diamine [35,40]. The final steps involve formation of β-enaminone and its elimination from the Pd/DNA catalyst. 3 Conclusions We have presented for the first time a highly efficient one-pot four-component methodology for the preparation of β-enaminones with tertiary amines. The synthesis is based on the tandem reaction composed of two processes, namely alkynone formation in copper-free carbonylative Sonogashira coupling and the oxidative N-dealkylation of tertiary amines. Both stages are catalyzed by the Pd/DNA catalyst containing Pd NPs as the catalytically active form. The catalyst is stable and it can be easily recovered with the same activity. Advantageously, the catalytic system is active without the addition of a phosphine ligand or any co-catalyst. Reagents do not need to be dried and specially purified, however, precise control of the amount of water is necessary to obtain the best results. 4 Experimental 4.1 Preparation of Pd/DNA catalysts C1: Catalyst C1 was prepared according to references [32,33] using fish sperm DNA (CAS: 438545-06-3) (Pd content estimated by ICP: 45 %). C2: Catalyst C2 was prepared according to references [32,33] using 150 mg of low molecular weight fish sperm DNA (CAS:100403-24-5) in 10 ml of water and 100 mg of Pd(OAc)2 and 10 ml of ethanol (Pd content estimated by ICP: 17.5 %). The FT IR, TEM and XRD data are presented in the SI. 4.2 Pyrolysis of C2 100 mg of C2 was placed in a furnace in a ceramic crucible. The furnace was heated up to 800 °C (5 °C per minute) under argon and kept at 800 °C for one hour. Following this process, the heating was completed and the furnace was cooled down to an ambient temperature (Pd content estimated by ICP: 40 %). 4.3 General procedure for synthesis of β-enaminones In the typical reaction, a 30 ml vial was filled with a catalyst (containing 2 mol % of Pd), aryl iodide (1 mmol), the terminal alkyne (1.2 mmol) and the amine (4 mmol). Then, 3 ml of the DMF was poured into the mixture. The vial was cooled in liquid nitrogen and, after the evacuation of air, the vial was joined with CO balloon. The obtained mixture was stirred under a CO atmosphere at 100–120 °C for 16–24 h. Next, the vial was cooled to room temperature. To extract the products, 5 ml of H2O and 3 × 7 ml of Et2O were added to the vial. After the extraction, the sample was analyzed by GC-FID. For the GC-FID analysis, 0.076 ml of mesitylene was used as the internal standard. For purification, the solvent was removed in vacuo. Afterwards, the residue was purified by column chromatography, analyzed by GC–MS, 1H NMR and 13C NMR for characterization. 4.4 Procedure for C2 reuse After the first reaction was completed, the flask was cooled to an ambient temperature. To extract the product, 5 ml of H2O and 3 × 7 ml of Et2O were added to the flask. After extraction, the remaining solvents were removed in vacuo. Afterwards, the flask containing the reused catalyst was filled with iodobenzene (1 mmol), phenylacetylene (1.2 mmol), Bu3N (4 mmol), and 3 ml of DMF. The flask was cooled in liquid nitrogen and, after the evacuation of air, the flask was joined with CO balloon. The reaction mixture was stirred under a CO at 120 °C for 24 h. 4.5 Pd leaching test The catalytic reaction was performed according to the general procedure, using iodobenzene, phenylacetylene, NBu3, C2 catalyst (12.16 mg) and CO balloon. After the reaction the catalyst was filtered off and the resulted filtrate was condenced by evaporating the solvent. To the obtained residue 1 ml of concentrated HNO3 and 3 ml of concentrated HCl were added and the mixture was heated for several minutes to obtain the homogeneous solution. It was next diluted with H2O and analysed by ICP method. The palladium content was determined as 0.37 wt % of the catalyst amount used in the reaction. 4.6 Hot filtration test The catalytic reaction was performed according to the general procedure, using iodobenzene, phenylacetylene, NBu3, C2 catalyst and CO balloon. After 1 h, the yield of product 2a and 3a was 11 % and 4 % respectively. The hot solution was filtered through celite and the resulted filtrate was stirred for 23 h at 120 °C. The GC-FID analysis performed after this time showed the same products composition (there was no increase in the products yields). Declaration of Competing Interest The authors report no declarations of interest. Appendix A Supplementary data Supplementary material related to this article can be found, in the online version, at doi:https://doi.org/10.1016/j.mcat.2020.111365. Appendix A Supplementary data The following is Supplementary data to this article: References [1] S.T. Gadge B.M. Bhanage RSC Adv. 4 2014 10367 10389 S.T. Gadge, B.M. Bhanage, RSC Adv., 4 (2014) 10367-10389. [2] P. Gautam B.M. Bhanage Catal. Sci. Technol. 5 2015 4663 4702 P. Gautam, B.M. Bhanage, Catal. Sci. Technol., 5 (2015) 4663-4702. [3] A. Brennfuhrer H. Neumann M. Beller Angew. Chem. Int. Ed. 48 2009 4114 4133 A. Brennfuhrer, H. Neumann, M. Beller, Angew. Chem. Int. Ed., 48 (2009) 4114-4133. [4] X.-F. Wu H. Neumann M. Beller Chem. Soc. Rev. 40 2011 4986 5009 X.-F. Wu, H. Neumann, M. Beller, Chem. Soc. Rev., 40 (2011) 4986-5009. [5] X.-F. Wu H. Neumann M. Beller Chem. Rev. 113 2013 1 35 X.-F. Wu, H. Neumann, M. Beller, Chem. Rev., 113 (2013) 1-35. [6] X.-F. Wu X. Fang L. Wu R. Jackstell H. Neumann M. Beller Acc. Chem. Res. 47 2014 1041 1053 X.-F. Wu, X. Fang, L. Wu, R. Jackstell, H. Neumann, M. Beller, Acc. Chem. Res., 47 (2014) 1041-1053. [7] C. Ramesh R. Nakamura Y. Kubota M. Miwa Y. Sugi Synthesis 4 2003 501 504 C. Ramesh, R. Nakamura, Y. Kubota, M. Miwa, Y. Sugi, Synthesis, 4 (2003) 501-504. [8] T. Morimoto K. Kakiuchi Angew. Chem. Int. Ed. 43 2004 5580 5588 T. Morimoto, K. Kakiuchi, Angew. Chem. Int. Ed., 43 (2004) 5580-5588. [9] H. Konishi K. Manabe Synlett 25 2014 1971 1986 H. Konishi, K. Manabe, Synlett., 25 (2014) 1971-1986. [10] M.S. Alexander K.R. Scott J. Harkless R.J. Butcher P.L. Jackson-Aytunde Bioorg. Med. Chem. 21 2013 3272 3279 M.S. Alexander, K.R. Scott, J. Harkless, R.J. Butcher, P.L. Jackson-Aytunde, Bioorg. Med. Chem., 21 (2013) 3272-3279. [11] L. Shi L. Xue R. Lang C. Xia F. Li E.M. Afsah E.-S.I. El-Desoky H.A. Etman I. Youssef A.M. Soliman J. Heterocycl. Chem. 55 2018 2959 2970 L. Shi, L. Xue, R. Lang, C. Xia, F. Li, E.M. Afsah, E.-S.I. El-Desoky, H.A. Etman, I. Youssef, A.M. Soliman, J. Heterocycl. Chem., 55 (2018) 2959-2970. [12] Y. Zhao Q. Duan Y. Zhou Q. Yao Y. Li Org. Biomol. Chem. 14 2016 2177 2181 Y. Zhao, Q. Duan, Y. Zhou, Q. Yao, Y. Li, Org. Biomol. Chem., 14 (2016) 2177-2181. [13] J.-P. Wan S. Cao Y. Liu Org. Lett. 18 2016 6034 6037 23 J.-P. Wan, S. Cao, Y. Liu, Org. Lett., 18 (2016) 23, 6034-6037. [14] R.E. Quiñones C.M. Glinkerman K. Zhu D.L. Boger Org. Lett. 19 2017 3568 3571 R. E. Quiñones, C. M. Glinkerman, K. Zhu, D. L. Boger, Org. Lett., 19 (2017) 3568-3571. [15] V. Sridharan C. Avendaño J. Carlos Menéndez Synlett 2007 2133 2142 V. Sridharan, C. Avendaño, J. Carlos Menéndez, Synlett, (2007) 2133-2142. [16] S.-L. Xu C.-P. Li J.-H. Li Synlett 2009 818 822 S.-L. Xu, C.-P. Li, J.-H. Li, Synlett, (2009) 818-822. [17] X. Zeng C. Liu W. Yang Y. Weng X. Wang Y. Hu J. Org. Chem. 84 2019 3656 3661 X. Zeng, C. Liu, W. Yang, Y. Weng, X. Wang, Y. Hu, J. Org. Chem., 84 (2019) 3656-3661. [18] L. Wang C. Qi T. Guo H. Jiang Org. Lett. 21 2019 2223 2226 L. Wang, C. Qi, T. Guo, H. Jiang, Org. Lett., 21 (2019) 2223-2226. [19] W. Wu Z. Wang Q. Shen Q. Liu H. Chen Org. Biomol. Chem. 17 2019 6753 6756 W. Wu, Z. Wang, Q. Shen, Q. Liu, H. Chen., Org. Biomol. Chem., 17 (2019) 6753-6756. [20] S. Cacchi G. Fabrizi E. Fillsti Org. Lett. 10 2008 2629 2632 S. Cacchi, G. Fabrizi, E. Fillsti, Org. Lett., 10 (2008) 2629-2632. [21] S. Roy M.P. Davydova R. Pal K. Gilmore G.A. Tolstikov S.F. Vasilevsky I.V. Alabugin J. Org. Chem. 76 2011 7482 7490 S. Roy, M.P. Davydova, R. Pal, K. Gilmore, G.A. Tolstikov, S.F. Vasilevsky, I.V. Alabugin, J. Org. Chem.,76 (2011) 7482-7490. [22] D.R. Chisholm R. Vlentine E. Pohl A. Whiting J. Org. Chem. 81 2016 7557 7565 17 D.R. Chisholm, R. Vlentine, E. Pohl, A. Whiting, J. Org. Chem., 81 (2016) 17, 7557-7565. [23] X.-F. Wu B. Sundararaju H. Neumann P.H. Dixneuf M. Beller Chem. Eur. J. 17 2011 106 110 X.-F. Wu, B. Sundararaju, H. Neumann, P.H. Dixneuf, M. Beller, Chem. Eur. J., 17 (2011) 106-110 [24] A.S. Karpov T.J.J. Müller Synthesis 18 2013 2815 2826 A.S. Karpov, T.J.J. Müller, Synthesis, 18 (2013) 2815-2826. [25] L. Wang J. Ma X. Chen X. Zhou Synlett 28 2017 2680 2684 L. Wang, J. Ma, X. Chen, X. Zhou, Synlett, 28 (2017) 2680-2684. [26] L. Shi L. Xue R. Lang C. Xia F. Li ChemCatChem 6 2014 2560 2566 L. Shi, L. Xue, R. Lang, C. Xia, F. Li, ChemCatChem., 6 (2014) 2560-2566. [27] L. Tang H. Sun Y. Li Z. Zha Z. Wang Green Chem. 14 2012 3423 3428 L. Tang, H. Sun, Y. Li, Z. Zha, Z. Wang, Green Chem., 14 (2012) 3423-3428. [28] A.S. Camacho I. Martin-Garcia C.L. Contreras-Celedon F.A. Chacon-Garcia Catal. Sci. Technol. 7 2017 2262 2273 A.S. Camacho, I. Martin-Garcia, C.L. Contreras-Celedon, F.A. Chacon-Garcia, Catal. Sci. Technol., 7 (2017) 2262–2273. [29] Y. Wang G. Ouyang J. Zhang Z. Wang Chem. Commun. 46 2010 7912 7914 Y. Wang, G. Ouyang, J. Zhang, Z. Wang, Chem. Commun., 46 (2010) 7912-7914. [30] H. Itoh H. Maeda S. Yamada Y. Hori ChemCatChem 4 2012 1737 1740 H. Itoh, H. Maeda, S. Yamada, Y. Hori, ChemCatChem, 4, (2012) 1737-1740. [31] V. Kandathil M. Kempasiddaiah S.K. Nataraj S.B. Somappa S.A. Patil Appl. Organomet. Chem. 2020 e5357 V. Kandathil, M. Kempasiddaiah, S.K. Nataraj, S.B. Somappa, S.A. Patil, Appl. Organomet. Chem. (2020) e5357. [32] M. Mart W. Tylus A.M. Trzeciak Catalysts 8 2018 552 M. Mart, W. Tylus, A.M. Trzeciak, Catalysts, 8 (2018) 552. [33] M. Mart W. Tylus A.M. Trzeciak Mol. Catal. 462 2019 28 36 M. Mart, W. Tylus, A.M. Trzeciak, Mol. Catal., 462 (2019) 28-36. [34] M. Mart A.M. Trzeciak Mol. Catal. 494 2020 111124 M. Mart, A.M. Trzeciak, Mol. Catal., 494 (2020) 111124. [35] R.S. Mane B.M. Bhanage J. Org. Chem. 81 2016 4974 4980 R.S. Mane, B.M. Bhanage, J. Org. Chem., 81 (2016) 4974-4980. [36] R. Shi H. Zhang L. Lu P. Gan Y. Sha H. Zhang Q. Liu M. Beller A. Lei Chem. Comm. 51 2015 3247 3250 R. Shi, H. Zhang, L. Lu, P. Gan, Y. Sha, H. Zhang, Q. Liu, M. Beller, A. Lei, Chem. Comm., 51 (2015) 3247-3250. [37] Z. Ling L. Yun L. Liu B. Wu X. Fu Chem. Comm. 49 2013 4214 4216 Z. Ling, L. Yun, L. Liu, B. Wu, X. Fu, Chem. Comm., 49 (2013) 4214-4216. [38] T. Fang X.-H. Gao R.-Y. Tang X.-G. Zhang C.-L. Deng Chem. Comm. 50 2014 14775 14777 T. Fang, X.-H. Gao, R.-Y. Tang, X.-G. Zhang, C.-L. Deng, Chem. Comm., 50 (2014) 14775-14777. [39] R.S. Mane B.M. Bhanage Asian J.Org. Chem. 7 2018 160 164 R.S. Mane, B.M. Bhanage, Asian J.Org. Chem. 7 (2018) 160-164. [40] R.S. Mane B.M. Bhanage Adv. Synth. Catal. 359 2017 2621 2629 R.S. Mane, B.M. Bhanage, Adv. Synth. Catal., 359 (2017) 2621-2629. [41] Y.-S. Bao B. Zhaorigetu B. Agula M. Baiyin M. Jia J. Org. Chem. 79 2014 803 808 Y.-S. Bao, B. Zhaorigetu, B. Agula, M. Baiyin, M. Jia, J. Org. Chem., 79 (2014) 803-808. [42] Y. Liu B. Yao C.-L. Deng R.-Y. Zhang J.-H. Li Org. Lett. 13 2011 2184 2187 Y. Liu, B. Yao, C.-L. Deng, R.-Y. Zhang, J.-H. Li, Org. Lett., 13 (2011) 2184-2187. [43] R.S. Mane B.M. Bhanage J. Org. Chem. 81 2016 1223 1228 R.S. Mane, B.M. Bhanage, J. Org. Chem., 81 (2016) 1223-1228.",
      "scopus-id": "85100115383",
      "coredata": {
        "eid": "1-s2.0-S2468823120306283",
        "dc:description": "A new one-pot procedure leading to β-enaminones has been developed. The elaborated methodology involves the cascade sequencing of carbonylative Sonogashira coupling of aryl iodide with a terminal alkyne and the oxidative dealkylation of tertiary amines. The efficient syntheses of β-enaminones were performed with a Pd/DNA catalyst, with NEt3, NPr3 and NBu3 used as amine sources. The catalyst was successfully recovered and used in several subsequent tests with the same results. The reaction mechanism, summarizing the activity of immobilized Pd NPs (palladium nanoparticles), was proposed.",
        "openArchiveArticle": "false",
        "prism:coverDate": "2021-02-28",
        "openaccessUserLicense": null,
        "prism:aggregationType": "Journal",
        "prism:url": "https://api.elsevier.com/content/article/pii/S2468823120306283",
        "dc:creator": [
          {
            "@_fa": "true",
            "$": "Mart, M."
          },
          {
            "@_fa": "true",
            "$": "Trzeciak, A.M."
          }
        ],
        "link": [
          {
            "@_fa": "true",
            "@rel": "self",
            "@href": "https://api.elsevier.com/content/article/pii/S2468823120306283"
          },
          {
            "@_fa": "true",
            "@rel": "scidir",
            "@href": "https://www.sciencedirect.com/science/article/pii/S2468823120306283"
          }
        ],
        "dc:format": "application/json",
        "openaccessType": null,
        "pii": "S2468-8231(20)30628-3",
        "prism:volume": "502",
        "articleNumber": "111365",
        "prism:publisher": "Elsevier B.V.",
        "dc:title": "The synthesis of β-enaminones using trialkylamines and a Pd/DNA catalyst",
        "prism:copyright": "© 2021 Elsevier B.V. All rights reserved.",
        "openaccess": "0",
        "prism:issn": "24688231",
        "dcterms:subject": [
          {
            "@_fa": "true",
            "$": "Palladium nanoparticles"
          },
          {
            "@_fa": "true",
            "$": "Carbonylative coupling"
          },
          {
            "@_fa": "true",
            "$": "Enaminones"
          },
          {
            "@_fa": "true",
            "$": "Oxidative amine dealkylation"
          }
        ],
        "openaccessArticle": "false",
        "prism:publicationName": "Molecular Catalysis",
        "openaccessSponsorType": null,
        "prism:pageRange": "111365",
        "pubType": "fla",
        "prism:coverDisplayDate": "February 2021",
        "prism:doi": "10.1016/j.mcat.2020.111365",
        "prism:startingPage": "111365",
        "dc:identifier": "doi:10.1016/j.mcat.2020.111365",
        "openaccessSponsorName": null
      },
      "objects": {
        "object": [
          {
            "@category": "standard",
            "@height": "200",
            "@width": "330",
            "@_fa": "true",
            "$": "https://api.elsevier.com/content/object/eid/1-s2.0-S2468823120306283-ga1.jpg?httpAccept=%2A%2F%2A",
            "@multimediatype": "JPEG image file",
            "@type": "IMAGE-DOWNSAMPLED",
            "@size": "19178",
            "@ref": "ga1",
            "@mimetype": "image/jpeg"
          },
          {
            "@category": "standard",
            "@height": "261",
            "@width": "340",
            "@_fa": "true",
            "$": "https://api.elsevier.com/content/object/eid/1-s2.0-S2468823120306283-gr4.jpg?httpAccept=%2A%2F%2A",
            "@multimediatype": "JPEG image file",
            "@type": "IMAGE-DOWNSAMPLED",
            "@size": "18408",
            "@ref": "gr4",
            "@mimetype": "image/jpeg"
          },
          {
            "@category": "standard",
            "@height": "249",
            "@width": "491",
            "@_fa": "true",
            "$": "https://api.elsevier.com/content/object/eid/1-s2.0-S2468823120306283-sc1.jpg?httpAccept=%2A%2F%2A",
            "@multimediatype": "JPEG image file",
            "@type": "IMAGE-DOWNSAMPLED",
            "@size": "19720",
            "@ref": "sc1",
            "@mimetype": "image/jpeg"
          },
          {
            "@category": "standard",
            "@height": "74",
            "@width": "566",
            "@_fa": "true",
            "$": "https://api.elsevier.com/content/object/eid/1-s2.0-S2468823120306283-sc2.jpg?httpAccept=%2A%2F%2A",
            "@multimediatype": "JPEG image file",
            "@type": "IMAGE-DOWNSAMPLED",
            "@size": "11250",
            "@ref": "sc2",
            "@mimetype": "image/jpeg"
          },
          {
            "@category": "standard",
            "@height": "134",
            "@width": "491",
            "@_fa": "true",
            "$": "https://api.elsevier.com/content/object/eid/1-s2.0-S2468823120306283-sc3.jpg?httpAccept=%2A%2F%2A",
            "@multimediatype": "JPEG image file",
            "@type": "IMAGE-DOWNSAMPLED",
            "@size": "10447",
            "@ref": "sc3",
            "@mimetype": "image/jpeg"
          },
          {
            "@category": "standard",
            "@height": "78",
            "@width": "566",
            "@_fa": "true",
            "$": "https://api.elsevier.com/content/object/eid/1-s2.0-S2468823120306283-sc4.jpg?httpAccept=%2A%2F%2A",
            "@multimediatype": "JPEG image file",
            "@type": "IMAGE-DOWNSAMPLED",
            "@size": "12063",
            "@ref": "sc4",
            "@mimetype": "image/jpeg"
          },
          {
            "@category": "standard",
            "@height": "137",
            "@width": "491",
            "@_fa": "true",
            "$": "https://api.elsevier.com/content/object/eid/1-s2.0-S2468823120306283-sc5.jpg?httpAccept=%2A%2F%2A",
            "@multimediatype": "JPEG image file",
            "@type": "IMAGE-DOWNSAMPLED",
            "@size": "10705",
            "@ref": "sc5",
            "@mimetype": "image/jpeg"
          },
          {
            "@category": "standard",
            "@height": "65",
            "@width": "566",
            "@_fa": "true",
            "$": "https://api.elsevier.com/content/object/eid/1-s2.0-S2468823120306283-sc6.jpg?httpAccept=%2A%2F%2A",
            "@multimediatype": "JPEG image file",
            "@type": "IMAGE-DOWNSAMPLED",
            "@size": "12137",
            "@ref": "sc6",
            "@mimetype": "image/jpeg"
          },
          {
            "@category": "standard",
            "@height": "277",
            "@width": "339",
            "@_fa": "true",
            "$": "https://api.elsevier.com/content/object/eid/1-s2.0-S2468823120306283-gr1.jpg?httpAccept=%2A%2F%2A",
            "@multimediatype": "JPEG image file",
            "@type": "IMAGE-DOWNSAMPLED",
            "@size": "15195",
            "@ref": "gr1",
            "@mimetype": "image/jpeg"
          },
          {
            "@category": "standard",
            "@height": "221",
            "@width": "566",
            "@_fa": "true",
            "$": "https://api.elsevier.com/content/object/eid/1-s2.0-S2468823120306283-sc7.jpg?httpAccept=%2A%2F%2A",
            "@multimediatype": "JPEG image file",
            "@type": "IMAGE-DOWNSAMPLED",
            "@size": "23185",
            "@ref": "sc7",
            "@mimetype": "image/jpeg"
          },
          {
            "@category": "standard",
            "@height": "218",
            "@width": "679",
            "@_fa": "true",
            "$": "https://api.elsevier.com/content/object/eid/1-s2.0-S2468823120306283-gr2.jpg?httpAccept=%2A%2F%2A",
            "@multimediatype": "JPEG image file",
            "@type": "IMAGE-DOWNSAMPLED",
            "@size": "33806",
            "@ref": "gr2",
            "@mimetype": "image/jpeg"
          },
          {
            "@category": "standard",
            "@height": "125",
            "@width": "566",
            "@_fa": "true",
            "$": "https://api.elsevier.com/content/object/eid/1-s2.0-S2468823120306283-sc8.jpg?httpAccept=%2A%2F%2A",
            "@multimediatype": "JPEG image file",
            "@type": "IMAGE-DOWNSAMPLED",
            "@size": "16055",
            "@ref": "sc8",
            "@mimetype": "image/jpeg"
          },
          {
            "@category": "standard",
            "@height": "182",
            "@width": "679",
            "@_fa": "true",
            "$": "https://api.elsevier.com/content/object/eid/1-s2.0-S2468823120306283-gr3.jpg?httpAccept=%2A%2F%2A",
            "@multimediatype": "JPEG image file",
            "@type": "IMAGE-DOWNSAMPLED",
            "@size": "40026",
            "@ref": "gr3",
            "@mimetype": "image/jpeg"
          },
          {
            "@category": "standard",
            "@height": "324",
            "@width": "474",
            "@_fa": "true",
            "$": "https://api.elsevier.com/content/object/eid/1-s2.0-S2468823120306283-fx1.jpg?httpAccept=%2A%2F%2A",
            "@multimediatype": "JPEG image file",
            "@type": "IMAGE-DOWNSAMPLED",
            "@size": "35565",
            "@ref": "fx1",
            "@mimetype": "image/jpeg"
          },
          {
            "@category": "thumbnail",
            "@height": "133",
            "@width": "219",
            "@_fa": "true",
            "$": "https://api.elsevier.com/content/object/eid/1-s2.0-S2468823120306283-ga1.sml?httpAccept=%2A%2F%2A",
            "@multimediatype": "GIF image file",
            "@type": "IMAGE-THUMBNAIL",
            "@size": "10646",
            "@ref": "ga1",
            "@mimetype": "image/gif"
          },
          {
            "@category": "thumbnail",
            "@height": "164",
            "@width": "214",
            "@_fa": "true",
            "$": "https://api.elsevier.com/content/object/eid/1-s2.0-S2468823120306283-gr4.sml?httpAccept=%2A%2F%2A",
            "@multimediatype": "GIF image file",
            "@type": "IMAGE-THUMBNAIL",
            "@size": "6665",
            "@ref": "gr4",
            "@mimetype": "image/gif"
          },
          {
            "@category": "thumbnail",
            "@height": "111",
            "@width": "219",
            "@_fa": "true",
            "$": "https://api.elsevier.com/content/object/eid/1-s2.0-S2468823120306283-sc1.sml?httpAccept=%2A%2F%2A",
            "@multimediatype": "GIF image file",
            "@type": "IMAGE-THUMBNAIL",
            "@size": "4390",
            "@ref": "sc1",
            "@mimetype": "image/gif"
          },
          {
            "@category": "thumbnail",
            "@height": "29",
            "@width": "219",
            "@_fa": "true",
            "$": "https://api.elsevier.com/content/object/eid/1-s2.0-S2468823120306283-sc2.sml?httpAccept=%2A%2F%2A",
            "@multimediatype": "GIF image file",
            "@type": "IMAGE-THUMBNAIL",
            "@size": "2457",
            "@ref": "sc2",
            "@mimetype": "image/gif"
          },
          {
            "@category": "thumbnail",
            "@height": "60",
            "@width": "219",
            "@_fa": "true",
            "$": "https://api.elsevier.com/content/object/eid/1-s2.0-S2468823120306283-sc3.sml?httpAccept=%2A%2F%2A",
            "@multimediatype": "GIF image file",
            "@type": "IMAGE-THUMBNAIL",
            "@size": "2769",
            "@ref": "sc3",
            "@mimetype": "image/gif"
          },
          {
            "@category": "thumbnail",
            "@height": "30",
            "@width": "219",
            "@_fa": "true",
            "$": "https://api.elsevier.com/content/object/eid/1-s2.0-S2468823120306283-sc4.sml?httpAccept=%2A%2F%2A",
            "@multimediatype": "GIF image file",
            "@type": "IMAGE-THUMBNAIL",
            "@size": "2556",
            "@ref": "sc4",
            "@mimetype": "image/gif"
          },
          {
            "@category": "thumbnail",
            "@height": "61",
            "@width": "219",
            "@_fa": "true",
            "$": "https://api.elsevier.com/content/object/eid/1-s2.0-S2468823120306283-sc5.sml?httpAccept=%2A%2F%2A",
            "@multimediatype": "GIF image file",
            "@type": "IMAGE-THUMBNAIL",
            "@size": "2847",
            "@ref": "sc5",
            "@mimetype": "image/gif"
          },
          {
            "@category": "thumbnail",
            "@height": "25",
            "@width": "219",
            "@_fa": "true",
            "$": "https://api.elsevier.com/content/object/eid/1-s2.0-S2468823120306283-sc6.sml?httpAccept=%2A%2F%2A",
            "@multimediatype": "GIF image file",
            "@type": "IMAGE-THUMBNAIL",
            "@size": "2470",
            "@ref": "sc6",
            "@mimetype": "image/gif"
          },
          {
            "@category": "thumbnail",
            "@height": "164",
            "@width": "200",
            "@_fa": "true",
            "$": "https://api.elsevier.com/content/object/eid/1-s2.0-S2468823120306283-gr1.sml?httpAccept=%2A%2F%2A",
            "@multimediatype": "GIF image file",
            "@type": "IMAGE-THUMBNAIL",
            "@size": "5042",
            "@ref": "gr1",
            "@mimetype": "image/gif"
          },
          {
            "@category": "thumbnail",
            "@height": "86",
            "@width": "219",
            "@_fa": "true",
            "$": "https://api.elsevier.com/content/object/eid/1-s2.0-S2468823120306283-sc7.sml?httpAccept=%2A%2F%2A",
            "@multimediatype": "GIF image file",
            "@type": "IMAGE-THUMBNAIL",
            "@size": "4105",
            "@ref": "sc7",
            "@mimetype": "image/gif"
          },
          {
            "@category": "thumbnail",
            "@height": "70",
            "@width": "219",
            "@_fa": "true",
            "$": "https://api.elsevier.com/content/object/eid/1-s2.0-S2468823120306283-gr2.sml?httpAccept=%2A%2F%2A",
            "@multimediatype": "GIF image file",
            "@type": "IMAGE-THUMBNAIL",
            "@size": "10546",
            "@ref": "gr2",
            "@mimetype": "image/gif"
          },
          {
            "@category": "thumbnail",
            "@height": "48",
            "@width": "219",
            "@_fa": "true",
            "$": "https://api.elsevier.com/content/object/eid/1-s2.0-S2468823120306283-sc8.sml?httpAccept=%2A%2F%2A",
            "@multimediatype": "GIF image file",
            "@type": "IMAGE-THUMBNAIL",
            "@size": "3022",
            "@ref": "sc8",
            "@mimetype": "image/gif"
          },
          {
            "@category": "thumbnail",
            "@height": "59",
            "@width": "219",
            "@_fa": "true",
            "$": "https://api.elsevier.com/content/object/eid/1-s2.0-S2468823120306283-gr3.sml?httpAccept=%2A%2F%2A",
            "@multimediatype": "GIF image file",
            "@type": "IMAGE-THUMBNAIL",
            "@size": "9028",
            "@ref": "gr3",
            "@mimetype": "image/gif"
          },
          {
            "@category": "thumbnail",
            "@height": "150",
            "@width": "219",
            "@_fa": "true",
            "$": "https://api.elsevier.com/content/object/eid/1-s2.0-S2468823120306283-fx1.sml?httpAccept=%2A%2F%2A",
            "@multimediatype": "GIF image file",
            "@type": "IMAGE-THUMBNAIL",
            "@size": "7281",
            "@ref": "fx1",
            "@mimetype": "image/gif"
          },
          {
            "@category": "standard",
            "@_fa": "true",
            "$": "https://api.elsevier.com/content/object/eid/1-s2.0-S2468823120306283-mmc1.docx?httpAccept=%2A%2F%2A",
            "@multimediatype": "Microsoft Word file",
            "@type": "APPLICATION",
            "@size": "3236518",
            "@ref": "mmc1",
            "@mimetype": "application/word"
          },
          {
            "@category": "standard",
            "@_fa": "true",
            "$": "https://api.elsevier.com/content/object/eid/1-s2.0-S2468823120306283-am.pdf?httpAccept=%2A%2F%2A",
            "@multimediatype": "Acrobat PDF file",
            "@type": "AAM-PDF",
            "@size": "934600",
            "@ref": "am",
            "@mimetype": "application/pdf"
          }
        ]
      },
      "link": {
        "@rel": "abstract",
        "@href": "https://api.elsevier.com/content/abstract/scopus_id/85100115383"
      }
    }
  }
}