{
  "metadata": {
    "title": "Promoting effect of alkaline earth metals on Ni/CeO<ce:inf loc=post>2</ce:inf> catalysts for ammonia decomposition reaction",
    "authors": "; ; ",
    "journal": "Molecular Catalysis",
    "date": "2025-05-01",
    "doi": "10.1016/j.mcat.2025.115016",
    "abstract": "",
    "uri": "https://api.elsevier.com/content/article/pii/S2468823125002020",
    "pii": "S2468823125002020"
  },
  "fulltext": {
    "full-text-retrieval-response": {
      "scopus-eid": "2-s2.0-86000757533",
      "originalText": "serial JL 315758 291210 291744 291790 291809 31 Molecular Catalysis MOLECULARCATALYSIS 2025-03-17 2025-03-17 2025-03-17 2025-03-17 2025-04-19T07:55:48 1-s2.0-S2468823125002020 S2468-8231(25)00202-0 S2468823125002020 10.1016/j.mcat.2025.115016 S300 S300.1 FULL-TEXT 1-s2.0-S2468823125X00055 2025-04-19T07:05:30.140381Z 0 0 20250501 2025 2025-03-17T10:27:43.095343Z absattachment articleinfo articlenumber articletitlenorm authfirstinitialnorm authfirstsurnamenorm cid cids contenttype copyright crossmark dateloaded dateloadedtxt datesearch datesort dateupdated dco docsubtype doctype doi eid ewtransactionid hubeid indexeddate issn issnnorm itemstage itemtransactionid itemweight openaccess openarchive pg pgfirst pii piinorm pubdatestart pubdatetxt pubyr sectiontitle sortorder srctitle srctitlenorm srctype ssids alllist content subj subheadings suppl tomb volfirst volissue volumelist webpdf webpdfpagecount yearnav figure table e-component body mmlmath acknowledge affil appendices articletitle auth authfirstini authfull authkeywords authlast grantnumber grantsponsor grantsponsorid highlightsabst orcid primabst ref specialabst 2468-8231 24688231 true 578 578 C Volume 578 31 115016 115016 115016 20250501 1 May 2025 2025-05-01 2025 Regular Papers article fla © 2025 Published by Elsevier B.V. PROMOTINGEFFECTALKALINEEARTHMETALSNICEO2CATALYSTSFORAMMONIADECOMPOSITIONREACTION ZHANG Z 1 Introduction 2 Experiment 2.1 Catalyst preparation 2.2 Catalytic testing 2.3 Characterization 2.4 Kinetic model 3 Results and discussion 3.1 Catalytic performance: activity and stability 3.2 The catalysts properties 3.3 The kinetic analysis of catalysts 3.3.1 Kinetic parameters: activation energy and reaction order 3.3.2 Kinetic modeling of Ni/CeO2: hydrogen inhibition 4 Conclusion CRediT authorship contribution statement Acknowledgments Appendix Supplementary materials References KLERKE 2008 2304 2310 A ZAMFIRESCU 2009 729 737 C CHANG 2021 2005721 F LAMB 2019 3580 3593 K RYU 2014 2390 2398 K YIN 2004 1 9 S KOBAYASHI 2019 109 133 H GUO 2017 709 712 J GALLUCCI 2021 44 50 M COMOTTI 2015 10673 10686 M WANG 2021 14805 14812 Y SCHUTH 2012 6278 6289 F WEI 2025 114741 X DENG 2012 15901 15907 Q ZHANG 2005 257 267 J JACOBSEN 2001 8404 8405 C BOISEN 2005 309 312 A DUAN 2012 81 86 X ZHOU 2021 10345 10350 C ZHENG 2008 98 105 W LIU 2023 145371 H YUAN 2025 114800 Y GUO 2024 123844 X YU 2020 16528 16539 Y OKURA 2018 32102 32110 K OKURA 2016 85142 85148 K XU 2024 K WANG 2025 158299 C SHI 2009 948 954 Q ZHOU 2024 130888 L DING 2025 129673 J ZANG 2023 111047 P YANG 2024 156493 W SATO 2017 6610 6617 K ALATTAR 2023 8667 8677 O CHEN 2023 1014 1021 C WANG 2019 8226 8235 Z MUKHERJEE 2018 162 181 S IM 2020 26979 26988 Y NIELSEN 1964 68 79 A ERTL 1980 537 539 G NIE 2019 1375 1382 C ALSHAFEI 2023 113581 E NI 2022 5344 Z ZHANGX2025X115016 ZHANGX2025X115016XZ 2027-03-17T00:00:00.000Z 2027-03-17T00:00:00.000Z http://creativecommons.org/licenses/by-nc-nd/4.0/ © 2025 Published by Elsevier B.V. 2025-03-19T05:46:59.231Z http://vtw.elsevier.com/data/voc/AddOnTypes/50.7/aggregated-refined Key R&D project of Shandong Province 2022CXGC020311 National Natural Science Foundation of China T2341001 NSFC National Natural Science Foundation of China http://data.elsevier.com/vocabulary/SciValFunders/501100001809 http://sws.geonames.org/1814991/ Shandong Province Natural Science Foundation Major Basic Research Program ZR2023ZD20 This work is supported by National Natural Science Foundation of China (T2341001), Shandong Province Natural Science Foundation Major Basic Research Program (ZR2023ZD20), the Key R&D project of Shandong Province (2022CXGC020311). https://doi.org/10.15223/policy-017 https://doi.org/10.15223/policy-037 https://doi.org/10.15223/policy-012 https://doi.org/10.15223/policy-029 https://doi.org/10.15223/policy-004 item S2468-8231(25)00202-0 S2468823125002020 1-s2.0-S2468823125002020 10.1016/j.mcat.2025.115016 315758 2025-04-19T07:05:30.140381Z 2025-05-01 1-s2.0-S2468823125002020-main.pdf https://s3-eu-west-1.amazonaws.com/prod-ucs-content-store-eu-west/content/pii:S2468823125002020/MAIN/application/pdf/c9c2b61ebfe28657b9cec8668e04eda8/main.pdf main.pdf pdf true 5522204 MAIN 9 1-s2.0-S2468823125002020-main_1.png https://s3-eu-west-1.amazonaws.com/prod-ucs-content-store-eu-west/content/pii:S2468823125002020/PREVIEW/image/png/ed8a87e249d24613c74156b53c579e23/main_1.png main_1.png png 58461 849 656 IMAGE-WEB-PDF 1 1-s2.0-S2468823125002020-gr1.jpg https://s3-eu-west-1.amazonaws.com/prod-ucs-content-store-eu-west/content/pii:S2468823125002020/gr1/DOWNSAMPLED/image/jpeg/679a2fac0e2ac8d84b9c3052f459c90b/gr1.jpg gr1 gr1.jpg jpg 59872 458 470 IMAGE-DOWNSAMPLED 1-s2.0-S2468823125002020-gr2.jpg https://s3-eu-west-1.amazonaws.com/prod-ucs-content-store-eu-west/content/pii:S2468823125002020/gr2/DOWNSAMPLED/image/jpeg/4c6b2e7588f35881aa2359237d08fa57/gr2.jpg gr2 gr2.jpg jpg 52397 239 565 IMAGE-DOWNSAMPLED 1-s2.0-S2468823125002020-ga1.jpg https://s3-eu-west-1.amazonaws.com/prod-ucs-content-store-eu-west/content/pii:S2468823125002020/ga1/DOWNSAMPLED/image/jpeg/ca486c7d3c089c386407f36034ac3d12/ga1.jpg ga1 true ga1.jpg jpg 31943 200 500 IMAGE-DOWNSAMPLED 1-s2.0-S2468823125002020-gr5.jpg https://s3-eu-west-1.amazonaws.com/prod-ucs-content-store-eu-west/content/pii:S2468823125002020/gr5/DOWNSAMPLED/image/jpeg/cea245e60199ac3d77e57461a6670d51/gr5.jpg gr5 gr5.jpg jpg 61686 355 470 IMAGE-DOWNSAMPLED 1-s2.0-S2468823125002020-gr6.jpg https://s3-eu-west-1.amazonaws.com/prod-ucs-content-store-eu-west/content/pii:S2468823125002020/gr6/DOWNSAMPLED/image/jpeg/98789772686532e8de3aeb8d1417c61c/gr6.jpg gr6 gr6.jpg jpg 46104 237 566 IMAGE-DOWNSAMPLED 1-s2.0-S2468823125002020-gr3.jpg https://s3-eu-west-1.amazonaws.com/prod-ucs-content-store-eu-west/content/pii:S2468823125002020/gr3/DOWNSAMPLED/image/jpeg/7dae9ed15e5942de51ddcbd042c3b0dc/gr3.jpg gr3 gr3.jpg jpg 46838 238 566 IMAGE-DOWNSAMPLED 1-s2.0-S2468823125002020-gr4.jpg https://s3-eu-west-1.amazonaws.com/prod-ucs-content-store-eu-west/content/pii:S2468823125002020/gr4/DOWNSAMPLED/image/jpeg/681041c7b554e9b0ec021454586fe81e/gr4.jpg gr4 gr4.jpg jpg 48713 243 565 IMAGE-DOWNSAMPLED 1-s2.0-S2468823125002020-gr9.jpg https://s3-eu-west-1.amazonaws.com/prod-ucs-content-store-eu-west/content/pii:S2468823125002020/gr9/DOWNSAMPLED/image/jpeg/1006c67334e6827d8bf782a91a87c3ea/gr9.jpg gr9 gr9.jpg jpg 32702 311 378 IMAGE-DOWNSAMPLED 1-s2.0-S2468823125002020-gr7.jpg https://s3-eu-west-1.amazonaws.com/prod-ucs-content-store-eu-west/content/pii:S2468823125002020/gr7/DOWNSAMPLED/image/jpeg/ae139ed163e2dc3b3437899ea86f5b41/gr7.jpg gr7 gr7.jpg jpg 45653 347 376 IMAGE-DOWNSAMPLED 1-s2.0-S2468823125002020-gr8.jpg https://s3-eu-west-1.amazonaws.com/prod-ucs-content-store-eu-west/content/pii:S2468823125002020/gr8/DOWNSAMPLED/image/jpeg/24bd06da4973540a47d6ef4a773a0751/gr8.jpg gr8 gr8.jpg jpg 39066 235 565 IMAGE-DOWNSAMPLED 1-s2.0-S2468823125002020-gr1.sml https://s3-eu-west-1.amazonaws.com/prod-ucs-content-store-eu-west/content/pii:S2468823125002020/gr1/THUMBNAIL/image/gif/f64e8e359c06373063dceaa95f5fd6e0/gr1.sml gr1 gr1.sml sml 13133 164 168 IMAGE-THUMBNAIL 1-s2.0-S2468823125002020-gr2.sml https://s3-eu-west-1.amazonaws.com/prod-ucs-content-store-eu-west/content/pii:S2468823125002020/gr2/THUMBNAIL/image/gif/06bc4520a08cfbd6310ab206318818b5/gr2.sml gr2 gr2.sml sml 11657 93 219 IMAGE-THUMBNAIL 1-s2.0-S2468823125002020-ga1.sml https://s3-eu-west-1.amazonaws.com/prod-ucs-content-store-eu-west/content/pii:S2468823125002020/ga1/THUMBNAIL/image/gif/4fe317f7cf81e47ac55fbcdf64ae4d84/ga1.sml ga1 true ga1.sml sml 14342 88 219 IMAGE-THUMBNAIL 1-s2.0-S2468823125002020-gr5.sml https://s3-eu-west-1.amazonaws.com/prod-ucs-content-store-eu-west/content/pii:S2468823125002020/gr5/THUMBNAIL/image/gif/78e073a499fdaca903a6742f62858923/gr5.sml gr5 gr5.sml sml 17085 164 217 IMAGE-THUMBNAIL 1-s2.0-S2468823125002020-gr6.sml https://s3-eu-west-1.amazonaws.com/prod-ucs-content-store-eu-west/content/pii:S2468823125002020/gr6/THUMBNAIL/image/gif/dde78ba5df61211f28128f12e535d2e3/gr6.sml gr6 gr6.sml sml 12420 92 219 IMAGE-THUMBNAIL 1-s2.0-S2468823125002020-gr3.sml https://s3-eu-west-1.amazonaws.com/prod-ucs-content-store-eu-west/content/pii:S2468823125002020/gr3/THUMBNAIL/image/gif/9ee78c9417face4c36f9e1a7addcd691/gr3.sml gr3 gr3.sml sml 12989 92 219 IMAGE-THUMBNAIL 1-s2.0-S2468823125002020-gr4.sml https://s3-eu-west-1.amazonaws.com/prod-ucs-content-store-eu-west/content/pii:S2468823125002020/gr4/THUMBNAIL/image/gif/b1c38f4179d66e1b539eda1c9a2731ef/gr4.sml gr4 gr4.sml sml 11646 94 219 IMAGE-THUMBNAIL 1-s2.0-S2468823125002020-gr9.sml https://s3-eu-west-1.amazonaws.com/prod-ucs-content-store-eu-west/content/pii:S2468823125002020/gr9/THUMBNAIL/image/gif/87e4e4d909ac7c32a237e2e6e2d264e1/gr9.sml gr9 gr9.sml sml 13209 164 199 IMAGE-THUMBNAIL 1-s2.0-S2468823125002020-gr7.sml https://s3-eu-west-1.amazonaws.com/prod-ucs-content-store-eu-west/content/pii:S2468823125002020/gr7/THUMBNAIL/image/gif/615b046c862d2f22fb9f56b7e3012696/gr7.sml gr7 gr7.sml sml 15415 163 177 IMAGE-THUMBNAIL 1-s2.0-S2468823125002020-gr8.sml https://s3-eu-west-1.amazonaws.com/prod-ucs-content-store-eu-west/content/pii:S2468823125002160/gr8/THUMBNAIL/image/gif/ca3bc2938599ce9646fee91b03e66f68/gr8.sml gr8 gr8.sml sml 9087 91 219 IMAGE-THUMBNAIL 1-s2.0-S2468823125002020-gr1_lrg.jpg https://s3-eu-west-1.amazonaws.com/prod-ucs-content-store-eu-west/content/pii:S2468823125002020/HIGHRES/image/jpeg/82234c40c2436ea558e095a9d1845e82/gr1_lrg.jpg gr1 gr1_lrg.jpg jpg 509412 2031 2083 IMAGE-HIGH-RES 1-s2.0-S2468823125002020-gr2_lrg.jpg https://s3-eu-west-1.amazonaws.com/prod-ucs-content-store-eu-west/content/pii:S2468823125002020/HIGHRES/image/jpeg/53a4d7470f102deed3e22e586b494284/gr2_lrg.jpg gr2 gr2_lrg.jpg jpg 438853 1059 2500 IMAGE-HIGH-RES 1-s2.0-S2468823125002020-ga1_lrg.jpg https://s3-eu-west-1.amazonaws.com/prod-ucs-content-store-eu-west/content/pii:S2468823125002020/HIGHRES/image/jpeg/4366494f253e3fc3ed86d10555216eb5/ga1_lrg.jpg ga1 true ga1_lrg.jpg jpg 236376 886 2213 IMAGE-HIGH-RES 1-s2.0-S2468823125002020-gr5_lrg.jpg https://s3-eu-west-1.amazonaws.com/prod-ucs-content-store-eu-west/content/pii:S2468823125002020/HIGHRES/image/jpeg/b379d3d600b0908734fe5c85dddbeeba/gr5_lrg.jpg gr5 gr5_lrg.jpg jpg 519732 1574 2083 IMAGE-HIGH-RES 1-s2.0-S2468823125002020-gr6_lrg.jpg https://s3-eu-west-1.amazonaws.com/prod-ucs-content-store-eu-west/content/pii:S2468823125002020/HIGHRES/image/jpeg/0afbbe6a65852813f08b60720fefa98e/gr6_lrg.jpg gr6 gr6_lrg.jpg jpg 401174 1048 2508 IMAGE-HIGH-RES 1-s2.0-S2468823125002020-gr3_lrg.jpg https://s3-eu-west-1.amazonaws.com/prod-ucs-content-store-eu-west/content/pii:S2468823125002020/HIGHRES/image/jpeg/d484b1ef35ffa297df9d2953774ea5c0/gr3_lrg.jpg gr3 gr3_lrg.jpg jpg 403833 1054 2508 IMAGE-HIGH-RES 1-s2.0-S2468823125002020-gr4_lrg.jpg https://s3-eu-west-1.amazonaws.com/prod-ucs-content-store-eu-west/content/pii:S2468823125002020/HIGHRES/image/jpeg/45efd16a1e4196478f27d846419d32b0/gr4_lrg.jpg gr4 gr4_lrg.jpg jpg 435684 1075 2500 IMAGE-HIGH-RES 1-s2.0-S2468823125002020-gr9_lrg.jpg https://s3-eu-west-1.amazonaws.com/prod-ucs-content-store-eu-west/content/pii:S2468823125002020/HIGHRES/image/jpeg/36ecb842079743a6b1b5d598463042cf/gr9_lrg.jpg gr9 gr9_lrg.jpg jpg 273521 1379 1675 IMAGE-HIGH-RES 1-s2.0-S2468823125002020-gr7_lrg.jpg https://s3-eu-west-1.amazonaws.com/prod-ucs-content-store-eu-west/content/pii:S2468823125002160/HIGHRES/image/jpeg/e0aaef2ea666d5af6fc43ebdad9b2dfa/gr7_lrg.jpg gr7 gr7_lrg.jpg jpg 372483 1539 1667 IMAGE-HIGH-RES 1-s2.0-S2468823125002020-gr8_lrg.jpg https://s3-eu-west-1.amazonaws.com/prod-ucs-content-store-eu-west/content/pii:S2468823125002160/HIGHRES/image/jpeg/2e52ecd6ac166e799e2b646176e60245/gr8_lrg.jpg gr8 gr8_lrg.jpg jpg 340872 1039 2500 IMAGE-HIGH-RES 1-s2.0-S2468823125002020-mmc1.docx https://s3-eu-west-1.amazonaws.com/prod-ucs-content-store-eu-west/content/pii:S2468823125002020/mmc1/MAIN/application/vnd.openxmlformats-officedocument.wordprocessingml.document/f5fdcc0fa9b1bfba0dc7d95be3b2bbeb/mmc1.docx mmc1 mmc1.docx docx 1455256 APPLICATION 1-s2.0-S2468823125002020-si1.svg https://s3-eu-west-1.amazonaws.com/prod-ucs-content-store-eu-west/content/pii:S2468823125002020/image/svg+xml/9224bd3561cbbca6d90a58b62bd3a2a2/si1.svg si1 si1.svg svg 3555 ALTIMG 1-s2.0-S2468823125002020-si2.svg https://s3-eu-west-1.amazonaws.com/prod-ucs-content-store-eu-west/content/pii:S2468823125002020/image/svg+xml/7dcdf99aafa40873e5f7e63b239922be/si2.svg si2 si2.svg svg 10426 ALTIMG 1-s2.0-S2468823125002020-si3.svg https://s3-eu-west-1.amazonaws.com/prod-ucs-content-store-eu-west/content/pii:S2468823125002020/image/svg+xml/d71b1388a1c38c80acde2d8fdf83b3b7/si3.svg si3 si3.svg svg 16735 ALTIMG 1-s2.0-S2468823125002020-si4.svg https://s3-eu-west-1.amazonaws.com/prod-ucs-content-store-eu-west/content/pii:S2468823125002020/image/svg+xml/e745072d035891872c22c0918b6eab0a/si4.svg si4 si4.svg svg 28811 ALTIMG 1-s2.0-S2468823125002020-si5.svg https://s3-eu-west-1.amazonaws.com/prod-ucs-content-store-eu-west/content/pii:S2468823125002020/image/svg+xml/5a88d035d321a0e54a522f74321e6d00/si5.svg si5 si5.svg svg 7158 ALTIMG 1-s2.0-S2468823125002020-si6.svg https://s3-eu-west-1.amazonaws.com/prod-ucs-content-store-eu-west/content/pii:S2468823125002020/image/svg+xml/0b83c8da0830451cfa6be3d66dee8517/si6.svg si6 si6.svg svg 9857 ALTIMG 1-s2.0-S2468823125002020-si7.svg https://s3-eu-west-1.amazonaws.com/prod-ucs-content-store-eu-west/content/pii:S2468823125002020/image/svg+xml/3568e812ec5fac54a7a8080587f9e32f/si7.svg si7 si7.svg svg 12857 ALTIMG 1-s2.0-S2468823125002020-si8.svg https://s3-eu-west-1.amazonaws.com/prod-ucs-content-store-eu-west/content/pii:S2468823125002020/image/svg+xml/ab5e980c686ff407ca3d6e57c2eb2f27/si8.svg si8 si8.svg svg 21044 ALTIMG MCAT 115016 115016 S2468-8231(25)00202-0 10.1016/j.mcat.2025.115016 Fig. 1 (a)Ammonia decomposition activity of Ni/CeO2 and Ni/M0.2Ce0.8Ox catalysts (pure NH3 WHSV= 9000 mL·gcat -1·h-1) (b) H2 formation rate of catalysts at 475 °C (c) 24 h stability tests of Ni/CeO2 and Ni/Ba0.2Ce0.8Ox catalysts. Fig 1 Fig. 2 XRD patterns of catalysts after (a) calcination and (b) reduction. Fig 2 Fig. 3 CO2-TPD profiles of Ni/CeO2 and Ni/M0.2Ce0.8Ox catalysts. Fig 3 Fig. 4 (a) H2-TPD (b) H2-TPR profiles of catalysts. Fig 4 Fig. 5 XPS spectra of Ni/CeO2 and Ni/M0.2Ce0.8Ox catalysts (a) Ni 2p (b) Ce 3d. Fig 5 Fig. 6 (a) Effect of NH3 partial pressure on ammonia decomposition reaction rate (b) Effect of H2 partial pressure on ammonia decomposition reaction rate. Fig 6 Fig. 7 Arrhenius plots of Ni/CeO2 and Ni/M0.2Ce0.8Ox. Fig 7 Fig. 8 Comparison of the experimental and model results for Ni/CeO2 at NH3 = 2500 ppm\\2250 ppm\\1500 ppm\\1120 ppm, WHSV=2460,000 mL·g-1·h-1 (a) without hydrogen inhibition (b) with hydrogen inhibition. Fig 8 Fig. 9 Comparison of the experimental and model results for Ni/CeO2 at different NH3 concentrations (black: pure NH3=15 mL·min-1; red: NH3=15 mL·min-1 and N2=505 mL·min-1, total flow rate = 520 mL·min-1). Fig 9 Table 1 Physical properties of Ni/CeO2 and Ni/M0.2Ce0.8Ox. Table 1 Samples Ni content wt% a SBET(m2·g-1) Pore volume (cm3·g-1) Pore diameter (nm) C e 3 + C e 3 + + C e 4 + (%) b Catalyst Support Ni/CeO2 8.44 23.8 33.5 0.070 5.52 37.93 Ni/Mg0.2Ce0.8Ox 8.13 38.5 36.1 0.138 7.05 33.65 Ni/Ca0.2Ce0.8Ox 8.36 20.4 24.7 0.088 7.63 28.99 Ni/Sr0.2Ce0.8Ox 8.26 11.5 17.3 0.058 8.09 20.63 Ni/Ba0.2Ce0.8Ox 8.31 11.6 16.5 0.062 7.66 31.92 a From ICP-OES analysis b From XPS analysis Table 2 NH3 and H2 reaction order and activation energy. Table 2 samples a (NH3)* b (H2) Ea (KJ·mol-1) Ni/CeO2 0.53 -1.55 88 Ni/Mg0.2Ce0.8Ox 0.51 -1.30 91 Ni/Ca0.2Ce0.8Ox 0.51 -1.11 79 Ni/Sr0.2Ce0.8Ox 0.60 -1.05 92 Ni/Ba0.2Ce0.8Ox 0.69 -0.81 75 ⁎ Reaction order was measured at 430 °C, WHSV=2460,000 mL·g-1·h-1. Promoting effect of alkaline earth metals on Ni/CeO2 catalysts for ammonia decomposition reaction Zhen Zhang Writing – original draft Validation Methodology Investigation Formal analysis Data curation Conceptualization a Minghui Yu Validation Methodology Conceptualization a Meiqing Shen Supervision Resources Funding acquisition Conceptualization a b Wei Li Writing – review & editing Validation Software Conceptualization b Gurong Shen Writing – review & editing Supervision Project administration Methodology Funding acquisition Conceptualization c ⁎ a School of Chemical Engineering and Technology, Tianjin University, Tianjin 300350, China School of Chemical Engineering and Technology Tianjin University Tianjin 300350 China aSchool of Chemical Engineering and Technology, Tianjin University, Tianjin 300350, China b National Rare Earth Catalysis Research Institute, Dongying 257000, China National Rare Earth Catalysis Research Institute Dongying 257000 China bNational Rare Earth Catalysis Research Institute, Dongying 257000, China c School of Materials Science and Engineering, Tianjin University, Tianjin 300350, China School of Materials Science and Engineering Tianjin University Tianjin 300350 China cSchool of Materials Science and Engineering, Tianjin University, Tianjin 300350, China ⁎ Corresponding author. Ni-based catalysts, as non-noble metal alternatives, are widely regarded for their potential in ammonia decomposition for hydrogen production. However, their performance at low temperatures is suboptimal, necessitating the addition of promoters and a clear understanding of their mechanisms to enhance catalytic activity. In this study, we have successfully improved the low-temperature ammonia decomposition performance of Ni/CeO2 by incorporating alkaline earth metals and conducted a comprehensive analysis of the underlying structural and electronic effects. The findings reveal that alkaline earth metals can enhance the basicity of the catalyst and increase electron density around the active metal sites, thereby facilitating the rate-determining step of recombination and desorption of N atom. Moreover, the presence of alkaline earth metals disrupts hydrogen adsorption stability on the catalysts, effectively mitigating the impact of hydrogen inhibition. Based on systematic kinetic experiments, a kinetic model was developed that accurately captures the hydrogen inhibition effect for Ni/CeO2 catalysts. The insights into the promotional mechanisms of alkaline earth metals offer theoretical guidance for the development of highly active and cost-effective catalysts for ammonia decomposition. Graphical abstract Image, graphical abstract Keywords Ammonia decomposition Alkaline earth metal Hydrogen inhibition Kinetic model Data availability No data was used for the research described in the article. 1 Introduction Ammonia, as an excellent hydrogen carrier, has several advantages [1–3]: (1) ammonia has a high hydrogen content of about 17.7 wt%, and liquid ammonia exhibits a high volumetric energy density of 12.9 MJ·L-1 [4–6]; (2) ammonia, as a carbon-free compound, can be burned directly; (3) Compared to the very low liquefaction temperature (-253 °C) of hydrogen, ammonia is easily liquefied at -33 °C [7], making it less expensive to store and transport than hydrogen [8]; (4) Ammonia is safe as a fuel with its explosion limit (15 %–28 %) much higher than that of hydrogen, and once ammonia leaks, the pungent odor can be detected quickly. Hence ammonia can be widely used in the transportation field, such as automobiles, airplanes, ships etc [9]. In addition, catalytic technology can be used to efficiently decompose ammonia to hydrogen when needed [10–12]. Ammonia decomposition reaction to generate nitrogen and hydrogen is endothermic (Eq. (1)), (1) 2 N H 3 = N 2 + 3 H 2 Δ H = 92 KJ · mo l − 1 Efficient and inexpensive hydrogen production from ammonia decomposition technology requires low-cost, highly active and stable catalysts. Nowadays, Ni-based catalysts have received much attention for their good catalytic activity and economic benefits, but their low-temperature performance needs to be improved [13]. However, selecting the appropriate supports and promoters can effectively enhance the activity of the catalyst. Deng [14] showed Ni/Ce0.8Zr0.2O2 catalysts to be more active than Ni/CeO2 and Ni/Al2O3, and they attributed it to the promoting effect of Ce, the doping of Zr4+ cations, and interactions between Ni and the support. Zhang et al. [15] used La to modify Ni/Al2O3, and found that La as a promoter could reduce the particle size of Ni and decrease the stability of the reaction intermediates in the active site, and the inhibitory effect of H2 was also mentioned. Increasing the alkalinity of the supports have become one of the important strategies to enhance the activity of ammonia decomposition catalysts. For ammonia decomposition reaction, the recombination of N atom and desorption of N2 are generally regarded as the rate-determining steps [16–18]. Basic promoters function as electron donors, transferring electrons to metal centers, which weakens the metal-nitrogen bond and aids in the desorption of nitrogen [19–22]. Guo [23] synthesized the La0.5Sr0.5NiO3-δ-600H2 catalyst by incorporating SrO, which served dual roles as support and promoter, and this catalyst demonstrated an exceptional conversion of ammonia decomposition. However, the impact of “hydrogen inhibition” caused by the competitive adsorption of NH3 and H2 on active sites during ammonia decomposition cannot be overlooked. Previous reports have suggested that the strong basic property of catalysts can mitigate the inhibitory effect of H2 on ammonia decomposition, but systematic evidence is generally lacking. Recently, ammonia decomposition catalysts prepared with single alkaline earth metals as promoters (Ni/MgO-La2O3 [24], Ni/CaZrO3 [25], SrO-Ni/Y2O3 [26], Co-Ba/Y2O3 [27]) have been frequently reported. Alkaline earth metals M (Mg, Ca, Sr, Ba), while belonging to the same group and sharing similar physical and chemical characteristics, also exhibit regular differences in ionic radii and electronegativity. These developments and theories inspire us to select the same carrier for a systematic and in-depth exploration of the mechanism by which alkaline earth metals enhance the catalytic activity of ammonia decomposition. In this work, we synthesized CeO2 support modified with alkaline earth metals M (Mg, Ca, Sr, Ba) via citric acid complexation method, and assessed their catalytic activities for ammonia decomposition following the loading of Ni. The incorporation of alkaline earth metals was found to markedly enhance the catalytic activity for ammonia decomposition, and increase the rate of hydrogen formation. We focus on analyzing the mechanism of alkaline earth metal promotion of catalytic activity from the perspectives of catalyst structural properties and electronic effects. The addition of alkaline earth metals can increase the electronic density around the active metal sites, thereby facilitating the slow kinetic step of associative desorption of N atoms. Kinetic studies are crucial for a deeper understanding of the mechanisms involved in ammonia decomposition reaction, which in turn informs the design of more efficient catalysts. To this end, we conducted comprehensive kinetic experiments to explore the mitigation of hydrogen inhibition by alkaline earth metals after eliminating both internal and external diffusion. Utilizing the kinetic parameters derived from these experiments, we developed a Ni/CeO2 kinetic model that accurately captures and validates the hydrogen inhibition effect during the ammonia decomposition reaction. 2 Experiment 2.1 Catalyst preparation Alkaline earth metal M (Mg, Ca, Sr, Ba) modified CeO2 were synthesized by the citric acid complexation method. The CeO2 was obtained by dissolving 17.37 g of Ce(NO)3·6H2O (Aladdin) and 11.58 g of citric acid (Aladdin) in 50 mL of deionized water, stirring at 80 °C for 3 h, drying in an oven at 80 °C for 12 h, followed by calcining at 600 °C for 5 h in a muffle furnace. The same procedure was used to prepare alkaline earth metals (Mg, Ca, Sr, Ba) modified CeO2 supports, using the alkaline earth metal to Ce molar ratio of M2+: Ce3+ = 2: 8. The Ni/M0.2Ce0.8Ox catalysts were prepared by the impregnation method. 1.01 g of Ni(NO3)2·6H2O was dissolved in a certain amount of deionized water at room temperature, and then mixed with 2 g of the supports. The sample was dried at 80 °C for 3 h and calcined at 550 °C for 5 h. 2.2 Catalytic testing The ammonia decomposition experiments were carried out in a quartz tube reactor with an inner diameter of 13 mm [28]. Before the test, 0.1 g of catalyst was mixed with 0.9 g of quartz sand, and 100 mL·min-1 of 10 % H2/N2 was passed through the reactor at 550 °C for 2 h. The reactor was purged and cooled down to 350 °C in Ar, and then pure NH3 was passed through the reactor at 15 mL·min-1, and the reaction temperature was varied from 350 °C to 650 °C with an interval of 25 °C. The conversion was measured at steady state after 20 min. Product on-line analysis was performed using a Fourier infrared gas analyzer (MKS MultiGas 2030). The catalytic activity was compared by both conversion as in Eq. (2) and rate of hydrogen production as in Eq. (3), where L (NH3, inlet) stands for inlet NH3 flow rate. (2) X N H 3 % = C ( N H 3 , i n l e t ) − C ( N H 3 , o u t l e t ) C ( N H 3 , i n l e t ) * 100 % (3) H 2 form ation rate ( mmol · g − 1 · min − 1 ) = L ( N H 3 , inlet ) * X N H 3 ( % ) * 1.5 V m * m cat 2.3 Characterization The specific surface areas and pore volumes of the samples were assessed by nitrogen adsorption-desorption isotherms, which were measured using a Micromeritics ASAP physisorption instrument at the temperature of liquid nitrogen (-196 °C). Prior to the measurements, the samples were subjected to degassing under vacuum at 300 °C for a duration of 2 h. The specific surface areas were determined employing the Bruner-Emmett-Teller (BET) equation, while the pore volumes were derived using the Barrett-Joyner-Halenda (BJH) method. Elemental analysis of the samples was carried out by Inductively Coupled Plasma Atomic Emission Spectrometry (ICP-OES, Thermal Fisher). Powder X-ray diffraction (XRD) patterns were obtained with a diffractometer (Haoyuan DX-2700BH) employing Cu Kα radiation (λ = 1.54056 Å). The data collection spanned from 20 to 90° with a step increment of 0.05°. The crystallite sizes were calculated using the Scherrer formula D = K λ β cos θ , where D represents the crystallite size in nanometers, λ is the wavelength in nanometers, β is the full width at half maximum (FWHM) of the target diffraction peak, and θ is the peak position in degrees. STEM-Mapping images were acquired using a JEM-F200 transmission electron microscope. The powder was deposited onto a twin-grid mesh coated with a carbon film, which was first suspended in ethanol and then sonicated for 30 min. The twin-grid mesh support film not only prevents sample movement due to the magnetic field of the electron microscope, but also protects against contamination from magnetic samples, making it highly effective for the observation of magnetic material samples. CO2 temperature-programmed desorption (CO2-TPD) was carried out using a Micromeritics Autochem II 2920 system equipped with a thermal conductivity detector (TCD). 0.1 g catalyst was reduced at 550 °C under a 10 % H2/N2 for 2 h. Subsequently, the catalyst was cooled to 50 °C under a He purge. The pretreated catalyst was then exposed to a CO2 flow for 1 h, followed by a 1 h He purge to remove the remaining CO2 gas. The desorption behavior of CO2 was recorded by TCD under pure He flow (30 mL·min-1) with a temperature ramp of 10 °C·min-1. Temperature-programmed reduction (TPR) and desorption (TPD) with H2 were conducted on a Micromeritics Autochem II 2920 system. Approximately 0.1g sample was used for each test. Each catalyst in H2-TPR experiment was measured at 10 % H2/N2 (30 mL/min) from 40 °C to 900 °C with a constant heating rate of 10 °C·min-1, and H2 consumption was quantified by using Ag2O as a reference measured on the same system. Prior to the TPD measurements, each catalyst (0.1 g) was pre-reduced in situ at 550 °C under 10 % H2/N2. The reduced sample was cooled in situ to 30 °C and adsorbed for 1 h under a 10 % H2/Ar flow, after which it was purged with pure Ar to achieve a stable baseline. The desorption curve was subsequently recorded under pure Ar flow (30 mL·min-1) with a temperature ramp of 10 °C·min-1. X-ray photoelectron spectroscopy (XPS) analyses were performed using a Thermo K-ALPHA system fitted with an Al Kα X-ray source (hν = 1486.6 eV). Wide-scan spectra were acquired with a step increment of 1.0 eV. The Ni 2p and Ce 3d regions were scanned within the energy ranges of 850–865 and 875–925 eV, respectively, with a step size of 0.1 eV. Binding energies (BE) were referenced to the adventitious carbon peak (C 1s BE at 284.8 eV). Throughout the measurements, the pressure in the analysis chamber was kept at 5 × 10⁻⁷ Pa. 2.4 Kinetic model The ammonia decomposition kinetics model is established using GT-POWER, a solver within the GT-SUITE engine performance simulation software developed by Gamma Technologies. The flow components mainly include the gas inlet, inlet conical channel, catalytic reactor, outlet conical channel, and outlet environment. The CatalystBrick component is used to define the geometric dimensions, channel shape, and discrete length of the catalyst carrier. As a flow component, it requires axial discretization to ensure accuracy, and the composition materials and thermodynamic parameters of the catalyst support must also be defined. After the physical model of the catalyst is established, based on this physical model, the ammonia decomposition catalytic reaction mechanism is added through the SurfaceReactions module, including the corresponding concentration reaction equations and inhibition term equations. 3 Results and discussion 3.1 Catalytic performance: activity and stability The catalytic activity of both Ni/CeO2 and Ni/M0.2Ce0.8Ox samples for ammonia decomposition was evaluated at a weight hourly space velocity (WHSV) of 9000 mL·gcat -1·h-1. The corresponding light-off curves are presented in Fig. 1 (a) and the rates of H2 formation at 475 °C are shown in Fig. 1(b). The order of the performance is as follows: Ni/Ba0.2Ce0.8Ox > Ni/Sr0.2Ce0.8Ox > Ni/Ca0.2Ce0.8Ox > Ni/Mg0.2Ce0.8Ox > Ni/CeO2, with the rate of H2 formation exhibiting a similar trend. Notably, at 475 °C, the conversion rate for Ni/CeO2 is a mere 12 %, whereas Ba doping significantly enhances the catalytic activity of Ni/Ba0.2Ce0.8Ox, boosting the conversion rate to approximately 32 %. Ni/CeO2 catalyst requires a temperature of 550 °C to achieve a 50 % conversion in ammonia decomposition. In contrast, catalysts modified with alkaline earth metals can substantially reduce the T50 value, enabling higher conversions at lower temperatures. These results indicate that the incorporation of alkaline earth metals can effectively improve the catalytic activity of ammonia decomposition. Fig. 1(c) depicts the 24 h stability tests conducted on catalysts Ni/CeO2 and the highest activity Ni/Ba0.2Ce0.8Ox. The Ni/CeO2 can maintain a stable ammonia decomposition conversion rate of 30 % at 525 °C. When the temperature was lowered to 475 °C and then returned to the original temperature of 525 °C, the catalyst's conversion rate rebounded to its initial level (30 %), indicating that Ni/CeO2 exhibits good durability and stability under temperature cycling. For catalyst Ni/Ba0.2Ce0.8Ox, no performance degradation was observed even after prolonged exposure to high temperatures of 550 °C, with the final ammonia decomposition conversion rate maintained at 84 %. These results validate that the synthesized alkaline earth metals modified Ni/CeO2 catalysts possesses outstanding thermal stability. 3.2 The catalysts properties Fig. 2 (a) and (b) show the XRD patterns of the catalysts after calcination and reduction, respectively. In the case of the calcined samples, the XRD patterns revealed, in addition to the characteristic peaks of CeO2, new peaks emerging at 2θ = 37.3° and 43.3°, which corresponding to the (111) and (200) crystal planes of NiO, respectively. For the reduced samples, diffraction peaks of metallic Ni were detected except for Ni/Mg0.2Ce0.8Ox. The absence of metallic nickel peaks in this particular sample suggests a strong interaction between nickel and MgO, potentially leading to the formation of MgNiO2 species [29]. These species are speculated to be resistant to reduction, thus preventing the formation of the nickel metal phase. The specific surface area and pore structure of the supports and catalysts were characterized using N2 adsorption-desorption analysis. Fig. S2(a) and (b) present the N2 adsorption-desorption isotherms for the supports and catalysts, respectively. The isotherms are classified as type IV, and the hysteresis loops are of type H3, indicative of a mesoporous structure predominantly comprising lamellar arrangements within the aggregate morphology. Table 1 quantifies the active metal Ni loading, specific surface area, pore volume and pore size of the catalysts. Compared to the support CeO2 with a specific surface area of 33.5 m2·g-1, the specific surface areas of Sr0.2Ce0.8Ox (17.3 m2·g-1) and Ba0.2Ce0.8Ox (16.5 m2·g-1) showed a significant decrease. The phenomenon appears to be detrimental to the dispersion of the active metal Ni. However, it was observed that the performance of catalysts showed an improving trend in the ammonia decomposition reaction tests. STEM-mapping, facilitated by high-angle annular dark-field (HAADF-STEM) images of samples are shown in Fig. S4, the Ba element is distributed quite uniformly, indicating that the citric acid complexation method effectively forms metal-citrate chelates, which in turn ensures a uniform elemental distribution during the material synthesis process. In the case of supports with a reduced specific surface area due to the incorporation of alkaline earth metals, severe aggregation of Ni elements was observed, indicating that a decrease in surface area is detrimental to the dispersion of active metals. Nevertheless, this aggregation did not significantly impact the comparison of ammonia decomposition conversion, suggesting that other factors are more critical in the catalytic process. The acid-base property of the catalysts was elucidated through CO2-TPD analysis to probe the quantity and intensity of basic sites, as shown in Fig. 3 . The peaks between 70 °C–150 °C (α) and 150 °C–400 °C (β) correspond to the desorption of CO2 from weak and moderate basic sites on the catalyst, respectively. Whereas the peaks after 400 °C (γ) are indicative of CO2 desorption from ligand-oxygen species on the strong basic sites or decomposition of the carbonates [30]. The upward trend in the desorption peaks temperature of CO2 for the low temperature α peak indicates that the alkaline earth metals have increased the basic strength of the weak basic sites. For peaks of β, the Ni/Ca0.2Ce0.8Ox catalyst exhibits a higher CO2 desorption peak temperature compared to the Ni/Mg0.2Ce0.8Ox catalyst, indicating a stronger basicity, which is consistent with the properties of alkaline earth metals. The significant CO2 desorption observed for both catalysts is primarily attributed to the presence of alkaline earth metal oxides (MgO, CaO) [31,32]. Although these oxides provide a considerable number of basic sites, their basicity strength is considerably lower than that of the Ni/Sr0.2Ce0.8Ox and Ni/Ba0.2Ce0.8Ox catalysts. Additionally, in comparison with the Ni/Sr0.2Ce0.8Ox catalyst, the Ni/Ba0.2Ce0.8Ox catalyst exhibits similar basicity strength but a greater number of basic sites. Several researchers have proposed that oxygen vacancies can typically act as Lewis basic sites to adsorb CO2 [33]. The higher oxygen vacancy concentration of the Ni/Ba0.2Ce0.8Ox catalyst compared to the Ni/Sr0.2Ce0.8Ox catalyst, as quantitatively determined by XPS in Table 1, reasonably accounts for the differences between the two. Overall, these results demonstrated that both the basicity strength and the quantity of basic sites contribute positively to enhancing the catalytic activity for ammonia decomposition. The incorporation of alkaline earth metals effectively enhances the basicity [25,34,35]. This enhancement implies an increased electron-donating capacity, which weakens Ni-N bond and facilitate the re-combinative desorption of N* [36–38], while also mitigating the effect of the hydrogen inhibition phenomenon [39–41]. The H2 adsorption and desorption capacities were measured by H2-TPD, as shown in Fig. 4 (a). The hydrogen desorption peaks (α) observed between 80 °C and 200 °C are attributed to H2 adsorbed by dispersed Ni particles on the supports. Peaks (β) above 200 °C are associated with the desorption of H2 that is more strongly bound to the catalyst, potentially due to spillover from the support or desorption on Ni-O-M (where M represents Mg, Ca, Sr, Ba) sites [42]. The hydrogen adsorption and desorption on active sites influence the catalytic activity of reaction. Therefore, we propose that peak (α) directly reflects the influence of the adsorption and desorption behavior of active metal Ni0 with H2 on the establishment of equilibrium in ammonia decomposition reaction. The sequence of peak hydrogen desorption temperatures, Ni/CeO2 > Ni/Mg0.2Ce0.8Ox > Ni/Ca0.2Ce0.8Ox > Ni/Sr0.2Ce0.8Ox > Ni/Ba0.2Ce0.8Ox, between 80 °C and 200 °C is believed to correlate with the stability of hydrogen on the active sites. By comparing the integral area of peak (α), it indicated that the incorporation of alkaline earth metals tends to reduce the amount of hydrogen adsorbed on Ni. Overall, the decrease in both the desorption peak temperature and quantity of hydrogen on active sites indicates that the incorporation of alkaline earth metals can effectively mitigate the effects of hydrogen inhibition, thereby promoting the catalytic activity of ammonia decomposition [15,36,43]. The metal-support interaction and the reduction behavior were probed by the H2-TPR technique, and the results are shown in Fig. 4(b). In the case of the Ni/CeO2 sample, the peaks between 150 °C and 250 °C are ascribed to the reduction of oxygen species resulting from the incorporation of Ni2+ into the CeO2 lattice to form a solid solution. And the peaks between 250 °C and 450 °C correspond to the reduction of NiO that interact strongly with the supports [44]. The addition of alkaline earth metals was observed to increase the temperature of the reduction peak, with the disappearance of the reduction peak at 208 °C, indicating a stronger interaction between the NiO and the alkaline earth metal in the support. It has been reported that an enhancement in metal-support interaction is beneficial for improving the performance of ammonia decomposition catalysts, however, a stronger interaction is not always preferable. For instance, in the case of the Ni/Mg0.2Ce0.8Ox catalyst, only a negligible hydrogen consumption peak was observed, which is attributed to the formation of MgNiO2 due to the strong interaction between NiO and the support, making the active metal Ni0 more difficult to reduce. Therefore, a moderate support-metal interaction is beneficial for the catalytic activity in ammonia decomposition reaction [14]. Meanwhile the enhancement of the interaction between active metals and supports facilitates electron transfer, which plays a significant role in modulating the electronic structure of catalysts and improving catalytic performance. XPS analysis was employed to reveal the surface chemical states and electronic structures of the reduced Ni/CeO2 and Ni/M0.2Ce0.8Ox catalysts. Fig. 5 (a) presents the analysis of the Ni 2p region, indicating the presence of both Ni0 (∼852.1 eV) and Ni2+ (∼853.7 eV, ∼855.6 eV) on the surface. The presence of Ni2+ may be attributed to rapid oxidation during sample handling or absorption of trace moisture from the air, which is inevitable given that XPS is a surface-sensitive characterization technique. The incorporation of alkaline earth metals led to a trend of decreased binding energy for metallic Ni0. It is noteworthy that there is a regular correlation between the binding energy and the catalysis performance, with Ni/CeO2 > Ni/Mg0.2Ce0.8Ox > Ni/Ca0.2Ce0.8Ox > Ni/Sr0.2Ce0.8Ox > Ni/Ba0.2Ce0.8Ox. This suggests that the support provides additional electrons to the surface of the active metal, increasing the electron density around Ni0, which is favorable for the binding and desorption of nitrogen, thereby enhancing the catalytic activity for ammonia decomposition. Fig. 5(b) analyzes the Ce 3d region, with the blue area corresponding to the 3d104f1 state of Ce3+ and the yellow area corresponding to the 3d10 state of Ce4+. The formation of oxygen vacancies in CeO2 is typically accompanied by the generation of Ce3+, hence the quantification of oxygen vacancies is achieved through the ratio Ce3+/ (Ce3+ + Ce4+), as shown in Table 1. The Ni/CeO2 catalyst has the highest number of oxygen vacancies, yet it exhibits the lowest ammonia decomposition conversion. Therefore, oxygen vacancies are not the only key factor contributing to the activity of the catalyst. 3.3 The kinetic analysis of catalysts 3.3.1 Kinetic parameters: activation energy and reaction order In order to better understand this promotion effect, we carried out kinetics measurements on these catalysts. The reaction rate can be expressed by a power law equation as follows: r = k ( p N H 3 ) a ( p H 2 ) b ( p N 2 ) c r is the reaction rate; k is the reaction rate constant; pi is the partial pressure of gas i, and a, b, and c are the reaction order for NH3, H2, and N2, respectively (c is usually 0 for N2). The rates were measured after eliminating both internal and external diffusion effects (WHSV=2460,000 mL·g-1·h-1, particle size 80–100 mesh) and the conversions were kept below 15 % to ensure differential kinetics region. The effects of NH3 and H2 partial pressures on the reaction rates are shown in Fig. 6 (a) and (b), respectively, and the measured reaction orders are shown in Table 2 . The rate was found to increase with increasing NH3 partial pressures, but decrease with increasing H2 partial pressures, indicating that the reaction is inhibited by the product hydrogen. The absolute value of the hydrogen reaction order: Ni/CeO2 > Ni/Mg0.2Ce0.8Ox > Ni/Ca0.2Ce0.8Ox > Ni/Sr0.2Ce0.8Ox > Ni/Ba0.2Ce0.8Ox, indicating that the addition of alkaline earth metals can significantly alleviate the hydrogen inhibition effect, consistent with the ammonia decomposition activity of the catalysts. Fig. 7 shows the calculated apparent activation energy based on the Arrhenius equation. Ni/Ba0.2Ce0.8Ox has the lowest reaction activation energy (Ea = 75 KJ·mol-1) under these conditions, corresponding to the highest ammonia decomposition conversion in the low temperature region in Fig. 1(a). 3.3.2 Kinetic modeling of Ni/CeO2: hydrogen inhibition Based on the kinetic measurements, kinetic models with and without the hydrogen inhibition effect have been developed for Ni/CeO2 using GT-SUITE software. For the Ni/CeO2 kinetic model, the model parameter values are all taken as experimental values. When hydrogen inhibition is not considered, the reaction rate equation is as follows: R = 10 6 * e − 88000 R T * { N H 3 } 0.53 Without considering hydrogen inhibition effect, the model simulation results show much higher ammonia conversion than the measured experimental values, as shown in Fig. 8 (a). However, after considering the hydrogen inhibition by adding the H2 inhibition amendment term G(i), the rate expression becomes: R ′ = R G ( i ) = 10 6 * e − 88000 R T * { N H 3 } 0.53 1 + A H 2 * e − E a , H 2 R T * { H 2 } 1.55 The choice of the hydrogen inhibition term ensures that the rate equation is not affected by hydrogen inhibition when {H2} = 0. The model result was found to agree well with the experimental result at varying temperatures and ammonia concentrations, as shown in Fig. 8(b). Hence the hydrogen inhibition phenomenon must be considered in the catalytic process of ammonia decomposition. To further validate the developed model, ammonia decomposition activity tests were performed under pure NH3 and 2885 ppm NH3 with the same flow rate of NH3 passed per unit of time, as shown in Fig. 9 . With 2885 ppm NH3, the ammonia decomposition conversion at 450 °C was found to be 58 % (blue curve), whereas the conversion drops to 9 % with pure NH3 (red curve), even though the space velocity is considerably lower. Due to the significant differences between the reaction conditions and the kinetic experimental conditions, the model is operated within a lower conversion range, which is primarily governed by kinetics. The model (displayed by the green and purple curves) accurately predicts the difference in conversion rates between the two conditions and underscores the pivotal role of the hydrogen inhibition effect. When pure ammonia serves as the reaction feed gas, the amount of H2 generated is significantly higher, leading to a substantial decrease in the ammonia decomposition conversion due to the hydrogen inhibition effect. 4 Conclusion The CeO2 catalysts modified with alkaline earth metals M (Mg, Ca, Sr, Ba) were synthesized via citric acid complexation, and their catalytic activities for ammonia decomposition were evaluated after the loading of Ni. Notably, the addition of alkaline earth metals, particularly Ba, was found to significantly enhance the ammonia conversion. Through meticulous characterization, it has been discovered that alkaline earth metals can enhance the basicity of catalysts. While the binding energy of metallic Ni0 exhibits a decreasing trend, indicating an enrichment of electrons around the active metal, thereby facilitating the recombination and desorption of nitrogen in ammonia decomposition reaction. Additionally, the introduction of alkaline earth metals destabilizes hydrogen on active sites, and the absolute value of the hydrogen reaction order also shows a gradually decreasing trend, suggesting that the inhibitory effect of hydrogen on ammonia decomposition reaction is significantly diminished. While a systematic kinetic study led to the development and validation of a kinetic model that accurately captures the hydrogen inhibition effect for the Ni/CeO2 catalysts. CRediT authorship contribution statement Zhen Zhang: Writing – original draft, Validation, Methodology, Investigation, Formal analysis, Data curation, Conceptualization. Minghui Yu: Validation, Methodology, Conceptualization. Meiqing Shen: Supervision, Resources, Funding acquisition, Conceptualization. Wei Li: Writing – review & editing, Validation, Software, Conceptualization. Gurong Shen: Writing – review & editing, Supervision, Project administration, Methodology, Funding acquisition, Conceptualization. Declaration of competing interest The authors declare that they have no known competing financial interests or personal relationships that could have appeared to influence the work reported in this paper. Acknowledgments This work is supported by National Natural Science Foundation of China (T2341001), Shandong Province Natural Science Foundation Major Basic Research Program (ZR2023ZD20), the Key R&D project of Shandong Province (2022CXGC020311). Supplementary materials Supplementary material associated with this article can be found, in the online version, at doi:10.1016/j.mcat.2025.115016. Appendix Supplementary materials Image, application 1 References [1] A. Klerke C.H. Christensen J.K. Nørskov T. Vegge Ammonia for hydrogen storage: challenges and opportunities J. Mater. Chem. 18 2008 2304 2310 10.1039/B720020J A. Klerke, C.H. Christensen, J.K. Nørskov, T. Vegge, Ammonia for hydrogen storage: challenges and opportunities, J. Mater. Chem. 18 (2008) 2304–2310. 10.1039/B720020J. [2] C. Zamfirescu I. Dincer Ammonia as a green fuel and hydrogen source for vehicular applications Fuel Process. Technol. 90 2009 729 737 10.1016/j.fuproc.2009.02.004 C. Zamfirescu, I. Dincer, Ammonia as a green fuel and hydrogen source for vehicular applications, Fuel Process. Technol. 90 (2009) 729–737. 10.1016/j.fuproc.2009.02.004. [3] F. Chang W.B. Gao J.P. Guo P. Chen Emerging materials and methods toward ammonia-based energy storage and conversion Adv. Mater. 33 2021 2005721 10.1002/adma.202005721 F. Chang, W.B. Gao, J.P. Guo, P. Chen, Emerging materials and methods toward ammonia-based energy storage and conversion, Adv. Mater. 33 (2021) 2005721. 10.1002/adma.202005721. [4] K.E. Lamb M.D. Dolan D.F. Kennedy Ammonia for hydrogen storage; a review of catalytic ammonia decomposition and hydrogen separation and purification Int. J. Hydrog. Energy 44 2019 3580 3593 10.1016/j.ijhydene.2018.12.024 K.E. Lamb, M.D. Dolan, D.F. Kennedy, Ammonia for hydrogen storage; a review of catalytic ammonia decomposition and hydrogen separation and purification, Int. J. Hydrog. Energy 44 (2019) 3580–3593. 10.1016/j.ijhydene.2018.12.024. [5] K. Ryu G.E. Zacharakis-Jutz S.-C. Kong Performance enhancement of ammonia-fueled engine by using dissociation catalyst for hydrogen generation Int. J. Hydrog. Energy 39 2014 2390 2398 10.1016/j.ijhydene.2013.11.098 K. Ryu, G.E. Zacharakis-Jutz, S.-C. Kong, Performance enhancement of ammonia-fueled engine by using dissociation catalyst for hydrogen generation, Int. J. Hydrog. Energy 39 (2014) 2390–2398. 10.1016/j.ijhydene.2013.11.098. [6] S.F. Yin B.Q. Xu X.P. Zhou C.T. Au A mini-review on ammonia decomposition catalysts for on-site generation of hydrogen for fuel cell applications Appl. Catal. A Gen. 277 2004 1 9 10.1016/j.apcata.2004.09.020 S.F. Yin, B.Q. Xu, X.P. Zhou, C.T. Au, A mini-review on ammonia decomposition catalysts for on-site generation of hydrogen for fuel cell applications, Appl. Catal. A Gen. 277 (2004) 1–9. 10.1016/j.apcata.2004.09.020. [7] H. Kobayashi A. Hayakawa K.D.K.A. Somarathne E.C. Okafor Science and technology of ammonia combustion Proc. Combust. Inst. 37 2019 109 133 10.1016/j.proci.2018.09.029 H. Kobayashi, A. Hayakawa, K.D.K.A. Somarathne, E.C. Okafor, Science and technology of ammonia combustion, Proc. Combust. Inst. 37 (2019) 109–133. 10.1016/j.proci.2018.09.029. [8] J. Guo P. Chen Catalyst: NH3 as an energy carrier Chem 3 2017 709 712 10.1016/j.chempr.2017.10.004 J. Guo, P. Chen, Catalyst: NH3 as an energy carrier, Chem 3 (2017) 709–712. 10.1016/j.chempr.2017.10.004. [9] M. Gallucci The ammonia solution: ammonia engines and fuel cells in cargo ships could slash their carbon emissions IEEE Spectr. 58 2021 44 50 10.1109/MSPEC.2021.9370109 M. Gallucci, The ammonia solution: ammonia engines and fuel cells in cargo ships could slash their carbon emissions, IEEE Spectr. 58 (2021) 44–50. 10.1109/MSPEC.2021.9370109. [10] M. Comotti S. Frigo Hydrogen generation system for ammonia–hydrogen fuelled internal combustion engines Int. J. Hydrog. Energy 40 2015 10673 10686 10.1016/j.ijhydene.2015.06.080 M. Comotti, S. Frigo, Hydrogen generation system for ammonia–hydrogen fuelled internal combustion engines, Int. J. Hydrog. Energy 40 (2015) 10673–10686. 10.1016/j.ijhydene.2015.06.080. [11] Y. Wang X. Zhou L. Liu Theoretical investigation of the combustion performance of ammonia/hydrogen mixtures on a marine diesel engine Int. J. Hydrog. Energy 46 2021 14805 14812 10.1016/j.ijhydene.2021.01.233 Y. Wang, X. Zhou, L. Liu, Theoretical investigation of the combustion performance of ammonia/hydrogen mixtures on a marine diesel engine, Int. J. Hydrog. Energy 46 (2021) 14805–14812. 10.1016/j.ijhydene.2021.01.233. [12] F. Schüth R. Palkovits R. Schlögl D.S. Su Ammonia as a possible element in an energy infrastructure: catalysts for ammonia decomposition Energy Environ. Sci. 5 2012 6278 6289 10.1039/c2ee02865d F. Schüth, R. Palkovits, R. Schlögl, D.S. Su, Ammonia as a possible element in an energy infrastructure: catalysts for ammonia decomposition, Energy Environ. Sci. 5 (2012) 6278–6289. 10.1039/c2ee02865d. [13] X.F. Wei J. Su Y. Ji H. Huang D. Li H. Fang C. Chen Y. Luo L. Jiang Hydrotalcite-derived well-dispersed and thermally stable cobalt nanoparticle catalyst for ammonia decomposition Mol. Catal. 572 2025 114741 10.1016/j.mcat.2024.114741 X.F. Wei, J. Su, Y. Ji, H. Huang, D. Li, H. Fang, C. Chen, Y. Luo, L. Jiang, Hydrotalcite-derived well-dispersed and thermally stable cobalt nanoparticle catalyst for ammonia decomposition, Mol. Catal. 572 (2025) 114741. 10.1016/j.mcat.2024.114741. [14] Q.F. Deng H. Zhang X.X. Hou T.Z. Ren Z.Y. Yuan High-surface-area Ce0.8Zr0.2O2 solid solutions supported Ni catalysts for ammonia decomposition to hydrogen Int. J. Hydrog. Energy 37 2012 15901 15907 10.1016/j.ijhydene.2012.08.069 Q.F. Deng, H. Zhang, X.X. Hou, T.Z. Ren, Z.Y. Yuan, High-surface-area Ce0.8Zr0.2O2 solid solutions supported Ni catalysts for ammonia decomposition to hydrogen, Int. J. Hydrog. Energy 37 (2012) 15901–15907. 10.1016/j.ijhydene.2012.08.069. [15] J. Zhang H. Xu W. Li Kinetic study of NH3 decomposition over Ni nanoparticles: the role of La promoter, structure sensitivity and compensation effect Appl. Catal. A Gen. 296 2005 257 267 10.1016/j.apcata.2005.08.046 J. Zhang, H. Xu, W. Li, Kinetic study of NH3 decomposition over Ni nanoparticles: the role of La promoter, structure sensitivity and compensation effect, Appl. Catal. A Gen. 296 (2005) 257–267. 10.1016/j.apcata.2005.08.046. [16] C.J.H. Jacobsen S. Dahl B.S. Clausen S. Bahn A. Logadottir J.K. Norskov Catalyst design by interpolation in the periodic table: bimetallic ammonia synthesis catalysts J. Am. Chem. Soc. 123 2001 8404 8405 10.1021/ja010963d C.J.H. Jacobsen, S. Dahl, B.S. Clausen, S. Bahn, A. Logadottir, J.K. Norskov, Catalyst design by interpolation in the periodic table: bimetallic ammonia synthesis catalysts, J. Am. Chem. Soc. 123 (2001) 8404–8405. 10.1021/ja010963d. [17] A. Boisen S. Dahl J.K. Norskov C.H. Christensen Why the optimal ammonia synthesis catalyst is not the optimal ammonia decomposition catalyst J. Catal. 230 2005 309 312 10.1016/j.jcat.2004.12.013 A. Boisen, S. Dahl, J.K. Norskov, C.H. Christensen, Why the optimal ammonia synthesis catalyst is not the optimal ammonia decomposition catalyst, J. Catal. 230 (2005) 309–312. 10.1016/j.jcat.2004.12.013. [18] X.Z. Duan J. Ji G. Qian C. Fan Y. Zhu X.G. Zhou D. Chen W.K. Yuan Ammonia decomposition on Fe(110), Co(111) and Ni(111) surfaces: a density functional theory study J. Mol. Catal. A Chem. 357 2012 81 86 10.1016/j.molcata.2012.01.023 X.Z. Duan, J. Ji, G. Qian, C. Fan, Y. Zhu, X.G. Zhou, D. Chen, W.K. Yuan, Ammonia decomposition on Fe(110), Co(111) and Ni(111) surfaces: a density functional theory study, J. Mol. Catal. A Chem. 357 (2012) 81–86. 10.1016/j.molcata.2012.01.023. [19] C. Zhou K. Wu H. Huang C.F. Cao Y. Luo C.Q. Chen L. Lin C. Au L. Jiang Spatial confinement of electron-rich Ni nanoparticles for efficient ammonia decomposition to hydrogen production ACS Catal. 11 2021 10345 10350 10.1021/acscatal.1c02420 C. Zhou, K. Wu, H. Huang, C.F. Cao, Y. Luo, C.Q. Chen, L. Lin, C. Au, L. Jiang, Spatial confinement of electron-rich Ni nanoparticles for efficient ammonia decomposition to hydrogen production, ACS Catal. 11 (2021) 10345–10350. 10.1021/acscatal.1c02420. [20] W.Q. Zheng J. Zhang Q. Ge H. Xu W. Li Effects of CeO2 addition on Ni/Al2O3 catalysts for the reaction of ammonia decomposition to hydrogen Appl. Catal. B Environ. 80 2008 98 105 10.1016/j.apcatb.2007.11.008 W.Q. Zheng, J. Zhang, Q. Ge, H. Xu, W. Li, Effects of CeO2 addition on Ni/Al2O3 catalysts for the reaction of ammonia decomposition to hydrogen, Appl. Catal. B Environ. 80 (2008) 98–105. 10.1016/j.apcatb.2007.11.008. [21] H.W. Liu Y. Zhang S. Liu S. Li G. Liu Ni-CeO2 nanocomposite with enhanced metal-support interaction for effective ammonia decomposition to hydrogen Chem. Eng. J. 473 2023 145371 10.1016/j.cej.2023.145371 H.W. Liu, Y. Zhang, S. Liu, S. Li, G. Liu, Ni-CeO2 nanocomposite with enhanced metal-support interaction for effective ammonia decomposition to hydrogen, Chem. Eng. J. 473 (2023) 145371. 10.1016/j.cej.2023.145371. [22] Y.P. Yuan W. Wang D. Li R. Hu A. Yan Z. Wang Highly efficient and stable non-noble metal CoM@NC (M = Ni, Mo) catalysts for NH3 decomposition Mol. Catal. 572 2025 114800 10.1016/j.mcat.2024.114800 Y.P. Yuan, W. Wang, D. Li, R. Hu, A. Yan, Z. Wang, Highly efficient and stable non-noble metal CoM@NC (M = Ni, Mo) catalysts for NH3 decomposition, Mol. Catal. 572 (2025) 114800. 10.1016/j.mcat.2024.114800. [23] X.Y. Guo J.H. Wang Q. Zhang T.Z. Li H. Dong C.J. Jia C. Li Y.W. Zhang Alkaline earth metal promoted hydrogen production from ammonia decomposition over Ni/La2O3-based catalysts Appl. Catal. B Environ. Energy 348 2024 123844 10.1016/j.apcatb.2024.123844 X.Y. Guo, J.H. Wang, Q. Zhang, T.Z. Li, H. Dong, C.J. Jia, C. Li, Y.W. Zhang, Alkaline earth metal promoted hydrogen production from ammonia decomposition over Ni/La2O3-based catalysts, Appl. Catal. B Environ. Energy 348 (2024) 123844. 10.1016/j.apcatb.2024.123844. [24] Y.Z. Yu Y. Gan C. Huang Z. Lu X. Wang R. Zhang G. Feng Ni/La2O3 and Ni/MgO–La2O3 catalysts for the decomposition of NH3 into hydrogen Int. J. Hydrog. Energy 45 2020 16528 16539 10.1016/j.ijhydene.2020.04.127 Y.Z. Yu, Y. Gan, C. Huang, Z. Lu, X. Wang, R. Zhang, G. Feng, Ni/La2O3 and Ni/MgO–La2O3 catalysts for the decomposition of NH3 into hydrogen, Int. J. Hydrog. Energy 45 (2020) 16528–16539. 10.1016/j.ijhydene.2020.04.127. [25] K. Okura K. Miyazaki H. Muroyama T. Matsui K. Eguchi Ammonia decomposition over Ni catalysts supported on perovskite-type oxides for the on-site generation of hydrogen RSC Adv. 8 2018 32102 32110 10.1039/c8ra06100a K. Okura, K. Miyazaki, H. Muroyama, T. Matsui, K. Eguchi, Ammonia decomposition over Ni catalysts supported on perovskite-type oxides for the on-site generation of hydrogen, RSC Adv. 8 (2018) 32102–32110. 10.1039/c8ra06100a. [26] K. Okura T. Okanishi H. Muroyama T. Matsui K. Eguchi Additive effect of alkaline earth metals on ammonia decomposition reaction over Ni/Y2O3 catalysts RSC Adv. 6 2016 85142 85148 10.1039/c6ra19005g K. Okura, T. Okanishi, H. Muroyama, T. Matsui, K. Eguchi, Additive effect of alkaline earth metals on ammonia decomposition reaction over Ni/Y2O3 catalysts, RSC Adv. 6 (2016) 85142–85148. 10.1039/c6ra19005g. [27] K. Xu Y.Y. Zhang W.W. Wang M. Peng J.C. Liu C. Ma Y.W. Zhang C.J. Jia D. Ma C.H. Yan Single-atom barium promoter enormously enhanced non-noble metal catalyst for ammonia decomposition Angew. Chem. Int. Ed. 2024 10.1002/anie.202416195 K. Xu, Y.Y. Zhang, W.W. Wang, M. Peng, J.C. Liu, C. Ma, Y.W. Zhang, C.J. Jia, D. Ma, C.H. Yan, Single-atom barium promoter enormously enhanced non-noble metal catalyst for ammonia decomposition, Angew. Chem. Int. Ed. (2024). 10.1002/anie.202416195. [28] C. Wang X. Kang Y. Gu F. Gao An oxidation-adsorption site separation strategy for stabilizing Pd-Pt/SSZ-13 PNA materials under high CO pressure Chem. Eng. J. 503 2025 158299 10.1016/j.cej.2024.158299 C. Wang, X. Kang, Y. Gu, F. Gao, An oxidation-adsorption site separation strategy for stabilizing Pd-Pt/SSZ-13 PNA materials under high CO pressure, Chem. Eng. J. 503 (2025) 158299. 10.1016/j.cej.2024.158299. [29] Q.J. Shi C.W. Liu W.Q. Chen Hydrogen production from steam reforming of ethanol over Ni/MgO-CeO2 catalyst at low temperature J. Rare Earths 27 2009 948 954 10.1016/s1002-0721(08)60368-3 Q.J. Shi, C.W. Liu, W.Q. Chen, Hydrogen production from steam reforming of ethanol over Ni/MgO-CeO2 catalyst at low temperature, J. Rare Earths 27 (2009) 948–954. 10.1016/s1002-0721(08)60368-3. [30] L.L. Zhou X. Guo X. Hu Y. Zhang J. Cheng Q. Guo CO2 methanation reaction over La-modified NiAl catalysts derived from hydrotalcite-like precursors Fuel 362 2024 130888 10.1016/j.fuel.2024.130888 L.L. Zhou, X. Guo, X. Hu, Y. Zhang, J. Cheng, Q. Guo, CO2 methanation reaction over La-modified NiAl catalysts derived from hydrotalcite-like precursors, Fuel 362 (2024) 130888. 10.1016/j.fuel.2024.130888. [31] J. Ding Y. Li X. Zhang Z. Zhang Y. Zhang Y. Wang G. Yu Z. Wang X. Guo Y. Wang T. Yu Study on the homologous effects on the performance of alkali metal-doping MgO-based adsorbents for CO2 capture Sep. Purif. Technol. 355 2025 129673 10.1016/j.seppur.2024.129673 J. Ding, Y. Li, X. Zhang, Z. Zhang, Y. Zhang, Y. Wang, G. Yu, Z. Wang, X. Guo, Y. Wang, T. Yu, Study on the homologous effects on the performance of alkali metal-doping MgO-based adsorbents for CO2 capture, Sep. Purif. Technol. 355 (2025) 129673. 10.1016/j.seppur.2024.129673. [32] P.C. Zang J. Tang X. Zhang L. Cui J. Chen P. Zhao Y. Dong Strategies to improve CaO absorption cycle stability and progress of catalysts in Ca-based DFMs for integrated CO2 capture-conversion: a critical review J. Environ. Chem. Eng. 11 2023 111047 10.1016/j.jece.2023.111047 P.C. Zang, J. Tang, X. Zhang, L. Cui, J. Chen, P. Zhao, Y. Dong, Strategies to improve CaO absorption cycle stability and progress of catalysts in Ca-based DFMs for integrated CO2 capture-conversion: a critical review, J. Environ. Chem. Eng. 11 (2023) 111047. 10.1016/j.jece.2023.111047. [33] W. Yang K. Chang M. Yang X. Yan S. Yang Y. Liu G. Wang F. Xia H. Wang Q. Zhang Facilitating CO2 methanation over oxygen vacancy-rich Ni/CeO2: insights into the synergistic effect between oxygen vacancy and metal-support interaction Chem. Eng. J. 499 2024 156493 10.1016/j.cej.2024.156493 W. Yang, K. Chang, M. Yang, X. Yan, S. Yang, Y. Liu, G. Wang, F. Xia, H. Wang, Q. Zhang, Facilitating CO2 methanation over oxygen vacancy-rich Ni/CeO2: insights into the synergistic effect between oxygen vacancy and metal-support interaction, Chem. Eng. J. 499 (2024) 156493. 10.1016/j.cej.2024.156493. [34] K. Sato N. Abe T. Kawagoe S. Miyahara K. Honda K. Nagaoka Supported Ni catalysts prepared from hydrotalcite-like compounds for the production of hydrogen by ammonia decomposition Int. J. Hydrog. Energy 42 2017 6610 6617 10.1016/j.ijhydene.2016.11.150 K. Sato, N. Abe, T. Kawagoe, S. Miyahara, K. Honda, K. Nagaoka, Supported Ni catalysts prepared from hydrotalcite-like compounds for the production of hydrogen by ammonia decomposition, Int. J. Hydrog. Energy 42 (2017) 6610–6617. 10.1016/j.ijhydene.2016.11.150. [35] O.A. Al-attar S. Podila A.A. Al-Zahrani Preparation and study of XCeO3 (X: Mg, Ca, Sr, Ba) perovskite-type oxide supported cobalt catalyst for hydrogen production by ammonia decomposition Arab. J. Sci. Eng. 48 2023 8667 8677 10.1007/s13369-022-07255-w O.A. Al-attar, S. Podila, A.A. Al-Zahrani, Preparation and study of XCeO3 (X: Mg, Ca, Sr, Ba) perovskite-type oxide supported cobalt catalyst for hydrogen production by ammonia decomposition, Arab. J. Sci. Eng. 48 (2023) 8667–8677. 10.1007/s13369-022-07255-w. [36] C.Q. Chen X. Fan C. Zhou L. Lin Y. Luo C. Au G. Cai X. Wang L. Jiang Hydrogen production from ammonia decomposition over Ni/CeO2 catalyst: effect of CeO2 morphology J. Rare Earths 41 2023 1014 1021 10.1016/j.jre.2022.05.001 C.Q. Chen, X. Fan, C. Zhou, L. Lin, Y. Luo, C. Au, G. Cai, X. Wang, L. Jiang, Hydrogen production from ammonia decomposition over Ni/CeO2 catalyst: effect of CeO2 morphology, J. Rare Earths 41 (2023) 1014–1021. 10.1016/j.jre.2022.05.001. [37] Z.Q. Wang Z. Cai Z. Wei Highly active ruthenium catalyst supported on barium hexaaluminate for ammonia decomposition to COx-free hydrogen ACS Sustain. Chem. Eng. 7 2019 8226 8235 10.1021/acssuschemeng.8b06308 Z.Q. Wang, Z. Cai, Z. Wei, Highly active ruthenium catalyst supported on barium hexaaluminate for ammonia decomposition to COx-free hydrogen, ACS Sustain. Chem. Eng. 7 (2019) 8226–8235. 10.1021/acssuschemeng.8b06308. [38] S. Mukherjee S.V. Devaguptapu A. Sviripa C.R.F. Lund G. Wu Low-temperature ammonia decomposition catalysts for hydrogen generation Appl. Catal. B Environ. 226 2018 162 181 10.1016/j.apcatb.2017.12.039 S. Mukherjee, S.V. Devaguptapu, A. Sviripa, C.R.F. Lund, G. Wu, Low-temperature ammonia decomposition catalysts for hydrogen generation, Appl. Catal. B Environ. 226 (2018) 162–181. 10.1016/j.apcatb.2017.12.039. [39] Y. Im H. Muroyama T. Matsui K. Eguchi Ammonia decomposition over nickel catalysts supported on alkaline earth metal aluminate for H2 production Int. J. Hydrog. Energy 45 2020 26979 26988 10.1016/j.ijhydene.2020.07.014 Y. Im, H. Muroyama, T. Matsui, K. Eguchi, Ammonia decomposition over nickel catalysts supported on alkaline earth metal aluminate for H2 production, Int. J. Hydrog. Energy 45 (2020) 26979–26988. 10.1016/j.ijhydene.2020.07.014. [40] A. Nielsen J. Kjaer B. Hansen Rate equation and mechanism of ammonia synthesis at industrial conditions J. Catal. 3 1964 68 79 10.1016/0021-9517(64)90094-6 A. Nielsen, J. Kjaer, B. Hansen, Rate equation and mechanism of ammonia synthesis at industrial conditions, J. Catal. 3 (1964) 68–79. 10.1016/0021-9517(64)90094-6. [41] G. Ertl M. Huber Mechanism and kinetics of ammonia decomposition on iron J. Catal. 61 1980 537 539 10.1016/0021-9517(80)90403-0 G. Ertl, M. Huber, Mechanism and kinetics of ammonia decomposition on iron, J. Catal. 61 (1980) 537–539. 10.1016/0021-9517(80)90403-0. [42] C. Nie H.T. Zhang H.F. Ma W.X. Qian Q.W. Sun W.Y. Ying Effects of Ce addition on Fe-Cu catalyst for fischer-tropsch synthesis Catal. Lett. 149 2019 1375 1382 10.1007/s10562-019-02700-2 C. Nie, H.T. Zhang, H.F. Ma, W.X. Qian, Q.W. Sun, W.Y. Ying, Effects of Ce addition on Fe-Cu catalyst for fischer-tropsch synthesis, Catal. Lett. 149 (2019) 1375–1382. 10.1007/s10562-019-02700-2. [43] E.N. Al-Shafei M.Z. Albahar R. Albashrayi M. Aljishi A. Alasseel G. Tanimu A. Aitani The effect of acidic–basic structural modification of nickel-based catalyst for ammonia decomposition for hydrogen generation Mol. Catal. 550 2023 113581 10.1016/j.mcat.2023.113581 E.N. Al-Shafei, M.Z. Albahar, R. Albashrayi, M. Aljishi, A. Alasseel, G. Tanimu, A. Aitani, The effect of acidic–basic structural modification of nickel-based catalyst for ammonia decomposition for hydrogen generation, Mol. Catal. 550 (2023) 113581. 10.1016/j.mcat.2023.113581. [44] Z. Ni X. Djitcheu X. Gao J. Wang H. Liu Q. Zhang Effect of preparation methods of CeO2 on the properties and performance of Ni/CeO2 in CO2 reforming of CH4 Sci. Rep. 12 2022 5344 10.1038/s41598-022-09291-w Z. Ni, X. Djitcheu, X. Gao, J. Wang, H. Liu, Q. Zhang, Effect of preparation methods of CeO2 on the properties and performance of Ni/CeO2 in CO2 reforming of CH4, Sci. Rep. 12 (2022) 5344. 10.1038/s41598-022-09291-w.",
      "scopus-id": "86000757533",
      "coredata": {
        "eid": "1-s2.0-S2468823125002020",
        "dc:description": "Ni-based catalysts, as non-noble metal alternatives, are widely regarded for their potential in ammonia decomposition for hydrogen production. However, their performance at low temperatures is suboptimal, necessitating the addition of promoters and a clear understanding of their mechanisms to enhance catalytic activity. In this study, we have successfully improved the low-temperature ammonia decomposition performance of Ni/CeO2 by incorporating alkaline earth metals and conducted a comprehensive analysis of the underlying structural and electronic effects. The findings reveal that alkaline earth metals can enhance the basicity of the catalyst and increase electron density around the active metal sites, thereby facilitating the rate-determining step of recombination and desorption of N atom. Moreover, the presence of alkaline earth metals disrupts hydrogen adsorption stability on the catalysts, effectively mitigating the impact of hydrogen inhibition. Based on systematic kinetic experiments, a kinetic model was developed that accurately captures the hydrogen inhibition effect for Ni/CeO2 catalysts. The insights into the promotional mechanisms of alkaline earth metals offer theoretical guidance for the development of highly active and cost-effective catalysts for ammonia decomposition.",
        "openArchiveArticle": "false",
        "prism:coverDate": "2025-05-01",
        "openaccessUserLicense": null,
        "prism:aggregationType": "Journal",
        "prism:url": "https://api.elsevier.com/content/article/pii/S2468823125002020",
        "dc:creator": [
          {
            "@_fa": "true",
            "$": "Zhang, Zhen"
          },
          {
            "@_fa": "true",
            "$": "Yu, Minghui"
          },
          {
            "@_fa": "true",
            "$": "Shen, Meiqing"
          },
          {
            "@_fa": "true",
            "$": "Li, Wei"
          },
          {
            "@_fa": "true",
            "$": "Shen, Gurong"
          }
        ],
        "link": [
          {
            "@_fa": "true",
            "@rel": "self",
            "@href": "https://api.elsevier.com/content/article/pii/S2468823125002020"
          },
          {
            "@_fa": "true",
            "@rel": "scidir",
            "@href": "https://www.sciencedirect.com/science/article/pii/S2468823125002020"
          }
        ],
        "dc:format": "application/json",
        "openaccessType": null,
        "pii": "S2468-8231(25)00202-0",
        "prism:volume": "578",
        "articleNumber": "115016",
        "prism:publisher": "Published by Elsevier B.V.",
        "dc:title": "Promoting effect of alkaline earth metals on Ni/CeO2 catalysts for ammonia decomposition reaction",
        "prism:copyright": "© 2025 Published by Elsevier B.V.",
        "openaccess": "0",
        "prism:issn": "24688231",
        "dcterms:subject": [
          {
            "@_fa": "true",
            "$": "Ammonia decomposition"
          },
          {
            "@_fa": "true",
            "$": "Alkaline earth metal"
          },
          {
            "@_fa": "true",
            "$": "Hydrogen inhibition"
          },
          {
            "@_fa": "true",
            "$": "Kinetic model"
          }
        ],
        "openaccessArticle": "false",
        "prism:publicationName": "Molecular Catalysis",
        "openaccessSponsorType": null,
        "prism:pageRange": "115016",
        "pubType": "fla",
        "prism:coverDisplayDate": "1 May 2025",
        "prism:doi": "10.1016/j.mcat.2025.115016",
        "prism:startingPage": "115016",
        "dc:identifier": "doi:10.1016/j.mcat.2025.115016",
        "openaccessSponsorName": null
      },
      "objects": {
        "object": [
          {
            "@category": "standard",
            "@height": "458",
            "@width": "470",
            "@_fa": "true",
            "$": "https://api.elsevier.com/content/object/eid/1-s2.0-S2468823125002020-gr1.jpg?httpAccept=%2A%2F%2A",
            "@multimediatype": "JPEG image file",
            "@type": "IMAGE-DOWNSAMPLED",
            "@size": "59872",
            "@ref": "gr1",
            "@mimetype": "image/jpeg"
          },
          {
            "@category": "standard",
            "@height": "239",
            "@width": "565",
            "@_fa": "true",
            "$": "https://api.elsevier.com/content/object/eid/1-s2.0-S2468823125002020-gr2.jpg?httpAccept=%2A%2F%2A",
            "@multimediatype": "JPEG image file",
            "@type": "IMAGE-DOWNSAMPLED",
            "@size": "52397",
            "@ref": "gr2",
            "@mimetype": "image/jpeg"
          },
          {
            "@category": "standard",
            "@height": "200",
            "@width": "500",
            "@_fa": "true",
            "$": "https://api.elsevier.com/content/object/eid/1-s2.0-S2468823125002020-ga1.jpg?httpAccept=%2A%2F%2A",
            "@multimediatype": "JPEG image file",
            "@type": "IMAGE-DOWNSAMPLED",
            "@size": "31943",
            "@ref": "ga1",
            "@mimetype": "image/jpeg"
          },
          {
            "@category": "standard",
            "@height": "355",
            "@width": "470",
            "@_fa": "true",
            "$": "https://api.elsevier.com/content/object/eid/1-s2.0-S2468823125002020-gr5.jpg?httpAccept=%2A%2F%2A",
            "@multimediatype": "JPEG image file",
            "@type": "IMAGE-DOWNSAMPLED",
            "@size": "61686",
            "@ref": "gr5",
            "@mimetype": "image/jpeg"
          },
          {
            "@category": "standard",
            "@height": "237",
            "@width": "566",
            "@_fa": "true",
            "$": "https://api.elsevier.com/content/object/eid/1-s2.0-S2468823125002020-gr6.jpg?httpAccept=%2A%2F%2A",
            "@multimediatype": "JPEG image file",
            "@type": "IMAGE-DOWNSAMPLED",
            "@size": "46104",
            "@ref": "gr6",
            "@mimetype": "image/jpeg"
          },
          {
            "@category": "standard",
            "@height": "238",
            "@width": "566",
            "@_fa": "true",
            "$": "https://api.elsevier.com/content/object/eid/1-s2.0-S2468823125002020-gr3.jpg?httpAccept=%2A%2F%2A",
            "@multimediatype": "JPEG image file",
            "@type": "IMAGE-DOWNSAMPLED",
            "@size": "46838",
            "@ref": "gr3",
            "@mimetype": "image/jpeg"
          },
          {
            "@category": "standard",
            "@height": "243",
            "@width": "565",
            "@_fa": "true",
            "$": "https://api.elsevier.com/content/object/eid/1-s2.0-S2468823125002020-gr4.jpg?httpAccept=%2A%2F%2A",
            "@multimediatype": "JPEG image file",
            "@type": "IMAGE-DOWNSAMPLED",
            "@size": "48713",
            "@ref": "gr4",
            "@mimetype": "image/jpeg"
          },
          {
            "@category": "standard",
            "@height": "311",
            "@width": "378",
            "@_fa": "true",
            "$": "https://api.elsevier.com/content/object/eid/1-s2.0-S2468823125002020-gr9.jpg?httpAccept=%2A%2F%2A",
            "@multimediatype": "JPEG image file",
            "@type": "IMAGE-DOWNSAMPLED",
            "@size": "32702",
            "@ref": "gr9",
            "@mimetype": "image/jpeg"
          },
          {
            "@category": "standard",
            "@height": "347",
            "@width": "376",
            "@_fa": "true",
            "$": "https://api.elsevier.com/content/object/eid/1-s2.0-S2468823125002020-gr7.jpg?httpAccept=%2A%2F%2A",
            "@multimediatype": "JPEG image file",
            "@type": "IMAGE-DOWNSAMPLED",
            "@size": "45653",
            "@ref": "gr7",
            "@mimetype": "image/jpeg"
          },
          {
            "@category": "standard",
            "@height": "235",
            "@width": "565",
            "@_fa": "true",
            "$": "https://api.elsevier.com/content/object/eid/1-s2.0-S2468823125002020-gr8.jpg?httpAccept=%2A%2F%2A",
            "@multimediatype": "JPEG image file",
            "@type": "IMAGE-DOWNSAMPLED",
            "@size": "39066",
            "@ref": "gr8",
            "@mimetype": "image/jpeg"
          },
          {
            "@category": "thumbnail",
            "@height": "164",
            "@width": "168",
            "@_fa": "true",
            "$": "https://api.elsevier.com/content/object/eid/1-s2.0-S2468823125002020-gr1.sml?httpAccept=%2A%2F%2A",
            "@multimediatype": "GIF image file",
            "@type": "IMAGE-THUMBNAIL",
            "@size": "13133",
            "@ref": "gr1",
            "@mimetype": "image/gif"
          },
          {
            "@category": "thumbnail",
            "@height": "93",
            "@width": "219",
            "@_fa": "true",
            "$": "https://api.elsevier.com/content/object/eid/1-s2.0-S2468823125002020-gr2.sml?httpAccept=%2A%2F%2A",
            "@multimediatype": "GIF image file",
            "@type": "IMAGE-THUMBNAIL",
            "@size": "11657",
            "@ref": "gr2",
            "@mimetype": "image/gif"
          },
          {
            "@category": "thumbnail",
            "@height": "88",
            "@width": "219",
            "@_fa": "true",
            "$": "https://api.elsevier.com/content/object/eid/1-s2.0-S2468823125002020-ga1.sml?httpAccept=%2A%2F%2A",
            "@multimediatype": "GIF image file",
            "@type": "IMAGE-THUMBNAIL",
            "@size": "14342",
            "@ref": "ga1",
            "@mimetype": "image/gif"
          },
          {
            "@category": "thumbnail",
            "@height": "164",
            "@width": "217",
            "@_fa": "true",
            "$": "https://api.elsevier.com/content/object/eid/1-s2.0-S2468823125002020-gr5.sml?httpAccept=%2A%2F%2A",
            "@multimediatype": "GIF image file",
            "@type": "IMAGE-THUMBNAIL",
            "@size": "17085",
            "@ref": "gr5",
            "@mimetype": "image/gif"
          },
          {
            "@category": "thumbnail",
            "@height": "92",
            "@width": "219",
            "@_fa": "true",
            "$": "https://api.elsevier.com/content/object/eid/1-s2.0-S2468823125002020-gr6.sml?httpAccept=%2A%2F%2A",
            "@multimediatype": "GIF image file",
            "@type": "IMAGE-THUMBNAIL",
            "@size": "12420",
            "@ref": "gr6",
            "@mimetype": "image/gif"
          },
          {
            "@category": "thumbnail",
            "@height": "92",
            "@width": "219",
            "@_fa": "true",
            "$": "https://api.elsevier.com/content/object/eid/1-s2.0-S2468823125002020-gr3.sml?httpAccept=%2A%2F%2A",
            "@multimediatype": "GIF image file",
            "@type": "IMAGE-THUMBNAIL",
            "@size": "12989",
            "@ref": "gr3",
            "@mimetype": "image/gif"
          },
          {
            "@category": "thumbnail",
            "@height": "94",
            "@width": "219",
            "@_fa": "true",
            "$": "https://api.elsevier.com/content/object/eid/1-s2.0-S2468823125002020-gr4.sml?httpAccept=%2A%2F%2A",
            "@multimediatype": "GIF image file",
            "@type": "IMAGE-THUMBNAIL",
            "@size": "11646",
            "@ref": "gr4",
            "@mimetype": "image/gif"
          },
          {
            "@category": "thumbnail",
            "@height": "164",
            "@width": "199",
            "@_fa": "true",
            "$": "https://api.elsevier.com/content/object/eid/1-s2.0-S2468823125002020-gr9.sml?httpAccept=%2A%2F%2A",
            "@multimediatype": "GIF image file",
            "@type": "IMAGE-THUMBNAIL",
            "@size": "13209",
            "@ref": "gr9",
            "@mimetype": "image/gif"
          },
          {
            "@category": "thumbnail",
            "@height": "163",
            "@width": "177",
            "@_fa": "true",
            "$": "https://api.elsevier.com/content/object/eid/1-s2.0-S2468823125002020-gr7.sml?httpAccept=%2A%2F%2A",
            "@multimediatype": "GIF image file",
            "@type": "IMAGE-THUMBNAIL",
            "@size": "15415",
            "@ref": "gr7",
            "@mimetype": "image/gif"
          },
          {
            "@category": "thumbnail",
            "@height": "91",
            "@width": "219",
            "@_fa": "true",
            "$": "https://api.elsevier.com/content/object/eid/1-s2.0-S2468823125002020-gr8.sml?httpAccept=%2A%2F%2A",
            "@multimediatype": "GIF image file",
            "@type": "IMAGE-THUMBNAIL",
            "@size": "9087",
            "@ref": "gr8",
            "@mimetype": "image/gif"
          },
          {
            "@category": "high",
            "@height": "2031",
            "@width": "2083",
            "@_fa": "true",
            "$": "https://api.elsevier.com/content/object/eid/1-s2.0-S2468823125002020-gr1_lrg.jpg?httpAccept=%2A%2F%2A",
            "@multimediatype": "JPEG image file",
            "@type": "IMAGE-HIGH-RES",
            "@size": "509412",
            "@ref": "gr1",
            "@mimetype": "image/jpeg"
          },
          {
            "@category": "high",
            "@height": "1059",
            "@width": "2500",
            "@_fa": "true",
            "$": "https://api.elsevier.com/content/object/eid/1-s2.0-S2468823125002020-gr2_lrg.jpg?httpAccept=%2A%2F%2A",
            "@multimediatype": "JPEG image file",
            "@type": "IMAGE-HIGH-RES",
            "@size": "438853",
            "@ref": "gr2",
            "@mimetype": "image/jpeg"
          },
          {
            "@category": "high",
            "@height": "886",
            "@width": "2213",
            "@_fa": "true",
            "$": "https://api.elsevier.com/content/object/eid/1-s2.0-S2468823125002020-ga1_lrg.jpg?httpAccept=%2A%2F%2A",
            "@multimediatype": "JPEG image file",
            "@type": "IMAGE-HIGH-RES",
            "@size": "236376",
            "@ref": "ga1",
            "@mimetype": "image/jpeg"
          },
          {
            "@category": "high",
            "@height": "1574",
            "@width": "2083",
            "@_fa": "true",
            "$": "https://api.elsevier.com/content/object/eid/1-s2.0-S2468823125002020-gr5_lrg.jpg?httpAccept=%2A%2F%2A",
            "@multimediatype": "JPEG image file",
            "@type": "IMAGE-HIGH-RES",
            "@size": "519732",
            "@ref": "gr5",
            "@mimetype": "image/jpeg"
          },
          {
            "@category": "high",
            "@height": "1048",
            "@width": "2508",
            "@_fa": "true",
            "$": "https://api.elsevier.com/content/object/eid/1-s2.0-S2468823125002020-gr6_lrg.jpg?httpAccept=%2A%2F%2A",
            "@multimediatype": "JPEG image file",
            "@type": "IMAGE-HIGH-RES",
            "@size": "401174",
            "@ref": "gr6",
            "@mimetype": "image/jpeg"
          },
          {
            "@category": "high",
            "@height": "1054",
            "@width": "2508",
            "@_fa": "true",
            "$": "https://api.elsevier.com/content/object/eid/1-s2.0-S2468823125002020-gr3_lrg.jpg?httpAccept=%2A%2F%2A",
            "@multimediatype": "JPEG image file",
            "@type": "IMAGE-HIGH-RES",
            "@size": "403833",
            "@ref": "gr3",
            "@mimetype": "image/jpeg"
          },
          {
            "@category": "high",
            "@height": "1075",
            "@width": "2500",
            "@_fa": "true",
            "$": "https://api.elsevier.com/content/object/eid/1-s2.0-S2468823125002020-gr4_lrg.jpg?httpAccept=%2A%2F%2A",
            "@multimediatype": "JPEG image file",
            "@type": "IMAGE-HIGH-RES",
            "@size": "435684",
            "@ref": "gr4",
            "@mimetype": "image/jpeg"
          },
          {
            "@category": "high",
            "@height": "1379",
            "@width": "1675",
            "@_fa": "true",
            "$": "https://api.elsevier.com/content/object/eid/1-s2.0-S2468823125002020-gr9_lrg.jpg?httpAccept=%2A%2F%2A",
            "@multimediatype": "JPEG image file",
            "@type": "IMAGE-HIGH-RES",
            "@size": "273521",
            "@ref": "gr9",
            "@mimetype": "image/jpeg"
          },
          {
            "@category": "high",
            "@height": "1539",
            "@width": "1667",
            "@_fa": "true",
            "$": "https://api.elsevier.com/content/object/eid/1-s2.0-S2468823125002020-gr7_lrg.jpg?httpAccept=%2A%2F%2A",
            "@multimediatype": "JPEG image file",
            "@type": "IMAGE-HIGH-RES",
            "@size": "372483",
            "@ref": "gr7",
            "@mimetype": "image/jpeg"
          },
          {
            "@category": "high",
            "@height": "1039",
            "@width": "2500",
            "@_fa": "true",
            "$": "https://api.elsevier.com/content/object/eid/1-s2.0-S2468823125002020-gr8_lrg.jpg?httpAccept=%2A%2F%2A",
            "@multimediatype": "JPEG image file",
            "@type": "IMAGE-HIGH-RES",
            "@size": "340872",
            "@ref": "gr8",
            "@mimetype": "image/jpeg"
          },
          {
            "@category": "standard",
            "@_fa": "true",
            "$": "https://api.elsevier.com/content/object/eid/1-s2.0-S2468823125002020-mmc1.docx?httpAccept=%2A%2F%2A",
            "@multimediatype": "Microsoft Word file",
            "@type": "APPLICATION",
            "@size": "1455256",
            "@ref": "mmc1",
            "@mimetype": "application/word"
          },
          {
            "@category": "thumbnail",
            "@_fa": "true",
            "$": "https://api.elsevier.com/content/object/eid/1-s2.0-S2468823125002020-si1.svg?httpAccept=%2A%2F%2A",
            "@multimediatype": "Scalable Vector Graphics file",
            "@type": "ALTIMG",
            "@size": "3555",
            "@ref": "si1",
            "@mimetype": "image/svg+xml"
          },
          {
            "@category": "thumbnail",
            "@_fa": "true",
            "$": "https://api.elsevier.com/content/object/eid/1-s2.0-S2468823125002020-si2.svg?httpAccept=%2A%2F%2A",
            "@multimediatype": "Scalable Vector Graphics file",
            "@type": "ALTIMG",
            "@size": "10426",
            "@ref": "si2",
            "@mimetype": "image/svg+xml"
          },
          {
            "@category": "thumbnail",
            "@_fa": "true",
            "$": "https://api.elsevier.com/content/object/eid/1-s2.0-S2468823125002020-si3.svg?httpAccept=%2A%2F%2A",
            "@multimediatype": "Scalable Vector Graphics file",
            "@type": "ALTIMG",
            "@size": "16735",
            "@ref": "si3",
            "@mimetype": "image/svg+xml"
          },
          {
            "@category": "thumbnail",
            "@_fa": "true",
            "$": "https://api.elsevier.com/content/object/eid/1-s2.0-S2468823125002020-si4.svg?httpAccept=%2A%2F%2A",
            "@multimediatype": "Scalable Vector Graphics file",
            "@type": "ALTIMG",
            "@size": "28811",
            "@ref": "si4",
            "@mimetype": "image/svg+xml"
          },
          {
            "@category": "thumbnail",
            "@_fa": "true",
            "$": "https://api.elsevier.com/content/object/eid/1-s2.0-S2468823125002020-si5.svg?httpAccept=%2A%2F%2A",
            "@multimediatype": "Scalable Vector Graphics file",
            "@type": "ALTIMG",
            "@size": "7158",
            "@ref": "si5",
            "@mimetype": "image/svg+xml"
          },
          {
            "@category": "thumbnail",
            "@_fa": "true",
            "$": "https://api.elsevier.com/content/object/eid/1-s2.0-S2468823125002020-si6.svg?httpAccept=%2A%2F%2A",
            "@multimediatype": "Scalable Vector Graphics file",
            "@type": "ALTIMG",
            "@size": "9857",
            "@ref": "si6",
            "@mimetype": "image/svg+xml"
          },
          {
            "@category": "thumbnail",
            "@_fa": "true",
            "$": "https://api.elsevier.com/content/object/eid/1-s2.0-S2468823125002020-si7.svg?httpAccept=%2A%2F%2A",
            "@multimediatype": "Scalable Vector Graphics file",
            "@type": "ALTIMG",
            "@size": "12857",
            "@ref": "si7",
            "@mimetype": "image/svg+xml"
          },
          {
            "@category": "thumbnail",
            "@_fa": "true",
            "$": "https://api.elsevier.com/content/object/eid/1-s2.0-S2468823125002020-si8.svg?httpAccept=%2A%2F%2A",
            "@multimediatype": "Scalable Vector Graphics file",
            "@type": "ALTIMG",
            "@size": "21044",
            "@ref": "si8",
            "@mimetype": "image/svg+xml"
          }
        ]
      },
      "link": {
        "@rel": "abstract",
        "@href": "https://api.elsevier.com/content/abstract/scopus_id/86000757533"
      }
    }
  }
}