{
  "metadata": {
    "title": "Tetranuclear Zn complex covalently immobilized on sulfopropylsilylated mesoporous silica: An efficient catalyst for ring opening reaction of epoxide with amine",
    "authors": "; ; ",
    "journal": "Molecular Catalysis",
    "date": "2020-12-31",
    "doi": "10.1016/j.mcat.2020.111220",
    "abstract": "",
    "uri": "https://api.elsevier.com/content/article/pii/S2468823120304831",
    "pii": "S2468823120304831"
  },
  "fulltext": {
    "full-text-retrieval-response": {
      "scopus-eid": "2-s2.0-85091910347",
      "originalText": "serial JL 315758 291210 291744 291790 291809 31 Molecular Catalysis MOLECULARCATALYSIS 2020-10-01 2020-10-01 2020-10-01 2020-10-01 2020-10-26T15:55:19 1-s2.0-S2468823120304831 S2468-8231(20)30483-1 S2468823120304831 10.1016/j.mcat.2020.111220 S300 S300.1 FULL-TEXT 1-s2.0-S2468823120X00162 2020-10-29T07:13:43.258915Z 0 0 20201201 20201231 2020 2020-10-01T22:57:18.424624Z absattachment articleinfo articlenumber articletitlenorm authfirstinitialnorm authfirstsurnamenorm cid cids contenttype copyright crossmark dateloaded dateloadedtxt datesearch datesort dateupdated dco docsubtype doctype doi eid ewtransactionid hubeid indexeddate issn issnnorm itemstage itemtransactionid itemweight openaccess openarchive pg pgfirst pii piinorm pubdateend pubdatestart pubdatetxt pubyr sectiontitle sortorder srctitle srctitlenorm srctype ssids alllist content subj subheadings suppl tomb volfirst volissue volumelist webpdf webpdfpagecount yearnav figure table e-component body acknowledge affil appendices articletitle auth authfirstini authfull authkeywords authlast grantsponsor highlightsabst primabst ref specialabst 2468-8231 24688231 true 497 497 C Volume 497 22 111220 111220 111220 202012 December 2020 2020-12-01 2020-12-31 2020 Regular Papers article fla © 2020 Elsevier B.V. All rights reserved. TETRANUCLEARZNCOMPLEXCOVALENTLYIMMOBILIZEDSULFOPROPYLSILYLATEDMESOPOROUSSILICAEFFICIENTCATALYSTFORRINGOPENINGREACTIONEPOXIDEAMINE JADAV D Introduction Experimental Synthesis and preparation of sulfopropylsilylated MCM-48, MCM-41 and SBA-15 Synthetic procedure for the preparation of complex Zn complex incorporation to the mesoporous silica Characterization X-ray crystallography Catalytic reaction Results and discussion X-Ray crystal structure [Zn4(l)2(LH)2((CH3)2SO)2]·2CH3OH·(CH3)2SO·H2O (1) Structural Integrity studies by characterization Comparison of various catalysts on epoxide ring opening reaction Reaction optimization Heterogeneity of the catalyst Conclusion CRediT authorship contribution statement Declaration of Competing Interest Acknowledgements Appendix A Supplementary data References SHERINGTON 1998 220 228 D SUPPORTEDREAGENTSCATALYSTINCHEMISTRY SOAI 1990 4832 4835 K JOSEPH 2003 13 21 T JOSEPH 2005 241 247 T SANYAL 2014 85 96 R SHIVANI 2007 137 142 A SUSSFINK 1998 G CATALYSISBYDIPOLYNUCLEARMETALCLUSTERCOMPLEXES PUDDEPHATT 1999 R METALCLUSTERSINCHEMISTRY GUILLENA 2012 223 252 G ASYMMETRICORGANOCATALYZEDMORITABAYLISHILLMANREACTIONS MUNGSE 2012 5427 5433 H COLLIS 2011 912 919 A VERMA 2011 1897 1902 S PEREIRA 2011 784 793 C ALAUZUN 2007 911 915 J LUQUE 2012 253 280 R CATALYSIS LI 2007 547 558 C LIU 2012 1 7 B LI 2012 252 257 Z RIMOLDI 2013 11314 11316 M CANILHO 2013 139 145 N MASSAH 2013 12816 12825 A ERDEM 2013 1041 1049 B ALAVI 2013 16 28 S MA 2013 24 29 Z SHARMA 2006 972 977 S YANG 2014 12 17 X GELLIN 1988 1315 1320 P JACOBS 1983 439 453 P AUROUX 1979 2544 2555 A IWAMOTO 1983 3365 3366 M MANTOVANI 1978 285 291 E MAURYA 2011 6968 6983 M MAURYA 2007 192 201 M SYAMAL 1980 225 228 A SYAMAL 1981 205 208 A RATNASAMY 1996 1 3 C PARIHAR 2012 1152 1161 S JANA 2007 2492 2496 S ALESSANDRA 2011 64 69 M PIROUZMAND 2013 1864 1870 M PLUCINSKA 1997 861 864 K BOLLI 1998 2243 2246 M GHOSH 1999 2789 2795 A COREY 1999 1931 1934 E OBRIEN 1999 326 329 P AGER 1996 835 876 D FULLAM 2011 1185 1190 E HANSON 1991 437 475 R KAMAL 2007 1876 1880 A BHUYAN 2014 195 201 D MATOS 2012 24 30 I YADAV 2003 1047 1050 J IQBAL 1990 575 576 J ISHIDA 2006 441 443 S ROBINSON 2010 57 63 M DESHPANDE 2019 46 54 N PLACZEK 2005 9029 9034 A LU 2013 11174 11184 H BASKARAN 2016 50 55 T XU 2019 1 8 L ROY 2015 2689 2697 S NAGARJUN 2020 110628 N CANOSERRANO 2003 7621 7627 E SIRIL 2007 72 78 P BANDYOPADHYAY 2017 1040 1050 M BANDYOPADHYAY 2019 167 179 M SHUKLA 2020 823 832 P NIWA 1997 215 226 M 2003 SMARTSAINTSOFTWAREREFERENCEMANUALSVERSION645BRUKERANALYTICALXRAYSYSTEMS SHELDRICK 2002 G SADABSASOFTWAREFOREMPIRICALABSORPTIONCORRECTIONVER205 2000 SHELXTLREFERENCEMANUALVER61BRUKERANALYTICALXRAYSYSTEMS SHELDRICK 2008 112 122 G DOLOMANOV 2009 339 341 O BRADENBURG 2005 K DIAMONDVER31EMCRYSTALIMPACTGBR SPEK 1990 c34 A BAIN 2008 532 536 G ADDISON 1984 1349 1356 A PATEL 2019 198 212 S GHOSH 2017 e1700176 S MARLER 1996 375 383 B ZHU 2014 31 37 Q ALAVI 2013 16 28 S SUJANDI 2009 134 142 E WANG 2008 5014 5022 J NASAB 2015 75491 75499 M PINTO 2016 9 20 V LI 2009 79 85 Y DAS 2018 132 141 T SHIVANI 2007 3713 3722 B BOUDART 1995 661 666 M KOTWAL 2013 65 73 M JADAVX2020X111220 JADAVX2020X111220XD 2022-10-01T00:00:00.000Z 2022-10-01T00:00:00.000Z http://creativecommons.org/licenses/by-nc-nd/4.0/ © 2020 Elsevier B.V. All rights reserved. 2020-10-07T22:27:19.058Z http://vtw.elsevier.com/data/voc/AddOnTypes/50.7/nlp S2468823120304831 Divya Jadav and Pooja Shukla are thankful to IITRAM for providing financial support and infrastructural facilities. We would like to acknowledge IIT Gandhinagar for SEM-EDX analysis, and Mr. Kengo Takama of Yokohama National University for his technical assistance. item S2468-8231(20)30483-1 S2468823120304831 1-s2.0-S2468823120304831 10.1016/j.mcat.2020.111220 315758 2020-10-29T07:13:43.258915Z 2020-12-01 2020-12-31 1-s2.0-S2468823120304831-main.pdf https://s3-eu-west-1.amazonaws.com/prod-ucs-content-store-eu-west/content/pii:S2468823120304831/MAIN/application/pdf/6334b273e586abb5fc5e4597a678e4b8/main.pdf main.pdf pdf true 4741163 MAIN 12 1-s2.0-S2468823120304831-main_1.png https://s3-eu-west-1.amazonaws.com/prod-ucs-content-store-eu-west/content/pii:S2468823120304831/PREVIEW/image/png/f2ddd9ccfe6e958dc29b6dc2c17699ca/main_1.png main_1.png png 55235 849 656 IMAGE-WEB-PDF 1 1-s2.0-S2468823120304831-ga1.jpg https://s3-eu-west-1.amazonaws.com/prod-ucs-content-store-eu-west/content/pii:S2468823120304831/ga1/DOWNSAMPLED/image/jpeg/f5e5b995ec0960decfe1fed5679b90e7/ga1.jpg ga1 true ga1.jpg jpg 14684 200 374 IMAGE-DOWNSAMPLED 1-s2.0-S2468823120304831-gr10.jpg https://s3-eu-west-1.amazonaws.com/prod-ucs-content-store-eu-west/content/pii:S2468823120304831/gr10/DOWNSAMPLED/image/jpeg/384804fb515f114ec9c139ba851633f9/gr10.jpg gr10 gr10.jpg jpg 23239 209 567 IMAGE-DOWNSAMPLED 1-s2.0-S2468823120304831-gr9.jpg https://s3-eu-west-1.amazonaws.com/prod-ucs-content-store-eu-west/content/pii:S2468823120304831/gr9/DOWNSAMPLED/image/jpeg/0c64f9a0ab2b2eefd1e4a67c2abdc984/gr9.jpg gr9 gr9.jpg jpg 18092 254 341 IMAGE-DOWNSAMPLED 1-s2.0-S2468823120304831-gr7.jpg https://s3-eu-west-1.amazonaws.com/prod-ucs-content-store-eu-west/content/pii:S2468823120304831/gr7/DOWNSAMPLED/image/jpeg/1922ed6a6aef126f1c0ade63f91c92c4/gr7.jpg gr7 gr7.jpg jpg 19566 257 341 IMAGE-DOWNSAMPLED 1-s2.0-S2468823120304831-gr8.jpg https://s3-eu-west-1.amazonaws.com/prod-ucs-content-store-eu-west/content/pii:S2468823120304831/gr8/DOWNSAMPLED/image/jpeg/722866582591573de3776da6b893c661/gr8.jpg gr8 gr8.jpg jpg 18506 255 341 IMAGE-DOWNSAMPLED 1-s2.0-S2468823120304831-gr5.jpg https://s3-eu-west-1.amazonaws.com/prod-ucs-content-store-eu-west/content/pii:S2468823120304831/gr5/DOWNSAMPLED/image/jpeg/531390b2f1f105551de2c60ab61f22ab/gr5.jpg gr5 gr5.jpg jpg 34349 213 567 IMAGE-DOWNSAMPLED 1-s2.0-S2468823120304831-gr6.jpg https://s3-eu-west-1.amazonaws.com/prod-ucs-content-store-eu-west/content/pii:S2468823120304831/gr6/DOWNSAMPLED/image/jpeg/052f0548fc9baf8d71d4f3a1d5bbbeb6/gr6.jpg gr6 gr6.jpg jpg 14740 189 341 IMAGE-DOWNSAMPLED 1-s2.0-S2468823120304831-gr3.jpg https://s3-eu-west-1.amazonaws.com/prod-ucs-content-store-eu-west/content/pii:S2468823120304831/gr3/DOWNSAMPLED/image/jpeg/b904a439be112fa5e525865ab1b0dc18/gr3.jpg gr3 gr3.jpg jpg 57207 389 718 IMAGE-DOWNSAMPLED 1-s2.0-S2468823120304831-gr4.jpg https://s3-eu-west-1.amazonaws.com/prod-ucs-content-store-eu-west/content/pii:S2468823120304831/gr4/DOWNSAMPLED/image/jpeg/2e42b67a56feb190ce6190d684f9cec7/gr4.jpg gr4 gr4.jpg jpg 29885 260 567 IMAGE-DOWNSAMPLED 1-s2.0-S2468823120304831-gr1.jpg https://s3-eu-west-1.amazonaws.com/prod-ucs-content-store-eu-west/content/pii:S2468823120304831/gr1/DOWNSAMPLED/image/jpeg/69882407cc5556baa52f3a805dc79d66/gr1.jpg gr1 gr1.jpg jpg 43024 373 567 IMAGE-DOWNSAMPLED 1-s2.0-S2468823120304831-gr2.jpg https://s3-eu-west-1.amazonaws.com/prod-ucs-content-store-eu-west/content/pii:S2468823120304831/gr2/DOWNSAMPLED/image/jpeg/efa8537eac6267cd2a1e5f1fa4dff4e5/gr2.jpg gr2 gr2.jpg jpg 27298 186 680 IMAGE-DOWNSAMPLED 1-s2.0-S2468823120304831-sc4.jpg https://s3-eu-west-1.amazonaws.com/prod-ucs-content-store-eu-west/content/pii:S2468823120304831/sc4/DOWNSAMPLED/image/jpeg/b20605585b0ba4be3312b0df6a0ae4dc/sc4.jpg sc4 sc4.jpg jpg 13113 202 341 IMAGE-DOWNSAMPLED 1-s2.0-S2468823120304831-sc5.jpg https://s3-eu-west-1.amazonaws.com/prod-ucs-content-store-eu-west/content/pii:S2468823120304831/sc5/DOWNSAMPLED/image/jpeg/bbabdb2851a2c0df77714b053e321d43/sc5.jpg sc5 sc5.jpg jpg 52676 981 496 IMAGE-DOWNSAMPLED 1-s2.0-S2468823120304831-sc2.jpg https://s3-eu-west-1.amazonaws.com/prod-ucs-content-store-eu-west/content/pii:S2468823120304831/sc2/DOWNSAMPLED/image/jpeg/d23e763244e65c4f7a0c10a54d19ec36/sc2.jpg sc2 sc2.jpg jpg 23466 232 567 IMAGE-DOWNSAMPLED 1-s2.0-S2468823120304831-sc3.jpg https://s3-eu-west-1.amazonaws.com/prod-ucs-content-store-eu-west/content/pii:S2468823120304831/sc3/DOWNSAMPLED/image/jpeg/4e1123f57851dedfb034917ac849857c/sc3.jpg sc3 sc3.jpg jpg 35521 291 567 IMAGE-DOWNSAMPLED 1-s2.0-S2468823120304831-sc1.jpg https://s3-eu-west-1.amazonaws.com/prod-ucs-content-store-eu-west/content/pii:S2468823120304831/sc1/DOWNSAMPLED/image/jpeg/082cdbbba24b68bbade08ed6f89d2677/sc1.jpg sc1 sc1.jpg jpg 16728 201 567 IMAGE-DOWNSAMPLED 1-s2.0-S2468823120304831-ga1.sml https://s3-eu-west-1.amazonaws.com/prod-ucs-content-store-eu-west/content/pii:S2468823120304831/ga1/THUMBNAIL/image/gif/50fbc7dd60e456f351ae74371184a112/ga1.sml ga1 true ga1.sml sml 5551 117 219 IMAGE-THUMBNAIL 1-s2.0-S2468823120304831-gr10.sml https://s3-eu-west-1.amazonaws.com/prod-ucs-content-store-eu-west/content/pii:S2468823120304831/gr10/THUMBNAIL/image/gif/9ece5b58b2894605ed2c348c8246173e/gr10.sml gr10 gr10.sml sml 4709 81 219 IMAGE-THUMBNAIL 1-s2.0-S2468823120304831-gr9.sml https://s3-eu-west-1.amazonaws.com/prod-ucs-content-store-eu-west/content/pii:S2468823120304831/gr9/THUMBNAIL/image/gif/cae1b3de92bf5ce6235cb1be3f6f7a11/gr9.sml gr9 gr9.sml sml 6482 163 219 IMAGE-THUMBNAIL 1-s2.0-S2468823120304831-gr7.sml https://s3-eu-west-1.amazonaws.com/prod-ucs-content-store-eu-west/content/pii:S2468823120304831/gr7/THUMBNAIL/image/gif/e6f8ab94296ee4b44713ecbdbec2ef59/gr7.sml gr7 gr7.sml sml 7406 164 217 IMAGE-THUMBNAIL 1-s2.0-S2468823120304831-gr8.sml https://s3-eu-west-1.amazonaws.com/prod-ucs-content-store-eu-west/content/pii:S2468823120304831/gr8/THUMBNAIL/image/gif/0c0a96a86911bc6d36b782d949bbe969/gr8.sml gr8 gr8.sml sml 6800 164 219 IMAGE-THUMBNAIL 1-s2.0-S2468823120304831-gr5.sml https://s3-eu-west-1.amazonaws.com/prod-ucs-content-store-eu-west/content/pii:S2468823120304831/gr5/THUMBNAIL/image/gif/6314121aab8cbcd5472da8490b93c764/gr5.sml gr5 gr5.sml sml 5897 82 219 IMAGE-THUMBNAIL 1-s2.0-S2468823120304831-gr6.sml https://s3-eu-west-1.amazonaws.com/prod-ucs-content-store-eu-west/content/pii:S2468823120304831/gr6/THUMBNAIL/image/gif/2121f8a677a125efe86946abbf774bf6/gr6.sml gr6 gr6.sml sml 6021 122 219 IMAGE-THUMBNAIL 1-s2.0-S2468823120304831-gr3.sml https://s3-eu-west-1.amazonaws.com/prod-ucs-content-store-eu-west/content/pii:S2468823120304831/gr3/THUMBNAIL/image/gif/a46947001d33013bdf8665d35e86d046/gr3.sml gr3 gr3.sml sml 6845 119 219 IMAGE-THUMBNAIL 1-s2.0-S2468823120304831-gr4.sml https://s3-eu-west-1.amazonaws.com/prod-ucs-content-store-eu-west/content/pii:S2468823120304831/gr4/THUMBNAIL/image/gif/1b94e0409c6289a3847996a9e1e2fc80/gr4.sml gr4 gr4.sml sml 9446 100 219 IMAGE-THUMBNAIL 1-s2.0-S2468823120304831-gr1.sml https://s3-eu-west-1.amazonaws.com/prod-ucs-content-store-eu-west/content/pii:S2468823120304831/gr1/THUMBNAIL/image/gif/6e5da182f4c1a6e6db3be8c9f7ad6306/gr1.sml gr1 gr1.sml sml 9580 144 219 IMAGE-THUMBNAIL 1-s2.0-S2468823120304831-gr2.sml https://s3-eu-west-1.amazonaws.com/prod-ucs-content-store-eu-west/content/pii:S2468823120304831/gr2/THUMBNAIL/image/gif/5a3af83a86fa88a6a6fe68ed909bbc8a/gr2.sml gr2 gr2.sml sml 4326 60 219 IMAGE-THUMBNAIL 1-s2.0-S2468823120304831-sc4.sml https://s3-eu-west-1.amazonaws.com/prod-ucs-content-store-eu-west/content/pii:S2468823120304831/sc4/THUMBNAIL/image/gif/6b60af3edfdc91074a374aadc8c4aaaa/sc4.sml sc4 sc4.sml sml 4567 130 219 IMAGE-THUMBNAIL 1-s2.0-S2468823120304831-sc5.sml https://s3-eu-west-1.amazonaws.com/prod-ucs-content-store-eu-west/content/pii:S2468823120304831/sc5/THUMBNAIL/image/gif/bde7332e46e337356851d4c1ff4a03d4/sc5.sml sc5 sc5.sml sml 3135 164 83 IMAGE-THUMBNAIL 1-s2.0-S2468823120304831-sc2.sml https://s3-eu-west-1.amazonaws.com/prod-ucs-content-store-eu-west/content/pii:S2468823120304831/sc2/THUMBNAIL/image/gif/0e046c97547ffb658798b3a1fd116650/sc2.sml sc2 sc2.sml sml 4346 90 219 IMAGE-THUMBNAIL 1-s2.0-S2468823120304831-sc3.sml https://s3-eu-west-1.amazonaws.com/prod-ucs-content-store-eu-west/content/pii:S2468823120304831/sc3/THUMBNAIL/image/gif/6702ce6a9ea2efeb67a1cab459f79be8/sc3.sml sc3 sc3.sml sml 6750 112 219 IMAGE-THUMBNAIL 1-s2.0-S2468823120304831-sc1.sml https://s3-eu-west-1.amazonaws.com/prod-ucs-content-store-eu-west/content/pii:S2468823120304831/sc1/THUMBNAIL/image/gif/b85f28b5f4ccb2ca7a90ee75354816e2/sc1.sml sc1 sc1.sml sml 3011 78 219 IMAGE-THUMBNAIL 1-s2.0-S2468823120304831-mmc1.docx https://s3-eu-west-1.amazonaws.com/prod-ucs-content-store-eu-west/content/pii:S2468823120304831/mmc1/MAIN/application/vnd.openxmlformats-officedocument.wordprocessingml.document/1c6e36f6d642045db1cba236dc375f5e/mmc1.docx mmc1 mmc1.docx docx 542702 APPLICATION 1-s2.0-S2468823120304831-am.pdf am am.pdf pdf 2011747 AAM-PDF https://s3-eu-west-1.amazonaws.com/prod-ucs-content-store-eu-west/content/egi:10NNMJ7FZQ3/MAIN/application/pdf/7a6733e1bfae6f76f8d4a15b45ff836a/am.pdf MCAT 111220 111220 S2468-8231(20)30483-1 10.1016/j.mcat.2020.111220 Elsevier B.V. Scheme 1 Ring opening reaction of propylene oxide with morpholine. Scheme 1 Scheme 2 Synthesis of the homometallic Zn4 complex (1). Scheme 2 Scheme 3 Preparation of Zn complex incorporated sulfopropylsilylated mesoporous silica. Scheme 3 Scheme 4 Two different binding mode of ligands [LH]2− for Zn(II) ions. Scheme 4 Scheme 5 A. A plausible mechanism of ring opening reaction of propylene oxide with moprholine via SN2 route using Zn complex incorporated mesoporous silica as a catalyst [84]. B. Scheme 5 Fig. 1 (a). Molecular structure of complex 1 (Hydrogen atoms except those of protonated ligand are omitted for clarity). (b) Coordination framework of 1 displaying open half cubane like structure. Selected bond distance (Å) and bond angle (o) parameters: Zn(1) - O(2) = 2.015(5), Zn(1)- O(1) = 2.009(5), Zn(1)- O(4) = 2.037(5), Zn(1)- N(1) = 2.056(7), Zn(1) - O(14) = 2.053(6), Zn(2) – N(3) = 2.023(6), Zn(2) – O(4) = 2.244(5), Zn(2) – O(7) = 1.994(6), Zn(2) – O(8) = 2.259(5),), Zn(2) – O(2) = 2.089(5), Zn(2) – O(3) = 2.101(6), Zn(3) – O(4) = 2.259(5), Zn(3) – O(8) = 2.222(5), Zn(3) – O(11) = 2.082(5), Zn(3) – O(5) = 2.010(6), Zn(3) – O(12) = 2.112(5), Zn(3) – N(2) = 2.031(6), Zn(4) – O(10) = 2.013(5), Zn(4) – N(4) = 2.058(7), Zn(4) – O(13) = 2.052(6), Zn(4)-O(11) = 2.017(5), Zn(4) – O(8) = 2.047(5). Zn(1) – O(4) – Zn(2) = 95.1(2), Zn(1) –O(2) – Zn(2) = 100.8(2), Zn(1) – O(4) – Zn(3) = 111.2(2), Zn(2) – O(4) – Zn(3) = 100.5(2), Zn(3) – O(8) – Zn(2) = 101.18(19), Zn(4) – O(8) – Zn(2) = 110.9(2), Zn(4) – O(8) – Zn(3) = 95.8(2), Zn(4) – O(11) – Zn(3) = 101.2(2). Fig. 1 Fig. 2 Powder XRD patterns of (a) calcined, (b) sulfopropylsilylated, (c) Zn complex incorporated materials, (d) high angle XRD pattern of Zn complex incorporated materials and (e) pure Zn complex: (A) MCM-48, (B) MCM-41 and (C) SBA-15. Fig. 2 Fig. 3 N2 adsorption/desorption isotherm of (a) sulfonic acid functionalized, (b) Zn complex incorporated (A1) MCM-48, (B1) MCM-41 and (C1) SBA-15 materials. Pore size distribution curve of (a) sulfonic acid functionalized (b) Zn complex incorporated (A2) MCM-48, (B2) MCM-41 and (C2) SBA-15 materials. Fig. 3 Fig. 4 (A) FE-SEM image and (B) EDX analysis of M-48-S-Zn material. Fig. 4 Fig. 5 (A) FT-IR spectra of (a) M-48-S-Zn, (b) M-41-S-Zn, (c) S-15-S-Zn and (d) pure Zn complex. (B) NH3-TPD profile of (a) M-48-S-Zn, (b) M-41-S-Zn and (c) S-15-S-Zn. Fig. 5 Fig. 6 Comparison of various catalysts in epoxide ring opening reaction. Reaction conditions: temperature, 70 °C; catalyst, 20 mg; time, 6 h; propylene oxide, 10 mmol; morpholine, 10 mmol. Fig. 6 Fig. 7 Conversion of morpholine using different catalyst amount. Reaction conditions: temperature, 70 °C; time, 6 h; propylene oxide, 10 mmol; morpholine, 10 mmol. Fig. 7 Fig. 8 Conversion of morpholine for different reaction time. Reaction conditions: temperature, 70 °C; catalyst, 20 mg; propylene oxide, 10 mmol; morpholine, 10 mmol. Fig. 8 Fig. 9 Conversion of morpholine at different reaction temperatures. Reaction conditions: catalyst, 20 mg; time, 6 h; propylene oxide, 10 mmol; morpholine, 10 mmol. Fig. 9 Fig. 10 (A) Heterogeneity test and (B) Recycle test of M-48-S-Zn catalyst. Reaction conditions: temperature, 70 °C; catalyst, 20 mg; time, 6 h; propylene oxide, 10 mmol; morpholine, 10 mmol. Fig. 10 Table 1 Characteristics of various unmodified and modified mesoporous materials Table 1 Catalyst Surface area[a] (m2/g) Pore volume[b] (cc/g) Pore diameter[b] (nm) Si/Zn ratio[c] Acid concentration (mmol/g)[d] MCM-48 1351 1.1 2.3 – – MCM-48-SO3H 590 0.44 2.1 – 0.61 MCM-48-SO3H-Zn 515 0.43 1.7 18.3 0.824 MCM-41 1088 0.99 2.5 – – MCM-41-SO3H 850 0.62 2.3 – 0.3 MCM-41-SO3H-Zn 715 0.51 2.0 10.6 0.373 SBA-15 852 0.96 6.4 – – SBA-15-SO3H 661 0.85 6.2 – 0.33 SBA-15-SO3H-Zn 512 0.77 6 17.6 0.33 [a]determined by the BET method, [b]determined by the BJH method, [c]from ICP-OES analysis, and [d]calculated from NH3-TPD measurement. Table 2 TOF, acidity and morpholine conversion with different catalyst amount. Table 2 Catalyst Catalyst amount (mg) Morpholine conversion (%) Acid concentrationa (mmol/g) TOF (h−1) M-48-S-Zn 5 65 0.824 263 10 84 170 20 95 96 M-41-S-Zn 5 58 0.373 519 10 77 344 20 86 192 S-15-S-Zn 5 52 0.330 525 10 64 323 20 78 197 aCalculated from NH3-TPD measurements. Tetranuclear Zn complex covalently immobilized on sulfopropylsilylated mesoporous silica: An efficient catalyst for ring opening reaction of epoxide with amine Divya Jadav a Pooja Shukla a Rajib Bandyopadhyay b Yoshihiro Kubota c Sourav Das a * Mahuya Bandyopadhyay a * a Institute of Infrastructure, Technology, Research and Management, IITRAM, Maninagar, Ahmedabad, Gujarat, India Institute of Infrastructure, Technology, Research and Management IITRAM Maninagar Ahmedabad Gujarat India b School of Technology, Pandit Deendayal Petroleum University, Raisan, Gandhinagar, Gujarat, India School of Technology Pandit Deendayal Petroleum University Raisan Gandhinagar Gujarat India c Department of Material Science & Chemical Engineering, Yokohama National University, Yokohama, Japan Department of Material Science & Chemical Engineering Yokohama National University Yokohama Japan ⁎ Corresponding authors. Graphical abstract Tetranuclear Zn complex, [Zn4(L)2(LH)2((CH3)2SO)2]·2CH3OH·(CH3)2SO·H2O (1) [where LH3 = 3-(E)-(2-hydroxyphenylimino)methyl-4-hydroxy-5-hydroxymethylphenyl (LH3)] was prepared and characterized by single-crystal X-ray analysis. Then, it was incorporated to the sulfopropylsilylated MCM-48, MCM-41 and SBA-15 mesoporous silica materials. The prepared materials were thoroughly characterized by XRD, FT-IR, N2 adsorption/desorption analysis, NH3-TPD, TGA, SEM-EDX and ICP-OES measurements. These catalysts were successfully used for the ring opening reaction of propylene oxide with morpholine producing the corresponding β-aminoalcohols. An abrupt increase in catalytic activities was observed after anchoring of the tetranuclear Zn complex onto the inner surface of sulfopropylsilylated mesoporous materials. Among all the catalysts, the tetranuclear Zn complex incorporated MCM-48 was found to be most active in this reaction system and gave maximum 95% conversion. Catalysis by the tetranuclear Zn complex immobilized on MCM-48 was totally heterogeneous and the catalyst was recyclable up to 4 times without leaching. Keywords Tetranuclear Zn complex Mesoporous silica Ring opening reaction β-Aminoalcohols Introduction Transition metal complexes are quite popular in the oxidation/reduction of organic substrates and for the synthesis of fine chemicals, but some disadvantages related to their use, such as difficult recovery from the reaction mixture, low stability, high cost, limits their use, especially from an industrial point of view. Their immobilisation on solid supports leads to an important class of organic inorganic hybrid materials with certain added advantages like selectivity, easy separation from the reaction mixture and recycle capability [1–4]. These immobilized materials can be utilized to develop new environment friendly technologies. Influence of zinc complexes arises from its excellent Lewis acidity, rapid ligand exchange, being non-toxic and non-redox active making it most obvious choice in catalytic studies. In order to deeply understand these traits, one should understand and appreciate how the chemistry of Zn2+ is influenced by its coordination sphere. Reported metal ion systems in most cases have Schiff- based ligands that are tridentate or tetradentate in nature providing necessary free coordination sites. It facilitates the formation of such complex which efficiently allows us to study the role of multidentate ligands, geometry, labile groups as well as its efficacy in the catalytic activity of the desired systems [5]. In case of epoxide ring opening reaction, zinc complexes are effective in inducing ‘electrophilic activation’ of the epoxide ring. Besides, the strong electrophilicity of the Zn2+ ion delocalized the negative charge of the oxygen atom in the transition state of the epoxide ring opening reaction and assisted the progress of the reversible reaction in the forward direction. Basically, Zn2+ containing metal complexes due their flexibility in coordination sites can play a delicate role in counterbalance between Lewis acid and electrostatic activation of the substrate [6]. Sometimes, substrate can be cooperatively activated by dual metal components present in the polynuclear metal complexes [7,8]. Till now, a wide varieties of hybrid solid supports have been used, namely “bulk’’ supports including mesoporous silicas, carbon materials, clay based materials and metal–organic frameworks or “nano-supports’’ like nano-silicas, carbon nano-tubes, magnetic iron oxide nano-particles, etc. [9]. The promising properties of high surface area, narrow pore size distribution and flexible pore diameters (>2 nm) of ordered mesoporous materials have attracted enough consideration for their potential applications in adsorption, separation, tailored delivery devices for bio-applications, chemical sensing and catalysis. In acid catalyzed reactions like alkylation, acylation, esterification, biodiesel production to redox reaction such as oxidation of alcohols, alkenes, sulfides and hydrogenation of acids, aldehydes and ketones and alkenes/alkynes also including asymmetric applications, such materials have been extensively used [10–19]. The combination of Schiff based complexes with functionalized porous materials can be a promising approach towards the industrially important catalytic reactions. S. Sharma et al. [20] synthesized high order of dioxygen binding to the immobilized CoII complexes in porous materials (90% for P-1. py[CoII]) and used them as heterogeneous oxidation catalysts for substituted phenol. There are reports on aminopropyl-functionalized SBA-15, as a support for anchoring tri(8-quinolinolato) iron complexes [21] and mono- and polynuclear carbonyl compounds of Rh, Ir, encapsulated and different oxovanadium and other metal complexes in the super cages of Y zeolites [22–28]. As reported, oxovanadium(IV) and copper(II) complexes are more stable as dimmer [29–32]; the zeolitic pore allows them to exist as stable monomeric active center by preventing dimerization. There are also other reports on synthesis and catalytic properties of Cu (II) complex modified MCM-41 material in variety of chemical conversions [33–35]. Epoxides are significant class of synthons which has profound use in synthetic organic chemistry [36–38]. Epoxide ring opening reactions lead to the formation of industrially important multipurpose products. The presence of nucleophiles, such as amines, ammonia, alcohols, phenols, water, thiols, etc. is required for this reaction to attack the substrate. Ring opening of epoxide by amine yields β-amino alcohols (Scheme 1 ) which are industrially important for the production of biologically active natural/unnatural materials and also can be used as a chiral ligand in asymmetric synthesis [39–42]. β-amino alcohols can also be used as a potential inhibitor of the anti-tubercular target N-acetyltransferase [43]. Traditionally the epoxide ring opening reactions are carried out at elevated temperature, however, at higher temperature the formation of unwanted side reactions [44] cannot be avoided. In most of the cases, weak nucleophile reacts slowly and yields low regioselective products. Some reported studies demonstrate the use of excess amount of sulfamic acid, modified montmorillonite clay, mesoporous carbon, ionic liquid, cobalt(II) chloride, polymeric rare earth complexes, nanoporous aluminosilicate and Lewis acid as a catalyst in epoxide ring opening reaction performed at elevated temperature, high pressure and long reaction time [45–52]. Henceforth, developing a method which will work at mild condition is always an effort for the scientific fraternity. Researchers are already working in this area to achieve higher yield at mild and solvent free reaction system [53–57]. Inspired by the versatile application of metal complex incorporated porous silica materials as a catalyst in different industrially important chemical reactions, we have prepared new tetranuclear open-cubane shaped Zn complex and it was anchored to the sulfopropylsilylated mesoporous silica supports (MCM-48, MCM-41 and SBA-15). Owing to high surface area which offers effective number of active sites than non-crystalline amorphous silica [58,59], mesoporous crystalline materials are preferred as a support for functionalization. The prepared materials were thoroughly characterized using different physicochemical characterization techniques to have a clear image of the successful anchoring of Zn complex in mesoporous silica support. In our present work, we have synthesized and used tetranuclear Zn-complex to incorporate in sulfonic acid functionalized mesoporous silica and explored their catalytic activities in epoxide ring opening reaction. Experimental Synthesis and preparation of sulfopropylsilylated MCM-48, MCM-41 and SBA-15 Mesoporous MCM-48, MCM-41 and SBA-15 materials were synthesized as per the conditions mentioned in the literature [60]. MCM-48, MCM-41 and SBA-15 materials were synthesized using molar gel composition of 1.0 TEOS:0.7 CTACl:0.5 NaOH:64 H2O, 1.0 TEOS:0.12 CTABr:0.23 NaOH:130 H2O and 1.0 TEOS:0.017 Pluronic123:6.1 HCl:165 H2O respectively. The as-made materials were calcined at 550 °C for 5 h. Post-synthetic modification was carried out by using 3-mercaptopropyltrimethoxysilane (MPTES) using literature procedure by our group [61]. Appropriate amount of catalyst was vacuum dried and refluxed at 110 °C for 12 h with excess of MPTES. The solid material was recovered and oxidation of thiol group was done by using excess of 30% H2O2 solution for 24 h followed by acidification with excess of 0.2 M H2SO4. Finally, the solid powder was filtered off, washed with water, dried at 60 °C. The schematic diagram for the functionalization process is explained in Scheme 3. Synthetic procedure for the preparation of complex The ligand (E)-2-(hydroxymethyl)-6-(((2-hydroxyphenyl) imino) methyl)-4-methylphenol (LH3) was prepared from a known procedure [62]. Zinc acetate dihydrate as well as 2-aminophenol were received from Sigma Aldrich, India and were used as such. The base tetra butyl ammonium hydroxide (TBA-OH) was obtained from SRL Chemicals, India. The other reagents were purchased from commercial sources and utilized without any further purification. Complex was prepared by using above mentioned ligand and the procedure is described as below. (1) [Zn4(L)2(LH)2((CH3)2SO)2]·2CH3OH·(CH3)2SO·H2O Ligand LH3 (0.041 gm, 0.1593 mmoles) was dissolved in methanol and after stirring for fifteen minutes, Zn(OAc)2·2H2O (0.0073 gm, 0.0398 mmoles) was added. To it three moles of TBA-OH was added giving yellow colored precipitate immediately. After stirring for twelve hours, the solution was evaporated in vacuum and dissolved in DMSO and dichloroform. One week later, yellow colored crystals suitable for single crystal X-ray diffraction were obtained (Scheme 2) . Yield: 0.034gm, 53.01% (based on Zn). Anal. Calcd. C68H79N4O18S3Zn4 (1597.91): C, 43.12; H, 5.59; N, 4.44. Found: C, 42.98; H, 4.05; N, 5.60. Zn complex incorporation to the mesoporous silica Sulfopropylsilylated mesoporous silica was used as a host to immobilize tetranuclear cubane shaped Zn complex to prepare the organic-inorganic hybrid materials (Scheme 3). Prior to the anchoring, 400 mg of sulfopropylsilylated mesoporous silica was dried at 80 °C for 3 h and then 40 mg of Zn complex was mixed with it in dry toluene followed by refluxing at 110 °C for 18 h. The solid product was then recovered by filtration, washed thoroughly with toluene and dried at 80 °C for 12 h. Zn complex incorporated MCM-48, MCM-41 and SBA-15 materials were denoted as M-48-S-Zn, M-41-S-Zn and S-15-S-Zn respectively. Characterization The crystallinity and phase purity of the prepared materials were investigated by powder X-ray diffraction (XRD; Ultima-IV, Rigaku) via Cu Kα radiation at 40 kV and 20 mA. Nitrogen (–196 °C) adsorption-desorption isotherm analysis was performed on BELMAX, MicrotracBEL instrument measured for samples pre-treated at 150 °C for 4 h. Thermogravimetric analysis (TGA) was performed on a Thermo plus EVO II TG 8120 (Rigaku) instrument. The sample was heated from room temperature to 800 °C at 10 °C min–1 in a dry air flow of 30 mL min–1. The temperature programme desorption (NH3-TPD) was carried out with a chemisorption analyzer (BELCAT-B, MicrotracBEL) and a thermal conductivity detector (TCD). The fresh sample (50 mg) was preheated at 600 °C for 1 h prior to measurement under He flow at 50 cm3 (NTP) min–1 and then it was cooled before being exposed to ammonia. NH3 adsorption was performed at 100 °C using 5% NH3/He flow at 50 cm3 (NTP) min–1, and the TPD profiles were collected by increasing the temperature range from 100-500 °C at a ramp rate of 10 °C min–1 under a He flow at 30 cm3 (NTP) min–1. Total number of acid sites was determined from the area of the h-peak [63] in the TPD profiles. The Si/Zn molar ratios were measured by inductively coupled plasma-atomic emission spectroscopy (ICP-AES; ICPE-9000, Shimadzu). The FT-IR spectroscopic analysis (PerkinElmer, Spectrum Two) was performed to evident the successful grafting of Zn complex to the mesoporous supports. The IR spectra was recorded at room temperature at resolution of 2 cm–1 in the range of 500–4000 cm–1 with the diamond crystal. The morphological study and elemental analysis of the zeolite catalysts were performed by Field Emission Scanning Electron Microscopy (FE-SEM with EDX; JSM-7600 F, JEOL). Elemental analysis was measured using Thermoquest CE instrument CHNS-O, EA/110 model. NMR spectra with CDCl3 solutions were performed by a JEOL JNM LAMBDA 400 model spectrometer operating at 400 MHz. X-ray crystallography Crystallographic data for the 1 were collected with a Bruker Apex II CCD diffractometer with graphite monochromated Mo-Kα radiation (λ =0.71073 Å). Data processing was completed with the help of SMART [64] and SAINT [64] processing program. SADABS [65] was used for absorption correction, and SHELXTL [65,66] was used for space group, structure determination and least-squares refinements on F2. The crystal structures were solved and refined by full-matrix least-squares methods against F2 by using the program SHELXL-2014 [67] and Olex-2 [68] software. The hydrogen atoms were set at calculated positions and refined with the help of riding model. The non-hydrogen atoms present in the complex were refined by anisotropic displacement parameters. Diamond 3.1e [69] was used to obtain the crystallographic structures. The solvent accessible voids present in 1 were assumed to be filled with certain disordered molecules of both methanol and DMSO which were unable to be modeled. Utilizing “PLATON/ “SQUEEZE” [70,71] program to remove those disordered solvent molecules (complex 1, 2CH3OH, 1(CH3)2SO), 1H2O). Total solvent-accessible void is of volume is 743 Å3 (per unit cell) which coincides to total electron count removed to 171 per unit cell. The total electron removed are 85 electrons per molecule (Z = 2). The crystal data can be acquired from the Cambridge Crystallographic Data Centre free of cost as CCDC 2002850 (1) from www.ccdc.cam.ac.uk/data_request/cif. Details of crystallographic data and structure refinement parameters are given in Table S1. Catalytic reaction Epoxide ring opening reaction of propylene oxide with morpholine was performed under solvent free condition using a series of prepared Zn complex grafted sulfopropylsilylated mesoporous materials. For a typical reaction procedure, required amount of catalyst was activated at 80 °C for 1 h. Propylene oxide, morpholine and catalyst were taken in a round bottom flask and the reaction mixture was allowed to stir at 70 °C using reflux condenser. The catalyst was filtered off from the resulting liquid and the liquid was subjected to Gas chromatographic analysis (Thermo Fisher Trace-1310, TG 5 column). A series of reactions were performed to optimize the reaction parameters to maximize the reactant conversion. The products were identified by means of GCMS (Perkin Elmer Clarus 500) using DB-5 MS Ui Column (30 m-long, 0.25 μm thickness and 0.25 mm-i.d.). Mass fragment of the products (around 145 m/z) were observed in GC–MS analysis which clearly confirm the formation of regioisomer products (1-Morpholinopropan-2-ol and 2-Morpholinopropan-1-ol). After removal of catalyst, reaction filtrate was further characterized by 1H NMR and mixture of both the regioisomers were observed in the data. Results and discussion X-Ray crystal structure [Zn4(l)2(LH)2((CH3)2SO)2]·2CH3OH·(CH3)2SO·H2O (1) Single crystal X-ray diffraction analysis reveals that homometallic tetranuclear complex 1 crystallizes in the triclinic system with P-1 space group (Z = 2). A perceptive view of the molecular structure of 1 is displayed in Fig. 1 a. Bond parameters associated with 1 are given in the caption of Fig. 1. The structural analysis of 1 imparts that the crystallographic independent unit contains one tetranuclear unit, [Zn(LH)4((CH3)2SO)2]. Molecular complex of 1 comprises a double open-cubane type [Zn4(μ 3-O)2(μ2 -O)2]4+ core which is constructed by four di-deprotonated Schiff base ligands [HL2−]. Here it is noteworthy to mention that in terms of binding capability two pairs of nonequivalent ligands [HL2−] are present in the system. Each ligand from a pair, chelates two Zn(II) ions via utilizing its all potential binding mode in μ 2-η1:η1:η2:η1-O, N, O, O fashion, while other ligand form a different pair accommodates three Zn(II) ions utilizing its partial coordination binding in μ 3-η3: η1: η1-O, N, O mode (Scheme 4 ). Fig. 1b unveils a simplified layout of coordination environment around the four Zn(II) ions. The overall structure of 1 contains two structurally distinct Zn(II) ions. The metal ions, Zn1 and Zn4 are five-coordinate and shows similar square pyramidal geometry, while the other two metal centres, Zn2 and Zn3 are present in a distorted octahedral geometry. The Addison distortion [72] indexes of Zn1 and Zn4 are found to be τZn1 = 0.1394 and τZn4 = 0.10435, respectively which further indicates that Zn1 and Zn4 centres possess distorted square pyramidal geometries. The basal planes of the square pyramid ligated by one imine nitrogen and two phenoxide oxygen atoms of the partially deprotonated ligand [HL]2− and the μ3-phenoxido oxygen atom of another deprotonated ligand [HL]2−. The apical position of the square pyramid is occupied by dimethyl sulphoxide molecule. The basal bond lengths of the square pyramid are in the range of 2.006(5) Å to 2.057(7) Å and the average apical bond distance is 2.055 Å. On the other hand, Zn2 and Zn3 centres adopt distorted octahedron geometry where basal plane is achieved by the imine nitrogen, phenoxido, μ3-phenoxido oxygen atoms of one HL2− ligand and μ2-phenoxido oxygen atoms from another HL2− ligand, and one of the axial position is occupied by oxygen atoms from the benzyl alcohol groups from later ligand and other axial position is occupied by μ3-phenoxido oxygen atoms of another HL2− ligand (Fig. S1). The equatorial bond distances vary from 1.993(6) – 2.260(4) Å, while the axial bond lengths fall in the range from 2.023(6) – 2.087(5) Å. Collected coordination action of all four HL2− ligands form a open-cubane type [Zn4(μ 3-O)2(μ2 -O)2]4+ core where, the corners of the cubane are occupied by Zn(II) atoms and bridging phenoxy O atoms. Zn····Zn distances within Zn4O4 cubane cores are different and are in the range of 2.018(5) to 2.260(4) while the average bond angle of Zn-O-Zn is 106.01°. The average bond angle of Zn-O-Zn and Zn····Zn distances within Zn4O4 cubane cores is almost comparable with the reported ones [73,74]. Structural Integrity studies by characterization The powder XRD patterns of unmodified and modified materials are depicted in Fig. 2 , high angle XRD patterns are shown in the inset of each of the figures. Low angle diffraction patterns of MCM-48, MCM-41 and SBA-15 show well resolved characteristic reflections revealing pure mesoporous phase. In systematic studies of mesoporous/sorbate system it is already proved that with the tethering of the functional groups into the pores and surface of the host molecules decreases the peak intensity in the diffraction patters [75]. The higher the electron density of the sorbate molecules the lower the peak intensity, however, the successive anchoring of the molecules restores the scattering contrast leading to the diffraction properties of the starting materials again showing the intact mesoporous silica framework after sulfone as well as Zn4 complex modifications consecutively. The scattering contrast and the resolution of the X-ray powder diagram was reduced in each functionalization step directly proves the successful grafting of the sulfonic acid onto the surface of mesoporous silica by surface silanolic −OH groups followed by covalently linked of Zn-complex with –SO3H groups. In order to check the Zn peaks in the mesoporous silica materials due to anchoring of the Zn-complex, high angle X-ray diffraction analysis was also recorded upto 50 ˚2θ, and compared with pure Zn complex to confirm the anchoring of Zn complex into mesoporous silica, which are shown in the inset of respective figures. All the modified materials showed peak at around 7.7 ˚2θ which is well matched with the pattern of pure Zn complex, with slight shift of ˚2θ value of Zn modified samples towards right angle which may be attributed to the change of chemical composition of the Zn complex after covalently linked with –SO3H groups in mesoporous materials. This observation confirms the presence of Zn complex in modified porous materials without any degradation. This fact was further confirmed by IR, EDX and ICP analyses also and explained in the later sections. N2 adsorption/desorption isotherms of MCM-48, MCM-41 and SBA-15 are shown in Fig. 3 . The adsorption/desorption isotherms of Zn complex incorporated mesoporous silica are compared with sulfopropylsilylated mesoporous silicas. All the isotherms are of type IV with steep increase around p/p0 0.3, which is more prominent in case of all the calcined materials (not shown here) and for functionalized MCM-41 and SBA-15 (Fig. 3 B & C), not very sharp for MCM-48 catalyst. The presence of mesopore assembly is confirmed by a sharp increase of adsorbed gas volume due to capillary condensation in a partial pressure of nitrogen ranging between p/p0 0.1 and 0.8, indicative of narrow and undeviating pore size distribution [60,76–80], which is likely for mesopores. The pore size distribution curve (Fig. 3) of acid modified and acid and Zn modified material was obtained from Barrett-Joyner-Halenda (BJH) method. The reduction of specific surface area, average pore diameter and pore volume were observed for all the samples may be due to the pore filling by tethering of the functionalized materials [81] and are summarized in Table 1 . The deterioration of the sharpness in the isotherm of functionalized MCM-48 materials may be due to the decrease of uniformity of the structure after the acid and Zn-complex modifications. Results clearly indicate that Zn complex covalently tethered to the external and internal pore surfaces of all three materials, which was further confirmed by other physico-chemical characterizations. SEM images of all three modified materials reveal that there was no apparent change in morphology of the materials observed after Zn complex immobilization into the mesoporous materials. Fig. 4 Shows the SEM image of M-48-S-Zn was found in spherical morphology with particle size of approx. 200 nm (0.2 μm). There were no significant changes in the morphology of M-41-S-Zn and S-15-S-Zn as well (not shown here) show the intactness of the structure even after modification. SEM-EDX analysis of a selected area of Zn complex modified sulfopropylsilylated MCM-48 material is shown in Fig. 4 B. The peaks of S, Si and Zn elements in the sample is clearly visible here. There is a clear Zn signal at 8.7 Kev for ZnKα. Apart from this the signals for ZnLα and ZnKβ are also present. These results indicate that Zn complex is covalently linked with the –SO3H group anchored in the mesoporous materials. From the EDX analyses the wt % of Zn present in the materials were calculated. M-48-S-Zn material showed 3.70% of Zn metal in the material whereas M-41-S-Zn and S-15-S-Zn showed 2.31 and 3.35% respectively. These estimations are done to have a rough calculations of bulk elements present in the materials or to confirm the presence of Zn or S in the hybrid materials. We have also used ICP analyses to calculate the exact amount of Zn and S present in the modified materials. ICP-OES results are summarized in Table 1. Result showed that highest Si/Zn ratio of 18.3 was in M-48-S-Zn with compare to M-41-S-Zn (10.6) and S-15-S-Zn (17.6) materials. 3D structure of MCM-48 material may have more accessibility to the active sites hence maximum amount of Zn was anchored to the internal and external pore surfaces of MCM-48. We can correlate these data with the N2 adsorption isotherm of M-48-S-Zn material. As the loading of Zn complex is maximum in MCM-48 material, the uniformity of the pore structure is somewhat disturbed, which is clearly reflected in the decrease of steepness of the curve in the range of p/p0 0.2 to 0.8 in the material than the other two. In order to confirm the linkage of Zn complex to the sulfopropylsilylated mesoporous silica materials, FT-IR spectra of pure Zn complex and Zn complex incorporated mesoporous materials were compared and shown in Fig. 5 A. All the materials exhibit broad bands at 787 and 1050 cm−1attributed to Si–O–Si bending and stretching vibrations as well as silanolic OH groups [61,82] respectively. At 1390 cm−1 deformation vibration band of −CH2 are also found for all the materials, which is ascribed from the propyl group linked to silanolic OH group due to presence of sulfonic acid group in the materials. Symmetric vibration of –SO3H groups as well as asymmetric vibration of SO is found around 1000–1200 cm−1 wave length range respectively, but due to overlay with the Si–O–Si band at 1050–1150 cm−1 this peak cannot be separated. The IR spectrum of pure Zn complex displayed band at 1530 cm-1 due to CN stretching vibration and the peak at 1450 cm-1 correspond to carbon-carbon stretching vibration of the aromatic rings. The ZnO stretching frequency is observed at 720 cm−1. The acid concentration of prepared materials due to incorporation of Zn complex was calculated from NH3-TPD measurements and NH3-TPD profile is depicted in Fig. 5 B. As shown in Table 2 , the total acidity of prepared materials was calculated and estimated by quantity of ammonia adsorbed. Total acid concentration was calculated from the NH3 peak above 350 °C which was derived from the physically adsorbed ammonia on the surface of mesoporous silica. Calculated acidity of M-48-S-Zn catalyst was 0.82 mmol/g which was higher with compare to other two catalysts as well as from sulfopropylsilylated mesoporous materials (0.61 mmol/g), and it was clearly reflected in the catalysis result (Section 4.2.), as M-48-S-Zn showed maximum catalytic activity than the other two. We have compared the activities with sulfopropylsilylated catalysts also with less acidity as revealed by TPD analyses and discussed in the later section. Additionally, to investigate the thermal stability of prepared material and to study the amount of catalyst loading, thermogravimetric analysis was performed. The results are depicted in Fig. S2. The small weight loss around 5% was observed below 150 °C which was due to the presence of physiosorbed water in all three materials. The other weight loss in the temperature range of 200–600 °C was assigned to the decomposition of covalently bonded Zn complex with sulfonic acid group with propyl linkage of mesoporous materials. In this temperature range, around 15–17% weight loss was observed for all three materials. Comparison of various catalysts on epoxide ring opening reaction The efficiency of proposed modification method can be clearly understood after evaluation of catalytic activities in epoxide ring opening reaction of propylene oxide with morpholine using sulfopropylsilylated catalysts, Zn complex incorporated catalysts and also in the absence of catalyst. Fig. 6 shows the comparison of various catalysts in epoxide ring opening reaction. Without any catalyst the reaction showed only 10% conversion of the reactant, whereas there were not much differences in conversion with sulfopropylsilylated mesoporous materials (15–25 %) also. There was a drastic change of catalytic activities when Zn-complex modified sulfopropylsilylated hybrid materials were used as catalysts. 95% reactant conversion was achieved with M-48-S-Zn material whereas M-41-S-Zn and S-15-S-Zn showed 86 % and 78 % conversion respectively. For comparison, another hybrid material by using Zn-acetate salt, impregnated with MCM-48-SO3H was also prepared. 40% morpholine conversion was found, which clearly indicates the significance of Zn complex impregnation instead of Zn acetate salt in sulfopropylsilylated mesoporous siica materials. The reactivity of a hybrid material depends on the type of ligands attached with the available site of centre metal ion to fulfil the coordination no after forming the bond with siliceous materials [83]. Here Zn-complex anchored with functionalized mesoporous material plays the key role in determining the high activity. Above results clearly demonstrate the importance of Zn complex immobilized (Lewis acid) catalysts over sulfopropylsilylated (Brönsted acid) catalysts in the proposed reaction system. In this reaction, we have only calculated reactant conversion and selectivity of the products was not calculated as we were unable to separate the products from the reaction mixture. The contribution of the two mechanism (SN2 and SN1) depends on substrate, steric restriction, and reaction conditions. In the case of SBA-15, the space inside the pore is too large to give steric restriction. The substrate in this work is propylene oxide, which means the substituent is methyl group. The methyl group has some ability to stabilize the adjacent carbenium ion, but phenyl group has stronger ability to do so and has more tendency to choose SN1 mechanism. On the other hand, the tendency to choose SN2 mechanism depends on the strength of nucleophile. Investigation of substituents and nucleophile is future work and at this stage we focused on the catalyst preparation and its ability to catalyse the ring-opening of propylene oxide as a primary investigation in this work. The Lewis acidic nature of Zn ion in the tetranuclear Zn complex plays a significant role in this reaction and are the active sites for this organic-inorganic hybrid mesoporous materials. In the proposed epoxide ring opening reaction, ring opening of propylene oxide in presence of prepared lewis acid catalyst occurs according to possible SN1 and SN2 mechanism which leads to the formation of regioisomer products. 1-Morpholinopropan-2-ol product was formed via SN2 route while 2-morpholinopropan-1-ol product was obtained via SN1 route. The plausible mechanism for this reaction is depicted in Scheme 5A and B. Reaction optimization In order to attain the maximum conversion of reactant, reaction was optimized by changing reaction parameters like catalyst amount, time temperature etc. and the effect of reaction conversion on catalyst amount is shown in Fig. 7 . 50–65% conversion was achieved when only 5 mg of catalyst was used, the conversion was increased simultaneously as amount of catalyst was increased. M-48-S-Zn catalyst showed 95% conversion using 20 mg of catalyst whereas M-41-S-Zn and S-15-S-Zn catalysts showed 86 % and 78 % conversion respectively with same reaction conditions. Reaction was also made using 30 mg of catalyst but there was not much change in the activities compare to 20 mg of catalysts. The intrinsic catalytic activities or turnover frequencies were also calculated based on the acidity estimated from the TPD analyses for all the catalysts to have an idea about the availability of active sites from the catalytic point of view. TOF is considered as the number of catalytic series per unit time, mainly depends on the catalyst, temperature, pressure, and concentration [85]. Turnover frequency (TOF) values are summarized in Table 2. To check the efficiency of prepared catalysts in the proposed reaction, it has been found that TOF values of all the hybrid materials decreased with increase of the catalyst amount from 5 mg to 20 mg as well as with increase of reactant conversion. All the materials are found to be proficient in the proposed reaction system and also showed higher TOF values. Maximum TOF values were obtained for S-15-S-Zn catalyst and M-41-S-Zn catalysts have comparable values, though, M-48-S-Zn has comparatively lower TOF values under same reaction condition. However, catalytic result implies the prominent activity of M-48-S-Zn catalyst in the proposed reaction system. This may be due to the reason that MCM-48 has 3D framework and so has more available active sites in its structure. Therefore, when Zn complex was anchored to the MCM-48 material, may be higher extent of Zn complex was covalently tethered to the surface with compare to MCM-41 and SBA-15 material. Also the higher acid concentration was observed in MCM-48 material which is in good agreement with the above mentioned reason. Acidity of the M-48-S-Zn catalyst was found to be higher compared to other two catalysts; however, the higher TOF and best conversion are not fully contributed by the acidity of the material, rather other factors such as acid strength as well as framework structure have significant contribution towards the catalytic activity [86]. Reaction time is an important parameter to study the mechanism of reaction and so several reactions were performed for different durations to optimize reaction time. The catalytic performance of prepared catalysts displayed in Fig. 8 demonstrate that less amount of morpholine was converted into the product when reaction was performed for 1 h and it was increased rapidly as reaction time was increased up to 6 h. Morpholine conversion of all three catalyst proved that this reaction is time dependent and within 6 h of reaction time 95% morpholine conversion was achieved by M-48-S-Zn. The effect of reaction temperature on the morpholine conversion was studied by varying reaction temperature and the results are summarized in Fig. 9 . Reactions were performed for three different temperatures in order to achieve the maximum conversion of morpholine. Results indicate that, when the reactions were performed at 50 °C, morpholine conversion was less (40 % for M-48-S-Zn, around 20 % for M-41-S-Zn and S-15-S-Zn) for all three catalysts. As the temperature was increased to 60 °C, conversion of morpholine was also increased and on further increase in the temperature to 70 °C, 95 % morpholine conversion was found. Heterogeneity of the catalyst In order to check the heterogeneity of the prepared M-48-S-Zn catalyst two tests were performed, filtration test and recycle (Fig. 10 ). In the filtration test, Reaction was started at optimized conditions and after 1 h catalyst was removed from the reaction mixture by filtration and reaction was continued for further 5 h. As shown in the Fig. 10 A, there was no change in the conversion after removal of catalyst and after completion of the test (after 6 h) the morpholine conversion obtained was 55% which was well matched with the conversion on 1 h of reaction time (54%). Results clearly indicate the true heterogeneity of prepared M-48-S-Zn catalyst and confirm no leaching of active site into the reaction medium during the reaction path. Recycle test was also carried out to check the efficiency of prepared catalyst and it was performed for the M-48-S-Zn catalyst in the optimized reaction conditions. After each catalytic run, the catalyst was recovered by filtration, washed with acetone and dried at 80 °C. The catalyst was used for four catalytic cycles under the same reaction and regeneration conditions. As shown in Fig. 10 B, no drastic change in morpholine conversion was observed and the catalytic activity was sustained even after 4th run with 80 % conversion over M-48-S-Zn catalyst. Slight gradual decrease in the conversion may be attributed to the deactivation of catalysts in successive runs which may have occurred due to the deposition of the product or substrate within the mesopore [60]. Conclusion In this work, we have synthesized open cubane shaped Zn4 complex utilizing multidentate Schiff base ligand which was further characterized by single crystal X-ray diffraction analysis. Later, this complex incorporated mesoporous silica materials were successfully prepared and anchoring of the complex was confirmed through thorough characterization techniques using powder XRD, N2 adsorption/desorption analysis, SEM-EDX, FT-IR, NH3-TPD, TGA and ICP-OES analysis. Mesoporous phase remains intact and homogeneous even after modification confirmed through powder XRD patterns. Successful immobilization of Zn complex to the sulfopropylsilylated mesoporous silica was confirmed by FT-IR spectroscopy, SEM-EDX, and ICP-OES analyses that showed the presence of Zn metal in the hybrid materials. The decrease in surface area, pore volume and pore diameter after modification was consistent with the presence of the organometallic complex inside the pore. The prepared catalysts, which were thoroughly characterized, were found to be highly active for ring opening reaction of propylene oxide with morpholine, and also noticeably M-48-S-Zn catalyst was found to be truly heterogeneous and reusable up to 4 times. CRediT authorship contribution statement Divya Jadav: Methodology, Writing - original draft. Pooja Shukla: Methodology. Rajib Bandyopadhyay: Visualization, Investigation. Yoshihiro Kubota: Characterization, Reviewing. Sourav Das: Conceptualization, Reviewing. Mahuya Bandyopadhyay: Conceptualization, Supervision, Reviewing, Editing. Declaration of Competing Interest The authors declare that they have no known competing financial interests or personal relationships that could have appeared to influence the work reported in this paper. Acknowledgements Divya Jadav and Pooja Shukla are thankful to IITRAM for providing financial support and infrastructural facilities. We would like to acknowledge IIT Gandhinagar for SEM-EDX analysis, and Mr. Kengo Takama of Yokohama National University for his technical assistance. Appendix A Supplementary data Supplementary material related to this article can be found, in the online version, at doi:https://doi.org/10.1016/j.mcat.2020.111220. Appendix A Supplementary data The following is Supplementary data to this article: References [1] D.C. Sherington B.K. Hodnett A.P. Keybett J.H. Clark K. Smith Supported Reagents and Catalyst in Chemistry 1998 Royal Society of Chemistry Cambridge 220 228 [2] K. Soai M. Watanable A. Yamamoto J. Org. Chem. 55 1990 4832 4835 10.1021/jo00303a014 [3] T. Joseph S.S. Deshpande S.B. Halligudi A. Vinu S. Ernst M. Hartmann J. Mol. Catal. A Chem. 206 2003 13 21 10.1016/S1381-1169(03)00452-7 [4] T. Joseph S.B. Halligudi J. Mol. Catal. A Chem. 229 2005 241 247 10.1016/j.molcata.2004.12.008 [5] R. Sanyal A. Guha T. Ghosh T. Kumar Mondal E. Zangrando D. Das Inorg. Chem. 53 2014 85 96 10.1021/ic4015493 [6] A.K. Shivani Chakraborti J. Mol. Catal. A Chem. 263 2007 137 142 10.1016/j.molcata.2006.08.047 [7] G. Süss-Fink M. Jahncke R.D. Adams F.A. Cotton Catalysis by Di- and Polynuclear Metal Cluster Complexes 1998 Wiley-VCH, Toronto ON, Canada [8] R.J. Puddephatt P. Braunstein L.A. Oro P.R. Raithby Metal Clusters in Chemistry 1999 Wiley-VCH, Toronto ON, Canada [9] (a) G. Guillena D.J. Ramon M. Yus M. Gupta J.J. Spivey Y.F. Han Asymmetric Organocatalyzed Morita-Baylis Hillman Reactions 2012 Catalysis, Royal Society of Chemistry UK 223 252 (b) H.P. Mungse S. Verma N. Kumar B. Sain O.P. Khatri J. Mater. Chem. 22 2012 5427 5433 10.1039/C2JM15644J (c) A.E.C. Collis I.T. Horvath Catal. Sci. Technol. 1 2011 912 919 10.1039/C1CY00174D (d) S. Verma M. Nandi A. Modak S.L. Jain A. Bhaumik Adv. Synth. Catal. 353 2011 1897 1902 10.1002/adsc.201100018 (e) C. Pereira J.F. Silva A.M. Pereira J.P. Araujo G. Blanco J.M. Pintado C. Freire Catal. Sci. Technol. 1 2011 784 793 10.1039/C1CY00090J (f) J. Alauzun A. Mehdi C. Reye R. Corriu New J. Chem. 31 2007 911 915 10.1039/B703155F [10] R. Luque A.M. Balu J.M. Campelo M.D. Gracia E. Losada A. Pineda A.A. Romero J.C. Serrano-Ruiz J.J. Spivey M. Gupta Y.-F. Han Catalysis vol. 24 2012 Royal Society of Chemistry Cambridge, UK 253 280 [11] C. Li H. Zhang D. Jiang Q. Yang Chem. Commun. 6 2007 547 558 10.1039/B609862B [12] B. Liu H. Liu C. Wang L. Liu S. Wu J. Guan Q. Kan Appl. Catal. A Gen. 443 2012 1 7 10.1016/j.apcata.2012.06.020 [13] Z. Li L. Liu J. Hu H. Liu S. Wu Q. Huo J. Guan Q. Kan Appl. Organometal. Chem. 26 2012 252 257 10.1002/aoc.2861 [14] M. Rimoldi D. Fodor J.A. van Bokhoven A. Mezzetti Chem. Commun. 49 2013 11314 11316 10.1039/C3CC47296E [15] N. Canilho J. Jacoby A. Pasc C. Carteret F. Dupire M.J. Stebe J.L. Blin Colloids Surf. B Biointerfaces 112 2013 139 145 10.1016/j.colsurfb.2013.07.024 [16] A.R. Massah R.J. Kalbasi S. Kaviyani RSC Adv. 3 2013 12816 12825 10.1039/C3RA22579H [17] B. Erdem S. Erdem R.M. Oksuzoglu A. Citak J. Porous Mater. 20 2013 1041 1049 10.1007/s10934-013-9685-3 [18] S. Alavi H. Hosseini-Monfared M. Siczek J. Mol. Catal. A Chem. 377 2013 16 28 10.1016/j.molcata.2013.04.013 [19] Z. Ma X. Wang S. Wei H. Yang F. Zhang P. Wang J. Ma Catal. Commun. 39 2013 24 29 10.1016/j.catcom.2013.04.012 [20] S. Sharma B. Kerler B. Subramaniam A.S. Borovik Green Chem. 8 2006 972 977 10.1039/B602965E [21] X. Yang J. Liu Q. Kan J. Guan Polish J. Chem. Technol. 16 2014 12 17 10.2478/pjct-2014-0043 [22] P. Gellin C. Naccache Y.B. Taarit Pure Appl. Chem. 60 1988 1315 1320 10.1351/pac198860081315 [23] P.A. Jacobs R. Chantillon P. DeLaet J. Verdonck M. Tielen ACS Symp. Series 218 1983 439 453 [24] A. Auroux V. Bolis P. Wierzchowski P.C. Grzvelle J.C. Vedrine J. Chem. Soc. Faraday Trans. 1 1979 2544 2555 10.1039/F19797502544 [25] M. Iwamoto H. Kusano S. Kagawa Inorg. Chem. 22 1983 3365 3366 10.1021/ic00165a001 [26] E. Mantovani N. Palladino A. Zanobi J. Mol. Catal. 3 1978 285 291 10.1016/0304-5102(78)80035-2 [27] M.R. Maurya M. Bisht A. Kumar M.L. Kuznetsov F. Avecilla J.C. Pessoa Dalton Trans. 40 2011 6968 6983 10.1039/C1DT10261C [28] M.R. Maurya A.K. Chandrakar S. Chand J. Mol. Catal. A Chem. 274 2007 192 201 10.1016/j.molcata.2007.05.018 [29] A. Syamal K.S. Kale Indian J. Chem. 19A 1980 225 228 [30] A. Syamal K.S. Kale Indian J. Chem. 20A 1981 205 208 [31] C. Ratnasamy A. Murugkar S. Padhya Indian J. Chem. 35A 1996 1 3 http://nopr.niscair.res.in/handle/123456789/41239 [32] S. Parihar S. Pathan R.N. Jadeja A. Patel V.K. Gupta Inorg. Chem. 51 2012 1152 1161 10.1021/ic202396q [33] S. Jana B. Dutta R. Bera S. Koner Langmuir 23 2007 2492 2496 10.1021/la062409t [34] M. Alessandra M. Andrea B. Amra G. Magnacca Catal. Today 161 2011 64 69 10.1016/j.cattod.2010.09.004 [35] M. Pirouzmand M.M. Amini N. Safari T. Hamoule J. Braz. Chem. Soc. 24 2013 1864 1870 10.5935/0103-5053.20130233 [36] K. Plucinska F. Kasprzykowski E. Kozian Tetrahedron Lett. 38 1997 861 864 10.1016/S0040-4039(96)02426-4 [37] M. Bolli S. Ley J. Chem. Soc. Perkin Trans. 1 1998 2243 2246 10.1039/A803612H [38] A.K. Ghosh Y. Wang J. Org. Chem. 64 1999 2789 2795 10.1021/jo9822378 [39] E.J. Corey F.Y. Zhang Angew. Chem. Int. Ed. 38 1999 1931 1934 10.1002/(SICI)1521-3773(19990712)38:13/14%3C1931::AID-ANIE1931%3E3.0.CO;2-4 [40] P. O’Brien Angew. Chem. Int. Ed. 38 1999 326 329 10.1002/(SICI)1521-3773(19990201)38:3%3C326::AID-ANIE326%3E3.0.CO;2-T [41] D.J. Ager I. Prakash D.R. Schaad Chem. Rev. 96 1996 835 876 10.1021/cr9500038 [42] E. Fullam A. Abuhammad D.L. Wilson M.C. Anderton S.G. Davies A.J. Russell E. Sim Bioorg. Med. Chem. Let. 21 2011 1185 1190 10.1016/j.bmcl.2010.12.099 [43] R.M. Hanson Chem. Rev. 91 1991 437 475 10.1021/cr00004a001 [44] A. Kamal B.R. Prasad A.M. Reddy M.N. Khan Catal. Commun. 8 2007 1876 1880 10.1016/j.catcom.2007.02.029 [45] D. Bhuyan L. Saikia D.K. Dutta Appl. Catal. A Gen. 487 2014 195 201 10.1016/j.apcata.2014.09.020 [46] I. Matos P.D. Neves J.E. Castanheiro E. Perez-Mayoral R. Martin-Aranda C. Duran-Valle J. Vital A.M. Botelho do Rego I.M. Fonseca Appl. Catal. A Gen. 439 2012 24 30 10.1016/j.apcata.2012.06.036 [47] J.S. Yadav B.V. Reddy A.K. Basak A.V. Narsaiah Tetrahedron Lett. 44 2003 1047 1050 10.1016/S0040-4039(02)02735-1 [48] J. Iqbal A. Pandey Tetrahedron Lett. 31 1990 575 576 10.1016/0040-4039(90)87039-3 [49] S. Ishida S. Suzuki T. Hayano H. Furuno J. Inanaga J. Alloys. Compd. 408 2006 441 443 10.1016/j.jallcom.2004.12.079 [50] M.W. Robinson A.M. Davies I. Mabbett T.E. Davies D.C. Apperley S.H. Taylor A.E. Graham J. Mol. Catal. A Chem. 329 2010 57 63 10.1016/j.molcata.2010.06.018 [51] N. Deshpande A. Parulkar R. Joshi B. Diep A. Kulkarni N.A. Brunelli J. Catal. 370 2019 46 54 10.1016/j.jcat.2018.11.038 [52] A.T. Placzek J.L. Donelson R. Trivedi R.A. Gibbs S.K. De Tetrahedron Lett. 46 2005 9029 9034 10.1016/j.tetlet.2005.10.106 [53] H.F. Lu J.T. Zhou H.L. Cheng L.L. Sun F.F. Yang R.Z. Wu Y.H. Gao Z.B. Luo Tetrahedron 69 2013 11174 11184 10.1016/j.tet.2013.10.098 [54] T. Baskaran A. Joshi G. Kamalakar A. Sakthivel Appl. Catal. A Gen. 524 2016 50 55 10.1016/j.apcata.2016.05.029 [55] L. Xu G. Fang Y. Yu Y. Ma Z. Ye Z. Li Mol. Catal. 467 2019 1 8 10.1016/j.mcat.2019.01.021 [56] S. Roy B. Banerjee N. Salam A. Bhaumik S.M. Islam ChemCatChem 7 2015 2689 2697 10.1002/cctc.201500563 [57] N. Nagarjun P. Concepcion A. Dhakshinamoorthy Mol. Catal. 482 2020 110628 10.1016/j.mcat.2019.110628 [58] E. Cano-Serrano G. Blanco-Brieva J.M. Campos-Martin J.L.G. Fierro Langmuir 19 2003 7621 7627 10.1021/la034520u [59] P.F. Siril A.D. Davison J.K. Randhawa D.R. Brown J. Mol. Catal. A Chem. 267 2007 72 78 10.1016/j.molcata.2006.11.022 [60] M. Bandyopadhyay N. Tsunoji T. Sano Catal. Lett. 147 2017 1040 1050 10.1007/s10562-017-1997-5 [61] M. Bandyopadhyay N. Tsunoji R. Bandyopadhyay T. Sano React. Kinet. Mech. Catal. 126 2019 167 179 10.1007/s11144-018-1447-4 [62] P. Shukla S. Roy D. Dolui W.C. Mancisidor S. Das Eur. J. Inorg. Chem. 2020 2020 823 832 10.1002/ejic.201901350 [63] M. Niwa N. Katada Catal. Surv. Jpn. 1 1997 215 226 10.1023/A:1019033115091 [64] SMART & SAINT Software Reference manuals, Version 6.45, Bruker Analytical X-ray Systems 2003 Inc., Madison WI [65] G.M. Sheldrick SADABS, A Software for Empirical Absorption Correction, Ver. 2.05 2002 University of Göttingen, Göttingen Germany [66] SHELXTL, Reference Manual, Ver. 6.1, Bruker Analytical X-ray Systems 2000 Inc., Madison WI [67] G.M. Sheldrick Acta Crystallogr. Sect. A: Found. Crystallogr. 64 2008 112 122 [68] O.V. Dolomanov L.J. Bourhis R.J. Gildea J.A.K. Howard H. Puschmann J. Appl. Crystallogr. 42 2009 339 341 10.1107/S0021889808042726 [69] K. Bradenburg Diamond, Ver. 3.1eM, Crystal Impact GbR Bonn, Germany 2005 [70] A.L. Spek Acta Crystallogr. Sect. A 46 1990 c34 10.1107/S0108767390099780 [71] G.A. Bain J.F. Berry J. Chem. Educ. 85 2008 532 536 10.1021/ed085p532 [72] A.W. Addison T.N. Rao J. Reedijk J. Van Rijn G.C. Verschoor J. Chem. Soc. Dalton Trans. 7 1984 1349 1356 10.1039/DT9840001349 [73] S.K. Patel R.N. Patel Y. Singh Y.P. Singh D. Kumhar R.N. Jadeja H. Roy A.K. Patel N. Patel N. Patel A. Banerjee D. Choquesillo-Lazarte A. Gutierre Polyhedron 161 2019 198 212 10.1016/j.poly.2019.01.006 [74] S. Ghosh A. Spannenberg E. Mejía Helv. Chim. Acta 100 2017 e1700176 10.1002/hlca.201700176 [75] B. Marler U. Oberhagemann S. Vortmann H. Gies Microporous Mesoporous Mater. 6 1996 375 383 10.1016/0927-6513(96)00016-8 [76] Q. Zhu S. Maeno R. Nishimoto T. Miyamoto M. Fukushima J. Mol. Catal. A Chem. 385 2014 31 37 10.1016/j.molcata.2014.01.013 [77] S. Alavi H. Hosseini-Monfared M. Siczek J. Mol. Catal. A Chem. 377 2013 16 28 10.1016/j.molcata.2013.04.013 [78] E. Sujandi E.A. Prasetyanto S.-C. Lee S.-E. Park Microporous Mesoporous Mater. 118 2009 134 142 10.1016/j.micromeso.2008.08.035 [79] J.-Q. Wang L. Huang M. Xue Y. Wang L. Gao J.H. Zhu Z. Zou J. Phys. Chem. C 112 2008 5014 5022 10.1021/jp7099948 [80] M.J. Nasab A.R. Kiasat RSC Adv. 5 2015 75491 75499 10.1039/C5RA11006H [81] V.H.A. Pinto J.S. Rebouças G.M. Ucoski E.H. de Faria B.F. Ferreira R.A.S. San Gil S. Nakagaki Appl. Catal. A Gen. 526 2016 9 20 10.1016/j.apcata.2016.07.018 [82] Y. Li G. Zhou C. Li D. Qin W. Qiao B. Chu Colloids Surf. A Physicochem. Eng. Asp. 341 2009 79 85 10.1016/j.colsurfa.2009.03.041 [83] T. Das H. Uyama M. Nandi J. Solid State Chem. 260 2018 132 141 10.1016/j.jssc.2018.01.027 [84] B. Shivani A.K. Pujala Chakraborti J. Org. Chem. 72 2007 3713 3722 10.1021/jo062674j [85] M. Boudart Chem. Rev. 95 1995 661 666 10.1021/cr00035a009 [86] M. Kotwal A. Kumar S. Darbha J. Mol. Catal. A Chem. 377 2013 65 73 10.1016/j.molcata.2013.04.029",
      "scopus-id": "85091910347",
      "coredata": {
        "eid": "1-s2.0-S2468823120304831",
        "dc:description": "Tetranuclear Zn complex, [Zn4(L)2(LH)2((CH3)2SO)2]·2CH3OH·(CH3)2SO·H2O (1) [where LH3 = 3-(E)-(2-hydroxyphenylimino)methyl-4-hydroxy-5-hydroxymethylphenyl (LH3)] was prepared and characterized by single-crystal X-ray analysis. Then, it was incorporated to the sulfopropylsilylated MCM-48, MCM-41 and SBA-15 mesoporous silica materials. The prepared materials were thoroughly characterized by XRD, FT-IR, N2 adsorption/desorption analysis, NH3-TPD, TGA, SEM-EDX and ICP-OES measurements. These catalysts were successfully used for the ring opening reaction of propylene oxide with morpholine producing the corresponding β-aminoalcohols. An abrupt increase in catalytic activities was observed after anchoring of the tetranuclear Zn complex onto the inner surface of sulfopropylsilylated mesoporous materials. Among all the catalysts, the tetranuclear Zn complex incorporated MCM-48 was found to be most active in this reaction system and gave maximum 95% conversion. Catalysis by the tetranuclear Zn complex immobilized on MCM-48 was totally heterogeneous and the catalyst was recyclable up to 4 times without leaching.",
        "openArchiveArticle": "false",
        "prism:coverDate": "2020-12-31",
        "openaccessUserLicense": null,
        "prism:aggregationType": "Journal",
        "prism:url": "https://api.elsevier.com/content/article/pii/S2468823120304831",
        "dc:creator": [
          {
            "@_fa": "true",
            "$": "Jadav, Divya"
          },
          {
            "@_fa": "true",
            "$": "Shukla, Pooja"
          },
          {
            "@_fa": "true",
            "$": "Bandyopadhyay, Rajib"
          },
          {
            "@_fa": "true",
            "$": "Kubota, Yoshihiro"
          },
          {
            "@_fa": "true",
            "$": "Das, Sourav"
          },
          {
            "@_fa": "true",
            "$": "Bandyopadhyay, Mahuya"
          }
        ],
        "link": [
          {
            "@_fa": "true",
            "@rel": "self",
            "@href": "https://api.elsevier.com/content/article/pii/S2468823120304831"
          },
          {
            "@_fa": "true",
            "@rel": "scidir",
            "@href": "https://www.sciencedirect.com/science/article/pii/S2468823120304831"
          }
        ],
        "dc:format": "application/json",
        "openaccessType": null,
        "pii": "S2468-8231(20)30483-1",
        "prism:volume": "497",
        "articleNumber": "111220",
        "prism:publisher": "Elsevier B.V.",
        "dc:title": "Tetranuclear Zn complex covalently immobilized on sulfopropylsilylated mesoporous silica: An efficient catalyst for ring opening reaction of epoxide with amine",
        "prism:copyright": "© 2020 Elsevier B.V. All rights reserved.",
        "openaccess": "0",
        "prism:issn": "24688231",
        "dcterms:subject": [
          {
            "@_fa": "true",
            "$": "Tetranuclear Zn complex"
          },
          {
            "@_fa": "true",
            "$": "Mesoporous silica"
          },
          {
            "@_fa": "true",
            "$": "Ring opening reaction"
          },
          {
            "@_fa": "true",
            "$": "β-Aminoalcohols"
          }
        ],
        "openaccessArticle": "false",
        "prism:publicationName": "Molecular Catalysis",
        "openaccessSponsorType": null,
        "prism:pageRange": "111220",
        "pubType": "fla",
        "prism:coverDisplayDate": "December 2020",
        "prism:doi": "10.1016/j.mcat.2020.111220",
        "prism:startingPage": "111220",
        "dc:identifier": "doi:10.1016/j.mcat.2020.111220",
        "openaccessSponsorName": null
      },
      "objects": {
        "object": [
          {
            "@category": "standard",
            "@height": "200",
            "@width": "374",
            "@_fa": "true",
            "$": "https://api.elsevier.com/content/object/eid/1-s2.0-S2468823120304831-ga1.jpg?httpAccept=%2A%2F%2A",
            "@multimediatype": "JPEG image file",
            "@type": "IMAGE-DOWNSAMPLED",
            "@size": "14684",
            "@ref": "ga1",
            "@mimetype": "image/jpeg"
          },
          {
            "@category": "standard",
            "@height": "209",
            "@width": "567",
            "@_fa": "true",
            "$": "https://api.elsevier.com/content/object/eid/1-s2.0-S2468823120304831-gr10.jpg?httpAccept=%2A%2F%2A",
            "@multimediatype": "JPEG image file",
            "@type": "IMAGE-DOWNSAMPLED",
            "@size": "23239",
            "@ref": "gr10",
            "@mimetype": "image/jpeg"
          },
          {
            "@category": "standard",
            "@height": "254",
            "@width": "341",
            "@_fa": "true",
            "$": "https://api.elsevier.com/content/object/eid/1-s2.0-S2468823120304831-gr9.jpg?httpAccept=%2A%2F%2A",
            "@multimediatype": "JPEG image file",
            "@type": "IMAGE-DOWNSAMPLED",
            "@size": "18092",
            "@ref": "gr9",
            "@mimetype": "image/jpeg"
          },
          {
            "@category": "standard",
            "@height": "257",
            "@width": "341",
            "@_fa": "true",
            "$": "https://api.elsevier.com/content/object/eid/1-s2.0-S2468823120304831-gr7.jpg?httpAccept=%2A%2F%2A",
            "@multimediatype": "JPEG image file",
            "@type": "IMAGE-DOWNSAMPLED",
            "@size": "19566",
            "@ref": "gr7",
            "@mimetype": "image/jpeg"
          },
          {
            "@category": "standard",
            "@height": "255",
            "@width": "341",
            "@_fa": "true",
            "$": "https://api.elsevier.com/content/object/eid/1-s2.0-S2468823120304831-gr8.jpg?httpAccept=%2A%2F%2A",
            "@multimediatype": "JPEG image file",
            "@type": "IMAGE-DOWNSAMPLED",
            "@size": "18506",
            "@ref": "gr8",
            "@mimetype": "image/jpeg"
          },
          {
            "@category": "standard",
            "@height": "213",
            "@width": "567",
            "@_fa": "true",
            "$": "https://api.elsevier.com/content/object/eid/1-s2.0-S2468823120304831-gr5.jpg?httpAccept=%2A%2F%2A",
            "@multimediatype": "JPEG image file",
            "@type": "IMAGE-DOWNSAMPLED",
            "@size": "34349",
            "@ref": "gr5",
            "@mimetype": "image/jpeg"
          },
          {
            "@category": "standard",
            "@height": "189",
            "@width": "341",
            "@_fa": "true",
            "$": "https://api.elsevier.com/content/object/eid/1-s2.0-S2468823120304831-gr6.jpg?httpAccept=%2A%2F%2A",
            "@multimediatype": "JPEG image file",
            "@type": "IMAGE-DOWNSAMPLED",
            "@size": "14740",
            "@ref": "gr6",
            "@mimetype": "image/jpeg"
          },
          {
            "@category": "standard",
            "@height": "389",
            "@width": "718",
            "@_fa": "true",
            "$": "https://api.elsevier.com/content/object/eid/1-s2.0-S2468823120304831-gr3.jpg?httpAccept=%2A%2F%2A",
            "@multimediatype": "JPEG image file",
            "@type": "IMAGE-DOWNSAMPLED",
            "@size": "57207",
            "@ref": "gr3",
            "@mimetype": "image/jpeg"
          },
          {
            "@category": "standard",
            "@height": "260",
            "@width": "567",
            "@_fa": "true",
            "$": "https://api.elsevier.com/content/object/eid/1-s2.0-S2468823120304831-gr4.jpg?httpAccept=%2A%2F%2A",
            "@multimediatype": "JPEG image file",
            "@type": "IMAGE-DOWNSAMPLED",
            "@size": "29885",
            "@ref": "gr4",
            "@mimetype": "image/jpeg"
          },
          {
            "@category": "standard",
            "@height": "373",
            "@width": "567",
            "@_fa": "true",
            "$": "https://api.elsevier.com/content/object/eid/1-s2.0-S2468823120304831-gr1.jpg?httpAccept=%2A%2F%2A",
            "@multimediatype": "JPEG image file",
            "@type": "IMAGE-DOWNSAMPLED",
            "@size": "43024",
            "@ref": "gr1",
            "@mimetype": "image/jpeg"
          },
          {
            "@category": "standard",
            "@height": "186",
            "@width": "680",
            "@_fa": "true",
            "$": "https://api.elsevier.com/content/object/eid/1-s2.0-S2468823120304831-gr2.jpg?httpAccept=%2A%2F%2A",
            "@multimediatype": "JPEG image file",
            "@type": "IMAGE-DOWNSAMPLED",
            "@size": "27298",
            "@ref": "gr2",
            "@mimetype": "image/jpeg"
          },
          {
            "@category": "standard",
            "@height": "202",
            "@width": "341",
            "@_fa": "true",
            "$": "https://api.elsevier.com/content/object/eid/1-s2.0-S2468823120304831-sc4.jpg?httpAccept=%2A%2F%2A",
            "@multimediatype": "JPEG image file",
            "@type": "IMAGE-DOWNSAMPLED",
            "@size": "13113",
            "@ref": "sc4",
            "@mimetype": "image/jpeg"
          },
          {
            "@category": "standard",
            "@height": "981",
            "@width": "496",
            "@_fa": "true",
            "$": "https://api.elsevier.com/content/object/eid/1-s2.0-S2468823120304831-sc5.jpg?httpAccept=%2A%2F%2A",
            "@multimediatype": "JPEG image file",
            "@type": "IMAGE-DOWNSAMPLED",
            "@size": "52676",
            "@ref": "sc5",
            "@mimetype": "image/jpeg"
          },
          {
            "@category": "standard",
            "@height": "232",
            "@width": "567",
            "@_fa": "true",
            "$": "https://api.elsevier.com/content/object/eid/1-s2.0-S2468823120304831-sc2.jpg?httpAccept=%2A%2F%2A",
            "@multimediatype": "JPEG image file",
            "@type": "IMAGE-DOWNSAMPLED",
            "@size": "23466",
            "@ref": "sc2",
            "@mimetype": "image/jpeg"
          },
          {
            "@category": "standard",
            "@height": "291",
            "@width": "567",
            "@_fa": "true",
            "$": "https://api.elsevier.com/content/object/eid/1-s2.0-S2468823120304831-sc3.jpg?httpAccept=%2A%2F%2A",
            "@multimediatype": "JPEG image file",
            "@type": "IMAGE-DOWNSAMPLED",
            "@size": "35521",
            "@ref": "sc3",
            "@mimetype": "image/jpeg"
          },
          {
            "@category": "standard",
            "@height": "201",
            "@width": "567",
            "@_fa": "true",
            "$": "https://api.elsevier.com/content/object/eid/1-s2.0-S2468823120304831-sc1.jpg?httpAccept=%2A%2F%2A",
            "@multimediatype": "JPEG image file",
            "@type": "IMAGE-DOWNSAMPLED",
            "@size": "16728",
            "@ref": "sc1",
            "@mimetype": "image/jpeg"
          },
          {
            "@category": "thumbnail",
            "@height": "117",
            "@width": "219",
            "@_fa": "true",
            "$": "https://api.elsevier.com/content/object/eid/1-s2.0-S2468823120304831-ga1.sml?httpAccept=%2A%2F%2A",
            "@multimediatype": "GIF image file",
            "@type": "IMAGE-THUMBNAIL",
            "@size": "5551",
            "@ref": "ga1",
            "@mimetype": "image/gif"
          },
          {
            "@category": "thumbnail",
            "@height": "81",
            "@width": "219",
            "@_fa": "true",
            "$": "https://api.elsevier.com/content/object/eid/1-s2.0-S2468823120304831-gr10.sml?httpAccept=%2A%2F%2A",
            "@multimediatype": "GIF image file",
            "@type": "IMAGE-THUMBNAIL",
            "@size": "4709",
            "@ref": "gr10",
            "@mimetype": "image/gif"
          },
          {
            "@category": "thumbnail",
            "@height": "163",
            "@width": "219",
            "@_fa": "true",
            "$": "https://api.elsevier.com/content/object/eid/1-s2.0-S2468823120304831-gr9.sml?httpAccept=%2A%2F%2A",
            "@multimediatype": "GIF image file",
            "@type": "IMAGE-THUMBNAIL",
            "@size": "6482",
            "@ref": "gr9",
            "@mimetype": "image/gif"
          },
          {
            "@category": "thumbnail",
            "@height": "164",
            "@width": "217",
            "@_fa": "true",
            "$": "https://api.elsevier.com/content/object/eid/1-s2.0-S2468823120304831-gr7.sml?httpAccept=%2A%2F%2A",
            "@multimediatype": "GIF image file",
            "@type": "IMAGE-THUMBNAIL",
            "@size": "7406",
            "@ref": "gr7",
            "@mimetype": "image/gif"
          },
          {
            "@category": "thumbnail",
            "@height": "164",
            "@width": "219",
            "@_fa": "true",
            "$": "https://api.elsevier.com/content/object/eid/1-s2.0-S2468823120304831-gr8.sml?httpAccept=%2A%2F%2A",
            "@multimediatype": "GIF image file",
            "@type": "IMAGE-THUMBNAIL",
            "@size": "6800",
            "@ref": "gr8",
            "@mimetype": "image/gif"
          },
          {
            "@category": "thumbnail",
            "@height": "82",
            "@width": "219",
            "@_fa": "true",
            "$": "https://api.elsevier.com/content/object/eid/1-s2.0-S2468823120304831-gr5.sml?httpAccept=%2A%2F%2A",
            "@multimediatype": "GIF image file",
            "@type": "IMAGE-THUMBNAIL",
            "@size": "5897",
            "@ref": "gr5",
            "@mimetype": "image/gif"
          },
          {
            "@category": "thumbnail",
            "@height": "122",
            "@width": "219",
            "@_fa": "true",
            "$": "https://api.elsevier.com/content/object/eid/1-s2.0-S2468823120304831-gr6.sml?httpAccept=%2A%2F%2A",
            "@multimediatype": "GIF image file",
            "@type": "IMAGE-THUMBNAIL",
            "@size": "6021",
            "@ref": "gr6",
            "@mimetype": "image/gif"
          },
          {
            "@category": "thumbnail",
            "@height": "119",
            "@width": "219",
            "@_fa": "true",
            "$": "https://api.elsevier.com/content/object/eid/1-s2.0-S2468823120304831-gr3.sml?httpAccept=%2A%2F%2A",
            "@multimediatype": "GIF image file",
            "@type": "IMAGE-THUMBNAIL",
            "@size": "6845",
            "@ref": "gr3",
            "@mimetype": "image/gif"
          },
          {
            "@category": "thumbnail",
            "@height": "100",
            "@width": "219",
            "@_fa": "true",
            "$": "https://api.elsevier.com/content/object/eid/1-s2.0-S2468823120304831-gr4.sml?httpAccept=%2A%2F%2A",
            "@multimediatype": "GIF image file",
            "@type": "IMAGE-THUMBNAIL",
            "@size": "9446",
            "@ref": "gr4",
            "@mimetype": "image/gif"
          },
          {
            "@category": "thumbnail",
            "@height": "144",
            "@width": "219",
            "@_fa": "true",
            "$": "https://api.elsevier.com/content/object/eid/1-s2.0-S2468823120304831-gr1.sml?httpAccept=%2A%2F%2A",
            "@multimediatype": "GIF image file",
            "@type": "IMAGE-THUMBNAIL",
            "@size": "9580",
            "@ref": "gr1",
            "@mimetype": "image/gif"
          },
          {
            "@category": "thumbnail",
            "@height": "60",
            "@width": "219",
            "@_fa": "true",
            "$": "https://api.elsevier.com/content/object/eid/1-s2.0-S2468823120304831-gr2.sml?httpAccept=%2A%2F%2A",
            "@multimediatype": "GIF image file",
            "@type": "IMAGE-THUMBNAIL",
            "@size": "4326",
            "@ref": "gr2",
            "@mimetype": "image/gif"
          },
          {
            "@category": "thumbnail",
            "@height": "130",
            "@width": "219",
            "@_fa": "true",
            "$": "https://api.elsevier.com/content/object/eid/1-s2.0-S2468823120304831-sc4.sml?httpAccept=%2A%2F%2A",
            "@multimediatype": "GIF image file",
            "@type": "IMAGE-THUMBNAIL",
            "@size": "4567",
            "@ref": "sc4",
            "@mimetype": "image/gif"
          },
          {
            "@category": "thumbnail",
            "@height": "164",
            "@width": "83",
            "@_fa": "true",
            "$": "https://api.elsevier.com/content/object/eid/1-s2.0-S2468823120304831-sc5.sml?httpAccept=%2A%2F%2A",
            "@multimediatype": "GIF image file",
            "@type": "IMAGE-THUMBNAIL",
            "@size": "3135",
            "@ref": "sc5",
            "@mimetype": "image/gif"
          },
          {
            "@category": "thumbnail",
            "@height": "90",
            "@width": "219",
            "@_fa": "true",
            "$": "https://api.elsevier.com/content/object/eid/1-s2.0-S2468823120304831-sc2.sml?httpAccept=%2A%2F%2A",
            "@multimediatype": "GIF image file",
            "@type": "IMAGE-THUMBNAIL",
            "@size": "4346",
            "@ref": "sc2",
            "@mimetype": "image/gif"
          },
          {
            "@category": "thumbnail",
            "@height": "112",
            "@width": "219",
            "@_fa": "true",
            "$": "https://api.elsevier.com/content/object/eid/1-s2.0-S2468823120304831-sc3.sml?httpAccept=%2A%2F%2A",
            "@multimediatype": "GIF image file",
            "@type": "IMAGE-THUMBNAIL",
            "@size": "6750",
            "@ref": "sc3",
            "@mimetype": "image/gif"
          },
          {
            "@category": "thumbnail",
            "@height": "78",
            "@width": "219",
            "@_fa": "true",
            "$": "https://api.elsevier.com/content/object/eid/1-s2.0-S2468823120304831-sc1.sml?httpAccept=%2A%2F%2A",
            "@multimediatype": "GIF image file",
            "@type": "IMAGE-THUMBNAIL",
            "@size": "3011",
            "@ref": "sc1",
            "@mimetype": "image/gif"
          },
          {
            "@category": "standard",
            "@_fa": "true",
            "$": "https://api.elsevier.com/content/object/eid/1-s2.0-S2468823120304831-mmc1.docx?httpAccept=%2A%2F%2A",
            "@multimediatype": "Microsoft Word file",
            "@type": "APPLICATION",
            "@size": "542702",
            "@ref": "mmc1",
            "@mimetype": "application/word"
          },
          {
            "@category": "standard",
            "@_fa": "true",
            "$": "https://api.elsevier.com/content/object/eid/1-s2.0-S2468823120304831-am.pdf?httpAccept=%2A%2F%2A",
            "@multimediatype": "Acrobat PDF file",
            "@type": "AAM-PDF",
            "@size": "2011747",
            "@ref": "am",
            "@mimetype": "application/pdf"
          }
        ]
      },
      "link": {
        "@rel": "abstract",
        "@href": "https://api.elsevier.com/content/abstract/scopus_id/85091910347"
      }
    }
  }
}