{
  "metadata": {
    "title": "Blue LED-induced photocatalytic “Click” reaction facilitated by CuO/Bi<ce:inf loc=post>2</ce:inf>WO₆ for synthesising 1,4-disubstituted 1,2,3-triazoles",
    "authors": "; ; ",
    "journal": "Molecular Catalysis",
    "date": "2025-11-30",
    "doi": "10.1016/j.mcat.2025.115429",
    "abstract": "",
    "uri": "https://api.elsevier.com/content/article/pii/S2468823125006157",
    "pii": "S2468823125006157"
  },
  "fulltext": {
    "full-text-retrieval-response": {
      "scopus-eid": "2-s2.0-105013521950",
      "originalText": "serial JL 315758 291210 291744 291790 291809 31 Molecular Catalysis MOLECULARCATALYSIS 2025-08-20 2025-08-20 2025-08-20 2025-08-20 2025-09-12T11:56:17 1-s2.0-S2468823125006157 S2468-8231(25)00615-7 S2468823125006157 10.1016/j.mcat.2025.115429 S300 S300.1 FULL-TEXT 1-s2.0-S2468823125X00134 2025-09-12T11:06:16.157539Z 0 0 20251101 20251130 2025 2025-08-20T12:33:46.736531Z absattachment articleinfo articlenumber articletitlenorm authfirstinitialnorm authfirstsurnamenorm cid cids contenttype copyright crossmark dateloaded dateloadedtxt datesearch datesort dateupdated dco docsubtype doctype doi eid ewtransactionid hubeid indexeddate issn issnnorm itemstage itemtransactionid itemweight openaccess openarchive pg pgfirst pii piinorm pubdateend pubdatestart pubdatetxt pubyr sectiontitle sortorder srctitle srctitlenorm srctype ssids alllist content subj subheadings suppl tomb volfirst volissue volumelist webpdf webpdfpagecount yearnav figure table e-component body mmlmath affil appendices articletitle auth authfirstini authfull authkeywords authlast highlightsabst primabst pubtype ref specialabst 2468-8231 24688231 true 586 586 C Volume 586 26 115429 115429 115429 202511 November 2025 2025-11-01 2025-11-30 2025 Regular Papers article fla © 2025 Elsevier B.V. All rights are reserved, including those for text and data mining, AI training, and similar technologies. BLUELEDINDUCEDPHOTOCATALYTICCLICKREACTIONFACILITATEDBYCUOBI2WOFORSYNTHESISING14DISUBSTITUTED123TRIAZOLES SHOBIKA M 1 Introduction 2 Experimental section 2.1 Description of materials used 2.2 Synthesis of COB catalyst 2.3 Characterization information 2.4 General protocol for photocatalytic click reaction 3 Results and discussion 3.1 XRD analysis 3.2 FTIR analysis 3.3 UV–vis DRS analysis 3.4 PL and EIS analysis 3.5 Morphology analysis 3.6 XPS analysis 3.7 Brunauer Emmett Teller (BET) analysis 3.8 Photocatalytic activity of synthesised 20COB catalyst 3.9 Evaluation of the photocatalytic mechanism 3.10 Scalability test 4 Conclusion and future aspects Data availability CRediT authorship contribution statement Appendix Supplementary materials References SHAFIQUE 2023 3104 K XIAO 2023 100113 Z ALI 2017 3698 3703 A VALERIOLOPES 2021 109688 F ZHANG 2019 357 372 B MEINEL 2020 108850 R MUKHERJEE 2024 113575 A KHAIRBEK 2025 114708 A GONZALEZLAINEZ 2022 2154 2169 M KUMAR 2021 6991 7031 G KOLB 2001 2004 2021 H ROSTOVTSEV 2002 2596 2599 V KUMAR 2016 69 75 P QI 2025 129 138 M YAN 2024 2898 2913 X SU 2024 14778 14790 P MO 2024 109 123 Q ZHANG 2024 6970 6980 J WU 2025 333 340 Y LANG 2014 473 486 X HOSSAIN 2019 A FAIRBANKS 2021 6915 6990 B MUHAMMAD 2020 2682 2687 M YI 2019 52 62 H PAPLAL 2015 57842 57846 B SHOBIKA 2024 14145 14154 M VERMA 2019 1170 1188 N KRISHNAVENI 2022 115618 T SHARMILA 2018 288 292 G CHEREDDY 2013 1130 1136 N CHEREDDY 2013 12873 N SINGH 2017 11342 11352 M MOKARIYA 2022 963 979 J YADAV 2022 132867 M SHOBIKA 2025 115190 M MENG 2017 3247 3256 X LI 2021 2884 2891 Y WANG 2014 11716 11727 D LV 2020 293 302 Y YANG 2023 144672 C LI 2016 29 36 Y SINGH 2021 126864 S KAVINKUMAR 2023 2985 2994 V RANA 2024 A KOUTAVARAPU 2022 132015 R LI 2020 126165 S SHI 2024 175219 X LI 2023 171520 X MANJUPRIYA 2024 10938 10954 R SHOBIKAX2025X115429 SHOBIKAX2025X115429XM 2027-08-20T00:00:00.000Z 2027-08-20T00:00:00.000Z http://creativecommons.org/licenses/by-nc-nd/4.0/ © 2025 Elsevier B.V. All rights are reserved, including those for text and data mining, AI training, and similar technologies. https://doi.org/10.15223/policy-017 https://doi.org/10.15223/policy-037 https://doi.org/10.15223/policy-012 https://doi.org/10.15223/policy-029 https://doi.org/10.15223/policy-004 item S2468-8231(25)00615-7 S2468823125006157 1-s2.0-S2468823125006157 10.1016/j.mcat.2025.115429 315758 2025-09-12T11:06:16.157539Z 2025-11-01 2025-11-30 1-s2.0-S2468823125006157-main.pdf https://s3-eu-west-1.amazonaws.com/prod-ucs-content-store-eu-west/content/pii:S2468823125006157/MAIN/application/pdf/43d8203ff796c14447e0bafb1cf9e19d/main.pdf main.pdf pdf true 11275595 MAIN 13 1-s2.0-S2468823125006157-main_1.png https://s3-eu-west-1.amazonaws.com/prod-ucs-content-store-eu-west/content/pii:S2468823125006157/PREVIEW/image/png/ed6965ce3d89c01140e88a9c1d080a78/main_1.png main_1.png png 59719 928 656 IMAGE-WEB-PDF 1 1-s2.0-S2468823125006157-ga1.jpg https://s3-eu-west-1.amazonaws.com/prod-ucs-content-store-eu-west/content/pii:S2468823125006157/ga1/DOWNSAMPLED/image/jpeg/d85bcbfa72bdaf21252b7a9ad4a132d0/ga1.jpg ga1 true ga1.jpg jpg 31385 164 500 IMAGE-DOWNSAMPLED 1-s2.0-S2468823125006157-fx10.jpg https://s3-eu-west-1.amazonaws.com/prod-ucs-content-store-eu-west/content/pii:S2468823125006157/fx10/DOWNSAMPLED/image/jpeg/693df8f9208f82c543856e5d742ebbf1/fx10.jpg fx10 fx10.jpg jpg 5688 65 74 IMAGE-DOWNSAMPLED 1-s2.0-S2468823125006157-fx11.jpg https://s3-eu-west-1.amazonaws.com/prod-ucs-content-store-eu-west/content/pii:S2468823125006157/fx11/DOWNSAMPLED/image/jpeg/4f882fcb7bc65ccf54a492fc76fae334/fx11.jpg fx11 fx11.jpg jpg 4997 35 78 IMAGE-DOWNSAMPLED 1-s2.0-S2468823125006157-fx12.jpg https://s3-eu-west-1.amazonaws.com/prod-ucs-content-store-eu-west/content/pii:S2468823125006157/fx12/DOWNSAMPLED/image/jpeg/17a5fce3656bb6e2e96a4542371c37fa/fx12.jpg fx12 fx12.jpg jpg 8503 87 114 IMAGE-DOWNSAMPLED 1-s2.0-S2468823125006157-fx13.jpg https://s3-eu-west-1.amazonaws.com/prod-ucs-content-store-eu-west/content/pii:S2468823125006157/fx13/DOWNSAMPLED/image/jpeg/944d52176f4d3ca3a481190b4be67c8c/fx13.jpg fx13 fx13.jpg jpg 5681 65 74 IMAGE-DOWNSAMPLED 1-s2.0-S2468823125006157-fx18.jpg https://s3-eu-west-1.amazonaws.com/prod-ucs-content-store-eu-west/content/pii:S2468823125006157/fx18/DOWNSAMPLED/image/jpeg/c89c038fff4aff2df518e6964962b52b/fx18.jpg fx18 fx18.jpg jpg 8818 86 132 IMAGE-DOWNSAMPLED 1-s2.0-S2468823125006157-fx19.jpg https://s3-eu-west-1.amazonaws.com/prod-ucs-content-store-eu-west/content/pii:S2468823125006157/fx19/DOWNSAMPLED/image/jpeg/fdaedecc07f23b4c9505c666f0d3c935/fx19.jpg fx19 fx19.jpg jpg 5594 64 74 IMAGE-DOWNSAMPLED 1-s2.0-S2468823125006157-fx14.jpg https://s3-eu-west-1.amazonaws.com/prod-ucs-content-store-eu-west/content/pii:S2468823125006157/fx14/DOWNSAMPLED/image/jpeg/1cd6e12c0d3b75944d16f24d3004c596/fx14.jpg fx14 fx14.jpg jpg 5362 34 78 IMAGE-DOWNSAMPLED 1-s2.0-S2468823125006157-sc1.jpg https://s3-eu-west-1.amazonaws.com/prod-ucs-content-store-eu-west/content/pii:S2468823125006157/sc1/DOWNSAMPLED/image/jpeg/ef0920f88dfd4f0e7638c273b4bae7aa/sc1.jpg sc1 sc1.jpg jpg 143103 997 600 IMAGE-DOWNSAMPLED 1-s2.0-S2468823125006157-fx15.jpg https://s3-eu-west-1.amazonaws.com/prod-ucs-content-store-eu-west/content/pii:S2468823125006157/fx15/DOWNSAMPLED/image/jpeg/cc6e089e90ee29a95942ff3acaa5348b/fx15.jpg fx15 fx15.jpg jpg 8921 87 129 IMAGE-DOWNSAMPLED 1-s2.0-S2468823125006157-fx16.jpg https://s3-eu-west-1.amazonaws.com/prod-ucs-content-store-eu-west/content/pii:S2468823125006157/fx16/DOWNSAMPLED/image/jpeg/f55875ca994a8fc0f2959fa30d72303d/fx16.jpg fx16 fx16.jpg jpg 5686 65 74 IMAGE-DOWNSAMPLED 1-s2.0-S2468823125006157-fx17.jpg https://s3-eu-west-1.amazonaws.com/prod-ucs-content-store-eu-west/content/pii:S2468823125006157/fx17/DOWNSAMPLED/image/jpeg/ac01fe0085eddfe20376e39800cce732/fx17.jpg fx17 fx17.jpg jpg 5202 47 78 IMAGE-DOWNSAMPLED 1-s2.0-S2468823125006157-fx21.jpg https://s3-eu-west-1.amazonaws.com/prod-ucs-content-store-eu-west/content/pii:S2468823125006157/fx21/DOWNSAMPLED/image/jpeg/4c5df1cc633836f68e037fba3529146a/fx21.jpg fx21 fx21.jpg jpg 8363 87 112 IMAGE-DOWNSAMPLED 1-s2.0-S2468823125006157-fx22.jpg https://s3-eu-west-1.amazonaws.com/prod-ucs-content-store-eu-west/content/pii:S2468823125006157/fx22/DOWNSAMPLED/image/jpeg/c9b76f00edde7caae3a7db47f0ad16dd/fx22.jpg fx22 fx22.jpg jpg 5638 64 73 IMAGE-DOWNSAMPLED 1-s2.0-S2468823125006157-fx23.jpg https://s3-eu-west-1.amazonaws.com/prod-ucs-content-store-eu-west/content/pii:S2468823125006157/fx23/DOWNSAMPLED/image/jpeg/df2b5e553004958cd15fb003e2001f3f/fx23.jpg fx23 fx23.jpg jpg 4997 34 79 IMAGE-DOWNSAMPLED 1-s2.0-S2468823125006157-fx24.jpg https://s3-eu-west-1.amazonaws.com/prod-ucs-content-store-eu-west/content/pii:S2468823125006157/fx24/DOWNSAMPLED/image/jpeg/53c9fe5bbe537d2f724f19691256302d/fx24.jpg fx24 fx24.jpg jpg 8534 87 114 IMAGE-DOWNSAMPLED 1-s2.0-S2468823125006157-fx20.jpg https://s3-eu-west-1.amazonaws.com/prod-ucs-content-store-eu-west/content/pii:S2468823125006157/fx20/DOWNSAMPLED/image/jpeg/e407cfb82284796dfaefe1a0725db4c5/fx20.jpg fx20 fx20.jpg jpg 4727 32 71 IMAGE-DOWNSAMPLED 1-s2.0-S2468823125006157-fx29.jpg https://s3-eu-west-1.amazonaws.com/prod-ucs-content-store-eu-west/content/pii:S2468823125006157/fx29/DOWNSAMPLED/image/jpeg/3d3a22435b58f89de87136c7753ee8cf/fx29.jpg fx29 fx29.jpg jpg 4910 53 57 IMAGE-DOWNSAMPLED 1-s2.0-S2468823125006157-fx25.jpg https://s3-eu-west-1.amazonaws.com/prod-ucs-content-store-eu-west/content/pii:S2468823125006157/fx25/DOWNSAMPLED/image/jpeg/d319b62d3f724314e6fc4b3b35bd474b/fx25.jpg fx25 fx25.jpg jpg 5672 65 74 IMAGE-DOWNSAMPLED 1-s2.0-S2468823125006157-fx26.jpg https://s3-eu-west-1.amazonaws.com/prod-ucs-content-store-eu-west/content/pii:S2468823125006157/fx26/DOWNSAMPLED/image/jpeg/7eda9710d42683825736c1f45ff2ea0f/fx26.jpg fx26 fx26.jpg jpg 5037 35 86 IMAGE-DOWNSAMPLED 1-s2.0-S2468823125006157-fx27.jpg https://s3-eu-west-1.amazonaws.com/prod-ucs-content-store-eu-west/content/pii:S2468823125006157/fx27/DOWNSAMPLED/image/jpeg/d76e1274be25436b2a138713eadc5fa0/fx27.jpg fx27 fx27.jpg jpg 8587 86 115 IMAGE-DOWNSAMPLED 1-s2.0-S2468823125006157-fx28.jpg https://s3-eu-west-1.amazonaws.com/prod-ucs-content-store-eu-west/content/pii:S2468823125006157/fx28/DOWNSAMPLED/image/jpeg/77670f568843b430b47d54d2fdd0d0c5/fx28.jpg fx28 fx28.jpg jpg 5688 65 74 IMAGE-DOWNSAMPLED 1-s2.0-S2468823125006157-gr8.jpg https://s3-eu-west-1.amazonaws.com/prod-ucs-content-store-eu-west/content/pii:S2468823125006157/gr8/DOWNSAMPLED/image/jpeg/31a5e9559935eb294dfde9ac061f3578/gr8.jpg gr8 gr8.jpg jpg 52285 314 676 IMAGE-DOWNSAMPLED 1-s2.0-S2468823125006157-gr7.jpg https://s3-eu-west-1.amazonaws.com/prod-ucs-content-store-eu-west/content/pii:S2468823125006157/gr7/DOWNSAMPLED/image/jpeg/c162593d68dc608e4d0bdc961751ed7a/gr7.jpg gr7 gr7.jpg jpg 55689 264 789 IMAGE-DOWNSAMPLED 1-s2.0-S2468823125006157-gr6.jpg https://s3-eu-west-1.amazonaws.com/prod-ucs-content-store-eu-west/content/pii:S2468823125006157/gr6/DOWNSAMPLED/image/jpeg/d475a53a976b5bec0d0e24c8a15559d2/gr6.jpg gr6 gr6.jpg jpg 147672 853 788 IMAGE-DOWNSAMPLED 1-s2.0-S2468823125006157-fx32.jpg https://s3-eu-west-1.amazonaws.com/prod-ucs-content-store-eu-west/content/pii:S2468823125006157/fx32/DOWNSAMPLED/image/jpeg/e830ccf2c714bec5d3bc84bc2a28778e/fx32.jpg fx32 fx32.jpg jpg 5032 35 85 IMAGE-DOWNSAMPLED 1-s2.0-S2468823125006157-fx33.jpg https://s3-eu-west-1.amazonaws.com/prod-ucs-content-store-eu-west/content/pii:S2468823125006157/fx33/DOWNSAMPLED/image/jpeg/cc676bd0df2823dbf0020e13277aa1d2/fx33.jpg fx33 fx33.jpg jpg 8504 88 117 IMAGE-DOWNSAMPLED 1-s2.0-S2468823125006157-fx34.jpg https://s3-eu-west-1.amazonaws.com/prod-ucs-content-store-eu-west/content/pii:S2468823125006157/fx34/DOWNSAMPLED/image/jpeg/3daabe2868cdb31395e7ab87393631c0/fx34.jpg fx34 fx34.jpg jpg 5514 60 69 IMAGE-DOWNSAMPLED 1-s2.0-S2468823125006157-fx35.jpg https://s3-eu-west-1.amazonaws.com/prod-ucs-content-store-eu-west/content/pii:S2468823125006157/fx35/DOWNSAMPLED/image/jpeg/c8130d82953cd646992ac4b1338f670c/fx35.jpg fx35 fx35.jpg jpg 3460 10 48 IMAGE-DOWNSAMPLED 1-s2.0-S2468823125006157-fx30.jpg https://s3-eu-west-1.amazonaws.com/prod-ucs-content-store-eu-west/content/pii:S2468823125006157/fx30/DOWNSAMPLED/image/jpeg/31212a016b1be968244c0eee530f7c01/fx30.jpg fx30 fx30.jpg jpg 8720 77 139 IMAGE-DOWNSAMPLED 1-s2.0-S2468823125006157-fx31.jpg https://s3-eu-west-1.amazonaws.com/prod-ucs-content-store-eu-west/content/pii:S2468823125006157/fx31/DOWNSAMPLED/image/jpeg/c22bab27d193efeaa41113ccce78082e/fx31.jpg fx31 fx31.jpg jpg 5684 65 74 IMAGE-DOWNSAMPLED 1-s2.0-S2468823125006157-fx4.jpg https://s3-eu-west-1.amazonaws.com/prod-ucs-content-store-eu-west/content/pii:S2468823125006157/fx4/DOWNSAMPLED/image/jpeg/fc108332c06aecc86297ef09eae6afc9/fx4.jpg fx4 fx4.jpg jpg 5503 61 70 IMAGE-DOWNSAMPLED 1-s2.0-S2468823125006157-fx36.jpg https://s3-eu-west-1.amazonaws.com/prod-ucs-content-store-eu-west/content/pii:S2468823125006157/fx36/DOWNSAMPLED/image/jpeg/ddcef361b1d87890665d5d1a8c69f406/fx36.jpg fx36 fx36.jpg jpg 7019 72 105 IMAGE-DOWNSAMPLED 1-s2.0-S2468823125006157-fx3.jpg https://s3-eu-west-1.amazonaws.com/prod-ucs-content-store-eu-west/content/pii:S2468823125006157/fx3/DOWNSAMPLED/image/jpeg/f7936d6f5881684e2eb1417d358d714c/fx3.jpg fx3 fx3.jpg jpg 7669 73 107 IMAGE-DOWNSAMPLED 1-s2.0-S2468823125006157-fx37.jpg https://s3-eu-west-1.amazonaws.com/prod-ucs-content-store-eu-west/content/pii:S2468823125006157/fx37/DOWNSAMPLED/image/jpeg/4a0fd17d94e8ac7f42dfde107fd8a26a/fx37.jpg fx37 fx37.jpg jpg 5505 60 69 IMAGE-DOWNSAMPLED 1-s2.0-S2468823125006157-fx2.jpg https://s3-eu-west-1.amazonaws.com/prod-ucs-content-store-eu-west/content/pii:S2468823125006157/fx2/DOWNSAMPLED/image/jpeg/6a399f482a4725e39ac38ff8c90fb0ae/fx2.jpg fx2 fx2.jpg jpg 4377 29 54 IMAGE-DOWNSAMPLED 1-s2.0-S2468823125006157-fx38.jpg https://s3-eu-west-1.amazonaws.com/prod-ucs-content-store-eu-west/content/pii:S2468823125006157/fx38/DOWNSAMPLED/image/jpeg/9723df6928a0a1f248b0216b9fd9496b/fx38.jpg fx38 fx38.jpg jpg 4265 10 83 IMAGE-DOWNSAMPLED 1-s2.0-S2468823125006157-fx1.jpg https://s3-eu-west-1.amazonaws.com/prod-ucs-content-store-eu-west/content/pii:S2468823125006157/fx1/DOWNSAMPLED/image/jpeg/ef8e32569e4457b538aaa99dd972f9b9/fx1.jpg fx1 fx1.jpg jpg 5507 60 69 IMAGE-DOWNSAMPLED 1-s2.0-S2468823125006157-fx39.jpg https://s3-eu-west-1.amazonaws.com/prod-ucs-content-store-eu-west/content/pii:S2468823125006157/fx39/DOWNSAMPLED/image/jpeg/4cacefa8172600017599e5fe409883cf/fx39.jpg fx39 fx39.jpg jpg 7647 82 132 IMAGE-DOWNSAMPLED 1-s2.0-S2468823125006157-gr1.jpg https://s3-eu-west-1.amazonaws.com/prod-ucs-content-store-eu-west/content/pii:S2468823125006157/gr1/DOWNSAMPLED/image/jpeg/fafdb1909152074619a8d3fb2405c526/gr1.jpg gr1 gr1.jpg jpg 53317 289 789 IMAGE-DOWNSAMPLED 1-s2.0-S2468823125006157-fx8.jpg https://s3-eu-west-1.amazonaws.com/prod-ucs-content-store-eu-west/content/pii:S2468823125006157/fx8/DOWNSAMPLED/image/jpeg/e67602a365ab086098633a68bebc08ba/fx8.jpg fx8 fx8.jpg jpg 4702 44 54 IMAGE-DOWNSAMPLED 1-s2.0-S2468823125006157-fx7.jpg https://s3-eu-west-1.amazonaws.com/prod-ucs-content-store-eu-west/content/pii:S2468823125006157/fx7/DOWNSAMPLED/image/jpeg/e672ab23fd002a4937a0b0248fd768ee/fx7.jpg fx7 fx7.jpg jpg 5506 61 70 IMAGE-DOWNSAMPLED 1-s2.0-S2468823125006157-fx6.jpg https://s3-eu-west-1.amazonaws.com/prod-ucs-content-store-eu-west/content/pii:S2468823125006157/fx6/DOWNSAMPLED/image/jpeg/89f88e873bb8a1ee6297470dcfbb065b/fx6.jpg fx6 fx6.jpg jpg 7986 72 121 IMAGE-DOWNSAMPLED 1-s2.0-S2468823125006157-fx5.jpg https://s3-eu-west-1.amazonaws.com/prod-ucs-content-store-eu-west/content/pii:S2468823125006157/fx5/DOWNSAMPLED/image/jpeg/3f6714175a4bc6d7471fe982ee948aed/fx5.jpg fx5 fx5.jpg jpg 4609 32 54 IMAGE-DOWNSAMPLED 1-s2.0-S2468823125006157-gr5.jpg https://s3-eu-west-1.amazonaws.com/prod-ucs-content-store-eu-west/content/pii:S2468823125006157/gr5/DOWNSAMPLED/image/jpeg/30166161b99356bc2b49a828d48dbb59/gr5.jpg gr5 gr5.jpg jpg 126366 528 789 IMAGE-DOWNSAMPLED 1-s2.0-S2468823125006157-gr4.jpg https://s3-eu-west-1.amazonaws.com/prod-ucs-content-store-eu-west/content/pii:S2468823125006157/gr4/DOWNSAMPLED/image/jpeg/42b40ae8374c8d3de48c6d2da49e89fd/gr4.jpg gr4 gr4.jpg jpg 222572 559 789 IMAGE-DOWNSAMPLED 1-s2.0-S2468823125006157-gr3.jpg https://s3-eu-west-1.amazonaws.com/prod-ucs-content-store-eu-west/content/pii:S2468823125006157/gr3/DOWNSAMPLED/image/jpeg/aa6bc5259fa4d30c436c6d7b04e5e638/gr3.jpg gr3 gr3.jpg jpg 93505 559 676 IMAGE-DOWNSAMPLED 1-s2.0-S2468823125006157-gr2.jpg https://s3-eu-west-1.amazonaws.com/prod-ucs-content-store-eu-west/content/pii:S2468823125006157/gr2/DOWNSAMPLED/image/jpeg/5484ae86ebac9d98a2031c7fd27758e1/gr2.jpg gr2 gr2.jpg jpg 72704 422 601 IMAGE-DOWNSAMPLED 1-s2.0-S2468823125006157-fx9.jpg https://s3-eu-west-1.amazonaws.com/prod-ucs-content-store-eu-west/content/pii:S2468823125006157/fx9/DOWNSAMPLED/image/jpeg/1e46a5ca8e4d784c8464bbf6979c540a/fx9.jpg fx9 fx9.jpg jpg 8030 71 124 IMAGE-DOWNSAMPLED 1-s2.0-S2468823125006157-ga1.sml https://s3-eu-west-1.amazonaws.com/prod-ucs-content-store-eu-west/content/pii:S2468823125006157/ga1/THUMBNAIL/image/gif/2baf882e24a7800e6cda537a1805c033/ga1.sml ga1 true ga1.sml sml 8129 72 219 IMAGE-THUMBNAIL 1-s2.0-S2468823125006157-fx10.sml https://s3-eu-west-1.amazonaws.com/prod-ucs-content-store-eu-west/content/pii:S2468823125006157/fx10/THUMBNAIL/image/gif/e434ec759523a2f04aedcbac7f5d3746/fx10.sml fx10 fx10.sml sml 10012 164 188 IMAGE-THUMBNAIL 1-s2.0-S2468823125006157-fx11.sml https://s3-eu-west-1.amazonaws.com/prod-ucs-content-store-eu-west/content/pii:S2468823125006157/fx11/THUMBNAIL/image/gif/60f8d0667d2a33f7d9c851e3e23c40f0/fx11.sml fx11 fx11.sml sml 8157 97 219 IMAGE-THUMBNAIL 1-s2.0-S2468823125006157-fx12.sml https://s3-eu-west-1.amazonaws.com/prod-ucs-content-store-eu-west/content/pii:S2468823125006157/fx12/THUMBNAIL/image/gif/73feb5bb2eed8b5a4b5af89aa3db2e73/fx12.sml fx12 fx12.sml sml 11344 164 216 IMAGE-THUMBNAIL 1-s2.0-S2468823125006157-fx13.sml https://s3-eu-west-1.amazonaws.com/prod-ucs-content-store-eu-west/content/pii:S2468823125006157/fx13/THUMBNAIL/image/gif/aeaf9fb16983fed8da7cbb1455d8323a/fx13.sml fx13 fx13.sml sml 9996 164 188 IMAGE-THUMBNAIL 1-s2.0-S2468823125006157-fx18.sml https://s3-eu-west-1.amazonaws.com/prod-ucs-content-store-eu-west/content/pii:S2468823125006157/fx18/THUMBNAIL/image/gif/0f46f7fc509f39dc2e4002251edc597d/fx18.sml fx18 fx18.sml sml 10078 143 219 IMAGE-THUMBNAIL 1-s2.0-S2468823125006157-fx19.sml https://s3-eu-west-1.amazonaws.com/prod-ucs-content-store-eu-west/content/pii:S2468823125006157/fx19/THUMBNAIL/image/gif/dca1583a0a6ed891e02ec21812e6d88f/fx19.sml fx19 fx19.sml sml 9506 163 188 IMAGE-THUMBNAIL 1-s2.0-S2468823125006157-fx14.sml https://s3-eu-west-1.amazonaws.com/prod-ucs-content-store-eu-west/content/pii:S2468823125006157/fx14/THUMBNAIL/image/gif/07c7c9d4ce9757adc05639bbec6d394f/fx14.sml fx14 fx14.sml sml 8708 97 219 IMAGE-THUMBNAIL 1-s2.0-S2468823125006157-sc1.sml https://s3-eu-west-1.amazonaws.com/prod-ucs-content-store-eu-west/content/pii:S2468823125006157/sc1/THUMBNAIL/image/gif/6eba127a36bee51fb6ae957c7ed9d71e/sc1.sml sc1 sc1.sml sml 6838 163 98 IMAGE-THUMBNAIL 1-s2.0-S2468823125006157-fx15.sml https://s3-eu-west-1.amazonaws.com/prod-ucs-content-store-eu-west/content/pii:S2468823125006157/fx15/THUMBNAIL/image/gif/c8868a0afafcd74cbde5c265794aff25/fx15.sml fx15 fx15.sml sml 10429 147 219 IMAGE-THUMBNAIL 1-s2.0-S2468823125006157-fx16.sml https://s3-eu-west-1.amazonaws.com/prod-ucs-content-store-eu-west/content/pii:S2468823125006157/fx16/THUMBNAIL/image/gif/99c7f90562146043094f89e5e0a99665/fx16.sml fx16 fx16.sml sml 10036 164 188 IMAGE-THUMBNAIL 1-s2.0-S2468823125006157-fx17.sml https://s3-eu-west-1.amazonaws.com/prod-ucs-content-store-eu-west/content/pii:S2468823125006157/fx17/THUMBNAIL/image/gif/7602fc8e3aa1847421ec739376606fe4/fx17.sml fx17 fx17.sml sml 8716 132 219 IMAGE-THUMBNAIL 1-s2.0-S2468823125006157-fx21.sml https://s3-eu-west-1.amazonaws.com/prod-ucs-content-store-eu-west/content/pii:S2468823125006157/fx21/THUMBNAIL/image/gif/148d1d502be8cb10644cee2082fb96a2/fx21.sml fx21 fx21.sml sml 11169 164 212 IMAGE-THUMBNAIL 1-s2.0-S2468823125006157-fx22.sml https://s3-eu-west-1.amazonaws.com/prod-ucs-content-store-eu-west/content/pii:S2468823125006157/fx22/THUMBNAIL/image/gif/2e5ca1c3da6e6881c5a0f5c8273d3521/fx22.sml fx22 fx22.sml sml 9932 163 185 IMAGE-THUMBNAIL 1-s2.0-S2468823125006157-fx23.sml https://s3-eu-west-1.amazonaws.com/prod-ucs-content-store-eu-west/content/pii:S2468823125006157/fx23/THUMBNAIL/image/gif/f7d60ca45d617718222375201bd5960e/fx23.sml fx23 fx23.sml sml 8049 95 219 IMAGE-THUMBNAIL 1-s2.0-S2468823125006157-fx24.sml https://s3-eu-west-1.amazonaws.com/prod-ucs-content-store-eu-west/content/pii:S2468823125006157/fx24/THUMBNAIL/image/gif/1a399f667ec417ef8176904e02842b2c/fx24.sml fx24 fx24.sml sml 11494 164 216 IMAGE-THUMBNAIL 1-s2.0-S2468823125006157-fx20.sml https://s3-eu-west-1.amazonaws.com/prod-ucs-content-store-eu-west/content/pii:S2468823125006157/fx20/THUMBNAIL/image/gif/f0f11928a48a36f52108a8fee41f96a1/fx20.sml fx20 fx20.sml sml 8581 99 219 IMAGE-THUMBNAIL 1-s2.0-S2468823125006157-fx29.sml https://s3-eu-west-1.amazonaws.com/prod-ucs-content-store-eu-west/content/pii:S2468823125006157/fx29/THUMBNAIL/image/gif/ec8a55a6cc614c997d44de425b5aa779/fx29.sml fx29 fx29.sml sml 9144 164 178 IMAGE-THUMBNAIL 1-s2.0-S2468823125006157-fx25.sml https://s3-eu-west-1.amazonaws.com/prod-ucs-content-store-eu-west/content/pii:S2468823125006157/fx25/THUMBNAIL/image/gif/74ecc8e04fc85e0031402371397de3e8/fx25.sml fx25 fx25.sml sml 10054 164 188 IMAGE-THUMBNAIL 1-s2.0-S2468823125006157-fx26.sml https://s3-eu-west-1.amazonaws.com/prod-ucs-content-store-eu-west/content/pii:S2468823125006157/fx26/THUMBNAIL/image/gif/fddd2fbbb32749b939c8d730a10e19b2/fx26.sml fx26 fx26.sml sml 7637 90 219 IMAGE-THUMBNAIL 1-s2.0-S2468823125006157-fx27.sml https://s3-eu-west-1.amazonaws.com/prod-ucs-content-store-eu-west/content/pii:S2468823125006157/fx27/THUMBNAIL/image/gif/7d89db0499171b28253ee7c9920256d7/fx27.sml fx27 fx27.sml sml 11775 164 219 IMAGE-THUMBNAIL 1-s2.0-S2468823125006157-fx28.sml https://s3-eu-west-1.amazonaws.com/prod-ucs-content-store-eu-west/content/pii:S2468823125006157/fx28/THUMBNAIL/image/gif/213139c02e3dfe8062b6b6033ffa1b79/fx28.sml fx28 fx28.sml sml 10044 164 188 IMAGE-THUMBNAIL 1-s2.0-S2468823125006157-gr8.sml https://s3-eu-west-1.amazonaws.com/prod-ucs-content-store-eu-west/content/pii:S2468823125006157/gr8/THUMBNAIL/image/gif/bdeb42de62e5d056d580914e9ff38cbc/gr8.sml gr8 gr8.sml sml 7775 102 219 IMAGE-THUMBNAIL 1-s2.0-S2468823125006157-gr7.sml https://s3-eu-west-1.amazonaws.com/prod-ucs-content-store-eu-west/content/pii:S2468823125006157/gr7/THUMBNAIL/image/gif/b2eee3498452333adc1ce97d5809578a/gr7.sml gr7 gr7.sml sml 7524 73 219 IMAGE-THUMBNAIL 1-s2.0-S2468823125006157-gr6.sml https://s3-eu-west-1.amazonaws.com/prod-ucs-content-store-eu-west/content/pii:S2468823125006157/gr6/THUMBNAIL/image/gif/d7a56211a89804dfeb8d0012f8c406d4/gr6.sml gr6 gr6.sml sml 10346 163 151 IMAGE-THUMBNAIL 1-s2.0-S2468823125006157-fx32.sml https://s3-eu-west-1.amazonaws.com/prod-ucs-content-store-eu-west/content/pii:S2468823125006157/fx32/THUMBNAIL/image/gif/a614edbecae59a5a1880c8dc1daf7423/fx32.sml fx32 fx32.sml sml 7545 90 219 IMAGE-THUMBNAIL 1-s2.0-S2468823125006157-fx33.sml https://s3-eu-west-1.amazonaws.com/prod-ucs-content-store-eu-west/content/pii:S2468823125006157/fx33/THUMBNAIL/image/gif/e009d06a49ec638b5984e40159f4a4ed/fx33.sml fx33 fx33.sml sml 11041 164 218 IMAGE-THUMBNAIL 1-s2.0-S2468823125006157-fx34.sml https://s3-eu-west-1.amazonaws.com/prod-ucs-content-store-eu-west/content/pii:S2468823125006157/fx34/THUMBNAIL/image/gif/68ec2c9cbb2df99fd16f24b11666d722/fx34.sml fx34 fx34.sml sml 10127 164 188 IMAGE-THUMBNAIL 1-s2.0-S2468823125006157-fx35.sml https://s3-eu-west-1.amazonaws.com/prod-ucs-content-store-eu-west/content/pii:S2468823125006157/fx35/THUMBNAIL/image/gif/c7f75076c8c297a3391628c998fc81e4/fx35.sml fx35 fx35.sml sml 5945 47 215 IMAGE-THUMBNAIL 1-s2.0-S2468823125006157-fx30.sml https://s3-eu-west-1.amazonaws.com/prod-ucs-content-store-eu-west/content/pii:S2468823125006157/fx30/THUMBNAIL/image/gif/a07978084bd87efe31076e0c24fa52a4/fx30.sml fx30 fx30.sml sml 9478 121 219 IMAGE-THUMBNAIL 1-s2.0-S2468823125006157-fx31.sml https://s3-eu-west-1.amazonaws.com/prod-ucs-content-store-eu-west/content/pii:S2468823125006157/fx31/THUMBNAIL/image/gif/081d008c9276686d3e3d599810bd6908/fx31.sml fx31 fx31.sml sml 10038 164 188 IMAGE-THUMBNAIL 1-s2.0-S2468823125006157-fx4.sml https://s3-eu-west-1.amazonaws.com/prod-ucs-content-store-eu-west/content/pii:S2468823125006157/fx4/THUMBNAIL/image/gif/9dbc3d683b9a0ff544124bca8e5684cb/fx4.sml fx4 fx4.sml sml 10263 163 189 IMAGE-THUMBNAIL 1-s2.0-S2468823125006157-fx36.sml https://s3-eu-west-1.amazonaws.com/prod-ucs-content-store-eu-west/content/pii:S2468823125006157/fx36/THUMBNAIL/image/gif/c39f98f0ebda7fd21550571261529a48/fx36.sml fx36 fx36.sml sml 9972 150 219 IMAGE-THUMBNAIL 1-s2.0-S2468823125006157-fx3.sml https://s3-eu-west-1.amazonaws.com/prod-ucs-content-store-eu-west/content/pii:S2468823125006157/fx3/THUMBNAIL/image/gif/32b0d2195a2884013a8075b93780e509/fx3.sml fx3 fx3.sml sml 11646 149 219 IMAGE-THUMBNAIL 1-s2.0-S2468823125006157-fx37.sml https://s3-eu-west-1.amazonaws.com/prod-ucs-content-store-eu-west/content/pii:S2468823125006157/fx37/THUMBNAIL/image/gif/44dfe2031472d31898fd607b59d000be/fx37.sml fx37 fx37.sml sml 10166 164 188 IMAGE-THUMBNAIL 1-s2.0-S2468823125006157-fx2.sml https://s3-eu-west-1.amazonaws.com/prod-ucs-content-store-eu-west/content/pii:S2468823125006157/fx2/THUMBNAIL/image/gif/1ae4835b8adb3ecee9c714dac2b30fa5/fx2.sml fx2 fx2.sml sml 10971 119 219 IMAGE-THUMBNAIL 1-s2.0-S2468823125006157-fx38.sml https://s3-eu-west-1.amazonaws.com/prod-ucs-content-store-eu-west/content/pii:S2468823125006157/fx38/THUMBNAIL/image/gif/aa854f51ad254f55f1016a576486481b/fx38.sml fx38 fx38.sml sml 4541 27 219 IMAGE-THUMBNAIL 1-s2.0-S2468823125006157-fx1.sml https://s3-eu-west-1.amazonaws.com/prod-ucs-content-store-eu-west/content/pii:S2468823125006157/fx1/THUMBNAIL/image/gif/d3636f3a8d8b0b7f1e1d6a664d6ccd64/fx1.sml fx1 fx1.sml sml 10258 164 188 IMAGE-THUMBNAIL 1-s2.0-S2468823125006157-fx39.sml https://s3-eu-west-1.amazonaws.com/prod-ucs-content-store-eu-west/content/pii:S2468823125006157/fx39/THUMBNAIL/image/gif/0ae42cc63d28db9f7c2cf0946d0c4d75/fx39.sml fx39 fx39.sml sml 8313 135 219 IMAGE-THUMBNAIL 1-s2.0-S2468823125006157-gr1.sml https://s3-eu-west-1.amazonaws.com/prod-ucs-content-store-eu-west/content/pii:S2468823125006157/gr1/THUMBNAIL/image/gif/8645d14cdb934032a6e38ccb1abe4b1f/gr1.sml gr1 gr1.sml sml 8168 80 219 IMAGE-THUMBNAIL 1-s2.0-S2468823125006157-fx8.sml https://s3-eu-west-1.amazonaws.com/prod-ucs-content-store-eu-west/content/pii:S2468823125006157/fx8/THUMBNAIL/image/gif/a09b917c57664480754add1b2ce62d76/fx8.sml fx8 fx8.sml sml 10499 164 201 IMAGE-THUMBNAIL 1-s2.0-S2468823125006157-fx7.sml https://s3-eu-west-1.amazonaws.com/prod-ucs-content-store-eu-west/content/pii:S2468823125006157/fx7/THUMBNAIL/image/gif/2935f999c9e9e66efaf90e5a99c5a424/fx7.sml fx7 fx7.sml sml 10285 164 189 IMAGE-THUMBNAIL 1-s2.0-S2468823125006157-fx6.sml https://s3-eu-west-1.amazonaws.com/prod-ucs-content-store-eu-west/content/pii:S2468823125006157/fx6/THUMBNAIL/image/gif/092d9f41229c8e0705147bd13b98b5ae/fx6.sml fx6 fx6.sml sml 10244 131 219 IMAGE-THUMBNAIL 1-s2.0-S2468823125006157-fx5.sml https://s3-eu-west-1.amazonaws.com/prod-ucs-content-store-eu-west/content/pii:S2468823125006157/fx5/THUMBNAIL/image/gif/06f89d2827539a6891b96afdd0ce4a49/fx5.sml fx5 fx5.sml sml 12224 131 219 IMAGE-THUMBNAIL 1-s2.0-S2468823125006157-gr5.sml https://s3-eu-west-1.amazonaws.com/prod-ucs-content-store-eu-west/content/pii:S2468823125006157/gr5/THUMBNAIL/image/gif/c7d1f9e7fd6fdcb9882738817ff21a8f/gr5.sml gr5 gr5.sml sml 23152 147 219 IMAGE-THUMBNAIL 1-s2.0-S2468823125006157-gr4.sml https://s3-eu-west-1.amazonaws.com/prod-ucs-content-store-eu-west/content/pii:S2468823125006157/gr4/THUMBNAIL/image/gif/4c800920d5e84ad591c0f5235c342827/gr4.sml gr4 gr4.sml sml 25496 155 219 IMAGE-THUMBNAIL 1-s2.0-S2468823125006157-gr3.sml https://s3-eu-west-1.amazonaws.com/prod-ucs-content-store-eu-west/content/pii:S2468823125006157/gr3/THUMBNAIL/image/gif/166e8f776500ece9767094866a9c1a73/gr3.sml gr3 gr3.sml sml 11938 164 198 IMAGE-THUMBNAIL 1-s2.0-S2468823125006157-gr2.sml https://s3-eu-west-1.amazonaws.com/prod-ucs-content-store-eu-west/content/pii:S2468823125006157/gr2/THUMBNAIL/image/gif/ad1b471290d51f0a538ec92fc5063dcc/gr2.sml gr2 gr2.sml sml 12320 154 219 IMAGE-THUMBNAIL 1-s2.0-S2468823125006157-fx9.sml https://s3-eu-west-1.amazonaws.com/prod-ucs-content-store-eu-west/content/pii:S2468823125006157/fx9/THUMBNAIL/image/gif/39512498008dd9e02f2aeb8a9aa2dce3/fx9.sml fx9 fx9.sml sml 9871 125 219 IMAGE-THUMBNAIL 1-s2.0-S2468823125006157-ga1_lrg.jpg https://s3-eu-west-1.amazonaws.com/prod-ucs-content-store-eu-west/content/pii:S2468823125006157/HIGHRES/image/jpeg/5ec55d462e32c18832ec9780f9377fc2/ga1_lrg.jpg ga1 true ga1_lrg.jpg jpg 207108 725 2213 IMAGE-HIGH-RES 1-s2.0-S2468823125006157-fx10_lrg.jpg https://s3-eu-west-1.amazonaws.com/prod-ucs-content-store-eu-west/content/pii:S2468823125006157/HIGHRES/image/jpeg/9bbfe9356ac7903ba10f6353728aafa3/fx10_lrg.jpg fx10 fx10_lrg.jpg jpg 26176 287 329 IMAGE-HIGH-RES 1-s2.0-S2468823125006157-fx11_lrg.jpg https://s3-eu-west-1.amazonaws.com/prod-ucs-content-store-eu-west/content/pii:S2468823125006157/HIGHRES/image/jpeg/ea6770bd561f1185f7c23e48bfcb4cdc/fx11_lrg.jpg fx11 fx11_lrg.jpg jpg 18243 154 347 IMAGE-HIGH-RES 1-s2.0-S2468823125006157-fx12_lrg.jpg https://s3-eu-west-1.amazonaws.com/prod-ucs-content-store-eu-west/content/pii:S2468823125006157/HIGHRES/image/jpeg/c39987898578409cd8ef1b8299d7936f/fx12_lrg.jpg fx12 fx12_lrg.jpg jpg 47398 384 506 IMAGE-HIGH-RES 1-s2.0-S2468823125006157-fx13_lrg.jpg https://s3-eu-west-1.amazonaws.com/prod-ucs-content-store-eu-west/content/pii:S2468823125006157/HIGHRES/image/jpeg/d024638cb0ccafdc9fb3b355f20cbedc/fx13_lrg.jpg fx13 fx13_lrg.jpg jpg 26209 287 329 IMAGE-HIGH-RES 1-s2.0-S2468823125006157-fx18_lrg.jpg https://s3-eu-west-1.amazonaws.com/prod-ucs-content-store-eu-west/content/pii:S2468823125006157/HIGHRES/image/jpeg/fd7b41d44fc8bee60a668748e28668b2/fx18_lrg.jpg fx18 fx18_lrg.jpg jpg 50271 385 588 IMAGE-HIGH-RES 1-s2.0-S2468823125006157-fx19_lrg.jpg https://s3-eu-west-1.amazonaws.com/prod-ucs-content-store-eu-west/content/pii:S2468823125006157/HIGHRES/image/jpeg/5686a866fa9bceee88ddee293535b70d/fx19_lrg.jpg fx19 fx19_lrg.jpg jpg 26133 286 329 IMAGE-HIGH-RES 1-s2.0-S2468823125006157-fx14_lrg.jpg https://s3-eu-west-1.amazonaws.com/prod-ucs-content-store-eu-west/content/pii:S2468823125006157/HIGHRES/image/jpeg/f9b9f4a3036d38b5df97e564add77b22/fx14_lrg.jpg fx14 fx14_lrg.jpg jpg 20396 153 347 IMAGE-HIGH-RES 1-s2.0-S2468823125006157-sc1_lrg.jpg https://s3-eu-west-1.amazonaws.com/prod-ucs-content-store-eu-west/content/pii:S2468823125006157/HIGHRES/image/jpeg/8b290bde6a694e68541acff1ee76759b/sc1_lrg.jpg sc1 sc1_lrg.jpg jpg 1095134 4418 2659 IMAGE-HIGH-RES 1-s2.0-S2468823125006157-fx15_lrg.jpg https://s3-eu-west-1.amazonaws.com/prod-ucs-content-store-eu-west/content/pii:S2468823125006157/HIGHRES/image/jpeg/102fb83255ae67652e7e42cfda4186ab/fx15_lrg.jpg fx15 fx15_lrg.jpg jpg 50128 384 572 IMAGE-HIGH-RES 1-s2.0-S2468823125006157-fx16_lrg.jpg https://s3-eu-west-1.amazonaws.com/prod-ucs-content-store-eu-west/content/pii:S2468823125006157/HIGHRES/image/jpeg/6ff66319c0bac72ae0d0a928faa27913/fx16_lrg.jpg fx16 fx16_lrg.jpg jpg 26169 287 329 IMAGE-HIGH-RES 1-s2.0-S2468823125006157-fx17_lrg.jpg https://s3-eu-west-1.amazonaws.com/prod-ucs-content-store-eu-west/content/pii:S2468823125006157/HIGHRES/image/jpeg/3f4abe83107a3ce49d6503242fcc24dc/fx17_lrg.jpg fx17 fx17_lrg.jpg jpg 19876 209 347 IMAGE-HIGH-RES 1-s2.0-S2468823125006157-fx21_lrg.jpg https://s3-eu-west-1.amazonaws.com/prod-ucs-content-store-eu-west/content/pii:S2468823125006157/HIGHRES/image/jpeg/3f209df5638264c7105f68bff14924c7/fx21_lrg.jpg fx21 fx21_lrg.jpg jpg 46092 384 497 IMAGE-HIGH-RES 1-s2.0-S2468823125006157-fx22_lrg.jpg https://s3-eu-west-1.amazonaws.com/prod-ucs-content-store-eu-west/content/pii:S2468823125006157/HIGHRES/image/jpeg/430fdd41bae823e75ebd037fc509a9b3/fx22_lrg.jpg fx22 fx22_lrg.jpg jpg 25754 287 325 IMAGE-HIGH-RES 1-s2.0-S2468823125006157-fx23_lrg.jpg https://s3-eu-west-1.amazonaws.com/prod-ucs-content-store-eu-west/content/pii:S2468823125006157/HIGHRES/image/jpeg/3747cafd311fc12d04ba10c685264757/fx23_lrg.jpg fx23 fx23_lrg.jpg jpg 18746 153 352 IMAGE-HIGH-RES 1-s2.0-S2468823125006157-fx24_lrg.jpg https://s3-eu-west-1.amazonaws.com/prod-ucs-content-store-eu-west/content/pii:S2468823125006157/HIGHRES/image/jpeg/33e18fb73d2325de9b97d9666dde2305/fx24_lrg.jpg fx24 fx24_lrg.jpg jpg 47925 384 506 IMAGE-HIGH-RES 1-s2.0-S2468823125006157-fx20_lrg.jpg https://s3-eu-west-1.amazonaws.com/prod-ucs-content-store-eu-west/content/pii:S2468823125006157/HIGHRES/image/jpeg/b1818716e5fa423892c1624eadab6016/fx20_lrg.jpg fx20 fx20_lrg.jpg jpg 16721 143 316 IMAGE-HIGH-RES 1-s2.0-S2468823125006157-fx29_lrg.jpg https://s3-eu-west-1.amazonaws.com/prod-ucs-content-store-eu-west/content/pii:S2468823125006157/HIGHRES/image/jpeg/d571b6724619a66e5d0c1935d6a24d96/fx29_lrg.jpg fx29 fx29_lrg.jpg jpg 17990 236 256 IMAGE-HIGH-RES 1-s2.0-S2468823125006157-fx25_lrg.jpg https://s3-eu-west-1.amazonaws.com/prod-ucs-content-store-eu-west/content/pii:S2468823125006157/HIGHRES/image/jpeg/451faa9fb018b4f927c6a57d50f70884/fx25_lrg.jpg fx25 fx25_lrg.jpg jpg 26099 287 329 IMAGE-HIGH-RES 1-s2.0-S2468823125006157-fx26_lrg.jpg https://s3-eu-west-1.amazonaws.com/prod-ucs-content-store-eu-west/content/pii:S2468823125006157/HIGHRES/image/jpeg/05985bd9718531009f113967ce3ded8a/fx26_lrg.jpg fx26 fx26_lrg.jpg jpg 19281 158 384 IMAGE-HIGH-RES 1-s2.0-S2468823125006157-fx27_lrg.jpg https://s3-eu-west-1.amazonaws.com/prod-ucs-content-store-eu-west/content/pii:S2468823125006157/HIGHRES/image/jpeg/cc51001bb1af023d1d66f1ac9636ef9d/fx27_lrg.jpg fx27 fx27_lrg.jpg jpg 48401 384 513 IMAGE-HIGH-RES 1-s2.0-S2468823125006157-fx28_lrg.jpg https://s3-eu-west-1.amazonaws.com/prod-ucs-content-store-eu-west/content/pii:S2468823125006157/HIGHRES/image/jpeg/63ed17b01ab77b726fd44b1717169eee/fx28_lrg.jpg fx28 fx28_lrg.jpg jpg 26216 287 329 IMAGE-HIGH-RES 1-s2.0-S2468823125006157-gr8_lrg.jpg https://s3-eu-west-1.amazonaws.com/prod-ucs-content-store-eu-west/content/pii:S2468823125006157/HIGHRES/image/jpeg/3eac58b1fc28148c0d0aac1d4c7b16ac/gr8_lrg.jpg gr8 gr8_lrg.jpg jpg 381932 1392 2994 IMAGE-HIGH-RES 1-s2.0-S2468823125006157-gr7_lrg.jpg https://s3-eu-west-1.amazonaws.com/prod-ucs-content-store-eu-west/content/pii:S2468823125006157/HIGHRES/image/jpeg/c855511df91af0f460d71163b18e32dc/gr7_lrg.jpg gr7 gr7_lrg.jpg jpg 332647 1168 3492 IMAGE-HIGH-RES 1-s2.0-S2468823125006157-gr6_lrg.jpg https://s3-eu-west-1.amazonaws.com/prod-ucs-content-store-eu-west/content/pii:S2468823125006157/HIGHRES/image/jpeg/76e4ce0a32e7b9d286432db6760bdc2a/gr6_lrg.jpg gr6 gr6_lrg.jpg jpg 939608 3775 3489 IMAGE-HIGH-RES 1-s2.0-S2468823125006157-fx32_lrg.jpg https://s3-eu-west-1.amazonaws.com/prod-ucs-content-store-eu-west/content/pii:S2468823125006157/HIGHRES/image/jpeg/df0ec772eb46bb3ed9f5c028a2898d06/fx32_lrg.jpg fx32 fx32_lrg.jpg jpg 19360 155 379 IMAGE-HIGH-RES 1-s2.0-S2468823125006157-fx33_lrg.jpg https://s3-eu-west-1.amazonaws.com/prod-ucs-content-store-eu-west/content/pii:S2468823125006157/HIGHRES/image/jpeg/0ec67fb148ac0163c6716578f0e37d14/fx33_lrg.jpg fx33 fx33_lrg.jpg jpg 47932 391 520 IMAGE-HIGH-RES 1-s2.0-S2468823125006157-fx34_lrg.jpg https://s3-eu-west-1.amazonaws.com/prod-ucs-content-store-eu-west/content/pii:S2468823125006157/HIGHRES/image/jpeg/b97bfeb4e2e9717ea71c40228d9a84f4/fx34_lrg.jpg fx34 fx34_lrg.jpg jpg 24275 269 309 IMAGE-HIGH-RES 1-s2.0-S2468823125006157-fx35_lrg.jpg https://s3-eu-west-1.amazonaws.com/prod-ucs-content-store-eu-west/content/pii:S2468823125006157/HIGHRES/image/jpeg/8b281f3049023a8c2a6684f88e1ffd7b/fx35_lrg.jpg fx35 fx35_lrg.jpg jpg 7818 47 215 IMAGE-HIGH-RES 1-s2.0-S2468823125006157-fx30_lrg.jpg https://s3-eu-west-1.amazonaws.com/prod-ucs-content-store-eu-west/content/pii:S2468823125006157/HIGHRES/image/jpeg/4c16c5d753168ce0f5827a5a664dc38b/fx30_lrg.jpg fx30 fx30_lrg.jpg jpg 48944 343 619 IMAGE-HIGH-RES 1-s2.0-S2468823125006157-fx31_lrg.jpg https://s3-eu-west-1.amazonaws.com/prod-ucs-content-store-eu-west/content/pii:S2468823125006157/HIGHRES/image/jpeg/8bb631f523f2c524d49574e755cd4214/fx31_lrg.jpg fx31 fx31_lrg.jpg jpg 26097 287 329 IMAGE-HIGH-RES 1-s2.0-S2468823125006157-fx4_lrg.jpg https://s3-eu-west-1.amazonaws.com/prod-ucs-content-store-eu-west/content/pii:S2468823125006157/HIGHRES/image/jpeg/bddfb3a6004fe0b947686c4470b6be12/fx4_lrg.jpg fx4 fx4_lrg.jpg jpg 23892 268 310 IMAGE-HIGH-RES 1-s2.0-S2468823125006157-fx36_lrg.jpg https://s3-eu-west-1.amazonaws.com/prod-ucs-content-store-eu-west/content/pii:S2468823125006157/HIGHRES/image/jpeg/523f7b16cfa7ee36d97ce41380eb8045/fx36_lrg.jpg fx36 fx36_lrg.jpg jpg 35970 321 468 IMAGE-HIGH-RES 1-s2.0-S2468823125006157-fx3_lrg.jpg https://s3-eu-west-1.amazonaws.com/prod-ucs-content-store-eu-west/content/pii:S2468823125006157/HIGHRES/image/jpeg/dbc40d6f540e77dbedbd241ac6d84252/fx3_lrg.jpg fx3 fx3_lrg.jpg jpg 41447 322 474 IMAGE-HIGH-RES 1-s2.0-S2468823125006157-fx37_lrg.jpg https://s3-eu-west-1.amazonaws.com/prod-ucs-content-store-eu-west/content/pii:S2468823125006157/HIGHRES/image/jpeg/7403a9e21156d74f310d538547a39cc4/fx37_lrg.jpg fx37 fx37_lrg.jpg jpg 24298 269 309 IMAGE-HIGH-RES 1-s2.0-S2468823125006157-fx2_lrg.jpg https://s3-eu-west-1.amazonaws.com/prod-ucs-content-store-eu-west/content/pii:S2468823125006157/HIGHRES/image/jpeg/bf99c3c2d75717ed74b21c935326da6e/fx2_lrg.jpg fx2 fx2_lrg.jpg jpg 13947 130 240 IMAGE-HIGH-RES 1-s2.0-S2468823125006157-fx38_lrg.jpg https://s3-eu-west-1.amazonaws.com/prod-ucs-content-store-eu-west/content/pii:S2468823125006157/HIGHRES/image/jpeg/fe8c63f35472ceb2e397e5341a384220/fx38_lrg.jpg fx38 fx38_lrg.jpg jpg 11327 46 370 IMAGE-HIGH-RES 1-s2.0-S2468823125006157-fx1_lrg.jpg https://s3-eu-west-1.amazonaws.com/prod-ucs-content-store-eu-west/content/pii:S2468823125006157/HIGHRES/image/jpeg/cdc66665aec3534d534cc48fb6fb27a2/fx1_lrg.jpg fx1 fx1_lrg.jpg jpg 23744 269 309 IMAGE-HIGH-RES 1-s2.0-S2468823125006157-fx39_lrg.jpg https://s3-eu-west-1.amazonaws.com/prod-ucs-content-store-eu-west/content/pii:S2468823125006157/HIGHRES/image/jpeg/966ba2864dc81e7f9eef44f49a4941a5/fx39_lrg.jpg fx39 fx39_lrg.jpg jpg 40136 363 587 IMAGE-HIGH-RES 1-s2.0-S2468823125006157-gr1_lrg.jpg https://s3-eu-west-1.amazonaws.com/prod-ucs-content-store-eu-west/content/pii:S2468823125006157/HIGHRES/image/jpeg/f8035a60560fd0a54f82ac23c4a15d40/gr1_lrg.jpg gr1 gr1_lrg.jpg jpg 341523 1277 3492 IMAGE-HIGH-RES 1-s2.0-S2468823125006157-fx8_lrg.jpg https://s3-eu-west-1.amazonaws.com/prod-ucs-content-store-eu-west/content/pii:S2468823125006157/HIGHRES/image/jpeg/1c20c3fea021523d8bff739353a55eb3/fx8_lrg.jpg fx8 fx8_lrg.jpg jpg 15850 196 240 IMAGE-HIGH-RES 1-s2.0-S2468823125006157-fx7_lrg.jpg https://s3-eu-west-1.amazonaws.com/prod-ucs-content-store-eu-west/content/pii:S2468823125006157/HIGHRES/image/jpeg/cac7773d4190424214c28dbba7845116/fx7_lrg.jpg fx7 fx7_lrg.jpg jpg 23921 269 310 IMAGE-HIGH-RES 1-s2.0-S2468823125006157-fx6_lrg.jpg https://s3-eu-west-1.amazonaws.com/prod-ucs-content-store-eu-west/content/pii:S2468823125006157/HIGHRES/image/jpeg/03a051503229860ff7fde3ce1ef07b37/fx6_lrg.jpg fx6 fx6_lrg.jpg jpg 44042 322 538 IMAGE-HIGH-RES 1-s2.0-S2468823125006157-fx5_lrg.jpg https://s3-eu-west-1.amazonaws.com/prod-ucs-content-store-eu-west/content/pii:S2468823125006157/HIGHRES/image/jpeg/c51524a047c70486102174db97aeea35/fx5_lrg.jpg fx5 fx5_lrg.jpg jpg 16186 144 240 IMAGE-HIGH-RES 1-s2.0-S2468823125006157-gr5_lrg.jpg https://s3-eu-west-1.amazonaws.com/prod-ucs-content-store-eu-west/content/pii:S2468823125006315/HIGHRES/image/jpeg/47b9ee1c16139b82a0fe6f70b97d4c18/gr5_lrg.jpg gr5 gr5_lrg.jpg jpg 1032129 2339 3492 IMAGE-HIGH-RES 1-s2.0-S2468823125006157-gr4_lrg.jpg https://s3-eu-west-1.amazonaws.com/prod-ucs-content-store-eu-west/content/pii:S2468823125006315/HIGHRES/image/jpeg/e3509cbdbbac4a22aa88451046fda94b/gr4_lrg.jpg gr4 gr4_lrg.jpg jpg 2284188 2475 3492 IMAGE-HIGH-RES 1-s2.0-S2468823125006157-gr3_lrg.jpg https://s3-eu-west-1.amazonaws.com/prod-ucs-content-store-eu-west/content/pii:S2468823125006315/HIGHRES/image/jpeg/fca7024c3d0a243d4d77393fb8840cd8/gr3_lrg.jpg gr3 gr3_lrg.jpg jpg 604424 2476 2992 IMAGE-HIGH-RES 1-s2.0-S2468823125006157-gr2_lrg.jpg https://s3-eu-west-1.amazonaws.com/prod-ucs-content-store-eu-west/content/pii:S2468823125006315/HIGHRES/image/jpeg/e2c28e455bea5c7b1120143a851c0672/gr2_lrg.jpg gr2 gr2_lrg.jpg jpg 424133 1866 2660 IMAGE-HIGH-RES 1-s2.0-S2468823125006157-fx9_lrg.jpg https://s3-eu-west-1.amazonaws.com/prod-ucs-content-store-eu-west/content/pii:S2468823125006157/HIGHRES/image/jpeg/7a39fa8a2c8bfcaa40ae7fc7c9ba4381/fx9_lrg.jpg fx9 fx9_lrg.jpg jpg 43240 314 551 IMAGE-HIGH-RES 1-s2.0-S2468823125006157-mmc1.docx https://s3-eu-west-1.amazonaws.com/prod-ucs-content-store-eu-west/content/pii:S2468823125006157/mmc1/MAIN/application/vnd.openxmlformats-officedocument.wordprocessingml.document/bc646c20dacf22e526a9c9997ed50079/mmc1.docx mmc1 mmc1.docx docx 12749237 APPLICATION 1-s2.0-S2468823125006157-si1.svg https://s3-eu-west-1.amazonaws.com/prod-ucs-content-store-eu-west/content/pii:S2468823125006157/image/svg+xml/77e5fd8827cb3c7421901d6570ae6714/si1.svg si1 si1.svg svg 7798 ALTIMG 1-s2.0-S2468823125006157-si2.svg https://s3-eu-west-1.amazonaws.com/prod-ucs-content-store-eu-west/content/pii:S2468823125006157/image/svg+xml/49fe8ce4558b41064ba3d8d1b7d0119b/si2.svg si2 si2.svg svg 8541 ALTIMG 1-s2.0-S2468823125006157-si3.svg https://s3-eu-west-1.amazonaws.com/prod-ucs-content-store-eu-west/content/pii:S2468823125006157/image/svg+xml/781f36e7b48d94ae6da44b94daa20f43/si3.svg si3 si3.svg svg 5047 ALTIMG MCAT 115429 115429 S2468-8231(25)00615-7 10.1016/j.mcat.2025.115429 Elsevier B.V. Scheme 1 The Synthesis of 1,4-Disubstituted Triazoles from N-propargylated Indole-Carbaldehyde [30–34]. Scheme 1 Fig. 1 Schematic representation of the synthesis pathways for CuO, BWO, and COB. Fig 1 Fig. 2 (a) XRD pattern and (b) FTIR pattern of BWO, CuO, 10COB, 20COB, and 30COB catalyst. Fig 2 Fig. 3 (a) UV vis-DRS spectra, (b) Tauc’s plot, (c) PL spectra of BWO, CuO, 10COB, 20COB, and 30COB catalysts, and (d) EIS-Nyquist spectra of the BWO, CuO, and 20COB catalysts. Fig 3 Fig. 4 The FE-SEM image of 20COB composite (a) is magnified at 500 nm, (b) is an EDS spectrum, and (c-g) is the elemental mapping spectrum of Bi, W, O, and Cu. Fig 4 Fig. 5 HR-TEM images of the 20COB composite: (a) and (b) at a magnification of 100 nm, (c) at 20 nm, (d) SAED pattern, (e) d-spacing calculation spectra of BWO and CuO in the 20COB composite, and (f) particle size of CuO in the 20COB composite. Fig 5 Fig. 6 XPS analysis of 20COB composite (a) the survey spectrum, and deconvoluted spectra for (b) Bi 4f, (c) W 4f, (d) O 1 s, and (e) Cu 2p. Fig 6 Fig. 7 (a) Nitrogen adsorption–desorption profiles and (b) BJH pore size distribution of pristine CuO, BWO, and composite 20COB. Fig 7 Fig. 8 Plausible photocatalytic reaction mechanism. Fig 8 Table 1 BET surface area, average pore diameter, and total pore volume of pristine CuO, BWO, and the 20COB composite. Table 1 Materials Surface area (m²/g) Pore diameter (nm) Pore volume (cm³/g) CuO 41.683 2.734 0.196 BWO 18.711 1.220 0.041 20COB 12.266 1.676 0.048 Table 2 Optimization Conditions. a , b . Table 2 Entry Catalyst Condition Solvent Time (h) Yield ( %) b 1 – 12 W blue LED/AA ACN 36 NR 2 NaOH 12 W blue LED/AA ACN 36 NR 3 Sodium ascorbate 12 W blue LED/AA ACN 36 NR 4 Ascorbic acid 12 W blue LED/AA ACN 36 NR 5 BWO 12 W blue LED/AA ACN 36 NR 6 CuO 12 W blue LED/AA ACN 8 55 7 Cu₂O 12 W blue LED/AA ACN 8 53 8 1:1 CuO/BWO 12 W blue LED/AA ACN 8 62 9 10COB 12 W blue LED/AA ACN 8 69 10 20COB 12 W blue LED/AA ACN 8 76 11 30COB 12 W blue LED/AA ACN 8 76 12 20COB 12 W blue LED/N2 ACN 8 91 13 20COB Dark/AA ACN 8 Trace 14 20COB 240 W visible light/AA ACN 8 56 15 20COB 8 W UV light/AA ACN 8 NR 16 20COB Dark/N2 ACN 36 Trace 17 20COB Reflux ACN 8 51 18 20COBc 12 W blue LED/AA ACN 8 Trace 19 20COBd 12 W blue LED/AA ACN 8 Trace 20 20COB 12 W blue LED/AA H₂O 8 Trace 21 20COB 12 W blue LED/AA EtOH 8 Trace 22 20COB 12 W blue LED/AA Toluene 8 Trace 23 20COB 12 W blue LED/AA DCM 8 46 24 20COB 12 W blue LED/AA DMF 8 59 25 20COB 12 W blue LED/AA DMSO 8 63 a Reaction conditions: Propargylated indole carbaldehyde (183 mg, 1.0 equiv., 1.0 mmol), benzyl chloride (0.1 mL, 1.0 equiv., 1.0 mmol), sodium azide (65 mg, 1.0 equiv., 1.0 mmol), solvent (3 mL), catalyst (18.3 mg, 10 wt %), irradiation with 12 W blue LED (λ = 450−495 nm, frequency = 6.66 × 1014 Hz, luminous intensity ≈ 19.845 cd/m2) at ambient temperature. Abbreviations: NR = no reaction. AA = atmospheric air, DMSO = dimethyl sulfoxide, DMF = dimethyl formamide, EtOH = ethyl alcohol, DCM = dichloromethane. b Isolated yields. cWith NaOH. dWith sodium ascorbate. Table 3 Derivatives of the 20COB-catalyzed photoclick reaction. a , b . Table 3 S.No. Alkyne Halide Product TON TOF(h-1) Yield(%) b 4a Image, table 3 Image, table 3 Image, table 3 33.7 4.2 91 4b Image, table 3 Image, table 3 Image, table 3 30.8 3.9 83 4c Image, table 3 Image, table 3 Image, table 3 29.6 3.7 80 4d Image, table 3 Image, table 3 Image, table 3 31.3 3.9 85 4e Image, table 3 Image, table 3 Image, table 3 30.8 3.9 83 4f Image, table 3 Image, table 3 Image, table 3 30.4 3.8 82 4 g Image, table 3 Image, table 3 Image, table 3 29.9 3.7 81 4h Image, table 3 Image, table 3 Image, table 3 20.7 2.6 56 4i Image, table 3 Image, table 3 Image, table 3 17.4 2.2 47 4j Image, table 3 Image, table 3 Image, table 3 23.3 2.9 63 4k Image, table 3 Image, table 3 Image, table 3 24.4 3.1 66 4l Image, table 3 Image, table 3 Image, table 3 26.3 3.3 71 4m Image, table 3 Image, table 3 Image, table 3 24.3 3.0 66 a Reaction conditions: Propargylated indole carbaldehyde (183 mg, 1.0 equiv., 1.0 mmol), sodium azide (65 mg, 1.0 equiv., 1.0 mmol), benzyl chloride (0.1 mL, 1.0 equiv., 1.0 mmol), solvent (3 mL), catalyst (18.3 mg, 10 wt %), irradiation with 12 W blue LED (λ = 450−495 nm, frequency = 6.66 × 1014 Hz, luminous intensity ≈ 19.845 cd/m2) at ambient temperature. b Isolated yields. TON = number of moles of formed product/number of moles of Cu in the catalyst, TOF = TON/reaction time (h). TON/TOF is calculated with respect to Cu species. Research Paper Blue LED-induced photocatalytic “Click” reaction facilitated by CuO/Bi2WO₆ for synthesising 1,4-disubstituted 1,2,3-triazoles Murugesan Shobika Writing – original draft Methodology Investigation Formal analysis a Selvaraj Mohana Roopan Writing – review & editing Supervision Conceptualization a ⁎ Jagannathan Madhavan Formal analysis Data curation b a Chemistry of Heterocycles and Natural Product Research Laboratory, Department of Chemistry, School of Advanced Sciences, Vellore Institute of Technology, Vellore 632014, Tamil Nadu, India Chemistry of Heterocycles and Natural Product Research Laboratory Department of Chemistry School of Advanced Sciences Vellore Institute of Technology Vellore Tamil Nadu 632014 India aChemistry of Heterocycles and Natural Product Research Laboratory, Department of Chemistry, School of Advanced Sciences, Vellore Institute of Technology, Vellore 632014, Tamil Nadu, India b Department of Chemistry, Thiruvalluvar University, Vellore, Tamil Nadu 632115, India Department of Chemistry Thiruvalluvar University Vellore Tamil Nadu 632115 India bDepartment of Chemistry, Thiruvalluvar University, Vellore, Tamil Nadu 632115, India ⁎ Correspondence authors. Azide-alkyne cycloaddition (CuAAC) is a key process in modern chemistry, enabling the efficient synthesis of molecules. Visible-light-induced photoredox catalysis offers an eco-friendly alternative to conventional thermal catalytic methods. In this study, CuO/Bi2WO6 (COB) heterojunctions are explored as photocatalysts for CuAAC under blue LED light, with minimal CuO loading on Bi2WO6 (BWO), demonstrating high efficacy in synthesizing disubstituted triazoles. The COB heterojunctions were thoroughly characterized using various techniques, including XRD, HRTEM, FTIR, BET, UV–vis DRS, FESEM, XPS, and EIS. HRTEM analysis indicated that the CuO in the composite exhibited an average size of 17.324 nm. The interaction between CuO and BWO promotes an electron transfer mechanism, improving photocatalytic efficiency and enabling Cu(II) to be photochemically reduced to Cu(I) in situ. Photocatalytic degradation studies and reactive oxygen species inhibition were used to support the mechanism. The COB catalyst achieved up to 91 % yield, with a high turnover number (TON: 33.7) and turnover frequency (TOF: 4.2 h⁻¹), and demonstrated high reusability over six cycles. A heterogeneity test confirmed the heterogeneity and non-leaching properties of the catalyst. These findings emphasize the potential of COB as a scalable, sustainable, and efficient catalyst for visible-light-driven copper-catalysed click reactions in modern synthetic chemistry. Graphical abstract Image, graphical abstract Keywords CuO Bi2WO6 Heterojunction Photocatalyst Blue LED Click reaction Triazole Redox catalyst 1 Introduction The discovery of new reaction pathways continues to advance synthetic organic chemistry. Among these, azide–alkyne cycloaddition (AAC) reaction is widely used due to its high selectivity for forming 1,2,3-triazoles, important structures in drugs for treating diabetes, cancer, and other diseases [1–8]. Since its introduction by Sharpless in 2001, click chemistry has emerged as a powerful and reliable approach in synthetic chemistry, drug discovery, biology, medical chemistry, and materials science [9–11]. The copper-catalysed azide–alkyne cycloaddition (CuAAC) remains the most commonly utilized click reaction, typically employing homogeneous Cu(I) or Cu(II) salts [12,13]. However, these conventional systems often suffer from limitations such as poor reusability, catalyst instability, and copper contamination issues that restrict their use in pharmaceutical and industrial applications. To overcome these challenges, visible-light-driven photo-redox catalysis has gained attention as a green alternative, as it has been widely reported in the literature as a powerful and sustainable strategy that utilizes light-induced electron transfer to drive chemical reactions, enabling the efficient synthesis of valuable compounds under mild conditions with broad applications in energy conversion and green chemistry [14–19]. It can activate click reactions while suppressing side reactions, using light as a clean energy source. Blue LEDs, with their high energy output in the visible spectrum, serve as an ideal light source for such reactions [20–22]. Nonetheless, most copper-based photocatalysts remain homogeneous, making recovery and reuse difficult. Heterogeneous systems offer a promising solution, with improved separation, environmental compatibility, and lower toxicity [23]. Bismuth tungstate (Bi₂WO₆ or BWO) is a visible-light-active semiconductor with excellent thermal and chemical stability and a layered structure that facilitates charge separation, making it a suitable support for photocatalysis [24,25]. However, its limitations, such as poor visible-light absorption, limited surface area, and rapid charge recombination reduce its catalytic efficiency [26]. To improve its performance, copper oxide (CuO), a narrow-bandgap semiconductor (∼2.0 eV) with high electrochemical activity and thermal stability, can be introduced [27–29]. CuO enhances light absorption and provides active sites for catalysis, but its use in CuAAC reactions has been relatively unexplored. Recent studies suggest that combining CuO with BWO could improve photocatalytic performance by enhancing charge separation and light utilization. Although some studies have examined thermal CuAAC reactions using these materials, the role of light and the underlying photo-redox mechanisms remain underexplored. In particular, no studies have addressed light-induced charge transfer, reactive oxygen species (ROS) generation, or photocatalytic radical pathways in such systems. In this study, we designed a CuO/Bi₂WO₆ (COB) heterojunction photocatalyst for visible-light-driven CuAAC reactions under blue LED irradiation. The Z-scheme heterojunction structure enhances charge separation and drives both oxidation and reduction processes essential for triazole formation. The COB catalyst demonstrated high selectivity, excellent stability, and recyclability (up to six cycles), achieving yields up to 91 % with excellent turnover number (TON) and turnover frequency (TOF). This work provides a sustainable and efficient photocatalytic system for green click chemistry, highlighting its potential in environmentally friendly organic synthesis. Scheme 1 . 2 Experimental section 2.1 Description of materials used The chemicals and reagents utilized for this experiment were obtained from Avra Laboratories Pvt. Ltd., Sigma-Aldrich, and TCI Pvt. Ltd. and were used without any extra purification. 2.2 Synthesis of COB catalyst The synthesis of BWO was carried out using the approach reported in our previous study [26,35]. Briefly, BWO was prepared via a hydrothermal process. Bi(NO3)3·5H2O (970.14 mg) was dissolved in 40 mL of water to achieve a 0.05 M concentration of solution A, whereas solution B was made by dissolving Na2WO4·2H2O (329.86 mg) in 20 mL of water to achieve the same concentration. The solutions (A and B) were stirred together for 2 h, followed by pH adjustment to 2 using 0.3 mL of 1 M HNO3. The obtained mixture was then transferred to a Teflon-lined autoclave (100 mL capacity) and treated hydrothermally at 160 °C for 24 h. After cooling to rt naturally, the resulting product was isolated by centrifugation, rinsed with ethanol and water, and then dried overnight at 60 °C, yielding the final BWO. Meanwhile, pristine CuO nanorods were synthesized using a straightforward precipitation approach, in which sodium hydroxide was added to an aqueous solution of copper acetate monohydrate, and the mixture was stirred for 4 h. The obtained product was repeatedly washed with deionized water to remove impurities, dried overnight at 80 °C, and subsequently calcined at 450 °C for further processing. To fabricate the composite, a simple grinding method was employed, wherein measured amounts of CuO (10 %, 20 %, and 30 % by weight) were added to BWO and ground for 20–30 min to ensure uniform dispersion. The well-mixed compound was loaded into a crucible and calcined at 200 °C for 2 h. The final composite was named x-COB, where “x” indicates the CuO weight percentage (10 %, 20 %, or 30 %) used in the synthesis (Fig. 1 ). 2.3 Characterization information For characterization details, see the supplementary data (Text S2). 2.4 General protocol for photocatalytic click reaction A mixture of propargyl indole-3-carbaldehyde (183 mg, 1.0 mmol), sodium azide (65 mg, 1.0 mmol), benzyl chloride (0.1 mL, 1.0 mmol), and 10 wt % of the 20COB catalyst has been prepared in a 15 mL glass vial containing 3 mL of acetonitrile. The reaction was carried out at ambient temperature under constant stirring while being irradiated with blue LEDs (12 W, 450–495 nm). Progress was monitored by TLC, and upon completion, the reaction was quenched with crushed ice. The resulting mixture was extracted with ethyl acetate, dried over anhydrous Na2SO4, and concentrated using a rotary evaporator. The crude product was purified by column chromatography (ethyl acetate/petroleum ether) to afford compound 4a as a white solid. Additionally, UV–vis analysis revealed that the catalyst has an absorption edge near 450 nm, which closely matches the emission peak of the blue LED used in the experiments. This spectral alignment enables efficient light absorption, enhances charge carrier generation, and improves photocatalytic efficiency under mild conditions. 3 Results and discussion 3.1 XRD analysis X-Ray Diffraction (XRD) is a reliable technique for studying the phase and structure of nanocrystals, covering diffraction angles (2θ) from 10° to 90° Fig. 2a presents the XRD patterns for BWO, CuO, and COB nanocomposites. The XRD pattern of CuO closely matches the monoclinic phase of CuO (JCPDS No. 45–0937), with no signs of impurities [36]. The observed CuO peaks at 32.86°, 35.88°, 39.03°, 49.13°, 53.79°, 58.58°, and 61.86° correspond to the (110), (002), (111), (202), (020), (202), and (113) planes. The results also verify the formation of BWO, consistent with JCPDS card #39–0256 [37]. The BWO peaks appear at 28.72°, 33.28°, 47.53°, 56.36°, and 58.93°, corresponding to planes (131), (200), (202), (133), and (262), confirming an orthorhombic phase [38,39]. In the 20COB nanocomposite, the BWO peaks show slight shifts to 2θ values of 28.09°, 32.65°, 35.31°, 38.50°, 46.92°, 55.59°, and 58.35°. The average crystallite sizes for pristine BWO and CuO were calculated by applying the Scherrer equation (Eq. (1)): (1) D = K λ / ( β cos θ ) In this equation, D denotes the crystallite size, λ represents the X-ray wavelength (0.154 nm), K is the Scherrer constant (0.9), and β corresponds to the full width at half maximum (FWHM). Pristine BWO and CuO exhibited crystallite sizes of 20.7 nm and 8.5 nm, respectively. In the 20COB nanocomposite, the size decreased to 19.7 nm, indicating the confined addition of CuO and its important role in the composite. 3.2 FTIR analysis FTIR analysis was employed to identify the surface functional groups present in the synthesized materials [40], providing insights into their bonding and chemical composition. As shown in Fig. 2b, the peaks were observed for BWO at 425 cm⁻¹, 863 cm⁻¹, and 737 cm⁻¹, corresponding to the W−O, Bi−O, and O−W−O stretching vibrations [41]. Additionally, a distinct peak between 400 and 600 cm⁻¹ was observed for CuO, which is linked to Cu−O stretching vibrations [42]. These results confirm that the synthesized nanocomposite contains both BWO and CuO. 3.3 UV–vis DRS analysis The optical behaviour of the synthesized materials was thoroughly characterized using UV–vis DRS, which provides valuable insights into their photocatalytic potential. These properties depend on factors like size, shape, and crystal structure. The absorption range and band gap energy obtained from UV–vis analysis are key parameters influencing photocatalytic efficiency. As illustrated in Fig. 3a , CuO exhibits a strong light absorption across 300–800 nm along with a narrow band gap, indicating its potential for effective photocatalytic performance. On the other hand, BWO shows a distinct absorption edge around 455 nm in the visible spectrum [43]. Notably, when CuO was coupled with BWO, the absorption edge moved to a longer wavelength (red shift), indicating better photocatalytic efficacy in visible light. Furthermore, the bandgap energies of the materials were determined using Tauc’s plot and the corresponding equation (Eq. (2)). (2) ( α h ν ) n = A ( h ν − E g ) where α is the absorption coefficient, A is a constant, hν represents photon energy, Eg​ denotes the bandgap energy, and n indicates the nature of the electronic transition (½ for indirect and 2 for direct transitions). The Tauc plots of (αhν)² versus hν (Fig. 3b) indicate that the bandgaps of BWO, CuO, and 20COB are 2.84 eV, 1.28 eV, and 2.18 eV, respectively. Notably, the intermediate bandgap of 20COB appears to facilitate its improved photocatalytic activity. To gain further insights into the photocatalytic mechanism, valence band X-ray photoelectron spectroscopy (VB-XPS) was employed to determine the valence band (VB) potentials (EVB) of BWO and CuO. As shown in Fig. S1a and S1b, the EVB​ values for BWO and CuO were measured to be 3.28 eV and 1.40 eV, respectively, with their corresponding bandgap energies reconfirmed as 2.84 eV and 1.28 eV (Fig. 3b). Using these values, the conduction band (CB) potentials (ECB) were derived using Eq. (3). (3) E CB = E VB − E g Where, EVB and ECB denote the energy levels at the valence and conduction band edges, respectively, while Eg denotes the bandgap energy. Based on these calculations, CuO exhibits VB and CB positions at 1.40 eV and 0.12 eV, while BWO shows corresponding values of 3.28 eV and 0.44 eV. These band edge positions confirm that the system follows a Z-scheme mechanism, enabling efficient charge transfer and improved photocatalytic performance. 3.4 PL and EIS analysis Photoluminescence (PL) spectroscopy was used to study the recombination behaviour of photoinduced electrons and holes in the 20COB composite [44]. A decrease in PL intensity typically reflects a lower electron–hole recombination rate. As illustrated in Fig. 3c, the PL signal of the 20COB composite decreases with increasing CuO content, suggesting more efficient separation of photogenerated carriers. This improvement can be attributed to the formation of a CuO/BWO heterojunction, which effectively narrows the bandgap and promotes charge carrier separation. Additionally, the electrochemical impedance spectroscopy (EIS) measurements were conducted for BWO, CuO, and 20COB catalysts, and the resulting Nyquist plots are presented in Fig. 3d. The EIS plot of the 20COB composite shows a straight line at low frequencies in the Nyquist plot, which indicates Warburg impedance. This means ion diffusion plays a key role in the electrochemical process. The porous and rough surface of the COB material helps ion movement, supporting diffusion-controlled behaviour. The absence of a clear semicircle at high frequencies further suggests low charge-transfer resistance and fast interfacial charge transport. 3.5 Morphology analysis The structure and shape of the 20COB composite were studied using FE-SEM analysis. The images (Fig. 4a ) show that CuO has a nanorod shape, while BWO has a nanosheet shape, confirming that the CuO nanorods are well-integrated with the BWO sheets. Energy-dispersive X-ray spectroscopy (EDS) analysis (Fig. 4b) confirmed the presence of Bi, W, O, and Cu in the composite. Additionally, elemental mapping images (Fig. 4c–g) demonstrate a homogeneous distribution of these elements, particularly showing that CuO is uniformly dispersed across the BWO surface. The HRTEM images (Fig. 5a –c) show that BWO (nanosheet-like) and CuO (nanorod-like) form a heterojunction. In the 20COB composite (Fig. 5e), different lattice fringes are observed. The interplanar distances of 0.313 nm (Fig. S4b) and 0.275 nm (Fig. S4c) correspond to the (131) [45] and (200) planes of BWO, while the 0.235 nm distance (Fig. S4d) corresponds to the (111) plane of CuO [45]. The selectedarea electron diffraction (SAED) pattern (Fig. 5d) displays distinct diffraction rings, confirming the polycrystalline nature and high crystallinity of the 20COB composite. These findings further verify the successful formation of heterojunctions between BWO and CuO. Such coupling results in a modified band structure, effectively narrowing the bandgap and facilitating improved separation of photogenerated electron–hole pairs. Additionally, the average particle size of CuO within the 20COB composite was found to be 17.324 nm (Fig. 5f). 3.6 XPS analysis The elemental composition and oxidation states of the BWO, CuO, and the 20COB nanocomposite were determined by XPS analysis, as depicted in Fig. 6 . The survey spectra (Fig. 6a) revealed the presence of Bi, W, and O in pure BWO; Cu and O in pure CuO; and Bi, W, O, and Cu in the 20COB composite. Fig. 6b showed the Bi 4f chemical states, with peaks at 164.28 eV for BWO and 164.43 eV for 20COB corresponding to Bi 4f5/2, and peaks at 158.98 and 159.12 eV corresponding to Bi 4f7/2, indicating Bi3+. From Fig. 6c, the observed peaks at 35.05 eV for BWO and 35.17 eV for 20COB attributed to W 4f7/2, while the peaks at 37.14 eV for BWO and 37.24 eV for 20COB assigned to W 4f5/2, indicating that W was present in the W6+ state [46]. The O 1 s XPS spectra (Fig. 6d) showed that the binding energy of CuO at 529.59 eV was due to the Cu-O bond, while BWO at 529.99 eV showed Bi-O and W-O bonds. In 20COB, the peak at 530.15 eV was attributed to Cu-O bonds and surface lattice oxygens from BWO. Additional peaks at 531.16, 531.53, and 531.56 eV for CuO, BWO, and 20COB, respectively, were associated with OH groups as a result of surface-adsorbed water. The Cu 2p high-resolution spectra (Fig. 6e) showed that Cu 2p3/2 peaks for CuO and 20COB were at 933.88 and 933.63 eV, while Cu 2p1/2 peaks were at 953.84 and 953.52 eV, respectively, indicating Cu2+. The existence of the Cu²⁺ state in CuO was also confirmed by satellite peaks at 941.56, 943.84, and 962.15 eV. The observed shift in binding energy suggested changes in electron density at the surface. An increase in binding energy corresponds to a decrease in electron density, whereas a decrease in binding energy reflects an increase in electron density. Compared to BWO, the W 4f and Bi 4f binding energies of 20COB were slightly higher, while the Cu 2p binding energy was lower compared to CuO. This suggested electron transfer from BWO to CuO due to interactions at the 20COB interface [43,47]. 3.7 Brunauer Emmett Teller (BET) analysis The catalyst surface area and pore structure play a crucial role in determining photocatalytic performance. Fig. 7a depicts absorption-desorption of N₂ isotherms of the sample prepared. The nitrogen adsorption–desorption isotherms of all samples were classified as Type IV with a small H3 hysteresis loop [47,48], reflecting mesoporous structures. The BET surface areas were 41.683 m²/g for CuO, 18.711 m²/g for BWO, and 12.266 m²/g for 20COB (Table 1 ). Although the surface area of 20COB was slightly smaller than BWO, its photocatalytic efficiency for organic transformation was much higher, showing that surface area is not the main factor influencing photocatalytic performance [48]. Pore volumes of CuO, BWO, and 20COB were 0.196, 0.041, and 0.048 cm3/g, respectively, indicating that CuO addition has a relatively minor impact on the porosity of BWO. However, the average pore diameter of 20COB was larger than that of BWO [47] because adding CuO nanoparticles creates extra voids or disrupts the pore structure. This enhances molecule access to active sites, improving photocatalytic efficiency. The BJH pore size distribution (Fig. 7b) indicates that BWO, CuO, and 20COB possess pore sizes of 1.220 nm, 2.734 nm, and 1.676 nm, respectively. 3.8 Photocatalytic activity of synthesised 20COB catalyst The superior efficacy of the COB catalyst compared to other heterogeneous photocatalysts was systematically evaluated through its photocatalytic performance in a photo-triggered Click reaction involving alkynes, azides, and aryl/alkyl halides. To establish a benchmark, a model reaction comprising N-propargylated indole-3-carbaldehyde, sodium azide, and benzyl chloride was performed under aerobic conditions. No product formation was observed in the absence of a catalyst, even after extended exposure to blue LED irradiation (Table 2 , entry 1). Similarly, the addition of conventional additives such as NaOH, sodium ascorbate, and ascorbic acid failed to promote the reaction (Table 2, entries 2–4). In contrast, Cu-based catalysts such as CuO, Cu₂O, and a 1:1 CuO/BWO combination exhibited moderate catalytic activity, yielding 55 %, 53 %, and 62 %, respectively (Table 2, entries 6–8). The pure BWO catalyst failed to generate the target product under identical conditions (Table 2, entry 5). However, CuO-loaded BWO catalysts (COB) with varied CuO loading (10 %, 20 %, and 30 %) demonstrated a remarkable enhancement in photocatalytic efficiency, achieving yields between 69 % and 76 % (Table 2, entries 9–11). Notably, the 20COB catalyst, with an optimized CuO loading of 20 %, exhibited the highest catalytic performance, achieving a yield of 76 %. Further increasing the CuO loading did not enhance the yield, confirming 20COB as the optimal catalyst for subsequent studies. When the reaction was conducted under a nitrogen (N₂) atmosphere, the yield improved significantly to 91 % (Table 2, entry 12). This enhancement is attributed to the suppression of reactive oxygen species (ROS) under an inert atmosphere, thereby minimizing unreacted reactants or side reactions that adversely affect product yield. Conversely, reactions conducted in air resulted in lower yields due to the formation of ROS. The role of light in the reaction was further investigated. Under visible-light illumination, the reaction achieved a 56 % yield (Table 2, entry 14), demonstrating the efficacy of mixed wavelengths in the visible spectrum (λ > 420 nm). UV light irradiation (λ = 365 nm), however, failed to initiate the reaction (Table 2, entry 15), consistent with the UV–vis DRS spectrum of the 20COB catalyst, which predominantly absorbs in the visible region. Reactions conducted in complete darkness, regardless of the atmosphere, afforded only trace amounts of the product (Table 2, entries 13 and 16), underscoring the indispensable role of light. Under purely thermal conditions, a moderate yield of 51 % was observed, potentially due to catalyst leaching (Table 2, entry 17). Additives such as NaOH and sodium ascorbate were tested in combination with the 20COB catalyst (Table 2, entries 18 and 19) but were found unnecessary, as the reaction proceeded efficiently without them. Solvent effects were also investigated. Polar aprotic solvents, including DCM, DMF, and DMSO, yielded better outcomes (Table 2, entries 23–25), with ACN proving to be the optimal solvent. In contrast, polar protic solvents (e.g., ethanol, water) exhibited poor performance (Table 2, entries 20 and 21), likely due to their hole-scavenging effects, while nonpolar toluene afforded only minimal product formation (Table 2, entry 22). For further optimization of the click reaction, the effects of parameters such as light intensity, reaction time, solvents, catalyst, and catalyst dosage were systematically studied (see Supplementary Information, Tables S1–S5). As shown in Table 2, the lower yield observed under aerobic conditions can be attributed to the involvement of molecular oxygen in undesirable side reactions. Under visible-light illumination, oxygen can react with photoexcited electrons to generate reactive oxygen species (ROS), including superoxide (•O₂⁻) and singlet oxygen (¹O₂). These ROS can non-selectively oxidize intermediates or the final triazole product, reducing overall yield. Additionally, oxygen acts as an electron scavenger, limiting the availability of photogenerated electrons for the desired redox processes. This leads to unreacted starting materials or by-product formation. These effects were further confirmed by ROS detection using the methylene blue degradation experiment. The optimized reaction was tested on various aryl and alkyl halides, giving yields between 47 % and 91 %. Benzyl halides with electron-withdrawing groups (like nitro, cyano, and halogens) showed yields of 47 % to 85 % (Table 3 , entries 4b-4i). In contrast, those with electron-donating groups (like methoxy) gave slightly lower yields of 63 % to 66 % (Table 3, entries 4j and 4k). Long-chain alkyl halides resulted in moderate yields of 66 % to 71 % (Table 3, entries 4l and 4m). However, the unsubstituted aryl halide produced the highest yield under these conditions (Table 3, entry 4a). This work pioneers the use of blue LED irradiation for a photo-click reaction in an indole moiety, demonstrating a sustainable, energy-efficient approach to copper-based catalysis. Blue LEDs effectively provide visible light essential for activating the 20COB catalyst. This novel approach highlights the potential of blue LED-mediated photocatalysis in advancing green chemical synthesis. Comprehensive spectral characterization data such as ¹H and ¹³C NMR, FTIR, and HR-MS for the synthesized compounds, are available in the Supporting Information (see Supplementary Information, Tables S6). 3.9 Evaluation of the photocatalytic mechanism Fig. 8 shows the proposed photocatalytic mechanism of the Click reaction. When exposed to visible light, the COB photocatalyst becomes active, causing the alkyne (I) to oxidize into a radical cation (Ia) through single-electron transfer (SET), likely in the valence band (VB) of BWO. At the same time, azide (IIa) forms from the reaction of alkyl or aryl halide (II) with sodium azide. The radical cation (Ia) then reacts with the azide (IIa), creating a radical intermediate (III), which quickly cyclizes to form intermediate (IIIa). Finally, the COB catalyst reduces intermediate (IIIa) into the desired triazole product, possibly in the conduction band (CB) of CuO [49]. In the proposed Z-scheme heterojunction between CuO and BWO, upon visible-light irradiation, both semiconductors absorb photons and generate e-/h + pairs. The CB of BWO is positioned at a more negative potential than the VB of CuO. This band position allows the transfer of photogenerated electrons from the CB of BWO to recombine with the photogenerated holes in the VB of CuO. This electron–hole recombination across the interface is energetically favorable due to the potential difference between the CB of BWO and the VB of CuO and is driven by electrostatic interactions at the heterojunction interface. Furthermore, strong interfacial coupling and the formation of an internal electric field at the CuO/BWO interface enhance charge separation and promote directional charge migration. As a result, holes remaining in the VB of BWO and electrons remaining in the CB of CuO possess higher redox potentials, which are crucial for the photocatalytic reactions. This synergistic interaction within the Z-scheme heterojunction not only prolongs charge carrier lifetimes but also ensures sufficient oxidative and reductive power, enabling efficient triazole synthesis under visible light. To enhance the clarity and focus of the main content of the text, we have moved the detailed studies, such as evaluating charge transfer in the photocatalyst system, scavenging and trapping studies, methylene blue degradation analysis, catalyst reusability and stability tests, and the heterogeneity study of the 20COB photocatalyst, and so on to the Supporting Information (Text S3.1–S3.6 and Fig. S1–S4). These results support the proposed reaction mechanism and show that the 20COB catalyst is stable and reusable. 3.10 Scalability test A gram-scale reaction was performed to assess the scalability of the proposed catalytic system. Specifically, the reaction was carried out using propargyl indole-3-carbaldehyde (1.83 g, 10 equiv., 10 mmol), sodium azide (0.65 g, 10 equiv., 10 mmol), and benzyl chloride (1.26 mL, 10 equiv., 10 mmol) in the presence of 10 wt % of the 20COB catalyst. The reactants were mixed with 3 mL of ACN, the solvent established for smaller-scale reactions which yielded above 85 % yield. The results showed that the catalyst maintained its activity and efficiency at a larger scale, indicating its potential for industrial applications. 4 Conclusion and future aspects In conclusion, this study highlights the effectiveness of CuO/Bi2WO6 (COB) heterojunctions as efficient photocatalysts for visible-light-driven azide–alkyne cycloaddition (CuAAC) reactions. The optimized CuO loading on Bi₂WO₆ (BWO) demonstrated exceptional catalytic performance, achieving up to 91 % yield in the synthesis of disubstituted triazoles under blue LED illumination. Comprehensive characterization, including HRTEM analysis, confirmed an average CuO particle size of 17.324 nm, providing insights into the functional and structural features of the catalyst. The strong interfacial interaction between CuO and BWO facilitates efficient electron transfer and enables the in situ photoreduction of Cu(II) to Cu(I), thereby enhancing photocatalytic activity. Photocatalytic degradation studies and reactive oxygen species inhibition experiments further validated the proposed reaction mechanism. The COB catalyst exhibited excellent stability and reusability over six consecutive cycles, with high turnover numbers (TON) and turnover frequencies (TOF). Heterogeneity tests confirmed its heterogeneous nature and negligible leaching of copper species. Moreover, the catalyst worked well in inert conditions, using nitrogen (N₂) to prevent ROS formation. This helped achieve a high yield of 91 %. The broad substrate scope, including various halides and aliphatic halides, underscores the versatility of this catalytic system. These findings establish COB as a highly efficient, reusable, and environmentally sustainable photocatalyst for visible-light-driven CuAAC reactions. The study paves the way for its potential application in green and scalable synthetic methodologies, further advancing the development of eco-friendly copper-catalyzed click chemistry. Data availability We do not have any data with this manuscript. The supporting information has been furnished with all the essential information. CRediT authorship contribution statement Murugesan Shobika: Writing – original draft, Methodology, Investigation, Formal analysis. Selvaraj Mohana Roopan: Writing – review & editing, Supervision, Conceptualization. Jagannathan Madhavan: Formal analysis, Data curation. Declaration of competing interest The authors declare that they have no known competing financial interests or personal relationships that could have appeared to influence the work reported in this paper. Supplementary materials Supplementary material associated with this article can be found, in the online version, at doi:10.1016/j.mcat.2025.115429. Appendix Supplementary materials Image, application 1 References [1] K. Shafique A. Farrukh T. Mahmood Ali S. Qasim L. Jafri H.S.M. Abd-Rabboh M. mana AL-Anazy S. Kalsoom Designing click one-pot synthesis and antidiabetic studies of 1,2,3-triazole derivatives Molecules 28 2023 3104 10.3390/molecules28073104 K. Shafique, A. Farrukh, T. Mahmood Ali, S. Qasim, L. Jafri, H.S.M. Abd-Rabboh, M. mana AL-Anazy, S. Kalsoom, Designing click one-pot synthesis and antidiabetic studies of 1,2,3-triazole derivatives, Molecules 28 (2023) 3104. https://doi.org/10.3390/molecules28073104. [2] Z. Xiao Y. Gu H. Dong B. Liu W. Jin J. Li P. Ma H. Xu W. Hou Strategic application of CuAAC click chemistry in the modification of natural products for anticancer activity Eur. J. Med. Chem. Reports 9 2023 100113 10.1016/j.ejmcr.2023.100113 Z. Xiao, Y. Gu, H. Dong, B. Liu, W. Jin, J. Li, P. Ma, H. Xu, W. Hou, Strategic application of CuAAC click chemistry in the modification of natural products for anticancer activity, Eur. J. Med. Chem. Reports 9 (2023) 100113. https://doi.org/10.1016/j.ejmcr.2023.100113. [3] A.Aziz Ali D. Gogoi A.K. Chaliha A.K. Buragohain P. Trivedi P.J. Saikia P.S. Gehlot A. Kumar V. Chaturvedi D. Sarma Synthesis and biological evaluation of novel 1,2,3-triazole derivatives as anti-tubercular agents Bioorg. Med. Chem. Lett. 27 2017 3698 3703 10.1016/j.bmcl.2017.07.008 A.Aziz Ali, D. Gogoi, A.K. Chaliha, A.K. Buragohain, P. Trivedi, P.J. Saikia, P.S. Gehlot, A. Kumar, V. Chaturvedi, D. Sarma, Synthesis and biological evaluation of novel 1,2,3-triazole derivatives as anti-tubercular agents, Bioorg. Med. Chem. Lett. 27 (2017) 3698–3703. https://doi.org/10.1016/j.bmcl.2017.07.008. [4] F. Valério Lopes P.H. Fazza Stroppa J.A. Marinho R. Reis Soares L. de Azevedo Alves P.V.Z. Capriles Goliatt C. Abramo A. David da Silva 1,2,3-Triazole derivatives: synthesis, docking, cytotoxicity analysis and in vivo antimalarial activity Chem. Biol. Interact. 350 2021 109688 10.1016/j.cbi.2021.109688 F. Valério Lopes, P.H. Fazza Stroppa, J.A. Marinho, R. Reis Soares, L. de Azevedo Alves, P.V.Z. Capriles Goliatt, C. Abramo, A. David da Silva, 1,2,3-Triazole derivatives: synthesis, docking, cytotoxicity analysis and in vivo antimalarial activity, Chem. Biol. Interact. 350 (2021) 109688. https://doi.org/10.1016/j.cbi.2021.109688. [5] B. Zhang Comprehensive review on the anti-bacterial activity of 1,2,3-triazole hybrids Eur. J. Med. Chem. 168 2019 357 372 10.1016/j.ejmech.2019.02.055 B. Zhang, Comprehensive review on the anti-bacterial activity of 1,2,3-triazole hybrids, Eur. J. Med. Chem. 168 (2019) 357–372. https://doi.org/10.1016/j.ejmech.2019.02.055. [6] R.S. Meinel A. das C. Almeida P.H.F. Stroppa N. Glanzmann E.S. Coimbra A.D. da Silva Novel functionalized 1,2,3-triazole derivatives exhibit antileishmanial activity, increase in total and mitochondrial-ROS and depolarization of mitochondrial membrane potential of Leishmania amazonensis Chem. Biol. Interact. 315 2020 108850 10.1016/j.cbi.2019.108850 R.S. Meinel, A. das C. Almeida, P.H.F. Stroppa, N. Glanzmann, E.S. Coimbra, A.D. da Silva, Novel functionalized 1,2,3-triazole derivatives exhibit antileishmanial activity, increase in total and mitochondrial-ROS and depolarization of mitochondrial membrane potential of Leishmania amazonensis, Chem. Biol. Interact. 315 (2020) 108850. https://doi.org/10.1016/j.cbi.2019.108850. [7] A. Mukherjee A. Saha S. Bhattacharya Copper(I) complexes of 1,2-bis(diphenylphosphino)benzene as efficient catalysts for alkyne hydroamination and azide-alkyne cycloaddition Mole. Cataly. 553 2024 113575 10.1016/j.mcat.2023.113575 A. Mukherjee, A. Saha, S. Bhattacharya, Copper(I) complexes of 1,2-bis(diphenylphosphino)benzene as efficient catalysts for alkyne hydroamination and azide-alkyne cycloaddition, Mole. Cataly. 553 (2024) 113575. https://doi.org/10.1016/j.mcat.2023.113575. [8] A.A. Khairbek M.A.A.H. Badawi A.Y.A. Alzahrani R. KJ R. Thomas Silver- and gold-catalyzed azide−alkyne cycloaddition by functionalized NHC-based polynuclear catalysts: computational investigation and mechanistic insights Molec. Cataly. 570 2025 114708 10.1016/j.mcat.2024.114708 A.A. Khairbek, M.A.A.H. Badawi, A.Y.A. Alzahrani, R. KJ, R. Thomas, Silver- and gold-catalyzed azide−alkyne cycloaddition by functionalized NHC-based polynuclear catalysts: computational investigation and mechanistic insights, Molec. Cataly. 570 (2025) 114708. https://doi.org/10.1016/j.mcat.2024.114708. [9] M. González-Lainez M. Gallegos J. Munarriz R. Azpiroz V. Passarelli M.V. Jiménez J.J. Pérez-Torrente Copper-catalyzed azide–Alkyne cycloaddition (CuAAC) by functionalized NHC-based polynuclear catalysts: scope and mechanistic insights Organometallics 41 2022 2154 2169 10.1021/acs.organomet.2c00246 M. González-Lainez, M. Gallegos, J. Munarriz, R. Azpiroz, V. Passarelli, M.V. Jiménez, J.J. Pérez-Torrente, Copper-catalyzed azide–Alkyne cycloaddition (CuAAC) by functionalized NHC-based polynuclear catalysts: scope and mechanistic insights, Organometallics 41 (2022) 2154–2169. https://doi.org/10.1021/acs.organomet.2c00246. [10] G.S. Kumar Q. Lin Light-triggered click chemistry Chem. Rev. 121 2021 6991 7031 10.1021/acs.chemrev.0c00799 G.S. Kumar, Q. Lin, Light-triggered click chemistry, Chem. Rev. 121 (2021) 6991–7031. https://doi.org/10.1021/acs.chemrev.0c00799. [11] H.C. Kolb M.G. Finn K.B. Sharpless Click chemistry: diverse chemical function from a few good reactions Angew. Chemie Int. Ed. 40 2001 2004 2021 10.1002/1521-3773(20010601)40 :11≤2004::AID-ANIE2004≥3.0.CO;2-5 H.C. Kolb, M.G. Finn, K.B. Sharpless, Click chemistry: diverse chemical function from a few good reactions, Angew. Chemie Int. Ed. 40 (2001) 2004–2021. https://doi.org/10.1002/1521-3773(20010601)40:11≤2004::AID-ANIE2004≥3.0.CO;2-5. [12] V.V. Rostovtsev L.G. Green V.V. Fokin K.B. Sharpless A stepwise Huisgen cycloaddition process: copper(I)-catalyzed regioselective “ligation” of azides and terminal alkynes Angew. Chemie Int. Ed. 41 2002 2596 2599 10.1002/1521-3773(20020715)41 :14≤2596::AID-ANIE2596≥3.0.CO;2-4 V.V. Rostovtsev, L.G. Green, V.V. Fokin, K.B. Sharpless, A stepwise Huisgen cycloaddition process: copper(I)-catalyzed regioselective “ligation” of azides and terminal alkynes, Angew. Chemie Int. Ed. 41 (2002) 2596–2599. https://doi.org/10.1002/1521-3773(20020715)41:14≤2596::AID-ANIE2596≥3.0.CO;2-4. [13] P. Kumar C. Joshi A.K. Srivastava P. Gupta R. Boukherroub S.L. Jain Visible light assisted photocatalytic [3 + 2] azide–Alkyne “click” reaction for the synthesis of 1,4-substituted 1,2,3-triazoles using a novel bimetallic Ru–Mn complex ACS Sustain. Chem. Eng. 4 2016 69 75 10.1021/acssuschemeng.5b00653 P. Kumar, C. Joshi, A.K. Srivastava, P. Gupta, R. Boukherroub, S.L. Jain, Visible light assisted photocatalytic [3 + 2] azide–Alkyne “click” reaction for the synthesis of 1,4-substituted 1,2,3-triazoles using a novel bimetallic Ru–Mn complex, ACS Sustain. Chem. Eng. 4 (2016) 69–75. https://doi.org/10.1021/acssuschemeng.5b00653. [14] M.Y. Qi W.Y. Xiao M. Conte Z.R. Tang Y.J. Xu Interfacial synergy of Ni single atom/clusters and MXene enabling semiconductor quantum dots based superior photoredox catalysis ACS Catal. 15 2025 129 138 10.1021/acscatal.4c05842 M.Y. Qi, W.Y. Xiao, M. Conte, Z.R. Tang, Y.J. Xu, Interfacial synergy of Ni single atom/clusters and MXene enabling semiconductor quantum dots based superior photoredox catalysis, ACS Catal. 15 (2025) 129–138. https://doi.org/10.1021/acscatal.4c05842. [15] X. Yan J.H. Dong J.Y. Zheng Y. Wu F.X. Xiao Customizing precise, tunable, and universal cascade charge transfer chains towards versatile photoredox catalysis Chem. Sci. 15 2024 2898 2913 10.1039/D3SC05761E X. Yan, J.H. Dong, J.Y. Zheng, Y. Wu, F.X. Xiao, Customizing precise, tunable, and universal cascade charge transfer chains towards versatile photoredox catalysis, Chem. Sci. 15 (2024) 2898–2913. https://doi.org/10.1039/D3SC05761E. [16] P. Su X. Yan F.X. Xiao Customizing dumbbell-shaped heterostructured artificial photosystems steering versatile photoredox catalysis Chem. Sci. 15 2024 14778 14790 10.1039/D4SC04838E P. Su, X. Yan, F.X. Xiao, Customizing dumbbell-shaped heterostructured artificial photosystems steering versatile photoredox catalysis, Chem. Sci. 15 (2024) 14778–14790. https://doi.org/10.1039/D4SC04838E. [17] Q.L. Mo R. Xiong J.H. Dong B.S. Sa J.Y. Zheng Q. Chen Y. Wu F.X. Xiao Identification of origin of insulating polymer maneuvered photoredox catalysis Chin. J. Cataly. 63 2024 109 123 10.1016/S1872-2067(24)60070-7 Q.L. Mo, R. Xiong, J.H. Dong, B.S. Sa, J.Y. Zheng, Q. Chen, Y. Wu, F.X. Xiao, Identification of origin of insulating polymer maneuvered photoredox catalysis, Chin. J. Cataly. 63 (2024) 109–123. https://doi.org/10.1016/S1872-2067(24)60070-7. [18] J. Zhang L. Zhan B. Ning Y. He G. Xiao Z. Chen F.X. Xiao Photoredox catalysis enabled by atomically precise metal nanoclusters Inorg. Chem. Front. 11 2024 6970 6980 10.1039/D4QI01826E J. Zhang, L. Zhan, B. Ning, Y. He, G. Xiao, Z. Chen, F.X. Xiao, Photoredox catalysis enabled by atomically precise metal nanoclusters, Inorg. Chem. Front. 11 (2024) 6970–6980. https://doi.org/10.1039/D4QI01826E. [19] Y.H. Wu Y.Q. Yan Y.X. Deng W.Y. Huang K. Yang K.Q. Lu Rational construction of S-scheme CdS quantum dots/In2O3 hollow nanotubes heterojunction for enhanced photocatalytic H2 evolution Chin. J. Cataly. 70 2025 333 340 10.1016/S1872-2067(24)60213-5 Y.H. Wu, Y.Q. Yan, Y.X. Deng, W.Y. Huang, K. Yang, K.Q. Lu, Rational construction of S-scheme CdS quantum dots/In2O3 hollow nanotubes heterojunction for enhanced photocatalytic H2 evolution, Chin. J. Cataly. 70 (2025) 333–340. https://doi.org/10.1016/S1872-2067(24)60213-5. [20] X. Lang X. Chen J. Zhao Heterogeneous visible light photocatalysis for selective organic transformations Chem. Soc. Rev. 43 2014 473 486 10.1039/C3CS60188A X. Lang, X. Chen, J. Zhao, Heterogeneous visible light photocatalysis for selective organic transformations, Chem. Soc. Rev. 43 (2014) 473–486. https://doi.org/10.1039/C3CS60188A. [21] A. Hossain A. Bhattacharyya O. Reiser Copper’s rapid ascent in visible-light photoredox catalysis Science 364 2019 10.1126/science.aav9713 A. Hossain, A. Bhattacharyya, O. Reiser, Copper’s rapid ascent in visible-light photoredox catalysis, Science 364 (2019). https://doi.org/10.1126/science.aav9713. [22] B.D. Fairbanks L.J. Macdougall S. Mavila J. Sinha B.E. Kirkpatrick K.S. Anseth C.N. Bowman Photoclick chemistry: a bright idea Chem. Rev. 121 2021 6915 6990 10.1021/acs.chemrev.0c01212 B.D. Fairbanks, L.J. Macdougall, S. Mavila, J. Sinha, B.E. Kirkpatrick, K.S. Anseth, C.N. Bowman, Photoclick chemistry: a bright idea, Chem. Rev. 121 (2021) 6915–6990. https://doi.org/10.1021/acs.chemrev.0c01212. [23] M.H. Muhammad X.L. Chen Y. Liu T. Shi Y. Peng L. Qu B. Yu Recyclable Cu@C3N4-catalyzed hydroxylation of aryl boronic acids in water under visible light: synthesis of phenols under ambient conditions and room temperature ACS Sustain. Chem. Eng. 8 2020 2682 2687 10.1021/acssuschemeng.9b06010 M.H. Muhammad, X.L. Chen, Y. Liu, T. Shi, Y. Peng, L. Qu, B. Yu, Recyclable Cu@C3N4-catalyzed hydroxylation of aryl boronic acids in water under visible light: synthesis of phenols under ambient conditions and room temperature, ACS Sustain. Chem. Eng. 8 (2020) 2682–2687. https://doi.org/10.1021/acssuschemeng.9b06010. [24] H. Yi M. Yan D. Huang G. Zeng C. Lai M. Li X. Huo L. Qin S. Liu X. Liu B. Li H. Wang M. Shen Y. Fu X. Guo Synergistic effect of artificial enzyme and 2D nano-structured Bi2WO6 for eco-friendly and efficient biomimetic photocatalysis Appl. Catal. B Environ. 250 2019 52 62 10.1016/j.apcatb.2019.03.008 H. Yi, M. Yan, D. Huang, G. Zeng, C. Lai, M. Li, X. Huo, L. Qin, S. Liu, X. Liu, B. Li, H. Wang, M. Shen, Y. Fu, X. Guo, Synergistic effect of artificial enzyme and 2D nano-structured Bi2WO6 for eco-friendly and efficient biomimetic photocatalysis, Appl. Catal. B Environ. 250 (2019) 52–62. https://doi.org/10.1016/j.apcatb.2019.03.008. [25] B. Paplal S. Nagaraju V. Palakollu S. Kanvah B.V. Kumar D. Kashinath Synthesis of functionalized 1,2,3-triazoles using Bi2WO6 nanoparticles as efficient and reusable heterogeneous catalyst in aqueous medium RSC Adv. 5 2015 57842 57846 10.1039/C5RA09544A B. Paplal, S. Nagaraju, V. Palakollu, S. Kanvah, B.V. Kumar, D. Kashinath, Synthesis of functionalized 1,2,3-triazoles using Bi2WO6 nanoparticles as efficient and reusable heterogeneous catalyst in aqueous medium, RSC Adv.. 5 (2015) 57842–57846. https://doi.org/10.1039/C5RA09544A. [26] M. Shobika S.M. Roopan Enhanced visible-light-active photocatalysts: incorporating bismuth tungstate into graphitic carbon nitride for an efficient condensation reaction New J. Chem. 48 2024 14145 14154 10.1039/D4NJ01370K M. Shobika, S.M. Roopan, Enhanced visible-light-active photocatalysts: incorporating bismuth tungstate into graphitic carbon nitride for an efficient condensation reaction, New J. Chem. 48 (2024) 14145–14154. https://doi.org/10.1039/D4NJ01370K. [27] N. Verma N. Kumar Synthesis and biomedical applications of copper oxide nanoparticles: an expanding horizon ACS Biomater. Sci. Eng. 5 2019 1170 1188 10.1021/acsbiomaterials.8b01092 N. Verma, N. Kumar, Synthesis and biomedical applications of copper oxide nanoparticles: an expanding horizon, ACS Biomater. Sci. Eng. 5 (2019) 1170–1188. https://doi.org/10.1021/acsbiomaterials.8b01092. [28] T. Krishnaveni K. Kadirvelu M.V. Kaveri Facile one pot ‘click’ synthesis of 1,4 disubstituted-1, 2, 3-trizole derivatives catalyzed by green chemically prepared CuO nanoparticles Mater. Sci. Eng. B 278 2022 115618 10.1016/j.mseb.2022.115618 T. Krishnaveni, K. Kadirvelu, M.V. Kaveri, Facile one pot ‘click’ synthesis of 1,4 disubstituted-1, 2, 3-trizole derivatives catalyzed by green chemically prepared CuO nanoparticles, Mater. Sci. Eng. B 278 (2022) 115618. https://doi.org/10.1016/j.mseb.2022.115618. [29] G. Sharmila R. Sakthi Pradeep K. Sandiya S. Santhiya C. Muthukumaran J. Jeyanthi N.Manoj Kumar M. Thirumarimurugan Biogenic synthesis of CuO nanoparticles using Bauhinia tomentosa leaves extract: characterization and its antibacterial application J. Mol. Struct. 1165 2018 288 292 10.1016/j.molstruc.2018.04.011 G. Sharmila, R. Sakthi Pradeep, K. Sandiya, S. Santhiya, C. Muthukumaran, J. Jeyanthi, N.Manoj Kumar, M. Thirumarimurugan, Biogenic synthesis of CuO nanoparticles using Bauhinia tomentosa leaves extract: characterization and its antibacterial application, J. Mol. Struct. 1165 (2018) 288–292. https://doi.org/10.1016/j.molstruc.2018.04.011. [30] N.R. Chereddy S. Janakipriya P.S. Korrapati S. Thennarasu A.B. Mandal Solvent-assisted selective detection of sub-micromolar levels of Cu2+ ions in aqueous samples and live-cells Analyst 138 2013 1130 1136 10.1039/C2AN36339A N.R. Chereddy, S. Janakipriya, P.S. Korrapati, S. Thennarasu, A.B. Mandal, Solvent-assisted selective detection of sub-micromolar levels of Cu2+ ions in aqueous samples and live-cells, Analyst 138 (2013) 1130–1136. https://doi.org/10.1039/C2AN36339A. [31] N.R. Chereddy P.S. Korrapati S. Thennarasu A.B. Mandal Tuning copper(ii) ion selectivity: the role of basicity, size of the chelating ring and orientation of coordinating atoms Dalt. Trans. 42 2013 12873 10.1039/c3dt51765a N.R. Chereddy, P.S. Korrapati, S. Thennarasu, A.B. Mandal, Tuning copper(ii) ion selectivity: the role of basicity, size of the chelating ring and orientation of coordinating atoms, Dalt. Trans. 42 (2013) 12873. https://doi.org/10.1039/c3dt51765a. [32] M.P. Singh F. Saleem R.S. Pal A.K. Singh Palladacycles having normal and spiro chelate rings designed from bi- and tridentate ligands with an indole core: structure, synthesis and applications as catalysts New J. Chem. 41 2017 11342 11352 10.1039/C7NJ02116J M.P. Singh, F. Saleem, R.S. Pal, A.K. Singh, Palladacycles having normal and spiro chelate rings designed from bi- and tridentate ligands with an indole core: structure, synthesis and applications as catalysts, New J. Chem. 41 (2017) 11342–11352. https://doi.org/10.1039/C7NJ02116J. [33] J.A. Mokariya A.G. Kalola P. Prasad M.P. Patel Simultaneous ultrasound- and microwave-assisted one-pot ‘click’ synthesis of 3-formyl-indole clubbed 1,2,3-triazole derivatives and their biological evaluation Mol. Divers. 26 2022 963 979 10.1007/s11030-021-10212-8 J.A. Mokariya, A.G. Kalola, P. Prasad, M.P. Patel, Simultaneous ultrasound- and microwave-assisted one-pot ‘click’ synthesis of 3-formyl-indole clubbed 1,2,3-triazole derivatives and their biological evaluation, Mol. Divers. 26 (2022) 963–979. https://doi.org/10.1007/s11030-021-10212-8. [34] M. Yadav K. Lal A. Kumar A. Kumar D. Kumar Indole-chalcone linked 1,2,3-triazole hybrids: facile synthesis, antimicrobial evaluation and docking studies as potential antimicrobial agents J. Mol. Struct. 1261 2022 132867 10.1016/j.molstruc.2022.132867 M. Yadav, K. Lal, A. Kumar, A. Kumar, D. Kumar, Indole-chalcone linked 1,2,3-triazole hybrids: facile synthesis, antimicrobial evaluation and docking studies as potential antimicrobial agents, J. Mol. Struct. 1261 (2022) 132867. https://doi.org/10.1016/j.molstruc.2022.132867. [35] M. Shobika S.M. Roopan Photocatalytic reaction pathway and mechanistic investigation for sustainable C(sp3)-N bond formation using Bi2WO6 photocatalyst Molecular Catalysis 582 2025 115190 10.1016/j.mcat.2025.115190 M. Shobika, S.M. Roopan, Photocatalytic reaction pathway and mechanistic investigation for sustainable C(sp3)-N bond formation using Bi2WO6 photocatalyst, Molecular Catalysis 582 (2025) 115190. https://doi.org/10.1016/j.mcat.2025.115190. [36] X. Meng M. Hao J. Shi Z. Cao W. He Y. Gao J. Liu Z. Li Novel CuO/Bi2WO6 heterojunction with enhanced visible light photoactivity Adv. Powder Technol. 28 2017 3247 3256 10.1016/j.apt.2017.09.036 X. Meng, M. Hao, J. Shi, Z. Cao, W. He, Y. Gao, J. Liu, Z. Li, Novel CuO/Bi2WO6 heterojunction with enhanced visible light photoactivity, Adv. Powder Technol. 28 (2017) 3247–3256. https://doi.org/10.1016/j.apt.2017.09.036. [37] Y. Li X. Yu R. Li F. Zhao G. Liu X. Wang Selective and sensitive visible-light-prompt photoelectrochemical sensor of paracetamol based on Bi2WO6 modified with Bi and copper sulfide RSC Adv 11 2021 2884 2891 10.1039/D0RA08599E Y. Li, X. Yu, R. Li, F. Zhao, G. Liu, X. Wang, Selective and sensitive visible-light-prompt photoelectrochemical sensor of paracetamol based on Bi2WO6 modified with Bi and copper sulfide, RSC Adv. 11 (2021) 2884–2891. https://doi.org/10.1039/D0RA08599E. [38] D. Wang L. Guo Y. Zhen L. Yue G. Xue F. Fu AgBr quantum dots decorated mesoporous Bi2WO6 architectures with enhanced photocatalytic activities for methylene blue J. Mater. Chem. A 2 2014 11716 11727 10.1039/C4TA01444H D. Wang, L. Guo, Y. Zhen, L. Yue, G. Xue, F. Fu, AgBr quantum dots decorated mesoporous Bi2WO6 architectures with enhanced photocatalytic activities for methylene blue, J. Mater. Chem. A 2 (2014) 11716–11727. https://doi.org/10.1039/C4TA01444H. [39] Y.R. Lv R.K. He Z.Y. Chen X. Li Y.H. Xu Fabrication of hierarchical copper sulfide/bismuth tungstate p-n heterojunction with two-dimensional (2D) interfacial coupling for enhanced visible-light photocatalytic degradation of glyphosate J. Colloid Interface Sci. 560 2020 293 302 10.1016/j.jcis.2019.10.064 Y.R. Lv, R.K. He, Z.Y. Chen, X. Li, Y.H. Xu, Fabrication of hierarchical copper sulfide/bismuth tungstate p-n heterojunction with two-dimensional (2D) interfacial coupling for enhanced visible-light photocatalytic degradation of glyphosate, J. Colloid Interface Sci. 560 (2020) 293–302. https://doi.org/10.1016/j.jcis.2019.10.064. [40] C. Yang Z. Zhang P. Wang P. Xu T. Shen Y. Xin G. Zhang A novel vertical immobilized photocatalytic membrane reactor based on Bi2WO6-g-C3N4/PVDF for enhanced removal of atrazine, anti-fouling performance and long-term stability Chem. Eng. J. 471 2023 144672 10.1016/J.CEJ.2023.144672 C. Yang, Z. Zhang, P. Wang, P. Xu, T. Shen, Y. Xin, G. Zhang, A novel vertical immobilized photocatalytic membrane reactor based on Bi2WO6-g-C3N4/PVDF for enhanced removal of atrazine, anti-fouling performance and long-term stability, Chem. Eng. J. 471 (2023) 144672. https://doi.org/10.1016/J.CEJ.2023.144672. [41] Y. Li L. Chen Y. Wang L. Zhu Advanced nanostructured photocatalysts based on reduced graphene oxide-flower-like Bi2WO6 composites for an augmented simulated solar photoactivity activity Mater. Sci. Eng. B 210 2016 29 36 10.1016/j.mseb.2016.03.010 Y. Li, L. Chen, Y. Wang, L. Zhu, Advanced nanostructured photocatalysts based on reduced graphene oxide-flower-like Bi2WO6 composites for an augmented simulated solar photoactivity activity, Mater. Sci. Eng. B 210 (2016) 29–36. https://doi.org/10.1016/j.mseb.2016.03.010. [42] S.J. Singh P. Chinnamuthu Highly efficient natural-sunlight-driven photodegradation of organic dyes with combustion derived Ce-doped CuO nanoparticles Colloids Surfaces A Physicochem. Eng. Asp. 625 2021 126864 10.1016/j.colsurfa.2021.126864 S.J. Singh, P. Chinnamuthu, Highly efficient natural-sunlight-driven photodegradation of organic dyes with combustion derived Ce-doped CuO nanoparticles, Colloids Surfaces A Physicochem. Eng. Asp. 625 (2021) 126864. https://doi.org/10.1016/j.colsurfa.2021.126864. [43] V. Kavinkumar A. Verma K. Jothivenkatachalam Y.P. Fu Dual-functional CuO-decorated Bi3.84W0.16O6.24/Bi2WO6 nanohybrids for enhanced electrochemical hydrogen evolution reaction and photocatalytic Cr(VI) reduction performance ACS Appl. Nano Mater. 6 2023 2985 2994 10.1021/acsanm.2c05358 V. Kavinkumar, A. Verma, K. Jothivenkatachalam, Y.P. Fu, Dual-functional CuO-decorated Bi3.84W0.16O6.24/Bi2WO6 nanohybrids for enhanced electrochemical hydrogen evolution reaction and photocatalytic Cr(VI) reduction performance, ACS Appl. Nano Mater. 6 (2023) 2985–2994. https://doi.org/10.1021/acsanm.2c05358. [44] A. Rana A.Sudhaik Sonu A. Chawla P. Raizada A.K. Kaushik T. Ahamad S. Kaya N. Kumar P. Singh Integrating BiOI/g-C3N4/Bi2WO6 derived dual S-scheme photocatalyst with Biochar for emerging adsorption for photocatalysis: multicharge migration and mechanistic insights Ind. Eng. Chem. Res. 2024 10.1021/acs.iecr.4c00101 A. Rana, Sonu, A.Sudhaik, A. Chawla, P. Raizada, A.K. Kaushik, T. Ahamad, S. Kaya, N. Kumar, P. Singh, Integrating BiOI/g-C3N4/Bi2WO6 derived dual S-scheme photocatalyst with Biochar for emerging adsorption for photocatalysis: multicharge migration and mechanistic insights, Ind. Eng. Chem. Res. (2024). https://doi.org/10.1021/acs.iecr.4c00101. [45] R. Koutavarapu K. Syed S. Pagidi M.Y. Jeon M.C. Rao D.Y. Lee J. Shim An effective CuO/Bi2WO6 heterostructured photocatalyst: analyzing a charge-transfer mechanism for the enhanced visible-light-driven photocatalytic degradation of tetracycline and organic pollutants Chemosphere 287 2022 132015 10.1016/j.chemosphere.2021.132015 R. Koutavarapu, K. Syed, S. Pagidi, M.Y. Jeon, M.C. Rao, D.Y. Lee, J. Shim, An effective CuO/Bi2WO6 heterostructured photocatalyst: analyzing a charge-transfer mechanism for the enhanced visible-light-driven photocatalytic degradation of tetracycline and organic pollutants, Chemosphere 287 (2022) 132015. https://doi.org/10.1016/j.chemosphere.2021.132015. [46] S. Li J. Chen S. Hu H. Wang W. Jiang X. Chen Facile construction of novel Bi2WO6/Ta3N5 Z-scheme heterojunction nanofibers for efficient degradation of harmful pharmaceutical pollutants Chem. Eng. J. 402 2020 126165 10.1016/j.cej.2020.126165 S. Li, J. Chen, S. Hu, H. Wang, W. Jiang, X. Chen, Facile construction of novel Bi2WO6/Ta3N5 Z-scheme heterojunction nanofibers for efficient degradation of harmful pharmaceutical pollutants, Chem. Eng. J. 402 (2020) 126165. https://doi.org/10.1016/j.cej.2020.126165. [47] X. Shi B. Liu G. Meng P. Wu J. Lian W. Kong R. Liu Enhanced visible-light photocatalytic degradation of oxytetracycline hydrochloride by Z-scheme CuO/Bi2WO6 heterojunction J. Alloys Compd. 1002 2024 175219 10.1016/j.jallcom.2024.175219 X. Shi, B. Liu, G. Meng, P. Wu, J. Lian, W. Kong, R. Liu, Enhanced visible-light photocatalytic degradation of oxytetracycline hydrochloride by Z-scheme CuO/Bi2WO6 heterojunction, J. Alloys Compd. 1002 (2024) 175219. https://doi.org/10.1016/j.jallcom.2024.175219. [48] X. Li Y. Yu Y. Wang Y. Di J. Liu D. Li Y. Wang Z. Zhu H. Liu M. Wei Withered magnolia-derived BCDs onto 3D flower-like Bi2WO6 for efficient photocatalytic TC degradation and CO2 reduction J. Alloys Compd. 965 2023 171520 10.1016/j.jallcom.2023.171520 X. Li, Y. Yu, Y. Wang, Y. Di, J. Liu, D. Li, Y. Wang, Z. Zhu, H. Liu, M. Wei, Withered magnolia-derived BCDs onto 3D flower-like Bi2WO6 for efficient photocatalytic TC degradation and CO2 reduction, J. Alloys Compd. 965 (2023) 171520. https://doi.org/10.1016/j.jallcom.2023.171520. [49] R. Manjupriya S.M. Roopan Visible-light-active CuO/carbon dots/g-C3N4 heterojunction triggered click reaction: scope and mechanistic insights Ind. Eng. Chem. Res. 63 2024 10938 10954 10.1021/acs.iecr.4c00615 R. Manjupriya, S.M. Roopan, Visible-light-active CuO/carbon dots/g-C3N4 heterojunction triggered click reaction: scope and mechanistic insights, Ind. Eng. Chem. Res. 63 (2024) 10938–10954. https://doi.org/10.1021/acs.iecr.4c00615.",
      "scopus-id": "105013521950",
      "coredata": {
        "eid": "1-s2.0-S2468823125006157",
        "dc:description": "Azide-alkyne cycloaddition (CuAAC) is a key process in modern chemistry, enabling the efficient synthesis of molecules. Visible-light-induced photoredox catalysis offers an eco-friendly alternative to conventional thermal catalytic methods. In this study, CuO/Bi2WO6 (COB) heterojunctions are explored as photocatalysts for CuAAC under blue LED light, with minimal CuO loading on Bi2WO6 (BWO), demonstrating high efficacy in synthesizing disubstituted triazoles. The COB heterojunctions were thoroughly characterized using various techniques, including XRD, HRTEM, FTIR, BET, UV–vis DRS, FESEM, XPS, and EIS. HRTEM analysis indicated that the CuO in the composite exhibited an average size of 17.324 nm. The interaction between CuO and BWO promotes an electron transfer mechanism, improving photocatalytic efficiency and enabling Cu(II) to be photochemically reduced to Cu(I) in situ. Photocatalytic degradation studies and reactive oxygen species inhibition were used to support the mechanism. The COB catalyst achieved up to 91 % yield, with a high turnover number (TON: 33.7) and turnover frequency (TOF: 4.2 h⁻¹), and demonstrated high reusability over six cycles. A heterogeneity test confirmed the heterogeneity and non-leaching properties of the catalyst. These findings emphasize the potential of COB as a scalable, sustainable, and efficient catalyst for visible-light-driven copper-catalysed click reactions in modern synthetic chemistry.",
        "openArchiveArticle": "false",
        "prism:coverDate": "2025-11-30",
        "openaccessUserLicense": null,
        "prism:aggregationType": "Journal",
        "prism:url": "https://api.elsevier.com/content/article/pii/S2468823125006157",
        "dc:creator": [
          {
            "@_fa": "true",
            "$": "Shobika, Murugesan"
          },
          {
            "@_fa": "true",
            "$": "Roopan, Selvaraj Mohana"
          },
          {
            "@_fa": "true",
            "$": "Madhavan, Jagannathan"
          }
        ],
        "link": [
          {
            "@_fa": "true",
            "@rel": "self",
            "@href": "https://api.elsevier.com/content/article/pii/S2468823125006157"
          },
          {
            "@_fa": "true",
            "@rel": "scidir",
            "@href": "https://www.sciencedirect.com/science/article/pii/S2468823125006157"
          }
        ],
        "dc:format": "application/json",
        "openaccessType": null,
        "pii": "S2468-8231(25)00615-7",
        "prism:volume": "586",
        "articleNumber": "115429",
        "prism:publisher": "Elsevier B.V. All rights are reserved, including those for text and data mining, AI training, and similar technologies.",
        "dc:title": "Blue LED-induced photocatalytic “Click” reaction facilitated by CuO/Bi2WO₆ for synthesising 1,4-disubstituted 1,2,3-triazoles",
        "prism:copyright": "© 2025 Elsevier B.V. All rights are reserved, including those for text and data mining, AI training, and similar technologies.",
        "openaccess": "0",
        "prism:issn": "24688231",
        "dcterms:subject": [
          {
            "@_fa": "true",
            "$": "CuO"
          },
          {
            "@_fa": "true",
            "$": "Bi2WO6"
          },
          {
            "@_fa": "true",
            "$": "Heterojunction"
          },
          {
            "@_fa": "true",
            "$": "Photocatalyst"
          },
          {
            "@_fa": "true",
            "$": "Blue LED"
          },
          {
            "@_fa": "true",
            "$": "Click reaction"
          },
          {
            "@_fa": "true",
            "$": "Triazole"
          },
          {
            "@_fa": "true",
            "$": "Redox catalyst"
          }
        ],
        "openaccessArticle": "false",
        "prism:publicationName": "Molecular Catalysis",
        "openaccessSponsorType": null,
        "prism:pageRange": "115429",
        "pubType": "fla",
        "prism:coverDisplayDate": "November 2025",
        "prism:doi": "10.1016/j.mcat.2025.115429",
        "prism:startingPage": "115429",
        "dc:identifier": "doi:10.1016/j.mcat.2025.115429",
        "openaccessSponsorName": null
      },
      "objects": {
        "object": [
          {
            "@category": "standard",
            "@height": "164",
            "@width": "500",
            "@_fa": "true",
            "$": "https://api.elsevier.com/content/object/eid/1-s2.0-S2468823125006157-ga1.jpg?httpAccept=%2A%2F%2A",
            "@multimediatype": "JPEG image file",
            "@type": "IMAGE-DOWNSAMPLED",
            "@size": "31385",
            "@ref": "ga1",
            "@mimetype": "image/jpeg"
          },
          {
            "@category": "standard",
            "@height": "65",
            "@width": "74",
            "@_fa": "true",
            "$": "https://api.elsevier.com/content/object/eid/1-s2.0-S2468823125006157-fx10.jpg?httpAccept=%2A%2F%2A",
            "@multimediatype": "JPEG image file",
            "@type": "IMAGE-DOWNSAMPLED",
            "@size": "5688",
            "@ref": "fx10",
            "@mimetype": "image/jpeg"
          },
          {
            "@category": "standard",
            "@height": "35",
            "@width": "78",
            "@_fa": "true",
            "$": "https://api.elsevier.com/content/object/eid/1-s2.0-S2468823125006157-fx11.jpg?httpAccept=%2A%2F%2A",
            "@multimediatype": "JPEG image file",
            "@type": "IMAGE-DOWNSAMPLED",
            "@size": "4997",
            "@ref": "fx11",
            "@mimetype": "image/jpeg"
          },
          {
            "@category": "standard",
            "@height": "87",
            "@width": "114",
            "@_fa": "true",
            "$": "https://api.elsevier.com/content/object/eid/1-s2.0-S2468823125006157-fx12.jpg?httpAccept=%2A%2F%2A",
            "@multimediatype": "JPEG image file",
            "@type": "IMAGE-DOWNSAMPLED",
            "@size": "8503",
            "@ref": "fx12",
            "@mimetype": "image/jpeg"
          },
          {
            "@category": "standard",
            "@height": "65",
            "@width": "74",
            "@_fa": "true",
            "$": "https://api.elsevier.com/content/object/eid/1-s2.0-S2468823125006157-fx13.jpg?httpAccept=%2A%2F%2A",
            "@multimediatype": "JPEG image file",
            "@type": "IMAGE-DOWNSAMPLED",
            "@size": "5681",
            "@ref": "fx13",
            "@mimetype": "image/jpeg"
          },
          {
            "@category": "standard",
            "@height": "86",
            "@width": "132",
            "@_fa": "true",
            "$": "https://api.elsevier.com/content/object/eid/1-s2.0-S2468823125006157-fx18.jpg?httpAccept=%2A%2F%2A",
            "@multimediatype": "JPEG image file",
            "@type": "IMAGE-DOWNSAMPLED",
            "@size": "8818",
            "@ref": "fx18",
            "@mimetype": "image/jpeg"
          },
          {
            "@category": "standard",
            "@height": "64",
            "@width": "74",
            "@_fa": "true",
            "$": "https://api.elsevier.com/content/object/eid/1-s2.0-S2468823125006157-fx19.jpg?httpAccept=%2A%2F%2A",
            "@multimediatype": "JPEG image file",
            "@type": "IMAGE-DOWNSAMPLED",
            "@size": "5594",
            "@ref": "fx19",
            "@mimetype": "image/jpeg"
          },
          {
            "@category": "standard",
            "@height": "34",
            "@width": "78",
            "@_fa": "true",
            "$": "https://api.elsevier.com/content/object/eid/1-s2.0-S2468823125006157-fx14.jpg?httpAccept=%2A%2F%2A",
            "@multimediatype": "JPEG image file",
            "@type": "IMAGE-DOWNSAMPLED",
            "@size": "5362",
            "@ref": "fx14",
            "@mimetype": "image/jpeg"
          },
          {
            "@category": "standard",
            "@height": "997",
            "@width": "600",
            "@_fa": "true",
            "$": "https://api.elsevier.com/content/object/eid/1-s2.0-S2468823125006157-sc1.jpg?httpAccept=%2A%2F%2A",
            "@multimediatype": "JPEG image file",
            "@type": "IMAGE-DOWNSAMPLED",
            "@size": "143103",
            "@ref": "sc1",
            "@mimetype": "image/jpeg"
          },
          {
            "@category": "standard",
            "@height": "87",
            "@width": "129",
            "@_fa": "true",
            "$": "https://api.elsevier.com/content/object/eid/1-s2.0-S2468823125006157-fx15.jpg?httpAccept=%2A%2F%2A",
            "@multimediatype": "JPEG image file",
            "@type": "IMAGE-DOWNSAMPLED",
            "@size": "8921",
            "@ref": "fx15",
            "@mimetype": "image/jpeg"
          },
          {
            "@category": "standard",
            "@height": "65",
            "@width": "74",
            "@_fa": "true",
            "$": "https://api.elsevier.com/content/object/eid/1-s2.0-S2468823125006157-fx16.jpg?httpAccept=%2A%2F%2A",
            "@multimediatype": "JPEG image file",
            "@type": "IMAGE-DOWNSAMPLED",
            "@size": "5686",
            "@ref": "fx16",
            "@mimetype": "image/jpeg"
          },
          {
            "@category": "standard",
            "@height": "47",
            "@width": "78",
            "@_fa": "true",
            "$": "https://api.elsevier.com/content/object/eid/1-s2.0-S2468823125006157-fx17.jpg?httpAccept=%2A%2F%2A",
            "@multimediatype": "JPEG image file",
            "@type": "IMAGE-DOWNSAMPLED",
            "@size": "5202",
            "@ref": "fx17",
            "@mimetype": "image/jpeg"
          },
          {
            "@category": "standard",
            "@height": "87",
            "@width": "112",
            "@_fa": "true",
            "$": "https://api.elsevier.com/content/object/eid/1-s2.0-S2468823125006157-fx21.jpg?httpAccept=%2A%2F%2A",
            "@multimediatype": "JPEG image file",
            "@type": "IMAGE-DOWNSAMPLED",
            "@size": "8363",
            "@ref": "fx21",
            "@mimetype": "image/jpeg"
          },
          {
            "@category": "standard",
            "@height": "64",
            "@width": "73",
            "@_fa": "true",
            "$": "https://api.elsevier.com/content/object/eid/1-s2.0-S2468823125006157-fx22.jpg?httpAccept=%2A%2F%2A",
            "@multimediatype": "JPEG image file",
            "@type": "IMAGE-DOWNSAMPLED",
            "@size": "5638",
            "@ref": "fx22",
            "@mimetype": "image/jpeg"
          },
          {
            "@category": "standard",
            "@height": "34",
            "@width": "79",
            "@_fa": "true",
            "$": "https://api.elsevier.com/content/object/eid/1-s2.0-S2468823125006157-fx23.jpg?httpAccept=%2A%2F%2A",
            "@multimediatype": "JPEG image file",
            "@type": "IMAGE-DOWNSAMPLED",
            "@size": "4997",
            "@ref": "fx23",
            "@mimetype": "image/jpeg"
          },
          {
            "@category": "standard",
            "@height": "87",
            "@width": "114",
            "@_fa": "true",
            "$": "https://api.elsevier.com/content/object/eid/1-s2.0-S2468823125006157-fx24.jpg?httpAccept=%2A%2F%2A",
            "@multimediatype": "JPEG image file",
            "@type": "IMAGE-DOWNSAMPLED",
            "@size": "8534",
            "@ref": "fx24",
            "@mimetype": "image/jpeg"
          },
          {
            "@category": "standard",
            "@height": "32",
            "@width": "71",
            "@_fa": "true",
            "$": "https://api.elsevier.com/content/object/eid/1-s2.0-S2468823125006157-fx20.jpg?httpAccept=%2A%2F%2A",
            "@multimediatype": "JPEG image file",
            "@type": "IMAGE-DOWNSAMPLED",
            "@size": "4727",
            "@ref": "fx20",
            "@mimetype": "image/jpeg"
          },
          {
            "@category": "standard",
            "@height": "53",
            "@width": "57",
            "@_fa": "true",
            "$": "https://api.elsevier.com/content/object/eid/1-s2.0-S2468823125006157-fx29.jpg?httpAccept=%2A%2F%2A",
            "@multimediatype": "JPEG image file",
            "@type": "IMAGE-DOWNSAMPLED",
            "@size": "4910",
            "@ref": "fx29",
            "@mimetype": "image/jpeg"
          },
          {
            "@category": "standard",
            "@height": "65",
            "@width": "74",
            "@_fa": "true",
            "$": "https://api.elsevier.com/content/object/eid/1-s2.0-S2468823125006157-fx25.jpg?httpAccept=%2A%2F%2A",
            "@multimediatype": "JPEG image file",
            "@type": "IMAGE-DOWNSAMPLED",
            "@size": "5672",
            "@ref": "fx25",
            "@mimetype": "image/jpeg"
          },
          {
            "@category": "standard",
            "@height": "35",
            "@width": "86",
            "@_fa": "true",
            "$": "https://api.elsevier.com/content/object/eid/1-s2.0-S2468823125006157-fx26.jpg?httpAccept=%2A%2F%2A",
            "@multimediatype": "JPEG image file",
            "@type": "IMAGE-DOWNSAMPLED",
            "@size": "5037",
            "@ref": "fx26",
            "@mimetype": "image/jpeg"
          },
          {
            "@category": "standard",
            "@height": "86",
            "@width": "115",
            "@_fa": "true",
            "$": "https://api.elsevier.com/content/object/eid/1-s2.0-S2468823125006157-fx27.jpg?httpAccept=%2A%2F%2A",
            "@multimediatype": "JPEG image file",
            "@type": "IMAGE-DOWNSAMPLED",
            "@size": "8587",
            "@ref": "fx27",
            "@mimetype": "image/jpeg"
          },
          {
            "@category": "standard",
            "@height": "65",
            "@width": "74",
            "@_fa": "true",
            "$": "https://api.elsevier.com/content/object/eid/1-s2.0-S2468823125006157-fx28.jpg?httpAccept=%2A%2F%2A",
            "@multimediatype": "JPEG image file",
            "@type": "IMAGE-DOWNSAMPLED",
            "@size": "5688",
            "@ref": "fx28",
            "@mimetype": "image/jpeg"
          },
          {
            "@category": "standard",
            "@height": "314",
            "@width": "676",
            "@_fa": "true",
            "$": "https://api.elsevier.com/content/object/eid/1-s2.0-S2468823125006157-gr8.jpg?httpAccept=%2A%2F%2A",
            "@multimediatype": "JPEG image file",
            "@type": "IMAGE-DOWNSAMPLED",
            "@size": "52285",
            "@ref": "gr8",
            "@mimetype": "image/jpeg"
          },
          {
            "@category": "standard",
            "@height": "264",
            "@width": "789",
            "@_fa": "true",
            "$": "https://api.elsevier.com/content/object/eid/1-s2.0-S2468823125006157-gr7.jpg?httpAccept=%2A%2F%2A",
            "@multimediatype": "JPEG image file",
            "@type": "IMAGE-DOWNSAMPLED",
            "@size": "55689",
            "@ref": "gr7",
            "@mimetype": "image/jpeg"
          },
          {
            "@category": "standard",
            "@height": "853",
            "@width": "788",
            "@_fa": "true",
            "$": "https://api.elsevier.com/content/object/eid/1-s2.0-S2468823125006157-gr6.jpg?httpAccept=%2A%2F%2A",
            "@multimediatype": "JPEG image file",
            "@type": "IMAGE-DOWNSAMPLED",
            "@size": "147672",
            "@ref": "gr6",
            "@mimetype": "image/jpeg"
          },
          {
            "@category": "standard",
            "@height": "35",
            "@width": "85",
            "@_fa": "true",
            "$": "https://api.elsevier.com/content/object/eid/1-s2.0-S2468823125006157-fx32.jpg?httpAccept=%2A%2F%2A",
            "@multimediatype": "JPEG image file",
            "@type": "IMAGE-DOWNSAMPLED",
            "@size": "5032",
            "@ref": "fx32",
            "@mimetype": "image/jpeg"
          },
          {
            "@category": "standard",
            "@height": "88",
            "@width": "117",
            "@_fa": "true",
            "$": "https://api.elsevier.com/content/object/eid/1-s2.0-S2468823125006157-fx33.jpg?httpAccept=%2A%2F%2A",
            "@multimediatype": "JPEG image file",
            "@type": "IMAGE-DOWNSAMPLED",
            "@size": "8504",
            "@ref": "fx33",
            "@mimetype": "image/jpeg"
          },
          {
            "@category": "standard",
            "@height": "60",
            "@width": "69",
            "@_fa": "true",
            "$": "https://api.elsevier.com/content/object/eid/1-s2.0-S2468823125006157-fx34.jpg?httpAccept=%2A%2F%2A",
            "@multimediatype": "JPEG image file",
            "@type": "IMAGE-DOWNSAMPLED",
            "@size": "5514",
            "@ref": "fx34",
            "@mimetype": "image/jpeg"
          },
          {
            "@category": "standard",
            "@height": "10",
            "@width": "48",
            "@_fa": "true",
            "$": "https://api.elsevier.com/content/object/eid/1-s2.0-S2468823125006157-fx35.jpg?httpAccept=%2A%2F%2A",
            "@multimediatype": "JPEG image file",
            "@type": "IMAGE-DOWNSAMPLED",
            "@size": "3460",
            "@ref": "fx35",
            "@mimetype": "image/jpeg"
          },
          {
            "@category": "standard",
            "@height": "77",
            "@width": "139",
            "@_fa": "true",
            "$": "https://api.elsevier.com/content/object/eid/1-s2.0-S2468823125006157-fx30.jpg?httpAccept=%2A%2F%2A",
            "@multimediatype": "JPEG image file",
            "@type": "IMAGE-DOWNSAMPLED",
            "@size": "8720",
            "@ref": "fx30",
            "@mimetype": "image/jpeg"
          },
          {
            "@category": "standard",
            "@height": "65",
            "@width": "74",
            "@_fa": "true",
            "$": "https://api.elsevier.com/content/object/eid/1-s2.0-S2468823125006157-fx31.jpg?httpAccept=%2A%2F%2A",
            "@multimediatype": "JPEG image file",
            "@type": "IMAGE-DOWNSAMPLED",
            "@size": "5684",
            "@ref": "fx31",
            "@mimetype": "image/jpeg"
          },
          {
            "@category": "standard",
            "@height": "61",
            "@width": "70",
            "@_fa": "true",
            "$": "https://api.elsevier.com/content/object/eid/1-s2.0-S2468823125006157-fx4.jpg?httpAccept=%2A%2F%2A",
            "@multimediatype": "JPEG image file",
            "@type": "IMAGE-DOWNSAMPLED",
            "@size": "5503",
            "@ref": "fx4",
            "@mimetype": "image/jpeg"
          },
          {
            "@category": "standard",
            "@height": "72",
            "@width": "105",
            "@_fa": "true",
            "$": "https://api.elsevier.com/content/object/eid/1-s2.0-S2468823125006157-fx36.jpg?httpAccept=%2A%2F%2A",
            "@multimediatype": "JPEG image file",
            "@type": "IMAGE-DOWNSAMPLED",
            "@size": "7019",
            "@ref": "fx36",
            "@mimetype": "image/jpeg"
          },
          {
            "@category": "standard",
            "@height": "73",
            "@width": "107",
            "@_fa": "true",
            "$": "https://api.elsevier.com/content/object/eid/1-s2.0-S2468823125006157-fx3.jpg?httpAccept=%2A%2F%2A",
            "@multimediatype": "JPEG image file",
            "@type": "IMAGE-DOWNSAMPLED",
            "@size": "7669",
            "@ref": "fx3",
            "@mimetype": "image/jpeg"
          },
          {
            "@category": "standard",
            "@height": "60",
            "@width": "69",
            "@_fa": "true",
            "$": "https://api.elsevier.com/content/object/eid/1-s2.0-S2468823125006157-fx37.jpg?httpAccept=%2A%2F%2A",
            "@multimediatype": "JPEG image file",
            "@type": "IMAGE-DOWNSAMPLED",
            "@size": "5505",
            "@ref": "fx37",
            "@mimetype": "image/jpeg"
          },
          {
            "@category": "standard",
            "@height": "29",
            "@width": "54",
            "@_fa": "true",
            "$": "https://api.elsevier.com/content/object/eid/1-s2.0-S2468823125006157-fx2.jpg?httpAccept=%2A%2F%2A",
            "@multimediatype": "JPEG image file",
            "@type": "IMAGE-DOWNSAMPLED",
            "@size": "4377",
            "@ref": "fx2",
            "@mimetype": "image/jpeg"
          },
          {
            "@category": "standard",
            "@height": "10",
            "@width": "83",
            "@_fa": "true",
            "$": "https://api.elsevier.com/content/object/eid/1-s2.0-S2468823125006157-fx38.jpg?httpAccept=%2A%2F%2A",
            "@multimediatype": "JPEG image file",
            "@type": "IMAGE-DOWNSAMPLED",
            "@size": "4265",
            "@ref": "fx38",
            "@mimetype": "image/jpeg"
          },
          {
            "@category": "standard",
            "@height": "60",
            "@width": "69",
            "@_fa": "true",
            "$": "https://api.elsevier.com/content/object/eid/1-s2.0-S2468823125006157-fx1.jpg?httpAccept=%2A%2F%2A",
            "@multimediatype": "JPEG image file",
            "@type": "IMAGE-DOWNSAMPLED",
            "@size": "5507",
            "@ref": "fx1",
            "@mimetype": "image/jpeg"
          },
          {
            "@category": "standard",
            "@height": "82",
            "@width": "132",
            "@_fa": "true",
            "$": "https://api.elsevier.com/content/object/eid/1-s2.0-S2468823125006157-fx39.jpg?httpAccept=%2A%2F%2A",
            "@multimediatype": "JPEG image file",
            "@type": "IMAGE-DOWNSAMPLED",
            "@size": "7647",
            "@ref": "fx39",
            "@mimetype": "image/jpeg"
          },
          {
            "@category": "standard",
            "@height": "289",
            "@width": "789",
            "@_fa": "true",
            "$": "https://api.elsevier.com/content/object/eid/1-s2.0-S2468823125006157-gr1.jpg?httpAccept=%2A%2F%2A",
            "@multimediatype": "JPEG image file",
            "@type": "IMAGE-DOWNSAMPLED",
            "@size": "53317",
            "@ref": "gr1",
            "@mimetype": "image/jpeg"
          },
          {
            "@category": "standard",
            "@height": "44",
            "@width": "54",
            "@_fa": "true",
            "$": "https://api.elsevier.com/content/object/eid/1-s2.0-S2468823125006157-fx8.jpg?httpAccept=%2A%2F%2A",
            "@multimediatype": "JPEG image file",
            "@type": "IMAGE-DOWNSAMPLED",
            "@size": "4702",
            "@ref": "fx8",
            "@mimetype": "image/jpeg"
          },
          {
            "@category": "standard",
            "@height": "61",
            "@width": "70",
            "@_fa": "true",
            "$": "https://api.elsevier.com/content/object/eid/1-s2.0-S2468823125006157-fx7.jpg?httpAccept=%2A%2F%2A",
            "@multimediatype": "JPEG image file",
            "@type": "IMAGE-DOWNSAMPLED",
            "@size": "5506",
            "@ref": "fx7",
            "@mimetype": "image/jpeg"
          },
          {
            "@category": "standard",
            "@height": "72",
            "@width": "121",
            "@_fa": "true",
            "$": "https://api.elsevier.com/content/object/eid/1-s2.0-S2468823125006157-fx6.jpg?httpAccept=%2A%2F%2A",
            "@multimediatype": "JPEG image file",
            "@type": "IMAGE-DOWNSAMPLED",
            "@size": "7986",
            "@ref": "fx6",
            "@mimetype": "image/jpeg"
          },
          {
            "@category": "standard",
            "@height": "32",
            "@width": "54",
            "@_fa": "true",
            "$": "https://api.elsevier.com/content/object/eid/1-s2.0-S2468823125006157-fx5.jpg?httpAccept=%2A%2F%2A",
            "@multimediatype": "JPEG image file",
            "@type": "IMAGE-DOWNSAMPLED",
            "@size": "4609",
            "@ref": "fx5",
            "@mimetype": "image/jpeg"
          },
          {
            "@category": "standard",
            "@height": "528",
            "@width": "789",
            "@_fa": "true",
            "$": "https://api.elsevier.com/content/object/eid/1-s2.0-S2468823125006157-gr5.jpg?httpAccept=%2A%2F%2A",
            "@multimediatype": "JPEG image file",
            "@type": "IMAGE-DOWNSAMPLED",
            "@size": "126366",
            "@ref": "gr5",
            "@mimetype": "image/jpeg"
          },
          {
            "@category": "standard",
            "@height": "559",
            "@width": "789",
            "@_fa": "true",
            "$": "https://api.elsevier.com/content/object/eid/1-s2.0-S2468823125006157-gr4.jpg?httpAccept=%2A%2F%2A",
            "@multimediatype": "JPEG image file",
            "@type": "IMAGE-DOWNSAMPLED",
            "@size": "222572",
            "@ref": "gr4",
            "@mimetype": "image/jpeg"
          },
          {
            "@category": "standard",
            "@height": "559",
            "@width": "676",
            "@_fa": "true",
            "$": "https://api.elsevier.com/content/object/eid/1-s2.0-S2468823125006157-gr3.jpg?httpAccept=%2A%2F%2A",
            "@multimediatype": "JPEG image file",
            "@type": "IMAGE-DOWNSAMPLED",
            "@size": "93505",
            "@ref": "gr3",
            "@mimetype": "image/jpeg"
          },
          {
            "@category": "standard",
            "@height": "422",
            "@width": "601",
            "@_fa": "true",
            "$": "https://api.elsevier.com/content/object/eid/1-s2.0-S2468823125006157-gr2.jpg?httpAccept=%2A%2F%2A",
            "@multimediatype": "JPEG image file",
            "@type": "IMAGE-DOWNSAMPLED",
            "@size": "72704",
            "@ref": "gr2",
            "@mimetype": "image/jpeg"
          },
          {
            "@category": "standard",
            "@height": "71",
            "@width": "124",
            "@_fa": "true",
            "$": "https://api.elsevier.com/content/object/eid/1-s2.0-S2468823125006157-fx9.jpg?httpAccept=%2A%2F%2A",
            "@multimediatype": "JPEG image file",
            "@type": "IMAGE-DOWNSAMPLED",
            "@size": "8030",
            "@ref": "fx9",
            "@mimetype": "image/jpeg"
          },
          {
            "@category": "thumbnail",
            "@height": "72",
            "@width": "219",
            "@_fa": "true",
            "$": "https://api.elsevier.com/content/object/eid/1-s2.0-S2468823125006157-ga1.sml?httpAccept=%2A%2F%2A",
            "@multimediatype": "GIF image file",
            "@type": "IMAGE-THUMBNAIL",
            "@size": "8129",
            "@ref": "ga1",
            "@mimetype": "image/gif"
          },
          {
            "@category": "thumbnail",
            "@height": "164",
            "@width": "188",
            "@_fa": "true",
            "$": "https://api.elsevier.com/content/object/eid/1-s2.0-S2468823125006157-fx10.sml?httpAccept=%2A%2F%2A",
            "@multimediatype": "GIF image file",
            "@type": "IMAGE-THUMBNAIL",
            "@size": "10012",
            "@ref": "fx10",
            "@mimetype": "image/gif"
          },
          {
            "@category": "thumbnail",
            "@height": "97",
            "@width": "219",
            "@_fa": "true",
            "$": "https://api.elsevier.com/content/object/eid/1-s2.0-S2468823125006157-fx11.sml?httpAccept=%2A%2F%2A",
            "@multimediatype": "GIF image file",
            "@type": "IMAGE-THUMBNAIL",
            "@size": "8157",
            "@ref": "fx11",
            "@mimetype": "image/gif"
          },
          {
            "@category": "thumbnail",
            "@height": "164",
            "@width": "216",
            "@_fa": "true",
            "$": "https://api.elsevier.com/content/object/eid/1-s2.0-S2468823125006157-fx12.sml?httpAccept=%2A%2F%2A",
            "@multimediatype": "GIF image file",
            "@type": "IMAGE-THUMBNAIL",
            "@size": "11344",
            "@ref": "fx12",
            "@mimetype": "image/gif"
          },
          {
            "@category": "thumbnail",
            "@height": "164",
            "@width": "188",
            "@_fa": "true",
            "$": "https://api.elsevier.com/content/object/eid/1-s2.0-S2468823125006157-fx13.sml?httpAccept=%2A%2F%2A",
            "@multimediatype": "GIF image file",
            "@type": "IMAGE-THUMBNAIL",
            "@size": "9996",
            "@ref": "fx13",
            "@mimetype": "image/gif"
          },
          {
            "@category": "thumbnail",
            "@height": "143",
            "@width": "219",
            "@_fa": "true",
            "$": "https://api.elsevier.com/content/object/eid/1-s2.0-S2468823125006157-fx18.sml?httpAccept=%2A%2F%2A",
            "@multimediatype": "GIF image file",
            "@type": "IMAGE-THUMBNAIL",
            "@size": "10078",
            "@ref": "fx18",
            "@mimetype": "image/gif"
          },
          {
            "@category": "thumbnail",
            "@height": "163",
            "@width": "188",
            "@_fa": "true",
            "$": "https://api.elsevier.com/content/object/eid/1-s2.0-S2468823125006157-fx19.sml?httpAccept=%2A%2F%2A",
            "@multimediatype": "GIF image file",
            "@type": "IMAGE-THUMBNAIL",
            "@size": "9506",
            "@ref": "fx19",
            "@mimetype": "image/gif"
          },
          {
            "@category": "thumbnail",
            "@height": "97",
            "@width": "219",
            "@_fa": "true",
            "$": "https://api.elsevier.com/content/object/eid/1-s2.0-S2468823125006157-fx14.sml?httpAccept=%2A%2F%2A",
            "@multimediatype": "GIF image file",
            "@type": "IMAGE-THUMBNAIL",
            "@size": "8708",
            "@ref": "fx14",
            "@mimetype": "image/gif"
          },
          {
            "@category": "thumbnail",
            "@height": "163",
            "@width": "98",
            "@_fa": "true",
            "$": "https://api.elsevier.com/content/object/eid/1-s2.0-S2468823125006157-sc1.sml?httpAccept=%2A%2F%2A",
            "@multimediatype": "GIF image file",
            "@type": "IMAGE-THUMBNAIL",
            "@size": "6838",
            "@ref": "sc1",
            "@mimetype": "image/gif"
          },
          {
            "@category": "thumbnail",
            "@height": "147",
            "@width": "219",
            "@_fa": "true",
            "$": "https://api.elsevier.com/content/object/eid/1-s2.0-S2468823125006157-fx15.sml?httpAccept=%2A%2F%2A",
            "@multimediatype": "GIF image file",
            "@type": "IMAGE-THUMBNAIL",
            "@size": "10429",
            "@ref": "fx15",
            "@mimetype": "image/gif"
          },
          {
            "@category": "thumbnail",
            "@height": "164",
            "@width": "188",
            "@_fa": "true",
            "$": "https://api.elsevier.com/content/object/eid/1-s2.0-S2468823125006157-fx16.sml?httpAccept=%2A%2F%2A",
            "@multimediatype": "GIF image file",
            "@type": "IMAGE-THUMBNAIL",
            "@size": "10036",
            "@ref": "fx16",
            "@mimetype": "image/gif"
          },
          {
            "@category": "thumbnail",
            "@height": "132",
            "@width": "219",
            "@_fa": "true",
            "$": "https://api.elsevier.com/content/object/eid/1-s2.0-S2468823125006157-fx17.sml?httpAccept=%2A%2F%2A",
            "@multimediatype": "GIF image file",
            "@type": "IMAGE-THUMBNAIL",
            "@size": "8716",
            "@ref": "fx17",
            "@mimetype": "image/gif"
          },
          {
            "@category": "thumbnail",
            "@height": "164",
            "@width": "212",
            "@_fa": "true",
            "$": "https://api.elsevier.com/content/object/eid/1-s2.0-S2468823125006157-fx21.sml?httpAccept=%2A%2F%2A",
            "@multimediatype": "GIF image file",
            "@type": "IMAGE-THUMBNAIL",
            "@size": "11169",
            "@ref": "fx21",
            "@mimetype": "image/gif"
          },
          {
            "@category": "thumbnail",
            "@height": "163",
            "@width": "185",
            "@_fa": "true",
            "$": "https://api.elsevier.com/content/object/eid/1-s2.0-S2468823125006157-fx22.sml?httpAccept=%2A%2F%2A",
            "@multimediatype": "GIF image file",
            "@type": "IMAGE-THUMBNAIL",
            "@size": "9932",
            "@ref": "fx22",
            "@mimetype": "image/gif"
          },
          {
            "@category": "thumbnail",
            "@height": "95",
            "@width": "219",
            "@_fa": "true",
            "$": "https://api.elsevier.com/content/object/eid/1-s2.0-S2468823125006157-fx23.sml?httpAccept=%2A%2F%2A",
            "@multimediatype": "GIF image file",
            "@type": "IMAGE-THUMBNAIL",
            "@size": "8049",
            "@ref": "fx23",
            "@mimetype": "image/gif"
          },
          {
            "@category": "thumbnail",
            "@height": "164",
            "@width": "216",
            "@_fa": "true",
            "$": "https://api.elsevier.com/content/object/eid/1-s2.0-S2468823125006157-fx24.sml?httpAccept=%2A%2F%2A",
            "@multimediatype": "GIF image file",
            "@type": "IMAGE-THUMBNAIL",
            "@size": "11494",
            "@ref": "fx24",
            "@mimetype": "image/gif"
          },
          {
            "@category": "thumbnail",
            "@height": "99",
            "@width": "219",
            "@_fa": "true",
            "$": "https://api.elsevier.com/content/object/eid/1-s2.0-S2468823125006157-fx20.sml?httpAccept=%2A%2F%2A",
            "@multimediatype": "GIF image file",
            "@type": "IMAGE-THUMBNAIL",
            "@size": "8581",
            "@ref": "fx20",
            "@mimetype": "image/gif"
          },
          {
            "@category": "thumbnail",
            "@height": "164",
            "@width": "178",
            "@_fa": "true",
            "$": "https://api.elsevier.com/content/object/eid/1-s2.0-S2468823125006157-fx29.sml?httpAccept=%2A%2F%2A",
            "@multimediatype": "GIF image file",
            "@type": "IMAGE-THUMBNAIL",
            "@size": "9144",
            "@ref": "fx29",
            "@mimetype": "image/gif"
          },
          {
            "@category": "thumbnail",
            "@height": "164",
            "@width": "188",
            "@_fa": "true",
            "$": "https://api.elsevier.com/content/object/eid/1-s2.0-S2468823125006157-fx25.sml?httpAccept=%2A%2F%2A",
            "@multimediatype": "GIF image file",
            "@type": "IMAGE-THUMBNAIL",
            "@size": "10054",
            "@ref": "fx25",
            "@mimetype": "image/gif"
          },
          {
            "@category": "thumbnail",
            "@height": "90",
            "@width": "219",
            "@_fa": "true",
            "$": "https://api.elsevier.com/content/object/eid/1-s2.0-S2468823125006157-fx26.sml?httpAccept=%2A%2F%2A",
            "@multimediatype": "GIF image file",
            "@type": "IMAGE-THUMBNAIL",
            "@size": "7637",
            "@ref": "fx26",
            "@mimetype": "image/gif"
          },
          {
            "@category": "thumbnail",
            "@height": "164",
            "@width": "219",
            "@_fa": "true",
            "$": "https://api.elsevier.com/content/object/eid/1-s2.0-S2468823125006157-fx27.sml?httpAccept=%2A%2F%2A",
            "@multimediatype": "GIF image file",
            "@type": "IMAGE-THUMBNAIL",
            "@size": "11775",
            "@ref": "fx27",
            "@mimetype": "image/gif"
          },
          {
            "@category": "thumbnail",
            "@height": "164",
            "@width": "188",
            "@_fa": "true",
            "$": "https://api.elsevier.com/content/object/eid/1-s2.0-S2468823125006157-fx28.sml?httpAccept=%2A%2F%2A",
            "@multimediatype": "GIF image file",
            "@type": "IMAGE-THUMBNAIL",
            "@size": "10044",
            "@ref": "fx28",
            "@mimetype": "image/gif"
          },
          {
            "@category": "thumbnail",
            "@height": "102",
            "@width": "219",
            "@_fa": "true",
            "$": "https://api.elsevier.com/content/object/eid/1-s2.0-S2468823125006157-gr8.sml?httpAccept=%2A%2F%2A",
            "@multimediatype": "GIF image file",
            "@type": "IMAGE-THUMBNAIL",
            "@size": "7775",
            "@ref": "gr8",
            "@mimetype": "image/gif"
          },
          {
            "@category": "thumbnail",
            "@height": "73",
            "@width": "219",
            "@_fa": "true",
            "$": "https://api.elsevier.com/content/object/eid/1-s2.0-S2468823125006157-gr7.sml?httpAccept=%2A%2F%2A",
            "@multimediatype": "GIF image file",
            "@type": "IMAGE-THUMBNAIL",
            "@size": "7524",
            "@ref": "gr7",
            "@mimetype": "image/gif"
          },
          {
            "@category": "thumbnail",
            "@height": "163",
            "@width": "151",
            "@_fa": "true",
            "$": "https://api.elsevier.com/content/object/eid/1-s2.0-S2468823125006157-gr6.sml?httpAccept=%2A%2F%2A",
            "@multimediatype": "GIF image file",
            "@type": "IMAGE-THUMBNAIL",
            "@size": "10346",
            "@ref": "gr6",
            "@mimetype": "image/gif"
          },
          {
            "@category": "thumbnail",
            "@height": "90",
            "@width": "219",
            "@_fa": "true",
            "$": "https://api.elsevier.com/content/object/eid/1-s2.0-S2468823125006157-fx32.sml?httpAccept=%2A%2F%2A",
            "@multimediatype": "GIF image file",
            "@type": "IMAGE-THUMBNAIL",
            "@size": "7545",
            "@ref": "fx32",
            "@mimetype": "image/gif"
          },
          {
            "@category": "thumbnail",
            "@height": "164",
            "@width": "218",
            "@_fa": "true",
            "$": "https://api.elsevier.com/content/object/eid/1-s2.0-S2468823125006157-fx33.sml?httpAccept=%2A%2F%2A",
            "@multimediatype": "GIF image file",
            "@type": "IMAGE-THUMBNAIL",
            "@size": "11041",
            "@ref": "fx33",
            "@mimetype": "image/gif"
          },
          {
            "@category": "thumbnail",
            "@height": "164",
            "@width": "188",
            "@_fa": "true",
            "$": "https://api.elsevier.com/content/object/eid/1-s2.0-S2468823125006157-fx34.sml?httpAccept=%2A%2F%2A",
            "@multimediatype": "GIF image file",
            "@type": "IMAGE-THUMBNAIL",
            "@size": "10127",
            "@ref": "fx34",
            "@mimetype": "image/gif"
          },
          {
            "@category": "thumbnail",
            "@height": "47",
            "@width": "215",
            "@_fa": "true",
            "$": "https://api.elsevier.com/content/object/eid/1-s2.0-S2468823125006157-fx35.sml?httpAccept=%2A%2F%2A",
            "@multimediatype": "GIF image file",
            "@type": "IMAGE-THUMBNAIL",
            "@size": "5945",
            "@ref": "fx35",
            "@mimetype": "image/gif"
          },
          {
            "@category": "thumbnail",
            "@height": "121",
            "@width": "219",
            "@_fa": "true",
            "$": "https://api.elsevier.com/content/object/eid/1-s2.0-S2468823125006157-fx30.sml?httpAccept=%2A%2F%2A",
            "@multimediatype": "GIF image file",
            "@type": "IMAGE-THUMBNAIL",
            "@size": "9478",
            "@ref": "fx30",
            "@mimetype": "image/gif"
          },
          {
            "@category": "thumbnail",
            "@height": "164",
            "@width": "188",
            "@_fa": "true",
            "$": "https://api.elsevier.com/content/object/eid/1-s2.0-S2468823125006157-fx31.sml?httpAccept=%2A%2F%2A",
            "@multimediatype": "GIF image file",
            "@type": "IMAGE-THUMBNAIL",
            "@size": "10038",
            "@ref": "fx31",
            "@mimetype": "image/gif"
          },
          {
            "@category": "thumbnail",
            "@height": "163",
            "@width": "189",
            "@_fa": "true",
            "$": "https://api.elsevier.com/content/object/eid/1-s2.0-S2468823125006157-fx4.sml?httpAccept=%2A%2F%2A",
            "@multimediatype": "GIF image file",
            "@type": "IMAGE-THUMBNAIL",
            "@size": "10263",
            "@ref": "fx4",
            "@mimetype": "image/gif"
          },
          {
            "@category": "thumbnail",
            "@height": "150",
            "@width": "219",
            "@_fa": "true",
            "$": "https://api.elsevier.com/content/object/eid/1-s2.0-S2468823125006157-fx36.sml?httpAccept=%2A%2F%2A",
            "@multimediatype": "GIF image file",
            "@type": "IMAGE-THUMBNAIL",
            "@size": "9972",
            "@ref": "fx36",
            "@mimetype": "image/gif"
          },
          {
            "@category": "thumbnail",
            "@height": "149",
            "@width": "219",
            "@_fa": "true",
            "$": "https://api.elsevier.com/content/object/eid/1-s2.0-S2468823125006157-fx3.sml?httpAccept=%2A%2F%2A",
            "@multimediatype": "GIF image file",
            "@type": "IMAGE-THUMBNAIL",
            "@size": "11646",
            "@ref": "fx3",
            "@mimetype": "image/gif"
          },
          {
            "@category": "thumbnail",
            "@height": "164",
            "@width": "188",
            "@_fa": "true",
            "$": "https://api.elsevier.com/content/object/eid/1-s2.0-S2468823125006157-fx37.sml?httpAccept=%2A%2F%2A",
            "@multimediatype": "GIF image file",
            "@type": "IMAGE-THUMBNAIL",
            "@size": "10166",
            "@ref": "fx37",
            "@mimetype": "image/gif"
          },
          {
            "@category": "thumbnail",
            "@height": "119",
            "@width": "219",
            "@_fa": "true",
            "$": "https://api.elsevier.com/content/object/eid/1-s2.0-S2468823125006157-fx2.sml?httpAccept=%2A%2F%2A",
            "@multimediatype": "GIF image file",
            "@type": "IMAGE-THUMBNAIL",
            "@size": "10971",
            "@ref": "fx2",
            "@mimetype": "image/gif"
          },
          {
            "@category": "thumbnail",
            "@height": "27",
            "@width": "219",
            "@_fa": "true",
            "$": "https://api.elsevier.com/content/object/eid/1-s2.0-S2468823125006157-fx38.sml?httpAccept=%2A%2F%2A",
            "@multimediatype": "GIF image file",
            "@type": "IMAGE-THUMBNAIL",
            "@size": "4541",
            "@ref": "fx38",
            "@mimetype": "image/gif"
          },
          {
            "@category": "thumbnail",
            "@height": "164",
            "@width": "188",
            "@_fa": "true",
            "$": "https://api.elsevier.com/content/object/eid/1-s2.0-S2468823125006157-fx1.sml?httpAccept=%2A%2F%2A",
            "@multimediatype": "GIF image file",
            "@type": "IMAGE-THUMBNAIL",
            "@size": "10258",
            "@ref": "fx1",
            "@mimetype": "image/gif"
          },
          {
            "@category": "thumbnail",
            "@height": "135",
            "@width": "219",
            "@_fa": "true",
            "$": "https://api.elsevier.com/content/object/eid/1-s2.0-S2468823125006157-fx39.sml?httpAccept=%2A%2F%2A",
            "@multimediatype": "GIF image file",
            "@type": "IMAGE-THUMBNAIL",
            "@size": "8313",
            "@ref": "fx39",
            "@mimetype": "image/gif"
          },
          {
            "@category": "thumbnail",
            "@height": "80",
            "@width": "219",
            "@_fa": "true",
            "$": "https://api.elsevier.com/content/object/eid/1-s2.0-S2468823125006157-gr1.sml?httpAccept=%2A%2F%2A",
            "@multimediatype": "GIF image file",
            "@type": "IMAGE-THUMBNAIL",
            "@size": "8168",
            "@ref": "gr1",
            "@mimetype": "image/gif"
          },
          {
            "@category": "thumbnail",
            "@height": "164",
            "@width": "201",
            "@_fa": "true",
            "$": "https://api.elsevier.com/content/object/eid/1-s2.0-S2468823125006157-fx8.sml?httpAccept=%2A%2F%2A",
            "@multimediatype": "GIF image file",
            "@type": "IMAGE-THUMBNAIL",
            "@size": "10499",
            "@ref": "fx8",
            "@mimetype": "image/gif"
          },
          {
            "@category": "thumbnail",
            "@height": "164",
            "@width": "189",
            "@_fa": "true",
            "$": "https://api.elsevier.com/content/object/eid/1-s2.0-S2468823125006157-fx7.sml?httpAccept=%2A%2F%2A",
            "@multimediatype": "GIF image file",
            "@type": "IMAGE-THUMBNAIL",
            "@size": "10285",
            "@ref": "fx7",
            "@mimetype": "image/gif"
          },
          {
            "@category": "thumbnail",
            "@height": "131",
            "@width": "219",
            "@_fa": "true",
            "$": "https://api.elsevier.com/content/object/eid/1-s2.0-S2468823125006157-fx6.sml?httpAccept=%2A%2F%2A",
            "@multimediatype": "GIF image file",
            "@type": "IMAGE-THUMBNAIL",
            "@size": "10244",
            "@ref": "fx6",
            "@mimetype": "image/gif"
          },
          {
            "@category": "thumbnail",
            "@height": "131",
            "@width": "219",
            "@_fa": "true",
            "$": "https://api.elsevier.com/content/object/eid/1-s2.0-S2468823125006157-fx5.sml?httpAccept=%2A%2F%2A",
            "@multimediatype": "GIF image file",
            "@type": "IMAGE-THUMBNAIL",
            "@size": "12224",
            "@ref": "fx5",
            "@mimetype": "image/gif"
          },
          {
            "@category": "thumbnail",
            "@height": "147",
            "@width": "219",
            "@_fa": "true",
            "$": "https://api.elsevier.com/content/object/eid/1-s2.0-S2468823125006157-gr5.sml?httpAccept=%2A%2F%2A",
            "@multimediatype": "GIF image file",
            "@type": "IMAGE-THUMBNAIL",
            "@size": "23152",
            "@ref": "gr5",
            "@mimetype": "image/gif"
          },
          {
            "@category": "thumbnail",
            "@height": "155",
            "@width": "219",
            "@_fa": "true",
            "$": "https://api.elsevier.com/content/object/eid/1-s2.0-S2468823125006157-gr4.sml?httpAccept=%2A%2F%2A",
            "@multimediatype": "GIF image file",
            "@type": "IMAGE-THUMBNAIL",
            "@size": "25496",
            "@ref": "gr4",
            "@mimetype": "image/gif"
          },
          {
            "@category": "thumbnail",
            "@height": "164",
            "@width": "198",
            "@_fa": "true",
            "$": "https://api.elsevier.com/content/object/eid/1-s2.0-S2468823125006157-gr3.sml?httpAccept=%2A%2F%2A",
            "@multimediatype": "GIF image file",
            "@type": "IMAGE-THUMBNAIL",
            "@size": "11938",
            "@ref": "gr3",
            "@mimetype": "image/gif"
          },
          {
            "@category": "thumbnail",
            "@height": "154",
            "@width": "219",
            "@_fa": "true",
            "$": "https://api.elsevier.com/content/object/eid/1-s2.0-S2468823125006157-gr2.sml?httpAccept=%2A%2F%2A",
            "@multimediatype": "GIF image file",
            "@type": "IMAGE-THUMBNAIL",
            "@size": "12320",
            "@ref": "gr2",
            "@mimetype": "image/gif"
          },
          {
            "@category": "thumbnail",
            "@height": "125",
            "@width": "219",
            "@_fa": "true",
            "$": "https://api.elsevier.com/content/object/eid/1-s2.0-S2468823125006157-fx9.sml?httpAccept=%2A%2F%2A",
            "@multimediatype": "GIF image file",
            "@type": "IMAGE-THUMBNAIL",
            "@size": "9871",
            "@ref": "fx9",
            "@mimetype": "image/gif"
          },
          {
            "@category": "high",
            "@height": "725",
            "@width": "2213",
            "@_fa": "true",
            "$": "https://api.elsevier.com/content/object/eid/1-s2.0-S2468823125006157-ga1_lrg.jpg?httpAccept=%2A%2F%2A",
            "@multimediatype": "JPEG image file",
            "@type": "IMAGE-HIGH-RES",
            "@size": "207108",
            "@ref": "ga1",
            "@mimetype": "image/jpeg"
          },
          {
            "@category": "high",
            "@height": "287",
            "@width": "329",
            "@_fa": "true",
            "$": "https://api.elsevier.com/content/object/eid/1-s2.0-S2468823125006157-fx10_lrg.jpg?httpAccept=%2A%2F%2A",
            "@multimediatype": "JPEG image file",
            "@type": "IMAGE-HIGH-RES",
            "@size": "26176",
            "@ref": "fx10",
            "@mimetype": "image/jpeg"
          },
          {
            "@category": "high",
            "@height": "154",
            "@width": "347",
            "@_fa": "true",
            "$": "https://api.elsevier.com/content/object/eid/1-s2.0-S2468823125006157-fx11_lrg.jpg?httpAccept=%2A%2F%2A",
            "@multimediatype": "JPEG image file",
            "@type": "IMAGE-HIGH-RES",
            "@size": "18243",
            "@ref": "fx11",
            "@mimetype": "image/jpeg"
          },
          {
            "@category": "high",
            "@height": "384",
            "@width": "506",
            "@_fa": "true",
            "$": "https://api.elsevier.com/content/object/eid/1-s2.0-S2468823125006157-fx12_lrg.jpg?httpAccept=%2A%2F%2A",
            "@multimediatype": "JPEG image file",
            "@type": "IMAGE-HIGH-RES",
            "@size": "47398",
            "@ref": "fx12",
            "@mimetype": "image/jpeg"
          },
          {
            "@category": "high",
            "@height": "287",
            "@width": "329",
            "@_fa": "true",
            "$": "https://api.elsevier.com/content/object/eid/1-s2.0-S2468823125006157-fx13_lrg.jpg?httpAccept=%2A%2F%2A",
            "@multimediatype": "JPEG image file",
            "@type": "IMAGE-HIGH-RES",
            "@size": "26209",
            "@ref": "fx13",
            "@mimetype": "image/jpeg"
          },
          {
            "@category": "high",
            "@height": "385",
            "@width": "588",
            "@_fa": "true",
            "$": "https://api.elsevier.com/content/object/eid/1-s2.0-S2468823125006157-fx18_lrg.jpg?httpAccept=%2A%2F%2A",
            "@multimediatype": "JPEG image file",
            "@type": "IMAGE-HIGH-RES",
            "@size": "50271",
            "@ref": "fx18",
            "@mimetype": "image/jpeg"
          },
          {
            "@category": "high",
            "@height": "286",
            "@width": "329",
            "@_fa": "true",
            "$": "https://api.elsevier.com/content/object/eid/1-s2.0-S2468823125006157-fx19_lrg.jpg?httpAccept=%2A%2F%2A",
            "@multimediatype": "JPEG image file",
            "@type": "IMAGE-HIGH-RES",
            "@size": "26133",
            "@ref": "fx19",
            "@mimetype": "image/jpeg"
          },
          {
            "@category": "high",
            "@height": "153",
            "@width": "347",
            "@_fa": "true",
            "$": "https://api.elsevier.com/content/object/eid/1-s2.0-S2468823125006157-fx14_lrg.jpg?httpAccept=%2A%2F%2A",
            "@multimediatype": "JPEG image file",
            "@type": "IMAGE-HIGH-RES",
            "@size": "20396",
            "@ref": "fx14",
            "@mimetype": "image/jpeg"
          },
          {
            "@category": "high",
            "@height": "4418",
            "@width": "2659",
            "@_fa": "true",
            "$": "https://api.elsevier.com/content/object/eid/1-s2.0-S2468823125006157-sc1_lrg.jpg?httpAccept=%2A%2F%2A",
            "@multimediatype": "JPEG image file",
            "@type": "IMAGE-HIGH-RES",
            "@size": "1095134",
            "@ref": "sc1",
            "@mimetype": "image/jpeg"
          },
          {
            "@category": "high",
            "@height": "384",
            "@width": "572",
            "@_fa": "true",
            "$": "https://api.elsevier.com/content/object/eid/1-s2.0-S2468823125006157-fx15_lrg.jpg?httpAccept=%2A%2F%2A",
            "@multimediatype": "JPEG image file",
            "@type": "IMAGE-HIGH-RES",
            "@size": "50128",
            "@ref": "fx15",
            "@mimetype": "image/jpeg"
          },
          {
            "@category": "high",
            "@height": "287",
            "@width": "329",
            "@_fa": "true",
            "$": "https://api.elsevier.com/content/object/eid/1-s2.0-S2468823125006157-fx16_lrg.jpg?httpAccept=%2A%2F%2A",
            "@multimediatype": "JPEG image file",
            "@type": "IMAGE-HIGH-RES",
            "@size": "26169",
            "@ref": "fx16",
            "@mimetype": "image/jpeg"
          },
          {
            "@category": "high",
            "@height": "209",
            "@width": "347",
            "@_fa": "true",
            "$": "https://api.elsevier.com/content/object/eid/1-s2.0-S2468823125006157-fx17_lrg.jpg?httpAccept=%2A%2F%2A",
            "@multimediatype": "JPEG image file",
            "@type": "IMAGE-HIGH-RES",
            "@size": "19876",
            "@ref": "fx17",
            "@mimetype": "image/jpeg"
          },
          {
            "@category": "high",
            "@height": "384",
            "@width": "497",
            "@_fa": "true",
            "$": "https://api.elsevier.com/content/object/eid/1-s2.0-S2468823125006157-fx21_lrg.jpg?httpAccept=%2A%2F%2A",
            "@multimediatype": "JPEG image file",
            "@type": "IMAGE-HIGH-RES",
            "@size": "46092",
            "@ref": "fx21",
            "@mimetype": "image/jpeg"
          },
          {
            "@category": "high",
            "@height": "287",
            "@width": "325",
            "@_fa": "true",
            "$": "https://api.elsevier.com/content/object/eid/1-s2.0-S2468823125006157-fx22_lrg.jpg?httpAccept=%2A%2F%2A",
            "@multimediatype": "JPEG image file",
            "@type": "IMAGE-HIGH-RES",
            "@size": "25754",
            "@ref": "fx22",
            "@mimetype": "image/jpeg"
          },
          {
            "@category": "high",
            "@height": "153",
            "@width": "352",
            "@_fa": "true",
            "$": "https://api.elsevier.com/content/object/eid/1-s2.0-S2468823125006157-fx23_lrg.jpg?httpAccept=%2A%2F%2A",
            "@multimediatype": "JPEG image file",
            "@type": "IMAGE-HIGH-RES",
            "@size": "18746",
            "@ref": "fx23",
            "@mimetype": "image/jpeg"
          },
          {
            "@category": "high",
            "@height": "384",
            "@width": "506",
            "@_fa": "true",
            "$": "https://api.elsevier.com/content/object/eid/1-s2.0-S2468823125006157-fx24_lrg.jpg?httpAccept=%2A%2F%2A",
            "@multimediatype": "JPEG image file",
            "@type": "IMAGE-HIGH-RES",
            "@size": "47925",
            "@ref": "fx24",
            "@mimetype": "image/jpeg"
          },
          {
            "@category": "high",
            "@height": "143",
            "@width": "316",
            "@_fa": "true",
            "$": "https://api.elsevier.com/content/object/eid/1-s2.0-S2468823125006157-fx20_lrg.jpg?httpAccept=%2A%2F%2A",
            "@multimediatype": "JPEG image file",
            "@type": "IMAGE-HIGH-RES",
            "@size": "16721",
            "@ref": "fx20",
            "@mimetype": "image/jpeg"
          },
          {
            "@category": "high",
            "@height": "236",
            "@width": "256",
            "@_fa": "true",
            "$": "https://api.elsevier.com/content/object/eid/1-s2.0-S2468823125006157-fx29_lrg.jpg?httpAccept=%2A%2F%2A",
            "@multimediatype": "JPEG image file",
            "@type": "IMAGE-HIGH-RES",
            "@size": "17990",
            "@ref": "fx29",
            "@mimetype": "image/jpeg"
          },
          {
            "@category": "high",
            "@height": "287",
            "@width": "329",
            "@_fa": "true",
            "$": "https://api.elsevier.com/content/object/eid/1-s2.0-S2468823125006157-fx25_lrg.jpg?httpAccept=%2A%2F%2A",
            "@multimediatype": "JPEG image file",
            "@type": "IMAGE-HIGH-RES",
            "@size": "26099",
            "@ref": "fx25",
            "@mimetype": "image/jpeg"
          },
          {
            "@category": "high",
            "@height": "158",
            "@width": "384",
            "@_fa": "true",
            "$": "https://api.elsevier.com/content/object/eid/1-s2.0-S2468823125006157-fx26_lrg.jpg?httpAccept=%2A%2F%2A",
            "@multimediatype": "JPEG image file",
            "@type": "IMAGE-HIGH-RES",
            "@size": "19281",
            "@ref": "fx26",
            "@mimetype": "image/jpeg"
          },
          {
            "@category": "high",
            "@height": "384",
            "@width": "513",
            "@_fa": "true",
            "$": "https://api.elsevier.com/content/object/eid/1-s2.0-S2468823125006157-fx27_lrg.jpg?httpAccept=%2A%2F%2A",
            "@multimediatype": "JPEG image file",
            "@type": "IMAGE-HIGH-RES",
            "@size": "48401",
            "@ref": "fx27",
            "@mimetype": "image/jpeg"
          },
          {
            "@category": "high",
            "@height": "287",
            "@width": "329",
            "@_fa": "true",
            "$": "https://api.elsevier.com/content/object/eid/1-s2.0-S2468823125006157-fx28_lrg.jpg?httpAccept=%2A%2F%2A",
            "@multimediatype": "JPEG image file",
            "@type": "IMAGE-HIGH-RES",
            "@size": "26216",
            "@ref": "fx28",
            "@mimetype": "image/jpeg"
          },
          {
            "@category": "high",
            "@height": "1392",
            "@width": "2994",
            "@_fa": "true",
            "$": "https://api.elsevier.com/content/object/eid/1-s2.0-S2468823125006157-gr8_lrg.jpg?httpAccept=%2A%2F%2A",
            "@multimediatype": "JPEG image file",
            "@type": "IMAGE-HIGH-RES",
            "@size": "381932",
            "@ref": "gr8",
            "@mimetype": "image/jpeg"
          },
          {
            "@category": "high",
            "@height": "1168",
            "@width": "3492",
            "@_fa": "true",
            "$": "https://api.elsevier.com/content/object/eid/1-s2.0-S2468823125006157-gr7_lrg.jpg?httpAccept=%2A%2F%2A",
            "@multimediatype": "JPEG image file",
            "@type": "IMAGE-HIGH-RES",
            "@size": "332647",
            "@ref": "gr7",
            "@mimetype": "image/jpeg"
          },
          {
            "@category": "high",
            "@height": "3775",
            "@width": "3489",
            "@_fa": "true",
            "$": "https://api.elsevier.com/content/object/eid/1-s2.0-S2468823125006157-gr6_lrg.jpg?httpAccept=%2A%2F%2A",
            "@multimediatype": "JPEG image file",
            "@type": "IMAGE-HIGH-RES",
            "@size": "939608",
            "@ref": "gr6",
            "@mimetype": "image/jpeg"
          },
          {
            "@category": "high",
            "@height": "155",
            "@width": "379",
            "@_fa": "true",
            "$": "https://api.elsevier.com/content/object/eid/1-s2.0-S2468823125006157-fx32_lrg.jpg?httpAccept=%2A%2F%2A",
            "@multimediatype": "JPEG image file",
            "@type": "IMAGE-HIGH-RES",
            "@size": "19360",
            "@ref": "fx32",
            "@mimetype": "image/jpeg"
          },
          {
            "@category": "high",
            "@height": "391",
            "@width": "520",
            "@_fa": "true",
            "$": "https://api.elsevier.com/content/object/eid/1-s2.0-S2468823125006157-fx33_lrg.jpg?httpAccept=%2A%2F%2A",
            "@multimediatype": "JPEG image file",
            "@type": "IMAGE-HIGH-RES",
            "@size": "47932",
            "@ref": "fx33",
            "@mimetype": "image/jpeg"
          },
          {
            "@category": "high",
            "@height": "269",
            "@width": "309",
            "@_fa": "true",
            "$": "https://api.elsevier.com/content/object/eid/1-s2.0-S2468823125006157-fx34_lrg.jpg?httpAccept=%2A%2F%2A",
            "@multimediatype": "JPEG image file",
            "@type": "IMAGE-HIGH-RES",
            "@size": "24275",
            "@ref": "fx34",
            "@mimetype": "image/jpeg"
          },
          {
            "@category": "high",
            "@height": "47",
            "@width": "215",
            "@_fa": "true",
            "$": "https://api.elsevier.com/content/object/eid/1-s2.0-S2468823125006157-fx35_lrg.jpg?httpAccept=%2A%2F%2A",
            "@multimediatype": "JPEG image file",
            "@type": "IMAGE-HIGH-RES",
            "@size": "7818",
            "@ref": "fx35",
            "@mimetype": "image/jpeg"
          },
          {
            "@category": "high",
            "@height": "343",
            "@width": "619",
            "@_fa": "true",
            "$": "https://api.elsevier.com/content/object/eid/1-s2.0-S2468823125006157-fx30_lrg.jpg?httpAccept=%2A%2F%2A",
            "@multimediatype": "JPEG image file",
            "@type": "IMAGE-HIGH-RES",
            "@size": "48944",
            "@ref": "fx30",
            "@mimetype": "image/jpeg"
          },
          {
            "@category": "high",
            "@height": "287",
            "@width": "329",
            "@_fa": "true",
            "$": "https://api.elsevier.com/content/object/eid/1-s2.0-S2468823125006157-fx31_lrg.jpg?httpAccept=%2A%2F%2A",
            "@multimediatype": "JPEG image file",
            "@type": "IMAGE-HIGH-RES",
            "@size": "26097",
            "@ref": "fx31",
            "@mimetype": "image/jpeg"
          },
          {
            "@category": "high",
            "@height": "268",
            "@width": "310",
            "@_fa": "true",
            "$": "https://api.elsevier.com/content/object/eid/1-s2.0-S2468823125006157-fx4_lrg.jpg?httpAccept=%2A%2F%2A",
            "@multimediatype": "JPEG image file",
            "@type": "IMAGE-HIGH-RES",
            "@size": "23892",
            "@ref": "fx4",
            "@mimetype": "image/jpeg"
          },
          {
            "@category": "high",
            "@height": "321",
            "@width": "468",
            "@_fa": "true",
            "$": "https://api.elsevier.com/content/object/eid/1-s2.0-S2468823125006157-fx36_lrg.jpg?httpAccept=%2A%2F%2A",
            "@multimediatype": "JPEG image file",
            "@type": "IMAGE-HIGH-RES",
            "@size": "35970",
            "@ref": "fx36",
            "@mimetype": "image/jpeg"
          },
          {
            "@category": "high",
            "@height": "322",
            "@width": "474",
            "@_fa": "true",
            "$": "https://api.elsevier.com/content/object/eid/1-s2.0-S2468823125006157-fx3_lrg.jpg?httpAccept=%2A%2F%2A",
            "@multimediatype": "JPEG image file",
            "@type": "IMAGE-HIGH-RES",
            "@size": "41447",
            "@ref": "fx3",
            "@mimetype": "image/jpeg"
          },
          {
            "@category": "high",
            "@height": "269",
            "@width": "309",
            "@_fa": "true",
            "$": "https://api.elsevier.com/content/object/eid/1-s2.0-S2468823125006157-fx37_lrg.jpg?httpAccept=%2A%2F%2A",
            "@multimediatype": "JPEG image file",
            "@type": "IMAGE-HIGH-RES",
            "@size": "24298",
            "@ref": "fx37",
            "@mimetype": "image/jpeg"
          },
          {
            "@category": "high",
            "@height": "130",
            "@width": "240",
            "@_fa": "true",
            "$": "https://api.elsevier.com/content/object/eid/1-s2.0-S2468823125006157-fx2_lrg.jpg?httpAccept=%2A%2F%2A",
            "@multimediatype": "JPEG image file",
            "@type": "IMAGE-HIGH-RES",
            "@size": "13947",
            "@ref": "fx2",
            "@mimetype": "image/jpeg"
          },
          {
            "@category": "high",
            "@height": "46",
            "@width": "370",
            "@_fa": "true",
            "$": "https://api.elsevier.com/content/object/eid/1-s2.0-S2468823125006157-fx38_lrg.jpg?httpAccept=%2A%2F%2A",
            "@multimediatype": "JPEG image file",
            "@type": "IMAGE-HIGH-RES",
            "@size": "11327",
            "@ref": "fx38",
            "@mimetype": "image/jpeg"
          },
          {
            "@category": "high",
            "@height": "269",
            "@width": "309",
            "@_fa": "true",
            "$": "https://api.elsevier.com/content/object/eid/1-s2.0-S2468823125006157-fx1_lrg.jpg?httpAccept=%2A%2F%2A",
            "@multimediatype": "JPEG image file",
            "@type": "IMAGE-HIGH-RES",
            "@size": "23744",
            "@ref": "fx1",
            "@mimetype": "image/jpeg"
          },
          {
            "@category": "high",
            "@height": "363",
            "@width": "587",
            "@_fa": "true",
            "$": "https://api.elsevier.com/content/object/eid/1-s2.0-S2468823125006157-fx39_lrg.jpg?httpAccept=%2A%2F%2A",
            "@multimediatype": "JPEG image file",
            "@type": "IMAGE-HIGH-RES",
            "@size": "40136",
            "@ref": "fx39",
            "@mimetype": "image/jpeg"
          },
          {
            "@category": "high",
            "@height": "1277",
            "@width": "3492",
            "@_fa": "true",
            "$": "https://api.elsevier.com/content/object/eid/1-s2.0-S2468823125006157-gr1_lrg.jpg?httpAccept=%2A%2F%2A",
            "@multimediatype": "JPEG image file",
            "@type": "IMAGE-HIGH-RES",
            "@size": "341523",
            "@ref": "gr1",
            "@mimetype": "image/jpeg"
          },
          {
            "@category": "high",
            "@height": "196",
            "@width": "240",
            "@_fa": "true",
            "$": "https://api.elsevier.com/content/object/eid/1-s2.0-S2468823125006157-fx8_lrg.jpg?httpAccept=%2A%2F%2A",
            "@multimediatype": "JPEG image file",
            "@type": "IMAGE-HIGH-RES",
            "@size": "15850",
            "@ref": "fx8",
            "@mimetype": "image/jpeg"
          },
          {
            "@category": "high",
            "@height": "269",
            "@width": "310",
            "@_fa": "true",
            "$": "https://api.elsevier.com/content/object/eid/1-s2.0-S2468823125006157-fx7_lrg.jpg?httpAccept=%2A%2F%2A",
            "@multimediatype": "JPEG image file",
            "@type": "IMAGE-HIGH-RES",
            "@size": "23921",
            "@ref": "fx7",
            "@mimetype": "image/jpeg"
          },
          {
            "@category": "high",
            "@height": "322",
            "@width": "538",
            "@_fa": "true",
            "$": "https://api.elsevier.com/content/object/eid/1-s2.0-S2468823125006157-fx6_lrg.jpg?httpAccept=%2A%2F%2A",
            "@multimediatype": "JPEG image file",
            "@type": "IMAGE-HIGH-RES",
            "@size": "44042",
            "@ref": "fx6",
            "@mimetype": "image/jpeg"
          },
          {
            "@category": "high",
            "@height": "144",
            "@width": "240",
            "@_fa": "true",
            "$": "https://api.elsevier.com/content/object/eid/1-s2.0-S2468823125006157-fx5_lrg.jpg?httpAccept=%2A%2F%2A",
            "@multimediatype": "JPEG image file",
            "@type": "IMAGE-HIGH-RES",
            "@size": "16186",
            "@ref": "fx5",
            "@mimetype": "image/jpeg"
          },
          {
            "@category": "high",
            "@height": "2339",
            "@width": "3492",
            "@_fa": "true",
            "$": "https://api.elsevier.com/content/object/eid/1-s2.0-S2468823125006157-gr5_lrg.jpg?httpAccept=%2A%2F%2A",
            "@multimediatype": "JPEG image file",
            "@type": "IMAGE-HIGH-RES",
            "@size": "1032129",
            "@ref": "gr5",
            "@mimetype": "image/jpeg"
          },
          {
            "@category": "high",
            "@height": "2475",
            "@width": "3492",
            "@_fa": "true",
            "$": "https://api.elsevier.com/content/object/eid/1-s2.0-S2468823125006157-gr4_lrg.jpg?httpAccept=%2A%2F%2A",
            "@multimediatype": "JPEG image file",
            "@type": "IMAGE-HIGH-RES",
            "@size": "2284188",
            "@ref": "gr4",
            "@mimetype": "image/jpeg"
          },
          {
            "@category": "high",
            "@height": "2476",
            "@width": "2992",
            "@_fa": "true",
            "$": "https://api.elsevier.com/content/object/eid/1-s2.0-S2468823125006157-gr3_lrg.jpg?httpAccept=%2A%2F%2A",
            "@multimediatype": "JPEG image file",
            "@type": "IMAGE-HIGH-RES",
            "@size": "604424",
            "@ref": "gr3",
            "@mimetype": "image/jpeg"
          },
          {
            "@category": "high",
            "@height": "1866",
            "@width": "2660",
            "@_fa": "true",
            "$": "https://api.elsevier.com/content/object/eid/1-s2.0-S2468823125006157-gr2_lrg.jpg?httpAccept=%2A%2F%2A",
            "@multimediatype": "JPEG image file",
            "@type": "IMAGE-HIGH-RES",
            "@size": "424133",
            "@ref": "gr2",
            "@mimetype": "image/jpeg"
          },
          {
            "@category": "high",
            "@height": "314",
            "@width": "551",
            "@_fa": "true",
            "$": "https://api.elsevier.com/content/object/eid/1-s2.0-S2468823125006157-fx9_lrg.jpg?httpAccept=%2A%2F%2A",
            "@multimediatype": "JPEG image file",
            "@type": "IMAGE-HIGH-RES",
            "@size": "43240",
            "@ref": "fx9",
            "@mimetype": "image/jpeg"
          },
          {
            "@category": "standard",
            "@_fa": "true",
            "$": "https://api.elsevier.com/content/object/eid/1-s2.0-S2468823125006157-mmc1.docx?httpAccept=%2A%2F%2A",
            "@multimediatype": "Microsoft Word file",
            "@type": "APPLICATION",
            "@size": "12749237",
            "@ref": "mmc1",
            "@mimetype": "application/word"
          },
          {
            "@category": "thumbnail",
            "@_fa": "true",
            "$": "https://api.elsevier.com/content/object/eid/1-s2.0-S2468823125006157-si1.svg?httpAccept=%2A%2F%2A",
            "@multimediatype": "Scalable Vector Graphics file",
            "@type": "ALTIMG",
            "@size": "7798",
            "@ref": "si1",
            "@mimetype": "image/svg+xml"
          },
          {
            "@category": "thumbnail",
            "@_fa": "true",
            "$": "https://api.elsevier.com/content/object/eid/1-s2.0-S2468823125006157-si2.svg?httpAccept=%2A%2F%2A",
            "@multimediatype": "Scalable Vector Graphics file",
            "@type": "ALTIMG",
            "@size": "8541",
            "@ref": "si2",
            "@mimetype": "image/svg+xml"
          },
          {
            "@category": "thumbnail",
            "@_fa": "true",
            "$": "https://api.elsevier.com/content/object/eid/1-s2.0-S2468823125006157-si3.svg?httpAccept=%2A%2F%2A",
            "@multimediatype": "Scalable Vector Graphics file",
            "@type": "ALTIMG",
            "@size": "5047",
            "@ref": "si3",
            "@mimetype": "image/svg+xml"
          }
        ]
      },
      "link": {
        "@rel": "abstract",
        "@href": "https://api.elsevier.com/content/abstract/scopus_id/105013521950"
      }
    }
  }
}