{
  "metadata": {
    "title": "Zirconium-malate coordination polymer: a green catalyst for transfer hydrogenation of Ethyl Levulinate to Synthesize <ce:italic>γ</ce:italic>-valerolactone",
    "authors": "; ; ",
    "journal": "Molecular Catalysis",
    "date": "2025-11-30",
    "doi": "10.1016/j.mcat.2025.115454",
    "abstract": "",
    "uri": "https://api.elsevier.com/content/article/pii/S246882312500639X",
    "pii": "S246882312500639X"
  },
  "fulltext": {
    "full-text-retrieval-response": {
      "scopus-eid": "2-s2.0-105014255126",
      "originalText": "serial JL 315758 291210 291744 291790 291809 31 Molecular Catalysis MOLECULARCATALYSIS 2025-08-28 2025-08-28 2025-08-28 2025-08-28 2025-09-12T11:56:17 1-s2.0-S246882312500639X S2468-8231(25)00639-X S246882312500639X 10.1016/j.mcat.2025.115454 S300 S300.1 FULL-TEXT 1-s2.0-S2468823125X00134 2025-09-12T11:06:16.172661Z 0 0 20251101 20251130 2025 2025-08-28T15:59:22.023183Z absattachment articleinfo articlenumber articletitlenorm authfirstinitialnorm authfirstsurnamenorm cid cids contenttype copyright crossmark dateloaded dateloadedtxt datesearch datesort dateupdated dco docsubtype doctype doi eid ewtransactionid hubeid indexeddate issn issnnorm itemstage itemtransactionid itemweight openaccess openarchive pg pgfirst pii piinorm pubdateend pubdatestart pubdatetxt pubyr sectiontitle sortorder srctitle srctitlenorm srctype ssids alllist content subj subheadings suppl tomb volfirst volissue volumelist webpdf webpdfpagecount yearnav figure table e-component body mmlmath affil appendices articletitle auth authfirstini authfull authkeywords authlast highlightsabst orcid primabst pubtype ref specialabst 2468-8231 24688231 true 586 586 C Volume 586 41 115454 115454 115454 202511 November 2025 2025-11-01 2025-11-30 2025 Regular Papers article fla © 2025 Elsevier B.V. All rights are reserved, including those for text and data mining, AI training, and similar technologies. ZIRCONIUMMALATECOORDINATIONPOLYMERAGREENCATALYSTFORTRANSFERHYDROGENATIONETHYLLEVULINATESYNTHESIZEVALEROLACTONE WANG S 1 Introduction 2 Experimental section 2.1 Materials 2.2 Catalysts preparation 2.3 Catalyst characterization 2.4 Procedure for catalytic reaction 2.5 Analytical method 3 Results and discussion 3.1 Characterization of catalysts 3.2 Catalytic test 3.3 Kinetic study 3.4 Catalyst stability 3.5 Tolerance assessment 3.6 Reaction mechanism 4 Conclusions CRediT authorship contribution statement Appendix Supplementary materials References GAO 2023 112890 J LIU 2021 1983 1988 H FEIYICHEN 2025 115315 T KERKEL 2021 2962 2976 F GONZALEZ 2023 117535 G LIU 2023 112771 D JIANG 2021 7065 7073 L YANG 2024 124193 J FENG 2019 1743 1756 H DU 2023 1912 1918 Y ZADA 2020 3427 3432 B QIN 2025 108026 Z WANG 2025 114804 Y HUANG 2021 121557 R LI 2020 163 174 J SHARMA 2024 4211 4248 D WANG 2022 911 921 Y LI 2021 1286 1297 X LI 2017 67 77 F JUUTILAINEN 2006 86 92 S WU 2020 7363 7372 H PEREZMENDEZ 2015 1767 1770 C ALOTHMAN 2012 2874 2902 Z HE 2020 359 370 J LIU 2009 5875 5879 J CHEN 2021 430 441 X ZHANG 2023 119064 P WU 2023 140156 Y AMAROGAHETE 2019 117190 J ZHANG 2009 2643 2649 R WAN 2021 3428 3438 F WANG 2022 112329 W ZHANG 2019 56 67 H SHAN 2025 124769 J ZHONG 2024 123421 L WANG 2021 4780 4789 H REN 2016 5999 6003 D ZHENG 2016 28898 J LANGE 2010 4479 4483 J SERRANORUIZ 2010 J BOND 2010 16291 16298 J TANG 2014 827 834 X DENG 2024 114346 Z ANTUNES 2016 485 503 M LI 2024 114938 Y ZHANG 2022 1181 1198 Z ZHANG 2024 157570 J WANG 2019 17207 17216 S WANG 2019 4657 4664 Y ORTUNO 2022 3567 3573 M YASUTAKAKUWAHARA 2017 1141 1152 H KHABAZI 2024 14387 14401 M WEI 2021 10882 10891 Z ZHANG 2025 115999 L WANGX2025X115454 WANGX2025X115454XS 2027-08-28T00:00:00.000Z 2027-08-28T00:00:00.000Z http://creativecommons.org/licenses/by-nc-nd/4.0/ © 2025 Elsevier B.V. All rights are reserved, including those for text and data mining, AI training, and similar technologies. 2025-08-26T03:12:17.578Z http://vtw.elsevier.com/data/voc/AddOnTypes/50.7/aggregated-refined Innovative Research Group Project of the National Natural Science Foundation of China http://data.elsevier.com/vocabulary/SciValFunders/100014718 http://sws.geonames.org/1814991 https://doi.org/10.15223/policy-017 https://doi.org/10.15223/policy-037 https://doi.org/10.15223/policy-012 https://doi.org/10.15223/policy-029 https://doi.org/10.15223/policy-004 item S2468-8231(25)00639-X S246882312500639X 1-s2.0-S246882312500639X 10.1016/j.mcat.2025.115454 315758 2025-09-12T11:06:16.172661Z 2025-11-01 2025-11-30 1-s2.0-S246882312500639X-main.pdf https://s3-eu-west-1.amazonaws.com/prod-ucs-content-store-eu-west/content/pii:S246882312500639X/MAIN/application/pdf/2e7fbbea72e67e352784a7262f3e21d7/main.pdf main.pdf pdf true 5484718 MAIN 10 1-s2.0-S246882312500639X-main_1.png https://s3-eu-west-1.amazonaws.com/prod-ucs-content-store-eu-west/content/pii:S246882312500639X/PREVIEW/image/png/722d5d6623ac3f91fbf3a515f03d92a1/main_1.png main_1.png png 61555 928 656 IMAGE-WEB-PDF 1 1-s2.0-S246882312500639X-gr5.jpg https://s3-eu-west-1.amazonaws.com/prod-ucs-content-store-eu-west/content/pii:S246882312500639X/gr5/DOWNSAMPLED/image/jpeg/db6950dd38c20e5f89badea2347aae61/gr5.jpg gr5 gr5.jpg jpg 73645 388 772 IMAGE-DOWNSAMPLED 1-s2.0-S246882312500639X-gr6.jpg https://s3-eu-west-1.amazonaws.com/prod-ucs-content-store-eu-west/content/pii:S246882312500639X/gr6/DOWNSAMPLED/image/jpeg/bffeebb5d627e98ee56ee1c37cadd540/gr6.jpg gr6 gr6.jpg jpg 34407 203 565 IMAGE-DOWNSAMPLED 1-s2.0-S246882312500639X-gr3.jpg https://s3-eu-west-1.amazonaws.com/prod-ucs-content-store-eu-west/content/pii:S246882312500639X/gr3/DOWNSAMPLED/image/jpeg/729bbb392f26d3fba842663d45e6581d/gr3.jpg gr3 gr3.jpg jpg 106916 378 753 IMAGE-DOWNSAMPLED 1-s2.0-S246882312500639X-gr4.jpg https://s3-eu-west-1.amazonaws.com/prod-ucs-content-store-eu-west/content/pii:S246882312500639X/gr4/DOWNSAMPLED/image/jpeg/aa370e30da14287b0482d7e9aae589da/gr4.jpg gr4 gr4.jpg jpg 77848 492 678 IMAGE-DOWNSAMPLED 1-s2.0-S246882312500639X-gr1.jpg https://s3-eu-west-1.amazonaws.com/prod-ucs-content-store-eu-west/content/pii:S246882312500639X/gr1/DOWNSAMPLED/image/jpeg/5c1bd480d58551ac8d6c9c3c51308196/gr1.jpg gr1 gr1.jpg jpg 111142 439 715 IMAGE-DOWNSAMPLED 1-s2.0-S246882312500639X-gr2.jpg https://s3-eu-west-1.amazonaws.com/prod-ucs-content-store-eu-west/content/pii:S246882312500639X/gr2/DOWNSAMPLED/image/jpeg/cb56715df8b261d11793dc6ce7bc6ba3/gr2.jpg gr2 gr2.jpg jpg 106427 362 753 IMAGE-DOWNSAMPLED 1-s2.0-S246882312500639X-ga1.jpg https://s3-eu-west-1.amazonaws.com/prod-ucs-content-store-eu-west/content/pii:S246882312500639X/ga1/DOWNSAMPLED/image/jpeg/2ab670da40c190254c42a5b2bd8aa8f4/ga1.jpg ga1 true ga1.jpg jpg 37432 200 403 IMAGE-DOWNSAMPLED 1-s2.0-S246882312500639X-sc1.jpg https://s3-eu-west-1.amazonaws.com/prod-ucs-content-store-eu-west/content/pii:S246882312500639X/sc1/DOWNSAMPLED/image/jpeg/03355284527f087212c4f1e6ea93f82b/sc1.jpg sc1 sc1.jpg jpg 17897 273 540 IMAGE-DOWNSAMPLED 1-s2.0-S246882312500639X-gr7.jpg https://s3-eu-west-1.amazonaws.com/prod-ucs-content-store-eu-west/content/pii:S246882312500639X/gr7/DOWNSAMPLED/image/jpeg/54887e9487c4a145e38627b1b42db658/gr7.jpg gr7 gr7.jpg jpg 46760 201 753 IMAGE-DOWNSAMPLED 1-s2.0-S246882312500639X-gr8.jpg https://s3-eu-west-1.amazonaws.com/prod-ucs-content-store-eu-west/content/pii:S246882312500639X/gr8/DOWNSAMPLED/image/jpeg/8831f84e981ed3daf3c7b669bb4ec703/gr8.jpg gr8 gr8.jpg jpg 50481 347 678 IMAGE-DOWNSAMPLED 1-s2.0-S246882312500639X-gr5.sml https://s3-eu-west-1.amazonaws.com/prod-ucs-content-store-eu-west/content/pii:S246882312500639X/gr5/THUMBNAIL/image/gif/4bfdb843adb1f18475277110677dd2ef/gr5.sml gr5 gr5.sml sml 9561 110 219 IMAGE-THUMBNAIL 1-s2.0-S246882312500639X-gr6.sml https://s3-eu-west-1.amazonaws.com/prod-ucs-content-store-eu-west/content/pii:S246882312500639X/gr6/THUMBNAIL/image/gif/a4251953285f5d1d519b399ba5fd37b7/gr6.sml gr6 gr6.sml sml 7763 79 219 IMAGE-THUMBNAIL 1-s2.0-S246882312500639X-gr3.sml https://s3-eu-west-1.amazonaws.com/prod-ucs-content-store-eu-west/content/pii:S246882312500639X/gr3/THUMBNAIL/image/gif/f74d0df6d882219738900d4c61d443ea/gr3.sml gr3 gr3.sml sml 13290 110 219 IMAGE-THUMBNAIL 1-s2.0-S246882312500639X-gr4.sml https://s3-eu-west-1.amazonaws.com/prod-ucs-content-store-eu-west/content/pii:S246882312500639X/gr4/THUMBNAIL/image/gif/64c089b90198595cc70a1e82e3efb99d/gr4.sml gr4 gr4.sml sml 11604 159 219 IMAGE-THUMBNAIL 1-s2.0-S246882312500639X-gr1.sml https://s3-eu-west-1.amazonaws.com/prod-ucs-content-store-eu-west/content/pii:S246882312500639X/gr1/THUMBNAIL/image/gif/122eeb4440233af99a9f14323660b8ee/gr1.sml gr1 gr1.sml sml 17986 134 219 IMAGE-THUMBNAIL 1-s2.0-S246882312500639X-gr2.sml https://s3-eu-west-1.amazonaws.com/prod-ucs-content-store-eu-west/content/pii:S246882312500639X/gr2/THUMBNAIL/image/gif/2201f311a00a0cd2c0051a0ec9deaeb9/gr2.sml gr2 gr2.sml sml 12652 105 219 IMAGE-THUMBNAIL 1-s2.0-S246882312500639X-ga1.sml https://s3-eu-west-1.amazonaws.com/prod-ucs-content-store-eu-west/content/pii:S246882312500639X/ga1/THUMBNAIL/image/gif/ca2af014034edf2b6fe4eefb7038edb6/ga1.sml ga1 true ga1.sml sml 20747 109 219 IMAGE-THUMBNAIL 1-s2.0-S246882312500639X-sc1.sml https://s3-eu-west-1.amazonaws.com/prod-ucs-content-store-eu-west/content/pii:S246882312500639X/sc1/THUMBNAIL/image/gif/6bae9fe45e80bd2a97400af60f5a7b4d/sc1.sml sc1 sc1.sml sml 3756 111 219 IMAGE-THUMBNAIL 1-s2.0-S246882312500639X-gr7.sml https://s3-eu-west-1.amazonaws.com/prod-ucs-content-store-eu-west/content/pii:S246882312500639X/gr7/THUMBNAIL/image/gif/4a3d94ef368a495ad2b54e4f4551a04e/gr7.sml gr7 gr7.sml sml 7734 58 219 IMAGE-THUMBNAIL 1-s2.0-S246882312500639X-gr8.sml https://s3-eu-west-1.amazonaws.com/prod-ucs-content-store-eu-west/content/pii:S2468823125006169/gr8/THUMBNAIL/image/gif/fc7a05b3b04b45262993d10f43db46e5/gr8.sml gr8 gr8.sml sml 8217 112 219 IMAGE-THUMBNAIL 1-s2.0-S246882312500639X-gr5_lrg.jpg https://s3-eu-west-1.amazonaws.com/prod-ucs-content-store-eu-west/content/pii:S246882312500639X/HIGHRES/image/jpeg/38b686ce55428478e24fa7696a5a9966/gr5_lrg.jpg gr5 gr5_lrg.jpg jpg 443027 1719 3417 IMAGE-HIGH-RES 1-s2.0-S246882312500639X-gr6_lrg.jpg https://s3-eu-west-1.amazonaws.com/prod-ucs-content-store-eu-west/content/pii:S246882312500639X/HIGHRES/image/jpeg/edc6d9cc0c6962d73303d9c2446f486a/gr6_lrg.jpg gr6 gr6_lrg.jpg jpg 188789 899 2500 IMAGE-HIGH-RES 1-s2.0-S246882312500639X-gr3_lrg.jpg https://s3-eu-west-1.amazonaws.com/prod-ucs-content-store-eu-west/content/pii:S246882312500639X/HIGHRES/image/jpeg/d90cbd7ed4d52bdea8ea5c92e9838b0c/gr3_lrg.jpg gr3 gr3_lrg.jpg jpg 673538 1672 3333 IMAGE-HIGH-RES 1-s2.0-S246882312500639X-gr4_lrg.jpg https://s3-eu-west-1.amazonaws.com/prod-ucs-content-store-eu-west/content/pii:S246882312500639X/HIGHRES/image/jpeg/802ad6cbb32c0ffddb16c81ff50d378b/gr4_lrg.jpg gr4 gr4_lrg.jpg jpg 464413 2179 3000 IMAGE-HIGH-RES 1-s2.0-S246882312500639X-gr1_lrg.jpg https://s3-eu-west-1.amazonaws.com/prod-ucs-content-store-eu-west/content/pii:S246882312500639X/HIGHRES/image/jpeg/13d17cd80587d039e6d67ba8fabb2abc/gr1_lrg.jpg gr1 gr1_lrg.jpg jpg 1070134 1945 3167 IMAGE-HIGH-RES 1-s2.0-S246882312500639X-gr2_lrg.jpg https://s3-eu-west-1.amazonaws.com/prod-ucs-content-store-eu-west/content/pii:S246882312500639X/HIGHRES/image/jpeg/7917baa6a79f752e09058401c130d472/gr2_lrg.jpg gr2 gr2_lrg.jpg jpg 678569 1602 3333 IMAGE-HIGH-RES 1-s2.0-S246882312500639X-ga1_lrg.jpg https://s3-eu-west-1.amazonaws.com/prod-ucs-content-store-eu-west/content/pii:S246882312500639X/HIGHRES/image/jpeg/47dd1322a24325e2a0f3126933c1f17d/ga1_lrg.jpg ga1 true ga1_lrg.jpg jpg 308941 886 1784 IMAGE-HIGH-RES 1-s2.0-S246882312500639X-sc1_lrg.jpg https://s3-eu-west-1.amazonaws.com/prod-ucs-content-store-eu-west/content/pii:S246882312500639X/HIGHRES/image/jpeg/c6b4220578770007ce70f4bae41964d8/sc1_lrg.jpg sc1 sc1_lrg.jpg jpg 128246 1207 2390 IMAGE-HIGH-RES 1-s2.0-S246882312500639X-gr7_lrg.jpg https://s3-eu-west-1.amazonaws.com/prod-ucs-content-store-eu-west/content/pii:S246882312500639X/HIGHRES/image/jpeg/1c63ae99f01f7d277b9bb49059d67994/gr7_lrg.jpg gr7 gr7_lrg.jpg jpg 261454 890 3333 IMAGE-HIGH-RES 1-s2.0-S246882312500639X-gr8_lrg.jpg https://s3-eu-west-1.amazonaws.com/prod-ucs-content-store-eu-west/content/pii:S2468823125006169/HIGHRES/image/jpeg/aef5a939904f150b40e71100f627b7ec/gr8_lrg.jpg gr8 gr8_lrg.jpg jpg 303979 1535 3000 IMAGE-HIGH-RES 1-s2.0-S246882312500639X-mmc1.docx https://s3-eu-west-1.amazonaws.com/prod-ucs-content-store-eu-west/content/pii:S246882312500639X/mmc1/MAIN/application/vnd.openxmlformats-officedocument.wordprocessingml.document/e696beb173afbc32859473f2fab446c2/mmc1.docx mmc1 mmc1.docx docx 130726131 APPLICATION 1-s2.0-S246882312500639X-si1.svg https://s3-eu-west-1.amazonaws.com/prod-ucs-content-store-eu-west/content/pii:S246882312500639X/image/svg+xml/b7aabc9eb9fed7a7a573ad194ac90fca/si1.svg si1 si1.svg svg 22291 ALTIMG 1-s2.0-S246882312500639X-si2.svg https://s3-eu-west-1.amazonaws.com/prod-ucs-content-store-eu-west/content/pii:S246882312500639X/image/svg+xml/623cf69def227876484cd55d2c047fd9/si2.svg si2 si2.svg svg 23904 ALTIMG 1-s2.0-S246882312500639X-si3.svg https://s3-eu-west-1.amazonaws.com/prod-ucs-content-store-eu-west/content/pii:S246882312500639X/image/svg+xml/ffe61ccfb7c0708998af2604e5636af3/si3.svg si3 si3.svg svg 22474 ALTIMG 1-s2.0-S246882312500639X-si4.svg https://s3-eu-west-1.amazonaws.com/prod-ucs-content-store-eu-west/content/pii:S246882312500639X/image/svg+xml/de61f946ad59573beb7ef498837f7bf1/si4.svg si4 si4.svg svg 26542 ALTIMG 1-s2.0-S246882312500639X-si5.svg https://s3-eu-west-1.amazonaws.com/prod-ucs-content-store-eu-west/content/pii:S246882312500639X/image/svg+xml/153dd6b7330b786446139f83112ff03d/si5.svg si5 si5.svg svg 26040 ALTIMG 1-s2.0-S246882312500639X-si6.svg https://s3-eu-west-1.amazonaws.com/prod-ucs-content-store-eu-west/content/pii:S246882312500639X/image/svg+xml/8c532bc39c747f4a725f786fe198477d/si6.svg si6 si6.svg svg 8375 ALTIMG 1-s2.0-S246882312500639X-si7.svg https://s3-eu-west-1.amazonaws.com/prod-ucs-content-store-eu-west/content/pii:S246882312500639X/image/svg+xml/e4275af457c7ba47a4b65f6df2b09c4c/si7.svg si7 si7.svg svg 9346 ALTIMG 1-s2.0-S246882312500639X-si8.svg https://s3-eu-west-1.amazonaws.com/prod-ucs-content-store-eu-west/content/pii:S246882312500639X/image/svg+xml/8df66a8ab07097fd97afef84770d3b46/si8.svg si8 si8.svg svg 10476 ALTIMG 1-s2.0-S246882312500639X-si9.svg https://s3-eu-west-1.amazonaws.com/prod-ucs-content-store-eu-west/content/pii:S246882312500639X/image/svg+xml/209c3b54e278fd15c90a0ad4b09b6baf/si9.svg si9 si9.svg svg 16996 ALTIMG MCAT 115454 115454 S2468-8231(25)00639-X 10.1016/j.mcat.2025.115454 Fig. 1 SEM images of (a) Zr-MA2, (b) Zr-MA, (c) Zr-MA0.5, (d) Zr-MA0.3, (e) Zr0.5−MA0.5. TEM image of (f) Zr0.5−MA0.5. TEM-EDS image (g), and elemental mapping profiles of Zr0.5−MA0.5. Fig. 1 Fig. 2 (a) X-ray diffraction, (b) N₂ adsorption-desorption isotherms, (c) pore size distribution, (d) thermogravimetric analysis, (e) derivative thermogravimetric analysis, (f) Fourier-transform infrared spectroscopy of different samples. Fig. 2 Fig. 3 (a-c) X-ray photoelectron spectroscopy, (d-f) pyridine adsorption Fourier-transform infrared spectroscopy of different samples. Fig. 3 Fig. 4 (a) Performance of different coordination catalysts. Effect of (b) temperature (reaction conditions: 0.1442 g EL, 0.10 g catalyst, 10 mL isopropanol and 3 h), (c) catalyst amount (reaction conditions: 0.1442 g EL, 10 mL isopropanol, 170 °C and 3 h), (d) reaction time (reaction conditions: 0.1442 g EL, 0.10 g catalyst, 10 mL isopropanol, 170 °C) on CTH of EL into GVL over Zr-MA0.5. Fig. 4 Scheme 1 Kinetic research routes for the hydrogenation from EL to GVL. Scheme 1 Fig. 5 Experimental (symbol) and modeled (solid lines) product concentration for EL via CTH to GVL in isopropanol over Zr-MA0.5 at (a) 120 °C, (b) 130 °C, and (c) 140 °C. Fitting plots of apparent activation energy for different reaction processes using the Arrhenius equation (d-f). Fig. 5 Fig. 6 Reusability test (a) and leaching experiment (b) for the conversion of EL to GVL over Zr-MA0.5 catalyst. Reusability of Zr-MA0.5 catalyst in the CTH of EL to GVL. Reaction conditions: 0.1442 g EL, 10 mL isopropanol, 170 °C, 3 h. Fig. 6 Fig. 7 Tolerance experiments for the conversion of EL to GVL over Zr-MA0.5 Catalyst: (a) furan, (b) H2O, (c) HAc. Reaction conditions: 0.1442 g EL, 10 mL isopropanol, 170 °C, 3 h. Fig. 7 Fig. 8 Possible reaction mechanism of EL to GVL over Zr-MA framework. Fig. 8 Table 1 Physical properties of different catalysts Zr x −MA y . Table 1 Entry Catalyst Surface area (m2/g) a Weight loss ( %) Pore diameter (nm) b Pore volume (cm3/g) c 1 Zr0.5−MA0.5 351.09 36.3 31.4 0.235 2 Zr-MA0.3 233.04 38.4 26.6 0.129 3 Zr-MA0.5 362.38 39.6 62.4 0.457 4 Zr-MA 372.12 41.6 32.5 0.276 5 Zr-MA2 159.83 42.8 27.1 0.091 a BET Surface area. b Pore size calculated by BJH method. C Total pore volume measured at P/P0=0.95. Table 2 Determined kinetic parameters for EL hydrogenation over Zr-MA0.5. Table 2 Rate constant Reaction temperature ( °C) 120 130 140 k1 0.059 0.110 0.281 k2 0.003 0.004 0.006 k3 0.006 0.014 0.027 Fobj 3.12×10−5 2.01×10−4 2.63×10−4 Research Paper Zirconium-malate coordination polymer: a green catalyst for transfer hydrogenation of Ethyl Levulinate to Synthesize γ-valerolactone Shuaihao Wang Writing – original draft Methodology Investigation Formal analysis Data curation Jie Li Validation Formal analysis Xin Xia Visualization Software Jianhua Wang Writing – review & editing ⁎ Qiong Xu Supervision Project administration Funding acquisition ⁎ Xianxiang Liu Project administration Methodology Funding acquisition Conceptualization Dulin Yin Resources National & Local Joint Engineering Laboratory for New Petro-chemical Materials and Fine Utilization of Resources, Key Laboratory of Chemical Biology and Traditional Chinese Medicine Research (Ministry of Education of China), Hunan Normal University, Changsha 410081, China National & Local Joint Engineering Laboratory for New Petro-chemical Materials and Fine Utilization of Resources, Key Laboratory of Chemical Biology and Traditional Chinese Medicine Research (Ministry of Education of China) Hunan Normal University Changsha 410081 China National & Local Joint Engineering Laboratory for New Petro-chemical Materials and Fine Utilization of Resources, Key Laboratory of Chemical Biology and Traditional Chinese Medicine Research (Ministry of Education of China), Hunan Normal University, Changsha 410081, China ⁎ Corresponding authors. The development of green, efficient, and economical catalysts for the transformation of biomass into value-added chemicals is vital for advancing sustainable chemical manufacturing. In this work, a series of cost-effective and stable zirconium-based catalysts were synthesized via coordination of Zr4+ with malic acid (MA), a low-cost and naturally abundant organic ligand, in aqueous solution. By precisely tuning the ligand-to-metal molar ratio, the porous structure properties of the resulting materials could be finely controlled. In addition, the Brønsted-to-Lewis acid site ratio reached 0.37, indicating a well-balanced acidic environment. These structural and acidic characteristics collectively contributed to its superior catalytic performance in the conversion of ethyl levulinate (EL) to γ-valerolactone (GVL) via transfer hydrogenation and intramolecular lactonization. Kinetic analysis revealed that elevated temperatures promote the direct transformation of EL to GVL; however, temperatures beyond the optimal range induce competing transesterification reactions, thereby extending the reaction pathway. Notably, the catalyst retained its activity over at least six consecutive cycles without detectable deactivation. A mechanistic framework is proposed to provide deeper insight into the transfer hydrogenation process mediated by this class of Zr-based coordination catalysts. Graphical abstract Image, graphical abstract Keywords Biomass Ethyl levulinate Γ-valerolactone Catalytic transfer hydrogenation Kinetics Data availability Data will be made available on request. 1 Introduction The catalytic conversion of renewable biomass into chemicals and biofuels represents one of the most promising approaches for achieving carbon neutrality and mitigating dependence on fossil energy sources [1–3]. γ-valerolactone (GVL), as a versatile bio-based platform chemical, serves not only as a green solvent and biofuel [4,5], but also as a key intermediate for the synthesis of widely used polymer precursors, such as 1,4-butanediol and 2-methyltetrahydrofuran [6]. Owing to these multifunctional attributes, GVL holds great promise for broad applications in various industrial sectors [7]. The synthesis of GVL from bio-derived levulinate has attracted considerable attention in recent years [8,9]. The conversion of levulinate to GVL can be accomplished via two principal approaches: direct hydrogenation using H2 or catalytic transfer hydrogenation (CTH) [10,11]. In the CTH pathway, formic acid and secondary alcohols, such as methanol, ethanol, 2-butanol, and isopropanol, serve as hydrogen donors [12]. Compared with conventional hydrogen gas hydrogenation, transfer hydrogenation proceeds under milder reaction conditions and offers simpler operational procedures [13]. Moreover, in heterogeneous catalytic systems, it enables favorable selectivity and high yields [14,15]. In addition, the hydrogen source material used, such as isopropanol, can be produced through biomass fermentation (such as corn or sugarcane), which is renewable and low in toxicity, complementing the green design of bio-based malic acid ligands. In addition to the aforementioned advantages of the CTH reaction, this approach significantly reduces the reliance on noble metal catalysts [16]. Among various non-noble metal catalytic systems, Zr-based organic-inorganic hybrid catalysts have attracted considerable attention due to their low cost, facile synthesis, and excellent catalytic performance. Wang et al. synthesized a magnetic, biomass-derived, acid-base bifunctional zirconium-based hybrid catalyst via a solvothermal method, utilizing magnetic iron oxide and furan-2,5-dicarboxylic acid. Under optimized reaction conditions of 180 °C for 5 hours, the catalytic conversion of ethyl levulinate EL to GVL achieved a yield of 94.5 % [17]. Li et al. developed a novel zirconium-based catalyst incorporating phenolic moieties, phenolic hydroxyl groups, and carboxyl functionalities by co-precipitating natural gallic acid with ZrCl4. Under reaction conditions of 160 °C for 8 hours, the catalyst facilitated the conversion of EL to GVL with a yield of 94.2 % [18]. Catalytic transfer hydrogenation of butyl levulinate to GVL over zirconium phosphates with adjustable Lewis and Brønsted acid sites [19]. Although these catalysts can achieve high yields (approximately 94 %), their preparation methods still have shortcomings. They often require the use of expensive ligands (such as FDCA, which has a more complex production process and low natural content, 220 USD/kg), high temperatures, longer reaction times, and non-aqueous solvents (such as N, N-dimethylformamide, ethanol, or ethyl acetate), which increase production costs and pose environmental risks. Additionally, the organic ligands used are not always fully sustainable, thereby limiting the overall green performance of these systems. In this study, malic acid (a biomass platform molecule derived from fruits and other sources, a naturally abundant and renewable organic acid with a cost of approximately 22 USD/kg) was used as a ligand to synthesize zirconium-based coordination polymer catalysts via a hydrothermal method. By using water as the sole solvent, the protocol conforms to green chemistry principles, minimizes organic solvent consumption and environmental burden, streamlines the process, enhances operational safety, and reduces production cost. By using water as the sole solvent, this protocol aligns with green chemistry principles. Compared to traditional zirconium-based catalysts (such as ZrO2/Al2O3, which typically require high-temperature calcination >500 °C) [20], it reduces organic solvent consumption and environmental impact, simplifies the process flow, enhances operational safety, and lowers production costs. Based on this optimized catalyst, a series of single-factor experiments were conducted to systematically investigate the effects of reaction temperature, catalyst loading, and reaction time, ultimately affording improved conversion and selectivity. Detailed kinetic analysis of reaction rate features further illuminated the underlying mechanism. This work offers new insights into the design of bifunctional metal-organic polymer catalysts and establishes both theoretical and experimental foundations for the aqueous solvothermal synthesis of green catalytic materials. 2 Experimental section 2.1 Materials Ethyl levulinate (EL, 99 %), γ-valerolactone (GVL, 98 %), zirconium tetrachloride (ZrCl4, 98 %), Malic acid (MA, 99.5 %), and dodecane (99 %) were purchased from Shanghai Macklin Biochemical Technology Co., Ltd. Methanol (AR), ethanol (95 %), n-propanol (AR), n-butanol (AR), isopropanol (AR), sodium bicarbonate (AR), potassium hydrogen phthalate (AR), phenolphthalein (AR), and sodium hydroxide (AR) were obtained from Sinopharm Chemical Reagent Co., Ltd. Hydrochloric acid was purchased from Hunan Huihong Reagent Co., Ltd. 2.2 Catalysts preparation MA (0.146 g) was dissolved in 20 mL of deionized water in a 50 mL beaker. Separately, ZrCl4 (0.518 g) was dissolved in 20 mL of deionized water. The two solutions were combined and stirred until a homogeneous mixture formed. This slurry was transferred into a Teflon-lined autoclave and heated at 160 °C for 24 h. Upon completion, the autoclave was cooled to ambient temperature in an ice-water bath. The resulting suspension was poured into a beaker, homogenized by stirring, and the precipitate isolated by vacuum filtration. The solid was washed three times each with deionized water and ethanol, then dried overnight at 60 °C under vacuum to ensure complete removal of ethanol. Finally, the dry material was ground in an agate mortar to yield a fine powder, denoted Zr-MA0.5. An analogous hydrothermal procedure was employed to synthesize a series of catalysts by systematically varying the quantities of ZrCl4 and MA. Each material is designated Zr x −MA y , where x and y correspond to the respective molar amounts of ZrCl4 and malic acid introduced. 2.3 Catalyst characterization The catalysts were analyzed using scanning electron microscopy (SEM) with a Zeiss Sigma 300 microscope. The X-ray diffraction (XRD) patterns of the catalysts were measured using a Rigaku Ultima IV with Cu Kα radiation, scanning in the range of 2θ = 5° to 90°, under conditions of 40 kV and 30 mA, with a scanning rate of 10°/minute. Fourier transform infrared (FT-IR) spectra were collected at room temperature in transmission mode using a NEXUS spectrometer with a resolution of 4 cm−1. The spectra were recorded over the 400–4000 cm−1 range, with 20 scans per spectrum. The samples were prepared by the KBr pellet method, with a sample-to-KBr mass ratio of 1:100. Thermogravimetric analysis (TGA) curves of the samples were recorded with a Netzsch STA 409 PC thermogravimetric analyzer (Germany), using a temperature ramp rate of 10 °C/min up to 800 °C. The Zr content in the Zr-based catalysts was determined by inductively coupled plasma optical emission spectrometry (ICP-OES) using a Thermo Fisher ICAP 7200 device. The samples underwent microwave digestion pretreatment. The Zr content was calculated from a standard curve based on known concentrations of zirconium in concentrated nitric acid (68 %, w/w). Prior to analysis, 0.12 g of catalyst was treated with 10 mL of concentrated nitric acid (68 %, w/w) and preheated at 160 °C for 3 h. X-ray photoelectron spectroscopy (XPS) measurements of the catalysts were performed using a Thermo Scientific K-Alpha spectrometer (USA). Nitrogen adsorption-desorption isotherms were obtained with a Micromeritics ASAP 2460 instrument. Pyridine-adsorbed FTIR spectra (Py-FTIR) were analyzed on Bruker Tensor 27 spectrometer to differentiate the Lewis and Brønsted acid sites of the samples. The area of the two absorption peaks near 1450 and 1540 cm−1 was used to determine the amount of Brønsted and Lewis acids in the materials. The surface acidity of the catalysts was measured using the Boehm titration method, as outlined in the literature. Solutions of 0.1 M NaOH, NaHCO3, and HCl were prepared and standardized with primary standard solutions. After standardization, 0.05 g (m1) of each sample was soaked in 25 mL of 0.1 M NaOH or NaHCO3 solution and left to stand for 24 h. The suspensions were then titrated with 0.1 M HCl. Each sample was titrated in triplicate. The amounts of acidic carboxyl and phenolic hydroxyl groups were calculated using the following formulas [21]. (1) η carboxyl ( mmol / g ) = 25 × C N a H C O 3 − V H C l × C H C l m 1 (2) η phenol ( mmol / g ) = 25 × C N a O H − V H C l × C H C l m 1 − η carboxyl 2.4 Procedure for catalytic reaction The catalytic experiments were conducted in a 100 mL cylindrical stainless steel high-pressure reactor equipped with an external temperature controller and a mechanical stirrer (Jingkou Dantu Universal Electromechanical Accessories Factory, Zhenjiang). Typically, the reactor contained 1 mmol EL, 0.1 g catalyst, 10 mL IPA as a hydrogen donor and solvent, and 0.2 mmol n-dodecane as a standard. After sealing, the mixture was purged with nitrogen five times. The reaction was then heated to the desired temperature while stirring at 450 rpm, maintaining the necessary reaction time. Upon completion of the reaction, the reactor was cooled to room temperature using cold water. The liquid phase products were analyzed using gas chromatography and gas chromatography-mass spectrometry. 2.5 Analytical method Determination and qualitative analysis of GVL and IPL were conducted using a Shimadzu gas chromatograph (GC 2030). Dodecane was used as an internal standard for GC analysis. The conversion of EL (CEL), the selectivity for GVL (SGVL), and the selectivity for IPL (SIPL) were calculated using the following formulas: (3) EL conversion ( % ) = ( 1 − F i n a l m o l e o f E L I n i t i a l m o l e o f E L ) × 100 % (4) Product yield ( % ) = M o l e o f p r o d u c t I n i t i a l m o l e o f E L × 100 % (5) Product selectivity ( % ) = P r o d u c t y i e l d E L c o n v e r s i o n × 100 % 3 Results and discussion 3.1 Characterization of catalysts This study seeks to optimize the physical and chemical properties of the catalyst by precisely modulating the molar ratio between ZrCl4 and the MA ligand, with the ultimate goal of enhancing catalytic performance. To this end, the morphological characteristics and pore structure of the catalysts were systematically characterized using SEM in conjunction with BET surface area and porosity analyses. As illustrated in Fig. 1 a and 1b, the catalyst exhibits a relatively smooth surface morphology. With a further decrease in the molar ratio of MA, the surface of the Zr-MA0.5 sample became markedly rougher. Although its specific surface area exhibited a slight reduction compared to that of Zr-MA, the pore volume increased significantly to 0.457 cm3/g, and the pore size doubled to 62.4 nm. These combined features render it the material with the most favorable overall physical properties among all the samples. This phenomenon may be attributed to the insufficient amount of MA ligand, which hinders effective coordination among the smaller structural fragments during synthesis, thereby impeding the formation of a stable and integrated framework. Upon reducing the amount of Zr precursor, the surface morphology of the Zr0.5−MA0.5 sample reverted to a state resembling that of Zr-MA. However, when the molar ratio of MA is decreased to even lower levels, the insufficient ligand content results in the growth of larger catalyst particles. Consequently, both the specific surface area and pore volume decrease markedly, reaching 233.04 m2/g and 0.129 cm3/g, respectively [22]. As shown in Fig. 2 b and 2c, the nitrogen adsorption-desorption isotherms of the Zr0.5−MA0.5 and Zr-MA samples exhibit typical Type IV curves with H4-type hysteresis loops, according to the classification criteria of the International Union of Pure and Applied Chemistry (IUPAC). This indicates the presence of slit-like pores formed by the aggregation of lamellar (plate-like) particles. In contrast, the isotherm of the Zr-MA0.5 sample displays a characteristic Type V shape accompanied by an H3-type hysteresis loop, which is typical of mesoporous materials and indicates that adsorption saturation is not achieved at high relative pressures. Additionally, the isotherms of Zr-MA0.3 and Zr-MA2 belong to Type I, with no obvious hysteresis loops observed, suggesting that their pore structures are predominantly microporous. Taking Zr0.5−MA0.5 as an example, TEM and SEM combined with elemental mapping analyses reveal that Zr, C, and O are uniformly distributed throughout both the surface and the interior of the catalyst. This demonstrates the feasibility of the water-based synthesis strategy and indicates that no metal aggregation occurs (see Fig. 1f, 1 g and Figure S1). Accordingly, both excessive and insufficient amounts of ligand can negatively impact the specific surface area and pore structure of the catalyst, thereby reducing its mass transfer efficiency during catalytic reactions. Generally, a higher specific surface area facilitates the formation of more acid-base active sites. Accordingly, among the tested samples, Zr-MA, Zr-MA0.5, and Zr0.5−MA0.5 exhibit superior overall porous structure properties. As shown in Fig. 2a, the XRD patterns of Zr x −MA y coordination polymer catalysts prepared at different molar ratios exhibit a broad diffraction feature between 2θ= 5° and 10°, with its maximum at approximately 6.7° The absence of any sharp Bragg reflections confirms that these materials are predominantly amorphous [23,24]. The observed broad diffraction feature corroborates the irregular coordination between Zr4+ and MA and confirms the amorphous character of Zr x −MA y , in agreement with SEM observations. Such an amorphous framework is expected to expose a higher density of active sites, thereby enhancing catalytic activity. Furthermore, although variations in the precursor ratios do not alter the overall propensity for amorphous phase formation, they may modulate the degree of short-range order, which in turn may affect catalytic performance. As illustrated in Fig. 2d, the material mass decreased progressively with increasing temperature. Upon reaching a constant mass, the residual mass reflected the relative zirconium content within the material. Notably, the variation in metal content did not exhibit a direct correlation with the change in ligand ratio used during catalyst preparation, indicating that the synthesized catalyst structures were not ordered. This observation is consistent with the XRD results. The TG profiles further resolve two principal weight-loss stages: the first, occurring between 96 °C and 130 °C, primarily reflects desorption of physiosorbed water and removal of surface hydroxyl groups [25]. The second mass-loss event, spanning 358 °C to 469 °C, reflects decomposition of surface carboxyl functionalities. Notably, Zr-MA0.3 exhibits a higher decomposition onset within this interval, implying that reducing the malic acid ratio enhances thermal robustness. Furthermore, integration of data from Table 1 and Table S1 reveals that elevated MA loading increases the abundance of uncoordinated carboxyl groups on the catalyst surface, thereby promoting more extensive decarboxylation to CO2 during thermal decomposition [26]. Moreover, TG-DTG analysis demonstrates that deliberate variation of the acid-ligand molar ratio provides precise control over catalyst thermal stability. These insights furnish a valuable framework for further optimization of catalyst performance. Fig. 2f presents a comparison of infrared spectral features for various catalysts. A broad absorption band centered at approximately 3400 cm−1 can be attributed to O-H stretching vibrations of surface hydroxyl groups. The peak observed at 1105 cm−1 corresponds to C-O stretching vibrations. Upon introduction of Zr, a new band appears at 688 cm−1, arising from Zr-O bond stretching and thereby confirming formation of a coordination structure between Zr and MA [17,27,28]. The absorption at 1498 cm−1 results from coupling between COO− stretching and C-O-H bending vibrations, which indicates coordination of carboxyl groups, while hydroxyl functionalities primarily engage in hydrogen bonding or weak coordination interactions [29,30]. With increasing ligand loading, intermolecular esterification becomes apparent, giving rise to characteristic C-O-C stretching bands in the 1064–1012 cm−1 region; these features are most pronounced in the Zr-MA2 catalyst. Furthermore, metal coordination and intermolecular esterification modify the electron density of the carboxyl C=O bond, leading to a strong absorption near 1780 cm−1. Uncoordinated, free carboxyl groups constitute Brønsted acid sites, thus providing essential active centers for catalytic processes. To further elucidate the acidic characteristics of the material, XPS and Py-FTIR were applied for systematic catalyst analysis. As shown in Fig. 3 a, the Zr 3d spectrum features two principal binding energy peaks at 185.3 eV (Zr 3d3/2) and 182.9 eV (Zr 3d5/2). Although reduction of the ligand content induced a slight decrease in Zr 3d binding energies, these values remained considerably higher than those reported for bulk ZrO2 (Zr 3d3/2 at 184.3 eV and Zr 3d5/2 at 181.9 eV) [31], thereby implying enhanced Lewis acidity of zirconium species within Zr x −MA y catalysts. As illustrated in Fig. 3b, deconvolution of the C 1s spectrum yields three distinct peaks at 284.8 eV, 286.5 eV, and 288.8 eV, which correspond to C-C/C-H, C-O, and O-C=O species, respectively. A progressive increase in MA content leads to a concomitant rise in the relative intensities of the C-O and O-C=O components, thereby corroborating an elevated surface concentration of carboxyl functionalities. In Fig. 3c, the O 1s spectrum can be resolved into three peaks at 531.7 eV, 532.9 eV, and 527.8 eV, attributable to -Zr-O, C-O, and C=O bonds, respectively [32]. SEM analysis revealed that the reduction of ligand loading led to an increase in catalyst particle size. This phenomenon is attributed to the complete coordination of carboxyl groups with metal ions, which consequently diminishes the population of free surface carboxyl. As a result, Py-FTIR spectra of Zr-MA0.3 failed to exhibit a discernible Brønsted acid band, thereby reinforcing the proposed coordination-driven mechanism. Using Zr-MA0.5 as a representative example, the catalyst exhibits both a high density of Lewis acid sites and a spectrum of Brønsted acid sites [33]. Quantitative analysis indicates Lewis acid site density of 9.36 mmol/gcat, marginally lower than the 12.66 mmol/gcat, observed for Zr-MA2 (Table S2), whereas Brønsted acid density reaches 3.49 mmol/gcat, resulting in a Brønsted-to-Lewis ratio of 0.37. Such a balanced acid-site architecture is anticipated to enhance both hydrogenation and lactonization steps during the catalytic conversion of EL to GVL [34]. 3.2 Catalytic test Selection of an effective catalyst is critical for catalytic transfer hydrogenation of EL to GVL. Among common dicarboxylic acid ligands, several typical ones were selected for comparison, with the data shown in Table S3. When malic acid was used as the ligand, the catalytic effect was optimal. Considering factors such as the source of the ligand, cost, and environmental friendliness, malic acid was selected as the ligand. As shown in Fig. 4 a, the impact of different feedstock ratios on catalytic performance was evaluated under identical reaction conditions. With a constant zirconium precursor, decreasing the ligand loading from 3 to 0.3 resulted in an initial increase in EL conversion followed by a slight decline, while GVL selectivity remained consistently high at over 93 %. This behavior can be attributed to an increase in defect sites as ligand proportion decreases. However, once ligand loading falls below a certain threshold, SEM and BET analyses reveal deterioration of pore structure and particle size distribution, which in turn adversely affects catalytic performance. This further demonstrates that different ratios of malic acid to zirconium can affect the structure of the catalyst, thereby influencing its catalytic performance. In comparison, Zr-MA0.5 exhibited the most superior catalytic performance, achieving an EL conversion of 98.3 % and a GVL selectivity of 93.9 %. Building on this formulation, reducing the Zr content increases the coordination number between Zr and carboxyl groups, thereby augmenting the Lewis acid site density [35]. Given the notable catalytic performance of Zr-MA0.5, this material was subjected to single-variable investigation. As illustrated in Fig. 4b, an increase in reaction temperature resulted in a progressive rise in EL conversion, while GVL selectivity remained consistently high; thus, elevated temperature appears to facilitate reaction progression. At 170 °C, EL conversion and GVL selectivity attained maximum values of 98.3 % and 93.9 %, respectively. Under conditions of 170 °C and a 3 h reaction time, catalyst loading was varied in 25 mg increments (Fig. 4c). As the amount of the catalyst increases, both EL conversion and GVL selectivity gradually increase, implying that a higher density of acid sites promotes the catalytic process. In the time-dependent study (Fig. 4d), the selectivity of GVL reached its maximum value after 3 h; as the reaction time was further extended, the selectivity decreased slightly, which may be due to secondary conversions that generated other compounds [36], such as 1,4-pentanediol [37], 2-methyl tetrahydrofuran [38], valeric acid/ester [39], 5-nonanone [40], and butene [41]. In the transfer hydrogenation reaction, alcohols act as both solvents and hydrogen donors. Under consistent reaction conditions, Figure S2 investigates the effect of different alcohols on the conversion of EL to GVL. Methanol, as a hydrogen donor, achieves a high EL conversion rate, but due to significant side reactions (particularly ester exchange to form methyl ethyl acetoacetate), it results in low GVL selectivity. Ethanol achieves moderate EL conversion rates with higher GVL selectivity, attributed to reduced ester exchange reactions. Other primary alcohols, such as n-propanol and n-butanol, exhibit lower performance due to their weaker reducing potential compared to secondary alcohols. However, isopropanol demonstrates excellent EL conversion rates and GVL selectivity, benefiting from its lower reducing potential, making it the most effective hydrogen donor in this reaction[42]. 3.3 Kinetic study Based on prior research findings and a comprehensive analysis of the experimental data, two plausible pathways have been proposed for the synthesis of GVL from EL via CTH. As illustrated in Scheme 1 , the first pathway involves the direct conversion of EL to GVL through a sequential process comprising CTH reduction followed by intramolecular lactonization. Alternatively, the second pathway proceeds via an initial transesterification reaction between EL and isopropanol, forming isopropyl levulinate (IPL), which subsequently undergoes CTH reduction and lactonization to afford GVL [43]. In the study of the effects of various reaction parameters on the conversion of EL to GVL, reaction temperature was found to exert a pronounced influence on GVL selectivity (Fig. 4a). Therefore, kinetic experiments were conducted at 120 °C, 130 °C, and 140 °C. Given that isopropanol served both as solvent and hydrogen source and was employed in large excess, slight variations in its concentration exerted negligible effects on overall reaction rate. Consequently, isopropanol concentration was maintained constant and reaction kinetics were modeled using a pseudo-first-order approach [44]. The differential equation governing the process is as follows: d C E L d t = − ( k 1 + k 2 ) · C E L d C I P L d t = k 2 · C E L − k 3 · C I P L d C G V L d t = k 1 · C I P L + k 3 · C E L In this formulation, C denotes the molar concentration of each species, whereas k i corresponds to the apparent rate constant under isothermal conditions. The fitting quality is quantified by computing residuals between calculated and experimental concentrations of each species at various reaction times; consequently, a lower value of the objective function F obj signifies a more accurate fit. Specifically, Cm, n, Calc. and Cm, n, exp. denote, respectively, the calculated and experimental concentrations of species m (for example, EL, IPA, and GVL) at the n time point. F o b j = ∑ m { ∑ n = 1 n p [ C m , n , c a l c − C m , n , e x p ] 2 } By fitting the experimental data, apparent rate constants at the temperatures listed in Table 2 were determined, and the objective function values (F obj ) were employed to evaluate the agreement between the kinetic model and the experimental observations. At 120 °C, 130 °C, and 140 °C, F obj values of 3.12×10−5, 2.01×10−4, and 2.60×10−4, respectively, demonstrate that the constructed kinetic model accurately reproduces the actual reaction behavior. Moreover, the close correspondence between experimental data points and model-predicted concentration profiles (Fig. 5 a-c) further confirms the reliability and scientific validity of the fitting results. As reaction temperature increases, all apparent rate constants rise in accordance with the temperature-dependence predicted by chemical kinetics. At each of the three temperatures, the apparent rate constant k1 for EL → GVL considerably exceeds k₂ for EL→ IPL and k3 for IPL → GVL, indicating that EL predominantly undergoes transfer hydrogenation and lactonization to yield GVL. At the same time, elevated temperature favors ester interchange to generate IPL. For example, at 140 °C, k2 reaches 6.0 × 10−3 h−1, approximately twice the value observed at 120 °C. Apparent activation energies for each reaction step were calculated using the Arrhenius equation (Fig. 5d-f). Because EL and IPL possess similar physicochemical properties, their activation energies for conversion to GVL are also comparable, measuring 101.02 kJ/mol and 105.33 kJ/mol, respectively. In contrast, the activation energy associated with EL → GVL via ester interchange alone is substantially lower, at 46.97 kJ/mol [45–47]. 3.4 Catalyst stability The reusability of heterogeneous catalysts plays a pivotal role in determining their feasibility for practical applications. To this end, the recyclability of the Zr-MA0.5 catalyst was systematically evaluated. As illustrated in Fig. 6 a, the catalyst maintained high catalytic activity over at least six consecutive reaction cycles, with only a marginal decline in performance, thereby demonstrating excellent cycle stability. To further assess the structural integrity of the catalyst, FT-IR spectra of the catalyst after six cycles were compared with those of the fresh material, as shown in Figure S3. The minimal differences observed between the characteristic absorption bands indicate that the catalyst structure remained largely intact throughout the recycling process. In addition, leaching experiments depicted in Fig. 6b revealed that the reaction ceased immediately upon removal of the catalyst from the reaction mixture. This observation confirms the absence of significant leaching of active species during the catalytic process. Collectively, these results highlight the outstanding reusability and structural robustness of the Zr-MA0.5 catalyst in the hydrogenation of EL to GVL, underscoring its potential as a promising and efficient catalytic system for biomass valorization. 3.5 Tolerance assessment To assess the suitability of the catalyst under actual biomass-derived feedstock conditions, we added typical impurities—water, acetic acid, and furan—at concentrations of 1–10 vol % to high-purity EL and tested them under the same reaction conditions. As shown in Fig. 7 , furan only caused a gradual decrease in EL conversion, while GVL selectivity remained above 89 %, indicating minimal interference with the reaction pathway. In contrast, acetic acid significantly reduced the conversion rate (approximately 22–25 %) and shifted the product distribution toward IPL. This is attributed to acetic acid competing with Zr⁴⁺ sites for coordination and promoting acid-catalyzed ester exchange reactions. Water caused moderate and gradual decreases in both conversion rate and GVL selectivity, while IPL production increased, consistent with the blocking of Zr–OH sites and shifts in the hydrolysis/esterification equilibrium. These results indicate that the catalyst exhibits good tolerance toward furan but is more sensitive to strong acids and water, emphasizing the importance of raw material pretreatment in crude EL processing for achieving optimal GVL yield. Additionally, it demonstrates that the catalyst described in this study maintains good catalytic activity even in the presence of small amounts of non-acidic impurities. 3.6 Reaction mechanism According to literature reports, when ZrCl4 is employed as the metal precursor and malic acid serves as the coordinating ligand in aqueous solution, Zr4+ ions do not stabilize in the form of the Zr6O4(OH)4 secondary building unit commonly observed in UiO-type metal-organic frameworks [48,49]. Instead, they tend to self-assemble into a Zr4 cluster, in which four zirconium atoms are bridged through μ₃-oxo linkages. Based on experimental observations, prior studies, and the schematic illustration in Fig. 8 , a catalytic mechanism is proposed for the transformation of EL into GVL over the Zr-MA framework [50]. Initially, isopropanol adsorbs onto the active sites of the Zr4 cluster, where it undergoes cleavage under the synergistic action of Zr4+-O2− acid-base pairs, generating alkoxide species and transferring a hydrogen atom to the cluster oxygen, thereby completing hydrogen donor activation. Subsequently, the EL molecule coordinates to an adjacent zirconium center via its carbonyl group and undergoes hydrogenation through a cyclic transition state (TS1), yielding an intermediate of 4-hydroxypentanoate ester [51]. Following the desorption of acetone as a byproduct, the resulting Zr defect site becomes available for coordination with the ester carbonyl group, providing an activation site for the subsequent lactonization step. The intermediate undergoes intramolecular nucleophilic attack via a second transition state (TS2), forming a five-membered ring and giving rise to the lactonized intermediate. Finally, under the influence of Zr4+-O2− acid–base pairs, a molecule of ethanol is eliminated through a third transition state (TS3), affording the final product GVL. This mechanistic proposal elucidates the functional roles of the Zr4 cluster in the sequential steps of hydrogen activation, carbonyl hydrogenation, and lactonization, thereby offering theoretical guidance for the rational design of efficient Zr-based catalysts [52–54]. 4 Conclusions In summary, this work synthesized a highly efficient and economical zirconium-malic acid coordination polymer, Zr-MA0.5, with a green, aqueous synthesis method. This catalyst exhibits a high specific surface area coupled with a well-developed mesoporous network, thereby enhancing mass transfer during reaction. In addition, it features abundant Lewis acid sites alongside pronounced Brønsted acidity, and the balanced Brønsted-to-Lewis acid ratio underlies its exceptional performance in the transfer hydrogenation of biomass-derived EL to GVL. Experimental and kinetic investigations reveal that judiciously elevated temperatures accelerate substrate conversion; however, temperatures beyond the optimal threshold prolong the reaction pathway and exacerbate undesired by-product generation. Besides, a mechanistic model was proposed to clarify the functional roles of the Zr active sites in hydrogen activation, carbonyl hydrogenation, and subsequent lactonization, thereby providing theoretical insight for the rational development of high-performance Zr-based catalytic system. Moreover, the catalyst maintained high catalytic efficiency over at least six consecutive cycles without generating contamination during either synthesis or reaction processes. Furthermore, the aqueous solution synthesis strategy used to prepare Zr-MA0.5 is highly scalable, as it relies on inexpensive precursors, mild reaction conditions, and no toxic solvents. Although further optimization of reactor design and process intensification may be required, the simplicity and environmental friendliness of this method highlight its strong potential for industrial conversion. These results embody the principles of green chemistry and underscore the immense potential of this catalyst in sustainable and environmentally friendly chemical transformations. These results embody the principles of green chemistry and underscore the significant potential of this catalyst in sustainable and environmentally friendly chemical transformations. CRediT authorship contribution statement Shuaihao Wang: Writing – original draft, Methodology, Investigation, Formal analysis, Data curation. Jie Li: Validation, Formal analysis. Xin Xia: Visualization, Software. Jianhua Wang: Writing – review & editing. Qiong Xu: Supervision, Project administration, Funding acquisition. Xianxiang Liu: Project administration, Methodology, Funding acquisition, Conceptualization. Dulin Yin: Resources. Declaration of competing interest The authors declare that they have no known competing financial interests or personal relationships that could have appeared to influence the work reported in this paper. Supplementary materials Supplementary material associated with this article can be found, in the online version, at doi:10.1016/j.mcat.2025.115454. Appendix Supplementary materials Image, application 1 References [1] J. Gao H. Wang X. Cao Z. Li H. Guo X. Yang W. Wang N. Guo Y. Ma Nitrogen doped carbon solid acid for improving its catalytic transformation of xylose and agricultural biomass residues to furfural Mol. Catal. 535 2023 112890 J. Gao, H. Wang, X. Cao, Z. Li, H. Guo, X. Yang, W. Wang, N. Guo,Y. Ma, Nitrogen doped carbon solid acid for improving its catalytic transformation of xylose and agricultural biomass residues to furfural, Mol. Catal. 535 (2023) 112890. [2] H. Liu X. Cao X. Tang X. Zeng Y. Sun X. Ke L. Lin Choline chloride-promoted efficient solvent-free hydrogenation of biomass-derived levulinic acid to γ-valerolactone over Ru/C Green Chem 23 2021 1983 1988 H. Liu, X. Cao, X. Tang, X. Zeng, Y. Sun, X. Ke,L. Lin, Choline chloride-promoted efficient solvent-free hydrogenation of biomass-derived levulinic acid to γ-valerolactone over Ru/C, Green Chem. 23 (2021) 1983–1988. [3] T.L. Feiyi Chen Wenlong Jia Huai Liu Rui Zhang Lincai Peng Junhua Zhang Silicon-mediated tailoring of HfO x /ZSM-5 interfaces for sustainablecatalytic transfer hydrogenation of furfural to furfuryl alcohol Mol. Catal. 584 2025 115315 T.L. Feiyi Chen, Wenlong Jia, Huai Liu, Rui Zhang, Lincai Peng, Junhua Zhang Silicon-mediated tailoring of HfOx/ZSM-5 interfaces for sustainablecatalytic transfer hydrogenation of furfural to furfuryl alcohol, Mol. Catal. 584 (2025) 115315. [4] F. Kerkel M. Markiewicz S. Stolte E. Müller W. Kunz The green platform molecule gamma-valerolactone – ecotoxicity, biodegradability, solvent properties, and potential applications Green Chem 23 2021 2962 2976 F. Kerkel, M. Markiewicz, S. Stolte, E. Müller,W. Kunz, The green platform molecule gamma-valerolactone – ecotoxicity, biodegradability, solvent properties, and potential applications, Green Chem. 23 (2021) 2962–2976. [5] G. González N. Ehman F.E. Felissia M.C. Area Strategies towards a green solvent biorefinery: efficient delignification of lignocellulosic biomass residues by gamma-valerolactone/water catalyzed system Ind. Crops Prod. 205 2023 117535 G. González, N. Ehman, F.E. Felissia, M.C. Area, Strategies towards a green solvent biorefinery: efficient delignification of lignocellulosic biomass residues by gamma-valerolactone/water catalyzed system, Ind. Crops Prod. 205 (2023) 117535. [6] D. Liu A. Farooq Gamma-valerolactone (GVL) as a biofuel: investigation of GVL thermal decomposition and GVL + OH reaction Combust. Flame 253 2023 112771 D. Liu,A. Farooq, Gamma-valerolactone (GVL) as a biofuel: investigation of GVL thermal decomposition and GVL + OH reaction, Combust. Flame 253 (2023) 112771. [7] L. Jiang G. Xu Y. Fu A nitrogen-doped carbon modified nickel catalyst for the hydrogenation of levulinic acid under mild conditions Green Chem 23 2021 7065 7073 L. Jiang, G. Xu,Y. Fu, A nitrogen-doped carbon modified nickel catalyst for the hydrogenation of levulinic acid under mild conditions, Green Chem. 23 (2021) 7065–7073. [8] J. Yang R. Shi X. Xu Y. Li X. Wang G. Zhou Yolk-shell electron-rich Ru@hollow pyridinic-N-doped carbon nanospheres with tunable shell thickness and ultrahigh surface area for biomass-derived levulinic acid hydrogenation under mild conditions Appl Catal B-Environ 355 2024 124193 J. Yang, R. Shi, X. Xu, Y. Li, X. Wang,G. Zhou, Yolk-shell electron-rich Ru@hollow pyridinic-N-doped carbon nanospheres with tunable shell thickness and ultrahigh surface area for biomass-derived levulinic acid hydrogenation under mild conditions, Appl Catal B-Environ 355 (2024) 124193. [9] H.-J. Feng X.-C. Li H. Qian Y.-F. Zhang D.-H. Zhang D. Zhao S.-G. Hong N. Zhang Efficient and sustainable hydrogenation of levulinic-acid to gamma-valerolactone in aqueous solution over acid-resistant CePO4/Co2P catalysts Green Chem 21 2019 1743 1756 H.-J. Feng, X.-C. Li, H. Qian, Y.-F. Zhang, D.-H. Zhang, D. Zhao, S.-G. Hong,N. Zhang, Efficient and sustainable hydrogenation of levulinic-acid to gamma-valerolactone in aqueous solution over acid-resistant CePO4/Co2P catalysts, Green Chem. 21 (2019) 1743–1756. [10] Y. Du C. Zhang Y. Li N. Zhang D. Ren Z. Huo Catalytic hydrogenation of ethyl levulinate into γ-valerolactone over commercial Raney Cu catalyst Korean J. Chem. Eng. 40 2023 1912 1918 Y. Du, C. Zhang, Y. Li, N. Zhang, D. Ren,Z. Huo, Catalytic hydrogenation of ethyl levulinate into γ-valerolactone over commercial Raney Cu catalyst, Korean J. Chem. Eng. 40 (2023) 1912–1918. [11] B. Zada R. Zhu B. Wang J. Liu J. Deng Y. Fu A practical and concise homogeneous nickel catalyst for efficient solvent-free synthesis of γ-valerolactone Green Chem 22 2020 3427 3432 B. Zada, R. Zhu, B. Wang, J. Liu, J. Deng,Y. Fu, A practical and concise homogeneous nickel catalyst for efficient solvent-free synthesis of γ-valerolactone, Green Chem. 22 (2020) 3427–3432. [12] Z. Qin D. Bi B. Li X. Zhu Y. Ni L. Wang Improve furfural production from lignocellulosic biomass using Zn/MgAl2O4 catalyst Biomass Bioenergy 200 2025 108026 Z. Qin, D. Bi, B. Li, X. Zhu, Y. Ni,L. Wang, Improve furfural production from lignocellulosic biomass using Zn/MgAl2O4 catalyst, Biomass Bioenergy 200 (2025) 108026. [13] Y. Wang H. Xia F. Ge Y. Wang X. Yang J. Jiang M. Zhou Fabrication of tannic acid promoted lignin-MOF hybrids derived catalysts for catalytic transfer hydrogenation of 5-hydroxymethylfurfural Mol. Catal. 572 2025 114804 Y. Wang, H. Xia, F. Ge, Y. Wang, X. Yang, J. Jiang,M. Zhou, Fabrication of tannic acid promoted lignin-MOF hybrids derived catalysts for catalytic transfer hydrogenation of 5-hydroxymethylfurfural, Mol. Catal. 572 (2025) 114804. [14] R. Huang Y. Liu J. Zhang J. Wei L. Peng X. Tang Catalytic transfer hydrogenation of levulinic acid to γ-valerolactone over an acids-base trifunctional Hf-bagasse coordination complex derived catalyst Fuel 305 2021 121557 R. Huang, Y. Liu, J. Zhang, J. Wei, L. Peng,X. Tang, Catalytic transfer hydrogenation of levulinic acid to γ-valerolactone over an acids-base trifunctional Hf-bagasse coordination complex derived catalyst, Fuel 305 (2021) 121557. [15] J. Li M. Li C. Zhang C.-L. Liu R.-Z. Yang W.-S. Dong Construction of mesoporous Cu/ZrO2-Al2O3 as a ternary catalyst for efficient synthesis of γ-valerolactone from levulinic acid at low temperature J. Catal. 381 2020 163 174 J. Li, M. Li, C. Zhang, C.-L. Liu, R.-Z. Yang,W.-S. Dong, Construction of mesoporous Cu/ZrO2-Al2O3 as a ternary catalyst for efficient synthesis of γ-valerolactone from levulinic acid at low temperature, J. Catal. 381 (2020) 163–174. [16] D. Sharma P. Choudhary P. Mittal S. Kumar A. Gouda V. Krishnan Nanoarchitectonics of non-noble-metal-based heterogeneous catalysts for transfer hydrogenation reactions: detailed insights on different hydrogen sources ACS Catal 14 2024 4211 4248 D. Sharma, P. Choudhary, P. Mittal, S. Kumar, A. Gouda,V. Krishnan, Nanoarchitectonics of non-noble-metal-based heterogeneous catalysts for transfer hydrogenation reactions: detailed insights on different hydrogen sources, ACS Catal 14 (2024) 4211–4248. [17] Y. Wang H. Liu J. Zhang Y. Cheng W. Lin R. Huang L. Peng Direct epitaxial synthesis of magnetic biomass derived acid/base bifunctional zirconium-based hybrid for catalytic transfer hydrogenation of ethyl levulinate into γ-valerolactone Renew Energy 197 2022 911 921 Y. Wang, H. Liu, J. Zhang, Y. Cheng, W. Lin, R. Huang,L. Peng, Direct epitaxial synthesis of magnetic biomass derived acid/base bifunctional zirconium-based hybrid for catalytic transfer hydrogenation of ethyl levulinate into γ-valerolactone, Renew Energy 197 (2022) 911–921. [18] X. Li Y. Li X. Wang H. Wang Zirconium-gallic acid coordination polymer: catalytic transfer hydrogenation of levulinic acid and its esters into γ-valerolactone Catal. Lett. 152 2021 1286 1297 X. Li, Y. Li, X. Wang,H. Wang, Zirconium-gallic acid coordination polymer: catalytic transfer hydrogenation of levulinic acid and its esters into γ-valerolactone, Catal. Lett. 152 (2021) 1286–1297. [19] F. Li L.J. France Z. Cai Y. Li S. Liu H. Lou J. Long X. Li Catalytic transfer hydrogenation of butyl levulinate to γ-valerolactone over zirconium phosphates with adjustable Lewis and Brønsted acid sites Appl. Catal. B Environ. 214 2017 67 77 F. Li, L.J. France, Z. Cai, Y. Li, S. Liu, H. Lou, J. Long,X. Li, Catalytic transfer hydrogenation of butyl levulinate to γ-valerolactone over zirconium phosphates with adjustable Lewis and Brønsted acid sites, Appl. Catal. B Environ. 214 (2017) 67–77. [20] S. Juutilainen P. Simell A. Krause Zirconia: selective oxidation catalyst for removal of tar and ammonia from biomass gasification gas Appl. Catal. B Environ. 62 2006 86 92 S. Juutilainen, P. Simell, A. Krause, Zirconia: selective oxidation catalyst for removal of tar and ammonia from biomass gasification gas, Appl. Catal. B Environ. 62 (2006) 86–92. [21] H. Wu W. Lu Y. Chen P. Zhang X. Cheng Application of Boehm titration for the quantitative measurement of soot oxygen functional groups Energy Fuels 34 2020 7363 7372 H. Wu, W. Lu, Y. Chen, P. Zhang,X. Cheng, Application of Boehm titration for the quantitative measurement of soot oxygen functional groups, Energy Fuels 34 (2020) 7363–7372. [22] C. Pérez-Méndez R. Contreras Quantitative characterization of the global philicity patterns of common diene/dienophile pairs in cycloaddition reactions II: the interacting pair model Tetrahedron Lett 56 2015 1767 1770 C. Pérez-Méndez,R. Contreras, Quantitative characterization of the global philicity patterns of common diene/dienophile pairs in cycloaddition reactions II: the interacting pair model, Tetrahedron Lett. 56 (2015) 1767–1770. [23] Z. Alothman A review: fundamental aspects of silicate mesoporous materials Materials (Basel) 5 2012 2874 2902 Z. Alothman, A review: fundamental aspects of silicate mesoporous materials, Materials (Basel) 5 (2012) 2874–2902. [24] J. He H. Li Y. Xu S. Yang Dual acidic mesoporous KIT silicates enable one-pot production of γ-valerolactone from biomass derivatives via cascade reactions Renew Energy 146 2020 359 370 J. He, H. Li, Y. Xu,S. Yang, Dual acidic mesoporous KIT silicates enable one-pot production of γ-valerolactone from biomass derivatives via cascade reactions, Renew Energy 146 (2020) 359–370. [25] J. Liu Z. Sun Y. Deng Y. Zou C. Li X. Guo L. Xiong Y. Gao F. Li D. Zhao Highly water-dispersible biocompatible magnetite particles with low cytotoxicity stabilized by citrate groups Angew. Chem., Int. Ed. 48 2009 5875 5879 J. Liu, Z. Sun, Y. Deng, Y. Zou, C. Li, X. Guo, L. Xiong, Y. Gao, F. Li,D. Zhao, Highly water-dispersible biocompatible magnetite particles with low cytotoxicity stabilized by citrate groups, Angew. Chem., Int. Ed. 48 (2009) 5875–5879. [26] X. Chen T. Zhao X. Zhang Y. Zhang H. Yu Q. Lyu X. Jia L. Han W. Xiao Synthesis of ternary magnetic nanoparticles for enhanced catalytic conversion of biomass-derived methyl levulinate into γ-valerolactone J. Energy Chem 63 2021 430 441 X. Chen, T. Zhao, X. Zhang, Y. Zhang, H. Yu, Q. Lyu, X. Jia, L. Han,W. Xiao, Synthesis of ternary magnetic nanoparticles for enhanced catalytic conversion of biomass-derived methyl levulinate into γ-valerolactone, J. Energy Chem 63 (2021) 430–441. [27] P. Zhang P. Hou M. Ma K. Bu Q. Guo H. Yue G. Tian S. Feng Bifunctional zirconium-based metal-organic frameworks as chemoselective catalysts for the synthesis of γ-valerolactone from furfural via a one-pot cascade reaction Appl. Catal., A 653 2023 119064 P. Zhang, P. Hou, M. Ma, K. Bu, Q. Guo, H. Yue, G. Tian,S. Feng, Bifunctional zirconium-based metal-organic frameworks as chemoselective catalysts for the synthesis of γ-valerolactone from furfural via a one-pot cascade reaction, Appl. Catal., A 653 (2023) 119064. [28] Y. Wu H. Wang J. Peng J. Zhang M. Ding Single-atom Cu catalyst in a zirconium-based metal–organic framework for biomass conversion Chem. Eng. J. (Lausanne) 454 2023 140156 Y. Wu, H. Wang, J. Peng, J. Zhang,M. Ding, Single-atom Cu catalyst in a zirconium-based metal–organic framework for biomass conversion, Chem. Eng. J. (Lausanne) 454 (2023) 140156. [29] J. Amaro-Gahete D. Esquivel J.R. Ruiz C. Jiménez-Sanchidrián F.J. Romero-Salguero Zirconium coordination polymers based on tartaric and malic acids as catalysts for cyanosilylation reactions Appl. Catal., A 585 2019 117190 J. Amaro-Gahete, D. Esquivel, J.R. Ruiz, C. Jiménez-Sanchidrián, F.J. Romero-Salguero, Zirconium coordination polymers based on tartaric and malic acids as catalysts for cyanosilylation reactions, Appl. Catal., A 585 (2019) 117190. [30] R.-H. Zhang Q.-M. Hong J.-M. Yang H.-L. Zhang G. Michael Blackburnb Z.-H. Zhou Syntheses, spectroscopies and structures of zinc complexes with malate Inorg. Chim. Acta 362 2009 2643 2649 R.-H. Zhang, Q.-M. Hong, J.-M. Yang, H.-L. Zhang, G. Michael Blackburnb,Z.-H. Zhou, Syntheses, spectroscopies and structures of zinc complexes with malate, Inorg. Chim. Acta 362 (2009) 2643–2649. [31] F. Wan B. Yang J. Zhu D. Jiang H. Zhang Q. Zhang S. Chen C. Zhang Y. Liu Z. Fu The transfer hydrogenation of high concentration levulinic acid to γ-valerolactone catalyzed by glucose phosphate carbamide zirconium Green Chem 23 2021 3428 3438 F. Wan, B. Yang, J. Zhu, D. Jiang, H. Zhang, Q. Zhang, S. Chen, C. Zhang, Y. Liu,Z. Fu, The transfer hydrogenation of high concentration levulinic acid to γ-valerolactone catalyzed by glucose phosphate carbamide zirconium, Green Chem. 23 (2021) 3428–3438. [32] W. Wang X. Cao H. Guo X. Yang N. Guo Y. Ma Carbon-based solid acid derived from lignin and polyvinyl chloride for conversion of xylose and crop wastes to furfural Mol. Catal. 524 2022 112329 W. Wang, X. Cao, H. Guo, X. Yang, N. Guo,Y. Ma, Carbon-based solid acid derived from lignin and polyvinyl chloride for conversion of xylose and crop wastes to furfural, Mol. Catal. 524 (2022) 112329. [33] H. Zhang W. Yang I.I. Roslan S. Jaenicke G.-K. Chuah A combo Zr-HY and Al-HY zeolite catalysts for the one-pot cascade transformation of biomass-derived furfural to γ-valerolactone J. Catal. 375 2019 56 67 H. Zhang, W. Yang, I.I. Roslan, S. Jaenicke,G.-K. Chuah, A combo Zr-HY and Al-HY zeolite catalysts for the one-pot cascade transformation of biomass-derived furfural to γ-valerolactone, J. Catal. 375 (2019) 56–67. [34] J. Shan Z. Chen D. Wang G. Zhang S. Li C. Sun D. Wang C. Ju X. Zhang L. Li Boosting γ-valerolactone production from ethyl levulinate hydrogenation over Pd catalyst via alloying with Co and synergistic catalysis with HZSM-5 Appl Catal B-Environ 362 2025 124769 J. Shan, Z. Chen, D. Wang, G. Zhang, S. Li, C. Sun, D. Wang, C. Ju, X. Zhang,L. Li, Boosting γ-valerolactone production from ethyl levulinate hydrogenation over Pd catalyst via alloying with Co and synergistic catalysis with HZSM-5, Appl Catal B-Environ 362 (2025) 124769. [35] L. Zhong X. Liao H. Cui H. Luo Y. Lv P. Liu Hydrogenation of α,β-unsaturated aldehydes over defective UiO-66 with frustrated Lewis Pairs: modulation of densities of defect sites via tailoring ligand-vacancies Appl. Catal. B Environ. 342 2024 123421 L. Zhong, X. Liao, H. Cui, H. Luo, Y. Lv,P. Liu, Hydrogenation of α,β-unsaturated aldehydes over defective UiO-66 with frustrated Lewis Pairs: modulation of densities of defect sites via tailoring ligand-vacancies, Appl. Catal. B Environ. 342 (2024) 123421. [36] H. Wang Y. Wu Y. Li J. Peng X.-K. Gu M. Ding One-step synthesis of pentane fuel from γ-valerolactone with high selectivity over a Co/HZSM-5 bifunctional catalyst Green Chem 23 2021 4780 4789 H. Wang, Y. Wu, Y. Li, J. Peng, X.-K. Gu,M. Ding, One-step synthesis of pentane fuel from γ-valerolactone with high selectivity over a Co/HZSM-5 bifunctional catalyst, Green Chem. 23 (2021) 4780–4789. [37] D. Ren X. Wan F. Jin Z. Song Y. Liu Z. Huo Selective hydrogenation of levulinate esters to 1,4-pentanediol using a ternary skeletal CuAlZn catalyst Green Chem 18 2016 5999 6003 D. Ren, X. Wan, F. Jin, Z. Song, Y. Liu,Z. Huo, Selective hydrogenation of levulinate esters to 1,4-pentanediol using a ternary skeletal CuAlZn catalyst, Green Chem. 18 (2016) 5999–6003. [38] J. Zheng J. Zhu X. Xu W. Wang J. Li Y. Zhao K. Tang Q. Song X. Qi D. Kong Y. Tang Continuous hydrogenation of ethyl levulinate to γ-valerolactone and 2-methyl tetrahydrofuran over alumina doped Cu/SiO2 catalyst: the potential of commercialization Sci. Rep. 6 2016 28898 J. Zheng, J. Zhu, X. Xu, W. Wang, J. Li, Y. Zhao, K. Tang, Q. Song, X. Qi, D. Kong,Y. Tang, Continuous hydrogenation of ethyl levulinate to γ-valerolactone and 2-methyl tetrahydrofuran over alumina doped Cu/SiO2 catalyst: the potential of commercialization, Sci. Rep. 6 (2016) 28898. [39] J.P. Lange R. Price P.M. Ayoub J. Louis L. Petrus L. Clarke H. Gosselink Valeric Biofuels: a platform of cellulosic transportation fuels Angew. Chem., Int. Ed. 49 2010 4479 4483 J.P. Lange, R. Price, P.M. Ayoub, J. Louis, L. Petrus, L. Clarke,H. Gosselink, Valeric Biofuels: a platform of cellulosic transportation fuels, Angew. Chem., Int. Ed. 49 (2010) 4479–4483. [40] J.C. Serrano-Ruiz D. Wang J.A. Dumesic Catalytic upgrading of levulinic acid to 5-nonanone Green Chem 12 2010 J.C. Serrano-Ruiz, D. Wang, J.A. Dumesic, Catalytic upgrading of levulinic acid to 5-nonanone, Green Chem. 12 (2010) [41] J.Q. Bond D.Martin Alonso R.M. West J.A. Dumesic γ-valerolactone ring-opening and decarboxylation over SiO2/Al2O3 in the presence of water Langmuir 26 2010 16291 16298 J.Q. Bond, D.Martin Alonso, R.M. West, J.A. Dumesic, γ-valerolactone ring-opening and decarboxylation over SiO2/Al2O3 in the presence of water, Langmuir 26 (2010) 16291–16298. [42] X. Tang H. Chen L. Hu W. Hao Y. Sun X. Zeng L. Lin S. Liu Conversion of biomass to γ-valerolactone by catalytic transfer hydrogenation of ethyl levulinate over metal hydroxides Appl. Catal. B Environ. 147 2014 827 834 X. Tang, H. Chen, L. Hu, W. Hao, Y. Sun, X. Zeng, L. Lin,S. Liu, Conversion of biomass to γ-valerolactone by catalytic transfer hydrogenation of ethyl levulinate over metal hydroxides, Appl. Catal. B Environ. 147 (2014) 827–834. [43] Z. Deng S. Wang C. Chen X. Xia Q. Xu D. Yin X. Liu Enhanced transfer hydrogenation of bio-derived Ethyl levulinate to γ-valerolactone over Zr-based catalysts through a formic acid modification strategy Mol. Catal. 564 2024 114346 Z. Deng, S. Wang, C. Chen, X. Xia, Q. Xu, D. Yin,X. Liu, Enhanced transfer hydrogenation of bio-derived Ethyl levulinate to γ-valerolactone over Zr-based catalysts through a formic acid modification strategy, Mol. Catal. 564 (2024) 114346. [44] M.M. Antunes S. Lima P. Neves A.L. Magalhães E. Fazio F. Neri M.T. Pereira A.F. Silva C.M. Silva S.M. Rocha M. Pillinger A. Urakawa A.A. Valente Integrated reduction and acid-catalysed conversion of furfural in alcohol medium using Zr,Al-containing ordered micro/mesoporous silicates Appl. Catal. B Environ. 182 2016 485 503 M.M. Antunes, S. Lima, P. Neves, A.L. Magalhães, E. Fazio, F. Neri, M.T. Pereira, A.F. Silva, C.M. Silva, S.M. Rocha, M. Pillinger, A. Urakawa, A.A. Valente, Integrated reduction and acid-catalysed conversion of furfural in alcohol medium using Zr,Al-containing ordered micro/mesoporous silicates, Appl. Catal. B Environ. 182 (2016) 485–503. [45] Y. Li K. Lyu D. Liu X. Lan T. Wang Metal-modified Ni phosphides: highly efficient catalysts for the hydrogenation of ethyl levulinate Catal. Today 442 2024 114938 Y. Li, K. Lyu, D. Liu, X. Lan,T. Wang, Metal-modified Ni phosphides: highly efficient catalysts for the hydrogenation of ethyl levulinate, Catal. Today 442 (2024) 114938. [46] Z. Zhang Z. Liu Z. Gu Z. Wen B. Xue Selective production of γ-valerolactone from ethyl levulinate by catalytic transfer hydrogenation over Zr-based catalyst Res. Chem. Intermed. 48 2022 1181 1198 Z. Zhang, Z. Liu, Z. Gu, Z. Wen,B. Xue, Selective production of γ-valerolactone from ethyl levulinate by catalytic transfer hydrogenation over Zr-based catalyst, Res. Chem. Intermed. 48 (2022) 1181–1198. [47] J. Zhang Z. Li H. Liu R. Shan H. Yuan Y. Chen Waste lithium-ion batteries for selective transfer hydrogenation of bio-based ethyl levulinate: experiments, kinetics and economic assessment Chem. Eng. J. (Lausanne) 501 2024 157570 J. Zhang, Z. Li, H. Liu, R. Shan, H. Yuan,Y. Chen, Waste lithium-ion batteries for selective transfer hydrogenation of bio-based ethyl levulinate: experiments, kinetics and economic assessment, Chem. Eng. J. (Lausanne) 501 (2024) 157570. [48] S. Wang N. Xhaferaj M. Wahiduzzaman K. Oyekan X. Li K. Wei B. Zheng A. Tissot J. Marrot W. Shepard C. Martineau-Corcos Y. Filinchuk K. Tan G. Maurin C. Serre Engineering structural dynamics of zirconium metal–Organic frameworks based on natural C4 linkers J. Am. Chem. Soc. 141 2019 17207 17216 S. Wang, N. Xhaferaj, M. Wahiduzzaman, K. Oyekan, X. Li, K. Wei, B. Zheng, A. Tissot, J. Marrot, W. Shepard, C. Martineau-Corcos, Y. Filinchuk, K. Tan, G. Maurin,C. Serre, Engineering structural dynamics of zirconium metal–Organic frameworks based on natural C4 linkers, J. Am. Chem. Soc. 141 (2019) 17207–17216. [49] Y.-L. Wang J.-W. Zhao Z. Zhang J.-J. Sun X.-Y. Li B.-F. Yang G.-Y. Yang Enantiomeric polyoxometalates based on malate chirality-inducing tetra-ZrIV–Substituted keggin dimeric clusters Inorg. Chem. 58 2019 4657 4664 Y.-L. Wang, J.-W. Zhao, Z. Zhang, J.-J. Sun, X.-Y. Li, B.-F. Yang,G.-Y. Yang, Enantiomeric polyoxometalates based on malate chirality-inducing tetra-ZrIV–Substituted keggin dimeric clusters, Inorg. Chem. 58 (2019) 4657–4664. [50] M.A. Ortuño M. Rellán-Piñeiro R. Luque Computational mechanism of methyl levulinate conversion to γ-valerolactone on UiO-66 metal organic frameworks ACS Sustain. Chem. Eng. 10 2022 3567 3573 M.A. Ortuño, M. Rellán-Piñeiro,R. Luque, Computational mechanism of methyl levulinate conversion to γ-valerolactone on UiO-66 metal organic frameworks, ACS Sustain. Chem. Eng. 10 (2022) 3567–3573. [51] H.K. Yasutaka Kuwahara Hiromi Yamashita catalytic Transfer hydrogenation of biomass-derived levulinic acid and its esters to γ-valerolactone over sulfonic acid-functionalized UiO-66 ACS Sustain. Chem. Eng. 5 2017 1141 1152 H.K. Yasutaka Kuwahara, Hiromi Yamashita catalytic Transfer hydrogenation of biomass-derived levulinic acid and its esters to γ-valerolactone over sulfonic acid-functionalized UiO-66, ACS Sustain. Chem. Eng. 5 (2017) 1141–1152. [52] M.E. Khabazi A. Najafi Chermahini R. Luque A. Pineda E. Rodríguez-Castellón C. Vargas Fernández Hydrogenation of ethyl levulinate to gamma-valerolactone with formic acid and a palladium–Manganese catalyst immobilized on dendritic fibrous nanosilica (DFNS) Energy Fuels 38 2024 14387 14401 M.E. Khabazi, A. Najafi Chermahini, R. Luque, A. Pineda, E. Rodríguez-Castellón, C. Vargas Fernández, Hydrogenation of ethyl levulinate to gamma-valerolactone with formic acid and a palladium–Manganese catalyst immobilized on dendritic fibrous nanosilica (DFNS), Energy Fuels 38 (2024) 14387–14401. [53] Z. Wei Q. Li Y. Cheng M. Dong Z. Zhang X. Zhu Y. Liu Y. Sun Low loading of CoRe/TiO2 for efficient hydrodeoxygenation of levulinic acid to γ-valerolactone ACS Sustain. Chem. Eng. 9 2021 10882 10891 Z. Wei, Q. Li, Y. Cheng, M. Dong, Z. Zhang, X. Zhu, Y. Liu,Y. Sun, Low loading of CoRe/TiO2 for efficient hydrodeoxygenation of levulinic acid to γ-valerolactone, ACS Sustain. Chem. Eng. 9 (2021) 10882–10891. [54] L. Zhang H. Xiao B. Zhou Y. Hong Q. Wu J. Qiu J. Chen Systematic study on efficient transfer hydrogenation of levulinate esters to γ-valerolactone over robust catalyst J. Catal. 444 2025 115999 L. Zhang, H. Xiao, B. Zhou, Y. Hong, Q. Wu, J. Qiu,J. Chen, Systematic study on efficient transfer hydrogenation of levulinate esters to γ-valerolactone over robust catalyst, J. Catal. 444 (2025) 115999.",
      "scopus-id": "105014255126",
      "coredata": {
        "eid": "1-s2.0-S246882312500639X",
        "dc:description": "The development of green, efficient, and economical catalysts for the transformation of biomass into value-added chemicals is vital for advancing sustainable chemical manufacturing. In this work, a series of cost-effective and stable zirconium-based catalysts were synthesized via coordination of Zr4+ with malic acid (MA), a low-cost and naturally abundant organic ligand, in aqueous solution. By precisely tuning the ligand-to-metal molar ratio, the porous structure properties of the resulting materials could be finely controlled. In addition, the Brønsted-to-Lewis acid site ratio reached 0.37, indicating a well-balanced acidic environment. These structural and acidic characteristics collectively contributed to its superior catalytic performance in the conversion of ethyl levulinate (EL) to γ-valerolactone (GVL) via transfer hydrogenation and intramolecular lactonization. Kinetic analysis revealed that elevated temperatures promote the direct transformation of EL to GVL; however, temperatures beyond the optimal range induce competing transesterification reactions, thereby extending the reaction pathway. Notably, the catalyst retained its activity over at least six consecutive cycles without detectable deactivation. A mechanistic framework is proposed to provide deeper insight into the transfer hydrogenation process mediated by this class of Zr-based coordination catalysts.",
        "openArchiveArticle": "false",
        "prism:coverDate": "2025-11-30",
        "openaccessUserLicense": null,
        "prism:aggregationType": "Journal",
        "prism:url": "https://api.elsevier.com/content/article/pii/S246882312500639X",
        "dc:creator": [
          {
            "@_fa": "true",
            "$": "Wang, Shuaihao"
          },
          {
            "@_fa": "true",
            "$": "Li, Jie"
          },
          {
            "@_fa": "true",
            "$": "Xia, Xin"
          },
          {
            "@_fa": "true",
            "$": "Wang, Jianhua"
          },
          {
            "@_fa": "true",
            "$": "Xu, Qiong"
          },
          {
            "@_fa": "true",
            "$": "Liu, Xianxiang"
          },
          {
            "@_fa": "true",
            "$": "Yin, Dulin"
          }
        ],
        "link": [
          {
            "@_fa": "true",
            "@rel": "self",
            "@href": "https://api.elsevier.com/content/article/pii/S246882312500639X"
          },
          {
            "@_fa": "true",
            "@rel": "scidir",
            "@href": "https://www.sciencedirect.com/science/article/pii/S246882312500639X"
          }
        ],
        "dc:format": "application/json",
        "openaccessType": null,
        "pii": "S2468-8231(25)00639-X",
        "prism:volume": "586",
        "articleNumber": "115454",
        "prism:publisher": "Elsevier B.V. All rights are reserved, including those for text and data mining, AI training, and similar technologies.",
        "dc:title": "Zirconium-malate coordination polymer: a green catalyst for transfer hydrogenation of Ethyl Levulinate to Synthesize γ-valerolactone",
        "prism:copyright": "© 2025 Elsevier B.V. All rights are reserved, including those for text and data mining, AI training, and similar technologies.",
        "openaccess": "0",
        "prism:issn": "24688231",
        "dcterms:subject": [
          {
            "@_fa": "true",
            "$": "Biomass"
          },
          {
            "@_fa": "true",
            "$": "Ethyl levulinate"
          },
          {
            "@_fa": "true",
            "$": "Γ-valerolactone"
          },
          {
            "@_fa": "true",
            "$": "Catalytic transfer hydrogenation"
          },
          {
            "@_fa": "true",
            "$": "Kinetics"
          }
        ],
        "openaccessArticle": "false",
        "prism:publicationName": "Molecular Catalysis",
        "openaccessSponsorType": null,
        "prism:pageRange": "115454",
        "pubType": "fla",
        "prism:coverDisplayDate": "November 2025",
        "prism:doi": "10.1016/j.mcat.2025.115454",
        "prism:startingPage": "115454",
        "dc:identifier": "doi:10.1016/j.mcat.2025.115454",
        "openaccessSponsorName": null
      },
      "objects": {
        "object": [
          {
            "@category": "standard",
            "@height": "388",
            "@width": "772",
            "@_fa": "true",
            "$": "https://api.elsevier.com/content/object/eid/1-s2.0-S246882312500639X-gr5.jpg?httpAccept=%2A%2F%2A",
            "@multimediatype": "JPEG image file",
            "@type": "IMAGE-DOWNSAMPLED",
            "@size": "73645",
            "@ref": "gr5",
            "@mimetype": "image/jpeg"
          },
          {
            "@category": "standard",
            "@height": "203",
            "@width": "565",
            "@_fa": "true",
            "$": "https://api.elsevier.com/content/object/eid/1-s2.0-S246882312500639X-gr6.jpg?httpAccept=%2A%2F%2A",
            "@multimediatype": "JPEG image file",
            "@type": "IMAGE-DOWNSAMPLED",
            "@size": "34407",
            "@ref": "gr6",
            "@mimetype": "image/jpeg"
          },
          {
            "@category": "standard",
            "@height": "378",
            "@width": "753",
            "@_fa": "true",
            "$": "https://api.elsevier.com/content/object/eid/1-s2.0-S246882312500639X-gr3.jpg?httpAccept=%2A%2F%2A",
            "@multimediatype": "JPEG image file",
            "@type": "IMAGE-DOWNSAMPLED",
            "@size": "106916",
            "@ref": "gr3",
            "@mimetype": "image/jpeg"
          },
          {
            "@category": "standard",
            "@height": "492",
            "@width": "678",
            "@_fa": "true",
            "$": "https://api.elsevier.com/content/object/eid/1-s2.0-S246882312500639X-gr4.jpg?httpAccept=%2A%2F%2A",
            "@multimediatype": "JPEG image file",
            "@type": "IMAGE-DOWNSAMPLED",
            "@size": "77848",
            "@ref": "gr4",
            "@mimetype": "image/jpeg"
          },
          {
            "@category": "standard",
            "@height": "439",
            "@width": "715",
            "@_fa": "true",
            "$": "https://api.elsevier.com/content/object/eid/1-s2.0-S246882312500639X-gr1.jpg?httpAccept=%2A%2F%2A",
            "@multimediatype": "JPEG image file",
            "@type": "IMAGE-DOWNSAMPLED",
            "@size": "111142",
            "@ref": "gr1",
            "@mimetype": "image/jpeg"
          },
          {
            "@category": "standard",
            "@height": "362",
            "@width": "753",
            "@_fa": "true",
            "$": "https://api.elsevier.com/content/object/eid/1-s2.0-S246882312500639X-gr2.jpg?httpAccept=%2A%2F%2A",
            "@multimediatype": "JPEG image file",
            "@type": "IMAGE-DOWNSAMPLED",
            "@size": "106427",
            "@ref": "gr2",
            "@mimetype": "image/jpeg"
          },
          {
            "@category": "standard",
            "@height": "200",
            "@width": "403",
            "@_fa": "true",
            "$": "https://api.elsevier.com/content/object/eid/1-s2.0-S246882312500639X-ga1.jpg?httpAccept=%2A%2F%2A",
            "@multimediatype": "JPEG image file",
            "@type": "IMAGE-DOWNSAMPLED",
            "@size": "37432",
            "@ref": "ga1",
            "@mimetype": "image/jpeg"
          },
          {
            "@category": "standard",
            "@height": "273",
            "@width": "540",
            "@_fa": "true",
            "$": "https://api.elsevier.com/content/object/eid/1-s2.0-S246882312500639X-sc1.jpg?httpAccept=%2A%2F%2A",
            "@multimediatype": "JPEG image file",
            "@type": "IMAGE-DOWNSAMPLED",
            "@size": "17897",
            "@ref": "sc1",
            "@mimetype": "image/jpeg"
          },
          {
            "@category": "standard",
            "@height": "201",
            "@width": "753",
            "@_fa": "true",
            "$": "https://api.elsevier.com/content/object/eid/1-s2.0-S246882312500639X-gr7.jpg?httpAccept=%2A%2F%2A",
            "@multimediatype": "JPEG image file",
            "@type": "IMAGE-DOWNSAMPLED",
            "@size": "46760",
            "@ref": "gr7",
            "@mimetype": "image/jpeg"
          },
          {
            "@category": "standard",
            "@height": "347",
            "@width": "678",
            "@_fa": "true",
            "$": "https://api.elsevier.com/content/object/eid/1-s2.0-S246882312500639X-gr8.jpg?httpAccept=%2A%2F%2A",
            "@multimediatype": "JPEG image file",
            "@type": "IMAGE-DOWNSAMPLED",
            "@size": "50481",
            "@ref": "gr8",
            "@mimetype": "image/jpeg"
          },
          {
            "@category": "thumbnail",
            "@height": "110",
            "@width": "219",
            "@_fa": "true",
            "$": "https://api.elsevier.com/content/object/eid/1-s2.0-S246882312500639X-gr5.sml?httpAccept=%2A%2F%2A",
            "@multimediatype": "GIF image file",
            "@type": "IMAGE-THUMBNAIL",
            "@size": "9561",
            "@ref": "gr5",
            "@mimetype": "image/gif"
          },
          {
            "@category": "thumbnail",
            "@height": "79",
            "@width": "219",
            "@_fa": "true",
            "$": "https://api.elsevier.com/content/object/eid/1-s2.0-S246882312500639X-gr6.sml?httpAccept=%2A%2F%2A",
            "@multimediatype": "GIF image file",
            "@type": "IMAGE-THUMBNAIL",
            "@size": "7763",
            "@ref": "gr6",
            "@mimetype": "image/gif"
          },
          {
            "@category": "thumbnail",
            "@height": "110",
            "@width": "219",
            "@_fa": "true",
            "$": "https://api.elsevier.com/content/object/eid/1-s2.0-S246882312500639X-gr3.sml?httpAccept=%2A%2F%2A",
            "@multimediatype": "GIF image file",
            "@type": "IMAGE-THUMBNAIL",
            "@size": "13290",
            "@ref": "gr3",
            "@mimetype": "image/gif"
          },
          {
            "@category": "thumbnail",
            "@height": "159",
            "@width": "219",
            "@_fa": "true",
            "$": "https://api.elsevier.com/content/object/eid/1-s2.0-S246882312500639X-gr4.sml?httpAccept=%2A%2F%2A",
            "@multimediatype": "GIF image file",
            "@type": "IMAGE-THUMBNAIL",
            "@size": "11604",
            "@ref": "gr4",
            "@mimetype": "image/gif"
          },
          {
            "@category": "thumbnail",
            "@height": "134",
            "@width": "219",
            "@_fa": "true",
            "$": "https://api.elsevier.com/content/object/eid/1-s2.0-S246882312500639X-gr1.sml?httpAccept=%2A%2F%2A",
            "@multimediatype": "GIF image file",
            "@type": "IMAGE-THUMBNAIL",
            "@size": "17986",
            "@ref": "gr1",
            "@mimetype": "image/gif"
          },
          {
            "@category": "thumbnail",
            "@height": "105",
            "@width": "219",
            "@_fa": "true",
            "$": "https://api.elsevier.com/content/object/eid/1-s2.0-S246882312500639X-gr2.sml?httpAccept=%2A%2F%2A",
            "@multimediatype": "GIF image file",
            "@type": "IMAGE-THUMBNAIL",
            "@size": "12652",
            "@ref": "gr2",
            "@mimetype": "image/gif"
          },
          {
            "@category": "thumbnail",
            "@height": "109",
            "@width": "219",
            "@_fa": "true",
            "$": "https://api.elsevier.com/content/object/eid/1-s2.0-S246882312500639X-ga1.sml?httpAccept=%2A%2F%2A",
            "@multimediatype": "GIF image file",
            "@type": "IMAGE-THUMBNAIL",
            "@size": "20747",
            "@ref": "ga1",
            "@mimetype": "image/gif"
          },
          {
            "@category": "thumbnail",
            "@height": "111",
            "@width": "219",
            "@_fa": "true",
            "$": "https://api.elsevier.com/content/object/eid/1-s2.0-S246882312500639X-sc1.sml?httpAccept=%2A%2F%2A",
            "@multimediatype": "GIF image file",
            "@type": "IMAGE-THUMBNAIL",
            "@size": "3756",
            "@ref": "sc1",
            "@mimetype": "image/gif"
          },
          {
            "@category": "thumbnail",
            "@height": "58",
            "@width": "219",
            "@_fa": "true",
            "$": "https://api.elsevier.com/content/object/eid/1-s2.0-S246882312500639X-gr7.sml?httpAccept=%2A%2F%2A",
            "@multimediatype": "GIF image file",
            "@type": "IMAGE-THUMBNAIL",
            "@size": "7734",
            "@ref": "gr7",
            "@mimetype": "image/gif"
          },
          {
            "@category": "thumbnail",
            "@height": "112",
            "@width": "219",
            "@_fa": "true",
            "$": "https://api.elsevier.com/content/object/eid/1-s2.0-S246882312500639X-gr8.sml?httpAccept=%2A%2F%2A",
            "@multimediatype": "GIF image file",
            "@type": "IMAGE-THUMBNAIL",
            "@size": "8217",
            "@ref": "gr8",
            "@mimetype": "image/gif"
          },
          {
            "@category": "high",
            "@height": "1719",
            "@width": "3417",
            "@_fa": "true",
            "$": "https://api.elsevier.com/content/object/eid/1-s2.0-S246882312500639X-gr5_lrg.jpg?httpAccept=%2A%2F%2A",
            "@multimediatype": "JPEG image file",
            "@type": "IMAGE-HIGH-RES",
            "@size": "443027",
            "@ref": "gr5",
            "@mimetype": "image/jpeg"
          },
          {
            "@category": "high",
            "@height": "899",
            "@width": "2500",
            "@_fa": "true",
            "$": "https://api.elsevier.com/content/object/eid/1-s2.0-S246882312500639X-gr6_lrg.jpg?httpAccept=%2A%2F%2A",
            "@multimediatype": "JPEG image file",
            "@type": "IMAGE-HIGH-RES",
            "@size": "188789",
            "@ref": "gr6",
            "@mimetype": "image/jpeg"
          },
          {
            "@category": "high",
            "@height": "1672",
            "@width": "3333",
            "@_fa": "true",
            "$": "https://api.elsevier.com/content/object/eid/1-s2.0-S246882312500639X-gr3_lrg.jpg?httpAccept=%2A%2F%2A",
            "@multimediatype": "JPEG image file",
            "@type": "IMAGE-HIGH-RES",
            "@size": "673538",
            "@ref": "gr3",
            "@mimetype": "image/jpeg"
          },
          {
            "@category": "high",
            "@height": "2179",
            "@width": "3000",
            "@_fa": "true",
            "$": "https://api.elsevier.com/content/object/eid/1-s2.0-S246882312500639X-gr4_lrg.jpg?httpAccept=%2A%2F%2A",
            "@multimediatype": "JPEG image file",
            "@type": "IMAGE-HIGH-RES",
            "@size": "464413",
            "@ref": "gr4",
            "@mimetype": "image/jpeg"
          },
          {
            "@category": "high",
            "@height": "1945",
            "@width": "3167",
            "@_fa": "true",
            "$": "https://api.elsevier.com/content/object/eid/1-s2.0-S246882312500639X-gr1_lrg.jpg?httpAccept=%2A%2F%2A",
            "@multimediatype": "JPEG image file",
            "@type": "IMAGE-HIGH-RES",
            "@size": "1070134",
            "@ref": "gr1",
            "@mimetype": "image/jpeg"
          },
          {
            "@category": "high",
            "@height": "1602",
            "@width": "3333",
            "@_fa": "true",
            "$": "https://api.elsevier.com/content/object/eid/1-s2.0-S246882312500639X-gr2_lrg.jpg?httpAccept=%2A%2F%2A",
            "@multimediatype": "JPEG image file",
            "@type": "IMAGE-HIGH-RES",
            "@size": "678569",
            "@ref": "gr2",
            "@mimetype": "image/jpeg"
          },
          {
            "@category": "high",
            "@height": "886",
            "@width": "1784",
            "@_fa": "true",
            "$": "https://api.elsevier.com/content/object/eid/1-s2.0-S246882312500639X-ga1_lrg.jpg?httpAccept=%2A%2F%2A",
            "@multimediatype": "JPEG image file",
            "@type": "IMAGE-HIGH-RES",
            "@size": "308941",
            "@ref": "ga1",
            "@mimetype": "image/jpeg"
          },
          {
            "@category": "high",
            "@height": "1207",
            "@width": "2390",
            "@_fa": "true",
            "$": "https://api.elsevier.com/content/object/eid/1-s2.0-S246882312500639X-sc1_lrg.jpg?httpAccept=%2A%2F%2A",
            "@multimediatype": "JPEG image file",
            "@type": "IMAGE-HIGH-RES",
            "@size": "128246",
            "@ref": "sc1",
            "@mimetype": "image/jpeg"
          },
          {
            "@category": "high",
            "@height": "890",
            "@width": "3333",
            "@_fa": "true",
            "$": "https://api.elsevier.com/content/object/eid/1-s2.0-S246882312500639X-gr7_lrg.jpg?httpAccept=%2A%2F%2A",
            "@multimediatype": "JPEG image file",
            "@type": "IMAGE-HIGH-RES",
            "@size": "261454",
            "@ref": "gr7",
            "@mimetype": "image/jpeg"
          },
          {
            "@category": "high",
            "@height": "1535",
            "@width": "3000",
            "@_fa": "true",
            "$": "https://api.elsevier.com/content/object/eid/1-s2.0-S246882312500639X-gr8_lrg.jpg?httpAccept=%2A%2F%2A",
            "@multimediatype": "JPEG image file",
            "@type": "IMAGE-HIGH-RES",
            "@size": "303979",
            "@ref": "gr8",
            "@mimetype": "image/jpeg"
          },
          {
            "@category": "standard",
            "@_fa": "true",
            "$": "https://api.elsevier.com/content/object/eid/1-s2.0-S246882312500639X-mmc1.docx?httpAccept=%2A%2F%2A",
            "@multimediatype": "Microsoft Word file",
            "@type": "APPLICATION",
            "@size": "130726131",
            "@ref": "mmc1",
            "@mimetype": "application/word"
          },
          {
            "@category": "thumbnail",
            "@_fa": "true",
            "$": "https://api.elsevier.com/content/object/eid/1-s2.0-S246882312500639X-si1.svg?httpAccept=%2A%2F%2A",
            "@multimediatype": "Scalable Vector Graphics file",
            "@type": "ALTIMG",
            "@size": "22291",
            "@ref": "si1",
            "@mimetype": "image/svg+xml"
          },
          {
            "@category": "thumbnail",
            "@_fa": "true",
            "$": "https://api.elsevier.com/content/object/eid/1-s2.0-S246882312500639X-si2.svg?httpAccept=%2A%2F%2A",
            "@multimediatype": "Scalable Vector Graphics file",
            "@type": "ALTIMG",
            "@size": "23904",
            "@ref": "si2",
            "@mimetype": "image/svg+xml"
          },
          {
            "@category": "thumbnail",
            "@_fa": "true",
            "$": "https://api.elsevier.com/content/object/eid/1-s2.0-S246882312500639X-si3.svg?httpAccept=%2A%2F%2A",
            "@multimediatype": "Scalable Vector Graphics file",
            "@type": "ALTIMG",
            "@size": "22474",
            "@ref": "si3",
            "@mimetype": "image/svg+xml"
          },
          {
            "@category": "thumbnail",
            "@_fa": "true",
            "$": "https://api.elsevier.com/content/object/eid/1-s2.0-S246882312500639X-si4.svg?httpAccept=%2A%2F%2A",
            "@multimediatype": "Scalable Vector Graphics file",
            "@type": "ALTIMG",
            "@size": "26542",
            "@ref": "si4",
            "@mimetype": "image/svg+xml"
          },
          {
            "@category": "thumbnail",
            "@_fa": "true",
            "$": "https://api.elsevier.com/content/object/eid/1-s2.0-S246882312500639X-si5.svg?httpAccept=%2A%2F%2A",
            "@multimediatype": "Scalable Vector Graphics file",
            "@type": "ALTIMG",
            "@size": "26040",
            "@ref": "si5",
            "@mimetype": "image/svg+xml"
          },
          {
            "@category": "thumbnail",
            "@_fa": "true",
            "$": "https://api.elsevier.com/content/object/eid/1-s2.0-S246882312500639X-si6.svg?httpAccept=%2A%2F%2A",
            "@multimediatype": "Scalable Vector Graphics file",
            "@type": "ALTIMG",
            "@size": "8375",
            "@ref": "si6",
            "@mimetype": "image/svg+xml"
          },
          {
            "@category": "thumbnail",
            "@_fa": "true",
            "$": "https://api.elsevier.com/content/object/eid/1-s2.0-S246882312500639X-si7.svg?httpAccept=%2A%2F%2A",
            "@multimediatype": "Scalable Vector Graphics file",
            "@type": "ALTIMG",
            "@size": "9346",
            "@ref": "si7",
            "@mimetype": "image/svg+xml"
          },
          {
            "@category": "thumbnail",
            "@_fa": "true",
            "$": "https://api.elsevier.com/content/object/eid/1-s2.0-S246882312500639X-si8.svg?httpAccept=%2A%2F%2A",
            "@multimediatype": "Scalable Vector Graphics file",
            "@type": "ALTIMG",
            "@size": "10476",
            "@ref": "si8",
            "@mimetype": "image/svg+xml"
          },
          {
            "@category": "thumbnail",
            "@_fa": "true",
            "$": "https://api.elsevier.com/content/object/eid/1-s2.0-S246882312500639X-si9.svg?httpAccept=%2A%2F%2A",
            "@multimediatype": "Scalable Vector Graphics file",
            "@type": "ALTIMG",
            "@size": "16996",
            "@ref": "si9",
            "@mimetype": "image/svg+xml"
          }
        ]
      },
      "link": {
        "@rel": "abstract",
        "@href": "https://api.elsevier.com/content/abstract/scopus_id/105014255126"
      }
    }
  }
}