{
  "metadata": {
    "title": "Immobilization of HPW on UiO-66-NH<ce:inf loc=post>2</ce:inf> MOF as efficient catalyst for synthesis of furfuryl ether and alkyl levulinate as biofuel",
    "authors": "; ",
    "journal": "Molecular Catalysis",
    "date": "2022-10-31",
    "doi": "10.1016/j.mcat.2022.112689",
    "abstract": "",
    "uri": "https://api.elsevier.com/content/article/pii/S2468823122005752",
    "pii": "S2468823122005752"
  },
  "fulltext": {
    "full-text-retrieval-response": {
      "scopus-eid": "2-s2.0-85138171843",
      "originalText": "serial JL 315758 291210 291744 291790 291809 31 Molecular Catalysis MOLECULARCATALYSIS 2022-09-20 2022-09-20 2022-09-20 2022-09-20 2023-04-12T11:58:50 1-s2.0-S2468823122005752 S2468-8231(22)00575-2 S2468823122005752 10.1016/j.mcat.2022.112689 S300 S300.1 FULL-TEXT 1-s2.0-S2468823122X0014X 2023-04-12T12:18:01.928683Z 0 0 20221001 20221031 2022 2022-09-20T17:10:00.880702Z absattachment articleinfo articlenumber articletitlenorm authfirstinitialnorm authfirstsurnamenorm cid cids contenttype copyright crossmark dateloaded dateloadedtxt datesearch datesort dateupdated dco docsubtype doctype doi eid ewtransactionid hubeid indexeddate issn issnnorm itemstage itemtransactionid itemweight openaccess openarchive pg pgfirst pii piinorm pubdateend pubdatestart pubdatetxt pubyr sectiontitle sortorder srctitle srctitlenorm srctype ssids alllist content subj subheadings suppl tomb volfirst volissue volumelist webpdf webpdfpagecount yearnav figure table e-component body mmlmath affil appendices articletitle auth authfirstini authfull authkeywords authlast orcid primabst ref specialabst 2468-8231 24688231 true 531 531 C Volume 531 36 112689 112689 112689 202210 October 2022 2022-10-01 2022-10-31 2022 Regular Papers article fla © 2022 Elsevier B.V. All rights reserved. IMMOBILIZATIONHPWUIO66NH2MOFEFFICIENTCATALYSTFORSYNTHESISFURFURYLETHERALKYLLEVULINATEBIOFUEL MULIK N 1 Introduction 2 Experimental 2.1 Catalyst synthesis 2.1.1 Synthesis of UiO-66-NH2 2.1.2 Post-Synthetic modification of UiO-66-NH2 to UiO-66-NH2-HPW 3 Catalyst characterization 4 Catalytic activity test 5 Result and discussion 5.1 Characterization of prepared catalysts 5.2 Catalyst screening 5.3 Optimization of reaction parameters 5.3.1 Effect of UiO-66-NH2-HPW amount 5.3.2 Effect of temperature 5.3.3 Effect of reaction time 5.3.4 Effect of type of alcohol 5.4 Catalysts reusability 5.5 Catalytic conversion of FFR 5.6 Comparison of present catalytic system with literature 6 Conclusion Appendix Supplementary materials References ZHOU 2014 42092 42113 Y HANIF 2017 165 188 M JALIL 2003 292 297 P JOSE 2019 115607 M KONG 2017 180 185 X TRAVERS 2001 355 361 C WINOTO 2019 588 597 H PESARESI 2009 50 58 L NARASIMHARAO 2007 226 234 K EOM 2014 263 270 H ZENG 2020 1 18 Q HASIK 1994 2099 2106 M INUMARU 2007 7625 7628 K MIZUNO 2010 9972 9976 N LECLERCQ 2012 14352 14358 L DHAKSHINAMOORTHY 2020 454 466 A CIRUJANO 2021 2100101 F FANG 2020 3638 3687 R DHAKSHINAMOORTHY 2019 899 923 A KATZ 2013 9449 9451 M MARSHALL 2016 4310 4331 R SAMANIYAN 2019 10174 10191 M TARABANKO 2015 1778 1782 V LANGE 2010 4479 4483 J DEMOLIS 2014 1338 1352 A ZACCHERIA 2019 9020172 F VERMOORTELE 2011 1521 1523 F KANDIAH 2010 9848 9851 M FANG 2020 146226 X YANG 2017 5590 5599 X CHEN 2015 77 85 Q PENASGARZON 2022 120467 M GAO 2015 6548 6564 X PIN 2014 2182 2190 J GAO 2017 7642 7655 X ANNATELLI 2021 493 505 M NATSIR 2018 2460 2463 T JI 2022 e202200747 Y LI 2022 3808 3816 Y SIVASANKAR 2017 2807 2816 E MULIKX2022X112689 MULIKX2022X112689XN 2024-09-20T00:00:00.000Z 2024-09-20T00:00:00.000Z http://creativecommons.org/licenses/by-nc-nd/4.0/ © 2022 Elsevier B.V. All rights reserved. https://doi.org/10.15223/policy-017 https://doi.org/10.15223/policy-037 https://doi.org/10.15223/policy-012 https://doi.org/10.15223/policy-029 https://doi.org/10.15223/policy-004 item S2468-8231(22)00575-2 S2468823122005752 1-s2.0-S2468823122005752 10.1016/j.mcat.2022.112689 315758 2023-04-12T12:18:01.928683Z 2022-10-01 2022-10-31 1-s2.0-S2468823122005752-main.pdf https://s3-eu-west-1.amazonaws.com/prod-ucs-content-store-eu-west/content/pii:S2468823122005752/MAIN/application/pdf/dd91dc43a852fbebb78633f5e1a7d485/main.pdf main.pdf pdf true 2770344 MAIN 9 1-s2.0-S2468823122005752-main_1.png https://s3-eu-west-1.amazonaws.com/prod-ucs-content-store-eu-west/content/pii:S2468823122005752/PREVIEW/image/png/71e70a2b5ca98797ffeada7225f95cab/main_1.png main_1.png png 60262 849 656 IMAGE-WEB-PDF 1 1-s2.0-S2468823122005752-ga1.jpg https://s3-eu-west-1.amazonaws.com/prod-ucs-content-store-eu-west/content/pii:S2468823122005752/ga1/DOWNSAMPLED/image/jpeg/97aac6809b7cdc6696aeb336e721aabb/ga1.jpg ga1 true ga1.jpg jpg 25281 167 301 IMAGE-DOWNSAMPLED 1-s2.0-S2468823122005752-gr7.jpg https://s3-eu-west-1.amazonaws.com/prod-ucs-content-store-eu-west/content/pii:S2468823122005752/gr7/DOWNSAMPLED/image/jpeg/9a86f99dcee8a10b0e56d5dfbb68933a/gr7.jpg gr7 gr7.jpg jpg 25856 280 339 IMAGE-DOWNSAMPLED 1-s2.0-S2468823122005752-gr8.jpg https://s3-eu-west-1.amazonaws.com/prod-ucs-content-store-eu-west/content/pii:S2468823122005752/gr8/DOWNSAMPLED/image/jpeg/f66e112d95ed77f89c200ddeac2c6d6d/gr8.jpg gr8 gr8.jpg jpg 22431 278 339 IMAGE-DOWNSAMPLED 1-s2.0-S2468823122005752-gr3.jpg https://s3-eu-west-1.amazonaws.com/prod-ucs-content-store-eu-west/content/pii:S2468823122005752/gr3/DOWNSAMPLED/image/jpeg/1df8d98645da35f8013c275a41f681ef/gr3.jpg gr3 gr3.jpg jpg 25615 360 339 IMAGE-DOWNSAMPLED 1-s2.0-S2468823122005752-gr4.jpg https://s3-eu-west-1.amazonaws.com/prod-ucs-content-store-eu-west/content/pii:S2468823122005752/gr4/DOWNSAMPLED/image/jpeg/01dbac493c8aea7dfc9153efc9f5906d/gr4.jpg gr4 gr4.jpg jpg 39024 362 339 IMAGE-DOWNSAMPLED 1-s2.0-S2468823122005752-gr1.jpg https://s3-eu-west-1.amazonaws.com/prod-ucs-content-store-eu-west/content/pii:S2468823122005752/gr1/DOWNSAMPLED/image/jpeg/b21de22fc46934eabcdc54085ce0b00d/gr1.jpg gr1 gr1.jpg jpg 29315 210 565 IMAGE-DOWNSAMPLED 1-s2.0-S2468823122005752-gr10.jpg https://s3-eu-west-1.amazonaws.com/prod-ucs-content-store-eu-west/content/pii:S2468823122005752/gr10/DOWNSAMPLED/image/jpeg/a7fa4abcb58ec379c5b330ffacc40054/gr10.jpg gr10 gr10.jpg jpg 23693 288 339 IMAGE-DOWNSAMPLED 1-s2.0-S2468823122005752-gr9.jpg https://s3-eu-west-1.amazonaws.com/prod-ucs-content-store-eu-west/content/pii:S2468823122005752/gr9/DOWNSAMPLED/image/jpeg/cc70b825d500597763251f4968dcd623/gr9.jpg gr9 gr9.jpg jpg 24341 278 339 IMAGE-DOWNSAMPLED 1-s2.0-S2468823122005752-gr5.jpg https://s3-eu-west-1.amazonaws.com/prod-ucs-content-store-eu-west/content/pii:S2468823122005752/gr5/DOWNSAMPLED/image/jpeg/6c1c2bb187d733710427f923fba6d343/gr5.jpg gr5 gr5.jpg jpg 142202 829 565 IMAGE-DOWNSAMPLED 1-s2.0-S2468823122005752-gr6.jpg https://s3-eu-west-1.amazonaws.com/prod-ucs-content-store-eu-west/content/pii:S2468823122005752/gr6/DOWNSAMPLED/image/jpeg/bbc78ee11b7aa440920569b290793e15/gr6.jpg gr6 gr6.jpg jpg 25653 290 339 IMAGE-DOWNSAMPLED 1-s2.0-S2468823122005752-gr2.jpg https://s3-eu-west-1.amazonaws.com/prod-ucs-content-store-eu-west/content/pii:S2468823122005752/gr2/DOWNSAMPLED/image/jpeg/35550c757cb88f8876a0317fac2d1ce3/gr2.jpg gr2 gr2.jpg jpg 107875 295 565 IMAGE-DOWNSAMPLED 1-s2.0-S2468823122005752-sc1.jpg https://s3-eu-west-1.amazonaws.com/prod-ucs-content-store-eu-west/content/pii:S2468823122005752/sc1/DOWNSAMPLED/image/jpeg/64f3c91d4fe15d1caef168a514eca5e9/sc1.jpg sc1 sc1.jpg jpg 19294 167 527 IMAGE-DOWNSAMPLED 1-s2.0-S2468823122005752-sc2.jpg https://s3-eu-west-1.amazonaws.com/prod-ucs-content-store-eu-west/content/pii:S2468823122005752/sc2/DOWNSAMPLED/image/jpeg/9f680514ca322500524f62bf6c467c07/sc2.jpg sc2 sc2.jpg jpg 13528 102 565 IMAGE-DOWNSAMPLED 1-s2.0-S2468823122005752-sc3.jpg https://s3-eu-west-1.amazonaws.com/prod-ucs-content-store-eu-west/content/pii:S2468823122005752/sc3/DOWNSAMPLED/image/jpeg/a4d1da7d954f36b037595cc0f3e9ede6/sc3.jpg sc3 sc3.jpg jpg 12548 88 565 IMAGE-DOWNSAMPLED 1-s2.0-S2468823122005752-ga1.sml https://s3-eu-west-1.amazonaws.com/prod-ucs-content-store-eu-west/content/pii:S2468823122005752/ga1/THUMBNAIL/image/gif/0dbff3c4bd7cf36914142124f962d8f6/ga1.sml ga1 true ga1.sml sml 20757 121 219 IMAGE-THUMBNAIL 1-s2.0-S2468823122005752-gr7.sml https://s3-eu-west-1.amazonaws.com/prod-ucs-content-store-eu-west/content/pii:S2468823122005752/gr7/THUMBNAIL/image/gif/b43d0731b5695dc9298a10b9bcf4627e/gr7.sml gr7 gr7.sml sml 11056 164 199 IMAGE-THUMBNAIL 1-s2.0-S2468823122005752-gr8.sml https://s3-eu-west-1.amazonaws.com/prod-ucs-content-store-eu-west/content/pii:S2468823122005752/gr8/THUMBNAIL/image/gif/0040195e8332a99d9ccb21783e504b54/gr8.sml gr8 gr8.sml sml 8346 164 200 IMAGE-THUMBNAIL 1-s2.0-S2468823122005752-gr3.sml https://s3-eu-west-1.amazonaws.com/prod-ucs-content-store-eu-west/content/pii:S2468823122005752/gr3/THUMBNAIL/image/gif/bfb777445bb626096bfd2b95086e3ac6/gr3.sml gr3 gr3.sml sml 6727 163 154 IMAGE-THUMBNAIL 1-s2.0-S2468823122005752-gr4.sml https://s3-eu-west-1.amazonaws.com/prod-ucs-content-store-eu-west/content/pii:S2468823122005752/gr4/THUMBNAIL/image/gif/7c065ecdf829760ffa554803ba099d54/gr4.sml gr4 gr4.sml sml 8627 164 153 IMAGE-THUMBNAIL 1-s2.0-S2468823122005752-gr1.sml https://s3-eu-west-1.amazonaws.com/prod-ucs-content-store-eu-west/content/pii:S2468823122005752/gr1/THUMBNAIL/image/gif/11f323cc320c49e2ed3eda141fb021fc/gr1.sml gr1 gr1.sml sml 12461 82 219 IMAGE-THUMBNAIL 1-s2.0-S2468823122005752-gr10.sml https://s3-eu-west-1.amazonaws.com/prod-ucs-content-store-eu-west/content/pii:S2468823122005752/gr10/THUMBNAIL/image/gif/be47d572850bfc1286bf769e0fc4a46b/gr10.sml gr10 gr10.sml sml 8527 164 193 IMAGE-THUMBNAIL 1-s2.0-S2468823122005752-gr9.sml https://s3-eu-west-1.amazonaws.com/prod-ucs-content-store-eu-west/content/pii:S2468823122005752/gr9/THUMBNAIL/image/gif/651daabc21edb772f8db8814291e320a/gr9.sml gr9 gr9.sml sml 7862 164 200 IMAGE-THUMBNAIL 1-s2.0-S2468823122005752-gr5.sml https://s3-eu-west-1.amazonaws.com/prod-ucs-content-store-eu-west/content/pii:S2468823122005752/gr5/THUMBNAIL/image/gif/84fb0a9d3ca6959cfc7c26afcaa39eb5/gr5.sml gr5 gr5.sml sml 10007 163 111 IMAGE-THUMBNAIL 1-s2.0-S2468823122005752-gr6.sml https://s3-eu-west-1.amazonaws.com/prod-ucs-content-store-eu-west/content/pii:S2468823122005752/gr6/THUMBNAIL/image/gif/531595f62e76b8cdc284ce378b82bac3/gr6.sml gr6 gr6.sml sml 8386 164 192 IMAGE-THUMBNAIL 1-s2.0-S2468823122005752-gr2.sml https://s3-eu-west-1.amazonaws.com/prod-ucs-content-store-eu-west/content/pii:S2468823122005752/gr2/THUMBNAIL/image/gif/dc24da87030f734becb72e3fe246cd15/gr2.sml gr2 gr2.sml sml 18703 114 219 IMAGE-THUMBNAIL 1-s2.0-S2468823122005752-sc1.sml https://s3-eu-west-1.amazonaws.com/prod-ucs-content-store-eu-west/content/pii:S2468823122005752/sc1/THUMBNAIL/image/gif/eb25b07e81c0505444a92caca9656faa/sc1.sml sc1 sc1.sml sml 4172 69 219 IMAGE-THUMBNAIL 1-s2.0-S2468823122005752-sc2.sml https://s3-eu-west-1.amazonaws.com/prod-ucs-content-store-eu-west/content/pii:S2468823122005752/sc2/THUMBNAIL/image/gif/d16e44a146a5ee8f442a0fc486a98b5b/sc2.sml sc2 sc2.sml sml 2711 40 219 IMAGE-THUMBNAIL 1-s2.0-S2468823122005752-sc3.sml https://s3-eu-west-1.amazonaws.com/prod-ucs-content-store-eu-west/content/pii:S2468823122005752/sc3/THUMBNAIL/image/gif/5ed9d8cfa5f885118f9e5064f3f9ac61/sc3.sml sc3 sc3.sml sml 2524 34 219 IMAGE-THUMBNAIL 1-s2.0-S2468823122005752-ga1_lrg.jpg https://s3-eu-west-1.amazonaws.com/prod-ucs-content-store-eu-west/content/pii:S2468823122005752/HIGHRES/image/jpeg/c9d397e67f22549391a9785341e5b492/ga1_lrg.jpg ga1 true ga1_lrg.jpg jpg 356362 739 1333 IMAGE-HIGH-RES 1-s2.0-S2468823122005752-gr7_lrg.jpg https://s3-eu-west-1.amazonaws.com/prod-ucs-content-store-eu-west/content/pii:S2468823122005752/HIGHRES/image/jpeg/cdececfac90b9f272f87e968bafd2bcc/gr7_lrg.jpg gr7 gr7_lrg.jpg jpg 163497 1237 1500 IMAGE-HIGH-RES 1-s2.0-S2468823122005752-gr8_lrg.jpg https://s3-eu-west-1.amazonaws.com/prod-ucs-content-store-eu-west/content/pii:S2468823122005752/HIGHRES/image/jpeg/7e2eb6acdeab3f40e38c447bf907571c/gr8_lrg.jpg gr8 gr8_lrg.jpg jpg 132395 1229 1500 IMAGE-HIGH-RES 1-s2.0-S2468823122005752-gr3_lrg.jpg https://s3-eu-west-1.amazonaws.com/prod-ucs-content-store-eu-west/content/pii:S2468823122005752/HIGHRES/image/jpeg/e2e3dd7d3f5dbeb9602ea51f8d97ceab/gr3_lrg.jpg gr3 gr3_lrg.jpg jpg 191983 1591 1500 IMAGE-HIGH-RES 1-s2.0-S2468823122005752-gr4_lrg.jpg https://s3-eu-west-1.amazonaws.com/prod-ucs-content-store-eu-west/content/pii:S2468823122005752/HIGHRES/image/jpeg/210303c58b935de586b02eecd15e2087/gr4_lrg.jpg gr4 gr4_lrg.jpg jpg 281635 1606 1502 IMAGE-HIGH-RES 1-s2.0-S2468823122005752-gr1_lrg.jpg https://s3-eu-west-1.amazonaws.com/prod-ucs-content-store-eu-west/content/pii:S2468823122005752/HIGHRES/image/jpeg/fcd542aae47cfe2f4d3d84d50e0ce671/gr1_lrg.jpg gr1 gr1_lrg.jpg jpg 305088 931 2501 IMAGE-HIGH-RES 1-s2.0-S2468823122005752-gr10_lrg.jpg https://s3-eu-west-1.amazonaws.com/prod-ucs-content-store-eu-west/content/pii:S2468823122005752/HIGHRES/image/jpeg/68e47809fb4492a84b8d1da69851348c/gr10_lrg.jpg gr10 gr10_lrg.jpg jpg 140510 1273 1500 IMAGE-HIGH-RES 1-s2.0-S2468823122005752-gr9_lrg.jpg https://s3-eu-west-1.amazonaws.com/prod-ucs-content-store-eu-west/content/pii:S2468823122005752/HIGHRES/image/jpeg/978b1d3bf5128c0530f847de2cdeb916/gr9_lrg.jpg gr9 gr9_lrg.jpg jpg 136017 1230 1500 IMAGE-HIGH-RES 1-s2.0-S2468823122005752-gr5_lrg.jpg https://s3-eu-west-1.amazonaws.com/prod-ucs-content-store-eu-west/content/pii:S2468823122005752/HIGHRES/image/jpeg/8dca460b1f43d65d77b97008ad5bd85a/gr5_lrg.jpg gr5 gr5_lrg.jpg jpg 1106633 3667 2500 IMAGE-HIGH-RES 1-s2.0-S2468823122005752-gr6_lrg.jpg https://s3-eu-west-1.amazonaws.com/prod-ucs-content-store-eu-west/content/pii:S2468823122005752/HIGHRES/image/jpeg/27b5c0d2af73eb37f9f2fda0fd25ce2b/gr6_lrg.jpg gr6 gr6_lrg.jpg jpg 146635 1283 1500 IMAGE-HIGH-RES 1-s2.0-S2468823122005752-gr2_lrg.jpg https://s3-eu-west-1.amazonaws.com/prod-ucs-content-store-eu-west/content/pii:S2468823122005752/HIGHRES/image/jpeg/1e76723ff421a9c6da616af08ffb6733/gr2_lrg.jpg gr2 gr2_lrg.jpg jpg 1937059 1305 2500 IMAGE-HIGH-RES 1-s2.0-S2468823122005752-sc1_lrg.jpg https://s3-eu-west-1.amazonaws.com/prod-ucs-content-store-eu-west/content/pii:S2468823122005752/HIGHRES/image/jpeg/65bc6c139af506b7ee6c9597528bb3c0/sc1_lrg.jpg sc1 sc1_lrg.jpg jpg 166458 739 2333 IMAGE-HIGH-RES 1-s2.0-S2468823122005752-sc2_lrg.jpg https://s3-eu-west-1.amazonaws.com/prod-ucs-content-store-eu-west/content/pii:S2468823122005752/HIGHRES/image/jpeg/2fb0cf0d3390c2557fc5ee5a6a4c70d0/sc2_lrg.jpg sc2 sc2_lrg.jpg jpg 109369 454 2503 IMAGE-HIGH-RES 1-s2.0-S2468823122005752-sc3_lrg.jpg https://s3-eu-west-1.amazonaws.com/prod-ucs-content-store-eu-west/content/pii:S2468823122005752/HIGHRES/image/jpeg/e13cdf7e7fb5f18b8693715eed4f121a/sc3_lrg.jpg sc3 sc3_lrg.jpg jpg 100955 390 2503 IMAGE-HIGH-RES 1-s2.0-S2468823122005752-mmc1.docx https://s3-eu-west-1.amazonaws.com/prod-ucs-content-store-eu-west/content/pii:S2468823122005752/mmc1/MAIN/application/vnd.openxmlformats-officedocument.wordprocessingml.document/27b71a71bb7d5fca735231ec9232bf6b/mmc1.docx mmc1 mmc1.docx docx 8675789 APPLICATION 1-s2.0-S2468823122005752-si1.svg https://s3-eu-west-1.amazonaws.com/prod-ucs-content-store-eu-west/content/pii:S2468823122005752/image/svg+xml/adb2942a8d4af47c7f653fe33d70f708/si1.svg si1 si1.svg svg 18930 ALTIMG 1-s2.0-S2468823122005752-si2.svg https://s3-eu-west-1.amazonaws.com/prod-ucs-content-store-eu-west/content/pii:S2468823122005752/image/svg+xml/2734f5024fee13412e2fc9ac3c8a4e66/si2.svg si2 si2.svg svg 19570 ALTIMG 1-s2.0-S2468823122005752-si3.svg https://s3-eu-west-1.amazonaws.com/prod-ucs-content-store-eu-west/content/pii:S2468823122005752/image/svg+xml/def8ba90674f9ff7cab22838506a673e/si3.svg si3 si3.svg svg 20129 ALTIMG 1-s2.0-S2468823122005752-si4.svg https://s3-eu-west-1.amazonaws.com/prod-ucs-content-store-eu-west/content/pii:S2468823122005752/image/svg+xml/b9b9bf03a609b31d89092c3685e2dc72/si4.svg si4 si4.svg svg 20960 ALTIMG 1-s2.0-S2468823122005752-am.pdf https://s3-eu-west-1.amazonaws.com/prod-ucs-content-store-eu-west/content/egi:106DZ2XB800/MAIN/application/pdf/e8ac56ba8a41a5534b901ae25e0ab89e/am.pdf am am.pdf pdf false 918128 AAM-PDF MCAT 112689 112689 S2468-8231(22)00575-2 10.1016/j.mcat.2022.112689 Fig. 1 HR-TEM image of (A) UiO-66-NH2 and (B) UiO-66-NH2 HPW. Fig 1 Fig. 2 STEM image and Elemental mapping of UiO-66-NH2 HPW. Fig 2 Fig. 3 Powder XRD of parent UiO-66-NH2 and UiO-66-NH2 HPW. Fig 3 Fig. 4 ATR-FTIR of parent UiO-66-NH2 and UiO-66-NH2 HPW. Fig 4 Fig. 5 (A) XPS survey scan of UiO-66-NH2 and UiO-66-NH2 HPW, and high-resolution XPS data of UiO-66-NH2 and UiO-66-NH2 HPW (B) N 1, (C) O 1 s, (D) Zr 3d, (E) C 1 s. Fig 5 Fig. 6 Effect of UiO-66-NH2 HPW amount. Reaction conditions: FAlc to Ethanol 1:50 mol ratio, Reaction temperature 150 °C, Reaction Time 2 h, stirring speed 300 rpm. Fig 6 Fig. 7 Effect of Temperature on the catalytic activity of UiO-66-NH2 HPW. Reaction conditions: FAlc to Ethanol 1:50 mol ratio, 20 wt.% catalyst wrt FALc, Reaction Time 2 h, stirring speed 300 rpm. Fig 7 Fig. 8 Effect of Time on the catalytic activity of UiO-66-NH2 HPW. Reaction conditions: FAlc to Ethanol 1:50 mol ratio, 20 wt.% catalyst wrt FALc, Reaction temperature 150 °C, stirring speed 300 rpm. Fig 8 Fig. 9 Effect of type of alcohol type on etherification and alcoholysis of FALc over UiO-66-NH2 HPW. Reaction conditions: FAlc to alcohol 1:50 mol ratio, 20 wt.% catalyst wrt FALc, Reaction temperature 150 °C, Reaction time 4 h, stirring speed 300 rpm. Fig 9 Fig. 10 Catalyst recycling for FALc conversion over UiO-66-NH2 HPW in Ethanol. Reaction conditions: FAlc to alcohol 1:50 mol ratio, 20 wt.% catalyst wrt FALc, Reaction temperature 150 °C, Reaction time 4 h, stirring speed 300 rpm. Fig 10 Scheme 1 Schematic illustration of post-synthetic formulation of UiO-66-NH2 HPW from UiO-66-NH2. Scheme 1 Scheme 2 Catalytic conversion of FALc to FE and AL. Scheme 2 Scheme 3 Catalytic conversion of FFR to FALc, FE, AL. Scheme 3 Table 1 Surface properties and Ammonia TPD acidity of UiO-66-NH2 and UiO-66-NH2 HPW. Table 1 Sample S (BET) m2g−1 Vtotal (cm3g−1) D nm Total Acidity mmol g − 1 UiO-66-NH2 907 0.543 3.793 0.301 UiO-66-NH2 HPW 669 0.399 3.385 0.436 Table 2 Activity comparison of parent and modified Catalyst. Table 2 Catalyst name % Conversion %Yield of EFE %Yield of EL % Humins UiO-66-NH2 20 8.7 5.4 0 UiO-66-NH2 HPW 83 34 23 2.5 Reaction conditions: FAlc to Ethanol 1:50 mol ratio, 20 wt.% catalyst wrt FALc, Reaction Time 2 h, stirring speed 300 rpm. Table 3 Comparison of present catalytic system with literature. Table 3 Sr.No. Catalyst(wt.% wrt FALc) Catalyst properties Reaction conditions % Conversion % Yield Ref.No. SA(m2/g) Acidity(mmol/g) Temp. ( °C) Time (h) E.P. MPa EFE EL 1 CrCl3 + H3PO4 (3.5 mol%) NA Np 110 2h – 96 – 38 [36] 2 Purolite CT151(50 wt.%) 12–25 Np 80 a 5 NA 100 – 63 [37] 3 Kaolinite(50 wt.%) np 0.431 180 2 0.8 N2 57 62 b – [38] 4 SAPO-34(35 wt.%) 444 0.399 160 2 0.5 Ar 43 16 4 [39] 5 CNB-H-ZSM-5 Si/Al=75(30 wt.%) 455 0.25 120 6 2 N2 100 6.1 60.5 [40] 6 25TS (TPA/SBA-16) (300 wt.%) 216 2.17 80 3 – 100 – 20 b [41] 7 UiO-66-NH2 HPW(20 wt.%) 669 0.436 150 4 – 97 31 29 This work SA=BET Surface area, E.P.=External pressure, NA=Not applicable, np=not provided a Reaction under reflux condition b Selectivity (%),. Immobilization of HPW on UiO-66-NH2 MOF as efficient catalyst for synthesis of furfuryl ether and alkyl levulinate as biofuel Nagesh Mulik a b Vijay Bokade a b ⁎ a Catalysis and Inorganic Chemistry Division, CSIR-National Chemical Laboratory, Dr. Homi Bhabha Road, Pashan, Pune 411008, India Catalysis and Inorganic Chemistry Division CSIR-National Chemical Laboratory Dr. Homi Bhabha Road, Pashan Pune 411008 India aCatalysis and Inorganic Chemistry Division, CSIR-National Chemical Laboratory, Dr. Homi Bhabha Road, Pashan, Pune 411008, India b Academy of Scientific and Innovative Research (AcSIR), Ghaziabad 201002, India Academy of Scientific and Innovative Research (AcSIR) Ghaziabad 201002 India bAcademy of Scientific and Innovative Research (AcSIR), Ghaziabad 201002, India ⁎ Corresponding author at: Catalysis Division, CSIR-National Chemical Laboratory, Pune 411008, India. Catalysis Division CSIR-National Chemical Laboratory Pune 411008 India Phosphotungustic Acid (HPW) is an inorganic super acid, that is highly soluble in polar solvents limiting its applicability as acid catalysis. To overcome these limitations immobilization of HPW was carried out at room temperature by protonation of -NH2 group of UiO-66-NH2 MOF to UiO-66-NH2 HPW. ATR-FTIR spectroscopy and XPS results confirmed the protonation and chemical interaction between HPW and UiO-66-NH2. STEM-EDS mapping showed homogeneous distribution of HPW on UiO-66-NH2. BET and NH3-TPD confirmed the reduction in specific surface area, total pore volume, and increase in total acidity for UiO-66-NH2 HPW. Further, powder XRD, SEM, and HR-TEM prevailed that there is no change in phase and morphology after post-synthetic modification of UiO-66-NH2. The prepared catalyst is found to be effective for etherification and alcoholysis of furfuryl alcohol (FALc) to Furfuryl ether (FE) and Alkyl levulinate (AL). UiO-66-NH2 HPW has shown 97 mol% FALc conversions in ethanolic media and 31 mol% Ethyl furfuryl ether (EFE) yield and 29 mol% Ethyl levulinate (EL) yield. UiO-66-NH2 HPW is also found to be efficient for the multistep conversion of Furfural (FFR) to FALc, FE, and AL. Graphical abstract Image, graphical abstract Keywords Immobilization Phosphotungstic acid UiO-66-NH2-HPW Etherification Alcoholysis Data Availability Data will be made available on request. 1 Introduction Heteropolyacids (HPAs) are an interesting class of well-defined strong solid Brønsted acids, exhibiting excellent catalytic behavior in a wide variety of acid-catalyzed reactions such as esterification, transesterification, hydrolysis, alkylation, acylation as well as a redox reaction [1,2]. However, HPAs are usually soluble in many polar solvents, causing difficulties in the recovery, separation, and recycling of the catalysts, which affects their eco-friendly applications. Thus, it will be beneficial to develop a reusable HPA-based catalyst. Nonetheless, heterogeneous HPA-based catalysts usually have some disadvantages, such as low surface area, leaching of the active sites, and low activity [1–5]. To overcome the above limitations, many approaches such as immobilization and solidification have been proposed to improve the stability and catalytic performance. HPAs can be immobilized using various supports such as mesoporous silica, metal-organic frameworks, mesoporous transition metal oxides, zeolites, and mesoporous carbon, [1,2,5–7]. It is well known that HPAs have strong acidity and even it reacts with weak bases and form bonding with them. HPAs will get heterogeneity by interacting with bases such as alkali metals and organic amines [2,4,5,8–12]. Materials such as organically modified silica with amine functionality, organic polymers containing an amino-functional group, organic amines, ionic liquids, and organic surfactants containing amino groups were often used as a carrier for anchoring of HPA employing strong bonding [11–15]. For acid-base dispersion and anchoring of HPAs on Metal-Organic frameworks (MOF) containing amine functionality may be the best option because MOFs have high porosity and high surface area which will provide more active sites for host-guest interaction. MOFs are a class of crystalline, well-ordered inorganic-organic porous hybrid material with tunable textural and diverse framework functionalities. MOFs can be used as a multifunctional catalyst in tandem reactions and their catalytic properties can be enhanced by engineering metal nodes as active sites, the post-synthetic introduction of active sites, and engineering of active sites in pores cavities [16–19]. Zirconium-based MOFs such as UiO-66 and its amine derivative UiO-66-NH2 are highly porous with high surface area, hydrothermally and chemically more stable in a wide range of pH in aqueous solutions. This makes UiO-66 extremely useful as a catalyst and an ideal platform to introduce active sites [19–21]. Biomass conversion involves hydrolysis, dehydration, alcoholysis, esterification, and etherification over Lewis as well as Brønsted acid sites. Brønsted acidity in MOFs is introduced by using acid functionalized ligands, by encapsulation of HPAs during solvothermal synthesis, and by impregnation of HPAs on MOFs. Encapsulation of HPAs in MOF may lead to pores blockage, extensive drop-down in total surface area, slow diffusion, and less contact of reactants with active sites, while impregnation of HPAs on MOFs may lead to low homogeneity in dispersion, occupation of the large cavities and leaching during the reaction [17,22]. Thus, the objective of this work is to overcome the above-mentioned problems by firm anchoring/binding of HPAs on UiO-66-NH2, by reacting it with the basic sites (-NH2). In this work, we have demonstrated post-synthetic modification of UiO-66-NH2 by binding with phosphotungstic acid (HPW). The prepared UiO-66-NH2 HPW catalyst was characterized by XRD, ATR-FTIR, XPS, STEM-EDS, SEM, HR-TEM, N2 adsorption-desorption analysis, and ammonia-temperature programmed desorption (NH3-TPD). Preparation of furfuryl ethers (FE) such as Ethyl furfuryl ether (FEF), Methyl furfuryl ether (MFE), Isopropyl furfuryl ether (IPFE), and alkyl levulinates (AL) such as Ethyl levulinate (EL), Methyl levulinate (ML), and Isopropyl levulinate (IPL) attracts much attention in recent years, due to their applicability as a fuel and fuel additive along with other applications [23–27]. Hence, we carried out the catalytic evaluation of prepared UiO-66-NH2 HPW for hydrogenation and alcoholysis of Furfural (FFR) and Furfuryl alcohol (FALc) to FE and AL. 2 Experimental 2.1 Catalyst synthesis 2.1.1 Synthesis of UiO-66-NH2 UiO-66-NH2 was synthesized by hydrothermal method, with a little modification based on the previous study [28], 13.5 mmol ZrCl4 (Acros), 13.5 mmol 2-aminoterephthalic acid (Alfa Aesar), and 13.5 mmol H2O were dissolved in 5.6 mol NN-dimethylformamide (Thomas baker) at room temperature. Crystallization was carried out in a 1 L stainless steel Teflon-lined reactor under static conditions in a preheated oven at 120 °C for 18 h. Then the reactor was removed from the oven and naturally cool down to RT, the resulting solid was centrifuged and repeatedly washed with DMF and with methanol to remove the unreacted ligand and then kept at 80 °C for 2 h in the oven to get dry powder. 2.1.2 Post-Synthetic modification of UiO-66-NH2 to UiO-66-NH2-HPW The post-synthetic modification was done by dissolving 2.3 mmol of HPW in 60 mL of acetonitrile, and 1.14 mmol of freshly prepared powder of UiO-66-NH2 were added to HPW solution and kept under vigorous stirring for 30 min. The final solid was separated by centrifugation and washed several times with acetonitrile to remove unreacted HPW and dried in the oven at 80 °C for 2 h to get UiO-66-NH2 HPW. 3 Catalyst characterization Wide-angle X-ray diffraction (XRD) patterns were obtained on a Regaku Miniflex X-ray diffractometer with a Cu Kα radiation source operated at 40 kV and 30 mA over a 2θ range from 5° to 50° at a scanning rate of 3°/min. Functional groups of the prepared materials were characterized by Fourier Transform Infrared Spectroscopy (FTIR), which was performed on a Bruker Alpha-P ATR FTIR spectrometer. The surface area of the samples was determined from nitrogen adsorption−desorption isotherms in liquid nitrogen on Quantachrome Autosorb iQ equipment, using the Brunauer−Emmett−Teller (BET) method, and all samples were degassed to 0.1 Pa at 200 °C for 3 h before measurement. Field Emission Scanning Electron Microscopy (FE-SEM) images have been captured on a NOVA NANOSEM 450 instrument while High-Resolution Transmission Electron Microscopy (HRTEM) images, STEM images, and Elemental mapping were done on JEOL JEM-F200 (URP) instrument. X-ray Photoelectron Spectroscopy (XPS) was carried out using the K-Alpha+ model Thermo Fisher Scientific an XPS instrument with an Al Kα source. XPS data of all the compounds were fitted with the Shirley-type background subtraction method using Fitiyk software. Temperature-Programmed Desorption (TPD) profiles of NH3 from the synthesized catalysts were measured using a Micrometric AutoChem 2950 HP instrument. The sample cell loaded with 0.050 g of sample was initially treated under a helium flow of 40 mL min−1 at 200 °C for 2 h, then cooled to 100 °C, and subsequently exposed to pulses of ammonia (10% in helium) until saturation and then purged with a helium flow at 100 °C for 1 h. Afterward, the sample cell was heated up to 600 °C with a ramp of 10 °C min−1. The concentration of the desorbed ammonia was monitored continuously with a TCD detector. 4 Catalytic activity test All reactions were performed in a 100 mL high-pressure Parr reactor (4871 series controller) equipped with external temperature and stirring controllers. In a typical reaction 7.2 mmol of FFR or FAlc, 360 mmol of alcohol, and 20 wt% catalyst were loaded based on FFR or FALc concentration. Then the reactor was sealed and placed in a heating unit with stirring at 300 rpm., After completion of the reaction, the reactor was cooled in a cooling water bath to room temperature. The spent catalyst was separated by centrifugation. After washing and drying, the spent catalyst was used for the next run to evaluate its stability and reusability. The liquid products were qualitatively determined using gas chromatography−mass spectrometry (GC−MS-QP2020 NX, Shimadzu) fitted with a TR-5 MS column (30 m × 250 μm × 0.25 μm). The quantitative analysis of liquid products was conducted on a Varian CP-3800 series with an RTX-5 capillary column (60 m × 320 μm × 0.25 μm) equipped with a flame ionization detector (FID). Both GC−MS and GC analysis employed the following temperature program: the initial temperature was 50 °C, followed by heating at a rate of 20 °C/min to 220 °C. The amounts of product samples were quantitatively analyzed based on the external standard curves with commercial samples. The yields of products were calculated as the ratio of the moles of products obtained to the moles of the substrate in the feed. The yield of IPFE, EFE, and MFE was calculated using calibration data of FALc it is commercially unavailable and was confirmed by GC−MS. The yield of products and conversion were determined according to the following equations: % C o n v e r s i o n = R e a c t a n t i n i t i a l m o l e s − R e a c t a n t f i n a l m o l e s R e a c t a n t i n i t i a l m o l e s * 100 % Y i e l d = m o l e s o f p r o d u c t R e a c t a n t i n i t i a l m o l e s * 100 W e i g h t o f h u m i n = R e s i d u e c o l l e c t e d ( d r i e d ) − W e i g h t o f C a t a l y s t % H u m i n = W e i g h t o f h u m i n I n i t i a l w e i g h t o f R e a c t a n t * 100 5 Result and discussion 5.1 Characterization of prepared catalysts The surface morphology of the sample was detected by HR-TEM and is presented in Fig. 1 A, B, and the SEM images are given in the supporting (Fig. S1. A, B). The forms of UiO-66-NH2 and UiO-66-NH2 HPW were regular octahedrons in shape. Powder XRD patterns of the samples before and after modification are shown in Fig. 3. It is demonstrated the well-comparable synthesis of UiO-66- NH2 as that of the previous studies [28–30]. Moreover, the morphology and XRD pattern remains the same after post-synthetic modification. Fig. 2 . STEM and EDS mapping images indicate that well dispersion and distribution of HPW throughout the UiO-66-NH2 crystal, while the parent sample (UiO-66-NH2) only shows framework elements- Zr, O, C, and N in EDS mapping (Fig. S2. In supplementary). Fig. 4 . Shows the ATR-FTIR spectra of UiO-66-NH2 and UiO-66-NH2 HPW samples. The ligand of UiO-66-NH2 was an amine-functionalized terephthalic acid (2-amino terephthalic acid), with the uncoordinated free –NH2 strong band of aromatic primary amine NH stretching appeared at 1655 cm−1 in the spectra of UiO-66-NH2 [31]. The spectral band at 1568 cm−1 was caused by the skeletal vibration of the benzene ring. Moreover, a component located at 1400 cm−1 corresponds to the OCO symmetric stretching, and 1257 cm−1 is assigned to the C − N stretching vibrational spectrum [28–31]. After the modification of UiO-66-NH2 with HPW to UiO-66-NH2 HPW, only a reduction in the characteristic NH stretching band of primary amine at 1655 cm−1 (shown in the inset of Fig. 4.) is observed. Hence it indicates that there is a strong chemical interaction between the -NH2 group and HPW. To confirm the chemical state of each element, XPS analysis was done and the spectra are illustrated in Fig. 5 . Fig. 5A. is the XPS survey scan of UiO-66-NH2 and UiO-66-NH2 HPW which represents the elements Zr 3d, O 1 s, C 1 s, N 1 s, and Zr 3d, O 1 s, C 1 s, N 1 s, W 4f, P 1 s respectively. Table S1. shows the elemental composition of UiO-66-NH2 and UiO-66-NH2 HPW by XPS and EDS analysis. The N 1 s XPS spectra (Fig. 5B) of both the samples UiO-66-NH2 and UiO-66-NH2 HPW indicate that three distinct peaks; peak at 398.8 eV are assigned to CN, peak at 399.3 eV is assigned to -NH2 and the other peak at 400.5 eV is due to the interaction between the amino group and proton [11,12,30,32]. Hence it can be seen that area under the peak at 400.5 eV which is assigned to -NH3 + is exponentially increased after post-synthetic modification of UiO-66-NH2 with HPW to UiO-66-NH2 HPW. Thus, there may be strong ionic bonding between -NH3 + and phosphotungstic ion (HPW−) [11,12]. Fig. 5C. represents the O 1 s XPS spectra of samples UiO-66-NH2 and UiO-66-NH2 HPW. Post synthetically modified sample clearly shows a total of five peaks, three peaks for Zr-O, CO, and C = O at the binding energy level of 590.9 eV, 531.4 eV, 531.8 eV, and two peaks for W-O-W, P-O-W at the energy level of 330.6 eV and 333.2 eV respectively, while UiO-66-NH2 shows only three peaks corresponds to Zr-O, CO, C = O at the binding energy level of 590.9 eV, 531.4 eV, 531.8 eV. [3,33] As shown in Fig. 5D, the Zr 3d spectrum can be divided into four peaks [30]. The peaks at 182.3 eV and 184.8 eV are attributed to Zr-O bonds, and the peaks at 182.8 eV and 185.6 eV are attributed to Zr-Zr bonds. As shown in Fig. 5E, the C 1 s spectrum can be divided into four peaks; C = C, CN, CC, and C = O correspond to 284.3 eV, 285.2 eV, 285.9 eV, and 288.5 eV, respectively [30,31]. Fig. S3. shows high-resolution XP spectra of W 4f and P 2p of the sample UiO-66-NH2 HPW, the W 4f XP spectra show the two distinctive peaks at the energy level of 35.8 eV and 37.9 eV while P 2p XP spectra show a single peak at 134 eV [3]. According to the literature and our XPS and ATR-FTIR analysis, there is a specific interaction between the basic -NH2 group and Brønsted acidic HPW, as illustrated in Scheme 1 . The nitrogen adsorption-desorption isotherm of UiO-66-NH2 and UiO-66-NH2 HPW is provided in supporting information as Fig. S4., and as listed in Table 1 . the specific surface area of UiO-66-NH2 and post synthetically modified UiO-66-NH2 HPW were 907 m2g−1 and 669 m2g−1 respectively. The total pore volume and pore diameter of UiO-66-NH2 was 0.543 cm3g−1 and 3.793 nm which is reduced to 0.399 cm3g−1 and 3.385 nm after post-synthetic modification of UiO-66-NH2 to UiO-66-NH2 HPW. The decrease in specific surface area, total pore volume, and pore diameter indicated anchoring of HPW to the framework -NH2 group. NH3-TPD curves of UiO-66-NH2 and UiO-66-NH2 HPW are shown in Fig. S5 (in supporting information) and acid values are given in Table 1. Two desorption peaks were observed in the ranges of 185–430 °C and 446–600 °C, which are attributed to weak acid sites and strong acid sites, respectively. It can be seen that the intensity of the strong acid site is more in post synthetically modified UiO-66-NH2 HPW than in parent UiO-66-NH2, and the total acidity of UiO-66-NH2 HPW is more (0.436 mmol g − 1) than parent UiO-66-NH2 (0.301 mmol g − 1). 5.2 Catalyst screening Scheme 2 reveals, catalytic etherification and alcoholysis of FALc to EFE and EL. EFE and EL formation were confirmed by GC–MS along with these products small fraction of byproducts such as 2,2-methylene difuran, 2-Pentanone-5–5-diethoxy levulinaldehyde, 2,5-(2-Furylmethyl), Ethyl 5-(5-methyl-2-furyl)−2,4-pentadienoate is also identified by GC–MS (Fig. S6.). Table 2 , shows the initial catalytic screening of etherification and alcoholysis of FALc to EFE and EL over 20 wt.% catalyst loading wrt FALc weight, at 150 °C, for 2 h. UiO-66-NH2 has shown only 20% catalytic conversion of FALc with 8.7% EFE and 5.4% EL yield, while UiO-66-NH2 HPW showed high catalytic activity to 83% FALc conversion with 34% and 23% yield of EFE and EL, respectively. Such drastic catalytic activity enhancement is due to the anchoring of highly acidic HPW and more acidity of UiO-66-NH2 HPW (0.436 mmol g − 1) than the parent UiO-66-NH2 (0.301 mmol g − 1). To investigate whether the catalytic system is heterogeneously or homogeneously catalyzed, a leaching test was performed in which the UiO-66-NH2 HPW sample was heated at 150 °C for 2 h in ethanol after 2 h, the system was cooled to room temperature and the catalyst was removed by centrifugation and then FALc added and the reaction was continued for 2 h at 150 °C. After 2 h of reaction, it has shown 10% conversion without yielding the desired product it confirming that reaction is purely heterogeneous. 5.3 Optimization of reaction parameters In addition to the physical properties of UiO-66-NH2 HPW, the etherification and alcoholysis conversion of FALc to EFE and EL equally depends on various reaction parameters. 5.3.1 Effect of UiO-66-NH2-HPW amount Fig. 6 . shows, the effect of catalyst loading wrt to FALc on the etherification and alcoholysis of FALc to EFE and EL. An increasing catalytic amount from 10 wt.% to 40 wt.% of initial FALc reflects the considerable increase in the conversion of FALc. However, unwanted products such as humin were also observed to be increased. Thus, 20 wt.% catalyst amount was considered optimum loading with low humin (2.5%), 83% FALc conversion, 34% EFE yield, and 24% EL yield. 5.3.2 Effect of temperature Fig. 7 . displays the effect of temperature on etherification and alcoholysis of FALc to EFE and EL over UiO-66-NH2 HPW. It can be seen that reaction temperature showed an exponential influence on the conversion of FALc and yield of EFE and EL. With an increase in temperature from 110 °C to 170 °C, there is a positive impact on FAlc conversion from 61% to 98% with a yield of EFE from 22% to 34% and EL from 7% to 30%. At lower temperatures of 110 °C and 130 °C, there is a significant formation of EFE within the reaction time of 2 h. Lower formation of EL suggests that at lower temperature further transformation of EFE to EL is limited. However, above 130 °C, a constant increment in EL yield was observed. It is worth noticing that when the temperature increases to 170 °C favor the formation of EL but simultaneously there is an increase in unwanted humins (5.7%) also. Thus, 150 °C temperature is optimum with 20 wt.% catalyst loading. 5.3.3 Effect of reaction time Fig. 8 . depicts the effect of reaction time on etherification and alcoholysis of FALc to EFE and EL over UiO-66-NH2 HPW. It can be seen that at FAlc conversion increased from 83% (2 h) to 97% (4 h). After 4 h, FAlc conversion is almost constant at 98%. At the initial stage of reaction, there is a substantial formation of EFE than EL. After 4 h, equilibrium formation of EFE (31%) and EL (33%) with humins formation of 3%. 5.3.4 Effect of type of alcohol Alcohols such as methanol, ethanol, and Isopropyl alcohol (IPA) were evaluated under optimum reaction conditions for FALc conversion to FE and AL, Products were identified by GC–MS (Fig. S4) and results are shown in Fig. 9 . As expected, ethanol and IPA are good solvents for this type of reaction and have shown higher etherification and alcoholysis activity than methanol. With ethanol, there is 97% FALc conversion with 31% and 29% EFE and EL yield, respectively. Whereas, IPA has shown 80% FAlc conversion with 38 and 17% IPFE and IPL yield respectively with low (2%) humins formation. In the case of methanol only 19% ML formation with high humins of 14% at 76% of FALc conversion, indicates methanol is not a good solvent for this reaction. 5.4 Catalysts reusability The major benefit of heterogeneous catalysis is its reusability. The reusability test was conducted by reacting FALc with Ethanol at 150 °C for 4 h (Fig. 10 ). After completion of the reaction, the catalyst was removed from the reaction mixture by centrifugation and washed with methanol, dried at 80 °C for 2 h, and then reused for the next cycle. As revealed in Fig. 10, the use of UiO-66-NH2 HPW is still capable of converting FALc to EFE and EL even after 2nd recycling. Though there is a decrease in FALc conversion (85% to 71%) and yield of EFE (28% to 23%), and EL (26% to 17%). The decrease in catalytic activity is due to the deactivation of active sites by the deposition of insoluble humins which is confirmed by the ATR-FTIR analysis of the used catalyst (Fig. S8.). The comparative ATR-FTIR spectra of the fresh and used catalyst given in the supplementary file (Fig. S8.) clearly show that there are emerging new IR bands at 1708 cm−1, 1625 cm−1, 1436 cm−1, 1079 cm−1, and 1018 cm−1 along with little suppression in IR transmittance as compared to fresh sample. The new IR band that emerged at 1708 cm−1 corresponds to stretching vibrations of C = O which is conjugated with C = C, while the band at 1625 cm−1 corresponds to C = C stretching conjugated with C = O and these are the characteristic bands for humins [34,35]. The band at 1436 can be assigned to CH2 deformation vibration in aliphatic chains while the band at 1018 cm−1 in humins corresponds to C = C stretching, in the olefinic group and the Strong band at 1076 cm−1 corresponds to C–O stretching [34,35]. ATR-FTIR study confirmed a deposition of humins on the catalyst's active surface, which is the main reason for catalyst deactivation. While powder XRD of the fresh and used samples (Fig. S7. provided in supporting file) shows no distinct crystallographic changes in UiO-66-NH2 HPW after the reaction. However, the used catalyst becomes brown (Image in the inset of Fig. S7.) due to the deposition of humins. 5.5 Catalytic conversion of FFR UiO-66-NH2 HPW catalyst was further evaluated for direct conversion of FFR to FALc, EFE, and EL in one step. FFR has been considered one of the most promising platform molecules directly derived from biomass. The hydrogenation of FFR is one of the most versatile reactions to upgrade furanic components to FALc, FE, and AL (Scheme 3 ) via catalytic transfer hydrogenation, etherification, and alcoholysis, in one step. UiO-66-NH2 HPW was further evaluated for this one-step reaction using different alcohols such as methanol, ethanol, and IPA. These solvents were also used as a hydrogen donor for hydrogenation of FFR to FAlc along with its consumption for etherification to FE and further to AL. Formed products were identified by GC–MS (Fig. S6.) and data is given in supporting files as Fig. S9. Despite 95% FFR conversion in methanol media it shows only 23% MFE formation while in the case of ethanol 87% FFR conversion with 39% FAlc, 11% EFE and 7% EL formation was observed. IPA as a well-known hydrogen donor for the catalytic transfer hydrogenation type of reaction has shown 25% FALc, 33% IPFE, and 13% IPL with 98% conversion of FFR. This confirmed that, amongst those studied, IPA is the best hydrogen donor and solvent system for this reaction. 5.6 Comparison of present catalytic system with literature The catalytic activity of present works has been compared with reported literature and summarized in Table 3 . Gao et al. directly used inorganic Brønsted acidic H3PO4 with lewis acidic CrCl3 for conversion of FALc with ethanolic media gave 38% EL at 96% conversion [36]. Annatelli et al., used highly acidic commercial sulfated resin Purolite CT151, with 50 wt.% catalyst loading at reflux conditions to get 63% EL yield [37]. Natsir et al. evaluated commercial kaolinite at a high temperature of 180 °C with external N2 pressure (0.8 MPa) and 50 wt.% catalyst loading to achieve 57% FALc conversion and 62% EFE selectivity [38]. Zuo et al. used conventional zeolite Silico-Alumino-Phosphate-34 (SAPO-34) with 35 wt.% loading and with 0.5 MPa external argon pressure to convert 43% FALc with 16% EFE and 4% EL yield [39]. Li et al. developed an H-ZSM-5 catalyst with Nano b-axis channels (CNB-H-ZSM-5) with Si/Al=75, 30 wt.% catalyst amount in reaction, with 2 MPa N2 pressure, and a longer reaction time (6 h), achieved 100% FALc conversion at a low EFE yield of 6.1% and EL yield of 60.5% [40]. Siva et al. used TPA (tungstophosphoric acid) impregnated on mesoporous silica SBA-16, sample 25TS (25% TPA impregnated on SBA-16) with high acidity (2.17 mmol/g) and higher loading in reaction (3.05 substrate to catalyst ratio) converted 100% FALc with 20% EL selectivity [41]. In the present work, the catalyst (UiO-66-NH2 HPW) with moderate acidity (0.436 mmol g − 1), low catalyst loading with respect to the substrate (20 wt.%), and without any external pressure converted 97% FALc and achieved 31% EFE and 29% EL yield, the present catalyst was also able to convert FFR by catalytic transfer hydrogenation to FALc, FE, and AL, in one step. In short, the present catalyst UiO-66-NH2 HPW has high SA, moderate acidity and well dispersed HPW active sites on the porous framework of UiO-66-NH2 is collectively responsible for high catalytic activity at a low catalyst amount in reaction. 6 Conclusion In this study, UiO-66-NH2 MOF was successfully modified at a molecular level by a post-synthetic modification approach and immobilized a superacid HPW by acid-basic interaction of -NH2 group of UiO-66-NH2 and HPW to obtain UiO-66-NH2 HPW as a catalyst. The prepared catalyst has a BET surface area of 669 m2g−1 with a total pore volume and pore diameter of 399 cm3g−1 and 3.385 nm, respectively. SEM, HR-TEM, and powder XRD were performed to analyze the morphology and phase of UiO-66-NH2 HPW, and confirm the intactness of octahedral morphology and identical phase of UiO-66-NH2 after post-synthetic modification. ATR-FTIR spectroscopy and XPS results confirmed the protonation and interaction between HPW and the -NH2 group of UiO-66-NH2 and EDS mapping confirms the good distribution of HPW in the UiO-66-NH2 crystal. NH3-TPD results showed that there is a high increment in strong acid sites with an increase in total acidity in a post synthetical modified sample UiO-66-NH2 HPW (0.436 mmol g − 1) than the parent UiO-66-NH2 (0.301 mmol g − 1). Well-characterized catalysts were evaluated for catalytic etherification and alcoholysis of FALc and found to be better than the parent one. UiO-66-NH2 HPW catalyst has shown 97 mol% FALc conversions, 31 mol% EFE yield, and 29 mol% EL yield. This catalyst could also be reused after reaction by simple washing and drying for multiple reuses. Further, this acidic catalyst was also evaluated for direct conversion of FFR to FALc, FE, and AL, in one step. Declaration of Competing Interest The authors declare no conflict of interest. Supplementary materials Supplementary material associated with this article can be found, in the online version, at doi:10.1016/j.mcat.2022.112689. Appendix Supplementary materials Image, application 1 References [1] Y. Zhou G. Chen Z. Long J. Wang Recent advances in polyoxometalate-based heterogeneous catalytic materials for liquid-phase organic transformations RSC Adv. 4 2014 42092 42113 10.1039/c4ra05175k Y. Zhou, G. Chen, Z. Long, J. Wang, Recent advances in polyoxometalate-based heterogeneous catalytic materials for liquid-phase organic transformations, RSC Adv.. 4 (2014) 42092–42113. https://doi.org/10.1039/c4ra05175k. [2] M.A. Hanif S. Nisar U. Rashid Supported solid and heteropoly acid catalysts for production of biodiesel Catal. Rev. Sci. Eng. 59 2017 165 188 10.1080/01614940.2017.1321452 M.A. Hanif, S. Nisar, U. Rashid, Supported solid and heteropoly acid catalysts for production of biodiesel, Catal. Rev. Sci. Eng.. 59 (2017) 165–188. https://doi.org/10.1080/01614940.2017.1321452. [3] P.A. Jalil M. Faiz N. Tabet N.M. Hamdan Z. Hussain A study of the stability of tungstophosphoric acid, H3PW 12O40, using synchrotron XPS, XANES, hexane cracking, XRD, and IR spectroscopy J. Catal. 217 2003 292 297 10.1016/S0021-9517(03)00066-6 P.A. Jalil, M. Faiz, N. Tabet, N.M. Hamdan, Z. Hussain, A study of the stability of tungstophosphoric acid, H3PW 12O40, using synchrotron XPS, XANES, hexane cracking, XRD, and IR spectroscopy, J. Catal.. 217 (2003) 292–297. https://doi.org/10.1016/S0021-9517(03)00066-6. [4] M. José D. Silva A. Aparecida S. Olavo R. Chagas D. Silva D. Morais Tin (II) phosphotungstate heteropoly salt: an efficient solid catalyst to synthesize bioadditives ethers from glycerol Fuel 254 2019 115607 10.1016/j.fuel.2019.06.015 M. José, D. Silva, A. Aparecida, S. Olavo, R. Chagas, D. Silva, D. Morais, Tin (II) phosphotungstate heteropoly salt: an efficient solid catalyst to synthesize bioadditives ethers from glycerol, Fuel. 254 (2019) 115607. https://doi.org/10.1016/j.fuel.2019.06.015. [5] X. Kong S. Wu L. Liu S. Li J. Liu Continuous synthesis of ethyl levulinate over Cerium exchanged phosphotungstic acid anchored on commercially silica gel pellets catalyst Mol. Catal. 439 2017 180 185 10.1016/j.mcat.2017.07.005 X. Kong, S. Wu, L. Liu, S. Li, J. Liu, Continuous synthesis of ethyl levulinate over Cerium exchanged phosphotungstic acid anchored on commercially silica gel pellets catalyst, Mol. Catal. 439 (2017) 180–185. https://doi.org/10.1016/j.mcat.2017.07.005. [6] C. Travers N. Essayem M. Delage S. Quelen Heteropolyanions based catalysts for paraffins isomerization Catal. Today 65 2001 355 361 10.1016/S0920-5861(00)00590-3 C. Travers, N. Essayem, M. Delage, S. Quelen, Heteropolyanions based catalysts for paraffins isomerization, Catal. Today. 65 (2001) 355–361. https://doi.org/10.1016/S0920-5861(00)00590-3. [7] H.P. Winoto Z.A. Fikri J.-.M. Ha Y.-.K. Park H. Lee D.J. Suh J. Jae Heteropolyacid supported on Zr-Beta zeolite as an active catalyst for one-pot transformation of furfural to γ-valerolactone Appl. Catal. B 241 2019 588 597 10.1016/j.apcatb.2018.09.031 H.P. Winoto, Z.A. Fikri, J.-.M. Ha, Y.-.K. Park, H. Lee, D.J. Suh, J. Jae, Heteropolyacid supported on Zr-Beta zeolite as an active catalyst for one-pot transformation of furfural to γ-valerolactone, Appl. Catal. B. 241 (2019) 588–597. https://doi.org/10.1016/j.apcatb.2018.09.031. [8] L. Pesaresi D.R. Brown A.F. Lee J.M. Montero H. Williams K. Wilson Cs-doped H4SiW12O40 catalysts for biodiesel applications Appl. Catal. A Gen. 360 2009 50 58 10.1016/j.apcata.2009.03.003 L. Pesaresi, D.R. Brown, A.F. Lee, J.M. Montero, H. Williams, K. Wilson, Cs-doped H4SiW12O40 catalysts for biodiesel applications, Appl. Catal. A Gen. 360 (2009) 50–58. https://doi.org/10.1016/j.apcata.2009.03.003. [9] K. Narasimharao D.R. Brown A.F. Lee A.D. Newman P.F. Siril S.J. Tavener K. Wilson Structure – activity relations in Cs-doped heteropolyacid catalysts for biodiesel production J. Catal. 248 2007 226 234 10.1016/j.jcat.2007.02.016 K. Narasimharao, D.R. Brown, A.F. Lee, A.D. Newman, P.F. Siril, S.J. Tavener, K. Wilson, Structure – activity relations in Cs-doped heteropolyacid catalysts for biodiesel production, J. Catal.. 248 (2007) 226–234. https://doi.org/10.1016/j.jcat.2007.02.016. [10] H. Eom D. Lee S. Kim S. Chung Y. Gul K. Lee Hydrocracking of extra-heavy oil using Cs-exchanged phosphotungstic acid (Cs x H 3 À x PW 12 O 40, x = 1 –3) catalysts Fuel 126 2014 263 270 10.1016/j.fuel.2014.02.060 H. Eom, D. Lee, S. Kim, S. Chung, Y. Gul, K. Lee, Hydrocracking of extra-heavy oil using Cs-exchanged phosphotungstic acid (Cs x H 3 À x PW 12 O 40, x = 1 –3) catalysts, Fuel. 126 (2014) 263–270. https://doi.org/10.1016/j.fuel.2014.02.060. [11] Q. Zeng S. Guo Y. Sun Z. Li W. Feng Protonation-induced enhanced optical-light photochromic properties of an inorganic-organic phosphomolybdic acid/polyaniline hybrid thin film Nanomaterials 10 2020 1 18 10.3390/nano10091839 Q. Zeng, S. Guo, Y. Sun, Z. Li, W. Feng, Protonation-induced enhanced optical-light photochromic properties of an inorganic-organic phosphomolybdic acid/polyaniline hybrid thin film, Nanomaterials. 10 (2020) 1–18. https://doi.org/10.3390/nano10091839. [12] M. Hasik A. Pron J. Poźniczek A. Bielański Z. Piwowarska K. Kruczala R. Dziembaj Physicochemical and catalytic properties of ployaniline protonated with 12-molybdophosphoric acid J. Chem. Soc., Faraday Trans. 90 1994 2099 2106 10.1039/FT9949002099 M. Hasik, A. Pron, J. Poźniczek, A. Bielański, Z. Piwowarska, K. Kruczala, R. Dziembaj, Physicochemical and catalytic properties of ployaniline protonated with 12-molybdophosphoric acid, J. Chem. Soc., Faraday Trans. 90 (1994) 2099–2106. https://doi.org/10.1039/FT9949002099. [13] K. Inumaru T. Ishihara Y. Kamiya T. Okuhara S. Yamanaka Water-tolerant, highly active solid acid catalysts composed of the keggin-type polyoxometalate H3PW12O40 immobilized in hydrophobic nanospaces of organomodified mesoporous silica Angew. Chem. Int. Ed. 46 2007 7625 7628 10.1002/ANIE.200702478 K. Inumaru, T. Ishihara, Y. Kamiya, T. Okuhara, S. Yamanaka, Water-tolerant, highly active solid acid catalysts composed of the keggin-type polyoxometalate H3PW12O40 immobilized in hydrophobic nanospaces of organomodified mesoporous silica, Angew. Chem. Int. Ed. 46 (2007) 7625–7628. https://doi.org/10.1002/ANIE.200702478. [14] N. Mizuno S. Uchida K. Kamata R. Ishimoto S. Nojima K. Yonehara Y. Sumida Heterogeneous Catalysis A Flexible Nonporous Heterogeneous Catalyst for Size-Selective Oxidation through a Bottom-Up Approach** Angew. Chem. Int. Ed. 49 2010 9972 9976 10.1002/anie.201005275 N. Mizuno, S. Uchida, K. Kamata, R. Ishimoto, S. Nojima, K. Yonehara, Y. Sumida, Heterogeneous Catalysis A Flexible Nonporous Heterogeneous Catalyst for Size-Selective Oxidation through a Bottom-Up Approach**, Angew. Chem. Int. Ed. 49 (2010) 9972–9976. https://doi.org/10.1002/anie.201005275. [15] L. Leclercq A. Mouret A. Proust V. Schmitt P. Bauduin J.-.M. Aubry V. Nardello-Rataj Pickering emulsion stabilized by catalytic polyoxometalate nanoparticles: a new effective medium for oxidation reactions Chem. Eur. J. 18 2012 14352 14358 10.1002/chem.201201799 L. Leclercq, A. Mouret, A. Proust, V. Schmitt, P. Bauduin, J.-.M. Aubry, V. Nardello-Rataj, Pickering emulsion stabilized by catalytic polyoxometalate nanoparticles: a new effective medium for oxidation reactions, Chem. Eur. J. 18 (2012) 14352–14358. https://doi.org/10.1002/chem.201201799. [16] A. Dhakshinamoorthy A.M. Asiri H. García Metal–organic frameworks as multifunctional solid catalysts Trend. Chem. 2 2020 454 466 10.1016/j.trechm.2020.02.004 A. Dhakshinamoorthy, A.M. Asiri, H. García, Metal–organic frameworks as multifunctional solid catalysts, Trend. Chem.. 2 (2020) 454–466. https://doi.org/10.1016/j.trechm.2020.02.004. [17] F.G. Cirujano A. Dhakshinamoorthy Engineering of active sites in metal–organic frameworks for biodiesel production Adv. Sustain. Syst. 5 2021 2100101 10.1002/adsu.202100101 F.G. Cirujano, A. Dhakshinamoorthy, Engineering of active sites in metal–organic frameworks for biodiesel production, Adv. Sustain. Syst.. 5 (2021) 2100101. https://doi.org/10.1002/adsu.202100101. [18] R. Fang A. Dhakshinamoorthy Y. Li H. Garcia Metal organic frameworks for biomass conversion Chem. Soc. Rev. 49 2020 3638 3687 10.1039/d0cs00070a R. Fang, A. Dhakshinamoorthy, Y. Li, H. Garcia, Metal organic frameworks for biomass conversion, Chem. Soc. Rev.. 49 (2020) 3638–3687. https://doi.org/10.1039/d0cs00070a. [19] A. Dhakshinamoorthy A. Santiago-Portillo A.M. Asiri H. Garcia Engineering UiO-66 metal organic framework for heterogeneous catalysis ChemCatChem 11 2019 899 923 10.1002/cctc.201801452 A. Dhakshinamoorthy, A. Santiago-Portillo, A.M. Asiri, H. Garcia, Engineering UiO-66 metal organic framework for heterogeneous catalysis, ChemCatChem. 11 (2019) 899–923. https://doi.org/10.1002/cctc.201801452. [20] M.J. Katz Z.J. Brown Y.J. Colón P.W. Siu K.A. Scheidt R.Q. Snurr J.T. Hupp O.K. Farha A facile synthesis of UiO-66, UiO-67 and their derivatives Chem. Commun. 49 2013 9449 9451 10.1039/c3cc46105j M.J. Katz, Z.J. Brown, Y.J. Colón, P.W. Siu, K.A. Scheidt, R.Q. Snurr, J.T. Hupp, O.K. Farha, A facile synthesis of UiO-66, UiO-67 and their derivatives, Chem. Commun. 49 (2013) 9449–9451. https://doi.org/10.1039/c3cc46105j. [21] R.J. Marshall R.S. Forgan Postsynthetic modification of zirconium metal-organic frameworks Eur. J. Inorg. Chem. 2016 2016 4310 4331 10.1002/ejic.201600394 R.J. Marshall, R.S. Forgan, Postsynthetic modification of zirconium metal-organic frameworks, Eur. J. Inorg. Chem.. 2016 (2016) 4310–4331. https://doi.org/10.1002/ejic.201600394. [22] M. Samaniyan M. Mirzaei R. Khajavian H. Eshtiagh-Hosseini C. Streb Heterogeneous catalysis by polyoxometalates in metal-organic frameworks ACS Catal. 9 2019 10174 10191 10.1021/acscatal.9b03439 M. Samaniyan, M. Mirzaei, R. Khajavian, H. Eshtiagh-Hosseini, C. Streb, Heterogeneous catalysis by polyoxometalates in metal-organic frameworks, ACS Catal. 9 (2019) 10174–10191. https://doi.org/10.1021/acscatal.9b03439. [23] V.E. Tarabanko M.Y. Chernyak I.L. Simakova K.L. Kaigorodov Y.N. Bezborodov N.F. Orlovskaya Antiknock properties of furfural derivatives Russ. J. Appl. Chem. 88 2015 1778 1782 10.1134/S10704272150110063 V.E. Tarabanko, M.Y. Chernyak, I.L. Simakova, K.L. Kaigorodov, Y.N. Bezborodov, N.F. Orlovskaya, Antiknock properties of furfural derivatives, Russ. J. Appl. Chem. 88 (2015) 1778–1782. https://doi.org/10.1134/S10704272150110063. [24] J.P. Lange R. Price P.M. Ayoub J. Louis L. Petrus L. Clarke H. Gosselink Valeric biofuels: a platform of cellulosic transportation fuels Angew. Chem. Int. Ed. 49 2010 4479 4483 10.1002/anie.201000655 J.P. Lange, R. Price, P.M. Ayoub, J. Louis, L. Petrus, L. Clarke, H. Gosselink, Valeric biofuels: a platform of cellulosic transportation fuels, Angew. Chem. Int. Ed. 49 (2010) 4479–4483. https://doi.org/10.1002/anie.201000655. [25] A. Démolis N. Essayem F. Rataboul Synthesis and applications of alkyl levulinates ACS Sustain. Chem. Eng. 2 2014 1338 1352 10.1021/sc500082n A. Démolis, N. Essayem, F. Rataboul, Synthesis and applications of alkyl levulinates, ACS Sustain. Chem. Eng.. 2 (2014) 1338–1352. https://doi.org/10.1021/sc500082n. [26] F. Zaccheria N. Scotti N. Ravasio D.E.E. Dbe Solid acids for the reaction of bioderived alcohols into ethers for fuel applications Catalysts 9 2019 9020172 10.3390/catal9020172 F. Zaccheria, N. Scotti, N. Ravasio, D.E.E. Dbe, Solid acids for the reaction of bioderived alcohols into ethers for fuel applications, Catalysts. 9 (2019) 9020172. https://doi.org/10.3390/catal9020172. [27] Rene Johan Haan, J.-.P. Lange, (12) United States Patent, US 8,372,164 B2, 2013. https://doi.org/10.1038/incomms1464. [28] F. Vermoortele A. Vimont C. Serre D. de Vos An amino-modified Zr-terephthalate metal–organic framework as an acid–base catalyst for cross-aldol condensation Chem. Commun. 47 2011 1521 1523 10.1039/c0cc03038d F. Vermoortele, A. Vimont, C. Serre, D. de Vos, An amino-modified Zr-terephthalate metal–organic framework as an acid–base catalyst for cross-aldol condensation, Chem. Commun. 47 (2011) 1521–1523. https://doi.org/10.1039/c0cc03038d. [29] M. Kandiah S. Usseglio S. Svelle U. Olsbye K.P. Lillerud M. Tilset Post-synthetic modification of the metal-organic framework compound UiO-66 J. Mater. Chem. 20 2010 9848 9851 10.1039/c0jm02416c M. Kandiah, S. Usseglio, S. Svelle, U. Olsbye, K.P. Lillerud, M. Tilset, Post-synthetic modification of the metal-organic framework compound UiO-66, J. Mater. Chem.. 20 (2010) 9848–9851. https://doi.org/10.1039/c0jm02416c. [30] X. Fang S. Wu Y. Wu W. Yang Y. Li J. He P. Hong M. Nie C. Xie Z. Wu K. Zhang L. Kong J. Liu High-efficiency adsorption of norfloxacin using octahedral UIO-66-NH2 nanomaterials: dynamics, thermodynamics, and mechanisms Appl. Surf. Sci. 518 2020 146226 10.1016/j.apsusc.2020.146226 X. Fang, S. Wu, Y. Wu, W. Yang, Y. Li, J. He, P. Hong, M. Nie, C. Xie, Z. Wu, K. Zhang, L. Kong, J. Liu, High-efficiency adsorption of norfloxacin using octahedral UIO-66-NH2 nanomaterials: dynamics, thermodynamics, and mechanisms, Appl. Surf. Sci.. 518 (2020) 146226. https://doi.org/10.1016/j.apsusc.2020.146226. [31] X. Yang X. Jiang Y. Huang Z. Guo L. Shao Building nanoporous metal-organic frameworks “armor” on fibers for high-performance composite materials ACS Appl. Mater. Interface. 9 2017 5590 5599 10.1021/acsami.6b15098 X. Yang, X. Jiang, Y. Huang, Z. Guo, L. Shao, Building nanoporous metal-organic frameworks “armor” on fibers for high-performance composite materials, ACS Appl. Mater. Interface.. 9 (2017) 5590–5599. https://doi.org/10.1021/acsami.6b15098. [32] Q. Chen Q. He M. Lv Y. Xu H. Yang X. Liu F. Wei Selective adsorption of cationic dyes by UiO-66-NH2 Appl. Surf. Sci. 327 2015 77 85 10.1016/J.APSUSC.2014.11.103 Q. Chen, Q. He, M. Lv, Y. Xu, H. Yang, X. Liu, F. Wei, Selective adsorption of cationic dyes by UiO-66-NH2, Appl. Surf. Sci.. 327 (2015) 77–85. https://doi.org/10.1016/J.APSUSC.2014.11.103. [33] M. Peñas-Garzón M.J. Sampaio Y.L. Wang J. Bedia J.J. Rodriguez C. Belver C.G. Silva J.L. Faria Solar photocatalytic degradation of parabens using UiO-66-NH2 Sep. Purif. Technol. 286 2022 120467 10.1016/j.seppur.2022.120467 M. Peñas-Garzón, M.J. Sampaio, Y.L. Wang, J. Bedia, J.J. Rodriguez, C. Belver, C.G. Silva, J.L. Faria, Solar photocatalytic degradation of parabens using UiO-66-NH2, Sep. Purif. Technol.. 286 (2022) 120467. https://doi.org/10.1016/j.seppur.2022.120467. [34] X. Gao L. Peng H. Li K. Chen Formation of humin and alkyl levulinate in the acid-catalyzed conversion of biomass-derived furfuryl alcohol Bioresources 10 2015 6548 6564 X. Gao, L. Peng, H. Li, K. Chen, Formation of humin and alkyl levulinate in the acid-catalyzed conversion of biomass-derived furfuryl alcohol, Bioresources. 10 (2015) 6548–6564. [35] J.M. Pin N. Guigo A. Mija L. Vincent N. Sbirrazzuoli J.C. van der Waal E. de Jong Valorization of biorefinery side-stream products: combination of humins with polyfurfuryl alcohol for composite elaboration ACS Sustain. Chem. Eng. 2 2014 2182 2190 10.1021/sc5003769 J.M. Pin, N. Guigo, A. Mija, L. Vincent, N. Sbirrazzuoli, J.C. van der Waal, E. de Jong, Valorization of biorefinery side-stream products: combination of humins with polyfurfuryl alcohol for composite elaboration, ACS Sustain. Chem. Eng.. 2 (2014) 2182–2190. https://doi.org/10.1021/sc5003769. [36] X. Gao X. Yu R. Tao L. Peng Enhanced conversion of furfuryl alcohol to alkyl levulinates catalyzed by synergy of CrCl3 and H3PO4 Bioresources 12 2017 7642 7655 X. Gao, X. Yu, R. Tao, L. Peng, Enhanced conversion of furfuryl alcohol to alkyl levulinates catalyzed by synergy of CrCl3 and H3PO4, Bioresources. 12 (2017) 7642–7655. [37] M. Annatelli G. Trapasso L. Lena F. Aricò Alkyl levulinates from furfuryl alcohol using CT151 Purolite as heterogenous catalyst: optimization, purification, and recycling Sustain. Chem. 2 2021 493 505 10.3390/suschem2030027 M. Annatelli, G. Trapasso, L. Lena, F. Aricò, Alkyl levulinates from furfuryl alcohol using CT151 Purolite as heterogenous catalyst: optimization, purification, and recycling, Sustain. Chem. 2 (2021) 493–505. https://doi.org/10.3390/suschem2030027. [38] T.A. Natsir T. Hara N. Ichikuni S. Shimazu Kaolinite catalyst for the production of a biodiesel-based compound from biomass-derived furfuryl alcohol ACS Appl. Energy Mater. 1 2018 2460 2463 10.1021/acsaem.8b00694 T.A. Natsir, T. Hara, N. Ichikuni, S. Shimazu, Kaolinite catalyst for the production of a biodiesel-based compound from biomass-derived furfuryl alcohol, ACS Appl. Energy Mater.. 1 (2018) 2460–2463. https://doi.org/10.1021/acsaem.8b00694. [39] Y. Ji Y. Zuo H. Liu F. Wang X. Guo Synthesis of silico-phospho-aluminum nanosheets by adding amino acid and its catalysis in the conversion of furfuryl alcohol to fuel additives ChemSusChem 15 2022 e202200747 10.1002/cssc.202200747 Y. Ji, Y. Zuo, H. Liu, F. Wang, X. Guo, Synthesis of silico-phospho-aluminum nanosheets by adding amino acid and its catalysis in the conversion of furfuryl alcohol to fuel additives, ChemSusChem. 15 (2022) e202200747. https://doi.org/10.1002/cssc.202200747. [40] Y. Li S. Wang S. Fan B. Ali X. Lan T. Wang Nano-H-ZSM-5 with short b-axis channels as a highly efficient catalyst for the synthesis of ethyl levulinate from furfuryl alcohol ACS Sustain. Chem. Eng. 10 2022 3808 3816 10.1021/acssuschemeng.1c06695 Y. Li, S. Wang, S. Fan, B. Ali, X. Lan, T. Wang, Nano-H-ZSM-5 with short b-axis channels as a highly efficient catalyst for the synthesis of ethyl levulinate from furfuryl alcohol, ACS Sustain. Chem. Eng.. 10 (2022) 3808–3816. https://doi.org/10.1021/acssuschemeng.1c06695. [41] E. Siva Sankar K. Saidulu Reddy Y. Jyothi B. David Raju K.S. Rama Rao Alcoholysis of furfuryl alcohol into n-butyl levulinate over SBA-16 supported heteropoly acid catalyst Catal. Lett. 147 2017 2807 2816 10.1007/s10562-017-2155-9 E. Siva Sankar, K. Saidulu Reddy, Y. Jyothi, B. David Raju, K.S. Rama Rao, Alcoholysis of furfuryl alcohol into n-butyl levulinate over SBA-16 supported heteropoly acid catalyst, Catal. Lett.. 147 (2017) 2807–2816. https://doi.org/10.1007/s10562-017-2155-9.",
      "scopus-id": "85138171843",
      "coredata": {
        "eid": "1-s2.0-S2468823122005752",
        "dc:description": "Phosphotungustic Acid (HPW) is an inorganic super acid, that is highly soluble in polar solvents limiting its applicability as acid catalysis. To overcome these limitations immobilization of HPW was carried out at room temperature by protonation of -NH2 group of UiO-66-NH2 MOF to UiO-66-NH2 HPW. ATR-FTIR spectroscopy and XPS results confirmed the protonation and chemical interaction between HPW and UiO-66-NH2. STEM-EDS mapping showed homogeneous distribution of HPW on UiO-66-NH2. BET and NH3-TPD confirmed the reduction in specific surface area, total pore volume, and increase in total acidity for UiO-66-NH2 HPW. Further, powder XRD, SEM, and HR-TEM prevailed that there is no change in phase and morphology after post-synthetic modification of UiO-66-NH2. The prepared catalyst is found to be effective for etherification and alcoholysis of furfuryl alcohol (FALc) to Furfuryl ether (FE) and Alkyl levulinate (AL). UiO-66-NH2 HPW has shown 97 mol% FALc conversions in ethanolic media and 31 mol% Ethyl furfuryl ether (EFE) yield and 29 mol% Ethyl levulinate (EL) yield. UiO-66-NH2 HPW is also found to be efficient for the multistep conversion of Furfural (FFR) to FALc, FE, and AL.",
        "openArchiveArticle": "false",
        "prism:coverDate": "2022-10-31",
        "openaccessUserLicense": null,
        "prism:aggregationType": "Journal",
        "prism:url": "https://api.elsevier.com/content/article/pii/S2468823122005752",
        "dc:creator": [
          {
            "@_fa": "true",
            "$": "Mulik, Nagesh"
          },
          {
            "@_fa": "true",
            "$": "Bokade, Vijay"
          }
        ],
        "link": [
          {
            "@_fa": "true",
            "@rel": "self",
            "@href": "https://api.elsevier.com/content/article/pii/S2468823122005752"
          },
          {
            "@_fa": "true",
            "@rel": "scidir",
            "@href": "https://www.sciencedirect.com/science/article/pii/S2468823122005752"
          }
        ],
        "dc:format": "application/json",
        "openaccessType": null,
        "pii": "S2468-8231(22)00575-2",
        "prism:volume": "531",
        "articleNumber": "112689",
        "prism:publisher": "Elsevier B.V.",
        "dc:title": "Immobilization of HPW on UiO-66-NH2 MOF as efficient catalyst for synthesis of furfuryl ether and alkyl levulinate as biofuel",
        "prism:copyright": "© 2022 Elsevier B.V. All rights reserved.",
        "openaccess": "0",
        "prism:issn": "24688231",
        "dcterms:subject": [
          {
            "@_fa": "true",
            "$": "Immobilization"
          },
          {
            "@_fa": "true",
            "$": "Phosphotungstic acid"
          },
          {
            "@_fa": "true",
            "$": "UiO-66-NH2-HPW"
          },
          {
            "@_fa": "true",
            "$": "Etherification"
          },
          {
            "@_fa": "true",
            "$": "Alcoholysis"
          }
        ],
        "openaccessArticle": "false",
        "prism:publicationName": "Molecular Catalysis",
        "openaccessSponsorType": null,
        "prism:pageRange": "112689",
        "pubType": "fla",
        "prism:coverDisplayDate": "October 2022",
        "prism:doi": "10.1016/j.mcat.2022.112689",
        "prism:startingPage": "112689",
        "dc:identifier": "doi:10.1016/j.mcat.2022.112689",
        "openaccessSponsorName": null
      },
      "objects": {
        "object": [
          {
            "@category": "standard",
            "@height": "167",
            "@width": "301",
            "@_fa": "true",
            "$": "https://api.elsevier.com/content/object/eid/1-s2.0-S2468823122005752-ga1.jpg?httpAccept=%2A%2F%2A",
            "@multimediatype": "JPEG image file",
            "@type": "IMAGE-DOWNSAMPLED",
            "@size": "25281",
            "@ref": "ga1",
            "@mimetype": "image/jpeg"
          },
          {
            "@category": "standard",
            "@height": "280",
            "@width": "339",
            "@_fa": "true",
            "$": "https://api.elsevier.com/content/object/eid/1-s2.0-S2468823122005752-gr7.jpg?httpAccept=%2A%2F%2A",
            "@multimediatype": "JPEG image file",
            "@type": "IMAGE-DOWNSAMPLED",
            "@size": "25856",
            "@ref": "gr7",
            "@mimetype": "image/jpeg"
          },
          {
            "@category": "standard",
            "@height": "278",
            "@width": "339",
            "@_fa": "true",
            "$": "https://api.elsevier.com/content/object/eid/1-s2.0-S2468823122005752-gr8.jpg?httpAccept=%2A%2F%2A",
            "@multimediatype": "JPEG image file",
            "@type": "IMAGE-DOWNSAMPLED",
            "@size": "22431",
            "@ref": "gr8",
            "@mimetype": "image/jpeg"
          },
          {
            "@category": "standard",
            "@height": "360",
            "@width": "339",
            "@_fa": "true",
            "$": "https://api.elsevier.com/content/object/eid/1-s2.0-S2468823122005752-gr3.jpg?httpAccept=%2A%2F%2A",
            "@multimediatype": "JPEG image file",
            "@type": "IMAGE-DOWNSAMPLED",
            "@size": "25615",
            "@ref": "gr3",
            "@mimetype": "image/jpeg"
          },
          {
            "@category": "standard",
            "@height": "362",
            "@width": "339",
            "@_fa": "true",
            "$": "https://api.elsevier.com/content/object/eid/1-s2.0-S2468823122005752-gr4.jpg?httpAccept=%2A%2F%2A",
            "@multimediatype": "JPEG image file",
            "@type": "IMAGE-DOWNSAMPLED",
            "@size": "39024",
            "@ref": "gr4",
            "@mimetype": "image/jpeg"
          },
          {
            "@category": "standard",
            "@height": "210",
            "@width": "565",
            "@_fa": "true",
            "$": "https://api.elsevier.com/content/object/eid/1-s2.0-S2468823122005752-gr1.jpg?httpAccept=%2A%2F%2A",
            "@multimediatype": "JPEG image file",
            "@type": "IMAGE-DOWNSAMPLED",
            "@size": "29315",
            "@ref": "gr1",
            "@mimetype": "image/jpeg"
          },
          {
            "@category": "standard",
            "@height": "288",
            "@width": "339",
            "@_fa": "true",
            "$": "https://api.elsevier.com/content/object/eid/1-s2.0-S2468823122005752-gr10.jpg?httpAccept=%2A%2F%2A",
            "@multimediatype": "JPEG image file",
            "@type": "IMAGE-DOWNSAMPLED",
            "@size": "23693",
            "@ref": "gr10",
            "@mimetype": "image/jpeg"
          },
          {
            "@category": "standard",
            "@height": "278",
            "@width": "339",
            "@_fa": "true",
            "$": "https://api.elsevier.com/content/object/eid/1-s2.0-S2468823122005752-gr9.jpg?httpAccept=%2A%2F%2A",
            "@multimediatype": "JPEG image file",
            "@type": "IMAGE-DOWNSAMPLED",
            "@size": "24341",
            "@ref": "gr9",
            "@mimetype": "image/jpeg"
          },
          {
            "@category": "standard",
            "@height": "829",
            "@width": "565",
            "@_fa": "true",
            "$": "https://api.elsevier.com/content/object/eid/1-s2.0-S2468823122005752-gr5.jpg?httpAccept=%2A%2F%2A",
            "@multimediatype": "JPEG image file",
            "@type": "IMAGE-DOWNSAMPLED",
            "@size": "142202",
            "@ref": "gr5",
            "@mimetype": "image/jpeg"
          },
          {
            "@category": "standard",
            "@height": "290",
            "@width": "339",
            "@_fa": "true",
            "$": "https://api.elsevier.com/content/object/eid/1-s2.0-S2468823122005752-gr6.jpg?httpAccept=%2A%2F%2A",
            "@multimediatype": "JPEG image file",
            "@type": "IMAGE-DOWNSAMPLED",
            "@size": "25653",
            "@ref": "gr6",
            "@mimetype": "image/jpeg"
          },
          {
            "@category": "standard",
            "@height": "295",
            "@width": "565",
            "@_fa": "true",
            "$": "https://api.elsevier.com/content/object/eid/1-s2.0-S2468823122005752-gr2.jpg?httpAccept=%2A%2F%2A",
            "@multimediatype": "JPEG image file",
            "@type": "IMAGE-DOWNSAMPLED",
            "@size": "107875",
            "@ref": "gr2",
            "@mimetype": "image/jpeg"
          },
          {
            "@category": "standard",
            "@height": "167",
            "@width": "527",
            "@_fa": "true",
            "$": "https://api.elsevier.com/content/object/eid/1-s2.0-S2468823122005752-sc1.jpg?httpAccept=%2A%2F%2A",
            "@multimediatype": "JPEG image file",
            "@type": "IMAGE-DOWNSAMPLED",
            "@size": "19294",
            "@ref": "sc1",
            "@mimetype": "image/jpeg"
          },
          {
            "@category": "standard",
            "@height": "102",
            "@width": "565",
            "@_fa": "true",
            "$": "https://api.elsevier.com/content/object/eid/1-s2.0-S2468823122005752-sc2.jpg?httpAccept=%2A%2F%2A",
            "@multimediatype": "JPEG image file",
            "@type": "IMAGE-DOWNSAMPLED",
            "@size": "13528",
            "@ref": "sc2",
            "@mimetype": "image/jpeg"
          },
          {
            "@category": "standard",
            "@height": "88",
            "@width": "565",
            "@_fa": "true",
            "$": "https://api.elsevier.com/content/object/eid/1-s2.0-S2468823122005752-sc3.jpg?httpAccept=%2A%2F%2A",
            "@multimediatype": "JPEG image file",
            "@type": "IMAGE-DOWNSAMPLED",
            "@size": "12548",
            "@ref": "sc3",
            "@mimetype": "image/jpeg"
          },
          {
            "@category": "thumbnail",
            "@height": "121",
            "@width": "219",
            "@_fa": "true",
            "$": "https://api.elsevier.com/content/object/eid/1-s2.0-S2468823122005752-ga1.sml?httpAccept=%2A%2F%2A",
            "@multimediatype": "GIF image file",
            "@type": "IMAGE-THUMBNAIL",
            "@size": "20757",
            "@ref": "ga1",
            "@mimetype": "image/gif"
          },
          {
            "@category": "thumbnail",
            "@height": "164",
            "@width": "199",
            "@_fa": "true",
            "$": "https://api.elsevier.com/content/object/eid/1-s2.0-S2468823122005752-gr7.sml?httpAccept=%2A%2F%2A",
            "@multimediatype": "GIF image file",
            "@type": "IMAGE-THUMBNAIL",
            "@size": "11056",
            "@ref": "gr7",
            "@mimetype": "image/gif"
          },
          {
            "@category": "thumbnail",
            "@height": "164",
            "@width": "200",
            "@_fa": "true",
            "$": "https://api.elsevier.com/content/object/eid/1-s2.0-S2468823122005752-gr8.sml?httpAccept=%2A%2F%2A",
            "@multimediatype": "GIF image file",
            "@type": "IMAGE-THUMBNAIL",
            "@size": "8346",
            "@ref": "gr8",
            "@mimetype": "image/gif"
          },
          {
            "@category": "thumbnail",
            "@height": "163",
            "@width": "154",
            "@_fa": "true",
            "$": "https://api.elsevier.com/content/object/eid/1-s2.0-S2468823122005752-gr3.sml?httpAccept=%2A%2F%2A",
            "@multimediatype": "GIF image file",
            "@type": "IMAGE-THUMBNAIL",
            "@size": "6727",
            "@ref": "gr3",
            "@mimetype": "image/gif"
          },
          {
            "@category": "thumbnail",
            "@height": "164",
            "@width": "153",
            "@_fa": "true",
            "$": "https://api.elsevier.com/content/object/eid/1-s2.0-S2468823122005752-gr4.sml?httpAccept=%2A%2F%2A",
            "@multimediatype": "GIF image file",
            "@type": "IMAGE-THUMBNAIL",
            "@size": "8627",
            "@ref": "gr4",
            "@mimetype": "image/gif"
          },
          {
            "@category": "thumbnail",
            "@height": "82",
            "@width": "219",
            "@_fa": "true",
            "$": "https://api.elsevier.com/content/object/eid/1-s2.0-S2468823122005752-gr1.sml?httpAccept=%2A%2F%2A",
            "@multimediatype": "GIF image file",
            "@type": "IMAGE-THUMBNAIL",
            "@size": "12461",
            "@ref": "gr1",
            "@mimetype": "image/gif"
          },
          {
            "@category": "thumbnail",
            "@height": "164",
            "@width": "193",
            "@_fa": "true",
            "$": "https://api.elsevier.com/content/object/eid/1-s2.0-S2468823122005752-gr10.sml?httpAccept=%2A%2F%2A",
            "@multimediatype": "GIF image file",
            "@type": "IMAGE-THUMBNAIL",
            "@size": "8527",
            "@ref": "gr10",
            "@mimetype": "image/gif"
          },
          {
            "@category": "thumbnail",
            "@height": "164",
            "@width": "200",
            "@_fa": "true",
            "$": "https://api.elsevier.com/content/object/eid/1-s2.0-S2468823122005752-gr9.sml?httpAccept=%2A%2F%2A",
            "@multimediatype": "GIF image file",
            "@type": "IMAGE-THUMBNAIL",
            "@size": "7862",
            "@ref": "gr9",
            "@mimetype": "image/gif"
          },
          {
            "@category": "thumbnail",
            "@height": "163",
            "@width": "111",
            "@_fa": "true",
            "$": "https://api.elsevier.com/content/object/eid/1-s2.0-S2468823122005752-gr5.sml?httpAccept=%2A%2F%2A",
            "@multimediatype": "GIF image file",
            "@type": "IMAGE-THUMBNAIL",
            "@size": "10007",
            "@ref": "gr5",
            "@mimetype": "image/gif"
          },
          {
            "@category": "thumbnail",
            "@height": "164",
            "@width": "192",
            "@_fa": "true",
            "$": "https://api.elsevier.com/content/object/eid/1-s2.0-S2468823122005752-gr6.sml?httpAccept=%2A%2F%2A",
            "@multimediatype": "GIF image file",
            "@type": "IMAGE-THUMBNAIL",
            "@size": "8386",
            "@ref": "gr6",
            "@mimetype": "image/gif"
          },
          {
            "@category": "thumbnail",
            "@height": "114",
            "@width": "219",
            "@_fa": "true",
            "$": "https://api.elsevier.com/content/object/eid/1-s2.0-S2468823122005752-gr2.sml?httpAccept=%2A%2F%2A",
            "@multimediatype": "GIF image file",
            "@type": "IMAGE-THUMBNAIL",
            "@size": "18703",
            "@ref": "gr2",
            "@mimetype": "image/gif"
          },
          {
            "@category": "thumbnail",
            "@height": "69",
            "@width": "219",
            "@_fa": "true",
            "$": "https://api.elsevier.com/content/object/eid/1-s2.0-S2468823122005752-sc1.sml?httpAccept=%2A%2F%2A",
            "@multimediatype": "GIF image file",
            "@type": "IMAGE-THUMBNAIL",
            "@size": "4172",
            "@ref": "sc1",
            "@mimetype": "image/gif"
          },
          {
            "@category": "thumbnail",
            "@height": "40",
            "@width": "219",
            "@_fa": "true",
            "$": "https://api.elsevier.com/content/object/eid/1-s2.0-S2468823122005752-sc2.sml?httpAccept=%2A%2F%2A",
            "@multimediatype": "GIF image file",
            "@type": "IMAGE-THUMBNAIL",
            "@size": "2711",
            "@ref": "sc2",
            "@mimetype": "image/gif"
          },
          {
            "@category": "thumbnail",
            "@height": "34",
            "@width": "219",
            "@_fa": "true",
            "$": "https://api.elsevier.com/content/object/eid/1-s2.0-S2468823122005752-sc3.sml?httpAccept=%2A%2F%2A",
            "@multimediatype": "GIF image file",
            "@type": "IMAGE-THUMBNAIL",
            "@size": "2524",
            "@ref": "sc3",
            "@mimetype": "image/gif"
          },
          {
            "@category": "high",
            "@height": "739",
            "@width": "1333",
            "@_fa": "true",
            "$": "https://api.elsevier.com/content/object/eid/1-s2.0-S2468823122005752-ga1_lrg.jpg?httpAccept=%2A%2F%2A",
            "@multimediatype": "JPEG image file",
            "@type": "IMAGE-HIGH-RES",
            "@size": "356362",
            "@ref": "ga1",
            "@mimetype": "image/jpeg"
          },
          {
            "@category": "high",
            "@height": "1237",
            "@width": "1500",
            "@_fa": "true",
            "$": "https://api.elsevier.com/content/object/eid/1-s2.0-S2468823122005752-gr7_lrg.jpg?httpAccept=%2A%2F%2A",
            "@multimediatype": "JPEG image file",
            "@type": "IMAGE-HIGH-RES",
            "@size": "163497",
            "@ref": "gr7",
            "@mimetype": "image/jpeg"
          },
          {
            "@category": "high",
            "@height": "1229",
            "@width": "1500",
            "@_fa": "true",
            "$": "https://api.elsevier.com/content/object/eid/1-s2.0-S2468823122005752-gr8_lrg.jpg?httpAccept=%2A%2F%2A",
            "@multimediatype": "JPEG image file",
            "@type": "IMAGE-HIGH-RES",
            "@size": "132395",
            "@ref": "gr8",
            "@mimetype": "image/jpeg"
          },
          {
            "@category": "high",
            "@height": "1591",
            "@width": "1500",
            "@_fa": "true",
            "$": "https://api.elsevier.com/content/object/eid/1-s2.0-S2468823122005752-gr3_lrg.jpg?httpAccept=%2A%2F%2A",
            "@multimediatype": "JPEG image file",
            "@type": "IMAGE-HIGH-RES",
            "@size": "191983",
            "@ref": "gr3",
            "@mimetype": "image/jpeg"
          },
          {
            "@category": "high",
            "@height": "1606",
            "@width": "1502",
            "@_fa": "true",
            "$": "https://api.elsevier.com/content/object/eid/1-s2.0-S2468823122005752-gr4_lrg.jpg?httpAccept=%2A%2F%2A",
            "@multimediatype": "JPEG image file",
            "@type": "IMAGE-HIGH-RES",
            "@size": "281635",
            "@ref": "gr4",
            "@mimetype": "image/jpeg"
          },
          {
            "@category": "high",
            "@height": "931",
            "@width": "2501",
            "@_fa": "true",
            "$": "https://api.elsevier.com/content/object/eid/1-s2.0-S2468823122005752-gr1_lrg.jpg?httpAccept=%2A%2F%2A",
            "@multimediatype": "JPEG image file",
            "@type": "IMAGE-HIGH-RES",
            "@size": "305088",
            "@ref": "gr1",
            "@mimetype": "image/jpeg"
          },
          {
            "@category": "high",
            "@height": "1273",
            "@width": "1500",
            "@_fa": "true",
            "$": "https://api.elsevier.com/content/object/eid/1-s2.0-S2468823122005752-gr10_lrg.jpg?httpAccept=%2A%2F%2A",
            "@multimediatype": "JPEG image file",
            "@type": "IMAGE-HIGH-RES",
            "@size": "140510",
            "@ref": "gr10",
            "@mimetype": "image/jpeg"
          },
          {
            "@category": "high",
            "@height": "1230",
            "@width": "1500",
            "@_fa": "true",
            "$": "https://api.elsevier.com/content/object/eid/1-s2.0-S2468823122005752-gr9_lrg.jpg?httpAccept=%2A%2F%2A",
            "@multimediatype": "JPEG image file",
            "@type": "IMAGE-HIGH-RES",
            "@size": "136017",
            "@ref": "gr9",
            "@mimetype": "image/jpeg"
          },
          {
            "@category": "high",
            "@height": "3667",
            "@width": "2500",
            "@_fa": "true",
            "$": "https://api.elsevier.com/content/object/eid/1-s2.0-S2468823122005752-gr5_lrg.jpg?httpAccept=%2A%2F%2A",
            "@multimediatype": "JPEG image file",
            "@type": "IMAGE-HIGH-RES",
            "@size": "1106633",
            "@ref": "gr5",
            "@mimetype": "image/jpeg"
          },
          {
            "@category": "high",
            "@height": "1283",
            "@width": "1500",
            "@_fa": "true",
            "$": "https://api.elsevier.com/content/object/eid/1-s2.0-S2468823122005752-gr6_lrg.jpg?httpAccept=%2A%2F%2A",
            "@multimediatype": "JPEG image file",
            "@type": "IMAGE-HIGH-RES",
            "@size": "146635",
            "@ref": "gr6",
            "@mimetype": "image/jpeg"
          },
          {
            "@category": "high",
            "@height": "1305",
            "@width": "2500",
            "@_fa": "true",
            "$": "https://api.elsevier.com/content/object/eid/1-s2.0-S2468823122005752-gr2_lrg.jpg?httpAccept=%2A%2F%2A",
            "@multimediatype": "JPEG image file",
            "@type": "IMAGE-HIGH-RES",
            "@size": "1937059",
            "@ref": "gr2",
            "@mimetype": "image/jpeg"
          },
          {
            "@category": "high",
            "@height": "739",
            "@width": "2333",
            "@_fa": "true",
            "$": "https://api.elsevier.com/content/object/eid/1-s2.0-S2468823122005752-sc1_lrg.jpg?httpAccept=%2A%2F%2A",
            "@multimediatype": "JPEG image file",
            "@type": "IMAGE-HIGH-RES",
            "@size": "166458",
            "@ref": "sc1",
            "@mimetype": "image/jpeg"
          },
          {
            "@category": "high",
            "@height": "454",
            "@width": "2503",
            "@_fa": "true",
            "$": "https://api.elsevier.com/content/object/eid/1-s2.0-S2468823122005752-sc2_lrg.jpg?httpAccept=%2A%2F%2A",
            "@multimediatype": "JPEG image file",
            "@type": "IMAGE-HIGH-RES",
            "@size": "109369",
            "@ref": "sc2",
            "@mimetype": "image/jpeg"
          },
          {
            "@category": "high",
            "@height": "390",
            "@width": "2503",
            "@_fa": "true",
            "$": "https://api.elsevier.com/content/object/eid/1-s2.0-S2468823122005752-sc3_lrg.jpg?httpAccept=%2A%2F%2A",
            "@multimediatype": "JPEG image file",
            "@type": "IMAGE-HIGH-RES",
            "@size": "100955",
            "@ref": "sc3",
            "@mimetype": "image/jpeg"
          },
          {
            "@category": "standard",
            "@_fa": "true",
            "$": "https://api.elsevier.com/content/object/eid/1-s2.0-S2468823122005752-mmc1.docx?httpAccept=%2A%2F%2A",
            "@multimediatype": "Microsoft Word file",
            "@type": "APPLICATION",
            "@size": "8675789",
            "@ref": "mmc1",
            "@mimetype": "application/word"
          },
          {
            "@category": "thumbnail",
            "@_fa": "true",
            "$": "https://api.elsevier.com/content/object/eid/1-s2.0-S2468823122005752-si1.svg?httpAccept=%2A%2F%2A",
            "@multimediatype": "Scalable Vector Graphics file",
            "@type": "ALTIMG",
            "@size": "18930",
            "@ref": "si1",
            "@mimetype": "image/svg+xml"
          },
          {
            "@category": "thumbnail",
            "@_fa": "true",
            "$": "https://api.elsevier.com/content/object/eid/1-s2.0-S2468823122005752-si2.svg?httpAccept=%2A%2F%2A",
            "@multimediatype": "Scalable Vector Graphics file",
            "@type": "ALTIMG",
            "@size": "19570",
            "@ref": "si2",
            "@mimetype": "image/svg+xml"
          },
          {
            "@category": "thumbnail",
            "@_fa": "true",
            "$": "https://api.elsevier.com/content/object/eid/1-s2.0-S2468823122005752-si3.svg?httpAccept=%2A%2F%2A",
            "@multimediatype": "Scalable Vector Graphics file",
            "@type": "ALTIMG",
            "@size": "20129",
            "@ref": "si3",
            "@mimetype": "image/svg+xml"
          },
          {
            "@category": "thumbnail",
            "@_fa": "true",
            "$": "https://api.elsevier.com/content/object/eid/1-s2.0-S2468823122005752-si4.svg?httpAccept=%2A%2F%2A",
            "@multimediatype": "Scalable Vector Graphics file",
            "@type": "ALTIMG",
            "@size": "20960",
            "@ref": "si4",
            "@mimetype": "image/svg+xml"
          },
          {
            "@category": "standard",
            "@_fa": "true",
            "$": "https://api.elsevier.com/content/object/eid/1-s2.0-S2468823122005752-am.pdf?httpAccept=%2A%2F%2A",
            "@multimediatype": "Acrobat PDF file",
            "@type": "AAM-PDF",
            "@size": "918128",
            "@ref": "am",
            "@mimetype": "application/pdf"
          }
        ]
      },
      "link": {
        "@rel": "abstract",
        "@href": "https://api.elsevier.com/content/abstract/scopus_id/85138171843"
      }
    }
  }
}