{
  "metadata": {
    "title": "Study on NH<ce:inf loc=post>3</ce:inf>-SCR performance and mechanism of Mn supported SO<ce:inf loc=post>4</ce:inf><ce:sup loc=post>2−</ce:sup>-CeCO<ce:inf loc=post>3</ce:inf>F-CePO<ce:inf loc=post>4</ce:inf> catalysts",
    "authors": "; ; ",
    "journal": "Molecular Catalysis",
    "date": "2022-12-31",
    "doi": "10.1016/j.mcat.2022.112763",
    "abstract": "",
    "uri": "https://api.elsevier.com/content/article/pii/S2468823122006496",
    "pii": "S2468823122006496"
  },
  "fulltext": {
    "full-text-retrieval-response": {
      "scopus-eid": "2-s2.0-85141281453",
      "originalText": "serial JL 315758 291210 291744 291790 291809 31 Molecular Catalysis MOLECULARCATALYSIS 2022-11-08 2022-11-08 2022-11-08 2022-11-08 2022-11-21T15:56:55 1-s2.0-S2468823122006496 S2468-8231(22)00649-6 S2468823122006496 10.1016/j.mcat.2022.112763 S300 S300.1 FULL-TEXT 1-s2.0-S2468823122X00163 2024-06-26T17:47:42.363978Z 0 0 20221201 20221231 2022 2022-11-08T11:58:20.116554Z absattachment articleinfo articlenumber articletitlenorm authfirstinitialnorm authfirstsurnamenorm cid cids contenttype copyright crossmark dateloaded dateloadedtxt datesearch datesort dateupdated dco docsubtype doctype doi eid ewtransactionid hubeid indexeddate issn issnnorm itemstage itemtransactionid itemweight openaccess openarchive pg pgfirst pii piinorm pubdateend pubdatestart pubdatetxt pubyr sectiontitle sortorder srctitle srctitlenorm srctype ssids alllist content subj subheadings suppl tomb volfirst volissue volumelist webpdf webpdfpagecount yearnav figure table body mmlmath acknowledge affil articletitle auth authfirstini authfull authkeywords authlast grantnumber grantsponsor grantsponsorid highlightsabst primabst pubtype ref specialabst 2468-8231 24688231 true 533 533 C Volume 533 39 112763 112763 112763 202212 December 2022 2022-12-01 2022-12-31 2022 Regular Papers article rev © 2022 Elsevier B.V. All rights reserved. STUDYNH3SCRPERFORMANCEMECHANISMMNSUPPORTEDSO42CECO3FCEPO4CATALYSTS LI N 1 Introduction 2 Experimental part 2.1 Experimental materials 2.2 Preparation of the catalyst 2.3 Evaluation of the activity of the catalyst 2.4 Catalyst characterization and equipment 3 Results and discussion 3.1 XRD 3.2 Raman spectroscopy 3.3 NH3-TPD 3.4 H2-TPR 3.5 XPS 3.6 Catalytic NH3-SCR performances 3.7 In situ drifts 3.7.1 Variation of NH3 and NO+O2 adsorption on the catalyst with time 3.7.2 Variation of NH3 and NO+O2 adsorption on the catalyst with temperature 3.7.3 Reaction of NH3 and NO+O2 pre-adsorption 3.8 Sulphur and water resistance testing 3.9 Mechanism analysis 4 Conclusion Acknowledgments References LI 2022 N LIU 2018 363 C YAO 2017 407 415 X ZHANG 2014 94 104 R ZHAO 2012 453 456 H REN 2011 362 368 W MA 2011 7603 7612 L LI 2014 378 383 K RAGAVENDRAN 2009 2166 2171 K MCBRIDE 1994 J SPANIER 2001 64 J LIU 2018 620 629 S DUAN 2022 49 56 C ZHANG 2015 338 346 T BONINGARI 2015 145 155 T GENG 2017 16951 16958 Y KWON 2015 160 166 D GAO 2019 175 Y CHEN 2005 582 586 J WANG 2012 232 241 L SU 2013 115 121 Y FANG 2013 9199 9207 C ANDREOLI 2015 174 182 S YU 2016 C PERFORMANCEREACTIONMECHANISMANEWMNSAPO34SERIESCATALYSTFORLOWTEMPERATURESCR KIJLSTRA 1997 219 230 W KANG 2007 261 269 M WANG 2020 118781 A HUANG 2021 111565 L ZENG 2018 8 15 Y FERRIZZ 2002 123 129 R HINO 2006 35 41 M FANG 2015 D STUDYLOWTEMPERATUREDENITRATIONPERFORMANCEADAPTABILITYMNTIO2CATALYSTSD YANG 2014 21500 21508 S WU 2008 12 21 B LIAO 2016 5033 5037 Y SUN 2017 12101 12110 J LIX2022X112763 LIX2022X112763XN 2024-11-08T00:00:00.000Z 2024-11-08T00:00:00.000Z http://creativecommons.org/licenses/by-nc-nd/4.0/ © 2022 Elsevier B.V. All rights reserved. 2022-11-11T01:06:20.642Z http://vtw.elsevier.com/data/voc/AddOnTypes/50.7/aggregated-refined National Natural Science Foundation of China 51866013 NSFC National Natural Science Foundation of China http://data.elsevier.com/vocabulary/SciValFunders/501100001809 http://sws.geonames.org/1814991/ This work was supported by the National Natural Science Foundation of China ( 51866013 ). 0 https://doi.org/10.15223/policy-017 https://doi.org/10.15223/policy-037 https://doi.org/10.15223/policy-012 https://doi.org/10.15223/policy-029 https://doi.org/10.15223/policy-004 item S2468-8231(22)00649-6 S2468823122006496 1-s2.0-S2468823122006496 10.1016/j.mcat.2022.112763 315758 2022-11-21T16:12:27.650009Z 2022-12-01 2022-12-31 1-s2.0-S2468823122006496-main.pdf https://s3-eu-west-1.amazonaws.com/prod-ucs-content-store-eu-west/content/pii:S2468823122006496/MAIN/application/pdf/147f6e3d0a80acaa3519bcddb1e0615a/main.pdf main.pdf pdf true 5944768 MAIN 13 1-s2.0-S2468823122006496-main_1.png https://s3-eu-west-1.amazonaws.com/prod-ucs-content-store-eu-west/content/pii:S2468823122006496/PREVIEW/image/png/29e1052d8769880ac1b4ae1a4d70d4d2/main_1.png main_1.png png 57714 849 656 IMAGE-WEB-PDF 1 1-s2.0-S2468823122006496-ga1.jpg https://s3-eu-west-1.amazonaws.com/prod-ucs-content-store-eu-west/content/pii:S2468823122006496/ga1/DOWNSAMPLED/image/jpeg/db599f1f2a0609fc77ed8509becef3d2/ga1.jpg ga1 true ga1.jpg jpg 17364 121 301 IMAGE-DOWNSAMPLED 1-s2.0-S2468823122006496-gr16.jpg https://s3-eu-west-1.amazonaws.com/prod-ucs-content-store-eu-west/content/pii:S2468823122006496/gr16/DOWNSAMPLED/image/jpeg/ffe64e60e2a70dba2153a9783c321d47/gr16.jpg gr16 gr16.jpg jpg 32313 205 508 IMAGE-DOWNSAMPLED 1-s2.0-S2468823122006496-gr1.jpg https://s3-eu-west-1.amazonaws.com/prod-ucs-content-store-eu-west/content/pii:S2468823122006496/gr1/DOWNSAMPLED/image/jpeg/e0a4d2674b0ece49f1f952810ceed4b9/gr1.jpg gr1 gr1.jpg jpg 22493 197 376 IMAGE-DOWNSAMPLED 1-s2.0-S2468823122006496-gr2.jpg https://s3-eu-west-1.amazonaws.com/prod-ucs-content-store-eu-west/content/pii:S2468823122006496/gr2/DOWNSAMPLED/image/jpeg/b3b085af09ca7642a5c0af4acaf107bf/gr2.jpg gr2 gr2.jpg jpg 52367 344 753 IMAGE-DOWNSAMPLED 1-s2.0-S2468823122006496-gr10.jpg https://s3-eu-west-1.amazonaws.com/prod-ucs-content-store-eu-west/content/pii:S2468823122006496/gr10/DOWNSAMPLED/image/jpeg/7f4ffb1878a9ecc0ca0b6d1512423745/gr10.jpg gr10 gr10.jpg jpg 78384 345 753 IMAGE-DOWNSAMPLED 1-s2.0-S2468823122006496-gr11.jpg https://s3-eu-west-1.amazonaws.com/prod-ucs-content-store-eu-west/content/pii:S2468823122006496/gr11/DOWNSAMPLED/image/jpeg/a32ea888fa0a8f5bc720844c9706b9c4/gr11.jpg gr11 gr11.jpg jpg 77431 342 753 IMAGE-DOWNSAMPLED 1-s2.0-S2468823122006496-gr12.jpg https://s3-eu-west-1.amazonaws.com/prod-ucs-content-store-eu-west/content/pii:S2468823122006496/gr12/DOWNSAMPLED/image/jpeg/d9bbecb471466c482ea2f0775fa16b0b/gr12.jpg gr12 gr12.jpg jpg 70524 339 753 IMAGE-DOWNSAMPLED 1-s2.0-S2468823122006496-gr13.jpg https://s3-eu-west-1.amazonaws.com/prod-ucs-content-store-eu-west/content/pii:S2468823122006496/gr13/DOWNSAMPLED/image/jpeg/39dc9b9c8b0510b80fe4c76b65805dc7/gr13.jpg gr13 gr13.jpg jpg 84445 338 753 IMAGE-DOWNSAMPLED 1-s2.0-S2468823122006496-gr14.jpg https://s3-eu-west-1.amazonaws.com/prod-ucs-content-store-eu-west/content/pii:S2468823122006496/gr14/DOWNSAMPLED/image/jpeg/a85d0f8a8f64991fb971b51417e67f60/gr14.jpg gr14 gr14.jpg jpg 79511 338 753 IMAGE-DOWNSAMPLED 1-s2.0-S2468823122006496-gr15.jpg https://s3-eu-west-1.amazonaws.com/prod-ucs-content-store-eu-west/content/pii:S2468823122006496/gr15/DOWNSAMPLED/image/jpeg/bd259e430b4453615d8578fd6948d4e6/gr15.jpg gr15 gr15.jpg jpg 36132 285 339 IMAGE-DOWNSAMPLED 1-s2.0-S2468823122006496-gr9.jpg https://s3-eu-west-1.amazonaws.com/prod-ucs-content-store-eu-west/content/pii:S2468823122006496/gr9/DOWNSAMPLED/image/jpeg/fc7c4fc9268feaa33544fb4c0fd67b8c/gr9.jpg gr9 gr9.jpg jpg 77791 349 753 IMAGE-DOWNSAMPLED 1-s2.0-S2468823122006496-gr7.jpg https://s3-eu-west-1.amazonaws.com/prod-ucs-content-store-eu-west/content/pii:S2468823122006496/gr7/DOWNSAMPLED/image/jpeg/8e6807f7ddcdc34f13e8d802f0fedfb2/gr7.jpg gr7 gr7.jpg jpg 82740 344 753 IMAGE-DOWNSAMPLED 1-s2.0-S2468823122006496-gr8.jpg https://s3-eu-west-1.amazonaws.com/prod-ucs-content-store-eu-west/content/pii:S2468823122006496/gr8/DOWNSAMPLED/image/jpeg/91aef7f1323c3405f519e26eab2d5ed8/gr8.jpg gr8 gr8.jpg jpg 67321 352 753 IMAGE-DOWNSAMPLED 1-s2.0-S2468823122006496-gr5.jpg https://s3-eu-west-1.amazonaws.com/prod-ucs-content-store-eu-west/content/pii:S2468823122006496/gr5/DOWNSAMPLED/image/jpeg/f54729f53cc8f90352833ec2464777ee/gr5.jpg gr5 gr5.jpg jpg 47197 338 753 IMAGE-DOWNSAMPLED 1-s2.0-S2468823122006496-gr6.jpg https://s3-eu-west-1.amazonaws.com/prod-ucs-content-store-eu-west/content/pii:S2468823122006496/gr6/DOWNSAMPLED/image/jpeg/e4da9c22ff82e1497884ce2a94686ea6/gr6.jpg gr6 gr6.jpg jpg 111013 347 753 IMAGE-DOWNSAMPLED 1-s2.0-S2468823122006496-gr3.jpg https://s3-eu-west-1.amazonaws.com/prod-ucs-content-store-eu-west/content/pii:S2468823122006496/gr3/DOWNSAMPLED/image/jpeg/8046373aaae61ecfd72bf706c0475c74/gr3.jpg gr3 gr3.jpg jpg 25958 289 376 IMAGE-DOWNSAMPLED 1-s2.0-S2468823122006496-gr4.jpg https://s3-eu-west-1.amazonaws.com/prod-ucs-content-store-eu-west/content/pii:S2468823122006496/gr4/DOWNSAMPLED/image/jpeg/e683f923c4f9d008c68163337f43a6b8/gr4.jpg gr4 gr4.jpg jpg 51237 345 753 IMAGE-DOWNSAMPLED 1-s2.0-S2468823122006496-ga1.sml https://s3-eu-west-1.amazonaws.com/prod-ucs-content-store-eu-west/content/pii:S2468823122006496/ga1/THUMBNAIL/image/gif/b02173fdf392a76e475512870bece633/ga1.sml ga1 true ga1.sml sml 8702 88 219 IMAGE-THUMBNAIL 1-s2.0-S2468823122006496-gr16.sml https://s3-eu-west-1.amazonaws.com/prod-ucs-content-store-eu-west/content/pii:S2468823122006496/gr16/THUMBNAIL/image/gif/be199f1f66768b5939f2f58aa95790d9/gr16.sml gr16 gr16.sml sml 8528 88 219 IMAGE-THUMBNAIL 1-s2.0-S2468823122006496-gr1.sml https://s3-eu-west-1.amazonaws.com/prod-ucs-content-store-eu-west/content/pii:S2468823122006496/gr1/THUMBNAIL/image/gif/cacd14a4ab5fc1665b26fdaec766b119/gr1.sml gr1 gr1.sml sml 9824 115 219 IMAGE-THUMBNAIL 1-s2.0-S2468823122006496-gr2.sml https://s3-eu-west-1.amazonaws.com/prod-ucs-content-store-eu-west/content/pii:S2468823122006496/gr2/THUMBNAIL/image/gif/159273ecd91302ec7f07128132c2d601/gr2.sml gr2 gr2.sml sml 5654 100 219 IMAGE-THUMBNAIL 1-s2.0-S2468823122006496-gr10.sml https://s3-eu-west-1.amazonaws.com/prod-ucs-content-store-eu-west/content/pii:S2468823122006496/gr10/THUMBNAIL/image/gif/c0829f9fc5d0246026c6063677a33e80/gr10.sml gr10 gr10.sml sml 10160 100 219 IMAGE-THUMBNAIL 1-s2.0-S2468823122006496-gr11.sml https://s3-eu-west-1.amazonaws.com/prod-ucs-content-store-eu-west/content/pii:S2468823122006496/gr11/THUMBNAIL/image/gif/7016603287d6e81fbd0b4ee4357d10a9/gr11.sml gr11 gr11.sml sml 8780 100 219 IMAGE-THUMBNAIL 1-s2.0-S2468823122006496-gr12.sml https://s3-eu-west-1.amazonaws.com/prod-ucs-content-store-eu-west/content/pii:S2468823122006496/gr12/THUMBNAIL/image/gif/3f53936801f11a660550c82d009971ac/gr12.sml gr12 gr12.sml sml 8796 98 219 IMAGE-THUMBNAIL 1-s2.0-S2468823122006496-gr13.sml https://s3-eu-west-1.amazonaws.com/prod-ucs-content-store-eu-west/content/pii:S2468823122006496/gr13/THUMBNAIL/image/gif/4d0276354f04bcfd129b3c6b10b33b4b/gr13.sml gr13 gr13.sml sml 9857 98 219 IMAGE-THUMBNAIL 1-s2.0-S2468823122006496-gr14.sml https://s3-eu-west-1.amazonaws.com/prod-ucs-content-store-eu-west/content/pii:S2468823122006496/gr14/THUMBNAIL/image/gif/5ae07c470058da1955a5d93914e2d708/gr14.sml gr14 gr14.sml sml 9327 98 219 IMAGE-THUMBNAIL 1-s2.0-S2468823122006496-gr15.sml https://s3-eu-west-1.amazonaws.com/prod-ucs-content-store-eu-west/content/pii:S2468823122006496/gr15/THUMBNAIL/image/gif/dbb11568eeef224023bd4da4e841a489/gr15.sml gr15 gr15.sml sml 10667 164 195 IMAGE-THUMBNAIL 1-s2.0-S2468823122006496-gr9.sml https://s3-eu-west-1.amazonaws.com/prod-ucs-content-store-eu-west/content/pii:S2468823122006496/gr9/THUMBNAIL/image/gif/f2c141516ba6ca35ac003e662cf20362/gr9.sml gr9 gr9.sml sml 9399 101 219 IMAGE-THUMBNAIL 1-s2.0-S2468823122006496-gr7.sml https://s3-eu-west-1.amazonaws.com/prod-ucs-content-store-eu-west/content/pii:S2468823122006496/gr7/THUMBNAIL/image/gif/3780de579878698c81c87777d6b24032/gr7.sml gr7 gr7.sml sml 10694 100 219 IMAGE-THUMBNAIL 1-s2.0-S2468823122006496-gr8.sml https://s3-eu-west-1.amazonaws.com/prod-ucs-content-store-eu-west/content/pii:S2468823122006496/gr8/THUMBNAIL/image/gif/e20fd141e52c7d6c8f3bcd87d95d3aa6/gr8.sml gr8 gr8.sml sml 9578 102 219 IMAGE-THUMBNAIL 1-s2.0-S2468823122006496-gr5.sml https://s3-eu-west-1.amazonaws.com/prod-ucs-content-store-eu-west/content/pii:S2468823122006496/gr5/THUMBNAIL/image/gif/a9650f71e0e2e27a5ae551ea29c6291b/gr5.sml gr5 gr5.sml sml 7078 98 219 IMAGE-THUMBNAIL 1-s2.0-S2468823122006496-gr6.sml https://s3-eu-west-1.amazonaws.com/prod-ucs-content-store-eu-west/content/pii:S2468823122006496/gr6/THUMBNAIL/image/gif/89549778a63bf7be8ea7666e911417dd/gr6.sml gr6 gr6.sml sml 12350 101 219 IMAGE-THUMBNAIL 1-s2.0-S2468823122006496-gr3.sml https://s3-eu-west-1.amazonaws.com/prod-ucs-content-store-eu-west/content/pii:S2468823122006496/gr3/THUMBNAIL/image/gif/a1af8c4f9885e5af2f0270fc7df78c53/gr3.sml gr3 gr3.sml sml 8308 164 213 IMAGE-THUMBNAIL 1-s2.0-S2468823122006496-gr4.sml https://s3-eu-west-1.amazonaws.com/prod-ucs-content-store-eu-west/content/pii:S2468823122006496/gr4/THUMBNAIL/image/gif/64cd908ca0d95b3bee28637279f8b8dc/gr4.sml gr4 gr4.sml sml 7228 100 219 IMAGE-THUMBNAIL 1-s2.0-S2468823122006496-ga1_lrg.jpg https://s3-eu-west-1.amazonaws.com/prod-ucs-content-store-eu-west/content/pii:S2468823122006496/HIGHRES/image/jpeg/ec7f2c3b69c5a8dc200cd0d6a8eccbd3/ga1_lrg.jpg ga1 true ga1_lrg.jpg jpg 107863 536 1333 IMAGE-HIGH-RES 1-s2.0-S2468823122006496-gr16_lrg.jpg https://s3-eu-west-1.amazonaws.com/prod-ucs-content-store-eu-west/content/pii:S2468823122006496/HIGHRES/image/jpeg/dc12057c9eabcd012c1ffd32794b4b47/gr16_lrg.jpg gr16 gr16_lrg.jpg jpg 192456 909 2250 IMAGE-HIGH-RES 1-s2.0-S2468823122006496-gr1_lrg.jpg https://s3-eu-west-1.amazonaws.com/prod-ucs-content-store-eu-west/content/pii:S2468823122006496/HIGHRES/image/jpeg/bb769324c499a912fe39ebaf15306973/gr1_lrg.jpg gr1 gr1_lrg.jpg jpg 132140 873 1667 IMAGE-HIGH-RES 1-s2.0-S2468823122006496-gr2_lrg.jpg https://s3-eu-west-1.amazonaws.com/prod-ucs-content-store-eu-west/content/pii:S2468823122006496/HIGHRES/image/jpeg/8b47cffab9ddd796e59a7e2a9129e937/gr2_lrg.jpg gr2 gr2_lrg.jpg jpg 444206 1523 3333 IMAGE-HIGH-RES 1-s2.0-S2468823122006496-gr10_lrg.jpg https://s3-eu-west-1.amazonaws.com/prod-ucs-content-store-eu-west/content/pii:S2468823122006496/HIGHRES/image/jpeg/10f4d1b05f75d898e0f48267c2f985b9/gr10_lrg.jpg gr10 gr10_lrg.jpg jpg 639723 1529 3333 IMAGE-HIGH-RES 1-s2.0-S2468823122006496-gr11_lrg.jpg https://s3-eu-west-1.amazonaws.com/prod-ucs-content-store-eu-west/content/pii:S2468823122006496/HIGHRES/image/jpeg/428b01e4d4239f0f2d9f0b9a32714ef9/gr11_lrg.jpg gr11 gr11_lrg.jpg jpg 536665 1515 3333 IMAGE-HIGH-RES 1-s2.0-S2468823122006496-gr12_lrg.jpg https://s3-eu-west-1.amazonaws.com/prod-ucs-content-store-eu-west/content/pii:S2468823122006496/HIGHRES/image/jpeg/cd21b365fc2214e4da7b06a8c759dd95/gr12_lrg.jpg gr12 gr12_lrg.jpg jpg 420642 1499 3333 IMAGE-HIGH-RES 1-s2.0-S2468823122006496-gr13_lrg.jpg https://s3-eu-west-1.amazonaws.com/prod-ucs-content-store-eu-west/content/pii:S2468823122006496/HIGHRES/image/jpeg/6291108554841e09aebde39483318665/gr13_lrg.jpg gr13 gr13_lrg.jpg jpg 517565 1495 3333 IMAGE-HIGH-RES 1-s2.0-S2468823122006496-gr14_lrg.jpg https://s3-eu-west-1.amazonaws.com/prod-ucs-content-store-eu-west/content/pii:S2468823122006496/HIGHRES/image/jpeg/76a162626998e0d998ce67c73920530d/gr14_lrg.jpg gr14 gr14_lrg.jpg jpg 468021 1497 3333 IMAGE-HIGH-RES 1-s2.0-S2468823122006496-gr15_lrg.jpg https://s3-eu-west-1.amazonaws.com/prod-ucs-content-store-eu-west/content/pii:S2468823122006496/HIGHRES/image/jpeg/5f90e21d78e2e36056313e1e3b5f8042/gr15_lrg.jpg gr15 gr15_lrg.jpg jpg 241665 1259 1500 IMAGE-HIGH-RES 1-s2.0-S2468823122006496-gr9_lrg.jpg https://s3-eu-west-1.amazonaws.com/prod-ucs-content-store-eu-west/content/pii:S2468823122006496/HIGHRES/image/jpeg/e6d8b6eb798052e77ca8d4b79eca0bbe/gr9_lrg.jpg gr9 gr9_lrg.jpg jpg 522380 1544 3333 IMAGE-HIGH-RES 1-s2.0-S2468823122006496-gr7_lrg.jpg https://s3-eu-west-1.amazonaws.com/prod-ucs-content-store-eu-west/content/pii:S2468823122006496/HIGHRES/image/jpeg/079c1cc6b22b29e5f9ce71724ff32304/gr7_lrg.jpg gr7 gr7_lrg.jpg jpg 662637 1524 3333 IMAGE-HIGH-RES 1-s2.0-S2468823122006496-gr8_lrg.jpg https://s3-eu-west-1.amazonaws.com/prod-ucs-content-store-eu-west/content/pii:S2468823122006496/HIGHRES/image/jpeg/411f111631a0c667f10b266b0000aa1d/gr8_lrg.jpg gr8 gr8_lrg.jpg jpg 452423 1558 3333 IMAGE-HIGH-RES 1-s2.0-S2468823122006496-gr5_lrg.jpg https://s3-eu-west-1.amazonaws.com/prod-ucs-content-store-eu-west/content/pii:S2468823122006496/HIGHRES/image/jpeg/626b779fe199e3d090163e70153c374e/gr5_lrg.jpg gr5 gr5_lrg.jpg jpg 371434 1496 3333 IMAGE-HIGH-RES 1-s2.0-S2468823122006496-gr6_lrg.jpg https://s3-eu-west-1.amazonaws.com/prod-ucs-content-store-eu-west/content/pii:S2468823122006496/HIGHRES/image/jpeg/d40ffddb15920e31e3f48260083bf0cf/gr6_lrg.jpg gr6 gr6_lrg.jpg jpg 720056 1537 3333 IMAGE-HIGH-RES 1-s2.0-S2468823122006496-gr3_lrg.jpg https://s3-eu-west-1.amazonaws.com/prod-ucs-content-store-eu-west/content/pii:S2468823122006496/HIGHRES/image/jpeg/c3b4d91ecd416bab9a971fef0b63f184/gr3_lrg.jpg gr3 gr3_lrg.jpg jpg 193764 1281 1667 IMAGE-HIGH-RES 1-s2.0-S2468823122006496-gr4_lrg.jpg https://s3-eu-west-1.amazonaws.com/prod-ucs-content-store-eu-west/content/pii:S2468823122006496/HIGHRES/image/jpeg/c99d8d4a0f154f275d5945218c28a0a7/gr4_lrg.jpg gr4 gr4_lrg.jpg jpg 405874 1528 3333 IMAGE-HIGH-RES 1-s2.0-S2468823122006496-am.pdf https://s3-eu-west-1.amazonaws.com/prod-ucs-content-store-eu-west/content/egi:100GG8VSRQ0/MAIN/application/pdf/659753e2c23bf8bb551c7b690b81f8c2/am.pdf am am.pdf pdf false 3799150 AAM-PDF MCAT 112763 112763 S2468-8231(22)00649-6 10.1016/j.mcat.2022.112763 Elsevier B.V. Fig. 1 Schematic diagram of the experimental setup for activity testing. Fig 1 Fig. 2 XRD spectra of different Mn loading(a) and different H2SO4 amounts(b). Fig 2 Fig. 3 Raman spectrum of the catalyst. Fig 3 Fig. 4 NH3-TPD of different Mn loadings(a) and different H2SO4 amounts(b). Fig 4 Fig. 5 H2-TPR of different Mn loadings(a) and different H2SO4 amounts(b). Fig 5 Fig. 6 XPS spectra (Ce 3d) of different Mn loadings (a) and different H2SO4 amounts (b). Fig 6 Fig. 7 XPS spectra (Mn 2p) of different Mn loadings(a) and different H2SO4 amounts(b). Fig 7 Fig. 8 XPS spectra (P 2p) of different Mn loadings(a) and different H2SO4 amounts(b). Fig 8 Fig. 9 XPS spectra (S 2p) of different Mn loadings(a) and different H2SO4 amounts(b). Fig 9 Fig. 10 XPS spectra (O 1 s) of different Mn loadings(a) and different H2SO4 amounts(b). Fig 10 Fig. 11 Denitrification performance of different Mn loading(a) and different H2SO4 amounts(b). Fig 11 Fig. 12 In-situ infrared spectra of NH3(a) and NO+O2(b) adsorption of catalyst at the optimal temperature. Fig 12 Fig. 13 In-situ infrared spectra of NH3(a) and NO+O2(b) adsorption of catalyst at different temperatures. Fig 13 Fig. 14 In-situ infrared spectra of NH3(a) or NO+O2(b) pre-adsorption. Fig 14 Fig. 15 Sulphur and water resistance test chart for the catalysts. Fig 15 Fig. 16 The catalyst surface reaction mechanism diagram. Fig 16 Table 1 The element peak area proportions of catalyst with different Mn loading. Table 1 Ce3+ /(Ce3++Ce4+) (Mn3++Mn4+) /(Mn4++Mn3++Mn2+) Mn4+ /(Mn4++Mn3++Mn2+) PO4 3− /(PO3 −+PO4 3−) O''/(O'+O''+O''') 5%Mn 21.64% 53.36% 23.28% 33.70% 53.04% 10%Mn 24.2% 58% 25.40% 46.10% 61.75% 12%Mn 29.88% 51.59% 6.81% 54.80% 58.76% 15%Mn 23% 59.47% 42.05% 52.03% 56.77% Table 2 The element peak area proportions of catalyst with different H2SO4 amounts. Table 2 Ce3+ /(Ce3++Ce4+) (Mn3++Mn4+) /(Mn4++Mn3++Mn2+) Mn4+ /(Mn4++Mn3++Mn2+) PO4 3− /(PO3 −+PO4 3−) O''/(O'+O''+O''') 0 mol/L 18.51% 37.67% 9.51% 30.15% 41.97% 0.6 mol/L 29.88% 51.59% 6.81% 54.80% 58.76% 1 mol/L 19.80% 47.57% 29.19% 29.19% 52.26% Review Study on NH3-SCR performance and mechanism of Mn supported SO4 2−-CeCO3F-CePO4 catalysts Na Li a b Chenhao Ren a Limin Hou a Kunlin Jiao a Wenfei Wu a c ⁎ a School of Environment and Energy, Inner Mongolia University of Science & Technology, Inner Mongolia, Baotou 014010, China School of Environment and Energy Inner Mongolia University of Science & Technology Inner Mongolia Baotou 014010 China aSchool of Environment and Energy, Inner Mongolia University of Science & Technology, Inner Mongolia, Baotou 014010, China b School of Environmental Science and Engineering, North China Electric Power University, Baoding, Hebei 071000, China School of Environmental Science and Engineering North China Electric Power University Baoding Hebei 071000 China bSchool of Environmental Science and Engineering, North China Electric Power University, Baoding, Hebei 071000, China c Key Laboratory of Efficient and Clean Combustion, Inner Mongolia, Baotou 014010, China Key Laboratory of Efficient and Clean Combustion Inner Mongolia Baotou 014010 China cKey Laboratory of Efficient and Clean Combustion, Inner Mongolia, Baotou 014010, China ⁎ Corresponding author. In this paper, NH3-SCR catalysts were prepared by impregnating transition metal Mn loaded on SO4 2−-CeCO3F-CePO4 and adding sulphuric acid to further improve the denitrification performance of the catalysts. The optimum performance of the catalysts was explored by varying the loading ratio of Mn and the concentration of sulphuric acid. XRD, Raman, NH3-TPD, H2-TPR, XPS and In situ DRIFTS were used to characterise the changes in the surface properties of the catalyst after loading with Mn and to investigate the reaction mechanism. The results show that the denitrification performance of the catalyst was improved after the loading of Mn and sulphuric acid treatment, and the temperature window became wider, with the denitrification rate consistently remaining above 80% at 200∼400 °C and the denitrification activity reaching 92.6% at 250 °C. Suitable Mn and sulphuric acid content allow for greater Mn-Ce interactions, resulting in better dispersion of active substances such as Mn oxides, MnSO4 and MnSO3, which can provide more adsorption and active sites and increase the reaction rate. The Mn atoms replace some of the Ce atoms in the CeO2 lattice, increasing the mobility of oxygen and thus improving the low-temperature activity of the catalyst. In situ IR results show that the catalyst follows both the Eley-Rideal mechanism and the Langmuir-Hinshelwood mechanism at 250 °C. The acidic sites on the surface are abundant and the Lewis acidic sites are the main active sites on the catalyst surface. Both mechanisms work together to facilitate the denitrification reaction. Graphical abstract Image, graphical abstract Keywords Mn-loaded Sulphation NH3-SCR Denitrification mechanism Data Availability The authors do not have permission to share data. 1 Introduction Nitrogen oxides (NOx) are one of the major air pollution problems and are extremely harmful to the ecological environment and human health. Selective Catalytic Reduction (SCR) using NH3 as the reducing agent is currently the preferred method of treating NOx in coal-fired power plants worldwide. The core of the technology is the preparation of the catalyst. Currently, commercial flue gas denitrification catalysts are mainly V2O5-WO3-MoO3/TiO2, but there are many disadvantages in the use of this catalyst, such as high denitrification activity window, high production cost, the toxicity of active ingredients, and easy to cause secondary pollution, so it is necessary to develop a new catalyst that is economically efficient and environmentally friendly. In recent years, research on catalysts has focused on both the active component and carrier performance. Compared with conventional carriers such as CePO4 and TiO2, SO4 2−-CeCO3F-CePO4 has inherently good catalytic properties, a wide temperature window and good resistance to sulfur and water, without causing adverse effects on the environment [1]. It has the potential to be a carrier with excellent properties. It was found that the transition metal Mn is a multivalent element that can form several stable oxides and the interconversion between ions facilitates the redox performance of the catalyst. Cheng Liu [2] loaded MOx (M=Cu, Mn, Co) onto CePO4 carriers by hydrothermal and impregnation methods, and the results showed that the denitrification activity of the MnOx/CePO4 catalyst was the highest, and the modification of MnOx greatly improved the low-temperature SCR activity, which still reached more than 80% at 180 °C. In addition, the MOx/CePO4 catalyst also showed good water resistance and N2 selectivity. Xiaojiang Yao [3] prepared a series of MnOx/CeO2 catalysts by adjusting the solvents (deionized water, anhydrous ethanol, acetic acid, oxalic acid solution) to improve the performance of low-temperature NH3-SCR, and the results showed that the MnOx/CeO2 catalysts prepared with the oxalic acid solution as the solvent had the best catalytic performance in the range of 100∼250 °C, with The NO conversion was over 80% and the low-temperature sulphur and water resistance was good, which may be attributed to the enhanced electronic interaction between MnOx and CeO2 by the solvent oxalic acid, which improved the oxygen vacancies in the carrier CeO2, resulting in improved denitrification performance. Runduo Zhang [4] prepared LaMnO3, LaMnO3/TiO2 and LaMnO3/CeO2 catalysts and investigated the effect of the carriers on the low-temperature catalytic performance of NH3-SCR. The study showed that the best low-temperature catalytic performance was achieved with CeO2 as the carrier, mainly because the interaction between LaMnO3 and CeO2 was conducive to the movement of lattice oxygen when the temperature was less than 200 °C, which could promote the partial oxidation of NO to NO2 and make the NO reduction reaction proceed according to the fast NH3-SCR reaction, thus significantly improving its low-temperature catalytic performance. In this paper, medium and low temperature denitrification catalysts were prepared by loading Mn onto SO4 2−-CeCO3F-CePO4. The effect of Mn element and sulphuric acid on the denitrification performance of the catalyst NH3-SCR was investigated, and the catalytic reaction pathway and denitrification mechanism were studied. 2 Experimental part 2.1 Experimental materials The names of the chemical reagents used in this experiment are cerium nitrate (Ce(NO3)3·6H2O), sodium bicarbonate (NaHCO3), sodium fluoride (NaF), phosphoric acid (H3PO4), 98% sulfuric acid (H2SO4) and manganese nitrate (Mn(NO3)2), all of which are analytically pure and purchased from Sinopharm Chemical Reagent Co. The gases used in this experiment were ammonia (NH3) and nitric oxide (NO) from Xuzhou Special Gas Factory, oxygen (O2) and nitrogen (N2) from Baotou Fuhua Gas Co. 2.2 Preparation of the catalyst Different masses of manganese nitrate were placed in 20 ml of water and stirred until dissolved. 2 g of SO4 2−-CeCO3F-CePO4 sample [1] was added to the solution, sonicated for 2 h, dried in a drying oven at 80 °C and roasted at 500 °C for 2 h to obtain Mn(0%, 5%, 8%, 10%, 12%, 15%)/SO4 2−-CeCO3F-CePO4 catalyst samples in different ratios of Mn to the carrier. The above-derived optimum loading of Mn in Mn nitrate was placed in 20 ml of water and stirred until dissolved. 2 g of samples after acid leaching with different sulphuric acid amounts (0, 0.6, 1 mol/L) were added to the solution, sonicated for 2 h, dried in a drying oven at 80 °C and roasted at 500 °C for 2 h to obtain samples of Mn/SO4 2−-CeCO3F-CePO4 catalysts with different sulphuric acid modification amounts. 2.3 Evaluation of the activity of the catalyst The experimental apparatus for activity testing is mainly composed of a precision gas mixing chamber-flow metre, quartz tube, riser furnace, sampler, Fourier infrared spectroscopy flue gas analyser and computer data acquisition system, the experimental setup is shown in Fig. 1 . First determine whether the gas line is well sealed, carry out a constant gas flow test in the empty tube so that the gas flow in the gas line is constant at room temperature and the gas content detected is constant for the flue gas analyser (GASMET DX4000, calibrated from ppm level to percentage content level with an analytical accuracy of ±3% of the corresponding calibration range). Quartz wool and samples were then added for temperature rise testing, the temperature point was set to rise 50 °C/5 min and the denitrification performance of the catalyst was tested in the range of 100∼550 °C. The constant temperature at the checkpoint was 30 min and the gas content measured was the volumetric concentration of NO, NO2, N2O, NH3 and O2. The simulated gas components are as follows: 500 ppm NO, 500 ppm NH3, 3 vol% O2 and N2 as equilibrium gas with a total gas flow of 100 mL/min and a volumetric air velocity of 10,000h−1. The denitrification efficiency (NOx conversion) and N2 selectivity of the catalysts are calculated by Eqs. (1) and (2), respectively. (1) C R NO x = ( NO x ) in − ( NO x ) out ( NO x ) in × 100 % (2) S N 2 = ( 1 − 2 ( N 2 O ) out ( NO x ) in + ( NH 3 ) in − ( NO x ) out − ( NH 3 ) out ) × 100 % Where (NOx)in, (NH3)in are the volumetric concentrations of NOx and NH3 detected at the inlet of the flue gas simulation system after smoothing, ppm; (NOx)out, (NH3)out, (N2O)out are the volumetric concentrations of NO, NH3 and N2O detected by the flue gas analyser at the outlet of the flue gas simulation system detection, ppm. 2.4 Catalyst characterization and equipment The characterisation and equipment used in this paper are as follows: The denitration performance of the catalyst was analysed using a Fourier infrared flue gas analyser from GASMET (DX4000, Finland). Physical phase analysis of the catalyst using an X-ray diffractometer (XRD) (PERSEE XD-3, China). Raman spectroscopy of the catalysts, using a DXR type spectrometer from Thermo Fisher. Analysis of the acid intensity and qualitative analysis of the acid amount of the catalyst, using a PCA-1200 multifunctional chemisorbed (NH3-TPD, H2-TPR) (Beijing). Analysis of elemental valence on the catalyst surface, using an EDX1800E instrument (XPS) from Tianrui Instruments Ltd. In situ IR sorption experiments using a VERTEX Model 70 Fourier Transform Infrared Spectrometer (DRIFTS) (Bruker, Germany) (including an MCT detector and a high-temperature micro-infrared accessory). 3 Results and discussion 3.1 XRD To study the phase structure changes on the catalyst surfaces with different Mn loadings, XRD analysis was carried out, as shown in Fig. 2 (a). MnO2 diffraction peaks appear at 2θ=43° and 61°, but the peak shapes are small, which is attributed to the fact that Mn enters the surface of the carrier in the form of ions, and is converted into Mn oxide after high-temperature calcination, so the dispersion is better [5]. The diffraction peaks of MnSO4 and MnSO3 species can also be detected from XRD. Studies have shown that metal sulfates have very excellent catalytic performance. Compared with metal oxides, denitration catalysts with metal sulfates as active components have higher denitration activity and a wider temperature window [6,7], which may be one of the reasons for the enhanced activity after Mn loading. After loading Mn, the peak of CeO2 shifts, and the half-peak width broadens, and the broadening is most obvious when the loading is 12%, indicating that Mn and Ce interact after loading Mn, and the interaction is larger when the loading is 12%, which is beneficial to The SCR reaction proceeds. After loading the active material Mn, XRD analysis was carried out on the Mn/SO4 2−-CeCO3F-CePO4 catalysts with different amounts of sulfuric acid, as shown in Fig. 2(b). It is found that after acidification of H2SO4, the diffraction peaks of MnSO4 and MnSO3 species can be detected from XRD. The catalyst with metal sulfate as the active component has higher denitration activity and a wider temperature window. At the same time, the diffraction peak of Mn3O4 appears, but with the increase of H2SO4 content, the diffraction peaks of the active species (CePO4, CeO2 and Ce7O12) on the catalyst surface were enhanced, which inhibited the catalytic activity. It shows that when the amount of H2SO4 is too large, the crystallinity of the main active substance will increase and its activity will be inhibited. 3.2 Raman spectroscopy To gain an in-depth understanding of the structural composition of the catalyst after loading Mn, the Raman test was carried out on the catalyst, as shown in Fig. 3 . When Mn is not loaded, a sharp Raman peak of CeO2 appears near 461 cm−1 [8], and there is a Raman peak near 1020 cm−1, which belongs to the Ce-O vibration peak of CePO4 [2]. After loading Mn, the Mn/SO4 2−-CeCO3F-CePO4 catalyst showed CeO2 Raman peaks between 428∼439 cm−1. Compared with the Raman shifts without Mn loading, the peak intensities became weaker. This may be because Mn atoms are doped into the lattice of CeO2, resulting in the deformation of the CeO2 lattice. To reduce the distortion, the Raman shift moves to the direction of low wavenumber. On the other hand, the lattice substitution can also cause the splitting of the active vibrational modes of F2g. The oxygen vacancies caused by the substitution of low-valent cations Mn3+ and the shrinkage of the unit cell caused by the doping of the smaller radius ions Mn3+ (0.065 nm [9]) will both promote the shift of the characteristic peaks of the F2g fluorite structure of CeO2 to lower wavenumbers [10]. When the addition amount of Mn was 12%, the distance of this characteristic peak shifted to the low wavenumber was the largest, indicating that its interaction with CeO2 was the strongest and the oxygen mobility was the largest. According to Spanier [11], the increase of the unit cell constant can be used to explain the phenomenon of Raman shift moving to low wavenumber. The previous XRD analysis shows that the diffraction peaks of CeO2 are broadened, indicating that the reduction of catalyst particle size increases the unit cell constant, which is consistent with the movement of Ce-O bonds to low wavenumbers. The above analysis shows that Mn atoms replace some Ce atoms in the CeO2 lattice, which increases the mobility of oxygen, thereby improving the low-temperature activity of the catalyst. 3.3 NH3-TPD To investigate the number of acid centres and the variation in acid strength of the catalysts with different Mn loadings, the Mn/SO4 2−-CeCO3F-CePO4 catalysts were experimentally investigated for NH3-TPD, as shown in Fig. 4 (a). Peaks less than 200 °C are attributed to desorption peaks resulting from the adsorption of NH3 and NH3 on weakly acidic sites physically adsorbed on the sample surface. The peaks from 200∼400 °C are attributed to the desorption peaks arising from the desorption of medium to strong acidic sites. Peaks greater than 400 °C are attributed to desorption peaks arising from the desorption of strongly acidic sites. As can be seen from the graph, the Mn loading of 10% produced a desorption peak at the weakly acidic site and two peaks at the strongly acidic site. The three peaks produced at 12% Mn loading were attributed to peaks in the weakly acidic site, peaks in the moderately strong acidic site and peaks in the strong acidic site. The Mn loading of 15% did not produce a desorption peak from the adsorption of NH3 on the weakly acidic sites, but a desorption peak was produced at 277 °C, which was attributed to the desorption of the medium to strong acidic sites. Although the peak area when unloaded with Mn was larger than that when loaded with Mn, the peak area was mainly concentrated in the desorption peaks generated by adsorption on the weakly acidic sites, and the peak areas of the desorption peaks generated on the medium and strong acidic sites were small, indicating that the amount of acid was mainly concentrated on the weakly acidic sites, and the desorption peaks generated on the weakly acidic sites were unstable. The amount of acid in the medium to strong acidic sites and in the strong acidic sites increased after Mn loading, suggesting that the addition of Mn promoted the production of higher strength acidic sites. The peak area was greatest at 12% Mn loading, indicating the greatest amount of acid, which corresponds to the denitrification activity. The experimental study of NH3-TPD was carried out on Mn/SO4 2−-CeCO3F- CePO4 catalysts with different amounts of sulphuric acid after loading with the active substance Mn, as shown in Fig. 4(b). The peak area of the catalyst increased after acidification with sulphuric acid, with the largest peak area at a concentration of 0.6 mol/L, indicating that the relative number of desorbed species was greatest at this time. Desorption peaks were generated near 200 °C, at 300 °C and greater than 400 °C, attributed to weakly acidic sites on the catalyst surface, moderately strongly acidic sites and strongly acidic sites, respectively, with no decrease in the number of adsorption sites and an increase in peak area, indicating that the strongest adsorption capacity of NH3 was indicated at this time, corresponding to the denitrification activity. However, when the sulphuric acid amount was 1 mol/L, the peak area increased compared to that of unsulphated, but the number of acid sites became smaller, and there was only a more obvious desorption peak at less than 200 °C, indicating that the amount of adsorbed material on the surface of the catalyst was small, which reduced its denitrification activity, and although the peak area increased compared to that of unsulphated, the number of acid sites decreased significantly, making the adsorption capacity of NH3 weaker. 3.4 H2-TPR To investigate the effect of different Mn loadings on the redox properties of Mn/SO4 2−-CeCO3F-CePO4, H2-TPR tests were carried out, as shown in Fig. 5 (a). The stronger redox properties increase the rate of conversion of NO to NO2 and the reactivity of the reaction. It can be seen from the graph that after loading Mn, a reduction peak appears at 530∼580 °C, corresponding to the reduction of Mn3+→Mn2+ [12] The reduction peak at 731 °C corresponds to the reduction of the bulk phase Ce4+ to Ce3+ on the catalyst surface, and the peak here shifts towards the lower temperature section after loading with Mn, indicating that Mn promotes the reduction of the bulk phase Ce4+ to Ce3+ on the catalyst surface, resulting in a higher reduction, corresponding to the denitrification activity. The overall peak area was greatest at 12%Mn loading, indicating the strongest reduction capacity, which corresponds to the trend in catalyst activity. After loading with the active substance Mn, the Mn/SO4 2−-CeCO3F-CePO4 catalysts with different amounts of sulphuric acid were tested for H2-TPR, as shown in Fig. 5(b). It can be seen from the graph that a reduction peak appears at 731 °C, corresponding to the reduction of the bulk phase Ce4+ to Ce3+ on the catalyst surface. At 0.6 mol/L sulphuric acid, the position of the secondary reduction peak remains the same, but the peak area increases, and at 1 mol/L sulphuric acid, the secondary reduction peak is shifted towards the low-temperature section, but the peak area is significantly reduced. A reduction peak at 530∼580 °C corresponds to the reduction of Mn3+→Mn2+ [12]. The peak here is significantly enhanced at 0.6 mol/L and disappears again at 1 mol/L, indicating that the right amount of sulphuric acid plays a decisive role in the reduction of Mn3+→Mn2+. The graph also shows the order of peak areas: 0.6 mol H2SO4 > 0 mol H2SO4 > 1 mol H2SO4, which corresponds to the reduction capacity of the catalyst and corresponds to the trend in catalyst activity. 3.5 XPS The catalyst surface composition and chemical state have an important influence on the catalytic activity. To investigate the effect of Mn loading and sulphate acidification and sulphuric acid amount on the elemental valence of the Mn/SO4 2−-CeCO3F-CePO4 catalyst, XPS tests were carried out on samples for Ce, Mn, P, S and O elements. As shown in Fig. 6 , the XPS spectrum of Ce 3d shows that there are eight characteristic peaks in the Ce 3d spectrum. amongst them, u(900.8 eV), u\"(907.5 eV), u\"'(916.5 eV), v(882.3 eV), v\"(888.9 eV), v\"'(898.4 eV) belong to Ce4+, u'(903.8 eV), the characteristic peak of v'(884.7 eV) belongs to Ce3+ [13,14] From the XPS spectrum of Ce 3d in Fig. 6(a), it can be seen that the peaks attributed to Ce3+ and Ce4+ are shifted to higher energy levels after loading Mn, indicating that the electron cloud of Cen+ species changes after loading Mn, driven by the induction effect of Mnn+ species. As shown in Table 1 , the order of Ce3+/(Ce4++Ce3+) ratio was Mn(12%)>Mn(10%)>Mn(15%)>Mn(5%), which corresponded to the denitrification activity, indicating that the Mn loading had a greater effect on the conversion ability of Ce4+ to Ce3+. The proportion of Ce3+ was the largest when the Mn loading was 12%, and Ce3+ moved the largest distance toward the higher energy level, indicating that Ce3+ was one of the main factors affecting the denitrification activity. From the XPS spectrum of Ce 3d in Fig. 6(b), it can be seen that all the characteristic peaks attributed to Cen+ are shifted towards the high binding energy after sulfuric acidification, implying that the Cen+ electron cloud is changed, which may be driven by the induced effect of sulfuric acid leading to the change of the electron cloud. It can be seen from Table 2 that the ratio of Ce3+/(Ce4++Ce3+) increased after sulfuric acid acidification, and the largest ratio was found at 0.6 mol/L. The available literature shows that the higher the ratio of Ce3+/(Ce4++Ce3+), the higher the catalyst has unsaturated chemical energy band and more oxygen vacancies, which will promote the NH3 adsorption of the reactant substances, and Ce3+ can promote the oxidation of NO to NO2, thus improving the activity of the catalyst [15–17]. It is shown that sulfuric acid acidification can promote the conversion of Ce4+ to Ce3+ and the improvement of denitrification activity of the catalyst. The XPS spectra of Mn 2p with different Mn loadings are shown in Fig. 7 (a). The characteristic peaks with binding energies in the range of 641.1 eV belong to Mn2+, 642.1 eV to Mn3+, and 644.1 eV to Mn4+ [18]. The characteristic peaks of Mnn+ are all shifted toward higher binding energies compared to the binding energies of the standard characteristic peaks, indicating that the Mn species interacted with the carrier as the active component, with the largest shift distance at 12% Mn loading and the most pronounced shift for Mn4+, indicating that the interaction between Mn4+ and the carrier had a significant effect on denitrification activity. It has been shown that Mn4+ species are more active than other Mn species and that increased levels of Mn4+ species can facilitate the oxidation of species in the NH3-SCR reaction [19–23]. It has also been suggested that the larger the ratio of (Mn3++Mn4+)/(Mn4++Mn3++Mn2+), the better the redox cycle of the manganese oxide can be achieved [24–26]. As can be seen from Table 1, the ratio of Mn3+ and (Mn3++Mn4+) for the catalyst with the best denitrification efficiency is not the greatest, indicating that the element Mn is not at its optimum at this time and that its superior denitrification performance is derived from the other elements and inter-element interactions. The XPS spectra of Mn 2p acidified with different amounts of H2SO4 are shown in Fig. 7(b). In agreement with the results shown in Fig. 7(a), the characteristic peaks of Mnn+ were all shifted toward the high binding energy, indicating that Mnn+ interacts with other substances as the active component. As can be seen from Table 2, the ratio of catalyst (Mn3++Mn4+)/(Mn4++Mn3++Mn2+) was greatest for a sulphuric acid amount of 0.6 mol/L, which corresponds to the H2-TPR results. The XPS spectra of P 2p are shown in Fig. 8 (a). 134.3 eV characteristic peaks are attributed to PO3 − and 133.2 eV characteristic peaks are attributed to PO4 3− [27,28]. It can be seen from Table 1 that the ratio of PO4 3−/(PO4 3−+PO3 −) on the catalyst surface shows a trend of increasing and then decreasing with the increase of Mn loading. The maximum ratio of PO4 3−/(PO4 3−+PO3 −) was observed at 12% of Mn loading, which indicates that the P element on the catalyst surface is mainly in the form of PO4 3− at this time. It has been shown that PO3 − hinders the reduction cycle of Ce4+ [29], which corresponds to the H2-TPR results. The XPS spectra of different sulfate acidified P 2p are shown in Fig. 8(b). As can be seen from Table 2, the ratio of PO4 3−/(PO4 3−+PO3 −) is maximum when the amount of H2SO4 is 0.6 mol/L, and the ratio of PO4 3−/(PO4 3−+PO3 −) decreases when the amount of H2SO4 increases to 1 mol/L, indicating that the PO3 − content on the surface of the catalyst sample is too large at this time, which will hinder the reduction cycle of Ce4+, which corresponds to the H2-TPR results corresponding to the H2-TPR results. The XPS spectra of S 2p both consist of two peaks, as shown in Fig. 9(a). 169.4 eV is attributed to S 2p1/2 photoelectron emission and 168.3 eV to S 2p3/2 photoelectron emission, both of which are signs of the presence of S6+ [30,31]. As can be seen from the figure, the overall shift of the binding energy of S 2p toward higher binding energy after loading Mn indicates that Mn interacts with the sulfate ion and possibly generates the new substance MnSO4, which is consistent with the results of XRD analysis. The XPS spectra of S 2p after sulfate acidification are shown in Fig. 9(b). Both peaks attributed to S6+ appeared in the figure, indicating the formation of sulfate species after sulfuric acidification. The peak at the sulfuric acid amount of 1 mol/L is shifted to lower binding energy compared to that at 0.6 mol/L, indicating that sulfuric acidification can cause the interaction between Fe and Ce species and sulfate species. The peak area attributed to the S 2p3/2 photoelectron emission occurring at the binding energy of 168.3 eV was significantly larger at 0.6 mol/L than at 1 mol/L sulfuric acid, confirming that the species attributed to this peak may promote some of the catalyst activity. The O 1 s XPS spectra all consisted of three peaks, and the O 1 s XPS spectra for different Mn loadings are shown in Fig. 10 (a). The characteristic peak at 533∼534 eV belongs to the characteristic peak of molecular adsorbed oxygen, marked as O', and the oxygen species near 531.3∼531.9 eV belongs to the characteristic peak produced by atomic adsorption of oxygen, marked as O'', near 529.3∼530.0 eV Oxygen species appearing are assigned to characteristic peaks of lattice oxygen species, marked as O'''. As can be seen from the graphs, the catalysts loaded with Mn have both molecularly and atomically adsorbed oxygen species, as well as lattice oxygen species, and the atomically adsorbed oxygen species are predominant. From Table 1, it can be seen that the proportion of O'' is the largest at 10% of Mn, but the denitrification performance is not optimal, probably because its shift towards higher binding energy found at too large a distance, which inhibits part of the denitrification activity. The Mn loading was 12% and the O'' ratio was not the highest, but the denitrification activity was the best, indicating that the interaction between elements on the catalyst surface had a significant effect on the denitrification performance. The XPS spectra of O 1 s acidified with different amounts of H2SO4 are shown in Fig. 10(b). As can be seen from the graph, the large increase in oxygen adsorbed on the catalyst surface after sulphation is a result of the action of sulphuric acid. With the addition of sulphuric acid, the proportion of surface adsorbed oxygen O'' rises from 41.97% to 58.76% and then decreases to 52.26%, indicating that the amount of sulphuric acid is not the larger the better, too much sulphuric acid will reduce the surface adsorbed oxygen content and inhibit the NH3-SCR reaction, as opposed to denitrification activity. 3.6 Catalytic NH3-SCR performances To test the denitration catalytic performance of Mn/SO4 2−-CeCO3F-CePO4 catalyst with different Mn loads (Loads: 0%, 5%, 8%, 10%, 12%, 15%). As shown in Fig. 11 (a), the denitration performance of the catalyzer tends to increase first and then decrease with the increase of Mn load. At 12%, the denitrification rate is the highest. In the range of 200 °C to 400 °C, the denitration rate is greater than 80%, maintained at a high level, 250 °C reached 92%. When the loading amount is 5%, the denitration efficiency is less than that of unloaded Mn. The denitrification efficiency when the loading amount is 8% is significantly higher than that when no Mn is loaded, and the denitration efficiency increases significantly from 200 °C. When the loading amount is 8%, 10%, and 12%, the denitration efficiency changes in a similar way, and it decreases significantly at 15%. This may be because the high concentration of active substances is easier to crystallize and sinter, which affects the denitration activity [32]. It shows that the optimal loading of Mn is 12%, the denitration activity has been improved from the low temperature of 150 °C, and the temperature window has become wider. At 200∼400 °C, the denitrification rate was always above 80%, and at 250 °C, the denitration activity reached a maximum of 92.6%. It can be seen from the small graph in Fig. 11(a) that when the transition metal Mn is loaded, the N2 selectivity increases only when the loading amount is 5%, and the N2 selectivity decreases when the loading amount exceeds 8%. The reason for this phenomenon may be that the MnO2 species in the catalyst has a strong oxidizing ability, which increases the production of by-product N2O in the NH3-SCR reaction, resulting in a decrease in the N2 selectivity of the catalyst [33,34]. After loading Mn, the denitration catalytic performance of Mn/SO4 2−-CeCO3F-CePO4 catalysts with different amounts of sulfuric acid (the amount of sulfuric acid was 0 mol/L, 0.6 mol/L, and 1 mol/L, respectively) was tested, in Fig. 2(b) shown. It can be found that the denitration activity of the catalyst increases first and then decreases when the carrier is not sulfated, reaching a maximum of 81.4% at 300 °C, and the activity decreases significantly after 300 °C. When the amount of sulfuric acid is 0.6 mol/L, the denitration activity of the catalyst in each temperature section is improved compared with that of the non-sulfated catalyst. The highest activity reaches 92.6%, and the temperature window becomes wider. However, when the amount of sulfuric acid increased to 1 mol/L, the denitration activity decreased significantly. The denitration activity below 300 °C was lower than that of the unsulfated one, and the denitration activity above 350 °C was higher than that of the unsulfated one. The overall denitration activity was lower than that of the catalyst when the amount of sulfuric acid was 0.6 mol/L, indicating that the appropriate amount of sulfuric acid had a great influence on the activity of the catalyst. It can be seen from the small graph in Fig. 11(b) that the N2 selectivity increases significantly after sulfuric acid acidification. With the increase of the sulfuric acid amount, the N2 selectivity increases, indicating that sulfuric acid acidification has an important influence on the N2 selectivity. 3.7 In situ drifts From the activity test results, it can be seen that the 12% loaded Mn/SO4 2−-CeCO3F-CePO4 catalyst exhibited a NOx conversion of 80% over a wide temperature range of 200 °C∼400 °C, with the best at 250 °C and a NOx conversion of 92%. The N2 selectivity of the catalyst was reduced compared to the unloaded version but remained between 70% and 80%. In this section, the mechanism of NH3-SCR reaction with Mn/SO4 2−-CeCO3F-CePO4 catalyst is investigated and discussed. 3.7.1 Variation of NH3 and NO+O2 adsorption on the catalyst with time Fig. 12 (a) shows the infrared spectrum of NH3 adsorption with time for the Mn/SO4 2−-CeCO3F-CePO4 catalyst obtained after loading with Mn at 250 °C. As can be seen from the graph, when NH3 was passed through for 5 min, three distinct IR absorption peaks appeared on the catalyst surface at 1774 cm−1, 1639 cm−1 and 1421 cm−1. The absorption peak at 1774 cm−1 is attributed to an absorption peak due to weakly adsorbed or gaseous NH3 [35], and the absorption peak at 1639 cm−1 is attributed to the dehydrogenation product -NH2 species of the Lewis acid centre adsorbed NH3 species. The absorption peak at 1421 cm−1 belongs to the deformation vibration of the NH bond in the Brønsted acid centre adsorbed NH4 + species. With increasing passage time, at 10 min, only the absorption peak of -NH2 species was present on the catalyst surface, thus indicating a faster activation rate of NH3 adsorption at the Lewis acidic site on the catalyst surface, which facilitates the reaction. From 20 to 30 min, two new absorption peaks appeared on the surface of the catalyst at 1248 cm−1 and 1722 cm−1, which were respectively attributed to the NH3 species adsorbed by the Lewis acid centre and the dehydrogenation product NH3 + species of the Brønsted acid centre adsorbed NH4 + species [36]. With the purging of N2, the absorption peaks at 1421 cm−1 for NH4 + species belonging to the Brønsted acid centre and at 1248 cm−1 for NH3 species belonging to the Lewis acid centre weakened, while the absorption peak at 1722 cm−1 disappeared, indicating their susceptibility to adsorption. However, NH3 species belonging to the Lewis acid centre adsorbed on the catalyst surface appeared at 1615 cm−1, indicating that the adsorption-desorption process of NH3 on the Lewis acidic site was not affected by N2. These results show that the Mn/SO4 2−-CeCO3F-CePO4 catalyst is rich in acidic sites on the catalyst surface at 250 °C and that all of them can participate in the reaction, but it is obvious that the Lewis acidic site has a faster activation rate of NH3(g) adsorption and is less likely to be interfered by the purging of the equilibrium gas, so the Lewis acidic site is the main active site on the Mn/SO4 2−-CeCO3F-CePO4 catalyst surface. Fig. 12(b) shows the IR spectrum of the Mn/SO4 2−-CeCO3F-CePO4 catalyst for NO+O2 adsorption at 250 °C with time. IR absorption peaks can be found on the catalyst surface at 1774 cm−1, 1418 cm−1 and 1247 cm−1 when NO+O2 is passed through for 5 min. Where the absorption peak at 1774 cm−1 belongs to the stretching vibration of the N=O bond. The absorption peak at 1418 cm−1 belongs to the monodentate nitrite species [35]. The absorption peak at 1247 cm−1 belongs to a bridging nitrate species. The Mn/SO4 2−-CeCO3F-CePO4 catalyst showed the presence of monodentate nitrite species on the surface, which are nitrate species with high reactivity and contribute to lower reaction temperatures, which is consistent with the activity test results. This could likewise indicate that Mn3+ readily bonds with monodentate nitrite species to form ON-O-Mn3+ species involved in the L-H mechanistic reaction process. With increasing passage time, at 20 min the monodentate nitrite species were further oxidised to monodentate nitrate species(1464 cm−1) and the bidentate nitrate species (1743 cm−1) were also present in a more stable state. In contrast, the absorption peak of the bridged nitrate species was enhanced at 20 min but was further oxidised to the bidentate nitrate species(1345 cm−1) with increasing time. After a 30 min N2 purge it was found that the bidentate nitrate species remained stable, while the bidentate nitrate species at 1345 cm−1 was also reduced to a monodentate nitrate species (1284 cm−1), which also illustrates the excellent redox ability of Mnn+. The above results indicate that the main NO adsorption products on the surface of the Mn/SO4 2−-CeCO3F-CePO4 catalyst were monodentate nitrate and bidentate nitrate species. 3.7.2 Variation of NH3 and NO+O2 adsorption on the catalyst with temperature Fig. 13 (a) shows the spectrum of the change in thermal stability of NH3 adsorbed species over the interval 50 °C to 400 °C for the Mn/SO4 2−-CeCO3F-CePO4 catalyst. Firstly, it can be observed that at low temperatures between 50 °C and 150 °C, infrared absorption peaks appear on the catalyst surface at 1725 cm−1, 1641 cm−1, 1422 cm−1 and 1241 cm−1. The peak at 1725 cm−1 belongs to the NH3 + species, a dehydrogenation product of NH4 + adsorbed on the Brønsted acid centre on the catalyst surface, and the peak at 1641 cm−1 belongs to the -NH2 species, a dehydrogenation product of NH3 adsorbed on the Lewis acid centre, indicating that the NH4 +/NH3 species adsorbed on the acidic sites are more reactive at low temperatures. The absorption peak at 1422 cm−1 belongs to the deformation vibration of the NH bond in NH4 + adsorbed at the Brønsted acid centre on the catalyst surface, and the absorption peak at 1241 cm−1 belongs to the NH3 species adsorbed at the Lewis acid centre on the catalyst surface. As the temperature increases, the NH3(a) species at 1241 cm−1 undergoes dehydrogenation to form the -NH2 species and the absorption peak is shifted to 1320 cm−1. NH4 + species belonging to the Brønsted acid centre adsorbed on the catalyst surface appeared in the interval 200 °C to 300 °C (1688 cm−1). When the temperature was increased to 350 °C∼400 °C, new IR absorption peaks appeared on the catalyst surface at 1773 cm−1 and 1541 cm−1. The adsorption peaks due to weakly adsorbed or gaseous NH3, and the Brønsted acid-centred adsorption of NH4 + species, respectively. Combined with the activity test results, it can be seen that the Mn/SO4 2−-CeCO3F-CePO4 catalyst exhibited good catalytic activity from the low to high temperature section, indicating that the dehydrogenation product -NH2 species in the Lewis acidic site and the Brønsted acidic site on the catalyst surface are the main active species and acid active site on the catalyst surface. Fig. 13(b) shows the spectrum of thermal stability changes of NO+O2 adsorbed species for the Mn/SO4 2−-CeCO3F-CePO4 catalyst in the interval from 50 °C to 400 °C. In the low temperature band from 50 °C to 150 °C, infrared absorption peaks appeared on the catalyst surface at 1699 cm−1, 1578 cm−1, 1513 cm−1 and 1350 cm−1. The absorption peaks at 1578 cm−1 and 1350 cm−1 both belong to the bidentate nitrate species, the peak at 1699 cm−1 belongs to the bidentate nitrite species and the absorption peak at 1513 cm−1 belongs to the monodentate nitrate species. This suggests that the catalytic activity is poorer at low temperatures as the nitrate species on the catalyst surface are more stable and thus less conducive to reacting with the adsorbed NH3 species. With the increase in temperature, a weakening of the absorption peaks of the bidentate nitrate species on the catalyst surface can be observed (1350 cm−1, 1578 cm−1), indicating that this part of the bidentate nitrate species undergoes reduction reactions and is followed by absorption peaks attributed to monodentate nitrate (1459 cm−1) and monodentate nitrite species (1418 cm−1), which are more reactive nitrate species that react more readily with NH3 species. Not only that, but the decomposition and reaction of bidentate nitrate also exposes certain active sites favourable for the activation of other reactive gases by adsorption. However, in the medium to high-temperature section (200 °C∼400 °C), the catalyst surface was still dominated by bidentate nitrate species, with absorption peaks located at 1638 cm−1 and 1544 cm−1. The absorption peaks appearing at 1758 cm−1 and 1522 cm−1 are attributed to the stretching vibration of the N=O bond and the monodentate nitrate species. Overall, the high-temperature section had fewer reactive nitrate species and was susceptible to pyrolysis and desorption by temperature, which combined with the results of the activity tests suggests that NO is less likely to be involved in the reaction in the form of nitrate species. 3.7.3 Reaction of NH3 and NO+O2 pre-adsorption Fig. 14 (a) shows the in situ IR spectrum of the reaction of NO+O2 on the surface of the Mn/SO4 2−-CeCO3F-CePO4 catalyst with preadsorbed NH3 species at a temperature of 250 °C. The change in the IR spectrum was observed at a temperature of 250 °C. Firstly, after the adsorption of NH3 1 h, the catalyst showed three distinct IR absorption peaks at 1609 cm−1, 1421 cm−1 and 1260 cm−1. The absorption peaks at 1609 cm−1 and 1260 cm−1 belong to the NH3 species adsorbed by the Lewis acid centre. The absorption peak at 1471 cm−1 belongs to the deformation vibration of the NH bond in the NH4 + adsorbed at the Brønsted acid centre on the catalyst surface. It is suggested that the Lewis acidic sites are the main acidic sites on the surface of the Mn/SO4 2−-CeCO3F-CePO4 catalyst, in agreement with the results in Fig. 12(a). When NO+O2 was introduced, the absorption peak of NH3 species belonging to the Lewis acid centre adsorbed at 1609 cm−1 disappeared rapidly, indicating a rapid reaction with the NO species, following the E-R mechanism. In contrast, the peak at 1260 cm−1 diminished, indicating that some of it also reacted with NO, while the incompletely reacted NH3(a) species also reacted completely after 10 min of NO+O2 passage. The absorption peak of NH4 + species adsorbed at the Brønsted acid centre is not affected but rather enhanced by the passage of NO+O2, implying that NO does not react with NH4 + species and that the enhanced absorption peak is probably due to the oxidation of NH3 species to produce nitrate species. The catalyst surface also showed bridged nitrate species (1686 cm−1, 1260 cm−1), and monodentate nitrate species (1512 cm−1) after the NO was passed through. Fig. 14(b) shows the in situ IR spectrum of the Mn/SO4 2−-CeCO3F-CePO4 catalyst for the reaction of NH3 with pre-adsorbed NO+O2 species at 250 °C. When NO+O2 was introduced into the reaction cell system for 60 min, stable double-dentate nitrite species (1690 cm−1), single-dentate nitrate species (1373 cm−1) and even secondary nitrate species (1145 cm−1) appeared on the catalyst surface [35]. After cutting off NO+O2 followed by NH3, it can be found that the 1690 cm−1 bidentate nitrite species did not react, but formed a compound absorption peak with the adsorbed NH3 species at 2 min of NH3 introduction, which was still present in a more stable state at 5 min, and was gradually reduced to other nitrate products under the action of reducing gas as the time of NH3 introduction increased. In contrast, the monodentate nitrate species disappeared quickly with the passage of NH3, indicating the presence of an L-H reaction mechanism on the catalyst surface. Even the secondary nitrate species reacted with NH3 at a slow rate, with decomposition disappearing only at 10 min pass, suggesting that the monodentate nitrate species on the surface of the Mn/SO4 2−-CeCO3F-CePO4 catalyst was the main active reactive species. The adsorption of NH3 onto the catalyst surface also produced several adsorption products, with the absorption peaks at 1642 cm−1, 1622 cm−1, 1302 cm−1 and 1651 cm−1 all belonging to the NH3 dehydrogenation product -NH2 species adsorbed at the Lewis acid centre. The absorption peak at 1238 cm−1 belongs to the NH3 species adsorbed by the Lewis acid centre, while the absorption peak at 1460 cm−1 belongs to the NH4 + species adsorbed by the Brønsted acid centre on the catalyst surface. 3.8 Sulphur and water resistance testing Fig. 15 shows the experiment of sulfur and water resistance of Mn/SO4 2−- CeCO3F-CePO4 catalyst. In the programmed ramp-up experiment, 500 ppm NH3, 500 ppm NO, 3% O2 and N2 equilibrium gas were first introduced at a certain temperature within the optimum temperature range of the catalyst, and after 30 min of reaction, 500 ppm SO2 and 5% H2O were introduced, and after 30 min of reaction, SO2 and H2O were cut off, and after 30 min of reaction, the temperature was ramped up for the next temperature point. In isothermal experiments, 500 ppm NH3, 500 ppm NO, 3% O2 and N2 equilibrium gas were firstly introduced at the optimum catalyst temperature and after 2 h of reaction, 500 ppm SO2 and 5% H2O were introduced and after 8 h of reaction, SO2 and H2O were cut off and the reaction continued for 2 h. From the experimental results, it is clear that the catalysts maintained excellent catalytic performance from 200 °C to 400 °C, and the best denitrification temperature was 250 °C (92.6%). The catalyst activity decreased by about 30% under low-temperature conditions, but the resistance to toxicity was relatively improved with the increase in temperature. After cutting off H2O+SO2, the catalytic activity was recovered in all cases. The experimental results at 250 °C showed that the catalytic activity continued to decrease by about 30% with increasing time, and the activity rebounded somewhat after cutting off the pass-through. It indicates that the poisoning on the catalyst surface is still mainly from the competing adsorption generated by SO2, H2O and NH3, NO, and most of the -OH cannot be removed at this temperature, which will affect the redox performance of the Mn-Ce system. However, due to the excellent redox properties of Mnn+, it was not affected by H2O and resulted in inactivation. 3.9 Mechanism analysis The catalyst surface reaction mechanism is shown in Fig. 16 : The equation for the reaction is as follows(M=Ce, Fe, Mn) (Δ=SO3 2−, PO4 3−): L-H Mechanism: NH3(g)+Δ→Δ-NH3(ad) Mn++O2→M( n + 1)++2O− Δ-NH3(ad)+O−→Δ-NH2+OH− NH3(g)+Δ-OH→Δ-NH4 ++O− Δ-NH4 ++O−→Δ-NH3 ++OH− Δ-NH3 ++-OH+O−→Δ-NH2+2-OH NO+O−→-NO2 2NO(g)+O2→2NO2(g) NO2(g)+O−→-NO3 Δ-NH2+-NO2→Δ-NH2-NO2 Δ-NH2-NO2+M( n + 1)+→N2+H2O+Δ+Mn++O − Δ-NH2+-NO3→Δ-NH2-NO3 Δ-NH2-NO3+M( n + 1)+→N2+H2O+Δ+Mn++2O− E-R Mechanism: NH3(g)+Δ→Δ-NH3(ad) Mn++O2→M( n + 1)++2O− Δ-NH3(ad)+O−→Δ-NH2+OH− NH3(g)+Δ-OH→Δ-NH4 ++O− 2NO(g)+O2→2NO2(g) Δ-NH2+NO(g)→Δ-NH2NO→N2+H2O+Δ Δ-NH4 ++NO2(g)→Δ-NH4NO2→Δ-NH2NO+H2O Δ-NH2NO→N2+H2O+Δ 4 Conclusion The Mn/SO4 2−-CeCO3F-CePO4 catalyst was prepared by the impregnation method, and the effects of different manganese nitrate content and sulphuric acid content on the catalyst activity were investigated respectively. The surface properties of the catalyst were analysed by a series of characterisations, and its NH3-SCR reaction path and reaction mechanism at the optimum denitrification temperature of 250 °C were explored, with the following main conclusions: (1) The best denitrification performance of the catalyst was achieved at 12% Mn loading and 0.6 mol/L sulphuric acid content, and the temperature window became wider, with denitrification consistently above 80% at 200∼400 °C and up to 92.6% denitrification activity at 250 °C. (2) Mn content and sulphuric acid content have a significant effect on denitrification performance, with suitable Mn and sulphuric acid content leading to greater Mn-Ce interactions and an increase in the amount of acid in the moderately strong acidic sites and strong acidic sites; The Mn oxides, MnSO4 and MnSO3 produced are well dispersed and provide more adsorption sites and active sites; The Mn atom replaces part of the Ce atom in the CeO2 lattice, increasing the mobility of the oxygen and thus improving the low-temperature activity of the catalyst; Promotes the conversion of Ce4+ to Ce3+ and the elevated proportion of oxygen adsorbed on the surface, accelerating the NH3-SCR reaction. (3) The Mn-loaded catalyst follows both the E-R and L-H mechanisms at medium to high temperatures (250 °C) and has a significantly different reaction path to that of the carrier following the L-H mechanism. Acidic sites are abundant on the catalyst surface, with Lewis acidic sites being the main active sites on the catalyst surface. The main NO adsorption products on the catalyst surface were monodentate nitrate and bidentate nitrite species. The dehydrogenation product -NH2 species at the Lewis acidic site of the surface is the main active species on the catalyst surface. Monodont nitrate species are the main active nitrate species. Declaration of Competing Interest The authors declare that they have no known competing financial interests or personal relationships that could have appeared to influence the work reported in this paper. Acknowledgments This work was supported by the National Natural Science Foundation of China (51866013). References [1] N. Li S.H. Zhang W.F. Wu Study on NH3-SCR of cerium-based substances in rare earth concentrates from Bayan Obo Polish J. Chem. Technol. 24 1 2022 Li N., Zhang S.H., Wu W.F.. Study on NH3-SCR of cerium-based substances in rare earth concentrates from Bayan Obo. Polish J. Chem. Technol., 2022, 24(1) [2] C. Liu F. Li J. Wu A comparative study of MOx (M=Mn, Co and Cu) modifications over CePO4 catalysts for Selective Catalytic Reduction of NO with NH3 J. Hazard. Mater. 2018 363 Liu C., Li F., Wu J., et al. A comparative study of MOx (M=Mn, Co and Cu) modifications over CePO4 catalysts for Selective Catalytic Reduction of NO with NH3. J. Hazard. Mater., 2018, 363 [3] X.J. Yao T.T. Kong L. Chen Enhanced low-temperature NH3-SCR performance of MnOx/CeO2 catalysts by optimal solvent effect Appl. Surf. Sci. 420 2017 407 415 Yao X.J., Kong T.T., Chen L., et al. Enhanced low-temperature NH3-SCR performance of MnOx/CeO2 catalysts by optimal solvent effect. Appl. Surf. Sci., 2017, 420:407–415 [4] R. Zhang W. Yang N. Luo Low-temperature NH3-SCR of NO by lanthanum manganite perovskites: effect of A-/B-site substitution and TiO2/CeO2 support Appl. Catal. B Environ. 146 2014 94 104 Zhang R., Yang W., Luo N.. Low-temperature NH3-SCR of NO by lanthanum manganite perovskites: effect of A-/B-site substitution and TiO2/CeO2 support. Appl. Catal. B: Environ., 2014, 146:94–104 [5] H. Zhao Y.N. Xu D.J. Guan Effect of addition of Ce on the catalytic activity of Fe-Mn-O Catalyst for SCR of NOx with NH3 Int. Conf. Energy 347 7 2012 453 456 Zhao H., Xu Y.N., Guan D.J.. Effect of addition of Ce on the catalytic activity of Fe-Mn-O Catalyst for SCR of NOx with NH3. Int. Conf. Energy, 2012, 347(7):453–456 [6] W. Ren B. Zhao Y.Q. Gao Performance of NaY molecular sieve-loaded FeSO4 catalysts for NOx reduction in ammonia gas CIESC J., 62 2 2011 362 368 Ren W., Zhao B., Gao Y.Q., et al. Performance of NaY molecular sieve-loaded FeSO4 catalysts for NOx reduction in ammonia gas. CIESC J., 2011, 62(2):362–368 [7] L. Ma J. Li R. Ke Catalytic performance, characterization, and mechanism study of (Fe2SO4)3/TiO2 catalyst for selective catalytic reduction of NOx by ammonia J. Phys. Chem. 2 2011 7603 7612 Ma L., Li J., Ke R., et al. Catalytic performance, characterization, and mechanism study of (Fe2SO4)3/TiO2 catalyst for selective catalytic reduction of NOx by ammonia. J. Phys. Chem., 2011, 2:7603–7612 [8] K. Li M. Haneda P. Ning Microstructure and oxygen evolution of Fe-Ce mixed oxides by redox treatment Appl. Surf. Sci. 289 2014 378 383 jan.15 Li K., Haneda M., Ning P., et al. Microstructure and oxygen evolution of Fe-Ce mixed oxides by redox treatment. Appl. Surf. Sci., 2014, 289(jan.15):378–383. [9] K. Ragavendran D. Sherwood D. Vasudevan On the observation of a huge lattice contraction and crystal habit modifications in LiMn2O4 prepared by a fuel assisted solution combustion Phys. B Condens. Matter 404 16 2009 2166 2171 Ragavendran K., Sherwood D., Vasudevan D., et al. On the observation of a huge lattice contraction and crystal habit modifications in LiMn2O4 prepared by a fuel assisted solution combustion. Physica B Condensed Matter, 2009, 404(16):2166–2171 [10] J.R. McBride Raman and x-ray studies of Ce1-xRExO2-y, where RE=La, Pr, Nd, Eu, Gd, and Tb J. Appl. Phys. 1994 McBride J.R., et al. Raman and x-ray studies of Ce1-xRExO2-y, where RE=La, Pr, Nd, Eu, Gd, and Tb. J Appl Phys, 1994 [11] J.E. Spanier R.D. Robinson F. Zhang Size-dependent properties of CeO2-y nanoparticles as studied by Raman scattering Phys. Rev. B 2001 64 Spanier J.E., Robinson R.D., Zhang F., et al. Size-dependent properties of CeO2-y nanoparticles as studied by Raman scattering. Physical Review B, 2001, 64 [12] S.S. Liu Q. Wang R.D. Zhang Acidification of MnOx and Fe2O3 and combination for NH3-SCR denitrification reaction Sci. Sin.(Chimica) 048 6 2018 620 629 Liu S.S., Wang Q., Zhang R.D.. Acidification of MnOx and Fe2O3 and combination for NH3-SCR denitrification reaction. Scientia Sinica(Chimica), 2018, 048(6):620–629 [13] C.P. Duan R.T. Guo Y.Z. Liu Enhancement of kalium resistance of Ce-Ti oxide catalyst for NH3-SCR reaction by modification with holmium J. Rare Earths 1 2022 49 56 Duan C.P., Guo R.T., Liu Y.Z., et al. Enhancement of kalium resistance of Ce-Ti oxide catalyst for NH3-SCR reaction by modification with holmium. J. Rare Earths, 2022, 1:49–56 [14] T. Zhang R.Y. Qu W.K. Su A novel Ce-Ta mixed oxide catalyst for the selective catalytic reduction of NOx with NH3 Appl. Catal. B Environ. 176 177 2015 338 346 Zhang T., Qu R.Y., Su W.K., et al. A novel Ce-Ta mixed oxide catalyst for the selective catalytic reduction of NOx with NH3. Appl. Catal. B: Environ., 2015, 176-177:338–346 [15] T. Boningari P.R. Ettireddy A. Somogyvari Influence of elevated surface texture hydrated titania on Ce-doped Mn/TiO2 catalysts for the low-temperature SCR of NOx under oxygen-rich conditions J. Catal. 325 2015 145 155 Boningari T., Ettireddy P.R., Somogyvari A., et al. Influence of elevated surface texture hydrated titania on Ce-doped Mn/TiO2 catalysts for the low-temperature SCR of NOx under oxygen-rich conditions. J. Catal., 2015, 325:145–155 [16] Y. Geng X. Chen S. Yang Promotional effects of Ti on a CeO2-MoO3 catalyst for the selective catalytic reduction of NOx with NH3 ACS Appl. Mater. Interfaces, 9 2017 16951 16958 Geng Y., Chen X., Yang S., et al. Promotional effects of Ti on a CeO2-MoO3 catalyst for the selective catalytic reduction of NOx with NH3. ACS Appl. Mater. Interfaces, 2017, 9:16951–16958 [17] D.W. Kwon K. Nam S. Hong Influence of tungsten on the activity of a Mn/Ce/W/Ti catalyst for the selective catalytic reduction of NO with NH3 at low temperatures Appl. Catal. A Gen. 497 2015 160 166 Kwon D.W., K. Nam, Hong S., et al. Influence of tungsten on the activity of a Mn/Ce/W/Ti catalyst for the selective catalytic reduction of NO with NH3 at low temperatures. Appl. Catal. A: General, 2015, 497:160–166 [18] Y. Gao T. Luan S. Zhang Comprehensive comparison between Nanocatalysts of Mn-Co/TiO2 and Mn-Fe/TiO2 for NO catalytic conversion: an insight from nanostructure, performance, kinetics, and thermodynamics Catalysts 9 2 2019 175 Gao Y., Luan T., Zhang S., et al. Comprehensive comparison between Nanocatalysts of Mn-Co/TiO2 and Mn-Fe/TiO2 for NO catalytic conversion: an insight from nanostructure, performance, kinetics, and thermodynamics. Catalysts, 2019, 9(2):175 [19] J. Chen W. Li α-Fe2O3 nanotubes in gas sensor and lithium-ion battery applications Adv. Mater. 17 5 2005 582 586 Chen J., Li W., et al. α-Fe2O3 nanotubes in gas sensor and lithium-ion battery applications. Adv. Mater., 2005, 17(5):582–586 [20] L.S. Wang B.C. Huang Y.X. Su Manganese oxides supported on multi-walled carbon nanotubes for selective catalytic reduction of NO with NH3:catalytic activity and characterization Chem. Eng. J. 192 2012 232 241 Wang L.S., Huang B.C., Su Y.X., et al. Manganese oxides supported on multi-walled carbon nanotubes for selective catalytic reduction of NO with NH3:catalytic activity and characterization. Chem. Eng. J., 2012, 192:232–241 [21] Y.X. Su B.X. Fan L.S. Wang MnOx supported on carbon nanotubes by different methods for the SCR of NO with NH3 Catal. Today 20 2013 115 121 Su Y.X., Fan B.X., Wang L.S., et al. MnOx supported on carbon nanotubes by different methods for the SCR of NO with NH3. Catal Today, 2013, 20:115–121 [22] C. Fang D.S. Zhang S.X. Cai Low-temperature selective catalytic reduction of NO with NH3 over nanoflaky MnOx on carbon nanotubes in situ prepared via a chemical bath deposition route Nanoscale 5 2013 9199 9207 Fang C., Zhang D.S., Cai S.X., et al. Low-temperature selective catalytic reduction of NO with NH3 over nanoflaky MnOx on carbon nanotubes in situ prepared via a chemical bath deposition route. Nanoscale, 2013, 5:9199–9207 [23] S. Andreoli F.A. Deorsola Nanostructured MnOx catalysts for low-temperature NOx SCR Chem. Eng. J. 278 2015 174 182 Andreoli S., Deorsola F.A., et al. Nanostructured MnOx catalysts for low-temperature NOx SCR. Chem. Eng. J., 2015, 278:174–182 [24] C.L. Yu Performance and Reaction Mechanism of a New Mn/SAPO-34 Series Catalyst for Low-Temperature SCR 2016 South China University of Technology Guangzhou Yu C.L.. Performance and Reaction Mechanism of a New Mn/SAPO-34 Series Catalyst for Low-Temperature SCR. Guangzhou: South China University of Technology, 2016 [25] W.S. Kijlstra D.S. Brands H.I. Smit Mechanism of the selective catalytic reduction of NO by NH3 over MnOx/Al2O3 II.reactivity of adsorbed NH3 and NO complexes J. Catal., 171 1997 219 230 Kijlstra W.S., Brands D.S., Smit H.I., et al. Mechanism of the selective catalytic reduction of NO by NH3 over MnOx/Al2O3 II.reactivity of adsorbed NH3 and NO complexes. J. Catal., 1997, 171:219–230 [26] M. Kang E.D. Park J.M. Kim Manganese oxide catalysts for NOx reduction with NH3 at low temperatures Appl. Catal. A Gener. 327 2007 261 269 Kang M., Park E.D., Kim J.M., et al. Manganese oxide catalysts for NOx reduction with NH3 at low temperatures. Appl. Catal. A: General. 2007, 327:261–269 [27] A.Y. Wang K.P. Xie D. Bernin Deactivation mechanism of Cu active sites in Cu/SSZ-13—Phosphoruspoisoning and the effect of hydrothermal aging Appl. Catal. B Environ. 269 2020 118781 Wang A.Y., Xie K.P., Bernin D., et al. Deactivation mechanism of Cu active sites in Cu/SSZ-13—Phosphoruspoisoning and the effect of hydrothermal aging. Appl. Catal. B: Environ., 2020, 269, 118781. [28] L. Huang Y.Q. Zeng Z.F. Chang Promotional effect of phosphorus modification on improving the Na resistance of V2O5-MoO3/TiO2 catalyst for selective catalytic reduction of NOx by NH3 Mol. Catal. 506 2021 111565 Huang L., Zeng Y.Q., Chang Z.F., et al. Promotional effect of phosphorus modification on improving the Na resistance of V2O5-MoO3/TiO2 catalyst for selective catalytic reduction of NOx by NH3. Mol. Catal., 2021, 506, 111565. [29] Y.Q. Zeng Y.N. Wang S.L. Zhang One-pot synthesis of ceria and cerium phosphate (CeO2-CePO4) nanorod composites for selective catalytic reduction of NO with NH3: active sites and reaction mechanism J. Colloid Interface Sci., 524 2018 8 15 Zeng Y.Q., Wang Y.N., Zhang S.L., et al. One-pot synthesis of ceria and cerium phosphate (CeO2-CePO4) nanorod composites for selective catalytic reduction of NO with NH3: active sites and reaction mechanism. J. Colloid Interface Sci., 2018, 524:8–15 [30] R.M. Ferrizz R.J. Gorte J.M. Vohs TPD and XPS investigation of the interaction of SO2 with model ceria catalysts Catal. Lett. 82 1–2 2002 123 129 Ferrizz R.M., Gorte R.J., Vohs J.M.. TPD and XPS investigation of the interaction of SO2 with model ceria catalysts. Catal. Lett., 2002, 82(1–2):123–129 [31] M. Hino M. Kurashige H. Matsuhashi The surface structure of sulfated zirconia: studies of XPS and thermal analysis Thermochim. Acta 441 1 2006 35 41 Hino M., Kurashige M., Matsuhashi H., et al. The surface structure of sulfated zirconia: studies of XPS and thermal analysis. Thermochim Acta, 2006, 441(1):35–41 [32] D. Fang Study On Low Temperature Denitration Performance and Adaptability of Mn/TiO2 Catalysts[D] 2015 Wuhan University of Technology Wuhan Fang D.. Study On Low Temperature Denitration Performance and Adaptability of Mn/TiO2 Catalysts[D]. Wuhan: Wuhan University of Technology, 2015 [33] S.J. Yang Y. Liao S.C. Xiong N2 Selectivity of NO reduction by NH3 over MnOx-CeO2: mechanism and key factors J. Phys. Chem. C 118 37 2014 21500 21508 Yang S.J., Liao Y., Xiong S.C., et al. N2 Selectivity of NO reduction by NH3 over MnOx-CeO2: mechanism and key factors. J. Phys. Chem. C, 2014, 118(37):21500–21508 [34] B.J. Wu X.Q. Liu S.G. Wang Investigation and characterization on MnOx/TiO2 for low-temperature selective catalytic reduction of NOx with NH3 J. Combust. Sci. Technol. 14 2008 12 21 Wu B.J., Liu X.Q., Wang S.G., et al. Investigation and characterization on MnOx/TiO2 for low-temperature selective catalytic reduction of NOx with NH3. J. Combust. Sci. Technol., 2008.14:12–21 [35] Y.J. Liao Y.P. Zhang Y.X. Yu MnOx/WO3/TiO2 in situ infrared study of the mechanism of low temperature selective catalytic reduction of NOx CIESC J. 67 12 2016 5033 5037 Liao Y.J., Zhang Y.P., Yu Y.X., et al. MnOx/WO3/TiO2 In situ infrared study of the mechanism of low temperature selective catalytic reduction of NOx. CIESC J., 2016, 67(12):5033–5037 [36] J. Sun Y. Lu L. Zhang Comparative study of different doped metal cations on the reduction, acidity, and activity of Fe9M1Ox (M=Ti4+, Ce4+/3+, Al3+) catalysts for NH3-SCR reaction Ind. Eng. Chem. Res. 56 2017 12101 12110 Sun J., Lu Y., Zhang L., et al. Comparative study of different doped metal cations on the reduction, acidity, and activity of Fe9M1Ox (M=Ti4+, Ce4+/3+, Al3+) catalysts for NH3-SCR reaction, Ind. Eng. Chem. Res., 2017, 56: 12101–12110",
      "scopus-id": "85141281453",
      "coredata": {
        "eid": "1-s2.0-S2468823122006496",
        "dc:description": "In this paper, NH3-SCR catalysts were prepared by impregnating transition metal Mn loaded on SO4 2−-CeCO3F-CePO4 and adding sulphuric acid to further improve the denitrification performance of the catalysts. The optimum performance of the catalysts was explored by varying the loading ratio of Mn and the concentration of sulphuric acid. XRD, Raman, NH3-TPD, H2-TPR, XPS and In situ DRIFTS were used to characterise the changes in the surface properties of the catalyst after loading with Mn and to investigate the reaction mechanism. The results show that the denitrification performance of the catalyst was improved after the loading of Mn and sulphuric acid treatment, and the temperature window became wider, with the denitrification rate consistently remaining above 80% at 200∼400 °C and the denitrification activity reaching 92.6% at 250 °C. Suitable Mn and sulphuric acid content allow for greater Mn-Ce interactions, resulting in better dispersion of active substances such as Mn oxides, MnSO4 and MnSO3, which can provide more adsorption and active sites and increase the reaction rate. The Mn atoms replace some of the Ce atoms in the CeO2 lattice, increasing the mobility of oxygen and thus improving the low-temperature activity of the catalyst. In situ IR results show that the catalyst follows both the Eley-Rideal mechanism and the Langmuir-Hinshelwood mechanism at 250 °C. The acidic sites on the surface are abundant and the Lewis acidic sites are the main active sites on the catalyst surface. Both mechanisms work together to facilitate the denitrification reaction.",
        "openArchiveArticle": "false",
        "prism:coverDate": "2022-12-31",
        "openaccessUserLicense": null,
        "prism:aggregationType": "Journal",
        "prism:url": "https://api.elsevier.com/content/article/pii/S2468823122006496",
        "dc:creator": [
          {
            "@_fa": "true",
            "$": "Li, Na"
          },
          {
            "@_fa": "true",
            "$": "Ren, Chenhao"
          },
          {
            "@_fa": "true",
            "$": "Hou, Limin"
          },
          {
            "@_fa": "true",
            "$": "Jiao, Kunlin"
          },
          {
            "@_fa": "true",
            "$": "Wu, Wenfei"
          }
        ],
        "link": [
          {
            "@_fa": "true",
            "@rel": "self",
            "@href": "https://api.elsevier.com/content/article/pii/S2468823122006496"
          },
          {
            "@_fa": "true",
            "@rel": "scidir",
            "@href": "https://www.sciencedirect.com/science/article/pii/S2468823122006496"
          }
        ],
        "dc:format": "application/json",
        "openaccessType": null,
        "pii": "S2468-8231(22)00649-6",
        "prism:volume": "533",
        "articleNumber": "112763",
        "prism:publisher": "Elsevier B.V.",
        "dc:title": "Study on NH3-SCR performance and mechanism of Mn supported SO4 2−-CeCO3F-CePO4 catalysts",
        "prism:copyright": "© 2022 Elsevier B.V. All rights reserved.",
        "openaccess": "0",
        "prism:issn": "24688231",
        "dcterms:subject": [
          {
            "@_fa": "true",
            "$": "Mn-loaded"
          },
          {
            "@_fa": "true",
            "$": "Sulphation"
          },
          {
            "@_fa": "true",
            "$": "NH3-SCR"
          },
          {
            "@_fa": "true",
            "$": "Denitrification mechanism"
          }
        ],
        "openaccessArticle": "false",
        "prism:publicationName": "Molecular Catalysis",
        "openaccessSponsorType": null,
        "prism:pageRange": "112763",
        "pubType": "rev",
        "prism:coverDisplayDate": "December 2022",
        "prism:doi": "10.1016/j.mcat.2022.112763",
        "prism:startingPage": "112763",
        "dc:identifier": "doi:10.1016/j.mcat.2022.112763",
        "openaccessSponsorName": null
      },
      "objects": {
        "object": [
          {
            "@category": "standard",
            "@height": "121",
            "@width": "301",
            "@_fa": "true",
            "$": "https://api.elsevier.com/content/object/eid/1-s2.0-S2468823122006496-ga1.jpg?httpAccept=%2A%2F%2A",
            "@multimediatype": "JPEG image file",
            "@type": "IMAGE-DOWNSAMPLED",
            "@size": "17364",
            "@ref": "ga1",
            "@mimetype": "image/jpeg"
          },
          {
            "@category": "standard",
            "@height": "205",
            "@width": "508",
            "@_fa": "true",
            "$": "https://api.elsevier.com/content/object/eid/1-s2.0-S2468823122006496-gr16.jpg?httpAccept=%2A%2F%2A",
            "@multimediatype": "JPEG image file",
            "@type": "IMAGE-DOWNSAMPLED",
            "@size": "32313",
            "@ref": "gr16",
            "@mimetype": "image/jpeg"
          },
          {
            "@category": "standard",
            "@height": "197",
            "@width": "376",
            "@_fa": "true",
            "$": "https://api.elsevier.com/content/object/eid/1-s2.0-S2468823122006496-gr1.jpg?httpAccept=%2A%2F%2A",
            "@multimediatype": "JPEG image file",
            "@type": "IMAGE-DOWNSAMPLED",
            "@size": "22493",
            "@ref": "gr1",
            "@mimetype": "image/jpeg"
          },
          {
            "@category": "standard",
            "@height": "344",
            "@width": "753",
            "@_fa": "true",
            "$": "https://api.elsevier.com/content/object/eid/1-s2.0-S2468823122006496-gr2.jpg?httpAccept=%2A%2F%2A",
            "@multimediatype": "JPEG image file",
            "@type": "IMAGE-DOWNSAMPLED",
            "@size": "52367",
            "@ref": "gr2",
            "@mimetype": "image/jpeg"
          },
          {
            "@category": "standard",
            "@height": "345",
            "@width": "753",
            "@_fa": "true",
            "$": "https://api.elsevier.com/content/object/eid/1-s2.0-S2468823122006496-gr10.jpg?httpAccept=%2A%2F%2A",
            "@multimediatype": "JPEG image file",
            "@type": "IMAGE-DOWNSAMPLED",
            "@size": "78384",
            "@ref": "gr10",
            "@mimetype": "image/jpeg"
          },
          {
            "@category": "standard",
            "@height": "342",
            "@width": "753",
            "@_fa": "true",
            "$": "https://api.elsevier.com/content/object/eid/1-s2.0-S2468823122006496-gr11.jpg?httpAccept=%2A%2F%2A",
            "@multimediatype": "JPEG image file",
            "@type": "IMAGE-DOWNSAMPLED",
            "@size": "77431",
            "@ref": "gr11",
            "@mimetype": "image/jpeg"
          },
          {
            "@category": "standard",
            "@height": "339",
            "@width": "753",
            "@_fa": "true",
            "$": "https://api.elsevier.com/content/object/eid/1-s2.0-S2468823122006496-gr12.jpg?httpAccept=%2A%2F%2A",
            "@multimediatype": "JPEG image file",
            "@type": "IMAGE-DOWNSAMPLED",
            "@size": "70524",
            "@ref": "gr12",
            "@mimetype": "image/jpeg"
          },
          {
            "@category": "standard",
            "@height": "338",
            "@width": "753",
            "@_fa": "true",
            "$": "https://api.elsevier.com/content/object/eid/1-s2.0-S2468823122006496-gr13.jpg?httpAccept=%2A%2F%2A",
            "@multimediatype": "JPEG image file",
            "@type": "IMAGE-DOWNSAMPLED",
            "@size": "84445",
            "@ref": "gr13",
            "@mimetype": "image/jpeg"
          },
          {
            "@category": "standard",
            "@height": "338",
            "@width": "753",
            "@_fa": "true",
            "$": "https://api.elsevier.com/content/object/eid/1-s2.0-S2468823122006496-gr14.jpg?httpAccept=%2A%2F%2A",
            "@multimediatype": "JPEG image file",
            "@type": "IMAGE-DOWNSAMPLED",
            "@size": "79511",
            "@ref": "gr14",
            "@mimetype": "image/jpeg"
          },
          {
            "@category": "standard",
            "@height": "285",
            "@width": "339",
            "@_fa": "true",
            "$": "https://api.elsevier.com/content/object/eid/1-s2.0-S2468823122006496-gr15.jpg?httpAccept=%2A%2F%2A",
            "@multimediatype": "JPEG image file",
            "@type": "IMAGE-DOWNSAMPLED",
            "@size": "36132",
            "@ref": "gr15",
            "@mimetype": "image/jpeg"
          },
          {
            "@category": "standard",
            "@height": "349",
            "@width": "753",
            "@_fa": "true",
            "$": "https://api.elsevier.com/content/object/eid/1-s2.0-S2468823122006496-gr9.jpg?httpAccept=%2A%2F%2A",
            "@multimediatype": "JPEG image file",
            "@type": "IMAGE-DOWNSAMPLED",
            "@size": "77791",
            "@ref": "gr9",
            "@mimetype": "image/jpeg"
          },
          {
            "@category": "standard",
            "@height": "344",
            "@width": "753",
            "@_fa": "true",
            "$": "https://api.elsevier.com/content/object/eid/1-s2.0-S2468823122006496-gr7.jpg?httpAccept=%2A%2F%2A",
            "@multimediatype": "JPEG image file",
            "@type": "IMAGE-DOWNSAMPLED",
            "@size": "82740",
            "@ref": "gr7",
            "@mimetype": "image/jpeg"
          },
          {
            "@category": "standard",
            "@height": "352",
            "@width": "753",
            "@_fa": "true",
            "$": "https://api.elsevier.com/content/object/eid/1-s2.0-S2468823122006496-gr8.jpg?httpAccept=%2A%2F%2A",
            "@multimediatype": "JPEG image file",
            "@type": "IMAGE-DOWNSAMPLED",
            "@size": "67321",
            "@ref": "gr8",
            "@mimetype": "image/jpeg"
          },
          {
            "@category": "standard",
            "@height": "338",
            "@width": "753",
            "@_fa": "true",
            "$": "https://api.elsevier.com/content/object/eid/1-s2.0-S2468823122006496-gr5.jpg?httpAccept=%2A%2F%2A",
            "@multimediatype": "JPEG image file",
            "@type": "IMAGE-DOWNSAMPLED",
            "@size": "47197",
            "@ref": "gr5",
            "@mimetype": "image/jpeg"
          },
          {
            "@category": "standard",
            "@height": "347",
            "@width": "753",
            "@_fa": "true",
            "$": "https://api.elsevier.com/content/object/eid/1-s2.0-S2468823122006496-gr6.jpg?httpAccept=%2A%2F%2A",
            "@multimediatype": "JPEG image file",
            "@type": "IMAGE-DOWNSAMPLED",
            "@size": "111013",
            "@ref": "gr6",
            "@mimetype": "image/jpeg"
          },
          {
            "@category": "standard",
            "@height": "289",
            "@width": "376",
            "@_fa": "true",
            "$": "https://api.elsevier.com/content/object/eid/1-s2.0-S2468823122006496-gr3.jpg?httpAccept=%2A%2F%2A",
            "@multimediatype": "JPEG image file",
            "@type": "IMAGE-DOWNSAMPLED",
            "@size": "25958",
            "@ref": "gr3",
            "@mimetype": "image/jpeg"
          },
          {
            "@category": "standard",
            "@height": "345",
            "@width": "753",
            "@_fa": "true",
            "$": "https://api.elsevier.com/content/object/eid/1-s2.0-S2468823122006496-gr4.jpg?httpAccept=%2A%2F%2A",
            "@multimediatype": "JPEG image file",
            "@type": "IMAGE-DOWNSAMPLED",
            "@size": "51237",
            "@ref": "gr4",
            "@mimetype": "image/jpeg"
          },
          {
            "@category": "thumbnail",
            "@height": "88",
            "@width": "219",
            "@_fa": "true",
            "$": "https://api.elsevier.com/content/object/eid/1-s2.0-S2468823122006496-ga1.sml?httpAccept=%2A%2F%2A",
            "@multimediatype": "GIF image file",
            "@type": "IMAGE-THUMBNAIL",
            "@size": "8702",
            "@ref": "ga1",
            "@mimetype": "image/gif"
          },
          {
            "@category": "thumbnail",
            "@height": "88",
            "@width": "219",
            "@_fa": "true",
            "$": "https://api.elsevier.com/content/object/eid/1-s2.0-S2468823122006496-gr16.sml?httpAccept=%2A%2F%2A",
            "@multimediatype": "GIF image file",
            "@type": "IMAGE-THUMBNAIL",
            "@size": "8528",
            "@ref": "gr16",
            "@mimetype": "image/gif"
          },
          {
            "@category": "thumbnail",
            "@height": "115",
            "@width": "219",
            "@_fa": "true",
            "$": "https://api.elsevier.com/content/object/eid/1-s2.0-S2468823122006496-gr1.sml?httpAccept=%2A%2F%2A",
            "@multimediatype": "GIF image file",
            "@type": "IMAGE-THUMBNAIL",
            "@size": "9824",
            "@ref": "gr1",
            "@mimetype": "image/gif"
          },
          {
            "@category": "thumbnail",
            "@height": "100",
            "@width": "219",
            "@_fa": "true",
            "$": "https://api.elsevier.com/content/object/eid/1-s2.0-S2468823122006496-gr2.sml?httpAccept=%2A%2F%2A",
            "@multimediatype": "GIF image file",
            "@type": "IMAGE-THUMBNAIL",
            "@size": "5654",
            "@ref": "gr2",
            "@mimetype": "image/gif"
          },
          {
            "@category": "thumbnail",
            "@height": "100",
            "@width": "219",
            "@_fa": "true",
            "$": "https://api.elsevier.com/content/object/eid/1-s2.0-S2468823122006496-gr10.sml?httpAccept=%2A%2F%2A",
            "@multimediatype": "GIF image file",
            "@type": "IMAGE-THUMBNAIL",
            "@size": "10160",
            "@ref": "gr10",
            "@mimetype": "image/gif"
          },
          {
            "@category": "thumbnail",
            "@height": "100",
            "@width": "219",
            "@_fa": "true",
            "$": "https://api.elsevier.com/content/object/eid/1-s2.0-S2468823122006496-gr11.sml?httpAccept=%2A%2F%2A",
            "@multimediatype": "GIF image file",
            "@type": "IMAGE-THUMBNAIL",
            "@size": "8780",
            "@ref": "gr11",
            "@mimetype": "image/gif"
          },
          {
            "@category": "thumbnail",
            "@height": "98",
            "@width": "219",
            "@_fa": "true",
            "$": "https://api.elsevier.com/content/object/eid/1-s2.0-S2468823122006496-gr12.sml?httpAccept=%2A%2F%2A",
            "@multimediatype": "GIF image file",
            "@type": "IMAGE-THUMBNAIL",
            "@size": "8796",
            "@ref": "gr12",
            "@mimetype": "image/gif"
          },
          {
            "@category": "thumbnail",
            "@height": "98",
            "@width": "219",
            "@_fa": "true",
            "$": "https://api.elsevier.com/content/object/eid/1-s2.0-S2468823122006496-gr13.sml?httpAccept=%2A%2F%2A",
            "@multimediatype": "GIF image file",
            "@type": "IMAGE-THUMBNAIL",
            "@size": "9857",
            "@ref": "gr13",
            "@mimetype": "image/gif"
          },
          {
            "@category": "thumbnail",
            "@height": "98",
            "@width": "219",
            "@_fa": "true",
            "$": "https://api.elsevier.com/content/object/eid/1-s2.0-S2468823122006496-gr14.sml?httpAccept=%2A%2F%2A",
            "@multimediatype": "GIF image file",
            "@type": "IMAGE-THUMBNAIL",
            "@size": "9327",
            "@ref": "gr14",
            "@mimetype": "image/gif"
          },
          {
            "@category": "thumbnail",
            "@height": "164",
            "@width": "195",
            "@_fa": "true",
            "$": "https://api.elsevier.com/content/object/eid/1-s2.0-S2468823122006496-gr15.sml?httpAccept=%2A%2F%2A",
            "@multimediatype": "GIF image file",
            "@type": "IMAGE-THUMBNAIL",
            "@size": "10667",
            "@ref": "gr15",
            "@mimetype": "image/gif"
          },
          {
            "@category": "thumbnail",
            "@height": "101",
            "@width": "219",
            "@_fa": "true",
            "$": "https://api.elsevier.com/content/object/eid/1-s2.0-S2468823122006496-gr9.sml?httpAccept=%2A%2F%2A",
            "@multimediatype": "GIF image file",
            "@type": "IMAGE-THUMBNAIL",
            "@size": "9399",
            "@ref": "gr9",
            "@mimetype": "image/gif"
          },
          {
            "@category": "thumbnail",
            "@height": "100",
            "@width": "219",
            "@_fa": "true",
            "$": "https://api.elsevier.com/content/object/eid/1-s2.0-S2468823122006496-gr7.sml?httpAccept=%2A%2F%2A",
            "@multimediatype": "GIF image file",
            "@type": "IMAGE-THUMBNAIL",
            "@size": "10694",
            "@ref": "gr7",
            "@mimetype": "image/gif"
          },
          {
            "@category": "thumbnail",
            "@height": "102",
            "@width": "219",
            "@_fa": "true",
            "$": "https://api.elsevier.com/content/object/eid/1-s2.0-S2468823122006496-gr8.sml?httpAccept=%2A%2F%2A",
            "@multimediatype": "GIF image file",
            "@type": "IMAGE-THUMBNAIL",
            "@size": "9578",
            "@ref": "gr8",
            "@mimetype": "image/gif"
          },
          {
            "@category": "thumbnail",
            "@height": "98",
            "@width": "219",
            "@_fa": "true",
            "$": "https://api.elsevier.com/content/object/eid/1-s2.0-S2468823122006496-gr5.sml?httpAccept=%2A%2F%2A",
            "@multimediatype": "GIF image file",
            "@type": "IMAGE-THUMBNAIL",
            "@size": "7078",
            "@ref": "gr5",
            "@mimetype": "image/gif"
          },
          {
            "@category": "thumbnail",
            "@height": "101",
            "@width": "219",
            "@_fa": "true",
            "$": "https://api.elsevier.com/content/object/eid/1-s2.0-S2468823122006496-gr6.sml?httpAccept=%2A%2F%2A",
            "@multimediatype": "GIF image file",
            "@type": "IMAGE-THUMBNAIL",
            "@size": "12350",
            "@ref": "gr6",
            "@mimetype": "image/gif"
          },
          {
            "@category": "thumbnail",
            "@height": "164",
            "@width": "213",
            "@_fa": "true",
            "$": "https://api.elsevier.com/content/object/eid/1-s2.0-S2468823122006496-gr3.sml?httpAccept=%2A%2F%2A",
            "@multimediatype": "GIF image file",
            "@type": "IMAGE-THUMBNAIL",
            "@size": "8308",
            "@ref": "gr3",
            "@mimetype": "image/gif"
          },
          {
            "@category": "thumbnail",
            "@height": "100",
            "@width": "219",
            "@_fa": "true",
            "$": "https://api.elsevier.com/content/object/eid/1-s2.0-S2468823122006496-gr4.sml?httpAccept=%2A%2F%2A",
            "@multimediatype": "GIF image file",
            "@type": "IMAGE-THUMBNAIL",
            "@size": "7228",
            "@ref": "gr4",
            "@mimetype": "image/gif"
          },
          {
            "@category": "high",
            "@height": "536",
            "@width": "1333",
            "@_fa": "true",
            "$": "https://api.elsevier.com/content/object/eid/1-s2.0-S2468823122006496-ga1_lrg.jpg?httpAccept=%2A%2F%2A",
            "@multimediatype": "JPEG image file",
            "@type": "IMAGE-HIGH-RES",
            "@size": "107863",
            "@ref": "ga1",
            "@mimetype": "image/jpeg"
          },
          {
            "@category": "high",
            "@height": "909",
            "@width": "2250",
            "@_fa": "true",
            "$": "https://api.elsevier.com/content/object/eid/1-s2.0-S2468823122006496-gr16_lrg.jpg?httpAccept=%2A%2F%2A",
            "@multimediatype": "JPEG image file",
            "@type": "IMAGE-HIGH-RES",
            "@size": "192456",
            "@ref": "gr16",
            "@mimetype": "image/jpeg"
          },
          {
            "@category": "high",
            "@height": "873",
            "@width": "1667",
            "@_fa": "true",
            "$": "https://api.elsevier.com/content/object/eid/1-s2.0-S2468823122006496-gr1_lrg.jpg?httpAccept=%2A%2F%2A",
            "@multimediatype": "JPEG image file",
            "@type": "IMAGE-HIGH-RES",
            "@size": "132140",
            "@ref": "gr1",
            "@mimetype": "image/jpeg"
          },
          {
            "@category": "high",
            "@height": "1523",
            "@width": "3333",
            "@_fa": "true",
            "$": "https://api.elsevier.com/content/object/eid/1-s2.0-S2468823122006496-gr2_lrg.jpg?httpAccept=%2A%2F%2A",
            "@multimediatype": "JPEG image file",
            "@type": "IMAGE-HIGH-RES",
            "@size": "444206",
            "@ref": "gr2",
            "@mimetype": "image/jpeg"
          },
          {
            "@category": "high",
            "@height": "1529",
            "@width": "3333",
            "@_fa": "true",
            "$": "https://api.elsevier.com/content/object/eid/1-s2.0-S2468823122006496-gr10_lrg.jpg?httpAccept=%2A%2F%2A",
            "@multimediatype": "JPEG image file",
            "@type": "IMAGE-HIGH-RES",
            "@size": "639723",
            "@ref": "gr10",
            "@mimetype": "image/jpeg"
          },
          {
            "@category": "high",
            "@height": "1515",
            "@width": "3333",
            "@_fa": "true",
            "$": "https://api.elsevier.com/content/object/eid/1-s2.0-S2468823122006496-gr11_lrg.jpg?httpAccept=%2A%2F%2A",
            "@multimediatype": "JPEG image file",
            "@type": "IMAGE-HIGH-RES",
            "@size": "536665",
            "@ref": "gr11",
            "@mimetype": "image/jpeg"
          },
          {
            "@category": "high",
            "@height": "1499",
            "@width": "3333",
            "@_fa": "true",
            "$": "https://api.elsevier.com/content/object/eid/1-s2.0-S2468823122006496-gr12_lrg.jpg?httpAccept=%2A%2F%2A",
            "@multimediatype": "JPEG image file",
            "@type": "IMAGE-HIGH-RES",
            "@size": "420642",
            "@ref": "gr12",
            "@mimetype": "image/jpeg"
          },
          {
            "@category": "high",
            "@height": "1495",
            "@width": "3333",
            "@_fa": "true",
            "$": "https://api.elsevier.com/content/object/eid/1-s2.0-S2468823122006496-gr13_lrg.jpg?httpAccept=%2A%2F%2A",
            "@multimediatype": "JPEG image file",
            "@type": "IMAGE-HIGH-RES",
            "@size": "517565",
            "@ref": "gr13",
            "@mimetype": "image/jpeg"
          },
          {
            "@category": "high",
            "@height": "1497",
            "@width": "3333",
            "@_fa": "true",
            "$": "https://api.elsevier.com/content/object/eid/1-s2.0-S2468823122006496-gr14_lrg.jpg?httpAccept=%2A%2F%2A",
            "@multimediatype": "JPEG image file",
            "@type": "IMAGE-HIGH-RES",
            "@size": "468021",
            "@ref": "gr14",
            "@mimetype": "image/jpeg"
          },
          {
            "@category": "high",
            "@height": "1259",
            "@width": "1500",
            "@_fa": "true",
            "$": "https://api.elsevier.com/content/object/eid/1-s2.0-S2468823122006496-gr15_lrg.jpg?httpAccept=%2A%2F%2A",
            "@multimediatype": "JPEG image file",
            "@type": "IMAGE-HIGH-RES",
            "@size": "241665",
            "@ref": "gr15",
            "@mimetype": "image/jpeg"
          },
          {
            "@category": "high",
            "@height": "1544",
            "@width": "3333",
            "@_fa": "true",
            "$": "https://api.elsevier.com/content/object/eid/1-s2.0-S2468823122006496-gr9_lrg.jpg?httpAccept=%2A%2F%2A",
            "@multimediatype": "JPEG image file",
            "@type": "IMAGE-HIGH-RES",
            "@size": "522380",
            "@ref": "gr9",
            "@mimetype": "image/jpeg"
          },
          {
            "@category": "high",
            "@height": "1524",
            "@width": "3333",
            "@_fa": "true",
            "$": "https://api.elsevier.com/content/object/eid/1-s2.0-S2468823122006496-gr7_lrg.jpg?httpAccept=%2A%2F%2A",
            "@multimediatype": "JPEG image file",
            "@type": "IMAGE-HIGH-RES",
            "@size": "662637",
            "@ref": "gr7",
            "@mimetype": "image/jpeg"
          },
          {
            "@category": "high",
            "@height": "1558",
            "@width": "3333",
            "@_fa": "true",
            "$": "https://api.elsevier.com/content/object/eid/1-s2.0-S2468823122006496-gr8_lrg.jpg?httpAccept=%2A%2F%2A",
            "@multimediatype": "JPEG image file",
            "@type": "IMAGE-HIGH-RES",
            "@size": "452423",
            "@ref": "gr8",
            "@mimetype": "image/jpeg"
          },
          {
            "@category": "high",
            "@height": "1496",
            "@width": "3333",
            "@_fa": "true",
            "$": "https://api.elsevier.com/content/object/eid/1-s2.0-S2468823122006496-gr5_lrg.jpg?httpAccept=%2A%2F%2A",
            "@multimediatype": "JPEG image file",
            "@type": "IMAGE-HIGH-RES",
            "@size": "371434",
            "@ref": "gr5",
            "@mimetype": "image/jpeg"
          },
          {
            "@category": "high",
            "@height": "1537",
            "@width": "3333",
            "@_fa": "true",
            "$": "https://api.elsevier.com/content/object/eid/1-s2.0-S2468823122006496-gr6_lrg.jpg?httpAccept=%2A%2F%2A",
            "@multimediatype": "JPEG image file",
            "@type": "IMAGE-HIGH-RES",
            "@size": "720056",
            "@ref": "gr6",
            "@mimetype": "image/jpeg"
          },
          {
            "@category": "high",
            "@height": "1281",
            "@width": "1667",
            "@_fa": "true",
            "$": "https://api.elsevier.com/content/object/eid/1-s2.0-S2468823122006496-gr3_lrg.jpg?httpAccept=%2A%2F%2A",
            "@multimediatype": "JPEG image file",
            "@type": "IMAGE-HIGH-RES",
            "@size": "193764",
            "@ref": "gr3",
            "@mimetype": "image/jpeg"
          },
          {
            "@category": "high",
            "@height": "1528",
            "@width": "3333",
            "@_fa": "true",
            "$": "https://api.elsevier.com/content/object/eid/1-s2.0-S2468823122006496-gr4_lrg.jpg?httpAccept=%2A%2F%2A",
            "@multimediatype": "JPEG image file",
            "@type": "IMAGE-HIGH-RES",
            "@size": "405874",
            "@ref": "gr4",
            "@mimetype": "image/jpeg"
          },
          {
            "@category": "standard",
            "@_fa": "true",
            "$": "https://api.elsevier.com/content/object/eid/1-s2.0-S2468823122006496-am.pdf?httpAccept=%2A%2F%2A",
            "@multimediatype": "Acrobat PDF file",
            "@type": "AAM-PDF",
            "@size": "3799150",
            "@ref": "am",
            "@mimetype": "application/pdf"
          }
        ]
      },
      "link": {
        "@rel": "abstract",
        "@href": "https://api.elsevier.com/content/abstract/scopus_id/85141281453"
      }
    }
  }
}