{
  "metadata": {
    "title": "Promotion of La<ce:inf loc=post>2</ce:inf>O<ce:inf loc=post>3</ce:inf> on Pd/Al<ce:inf loc=post>2</ce:inf>O<ce:inf loc=post>3</ce:inf> three-way catalyst for passive selective catalytic reduction operation",
    "authors": "; ; ",
    "journal": "Molecular Catalysis",
    "date": "2024-12-31",
    "doi": "10.1016/j.mcat.2024.114540",
    "abstract": "",
    "uri": "https://api.elsevier.com/content/article/pii/S2468823124007223",
    "pii": "S2468823124007223"
  },
  "fulltext": {
    "full-text-retrieval-response": {
      "scopus-eid": "2-s2.0-85203442673",
      "originalText": "serial JL 315758 291210 291744 291790 291809 31 Molecular Catalysis MOLECULARCATALYSIS 2024-09-11 2024-09-11 2024-09-11 2024-09-11 2024-11-15T16:17:10 1-s2.0-S2468823124007223 S2468-8231(24)00722-3 S2468823124007223 10.1016/j.mcat.2024.114540 S300 S300.1 FULL-TEXT 1-s2.0-S2468823124X00152 2024-11-15T17:47:59.052827Z 0 0 20241201 20241231 2024 2024-09-11T21:44:38.370828Z absattachment articleinfo articlenumber articletitlenorm authfirstinitialnorm authfirstsurnamenorm cid cids contenttype copyright crossmark dateloaded dateloadedtxt datesearch datesort dateupdated dco docsubtype doctype doi eid ewtransactionid hubeid indexeddate issn issnnorm itemstage itemtransactionid itemweight openaccess openarchive pg pgfirst pii piinorm pubdateend pubdatestart pubdatetxt pubyr sectiontitle sortorder srctitle srctitlenorm srctype ssids alllist content subj subheadings suppl tomb volfirst volissue volumelist webpdf webpdfpagecount yearnav figure table e-component body acknowledge affil appendices articletitle auth authfirstini authfull authkeywords authlast grantnumber grantsponsor highlightsabst primabst pubtype ref specialabst 2468-8231 24688231 true 569 569 C Volume 569 13 114540 114540 114540 202412 December 2024 2024-12-01 2024-12-31 2024 Regular Papers article fla © 2024 Elsevier B.V. All rights are reserved, including those for text and data mining, AI training, and similar technologies. PROMOTIONLA2O3PDAL2O3THREEWAYCATALYSTFORPASSIVESELECTIVECATALYTICREDUCTIONOPERATION HE W 1 Introduction 2 Experimental 2.1 Synthesis of the Pd/La2O3/Al2O3 catalysts 2.2 Evaluation of the three-way catalytic performance 2.3 Characterization of the catalysts 3 Results and discussion 3.1 The three-way catalytic performance 3.2 Textural properties of the catalysts 3.3 XRD characterization results 3.4 27Al SSNMR analysis 3.5 Dispersion of Pd species 3.6 XPS study 3.7 SEM and TEM observations 3.8 H2-TPR analysis 3.9 NH3-TPD analysis 4 Conclusions CRediT authorship contribution statement Acknowledgement Appendix Supplementary materials References THOMAS 2019 284 294 C PRIKHODKO 2016 202 209 V PRIKHODKO 2016 1289 1295 V LI 2010 99 106 W ROOD 2020 936 949 S CHEN 2015 499 509 X CHEN 2022 112361 K WOO 2023 110671 H DIGIULIO 2014 33 45 C PROKHODKO 2023 100150 V THOMAS 2021 106308 C THOMAS 2022 118771 C RAMANATHAN 2012 1198 1208 K LIU 2021 5002 5012 M BAE 2022 100222 W LIU 2021 182 193 Y DAI 2024 606 614 W OH 2014 22 32 S WANG 2019 12621 12628 C ADAMS 2015 10 19 E KASPAR 2003 419 449 J PAPAVASILIOU 2010 73 84 A WANG 2010 150 159 Q JING 2021 387 396 Y PETERSON 2014 4885 E MONTE 2004 4273 4285 R PETERSON 2014 4885 E SCHAPER 1983 211 220 H HAACK 1992 199 214 L WANG 2004 143 146 S SCHAPER 1985 261 266 H PARK 2014 157 163 J MURATA 2020 1381 1387 K ZHAO 2022 795 803 Z JEONG 2020 368 375 H KWAK 2007 189 194 J SONG 2017 123 133 J ODELL 2007 169 173 L ARAUJO 2008 552 562 J SHEN 2009 3212 3221 M WENG 2011 453 461 X SELLICK 2013 98 106 D LI 2017 126 136 H MATAM 2012 237 244 S ZHANG 2011 71 81 W CAO 2018 85 92 Y HEX2024X114540 HEX2024X114540XW 2026-09-11T00:00:00.000Z 2026-09-11T00:00:00.000Z http://creativecommons.org/licenses/by-nc-nd/4.0/ © 2024 Elsevier B.V. All rights are reserved, including those for text and data mining, AI training, and similar technologies. 2024-09-18T08:17:43.053Z http://vtw.elsevier.com/data/voc/AddOnTypes/50.7/aggregated-refined Jiangxi Province Key Laboratory of Organic Functional Molecules 2024SSY05141 http://sws.geonames.org/1814991 This work was supported by Jiangxi Province Key Laboratory of Organic Functional Molecules (No: 2024SSY05141 ). https://doi.org/10.15223/policy-017 https://doi.org/10.15223/policy-037 https://doi.org/10.15223/policy-012 https://doi.org/10.15223/policy-029 https://doi.org/10.15223/policy-004 item S2468-8231(24)00722-3 S2468823124007223 1-s2.0-S2468823124007223 10.1016/j.mcat.2024.114540 315758 2024-11-15T17:47:59.052827Z 2024-12-01 2024-12-31 1-s2.0-S2468823124007223-main.pdf https://s3-eu-west-1.amazonaws.com/prod-ucs-content-store-eu-west/content/pii:S2468823124007223/MAIN/application/pdf/c1c6890853508d4f08605c57604447f8/main.pdf main.pdf pdf true 9989658 MAIN 10 1-s2.0-S2468823124007223-main_1.png https://s3-eu-west-1.amazonaws.com/prod-ucs-content-store-eu-west/content/pii:S2468823124007223/PREVIEW/image/png/a0402f40c5719b19f0adcb974441835c/main_1.png main_1.png png 59486 849 656 IMAGE-WEB-PDF 1 1-s2.0-S2468823124007223-gr10.jpg https://s3-eu-west-1.amazonaws.com/prod-ucs-content-store-eu-west/content/pii:S2468823124007223/gr10/DOWNSAMPLED/image/jpeg/c402a7ae040584dac12be0d814bfe96e/gr10.jpg gr10 gr10.jpg jpg 23558 317 395 IMAGE-DOWNSAMPLED 1-s2.0-S2468823124007223-gr2.jpg https://s3-eu-west-1.amazonaws.com/prod-ucs-content-store-eu-west/content/pii:S2468823124007223/gr2/DOWNSAMPLED/image/jpeg/40682c7911e3aaa5a185440c7b47b8ae/gr2.jpg gr2 gr2.jpg jpg 41719 221 565 IMAGE-DOWNSAMPLED 1-s2.0-S2468823124007223-gr3.jpg https://s3-eu-west-1.amazonaws.com/prod-ucs-content-store-eu-west/content/pii:S2468823124007223/gr3/DOWNSAMPLED/image/jpeg/d56376dcbd6bde6ec1ac650743de0f40/gr3.jpg gr3 gr3.jpg jpg 44838 320 395 IMAGE-DOWNSAMPLED 1-s2.0-S2468823124007223-gr1.jpg https://s3-eu-west-1.amazonaws.com/prod-ucs-content-store-eu-west/content/pii:S2468823124007223/gr1/DOWNSAMPLED/image/jpeg/13bc6f2e90edf9057b04609d48df5f7a/gr1.jpg gr1 gr1.jpg jpg 109884 615 809 IMAGE-DOWNSAMPLED 1-s2.0-S2468823124007223-gr11.jpg https://s3-eu-west-1.amazonaws.com/prod-ucs-content-store-eu-west/content/pii:S2468823124007223/gr11/DOWNSAMPLED/image/jpeg/357847ae40a02cf2734e2642043ac38b/gr11.jpg gr11 gr11.jpg jpg 29331 317 395 IMAGE-DOWNSAMPLED 1-s2.0-S2468823124007223-gr6.jpg https://s3-eu-west-1.amazonaws.com/prod-ucs-content-store-eu-west/content/pii:S2468823124007223/gr6/DOWNSAMPLED/image/jpeg/a2a2240e866e9b798b87aba3e2779309/gr6.jpg gr6 gr6.jpg jpg 133042 520 678 IMAGE-DOWNSAMPLED 1-s2.0-S2468823124007223-gr7.jpg https://s3-eu-west-1.amazonaws.com/prod-ucs-content-store-eu-west/content/pii:S2468823124007223/gr7/DOWNSAMPLED/image/jpeg/d5406d2a8d3f98f14eb759b7aab2464b/gr7.jpg gr7 gr7.jpg jpg 152821 567 753 IMAGE-DOWNSAMPLED 1-s2.0-S2468823124007223-gr4.jpg https://s3-eu-west-1.amazonaws.com/prod-ucs-content-store-eu-west/content/pii:S2468823124007223/gr4/DOWNSAMPLED/image/jpeg/b885b57f36c82ae459ad89968b7226e3/gr4.jpg gr4 gr4.jpg jpg 36989 232 565 IMAGE-DOWNSAMPLED 1-s2.0-S2468823124007223-gr5.jpg https://s3-eu-west-1.amazonaws.com/prod-ucs-content-store-eu-west/content/pii:S2468823124007223/gr5/DOWNSAMPLED/image/jpeg/63c83f1253dab8b4630c540e7b5d4189/gr5.jpg gr5 gr5.jpg jpg 18563 282 393 IMAGE-DOWNSAMPLED 1-s2.0-S2468823124007223-gr8.jpg https://s3-eu-west-1.amazonaws.com/prod-ucs-content-store-eu-west/content/pii:S2468823124007223/gr8/DOWNSAMPLED/image/jpeg/29a587b05583b8c6d834a759df588a31/gr8.jpg gr8 gr8.jpg jpg 125198 527 527 IMAGE-DOWNSAMPLED 1-s2.0-S2468823124007223-gr9.jpg https://s3-eu-west-1.amazonaws.com/prod-ucs-content-store-eu-west/content/pii:S2468823124007223/gr9/DOWNSAMPLED/image/jpeg/8f67b703d97b8d6e165418a06b2b1454/gr9.jpg gr9 gr9.jpg jpg 148959 375 753 IMAGE-DOWNSAMPLED 1-s2.0-S2468823124007223-ga1.jpg https://s3-eu-west-1.amazonaws.com/prod-ucs-content-store-eu-west/content/pii:S2468823124007223/ga1/DOWNSAMPLED/image/jpeg/3a522c82ed1efe5dfd23e6c4ff589772/ga1.jpg ga1 true ga1.jpg jpg 35198 200 286 IMAGE-DOWNSAMPLED 1-s2.0-S2468823124007223-gr10.sml https://s3-eu-west-1.amazonaws.com/prod-ucs-content-store-eu-west/content/pii:S2468823124007223/gr10/THUMBNAIL/image/gif/b59953212203e63fd3b92a925c4f8317/gr10.sml gr10 gr10.sml sml 6390 164 204 IMAGE-THUMBNAIL 1-s2.0-S2468823124007223-gr2.sml https://s3-eu-west-1.amazonaws.com/prod-ucs-content-store-eu-west/content/pii:S2468823124007223/gr2/THUMBNAIL/image/gif/c6cd4bc942c9c56f112bd941d03e20d8/gr2.sml gr2 gr2.sml sml 7834 86 219 IMAGE-THUMBNAIL 1-s2.0-S2468823124007223-gr3.sml https://s3-eu-west-1.amazonaws.com/prod-ucs-content-store-eu-west/content/pii:S2468823124007223/gr3/THUMBNAIL/image/gif/17605d2661395928e9fa4f1892015ee5/gr3.sml gr3 gr3.sml sml 11083 164 202 IMAGE-THUMBNAIL 1-s2.0-S2468823124007223-gr1.sml https://s3-eu-west-1.amazonaws.com/prod-ucs-content-store-eu-west/content/pii:S2468823124007223/gr1/THUMBNAIL/image/gif/b695dbadc822b86f3b32f88d84fbbf36/gr1.sml gr1 gr1.sml sml 11077 164 215 IMAGE-THUMBNAIL 1-s2.0-S2468823124007223-gr11.sml https://s3-eu-west-1.amazonaws.com/prod-ucs-content-store-eu-west/content/pii:S2468823124007223/gr11/THUMBNAIL/image/gif/611bcdbee2da01aae3bf823fc90ddc9a/gr11.sml gr11 gr11.sml sml 7546 164 204 IMAGE-THUMBNAIL 1-s2.0-S2468823124007223-gr6.sml https://s3-eu-west-1.amazonaws.com/prod-ucs-content-store-eu-west/content/pii:S2468823124007223/gr6/THUMBNAIL/image/gif/50d9dff9a56e2eb2046db5a5156bd629/gr6.sml gr6 gr6.sml sml 14622 164 214 IMAGE-THUMBNAIL 1-s2.0-S2468823124007223-gr7.sml https://s3-eu-west-1.amazonaws.com/prod-ucs-content-store-eu-west/content/pii:S2468823124007223/gr7/THUMBNAIL/image/gif/3bb757e4dc7b952b57d6ea3788c74cdf/gr7.sml gr7 gr7.sml sml 24486 164 218 IMAGE-THUMBNAIL 1-s2.0-S2468823124007223-gr4.sml https://s3-eu-west-1.amazonaws.com/prod-ucs-content-store-eu-west/content/pii:S2468823124007223/gr4/THUMBNAIL/image/gif/247f6362a07019ac5da981fa51216146/gr4.sml gr4 gr4.sml sml 7777 90 219 IMAGE-THUMBNAIL 1-s2.0-S2468823124007223-gr5.sml https://s3-eu-west-1.amazonaws.com/prod-ucs-content-store-eu-west/content/pii:S2468823124007223/gr5/THUMBNAIL/image/gif/aa1721cd960c126b75b7640c3e75b480/gr5.sml gr5 gr5.sml sml 5819 157 219 IMAGE-THUMBNAIL 1-s2.0-S2468823124007223-gr8.sml https://s3-eu-west-1.amazonaws.com/prod-ucs-content-store-eu-west/content/pii:S2468823124007223/gr8/THUMBNAIL/image/gif/aa70c86736bcb74a6b6c0c37d96779e1/gr8.sml gr8 gr8.sml sml 15830 164 164 IMAGE-THUMBNAIL 1-s2.0-S2468823124007223-gr9.sml https://s3-eu-west-1.amazonaws.com/prod-ucs-content-store-eu-west/content/pii:S2468823124007223/gr9/THUMBNAIL/image/gif/073170141a162c096819aa84ac5393fd/gr9.sml gr9 gr9.sml sml 16956 109 219 IMAGE-THUMBNAIL 1-s2.0-S2468823124007223-ga1.sml https://s3-eu-west-1.amazonaws.com/prod-ucs-content-store-eu-west/content/pii:S2468823124007223/ga1/THUMBNAIL/image/gif/0157ba1c6b26d4f718cd2c458aaa5eb5/ga1.sml ga1 true ga1.sml sml 15492 153 219 IMAGE-THUMBNAIL 1-s2.0-S2468823124007223-gr10_lrg.jpg https://s3-eu-west-1.amazonaws.com/prod-ucs-content-store-eu-west/content/pii:S2468823124007223/HIGHRES/image/jpeg/90b03a80b34db0c928882cb479ca62c7/gr10_lrg.jpg gr10 gr10_lrg.jpg jpg 143717 1402 1749 IMAGE-HIGH-RES 1-s2.0-S2468823124007223-gr2_lrg.jpg https://s3-eu-west-1.amazonaws.com/prod-ucs-content-store-eu-west/content/pii:S2468823124007223/HIGHRES/image/jpeg/2579028f4ec79fa65e994ceab6ec2d84/gr2_lrg.jpg gr2 gr2_lrg.jpg jpg 314042 979 2500 IMAGE-HIGH-RES 1-s2.0-S2468823124007223-gr3_lrg.jpg https://s3-eu-west-1.amazonaws.com/prod-ucs-content-store-eu-west/content/pii:S2468823124007223/HIGHRES/image/jpeg/85f9d8c7014bc97d477bdc0bf64d4985/gr3_lrg.jpg gr3 gr3_lrg.jpg jpg 317221 1417 1749 IMAGE-HIGH-RES 1-s2.0-S2468823124007223-gr1_lrg.jpg https://s3-eu-west-1.amazonaws.com/prod-ucs-content-store-eu-west/content/pii:S2468823124007223/HIGHRES/image/jpeg/a503189ab7df0bae8590568ec9018dc4/gr1_lrg.jpg gr1 gr1_lrg.jpg jpg 787834 2726 3583 IMAGE-HIGH-RES 1-s2.0-S2468823124007223-gr11_lrg.jpg https://s3-eu-west-1.amazonaws.com/prod-ucs-content-store-eu-west/content/pii:S2468823124007223/HIGHRES/image/jpeg/8090a1fa88e6049ada8214fad58054b8/gr11_lrg.jpg gr11 gr11_lrg.jpg jpg 180494 1402 1749 IMAGE-HIGH-RES 1-s2.0-S2468823124007223-gr6_lrg.jpg https://s3-eu-west-1.amazonaws.com/prod-ucs-content-store-eu-west/content/pii:S2468823124007223/HIGHRES/image/jpeg/fe47fd3d6c27abe783c9abd4f7ffe3d8/gr6_lrg.jpg gr6 gr6_lrg.jpg jpg 981129 2302 3000 IMAGE-HIGH-RES 1-s2.0-S2468823124007223-gr7_lrg.jpg https://s3-eu-west-1.amazonaws.com/prod-ucs-content-store-eu-west/content/pii:S2468823124007223/HIGHRES/image/jpeg/8e690020d4157043615090ffbefc6cde/gr7_lrg.jpg gr7 gr7_lrg.jpg jpg 1474103 2509 3333 IMAGE-HIGH-RES 1-s2.0-S2468823124007223-gr4_lrg.jpg https://s3-eu-west-1.amazonaws.com/prod-ucs-content-store-eu-west/content/pii:S2468823124007223/HIGHRES/image/jpeg/4581d53a7ebde4299b0f1bfc596e4660/gr4_lrg.jpg gr4 gr4_lrg.jpg jpg 252662 1028 2500 IMAGE-HIGH-RES 1-s2.0-S2468823124007223-gr5_lrg.jpg https://s3-eu-west-1.amazonaws.com/prod-ucs-content-store-eu-west/content/pii:S2468823124007223/HIGHRES/image/jpeg/00291d3933a8c2a9654de79203dffa1f/gr5_lrg.jpg gr5 gr5_lrg.jpg jpg 108468 1248 1742 IMAGE-HIGH-RES 1-s2.0-S2468823124007223-gr8_lrg.jpg https://s3-eu-west-1.amazonaws.com/prod-ucs-content-store-eu-west/content/pii:S2468823124007223/HIGHRES/image/jpeg/0cd88fdd46dd1419aa72a1c69355be0a/gr8_lrg.jpg gr8 gr8_lrg.jpg jpg 1976095 2331 2333 IMAGE-HIGH-RES 1-s2.0-S2468823124007223-gr9_lrg.jpg https://s3-eu-west-1.amazonaws.com/prod-ucs-content-store-eu-west/content/pii:S2045232217007386/HIGHRES/image/jpeg/3f827e4d771e009368422f7a9f5e6949/gr9_lrg.jpg gr9 gr9_lrg.jpg jpg 2709955 1661 3333 IMAGE-HIGH-RES 1-s2.0-S2468823124007223-ga1_lrg.jpg https://s3-eu-west-1.amazonaws.com/prod-ucs-content-store-eu-west/content/pii:S2468823124007223/HIGHRES/image/jpeg/5d2eec74ebd4dd6cfa729383c68ced76/ga1_lrg.jpg ga1 true ga1_lrg.jpg jpg 263548 886 1269 IMAGE-HIGH-RES 1-s2.0-S2468823124007223-mmc1.docx https://s3-eu-west-1.amazonaws.com/prod-ucs-content-store-eu-west/content/pii:S2468823124007223/mmc1/MAIN/application/vnd.openxmlformats-officedocument.wordprocessingml.document/473668d11fd068a6720f770978798548/mmc1.docx mmc1 mmc1.docx docx 169939 APPLICATION 1-s2.0-S2468823124007223-am.pdf https://s3-eu-west-1.amazonaws.com/prod-ucs-content-store-eu-west/content/egi:10JSTR4NW6G/MAIN/application/pdf/67dd55a1de3032261c8aec0a7a463f69/am.pdf am am.pdf pdf false 2371818 AAM-PDF MCAT 114540 114540 S2468-8231(24)00722-3 10.1016/j.mcat.2024.114540 Elsevier B.V. Fig. 1 Light-off curves of (a) C3H8 conversion, (b) C3H6 conversion, (c) CO conversion, (d) NO conversion and (e) NH3 concentration as a function of temperature. Fig 1 Fig. 2 (a) N2 adsorption-desorption isotherms and (b) pore size distribution curves of the catalysts. Fig 2 Fig. 3 XRD patterns of the various catalysts. Fig 3 Fig. 4 (a) 27Al SSNMR spectra of the various catalysts, (b) The ratio of Altetra vs La2O3 content. Fig 4 Fig. 5 Dispersion of Pd species derived from CO chemisorption experiment. Fig 5 Fig. 6 (a) Pd 3d, (b) La 3d, (c) Al 2p and (d) O 1 s XPS spectra of the various catalysts. Fig 6 Fig. 7 SEM images of (a) La0, (b) La2, (c) La4 and (d) La8. Fig 7 Fig. 8 TEM images of (a) La0, (b) La2, (c) La4 and (d) La8. Fig 8 Fig. 9 HRTEM images of (a1, a2) La0, (b1, b2) La2, (c1, c2) La4 and (d1, d2) La8. Fig 9 Fig. 10 H2-TPR profiles of the various catalysts. Fig 10 Fig. 11 NH3-TPD profiles of the various catalysts. Fig 11 Table 1 Textural parameters of the catalysts. Table 1: Samples SBET(m2/g) V(cm3/g) D(nm) La0 117.1 0.74 21.8 La2 106.9 0.55 16.6 La4 106.3 0.51 15.7 La8 92.5 0.51 17.9 Table 2 The quantitative information of Altetra, Alpenta and Alocta sites derived from the deconvolution of 27Al SSNMR spectra. Table 2: Samples The ratio of Altetra (%) The ratio of Alpenta (%) The ratio of Alocta (%) La0 28.12 12.78 59.10 La2 26.54 13.25 60.21 La4 24.83 13.48 61.69 La8 21.09 14.46 64.45 Table 3 Surface elemental information derived from the XPS measurement results. Table 3: Samples Relative amount (%) Pd ratio (%) O ratio (%) La Al O Pd Pd2+ Pd0 Oα Oβ La0 – 38.19 61.55 0.26 35.63 64.37 62.13 37.87 La2 0.32 38.41 60.99 0.28 42.49 57.51 59.56 40.44 La4 0.53 38.14 61.05 0.28 66.93 33.07 58.27 41.73 La8 0.91 37.06 61.70 0.33 38.99 61.01 61.15 38.85 Research Paper Promotion of La2O3 on Pd/Al2O3 three-way catalyst for passive selective catalytic reduction operation Wenjing He Investigation Formal analysis Data curation a Yanmei Kong Investigation Data curation a Longlong Zhang Resources Methodology b Huasheng Lin Methodology Investigation a Shuanghua Cheng Investigation Formal analysis a Liang Shen Resources Methodology a Li Lan Writing – review & editing Writing – original draft Formal analysis c Shanhu Chen Supervision Formal analysis Conceptualization a Meihua Zhu Supervision Project administration Formal analysis Conceptualization a ⁎ Xianrong Song Supervision Funding acquisition d ⁎ a College of Chemistry and Chemical Engineering, Jiangxi Science and Technology Normal University, Nanchang, 330013, China College of Chemistry and Chemical Engineering Jiangxi Science and Technology Normal University Nanchang 330013 China aCollege of Chemistry and Chemical Engineering, Jiangxi Science and Technology Normal University, Nanchang, 330013, China b Purification Equipment Research Institute of CSSC, Handan, 056027, China Purification Equipment Research Institute of CSSC Handan 056027 China bPurification Equipment Research Institute of CSSC, Handan, 056027, China c College of Materials and Energy, Jiangxi Science and Technology Normal University, Nanchang, 330013, China College of Materials and Energy Jiangxi Science and Technology Normal University Nanchang 330013 China cCollege of Materials and Energy, Jiangxi Science and Technology Normal University, Nanchang, 330013, China d Jiangxi Province Key Laboratory of Organic Functional Molecules, Institute of Organic Chemistry, Jiangxi Science and Technology Normal University, Nanchang, 330013, China Jiangxi Province Key Laboratory of Organic Functional Molecules Institute of Organic Chemistry Jiangxi Science and Technology Normal University Nanchang 330013 China dJiangxi Province Key Laboratory of Organic Functional Molecules, Institute of Organic Chemistry, Jiangxi Science and Technology Normal University, Nanchang, 330013, China ⁎ Corresponding authors. For three-way catalysts (TWC) applied in lean burn gasoline engines for passive selective catalytic reduction (pSCR) operation, besides the conversion efficiency of HC/CO/NO, the production of NH3 is also an important concern. In this work, La2O3 was introduced into the Pd/Al2O3 catalyst system, the influence on its TWC performance for pSCR operation was investigated, and the physicochemical properties were characterized by a range of techniques. The results reveal that the introduced La2O3 mainly interacts with Al2O3 by preferentially anchoring to the tetra-coordinated Al sites on the surface. When the catalyst is modified by appropriate amount of La2O3 (4 wt%), higher dispersion of Pd species, larger amount of Pd2+ and active oxygen species are achieved, which well contributes to improved low-temperature reduction ability and NH3 desorption property of the catalyst. As a consequence, excellent catalytic conversions of HC/CO/NO are obtained, and meanwhile, higher concentration of NH3 is generated, making the modified catalyst more promising for pSCR operation. Graphical abstract Image, graphical abstract Keywords TWC for pSCR operation NH3 La2O3 Pd/Al2O3 Data availability No data was used for the research described in the article. 1 Introduction Nowadays, in spite of the increasing prevalence of alternative fuels and renewable energy, petroleum-based fuels are still accounted for the vast majority of transportation energy, wherein a large portion of petroleum energy is consumed by gasoline-engined vehicles. Owing to the requirements of energy conservation, emission reduction and fuel consumption regulations, gasoline engines with higher thermal efficiency have become a pursuing goal. Under this circumstance, lean burn gasoline engines are a promising technology, which can increase the adiabatic index of the fuel mixture, reduce the combustion temperature, and consequently remarkably improved thermal efficiency can be achieved [1]. By applying improved engine technology, lean burn engines provide higher air-to-fuel ratio relative to conventional stoichiometric engines, in this case, the fuel economy can be increased by about 10% [2,3], and meanwhile, the emissions of greenhouse gas can be effectively lowered down [4]. As is well known, typical three-way catalysts (TWCs) possess considerably high efficiency for simultaneous conversions of CO, HC and NOx only in a narrow region around the stoichiometric condition [5-8]. However, owing to the oxygen-rich atmosphere in lean burn engines, the reduction of NOx to N2 over TWCs appears to be much more difficult [3,9]. Therefore, in order to achieve widespread commercial application of lean burn engines, it is of critical importance to diminish the elevated NOx emissions. Passive selective catalytic reduction (pSCR) is a potential approach for the treatment of NOx generated from lean burn gasoline engines [10-14]. A designed pSCR system is typically composed of a close-coupled TWC and a downstream SCR. For conventional researches concerning TWCs, NH3 has long been recognized as a secondary pollutant from gasoline engine emissions [15-19]. However, recently it has been proposed that in pSCR system, the on-board production of NH3 can act as the reductant for the subsequent SCR of NOx [1]. That is, when the engine is operated under stoichiometric or slightly rich condition, NOx would be partially reduced to NH3 over TWC, and the generated NH3 could be stored on the downstream SCR catalyst. During lean burn condition, NOx flows through SCR and reacts with the stored NH3 [4,9]. In this approach, the equipment of additional components such as urea storage tanks and urea injection system is avoided, which are typically included in diesel SCR techniques [4]. While plenty of researches have been conducted to optimize the TWC activity for simultaneous elimination of HC, CO and NOx in the past decades, recently design of highly effective TWC formulations for pSCR system is attracted increasing attention [11]. Herein, besides the conversion efficiency of HC, CO and NOx, the production of NH3 is also a key consideration when evaluating the TWC activity. As reported in the literatures, TWCs composed of Pt or Pd supported on Al2O3 are quite effective for production of NH3, wherein the supported Pd catalysts appear to be more promising on account of its higher efficiency for water gas shift reaction, which can produce more H2 to promote the reduction of NOx to NH3 [18,20]. In addition, La2O3 is a commonly used auxiliary in commercial TWCs in respect that it can act as a stabilizing agent for Al2O3 and a promoter for active component Pd as well, moreover, La2O3 is reported to be able to promote the catalytic conversion of NO during three-way catalytic reaction process [21-25]. In this study, Pd/La2O3/Al2O3 catalysts with different contents of La2O3 were synthesized, the influence of La2O3 on TWC performance of Pd/Al2O3 in pSCR system was investigated, besides the conversion efficiency of HC/CO/NO, particular attention was also paid to the production of NH3. Moreover, the Pd/La2O3/Al2O3 catalysts were characterized through a range of techniques to disclose the relationship between the physicochemical properties and their catalytic performance. 2 Experimental 2.1 Synthesis of the Pd/La2O3/Al2O3 catalysts Bare Pd/Al2O3 catalyst without the addition of La2O3 was synthesized as follows: Firstly, 4.0 g of Al2O3 powders (which had been previously treated at 700 °C) were submitted to thermal treating at 1000 °C for 4 h in a muffle furnace. Then, required amount of Pd(NO3)2 solution (the content of Pd was 0.106 g) was diluted with distilled water and impregnated onto the above Al2O3 powders. Afterwards the impregnated mixture was calcined at 400 °C for 2 h, which was then ball milled with pseudo-boehmite, acetic acid and distilled water to obtain a slurry. After that the slurry was washcoated onto a cordierite honeycomb matrix, after further calcining at 550 °C for 2 h, the obtained monolithic Pd/Al2O3 catalyst was hereafter referred to as La0. In addition, the remaining slurry was dried and calcined at 550 °C for 2 h to obtain the corresponding powder catalyst, which was used to conduct the subsequent characterization experiments. Pd/La2O3/Al2O3 catalyst with La2O3 content of 2 wt% was prepared as follows: Firstly, 0.2128 g of La(NO3)3·6H2O (the content of La2O3 was 37.6 wt%) was dissolved by distilled water and then impregnated onto 4.0 g of Al2O3 powders (which had been previously treated at 700 °C), after thermally treated at 1000 °C for 4 h, the obtained La2O3/Al2O3 powders were impregnated by diluted Pd(NO3)2 solution. Then the impregnated mixture was calcined at 400 °C for 2 h to obtain the catalyst powders. After that, the slurrying, washcoating and calcining processes were the same with those for La0, and the obtained sample was henceforward labeled as La2. Furthermore, another two Pd/La2O3/Al2O3 catalysts with La2O3 contents of 4 wt% and 8 wt% were synthesized applying the same procedure with that for La2, except that the amount of La(NO3)3·6H2O used in the first step was changed to 0.4256 g and 0.8511 g, and the corresponding catalysts were named as La4 and La8, respectively. 2.2 Evaluation of the three-way catalytic performance The catalytic performance of the monolithic catalysts was evaluated in a gas mixture that simulated actual gasoline engine emissions, the composition was as follows: C3H8: 120 ppm; C3H6: 240 ppm; CO: 5100 ppm; NO: 1000 ppm; H2: 1700 ppm; O2: 4580 ppm; H2O: 100,000 ppm; CO2: 100,000 ppm; N2 was used as the balance and the space velocity was controlled at 40,000 h −1. The detailed testing procedure was as follows: Firstly, the monolithic catalyst was placed in the reactor, and the above-mentioned gas mixture was passed through, then the reactor was heated to 550 °C and held for 1 h to activate the catalyst. After that the catalyst was cooled down to ca. 150 °C, and then the temperature was programmed rising, during this process, the compositions of the inlet and outlet gas mixtures were analyzed by an FTIR. Accordingly, the conversions of CO, HC and NO were calculated, and the concentration of NH3 was obtained as well. Moreover, to verify the stability of the catalysts, they were exposed in the reactive gas mixture at 550 °C for 100 h, after that their catalytic performance was evaluated once again. 2.3 Characterization of the catalysts The textural parameters of the catalysts were measured using a surface area & pore size analyzer (V-SordX800, Gold APP Instruments Corporation, Beijing). Before the measurement, the samples were pretreated at 300 °C for 2–5 h under vacuum, then N2 was used as the adsorbate, and the adsorption-desorption experiment was conducted at liquid nitrogen temperature (−196 °C). The phase identification of the catalysts were conducted by an X-ray diffractometer (DX-2500, Rigaku), Cu Kα (λ = 0.15406 nm) was employed as the radiation source. The powder samples were uniformly spread onto a quartz glass plate, which was then placed at the sample stage and continuously scanned in the 2θ range of 10°−90° with a step size of 0.02°. The coordination state of Al in the catalysts was analyzed by a solid state nuclear magnetic resonance (SSNMR, Bruker 300 M). 27Al SSNMR spectra were obtained at room temperature in a 9.4 T magnetic field. The dispersion of Pd species for the catalysts was determined by CO chemisorption experiment. Prior to the chemisorption measurement, the catalyst was pretreated in H2 atmosphere (20 mL/min) at 400 °C for 1 h, and then it was purged in N2 (30 mL/min) for 30 min. After cooling down to near room temperature, CO was pulsed every 2 min until no adsorption could be detected. The surface elemental information of the catalysts was analyzed by a Thermo Scientific™ K-Alpha™+ spectrometer equipped with a monochromatic Al Kα X-ray source (1486.6 eV), the measurement was operated at 100 W. All peaks would be calibrated with C1s peak at a binding energy of 284.8 eV for adventitious carbon. The surface morphology of the catalysts was observed on a scanning electron microscope (ZEISS) operated at 20 kV. Then the transmission electron microscopy (TEM) and high-resolution transmission electron microscopy (HRTEM) images were collected applying a ZEISS Libra 200 FE electron microscope operated at an accelerating voltage of 200 kV. H2-temperature programmed reduction (H2-TPR) experiment was carried out on an automatic temperature programmed chemisorbed instrument (Vodo Instrument Co., Ltd., Quzhou). Prior to the reduction experiment, the powder samples were firstly pressed into granules with appropriate size, then 100 mg of granules were placed into a quartz tube. After that N2 (20 mL/min) was passed through, and the samples were pretreated in N2 at 450 °C for 45 min. After cooled down to room temperature, the atmosphere was switched to 5 vol% H2/N2 (20 mL/min). And then temperature programmed reduction was proceeded at a constant heating rate of 10 °C/min, and the variation of H2 signal was monitored using a thermal conductivity detector (TCD). NH3-temperature programmed desorption (NH3-TPD) experiment was also performed on the above mentioned automatic temperature programmed chemisorbed instrument. The detailed process was as follows: Firstly, 100 mg of sample granules were placed into a quartz tube, which were pretreated in an Ar atmosphere (20 mL/min) at 400 °C for 45 min. After cooled down to room temperature, a gas mixture of 0.5 vol% NH3/Ar (30 mL/min) was passed through and held for 30 min. Then temperature programmed desorption was proceeded at a constant heating rate of 10 °C/min, and the variation of NH3 signal was monitored using a thermal conductivity detector (TCD). 3 Results and discussion 3.1 The three-way catalytic performance The three-way catalytic performance, in terms of conversions of C3H8, C3H6, CO, NO as well as the concentration of NH3 as function of temperature, is illustrated in Fig. 1 . As displayed therein, compared with La0, the La2O3-modified catalysts approximately show higher conversions of C3H8, C3H6, CO and NO throughout the experimental temperature range, especially for La4 with La2O3 content of 4 wt%, demonstrating that the introduction of appropriate amount of La2O3 into the Pd/Al2O3 catalyst system is beneficial to the catalytic conversions of HC/CO/NO. On the other hand, for the purpose of verification its application potential in pSCR system, particular attention should be paid to the production of NH3 during the catalytic reaction process. Fortunately, it can be found from Fig. 1(e) that the concentration of NH3 over La4 and La8 is obviously higher than that over La0 throughout the whole testing process, wherein La4 behaves somewhat better compared with La8. Therefore, it can be concluded that the introduction of appropriate amount of La2O3 into Pd/Al2O3 could not only facilitate the conversions of HC/CO/NO, but also promote the generation of NH3, and the optimal content of La2O3 is 4 wt%. In addition, the stability test results shown in Fig. S1 tell us that after exposed in the reactive gas mixture for 100 h, the conversions of C3H8, C3H6, CO and NO for the four catalysts are similar with those for the original catalysts, and the concentration of NH3 appears to be a little higher, demonstrating that both Pd/Al2O3 and the La2O3-modified catalysts possess excellent catalytic stability. 3.2 Textural properties of the catalysts The textural parameters of the various catalysts, including specific surface areas (SBET), pore volumes (V) and pore diameters (D), are summarized in Table 1 . It can be seen therein that compared with bare Pd/Al2O3 catalyst (La0), the La2O3-containing catalysts show smaller pore diameters, pore volumes and surface areas. Considering that Al2O3 powders are thermally treated at a temperature as high as 1000 °C before impregnation of precious metal solution, which may bring about sintering of smaller pores and formation of larger ones, the relatively large diameter (21.8 nm) of La0 is understandable. After introduction of La2O3, which can act as a stabilizer for Al2O3, the deterioration of the pore structure upon high temperature treatment is effectively retarded, thus smaller pore diameters are maintained for La2, La4 and La8, which consequently leads to their smaller pore volumes and surface areas. Fig. 2 display the N2 adsorption-desorption isotherms and pore size distribution curves of the various catalysts. As observed in Fig. 2(a), the isotherm of La0 can be identified as type IV and the hysteresis loop is similar with type H1, indicating that uniform cylindrical shape pores are present in La0. However, the hysteresis loops of the La2O3-containing catalysts seem to transform to type H2, meaning that ink-bottle shaped pores are presented. In addition, from Fig. 2(b), it is found that the pore sizes of La2, La4 and La8 are smaller than that of La0, and the distribution curves are narrower as well, which agrees well with the textural parameters listed in Table 1. 3.3 XRD characterization results XRD characterization was performed for the purpose of phase identification and the obtained patterns are compared in Fig. 3 . As is well known, when Al2O3 is obtained after calcination at relatively low temperature, it is probably presented as γ-Al2O3 phase, which is metastable and upon increasing calcination temperature, it would undergo gradual transformation into θ (or δ) and finally α-Al2O3 phase [26]. For bare Pd/Al2O3 catalyst (La0), θ-Al2O3 and PdO phase can be identified from its XRD pattern, which is understandable considering that the Al2O3 powders were thermally treated at 1000 °C prior to the impregnation process. As reported in the literatures [27-31], introduction of La2O3 into Al2O3 could effectively improve its stability at high temperatures, the atomically dispersed La3+ on Al2O3 surface appears to pin the oxygen substructure, thus hindering the reconstructive transformation of Al2O3 phase. It is found from Fig. 3 that although Al2O3 in La2 and La4 also presents as θ phase, their peak intensities become obviously lower, which can be attributed to the improved stability of Al2O3 induced by the introduction of La2O3, and moreover, the introduction of La2O3 could promote the dispersion of Pd species, especially for La4, the peaks characteristic of PdO phase of which are weakest, implying its highest dispersion of Pd species, which is consequently advantageous to its catalytic performance. However, for La8 with highest La2O3 content, although highest stability of Al2O3 is obtained, which could help Al2O3 predominantly maintain at γ-Al2O3 phase, undesirable catalytic performance is attained in respect that γ-Al2O3 is inferior to θ-Al2O3 to support Pd catalysts with excellent redox behavior [32,33]. On the other hand, the introduction of excessive amount of La2O3 is detrimental to the dispersion of Pd species, thus larger particles of PdO are observed, which may be another reason for its worse catalytic activity compared with La4. In addition, to disclose the evolution of phase structure of the catalysts during catalytic reaction process, the XRD patterns of the catalysts after reaction are collected and displayed in Fig. S2. It can be found therein that the crystal phase of Al2O3 for the four catalysts remains almost unchanged compared with the corresponding catalysts before reaction. However, peaks related to Pd species are absent, which is understandable in respect that PdO species would generally undergo reduction during three-way catalytic reaction process, and Pd species are more difficult to be detected by XRD technique. 3.4 27Al SSNMR analysis Chemical states of Al species in the catalysts were analyzed by 27Al SSNMR, and Fig. 4 (a) shows the obtained 27Al SSNMR spectra. Through curve fitting, three peaks at around 67 ppm, 55 ppm and 5.5 ppm are found for all samples, which is corresponded to three forms of coordination state of Al species typically presented in transitional alumina, that is, tetra-coordinated (Altetra), penta-coordinated (Alpenta) and octa-coordinated (Alocta) [34-38]. The ratios of Al species with different coordination states are calculated based on the peak areas of the three fitted peaks, and the results are compiled in Table 2 . It can be found therein that as the content of La2O3 increases, the ratio of Altetra gradually decreases, while the ratios of Alpenta and Alocta become larger. To better disclose the relationship between the content of La2O3 and the coordination state of Al species, the ratio of Altetra as a function of La2O3 content is depicted in Fig. 4(b), wherein it is found that the decrease of the ratio of Altetra is linearly correlated with the increase of La2O3 content. In addition, it is also reported that the formation of LaAlO3 by partial incorporation of La into the Al2O3 lattice would lead to stronger signals of Altetra [39]. Thus, the smaller ratio of Altetra after the introduction of La2O3 hints us that La2O3 is predominately distributed on the surface of Al2O3. In a word, it is reasonably inferred that the introduced La2O3 mainly interacts with Al2O3 by preferentially anchoring to the tetra-coordinated Al sites on the surface, which exerts positive influence on dispersing and stabilizing the ionic forms of Pd2+ on the surface of Al2O3. 3.5 Dispersion of Pd species Dispersion of Pd species is of critical importance to the catalysts in respect that it represents the metallic surface available for the catalytic reaction. Thus dispersion of Pd species is measured through CO chemisorption experiment and it is calculated under the assumption that the ratio of Pd to CO is 1:1, the obtained results are illustrated in Fig. 5 . As can be seen from Fig. 5, the dispersion of Pd species for the La2O3-modified catalysts is remarkably higher than that for bare Pd/Al2O3, demonstrating that the introduction of La2O3 could indeed promote the dispersion of Pd species, and the optimal content of La2O3 appears to be 4 wt%, which is well in line with the sequence of the three-way catalytic performance. 3.6 XPS study XPS study was performed to provide surface elemental information of the catalysts, the obtained Pd 3d, La 3d, Al 2p and O 1 s spectra are displayed in Fig. 6 , and the quantitative information about the surface elemental distribution, as well as the chemical states of Pd and O species, is summarized in Table 3 . As can be observed in Fig. 6(b), the peak intensity of La 3d increases with increasing La2O3 content, indicating that La is enriched on the surface, as also evidenced by the increasing relative amount of La in Table 3. Moreover, the binding energies of Al 2p (Fig. 6(c)) for the La2O3-modified samples shift to lower values, implying that the state of Al is affected by the addition of La2O3. This phenomenon is in good consistency with the 27Al SSNMR results. From Table 3, similar surface concentrations of Pd are observed for all catalysts, however, the chemical state of Pd varies to a large extent. Fig. 6(a) shows the curve fitting results of the Pd 3d XPS spectra, therein the XPS curves can be fitted into four peaks, which are assigned to as Pd0 3d5/2, Pd2+ 3d5/2, Pd0 3d3/2 and Pd2+ 3d3/2, respectively, from low to high binding energy direction [40,41]. Accordingly, the ratios of Pd2+ and Pd0 are calculated based on the relative areas of the four peaks. As can be found from Table 3, after La2O3 is introduced, the ratio of Pd2+ remarkably increases, especially for La4, the ratio of Pd2+ increases to 66.93%, meaning that the majority of Pd species on the surface of La4 is presented as PdO. Combining with the XRD results that the characteristic peaks of PdO phase are weakest for La4, it can be more affirmatively deduced that best dispersion state of Pd species is achieved for La4, which can well account for its superior three-way catalytic performance. With respect to the O 1 s spectra, as shown in Fig. 6(d), two types of oxygen species labeled as Oα and Oβ are resolved, and the relative ratios of Oα and Oβ are also listed in Table 3. It is generally accepted that Oα at lower binding energy is originated from lattice oxygen, and Oβ at higher binding energy is attributed to surface adsorbed oxygen, hydroxyl groups or oxygen vacancies [42]. Thus higher ratio of Oβ species is advantageous to the catalytic reactions in respect that Oβ has higher mobility than Oα [43]. Fortunately, it is found from Table 3 that the introduction of La2O3 into the Pd/Al2O3 catalyst system appears to be beneficial to obtain more Oβ species, and La4 with La2O3 content of 4 wt% possesses highest ratio of Oβ, which means largest amount of active oxygen species that can participate in the catalytic reaction process. 3.7 SEM and TEM observations SEM and TEM observations were conducted to disclose the morphological properties of the various catalysts, and the obtained images are displayed in Figs. 7-9 . From the SEM images in Fig. 7, it is found that large particles with compact morphology are presented in La0, and the La2O3-containing catalysts exhibit looser morphology with smaller particles, especially for La4 in Fig. 7(c), which could facilitate the transfer process of both the gaseous reactants and the products, thus consequently promote the catalytic conversion process. The TEM images in Fig. 8 can intuitively provide us some information about the dispersion of Pd species on the surface of the catalysts. As seen in Fig. 8(a), the black particles located on the gray substrate is possibly Pd species. While for the La2O3-containing catalysts, especially when the content of La2O3 is relatively higher, some crystalline La2O3 particles may be presented. In this case, the distinguish between La2O3 and Pd-related particles is difficult when the resolution of TEM measurement is not high enough. Notwithstanding, it can be roughly observed from Fig. 8 that the introduction of La2O3 into the Pd/Al2O3 system is advantageous for Pd species to achieve better dispersion state. Fig. 9 shows the HRTEM images of the various catalysts, wherein the particles labeled by red arrows are identified as PdO, those labeled by black arrows are recognized as metallic Pd particles, and the particles marked by yellow arrows are crystalline La2O3 particles. By careful comparison of the HRTEM images in Fig. 9, it is found that when appropriate amount of La2O3 in introduced, higher dispersion and smaller particles of Pd species are achieved for La2 and La4, which is favorable to the three-way catalytic performance. However, when the amount of La2O3 is excessive, crystalline La2O3 particles are detected for La8, which is detrimental to the dispersion of Pd species. 3.8 H2-TPR analysis H2-TPR analysis was performed to investigate the reduction property of the various catalysts, and the results are illustrated in Fig. 10 . Therein the reduction peaks are generated from the reduction of oxidative Pd2+ species in the catalysts. As is well known, when Pd species is loaded on Al2O3 support, the reduction of oxidative Pd2+ species usually takes place at considerably low temperatures [44,45]. As displayed in Fig. 10, the reduction of La0 begins at ca. 43 °C and the peak maximum appears at 62 °C. When La2O3 is introduced into the Pd/Al2O3 catalyst system, the reduction occurs at obviously lower temperatures in respect that the introduction of La2O3 could facilitate the dissociation of molecular H2 into H species on active surface sites, as a result, the following reduction of Pd2+ species could proceed more easily. Thus, the reduction of Pd2+ species may start at temperature lower than 40 °C. This may be a reason for the production of larger amount of NH3 during the three-way catalytic reaction process. On the other hand, when the content of La2O3 is excessively high, crystalline La2O3 is formed, which is detrimental to the dispersion of Pd species, consequently higher reduction temperature and more complicated reduction peak are obtained for La8. 3.9 NH3-TPD analysis Fig. 11 displays the NH3-TPD profiles of the various catalysts. In general, the NH3-TPD profiles can be categorized into two regions, that is, the desorption peak in the low-temperature range is ascribed to the weak acidic site on the surface of the catalyst, and the desorption peak in the high-temperature range is correlated with the strong acidic site [46]. As observed in Fig. 11, when La2O3 is introduced into the Pd/Al2O3 catalyst system, the desorption peak of NH3 in the high-temperature region becomes weaker, and the peak in the low-temperature region becomes somewhat stronger. As confirmed by 27Al SSNMR results, the introduced La2O3 mainly interacts with Al2O3 by preferentially anchoring to the tetra-coordinated Al sites on the surface, which can account for the decreased amount of strong acidic site on the surface. In addition, the prominent desorption performance of NH3 in low-temperature region for the La2O3-modified catalysts is beneficial to the production of NH3 during the three-way catalytic reaction process. Furthermore, for La8 with excessive content of La2O3, the complicated phase structure is responsible for the multiplet peaks of NH3 desorption. 4 Conclusions In this work, La2O3 was introduced into the Pd/Al2O3 catalyst system to promote its three-way catalytic (TWC) performance for passive selective catalytic reduction (pSCR) operation, based on the results and discussion above, the following conclusions can be drawn: 1) The introduced La2O3 mainly interacts with Al2O3 by preferentially anchoring to the tetra-coordinated Al sites on the surface. 2) The introduction of appropriate amount of La2O3 could suppress the particle aggregation of Al2O3 and promote the dispersion of Pd species, in addition, more Pd2+ species and active oxygen species are presented. 3) The low-temperature reduction capability and desorption property of NH3 are improved by the modification of La2O3. 4) Pd/Al2O3 catalyst modified by appropriate amount of La2O3 exhibits superior conversion efficiency of HC/CO/NO, as well as larger amount of NH3 production, and the optimal content of La2O3 is 4 wt%. 5) While excessive amount of La2O3 is introduced, crystalline La2O3 is formed, which is detrimental to the dispersion of Pd species and consequently results in declined three-way catalytic performance. CRediT authorship contribution statement Wenjing He: Investigation, Formal analysis, Data curation. Yanmei Kong: Investigation, Data curation. Longlong Zhang: Resources, Methodology. Huasheng Lin: Methodology, Investigation. Shuanghua Cheng: Investigation, Formal analysis. Liang Shen: Resources, Methodology. Li Lan: Writing – review & editing, Writing – original draft, Formal analysis. Shanhu Chen: Supervision, Formal analysis, Conceptualization. Meihua Zhu: Supervision, Project administration, Formal analysis, Conceptualization. Xianrong Song: Supervision, Funding acquisition. Declaration of competing interest The authors declare that they have no known competing financial interests or personal relationships that could have appeared to influence the work reported in this paper. Acknowledgement This work was supported by Jiangxi Province Key Laboratory of Organic Functional Molecules (No: 2024SSY05141). Supplementary materials Supplementary material associated with this article can be found, in the online version, at doi:10.1016/j.mcat.2024.114540. Appendix Supplementary materials Image, application 1 References [1] C.R. Thomas J.A. Pihl M.J. Lance T.J. Toops J.E. Parks II J. Lauterbach Effects of four-mode hydrothermal aging on three-way catalysts for passive selective catalytic reduction to control emissions from lean-burn gasoline engine Appl. Catal. B Environ. 244 2019 284 294 C.R. Thomas, J.A. Pihl, M.J. Lance, T.J. Toops, J.E. Parks II, J. Lauterbach, Effects of four-mode hydrothermal aging on three-way catalysts for passive selective catalytic reduction to control emissions from lean-burn gasoline engine. Appl. Catal. B Environ. 244 (2019) 284–294. [2] V.Y. Prikhodko J.E. Parks J.A. Pihl T.J. Toops Passive SCR for lean gasoline NOx control: engine-based strategies to minimize fuel penalty associated with catalytic NH3 generation Catal. Today 267 2016 202 209 V.Y. Prikhodko, J.E. Parks, J.A. Pihl, T.J. Toops, Passive SCR for lean gasoline NOx control: engine-based strategies to minimize fuel penalty associated with catalytic NH3 generation. Catal. Today 267 (2016) 202–209. [3] V.Y. Prikhodko J.E. Parks J.A. Pihl T.J. Toops Ammonia generation and utilization in a passive SCR (TWC+SCR) system on lean gasoline engine SAE Int. J. Engines 9 2016 1289 1295 V.Y. Prikhodko, J.E. Parks, J.A. Pihl, T.J. Toops, Ammonia generation and utilization in a passive SCR (TWC+SCR) system on lean gasoline engine. SAE Int. J. Engines 9 (2016) 1289–1295. [4] W. Li K.L. Perry K. Narayanaswamy C.H. Kim P. Najt Passive ammonia SCR system for lean-burn SIDI engines SAE Int. J. Fuels Lubr. 3 2010 99 106 W. Li, K.L. Perry, K. Narayanaswamy, C.H. Kim, P. Najt, Passive ammonia SCR system for lean-burn SIDI engines. SAE Int. J. Fuels Lubr. 3 (2010) 99–106. [5] S. Rood S. Eslava A. Manigrasso C. Bannister Recent advances in gasoline three-way catalyst formulation: a review Proc. IMechE Part D J. Aut. Eng. 234 2020 936 949 S. Rood, S. Eslava, A. Manigrasso, C. Bannister, Recent advances in gasoline three-way catalyst formulation: a review. Proc. IMechE Part D J. Aut. Eng. 234 (2020) 936–949. [6] X.Y. Chen Y.S. Cheng C.Y. Seo J.W. Schwank R.W. McCabe Aging, re-dispersion, and catalytic oxidation characteristics of model Pd/Al2O3 automotive three-way catalysts Appl. Catal. B Environ. 163 2015 499 509 X.Y. Chen, Y.S. Cheng, C.Y. Seo, J.W. Schwank, R.W. McCabe, Aging, re-dispersion, and catalytic oxidation characteristics of model Pd/Al2O3 automotive three-way catalysts. Appl. Catal. B Environ. 163 (2015) 499–509. [7] K. Chen J. Wan J.S. Lin R.X. Zhou Comparative study of three-way catalytic performance over Pd/CeO2-ZrO2-Al2O3 and Pd/La-Al2O3 catalysts: new insights into microstructure and thermal stability Mol. Catal. 526 2022 112361 K. Chen, J. Wan, J.S. Lin, R.X. Zhou, Comparative study of three-way catalytic performance over Pd/CeO2-ZrO2-Al2O3 and Pd/La-Al2O3 catalysts: new insights into microstructure and thermal stability. Mol. Catal. 526 (2022) 112361. [8] H. Woo E.J. Lee H. Park D. Yoon C.H. Kim K. Lee Enhancing the thermal stability and activity of Pd-Rh/Al2O3 catalyst for three-way catalytic reaction by introducing Pt and varying the synthesis method J. Environ. Chem. Eng. 11 2023 110671 H. Woo, E.J. Lee, H. Park, D. Yoon, C.H. Kim, K. Lee, Enhancing the thermal stability and activity of Pd-Rh/Al2O3 catalyst for three-way catalytic reaction by introducing Pt and varying the synthesis method. J. Environ. Chem. Eng. 11 (2023) 110671. [9] C.D. DiGiulio J.A. Pihl J.E. Parks II M.D. Amiridis T.J. Toops Passive-ammonia selective catalytic reduction (SCR): understanding NH3 formation over close-coupled three-way catalyst (TWC) Catal. Today 231 2014 33 45 C.D. DiGiulio, J.A. Pihl, J.E. Parks II, M.D. Amiridis, T.J. Toops, Passive-ammonia selective catalytic reduction (SCR): understanding NH3 formation over close-coupled three-way catalyst (TWC). Catal. Today 231 (2014) 33–45. [10] V.Y. Prokhodko J.A. Pihl T.J. Toops C.R. Thomas J.E. Parks II Effects of including a NOx storage component on a TWC when using a lean spark ignition gasoline engine combined with a passive SCR system Appl. Energ. Combust. Sci. 14 2023 100150 V.Y. Prokhodko, J.A. Pihl, T.J. Toops, C.R. Thomas, J.E. Parks II, Effects of including a NOx storage component on a TWC when using a lean spark ignition gasoline engine combined with a passive SCR system. Appl. Energ. Combust. Sci. 14 (2023) 100150. [11] C.R. Thomas J.A. Pihl V.Y. Prikhodko J. Lauterbach T.J. Toops The effects of ceria loading on three-way catalysts for passive SCR operation Catal. Commun. 156 2021 106308 C.R. Thomas, J.A. Pihl, V.Y. Prikhodko, J. Lauterbach, T.J. Toops, The effects of ceria loading on three-way catalysts for passive SCR operation. Catal. Commun. 156 (2021) 106308. [12] C. Thomas J. Pihl V. Prikhodko J. Parks II J. Lauterbach T. Toops The effects of SO2 exposure on three-way catalysts for passive SCR operation Appl. Catal. A Gen. 643 2022 118771 C. Thomas, J. Pihl, V. Prikhodko, J. Parks II, J. Lauterbach, T. Toops, The effects of SO2 exposure on three-way catalysts for passive SCR operation. Appl. Catal. A Gen. 643 (2022) 118771. [13] K. Ramanathan C.S. Sharma C.H. Kim Global kinetics for ammonia formation and oxidation reactions in a commercial three-way catalyst Ind. Eng. Chem. Res. 51 2012 1198 1208 K. Ramanathan, C.S. Sharma, C.H. Kim, Global kinetics for ammonia formation and oxidation reactions in a commercial three-way catalyst. Ind. Eng. Chem. Res. 51 (2012) 1198–1208. [14] M. Liu R.N. Yan X.T. Zhao Y.N. Wang R. Zhan H. Lin Synthesis of Pd0.01FexCe(1-x)/2Zr(1-x)/2Oy catalysts and their catalytic performance for ammonia production by passive SCR reaction New J. Chem. 45 2021 5002 5012 M. Liu, R.N. Yan, X.T. Zhao, Y.N. Wang, R. Zhan, H. Lin, Synthesis of Pd0.01FexCe(1-x)/2Zr(1-x)/2Oy catalysts and their catalytic performance for ammonia production by passive SCR reaction. New J. Chem. 45 (2021) 5002–5012. [15] W.B. Bae D.Y. Kim S.W. Byun M. Hazlett D.Y. Yoon C. Jung C.H. Kim S.B. Kang Emission of NH3 and N2O during NO reduction over commercial aged three-way catalyst (TWC) : role of individual reductants in simulated exhausts Chem. Eng. J. Adv. 9 2022 100222 W.B. Bae, D.Y. Kim, S.W. Byun, M. Hazlett, D.Y. Yoon, C. Jung, C.H. Kim, S.B. Kang, Emission of NH3 and N2O during NO reduction over commercial aged three-way catalyst (TWC) : role of individual reductants in simulated exhausts. Chem. Eng. J. Adv. 9 (2022) 100222. [16] Y.S. Liu Y.S. Ge J.W. Tan H.L. Wang Y. Ding Research on ammonia emissions characteristics from light-duty gasoline vehicles J. Environ. Sci. 106 2021 182 193 Y.S. Liu, Y.S. Ge, J.W. Tan, H.L. Wang, Y. Ding, Research on ammonia emissions characteristics from light-duty gasoline vehicles. J. Environ. Sci. 106 (2021) 182–193. [17] W.H. Dai S.S. Wang S.B. Zhang J. Zhu C.Q. Gu Z.B. Sun R.B. Xue B. Zhou A new portable open-path instrument for ambient NH3 and on-road emission measurements J. Environ. Sci. 136 2024 606 614 W.H. Dai, S.S. Wang, S.B. Zhang, J. Zhu, C.Q. Gu, Z.B. Sun, R.B. Xue, B. Zhou, A new portable open-path instrument for ambient NH3 and on-road emission measurements. J. Environ. Sci. 136 (2024) 606–614. [18] S.H. Oh T. Triplett Reaction pathways and mechanism for ammonia formation and removal over palladium-based three-way catalysts: multiple roles of CO Catal. Today 231 2014 22 32 S.H. Oh, T. Triplett, Reaction pathways and mechanism for ammonia formation and removal over palladium-based three-way catalysts: multiple roles of CO. Catal. Today 231 (2014) 22–32. [19] C.X. Wang J.W. Tan G. Harle H.M. Gong W.Z. Xia T.T. Zheng D.X. Yang Y.S. Ge Y.K. Zhao Ammonia formation over Pd/Rh three-way catalysts during lean-to-rich fluctuations: the effect of catalyst ageing, exhaust temperature, lambda and duration in rich conditions Environ. Sci. Technol. 53 2019 12621 12628 C.X. Wang, J.W. Tan, G. Harle, H.M. Gong, W.Z. Xia, T.T. Zheng, D.X. Yang, Y.S. Ge, Y.K. Zhao, Ammonia formation over Pd/Rh three-way catalysts during lean-to-rich fluctuations: the effect of catalyst ageing, exhaust temperature, lambda and duration in rich conditions. Environ. Sci. Technol. 53 (2019) 12621–12628. [20] E.C. Adams M. Skoglundh M. Folic E.C. Bendixen Ammonia formation over supported platinum and palladium catalysts Appl. Catal. B Environ. 165 2015 10 19 E.C. Adams, M. Skoglundh, M. Folic, E.C. Bendixen, Ammonia formation over supported platinum and palladium catalysts. Appl. Catal. B Environ. 165 (2015) 10–19. [21] J. Kašpar P. Fornasiero N. Hickey Automotive catalytic converters: current status and some perspectives Catal. Today 77 2003 419 449 J. Kašpar, P. Fornasiero, N. Hickey, Automotive catalytic converters: current status and some perspectives. Catal. Today 77 (2003) 419–449. [22] A. Papavasiliou A. Tsetsekou V. Matsouka M. Konsolakis I.V. Yentekakis An investigation of the role of Zr and La dopants into Ce1-x-yZrxLayOδ enriched γ-Al2O3 TWC washcoats Appl. Catal. A Gen. 382 2010 73 84 A. Papavasiliou, A. Tsetsekou, V. Matsouka, M. Konsolakis, I.V. Yentekakis, An investigation of the role of Zr and La dopants into Ce1-x-yZrxLayOδ enriched γ-Al2O3 TWC washcoats. Appl. Catal. A Gen. 382 (2010) 73–84. [23] Q.Y. Wang G.F. Li B. Zhao M.Q. Shen R.X. Zhou The effect of La doping on the structure of Ce0.2Zr0.8O2 and the catalytic performance of its supported Pd-only three-way catalyst Appl. Catal. B Environ. 101 2010 150 159 Q.Y. Wang, G.F. Li, B. Zhao, M.Q. Shen, R.X. Zhou, The effect of La doping on the structure of Ce0.2Zr0.8O2 and the catalytic performance of its supported Pd-only three-way catalyst. Appl. Catal. B Environ. 101 (2010) 150–159. [24] Y. Jing G. Wang K.W. Ting Z. Maeno K. Oshima S. Satokawa S. Nagaoka K. Shimizu T. Toyao Roles of the basic metals La, Ba, and Sr as additives in Al2O3-supported Pd-based three-way catalysts J. Catal. 400 2021 387 396 Y. Jing, G. Wang, K.W. Ting, Z. Maeno, K. Oshima, S. Satokawa, S. Nagaoka, K. Shimizu, T. Toyao, Roles of the basic metals La, Ba, and Sr as additives in Al2O3-supported Pd-based three-way catalysts. J. Catal. 400 (2021) 387–396. [25] E.J. Peterson A.T. DeLaRiva S. Lin R.S. Johnson H. Guo J.T. Miller J.H. Kwak C.H.F. Peden B. Kiefer L.F. Allard F.H. Ribeiro A.K. Datye Low-temperature carbon monoxide oxidation catalysed by regenerable atomically dispersed palladium on alumina Nat. Commun. 5 2014 4885 E.J. Peterson, A.T. DeLaRiva, S. Lin, R.S. Johnson, H. Guo, J.T. Miller, J.H. Kwak, C.H.F. Peden, B. Kiefer, L.F. Allard, F.H. Ribeiro, A.K. Datye, Low-temperature carbon monoxide oxidation catalysed by regenerable atomically dispersed palladium on alumina. Nat. Commun. 5 (2014) 4885. [26] R.D. Monte P. Fornasiero S. Desinan J. Kašpar J.M. Gatica J.J. Calvino E. Fonda Thermal stabilization of CexZr1-xO2 oxygen storage promoters by addition of Al2O3: effect of thermal aging on textural, structural, and morphological properties Chem. Mater. 16 2004 4273 4285 R.D. Monte, P. Fornasiero, S. Desinan, J. Kašpar, J.M. Gatica, J.J. Calvino, E. Fonda, Thermal stabilization of CexZr1-xO2 oxygen storage promoters by addition of Al2O3: effect of thermal aging on textural, structural, and morphological properties. Chem. Mater. 16 (2004) 4273–4285. [27] E.J. Peterson A.T. DeLaRiva S. Lin R.S. Johnson H. Guo J.T. Miller J.H. Kwak C.H.F. Peden B. Kiefer L.F. Allard F.H. Ribeiro A.K. Datye Low-temperature carbon monoxide oxidation catalysed by regenerable atomically dispersed palladium on alumina Nat. Commun. 5 2014 4885 E.J. Peterson, A.T. DeLaRiva, S. Lin, R.S. Johnson, H. Guo, J.T. Miller, J.H. Kwak, C.H.F. Peden, B. Kiefer, L.F. Allard, F.H. Ribeiro, A.K. Datye, Low-temperature carbon monoxide oxidation catalysed by regenerable atomically dispersed palladium on alumina. Nat. Commun. 5 (2014) 4885. [28] H. Schaper E.B.M. Doesburg L.L. Van Reijen The influence of lanthanum oxide on the thermal stability of gamma alumina catalyst supports Appl. Catal. 7 1983 211 220 H. Schaper, E.B.M. Doesburg, L.L. Van Reijen, The influence of lanthanum oxide on the thermal stability of gamma alumina catalyst supports. Appl. Catal. 7 (1983) 211–220. [29] L.P. Haack J.E. deVries K. Otto M.S. Chattha Characterization of lanthanum-modified γ-alumina by X-ray photoelectron spectroscopy and carbon dioxide absorption Appl. Catal. A Gen. 82 1992 199 214 L.P. Haack, J.E. deVries, K. Otto, M.S. Chattha, Characterization of lanthanum-modified γ-alumina by X-ray photoelectron spectroscopy and carbon dioxide absorption. Appl. Catal. A Gen. 82 (1992) 199–214. [30] S. Wang A.Y. Borisevich S.N. Rashkeev M.V. Glazoff K. Sohlberg S.J. Pennycook S.T. Pantelides Dopants adsorbed as single atoms prevent degradation of catalysts Nat. Mater. 3 2004 143 146 S. Wang, A.Y. Borisevich, S.N. Rashkeev, M.V. Glazoff, K. Sohlberg, S.J. Pennycook, S.T. Pantelides, Dopants adsorbed as single atoms prevent degradation of catalysts. Nat. Mater. 3 (2004) 143–146. [31] H. Schaper E.B.M. Doesburg P.H.M. De Korte L.L. Van Reijen Thermal stabilization of high surface area alumina Solid State Ionics 16 1985 261 266 H. Schaper, E.B.M. Doesburg, P.H.M. De Korte, L.L. Van Reijen, Thermal stabilization of high surface area alumina. Solid State Ionics 16 (1985) 261–266. [32] J.H. Park J.H. Ahn H.I. Sim Low-temperature combustion of methane using PdO/Al2O3 catalyst: influence of crystalline phase of Al2O3 support Catal. Commun. 56 2014 157 163 J.H. Park, J.H. Ahn, H.I. Sim, Low-temperature combustion of methane using PdO/Al2O3 catalyst: influence of crystalline phase of Al2O3 support. Catal. Commun. 56 (2014) 157–163. [33] K. Murata D. Kosuge J. Ohyama Y. Mahara Y. Yamamoto S. Arai A. Satsuma Exploiting metal-support interactions to tune the redox properties of supported Pd catalysts for methane combustion ACS Catal 10 2020 1381 1387 K. Murata, D. Kosuge, J. Ohyama, Y. Mahara, Y. Yamamoto, S. Arai, A. Satsuma, Exploiting metal-support interactions to tune the redox properties of supported Pd catalysts for methane combustion. ACS Catal. 10 (2020) 1381–1387. [34] Z.C. Zhao D. Xiao K.Z. Chen R. Wang L.X. Liang Z.M. Liu I. Hung Z.H. Gan G.J. Hou Nature of five-coordinated Al in γ-Al2O3 revealed by ulra-high-field solid-state NMR ACS Cent. Sci. 8 2022 795 803 Z.C. Zhao, D. Xiao, K.Z. Chen, R. Wang, L.X. Liang, Z.M. Liu, I. Hung, Z.H. Gan, G.J. Hou, Nature of five-coordinated Al in γ-Al2O3 revealed by ulra-high-field solid-state NMR. ACS Cent. Sci. 8 (2022) 795–803. [35] H. Jeong O. Kwon B. Kim J. Bae S. Shin H. Kim J. Kim H. Lee Highly durable metal ensemble catalysts with full dispersion for automotive applications beyond single-atom catalysts Nat. Catal. 3 2020 368 375 H. Jeong, O. Kwon, B. Kim, J. Bae, S. Shin, H. Kim, J. Kim, H. Lee, Highly durable metal ensemble catalysts with full dispersion for automotive applications beyond single-atom catalysts. Nat. Catal. 3 (2020) 368–375. [36] J.H. Kwak J.Z. Hu D.H. Kim J. Szanyi C.H.F. Peden Penta-coordinated Al3+ ions as preferential nucleation sites for BaO on γ-Al2O3: an ultra-high-magnetic field 27Al MAS NMR study J. Catal. 251 2007 189 194 J.H. Kwak, J.Z. Hu, D.H. Kim, J. Szanyi, C.H.F. Peden, Penta-coordinated Al3+ ions as preferential nucleation sites for BaO on γ-Al2O3: an ultra-high-magnetic field 27Al MAS NMR study. J. Catal. 251 (2007) 189–194. [37] J.H. Song S. Yoo J. Yoo S. Park M.Y. Gim T.H. Kim I.K. Song Hydrogen production by steam reforming of ethanol over Ni/Al2O3-La2O3 xerogel catalysts Mol. Catal. 434 2017 123 133 J.H. Song, S. Yoo, J. Yoo, S. Park, M.Y. Gim, T.H. Kim, I.K. Song, Hydrogen production by steam reforming of ethanol over Ni/Al2O3-La2O3 xerogel catalysts. Mol. Catal. 434 (2017) 123–133. [38] L.A. O'Dell S.L.P. Savin A.V. Chadwick M.E. Smith A 27Al MAS NMR study of a sol-gel produced alumina: identification of the NMR parameters of the θ-Al2O3 transition alumina phase Solid State Nucl. Mag. 31 2007 169 173 L.A. O'Dell, S.L.P. Savin, A.V. Chadwick, M.E. Smith, A 27Al MAS NMR study of a sol-gel produced alumina: identification of the NMR parameters of the θ-Al2O3 transition alumina phase. Solid State Nucl. Mag. 31 (2007) 169–173. [39] J.C.S. Araujo D. Zanchet R. Rinaldi U. Schuchardt C.E. Hori J.L.G. Fierro J.M.C. Bueno The effects of La2O3 on the structural properties of La2O3-Al2O3 prepared by the sol-gel method and on the catalytic performance of Pt/La2O3-Al2O3 towards steam reforming and partial oxidation of methane Appl. Catal. B Environ. 84 2008 552 562 J.C.S. Araujo, D. Zanchet, R. Rinaldi, U. Schuchardt, C.E. Hori, J.L.G. Fierro, J.M.C. Bueno, The effects of La2O3 on the structural properties of La2O3-Al2O3 prepared by the sol-gel method and on the catalytic performance of Pt/La2O3-Al2O3 towards steam reforming and partial oxidation of methane. Appl. Catal. B Environ. 84 (2008) 552–562. [40] M.Q. Shen M. Yang J. Wang J. Wen M.W. Zhao W.L. Wang Pd/support interface-promoted Pd-Ce0.7Zr0.3O2-Al2O3 automobile three-way catalysts: studying the dynamic oxygen storage capacity and CO, C3H8, and NO conversion J. Phys. Chem. C 113 2009 3212 3221 M.Q. Shen, M. Yang, J. Wang, J. Wen, M.W. Zhao, W.L. Wang, Pd/support interface-promoted Pd-Ce0.7Zr0.3O2-Al2O3 automobile three-way catalysts: studying the dynamic oxygen storage capacity and CO, C3H8, and NO conversion. J. Phys. Chem. C 113 (2009) 3212–3221. [41] X.L. Weng J.Y. Zhang Z.B. Wu Y. Liu H.Q. Wang J.A. Darr Continuous syntheses of highly dispersed composite nanocatalysts via simultaneous co-precipitation in supercritical water Appl. Catal. B Environ. 103 2011 453 461 X.L. Weng, J.Y. Zhang, Z.B. Wu, Y. Liu, H.Q. Wang, J.A. Darr, Continuous syntheses of highly dispersed composite nanocatalysts via simultaneous co-precipitation in supercritical water. Appl. Catal. B Environ. 103 (2011) 453–461. [42] D.R. Sellick A. Aranda T. García J.M. López B. Solsona A.M. Mastral D.J. Morgan A.F. Carley S.H. Taylor Influence of the preparation method on the activity of ceria zirconia mixed oxides for naphthalene total oxidation Appl. Catal. B Environ. 132-133 2013 98 106 D.R. Sellick, A. Aranda, T. García, J.M. López, B. Solsona, A.M. Mastral, D.J. Morgan, A.F. Carley, S.H. Taylor, Influence of the preparation method on the activity of ceria zirconia mixed oxides for naphthalene total oxidation. Appl. Catal. B Environ. 132-133 (2013) 98–106. [43] H.C. Li K.Z. Li X. Zhu Y.P. Du Y.G. Wei K. Zhai H. Wang Synthesis of mesoporous PrxZr1-xO2-δ solid solution with high thermal stability for catalytic soot oxidation J. Ind. Eng. Chem. 54 2017 126 136 H.C. Li, K.Z. Li, X. Zhu, Y.P. Du, Y.G. Wei, K. Zhai, H. Wang, Synthesis of mesoporous PrxZr1-xO2-δ solid solution with high thermal stability for catalytic soot oxidation. J. Ind. Eng. Chem. 54 (2017) 126–136. [44] S.K. Matam E.H. Otal M.H. Aguirre A. Winkler A. Ulrich D. Rentsch A. Weidenkaff D. Ferri Thermal and chemical aging of model three-way catalyst Pd/Al2O3 and its impact on the conversion of CNG vehicle exhaust Catal. Today 184 2012 237 244 S.K. Matam, E.H. Otal, M.H. Aguirre, A. Winkler, A. Ulrich, D. Rentsch, A. Weidenkaff, D. Ferri, Thermal and chemical aging of model three-way catalyst Pd/Al2O3 and its impact on the conversion of CNG vehicle exhaust. Catal. Today 184 (2012) 237–244. [45] W. Zhang Y.L. Zhu S.S. Niu Y.W. Li A study of furfural decarbonylation on K-doped Pd/Al2O3 catalysts J. Mol. Catal. A Chem. 335 2011 71 81 W. Zhang, Y.L. Zhu, S.S. Niu, Y.W. Li, A study of furfural decarbonylation on K-doped Pd/Al2O3 catalysts. J. Mol. Catal. A Chem. 335 (2011) 71–81. [46] Y. Cao D. Fan P. Tian L. Cao T.T. Sun S.T. Xu M. Yang Z.M. Liu The influence of low-temperature hydration methods on the stability of Cu-SAPO-34 SCR catalyst Chem. Eng. J. 354 2018 85 92 Y. Cao, D. Fan, P. Tian, L. Cao, T.T. Sun, S.T. Xu, M. Yang, Z.M. Liu, The influence of low-temperature hydration methods on the stability of Cu-SAPO-34 SCR catalyst. Chem. Eng. J. 354 (2018) 85–92.",
      "scopus-id": "85203442673",
      "coredata": {
        "eid": "1-s2.0-S2468823124007223",
        "dc:description": "For three-way catalysts (TWC) applied in lean burn gasoline engines for passive selective catalytic reduction (pSCR) operation, besides the conversion efficiency of HC/CO/NO, the production of NH3 is also an important concern. In this work, La2O3 was introduced into the Pd/Al2O3 catalyst system, the influence on its TWC performance for pSCR operation was investigated, and the physicochemical properties were characterized by a range of techniques. The results reveal that the introduced La2O3 mainly interacts with Al2O3 by preferentially anchoring to the tetra-coordinated Al sites on the surface. When the catalyst is modified by appropriate amount of La2O3 (4 wt%), higher dispersion of Pd species, larger amount of Pd2+ and active oxygen species are achieved, which well contributes to improved low-temperature reduction ability and NH3 desorption property of the catalyst. As a consequence, excellent catalytic conversions of HC/CO/NO are obtained, and meanwhile, higher concentration of NH3 is generated, making the modified catalyst more promising for pSCR operation.",
        "openArchiveArticle": "false",
        "prism:coverDate": "2024-12-31",
        "openaccessUserLicense": null,
        "prism:aggregationType": "Journal",
        "prism:url": "https://api.elsevier.com/content/article/pii/S2468823124007223",
        "dc:creator": [
          {
            "@_fa": "true",
            "$": "He, Wenjing"
          },
          {
            "@_fa": "true",
            "$": "Kong, Yanmei"
          },
          {
            "@_fa": "true",
            "$": "Zhang, Longlong"
          },
          {
            "@_fa": "true",
            "$": "Lin, Huasheng"
          },
          {
            "@_fa": "true",
            "$": "Cheng, Shuanghua"
          },
          {
            "@_fa": "true",
            "$": "Shen, Liang"
          },
          {
            "@_fa": "true",
            "$": "Lan, Li"
          },
          {
            "@_fa": "true",
            "$": "Chen, Shanhu"
          },
          {
            "@_fa": "true",
            "$": "Zhu, Meihua"
          },
          {
            "@_fa": "true",
            "$": "Song, Xianrong"
          }
        ],
        "link": [
          {
            "@_fa": "true",
            "@rel": "self",
            "@href": "https://api.elsevier.com/content/article/pii/S2468823124007223"
          },
          {
            "@_fa": "true",
            "@rel": "scidir",
            "@href": "https://www.sciencedirect.com/science/article/pii/S2468823124007223"
          }
        ],
        "dc:format": "application/json",
        "openaccessType": null,
        "pii": "S2468-8231(24)00722-3",
        "prism:volume": "569",
        "articleNumber": "114540",
        "prism:publisher": "Elsevier B.V. All rights are reserved, including those for text and data mining, AI training, and similar technologies.",
        "dc:title": "Promotion of La2O3 on Pd/Al2O3 three-way catalyst for passive selective catalytic reduction operation",
        "prism:copyright": "© 2024 Elsevier B.V. All rights are reserved, including those for text and data mining, AI training, and similar technologies.",
        "openaccess": "0",
        "prism:issn": "24688231",
        "dcterms:subject": [
          {
            "@_fa": "true",
            "$": "TWC for pSCR operation"
          },
          {
            "@_fa": "true",
            "$": "NH3"
          },
          {
            "@_fa": "true",
            "$": "La2O3"
          },
          {
            "@_fa": "true",
            "$": "Pd/Al2O3"
          }
        ],
        "openaccessArticle": "false",
        "prism:publicationName": "Molecular Catalysis",
        "openaccessSponsorType": null,
        "prism:pageRange": "114540",
        "pubType": "fla",
        "prism:coverDisplayDate": "December 2024",
        "prism:doi": "10.1016/j.mcat.2024.114540",
        "prism:startingPage": "114540",
        "dc:identifier": "doi:10.1016/j.mcat.2024.114540",
        "openaccessSponsorName": null
      },
      "objects": {
        "object": [
          {
            "@category": "standard",
            "@height": "317",
            "@width": "395",
            "@_fa": "true",
            "$": "https://api.elsevier.com/content/object/eid/1-s2.0-S2468823124007223-gr10.jpg?httpAccept=%2A%2F%2A",
            "@multimediatype": "JPEG image file",
            "@type": "IMAGE-DOWNSAMPLED",
            "@size": "23558",
            "@ref": "gr10",
            "@mimetype": "image/jpeg"
          },
          {
            "@category": "standard",
            "@height": "221",
            "@width": "565",
            "@_fa": "true",
            "$": "https://api.elsevier.com/content/object/eid/1-s2.0-S2468823124007223-gr2.jpg?httpAccept=%2A%2F%2A",
            "@multimediatype": "JPEG image file",
            "@type": "IMAGE-DOWNSAMPLED",
            "@size": "41719",
            "@ref": "gr2",
            "@mimetype": "image/jpeg"
          },
          {
            "@category": "standard",
            "@height": "320",
            "@width": "395",
            "@_fa": "true",
            "$": "https://api.elsevier.com/content/object/eid/1-s2.0-S2468823124007223-gr3.jpg?httpAccept=%2A%2F%2A",
            "@multimediatype": "JPEG image file",
            "@type": "IMAGE-DOWNSAMPLED",
            "@size": "44838",
            "@ref": "gr3",
            "@mimetype": "image/jpeg"
          },
          {
            "@category": "standard",
            "@height": "615",
            "@width": "809",
            "@_fa": "true",
            "$": "https://api.elsevier.com/content/object/eid/1-s2.0-S2468823124007223-gr1.jpg?httpAccept=%2A%2F%2A",
            "@multimediatype": "JPEG image file",
            "@type": "IMAGE-DOWNSAMPLED",
            "@size": "109884",
            "@ref": "gr1",
            "@mimetype": "image/jpeg"
          },
          {
            "@category": "standard",
            "@height": "317",
            "@width": "395",
            "@_fa": "true",
            "$": "https://api.elsevier.com/content/object/eid/1-s2.0-S2468823124007223-gr11.jpg?httpAccept=%2A%2F%2A",
            "@multimediatype": "JPEG image file",
            "@type": "IMAGE-DOWNSAMPLED",
            "@size": "29331",
            "@ref": "gr11",
            "@mimetype": "image/jpeg"
          },
          {
            "@category": "standard",
            "@height": "520",
            "@width": "678",
            "@_fa": "true",
            "$": "https://api.elsevier.com/content/object/eid/1-s2.0-S2468823124007223-gr6.jpg?httpAccept=%2A%2F%2A",
            "@multimediatype": "JPEG image file",
            "@type": "IMAGE-DOWNSAMPLED",
            "@size": "133042",
            "@ref": "gr6",
            "@mimetype": "image/jpeg"
          },
          {
            "@category": "standard",
            "@height": "567",
            "@width": "753",
            "@_fa": "true",
            "$": "https://api.elsevier.com/content/object/eid/1-s2.0-S2468823124007223-gr7.jpg?httpAccept=%2A%2F%2A",
            "@multimediatype": "JPEG image file",
            "@type": "IMAGE-DOWNSAMPLED",
            "@size": "152821",
            "@ref": "gr7",
            "@mimetype": "image/jpeg"
          },
          {
            "@category": "standard",
            "@height": "232",
            "@width": "565",
            "@_fa": "true",
            "$": "https://api.elsevier.com/content/object/eid/1-s2.0-S2468823124007223-gr4.jpg?httpAccept=%2A%2F%2A",
            "@multimediatype": "JPEG image file",
            "@type": "IMAGE-DOWNSAMPLED",
            "@size": "36989",
            "@ref": "gr4",
            "@mimetype": "image/jpeg"
          },
          {
            "@category": "standard",
            "@height": "282",
            "@width": "393",
            "@_fa": "true",
            "$": "https://api.elsevier.com/content/object/eid/1-s2.0-S2468823124007223-gr5.jpg?httpAccept=%2A%2F%2A",
            "@multimediatype": "JPEG image file",
            "@type": "IMAGE-DOWNSAMPLED",
            "@size": "18563",
            "@ref": "gr5",
            "@mimetype": "image/jpeg"
          },
          {
            "@category": "standard",
            "@height": "527",
            "@width": "527",
            "@_fa": "true",
            "$": "https://api.elsevier.com/content/object/eid/1-s2.0-S2468823124007223-gr8.jpg?httpAccept=%2A%2F%2A",
            "@multimediatype": "JPEG image file",
            "@type": "IMAGE-DOWNSAMPLED",
            "@size": "125198",
            "@ref": "gr8",
            "@mimetype": "image/jpeg"
          },
          {
            "@category": "standard",
            "@height": "375",
            "@width": "753",
            "@_fa": "true",
            "$": "https://api.elsevier.com/content/object/eid/1-s2.0-S2468823124007223-gr9.jpg?httpAccept=%2A%2F%2A",
            "@multimediatype": "JPEG image file",
            "@type": "IMAGE-DOWNSAMPLED",
            "@size": "148959",
            "@ref": "gr9",
            "@mimetype": "image/jpeg"
          },
          {
            "@category": "standard",
            "@height": "200",
            "@width": "286",
            "@_fa": "true",
            "$": "https://api.elsevier.com/content/object/eid/1-s2.0-S2468823124007223-ga1.jpg?httpAccept=%2A%2F%2A",
            "@multimediatype": "JPEG image file",
            "@type": "IMAGE-DOWNSAMPLED",
            "@size": "35198",
            "@ref": "ga1",
            "@mimetype": "image/jpeg"
          },
          {
            "@category": "thumbnail",
            "@height": "164",
            "@width": "204",
            "@_fa": "true",
            "$": "https://api.elsevier.com/content/object/eid/1-s2.0-S2468823124007223-gr10.sml?httpAccept=%2A%2F%2A",
            "@multimediatype": "GIF image file",
            "@type": "IMAGE-THUMBNAIL",
            "@size": "6390",
            "@ref": "gr10",
            "@mimetype": "image/gif"
          },
          {
            "@category": "thumbnail",
            "@height": "86",
            "@width": "219",
            "@_fa": "true",
            "$": "https://api.elsevier.com/content/object/eid/1-s2.0-S2468823124007223-gr2.sml?httpAccept=%2A%2F%2A",
            "@multimediatype": "GIF image file",
            "@type": "IMAGE-THUMBNAIL",
            "@size": "7834",
            "@ref": "gr2",
            "@mimetype": "image/gif"
          },
          {
            "@category": "thumbnail",
            "@height": "164",
            "@width": "202",
            "@_fa": "true",
            "$": "https://api.elsevier.com/content/object/eid/1-s2.0-S2468823124007223-gr3.sml?httpAccept=%2A%2F%2A",
            "@multimediatype": "GIF image file",
            "@type": "IMAGE-THUMBNAIL",
            "@size": "11083",
            "@ref": "gr3",
            "@mimetype": "image/gif"
          },
          {
            "@category": "thumbnail",
            "@height": "164",
            "@width": "215",
            "@_fa": "true",
            "$": "https://api.elsevier.com/content/object/eid/1-s2.0-S2468823124007223-gr1.sml?httpAccept=%2A%2F%2A",
            "@multimediatype": "GIF image file",
            "@type": "IMAGE-THUMBNAIL",
            "@size": "11077",
            "@ref": "gr1",
            "@mimetype": "image/gif"
          },
          {
            "@category": "thumbnail",
            "@height": "164",
            "@width": "204",
            "@_fa": "true",
            "$": "https://api.elsevier.com/content/object/eid/1-s2.0-S2468823124007223-gr11.sml?httpAccept=%2A%2F%2A",
            "@multimediatype": "GIF image file",
            "@type": "IMAGE-THUMBNAIL",
            "@size": "7546",
            "@ref": "gr11",
            "@mimetype": "image/gif"
          },
          {
            "@category": "thumbnail",
            "@height": "164",
            "@width": "214",
            "@_fa": "true",
            "$": "https://api.elsevier.com/content/object/eid/1-s2.0-S2468823124007223-gr6.sml?httpAccept=%2A%2F%2A",
            "@multimediatype": "GIF image file",
            "@type": "IMAGE-THUMBNAIL",
            "@size": "14622",
            "@ref": "gr6",
            "@mimetype": "image/gif"
          },
          {
            "@category": "thumbnail",
            "@height": "164",
            "@width": "218",
            "@_fa": "true",
            "$": "https://api.elsevier.com/content/object/eid/1-s2.0-S2468823124007223-gr7.sml?httpAccept=%2A%2F%2A",
            "@multimediatype": "GIF image file",
            "@type": "IMAGE-THUMBNAIL",
            "@size": "24486",
            "@ref": "gr7",
            "@mimetype": "image/gif"
          },
          {
            "@category": "thumbnail",
            "@height": "90",
            "@width": "219",
            "@_fa": "true",
            "$": "https://api.elsevier.com/content/object/eid/1-s2.0-S2468823124007223-gr4.sml?httpAccept=%2A%2F%2A",
            "@multimediatype": "GIF image file",
            "@type": "IMAGE-THUMBNAIL",
            "@size": "7777",
            "@ref": "gr4",
            "@mimetype": "image/gif"
          },
          {
            "@category": "thumbnail",
            "@height": "157",
            "@width": "219",
            "@_fa": "true",
            "$": "https://api.elsevier.com/content/object/eid/1-s2.0-S2468823124007223-gr5.sml?httpAccept=%2A%2F%2A",
            "@multimediatype": "GIF image file",
            "@type": "IMAGE-THUMBNAIL",
            "@size": "5819",
            "@ref": "gr5",
            "@mimetype": "image/gif"
          },
          {
            "@category": "thumbnail",
            "@height": "164",
            "@width": "164",
            "@_fa": "true",
            "$": "https://api.elsevier.com/content/object/eid/1-s2.0-S2468823124007223-gr8.sml?httpAccept=%2A%2F%2A",
            "@multimediatype": "GIF image file",
            "@type": "IMAGE-THUMBNAIL",
            "@size": "15830",
            "@ref": "gr8",
            "@mimetype": "image/gif"
          },
          {
            "@category": "thumbnail",
            "@height": "109",
            "@width": "219",
            "@_fa": "true",
            "$": "https://api.elsevier.com/content/object/eid/1-s2.0-S2468823124007223-gr9.sml?httpAccept=%2A%2F%2A",
            "@multimediatype": "GIF image file",
            "@type": "IMAGE-THUMBNAIL",
            "@size": "16956",
            "@ref": "gr9",
            "@mimetype": "image/gif"
          },
          {
            "@category": "thumbnail",
            "@height": "153",
            "@width": "219",
            "@_fa": "true",
            "$": "https://api.elsevier.com/content/object/eid/1-s2.0-S2468823124007223-ga1.sml?httpAccept=%2A%2F%2A",
            "@multimediatype": "GIF image file",
            "@type": "IMAGE-THUMBNAIL",
            "@size": "15492",
            "@ref": "ga1",
            "@mimetype": "image/gif"
          },
          {
            "@category": "high",
            "@height": "1402",
            "@width": "1749",
            "@_fa": "true",
            "$": "https://api.elsevier.com/content/object/eid/1-s2.0-S2468823124007223-gr10_lrg.jpg?httpAccept=%2A%2F%2A",
            "@multimediatype": "JPEG image file",
            "@type": "IMAGE-HIGH-RES",
            "@size": "143717",
            "@ref": "gr10",
            "@mimetype": "image/jpeg"
          },
          {
            "@category": "high",
            "@height": "979",
            "@width": "2500",
            "@_fa": "true",
            "$": "https://api.elsevier.com/content/object/eid/1-s2.0-S2468823124007223-gr2_lrg.jpg?httpAccept=%2A%2F%2A",
            "@multimediatype": "JPEG image file",
            "@type": "IMAGE-HIGH-RES",
            "@size": "314042",
            "@ref": "gr2",
            "@mimetype": "image/jpeg"
          },
          {
            "@category": "high",
            "@height": "1417",
            "@width": "1749",
            "@_fa": "true",
            "$": "https://api.elsevier.com/content/object/eid/1-s2.0-S2468823124007223-gr3_lrg.jpg?httpAccept=%2A%2F%2A",
            "@multimediatype": "JPEG image file",
            "@type": "IMAGE-HIGH-RES",
            "@size": "317221",
            "@ref": "gr3",
            "@mimetype": "image/jpeg"
          },
          {
            "@category": "high",
            "@height": "2726",
            "@width": "3583",
            "@_fa": "true",
            "$": "https://api.elsevier.com/content/object/eid/1-s2.0-S2468823124007223-gr1_lrg.jpg?httpAccept=%2A%2F%2A",
            "@multimediatype": "JPEG image file",
            "@type": "IMAGE-HIGH-RES",
            "@size": "787834",
            "@ref": "gr1",
            "@mimetype": "image/jpeg"
          },
          {
            "@category": "high",
            "@height": "1402",
            "@width": "1749",
            "@_fa": "true",
            "$": "https://api.elsevier.com/content/object/eid/1-s2.0-S2468823124007223-gr11_lrg.jpg?httpAccept=%2A%2F%2A",
            "@multimediatype": "JPEG image file",
            "@type": "IMAGE-HIGH-RES",
            "@size": "180494",
            "@ref": "gr11",
            "@mimetype": "image/jpeg"
          },
          {
            "@category": "high",
            "@height": "2302",
            "@width": "3000",
            "@_fa": "true",
            "$": "https://api.elsevier.com/content/object/eid/1-s2.0-S2468823124007223-gr6_lrg.jpg?httpAccept=%2A%2F%2A",
            "@multimediatype": "JPEG image file",
            "@type": "IMAGE-HIGH-RES",
            "@size": "981129",
            "@ref": "gr6",
            "@mimetype": "image/jpeg"
          },
          {
            "@category": "high",
            "@height": "2509",
            "@width": "3333",
            "@_fa": "true",
            "$": "https://api.elsevier.com/content/object/eid/1-s2.0-S2468823124007223-gr7_lrg.jpg?httpAccept=%2A%2F%2A",
            "@multimediatype": "JPEG image file",
            "@type": "IMAGE-HIGH-RES",
            "@size": "1474103",
            "@ref": "gr7",
            "@mimetype": "image/jpeg"
          },
          {
            "@category": "high",
            "@height": "1028",
            "@width": "2500",
            "@_fa": "true",
            "$": "https://api.elsevier.com/content/object/eid/1-s2.0-S2468823124007223-gr4_lrg.jpg?httpAccept=%2A%2F%2A",
            "@multimediatype": "JPEG image file",
            "@type": "IMAGE-HIGH-RES",
            "@size": "252662",
            "@ref": "gr4",
            "@mimetype": "image/jpeg"
          },
          {
            "@category": "high",
            "@height": "1248",
            "@width": "1742",
            "@_fa": "true",
            "$": "https://api.elsevier.com/content/object/eid/1-s2.0-S2468823124007223-gr5_lrg.jpg?httpAccept=%2A%2F%2A",
            "@multimediatype": "JPEG image file",
            "@type": "IMAGE-HIGH-RES",
            "@size": "108468",
            "@ref": "gr5",
            "@mimetype": "image/jpeg"
          },
          {
            "@category": "high",
            "@height": "2331",
            "@width": "2333",
            "@_fa": "true",
            "$": "https://api.elsevier.com/content/object/eid/1-s2.0-S2468823124007223-gr8_lrg.jpg?httpAccept=%2A%2F%2A",
            "@multimediatype": "JPEG image file",
            "@type": "IMAGE-HIGH-RES",
            "@size": "1976095",
            "@ref": "gr8",
            "@mimetype": "image/jpeg"
          },
          {
            "@category": "high",
            "@height": "1661",
            "@width": "3333",
            "@_fa": "true",
            "$": "https://api.elsevier.com/content/object/eid/1-s2.0-S2468823124007223-gr9_lrg.jpg?httpAccept=%2A%2F%2A",
            "@multimediatype": "JPEG image file",
            "@type": "IMAGE-HIGH-RES",
            "@size": "2709955",
            "@ref": "gr9",
            "@mimetype": "image/jpeg"
          },
          {
            "@category": "high",
            "@height": "886",
            "@width": "1269",
            "@_fa": "true",
            "$": "https://api.elsevier.com/content/object/eid/1-s2.0-S2468823124007223-ga1_lrg.jpg?httpAccept=%2A%2F%2A",
            "@multimediatype": "JPEG image file",
            "@type": "IMAGE-HIGH-RES",
            "@size": "263548",
            "@ref": "ga1",
            "@mimetype": "image/jpeg"
          },
          {
            "@category": "standard",
            "@_fa": "true",
            "$": "https://api.elsevier.com/content/object/eid/1-s2.0-S2468823124007223-mmc1.docx?httpAccept=%2A%2F%2A",
            "@multimediatype": "Microsoft Word file",
            "@type": "APPLICATION",
            "@size": "169939",
            "@ref": "mmc1",
            "@mimetype": "application/word"
          },
          {
            "@category": "standard",
            "@_fa": "true",
            "$": "https://api.elsevier.com/content/object/eid/1-s2.0-S2468823124007223-am.pdf?httpAccept=%2A%2F%2A",
            "@multimediatype": "Acrobat PDF file",
            "@type": "AAM-PDF",
            "@size": "2371818",
            "@ref": "am",
            "@mimetype": "application/pdf"
          }
        ]
      },
      "link": {
        "@rel": "abstract",
        "@href": "https://api.elsevier.com/content/abstract/scopus_id/85203442673"
      }
    }
  }
}