{
  "metadata": {
    "title": "Theoretical prediction of metal-doped high C/N-ratio C<ce:italic><ce:inf loc=post>x</ce:inf></ce:italic>N<ce:inf loc=post>3</ce:inf> (<ce:italic>x</ce:italic>=7, 10, 13, 19) as single-atom catalysts for CO<ce:inf loc=post>2</ce:inf>RR",
    "authors": "; ; ",
    "journal": "Molecular Catalysis",
    "date": "2025-02-15",
    "doi": "10.1016/j.mcat.2024.114808",
    "abstract": "",
    "uri": "https://api.elsevier.com/content/article/pii/S2468823124009908",
    "pii": "S2468823124009908"
  },
  "fulltext": {
    "full-text-retrieval-response": {
      "scopus-eid": "2-s2.0-85214558449",
      "originalText": "serial JL 315758 291210 291744 291790 291809 31 Molecular Catalysis MOLECULARCATALYSIS 2025-01-11 2025-01-11 2025-01-11 2025-01-11 2025-01-25T11:56:29 1-s2.0-S2468823124009908 S2468-8231(24)00990-8 S2468823124009908 10.1016/j.mcat.2024.114808 S300 S300.1 FULL-TEXT 1-s2.0-S2468823124X0019X 2025-02-24T04:38:27.787218Z 0 0 20250215 2025 2025-01-11T22:40:47.553054Z absattachment articleinfo articlenumber articletitlenorm authfirstinitialnorm authfirstsurnamenorm cid cids contenttype copyright crossmark dateloaded dateloadedtxt datesearch datesort dateupdated dco docsubtype doctype doi eid ewtransactionid hubeid indexeddate issn issnnorm itemstage itemtransactionid itemweight openaccess openarchive pg pgfirst pii piinorm pubdatestart pubdatetxt pubyr sectiontitle sortorder srctitle srctitlenorm srctype ssids alllist content subj subheadings suppl tomb volfirst volissue volumelist webpdf webpdfpagecount yearnav figure table e-component body mmlmath acknowledge affil appendices articletitle auth authfirstini authfull authkeywords authlast grantnumber grantsponsor highlightsabst orcid primabst ref specialabst 2468-8231 24688231 true 573 573 C Volume 573 24 114808 114808 114808 20250215 15 February 2025 2025-02-15 2025 Regular Papers article fla © 2024 Elsevier B.V. All rights are reserved, including those for text and data mining, AI training, and similar technologies. THEORETICALPREDICTIONMETALDOPEDHIGHCNRATIOCXN3X7101319SINGLEATOMCATALYSTSFORCO2RR QIU H 1 Introduction 2 Computational methods 3 Results and discussion 3.1 Structure and stability of catalyst 3.2 CO2 adsorption 3.3 Reaction mechanism and catalytic activity 3.3.1 CO2RR reaction pathways to CO on catalysts 3.3.2 CO2RR reaction pathways to HCOOH on catalysts 3.3.3 CO2RR reaction pathways to CH3OH on catalysts 3.3.4 CO2RR reaction pathways to CH4 on catalysts 3.3.5 Side reaction and solvation effect 3.4 Origin of catalytic activity 4 Conclusion CRediT authorship contribution statement Acknowledgements Appendix Supplementary materials References CHU 2012 294 303 S MILLAR 2017 741 747 R LV 2024 128613 G GAO 2024 5011 5021 Y CHEN 2024 e202411591 S ZHANG 2023 2304379 B TAN 2021 765 780 X LIU 2024 3911 3918 Z VASILEFF 2017 1700759 A WANG 2022 22681 22696 J ZHANG 2017 11326 11353 L XIE 2018 41 54 H WOLDU 2022 214340 A LI 2024 3266 3277 J SUN 2023 126114 B TOMBOC 2020 1908398 G CHEN 2023 e202315621 S CUI 2024 104353 C ZHU 2024 74 86 C LEE 2023 2200236 S XU 2024 147837 Q WANG 2023 2759 2803 S WANG 2023 601 616 Y ZHUO 2020 12315 12341 H WU 2023 501 534 Y CHEN 2023 109942 Q YUAN 2024 2283 2300 X YANG 2020 3047 3054 H BESHARAT 2022 5605 5660 F MA 2022 120695 M LI 2023 238 M HASSAN 2022 15409 15417 A TAN 2021 6082 6089 R CAO 2023 141936 S UMER 2022 24280 24289 M DU 2022 3252 3262 P YANG 2023 108404 Q CHEN 2024 126552 Q SHEN 2023 e9120096 J DELLEY 1990 508 517 B DELLEY 2000 7756 7764 B PERDEW 1996 3865 J GUO 2019 11042 11054 X NORSKOV 2004 17886 17892 J SHI 2018 014104 X SONG 2022 121721 Q CHEN 2019 20777 20784 Z WANG 2020 12217 12314 Y CUI 2023 127541 L CUI 2018 15262 15272 X XUE 2024 112778 P NORSKOV 2009 37 46 J WANG 2023 e202303794 X QIUX2025X114808 QIUX2025X114808XH 2027-01-11T00:00:00.000Z 2027-01-11T00:00:00.000Z http://creativecommons.org/licenses/by-nc-nd/4.0/ © 2024 Elsevier B.V. All rights are reserved, including those for text and data mining, AI training, and similar technologies. 2025-02-23T14:06:41.206Z http://vtw.elsevier.com/data/voc/AddOnTypes/50.7/aggregated-refined http://sws.geonames.org/1814991 National Natural Science Foundation of China 52234003 NSFC National Natural Science Foundation of China http://data.elsevier.com/vocabulary/SciValFunders/501100001809 http://sws.geonames.org/1814991/ 23XNSYSX0010 http://sws.geonames.org/1814991 Southwest Petroleum University SWPU Southwest Petroleum University http://data.elsevier.com/vocabulary/SciValFunders/501100004753 http://sws.geonames.org/1814991/ National Supercomputing Center in Shenzhen http://sws.geonames.org/1814991 Science and Technology Project of Sichuan Province 25QYCX0163 SPDST Science and Technology Department of Sichuan Province http://data.elsevier.com/vocabulary/SciValFunders/501100004829 http://sws.geonames.org/1814991/ This work is supported by the Key Program of National Natural Science Foundation of China (52234003), the Special Project of Science and Technology Strategic Cooperation between Nanchong City and Southwest Petroleum University (23XNSYSX0010) and the Science and Technology Project of Sichuan Province (25QYCX0163). We acknowledge the National Supercomputing Center in Shenzhen and the High-Performance Computing platform of Southwest Petroleum University for providing the computational resources and Materials Studio software. https://doi.org/10.15223/policy-017 https://doi.org/10.15223/policy-037 https://doi.org/10.15223/policy-012 https://doi.org/10.15223/policy-029 https://doi.org/10.15223/policy-004 item S2468-8231(24)00990-8 S2468823124009908 1-s2.0-S2468823124009908 10.1016/j.mcat.2024.114808 315758 2025-01-25T12:10:06.185744Z 2025-02-15 1-s2.0-S2468823124009908-main.pdf https://s3-eu-west-1.amazonaws.com/prod-ucs-content-store-eu-west/content/pii:S2468823124009908/MAIN/application/pdf/b7cb04fa3967d7b9c378317cea94ad1d/main.pdf main.pdf pdf true 6052981 MAIN 11 1-s2.0-S2468823124009908-main_1.png https://s3-eu-west-1.amazonaws.com/prod-ucs-content-store-eu-west/content/pii:S2468823124009908/PREVIEW/image/png/cfc3a6f53b31d8922fd42121f8b6129b/main_1.png main_1.png png 58609 849 656 IMAGE-WEB-PDF 1 1-s2.0-S2468823124009908-gr1.jpg https://s3-eu-west-1.amazonaws.com/prod-ucs-content-store-eu-west/content/pii:S2468823124009908/gr1/DOWNSAMPLED/image/jpeg/1c45d43a84d4b3898782b2a52de2f49f/gr1.jpg gr1 gr1.jpg jpg 44200 238 376 IMAGE-DOWNSAMPLED 1-s2.0-S2468823124009908-gr2.jpg https://s3-eu-west-1.amazonaws.com/prod-ucs-content-store-eu-west/content/pii:S2468823124009908/gr2/DOWNSAMPLED/image/jpeg/5808e825d41ee712f2592e79129ba644/gr2.jpg gr2 gr2.jpg jpg 105996 570 791 IMAGE-DOWNSAMPLED 1-s2.0-S2468823124009908-ga1.jpg https://s3-eu-west-1.amazonaws.com/prod-ucs-content-store-eu-west/content/pii:S2468823124009908/ga1/DOWNSAMPLED/image/jpeg/de195bf040f4510cae947684aeadbaaf/ga1.jpg ga1 true ga1.jpg jpg 39471 200 292 IMAGE-DOWNSAMPLED 1-s2.0-S2468823124009908-gr3.jpg https://s3-eu-west-1.amazonaws.com/prod-ucs-content-store-eu-west/content/pii:S2468823124009908/gr3/DOWNSAMPLED/image/jpeg/05892becbff34412bf54a93d0ee90389/gr3.jpg gr3 gr3.jpg jpg 162642 725 659 IMAGE-DOWNSAMPLED 1-s2.0-S2468823124009908-gr4.jpg https://s3-eu-west-1.amazonaws.com/prod-ucs-content-store-eu-west/content/pii:S2468823124009908/gr4/DOWNSAMPLED/image/jpeg/c744eda2bae64b17775479628911d9ad/gr4.jpg gr4 gr4.jpg jpg 129605 936 791 IMAGE-DOWNSAMPLED 1-s2.0-S2468823124009908-gr5.jpg https://s3-eu-west-1.amazonaws.com/prod-ucs-content-store-eu-west/content/pii:S2468823124009908/gr5/DOWNSAMPLED/image/jpeg/d12cf4aaa262517aa02d7f1d27f77e72/gr5.jpg gr5 gr5.jpg jpg 35514 185 508 IMAGE-DOWNSAMPLED 1-s2.0-S2468823124009908-gr6.jpg https://s3-eu-west-1.amazonaws.com/prod-ucs-content-store-eu-west/content/pii:S2468823124009908/gr6/DOWNSAMPLED/image/jpeg/e9ddf7798ea80d519f64b26fd685de05/gr6.jpg gr6 gr6.jpg jpg 193645 997 650 IMAGE-DOWNSAMPLED 1-s2.0-S2468823124009908-gr7.jpg https://s3-eu-west-1.amazonaws.com/prod-ucs-content-store-eu-west/content/pii:S2468823124009908/gr7/DOWNSAMPLED/image/jpeg/4abb25818238410ee2ae8160057021ab/gr7.jpg gr7 gr7.jpg jpg 48164 250 659 IMAGE-DOWNSAMPLED 1-s2.0-S2468823124009908-gr8.jpg https://s3-eu-west-1.amazonaws.com/prod-ucs-content-store-eu-west/content/pii:S2468823124009908/gr8/DOWNSAMPLED/image/jpeg/2487fabb49faef7c2e54e6d8499d92d4/gr8.jpg gr8 gr8.jpg jpg 59451 636 791 IMAGE-DOWNSAMPLED 1-s2.0-S2468823124009908-gr1.sml https://s3-eu-west-1.amazonaws.com/prod-ucs-content-store-eu-west/content/pii:S2468823124009908/gr1/THUMBNAIL/image/gif/42f7b2e8c5a07ab41bd8a33e50fa3662/gr1.sml gr1 gr1.sml sml 13929 139 219 IMAGE-THUMBNAIL 1-s2.0-S2468823124009908-gr2.sml https://s3-eu-west-1.amazonaws.com/prod-ucs-content-store-eu-west/content/pii:S2468823124009908/gr2/THUMBNAIL/image/gif/d1270422eb9a95f37e352a1828eef11a/gr2.sml gr2 gr2.sml sml 12971 158 219 IMAGE-THUMBNAIL 1-s2.0-S2468823124009908-ga1.sml https://s3-eu-west-1.amazonaws.com/prod-ucs-content-store-eu-west/content/pii:S2468823124009908/ga1/THUMBNAIL/image/gif/42cdb18db68c083c250a210103362f73/ga1.sml ga1 true ga1.sml sml 29645 150 219 IMAGE-THUMBNAIL 1-s2.0-S2468823124009908-gr3.sml https://s3-eu-west-1.amazonaws.com/prod-ucs-content-store-eu-west/content/pii:S2468823124009908/gr3/THUMBNAIL/image/gif/9b5055382d9381c0d4daf697a1a5dcc0/gr3.sml gr3 gr3.sml sml 16701 164 149 IMAGE-THUMBNAIL 1-s2.0-S2468823124009908-gr4.sml https://s3-eu-west-1.amazonaws.com/prod-ucs-content-store-eu-west/content/pii:S2468823124009908/gr4/THUMBNAIL/image/gif/b692c8504f0f1965fea547a423a7647b/gr4.sml gr4 gr4.sml sml 8764 163 138 IMAGE-THUMBNAIL 1-s2.0-S2468823124009908-gr5.sml https://s3-eu-west-1.amazonaws.com/prod-ucs-content-store-eu-west/content/pii:S2468823124009908/gr5/THUMBNAIL/image/gif/1c66d70c52595d5e9cc5c013c1d1012b/gr5.sml gr5 gr5.sml sml 12542 80 219 IMAGE-THUMBNAIL 1-s2.0-S2468823124009908-gr6.sml https://s3-eu-west-1.amazonaws.com/prod-ucs-content-store-eu-west/content/pii:S2468823124009908/gr6/THUMBNAIL/image/gif/547d96c1bc93355f574acfb5507f1f0d/gr6.sml gr6 gr6.sml sml 10573 164 107 IMAGE-THUMBNAIL 1-s2.0-S2468823124009908-gr7.sml https://s3-eu-west-1.amazonaws.com/prod-ucs-content-store-eu-west/content/pii:S2468823124009908/gr7/THUMBNAIL/image/gif/24308aa19753fa105236f0106b5d8ceb/gr7.sml gr7 gr7.sml sml 8582 83 219 IMAGE-THUMBNAIL 1-s2.0-S2468823124009908-gr8.sml https://s3-eu-west-1.amazonaws.com/prod-ucs-content-store-eu-west/content/pii:S2468823124009908/gr8/THUMBNAIL/image/gif/4c311532e894dc8d91ae440523ca48b6/gr8.sml gr8 gr8.sml sml 7343 164 204 IMAGE-THUMBNAIL 1-s2.0-S2468823124009908-gr1_lrg.jpg https://s3-eu-west-1.amazonaws.com/prod-ucs-content-store-eu-west/content/pii:S2468823124009908/HIGHRES/image/jpeg/1500d64f852ad5ae7b78e98928ffd2c3/gr1_lrg.jpg gr1 gr1_lrg.jpg jpg 270130 1055 1667 IMAGE-HIGH-RES 1-s2.0-S2468823124009908-gr2_lrg.jpg https://s3-eu-west-1.amazonaws.com/prod-ucs-content-store-eu-west/content/pii:S2468823124009908/HIGHRES/image/jpeg/10dc4d04c038607f5d6e3848c015f557/gr2_lrg.jpg gr2 gr2_lrg.jpg jpg 704716 2524 3500 IMAGE-HIGH-RES 1-s2.0-S2468823124009908-ga1_lrg.jpg https://s3-eu-west-1.amazonaws.com/prod-ucs-content-store-eu-west/content/pii:S2468823124009908/HIGHRES/image/jpeg/b39c79b4b5a1484127bd749a22e45a6e/ga1_lrg.jpg ga1 true ga1_lrg.jpg jpg 280568 886 1296 IMAGE-HIGH-RES 1-s2.0-S2468823124009908-gr3_lrg.jpg https://s3-eu-west-1.amazonaws.com/prod-ucs-content-store-eu-west/content/pii:S2468823124009908/HIGHRES/image/jpeg/c40d3e4b8238e072661bf4e1c2c32e70/gr3_lrg.jpg gr3 gr3_lrg.jpg jpg 1047408 3211 2917 IMAGE-HIGH-RES 1-s2.0-S2468823124009908-gr4_lrg.jpg https://s3-eu-west-1.amazonaws.com/prod-ucs-content-store-eu-west/content/pii:S2468823124009908/HIGHRES/image/jpeg/a7fe23e3d56b089ffe21e30fbd62cf3b/gr4_lrg.jpg gr4 gr4_lrg.jpg jpg 822183 4142 3500 IMAGE-HIGH-RES 1-s2.0-S2468823124009908-gr5_lrg.jpg https://s3-eu-west-1.amazonaws.com/prod-ucs-content-store-eu-west/content/pii:S2468823124009908/HIGHRES/image/jpeg/26c9fac00c64ea608541d8a88e9b5483/gr5_lrg.jpg gr5 gr5_lrg.jpg jpg 274840 821 2250 IMAGE-HIGH-RES 1-s2.0-S2468823124009908-gr6_lrg.jpg https://s3-eu-west-1.amazonaws.com/prod-ucs-content-store-eu-west/content/pii:S2468823124009908/HIGHRES/image/jpeg/eca224e6c7a264421661a8ecbc32ded1/gr6_lrg.jpg gr6 gr6_lrg.jpg jpg 1207537 4417 2879 IMAGE-HIGH-RES 1-s2.0-S2468823124009908-gr7_lrg.jpg https://s3-eu-west-1.amazonaws.com/prod-ucs-content-store-eu-west/content/pii:S2468823124009908/HIGHRES/image/jpeg/fb49b5d57e8c00fb66966d48f77d92b4/gr7_lrg.jpg gr7 gr7_lrg.jpg jpg 280210 1106 2917 IMAGE-HIGH-RES 1-s2.0-S2468823124009908-gr8_lrg.jpg https://s3-eu-west-1.amazonaws.com/prod-ucs-content-store-eu-west/content/pii:S246882312500001X/HIGHRES/image/jpeg/e703f6ca098cc32efa16df494a790710/gr8_lrg.jpg gr8 gr8_lrg.jpg jpg 388959 2815 3500 IMAGE-HIGH-RES 1-s2.0-S2468823124009908-mmc1.docx https://s3-eu-west-1.amazonaws.com/prod-ucs-content-store-eu-west/content/pii:S2468823124009908/mmc1/MAIN/application/vnd.openxmlformats-officedocument.wordprocessingml.document/9a05a26be9623874ba2410fc032747f1/mmc1.docx mmc1 mmc1.docx docx 3990578 APPLICATION 1-s2.0-S2468823124009908-si1.svg https://s3-eu-west-1.amazonaws.com/prod-ucs-content-store-eu-west/content/pii:S2468823124009908/image/svg+xml/62948e13c0b02eeccf172ed0f4f4edc6/si1.svg si1 si1.svg svg 7518 ALTIMG 1-s2.0-S2468823124009908-si2.svg https://s3-eu-west-1.amazonaws.com/prod-ucs-content-store-eu-west/content/pii:S2468823124009908/image/svg+xml/6f02bf86792e1a8a5b4bb0ce539988f7/si2.svg si2 si2.svg svg 17086 ALTIMG 1-s2.0-S2468823124009908-si3.svg https://s3-eu-west-1.amazonaws.com/prod-ucs-content-store-eu-west/content/pii:S2468823124009908/image/svg+xml/a21b628e7b0bd37158c37d090c31540d/si3.svg si3 si3.svg svg 14745 ALTIMG 1-s2.0-S2468823124009908-si4.svg https://s3-eu-west-1.amazonaws.com/prod-ucs-content-store-eu-west/content/pii:S2468823124009908/image/svg+xml/ab0bcfdc911306fce36eae9d21fbba37/si4.svg si4 si4.svg svg 9355 ALTIMG 1-s2.0-S2468823124009908-si5.svg https://s3-eu-west-1.amazonaws.com/prod-ucs-content-store-eu-west/content/pii:S2468823124009908/image/svg+xml/31bf0a5ecc84ed30f63999df48cbf758/si5.svg si5 si5.svg svg 4382 ALTIMG 1-s2.0-S2468823124009908-si6.svg https://s3-eu-west-1.amazonaws.com/prod-ucs-content-store-eu-west/content/pii:S2468823124009908/image/svg+xml/212d3d3abf78cef42b55159ca99e5367/si6.svg si6 si6.svg svg 7619 ALTIMG MCAT 114808 114808 S2468-8231(24)00990-8 10.1016/j.mcat.2024.114808 Elsevier B.V. Fig. 1 Top and side views of constructed (a) C7N3, (b) C10N3, (c) C1 3N3, and (d) C19N3. Fig 1 Fig. 2 (a)The E f and U diss values of M-C x N3 (x = 7, 10, 13, 19). First principles molecular dynamics simulations of (b) Ru-C7N3, (c) Rh-C7N3, and (d) Pd-C7N3. Fig 2 Fig. 3 Optimized adsorption configurations, adsorption energies, and the amount of charge transfer for CO2 adsorbed on (a) Ru-C x N3, (b) Rh-C x N3, and (c) Pd-C x N3. Fig 3 Fig. 4 PDOS of *CO2 on (a) Ru-C7N3, (b) Ru-C19N3, (c) Rh-C7N3, (d) Rh-C19N3, (e) Pd-C7N3, and (f) Pd-C19N3. Fig 4 Fig. 5 Reaction pathways for CO2RR on M-C x N3. Fig 5 Fig. 6 Gibbs free energy diagrams and reaction pathways for all C1 products of CO2RR on (a) Ru-C7N3, (b) Ru-C10N3, (c) Ru-C1 3N3, (d) Ru-C19N3, (e) Rh-C7N3, (f) Rh-C10N3, (g) Rh-C1 3N3, and (h) Rh-C19N3. Fig 6 Fig. 7 (a) Gibbs free energy diagram for the HER on Ru-C x N3 and Rh-C x N3. (b) Limiting potential differences (U L(CO2RR) − U L (HER)) of Ru-C x N3 and Rh-C x N3. Fig 7 Fig. 8 Scaling relationships of (a) ε d and ΔG *OCHO, (b) ε d and x of C x N3, (c) ICOHP and ΔG *OCHO. Fig 8 Table 1 U L values, products, and PDS of Ru- and Rh-C x N3 and similar catalysts reported previously for C1 products. Table 1 Catalysts PDS U L (V) Product Ru-C7N3 * + CO2 → *OCHO −0.36 HCOOH Ru-C10N3 * + CO2 → *OCHO −0.33 HCOOH Ru-C10N3 * + CO2 → *OCHO −0.33 CH3OH Ru-C1 3N3 * + CO2 → *OCHO −0.30 HCOOH Ru-C19N3 * + CO2 → *OCHO −0.18 HCOOH Rh-C7N3 * + CO2 → *COOH −0.36 HCOOH Rh-C10N3 * + CO2 → *COOH −0.49 HCOOH Rh-C1 3N3 * + CO2 → *COOH −0.55 HCOOH Rh-C19N3 *COOH → *HCOOH −0.35 HCOOH Ru@C3N4[50] * + CO2 → *COOH −0.61 HCOOH Rh-C3N[51] *CHO → *CH2O −0.57 CH2O Ru@C2N[52] *CO → *CHO −0.56 CH3OH Rh@C2N[52] *CO → *CHO −0.95 CH3OH Theoretical prediction of metal-doped high C/N-ratio C x N3 (x=7, 10, 13, 19) as single-atom catalysts for CO2RR Haoyang Qiu Writing – original draft Visualization Resources Investigation Formal analysis Data curation a b Huohai Yang Writing – original draft Visualization Resources Investigation c Qigang Chen Writing – original draft Visualization Resources Investigation Formal analysis Data curation a Manxi Leng Writing – review & editing d Xu Yang Writing – review & editing Supervision Resources Methodology b ⁎ Xin Chen Writing – review & editing Supervision Resources Project administration Methodology Conceptualization a b ⁎ a State Key Laboratory of Oil and Gas Reservoir Geology and Exploitation, Southwest Petroleum University State Key Laboratory of Oil and Gas Reservoir Geology and Exploitation Southwest Petroleum University aState Key Laboratory of Oil and Gas Reservoir Geology and Exploitation, Southwest Petroleum University b Center for Computational Chemistry and Molecular Simulation, College of Chemistry and Chemical Engineering, Southwest Petroleum University, Chengdu 610500, China Center for Computational Chemistry and Molecular Simulation College of Chemistry and Chemical Engineering Southwest Petroleum University Chengdu 610500 China bCenter for Computational Chemistry and Molecular Simulation, College of Chemistry and Chemical Engineering, Southwest Petroleum University, Chengdu 610500, China c School of Petroleum Engineering, Southwest Petroleum University, Chengdu 610500, China School of Petroleum Engineering Southwest Petroleum University Chengdu 610500 China cSchool of Petroleum Engineering, Southwest Petroleum University, Chengdu 610500, China d School of New Energy and Materials, Southwest Petroleum University, Nanchong 623300, PR China School of New Energy and Materials Southwest Petroleum University Nanchong 623300 PR China dSchool of New Energy and Materials, Southwest Petroleum University, Nanchong 623300, PR China ⁎ Corresponding authors. The development of efficient catalysts for the electrocatalytic carbon dioxide reduction reaction (CO2RR) has emerged as a primary focus in contemporary research. In this study, a series of single-atom catalysts are constructed by doping Ru, Rh, and Pd into C x N3 (x = 7, 10, 13, 19), denoted as M-C x N3. Density functional theory (DFT) methods are employed to systematically investigate the CO2RR catalytic activity and mechanism on M-C x N3. The catalysts are found to exhibit thermodynamic, electrochemical, and dynamic stability, as evidenced by formation energy calculations, dissolution potential assessments, and first principles molecular dynamics simulations. Gibbs free energy calculations reveal that Ru-C x N3 demonstrates exceptional catalytic selectivity towards HCOOH production, with optimal catalytic activity observed at low limiting potentials (x = 7: –0.36 V, x = 10: –0.33 V, x = 13: –0.30 V, and x = 19: –0.18 V). Furthermore, Ru-C x N3 effectively suppresses the competitive hydrogen evolution reaction (HER). Linear relationships between the Gibbs free energy change of the key intermediate *OCHO and the catalyst d band center, as well as the integration crystal orbital Hamiltonian population (ICOHP), indicate that Ru doping and higher C/N-ratios in C x N3 enhance catalytic performance for CO2RR. This computational study provides comprehensive guidance and insights for the experimental synthesis and exploration of CO2RR electrocatalysts. Graphical abstract Image, graphical abstract Keywords Single-atom catalyst Carbon nitride materials Density functional theory Carbon dioxide reduction reaction Data availability Data will be made available on request. 1 Introduction The excessive exploitation and utilization of fossil fuels have resulted in substantial carbon dioxide (CO2) emissions, disrupting the carbon cycle and precipitating a global climate crisis [1–5]. The direct conversion of CO2 into value-added chemicals and fuels through renewable electricity is considered an environmentally favorable approach for establishing a carbon-neutral society [6–8]. However, the stable C = O bonding (750 kJ mol−1) and the high activation barrier required to break the symmetrical linear structure render the electrocatalytic CO2RR process challenging [9,10]. Moreover, CO2RR is typically accompanied by a competitive HER, involving multi-electron/proton transfer steps and generating numerous reaction intermediates, which results in low efficiency and selectivity of CO2RR [11]. Consequently, the utilization of catalysts is proposed as an effective strategy to address these issues. In recent years, Cu-based catalysts have been the focus of research and application in catalyzing CO2RR due to their unique capacity to produce various hydrocarbons or organic oxygenates, such as methane (CH4), ethane (C2H4), methanol (CH3OH), and ethanal (CH3CHO). However, problems such as low selectivity and high over-potential significantly limit their further application. [5,12–19]. Therefore, there is a pressing need for high-performance catalysts with excellent product selectivity and high Faraday efficiency that can accelerate the CO2RR process at low over-potential to improve the energy efficiency of CO2RR. Single-atom catalysts (SACs) have recently garnered increasing attention and study due to their unique electronic structure, 100 % atomic utilization, and excellent catalytic performance in the field of electrocatalysis [20–23]. The substrates of SACs play a crucial role in modulating catalytic properties. Various materials, including graphene [24], metal–organic frameworks (MOFs) [25], boron nitride (BN) [26], and carbon nitrides (C x N y ) [27–29] have been reported to exhibit different catalytic activity and selectivity in CO2RR when loaded with a single metal atom to form SACs. Carbon nitrides, particularly C x N y , a polymeric semiconductor with a moderate bandgap and a series of unique electronic and chemical properties, have been extensively studied as substrates for CO2RR catalysis by SACs [30]. Commonly studied carbon nitrides materials include g-C3N4, C2N, and C3N , which have been extensively investigated both experimentally and theoretically. For example, Yang et al. have reported catalyst that loads a single Cu atom into g-C3N4 substrate for efficient CH4 production from CO2RR, achieving the highest CH4 Faraday efficiency of 49.04 % [31]. Hasson et al. have found that a single Zr atom doped into a C2N substrate exhibits better catalytic performance on CO2RR than double or triple Zr atoms doped by means of density functional theory (DFT) methods [32]. Similarly, Zhang et al. have found that single Cu, Co, Fe, and Mn atoms embedded into C3 N for catalyzing CO2RR exhibited good performance with promising application prospects [33]. These studies have shown that doping a single metal atom into C x N y to serve as the active site alters the material property from semiconducting to metallic, resulting in a more favorable electronic structure and thus enhancing electrocatalytic performance. Regarding C x N y with high C/N-ratios, such as C7N3, C10N3, C1 3N3, and C19N3, these materials are predicted to be promising candidates for high-performance electronic devices and energy conversion applications. Moreover, C x N3 (x = 7, 10, 13, 19) have been verified to be energetically, dynamically, and mechanically stable, indicating their experimental feasibility [34]. Furthermore, their porous geometric constructions facilitate the convenient doping of metal atoms to serve as active sites. Consequently, it is hypothesized that single metal atoms doped into C x N3 may exhibit significant electrocatalytic activity. However, comprehensive studies on the catalytic ability of such high C/N-ratio C x N y and the mechanisms of catalyzing CO2RR are currently lacking. In this investigation, a series of catalysts have been constructed by doping single metal atoms of Ruthenium (Ru), Rhodium (Rh), and Palladium (Pd) into C x N3 (x = 7, 10, 13, 19), designated as M-C x N3. The reason for choosing these three group Ⅷ metals is because they exhibit good CO2RR activity in forming SACs in previous works [35–40]. The catalytic performance of these materials has been systematically examined using DFT methods. Initially, the formation energy and dissolution potential of these catalysts were calculated to assess their thermodynamic and electrochemical stability. Subsequently, the adsorption and activation behavior of CO2 on the catalyst active sites were explored, as the disruption of the robust symmetrical linear structure of the CO2 molecule is crucial for catalyzing the CO2RR. A comprehensive calculation of the Gibbs free energy change for elementary reactions was conducted to obtain the limiting potential of all C1 products, thereby elucidating the catalytic activity of these materials. Furthermore, the selectivity between CO2RR and the competing HER on the catalysts was considered by comparing the limiting potentials of the two reactions. To investigate the origin of catalytic activity, the electronic band structures of pristine C x N3 and Ru-C x N3 were analyzed to understand the regulatory effect of Ru on C x N3. Moreover, linear relationships between the Gibbs free energy change of *OCHO and the catalyst d band center, as well as the integrated crystal orbital Hamiltonian population of Ru-O, indicate that as the C/N-ratio of C x N3 increases, the adsorption of *OCHO weakens, leading to enhanced catalytic activity. 2 Computational methods In this work, all the relevant calculations were executed using a spin-unrestricted DFT methods implemented by the DMol3 module in the Materials Studio software [41,42]. The Perdew-Burke-Ernzerhof (PBE) functional of the Generalized Gradient Approximation (GGA) was utilized to represent the exchange and correlation model. To describe the atomic orbitals, the double numerical plus polarization (DNP) basis set was employed [43]. The convergence tolerance for energy change, max force, and max displacement were 1 × 10−5 Ha (1 Ha = 27.2114 eV), 2 × 10−3 Ha Å−1, and 5 × 10−3 Å, respectively. To avoid the interactions between periodic images, a vacuum layer with a thickness of 30 Å was added. The Brillouin-zone was sampled using a 3 × 3 × 1 k-point mesh. Additionally, the parameters used for the calculation of electronic structure were consistent with those used for structure optimization. The electronic structure analysis methods considered in this work include PDOS, the COHP, the deformation charge density, and the Hirshfeld charge. It is important to note that the Van der Waals (vdW) interactions can influence the adsorption of CO2 molecule, thereby having a certain effect on the catalytic activity. However, in order to compare the results with other similar works, we ignore them in this work. The stability of M-C x N3 (x = 7, 10, 13, 19) is evaluated through the Formation energy (E f), and it is defined as: (1) E f = E M − CxN 3 − E CxN 3 − E M where E M-C x N3 indicates the total energy of single metal atoms doped into C x N3, E C x N3 is the energy of C x N3, E M represents metal atom in bulk structure. The electrochemical stability of M-C x N3 is evaluated by the dissolution potential (U diss) of metal atom is calculated using the following equation [44]: (2) U d i s s = U ∘ d i s s ( m e t a l , b u l k ) − E f / e N e where U°diss(metal, bulk) is the standard dissolution potential of metal in bulk phase, N e is denoted the number of electrons involved during dissolution. The Adsorption energy (E ads) is calculated by the under formula: (3) E ads = E total − E spei ces − E M − CxN 3 where E total is the total energy of M-C x N3 binding with adsorbed species, E speices is the energy of adsorbed species. The computational hydrogen electrode method (CHE) model by Nørskov et al. was used for calculating the Gibbs free energy [45]. The calculation of Gibbs free energy change (ΔG) is using the following formula: (4) Δ G = Δ E + Δ Z P E + ∫ C P d T − T Δ S in which ΔE is the difference of energy changes by DFT calculation results, ΔZPE, ΔS, and ∫ C P d T are the zero-point energy correction, entropy change, and the enthalpic (heat capacity) corrections, respectively. T is the temperature (298.15 K). The limiting potential (U L) is calculated by following equation: (5) U L = − Δ G m a x / e where ΔG max is the ΔG of the potential determining step (PDS). 3 Results and discussion 3.1 Structure and stability of catalyst The C7N3, C10N3, C1 3N3, and C19N3 monolayers can be constructed based on RG2 method [46]. Initially, a six-membered ring was removed from a graphene supercell to create a hole, and the C atoms situated on the edge of the hole were subsequently replaced by N atoms, as illustrated in Fig. S1. The 4-fold cell of C x N3 (C8 x N24, the 2 × 2 supercell) are optimized and presented in Fig. 1a –d. There is an intrinsic central cavity that single metal atom can be securely anchored and form SACs. n this study, Ru, Rh, and Pd were chosen for doping into C x N3, resulting in M-C x N3 (M = Ru, Rh, Pd; x = 7, 10, 13, 19). After structural optimization, the metal atoms in all 12 catalysts were found to be surrounded by two N atoms, as depicted in Fig. S2. It is noteworthy that constructional stability is a prerequisite for screening promising catalysts and efficiently catalyzing CO2RR. The formation energy (E f) and dissolution potential (U diss) were calculated to evaluate the stability of M-C x N3, as shown in Fig. 2a . Generally, a negative E f value indicates thermodynamic stability, while a positive U diss value suggests electrochemical stability. A catalyst is considered stable when it meets both criteria simultaneously. The E f values of M-C x N3 were found to range from −2.54 to −6.85 eV, with U diss values ranging from 1.73 to 4.03 V, demonstrating excellent stability across all M-C x N3 catalysts. All E f and U diss values of M-C x N3 are summarized in the Table S1. Notably, the stability of M-C x N3 increases with rising C/N-ratio. To further investigate the thermodynamic stability of the catalysts, first-principles molecular dynamics simulations were performed on Ru-C7N3, Rh-C7N3, and Pd-C7N3 as examples. These simulations were conducted at 500 K for 5 ps. As illustrated in Fig. 2b–d, despite being the catalysts with relatively weak stability under the E f and U diss criteria, Ru-C7N3, Rh-C7N3, and Pd-C7N3 maintained extremely small energy fluctuations throughout the simulation process. Moreover, their structures did not exhibit significant deformation, further confirming their excellent stability. 3.2 CO2 adsorption The adsorption of CO2 on the catalyst's active site is a critical focus, as it initiates the overall electrocatalytic reaction. Due to the chemical inertness of CO2 molecules, the degree of activation significantly influences subsequent CO2RR processes. An investigation of CO2 adsorption on M-C x N3 is conducted, as illustrated in Fig. 3 and Fig. S3. The optimized C-terminal adsorption of *CO2 is considered in Fig. 3, the optimized O-terminal adsorption of *CO2 is considered in Fig. S3. In the Fig. 3, two distinct adsorption configurations are observed: chemisorption and physisorption. In chemisorption, both O and C atoms of CO2 exhibit significant interaction with Ru and Rh active sites (Fig. 3a–b). Conversely, physisorption is observed with Pd active sites, which demonstrate minimal adsorption of CO2 molecules (Fig. 3c). The adsorption energy (E ads) of *CO2 is calculated for various structures. For Ru-C x N3 (x = 7, 10, 13, 19), the E ads values are determined to be −0.36, −0.41, −0.41, and −0.53 eV, respectively. Correspondingly, the bond angles (∠O − C − O) of *CO2 on Ru-C x N3 are measured at 145.19°, 144.58°, 144.45°, and 143.55° Hirshfeld charge analysis reveals electron transfers from Ru-C x N3 to *CO2 of 0.26, 0.29, 0.31, and 0.32 |e|. Calculation results for the remaining catalysts are summarized in Table S2. These findings indicate that more negative E ads values of *CO2 correlate with smaller ∠O − C − O and increased electron transfer from catalyst to *CO2. Notably, Ru-C19N3 demonstrates a superior ability to capture and activate CO2 molecules, suggesting its potential as a candidate for catalyzing CO2RR. However, the O-terminal adsorption of *CO2 in the Fig. S3 shows that the CO2 molecule does not have no change in bond angles. Therefore, the O-terminal does not allow the CO2 molecule to be effectively activated by the catalysts. To elucidate the activation properties of *CO2 on catalysts, partial density of state (PDOS) calculations is performed to analyze the interaction between CO2 molecules and the active sites of catalysts (Fig. 4 and Fig. S4). For Ru- and Rh-C x N3, overlaps between the 3d orbitals of Ru and Rh and the 2p orbitals of *CO2 are observed at the Fermi level (Fig. 4a–d). This overlap indicates robust interaction between *CO2 and Ru and Rh atoms. In contrast, orbital overlap between the 2p of *CO2 and 3d of Pd is not clearly discernible (Fig. 4e and F). Furthermore, the PDOS of M-C x N3 are also calculated and shown in Fig. S5. The enhanced energy level splitting near the Fermi level of Ru and Rh 3d can be observed, a characteristic feature of SACs that significantly enhances the activation of CO2 molecules [47]. These results align with the aforementioned electron transfer study. Significantly greater charge transfer is observed from Ru and Rh to *CO2 compared to Pd, demonstrating that single Ru and Rh atoms function as efficient active centers and can promote further hydrogenation. Due to insufficient activation of *CO2 on Pd-C x N3 (x = 7, 10, 13, 19), these catalysts are excluded from further investigation of the CO2RR mechanism. 3.3 Reaction mechanism and catalytic activity CO2 can be converted into multiple products through CO2RR. This process involves the formation of common products such as carbon monoxide (CO), formic acid (HCOOH), methanol (CH3OH), and methane (CH4) through two, six, and eight electron transfers, respectively. Additionally, CO2RR can produce C–C coupling products, including ethylene (C2H4) and ethanol (C2H5OH) [48]. However, due to the single active site of SACs, C–C coupling is not feasible [49]. Therefore, this study focuses on the reaction pathway of C1 products. The possible elementary reaction pathways are plotted in Fig. 5 . 3.3.1 CO2RR reaction pathways to CO on catalysts The Gibbs free energy of intermediates on Ru- and Rh-C x N3 catalysts has been calculated. The most favorable reaction path for each C1 product has been determined, and the Gibbs free energy diagrams for CO2RR on these catalysts are presented in Fig. 6 . The reaction pathway for CO2 conversion to CO follows the sequence: * + CO2 → *COOH → *CO → * + CO. In the initial protonation step, the O atom of * CO2 is attacked by a proton-electron pair (H + + e −), forming the *COOH intermediate. Subsequently, *COOH undergoes further hydrogenation to form *CO. Finally, the *CO intermediate desorbs from the active site, resulting in the CO product. For Ru-C x N3 catalysts, both the first and second protonation steps are spontaneous processes. In contrast, the formation of *COOH on Rh-C x N3 is non-spontaneous. However, the desorption of *CO is significantly challenging on both Ru- and Rh-C x N3 catalysts. This difficulty in *CO desorption determines the poor catalytic activity of these catalysts for CO2RR to generate CO, with U L values ranging from −1.54 to −2.78 V. 3.3.2 CO2RR reaction pathways to HCOOH on catalysts For Ru-C x N3, the reaction pathway of generate HCOOH product is * + CO2 → *OCHO → *HCOOH → * + HCOOH and PDS is * + CO2 → *OCHO. However, the U L values are different, they are −0.36, −0.33, −0.30, and −0.18 V for Ru-C7N3, Ru-C10N3, Ru-C1 3N3, and Ru-C19N3, respectively. In the case of Rh-C x N3 catalysts, the reaction pathway is * + CO2 → *COOH → *HCOOH → * + HCOOH, as illustrated in Fig. 6e–h. The common PDS for Rh-C7N3, Rh-C10N3, and Rh-C1 3N3 is * + CO2 → *COOH, with U L values of −0.36, −0.49, and −0.55 V, respectively. For Rh-C19N3, the PDS of CO2RR is *COOH → *HCOOH, with a U L value of −0.35 V. This is due to the higher Gibbs free energy value of ΔG*HCOOH compared to ΔG*COOH (0.35 vs. 0.26 eV). 3.3.3 CO2RR reaction pathways to CH3OH on catalysts The conversion of CO2 into CH3OH on Ru-C x N3 catalysts follows diverse favorable reaction pathways. For Ru-C7N3, the initial protonation step involves the formation of *OCHO, which is subsequently hydrogenated to *HCOOH. A proton-electron pair then attacks the O atom of *HCOOH, forming the *OCH2OH intermediate. Further protonation of *OCH2OH leads to the formation of *O intermediate and the release of CH3OH. Continuous protonation of *O results in the formation of *H2O intermediate. The most favorable reaction pathway on Ru-C7N3 is thus: * + CO2 → *OCHO → *HCOOH → *OCH2OH → *O + CH3OH → *OH → *H2O → H2O. The PDS is *OH → *H2O with a U L value of −0.55 V. Ru-C10N3, Ru-C1 3N3, and Ru-C19N3 share a common favorable reaction pathway: * + CO2 → *OCHO → *HCOOH → *OCH2OH → *CH2O + H2O → *CH3O → *CH3OH → * + CH3OH. For Ru-C1 3N3 and Ru-C19N3, *CH3O → *CH3OH is the common PDS with U L values of −0.41 V and −0.70 V, respectively. The PDS for Ru-C10N3 is * + CO2 → *COOH with a U L value of −0.33 V. Regarding Rh-C x N3 catalysts, Rh-C7N3 and Rh-C10N3 follow the pathway: * + CO2 → *COOH → *HCOOH → *OCH2OH → *O + CH3OH → *OH → *H2O → H2O. Their respective PDS are *OCH2OH → *O + CH3OH and *HCOOH → *OCH2OH, with corresponding U L values of −0.46 and −0.61 V. Rh-C1 3N3 follows a distinct path for CH3OH production: * + CO2 → *COOH → *HCOOH → *CHO + H2O → *CHOH → *CH2OH → *CH3OH → * + CH3OH. The PDS for Rh-C1 3N3 is *CHOH → *CH2OH with a U L value of −0.59 V. The favorable reaction pathway for Rh-C19N3 is: * + CO2 → *COOH → *HCOOH → *OCH2OH → *CH2O + H2O → *CH2OH → *CH3OH → * + CH3OH. The PDS for Rh-C19N3 is *OCH2OH → *CH2O + H2O with a U L value of −0.58 V. 3.3.4 CO2RR reaction pathways to CH4 on catalysts All Ru-C x N3 (x = 7, 10, 13, 19) catalysts follow an identical reaction pathway for CO2 conversion to CH4: * + CO2 → *OCHO → *HCOOH → *OCH2OH → *CH2O + H2O →*CH3O → *O + CH4 → *OH → *H2O → * + H2O. The common PDS is *O → *OH, with varying catalytic activities reflected in U L values of −0.55, −0.81, −0.99, and −0.40 V, respectively. Rh-C7N3 and Rh-C10N3 share a favorable reaction pathway: * + CO2 → *COOH → *HCOOH → *OCH2OH → *CH2O + H2O → *CH3O → *O + CH4 → *OH → *H2O → * + H2O. The PDS is *CH2O + H2O → *CH3O with U L values of −0.83 and −0.91 V, respectively. The reaction pathway for CH4 production on Rh-C1 3N3 is: * + CO2 → *COOH → *HCOOH → *CHO + H2O → *CHOH → *CH2OH → *CH2 + H2O → *CH3 → *CH4 → * + CH4. The U L value for Rh-C1 3N3 is −0.88 V. For Rh-C19N3, the reaction pathway is: * + CO2 → *COOH → *HCOOH → *OCH2OH → *CH2O + H2O → *CH2OH → *CH2 + H2O → *CH3 → *CH4 → * + CH4. The PDS is *CH2OH → *CH2 + H2O with a U L value of −0.95 V. It is generally known that a low negative U L value indicates superior CO2RR catalytic activity. Table 1 summarizes the lowest U L values for Ru- and Rh-C x N3 catalysts in this study and comparable catalysts previously reported for C1 products. All catalysts exhibit excellent selectivity and activity for HCOOH production, surpassing the performance of previously reported catalysts such as Ru@C3N4 (−0.61 V), Rh-C3N (−0.57 V), Ru@C2N (−0.56 V), and Rh@C2N (−0.95 V) [50–52]. 3.3.5 Side reaction and solvation effect The presence of the HER as a side reaction to CO2RR significantly impairs the efficiency and selectivity of CO2RR. The Gibbs free energy of hydrogen adsorption (ΔG *H) is widely regarded as the primary descriptor for evaluating HER catalytic activity. A ΔG *H value closer to zero indicates superior HER catalytic performance [53]. Consequently, the ΔG *H values of Ru- and Rh-C x N3 (x = 7, 10, 13, 19) were calculated and are presented in Fig. 7a . To assess the competition between CO2RR and HER, the limiting potential differences (U L(CO2RR) – U L(HER)) were computed and are illustrated in Fig. 7b. A positive value of limiting potential difference signifies the prioritization of CO2RR over HER for the corresponding catalysts. For Ru-C x N3, the inferior catalytic activity for CO2 to CO conversion results in substantial negative values of U L(CO) – U L(HER). However, the positive values of U L(HCOOH) – U L(HER) suggest that HCOOH is an ideal product for CO2RR on Ru-C x N3. Furthermore, with the exception of Ru-C19N3, the positive values of U L(CH3OH) – U L(HER) indicate higher selectivity for CO2RR compared to HER. Regarding CH4 production, CO2RR is predominant on Ru-C7N3 and Ru-C19N3 due to the positive U L(CH4) – U L(HER) values (0.04 and 0.24 V, respectively). Unfortunately, Rh-C x N3 exhibits superior catalytic selectivity for HER over CO2RR due to the favorable adsorption of *H on active sites, making it unsuitable as an efficient CO2RR catalyst. In order to investigate the solvation effect on Ru-C x N3 for CO2RR, an implicit solvation model is constructed, and the dielectric constant is set to 78.54 in order to simulate the water environment. The results of the comparative analysis conducted at the vacuum and implicit solvation models are presented in the Fig. S6. It can be found that the Ru-C x N3 still maintains the same PDS as in a vacuum condition, and the average U L difference is less than 0.10 V. Therefore, the solvation effect, as considered in this study, has a negligible impact on the catalytic performance of the screened catalysts. 3.4 Origin of catalytic activity To elucidate the regulatory effect of the electronic structure of pristine C x N3 upon doping with a single Ru atom and to investigate its impact on the electrocatalytic performance of C x N3, the electronic band structures and density of states (DOS) of both pristine C x N3 and Ru-C x N3 were calculated. The results are presented in Fig. S7 and S8. The introduction of a single Ru atom is observed to decrease the bandgap energies of all pristine C x N3 structures. This reduction in bandgap energy indicates an improvement in the overall conductivity of the catalyst following Ru atom doping into pristine C x N3. The enhanced catalyst conductivity is expected to facilitate electron transfer during the CO2RR process. To further investigate the exceptional catalytic activity of Ru-C x N3 (x = 7, 10, 13, 19) in converting CO2 to HCOOH, *OCHO is identified as the key intermediate due to the shared PDS: * + CO2 → *OCHO. The ΔG *OCHO value is equivalent to the U L, thereby establishing ΔG *OCHO as an activity descriptor. The d band center (ε d) is commonly employed to characterize the electronic properties of materials. A distinct linear relationship between ε d and ΔG *OCHO on Ru-C x N3 is observed, with an R² value of 0.93, as illustrated in Fig. 8 (a). According to d band center theory, a d band center closer to the Fermi level results in stronger interactions between the catalyst and intermediates [54]. The ε d values demonstrate that as the C/N ratio increases, ε d shifts further from the Fermi level. This shift weakens the adsorption strength of the key intermediate and promotes HCOOH desorption from the catalysts. In comparison to Ru-C x N3 (x = 7, 10, 13) (d band energies: −0.62, −0.92, and −1.05 eV), the antibonding states of the *OCHO intermediate are positioned at lower energies on Ru-C19N3 (−1.51 eV), with higher occupancy by additional electrons [55]. The ε d values also exhibit good linear relationship with the x value of Ru-C x N3 as shown in Fig. 8b. The crystal orbital Hamiltonian population (COHP) for the Ru atom and O atom of the *OCHO intermediate on Ru-C x N3 is calculated. The ICOHP value is utilized to quantitatively describe the binding strength. A linear relationship between ICOHP values of Ru-C x N3 and ΔG *OCHO is observed, as shown in Fig. 8 (b). More negative ICOHP values indicate stronger interactions between Ru and O atoms. This linear relationship reveals that more negative ICOHP values of Ru-C x N3 correspond to greater binding strength between Ru and O atoms, resulting in decreased catalytic activation for CO2RR. In summary, the enhancement of catalyst conductivity through Ru atom doping is initially examined. Subsequently, the Gibbs free energy change of the key intermediate *OCHO is considered as an activity descriptor. The connections between ε d, ICOHP, and ΔG *OCHO are explored, demonstrating that a higher C/N ratio modulates the adsorption of the key intermediate OCHO, thereby improving the catalytic activation of Ru-C x N3. 4 Conclusion In this study, DFT methods are used to investigate the catalytic performance of M-C x N3 (M = Ru, Rh, Pd; x = 7, 10, 13, 19) for CO2RR. The thermodynamic and electrochemical stability of M-C x N3 were initially assessed through the calculation of E f and U diss. The results demonstrate the structural stability of these catalysts. Furthermore, the dynamic stability was verified using first principles molecular dynamics simulations at 500 K, with Ru-, Rh-, and Pd-C7N3 serving as exemplars. Subsequently, the adsorption and activation behavior of CO2 on the catalyst active sites were scrutinized. Analyses of adsorption energy (E ads), bond angle, charge transfer, and PDOS of *CO2 on catalysts reveal that Ru-C x N3 and Rh-C x N3 exhibit chemisorption of the CO2 molecule. However, Pd-C x N3 demonstrated inadequate CO2 molecule activation and was consequently excluded from further CO2RR mechanism studies. A comprehensive calculation of the Gibbs free energy change for each elementary reaction was conducted, and the limiting potential for all C1 products was determined to unveil the catalytic activity of Ru-C x N3 and Rh-C x N3. Concurrently, the competitive selectivity between CO2RR and HER on these catalysts was examined by calculating U L(CO2RR) – U L(HER). Despite Rh-C x N3 exhibiting remarkable activity for catalyzing CO2RR to produce HCOOH, its superior activity for HER diminishes its potential as a promising CO2RR electrocatalyst. Ru-C x N3 catalysts demonstrated commendable catalytic activity and selectivity for HCOOH production. The optimal reaction pathway was identified as: * + CO2 → *OCHO → *HCOOH → * + HCOOH, with the PDS being * + CO2 → *OCHO (U L = −0.36, −0.33, −0.30, and −0.18 V, respectively). To explore the origin of catalytic activity, electronic band structures of pristine C x N3 and Ru-C x N3 were calculated to analyze the regulatory effect of Ru on C x N3. The introduction of a single Ru atom resulted in decreased bandgap energies for all pristine C x N3 materials, indicating improved electron transfer within the pristine material. The Gibbs free energy change (ΔG) of the key intermediate *OCHO was considered as a simple activity descriptor due to its equivalence to U L. Linear relationships between ΔG *OCHO and catalyst ε d, as well as the ICOHP of Ru-O, indicate an intrinsic connection between C x N3 C/N-ratio and catalyst activity. This connection is achieved by modulating the catalyst's adsorption capacity for the key reaction intermediate. In conclusion, this computational study provides comprehensive guidance and insights for the experimental synthesis and exploration of CO2RR electrocatalysts' catalytic performance. The findings elucidate the fundamental principles governing the activity and selectivity of M-C x N3 catalysts, paving the way for the rational design of efficient CO2RR electrocatalysts. CRediT authorship contribution statement Haoyang Qiu: Writing – original draft, Visualization, Resources, Investigation, Formal analysis, Data curation. Huohai Yang: Writing – original draft, Visualization, Resources, Investigation. Qigang Chen: Writing – original draft, Visualization, Resources, Investigation, Formal analysis, Data curation. Manxi Leng: Writing – review & editing. Xu Yang: Writing – review & editing, Supervision, Resources, Methodology. Xin Chen: Writing – review & editing, Supervision, Resources, Project administration, Methodology, Conceptualization. Declaration of competing interest The authors declare that they have no known competing financial interests or personal relationships that could have appeared to influence the work reported in this paper. Acknowledgements This work is supported by the Key Program of National Natural Science Foundation of China (52234003), the Special Project of Science and Technology Strategic Cooperation between Nanchong City and Southwest Petroleum University (23XNSYSX0010) and the Science and Technology Project of Sichuan Province (25QYCX0163). We acknowledge the National Supercomputing Center in Shenzhen and the High-Performance Computing platform of Southwest Petroleum University for providing the computational resources and Materials Studio software. Supplementary materials Supplementary material associated with this article can be found, in the online version, at doi:10.1016/j.mcat.2024.114808. Appendix Supplementary materials Image, application 1 References [1] S. Chu A. Majumdar Opportunities and challenges for a sustainable energy future Nature 488 2012 294 303 S. Chu, A. Majumdar, Opportunities and challenges for a sustainable energy future, Nature 488 (2012) 294–303. [2] R.J. Millar J.S. Fuglestvedt P. Friedlingstein J. Rogelj J.G. Michael H.D. Matthews B.S. Ragnhild M.F. Piers J.F. David R.A. Myles Emission budgets and pathways consistent with limiting warming to 1.5°C Nat. Geosci. 10 2017 741 747 R.J. Millar, J.S. Fuglestvedt, P. Friedlingstein, J. Rogelj, J.G. Michael, H.D. Matthews, B.S. Ragnhild, M.F. Piers, J.F. David, R.A. Myles, Emission budgets and pathways consistent with limiting warming to 1.5°C, Nat. Geosci. 10 (2017) 741–747. [3] G. Lv S. Li H. Zhang C. Zhu J. Cheng P. Qian CO2 adsorption by Cr, Mn, Fe, Co, Ni doped MgO (100) surfaces: a first-principles study Sep. Purif. Technol. 2024 128613 G. Lv, S. Li, H. Zhang, C. Zhu, J. Cheng, P. Qian, CO2 adsorption by Cr, Mn, Fe, Co, Ni doped MgO (100) surfaces: a first-principles study. Sep. Purif. Technol. (2024) 128613. [4] Y. Gao J. Ge J. Zhang T. Cao Z. Sun W. Yan Z. Liu Asymmetrically coordinated main group atomic In-S1N3 interface sites for promoting electrochemical CO2 reduction Nano Res. 17 2024 5011 5021 Y. Gao, J. Ge, J. Zhang, T. Cao, Z. Sun, W. Yan, Z. Liu, Asymmetrically coordinated main group atomic In-S1N3 interface sites for promoting electrochemical CO2 reduction, Nano Res. 17 (2024) 5011–5021. [5] S. Chen X. Zheng P. Zhu Y. Li Z. Zhuang H. Wu D. Wang Y. He Copper atom pairs stabilize *OCCO dipole toward highly selective CO2 electroreduction to C2H4 Angew. Chem. Int. Ed. 2024 e202411591 S. Chen, X. Zheng, P. Zhu, Y. Li, Z. Zhuang, H. Wu, D. Wang, Y. He, Copper atom pairs stabilize *OCCO dipole toward highly selective CO2 electroreduction to C2H4, Angew. Chem. Int. Ed. (2024) e202411591. [6] B. Zhang Y. Chang P. Zhai C. Wang J. Gao L. Sun J. Hou Enriching metal–oxygen species and phosphate modulating of active sites for robust electrocatalytical CO2 reduction Adv. Mater. 35 2023 2304379 B. Zhang, Y. Chang, P. Zhai, C. Wang, J. Gao, L. Sun, J. Hou, Enriching metal–oxygen species and phosphate modulating of active sites for robust electrocatalytical CO2 reduction, Adv. Mater. 35 (2023) 2304379. [7] X. Tan C. Yu Y. Ren S. Cui W. Li J. Qiu Recent advances in innovative strategies for the CO2 electroreduction reaction Energ. Environ. Sci. 14 2021 765 780 X. Tan, C. Yu, Y. Ren, S. Cui, W. Li, J. Qiu, Recent advances in innovative strategies for the CO2 electroreduction reaction, Energ. Environ. Sci. 14 (2021) 765–780. [8] Z. Liu Y. Liu J. Zhang T. Cao Z. Sun J. Liu H. Shang Asymmetrically coordinated single atom Cu catalyst with unsaturated C-Cu-N structure for CO2 reduction to CO Nano Res. 17 2024 3911 3918 Z. Liu, Y. Liu, J. Zhang, T. Cao, Z. Sun, J. Liu, H. Shang, Asymmetrically coordinated single atom Cu catalyst with unsaturated C-Cu-N structure for CO2 reduction to CO, Nano Res. 17 (2024) 3911–3918. [9] A. Vasileff Y. Zheng S. Qiao Carbon solving carbon's problems: recent progress of nanostructured carbon-based catalysts for the electrochemical reduction of CO2 Adv. Energy Mater. 7 2017 1700759 A. Vasileff, Y. Zheng, S. Qiao, Carbon solving carbon's problems: recent progress of nanostructured carbon-based catalysts for the electrochemical reduction of CO2, Adv. Energy Mater. 7 (2017) 1700759. [10] J. Wang H. Chen H. Tan C. Tan Y. Zhu H. Chen Strong correlation between the dynamic chemical state and product profile of carbon dioxide electroreduction ACS Appl. Mater. 14 2022 22681 22696 J. Wang, H. Chen, H. Tan, C. Tan, Y. Zhu, H. Chen, Strong correlation between the dynamic chemical state and product profile of carbon dioxide electroreduction, ACS Appl. Mater. 14 (2022) 22681–22696. [11] L. Zhang Z. Zha J. Gong Nanostructured materials for heterogeneous electrocatalytic CO2 reduction and their related reaction mechanisms Angew. Chem. Int. Ed. 56 2017 11326 11353 L. Zhang, Z. Zha, J. Gong, Nanostructured materials for heterogeneous electrocatalytic CO2 reduction and their related reaction mechanisms, Angew. Chem. Int. Ed. 56 (2017) 11326–11353. [12] H. Xie T. Wang J. Liang Q. Li S. Sun Cu-based nanocatalysts for electrochemical reduction of CO2 Nano Today 21 2018 41 54 H. Xie, T. Wang, J. Liang, Q. Li, S. Sun, Cu-based nanocatalysts for electrochemical reduction of CO2, Nano Today 21 (2018) 41–54. [13] A.R. Woldu Z. Huang P. Zhao L. Hu D. Astruc Electrochemical CO2 reduction (CO2RR) to multi-carbon products over copper-based catalysts Coordin. Chem. Rev. 454 2022 214340 A.R. Woldu, Z. Huang, P. Zhao, L. Hu, D. Astruc, Electrochemical CO2 reduction (CO2RR) to multi-carbon products over copper-based catalysts. Coordin. Chem. Rev. 454 (2022) 214340. [14] J. Li R. Cai H. Mu J. Guo X. Zhong J. Wang F. Li Twin heterostructure engineering and facet effect boosts efficient reduction CO2-to-ethanol at low potential on Cu2O@ Cu2S catalysts ACS Catal. 14 2024 3266 3277 J. Li, R. Cai, H. Mu, J. Guo, X. Zhong, J. Wang, F. Li, Twin heterostructure engineering and facet effect boosts efficient reduction CO2-to-ethanol at low potential on Cu2O@ Cu2S catalysts. ACS Catal. 14 (2024) 3266–3277. [15] B. Sun M. Dai S. Cai H. Cheng K. Song Y. Yu H. Hu Challenges and strategies towards copper-based catalysts for enhanced electrochemical CO2 reduction to multi-carbon products Fuel 332 2023 126114 B. Sun, M. Dai, S. Cai, H. Cheng, K. Song, Y. Yu, H. Hu, Challenges and strategies towards copper-based catalysts for enhanced electrochemical CO2 reduction to multi-carbon products, Fuel 332 (2023) 126114. [16] G.M. Tomboc S. Choi T. Kwon Y.J. Hwang K. Lee Potential link between Cu surface and selective CO2 electroreduction: perspective on future electrocatalyst designs Adv. Mater. 32 2020 1908398 G.M. Tomboc, S. Choi, T. Kwon, Y.J. Hwang, K. Lee, Potential link between Cu surface and selective CO2 electroreduction: perspective on future electrocatalyst designs, Adv. Mater. 32 (2020) 1908398. [17] S. Chen C. Ye Z. Wang P. Li W. Jiang Z. Zhuang D. Wang Selective CO2 reduction to ethylene mediated by adaptive small-molecule engineering of copper-based electrocatalysts Angew. Chem. Int. Ed. 135 2023 e202315621 S. Chen, C. Ye, Z. Wang, P. Li, W. Jiang, Z. Zhuang, D. Wang, Selective CO2 reduction to ethylene mediated by adaptive small-molecule engineering of copper-based electrocatalysts. Angew. Chem. Int. Ed. 135 (2023) e202315621. [18] C. Cui Q. Cao H. Jing Z. Zhao D. Wang Y. Li A review of electroreduction of CO2 to C1 products: catalysts design, characterizations and performance evaluation Surf. Interfaces 2024 104353 C. Cui, Q. Cao, H. Jing, Z. Zhao, D. Wang, Y. Li, A review of electroreduction of CO2 to C1 products: catalysts design, characterizations and performance evaluation, Surf. Interfaces (2024) 104353. [19] C. Zhu J. Yang J. Zhang X. Wang Y. Gao D. Wang H. Pan Single-atom materials: the application in energy conversion Interdiscip. Mater. 3 2024 74 86 C. Zhu, J. Yang, J. Zhang, X. Wang, Y. Gao, D. Wang, H. Pan, Single-atom materials: the application in energy conversion. Interdiscip. Mater. 3 (2024) 74–86. [20] S.M. Lee W.S. Cheon M.G. Lee H.W. Jang Coordination environment in single-atom catalysts for high-performance electrocatalytic CO2 reduction Small Struct 4 2023 2200236 S.M. Lee, W.S. Cheon, M.G. Lee, H.W. Jang, Coordination environment in single-atom catalysts for high-performance electrocatalytic CO2 reduction, Small Struct. 4 (2023) 2200236. [21] Q. Xu Y. Jin T. Sun T. Zheng P. Zhang Y. Han J. Jiang Theoretical and experimental investigation of the coordination effect on photocatalytic CO2 reduction efficiency of cobalt single atom catalyst Chem. Eng. J. 479 2024 147837 Q. Xu, Y. Jin, T. Sun, T. Zheng, P. Zhang, Y. Han, J. Jiang, Theoretical and experimental investigation of the coordination effect on photocatalytic CO2 reduction efficiency of cobalt single atom catalyst, Chem. Eng. J. 479 (2024) 147837. [22] S. Wang L. Wang D. Wang Y. Li Recent advances of single-atom catalysts in CO2 conversion Energy Environ. Sci. 16 2023 2759 2803 S. Wang, L. Wang, D. Wang, Y. Li, Recent advances of single-atom catalysts in CO2 conversion, Energy Environ. Sci. 16 (2023) 2759–2803. [23] Y. Wang J. Hao Y. Liu M. Liu K. Sheng Y. Wang W. Li Recent advances in regulating the performance of acid oxygen reduction reaction on carbon-supported non-precious metal single atom catalysts J. Energy Chem. 76 2023 601 616 Y. Wang, J. Hao, Y. Liu, M. Liu, K. Sheng, Y. Wang, W. Li, Recent advances in regulating the performance of acid oxygen reduction reaction on carbon-supported non-precious metal single atom catalysts, J. Energy Chem. 76 (2023) 601–616. [24] H. Zhuo X. Zhang J. Liang Q. Yu H. Xiao J. Li Theoretical understandings of graphene-based metal single-atom catalysts: stability and catalytic performance Chem. Rev. 20 2020 12315 12341 H. Zhuo, X. Zhang, J. Liang, Q. Yu, H. Xiao, J. Li, Theoretical understandings of graphene-based metal single-atom catalysts: stability and catalytic performance, Chem. Rev. 20 (2020) 12315–12341. [25] Y. Wu P. Hu F. Xiao X. Yu W. Yang M. Liang A. Zhu Metal-organic frameworks based single-atom catalysts for advanced fuel cells and rechargeable batteries J. Energy Chem. 80 2023 501 534 Y. Wu, P. Hu, F. Xiao, X. Yu, W. Yang, M. Liang, A. Zhu, Metal-organic frameworks based single-atom catalysts for advanced fuel cells and rechargeable batteries, J. Energy Chem. 80 (2023) 501–534. [26] Q. Chen Q. Ke X. Zhao X. Chen Ruthenium-doped boron nitride nanotubes as promising electrocatalysts for carbon dioxide reduction to methane Diam. Relat. Mater. 136 2023 109942 Q. Chen, Q. Ke, X. Zhao, X. Chen, Ruthenium-doped boron nitride nanotubes as promising electrocatalysts for carbon dioxide reduction to methane, Diam. Relat. Mater. 136 (2023) 109942. [27] X. Yuan X. Hu Q. Lin S. Zhang Progress of charge carrier dynamics and regulation strategies in 2D CxNy-based heterojunctions Chem. Commun. 60 2024 2283 2300 X. Yuan, X. Hu, Q. Lin, S. Zhang, Progress of charge carrier dynamics and regulation strategies in 2D CxNy-based heterojunctions, Chem. Commun. 60 (2024) 2283–2300. [28] H. Yang Z. Wang S. Liu Y. Shen Y. Zhang Molecular engineering of CxNy: topologies, electronic structures and multidisciplinary applications Chin. Chem. Lett. 31 2020 3047 3054 H. Yang, Z. Wang, S. Liu, Y. Shen, Y. Zhang, Molecular engineering of CxNy: topologies, electronic structures and multidisciplinary applications, Chin. Chem. Lett. 31 (2020) 3047–3054. [29] F. Besharat F. Ahmadpoor Z. Nezafat M. Nasrollahzadeh N.R. Manwar P. Fornasiero M.B. Gawande Advances in carbon nitride-based materials and their electrocatalytic applications ACS Catal. 12 2022 5605 5660 F. Besharat, F. Ahmadpoor, Z. Nezafat, M. Nasrollahzadeh, N.R. Manwar, P. Fornasiero, M.B. Gawande, Advances in carbon nitride-based materials and their electrocatalytic applications, ACS Catal. 12 (2022) 5605–5660. [30] M. Ma Z. Huang D.E. Doronkin W. Fa Z. Rao Y. Zou Y. Zhou Ultrahigh surface density of Co-N2C single-atom-sites for boosting photocatalytic CO2 reduction to methanol Appl. Catal. B-Environ. 300 2022 120695 M. Ma, Z. Huang, D.E. Doronkin, W. Fa, Z. Rao, Y. Zou, Y. Zhou, Ultrahigh surface density of Co-N2C single-atom-sites for boosting photocatalytic CO2 reduction to methanol, Appl. Catal. B-Environ. 300 (2022) 120695. [31] M. Li F. Zhang M. Kuang Y. Ma T. Liao Z. Sun J. Yang Atomic Cu sites engineering enables efficient CO2 electroreduction to methane with high CH4/C2H4 ratio Nanomicro Lett. 15 2023 238 M. Li, F. Zhang, M. Kuang, Y. Ma, T. Liao, Z. Sun, J. Yang, Atomic Cu sites engineering enables efficient CO2 electroreduction to methane with high CH4/C2H4 ratio, Nanomicro Lett. 15 (2023) 238. [32] A. Hassan I. Anis S. Shafi A. Assad A. Rasool R. Khanam M.A. Dar First-principles investigation of the electrocatalytic reduction of CO2 on zirconium-based single-, double-, and triple-atom catalysts anchored on a graphitic carbon nitride monolayer ACS Appl. Nano Mater. 5 2022 15409 15417 A. Hassan, I. Anis, S. Shafi, A. Assad, A. Rasool, R. Khanam, M.A. Dar, First-principles investigation of the electrocatalytic reduction of CO2 on zirconium-based single-, double-, and triple-atom catalysts anchored on a graphitic carbon nitride monolayer, ACS Appl. Nano Mater. 5 (2022): 15409–15417. [33] J. Zhang, T. Xu, D. Yuan, J. Tian, D. Ma, CO2 electroreduction by transition metal-embedded two-dimensional C3N: a theoretical study, J. CO2 Util. 43 (2021) 101367. [34] R. Tan Z. Li P. Zhou Z. Zou W. Li L. Sun Dirac semimetals in homogeneous holey carbon nitride monolayers J. Phys. Chem. C 125 2021 6082 6089 R. Tan, Z. Li, P. Zhou, Z. Zou, W. Li, L. Sun, Dirac semimetals in homogeneous holey carbon nitride monolayers, J. Phys. Chem. C 125 (2021) 6082–6089. [35] S. Cao H. Chen Y. Hu J. Li C. Yang Z. Chen X. Lu MXene-based single atom catalysts for efficient CO2RR towards CO: a novel strategy for high-throughput catalyst design and screening Chem. Eng. J. 461 2023 141936 S. Cao, H. Chen, Y. Hu, J. Li, C. Yang, Z. Chen, X. Lu, MXene-based single atom catalysts for efficient CO2RR towards CO: a novel strategy for high-throughput catalyst design and screening, Chem. Eng. J. 461 (2023) 141936. [36] M. Umer S. Umer R. Anand J. Mun M. Zafari G. Lee K.S. Kim Transition metal single atom embedded GaN monolayer surface for efficient and selective CO2 electroreduction J. Mater. Chem. A. 10 2022 24280 24289 M. Umer, S. Umer, R. Anand, J. Mun, M. Zafari, G. Lee, K.S. Kim, Transition metal single atom embedded GaN monolayer surface for efficient and selective CO2 electroreduction, J. Mater. Chem. A. 10 (2022) 24280–24289. [37] P. Du R. Qi Y. Zhang Q. Gu X. Xu Y. Tan T. Zhang Single-atom-driven dynamic carburization over Pd1–FeOx catalyst boosting CO2 conversion Chem 8 2022 3252 3262 P. Du, R. Qi, Y. Zhang, Q. Gu, X. Xu, Y. Tan, T. Zhang, Single-atom-driven dynamic carburization over Pd1–FeOx catalyst boosting CO2 conversion, Chem 8 (2022) 3252–3262. [38] Q. Yang Y. Jiang H. Zhuo E.M. Mitchell Q. Yu Recent progress of metal single-atom catalysts for energy applications Nano Energy 111 2023 108404 Q. Yang, Y. Jiang, H. Zhuo, E.M. Mitchell, Q. Yu, Recent progress of metal single-atom catalysts for energy applications, Nano Energy 111 (2023) 108404. [39] Q. Chen Q. Ke X. Zhao Y. Feng Q. Zhao J. Feng X. Chen Transition metal doped into defective boron nitride nanotubes for CO2RR: regulation of catalytic activity and mechanism by curvature effect Sep. Purif. Technol. 338 2024 126552 Q. Chen, Q. Ke, X. Zhao, Y. Feng, Q. Zhao, J. Feng, X. Chen, Transition metal doped into defective boron nitride nanotubes for CO2RR: regulation of catalytic activity and mechanism by curvature effect, Sep. Purif. Technol. 338 (2024) 126552. [40] J. Shen D. Wang How to select heterogeneous CO2 reduction electrocatalyst Nano Res Energy 3 2023 e9120096 J. Shen, D. Wang, How to select heterogeneous CO2 reduction electrocatalyst, Nano Res Energy, 3 (2023) e9120096. [41] B. Delley An all-electron numerical method for solving the local density functional for polyatomic molecules J. Chem. Phys. 92 1990 508 517 B. Delley, An all-electron numerical method for solving the local density functional for polyatomic molecules, J. Chem. Phys. 92 (1990) 508–517 [42] B. Delley From molecules to solids with the DMol3 approach J. Chem. Phys. 113 2000 7756 7764 B. Delley, From molecules to solids with the DMol3 approach, J. Chem. Phys. 113 (2000) 7756–7764. [43] J.P. Perdew K. Burke M. Ernzerhof Generalized gradient approximation made simple Phys. Rev. Lett. 77 1996 3865 J.P. Perdew, K. Burke, M. Ernzerhof, Generalized gradient approximation made simple, Phys. Rev. Lett. 77 (1996) 3865. [44] X. Guo S. Lin J. Gu S. Zhang Z. Chen S. Huang Simultaneously achieving high activity and selectivity toward two-electron O2 electroreduction: the power of single-atom catalysts ACS Catal. 9 2019 11042 11054 X. Guo, S. Lin, J. Gu, S. Zhang, Z. Chen, S. Huang, Simultaneously achieving high activity and selectivity toward two-electron O2 electroreduction: the power of single-atom catalysts, ACS Catal. 9 (2019) 11042–11054 [45] J.K. Nørskov J. Rossmeisl A. Logadottir L. Lindqvist J.R. Kitchin T. Bligaard H. Jonsson Origin of the overpotential for oxygen reduction at a fuel-cell cathode J. Phys. Chem. B 108 2004 17886 17892 J.K. Nørskov, J. Rossmeisl, A. Logadottir, L. Lindqvist, J.R. Kitchin, T. Bligaard, H. Jonsson, Origin of the overpotential for oxygen reduction at a fuel-cell cathode, J. Phys. Chem. B 108 (2004) 17886–17892 [46] X. Shi C. He C.J. Pickard C. Tang J. Zhong Stochastic generation of complex crystal structures combining group and graph theory with application to carbon Phys. Rev. B 97 2018 014104 X. Shi, C. He, C.J. Pickard, C. Tang, J. Zhong, Stochastic generation of complex crystal structures combining group and graph theory with application to carbon, Phys. Rev. B 97 (2018) 014104. [47] Q. Song M. Li X. Hou J. Li Z. Dong S. Zhang X. Liu Anchored Fe atoms for NO bond activation to boost electrocatalytic nitrate reduction at low concentrations Appl. Catal. B-Environ. 317 2022 121721 Q. Song, M. Li, X. Hou, J. Li, Z. Dong, S. Zhang, X. Liu, Anchored Fe atoms for NO bond activation to boost electrocatalytic nitrate reduction at low concentrations, Appl. Catal. B-Environ. 317 (2022) 121721. [48] Z. Chen J. Zhao J. Zhao Z. Chen L. Yin Frustrated Lewis pairs photocatalyst for visible light-driven reduction of CO to multi-carbon chemicals Nanoscale 11 2019 20777 20784 Z. Chen, J. Zhao, J. Zhao, Z. Chen, L. Yin, Frustrated Lewis pairs photocatalyst for visible light-driven reduction of CO to multi-carbon chemicals, Nanoscale 11 (2019) 20777–20784 [49] Y. Wang H. Su Y. He L. Li S. Zhu H. Shen P. Xie X. Fu G. Zhou C. Feng D. Zhao F. Xiao X. Zhu Y. Zeng M. Shao S. Chen G. Wu J. Zeng C. Wang Advanced electrocatalysts with single-metal-atom active sites Chem. Rev. 120 2020 12217 12314 Y. Wang, H. Su, Y. He, L. Li, S. Zhu, H. Shen, P. Xie, X. Fu, G. Zhou, C. Feng, D. Zhao, F. Xiao, X. Zhu, Y. Zeng, M. Shao, S. Chen, G. Wu, J. Zeng, C. Wang, Advanced electrocatalysts with single-metal-atom active sites, Chem. Rev. 120 (2020) 12217–12314 [50] L. Cui K. Shi M. Zhang J. Guo Z. Yan H. Hao R. Gao Theoretical study the electrocatalytic performance and mechanism of novel designed electrocatalyst Ru@2DMs for CO2RR Fuel 340 2023 127541 L. Cui, K. Shi, M. Zhang, J. Guo, Z. Yan, H. Hao, R. Gao, Theoretical study the electrocatalytic performance and mechanism of novel designed electrocatalyst Ru@2DMs for CO2RR, Fuel 340 (2023) 127541. [51] J. Zhang, T. Xu, D. Yuan, J. Tian, D. Ma, CO2 electroreduction by transition metal-embedded two-dimensional C3N: a theoretical study, J. CO2 Util. 43 (2021) 101367. [52] X. Cui W. An X. Liu H. Wang Y. Men J. Wang C2N-graphene supported single-atom catalysts for CO2 electrochemical reduction reaction: mechanistic insight and catalyst screening Nanoscale 10 2018 15262 15272 X. Cui, W. An, X. Liu, H. Wang, Y. Men, J. Wang, C2N-graphene supported single-atom catalysts for CO2 electrochemical reduction reaction: mechanistic insight and catalyst screening, Nanoscale 10 (2018) 15262–15272. [53] P. Xue X. Zhao D. Zheng Q. Zhao J. Feng Y. Feng X. Chen First-principles study of the electronic and catalytic properties of nickel-antimony (Ni-Sb) alloy catalyst for hydrogen evolution reaction Comp. Mater. Sci. 234 2024 112778 P. Xue, X. Zhao, D. Zheng, Q. Zhao, J. Feng, Y. Feng, X. Chen, First-principles study of the electronic and catalytic properties of nickel-antimony (Ni-Sb) alloy catalyst for hydrogen evolution reaction, Comp. Mater. Sci. 234 (2024) 112778. [54] J.K. Nørskov T. Bligaard J. Rossmeisl C.H. Christensen Towards the computational design of solid catalysts Nat. Chem. 1 2009 37 46 J.K. Nørskov, T. Bligaard, J. Rossmeisl, C.H. Christensen, Towards the computational design of solid catalysts, Nat. Chem. 1 (2009) 37–46. [55] X. Wang S. Li Z. Yuan Y. Sun Z. Tang X. Gao Y.M. Yan Optimizing electrocatalytic nitrogen reduction via interfacial electric field modulation: elevating d-band center in WS2-WO3 for enhanced intermediate adsorption Angew. Chem. Int. Ed. 135 2023 e202303794 X. Wang, S. Li, Z. Yuan, Y. Sun, Z. Tang, X. Gao, Y.M. Yan, Optimizing electrocatalytic nitrogen reduction via interfacial electric field modulation: elevating d-band center in WS2-WO3 for enhanced intermediate adsorption, Angew. Chem. Int. Ed. 135 (2023) e202303794.",
      "scopus-id": "85214558449",
      "coredata": {
        "eid": "1-s2.0-S2468823124009908",
        "dc:description": "The development of efficient catalysts for the electrocatalytic carbon dioxide reduction reaction (CO2RR) has emerged as a primary focus in contemporary research. In this study, a series of single-atom catalysts are constructed by doping Ru, Rh, and Pd into C x N3 (x = 7, 10, 13, 19), denoted as M-C x N3. Density functional theory (DFT) methods are employed to systematically investigate the CO2RR catalytic activity and mechanism on M-C x N3. The catalysts are found to exhibit thermodynamic, electrochemical, and dynamic stability, as evidenced by formation energy calculations, dissolution potential assessments, and first principles molecular dynamics simulations. Gibbs free energy calculations reveal that Ru-C x N3 demonstrates exceptional catalytic selectivity towards HCOOH production, with optimal catalytic activity observed at low limiting potentials (x = 7: –0.36 V, x = 10: –0.33 V, x = 13: –0.30 V, and x = 19: –0.18 V). Furthermore, Ru-C x N3 effectively suppresses the competitive hydrogen evolution reaction (HER). Linear relationships between the Gibbs free energy change of the key intermediate *OCHO and the catalyst d band center, as well as the integration crystal orbital Hamiltonian population (ICOHP), indicate that Ru doping and higher C/N-ratios in C x N3 enhance catalytic performance for CO2RR. This computational study provides comprehensive guidance and insights for the experimental synthesis and exploration of CO2RR electrocatalysts.",
        "openArchiveArticle": "false",
        "prism:coverDate": "2025-02-15",
        "openaccessUserLicense": null,
        "prism:aggregationType": "Journal",
        "prism:url": "https://api.elsevier.com/content/article/pii/S2468823124009908",
        "dc:creator": [
          {
            "@_fa": "true",
            "$": "Qiu, Haoyang"
          },
          {
            "@_fa": "true",
            "$": "Yang, Huohai"
          },
          {
            "@_fa": "true",
            "$": "Chen, Qigang"
          },
          {
            "@_fa": "true",
            "$": "Leng, Manxi"
          },
          {
            "@_fa": "true",
            "$": "Yang, Xu"
          },
          {
            "@_fa": "true",
            "$": "Chen, Xin"
          }
        ],
        "link": [
          {
            "@_fa": "true",
            "@rel": "self",
            "@href": "https://api.elsevier.com/content/article/pii/S2468823124009908"
          },
          {
            "@_fa": "true",
            "@rel": "scidir",
            "@href": "https://www.sciencedirect.com/science/article/pii/S2468823124009908"
          }
        ],
        "dc:format": "application/json",
        "openaccessType": null,
        "pii": "S2468-8231(24)00990-8",
        "prism:volume": "573",
        "articleNumber": "114808",
        "prism:publisher": "Elsevier B.V. All rights are reserved, including those for text and data mining, AI training, and similar technologies.",
        "dc:title": "Theoretical prediction of metal-doped high C/N-ratio C x N3 (x=7, 10, 13, 19) as single-atom catalysts for CO2RR",
        "prism:copyright": "© 2024 Elsevier B.V. All rights are reserved, including those for text and data mining, AI training, and similar technologies.",
        "openaccess": "0",
        "prism:issn": "24688231",
        "dcterms:subject": [
          {
            "@_fa": "true",
            "$": "Single-atom catalyst"
          },
          {
            "@_fa": "true",
            "$": "Carbon nitride materials"
          },
          {
            "@_fa": "true",
            "$": "Density functional theory"
          },
          {
            "@_fa": "true",
            "$": "Carbon dioxide reduction reaction"
          }
        ],
        "openaccessArticle": "false",
        "prism:publicationName": "Molecular Catalysis",
        "openaccessSponsorType": null,
        "prism:pageRange": "114808",
        "pubType": "fla",
        "prism:coverDisplayDate": "15 February 2025",
        "prism:doi": "10.1016/j.mcat.2024.114808",
        "prism:startingPage": "114808",
        "dc:identifier": "doi:10.1016/j.mcat.2024.114808",
        "openaccessSponsorName": null
      },
      "objects": {
        "object": [
          {
            "@category": "standard",
            "@height": "238",
            "@width": "376",
            "@_fa": "true",
            "$": "https://api.elsevier.com/content/object/eid/1-s2.0-S2468823124009908-gr1.jpg?httpAccept=%2A%2F%2A",
            "@multimediatype": "JPEG image file",
            "@type": "IMAGE-DOWNSAMPLED",
            "@size": "44200",
            "@ref": "gr1",
            "@mimetype": "image/jpeg"
          },
          {
            "@category": "standard",
            "@height": "570",
            "@width": "791",
            "@_fa": "true",
            "$": "https://api.elsevier.com/content/object/eid/1-s2.0-S2468823124009908-gr2.jpg?httpAccept=%2A%2F%2A",
            "@multimediatype": "JPEG image file",
            "@type": "IMAGE-DOWNSAMPLED",
            "@size": "105996",
            "@ref": "gr2",
            "@mimetype": "image/jpeg"
          },
          {
            "@category": "standard",
            "@height": "200",
            "@width": "292",
            "@_fa": "true",
            "$": "https://api.elsevier.com/content/object/eid/1-s2.0-S2468823124009908-ga1.jpg?httpAccept=%2A%2F%2A",
            "@multimediatype": "JPEG image file",
            "@type": "IMAGE-DOWNSAMPLED",
            "@size": "39471",
            "@ref": "ga1",
            "@mimetype": "image/jpeg"
          },
          {
            "@category": "standard",
            "@height": "725",
            "@width": "659",
            "@_fa": "true",
            "$": "https://api.elsevier.com/content/object/eid/1-s2.0-S2468823124009908-gr3.jpg?httpAccept=%2A%2F%2A",
            "@multimediatype": "JPEG image file",
            "@type": "IMAGE-DOWNSAMPLED",
            "@size": "162642",
            "@ref": "gr3",
            "@mimetype": "image/jpeg"
          },
          {
            "@category": "standard",
            "@height": "936",
            "@width": "791",
            "@_fa": "true",
            "$": "https://api.elsevier.com/content/object/eid/1-s2.0-S2468823124009908-gr4.jpg?httpAccept=%2A%2F%2A",
            "@multimediatype": "JPEG image file",
            "@type": "IMAGE-DOWNSAMPLED",
            "@size": "129605",
            "@ref": "gr4",
            "@mimetype": "image/jpeg"
          },
          {
            "@category": "standard",
            "@height": "185",
            "@width": "508",
            "@_fa": "true",
            "$": "https://api.elsevier.com/content/object/eid/1-s2.0-S2468823124009908-gr5.jpg?httpAccept=%2A%2F%2A",
            "@multimediatype": "JPEG image file",
            "@type": "IMAGE-DOWNSAMPLED",
            "@size": "35514",
            "@ref": "gr5",
            "@mimetype": "image/jpeg"
          },
          {
            "@category": "standard",
            "@height": "997",
            "@width": "650",
            "@_fa": "true",
            "$": "https://api.elsevier.com/content/object/eid/1-s2.0-S2468823124009908-gr6.jpg?httpAccept=%2A%2F%2A",
            "@multimediatype": "JPEG image file",
            "@type": "IMAGE-DOWNSAMPLED",
            "@size": "193645",
            "@ref": "gr6",
            "@mimetype": "image/jpeg"
          },
          {
            "@category": "standard",
            "@height": "250",
            "@width": "659",
            "@_fa": "true",
            "$": "https://api.elsevier.com/content/object/eid/1-s2.0-S2468823124009908-gr7.jpg?httpAccept=%2A%2F%2A",
            "@multimediatype": "JPEG image file",
            "@type": "IMAGE-DOWNSAMPLED",
            "@size": "48164",
            "@ref": "gr7",
            "@mimetype": "image/jpeg"
          },
          {
            "@category": "standard",
            "@height": "636",
            "@width": "791",
            "@_fa": "true",
            "$": "https://api.elsevier.com/content/object/eid/1-s2.0-S2468823124009908-gr8.jpg?httpAccept=%2A%2F%2A",
            "@multimediatype": "JPEG image file",
            "@type": "IMAGE-DOWNSAMPLED",
            "@size": "59451",
            "@ref": "gr8",
            "@mimetype": "image/jpeg"
          },
          {
            "@category": "thumbnail",
            "@height": "139",
            "@width": "219",
            "@_fa": "true",
            "$": "https://api.elsevier.com/content/object/eid/1-s2.0-S2468823124009908-gr1.sml?httpAccept=%2A%2F%2A",
            "@multimediatype": "GIF image file",
            "@type": "IMAGE-THUMBNAIL",
            "@size": "13929",
            "@ref": "gr1",
            "@mimetype": "image/gif"
          },
          {
            "@category": "thumbnail",
            "@height": "158",
            "@width": "219",
            "@_fa": "true",
            "$": "https://api.elsevier.com/content/object/eid/1-s2.0-S2468823124009908-gr2.sml?httpAccept=%2A%2F%2A",
            "@multimediatype": "GIF image file",
            "@type": "IMAGE-THUMBNAIL",
            "@size": "12971",
            "@ref": "gr2",
            "@mimetype": "image/gif"
          },
          {
            "@category": "thumbnail",
            "@height": "150",
            "@width": "219",
            "@_fa": "true",
            "$": "https://api.elsevier.com/content/object/eid/1-s2.0-S2468823124009908-ga1.sml?httpAccept=%2A%2F%2A",
            "@multimediatype": "GIF image file",
            "@type": "IMAGE-THUMBNAIL",
            "@size": "29645",
            "@ref": "ga1",
            "@mimetype": "image/gif"
          },
          {
            "@category": "thumbnail",
            "@height": "164",
            "@width": "149",
            "@_fa": "true",
            "$": "https://api.elsevier.com/content/object/eid/1-s2.0-S2468823124009908-gr3.sml?httpAccept=%2A%2F%2A",
            "@multimediatype": "GIF image file",
            "@type": "IMAGE-THUMBNAIL",
            "@size": "16701",
            "@ref": "gr3",
            "@mimetype": "image/gif"
          },
          {
            "@category": "thumbnail",
            "@height": "163",
            "@width": "138",
            "@_fa": "true",
            "$": "https://api.elsevier.com/content/object/eid/1-s2.0-S2468823124009908-gr4.sml?httpAccept=%2A%2F%2A",
            "@multimediatype": "GIF image file",
            "@type": "IMAGE-THUMBNAIL",
            "@size": "8764",
            "@ref": "gr4",
            "@mimetype": "image/gif"
          },
          {
            "@category": "thumbnail",
            "@height": "80",
            "@width": "219",
            "@_fa": "true",
            "$": "https://api.elsevier.com/content/object/eid/1-s2.0-S2468823124009908-gr5.sml?httpAccept=%2A%2F%2A",
            "@multimediatype": "GIF image file",
            "@type": "IMAGE-THUMBNAIL",
            "@size": "12542",
            "@ref": "gr5",
            "@mimetype": "image/gif"
          },
          {
            "@category": "thumbnail",
            "@height": "164",
            "@width": "107",
            "@_fa": "true",
            "$": "https://api.elsevier.com/content/object/eid/1-s2.0-S2468823124009908-gr6.sml?httpAccept=%2A%2F%2A",
            "@multimediatype": "GIF image file",
            "@type": "IMAGE-THUMBNAIL",
            "@size": "10573",
            "@ref": "gr6",
            "@mimetype": "image/gif"
          },
          {
            "@category": "thumbnail",
            "@height": "83",
            "@width": "219",
            "@_fa": "true",
            "$": "https://api.elsevier.com/content/object/eid/1-s2.0-S2468823124009908-gr7.sml?httpAccept=%2A%2F%2A",
            "@multimediatype": "GIF image file",
            "@type": "IMAGE-THUMBNAIL",
            "@size": "8582",
            "@ref": "gr7",
            "@mimetype": "image/gif"
          },
          {
            "@category": "thumbnail",
            "@height": "164",
            "@width": "204",
            "@_fa": "true",
            "$": "https://api.elsevier.com/content/object/eid/1-s2.0-S2468823124009908-gr8.sml?httpAccept=%2A%2F%2A",
            "@multimediatype": "GIF image file",
            "@type": "IMAGE-THUMBNAIL",
            "@size": "7343",
            "@ref": "gr8",
            "@mimetype": "image/gif"
          },
          {
            "@category": "high",
            "@height": "1055",
            "@width": "1667",
            "@_fa": "true",
            "$": "https://api.elsevier.com/content/object/eid/1-s2.0-S2468823124009908-gr1_lrg.jpg?httpAccept=%2A%2F%2A",
            "@multimediatype": "JPEG image file",
            "@type": "IMAGE-HIGH-RES",
            "@size": "270130",
            "@ref": "gr1",
            "@mimetype": "image/jpeg"
          },
          {
            "@category": "high",
            "@height": "2524",
            "@width": "3500",
            "@_fa": "true",
            "$": "https://api.elsevier.com/content/object/eid/1-s2.0-S2468823124009908-gr2_lrg.jpg?httpAccept=%2A%2F%2A",
            "@multimediatype": "JPEG image file",
            "@type": "IMAGE-HIGH-RES",
            "@size": "704716",
            "@ref": "gr2",
            "@mimetype": "image/jpeg"
          },
          {
            "@category": "high",
            "@height": "886",
            "@width": "1296",
            "@_fa": "true",
            "$": "https://api.elsevier.com/content/object/eid/1-s2.0-S2468823124009908-ga1_lrg.jpg?httpAccept=%2A%2F%2A",
            "@multimediatype": "JPEG image file",
            "@type": "IMAGE-HIGH-RES",
            "@size": "280568",
            "@ref": "ga1",
            "@mimetype": "image/jpeg"
          },
          {
            "@category": "high",
            "@height": "3211",
            "@width": "2917",
            "@_fa": "true",
            "$": "https://api.elsevier.com/content/object/eid/1-s2.0-S2468823124009908-gr3_lrg.jpg?httpAccept=%2A%2F%2A",
            "@multimediatype": "JPEG image file",
            "@type": "IMAGE-HIGH-RES",
            "@size": "1047408",
            "@ref": "gr3",
            "@mimetype": "image/jpeg"
          },
          {
            "@category": "high",
            "@height": "4142",
            "@width": "3500",
            "@_fa": "true",
            "$": "https://api.elsevier.com/content/object/eid/1-s2.0-S2468823124009908-gr4_lrg.jpg?httpAccept=%2A%2F%2A",
            "@multimediatype": "JPEG image file",
            "@type": "IMAGE-HIGH-RES",
            "@size": "822183",
            "@ref": "gr4",
            "@mimetype": "image/jpeg"
          },
          {
            "@category": "high",
            "@height": "821",
            "@width": "2250",
            "@_fa": "true",
            "$": "https://api.elsevier.com/content/object/eid/1-s2.0-S2468823124009908-gr5_lrg.jpg?httpAccept=%2A%2F%2A",
            "@multimediatype": "JPEG image file",
            "@type": "IMAGE-HIGH-RES",
            "@size": "274840",
            "@ref": "gr5",
            "@mimetype": "image/jpeg"
          },
          {
            "@category": "high",
            "@height": "4417",
            "@width": "2879",
            "@_fa": "true",
            "$": "https://api.elsevier.com/content/object/eid/1-s2.0-S2468823124009908-gr6_lrg.jpg?httpAccept=%2A%2F%2A",
            "@multimediatype": "JPEG image file",
            "@type": "IMAGE-HIGH-RES",
            "@size": "1207537",
            "@ref": "gr6",
            "@mimetype": "image/jpeg"
          },
          {
            "@category": "high",
            "@height": "1106",
            "@width": "2917",
            "@_fa": "true",
            "$": "https://api.elsevier.com/content/object/eid/1-s2.0-S2468823124009908-gr7_lrg.jpg?httpAccept=%2A%2F%2A",
            "@multimediatype": "JPEG image file",
            "@type": "IMAGE-HIGH-RES",
            "@size": "280210",
            "@ref": "gr7",
            "@mimetype": "image/jpeg"
          },
          {
            "@category": "high",
            "@height": "2815",
            "@width": "3500",
            "@_fa": "true",
            "$": "https://api.elsevier.com/content/object/eid/1-s2.0-S2468823124009908-gr8_lrg.jpg?httpAccept=%2A%2F%2A",
            "@multimediatype": "JPEG image file",
            "@type": "IMAGE-HIGH-RES",
            "@size": "388959",
            "@ref": "gr8",
            "@mimetype": "image/jpeg"
          },
          {
            "@category": "standard",
            "@_fa": "true",
            "$": "https://api.elsevier.com/content/object/eid/1-s2.0-S2468823124009908-mmc1.docx?httpAccept=%2A%2F%2A",
            "@multimediatype": "Microsoft Word file",
            "@type": "APPLICATION",
            "@size": "3990578",
            "@ref": "mmc1",
            "@mimetype": "application/word"
          },
          {
            "@category": "thumbnail",
            "@_fa": "true",
            "$": "https://api.elsevier.com/content/object/eid/1-s2.0-S2468823124009908-si1.svg?httpAccept=%2A%2F%2A",
            "@multimediatype": "Scalable Vector Graphics file",
            "@type": "ALTIMG",
            "@size": "7518",
            "@ref": "si1",
            "@mimetype": "image/svg+xml"
          },
          {
            "@category": "thumbnail",
            "@_fa": "true",
            "$": "https://api.elsevier.com/content/object/eid/1-s2.0-S2468823124009908-si2.svg?httpAccept=%2A%2F%2A",
            "@multimediatype": "Scalable Vector Graphics file",
            "@type": "ALTIMG",
            "@size": "17086",
            "@ref": "si2",
            "@mimetype": "image/svg+xml"
          },
          {
            "@category": "thumbnail",
            "@_fa": "true",
            "$": "https://api.elsevier.com/content/object/eid/1-s2.0-S2468823124009908-si3.svg?httpAccept=%2A%2F%2A",
            "@multimediatype": "Scalable Vector Graphics file",
            "@type": "ALTIMG",
            "@size": "14745",
            "@ref": "si3",
            "@mimetype": "image/svg+xml"
          },
          {
            "@category": "thumbnail",
            "@_fa": "true",
            "$": "https://api.elsevier.com/content/object/eid/1-s2.0-S2468823124009908-si4.svg?httpAccept=%2A%2F%2A",
            "@multimediatype": "Scalable Vector Graphics file",
            "@type": "ALTIMG",
            "@size": "9355",
            "@ref": "si4",
            "@mimetype": "image/svg+xml"
          },
          {
            "@category": "thumbnail",
            "@_fa": "true",
            "$": "https://api.elsevier.com/content/object/eid/1-s2.0-S2468823124009908-si5.svg?httpAccept=%2A%2F%2A",
            "@multimediatype": "Scalable Vector Graphics file",
            "@type": "ALTIMG",
            "@size": "4382",
            "@ref": "si5",
            "@mimetype": "image/svg+xml"
          },
          {
            "@category": "thumbnail",
            "@_fa": "true",
            "$": "https://api.elsevier.com/content/object/eid/1-s2.0-S2468823124009908-si6.svg?httpAccept=%2A%2F%2A",
            "@multimediatype": "Scalable Vector Graphics file",
            "@type": "ALTIMG",
            "@size": "7619",
            "@ref": "si6",
            "@mimetype": "image/svg+xml"
          }
        ]
      },
      "link": {
        "@rel": "abstract",
        "@href": "https://api.elsevier.com/content/abstract/scopus_id/85214558449"
      }
    }
  }
}