{
  "metadata": {
    "title": "Why could the CrO<ce:inf loc=post>x</ce:inf>/SiO<ce:inf loc=post>2</ce:inf> and VO<ce:inf loc=post>x</ce:inf>/SiO<ce:inf loc=post>2</ce:inf> catalysts show so different behaviors in ethylene polymerization? A theoretical approach",
    "authors": "; ; ",
    "journal": "Molecular Catalysis",
    "date": "2020-09-30",
    "doi": "10.1016/j.mcat.2020.111090",
    "abstract": "",
    "uri": "https://api.elsevier.com/content/article/pii/S2468823120303539",
    "pii": "S2468823120303539"
  },
  "fulltext": {
    "full-text-retrieval-response": {
      "scopus-eid": "2-s2.0-85087286063",
      "originalText": "serial JL 315758 291210 291744 291790 291809 31 Molecular Catalysis MOLECULARCATALYSIS 2020-07-07 2020-07-07 2020-07-07 2020-07-07 2020-09-14T19:55:54 1-s2.0-S2468823120303539 S2468-8231(20)30353-9 S2468823120303539 10.1016/j.mcat.2020.111090 S300 S300.2 FULL-TEXT 1-s2.0-S2468823120X00125 2021-02-06T09:44:39.761623Z 0 0 20200901 20200930 2020 2020-07-07T16:32:50.90556Z absattachment articleinfo articlenumber articletitlenorm authfirstinitialnorm authfirstsurnamenorm cid cids contenttype copyright crossmark dateloaded dateloadedtxt datesearch datesort dateupdated dco docsubtype doctype doi eid ewtransactionid hubeid indexeddate issn issnnorm itemstage itemtransactionid itemweight openaccess openarchive pg pgfirst pii piinorm pubdateend pubdatestart pubdatetxt pubyr sectiontitle sortorder srctitle srctitlenorm srctype ssids alllist content subj subheadings suppl tomb volfirst volissue volumelist webpdf webpdfpagecount yearnav figure table e-component body mmlmath acknowledge affil appendices articletitle auth authfirstini authfull authkeywords authlast grantnumber grantsponsor grantsponsorid highlightsabst orcid primabst ref specialabst 2468-8231 24688231 true 493 493 C Volume 493 36 111090 111090 111090 202009 September 2020 2020-09-01 2020-09-30 2020 Regular Papers article fla © 2020 Elsevier B.V. All rights reserved. CROXSIO2VOXSIO2CATALYSTSSHOWDIFFERENTBEHAVIORSINETHYLENEPOLYMERIZATIONATHEORETICALAPPROACH WANG S 1 Introduction 2 Computational methods and models 2.1 Computational models 2.2 Computational methods 3 Results and discussion 3.1 Chain propagation through insertion 3.2 Chain termination through chain transfer 3.3 Chain propagation vs chain termination 4 Conclusions CRediT authorship contribution statement Acknowledgement Appendix A Supplementary data References MCDANIEL 2010 123 606 M CHENG 2013 135 202 R POLYOLEFINS50YEARSAFTERZIEGLERNATTAIPOLYETHYLENEPOLYPROPYLENE PHILLIPSCRSILICACATALYSTFORETHYLENEPOLYMERIZATION HAGEN 2002 357 364 H JIN 2017 1600443 Y LIU 2017 1700006 B ZHAO 2014 N LIU 2018 1800021 B ZHAO 2014 1434 1445 N CHENG 2015 462 472 R JIN 2017 3404 3412 Y JIN 2017 1700236 Y GOLDSMITH 2017 7543 7557 B LICHTENSTEIN 2012 404 407 L DEMMELMAIER 2009 44 56 C MA 2015 1 12 Y JIN 2019 995 1004 Y LIU 2016 6591 6600 Z ESPELID 2000 125 139 O GROPPO 2018 10846 10863 E GIERADA 2016 122 135 M FLORYAN 2017 50 56 L BROWN 2015 5574 5583 C CHAKRABARTI 2016 725 739 A GIERADA 2017 314 328 M ADISSON 1993 831 839 E ADISSON 1994 1033 1041 E CRUZ 2019 5750 5760 C ZENG 2017 1600046 Y FRISCH 2009 M GAUSSIAN09REVISIONE01 JENGDA 2008 6615 6620 C WEIGEND 2006 1057 1065 F WEIGEND 2005 3297 3305 F SCHLEGEL 1982 214 218 H NEESE 2012 73 78 F GRIMME 2012 9955 9964 S CREHUET 2005 234105 R MAEDA 2015 258 269 S GLENDENING 2012 1 42 E LU 2012 580 592 T HUMPHREY 1996 33 38 W COSSEE 1964 80 88 P BORRELLI 2002 2835 2844 M TOMASI 2009 2609 2618 S LAINE 2010 1541 1550 A CORREA 2007 4519 4527 A SUN 2016 3364 3373 Q FONG 2015 9882 9891 A HANDZLIK 2013 8138 8149 J GALLAND 1996 607 613 G LAINE 2011 1350 1358 A MURRAY 2017 e1326 J CRUZ 2004 2061 2072 V YANG 2015 1125 1133 W AHMED 2018 9637 9644 S HUO 2013 2291 2299 P ELEY 1972 361 373 D LIU 2017 6164 6175 B GIBSON 2002 2316 2317 V BYUN 2000 1921 1923 D GIERADA 2017 314 328 M TALARICO 2008 4098 4107 G FALIVENE 2018 138 144 L BESORA 2018 1392 1399 M MAMMEN 1998 3821 3830 M BAHRILALEH 2012 74 79 N TONOSAKI 2011 33 38 K ATIQULLAH 1998 1511 1520 M MARGL 1999 154 162 P ZAI 2010 4321 4323 S KWON 2019 3727 3739 D WANGX2020X111090 WANGX2020X111090XS 2022-07-07T00:00:00.000Z 2022-07-07T00:00:00.000Z http://creativecommons.org/licenses/by-nc-nd/4.0/ © 2020 Elsevier B.V. All rights reserved. 2020-06-23T13:22:13.670Z http://vtw.elsevier.com/data/voc/AddOnTypes/50.7/eoas NSFC National Natural Science Foundation of China http://data.elsevier.com/vocabulary/SciValFunders/501100001809 http://sws.geonames.org/1814991 item S2468-8231(20)30353-9 S2468823120303539 1-s2.0-S2468823120303539 10.1016/j.mcat.2020.111090 315758 2021-02-06T09:44:39.761623Z 2020-09-01 2020-09-30 1-s2.0-S2468823120303539-main.pdf https://s3-eu-west-1.amazonaws.com/prod-ucs-content-store-eu-west/content/pii:S2468823120303539/MAIN/application/pdf/f143bf4bf13b42e88456b898549536f7/main.pdf main.pdf pdf true 3305707 MAIN 12 1-s2.0-S2468823120303539-main_1.png https://s3-eu-west-1.amazonaws.com/prod-ucs-content-store-eu-west/content/pii:S2468823120303539/PREVIEW/image/png/8535a4de975cb3a3811960de5f4c98b8/main_1.png main_1.png png 55562 849 656 IMAGE-WEB-PDF 1 1-s2.0-S2468823120303539-ga1.jpg https://s3-eu-west-1.amazonaws.com/prod-ucs-content-store-eu-west/content/pii:S2468823120303539/ga1/DOWNSAMPLED/image/jpeg/45c84f1165a23776e966f69426ba5930/ga1.jpg ga1 true ga1.jpg jpg 19492 200 487 IMAGE-DOWNSAMPLED 1-s2.0-S2468823120303539-gr1.jpg https://s3-eu-west-1.amazonaws.com/prod-ucs-content-store-eu-west/content/pii:S2468823120303539/gr1/DOWNSAMPLED/image/jpeg/8d79bb09f39cf4733387b7b9c596d116/gr1.jpg gr1 gr1.jpg jpg 17635 272 340 IMAGE-DOWNSAMPLED 1-s2.0-S2468823120303539-gr10.jpg https://s3-eu-west-1.amazonaws.com/prod-ucs-content-store-eu-west/content/pii:S2468823120303539/gr10/DOWNSAMPLED/image/jpeg/e040b9c1d94ab3356effaecf263dad9d/gr10.jpg gr10 gr10.jpg jpg 29212 188 679 IMAGE-DOWNSAMPLED 1-s2.0-S2468823120303539-gr11.jpg https://s3-eu-west-1.amazonaws.com/prod-ucs-content-store-eu-west/content/pii:S2468823120303539/gr11/DOWNSAMPLED/image/jpeg/a467073a820515a1034827e9b581927b/gr11.jpg gr11 gr11.jpg jpg 18464 243 340 IMAGE-DOWNSAMPLED 1-s2.0-S2468823120303539-gr12.jpg https://s3-eu-west-1.amazonaws.com/prod-ucs-content-store-eu-west/content/pii:S2468823120303539/gr12/DOWNSAMPLED/image/jpeg/4ab786eb31ae58914af08bab83c5a32d/gr12.jpg gr12 gr12.jpg jpg 65154 713 491 IMAGE-DOWNSAMPLED 1-s2.0-S2468823120303539-gr2.jpg https://s3-eu-west-1.amazonaws.com/prod-ucs-content-store-eu-west/content/pii:S2468823120303539/gr2/DOWNSAMPLED/image/jpeg/2b731ae89d110af8db05a45717179977/gr2.jpg gr2 gr2.jpg jpg 56932 602 509 IMAGE-DOWNSAMPLED 1-s2.0-S2468823120303539-gr3.jpg https://s3-eu-west-1.amazonaws.com/prod-ucs-content-store-eu-west/content/pii:S2468823120303539/gr3/DOWNSAMPLED/image/jpeg/803d5250bfad5f8cb4dbe6392e9c49db/gr3.jpg gr3 gr3.jpg jpg 35140 490 378 IMAGE-DOWNSAMPLED 1-s2.0-S2468823120303539-gr4.jpg https://s3-eu-west-1.amazonaws.com/prod-ucs-content-store-eu-west/content/pii:S2468823120303539/gr4/DOWNSAMPLED/image/jpeg/f4548641b7be5269e37aff88481ecf88/gr4.jpg gr4 gr4.jpg jpg 21991 239 340 IMAGE-DOWNSAMPLED 1-s2.0-S2468823120303539-gr5.jpg https://s3-eu-west-1.amazonaws.com/prod-ucs-content-store-eu-west/content/pii:S2468823120303539/gr5/DOWNSAMPLED/image/jpeg/156ef7e8ba0087caa59454516db18f46/gr5.jpg gr5 gr5.jpg jpg 32961 353 566 IMAGE-DOWNSAMPLED 1-s2.0-S2468823120303539-gr6.jpg https://s3-eu-west-1.amazonaws.com/prod-ucs-content-store-eu-west/content/pii:S2468823120303539/gr6/DOWNSAMPLED/image/jpeg/14db7acfaad813a9770b6a8eedb26728/gr6.jpg gr6 gr6.jpg jpg 80031 584 602 IMAGE-DOWNSAMPLED 1-s2.0-S2468823120303539-gr7.jpg https://s3-eu-west-1.amazonaws.com/prod-ucs-content-store-eu-west/content/pii:S2468823120303539/gr7/DOWNSAMPLED/image/jpeg/13622652117ca4cffe6ae9a9d206d16e/gr7.jpg gr7 gr7.jpg jpg 37916 191 679 IMAGE-DOWNSAMPLED 1-s2.0-S2468823120303539-gr8.jpg https://s3-eu-west-1.amazonaws.com/prod-ucs-content-store-eu-west/content/pii:S2468823120303539/gr8/DOWNSAMPLED/image/jpeg/a3b3ef89b9fe4132e15060a48bfbeff8/gr8.jpg gr8 gr8.jpg jpg 35773 392 378 IMAGE-DOWNSAMPLED 1-s2.0-S2468823120303539-gr9.jpg https://s3-eu-west-1.amazonaws.com/prod-ucs-content-store-eu-west/content/pii:S2468823120303539/gr9/DOWNSAMPLED/image/jpeg/5e50fb9162d6833a2051312cd2a69291/gr9.jpg gr9 gr9.jpg jpg 73423 549 566 IMAGE-DOWNSAMPLED 1-s2.0-S2468823120303539-sc1.jpg https://s3-eu-west-1.amazonaws.com/prod-ucs-content-store-eu-west/content/pii:S2468823120303539/sc1/DOWNSAMPLED/image/jpeg/27d129a5499f23a499607bd375cf991d/sc1.jpg sc1 sc1.jpg jpg 34028 379 679 IMAGE-DOWNSAMPLED 1-s2.0-S2468823120303539-sc2.jpg https://s3-eu-west-1.amazonaws.com/prod-ucs-content-store-eu-west/content/pii:S2468823120303539/sc2/DOWNSAMPLED/image/jpeg/36fac9a6f869c635e15a4d9f72f9919b/sc2.jpg sc2 sc2.jpg jpg 32361 299 717 IMAGE-DOWNSAMPLED 1-s2.0-S2468823120303539-ga1.sml https://s3-eu-west-1.amazonaws.com/prod-ucs-content-store-eu-west/content/pii:S2468823120303539/ga1/THUMBNAIL/image/gif/fde038b1410864c30ba3e8f1ad06cac4/ga1.sml ga1 true ga1.sml sml 5760 90 219 IMAGE-THUMBNAIL 1-s2.0-S2468823120303539-gr1.sml https://s3-eu-west-1.amazonaws.com/prod-ucs-content-store-eu-west/content/pii:S2468823120303539/gr1/THUMBNAIL/image/gif/bbc284af7f2243189342f4be2c915e6e/gr1.sml gr1 gr1.sml sml 10275 164 205 IMAGE-THUMBNAIL 1-s2.0-S2468823120303539-gr10.sml https://s3-eu-west-1.amazonaws.com/prod-ucs-content-store-eu-west/content/pii:S2468823120303539/gr10/THUMBNAIL/image/gif/89672266dbcf4a33eefcfef5b46131c2/gr10.sml gr10 gr10.sml sml 4352 61 219 IMAGE-THUMBNAIL 1-s2.0-S2468823120303539-gr11.sml https://s3-eu-west-1.amazonaws.com/prod-ucs-content-store-eu-west/content/pii:S2468823120303539/gr11/THUMBNAIL/image/gif/00d7d5fc46926bd894a9a534b6daa123/gr11.sml gr11 gr11.sml sml 7131 157 219 IMAGE-THUMBNAIL 1-s2.0-S2468823120303539-gr12.sml https://s3-eu-west-1.amazonaws.com/prod-ucs-content-store-eu-west/content/pii:S2468823120303539/gr12/THUMBNAIL/image/gif/3b85019818a346231accbe49b4cf4e09/gr12.sml gr12 gr12.sml sml 7438 164 113 IMAGE-THUMBNAIL 1-s2.0-S2468823120303539-gr2.sml https://s3-eu-west-1.amazonaws.com/prod-ucs-content-store-eu-west/content/pii:S2468823120303539/gr2/THUMBNAIL/image/gif/f188142f220d025f09e049429cc52b39/gr2.sml gr2 gr2.sml sml 5882 163 138 IMAGE-THUMBNAIL 1-s2.0-S2468823120303539-gr3.sml https://s3-eu-west-1.amazonaws.com/prod-ucs-content-store-eu-west/content/pii:S2468823120303539/gr3/THUMBNAIL/image/gif/aff23d789f864f1ec52d1cb001f07693/gr3.sml gr3 gr3.sml sml 5311 163 126 IMAGE-THUMBNAIL 1-s2.0-S2468823120303539-gr4.sml https://s3-eu-west-1.amazonaws.com/prod-ucs-content-store-eu-west/content/pii:S2468823120303539/gr4/THUMBNAIL/image/gif/08da77a9f4bc89a659579564ad140c82/gr4.sml gr4 gr4.sml sml 8346 154 219 IMAGE-THUMBNAIL 1-s2.0-S2468823120303539-gr5.sml https://s3-eu-west-1.amazonaws.com/prod-ucs-content-store-eu-west/content/pii:S2468823120303539/gr5/THUMBNAIL/image/gif/baa4fec46067e78e8ebe7e22968f070b/gr5.sml gr5 gr5.sml sml 12228 136 219 IMAGE-THUMBNAIL 1-s2.0-S2468823120303539-gr6.sml https://s3-eu-west-1.amazonaws.com/prod-ucs-content-store-eu-west/content/pii:S2468823120303539/gr6/THUMBNAIL/image/gif/2204293b0da2df8d411460082373a2d9/gr6.sml gr6 gr6.sml sml 9485 164 169 IMAGE-THUMBNAIL 1-s2.0-S2468823120303539-gr7.sml https://s3-eu-west-1.amazonaws.com/prod-ucs-content-store-eu-west/content/pii:S2468823120303539/gr7/THUMBNAIL/image/gif/49f0d738cd3509b760ab2017807744c0/gr7.sml gr7 gr7.sml sml 4817 62 219 IMAGE-THUMBNAIL 1-s2.0-S2468823120303539-gr8.sml https://s3-eu-west-1.amazonaws.com/prod-ucs-content-store-eu-west/content/pii:S2468823120303539/gr8/THUMBNAIL/image/gif/795ca3543619aa826eefd44088d5ba4e/gr8.sml gr8 gr8.sml sml 7700 164 158 IMAGE-THUMBNAIL 1-s2.0-S2468823120303539-gr9.sml https://s3-eu-west-1.amazonaws.com/prod-ucs-content-store-eu-west/content/pii:S2468823120303539/gr9/THUMBNAIL/image/gif/c3c8dc412c2b69deadab4f8eb080c039/gr9.sml gr9 gr9.sml sml 10535 164 169 IMAGE-THUMBNAIL 1-s2.0-S2468823120303539-sc1.sml https://s3-eu-west-1.amazonaws.com/prod-ucs-content-store-eu-west/content/pii:S2468823120303539/sc1/THUMBNAIL/image/gif/6705a2534d5121abd7a4de6968e1cdd5/sc1.sml sc1 sc1.sml sml 4545 122 219 IMAGE-THUMBNAIL 1-s2.0-S2468823120303539-sc2.sml https://s3-eu-west-1.amazonaws.com/prod-ucs-content-store-eu-west/content/pii:S2468823120303539/sc2/THUMBNAIL/image/gif/bfd0769745df3c658ed2108c43e68525/sc2.sml sc2 sc2.sml sml 3693 91 219 IMAGE-THUMBNAIL 1-s2.0-S2468823120303539-mmc1.pdf https://s3-eu-west-1.amazonaws.com/prod-ucs-content-store-eu-west/content/pii:S2468823120303539/mmc1/MAIN/application/pdf/afe72aed68d2fae92a05332da5baa1fd/mmc1.pdf mmc1 mmc1.pdf pdf false 1962861 APPLICATION 1-s2.0-S2468823120303539-si1.svg https://s3-eu-west-1.amazonaws.com/prod-ucs-content-store-eu-west/content/pii:S2468823120303539/STRIPIN/image/svg+xml/4e3e1dac06c5237387d0def9414528ec/si1.svg si1 si1.svg svg 105925 ALTIMG 1-s2.0-S2468823120303539-si10.svg https://s3-eu-west-1.amazonaws.com/prod-ucs-content-store-eu-west/content/pii:S2468823120303539/STRIPIN/image/svg+xml/9faf45adfb67fc3bda870c249cd5b748/si10.svg si10 si10.svg svg 29174 ALTIMG 1-s2.0-S2468823120303539-si11.svg https://s3-eu-west-1.amazonaws.com/prod-ucs-content-store-eu-west/content/pii:S2468823120303539/STRIPIN/image/svg+xml/4214537ea66cba3ddb6a03f31c4bd1f4/si11.svg si11 si11.svg svg 3017 ALTIMG 1-s2.0-S2468823120303539-si12.svg https://s3-eu-west-1.amazonaws.com/prod-ucs-content-store-eu-west/content/pii:S2468823120303539/STRIPIN/image/svg+xml/e2088e64c55b03c0196a64b00a21a938/si12.svg si12 si12.svg svg 2932 ALTIMG 1-s2.0-S2468823120303539-si13.svg https://s3-eu-west-1.amazonaws.com/prod-ucs-content-store-eu-west/content/pii:S2468823120303539/STRIPIN/image/svg+xml/f6ccee71724293d2e91adcdb7a5c320f/si13.svg si13 si13.svg svg 5448 ALTIMG 1-s2.0-S2468823120303539-si14.svg https://s3-eu-west-1.amazonaws.com/prod-ucs-content-store-eu-west/content/pii:S2468823120303539/STRIPIN/image/svg+xml/069b8befd1f55a7c44aab9dc9fc3dc5d/si14.svg si14 si14.svg svg 5837 ALTIMG 1-s2.0-S2468823120303539-si15.svg https://s3-eu-west-1.amazonaws.com/prod-ucs-content-store-eu-west/content/pii:S2468823120303539/STRIPIN/image/svg+xml/ac1d5e10f66997a7797dffa898ce103e/si15.svg si15 si15.svg svg 5592 ALTIMG 1-s2.0-S2468823120303539-si16.svg https://s3-eu-west-1.amazonaws.com/prod-ucs-content-store-eu-west/content/pii:S2468823120303539/STRIPIN/image/svg+xml/54cf4c934fe22ea06799953151118c8a/si16.svg si16 si16.svg svg 8108 ALTIMG 1-s2.0-S2468823120303539-si17.svg https://s3-eu-west-1.amazonaws.com/prod-ucs-content-store-eu-west/content/pii:S2468823120303539/STRIPIN/image/svg+xml/3cfd5a201185b8cd8ee6c3e27934fffa/si17.svg si17 si17.svg svg 8315 ALTIMG 1-s2.0-S2468823120303539-si18.svg https://s3-eu-west-1.amazonaws.com/prod-ucs-content-store-eu-west/content/pii:S2468823120303539/STRIPIN/image/svg+xml/8f1cf9de8ea7a32f2527104891abaae9/si18.svg si18 si18.svg svg 5071 ALTIMG 1-s2.0-S2468823120303539-si2.svg https://s3-eu-west-1.amazonaws.com/prod-ucs-content-store-eu-west/content/pii:S2468823120303539/STRIPIN/image/svg+xml/73976acdf9a0252922a5d03320e830eb/si2.svg si2 si2.svg svg 24373 ALTIMG 1-s2.0-S2468823120303539-si3.svg https://s3-eu-west-1.amazonaws.com/prod-ucs-content-store-eu-west/content/pii:S2468823120303539/STRIPIN/image/svg+xml/6c387237a94fe09cb9ba251daccb09e4/si3.svg si3 si3.svg svg 13527 ALTIMG 1-s2.0-S2468823120303539-si4.svg https://s3-eu-west-1.amazonaws.com/prod-ucs-content-store-eu-west/content/pii:S2468823120303539/STRIPIN/image/svg+xml/2069f70b0106502ee3b295ff472d3277/si4.svg si4 si4.svg svg 10381 ALTIMG 1-s2.0-S2468823120303539-si5.svg https://s3-eu-west-1.amazonaws.com/prod-ucs-content-store-eu-west/content/pii:S2468823120303539/STRIPIN/image/svg+xml/72d11f231b6b472d91e7ff08692f4c7e/si5.svg si5 si5.svg svg 24073 ALTIMG 1-s2.0-S2468823120303539-si6.svg https://s3-eu-west-1.amazonaws.com/prod-ucs-content-store-eu-west/content/pii:S2468823120303539/STRIPIN/image/svg+xml/b726114f53bdf615f4ddb64922f68849/si6.svg si6 si6.svg svg 16618 ALTIMG 1-s2.0-S2468823120303539-si7.svg https://s3-eu-west-1.amazonaws.com/prod-ucs-content-store-eu-west/content/pii:S2468823120303539/STRIPIN/image/svg+xml/ff5ab42428be18f88ad8055521209952/si7.svg si7 si7.svg svg 20840 ALTIMG 1-s2.0-S2468823120303539-si8.svg https://s3-eu-west-1.amazonaws.com/prod-ucs-content-store-eu-west/content/pii:S2468823120303539/STRIPIN/image/svg+xml/3977463387d0659ff8d595eb40e58d4b/si8.svg si8 si8.svg svg 18536 ALTIMG 1-s2.0-S2468823120303539-si9.svg https://s3-eu-west-1.amazonaws.com/prod-ucs-content-store-eu-west/content/pii:S2468823120303539/STRIPIN/image/svg+xml/10d4e4a1ffb1f5a964a79bf892709a3d/si9.svg si9 si9.svg svg 25002 ALTIMG 1-s2.0-S2468823120303539-am.pdf am am.pdf pdf 1306223 AAM-PDF https://s3-eu-west-1.amazonaws.com/prod-ucs-content-store-eu-west/content/egi:10T0MQ15H5H/MAIN/application/pdf/4436c738e57eca0151bab5677bf03eb9/am.pdf MCAT 111090 111090 S2468-8231(20)30353-9 10.1016/j.mcat.2020.111090 Elsevier B.V. Scheme 1 The chain propagation pathway for CrOx/SiO2 and VOx/SiO2 via the Cossess-Alrman mechanism. (M = Cr or V. R = H, ethyl or n-butyl. X = E, B or H, which indicates the first inserted olefin is ethylene, n-butene or n-hexene, respectively.). Scheme 1 Scheme 2 The chain transfer pathways through (A) β-H transfer to the coordinated C2H4 monomer, (B) β-H transfer to the metal center, and (C) hydrogenolysis. (M = Cr or V; R = H, ethyl or n-butyl; X = E, B or H for (A) and (B), while X = E for (C), where E, B and H indicates that the firstly inserted olefin is ethylene, n-butene or n-hexene, respectively.). Scheme 2 Fig. 1 Optimized structures of the proposed cluster models as active species for (A) CrOx/SiO2 and (B) VOx/SiO2. Fig. 1 Fig. 2 The energy profiles for the sequential insertion of (a) C2H4 and C2H4, (b) 1-butene and C2H4 and (c) 1-hexene and C2H4 on CrOx/SiO2 and VOx/SiO2 (M = Cr or V. X = E, B or H, which indicates the firstly inserted olefin is ethylene, 1-butene or 1-hexene, respectively. The relative energies are calculated by being normalized with the Gibbs free energies of the bare model and olefin monomer). Fig. 2 Fig. 3 The lengths of several key bonds involved in the insertion of the first C2H4 (M = Cr or V; The numbers above the columns are the specific bond lengths, and those in the parentheses belong to VOx/SiO2, while the others to CrOx/SiO2; The H atoms bonded to C1, C2, C3 and C4 are omitted for clarity). Fig. 3 Fig. 4 The NBO charges on the metal centers of various models and the energy gap between the LUMO of catalysts and HOMO of olefins (Energy gap (ΔE) = E(LUMO,Cat) – E(HOMO, Olefin)). Fig. 4 Fig. 5 The electrostatic potential distribution on the Van der Waals surface of various model catalysts (The surface patterns in red and blue indicate the positive and negative electrostatic potential, respectively). (For interpretation of the references to colour in the Figure, the reader is referred to the web version of this article). Fig. 5 Fig. 6 The electron density difference maps of the models in transition states for the insertion of thefirst olefin(The lobes in red and blue indicate the increasement and decrement of electron density, respectively; The same isosurface level = 0.013 is set for all the maps). (For interpretation of the references to colour in the Figure, the reader is referred to the web version of this article). Fig. 6 Fig. 7 The energy profiles for the β-H transfer to the C2H4 monomer (M = Cr or V;). Fig. 7 Fig. 8 The lengths of several key bonds involved in the β-H transfer to the C2H4 monomer (M = Cr or V; The numbers above the columns are the specific bond lengths, and those in the parentheses belong to VOx/SiO2, while the others to CrOx/SiO2; The H atoms bonded to C1, C2, C3 and C4 are omitted for clarity). Fig. 8 Fig. 9 The electron density difference maps of the models in transition states for the β-H transfer to the C2H4 monomer (The lobes in red and blue indicate the increasement and decrement of electron density, respectively; The same isosurface level = 0.018 is set for all the maps). (For interpretation of the references to colour in the Figure, the reader is referred to the web version of this article). Fig. 9 Fig. 10 The energy profiles for the β-H transfer to the Cr center (The orange and purple lines indicate the transition state before and after entropy correction, respectively). (For interpretation of the references to colour in the Figure, the reader is referred to the web version of this article). Fig. 10 Fig. 11 The energy profiles for chain transfer process via hydrogenolysis (M = Cr or V;). Fig. 11 Fig. 12 The electron density difference maps of the models (a) and (b) in complexation with H2 and (c) and (d) in transition states for hydrogenolysis (The lobes in red and blue indicate the increasement and decrement of electron density, respectively; The same isosurface level = 0.05 is set for all the maps). (For interpretation of the references to colour in the Figure, the reader is referred to the web version of this article). Fig. 12 Table 1 The summary of the reaction barriers for chain propagation and termination and the predicted MW of the PE products. Table 1 Models ΔG‡ p a ΔG‡ t ΔE d MW e (kcal mol−1) (kcal mol−1) (kcal mol−1) (g mol−1) Cr-3E 16.1 18.5 b 2.4 193 Cr-3E(St) f 16.1 20.5 b 4.4 5618 Cr-3B 15.6 15.5 b −0.1 0 Cr-3B(St) f 15.6 17.6 b 2.0 98 Cr-3H 15.2 15.7 b 0.5 8 Cr-3H(St) f 15.2 17.9 b 2.7 320 V-3E 17.8 22.1 c 4.3 39956 V-3B 17.6 22.2 c 4.6 66312 V-3H 17.2 21.3 c 4.1 28504 a The barriers for the insertion of the second C2H4 as shown in Fig. 1. b The barriers for BHE as shown in Fig. 9. c The barriers for BHT as shown in Fig. 6. d ΔE = ΔG‡ t-ΔG‡ p. e The most probable MW calculated with the Eq. (2)–(6). f “(St)” indicates the results after entropy correction. Why could the CrOx/SiO2 and VOx/SiO2 catalysts show so different behaviors in ethylene polymerization? A theoretical approach Shiyang Wang Writing - original draft Boping Liu Conceptualization Supervision Writing - review & editing * Yulong Jin Methodology Writing - original draft Supervision * Key Laboratory for Biomaterials and Energy of Ministry of Education, College of Materials and Energy, South China Agricultural University, Guangzhou 510630, People’s Republic of China Key Laboratory for Biomaterials and Energy of Ministry of Education College of Materials and Energy South China Agricultural University Guangzhou 510630 People’s Republic of China Key Laboratory for Biomaterials and Energy of Ministry of Education, College of Materials and Energy, South China Agricultural University, Guangzhou 510630, People’s Republic of China ⁎ Corresponding authors. Graphical abstract Phillips catalyst (CrOx/SiO2) is one of the most famous industrial catalysts for ethylene polymerization, while VOx/SiO2 catalyst is a promising catalyst capable of making UHMWPE, which was recently developed in our group. These two catalysts were known to show completely deferent behaviors in ethylene polymerization in terms of activity, H2 response and copolymerization ability. However, a molecular insight into the mechanism is not well understood. Herein, a theoretical comparison between them via the propagation through insertion and termination through chain transfer reaction pathways is performed. The results show the transition states for olefins (ethylene, 1-butene and 1-hexene) insertion are energetically more stable in VOx/SiO2. However, the binding energies of the olefins by VOx/SiO2 is obviously lower, which results in the insertion barriers for VOx/SiO2 about 2–3 kcal mol−1 higher than those for CrOx/SiO2. As to the termination, CrOx/SiO2 is more probably to terminate via the BHE (β-H elimination to Cr center) pathway, which generally has lower barriers than those for BHT (β-H elimination to monomer) in the VOx/SiO2 system. Meanwhile, VOx/SiO2 is superior to CrOx/SiO2 in hydrogenolysis, because it is more accessible by the H2, and the reaction barrier is also much lower. The energy gap between the barriers for propagation and termination is generally smaller for CrOx/SiO2, implying its tendency to produce lower MW PE when compared with VOx/SiO2. Furthermore, for CrOx/SiO2, the insertion barriers between C2H4 and α-olefin are bigger and the promotion effect of the incorporated α-olefins on termination is more obvious, which might account for the lower incorporation efficiency for comonomer by CrOx/SiO2, despite of its lower insertion barriers. Keywords Phillips catalyst Vanadium-oxide-based catalyst Ethylene polymerization Density functional theory 1 Introduction Phillips catalyst, consisting of CrOx/SiO2, was one of the first to be commercialized for low pressure production of polyethylene (PE). Though nearly 70 years had passed since its discovery, this catalyst still accounts for almost half of the market for high-density polyethylene (HDPE), primarily due to its competence in producing HDPE products with distinct properties like broad molecular weight distribution (MWD), in-situ generated long chain branch, and so forth. Additionally, Phillips catalyst is also cost-competitive owing to its simple preparation procedures by the impregnation of Cr sources on silica and subsequent high temperature calcination under dehydrated and O2 containing atmosphere [1,2]. In addition to CrOx/SiO2, the vanadium-oxide-based catalyst VOx/SiO2, which could be prepared with the similar way as that for Phillips catalyst, was also found to be active for ethylene polymerization. On the other hand, VOx/SiO2 also presents peculiar catalytic behaviors owned by typical V-based Ziegler-Natta catalysts such as VOCl3 and VCl4 [3]. For instance, VOx/SiO2 is apt to produce PEs with molecular weight (MW) as high as millions [4]. Its efficiency for comonomer incorporation is also excellent. Furthermore, VOx/SiO2 is sensitive to H2, which means the MW of the produced PEs would decrease obviously with relatively low partial pressure of H2 [5]. However, the activity of VOx/SiO2 for olefin polymerization is low and failed to be applied in industry alone. Instead, it is used as promoter for other catalysts [6,7]. Recently, our group also synthesized a series of bimetallic catalysts by co-immobilizing VOx together with others catalysts precursors such as CrOx or silyl-chromate on silica-based supports. Bimodal PEs with reverse short chain branch distribution could be synthesized in one pot with these catalysts, if catalyst composition and reaction conditions were properly regulated [6,8–10]. More recently, we devoted great effort to enhance the efficiency of VOx/SiO2 through the modification of support and activator ingredients, hence, its activity could reach as high as 5 × 103 kg PE mol−1 V [4,11]. As mentioned above, CrOx/SiO2 is an important industrial PE catalyst, while VOx/SiO2 is a newly developed catalyst with potential practicality. For both catalysts, the preparation procedures are almost the same, and their active sites are all anchored on silica surface by SiOM (M = Cr or V) bonds. However, their catalytic behaviors and PE products are obviously different. In comparison to VOx/SiO2, CrOx/SiO2 exhibits much higher activity towards C2H4 polymerization, but its copolymerization efficiency and H2 sensitivity are inferior to the former one, and the MW of its PE products is relatively lower than that synthesized by VOx/SiO2. To give a molecular insight into the underlying mechanism, which is not well understood up to now, we tried to take full advantages of computational method and make a comparative theoretical study on both CrOx/SiO2 and VOx/SiO2 catalysts. 2 Computational methods and models 2.1 Computational models In our calculations, a six-membered siloxane ring was used to model silica support, as it was found to be the most abundant and stable ring size in amorphous silica [12,13]. Demmelmaier et al. also found the most active species on Phillips catalyst are those supported by the strained siloxane rings with 6∼8 Si-O units [14]. The catalyst clusters were obtained by replacing one of the Si atoms with Cr or V. Such cluster models are simple but found be able to reveal the fundamental characteristics of both catalysts. Therefore, it is widely used to investigate the catalytic behaviors of CrOx/SiO2 and VOx/SiO2 in olefin polymerization [15–18]. On the other hand, we also ran calculations on models with bigger silica support derived from the β-cristobalite structure. It generally indicates the relative energies of the active species are similar for the two types of clusters (see Fig. S1 and S2). In addition, as the loading amount of Cr or V in these catalysts is often less than 1 wt %, and the specific surface area of the silica support is usually high, thus highly dispersed Cr or V species are immobilized on the surface. Hence, models with multinuclear were not considered herein. Up to now, there is still a controversy over the virtual active valence of CrOx/SiO2 and VOx/SiO2 for ethylene polymerization [19–21]. However, Cr(III) species were mostly verified to be the active centers in several recent works [21–24]. While V(III) species were also often detected to be the active centers for V-based Ziegler-Natta catalyst as well [25,26]. Jin et al. found that V(III) was the most possible active species for VOx/SiO2 in ethylene polymerization, as the steric hindrance of V(IV) and V(V) species was very large, while the complexation between C2H4 and V(II) species was too strong, which would boost up the overall insertion barrier greatly [16]. On the other hand, though chain initiation mechanism is a very important subject for Phillips catalyst, it is still difficult to reach a consensus [19,27]. Moreover, alkylation agents such as triethyl-aluminum (TEA) are often added for impurity scavenging and the activation of both CrOx/SiO2 and VOx/SiO2 in many works [4,11,28]. Consequently, ethylated Cr(III) and V(III) models shown in Fig. 1 were proposed as the active species for CrOx/SiO2 and VOx/SiO2, respectively. 2.2 Computational methods All calculations were carried out with the Gaussian 09 E.01 package [29]. The structures of reactants, resultants, as well as the transition states were optimized using the long-range corrected hybrid density functional ωB97X-D functional [30] in combination with the double-zeta basis-set def2-SVP [31,32]. The TSN method (keywords: opt = TS) was used to search the transition states, in which an initial structure was built up and computed with the Berny algorithm [33]. The default convergence criteria in Gaussian 09 were executed for all the calculations. The single point energy was calculated with the same functional as for structure optimization but with the more accurate triple-zeta basis-set def2-TZVPP [31,32]. We also calculated the single point energies of several optimized structures for C2H4 insertion by ωB97X-D3/def2-TZVPP with the ORCA 4.1 program, [34] since it is believed that the DFT-D3(BJ) dispersion corrections integrated in ωB97X-D3 are endowed with improved accuracy in comparison to the DFT-D2(BJ) included by ωB97X-D [35]. It is found the electronic energies calculated by ωB97X-D3/def2-TZVPP are consistently lower, but the relative energies for the species in C2H4 insertion are comparable for both theoretical levels (see Table S1 in Supporting information). This computational protocol was applied for both CrOx/SiO2 and VOx/SiO2, which had been demonstrated reasonable previously [16] Harmonic frequencies were computed to verify that the local minimum for reactants and products had no imaginary frequencies and the 1st order saddle points for each transition state had only one imaginary frequency. At the same time, the Gibbs energy corrections were calculated at T =298 K and P =1 atm. To ensure that the reactant and the product are correctly connected by the located transition state, the intrinsic reaction coordinate (IRC) method was applied afterwards [36,37]. We predict the reaction pathways through the Gibbs free energies which were obtained by adding the single point energies to the Gibbs energy corrections. Jin et al. and Floryan et al. had summarized the relationship between spin multiplicity and the stability of V(III) and Cr(III) active species, finding the high-spin state (i.e., quartet for Cr(III) and triplet for V(III)) was always more stable than the low-spin ones [16,21]. Therefore, all the calculations were also carried out with high-spin states herein. The Nature Bond Orbital analysis (NBO) was performed by the integrated NBO program in Gaussian, and the applied computational protocol was the same to that for the single point energy calculation [38]. The electrostatic potential (ESP) defined on the molecular Van der Waals surface, as well as the electron density difference maps were graphed by the combination of Multiwfn 3.9 and VMD 1.9.1 programs [39,40]. The electron density difference maps were produced by the following equation: Δρ = ρAB-ρA-ρB, where ρAB is the electron density of the complex consisted by A and B, ρA and ρB imply the electron density of A and B alone, but have their structures kept the same as in the complex, and Δρ is the obtained electron density difference. 3 Results and discussion 3.1 Chain propagation through insertion We firstly performed a calculation on chain propagation. It proceeds through the first insertion of a C2H4 or an α-olefin (1-butene and 1-hexene) and a subsequent insertion of another C2H4. The Cossee-Alrman mechanism, which is often believed to be applicable to olefin coordination polymerization, is used to describe the chain propagation process [41]. Firstly, the free olefins would complex with the catalysts through the vacant coordination site of the metal centers. Then, the transition state with a geometry of four-membered ring, which is consisted by the MC bond in M-alkyl and CC bond in olefins, would come into being. Finally, the product would be obtained by accomplishing the insertion of the alkylene carbons into the MC bond. The vacant coordination site would be regenerated and ready for the insertion of the next olefin (see Scheme 1 ). For the incorporation of α-olefin, a regioselectivity should be considered. It is found the 1,2-insertion is more or less energetically preferred than the 2,1-insertion (see Fig. S1 in the Supporting Information). It might be mainly due to the steric effect between the incoming α-olefin and the catalyst framework, which is commonly met in the coordination polymerization of α-olefin [42–45]. Therefore, in the following discussion, the results only for the 1,2-insertion are taken into account if α-olefin is involved. We primarily investigate the insertion of the first olefin, as shown in Fig. 2 (a), the coordination of a C2H4 to CrOx/SiO2 is exothermic and a heat of 2.2 kcal mol−1 would be released. Afterwards, an energy barrier of 14.9 kcal mol−1 has to be overcome to realize the C2H4 insertion. The obtained product has an energy about 14 kcal mol−1 lower than the free system (bare catalyst + one C2H4), which indicates a strong exothermic process for C2H4 insertion. It is coincident with the results of Sun et al. and Fong et al., who also investigated the Phillips catalyst for C2H4 polymerization with similar cluster models [46,47], They declared modest binding energies of −1–2 kcal mol−1 for C2H4, a insertion barrier about 17 kcal mol−1, and a reaction enthalpy about−10–−12 kcal mol−1. On the other hand, Floryan et al. [21] reported the binding energies for a C2H4 molecule were about −8–5 kcal mol−1, while the insertion barriers were in the range of 0.9–5.5 kcal mol−1. Such a discrepancy might result from the amorphous periodic models of silica adopted by them, since it was able to describe the variation of the silica surface more accurately and allow to build up active sites with diversified coordination conditions [48]. In addition, the differences in computational details, such as program package and functionals, should also be taken into account. With respect to VOx/SiO2, it is distinct that the coordination of C2H4 is much stronger, that is, a binding energy lower than −7 kcal mol−1 could be seen. This impedes the subsequent insertion obviously and results in an energy barrier higher than 18 kcal mol−1. However, it is intriguing to find that more stable transition state of C2H4 insertion could even be formed on VOx/SiO2 in comparison to that of CrOx/SiO2. As shown in Fig. 3 , we look into several key bonds involved in the insertion process. It is found that the length of V-C1 is about 0.05 Å longer than Cr-C2 for the bare models. After the coordination of C2H4, the length of M-C1 is kept nearly constant, but for VOx/SiO2, the M-C3 and C1-C4 are respectively 0.13 and 0.05 Å shorter, and the double bond of C3=C4 in C2H4 is 0.01 Å longer. It means the C2H4 could be more strongly complexed with VOx/SiO2, which is also in compatible with its much lower binding energy with C2H4. During the formation of the transition states, the distance of M-C3 is similar on both catalysts, but the C1-C4 decreases to 2.14 Å and the C3=C4 elongates to 1.42 Å for VOx/SiO2, which are 0.08 Å shorter and 0.02 longer Å than those values observed for CrOx/SiO2, respectively. Furthermore, the M-C1 bond stretches from 2.04 to 2.17 Å in VOx/SiO2, but from 2.00 to 2.07 Å in CrOx/SiO2. It indicates that, during the insertion of C2H4, both the catalyst and the C2H4 is more severely activated in the VOx/SiO2 system. This is also in accordance with its lower energy in transition state in comparison to that for CrOx/SiO2. For the cases in which 1-butene or 1-hexene is firstly inserted (see Fig. 2 (b) and (c)), since the metal centers are sterically open, the binding energies for 1-butene and 1-hexene are almost the same to those for C2H4, despite of the longer chain length of the comonomers. However, the transition states for comonomer insertion locate at higher energy level, and hence the overall insertion barriers are all about 2∼3 kcal mol−1 higher than the insertion of C2H4. It is coincident with the lower reactivity ratios of α-olefins than C2H4 in olefin coordination polymerization [49,50]. On the other hand, when compared with CrOx/SiO2, VOx/SiO2 is still much more appealing to the upcoming comonomers. It predominantly renders the insertion barrier about 3 kcal mol−1 higher in VOx/SiO2 than CrOx/SiO2. Regarding to the products for the insertion of the first olefin, the terminal H atoms tend to bite back the metal center. It is more obvious when α-olefins are incorporated. Because the growing chain is relatively longer and more flexible, which facilitates the interactions between the terminal H atoms and the unsaturated metal centers (see Fig. S2 in the Supporting Information). Consequently, the complexing of the awaiting C2H4 becomes a bit difficult, which could be reflected by the less negative binding energies. It frees the binding C2H4 more or less and enhances the energy level of the starting point for the subsequent insertion. Nevertheless, the energies of the transition states for insertion increase a bit as well. Therefore, the overall insertion barriers for the second olefin (C2H4) are kept comparable to those for the firstly incorporated C2H4, which ensures the sustainability of the propagation. The calculated energies above clearly demonstrate that VOx/SiO2 has slower incorporation rate of 1-butene and 1-hexene than CrOx/SiO2. More importantly, just like in the case of C2H4 insertion, it is still the relatively stronger binding of the α-olefin that enlarges the insertion barriers. Similarly, it could be verified by the structural characters of the species formed during the insertion process as well (see Fig. S3 in the Supporting Information). Nevertheless, it is worthy to note that the differences in the insertion barriers between C2H4 and α-olefin (for both primary and secondary propagations, see Fig. 2 and Fig. S1) are bigger for CrOx/SiO2. It indicates its higher reactivity ratio for C2H4, which could partially illustrate that CrOx/SiO2 possesses less incorporation efficiency for comonomers when compared with VOx/SiO2. On the hand other, given the analogous steric hindrance around the metal centers for both catalyst models, we also try to illustrate their catalytic behaviors through the electronic properties of the catalysts. Firstly, we analyze the NBO charges of the metal centers in M-3X (M = Cr or V, X = E, B or H), which are the bare catalysts ready for the coordination with the second C2H4 (see Fig. 4 ). However, it is found these atomic charges are almost the same in all the cases. Afterward, we calculate the electrostatic potential (ESP) distribution on the surface of the catalysts to predict their electrophilic in a more global way (see Fig. 5 ). Normally, the higher ESP a region of the catalyst surface has, the more nucleus charges it owns, which indicates a higher electrophilic of this region [51]. With respect to CrOx/SiO2, we can see positive ESP could be observed distinctly at the top of the Cr center, but it is kept almost neutral at the lower region. As to VOx/SiO2, it is found the ESP is distributed in a more homogeneous way, and highly positive ESP could be clearly observed around the V center, which would facilitate its electrophilic attack to the upcoming olefins. Therefore, the binding energies of olefins by VOx/SiO2 is much lower. With regard to the transition states, we analyze the frontier molecular orbitals of the reaction system, which includes the lowest unoccupied molecular orbital (LUMO) of the catalysts and the highest occupied molecular orbital (HOMO) of the olefins. Because the reception of π electrons by the LUMO of the catalysts from the HOMO of the olefins is one of the key steps to accomplish the insertion process [52]. As shown in Fig. 4, the energy gaps between the LUMO of the catalysts and the HOMO of the olefins in VOx/SiO2 are all about 0.2 eV (4.6 kcal) lower than those in CrOx/SiO2. It implies the more readily electronic interactions between these two orbitals [53–55]. This could be further verified by the electron difference maps of the species in the transition states for the insertion of the first olefin. As shown in Fig. 6 , the electronic interactions mainly occur between the metal centers and one of the alkylene carbons of olefins (C3). The lobe patterns suggest that the π electrons of the p orbitals belong to C3 would migrate to the d orbitals of the metal centers. However, when put CrOx/SiO2 and VOx/SiO2 into comparison, it could be found the increasement of electron density between V and C3 is more obvious, and the direct contact between d orbitals of V and p orbitals of C3 could be seen clearly. In addition, when take close look into the region between M and the alkyl carbon (C1), the decrement of electron density could be observed for V-C1, but it could be hardly seen for Cr-C1. This implies the more obvious bond weakening for V-C1, and the olefins could be more easily inserted as a result. Generally, it is in agreement with the lower energies of the transition states for olefin insertion in VOx/SiO2. For the insertion of the second olefin, similar electronic interaction between the catalysts and olefins could be observed as well (see Fig. S4 in the Supporting Information). 3.2 Chain termination through chain transfer After the insertion of the first olefin, chain termination process is investigated as well (see Scheme 2 ). For CrOx/SiO2, the experimental results showed that the number average molecular weight (Mn) of its PE product would increase with the improved C2H4 partial pressure, but the actual response was between zero and first order [1,56]. With regard to VOx/SiO2, Liu et al. found both the Mn and Mw of the PE synthesized by this catalyst system could be hardly affected by the varied C2H4 concentrations [57]. As a consequence, for the former system, two primary reaction pathways are considered, one is the β-H transfer to the upcoming C2H4 (BHT), the other is the β-H transfer to the metal centers (i.e., β-H elimination, BHE). For the latter one, we mainly focus on the BHT process, while the BHE process is only investigated and briefly discussed in the Supporting Information (see Fig. S8). Besides, the chain termination goes on through hydrogenolysis is also investigated by the introduction of a H2 molecule. For the BHT process, as shown in Scheme 2 (A), the C2H4 monomer would coordinate with the metal centers in advance. Since the β-H of M-alkyl tends to has an agostic interaction with the metal centers and becomes electronically deficient, it is apt to be attacked by the electronically abundant C2H4 and form the transition state of a six-membered ring [58]. Subsequently, the ring would decompose to produce a polymer chain with a terminal vinyl and an ethylated active site. The energy profiles show that the binding energies of the C2H4 by VOx/SiO2 are also much lower than those for the CrOx/SiO2 system (see Fig. 7 ). According to the structural characters of the species in Fig. 7 (a), we can see the distance of M-C3 is about 0.3 Å closer in the case of VOx/SiO2, which verifies its tighter binding to C2H4 (see Fig. 8 ). Meanwhile, it is found the agostic interaction between Cr and β-H of the polymer chain is stronger, as the distance of Cr-H1 is obvious shorter. It indicates the possibility of CrOx/SiO2 to work on the BHE pathway [59]. As a result, its accessibility by C2H4 also decreases more or less. In the transition states, it is distinct that the energies are 6∼8 kcal mol−1 higher in CrOx/SiO2 than VOx/SiO2, and the overall transfer barriers are also 1–2 kcal mol−1 higher in the former system. With regard to CrOx/SiO2, Fong et al. [47] also calculated the BHT pathway and reported a comparable reaction barrier (23.7 kcal mol−1) to ours (24.0 kcal mol−1). While Floryan et al. [21] and Gierada et al. [60] gave an overall barrier of 21.4 kcal mol−1and 25.8 kcal mol−1, respectively, which are possibly due to the different silica models (period surface or β-cristobalite-like cluster) used by them. Furthermore, the terminal alkenyl of the growth chain on their Cr(III) sites would also affect the BHT process more or less. The structural features of the species in transition states show that the C2H4 is more highly activated by VOx/SiO2, since the monomer is stretched longer and readily to abstract the β-H lying closer to it. Whereas the MC1 bond is actually weakened to a higher degree in CrOx/SiO2. Therefore, we further make an analysis on the electronic interaction between the catalyst and olefins in transition states (see Fig. 9 ). For VOx/SiO2, it is obvious that more π electrons of the olefins would migrate to the region between M and C3, as well as that between the β-H and C4. It clearly indicates the higher tendency of the C2H4 to abstract the β-H and bond with the metal centers in VOx/SiO2, therefore, the BHT proceeds more easily. Pertaining to the BHE process for CrOx/SiO2, the energy profiles as shown in Fig. 10 demonstrate that the barriers for BHE are almost the same to those for the insertion process. Therefore, only low MW PE could be produced by this kind of active site. Fong et al. also reported similar low barriers for BHE (about 2 kcal mol−1 higher than that for insertion) over CrOx/SiO2, and the predicted MW for the synthesized PE was about 100–3000 g mol−1. They attributed it to the small error in DFT calculations [47]. In addition, the variability of chain transfer process is distinct as well [61]. Besides, it is also suggested this unconformity might originate from the overestimations on the entropy effect (particularly contributed from the translational component) for those unimolecular steps, in which the BHE process was covered as well [62,63]. As a result, we further correct the BHE process with the validated computational protocol for entropy correction proposed by Falivene et al. [62] (see Eq. 1), and the results are given in Fig. 10 for comparison. It could be seen that the corrected translational entropies would promote the barriers about 2∼2.2 kcal mol−1 for BHE. It makes the chain propagation be more competitive, and ensures the smooth going of the polymerization process, but the barrier differences between insertion and BHE are still kept low (about 2–4 kcal mol−1). Herein, it should be noted that Phillips catalyst is actually famous for its multisite characters, which are responsible for polymerizing C2H4 into chains with MW from thousands to millions. In this regard, it indicates the model built in this work is more likely to reflect the active species on Phillips catalyst for the synthesis of low MW PEs. (1) S trans analyte =R Ln 10 -15 2 N 0 4 analyte 2πMRT e 5 3 h 2 3 2 + △ S cond,exp solvent - △ S cond solvent = 11.1 + 12.5 L n ( T ) + 12.5 L n ( M ) + △ S cond,exp solvent - △ S cond solvent Where T is the temperature in K, M is the mass in g mol−1, [X] is the concentration in mol·L−1, while R, N0, h and e are the ideal gas constant (J mol−1 K−1), Avogadro’s number, Plank’s constant (J·s) and fundamental constant, respectively. The correction item represented by △ S cond,exp solvent - △ S cond solvent is obtained by subtracting the solvent condensation entropies measured experimentally ( △ S cond,exp solvent ) with that calculated by the classical Sackur-Tetrode equation ( △ S cond solvent ) [64]. Herein, we followed Falivene et al. and did the correction with toluene as solvent, which is widely used in olefin polymerization, that is, △ S cond,exp solvent = -50.3 J· K - 1 · mol - 1 . Concerning the hydrogenolysis process (see Fig. 11 ), it is found the binding of a H2 molecule is endothermic for both CrOx/SiO2 and VOx/SiO2, though it is a bit less for the latter one. It might be due to the poorer donor role of H2 when compared with C2H4 [65]. The transition state formed with VOx/SiO2 is about 16 kcal mol−1, but that with CrOx/SiO2 is more than 21 kcal mol−1, which is even comparable to the reaction barriers for BHT. It is compatible with the experimental observations that CrOx/SiO2 is insensitive to H2 in the modulation of the MW of PE products, but the opposite phenomenon is observed for VOx/SiO2. As shown in Fig. 12 , the electron density difference maps indicate that the complexed H2 would donate relatively more electrons to V center, as reflected by the distinct red lobes between them, but it is unobvious for CrOx/SiO2. In the transition states, the electron density increasement between H2 and Cr or V is similar, but its decrement between V and C is more dominant. Hence, the lower energy of the transition state for hydrogenolysis met in VOx/SiO2 is possibly due to its more highly weakened VC bond. 3.3 Chain propagation vs chain termination It is the relative energy gap between the barriers of chain propagation and termination that primarily determines the MW of the PE products. Therefore, we predict the most probable MW of PEs on the basis of the Eqs. (2) to (6): [66] For CrOx/SiO2, the reaction barriers for termination (ΔGt ‡) are based on the BHE pathway, since this process before and after the entropy correction are both more competent than the BHT. For VOx/SiO2, only the BHT process is considered. Pertaining to hydrogenolysis, since the partial pressure and solubility of H2 might also have great effect on its reaction kinetics, we think it is very complicated and prefer not to discuss herein. (2) MW 28.06 = P n ¯ = k p k tBHT (3) MW 28.06 = P n ¯ = C C2H4 k p k tBHE (4) k x = RT N A h exp ( -ΔG x ‡ RT ) (5) MW 28.06 =exp ( ΔG t BHT ‡ - ΔG p ‡ RT ) (6) MW 28.06 = C C2H4 exp ( ΔG tBHE ‡ - ΔG p ‡ RT ) Where P n ¯ is the most probable polymerization degree, k p , k t BHT and k t BHE are respectively the rate constants for chain propagation, BHT and BHE processes, R is the gas constant, T is the reaction temperature in K, ΔG p ‡ , ΔG t BHT ‡ and ΔG tBHE ‡ indicate the reaction barriers in J mol−1 for chain propagation, BHT and BHE, respectively. x = p, tBHT or tBHE in Eq. (4). C C 2 H 4 is the C2H4 concentration in mol·L−1. In this work, CC2H4 = 0.12 mol·L−1 is used, which is calculated from the experimental solubility of C2H4 in toluene (1 atm, 298 K) [67]. The results listed in Table 1 shows that the MW of the PEs produced by VOx/SiO2 is in the range of 3–6 × 104 g mol−1, while it is obviously lower for CrOx/SiO2 (MW = 5.6 × 103 g mol−1), even though after the entropy correction for BHE. It is in agreement with the experimental observation that VOx/SiO2 is more competent in producing high MW PEs in comparison to CrOx/SiO2. Besides, as to CrOx/SiO2, it is found the MW of the PEs predicted for Cr-3B and Cr-3H is obviously lower than that for Cr-3E. It is probably due to the previously inserted 1-butene and 1-hexene for Cr-3B and Cr-3H, respectively, since the β-H is more active when bonded with a tertiary carbon.50 With respect to VOx/SiO2, such a difference is small. It is likely to originate from the BHT pathway working in this catalyst system, since the tightly complexed C2H4 would impede the close contact of the β-H with the V center, and make the chain transfer process less sensitive to the chemical properties of the β-H (see Fig. 5) [68,69]. Meanwhile, the more obvious promotion effect brought by the inserted α-olefins for termination in the CrOx/SiO2 system might also partially account for its lower efficiency for comonomer incorporation in comparison to VOx/SiO2, despite of its lower insertion barriers for 1-butene and 1-hexene. This is also in accordance with the experimental observation that the MW for the PE produced by Phillips catalyst tends to be suppressed obviously by the increased concentration of α-olefins [1]. On the other hand, it is worth to note that some deviations about the quantitative description of the MW are exist, because of the inevitable computational errors in DFT calculations [47]. Furthermore, the termination process is believed to pose a greater challenge than the insertion one for olefin coordination polymerization [61,70]. Moreover, the non-equivalence between the cluster models and the real catalyst surfaces would also result in a discrepancy. Since the Phillips catalyst is distinguished for its diversity in active sites, which are different in coordination conditions and enabled to produce PE chains with various lengths. 4 Conclusions A theoretical comparison was performed for both VOx/SiO2 and CrOx/SiO2, through the pathways of chain propagation and termination, to shed light on their distinct catalytic behaviors in ethylene polymerization. That is, CrOx/SiO2 show obviously higher activity, while VOx/SiO2 has an advantage on producing high MW PE and incorporating α-olefin more efficiently. In addition, the latter one also presents higher sensitivity towards hydrogenolysis. The results show that more stable transition states for olefins (ethylene, 1-butene and 1-hexene) insertion could actually be observed for VOx/SiO2. It might be partially attributed to the smaller energy gap between the LUMO of VOx/SiO2 and the HOMO of the olefins, which might facilitate the electronic interaction between them. It is further verified by the electronic analysis of CrOx/SiO2 and VOx/SiO2, which shows that more π electrons of olefins are apt to migrate to the V centers and the V-alkyl bond would also be more strongly weakened. However, the binding energies of the olefins by VOx/SiO2 is obviously lower, because of the more positive electrostatic potential (ESP) around the V centers. It results in the insertion barriers for VOx/SiO2 about 2∼3 kcal mol−1 higher than those for CrOx/SiO2, which accounts for the higher activity of the latter one. With respect to chain termination, according to the experimental observations, two primary pathways including the BHE (β-H elimination to metal) and BHT (β-H transfer to monomer) are considered for CrOx/SiO2, while only the latter one is taken into account for VOx/SiO2. It is found that the reaction barriers for CrOx/SiO2 in BHE (15.5∼18.5 kcal mol−1) are so low that the proceeding of the polymerization is difficult. This contradiction is avoided by the correction of its translational entropies. With respect to the BHT pathway, the corresponding barriers (22–23 kcal mol−1) are relatively higher for both CrOx/SiO2 and VOx/SiO2. Regarding to hydrogenolysis, the complexation of a H2 molecule is moderately and highly endothermic for VOx/SiO2 and CrOx/SiO2, respectively, since H2 is a poorer electron donator when compared with C2H4. In addition, the overall barrier is 7 kcal mol−1 higher for CrOx/SiO2 due to its less stable transition state. The MW of the produced PE is predicted on the basis of the energy gaps between the barriers for propagation and termination. It is found that the MW of the PE produced by CrOx/SiO2 (≤5.6 × 103 g mol-1) is lower than that by VOx/SiO2 (3–6 × 104 g mol−1), which is qualitatively compatible with the experimental observation. Meanwhile, the insertion barriers between C2H4 and α-olefin are bigger for CrOx/SiO2, and the promotion effect of the incorporated α-olefins on termination is also more obvious for this catalyst system, which might account for its lower incorporation efficiency for comonomer in comparison to VOx/SiO2, despite of its lower insertion barriers. CRediT authorship contribution statement Shiyang Wang: Writing - original draft. Boping Liu: Conceptualization, Supervision, Writing - review & editing. Yulong Jin: Methodology, Writing - original draft, Supervision. Declaration of Competing Interests The authors declare that they have no known competing financial interests or personal relationships that could have appeared to influence the work reported in this paper. Acknowledgement This work is financially supported by the National Natural Science Foundation of China (NO. 21801079 and NO.51973069). The authors also thank Dr. Zhen Liu and Dr. Zhou Tian in East China University of Science and Technology for their valuable suggestions in calculations. Appendix A Supplementary data Supplementary material related to this article can be found, in the online version, at doi:https://doi.org/10.1016/j.mcat.2020.111090. Appendix A Supplementary data The following is Supplementary data to this article: References [1] M.P. McDaniel A review of the phillips supported chromium catalyst and its commercial use for ethylene polymerization Adv. Catal. 53 2010 123 606 10.1016/S0360-0564(10)53003-7 McDaniel, M. P. A Review of the Phillips Supported Chromium Catalyst and Its Commercial Use for Ethylene Polymerization. Adv. Catal. (53) 2010 123-606, https://doi.org/10.1016/S0360-0564(10)53003-7. [2] R. Cheng Z. Liu L. Zhong X. He P. Qiu M. Terano M.S. Eisen S.L. Scott B. Liu Phillips cr/silica catalyst for ethylene polymerization W. Kaminsky Polyolefins: 50 Years after Ziegler and Natta I: Polyethylene and Polypropylene 2013 Springer Berlin, Heidelberg 135 202 10.1007/12_2013_222 . Cheng, R.; Liu, Z.; Zhong, L.; He, X.; Qiu, P.; Terano, M.; Eisen, M. S.; Scott, S. L.; Liu, B., Phillips cr/silica catalyst for ethylene polymerization. In W. Kaminsky (eds.), polyolefins: 50 years after ziegler and natta i: Polyethylene and polypropylene, Springer: Berlin, Heidelberg, 2013; pp 135-202, https://doi.org/10.1007/12_2013_222. [3] H. Hagen J. Boersma G. van Koten Homogeneous vanadium-based catalysts for the Ziegler–Natta polymerization of α-olefins Chem. Soc. Rev. 31 6 2002 357 364 10.1039/B205238E Hagen, H., Boersma, J., & van Koten, G. Homogeneous vanadium-based catalysts for the Ziegler–Natta polymerization of α-olefins. Chem. Soc. Rev., 31(6), 357–364, https://doi.org/10.1039/B205238E. [4] Y. Jin R. Cheng X. He Z. Liu N. Zhao B. Liu The first vanadium-oxide-Based UHMWPE catalyst supported on chemically modified sillica gel Macromol. Chem. Phys. 218 2017 1600443 10.1002/macp.201600443 Jin, Y.; Cheng, R.; He, X.; Liu, Z.; Zhao, N.; Liu, B. The First Vanadium-Oxide-Based UHMWPE Catalyst Supported on Chemically Modified Sillica Gel, Macromol. Chem. Phys. (218) 2017 1600443, https://doi.org/10.1002/macp.201600443. [5] B. Liu N. Zhao Y. Jin R. Cheng X. He Z. Liu B. Liu Effects of alkyl aluminum on SiO2-Supproted silyl-chromate(Cr)/Imido-Vanadium(V) bimetallic catalysts for producing bimodal polyethylene Macromol. React. Eng. 2017 1700006 10.1002/mren.201700006 Liu, B.; Zhao, N.; Jin, Y.; Cheng, R.; He, X.; Liu, Z.; Liu, B. Effects of Alkyl Aluminum on SiO2-Supproted Silyl-Chromate(Cr)/Imido-Vanadium(V) Bimetallic Catalysts for Producing Bimodal Polyethylene, Macromol. React. Eng. 2017 1700006, https://doi.org/10.1002/mren.201700006. [6] N. Zhao R. Cheng X. He Z. Liu B. Liu A novel SiO2-supported Cr-V bimetallic catalyst making Polyethylene and ethylene/1-Hexene copolymers with bimodal molecular weight distribution Macromol. Chem. Phys. 2014 10.1002/macp.201400094 Zhao, N.; Cheng, R.; He, X.; Liu, Z.; Liu, B. A Novel SiO2-Supported Cr-V Bimetallic Catalyst Making Polyethylene and Ethylene/1-Hexene Copolymers with Bimodal Molecular Weight Distribution, Macromol. Chem. Phys. 2014, https://doi.org/10.1002/macp.201400094. [7] B. Liu Z. Tian Y. Jin N. Zhao B. Liu Toward the optimization of a Cr-V bimetallic catalyst for producing bimodal polyethylene: effect of vanadium content and calcination temperature Macromol. Chem. Phys. 219 2018 1800021 10.1002/macp.201800021 Liu, B.; Tian, Z.; Jin, Y.; Zhao, N.; Liu, B. Toward the Optimization of a Cr-V Bimetallic Catalyst for Producing Bimodal Polyethylene: Effect of Vanadium Content and Calcination Temperature, Macromol. Chem. Phys. (219) 2018 1800021, https://doi.org/10.1002/macp.201800021. [8] N. Zhao R. Cheng X. He Z. Liu B. Liu R. Zhang Y. Gao E. Zou S. Wang Novel SiO2-Supported silyl-chromate(Cr)/Imido-Vandium(V) bimetallic catalysts producing polyethylene and Ethylene/1-Hexene copolymers with bimodal molecular-weight distribution Macromol. Chem. Phys. 215 2014 1434 1445 10.1002/macp.201400204 Zhao, N.; Cheng, R.; He, X.; Liu, Z.; Liu, B.; Zhang, R.; Gao, Y.; Zou, E.; Wang, S. Novel SiO2-Supported Silyl-Chromate(Cr)/Imido-Vandium(V) Bimetallic Catalysts Producing Polyethylene and Ethylene/1-Hexene Copolymers with Bimodal Molecular-Weight Distribution, Macromol. Chem. Phys. (215) 2014 1434-1445, https://doi.org/10.1002/macp.201400204. [9] R. Cheng X. Xue W. Liu N. Zhao X. He Z. Liu B. Liu Novel SiO2-Supported Chromium Oxide(Cr)Vanadium Oxide(V) Bimetallic Catalysts for production of Bimodal Polyethylene Macromol. React. Eng. 9 2015 462 472 10.1002/mren.201400072 Cheng, R.; Xue, X.; Liu, W.; Zhao, N.; He, X.; Liu, Z.; Liu, B. Novel SiO2-Supported Chromium Oxide(Cr)Vanadium Oxide(V) Bimetallic Catalysts for Production of Bimodal Polyethylene, Macromol. React. Eng. (9) 2015 462-472, https://doi.org/10.1002/mren.201400072. [10] Y. Jin N. Zhao R. Cheng X. He Z. Liu D. Dong Y. Bin X. Chen L. Li B. Liu One pot syntehsis of bimodal UHMWPE/HDPE in-reactor blends with Cr/V bimetallic catalysts J. Polym. Sci. Polym. Chem. 55 2017 3404 3412 10.1002/pola.28719 Jin, Y.; Zhao, N.; Cheng, R.; He, X.; Liu, Z.; Dong, D.; Bin, Y.; Chen, X.; Li, L.; Liu, B. One Pot Syntehsis of Bimodal UHMWPE/HDPE in-Reactor Blends with Cr/V Bimetallic Catalysts, J. Polym. Sci. Polym. Chem. (55) 2017 3404–3412, https://doi.org/10.1002/pola.28719. [11] Y. Jin N. Zhao R. Cheng X. He Z. Liu B. Liu Remarkable promotion effect of sulfation over the SiO2-supported vandium-oxide-Based catalysts for UHMWPE Macromol. Chem. Phys. 218 2017 1700236 10.1002/macp.201700236 Jin, Y.; Zhao, N.; Cheng, R.; He, X.; Liu, Z.; Liu, B. Remarkable Promotion Effect of Sulfation over the SiO2-Supported Vandium-Oxide-Based Catalysts for UHMWPE, Macromol. Chem. Phys. (218) 2017 1700236, https://doi.org/10.1002/macp.201700236. [12] B.R. Goldsmith B. Peters J.K. Johnson B.C. Gates S.L. Scott Beyong ordered materials: understanding catalytic sites on amorphous solids ACS Catal. 7 2017 7543 7557 10.1021/acscatal.7b01767 Goldsmith, B. R.; Peters, B.; Johnson, J. K.; Gates, B. C.; Scott, S. L. Beyong Ordered Materials: Understanding Catalytic Sites on Amorphous Solids, ACS. Catal. (7) 2017 7543-7557, https://doi.org/10.1021/acscatal.7b01767. [13] L. Lichtenstein C. Büchner B. Yang S. Shaikhutdinov M. Heyde M. Sierka R. Włodarczyk J. Sauer H.-J. Freund The atomic structure of a metal-supported vitreous thin sillica film Angew. Chem. Int. Edit. 51 2012 404 407 10.1002/anie.201107097 Lichtenstein, L.; Büchner, C.; Yang, B.; Shaikhutdinov, S.; Heyde, M.; Sierka, M.; Włodarczyk, R.; Sauer, J.; Freund, H.-J. The Atomic Structure of a Metal-Supported Vitreous Thin Sillica Film, Angew. Chem. Int. Edit. (51) 2012 404-407, https://doi.org/10.1002/anie.201107097. [14] C.A. Demmelmaier R.E. White J.A. van Bokhoven S.L. Scott Evidence for a chromasiloxane ring size effect in phillips (Cr/SiO2) polymerization catalysts J. Catal. 262 2009 44 56 10.1016/j.jcat.2008.11.024 Demmelmaier, C. A.; White, R. E.; van Bokhoven, J. A.; Scott, S. L. Evidence for a Chromasiloxane Ring Size Effect in Phillips (Cr/SiO2) Polymerization Catalysts, J. Catal. (262) 2009 44-56, https://doi.org/10.1016/j.jcat.2008.11.024. [15] Y. Ma L. Wang Z. Liu R. Cheng L. Zhong Y. Yang X. He Y. Fang M. Terano B. Liu High-resolution XPS and DFT investigations into Al-modified phillips CrOX/SiO2 catalysts J. Mol. Catal. A-Chem. 401 2015 1 12 10.1016/j.molcata.2015.01.020 Ma, Y.; Wang, L.; Liu, Z.; Cheng, R.; Zhong, L.; Yang, Y.; He, X.; Fang, Y.; Terano, M.; Liu, B. High-resolution XPS and DFT Investigations into Al-modified Phillips CrOX/SiO2 Catalysts, J. Mol. Catal. A-Chem. (401) 2015 1-12, https://doi.org/10.1016/j.molcata.2015.01.020. [16] Y.-L. Jin L. Liu Y.-J. Wang Z. Liu B.-P. Liu Mechanistic study on the dominant promotion effect of Al-/Ti-/Zr-modifications over the VOX/SiO2 UHMWPE catalysts Chinese J. Polym. Sci. 37 2019 995 1004 10.1007/s10118-019-2295-z Jin, Y.-L.; Liu, L.; Wang, Y.-J.; Liu, Z.; Liu, B.-P. Mechanistic Study on the Dominant Promotion Effect of Al-/Ti-/Zr-modifications over the VOX/SiO2 UHMWPE Catalysts, Chinese J. Polym. Sci. (37) 2019 995-1004, https://doi.org/10.1007/s10118-019-2295-z. [17] Z. Liu R. Zhang S. Wang N. Li R. Sima G. Liu P. Wu G. Zeng S. Li Y. Sun Highly efficient and stable vanadia-titania-Sulfate catalysts for methanol oxidation to methyl formate: synthesis and mecanistic study J. Phys. Chem. C. 120 2016 6591 6600 10.1021/acs.jpcc.5b12621 Liu, Z.; Zhang, R.; Wang, S.; Li, N.; Sima, R.; Liu, G.; Wu, P.; Zeng, G.; Li, S.; Sun, Y. Highly Efficient and Stable Vanadia-Titania-Sulfate Catalysts for Methanol Oxidation to Methyl Formate: Synthesis and Mecanistic Study, J. Phys. Chem. C. (120) 2016 6591-6600, https://doi.org/10.1021/acs.jpcc.5b12621. [18] Ø. Espelid K.J. Børve Theoretical models of ethylene polymerization over a mononuclear chromium(II)/Sillica site J. Catal. 195 2000 125 139 10.1006/jcat.2000.2986 Espelid, Ø.; Børve, K. J. Theoretical Models of Ethylene Polymerization over a Mononuclear Chromium(II)/Sillica Site, J. Catal. (195) 2000 125-139, https://doi.org/10.1006/jcat.2000.2986. [19] E. Groppo G.A. Martino A. Piovano C. Barzan The active sites in the Phillips catalysts: prigins of a lively debate and a vision for the future ACS Catal. 8 2018 10846 10863 10.1021/acscatal.8b02521 Groppo, E.; Martino, G. A.; Piovano, A.; Barzan, C.The active sites in the Phillips catalysts: prigins of a lively debate and a vision for the future, ACS. Catal. (8) 2018 10846-10863, https://doi.org/10.1021/acscatal.8b02521. [20] M. Gierada P. Michorczyk F. Tielens J. Handzlik Reduction of chromia-silica catalysts: a molecular picture J. Catal. 340 2016 122 135 10.1016/j.jcat.2016.04.022 Gierada, M.; Michorczyk, P.; Tielens, F.; Handzlik, J. Reduction of Chromia-silica Catalysts: A Molecular Picture, J. Catal. (340) 2016 122-135, https://doi.org/10.1016/j.jcat.2016.04.022. [21] L. Floryan A.P. Borosy F. Núñez-Zarur A. Comas-Vives C. Copéret Strain effect and dual initiation pathway in CrIII/SiO2 polymerization catalysts from amorphous periodic models J. Catal. 346 2017 50 56 10.1016/j.jcat.2016.11.037 Floryan, L.; Borosy, A. P.; Núñez-Zarur, F.; Comas-Vives, A.; Copéret, C. Strain Effect and Dual Initiation Pathway in CrIII/SiO2 Polymerization Catalysts from Amorphous Periodic Models, J. Catal. (346) 2017 50-56, https://doi.org/10.1016/j.jcat.2016.11.037. [22] C. Brown J. Krzystek R. Achey A. Lita R. Fu R.W. Meulenberg M. Polinski N. Peek Y. Wang L.J. van de Burgt S. Profeta A.E. Stiegman S.L. Scott Mechanism of initiation in the phillips ethylene polymerization catalyst: redox processes leading to the active site ACS Catal. 5 2015 5574 5583 10.1021/acscatal.5b00927 Brown, C.; Krzystek, J.; Achey, R.; Lita, A.; Fu, R.; Meulenberg, R. W.; Polinski, M.; Peek, N.; Wang, Y.; van de Burgt, L. J.; Profeta, S.; Stiegman, A. E.; Scott, S. L. Mechanism of Initiation in the Phillips Ethylene Polymerization Catalyst: Redox Processes Leading to the Active Site, ACS. Catal. (5) 2015 5574-5583, https://doi.org/10.1021/acscatal.5b00927. [23] A. Chakrabarti M. Gierada J. Handzlik I.E. Wachs Operando molecular spectroscopy during Ethylene Polymerization by supported CrOX/SiO2Catalysts :active site, reaction intermediates, and structure-activity relationship Top. Catal. 59 2016 725 739 10.1007/s11244-016-0546-6 Chakrabarti, A.; Gierada, M.; Handzlik, J.; Wachs, I. E. Operando Molecular Spectroscopy During Ethylene Polymerization by Supported CrOX/SiO2 Catalysts :Active Site, Reaction Intermediates, and Structure-Activity Relationship, Top. Catal. (59) 2016 725-739, https://doi.org/10.1007/s11244-016-0546-6. [24] M. Gierada J. Handzlik Active aites formation and their transformations during ethylene polymerization by the phillips CrOX/SiO2 catalyst J. Catal. 352 2017 314 328 10.1016/j.jcat.2017.05.025 Gierada, M.; Handzlik, J. Active Aites Formation and Their Transformations during Ethylene Polymerization by the Phillips CrOX/SiO2 Catalyst, J. Catal. (352) 2017 314-328, https://doi.org/10.1016/j.jcat.2017.05.025. [25] E. Adisson A. Deffieux M. Fontanille Polymerization of ethylene at high temperature by vanadium-based heterogeneous ziegler-natta catalysts. I. Study of the deactivation process J. Polym. Sci. Polym. Chem. 31 1993 831 839 10.1002/pola.1993.080310329 Adisson, E.; Deffieux, A.; Fontanille, M. Polymerization of Ethylene at High Temperature by Vanadium-Based Heterogeneous Ziegler-Natta Catalysts. I. Study of the Deactivation Process, J. Polym. Sci. Polym. Chem. (31) 1993 831-839, https://doi.org/10.1002/pola.1993.080310329. [26] E. Adisson A. Deffieux M. Fontanille K. Bujadoux Polymerization of ethylene at high temperature by vanadium-based heterogeneous ziegler-natta catalysts. II. Study of the activation by halocarbons J. Polym. Sci. Polym. Chem. 32 1994 1033 1041 10.1002/pola.1994.080320604 Adisson, E.; Deffieux, A.; Fontanille, M.; Bujadoux, K. Polymerization of Ethylene at High Temperature by Vanadium-Based Heterogeneous Ziegler-Natta Catalysts. II. Study of the Activation by Halocarbons, J. Polym. Sci. Polym. Chem. (32) 1994 1033-1041, https://doi.org/10.1002/pola.1994.080320604. [27] C.A. Cruz M.M. Monwar J. Barr M.P. McDaniel Identification of the starting group on the first PE chain produced by the phillips catalyst Macromolecules 52 2019 5750 5760 10.1021/acs.macromol.9b00588 Cruz, C. A.; Monwar, M. M.; Barr, J.; McDaniel, M. P. Identification of the Starting Group on the First PE Chain Produced by the Phillips Catalyst, Macromolecules (52) 2019 5750-5760, https://doi.org/10.1021/acs.macromol.9b00588. [28] Y. Zeng P. Chammingkwan R. Baba T. Taniike M. Terano Activation and deactivation of phillips catalyst for ethylene polymerization using various activators Macromol. React. Eng. 11 2017 1600046 10.1002/mren.201600046 Zeng, Y.; Chammingkwan, P.; Baba, R.; Taniike, T.; Terano, M. Activation and Deactivation of Phillips Catalyst for Ethylene Polymerization Using Various Activators, Macromol. React. Eng. (11) 2017 1600046, https://doi.org/10.1002/mren.201600046. [29] M.J. Frisch G.W. Trucks H.B. Schlegel G.E. Scuseria M.A. Robb J.R. Cheeseman G. Scalmani V. Barone G.A. Petersson H. Nakatsuji X. Li M. Caricato A. Marenich J. Bloino B.G. Janesko R. Gomperts B. Mennucci H.P. Hratchian J.V. Ortiz A.F. Izmaylov J.L. Sonnenberg D. Williams-Young F. Ding F. Lipparini F. Egidi J. Goings B. Peng A. Petrone T. Henderson D. Ranasinghe V.G. Zakrzewski J. Gao N. Rega G. Zheng W. Liang M. Hada M. Ehara K. Toyota R. Fukuda J. Hasegawa M. Ishida T. Nakajima Y. Honda O. Kitao H. Nakai T. Vreven K. Throssell J.A. Montgomery J.E. Peralta F. Ogliaro M. Bearpark J.J. Heyd E. Brothers K.N. Kudin V.N. Staroverov T. Keith R. Kobayashi J. Normand K. Raghavachari A. Rendell J.C. Burant S.S. Iyengar J. Tomasi M. Cossi J.M. Millam M. Klene C. Adamo R. Cammi J.W. Ochterski R.L. Martin K. Morokuma O. Farkas J.B. Foresman D.J. Fox Gaussian 09., Revision E.01 2009 Gaussian, Inc. Wallingford C.T Frisch, M. J.; Trucks, G. W.; Schlegel, H. B.; Scuseria, G. E.; Robb, M. A.; Cheeseman, J. R.; Scalmani, G.; V. Barone; Petersson, G. A.; Nakatsuji, H.; Li, X.; Caricato, M.; Marenich, A.; Bloino, J.; Janesko, B. G.; Gomperts, R.; Mennucci, B.; Hratchian, H. P.; Ortiz, J. V.; Izmaylov, A. F.; Sonnenberg, J. L.; Williams-Young, D.; Ding, F.; Lipparini, F.; Egidi, F.; Goings, J.; Peng, B.; Petrone, A.; Henderson, T.; Ranasinghe, D.; Zakrzewski, V. G.; Gao, J.; Rega, N.; Zheng, G.; Liang, W.; Hada, M.; Ehara, M.; Toyota, K.; Fukuda, R.; Hasegawa, J.; Ishida, M.; Nakajima, T.; Honda, Y.; Kitao, O.; Nakai, H.; Vreven, T.; Throssell, K.; Montgomery, J. A.; Peralta, J. E.; Ogliaro, F.; Bearpark, M.; Heyd, J. J.; Brothers, E.; Kudin, K. N.; Staroverov, V. N.; Keith, T.; Kobayashi, R.; Normand, J.; Raghavachari, K.; Rendell, A.; Burant, J. C.; Iyengar, S. S.; Tomasi, J.; Cossi, M.; Millam, J. M.; Klene, M.; Adamo, C.; Cammi, R.; Ochterski, J. W.; Martin, R. L.; Morokuma, K.; Farkas, O.; Foresman, J. B.; Fox, D. J., Gaussian 09, Revision E.01; Gaussian, Inc.: Wallingford CT, 2009. [30] C. Jeng-Da H.G. Martin Long-range corrected hybrid density functionals with damped atom-atom dispersion corrections Phys. Chem. Chem. Phys. 10 2008 6615 6620 10.1039/b810189b Jeng-Da, C.; Martin, H. G. Long-range corrected hybrid density functionals with damped atom-atom dispersion corrections, Phys. Chem. Chem. Phys. (10) 2008 6615-6620, https://doi.org/10.1039/b810189b. [31] F. Weigend Accurate coulomb-fitting basis sets for H to Rn Phys. Chem. Chem. Phys. 8 2006 1057 1065 10.1039/b515623h Weigend, F. Accurate Coulomb-fitting basis sets for H to Rn, Phys. Chem. Chem. Phys. (8) 2006 1057-1065, https://doi.org/10.1039/b515623h. [32] F. Weigend R. Ahlrichs Balanced basis sets of split valence, triple zeta valence and quadruple zeta valence quality for H to Rn: design and assessment of accuracy Phys. Chem. Chem. Phys. 7 2005 3297 3305 10.1039/b508541a Weigend, F.; Ahlrichs, R. Balanced basis sets of split valence, triple zeta valence and quadruple zeta valence quality for H to Rn: Design and assessment of accuracy, Phys. Chem. Chem. Phys. (7) 2005 3297-3305, https://doi.org/10.1039/b508541a. [33] H.B. Schlegel Optimization of equilibrium geometries and transition structures J. Comp. Chem. 3 1982 214 218 10.1002/jcc.540030212 Schlegel, H. B. Optimization of Equilibrium Geometries and Transition Structures, J. Comp. Chem. (3) 1982 214-218, https://doi.org/10.1002/jcc.540030212. [34] F. Neese The ORCA program system Wires. Comput. Mol. Sci. 2 2012 73 78 10.1002/wcms.81 Neese, F. The ORCA program system, Wires. Comput. Mol. Sci. (2) 2012 73-78, https://doi.org/10.1002/wcms.81. [35] S. Grimme Supramolecular binding thermodynamics by dispersion-corrected density functional theory Chem-Eur. J. 18 2012 9955 9964 10.1002/chem.201200497 Grimme, S. Supramolecular Binding Thermodynamics by Dispersion-Corrected Density Functional Theory, Chem-Eur. J. (18) 2012 9955-9964, https://doi.org/10.1002/chem.201200497. [36] R. Crehuet J.M. Bofill The reaction path intrinsic reaction coordinate method and the Hamilton-Jacobi theory J. Chem. Phys. 122 2005 234105 10.1063/1.1927521 Crehuet, R.; Bofill, J. M. The reaction path intrinsic reaction coordinate method and the Hamilton-Jacobi theory, J. Chem. Phys. (122) 2005 234105, https://doi.org/10.1063/1.1927521. [37] S. Maeda Y. Harabuchi Y. Ono T. Taketsugu K. Morokuma Intrinsic reaction coordinate: calculation, bifurcation, and automated search Int. J. Quantum Chem. 115 2015 258 269 10.1002/qua.24757 Maeda, S.; Harabuchi, Y.; Ono, Y.; Taketsugu, T.; Morokuma, K. Intrinsic Reaction Coordinate: Calculation, Bifurcation, and Automated Search, Int. J. Quantum. Chem. (115) 2015 258-269, https://doi.org/10.1002/qua.24757. [38] E.D. Glendening C.R. Landis F. Weinhold Natural bond orbital methods Wires. Comput. Mol. Sci. 2 2012 1 42 10.1002/wcms.51 Glendening, E. D.; Landis, C. R.; Weinhold, F. Natural bond orbital methods, Wires. Comput. Mol. Sci. (2) 2012 1-42, https://doi.org/10.1002/wcms.51. [39] T. Lu F. Chen Multiwfn: a multifunctional wavefunction analyzer J. Comp. Chem. 33 2012 580 592 10.1002/jcc.22885 Lu, T.; Chen, F. Multiwfn: A Multifunctional Wavefunction Analyzer, J. Comp. Chem. (33) 2012 580-592, https://doi.org/10.1002/jcc.22885. [40] W. Humphrey A. Dalke K. Schulten VMD: visual molecular dynamics J. Mol. Graph. 14 1996 33 38 10.1016/0263-7855(96)00018-5 Humphrey, W.; Dalke, A.; Schulten, K. VMD: Visual Molecular Dynamics, J. Mol. Graph. (14) 1996 33-38, https://doi.org/10.1016/0263-7855(96)00018-5. [41] P. Cossee Ziegler-Natta catalysis I. Mechanism of polymerization of α-olefins with Ziegler-Natta catalysts J. Catal. 3 1964 80 88 10.1016/0021-9517(64)90095-8 Cossee, P. Ziegler-Natta catalysis I. Mechanism of polymerization of α-olefins with Ziegler-Natta catalysts, J. Catal. (3) 1964 80-88, https://doi.org/10.1016/0021-9517(64)90095-8. [42] M. Borrelli V. Busico R. Cipullo S. Ronca P.H.M. Budzelaar Selectivity of Metallocene-Catalyzed Olefin Plymerization: a Combined experimental and quantum mechanical study. 1. Nonchiral Bis(cyclopentadienyl) systems Macromolecules 35 2002 2835 2844 10.1021/ma011557h Borrelli, M.; Busico, V.; Cipullo, R.; Ronca, S.; Budzelaar, P. H. M. Selectivity of Metallocene-Catalyzed Olefin Plymerization: A Combined Experimental and Quantum Mechanical Study. 1. Nonchiral Bis(cyclopentadienyl) Systems, Macromolecules (35) 2002 2835-2844, https://doi.org/10.1021/ma011557h. [43] S. Tomasi A. Razavi T. Ziegler Stereoregularity, Regioselectivity, and Dormancy in Polymerizations Catalyzed by C1-Symmetric Fluorenyl-Based Metallocenes. A theoretical study based on density functional theory Organometallics 28 2009 2609 2618 10.1021/om900044s Tomasi, S.; Razavi, A.; Ziegler, T. Stereoregularity, Regioselectivity, and Dormancy in Polymerizations Catalyzed by C1-Symmetric Fluorenyl-Based Metallocenes. A Theoretical Study Based on Density Functional Theory, Organometallics (28) 2009 2609-2618, https://doi.org/10.1021/om900044s. [44] A. Laine M. Linnolahti T.A. Pakkanen J.R. Severn E. Kokko A. Pakkanen Comparative theoretical study on homopolymerization of α-Olefins by bis(cyclopentadienyl) zirconocene and hafnocene: elemental propagation and termination reactions between monomers and metals Organometallics 29 2010 1541 1550 10.1021/om900843h Laine, A.; Linnolahti, M.; Pakkanen, T. A.; Severn, J. R.; Kokko, E.; Pakkanen, A. Comparative Theoretical Study on Homopolymerization of α-Olefins by Bis(cyclopentadienyl) Zirconocene and Hafnocene: Elemental Propagation and Termination Reactions between Monomers and Metals, Organometallics (29) 2010 1541-1550, https://doi.org/10.1021/om900843h. [45] A. Correa G. Talarico L. Cavallo Regiochemistry of propene insertion with group 4 polymerization catalysts from a theoretical perspective J. Organomet. Chem. 692 2007 4519 4527 10.1016/j.jorganchem.2007.04.015 Correa, A.; Talarico, G.; Cavallo, L. Regiochemistry of propene insertion with group 4 polymerization catalysts from a theoretical perspective, J. Organomet. Chem. (692) 2007 4519-4527, https://doi.org/10.1016/j.jorganchem.2007.04.015. [46] Q. Sun R. Cheng Z. Liu X. He N. Zhao B. Liu Effect of Fluoride-Modification on the Phillips Cr/SiO2Catalyst for Ethylene Polymerization ChemCatChem 9 2016 3364 3373 10.1002/cctc.201700375 Sun, Q.; Cheng, R.; Liu, Z.; He, X.; Zhao, N.; Liu, B. Effect of Fluoride-Modification on the Phillips Cr/SiO2 Catalyst for Ethylene Polymerization, ChemCatChem (9) 2016 3364-3373, https://doi.org/10.1002/cctc.201700375. [47] A. Fong Y. Ye S.L. Ivry S.L. Scott B. Peters Computational kinetic discrimination of ethylene polymerization mechanisms for the phillips (Cr/SiO2) catalyst ACS Catal. 5 2015 9882 9891 10.1021/acscatal.5b00016 Fong, A.; Ye, Y.; Ivry, S. L.; Scott, S. L.; Peters, B. Computational Kinetic Discrimination of Ethylene Polymerization Mechanisms for the Phillips (Cr/SiO2) Catalyst, ACS. Catal. (5) 2015 9882-91, https://doi.org/10.1021/acscatal.5b00016. [48] J. Handzlik R. Grybos F. Tielens Structure of Monomeric Chromium(VI) oxide species supported on Silica: periodic and cluster DFT Studies J. Phys. Chem. C. 117 2013 8138 8149 10.1021/jp3103035 Handzlik, J.; Grybos, R.; Tielens, F. Structure of Monomeric Chromium(VI) Oxide Species Supported on Silica: Periodic and Cluster DFT Studies, J. Phys. Chem. C. (117) 2013 8138-8149, https://doi.org/10.1021/jp3103035. [49] G.B. Galland P. Quijada R.S. Mauler S.C. de Menezes Determination of reactivity ratios for ethylene/α-olefin copolymerization catalysed by the C2H4[Ind]2ZrCl2/methylaluminoxane system Macromol. Rapid. Comm. 17 1996 607 613 10.1002/marc.1996.030170901 Galland, G. B.; Quijada, P.; Mauler, R. S.; de Menezes, S. C. Determination of reactivity ratios for ethylene/α-olefin copolymerization catalysed by the C2H4[Ind]2ZrCl2/methylaluminoxane system, Macromol. Rapid. Comm. (17) 1996 607-613, https://doi.org/10.1002/marc.1996.030170901. [50] A. Laine M. Linnolahti T.A. Pakkanen J.R. Severn E. Kokko A. Pakkanen Elemental reactions in copolymerization of α-Olefins by bis(cyclopentiadienyl) zirconocene and hafnocene: effects of the metal as a function of the monomer and the chain end Organometallics 30 2011 1350 1358 10.1021/om100761p Laine, A.; Linnolahti, M.; Pakkanen, T. A.; Severn, J. R.; Kokko, E.; Pakkanen, A. Elemental Reactions in Copolymerization of α-Olefins by Bis(cyclopentiadienyl) Zirconocene and Hafnocene: Effects of the Metal as a Function of the Monomer and the Chain End, Organometallics (30) 2011 1350-1358, https://doi.org/10.1021/om100761p. [51] J.S. Murray P. Politzer Molecular electrostatic potentials and noncovalent interactions Wires. Comput. Mol. Sci. 7 2017 e1326 10.1002/wcms.1326 Murray, J. S.; Politzer, P. Molecular electrostatic potentials and noncovalent interactions, Wires. Comput. Mol. Sci. (7) 2017 e1326, https://doi.org/10.1002/wcms.1326. [52] V. Cruz J. Ramos A. Muñoz-Escalona P. Lafuente B. Peña J. Martinez-Salazar 3D-QSAR analysis of metallocene-based catalysts used in ethylene polymerisation Polymer 45 2004 2061 2072 10.1016/j.polymer.2003.12.059 Cruz, V.; Ramos, J.; Muñoz-Escalona, A.; Lafuente, P.; Peña, B.; Martinez-Salazar, J. 3D-QSAR analysis of metallocene-based catalysts used in ethylene polymerisation, Polymer (45) 2004 2061-2072, https://doi.org/10.1016/j.polymer.2003.12.059. [53] W. Yang J. Yi W.-H. Sun Revisiting benzylidenequinolinylnickel catalysts through the electronic effectronic effects on catalytic activity by DFT studies Macromol. Chem. Phys. 216 2015 1125 1133 10.1002/macp.201500028 Yang, W.; Yi, J.; Sun, W.-H. Revisiting Benzylidenequinolinylnickel Catalysts through the Electronic Effectronic Effects on Catalytic Activity by DFT Studies, Macromol. Chem. Phys. (216) 2015 1125-1133, https://doi.org/10.1002/macp.201500028. [54] S. Ahmed W. Yang Z. Ma W.-H. Sun Catalytic activities of bis(pentamethylene)pyridyl(Fe/Co) complex analogues in ethylene polymerization by modeling method J. Phys. Chem. A 122 2018 9637 9644 10.1021/acs.jpca.8b09121 Ahmed, S.; Yang, W.; Ma, Z.; Sun, W.-H. Catalytic Activities of Bis(pentamethylene)pyridyl(Fe/Co) Complex Analogues in Ethylene Polymerization by Modeling Method, J. Phys. Chem. A. (122) 2018 9637-9644, https://doi.org/10.1021/acs.jpca.8b09121. [55] P. Huo W. Liu X. He H. Wang Y. Chen Nickel(II) Complexes with three-Dimensional Geometry α-Diimine Ligands: synthesis and catalyti activity toward copolymerization of norbornene Organometallics 32 2013 2291 2299 10.1021/om300883h Huo, P.; Liu, W.; He, X.; Wang, H.; Chen, Y. Nickel(II) Complexes with Three-Dimensional Geometry α-Diimine Ligands: Synthesis and Catalyti Activity toward Copolymerization of Norbornene, Organometallics (32) 2013 2291-2299, https://doi.org/10.1021/om300883h. [56] D.D. Eley C.H. Rochester M.S. Scurrell The polymerization of ethylene on chromium oxide catalysts I. kinetic studies Proc. R. Soc. Lond. A. 329 1972 361 373 10.1098/rspa.1972.0117 Eley, D. D.; Rochester, C. H.; Scurrell, M. S. The polymerization of ethylene on chromium oxide catalysts I. Kinetic studies, Proc. R. Soc. Lond. A. (329) 1972 361-373, https://doi.org/10.1098/rspa.1972.0117. [57] B. Liu Z. Tian N. Zhao Z. Liu B. Liu Peculiarities of ethylene polymerization kinetics with an Imido-Vandium/Silyl-Chromate bimetallic catalyst: effect of polymerization conditions Ind. Eng. Chem. Res. 56 2017 6164 6175 10.1021/acs.iecr.7b00883 Liu, B.; Tian, Z.; Zhao, N.; Liu, Z.; Liu, B. Peculiarities of Ethylene Polymerization Kinetics with an Imido-Vandium/Silyl-Chromate Bimetallic Catalyst: Effect of Polymerization Conditions, Ind. Eng. Chem. Res. (56) 2017 6164-6175, https://doi.org/10.1021/acs.iecr.7b00883. [58] V.C. Gibson K.P. Tellmann M.J. Humphries D.F. Wass Bis(imino)pyridine cobalt alkyl complexes and their reactivity towards ethylene: a model system for β-hydrogen chain transfer Chem. Commun. 2002 2316 2317 10.1039/b207794a Gibson, V. C.; Tellmann, K. P.; Humphries, M. J.; Wass, D. F. Bis(imino)pyridine cobalt alkyl complexes and their reactivity towards ethylene: a model system for β-hydrogen chain transfer, Chem. Commun. 2002 2316-2317, https://doi.org/10.1039/b207794a. [59] D.-J. Byun S.Y. Kim Selective chain transfer reactions in metallocene catalyzed copolymerization of ethylene with allylbenzene Macromolecules 33 2000 1921 1923 10.1021/ma9913459 Byun, D.-J.; Kim, S. Y. Selective Chain Transfer Reactions in Metallocene Catalyzed Copolymerization of Ethylene with Allylbenzene, Macromolecules (33) 2000 1921-1923, https://doi.org/10.1021/ma9913459. [60] M. Gierada J. Handzlik Active sites formation and their transformations during ethylene polymerization by the Phillips CrOX/SiO2 catalyst J. Catal. 352 2017 314 328 10.1016/j.jcat.2017.05.025 Gierada, M.; Handzlik, J. Active sites formation and their transformations during ethylene polymerization by the Phillips CrOX/SiO2 catalyst, J. Catal. (352) 2017, 314-328, https://doi.org/10.1016/j.jcat.2017.05.025. [61] G. Talarico P.H.M. Budzelaar Variability of chain transfer to monomer step in olefin polymerization Organometallics 27 2008 4098 4107 10.1021/om800313n Talarico, G.; Budzelaar, P. H. M. Variability of Chain Transfer to Monomer Step in Olefin Polymerization, Organometallics (27) 2008 4098-4107, https://doi.org/10.1021/om800313n. [62] L. Falivene V. Barone G. Talarico Unraveling the role of entropy in tuning unimolecular vs Bimolecular reaction rates: the case of olefin polymerization catalyzed by transition metals Mol. Catal. 452 2018 138 144 10.1016/j.mcat.2018.04.012 Falivene, L.; Barone, V.; Talarico, G. Unraveling the role of entropy in tuning unimolecular vs. bimolecular reaction rates: The case of olefin polymerization catalyzed by transition metals, Mol. Catal. (452) 2018 138-144, https://doi.org/10.1016/j.mcat.2018.04.012. [63] M. Besora P. Vidossich A. Lledós G. Ujaque F. Maseras Calculation of reaction free energies in solution : a comparison of current approaches J. Phys. Chem. A 122 2018 1392 1399 10.1021/acs.jpca.7b11580 Besora, M.; Vidossich, P.; Lledós, A.; Ujaque, G.; Maseras, F. Calculation of Reaction Free Energies in Solution : A Comparison of Current Approaches, J. Phys. Chem. A. (122) 2018 1392-1399, https://doi.org/10.1021/acs.jpca.7b11580. [64] M. Mammen E.I. Shakhnovich J.M. Deutch G.M. Whitesides Estimating the entropic cost of self-assembly of multiparticle hydrogen-bonded aggregates based on the cyanuric acid·Melamine lattice J. Org. Chem. 63 1998 3821 3830 10.1021/jo970944f Mammen, M.; Shakhnovich, E. I.; Deutch, J. M.; Whitesides, G. M. Estimating the Entropic Cost of Self-Assembly of Multiparticle Hydrogen-Bonded Aggregates Based on the Cyanuric Acid·Melamine Lattice, J. Org. Chem. (63) 1998 3821-3830, https://doi.org/10.1021/jo970944f. [65] N. Bahri-Laleh M. Nekoomanesh-Haghighi S.A. Mirmohammadi A DFT study on the effect of hydrogen in ethylene and propylene polymerization using a Ti-based heterogeneous Ziegler-Natta catalyst J. Organomet. Chem. 719 2012 74 79 10.1016/j.jorganchem.2012.08.017 Bahri-Laleh, N.; Nekoomanesh-Haghighi, M.; Mirmohammadi, S. A. A DFT study on the effect of hydrogen in ethylene and propylene polymerization using a Ti-based heterogeneous Ziegler-Natta catalyst, J. Organomet. Chem. (719) 2012 74-79, https://doi.org/10.1016/j.jorganchem.2012.08.017. [66] K. Tonosaki T. Taniike M. Terano Origin of broad molecular weight distribution of polethylene produced by Phillips-type silica-supported chromium catalyst J. Mol. Catal. A-Chem. 340 2011 33 38 10.1016/j.molcata.2011.03.005 Tonosaki, K.; Taniike, T.; Terano, M. Origin of broad molecular weight distribution of polethylene produced by Phillips-type silica-supported chromium catalyst, J. Mol. Catal. A-Chem. (340) 2011 33-38, https://doi.org/10.1016/j.molcata.2011.03.005. [67] M. Atiqullah H. Hammawa H. Hamid Modeling the solubility of ethylene and propylene in a typical polymerization diluent: some selected situations Eur. Polym. J. 34 1998 1511 1520 10.1016/S0014-3057(98)00005-6 Atiqullah, M.; Hammawa, H.; Hamid, H. Modeling the Solubility of Ethylene and Propylene in a Typical Polymerization Diluent: Some Selected Situations, Eur. Polym. J. (34) 1998 1511-1520, https://doi.org/10.1016/S0014-3057(98)00005-6. [68] P. Margl L. Deng T. Ziegler A unified view of Ethylene polymerization by d° and d°fn Transition Metals. 3. Termination of the growing polymer chain J.Am.Chem.Soc. 121 1999 154 162 10.1021/ja981995c Margl, P.; Deng, L.; Ziegler, T. A Unified View of Ethylene Polymerization by d° and d°fn Transition Metals. 3. Termination of the Growing Polymer Chain, J.Am.Chem.Soc. (121) 1999 154-162, https://doi.org/10.1021/ja981995c. [69] S. Zai F. Liu H. Gao C. Li G. Zhou S. Cheng L. Guo L. Zhang F. Zhu Q. Wu Longstanding living polymerization of ethylene: substituent effect on bridging carbon of 2-pyridinemethanamine nickel catalysts Chem. Commun. 46 2010 4321 4323 10.1039/c000176g Zai, S.; Liu, F.; Gao, H.; Li, C.; Zhou, G.; Cheng, S.; Guo, L.; Zhang, L.; Zhu, F.; Wu, Q. Longstanding living polymerization of ethylene: substituent effect on bridging carbon of 2-pyridinemethanamine nickel catalysts, Chem. Commun. (46) 2010 4321-4323, https://doi.org/10.1039/c000176g. [70] D.-H. Kwon B.L. Small O.L. Sydora S.M. Bischof D.H. Ess Challenge of using practical DFT to model Fe pendant donor diimine catalyzed ethylene oligomerization J. Phys. Chem. C. 123 2019 3727 3739 10.1021/acs.jpcc.9b00129 Kwon, D.-H.; Small, B. L.; Sydora, O. L.; Bischof, S. M.; Ess, D. H. Challenge of Using Practical DFT to Model Fe Pendant Donor Diimine Catalyzed ethylene Oligomerization, J. Phys. Chem. C. (123) 2019 3727-3739, https://doi.org/10.1021/acs.jpcc.9b00129.",
      "scopus-id": "85087286063",
      "coredata": {
        "eid": "1-s2.0-S2468823120303539",
        "dc:description": "Phillips catalyst (CrOx/SiO2) is one of the most famous industrial catalysts for ethylene polymerization, while VOx/SiO2 catalyst is a promising catalyst capable of making UHMWPE, which was recently developed in our group. These two catalysts were known to show completely deferent behaviors in ethylene polymerization in terms of activity, H2 response and copolymerization ability. However, a molecular insight into the mechanism is not well understood. Herein, a theoretical comparison between them via the propagation through insertion and termination through chain transfer reaction pathways is performed. The results show the transition states for olefins (ethylene, 1-butene and 1-hexene) insertion are energetically more stable in VOx/SiO2. However, the binding energies of the olefins by VOx/SiO2 is obviously lower, which results in the insertion barriers for VOx/SiO2 about 2–3 kcal mol−1 higher than those for CrOx/SiO2. As to the termination, CrOx/SiO2 is more probably to terminate via the BHE (β-H elimination to Cr center) pathway, which generally has lower barriers than those for BHT (β-H elimination to monomer) in the VOx/SiO2 system. Meanwhile, VOx/SiO2 is superior to CrOx/SiO2 in hydrogenolysis, because it is more accessible by the H2, and the reaction barrier is also much lower. The energy gap between the barriers for propagation and termination is generally smaller for CrOx/SiO2, implying its tendency to produce lower MW PE when compared with VOx/SiO2. Furthermore, for CrOx/SiO2, the insertion barriers between C2H4 and α-olefin are bigger and the promotion effect of the incorporated α-olefins on termination is more obvious, which might account for the lower incorporation efficiency for comonomer by CrOx/SiO2, despite of its lower insertion barriers.",
        "openArchiveArticle": "false",
        "prism:coverDate": "2020-09-30",
        "openaccessUserLicense": null,
        "prism:aggregationType": "Journal",
        "prism:url": "https://api.elsevier.com/content/article/pii/S2468823120303539",
        "dc:creator": [
          {
            "@_fa": "true",
            "$": "Wang, Shiyang"
          },
          {
            "@_fa": "true",
            "$": "Liu, Boping"
          },
          {
            "@_fa": "true",
            "$": "Jin, Yulong"
          }
        ],
        "link": [
          {
            "@_fa": "true",
            "@rel": "self",
            "@href": "https://api.elsevier.com/content/article/pii/S2468823120303539"
          },
          {
            "@_fa": "true",
            "@rel": "scidir",
            "@href": "https://www.sciencedirect.com/science/article/pii/S2468823120303539"
          }
        ],
        "dc:format": "application/json",
        "openaccessType": null,
        "pii": "S2468-8231(20)30353-9",
        "prism:volume": "493",
        "articleNumber": "111090",
        "prism:publisher": "Elsevier B.V.",
        "dc:title": "Why could the CrOx/SiO2 and VOx/SiO2 catalysts show so different behaviors in ethylene polymerization? A theoretical approach",
        "prism:copyright": "© 2020 Elsevier B.V. All rights reserved.",
        "openaccess": "0",
        "prism:issn": "24688231",
        "dcterms:subject": [
          {
            "@_fa": "true",
            "$": "Phillips catalyst"
          },
          {
            "@_fa": "true",
            "$": "Vanadium-oxide-based catalyst"
          },
          {
            "@_fa": "true",
            "$": "Ethylene polymerization"
          },
          {
            "@_fa": "true",
            "$": "Density functional theory"
          }
        ],
        "openaccessArticle": "false",
        "prism:publicationName": "Molecular Catalysis",
        "openaccessSponsorType": null,
        "prism:pageRange": "111090",
        "pubType": "fla",
        "prism:coverDisplayDate": "September 2020",
        "prism:doi": "10.1016/j.mcat.2020.111090",
        "prism:startingPage": "111090",
        "dc:identifier": "doi:10.1016/j.mcat.2020.111090",
        "openaccessSponsorName": null
      },
      "objects": {
        "object": [
          {
            "@category": "standard",
            "@height": "200",
            "@width": "487",
            "@_fa": "true",
            "$": "https://api.elsevier.com/content/object/eid/1-s2.0-S2468823120303539-ga1.jpg?httpAccept=%2A%2F%2A",
            "@multimediatype": "JPEG image file",
            "@type": "IMAGE-DOWNSAMPLED",
            "@size": "19492",
            "@ref": "ga1",
            "@mimetype": "image/jpeg"
          },
          {
            "@category": "standard",
            "@height": "272",
            "@width": "340",
            "@_fa": "true",
            "$": "https://api.elsevier.com/content/object/eid/1-s2.0-S2468823120303539-gr1.jpg?httpAccept=%2A%2F%2A",
            "@multimediatype": "JPEG image file",
            "@type": "IMAGE-DOWNSAMPLED",
            "@size": "17635",
            "@ref": "gr1",
            "@mimetype": "image/jpeg"
          },
          {
            "@category": "standard",
            "@height": "188",
            "@width": "679",
            "@_fa": "true",
            "$": "https://api.elsevier.com/content/object/eid/1-s2.0-S2468823120303539-gr10.jpg?httpAccept=%2A%2F%2A",
            "@multimediatype": "JPEG image file",
            "@type": "IMAGE-DOWNSAMPLED",
            "@size": "29212",
            "@ref": "gr10",
            "@mimetype": "image/jpeg"
          },
          {
            "@category": "standard",
            "@height": "243",
            "@width": "340",
            "@_fa": "true",
            "$": "https://api.elsevier.com/content/object/eid/1-s2.0-S2468823120303539-gr11.jpg?httpAccept=%2A%2F%2A",
            "@multimediatype": "JPEG image file",
            "@type": "IMAGE-DOWNSAMPLED",
            "@size": "18464",
            "@ref": "gr11",
            "@mimetype": "image/jpeg"
          },
          {
            "@category": "standard",
            "@height": "713",
            "@width": "491",
            "@_fa": "true",
            "$": "https://api.elsevier.com/content/object/eid/1-s2.0-S2468823120303539-gr12.jpg?httpAccept=%2A%2F%2A",
            "@multimediatype": "JPEG image file",
            "@type": "IMAGE-DOWNSAMPLED",
            "@size": "65154",
            "@ref": "gr12",
            "@mimetype": "image/jpeg"
          },
          {
            "@category": "standard",
            "@height": "602",
            "@width": "509",
            "@_fa": "true",
            "$": "https://api.elsevier.com/content/object/eid/1-s2.0-S2468823120303539-gr2.jpg?httpAccept=%2A%2F%2A",
            "@multimediatype": "JPEG image file",
            "@type": "IMAGE-DOWNSAMPLED",
            "@size": "56932",
            "@ref": "gr2",
            "@mimetype": "image/jpeg"
          },
          {
            "@category": "standard",
            "@height": "490",
            "@width": "378",
            "@_fa": "true",
            "$": "https://api.elsevier.com/content/object/eid/1-s2.0-S2468823120303539-gr3.jpg?httpAccept=%2A%2F%2A",
            "@multimediatype": "JPEG image file",
            "@type": "IMAGE-DOWNSAMPLED",
            "@size": "35140",
            "@ref": "gr3",
            "@mimetype": "image/jpeg"
          },
          {
            "@category": "standard",
            "@height": "239",
            "@width": "340",
            "@_fa": "true",
            "$": "https://api.elsevier.com/content/object/eid/1-s2.0-S2468823120303539-gr4.jpg?httpAccept=%2A%2F%2A",
            "@multimediatype": "JPEG image file",
            "@type": "IMAGE-DOWNSAMPLED",
            "@size": "21991",
            "@ref": "gr4",
            "@mimetype": "image/jpeg"
          },
          {
            "@category": "standard",
            "@height": "353",
            "@width": "566",
            "@_fa": "true",
            "$": "https://api.elsevier.com/content/object/eid/1-s2.0-S2468823120303539-gr5.jpg?httpAccept=%2A%2F%2A",
            "@multimediatype": "JPEG image file",
            "@type": "IMAGE-DOWNSAMPLED",
            "@size": "32961",
            "@ref": "gr5",
            "@mimetype": "image/jpeg"
          },
          {
            "@category": "standard",
            "@height": "584",
            "@width": "602",
            "@_fa": "true",
            "$": "https://api.elsevier.com/content/object/eid/1-s2.0-S2468823120303539-gr6.jpg?httpAccept=%2A%2F%2A",
            "@multimediatype": "JPEG image file",
            "@type": "IMAGE-DOWNSAMPLED",
            "@size": "80031",
            "@ref": "gr6",
            "@mimetype": "image/jpeg"
          },
          {
            "@category": "standard",
            "@height": "191",
            "@width": "679",
            "@_fa": "true",
            "$": "https://api.elsevier.com/content/object/eid/1-s2.0-S2468823120303539-gr7.jpg?httpAccept=%2A%2F%2A",
            "@multimediatype": "JPEG image file",
            "@type": "IMAGE-DOWNSAMPLED",
            "@size": "37916",
            "@ref": "gr7",
            "@mimetype": "image/jpeg"
          },
          {
            "@category": "standard",
            "@height": "392",
            "@width": "378",
            "@_fa": "true",
            "$": "https://api.elsevier.com/content/object/eid/1-s2.0-S2468823120303539-gr8.jpg?httpAccept=%2A%2F%2A",
            "@multimediatype": "JPEG image file",
            "@type": "IMAGE-DOWNSAMPLED",
            "@size": "35773",
            "@ref": "gr8",
            "@mimetype": "image/jpeg"
          },
          {
            "@category": "standard",
            "@height": "549",
            "@width": "566",
            "@_fa": "true",
            "$": "https://api.elsevier.com/content/object/eid/1-s2.0-S2468823120303539-gr9.jpg?httpAccept=%2A%2F%2A",
            "@multimediatype": "JPEG image file",
            "@type": "IMAGE-DOWNSAMPLED",
            "@size": "73423",
            "@ref": "gr9",
            "@mimetype": "image/jpeg"
          },
          {
            "@category": "standard",
            "@height": "379",
            "@width": "679",
            "@_fa": "true",
            "$": "https://api.elsevier.com/content/object/eid/1-s2.0-S2468823120303539-sc1.jpg?httpAccept=%2A%2F%2A",
            "@multimediatype": "JPEG image file",
            "@type": "IMAGE-DOWNSAMPLED",
            "@size": "34028",
            "@ref": "sc1",
            "@mimetype": "image/jpeg"
          },
          {
            "@category": "standard",
            "@height": "299",
            "@width": "717",
            "@_fa": "true",
            "$": "https://api.elsevier.com/content/object/eid/1-s2.0-S2468823120303539-sc2.jpg?httpAccept=%2A%2F%2A",
            "@multimediatype": "JPEG image file",
            "@type": "IMAGE-DOWNSAMPLED",
            "@size": "32361",
            "@ref": "sc2",
            "@mimetype": "image/jpeg"
          },
          {
            "@category": "thumbnail",
            "@height": "90",
            "@width": "219",
            "@_fa": "true",
            "$": "https://api.elsevier.com/content/object/eid/1-s2.0-S2468823120303539-ga1.sml?httpAccept=%2A%2F%2A",
            "@multimediatype": "GIF image file",
            "@type": "IMAGE-THUMBNAIL",
            "@size": "5760",
            "@ref": "ga1",
            "@mimetype": "image/gif"
          },
          {
            "@category": "thumbnail",
            "@height": "164",
            "@width": "205",
            "@_fa": "true",
            "$": "https://api.elsevier.com/content/object/eid/1-s2.0-S2468823120303539-gr1.sml?httpAccept=%2A%2F%2A",
            "@multimediatype": "GIF image file",
            "@type": "IMAGE-THUMBNAIL",
            "@size": "10275",
            "@ref": "gr1",
            "@mimetype": "image/gif"
          },
          {
            "@category": "thumbnail",
            "@height": "61",
            "@width": "219",
            "@_fa": "true",
            "$": "https://api.elsevier.com/content/object/eid/1-s2.0-S2468823120303539-gr10.sml?httpAccept=%2A%2F%2A",
            "@multimediatype": "GIF image file",
            "@type": "IMAGE-THUMBNAIL",
            "@size": "4352",
            "@ref": "gr10",
            "@mimetype": "image/gif"
          },
          {
            "@category": "thumbnail",
            "@height": "157",
            "@width": "219",
            "@_fa": "true",
            "$": "https://api.elsevier.com/content/object/eid/1-s2.0-S2468823120303539-gr11.sml?httpAccept=%2A%2F%2A",
            "@multimediatype": "GIF image file",
            "@type": "IMAGE-THUMBNAIL",
            "@size": "7131",
            "@ref": "gr11",
            "@mimetype": "image/gif"
          },
          {
            "@category": "thumbnail",
            "@height": "164",
            "@width": "113",
            "@_fa": "true",
            "$": "https://api.elsevier.com/content/object/eid/1-s2.0-S2468823120303539-gr12.sml?httpAccept=%2A%2F%2A",
            "@multimediatype": "GIF image file",
            "@type": "IMAGE-THUMBNAIL",
            "@size": "7438",
            "@ref": "gr12",
            "@mimetype": "image/gif"
          },
          {
            "@category": "thumbnail",
            "@height": "163",
            "@width": "138",
            "@_fa": "true",
            "$": "https://api.elsevier.com/content/object/eid/1-s2.0-S2468823120303539-gr2.sml?httpAccept=%2A%2F%2A",
            "@multimediatype": "GIF image file",
            "@type": "IMAGE-THUMBNAIL",
            "@size": "5882",
            "@ref": "gr2",
            "@mimetype": "image/gif"
          },
          {
            "@category": "thumbnail",
            "@height": "163",
            "@width": "126",
            "@_fa": "true",
            "$": "https://api.elsevier.com/content/object/eid/1-s2.0-S2468823120303539-gr3.sml?httpAccept=%2A%2F%2A",
            "@multimediatype": "GIF image file",
            "@type": "IMAGE-THUMBNAIL",
            "@size": "5311",
            "@ref": "gr3",
            "@mimetype": "image/gif"
          },
          {
            "@category": "thumbnail",
            "@height": "154",
            "@width": "219",
            "@_fa": "true",
            "$": "https://api.elsevier.com/content/object/eid/1-s2.0-S2468823120303539-gr4.sml?httpAccept=%2A%2F%2A",
            "@multimediatype": "GIF image file",
            "@type": "IMAGE-THUMBNAIL",
            "@size": "8346",
            "@ref": "gr4",
            "@mimetype": "image/gif"
          },
          {
            "@category": "thumbnail",
            "@height": "136",
            "@width": "219",
            "@_fa": "true",
            "$": "https://api.elsevier.com/content/object/eid/1-s2.0-S2468823120303539-gr5.sml?httpAccept=%2A%2F%2A",
            "@multimediatype": "GIF image file",
            "@type": "IMAGE-THUMBNAIL",
            "@size": "12228",
            "@ref": "gr5",
            "@mimetype": "image/gif"
          },
          {
            "@category": "thumbnail",
            "@height": "164",
            "@width": "169",
            "@_fa": "true",
            "$": "https://api.elsevier.com/content/object/eid/1-s2.0-S2468823120303539-gr6.sml?httpAccept=%2A%2F%2A",
            "@multimediatype": "GIF image file",
            "@type": "IMAGE-THUMBNAIL",
            "@size": "9485",
            "@ref": "gr6",
            "@mimetype": "image/gif"
          },
          {
            "@category": "thumbnail",
            "@height": "62",
            "@width": "219",
            "@_fa": "true",
            "$": "https://api.elsevier.com/content/object/eid/1-s2.0-S2468823120303539-gr7.sml?httpAccept=%2A%2F%2A",
            "@multimediatype": "GIF image file",
            "@type": "IMAGE-THUMBNAIL",
            "@size": "4817",
            "@ref": "gr7",
            "@mimetype": "image/gif"
          },
          {
            "@category": "thumbnail",
            "@height": "164",
            "@width": "158",
            "@_fa": "true",
            "$": "https://api.elsevier.com/content/object/eid/1-s2.0-S2468823120303539-gr8.sml?httpAccept=%2A%2F%2A",
            "@multimediatype": "GIF image file",
            "@type": "IMAGE-THUMBNAIL",
            "@size": "7700",
            "@ref": "gr8",
            "@mimetype": "image/gif"
          },
          {
            "@category": "thumbnail",
            "@height": "164",
            "@width": "169",
            "@_fa": "true",
            "$": "https://api.elsevier.com/content/object/eid/1-s2.0-S2468823120303539-gr9.sml?httpAccept=%2A%2F%2A",
            "@multimediatype": "GIF image file",
            "@type": "IMAGE-THUMBNAIL",
            "@size": "10535",
            "@ref": "gr9",
            "@mimetype": "image/gif"
          },
          {
            "@category": "thumbnail",
            "@height": "122",
            "@width": "219",
            "@_fa": "true",
            "$": "https://api.elsevier.com/content/object/eid/1-s2.0-S2468823120303539-sc1.sml?httpAccept=%2A%2F%2A",
            "@multimediatype": "GIF image file",
            "@type": "IMAGE-THUMBNAIL",
            "@size": "4545",
            "@ref": "sc1",
            "@mimetype": "image/gif"
          },
          {
            "@category": "thumbnail",
            "@height": "91",
            "@width": "219",
            "@_fa": "true",
            "$": "https://api.elsevier.com/content/object/eid/1-s2.0-S2468823120303539-sc2.sml?httpAccept=%2A%2F%2A",
            "@multimediatype": "GIF image file",
            "@type": "IMAGE-THUMBNAIL",
            "@size": "3693",
            "@ref": "sc2",
            "@mimetype": "image/gif"
          },
          {
            "@category": "standard",
            "@_fa": "true",
            "$": "https://api.elsevier.com/content/object/eid/1-s2.0-S2468823120303539-mmc1.pdf?httpAccept=%2A%2F%2A",
            "@multimediatype": "Acrobat PDF file",
            "@type": "APPLICATION",
            "@size": "1962861",
            "@ref": "mmc1",
            "@mimetype": "application/pdf"
          },
          {
            "@category": "thumbnail",
            "@_fa": "true",
            "$": "https://api.elsevier.com/content/object/eid/1-s2.0-S2468823120303539-si1.svg?httpAccept=%2A%2F%2A",
            "@multimediatype": "Scalable Vector Graphics file",
            "@type": "ALTIMG",
            "@size": "105925",
            "@ref": "si1",
            "@mimetype": "image/svg+xml"
          },
          {
            "@category": "thumbnail",
            "@_fa": "true",
            "$": "https://api.elsevier.com/content/object/eid/1-s2.0-S2468823120303539-si10.svg?httpAccept=%2A%2F%2A",
            "@multimediatype": "Scalable Vector Graphics file",
            "@type": "ALTIMG",
            "@size": "29174",
            "@ref": "si10",
            "@mimetype": "image/svg+xml"
          },
          {
            "@category": "thumbnail",
            "@_fa": "true",
            "$": "https://api.elsevier.com/content/object/eid/1-s2.0-S2468823120303539-si11.svg?httpAccept=%2A%2F%2A",
            "@multimediatype": "Scalable Vector Graphics file",
            "@type": "ALTIMG",
            "@size": "3017",
            "@ref": "si11",
            "@mimetype": "image/svg+xml"
          },
          {
            "@category": "thumbnail",
            "@_fa": "true",
            "$": "https://api.elsevier.com/content/object/eid/1-s2.0-S2468823120303539-si12.svg?httpAccept=%2A%2F%2A",
            "@multimediatype": "Scalable Vector Graphics file",
            "@type": "ALTIMG",
            "@size": "2932",
            "@ref": "si12",
            "@mimetype": "image/svg+xml"
          },
          {
            "@category": "thumbnail",
            "@_fa": "true",
            "$": "https://api.elsevier.com/content/object/eid/1-s2.0-S2468823120303539-si13.svg?httpAccept=%2A%2F%2A",
            "@multimediatype": "Scalable Vector Graphics file",
            "@type": "ALTIMG",
            "@size": "5448",
            "@ref": "si13",
            "@mimetype": "image/svg+xml"
          },
          {
            "@category": "thumbnail",
            "@_fa": "true",
            "$": "https://api.elsevier.com/content/object/eid/1-s2.0-S2468823120303539-si14.svg?httpAccept=%2A%2F%2A",
            "@multimediatype": "Scalable Vector Graphics file",
            "@type": "ALTIMG",
            "@size": "5837",
            "@ref": "si14",
            "@mimetype": "image/svg+xml"
          },
          {
            "@category": "thumbnail",
            "@_fa": "true",
            "$": "https://api.elsevier.com/content/object/eid/1-s2.0-S2468823120303539-si15.svg?httpAccept=%2A%2F%2A",
            "@multimediatype": "Scalable Vector Graphics file",
            "@type": "ALTIMG",
            "@size": "5592",
            "@ref": "si15",
            "@mimetype": "image/svg+xml"
          },
          {
            "@category": "thumbnail",
            "@_fa": "true",
            "$": "https://api.elsevier.com/content/object/eid/1-s2.0-S2468823120303539-si16.svg?httpAccept=%2A%2F%2A",
            "@multimediatype": "Scalable Vector Graphics file",
            "@type": "ALTIMG",
            "@size": "8108",
            "@ref": "si16",
            "@mimetype": "image/svg+xml"
          },
          {
            "@category": "thumbnail",
            "@_fa": "true",
            "$": "https://api.elsevier.com/content/object/eid/1-s2.0-S2468823120303539-si17.svg?httpAccept=%2A%2F%2A",
            "@multimediatype": "Scalable Vector Graphics file",
            "@type": "ALTIMG",
            "@size": "8315",
            "@ref": "si17",
            "@mimetype": "image/svg+xml"
          },
          {
            "@category": "thumbnail",
            "@_fa": "true",
            "$": "https://api.elsevier.com/content/object/eid/1-s2.0-S2468823120303539-si18.svg?httpAccept=%2A%2F%2A",
            "@multimediatype": "Scalable Vector Graphics file",
            "@type": "ALTIMG",
            "@size": "5071",
            "@ref": "si18",
            "@mimetype": "image/svg+xml"
          },
          {
            "@category": "thumbnail",
            "@_fa": "true",
            "$": "https://api.elsevier.com/content/object/eid/1-s2.0-S2468823120303539-si2.svg?httpAccept=%2A%2F%2A",
            "@multimediatype": "Scalable Vector Graphics file",
            "@type": "ALTIMG",
            "@size": "24373",
            "@ref": "si2",
            "@mimetype": "image/svg+xml"
          },
          {
            "@category": "thumbnail",
            "@_fa": "true",
            "$": "https://api.elsevier.com/content/object/eid/1-s2.0-S2468823120303539-si3.svg?httpAccept=%2A%2F%2A",
            "@multimediatype": "Scalable Vector Graphics file",
            "@type": "ALTIMG",
            "@size": "13527",
            "@ref": "si3",
            "@mimetype": "image/svg+xml"
          },
          {
            "@category": "thumbnail",
            "@_fa": "true",
            "$": "https://api.elsevier.com/content/object/eid/1-s2.0-S2468823120303539-si4.svg?httpAccept=%2A%2F%2A",
            "@multimediatype": "Scalable Vector Graphics file",
            "@type": "ALTIMG",
            "@size": "10381",
            "@ref": "si4",
            "@mimetype": "image/svg+xml"
          },
          {
            "@category": "thumbnail",
            "@_fa": "true",
            "$": "https://api.elsevier.com/content/object/eid/1-s2.0-S2468823120303539-si5.svg?httpAccept=%2A%2F%2A",
            "@multimediatype": "Scalable Vector Graphics file",
            "@type": "ALTIMG",
            "@size": "24073",
            "@ref": "si5",
            "@mimetype": "image/svg+xml"
          },
          {
            "@category": "thumbnail",
            "@_fa": "true",
            "$": "https://api.elsevier.com/content/object/eid/1-s2.0-S2468823120303539-si6.svg?httpAccept=%2A%2F%2A",
            "@multimediatype": "Scalable Vector Graphics file",
            "@type": "ALTIMG",
            "@size": "16618",
            "@ref": "si6",
            "@mimetype": "image/svg+xml"
          },
          {
            "@category": "thumbnail",
            "@_fa": "true",
            "$": "https://api.elsevier.com/content/object/eid/1-s2.0-S2468823120303539-si7.svg?httpAccept=%2A%2F%2A",
            "@multimediatype": "Scalable Vector Graphics file",
            "@type": "ALTIMG",
            "@size": "20840",
            "@ref": "si7",
            "@mimetype": "image/svg+xml"
          },
          {
            "@category": "thumbnail",
            "@_fa": "true",
            "$": "https://api.elsevier.com/content/object/eid/1-s2.0-S2468823120303539-si8.svg?httpAccept=%2A%2F%2A",
            "@multimediatype": "Scalable Vector Graphics file",
            "@type": "ALTIMG",
            "@size": "18536",
            "@ref": "si8",
            "@mimetype": "image/svg+xml"
          },
          {
            "@category": "thumbnail",
            "@_fa": "true",
            "$": "https://api.elsevier.com/content/object/eid/1-s2.0-S2468823120303539-si9.svg?httpAccept=%2A%2F%2A",
            "@multimediatype": "Scalable Vector Graphics file",
            "@type": "ALTIMG",
            "@size": "25002",
            "@ref": "si9",
            "@mimetype": "image/svg+xml"
          },
          {
            "@category": "standard",
            "@_fa": "true",
            "$": "https://api.elsevier.com/content/object/eid/1-s2.0-S2468823120303539-am.pdf?httpAccept=%2A%2F%2A",
            "@multimediatype": "Acrobat PDF file",
            "@type": "AAM-PDF",
            "@size": "1306223",
            "@ref": "am",
            "@mimetype": "application/pdf"
          }
        ]
      },
      "link": {
        "@rel": "abstract",
        "@href": "https://api.elsevier.com/content/abstract/scopus_id/85087286063"
      }
    }
  }
}