{
  "metadata": {
    "title": "Ni and Sr modified ZSM-5 catalyst with enhanced catalytic activity for selective dehydration of bio-derived ethanol to ethylene",
    "authors": "; ; ",
    "journal": "Molecular Catalysis",
    "date": "2023-12-31",
    "doi": "10.1016/j.mcat.2023.113587",
    "abstract": "",
    "uri": "https://api.elsevier.com/content/article/pii/S2468823123006703",
    "pii": "S2468823123006703"
  },
  "fulltext": {
    "full-text-retrieval-response": {
      "scopus-eid": "2-s2.0-85174702102",
      "originalText": "serial JL 315758 291210 291744 291790 291809 31 Molecular Catalysis MOLECULARCATALYSIS 2023-10-25 2023-10-25 2023-10-25 2023-10-25 2023-11-15T19:32:27 1-s2.0-S2468823123006703 S2468-8231(23)00670-3 S2468823123006703 10.1016/j.mcat.2023.113587 S300 S300.1 FULL-TEXT 1-s2.0-S2468823123X00170 2024-11-20T04:36:25.786495Z 0 0 20231201 20231231 2023 2023-10-26T00:11:24.263406Z absattachment articleinfo articlenumber articletitlenorm authfirstinitialnorm authfirstsurnamenorm cid cids contenttype copyright crossmark dateloaded dateloadedtxt datesearch datesort dateupdated dco docsubtype doctype doi eid ewtransactionid hubeid indexeddate issn issnnorm itemstage itemtransactionid itemweight openaccess openarchive pg pgfirst pii piinorm pubdateend pubdatestart pubdatetxt pubyr sectiontitle sortorder srctitle srctitlenorm srctype ssids alllist content subj subheadings suppl tomb volfirst volissue volumelist webpdf webpdfpagecount yearnav figure table e-component body mmlmath acknowledge affil appendices articletitle auth authfirstini authfull authkeywords authlast grantsponsor highlightsabst orcid primabst ref specialabst 2468-8231 24688231 true 551 551 C Volume 551 14 113587 113587 113587 202312 December 2023 2023-12-01 2023-12-31 2023 Regular Papers article fla © 2023 Elsevier B.V. All rights reserved. NISRMODIFIEDZSM5CATALYSTENHANCEDCATALYTICACTIVITYFORSELECTIVEDEHYDRATIONBIODERIVEDETHANOLETHYLENE SAINI S 1 Introduction 2 Experimental section 2.1 Materials 2.2 Catalysts preparation 3 Characterizations 4 Catalytic activity setup 5 Results and discussion 5.1 Catalyst characterizations 5.2 Significance of the work 5.3 Activity testing 5.3.1 Effect of reaction temperature 5.3.2 Effect of weight hourly space velocity 5.3.3 Effect of ethanol concentration 5.3.4 Time-on-stream study 5.4 Mechanism of ethanol dehydration 6 Conclusions Supplementary Information CRediT authorship contribution statement Acknowledgments Appendix Supplementary materials References FAN 2012 101 D MASIH 2019 91 D CHERUBINI 2010 1412 F AYALA 2022 2171 H TRIPODI 2019 13333 A HAN 2011 8 Y BANZARAKTSAEVA 2019 605 S VARISLI 2007 5349 D ALMOHALLA 2017 1892 M RITTIRUAM 2019 1 M CHENG 2020 119323 Y ZHAN 2010 633 N MOSER 1989 19 W GAYUBO 2010 299 A SOH 2017 11 J PHUNG 2015 77 T DONG 2023 111979 X DELASPOZAS 1993 145 C CHIANG 2010 251 H MORSCHBACKER 2009 79 A PHUNG 2015 92 T PHUNG 2015 290 T RAMASAMY 2014 89 K GARBARINO 2017 458 G GOLAY 1998 97 S DOHEIM 2002 304 M HUANG 2015 1093 Y ROSSETTI 2017 407 I CHEN 2007 111 G TAKAHASHI 2013 380 A NASH 2016 110 C JESUDOSS 2018 481 S BAKARE 2016 7852 I SING 1985 603 K LEWANDOWSKI 2000 487 M YUAN 2016 41 E ZAKARIA 2012 803 Z TARDITI 2014 521 A MAIA 2010 103 A AHMED 2021 124181 A HAMBALI 2020 5696 H CHASTAIN 1992 221 J WAGNER 1979 466 C ZHANG 2008 384 D SHARMA 2017 89 Y PHUNG 2015 110 T LI 2014 292 X SOH 2017 85 J WU 2017 4287 C WANG 2011 161 F SHENG 2014 1365 Q GAYUBO 2011 262 A FUJISAWA 1987 791 H SAINIX2023X113587 SAINIX2023X113587XS 2025-10-25T00:00:00.000Z 2025-10-25T00:00:00.000Z http://creativecommons.org/licenses/by-nc-nd/4.0/ © 2023 Elsevier B.V. All rights reserved. 2024-11-20T04:35:41.021Z http://vtw.elsevier.com/data/voc/AddOnTypes/50.7/aggregated-refined CSIR CSIR Council of Scientific and Industrial Research, India http://data.elsevier.com/vocabulary/SciValFunders/501100001412 http://sws.geonames.org/1269750/ Department of Science and Technology DST Department of Science and Technology, Ministry of Science and Technology, India http://data.elsevier.com/vocabulary/SciValFunders/501100001409 http://sws.geonames.org/1269750/ TWAS-CSIR The authors are thankful to the Director CSIR-Indian Institute of Petroleum (IIP) for his constant support. The authors are also thankful to Material Resource Efficiency Division (CSIR-IIP) for providing fermentation broth to prepare feedstock for the reaction. The authors also acknowledge the Analytical Sciences Division (ASD), CSIR-IIP , for analytical support. Financial support of CSIR, New Delhi, India, is acknowledged by the author&apos;s SS and BS. AV acknowledges the Department of Science and Technology (DST), New Delhi, India , for providing INSPIRE research fellowship. TO is thankful to TWAS-CSIR for providing the fellowship. https://doi.org/10.15223/policy-017 https://doi.org/10.15223/policy-037 https://doi.org/10.15223/policy-012 https://doi.org/10.15223/policy-029 https://doi.org/10.15223/policy-004 item S2468-8231(23)00670-3 S2468823123006703 1-s2.0-S2468823123006703 10.1016/j.mcat.2023.113587 315758 2023-11-15T21:08:15.188499Z 2023-12-01 2023-12-31 1-s2.0-S2468823123006703-main.pdf https://s3-eu-west-1.amazonaws.com/prod-ucs-content-store-eu-west/content/pii:S2468823123006703/MAIN/application/pdf/65198137e5c340f7305f4ba941dbf75c/main.pdf main.pdf pdf true 7248221 MAIN 10 1-s2.0-S2468823123006703-main_1.png https://s3-eu-west-1.amazonaws.com/prod-ucs-content-store-eu-west/content/pii:S2468823123006703/PREVIEW/image/png/a46d8fd31858507793103fbf89573ddb/main_1.png main_1.png png 57013 849 656 IMAGE-WEB-PDF 1 1-s2.0-S2468823123006703-gr12.jpg https://s3-eu-west-1.amazonaws.com/prod-ucs-content-store-eu-west/content/pii:S2468823123006703/gr12/DOWNSAMPLED/image/jpeg/3cd17dbe0bbc7bc3f4b55a129665fc14/gr12.jpg gr12 gr12.jpg jpg 19671 208 282 IMAGE-DOWNSAMPLED 1-s2.0-S2468823123006703-gr11.jpg https://s3-eu-west-1.amazonaws.com/prod-ucs-content-store-eu-west/content/pii:S2468823123006703/gr11/DOWNSAMPLED/image/jpeg/5b30c660972216fd2036841dce1259e2/gr11.jpg gr11 gr11.jpg jpg 24111 287 376 IMAGE-DOWNSAMPLED 1-s2.0-S2468823123006703-gr10.jpg https://s3-eu-west-1.amazonaws.com/prod-ucs-content-store-eu-west/content/pii:S2468823123006703/gr10/DOWNSAMPLED/image/jpeg/8a9987706b2ddf366ac1f6813114343b/gr10.jpg gr10 gr10.jpg jpg 64926 323 659 IMAGE-DOWNSAMPLED 1-s2.0-S2468823123006703-ga1.jpg https://s3-eu-west-1.amazonaws.com/prod-ucs-content-store-eu-west/content/pii:S2468823123006703/ga1/DOWNSAMPLED/image/jpeg/a79cc595ece70cd592fd4c773816ef92/ga1.jpg ga1 true ga1.jpg jpg 29606 200 380 IMAGE-DOWNSAMPLED 1-s2.0-S2468823123006703-gr6.jpg https://s3-eu-west-1.amazonaws.com/prod-ucs-content-store-eu-west/content/pii:S2468823123006703/gr6/DOWNSAMPLED/image/jpeg/5a04292c0a11d18823536b59a1c06553/gr6.jpg gr6 gr6.jpg jpg 43532 509 376 IMAGE-DOWNSAMPLED 1-s2.0-S2468823123006703-gr7.jpg https://s3-eu-west-1.amazonaws.com/prod-ucs-content-store-eu-west/content/pii:S2468823123006703/gr7/DOWNSAMPLED/image/jpeg/cf77b66e585e94999b87d1dd5cf48210/gr7.jpg gr7 gr7.jpg jpg 52007 572 376 IMAGE-DOWNSAMPLED 1-s2.0-S2468823123006703-gr9.jpg https://s3-eu-west-1.amazonaws.com/prod-ucs-content-store-eu-west/content/pii:S2468823123006703/gr9/DOWNSAMPLED/image/jpeg/67a6ce78f8763542dbbf4a06b121a98b/gr9.jpg gr9 gr9.jpg jpg 36516 374 565 IMAGE-DOWNSAMPLED 1-s2.0-S2468823123006703-gr2.jpg https://s3-eu-west-1.amazonaws.com/prod-ucs-content-store-eu-west/content/pii:S2468823123006703/gr2/DOWNSAMPLED/image/jpeg/5f39ed7711d8d6689dacdedad80647a2/gr2.jpg gr2 gr2.jpg jpg 84262 317 753 IMAGE-DOWNSAMPLED 1-s2.0-S2468823123006703-gr1.jpg https://s3-eu-west-1.amazonaws.com/prod-ucs-content-store-eu-west/content/pii:S2468823123006703/gr1/DOWNSAMPLED/image/jpeg/5b41ca2a20ed94e0d7402086c1e306a6/gr1.jpg gr1 gr1.jpg jpg 14995 235 376 IMAGE-DOWNSAMPLED 1-s2.0-S2468823123006703-gr4.jpg https://s3-eu-west-1.amazonaws.com/prod-ucs-content-store-eu-west/content/pii:S2468823123006703/gr4/DOWNSAMPLED/image/jpeg/7adca7418c1661ac40eef1882235a7f4/gr4.jpg gr4 gr4.jpg jpg 28248 162 565 IMAGE-DOWNSAMPLED 1-s2.0-S2468823123006703-gr3.jpg https://s3-eu-west-1.amazonaws.com/prod-ucs-content-store-eu-west/content/pii:S2468823123006703/gr3/DOWNSAMPLED/image/jpeg/a01c35d4aa2dbeb5ee97e6c1c4423c27/gr3.jpg gr3 gr3.jpg jpg 40549 331 376 IMAGE-DOWNSAMPLED 1-s2.0-S2468823123006703-gr5.jpg https://s3-eu-west-1.amazonaws.com/prod-ucs-content-store-eu-west/content/pii:S2468823123006703/gr5/DOWNSAMPLED/image/jpeg/d54d1bd9727bd6b397b29c0bd421738b/gr5.jpg gr5 gr5.jpg jpg 25736 227 282 IMAGE-DOWNSAMPLED 1-s2.0-S2468823123006703-gr8.jpg https://s3-eu-west-1.amazonaws.com/prod-ucs-content-store-eu-west/content/pii:S2468823123006703/gr8/DOWNSAMPLED/image/jpeg/43454d33a1bbf176d49a209f7d50866b/gr8.jpg gr8 gr8.jpg jpg 175619 965 747 IMAGE-DOWNSAMPLED 1-s2.0-S2468823123006703-gr12.sml https://s3-eu-west-1.amazonaws.com/prod-ucs-content-store-eu-west/content/pii:S2468823123006703/gr12/THUMBNAIL/image/gif/d2e9bfba5f4774c6d8a783d339f107dc/gr12.sml gr12 gr12.sml sml 9543 162 219 IMAGE-THUMBNAIL 1-s2.0-S2468823123006703-gr11.sml https://s3-eu-west-1.amazonaws.com/prod-ucs-content-store-eu-west/content/pii:S2468823123006703/gr11/THUMBNAIL/image/gif/6d4aeaec20d1c87bb00980af61457c4b/gr11.sml gr11 gr11.sml sml 8085 164 215 IMAGE-THUMBNAIL 1-s2.0-S2468823123006703-gr10.sml https://s3-eu-west-1.amazonaws.com/prod-ucs-content-store-eu-west/content/pii:S2468823123006703/gr10/THUMBNAIL/image/gif/8be2474c7461f6a6f19f3cfa68c97a42/gr10.sml gr10 gr10.sml sml 11377 107 219 IMAGE-THUMBNAIL 1-s2.0-S2468823123006703-ga1.sml https://s3-eu-west-1.amazonaws.com/prod-ucs-content-store-eu-west/content/pii:S2468823123006703/ga1/THUMBNAIL/image/gif/7bc6aac5aeff7b5c6bc83eda3a700c73/ga1.sml ga1 true ga1.sml sml 16698 115 219 IMAGE-THUMBNAIL 1-s2.0-S2468823123006703-gr6.sml https://s3-eu-west-1.amazonaws.com/prod-ucs-content-store-eu-west/content/pii:S2468823123006703/gr6/THUMBNAIL/image/gif/a3176c87823ee5a9611f627dab75316e/gr6.sml gr6 gr6.sml sml 7608 164 121 IMAGE-THUMBNAIL 1-s2.0-S2468823123006703-gr7.sml https://s3-eu-west-1.amazonaws.com/prod-ucs-content-store-eu-west/content/pii:S2468823123006703/gr7/THUMBNAIL/image/gif/3104ba86c233174d4c78cb34db984514/gr7.sml gr7 gr7.sml sml 7981 164 108 IMAGE-THUMBNAIL 1-s2.0-S2468823123006703-gr9.sml https://s3-eu-west-1.amazonaws.com/prod-ucs-content-store-eu-west/content/pii:S2468823123006703/gr9/THUMBNAIL/image/gif/be0b64501bfe94fe9f312c227ee01ba1/gr9.sml gr9 gr9.sml sml 8030 145 219 IMAGE-THUMBNAIL 1-s2.0-S2468823123006703-gr2.sml https://s3-eu-west-1.amazonaws.com/prod-ucs-content-store-eu-west/content/pii:S2468823123006703/gr2/THUMBNAIL/image/gif/d7a04e3820b7a49c8020f1bf722975ea/gr2.sml gr2 gr2.sml sml 13064 92 219 IMAGE-THUMBNAIL 1-s2.0-S2468823123006703-gr1.sml https://s3-eu-west-1.amazonaws.com/prod-ucs-content-store-eu-west/content/pii:S2468823123006703/gr1/THUMBNAIL/image/gif/8d9ae8592f761e0211aa1c33dfb307d0/gr1.sml gr1 gr1.sml sml 7007 137 219 IMAGE-THUMBNAIL 1-s2.0-S2468823123006703-gr4.sml https://s3-eu-west-1.amazonaws.com/prod-ucs-content-store-eu-west/content/pii:S2468823123006703/gr4/THUMBNAIL/image/gif/e871fe38b797f1f79b17ad59791cb082/gr4.sml gr4 gr4.sml sml 11021 63 219 IMAGE-THUMBNAIL 1-s2.0-S2468823123006703-gr3.sml https://s3-eu-west-1.amazonaws.com/prod-ucs-content-store-eu-west/content/pii:S2468823123006703/gr3/THUMBNAIL/image/gif/97493e54fc82fdf19375ca0477028d99/gr3.sml gr3 gr3.sml sml 10984 164 186 IMAGE-THUMBNAIL 1-s2.0-S2468823123006703-gr5.sml https://s3-eu-west-1.amazonaws.com/prod-ucs-content-store-eu-west/content/pii:S2468823123006703/gr5/THUMBNAIL/image/gif/5343ef3621e666ac57562b9e054071bd/gr5.sml gr5 gr5.sml sml 11485 164 204 IMAGE-THUMBNAIL 1-s2.0-S2468823123006703-gr8.sml https://s3-eu-west-1.amazonaws.com/prod-ucs-content-store-eu-west/content/pii:S2468823123006703/gr8/THUMBNAIL/image/gif/d882e9b45a609c990844edb2c8bb2463/gr8.sml gr8 gr8.sml sml 10668 164 127 IMAGE-THUMBNAIL 1-s2.0-S2468823123006703-gr12_lrg.jpg https://s3-eu-west-1.amazonaws.com/prod-ucs-content-store-eu-west/content/pii:S2468823123006703/HIGHRES/image/jpeg/e9c45efd4e0e73e270736d2e5beeb889/gr12_lrg.jpg gr12 gr12_lrg.jpg jpg 170086 924 1250 IMAGE-HIGH-RES 1-s2.0-S2468823123006703-gr11_lrg.jpg https://s3-eu-west-1.amazonaws.com/prod-ucs-content-store-eu-west/content/pii:S2468823123006703/HIGHRES/image/jpeg/60523b56605e12e4a93f4d959fdaeeba/gr11_lrg.jpg gr11 gr11_lrg.jpg jpg 172842 1271 1667 IMAGE-HIGH-RES 1-s2.0-S2468823123006703-gr10_lrg.jpg https://s3-eu-west-1.amazonaws.com/prod-ucs-content-store-eu-west/content/pii:S2468823123006703/HIGHRES/image/jpeg/e245c15bf7ef4939f52f65c6412c3f9f/gr10_lrg.jpg gr10 gr10_lrg.jpg jpg 458655 1431 2917 IMAGE-HIGH-RES 1-s2.0-S2468823123006703-ga1_lrg.jpg https://s3-eu-west-1.amazonaws.com/prod-ucs-content-store-eu-west/content/pii:S2468823123006703/HIGHRES/image/jpeg/d7d569b258332dbea4fbb1d5721e1c6b/ga1_lrg.jpg ga1 true ga1_lrg.jpg jpg 205599 886 1685 IMAGE-HIGH-RES 1-s2.0-S2468823123006703-gr6_lrg.jpg https://s3-eu-west-1.amazonaws.com/prod-ucs-content-store-eu-west/content/pii:S2468823123006703/HIGHRES/image/jpeg/728100e0712c512f892caf1f5fa47367/gr6_lrg.jpg gr6 gr6_lrg.jpg jpg 294729 2256 1667 IMAGE-HIGH-RES 1-s2.0-S2468823123006703-gr7_lrg.jpg https://s3-eu-west-1.amazonaws.com/prod-ucs-content-store-eu-west/content/pii:S2468823123006703/HIGHRES/image/jpeg/f81ce3cd2cad68ae7e0683a85bc562d3/gr7_lrg.jpg gr7 gr7_lrg.jpg jpg 878685 2534 1667 IMAGE-HIGH-RES 1-s2.0-S2468823123006703-gr9_lrg.jpg https://s3-eu-west-1.amazonaws.com/prod-ucs-content-store-eu-west/content/pii:S2468823123006703/HIGHRES/image/jpeg/6e660cf6276f39dc188e4a9a1b4e4506/gr9_lrg.jpg gr9 gr9_lrg.jpg jpg 240438 1655 2500 IMAGE-HIGH-RES 1-s2.0-S2468823123006703-gr2_lrg.jpg https://s3-eu-west-1.amazonaws.com/prod-ucs-content-store-eu-west/content/pii:S2468823123006703/HIGHRES/image/jpeg/46ccf7a3d4eac94b7ebc346ad7b377bb/gr2_lrg.jpg gr2 gr2_lrg.jpg jpg 713245 1401 3333 IMAGE-HIGH-RES 1-s2.0-S2468823123006703-gr1_lrg.jpg https://s3-eu-west-1.amazonaws.com/prod-ucs-content-store-eu-west/content/pii:S2468823123006703/HIGHRES/image/jpeg/74dc2d1e127d4238679afd0d4748ca7e/gr1_lrg.jpg gr1 gr1_lrg.jpg jpg 96834 1040 1667 IMAGE-HIGH-RES 1-s2.0-S2468823123006703-gr4_lrg.jpg https://s3-eu-west-1.amazonaws.com/prod-ucs-content-store-eu-west/content/pii:S2468823123006703/HIGHRES/image/jpeg/a936beb30b67562b65893f7f650a70df/gr4_lrg.jpg gr4 gr4_lrg.jpg jpg 365253 716 2500 IMAGE-HIGH-RES 1-s2.0-S2468823123006703-gr3_lrg.jpg https://s3-eu-west-1.amazonaws.com/prod-ucs-content-store-eu-west/content/pii:S2468823123006703/HIGHRES/image/jpeg/3dc8bd4dd8190726882952b23ee167d1/gr3_lrg.jpg gr3 gr3_lrg.jpg jpg 560139 1466 1667 IMAGE-HIGH-RES 1-s2.0-S2468823123006703-gr5_lrg.jpg https://s3-eu-west-1.amazonaws.com/prod-ucs-content-store-eu-west/content/pii:S2468823123006703/HIGHRES/image/jpeg/74332d7628841fa259df3b73ca49c3fd/gr5_lrg.jpg gr5 gr5_lrg.jpg jpg 182930 1006 1250 IMAGE-HIGH-RES 1-s2.0-S2468823123006703-gr8_lrg.jpg https://s3-eu-west-1.amazonaws.com/prod-ucs-content-store-eu-west/content/pii:S2468823123006703/HIGHRES/image/jpeg/db6fe6191522ab13bb817ed51dbd7653/gr8_lrg.jpg gr8 gr8_lrg.jpg jpg 1288172 4276 3309 IMAGE-HIGH-RES 1-s2.0-S2468823123006703-mmc1.docx https://s3-eu-west-1.amazonaws.com/prod-ucs-content-store-eu-west/content/pii:S2468823123006703/mmc1/MAIN/application/vnd.openxmlformats-officedocument.wordprocessingml.document/90bb176c24bdc13bee651b5a8a1fbe82/mmc1.docx mmc1 mmc1.docx docx 2063060 APPLICATION 1-s2.0-S2468823123006703-si1.svg https://s3-eu-west-1.amazonaws.com/prod-ucs-content-store-eu-west/content/pii:S2468823123006703/image/svg+xml/cc02d1fc94ab1b80041b9ef49da9d2ac/si1.svg si1 si1.svg svg 17407 ALTIMG 1-s2.0-S2468823123006703-si2.svg https://s3-eu-west-1.amazonaws.com/prod-ucs-content-store-eu-west/content/pii:S2468823123006703/image/svg+xml/bf97ed37d64fed0cfdab65366d083563/si2.svg si2 si2.svg svg 19649 ALTIMG 1-s2.0-S2468823123006703-si3.svg https://s3-eu-west-1.amazonaws.com/prod-ucs-content-store-eu-west/content/pii:S2468823123006703/image/svg+xml/49b2fbc2cf6435317b0e1295739f16b5/si3.svg si3 si3.svg svg 13134 ALTIMG 1-s2.0-S2468823123006703-am.pdf https://s3-eu-west-1.amazonaws.com/prod-ucs-content-store-eu-west/content/egi:10ZMH3HBJV2/MAIN/application/pdf/4404305be1081527175409587eaf3736/am.pdf am am.pdf pdf false 3055857 AAM-PDF MCAT 113587 113587 S2468-8231(23)00670-3 10.1016/j.mcat.2023.113587 Fig. 1 Simple process diagram for ethanol dehydration. Fig 1 Fig. 2 TEM images of (a) H-ZSM-5 (b) Sr-ZSM-5 (c), (d) Ni/Sr-ZSM-5, and (e) XRD pattern of H-ZSM-5, Sr-ZSM-5, and Ni/Sr-ZSM-5 catalysts. Fig 2 Fig. 3 FTIR spectra of neat H-ZSM-5, Sr-ZSM-5, and Ni/Sr-ZSM-5 catalysts. Fig 3 Fig. 4 SEM images of (a) H-ZSM-5, (b) Sr-ZSM-5, and (c) Ni/Sr-ZSM-5 catalysts. Fig 4 Fig. 5 Adsorption-desorption isotherm of H-ZSM-5, Sr-ZSM-5, and Ni/Sr-ZSM-5 catalysts. Fig 5 Fig. 6 NH3-TPD profiles of H-ZSM-5, Sr-ZSM-5, and Ni/Sr-ZSM-5 catalysts. Fig 6 Fig. 7 . 27Al MAS-NMR of H-ZSM-5, Sr-ZSM-5, NiO/Sr-ZSM-5 and Ni/Sr-ZSM-5 catalysts. Fig 7 Fig. 8 XPS spectra of (a) Full survey scan (b) Si 2p (c) O 1s (d) Ni 3p/Al 2p and (e) Sr 3d and (f) Ni 2p core level of Ni/Sr-ZSM-5 catalyst. Fig 8 Fig. 9 Compendium of comparison of catalysts reported in the literature and prepared Ni/Sr-ZSM-5. Selectivity of ethylene (a) and ethanol conversion (b) at relative temperature difference. ΔT ( °C) corresponds to the difference between our operation temperature (i.e., 250 °C) and the temperature reported in the respective literature. All the above literature has been tabulated in Table S1. Fig 9 Fig. 10 Effect of (a) temperature and (b) WHSV on ethanol conversion and ethylene selectivity. Reaction conditions: catalyst = 2 g, feed conc. = 6%, WHSV = 6 h−1, N2 flow = 10 mL min−1, pressure = 1 atm, TOS = 5 h. Fig 10 Fig. 11 Rate of formation of ethylene over H-ZSM-5 and Ni/Sr-ZSM-5. Reaction conditions: catalyst = 2 g, feed conc. = 6%, temp. = 250 °C, WHSV = 9 h−1, N2 flow = 10 mL min−1, pressure = 1 atm. Fig 11 Fig. 12 TOS study using Ni/Sr-ZSM-5 catalyst. Reaction condition: catalyst (Ni/Sr-ZSM-5) = 2 g, feed conc. = 6%, temp. = 250 °C, WHSV = 9 h−1, N2 flow = 10 mL min−1, pressure = 1 atm. Fig 12 Table 1 Surface properties and acidity of catalysts. Table 1 Catalysts Surface area (m2g−1) Pore volume (ccg−1) Acidity a SBET b VTotal c VMicro d VMeso e Weak acidity Strong acidity Temp range Quantity (mmol g−1) Temp range Quantity (mmol g−1) H-ZSM-5 324.9 0.189 0.137 0.052 120–280 0.570 290–480 0.710 Sr-ZSM-5 296.5 0.177 0.114 0.063 120–280 0.750 290–450 0.510 Ni/Sr-ZSM-5 286.6 0.188 0.104 0.080 120–280 0.094 350–480 0.01 a Calculated by NH3-TPD. b SBET: BET surface area. c VTotal: total pore volume. d VMicro: micropore volume (calculated by t-plot). e VMeso: mesopore volume calculated by the subtraction of micropore volume from the total pore volume. Ni and Sr modified ZSM-5 catalyst with enhanced catalytic activity for selective dehydration of bio-derived ethanol to ethylene Swati Saini Conceptualization Methodology Investigation Writing – original draft a b Akash Verma Methodology Software Visualization a b Bhawna Sharma Investigation Data curation a b Varsha Singh Data curation Investigation a Tolulope Oluokun Formal analysis Resources a c Nagabhatla Viswanadham Writing – review & editing Supervision b d Anjan Ray Writing – review & editing b e Umesh Kumar Writing – review & editing Resources Project administration Funding acquisition Supervision a b ⁎ a Polymeric Materials Area, Chemical and Material Sciences Division, CSIR - Indian Institute of Petroleum, Dehradun 248005, India Polymeric Materials Area Chemical and Material Sciences Division CSIR - Indian Institute of Petroleum Dehradun 248005 India aPolymeric Materials Area, Chemical and Material Sciences Division, CSIR - Indian Institute of Petroleum, Dehradun 248005, India b Academy of Scientific and Innovative Research (AcSIR), Ghaziabad 201002, India Academy of Scientific and Innovative Research (AcSIR) Ghaziabad 201002 India bAcademy of Scientific and Innovative Research (AcSIR), Ghaziabad 201002, India c Department of Chemistry, University of Ibadan, Ibadan 200005, Nigeria Department of Chemistry University of Ibadan Ibadan 200005 Nigeria cDepartment of Chemistry, University of Ibadan, Ibadan 200005, Nigeria d Light Stock Processing Division, CSIR - Indian Institute of Petroleum, Dehradun 248005, India Light Stock Processing Division CSIR - Indian Institute of Petroleum Dehradun 248005 India dLight Stock Processing Division, CSIR-Indian Institute of Petroleum, Dehradun 248005, India e CSIR - Indian Institute of Petroleum, Dehradun 248005, India CSIR - Indian Institute of Petroleum Dehradun 248005 India eCSIR- Indian Institute of Petroleum, Dehradun 248005, India ⁎ Corresponding author. Ni/Sr-ZSM-5 catalyst was synthesized with tuned acidity and improved hydrothermal stability desired for the dehydration of dilute ethanol. Operating conditions were established to maximize the ethylene selectivity from ethanol dehydration by controlling side reactions, using 6% aqueous ethanol as a model feedstock for fermenter broth. Detailed characterization data of the catalyst reveals that Ni in the catalyst is responsible for the enhanced, near quantitative ethylene selectivity at optimum reaction conditions (temperature of 250 °C, 9 h−1 WHSV), the Ni/Sr-ZSM-5 catalyst exhibited >96% conversion of ethanol with 95% yield of ethylene, facilitated by discouraging undesired side reactions of ethanol. The role of Sr is observed to improve the hydrothermal stability of the catalyst, allowing it to function even in the presence of 94% water in the feed at operated reaction conditions, as evidenced by its stable operation in the studied period of 30 h without significant loss in catalytic activity. The rate of ethylene formation with Ni/Sr-ZSM-5 was 5.33×10 −3 molgcat −1s−1, which is higher than neat H-ZSM-5. This study highlights the production of ethylene from low concentration feedstock using a catalyst with enhanced catalytic activity even in the presence of water in the feedstock. Graphical abstract Image, graphical abstract Keywords Ni/Sr-ZSM-5 Catalytic dehydration Bioethanol Ethylene Data availability Data will be made available on request. 1 Introduction Ethylene is a leading petrochemical and has a current market size of 176 billion USD, and it will grow to 287 billion USD by 2030 [1]. Ethylene is a key building block for the production of polyethylene, polyvinyl chloride, polystyrene, and other copolymers [2]. It also serves as the main intermediate for the production of acetaldehyde, ethylene glycol, ethylene oxide, styrene, ethyl benzene, acetic acid, ethylene dichloride, and vinyl acetate. Ethylene is primarily produced by steam cracking of the naphtha (a nonrenewable fossil fuel source); the traditional ethylene production process is among the most energy-intensive processes, leading to large carbon footprints [3]. Global concern about sustainability has urged researchers to find an alternative route for ethylene production, and renewable sources, including bioethanol, are a sustainable alternative [4–7]. In the last decade, some processes for the production of ethylene from ethanol have successfully been commercialized, like; the Atol process and the Hummingbird process. Some of the key global producers of renewable ethylene are Lummus, Chematur, Axens-Total-IFPEN, Petrobras, BP-Technip, Braskem, and Dow Chemicals. Solid acid catalysts are mainly used in these processes, which contain alumina, alumina-silica, zeolites, and heteropolyacids. The Atol process uses a ZSM-5 catalyst (ATO-201), and two adiabatic reactors are implemented in series at a relatively high temperature of 400–500 °C with 99.4% conversion and 96.4% yield. In the Hummingbird process, heteropolyacids are used as a catalyst. The Al2O3 −MgO/SiO2 catalyst is used in Braskem and Chematur processes using pure ethanol, at 300–450 °C and a WHSV of 0.23–1.17 h − 1, with >97% conversion and >92% ethylene selectivity [8]. Despite these commercial processes, other reported catalysts for catalytic dehydration of ethanol are heteropolyacids [9,10], zirconia-based catalysts [11], SBA-15 [12], ZSM-5 [13–15], zeolite Y [16], and alumina [8,17,18]. Zhan et al. reported La-P modified ZSM-5 catalyst with >96% ethylene selectivity at 300 °C and 2 h−1 WHSV using 50% ethanol as a feedstock [13]. Jiah Chee et al. reported the zeolite-Y catalyst with varying Si/Al ratios; among them, zeolite-Y having Si/Al of 80:1 showed the highest 73% conversion and 98% ethylene selectivity at a temperature of 500 °C [16]. Two pathways, direct dehydration of ethanol and through diethyl ether (DEE) intermediate for ethylene formation, are possible depending upon the reaction temperature and catalyst [19–21]. Commonly, at a low temperature, DEE is dominant; however, at a higher temperature, ethylene is selectively formed, but the much higher temperature (>450 °C) has a negative effect on ethylene selectivity due to the formation of bulky hydrocarbons and aromatics [17,22–24]. γ-A12O3 is the most studied catalyst for this application because of its stability [8,25–27], but a high concentration of ethanol and a high reaction temperature is required, which is usually >350 ℃ [28]. The use of low-concentration ethanol as feedstock offers a more sustainable route; however, catalyst stability in the presence of steam is a challenge. Rossetti et al. [29] proposed the addition of water has a drawback for catalytic activity since most of the catalyst lacks hydrothermal stability in the presence of water in the feedstock. Inducing good hydrothermal stability to the catalyst system and producing ethylene selectively at relatively low temperatures is still challenging. During catalytic dehydration of ethanol, several byproducts may form, including acetic acid, ethyl acetate, acetaldehyde, hydrocarbons (most probably C3 C4), CO2, CO, and hydrogen. Based on previous studies, ethylene formation is caused by surface acidity. The C3 C5 hydrocarbon selectivity was found to be decreased with ethanol dilution over TiO2/γ-Al2O3 (having no strong acidity) [30] but increased over SAPO-34, having strong acidity [31]. During the dehydration of ethanol, the presence of strong acidic sites eventually promote the oligomerization of ethylene. Therefore, better control over side reactions with improved ethylene selectivity is required. Improved ethylene selectivity would enhance the sustainability of the process by limiting the cost of ethylene purification. Among the catalysts reported so far for ethanol dehydration, ZSM-5 is promising in the aspect of its industrial application. However, some drawbacks are still associated with it; the major one is deactivation due to byproduct formation. Therefore, researchers are focused on modifying the catalyst to improve the catalyst stability, leading to maximum ethylene production. In the present study, we prepared a tailored H-ZSM-5 catalyst. H-ZSM-5 was modified with strontium (Sr) and nickel (Ni). The prepared catalyst was methodically studied by X-ray diffraction analysis, N2 physisorption measurements, NH3 temperature program desorption, pyridine adsorbed IR, temperature program reduction, X-ray photoelectron spectroscopy, and 27Al MAS-NMR. The dehydration of ethanol requires moderate acidity and good hydrothermal stability of the catalysts. The incorporation of Sr in H-ZSM-5 enhanced the potential of the catalyst for ethanol dehydration by increasing the hydrothermal stability of the catalyst. Further, Ni addition has improved product selectivity towards ethylene by controlling the acidity of catalysts as well as changing the electronic environment of acidic sites. The process parameters were studied, leading to selective ethanol dehydration using dilute bioethanol as a feedstock. Time-on-stream study was also performed for 30 h. The rate of ethylene formation was calculated and compared with a neat H-ZSM-5 catalyst. 2 Experimental section 2.1 Materials H-ZSM-5 (Si/Al molar ratio = 25–30) was purchased from ProCat India, AR grade strontium nitrate [Sr(NO₃)₂], and nickel acetate [Ni(CH3COO)2·4H2O] were purchased from Alfa Aesar, and bioethanol was obtained from the in-house facility. 2.2 Catalysts preparation The Ni/Sr-ZSM-5 catalyst was prepared by modifying H-ZSM-5 catalysts. The H-ZSM-5 with a Si/Al molar ratio of 25–30 was used for catalyst preparation. Sr-ZSM-5 was prepared by ion exchange (with actual loading of 0.5 wt% as confirmed by ICP analysis). The suspension of 20 g of H-ZSM-5 was made in distilled water, and in another solution, the desired amount of Sr(NO₃)₂ was dissolved in distilled water. The Sr(NO₃)₂ solution was then added to H-ZSM-5 suspension (solid to solvent ratio = 15), and the resulting mixture was stirred for 12 h at 70 °C. The resultant mixture was centrifuged and washed thoroughly with water to remove free ions. The obtained solid was then dried overnight at 70 °C and calcined in air at 500 °C, designated as Sr-ZSM-5. Further, the Ni was impregnated over Sr-ZSM-5. To obtain a final loading of 3.3%, 2.8 g of Ni precursor, [Ni(CH3COO)2·4H2O], was dissolved in distilled water as per the adsorption capacity (3 mL water per gram of catalyst). Prepared powered Sr-ZSM-5 was taken in a mortar pestle, and a solution of [Ni(CH3COO)2·4H2O] was dropwise added with continuous mixing. The resulting paste was left overnight at room temperature, dried at 70 °C, and ground. The obtained solid was calcined at 500 °C with a ramping of 1 °C min−1 and held for 5 h under an air atmosphere (designated as NiO/Sr-ZSM-5). The catalyst was reduced prior to the reaction (designated as Ni/Sr-ZSM-5). The final loading of Sr and Ni was 0.5 wt% and 3.3 wt%, as confirmed by ICP analysis. The neat H-ZSM-5, Sr-ZSM-5, NiO/Sr-ZSM-5, and Ni/Sr-ZSM-5 were characterized by various techniques. 3 Characterizations The prepared catalysts were characterized in detail using different physicochemical, analytical, and spectroscopic techniques, like X-ray Powder Diffraction (XRD), Scanning Electron Microscopy (SEM), Transmission Electron Microscopy (TEM), Fourier-transform Infrared Spectroscopy (FTIR), Ammonia Temperature Programmed Desorption (NH3-TPD), Pyridine adsorbed IR (Py-IR), Temperature Programmed Reduction (H2-TPR), 27Al MAS-NMR, X-ray Photoelectron Spectroscopy (XPS), and N2 physisorption properties. The detail of the techniques and the instruments is given in supplementary information (SI). 4 Catalytic activity setup Ethanol dehydration was carried out in a downflow fixed bed reactor having an internal diameter (ID) of 8 mm and length of 12.5 cm; the catalyst was sieved into BSS 16 mesh size and packed in the middle of the reactor between inert material (SiC) used as a diluent to minimize temperature gradient to ensure isothermal operation, diluent also helps to prevent channeling [32]. The catalyst Ni/Sr-ZSM-5 was reduced in situ under hydrogen at 350 °C prior to the reaction. The temperature of the catalyst bed was monitored by a K-type thermocouple located in the furnace, touching the outer wall of the reactor tube and inside the reactor, placed at the center of the catalyst bed. The N2 flow was maintained with a digital mass flow controller. The preheated ethanol was fed into the reactor, where the reaction was carried out at an elevated temperature ranging from 230 to 270 °C with weight hourly space velocity (WHSV) in the range of 3–12 h−1. The process diagram for ethanol dehydration (Fig. 1 ) consists of an ethanol feed tank (1), a preheater (2), a thermocouple (3), a tubular reactor (4), which consists catalyst bed (5), the furnace (6), a thermocouple (7), which controls the reaction temperature. The setup also consists of a gas-liquid separator (8), where the product stream undergoes separation. The reaction parameters were optimized to maximize ethanol conversion with ethylene selectivity. The formed gaseous and liquid products were analyzed by online GC (PerkinElmer Clarus 690) equipped with a flame ionization detector (FID) and thermal conductivity detector (TCD). HP-PLOT Q, Heysep Q, and molecular sieve columns were used for analysis. Unreacted ethanol and hydrocarbon formed were analyzed by FID detector. Ethanol conversion and ethylene selectivity among all hydrocarbons were analyzed by the formula given below. X = m o l e s o f e t h a n o l f e d i n t o t h e r e a c t o r − m o l e s o f e t h a n o l l e f t a f t e r r e a c t i o n m o l e s o f e t h a n o l f e d i n t o t h e r e a c t o r S = m o l e o f e t h y l e n e p r o d u c e d m o l e s o f g a s e o u s p r o d u c t p r o d u c e d × 100 r = V e t h a n o l × ρ e t h a n o l × 2 × Y M e t h a n o l × C × M c Where Vethanol is the volume of ethanol, ρethanol is the density of ethanol, Y is the% yield of ethylene, Methanol is the molar mass of ethanol, C is the number of carbons in ethylene, and MC is the weight of the catalyst. X = Ethanol conversion S = Ethylene selectivity r = Rate of ethylene formation 5 Results and discussion 5.1 Catalyst characterizations The XRD pattern of neat H-ZSM-5, Sr-ZSM-5, and Ni/Sr-ZSM-5 shows that the structure remains intact during modification of H-ZSM-5 with ion exchange and impregnation. Both Sr-ZSM-5 and Ni/Sr-ZSM-5 have shown the characteristic planes (101), (200), (501), and (303) of H-ZSM-5 at 2θ range of 7 to 30° [33]. No metal-oxide peaks are observed in the case of Sr-ZSM-5 [Fig. 2 (e)], which indicates that metal is highly dispersed on zeolite; this is in good accordance with the TEM analysis. [Fig 2] A similar observation was also reported in the previous literature by Idris A. Bakare [34]. In the case of NiO/Sr-ZSM-5 the small NiO peak is observed (Fig. S1), which is absent in the case of Ni/Sr-ZSM-5 [Fig. 2(e)]. The FT-IR spectra of prepared catalysts in the range of 400–4000 cm−1 are shown in Fig. 3 . The characteristic bands corresponding to the different OH stretching at the surface of the ZSM-5 framework are observed in the range of 3400–3800 cm−1. Also, the peak at 1640 cm−1 is assigned to OH bending present in H-ZSM-5. The peaks at 1100 and 800 cm−1 are assigned to the asymmetric and symmetric stretching of Si-O-T moiety (T=Si, Al), whereas the peaks at 1230 and 450 cm−1 are due to the external T-O (T=Si, Al) asymmetric stretching and bending respectively [35]. The band attributed to the pentacil framework of the catalyst is also seen at 545 cm−1. The HRTEM analysis of Ni/Sr-ZSM-5 clearly shows the presence of metallic Ni nanoparticles over the surface of the catalyst. Ni (111) and Ni (200) planes with d-spacing of 0.20 and 0.18 nm are observed at the 5 nm scale [Fig. 2(d)]. The TEM-EDX is shown in Fig. S2, which shows the uniform dispersion of Ni on the support. The SEM images of the prepared catalysts were obtained to identify the morphology after the modification in the neat H-ZSM-5. The obtained images reveal that morphology remains unaltered after the modification of the metals in Sr-ZSM-5 and Ni/Sr-ZSM-5 catalysts, as shown in Fig. 4 . The surface properties of the prepared catalysts are shown in Table 1 . BET surface area is between 280 and 325 m2/g for every catalyst; BET surface area of the catalyst follows the trend H-ZSM-5 > Sr-ZSM-5 > Ni/Sr-ZSM-5 (Table 1), indicating the decrease in the surface area with the metal incorporation in the prepared catalysts. It is due to the partial blockage of pores by the exchanged bigger Sr metal ion with protons, which is in clear agreement with the literature [34]. The BET surface area further decreased with the impregnation of Ni over the surface of the Sr-ZSM-5 catalyst. The adsorption-desorption isotherms of the neat and modified ZSM-5 show H-4 hysteresis loop (Fig. 5 ) [36]. In the case of Ni/Sr ZSM-5 catalyst, upward projection of the loop was observed at 0.9 P/Po, which indicates the formation of narrow-range mesopores that were not actually present in neat H-ZSM-5 and Sr-ZSM-5 catalysts. The number of acidic sites and relative NH3 desorption temperature are summarized in Table 1. Ammonia desorption is divided into three ranges: weak, intermediate, and strong, depending upon the desorption temperature that signifies the strength of acidic sites [37]. The ammonia desorption at a temperature below 400 °C corresponds to low to moderate acidity whereas at above 400 °C corresponds to high acidity [38]. The number of acid sites present in the solid catalyst can be calculated by the area under the desorption peaks [39,40]. According to the ammonia desorption temperature, after modification with Sr, an increase in weak acid sites is observed, and the strong acid sites are decreased, indicating the stronger acid sites become relatively weaker with the exchange of Sr, an alkaline earth metal. After Ni impregnation, followed by reduction, the acidity was reduced further. The appearance of a new strong acid site may be due to the presence of a small amount of Ni in oxide form (Fig. 6 ). However, these acidic sites are very few. The acidic sites were further evaluated by Py-IR analysis; the peak at 1540 cm−1 corresponds to Bronsted acid sites, whereas the peak at 1450 cm−1 is due to Lewis acid sites. The Bronsted acidity decreases with the modification of Sr because of the replacement of H ions by Sr ions. Further modification by Ni impregnation increases Lewis acidity due to the presence of NiO in the case of NiO/Sr-ZSM-5; however, after reduction, Lewis acidity decreases in Ni/Sr-ZSM-5, as observed in the Py-IR analysis. (Fig. S3) The presence of weak acidic sites favors ethylene formation; on the other hand, the strong acidic sites lead to the formation of several byproducts, as recalled in the introduction. The H2-TPR of NiO/Sr-ZSM-5 was performed prior to the reduction. The TPR profile for NiO/Sr-ZSM-5 is shown in Fig. S4. The main reduction peak is observed at a temperature of 300 °C which signifies the presence of bulk NiO particles [41]. The other small peaks at high temperature is due to the metal present at exchanged site. From the XRD pattern of NiO/Sr-ZSM-5 catalyst, the presence of small peak for NiO indicates the formation of NiO particles on the surfaces of Sr-ZSM-5 (Fig. S1). 27Al MAS-NMR spectroscopy is used to determine the local environment of aluminum species present in the zeolite structure. Both tetrahedral (AlTd) and octahedral (AlOh) types of Al can be identified by their chemical shift. The framework tetrahedral Al (AlTd) is observed at 50–60 ppm, whereas the extra framework aluminum atoms in octahedral coordination (AlOh) are usually observed at ∼0 ppm. In the case of neat H-ZSM-5, Sr-ZSM-5, the AlTd peak is centered at 58.2 ppm and AlOh at ∼2 ppm. (Fig. 7 ). The peak for AlTd is slightly shifted to 54.4 ppm after Ni impregnation. When the catalyst is reduced under hydrogen, the peak position again shifts to 58.4 ppm, and the octahedral alumina almost vanishes, indicating that the presence of Ni helps extra framework alumina to enter the framework. The surface chemical state and composition of the Ni/Sr-ZSM-5 catalysts were studied by XPS. (Fig. 8 ). Si 2p XPS spectrum shows two close peaks at around 103 and 102.7 eV, corresponding to Si-O-Si and Si-O-Al, respectively [42]. O 1 s spectrum shows two peaks; the broad peak at around 532.8 eV corresponds to lattice oxygen, and 529.1 eV is due to Si-O-Ni bonds [43]. The Al 2p and Ni 3p levels partially overlap, so the spectra were deconvoluted separately. The peak at 66.58 eV corresponds to Ni0, the peak at 67.79 eV corresponds to Ni2+, and the peak at 74 eV corresponds to Al 2p [40]. The presence of Ni2+may be due to the partial oxidation during the time gap between the reduction process and the XPS analysis. Sr 3d shows two peaks corresponding to Sr 3d3/2 and Sr 3d5/2. In the Ni 2p region, six peaks were clearly observed. The peaks at 552.7 eV and 870.3 correspond to Ni0, while the peaks at 872.6 and 855.3 eV correspond to Ni 2p½ and Ni 2p3/2 of NiO respectively, accompanied by those of their corresponding satellite peaks at 879.95 and 855.53 [44,45]. The presence of metallic Ni is the main contributor to controlling the undesired side reactions during dehydration, leading to more selective ethylene production. 5.2 Significance of the work The present study reports the dehydration of bio-derived diluted ethanol into ethylene. The ethanol concentration in feed is similar to the ethanol obtained from fermentation broth. The objective of the present investigation is to design an active catalyst able to convert dilute ethanol into ethylene selectively that may improve the economic viability of the process. The catalyst durability is, of course, tested for a prolonged time, and it is found that the prepared catalyst limits byproduct formation and leads to more ethanol conversion in comparison to the neat H-ZSM-5 catalyst. 5.3 Activity testing For catalytic dehydration, different routes are proposed, one is direct dehydration into ethylene, and another is etherification to DEE followed by ethylene formation. DEE predominates at a reaction temperature of 150–200 °C, but at high temperatures, it readily converts to ethylene. The dehydration of ethanol into ethylene involves competing for products, i.e., DEE, acetic acid, acetaldehyde, ethyl acetate, methanol, C1 C4 hydrocarbon, and H2; therefore, improved selectivity would limit ethylene purification and enhance the sustainability of the process. This study is focused on the potential of using cheaper and more sustainable bio-derived feedstock for the production of ethylene. The catalytic potential of the Ni/Sr-ZSM-5 catalyst is evaluated for catalytic dehydration of bio-derived dilute ethanol into ethylene. In order to achieve the highest ethylene selectivity with maximum ethanol conversion, the dehydration was carried out at variable reaction temperatures from 230 to 250 °C and WHSV from 3 to 12 h−1; the results are reported in Fig. 10. The metals present in the catalyst impart characteristic properties to the catalysts wherein the presence of Sr makes the catalyst hydrothermally stable, which renders it more active for catalytic dehydration of dilute ethanol, and the presence of Ni discourages the side reactions during dehydration. The Ni/Sr-ZSM-5 catalyst is effective for the production of greener ethylene with a more sustainable route. 5.3.1 Effect of reaction temperature The reaction temperature primarily affects the product distribution of ethanol dehydration. Zhang et al. [46] claimed that the formation of DEE is thermodynamically favored at 150 - 200 °C, whereas ethylene is favored above 200 °C. Most of the available literature has reported dehydration at higher temperature. For easy understanding, a compendium of literature showing temperature difference (difference between reported temperature and our reaction temperature) and obtained ethanol conversion and ethylene selectivity is made (Fig. 9 ); the same is discussed with references in Table S1. Fig. 10 (a) shows the effect of the reaction temperature on ethanol conversion and ethylene selectivity over the prepared catalyst (initial ethanol concentration = 6 wt% and WHSV = 6 h−1). Ethanol dehydration over Ni/Sr-ZSM-5 catalyst chiefly produces ethylene with trace amounts of CH4, H2, and other higher hydrocarbon byproducts. Thermal decomposition of ethanol forms the CH4, CO, and H2, while the CO2 and H2 are formed by water gas shift reaction by consuming the generated CO [47]. The oligomerization of ethylene produces higher hydrocarbon byproducts, viz.C3 – C4 hydrocarbons [48]. As depicted in Fig. 10(a), the ethanol conversion over Ni/Sr-ZSM-5 catalyst increases sharply with the temperature from 230 to 270 °C. At high temperatures, the ethanol molecules possess enough kinetic energy required to overcome the energy barrier. Ni/Sr-ZSM-5 possesses weak and medium acidic sites (Table 1), which resulted in higher ethylene selectivity. The effect of weak and medium acidity on ethylene production has also been evinced by Zhang et al. [49]. A lesser strong acidity plausibly diminishes ethylene oligomerization; therefore, the Ni/Sr-ZSM-5 catalyst lowers the selectivity of C3 C5 byproducts than H-ZSM-5, as observed in the TOS study (Table S4 of SI). Apart from acidity, the textural properties of the ZSM-5 catalyst also affect ethylene selectivity and conversion of ethanol. For H-ZSM-5, its high surface area and pore volume lead to deep traveling of reactant, increasing the contact time and thereby increasing the probability of side reactions [50]. Meanwhile, Ni/Sr-ZSM-5 catalyst has textural properties that may obstruct multiple adsorptions of reactant molecules, thereby minimizing the possibilities of ethylene oligomerization and other byproduct formation. The conversion of ethanol to ethylene was increased with the temperature from 230 to 250 °C. At 230 °C, the ethanol conversion was 79%, while at 250 °C, it raised to 99%, and on further increase in temperature to 270 °C, no significant increment in conversion was observed. At 230 °C, the ethylene selectivity was 99%; it remained the same at 250 °C but dropped to 97% as the temperature was increased to 270 °C [Fig. 10(a)]. The slight decrease in selectivity is due to the formation of other higher hydrocarbons at this temperature. It indicates that the higher temperature is not a suitable condition for selective ethanol dehydration. Therefore, 250 °C is considered an optimum temperature for selective ethanol dehydration. However, some of the studies have reported ethanol dehydration at a lower temperature (240 °C) [51]. Still, the other process parameters like high WHSV and low concentration ethanol as a feedstock make the current study more advantageous. 5.3.2 Effect of weight hourly space velocity The effect of WHSV was also studied; the WHSV was augmented from 3 to 12 h−1, and the gradual descent in conversion was observed because the contact time decreases with the rise in WHSV [Fig 10(b)]. With a fixed amount of catalyst, the finite number of active sites plausibly failed to have all ethanol molecules at higher WHSV; therefore, the ethanol conversion decreases with an increase in WHSV. At a WHSV of 6 h−1, the ethanol conversion was 99.3% with a selectivity of 99.6%, and it remained almost the same with the increase in the WHSV to 9 h−1, but the conversion was decreased to 95 with a further increase in the WHSV to 12 h−1. Therefore 9 h−1 is considered an optimum WHSV for the process. 5.3.3 Effect of ethanol concentration The concentration of ethanol was varied to evaluate the potentiality of catalytic ethanol dehydration over Ni/Sr-ZSM-5 catalyst. Ethanol derived from biomass mostly contains water and is purified via azeotropic distillation, which is energy-intensive. Direct conversion of bio-derived dilute ethanol to ethylene is an effective process since it eliminates the purification step. The catalytic dehydration of bio-derived ethanol over Ni/Sr-ZSM-5 catalyst with varied ethanol concentration (6 - 70 wt%) is depicted in Table S2. It is observed that the ethanol conversion dropped with increased ethanol concentration in the feedstock from 6 wt% to 70 wt%. Unlike ethanol conversion, no remarkable change has been seen in ethylene selectivity with varied ethanol concentrations in the feedstock. It has been observed that the prepared catalyst is more particularly active for the dehydration of dilute ethanol, which is one of the advantages of the present work. 5.3.4 Time-on-stream study At optimized reaction conditions (temp. = 250 °C, WHSV = 9 h−1, N2 flow rate = 10 mL min−1), the time-on-stream study was performed for 6 h with H-ZSM-5, Sr-ZSM-5, and Ni/Sr-ZSM-5 and the results are compared in Table S3. Further, the complete product distribution with H-ZSM-5 and Ni/Sr-ZSM-5 catalysts at optimum reaction conditions is tabulated (Table S4). The product distribution shows that Ni/Sr-ZSM-5 catalyst is better for selective ethanol dehydration than the H-ZSM-5 catalyst. The addition of a small amount of Ni controls the undesired secondary reactions for heavier olefins formation, which results in improved ethylene selectivity without compromising the ethanol conversion. The Ni/Sr-ZSM-5 catalyst also increases the rate of formation of ethylene. It was observed that the initial rate of formation was 5.33×10 −3 molgcat −1s−1 with both the catalyst, but in the case of H-ZSM-5 the rate of formation of ethylene decreases rapidly with time, whereas the decrease is lesser in the case of Ni/Sr-ZSM-5 (Fig. 11 ). After 10 h on stream, the rate of formation was found to be 5.28×10 −3 molgcat −1s−1 with Ni/Sr-ZSM-5 whereas it decreased to 4.75×10 −3 molgcat −1s−1 with neat H-ZSM-5. The coke deposition at the surface of the catalyst was also studied. Coking occurs mainly due to oligomerization and polymerization; the main issue of coking in the conversion of ethanol to ethylene is the ethylene itself, which oligomerizes and eventually turns into coke formation [52]. The strong acidic site on the solid acid catalysts is the main contributor to coke formation with the secondary reactions of produced ethylene. The coke formation can be suppressed by either controlling the strong acid sites or reducing the residence time, but that lowers the reactivity of the catalyst [53,54]. Here, the Ni reduces strong acid sites, changes their electronic environment, and therefore suppresses the byproduct formation (Table S4). The Ni/Sr-ZSM-5 is very active with high conversion and ethylene selectivity. The increase in selectivity achieved may also make the ethylene separation/purification process easier. The carbon deposition on the catalyst during the reaction was estimated by TGA; it is clear from the analysis that the Ni/Sr-ZSM-5 has lesser coke deposition in comparison to the neat H-ZSM-5 catalyst. Up to 200 °C, the weight loss is due to adsorbed water. The weight loss at a temperature range of 400–600 °C is due to carbon deposition; the weight loss is less in the case of Ni/Sr-ZSM-5 catalyst after 10 h of reaction (Fig. S5). The spent catalysts were also characterized by XRD, and it has been observed that there is a peak shift to a higher value in the case of spent H-ZSM-5; this points out the slight lattice contraction caused by dealumination. (Fig. S6). No such changes are observed in spent Ni/Sr-ZSM-5, indicating that Ni/Sr-ZSM-5 is more stable. The catalyst Ni/Sr-ZSM-5 was active for the dehydration of ethanol to ethylene even up to 30 h, as revealed by the TOS study (Fig. 12 ). The conversion was ∼96%, and the ethylene selectivity was ∼98%. The characterization of catalysts reveals that Ni increases the catalytic activity of the catalyst by suppressing the undesired byproduct formation, leading to more selective ethylene production. The selectivity achieved here can decrease the cost of ethylene separation. When complete ethanol conversion with 100% selectivity of the product is achieved, ethylene can be purified by the easy separation of water. The good hydrothermal stability also made the catalyst stable for a longer time. The hydrothermal stability caused by Sr ions was investigated by treating the ZSM-5 and Sr-ZSM-5 with steam; the detailed procedure is given in SI. After steam treatment, the catalysts were characterized by NH3-TPD, and observed that the NH3 desorption decreases in both the catalysts, but the decrease is more in the case of steam-treated H-ZSM-5 [H-ZSM-5 (ST)] than steam-treated Sr-ZSM-5 [Sr-ZSM-5 (ST)]. Also, the peak maxima for weak acidic sites decrease to a lower temperature in the case of H-ZSM-5 (ST), indicating partial dealumination (Fig. S7, S8), a similar phenomenon was observed by Fijisawa et al. [55]. 5.4 Mechanism of ethanol dehydration In zeolites, the mechanism of ethanol dehydration is a little complicated; it depends on the type of active sites and the strength of active sites involved in the dehydration. We proposed a possible mechanism for ethanol dehydration, as shown in Scheme S1. The ethanol dehydration to ethylene can occur on both Bronsted acid and Lewis acid sites. In the detailed mechanism occurring on Bronsted acid sites, the proton of Bronsted acid migrates to the O atom of ethanol, and one H atom of ethanol bonds with the neighboring electronegative skeleton O atom of the zeolite. Ethoxy groups will proceed with β-H elimination to form ethylene, accompanied by recovery of Bronsted acid sites [6]. (Scheme S1a) In the dehydration mechanism on Lewis acid sites, first, the O atom of ethanol is attached to the skeleton Al atom of zeolite that behaves as a Lewis acid site. The ethanol can dehydrate directly to ethylene with the removal of water, or another ethanol molecule is again attached, leading to the formation of diethyl ether (DEE). That can further be converted to ethanol and an ethylene molecule. (Scheme S1b) We assume that the direct dehydration of ethanol to ethylene is more prominent on Ni/Sr-ZSM-5 as no DEE formation is observed at optimized reaction conditions. 6 Conclusions The present protocol demonstrates a potential catalytic process for the conversion of bio-derived ethanol (a cheaper feedstock) for effective ethylene production. The incorporation of Sr and Ni generates an efficient catalyst for selective ethylene production from ethanol, which ensures the highest conversion at 250 °C and WHSV of 9 h−1. The Sr improves hydrothermal stability, whereas Ni loading on Sr-ZSM-5 plays an important role in selective ethylene formation by minimizing the byproduct formation. Overall, Ni/Sr-ZSM-5 has proved to be a viable catalyst that holds good catalytic activity even in the presence of water in the feedstock to produce ethylene with >98% selectivity and ∼96% conversion even after 30 h on stream. The rate of formation of ethylene is higher for Ni/Sr-ZSM-5 than for H-ZSM-5. The catalyst system of the present study provides a wide scope in dealing with bio-derived ethanol, having plenty of water for the selective production of olefins. Supplementary Information Comparison of this work with the available literature, effect of ethanol concentration on dehydration, comparison of ethanol dehydration with neat H-ZSM-5 and other prepared catalysts, detail product distribution of the dehydration reaction, TPR and XRD of NiO/Sr-ZSM-5, TEM-EDX for Ni/Sr-ZSM-5, Py-IR, NH3-TPD of ZSM-5 (ST) and Sr-ZSM-5 (ST) TGA and XRD of spent catalyst. CRediT authorship contribution statement Swati Saini: Conceptualization, Methodology, Investigation, Writing – original draft. Akash Verma: Methodology, Software, Visualization. Bhawna Sharma: Investigation, Data curation. Varsha Singh: Data curation, Investigation. Tolulope Oluokun: Formal analysis, Resources. Nagabhatla Viswanadham: Writing – review & editing, Supervision. Anjan Ray: Writing – review & editing. Umesh Kumar: Writing – review & editing, Resources, Project administration, Funding acquisition, Supervision. Declaration of Competing Interest The authors declare that they have no known competing financial interests or personal relationships that could have appeared to influence the work reported in this paper. Acknowledgments The authors are thankful to the Director CSIR - Indian Institute of Petroleum (IIP) for his constant support. The authors are also thankful to Material Resource Efficiency Division (CSIR - IIP) for providing fermentation broth to prepare feedstock for the reaction. The authors also acknowledge the Analytical Sciences Division (ASD), CSIR - IIP, for analytical support. Financial support of CSIR, New Delhi, India, is acknowledged by the author's SS (31/017(0077)/2019-EMR-I) and BS (31/017(0080)/2019-EMR-I. AV acknowledges the Department of Science and Technology (DST), New Delhi, India, for providing INSPIRE research fellowship (IF180025). TO is thankful to TWAS - CSIR for providing the fellowship. Supplementary materials Supplementary material associated with this article can be found, in the online version, at doi:10.1016/j.mcat.2023.113587. Appendix Supplementary materials Image, application 1 References [1] Statista research department, Accessed on March 24, 2023. [2] D. Fan D.-J. Dai H.-S. Wu Materials (Basel) 6 2012 101 D. Fan, D.-J. Dai, H.-S. Wu, Materials (Basel) 6 (2012) 101. [3] D. Masih S. Rohani J.N. Kondo T. Tatsumi Microporous Mesoporous Mater. 282 2019 91 D. Masih, S. Rohani, J.N. Kondo, T. Tatsumi, Microporous Mesoporous Mater. 282 (2019) 91. [4] F. Cherubini Energy. Convers. Manag. 51 2010 1412 F. Cherubini, Energy. Convers. Manag. 51 (2010) 1412. [5] H. Ayala D. Kaiser S. Pavón E. Molina J. Siguenza M. Bertau B. Lapo J. Chem. Technol. Biotechnol. 97 2022 2171 H. Ayala, D. Kaiser, S. Pavón, E. Molina, J. Siguenza, M. Bertau, B. Lapo, J. Chem. Technol. Biotechnol.97 (2022) 2171. [6] A. Tripodi M. Belotti I. Rossetti A.C.S. Sustain Chem. Eng. 7 2019 13333 A. Tripodi, M. Belotti, I. Rossetti, A.C.S. Sustain. Chem. Eng. 7 (2019) 13333. [7] Y. Han C. Lu D. Xu Y. Zhang Y. Hu H. Huang Appl. Catal. Gen. 396 2011 8 Y. Han, C. Lu, D. Xu, Y. Zhang, Y. Hu, H. Huang, Appl. Catal. Gen. 396 (2011) 8. [8] S.P. Banzaraktsaeva E.V. Ovchinnikova I.G. Danilova V.V. Danilevich V.A. Chumachenko Chem. Eng. J. 374 2019 605 S.P. Banzaraktsaeva, E.V. Ovchinnikova, I.G. Danilova, V.V. Danilevich, V.A. Chumachenko, Chem. Eng. J. 374 (2019) 605. [9] D. Varisli T. Dogu G. Dogu Chem. Eng. Sci. 62 2007 5349 D. Varisli, T. Dogu, G. Dogu, Chem. Eng. Sci. 62 (2007) 5349. [10] M. Almohalla I. Rodríguez-Ramos A. Guerrero-Ruiz Catal. Sci .Technol. 7 2017 1892 M. Almohalla, I. Rodríguez-Ramos, A. Guerrero-Ruiz, Catal. Sci .Technol. 7 (2017) 1892. [11] M. Rittiruam B. Jongsomjit S. Praserthdam Sci. Rep. 9 2019 1 M. Rittiruam, B. Jongsomjit, S. Praserthdam, Sci. Rep. 9 (2019) 1. [12] Y.W. Cheng C.C. Chong C.K. Cheng K.H. Ng T. Witoon J.C. Juan J. Clean. Prod. 249 2020 119323 Y.W. Cheng, C.C. Chong, C.K. Cheng, K.H. Ng, T. Witoon, J.C. Juan, J. Clean. Prod. 249 (2020) 119323. [13] N. Zhan Y. Hu H. Li D. Yu Y. Han H. Huang Catal. Commun. 11 2010 633 N. Zhan, Y. Hu, H. Li, D. Yu, Y. Han, H. Huang, Catal. Commun. 11 (2010) 633. [14] W.R. Moser R.W. Thompson C.C. Chiang H. Tong J. Catal. 117 1989 19 W.R. Moser, R.W. Thompson, C.C. Chiang, H. Tong, J. Catal. 117 (1989) 19. [15] A.G. Gayubo A. Alonso B. Valle A.T. Aguayo J. Bilbao Appl. Catal. B:Environ. 97 2010 299 A.G. Gayubo, A. Alonso, B. Valle, A.T. Aguayo, J. Bilbao, Appl. Catal. B:Environ. 97 (2010) 299. [16] J.C. Soh S.L. Chong C.K. Cheng Fuel Process. Tech. 158 2017 11 J.C. Soh, S.L. Chong, C.K. Cheng, Fuel Process. Tech. 158 (2017) 11. [17] T.K. Phung L.P. Hernández A. Lagazzo G. Busca Appl. Catal. A Gen. 493 2015 77 T.K. Phung, L.P. Hernández, A. Lagazzo, G. Busca, Appl. Catal. A Gen. 493 (2015) 77. [18] X. Dong D. Lu Q. Fan H. Gong Comput. Mater. Sci. 219 2023 111979 X. Dong, D. Lu, Q. Fan, H. Gong, Comput. Mater. Sci. 219 (2023) 111979. [19] C. De las Pozas R. Lopez-Cordero J.A. Gonzalez-Morales N. Travieso R. Roque-Malherbe J. Mol. Catal. 83 1993 145 C. De las Pozas, R. Lopez-Cordero, J.A. Gonzalez-Morales, N. Travieso, R. Roque-Malherbe, J. Mol. Catal. 83 (1993) 145. [20] H. Chiang A. Bhan J. Catal. 271 2010 251 H. Chiang, A. Bhan, J. Catal. 271 (2010) 251. [21] A. Morschbacker J. Macromol. Sci., Polym. rev. 49 2009 79 A. Morschbacker, J. Macromol. Sci., Polym. rev. 49 (2009) 79. [22] T.K. Phung G. Busca Chem. Eng. J. 272 2015 92 T.K. Phung, G. Busca, Chem. Eng. J. 272 (2015) 92. [23] T.K. Phung R. Radikapratama G. Garbarino A. Lagazzo P. Riani G. Busca Fuel Process. Tech. 137 2015 290 T.K. Phung, R. Radikapratama, G. Garbarino, A. Lagazzo, P. Riani, G. Busca, Fuel Process. Tech. 137 (2015) 290. [24] K.K. Ramasamy Y. Wang Catal. Today 237 2014 89 K.K. Ramasamy, Y. Wang, Catal. Today 237 (2014) 89. [25] G. Garbarino C. Wang I. Valsamakis S. Chitsazan P. Riani E. Finocchio M. Flytzani-Stephanopoulos G. Busca Appl. Catal. B: Environ. 200 2017 458 G. Garbarino, C. Wang, I. Valsamakis, S. Chitsazan, P. Riani, E. Finocchio, M. Flytzani-Stephanopoulos, G. Busca, Appl. Catal. B: Environ. 200 (2017) 458. [26] S. Golay R. Doepper A. Renken Appl. Catal. A : Gen 172 1998 97 S. Golay, R. Doepper, A. Renken, Appl. Catal. A : Gen 172 (1998) 97. [27] M.M. Doheim S.A. Hanafy G.A. El-Shobaky Mater. Lett. 55 2002 304 M.M. Doheim, S.A. Hanafy, G.A. El-Shobaky, Mater. Lett. 55 (2002) 304. [28] Y. Huang X. Dong M. Li Y. Yu Catal. Sci. Technol. 5 2015 1093 Y. Huang, X. Dong, M. Li, Y. Yu, Catal. Sci. Technol. 5 (2015) 1093. [29] I. Rossetti M. Compagnoni E. Finocchio G. Ramis A. di Michele Y. Millot S. Dzwigaj Appl. Catal. B:Environ. 210 2017 407 I. Rossetti, M. Compagnoni, E. Finocchio, G. Ramis, A. di Michele, Y. Millot, S. Dzwigaj, Appl. Catal. B:Environ. 210 (2017) 407. [30] G. Chen S. Li F. Jiao Q. Yuan Catal. Today 125 2007 111 G. Chen, S. Li, F. Jiao, Q. Yuan, Catal. Today 125 (2007) 111. [31] A. Takahashi W. Xia Q. Wu T. Furukawa I. Nakamura H. Shimada T. Fujitani Appl. Catal. A Gen. 467 2013 380 A. Takahashi, W. Xia, Q. Wu, T. Furukawa, I. Nakamura, H. Shimada, T. Fujitani, Appl. Catal. A Gen. 467 (2013) 380. [32] C.P. Nash A. Ramanathan D.A. Ruddy M. Behl E. Gjersing M. Griffin H. Zhu B. Subramaniam J.A. Schaidle J.E. Hensley Appl. Catal. A Gen. 510 2016 110 C.P. Nash, A. Ramanathan, D.A. Ruddy, M. Behl, E. Gjersing, M. Griffin, H. Zhu, B. Subramaniam, J.A. Schaidle, J.E. Hensley, Appl. Catal. A Gen. 510 (2016) 110. [33] S.K. Jesudoss J.J. Vijaya K. Kaviyarasu L.J. Kennedy R. Jothi Ramalingam H.A. Al-Lohedan RSC Adv. 8 2018 481 S.K. Jesudoss, J.J. Vijaya, K. Kaviyarasu, L.J. Kennedy, R. Jothi Ramalingam, H.A. Al-Lohedan, RSC Adv. 8 (2018) 481. [34] I.A. Bakare O. Muraza M. Yoshioka Z.H. Yamani T. Yokoi Catal. Sci. Technol. 6 2016 7852 I.A. Bakare, O. Muraza, M. Yoshioka, Z.H. Yamani, T. Yokoi, Catal. Sci. Technol. 6 (2016) 7852. [35] G. Liang, Y. Li, C. Yang, X. Hu, Q. Li, W. Zhao, RSC Adv. 11 (202) 22365. [36] K.S.W. Sing Pure Appl. Chem. 57 1985 603 K.S.W. Sing, Pure Appl. Chem. 57 (1985) 603. [37] M. Lewandowski Z. Sarbak, Fuel 79 2000 487 M. Lewandowski, Z. Sarbak, Fuel 79 (2000) 487. [38] E.H. Yuan W. Han G. Zhang K. Zhao Z. Mo G. Lu Z. Tang Catal. Surv. from Asia 20 2016 41 E.H. Yuan, W. Han, G. Zhang, K. Zhao, Z. Mo, G. Lu, Z. Tang, Catal. Surv. from Asia 20 (2016) 41. [39] Z.Y. Zakaria J. Linnekoski N.A.S. Amin Chem. Eng. J. 207 2012 803 Z.Y. Zakaria, J. Linnekoski, N.A.S. Amin, Chem. Eng. J. 207 (2012) 803. [40] A.M. Tarditi N. Barroso A.E. Galetti L.A. Arrúa L. Cornaglia M.C. Abello Surf. Interface Anal. 46 2014 521 A.M. Tarditi, N. Barroso, A.E. Galetti, L.A. Arrúa, L. Cornaglia, M.C. Abello, Surf. Interface Anal. 46 (2014) 521. [41] A.J. Maia B. Louis Y.L. Lam M.M. Pereira J. Catal. 269 2010 103 A.J. Maia, B. Louis, Y.L. Lam, M.M. Pereira, J. Catal. 269 (2010) 103. [42] A.A. Ahmed Z.H. Yamani Mater. Chem. Phys. 259 2021 124181 A.A. Ahmed, Z.H. Yamani, Mater. Chem. Phys. 259 (2021) 124181. [43] H.U. Hambali A.A. Jalil A.A. Abdulrasheed T.J. Siang T.A.T. Abdullah A. Ahmad D.V.N. Vo Int. J. Energy. Res. 44 2020 5696 H.U. Hambali, A.A. Jalil, A.A. Abdulrasheed, T.J. Siang, T.A.T. Abdullah, A. Ahmad, D.V.N. Vo, Int. J. Energy. Res. 44 (2020) 5696. [44] J. Chastain R.C. King Jr Perkin-Elmer Corp. 40 1992 221 J. Chastain, R.C. King Jr, Perkin-Elmer Corp. 40 (1992) 221. [45] C.D. Wagner L.H. Gale R.H. Raymond Anal. Chem. 51 1979 466 C.D. Wagner, L.H. Gale, R.H. Raymond, Anal. Chem. 51 (1979) 466. [46] D. Zhang R. Wang X. Yang Catal. Lett. 124 2008 384 D. Zhang, R. Wang, X. Yang, Catal. Lett. 124 (2008) 384. [47] Y.C. Sharma A. Kumar R. Prasad S.N. Upadhyay Renew. Sust. Energ. Rev. 74 2017 89 Y.C. Sharma, A. Kumar, R. Prasad, S.N. Upadhyay, Renew. Sust. Energ. Rev. 74 (2017) 89. [48] T.K. Phung G. Busca Catal. Commun. 68 2015 110 T.K. Phung, G. Busca, Catal. Commun. 68 (2015) 110. [49] X. Li H. Zhang S. Lin Y. Fang H. Xin X. Li Energy Environ. Focus 3 2014 292 X. Li, H. Zhang, S. Lin, Y. Fang, H. Xin, X. Li, Energy Environ. Focus 3 (2014) 292. [50] J.C. Soh S.L. Chong S.S. Hossain C.K. Cheng Fuel Process. Technol. 158 2017 85 J.C. Soh, S.L. Chong, S.S. Hossain, C.K. Cheng, Fuel Process. Technol. 158 (2017) 85. [51] C.-Y. Wu H.-S. Wu ACS Omega 2 2017 4287 C.-Y. Wu, H.-S. Wu, ACS Omega 2 (2017) 4287. [52] F. Wang M. Luo W. Xiao X. Cheng Y. Long Appl. Catal. A: Gen 393 2011 161 F. Wang, M. Luo, W. Xiao, X. Cheng, Y. Long, Appl. Catal. A: Gen 393 (2011) 161. [53] Q. Sheng S. Guo K. Ling L. Zhao J Braz Chem Soc 25 2014 1365 Q. Sheng, S. Guo, K. Ling, L. Zhao, J Braz Chem Soc 25 (2014) 1365. [54] A.G. Gayubo A. Alonso B. Valle A.T. Aguayo M. Olazar J. Bilbao Chem. Eng. J. 167 2011 262 A.G. Gayubo, A. Alonso, B. Valle, A.T. Aguayo, M. Olazar, J. Bilbao, Chem. Eng. J. 167 (2011) 262. [55] H.T.K. Fujisawa T. sano K. Suzuki H. Okado K. Kawamura Y. Kohtoku S. Shin H.Bull. Chem. Soc. Jpn. 60 1987 791 H.T.K. Fujisawa, T. sano, K. Suzuki, H. Okado, K. Kawamura, Y. Kohtoku, S. Shin, H.Bull. Chem. Soc. Jpn. 60, (1987) 791.",
      "scopus-id": "85174702102",
      "coredata": {
        "eid": "1-s2.0-S2468823123006703",
        "dc:description": "Ni/Sr-ZSM-5 catalyst was synthesized with tuned acidity and improved hydrothermal stability desired for the dehydration of dilute ethanol. Operating conditions were established to maximize the ethylene selectivity from ethanol dehydration by controlling side reactions, using 6% aqueous ethanol as a model feedstock for fermenter broth. Detailed characterization data of the catalyst reveals that Ni in the catalyst is responsible for the enhanced, near quantitative ethylene selectivity at optimum reaction conditions (temperature of 250 °C, 9 h−1 WHSV), the Ni/Sr-ZSM-5 catalyst exhibited >96% conversion of ethanol with 95% yield of ethylene, facilitated by discouraging undesired side reactions of ethanol. The role of Sr is observed to improve the hydrothermal stability of the catalyst, allowing it to function even in the presence of 94% water in the feed at operated reaction conditions, as evidenced by its stable operation in the studied period of 30 h without significant loss in catalytic activity. The rate of ethylene formation with Ni/Sr-ZSM-5 was 5.33×10 −3 molgcat −1s−1, which is higher than neat H-ZSM-5. This study highlights the production of ethylene from low concentration feedstock using a catalyst with enhanced catalytic activity even in the presence of water in the feedstock.",
        "openArchiveArticle": "false",
        "prism:coverDate": "2023-12-31",
        "openaccessUserLicense": null,
        "prism:aggregationType": "Journal",
        "prism:url": "https://api.elsevier.com/content/article/pii/S2468823123006703",
        "dc:creator": [
          {
            "@_fa": "true",
            "$": "Saini, Swati"
          },
          {
            "@_fa": "true",
            "$": "Verma, Akash"
          },
          {
            "@_fa": "true",
            "$": "Sharma, Bhawna"
          },
          {
            "@_fa": "true",
            "$": "Singh, Varsha"
          },
          {
            "@_fa": "true",
            "$": "Oluokun, Tolulope"
          },
          {
            "@_fa": "true",
            "$": "Viswanadham, Nagabhatla"
          },
          {
            "@_fa": "true",
            "$": "Ray, Anjan"
          },
          {
            "@_fa": "true",
            "$": "Kumar, Umesh"
          }
        ],
        "link": [
          {
            "@_fa": "true",
            "@rel": "self",
            "@href": "https://api.elsevier.com/content/article/pii/S2468823123006703"
          },
          {
            "@_fa": "true",
            "@rel": "scidir",
            "@href": "https://www.sciencedirect.com/science/article/pii/S2468823123006703"
          }
        ],
        "dc:format": "application/json",
        "openaccessType": null,
        "pii": "S2468-8231(23)00670-3",
        "prism:volume": "551",
        "articleNumber": "113587",
        "prism:publisher": "Elsevier B.V.",
        "dc:title": "Ni and Sr modified ZSM-5 catalyst with enhanced catalytic activity for selective dehydration of bio-derived ethanol to ethylene",
        "prism:copyright": "© 2023 Elsevier B.V. All rights reserved.",
        "openaccess": "0",
        "prism:issn": "24688231",
        "dcterms:subject": [
          {
            "@_fa": "true",
            "$": "Ni/Sr-ZSM-5"
          },
          {
            "@_fa": "true",
            "$": "Catalytic dehydration"
          },
          {
            "@_fa": "true",
            "$": "Bioethanol"
          },
          {
            "@_fa": "true",
            "$": "Ethylene"
          }
        ],
        "openaccessArticle": "false",
        "prism:publicationName": "Molecular Catalysis",
        "openaccessSponsorType": null,
        "prism:pageRange": "113587",
        "pubType": "fla",
        "prism:coverDisplayDate": "December 2023",
        "prism:doi": "10.1016/j.mcat.2023.113587",
        "prism:startingPage": "113587",
        "dc:identifier": "doi:10.1016/j.mcat.2023.113587",
        "openaccessSponsorName": null
      },
      "objects": {
        "object": [
          {
            "@category": "standard",
            "@height": "208",
            "@width": "282",
            "@_fa": "true",
            "$": "https://api.elsevier.com/content/object/eid/1-s2.0-S2468823123006703-gr12.jpg?httpAccept=%2A%2F%2A",
            "@multimediatype": "JPEG image file",
            "@type": "IMAGE-DOWNSAMPLED",
            "@size": "19671",
            "@ref": "gr12",
            "@mimetype": "image/jpeg"
          },
          {
            "@category": "standard",
            "@height": "287",
            "@width": "376",
            "@_fa": "true",
            "$": "https://api.elsevier.com/content/object/eid/1-s2.0-S2468823123006703-gr11.jpg?httpAccept=%2A%2F%2A",
            "@multimediatype": "JPEG image file",
            "@type": "IMAGE-DOWNSAMPLED",
            "@size": "24111",
            "@ref": "gr11",
            "@mimetype": "image/jpeg"
          },
          {
            "@category": "standard",
            "@height": "323",
            "@width": "659",
            "@_fa": "true",
            "$": "https://api.elsevier.com/content/object/eid/1-s2.0-S2468823123006703-gr10.jpg?httpAccept=%2A%2F%2A",
            "@multimediatype": "JPEG image file",
            "@type": "IMAGE-DOWNSAMPLED",
            "@size": "64926",
            "@ref": "gr10",
            "@mimetype": "image/jpeg"
          },
          {
            "@category": "standard",
            "@height": "200",
            "@width": "380",
            "@_fa": "true",
            "$": "https://api.elsevier.com/content/object/eid/1-s2.0-S2468823123006703-ga1.jpg?httpAccept=%2A%2F%2A",
            "@multimediatype": "JPEG image file",
            "@type": "IMAGE-DOWNSAMPLED",
            "@size": "29606",
            "@ref": "ga1",
            "@mimetype": "image/jpeg"
          },
          {
            "@category": "standard",
            "@height": "509",
            "@width": "376",
            "@_fa": "true",
            "$": "https://api.elsevier.com/content/object/eid/1-s2.0-S2468823123006703-gr6.jpg?httpAccept=%2A%2F%2A",
            "@multimediatype": "JPEG image file",
            "@type": "IMAGE-DOWNSAMPLED",
            "@size": "43532",
            "@ref": "gr6",
            "@mimetype": "image/jpeg"
          },
          {
            "@category": "standard",
            "@height": "572",
            "@width": "376",
            "@_fa": "true",
            "$": "https://api.elsevier.com/content/object/eid/1-s2.0-S2468823123006703-gr7.jpg?httpAccept=%2A%2F%2A",
            "@multimediatype": "JPEG image file",
            "@type": "IMAGE-DOWNSAMPLED",
            "@size": "52007",
            "@ref": "gr7",
            "@mimetype": "image/jpeg"
          },
          {
            "@category": "standard",
            "@height": "374",
            "@width": "565",
            "@_fa": "true",
            "$": "https://api.elsevier.com/content/object/eid/1-s2.0-S2468823123006703-gr9.jpg?httpAccept=%2A%2F%2A",
            "@multimediatype": "JPEG image file",
            "@type": "IMAGE-DOWNSAMPLED",
            "@size": "36516",
            "@ref": "gr9",
            "@mimetype": "image/jpeg"
          },
          {
            "@category": "standard",
            "@height": "317",
            "@width": "753",
            "@_fa": "true",
            "$": "https://api.elsevier.com/content/object/eid/1-s2.0-S2468823123006703-gr2.jpg?httpAccept=%2A%2F%2A",
            "@multimediatype": "JPEG image file",
            "@type": "IMAGE-DOWNSAMPLED",
            "@size": "84262",
            "@ref": "gr2",
            "@mimetype": "image/jpeg"
          },
          {
            "@category": "standard",
            "@height": "235",
            "@width": "376",
            "@_fa": "true",
            "$": "https://api.elsevier.com/content/object/eid/1-s2.0-S2468823123006703-gr1.jpg?httpAccept=%2A%2F%2A",
            "@multimediatype": "JPEG image file",
            "@type": "IMAGE-DOWNSAMPLED",
            "@size": "14995",
            "@ref": "gr1",
            "@mimetype": "image/jpeg"
          },
          {
            "@category": "standard",
            "@height": "162",
            "@width": "565",
            "@_fa": "true",
            "$": "https://api.elsevier.com/content/object/eid/1-s2.0-S2468823123006703-gr4.jpg?httpAccept=%2A%2F%2A",
            "@multimediatype": "JPEG image file",
            "@type": "IMAGE-DOWNSAMPLED",
            "@size": "28248",
            "@ref": "gr4",
            "@mimetype": "image/jpeg"
          },
          {
            "@category": "standard",
            "@height": "331",
            "@width": "376",
            "@_fa": "true",
            "$": "https://api.elsevier.com/content/object/eid/1-s2.0-S2468823123006703-gr3.jpg?httpAccept=%2A%2F%2A",
            "@multimediatype": "JPEG image file",
            "@type": "IMAGE-DOWNSAMPLED",
            "@size": "40549",
            "@ref": "gr3",
            "@mimetype": "image/jpeg"
          },
          {
            "@category": "standard",
            "@height": "227",
            "@width": "282",
            "@_fa": "true",
            "$": "https://api.elsevier.com/content/object/eid/1-s2.0-S2468823123006703-gr5.jpg?httpAccept=%2A%2F%2A",
            "@multimediatype": "JPEG image file",
            "@type": "IMAGE-DOWNSAMPLED",
            "@size": "25736",
            "@ref": "gr5",
            "@mimetype": "image/jpeg"
          },
          {
            "@category": "standard",
            "@height": "965",
            "@width": "747",
            "@_fa": "true",
            "$": "https://api.elsevier.com/content/object/eid/1-s2.0-S2468823123006703-gr8.jpg?httpAccept=%2A%2F%2A",
            "@multimediatype": "JPEG image file",
            "@type": "IMAGE-DOWNSAMPLED",
            "@size": "175619",
            "@ref": "gr8",
            "@mimetype": "image/jpeg"
          },
          {
            "@category": "thumbnail",
            "@height": "162",
            "@width": "219",
            "@_fa": "true",
            "$": "https://api.elsevier.com/content/object/eid/1-s2.0-S2468823123006703-gr12.sml?httpAccept=%2A%2F%2A",
            "@multimediatype": "GIF image file",
            "@type": "IMAGE-THUMBNAIL",
            "@size": "9543",
            "@ref": "gr12",
            "@mimetype": "image/gif"
          },
          {
            "@category": "thumbnail",
            "@height": "164",
            "@width": "215",
            "@_fa": "true",
            "$": "https://api.elsevier.com/content/object/eid/1-s2.0-S2468823123006703-gr11.sml?httpAccept=%2A%2F%2A",
            "@multimediatype": "GIF image file",
            "@type": "IMAGE-THUMBNAIL",
            "@size": "8085",
            "@ref": "gr11",
            "@mimetype": "image/gif"
          },
          {
            "@category": "thumbnail",
            "@height": "107",
            "@width": "219",
            "@_fa": "true",
            "$": "https://api.elsevier.com/content/object/eid/1-s2.0-S2468823123006703-gr10.sml?httpAccept=%2A%2F%2A",
            "@multimediatype": "GIF image file",
            "@type": "IMAGE-THUMBNAIL",
            "@size": "11377",
            "@ref": "gr10",
            "@mimetype": "image/gif"
          },
          {
            "@category": "thumbnail",
            "@height": "115",
            "@width": "219",
            "@_fa": "true",
            "$": "https://api.elsevier.com/content/object/eid/1-s2.0-S2468823123006703-ga1.sml?httpAccept=%2A%2F%2A",
            "@multimediatype": "GIF image file",
            "@type": "IMAGE-THUMBNAIL",
            "@size": "16698",
            "@ref": "ga1",
            "@mimetype": "image/gif"
          },
          {
            "@category": "thumbnail",
            "@height": "164",
            "@width": "121",
            "@_fa": "true",
            "$": "https://api.elsevier.com/content/object/eid/1-s2.0-S2468823123006703-gr6.sml?httpAccept=%2A%2F%2A",
            "@multimediatype": "GIF image file",
            "@type": "IMAGE-THUMBNAIL",
            "@size": "7608",
            "@ref": "gr6",
            "@mimetype": "image/gif"
          },
          {
            "@category": "thumbnail",
            "@height": "164",
            "@width": "108",
            "@_fa": "true",
            "$": "https://api.elsevier.com/content/object/eid/1-s2.0-S2468823123006703-gr7.sml?httpAccept=%2A%2F%2A",
            "@multimediatype": "GIF image file",
            "@type": "IMAGE-THUMBNAIL",
            "@size": "7981",
            "@ref": "gr7",
            "@mimetype": "image/gif"
          },
          {
            "@category": "thumbnail",
            "@height": "145",
            "@width": "219",
            "@_fa": "true",
            "$": "https://api.elsevier.com/content/object/eid/1-s2.0-S2468823123006703-gr9.sml?httpAccept=%2A%2F%2A",
            "@multimediatype": "GIF image file",
            "@type": "IMAGE-THUMBNAIL",
            "@size": "8030",
            "@ref": "gr9",
            "@mimetype": "image/gif"
          },
          {
            "@category": "thumbnail",
            "@height": "92",
            "@width": "219",
            "@_fa": "true",
            "$": "https://api.elsevier.com/content/object/eid/1-s2.0-S2468823123006703-gr2.sml?httpAccept=%2A%2F%2A",
            "@multimediatype": "GIF image file",
            "@type": "IMAGE-THUMBNAIL",
            "@size": "13064",
            "@ref": "gr2",
            "@mimetype": "image/gif"
          },
          {
            "@category": "thumbnail",
            "@height": "137",
            "@width": "219",
            "@_fa": "true",
            "$": "https://api.elsevier.com/content/object/eid/1-s2.0-S2468823123006703-gr1.sml?httpAccept=%2A%2F%2A",
            "@multimediatype": "GIF image file",
            "@type": "IMAGE-THUMBNAIL",
            "@size": "7007",
            "@ref": "gr1",
            "@mimetype": "image/gif"
          },
          {
            "@category": "thumbnail",
            "@height": "63",
            "@width": "219",
            "@_fa": "true",
            "$": "https://api.elsevier.com/content/object/eid/1-s2.0-S2468823123006703-gr4.sml?httpAccept=%2A%2F%2A",
            "@multimediatype": "GIF image file",
            "@type": "IMAGE-THUMBNAIL",
            "@size": "11021",
            "@ref": "gr4",
            "@mimetype": "image/gif"
          },
          {
            "@category": "thumbnail",
            "@height": "164",
            "@width": "186",
            "@_fa": "true",
            "$": "https://api.elsevier.com/content/object/eid/1-s2.0-S2468823123006703-gr3.sml?httpAccept=%2A%2F%2A",
            "@multimediatype": "GIF image file",
            "@type": "IMAGE-THUMBNAIL",
            "@size": "10984",
            "@ref": "gr3",
            "@mimetype": "image/gif"
          },
          {
            "@category": "thumbnail",
            "@height": "164",
            "@width": "204",
            "@_fa": "true",
            "$": "https://api.elsevier.com/content/object/eid/1-s2.0-S2468823123006703-gr5.sml?httpAccept=%2A%2F%2A",
            "@multimediatype": "GIF image file",
            "@type": "IMAGE-THUMBNAIL",
            "@size": "11485",
            "@ref": "gr5",
            "@mimetype": "image/gif"
          },
          {
            "@category": "thumbnail",
            "@height": "164",
            "@width": "127",
            "@_fa": "true",
            "$": "https://api.elsevier.com/content/object/eid/1-s2.0-S2468823123006703-gr8.sml?httpAccept=%2A%2F%2A",
            "@multimediatype": "GIF image file",
            "@type": "IMAGE-THUMBNAIL",
            "@size": "10668",
            "@ref": "gr8",
            "@mimetype": "image/gif"
          },
          {
            "@category": "high",
            "@height": "924",
            "@width": "1250",
            "@_fa": "true",
            "$": "https://api.elsevier.com/content/object/eid/1-s2.0-S2468823123006703-gr12_lrg.jpg?httpAccept=%2A%2F%2A",
            "@multimediatype": "JPEG image file",
            "@type": "IMAGE-HIGH-RES",
            "@size": "170086",
            "@ref": "gr12",
            "@mimetype": "image/jpeg"
          },
          {
            "@category": "high",
            "@height": "1271",
            "@width": "1667",
            "@_fa": "true",
            "$": "https://api.elsevier.com/content/object/eid/1-s2.0-S2468823123006703-gr11_lrg.jpg?httpAccept=%2A%2F%2A",
            "@multimediatype": "JPEG image file",
            "@type": "IMAGE-HIGH-RES",
            "@size": "172842",
            "@ref": "gr11",
            "@mimetype": "image/jpeg"
          },
          {
            "@category": "high",
            "@height": "1431",
            "@width": "2917",
            "@_fa": "true",
            "$": "https://api.elsevier.com/content/object/eid/1-s2.0-S2468823123006703-gr10_lrg.jpg?httpAccept=%2A%2F%2A",
            "@multimediatype": "JPEG image file",
            "@type": "IMAGE-HIGH-RES",
            "@size": "458655",
            "@ref": "gr10",
            "@mimetype": "image/jpeg"
          },
          {
            "@category": "high",
            "@height": "886",
            "@width": "1685",
            "@_fa": "true",
            "$": "https://api.elsevier.com/content/object/eid/1-s2.0-S2468823123006703-ga1_lrg.jpg?httpAccept=%2A%2F%2A",
            "@multimediatype": "JPEG image file",
            "@type": "IMAGE-HIGH-RES",
            "@size": "205599",
            "@ref": "ga1",
            "@mimetype": "image/jpeg"
          },
          {
            "@category": "high",
            "@height": "2256",
            "@width": "1667",
            "@_fa": "true",
            "$": "https://api.elsevier.com/content/object/eid/1-s2.0-S2468823123006703-gr6_lrg.jpg?httpAccept=%2A%2F%2A",
            "@multimediatype": "JPEG image file",
            "@type": "IMAGE-HIGH-RES",
            "@size": "294729",
            "@ref": "gr6",
            "@mimetype": "image/jpeg"
          },
          {
            "@category": "high",
            "@height": "2534",
            "@width": "1667",
            "@_fa": "true",
            "$": "https://api.elsevier.com/content/object/eid/1-s2.0-S2468823123006703-gr7_lrg.jpg?httpAccept=%2A%2F%2A",
            "@multimediatype": "JPEG image file",
            "@type": "IMAGE-HIGH-RES",
            "@size": "878685",
            "@ref": "gr7",
            "@mimetype": "image/jpeg"
          },
          {
            "@category": "high",
            "@height": "1655",
            "@width": "2500",
            "@_fa": "true",
            "$": "https://api.elsevier.com/content/object/eid/1-s2.0-S2468823123006703-gr9_lrg.jpg?httpAccept=%2A%2F%2A",
            "@multimediatype": "JPEG image file",
            "@type": "IMAGE-HIGH-RES",
            "@size": "240438",
            "@ref": "gr9",
            "@mimetype": "image/jpeg"
          },
          {
            "@category": "high",
            "@height": "1401",
            "@width": "3333",
            "@_fa": "true",
            "$": "https://api.elsevier.com/content/object/eid/1-s2.0-S2468823123006703-gr2_lrg.jpg?httpAccept=%2A%2F%2A",
            "@multimediatype": "JPEG image file",
            "@type": "IMAGE-HIGH-RES",
            "@size": "713245",
            "@ref": "gr2",
            "@mimetype": "image/jpeg"
          },
          {
            "@category": "high",
            "@height": "1040",
            "@width": "1667",
            "@_fa": "true",
            "$": "https://api.elsevier.com/content/object/eid/1-s2.0-S2468823123006703-gr1_lrg.jpg?httpAccept=%2A%2F%2A",
            "@multimediatype": "JPEG image file",
            "@type": "IMAGE-HIGH-RES",
            "@size": "96834",
            "@ref": "gr1",
            "@mimetype": "image/jpeg"
          },
          {
            "@category": "high",
            "@height": "716",
            "@width": "2500",
            "@_fa": "true",
            "$": "https://api.elsevier.com/content/object/eid/1-s2.0-S2468823123006703-gr4_lrg.jpg?httpAccept=%2A%2F%2A",
            "@multimediatype": "JPEG image file",
            "@type": "IMAGE-HIGH-RES",
            "@size": "365253",
            "@ref": "gr4",
            "@mimetype": "image/jpeg"
          },
          {
            "@category": "high",
            "@height": "1466",
            "@width": "1667",
            "@_fa": "true",
            "$": "https://api.elsevier.com/content/object/eid/1-s2.0-S2468823123006703-gr3_lrg.jpg?httpAccept=%2A%2F%2A",
            "@multimediatype": "JPEG image file",
            "@type": "IMAGE-HIGH-RES",
            "@size": "560139",
            "@ref": "gr3",
            "@mimetype": "image/jpeg"
          },
          {
            "@category": "high",
            "@height": "1006",
            "@width": "1250",
            "@_fa": "true",
            "$": "https://api.elsevier.com/content/object/eid/1-s2.0-S2468823123006703-gr5_lrg.jpg?httpAccept=%2A%2F%2A",
            "@multimediatype": "JPEG image file",
            "@type": "IMAGE-HIGH-RES",
            "@size": "182930",
            "@ref": "gr5",
            "@mimetype": "image/jpeg"
          },
          {
            "@category": "high",
            "@height": "4276",
            "@width": "3309",
            "@_fa": "true",
            "$": "https://api.elsevier.com/content/object/eid/1-s2.0-S2468823123006703-gr8_lrg.jpg?httpAccept=%2A%2F%2A",
            "@multimediatype": "JPEG image file",
            "@type": "IMAGE-HIGH-RES",
            "@size": "1288172",
            "@ref": "gr8",
            "@mimetype": "image/jpeg"
          },
          {
            "@category": "standard",
            "@_fa": "true",
            "$": "https://api.elsevier.com/content/object/eid/1-s2.0-S2468823123006703-mmc1.docx?httpAccept=%2A%2F%2A",
            "@multimediatype": "Microsoft Word file",
            "@type": "APPLICATION",
            "@size": "2063060",
            "@ref": "mmc1",
            "@mimetype": "application/word"
          },
          {
            "@category": "thumbnail",
            "@_fa": "true",
            "$": "https://api.elsevier.com/content/object/eid/1-s2.0-S2468823123006703-si1.svg?httpAccept=%2A%2F%2A",
            "@multimediatype": "Scalable Vector Graphics file",
            "@type": "ALTIMG",
            "@size": "17407",
            "@ref": "si1",
            "@mimetype": "image/svg+xml"
          },
          {
            "@category": "thumbnail",
            "@_fa": "true",
            "$": "https://api.elsevier.com/content/object/eid/1-s2.0-S2468823123006703-si2.svg?httpAccept=%2A%2F%2A",
            "@multimediatype": "Scalable Vector Graphics file",
            "@type": "ALTIMG",
            "@size": "19649",
            "@ref": "si2",
            "@mimetype": "image/svg+xml"
          },
          {
            "@category": "thumbnail",
            "@_fa": "true",
            "$": "https://api.elsevier.com/content/object/eid/1-s2.0-S2468823123006703-si3.svg?httpAccept=%2A%2F%2A",
            "@multimediatype": "Scalable Vector Graphics file",
            "@type": "ALTIMG",
            "@size": "13134",
            "@ref": "si3",
            "@mimetype": "image/svg+xml"
          },
          {
            "@category": "standard",
            "@_fa": "true",
            "$": "https://api.elsevier.com/content/object/eid/1-s2.0-S2468823123006703-am.pdf?httpAccept=%2A%2F%2A",
            "@multimediatype": "Acrobat PDF file",
            "@type": "AAM-PDF",
            "@size": "3055857",
            "@ref": "am",
            "@mimetype": "application/pdf"
          }
        ]
      },
      "link": {
        "@rel": "abstract",
        "@href": "https://api.elsevier.com/content/abstract/scopus_id/85174702102"
      }
    }
  }
}