{
  "metadata": {
    "title": "Nano-Co<ce:inf loc=post>3</ce:inf>O<ce:inf loc=post>4</ce:inf> supported on magnetic N-doped graphene as highly efficient catalyst for epoxidation of alkenes",
    "authors": "; ; ",
    "journal": "Molecular Catalysis",
    "date": "2017-05-31",
    "doi": "10.1016/j.mcat.2017.02.001",
    "abstract": "",
    "uri": "https://api.elsevier.com/content/article/pii/S2468823117300597",
    "pii": "S2468823117300597"
  },
  "fulltext": {
    "full-text-retrieval-response": {
      "scopus-eid": "2-s2.0-85029616522",
      "originalText": "serial JL 315758 291210 291744 291790 291809 31 Molecular Catalysis MOLECULARCATALYSIS 2017-03-22 2017-03-31 2017-03-22 2017-03-31 2017-03-22T06:16:05 1-s2.0-S2468823117300597 S2468-8231(17)30059-7 S2468823117300597 10.1016/j.mcat.2017.02.001 S300 S300.1 FULL-TEXT 1-s2.0-S2468823117X00060 2021-10-25T08:02:11.162638Z 0 0 20170501 20170531 2017 2017-03-22T08:47:50.388299Z absattachment articleinfo articletitlenorm authfirstinitialnorm authfirstsurnamenorm cid cids contenttype copyright crossmark dateloaded dateloadedtxt datesearch datesort dateupdated dco docsubtype doctype doi eid ewtransactionid hubeid indexeddate issn issnnorm itemstage itemtransactionid itemweight openaccess openarchive pg pgfirst pglast pii piinorm pubdateend pubdatestart pubdatetxt pubyr sectiontitle sortorder srctitle srctitlenorm srctype ssids content subj subheadings suppl tomb volfirst volissue volumelist webpdf webpdfpagecount yearnav figure table e-component body acknowledge affil appendices articletitle auth authfirstini authfull authkeywords authlast highlightsabst primabst ref specialabst 2468-8231 24688231 true 432 432 C Volume 432 31 267 273 267 273 201705 May 2017 2017-05-01 2017-05-31 2017 Regular Papers article fla © 2017 Elsevier B.V. All rights reserved. NANOCO3O4SUPPORTEDMAGNETICNDOPEDGRAPHENEHIGHLYEFFICIENTCATALYSTFOREPOXIDATIONALKENES LI Z 1 Introduction 2 Experimental 2.1 Materials and characterization 2.2 Synthetic procedures (Scheme 1) 2.2.1 Catalyst preparation 2.3 Catalytic tests 3 Results and discussion 3.1 Structural characteristics of catalysts 3.2 Spectroscopy characterization 3.3 XPS studies 3.4 Magnetization studies 3.5 Catalytic tests 4 Conclusions Acknowledgements Appendix A Supplementary data References WANG 2011 30 39 L BHATTACHARJEE 2006 103 110 S TYAGI 2010 161 168 B TANG 2005 384 397 Q CHOUDHARY 2013 217 224 V LIU 2010 550 552 Y CHEN 2016 3354 3359 Z VANOYE 2016 4724 4732 L RAYATI 2008 65 71 S GINOTRA 2006 3573 3581 S QI 2011 44 51 B MUKHERJEE 2006 79 88 S VISUVAMITHIRAN 2013 31 38 P HUANG 2012 10661 10669 J GENG 2014 2965 2967 L AN 2014 6830 6833 K ALHUMAIMESS 2014 1701 1710 M WANG 2007 2415 2418 X HE 2006 1078 1082 T NAM 2006 885 888 K VARGHESE 2007 1932 1939 B LI 2008 265 270 Y CUI 2010 45 53 H NIE 2013 9037 9045 R NONGWE 2013 1 8 I QIE 2012 2047 2050 L WEI 2013 2322 2328 J YANG 2014 268 277 Y VINU 2008 816 827 A CHEN 2009 4093 4095 X LI 2013 6593 6604 X MUNGSE 2012 5427 5433 H FAN 2012 25108 25115 W ZHOU 2010 5306 5313 G WU 2012 2478 2483 S LI 2013 488 497 X KONG 2011 35 42 L NIETOMARQUEZ 2011 1664 1672 A HU 2010 813 828 B YE 2013 5887 5895 Y KRISHNAMOORTHY 2013 38 49 K CHOUDHARY 2012 21032 21039 S AI 2011 1515 1524 L CHOI 2012 5924 5930 B ZHANG 2013 1745 1753 W ZHU 2013 1154 1164 Z WANG 2010 1325 1327 Z JIN 2013 10538 10545 J WU 2010 3187 3194 Z SONG 2013 20179 20185 C HE 2010 3139 3144 F BRUNO 2007 185 194 S LU 2015 219 224 N SHIT 2014 103 110 S JINKA 2010 638 642 K SUN 2014 1246 1252 J DATTA 2015 897 905 S LIX2017X267 LIX2017X267X273 LIX2017X267XZ LIX2017X267X273XZ 2019-03-31T00:00:00Z http://creativecommons.org/licenses/by-nc-nd/4.0/ © 2017 Elsevier B.V. All rights reserved. 0 item S2468-8231(17)30059-7 S2468823117300597 1-s2.0-S2468823117300597 10.1016/j.mcat.2017.02.001 315758 2017-03-31T19:14:32.79547-04:00 2017-05-01 2017-05-31 1-s2.0-S2468823117300597-main.pdf https://s3-eu-west-1.amazonaws.com/prod-ucs-content-store-eu-west/content/pii:S2468823117300597/MAIN/application/pdf/a981d0158eba3357e3fe4dbc1d3ec0d8/main.pdf https://s3.amazonaws.com/prod-ucs-content-store-us-east/content/pii:S2468823117300597/MAIN/application/pdf/a981d0158eba3357e3fe4dbc1d3ec0d8/main.pdf main.pdf pdf true 1703647 MAIN 7 1-s2.0-S2468823117300597-main_1.png https://s3-eu-west-1.amazonaws.com/prod-ucs-content-store-eu-west/content/pii:S2468823117300597/PREVIEW/image/png/89d78802e7d96f0d8e24ea4a2a5a8483/main_1.png https://s3.amazonaws.com/prod-ucs-content-store-us-east/content/pii:S2468823117300597/PREVIEW/image/png/89d78802e7d96f0d8e24ea4a2a5a8483/main_1.png main_1.png png 55244 849 656 IMAGE-WEB-PDF 1 1-s2.0-S2468823117300597-fx1.sml https://s3-eu-west-1.amazonaws.com/prod-ucs-content-store-eu-west/content/pii:S2468823117300597/fx1/THUMBNAIL/image/gif/fffdcc9f42cd3a53a1fcefc56115c26e/fx1.sml https://s3.amazonaws.com/prod-ucs-content-store-us-east/content/pii:S2468823117300597/fx1/THUMBNAIL/image/gif/fffdcc9f42cd3a53a1fcefc56115c26e/fx1.sml fx1 true fx1.sml sml 3126 88 219 IMAGE-THUMBNAIL 1-s2.0-S2468823117300597-gr1.sml https://s3-eu-west-1.amazonaws.com/prod-ucs-content-store-eu-west/content/pii:S2468823117300597/gr1/THUMBNAIL/image/gif/1c9015cfc1acad3c0984620fa97c959c/gr1.sml https://s3.amazonaws.com/prod-ucs-content-store-us-east/content/pii:S2468823117300597/gr1/THUMBNAIL/image/gif/1c9015cfc1acad3c0984620fa97c959c/gr1.sml gr1 gr1.sml sml 10734 164 182 IMAGE-THUMBNAIL 1-s2.0-S2468823117300597-gr2.sml https://s3-eu-west-1.amazonaws.com/prod-ucs-content-store-eu-west/content/pii:S2468823117300597/gr2/THUMBNAIL/image/gif/1add89fb509388c306f6e667d3d91397/gr2.sml https://s3.amazonaws.com/prod-ucs-content-store-us-east/content/pii:S2468823117300597/gr2/THUMBNAIL/image/gif/1add89fb509388c306f6e667d3d91397/gr2.sml gr2 gr2.sml sml 8618 162 65 IMAGE-THUMBNAIL 1-s2.0-S2468823117300597-gr3.sml https://s3-eu-west-1.amazonaws.com/prod-ucs-content-store-eu-west/content/pii:S2468823117300597/gr3/THUMBNAIL/image/gif/b082602223a3fdbf63f9bd4b3071b907/gr3.sml https://s3.amazonaws.com/prod-ucs-content-store-us-east/content/pii:S2468823117300597/gr3/THUMBNAIL/image/gif/b082602223a3fdbf63f9bd4b3071b907/gr3.sml gr3 gr3.sml sml 8347 163 183 IMAGE-THUMBNAIL 1-s2.0-S2468823117300597-gr4.sml https://s3-eu-west-1.amazonaws.com/prod-ucs-content-store-eu-west/content/pii:S2468823117300597/gr4/THUMBNAIL/image/gif/8e7a024c1b8fa2787d0a9a47a90bf052/gr4.sml https://s3.amazonaws.com/prod-ucs-content-store-us-east/content/pii:S2468823117300597/gr4/THUMBNAIL/image/gif/8e7a024c1b8fa2787d0a9a47a90bf052/gr4.sml gr4 gr4.sml sml 6065 164 182 IMAGE-THUMBNAIL 1-s2.0-S2468823117300597-gr5.sml https://s3-eu-west-1.amazonaws.com/prod-ucs-content-store-eu-west/content/pii:S2468823117300597/gr5/THUMBNAIL/image/gif/b68ab86e4a2aa158d095c9fb388110e4/gr5.sml https://s3.amazonaws.com/prod-ucs-content-store-us-east/content/pii:S2468823117300597/gr5/THUMBNAIL/image/gif/b68ab86e4a2aa158d095c9fb388110e4/gr5.sml gr5 gr5.sml sml 6852 163 118 IMAGE-THUMBNAIL 1-s2.0-S2468823117300597-gr6.sml https://s3-eu-west-1.amazonaws.com/prod-ucs-content-store-eu-west/content/pii:S2468823117300597/gr6/THUMBNAIL/image/gif/89fa6484b7400b212f4cbd6d8f670bb7/gr6.sml https://s3.amazonaws.com/prod-ucs-content-store-us-east/content/pii:S2468823117300597/gr6/THUMBNAIL/image/gif/89fa6484b7400b212f4cbd6d8f670bb7/gr6.sml gr6 gr6.sml sml 7115 164 197 IMAGE-THUMBNAIL 1-s2.0-S2468823117300597-sc1.sml https://s3-eu-west-1.amazonaws.com/prod-ucs-content-store-eu-west/content/pii:S2468823117300597/sc1/THUMBNAIL/image/gif/635c8cf29c0f00f74eb5ca075d3e2fe2/sc1.sml https://s3.amazonaws.com/prod-ucs-content-store-us-east/content/pii:S2468823117300597/sc1/THUMBNAIL/image/gif/635c8cf29c0f00f74eb5ca075d3e2fe2/sc1.sml sc1 sc1.sml sml 10138 164 152 IMAGE-THUMBNAIL 1-s2.0-S2468823117300597-fx1.jpg https://s3-eu-west-1.amazonaws.com/prod-ucs-content-store-eu-west/content/pii:S2468823117300597/fx1/DOWNSAMPLED/image/jpeg/4ce3d1bf625615e780fdbbf9c678616d/fx1.jpg https://s3.amazonaws.com/prod-ucs-content-store-us-east/content/pii:S2468823117300597/fx1/DOWNSAMPLED/image/jpeg/4ce3d1bf625615e780fdbbf9c678616d/fx1.jpg fx1 true fx1.jpg jpg 9662 200 500 IMAGE-DOWNSAMPLED 1-s2.0-S2468823117300597-gr1.jpg https://s3-eu-west-1.amazonaws.com/prod-ucs-content-store-eu-west/content/pii:S2468823117300597/gr1/DOWNSAMPLED/image/jpeg/27898611104fb1243013b1c8fc665bd2/gr1.jpg https://s3.amazonaws.com/prod-ucs-content-store-us-east/content/pii:S2468823117300597/gr1/DOWNSAMPLED/image/jpeg/27898611104fb1243013b1c8fc665bd2/gr1.jpg gr1 gr1.jpg jpg 27240 237 263 IMAGE-DOWNSAMPLED 1-s2.0-S2468823117300597-gr2.jpg https://s3-eu-west-1.amazonaws.com/prod-ucs-content-store-eu-west/content/pii:S2468823117300597/gr2/DOWNSAMPLED/image/jpeg/d2840d87f3eb9177590975443b2c7fab/gr2.jpg https://s3.amazonaws.com/prod-ucs-content-store-us-east/content/pii:S2468823117300597/gr2/DOWNSAMPLED/image/jpeg/d2840d87f3eb9177590975443b2c7fab/gr2.jpg gr2 gr2.jpg jpg 116580 940 376 IMAGE-DOWNSAMPLED 1-s2.0-S2468823117300597-gr3.jpg https://s3-eu-west-1.amazonaws.com/prod-ucs-content-store-eu-west/content/pii:S2468823117300597/gr3/DOWNSAMPLED/image/jpeg/fa24998e177798d4df09c335cc2f9f8e/gr3.jpg https://s3.amazonaws.com/prod-ucs-content-store-us-east/content/pii:S2468823117300597/gr3/DOWNSAMPLED/image/jpeg/fa24998e177798d4df09c335cc2f9f8e/gr3.jpg gr3 gr3.jpg jpg 21517 235 263 IMAGE-DOWNSAMPLED 1-s2.0-S2468823117300597-gr4.jpg https://s3-eu-west-1.amazonaws.com/prod-ucs-content-store-eu-west/content/pii:S2468823117300597/gr4/DOWNSAMPLED/image/jpeg/3e5575e5552378cc203672cc50773df8/gr4.jpg https://s3.amazonaws.com/prod-ucs-content-store-us-east/content/pii:S2468823117300597/gr4/DOWNSAMPLED/image/jpeg/3e5575e5552378cc203672cc50773df8/gr4.jpg gr4 gr4.jpg jpg 15857 237 263 IMAGE-DOWNSAMPLED 1-s2.0-S2468823117300597-gr5.jpg https://s3-eu-west-1.amazonaws.com/prod-ucs-content-store-eu-west/content/pii:S2468823117300597/gr5/DOWNSAMPLED/image/jpeg/7f08c07161e77c654dc3dda661e3d0c9/gr5.jpg https://s3.amazonaws.com/prod-ucs-content-store-us-east/content/pii:S2468823117300597/gr5/DOWNSAMPLED/image/jpeg/7f08c07161e77c654dc3dda661e3d0c9/gr5.jpg gr5 gr5.jpg jpg 81075 677 489 IMAGE-DOWNSAMPLED 1-s2.0-S2468823117300597-gr6.jpg https://s3-eu-west-1.amazonaws.com/prod-ucs-content-store-eu-west/content/pii:S2468823117300597/gr6/DOWNSAMPLED/image/jpeg/8b136d6c5c7226d46df4855aeb3b6004/gr6.jpg https://s3.amazonaws.com/prod-ucs-content-store-us-east/content/pii:S2468823117300597/gr6/DOWNSAMPLED/image/jpeg/8b136d6c5c7226d46df4855aeb3b6004/gr6.jpg gr6 gr6.jpg jpg 10671 219 263 IMAGE-DOWNSAMPLED 1-s2.0-S2468823117300597-sc1.jpg https://s3-eu-west-1.amazonaws.com/prod-ucs-content-store-eu-west/content/pii:S2468823117300597/sc1/DOWNSAMPLED/image/jpeg/e93f8de8c481bd64980a88f0323debdb/sc1.jpg https://s3.amazonaws.com/prod-ucs-content-store-us-east/content/pii:S2468823117300597/sc1/DOWNSAMPLED/image/jpeg/e93f8de8c481bd64980a88f0323debdb/sc1.jpg sc1 sc1.jpg jpg 39531 406 376 IMAGE-DOWNSAMPLED 1-s2.0-S2468823117300597-mmc1.docx https://s3-eu-west-1.amazonaws.com/prod-ucs-content-store-eu-west/content/pii:S2468823117300597/mmc1/MAIN/application/msword/ce6e417190e7a440ec6073d9cf7a2321/mmc1.docx https://s3.amazonaws.com/prod-ucs-content-store-us-east/content/pii:S2468823117300597/mmc1/MAIN/application/msword/ce6e417190e7a440ec6073d9cf7a2321/mmc1.docx mmc1 mmc1.docx docx 124796 APPLICATION MCAT 31 S2468-8231(17)30059-7 10.1016/j.mcat.2017.02.001 Elsevier B.V. Scheme 1 A schematic illustration of the formation of the Co3O4 supported on N-doped graphene/Fe3O4@carbon. Scheme 1 Fig. 1 XRD patterns of (a) RGO/Fe3O4, (b) RGO/Fe3O4@C, (c) Co3O4, (d) RGO/Fe3O4@C-N-Co3O4, (e) RGO/Fe3O4@C-Co3O4. Fig. 1 Fig. 2 TEM (a, b), HRTEM (c, d) EDX mapping images of RGO-Fe3O4@C-N-Co3O4 and TEM image of RGO-Fe3O4@C-Co3O4 (e). Fig. 2 Fig. 3 FT-IR spectra of (a) GO, (b) RGO/Fe3O4, (c) RGO/Fe3O4@C, (d) RGO/Fe3O4@C-N-Co3O4 and (e) RGO/Fe3O4@C-Co3O4. Fig. 3 Fig. 4 Raman spectra of (a) GO, (b) RGO/Fe3O4@C, (c) RGO/Fe3O4@C-N-Co3O4 and (d) RGO/Fe3O4@C-Co3O4. Fig. 4 Fig. 5 XPS spectra of Fe2p (a) RGO/Fe3O4 and (b) RGO/Fe3O4@C, C1s (c) GO, (d) RGO/Fe3O4@C-N-Co3O4 and (e) RGO/Fe3O4@C-Co3O4, N1s (d) RGO/Fe3O4@C-N-Co3O4, Co2p (d) RGO/Fe3O4@C-N-Co3O4 and (e) RGO/Fe3O4@C-Co3O4. Fig. 5 Fig. 6 Magnetization curves of RGO/Fe3O4@C-N-Co3O4. Fig. 6 Table 1 Catalytic data of various catalysts in aerobic epoxidation of alkenes. Table 1 Entry Catalysts Cycle Substrate Conversion (%) Product selectivity f (mol%) Epoxide Bza Others 1 a RGO-Fe3O4@C-N-Co3O4 1 Styrene 93.2 88.4 9.2 2.4 2 a RGO-Fe3O4@C-N-Co3O4 2 Styrene 89.4 89.9 7.7 2.4 3 a RGO-Fe3O4@C-N-Co3O4 3 Styrene 85.7 84.3 15.7 0 4 a RGO-Fe3O4@C-N-Co3O4 4 Styrene 84.1 82.0 18.0 0 5 b RGO-Fe3O4@C-N-Co3O4 1 Styrene 87.0 90.1 9.9 0 6 c RGO-Fe3O4@C-N-Co3O4 1 Styrene 85.9 83.6 14.5 1.9 7 d RGO-Fe3O4@C-N-Co3O4 1 Styrene 50.2 78.1 20.8 1.1 8 e RGO-Fe3O4@C-N-Co3O4 1 Styrene 95.0 86.4 13.6 0 9 a RGO-Fe3O4@C-N-Co3O4 1 Cyclooctene >99 >99 0 trace 10 a RGO-Fe3O4@C-Co3O4 1 Styrene 61.0 81.5 16.6 1.9 11 a RGO-Fe3O4@C 1 Styrene 1.3 0 >99 0 12 a Co3O4 1 Styrene 83.1 88.7 8.9 2.4 13 a Fe3O4 1 Styrene 30.1 71.1 28.9 0 a Reaction conditions: catalyst 10mg, styrene 8mmol, DMF 25mL, flow of air 80mL/min, temperature 100°C and time 8h. b The amount of catalyst is 20mg. c The amount of catalyst is 30mg. d The reaction was carried out at 80°C. e The reaction was carried out at 120°C. f Bza: benzaldehyde; Others: including benzoic acid, phenylacetaldehyde, etc. Table 2 A comparison of catalytic performances on aerobic styrene epoxidation of RGO-Fe3O4@C-N-Co3O4 with other related Co systems. Table 2 Catalysts Conversion (%) Epoxide selectivity (%) References RGO-Fe3O4@C-N-Co3O4 93.2 88.4 This work CoSalen-LDH-del 79.5 60.1 [53] [Co(L)(HL)(NCS)]·ClO4 69 53.6 [54] [Co(L)(HL)(N3)]·ClO4 78 55.1 [54] Co-E10-26 100 24 [57] Co2+-NaX 44 60 [4] Co-SSZ-S-10 24 62 [55] Fe3O4@SiO2-NH2-Co 90.8 63.7 [56] Nano-Co3O4 supported on magnetic N-doped graphene as highly efficient catalyst for epoxidation of alkenes Zhifang Li a b Shujie Wu a Changlong Yang b Yuanyuan Ma c Xiaoran Fu a Ling Peng a Jingqi Guan a ⁎ Qiubin Kan a ⁎ a College of Chemistry, Jilin University, Changchun, 130023, China College of Chemistry Jilin University Changchun 130023 China b College of Materials Science and Engineering, Qiqihar University, Qiqihar 161006, China College of Materials Science and Engineering Qiqihar University Qiqihar 161006 China c Key Laboratory of Fine Chemicals of College of Heilongjiang Province, Qiqihar University, Qiqihar 161006, China Key Laboratory of Fine Chemicals of College of Heilongjiang Province Qiqihar University Qiqihar 161006 China ⁎ Corresponding authors. Graphical abstract Novel core@shellstructuredmagneticnanocatalystsinvolvingN-dopedhybridizationofgraphenesheetsandcarbon-coatedFe3O4nanoparticles(RGO/Fe3O4@C-N) immobilized Co3O4 were prepared by a facile, green and efficient chemical approach and used as efficient heterogeneous catalysts for aerobic oxidation of styrene using air as oxidant without any reducing agent. RGO/Fe3O4@C-N-Co3O4 Exhibits 93.2% conversion of styrene and 88.4% selectivity to the styrene oxide and shows excellent recoverability without loss in activity and selectivity within successive runs. Besides, the synthesized catalyst can be easily recovered via simple magnetic separation and be reused for many times. The epoxidation of alkenes to the corresponding epoxides plays a vital role in fine chemical engineering. Magnetic nanocomposite catalyst RGO/Fe3O4@C-N-Co3O4 (RGO: reduced graphene oxide) involving Co3O4 nanoparticles immobilized on magnetic N-doped graphene was prepared by a hydrothermal method. N-dopants in the RGO/Fe3O4@C-N-Co3O4 can strengthen the interaction between Co3O4 nanoparticles and the support. RGO/Fe3O4@C-N-Co3O4 revealed higher catalytic reactivity (i.e. 93.2% conversion of styrene and 88.4% selectivity to styrene oxide) as compared to bulk Co3O4, and Co3O4 supported on N-free RGO/Fe3O4@C due to site-isolation, good dispersion of Co3O4 nanoparticles and efficiently synergistic effect between Co3O4 and the magnetic support. In addition, the catalyst displayed good recoverability by simple magnetic separation with negligible loss in activity and selectivity within several successive runs due to superparamagnetism. Keywords Graphene Fe3O4 Co3O4 Air Styrene 1 Introduction The selective epoxidation of alkenes to the corresponding epoxides is of great interest and importance due to its utility in flexible intermediates [1] and precursors for many useful chemical products such as drugs, agrochemicals, food additives, perfume materials and sweeteners [2,3]. For achieving high selectivity to epoxides, H2O2, TBHP or peracids was usually used as oxidant for the oxidation of alkenes [4–6]. Nonetheless, these oxidants are expensive, corrosive and unsafe and might create much serious pollution and lots of waste due to formation of undesirable products in the oxidation process. In recent years, environmental legislation has increasingly imposed stringent targets for permitted levels of pollutants. In order to meet the increasing demand for epoxides and satisfy environmental requirements, green and clear air was used as a very attractive and desirable oxidant for the epoxidation of alkenes. In most cases, a sacrificial co-reductant (i.e. aldehyde) or a promoter was used to obtain high yield and selectivity [7,8]. Up to now, the use of molecular oxygen without any co-reductant in epoxidation of alkenes is still a challenge. Many transition metal (e.g. Co, Cu and V) compounds are active homogeneous catalysts for the oxidation of alkenes [9–11]. However, the homogenous catalysts have some shortcomings in separation of the product, regeneration and recovery of the catalysts. The heterogenization of homogeneous catalysts on solid supports can address these issues. For instance, the immobilized Schiff base copper complex catalyst is active in the liquid phase partial oxidation of cyclohexene using aqueous H2O2 or tert-butylhydroperoxide (TBHP) as oxidant [12]. The immobilization of Co-Salen complex onto amine functionalized mesoporous KIT-6 is found to be an efficient and selective catalyst for the epoxidation of olefins [13]. Luo et al. reported the catalytic asymmetric epoxidation of olefins was catalyzed by a series of chiral salen Mn(III) immobilized onto azole onium modified zinc poly(styrene-phenylvinyl phosphonate)-phosphate (ZnPS-PVPA) using NaIO4 as an oxidant [14]. Recently, Co, Fe, Pt and Au nanoparticles (NPs) are widely used in a series of epoxidation reactions [5,15–17]. For example, Au nanoparticles were highly dispersed in the mesopore of (s)-(−)-2-pyrrolidinone-5-carboxylic acid (Py)-modified SBA-15 (Au/SBA-15-Py), which manifested superior catalytic properties in the oxidation of cyclohexene and styrene by molecular oxygen [1]. Cobalt oxide nanoparticles have received increasing attention since Co3O4 plays a significant role in many fields, such as energy storage and conversion, catalysis, gas sensing, and so on [18–22]. In particular, Co-based catalysts display excellent activity in the oxidation of alkenes [4,23]. In recent years, considerable efforts have been made to improve the catalytic performance of cobalt oxide by depositing it on carbon, ZSM-5, and SBA-15 etc [23–25]. Compared with silicate-based materials, carbon materials have lots of merits, such as good hydrothermal stability and excellent acid and alkali resistance. Therefore, the carbon materials have attracted increasing attention. In recent years, there are many reports about incorporating nitrogen into the carbon framework to enhance the surface property [26,27]. In addition, the modification of carbon by incorporating nitrogen could boost particle dispersity [28]. For example, for the N-doped mesoporous carbon, well-developed porosity and enriched heterogeneous sites has drawn great attention to support metal particles for advanced catalysis [29–31]. Graphene oxide (GO) has an ideal 2D structure and ample oxygen carrying functionalities (hydroxyl, epoxide, and carboxylic groups) on its basal planes and at its edges, [32] which could participate in a wide range of bonding interactions and hence serve as an ideal substrate for the deposition of inorganic nanoparticles [33]. Fe3O4 nanoparticles have been brought into sharp focus largely due to its low cost, eco-friendliness and magnetic properties [34–36]. Nevertheless, there is one big limitation in the practical application. that is that Fe3O4 nanoparticles are unstable in strongly acidic or oxidant solution [37]. Coating Fe3O4 nanoparticles with silica or carbon can protect them from being dissolved in acidic environment, enhancing the specific surface area and introducing functional groups on their surface [33]. Recently, coating magnetic materials with glucose is an efficient approach to generate carbon shells [38,39], which can be regarded as a kind of very promising new materials due to the higher stability in various chemical and physical environments such as acid or base media, as well as at high temperatures and pressures compared with silica shells [40]. Fan et al. [33] reported magnetic graphene-Fe3O4@carbon (GFC) hybrid with hierarchical nanostructures as an adsorbent for the removal of organic dyes with excellent reproducibility and recyclability. Herein we synthesized magnetic RGO/Fe3O4@C-N-Co3O4 catalyst by a solvothermal method. Furthermore, the catalytic properties in the epoxidation of styrene and cyclooctene using air as oxidizing agent were investigated. 2 Experimental 2.1 Materials and characterization The detailed information of materials and characterization was seen in the supporting information. 2.2 Synthetic procedures (Scheme 1) The synthesis route of Co3O4 supported on magnetic N-doped graphene (RGO/Fe3O4@C-N) is depicted in Scheme 1 and described as follows. 2.2.1 Catalyst preparation Graphene oxide (GO) was synthesized by slightly modified Hummer method [41] (as shown in the supporting information). The synthesis procedures of reduced graphene oxide/Fe3O4 and reduced graphene oxide/Fe3O4@carbon (RGO/Fe3O4@C) were shown in the supporting information. The detailed information of Co3O4 supported on magnetic N-doped hybridization of reduced graphene oxide sheets (RGO/Fe3O4@C-N-Co3O4) is as follows [24]: 62.5mg RGO/Fe3O4@C was dispersed in 189ml ethanol in an ultrasonic bath for 2h and 0.55g Co(NO3)2·6H2O dissolved in 15ml deionized water Then 4.0ml NH3·H2O was added to the above solution. The resulting mixture was refluxed at 80°C for 10h. Finally, the mixture was transferred into an autoclave, sealed and heated at 150°C for 3h. The sample was collected by magnetic separation, followed by washing with H2O and ethanol for three times. The synthesized sample was denoted as RGO/Fe3O4@C-N-Co3O4. As a control experiment, RGO/Fe3O4@C-Co3O4 was prepared under the same condition with NaOH substitution for NH3·H2O. 2.3 Catalytic tests The catalytic aerobic epoxidation of styrene or cyclooctene was carried out in a 50mL flask equipped with a reflux condenser and an air pump. In brief, substrate (8mmol), solvent (DMF, 25ml), and catalyst (10mg) were mixed. The mixture was heated to 100°C, and then oxidant (air, ca. 80mlmin−1) was imported. After filtering the solid, the filtrate was analyzed by a gas chromatography instrument (Shimadzu GC-8A) using FID detector to determine the conversion of substrate and the product yields. At the end of the reaction, the catalyst was recovered by magnetic separation, followed by washing with copious solvent, and drying. The catalyst was then reused in the next reaction without further purification. 3 Results and discussion 3.1 Structural characteristics of catalysts The synthesized samples were analyzed by using XRD at high diffraction angle. As shown in Fig. S1, for GO, a broadening diffraction peak located at 2θ of 11.2° is assigned to the (0 0 1) reflection of graphene oxide, indicating that oxygen species were successfully inserted into the graphitic layers. For a series of RGO/Fe3O4 composites (Fig. 1 a–e), the diffraction peak located at 2θ of 11.2° disappears and a new peak located at 2θ of 25.3° is observed due to the removal of the oxygen-containing groups and recovery of the ordered structure of graphene [42]. Furthermore, for RGO/Fe3O4 (Fig. 1a), the diffraction peaks at 30.2, 35.6, 43.3, 53.6, 57.1, and 62.8° are indicative of cubic phase Fe3O4 (JCPDS no. 89-4319) [43]. For RGO/Fe3O4@C (Fig. 1b), a broad peak located at 2θ of 24.2° is observed owing to the amorphous carbon shell. For Co3O4 (Fig. 1c), the diffraction peaks located at 2θ of 18.9, 31.3, 36.8, 38.1, 44.9, 59.4 and 65.2° are assigned to (1 1 1), (2 2 0), (3 1 1), (2 2 2), (4 0 0), (5 1 1), and (4 4 0) reflections (JCPDS no. 42-1467) [44]. Meanwhile, for the cobalt-containing composites RGO/Fe3O4@C-N-Co3O4, and RGO/Fe3O4@C-Co3O4 (Fig. 1d and e), the characteristic diffraction peaks of Fe3O4 and carbon are still observed. In addition, the extremely weak peak at ca. 18.9° is considered to the high dispersity of cobalt species on RGO/Fe3O4@C support. The morphology and structure of RGO/Fe3O4@C-N-Co3O4 and RGO/Fe3O4@C-Co3O4 were investigated with TEM and HRTEM (Fig. 2 ). The TEM image of GO is shown in Fig. S2. From Fig. 2a and b it is evident that Fe3O4 nanoparticles are evenly covered by a light layer of amorphous carbonaceous shell. Furthermore, Co3O4 with a uniform size of 4–8nm is well dispersed on RGO-Fe3O4@C. A high-resolution TEM image (Fig. 2c) shows well-resolved lattice fringes, corresponding to the Fe3O4, Co3O4 and carbon, which are consistent with the XRD results. From the TEM and HRTEM images, it can be found the Co3O4 nanoparticles are dispersed on both the RGO and the layer of amorphous carbonaceous shell. The EDX mapping results exhibit that carbon, cobalt, nitrogen and iron elements exist in RGO/Fe3O4@C-N-Co3O4, indicating that Co3O4 supported on N-doped hybridization of graphene sheets and carbon-coated Fe3O4 nanoparticles has been successfully synthesized. In addition, the distribution of O, N, and Co elements is not consistent with that of Fe and C, which suggests that Co3O4 nanoparticles distribute uniformly on RGO/Fe3O4@C. Nevertheless, without addition of NH3·H2O (Fig. 2e), bigger Co3O4 nanoparticles are generated on RGO/Fe3O4@C, indicating that the introduction of NH3·H2O is crucial for reducing Co3O4 particle size and enhancing particle nucleation due to its coordination with cobalt cations. The BET surface area obtained from the N2 adsorption/desorption isotherms is 123m2/g and 41m2/g for RGO/Fe3O4@C-N-Co3O4 and RGO/Fe3O4@C-Co3O4, respectively (Fig. S3). 3.2 Spectroscopy characterization The FT-IR spectra of all the synthesized catalysts are shown in Fig. 3 . Characteristic bands at 1728, 1623, 1395, 1224 and 1056cm−1 are observed in the IR spectrum of GO (Fig. 3a), which is due to the vibration of CO, CC, OH, CO and COC, respectively [42]. Moreover, the characteristic bands of RGO/Fe3O4 at ca. 1623 and 1395cm−1 are absent. In the meantime, two new absorption bands at ca. 1569 and 583cm−1 are observed due to the skeletal vibration of the graphene sheets and FeO bond, respectively [45]. Characteristic peaks of RGO/Fe3O4@C appeared at 1707 and 1576cm−1 is ascribed to CO and CC vibrations, respectively, suggesting that glucose was successfully coated onto RGO/Fe3O4 during hydrothermal treatment [37]. Furthermore, the bands in the range of 1000–1300cm−1 are observed due to C-O stretching and OH bending vibrations, indicating the presence of a large number of residual hydroxyl groups on their surface. The spectrum of RGO/Fe3O4@C-N-Co3O4 exhibits two new peaks at 662 and 571cm−1 due to the stretching vibration mode of MO (M is tetrahedrally coordinated Co2+ and/or Co3+) and MO (M is octahedrally coordinated) [46], respectively, indicating that RGO/Fe3O4@C-N-Co3O4 was successfully prepared. Compared with RGO/Fe3O4@C-N-Co3O4, the stretching vibration band of octahedrally coordinated Co3+ in RGO/Fe3O4@C-Co3O4 shifts from 571cm−1 to 691cm−1, indicates a decrease in the strength of the CoO bond in Co3O4 [46]. Raman spectroscopy was performed to investigate the structural changes of carbon materials during the chemical reactions (Fig. 4 ). The two strong bands at ca. 1345 and 1591cm−1 correspond to the well-defined D band and G band, respectively. G band is generally attributed to the first-order scattering of the E2g mode of sp2 carbon atoms in a 2D hexagonal lattice while D band is structural defects like the vibrations of the A1g-symmetry mode of sp3 carbon atoms in disordered amorphous carbon [45]. ID/IG (the Raman intensity ratio of D and G bands) is usually used to predict the presence of defects in the samples. The ID/IG value for GO, RGO/Fe3O4@C, RGO/Fe3O4@C-N-Co3O4 and RGO/Fe3O4@C-Co3O4 is estimated to be around 1.30, 1.25, 1.20 and 1.15, respectively. Compared with GO, the supported catalysts give a lower ratio of ID/IG, suggesting the increase of the in-plane sp2 domains and a comparatively low degree of defects of Co3O4 and Fe3O4 nanoparticles. 3.3 XPS studies Fig. 5 presents the XPS spectra of GO and the synthesized magnetic composites. The surface concentration of various elements detected by XPS and the bulk cobalt content detected by ICP-AES are shown in Table S1. For RGO/Fe3O4 (Fig. 5a), the sharp peaks centered at 711.4 and 725.2eV are due to Fe 2p3/2 and Fe 2p1/2, respectively, verifying that the magnetic Fe3O4 nanoparticles are effectively decorated on the thin reduced GO sheets [47]. Compared with RGO/Fe3O4, the intensities of the characteristic peak of Fe element dramatically reduced after coating with carbon layer (Fig. 5b), suggesting that RGO/Fe3O4 was wrapped by the carbon layer during the hydrothermal treatment. The C1s spectrum of GO (Fig. 5c) exhibits the presence of CC (284.3eV), C-OH (285.4eV), COC (287.4eV), and OCO (289.1eV), indicating that GO contained large numbers of functional groups on its surface. Furthermore, compared with GO, the C1s XPS spectra of the other magnetic composites catalysts (Fig. 5d and e) obviously exhibited a decreased intensity for the peaks corresponding to the functional groups because of effective deoxygenation of GO. The N1s spectrum of RGO/Fe3O4@C-N-Co3O4 exhibits two peaks centered at 398.7 and 400.2eV, which can be assigned to the N atoms in pyridinic and pyrrolic [48]. In the Co2p XPS spectra of RGO/Fe3O4@C-N-Co3O4 and RGO/Fe3O4@C-Co3O4 (Fig. 5 Co2p), the peaks centered at 796.6 and 780.9eV correspond to Co2p1/2 and Co2p3/2, which is in a good agreement with the Co2p peak of the Co3O4 NPs [49,50]. 3.4 Magnetization studies Magnetic measurements of the as-synthesized magnetic nanocomposites are measured at room temperature with an applied magnetic field sweeping from −4 to 4kOe, as shown in Fig. 6 . It is apparent that the magnetization hysteresis loops of the synthesized magnetic catalyst is S-like curve, suggesting that there is almost no coercivity or remaining magnetization when the external magnetic field is removed. Meanwhile, it implies that the prepared magnetic catalyst shows superparamagnetic behavior [45,51]. The saturated magnetization (Ms) of RGO/Fe3O4@C-N-Co3O4 is 2.4 emu/g. Compared with Fe3O4 (not shown, Ms =89.6 emu/g), the synthesized magnetic nanocomposites exhibit a decrease in the value of Ms due to the decrease in the amount of magnetic component in the nanocomposites. Moreover, the synthesized magnetic nanocomposite (RGO/Fe3O4@C-N-Co3O4) can be easily separated by an external magnetic force (inset in Fig. 6), which is significant in the field of catalytic reactions and the other practical applications with good separability and recyclability. 3.5 Catalytic tests The influence of the catalyst amount and reaction temperature on the catalytic properties of various catalysts is studied, as shown in Table 1 . Under the optimal reaction conditions, the catalytic behavior of various catalysts in aerobic oxidation of styrene or cyclooctene with DMF as solvent and air as an oxidant source was evaluated (Table 1). RGO/Fe3O4@C-N-Co3O4 shows 93.2% conversion of styrene and 88.4% selectivity to the styrene oxide after 8h in the first run. For comparison, the catalytic properties of Co3O4 supported on N-free RGO/Fe3O4@C (RGO/Fe3O4@C-Co3O4), RGO/Fe3O4@C, pure Co3O4 and Fe3O4 are also investigated under the identical reaction conditions. RGO/Fe3O4@C-Co3O4 shows 61.0% conversion of styrene and 81.5% selectivity to the styrene oxide after 8h. In addition, Co3O4 and Fe3O4 Exhibit 83.1% and 30.1% conversion of styrene, respectively. Furthermore, RGO/Fe3O4@C displays only 1.3% conversion of styrene. It is worth noting that the RGO/Fe3O4@C-N-Co3O4 catalyst exhibits higher conversion of styrene and selectivity to the corresponding epoxide than RGO/Fe3O4@C-Co3O4, RGO/Fe3O4@C, pure Co3O4 and Fe3O4. From the above TEM results, bigger Co3O4 nanoparticles are generated for RGO/Fe3O4@C-Co3O4 compared with RGO/Fe3O4@C-N-Co3O4. For RGO/Fe3O4@C-N-Co3O4, the mediation of NH3·H2O can enhance the electron-donor property of the carbon matrix, strengthen the interaction between Co3O4 and the RGO/Fe3O4@C support and enable generation of smaller Co3O4 nanoparticles and more active species than Co3O4 supported on N-free RGO/Fe3O4@C (RGO/Fe3O4@C-Co3O4). These could explain the better conversion (93.2%) observed for the magnetic RGO/Fe3O4@C-N-Co3O4 catalyst. Recent studies also show that the incorporation of electron-accepting nitrogen atoms could enhance the electron-donor property of the carbon matrix, which may strengthen the interaction between carbon and guest molecules [24,28]. Therefore, the site-isolation, good dispersion of Co3O4 nanoparticles and the synergistic beneficial catalytic interaction between Co3O4 and the magnetic support are beneficial to enhance the catalytic activity. The epoxidation of cyclooctene over various catalysts was also examined under the similar conditions. RGO/Fe3O4@C-N-Co3O4 exhibits nearly 100% of conversion of cyclooctene and above 99% selectivity to epoxycyclooctane. It is suggested that the higher conversion of cyclooctene than styrene is due to electron density effect of the substrate [52]. The catalytic performance comparison was made between RGO/Fe3O4@C-N-Co3O4 and previously reported other related catalysts that contain Co for aerobic epoxidation of styrene (Table 2 ). This comparison indicates that RGO/Fe3O4@C-N-Co3O4 gives higher styrene conversion (93.2%) than the reported catalysts [4,53–56] except for the Co-E10-26 catalyst [57]. However, the epoxide selectivity is only 24% for the Co-E10-26 catalyst, much lower than that achieved over RGO/Fe3O4@C-N-Co3O4 (88.4%). The recoverability and stability of RGO/Fe3O4@C-N-Co3O4 are studied in the aerobic epoxidation of styrene under similar reaction conditions and the results are depicted in Table 1. It is evident from Table 1 that the RGO/Fe3O4@C-N-Co3O4 catalyst could be successfully recycled for four times without significant decrease in activity or selectivity. It is also worth noting that selectivity to the corresponding epoxide increase in the second run, which could possibly be due to the better synergistic effect between Co3O4 and the magnetic support after the first run. To verify the heterogeneity of these catalytic processes, a leaching test was performed. The catalyst in half of the volume was separated by magnetic separation at reaction temperature 100°C after reacting for 2h and the resulting clear solution was permitted to react for another 6h. The leaching result is shown in Fig. S4. From Fig. S4, it is evident that styrene could just be converted at a very low rate after magnetically separating RGO/Fe3O4@C-N-Co3O4 catalyst. The ICP analysis result exhibits almost no metal ion in the filter liquor, indicating leaching of active species into solution did not occur. Furthermore, the catalyst was separated by magnetic separation after the fourth run and then the filter liquor was also confirmed by ICP-AES. The result indicates that the supported Co3O4 catalyst is stable and leaching of active species into solution is insignificant. Therefore, the large majority of the catalysis is carried out by truly heterogeneous catalysis. 4 Conclusions A simple and effective hydrothermal method was developed to graft Co3O4 nanoparticles onto the magnetic N-doped RGO/Fe3O4@C support for aerobic oxidation of styrene with air as an oxidant source. The magnetic nanocomposite catalysts were characterized by XRD, TEM, N2 adsorption/desorption, FT-IR, Raman, XPS, ICP-AES and VSM, indicating that the supported Co3O4 catalysts have been successfully prepared. The magnetic RGO/Fe3O4@C-N-Co3O4 catalyst exhibits higher catalytic activity for aerobic oxidation of styrene than pure Co3O4 and N-free RGO/Fe3O4@C-Co3O4 under the same conditions due to site-isolation, good dispersion of Co3O4 nanoparticles and efficient synergistic effect between Co3O4 nanoparticles and the supports. By using a permanent magnet, the catalysts can be recovered and reused economically for aerobic oxidation of styrene with air as an oxidant source. This finding paves a promising and green route for environmental catalytic epoxidation. Acknowledgements This work was supported by the National Natural Science Foundation of China (21303069), Jilin province (20150520013JH), the Science Research Project of Heilongjiang province education department, China (12541861), the Science Research Project of Qiqihar University, China (135109303, 135109103) andcivic scientific and technological project of Qiqihar, China (GYGG-201405). Appendix A Supplementary data Supplementary data associated with this article can be found, in the online version, at http://dx.doi.org/10.1016/j.mcat.2017.02.001. Appendix A Supplementary data The following are Supplementary data to this article: References [1] L. Wang H. Wang P. Hapala L. Zhu L. Ren X. Meng J.P. Lewis F.-S. Xiao J. Catal. 281 2011 30 39 [2] S. Bhattacharjee J.A. Anderson J. Mol. Catal. A-Chem. 249 2006 103 110 [3] B. Tyagi B. Shaik H. Bajaj Appl. Catal. A-Gen. 383 2010 161 168 [4] Q. Tang Q. Zhang H. Wu Y. Wang J. Catal. 230 2005 384 397 [5] V. Choudhary D. Dumbre N. Patil B. Uphade S. Bhargava J. Catal. 300 2013 217 224 [6] Y. Liu H. Tsunoyama T. Akita T. Tsukuda Chem. Commun. 46 2010 550 552 [7] Z. Chen R.L. Luck Green Chem. 18 2016 3354 3359 [8] L. Vanoye J. Wang M. Pablos C. de Bellefon A. Favre-Reguillon Catal. Sci. Technol. 6 2016 4724 4732 [9] S. Rayati M. Koliaei F. Ashouri S. Mohebbi A. Wojtczak A. Kozakiewicz Appl. Catal. A-Gen. 346 2008 65 71 [10] S.K. Ginotra V.K. Singh Tetrahedron 62 2006 3573 3581 [11] B. Qi X.-H. Lu S.-Y. Fang J. Lei Y.-L. Dong D. Zhou Q.-H. Xia J. Mol. Catal. A-Chem. 334 2011 44 51 [12] S. Mukherjee S. Samanta B.C. Roy A. Bhaumik Appl. Catal. A-Gen. 301 2006 79 88 [13] P. Visuvamithiran M. Palanichamy K. Shanthi V. Murugesan Appl. Catal. A-Gen. 462 2013 31 38 [14] J. Huang X. Fu G. Wang Q. Miao G. Wang Dalton Trans. 41 2012 10661 10669 [15] L. Geng X. Zhang W. Zhang M. Jia G. Liu Chem. Commun. 50 2014 2965 2967 [16] K. An S. Alayoglu N. Musselwhite K. Na G.A. Somorjai J. Am. Chem. Soc. 136 2014 6830 6833 [17] M. Alhumaimess Z. Lin Q. He L. Lu N. Dimitratos N.F. Dummer M. Conte S.H. Taylor J.K. Bartley C.J. Kiely Chem. −Eur. J. 20 2014 1701 1710 [18] X. Wang L. Yu P. Hu F. Yuan Cryst. Growth Des. 7 2007 2415 2418 [19] T. He D. Chen X. Jiao Y. Wang Adv. Mater. 18 2006 1078 1082 [20] K.T. Nam D.-W. Kim P.J. Yoo C.-Y. Chiang N. Meethong P.T. Hammond Y.-M. Chiang A.M. Belcher Science 312 2006 885 888 [21] B. Varghese C. Teo Y. Zhu M.V. Reddy B.V. Chowdari A.T.S. Wee V. Tan C.T. Lim C.H. Sow Adv. Funct. Mater. 17 2007 1932 1939 [22] Y. Li B. Tan Y. Wu Nano Lett. 8 2008 265 270 [23] H. Cui Y. Zhang Z. Qiu L. Zhao Y. Zhu Appl. Catal. B-Environ. 101 2010 45 53 [24] R. Nie J. Shi W. Du W. Ning Z. Hou F.-S. Xiao J. Mater. Chem. A. 1 2013 9037 9045 [25] I. Nongwe V. Ravat R. Meijboom N.J. Coville Appl. Catal. A-Gen. 466 2013 1 8 [26] L. Qie W.M. Chen Z.H. Wang Q.G. Shao X. Li L.X. Yuan X.L. Hu W.X. Zhang Y.H. Huang Adv. Mater. 24 2012 2047 2050 [27] J. Wei D. Zhou Z. Sun Y. Deng Y. Xia D. Zhao Adv. Funct. Mater. 23 2013 2322 2328 [28] Y. Yang L. Jia B. Hou D. Li J. Wang Y. Sun J. Phy. Chem. C 118 2014 268 277 [29] A. Vinu Adv. Funct. Mater. 18 2008 816 827 [30] X. Chen Y.-S. Jun K. Takanabe K. Maeda K. Domen X. Fu M. Antonietti X. Wang Chem. Mater. 21 2009 4093 4095 [31] X.-H. Li M. Antonietti Chem. Soc. Rev. 42 2013 6593 6604 [32] H.P. Mungse S. Verma N. Kumar B. Sain O.P. Khatri J. Mater. Chem. 22 2012 5427 5433 [33] W. Fan W. Gao C. Zhang W.W. Tjiu J. Pan T. Liu J. Mater. Chem. 22 2012 25108 25115 [34] G. Zhou D.-W. Wang F. Li L. Zhang N. Li Z.-S. Wu L. Wen G.Q. Lu H.-M. Cheng Chem. Mater. 22 2010 5306 5313 [35] S. Wu Q. He C. Zhou X. Qi X. Huang Z. Yin Y. Yang H. Zhang Nanoscale. 4 2012 2478 2483 [36] X. Li H. Zhu J. Feng J. Zhang X. Deng B. Zhou H. Zhang D. Xue F. Li N.J. Mellors Y. Li Y. Peng Carbon. 60 2013 488 497 [37] L. Kong X. Lu X. Bian W. Zhang C. Wang ACS Appl. Mater. Interface 3 2011 35 42 [38] A. Nieto-Márquez R. Romero A. Romero J.L. Valverde J. Mater. Chem. 21 2011 1664 1672 [39] B. Hu K. Wang L. Wu S.H. Yu M. Antonietti M.M. Titirici Adv. Mater. 22 2010 813 828 [40] Y. Ye J. Chen Q. Ding D. Lin R. Dong L. Yang J. Liu Nanoscale 5 2013 5887 5895 [41] K. Krishnamoorthy M. Veerapandian K. Yun S.J. Kim Carbon 53 2013 38 49 [42] S. Choudhary H.P. Mungse O.P. Khatri J. Mater. Chem. 22 2012 21032 21039 [43] L. Ai C. Zhang Z. Chen J. Hazard. Mater. 192 2011 1515 1524 [44] B.G. Choi S.-J. Chang Y.B. Lee J.S. Bae H.J. Kim Y.S. Huh Nanoscale 4 2012 5924 5930 [45] W. Zhang X. Shi Y. Zhang W. Gu B. Li Y. Xian J. Mater. Chem. A 1 2013 1745 1753 [46] Z. Zhu G. Lu Z. Zhang Y. Guo Y. Guo Y. Wang ACS Catal. 3 2013 1154 1164 [47] Z. Wang J. Guan S. Wu C. Xu Y. Ma J. Lei Q. Kan Mater. Lett. 64 2010 1325 1327 [48] J. Jin X. Fu Q. Liu J. Zhang J. Mater. Chem. A 1 2013 10538 10545 [49] Z.-S. Wu W. Ren L. Wen L. Gao J. Zhao Z. Chen G. Zhou F. Li H.-M. Cheng ACS Nano 4 2010 3187 3194 [50] C.O. Song J.W. Lee H.S. Choi J.K. Kang RSC Adv. 3 2013 20179 20185 [51] F. He J. Fan D. Ma L. Zhang C. Leung H.L. Chan Carbon 48 2010 3139 3144 [52] S.M. Bruno S.S. Balula A.A. Valente F.A.A. Paz M. Pillinger C. Sousa J. Klinowski C. Freire P. Ribeiro-Claro I.S. Gonçalves J. Mol. Catal. A-Chem. 270 2007 185 194 [53] N. Lu B. Li B. Fan W. Guo R. Li Mater. Chem. Phys. 167 2015 219 224 [54] S. Shit D. Saha D. Saha T.N. Guru Row C. Rizzoli Inorg. Chim. Acta 415 2014 103 110 [55] K.M. Jinka S.M. Pai B.L. Newalkar N.V. Choudary R.V. Jasra Catal. Commun. 11 2010 638 642 [56] J. Sun G.L. Yu L.L. Liu Z.F. Li Q.B. Kan Q.S. Huob J.Q. Guan Catal. Sci. Technol. 4 2014 1246 1252 [57] S.J. Datta K.B. Yoon Chin. J. Catal. 36 2015 897 905",
      "scopus-id": "85029616522",
      "coredata": {
        "eid": "1-s2.0-S2468823117300597",
        "dc:description": "The epoxidation of alkenes to the corresponding epoxides plays a vital role in fine chemical engineering. Magnetic nanocomposite catalyst RGO/Fe3O4@C-N-Co3O4 (RGO: reduced graphene oxide) involving Co3O4 nanoparticles immobilized on magnetic N-doped graphene was prepared by a hydrothermal method. N-dopants in the RGO/Fe3O4@C-N-Co3O4 can strengthen the interaction between Co3O4 nanoparticles and the support. RGO/Fe3O4@C-N-Co3O4 revealed higher catalytic reactivity (i.e. 93.2% conversion of styrene and 88.4% selectivity to styrene oxide) as compared to bulk Co3O4, and Co3O4 supported on N-free RGO/Fe3O4@C due to site-isolation, good dispersion of Co3O4 nanoparticles and efficiently synergistic effect between Co3O4 and the magnetic support. In addition, the catalyst displayed good recoverability by simple magnetic separation with negligible loss in activity and selectivity within several successive runs due to superparamagnetism.",
        "openArchiveArticle": "false",
        "prism:coverDate": "2017-05-31",
        "openaccessUserLicense": null,
        "prism:aggregationType": "Journal",
        "prism:url": "https://api.elsevier.com/content/article/pii/S2468823117300597",
        "dc:creator": [
          {
            "@_fa": "true",
            "$": "Li, Zhifang"
          },
          {
            "@_fa": "true",
            "$": "Wu, Shujie"
          },
          {
            "@_fa": "true",
            "$": "Yang, Changlong"
          },
          {
            "@_fa": "true",
            "$": "Ma, Yuanyuan"
          },
          {
            "@_fa": "true",
            "$": "Fu, Xiaoran"
          },
          {
            "@_fa": "true",
            "$": "Peng, Ling"
          },
          {
            "@_fa": "true",
            "$": "Guan, Jingqi"
          },
          {
            "@_fa": "true",
            "$": "Kan, Qiubin"
          }
        ],
        "link": [
          {
            "@_fa": "true",
            "@rel": "self",
            "@href": "https://api.elsevier.com/content/article/pii/S2468823117300597"
          },
          {
            "@_fa": "true",
            "@rel": "scidir",
            "@href": "https://www.sciencedirect.com/science/article/pii/S2468823117300597"
          }
        ],
        "dc:format": "application/json",
        "openaccessType": null,
        "pii": "S2468-8231(17)30059-7",
        "prism:volume": "432",
        "prism:publisher": "Elsevier B.V.",
        "dc:title": "Nano-Co3O4 supported on magnetic N-doped graphene as highly efficient catalyst for epoxidation of alkenes",
        "prism:copyright": "© 2017 Elsevier B.V. All rights reserved.",
        "openaccess": "0",
        "prism:issn": "24688231",
        "dcterms:subject": [
          {
            "@_fa": "true",
            "$": "Graphene"
          },
          {
            "@_fa": "true",
            "$": "Fe3O4"
          },
          {
            "@_fa": "true",
            "$": "Co3O4"
          },
          {
            "@_fa": "true",
            "$": "Air"
          },
          {
            "@_fa": "true",
            "$": "Styrene"
          }
        ],
        "openaccessArticle": "false",
        "prism:publicationName": "Molecular Catalysis",
        "openaccessSponsorType": null,
        "prism:pageRange": "267-273",
        "prism:endingPage": "273",
        "pubType": "fla",
        "prism:coverDisplayDate": "May 2017",
        "prism:doi": "10.1016/j.mcat.2017.02.001",
        "prism:startingPage": "267",
        "dc:identifier": "doi:10.1016/j.mcat.2017.02.001",
        "openaccessSponsorName": null
      },
      "objects": {
        "object": [
          {
            "@category": "thumbnail",
            "@height": "88",
            "@width": "219",
            "@_fa": "true",
            "$": "https://api.elsevier.com/content/object/eid/1-s2.0-S2468823117300597-fx1.sml?httpAccept=%2A%2F%2A",
            "@multimediatype": "GIF image file",
            "@type": "IMAGE-THUMBNAIL",
            "@size": "3126",
            "@ref": "fx1",
            "@mimetype": "image/gif"
          },
          {
            "@category": "thumbnail",
            "@height": "164",
            "@width": "182",
            "@_fa": "true",
            "$": "https://api.elsevier.com/content/object/eid/1-s2.0-S2468823117300597-gr1.sml?httpAccept=%2A%2F%2A",
            "@multimediatype": "GIF image file",
            "@type": "IMAGE-THUMBNAIL",
            "@size": "10734",
            "@ref": "gr1",
            "@mimetype": "image/gif"
          },
          {
            "@category": "thumbnail",
            "@height": "162",
            "@width": "65",
            "@_fa": "true",
            "$": "https://api.elsevier.com/content/object/eid/1-s2.0-S2468823117300597-gr2.sml?httpAccept=%2A%2F%2A",
            "@multimediatype": "GIF image file",
            "@type": "IMAGE-THUMBNAIL",
            "@size": "8618",
            "@ref": "gr2",
            "@mimetype": "image/gif"
          },
          {
            "@category": "thumbnail",
            "@height": "163",
            "@width": "183",
            "@_fa": "true",
            "$": "https://api.elsevier.com/content/object/eid/1-s2.0-S2468823117300597-gr3.sml?httpAccept=%2A%2F%2A",
            "@multimediatype": "GIF image file",
            "@type": "IMAGE-THUMBNAIL",
            "@size": "8347",
            "@ref": "gr3",
            "@mimetype": "image/gif"
          },
          {
            "@category": "thumbnail",
            "@height": "164",
            "@width": "182",
            "@_fa": "true",
            "$": "https://api.elsevier.com/content/object/eid/1-s2.0-S2468823117300597-gr4.sml?httpAccept=%2A%2F%2A",
            "@multimediatype": "GIF image file",
            "@type": "IMAGE-THUMBNAIL",
            "@size": "6065",
            "@ref": "gr4",
            "@mimetype": "image/gif"
          },
          {
            "@category": "thumbnail",
            "@height": "163",
            "@width": "118",
            "@_fa": "true",
            "$": "https://api.elsevier.com/content/object/eid/1-s2.0-S2468823117300597-gr5.sml?httpAccept=%2A%2F%2A",
            "@multimediatype": "GIF image file",
            "@type": "IMAGE-THUMBNAIL",
            "@size": "6852",
            "@ref": "gr5",
            "@mimetype": "image/gif"
          },
          {
            "@category": "thumbnail",
            "@height": "164",
            "@width": "197",
            "@_fa": "true",
            "$": "https://api.elsevier.com/content/object/eid/1-s2.0-S2468823117300597-gr6.sml?httpAccept=%2A%2F%2A",
            "@multimediatype": "GIF image file",
            "@type": "IMAGE-THUMBNAIL",
            "@size": "7115",
            "@ref": "gr6",
            "@mimetype": "image/gif"
          },
          {
            "@category": "thumbnail",
            "@height": "164",
            "@width": "152",
            "@_fa": "true",
            "$": "https://api.elsevier.com/content/object/eid/1-s2.0-S2468823117300597-sc1.sml?httpAccept=%2A%2F%2A",
            "@multimediatype": "GIF image file",
            "@type": "IMAGE-THUMBNAIL",
            "@size": "10138",
            "@ref": "sc1",
            "@mimetype": "image/gif"
          },
          {
            "@category": "standard",
            "@height": "200",
            "@width": "500",
            "@_fa": "true",
            "$": "https://api.elsevier.com/content/object/eid/1-s2.0-S2468823117300597-fx1.jpg?httpAccept=%2A%2F%2A",
            "@multimediatype": "JPEG image file",
            "@type": "IMAGE-DOWNSAMPLED",
            "@size": "9662",
            "@ref": "fx1",
            "@mimetype": "image/jpeg"
          },
          {
            "@category": "standard",
            "@height": "237",
            "@width": "263",
            "@_fa": "true",
            "$": "https://api.elsevier.com/content/object/eid/1-s2.0-S2468823117300597-gr1.jpg?httpAccept=%2A%2F%2A",
            "@multimediatype": "JPEG image file",
            "@type": "IMAGE-DOWNSAMPLED",
            "@size": "27240",
            "@ref": "gr1",
            "@mimetype": "image/jpeg"
          },
          {
            "@category": "standard",
            "@height": "940",
            "@width": "376",
            "@_fa": "true",
            "$": "https://api.elsevier.com/content/object/eid/1-s2.0-S2468823117300597-gr2.jpg?httpAccept=%2A%2F%2A",
            "@multimediatype": "JPEG image file",
            "@type": "IMAGE-DOWNSAMPLED",
            "@size": "116580",
            "@ref": "gr2",
            "@mimetype": "image/jpeg"
          },
          {
            "@category": "standard",
            "@height": "235",
            "@width": "263",
            "@_fa": "true",
            "$": "https://api.elsevier.com/content/object/eid/1-s2.0-S2468823117300597-gr3.jpg?httpAccept=%2A%2F%2A",
            "@multimediatype": "JPEG image file",
            "@type": "IMAGE-DOWNSAMPLED",
            "@size": "21517",
            "@ref": "gr3",
            "@mimetype": "image/jpeg"
          },
          {
            "@category": "standard",
            "@height": "237",
            "@width": "263",
            "@_fa": "true",
            "$": "https://api.elsevier.com/content/object/eid/1-s2.0-S2468823117300597-gr4.jpg?httpAccept=%2A%2F%2A",
            "@multimediatype": "JPEG image file",
            "@type": "IMAGE-DOWNSAMPLED",
            "@size": "15857",
            "@ref": "gr4",
            "@mimetype": "image/jpeg"
          },
          {
            "@category": "standard",
            "@height": "677",
            "@width": "489",
            "@_fa": "true",
            "$": "https://api.elsevier.com/content/object/eid/1-s2.0-S2468823117300597-gr5.jpg?httpAccept=%2A%2F%2A",
            "@multimediatype": "JPEG image file",
            "@type": "IMAGE-DOWNSAMPLED",
            "@size": "81075",
            "@ref": "gr5",
            "@mimetype": "image/jpeg"
          },
          {
            "@category": "standard",
            "@height": "219",
            "@width": "263",
            "@_fa": "true",
            "$": "https://api.elsevier.com/content/object/eid/1-s2.0-S2468823117300597-gr6.jpg?httpAccept=%2A%2F%2A",
            "@multimediatype": "JPEG image file",
            "@type": "IMAGE-DOWNSAMPLED",
            "@size": "10671",
            "@ref": "gr6",
            "@mimetype": "image/jpeg"
          },
          {
            "@category": "standard",
            "@height": "406",
            "@width": "376",
            "@_fa": "true",
            "$": "https://api.elsevier.com/content/object/eid/1-s2.0-S2468823117300597-sc1.jpg?httpAccept=%2A%2F%2A",
            "@multimediatype": "JPEG image file",
            "@type": "IMAGE-DOWNSAMPLED",
            "@size": "39531",
            "@ref": "sc1",
            "@mimetype": "image/jpeg"
          },
          {
            "@category": "standard",
            "@_fa": "true",
            "$": "https://api.elsevier.com/content/object/eid/1-s2.0-S2468823117300597-mmc1.docx?httpAccept=%2A%2F%2A",
            "@multimediatype": "Microsoft Word file",
            "@type": "APPLICATION",
            "@size": "124796",
            "@ref": "mmc1",
            "@mimetype": "application/word"
          }
        ]
      },
      "link": {
        "@rel": "abstract",
        "@href": "https://api.elsevier.com/content/abstract/scopus_id/85029616522"
      }
    }
  }
}