{
  "metadata": {
    "title": "Late redistribution effect of copper species in the Cu/SiO<ce:inf loc=post>2</ce:inf> catalyst induced by EDTA",
    "authors": "; ; ",
    "journal": "Molecular Catalysis",
    "date": "2024-08-15",
    "doi": "10.1016/j.mcat.2024.114290",
    "abstract": "",
    "uri": "https://api.elsevier.com/content/article/pii/S2468823124004735",
    "pii": "S2468823124004735"
  },
  "fulltext": {
    "full-text-retrieval-response": {
      "scopus-eid": "2-s2.0-85197091824",
      "originalText": "serial JL 315758 291210 291744 291790 291809 31 Molecular Catalysis MOLECULARCATALYSIS 2024-07-02 2024-07-02 2024-07-02 2024-07-02 2024-08-02T11:57:37 1-s2.0-S2468823124004735 S2468-8231(24)00473-5 S2468823124004735 10.1016/j.mcat.2024.114290 S300 S300.1 FULL-TEXT 1-s2.0-S2468823124X00115 2024-09-04T07:36:43.638458Z 0 0 20240815 2024 2024-07-02T19:40:15.766719Z absattachment articleinfo articlenumber articletitlenorm authfirstinitialnorm authfirstsurnamenorm cid cids contenttype copyright crossmark dateloaded dateloadedtxt datesearch datesort dateupdated dco docsubtype doctype doi eid ewtransactionid hubeid indexeddate issn issnnorm itemstage itemtransactionid itemweight openaccess openarchive pg pgfirst pii piinorm pubdatestart pubdatetxt pubyr sectiontitle sortorder srctitle srctitlenorm srctype ssids alllist content subj subheadings suppl tomb volfirst volissue volumelist webpdf webpdfpagecount yearnav figure table e-component body acknowledge affil appendices articletitle auth authfirstini authfull authkeywords authlast grantnumber grantsponsor highlightsabst orcid primabst pubtype ref specialabst 2468-8231 24688231 true 565 565 C Volume 565 3 114290 114290 114290 20240815 15 August 2024 2024-08-15 2024 Regular Papers article fla © 2024 Published by Elsevier B.V. LATEREDISTRIBUTIONEFFECTCOPPERSPECIESINCUSIO2CATALYSTINDUCEDBYEDTA LI T 1 Introduction 2 Experimental 2.1 Catalysts preparation 2.2 Dissolution experiment of copper phyllosilicate 2.2.1 Dissolution of copper phyllosilicate in EDTA solution 2.2.2 Dissolution of copper phyllosilicate in EDTA4Na solution 2.3 Catalysts characterization 2.4 Evaluation of catalytic activity 3 Result 3.1 Structure and physicochemical properties 3.2 Evolution of crystalline phase and morphology 3.3 Chemical states of surface species 3.4 Solubility of copper phyllosilicate in EDTA and its salts solution 3.5 Catalytic evaluation 4 Discussion 4.1 Dissolution of copper phyllosilicate 4.2 Redistribution of copper species 4.3 Study on structure-activity relationship 5 Conclusions CRediT authorship contribution statement Acknowledgments Appendix Supplementary materials References YE 2018 3428 3449 R LV 2020 183 191 J CHEN 2011 519 526 H HE 2011 54 63 Z WANG 2017 759 768 Z ZHOU 2010 2003 2009 Z CHEN 2020 10781 10786 Z CUI 2019 394 404 G YE 2018 3382 3394 R CUI 2021 119406 G CHEN 2008 172 180 L YIN 2008 91 99 A GONG 2012 13922 13925 J DING 2017 530 542 J CHEN 2020 421 431 C YE 2020 4465 4490 R VANDERGRIFT 1990 275 289 C WANG 2020 127 135 Y ZHENG 1995 28 32 R WANG 1987 109 114 J GRIFT 1989 C LI 2022 320 T WANG 2020 9414 9422 M WANG 2016 66 74 B SONG 2015 9699 9707 Y YANG 2016 1 5 W CHEN 2021 120083 C POPA 2015 52 61 T WANG 2015 6200 6208 Y TOUPANCE 2002 2277 2286 T ZHU 2014 3612 3620 Y WEN 2015 483 493 C YIN 2009 11003 11013 A ZHAO 2013 142 150 S TAKAHASHI 2000 12184 12191 R ZHU 2017 315 324 Y YE 2017 122 132 R KOHLER 1987 309 321 M LIX2024X114290 LIX2024X114290XT 2026-07-02T00:00:00.000Z 2026-07-02T00:00:00.000Z http://creativecommons.org/licenses/by-nc-nd/4.0/ © 2024 Published by Elsevier B.V. 2024-07-04T04:14:02.039Z http://vtw.elsevier.com/data/voc/AddOnTypes/50.7/aggregated-refined National Natural Science Foundation of China 22102186 U23B20164 NSFC National Natural Science Foundation of China http://data.elsevier.com/vocabulary/SciValFunders/501100001809 http://sws.geonames.org/1814991/ Chinese Academy of Sciences CXZX-2022-GH05 CXZX-2022-GS03 CAS Chinese Academy of Sciences http://data.elsevier.com/vocabulary/SciValFunders/501100002367 http://sws.geonames.org/1814991/ Haixi Institutes National Key R&D Program of China 2018YFA0704500 NKRDPC National Key Research and Development Program of China http://data.elsevier.com/vocabulary/SciValFunders/501100012166 http://sws.geonames.org/1814991/ This work was supported by the National Key R&D Program of China (2018YFA0704500), the National Natural Science Foundation of China (U23B20164&22102186) and the Self-deployment Project Research Program of Haixi Institutes, Chinese Academy of Sciences (CXZX-2022-GS03, CXZX-2022-GH05). https://doi.org/10.15223/policy-017 https://doi.org/10.15223/policy-037 https://doi.org/10.15223/policy-012 https://doi.org/10.15223/policy-029 https://doi.org/10.15223/policy-004 item S2468-8231(24)00473-5 S2468823124004735 1-s2.0-S2468823124004735 10.1016/j.mcat.2024.114290 315758 2024-09-04T07:36:43.638458Z 2024-08-15 1-s2.0-S2468823124004735-main.pdf https://s3-eu-west-1.amazonaws.com/prod-ucs-content-store-eu-west/content/pii:S2468823124004735/MAIN/application/pdf/d6b84eb23d66727e82c04b1628dc4ca1/main.pdf main.pdf pdf true 4255799 MAIN 9 1-s2.0-S2468823124004735-main_1.png https://s3-eu-west-1.amazonaws.com/prod-ucs-content-store-eu-west/content/pii:S2468823124004735/PREVIEW/image/png/9d2035f08c6735eec56aac3440301130/main_1.png main_1.png png 58767 849 656 IMAGE-WEB-PDF 1 1-s2.0-S2468823124004735-gr7.jpg https://s3-eu-west-1.amazonaws.com/prod-ucs-content-store-eu-west/content/pii:S2468823124004735/gr7/DOWNSAMPLED/image/jpeg/64a8025134199832c3684f9db2fde7e1/gr7.jpg gr7 gr7.jpg jpg 23123 307 386 IMAGE-DOWNSAMPLED 1-s2.0-S2468823124004735-sc1.jpg https://s3-eu-west-1.amazonaws.com/prod-ucs-content-store-eu-west/content/pii:S2468823124004735/sc1/DOWNSAMPLED/image/jpeg/53e88fc67d9ad5a146ad5429533ae08c/sc1.jpg sc1 sc1.jpg jpg 33722 222 602 IMAGE-DOWNSAMPLED 1-s2.0-S2468823124004735-gr2.jpg https://s3-eu-west-1.amazonaws.com/prod-ucs-content-store-eu-west/content/pii:S2468823124004735/gr2/DOWNSAMPLED/image/jpeg/92a2a85d38583a8bcd8004a23cccc2e2/gr2.jpg gr2 gr2.jpg jpg 46426 246 489 IMAGE-DOWNSAMPLED 1-s2.0-S2468823124004735-ga1.jpg https://s3-eu-west-1.amazonaws.com/prod-ucs-content-store-eu-west/content/pii:S2468823124004735/ga1/DOWNSAMPLED/image/jpeg/5b6e68d0dd8437c0f5781df800003481/ga1.jpg ga1 true ga1.jpg jpg 30040 200 355 IMAGE-DOWNSAMPLED 1-s2.0-S2468823124004735-gr1.jpg https://s3-eu-west-1.amazonaws.com/prod-ucs-content-store-eu-west/content/pii:S2468823124004735/gr1/DOWNSAMPLED/image/jpeg/fce310c999526bf5aedbe0180ac3a059/gr1.jpg gr1 gr1.jpg jpg 57447 263 678 IMAGE-DOWNSAMPLED 1-s2.0-S2468823124004735-gr4.jpg https://s3-eu-west-1.amazonaws.com/prod-ucs-content-store-eu-west/content/pii:S2468823124004735/gr4/DOWNSAMPLED/image/jpeg/906e482608e5ca87953583e4b001e73b/gr4.jpg gr4 gr4.jpg jpg 44284 506 339 IMAGE-DOWNSAMPLED 1-s2.0-S2468823124004735-gr3.jpg https://s3-eu-west-1.amazonaws.com/prod-ucs-content-store-eu-west/content/pii:S2468823124004735/gr3/DOWNSAMPLED/image/jpeg/4a664937ed9f0652a6dd5b28964cc3f1/gr3.jpg gr3 gr3.jpg jpg 24299 302 386 IMAGE-DOWNSAMPLED 1-s2.0-S2468823124004735-gr6.jpg https://s3-eu-west-1.amazonaws.com/prod-ucs-content-store-eu-west/content/pii:S2468823124004735/gr6/DOWNSAMPLED/image/jpeg/750184a2f9799a410a3d07651616443f/gr6.jpg gr6 gr6.jpg jpg 41897 446 301 IMAGE-DOWNSAMPLED 1-s2.0-S2468823124004735-gr5.jpg https://s3-eu-west-1.amazonaws.com/prod-ucs-content-store-eu-west/content/pii:S2468823124004735/gr5/DOWNSAMPLED/image/jpeg/7e224bf076f9a392a3e35e34fd57d721/gr5.jpg gr5 gr5.jpg jpg 58909 274 715 IMAGE-DOWNSAMPLED 1-s2.0-S2468823124004735-gr7.sml https://s3-eu-west-1.amazonaws.com/prod-ucs-content-store-eu-west/content/pii:S2468823124004735/gr7/THUMBNAIL/image/gif/15749fe6d96469012f07698c776cbebb/gr7.sml gr7 gr7.sml sml 7807 164 206 IMAGE-THUMBNAIL 1-s2.0-S2468823124004735-sc1.sml https://s3-eu-west-1.amazonaws.com/prod-ucs-content-store-eu-west/content/pii:S2468823124004735/sc1/THUMBNAIL/image/gif/846cfd46cca37e5c5db8efdf55ce8a38/sc1.sml sc1 sc1.sml sml 10531 81 219 IMAGE-THUMBNAIL 1-s2.0-S2468823124004735-gr2.sml https://s3-eu-west-1.amazonaws.com/prod-ucs-content-store-eu-west/content/pii:S2468823124004735/gr2/THUMBNAIL/image/gif/c6698f2c501f80729bcb602be914fb5c/gr2.sml gr2 gr2.sml sml 18026 110 219 IMAGE-THUMBNAIL 1-s2.0-S2468823124004735-ga1.sml https://s3-eu-west-1.amazonaws.com/prod-ucs-content-store-eu-west/content/pii:S2468823124004735/ga1/THUMBNAIL/image/gif/0357e1efe0534b628da6690b1703d041/ga1.sml ga1 true ga1.sml sml 21171 123 219 IMAGE-THUMBNAIL 1-s2.0-S2468823124004735-gr1.sml https://s3-eu-west-1.amazonaws.com/prod-ucs-content-store-eu-west/content/pii:S2468823124004735/gr1/THUMBNAIL/image/gif/db695a8dbe9ed306be3eef4647e7b79f/gr1.sml gr1 gr1.sml sml 7994 85 219 IMAGE-THUMBNAIL 1-s2.0-S2468823124004735-gr4.sml https://s3-eu-west-1.amazonaws.com/prod-ucs-content-store-eu-west/content/pii:S2468823124004735/gr4/THUMBNAIL/image/gif/6a98046e8347a6822c8bbc8a82723d2c/gr4.sml gr4 gr4.sml sml 7286 164 110 IMAGE-THUMBNAIL 1-s2.0-S2468823124004735-gr3.sml https://s3-eu-west-1.amazonaws.com/prod-ucs-content-store-eu-west/content/pii:S2468823124004735/gr3/THUMBNAIL/image/gif/6515ba2e454f83845f26879bb8cee3af/gr3.sml gr3 gr3.sml sml 7856 164 209 IMAGE-THUMBNAIL 1-s2.0-S2468823124004735-gr6.sml https://s3-eu-west-1.amazonaws.com/prod-ucs-content-store-eu-west/content/pii:S2468823124004735/gr6/THUMBNAIL/image/gif/99f168f8c94fa6a0ebc4c2c7fdd582d5/gr6.sml gr6 gr6.sml sml 8443 163 110 IMAGE-THUMBNAIL 1-s2.0-S2468823124004735-gr5.sml https://s3-eu-west-1.amazonaws.com/prod-ucs-content-store-eu-west/content/pii:S2468823124004735/gr5/THUMBNAIL/image/gif/eb1c62027e6f1d0c37bc79322762fdfa/gr5.sml gr5 gr5.sml sml 7364 84 219 IMAGE-THUMBNAIL 1-s2.0-S2468823124004735-gr7_lrg.jpg https://s3-eu-west-1.amazonaws.com/prod-ucs-content-store-eu-west/content/pii:S2468823124004735/HIGHRES/image/jpeg/a545d49acc0bb23a81bd59c8cd30a702/gr7_lrg.jpg gr7 gr7_lrg.jpg jpg 156579 1359 1708 IMAGE-HIGH-RES 1-s2.0-S2468823124004735-sc1_lrg.jpg https://s3-eu-west-1.amazonaws.com/prod-ucs-content-store-eu-west/content/pii:S2468823124004735/HIGHRES/image/jpeg/fa6af04f7869476ff6b096720a4d741c/sc1_lrg.jpg sc1 sc1_lrg.jpg jpg 255936 983 2667 IMAGE-HIGH-RES 1-s2.0-S2468823124004735-gr2_lrg.jpg https://s3-eu-west-1.amazonaws.com/prod-ucs-content-store-eu-west/content/pii:S2468823124004735/HIGHRES/image/jpeg/afbea559974ac4f7c3b8364e970b2995/gr2_lrg.jpg gr2 gr2_lrg.jpg jpg 494689 1092 2167 IMAGE-HIGH-RES 1-s2.0-S2468823124004735-ga1_lrg.jpg https://s3-eu-west-1.amazonaws.com/prod-ucs-content-store-eu-west/content/pii:S2468823124004735/HIGHRES/image/jpeg/9241fd1b3a6284b31942b9f4a69e5d54/ga1_lrg.jpg ga1 true ga1_lrg.jpg jpg 226362 886 1575 IMAGE-HIGH-RES 1-s2.0-S2468823124004735-gr1_lrg.jpg https://s3-eu-west-1.amazonaws.com/prod-ucs-content-store-eu-west/content/pii:S2468823124004735/HIGHRES/image/jpeg/70d4a73107fb78d2270b2e0db98b65d0/gr1_lrg.jpg gr1 gr1_lrg.jpg jpg 408354 1164 3000 IMAGE-HIGH-RES 1-s2.0-S2468823124004735-gr4_lrg.jpg https://s3-eu-west-1.amazonaws.com/prod-ucs-content-store-eu-west/content/pii:S2468823124004735/HIGHRES/image/jpeg/b79d5f72a053fc5dc29ecdb0cd4ecdfb/gr4_lrg.jpg gr4 gr4_lrg.jpg jpg 271065 2237 1500 IMAGE-HIGH-RES 1-s2.0-S2468823124004735-gr3_lrg.jpg https://s3-eu-west-1.amazonaws.com/prod-ucs-content-store-eu-west/content/pii:S2468823124004735/HIGHRES/image/jpeg/8bf9d08d327b60c37d1f6b9dffeaa02a/gr3_lrg.jpg gr3 gr3_lrg.jpg jpg 163105 1337 1708 IMAGE-HIGH-RES 1-s2.0-S2468823124004735-gr6_lrg.jpg https://s3-eu-west-1.amazonaws.com/prod-ucs-content-store-eu-west/content/pii:S2468823124004735/HIGHRES/image/jpeg/6342668fd5a097965a597d46776ee6a6/gr6_lrg.jpg gr6 gr6_lrg.jpg jpg 266093 1975 1333 IMAGE-HIGH-RES 1-s2.0-S2468823124004735-gr5_lrg.jpg https://s3-eu-west-1.amazonaws.com/prod-ucs-content-store-eu-west/content/pii:S2468823124005649/HIGHRES/image/jpeg/054bd0f7b29114c99b9f617c116d5a06/gr5_lrg.jpg gr5 gr5_lrg.jpg jpg 375152 1212 3167 IMAGE-HIGH-RES 1-s2.0-S2468823124004735-mmc1.docx https://s3-eu-west-1.amazonaws.com/prod-ucs-content-store-eu-west/content/pii:S2468823124004735/mmc1/MAIN/application/vnd.openxmlformats-officedocument.wordprocessingml.document/8cf9114f21ea5fdffbba91bd58f23ac6/mmc1.docx mmc1 mmc1.docx docx 30274202 APPLICATION 1-s2.0-S2468823124004735-am.pdf am am.pdf pdf 15855763 AAM-PDF https://s3-eu-west-1.amazonaws.com/prod-ucs-content-store-eu-west/content/egi:104H5JJGMZR/MAIN/application/pdf/1c3b481033635e46b5ad5aeee0c4de4a/am.pdf MCAT 114290 114290 S2468-8231(24)00473-5 10.1016/j.mcat.2024.114290 Scheme 1 Preparation process of catalysts by the ammonia-evaporation method. Scheme 1 Fig. 1 XRD spectra of the reduced (A) and used catalysts (B). (a) Af-0.08E-Cu/SiO2, (b) E + 0.01-Cu/SiO2, (c) E + 0.02-Cu/SiO2, (d) E + 0.04-Cu/SiO2, (e) E + 0.08-Cu/SiO2. Fig 1 Fig. 2 TEM images of used catalysts. (A) E + 0.02-Cu/SiO2, (B) Af-0.08-Cu/SiO2. Fig 2 Fig. 3 H2 TPR profiles of the catalysts. (a) Af-0.08E-Cu/SiO2, (b) E + 0.01-Cu/SiO2, (c) E + 0.02-Cu/SiO2, (d) E + 0.04-Cu/SiO2, (e) E + 0.08-Cu/SiO2. Fig 3 Fig. 4 FT-IR spectra of the calcined catalysts. (a) Af-0.08E-Cu/SiO2, (b) E + 0.01-Cu/SiO2, (c) E + 0.02-Cu/SiO2, (d) E + 0.04-Cu/SiO2, (e) E + 0.08-Cu/SiO2. Fig 4 Fig. 5 XPS spectra of calcined (A) and reduced catalysts (B). (a) Af-0.08E-Cu/SiO2 (b) E + 0.01-Cu/SiO2, (c) E + 0.02-Cu/SiO2, (d) E + 0.04-Cu/SiO2, (e) E + 0.08-Cu/SiO2. Fig 5 Fig. 6 Cu LMM XAES spectra of the reduced catalysts. (a) Af-0.08E-Cu/SiO2, (b) E + 0.01-Cu/SiO2, (c) E + 0.02-Cu/SiO2, (d) E + 0.04-Cu/SiO2, (e) E + 0.08-Cu/SiO2. Fig 6 Fig. 8 DMO hydrogenation over the E + 0.02-Cu/SiO2 catalyst as a function of time on stream. Reaction conditions: T = 180 °C, P(H2) = 2.0 MPa, H2/DMO = 100 (mol mol−1), WLHSVDMO = 1 h−1. Fig 8 Table 1 Physical and chemical properties of all catalysts. Table 1 Catalyst Cu loading (wt%) SBET (m2g−1) Vp (cm3g−1) dp (nm) SCu (m2g−1) Cu dispersion(%) C loading(wt%) Af-0.08E-Cu/SiO2 21.1 349 0.54 4.8 8.7 7.8 ≤0.3 E + 0.01-Cu/SiO2 21.8 322 0.60 5.5 11.1 8.2 ≤0.3 E + 0.02-Cu/SiO2 21.1 323 0.54 5.1 10.7 8.1 ≤0.3 E + 0.04-Cu/SiO2 20.4 313 0.48 4.8 10.0 7.9 ≤0.3 E + 0.08-Cu/SiO2 19.6 301 0.45 4.7 10.3 8.1 ≤0.3 Table 2 Cu LMM deconvolution results of catalysts. Table 2 Catalyst K.E. (eV) a A.P. (eV) b B.E. ofCu2p 3/2 (eV) X Cu + (%) c Cu+ Cu0 Cu+ Cu0 Af-0.08-Cu/SiO2 912.6 916.1 1845.4 1848.9 932.8 58.9 E + 0.01-Cu/SiO2 912.6 916.0 1845.6 1849.0 933.0 59.3 E + 0.02-Cu/SiO2 913.4 916.5 1845.4 1849.5 933.0 69.1 E + 0.04-Cu/SiO2 912.9 915.7 1845.9 1848.7 933.0 62.6 E + 0.08-Cu/SiO2 913.0 915.2 1845.9 1848.1 932.9 47.4 a Kinetic energy. b Auger parameter. c Intensity ratio between Cu+ and (Cu+ + Cu0) by deconvolution of Cu LMM XAES. Table 3 The catalytic activity of catalysts for DMO hydrogenation. Table 3 Catalyst 160 °C 180 °C Conv.(%) Selec. (%) TOF(h−1) b Conv.(%) Selec. (%) EG EtOH MG Other a EG EtOH MG Other a Af-0.08-Cu/SiO2 35.72 11.50 0.16 88.03 0.31 14.3 99.03 75.41 0.13 24.12 0.34 E + 0.01-Cu/SiO2 41.11 11.73 0.03 87.60 0.64 12.9 99.67 91.21 0.07 8.14 0.58 E + 0.02-Cu/SiO2 67.31 16.90 0.06 82.51 0.53 22.0 99.98 97.52 0.44 0.60 1.44 E + 0.04-Cu/SiO2 54.52 15.51 0.01 84.13 0.35 19.0 99.97 97.70 0.26 1.26 0.78 E + 0.08-Cu/SiO2 46.48 11.69 0.16 87.77 0.38 15.7 99.98 96.68 0.02 2.46 0.84 Reaction conditions: P(H2) = 2.0 MPa, H2/DMO = 100 (mol mol−1), WLHSVDMO = 1 h−1. a Other byproducts, including 1,2-BDO and 1,2-PDO. b TOF values calculated by the surface Cu numbers of N2O titration. Research Paper Late redistribution effect of copper species in the Cu/SiO2 catalyst induced by EDTA Tianyou Li Writing – original draft Visualization Investigation Formal analysis Data curation a Yihua Wang Visualization Data curation a b Pinmei Yan Visualization Formal analysis a Ling Lin Writing – review & editing Validation Supervision Conceptualization a ⁎ Yuangen Yao Resources Project administration Funding acquisition a ⁎ a Key Laboratory of Coal to Ethylene Glycol and Its Related Technology, Fujian Institute of Research on the Structure of Matter, Chinese Academy of Sciences, Fuzhou 350002, China Key Laboratory of Coal to Ethylene Glycol and Its Related Technology Fujian Institute of Research on the Structure of Matter Chinese Academy of Sciences Fuzhou 350002 China aKey Laboratory of Coal to Ethylene Glycol and Its Related Technology, Fujian Institute of Research on the Structure of Matter, Chinese Academy of Sciences, Fuzhou 350002, China b University of Chinese Academy of Sciences, Beijing 100049, China University of Chinese Academy of Sciences Beijing 100049 China bUniversity of Chinese Academy of Sciences, Beijing 100049, China ⁎ Corresponding authors. The Cu/SiO2 catalyst is widely used in the catalytic hydrogenation reactions of numerous CO bonded compounds, due to its economy and efficiency. In this work, it is found that the EDTA introduced after ammonia evaporation could dissolve part of the copper phyllosilicate in the catalysts prepared by the ammonia-evaporation method, which is called the dissolution effect. Further research shows that the dissolution of the copper phyllosilicate will release Cu2+ ions and silica, then the two will take place ion exchange to form CuOSi units that could be reduced to stable Cu2O. To some extent, the formation of new Cu2O prevents the severe decrease of Cu+ caused by the dissolution of the copper phyllosilicate, which even makes E + 0.02-Cu/SiO2 catalyst have the highest content of Cu+ (69.1 %). Moreover, the Cu2+ species adsorbed in the silica layers would decrease with the introduction of EDTA, which conduces to the formation of more dispersed Cu0 species with smaller particle sizes. In the hydrogenation reaction of dimethyl oxalate (DMO) to ethylene glycol (EG), the optimal catalytic performance (99.86 % DMO conversion and 97.58 % EG selectivity) can be obtained over the E + 0.02-Cu/SiO2 catalyst at 180 °C during the life evaluation of 300 h. This work reports a strategy for improving the performance and stability of the Cu/SiO2 catalyst by realizing the late redistribution of copper species. Graphical abstract The introduction of moderate EDTA twice in the process of preparing Cu/SiO2 catalysts by the ammonia- evaporationmethod reduces the size of Cu0 nanoparticles and realizes the late redistribution of copper species. Image, graphical abstract Keywords EDTA Cu/SiO2 Dimethyl oxalate, Ethylene glycol, Hydrogenation Data availability Data will be made available on request. 1 Introduction Ethylene glycol (EG) is a common bulk chemical widely used in polyester, antifreeze and other industries [1,2]. Currently, the ethylene oxide method for the petroleum route and the oxalic ester method for the coal route are the two main production technologies of EG [3,4]. The petroleum route is the traditional production technology of EG, but it is extremely vulnerable to the impact of unstable petroleum prices because of the increasing depletion of petroleum resources and the unpredictable international situation, so the oxalic ester method for the coal route was promptly developed and gradually matured in recent years [5]. In this method, the syngas produced by coal is first converted to dimethyl oxalate (DMO), and then DMO is hydrogenated to create EG. Lamentedly, there are still a few technical difficulties in this method, for instance, the stability of DMO hydrogenation catalysts and the purity of the product still need to be further improved. The hydrogenation of DMO is the final stage in the coal-to-EG process, which directly influences the quality of EG [6]. The copper-based catalyst is the best catalyst for DMO hydrogenation to EG due to its advantages of non-toxicity, low cost and high efficiency [1]. The copper-based catalyst has also been a focus of research in the field of catalysis because it also has outstanding catalytic performance in the hydrogenation of numerous CO bond molecules, including CO2, methyl acetate, ethylene carbonate, furfural, glycerol, etc. [2,7,8]. The copper-based catalyst has strong catalytic activity but low stability and inadequate life because of the aggregation and sintering of copper species, which severely restricts its employment in industrial production [4,9]. Therefore, the primary goal of present research on the copper-based catalyst is to increase its stability and lengthen its service life [10]. The ammonia-evaporation method is a common method for preparing Cu/SiO2 catalysts, and the calcined catalysts prepared by this method mainly contain ion-exchanged CuOSi units, copper phyllosilicate and CuO [11]. It is widely believed that the synergistic effect of Cu+ and Cu0 is the key to catalytic hydrogenation for Cu/SiO2 catalysts [4,11–13], and the Cu+mainly derives from CuOSi units and copper phyllosilicate [14–16]. Because of the larger specific surface area, copper phyllosilicate can give a higher copper content for catalysts [17]. Several studies have indicated that a higher copper phyllosilicate proportion is advantageous to improve catalytic performance [11,18]. Ding et al. [14] reported that ion-exchanged CuOSi units are conducive to the generation of Cu2O species, which are more stable than Cu+ OSi units derived from copper phyllosilicate because the Cu+ OSi unit is easily oxidized back to copper phyllosilicate in the hydrogenation reaction. Therefore, the catalyst with more ion-exchanged CuOSi units prepared by the deposition-precipitation method has higher performance than that prepared by the ammonia-evaporation method. It can be inferred that CuOSi units and copper phyllosilicate are two important copper species in Cu/SiO2 catalysts, and the balance between them is critical to the performance of catalysts. According to this viewpoint, the performance and stability of the Cu/SiO2 catalyst may be further improved if the formed copper phyllosilicate is partly converted into CuOSi units in a controlled way during the preparation of catalysts by the ammonia-evaporation method, so as to optimize the ratio of copper phyllosilicate and CuOSi units. It has been reported that EDTA can extract copper metal from copper mines by dissolving chrysocolla, which has the same structure as copper phyllosilicate [19–21]. Herein, EDTA is introduced into the precursor solution after ammonia evaporation (the bivalent copper species has been basically stable), and it is found that the performance of the catalyst is higher than that of the Cu/SiO2 catalyst without EDTA, but inferior to that (0.08E-Cu/SiO2) of the catalyst introduced EDTA before ammonia evaporation (Table S1). Based on our previous work, therefore, EDTA is added to the Cu/SiO2 catalyst both before and after ammonia evaporation, and the resulting catalyst shows a higher catalytic performance. The effect of EDTA before ammonia evaporation has been reported in the previous work [22], so this work focuses on the effect of EDTA after ammonia evaporation on the already stable copper species. The results show that the introduction of EDTA after ammonia evaporation caused the redistribution of stable bivalent copper species, which optimized the ratio of each copper species, and thus improved the performance of the Cu/SiO2 catalyst. 2 Experimental 2.1 Catalysts preparation All catalysts were prepared using the ammonia-evaporation method as previously reported in the literature (Scheme 1 ) [22]. Taking Af-0.08E-Cu/SiO2 as an example, the detailed preparation steps are as follows: (a) 10.6 g of Cu(NO3)2·3H2O and 6.0 g of urea were completely dissolved in 200 mL of deionized water with stirring, subsequently, 24 mL of 25∼28 wt% ammonia aqueous solution and 42.0 g of 20 wt% silica sol were added successively to the mixed solution at room temperature; (b) the mixed solution was sealed at 80 °C for 1 h and then opened to allow the evaporation of ammonia until the pH reached 6∼7; (c) EDTA (nEDTA/nCu = 0.08) was introduced into the mixed solution after ammonia evaporation, then it needed to be stirred for another 2 h before suction filtration and washing with deionized water at the same time, the cake was dried at 120 °C for 12 h before being calcined at 450 °C for 5 h. This catalyst was named Af-0.08E-Cu/SiO2. E + x-Cu/SiO2 catalysts were prepared based on the 0.08E-Cu/SiO2 catalyst (x = nEDTA/nCu) [22]. That was, EDTA (nEDTA/nCu = 0.08) was introduced together with the copper source before ammonia evaporation, and then different amounts of EDTA (nEDTA/nCu = x) were introduced again after ammonia evaporation, and the mixed solution should be stirred for another 2 h after EDTA was introduced a second time. The subsequent procedures were the same as that of the Af-0.08E-Cu/SiO2 catalyst, in the end, the obtained catalysts were named E + x-Cu/SiO2 catalysts (x represented the molar ratio of the second introduced EDTA to copper). 2.2 Dissolution experiment of copper phyllosilicate 2.2.1 Dissolution of copper phyllosilicate in EDTA solution The calcined Cu/SiO2 catalyst of 2.5 g was immersed in 200 mL of EDTA solution with different mass concentrations. The suspension was stirred at 80 °C for 2 h before suction filtration, and the filter cake was dried at 120 °C for 12 h. The resultant samples were given the designation “y-EDTA”, where y (g/L) represented the mass concentration of EDTA. y = 0 indicated that no EDTA was added, this sample served as a blank control. The relative content of copper phyllosilicate in the samples was measured by the value of I673/I800 in the Fourier transform infrared spectra. The pore size distributions of 1-EDTA and 5-EDTA samples were characterized by N2 adsorption-desorption experiments. 2.2.2 Dissolution of copper phyllosilicate in EDTA4Na solution The calcined 0.08E-Cu/SiO2 catalyst of 3.0 g was immersed in 200 mL of EDTA solution and EDTA4Na solution (nEDTA = nEDTA4Na). The suspension was stirred at 80 °C for 2 h before suction filtration, and the filter cake was dried at 120 °C for 12 h. The resultant samples were named as “EDTA” or “EDTA4Na”, respectively. The sample immersed in deionized water served as a blank control, which was marked as “H-0.08E-Cu/SiO2”. The relative content of copper phyllosilicate in the samples was measured by the value of I673/I800 in the Fourier transform infrared spectra. 2.3 Catalysts characterization The Cu loadings in catalysts were determined by an inductively coupled plasma optical emission spectrometer (ICP-OES) produced by HORIBA Jobin Yvon. The C element loadings in the catalysts were measured by an element analyzer (EA) manufactured by Elementar, whose model was Vario EL-Cube. N2 adsorption-desorption isotherms of catalysts were measured at −196 °C using ASAP 2020 rapid specific surface area and aperture analyzer produced by Micrometrics. The BET equation was used to calculate the specific surface area (SBET) of catalysts. Except for the pore volume (Vp) calculated by the single-point method, the mean pore diameter (Dp) and pore diameter distributions were obtained by the BJH method. N2O pulse titration was used to measure the surface area and dispersion of active copper in catalysts. Firstly, the catalysts were reduced in H2 so that the copper species were reduced to Cu0 and Cu+; then the Cu0 was oxidized to Cu+ by reacting with N2O, and the reaction equation was 2Cu (s) + N2O → N2 + Cu2O (s); finally, reducing Cu+ to Cu0 with H2 pulse. The Cu surface area (SCu) of catalysts was calculated by measuring the amount of hydrogen consumption in the second stage, and the atomic density of copper in catalysts was calculated as 1.46 × 1019 copper atoms per m2. The crystalline state of catalysts was characterized by a Rigaku Miniflex 600 bench powder X-ray diffractometer with Cu target (XRD). The scanning range and speed were 10°∼80°and 2.5°/min, respectively. Bruker Vertex 70 Fourier transform infrared spectroscopy (FT-IR) was used to characterize the different species in catalysts. The catalysts were made into pieces with KBr in a ratio of 1:100. The wave number range and the spectral resolution were 400∼4000 cm−1 and 4 cm−1. The morphology was observed by transmission electron microscopy (TEM) produced by FEI Company in the United States with an operating voltage of 200 kV. Autochem Ⅱ2920 produced by Micromeritics Corporation of USA was used for the H2-temperature programmed reduction experiment (H2-TPR). The catalysts were pretreated for 2 h in a flowing Ar atmosphere at 120 °C to remove moisture and impurities before testing. After the catalysts were cooled to 50 °C, the Ar flow was replaced with the 10 %H2–90 %Ar flow, then they were heated to 800 °C at a rate of 10 °C/min, meanwhile, the H2 consumption was detected by a TCD detector and an MS signal. X-ray photoelectron spectroscopy (XPS) and Auger electron spectroscopy (XAES) were determined by the ESCALAB 250Xi spectrometer with Al Kα radiation (Hν = 1486.6 eV) and multi-channel detector, which was produced by Thermo Fisher, and the binding energy (BE) of Si2p (103.7 eV) was used as the calibration binding energy of XPS. 2.4 Evaluation of catalytic activity The DMO hydrogenation reaction was carried out in a continuous flow gas-solid stainless-steel reactor. Before the hydrogenation reaction, DMO was dissolved in methanol to prepare the raw material liquid with a mass concentration of 0.1 g/mL. The reaction required filling the tube with 1 g of target catalyst (20∼40 meshes), and refractory cellucotton was used to separate the catalyst and quartz sand, which fills the remaining space in the tube to stabilize the H2 flow. Before the reaction, the catalysts were reduced for 5 h in the H2 flow with a flow of 100 mL/min at 300 °C and 2 MPa, and the heating rate was 1 °C/min. The raw material liquid was fed into a carburetor by a high-pressure metering pump at different temperatures, the weight liquid hour space velocity of DMO (WLHSVDMO) was 1.0 h−1 and the molar ratio of H2/DMO was 100, at last, the products were analyzed by gas chromatography with a flame ionization detector. 3 Result 3.1 Structure and physicochemical properties The results of ICP, EA, BET and N2O titration are summarized in Table 1 . According to the results of ICP, the Cu loadings of all catalysts are between 20 % and 22 %, and it exhibits a tendency toward reduction with the increase of EDTA after ammonia evaporation, yet the trend is not severe due to EDTA's restricted introduction. Pursuant to the results of EA, the C loadings of all catalysts are all below the detection limit, which is attributed to the removal of EDTA during the washing process. The results of N2 adsorption-desorption experiment (Fig. S1) reveal that all catalysts have almost identical IV-type isotherms, indicating that they have mesoporous structures [23–25]. The smaller pore size (about 3 nm) is mainly attributed to the copper phyllosilicate layers, while the larger pore size (about 6∼8 nm) is mainly attributed to the SiO2 accumulation [26]. It can be seen from Table 1 and Table S2 that the introduction of EDTA after ammonia evaporation leads to an increase in the average pore size of Af-0.08E-Cu/SiO2 and E + x-Cu/SiO2 compared with that of Cu/SiO2 and 0.08-Cu/SiO2, respectively. The pore size distribution curves (Fig. S1B) also show that the introduction of EDTA after ammonia evaporation increases the large pore size. The alteration of pore size indicates that there may be the formation of new SiO2 accumulation with the introduction of EDTA after ammonia evaporation. According to the results of N2O titration (Table 1 and Table S2), the SCu of Af-0.08E-Cu/SiO2 catalyst is significantly lower than that of Cu/SiO2 catalyst, and the SCu of E + x-Cu/SiO2 catalysts is significantly lower than that of 0.08E-Cu/SiO2 catalyst. It can be inferred that the amount of Cu0 nano-particles (Cu0 NPs) will decrease with the introduction of EDTA after ammonia evaporation. 3.2 Evolution of crystalline phase and morphology The XRD results of calcined catalysts are displayed in Fig. S2. The weak diffraction peaks at 31.5°, 36°, and 57.5° belong to copper phyllosilicate, whereas the wide diffraction peak at around 22° is attributed to amorphous SiO2 [11,27]. The patterns of reduced and used catalysts are illustrated in Fig. 1 , and the diffraction peaks of 37.1° and 43.2° correspond to Cu2O and Cu, respectively [14,28,29]. The Cu peaks of E + 0.02-Cu/SiO2 catalyst are weaker in both the reduced and used patterns, especially in the used one, besides the Cu peak of used Af-0.08E-Cu/SiO2 catalyst is also weaker than that of Cu/SiO2 catalyst, which is shown in Fig. S3. This indicates that it is beneficial to inhibit the agglomeration of copper species with the introduction of EDTA after ammonia evaporation. In addition, it could be observed by the TEM images (Fig. 2 ) of the used catalysts that the particle sizes of E + 0.02-Cu/SiO2 and Af-0.08E-Cu/SiO2 are reduced to below 2 nm and less than that of 0.08E-Cu/SiO2 and Cu/SiO2 catalysts (Fig. S4), respectively, at the same time, the dispersion state of copper species is obviously improved, which is consistent with the results of XRD. This suggests that it is conducive to the formation of smaller and better dispersion copper species with the introduction of EDTA after ammonia evaporation. Only one single reduction peak for all catalysts can be observed in Fig. 3 , which corresponds to the reduction of Cu2+ species (copper phyllosilicate, CuOSi units and copper oxide) [11,18]. The reduction temperatures of E + x-Cu/SiO2 catalysts are all at about 193.5 °C, which is similar to that of 0.08E-Cu/SiO2 catalyst but lower than that of Cu/SiO2 catalyst (Fig. S4F). This suggests that it facilitates the formation of smaller copper species with the twice introductions of EDTA. The results of FT-IR are depicted in Fig. 4 , the presence of copper phyllosilicate is demonstrated by both the νSiO asymmetric stretching vibration peak at 1035 cm−1 and the δOH deformation vibration peak at 673 cm−1 [11,13,30]. It has been widely acknowledged that the ratio of the δOH intensity at 673 cm−1 (I673) to the νSiO intensity at 800 cm−1 (I800) could be used to quantify the relative change of copper phyllosilicate [11,14,30]. The results of I673/I800 in Table S3 show that the relative content of copper phyllosilicate decreases obviously with the introduction of EDTA after ammonia evaporation, and that decreases more seriously for the E + x-Cu/SiO2 catalysts which is introduced EDTA twice. 3.3 Chemical states of surface species The results of XPS analysis performed to determine the chemical state of copper on the catalyst surfaces are displayed in Fig. 5 . All copper species are divalent, which is proved by the photoelectron peaks of Cu 2p3/2 at around 935.8 eV and Cu 2p1/2 at 955.7 eV as well as the satellite vibration peaks at 940∼947 eV and 960∼965 eV [12,31,32]. Copper phyllosilicate and CuOSi units should be responsible for the peak at 935.8 eV, and the CuO is thought to be responsible for the shoulder peak at 933.4 eV [15]. The presence of Cu2O and Cu has been proved by the XRD results of reduced catalysts, therefore the absence of the Cu 2p satellite vibration peak suggests that all copper species undergo reduction transformation from Cu2+ to Cu+ and Cu0. The photoelectron peaks of Cu+ and Cu0 overlap at 933.0 eV, thus the Auger spectrum is utilized to further separate them, whose results are displayed in Fig. 6 and Table 2 , there are the peaks of Cu+ and Cu0 at 913.0 eV and 916.2 eV, respectively [11,33,34]. According to the intensity ratio between Cu+ and (Cu+ + Cu0) by deconvolution of Cu LMM XAES, it is found that the Cu+contents of most catalysts nearly remain unaltered and are quite similar to that of 0.08E-Cu/SiO2 and Cu/SiO2 (Table S4), and only a little rise is seen in the catalyst of E + 0.02-Cu/SiO2. Unexpectedly, the Cu+ content of E + 0.08-Cu/SiO2 decreases significantly, the reasons for which will be explained in the discussion section. 3.4 Solubility of copper phyllosilicate in EDTA and its salts solution It has been reported in industry that the EDTA aqueous solution was used to dissolve copper phyllosilicate [19,20]. In this work, the relationship between the EDTA concentration and the solubility of copper phyllosilicate is further discussed. As shown in Fig. S5A, the relative content of copper phyllosilicate is decreasing dramatically with the increasing concentration of EDTA solution. The peak at 1035 cm−1 totally vanishes as the concentration of EDTA solution reaches 5 g/L, and the value of I673/I800 falls from 0.464 to 0.073, at the same time, the peak of SiOH appears at 970 cm−1 [9,35,36]. According to the results of the dissolution experiment in EDTA solution, it could be inferred that copper phyllosilicate could be completely dissolved in EDTA aqueous solution of 5 g/L, and the dissolution degree of copper phyllosilicate is related to the concentration of EDTA aqueous solution. On the other hand, it can be seen from the pore size distribution curves of 1-EDTA and 5-EDTA in Fig. S6 that the pore size of the samples soaked in EDTA solution increases significantly. Combined with the above characterization, it can be inferred that the dissolution of copper phyllosilicate produces new silica, which can redeposit to form larger mesoporous, being proved by the pore size distribution results of the catalysts (Fig. S1B). It has been proved that EDTA solution can dissolve copper phyllosilicate, but is it only the Y4− ions produced by EDTA ionization play a key role in the dissolution process? To verify this problem, the EDTYA4Na solution was used to dissolve copper phyllosilicate. According to the FT-IR results in Fig. S5B, the I673/I800 in the sample with EDTA4Na declines from 0.458 to 0.314, while the one with EDTA decreases to 0.198. It is easy to conclude that EDTA contributes more to copper phyllosilicate breakdown than Y4− ions during the process. It may be a plausible explanation that Y4− ions hardly directly chelate Cu2+ ions from copper phyllosilicate by reason of the stability of copper phyllosilicate, while EDTA is able to interact with copper phyllosilicate at a certain temperature to destroy the stable structure of copper phyllosilicate, and then Cu2+ ions are gradually released, which could be chelated by Y4− ions to stable CuY2− ions. Based on the above, the solubility of copper phyllosilicate depends on the EDTA concentration, and the solution containing only Y4− ions makes it difficult to dissolve copper phyllosilicate. The dissolution of copper phyllosilicate caused by EDTA could be called as “dissolution effect”. 3.5 Catalytic evaluation Based on previous activity evaluation results [22], the ideal reaction temperature of 0.08E-Cu/SiO2 catalyst was 180 °C. The DMO hydrogenation catalytic performances of all catalysts are shown in Table 3 and Table S1. All the E + x-Cu/SiO2 catalysts have better conversion and selectivity than the Cu/SiO2 catalyst at 180 °C, and the E + 0.02-Cu/SiO2 catalyst achieves comparable conversion and selectivity to the 0.08E-Cu/SiO2 catalyst. The TOF value of E + 0.02-Cu/SiO2 catalyst (22.0) is higher than that of 0.08E-Cu/SiO2 catalyst (16.0), and the TOF value of Af-0.08E-Cu/SiO2 catalyst (14.3) is also higher than that of Cu/SiO2 catalyst (8.6). This shows that the introduction of EDTA after ammonia evaporation can improve the catalytic performance of catalysts, and it could be further enhanced by introducing the appropriate amount of EDTA twice, that is, it is introduced at the same time as copper nitrate and reintroduced after ammonia evaporation. As can be seen from Fig. 8 , the E + 0.02-Cu/SiO2 catalyst shows outstanding stability and catalytic performance during a long reaction period, the average conversion of DMO and the average selectivity of EG for the life evaluation of 300 h are 99.86 % and 97.58 %, respectively, while the maximum values are 99.99 % and 98.75 %. In addition, the stability of E + 0.02-Cu/SiO2 catalyst also was evaluated under lower conversion. As shown in Fig. S4(I), it can be seen that the conversion of DMO is not less than 70 %, and the selectivity of EG is not less than 40 % during the evaluation process of 250 h at 170 °C, which shows that the catalyst can still maintain high stability even if under harsher conditions. As for the stability of Cu/SiO2, the earlier researches of our team have proved that it showed an obvious deactivation within 100 h [15,37], so it is not evaluated repeatedly. The activities of some copper-based catalysts in recent years also have been summarized in Table S5. It can be seen that the E + 0.02-Cu/SiO2 catalyst can maintain higher activity and stability under more demanding conditions. 4 Discussion In our previous work, it was discovered that the 0.08E-Cu/SiO2 catalyst with an appropriate amount of EDTA introduced before the formation of copper phyllosilicate had a good catalytic performance. In this work, the effects of EDTA reintroduced after the formation of copper phyllosilicate on the formation of surface copper species and the structure–performance relationship of Cu/SiO2 catalysts are further investigated. It is worth mentioning that copper phyllosilicate has been formed after ammonia evaporation [26], in other words, the secondary introduction of EDTA also occurs after the formation of copper phyllosilicate. 4.1 Dissolution of copper phyllosilicate The results of BET show that the reintroduction of EDTA after the formation of copper phyllosilicate will result in the formation of larger pores. The dissolution experiment also proves that it will produce new SiO2 with the dissolution of copper phyllosilicate in the EDTA solution. The results of FT-IR show that the reintroduction of EDTA results in a significant decrease of copper phyllosilicate in E + x-Cu/SiO2 catalysts, and the decrease is more severe than that of Af-0.08-Cu/SiO2 catalyst which is introduced with EDTA only after ammonia evaporation. It shows that there is a “dissolution effect” as the EDTA is introduced after copper phyllosilicate formation. The dissolution experiment also indicates that copper phyllosilicate is more easily dissolved in an EDTA solution than in an EDTA salt solution. EDTA introduced along with copper nitrate has caused the formation of CuY2− ions in the solution, which inhibits the ionization of EDTA introduced after ammonia evaporation, so more unionized EDTA can be used to dissolve copper phyllosilicate. Therefore, the dissolution effect of twice introducing EDTA is more serious than that of introducing EDTA only after ammonia evaporation. 4.2 Redistribution of copper species The results of ICP show that the Cu loadings of catalysts do not decrease until the molar ratio of EDTA to Cu exceeds 0.04. The XPS results indicate that the moderate introduction of EDTA after ammonia evaporation does not cause a significant decrease in Cu+ species, and even slightly increases the Cu+ content. Based on the above, it can be inferred that new Cu(II) species will be formed at the same time with the dissolution of copper phyllosilicate. Chen et al. [11] thought in addition to copper phyllosilicate, the calcined catalyst prepared by the ammonia-evaporation method also contains ion-exchanged CuOSi units formed by the ion exchange of Cu2+ and SiO2 in the solution and CuO derived from copper hydroxide adsorbed in SiO2 layers. Importantly, CuOSi units could be reduced to form Cu2O, which is also the main source of Cu+. The dissolution experiment proves that the dissolution of copper phyllosilicate will produce new SiO2. Hence, it is believed that Cu2+ ions derived from dissolved copper phyllosilicate could form ion-exchanged CuOSi units with the newly formed SiO2. In addition, Cu2O from CuOSi units is more stable than Cu+ OSi unit from copper phyllosilicate, because the Cu+ OSi unit is easily oxidized back to copper phyllosilicate in the hydrogenation reaction [14]. Therefore, the amount of Cu+ species did not decrease with moderate EDTA when the total loading in the catalyst was almost constant. In contrast to the 0.08E-Cu/SiO2 catalyst, the SCu of the E + x-Cu/SiO2 catalysts continuously decreases as more EDTA is introduced. This is owing to more Y4− ions generated from EDTA can chelate with copper ammonia ions to CuY2− ions, which causes a decrease in surface Cu species (like CuO). In this way, the amount of copper ammonia ions adsorbed in SiO2 accumulation layers by electrostatic interaction will decrease. Obviously, the amount of Cu0 derived from absorbed Cu2+ would decrease with the introduction of EDTA after ammonia evaporation, which is helpful to inhibit the size increase of Cu0 NPs due to agglomeration. Of course, too much Y4− in the solution will also seriously reduce the amount of surface Cu0 NPs. 4.3 Study on structure-activity relationship In this work, the EDTA introduced after ammonia evaporation can dissolve the copper phyllosilicate, causing Cu2+ ions to be released again, while those Cu2+ ions can form ion-exchanged CuOSi units with new SiO2 by ion exchange. It is important that the ion-exchanged CuOSi units could be reduced to new and stable Cu2O during pre-reduction. However, the dissolution effect of copper phyllosilicate will become serious with the excessive increase of EDTA, meanwhile, the pH value in the solution will also obviously decrease, which is not conducive to (but not completely terminated) the formation of ion-exchanged CuOSi units [38]. Therefore, the relative content of formed CuOSi units will be significantly less than that of dissolved copper phyllosilicate with the excessive introduction of EDTA, and then the XCu + will decrease significantly, such as E + 0.08-Cu/SiO2 catalyst. In short, the introduction of appropriate EDTA favors the formation of new Cu2O, and the reduction of Cu+ content is mainly due to the excessive dissolution of copper phyllosilicate and the decline of pH induced by excess EDTA. It is widely believed that the synergistic effect of Cu+ and Cu0 is the key to catalytic hydrogenation for Cu/SiO2 catalysts. The higher TOF value reflects the stronger synergistic effect of Cu+ and Cu0. Ma et al. [29] believed that when the content of Cu0 species on the catalyst surface is insufficient (less than 20 m2/g), the hydrogenation performance is improved with the increase of the specific surface area of Cu0 species; when the Cu0 species on the catalyst surface is relatively sufficient, the Cu+ species play a leading role, and the hydrogenation performance is linearly positively correlated with the specific surface area of Cu+ species. Table 1 shows that the E + x-Cu/SiO2 catalysts have a similar Cu0 surface area, so the performances of catalysts are mainly determined by the Cu+ content, which is also proved by the consistent change trend of XCu + (Table 2) and TOF value (Table 3). As for Af-0.08-Cu/SiO2 catalyst, the lower TOF value is attributed to its lower SCu. Although the TOF value of E + 0.1-Cu/SiO2 is the lowest, its activity at 160 °C is still higher than that of Af-0.08-Cu/SiO2 catalyst, which may be due to the lower SBET and higher SCu resulting in agglomeration of Cu0. According to the particle size data derived from TEM and XRD (Table S3), the size of E + 0.1-Cu/SiO2 catalyst (DXRD = 6.5 nm and DTEM = 1.9 nm) is significantly higher than that of Af-0.08E-Cu/SiO2 catalyst (DXRD = 6.0 nm and DTEM = 1.7 nm), which is a good proof of our speculation. In conclusion, the appropriate EDTA introduced after ammonia evaporation promotes the formation of more and stable Cu+ sites, optimizes the number and dispersion of Cu0 species by the redistribution effect of copper species, which improves the synergistic effect of Cu+ and Cu0. 5 Conclusions In this work, it is found that EDTA introduced after ammonia evaporation is able to dissolve part of copper phyllosilicate through the dissolution effect, then the release Cu2+ and silica because of dissolution could form ion-exchanged CuOSi units by ions exchange. The stable Cu2O formed by the reduction of new CuOSi units provides more stable Cu+ sites for the catalysts. EDTA also reduces the Cu2+ species adsorbed in the silica layers through chelation, thus promoting the formation of more dispersed small particle size Cu0NPs. The stable Cu+ sites and highly dispersed Cu0 sites improve the synergy of the two. The 99.86 % DMO conversion and 97.58 % EG selectivity can be obtained over the E + 0.02-Cu/SiO2 catalyst at 180 °C during the life evaluation of 300 h. The late redistribution of copper species is successfully realized by introducing EDTA after ammonia evaporation, which improves the performance of the catalysts. It provides a novel scheme for the modification of copper-silicon catalysts. CRediT authorship contribution statement Tianyou Li: Writing – original draft, Visualization, Investigation, Formal analysis, Data curation. Yihua Wang: Visualization, Data curation. Pinmei Yan: Visualization, Formal analysis. Ling Lin: Writing – review & editing, Validation, Supervision, Conceptualization. Yuangen Yao: Resources, Project administration, Funding acquisition. Declaration of competing interest The authors declare that they have no known competing financial interests or personal relationships that could have appeared to influence the work reported in this paper. Acknowledgments This work was supported by the National Key R&D Program of China (2018YFA0704500), the National Natural Science Foundation of China (U23B20164&22102186) and the Self-deployment Project Research Program of Haixi Institutes, Chinese Academy of Sciences (CXZX-2022-GS03, CXZX-2022-GH05). Supplementary materials Supplementary material associated with this article can be found, in the online version, at doi:10.1016/j.mcat.2024.114290. Appendix Supplementary materials Image, application 1 References [1] R. Ye L. Lin Q. Li Z. Zhou T. Wang C.K. Russell H. Adidharma Z. Xu Y. Yao M. Fan Recent progress in improving the stability of copper-based catalysts for hydrogenation of carbon-oxygen bonds Catal. Sci. Technol. 8 2018 3428 3449 10.1039/C8CY00608C R. Ye, L. Lin, Q. Li, Z. Zhou, T. Wang, C.K. Russell, H. Adidharma, Z. Xu, Y. Yao, M. Fan, Recent progress in improving the stability of copper-based catalysts for hydrogenation of carbon-oxygen bonds, Catal. Sci. Technol., 8 (2018) 3428–3449. https://doi.org/10.1039/C8CY00608C [2] J. Lv X. Ma Y. Wang Y. Zhao High-performance copper-based catalysts for ethylene glycol and ethanol synthesis via ester hydrogenation reactions Sci. Sin. Chim. 50 2020 183 191 J. Lv, X. Ma, Y. Wang, Y. Zhao, High-performance copper-based catalysts for ethylene glycol and ethanol synthesis via ester hydrogenation reactions, Sci. Sin. Chim., 50 (2020) 183–191. [3] H. Chen Y. Zhu G. Ding H. Zheng Y. Li Study on hydrogenation of dimethyl oxalate to ethylene glycol J. Fuel Chem. Technol. 39 2011 519 526 H. Chen, Y. Zhu, G. Ding, H. Zheng, Y. Li, Study on hydrogenation of dimethyl oxalate to ethylene glycol, J. Fuel Chem. Technol., 39 (2011) 519–526. [4] Z. He H. Lin P. He Y. Yuan Effect of boric oxide doping on the stability and activity of a Cu-SiO2 catalyst for vapor-phase hydrogenation of dimethyl oxalate to ethylene glycol J. Catal. 277 2011 54 63 10.1016/j.jcat.2010.10.010 Z. He, H. Lin, P. He, Y. Yuan, Effect of boric oxide doping on the stability and activity of a Cu-SiO2 catalyst for vapor-phase hydrogenation of dimethyl oxalate to ethylene glycol, J. Catal., 277 (2011) 54–63. https://doi.org/10.1016/j.jcat.2010.10.010 [5] Z. Wang Z. Xu S. Peng Z. Zhou P. Pan L. Lin Y. Qin G. Guo Y. Yao New catalysts for coal to ethylene glycol Chin. J. Chem. 35 2017 759 768 10.1002/cjoc.201600746 Z. Wang, Z. Xu, S. Peng, Z. Zhou, P. Pan, L. Lin, Y. Qin, G. Guo, Y. Yao, New catalysts for coal to ethylene glycol, Chin. J. Chem., 35 (2017) 759–768. https://doi.org/10.1002/cjoc.201600746 [6] Z. Zhou Z. Li P. Pan L. Lin Y. Qin Y. Yao Progress in technologies of coal-based ethylene glycol synthesis Chem. Ind. Eng.Prog. 29 2010 2003 2009 Z. Zhou, Z. Li, P. Pan, L. Lin, Y. Qin, Y. Yao, Progress in technologies of coal-based ethylene glycol synthesis, Chem. Ind. Eng.Prog., 29 (2010) 2003–2009. [7] Z. Chen J. Chen Comparative study of the effect of water on Cu/SiO2 catalysts prepared by different methods: structure, hydrogenation performance and the promotion of reduction Cu+ to Cu0 ChemistrySelect 5 2020 10781 10786 10.1002/slct.202002545 Z. Chen, J. Chen, Comparative study of the effect of water on Cu/SiO2 catalysts prepared by different methods: structure, hydrogenation performance and the promotion of reduction Cu+ to Cu0, ChemistrySelect, 5 (2020) 10781–10786. https://doi.org/10.1002/slct.202002545 [8] G. Cui X. Meng X. Zhang W. Wang S. Xu Y. Ye K. Tang W. Wang J. Zhu M. Wei D.G. Evans X. Duan Low-temperature hydrogenation of dimethyl oxalate to ethylene glycol via ternary synergistic catalysis of Cu and acid-base sites Appl. Catal. B-Environ. 248 2019 394 404 10.1016/j.apcatb.2019.02.042 G. Cui, X. Meng, X. Zhang, W. Wang, S. Xu, Y. Ye, K. Tang, W. Wang, J. Zhu, M. Wei, D.G. Evans, X. Duan, Low-temperature hydrogenation of dimethyl oxalate to ethylene glycol via ternary synergistic catalysis of Cu and acid-base sites, Appl. Catal. B-Environ., 248 (2019) 394–404. https://doi.org/10.1016/j.apcatb.2019.02.042 [9] R. Ye L. Lin C. Chen J. Yang F. Li X. Zhang D. Li Y. Qin Z. Zhou Y. Yao Synthesis of robust MOF-derived Cu/SiO2 catalyst with low copper loading via sol-gel method for the dimethyl oxalate hydrogenation reaction ACS Catal. 8 2018 3382 3394 10.1021/acscatal.8b00501 R. Ye, L. Lin, C. Chen, J. Yang, F. Li, X. Zhang, D. Li, Y. Qin, Z. Zhou, Y. Yao, Synthesis of robust MOF-derived Cu/SiO2 catalyst with low copper loading via sol-gel method for the dimethyl oxalate hydrogenation reaction, ACS Catal.., 8 (2018) 3382–3394. https://doi.org/10.1021/acscatal.8b00501 [10] G. Cui X. Zhang H. Wang Z. Li W. Wang Q. Yu L. Zheng Y. Wang J. Zhu M. Wei ZrO2-x modified Cu nanocatalysts with synergistic catalysis towards carbon-oxygen bond hydrogenation Appl. Catal. B-Environ. 280 2021 119406 10.1016/j.apcatb.2020.119406 G. Cui, X. Zhang, H. Wang, Z. Li, W. Wang, Q. Yu, L. Zheng, Y. Wang, J. Zhu, M. Wei, ZrO2-x modified Cu nanocatalysts with synergistic catalysis towards carbon-oxygen bond hydrogenation, Appl. Catal. B-Environ., 280 (2021) 119406. https://doi.org/10.1016/j.apcatb.2020.119406 [11] L. Chen P. Guo M. Qiao S. Yan H. Li W. Shen H. Xu K. Fan Cu/SiO2 catalysts prepared by the ammonia-evaporation method: texture, structure, and catalytic performance in hydrogenation of dimethyl oxalate to ethylene glycol J. Catal. 257 2008 172 180 10.1016/j.jcat.2008.04.021 L. Chen, P. Guo, M. Qiao, S. Yan, H. Li, W. Shen, H. Xu, K. Fan, Cu/SiO2 catalysts prepared by the ammonia-evaporation method: texture, structure, and catalytic performance in hydrogenation of dimethyl oxalate to ethylene glycol, J. Catal., 257 (2008) 172–180. https://doi.org/10.1016/j.jcat.2008.04.021 [12] A. Yin X. Guo W. Dai H. Li K. Fan Highly active and selective copper-containing HMS catalyst in the hydrogenation of dimethyl oxalate to ethylene glycol Appl. Catal. A-Gen. 349 2008 91 99 10.1016/j.apcata.2008.07.020 A. Yin, X. Guo, W. Dai, H. Li, K. Fan, Highly active and selective copper-containing HMS catalyst in the hydrogenation of dimethyl oxalate to ethylene glycol, Appl. Catal. A-Gen., 349 (2008) 91–99. https://doi.org/10.1016/j.apcata.2008.07.020 [13] J. Gong H. Yue Y. Zhao S. Zhao L. Zhao J. Lv S. Wang X. Ma Synthesis of ethanol via syngas on Cu/SiO2 catalysts with balanced Cu0-Cu+ sites J. Am. Chem. Soc. 134 2012 13922 13925 10.1021/ja3034153 J. Gong, H. Yue, Y. Zhao, S. Zhao, L. Zhao, J. Lv, S. Wang, X. Ma, Synthesis of ethanol via syngas on Cu/SiO2 catalysts with balanced Cu0-Cu+ sites, J. Am. Chem. Soc., 134 (2012) 13922–13925. https://doi.org/10.1021/ja3034153 [14] J. Ding T. Popa J. Tang K.A.M. Gasem M. Fan Q. Zhong Highly selective and stable Cu/SiO2 catalysts prepared with a green method for hydrogenation of diethyl oxalate into ethylene glycol Appl. Catal. B-Environ. 209 2017 530 542 10.1016/j.apcatb.2017.02.072 J. Ding, T. Popa, J. Tang, K.A.M. Gasem, M. Fan, Q. Zhong, Highly selective and stable Cu/SiO2 catalysts prepared with a green method for hydrogenation of diethyl oxalate into ethylene glycol, Appl. Catal. B-Environ., 209 (2017) 530–542. https://doi.org/10.1016/j.apcatb.2017.02.072 [15] C. Chen L. Lin R. Ye M. Sun J. Yang F. Li Y. Yao Mannitol as a novel dopant for Cu/SiO2: a low-cost, environmental and highly stable catalyst for dimethyl oxalate hydrogenation without hydrogen prereduction J. Catal. 389 2020 421 431 10.1016/j.jcat.2020.06.008 C. Chen, L. Lin, R. Ye, M. Sun, J. Yang, F. Li, Y. Yao, Mannitol as a novel dopant for Cu/SiO2: a low-cost, environmental and highly stable catalyst for dimethyl oxalate hydrogenation without hydrogen prereduction, J. Catal., 389 (2020) 421–431. https://doi.org/10.1016/j.jcat.2020.06.008 [16] R. Ye L. Lin L. Wang D. Ding Z. Zhou P. Pan Z. Xu J. Liu H. Adidharma M. Radosz M. Fan Y. Yao Perspectives on the active sites and catalyst design for the hydrogenation of dimethyl oxalate Acs Catal. 10 2020 4465 4490 10.1021/acscatal.9b05477 R. Ye, L. Lin, L. Wang, D. Ding, Z. Zhou, P. Pan, Z. Xu, J. Liu, H. Adidharma, M. Radosz, M. Fan, Y. Yao, Perspectives on the active sites and catalyst design for the hydrogenation of dimethyl oxalate, Acs Catal.., 10 (2020) 4465–4490. https://doi.org/10.1021/acscatal.9b05477 [17] C.J.G. Vandergrift P.A. Elberse A. Mulder J.W. Geus Preparation of silica-supported copper-catalysts by means of deposition precipitation Appl. Catal. 59 1990 275 289 10.1016/S0166-9834(00)82204-6 C.J.G. Vandergrift, P.A. Elberse, A. Mulder, J.W. Geus, Preparation of silica-supported copper-catalysts by means of deposition precipitation, Appl. Catal., 59 (1990) 275–289. https://doi.org/10.1016/S0166-9834(00)82204-6 [18] Y. Wang W. Yang D. Yao S. Wang Y. Xun Y. Zhao X. Ma Effect of surface hydroxyl group of ultra-small silica on the chemical states of copper catalyst for dimethyl oxalate hydrogenation Catal. Today 350 2020 127 135 10.1016/j.cattod.2019.06.031 Y. Wang, W. Yang, D. Yao, S. Wang, Y. Xun, Y. Zhao, X. Ma, Effect of surface hydroxyl group of ultra-small silica on the chemical states of copper catalyst for dimethyl oxalate hydrogenation, Catal. Today, 350 (2020) 127–135. https://doi.org/10.1016/j.cattod.2019.06.031 [19] 郑若锋, 自然铜矿石中铜的化学物相分析, 四川化工, 1995(S2):28-32 R. Zheng Chemical phase analysis of copper in natural copper ore Sichuan Chem. Ind. S2 1995 28 32 郑若锋, 自然铜矿石中铜的化学物相分析, 四川化工, 1995(S2):28-32. R. Zheng, Chemical phase analysis of copper in natural copper ore. Sichuan Chem. Ind. 1995(S2):28–32. [20] 汪镜亮, 矿石化学物相分析的发展, 矿物岩石, 1987(02):109-14 J. Wang Development of mineral chemical phase analysis Mineral Rock 02 1987 109 114 汪镜亮, 矿石化学物相分析的发展, 矿物岩石, 1987(02):109-14. J. Wang. Development of mineral chemical phase analysis. Mineral Rock 1987(02):109–14. [21] C.J.G. Grift J.W. Geus M.J.K.H. Maas Characterization of copper-silica catalysts by means of in situ diffuse reflectance infrared Fourier transform spectroscopy Catal. Lett. 1989 10.1016/S0166-9834(00)82181-8 C.J.G. Grift, J.W. Geus, M.J.K.H. Maas, Characterization of copper-silica catalysts by means of in situ diffuse reflectance infrared Fourier transform spectroscopy, Catal. Lett., (1989). https://doi.org/10.1016/S0166-9834(00)82181-8 [22] T. Li L. Lin C. Chen R. Ye L. Huang J. Yang P. Zhang Y. Qin J. Cheng Y. Yao Insights into a new formation mechanism of robust Cu/SiO2 catalysts for low-temperature dimethyl oxalate hydrogenation induced by a chelating ligand of EDTA Catalysts 12 2022 320 10.3390/catal12030320 T. Li, L. Lin, C. Chen, R. Ye, L. Huang, J. Yang, P. Zhang, Y. Qin, J. Cheng, Y. Yao, Insights into a new formation mechanism of robust Cu/SiO2 catalysts for low-temperature dimethyl oxalate hydrogenation induced by a chelating ligand of EDTA, Catalysts, 12 (2022) 320. https://doi.org/10.3390/catal12030320 [23] M. Wang D. Yao A. Li Y. Yang J. Lv S. Huang Y. Wang X. Ma Enhanced selectivity and stability of Cu/SiO2 catalysts for dimethyl oxalate hydrogenation to ethylene glycol by using silane coupling agents for surface modification Ind. Eng. Chem. Res. 59 2020 9414 9422 10.1021/acs.iecr.0c00789 M. Wang, D. Yao, A. Li, Y. Yang, J. Lv, S. Huang, Y. Wang, X. Ma, Enhanced selectivity and stability of Cu/SiO2 catalysts for dimethyl oxalate hydrogenation to ethylene glycol by using silane coupling agents for surface modification, Ind. Eng. Chem. Res., 59 (2020) 9414–9422. https://doi.org/10.1021/acs.iecr.0c00789 [24] B. Wang Y. Cui C. Wen X. Chen Y. Dong W. Dai Role of copper content and calcination temperature in the structural evolution and catalytic performance of Cu/P25 catalysts in the selective hydrogenation of dimethyl oxalate Appl. Catal. A-Gen. 509 2016 66 74 10.1016/j.apcata.2015.10.022 B. Wang, Y. Cui, C. Wen, X. Chen, Y. Dong, W. Dai, Role of copper content and calcination temperature in the structural evolution and catalytic performance of Cu/P25 catalysts in the selective hydrogenation of dimethyl oxalate, Appl. Catal. A-Gen., 509 (2016) 66–74. https://doi.org/10.1016/j.apcata.2015.10.022 [25] Y. Song J. Zhang J. Lv Y. Zhao X. Ma Hydrogenation of dimethyl oxalate over copper-based catalysts: acid-base properties and reaction paths Ind. Eng. Chem. Res. 54 2015 9699 9707 10.1021/acs.iecr.5b01928 Y. Song, J. Zhang, J. Lv, Y. Zhao, X. Ma, Hydrogenation of dimethyl oxalate over copper-based catalysts: acid-base properties and reaction paths, Ind. Eng. Chem. Res., 54 (2015) 9699–9707. https://doi.org/10.1021/acs.iecr.5b01928 [26] W. Yang Y. Zhao S. Wang X. Ma Formation of copper phyllosilicate in silica supported copper catalyst Chem. Ind. Eng. 33 2016 1 5 W. Yang, Y. Zhao, S. Wang, X. Ma, Formation of copper phyllosilicate in silica supported copper catalyst, Chem. Ind. Eng., 33 (2016) 1–5. [27] C. Chen L. Lin R. Ye L. Huang L. Zhu Y. Huang Y. Qin Y. Yao Construction of Cu-Ce composite oxides by simultaneous ammonia evaporation method to enhance catalytic performance of Ce-Cu/SiO2 catalysts for dimethyl oxalate hydrogenation Fuel 290 2021 120083 10.1016/j.fuel.2020.120083 C. Chen, L. Lin, R. Ye, L. Huang, L. Zhu, Y. Huang, Y. Qin, Y. Yao, Construction of Cu-Ce composite oxides by simultaneous ammonia evaporation method to enhance catalytic performance of Ce-Cu/SiO2 catalysts for dimethyl oxalate hydrogenation, Fuel, 290 (2021) 120083. https://doi.org/10.1016/j.fuel.2020.120083 [28] T. Popa Y. Zhang E. Jin M. Fan An environmentally benign and low-cost approach to synthesis of thermally stable industrial catalyst Cu/SiO2 for the hydrogenation of dimethyl oxalate to ethylene glycol Appl. Catal. A-Gen. 505 2015 52 61 10.1016/j.apcata.2015.07.026 T. Popa, Y. Zhang, E. Jin, M. Fan, An environmentally benign and low-cost approach to synthesis of thermally stable industrial catalyst Cu/SiO2 for the hydrogenation of dimethyl oxalate to ethylene glycol, Appl. Catal. A-Gen., 505 (2015) 52–61. https://doi.org/10.1016/j.apcata.2015.07.026 [29] Y. Wang Y. Shen Y. Zhao J. Lv S. Wang X. Ma Insight into the balancing effect of active Cu species for hydrogenation of carbon-oxygen bonds ACS Catal. 5 2015 6200 6208 10.1021/acscatal.5b01678 Y. Wang, Y. Shen, Y. Zhao, J. Lv, S. Wang, X. Ma, Insight into the balancing effect of active Cu species for hydrogenation of carbon-oxygen bonds, ACS Catal.., 5 (2015) 6200–6208. https://doi.org/10.1021/acscatal.5b01678 [30] T. Toupance M. Kermarec J.F. Lambert C. Louis Conditions of formation of copper phyllosilicates in silica-supported copper catalysts prepared by selective adsorption J. Phys. Chem. B 106 2002 2277 2286 10.1021/jp013153x T. Toupance, M. Kermarec, J.F. Lambert, C. Louis, Conditions of formation of copper phyllosilicates in silica-supported copper catalysts prepared by selective adsorption, J. Phys. Chem. B, 106 (2002) 2277–2286. https://doi.org/10.1021/jp013153x [31] Y. Zhu Y. Zhu X. Kong X. Li G. Ding Y. Li Cu nanoparticles inlaid mesoporous Al2O3 as a high-performance bifunctional catalyst for ethanol synthesis via dimethyl oxalate hydrogenation ACS Catal. 4 2014 3612 3620 10.1021/cs5009283 Y. Zhu, Y. Zhu, X. Kong, X. Li, G. Ding, Y. Li, Cu nanoparticles inlaid mesoporous Al2O3 as a high-performance bifunctional catalyst for ethanol synthesis via dimethyl oxalate hydrogenation, ACS Catal. 4 (2014) 3612–3620. https://doi.org/10.1021/cs5009283 [32] C. Wen Y. Cui X. Chen B. Zong W. Dai Reaction temperature controlled selective hydrogenation of dimethyl oxalate to methyl glycolate and ethylene glycol over copper-hydroxyapatite catalysts Appl. Catal. B-Environ. 162 2015 483 493 10.1016/j.apcatb.2014.07.023 C. Wen, Y. Cui, X. Chen, B. Zong, W. Dai, Reaction temperature controlled selective hydrogenation of dimethyl oxalate to methyl glycolate and ethylene glycol over copper-hydroxyapatite catalysts, Appl. Catal. B-Environ., 162 (2015) 483–493. https://doi.org/10.1016/j.apcatb.2014.07.023 [33] A. Yin X. Guo W. Dai K. Fan The nature of active copper species in Cu-HMS catalyst for hydrogenation of dimethyl oxalate to ethylene glycol: new insights on the synergetic effect between Cu0 and Cu+ J. Phys. Chem. C 113 2009 11003 11013 10.1021/jp902688b A. Yin, X. Guo, W. Dai, K. Fan, The nature of active copper species in Cu-HMS catalyst for hydrogenation of dimethyl oxalate to ethylene glycol: new insights on the synergetic effect between Cu0 and Cu+, J. Phys. Chem. C, 113 (2009) 11003–11013. https://doi.org/10.1021/jp902688b [34] S. Zhao H. Yue Y. Zhao B. Wang Y. Geng J. Lv S. Wang J. Gong X. Ma Chemoselective synthesis of ethanol via hydrogenation of dimethyl oxalate on Cu/SiO2: enhanced stability with boron dopant J. Catal. 297 2013 142 150 10.1016/j.jcat.2012.10.004 S. Zhao, H. Yue, Y. Zhao, B. Wang, Y. Geng, J. Lv, S. Wang, J. Gong, X. Ma, Chemoselective synthesis of ethanol via hydrogenation of dimethyl oxalate on Cu/SiO2: enhanced stability with boron dopant, J. Catal., 297 (2013) 142–150. https://doi.org/10.1016/j.jcat.2012.10.004 [35] R. Takahashi S. Sato T. Sodesawa M. Kawakita K. Ogura High surface-area silica with controlled pore size prepared from nanocomposite of silica and citric acid J. Phys. Chem. B 104 2000 12184 12191 10.1021/jp002662g R. Takahashi, S. Sato, T. Sodesawa, M. Kawakita, K. Ogura, High surface-area silica with controlled pore size prepared from nanocomposite of silica and citric acid, J. Phys. Chem. B, 104 (2000) 12184–12191. https://doi.org/10.1021/jp002662g [36] Y. Zhu X. Kong J. Yin R. You B. Zhang H. Zheng X. Wen Y. Zhu Y. Li Covalent-bonding to irreducible SiO2 leads to high-loading and atomically dispersed metal catalysts J. Catal. 353 2017 315 324 10.1016/j.jcat.2017.07.030 Y. Zhu, X. Kong, J. Yin, R. You, B. Zhang, H. Zheng, X. Wen, Y. Zhu, Y. Li, Covalent-bonding to irreducible SiO2 leads to high-loading and atomically dispersed metal catalysts, J. Catal., 353 (2017) 315–324. https://doi.org/10.1016/j.jcat.2017.07.030 [37] R. Ye L. Lin J. Yang M. Sun F. Li B. Li Y. Yao A new low-cost and effective method for enhancing the catalytic performance of Cu-SiO2 catalysts for the synthesis of ethylene glycol via the vapor-phase hydrogenation of dimethyl oxalate by coating the catalysts with dextrin J. Catal. 350 2017 122 132 10.1016/j.jcat.2017.02.018 R. Ye, L. Lin, J. Yang, M. Sun, F. Li, B. Li, Y. Yao, A new low-cost and effective method for enhancing the catalytic performance of Cu-SiO2 catalysts for the synthesis of ethylene glycol via the vapor-phase hydrogenation of dimethyl oxalate by coating the catalysts with dextrin, J. Catal., 350 (2017) 122–132. https://doi.org/10.1016/j.jcat.2017.02.018 [38] M.A. Kohler J.C. Lee D.L. Trimm N.W. Cant M.S. Wainwright Preparation of Cu/SiO2 catalysts by the ion-exchange technique Appl. Catal. 31 1987 309 321 10.1016/S0166-9834(00)80699-5 M.A. Kohler, J.C. Lee, D.L. Trimm, N.W. Cant, M.S. Wainwright, Preparation of Cu/SiO2 catalysts by the ion-exchange technique, Appl. Catal., 31 (1987) 309–321. https://doi.org/10.1016/S0166-9834(00)80699-5",
      "scopus-id": "85197091824",
      "coredata": {
        "eid": "1-s2.0-S2468823124004735",
        "dc:description": "The Cu/SiO2 catalyst is widely used in the catalytic hydrogenation reactions of numerous CO bonded compounds, due to its economy and efficiency. In this work, it is found that the EDTA introduced after ammonia evaporation could dissolve part of the copper phyllosilicate in the catalysts prepared by the ammonia-evaporation method, which is called the dissolution effect. Further research shows that the dissolution of the copper phyllosilicate will release Cu2+ ions and silica, then the two will take place ion exchange to form CuOSi units that could be reduced to stable Cu2O. To some extent, the formation of new Cu2O prevents the severe decrease of Cu+ caused by the dissolution of the copper phyllosilicate, which even makes E + 0.02-Cu/SiO2 catalyst have the highest content of Cu+ (69.1 %). Moreover, the Cu2+ species adsorbed in the silica layers would decrease with the introduction of EDTA, which conduces to the formation of more dispersed Cu0 species with smaller particle sizes. In the hydrogenation reaction of dimethyl oxalate (DMO) to ethylene glycol (EG), the optimal catalytic performance (99.86 % DMO conversion and 97.58 % EG selectivity) can be obtained over the E + 0.02-Cu/SiO2 catalyst at 180 °C during the life evaluation of 300 h. This work reports a strategy for improving the performance and stability of the Cu/SiO2 catalyst by realizing the late redistribution of copper species.",
        "openArchiveArticle": "false",
        "prism:coverDate": "2024-08-15",
        "openaccessUserLicense": null,
        "prism:aggregationType": "Journal",
        "prism:url": "https://api.elsevier.com/content/article/pii/S2468823124004735",
        "dc:creator": [
          {
            "@_fa": "true",
            "$": "Li, Tianyou"
          },
          {
            "@_fa": "true",
            "$": "Wang, Yihua"
          },
          {
            "@_fa": "true",
            "$": "Yan, Pinmei"
          },
          {
            "@_fa": "true",
            "$": "Lin, Ling"
          },
          {
            "@_fa": "true",
            "$": "Yao, Yuangen"
          }
        ],
        "link": [
          {
            "@_fa": "true",
            "@rel": "self",
            "@href": "https://api.elsevier.com/content/article/pii/S2468823124004735"
          },
          {
            "@_fa": "true",
            "@rel": "scidir",
            "@href": "https://www.sciencedirect.com/science/article/pii/S2468823124004735"
          }
        ],
        "dc:format": "application/json",
        "openaccessType": null,
        "pii": "S2468-8231(24)00473-5",
        "prism:volume": "565",
        "articleNumber": "114290",
        "prism:publisher": "Published by Elsevier B.V.",
        "dc:title": "Late redistribution effect of copper species in the Cu/SiO2 catalyst induced by EDTA",
        "prism:copyright": "© 2024 Published by Elsevier B.V.",
        "openaccess": "0",
        "prism:issn": "24688231",
        "dcterms:subject": [
          {
            "@_fa": "true",
            "$": "EDTA"
          },
          {
            "@_fa": "true",
            "$": "Cu/SiO2"
          },
          {
            "@_fa": "true",
            "$": "Dimethyl oxalate, Ethylene glycol, Hydrogenation"
          }
        ],
        "openaccessArticle": "false",
        "prism:publicationName": "Molecular Catalysis",
        "openaccessSponsorType": null,
        "prism:pageRange": "114290",
        "pubType": "fla",
        "prism:coverDisplayDate": "15 August 2024",
        "prism:doi": "10.1016/j.mcat.2024.114290",
        "prism:startingPage": "114290",
        "dc:identifier": "doi:10.1016/j.mcat.2024.114290",
        "openaccessSponsorName": null
      },
      "objects": {
        "object": [
          {
            "@category": "standard",
            "@height": "307",
            "@width": "386",
            "@_fa": "true",
            "$": "https://api.elsevier.com/content/object/eid/1-s2.0-S2468823124004735-gr7.jpg?httpAccept=%2A%2F%2A",
            "@multimediatype": "JPEG image file",
            "@type": "IMAGE-DOWNSAMPLED",
            "@size": "23123",
            "@ref": "gr7",
            "@mimetype": "image/jpeg"
          },
          {
            "@category": "standard",
            "@height": "222",
            "@width": "602",
            "@_fa": "true",
            "$": "https://api.elsevier.com/content/object/eid/1-s2.0-S2468823124004735-sc1.jpg?httpAccept=%2A%2F%2A",
            "@multimediatype": "JPEG image file",
            "@type": "IMAGE-DOWNSAMPLED",
            "@size": "33722",
            "@ref": "sc1",
            "@mimetype": "image/jpeg"
          },
          {
            "@category": "standard",
            "@height": "246",
            "@width": "489",
            "@_fa": "true",
            "$": "https://api.elsevier.com/content/object/eid/1-s2.0-S2468823124004735-gr2.jpg?httpAccept=%2A%2F%2A",
            "@multimediatype": "JPEG image file",
            "@type": "IMAGE-DOWNSAMPLED",
            "@size": "46426",
            "@ref": "gr2",
            "@mimetype": "image/jpeg"
          },
          {
            "@category": "standard",
            "@height": "200",
            "@width": "355",
            "@_fa": "true",
            "$": "https://api.elsevier.com/content/object/eid/1-s2.0-S2468823124004735-ga1.jpg?httpAccept=%2A%2F%2A",
            "@multimediatype": "JPEG image file",
            "@type": "IMAGE-DOWNSAMPLED",
            "@size": "30040",
            "@ref": "ga1",
            "@mimetype": "image/jpeg"
          },
          {
            "@category": "standard",
            "@height": "263",
            "@width": "678",
            "@_fa": "true",
            "$": "https://api.elsevier.com/content/object/eid/1-s2.0-S2468823124004735-gr1.jpg?httpAccept=%2A%2F%2A",
            "@multimediatype": "JPEG image file",
            "@type": "IMAGE-DOWNSAMPLED",
            "@size": "57447",
            "@ref": "gr1",
            "@mimetype": "image/jpeg"
          },
          {
            "@category": "standard",
            "@height": "506",
            "@width": "339",
            "@_fa": "true",
            "$": "https://api.elsevier.com/content/object/eid/1-s2.0-S2468823124004735-gr4.jpg?httpAccept=%2A%2F%2A",
            "@multimediatype": "JPEG image file",
            "@type": "IMAGE-DOWNSAMPLED",
            "@size": "44284",
            "@ref": "gr4",
            "@mimetype": "image/jpeg"
          },
          {
            "@category": "standard",
            "@height": "302",
            "@width": "386",
            "@_fa": "true",
            "$": "https://api.elsevier.com/content/object/eid/1-s2.0-S2468823124004735-gr3.jpg?httpAccept=%2A%2F%2A",
            "@multimediatype": "JPEG image file",
            "@type": "IMAGE-DOWNSAMPLED",
            "@size": "24299",
            "@ref": "gr3",
            "@mimetype": "image/jpeg"
          },
          {
            "@category": "standard",
            "@height": "446",
            "@width": "301",
            "@_fa": "true",
            "$": "https://api.elsevier.com/content/object/eid/1-s2.0-S2468823124004735-gr6.jpg?httpAccept=%2A%2F%2A",
            "@multimediatype": "JPEG image file",
            "@type": "IMAGE-DOWNSAMPLED",
            "@size": "41897",
            "@ref": "gr6",
            "@mimetype": "image/jpeg"
          },
          {
            "@category": "standard",
            "@height": "274",
            "@width": "715",
            "@_fa": "true",
            "$": "https://api.elsevier.com/content/object/eid/1-s2.0-S2468823124004735-gr5.jpg?httpAccept=%2A%2F%2A",
            "@multimediatype": "JPEG image file",
            "@type": "IMAGE-DOWNSAMPLED",
            "@size": "58909",
            "@ref": "gr5",
            "@mimetype": "image/jpeg"
          },
          {
            "@category": "thumbnail",
            "@height": "164",
            "@width": "206",
            "@_fa": "true",
            "$": "https://api.elsevier.com/content/object/eid/1-s2.0-S2468823124004735-gr7.sml?httpAccept=%2A%2F%2A",
            "@multimediatype": "GIF image file",
            "@type": "IMAGE-THUMBNAIL",
            "@size": "7807",
            "@ref": "gr7",
            "@mimetype": "image/gif"
          },
          {
            "@category": "thumbnail",
            "@height": "81",
            "@width": "219",
            "@_fa": "true",
            "$": "https://api.elsevier.com/content/object/eid/1-s2.0-S2468823124004735-sc1.sml?httpAccept=%2A%2F%2A",
            "@multimediatype": "GIF image file",
            "@type": "IMAGE-THUMBNAIL",
            "@size": "10531",
            "@ref": "sc1",
            "@mimetype": "image/gif"
          },
          {
            "@category": "thumbnail",
            "@height": "110",
            "@width": "219",
            "@_fa": "true",
            "$": "https://api.elsevier.com/content/object/eid/1-s2.0-S2468823124004735-gr2.sml?httpAccept=%2A%2F%2A",
            "@multimediatype": "GIF image file",
            "@type": "IMAGE-THUMBNAIL",
            "@size": "18026",
            "@ref": "gr2",
            "@mimetype": "image/gif"
          },
          {
            "@category": "thumbnail",
            "@height": "123",
            "@width": "219",
            "@_fa": "true",
            "$": "https://api.elsevier.com/content/object/eid/1-s2.0-S2468823124004735-ga1.sml?httpAccept=%2A%2F%2A",
            "@multimediatype": "GIF image file",
            "@type": "IMAGE-THUMBNAIL",
            "@size": "21171",
            "@ref": "ga1",
            "@mimetype": "image/gif"
          },
          {
            "@category": "thumbnail",
            "@height": "85",
            "@width": "219",
            "@_fa": "true",
            "$": "https://api.elsevier.com/content/object/eid/1-s2.0-S2468823124004735-gr1.sml?httpAccept=%2A%2F%2A",
            "@multimediatype": "GIF image file",
            "@type": "IMAGE-THUMBNAIL",
            "@size": "7994",
            "@ref": "gr1",
            "@mimetype": "image/gif"
          },
          {
            "@category": "thumbnail",
            "@height": "164",
            "@width": "110",
            "@_fa": "true",
            "$": "https://api.elsevier.com/content/object/eid/1-s2.0-S2468823124004735-gr4.sml?httpAccept=%2A%2F%2A",
            "@multimediatype": "GIF image file",
            "@type": "IMAGE-THUMBNAIL",
            "@size": "7286",
            "@ref": "gr4",
            "@mimetype": "image/gif"
          },
          {
            "@category": "thumbnail",
            "@height": "164",
            "@width": "209",
            "@_fa": "true",
            "$": "https://api.elsevier.com/content/object/eid/1-s2.0-S2468823124004735-gr3.sml?httpAccept=%2A%2F%2A",
            "@multimediatype": "GIF image file",
            "@type": "IMAGE-THUMBNAIL",
            "@size": "7856",
            "@ref": "gr3",
            "@mimetype": "image/gif"
          },
          {
            "@category": "thumbnail",
            "@height": "163",
            "@width": "110",
            "@_fa": "true",
            "$": "https://api.elsevier.com/content/object/eid/1-s2.0-S2468823124004735-gr6.sml?httpAccept=%2A%2F%2A",
            "@multimediatype": "GIF image file",
            "@type": "IMAGE-THUMBNAIL",
            "@size": "8443",
            "@ref": "gr6",
            "@mimetype": "image/gif"
          },
          {
            "@category": "thumbnail",
            "@height": "84",
            "@width": "219",
            "@_fa": "true",
            "$": "https://api.elsevier.com/content/object/eid/1-s2.0-S2468823124004735-gr5.sml?httpAccept=%2A%2F%2A",
            "@multimediatype": "GIF image file",
            "@type": "IMAGE-THUMBNAIL",
            "@size": "7364",
            "@ref": "gr5",
            "@mimetype": "image/gif"
          },
          {
            "@category": "high",
            "@height": "1359",
            "@width": "1708",
            "@_fa": "true",
            "$": "https://api.elsevier.com/content/object/eid/1-s2.0-S2468823124004735-gr7_lrg.jpg?httpAccept=%2A%2F%2A",
            "@multimediatype": "JPEG image file",
            "@type": "IMAGE-HIGH-RES",
            "@size": "156579",
            "@ref": "gr7",
            "@mimetype": "image/jpeg"
          },
          {
            "@category": "high",
            "@height": "983",
            "@width": "2667",
            "@_fa": "true",
            "$": "https://api.elsevier.com/content/object/eid/1-s2.0-S2468823124004735-sc1_lrg.jpg?httpAccept=%2A%2F%2A",
            "@multimediatype": "JPEG image file",
            "@type": "IMAGE-HIGH-RES",
            "@size": "255936",
            "@ref": "sc1",
            "@mimetype": "image/jpeg"
          },
          {
            "@category": "high",
            "@height": "1092",
            "@width": "2167",
            "@_fa": "true",
            "$": "https://api.elsevier.com/content/object/eid/1-s2.0-S2468823124004735-gr2_lrg.jpg?httpAccept=%2A%2F%2A",
            "@multimediatype": "JPEG image file",
            "@type": "IMAGE-HIGH-RES",
            "@size": "494689",
            "@ref": "gr2",
            "@mimetype": "image/jpeg"
          },
          {
            "@category": "high",
            "@height": "886",
            "@width": "1575",
            "@_fa": "true",
            "$": "https://api.elsevier.com/content/object/eid/1-s2.0-S2468823124004735-ga1_lrg.jpg?httpAccept=%2A%2F%2A",
            "@multimediatype": "JPEG image file",
            "@type": "IMAGE-HIGH-RES",
            "@size": "226362",
            "@ref": "ga1",
            "@mimetype": "image/jpeg"
          },
          {
            "@category": "high",
            "@height": "1164",
            "@width": "3000",
            "@_fa": "true",
            "$": "https://api.elsevier.com/content/object/eid/1-s2.0-S2468823124004735-gr1_lrg.jpg?httpAccept=%2A%2F%2A",
            "@multimediatype": "JPEG image file",
            "@type": "IMAGE-HIGH-RES",
            "@size": "408354",
            "@ref": "gr1",
            "@mimetype": "image/jpeg"
          },
          {
            "@category": "high",
            "@height": "2237",
            "@width": "1500",
            "@_fa": "true",
            "$": "https://api.elsevier.com/content/object/eid/1-s2.0-S2468823124004735-gr4_lrg.jpg?httpAccept=%2A%2F%2A",
            "@multimediatype": "JPEG image file",
            "@type": "IMAGE-HIGH-RES",
            "@size": "271065",
            "@ref": "gr4",
            "@mimetype": "image/jpeg"
          },
          {
            "@category": "high",
            "@height": "1337",
            "@width": "1708",
            "@_fa": "true",
            "$": "https://api.elsevier.com/content/object/eid/1-s2.0-S2468823124004735-gr3_lrg.jpg?httpAccept=%2A%2F%2A",
            "@multimediatype": "JPEG image file",
            "@type": "IMAGE-HIGH-RES",
            "@size": "163105",
            "@ref": "gr3",
            "@mimetype": "image/jpeg"
          },
          {
            "@category": "high",
            "@height": "1975",
            "@width": "1333",
            "@_fa": "true",
            "$": "https://api.elsevier.com/content/object/eid/1-s2.0-S2468823124004735-gr6_lrg.jpg?httpAccept=%2A%2F%2A",
            "@multimediatype": "JPEG image file",
            "@type": "IMAGE-HIGH-RES",
            "@size": "266093",
            "@ref": "gr6",
            "@mimetype": "image/jpeg"
          },
          {
            "@category": "high",
            "@height": "1212",
            "@width": "3167",
            "@_fa": "true",
            "$": "https://api.elsevier.com/content/object/eid/1-s2.0-S2468823124004735-gr5_lrg.jpg?httpAccept=%2A%2F%2A",
            "@multimediatype": "JPEG image file",
            "@type": "IMAGE-HIGH-RES",
            "@size": "375152",
            "@ref": "gr5",
            "@mimetype": "image/jpeg"
          },
          {
            "@category": "standard",
            "@_fa": "true",
            "$": "https://api.elsevier.com/content/object/eid/1-s2.0-S2468823124004735-mmc1.docx?httpAccept=%2A%2F%2A",
            "@multimediatype": "Microsoft Word file",
            "@type": "APPLICATION",
            "@size": "30274202",
            "@ref": "mmc1",
            "@mimetype": "application/word"
          },
          {
            "@category": "standard",
            "@_fa": "true",
            "$": "https://api.elsevier.com/content/object/eid/1-s2.0-S2468823124004735-am.pdf?httpAccept=%2A%2F%2A",
            "@multimediatype": "Acrobat PDF file",
            "@type": "AAM-PDF",
            "@size": "15855763",
            "@ref": "am",
            "@mimetype": "application/pdf"
          }
        ]
      },
      "link": {
        "@rel": "abstract",
        "@href": "https://api.elsevier.com/content/abstract/scopus_id/85197091824"
      }
    }
  }
}