{
  "metadata": {
    "title": "Imidazolium ionic liquids/organic bases: Efficient intermolecular synergistic catalysts for the cycloaddition of CO<ce:inf loc=post>2</ce:inf> and epoxides under atmospheric pressure",
    "authors": "; ; ",
    "journal": "Molecular Catalysis",
    "date": "2018-02-28",
    "doi": "10.1016/j.mcat.2017.12.026",
    "abstract": "",
    "uri": "https://api.elsevier.com/content/article/pii/S2468823117306673",
    "pii": "S2468823117306673"
  },
  "fulltext": {
    "full-text-retrieval-response": {
      "scopus-eid": "2-s2.0-85041924840",
      "originalText": "serial JL 315758 291210 291744 291790 291809 31 Molecular Catalysis MOLECULARCATALYSIS 2018-01-04 2018-01-04 2018-01-04 2018-01-04 2020-06-13T11:57:25 1-s2.0-S2468823117306673 S2468-8231(17)30667-3 S2468823117306673 10.1016/j.mcat.2017.12.026 S300 S300.3 FULL-TEXT 1-s2.0-S2468823117X00205 2020-06-13T11:12:18.801324Z 0 0 20180201 20180228 2018 2018-01-04T11:56:49.894078Z absattachment articleinfo articletitlenorm authfirstinitialnorm authfirstsurnamenorm cid cids contenttype copyright crossmark dateloaded dateloadedtxt datesearch datesort dateupdated dco docsubtype doctype doi eid ewtransactionid hubeid indexeddate issn issnnorm itemstage itemtransactionid itemweight openaccess openarchive pg pgfirst pglast pii piinorm pubdateend pubdatestart pubdatetxt pubyr sectiontitle sortorder srctitle srctitlenorm srctype ssids alllist content subj subheadings suppl tomb volfirst volissue volumelist webpdf webpdfpagecount yearnav figure table e-component body acknowledge affil appendices articletitle auth authfirstini authfull authkeywords authlast footnotes grantnumber grantsponsor grantsponsorid highlightsabst primabst ref specialabst 2468-8231 24688231 true 446 446 C Volume 446 15 124 130 124 130 201802 February 2018 2018-02-01 2018-02-28 2018 Regular Papers article fla © 2017 Elsevier B.V. All rights reserved. IMIDAZOLIUMIONICLIQUIDSORGANICBASESEFFICIENTINTERMOLECULARSYNERGISTICCATALYSTSFORCYCLOADDITIONCO2EPOXIDESUNDERATMOSPHERICPRESSURE JI L 1 Introduction 2 Experimental 2.1 General 2.2 Typical procedure for the cycloaddition of CO2 and epoxide 2.3 Computational methods 3 Results and discussion 3.1 Synergistic catalysis of organic bases and ionic liquids 3.2 Optimization of reaction parameters 3.3 Synthesis of cyclic carbonates from CO2 and other epoxides 3.4 Mechanism study 3.4.1 Ionic liquids/secondary amines catalyzed mechanism 3.4.2 Ionic liquids/tertiary amines catalyzed mechanism 4 Conclusion Acknowledgements Appendix A Supplementary data References HUNT 2010 306 322 A GOEPPERT 2012 7833 7853 A DREES 2012 1703 1712 M HE 2013 9620 9633 M YANG 2014 962 998 L YI 2015 5409 5445 Q SAKAKURA 2007 2365 2387 T MIKKELSEN 2010 43 81 M COKOJA 2011 8510 8537 M MAEDA 2014 1482 1497 C TAKEDA 2017 70 88 H DELLAMICO 2003 3857 3897 D LIU 2011 529 541 C OLAH 2011 12881 12898 G WANG 2011 3703 3727 W LI 2016 7485 7527 K SAKAKURA 2009 1312 1330 T NORTH 2010 1514 1539 M COKOJA 2015 2436 2454 M GIBSON 1996 2063 2095 D DECORTES 2010 10016 10032 A PESCARMONA 2012 2169 2187 P KIM 2013 1973 1984 D COMERFORD 2015 1966 1987 J MARTIN 2015 1353 1370 C BUTTNER 2015 2655 2669 H DELIA 2015 1906 1917 V QIN 2017 3785 3788 L YANG 2011 545 567 Z LI 2012 12525 12551 H CHENG 2013 878 901 W HE 2014 1513 1528 Q WU 2016 1 8 S WU 2017 753 759 S XU 2015 108 122 B VILLIERS 2010 3465 3468 C GOMES 2012 187 190 C SUN 2014 3071 3078 J LIU 2016 2871 2876 X WANG 2016 3872 3877 L HUENERBEIN 2010 6940 6948 R ZHAO 2006 5753 5755 Y ZHAO 2008 215 241 Y FRISCH 2017 M GAUSSIAN DOLG 1987 866 872 M ANDRAE 1990 123 141 D KIM 2005 7882 7891 Y ZHANG 2011 1359 1364 L WANG 2013 88 91 B WANG 2014 3125 3134 B WANG 2014 278 283 B ELAGEED 2016 3650 3656 E ZHANG 2016 435 438 Y LUO 2016 27951 27957 Z SONG 2012 130 135 J SHI 2013 1633 1641 J HAMPE 2003 9619 9625 E KREHER 2004 387 393 U DIJKSTRA 2007 109 114 Z VIJAYARAGHAVAN 2014 1724 1728 R SRIKANTH 2013 9196 9205 C WANG 2015 2066 2072 Y HISATSUNE 1984 945 948 C HELDEBRANT 2010 713 721 D LIU 2012 11306 11310 A HELDEBRANT 2005 5335 5338 D JIX2018X124 JIX2018X124X130 JIX2018X124XL JIX2018X124X130XL © 2017 Elsevier B.V. All rights reserved. 2020-03-10T04:07:55.761Z http://vtw.elsevier.com/data/voc/AddOnTypes/50.7/nlp S2468823117306673 Shanghai Natural Science Foundation 14ZR1411800 Natural Science Foundation of Shanghai http://data.elsevier.com/vocabulary/SciValFunders/100007219 http://sws.geonames.org/1814991/ Shanghai Leading Academic Discipline Project B409 Shanghai Leading Academic Discipline Project http://data.elsevier.com/vocabulary/SciValFunders/501100012150 http://sws.geonames.org/1814991/ National Key Research and Development Program of China 2017YFA0403102 National Basic Research Program of China (973 Program) http://data.elsevier.com/vocabulary/SciValFunders/501100012166 http://sws.geonames.org/1814991/ National Natural Science Foundation of China 21433004 21773068 21573072 NSFC National Natural Science Foundation of China http://data.elsevier.com/vocabulary/SciValFunders/501100001809 http://sws.geonames.org/1814991/ We thank the National Key Research and Development Program of China ( 2017YFA0403102 ), the National Natural Science Foundation of China ( 21573072 , 21773068 , 21433004 ) Shanghai Natural Science Foundation ( 14ZR1411800 ) and Shanghai Leading Academic Discipline Project ( B409 ) for financial support. We acknowledge the support of the NYU-ECNU Center for Computational Chemistry at NYU Shanghai. We also thank the supercomputer center of ECNU for providing computer time. item S2468-8231(17)30667-3 S2468823117306673 1-s2.0-S2468823117306673 10.1016/j.mcat.2017.12.026 315758 2020-06-13T11:12:18.801324Z 2018-02-01 2018-02-28 1-s2.0-S2468823117306673-main.pdf https://s3-eu-west-1.amazonaws.com/prod-ucs-content-store-eu-west/content/pii:S2468823117306673/MAIN/application/pdf/2660dd25fb14b81fe10a9e9e54de0268/main.pdf main.pdf pdf true 1762974 MAIN 7 1-s2.0-S2468823117306673-main_1.png https://s3-eu-west-1.amazonaws.com/prod-ucs-content-store-eu-west/content/pii:S2468823117306673/PREVIEW/image/png/2abc13c8147d5f856befd66ca7cbd7bf/main_1.png main_1.png png 54574 849 656 IMAGE-WEB-PDF 1 1-s2.0-S2468823117306673-fx1.jpg https://s3-eu-west-1.amazonaws.com/prod-ucs-content-store-eu-west/content/pii:S2468823117306673/fx1/DOWNSAMPLED/image/jpeg/580093837e8a0613148e2617b3ffe1b2/fx1.jpg fx1 true fx1.jpg jpg 19895 200 394 IMAGE-DOWNSAMPLED 1-s2.0-S2468823117306673-fx10.jpg https://s3-eu-west-1.amazonaws.com/prod-ucs-content-store-eu-west/content/pii:S2468823117306673/fx10/DOWNSAMPLED/image/jpeg/1f63d23d469d14c30ca0c32401db8cdc/fx10.jpg fx10 fx10.jpg jpg 1322 36 67 IMAGE-DOWNSAMPLED 1-s2.0-S2468823117306673-fx11.jpg https://s3-eu-west-1.amazonaws.com/prod-ucs-content-store-eu-west/content/pii:S2468823117306673/fx11/DOWNSAMPLED/image/jpeg/444f810cf25e42601923b66fb8f55adb/fx11.jpg fx11 fx11.jpg jpg 716 28 20 IMAGE-DOWNSAMPLED 1-s2.0-S2468823117306673-fx12.jpg https://s3-eu-west-1.amazonaws.com/prod-ucs-content-store-eu-west/content/pii:S2468823117306673/fx12/DOWNSAMPLED/image/jpeg/0b4a680413a407b18ba98cfc091f71e2/fx12.jpg fx12 fx12.jpg jpg 764 30 30 IMAGE-DOWNSAMPLED 1-s2.0-S2468823117306673-fx13.jpg https://s3-eu-west-1.amazonaws.com/prod-ucs-content-store-eu-west/content/pii:S2468823117306673/fx13/DOWNSAMPLED/image/jpeg/1f4e9059dd00f80834e92c6439ee192c/fx13.jpg fx13 fx13.jpg jpg 1162 41 49 IMAGE-DOWNSAMPLED 1-s2.0-S2468823117306673-fx14.jpg https://s3-eu-west-1.amazonaws.com/prod-ucs-content-store-eu-west/content/pii:S2468823117306673/fx14/DOWNSAMPLED/image/jpeg/448cf16ccfb6963d2a1972b66806e724/fx14.jpg fx14 fx14.jpg jpg 889 31 37 IMAGE-DOWNSAMPLED 1-s2.0-S2468823117306673-fx2.jpg https://s3-eu-west-1.amazonaws.com/prod-ucs-content-store-eu-west/content/pii:S2468823117306673/fx2/DOWNSAMPLED/image/jpeg/255077833fc0ef9f28bdf3086bd8cf9e/fx2.jpg fx2 fx2.jpg jpg 2507 42 174 IMAGE-DOWNSAMPLED 1-s2.0-S2468823117306673-fx3.jpg https://s3-eu-west-1.amazonaws.com/prod-ucs-content-store-eu-west/content/pii:S2468823117306673/fx3/DOWNSAMPLED/image/jpeg/7a9540b535f27f536118c9e4e9e452d6/fx3.jpg fx3 fx3.jpg jpg 607 16 36 IMAGE-DOWNSAMPLED 1-s2.0-S2468823117306673-fx4.jpg https://s3-eu-west-1.amazonaws.com/prod-ucs-content-store-eu-west/content/pii:S2468823117306673/fx4/DOWNSAMPLED/image/jpeg/f6bb68a099b09e5b84c50707cd668f85/fx4.jpg fx4 fx4.jpg jpg 903 30 51 IMAGE-DOWNSAMPLED 1-s2.0-S2468823117306673-fx5.jpg https://s3-eu-west-1.amazonaws.com/prod-ucs-content-store-eu-west/content/pii:S2468823117306673/fx5/DOWNSAMPLED/image/jpeg/c086145bb9330b7aa3df25cdb9baed05/fx5.jpg fx5 fx5.jpg jpg 462 12 11 IMAGE-DOWNSAMPLED 1-s2.0-S2468823117306673-fx6.jpg https://s3-eu-west-1.amazonaws.com/prod-ucs-content-store-eu-west/content/pii:S2468823117306673/fx6/DOWNSAMPLED/image/jpeg/30bdb7805042a2aed334481969003ca9/fx6.jpg fx6 fx6.jpg jpg 579 20 22 IMAGE-DOWNSAMPLED 1-s2.0-S2468823117306673-fx7.jpg https://s3-eu-west-1.amazonaws.com/prod-ucs-content-store-eu-west/content/pii:S2468823117306673/fx7/DOWNSAMPLED/image/jpeg/95b954c8be9fd5eb406d29742df330d4/fx7.jpg fx7 fx7.jpg jpg 801 30 36 IMAGE-DOWNSAMPLED 1-s2.0-S2468823117306673-fx8.jpg https://s3-eu-west-1.amazonaws.com/prod-ucs-content-store-eu-west/content/pii:S2468823117306673/fx8/DOWNSAMPLED/image/jpeg/fab271d173739c10921163892476f3c5/fx8.jpg fx8 fx8.jpg jpg 628 23 30 IMAGE-DOWNSAMPLED 1-s2.0-S2468823117306673-fx9.jpg https://s3-eu-west-1.amazonaws.com/prod-ucs-content-store-eu-west/content/pii:S2468823117306673/fx9/DOWNSAMPLED/image/jpeg/4e73fdd802b583ff65597b2333cc4968/fx9.jpg fx9 fx9.jpg jpg 923 31 47 IMAGE-DOWNSAMPLED 1-s2.0-S2468823117306673-gr1.jpg https://s3-eu-west-1.amazonaws.com/prod-ucs-content-store-eu-west/content/pii:S2468823117306673/gr1/DOWNSAMPLED/image/jpeg/9f6cc65ccfe65009616203100f500f24/gr1.jpg gr1 gr1.jpg jpg 17625 317 376 IMAGE-DOWNSAMPLED 1-s2.0-S2468823117306673-gr2.jpg https://s3-eu-west-1.amazonaws.com/prod-ucs-content-store-eu-west/content/pii:S2468823117306673/gr2/DOWNSAMPLED/image/jpeg/7d7579e1228e78dc8ac28042dcb65006/gr2.jpg gr2 gr2.jpg jpg 16127 209 263 IMAGE-DOWNSAMPLED 1-s2.0-S2468823117306673-gr3.jpg https://s3-eu-west-1.amazonaws.com/prod-ucs-content-store-eu-west/content/pii:S2468823117306673/gr3/DOWNSAMPLED/image/jpeg/86d30051534c86e68c6f8d9712abb99b/gr3.jpg gr3 gr3.jpg jpg 13633 198 489 IMAGE-DOWNSAMPLED 1-s2.0-S2468823117306673-gr4.jpg https://s3-eu-west-1.amazonaws.com/prod-ucs-content-store-eu-west/content/pii:S2468823117306673/gr4/DOWNSAMPLED/image/jpeg/cd069317107300aea499f212291c4327/gr4.jpg gr4 gr4.jpg jpg 39106 282 753 IMAGE-DOWNSAMPLED 1-s2.0-S2468823117306673-gr5.jpg https://s3-eu-west-1.amazonaws.com/prod-ucs-content-store-eu-west/content/pii:S2468823117306673/gr5/DOWNSAMPLED/image/jpeg/8de3eb9c2a07d54c0b47970fa9033021/gr5.jpg gr5 gr5.jpg jpg 15069 312 376 IMAGE-DOWNSAMPLED 1-s2.0-S2468823117306673-gr6.jpg https://s3-eu-west-1.amazonaws.com/prod-ucs-content-store-eu-west/content/pii:S2468823117306673/gr6/DOWNSAMPLED/image/jpeg/bdb092f49fdfe719f25c7b6c5c6d2ef7/gr6.jpg gr6 gr6.jpg jpg 14519 268 376 IMAGE-DOWNSAMPLED 1-s2.0-S2468823117306673-gr7.jpg https://s3-eu-west-1.amazonaws.com/prod-ucs-content-store-eu-west/content/pii:S2468823117306673/gr7/DOWNSAMPLED/image/jpeg/6e3b85e3c532e51b85dcc20f8298254f/gr7.jpg gr7 gr7.jpg jpg 35923 279 753 IMAGE-DOWNSAMPLED 1-s2.0-S2468823117306673-sc1.jpg https://s3-eu-west-1.amazonaws.com/prod-ucs-content-store-eu-west/content/pii:S2468823117306673/sc1/DOWNSAMPLED/image/jpeg/666b6b5df36a11b20add69cc8a3a88b6/sc1.jpg sc1 sc1.jpg jpg 27042 311 376 IMAGE-DOWNSAMPLED 1-s2.0-S2468823117306673-sc2.jpg https://s3-eu-west-1.amazonaws.com/prod-ucs-content-store-eu-west/content/pii:S2468823117306673/sc2/DOWNSAMPLED/image/jpeg/63d75fa4b56118d380ca1b00caa8fe5b/sc2.jpg sc2 sc2.jpg jpg 2535 39 188 IMAGE-DOWNSAMPLED 1-s2.0-S2468823117306673-fx1.sml https://s3-eu-west-1.amazonaws.com/prod-ucs-content-store-eu-west/content/pii:S2468823117306673/fx1/THUMBNAIL/image/gif/1e597bc9d5c74cb5e3b42778b1d0b1bb/fx1.sml fx1 true fx1.sml sml 10206 111 219 IMAGE-THUMBNAIL 1-s2.0-S2468823117306673-fx10.sml https://s3-eu-west-1.amazonaws.com/prod-ucs-content-store-eu-west/content/pii:S2468823117306673/fx10/THUMBNAIL/image/gif/bc433bf982e4e551142df1a492f66127/fx10.sml fx10 fx10.sml sml 4612 118 219 IMAGE-THUMBNAIL 1-s2.0-S2468823117306673-fx11.sml https://s3-eu-west-1.amazonaws.com/prod-ucs-content-store-eu-west/content/pii:S2468823117306673/fx11/THUMBNAIL/image/gif/4fa8142111a4defedd6a7e34ba6c861d/fx11.sml fx11 fx11.sml sml 2968 128 90 IMAGE-THUMBNAIL 1-s2.0-S2468823117306673-fx12.sml https://s3-eu-west-1.amazonaws.com/prod-ucs-content-store-eu-west/content/pii:S2468823117306673/fx12/THUMBNAIL/image/gif/50c1cfe995a837cad69ac259be87c838/fx12.sml fx12 fx12.sml sml 3371 134 133 IMAGE-THUMBNAIL 1-s2.0-S2468823117306673-fx13.sml https://s3-eu-west-1.amazonaws.com/prod-ucs-content-store-eu-west/content/pii:S2468823117306673/fx13/THUMBNAIL/image/gif/960fbbaf4c3de913538e58ed9c7f3da2/fx13.sml fx13 fx13.sml sml 5482 164 194 IMAGE-THUMBNAIL 1-s2.0-S2468823117306673-fx14.sml https://s3-eu-west-1.amazonaws.com/prod-ucs-content-store-eu-west/content/pii:S2468823117306673/fx14/THUMBNAIL/image/gif/3b127e628e7c71f7e3fab95bd3ca7c73/fx14.sml fx14 fx14.sml sml 3826 139 164 IMAGE-THUMBNAIL 1-s2.0-S2468823117306673-fx2.sml https://s3-eu-west-1.amazonaws.com/prod-ucs-content-store-eu-west/content/pii:S2468823117306673/fx2/THUMBNAIL/image/gif/1e791284b610eca6291003e9764baab7/fx2.sml fx2 fx2.sml sml 2965 52 219 IMAGE-THUMBNAIL 1-s2.0-S2468823117306673-fx3.sml https://s3-eu-west-1.amazonaws.com/prod-ucs-content-store-eu-west/content/pii:S2468823117306673/fx3/THUMBNAIL/image/gif/bad83eb07c94959f02b7bcbb20675850/fx3.sml fx3 fx3.sml sml 2490 73 161 IMAGE-THUMBNAIL 1-s2.0-S2468823117306673-fx4.sml https://s3-eu-west-1.amazonaws.com/prod-ucs-content-store-eu-west/content/pii:S2468823117306673/fx4/THUMBNAIL/image/gif/ad654bc70dfd6fb495f4959956257b13/fx4.sml fx4 fx4.sml sml 4581 128 219 IMAGE-THUMBNAIL 1-s2.0-S2468823117306673-fx5.sml https://s3-eu-west-1.amazonaws.com/prod-ucs-content-store-eu-west/content/pii:S2468823117306673/fx5/THUMBNAIL/image/gif/dc7888368507a81cfc4be41025a076a5/fx5.sml fx5 fx5.sml sml 1571 55 49 IMAGE-THUMBNAIL 1-s2.0-S2468823117306673-fx6.sml https://s3-eu-west-1.amazonaws.com/prod-ucs-content-store-eu-west/content/pii:S2468823117306673/fx6/THUMBNAIL/image/gif/faf7b22aa24cb5a07c3156edb55d05ba/fx6.sml fx6 fx6.sml sml 2096 92 101 IMAGE-THUMBNAIL 1-s2.0-S2468823117306673-fx7.sml https://s3-eu-west-1.amazonaws.com/prod-ucs-content-store-eu-west/content/pii:S2468823117306673/fx7/THUMBNAIL/image/gif/a680cf219ee8e81ec745a72d4b8318b1/fx7.sml fx7 fx7.sml sml 3456 137 163 IMAGE-THUMBNAIL 1-s2.0-S2468823117306673-fx8.sml https://s3-eu-west-1.amazonaws.com/prod-ucs-content-store-eu-west/content/pii:S2468823117306673/fx8/THUMBNAIL/image/gif/a3f824619a220d22d0d78a0dff1fabd5/fx8.sml fx8 fx8.sml sml 2512 101 134 IMAGE-THUMBNAIL 1-s2.0-S2468823117306673-fx9.sml https://s3-eu-west-1.amazonaws.com/prod-ucs-content-store-eu-west/content/pii:S2468823117306673/fx9/THUMBNAIL/image/gif/05ef8f138d6a1ec00e774a00f6968d65/fx9.sml fx9 fx9.sml sml 4154 139 208 IMAGE-THUMBNAIL 1-s2.0-S2468823117306673-gr1.sml https://s3-eu-west-1.amazonaws.com/prod-ucs-content-store-eu-west/content/pii:S2468823117306673/gr1/THUMBNAIL/image/gif/1a9d963eb876f73a3a4dd78157732b71/gr1.sml gr1 gr1.sml sml 5043 164 194 IMAGE-THUMBNAIL 1-s2.0-S2468823117306673-gr2.sml https://s3-eu-west-1.amazonaws.com/prod-ucs-content-store-eu-west/content/pii:S2468823117306673/gr2/THUMBNAIL/image/gif/0fa08536c074c5dcfcb0f472a58130ae/gr2.sml gr2 gr2.sml sml 7969 164 206 IMAGE-THUMBNAIL 1-s2.0-S2468823117306673-gr3.sml https://s3-eu-west-1.amazonaws.com/prod-ucs-content-store-eu-west/content/pii:S2468823117306673/gr3/THUMBNAIL/image/gif/8420a807394ea0c71a3ea8fbd838752a/gr3.sml gr3 gr3.sml sml 3196 89 219 IMAGE-THUMBNAIL 1-s2.0-S2468823117306673-gr4.sml https://s3-eu-west-1.amazonaws.com/prod-ucs-content-store-eu-west/content/pii:S2468823117306673/gr4/THUMBNAIL/image/gif/dbe759f5aae700eeddcb028a27319659/gr4.sml gr4 gr4.sml sml 4117 82 219 IMAGE-THUMBNAIL 1-s2.0-S2468823117306673-gr5.sml https://s3-eu-west-1.amazonaws.com/prod-ucs-content-store-eu-west/content/pii:S2468823117306673/gr5/THUMBNAIL/image/gif/327aef9c7f21d77b75a18ade56e2d51e/gr5.sml gr5 gr5.sml sml 4639 163 197 IMAGE-THUMBNAIL 1-s2.0-S2468823117306673-gr6.sml https://s3-eu-west-1.amazonaws.com/prod-ucs-content-store-eu-west/content/pii:S2468823117306673/gr6/THUMBNAIL/image/gif/371fd3f4c03a1cac8c32ae24dcc8a3cb/gr6.sml gr6 gr6.sml sml 5935 156 219 IMAGE-THUMBNAIL 1-s2.0-S2468823117306673-gr7.sml https://s3-eu-west-1.amazonaws.com/prod-ucs-content-store-eu-west/content/pii:S2468823117306673/gr7/THUMBNAIL/image/gif/e300b5904fb8dd72472feceef0c5e756/gr7.sml gr7 gr7.sml sml 3884 81 219 IMAGE-THUMBNAIL 1-s2.0-S2468823117306673-sc1.sml https://s3-eu-west-1.amazonaws.com/prod-ucs-content-store-eu-west/content/pii:S2468823117306673/sc1/THUMBNAIL/image/gif/e2b290f21544829c8bef9a04fd6616df/sc1.sml sc1 sc1.sml sml 7099 164 198 IMAGE-THUMBNAIL 1-s2.0-S2468823117306673-sc2.sml https://s3-eu-west-1.amazonaws.com/prod-ucs-content-store-eu-west/content/pii:S2468823117306673/sc2/THUMBNAIL/image/gif/b1a5d5708f992b252791aff0b658fd9f/sc2.sml sc2 sc2.sml sml 2291 45 219 IMAGE-THUMBNAIL 1-s2.0-S2468823117306673-mmc1.docx https://s3-eu-west-1.amazonaws.com/prod-ucs-content-store-eu-west/content/pii:S2468823117306673/mmc1/MAIN/application/vnd.openxmlformats-officedocument.wordprocessingml.document/8997d85966984acf52cec83937af100f/mmc1.docx mmc1 mmc1.docx docx 1589017 APPLICATION MCAT 433 S2468-8231(17)30667-3 10.1016/j.mcat.2017.12.026 Elsevier B.V. Scheme 1 Mechanism of cycloaddition of CO2 and epoxides by different catalytic system a) ionic liquids; b) organic bases; c) our proposed dual catalysts. Scheme 1 Scheme 2 The reaction of DEA and CO2. Scheme 2 Fig. 1 The correlation of activities and hydrogen bond between C2-H of imidazolium and epichlorohydrin in the presence of various bases. Reaction conditions: Epichlorohydrin (10 mmol), CO2 (0.1 MPa), BnBimBr (0.1 mmol), organic base (0.1 mmol), 80 °C, 3 h. GC yield. Fig. 1 Fig. 2 IR spectrum of DEA before and after reaction with CO2. Fig. 2 Fig. 3 1H NMR spectra of a) only DEA, b) the complex of DEA react with CO2 for 1 h, c) 2 h, d) 3 h in CDCl3, and e) 13C NMR spectra of the complex of DEA react with CO2 for 3 h in CDCl3. Fig. 3 Fig. 4 (a) Proposed Ionic liquids/secondary amines catalyzed mechanism for the cycloaddition of CO2 and epichlorohydrin. (b) Calculated reaction pathways and energy profiles for the reactions in (a). Path A denotes the ring-opening process of epoxide, Path B denotes the formation of diethyl carbamic acid and Path C denotes the process of yielding the final products. Fig. 4 Fig. 5 The effects of additional water in the BnBimBr/DEBA catalytic system for the cycloaddition of CO2 and epichlorohydrin. Reactin conditions: Epichlorohydrin (10 mmol), CO2 (0.1 MPa), DEBA (0.1 mmol), BnBimBr (0.1 mmol), 80 °C, 1 h. GC yield. Fig. 5 Fig. 6 The effects of additional water in the BnBimBr/organic base catalytic system for the cycloaddition of CO2 and epichlorohydrin. Reaction conditions: Epichlorohydrin (10 mmol), CO2 (0.1 MPa), BnBimBr (0.1 mmol), Organic base (0.1 mmol), water (0.4 mmol) 80 °C, 1 h. GC yield. Fig. 6 Fig. 7 (a) Proposed Ionic liquids/tertiary amines catalyzed mechanism for the cycloaddition of CO2 and epichlorohydrin. (b) Calculated reaction pathways and energy profiles for the proposed tertiary amine-catalyzed mechanism. Path D denotes the activation of CO2 by DEBA and Path E denotes the synthesis of cyclic carbonate. Fig. 7 Table 1 The synergistic effect of organic bases and ionic liquids for the cycloaddition of CO2 and epichlorohydrin.[a] Table 1 Entry Ionic liquids Organic bases Yield[b] [%] 1 BnBimBr – 50 2 – DEA 20 3 BnBimBr DEA 96 4 BmimBr DEA 82 5 DBnimBr DEA 95 6 BnMBimBr DEA 53 7 BnBimBr DEBA 93 8 BnBimBr MIm 91 9 BnBimBr DBU 72 10 BnBimBr TEA 80 11 BnBimBr n-BA 81 12 BnBimBr DABCO 85 13 BnBimBr Im 78 [a] Reaction conditions: Epichlorohydrin (10 mmol), CO2 (0.1 MPa), organic base (0.1 mmol), ionic liquids (0.1 mmol), 80 °C, 3 h. [b] GC yield. Table 2 Optimization of reaction parameters on the cycloaddition in BnBimBr/DEA catalytic system.[a]. Table 2 Entry Ionic liquids [mol%] Organic bases [mol%] T[°C] t [h] Yield[b][%] 1 0.5 1 80 3 80 2 1 1 80 3 96 3 2 1 80 3 96 4 1 2 80 3 95 5 1 0.5 80 3 91 6 1 1 70 3 75 7 1 1 60 3 45 8 1 1 80 2 75 9 1 1 80 1 59 [a] Reaction conditions: Epichlorohydrin (10 mmol), CO2 (0.1 MPa). [b] GC yield. Table 3 Reaction of various terminal epoxides with CO2 under optimized conditions.[a]. Table 3 Entry Substate Product Yield[e][%] 1 95 2 93 3[b] 97 4[b] 97 [c] 94 6[d] 82 [a] Reaction conditions: Epoxide (10 mmol), CO2 (0.1 MPa), BnBimBr (0.1 mmol), organic bases (0.1 mmol), 80 °C, 3 h, GC yield. [b] 0.5 MPa; [c] 90 °C; [d] 110 °C; [e] GC yield. Imidazolium ionic liquids/organic bases: Efficient intermolecular synergistic catalysts for the cycloaddition of CO2 and epoxides under atmospheric pressure Liangzheng Ji a 1 Zhoujie Luo a 1 Yongya Zhang a Rong Wang a Yayan Ji a Fei Xia a b ⁎ Guohua Gao a ⁎ a Shanghai Key Laboratory of Green Chemistry and Chemical Processes, School of Chemistry and Molecular Engineering, East China Normal University, 3663 North Zhongshan Road, Shanghai 200062, China Shanghai Key Laboratory of Green Chemistry and Chemical Processes School of Chemistry and Molecular Engineering East China Normal University 3663 North Zhongshan Road Shanghai 200062 China b NYU-ECNU Center for Computational Chemistry at New York University, East China Normal University, 3663 North Zhongshan Road, Shanghai 200062, China NYU-ECNU Center for Computational Chemistry at New York University East China Normal University 3663 North Zhongshan Road Shanghai 200062 China ⁎ Corresponding authors at: Shanghai Key Laboratory of Green Chemistry and Chemical Processes, School of Chemistry and Molecular Engineering, East China Normal University, 3663 North Zhongshan Road, Shanghai, 200062, China. Shanghai Key Laboratory of Green Chemistry and Chemical Processes School of Chemistry and Molecular Engineering East China Normal University 3663 North Zhongshan Road Shanghai 200062 China 1 These authors contributed equally to this work. Graphical abstract Ionic liquids/organic bases synergistically catalyze the cycloaddition of CO2 and epoxides under atmospheric pressure with high activity. An intermolecular synergistic catalytic system consisting of ionic liquids and organic bases is developed for the cycloaddition of CO2 and epoxides. This strategy realizes the cycloaddition takes place under atmospheric pressure of CO2 with high activity. NMR, FT-IR spectroscopy and DFT calculations are applied to investigate the synergistic effect and reaction mechanism on molecules. Plausible ionic liquids/secondary amines and ionic liquids/tertiary amines catalyzed mechanisms are proposed and further confirmed by more detailed DFT calculations including reaction pathways and energy profiles, respectively. The procedure reported here represents a facile, cost-effective and energy-efficient route for chemical fixation of CO2 into 5-membered cyclic carbonates. Keywords Carbon dioxide Synergistic catalysis Cycloaddition Mechanism study 1 Introduction With ceaseless increasing CO2 emission since last century, it has become the primary reason of global climatic warming. As an abundant, non-toxic, non-flammable and easily available source of C1 building block, CO2 is also an attractive environmentally friendly chemical reagent [1]. However, due to the low energy level of CO2, a large energy input is inevitable to transform it [2]. Enormous researchers have dedicated themselves to apply CO2 as raw material for chemical reactions [3]. CO2 can be applied to synthesize high value-added compounds or fuel products [4,5]. Particularly, the cycloaddition of CO2 and epoxides to synthesize cyclic carbonates is one of the most successful and efficient routes for chemical fixation of CO2 in academia and industry [1,2]. The cyclic carbonates are widely used as green reagents, aprotic solvents, precursors for polycarbonate materials, electrolyte solvents for lithium ion battery and fuel additives [5]. Therefore, a variety of catalysts have been investigated for the coupling reaction, such as, alkali metal salts, transition metal complexes, functional polymers, quaternary ammonium salts, quaternary phosphonium salts and Schiff bases [6]. However, these catalytic systems were still suffered from low reactivity, harsh reaction condition, toxic metals, and/or multistep catalyst preparation. Newly emerged ionic liquids (ILs) were supposed to solve such problems to some extent when they were applied to catalyze the cycloaddition reaction of CO2 and epoxides [7]. We also found that phenolic hydroxyl-functionalized imidazolium ILs present excellent performance for the cycloaddition reaction [8]. In these studies, the typical ILs-catalyzed mechanism was established as shown in Scheme 1 a [9]. The cations of ILs activate epoxides through the interaction with oxygen and the anions of ILs undergo a nucleophilic attack at the least hindered carbon atom of epoxides, which facilitate the opening of the CO bond. In this strategy, the activation of CO2 was ignored. On the other hand, it has been reported that organic bases may provide new opportunities for CO2 activation through the formation of base-CO2 adducts [10]. As co-catalysts, organic bases were widely used to activate CO2 in the cycloaddition of CO2 and epoxides (Scheme 1b) [11]. Herein, we present a study on the combination of imidazolium ionic liquids and organic bases as synergistic catalytic system for the cycloaddition of CO2 and epoxides for the first time (Scheme 1c). In this catalytic system, ionic liquids and organic bases are able to activate epoxides and CO2, respectively. The dual activation facilitates the reaction to proceed under mild conditions. Experimental and theoretical methods on molecules were applied to investigate the synergistic mechanisms of ionic liquids/secondary amines or ionic liquids/tertiary amines. 2 Experimental 2.1 General 1-Benzyl-3-butylimidazolium bromide (BnBimBr), 1,3-dibenzylimidazolium bromide (DBnimBr), 1-benzyl-2-methy-3-butylimidazolium bromide (BnMBimBr) were synthesized according to the literature with minor modification (see Supporting Information). 1-Butyl-3-methylimidazolium bromide (BmimBr) was supplied by the Centre for Green Chemistry and Catalysis, LICP, CAS. CO2 was supplied by Doumaoai Factory with a purity of 99.9%. Epichlorohydrin, epibromohydrin, 2-(phenoxymethyl)oxirane ethylene oxide, propylene oxide, styrene oxide and 1,2-hexene oxide were purchased from TCI. The other reagents were supplied by Sinopharm. All chemicals were used without further purification. NMR spectra were recorded on Bruker Ascend400 instruments with tetramethylsilane as the internal standard. GC analysis was performed by using a Shimadzu GC–14 B equipped with a capillary column DM-1701 (60 m-0.32 mm-0.25 mm) equipped with a flame ionization detector. FTIR spectra were recorded on a Nicolet nexus 670 instrument. 2.2 Typical procedure for the cycloaddition of CO2 and epoxide Typically, epichlorohydrin (0.925 g, 10 mmol), BnBimBr (0.029 g, 0.1 mmol) and DEA (0.007 g, 0.1 mmol) were mixed together and put into a 30 mL stainless steel autoclave equipped with a magnetic stirrer. The reaction was carried out under atmospheric pressure of CO2 at 80 °C. After the completion of reaction, the autoclave was cooled to room temperature. In order to remove the ionic liquid, Et2O (40 mL) was added to the reaction mixture and filtered. The filtrate was subsequently analyzed by gas chromatography to determine yield using dodecane as internal standard. The product was purified by chromatography on silica gel and characterized structurally by NMR spectroscopy. 2.3 Computational methods The structural optimization by DFT calculations was carried out at the M06-2x/6–31 + G* level using G09 program package [12,13]. The frequency analyses were then performed at the M06-2X/6-311G* level based on the optimized gaseous structures to identify the minima and transition states on potential surfaces. The intrinsic reaction coordinate calculations were conducted to verify that the transition structures connect the correct reactants and products in the forward and reverse directions. The solvent effect on the solute was evaluated using the SMD [14,15] model in G09. All the calculated Gibbs free energies ΔGsol were evaluated under the experimental conditions with the temperature 353 K and pressure 0.1 MPa. More details about the optimized structures are provided in Supporting Information. 3 Results and discussion 3.1 Synergistic catalysis of organic bases and ionic liquids To investigate the effect of intermolecular synergistic catalytic system, diethylamine (DEA) and BnBimBr were selected as catalysts for the cycloaddition of CO2 and epichlorohydrin. When BnBimBr was used alone, a moderate yield of 50% of 3-chloro-1,2-propylene carbonate was obtained after 3 h under atmospheric CO2 pressure (entry 1, Table 1 ). If DEA was used alone, a poor yield of 20% was obtained (entry 2, Table 1). However, the combination of BnBimBr and DEA gave excellent yield of 96% (entry 3, Table 1), indicating the intermolecular synergistic effect of organic base and ionic liquid for accelerating the cycloaddition reaction. The synergistic effect was also observed in the combination of other ionic liquids and DEA as well. DBnimBr and BmimBr gave yields of 95% and 82%, respectively (entry 4–5, Table 1). However, BnMBimBr, in which the C2-H of the imidazolium ring was replaced by methyl group, provided a lower yield of product (53%) (entry 6, Table 1). These results indicated that C2-H of imidazolium was also crucial for the reaction. NMR spectroscopy and DFT calculations demonstrated the interaction between epoxide and C2-H through hydrogen bonding which led to the activation of epoxide (Fig. S1, S2). The similar observation has been reported by us and others [16]. Various organic bases also showed the synergistic effects to different extent in combination with BnBimBr. Distinctly, N, N-diethylbenzylamine (DEBA) and 1-methylimidazole (MIm) gave the high yields of 93% and 91%, respectively (entry 7–8, Table 1). Other organic bases including 1,8-diazabicyclo[5.4.0]-undec-7-ene (DBU), triethylamine (TEA), n-butylamine (n-BA), 1,4-diazabicyclo[2.2.2]octane (DABCO) and imidazole (Im) afforded the product in the yields of 72–85% (entry 9–13, Table 1). In order to verify the effect of organic base on the cycloaddition reaction in detail, DFT calculations were applied to simulate the hydrogen bond (H1 O1) between C2H of imidazolium and oxygen atom of epichlorohydrin in the mixture of BnBimBr, epoxide and organic bases. The length of H1 O1 bond was ranging from 2.07 Å to 2.25 Å in the presence of different organic bases such as DEA, DEBA, MIm, DBU, TEA, n-BA, DABCO and Im (Fig. S3), which might be influenced by the basicity and steric hindrance of organic base. Interestingly, an approximately linear negative correlation was obtained between the catalytic activities of organic bases and the lengths of H1 O1 bonds (Fig. 1 ). When the length of H1 O1 bond was shorter, the activation of epoxide was more sufficient, which led to the higher reaction activity. These results demonstrated that these organic bases affected the interaction between BnBimBr and epoxide, and further influenced the reaction activity. 3.2 Optimization of reaction parameters Subsequently, we investigated the effect of other reaction parameters including catalysts amount, reaction temperature and reaction time. In BnBimBr/DEA synergistic catalytic system, when increasing the amount of BnBimBr from 0.5 mol% to 1 mol%, the yield of cyclic carbonate increased from 80% to 96%, and remained the same yield with further increasing the amount of ionic liquid to 2 mol% (entry 1–3, Table 2 ). With increasing of the amount of organic base from 1 mol% to 2 mol%, the yield did not change obviously, decreasing the amount of organic base to 0.5 mol% resulted in slightly decrease in the yield from 96% to 91% (entry 4–5, Table 2). Lowering reaction temperature to 70 °C and 60 °C led to lower yields of 75% and 45%, respectively (entry 6 and 7, Table 2). In addition, a shorter reaction time of 2 h and 1 h gave the lower yields of 75% and 59%, respectively (entry 8 and 9, Table 2). The optimized reaction conditions of 1 mol% BnBimBr, 1 mol% DEA, 80 °C, 3 h, 0.1 MPa were obtained. The BnBimBr/DEBA catalytic system showed a similar variation trend (Table S1). 3.3 Synthesis of cyclic carbonates from CO2 and other epoxides To investigate the generalities of the dual catalyst system, various epoxides were applied for cycloaddition under the optimized reaction conditions (Table 3 ). Diverse epoxides were transformed into corresponding cyclic carbonates with good to excellent yields. In BnBimBr/DEA synergistic catalytic system, epibromohydrin and 2-(phenoxymethyl)oxirane (entry 1–2, Table 3) afforded high yields of 95% and 93%, respectively, presumably ascribe to the electron-withdrawing properties of the bromide atom and phenoxyl [11c,17]. Due to their low boiling points, ethylene oxide and propylene oxide reacted with CO2 under higher pressure and gave yield of 97% (entry 3–4, Table 3). Styrene oxide (entry 5, Table 3) with large steric hindrance also converted into corresponding cyclic carbonate in the yield of 94% under a slight higher temperature (90 °C). 1,2-Hexene oxide afforded a good yield (81%) at 110 °C (entry 6, Table 3). The relative lower reactivity of 1,2-hexene oxide was probably ascribed to the large steric hindrance and electron donating group of butyl, which would hinder nucleophilic attack on the least hindered carbon atom of epoxide ring. The BnBimBr/DEBA system also showed good generalities for various epoxides (Table S2). 3.4 Mechanism study During the studies of synergistic effect of organic bases and ionic liquids, we found that secondary amines and tertiary amines activated CO2 through different approaches. In order to make a deep insight into the catalytic mechanism, the activation models of CO2 by secondary amines and tertiary amines and the promotion of ionic liquids were investigated by using experimental and theoretical methods. 3.4.1 Ionic liquids/secondary amines catalyzed mechanism It has reported that the reaction of secondary amines and CO2 form carbamic acids or carbamates depending on the reaction conditions. [4a,18] In order to clarify the intermediates in BnBimBr/DEA catalyzed system, FT-IR and NMR investigations were applied to identify the reaction mixture of DEA and CO2. The FT-IR spectrum of the DEA before and after CO2-bubbling for 1 h was shown in Fig. 2 . Two characteristic peaks centered at 1634 cm−1 and 1661 cm−1 can be assigned to the new formed −COOH moiety. [19] Besides, the characteristic peak corresponding to dialkylammonium carbamate anion around 1545–1575 cm−1 was not observed. [18c,20] These results indicated that CO2 could be captured by DEA to generate carbamic acid under the reaction condition. Subsequently, NMR investigations based on the bubbling of CO2 into DEA were performed to further verify the formation of diethylcarbamic acid (Fig. 3 ). Upon prolonging the reaction time, the resonance of active proton was shifted downfield gradually from 0.88 ppm to 7.89 ppm and all the peaks were broadened, which were presumably due to the fast proton exchange between continuous formed carbamic acid and free amine. In the 13C NMR spectrum, a new signal at δ = 161.89 ppm was observed, which indicates that a CO2 molecule was inserted into the NH bond of DEA to form the carbamic acid. Dijkstra also found similar results that carbamic acid was formed in the organic solvent and in the supercritical CO2. [18c] CO2 could be activated by diethyl amine to form diethyl carbamic acid, which was considered as active intermediate in the cycloaddition of CO2 and epoxides (Scheme 2 ). On the basis of the dual effect of such a binary catalyst on epoxide/CO2-activation, a reaction mechanism catalyzed by BnBimBr/secondary amines is proposed as illustrated in Fig. 4 (a). Correspondingly, a detailed DFT calculation on the reaction pathways was carried out and the calculated free energy profiles are shown in Fig. 4(b). In the first step, the epoxide and BnBimBr can form the stable complex Int-1 through the hydrogen-bonding interaction between the oxygen atom of epoxide ring and the C2-H of BnBimBr. Then, the bromide anion attacks the carbon atom of epoxide nucleo philically via the transition state TS-1, with a remarkable energy barrier of 23.0 kcal mol−1. The ring opening of epoxide leads to an oxy anion species Int-2. On the other hand, CO2 is activated by DEA via the transition state TS-2 to afford the species Int-4 diethyl carbamic acid, where the new nitrogen-carbon bond forms. Our calculated results also indicate that, the energy of another transition state without the water for proton transfer is higher than that of TS-2 (Fig. S4), since the transition state with a four-member ring is quite unstable in energetics. Subsequently, nucleophilic attack of Int-2 on Int-4 via the transition state TS-3, yielding a salt Int-5 which contains alkylcarbonate anion. The DEA is released from TS-3 by abstracting the proton in diethyl carbamic acid back through a water molecule as a proton shuttle. The activation energy barrier for this step is 21.2 kcal mol−1 and the salt Int-5 is quite stable in energetics. Finally, Int-5 converts to the corresponding cyclic carbonate Pro through the intramolecular ring-closure via TS-4, with regenerating the catalyst BnBimBr. 3.4.2 Ionic liquids/tertiary amines catalyzed mechanism During the study of the mechanism for BnBimBr/DEBA catalyzed the cycloaddition of CO2 and epoxide, we found that adventitious water could affect the catalytic activity significantly. Accordingly, the effect of additional water on the cycloaddition of CO2 and epichlorohydrin was investigated. As shown in Fig. 5 , without any additional water, a yield of 50% was obtained after 1 h under atmospheric CO2 pressure. With increasing of additional water from 1 mol% to 4 mol% base on the epoxide, the yields were increased gradually to around 70%. However, with further increasing of additional water from 4 mol% to 10 mol%, the yields were decreased significantly. The effect of water in other BnBimBr/tertiary amine systems was also evaluated. As shown in Fig. 6 , in the presence of 4 mol% water, the yields of target product increased about 10% in the BnBimBr/tertiary amines (e.g. DBU, TEA, DABCO, Mim and Im) systems. It has reported that DBU could react with CO2 to form corresponding bicarbonate salt [DBUH+][HCO3 −] in the presence of trace amount of water. [21] Similarly, in the BnBimBr/tertiary amines system, adventitious water was capable of assisting tertiary amines to activate CO2 through in-situ generation of bicarbonate salts. The appropriate amount of water would facilitate the formation of bicarbonate salts, which were considered to be active species of CO2 for the cycloaddition, and lead to acceleration of the reaction. Based on the above results, a reaction mechanism catalyzed by BnBimBr/tertiary amines is proposed as illustrated in Fig. 7 (a). Correspondingly, a detailed DFT calculation on the reaction pathways was carried out and the calculated free energy profiles are shown in Fig. 7(b). The ring-opening process of epoxide is the same as Path A shown in Fig. 4(b). Path D denotes the proposed pathway for the activation of CO2 existing in solution by the tertiary amine. Tertiary amine, CO2, and water molecules can form stable complex Int-6 through the hydrogen bonding interactions in solution. Due to the strong basicity of tertiary amine, the nitrogen atom is capable of abstracting the proton from H2CO3 through the transition state TS-5. The energy barrier for the proton abstraction via TS-5 is only 5.9 kcal mol−1, which is quite easy to occur in solution. The capture of CO2 by DEBA with water molecules generates the ion pair [HDEBA+][HCO3 −], denoted as Int-7. The ion pair Int-7 reacts with Int-2 to generate the stable complex Int-5, with DEBA and a water molecule liberated. The energy barrier of this step is 21.2 kcal mol−1. In the last intramolecular cyclization step via the transition state TS-4, the target product Pro is formed and BnBimBr is regenerated. 4 Conclusion In summary, a simple and efficient intermolecular synergistic catalyst system consisting of imidazolium ionic liquids and organic bases has been developed for CO2 chemical fixation with epoxides under metal- and solvent-free conditions. The binary system exhibits distinctly higher catalytic activity than using organic bases or imidazolium ionic liquids alone. The combination of imidazolium ionic liquids and organic bases is found to be applicable for the transformation of a range of epoxides under very mild conditions. The mechanism studies based on the NMR, FT-IR investigations and DFT calculations indicate that imidazolium ionic liquids activate epoxides and organic bases activate CO2, respectively. The application of imidazolium ionic liquids/organic bases catalytic system in the cycloaddition reaction provides a cost-effective and energy-efficient route to obtain 5-membered cyclic carbonates from CO2 at atmospheric pressure. Acknowledgements We thank the National Key Research and Development Program of China (2017YFA0403102), the National Natural Science Foundation of China (21573072, 21773068, 21433004) Shanghai Natural Science Foundation (14ZR1411800) and Shanghai Leading Academic Discipline Project (B409) for financial support. We acknowledge the support of the NYU-ECNU Center for Computational Chemistry at NYU Shanghai. We also thank the supercomputer center of ECNU for providing computer time. Appendix A Supplementary data Supplementary data associated with this article can be found, in the online version, at http://dx.doi.org/10.1016/j.mcat.2017.12.026. Appendix A Supplementary data The following is Supplementary data to this article: References [1] (a) A.J. Hunt E.H.K. Sin R. Marriott J.H. Clark ChemSusChem 3 2010 306 322 (b) A. Goeppert M. Czaun G.K.S. Prakash G.A. Olah Energy Environ. Sci. 5 2012 7833 7853 (c) M. Drees M. Cokoja F.E. Kühn ChemCatChem 4 2012 1703 1712 (d) M. He Y. Sun B. Han Angew. Chem. Int. Ed. 5 2013 9620 9633 (e) L. Yang H. Wang ChemSusChem 7 2014 962 998 (f) Q. Yi W. Li J. Feng K. Xie Chem. Soc. Rev. 44 2015 5409 5445 [2] (a) T. Sakakura J.-C. Choi H. Yasuda Chem. Rev. 107 2007 2365 2387 (b) M. Mikkelsen M. Jørgensen F.C. Krebs Energy Environ. Sci. 3 2010 43 81 [3] (a) M. Cokoja C. Bruckmeier B. Rieger W.A. Herrmann F.E. Kühn Angew. Chem. Int. Ed. 5 2011 8510 8537 (b) C. Maeda Y. Miyazaki T. Ema Catal. Sci. Technol. 4 2014 1482 1497 (c) H. Takeda C. Cometto O. Ishitani M. Robert ACS Catal. 7 2017 70 88 [4] (a) D.B. Dell’Amico F. Calderazzo L. Labella F. Marchetti G. Pampaloni Chem. Rev. 103 2003 3857 3897 (b) C. Liu J. Ye J. Jiang Y. Pan ChemCatChem 3 2011 529 541 (c) G.A. Olah G.K.S. Prakash A. Goeppert J. Am. Chem. Soc. 133 2011 12881 12898 (d) W. Wang S. Wang X. Ma J. Gong Chem. Soc. Rev. 40 2011 3703 3727 (e) K. Li B. Peng T. Peng ACS Catal. 6 2016 7485 7527 [5] (a) T. Sakakura K. Kohnoa Chem. Commun. 2009 1312 1330 (b) M. North R. Pasquale C. Young Green Chem. 12 2010 1514 1539 (c) M. Cokoja M.E. Wilhelm M.H. Anthofer W.A. Herrmann F.E. Kühn ChemSusChem 8 2015 2436 2454 [6] (a) D.H. Gibson Chem. Rev. 96 1996 2063 2095 (b) A. Decortes A.M. Castilla A.W. Kleij Angew. Chem. Int. Ed. 122 2010 10016 10032 (c) P.P. Pescarmona M. Taherimehr Catal. Sci. Technol. 2 2012 2169 2187 (d) D.-W. Kim R. Roshan J. Tharun A. Cherian D.-W. Park Korean J. Chem. Eng. 30 2013 1973 1984 (e) J.W. Comerford I.D.V. Ingram M. North X. Wu Green Chem. 17 2015 1966 1987 (f) C. Martín G. Fiorani A.W. Kleij ACS. Catal. 5 2015 1353 1370 (g) H. Büttner J. Steinbauer T. Werner ChemSusChem 8 2015 2655 2669 (h) V. D’Elia J.D.A. Pelletier J.M. Basset ChemCatChem 7 2015 1906 1917 (i) L. Qin B. Wang Y. Zhang L. Chen G. Gao Chem. Commun. 53 2017 3785 3788 [7] (a) Z.-Z. Yang Y.-N. Zhao L.-N. He RSC Adv. 1 2011 545 567 (b) H. Li P.S. Bhadury B. Song S. Yang RSC Adv. 2 2012 12525 12551 (c) W. Cheng Q. Su J. Wang J. Sun F.T.T. Ng Catalysts 3 2013 878 901 (d) Q. He J.W. O'Brien K.A. Kitselman L.E. Tompkins G.C.T. Curtis F.M. Kerton Catal. Sci. Technol. 4 2014 1513 1528 [8] (a) S. Wu B. Wang Y. Zhang E.H.M. Elageed H. Wu G. Gao J. Mol. Catal. A Chem. 418 2016 1 8 (b) S. Wu Y. Zhang B. Wang E.H.M. Elageed L. Ji H. Wu G. Gao Eur. J. Org. Chem. 3 2017 753 759 [9] B.-H. Xu J.-Q. Wang J. Sun Y. Huang J.-P. Zhang X.-P. Zhang S.-J. Zhang Green Chem. 17 2015 108 122 [10] (a) C. Villiers J.-P. Dognon R. Pollet P. Thuéry M. Ephritikhine Angew. Chem. Int. Ed. 49 2010 3465 3468 (b) C.D.N. Gomes O. Jacquet C. Villiers P. Thuéry M. Ephritikhine T. Cantat Angew. Chem. Int. Ed. 51 2012 187 190 [11] (a) J. Sun W. Cheng Z. Yang J. Wang T. Xu J. Xin S. Zhang Green Chem. 16 2014 3071 3078 (b) X. Liu S. Zhang Q.-W. Song X.-F. Liu R. Ma L.-N. He Green Chem. 18 2016 2871 2876 (c) L. Wang K. Kodama T. Hirose Catal. Sci. Technol. 6 2016 3872 3877 [12] (a) R. Huenerbein B. Schirmer J. Moellmann S. Grimme Phys. Chem. Chem. Phys. 12 2010 6940 6948 (b) Y. Zhao D.G. Truhlar Org. Lett. 8 2006 5753 5755 (c) Y. Zhao D.G. Truhlar Theor. Chem. Acc. 120 2008 215 241 [13] M.J. Frisch G.W. Trucks H.B. Schlegel G.E. Scuseria M.A. Robb J.R. Cheeseman G. Scalmani V. Barone B. Mennucci G.A. Petersson H. Nakatsuji M. Caricato X. Li H.P. Hratchian A.F. Izmaylov J. Bloino G. Zheng J.L. Sonnenberg M. Hada M. Ehara K. Toyota R. Fukuda J. Hasegawa M. Ishida T. Nakajima Y. Honda O. Kitao H. Nakai T. Vreven J.A. Montgomery Jr. J.E. Peralta F. Ogliaro M. Bearpark J.J. Heyd E. Brothers K.N. Kudin V.N. Staroverov R. Kobayashi J. Normand K. Raghavachari A. Rendell J.C. Burant S.S. Iyengar J. Tomasi M. Cossi N. Rega J.M. Millam M. Klene J.E. Knox J.B. Cross V. Bakken C. Adamo J. Jaramillo R. Gomperts R.E. Stratmann O. Yazyev A.J. Austin R. Cammi C. Pomelli J.W. Ochterski R.L. Martin K. Morokuma V.G. Zakrzewski G.A. Voth P. Salvador J.J. Dannenberg S. Dapprich A.D. Daniels Ö. Farkas J.B. Foresman J.V. Ortiz J. Cioslowski D.J. Fox Gaussian 2017 Inc Wallingford CT [14] M. Dolg U. Wedig H. Stoll H. Preuss J. Chem. Phys. 86 1987 866 872 [15] D. Andrae U. Häußermann M. Dolg H. Stoll H. Preuß Theor. Chem. Acc. 77 1990 123 141 [16] (a) Y.J. Kim R.S. Varma J. Org. Chem. 70 2005 7882 7891 (b) L. Zhang X. Fu G. Gao ChemCatChem 3 2011 1359 1364 (c) B. Wang X. Feng L. Zhang S. Yang X. Jiang J. Zhou G. Gao J. CO2 Util. 1 2013 88 91 (d) B. Wang S. Yang L. Min Y. Gu Y. Zhang X. Wu L. Zhang E.H.M. Elageed S. Wu G. Gao Adv. Synth. Catal. 356 2014 3125 3134 (e) B. Wang E.H.M. Elageed D. Zhang S. Yang S. Wu G. Zhang G. Gao ChemCatChem 6 2014 278 283 (f) E.H.M. Elageed B. Chen B. Wang Y. Zhang S. Wu X. Liu G. Gao Eur. J. Org. Chem. 2016 3650 3656 (g) Y. Zhang B. Wang E.H.M. Elageed L. Qin B. Ni X. Liu G. Gao ACS Macro Lett. 5 2016 435 438 (h) Z. Luo B. Wang Y. Liu G. Gao F. Xia Phys. Chem. Chem. Phys. 18 2016 27951 27957 [17] (a) J. Song B. Zhang P. Zhang J. Ma J. Liu H. Fan T. Jiang B. Han Catal. Today 183 2012 130 135 (b) J. Shi J. Song J. Ma Z. Zhang H. Fan B. Han Pure Appl. Chem. 85 2013 1633 1641 [18] (a) E.M. Hampe D.M. Rudkevich Tetrahedron 59 2003 9619 9625 (b) U.P. Kreher A.E. Rosamilia C.L. Raston J.L. Scott C.R. Strauss Molecules 9 2004 387 393 (c) Z.J. Dijkstra A.R. Doornbos H. Weyten J.M. Ernsting C.J. Elsevier J.T.F. Keurentjes J. Supercrit. Fluids 41 2007 109 114 (d) R. Vijayaraghavan D.R. MacFarlane ACS Sustain. Chem. Eng. 2 2014 1724 1728 [19] (a) C.S. Srikanth S.S.C. Chuang J. Phys. Chem. C 117 2013 9196 9205 (b) Y. Wang J. Zhang J. Liu C. Zhang Z. Zhang J. Xu S. Xu F. Wang F. Wang ChemSusChem 8 2015 2066 2072 [20] (a) C. Hisatsune Can. J. Chem. 62 1984 945 948 (b) D.J. Heldebrant P.K. Koech M.T.C. Ang C. Liang J.E. Rainbolt C.R. Yonker P.G. Jessop Green Chem. 12 2010 713 721 (c) A.-H. Liu R. Ma C. Song Z.-Z. Yang A. Yu Y. Cai L.-N. He Y.-N. Zhao B. Yu Q.-W. Song Angew. Chem. Int. Ed. 51 2012 11306 11310 [21] D.J. Heldebrant P.G. Jessop C.A. Thomas C.A. Eckert C.L. Liotta J. Org. Chem. 70 2005 5335 5338",
      "scopus-id": "85041924840",
      "coredata": {
        "eid": "1-s2.0-S2468823117306673",
        "dc:description": "An intermolecular synergistic catalytic system consisting of ionic liquids and organic bases is developed for the cycloaddition of CO2 and epoxides. This strategy realizes the cycloaddition takes place under atmospheric pressure of CO2 with high activity. NMR, FT-IR spectroscopy and DFT calculations are applied to investigate the synergistic effect and reaction mechanism on molecules. Plausible ionic liquids/secondary amines and ionic liquids/tertiary amines catalyzed mechanisms are proposed and further confirmed by more detailed DFT calculations including reaction pathways and energy profiles, respectively. The procedure reported here represents a facile, cost-effective and energy-efficient route for chemical fixation of CO2 into 5-membered cyclic carbonates.",
        "openArchiveArticle": "false",
        "prism:coverDate": "2018-02-28",
        "openaccessUserLicense": null,
        "prism:aggregationType": "Journal",
        "prism:url": "https://api.elsevier.com/content/article/pii/S2468823117306673",
        "dc:creator": [
          {
            "@_fa": "true",
            "$": "Ji, Liangzheng"
          },
          {
            "@_fa": "true",
            "$": "Luo, Zhoujie"
          },
          {
            "@_fa": "true",
            "$": "Zhang, Yongya"
          },
          {
            "@_fa": "true",
            "$": "Wang, Rong"
          },
          {
            "@_fa": "true",
            "$": "Ji, Yayan"
          },
          {
            "@_fa": "true",
            "$": "Xia, Fei"
          },
          {
            "@_fa": "true",
            "$": "Gao, Guohua"
          }
        ],
        "link": [
          {
            "@_fa": "true",
            "@rel": "self",
            "@href": "https://api.elsevier.com/content/article/pii/S2468823117306673"
          },
          {
            "@_fa": "true",
            "@rel": "scidir",
            "@href": "https://www.sciencedirect.com/science/article/pii/S2468823117306673"
          }
        ],
        "dc:format": "application/json",
        "openaccessType": null,
        "pii": "S2468-8231(17)30667-3",
        "prism:volume": "446",
        "prism:publisher": "Elsevier B.V.",
        "dc:title": "Imidazolium ionic liquids/organic bases: Efficient intermolecular synergistic catalysts for the cycloaddition of CO2 and epoxides under atmospheric pressure",
        "prism:copyright": "© 2017 Elsevier B.V. All rights reserved.",
        "openaccess": "0",
        "prism:issn": "24688231",
        "dcterms:subject": [
          {
            "@_fa": "true",
            "$": "Carbon dioxide"
          },
          {
            "@_fa": "true",
            "$": "Synergistic catalysis"
          },
          {
            "@_fa": "true",
            "$": "Cycloaddition"
          },
          {
            "@_fa": "true",
            "$": "Mechanism study"
          }
        ],
        "openaccessArticle": "false",
        "prism:publicationName": "Molecular Catalysis",
        "openaccessSponsorType": null,
        "prism:pageRange": "124-130",
        "prism:endingPage": "130",
        "pubType": "fla",
        "prism:coverDisplayDate": "February 2018",
        "prism:doi": "10.1016/j.mcat.2017.12.026",
        "prism:startingPage": "124",
        "dc:identifier": "doi:10.1016/j.mcat.2017.12.026",
        "openaccessSponsorName": null
      },
      "objects": {
        "object": [
          {
            "@category": "standard",
            "@height": "200",
            "@width": "394",
            "@_fa": "true",
            "$": "https://api.elsevier.com/content/object/eid/1-s2.0-S2468823117306673-fx1.jpg?httpAccept=%2A%2F%2A",
            "@multimediatype": "JPEG image file",
            "@type": "IMAGE-DOWNSAMPLED",
            "@size": "19895",
            "@ref": "fx1",
            "@mimetype": "image/jpeg"
          },
          {
            "@category": "standard",
            "@height": "36",
            "@width": "67",
            "@_fa": "true",
            "$": "https://api.elsevier.com/content/object/eid/1-s2.0-S2468823117306673-fx10.jpg?httpAccept=%2A%2F%2A",
            "@multimediatype": "JPEG image file",
            "@type": "IMAGE-DOWNSAMPLED",
            "@size": "1322",
            "@ref": "fx10",
            "@mimetype": "image/jpeg"
          },
          {
            "@category": "standard",
            "@height": "28",
            "@width": "20",
            "@_fa": "true",
            "$": "https://api.elsevier.com/content/object/eid/1-s2.0-S2468823117306673-fx11.jpg?httpAccept=%2A%2F%2A",
            "@multimediatype": "JPEG image file",
            "@type": "IMAGE-DOWNSAMPLED",
            "@size": "716",
            "@ref": "fx11",
            "@mimetype": "image/jpeg"
          },
          {
            "@category": "standard",
            "@height": "30",
            "@width": "30",
            "@_fa": "true",
            "$": "https://api.elsevier.com/content/object/eid/1-s2.0-S2468823117306673-fx12.jpg?httpAccept=%2A%2F%2A",
            "@multimediatype": "JPEG image file",
            "@type": "IMAGE-DOWNSAMPLED",
            "@size": "764",
            "@ref": "fx12",
            "@mimetype": "image/jpeg"
          },
          {
            "@category": "standard",
            "@height": "41",
            "@width": "49",
            "@_fa": "true",
            "$": "https://api.elsevier.com/content/object/eid/1-s2.0-S2468823117306673-fx13.jpg?httpAccept=%2A%2F%2A",
            "@multimediatype": "JPEG image file",
            "@type": "IMAGE-DOWNSAMPLED",
            "@size": "1162",
            "@ref": "fx13",
            "@mimetype": "image/jpeg"
          },
          {
            "@category": "standard",
            "@height": "31",
            "@width": "37",
            "@_fa": "true",
            "$": "https://api.elsevier.com/content/object/eid/1-s2.0-S2468823117306673-fx14.jpg?httpAccept=%2A%2F%2A",
            "@multimediatype": "JPEG image file",
            "@type": "IMAGE-DOWNSAMPLED",
            "@size": "889",
            "@ref": "fx14",
            "@mimetype": "image/jpeg"
          },
          {
            "@category": "standard",
            "@height": "42",
            "@width": "174",
            "@_fa": "true",
            "$": "https://api.elsevier.com/content/object/eid/1-s2.0-S2468823117306673-fx2.jpg?httpAccept=%2A%2F%2A",
            "@multimediatype": "JPEG image file",
            "@type": "IMAGE-DOWNSAMPLED",
            "@size": "2507",
            "@ref": "fx2",
            "@mimetype": "image/jpeg"
          },
          {
            "@category": "standard",
            "@height": "16",
            "@width": "36",
            "@_fa": "true",
            "$": "https://api.elsevier.com/content/object/eid/1-s2.0-S2468823117306673-fx3.jpg?httpAccept=%2A%2F%2A",
            "@multimediatype": "JPEG image file",
            "@type": "IMAGE-DOWNSAMPLED",
            "@size": "607",
            "@ref": "fx3",
            "@mimetype": "image/jpeg"
          },
          {
            "@category": "standard",
            "@height": "30",
            "@width": "51",
            "@_fa": "true",
            "$": "https://api.elsevier.com/content/object/eid/1-s2.0-S2468823117306673-fx4.jpg?httpAccept=%2A%2F%2A",
            "@multimediatype": "JPEG image file",
            "@type": "IMAGE-DOWNSAMPLED",
            "@size": "903",
            "@ref": "fx4",
            "@mimetype": "image/jpeg"
          },
          {
            "@category": "standard",
            "@height": "12",
            "@width": "11",
            "@_fa": "true",
            "$": "https://api.elsevier.com/content/object/eid/1-s2.0-S2468823117306673-fx5.jpg?httpAccept=%2A%2F%2A",
            "@multimediatype": "JPEG image file",
            "@type": "IMAGE-DOWNSAMPLED",
            "@size": "462",
            "@ref": "fx5",
            "@mimetype": "image/jpeg"
          },
          {
            "@category": "standard",
            "@height": "20",
            "@width": "22",
            "@_fa": "true",
            "$": "https://api.elsevier.com/content/object/eid/1-s2.0-S2468823117306673-fx6.jpg?httpAccept=%2A%2F%2A",
            "@multimediatype": "JPEG image file",
            "@type": "IMAGE-DOWNSAMPLED",
            "@size": "579",
            "@ref": "fx6",
            "@mimetype": "image/jpeg"
          },
          {
            "@category": "standard",
            "@height": "30",
            "@width": "36",
            "@_fa": "true",
            "$": "https://api.elsevier.com/content/object/eid/1-s2.0-S2468823117306673-fx7.jpg?httpAccept=%2A%2F%2A",
            "@multimediatype": "JPEG image file",
            "@type": "IMAGE-DOWNSAMPLED",
            "@size": "801",
            "@ref": "fx7",
            "@mimetype": "image/jpeg"
          },
          {
            "@category": "standard",
            "@height": "23",
            "@width": "30",
            "@_fa": "true",
            "$": "https://api.elsevier.com/content/object/eid/1-s2.0-S2468823117306673-fx8.jpg?httpAccept=%2A%2F%2A",
            "@multimediatype": "JPEG image file",
            "@type": "IMAGE-DOWNSAMPLED",
            "@size": "628",
            "@ref": "fx8",
            "@mimetype": "image/jpeg"
          },
          {
            "@category": "standard",
            "@height": "31",
            "@width": "47",
            "@_fa": "true",
            "$": "https://api.elsevier.com/content/object/eid/1-s2.0-S2468823117306673-fx9.jpg?httpAccept=%2A%2F%2A",
            "@multimediatype": "JPEG image file",
            "@type": "IMAGE-DOWNSAMPLED",
            "@size": "923",
            "@ref": "fx9",
            "@mimetype": "image/jpeg"
          },
          {
            "@category": "standard",
            "@height": "317",
            "@width": "376",
            "@_fa": "true",
            "$": "https://api.elsevier.com/content/object/eid/1-s2.0-S2468823117306673-gr1.jpg?httpAccept=%2A%2F%2A",
            "@multimediatype": "JPEG image file",
            "@type": "IMAGE-DOWNSAMPLED",
            "@size": "17625",
            "@ref": "gr1",
            "@mimetype": "image/jpeg"
          },
          {
            "@category": "standard",
            "@height": "209",
            "@width": "263",
            "@_fa": "true",
            "$": "https://api.elsevier.com/content/object/eid/1-s2.0-S2468823117306673-gr2.jpg?httpAccept=%2A%2F%2A",
            "@multimediatype": "JPEG image file",
            "@type": "IMAGE-DOWNSAMPLED",
            "@size": "16127",
            "@ref": "gr2",
            "@mimetype": "image/jpeg"
          },
          {
            "@category": "standard",
            "@height": "198",
            "@width": "489",
            "@_fa": "true",
            "$": "https://api.elsevier.com/content/object/eid/1-s2.0-S2468823117306673-gr3.jpg?httpAccept=%2A%2F%2A",
            "@multimediatype": "JPEG image file",
            "@type": "IMAGE-DOWNSAMPLED",
            "@size": "13633",
            "@ref": "gr3",
            "@mimetype": "image/jpeg"
          },
          {
            "@category": "standard",
            "@height": "282",
            "@width": "753",
            "@_fa": "true",
            "$": "https://api.elsevier.com/content/object/eid/1-s2.0-S2468823117306673-gr4.jpg?httpAccept=%2A%2F%2A",
            "@multimediatype": "JPEG image file",
            "@type": "IMAGE-DOWNSAMPLED",
            "@size": "39106",
            "@ref": "gr4",
            "@mimetype": "image/jpeg"
          },
          {
            "@category": "standard",
            "@height": "312",
            "@width": "376",
            "@_fa": "true",
            "$": "https://api.elsevier.com/content/object/eid/1-s2.0-S2468823117306673-gr5.jpg?httpAccept=%2A%2F%2A",
            "@multimediatype": "JPEG image file",
            "@type": "IMAGE-DOWNSAMPLED",
            "@size": "15069",
            "@ref": "gr5",
            "@mimetype": "image/jpeg"
          },
          {
            "@category": "standard",
            "@height": "268",
            "@width": "376",
            "@_fa": "true",
            "$": "https://api.elsevier.com/content/object/eid/1-s2.0-S2468823117306673-gr6.jpg?httpAccept=%2A%2F%2A",
            "@multimediatype": "JPEG image file",
            "@type": "IMAGE-DOWNSAMPLED",
            "@size": "14519",
            "@ref": "gr6",
            "@mimetype": "image/jpeg"
          },
          {
            "@category": "standard",
            "@height": "279",
            "@width": "753",
            "@_fa": "true",
            "$": "https://api.elsevier.com/content/object/eid/1-s2.0-S2468823117306673-gr7.jpg?httpAccept=%2A%2F%2A",
            "@multimediatype": "JPEG image file",
            "@type": "IMAGE-DOWNSAMPLED",
            "@size": "35923",
            "@ref": "gr7",
            "@mimetype": "image/jpeg"
          },
          {
            "@category": "standard",
            "@height": "311",
            "@width": "376",
            "@_fa": "true",
            "$": "https://api.elsevier.com/content/object/eid/1-s2.0-S2468823117306673-sc1.jpg?httpAccept=%2A%2F%2A",
            "@multimediatype": "JPEG image file",
            "@type": "IMAGE-DOWNSAMPLED",
            "@size": "27042",
            "@ref": "sc1",
            "@mimetype": "image/jpeg"
          },
          {
            "@category": "standard",
            "@height": "39",
            "@width": "188",
            "@_fa": "true",
            "$": "https://api.elsevier.com/content/object/eid/1-s2.0-S2468823117306673-sc2.jpg?httpAccept=%2A%2F%2A",
            "@multimediatype": "JPEG image file",
            "@type": "IMAGE-DOWNSAMPLED",
            "@size": "2535",
            "@ref": "sc2",
            "@mimetype": "image/jpeg"
          },
          {
            "@category": "thumbnail",
            "@height": "111",
            "@width": "219",
            "@_fa": "true",
            "$": "https://api.elsevier.com/content/object/eid/1-s2.0-S2468823117306673-fx1.sml?httpAccept=%2A%2F%2A",
            "@multimediatype": "GIF image file",
            "@type": "IMAGE-THUMBNAIL",
            "@size": "10206",
            "@ref": "fx1",
            "@mimetype": "image/gif"
          },
          {
            "@category": "thumbnail",
            "@height": "118",
            "@width": "219",
            "@_fa": "true",
            "$": "https://api.elsevier.com/content/object/eid/1-s2.0-S2468823117306673-fx10.sml?httpAccept=%2A%2F%2A",
            "@multimediatype": "GIF image file",
            "@type": "IMAGE-THUMBNAIL",
            "@size": "4612",
            "@ref": "fx10",
            "@mimetype": "image/gif"
          },
          {
            "@category": "thumbnail",
            "@height": "128",
            "@width": "90",
            "@_fa": "true",
            "$": "https://api.elsevier.com/content/object/eid/1-s2.0-S2468823117306673-fx11.sml?httpAccept=%2A%2F%2A",
            "@multimediatype": "GIF image file",
            "@type": "IMAGE-THUMBNAIL",
            "@size": "2968",
            "@ref": "fx11",
            "@mimetype": "image/gif"
          },
          {
            "@category": "thumbnail",
            "@height": "134",
            "@width": "133",
            "@_fa": "true",
            "$": "https://api.elsevier.com/content/object/eid/1-s2.0-S2468823117306673-fx12.sml?httpAccept=%2A%2F%2A",
            "@multimediatype": "GIF image file",
            "@type": "IMAGE-THUMBNAIL",
            "@size": "3371",
            "@ref": "fx12",
            "@mimetype": "image/gif"
          },
          {
            "@category": "thumbnail",
            "@height": "164",
            "@width": "194",
            "@_fa": "true",
            "$": "https://api.elsevier.com/content/object/eid/1-s2.0-S2468823117306673-fx13.sml?httpAccept=%2A%2F%2A",
            "@multimediatype": "GIF image file",
            "@type": "IMAGE-THUMBNAIL",
            "@size": "5482",
            "@ref": "fx13",
            "@mimetype": "image/gif"
          },
          {
            "@category": "thumbnail",
            "@height": "139",
            "@width": "164",
            "@_fa": "true",
            "$": "https://api.elsevier.com/content/object/eid/1-s2.0-S2468823117306673-fx14.sml?httpAccept=%2A%2F%2A",
            "@multimediatype": "GIF image file",
            "@type": "IMAGE-THUMBNAIL",
            "@size": "3826",
            "@ref": "fx14",
            "@mimetype": "image/gif"
          },
          {
            "@category": "thumbnail",
            "@height": "52",
            "@width": "219",
            "@_fa": "true",
            "$": "https://api.elsevier.com/content/object/eid/1-s2.0-S2468823117306673-fx2.sml?httpAccept=%2A%2F%2A",
            "@multimediatype": "GIF image file",
            "@type": "IMAGE-THUMBNAIL",
            "@size": "2965",
            "@ref": "fx2",
            "@mimetype": "image/gif"
          },
          {
            "@category": "thumbnail",
            "@height": "73",
            "@width": "161",
            "@_fa": "true",
            "$": "https://api.elsevier.com/content/object/eid/1-s2.0-S2468823117306673-fx3.sml?httpAccept=%2A%2F%2A",
            "@multimediatype": "GIF image file",
            "@type": "IMAGE-THUMBNAIL",
            "@size": "2490",
            "@ref": "fx3",
            "@mimetype": "image/gif"
          },
          {
            "@category": "thumbnail",
            "@height": "128",
            "@width": "219",
            "@_fa": "true",
            "$": "https://api.elsevier.com/content/object/eid/1-s2.0-S2468823117306673-fx4.sml?httpAccept=%2A%2F%2A",
            "@multimediatype": "GIF image file",
            "@type": "IMAGE-THUMBNAIL",
            "@size": "4581",
            "@ref": "fx4",
            "@mimetype": "image/gif"
          },
          {
            "@category": "thumbnail",
            "@height": "55",
            "@width": "49",
            "@_fa": "true",
            "$": "https://api.elsevier.com/content/object/eid/1-s2.0-S2468823117306673-fx5.sml?httpAccept=%2A%2F%2A",
            "@multimediatype": "GIF image file",
            "@type": "IMAGE-THUMBNAIL",
            "@size": "1571",
            "@ref": "fx5",
            "@mimetype": "image/gif"
          },
          {
            "@category": "thumbnail",
            "@height": "92",
            "@width": "101",
            "@_fa": "true",
            "$": "https://api.elsevier.com/content/object/eid/1-s2.0-S2468823117306673-fx6.sml?httpAccept=%2A%2F%2A",
            "@multimediatype": "GIF image file",
            "@type": "IMAGE-THUMBNAIL",
            "@size": "2096",
            "@ref": "fx6",
            "@mimetype": "image/gif"
          },
          {
            "@category": "thumbnail",
            "@height": "137",
            "@width": "163",
            "@_fa": "true",
            "$": "https://api.elsevier.com/content/object/eid/1-s2.0-S2468823117306673-fx7.sml?httpAccept=%2A%2F%2A",
            "@multimediatype": "GIF image file",
            "@type": "IMAGE-THUMBNAIL",
            "@size": "3456",
            "@ref": "fx7",
            "@mimetype": "image/gif"
          },
          {
            "@category": "thumbnail",
            "@height": "101",
            "@width": "134",
            "@_fa": "true",
            "$": "https://api.elsevier.com/content/object/eid/1-s2.0-S2468823117306673-fx8.sml?httpAccept=%2A%2F%2A",
            "@multimediatype": "GIF image file",
            "@type": "IMAGE-THUMBNAIL",
            "@size": "2512",
            "@ref": "fx8",
            "@mimetype": "image/gif"
          },
          {
            "@category": "thumbnail",
            "@height": "139",
            "@width": "208",
            "@_fa": "true",
            "$": "https://api.elsevier.com/content/object/eid/1-s2.0-S2468823117306673-fx9.sml?httpAccept=%2A%2F%2A",
            "@multimediatype": "GIF image file",
            "@type": "IMAGE-THUMBNAIL",
            "@size": "4154",
            "@ref": "fx9",
            "@mimetype": "image/gif"
          },
          {
            "@category": "thumbnail",
            "@height": "164",
            "@width": "194",
            "@_fa": "true",
            "$": "https://api.elsevier.com/content/object/eid/1-s2.0-S2468823117306673-gr1.sml?httpAccept=%2A%2F%2A",
            "@multimediatype": "GIF image file",
            "@type": "IMAGE-THUMBNAIL",
            "@size": "5043",
            "@ref": "gr1",
            "@mimetype": "image/gif"
          },
          {
            "@category": "thumbnail",
            "@height": "164",
            "@width": "206",
            "@_fa": "true",
            "$": "https://api.elsevier.com/content/object/eid/1-s2.0-S2468823117306673-gr2.sml?httpAccept=%2A%2F%2A",
            "@multimediatype": "GIF image file",
            "@type": "IMAGE-THUMBNAIL",
            "@size": "7969",
            "@ref": "gr2",
            "@mimetype": "image/gif"
          },
          {
            "@category": "thumbnail",
            "@height": "89",
            "@width": "219",
            "@_fa": "true",
            "$": "https://api.elsevier.com/content/object/eid/1-s2.0-S2468823117306673-gr3.sml?httpAccept=%2A%2F%2A",
            "@multimediatype": "GIF image file",
            "@type": "IMAGE-THUMBNAIL",
            "@size": "3196",
            "@ref": "gr3",
            "@mimetype": "image/gif"
          },
          {
            "@category": "thumbnail",
            "@height": "82",
            "@width": "219",
            "@_fa": "true",
            "$": "https://api.elsevier.com/content/object/eid/1-s2.0-S2468823117306673-gr4.sml?httpAccept=%2A%2F%2A",
            "@multimediatype": "GIF image file",
            "@type": "IMAGE-THUMBNAIL",
            "@size": "4117",
            "@ref": "gr4",
            "@mimetype": "image/gif"
          },
          {
            "@category": "thumbnail",
            "@height": "163",
            "@width": "197",
            "@_fa": "true",
            "$": "https://api.elsevier.com/content/object/eid/1-s2.0-S2468823117306673-gr5.sml?httpAccept=%2A%2F%2A",
            "@multimediatype": "GIF image file",
            "@type": "IMAGE-THUMBNAIL",
            "@size": "4639",
            "@ref": "gr5",
            "@mimetype": "image/gif"
          },
          {
            "@category": "thumbnail",
            "@height": "156",
            "@width": "219",
            "@_fa": "true",
            "$": "https://api.elsevier.com/content/object/eid/1-s2.0-S2468823117306673-gr6.sml?httpAccept=%2A%2F%2A",
            "@multimediatype": "GIF image file",
            "@type": "IMAGE-THUMBNAIL",
            "@size": "5935",
            "@ref": "gr6",
            "@mimetype": "image/gif"
          },
          {
            "@category": "thumbnail",
            "@height": "81",
            "@width": "219",
            "@_fa": "true",
            "$": "https://api.elsevier.com/content/object/eid/1-s2.0-S2468823117306673-gr7.sml?httpAccept=%2A%2F%2A",
            "@multimediatype": "GIF image file",
            "@type": "IMAGE-THUMBNAIL",
            "@size": "3884",
            "@ref": "gr7",
            "@mimetype": "image/gif"
          },
          {
            "@category": "thumbnail",
            "@height": "164",
            "@width": "198",
            "@_fa": "true",
            "$": "https://api.elsevier.com/content/object/eid/1-s2.0-S2468823117306673-sc1.sml?httpAccept=%2A%2F%2A",
            "@multimediatype": "GIF image file",
            "@type": "IMAGE-THUMBNAIL",
            "@size": "7099",
            "@ref": "sc1",
            "@mimetype": "image/gif"
          },
          {
            "@category": "thumbnail",
            "@height": "45",
            "@width": "219",
            "@_fa": "true",
            "$": "https://api.elsevier.com/content/object/eid/1-s2.0-S2468823117306673-sc2.sml?httpAccept=%2A%2F%2A",
            "@multimediatype": "GIF image file",
            "@type": "IMAGE-THUMBNAIL",
            "@size": "2291",
            "@ref": "sc2",
            "@mimetype": "image/gif"
          },
          {
            "@category": "standard",
            "@_fa": "true",
            "$": "https://api.elsevier.com/content/object/eid/1-s2.0-S2468823117306673-mmc1.docx?httpAccept=%2A%2F%2A",
            "@multimediatype": "Microsoft Word file",
            "@type": "APPLICATION",
            "@size": "1589017",
            "@ref": "mmc1",
            "@mimetype": "application/word"
          }
        ]
      },
      "link": {
        "@rel": "abstract",
        "@href": "https://api.elsevier.com/content/abstract/scopus_id/85041924840"
      }
    }
  }
}