{
  "metadata": {
    "title": "Influence of the anionic ligands on properties and reactivity of Hoveyda-Grubbs catalysts",
    "authors": "; ; ",
    "journal": "Molecular Catalysis",
    "date": "2021-06-30",
    "doi": "10.1016/j.mcat.2021.111612",
    "abstract": "",
    "uri": "https://api.elsevier.com/content/article/pii/S2468823121002297",
    "pii": "S2468823121002297"
  },
  "fulltext": {
    "full-text-retrieval-response": {
      "scopus-eid": "2-s2.0-85106947653",
      "originalText": "serial JL 315758 291210 291744 291790 291809 31 Molecular Catalysis MOLECULARCATALYSIS 2021-05-26 2021-05-26 2021-05-26 2021-05-26 2021-06-17T07:55:17 1-s2.0-S2468823121002297 S2468-8231(21)00229-7 S2468823121002297 10.1016/j.mcat.2021.111612 S300 S300.1 FULL-TEXT 1-s2.0-S2468823121X00090 2022-12-12T23:36:12.42485Z 0 0 20210601 20210630 2021 2021-05-26T04:18:52.952333Z absattachment articleinfo articlenumber articletitlenorm authfirstinitialnorm authfirstsurnamenorm cid cids contenttype copyright crossmark dateloaded dateloadedtxt datesearch datesort dateupdated dco docsubtype doctype doi eid ewtransactionid hubeid indexeddate issn issnnorm itemstage itemtransactionid itemweight openaccess openarchive pg pgfirst pii piinorm pubdateend pubdatestart pubdatetxt pubyr sectiontitle sortorder srctitle srctitlenorm srctype ssids alllist content subj subheadings suppl tomb volfirst volissue volumelist webpdf webpdfpagecount yearnav figure table e-component body mmlmath affil appendices articletitle auth authfirstini authfull authkeywords authlast highlightsabst orcid primabst ref specialabst 2468-8231 24688231 true 509 509 C Volume 509 14 111612 111612 111612 202106 June 2021 2021-06-01 2021-06-30 2021 Regular Papers article fla © 2021 Elsevier B.V. All rights reserved. INFLUENCEANIONICLIGANDSPROPERTIESREACTIVITYHOVEYDAGRUBBSCATALYSTS ALBALAWI M Introduction Computational methods Results and discussion Energy analysis Electronic analysis Structure-performance correlation Conclusions Funding source Author Statement Appendix Supplementary materials References DORWALD 2004 395 396 F ENDO 2013 32 K HOVEYDA 2010 34 44 A TRNKA 2001 18 29 T PAREDESGIL 2016 755 766 K SCHOLL 1999 30 M SCHWAB 1995 2039 2041 P DIAS 1997 3887 3897 E STRAUB 2005 5974 5978 B KINGSBURY 1999 791 799 J GARBER 2000 8168 8179 S TRZASKOWSKI 2017 313 320 B OGBA 2018 4510 4544 O VANVELDHUIZEN 2003 12502 12508 J WAKAMATSU 2002 2403 2405 H HERBERT 2015 2858 2869 M CONRAD 2006 105 110 J MONFETTE 2009 944 946 S AHMED 2017 1532 1537 T LIU 2019 7137 7146 Z KEITZ 2012 693 699 B SANFORD 2000 3451 3453 M LANE 2009 6789 6797 D SOLANSMONFORT 2010 7331 7343 X NUNEZZARUR 2012 57 67 F POATER 2014 4442 4448 A MIYAZAKI 2013 5848 5858 H VANDEREIDE 2010 571 576 E CREDENDINO 2012 8127 8135 R ROUEN 2014 13716 13721 M ASHWORTH 2013 1929 1939 I BIENIEK 2006 13652 13653 M MONFETTE 2009 361 367 S KOTYK 2009 5424 5431 M KOHN 1965 A1133 A1138 W HOHENBERG 1964 B864 B871 P CALAIS 1993 J LEE 1988 785 789 C COSSI 2003 669 681 M FALIVENE 2018 138 144 L DANG 2012 7222 7234 Y LIU 2012 1464 1467 P POUNDS 2007 43 A VEKTARIENE 2009 A KOOPMANS 1933 104 113 T PARR 1999 1922 1924 R JUPP 2018 7029 7035 A DEBRITOSA 2015 20 28 E ASHWORTH 2011 5428 5430 I NUNEZZARUR 2012 4203 4215 F ROMERO 2007 1698 1704 P SURESH 2004 76 80 C JEANLOUISHERISSON 1971 161 176 P REMYA 2018 29 38 P SANFORD 2001 6543 6554 M THIEL 2012 1104 1114 V REMYA 2017 63 71 P FERNANDES 2015 58 65 R GULAJSKI 2006 118 123 L NUNEZZARUR 2013 14553 14565 F NUNEZZARUR 2011 7506 7520 F PINHOEMELO 2005 925 958 T DIZAJI 2017 767 782 N HANSCH 1991 165 195 C ALBALAWIX2021X111612 ALBALAWIX2021X111612XM 2023-05-26T00:00:00.000Z 2023-05-26T00:00:00.000Z http://creativecommons.org/licenses/by-nc-nd/4.0/ © 2021 Elsevier B.V. All rights reserved. 2021-06-07T13:15:48.952Z http://vtw.elsevier.com/data/voc/AddOnTypes/50.7/aggregated-refined KAU's High Performance Computing Center KAUST KAUST King Abdullah University of Science and Technology http://data.elsevier.com/vocabulary/SciValFunders/501100004052 http://sws.geonames.org/102358/ Funding sources from the King Abdulaziz University and the King Abdullah University of Science and Technology, Thuwal, Saudi Arabia. Computation for the work presented in this paper was supported by KAU's High Performance Computing Center (Aziz Supercomputer) ( http://hpc.kau.edu.sa ) and by the KAUST Super-computing Laboratory (KSL) at KAUST. https://doi.org/10.15223/policy-017 https://doi.org/10.15223/policy-037 https://doi.org/10.15223/policy-012 https://doi.org/10.15223/policy-029 https://doi.org/10.15223/policy-004 item S2468-8231(21)00229-7 S2468823121002297 1-s2.0-S2468823121002297 10.1016/j.mcat.2021.111612 315758 2021-06-22T11:14:15.766045Z 2021-06-01 2021-06-30 1-s2.0-S2468823121002297-main.pdf https://s3-eu-west-1.amazonaws.com/prod-ucs-content-store-eu-west/content/pii:S2468823121002297/MAIN/application/pdf/03fd57b6de18b8bbf448612968c9020f/main.pdf main.pdf pdf true 2128872 MAIN 7 1-s2.0-S2468823121002297-main_1.png https://s3-eu-west-1.amazonaws.com/prod-ucs-content-store-eu-west/content/pii:S2468823121002297/PREVIEW/image/png/54ed4e601689d796fa9f87a336bf752c/main_1.png main_1.png png 57956 849 656 IMAGE-WEB-PDF 1 1-s2.0-S2468823121002297-gr4.jpg https://s3-eu-west-1.amazonaws.com/prod-ucs-content-store-eu-west/content/pii:S2468823121002297/gr4/DOWNSAMPLED/image/jpeg/6d85ed072e6dc4b5bbdf41f9ae92b3d1/gr4.jpg gr4 gr4.jpg jpg 47441 372 679 IMAGE-DOWNSAMPLED 1-s2.0-S2468823121002297-gr3.jpg https://s3-eu-west-1.amazonaws.com/prod-ucs-content-store-eu-west/content/pii:S2468823121002297/gr3/DOWNSAMPLED/image/jpeg/8733e00a45e2d07ef13e180905e8b447/gr3.jpg gr3 gr3.jpg jpg 23262 260 376 IMAGE-DOWNSAMPLED 1-s2.0-S2468823121002297-gr2.jpg https://s3-eu-west-1.amazonaws.com/prod-ucs-content-store-eu-west/content/pii:S2468823121002297/gr2/DOWNSAMPLED/image/jpeg/cf90751ade1a86b627d0c4afdc211587/gr2.jpg gr2 gr2.jpg jpg 26358 241 376 IMAGE-DOWNSAMPLED 1-s2.0-S2468823121002297-gr1.jpg https://s3-eu-west-1.amazonaws.com/prod-ucs-content-store-eu-west/content/pii:S2468823121002297/gr1/DOWNSAMPLED/image/jpeg/e06e5d556b0d6dc0c7de9dd53cb7a8ce/gr1.jpg gr1 gr1.jpg jpg 14769 164 583 IMAGE-DOWNSAMPLED 1-s2.0-S2468823121002297-gr6.jpg https://s3-eu-west-1.amazonaws.com/prod-ucs-content-store-eu-west/content/pii:S2468823121002297/gr6/DOWNSAMPLED/image/jpeg/2596f5a2bfdacdf73b75c9c8cb244a9f/gr6.jpg gr6 gr6.jpg jpg 16224 278 579 IMAGE-DOWNSAMPLED 1-s2.0-S2468823121002297-gr5.jpg https://s3-eu-west-1.amazonaws.com/prod-ucs-content-store-eu-west/content/pii:S2468823121002297/gr5/DOWNSAMPLED/image/jpeg/ee25b79a3377e764390f9d30f903d555/gr5.jpg gr5 gr5.jpg jpg 50420 528 727 IMAGE-DOWNSAMPLED 1-s2.0-S2468823121002297-sc1.jpg https://s3-eu-west-1.amazonaws.com/prod-ucs-content-store-eu-west/content/pii:S2468823121002297/sc1/DOWNSAMPLED/image/jpeg/07387e428e19a7089e62eb1e97379e80/sc1.jpg sc1 sc1.jpg jpg 16635 293 376 IMAGE-DOWNSAMPLED 1-s2.0-S2468823121002297-fx1.jpg https://s3-eu-west-1.amazonaws.com/prod-ucs-content-store-eu-west/content/pii:S2468823121002297/fx1/DOWNSAMPLED/image/jpeg/29e5d405fda156a2a38f3bb7ba47527c/fx1.jpg fx1 true fx1.jpg jpg 13737 143 301 IMAGE-DOWNSAMPLED 1-s2.0-S2468823121002297-gr4.sml https://s3-eu-west-1.amazonaws.com/prod-ucs-content-store-eu-west/content/pii:S2468823121002297/gr4/THUMBNAIL/image/gif/682f77330b293ff280113da0f7a639ea/gr4.sml gr4 gr4.sml sml 7057 120 219 IMAGE-THUMBNAIL 1-s2.0-S2468823121002297-gr3.sml https://s3-eu-west-1.amazonaws.com/prod-ucs-content-store-eu-west/content/pii:S2468823121002297/gr3/THUMBNAIL/image/gif/340b4b62d01468541e1b778d40502edf/gr3.sml gr3 gr3.sml sml 11368 151 219 IMAGE-THUMBNAIL 1-s2.0-S2468823121002297-gr2.sml https://s3-eu-west-1.amazonaws.com/prod-ucs-content-store-eu-west/content/pii:S2468823121002297/gr2/THUMBNAIL/image/gif/b7acaa86bf3a0c32dffcc21937587ac8/gr2.sml gr2 gr2.sml sml 12149 140 219 IMAGE-THUMBNAIL 1-s2.0-S2468823121002297-gr1.sml https://s3-eu-west-1.amazonaws.com/prod-ucs-content-store-eu-west/content/pii:S2468823121002297/gr1/THUMBNAIL/image/gif/96871537704a4db2c33540003d25a311/gr1.sml gr1 gr1.sml sml 2950 62 219 IMAGE-THUMBNAIL 1-s2.0-S2468823121002297-gr6.sml https://s3-eu-west-1.amazonaws.com/prod-ucs-content-store-eu-west/content/pii:S2468823121002297/gr6/THUMBNAIL/image/gif/cc360eb57115a6225c18b1d95c07c1be/gr6.sml gr6 gr6.sml sml 3080 105 219 IMAGE-THUMBNAIL 1-s2.0-S2468823121002297-gr5.sml https://s3-eu-west-1.amazonaws.com/prod-ucs-content-store-eu-west/content/pii:S2468823121002297/gr5/THUMBNAIL/image/gif/d704ecf8e3190cc4b9b89a3b5a0b35a5/gr5.sml gr5 gr5.sml sml 5714 159 219 IMAGE-THUMBNAIL 1-s2.0-S2468823121002297-sc1.sml https://s3-eu-west-1.amazonaws.com/prod-ucs-content-store-eu-west/content/pii:S2468823121002297/sc1/THUMBNAIL/image/gif/680a1ab902535ac6373462f66a1b5580/sc1.sml sc1 sc1.sml sml 4736 164 210 IMAGE-THUMBNAIL 1-s2.0-S2468823121002297-fx1.sml https://s3-eu-west-1.amazonaws.com/prod-ucs-content-store-eu-west/content/pii:S2468823121002297/fx1/THUMBNAIL/image/gif/99256a617427cf17eb4a51627f2182c1/fx1.sml fx1 true fx1.sml sml 6060 104 219 IMAGE-THUMBNAIL 1-s2.0-S2468823121002297-gr4_lrg.jpg https://s3-eu-west-1.amazonaws.com/prod-ucs-content-store-eu-west/content/pii:S2468823121002297/gr4/HIGHRES/image/jpeg/fdaf00420f189132765ffd073a5c442e/gr4_lrg.jpg gr4 gr4_lrg.jpg jpg 321048 1650 3008 IMAGE-HIGH-RES 1-s2.0-S2468823121002297-gr3_lrg.jpg https://s3-eu-west-1.amazonaws.com/prod-ucs-content-store-eu-west/content/pii:S2468823121002297/gr3/HIGHRES/image/jpeg/9806b16e33c63b60279671ef96e330de/gr3_lrg.jpg gr3 gr3_lrg.jpg jpg 170936 1151 1667 IMAGE-HIGH-RES 1-s2.0-S2468823121002297-gr2_lrg.jpg https://s3-eu-west-1.amazonaws.com/prod-ucs-content-store-eu-west/content/pii:S2468823121002297/gr2/HIGHRES/image/jpeg/91abb8550c0fca879f2f19403667e3a6/gr2_lrg.jpg gr2 gr2_lrg.jpg jpg 189369 1067 1667 IMAGE-HIGH-RES 1-s2.0-S2468823121002297-gr1_lrg.jpg https://s3-eu-west-1.amazonaws.com/prod-ucs-content-store-eu-west/content/pii:S2468823121002297/gr1/HIGHRES/image/jpeg/c24a4e1efcb6f956481098af10379049/gr1_lrg.jpg gr1 gr1_lrg.jpg jpg 115061 726 2581 IMAGE-HIGH-RES 1-s2.0-S2468823121002297-gr6_lrg.jpg https://s3-eu-west-1.amazonaws.com/prod-ucs-content-store-eu-west/content/pii:S2468823121002297/gr6/HIGHRES/image/jpeg/71bad67295ba1797bd18d1db4fe9e64b/gr6_lrg.jpg gr6 gr6_lrg.jpg jpg 138791 1229 2564 IMAGE-HIGH-RES 1-s2.0-S2468823121002297-gr5_lrg.jpg https://s3-eu-west-1.amazonaws.com/prod-ucs-content-store-eu-west/content/pii:S2468823121002297/gr5/HIGHRES/image/jpeg/c14e55f2db87436eb574ceee92cad13f/gr5_lrg.jpg gr5 gr5_lrg.jpg jpg 409687 2339 3221 IMAGE-HIGH-RES 1-s2.0-S2468823121002297-sc1_lrg.jpg https://s3-eu-west-1.amazonaws.com/prod-ucs-content-store-eu-west/content/pii:S2468823121002297/sc1/HIGHRES/image/jpeg/be0f7eb39b458ca6c0e1704a9c48674d/sc1_lrg.jpg sc1 sc1_lrg.jpg jpg 132324 1301 1667 IMAGE-HIGH-RES 1-s2.0-S2468823121002297-fx1_lrg.jpg https://s3-eu-west-1.amazonaws.com/prod-ucs-content-store-eu-west/content/pii:S2468823121002297/fx1/HIGHRES/image/jpeg/2371a40ec832e4f9482abab31800d904/fx1_lrg.jpg fx1 true fx1_lrg.jpg jpg 87926 635 1333 IMAGE-HIGH-RES 1-s2.0-S2468823121002297-mmc1.pdf https://s3-eu-west-1.amazonaws.com/prod-ucs-content-store-eu-west/content/pii:S2468823121002297/mmc1/MAIN/application/pdf/6d7f4234e67a0efbc0b15cc66a85eeb1/mmc1.pdf mmc1 mmc1.pdf pdf false 864919 APPLICATION 1-s2.0-S2468823121002297-si1.svg https://s3-eu-west-1.amazonaws.com/prod-ucs-content-store-eu-west/content/pii:S2468823121002297/STRIPIN/image/svg+xml/870cba91934f6546fa6277e00c3c7a70/si1.svg si1 si1.svg svg 1179 ALTIMG 1-s2.0-S2468823121002297-si2.svg https://s3-eu-west-1.amazonaws.com/prod-ucs-content-store-eu-west/content/pii:S2468823121002297/STRIPIN/image/svg+xml/63662ac4c8058347b3f18d21a25059a4/si2.svg si2 si2.svg svg 6005 ALTIMG 1-s2.0-S2468823121002297-si3.svg https://s3-eu-west-1.amazonaws.com/prod-ucs-content-store-eu-west/content/pii:S2468823121002297/STRIPIN/image/svg+xml/1d02102476d4e5be9ddbed590e13ca8f/si3.svg si3 si3.svg svg 1401 ALTIMG 1-s2.0-S2468823121002297-si4.svg https://s3-eu-west-1.amazonaws.com/prod-ucs-content-store-eu-west/content/pii:S2468823121002297/STRIPIN/image/svg+xml/6af44db0653dc1c344905e9c9209e2b9/si4.svg si4 si4.svg svg 8193 ALTIMG 1-s2.0-S2468823121002297-si5.svg https://s3-eu-west-1.amazonaws.com/prod-ucs-content-store-eu-west/content/pii:S2468823121002297/STRIPIN/image/svg+xml/67a67d8f5e272b0a95b72cba0a892e47/si5.svg si5 si5.svg svg 8430 ALTIMG 1-s2.0-S2468823121002297-si6.svg https://s3-eu-west-1.amazonaws.com/prod-ucs-content-store-eu-west/content/pii:S2468823121002297/STRIPIN/image/svg+xml/d0e0aade768cc2b5c1859d7be7b2cadf/si6.svg si6 si6.svg svg 4190 ALTIMG 1-s2.0-S2468823121002297-am.pdf am am.pdf pdf 807072 AAM-PDF https://s3-eu-west-1.amazonaws.com/prod-ucs-content-store-eu-west/content/egi:10V77GMQWVR/MAIN/application/pdf/a5b0fffa89b44b078c2926c4721d3e66/am.pdf MCAT 111612 111612 S2468-8231(21)00229-7 10.1016/j.mcat.2021.111612 Elsevier B.V. Fig. 1 Schematic structure of (A) first and (B) second generation Grubbs catalyst, (C) Hoveyda-Grubbs catalyst. Fig 1 Fig. 2 Pre-catalyst structures considered in this work. (COOH ligand binds to Ru by the carbon atom forming a Ru-COOH bond). Fig 2 Fig. 3 Metallacyclobutane structure. Fig 3 Fig. 4 Gibbs free energies in kcal/mol and CH2Cl2 for the initiation step of ethylene metathesis in presence of C1. Fig 4 Fig. 5 Linear correlation plots between TS3 energy (values from Table 3) and HOMO and LUMO energies, HOMO-LUMO energy gap, and electrophilicity (values from Table 4), for C1-C8. Fig 5 Fig. 6 Linear correlation plot between TS3 energy (kcal/mol, values in Table 3) and σp of X. σp values are taken from ref [66]. Fig 6 Scheme 1 Mechanism of olefin metathesis for Grubbs-Hoveyda catalysts. Scheme 1 Table 1 Selected bond lengths (Å), bond angles (deg.) and dihedral angles (deg.) for C1-C8. Table 1 C1 C2 C3 C4 C5 C6 C7 C8 Bond Lengths Ru-C1 2.002 2.007 2.016 1.999 1.983 1.984 2.007 2.004 Ru-C2 1.854 1.859 1.860 1.867 1.859 1.860 1.855 1.857 Ru-O5 2.291 2.290 2.299 2.266 2.292 2.317 2.301 2.304 Ru-X1 2.467 2.096 2.136 2.523 2.022 2.031 2.453 2.064 Ru-X2 2.450 2.132 2.124 2.035 1.998 1.992 2.449 2.061 C2-C3 1.445 1.451 1.446 1.451 1.453 1.454 1.451 1.448 Bond Angles N1-C1-Ru 131.95 132.77 132.93 130.21 130.54 130.99 131.02 133.23 N2-C1-Ru 121.04 120.51 120.31 123.09 122.33 122.38 122.54 119.55 C1-Ru-C2 98.02 97.69 97.81 96.10 96.34 96.84 97.89 98.94 Dihedrals Ru-C2-C3-C4 1.467 1.696 2.130 3.544 1.279 0.435 1.980 0.952 Table 2 Selected bond lengths (Å) for metallacyclobutane intermediates M1-8. Table 2 Bond Lengths M1 M2 M3 M4 M5 M6 M7 M8 Ru-C2 2.045 2.054 2.077 2.055 2.008 2.040 2.056 2.054 Ru-Ca 1.989 1.955 1.989 1.997 1.998 1.994 1.987 2.001 Ru-Cb 2.302 2.300 2.304 2.297 2.289 2.312 2.305 2.306 Ca-Cb 1.579 1.587 1.595 1.577 1.566 1.565 1.588 1.582 Table 3 Free energies in kcal/mol and in CH2Cl2 for C1-C8. The zero point energy is always the precatalyst and ethylene at infinite distance. Table 3 TS1 TS1D D TS2D A TS2 B TS3 C C1 28.3 14.3 4.8 19.5 19.5 24.8 20.7 28.7 25.3 C2 29.7 14.2 4.5 21.3 20.4 30.0 25.0 29.3 24.3 C3 32.1 19.9 7.7 23.4 22.7 31.0 26.0 30.4 23.8 C4 27.4 14.8 4.6 25.8 19.2 28.0 24.5 30.2 25.0 C5 24.5 12.2 6.8 24.3 21.5 35.1 31.3 40.5 23.8 C6 30.5 13.0 4.9 25.6 25.3 36.4 30.9 39.4 22.0 C7 29.1 13.1 5.3 23.2 23.6 31.8 26.4 32.2 26.0 C8 27.2 16.9 7.4 18.3 15.6 25.8 21.4 26.7 25.6 Table 4 Frontier orbital energies HOMO, LUMO and energy gap, ΔEL-H, in eV, and electrophilicity index, ω, for precatalysts C1-C8 and metallacyclobutane M1-M8. Table 4 C1-C8 M1-M8 EHOMO ELUMO ΔEL-H ω EHOMO ELUMO ΔEL-H ω 1 -5.40 -2.28 3.12 4.72 -5.33 -2.23 3.10 4.61 2 -5.40 -2.01 3.39 4.06 -5.15 -2.20 2.95 4.58 3 -6.09 -2.42 3.67 4.93 -6.05 -2.58 3.47 5.37 4 -5.53 -2.30 3.23 4.74 -5.61 -2.22 3.39 4.52 5 -4.76 -1.51 3.25 3.03 -4.67 -1.67 3.00 3.35 6 -4.93 -1.55 3.38 3.11 -4.68 -1.80 2.78 3.60 7 -4.82 -1.90 2.92 3.87 -4.63 -2.15 2.48 4.63 8 -5.93 -2.43 3.50 4.98 -5.85 -2.56 3.29 5.37 Influence of the anionic ligands on properties and reactivity of Hoveyda-Grubbs catalysts Mona O. Albalawi a b Laura Falivene c Abdesslem Jedidi a Osman I. Osman a d Shaaban A. Elroby a Luigi Cavallo c ⁎ a Chemistry Department, Faculty of Science, King Abdulaziz University, P.O. Box 80203, Jeddah, 21589, Saudi Arabia Chemistry Department Faculty of Science King Abdulaziz University P.O. Box 80203 Jeddah 21589 Saudi Arabia 1Chemistry Department, Faculty of Science, King Abdulaziz University, P.O. Box 80203, Jeddah, 21589, Saudi Arabia b Department of Chemistry, Faculty of Science, Tabuk University, Tabuk, 71491, Saudi Arabia Department of Chemistry Faculty of Science Tabuk University Tabuk 71491 Saudi Arabia 2Department of Chemistry, Faculty of Science, Tabuk University, Tabuk, 71491, Saudi Arabia c Physical Sciences and Engineering Division, KAUST Catalysis Center, King Abdullah University of Science and Technology, Thuwal 23955-6900, Saudi Arabia Physical Sciences and Engineering Division KAUST Catalysis Center King Abdullah University of Science and Technology Thuwal 23955-6900 Saudi Arabia 3Physical Sciences and Engineering Division, KAUST Catalysis Center, King Abdullah University of Science and Technology, Thuwal 23955-6900, Saudi Arabia d Chemistry Department, Faculty of Science, University of Khartoum, P.O. Box 321, Khartoum 11111, Sudan Chemistry Department Faculty of Science University of Khartoum P.O. Box 321 Khartoum 11111 Sudan 4Chemistry Department, Faculty of Science, University of Khartoum, P.O. Box 321, Khartoum 11111, Sudan ⁎ Corresponding author. Ruthenium based catalysts remain among the more successful complexes used in the catalysis of metathesis processes for the synthesis of new carbon-carbon bonds. The investigation of the influence of the different system moieties on its catalytic performance has led to important improvements in the field. To this extent, density functional theory (DFT) calculations have contributed significantly providing fundamental understandings to develop new catalysts. With this aim, we presented here a detailed computational study of how the nature of the anion ligand binding to the metal affects the global properties and reactivity of the catalyst. Geometric, energetic and electronic analysis have been performed to reach the key insights necessary to build structure-performance correlations. Graphical abstract Image, graphical abstract Keywords Olefins metathesis Reaction mechanism Hoveyda-Grubbs catalysts DFT calculations Introduction Olefin metathesis is a convenient and powerful method for the formation of new carbon-carbon double bonds. It is widely exploited in a variety of fields including natural product synthesis, biochemistry, green chemistry, and polymer chemistry [1-4]. Ruthenium-based complexes, the so-called Grubbs catalysts, are highly efficient catalysts promoting the olefins metathesis process [5]. Grubbs first generation systems contain bis-phosphane ligands, Fig. 1 A, and the prototype [RuCl2(=CHPh)(PR3)2] skeleton was further modified to obtain second generation Grubbs catalyst, [RuCl2(=CHPh)(NHC)(PR3)], Fig. 1B, by exchanging one PR3 ligand with an N-heterocyclic carbene moiety, NHC [6, 7]. Since the first use of these catalysts, many efforts have been dedicated to investigate the optimal electronic features of the ligands lying on the metal. Nowadays it is widely accepted that the more active catalysts display large and strong electron-donating phosphines or NHC moieties and small electron-withdrawing anionic ligands [8, 9]. Along these attempts, Hoveyda and co-workers reported a new class of Ru-catalysts that were derived from Grubbs type complexes, by replacing the benzylidene and PCy3 moieties by a bidentate benzylidene ether ligand. This confers to the system an excellent thermal stability and oxygen and moisture-tolerance [10, 11]. In the last years, a fair number of catalyst modifications have been carried out by varying steric and/or electronic properties of the ligands in Hoveyda-Grubbs systems [12-16]. Various attempts to improve the catalytic activity, selectivity and stability were based on the replacement of the anionic chloride ligand with different electron withdrawing moieties such as bromide, iodide [8], aryloxides [17], catecholate [18], dithiolate [19] and catechothiolate ligand [20]. In 2012, Benjamin K. Keitz et al. [21] reported the synthesis of new classes of Grubbs-Hoveyda catalysts with different kinds of anionic ligands such as pivalate, carboxylate and nitrate groups and they tested them as catalysts for Z-selective olefin metathesis. Their results allowed to point out the greater activity and stability of nitrate bearing catalysts respect to carboxylate ones. Melanie S. Sanford et al. [22] reported a modification of Grubbs catalyst first generation with tertiary alkoxides as anionic ligands and demonstrated that their relatively low activity was ascribed to both the large steric bulk of the alkoxides that shields the metal from the incoming substrate, and their strong π donation ability, which inhibits olefin binding by decreasing the electrophilicity of the Ru center. Alongside with experimental works, computational studies have also contributed significantly to the understanding of the olefin metathesis reaction catalyzed by Grubbs–Hoveyda-type catalysts [23-28]. Most of the theoretical studies mainly focused on the effect of modifying the donor ligands, i.e NHC [29, 30], PCy3 [31] and the ether functionality [32]. Only few computational studies have dealt with the replacement of the chlorine ligands with different groups in the catalyst structure [18, 33, 34]. For a further contribution, the objective of this study is to explore the impact of altering the anionic ligands on the property and reactivity of Grubbs-Hoveyda catalyst during the metathesis reaction process. With this aim in mind, we present here a density functional theory (DFT) study of the energy scenarios together with orbitals and chemical reactivity descriptors analysis to gain a deeper understanding of the elements affecting the catalyst varying the anionic ligands lying on the metal. Computational methods All the molecular geometries were optimized at the DFT level of theory [35, 36] using the B3LYP hybrid functional [37, 38] with the Gaussian 09 suite of programs [39]. For Ru, the basis set LanL2DZ was used, while for the other atoms, i.e. H, C, S, N, O, Cl and F, the 6-311G+(d,p) basis sets was selected. Vibrational analysis was performed for all stationary points to characterize them as transition states (TSs) or equilibrium structures. Single-point energy calculations were performed on these geometries using B3LYP/TZVP-LANL2DZ (Ru) with the PCM solvation model for di-chloromethane [40]. Thermal energies and entropy effects are calculated at 298 K and 1 atm, with no further entropic corrections [41]. The theoretical method used above is found to be satisfactory in previous studies on related ruthenium catalysts [27, 42, 43]. Molecular electrostatic potential intramolecular charge transfer (ICT) have been determined at DFT/B3LYP level using NBO (Natural Bond Orbital) calculations [44] as implemented in Gaussian 09 package [36]. Chemical reactivity indexes have been calculated using the standard working equations as follows. The chemical potential ( μ ) is determined as the derivative of the energy respect to the number of electrons [41], μ = ( ∂ E ∂ N ) ν while the chemical hardness ( η ) is determined as the second derivative of the energy with respect to the number of electrons [45, 46], η = ( ∂ 2 E ∂ N 2 ) ν = ( ∂ μ ∂ N ) ν In numerical forms, μ and η are calculated with the approximations of Koopmans’ theorem [47]: μ ≅ 1 2 ( ε L + ε H ) η ≅ 1 2 ( ε L − ε H ) where Η and L are used to indicate the highest occupied molecular orbital (HOMO) and the lowest unoccupied molecular orbital (LUMO), respectively [37, 45]. Finally, the electrophilicity (ω) is defined as the affinity of a molecule to interact with a nucleophile and determined as in the equation below [37, 48, 49], ω = μ 2 2 η Results and discussion Geometry analysis. The systems selected for this study are reported in Fig. 2 . All the complexes considered display the NHC with a saturate backbone, a phenyl ring on the nitrogen atoms, and the ether moiety bearing an ethyl substituent. The chosen anionic ligands cover a wide range on the electrodonicity scale, and they are quite small in order to avoid any shielding caused by using bulkier ligands. As representative structures, we considered the precatalyst geometry and the metallacyclobutanes deriving from metathesis of C1-C8 with ethylene. Table 1 reports selected computed values for bonds length, angles and dihedrals for the pre-catalyst optimized structures. The computed geometry for C1 is in agreement with the X-ray data published for a related system [11], and with the geometries obtained in previous theoretical studies [50, 51], making us confident of the chosen computational protocol. As suggested by Nuñez-Zarur et al. [25], the key structural parameters governing the reactivity of Fisher type of Ru-metathesis catalysts are the strength of the Ru-O interaction, the metal–carbene bond (Ru-C2), and the bond between the metal carbene and the phenyl ring of the Hoveyda ligand (C2-C3), with the guideline that larger C2-C3 bond length means lower π character of the C-C bond. In the current study, the C2-C3 bond does not seem to be meaningfully affected by the change in the anionic ligand; in fact, the length of this bond is mostly identical for all the studied catalysts (see Table 1). On the other side, the Ru-O bond distance scales between 2.27 and 2.30 Å, except for C6 (with OCH3 as anionic ligand), which shows a longer Ru-O distance of 2.32 Å. This suggests a lower overlap between the O lone pair and the empty orbital on Ru, which should facilitate the initiation step (i.e. dissociation of the ether ligand from Ru to coordinate the olefin) [24]. The Ru-C2-C3-C4 dihedral is almost planar for all systems ranging between 0.4o and 3.5o. Next we move to the metallacyclobutanes (see Fig. 3 ), the key intermediate along the catalytic cycle, whose opening towards products or back to reactants can determine the outcome of the reaction. This intermediate has a trigonal bipyramid structure (TBP), with the two anionic ligands being in the axial plane. As reported in the literature for Ru based catalysts, the ruthenacyclobutane is flat and presents a considerably long Ru•••C2 distance [52, 53]. For the studied systems, this distance varies in the range of 2.01-2.08 Å with M5 (with OH as anionic ligand) showing the shortest value and M3 (with CF3 as anionic ligand) the longest one (see Table 2 ). Regarding the distance between the metal and the middle carbon (Ru-Cb), it is ranged between 2.31 Å for M6 (with OCH3 as anionic ligand) and 2.29 Å for M5 (with OH as anionic ligand). As reported by Suresh and Koga in 2004 [54], the Ru-Cb distance may give an indication of the overlap between the Ca-Cb-C2 bonding orbital and the empty dy2 orbital on the metal, with a short Ru-Cb bond aligning with an elongated and more easily cleavable Ca-Cb bond. Accordingly, in this study, M6 displays the longer Ru-Cb distance and the shorter Ca-Cb bond, which may impede the cleavage of the Ca-Cb bond decreasing the rate of the following steps. Energy analysis To understand the effect of the anionic ligands on the reactivity of the system, we have performed mechanistic energy calculations. The catalytic cycle proposed by Chauvin in 1971 begins with the initiation step in which the active species is formed by the reaction between the olefin substrate and the metal alkylidene pre-catalyst [55]. In case of Grubbs-Hoveyda catalysts, the activation process includes a gradual decreasing of the Ru–O interaction to form a vacant Ru binding site for the incoming olefin substrate [26-28, 51] (see Scheme 1). Numerous studies have dealt with the investigation of the whole catalytic cycle including initiation and propagation mechanisms [56-61]. Here we focus on the first step of the reaction calculating the energy required during the initiation pathway while changing the anionic ligands in the catalyst structure. Discussion of the energy profile is based on free energies (ΔG) relative to the pre-catalyst and ethylene substrate considered at infinite distance (zero point energy). Many studies reported in the literature questioned on the features of the initiation mechanism more likely to happen in the experimental conditions. For example, Ashworth et al. hypothesized that the interchange mechanism would be more favorable than the associative and the dissociative pathways for the reaction of ethylene and ethyl vinyl ether in presence of Hoveyda-Grubbs catalyst [51]. Thiel et al. investigated the mechanism of the initiation reaction of electronically and sterically modified Grubbs−Hoveyda-type complexes for olefins substrates with different steric hindrance [58]. The study showed that the initiation step can follow two parallel pathways: a dissociative mechanism and an interchange mechanism. Importantly, it was concluded that the selection of one of the two possible modes of activation is highly dependent on the steric and electronic properties of the ruthenium complex, with the less sterically hindered olefins preferring the interchange mechanism. This study proved also that the acceleration of the interchange or the dissociative mechanism could be achieved by adding electron-withdrawing groups at the benzylidene ether moiety of the Grubbs−Hoveyda complexes [58]. A comprehensive theoretical investigation of the three possible mechanisms (associative, dissociative and interchange) for the activation of the Grubbs−Hoveyda precatalysts using DFT calculations have been reported by F. Nuñez-Zarur et al [25, 52, 62, 63]. The findings showed that the dissociative and the interchange mechanism could be considered as dominant pathways, with the associative mechanism being always disfavored with high-energy barriers. For this reason, we focused here only on the stepwise dissociative mechanism and on the concerted interchange mechanism for the initial breaking of the Ru-O bond and coordination of ethylene to the metal (formation of A) for the eight catalysts considered. The interchange mechanism requires the overcome of transition state TS1 consisting in the breaking of the Ru-O bond and the simultaneous approaching of the olefin to form A. Instead, the dissociative mechanism consists in the initial rotation around the C2-C3 bond, leading to the lengthening of the Ru–O bond (TS1D) and formation of the 14 electron species D, having a vacant site on Ru. Next, the olefin approaches to Ru through transition state TS2D leading to the formation of A. From A, the common pathway to both mechanisms consists in the formation of the metallacycle B (cycloaddition) and in its following re-opening (cycloreversion) leading to the formation of the new Ru-methylidene bond in C. The release of the oxygenated fragment generates the active species ready to enter in the general catalytic cycle. Since several studies have depicted these pathways for chloride containing Hoveyda-Grubbs analogues [52, 63], we use here the energy profile of C1 as a reference for the other catalytic systems, see Fig. 4 . Regarding the dissociative mechanism, the initial alkoxy dissociation requires an energy barrier of 14.3 kcal/mol, with intermediate D lying almost 5 kcal/mol above the starting reactants. After the vacant site has been created, the alkene coordination step takes place through transition state TS2D, which overall requires overcoming a barrier of approximately 20 kcal/mol and it is isoenergetic with the following A complex. For the interchange mechanism, the activation process requires overcoming an energy barrier of 28.3 kcal/mol, almost 9 kcal/mol higher than the rate determining transition state for the dissociative pathway (TS2D). From A the two mechanisms follow the same pathway, with the opening of the metallacycle B through transition state TS3 (at 28.7 kcal/mol) representing the higher energy barrier to form C. We have calculated the energies for all the systems considered here, see Table 3 . The numbers reported in Table 3 indicate that the dissociative path is always kinetically favored over the concerted interchange pathway, with C3 and C6 having the highest energies for TS1, possibly due to the greater steric hindrance of the CF3 and OCH3 groups which disfavor the more congested interchange pathway. Focusing on the dissociative mechanism, the results show two trends. First, TS1D requires less energy for C5, C6 and C7 (12.2, 13.0 and 13.1 kcal/mol), which exhibit more electron donating ligands (i.e. OH, SH and OCH3) that are able to increase the electronic density on the metal center, favoring the breaking of the Ru-O bond. Higher energy is required for complexes C3 and C8 (19.9 and 16.9 kcal/mol), due to the high electron withdrawing character of CF3 and CN ligands. On the other hand, the approach of ethylene to the Ru center in TS2D requires less energy in the case of C1, C2 and C8, in agreement with the presence of more withdrawing ligands (Cl, COOH, and CN) that deplete electrons from the metal favoring the coordination of the incoming ethylene. Moving to the second part of the activation pathway, starting from intermediate A, the energy barrier required to form the metallacycle intermediate B (TS2) varies in a range between 24 and 37 kcal/mol, while metallacyclobutane opening barrier (TS3) covers the 26-41 kcal/mol range, with TS3 being highest than TS2 for all the systems considered (except for C2 and C3, having TS3 almost isoenergetic with TS2). These results show how the presence of different withdrawing/donor groups influence the Ru electronic structure and, consequently, the strength of the Ru-O/Ru-C interactions and the corresponding energy scenario. However, as expected, also the steric hindrance of the ligand affects the pathways and, as consequence, the final energy trends will depend on a balance between both these ligand features. Electronic analysis Rationalizing the reactivity of systems is crucial for the development of the more appropriate reaction approach. To this extent, DFT methodologies provide useful insights since they have access to properties of the species at molecular level, an information that can complement experimentally derived knowledge [45]. In this section, we will focus on the orbital analysis based on HOMO and LUMO, and on the chemical reactivity index ω, explained in the methods section. In the pre-catalyst, the HOMO is localized on the Ru-X and Ru-NHC σ-bonds while the LUMO is mainly localized on the benzylidene moiety π* orbital [24]. Replacing the two chloride ligands of C1 by the other anionic ligands affects the frontier molecular orbitals, see Table 4 . Both the HOMO and the LUMO orbitals are stabilized in C3 (with CF3 as anionic ligand), C4 (with Cl and COOH as anionic ligands) and C8 (with CN as anionic ligand), as similarly reported in previous studies [64, 65] showing that the presence of a more electron withdrawing substituent on the metal leads to a general decrease in the frontier orbital energies of the starting complex. At the contrary, for C5 (with OH as anionic ligand), C6 (with OCH3 as anionic ligand) and C7 (with SH as anionic ligand) both HOMO and LUMO energies are increased respect to C1. These variations in the HOMO and LUMO energies results in a HOMO-LUMO gap, ΔEL-H, ranging from 2.92 eV in C7 to 3.67 eV in C3. In the case of the metallacyclobutane intermediate, the HOMO is basically localized on the dxy or dyz orbital of the Ru atom, and the LUMO on the π∗ orbital of ethylene. The energy trend for these orbitals follows the one already explained for the starting complex, with systems bearing electron withdrawing ligands, such as C3, C4 and C8, having clearly more stable frontier orbitals, see Table 4. Also at the metallacycle level the smaller and larger HOMO-LUMO gaps correspond to the complexes with SH and CF3, which are M7 and M3, with ΔEH-L of 2.48 and 3.47 eV, respectively. Finally, the electrophilicity index calculated on the pre-catalysts and metallacycles in the gas phase, also reported in Table 4, indicate that the presence of more electron withdrawing ligands on the metal can be exploited to enhance the global electrophilicity of the system, reflecting a higher propensity to react with the incoming olefin, with CF3 and CN ligands having the greatest effect. Structure-performance correlation The typical approach of the so called “rational” catalyst design, is to use molecular descriptors, able to capture the experimental behaviours of the catalysts, to develop structure-performance relationships that can be used for guiding catalysts engineering. With this approach in the mind, we explored if electronic features of precatalysts C1-C8 could capture the expected behaviour in catalysis. As measure of the expected catalytic performance we used the energy of the rate determining transition state TS3 relative to reactants. As molecular descriptors we will focus on the electronic properties discussed in the sections above. All the plots for C1-C8 are reported in Fig. 5 , those of M1-M8 are reported in the Supporting Information. Nevertheless the general trend discussed in the previous section, HOMO energies do not seem capable to capture the expected catalyst behaviors, with a correlation coefficient R2 of only 0.56. Even worse is the correlation between TS3 energy and the HOMO-LUMO energy gap, with a R2 of 0.02. Conversely, LUMO energy correlates very well with the TS3 energy, with a R2 value of 0.84. It seems evident that the presence of more electron withdrawing groups like those in C8, C1, C2, C3 and C4 stabilizes the LUMO orbitals decreasing meaningfully the energy required for TS3 and, thus, increasing the reactivity of the catalyst. This aspect seems to be very relevant, since moving from C8, with the most stable LUMO, to C5, corresponding to the less stable LUMO, TS3 energy varies by more than 10 kcal/mol. Similar results are achieved performing the analysis on metallacycles M1-M8. Considering the identity of the LUMOs, i.e. π* orbital of the benzylidene moiety and π∗ orbital of ethylene for the precatalysts and metallacycles, respectively, having them more energetically accessible means to facilitate the formation of the π-bond CHR=CH2 and Ru=CH2 in TS3. Similar reasoning can be applied to the electrophilicity index, which also correlates with the TS3 energy with a R2 value of 0.84. As discussed above, electrophilicity increases in presence of more electron withdrawing ligands, which causes a decrease in the energy of TS3. As some of the electronic features considered above can catch properties of the systems quantitatively, we decided to check if a simple empirical parameter, capable to capture the electronic influence of a group, could correlate similarly well with the TS3 energies. As the most obvious choice, we focused on the Hammet constant σp, as it is a descriptor largely used to treat the electronic effect of substituents on rates and equilibria in various kinds of chemical reactions [66]. The linear correlation reported in Fig. 6 , with a R2 value of 0.89, is even slightly better than the correlations achieved using the LUMO energy or the electrophilicity index, see Fig. 5, and it can be considered a sort of validation of the DFT calculations performed in this work. Of course, the possibility of using a tabled descriptor, such as the Hammet parameter, should allow engineering catalysts without having to perform electronic structure calculations. Conclusions Many efforts have been dedicated to study the metathesis of olefin substrates catalyzed by ruthenium complexes both with experimental and computational techniques. After the general mechanism leading to the formation of the new carbon-carbon bonds has been established in the early 70s, many studies have focused on refining the catalyst features in order to improve the reaction yield, selectivity etc. The role of the different ligands lying on the metal has been analyzed during the years to depict the ideal ruthenium environmental able to maximize the performance of the system. It is now widely accepted that the more active catalysts display large and electron-donating sigma donor ligands, as phosphines or NHC moieties, and small electron-withdrawing anionic ligands, as chlorine. Among the others, the modification of the metal coordination sphere by adding bidentate benzylidene ether ligands in the Grubbs-Hoveyda catalysts conferred to the systems an excellent thermal stability and oxygen and moisture-tolerance. In this study we focused on this kind of catalysts changing the anionic ligand lying (X) on Ru and studying the effect on the geometric and electronic properties of the whole system. Eight different systems have been considered with X properties covering a wide range of electrodonicity. Orbital analysis and reactivity index calculations allowed us to rationalize the change in the electronic state of the catalyst and detailed energy calculations of the initiation pathways indicated how the reactivity of the system undergo the change caused by X. Altogether, we built in the end of the work structure-performance correlations between the energy of the rate determining state along the studied pathways, i.e. the opening of the metallacyle intermediate, and the Hammet constant of the anionic ligand as measure of its electronic properties. The insights reached here could be usefully exploited to predict the behavior of catalysts bearing different anions and to rationally design better performing systems. Funding source Funding sources from the King Abdulaziz University and the King Abdullah University of Science and Technology, Thuwal, Saudi Arabia. Computation for the work presented in this paper was supported by KAU's High Performance Computing Center (Aziz Supercomputer) (http://hpc.kau.edu.sa) and by the KAUST Super-computing Laboratory (KSL) at KAUST. Author Statement Mona O. Albalawi. Executed the work, analysed the results, drafted the manuscript. Laura Falivene. Designed the project, supervised the work, analysed the results, drafted the manuscript. Abdesslem Jedidi. Designed the project, supervised the work, analysed the results, drafted the manuscript. Osman I. Osman,. Designed the project, analysed the results, drafted the manuscript. Shaaban A. Elroby. Designed the project, analysed the results, drafted the manuscript. Luigi Cavallo. Designed the project, analysed the results, drafted the manuscript. Supplementary data. Computational details, tables with numerical values of selected data, Cartesian coordinates of all the species considered in this work. Declaration of Competing Interest The authors declare that they have no known competing financial interests or personal relationships that could have appeared to influence the work reported in this paper. Supplementary materials Supplementary material associated with this article can be found, in the online version, at doi:10.1016/j.mcat.2021.111612. Appendix Supplementary materials Image, application 1 References [1] F.Z. Dörwald Angew. Chem. Int. Ed. Engl. 43 2004 395 396 F. Z. Dörwald, Angew. Chem. Int. Ed. Engl.,2004, 43, 395-396. [2] K. Endo M.B. Herbert R.H. Grubbs Organometallics 2013 32 K. Endo, M. B. Herbert, R. H. Grubbs, Organometallics.2013, 32, [3] A.H. Hoveyda S.J. Malcolmson S.J. Meek A.R. Zhugralin Angew. Chem. Int. Ed. Engl. 49 2010 34 44 A. H. Hoveyda, S. J. Malcolmson, S. J. Meek, A. R. Zhugralin, Angew. Chem. Int. Ed. Engl.,2010, 49, 34-44. [4] T.M. Trnka R.H. Grubbs Acc. Chem. Res. 34 2001 18 29 T. M. Trnka, R. H. Grubbs, Acc. Chem. Res.,2001, 34, 18-29. [5] K. Paredes-Gil P. Jaque Catal. Sci. Technol. 6 2016 755 766 K. Paredes-Gil, P. Jaque, Catal. Sci. Technol.,2016, 6, 755-766. [6] M. Scholl S. Ding C.W. Lee R.H. Grubbs ChemInform 1999 30 M. Scholl, S. Ding, C. W. Lee, R. H. Grubbs, ChemInform.1999, 30, [7] P. Schwab M.B. France J.W. Ziller R.H. Grubbs Angew. Chem. Int. Ed. Engl. 34 1995 2039 2041 P. Schwab, M. B. France, J. W. Ziller, R. H. Grubbs, Angew. Chem. Int. Ed. Engl.,1995, 34, 2039-2041. [8] E.L. Dias S.T. Nguyen R.H. Grubbs J. Am. Chem. Soc. 119 1997 3887 3897 E. L. Dias, S. T. Nguyen, R. H. Grubbs, J. Am. Chem. Soc.,1997, 119, 3887-3897. [9] B.F. Straub Angew. Chem. Int. Ed. Engl. 44 2005 5974 5978 B. F. Straub, Angew. Chem. Int. Ed. Engl.,2005, 44, 5974-5978. [10] J.S. Kingsbury J.P.A. Harrity P.J. Bonitatebus A.H. Hoveyda J. Am. Chem. Soc. 121 1999 791 799 J. S. Kingsbury, J. P. A. Harrity, P. J. Bonitatebus, A. H. Hoveyda, J. Am. Chem. Soc.,1999, 121, 791-799. [11] S.B. Garber J.S. Kingsbury B.L. Gray A.H. Hoveyda J. Am. Chem. Soc. 122 2000 8168 8179 S. B. Garber, J. S. Kingsbury, B. L. Gray, A. H. Hoveyda, J. Am. Chem. Soc.,2000, 122, 8168-8179. [12] B. Trzaskowski W.A. Goddard K. Grela Mol. Catal. 433 2017 313 320 B. Trzaskowski, W. A. Goddard, K. Grela, Mol. Catal.,2017, 433, 313-320. [13] O.M. Ogba N.C. Warner D.J. O'Leary R.H. Grubbs Chem. Soc. Rev. 47 2018 4510 4544 O. M. Ogba, N. C. Warner, D. J. O'Leary, R. H. Grubbs, Chem. Soc. Rev.,2018, 47, 4510-4544. [14] J.J. Van Veldhuizen D.G. Gillingham S.B. Garber O. Kataoka A.H. Hoveyda J. Am. Chem. Soc. 125 2003 12502 12508 J. J. Van Veldhuizen, D. G. Gillingham, S. B. Garber, O. Kataoka, A. H. Hoveyda, J. Am. Chem. Soc.,2003, 125, 12502-12508. [15] H. Wakamatsu S. Blechert Angew. Chem. Int. Ed. Engl. 41 2002 2403 2405 H. Wakamatsu, S. Blechert, Angew. Chem. Int. Ed. Engl.,2002, 41, 2403-2405. [16] M.B. Herbert B.A. Suslick P. Liu L. Zou P.K. Dornan K.N. Houk R.H. Grubbs Organometallics 34 2015 2858 2869 M. B. Herbert, B. A. Suslick, P. Liu, L. Zou, P. K. Dornan, K. N. Houk, R. H. Grubbs, Organometallics.2015, 34, 2858-2869. [17] J.C. Conrad J.L. Snelgrove M.D. Eeelman S. Hall D.E. Fogg J MOL CATAL A-CHEM 254 2006 105 110 J. C. Conrad, J. L. Snelgrove, M. D. Eeelman, S. Hall, D. E. Fogg, J MOL CATAL A-CHEM.2006, 254, 105-110. [18] S. Monfette K.D. Camm S.I. Gorelsky D.E. Fogg Organometallics 28 2009 944 946 S. Monfette, K. D. Camm, S. I. Gorelsky, D. E. Fogg, Organometallics.2009, 28, 944-946. [19] T.S. Ahmed R.H. Grubbs J. Am. Chem. Soc. 139 2017 1532 1537 T. S. Ahmed, R. H. Grubbs, J. Am. Chem. Soc.,2017, 139, 1532-1537. [20] Z. Liu C. Xu J. Del Pozo S. Torker A.H. Hoveyda J. Am. Chem. Soc. 141 2019 7137 7146 Z. Liu, C. Xu, J. Del Pozo, S. Torker, A. H. Hoveyda, J. Am. Chem. Soc.,2019, 141, 7137-7146. [21] B.K. Keitz K. Endo P.R. Patel M.B. Herbert R.H. Grubbs J. Am. Chem. Soc. 134 2012 693 699 B. K. Keitz, K. Endo, P. R. Patel, M. B. Herbert, R. H. Grubbs, J. Am. Chem. Soc.,2012, 134, 693-699. [22] M.S. Sanford L.M. Henling M.W. Day R.H. Grubbs Angew. Chem. Int. Ed. Engl. 39 2000 3451 3453 M. S. Sanford, L. M. Henling, M. W. Day, R. H. Grubbs, Angew. Chem. Int. Ed. Engl.,2000, 39, 3451-3453. [23] D.R. Lane C.M. Beavers M.M. Olmstead N.E. Schore Organometallics 28 2009 6789 6797 D. R. Lane, C. M. Beavers, M. M. Olmstead, N. E. Schore, Organometallics.2009, 28, 6789-6797. [24] X. Solans-Monfort R. Pleixats M. Sodupe Chem. Eur. J. 16 2010 7331 7343 X. Solans-Monfort, R. Pleixats, M. Sodupe, Chem. Eur. J.,2010, 16, 7331-7343. [25] F. Nuñez-Zarur J. Poater L. Rodríguez-Santiago X. Solans-Monfort M. Solà M. Sodupe Comput. Theor. Chem. 996 2012 57 67 F. Nuñez-Zarur, J. Poater, L. Rodríguez-Santiago, X. Solans-Monfort, M. Solà, M. Sodupe, Comput. Theor. Chem.,2012, 996, 57-67. [26] A. Poater E. Pump S.V.C. Vummaleti L. Cavallo J. Chem. Theory Comput. 10 2014 4442 4448 A. Poater, E. Pump, S. V. C. Vummaleti, L. Cavallo, J. Chem. Theory Comput.,2014, 10, 4442-4448. [27] H. Miyazaki M.B. Herbert P. Liu X. Dong X. Xu B.K. Keitz T. Ung G. Mkrtumyan K.N. Houk R.H. Grubbs J. Am. Chem. Soc. 135 2013 5848 5858 H. Miyazaki, M. B. Herbert, P. Liu, X. Dong, X. Xu, B. K. Keitz, T. Ung, G. Mkrtumyan, K. N. Houk, R. H. Grubbs, J. Am. Chem. Soc.,2013, 135, 5848-5858. [28] E.F. van der Eide W.E. Piers Nat. Chem. 2 2010 571 576 E. F. van der Eide, W. E. Piers, Nat. Chem.,2010, 2, 571-576. [29] R. Credendino L. Falivene L. Cavallo J. Am. Chem. Soc. 134 2012 8127 8135 R. Credendino, L. Falivene, L. Cavallo, J. Am. Chem. Soc.,2012, 134, 8127-8135. [30] M. Rouen P. Queval L. Falivene J. Allard L. Toupet C. Crevisy F. Caijo O. Basle L. Cavallo M. Mauduit Chemistry 20 2014 13716 13721 M. Rouen, P. Queval, L. Falivene, J. Allard, L. Toupet, C. Crevisy, F. Caijo, O. Basle, L. Cavallo, M. Mauduit, Chemistry.2014, 20, 13716-13721. [31] I.W. Ashworth I.H. Hillier D.J. Nelson J.M. Percy M.A. Vincent ACS Catal 3 2013 1929 1939 I. W. Ashworth, I. H. Hillier, D. J. Nelson, J. M. Percy, M. A. Vincent, ACS Catal.,2013, 3, 1929-1939. [32] M. Bieniek R. Bujok M. Cabaj N. Lugan G. Lavigne D. Arlt K. Grela J. Am. Chem. Soc. 128 2006 13652 13653 M. Bieniek, R. Bujok, M. Cabaj, N. Lugan, G. Lavigne, D. Arlt, K. Grela, J. Am. Chem. Soc.,2006, 128, 13652-13653. [33] S. Monfette J.A.D. Silva S.I. Gorelsky S.J. Dalgarno E.N. d. Santos M.H. Araujo D.E. Fogg Can. J. Chem. 87 2009 361 367 S. Monfette, J. A. D. Silva, S. I. Gorelsky, S. J. Dalgarno, E. N. d. Santos, M. H. Araujo, D. E. Fogg, Can. J. Chem.,2009, 87, 361-367. [34] M.W. Kotyk S.I. Gorelsky J.C. Conrad C. Carra D.E. Fogg Organometallics 28 2009 5424 5431 M. W. Kotyk, S. I. Gorelsky, J. C. Conrad, C. Carra, D. E. Fogg, Organometallics.2009, 28, 5424-5431. [35] W. Kohn L.J. Sham Phys. Rev. 140 1965 A1133 A1138 W. Kohn, L. J. Sham, Phys. Rev.1965, 140, A1133-A1138. [36] P. Hohenberg W. Kohn Phys. Rev. 136 1964 B864 B871 P. Hohenberg, W. Kohn, Phys. Rev.1964, 136, B864-B871. [37] J.-L. Calais Int. J. Quant. Chem. 47 1993 101–101 J.-L. Calais, Int. J. Quant. Chem.,1993, 47, 101-101. [38] C. Lee W. Yang R.G. Parr Phys. Rev. B Condens. Matter. 37 1988 785 789 C. Lee, W. Yang, R. G. Parr, Phys. Rev. B Condens. Matter.1988, 37, 785-789. [39] M. J. T. Frisch, G. W.; Schlegel, H. B.; Scuseria, G. E.; Robb, M. A.; Cheeseman, J. R.; Scalmani, G.; Barone, V.; Mennucci, B.; Petersson, G. A.; Nakatsuji, H.; Caricato, M.; Li, X.; Hratchian, H. P.; Izmaylov, A. F.; Bloino, J.; Zheng, G.; Sonnenberg, J. L.; Hada, M.; Ehara, M.; Toyota, K.; Fukuda, R.; Hasegawa, J.; Ishida, M.; Nakajima, T.; Honda, Y.; Kitao, O.; Nakai, H.; Vreven, T.; Montgomery, Jr., J. A.; Peralta, J. E.; Ogliaro, F.; Bearpark, M.; Heyd, J. J.; Brothers, E.; Kudin, K. N.; Staroverov, V. N.; Kobayashi, R.; Normand, J.; Raghavachari, K.; Rendell, A.; Burant, J. C.; Iyengar, S. S.; Tomasi, J.; Cossi, M.; Rega, N.; Millam, N. J.; Klene, M.; Knox, J. E.; Cross, J. B.; Bakken, V.; Adamo, C.; Jaramillo, J.; Gomperts, R.; Stratmann, R. E.; Yazyev, O.; Austin, A. J.; Cammi, R.; Pomelli, C.; Ochterski, J. W.; Martin, R. L.; Morokuma, K.; Zakrzewski, V. G.; Voth, G. A.; Salvador, P.; Dannenberg, J. J.; Dapprich, S.; Daniels, A. D.; Farkas, Ö.; Foresman, J. B.; Ortiz, J. V.; Cioslowski, J.; Fox, D. J. Gaussian, in Inc., Wallingford CT. (2010). [40] M. Cossi N. Rega G. Scalmani V. Barone J. Comput. Chem. 24 2003 669 681 M. Cossi, N. Rega, G. Scalmani, V. Barone, J. Comput. Chem.,2003, 24, 669-681. [41] L. Falivene V. Barone G. Talarico Mol. Catal. 452 2018 138 144 L. Falivene, V. Barone, G. Talarico, Mol. Catal.,2018, 452, 138-144. [42] Z.-X. Y.W. Dang X Wang Organometallics 31 2012 7222 7234 Y. W. Dang, Z.-X.; Wang, X., Organometallics.2012, 31, 7222-7234. [43] P. Liu X. Xu X. Dong B.K. Keitz M.B. Herbert R.H. Grubbs K.N. Houk J. Am. Chem. Soc. 134 2012 1464 1467 P. Liu, X. Xu, X. Dong, B. K. Keitz, M. B. Herbert, R. H. Grubbs, K. N. Houk, J. Am. Chem. Soc.,2012, 134, 1464-1467. [44] A.J. Pounds J. Chem. Educ. 84 2007 43 A. J. Pounds, J. Chem. Educ.,2007, 84, 43. [45] P. K. Chattaraj. (CRC press, 2009). [46] A. Vektariene G. Vektaris J. Svoboda Arkivoc. 2009 A. Vektariene, G. Vektaris, J. Svoboda, Arkivoc.2009, [47] T. Koopmans Physica 1 1933 104 113 T. Koopmans, Physica.1933, 1, 104-113. [48] R.G. Parr L.v. Szentpály S. Liu J. Am. Chem. Soc. 121 1999 1922 1924 R. G. Parr, L. v. Szentpály, S. Liu, J. Am. Chem. Soc.,1999, 121, 1922-1924. [49] A.R. Jupp T.C. Johnstone D.W. Stephan Dalton Trans 47 2018 7029 7035 A. R. Jupp, T. C. Johnstone, D. W. Stephan, Dalton Trans.,2018, 47, 7029-7035. [50] É. de Brito Sá J.M.E. de Matos Inorganica Chim. Acta. 426 2015 20 28 É. de Brito Sá, J. M. E. de Matos, Inorganica Chim. Acta.2015, 426, 20-28. [51] I.W. Ashworth I.H. Hillier D.J. Nelson J.M. Percy M.A. Vincent ChemCommun 47 2011 5428 5430 I. W. Ashworth, I. H. Hillier, D. J. Nelson, J. M. Percy, M. A. Vincent, ChemCommun.2011, 47, 5428-5430. [52] F. Nuñez-Zarur X. Solans-Monfort L. Rodrı́guez-Santiago M. Sodupe Organometallics 31 2012 4203 4215 F. Nuñez-Zarur, X. Solans-Monfort, L. Rodrı́guez-Santiago, M. Sodupe, Organometallics.2012, 31, 4203-4215. [53] P.E. Romero W.E. Piers J. Am. Chem. Soc. 129 2007 1698 1704 P. E. Romero, W. E. Piers, J. Am. Chem. Soc.,2007, 129, 1698-1704. [54] C.H. Suresh N. Koga Organometallics 23 2004 76 80 C. H. Suresh, N. Koga, Organometallics.2004, 23, 76-80. [55] P. Jean-Louis Hérisson Y. Chauvin Die Makromolekulare Chemie 141 1971 161 176 P. Jean-Louis Hérisson, Y. Chauvin, Die Makromolekulare Chemie.1971, 141, 161-176. [56] P.R. Remya C.H. Suresh Mol. Catal. 450 2018 29 38 P. R. Remya, C. H. Suresh, Mol. Catal.,2018, 450, 29-38. [57] M.S. Sanford J.A. Love R.H. Grubbs J. Am. Chem. Soc. 123 2001 6543 6554 M. S. Sanford, J. A. Love, R. H. Grubbs, J. Am. Chem. Soc.,2001, 123, 6543-6554. [58] V. Thiel M. Hendann K.-J. Wannowius H. Plenio J. Am. Chem. Soc. 134 2012 1104 1114 V. Thiel, M. Hendann, K.-J. Wannowius, H. Plenio, J. Am. Chem. Soc.,2012, 134, 1104-1114. [59] P.R. Remya C.H. Suresh Mol. Catal. 441 2017 63 71 P. R. Remya, C. H. Suresh, Mol. Catal.,2017, 441, 63-71. [60] R.J. Fernandes T.B. Silva B.S. Lima-Neto R.L.A. Haiduke J. Mol. Catal. A 410 2015 58 65 R. J. Fernandes, T. B. Silva, B. S. Lima-Neto, R. L.A. Haiduke, J. Mol. Catal. A, 2015, 410, 58–65. [61] Ł. Gułajski A. Michrowska R. Bujok K. Grela J. Mol. Catal. A 254 2006 118 123 Ł. Gułajski, A. Michrowska, R. Bujok, K. Grela, J. Mol. Catal. A, 2006, 254, 118–123 [62] F. Núñez-Zarur X. Solans-Monfort R. Pleixats L. Rodríguez-Santiago M. Sodupe Chem. Eur. J. 19 2013 14553 14565 F. Núñez-Zarur, X. Solans-Monfort, R. Pleixats, L. Rodríguez-Santiago, M. Sodupe, Chem. Eur. J.,2013, 19, 14553-14565. [63] F. Nuñez-Zarur X. Solans-Monfort L. Rodríguez-Santiago R. Pleixats M. Sodupe Chem. Eur. J. 17 2011 7506 7520 F. Nuñez-Zarur, X. Solans-Monfort, L. Rodríguez-Santiago, R. Pleixats, M. Sodupe, Chem. Eur. J.,2011, 17, 7506-7520. [64] T.M. Pinho e Melo Curr. Org. Chem. 9 2005 925 958 T. M. Pinho e Melo, Curr. Org. Chem.,2005, 9, 925-958. [65] N.J. Dizaji A. Nouri E. Zahedi S.M. Musavi A. Nouri Res. Chem. Intermed. 43 2017 767 782 N. J. Dizaji, A. Nouri, E. Zahedi, S. M. Musavi, A. Nouri, Res. Chem. Intermed.,2017, 43, 767-782. [66] C. Hansch A. Leo R.W. Taft Chem. Rev. 91 1991 165 195 C. Hansch, A. Leo, R. W. Taft, Chem. Rev.,1991, 91, 165-195.",
      "scopus-id": "85106947653",
      "coredata": {
        "eid": "1-s2.0-S2468823121002297",
        "dc:description": "Ruthenium based catalysts remain among the more successful complexes used in the catalysis of metathesis processes for the synthesis of new carbon-carbon bonds. The investigation of the influence of the different system moieties on its catalytic performance has led to important improvements in the field. To this extent, density functional theory (DFT) calculations have contributed significantly providing fundamental understandings to develop new catalysts. With this aim, we presented here a detailed computational study of how the nature of the anion ligand binding to the metal affects the global properties and reactivity of the catalyst. Geometric, energetic and electronic analysis have been performed to reach the key insights necessary to build structure-performance correlations.",
        "openArchiveArticle": "false",
        "prism:coverDate": "2021-06-30",
        "openaccessUserLicense": null,
        "prism:aggregationType": "Journal",
        "prism:url": "https://api.elsevier.com/content/article/pii/S2468823121002297",
        "dc:creator": [
          {
            "@_fa": "true",
            "$": "Albalawi, Mona O."
          },
          {
            "@_fa": "true",
            "$": "Falivene, Laura"
          },
          {
            "@_fa": "true",
            "$": "Jedidi, Abdesslem"
          },
          {
            "@_fa": "true",
            "$": "Osman, Osman I."
          },
          {
            "@_fa": "true",
            "$": "Elroby, Shaaban A."
          },
          {
            "@_fa": "true",
            "$": "Cavallo, Luigi"
          }
        ],
        "link": [
          {
            "@_fa": "true",
            "@rel": "self",
            "@href": "https://api.elsevier.com/content/article/pii/S2468823121002297"
          },
          {
            "@_fa": "true",
            "@rel": "scidir",
            "@href": "https://www.sciencedirect.com/science/article/pii/S2468823121002297"
          }
        ],
        "dc:format": "application/json",
        "openaccessType": null,
        "pii": "S2468-8231(21)00229-7",
        "prism:volume": "509",
        "articleNumber": "111612",
        "prism:publisher": "Elsevier B.V.",
        "dc:title": "Influence of the anionic ligands on properties and reactivity of Hoveyda-Grubbs catalysts",
        "prism:copyright": "© 2021 Elsevier B.V. All rights reserved.",
        "openaccess": "0",
        "prism:issn": "24688231",
        "dcterms:subject": [
          {
            "@_fa": "true",
            "$": "Olefins metathesis"
          },
          {
            "@_fa": "true",
            "$": "Reaction mechanism"
          },
          {
            "@_fa": "true",
            "$": "Hoveyda-Grubbs catalysts"
          },
          {
            "@_fa": "true",
            "$": "DFT calculations"
          }
        ],
        "openaccessArticle": "false",
        "prism:publicationName": "Molecular Catalysis",
        "openaccessSponsorType": null,
        "prism:pageRange": "111612",
        "pubType": "fla",
        "prism:coverDisplayDate": "June 2021",
        "prism:doi": "10.1016/j.mcat.2021.111612",
        "prism:startingPage": "111612",
        "dc:identifier": "doi:10.1016/j.mcat.2021.111612",
        "openaccessSponsorName": null
      },
      "objects": {
        "object": [
          {
            "@category": "standard",
            "@height": "372",
            "@width": "679",
            "@_fa": "true",
            "$": "https://api.elsevier.com/content/object/eid/1-s2.0-S2468823121002297-gr4.jpg?httpAccept=%2A%2F%2A",
            "@multimediatype": "JPEG image file",
            "@type": "IMAGE-DOWNSAMPLED",
            "@size": "47441",
            "@ref": "gr4",
            "@mimetype": "image/jpeg"
          },
          {
            "@category": "standard",
            "@height": "260",
            "@width": "376",
            "@_fa": "true",
            "$": "https://api.elsevier.com/content/object/eid/1-s2.0-S2468823121002297-gr3.jpg?httpAccept=%2A%2F%2A",
            "@multimediatype": "JPEG image file",
            "@type": "IMAGE-DOWNSAMPLED",
            "@size": "23262",
            "@ref": "gr3",
            "@mimetype": "image/jpeg"
          },
          {
            "@category": "standard",
            "@height": "241",
            "@width": "376",
            "@_fa": "true",
            "$": "https://api.elsevier.com/content/object/eid/1-s2.0-S2468823121002297-gr2.jpg?httpAccept=%2A%2F%2A",
            "@multimediatype": "JPEG image file",
            "@type": "IMAGE-DOWNSAMPLED",
            "@size": "26358",
            "@ref": "gr2",
            "@mimetype": "image/jpeg"
          },
          {
            "@category": "standard",
            "@height": "164",
            "@width": "583",
            "@_fa": "true",
            "$": "https://api.elsevier.com/content/object/eid/1-s2.0-S2468823121002297-gr1.jpg?httpAccept=%2A%2F%2A",
            "@multimediatype": "JPEG image file",
            "@type": "IMAGE-DOWNSAMPLED",
            "@size": "14769",
            "@ref": "gr1",
            "@mimetype": "image/jpeg"
          },
          {
            "@category": "standard",
            "@height": "278",
            "@width": "579",
            "@_fa": "true",
            "$": "https://api.elsevier.com/content/object/eid/1-s2.0-S2468823121002297-gr6.jpg?httpAccept=%2A%2F%2A",
            "@multimediatype": "JPEG image file",
            "@type": "IMAGE-DOWNSAMPLED",
            "@size": "16224",
            "@ref": "gr6",
            "@mimetype": "image/jpeg"
          },
          {
            "@category": "standard",
            "@height": "528",
            "@width": "727",
            "@_fa": "true",
            "$": "https://api.elsevier.com/content/object/eid/1-s2.0-S2468823121002297-gr5.jpg?httpAccept=%2A%2F%2A",
            "@multimediatype": "JPEG image file",
            "@type": "IMAGE-DOWNSAMPLED",
            "@size": "50420",
            "@ref": "gr5",
            "@mimetype": "image/jpeg"
          },
          {
            "@category": "standard",
            "@height": "293",
            "@width": "376",
            "@_fa": "true",
            "$": "https://api.elsevier.com/content/object/eid/1-s2.0-S2468823121002297-sc1.jpg?httpAccept=%2A%2F%2A",
            "@multimediatype": "JPEG image file",
            "@type": "IMAGE-DOWNSAMPLED",
            "@size": "16635",
            "@ref": "sc1",
            "@mimetype": "image/jpeg"
          },
          {
            "@category": "standard",
            "@height": "143",
            "@width": "301",
            "@_fa": "true",
            "$": "https://api.elsevier.com/content/object/eid/1-s2.0-S2468823121002297-fx1.jpg?httpAccept=%2A%2F%2A",
            "@multimediatype": "JPEG image file",
            "@type": "IMAGE-DOWNSAMPLED",
            "@size": "13737",
            "@ref": "fx1",
            "@mimetype": "image/jpeg"
          },
          {
            "@category": "thumbnail",
            "@height": "120",
            "@width": "219",
            "@_fa": "true",
            "$": "https://api.elsevier.com/content/object/eid/1-s2.0-S2468823121002297-gr4.sml?httpAccept=%2A%2F%2A",
            "@multimediatype": "GIF image file",
            "@type": "IMAGE-THUMBNAIL",
            "@size": "7057",
            "@ref": "gr4",
            "@mimetype": "image/gif"
          },
          {
            "@category": "thumbnail",
            "@height": "151",
            "@width": "219",
            "@_fa": "true",
            "$": "https://api.elsevier.com/content/object/eid/1-s2.0-S2468823121002297-gr3.sml?httpAccept=%2A%2F%2A",
            "@multimediatype": "GIF image file",
            "@type": "IMAGE-THUMBNAIL",
            "@size": "11368",
            "@ref": "gr3",
            "@mimetype": "image/gif"
          },
          {
            "@category": "thumbnail",
            "@height": "140",
            "@width": "219",
            "@_fa": "true",
            "$": "https://api.elsevier.com/content/object/eid/1-s2.0-S2468823121002297-gr2.sml?httpAccept=%2A%2F%2A",
            "@multimediatype": "GIF image file",
            "@type": "IMAGE-THUMBNAIL",
            "@size": "12149",
            "@ref": "gr2",
            "@mimetype": "image/gif"
          },
          {
            "@category": "thumbnail",
            "@height": "62",
            "@width": "219",
            "@_fa": "true",
            "$": "https://api.elsevier.com/content/object/eid/1-s2.0-S2468823121002297-gr1.sml?httpAccept=%2A%2F%2A",
            "@multimediatype": "GIF image file",
            "@type": "IMAGE-THUMBNAIL",
            "@size": "2950",
            "@ref": "gr1",
            "@mimetype": "image/gif"
          },
          {
            "@category": "thumbnail",
            "@height": "105",
            "@width": "219",
            "@_fa": "true",
            "$": "https://api.elsevier.com/content/object/eid/1-s2.0-S2468823121002297-gr6.sml?httpAccept=%2A%2F%2A",
            "@multimediatype": "GIF image file",
            "@type": "IMAGE-THUMBNAIL",
            "@size": "3080",
            "@ref": "gr6",
            "@mimetype": "image/gif"
          },
          {
            "@category": "thumbnail",
            "@height": "159",
            "@width": "219",
            "@_fa": "true",
            "$": "https://api.elsevier.com/content/object/eid/1-s2.0-S2468823121002297-gr5.sml?httpAccept=%2A%2F%2A",
            "@multimediatype": "GIF image file",
            "@type": "IMAGE-THUMBNAIL",
            "@size": "5714",
            "@ref": "gr5",
            "@mimetype": "image/gif"
          },
          {
            "@category": "thumbnail",
            "@height": "164",
            "@width": "210",
            "@_fa": "true",
            "$": "https://api.elsevier.com/content/object/eid/1-s2.0-S2468823121002297-sc1.sml?httpAccept=%2A%2F%2A",
            "@multimediatype": "GIF image file",
            "@type": "IMAGE-THUMBNAIL",
            "@size": "4736",
            "@ref": "sc1",
            "@mimetype": "image/gif"
          },
          {
            "@category": "thumbnail",
            "@height": "104",
            "@width": "219",
            "@_fa": "true",
            "$": "https://api.elsevier.com/content/object/eid/1-s2.0-S2468823121002297-fx1.sml?httpAccept=%2A%2F%2A",
            "@multimediatype": "GIF image file",
            "@type": "IMAGE-THUMBNAIL",
            "@size": "6060",
            "@ref": "fx1",
            "@mimetype": "image/gif"
          },
          {
            "@category": "high",
            "@height": "1650",
            "@width": "3008",
            "@_fa": "true",
            "$": "https://api.elsevier.com/content/object/eid/1-s2.0-S2468823121002297-gr4_lrg.jpg?httpAccept=%2A%2F%2A",
            "@multimediatype": "JPEG image file",
            "@type": "IMAGE-HIGH-RES",
            "@size": "321048",
            "@ref": "gr4",
            "@mimetype": "image/jpeg"
          },
          {
            "@category": "high",
            "@height": "1151",
            "@width": "1667",
            "@_fa": "true",
            "$": "https://api.elsevier.com/content/object/eid/1-s2.0-S2468823121002297-gr3_lrg.jpg?httpAccept=%2A%2F%2A",
            "@multimediatype": "JPEG image file",
            "@type": "IMAGE-HIGH-RES",
            "@size": "170936",
            "@ref": "gr3",
            "@mimetype": "image/jpeg"
          },
          {
            "@category": "high",
            "@height": "1067",
            "@width": "1667",
            "@_fa": "true",
            "$": "https://api.elsevier.com/content/object/eid/1-s2.0-S2468823121002297-gr2_lrg.jpg?httpAccept=%2A%2F%2A",
            "@multimediatype": "JPEG image file",
            "@type": "IMAGE-HIGH-RES",
            "@size": "189369",
            "@ref": "gr2",
            "@mimetype": "image/jpeg"
          },
          {
            "@category": "high",
            "@height": "726",
            "@width": "2581",
            "@_fa": "true",
            "$": "https://api.elsevier.com/content/object/eid/1-s2.0-S2468823121002297-gr1_lrg.jpg?httpAccept=%2A%2F%2A",
            "@multimediatype": "JPEG image file",
            "@type": "IMAGE-HIGH-RES",
            "@size": "115061",
            "@ref": "gr1",
            "@mimetype": "image/jpeg"
          },
          {
            "@category": "high",
            "@height": "1229",
            "@width": "2564",
            "@_fa": "true",
            "$": "https://api.elsevier.com/content/object/eid/1-s2.0-S2468823121002297-gr6_lrg.jpg?httpAccept=%2A%2F%2A",
            "@multimediatype": "JPEG image file",
            "@type": "IMAGE-HIGH-RES",
            "@size": "138791",
            "@ref": "gr6",
            "@mimetype": "image/jpeg"
          },
          {
            "@category": "high",
            "@height": "2339",
            "@width": "3221",
            "@_fa": "true",
            "$": "https://api.elsevier.com/content/object/eid/1-s2.0-S2468823121002297-gr5_lrg.jpg?httpAccept=%2A%2F%2A",
            "@multimediatype": "JPEG image file",
            "@type": "IMAGE-HIGH-RES",
            "@size": "409687",
            "@ref": "gr5",
            "@mimetype": "image/jpeg"
          },
          {
            "@category": "high",
            "@height": "1301",
            "@width": "1667",
            "@_fa": "true",
            "$": "https://api.elsevier.com/content/object/eid/1-s2.0-S2468823121002297-sc1_lrg.jpg?httpAccept=%2A%2F%2A",
            "@multimediatype": "JPEG image file",
            "@type": "IMAGE-HIGH-RES",
            "@size": "132324",
            "@ref": "sc1",
            "@mimetype": "image/jpeg"
          },
          {
            "@category": "high",
            "@height": "635",
            "@width": "1333",
            "@_fa": "true",
            "$": "https://api.elsevier.com/content/object/eid/1-s2.0-S2468823121002297-fx1_lrg.jpg?httpAccept=%2A%2F%2A",
            "@multimediatype": "JPEG image file",
            "@type": "IMAGE-HIGH-RES",
            "@size": "87926",
            "@ref": "fx1",
            "@mimetype": "image/jpeg"
          },
          {
            "@category": "standard",
            "@_fa": "true",
            "$": "https://api.elsevier.com/content/object/eid/1-s2.0-S2468823121002297-mmc1.pdf?httpAccept=%2A%2F%2A",
            "@multimediatype": "Acrobat PDF file",
            "@type": "APPLICATION",
            "@size": "864919",
            "@ref": "mmc1",
            "@mimetype": "application/pdf"
          },
          {
            "@category": "thumbnail",
            "@_fa": "true",
            "$": "https://api.elsevier.com/content/object/eid/1-s2.0-S2468823121002297-si1.svg?httpAccept=%2A%2F%2A",
            "@multimediatype": "Scalable Vector Graphics file",
            "@type": "ALTIMG",
            "@size": "1179",
            "@ref": "si1",
            "@mimetype": "image/svg+xml"
          },
          {
            "@category": "thumbnail",
            "@_fa": "true",
            "$": "https://api.elsevier.com/content/object/eid/1-s2.0-S2468823121002297-si2.svg?httpAccept=%2A%2F%2A",
            "@multimediatype": "Scalable Vector Graphics file",
            "@type": "ALTIMG",
            "@size": "6005",
            "@ref": "si2",
            "@mimetype": "image/svg+xml"
          },
          {
            "@category": "thumbnail",
            "@_fa": "true",
            "$": "https://api.elsevier.com/content/object/eid/1-s2.0-S2468823121002297-si3.svg?httpAccept=%2A%2F%2A",
            "@multimediatype": "Scalable Vector Graphics file",
            "@type": "ALTIMG",
            "@size": "1401",
            "@ref": "si3",
            "@mimetype": "image/svg+xml"
          },
          {
            "@category": "thumbnail",
            "@_fa": "true",
            "$": "https://api.elsevier.com/content/object/eid/1-s2.0-S2468823121002297-si4.svg?httpAccept=%2A%2F%2A",
            "@multimediatype": "Scalable Vector Graphics file",
            "@type": "ALTIMG",
            "@size": "8193",
            "@ref": "si4",
            "@mimetype": "image/svg+xml"
          },
          {
            "@category": "thumbnail",
            "@_fa": "true",
            "$": "https://api.elsevier.com/content/object/eid/1-s2.0-S2468823121002297-si5.svg?httpAccept=%2A%2F%2A",
            "@multimediatype": "Scalable Vector Graphics file",
            "@type": "ALTIMG",
            "@size": "8430",
            "@ref": "si5",
            "@mimetype": "image/svg+xml"
          },
          {
            "@category": "thumbnail",
            "@_fa": "true",
            "$": "https://api.elsevier.com/content/object/eid/1-s2.0-S2468823121002297-si6.svg?httpAccept=%2A%2F%2A",
            "@multimediatype": "Scalable Vector Graphics file",
            "@type": "ALTIMG",
            "@size": "4190",
            "@ref": "si6",
            "@mimetype": "image/svg+xml"
          },
          {
            "@category": "standard",
            "@_fa": "true",
            "$": "https://api.elsevier.com/content/object/eid/1-s2.0-S2468823121002297-am.pdf?httpAccept=%2A%2F%2A",
            "@multimediatype": "Acrobat PDF file",
            "@type": "AAM-PDF",
            "@size": "807072",
            "@ref": "am",
            "@mimetype": "application/pdf"
          }
        ]
      },
      "link": {
        "@rel": "abstract",
        "@href": "https://api.elsevier.com/content/abstract/scopus_id/85106947653"
      }
    }
  }
}