{
  "metadata": {
    "title": "Regulating the physical properties of silica immobilized Fe(II), Ni(II) and Co(II) catalysts towards ethylene oligomerization reactions",
    "authors": "; ; ",
    "journal": "Molecular Catalysis",
    "date": "2023-10-31",
    "doi": "10.1016/j.mcat.2023.113465",
    "abstract": "",
    "uri": "https://api.elsevier.com/content/article/pii/S2468823123005485",
    "pii": "S2468823123005485"
  },
  "fulltext": {
    "full-text-retrieval-response": {
      "scopus-eid": "2-s2.0-85167978054",
      "originalText": "serial JL 315758 291210 291744 291790 291809 31 90 Molecular Catalysis MOLECULARCATALYSIS 2023-08-16 2023-08-16 2023-08-16 2023-08-16 2023-09-17T11:59:24 1-s2.0-S2468823123005485 S2468-8231(23)00548-5 S2468823123005485 10.1016/j.mcat.2023.113465 S300 S300.1 FULL-TEXT 1-s2.0-S2468823123X00157 2024-06-26T17:47:58.017886Z 0 0 20231001 20231031 2023 2023-08-16T23:33:00.502493Z absattachment articleinfo articlenumber articletitlenorm authfirstinitialnorm authfirstsurnamenorm cid cids contenttype copyright crossmark dateloaded dateloadedtxt datesearch datesort dateupdated dco docsubtype doctype doi eid ewtransactionid fundingbodyid hubeid indexeddate issn issnnorm itemstage itemtransactionid itemweight oauserlicense openaccess openarchive pg pgfirst pii piinorm pubdateend pubdatestart pubdatetxt pubyr sectiontitle sortorder sponsoredaccesstype srctitle srctitlenorm srctype ssids alllist content oa subj subheadings suppl tomb volfirst volissue volumelist webpdf webpdfpagecount yearnav figure table e-component body acknowledge affil appendices articletitle auth authfirstini authfull authkeywords authlast grantsponsor grantsponsorid highlightsabst orcid primabst ref specialabst 2468-8231 24688231 UNLIMITED SANHYB2023 true 549 549 C Volume 549 5 113465 113465 113465 202310 October 2023 2023-10-01 2023-10-31 2023 Regular Papers article fla © 2023 The Author(s). Published by Elsevier B.V. REGULATINGPHYSICALPROPERTIESSILICAIMMOBILIZEDFEIINIIICOIICATALYSTSTOWARDSETHYLENEOLIGOMERIZATIONREACTIONS NGCOBO M Introduction Experimental section General materials and instrumentation Synthesis of silica-immobilized ligands and their Ni(II), Fe(II) and Co(II) complexes Synthesis of LH-SBA15 Synthesis of LH-MCM41 Syntheses of [Ni(LH-SBA15)2Cl2] (Ni-SBA15) [Co(LH-SBA15)2Cl2], (Co-SBA15) [Fe(LH-SBA15)2Cl2], (Fe-SBA15) [Ni(LH-MCM41)2Cl2], (Ni-MCM41) Ethylene oligomerization catalysis Typical procedure for ethylene oligomerization reactions Catalyst recycling experiments Results and discussion Syntheses and surface analyses of the immobilized metal complexes Ethylene oligomerization reactions catalysed by immobilized catalysts Preliminary and optimization studies of the ethylene oligomerization reactions Influence of nature of support and metal atom in the ethylene oligomerization reactions Catalyst recycling and post characterization studies Comparison of current immobilized catalysts with reported systems Conclusions Credit author statement Acknowledgements Appendix Supplementary materials References ZHANG 2014 246 256 H BRYLIAKOV 2018 55 61 K AJELLAL 2006 1213 1216 N BOUDIER 2012 31 37 A YANG 2006 5518 5527 Q REZAEI 2016 985 990 S WULFERS 2015 394 401 M FINIELS 2014 2412 2426 A HLATKY 2000 1347 1376 G WIGHT 2002 3589 3614 A ZHAO 2006 32 39 X DESPHANDE 1999 261 263 S SHIN 2020 117376 M KIM 2017 4351 4354 M LECOCQ 2007 761 773 V WECK 2007 1865 1875 M CAGNOLA 2004 205 212 E ISLAM 2012 97 107 S KUMAR 2016 137 144 K ROSSETTO 2015 221 229 E HUANG 2019 103 108 C TUSKAEV 2019 29 38 V NGCOBO 2017 1 5 M NYAMATO 2015 5647 5657 G NYAMATO 2014 274 282 G OJWACH 2009 2127 2133 S NGCOBO 2021 111583 M JAYAMANI 2019 120987 A BRADLEY 2010 D ROME 2012 K NGCOBO 2019 110590 M MEHRABADI 2017 1 35 B WEI 2013 175 181 S LIN 2000 8967 8975 H VANWESTERN 2018 4952 4962 T ROSSETTO 2015 45 54 E SHOZI 2016 5752 5760 L BARBOSA 2022 6233 6243 T DESOUZA 2010 597 600 M LALLEMAND 2011 1078 1082 M MLINAR 2014 337 343 A SHIN 2020 117363 D JARAMILLO 2020 1669 1676 L GUO 2009 1467 1471 C CHAN 2014 153 165 D HUO 2018 616 P BRITOVSEK 2000 2221 2231 G SCHMIDT 2003 476 482 R HUANG 2019 1143 1150 Y KAUL 2002 74 82 F NGCOBOX2023X113465 NGCOBOX2023X113465XM Full 2023-08-11T18:39:46Z FundingBody SANLIC (South African Consortium) – Hybrid http://creativecommons.org/licenses/by-nc-nd/4.0/ 2025-08-16T00:00:00.000Z 2025-08-16T00:00:00.000Z http://creativecommons.org/licenses/by-nc-nd/4.0/ This is an open access article under the CC BY-NC-ND license. © 2023 The Author(s). Published by Elsevier B.V. 2023-08-31T20:05:34.534Z http://vtw.elsevier.com/data/voc/AddOnTypes/50.7/aggregated-refined National Research Fund SFB TRR-88 FNR Fonds National de la Recherche Luxembourg http://data.elsevier.com/vocabulary/SciValFunders/501100001866 http://sws.geonames.org/2960313/ The authors are thankful to the University of KwaZulu-Natal for research facilities and the financial support from the National Research Fund (South Africa) is acknowledged. The authors would also like to thank SFB TRR-88 for the financial support to SO during his sabbatical at RPTU. Benjamin Heider (RPTU) is acknowledged for performing the thermogravimetric measurements. item S2468-8231(23)00548-5 S2468823123005485 1-s2.0-S2468823123005485 10.1016/j.mcat.2023.113465 315758 2023-09-17T11:16:31.806545Z 2023-10-01 2023-10-31 UNLIMITED SANHYB2023 1-s2.0-S2468823123005485-main.pdf https://s3-eu-west-1.amazonaws.com/prod-ucs-content-store-eu-west/content/pii:S2468823123005485/MAIN/application/pdf/b47d1e4cbfe153fbdd76427ee905ac30/main.pdf main.pdf pdf true 6794522 MAIN 10 1-s2.0-S2468823123005485-main_1.png https://s3-eu-west-1.amazonaws.com/prod-ucs-content-store-eu-west/content/pii:S2468823123005485/PREVIEW/image/png/23b38e75dd15283aa33d5d9b38b07727/main_1.png main_1.png png 60177 849 656 IMAGE-WEB-PDF 1 1-s2.0-S2468823123005485-gr1.jpg https://s3-eu-west-1.amazonaws.com/prod-ucs-content-store-eu-west/content/pii:S2468823123005485/gr1/DOWNSAMPLED/image/jpeg/299f0d9c72841731dae6bb4e302e0fc1/gr1.jpg gr1 gr1.jpg jpg 105655 493 809 IMAGE-DOWNSAMPLED 1-s2.0-S2468823123005485-gr2.jpg https://s3-eu-west-1.amazonaws.com/prod-ucs-content-store-eu-west/content/pii:S2468823123005485/gr2/DOWNSAMPLED/image/jpeg/703b3f61f350484a3b0f5b8c9b90f2dc/gr2.jpg gr2 gr2.jpg jpg 180569 602 809 IMAGE-DOWNSAMPLED 1-s2.0-S2468823123005485-fx1.jpg https://s3-eu-west-1.amazonaws.com/prod-ucs-content-store-eu-west/content/pii:S2468823123005485/fx1/DOWNSAMPLED/image/jpeg/921eac85d3414716560f1abab23f9343/fx1.jpg fx1 fx1.jpg jpg 4024 99 143 IMAGE-DOWNSAMPLED 1-s2.0-S2468823123005485-sc2.jpg https://s3-eu-west-1.amazonaws.com/prod-ucs-content-store-eu-west/content/pii:S2468823123005485/sc2/DOWNSAMPLED/image/jpeg/c163de5ba26e482b808cd7d041c454c9/sc2.jpg sc2 sc2.jpg jpg 23778 220 584 IMAGE-DOWNSAMPLED 1-s2.0-S2468823123005485-fx6.jpg https://s3-eu-west-1.amazonaws.com/prod-ucs-content-store-eu-west/content/pii:S2468823123005485/fx6/DOWNSAMPLED/image/jpeg/3621657e15b349d7ab0c3db10e811412/fx6.jpg fx6 fx6.jpg jpg 4467 93 186 IMAGE-DOWNSAMPLED 1-s2.0-S2468823123005485-ga1.jpg https://s3-eu-west-1.amazonaws.com/prod-ucs-content-store-eu-west/content/pii:S2468823123005485/ga1/DOWNSAMPLED/image/jpeg/7841438754eef237f399c6f66d1a75dc/ga1.jpg ga1 true ga1.jpg jpg 27495 196 500 IMAGE-DOWNSAMPLED 1-s2.0-S2468823123005485-gr3.jpg https://s3-eu-west-1.amazonaws.com/prod-ucs-content-store-eu-west/content/pii:S2468823123005485/gr3/DOWNSAMPLED/image/jpeg/90104bcefc9b5057ab829c394deff9bf/gr3.jpg gr3 gr3.jpg jpg 29549 271 395 IMAGE-DOWNSAMPLED 1-s2.0-S2468823123005485-gr4.jpg https://s3-eu-west-1.amazonaws.com/prod-ucs-content-store-eu-west/content/pii:S2468823123005485/gr4/DOWNSAMPLED/image/jpeg/af9b96111eaddf404cae3e91879c6be6/gr4.jpg gr4 gr4.jpg jpg 24790 246 396 IMAGE-DOWNSAMPLED 1-s2.0-S2468823123005485-gr5.jpg https://s3-eu-west-1.amazonaws.com/prod-ucs-content-store-eu-west/content/pii:S2468823123005485/gr5/DOWNSAMPLED/image/jpeg/5abf7a18910a5d9733616af8d03c5ef0/gr5.jpg gr5 gr5.jpg jpg 22626 160 339 IMAGE-DOWNSAMPLED 1-s2.0-S2468823123005485-fx2.jpg https://s3-eu-west-1.amazonaws.com/prod-ucs-content-store-eu-west/content/pii:S2468823123005485/fx2/DOWNSAMPLED/image/jpeg/ba407f112f717105d502303c1a72d539/fx2.jpg fx2 fx2.jpg jpg 4532 110 160 IMAGE-DOWNSAMPLED 1-s2.0-S2468823123005485-sc1.jpg https://s3-eu-west-1.amazonaws.com/prod-ucs-content-store-eu-west/content/pii:S2468823123005485/sc1/DOWNSAMPLED/image/jpeg/40df799d08267f5a741d2a8f791bfce0/sc1.jpg sc1 sc1.jpg jpg 34078 211 728 IMAGE-DOWNSAMPLED 1-s2.0-S2468823123005485-fx3.jpg https://s3-eu-west-1.amazonaws.com/prod-ucs-content-store-eu-west/content/pii:S2468823123005485/fx3/DOWNSAMPLED/image/jpeg/c4062976bef82e10182176054887a28d/fx3.jpg fx3 fx3.jpg jpg 6894 112 202 IMAGE-DOWNSAMPLED 1-s2.0-S2468823123005485-fx4.jpg https://s3-eu-west-1.amazonaws.com/prod-ucs-content-store-eu-west/content/pii:S2468823123005485/fx4/DOWNSAMPLED/image/jpeg/dc4068840fd75a4ddcde1629a7bc69b0/fx4.jpg fx4 fx4.jpg jpg 6403 86 165 IMAGE-DOWNSAMPLED 1-s2.0-S2468823123005485-fx5.jpg https://s3-eu-west-1.amazonaws.com/prod-ucs-content-store-eu-west/content/pii:S2468823123005485/fx5/DOWNSAMPLED/image/jpeg/3336b24a5e97ab41126b8ba3f3024522/fx5.jpg fx5 fx5.jpg jpg 4455 67 202 IMAGE-DOWNSAMPLED 1-s2.0-S2468823123005485-fx7.jpg https://s3-eu-west-1.amazonaws.com/prod-ucs-content-store-eu-west/content/pii:S2468823123005485/fx7/DOWNSAMPLED/image/jpeg/eee54ba2dd8ab828c6e9a3baf2141b83/fx7.jpg fx7 fx7.jpg jpg 4742 99 197 IMAGE-DOWNSAMPLED 1-s2.0-S2468823123005485-gr1.sml https://s3-eu-west-1.amazonaws.com/prod-ucs-content-store-eu-west/content/pii:S2468823123005485/gr1/THUMBNAIL/image/gif/ba54006f4997975a5d7f6ef2cf7fb4e1/gr1.sml gr1 gr1.sml sml 19144 133 219 IMAGE-THUMBNAIL 1-s2.0-S2468823123005485-gr2.sml https://s3-eu-west-1.amazonaws.com/prod-ucs-content-store-eu-west/content/pii:S2468823123005485/gr2/THUMBNAIL/image/gif/48a4d5874ca29145e0c8155e257f09f3/gr2.sml gr2 gr2.sml sml 26973 163 219 IMAGE-THUMBNAIL 1-s2.0-S2468823123005485-fx1.sml https://s3-eu-west-1.amazonaws.com/prod-ucs-content-store-eu-west/content/pii:S2468823123005485/fx1/THUMBNAIL/image/gif/8117940053ae003e2e6ff1cc79d7da64/fx1.sml fx1 fx1.sml sml 4805 152 219 IMAGE-THUMBNAIL 1-s2.0-S2468823123005485-sc2.sml https://s3-eu-west-1.amazonaws.com/prod-ucs-content-store-eu-west/content/pii:S2468823123005485/sc2/THUMBNAIL/image/gif/352be5a7cb80f529f54fc635a25eb6e3/sc2.sml sc2 sc2.sml sml 5396 82 219 IMAGE-THUMBNAIL 1-s2.0-S2468823123005485-fx6.sml https://s3-eu-west-1.amazonaws.com/prod-ucs-content-store-eu-west/content/pii:S2468823123005485/fx6/THUMBNAIL/image/gif/fbec499688b5db56c0eccf51de8839d5/fx6.sml fx6 fx6.sml sml 4537 109 219 IMAGE-THUMBNAIL 1-s2.0-S2468823123005485-ga1.sml https://s3-eu-west-1.amazonaws.com/prod-ucs-content-store-eu-west/content/pii:S2468823123005485/ga1/THUMBNAIL/image/gif/1801b57f9b5ee57be44b8f7d55f3688d/ga1.sml ga1 true ga1.sml sml 7368 86 219 IMAGE-THUMBNAIL 1-s2.0-S2468823123005485-gr3.sml https://s3-eu-west-1.amazonaws.com/prod-ucs-content-store-eu-west/content/pii:S2468823123005485/gr3/THUMBNAIL/image/gif/a26353eea32ba75634e6401318622237/gr3.sml gr3 gr3.sml sml 8295 150 219 IMAGE-THUMBNAIL 1-s2.0-S2468823123005485-gr4.sml https://s3-eu-west-1.amazonaws.com/prod-ucs-content-store-eu-west/content/pii:S2468823123005485/gr4/THUMBNAIL/image/gif/c8914d0fcbb4ab8cac3bb1f163e41f76/gr4.sml gr4 gr4.sml sml 7389 136 219 IMAGE-THUMBNAIL 1-s2.0-S2468823123005485-gr5.sml https://s3-eu-west-1.amazonaws.com/prod-ucs-content-store-eu-west/content/pii:S2468823123005485/gr5/THUMBNAIL/image/gif/fd8f3612633ac5c6a1d7cbd15c6fa887/gr5.sml gr5 gr5.sml sml 17512 104 219 IMAGE-THUMBNAIL 1-s2.0-S2468823123005485-fx2.sml https://s3-eu-west-1.amazonaws.com/prod-ucs-content-store-eu-west/content/pii:S2468823123005485/fx2/THUMBNAIL/image/gif/a426f1abd02d2acbeeb9de011e05ea13/fx2.sml fx2 fx2.sml sml 4699 151 219 IMAGE-THUMBNAIL 1-s2.0-S2468823123005485-sc1.sml https://s3-eu-west-1.amazonaws.com/prod-ucs-content-store-eu-west/content/pii:S2468823123005485/sc1/THUMBNAIL/image/gif/408fa098e725a7700e1c5739cf240fc8/sc1.sml sc1 sc1.sml sml 6528 64 219 IMAGE-THUMBNAIL 1-s2.0-S2468823123005485-fx3.sml https://s3-eu-west-1.amazonaws.com/prod-ucs-content-store-eu-west/content/pii:S2468823123005485/fx3/THUMBNAIL/image/gif/bbe79b3068725f5cf39140c1c01a4fd7/fx3.sml fx3 fx3.sml sml 5244 121 219 IMAGE-THUMBNAIL 1-s2.0-S2468823123005485-fx4.sml https://s3-eu-west-1.amazonaws.com/prod-ucs-content-store-eu-west/content/pii:S2468823123005485/fx4/THUMBNAIL/image/gif/769e97df750bdaab9c4a179904c418b9/fx4.sml fx4 fx4.sml sml 5462 114 219 IMAGE-THUMBNAIL 1-s2.0-S2468823123005485-fx5.sml https://s3-eu-west-1.amazonaws.com/prod-ucs-content-store-eu-west/content/pii:S2468823123005485/fx5/THUMBNAIL/image/gif/812cf8968125923406ae352e637eafd7/fx5.sml fx5 fx5.sml sml 3810 73 219 IMAGE-THUMBNAIL 1-s2.0-S2468823123005485-fx7.sml https://s3-eu-west-1.amazonaws.com/prod-ucs-content-store-eu-west/content/pii:S2468823123005485/fx7/THUMBNAIL/image/gif/7fd4b0c09cd3fd4e5ad9e32161e693fe/fx7.sml fx7 fx7.sml sml 4545 110 219 IMAGE-THUMBNAIL 1-s2.0-S2468823123005485-gr1_lrg.jpg https://s3-eu-west-1.amazonaws.com/prod-ucs-content-store-eu-west/content/pii:S2468823123005485/HIGHRES/image/jpeg/631829d5393645ef0e0f93fe16aad103/gr1_lrg.jpg gr1 gr1_lrg.jpg jpg 950585 2183 3583 IMAGE-HIGH-RES 1-s2.0-S2468823123005485-gr2_lrg.jpg https://s3-eu-west-1.amazonaws.com/prod-ucs-content-store-eu-west/content/pii:S2468823123005485/HIGHRES/image/jpeg/256715eee86cec687dc20eb318f4d5b5/gr2_lrg.jpg gr2 gr2_lrg.jpg jpg 1413912 2667 3583 IMAGE-HIGH-RES 1-s2.0-S2468823123005485-fx1_lrg.jpg https://s3-eu-west-1.amazonaws.com/prod-ucs-content-store-eu-west/content/pii:S2468823123005485/HIGHRES/image/jpeg/8f966ebee0015c2aa09ce27b90c8ce1e/fx1_lrg.jpg fx1 fx1_lrg.jpg jpg 26618 441 636 IMAGE-HIGH-RES 1-s2.0-S2468823123005485-sc2_lrg.jpg https://s3-eu-west-1.amazonaws.com/prod-ucs-content-store-eu-west/content/pii:S2468823123005485/HIGHRES/image/jpeg/50e5db9b1fba21ca74f50c85faaf28e8/sc2_lrg.jpg sc2 sc2_lrg.jpg jpg 170347 974 2586 IMAGE-HIGH-RES 1-s2.0-S2468823123005485-fx6_lrg.jpg https://s3-eu-west-1.amazonaws.com/prod-ucs-content-store-eu-west/content/pii:S2468823123005485/HIGHRES/image/jpeg/c640fd6cbd115b4167c466d93b04e566/fx6_lrg.jpg fx6 fx6_lrg.jpg jpg 32647 411 826 IMAGE-HIGH-RES 1-s2.0-S2468823123005485-ga1_lrg.jpg https://s3-eu-west-1.amazonaws.com/prod-ucs-content-store-eu-west/content/pii:S2468823123005485/HIGHRES/image/jpeg/22f95443eb608d71278d5f54d268f258/ga1_lrg.jpg ga1 true ga1_lrg.jpg jpg 145825 868 2213 IMAGE-HIGH-RES 1-s2.0-S2468823123005485-gr3_lrg.jpg https://s3-eu-west-1.amazonaws.com/prod-ucs-content-store-eu-west/content/pii:S2468823123005485/HIGHRES/image/jpeg/4d4e3af4f47bf0ebb7c130c014eb357c/gr3_lrg.jpg gr3 gr3_lrg.jpg jpg 172216 1200 1749 IMAGE-HIGH-RES 1-s2.0-S2468823123005485-gr4_lrg.jpg https://s3-eu-west-1.amazonaws.com/prod-ucs-content-store-eu-west/content/pii:S2468823123005485/HIGHRES/image/jpeg/53ecf0ae5ded0837eb7244ecf269b70d/gr4_lrg.jpg gr4 gr4_lrg.jpg jpg 143073 1089 1754 IMAGE-HIGH-RES 1-s2.0-S2468823123005485-gr5_lrg.jpg https://s3-eu-west-1.amazonaws.com/prod-ucs-content-store-eu-west/content/pii:S2468823123005485/HIGHRES/image/jpeg/4c7cee1a25b536d35a0c98e3534f1cd1/gr5_lrg.jpg gr5 gr5_lrg.jpg jpg 185267 709 1500 IMAGE-HIGH-RES 1-s2.0-S2468823123005485-fx2_lrg.jpg https://s3-eu-west-1.amazonaws.com/prod-ucs-content-store-eu-west/content/pii:S2468823123005485/HIGHRES/image/jpeg/d76b9318c84f5e33a378e2c58fa12f94/fx2_lrg.jpg fx2 fx2_lrg.jpg jpg 31325 488 708 IMAGE-HIGH-RES 1-s2.0-S2468823123005485-sc1_lrg.jpg https://s3-eu-west-1.amazonaws.com/prod-ucs-content-store-eu-west/content/pii:S2468823123005485/HIGHRES/image/jpeg/76a887666a7e29c5cf4f57ad0a4e1ecb/sc1_lrg.jpg sc1 sc1_lrg.jpg jpg 251048 935 3222 IMAGE-HIGH-RES 1-s2.0-S2468823123005485-fx3_lrg.jpg https://s3-eu-west-1.amazonaws.com/prod-ucs-content-store-eu-west/content/pii:S2468823123005485/HIGHRES/image/jpeg/867f9196787633f2c499600f560806ea/fx3_lrg.jpg fx3 fx3_lrg.jpg jpg 49626 496 897 IMAGE-HIGH-RES 1-s2.0-S2468823123005485-fx4_lrg.jpg https://s3-eu-west-1.amazonaws.com/prod-ucs-content-store-eu-west/content/pii:S2468823123005485/HIGHRES/image/jpeg/28de84f811c55e11096338b1ba5a3433/fx4_lrg.jpg fx4 fx4_lrg.jpg jpg 29735 380 733 IMAGE-HIGH-RES 1-s2.0-S2468823123005485-fx5_lrg.jpg https://s3-eu-west-1.amazonaws.com/prod-ucs-content-store-eu-west/content/pii:S2468823123005485/HIGHRES/image/jpeg/6dd7bb24f7489a71231a00546ece5561/fx5_lrg.jpg fx5 fx5_lrg.jpg jpg 35375 300 898 IMAGE-HIGH-RES 1-s2.0-S2468823123005485-fx7_lrg.jpg https://s3-eu-west-1.amazonaws.com/prod-ucs-content-store-eu-west/content/pii:S2468823123005485/HIGHRES/image/jpeg/1534ea56dff8666c895dd0b787484769/fx7_lrg.jpg fx7 fx7_lrg.jpg jpg 34772 438 872 IMAGE-HIGH-RES 1-s2.0-S2468823123005485-mmc1.docx https://s3-eu-west-1.amazonaws.com/prod-ucs-content-store-eu-west/content/pii:S2468823123005485/mmc1/MAIN/application/vnd.openxmlformats-officedocument.wordprocessingml.document/b2d35d7bc8c51bb6e3511e1d64027c17/mmc1.docx mmc1 mmc1.docx docx 1789140 APPLICATION 1-s2.0-S2468823123005485-am.pdf https://s3-eu-west-1.amazonaws.com/prod-ucs-content-store-eu-west/content/egi:10L6SPWTV0B/MAIN/application/pdf/3b5035569628dfed7a062f87e4de1ea9/am.pdf am am.pdf pdf false 2974770 AAM-PDF MCAT 113465 113465 S2468-8231(23)00548-5 10.1016/j.mcat.2023.113465 The Author(s) Fig. 1 TEM images of showing multi-channelled SBA-15 (A), spherical particles of immobilized ligands (B) LH-SBA15, (C) LH-MCM-41 and the immobilized metal complexes (D) Ni-SBA15, (E) Co-SBA15 and (F) Fe-SBA15. Fig 1 Fig. 2 SEM micrographs of ligand LH-SBA15 (A) and the immobilized metal complexes (B) Ni-SBA15, (C) Co-SBA15 and (D) Fe-SBA15. Fig 2 Fig. 3 Plots of the dependence of catalytic activity and selectivity towards C6 oligomers on the amount of catalyst Ni-SBA15 (metal content calculated based on ICP-AES). Reaction conditions: solvent, n-heptane (30 mL); temperature, 30 °C; time, 1 h; pressure, 10 bar; Al/M ratio = 200. Fig 3 Fig. 4 Recycling data of the immobilized catalysts in the ethylene oligomerization reactions. Reaction conditions: [Metal] = 0.01 mmol; co-catalyst, EtAlCl2; solvent, n-heptane (30 mL); temperature, 30 °C; time, 1 h; pressure, 10 bar; Al/M ratio = 200. Fig 4 Fig. 5 TEM images of the fresh (A) and spent (B) catalyst, Ni-SBA15 showing slightly deformed morphology of the spent material. Fig 5 Scheme 1 Synthetic protocol of the N^O ligands immobilized on SBA-15 and MCM-41 and their Ni(II), Fe(II) and Co(II) complexes. Scheme 1 Scheme 2 Ethylene oligomerization reaction catalysed by the metal complexes Fe(II), Ni(II) and Co(II) immobilized on SBA-15 and MCM-41 silica supports. Scheme 2 Table 1 Physical and surface properties of metal complexes immobilized on SBA-15 and MCM-41 supports. Table 1 Entry Material EDX (wt%) ICP-AES (wt%) ICP-AES (µmol/g) SBET (m2/g) a Vp (cm3/g) a Vmicro (cm3/g) a APD (nm) b 1 Ni-SBA15 0.58 0.59 100.53 205 0.45 0.21 7.19 2 Co-SBA15 0.99 0.95 161.21 190 0.42 0.20 7.74 3 Fe-SBA15 7.35 6.92 1239.03 260 0.45 0.24 5.72 4 Ni-MCM41 1.55 0.96 163.57 220 0.38 0.23 5.49 5 SBA15 – – – 870 1.118 0.972 3.49 6 MCM41 – – – 790 0.933 0.850 2.74 a bet surface area (SBET), total pore volume (Vp) and micro pore volume (Vmicro) measured by N2 physisorption. b APD (Average pore diameter) calculated according to BJH plot. [37]. Table 2 Physical properties and ethylene oligomerization data of immobilized metal complexes a . Table 2 Entry Catalyst Metal b (µmol/g) SBET c (m2/g) Vp c (cm3/g) Average pore diameter d (nm) Yield e (g) Activity f (g.mol−1. M. h − 1) Product Selectivity g (%) C4 (α-C4) C6 (α-C6) >C8 1 Ni-SBA15 100.53 205 0.45 7.19 0.35 35,000 26 (91) 71 (18) 3 2 Co-SBA15 161.21 190 0.42 7.74 0.32 32,000 12 (56) 84 (23) 4 3 Fe-SBA15 1239.03 260 0.45 5.72 0.29 29,000 5 (69) 92 (23) 3 4 Ni-MCM41 163.57 220 0.38 5.49 0.31 31,000 17 (51) 80 (33) 3 5 [Ni(L1)2] – – – – 0.28 28,000 15(17) 85(10) a Reaction conditions: [Metal] = 10 µmol (calculated based on the ICP-AES data and weighed accordingly). Co-catalyst EtAlCl2; solvent, n-heptane (30 mL); temperature, 30 °C; time, 1 h; pressure, 10 bar; Al/M ratio = 200. b Metal content in the original catalyst sample. c BET surface area (SBET) and total pore volume (Vp) measured by N2 physisorption. d Calculated according to a BJH plot. e Determined using tetradecene as the internal standard. f activity, in g oligomer produced per mol metal per hour; amount of catalyst calculated using ICP-AES results. g olefinic products were detected by GC-FID and GC–MS. Table 3 Ethylene oligomerization recycling data of the immobilized catalysts. a Table 3 Entry Catalyst Initial b Cycle 1 b Cycle 2 b SelectivityC6 c Metal content (µmol/g) ΔMetal (%) d ΔActivity (%) e Fresh Spent 1 Ni-SBA15 35,000 31,500 30,000 70(71) 100.53 73.86 26 15 2 Co-SBA15 32,000 29,800 25,800 83(84) 161.21 112.00 30 20 3 Fe-SBA15 29,000 21,400 19,500 92(92) 1239.03 533.57 43 33 4 Ni-MCM41 31,000 24,000 23,000 83(80) 163.57 100.53 39 25 a Reaction conditions: [Metal]= 10 µmol (calculated based on the ICP-AES data); Co-catalyst, EtAlCl2; solvent, n-heptane (30 mL); temperature, 30 °C; time, 1 h; pressure, 10 bar; Al/M ratio, 200. b Catalytic activity in g·mol−1M·h−1. c Differences in selectivity between the initial and final cycle. d % difference in metal contents between final and initial experiments. e Percentage loss in catalytic activity between the initial and final runs. Table 4 Comparisons of the current systems to the literature catalysts. Table 4 Entry Catalyst Support Activity a Product b Reference 1 Image, table 4 MCM-41 18,100 C4 [37] 2 Image, table 4 SBA-15 7200 C4 [21] 3 Image, table 4 SBA15 6600 Polymers [51] 4 Image, table 4 Silica (Davisil 710) 239 000 Alkyltoluenes [20] 5 Image, table 4 Fe3O4 20 500 C6 [28] 6 Image, table 4 SBA-15 35 400 C6 This work 7 Image, table 4 MCM-41 31 000 C6 This work a Activity, Kg/Mol Cat.h. b Major product. Regulating the physical properties of silica immobilized Fe(II), Ni(II) and Co(II) catalysts towards ethylene oligomerization reactions Makhosonke Ngcobo a Alina Ouissa b Wolfgang Kleist b Werner R. Thiel b Stephen O. Ojwach a ⁎ a School of Chemistry and Physics, University of KwaZulu-Natal, Pietermaritzburg Campus, Private Bag X01 Scottsville 3209, South Africa School of Chemistry and Physics University of KwaZulu-Natal Pietermaritzburg Campus Private Bag X01 Scottsville 3209 South Africa aSchool of Chemistry and Physics, University of KwaZulu-Natal, Pietermaritzburg Campus, Private Bag X01 Scottsville 3209, South Africa b Fachbereich Chemie, RPTU Kaiserslautern-Landau, Erwin-Schrödinger-Str. 54, 67663 Kaiserslautern, Germany Fachbereich Chemie RPTU Kaiserslautern-Landau Erwin-Schrödinger-Str. 54 Kaiserslautern 67663 Germany bFachbereich Chemie, RPTU Kaiserslautern-Landau, Erwin-Schrödinger-Str. 54, 67663 Kaiserslautern, Germany ⁎ Corresponding author. Immobilization of the phenol((triethoxysilyl)propylimino) ligand (LH) on SBA15 and MCM41 afforded the ligands LH-SBA15 and LH-MCM41 respectively. The reactions of LH-SBA15 and LH-MCM41 with NiCl2, CoCl2 and FeCl2 salts produced the respective materials [Ni(LH-SBA15)2Cl2], (Ni-SBA15), [Co(LHSBA15)2Cl2], (Co-SBA15), [Fe(LH-SBA15)2Cl2], (Fe-SBA15) and [Ni(LH-MCM41)2Cl2], (Ni-MCM41) in good yields. The functional group determination, morphology, physical and surfaced properties of the materials containing immobilized ligands and complexes were established from FT-IR, TGA, TEM, SEM-EDX, PXRD, ICP-AES, and nitrogen physisorption measurement techniques. Activation of the complexes on the surface with EtAlCl2 as co-catalyst formed active catalysts for the oligomerization of ethylene affording mainly C6 oligomers. The SBA-15 immobilized catalysts were more active than the corresponding MCM-41 materials, while Ni(II) catalysts performed better than the corresponding Co(II) and Fe(II) systems. The immobilized catalysts could be used in three cycles without significant loss of catalytic activity and selectivity. Graphical abstract Image, graphical abstract Keywords Metal catalysts Immobilization Silica Ethylene oligomerization Recycling Data availability The data is provided as supplementary material in the manuscript Introduction The production of higher olefins is one of the most studied catalytic processes both in academia and industry, owing to its vital contributions in the petrochemical industries [1]. These higher olefins have a wide range of domestic and industrial applications of higher ethylene oligomers as in lubricants, surfactants, solvents and detergents [2]. Over the past decades, the evolution of transition metal-based homogeneous catalysts in these ethylene oligomerization reactions have witnessed significant growth [3–5]. Despite their high catalytic activities and selectivity, these homogeneous catalysts suffer some drawbacks, mainly associated with the difficulty in separation of the catalysts from products [6]. On the other hand, while the use of heterogeneous systems circumvents the separation dilemma, they also have limitations such as poor selectivity [7]. As a result, the design and development of separable and selective catalysts for various organic transformations represents an attractive research focus [8–11]. Several approaches have so far been adopted to design both single-site and separable catalysts [11]. One such technique is the immobilization of homogeneous catalysts on inorganic supports such as zeolites [12], silica [13] and organic polymers [14,15]. amongst these techniques, the use of silica-based supports has several advantages such as enhanced thermal and chemical stability, large surface areas and a higher density of the active sites, leading to enhanced catalytic performance [16]. It is noteworthy to mention that while a number of immobilized catalysts have been designed for various reactions such as Heck-coupling [17], hydrogenation [18], oxidation [19], their development in ethylene oligomerization is still at its infancy. An illustration is the contribution from Kumar et al. [20]., using MCM-41 immobilized Ni(II) and Pd(II) complexes in ethylene oligomerization reactions. Activation of these immobilized complexes with EtAlCl2 as the co-catalyst form active and recyclable catalysts to give mainly butenes [20]. In another example, Rossetto et al. [21] reported that β-diimine nickel(II) complexes immobilized on SBA-15 oligomerize ethylene with high turn-over frequency (TOFs) of up to 7.2 × 103 h − 1 and selectivity of 98% towards the C4 oligomers. These catalysts are reusable in three successive cycles with marginal loss in catalytic activities and selectivity. It is generally known that immobilized catalysts often display lower catalytic activities when compared to their homogeneous analogues [22]. On a more positive note, the recent report by Tuskaev et al. [23] on nickel(II) complexes anchored on tripodal N^N^N ligands show that the immobilized complexes display higher catalytic activities of 120 kg mol−1 h−1 atm−1 with selectivity of 92% towards 1-butene, while the homogeneous counterparts display catalytic activities of 62 kg mol−1 h−1 atm−1. Over the past decade, our research has largely focused on the design and development of homogeneous and supported catalysts for ethylene oligomerization reactions [24–27]. Encouraged by our recent findings using N^O coordinated metal catalysts immobilized on inorganic supports in ethylene oligomerization reactions [28,29], we herein report the ethylene oligomerization reactions catalysed by N^O coordinated Ni(II), Co(II) and Fe(II) complexes immobilized on silica supports. The effect of the nature of silica support, using MCM-41 and SBA-15, in regulating the physical properties of the complexes and their resultant catalytic performance have been studied. Recycling studies in these ethylene oligomerization reactions and post-catalysts characterization have also be examined in details and are herein discussed. Experimental section General materials and instrumentation All synthetic manipulations were performed using standard Schlenk-line techniques. The solvents were obtained from Merck and dried or distilled using appropriate methods [30]. Ethanol was dried over calcium oxide whilst toluene solvent was treated under sodium/benzophenone reagent, distilled, and stored in 4 Å molecular sieves, while n-heptane was over under calcium hydride, distilled, and stored in 4 Å molecular sieves. Salicylaldehyde (98%), 2′-hydroxyacetophenone (98%), (3-aminopropyl)triethoxysilane (APTES, ≥98%), CoCl2 (97%), FeCl2 (98%), NiCl2 (98%), Santa Barbara Amorphous-15 (SBA-15, 99%) and Mobil Composition of Matter number 41 (MCM-41, 98%) were obtained from Sigma-Aldrich and used as received. 1H NMR and 13C NMR (100 MHz) spectra were recorded on a 400 MHz Bruker Ultra shield NMR spectrometer with CDCl3 and DMSO‑d6 used as the solvents. The infrared spectra were recorded on a Perkin Elmer Spectrometer 100. A LC Premier micro-mass Spectrometer model LCMS-2020, was used for mass spectral analyses. The ZEISS EVO L 15 scanning electron microscope (conventional SEM, low vacuum, ESEM and EDX) operating at 20 kV accelerating voltage was used to carry out microscopic analyses while energy dispersive X-ray (EDX) analyses were carried out using an Oxford make EDX detector. Prior to the analysis, the samples were coated with gold using a Q150R series high vacuum Quorum sputter coater (Laughton, UK). A JEOL 1400 transmission electron microscope (brightfield, darkfield, diffraction, EDX) operating at an accelerating voltage of 200 kV was used to perform transmission electron microscopic analyses. Elemental composition was performed using a Varian 720-ES inductively coupled plasma atomic emission spectroscopy (ICP-AES) device equipped with the ICP Expert II software. Nitrogen physisorption measurements were performed on BELSORP MAX from Microtrac Retzsch. Data evaluation according to Brunauer, Emmett, Teller (BET) and Barrett, Joyner, Halenda (BJH) was carried out with the software BELmaster version 7.3.2.0. The samples were activated in vacuum for 20 h at 130 °C prior to the measurements. Thermogravimetric analyses were acquired on a Perkin-Elmer TGA 4000 instrument equipped with Pyris software at 50- 900 °C with 10 °C/min heating rate. A Varian CP-3800 gas chromatograph equipped with a flame ionization detector (FID) and a CP-Sil 5 CB (30 m x 0.2 mm x 0.25 µm) capillary column was used for GC analyses (GC conditions: starting temperature 40 °C for 5 min, the heating rate of 10 °C/min up to 250 °C), while GC–MS analyses were performed on a Shimadzu GCMS-QP2010SE. Synthesis of silica-immobilized ligands and their Ni(II), Fe(II) and Co(II) complexes Synthesis of LH-SBA15 The immobilized ligand LH-SBA15, was prepared by adding SBA-15 (1.01 g) to a solution of ((triethoxysilyl)propylimino)phenol LH (0.12 g) [28] in toluene (20 mL) in a 100 mL round-bottomed flask. The slurry was then sonicated for 15 min at room temperature and then refluxed for a further 14 h. At the end of the reaction time, the mixture was filtered, and the crude product washed with toluene (3 × 20 mL) and dichloromethane (3 × 10 mL). The residue was then dried under vacuum at room temperature for 10 h to afford the immobilized ligand as a yellow solid. Yield: 0.95 g, 84%. FT-IR (cm−1): ν(OH): 2305; ν(C=N):1641; ν(Si-O): 1053. Synthesis of LH-MCM41 The MCM-41 immobilized ligand was synthesized in a similar manner as described for LH@SBA-15 using MCM-41 (1.01 g) and LH (0.10 g). Light yellow solid. Yield: 1.05 g (95%). FT-IR (cm−1): ν(OH): 2107; ν(C=N): 1636; ν(Si-O): 1058. Syntheses of [Ni(LH-SBA15)2Cl2] (Ni-SBA15) The nickel(II) material Ni-SBA15 was synthesized by introducing the immobilized ligand LH-SBA15 (0.11 g) to a suspension of NiCl2 (0.07 g, 0.50 mmol) in ethanol (20 mL). The resultant yellow mixture was refluxed for 24 h. After this period, the mixture was cooled, filtered and the residue was dried in an oven at 100 °C for 1 h to furnish a light-yellow powder. Yield: 0.07 g (39%). FT-IR (cm−1): ν(OH): 2240; ν(CO): 1744; ν(C = N): 1635; ν(Si-O): 1055. The materials Co-SBA15, Fe-SBA15 and Ni-MCM41 were synthesized following the protocol described for Ni-SBA15. [Co(LH-SBA15)2Cl2], (Co-SBA15) LH-SBA15 (0.10 g) and CoCl2 (0.05 g, 0.50 mmol). Light blue powder. Yield: 0.06 g (40%). FT-IR (cm−1): ν(OH): 2114; ν(C=N): 1623; ν(Si-O): 1058. [Fe(LH-SBA15)2Cl2], (Fe-SBA15) LH@SBA-15 (0.12 g) and FeCl2 (0.07 g, 0.50 mmol). Brown powder. Yield: 0.08 g (42%). FT-IR (cm−1): ν(OH): 2324; ν(CO): 1740; ν(C=N): 1616; ν(Si-O): 1049. [Ni(LH-MCM41)2Cl2], (Ni-MCM41) Ligand LH-MCM41 (0.11 g) and NiCl2 (0.07 g, 0.50 mmol). Cream white powder. Yield: 0.06 g (33%). FT-IR (cm−1): ν(OH): 3422, 2295, 2226, 2120; ν(C=N):1630; ν(Si-O): 1051. Ethylene oligomerization catalysis Typical procedure for ethylene oligomerization reactions The ethylene oligomerization experiments were carried out in a stainless-steel Parr reactor fitted with a 100 mL glass chamber and a magnetic stirrer bar. A pre-weighed amount of the immobilized complex (10 µmol) was transferred into a dry Schlenk tube under nitrogen atmosphere and n-heptane (30 mL) was added using a syringe. In a typical experiment, 10.30 mg of Ni-SBA15 (equivalent to 0.01 mmol of Ni based on ICP-AES analyses) was weighed and ethylaluminum dichloride co-catalyst, EtAlCl2 (2.00 mmol) to give an Al/M ratio of 200 which was injected into the Schlenk tube containing the pre-catalyst. The solution was then transferred through a cannula into the nitrogen filled reactor and heated to 30 °C while stirring on a hot plate. The reactor was flashed several times with ethylene gas, the ethylene pressure was set at 10 bar and the reaction initiated by stirring. After 1 h, the reactor was cooled to approximately −10 °C using liquid nitrogen and excess ethylene gas was vented off. The reaction mixture was then quenched by addition of 10% hydrochloric acid (2 mL). A portion of the reaction mixture was sampled in a GC-vial for GC-FID and GC–MS analyses to determine identity and distribution of the products. The mass of the product formed was determined using the calibration curve of the R-factors for the olefin standards versus the number of carbons of the standards [31]. Hexene (0.85), octene (0.74), decene (0.50), dodecene (0.39) and tetradecene (0.327) standards were used to obtain a calibration curve and tetradecane was used as an internal standard. The R-factor for butene was extrapolated as 0.981 from the calibration curve. The catalytic activity (goligomer mol−1 M. h−1) was determined using the percentage metal content in the immobilized complexes as determined from ICP-AES analyses. Catalyst recycling experiments In a typical recycling experiment, the spent catalyst was recovered via centrifugation and the oligomeric products were separated and filtered for analyses. The recovered material was washed with n-heptane and ethanol and reactivated by calcination at 300 °C. The reactivated material catalyst was weighed prior to the subsequent experiment, following the protocol described for the standard ethylene oligomerization reaction described in Section 2.3.1. Results and discussion Syntheses and surface analyses of the immobilized metal complexes The pre-ligand, ((triethoxysilyl)propylimino)phenol (LH) was synthesized following literature procedures [28,32] and characterized using 1H NMR (Fig. S1) and FT-IR (Fig. S2) spectroscopies and mass spectrometry (Fig. S3). The immobilization protocol of LH on SBA-15 and MCM-41 and subsequent treatments of the immobilized ligands LH-SBA15 and LH-MCM41 with NiCl2, FeCl2 or CoCl2 salts to produce the respective immobilized complexes materials Ni-SBA15, Co-SBA15, Fe-SBA15 and Ni-MCM41 is shown in Scheme 1 . The immobilized metal complexes were obtained in low yields of 33%−42%, which may be attributed to the wet impregnation method adopted [33]. The compounds were characterized using a combination of techniques such as FT-IR spectroscopy for functional group analyses, TGA for thermal and stability studies, TEM, SEM-EDX for surface and texture determination, ICP-AES for metal content, and Nitrogen physisorption for surface area analyses. To fully confirm the proposed structures of the immobilized metal complexes in Scheme 1, we synthesized and characterized the homogeneous Ni(II) complex by reactions of ligand LH with the NiCl2 salt to give the complex [Ni(L)2] (ESI). The absence of the νOH signal in the spectrum of complex [Ni(L)2 ] (observed at 3060 cm−1 in the free ligand LH, Fig. S2), points to the deprotonation of the OH proton prior to coordination as depicted in Scheme 1. Mass spectrometry of the homogenous Ni complex displayed a peak at m/z = 720 amu, corresponding to the molecular ion [M+Na] of the species [Ni(L)2] (Mw= 707.5 4 g/mol) (Fig. S4). From the spectral data of the homogeneous Ni(II) complex, it is reasonable to assign the general formulae of [M(L)2] in the immobilized complexes as shown in Scheme 1. The FT-IR spectroscopic data display the imine νCN peaks of the free ligand (LH) as a sharp peak at 1612 cm−1 that shift to higher frequencies (1641 and 1636 cm−1) in the immobilized ligands LH-SBA15 and LH-MCM41 respectively (Fig. S5). The formation of the immobilized complexes can be deduced from the observation of these signals at lower stretching frequencies: Ni-SBA15 (νC N = 1635 cm−1), Co-SBA15 (νC N = 1623 cm−1), Fe-SBA15 (νC N = 1616 cm−1) and Ni-MCM41 (νC N = 1630 cm−1), see Figures S5-S8. In addition, the appearance of a strong absorption at around 1049–1058 cm−1 establishes the presence of the Si-O-Si motif in the materials [34]. The thermal stability and decomposition profiles of the immobilized compounds was investigated using TGA (Fig. S9). The materials containing immobilized complexes displayed comparable profiles with weight losses in the regions of 50–100 °C, 150–300 °C, 300–500 °C, and 500–900 °C. For example, the TGA plot of material Fe-SBA15 showed a steep weight loss of 5% between 50 and 100 °C, assigned to the loss of moisture physisorbed on the material's surface (Fig. S9-c). The subsequent weight loss of 2% between 150 and 300 °C corresponds to the chemically adsorbed water molecules and trapped solvent molecules [21]. The decomposition of organic matter could be deduced from the 8% weight loss between 300 °C-500 °C. There was no significant influence of the nature of silica support on the thermal stability of the materials as comparable decomposition profiles were obtained as shown in Fig. S9. On the other hand, it appears that MCM-41 and SBA-15 supports influenced the incorporation of organic matter in the materials as evidenced from the variations in the overall weight losses of 11% in Ni-MCM41 and 14% in Ni-SBA15 [35]. The morphology, texture and elemental compositions of the compounds were elucidated using TEM and SEM-EDX microscopic techniques. The TEM images of the compounds (Fig. 1 ), it was evident that upon immobilization of the ligands and complexes, the structure of the SBA-15 solid support was distorted to form spherical particles with different sizes due to the Ostwald ripening process [36]. The SEM images of SBA15 immobilized materials (Fig. 2 ), revealed no major changes on the morphology of the material upon immobilization of the ligand and complexes. The EDX spectra of the materials (Fig. S10 and Table 1 ) revealed the presence of Si, C, O and Cl and the respective metal cations. From Table 1, Fe-SBA15 exhibits the highest Fe metal content of 7.35%, while Ni-SBA15 shows the lowest Ni metal atom of 0.58% (Table 1, entries 1–3). The ICP-AES studies were done to further authenticate the metal contents obtained from EDX analyses (Table 1). Notably, there was a good agreement between the EDX and ICP-AES results. Interestingly, comparison of metal contents based on the nature of the support showed material Ni-MCM41 to contain higher Ni(II) content of 163.60 µmol/g in comparison to its analogous Ni-SBA15 of 100.53 µmol/g (Table 1, entry 1 vs 4). Similar trends have been reported by Rossetto et al. using β-diimine Ni(II) complexes, where MCM-41 and SBA-15 supports display Ni metal contents of 130±1.87 µmol/g and 127.4 ± 0.39 µmol/g respectively [21,37]. The crystallinity of the materials was determined using PXRD. The diffractogram of the Ni-SBA15 (Fig. S11) showed Miller indices: d100, d110, d200, which are typical for a 2D hexagonal lattice. The same peaks were observed for other materials that were synthesized based on SBA-15 and MCM-41 [40]. Lower intensities observed for 110 and 200 reflections may be attributed to the anchoring of the organic motifs and the addition of the metal centre to the matrix. Nevertheless, the presence of d100, d110 and d200 reflection indices was an indication that the matrix was not severely distorted upon the formation of the respective materials [41]. The immobilized metal complexes and the pure SBA15 and MCM41 supports were also analysed using nitrogen physisorption measurements. Specific surface areas were determined according to Brunauer, Emmett, Teller (BET) and other pore characteristics such as pore size distribution and pore volumes were obtained using the Barrett, Joyner, Halenda (BJH) method or by applying a t-plot analysis. The N2 adsorption-desorption isotherms of the synthesized immobilized complexes and their respective pure support materials SBA15 and MCM41 are shown in Fig. S12, while the pore-size distributions (according to BJH) are given in Fig. S13. The surface area and pore size parameters are given in Table 1. From the data, it was evident that both the nature of the support and metal atom controlled the surfaces areas and pore sizes of the materials. In general, the immobilized materials exhibited mesoporous behaviour with average pore diameters of between 5.49 nm to 7.74 nm, which are much higher than their respective pure solid supports. For example, the average pore diameter of SBA15 increased from 3.49 nm to 7.19 nm in Ni-SBA15 (Table 1, entries 1 and 5). This contrasts the relative specific areas of the pure supports, which reduced by approximately 70% upon incorporation of the metal complexes. For instance, the specific surface areas of SBA15 and MCM41 decreased from 870 m2/g and 970 m2/g to 205 m2/g and 220 m2/g in the respective immobilized complexes Ni-SBA15 and Ni-MCM41 (Table 2 , entries 1, 4–6), and is consistent with appreciable incorporation of the metal complexes on the support matrix. With respect to the identity of the metal atom, the Co(II) and Fe(II) materials Co-SBA15 and Fe-SBA15 show the least and highest surface areas of 190 m2/g and 260 m2/g respectively (Table 1, entries 2 and 3), consistent with previous findings [38]. The influence of the nature of support in regulating the surface area of the materials could also be derived from the relatively higher surface area of 220 m2/g for the Ni-MCM41, in comparison to the value of 205 m2/g reported for the Ni-SBA15 complex (Table 1, entries 1 and 4). Expectedly, the material Ni-MCM41 displayed smaller average pore diameter of 5.49 nm than the analogous material Ni-SBA15 of 7.19 nm [39]. From the pore distribution of the materials, it is evident that compound NiMCM41 displays wider pore distributions, compared to the analogous NiSBA15 compound (Figs. S13a and S13d), consistent with literature findings [39]. Ethylene oligomerization reactions catalysed by immobilized catalysts Preliminary and optimization studies of the ethylene oligomerization reactions The immobilized metal complexes Ni-SBA15, Co-SBA15, Fe-SBA15 and Ni-MCM41 were screened as catalysts in ethylene oligomerization reactions in n-heptane as the solvent using ethylaluminum dichloride (EtAlCl2) as the co-catalyst (Scheme 2 ). Analyses of the ethylene oligomerization products using GC (Fig. S14) and GC–MS (Fig. S15) confirmed the formation of C6 as the major fraction, C4 oligomers and trace amounts of higher C8 and C10 olefins (Table 2). Initial reactions conditions using Al/M ratio of 200, 10 bar at 30 °C were employed and furnished catalytic activities of up to 35,000 g·mol−1M·h−1 (Table 2). We then investigated the effect of the catalyst loading (metal content based on ICP-AES analyses) on the catalytic performance of Ni-SBA15 by varying the amount of the catalysts from 5 µmol to 20 µmol (Fig. 3 ). Generally, the catalytic activities of Ni-SBA15 decreased with increasing amounts of the catalyst/metal contents. For example, catalytic activities of 37,500 g·mol−1·Ni·h−1 and 18,000 g·mol−1Ni·h−1 were recorded at Ni loadings of 5 µmol and 20 µmol respectively. A plausible explanation for the decline of catalytic activities with higher metal loadings could be that at high metal loadings, agglomeration (reduced catalyst dispersion) is possible, thus limiting access of the monomer to the active sites [42]. This is also supported by the data in Fig. S16, which shows a decline in the catalytic activity of the materials with increasing metal contents. Interestingly, the selectivity of the catalysts was also influenced by the metal concentrations (Fig. 3). For example, the selectivity for C6 increased from 69% to 80% as the metal loading of Ni-SBA15 was increased from 5 µmol to 20 µmol respectively (Fig. 3). While this phenomenon has been reported before [43] its exact interpretation is not quite clear to us at this moment. Influence of nature of support and metal atom in the ethylene oligomerization reactions The main objective of this contribution was to examine the effect of the silica support and metal atom on the catalytic performance of the immobilized complexes using SBA-15 and MCM-41 as templates (Table 2). From the results, immobilization on SBA-15 support afforded more active Ni catalyst than the use of MCM-41. For example, Ni-SBA15 and Ni-MCM41 displayed catalytic activities of 35,000 g·mol−1Ni·h−1 and 31,000 g·mol−1Ni.h−1 respectively (Table 2, entries 1 vs 4 and Fig. S17). This observation may be assigned to the generally larger pore size of SBA-15 compared to MCM-41, which facilitates efficient inter-channel transportation of ethylene within the pores of the materials resulting in enhanced oligomerization reactions [44]. The observed trends are in good agreement with the those of Guo and co-workers [45], where the Fe-SBA15 catalyst (1.75 × 106 g·mol−1Fe·h) shows higher catalytic activities than the corresponding Fe-MCM41 (1.45 × 106 g·mol−1Fe·h) system. In addition, the plot of the catalytic activity vs the BET surface area of the catalysts (Fig. S18) reveals an inverse relationship. To further understand the role played by the catalyst support, we tested the homogeneous [Ni(L)2] complex and compared its catalytic activity with the analogous NiSBA15 and NiMCM41 systems. From the data, it is interesting to note that the catalytic activity of the homogeneous system was slightly lower (28 000 g·mol−1Ni.h−1) than the respective immobilized NiSBA15 (35,000 g·mol−1Ni.h−1) and NiMCM41 (31,000 g·mol−1Ni.h−1) catalysts (Table 2, entries 1, 4- 5). While immobilized catalysts generally show lower catalytic activities compared to their homogeneous counterparts [20,21,37], instances where they exhibit higher catalytic activities are also known [23]. The nature of the metal atom also controlled the catalytic activities of the materials (Table 2). In general, the Ni(II) materials showed greater catalytic activities compared to the corresponding Fe(II) and Co(II) catalysts (Table 2, entries 1–3). As discussed in the nature of supports, this observation can also be assigned to the combined larger pore volume and diameter of Ni-SBA15 (0.45 cm3/g and 7.19 nm) compared to those of Co-SBA15 (0.42 cm3/g and 7.74 nm) and Fe-SBA15 (0.45 cm3/g and 5.72 nm). From these catalytic trends (general increase in catalytic activity with pore size), it can therefore be conceived that the ethylene oligomerization reactions occur within the pores of the materials (diffuse controlled) rather than on the surface of the material due to adsorption [46,47]. In terms of product distribution and selectivity, there was also good correlations between the pore sizes of the catalysts and product distribution. For example, selectivity towards the major C6 oligomers of 71% and 80% were obtained for catalyst Ni-SBA15 (0.45 cm3/g) and Ni-MCM41 (0.38 cm3/g) respectively (Table 2, entries 1 and 4). This suggests that the smaller pore volume of Ni-MCM41 favours retention of the preformed C4 oligomers resulting in chain propagation to form more C6 oligomers. The identity of the metal atom also influenced product distribution. For example, Ni-SBA15 catalyst produced lower amounts of C6 oligomers (71%) in comparison to 84% and 92% afforded by the analogous Co-SBA15 and Fe-SBA15 respectively (Table 2, entries 1–3). This trend is in tandem with those of homogeneous behaviour where Ni(II) catalysts are known to favour dimerization of ethylene while Co(II) and Fe(II) systems promote trimerization reactions [48–50]. Another explanation, which agrees with the observed catalytic activity trends is that smaller pore size favour retention of C4 fractions and promotes ethylene reincorporation to give more C6 oligomers. This argument is well supported by the highest composition of C6 oligomers (92%) produced by Fe-SBA15 catalyst, which has the smallest pore size (5.72 nm) in this series (Table 2, entries 1–3). More importantly, the selectivity of the immobilized systems was comparable to the homogeneous catalysts. For example, percentage compositions for C6 of 80% and 85% were recorded for NiMC41 and [Ni(L)2] respectively ((Table 2, entries 4 and 5) Catalyst recycling and post characterization studies The recyclability of the immobilized catalysts in ethylene oligomerization reactions was conducted in three successive runs as shown in Table 3 and Fig. 4 . After the first run (cycle), a fresh EtAlCl2 co-catalyst (2 mL, 200 equivalence) was added to the recovered and reactivated materials. The data confirm that these immobilized metal complexes are recyclable in ethylene oligomerization reactions, albeit with some reductions in catalytic activities, depending on the nature of the support (Fig. 4). For example, catalyst Ni-SBA15 showed the highest stability and recycling efficiency, displaying catalytic activities of 35,000 g·mol−1Ni·h−1 and 30,000 g·mol−1Ni·h−1 (translating to a 15% drop) in the first and third runs respectively (Table 3, entry 1), in contrasts to significant reduction in catalytic activity of 25% recorded for the corresponding Ni-MCM41 (Table 3, entries 1 vs 4). Similarly, we were able to establish that by changing the metal atom, the recycling efficiency was also altered. This is illustrated by the percentage losses in catalytic activities of 15% and 33% for the Ni-SAB15 and Fe-SBA15 respectively (Table 3, entries 1 vs 3). More significantly, the oligomer distribution and selectivity remained largely unchanged during the recycling experiments in all the catalysts (Table 3 and Table S1). For example, using catalysts Ni-SBA15, compositions of the C6 oligomers of 71% and 70% were obtained in the initial and second cycle experiments respectively (Table 3, entry 1). Our attention then shifted to the understanding of the reasons behind the slight reductions in catalytic activities in the recycling experiments. First, we performed hot filtration experiments to establish any possible leaching of the active species. No quantitative catalytic activity was obtained from the filtrates, signifying minimal/absence of leaching of the active species. ICP-AES analyses of the spent catalysts was then carried out to elucidate any possible loss of the active metal species during catalyst recovery (Table 3). The results confirm the loss of the metal species as witnessed in Ni-SBA15 recording Ni metal contents of 100.53 µmol/g and 73.86 µmol/g (26% loss of the Ni species) in the fresh and spent catalysts (Table 3, entry 1). Similar trends were observed for the other catalysts (Table 3, entries 2–4). There was a good correlation between the losses in metal content and catalytic activities (Fig. S16). For example, catalyst Fe-SBA15, which recorded the greatest loss in metal content of 43%, also witnessed the highest loss in catalytic activity of 33% (Table 3, entry 3). On the other hand, catalyst Ni-SBA15 displayed the lowest reduction in metal contents and catalytic activities of 26% and 15% respectively (Fig. S19). In terms of the nature of support, catalysts Ni-MCM41 recorded the higher reduction in metal content and catalytic activity of 39% and 25% respectively, compared to values of 26% and 15% obtained for Ni-SBA15 (Table 3 , entries 1 and 4). These data suggest that the decrease in catalytic activities of the immobilized materials in the recycling experiments could be assigned to the reduction of the active metal species, with the SBA-15 support imparting greater stability than the MCM-41 support. Finally, we analysed the used materials using TEM to ventilate if any changes in the texture and morphology of the materials could account for the observed reductions in catalytic activities in the recycling experiments (Fig. 5 ). The TEM images of the spent catalyst Ni-SBA15 shows some slightly deformed morphology when compared to the TEM images of the fresh material (Fig. 5). Furthermore, the TEM image of the recovered catalyst revealed the formation of metal nanoparticles as tiny dark spots in the catalyst's structure (Fig. 5 b). Similarly, the white spots in the used catalyst (Fig. 5 B) may be associated with the decomposition of EtAlCl2 co-catalyst to form alumina ash. From the TEM images, it is therefore possible that the damages and changes in the catalyst structure may also be responsible for the observed reductions catalytic activities in the recycling experiments. Comparison of current immobilized catalysts with reported systems Finally, we carried out a comparative analyses of the performance of the current immobilized catalysts with other immobilized systems present in literature in the ethylene oligomerization/polymerization reactions (Table 4 ). In general, our catalysts showed comparable behaviour to the reported systems. Interestingly, the beta-diimine Ni(II) systems reported by Rossetto et al. [21,37] afford C4 oligomers as the major products, in sharp contrast to our catalysts, which gave C6 as the major products (Table 4 , entries 1–2, 6–7), indicating that product distribution is largely controlled by the nature of the coordinated ligands. This is supported by the findings of Kumar et al. [20] using Davisil supported (pyridyl)imine Ni(II) catalysts, which are more active than our current catalysts (TOF of 239 000 g·mol−1·h−1) but has poor selectivity, giving mainly alkyltoluenes (Table 4 , entry 4). Comparison of the current silica immobilized catalysts with our recently reported Fe3O4 immobilized systems [28], reveal that the silica supports (MCM-41 and SBA-15) impart higher catalytic activity compared to the Fe3O4 support. For example, catalytic activities of 10,500 g·mol−1·h−1, 35,000 g·mol−1·h−1 and 31,000 g·mol−1·h−1 are displayed by Ni2@Fe3O4, Ni-SBA15 and Ni-MCM41 respectively (Table 4, entries 5–7). Nevertheless, both the current silica immobilized catalysts and the previously reported Fe3O4 immobilized systems [28] predominantly produce hexene oligomers. As shown in Table 4, entry 3, immobilization of the famous Gibson bis(imino)pyridine Fe(II) catalysts on SBA15 support produces mainly polyethylene [51], but show lower catalytic activities than our current silica immobilized systems. Conclusions The SBA-15 and MCM-41 immobilized Ni(II), Co(II) and Fe(II) complexes have been synthesized and characterized using FT-IR, TGA, XRD, TEM, SEM-EDX, ICP-AES, and BET analyses. Both the nature of the support and metal atom influence the physical properties of the materials. In general, the SBA-15 immobilized systems exhibit large pore sizes and lower surface areas compared to the MCM-41 supported catalysts. Activation of the immobilized complexes with EtAlCl2 as co-catalyst afford active catalysts in ethylene oligomerization reactions to give predominantly C6 oligomers. The physical properties of the materials influenced both their catalytic activities and selectivity in the ethylene oligomerization reactions. The higher catalytic activities and lower fractions of the C6 oligomer fractions of the SBA-15 immobilized catalysts confirm that the reactions occur within the pores of the materials rather than on the surface. The immobilized complexes were used in three consecutive cycles with minimum reductions in catalytic activities and selectivity. The SBA-15 support imparted better stability and recycling efficiencies of the catalysts. Losses in active metal atom and structural changes to the materials may be implicated in the reductions in catalytic activities in the recycling experiments. Credit author statement Makhosonke Ngcobo: Investigation, experimental work, validation, software, formal analyses, drafting of the original manuscript; Alina Ouissa: Experimental work, validation, software, formal analyses, manuscript draft; Wolfgang Kleist: Supervision, resources, manuscript draft; Werner R. Thiel: Supervision, resources, manuscript draft; Stephen O. Ojwach: Supervision, resources, review and editing of the draft, corresponding author. Declaration of Competing Interest The authors declare that they have no known competing financial interests or personal relationships that could have appeared to influence the work reported in this paper. Acknowledgements The authors are thankful to the University of KwaZulu-Natal for research facilities and the financial support from the National Research Fund (South Africa) is acknowledged. The authors would also like to thank SFB TRR-88 for the financial support to SO during his sabbatical at RPTU. Benjamin Heider (RPTU) is acknowledged for performing the thermogravimetric measurements. Supplementary materials Supplementary material associated with this article can be found, in the online version, at doi:10.1016/j.mcat.2023.113465. Appendix Supplementary materials Supplementary materials contain additional synthetic procedures, NMR, IR, and MS spectra of the ligands, TGA chromatograms, PXRD, EDX, phsisorption data of the materials with immobilized complexes. The supplementary information also contains GC and GC–MS characterization of ethylene oligomerization products and additional catalysis results. Image, application 1 References [1] H. Zhang X. Li Y. Zhang S. Lin G. Li L. Chen Y. Fang H. Xin X. Li Ethylene oligomerization over heterogeneous catalysts Energy Environ. Focus. 3 2014 246 256 H. Zhang, X. Li, Y. Zhang, S. Lin, G. Li, L. Chen, Y. Fang, H. Xin, X. Li, Ethylene oligomerization over heterogeneous catalysts, Energy Environ. Focus., 3 (2014) 246–256. [2] K.P. Bryliakov A.A. Antonov Recent progress of transition metal based catalysts for the selective dimerization of ethylene J. Organomet. Chem. 867 2018 55 61 K.P. Bryliakov, A.A. Antonov, Recent progress of transition metal based catalysts for the selective dimerization of ethylene, J. Organomet. Chem., 867 (2018) 55–61. [3] N. Ajellal M.C.A. Kuhn A.D.G. Boff M. Hoener C.M. Thomas J.-F. Carpentier O.L. Casagrande Jr. Nickel complexes based on tridentate pyrazolyl ligands for highly efficient dimerization of ethylene to 1-butene Organometallics 25 2006 1213 1216 N. Ajellal, M.C.A. Kuhn, A.D.G. Boff, M. Hoener, C.M. Thomas, J.-F. Carpentier, O.L. Casagrande Jr., Nickel complexes based on tridentate pyrazolyl ligands for highly efficient dimerization of ethylene to 1-butene., Organometallics, 25 (2006) 1213–1216. [4] A. Boudier P.R. Breuil L. Magna H. Olivier-Bourbigou P. Braunstein Nickel(II) complexes with imino-imidazole chelating ligands bearing pendant donor groups (SR, OR, NR2, PR2) as precatalysts in ethylene oligomerization J. Organomet. Chem. 718 2012 31 37 A. Boudier, P.R. Breuil, L. Magna, H. Olivier-Bourbigou, Braunstein, P., Nickel(II) complexes with imino-imidazole chelating ligands bearing pendant donor groups (SR, OR, NR2, PR2) as precatalysts in ethylene oligomerization., J. Organomet. Chem., 718 (2012) 31–37. [5] Q.Z. Yang A. Kermagoret M. Agostinho O. Siri P. Braunstein Nickel complexes with functional zwitterionic N,O-benzoquinonemonoimine-type ligands: syntheses, structures, and catalytic oligomerization of ethylene Organometallics 25 2006 5518 5527 Q.Z. Yang, A. Kermagoret, M. Agostinho, O. Siri, P. Braunstein, Nickel complexes with functional zwitterionic N,O-benzoquinonemonoimine-type ligands: syntheses, structures, and catalytic oligomerization of ethylene, Organometallics., 25 (2006) 5518–5527. [6] S. Rezaei A. Ghorbani-Choghamarani R. Badri Schiff base complex of palladium immobilized on magnetic nanoparticles: an efficient and recyclable nanocatalyst for C-C coupling reactions Appl. Organometal. Chem. 30 2016 985 990 S. Rezaei, A. Ghorbani-Choghamarani, R. Badri, Schiff base complex of palladium immobilized on magnetic nanoparticles: an efficient and recyclable nanocatalyst for C-C coupling reactions., Appl. Organometal. Chem., 30 (2016) 985–990. [7] M.J. Wulfers R.F. Lobo Assessment of mass transfer limitations in oligomerization of butene at high pressure on H-beta Appl. Catal. A: Gen. 505 2015 394 401 M.J. Wulfers, R.F. Lobo, Assessment of mass transfer limitations in oligomerization of butene at high pressure on H-beta., Appl. Catal. A: Gen., 505 (2015) 394–401. [8] A. Finiels F. Fajula V. Hulea Nickel-based solid catalysts for ethylene oligomerization – a review Catal. Sci. Technol. 4 2014 2412 2426 A. Finiels, F. Fajula, V. Hulea, Nickel-based solid catalysts for ethylene oligomerization – a review, Catal. Sci. Technol., 4 (2014) 2412–2426. [9] G.G. Hlatky Heterogeneous single-site catalysts for olefin polymerization Chem. Rev. 100 2000 1347 1376 G.G. Hlatky, Heterogeneous single-site catalysts for olefin polymerization, Chem. Rev., 100 (2000) 1347–1376. [10] A.P. Wight M.E. Davis Design and preparation of organic-inorganic hybrid catalysts Chem . Rev. 102 2002 3589 3614 A.P. Wight, M.E. Davis, Design and preparation of organic-inorganic hybrid catalysts, Chem . Rev., 102 (2002) 3589–3614. [11] X.S. Zhao X.Y. Bao W. Guo F.Y. Lee Immobilizing catalysts on porous materials Mater. Today 9 2006 32 39 X.S. Zhao, X.Y. Bao, W. Guo, F.Y. Lee, Immobilizing catalysts on porous materials, Mater. Today, 9 (2006) 32–39. [12] S. Desphande D. Scrinivas P. Ratnasamy Zeolite Encapsulated Metal Complexes and Their Catalytic Activities J. Catal. 188 1999 261 263 S. Desphande, D. Scrinivas, P. Ratnasamy, Zeolite Encapsulated Metal Complexes and Their Catalytic Activities, J. Catal., 188 (1999) 261–263. [13] M. Shin H. Jeong M.-J. Park Y.-W. Suh Benefits of the SiO2-supported nickel phosphide catalyst on ethylene oligomerization Appl. Catal. A: Gen. 591 2020 117376 M. Shin, H. Jeong, M.-J. Park, Y.-W. Suh, Benefits of the SiO2-supported nickel phosphide catalyst on ethylene oligomerization, Appl. Catal. A: Gen., 591 (2020) 117376. [14] M.J. Kim S. Ahn J. Yi J.T. Hupp J.M. Notestein O.K. Farha S.J. Lee Ni(ii) complex on a bispyridine-based porous organic polymer as a heterogeneous catalyst for ethylene oligomerization Catal. Sci. Technol. 7 2017 4351 4354 M.J. Kim, S. Ahn, J. Yi, J.T. Hupp, J.M. Notestein, O.K. Farha, S.J. Lee, Ni(ii) complex on a bispyridine-based porous organic polymer as a heterogeneous catalyst for ethylene oligomerization., Catal. Sci. Technol., 7 (2017) 4351–4354. [15] V. Lecocq H.O. Bourbigou Biphasic Ni-Catalyzed Ethylene Oligomerization in Ionic Liquids Oil Gas Sci. Technol. 62 2007 761 773 V. Lecocq, H.O. Bourbigou, Biphasic Ni-Catalyzed Ethylene Oligomerization in Ionic Liquids, Oil Gas Sci. Technol., 62 (2007) 761–773. [16] F.F. Karbach, Silica-supported catalysts for ethylene oligomerization, (2004) 15–21. [17] M. Weck C.W. Jones Mizoroki-Heck Coupling using immobilized molecular pre-catalysts: leaching active species from Pd pincers, entrapped Pd salts, and Pd NHC complexes Inorg. Chem. 46 2007 1865 1875 M. Weck, C.W. Jones, Mizoroki-Heck Coupling using immobilized molecular pre-catalysts: leaching active species from Pd pincers, entrapped Pd salts, and Pd NHC complexes, Inorg. Chem., 46 (2007) 1865–1875. [18] E.A. Cagnola M.E. Quiroga D.A. Liprandi P.C. L'Argentiere Immobilized Rh, Ru, Pd and Ni complexes as catalysts in the hydrogenation of cyclohexene Appl. Catal. A: Gen. 274 2004 205 212 E.A. Cagnola, M.E. Quiroga, D.A. Liprandi, P.C. L'Argentiere, Immobilized Rh, Ru, Pd and Ni complexes as catalysts in the hydrogenation of cyclohexene Appl. Catal. A: Gen., 274 (2004) 205–212. [19] S.M. Islam M. Mobarok P. Mondal S.A. Roy N. Salam D. Hossain S. Mondal Use of immobilized transition metal complexes as recyclable catalysts for oxidation reactions with hydrogen peroxide as oxidant Transit. Met. Chem. 37 2012 97 107 S.M. Islam, M. Mobarok, P. Mondal, S.A. Roy, N. Salam, D. Hossain, S. Mondal, Use of immobilized transition metal complexes as recyclable catalysts for oxidation reactions with hydrogen peroxide as oxidant, Transit. Met. Chem., 37 (2012) 97–107. [20] K. Kumar T. Godeto J. Darkwa Tandem ethylene dimerization and Friedel-Crafts alkylation of toluene catalyzed by homo- and heterogeneous nickel(II) and palladium(II) pre-catalysts J. Organomet. Chem. 818 2016 137 144 K. Kumar, T. Godeto, J. Darkwa, Tandem ethylene dimerization and Friedel-Crafts alkylation of toluene catalyzed by homo- and heterogeneous nickel(II) and palladium(II) pre-catalysts, J. Organomet. Chem., 818 (2016) 137–144. [21] E. Rossetto B.P. Nicola R.F. de Souza K. Bernardo-Gusmao S.B.C. Pergher Anchoring via covalent binding of beta-diimine-nickel complexes in SBA-15 and its application in catalytic reactions Appl. Catal. A: Gen. 502 2015 221 229 E. Rossetto, B.P. Nicola, R.F. de Souza, K. Bernardo-Gusmao, S.B.C. Pergher, Anchoring via covalent binding of beta-diimine-nickel complexes in SBA-15 and its application in catalytic reactions, Appl. Catal. A: Gen., 502 (2015) 221–229. [22] C. Huang V.A. Zakharov N.V. Semikolenove M.A. Matsko Q. Mahmood E.P. Talsi W.-H. Sun Comparisons between homogeneous and immobilized 1-(2,6-dibenzhydryl-4-nitrophenylimino)-2 mesityliminoacenaphthylnickel bromide as a precatalyst in ethylene polymerization J. Catal. 372 2019 103 108 C. Huang, V.A. Zakharov, N.V. Semikolenove, M.A. Matsko, Q. Mahmood, E.P. Talsi, W.-H. Sun, Comparisons between homogeneous and immobilized 1-(2,6-dibenzhydryl-4-nitrophenylimino)-2 mesityliminoacenaphthylnickel bromide as a precatalyst in ethylene polymerization, J. Catal., 372 (2019) 103–108. [23] V.A. Tuskaev S.V. Zubkevich D. Saracheno S.C. Gagieva P.V. Dorovatovskii E.G. Kononova V.N. Khrustalev D.N. Zarubin B.M. Bulychev Y.V. Kissin Nickel(II) complexes with tripodal NNN ligands as homogenous and supported catalysts for ethylene oligomerization J. Mol. Catal. 464 2019 29 38 V.A. Tuskaev, S.V. Zubkevich, D. Saracheno, S.C. Gagieva, P.V. Dorovatovskii, E.G. Kononova, V.N. Khrustalev, D.N. Zarubin, B.M. Bulychev, Y.V. Kissin, Nickel(II) complexes with tripodal NNN ligands as homogenous and supported catalysts for ethylene oligomerization, J. Mol. Catal., 464 (2019) 29–38. [24] M. Ngcobo S. Ojwach Nickel(II) complexes chelated by N^N (benzimidazolylmethyl)amine ligands: synthesis and catalytic behavior in tandem ethylene oligomerization and Friedel-crafts alkylation reactions Inorg. Chim. Acta. 467 2017 1 5 M. Ngcobo, S. Ojwach, Nickel(II) complexes chelated by N^N (benzimidazolylmethyl)amine ligands: synthesis and catalytic behavior in tandem ethylene oligomerization and Friedel-crafts alkylation reactions., Inorg. Chim. Acta., 467 (2017) 1–5. [25] G.S. Nyamato S.O. Ojwach M.P. Akerman Potential hemilabile (Iminopyridine Palladium(II) complexes as selective Ethylene dimerization catalysts: an experimental and theoretical approach Organometallics 34 2015 5647 5657 Nyamato G.S., S.O. Ojwach, M.P. Akerman, Potential hemilabile (Iminopyridine Palladium(II) complexes as selective Ethylene dimerization catalysts: an experimental and theoretical approach, Organometallics., 34 (2015) 5647–5657. [26] G.S. Nyamato S.O. Ojwach M.P. Akerman Unsymmetrical (pyrazolylmethyl)pyridine metal complexes as catalysts for ethylene oligomerization reactions: role of solvent and co-catalyst in product distribution J. Mol. Catal. A: Chem. 394 2014 274 282 G.S. Nyamato, S.O. Ojwach, M.P. Akerman, Unsymmetrical (pyrazolylmethyl)pyridine metal complexes as catalysts for ethylene oligomerization reactions: role of solvent and co-catalyst in product distribution., J. Mol. Catal. A: Chem., 394 (2014) 274–282. [27] S.O. Ojwach I.A. Guzei L.L. Benade S.F. Mapolie J. Darkwa Pyrazol-1-ylmethyl)pyridine nickel complexes: ethylene oligomerization and unusual Friedel-Crafts alkylation catalysts Organometallics 28 2009 2127 2133 S.O. Ojwach, I.A. Guzei, L.L. Benade, S.F. Mapolie, J. Darkwa, (Pyrazol-1-ylmethyl)pyridine nickel complexes: ethylene oligomerization and unusual Friedel-Crafts alkylation catalysts., Organometallics., 28 (2009) 2127–2133. [28] M. Ngcobo S.O. Ojwach Ethylene oligomerization reactions catalyzed by recyclable Fe(II), Ni(II) and Co(II) complexes immobilized on Fe3O4 magnetic nanoparticles Mol. Catal. 508 2021 111583 M. Ngcobo, S.O. Ojwach, Ethylene oligomerization reactions catalyzed by recyclable Fe(II), Ni(II) and Co(II) complexes immobilized on Fe3O4 magnetic nanoparticles., Mol. Catal., 508 (2021) 111583. [29] A. Jayamani G.S. Nyamato S.O. Ojwach Ethylene oligomerization reactions catalyzed by homogeneous and silica immobilized NˆO Fe(II) and Co(II) complexes J. Organomet. Chem. 903 2019 120987 A. Jayamani, G.S. Nyamato, S.O. Ojwach, Ethylene oligomerization reactions catalyzed by homogeneous and silica immobilized NˆO Fe(II) and Co(II) complexes, J. Organomet. Chem., 903 (2019) 120987. [30] D. Bradley G. Williams M. Lawton Drying of organic solvents: quantitative evaluation of the efficiency of several desiccants J. Org. Chem. 2010 D. Bradley, G. Williams, M. Lawton, Drying of organic solvents: quantitative evaluation of the efficiency of several desiccants, J. Org. Chem., (2010). [31] K. Rome A. Mclntyre Chromatography Today 52 2012 K. Rome, Mclntyre, A., Chromatography Today., 52 (2012). [32] M. Ngcobo G.S. Nyamato S.O. Ojwach Structural elucidation of N^O (ethylimino-methyl)phenol Fe(II) and Co(II) complexes and their applications in ethylene oligomerization catalysis Mol. Catal. 478 2019 110590 M. Ngcobo, G.S. Nyamato, S.O. Ojwach, Structural elucidation of N^O (ethylimino-methyl)phenol Fe(II) and Co(II) complexes and their applications in ethylene oligomerization catalysis, Mol. Catal., 478 (2019) 110590. [33] B.A.T. Mehrabadi S. Eskandari U. Khan R.D. White J.R. Regalbuto A review of preparation methods for supported metal catalysts Adv. Catal. 61 2017 1 35 B.A.T. Mehrabadi, S. Eskandari, U. Khan, R.D. White, J.R. Regalbuto, A review of preparation methods for supported metal catalysts, Adv. Catal., 61 (2017) 1–35. [34] S. Wei Z. Ma P. Wang Z. Dong J. Ma Anchoring of palladium (II) in functionalized SBA-16: an efficient heterogeneous catalyst for Suzuki coupling reaction J. Mol. Catal: A Chem. 370 2013 175 181 S. Wei, Z. Ma, P. Wang, Z. Dong, J. Ma, Anchoring of palladium (II) in functionalized SBA-16: an efficient heterogeneous catalyst for Suzuki coupling reaction, J. Mol. Catal: A Chem., 370 (2013) 175–181. [35] H.P. Lin S.T. Wong C.Y. Mou C.Y. Tang Extenxive void defects in mesoporous aluminosilicate MCM-41 J. Phys. Chem. B 104 2000 8967 8975 H.P. Lin, S.T. Wong, C.Y. Mou, C.Y. Tang, Extenxive void defects in mesoporous aluminosilicate MCM-41, J. Phys. Chem. B, 104 (2000) 8967–8975. [36] T. Van Western R.D. Groot Effect of temperature cycling on Ostwald ripening Cryst. Growth Des. 18 2018 4952 4962 T. Van Western, R.D. Groot, Effect of temperature cycling on Ostwald ripening, Cryst. Growth Des., 18 (2018) 4952–4962. [37] E. Rossetto B.P. Nicola R.F. de Souza K. Bernardo-Gusmao S.B.C. Pergher Heterogeneous complexes of nickel MCM-41 with beta-diimine ligands: applications in olefin oligomerization J. Catal. 323 2015 45 54 E. Rossetto, B.P. Nicola, R.F. de Souza, K. Bernardo-Gusmao, S.B.C. Pergher, Heterogeneous complexes of nickel MCM-41 with beta-diimine ligands: applications in olefin oligomerization, J. Catal., 323 (2015) 45–54. [38] L.M. Shozi V.D.B.C. Dasireddy S. Singh P. Mohlala D.J. Morgan H.B. Friedrich Hydrogenolysis of glycerol to monoalcohols over supported Mo and W catalysts ACS. Sustainable Chem. Eng. 4 2016 5752 5760 L.M. Shozi, V.D.B.C. Dasireddy, S. Singh, P. Mohlala, D.J. Morgan, H.B. Friedrich, Hydrogenolysis of glycerol to monoalcohols over supported Mo and W catalysts, ACS. Sustainable Chem. Eng., 4 (2016) 5752–5760. [39] T.S.B. Barbosa T.R.B. Barros T.L.A. Barbosa M.G.F. Rodrigues Green synthesis of MCM-41 and SBA-15 silica using waste mother liquor Silicon 14 2022 6233 6243 T.S.B. Barbosa, T.R.B. Barros, T.L.A. Barbosa, M.G.F. Rodrigues, Green synthesis of MCM-41 and SBA-15 silica using waste mother liquor, Silicon, 14 (2022) 6233–6243. [40] M.O. de Souza L.R. Rodrigues R.M. Gauvin F.R. de Souza H.O. Pastore L. Gengembre J.A.C. Ruiz J.M.R. Gallo T.S. Milanes M.A. Milani Support effect in ethylene oligomerization mediated by heterogenized nickel catalysts Catal. Commun. 11 2010 597 600 M.O. de Souza, L.R. Rodrigues, R.M. Gauvin, F.R. de Souza, H.O. Pastore, L. Gengembre, J.A.C. Ruiz, J.M.R. Gallo, T.S. Milanes, M.A. Milani, Support effect in ethylene oligomerization mediated by heterogenized nickel catalysts, Catal. Commun., 11 (2010) 597–600. [41] M. Lallemand A. Finiels F. Fajula V. Hulea Continuous stirred tank reactor for ethylene oligomerization catalyzed by NiMCM-41 J. Chem. Eng. 172 2011 1078 1082 M. Lallemand, A. Finiels, F. Fajula, V. Hulea, Continuous stirred tank reactor for ethylene oligomerization catalyzed by NiMCM-41, J. Chem. Eng., 172 (2011) 1078–1082. [42] A.N. Mlinar S. Shylesh C.O. Ho A.T. Bell Propene Oligomerization using Alkali Metal- and Nickel-Exchanged Mesoporous Aluminosilicate Catalysts ACS. Catal. 4 2014 337 343 A.N. Mlinar, S. Shylesh, C.O. Ho, A.T. Bell, Propene Oligomerization using Alkali Metal- and Nickel-Exchanged Mesoporous Aluminosilicate Catalysts, ACS. Catal., 4 (2014) 337–343. [43] D.Y. Shin J.H. Yoon H. Baik S.J. Lee A way to avoid polymeric side products during the liquid-phase ethylene oligomerization with SBA-15 supported (bpy)Ni(II)Cl2 heterogeneous catalyst Appl. Catal. A: Gen. 590 2020 117363 D.Y. Shin, J.H. Yoon, H. Baik, S.J. Lee, A way to avoid polymeric side products during the liquid-phase ethylene oligomerization with SBA-15 supported (bpy)Ni(II)Cl2 heterogeneous catalyst, Appl. Catal. A: Gen., 590 (2020) 117363. [44] L.Y. Jaramillo W. Henao M. Romero-Saez Synthesis and characterization of MCM-41-SBA-15 mixed-phase silica with trimodal mesoporous system and thick pore wall J. Porous Mater. 27 2020 1669 1676 L.Y. Jaramillo, W. Henao, M. Romero-Saez, Synthesis and characterization of MCM-41-SBA-15 mixed-phase silica with trimodal mesoporous system and thick pore wall, J. Porous Mater., 27 (2020) 1669–1676. [45] C.-Y. Guo H. Xu M. Zhang X. Zhang F. Yan G. Yuan Immobilization of bis(imino)pyridine iron complexes onto mesoporous molecular sieves and their catalytic performance in ethylene oligomerization Catal. Commun. 10 2009 1467 1471 C.-Y. Guo, H. Xu, M. Zhang, X. Zhang, F. Yan, G. Yuan, Immobilization of bis(imino)pyridine iron complexes onto mesoporous molecular sieves and their catalytic performance in ethylene oligomerization, Catal. Commun., 10 (2009) 1467–1471. [46] D. Chan S. Tischer J. Heck C. Diehm O. Deutschmann Correlation between activity and catalytic surface area of a Pt/Al2O3 DOC: an experimental and microkinetic modelling study Appl. Catal. B 156-157 2014 153 165 D. Chan, S. Tischer, J. Heck, C. Diehm, O. Deutschmann, Correlation between activity and catalytic surface area of a Pt/Al2O3 DOC: an experimental and microkinetic modelling study, Appl. Catal. B, 156-157 (2014) 153–165. [47] P. Huo P. Kumar B. Liu The mechanism of adsorption, diffusion, and photocatalytic reaction of organic molecules on TiO2 revealed by means of on-site scanning tunneling microscopy observations Catalysts 8 2018 616 P. Huo, P. Kumar, B. Liu, The mechanism of adsorption, diffusion, and photocatalytic reaction of organic molecules on TiO2 revealed by means of on-site scanning tunneling microscopy observations, Catalysts, 8 (2018) 616. [48] G.J.P. Britovsek S. Mastrolanni G.A. Solan S.P.D. Bough C. Redshaw V.C. Gibson A.J.P. White D.J. Williams M.R.J Elsegood Oligomerization of ethylene by bis(imino)pyridyliron and -cobalt complexes J. Chem. Eur. 6 2000 2221 2231 G.J.P. Britovsek, Mastrolanni, S., Solan, G.A., Bough, S.P.D., Redshaw, C., Gibson, V.C., White, A.J.P., Williams, D.J., Elsegood, M.R.J, Oligomerization of ethylene by bis(imino)pyridyliron and -cobalt complexes, J. Chem. Eur., 6 (2000) 2221–2231. [49] R. Schmidt U. Hammon S. Gottfried M.B. Welch H.G. Alt Iron(II)-based catalysts for ethene oligomerization J. Appl. Polym. Sci. 88 2003 476 482 R. Schmidt, U. Hammon, S. Gottfried, M.B. Welch, H.G. Alt, Iron(II)-based catalysts for ethene oligomerization, J. Appl. Polym. Sci., 88 (2003) 476–482. [50] Y. Huang R. Zhang T. Liang X. Hu G. Solan A.W.-H. Sun Selectivity effects on N,N,N'‑cobalt catalyzed ethylene dimerization/trimerization dictated through choice of aluminoxane cocatalyst Organometallics 38 2019 1143 1150 Y. Huang, R. Zhang, T. Liang, X. Hu, G. Solan, A.W.-H. Sun, Selectivity effects on N,N,N'‑cobalt catalyzed ethylene dimerization/trimerization dictated through choice of aluminoxane cocatalyst, Organometallics, 38 (2019) 1143–1150. [51] F.A. Kaul G.T. Puchta H. Schneider F. Bielert D. Mihalios W.A. Herrmann Organometallics 21 2002 74 82 F.A. Kaul, G.T. Puchta, H. Schneider, F. Bielert, D. Mihalios, W.A. Herrmann, Organometallics 21 (2002), 74–82.",
      "scopus-id": "85167978054",
      "coredata": {
        "eid": "1-s2.0-S2468823123005485",
        "dc:description": "Immobilization of the phenol((triethoxysilyl)propylimino) ligand (LH) on SBA15 and MCM41 afforded the ligands LH-SBA15 and LH-MCM41 respectively. The reactions of LH-SBA15 and LH-MCM41 with NiCl2, CoCl2 and FeCl2 salts produced the respective materials [Ni(LH-SBA15)2Cl2], (Ni-SBA15), [Co(LHSBA15)2Cl2], (Co-SBA15), [Fe(LH-SBA15)2Cl2], (Fe-SBA15) and [Ni(LH-MCM41)2Cl2], (Ni-MCM41) in good yields. The functional group determination, morphology, physical and surfaced properties of the materials containing immobilized ligands and complexes were established from FT-IR, TGA, TEM, SEM-EDX, PXRD, ICP-AES, and nitrogen physisorption measurement techniques. Activation of the complexes on the surface with EtAlCl2 as co-catalyst formed active catalysts for the oligomerization of ethylene affording mainly C6 oligomers. The SBA-15 immobilized catalysts were more active than the corresponding MCM-41 materials, while Ni(II) catalysts performed better than the corresponding Co(II) and Fe(II) systems. The immobilized catalysts could be used in three cycles without significant loss of catalytic activity and selectivity.",
        "openArchiveArticle": "false",
        "prism:coverDate": "2023-10-31",
        "openaccessUserLicense": "http://creativecommons.org/licenses/by-nc-nd/4.0/",
        "prism:aggregationType": "Journal",
        "prism:url": "https://api.elsevier.com/content/article/pii/S2468823123005485",
        "dc:creator": [
          {
            "@_fa": "true",
            "$": "Ngcobo, Makhosonke"
          },
          {
            "@_fa": "true",
            "$": "Ouissa, Alina"
          },
          {
            "@_fa": "true",
            "$": "Kleist, Wolfgang"
          },
          {
            "@_fa": "true",
            "$": "Thiel, Werner R."
          },
          {
            "@_fa": "true",
            "$": "Ojwach, Stephen O."
          }
        ],
        "link": [
          {
            "@_fa": "true",
            "@rel": "self",
            "@href": "https://api.elsevier.com/content/article/pii/S2468823123005485"
          },
          {
            "@_fa": "true",
            "@rel": "scidir",
            "@href": "https://www.sciencedirect.com/science/article/pii/S2468823123005485"
          }
        ],
        "dc:format": "application/json",
        "openaccessType": "Full",
        "pii": "S2468-8231(23)00548-5",
        "prism:volume": "549",
        "articleNumber": "113465",
        "prism:publisher": "The Author(s). Published by Elsevier B.V.",
        "dc:title": "Regulating the physical properties of silica immobilized Fe(II), Ni(II) and Co(II) catalysts towards ethylene oligomerization reactions",
        "prism:copyright": "© 2023 The Author(s). Published by Elsevier B.V.",
        "openaccess": "1",
        "prism:issn": "24688231",
        "dcterms:subject": [
          {
            "@_fa": "true",
            "$": "Metal catalysts"
          },
          {
            "@_fa": "true",
            "$": "Immobilization"
          },
          {
            "@_fa": "true",
            "$": "Silica"
          },
          {
            "@_fa": "true",
            "$": "Ethylene oligomerization"
          },
          {
            "@_fa": "true",
            "$": "Recycling"
          }
        ],
        "openaccessArticle": "true",
        "prism:publicationName": "Molecular Catalysis",
        "openaccessSponsorType": "FundingBody",
        "prism:pageRange": "113465",
        "pubType": "fla",
        "prism:coverDisplayDate": "October 2023",
        "prism:doi": "10.1016/j.mcat.2023.113465",
        "prism:startingPage": "113465",
        "dc:identifier": "doi:10.1016/j.mcat.2023.113465",
        "openaccessSponsorName": "SANLIC (South African Consortium) – Hybrid"
      },
      "objects": {
        "object": [
          {
            "@category": "standard",
            "@height": "493",
            "@width": "809",
            "@_fa": "true",
            "$": "https://api.elsevier.com/content/object/eid/1-s2.0-S2468823123005485-gr1.jpg?httpAccept=%2A%2F%2A",
            "@multimediatype": "JPEG image file",
            "@type": "IMAGE-DOWNSAMPLED",
            "@size": "105655",
            "@ref": "gr1",
            "@mimetype": "image/jpeg"
          },
          {
            "@category": "standard",
            "@height": "602",
            "@width": "809",
            "@_fa": "true",
            "$": "https://api.elsevier.com/content/object/eid/1-s2.0-S2468823123005485-gr2.jpg?httpAccept=%2A%2F%2A",
            "@multimediatype": "JPEG image file",
            "@type": "IMAGE-DOWNSAMPLED",
            "@size": "180569",
            "@ref": "gr2",
            "@mimetype": "image/jpeg"
          },
          {
            "@category": "standard",
            "@height": "99",
            "@width": "143",
            "@_fa": "true",
            "$": "https://api.elsevier.com/content/object/eid/1-s2.0-S2468823123005485-fx1.jpg?httpAccept=%2A%2F%2A",
            "@multimediatype": "JPEG image file",
            "@type": "IMAGE-DOWNSAMPLED",
            "@size": "4024",
            "@ref": "fx1",
            "@mimetype": "image/jpeg"
          },
          {
            "@category": "standard",
            "@height": "220",
            "@width": "584",
            "@_fa": "true",
            "$": "https://api.elsevier.com/content/object/eid/1-s2.0-S2468823123005485-sc2.jpg?httpAccept=%2A%2F%2A",
            "@multimediatype": "JPEG image file",
            "@type": "IMAGE-DOWNSAMPLED",
            "@size": "23778",
            "@ref": "sc2",
            "@mimetype": "image/jpeg"
          },
          {
            "@category": "standard",
            "@height": "93",
            "@width": "186",
            "@_fa": "true",
            "$": "https://api.elsevier.com/content/object/eid/1-s2.0-S2468823123005485-fx6.jpg?httpAccept=%2A%2F%2A",
            "@multimediatype": "JPEG image file",
            "@type": "IMAGE-DOWNSAMPLED",
            "@size": "4467",
            "@ref": "fx6",
            "@mimetype": "image/jpeg"
          },
          {
            "@category": "standard",
            "@height": "196",
            "@width": "500",
            "@_fa": "true",
            "$": "https://api.elsevier.com/content/object/eid/1-s2.0-S2468823123005485-ga1.jpg?httpAccept=%2A%2F%2A",
            "@multimediatype": "JPEG image file",
            "@type": "IMAGE-DOWNSAMPLED",
            "@size": "27495",
            "@ref": "ga1",
            "@mimetype": "image/jpeg"
          },
          {
            "@category": "standard",
            "@height": "271",
            "@width": "395",
            "@_fa": "true",
            "$": "https://api.elsevier.com/content/object/eid/1-s2.0-S2468823123005485-gr3.jpg?httpAccept=%2A%2F%2A",
            "@multimediatype": "JPEG image file",
            "@type": "IMAGE-DOWNSAMPLED",
            "@size": "29549",
            "@ref": "gr3",
            "@mimetype": "image/jpeg"
          },
          {
            "@category": "standard",
            "@height": "246",
            "@width": "396",
            "@_fa": "true",
            "$": "https://api.elsevier.com/content/object/eid/1-s2.0-S2468823123005485-gr4.jpg?httpAccept=%2A%2F%2A",
            "@multimediatype": "JPEG image file",
            "@type": "IMAGE-DOWNSAMPLED",
            "@size": "24790",
            "@ref": "gr4",
            "@mimetype": "image/jpeg"
          },
          {
            "@category": "standard",
            "@height": "160",
            "@width": "339",
            "@_fa": "true",
            "$": "https://api.elsevier.com/content/object/eid/1-s2.0-S2468823123005485-gr5.jpg?httpAccept=%2A%2F%2A",
            "@multimediatype": "JPEG image file",
            "@type": "IMAGE-DOWNSAMPLED",
            "@size": "22626",
            "@ref": "gr5",
            "@mimetype": "image/jpeg"
          },
          {
            "@category": "standard",
            "@height": "110",
            "@width": "160",
            "@_fa": "true",
            "$": "https://api.elsevier.com/content/object/eid/1-s2.0-S2468823123005485-fx2.jpg?httpAccept=%2A%2F%2A",
            "@multimediatype": "JPEG image file",
            "@type": "IMAGE-DOWNSAMPLED",
            "@size": "4532",
            "@ref": "fx2",
            "@mimetype": "image/jpeg"
          },
          {
            "@category": "standard",
            "@height": "211",
            "@width": "728",
            "@_fa": "true",
            "$": "https://api.elsevier.com/content/object/eid/1-s2.0-S2468823123005485-sc1.jpg?httpAccept=%2A%2F%2A",
            "@multimediatype": "JPEG image file",
            "@type": "IMAGE-DOWNSAMPLED",
            "@size": "34078",
            "@ref": "sc1",
            "@mimetype": "image/jpeg"
          },
          {
            "@category": "standard",
            "@height": "112",
            "@width": "202",
            "@_fa": "true",
            "$": "https://api.elsevier.com/content/object/eid/1-s2.0-S2468823123005485-fx3.jpg?httpAccept=%2A%2F%2A",
            "@multimediatype": "JPEG image file",
            "@type": "IMAGE-DOWNSAMPLED",
            "@size": "6894",
            "@ref": "fx3",
            "@mimetype": "image/jpeg"
          },
          {
            "@category": "standard",
            "@height": "86",
            "@width": "165",
            "@_fa": "true",
            "$": "https://api.elsevier.com/content/object/eid/1-s2.0-S2468823123005485-fx4.jpg?httpAccept=%2A%2F%2A",
            "@multimediatype": "JPEG image file",
            "@type": "IMAGE-DOWNSAMPLED",
            "@size": "6403",
            "@ref": "fx4",
            "@mimetype": "image/jpeg"
          },
          {
            "@category": "standard",
            "@height": "67",
            "@width": "202",
            "@_fa": "true",
            "$": "https://api.elsevier.com/content/object/eid/1-s2.0-S2468823123005485-fx5.jpg?httpAccept=%2A%2F%2A",
            "@multimediatype": "JPEG image file",
            "@type": "IMAGE-DOWNSAMPLED",
            "@size": "4455",
            "@ref": "fx5",
            "@mimetype": "image/jpeg"
          },
          {
            "@category": "standard",
            "@height": "99",
            "@width": "197",
            "@_fa": "true",
            "$": "https://api.elsevier.com/content/object/eid/1-s2.0-S2468823123005485-fx7.jpg?httpAccept=%2A%2F%2A",
            "@multimediatype": "JPEG image file",
            "@type": "IMAGE-DOWNSAMPLED",
            "@size": "4742",
            "@ref": "fx7",
            "@mimetype": "image/jpeg"
          },
          {
            "@category": "thumbnail",
            "@height": "133",
            "@width": "219",
            "@_fa": "true",
            "$": "https://api.elsevier.com/content/object/eid/1-s2.0-S2468823123005485-gr1.sml?httpAccept=%2A%2F%2A",
            "@multimediatype": "GIF image file",
            "@type": "IMAGE-THUMBNAIL",
            "@size": "19144",
            "@ref": "gr1",
            "@mimetype": "image/gif"
          },
          {
            "@category": "thumbnail",
            "@height": "163",
            "@width": "219",
            "@_fa": "true",
            "$": "https://api.elsevier.com/content/object/eid/1-s2.0-S2468823123005485-gr2.sml?httpAccept=%2A%2F%2A",
            "@multimediatype": "GIF image file",
            "@type": "IMAGE-THUMBNAIL",
            "@size": "26973",
            "@ref": "gr2",
            "@mimetype": "image/gif"
          },
          {
            "@category": "thumbnail",
            "@height": "152",
            "@width": "219",
            "@_fa": "true",
            "$": "https://api.elsevier.com/content/object/eid/1-s2.0-S2468823123005485-fx1.sml?httpAccept=%2A%2F%2A",
            "@multimediatype": "GIF image file",
            "@type": "IMAGE-THUMBNAIL",
            "@size": "4805",
            "@ref": "fx1",
            "@mimetype": "image/gif"
          },
          {
            "@category": "thumbnail",
            "@height": "82",
            "@width": "219",
            "@_fa": "true",
            "$": "https://api.elsevier.com/content/object/eid/1-s2.0-S2468823123005485-sc2.sml?httpAccept=%2A%2F%2A",
            "@multimediatype": "GIF image file",
            "@type": "IMAGE-THUMBNAIL",
            "@size": "5396",
            "@ref": "sc2",
            "@mimetype": "image/gif"
          },
          {
            "@category": "thumbnail",
            "@height": "109",
            "@width": "219",
            "@_fa": "true",
            "$": "https://api.elsevier.com/content/object/eid/1-s2.0-S2468823123005485-fx6.sml?httpAccept=%2A%2F%2A",
            "@multimediatype": "GIF image file",
            "@type": "IMAGE-THUMBNAIL",
            "@size": "4537",
            "@ref": "fx6",
            "@mimetype": "image/gif"
          },
          {
            "@category": "thumbnail",
            "@height": "86",
            "@width": "219",
            "@_fa": "true",
            "$": "https://api.elsevier.com/content/object/eid/1-s2.0-S2468823123005485-ga1.sml?httpAccept=%2A%2F%2A",
            "@multimediatype": "GIF image file",
            "@type": "IMAGE-THUMBNAIL",
            "@size": "7368",
            "@ref": "ga1",
            "@mimetype": "image/gif"
          },
          {
            "@category": "thumbnail",
            "@height": "150",
            "@width": "219",
            "@_fa": "true",
            "$": "https://api.elsevier.com/content/object/eid/1-s2.0-S2468823123005485-gr3.sml?httpAccept=%2A%2F%2A",
            "@multimediatype": "GIF image file",
            "@type": "IMAGE-THUMBNAIL",
            "@size": "8295",
            "@ref": "gr3",
            "@mimetype": "image/gif"
          },
          {
            "@category": "thumbnail",
            "@height": "136",
            "@width": "219",
            "@_fa": "true",
            "$": "https://api.elsevier.com/content/object/eid/1-s2.0-S2468823123005485-gr4.sml?httpAccept=%2A%2F%2A",
            "@multimediatype": "GIF image file",
            "@type": "IMAGE-THUMBNAIL",
            "@size": "7389",
            "@ref": "gr4",
            "@mimetype": "image/gif"
          },
          {
            "@category": "thumbnail",
            "@height": "104",
            "@width": "219",
            "@_fa": "true",
            "$": "https://api.elsevier.com/content/object/eid/1-s2.0-S2468823123005485-gr5.sml?httpAccept=%2A%2F%2A",
            "@multimediatype": "GIF image file",
            "@type": "IMAGE-THUMBNAIL",
            "@size": "17512",
            "@ref": "gr5",
            "@mimetype": "image/gif"
          },
          {
            "@category": "thumbnail",
            "@height": "151",
            "@width": "219",
            "@_fa": "true",
            "$": "https://api.elsevier.com/content/object/eid/1-s2.0-S2468823123005485-fx2.sml?httpAccept=%2A%2F%2A",
            "@multimediatype": "GIF image file",
            "@type": "IMAGE-THUMBNAIL",
            "@size": "4699",
            "@ref": "fx2",
            "@mimetype": "image/gif"
          },
          {
            "@category": "thumbnail",
            "@height": "64",
            "@width": "219",
            "@_fa": "true",
            "$": "https://api.elsevier.com/content/object/eid/1-s2.0-S2468823123005485-sc1.sml?httpAccept=%2A%2F%2A",
            "@multimediatype": "GIF image file",
            "@type": "IMAGE-THUMBNAIL",
            "@size": "6528",
            "@ref": "sc1",
            "@mimetype": "image/gif"
          },
          {
            "@category": "thumbnail",
            "@height": "121",
            "@width": "219",
            "@_fa": "true",
            "$": "https://api.elsevier.com/content/object/eid/1-s2.0-S2468823123005485-fx3.sml?httpAccept=%2A%2F%2A",
            "@multimediatype": "GIF image file",
            "@type": "IMAGE-THUMBNAIL",
            "@size": "5244",
            "@ref": "fx3",
            "@mimetype": "image/gif"
          },
          {
            "@category": "thumbnail",
            "@height": "114",
            "@width": "219",
            "@_fa": "true",
            "$": "https://api.elsevier.com/content/object/eid/1-s2.0-S2468823123005485-fx4.sml?httpAccept=%2A%2F%2A",
            "@multimediatype": "GIF image file",
            "@type": "IMAGE-THUMBNAIL",
            "@size": "5462",
            "@ref": "fx4",
            "@mimetype": "image/gif"
          },
          {
            "@category": "thumbnail",
            "@height": "73",
            "@width": "219",
            "@_fa": "true",
            "$": "https://api.elsevier.com/content/object/eid/1-s2.0-S2468823123005485-fx5.sml?httpAccept=%2A%2F%2A",
            "@multimediatype": "GIF image file",
            "@type": "IMAGE-THUMBNAIL",
            "@size": "3810",
            "@ref": "fx5",
            "@mimetype": "image/gif"
          },
          {
            "@category": "thumbnail",
            "@height": "110",
            "@width": "219",
            "@_fa": "true",
            "$": "https://api.elsevier.com/content/object/eid/1-s2.0-S2468823123005485-fx7.sml?httpAccept=%2A%2F%2A",
            "@multimediatype": "GIF image file",
            "@type": "IMAGE-THUMBNAIL",
            "@size": "4545",
            "@ref": "fx7",
            "@mimetype": "image/gif"
          },
          {
            "@category": "high",
            "@height": "2183",
            "@width": "3583",
            "@_fa": "true",
            "$": "https://api.elsevier.com/content/object/eid/1-s2.0-S2468823123005485-gr1_lrg.jpg?httpAccept=%2A%2F%2A",
            "@multimediatype": "JPEG image file",
            "@type": "IMAGE-HIGH-RES",
            "@size": "950585",
            "@ref": "gr1",
            "@mimetype": "image/jpeg"
          },
          {
            "@category": "high",
            "@height": "2667",
            "@width": "3583",
            "@_fa": "true",
            "$": "https://api.elsevier.com/content/object/eid/1-s2.0-S2468823123005485-gr2_lrg.jpg?httpAccept=%2A%2F%2A",
            "@multimediatype": "JPEG image file",
            "@type": "IMAGE-HIGH-RES",
            "@size": "1413912",
            "@ref": "gr2",
            "@mimetype": "image/jpeg"
          },
          {
            "@category": "high",
            "@height": "441",
            "@width": "636",
            "@_fa": "true",
            "$": "https://api.elsevier.com/content/object/eid/1-s2.0-S2468823123005485-fx1_lrg.jpg?httpAccept=%2A%2F%2A",
            "@multimediatype": "JPEG image file",
            "@type": "IMAGE-HIGH-RES",
            "@size": "26618",
            "@ref": "fx1",
            "@mimetype": "image/jpeg"
          },
          {
            "@category": "high",
            "@height": "974",
            "@width": "2586",
            "@_fa": "true",
            "$": "https://api.elsevier.com/content/object/eid/1-s2.0-S2468823123005485-sc2_lrg.jpg?httpAccept=%2A%2F%2A",
            "@multimediatype": "JPEG image file",
            "@type": "IMAGE-HIGH-RES",
            "@size": "170347",
            "@ref": "sc2",
            "@mimetype": "image/jpeg"
          },
          {
            "@category": "high",
            "@height": "411",
            "@width": "826",
            "@_fa": "true",
            "$": "https://api.elsevier.com/content/object/eid/1-s2.0-S2468823123005485-fx6_lrg.jpg?httpAccept=%2A%2F%2A",
            "@multimediatype": "JPEG image file",
            "@type": "IMAGE-HIGH-RES",
            "@size": "32647",
            "@ref": "fx6",
            "@mimetype": "image/jpeg"
          },
          {
            "@category": "high",
            "@height": "868",
            "@width": "2213",
            "@_fa": "true",
            "$": "https://api.elsevier.com/content/object/eid/1-s2.0-S2468823123005485-ga1_lrg.jpg?httpAccept=%2A%2F%2A",
            "@multimediatype": "JPEG image file",
            "@type": "IMAGE-HIGH-RES",
            "@size": "145825",
            "@ref": "ga1",
            "@mimetype": "image/jpeg"
          },
          {
            "@category": "high",
            "@height": "1200",
            "@width": "1749",
            "@_fa": "true",
            "$": "https://api.elsevier.com/content/object/eid/1-s2.0-S2468823123005485-gr3_lrg.jpg?httpAccept=%2A%2F%2A",
            "@multimediatype": "JPEG image file",
            "@type": "IMAGE-HIGH-RES",
            "@size": "172216",
            "@ref": "gr3",
            "@mimetype": "image/jpeg"
          },
          {
            "@category": "high",
            "@height": "1089",
            "@width": "1754",
            "@_fa": "true",
            "$": "https://api.elsevier.com/content/object/eid/1-s2.0-S2468823123005485-gr4_lrg.jpg?httpAccept=%2A%2F%2A",
            "@multimediatype": "JPEG image file",
            "@type": "IMAGE-HIGH-RES",
            "@size": "143073",
            "@ref": "gr4",
            "@mimetype": "image/jpeg"
          },
          {
            "@category": "high",
            "@height": "709",
            "@width": "1500",
            "@_fa": "true",
            "$": "https://api.elsevier.com/content/object/eid/1-s2.0-S2468823123005485-gr5_lrg.jpg?httpAccept=%2A%2F%2A",
            "@multimediatype": "JPEG image file",
            "@type": "IMAGE-HIGH-RES",
            "@size": "185267",
            "@ref": "gr5",
            "@mimetype": "image/jpeg"
          },
          {
            "@category": "high",
            "@height": "488",
            "@width": "708",
            "@_fa": "true",
            "$": "https://api.elsevier.com/content/object/eid/1-s2.0-S2468823123005485-fx2_lrg.jpg?httpAccept=%2A%2F%2A",
            "@multimediatype": "JPEG image file",
            "@type": "IMAGE-HIGH-RES",
            "@size": "31325",
            "@ref": "fx2",
            "@mimetype": "image/jpeg"
          },
          {
            "@category": "high",
            "@height": "935",
            "@width": "3222",
            "@_fa": "true",
            "$": "https://api.elsevier.com/content/object/eid/1-s2.0-S2468823123005485-sc1_lrg.jpg?httpAccept=%2A%2F%2A",
            "@multimediatype": "JPEG image file",
            "@type": "IMAGE-HIGH-RES",
            "@size": "251048",
            "@ref": "sc1",
            "@mimetype": "image/jpeg"
          },
          {
            "@category": "high",
            "@height": "496",
            "@width": "897",
            "@_fa": "true",
            "$": "https://api.elsevier.com/content/object/eid/1-s2.0-S2468823123005485-fx3_lrg.jpg?httpAccept=%2A%2F%2A",
            "@multimediatype": "JPEG image file",
            "@type": "IMAGE-HIGH-RES",
            "@size": "49626",
            "@ref": "fx3",
            "@mimetype": "image/jpeg"
          },
          {
            "@category": "high",
            "@height": "380",
            "@width": "733",
            "@_fa": "true",
            "$": "https://api.elsevier.com/content/object/eid/1-s2.0-S2468823123005485-fx4_lrg.jpg?httpAccept=%2A%2F%2A",
            "@multimediatype": "JPEG image file",
            "@type": "IMAGE-HIGH-RES",
            "@size": "29735",
            "@ref": "fx4",
            "@mimetype": "image/jpeg"
          },
          {
            "@category": "high",
            "@height": "300",
            "@width": "898",
            "@_fa": "true",
            "$": "https://api.elsevier.com/content/object/eid/1-s2.0-S2468823123005485-fx5_lrg.jpg?httpAccept=%2A%2F%2A",
            "@multimediatype": "JPEG image file",
            "@type": "IMAGE-HIGH-RES",
            "@size": "35375",
            "@ref": "fx5",
            "@mimetype": "image/jpeg"
          },
          {
            "@category": "high",
            "@height": "438",
            "@width": "872",
            "@_fa": "true",
            "$": "https://api.elsevier.com/content/object/eid/1-s2.0-S2468823123005485-fx7_lrg.jpg?httpAccept=%2A%2F%2A",
            "@multimediatype": "JPEG image file",
            "@type": "IMAGE-HIGH-RES",
            "@size": "34772",
            "@ref": "fx7",
            "@mimetype": "image/jpeg"
          },
          {
            "@category": "standard",
            "@_fa": "true",
            "$": "https://api.elsevier.com/content/object/eid/1-s2.0-S2468823123005485-mmc1.docx?httpAccept=%2A%2F%2A",
            "@multimediatype": "Microsoft Word file",
            "@type": "APPLICATION",
            "@size": "1789140",
            "@ref": "mmc1",
            "@mimetype": "application/word"
          },
          {
            "@category": "standard",
            "@_fa": "true",
            "$": "https://api.elsevier.com/content/object/eid/1-s2.0-S2468823123005485-am.pdf?httpAccept=%2A%2F%2A",
            "@multimediatype": "Acrobat PDF file",
            "@type": "AAM-PDF",
            "@size": "2974770",
            "@ref": "am",
            "@mimetype": "application/pdf"
          }
        ]
      },
      "link": {
        "@rel": "abstract",
        "@href": "https://api.elsevier.com/content/abstract/scopus_id/85167978054"
      }
    }
  }
}