{
  "metadata": {
    "title": "Boosting the low-temperature NH<ce:inf loc=post>3</ce:inf>-SCR performance via metals co-doping with inequality Mn/Ce ratios in the carbon-based catalyst prepared by Cr-containing leather waste",
    "authors": "; ; ",
    "journal": "Molecular Catalysis",
    "date": "2023-12-31",
    "doi": "10.1016/j.mcat.2023.113615",
    "abstract": "",
    "uri": "https://api.elsevier.com/content/article/pii/S2468823123006983",
    "pii": "S2468823123006983"
  },
  "fulltext": {
    "full-text-retrieval-response": {
      "scopus-eid": "2-s2.0-85175189770",
      "originalText": "serial JL 315758 291210 291744 291790 291809 31 Molecular Catalysis MOLECULARCATALYSIS 2023-11-01 2023-11-01 2023-11-01 2023-11-01 2023-11-15T19:32:27 1-s2.0-S2468823123006983 S2468-8231(23)00698-3 S2468823123006983 10.1016/j.mcat.2023.113615 S300 S300.1 FULL-TEXT 1-s2.0-S2468823123X00170 2023-11-15T21:08:15.185706Z 0 0 20231201 20231231 2023 2023-11-01T02:33:23.768062Z absattachment articleinfo articlenumber articletitlenorm authfirstinitialnorm authfirstsurnamenorm cid cids contenttype copyright crossmark dateloaded dateloadedtxt datesearch datesort dateupdated dco docsubtype doctype doi eid ewtransactionid hubeid indexeddate issn issnnorm itemstage itemtransactionid itemweight openaccess openarchive pg pgfirst pii piinorm pubdateend pubdatestart pubdatetxt pubyr sectiontitle sortorder srctitle srctitlenorm srctype ssids alllist content subj subheadings suppl tomb volfirst volissue volumelist webpdf webpdfpagecount yearnav figure table e-component body mmlmath acknowledge affil appendices articletitle auth authfirstini authfull authkeywords authlast highlightsabst orcid primabst ref specialabst 2468-8231 24688231 true 551 551 C Volume 551 25 113615 113615 113615 202312 December 2023 2023-12-01 2023-12-31 2023 Regular Papers article fla © 2023 Elsevier B.V. All rights reserved. BOOSTINGLOWTEMPERATURENH3SCRPERFORMANCEVIAMETALSCODOPINGINEQUALITYMNCERATIOSINCARBONBASEDCATALYSTPREPAREDBYCRCONTAININGLEATHERWASTE XIA Y Introduction Experiment Catalyst synthesis Catalyst activity evaluation Catalyst characterization Results and discussion Catalyst activity Textural characterization SEM and N2 physisorption XRD NH3-TPD analyses H2-TPR and XPS analyses H2-TPR XPS analyses In situ DRIFTS spectra NH3 adsorption In situ DRIFTS study of reaction between NO + O2 and pre-adsorption NH3 In situ DRIFTS study of reaction between NH3 and adsorption NO+O2 Possible mechanism of the catalyst reaction Conclusion CRediT authorship contribution statement Acknowledgments Appendix Supplementary materials References JIANG 2000 Y SHEN 2015 47 53 B 2002 3 15 IZWAN 2018 740 761 A ZHAO 2016 316 322 K YANG 2014 1007 1010 J LIU 2022 528 W ZHU 2023 J YANG 2022 524 Y WANG 2004 445 448 Y LIU 2014 1044 1050 Z HUANG 2006 260 265 Z YANG 2011 71 80 S TANG 2007 406 411 X LI 2013 47 50 X FANG 2016 C PENGPANICH 2002 221 233 S ZHE 2014 1738 1741 X SMIRNIOTIS 2010 P YANG 2016 544 553 P KANG 2006 M LONG 2002 452 453 R WEI 2022 X WANG 2022 118749 M RAJENDRAN 2011 A KANTARLI 2010 348 356 I ZHU 2023 112859 J KOLOMAZNIK 2008 514 520 K ARAGON 2001 624 628 V BUFALO 2020 5374 G SEMIH 2018 1 10 A ZHAO 2019 245 L KENNEDY 2018 930 936 L WEI 2022 316 L JIANG 2019 370 L EH 2022 CHANG 2013 5294 5301 H XIONG 2022 112250 Z WANG 2022 123763 M JIE 2019 122398 Y SU 2020 873 Z MWA 2022 B GONG 2021 28 35 Z WANG 2014 660 669 J JIE 2019 883 891 Y LI 2017 S ANDERSEN 2015 623 627 N GUTIERREZORTIZ 2007 1004 1012 J MEJRI 2016 I CHEN 2017 L VILLAMAINA 2019 R YANG 2020 125446 J ZHANG 2015 589 598 L NINGJIE 2017 328 337 F FAN 2015 232 239 C RAN 2020 Y BONINGARI 2015 T LI 2021 M XIANG 2016 X TANG 2010 871 875 X VENKATASWAMY 2015 P LU 2014 11601 11610 X VENEZIA 2008 430 437 A KAN 2017 530 J LIU 2021 127833 X YANG 2006 8499 8505 S ZHENG 2014 20142 20145 Y YL 2019 268 A SI 2015 Z XIE 2020 S PENG 2019 121593 C GU 2013 30 38 T AMACZ 2013 268 277 A YANG 2022 112769 W XIAX2023X113615 XIAX2023X113615XY 2025-11-01T00:00:00.000Z 2025-11-01T00:00:00.000Z http://creativecommons.org/licenses/by-nc-nd/4.0/ © 2023 Elsevier B.V. All rights reserved. 2023-11-02T17:31:20.068Z http://vtw.elsevier.com/data/voc/AddOnTypes/50.7/aggregated-refined S202210626070 Department of Education of Sichuan Province http://data.elsevier.com/vocabulary/SciValFunders/501100004884 http://sws.geonames.org/1814991 College Students' Innovative Entrepreneurial Training Plan Program This study was supported by the College Students' Innovative Entrepreneurial Training Plan Program (S202210626070). https://doi.org/10.15223/policy-017 https://doi.org/10.15223/policy-037 https://doi.org/10.15223/policy-012 https://doi.org/10.15223/policy-029 https://doi.org/10.15223/policy-004 item S2468-8231(23)00698-3 S2468823123006983 1-s2.0-S2468823123006983 10.1016/j.mcat.2023.113615 315758 2023-11-15T21:08:15.185706Z 2023-12-01 2023-12-31 1-s2.0-S2468823123006983-main.pdf https://s3-eu-west-1.amazonaws.com/prod-ucs-content-store-eu-west/content/pii:S2468823123006983/MAIN/application/pdf/d51560de4a549f219a0f1cc087ce68fe/main.pdf main.pdf pdf true 13853839 MAIN 13 1-s2.0-S2468823123006983-main_1.png https://s3-eu-west-1.amazonaws.com/prod-ucs-content-store-eu-west/content/pii:S2468823123006983/PREVIEW/image/png/f6fcd865618409faf6e970f5974ea018/main_1.png main_1.png png 57004 849 656 IMAGE-WEB-PDF 1 1-s2.0-S2468823123006983-gr2.jpg https://s3-eu-west-1.amazonaws.com/prod-ucs-content-store-eu-west/content/pii:S2468823123006983/gr2/DOWNSAMPLED/image/jpeg/8ccb8a0beb861ec9a16b7fa79cb63cd7/gr2.jpg gr2 gr2.jpg jpg 117050 479 640 IMAGE-DOWNSAMPLED 1-s2.0-S2468823123006983-ga1.jpg https://s3-eu-west-1.amazonaws.com/prod-ucs-content-store-eu-west/content/pii:S2468823123006983/ga1/DOWNSAMPLED/image/jpeg/67a64402b94ba6dbdd899c4ff975e99a/ga1.jpg ga1 true ga1.jpg jpg 31741 200 312 IMAGE-DOWNSAMPLED 1-s2.0-S2468823123006983-gr1.jpg https://s3-eu-west-1.amazonaws.com/prod-ucs-content-store-eu-west/content/pii:S2468823123006983/gr1/DOWNSAMPLED/image/jpeg/5a1db18b116f5a8fd4e0e775e0b0da73/gr1.jpg gr1 gr1.jpg jpg 169853 867 640 IMAGE-DOWNSAMPLED 1-s2.0-S2468823123006983-gr6.jpg https://s3-eu-west-1.amazonaws.com/prod-ucs-content-store-eu-west/content/pii:S2468823123006983/gr6/DOWNSAMPLED/image/jpeg/e243c72d124b0a7c202b3fad90fe31bd/gr6.jpg gr6 gr6.jpg jpg 161061 729 621 IMAGE-DOWNSAMPLED 1-s2.0-S2468823123006983-gr5.jpg https://s3-eu-west-1.amazonaws.com/prod-ucs-content-store-eu-west/content/pii:S2468823123006983/gr5/DOWNSAMPLED/image/jpeg/1e0b5dc2cbae43308ef6c7c0fba1bfaf/gr5.jpg gr5 gr5.jpg jpg 61279 287 615 IMAGE-DOWNSAMPLED 1-s2.0-S2468823123006983-gr8.jpg https://s3-eu-west-1.amazonaws.com/prod-ucs-content-store-eu-west/content/pii:S2468823123006983/gr8/DOWNSAMPLED/image/jpeg/d4de1928d95486a7cd811614d1380cbb/gr8.jpg gr8 gr8.jpg jpg 161202 575 610 IMAGE-DOWNSAMPLED 1-s2.0-S2468823123006983-gr10.jpg https://s3-eu-west-1.amazonaws.com/prod-ucs-content-store-eu-west/content/pii:S2468823123006983/gr10/DOWNSAMPLED/image/jpeg/23f7cee7798b15201cd6321787c66dd5/gr10.jpg gr10 gr10.jpg jpg 45880 259 565 IMAGE-DOWNSAMPLED 1-s2.0-S2468823123006983-gr7.jpg https://s3-eu-west-1.amazonaws.com/prod-ucs-content-store-eu-west/content/pii:S2468823123006983/gr7/DOWNSAMPLED/image/jpeg/2a0aa340c7fbde01a627219062820d05/gr7.jpg gr7 gr7.jpg jpg 160586 603 607 IMAGE-DOWNSAMPLED 1-s2.0-S2468823123006983-gr4.jpg https://s3-eu-west-1.amazonaws.com/prod-ucs-content-store-eu-west/content/pii:S2468823123006983/gr4/DOWNSAMPLED/image/jpeg/6df998479344031f86c5dc35d06a2cfe/gr4.jpg gr4 gr4.jpg jpg 56953 274 640 IMAGE-DOWNSAMPLED 1-s2.0-S2468823123006983-gr3.jpg https://s3-eu-west-1.amazonaws.com/prod-ucs-content-store-eu-west/content/pii:S2468823123006983/gr3/DOWNSAMPLED/image/jpeg/914942396660b6c93075f8df25ea0d01/gr3.jpg gr3 gr3.jpg jpg 41598 306 351 IMAGE-DOWNSAMPLED 1-s2.0-S2468823123006983-gr9.jpg https://s3-eu-west-1.amazonaws.com/prod-ucs-content-store-eu-west/content/pii:S2468823123006983/gr9/DOWNSAMPLED/image/jpeg/ae953359181820ed7cc3a2da718cab25/gr9.jpg gr9 gr9.jpg jpg 163055 589 613 IMAGE-DOWNSAMPLED 1-s2.0-S2468823123006983-gr2.sml https://s3-eu-west-1.amazonaws.com/prod-ucs-content-store-eu-west/content/pii:S2468823123006983/gr2/THUMBNAIL/image/gif/249d9b1b0bc9304bd8eeaab5cfb9d8ef/gr2.sml gr2 gr2.sml sml 20022 164 219 IMAGE-THUMBNAIL 1-s2.0-S2468823123006983-ga1.sml https://s3-eu-west-1.amazonaws.com/prod-ucs-content-store-eu-west/content/pii:S2468823123006983/ga1/THUMBNAIL/image/gif/4e8de940d90cc7951db5134ce8534902/ga1.sml ga1 true ga1.sml sml 20237 141 219 IMAGE-THUMBNAIL 1-s2.0-S2468823123006983-gr1.sml https://s3-eu-west-1.amazonaws.com/prod-ucs-content-store-eu-west/content/pii:S2468823123006983/gr1/THUMBNAIL/image/gif/d247083fba9fa8209442b501fb3ab82f/gr1.sml gr1 gr1.sml sml 11380 164 121 IMAGE-THUMBNAIL 1-s2.0-S2468823123006983-gr6.sml https://s3-eu-west-1.amazonaws.com/prod-ucs-content-store-eu-west/content/pii:S2468823123006983/gr6/THUMBNAIL/image/gif/2834bc867f609693a5ff06d7b2c4eef5/gr6.sml gr6 gr6.sml sml 13057 164 140 IMAGE-THUMBNAIL 1-s2.0-S2468823123006983-gr5.sml https://s3-eu-west-1.amazonaws.com/prod-ucs-content-store-eu-west/content/pii:S2468823123006983/gr5/THUMBNAIL/image/gif/85ff4901c1d906d5b743aef7fa71fe9b/gr5.sml gr5 gr5.sml sml 11976 102 219 IMAGE-THUMBNAIL 1-s2.0-S2468823123006983-gr8.sml https://s3-eu-west-1.amazonaws.com/prod-ucs-content-store-eu-west/content/pii:S2468823123006983/gr8/THUMBNAIL/image/gif/54f83ff56c579497801253bbbd51dba6/gr8.sml gr8 gr8.sml sml 19669 164 174 IMAGE-THUMBNAIL 1-s2.0-S2468823123006983-gr10.sml https://s3-eu-west-1.amazonaws.com/prod-ucs-content-store-eu-west/content/pii:S2468823123006983/gr10/THUMBNAIL/image/gif/577775f1296ae4bc2dcfc636dc7e81d6/gr10.sml gr10 gr10.sml sml 10697 100 219 IMAGE-THUMBNAIL 1-s2.0-S2468823123006983-gr7.sml https://s3-eu-west-1.amazonaws.com/prod-ucs-content-store-eu-west/content/pii:S2468823123006983/gr7/THUMBNAIL/image/gif/90d1f24dec974de84ad3761041809773/gr7.sml gr7 gr7.sml sml 18294 164 165 IMAGE-THUMBNAIL 1-s2.0-S2468823123006983-gr4.sml https://s3-eu-west-1.amazonaws.com/prod-ucs-content-store-eu-west/content/pii:S2468823123006983/gr4/THUMBNAIL/image/gif/0a90fe9bd6718a51e4c64e1d95be1fb0/gr4.sml gr4 gr4.sml sml 11971 94 219 IMAGE-THUMBNAIL 1-s2.0-S2468823123006983-gr3.sml https://s3-eu-west-1.amazonaws.com/prod-ucs-content-store-eu-west/content/pii:S2468823123006983/gr3/THUMBNAIL/image/gif/739a4be8842bb15c824adba243791048/gr3.sml gr3 gr3.sml sml 13608 164 188 IMAGE-THUMBNAIL 1-s2.0-S2468823123006983-gr9.sml https://s3-eu-west-1.amazonaws.com/prod-ucs-content-store-eu-west/content/pii:S2468823123006983/gr9/THUMBNAIL/image/gif/97b5e8081967e0f432fff2da77052bea/gr9.sml gr9 gr9.sml sml 18886 163 170 IMAGE-THUMBNAIL 1-s2.0-S2468823123006983-gr2_lrg.jpg https://s3-eu-west-1.amazonaws.com/prod-ucs-content-store-eu-west/content/pii:S2468823123006983/HIGHRES/image/jpeg/64f9e350dcf519787f24dd57ffb3614d/gr2_lrg.jpg gr2 gr2_lrg.jpg jpg 1087034 2122 2833 IMAGE-HIGH-RES 1-s2.0-S2468823123006983-ga1_lrg.jpg https://s3-eu-west-1.amazonaws.com/prod-ucs-content-store-eu-west/content/pii:S2468823123006983/HIGHRES/image/jpeg/2a050864b0ef753b4c0aef5f2e6ee0ef/ga1_lrg.jpg ga1 true ga1_lrg.jpg jpg 243586 886 1381 IMAGE-HIGH-RES 1-s2.0-S2468823123006983-gr1_lrg.jpg https://s3-eu-west-1.amazonaws.com/prod-ucs-content-store-eu-west/content/pii:S2468823123006983/HIGHRES/image/jpeg/b7828d852e8fcc900e3d84b7cf319fb4/gr1_lrg.jpg gr1 gr1_lrg.jpg jpg 1289432 3837 2833 IMAGE-HIGH-RES 1-s2.0-S2468823123006983-gr6_lrg.jpg https://s3-eu-west-1.amazonaws.com/prod-ucs-content-store-eu-west/content/pii:S2468823123006983/HIGHRES/image/jpeg/3f89068f6c4b6beda2026f962ae30c4b/gr6_lrg.jpg gr6 gr6_lrg.jpg jpg 1331310 3225 2749 IMAGE-HIGH-RES 1-s2.0-S2468823123006983-gr5_lrg.jpg https://s3-eu-west-1.amazonaws.com/prod-ucs-content-store-eu-west/content/pii:S2468823123006983/HIGHRES/image/jpeg/bcdbf4e56af3f29052635fa616c03f8d/gr5_lrg.jpg gr5 gr5_lrg.jpg jpg 499742 1271 2725 IMAGE-HIGH-RES 1-s2.0-S2468823123006983-gr8_lrg.jpg https://s3-eu-west-1.amazonaws.com/prod-ucs-content-store-eu-west/content/pii:S2468823123006983/HIGHRES/image/jpeg/60aef7e96bac8c990e07bd604d993c2a/gr8_lrg.jpg gr8 gr8_lrg.jpg jpg 1377758 2548 2703 IMAGE-HIGH-RES 1-s2.0-S2468823123006983-gr10_lrg.jpg https://s3-eu-west-1.amazonaws.com/prod-ucs-content-store-eu-west/content/pii:S2468823123006983/HIGHRES/image/jpeg/6aef4b0af61b5a8776cdc108c1977ccf/gr10_lrg.jpg gr10 gr10_lrg.jpg jpg 356395 1147 2500 IMAGE-HIGH-RES 1-s2.0-S2468823123006983-gr7_lrg.jpg https://s3-eu-west-1.amazonaws.com/prod-ucs-content-store-eu-west/content/pii:S2468823123006983/HIGHRES/image/jpeg/18f563b0aebffffced743fafb6ebc94a/gr7_lrg.jpg gr7 gr7_lrg.jpg jpg 1377216 2672 2689 IMAGE-HIGH-RES 1-s2.0-S2468823123006983-gr4_lrg.jpg https://s3-eu-west-1.amazonaws.com/prod-ucs-content-store-eu-west/content/pii:S2468823123006983/HIGHRES/image/jpeg/4f159d1771cd7c1a56d67a01d5e2fa61/gr4_lrg.jpg gr4 gr4_lrg.jpg jpg 453077 1215 2833 IMAGE-HIGH-RES 1-s2.0-S2468823123006983-gr3_lrg.jpg https://s3-eu-west-1.amazonaws.com/prod-ucs-content-store-eu-west/content/pii:S2468823123006983/HIGHRES/image/jpeg/65898aff0f6be9f4021127c425a7977a/gr3_lrg.jpg gr3 gr3_lrg.jpg jpg 324698 1358 1557 IMAGE-HIGH-RES 1-s2.0-S2468823123006983-gr9_lrg.jpg https://s3-eu-west-1.amazonaws.com/prod-ucs-content-store-eu-west/content/pii:S2468823123006983/HIGHRES/image/jpeg/0e13554017197fbc3faf1606eac43c94/gr9_lrg.jpg gr9 gr9_lrg.jpg jpg 1404529 2607 2714 IMAGE-HIGH-RES 1-s2.0-S2468823123006983-mmc1.docx https://s3-eu-west-1.amazonaws.com/prod-ucs-content-store-eu-west/content/pii:S2468823123006983/mmc1/MAIN/application/vnd.openxmlformats-officedocument.wordprocessingml.document/4a2c70c4586da17ae55d3046b5b23b38/mmc1.docx mmc1 mmc1.docx docx 2131634 APPLICATION 1-s2.0-S2468823123006983-si1.svg https://s3-eu-west-1.amazonaws.com/prod-ucs-content-store-eu-west/content/pii:S2468823123006983/image/svg+xml/105d2d9c7f1d3b6ba8a43319d49219ba/si1.svg si1 si1.svg svg 5722 ALTIMG 1-s2.0-S2468823123006983-si10.svg https://s3-eu-west-1.amazonaws.com/prod-ucs-content-store-eu-west/content/pii:S2468823123006983/image/svg+xml/88f25c0aada3866ad47581700366e106/si10.svg si10 si10.svg svg 6493 ALTIMG 1-s2.0-S2468823123006983-si11.svg https://s3-eu-west-1.amazonaws.com/prod-ucs-content-store-eu-west/content/pii:S2468823123006983/image/svg+xml/7c75fff43ab258cdd9b5ea68b174c217/si11.svg si11 si11.svg svg 7548 ALTIMG 1-s2.0-S2468823123006983-si12.svg https://s3-eu-west-1.amazonaws.com/prod-ucs-content-store-eu-west/content/pii:S2468823123006983/image/svg+xml/f220333c11c88e2b5009ab140d0bbbfa/si12.svg si12 si12.svg svg 7217 ALTIMG 1-s2.0-S2468823123006983-si13.svg https://s3-eu-west-1.amazonaws.com/prod-ucs-content-store-eu-west/content/pii:S2468823123006983/image/svg+xml/95bc861768f624afd061a59c13959ccd/si13.svg si13 si13.svg svg 7507 ALTIMG 1-s2.0-S2468823123006983-si14.svg https://s3-eu-west-1.amazonaws.com/prod-ucs-content-store-eu-west/content/pii:S2468823123006983/image/svg+xml/6dfae8dccfd81672ae6f73435e662123/si14.svg si14 si14.svg svg 8739 ALTIMG 1-s2.0-S2468823123006983-si15.svg https://s3-eu-west-1.amazonaws.com/prod-ucs-content-store-eu-west/content/pii:S2468823123006983/image/svg+xml/b771b8cd284741a99a41aa0b77364ed6/si15.svg si15 si15.svg svg 9301 ALTIMG 1-s2.0-S2468823123006983-si2.svg https://s3-eu-west-1.amazonaws.com/prod-ucs-content-store-eu-west/content/pii:S2468823123006983/image/svg+xml/771fa59c1fe3ae38d0766ba605d43cec/si2.svg si2 si2.svg svg 6240 ALTIMG 1-s2.0-S2468823123006983-si3.svg https://s3-eu-west-1.amazonaws.com/prod-ucs-content-store-eu-west/content/pii:S2468823123006983/image/svg+xml/c609bd45050ab61b6fc4be3003a85ac0/si3.svg si3 si3.svg svg 7604 ALTIMG 1-s2.0-S2468823123006983-si4.svg https://s3-eu-west-1.amazonaws.com/prod-ucs-content-store-eu-west/content/pii:S2468823123006983/image/svg+xml/d7abcf701f71f7b6c503885d6aecd230/si4.svg si4 si4.svg svg 7870 ALTIMG 1-s2.0-S2468823123006983-si5.svg https://s3-eu-west-1.amazonaws.com/prod-ucs-content-store-eu-west/content/pii:S2468823123006983/image/svg+xml/58d10e74d20ce7072f623aa1d089546a/si5.svg si5 si5.svg svg 9247 ALTIMG 1-s2.0-S2468823123006983-si6.svg https://s3-eu-west-1.amazonaws.com/prod-ucs-content-store-eu-west/content/pii:S2468823123006983/image/svg+xml/68a23bb285bffe78a4dfd6b84d309c1f/si6.svg si6 si6.svg svg 9841 ALTIMG 1-s2.0-S2468823123006983-si7.svg https://s3-eu-west-1.amazonaws.com/prod-ucs-content-store-eu-west/content/pii:S2468823123006983/image/svg+xml/06930528050f6a36f06cd63f9f5def2b/si7.svg si7 si7.svg svg 6126 ALTIMG 1-s2.0-S2468823123006983-si8.svg https://s3-eu-west-1.amazonaws.com/prod-ucs-content-store-eu-west/content/pii:S2468823123006983/image/svg+xml/c0446706fa033ca5eef97f6a67f16414/si8.svg si8 si8.svg svg 6774 ALTIMG 1-s2.0-S2468823123006983-si9.svg https://s3-eu-west-1.amazonaws.com/prod-ucs-content-store-eu-west/content/pii:S2468823123006983/image/svg+xml/65b11c3493af1b6dc277baf8950c121f/si9.svg si9 si9.svg svg 6501 ALTIMG 1-s2.0-S2468823123006983-am.pdf https://s3-eu-west-1.amazonaws.com/prod-ucs-content-store-eu-west/content/egi:10SQLJ6V6TL/MAIN/application/pdf/4d70144285f9dcafedb358f06bef0b4c/am.pdf am am.pdf pdf false 3591359 AAM-PDF MCAT 113615 113615 S2468-8231(23)00698-3 10.1016/j.mcat.2023.113615 Elsevier B.V. Fig. 1 (a) comparison of NH3-SCR activity over various catalysts, (b) effect of Mn/Ce ratios on NH3-SCR activity over the serial catalysts, (c) GHSV=90,000 h −1; (d) GHSV=120,000 h −1, (e) effect of H2O at 200 °C with GHSV = 60,000 h −1 on NH3-SCR activity over the serial catalysts, (f) tests for resistance to SO2 and H2O poisoning over the serial catalysts. Reaction gas compositions: [NH3]/ [NO] = 500 ppm, [O2] = 5 %, N2 balance and GHSV = 60,000 h −1 (90,000 h −1 or 120,000 h −1). Fig 1 Fig. 2 SEM image of leather activated carbon. Fig 2 Fig. 3 XRD patterns of the different samples. Fig 3 Fig. 4 (a) NH3-TPD curves of Mn0.7Ce0.3AC, Mn0.6Ce0.4AC, Mn0.4Ce0.6AC, Mn0.3Ce0.7AC, (b) the amounts of total acid and ratios of Lewis acid over the serial samples. Fig 4 Fig. 5 (a) H2-TPR curves of Mn0.7Ce0.3AC, Mn0.6Ce0.4AC, Mn0.4Ce0.6AC, Mn0.3Ce0.7AC, (b) their corresponding H2 consumption. Fig 5 Fig. 6 XPS spectra of Mn 2p (a), Ce 3d (b), Zr 3d (c), O 1 s (d) of Mn0.7Ce0.3AC, Mn0.6Ce0.4AC, Mn0.4Ce0.6AC, Mn0.3Ce0.7AC. Fig 6 Fig. 7 DRIFT spectra for NH3 adsorption over (a) Mn0.7Ce0.3AC, (b) Mn0.6Ce0.3AC, (c) Mn0.4Ce0.6AC, (d) Mn0.3Ce0.7AC at different time. Fig 7 Fig. 8 DRIFT spectra taken at 80 °C of passing NO + O2 over the NH3 pre-absorbed on (a) Mn0.7Ce0.3AC, (b) Mn0.6Ce0.4AC, (c) Mn0.4Ce0.6AC, (d) Mn0.3Ce0.7AC catalysts. Fig 8 Fig. 9 DRIFT spectra taken at 80 °C of passing NH3 over the NO + O2 absorbed on (a) Mn0.7Ce0.3AC, (b) Mn0.6Ce0.4AC, (c) Mn0.4Ce0.6AC, (d) Mn0.3Ce0.7AC catalysts. Fig 9 Fig. 10 Reaction mechanism of the composite catalyst. Fig 10 Table 1 Primary data of NH3-SCR study on carbon-based catalysts. Table 1 Catalyst component Mass(g) NO concentration (ppm) GHSV (h −1) T90 a ( °C) Reference MnCe(0.4)-V/AC 1.0 500 18,000 200 [35] MnCe/AC 0.5 500 30,000 200 [40] Mn-Ce-Fe/AC 0.5 500 12,000 175 [41] MnCe/AC 0.5 500 12,000 200 [42] Mn-Ce/AC 0.5 500 30,000 225 [43] Mn/ACMS (35 %) 0.1 400 4000 180 [44] V2O5/ASC 1 1000 12,000 200 [45] MnCe (7:3)/BC 1.0 600 15,000 175 [46] Cr (2 %)/SAC 0.1 500 80,000 125 [47] Mn0.7Ce0.3Zr0.5AC 0.1 500 60,000 180 This work a Temperature of the 90 % NO conversion. Table 2 BET specific surface area and pore structure of various catalysts. Table 2 Sample SBET (m2·g−1) a Smic (m2·g−1) b Vtotal (cm3·g−1) b Vmic (cm3·g−1) c AC 1489 855 0.86 0.44 Mn0.7Ce0.3AC 1305 797 0.56 0.33 Mn0.6Ce0.4AC 941 634 0.42 0.25 Mn0.4Ce0.6AC 1163 772 0.55 0.30 Mn0.3Ce0.7AC 1052 758 0.45 0.31 a Calculated by BJH method. b Micropore volumes and Micropore areas were determined by the t-plot method. c Total pore volumes were determined by the DFT method. Table 3 XPS analysis of Mn0.7Ce0.3AC, Mn0.6Ce0.4AC, Mn0.4Ce0.6AC, Mn0.3Ce0.7AC. Table 3 Sample Surface atomic concentration (%) Oxygen distribution (%) Mn Ce Zr α β γ Mn0.7Ce0.3AC 59 20 21 8 62 30 Mn0.6Ce0.4AC 53 18 29 25 46 29 Mn0.4Ce0.6AC 48 33 19 16 49 35 Mn0.3Ce0.7AC 39 34 27 11 54 35 Table 4 Element concentration on the surface of Mnx+, Cex+. Table 4 Sample Mn distribution (%) Ce distribution (%) Mn4+ Mn3+ Mn2+ Ce4+ Ce3+ Mn0.7Ce0.3AC 35 39 26 0.503 0.497 Mn0.6Ce0.4AC 55 10 35 0.55 0.45 Mn0.4Ce0.6AC 62 3 35 0.37 0.61 Mn0.3Ce0.7AC 91 2 7 0.39 0.63 Table 5 The acid distribution ratios of all catalysts. Table 5 Catalyst Bronsted acid (%) Lewis acid (%) Mn0.7Ce0.3AC 0.25 0.75 Mn0.6Ce0.4AC 0.48 0.52 Mn0.4Ce0.6AC 0.38 0.62 Mn0.3Ce0.7AC 0.29 0.71 Boosting the low-temperature NH3-SCR performance via metals co-doping with inequality Mn/Ce ratios in the carbon-based catalyst prepared by Cr-containing leather waste Yunbin Xia Investigation Methodology Formal analysis Writing – original draft a Yuanyuan Yang Methodology Investigation a Zhiqiang Chen Methodology a Mingli Li Methodology Formal analysis a Ziyue Lan Investigation a Hang Chen Methodology Formal analysis a Chen Huang Methodology Formal analysis a Qi Gao Methodology Formal analysis a Rui Wang Methodology Formal analysis a Yinghao Chu Supervision Conceptualization b Ganxue Wu Formal analysis Writing – review & editing Supervision Funding acquisition Conceptualization a ⁎ Dexin Fang Supervision Conceptualization a Zhenxin Zeng Supervision Conceptualization a Hong Xiao Supervision Conceptualization a a College of Environmental Science, Sichuan Agricultural University, Chengdu, Sichuan 611130, PR China College of Environmental Science Sichuan Agricultural University Chengdu Sichuan 611130 PR China aCollege of Environmental Science, Sichuan Agricultural University, Chengdu, Sichuan 611130, PR China b College of Architecture and Environment, Sichuan University, Chengdu 610000, PR China College of Architecture and Environment Sichuan University Chengdu 610000 PR China bCollege of Architecture and Environment, Sichuan University, Chengdu 610000, PR China ⁎ Corresponding author. The resource utilization of Cr-containing leather waste is still a great challenge. In this work, waste from leather production as raw material was attempted to be used to synthesize activated carbon, a series of MnxCe1-xZr0.5/AC composite catalysts were prepared via loading three metal elements onto activated carbon by impregnation method, the NH3-SCR performance was measured in a low temperature range of 50 ∼ 200 °C. Among them, the catalyst Mn0.7Ce0.3Zr0.5/AC displays the optimal low-temperature SCR activity, excellent resistance to GHSV, H2O and SO2. The characterization results indicated that increasing the Mn/Ce inequality ratios within a certain range would promote the electron transfer between the active metal components, thereby enhancing the synergistic effect and the redox capacity of the catalysts, and it also could significantly improve the concentration of Lewis acid sites to accelerate the adsorption and activation of NH3, resulting in different catalytic activities. The in situ DRIFTS results prove that the Lewis acid site plays a vital role in the “fast SCR” reaction, and the whole reaction process conforms to the Langmuir-Hinshelwood (L-H) mechanism. Graphical abstract Image, graphical abstract Keywords Leather waste Activated carbon Metal-modification NH3-SCR Metal synergies Data availability No data was used for the research described in the article. Introduction As one of the main pollutants in the atmosphere [1,2], NOx mainly comes from coal combustion, automobile exhaust emission, etc. and bring numerous environmental troubles such as photochemical smog and acid rain [3]. Selective catalytic reduction (SCR) of nitrogen oxides using NH3 is the most efficient industrial technology to control NOx emissions [4]. At present, the traditional commercialized SCR catalyst is V2O5-WO3 (MoO3)/TiO2 (anatase) [5–7]. But some shortcomings also appear in recent years including high energy consumption, narrow active temperature window (350 ∼ 450 °C), and unsatisfactory stability [8,9], which limits its further application. Especially, in recent years, the requirement of “Ultra-low emission” and cost reduction call for the development of high-efficiency SCR catalysts with excellent low-temperature catalytic ability [10]. Catalysts based on transition metals gradually have been a research hotspot for several years. MnOx, MnOx-CeO2/TiO2 [11] or MnOx-CeO2 supported on carbon-based carrier substance [12–14] (activated carbon, activated carbon fibers, carbon nanotubes, and honeycomb activated carbon, etc.) have been commonly exploited as low-temperature SCR catalysts. Due to the reason that cerium can store and release oxygen through the transformation of its own valence state to form more unstable oxygen vacancies and free radicals, while Mn has various valences, including + 2, + 3, + 4, + 5 and some non-integer equivalents due to the special valence electron configuration (3d54s2), the mutual conversion between different valence states facilitates the formation of surface-active oxygens species, which consequently benefits the SCR activity [15,16]. In addition, when Mn and Ce are coexisted in the same system, Mn may enter into the lattice of CeO2 to replace part of the Ce atoms, so that the lattice of CeO2 will be distorted to form solid solutions or new crystalline phases resulting in better catalytic performance via inducing interactions [17,18]. Additionally, it is widely accepted that muti-metal doping can induce a synergistic effect via inhibiting the sintering of active metals to a certain degree, improving the dispersion of active components, which consequently promote the SCR reaction cycle [19]. For example, Yang et al. [20] reported that Fe-Mn composite oxides synthesized by co-precipitation method, owns optimal low-temperature catalytic activity and high N2 selectivity due to the synergistic effect between Fe and Mn. Kang et al. [21] prepared an unsupported Cu-Mn composite catalyst, their results showed that the catalyst achieved nearly 100 % NOx conversion at 50 ∼ 200 °C since the existence of solid solution. Long et al. [22] synthesized three mixed oxides catalysts including Mn-Fe, Mn-Zr and Mn-Fe-Zr via coprecipitation, and evaluated the low-temperature catalytic ability at 100 ∼ 180 °C. They found that the synergistic effect between elements could make the NO removal rate at 180 °C reach to nearly 100 % at a space velocity of 15,000 h−1, and revealed that the introduction of Zr could significantly enhance the thermal stability and anti-poisoning ability of the catalysts due to the enhanced crystallinity of the active components. Similar conclusions are found in others reports [23,24]. In general, the catalytic performance of the Mn-Ce based catalysts may be significantly improved by introducing some metal elements. However, the sintering phenomenon has been a prominent problem in the fabrication of metal oxide catalysts, in which case loading catalysts have received much attention. Compared with TiO2 support, activated carbon (AC) has some unique advantages including larger specific surface area, higher adsorption capacity, and abundant functional groups, which are critical for the promotion of the SCR reaction [25–27]. The activated carbon carrier used in this work was derived from leather waste by considering its negative impact on the environment and human beings. At present, the chrome tanning is the mainstream technology in the tanning process, which results in the generation of a large amounts of chrome-containing wastes [28,29]. The main components of leather waste are collagen, trivalent chromium in the form of chromium oxide, fats and other inorganic substances and impurity metals (such as Fe, Mg, etc.), their contents are approximately 80 %, 4 %, 10.5 % and 5.5 % in kilobases, respectively [30]. In fact, the current resource utilization of leather waste is mainly reflected in the recovery of chromium from leather waste through incineration. Although this method realizes the resource utilization of leather waste to a certain extent, it also induces some new problems such as incomplete recycling, serious secondary pollution [31]. In summary, it's a waste of resources and makes harm to the environment if the Cr-containing leather wastes are ignored. Therefore, the handing of the Cr-containing leather wastes is a key issue that severely restricts the healthy development of the leather industry, realizing the resource utilization of Cr-containing leather wastes is an important research direction to solve the above problems. Considering the fact that the leather wastes are mainly composed of protein, the use of Cr-containing leather wastes to prepare activated carbon for catalytic carrier may be a new resource utilization approach, which could solve the problem of leather waste treatment and provides assistance to solve environmental problems [32,33]. In this study, activated carbon with high specific surface area and developed void structure was prepared by using Cr-containing leather waste as raw material as a carrier, a multi-metal/activated carbon catalyst was synthesized via loading cerium, manganese, and zirconium, the ratios of Mn/Ce in the catalyst were adjusted to improve the low-temperature de-NOx ability, and SEM, N2 adsorption-desorption, XRD, NH3-TPD, H2-TPR and XPS were employed to characterize the structures of these samples. In addition, to gain an insight into the impact mechanism of Mn/Ce ratios on the reaction path, in-situ DRIFTS was adopted. This work may provide the possibility for the commercial application of this Cr-containing leather waste based stationary source SCR catalyst in the future. Experiment Catalyst synthesis The preparation of activated carbon from leather waste mainly includes four steps: pulverization, acid pretreatment, carbonization, and activation. By soaking the leather powder in a high concentration hydrochloric acid to remove impurities, drying and calcinated in a tube furnace at 600 °C in N2 atmosphere for carbonization, then the obtained raw leather carbon was ground and mixed with KOH solid, and subsequently activated at 800 °C in N2 atmosphere to obtain the desired activated carbon. Different proportions of Mn, Ce, Zr were loaded on the obtained activated carbon by impregnation method. The total loading was 5 % of the mass of the activated carbon, the amount of Zr was fixed with being 0.5 % of the mass of the carrier. Preparation of different catalysts were performed by changing the Mn/Ce ratios. As a matter of convenience of expression, the activated carbon without metal oxide and the catalyst loaded with single metal oxide were labeled as AC, AC-Ce and AC-Mn, respectively. Meanwhile, the composite catalysts were named as Mn0.8Ce0.2AC, Mn0.7Ce0.3AC, Mn0.6Ce0.4AC, Mn0.4Ce0.6AC and Mn0.3Ce0.7AC, respectively, according to the Mn/Ce ratio (mass ratios of Mn: Ce is 8:2, 7:3, 6:4, 4:6, 3:7) since the content of Zr was fixed in each composite metal oxide. Catalyst activity evaluation The evaluation of catalytic activity was expressed in the supporting information. Catalyst characterization The characterization measurement of as-synthesized catalysts and in-situ DRIFTS of MnxCe1-xZr0.5/AC are expressed in the supporting information. Results and discussion Catalyst activity Fig. 1 (a) shows the NOx conversion curves over AC, AC-Ce, AC-Mn, and Mn0.7Ce0.3AC catalysts under the reaction temperature (50 ∼ 200 °C). It can be noticed that AC exhibits some ternary NO conversion over the whole temperature range, with a maximum catalytic efficiency of no more than 30 %. The catalytic conversion NOx ability was significantly upgraded after the introduction of Mn and Ce, suggesting that Mn and Ce are active for NH3-SCR reaction in the Mn-Ce/AC system. Additionally, the catalytic activity of AC-Mn (maximum NOx conversion above 70 %) was significantly better than that of ACCe (maximum NOx conversion below 70 %), illustrating that Mn-based catalysts can exhibit higher NH3-SCR catalytic performance at low temperature, as reported in the literatures [34,35]. Compared with others, Mn0.7Ce0.3AC displays the optimal catalytic activity with the highest NOx conversion (97 %, 200 °C). The results proved that the bimetallic combination is highly beneficial to improve the catalytic activity. A similar finding was reported by Yuan et al. [36]. Fig. 1(b) reveals the influence of Mn/Ce ratios on the NH3-SCR performance over MnxCe1-xZr0.5/AC catalysts. It can be observed that the Mn/Ce ratios have an important impact on the catalytic ability. The conversion of NO improved gradually as the Mn/ (Mn + Ce) mass ratio increased from 0.4 to 0.7, but the catalytic behavior was negatively affected when the ratio was further increased to 0.8. Not only that, the catalytic activity showed a certain rise when the Mn/ (Mn + Ce) mass ratio was reduced to 0.3. Obviously, 97 % NO conversion was achieved at 200 °C for the Mn/ (Mn + Ce) mass ratio of 0.7. Chang et al. [37] founded that MnOx-CeO2 catalyst has high deNOx ability in a wide temperature range of 80 °C ∼ 230 °C, whose NO removal rate is as high as 98 ∼ 100 %. The deNOx comparison of the as-synthesized carbon-based catalysts in this work with that in the literatures as previously reported were summarized in Table 1 . In contrast, Mn0.7Ce0.3AC is competitively available due to its high deNOx performance. The NO oxidation reaction tests were also performed on the samples before and after modification to investigate the effect of Mn/Ce ratios on the oxidation ability, as shown in Fig. S1. The low-temperature NO oxidation ability is significantly improved compared to the raw AC, suggesting that the active components adopted are active for the NO oxidation reaction. At the same time, the order of the catalysts' oxidation activity is well consistent with that of the standard SCR reaction, revealing that the metals co-doping with inequality Mn/Ce ratios can greatly affect the NO oxidation ability of the as-gained catalysts, consequently determining the low temperature NH3-SCR reaction. As the GHSV was increased to 90,000 h −1 and 120,000 h −1, the NO conversion appeared to be reduced to varying extent, with a maximum reduction rate of about 51 % (Mn0.6Ce0.4AC, 120,000 h −1, 200 °C). In comparison with other catalysts, it is still more than 70 % removal efficiency 200 °C for Mn0.7Ce0.3AC, suggesting that it has good resistance ability to space velocity. The order of the catalytic activity in general remains consistent with Mn0.7Ce0.3AC > Mn0.3Ce0.7AC > Mn0.4Ce0.6AC > Mn0.6Ce0.4AC. It is well known that the catalyst's resistance ability to H2O and SOx should be taken into account in practical application, therefore, the corresponding tests were carried out, as shown in Fig. 1(e) and (f). The NOx conversion of the catalyst at 200 °C suffered a reduction with varying degrees after the introduction of H2O, which was mainly due to the competition adsorption of the reactive gasses and H2O [38,39], as shown in Fig. 1(e). It could be observed that the Mn0.7Ce0.3AC exhibited a good resistance to water, only 10 % decline in catalytic activity. And the NOx conversion gradually recovered to the original level with the water vapor turning off, suggesting that the poisoning was reversible. As shown in Fig. 1(f), it was found that the catalytic performance of these catalysts after sulfuration was reduced to some extent, but Mn0.7Ce0.3AC still showed excellent catalytic activity with the 90 % NOx conversion at 200 °C, indicative of a good resistance ability to SO2 and H2O poisoning. The catalytic performance of Mn0.7Ce0.3AC was recovered to some extent but could not completely back to its original level after thermal regeneration through calcining the poisoned catalyst at 550 °C under nitrogen protection as shown in Fig. S2, which implies that Mn0.7Ce0.3AC has good resistance ability to poisoning. Textural characterization SEM and N2 physisorption The SEM pattens of the leather activated carbon in Fig. 2 show that a rich pore structure of the as-prepared activated carbon exists mainly in the form of irregular lumps, which should mainly be attributed to the contribution of chemical activation and was favorable for the loading of active metals. Meanwhile, it can be inferred from Table 1 and Fig. S3 that the raw activated carbon exhibits a huge specific surface area (1489 m2 g−1) which facilitates the availability of more reactive sites, abundant pore structure (0.86 cm3 g−1) and an average pore diameter of 0.55 nm (close to the molecular size of reactive gas). Based on potential energy theory, the smaller pore size and larger BET surface area are favorable for the enhancement of catalyst adsorption capacity, which makes the reactive gasses easily selective absorption by the pores when the pore diameter is close to the absorbent size, and thus promote the SCR reaction [40]. The nitrogen adsorption curves shown in Fig. S4(a) indicate that the adsorption isotherm of leather activated carbon belongs to type I according to the classification of IUPAC adsorption and desorption isotherm, meaning the presence of numerous micropores. The pore size distribution diagram derived from the HK method in Fig. S4(b) displays that organized carbon pore size is mainly 0.6 nm, implying that the Mn/Ce ratios make some impact on the pore diameter of the as-synthesized catalysts during calcination process. As shown in Table 2 , the introduction of metal oxides would significantly reduce the specific surface area, micropore specific surface area and total pore volume, the pore structure of Mn0.6Ce0.4AC is most affected while Mn0.7Ce0.3AC is the least influenced, which is probably related with the formation of oxide nanoparticles within the pore structure of the AC. The above analysis suggests that Me/Ce ratio may influence the contact of the adsorbed gas with the active site through pore structure, resulting in differences in catalytic efficiency. XRD XRD was used to detect the change of crystal phase as shown in Fig. 3 , and the diffraction peaks of Mn3O4, Ce2O3 and carbon are detected in this spectrum. The two broad diffraction peaks of (0 0 2) and (1 0 0) crystal planes are monitored in all catalysts which attributed to the amorphous carbon. Among them, the (0 0 2) diffraction peak at around 30° represents the presence of graphite microcrystals with a layered structure, which helps to oxidize NO to NO2 and favors the “fast SCR” reaction at low temperature since the coexisting of NO and NO2 according to the study, and the (1 0 0) diffraction peak at 40 ∼ 45° reflecting a turbulent graphite-like structure [41]. It could be observed that the diffraction peak of (0 0 2) and (1 0 0) weaken with the introduction of metal oxides, which suggests that the degree of catalyst arylation and the size of the aromatic planar molecules are affected. Well-dispersed active phases were proven to be able to ameliorate the structural properties of the catalyst [48], which is in accordance with the BET results. The diffraction peaks at 37.5°, 42.8° to 45.8° and 48.6° are significantly affected by the Mn/Ce ratios. And diffraction peaks located at 2θ = 35.4°, 57° and 62.3° were well matched with the tetragonal Mn3O4 (JCPDS No.24–0734) [49], and its intensity increased significantly with the Mn loading indicating the enhancement of the crystallinity of Mn3O4, this phenomenon is also present in the variation of the diffraction peak located at 2θ = 30.3° which was attributed to cubic CeO2 (JCPDS No.23–1048). However, the diffraction peaks assigned to ZrOx species are not detected in the serial diffraction patterns, indicative of the homogeneously dispersed of ZrOx on the catalyst surface [50]. In summary, Mn/Ce ratios could impact the crystallization of the composite oxides, thereby affecting the de-NOx ability. NH3-TPD analyses The key of NH3-SCR lies in the adsorption and activation of NH3 at acidic sites on the catalyst surface, the NH3-TPD test was employed to analyze the surface acidity. As is present in Fig. 4 (a), all of the four NH3-TPD curves can be fitted into four parts, which are below 200 °C, 200 ∼ 400 °C, 400 ∼ 600 °C and above 600 °C, respectively. The peaks below 200 °C are attached to weakly acidic sites while the peaks at 200 ∼ 400 °C are derived from medium acid sites, and the peaks at 400 ∼ 600 °C and above 600 °C are medium-strong acid sites and strong acid sites, respectively [51,52]. The peaks below 400 °C are assigned to the desorption of NH3 on weak Brønsted acid sites while those above could be corresponded to NH3 desorption at Lewis acid sites since the thermal stability of NH3 molecules adsorbed on Lewis acid is stronger than NH4 + ions adsorbed on Brønsted acid sites reported in literatures [45,53]. All catalysts exhibit an abundant content of Lewis acidic sites which was demonstrated to sustain the high NO conversion and low N2O generation at low temperature. The proportion of Lewis acid is shown in Fig. 4(b), it could discover that the order is consistent with the catalytic activity which follows Mn0.7Ce0.3AC > Mn0.3Ce0.7AC > Mn0.4Ce0.6AC > Mn0.6Ce0.4AC, proving that Mn/Ce ratios could significantly affect the amount of Lewis acid sites since the greater this non-equivalent ratio, the higher the ratio of Lewis acidic sites, resulting in differences in the adsorption and activation rates of NH3 [41], which makes Mn0.7Ce0.3AC owns better NO conversion and might be a crucial factor affecting the catalytic behavior. Furthermore, the total acid amount calculated from fitted peak areas can be observed to be subject to the Mn/Ce ratios, but the order is not coinciding with that of the catalytic activity (Mn0.7Ce0.3AC > Mn0.4Ce0.6AC > Mn0.3Ce0.7AC > Mn0.6Ce0.4AC), suggesting that the total acid amount does not seem to be the main factor affecting the catalytic activity, but rather the magnitude of the Lewis acid. Additionally, the formation of Lewis acid sites seems to be highly related to the Mn/Ce ratios, specifically, the more the Mn/Ce ratio deviates from 1.0, the more favorable the generation of Lewis acid sites. It implies that the metals co-doping with inequality ratios of Mn/Ce are beneficial to the occurrence of interaction, which consequently promotes the generation of Lewis acid sites. The above analysis shows that the Mn/Ce ratio can significantly determine the amount of Lewis acid in the catalyst, which consequently impacts adsorption and activation of NH3, eventually affect the catalytic reaction cycle. H2-TPR and XPS analyses H2-TPR It is widely accepted that the deNOx ability of the SCR catalyst is highly related to the redox property [34,54,55]. Herein, the redox ability of Mn0.7Ce0.3AC, Mn0.6Ce0.4AC, Mn0.4Ce0.6AC and Mn0.3Ce0.7AC was investigated by H2-TPR, the curves and corresponding H2 consumption are shown in Fig. 5 (a) and (b). Three peaks appear in all catalysts after peak fitting. The peak below 400 °C was attributed to the reduction of MnO2 → Mn2O3 or surface adsorbed oxygen species (only observed on Mn0.4Ce0.6AC catalyst), which means Mn0.4Ce0.6AC owns a higher average oxidation state of Mn. The peaks at 500 ∼ 530 °C could also be ascribed to the partially reduction of Mn2O3 → Mn3O4 while the peaks at 580 ∼ 620 °C were assigned to Mn3O4 → MnO or Mn-O-Ce species [56], and peaks above 700 °C were presumed to the reduction of Ce4+ (not observed on Mn0.4Ce0.6AC catalyst, it might contribute to a lower vacancies concentration and oxygen species) [57,58]. Each reduction process of these catalysts and the total H2 consumption through quantitative analysis were shown in Fig. 5(b). The total H2 consumption of Mn0.4Ce0.6AC was significantly lower than those of other catalysts, while Mn0.7Ce0.3AC possessed the highest value, and the total H2 consumption shown in Fig. 5(b) is in the order of Mn0.7Ce0.3AC (3.4 mmol/g) > Mn0.3Ce0.7AC (2.7 mmol/g) > Mn0.4Ce0.6AC (2.3 mmol/g) > Mn0.6Ce0.4AC (1.3 mmol/g), which is consistent with the activity results, evidencing that there is a strong interaction between the active components, perhaps originating from the solid solution, which allows the reduction capacity of the catalyst to be improved and promotes the SCR reaction cycle. More importantly, the total H2 consumption is always dominated by the reduction peak at 580 - 620 °C and its variation was consistent with the order of the total H2 consumption, but not with the gradually decreasing Mn ratio. This phenomenon suggests that the metals co-doping with inequality ratio of Mn/Ce can promote the synergistic effect between the active metals, which may originate from the formation of Mn-O-Ce species or MnOx-CeO2 solid solutions. When this unequal ratio is larger within a certain range, the doping effect and connection between elements become more pronounced, which favors the mutual substitution of atoms and thus promotes the formation of solid solution, a similar result also have been found for Li et al. [59]. The above analysis proves that the synergistic effect between the active elements will notably promote the redox properties of the catalyst, the oxygen species content and thus benefit for the improvement of the catalytic performance. XPS analyses In order to further determine the element species and valence state, these catalysts were characterized by XPS. Fig. 6 is the peak spectrum of Mn 2p, Ce 3d, Zr 3d, O 1 s of each catalyst, and the element content is listed in Table 3 . The change of Mn, Ce, Zr element content is generally consistence with the theoretical change trend, and the difference from the theoretical content may be mainly due to the formation of solid solutions or the accumulation of elements on the catalyst surface. As is shown in Fig. S5, metal elements mainly exist in the form of MnOx, CeOx and ZrOx, respectively. From the C 1 s peak spectrum of all catalysts shown in Fig. S6, two characteristic peaks appear at the binding energy of 284.8 eV and 286 eV, belongs to CC and CO in activated carbon, respectively. Some studies [18,60] have proposed that graphene structure would influence the valence state of Mn and the presence of oxygen-bound carbon on the activated carbon surface could provide active sites for the connection of MnOx-CeOx-ZrOx, which is beneficial to promote the NH3-SCR reaction. From the peak spectrum of Mn 2p in Fig. 6(a), characteristic peaks at the binding energy of 640 ∼ 644 eV and 650 ∼ 660 eV correspond to Mn 2p3/2 and Mn 2p1/2, respectively. Among them, the characteristic peak with binding energy at 641.5 eV belongs to Mn3+, that at 642.6 eV and 654.5 eV belong to Mn4+, and the peak at 646 ± 1.0 eV is attributed to Mn2+ [61,62]. It has been reported that the coexistence of multiple-valence manganese oxides could enhance electron transfer and facilitate the SCR reaction [63]. The relative contents of Mn4+, Mn3+and Mn2+ are listed in Table 4 . It was found that the content of Mn4+ progressively rises with the decline in the proportion of Mn. Some studies believed that low-valence manganese (Mn3+, Mn2+) could generate more lattice defects and oxygen vacancies, resulting in stronger oxygen mobility and higher surface-active oxygen content, which in turn contributes to the improvement of redox ability and ultimately affects the SCR reaction [57,62,63]. This may be an important reason why the NO conversion performance of Mn0.7Ce0.3AC is better than others. In other words, the presence of manganese with different valences jointly promotes redox ability of the catalyst. More interestingly, it could be observed in Table S1 that the Mn2+peaks show a tendency to shift to higher binding energies as the Mn/Ce ratio decreases, indicative of the formation of Mn-CeOx solid solution, which makes the outer electrons of Mn transfer to Ce and further enhances the interaction between Mn and Ce, the above analysis was also supported by H2-TPR results. The Ce 3d peak spectrum in Fig. 6(b) can be fitted into five characteristic peaks at the binding energies of 883 eV, 886 eV, 901 eV, 904.7 eV, 917 eV, the characteristic peaks at 886 eV and 904.7 eV belong to Ce3+, while the peaks at 883 eV, 901 eV and 917 eV are attributed to Ce4+. A coexistence of Ce3+ and Ce4+ species has been shown to induce charge imbalances, oxygen vacancies, and unsaturated chemical bonds, which favors the production of chemisorbed oxygen on the catalyst surface [56]. Some studies [18,43] have proved that the presence of Ce3+ could induce electron imbalance on the catalyst surface, forming oxygen vacancies and unsaturated chemical bonds. And it is well-known that increasing the content of chemically adsorbed oxygen is beneficial to improve the SCR activity. Compared with Mn0.6Ce0.4AC, the ratio of Ce3+ on Mn0.7Ce0.3AC was higher, which could promote the redox cycle of Mn4++ Ce3+↔ Mn3+ + Ce4+, thus encouraged the NH3-SCR reaction [57]. Unsurprisingly, as shown in Table S1, with the increase of Ce concentration, the peaks at around 883 eV, 901 eV and 917 eV gradually shifted to the lower binding energy since the radius of Ce4+ is larger than Mnx+ and Zr4+, this phenomenon was in accordance with the studies of Venezia et al. [64], which may cause part of Mnx+ and Zr4+ to get into the Ce lattice to form solid solution and finally promote SCR reaction through synergistic effect. There are two characteristic peaks spectrum of Zr 3d5/2 at the binding energy of 182.7 eV and 185 eV (Fig. 6(c)), which is attributed to Zr4+. The change that both of its peaks tend to move to higher energy attests that there might be a synergistic effect between active components via forming a solid solution (Zr-CeOx or Mn-Zr-CeOx) once again, which is consistent with the XRD, NH3-TPD and H2-TPR results. Fig. 6(d) exhibits the peak spectrum of O 1 s. The characteristic peaks with binding energy at 530.2 eV, 531.9 eV, 533.1 eV can be corresponded to lattice oxygen (O2−, donated as α), chemisorbed oxygen (O2 −, O−, donated as β) and other oxygen species (hydroxyl, free oxygen, donated as γ), respectively [61,65]. The relative contents of α, β and γ on the catalyst surface were obtained according to the peak areas (Table 3). All catalysts presented abundant chemisorbed oxygen species since the order of the three oxygen species is: β > γ > α, which could favor the catalytic cycle due to the higher mobility. And it can be observed that the order of the content of chemically adsorbed oxygen (Mn0.7Ce0.3AC > Mn0.3Ce0.7AC > Mn0.4Ce0.6AC > Mn0.6Ce0.4AC) is highly consistent with the H2-TPR results, combined with the previous analysis, this suggests that when the non-equivalent ratios of co-doping with Mn and Ce is greater within a certain range, the electron transfer abilities between the metals are closer and more synergistic, which facilitates the generation of oxygen vacancies and the cycling of oxygen species [66,67]. Therefore, although Mn0.3Ce0.7AC also has a large unequal Mn/Ce ratio, it has less reactive oxygen species than Mn0.7Ce0.3AC, which may be the reason for its inferior catalytic activity. This order is also similar with activity results, since the chemisorbed oxygen is more likely to migrate and participate in SCR reaction compared with lattice oxygen and other oxygen species, which might be one explanation for its relatively higher SCR activity. In general, the catalytic ability of supported Mn-Ce-Zr mixed oxides is highly related to the low-valence Mn (Mn2+, Mn3+), chemisorbed oxygen and synergistic effect between metals. The valence state of the active component may undergo the following redox cycle during the catalytic process, which is strengthened with the widening of the Mn/Ce non-equivalent ratios: M n 4 + + C e 3 + ↔ M n 3 + + C e 4 + C e 3 + + M n 3 + ↔ M n 2 + + C e 4 + In situ DRIFTS spectra NH3 adsorption Fig. 7 displays the DRIFT spectra of NH3 adsorption over Mn0.7Ce0.3AC, Mn0.6Ce0.4AC, Mn0.4Ce0.6AC, Mn0.3Ce0.7AC at 80 °C. Except for Mn0.6Ce0.4AC, there appeared several peaks at 947 cm−1, which attributed to the stretching vibration of N-H in NH2, it may be formed by the oxidation of adsorbed NH3 or ammonia species and make the difference in catalyst ability since -NH2 is usually identified as an important intermediate product of the NH3-SCR process [68]. The peaks in the interval of 3000 ∼ 3400 cm−1 are the symmetric and asymmetric stretching vibrations of the NH bond in the NH3 adsorbed on the Lewis acid sites and their intensity increased with adsorption time, while peaks above 3500 cm−1 are belonged to the -OH bond (originate from carboxyl group, hydroxyl group or chemically adsorbed water) which might be oxidized to superoxide anion radical ·OH. The peak located at 1380 cm−1 is belonged to monodentate nitrite species (M-N) resulted from the oxidation of adsorbed NH3 [45]. Among the peaks between 1400 ∼ 1850 cm−1, the peaks at 1580 cm−1, 1636 cm−1 and 1665 cm−1 are attributed to the NH bonds in the NH3 species of the Lewis acid site while the rests are belonged to NH4 + species on Bronsted acid site [69,70]. The contents of Lewis acid and Bronsted acid were calculated by peak areas and listed in Table 5 , and the change of Lewis acid contents is accordance with NH3-TPD results. And the contents of Lewis acid sites were significantly higher than that of Bronsted acid sites, indicating that the Mn/Ce ratios would significantly affect the composition of acid sites. Simultaneously, there is a general strengthening of the peak intensity of Lewis acid sites with adsorption time, suggesting that the Lewis acid sites are more stability than Bronsted acid sites, a similar viewpoint was also reported in the paper [71]. The variety of the NH3 adsorption state demonstrates that Mn/Ce ratios have a significant effect on the composition of acid sites of MnxCe1-xAC, especially for the Lewis acid sites. In situ DRIFTS study of reaction between NO + O2 and pre-adsorption NH3 The transient reaction between adsorbed species was further studied by in situ DRIFTS experiment at 80 °C. The peak at 947 cm−1 gradually became progressively weaker and even disappeared with the increase of NO + O2 co-adsorption time, manifesting that the adsorbed NH2 could react with NO and O2 to generate other nitrogen species. Peaks at 1380 cm−1, 1537 cm−1, 1619 cm−1, 1646 cm−1 and 1743 cm−1 were corresponded to free nitrate ions (NO3 −), bidentate nitrate, gaseous NO2 molecule, bridge nitrate and N2O4, respectively [72,73]. It can be observed that the peaks situated in 1537 cm−1, 1619 cm−1 were significantly enhanced with reaction time while the other peaks intensities remain unchanged, indicating that the bidentate nitrate and gaseous NO2 molecule increased. The peaks located at 1696 cm−1, 1717 cm−1 and 1872 cm−1 were attributed to the NO molecules adsorbed on the catalyst surface [74], which can react with O2 to conduct “fast SCR” reaction [75], and the changes at 3000 ∼ 3400 cm−1 implying that adsorbed NH3 participated in the SCR reaction. With the prolong of NO + O2 co-adsorption time, the change degree of peaks (such as 947 cm−1, 1537 cm−1) over Mn0.7Ce0.3AC was more obvious compared with that of other catalysts, followed by Mn0.3Ce0.7AC, which was highly related to the adsorption of NH3 on the catalyst and the content of Lewis acid. These results indicated that NO and O2 would immediately react with the NH3 species adsorbed on the catalyst surface, the reaction rate is mainly governed by the mount of Lewis acid sites which is determined by the Mn/Ce ratios, and the residual NO gas proves that the adsorbed NH3 is completely consumed. The above analysis shows that the SCR reaction occurring on the catalyst surface follows the l-H mechanism: (Fig. 8 ) (1) NO ( g ) + N H 3 ( g ) + N O 2 ( g ) → N 2 ( g ) + H 2 O ( g ) (2) NO ( g ) + N H 2 ( a ) → N H 2 NO → N 2 ( g ) + H 2 O ( g ) In situ DRIFTS study of reaction between NH3 and adsorption NO+O2 Fig. 9 exhibits the spectra of adsorbed NO + O2 and subsequent adsorption of NH3 to explore the reaction mechanism of NH3 and adsorbed NOx species. As is shown in Fig. 9(a), influx of NH3 affects the intensity of the peak to some extent, such as the peaks at 947 cm−1, 1696 cm−1, 1872 cm−1 and 3000 ∼ 3400 cm−1, which is attributed to the acid sites and the residual NO + O2. The peak located at 947 cm−1 increased significantly with the NH3 adsorption time but not completely consistent with the initial adsorption of ammonia. It is speculated that the NOx species on the catalyst surface may react with the adsorbed NH3 on Lewis acid sites. A slight increase in the peak at 1380 cm−1 indicates that the formation of NO3 −, suggesting that the reaction of ammonia with NO promotes the production of nitrate species. It is worth noting that the peaks at 1619 cm−1 and 1646 cm−1 disappear, which is presumed to be the reaction between NO2, bridge nitrate and adsorbed NH3. The peaks of Mn0.3Ce0.7AC change more violent in the interval of 3000 ∼ 3400 cm−1 since the high content of Lewis acid sites, suggesting the concentration of Lewis acid sites is the key to the NH3-SCR reaction [44]. From the above analysis results, the denitrification reaction on the catalyst surface was mainly determined by Lewis acid sites, which could be influenced by the Mn/Ce ratios significantly. The major reaction on the catalysts was as follows: (3) N H 3 ( a ) + N O 2 ( a ) → N O 2 ( N H 3 ) 2 + NO ( a ) → N 2 ( g ) + H 2 O ( g ) (4) NH 4 + + NO 3 − ( a ) → N H 4 N O 3 + NO ( a ) + N H 3 ( a ) → N 2 ( g ) + H 2 O ( g ) Possible mechanism of the catalyst reaction Based on the above experimental results, the possible reaction mechanism on the prepared composite catalyst is inferred as follows, and the reaction mechanism diagram is placed in Fig. 10 . NH3 molecules are mainly in the form of adsorbed ligand NH3, ionic NH4 + and -NH2 which contributes to Lewis and Bronsted acid sites according to the in-situ DRIFTS NH3 adsorption results, and the Lewis acidic site controlled by Mn/Ce ratios performed a key role in the adsorption of ammonia which consistent with NH3-TPD analysis. Meanwhile, the NO molecules exist mainly as NO2, N2O4 and nitrate depending on the results of NO adsorption. When oxygen gas (O2(g)) enters the catalyst, the oxygen will be adsorbed and activated by oxygen vacancies produced by the active component proven to generate active oxygen (O2(a)) or chemisorbed oxygen, and the higher the unequal Mn/Ce ratio, the greater the reduction capacity and the more abundant chemisorbed oxygen species according to the XPS and H2-TPR results. The active oxygen may also react with the functional group -OH present in the activated carbon to form superoxide anion radical ·OH to facilitate the redox of Mnx+ and Cex+. Not only that, the adsorption and activation NH3 has been effectively improved due to the better mobility of the active oxygen species proven by previous outcomes. Under this action, NO will be converted into other nitrogen oxides (NO2, NO3 −) very quickly under the powerful redox ability and abundant Lewis acid sites, thus promotes the “fast SCR” reaction finally. This reaction was mainly controlled by l-H mechanism. The main specific reaction process is as follows: (5) N H 3 ( g ) → N H 3 ( a ) (6) N H 3 ( g ) + H + → NH 4 + ( a ) (7) NO ( g ) + O ( a ) → N O 2 ( a ) (8) N H 3 ( a ) + ( O ) → N H 2 ( a ) + OH ( a ) (9) O 2 ( g ) → O 2 ( ad ) → O ( a ) + − OH → · OH (10) N H 3 ( g ) + NO ( g ) + N O 2 ( g ) → N 2 ( g ) + H 2 O ( g ) (11) N H 2 ( a ) + NO ( g ) → N H 2 NO ( a ) → N 2 ( g ) + H 2 O ( g ) (12) N H 3 ( a ) + N O 2 ( a ) → N O 2 ( N H 3 ) 2 + NO ( a ) → N 2 ( g ) + H 2 O ( g ) (13) NH 4 + + NO 3 − ( a ) → N H 4 N O 3 + NO ( a ) + N H 3 ( a ) → N 2 ( g ) + H 2 O ( g ) Conclusion The results of the prepared of carbon-based catalysts for low-temperature NH3-SCR using Cr-containing leather waste as raw carrier substances are a step forward in ensuring resource utilization and sustainable development. The low-temperature NH3-SCR performance of MnxCe1-xZr0.5/AC catalysts with different Mn/Ce ratios was investigated in this work. Mn0.7Ce0.3Zr0.5/AC exhibits the optimal low-temperature deNOx performance since the NO conversion efficiency at 200 °C can reach up to 97 %, and also shows good resistance to GHSV, H2O and SO2 poisoning. Physical structure characterization reveals that the catalyst features a large specific surface and excellent dispersion of active components, which is conducive to the tight binding between the elements which is one of the reasons for its superior catalytic activity. Results of catalyst surface property characterization (H2-TPR, NH3-TPD) demonstrate that Mn/Ce ratios can significantly affect the surface adsorption of oxygen species, the amount of Lewis acid sites and the redox ability of the catalyst, which subsequently determines the SCR performance as a result. At the same time, it is proved that there is a synergistic effect between Mn and Ce due to the electron transfer as mentioned in XPS, which contributes to the catalytic reactivity. The in situ DRIFTS results indicate that the Lewis acid site which could be promoted via metals co-doping with inequality ratio of Mn/Ce is the key of the entire NH3-SCR reaction, and the reaction mechanism is mainly controlled by Langmuir-Hinshelwood (L-H) mechanism. Finally, the as-prepared Mn0.7Ce0.3Zr0.5/AC catalyst might be one of the potential choices of NH3-SCR low temperature catalyst to some extent. CRediT authorship contribution statement Yunbin Xia: Investigation, Methodology, Formal analysis, Writing – original draft. Yuanyuan Yang: Methodology, Investigation. Zhiqiang Chen: Methodology. Mingli Li: Methodology, Formal analysis. Ziyue Lan: Investigation. Hang Chen: Methodology, Formal analysis. Chen Huang: Methodology, Formal analysis. Qi Gao: Methodology, Formal analysis. Rui Wang: Methodology, Formal analysis. Yinghao Chu: Supervision, Conceptualization. Ganxue Wu: Formal analysis, Writing – review & editing, Supervision, Funding acquisition, Conceptualization. Dexin Fang: Supervision, Conceptualization. Zhenxin Zeng: Supervision, Conceptualization. Hong Xiao: Supervision, Conceptualization. Declaration of Competing Interest The authors declare that they have no known competing financial interests or personal relationships that could have appeared to influence the work reported in this paper. Acknowledgments This study was supported by the College Students' Innovative Entrepreneurial Training Plan Program (S202210626070). Supplementary materials Supplementary material associated with this article can be found, in the online version, at doi:10.1016/j.mcat.2023.113615. Appendix Supplementary materials Image, application 1 References [1] Y. Jiang G. Peng Mechanism on NOx formation and its suppression method Wisco Technol. 2000 10.1007/s11663-020-01923-8 Jiang Y., G. Peng, Mechanism on NOx formation and its suppression method. Wisco Technol. (2000). 10.1007/s11663-020-01923-8 [2] B. Shen J. Chen S. Yue G. Li A comparative study of modified cotton biochar and activated carbon based catalysts in low temperature SCR Fuel 156 2015 47 53 10.1016/j.fuel.2015.04.027 Shen B., J. Chen, S. Yue, G. Li, A comparative study of modified cotton biochar and activated carbon based catalysts in low temperature SCR. Fuel 156 (2015) 47–53. 10.1016/j.fuel.2015.04.027 [3] Environmental catalysis: trends and outlook Catal. Today 75 2002 3 15 10.1016/S0920-5861(02)00037-8 A, G.C P.C. B, S.P. A, P.R. B, Environmental catalysis: trends and outlook. Catal. Today 75 (2002) 3–15. 10.1016/S0920-5861(02)00037-8 [4] A.S.B. Izwan A.S. Binti K. Mehrnoush M.A.R. Bin A review of carbon-based and non-carbon-based catalyst supports for the selective catalytic reduction of nitric oxide Beilstein J. Nanotechnol. 9 2018 740 761 10.3762/bjnano.9.68 Izwan A.S.B., A.S. Binti, K. Mehrnoush, M.A.R. Bin, A review of carbon-based and non-carbon-based catalyst supports for the selective catalytic reduction of nitric oxide. Beilstein J. Nanotechnol. 9 (2018) 740–761. 10.3762/bjnano.9.68 [5] K. Zhao W. Han G. Lu J. Lu Z. Tang X. Zhen Promotion of redox and stability features of doped Ce-W-Ti for NH3-SCR reaction over a wide temperature range Appl. Surf. Sci. 379 2016 316 322 10.1016/j.apsusc.2016.04.090 Zhao K., W. Han, G. Lu, J. Lu, Z. Tang, X. Zhen, Promotion of redox and stability features of doped Ce-W-Ti for NH3-SCR reaction over a wide temperature range. Appl. Surf. Sci. 379 (2016) 316–322. 10.1016/j.apsusc.2016.04.090 [6] J. Yang S. Lei J. Yu G. Xu Low-cost V-W-Ti SCR catalyst from titanium-bearing blast furnace slag J. Environ. Chem. Eng. 2 2014 1007 1010 10.1016/j.jece.2014.03.022 Yang J., S. Lei, J. Yu, G. Xu, Low-cost V-W-Ti SCR catalyst from titanium-bearing blast furnace slag. J. Environ. Chem. Eng. 2 (2014) 1007–1010. 10.1016/j.jece.2014.03.022 [7] W. Liu Y. Long Y. Zhou Excellent low temperature NH3-SCR and NH3-SCO performance over Ag-Mn/Ce-Ti catalyst: evaluation and characterization Mol. Catal. 2022 528 10.1016/j.mcat.2022.112510 Liu W., Y. Long, Y. Zhou, Excellent low temperature NH3-SCR and NH3-SCO performance over Ag-Mn/Ce-Ti catalyst: evaluation and characterization. Mol. Catal. (2022) 528. 10.1016/j.mcat.2022.112510 [8] J. Zhu J. Li B. Chu Excitation of catalytic performance on MOFs derivative carrier by residual carbon for low-temperature NH3-SCR reaction Mol. Catal. 2023 10.1016/j.mcat.2022.112859 Zhu J., J. Li, B. Chu, Excitation of catalytic performance on MOFs derivative carrier by residual carbon for low-temperature NH3-SCR reaction. Mol. Catal. (2023). 10.1016/j.mcat.2022.112859 [9] Y. Yang X. Liu Z. Sui Support effects on the dispersion and interaction of Ce and W species for NH3-SCR Mol. Catal. 2022 524 10.1016/j.mcat.2022.112284 Yang Y., X. Liu, Z. Sui, Support effects on the dispersion and interaction of Ce and W species for NH3-SCR. Mol. Catal. (2022) 524. 10.1016/j.mcat.2022.112284 [10] Y. Wang Z. Huang Z. Liu Q. Liu A novel activated carbon honeycomb catalyst for simultaneous SO2 and NO removal at low temperatures Carbon N Y 42 2004 445 448 10.1016/j.carbon.2003.11.006 Wang Y., Z. Huang, Z. Liu, Q. Liu, A novel activated carbon honeycomb catalyst for simultaneous SO2 and NO removal at low temperatures. Carbon N Y 42 (2004) 445–448. 10.1016/j.carbon.2003.11.006 [11] Z. Liu J. Zhu J. Li L. Ma S.I. Woo Novel Mn-Ce-Ti mixed-oxide catalyst for the selective catalytic reduction of NOx with NH3 ACS Appl. Mater. Int. 6 2014 1044 1050 10.1021/am5038164 Liu Z., J. Zhu, J. Li, L. Ma, S.I. Woo, Novel Mn-Ce-Ti mixed-oxide catalyst for the selective catalytic reduction of NOx with NH3. ACS Appl. Mater. Int. 6 (2014) 1044–1050. 10.1021/am5038164 [12] Z. Huang Z. Liu X. Zhang Q. Liu Inhibition effect of H2O on V2O5/AC catalyst for catalytic reduction of NO with NH3 at low temperature Appl. Catal. B 63 2006 260 265 10.1016/j.apcatb.2005.10.011 Huang Z., Z. Liu, X. Zhang, Q. Liu, Inhibition effect of H2O on V2O5/AC catalyst for catalytic reduction of NO with NH3 at low temperature. Appl. Catal. B 63 (2006) 260–265. 10.1016/j.apcatb.2005.10.011 [13] S. Yang C. Wang J. Li N. Yan M. Lei H. Chang Low temperature selective catalytic reduction of NO with NH3 over Mn-Fe spinel: performance, mechanism and kinetic study Appl. Catal. B 110 2011 71 80 10.1016/j.apcatb.2011.08.027 Yang S., C. Wang, J. Li, N. Yan, M. Lei, H. Chang, Low temperature selective catalytic reduction of NO with NH3 over Mn-Fe spinel: performance, mechanism and kinetic study. Appl. Catal. B 110 (2011) 71–80. 10.1016/j.apcatb.2011.08.027 [14] X. Tang J. Hao H. Yi J. Li Low-temperature SCR of NO with NH3 over AC/C supported manganese-based monolithic catalysts Catal. Today 126 2007 406 411 10.1016/j.cattod.2007.06.013 Tang X., J. Hao, H. Yi, J. Li, Low-temperature SCR of NO with NH3 over AC/C supported manganese-based monolithic catalysts. Catal. Today 126 (2007) 406–411. 10.1016/j.cattod.2007.06.013 [15] X. Li Y. Li S. Deng T.A. Rong A Ce-Sn-Ox catalyst for the selective catalytic reduction of NOx with NH3 Catal. Commun. 40 2013 47 50 10.1016/j.catcom.2013.05.024 Li X., Y. Li, S. Deng, T.A. Rong, A Ce-Sn-Ox catalyst for the selective catalytic reduction of NOx with NH3. Catal. Commun. 40 (2013) 47–50. 10.1016/j.catcom.2013.05.024 [16] C. Fang L.Y. Shi H. Li L. Huang D. Zhang Creating hierarchically macro-/mesoporous Sn/CeO2 for the selective catalytic reduction of NO with NH3 RSC Adv. 6 2016 10.1039/C6RA18339E Fang C., L.Y. Shi, H. Li, L. Huang, D. Zhang, Creating hierarchically macro-/mesoporous Sn/CeO2 for the selective catalytic reduction of NO with NH3. RSC Adv. 6 (2016). 10.1039/C6RA18339E [17] S. Pengpanich V. Meeyoo T. Rirksomboon K. Bunyakiat Catalytic oxidation of methane over CeO2-ZrO2 mixed oxide solid solution catalysts prepared via urea hydrolysis Appl. Catal. A 234 2002 221 233 10.1016/S0926-860X(02)00230-2 Pengpanich S., V. Meeyoo, T. Rirksomboon, K. Bunyakiat, Catalytic oxidation of methane over CeO2-ZrO2 mixed oxide solid solution catalysts prepared via urea hydrolysis. Appl. Catal. A 234 (2002) 221–233. 10.1016/S0926-860X(02)00230-2 [18] X. Zhe Z. Yuying W. Xie Low-temperature NO reduction with NH3 over Mn-CeOx/CNT catalysts prepared by a liquid-phase methodf Catal. Sci. Technol. 4 2014 1738 1741 10.1039/C4CY00026A Zhe X., Yuying Z., Xie W., Low-temperature NO reduction with NH3 over Mn-CeOx/CNT catalysts prepared by a liquid-phase methodf. Catal. Sci. Technol. 4 (2014) 1738–1741. 10.1039/C4CY00026A [19] P.G. Smirniotis D.A. Pena B.S. Uphade Low-temperature selective catalytic reduction (SCR) of NO with NH3 by using Mn, Cr, and Cu oxides supported on hombikat TiO2 ChemBioChem 32 2010 10.1002/1521-3773(20010702)40:13<3C2479::aid-anie2479>3E3.0.co;2-7 no-no Smirniotis P.G., D.A. Pena, B.S. Uphade, Low-temperature selective catalytic reduction (SCR) of NO with NH3 by using Mn, Cr, and Cu oxides supported on hombikat TiO2. ChemBioChem 32 (2010) no-no. 10.1002/1521-3773(20010702)40:13%3C2479::aid-anie2479%3E3.0.co;2-7 [20] P. Yang S. Yang Z. Shi F. Tao X. Guo R. Zhou Accelerating effect of ZrO2 doping on catalytic performance and thermal stability of CeO2-CrOx mixed oxide for 1,2-dichloroethane elimination Chem. Eng. J. 285 2016 544 553 10.1016/j.cej.2015.10.025 Yang P., S. Yang, Z. Shi, F. Tao, X. Guo, R. Zhou, Accelerating effect of ZrO2 doping on catalytic performance and thermal stability of CeO2-CrOx mixed oxide for 1,2-dichloroethane elimination. Chem. Eng. J. 285 (2016) 544–553. 10.1016/j.cej.2015.10.025 [21] M. Kang E.D. Park J.M. Kim J.E. Yie Cu-Mn mixed oxides for low temperature NO reduction with NH3 Catal. Today 2006 10.1016/j.cattod.2005.10.032 Kang M., E.D. Park, J.M. Kim, J.E. Yie, Cu-Mn mixed oxides for low temperature NO reduction with NH3. Catal. Today (2006). 10.1016/j.cattod.2005.10.032 [22] R.Q. Long R.T. Yang R. Chang Low temperature selective catalytic reduction (SCR) of NO with NH3 over Fe-Mn based catalysts Chem. Commun. 2002 452 453 10.1039/B111382H Long R.Q., R.T. Yang, R. Chang, Low temperature selective catalytic reduction (SCR) of NO with NH3 over Fe-Mn based catalysts. Chem. Commun. (2002) 452–453. 10.1039/B111382H [23] X. Wei R. Zhao B. Chu S. Xie Q. Qin K. Chen L. Li S. Zhao B. Li L. Dong Significantly enhanced activity and SO2 resistance of Zr-modified CeTiOx catalyst for low-temperature NH3-SCR by H2 reduction treatment Mol. Catal. 518 2022 10.1016/j.mcat.2021.112069 Wei X., R. Zhao, B. Chu, S. Xie, Q. Qin, K. Chen, L. Li, S. Zhao, B. Li, L. Dong, Significantly enhanced activity and SO2 resistance of Zr-modified CeTiOx catalyst for low-temperature NH3-SCR by H2 reduction treatment. Mol. Catal. (2022) 518. 10.1016/j.mcat.2021.112069 [24] M. Wang R.T. Guo S. Ren Revealing M(M = Cu,Co and Zr)oxides doping effects on anti-PbCl2 poisoning over Mn-Ce/AC catalysts in low-temperature NH3-SCR reaction Applied Catalysis A, General 643 2022 118749 10.1016/j.apcata.2022.118749 Wang et al., 2022. [25] A. Rajendran C. Mansiya Extraction of chromium from tannery effluents using waste egg shell material as an adsorbent Br. J. Environ. Clim. Change 2011 10.9734/BJECC/2011/262 Rajendran A., C. Mansiya, Extraction of chromium from tannery effluents using waste egg shell material as an adsorbent. Br. J. Environ. Clim. Change (2011). doi: 10.9734/BJECC/2011/262 [26] I.C. Kantarli J. Yanik Activated carbon from leather shaving wastes and its application in removal of toxic materials J. Hazard. Mater. 179 2010 348 356 10.1016/j.jhazmat.2010.03.012 Kantarli I.C., J. Yanik, Activated carbon from leather shaving wastes and its application in removal of toxic materials. J. Hazard. Mater. 179 (2010) 348–356. 10.1016/j.jhazmat.2010.03.012 [27] J. Zhu J. Li B. Chu S. Liu S. Fu Q. Qin L. Dong B. Li Excitation of catalytic performance on MOFs derivative carrier by residual carbon for low-temperature NH3-SCR reaction Mol. Catal. 535 2023 112859 10.1016/j.mcat.2022.112859 Zhu J., J. Li, B. Chu, S. Liu, S. Fu, Q. Qin, L. Dong, B. Li, Excitation of catalytic performance on MOFs derivative carrier by residual carbon for low-temperature NH3-SCR reaction. Mol. Catal. 535 (2023) 112859. 10.1016/j.mcat.2022.112859 [28] K. Kolomaznik M. Adamek I. Andel M. Uhlirova Leather waste-Potential threat to human health, and a new technology of its treatment J. Hazard. Mater. 160 2008 514 520 10.1016/j.jhazmat.2008.03.070 Kolomaznik K., M. Adamek, I. Andel, M. Uhlirova, Leather waste-Potential threat to human health, and a new technology of its treatment. J. Hazard. Mater. 160 (2008) 514–520. 10.1016/j.jhazmat.2008.03.070 [29] V. Aragón D.S. Graa A.L. Norte G.S. Santiago O.J. Paula Supplemental high chromium yeast and reproductive performance of grazing primiparous zebu cows Arq. Bras. Med. Vet. Zootec. 53 2001 624 628 Aragón V., D.S. Graa, A.L. Norte, G.S. Santiago, O.J. Paula, Supplemental high chromium yeast and reproductive performance of grazing primiparous zebu cows. Arq. Bras. Med. Vet. Zootec. 53 (2001) 624–628. [30] G. Bufalo B. Molino L. Ambrosone Selection of tanned-leather waste in recovering novel raw material for manufacturing rubber artifacts: towards a zero-waste condition Appl. Sci. 10 2020 5374 10.3390/app10155374 Bufalo G., B. Molino, L. Ambrosone, Selection of tanned-leather waste in recovering novel raw material for manufacturing rubber artifacts: towards a zero-waste condition. Appl. Sci. 10 (2020) 5374. 10.3390/app10155374 [31] A.M. Semih K.B. Dagül U. Nurseli Utilization of chrome-tanned leather wastes in natural rubber and styrene-butadiene rubber blends J. Mater. Cycles Waste Manag. 2018 1 10 10.1007/s10163-018-0775-9 Semih A.M., K.B. Dagül, U. Nurseli, Utilization of chrome-tanned leather wastes in natural rubber and styrene-butadiene rubber blends. J. Mater. Cycles Waste Manag. (2018) 1–10. doi: 10.1007/s10163-018-0775-9 [32] L.Z.Y.X. Zhao Synthesis of CeaMnOx hollow microsphere with hierarchical structure and its excellent catalytic performance for toluene combustion Appl. Catal. B Environ. 2019 245 10.1016/j.apcatb.2019.01.005 Zhao L.Z.Y.X., Synthesis of CeaMnOx hollow microsphere with hierarchical structure and its excellent catalytic performance for toluene combustion. Appl. Catal. B Environ. 245 (2019). 10.1016/j.apcatb.2019.01.005 [33] L.J. Kennedy T. Ratnaji N. Konikkara J.J. Vijaya Value added porous carbon from leather wastes as potential supercapacitor electrode using neutral electrolyte J. Clean. Prod. 197 2018 930 936 10.1016/j.jclepro.2018.06.244 Kennedy L.J., T. Ratnaji, N. Konikkara, J.J. Vijaya, Value added porous carbon from leather wastes as potential supercapacitor electrode using neutral electrolyte. J. Clean. Prod. 197 (2018) 930–936. 10.1016/j.jclepro.2018.06.244 [34] L.G. Wei R.T. Guo J. Zhou B. Qin X. Chen Z.X. Bi W.G. Pan Chemical deactivation and resistance of Mn-based SCR catalysts for NOx removal from stationary sources Fuel 2022 316 10.1016/j.fuel.2022.123438 Wei L.G., R.T. Guo, J. Zhou, B. Qin, X. Chen, Z.X. Bi, W.G. Pan, Chemical deactivation and resistance of Mn-based SCR catalysts for NOx removal from stationary sources. Fuel (2022) 316. 10.1016/j.fuel.2022.123438 [35] L.Q.G.M. Jiang V2O5-modified Mn-Ce/AC catalyst with high SO2 tolerance for low-temperature NH3-SCR of NO Chem. Eng. J. 2019 370 10.1016/j.cej.2019.03.225 Jiang L.Q.G.M., V2O5-modified Mn-Ce/AC catalyst with high SO2 tolerance for low-temperature NH3-SCR of NO. Chem. Eng. J. 370 (2019). 10.1016/j.cej.2019.03.225 [36] E. H Y M. Li Y. M. H X. Huang K. Zhang W. Han Z. Tang L. Z. W Encapsulation of ultra-small Cu-Fe into ZSM-5 zeolites for NH3-SCR with broad reaction-temperature ranges Microporous Mesoporous Mater. 331 2022 10.1016/j.micromeso.2021.111675 E. H, Y, M. Li, Y. M. H, X. Huang, K. Zhang, W. Han, Z. Tang, L. Z. W, Encapsulation of ultra-small Cu-Fe into ZSM-5 zeolites for NH3-SCR with broad reaction-temperature ranges. Microporous Mesoporous Mater. (2022) 331. 10.1016/j.micromeso.2021.111675 [37] H. Chang X. Chen J. Li L. Ma C. Wang C. Liu J.W. Schwank J. Hao Improvement of activity and SO2 tolerance of Sn-modified MnOx-CeO2 catalysts for NH3-SCR at low temperatures Environ. Sci. Technol. 47 2013 5294 5301 10.1021/es304732h Chang H., X. Chen, J. Li, L. Ma, C. Wang, C. Liu, J.W. Schwank, J. Hao, Improvement of activity and SO2 tolerance of Sn-modified MnOx-CeO2 catalysts for NH3-SCR at low temperatures. Environ. Sci. Technol. 47 (2013) 5294–5301. 10.1021/es304732h [38] B, Y.C H.L. A, J.Z. A, Y.C. A, J.L. A, J.Y. A, F.L. A, C.L. A, Y.W. C, Y.L. D, Enhanced performance and SO2 tolerance of Ce modified TiO2 supported Mn-Sm catalyst for synergetic removal of Hg0 and NO from flue gas. Fuel Process. Technol. 227. 10.1016/j.fuproc.2021.107136. [39] Z. Xiong W. Wang J. Li L. Huang W. Lu The synergistic promotional effect of W doping and sulfate modification on the NH3-SCR activity of CeO2 catalyst Mol. Catal. 522 2022 112250 10.1016/j.mcat.2022.112250 Xiong Z., W. Wang, J. Li, L. Huang, W. Lu, The synergistic promotional effect of W doping and sulfate modification on the NH3-SCR activity of CeO2 catalyst. Mol. Catal. 522 (2022) 112250. 10.1016/j.mcat.2022.112250 [40] M. Wang S. Ren Y. Jiang B. Su Z. Chen W. Liu J. Yang L. Chen Insights into co-doping effect of Sm and Fe on anti-Pb poisoning of Mn-Ce/AC catalyst for low-temperature SCR of NO with NH3 Fuel 319 2022 123763 10.1016/j.fuel.2022.123763 Wang M., S. Ren, Y. Jiang, B. Su, Z. Chen, W. Liu, J. Yang, L. Chen, Insights into co-doping effect of Sm and Fe on anti-Pb poisoning of Mn-Ce/AC catalyst for low-temperature SCR of NO with NH3. Fuel 319 (2022) 123763 10.1016/j.fuel.2022.123763 [41] Y.A. Jie R.A. Shan A. Tz A. Zs B. Hl K.A. Ming Y.A. Lu Iron doped effects on active sites formation over activated carbon supported Mn-Ce oxide catalysts for low-temperature SCR of NO Chem. Eng. J. 379 2019 122398 10.1016/j.cej.2019.122398 122398 Jie Y.A., R.A. Shan, A. Tz, A. Zs, B. Hl, K.A. Ming, Y.A. Lu, Iron doped effects on active sites formation over activated carbon supported Mn-Ce oxide catalysts for low-temperature SCR of NO. Chem. Eng. J. 379 (2019) 122398 122398. 10.1016/j.cej.2019.122398 [42] Z. Su S. Ren Z. Chen J. Yang C. Yang Deactivation effect of CaO on Mn-Ce/AC catalyst for SCR of NO with NH3 at low temperature Catalysts 10 2020 873 10.3390/catal10080873 Su Z., S. Ren, Z. Chen, J. Yang, C. Yang, Deactivation effect of CaO on Mn-Ce/AC catalyst for SCR of NO with NH3 at low temperature. Catalysts 10 (2020) 873. 10.3390/catal10080873 [43] B. Mwa C. Bs R. Shan B. Wla Y. Jie B. Zca C. Lin Different lead species deactivation on Mn-Ce activated carbon supported catalyst for low-temperature SCR of NO with NH3: comparison of PbCl2, Pb (NO3)2 and PbSO4 J. Colloid Interface Sci. 2022 10.1016/j.jcis.2022.04.121 Mwa B., C. Bs, R. Shan, B. Wla, Y. Jie, B. Zca, C. Lin, Different lead species deactivation on Mn-Ce activated carbon supported catalyst for low-temperature SCR of NO with NH3: comparison of PbCl2, Pb (NO3)2 and PbSO4. J. Colloid Interface Sci. (2022). 10.1016/j.jcis.2022.04.121 [44] Z. Gong B. Wang W. Chen S. Ma W. Jiang X. Jiang Waste straw derived Mn-doped carbon/mesoporous silica catalyst for enhanced low-temperature SCR of NO Waste Manag. 136 2021 28 35 10.1016/j.wasman.2021.09.035 Gong Z., B. Wang, W. Chen, S. Ma, W. Jiang, X. Jiang, Waste straw derived Mn-doped carbon/mesoporous silica catalyst for enhanced low-temperature SCR of NO. Waste Manag. 136 (2021) 28–35. 10.1016/j.wasman.2021.09.035 [45] J. Wang Y. Zheng L. Liu C. Yan X. Wang In situ DRIFTS investigation on the SCR of NO with NH3 over V2O5 catalyst supported by activated semi-coke Appl. Surf. Sci. 313 2014 660 669 10.1016/j.apsusc.2014.06.043 Wang J., Y. Zheng, L. Liu, C. Yan, X. Wang, In situ DRIFTS investigation on the SCR of NO with NH3 over V2O5 catalyst supported by activated semi-coke. Appl. Surf. Sci. 313 (2014) 660–669. 10.1016/j.apsusc.2014.06.043 [46] Y.A. Jie A. Zs R.A. Shan B. Hl K.A. Ming A. Lj Low-temperature SCR of NO with NH3 over biomass char supported highly dispersed MnCe mixed oxides J. Energy Inst. 92 2019 883 891 10.1016/j.joei.2018.08.001 Jie Y.A., A. Zs, R.A. Shan, B. Hl, K.A. Ming, A. Lj, Low-temperature SCR of NO with NH3 over biomass char supported highly dispersed MnCe mixed oxides. J. Energy Inst. 92 (2019) 883–891. 10.1016/j.joei.2018.08.001 [47] S. Li X. Wang S. Tan Y. Shi L. Wei CrO3 supported on sargassum-based activated carbon as low temperature catalysts for the selective catalytic reduction of NO with NH3 Fuel 2017 10.1016/j.fuel.2016.11.095 Li S., X. Wang, S. Tan, Y. Shi, L. Wei, CrO3 supported on sargassum-based activated carbon as low temperature catalysts for the selective catalytic reduction of NO with NH3. Fuel (2017). 10.1016/j.fuel.2016.11.095 [48] N.I. Andersen A. Serov P. Atanassov Metal oxides/CNT nano-composite catalysts for oxygen reduction/oxygen evolution in alkaline media Appl. Catal. B Environ. 163 2015 623 627 10.1016/j.apcatb.2014.08.033 Andersen N.I., A. Serov, P. Atanassov, Metal oxides/CNT nano-composite catalysts for oxygen reduction/oxygen evolution in alkaline media. Appl. Catal. B Environ. 163 (2015) 623–627. 10.1016/j.apcatb.2014.08.033 [49] J.I. Gutierrez-Ortiz B.D. Rivas R. Lopez-Fonseca S. Martin J.R. Gonzalez-Velasco Structure of Mn-Zr mixed oxides catalysts and their catalytic performance in the gas-phase oxidation of chlorocarbons Chemosphere 68 2007 1004 1012 10.1016/j.chemosphere.2007.02.025 Gutierrez-Ortiz J.I., B.D. Rivas, R. Lopez-Fonseca, S. Martin, J.R. Gonzalez-Velasco, Structure of Mn-Zr mixed oxides catalysts and their catalytic performance in the gas-phase oxidation of chlorocarbons. Chemosphere 68 (2007) 1004–1012. 10.1016/j.chemosphere.2007.02.025 [50] I. Mejri F. Ayari M. Mhamdi G. Delahay Z. Ksibi SCR of NO by NH3 catalyzed by Mo- and V-exchanged zeolite: effect of Mo precursor salt Microporous Mesoporous Mater. 2016 10.1016/j.micromeso.2015.09.014 I., Mejri, F., Ayari, M., Mhamdi, G., Delahay, Z., Ksibi, SCR of NO by NH3 catalyzed by Mo- and V-exchanged zeolite: effect of Mo precursor salt. Microporous Mesoporous Mater. (2016). 10.1016/j.micromeso.2015.09.014 [51] L. Chen R. Li Z. Li F. Yuan Y. Zhu Effect of Ni doping in NixMn1-xTi10 (x = 0.1-0.5) on activity and SO2 resistance for NH3-SCR of NO studied with in situ DRIFTS Catal. Sci. Technol. 7 2017 10.1039/C7CY00672A Chen L., R. Li, Z. Li, F. Yuan, Y. Zhu, Effect of Ni doping in NixMn1-xTi10 (x = 0.1-0.5) on activity and SO2 resistance for NH3-SCR of NO studied with in situ DRIFTS. Catal. Sci. Technol. 7 (2017). 10.1039/C7CY00672A [52] R. Villamaina S. Liu I. Nova E. Tronconi D. Thompsett Speciation of Cu cations in Cu-CHA catalysts for NH3-SCR: the effects of SiO2/AlO3 ratio and Cu-loading investigated by transient response methods ACS Catal. 9 2019 10.1021/ACSCATAL.9B02578 Villamaina R., S. Liu, I. Nova, E. Tronconi, D. Thompsett, Speciation of Cu cations in Cu-CHA catalysts for NH3-SCR: the effects of SiO2/AlO3 ratio and Cu-loading investigated by transient response methods. ACS Catal. 9 (2019). 10.1021/ACSCATAL.9B02578 [53] J. Yang S. Ren Y. Zhou Z. Su Q. Liu In situ IR comparative study on N2O formation pathways over different valence states manganese oxides catalysts during NH3 SCR of NO Chem. Eng. J. 397 2020 125446 10.1016/j.cej.2020.125446 Yang J., S. Ren, Y. Zhou, Z. Su, Q. Liu, In situ IR comparative study on N2O formation pathways over different valence states manganese oxides catalysts during NH3 SCR of NO. Chem. Eng. J. 397 (2020) 125446. 10.1016/j.cej.2020.125446 [54] L. Zhang L. Li Y. Cao X. Yao C. Ge F. Gao Y. Deng C. Tang L. Dong Getting insight into the influence of SO2 on TiO2/CeO2 for the selective catalytic reduction of NO by NH3 Appl. Catal. B 165 2015 589 598 10.1016/j.apcatb.2014.10.029 Zhang L., L. Li, Y. Cao, X. Yao, C. Ge, F. Gao, Y. Deng, C. Tang, L. Dong, Getting insight into the influence of SO2 on TiO2/CeO2 for the selective catalytic reduction of NO by NH3. Appl. Catal. B 165 (2015) 589–598. 10.1016/j.apcatb.2014.10.029 [55] F. Ning-Jie G. Jia-Xiu S. Shu L. Jian-Jun C. Ying-Hao Influence of textures, oxygen-containing functional groups and metal species on SO2 and NO removal over Ce-Mn/NAC Fuel 202 2017 328 337 10.1016/j.fuel.2017.04.035 Ning-Jie F., G. Jia-Xiu, S. Shu, L. Jian-Jun, C. Ying-Hao, Influence of textures, oxygen-containing functional groups and metal species on SO2 and NO removal over Ce-Mn/NAC. Fuel 202 (2017) 328–337. 10.1016/j.fuel.2017.04.035 [56] C. Fan S. Sheng J. Xiang P. Wang H. Song L. Sun A. Zhang The activity and mechanism study of Fe-Mn-Ce/γ-Al2O3 catalyst for low temperature selective catalytic reduction of NO with NH3 Fuel 139 2015 232 239 10.1016/j.fuel.2014.08.060 Fan C., S. Sheng, J. Xiang, P. Wang, H. Song, L. Sun, A. Zhang, The activity and mechanism study of Fe-Mn-Ce/γ-Al2O3 catalyst for low temperature selective catalytic reduction of NO with NH3. Fuel 139 (2015) 232–239. 10.1016/j.fuel.2014.08.060 [57] Y.A. Ran A. Sl A. Yl A. Wl A. Ym C. Ct W.D. Liang W.E. Peng B. Hpa Novel shielding and synergy effects of Mn-Ce oxides confined in mesoporous zeolite for low temperature selective catalytic reduction of NOx with enhanced SO2/H2O tolerance J. Hazard. Mater. 396 2020 10.1016/j.jhazmat.2020.122592 Ran Y.A., A. Sl, A. Yl, A. Wl, A. Ym, C. Ct, W.D. Liang, W.E. Peng, B. Hpa, Novel shielding and synergy effects of Mn-Ce oxides confined in mesoporous zeolite for low temperature selective catalytic reduction of NOx with enhanced SO2/H2O tolerance. J. Hazard. Mater. 396 (2020). 10.1016/j.jhazmat.2020.122592 [58] T. Boningari R.P. Ettireddy A. Somogyvari A. Vorontsov A.C. McDonald Influence of elevated surface texture hydrated titania on Ce-doped Mn/TiO2 catalysts for the low-temperature SCR of NOx under oxygen-rich conditions J. Catal. 2015 10.1016/j.jcat.2015.03.002 Boningari T., Ettireddy R.P., Somogyvari A., Vorontsov A., McDonald A.C., Influence of elevated surface texture hydrated titania on Ce-doped Mn/TiO2 catalysts for the low-temperature SCR of NOx under oxygen-rich conditions. J. Catal. (2015). 10.1016/j.jcat.2015.03.002 [59] M.Y. Li Preferred enhancement of fast-SCR by Mn/CeSiOx catalyst: study on Ce/Si promotion and shape dependence Chem. Eng. J. 403 2021 10.1016/j.cej.2020.126317 Li M.Y., Preferred enhancement of fast-SCR by Mn/CeSiOx catalyst: study on Ce/Si promotion and shape dependence. Chem. Eng. J. 403 (2021). 10.1016/j.cej.2020.126317 [60] X. Xiang Z. Sheng Y. Liu D. Fan Low-temperature selective catalytic reduction of NOx with NH3 over a manganese and cerium oxide/graphene composite prepared by a hydrothermal method Catal. Sci. Technol. 6 2016 10.1039/C5CY01228G Xiang X., Z. Sheng, Y. Liu, D. Fan, Low-temperature selective catalytic reduction of NOx with NH3 over a manganese and cerium oxide/graphene composite prepared by a hydrothermal method. Catal. Sci. Technol. 6 (2016). 10.1039/C5CY01228G [61] X. Tang J. Li J. Hao Significant enhancement of catalytic activities of manganese oxide octahedral molecular sieve by marginal amount of doping vanadium Catal. Commun. 11 2010 871 875 10.1016/j.catcom.2010.03.011 Tang X., J. Li, J. Hao, Significant enhancement of catalytic activities of manganese oxide octahedral molecular sieve by marginal amount of doping vanadium. Catal. Commun. 11 (2010) 871–875. 10.1016/j.catcom.2010.03.011 [62] P. Venkataswamy D. Jampaiah F. Lin I. Alxneit B.M. Reddy Structural properties of alumina supported Ce-Mn solid solutions and their markedly enhanced catalytic activity for CO oxidation Appl. Surf. Sci. 349 2015 10.1016/j.apsusc.2015.04.220 Venkataswamy P., D. Jampaiah, F. Lin, I. Alxneit, B.M. Reddy, Structural properties of alumina supported Ce-Mn solid solutions and their markedly enhanced catalytic activity for CO oxidation. Appl. Surf. Sci. 349 (2015). 10.1016/j.apsusc.2015.04.220 [63] X. Lu C. Song C.C. Chang Y. Teng Z. Tong X. Tang Manganese oxides supported on TiO2-graphene nanocomposite catalysts for selective catalytic reduction of NOx with NH3 at low temperature Ind. Eng. Chem. Res. 53 2014 11601 11610 10.1021/ie5016969 Lu X., C. Song, C.C. Chang, Y. Teng, Z. Tong, X. Tang, Manganese oxides supported on TiO2-graphene nanocomposite catalysts for selective catalytic reduction of NOx with NH3 at low temperature. Ind. Eng. Chem. Res. 53 (2014) 11601–11610. 10.1021/ie5016969 [64] A.M. Venezia G.D. Carlo G. Pantaleo L.F. Liotta N. Kruse Oxidation of CH4 over Pd supported on TiO2-doped SiO2: effect of Ti(IV) loading and influence of SO2 Appl. Catal. B 88 2008 430 437 10.1016/j.apcatb.2008.10.023 Venezia A.M., G.D. Carlo, G. Pantaleo, L.F. Liotta, N. Kruse, Oxidation of CH4 over Pd supported on TiO2-doped SiO2: effect of Ti(IV) loading and influence of SO2. Appl. Catal. B 88 (2008) 430–437. 10.1016/j.apcatb.2008.10.023 [65] J. Kan D. Lei L. Bing Q. Huang Y. Chen Performance of Co-doped Mn-Ce catalysts supported on cordierite for low concentration chlorobenzene oxidation Appl. Catal. A 2017 530 10.1016/j.apcata.2016.11.013 Kan J., D. Lei, L. Bing, Q. Huang, Y. Chen, Performance of Co-doped Mn-Ce catalysts supported on cordierite for low concentration chlorobenzene oxidation. Appl. Catal. A 530 (2017). 10.1016/j.apcata.2016.11.013 [66] X.P.Y.Y. Liu A basic comprehensive study on synergetic effects among the metal oxides in CeO2-WO3/TiO2 NH3-SCR catalyst Chem. Eng. J. 421 2021 127833 10.1016/j.cej.2020.127833 Liu X.P.Y.Y., A basic comprehensive study on synergetic effects among the metal oxides in CeO2-WO3/TiO2 NH3-SCR catalyst. Chem. Eng. J. 421 (2021). [67] S. Yang W. Zhu Z. Jiang Z. Chen J. Wang The surface properties and the activities in catalytic wet air oxidation over CeO2-TiO2 catalysts Appl. Surf. Sci. 252 2006 8499 8505 10.1016/j.apsusc.2005.11.067 Yang S., W. Zhu, Z. Jiang, Z. Chen, J. Wang, The surface properties and the activities in catalytic wet air oxidation over CeO2-TiO2 catalysts. Appl. Surf. Sci. 252 (2006) 8499–8505. 10.1016/j.apsusc.2005.11.067 [68] Y.Y. Zheng Z. Xu Y.B. Zhang Y.Y. Xiao Q. Zhou Mn-Fe/ACF catalyst for low-temperature selective catalytic reduction of NO J. Funct. Mater. 45 2014 20142 20145 10.3969/j.issn.1001-9731.2014.20.030 Zheng Y.Y., Z. Xu, Y.B. Zhang, Y.Y. Xiao, Q. Zhou, Mn-Fe/ACF catalyst for low-temperature selective catalytic reduction of NO. J. Funct. Mater. 45 (2014) 20142–20145. doi: 10.3969/j.issn.1001-9731.2014.20.030 [69] A. Yl A. Wl Y.A. Ran L.A. Jian D.A. Tao A. Ym W.B. Peng W.C. Zheng A. Hp D. Ta Hierarchical three-dimensionally ordered macroporous Fe-V binary metal oxide catalyst for low temperature selective catalytic reduction of NOx from marine diesel engine exhaust Appl. Catal. B 2019 268 10.1016/j.apcatb.2019.118455 Yl A., A. Wl, Y.A. Ran, L.A. Jian, D.A. Tao, A. Ym, W.B. Peng, W.C. Zheng, A. Hp, D. Ta, Hierarchical three-dimensionally ordered macroporous Fe-V binary metal oxide catalyst for low temperature selective catalytic reduction of NOx from marine diesel engine exhaust. Appl. Catal. B 268 (2019). 10.1016/j.apcatb.2019.118455 [70] Z. Si J. Ma D. Weng T. Xu W. Ziran Impacts of niobia loading on active sites and surface acidity in NbOx/CeO2-ZrO2 NH3-SCR catalysts Appl. Catal. B Environ. 2015 10.1016/j.apcatb.2015.05.038 Si Z., Ma J., Weng D., Xu T., Ziran W., Impacts of niobia loading on active sites and surface acidity in NbOx/CeO2-ZrO2 NH3-SCR catalysts. Appl. Catal. B Environ. (2015). 10.1016/j.apcatb.2015.05.038 [71] S. Xie L. Li L. Jin Y. Wu H. Liu Q. Qin X. Wei J. Liu L. Dong B. Li Low temperature high activity of M (M=Ce, Fe, Co, Ni) doped M-Mn/TiO2 catalysts for NH3-SCR and in situ DRIFTS for investigating the reaction mechanism Appl. Surf. Sci. 515 2020 10.1016/j.apsusc.2020.146014 Xie S., L. Li, L. Jin, Y. Wu, H. Liu, Q. Qin, X. Wei, J. Liu, L. Dong, B. Li, Low temperature high activity of M (M=Ce, Fe, Co, Ni) doped M-Mn/TiO2 catalysts for NH3-SCR and in situ DRIFTS for investigating the reaction mechanism. Appl. Surf. Sci. 515 (2020). 10.1016/j.apsusc.2020.146014 [72] C. Peng R. Yan H. Peng Y. Mi F. Liu One-pot synthesis of layered mesoporous ZSM-5 plus Cu ion-exchange: enhanced NH3-SCR performance on Cu-ZSM-5 with hierarchical pore structures J. Hazard. Mater. 385 2019 121593 10.1016/j.jhazmat.2019.121593 Peng C., R. Yan, H. Peng, Y. Mi, F. Liu, One-pot synthesis of layered mesoporous ZSM-5 plus Cu ion-exchange: enhanced NH3-SCR performance on Cu-ZSM-5 with hierarchical pore structures. J. Hazard. Mater. 385 (2019) 121593. 10.1016/j.jhazmat.2019.121593 [73] T. Gu R. Jin Y. Liu H. Liu Z. Wu Promoting effect of calcium doping on the performances of MnOx/TiO2 catalysts for NO reduction with NH3 at low temperature Appl. Catal. B 129 2013 30 38 10.1016/j.apcatb.2012.09.003 Gu T., R. Jin, Y. Liu, H. Liu, Z. Wu, Promoting effect of calcium doping on the performances of MnOx/TiO2 catalysts for NO reduction with NH3 at low temperature. Appl. Catal. B 129 (2013) 30–38. 10.1016/j.apcatb.2012.09.003 [74] A. Amacz A. Krztoń G. Djéga-Mariadassou Study on the selective catalytic reduction of NO with toluene over CuO/CeZrO2: a confirmation for the three-function model of HC-SCR using the temperature programmed methods and in situ DRIFTS Appl. Catal. B 142 2013 268 277 10.1016/j.apcatb.2013.05.030 Amacz A., A. Krztoń, G. Djéga-Mariadassou, Study on the selective catalytic reduction of NO with toluene over CuO/CeZrO2: a confirmation for the three-function model of HC-SCR using the temperature programmed methods and in situ DRIFTS. Appl. Catal. B 142 (2013) 268–277. 10.1016/j.apcatb.2013.05.030 [75] W. Yang B. Zhou Y. Zhang J. Ren C. Wu I.D. Gates Y. Liu Z. Gao A novel low-temperature Fe-Fe double-atom catalyst for a“fast SCR”reaction Mol. Catal. 533 2022 112769 10.1016/j.mcat.2022.112769 Yang W., B. Zhou, Y. Zhang, J. Ren, C. Wu, I.D. Gates, Y. Liu, Z. Gao, A novel low-temperature Fe-Fe double-atom catalyst for a“fast SCR”reaction. Mol. Catal. 533 (2022) 112769. 10.1016/j.mcat.2022.112769",
      "scopus-id": "85175189770",
      "coredata": {
        "eid": "1-s2.0-S2468823123006983",
        "dc:description": "The resource utilization of Cr-containing leather waste is still a great challenge. In this work, waste from leather production as raw material was attempted to be used to synthesize activated carbon, a series of MnxCe1-xZr0.5/AC composite catalysts were prepared via loading three metal elements onto activated carbon by impregnation method, the NH3-SCR performance was measured in a low temperature range of 50 ∼ 200 °C. Among them, the catalyst Mn0.7Ce0.3Zr0.5/AC displays the optimal low-temperature SCR activity, excellent resistance to GHSV, H2O and SO2. The characterization results indicated that increasing the Mn/Ce inequality ratios within a certain range would promote the electron transfer between the active metal components, thereby enhancing the synergistic effect and the redox capacity of the catalysts, and it also could significantly improve the concentration of Lewis acid sites to accelerate the adsorption and activation of NH3, resulting in different catalytic activities. The in situ DRIFTS results prove that the Lewis acid site plays a vital role in the “fast SCR” reaction, and the whole reaction process conforms to the Langmuir-Hinshelwood (L-H) mechanism.",
        "openArchiveArticle": "false",
        "prism:coverDate": "2023-12-31",
        "openaccessUserLicense": null,
        "prism:aggregationType": "Journal",
        "prism:url": "https://api.elsevier.com/content/article/pii/S2468823123006983",
        "dc:creator": [
          {
            "@_fa": "true",
            "$": "Xia, Yunbin"
          },
          {
            "@_fa": "true",
            "$": "Yang, Yuanyuan"
          },
          {
            "@_fa": "true",
            "$": "Chen, Zhiqiang"
          },
          {
            "@_fa": "true",
            "$": "Li, Mingli"
          },
          {
            "@_fa": "true",
            "$": "Lan, Ziyue"
          },
          {
            "@_fa": "true",
            "$": "Chen, Hang"
          },
          {
            "@_fa": "true",
            "$": "Huang, Chen"
          },
          {
            "@_fa": "true",
            "$": "Gao, Qi"
          },
          {
            "@_fa": "true",
            "$": "Wang, Rui"
          },
          {
            "@_fa": "true",
            "$": "Chu, Yinghao"
          },
          {
            "@_fa": "true",
            "$": "Wu, Ganxue"
          },
          {
            "@_fa": "true",
            "$": "Fang, Dexin"
          },
          {
            "@_fa": "true",
            "$": "Zeng, Zhenxin"
          },
          {
            "@_fa": "true",
            "$": "Xiao, Hong"
          }
        ],
        "link": [
          {
            "@_fa": "true",
            "@rel": "self",
            "@href": "https://api.elsevier.com/content/article/pii/S2468823123006983"
          },
          {
            "@_fa": "true",
            "@rel": "scidir",
            "@href": "https://www.sciencedirect.com/science/article/pii/S2468823123006983"
          }
        ],
        "dc:format": "application/json",
        "openaccessType": null,
        "pii": "S2468-8231(23)00698-3",
        "prism:volume": "551",
        "articleNumber": "113615",
        "prism:publisher": "Elsevier B.V.",
        "dc:title": "Boosting the low-temperature NH3-SCR performance via metals co-doping with inequality Mn/Ce ratios in the carbon-based catalyst prepared by Cr-containing leather waste",
        "prism:copyright": "© 2023 Elsevier B.V. All rights reserved.",
        "openaccess": "0",
        "prism:issn": "24688231",
        "dcterms:subject": [
          {
            "@_fa": "true",
            "$": "Leather waste"
          },
          {
            "@_fa": "true",
            "$": "Activated carbon"
          },
          {
            "@_fa": "true",
            "$": "Metal-modification"
          },
          {
            "@_fa": "true",
            "$": "NH3-SCR"
          },
          {
            "@_fa": "true",
            "$": "Metal synergies"
          }
        ],
        "openaccessArticle": "false",
        "prism:publicationName": "Molecular Catalysis",
        "openaccessSponsorType": null,
        "prism:pageRange": "113615",
        "pubType": "fla",
        "prism:coverDisplayDate": "December 2023",
        "prism:doi": "10.1016/j.mcat.2023.113615",
        "prism:startingPage": "113615",
        "dc:identifier": "doi:10.1016/j.mcat.2023.113615",
        "openaccessSponsorName": null
      },
      "objects": {
        "object": [
          {
            "@category": "standard",
            "@height": "479",
            "@width": "640",
            "@_fa": "true",
            "$": "https://api.elsevier.com/content/object/eid/1-s2.0-S2468823123006983-gr2.jpg?httpAccept=%2A%2F%2A",
            "@multimediatype": "JPEG image file",
            "@type": "IMAGE-DOWNSAMPLED",
            "@size": "117050",
            "@ref": "gr2",
            "@mimetype": "image/jpeg"
          },
          {
            "@category": "standard",
            "@height": "200",
            "@width": "312",
            "@_fa": "true",
            "$": "https://api.elsevier.com/content/object/eid/1-s2.0-S2468823123006983-ga1.jpg?httpAccept=%2A%2F%2A",
            "@multimediatype": "JPEG image file",
            "@type": "IMAGE-DOWNSAMPLED",
            "@size": "31741",
            "@ref": "ga1",
            "@mimetype": "image/jpeg"
          },
          {
            "@category": "standard",
            "@height": "867",
            "@width": "640",
            "@_fa": "true",
            "$": "https://api.elsevier.com/content/object/eid/1-s2.0-S2468823123006983-gr1.jpg?httpAccept=%2A%2F%2A",
            "@multimediatype": "JPEG image file",
            "@type": "IMAGE-DOWNSAMPLED",
            "@size": "169853",
            "@ref": "gr1",
            "@mimetype": "image/jpeg"
          },
          {
            "@category": "standard",
            "@height": "729",
            "@width": "621",
            "@_fa": "true",
            "$": "https://api.elsevier.com/content/object/eid/1-s2.0-S2468823123006983-gr6.jpg?httpAccept=%2A%2F%2A",
            "@multimediatype": "JPEG image file",
            "@type": "IMAGE-DOWNSAMPLED",
            "@size": "161061",
            "@ref": "gr6",
            "@mimetype": "image/jpeg"
          },
          {
            "@category": "standard",
            "@height": "287",
            "@width": "615",
            "@_fa": "true",
            "$": "https://api.elsevier.com/content/object/eid/1-s2.0-S2468823123006983-gr5.jpg?httpAccept=%2A%2F%2A",
            "@multimediatype": "JPEG image file",
            "@type": "IMAGE-DOWNSAMPLED",
            "@size": "61279",
            "@ref": "gr5",
            "@mimetype": "image/jpeg"
          },
          {
            "@category": "standard",
            "@height": "575",
            "@width": "610",
            "@_fa": "true",
            "$": "https://api.elsevier.com/content/object/eid/1-s2.0-S2468823123006983-gr8.jpg?httpAccept=%2A%2F%2A",
            "@multimediatype": "JPEG image file",
            "@type": "IMAGE-DOWNSAMPLED",
            "@size": "161202",
            "@ref": "gr8",
            "@mimetype": "image/jpeg"
          },
          {
            "@category": "standard",
            "@height": "259",
            "@width": "565",
            "@_fa": "true",
            "$": "https://api.elsevier.com/content/object/eid/1-s2.0-S2468823123006983-gr10.jpg?httpAccept=%2A%2F%2A",
            "@multimediatype": "JPEG image file",
            "@type": "IMAGE-DOWNSAMPLED",
            "@size": "45880",
            "@ref": "gr10",
            "@mimetype": "image/jpeg"
          },
          {
            "@category": "standard",
            "@height": "603",
            "@width": "607",
            "@_fa": "true",
            "$": "https://api.elsevier.com/content/object/eid/1-s2.0-S2468823123006983-gr7.jpg?httpAccept=%2A%2F%2A",
            "@multimediatype": "JPEG image file",
            "@type": "IMAGE-DOWNSAMPLED",
            "@size": "160586",
            "@ref": "gr7",
            "@mimetype": "image/jpeg"
          },
          {
            "@category": "standard",
            "@height": "274",
            "@width": "640",
            "@_fa": "true",
            "$": "https://api.elsevier.com/content/object/eid/1-s2.0-S2468823123006983-gr4.jpg?httpAccept=%2A%2F%2A",
            "@multimediatype": "JPEG image file",
            "@type": "IMAGE-DOWNSAMPLED",
            "@size": "56953",
            "@ref": "gr4",
            "@mimetype": "image/jpeg"
          },
          {
            "@category": "standard",
            "@height": "306",
            "@width": "351",
            "@_fa": "true",
            "$": "https://api.elsevier.com/content/object/eid/1-s2.0-S2468823123006983-gr3.jpg?httpAccept=%2A%2F%2A",
            "@multimediatype": "JPEG image file",
            "@type": "IMAGE-DOWNSAMPLED",
            "@size": "41598",
            "@ref": "gr3",
            "@mimetype": "image/jpeg"
          },
          {
            "@category": "standard",
            "@height": "589",
            "@width": "613",
            "@_fa": "true",
            "$": "https://api.elsevier.com/content/object/eid/1-s2.0-S2468823123006983-gr9.jpg?httpAccept=%2A%2F%2A",
            "@multimediatype": "JPEG image file",
            "@type": "IMAGE-DOWNSAMPLED",
            "@size": "163055",
            "@ref": "gr9",
            "@mimetype": "image/jpeg"
          },
          {
            "@category": "thumbnail",
            "@height": "164",
            "@width": "219",
            "@_fa": "true",
            "$": "https://api.elsevier.com/content/object/eid/1-s2.0-S2468823123006983-gr2.sml?httpAccept=%2A%2F%2A",
            "@multimediatype": "GIF image file",
            "@type": "IMAGE-THUMBNAIL",
            "@size": "20022",
            "@ref": "gr2",
            "@mimetype": "image/gif"
          },
          {
            "@category": "thumbnail",
            "@height": "141",
            "@width": "219",
            "@_fa": "true",
            "$": "https://api.elsevier.com/content/object/eid/1-s2.0-S2468823123006983-ga1.sml?httpAccept=%2A%2F%2A",
            "@multimediatype": "GIF image file",
            "@type": "IMAGE-THUMBNAIL",
            "@size": "20237",
            "@ref": "ga1",
            "@mimetype": "image/gif"
          },
          {
            "@category": "thumbnail",
            "@height": "164",
            "@width": "121",
            "@_fa": "true",
            "$": "https://api.elsevier.com/content/object/eid/1-s2.0-S2468823123006983-gr1.sml?httpAccept=%2A%2F%2A",
            "@multimediatype": "GIF image file",
            "@type": "IMAGE-THUMBNAIL",
            "@size": "11380",
            "@ref": "gr1",
            "@mimetype": "image/gif"
          },
          {
            "@category": "thumbnail",
            "@height": "164",
            "@width": "140",
            "@_fa": "true",
            "$": "https://api.elsevier.com/content/object/eid/1-s2.0-S2468823123006983-gr6.sml?httpAccept=%2A%2F%2A",
            "@multimediatype": "GIF image file",
            "@type": "IMAGE-THUMBNAIL",
            "@size": "13057",
            "@ref": "gr6",
            "@mimetype": "image/gif"
          },
          {
            "@category": "thumbnail",
            "@height": "102",
            "@width": "219",
            "@_fa": "true",
            "$": "https://api.elsevier.com/content/object/eid/1-s2.0-S2468823123006983-gr5.sml?httpAccept=%2A%2F%2A",
            "@multimediatype": "GIF image file",
            "@type": "IMAGE-THUMBNAIL",
            "@size": "11976",
            "@ref": "gr5",
            "@mimetype": "image/gif"
          },
          {
            "@category": "thumbnail",
            "@height": "164",
            "@width": "174",
            "@_fa": "true",
            "$": "https://api.elsevier.com/content/object/eid/1-s2.0-S2468823123006983-gr8.sml?httpAccept=%2A%2F%2A",
            "@multimediatype": "GIF image file",
            "@type": "IMAGE-THUMBNAIL",
            "@size": "19669",
            "@ref": "gr8",
            "@mimetype": "image/gif"
          },
          {
            "@category": "thumbnail",
            "@height": "100",
            "@width": "219",
            "@_fa": "true",
            "$": "https://api.elsevier.com/content/object/eid/1-s2.0-S2468823123006983-gr10.sml?httpAccept=%2A%2F%2A",
            "@multimediatype": "GIF image file",
            "@type": "IMAGE-THUMBNAIL",
            "@size": "10697",
            "@ref": "gr10",
            "@mimetype": "image/gif"
          },
          {
            "@category": "thumbnail",
            "@height": "164",
            "@width": "165",
            "@_fa": "true",
            "$": "https://api.elsevier.com/content/object/eid/1-s2.0-S2468823123006983-gr7.sml?httpAccept=%2A%2F%2A",
            "@multimediatype": "GIF image file",
            "@type": "IMAGE-THUMBNAIL",
            "@size": "18294",
            "@ref": "gr7",
            "@mimetype": "image/gif"
          },
          {
            "@category": "thumbnail",
            "@height": "94",
            "@width": "219",
            "@_fa": "true",
            "$": "https://api.elsevier.com/content/object/eid/1-s2.0-S2468823123006983-gr4.sml?httpAccept=%2A%2F%2A",
            "@multimediatype": "GIF image file",
            "@type": "IMAGE-THUMBNAIL",
            "@size": "11971",
            "@ref": "gr4",
            "@mimetype": "image/gif"
          },
          {
            "@category": "thumbnail",
            "@height": "164",
            "@width": "188",
            "@_fa": "true",
            "$": "https://api.elsevier.com/content/object/eid/1-s2.0-S2468823123006983-gr3.sml?httpAccept=%2A%2F%2A",
            "@multimediatype": "GIF image file",
            "@type": "IMAGE-THUMBNAIL",
            "@size": "13608",
            "@ref": "gr3",
            "@mimetype": "image/gif"
          },
          {
            "@category": "thumbnail",
            "@height": "163",
            "@width": "170",
            "@_fa": "true",
            "$": "https://api.elsevier.com/content/object/eid/1-s2.0-S2468823123006983-gr9.sml?httpAccept=%2A%2F%2A",
            "@multimediatype": "GIF image file",
            "@type": "IMAGE-THUMBNAIL",
            "@size": "18886",
            "@ref": "gr9",
            "@mimetype": "image/gif"
          },
          {
            "@category": "high",
            "@height": "2122",
            "@width": "2833",
            "@_fa": "true",
            "$": "https://api.elsevier.com/content/object/eid/1-s2.0-S2468823123006983-gr2_lrg.jpg?httpAccept=%2A%2F%2A",
            "@multimediatype": "JPEG image file",
            "@type": "IMAGE-HIGH-RES",
            "@size": "1087034",
            "@ref": "gr2",
            "@mimetype": "image/jpeg"
          },
          {
            "@category": "high",
            "@height": "886",
            "@width": "1381",
            "@_fa": "true",
            "$": "https://api.elsevier.com/content/object/eid/1-s2.0-S2468823123006983-ga1_lrg.jpg?httpAccept=%2A%2F%2A",
            "@multimediatype": "JPEG image file",
            "@type": "IMAGE-HIGH-RES",
            "@size": "243586",
            "@ref": "ga1",
            "@mimetype": "image/jpeg"
          },
          {
            "@category": "high",
            "@height": "3837",
            "@width": "2833",
            "@_fa": "true",
            "$": "https://api.elsevier.com/content/object/eid/1-s2.0-S2468823123006983-gr1_lrg.jpg?httpAccept=%2A%2F%2A",
            "@multimediatype": "JPEG image file",
            "@type": "IMAGE-HIGH-RES",
            "@size": "1289432",
            "@ref": "gr1",
            "@mimetype": "image/jpeg"
          },
          {
            "@category": "high",
            "@height": "3225",
            "@width": "2749",
            "@_fa": "true",
            "$": "https://api.elsevier.com/content/object/eid/1-s2.0-S2468823123006983-gr6_lrg.jpg?httpAccept=%2A%2F%2A",
            "@multimediatype": "JPEG image file",
            "@type": "IMAGE-HIGH-RES",
            "@size": "1331310",
            "@ref": "gr6",
            "@mimetype": "image/jpeg"
          },
          {
            "@category": "high",
            "@height": "1271",
            "@width": "2725",
            "@_fa": "true",
            "$": "https://api.elsevier.com/content/object/eid/1-s2.0-S2468823123006983-gr5_lrg.jpg?httpAccept=%2A%2F%2A",
            "@multimediatype": "JPEG image file",
            "@type": "IMAGE-HIGH-RES",
            "@size": "499742",
            "@ref": "gr5",
            "@mimetype": "image/jpeg"
          },
          {
            "@category": "high",
            "@height": "2548",
            "@width": "2703",
            "@_fa": "true",
            "$": "https://api.elsevier.com/content/object/eid/1-s2.0-S2468823123006983-gr8_lrg.jpg?httpAccept=%2A%2F%2A",
            "@multimediatype": "JPEG image file",
            "@type": "IMAGE-HIGH-RES",
            "@size": "1377758",
            "@ref": "gr8",
            "@mimetype": "image/jpeg"
          },
          {
            "@category": "high",
            "@height": "1147",
            "@width": "2500",
            "@_fa": "true",
            "$": "https://api.elsevier.com/content/object/eid/1-s2.0-S2468823123006983-gr10_lrg.jpg?httpAccept=%2A%2F%2A",
            "@multimediatype": "JPEG image file",
            "@type": "IMAGE-HIGH-RES",
            "@size": "356395",
            "@ref": "gr10",
            "@mimetype": "image/jpeg"
          },
          {
            "@category": "high",
            "@height": "2672",
            "@width": "2689",
            "@_fa": "true",
            "$": "https://api.elsevier.com/content/object/eid/1-s2.0-S2468823123006983-gr7_lrg.jpg?httpAccept=%2A%2F%2A",
            "@multimediatype": "JPEG image file",
            "@type": "IMAGE-HIGH-RES",
            "@size": "1377216",
            "@ref": "gr7",
            "@mimetype": "image/jpeg"
          },
          {
            "@category": "high",
            "@height": "1215",
            "@width": "2833",
            "@_fa": "true",
            "$": "https://api.elsevier.com/content/object/eid/1-s2.0-S2468823123006983-gr4_lrg.jpg?httpAccept=%2A%2F%2A",
            "@multimediatype": "JPEG image file",
            "@type": "IMAGE-HIGH-RES",
            "@size": "453077",
            "@ref": "gr4",
            "@mimetype": "image/jpeg"
          },
          {
            "@category": "high",
            "@height": "1358",
            "@width": "1557",
            "@_fa": "true",
            "$": "https://api.elsevier.com/content/object/eid/1-s2.0-S2468823123006983-gr3_lrg.jpg?httpAccept=%2A%2F%2A",
            "@multimediatype": "JPEG image file",
            "@type": "IMAGE-HIGH-RES",
            "@size": "324698",
            "@ref": "gr3",
            "@mimetype": "image/jpeg"
          },
          {
            "@category": "high",
            "@height": "2607",
            "@width": "2714",
            "@_fa": "true",
            "$": "https://api.elsevier.com/content/object/eid/1-s2.0-S2468823123006983-gr9_lrg.jpg?httpAccept=%2A%2F%2A",
            "@multimediatype": "JPEG image file",
            "@type": "IMAGE-HIGH-RES",
            "@size": "1404529",
            "@ref": "gr9",
            "@mimetype": "image/jpeg"
          },
          {
            "@category": "standard",
            "@_fa": "true",
            "$": "https://api.elsevier.com/content/object/eid/1-s2.0-S2468823123006983-mmc1.docx?httpAccept=%2A%2F%2A",
            "@multimediatype": "Microsoft Word file",
            "@type": "APPLICATION",
            "@size": "2131634",
            "@ref": "mmc1",
            "@mimetype": "application/word"
          },
          {
            "@category": "thumbnail",
            "@_fa": "true",
            "$": "https://api.elsevier.com/content/object/eid/1-s2.0-S2468823123006983-si1.svg?httpAccept=%2A%2F%2A",
            "@multimediatype": "Scalable Vector Graphics file",
            "@type": "ALTIMG",
            "@size": "5722",
            "@ref": "si1",
            "@mimetype": "image/svg+xml"
          },
          {
            "@category": "thumbnail",
            "@_fa": "true",
            "$": "https://api.elsevier.com/content/object/eid/1-s2.0-S2468823123006983-si10.svg?httpAccept=%2A%2F%2A",
            "@multimediatype": "Scalable Vector Graphics file",
            "@type": "ALTIMG",
            "@size": "6493",
            "@ref": "si10",
            "@mimetype": "image/svg+xml"
          },
          {
            "@category": "thumbnail",
            "@_fa": "true",
            "$": "https://api.elsevier.com/content/object/eid/1-s2.0-S2468823123006983-si11.svg?httpAccept=%2A%2F%2A",
            "@multimediatype": "Scalable Vector Graphics file",
            "@type": "ALTIMG",
            "@size": "7548",
            "@ref": "si11",
            "@mimetype": "image/svg+xml"
          },
          {
            "@category": "thumbnail",
            "@_fa": "true",
            "$": "https://api.elsevier.com/content/object/eid/1-s2.0-S2468823123006983-si12.svg?httpAccept=%2A%2F%2A",
            "@multimediatype": "Scalable Vector Graphics file",
            "@type": "ALTIMG",
            "@size": "7217",
            "@ref": "si12",
            "@mimetype": "image/svg+xml"
          },
          {
            "@category": "thumbnail",
            "@_fa": "true",
            "$": "https://api.elsevier.com/content/object/eid/1-s2.0-S2468823123006983-si13.svg?httpAccept=%2A%2F%2A",
            "@multimediatype": "Scalable Vector Graphics file",
            "@type": "ALTIMG",
            "@size": "7507",
            "@ref": "si13",
            "@mimetype": "image/svg+xml"
          },
          {
            "@category": "thumbnail",
            "@_fa": "true",
            "$": "https://api.elsevier.com/content/object/eid/1-s2.0-S2468823123006983-si14.svg?httpAccept=%2A%2F%2A",
            "@multimediatype": "Scalable Vector Graphics file",
            "@type": "ALTIMG",
            "@size": "8739",
            "@ref": "si14",
            "@mimetype": "image/svg+xml"
          },
          {
            "@category": "thumbnail",
            "@_fa": "true",
            "$": "https://api.elsevier.com/content/object/eid/1-s2.0-S2468823123006983-si15.svg?httpAccept=%2A%2F%2A",
            "@multimediatype": "Scalable Vector Graphics file",
            "@type": "ALTIMG",
            "@size": "9301",
            "@ref": "si15",
            "@mimetype": "image/svg+xml"
          },
          {
            "@category": "thumbnail",
            "@_fa": "true",
            "$": "https://api.elsevier.com/content/object/eid/1-s2.0-S2468823123006983-si2.svg?httpAccept=%2A%2F%2A",
            "@multimediatype": "Scalable Vector Graphics file",
            "@type": "ALTIMG",
            "@size": "6240",
            "@ref": "si2",
            "@mimetype": "image/svg+xml"
          },
          {
            "@category": "thumbnail",
            "@_fa": "true",
            "$": "https://api.elsevier.com/content/object/eid/1-s2.0-S2468823123006983-si3.svg?httpAccept=%2A%2F%2A",
            "@multimediatype": "Scalable Vector Graphics file",
            "@type": "ALTIMG",
            "@size": "7604",
            "@ref": "si3",
            "@mimetype": "image/svg+xml"
          },
          {
            "@category": "thumbnail",
            "@_fa": "true",
            "$": "https://api.elsevier.com/content/object/eid/1-s2.0-S2468823123006983-si4.svg?httpAccept=%2A%2F%2A",
            "@multimediatype": "Scalable Vector Graphics file",
            "@type": "ALTIMG",
            "@size": "7870",
            "@ref": "si4",
            "@mimetype": "image/svg+xml"
          },
          {
            "@category": "thumbnail",
            "@_fa": "true",
            "$": "https://api.elsevier.com/content/object/eid/1-s2.0-S2468823123006983-si5.svg?httpAccept=%2A%2F%2A",
            "@multimediatype": "Scalable Vector Graphics file",
            "@type": "ALTIMG",
            "@size": "9247",
            "@ref": "si5",
            "@mimetype": "image/svg+xml"
          },
          {
            "@category": "thumbnail",
            "@_fa": "true",
            "$": "https://api.elsevier.com/content/object/eid/1-s2.0-S2468823123006983-si6.svg?httpAccept=%2A%2F%2A",
            "@multimediatype": "Scalable Vector Graphics file",
            "@type": "ALTIMG",
            "@size": "9841",
            "@ref": "si6",
            "@mimetype": "image/svg+xml"
          },
          {
            "@category": "thumbnail",
            "@_fa": "true",
            "$": "https://api.elsevier.com/content/object/eid/1-s2.0-S2468823123006983-si7.svg?httpAccept=%2A%2F%2A",
            "@multimediatype": "Scalable Vector Graphics file",
            "@type": "ALTIMG",
            "@size": "6126",
            "@ref": "si7",
            "@mimetype": "image/svg+xml"
          },
          {
            "@category": "thumbnail",
            "@_fa": "true",
            "$": "https://api.elsevier.com/content/object/eid/1-s2.0-S2468823123006983-si8.svg?httpAccept=%2A%2F%2A",
            "@multimediatype": "Scalable Vector Graphics file",
            "@type": "ALTIMG",
            "@size": "6774",
            "@ref": "si8",
            "@mimetype": "image/svg+xml"
          },
          {
            "@category": "thumbnail",
            "@_fa": "true",
            "$": "https://api.elsevier.com/content/object/eid/1-s2.0-S2468823123006983-si9.svg?httpAccept=%2A%2F%2A",
            "@multimediatype": "Scalable Vector Graphics file",
            "@type": "ALTIMG",
            "@size": "6501",
            "@ref": "si9",
            "@mimetype": "image/svg+xml"
          },
          {
            "@category": "standard",
            "@_fa": "true",
            "$": "https://api.elsevier.com/content/object/eid/1-s2.0-S2468823123006983-am.pdf?httpAccept=%2A%2F%2A",
            "@multimediatype": "Acrobat PDF file",
            "@type": "AAM-PDF",
            "@size": "3591359",
            "@ref": "am",
            "@mimetype": "application/pdf"
          }
        ]
      },
      "link": {
        "@rel": "abstract",
        "@href": "https://api.elsevier.com/content/abstract/scopus_id/85175189770"
      }
    }
  }
}