{
  "metadata": {
    "title": "A review with transition-metal phosphide electrocatalysts in hydrogen evolution reaction: Doping perspective",
    "authors": "; ; ",
    "journal": "Molecular Catalysis",
    "date": "2024-02-01",
    "doi": "10.1016/j.mcat.2024.113832",
    "abstract": "",
    "uri": "https://api.elsevier.com/content/article/pii/S2468823124000154",
    "pii": "S2468823124000154"
  },
  "fulltext": {
    "full-text-retrieval-response": {
      "scopus-eid": "2-s2.0-85183201968",
      "originalText": "serial JL 315758 291210 291744 291790 291809 31 Molecular Catalysis MOLECULARCATALYSIS 2024-01-19 2024-01-19 2024-01-19 2024-01-19 2024-02-13T11:57:35 1-s2.0-S2468823124000154 S2468-8231(24)00015-4 S2468823124000154 10.1016/j.mcat.2024.113832 S300 S300.2 FULL-TEXT 1-s2.0-S2468823123X00200 2024-02-26T04:34:03.282817Z 0 0 20240201 2024 2024-01-19T06:58:06.999264Z absattachment articleinfo articlenumber articletitlenorm authfirstinitialnorm authfirstsurnamenorm cid cids contenttype copyright crossmark dateloaded dateloadedtxt datesearch datesort dateupdated dco docsubtype doctype doi eid ewtransactionid hubeid indexeddate issn issnnorm itemstage itemtransactionid itemweight openaccess openarchive pg pgfirst pii piinorm pubdatestart pubdatetxt pubyr sectiontitle sortorder srctitle srctitlenorm srctype ssids alllist content subj subheadings suppl tomb volfirst volissue volumelist webpdf webpdfpagecount yearnav figure table body acknowledge affil articletitle auth authfirstini authfull authkeywords authlast grantnumber grantsponsor highlightsabst primabst pubtype ref specialabst 2468-8231 24688231 true 554 554 C Volume 554 31 113832 113832 113832 20240201 1 February 2024 2024-02-01 2024 Review Papers article rev © 2024 Elsevier B.V. All rights reserved. AREVIEWTRANSITIONMETALPHOSPHIDEELECTROCATALYSTSINHYDROGENEVOLUTIONREACTIONDOPINGPERSPECTIVE JING C 1 Introduction 2 Hydrogen evolution reaction mechanism 3 Preparation method of TMPs 3.1 Colloidal synthesis 3.2 Hydrothermal 3.3 Chemical vapor deposition 3.4 Electrodeposition 4 The effect of metal doping on TMPs 4.1 Mn doping 4.2 Fe doping 4.3 Ni doping 4.4 Co doping 4.5 Other metal atoms doping 5 Summary and outlook CRediT authorship contribution statement Acknowledgments References WU 2023 Y TOAN 2023 538 T LI 2021 7539 7586 S QI 2021 13051 13085 M LI 2018 13082 13085 S ZHAO 2022 520 H LIU 2021 404 H ZHONG 2021 14222 14233 M MAHADIK 2022 14655 14673 S WANG 2023 339 S MOHAMMADI 2021 1165 A WANG 2021 12 N KUMAR 2023 A ZOU 2022 509 515 X GUO 2023 625 P CALISKAN 2022 3790 3798 S WU 2023 35 J LI 2016 48 H YANG 2019 132 139 Y REN 2022 Y YUAN 2016 1 36 L ZHU 2021 1928 1958 Y LI 2019 Y SONG 2014 F HU 2022 F WANG 2022 3946 3951 T YAN 2021 446 462 Y PAN 2019 411 419 Y LI 2020 Y SHI 2016 1529 1541 Y ZHANG 2017 362 370 T YAN 2017 27 L KIBSGAARD 2014 248 253 J YU 2021 33 Z SHI 2021 649 735 Y ZHANG 2022 X YANG 2017 3824 3831 F SUN 2017 16674 16679 Y SUBBARAMAN 2011 1256 1260 R XUE 2020 10934 10938 S WANG 2018 30 X WANG 2017 29 J LI 2021 Z PARK 2020 32780 32788 Y LIU 2018 19100 19106 Q CAI 2020 30 C XIONG 2020 611 614 K GUO 2020 4990 4993 D LU 2020 Z WANG 2019 2518 2523 K SUN 2018 22062 22069 H SUN 2019 9621 9628 D BU 2019 14526 14535 F HUANG 2012 1713 1715 H ZHAO 2017 19 Q LI 2019 2286 2297 W LI 2019 29 W KIM 2019 13494 13501 K TAN 2016 2951 2955 Y JIANG 2019 21069 21078 Y XU 2018 5574 5579 W YAN 2023 547 H SONG 2022 H LI 2022 32 S SEO 2016 6083 6089 B LI 2018 11748 11754 H GHOSH 2020 S LI 2016 10826 10834 J CAI 2021 J HAN 2021 12 A CHEN 2023 170 K HE 2023 X SHAJIRATI 2023 278 Y TALLAPALLY 2016 5406 5414 V CALLEJAS 2014 11101 11107 J POPCZUN 2014 5427 5430 E POPCZUN 2013 9267 9270 E DU 2018 21617 21624 H WANG 2015 6738 6741 X FU 2022 T HUANG 2014 16 X WANG 2016 11 15 D WU 2015 10360 10367 T JIANG 2015 6251 6254 N ZHAO 2020 380 P YU 2019 191 198 C GE 2020 14081 14104 Z MENG 2022 9832 9839 C LIU 2017 98 102 T KIBSGAARD 2015 3022 3029 J LI 2016 4006 4009 D LI 2021 X ZHOU 2018 14939 14948 X HUANG 2016 2137 2141 J ZHOU 2019 22530 22538 D WANG 2018 1 8 X WANG 2017 1041 1044 J JIANG 2014 13440 13445 P WANG 2019 12419 12427 M MU 2021 551 Z LIU 2018 Y LI 2019 20658 20666 Y LI 2017 13 F YOU 2015 7636 7642 B MA 2017 788 798 Y YU 2019 10 L LIN 2021 92 101 Y SUO 2020 N SUN 2019 8882 H ZHAO 2021 823 832 Y FAN 2016 2167 2170 H PEI 2017 31887 31896 Y LU 2019 X HAN 2010 5194 5201 Q MCENANEY 2014 11026 11028 J MORALESGUIO 2014 2671 2681 C PENG 2018 66 73 X CHEN 2019 225 233 J LI 2016 6785 6796 J RONG 2019 28833 28840 Y CHO 2020 510 G RAI 2016 1424 1432 V HAN 2019 6302 6310 Y ZHANG 2017 4793 4800 R TIAN 2014 7587 7590 J LIU 2014 6710 6714 Q LONG 2015 11900 11903 X NORSKOV 2002 275 278 J DONG 2023 547 X CHEN 2020 279 D XIONG 2021 295 L GREELEY 2006 909 913 J JINGX2024X113832 JINGX2024X113832XC 2026-01-19T00:00:00.000Z 2026-01-19T00:00:00.000Z http://creativecommons.org/licenses/by-nc-nd/4.0/ © 2024 Elsevier B.V. All rights reserved. 2024-01-31T18:30:59.373Z http://vtw.elsevier.com/data/voc/AddOnTypes/50.7/aggregated-refined International Cooperation Research 2016YFE0110800 2017YFE0108300 Natural Scientific Foundation of China 51273096 51473082 52003135 NSFC National Natural Science Foundation of China http://data.elsevier.com/vocabulary/SciValFunders/501100001809 http://sws.geonames.org/1814991/ Program for Introducing Talents of Discipline to Universities Project 211 http://data.elsevier.com/vocabulary/SciValFunders/501100012176 http://sws.geonames.org/1814991/ This work is supported by (1) the Natural Scientific Foundation of China (Grant Nos. 52003135, 51273096, 51473082 ); (2) State Key Project of International Cooperation Research ( 2017YFE0108300, 2016YFE0110800 ); (3) Shandong double-hundred project; (4) the Program for Introducing Talents of Discipline to Universities (“111” plan); (6) The high level discipline program of Shandong Province of China. https://doi.org/10.15223/policy-017 https://doi.org/10.15223/policy-037 https://doi.org/10.15223/policy-012 https://doi.org/10.15223/policy-029 https://doi.org/10.15223/policy-004 item S2468-8231(24)00015-4 S2468823124000154 1-s2.0-S2468823124000154 10.1016/j.mcat.2024.113832 315758 2024-02-26T04:34:03.282817Z 2024-02-01 1-s2.0-S2468823124000154-main.pdf https://s3-eu-west-1.amazonaws.com/prod-ucs-content-store-eu-west/content/pii:S2468823124000154/MAIN/application/pdf/3faa165714bd8e3982cdaf6c7acf1a0f/main.pdf main.pdf pdf true 12998662 MAIN 14 1-s2.0-S2468823124000154-main_1.png https://s3-eu-west-1.amazonaws.com/prod-ucs-content-store-eu-west/content/pii:S2468823124000154/PREVIEW/image/png/33d28210490d38743e720af6cf2dcc1f/main_1.png main_1.png png 58008 849 656 IMAGE-WEB-PDF 1 1-s2.0-S2468823124000154-gr9.jpg https://s3-eu-west-1.amazonaws.com/prod-ucs-content-store-eu-west/content/pii:S2468823124000154/gr9/DOWNSAMPLED/image/jpeg/dab7d98d435b1a2716b26d781da3b90b/gr9.jpg gr9 gr9.jpg jpg 57010 373 565 IMAGE-DOWNSAMPLED 1-s2.0-S2468823124000154-gr8.jpg https://s3-eu-west-1.amazonaws.com/prod-ucs-content-store-eu-west/content/pii:S2468823124000154/gr8/DOWNSAMPLED/image/jpeg/c06b92924e97782f27a757e36285e180/gr8.jpg gr8 gr8.jpg jpg 62946 431 565 IMAGE-DOWNSAMPLED 1-s2.0-S2468823124000154-gr5.jpg https://s3-eu-west-1.amazonaws.com/prod-ucs-content-store-eu-west/content/pii:S2468823124000154/gr5/DOWNSAMPLED/image/jpeg/438c184cdd18bccd68c729a8fbd14b3b/gr5.jpg gr5 gr5.jpg jpg 76605 423 565 IMAGE-DOWNSAMPLED 1-s2.0-S2468823124000154-gr10.jpg https://s3-eu-west-1.amazonaws.com/prod-ucs-content-store-eu-west/content/pii:S2468823124000154/gr10/DOWNSAMPLED/image/jpeg/152cf03a17e90d097717d26e3e2fe527/gr10.jpg gr10 gr10.jpg jpg 86587 383 565 IMAGE-DOWNSAMPLED 1-s2.0-S2468823124000154-gr4.jpg https://s3-eu-west-1.amazonaws.com/prod-ucs-content-store-eu-west/content/pii:S2468823124000154/gr4/DOWNSAMPLED/image/jpeg/b92f33817b7c91514c8ea500159dd9ca/gr4.jpg gr4 gr4.jpg jpg 34076 214 565 IMAGE-DOWNSAMPLED 1-s2.0-S2468823124000154-gr7.jpg https://s3-eu-west-1.amazonaws.com/prod-ucs-content-store-eu-west/content/pii:S2468823124000154/gr7/DOWNSAMPLED/image/jpeg/5404a05c76666f85b6f6087a264e0915/gr7.jpg gr7 gr7.jpg jpg 60898 301 565 IMAGE-DOWNSAMPLED 1-s2.0-S2468823124000154-gr6.jpg https://s3-eu-west-1.amazonaws.com/prod-ucs-content-store-eu-west/content/pii:S2468823124000154/gr6/DOWNSAMPLED/image/jpeg/522773e6ecfcbccf0ffb9a3164b2335c/gr6.jpg gr6 gr6.jpg jpg 68545 361 565 IMAGE-DOWNSAMPLED 1-s2.0-S2468823124000154-gr1.jpg https://s3-eu-west-1.amazonaws.com/prod-ucs-content-store-eu-west/content/pii:S2468823124000154/gr1/DOWNSAMPLED/image/jpeg/8736b42dbed250aeb0028d4ab6930e0c/gr1.jpg gr1 gr1.jpg jpg 46890 279 565 IMAGE-DOWNSAMPLED 1-s2.0-S2468823124000154-gr3.jpg https://s3-eu-west-1.amazonaws.com/prod-ucs-content-store-eu-west/content/pii:S2468823124000154/gr3/DOWNSAMPLED/image/jpeg/fa96447d9726e830bb5c5b811cf9c9d2/gr3.jpg gr3 gr3.jpg jpg 87333 421 565 IMAGE-DOWNSAMPLED 1-s2.0-S2468823124000154-gr2.jpg https://s3-eu-west-1.amazonaws.com/prod-ucs-content-store-eu-west/content/pii:S2468823124000154/gr2/DOWNSAMPLED/image/jpeg/c168a39349da0929444c8c63226315c9/gr2.jpg gr2 gr2.jpg jpg 76029 450 565 IMAGE-DOWNSAMPLED 1-s2.0-S2468823124000154-ga1.jpg https://s3-eu-west-1.amazonaws.com/prod-ucs-content-store-eu-west/content/pii:S2468823124000154/ga1/DOWNSAMPLED/image/jpeg/e484c8ae8fd0c05177ec847e9d88b584/ga1.jpg ga1 true ga1.jpg jpg 32334 200 258 IMAGE-DOWNSAMPLED 1-s2.0-S2468823124000154-sc1.jpg https://s3-eu-west-1.amazonaws.com/prod-ucs-content-store-eu-west/content/pii:S2468823124000154/sc1/DOWNSAMPLED/image/jpeg/ecd2145e266646d059c485c5cfca87b2/sc1.jpg sc1 sc1.jpg jpg 45296 391 386 IMAGE-DOWNSAMPLED 1-s2.0-S2468823124000154-gr9.sml https://s3-eu-west-1.amazonaws.com/prod-ucs-content-store-eu-west/content/pii:S2468823124000154/gr9/THUMBNAIL/image/gif/37a8a4432fb67e55243b76143f8f37b7/gr9.sml gr9 gr9.sml sml 13826 145 219 IMAGE-THUMBNAIL 1-s2.0-S2468823124000154-gr8.sml https://s3-eu-west-1.amazonaws.com/prod-ucs-content-store-eu-west/content/pii:S2468823124000154/gr8/THUMBNAIL/image/gif/be038952a10812b2429dafd1a9cee5f9/gr8.sml gr8 gr8.sml sml 17077 164 215 IMAGE-THUMBNAIL 1-s2.0-S2468823124000154-gr5.sml https://s3-eu-west-1.amazonaws.com/prod-ucs-content-store-eu-west/content/pii:S2468823124000154/gr5/THUMBNAIL/image/gif/f244b7b0e183abc57d773eb533e1a704/gr5.sml gr5 gr5.sml sml 20132 164 219 IMAGE-THUMBNAIL 1-s2.0-S2468823124000154-gr10.sml https://s3-eu-west-1.amazonaws.com/prod-ucs-content-store-eu-west/content/pii:S2468823124000154/gr10/THUMBNAIL/image/gif/45ff2bb4d2cc4e8f1bf6877f2c26e97c/gr10.sml gr10 gr10.sml sml 26123 148 219 IMAGE-THUMBNAIL 1-s2.0-S2468823124000154-gr4.sml https://s3-eu-west-1.amazonaws.com/prod-ucs-content-store-eu-west/content/pii:S2468823124000154/gr4/THUMBNAIL/image/gif/c4687e260ce9d292a287302f2c39b596/gr4.sml gr4 gr4.sml sml 11929 83 219 IMAGE-THUMBNAIL 1-s2.0-S2468823124000154-gr7.sml https://s3-eu-west-1.amazonaws.com/prod-ucs-content-store-eu-west/content/pii:S2468823124000154/gr7/THUMBNAIL/image/gif/43060302beb49cd71795f818809e2080/gr7.sml gr7 gr7.sml sml 14808 117 219 IMAGE-THUMBNAIL 1-s2.0-S2468823124000154-gr6.sml https://s3-eu-west-1.amazonaws.com/prod-ucs-content-store-eu-west/content/pii:S2468823124000154/gr6/THUMBNAIL/image/gif/e96ae4299855ea49c1664a44ee91c7bf/gr6.sml gr6 gr6.sml sml 16531 140 219 IMAGE-THUMBNAIL 1-s2.0-S2468823124000154-gr1.sml https://s3-eu-west-1.amazonaws.com/prod-ucs-content-store-eu-west/content/pii:S2468823124000154/gr1/THUMBNAIL/image/gif/320cfacfa89c1aa889b05ac022923bde/gr1.sml gr1 gr1.sml sml 14164 108 219 IMAGE-THUMBNAIL 1-s2.0-S2468823124000154-gr3.sml https://s3-eu-west-1.amazonaws.com/prod-ucs-content-store-eu-west/content/pii:S2468823124000154/gr3/THUMBNAIL/image/gif/636dd7789218844d45470f45c6024ffc/gr3.sml gr3 gr3.sml sml 23625 163 219 IMAGE-THUMBNAIL 1-s2.0-S2468823124000154-gr2.sml https://s3-eu-west-1.amazonaws.com/prod-ucs-content-store-eu-west/content/pii:S2468823124000154/gr2/THUMBNAIL/image/gif/fd3dbc18baa0562f85950e49866228de/gr2.sml gr2 gr2.sml sml 17931 164 206 IMAGE-THUMBNAIL 1-s2.0-S2468823124000154-ga1.sml https://s3-eu-west-1.amazonaws.com/prod-ucs-content-store-eu-west/content/pii:S2468823124000154/ga1/THUMBNAIL/image/gif/602c9509fd3cf0159c6cf948247c2bbe/ga1.sml ga1 true ga1.sml sml 24240 164 211 IMAGE-THUMBNAIL 1-s2.0-S2468823124000154-sc1.sml https://s3-eu-west-1.amazonaws.com/prod-ucs-content-store-eu-west/content/pii:S2468823124000154/sc1/THUMBNAIL/image/gif/076e85d08a1d9b97ca9d091ef0006e8c/sc1.sml sc1 sc1.sml sml 11877 164 162 IMAGE-THUMBNAIL 1-s2.0-S2468823124000154-gr9_lrg.jpg https://s3-eu-west-1.amazonaws.com/prod-ucs-content-store-eu-west/content/pii:S2468823124000154/HIGHRES/image/jpeg/3a1541fc582a8d2e7c4b0a92d85a1b9a/gr9_lrg.jpg gr9 gr9_lrg.jpg jpg 393208 1651 2500 IMAGE-HIGH-RES 1-s2.0-S2468823124000154-gr8_lrg.jpg https://s3-eu-west-1.amazonaws.com/prod-ucs-content-store-eu-west/content/pii:S2468823124000154/HIGHRES/image/jpeg/5435f2f44d1c3e6292de3191501858cb/gr8_lrg.jpg gr8 gr8_lrg.jpg jpg 487598 1909 2500 IMAGE-HIGH-RES 1-s2.0-S2468823124000154-gr5_lrg.jpg https://s3-eu-west-1.amazonaws.com/prod-ucs-content-store-eu-west/content/pii:S2468823124000154/HIGHRES/image/jpeg/cdbdd75c2ffca7fe920f7d1dee791c1d/gr5_lrg.jpg gr5 gr5_lrg.jpg jpg 589719 1871 2500 IMAGE-HIGH-RES 1-s2.0-S2468823124000154-gr10_lrg.jpg https://s3-eu-west-1.amazonaws.com/prod-ucs-content-store-eu-west/content/pii:S2468823124000154/HIGHRES/image/jpeg/43cf21de9a0046fedfbe6f7560d98f8d/gr10_lrg.jpg gr10 gr10_lrg.jpg jpg 726324 1694 2500 IMAGE-HIGH-RES 1-s2.0-S2468823124000154-gr4_lrg.jpg https://s3-eu-west-1.amazonaws.com/prod-ucs-content-store-eu-west/content/pii:S2468823124000154/HIGHRES/image/jpeg/658bef97dd2487e30c4654cde3f70084/gr4_lrg.jpg gr4 gr4_lrg.jpg jpg 245293 946 2500 IMAGE-HIGH-RES 1-s2.0-S2468823124000154-gr7_lrg.jpg https://s3-eu-west-1.amazonaws.com/prod-ucs-content-store-eu-west/content/pii:S2468823124000154/HIGHRES/image/jpeg/4e865ef4576e4efc4e9c4b54416b5f94/gr7_lrg.jpg gr7 gr7_lrg.jpg jpg 472639 1330 2500 IMAGE-HIGH-RES 1-s2.0-S2468823124000154-gr6_lrg.jpg https://s3-eu-west-1.amazonaws.com/prod-ucs-content-store-eu-west/content/pii:S2468823124000154/HIGHRES/image/jpeg/662de5975eb33dd6943b7fc1c83c13f7/gr6_lrg.jpg gr6 gr6_lrg.jpg jpg 494169 1599 2500 IMAGE-HIGH-RES 1-s2.0-S2468823124000154-gr1_lrg.jpg https://s3-eu-west-1.amazonaws.com/prod-ucs-content-store-eu-west/content/pii:S2468823124000154/HIGHRES/image/jpeg/98d24c5e697cdf27c0e952b1dcebfbd1/gr1_lrg.jpg gr1 gr1_lrg.jpg jpg 350631 1234 2500 IMAGE-HIGH-RES 1-s2.0-S2468823124000154-gr3_lrg.jpg https://s3-eu-west-1.amazonaws.com/prod-ucs-content-store-eu-west/content/pii:S2468823124000154/HIGHRES/image/jpeg/9c9a6cdf43c6260fd277e6d512fec1ca/gr3_lrg.jpg gr3 gr3_lrg.jpg jpg 802705 1863 2500 IMAGE-HIGH-RES 1-s2.0-S2468823124000154-gr2_lrg.jpg https://s3-eu-west-1.amazonaws.com/prod-ucs-content-store-eu-west/content/pii:S2468823124000154/HIGHRES/image/jpeg/a5df38820ad71b9c8c61bed85e279983/gr2_lrg.jpg gr2 gr2_lrg.jpg jpg 576601 1989 2500 IMAGE-HIGH-RES 1-s2.0-S2468823124000154-ga1_lrg.jpg https://s3-eu-west-1.amazonaws.com/prod-ucs-content-store-eu-west/content/pii:S2468823124000154/HIGHRES/image/jpeg/5735aea02bf76c4c8a38299c33089e09/ga1_lrg.jpg ga1 true ga1_lrg.jpg jpg 261874 886 1142 IMAGE-HIGH-RES 1-s2.0-S2468823124000154-sc1_lrg.jpg https://s3-eu-west-1.amazonaws.com/prod-ucs-content-store-eu-west/content/pii:S2468823124000154/HIGHRES/image/jpeg/9f03e2316f47b89243c75ec6340c046e/sc1_lrg.jpg sc1 sc1_lrg.jpg jpg 360436 1729 1708 IMAGE-HIGH-RES 1-s2.0-S2468823124000154-am.pdf am am.pdf pdf 2305176 AAM-PDF https://s3-eu-west-1.amazonaws.com/prod-ucs-content-store-eu-west/content/egi:10FFKLMSZRT/MAIN/application/pdf/99684e79128c6272311a370d4f6d3b48/am.pdf MCAT 113832 113832 S2468-8231(24)00015-4 10.1016/j.mcat.2024.113832 Elsevier B.V. Fig. 1 (a) Schematic illustration of synthetic routes of Mn-doped CoP/NF. (b) TEM images of Mn10-doped CoP. (c) side view Mn−Co−P (101) with two Mn atoms replacing the subsurface Co atoms. Purple, blue, and light gray balls represent Mn, Co, and P atoms, respectively. (d)Free-energy diagram for HER on pristine CoP (101), Pt, and Mn−Co−P (101) with 8.3 % Mn doping. Fig 1 Fig. 2 (a) XPS spectra of Mn-CoP and R-Mn-CoP catalysts for P elements. (b) Schematic illustration of the fabrication process of manganese Mn-doped NiP2 nanosheets on carbon cloth. (c) N2 adsorption-desorption of FeP and Mn-FeP. (d) HER polarization curves. Fig 2 Fig. 3 (a) The preparation procedure of Fe-CoP UNSs/NF. (b) SEM image of Fe-CoP UNSs/NF. (c) SEM image of porous Co0.68Fe0.32P polyhedrons. Inset is the corresponding magnified image. (d) HER analyses of Co0.44Fe0.56P, Co0.68Fe0.32P, CoP, FeP, and Pt/C electrocatalysts in nitrogen-saturated 1.0 M aq. KOH solution, Overpotentials at the rate 10 mA·cm−2. Fig 3 Fig. 4 (a) XANES spectra at the Co K-edge. (b) The ΔGH*value of Co2P, Mn-Co2P, Fe-Co2P. Fig 4 Fig. 5 (a) SEM images of Fe1V3-PC/NF. (b) HER polarization curve (c) Gibbs free energies of absorbed hydrogen atom (ΔGH*) for HER. Inset: Volcano plot depicting HER overpotentials as a functional of ΔGH*. (d) HER polarization curves for NF@Ni/C, NF@Ni2P/C, NF@Fe2-Ni/C, NF@Fe2-Ni2P/C, NF@Pt/C, NF. Fig 5 Fig. 6 (a) Schematic Illustration and structural characterization. (b) Comparison of overpotential at j = 10 mA·cm−2 of different catalysts in 0.5 M H2SO4 and 1 M KOH. (c) TEM images of Ni-CoP-5 %. (d) DFT calculations of the reaction coordination during HER with Ni-CoP. Fig 6 Fig. 7 (a) LSV curves of the Pt/C and Co-Ni-P catalysts for HER in 1 M KOH. (b) The corresponding Tafel plots of HER polarization curves. (c) Schematic illustration of the preparation of the hierarchical Ni-FeP/TiN/CC electrocatalyst. (d) Ni-FeP/TiN/CC with symbol A showing the amorphous TiN surface. (e) FTIR spectra of MIL-88A, NM-1, NM-2, and NM-3. (f) LSV curves of the FeP/C, NFP/C-1, NFP/C-2, NFP/C-3. Fig 7 Fig. 8 (a) Schematic illustration of the synthesis of Co-Fe-P nanotubes. (b) TEM images of CoFeOx nanostructure. (c) LSV curves of the rGO, 10 wt% Pt/C, NiCoP, and NiCoP/rGO hybrids in 0.5 M H2SO4. (d) pH-dependent polarization curves of the NiCoP/rGO catalyst at a scan rate of 5 mV·s−1. Fig 8 Fig. 9 (a) Schematic illustration of the preparation of paintbrush-like Co-Cu3P/CF. (b) SEM image of Co-Cu3P/CF. (c) Polarization curves for FeP/Ti, Co-FeP/Ti, Ni-FeP/Ti, and Mn-FeP/Ti in 0.5 M H2SO4. (d) Normalized Fe K-edge XANES spectra. Fig 9 Fig. 10 (a) Schematic of the synthesis of CoMo(Al)-P/NF through the phosphorization of CoMoAl-LTH/NF. (b) Polarization curves Alkaline that HER activity of nickel foam (NF), CoP/NF, CoMo-P/NF, CoMo(Al)-P/NF, Pt/C-20/NF, and Pt/C-40/NF electrocatalysts. (c) SEM images for Al-CoP/CC. (d) TEM images of Ru-NiCoP/NF. Fig 10 Scheme 1 Schematic illustration of the main content of this comprehensive review. Scheme 1 Table 1 Development process of electrolytic water. Table 1 Years Figure achieve 1833 Faraday Propose Faraday's laws 1869 Gramme Invention of the direct current machine 1888 Lachionv Realize industrial production of electrolytic water 1910 Electrolysis Company Design Knowles electrolytic cell 1948 Zdansk and Lonza Pressurized water and electricity solution tank 1967 - CJB small fully automatic pressure type electrolytic cell Table 2 Methods for synthesizing different TMPs. Table 2 Synthesis method Advantages Disadvantages Refs. electrodepositionPhotodepositionChemical depositionHydrothermal Simple processControllable morphology Low yieldExcessive waste liquid [23,45,46] [47–49] [50–52] [53–55] ball millarc melting Simple processHigh yield Low purityUncontrollable morphology [56–58] [59–61] Chemical vapor deposition (CVD) Low purityControllable morphology High costComplex process [62–64] Colloidal synthesis Controllable easily Toxic phosphorus source [65–67] Table 3 Effects of Mn doped TMPs. Table 3 Catalyst Overpotential (mV@mA·cm−2) Tafel slope(mV dec−1) Electrolyte Durable Refs. 10 %Mn-CoP 60 @ 10 56.7 1 M KOH 16 h [88] Mn-Co-P 49 @ 10 55 0.5 M H2SO4 10 h [89] 76 @ 10 52 1 M KOH 86 @ 10 82 1M PBS Mn-CoP@ Mn-CoOOH 110 @ 10 45 1 M KOH 17 h [92] Mn-NiP2 69 @ 10 42 0.5 M H2SO4 20 h [96] 97 @ 10 61 1 M KOH 107 @ 10 91 1M PBS 0.05 Mn-MoP 199 @ 10 49 0.5 M H2SO4 50h [100] Table 4 Effects of Fe doped TMPs. Table 4 Catalyst Overpotential (mV@mA·cm−2) Tafel slope(mV dec−1) Electrolyte Durable Refs. Fe-CoP UNSs 67 @ 10 66.22 1 M KOH 50 h [102] Co0.68Fe0.32P 116 @ 10 64 1 M KOH 6 h [103] Fe–Co2P BNRs 489 @ 10 - Seawater 48 h [107] Fe1V3-PC 66 @ 10 37 1 M KOH 24 h [108] Fe-Ni2P 33 @ 10 26 1 M KOH 22 h [109] Table 5 Effects of Ni doped TMPs. Table 5 Catalyst Overpotential (mV@mA·cm−2) Tafel slope(mV dec−1) Electrolyte Durable Refs. Ni-CoP 144 @ 10 71 0.5 M H2SO4 21 h [28] 92 @ 10 52 1 M KOH NiCo16−xP6 98 @ 10 41 1 M KOH 10 h [110] Co−Ni−P 103 @ 10 33 1 M KOH 10 h [112] Ni-FeP 72 @ 10 54 0.5 M H2SO4 12 h [117] 117 @ 10 70 1 M PBS 95 @ 10 72 1 M KOH Ni-FeP/TiN 75 @ 10 73 1 M KOH 10 h [113] Table 6 Effects of Co doped TMPs. Table 6 Catalyst Overpotential (mV@mA·cm−2) Tafel slope(mV dec−1) Electrolyte Durable Refs. Co-Fe-P 66 @ 10 72 0.5 M H2SO4 20 h [118] 138 @ 10 138 1 M PBS 86 @ 10 66 1 M KOH NiCoP 59 @ 10 50 0.5 M H2SO4 18 h [119] NiCoP/rGO 42 @ 10 45.2 0.5 M H2SO4 18 h 124 @ 10 91 1 M PBS 138 @ 10 124.1 1M KOH Co-Cu3P 250 @ 100 75 1M KOH 40 h [120] Co-FeP NPs 126 @ 10 63.6 0.5 M H2SO4 stability [121] Table 7 Effects of other atoms doped TMPs. Table 7 Catalyst Overpotential (mV@mA·cm−2) Tafel slope(mV dec−1) Electrolyte Durable Refs. CoMo(Al)-P 64 @ 10 55.02 1 M KOH 3000 cycles [123] Al-CoP 23 @ 10 43 0.5 M H2SO4 20 h [124] 38 @ 10 45 1 M KOH Ru-NiCoP 44 @ 10 45.4 1 M KOH 30 h [130] Review Paper A review with transition-metal phosphide electrocatalysts in hydrogen evolution reaction: Doping perspective Changdi Jing Writing – review & editing Writing – original draft Validation Formal analysis Data curation a Lumin Hong Writing – original draft Data curation a Bo Li Writing – review & editing Resources Data curation a Yao Wang Resources Data curation a Fengming Zhang a Hua bo Huang b ⁎ Qianqian Jiang Writing – review & editing Validation Supervision a ⁎ Jianguo Tang Writing – review & editing Supervision a ⁎ a Institute of Hybrid Materials, National Center of International Research for Hybrid Materials Technology, National Base of International Science & Technology Cooperation, College of Materials Science and Engineering, Qingdao University, Qingdao 206000, China Institute of Hybrid Materials, National Center of International Research for Hybrid Materials Technology, National Base of International Science & Technology Cooperation, College of Materials Science and Engineering Qingdao University Qingdao 206000 China aInstitute of Hybrid Materials, National Center of International Research for Hybrid Materials Technology, National Base of International Science & Technology Cooperation, College of Materials Science and Engineering, Qingdao University, Qingdao 206000, China b Hubei Key Laboratory of Plasma Chemistry and Advanced Materials, School of Materials Science and Engineering, Wuhan Institute of Technology, Wuhan 430205, China Hubei Key Laboratory of Plasma Chemistry and Advanced Materials, School of Materials Science and Engineering Wuhan Institute of Technology Wuhan 430205 China bHubei Key Laboratory of Plasma Chemistry and Advanced Materials, School of Materials Science and Engineering, Wuhan Institute of Technology, Wuhan 430205, China ⁎ Corresponding authors. With the soaring price of traditional energy and environmental pollution, it is important to find reliable and environmentally friendly clean energy. Transition Metal Phosphides (TMPs) have been shown to perform well compared to other non-precious metal catalysts for hydrogen evolution reaction (HER) electrocatalysts. The modifications of transition metal phosphides can obtain better catalytic performance. Among that, metal doping has become a commonly used method for modifying transition metal phosphides, because it can control the amount of doping and the synthesis method is simple. Metal atom doping greatly changes the intrinsic properties of transition metal phosphides, such as adding Electrochemical Active Surface Area (ESCA), adjusting the electronic structure, etc. Transition metal phosphides can also improve catalytic activity by constructing composite materials such as NiCoP/rGO. Polymetallic doping can also improve the catalytic performance of TMPs, such as CoMo(Al)-P. Through the synergy between polymetals, the catalytic activity of the catalyst is greatly improved. Therefore, it can be developed in the direction of high-entropy alloys to produce catalysts with excellent performance. And TMPs also have good catalytic activity in seawater, such as Fe–Co2P BNRs. A series of modification methods such as metal doping will greatly tap the hydrogen evolution reaction potential of transition metal phosphides, and are expected to be applied in industry. Graphical abstract As we all know, electrolysis of water is two and a half reactions of hydrogen evolution and oxygen evolution. Almost all transition metal phosphides electrocatalysts are highly active oxygen evolution reaction performance under basic conditions. Therefore, it is very important to develop the hydrogen evolution reaction catalytic activity of transition metal phosphides catalysts. Doping modification of transition metal phosphides is one of the commonly used methods. That series of materials from doping metal atoms can own good hydrogen evolution reaction catalytic activity under different pH values. In addition, doping metal atoms in transition metal phosphides can promote electron transfer, thereby greatly reducing ΔGH* and promoting hydrogen evolution reaction. Meanwhile, it can also provide more active sites and expand the specific surface area of transition metal phosphides. It can be seen that doped metal atoms are conducive to the application of transition metal phosphides in the electrolyzed water industry. Image, graphical abstract Keywords Modification Doping Metal atoms TMPs HER Data availability No data was used for the research described in the article. 1 Introduction At a time when traditional fossil fuels are polluting and depleted, it is important to find a clean and renewable source of energy. The hydrogen can be made through electrolysis of water, can replace the current serious pollution and non-renewable traditional energy. Electrolytic water has a long history of development, with over 200 years to date. The development process is shown in Table 1 . But the efficiency of electrolytic water is not yet high at present. To make HER efficient, it is necessary to electrolyze water with a low overpotential [1,2]. So we generally use catalysts to reduce the passing point [3]. Platinum is the most efficient in hydrogen evolution reactions, which cannot be widely used caused by its low reserves and high price [4,5]. While nickel and its alloys are potential HER materials in alkaline media, they undergo extensive inactivation during alkaline water electrolysis. Therefore, it is imperative to create a catalyst that is minimal in cost, highly active, and stable. Based on this reason, Co, Ni, Fe, Mo, W, Cu and other earth-rich transition metals and their alloy [6–8], nitrides [9–11], borides [12–14], carbides [15–17], sulfides [18–20], phosphides [21–23] and other derivatives [24–26] have been studied. Among these, transition metal phosphides (TMPs) have been extensively studied by researchers. TMPs have a special catalytic mechanism similar to that of hydrogenases [27]. And P atoms can increase the spacing between metal atoms, weaken the interaction between metal atoms, thereby greatly improving conductivity [28]. In addition, phosphating the metal alloy effectively inhibits the dissolution of the metal, thereby improving the stability and corrosiveness of the catalyst [29,30]. In summary, TMPs have abundant content, special structure, excellent catalytic activity and stable properties [31,32], which has attracted widespread attention in the field of electrocatalysis among the many catalysts. These advantages make transition metal phosphides become a promising hydrolysis material. However, the catalytic effect of pure TMPs is still not very ideal. Therefore, many researchers modify it to improve the catalytic performance of TMPs. Element doping are commonly used modification methods. Elemental doping includes metal atom doping, non-metal atom doping, and metal/non-metal atomic co-doping. Among that, metal doping control the amount of doping and the synthesis method is simple. Metal atom doping greatly changes the intrinsic properties of transition metal phosphides, such as adding Electrochemical Active Surface Area (ESCA), adjusting the electronic structure, etc. Therefore, TMPs have important applications in the field of electrocatalytic hydrolysis. 2 Hydrogen evolution reaction mechanism Before discussing the mechanism of hydrogen evolution reactions, it is important to understand the Sabatier principle. The Sabatier principle provides the basis for the principle of activity between catalysts [33]. HER catalysts with good catalytic performance not only possess strong enough adsorption capacity for key reaction intermediates, but also occur desorption when they are weak enough. This will leave space for the product to adsorb another intermediate and maintain the HER [34]. Therefore, it often presents a volcanic curve in the relationship between heat of adsorption and enthalpy of intermediate formation and catalytic rate. However, the volcanic curve does not explain the higher catalytic activity observed at acid solution with low pH [35,36]. In acidic and alkaline solutions, the HER reaction mechanism is different. For example, in acidic media, hydrated hydrogen ions are proton donors, while in alkaline media water becomes proton donors, as shown below: (1) Acidic media: 2H3O+2e− ⇌ H2 (2) Alkaline media: 2H2O+2e− ⇌ H2+2OH− The hydrogen evolution reaction mechanism in different electrolyte solutions is as followed: In acidic media: (3) Volmer H++e−+*→H*+H2O (4) Heyrovsky H++e−+H*→H2+H2O (5) Tafel H*+H*→H2 In alkaline media: (6) Volmer H2O+e−+*→H*+OH− (7) Heyrovsky H2O+e-+H*→H*+OH− (8) Tafel H*+H*→H2 In alkaline media, the activity of HER is about 2-3 grades below than that in acidic media [37]. At the initial potential, HER is more difficult to occur under alkaline electrolyte compared in the acidic electrolyte [38], because the proton hydrogen used in the HER from alkaline medium is obtained by splitting water molecules with additional energy, which affects the overall reaction rate of HER [39,40]. In actual production, no electrolyzer can achieve 100 % Faraday efficiency due to various obstacles with thermodynamic and kinetic. Whether in acidic or alkaline media, the minimum voltage of water electrolysis is 1.23 V. However, the electrolysis of water can hardly be carried out at the theoretical decomposition voltage of 1.23 V, and the excess voltage is called with the over-point position. The overpotential (η) is mainly used to overcome the intrinsic activation barrier present on the anode (ηa) and cathode (ηc), as well as some other resistors (ηother) such as solution resistance and contact resistance. So electrolyzed water can be reflected by the following chemical equation: Eop = 1.23 V + ηa + ηc + ηother It can be seen from this formula that reducing the overpotential is the central problem to make water electrolysis energy-efficient. ηother can be decreased by using optimizing the plan of the electrolyzer, while ηa and ηc must be decreased by way of exceedingly lively oxygen evolution and hydrogen evolution catalysts, respectively. In general, OER is performed by coupling several protons/electrons [41]. In addition, OER is highly sensitive to pH and has very different response kinetics under medium with different pH values [42]. For electrocatalytic OER in acidic solutions, the most broadly used electrocatalysts are the noble metals Ru, Ir and their derivative. Due to poor acid resistance, other materials are not appropriate for acidic OER. Unlike OER in acid solution, almost all TMPs electrocatalysts are highly active OER performance under basic conditions [43]. Therefore, it is very important to synthesize excellent HER catalysts under alkaline conditions. 3 Preparation method of TMPs A long time ago, the synthesis of TMPs mostly required a high temperature and high-pressure environment, which greatly limited the development of TMPs. But with the deepening of the research on TMPs, synthetic methods have sprung up. The metal source and the P source are different, so the synthesis method is different. Metal sources are mainly divided into free metal ions, coordinated metal ions, metals, metal hydroxides, metal oxides, metal phosphoric acid salt and other sources of metals. Phosphorus sources can be divided into organophosphorus (trioctylphosphine (TOP), hexamethylphosphoric triamide (HMPA), tetrabutylphosphonium chloride, organophosphoric acid, etc.) and inorganic phosphorus (PH3 gas, phosphoric acid, phosphate, red phosphorus, black phosphorus, etc.) [44] The synthesis methods under different metal and phosphorus sources are systematically summarized, as shown in Table 2 . TMPs have excellent HER catalytic activity, and their synthesis methods are also diverse. Colloidal synthesis [65–67], hydrothermal [53–55], Chemical vapor deposition [68–70], electrodeposition [71–73] is common synthesis methods. These three common types of methods will be discussed in detail as followed. 3.1 Colloidal synthesis Colloidal synthesis is a method for synthesizing metal phosphate nanoparticles using organic solvents as reaction media. This reaction is usually carried out in inert atmosphere at temperatures ranging from 220°C to 385°C. By controlling the type of precursor, reaction temperature, and molar ratio of M/P, catalysts with different sizes and morphologies can be obtained [74]. For example, Callejas et al. [75] reported the synthesis of low-cost, abnormally active iron phosphide (FeP) nanoparticles. Fe(CO)5 is first mixed with oleylamine and 1-octadecane, and Fe nanoparticles are prepared. The prepared iron nanoparticles are reacted with TOP to convert to FeP. It is reported by Eric J. Popczun that CoP hollow nanoparticles can be prepared by mixing 1-octadecene, oleylamine and trioctylphodphine and then slowly injecting the prepared Co nanoparticle suspension into the reaction mixture [76]. This is a typical structure of TMPs nanoparticles, as TOP is used to chemically convert metal seed particles from the outside in to phosphide. This method can also be applied to the synthesis of other transition metal phosphides [77,78]. Although this method can effectively regulate the morphology of metal phosphides, the presence of toxic organic phosphorus greatly limits its development. 3.2 Hydrothermal Hydrothermal is a common way for synthesizing metallic phosphate. Generally, many different metal salts and phosphorus sources are dissolved in water or solvents, which is saved a necessary time at a reaction temperature below 210°C in a PTFE-lined autoclave, and then TMPs can be successfully acquired. TMPs nanostructures also can be composited by means of solvothermal method using organic solvents as reaction media. For example, nickel foam is put into a mixed solution of anhydrous ethylenediamine and amorphous red P and then placed in an oven for reaction. Finally, it is worth Ni2P-NRs/NF electrodes with good catalytic performance [79]. The method can also be used to synthesize other TMPs [80,81]. The hydrothermal method is simple to operate, but the obtained TMPs are prone to agglomeration. 3.3 Chemical vapor deposition Chemical vapor deposition has the strengths of excessive selectivity, excessive yield and easy procedure, which makes it become a common method for preparing TMPs. Recently, metals and red phosphorus are combined with stoichiometry, sealed in vacuum silicon tubes, and then heated to high temperatures for long periods of time to synthesize TMPs. Later, in order to decrease the reaction temperature and time, the other solid-phase reaction is widely adopted. An instance is the CoMoP catalyst [82], in which a stoichiometric combination of cobalt nitrate, ammonium molybdate tetrahydrate and ammonium phosphate hydrogen phosphate is calcined in air, then treated at H2/Ar. In the synthesis of MoP2 nanoparticles [83], molybdenum oxide and elemental red phosphorus (P) powder are combined, vacuum-sealed in a quartz tube, then are heated and finally acid washed. The solid-phase reaction process is simple, but PH3 highly poisonous gas will be produced for the duration of the reaction, which greatly limits the application of this method. Therefore, it is a very necessary issue how can efficiently collect the poisonous gas when the reaction is completed. 3.4 Electrodeposition Electrodeposition preparation of TMPs is one of the commonly used preparation methods, which can make the ions to be reduced and deposited on the electrode surface to form a coating by the application of electric current or voltage. For example, CoSO4 and NaH2PO2 are dissolved in water as a electrolytic solution, and electrode is linearly scanned 15 times between 0.3 and 1.0V. Finally CoP films can be immediately deposited on copper foil [84]. The obtained CoP films can be used immediately as an electrocatalyst or saved under vacuum at ambient temperature. In the electrodeposition method, the deposition time, voltage, and concentration of ions in the solution will affect the final catalytic activity [85,86]. The electrodeposition method is direct, low power consumption, fast preparation speed, and simple experimental process. 4 The effect of metal doping on TMPs Doping metal or non-metallic atoms can increase the electrocatalytic activity of TMPs. It can promote anion and cation exchange of transition metal phosphides, accelerate charge transfer, and optimize ΔGH* and ΔGH2O for easy adsorption and desorption of HER intermediates. Metals can be incorporated into TMPs, such as Mn, Ni, Co, Fe and so on. Doping metal elements is relatively easy, only a certain amount of dopant needs to be added during the precursor synthesis process, and generally does not require any post-treatment [87]. 4.1 Mn doping Doping Mn atoms is one of the common methods for modifying TMPs. The researchers [88] synthesized the Mn-CoP on NF (Ni Foam), as shown in Fig. 1 a. Due to the different diffusion rates, the phosphine after NaH2PO2 decomposition diffuses to the surface of the precursor, and reacts with Co atoms. Many holes are formed on the surface, and finally form to be the porous cobalt phosphide nanorods, as shown in Fig. 1 b. In the experiment, the result showed that when the manganese doping amount was 10 %, the catalytic activity of CoP was the best. According to the calculation of DFT. An appropriate amount of Mn doping can effectively reduce the overall d-band center of the CoP and provide good H* adsorption and fast reaction kinetics. In general, almost all the best HER catalysts work well only in acidic media, but nearly all the best OER works well in alkaline media, so it is important to find catalysts can work well in all the pH ranges. For example, the manganese-doped CoP (Mn-Co-P) nanosheet array has synthesized by electrodeposition on the Ti network [89], and the synthesized catalyst has good catalytic activity under acidity, alkalinity and neutrality. According to the study [90], the ΔGH* on the surface of the original CoP(101) is -0.14 eV, and when Mn is incorporated into the CoP, the ΔGH* decreases to only -0.11 eV, and the doping of Mn shows that it is easier to replace the Co atoms under the surface, as shown in Fig. 1 c. DFT calculations showed that Mn doping reduces the ΔGH* of the CoP, as shown in Fig. 1 d. Electrochemical experiments also prove that the excellent effect of doping. Mn-CoP only needs 49 mV, 76 mV, 86 mV to reach 10 mA·cm−2 in sulfuric acid solution, potassium hydroxide solution and phosphate-buffered saline (PBS), which is far less than the passing point of CoP. Since the surface material of cobalt phosphate is without difficultly oxidized to phosphate in the air, which is not conducive to electrolysis of water [91]. Therefore, the Mn-CoOOH nanowire is converted into Mn-CoP @ Mn-CoOOH. And the Mn-CoOOH formed not only efficiently prevents the constant oxidation of Mn-CoP, but also during the HER process, efficiently promoting the splitting of water to protons during the electrolysis process [92]. Before in situ oxidation, electroreduction has been firstly performed and labeled as R-Mn-CoP. During the reduction reaction, the valence state of the metallic component changes, producing abundant defects [93] and more coordination-unsaturated spinel structures [94,95]. XPS can confirm the existence of P vacancies in R-Mn-CoP, and the total electron density of the β-CoOOH shell increasing with the increase of P vacancies, thereby increasing the conductivity, as shown in Fig. 2 a. DFT calculation results show that P vacancies can regulate Gibbs function and increase internal activity of the Mn-CoP. Then, Mn-CoP is oxidized to Mn-CoP @ Mn-CoOOH in situ, the catalytic activity is further improved. Manganese incorporation into other TMPs also produces excellent catalytic properties. Mn-Ni NSs precursors are obtained on CC by hydrothermal method, and then phosphorylated Mn-Ni NSs precursors can be formed Mn-NiP2 nanosheets, as shown in Fig. 2 b [96]. According to the XPS consequences, it can be known that after Mn doping, the electron shift from Ni to P becomes smaller [97,98], which promotes the performance of HER. This catalyst has good catalytic activity in all pH ranges, only needing 69 mV, 97 mV, 107 mV to drive 10 mA·cm−2 in sulfuric acid, potassium hydroxide and phosphate-buffered saline (PBS). As we all know, the catalytic activity of iron phosphide HER is very low, much less than that of Pt, but doping Mn with iron phosphide will have a miraculous effect. For example, Mn-doped FeP (Mn-FeP) catalyst is prepared by a simple and controlled composite path [99]. After doping with Mn dopant, the obtained Mn-FeP and FeP both exhibit mesoporous structures, and the mesopores of Mn-FeP decrease by 0.37 compared to FeP, reaching to 11.79 nm, as shown in Fig. 2 c. And the specific surface area of Mn-FeP is much larger than the specific surface area when it is not doped. This shows that Mn doping can offer more active site, thereby facilitating anion and cation exchange during electrocatalysis. Indeed, Mn-FeP catalysts only needs 69, 157, and 173 mV to reach 10 mA·cm−2 in sulfuric acid, PBS, and potassium hydroxide electrolytes solutions, respectively, which is much lower than those of the FeP. When Mn is incorporated into MoP, the electrocatalytic performance is also improved. And the amount of Mn can also affect the electrocatalytic performance. When 0.01, 0.05, 0.1 mol or greater amounts of Mn are incorporated into MoP in acidic media. The results show that 0.05 mol Mn-MoP NSs has the best catalytic activity, only 199 mV can reach 10 mA·cm−2, which is much lower than the doping amount of other Mn, as described in Fig. 2 d. [100] These experimental outcomes confirm the incorporation of Mn into TMPs can improve HER performance. The doping of Mn greatly changed the catalytic activity of TMPs, as shown in Table 3 . After Mn doping, the overpotential was significantly reduced, and the Tafel slope was reduced. And it is easy to see that transition metal phosphides have better catalytic performance in acidic solutions. However, working in acidic solutions for a long time will corrode the catalyst and is not conducive to industrial applications. Therefore, it is very important that the catalyst has good catalytic activity under alkaline conditions. As we all know, durability is an important indicator for evaluating catalysts. As we all know, durability is an important indicator for evaluating catalysts. Chronopotentiometry testing is the most commonly used method for evaluating durability. In general, the test period of chronopotentiometry can be considered to have good stability after 10h. However, the cycle of each test is different [101], so the potential decay rate of each cycle is used as a general indicator of stability evaluation. After a large number of experimental surface Mn-doped catalysts, the decay rate is maintained at a low level after a cycle of cycling. This proves that the doping of Mn can improve the stability of the catalyst. 4.2 Fe doping The incorporation of Fe atoms in TMPs can regulate the electronic structure of metal atoms and P atoms at the same time, thereby greatly reducing ΔGH* and promoting hydrogen evolution reaction. The researchers [102] have successfully synthesized Fe-CoP UNSs/NF. Firstly, using the one-pot method to synthesize Fe-Co3O4 UNSs on NF (Ni Foam) substrates, and then combining Fe-Co3O4 UNSs/NFs with NaH2PO2·annealed to generate Fe-CoP UNSs/NF, as shown in Fig. 3 a. Fe-CoP UNSs has a rougher surface compared to the superficial of the NF basal, indicating that nanoparticles grow on the NF surface, as shown in Fig. 3 b. The three-dimensional framework of this Fe-CoP UNSs can not only expose more active spots, but also quicken the diffusion of electrolytes. Therefore, the prepared catalyst has good catalytic activity. The proportion of metal organic framework (MOF) can be changed by the content of Fe to further control the hydrogen evolution reaction performance. For example, a high-efficiency hydrogen evolution reaction electrocatalyst is designed and synthesized by the simple phosphating CoFe MOF [103]. After phosphating, it is still a polyhedral structure, but it exhibits a higher porosity, as shown in Fig. 3 c. In electrochemical tests, the porous Co0.68Fe0.32P polyhedron requires only 116 mV to reach 10 mA·cm−2, which has surpassed other CoFeP catalysts with Fe content [104]. Hydrogen production from seawater provides a large amount of clean energy, but it is difficult to eliminate chlorine cross-cutting and corrosion, and the battery voltage is high (> 1.7-2.4 V) and consumes a lot of electricity [105,106]. Therefore, it is very important to solve the problem of electrolysis in seawater. An innovative Fe-Co2P nanorod bundle was prepared for catalytic seawater electrolysis [107]. Due to the different amount of iron doping, there will generate CoP with different crystal phases and morphologies. It has been experimentally proved that Fe-Co2P BNRs are prepared when the molar ratio of Co: Fe is 1:0.5. It can be seen in Fig. 4 a that electronic transition in Fe-Co2P BNRs is superior to electron transfer in Mn-Co2P NRs and Co2P NRs. Fig. 4 b indicates that iron and manganese dopants reduce the |ΔGH*| of Co2P. In addition, Fe doping can accelerate the hydrogen evolution reaction kinetics of Co2P more effectively than that of Mn doping. In addition to Co-based phosphides, vanadium phosphides are also used in hydrogen evolution reaction. For example, FexVy-MOF is used as the precursor to create Fe-VyP by combining hydrothermal and Chemical Vapor Deposition (CVD) [108]. Compared with Fe3V1-PC/NF nanoparticles, Fe1V3-PC/NF prepared when the Fe to V ratio is low is smaller in size and denser in dispersion, which proves that latter has a strong electrochemcial active surface area (ESCA), being conducive to improve the catalytic performance, as described in Fig. 5 a. Fe1V3-PC/NF only needs 66 mV to reach 10 mA cm−2, which is much smaller than other catalysts. The incorporation of Fe into NiP can also obtain excellent hydrogen evolution reaction performance. Before the experiment, DFT simulation is carried out, and then carbon nanotubes embedded in doped Ni2P nanoparticles are prepared adopting metal organic framework (MOF) arrays as framework templates for experimental verification. DFT calculation compares the ΔGH* values of nickel, dinickel phosphide, and iron doped with dinickel phosphide [109]. Fe doping can effectively regulate the ΔGH* of Ni2P (111) and Ni (111), which significantly favors the hydrogen conversion kinetics, as shown in Fig. 5 c. The experimental results are exactly this: NF@Fe2-Ni/C hydrogen evolution reaction activity is the best of all the test agents. η10 is 33 mV. However, NF@Fe2-Ni2P/C shows smaller overpotentials than NF@Fe2-Ni/C at high current densities, showing NF@Fe2-Ni2P/C can be well used in industry, as shown in Fig. 5 d. These experiments confirm that Fe-doped TMPs have the potential to be applied in industry. The doping of Fe greatly changed the catalytic activity of TMPs, as shown in Table 4 . Obviously, Fe doping greatly improves the catalytic performance and stability of TMPs. Moreover, Fe–Co2P BNRs can have excellent catalytic performance in seawater, which provides new ideas and directions for seawater electrolysis. 4.3 Ni doping With nickel doped in TMPs, it can also change the electronic structure, and it is better in some transition metal phosphides than in other metal atoms. For example, Ni, Mn, Fe metals are incorporated into the CoP through self-template conversion (STT) strategies [28]. ZIF-67 has been used to seal the metal precursors, and then oxidized and phosphorylated them, and finally obtained the products, as shown in Fig. 6 a. In electrochemical tests, the catalytic activity of Metal-CoP/HPFs is enhanced compared to ZIF-67-derived CoP/HPFs, indicating that metal doping has a positive effect. Fig. 6 b shows that Ni-CoP/HPFs have good catalytic activity, requiring only 144 mV and 92 mV to reach 10 mA·cm−2 in acidic and basic solutions, which is far better than the doped cobalt phosphide of Mn and Fe atoms. The results show that Ni-CoP/HPFs are excellent hydrogen evolution reaction electrocatalysts, especially in basic media. It can be concluded that different metals have different degrees of influence on TMPs. There are also many researchers who determine the active sites of efficient hydrolysis catalysts at the atomic size. For example, Ni-CoP with atomic metal sites are prepared by boron-assisted method [110]. This is mainly because the existence of B induces a release-oxidation mechanism that can produce the progressive peeling off of hydroxide nanosheets, exposing more active spots, which greatly promotes hydrogen evolution performance [111]. In-plane pores on Ni-CoP nanosheets produce rich edge structures and reveal additional active sites, as shown in Fig. 6 c. Performance is as the structure shows. Ni-CoP has a passing point of 88mV at 10 mA·cm−2. DFT calculations are subsequently performed. Fig. 6 d shows that when Ni is doped, the ΔGH* of CoP is greatly reduced, and the H adsorption capacity becomes stronger. There are also electrodeposition methods to incorporate nickel into cobalt phosphide, such as the preparation of Ni-CoP films by electrodeposition [112]. The hydrogen evolution of these thin films is very effective, and the deposition time is considered as a key factor affecting the catalytic activity. At the optimal deposition time, the obtained Co−Ni−P-2 catalyst has a significant effect on HER in basic media, which needs 103 mV overpotential to reach 10 mA·cm−2, as shown in Fig. 7 a. Co−Ni−P-2 has a low Tafel slope, much smaller than when undoped, further proving that it is an excellent catalyst, as shown in Fig. 7 b. There also nickel incorporated into other metal phosphides with good results, such as Ni-FeP/TiN/CC [113]. Ni-FeP/TiN/CC is a layered structure, Fig. 7 c shows how nickel can be incorporated into this layered structure. Titanium nitride NWs are firstly produced on CC carbon fiber by solvothermal reaction and ammonia processing. Then, FeP NPs are coated on titanium nitride. Finally, plasma ions are injected to dope FeP NPs. Fig. 7 d is an HR-TEM image of nickel incorporated into a hierarchical structure, and it can be seen that the hierarchy remains unchanged after Ni ion implantation. But the nanoparticles and surface layers of titanium nitride become amorphous. Crystalline titanium nitride hastens electron transfer and the amorphous surface improves catalytic activity, so the structure shows excellent HER performance [114–116]. Lu et al. [117] also incorporates nickel into iron phosphide to modify and improve the catalytic performance. And Fourier transform infrared (FTIR) spectroscopy shows that the doping course don't cause abundantly variation in the crystal structure and synthetic of MIL-88A, as shown in Fig. 7 e. The passing point decreases with increasing doping, as shown in Fig. 7 f. NFP/C-3 hollow nanorods have an overpotential of only 72 mV at 10 mA·cm−2. In conclusion, Ni doping effectively improves the electrocatalytic activity, and thus enhancing the performance of HER. It can be seen from Table 5 that Ni is incorporated into TMPs, which changes its electronic structure, greatly improves its catalytic performance, and has good stability. 4.4 Co doping Co-based incorporation into TMPs is also a common method of modification. Co-doped FeP nanotubes are composited by metal-organic framework (MOF) template method [118]. CoFe MIL-88B has been composited by hydrothermal way, and then, the prepared precursor is annealed in air to obtain metal oxides (CoFeOx). Finally, phosphorylated it to obtain Co-FeP nanotubes, the specific preparation process is shown in Fig. 8 a. From TEM image of Co-FeP nanotubes shown in Fig. 8 b, the full hollow Co-FeP nanostructure can be obviously watched. The internal interval of nanotubes facilitates exposure of active spots, quality and electron transfer, and increases the approachability of electrolyte solutions. After Co doping, these advantages are further expanded. These advantages make Co-FeP nanotubes own an effective HER activity at full pH scope. Hybridization of doped TMPs with other oxides also shows excellent HER performance. For example, Co-Ni2P catalyst and its hybrid with reduced graphene oxide (rGO) are used for electrocatalysis [119]. NiCoP/rGO efficiently modulates the surface-active site, accelerates electron transfer, and improves its excellent catalytic activity. The thin nanoplates are successfully deposited on the surface of rGO, but after phosphorylation, the nanoplates are found to be morphologically deformed, as shown in Fig. 8 c. Both NiCoP and NiCoP/rGO hybrids have significant HER performance, and the cathode current density increases rapidly at higher applied voltages. Fig. 8 d shows that rGO significantly reduces the overpotential (42 mV) required to reach 10 mA·cm−2 compared to the NiCoP catalyst (59 mV). The electrochemical measurement results show that the NiCoP/rGO hybrid has excellent HER effectively and wear in the electrolyte with all pH values. The incorporation of Co into CuP also yields excellent catalytic properties, such as a simple strategy to create pigment-like Co-Cu3P structures grown on porous copper foam [120], as shown in Fig. 9 a. After phosphorylation of Co-CuO, the obtained Co-Cu3P still retains its initial form, but the surface is rough due to structural shrinkage and phase change during annealing, as shown in Fig. 9 b. This rough surface may provide more active sites, Co-Cu3P/CF exhibits excellent catalytic activity for HER. The fine performance of Co-Cu3P/CF can be attributed to its architecture, which provides abundant active spots, and the existence of Co dopants can also reasonably change its electronic characteristics, thereby producing synergistic effects. Co have also been incorporated into iron phosphide. Cho and et al. [121] have incorporated Mn, Co, Ni groups into FeP NPs and compared the changes in HER activity after doping with different elements. As shown in Fig. 9 c, Co-FeP/Ti (126 mV) has higher HER activity than that of FeP (139 mV), showing that doping Co in FeP can greatly improve the catalytic performance. Doping Ni and Mn atoms did not change the catalytic activity of FeP, because Ni-FeP and Mn-FeP require higher overpotentials than FeP/Ti to reach a current density of 100 mA·cm−2 [122]. It also shows that FeP has a stable structure regardless of the doped elements. The doping of Co greatly changed the catalytic activity of TMPs, as shown in Table 6 . It can be clearly seen that after doping, it has good catalytic activity and good stability at a wide range of pH. And NiCoP and rGO hybridization produces excellent performance. It can be seen that metal doping can be combined with the construction of composite materials to produce excellent performance, which may provide a new way for the development of TMPs. 4.5 Other metal atoms doping There are other metal atoms also doping into TMPs, such as Mo, Al, Ru, etc. For example, Mo-doped CoP synthesized by typical synthesis method, and then phosphated in tubular furnaces, as shown in Fig. 10 a [123]. The introduction of Mo atoms and Al atoms greatly prevented the aggregation of cobalt phosphide crystals and was conducive to the formation of porous CoP nanosheets. The final product has excellent electrochemical performance, CoMo(Al)-P/NF only needs 78 mV to reach 10 mA·cm−2, which is smaller than CoP/NF and CoMo-P/NF, as shown in Fig. 10 b. Although CoMo(Al)-P/NF has higher over-point than Pt/C/, the overpotential of it increases faster. This means that CoMo(Al)-P/NF electrocatalysts are more suitable than costly Pt/C electrocatalysts in industrial electrolytic water. Al atoms doped into TMPs can also play well for HER performance. Al-doped CoP is prepared with CoAl-LDH as a precursor. Al-CoP has the same nano arrays as CoAl-LDH/CC, but with a relatively rough surface, as shown in Fig. 10 c [124]. Rough surfaces can provide more active sites, increasing catalytic activity. After Al doping, the Co 2p are negatively shifted compared to in CoP [125,126]. Because there is a intense electron interaction after Al doping, which may be of great significance for regulating the electronic environment in Al-CoP to promote HER catalysis [127]. DFT calculations show that Al atoms can supply charges to Co and P atoms [128]. And the d-band center of Co atoms reduces, getting the weakened interactions between Co and H atoms and decreasing |ΔGH*| [129]. Ru doping can also well catalyze HER performance, such as the construction of a Ru-doped 3D NiCoP, as shown in Fig. 10 d [130]. The catalyst is petal-shaped and has a large electrochemical active area. DFT calculations show that Ru atoms at the Ru-NiCoP site exhibit higher density states near the Fermi level, which means that catalytic electron transfer has better conductivity, that is, Ru atoms doped at the Ni site of NiCoP can easily become the catalytic site of HER. The doping of other metal atoms also greatly changed the catalytic activity of TMPs, as shown in Table 7 . In this section, metal atom-doped bimetallic phosphides can also produce good catalytic activity and good stability. This may be able to develop in the direction of high-entropy alloys to produce more catalysts with excellent activity. Overall, metal atoms such as Fe, Ni, Co have extremely strong hydrogen evolution activity metals, and are widely used for doping transition metal phosphides. Xiong et al. [131] analyzed the effect of surface electronic structure on the catalytic performance of M-NiP through DFT calculations. ΔGH* varies linearly with the increasing charge, showing that the more electrons the dopant contributes to the surface, the stronger the adsorption energy of H* can get. Bader charge analysis exhibits that the contribution of doped different metal atoms to the electric density of Ni2P follow Co < Fe < Mn, and the charge contribution of these three metals is small [132]. When metal atoms doped with these three metals, ΔGH* is very small, similar to that of a Pt catalyst. According to the Sabatier principle, the ΔGH* of a good HER catalyst should be close to zero. Therefore, Ni2P catalysts doped with Co and Fe have good catalytic activity. Inactive atoms such as Al doped into CoP can also produce excellent catalytic performance, which may be because Al atoms replace Co atoms on the surface of CoP, greatly reducing Δ GH*. Therefore, it is very important for reducing the Gibbs free energy of materials. 5 Summary and outlook In summary, the reaction mechanism of hydrogen evolution, the preparation method of TMPs and the method of improving the performance of metal doping have been summarized in this review as shown in Scheme 1 . As we all know, the catalytic activity of pure TMPs is still not very good. Therefore, pure TMPs were doped and modified. Doping Mn has good HER catalytic activity under different pH values and Mn is abundant in the earth's crust; doping Fe and Ni atoms in TMPs can promote anion and cation exchange, thereby greatly reducing ΔGH* and promoting HER; doping of Co atoms lead to a larger specific surface area and an increase in active spots and promotes anion and cation conversion in TMPs; doping of other metal atoms also can have a similar effect. In general, metal atom doping can greatly alter the intrinsic activity of TMPs, thereby promoting HER. In addition, compared to non-metallic doping, the amount of doping is easy to control metal-doped TMPs. The difference in doping location and doping amount deeply affects the activity of the catalyst. Because the doping mechanism and reaction mechanism are not very clear. It is necessary to deeply understand the mechanism of action of metal atom doping and the true center of reaction activity, thereby promoting the industrial application of electrolyzed water. The construction of composite materials is also a commonly used modification method, and NiCoP/rGO has good catalytic activity at any pH value. There are many studies of single doping and single interface engineering, and not many studies of combining them, perhaps this is a way to build a good catalyst. Polymetallic doping, such as CoMo(Al)-P, has also been constructed, and the polymetallic synergy allows the catalyst to produce good catalytic activity. In recent years, high-entropy alloys have developed rapidly, and the construction of phosphides of high-entropy alloys may be a good way to develop. TMPs are excellent electrocatalysts. In summary, TMPs catalysts have great hydrogen evolution potential and are expected to become an alternative to precious metal catalysts. CRediT authorship contribution statement Changdi Jing: Writing – review & editing, Writing – original draft, Validation, Formal analysis, Data curation. Lumin Hong: Writing – original draft, Data curation. Bo Li: Writing – review & editing, Resources, Data curation. Yao Wang: Resources, Data curation. Fengming Zhang: . Hua bo Huang: . Qianqian Jiang: Writing – review & editing, Validation, Supervision. Jianguo Tang: Writing – review & editing, Supervision. Declaration of competing interest The authors declare that they have no known competing financial interests or personal relationships that could have appeared to influence the work reported in this paper. Acknowledgments This work is supported by (1) the Natural Scientific Foundation of China (Grant Nos. 52003135, 51273096, 51473082); (2) State Key Project of International Cooperation Research (2017YFE0108300, 2016YFE0110800); (3) Shandong double-hundred project; (4) the Program for Introducing Talents of Discipline to Universities (“111” plan); (6) The high level discipline program of Shandong Province of China. References [1] Y. Wu Y. Zhang M.V. Nguyen T.T.H. Chu T.B.H. Nguyen E.N. Dragoi C. Xia Latest insights on eco-friendly metal based-electrocatalyst for oxygen evolution reaction: challenges, and future perspectives Mol. Catal. 534 2023 10.1016/j.mcat.2022.112818 Y. Wu, Y. Zhang, M.V. Nguyen, T.T.H. Chu, T.B.H. Nguyen, E.N. Dragoi, C. Xia, Latest insights on eco-friendly metal based-electrocatalyst for oxygen evolution reaction: challenges, and future perspectives, Mol. Catal. 534 (2023). 10.1016/j.mcat.2022.112818 [2] T.T.T. Toan D.M. Nguyen A.Q. Dao V.T. Le Y. Vasseghian Latest insights on metal-based catalysts in the electrocatalysis processes: challenges and future perspectives Mol. Catal. 2023 538 10.1016/j.mcat.2023.113001 T.T.T. Toan, D.M. Nguyen, A.Q. Dao, V.T. Le, Y. Vasseghian, Latest insights on metal-based catalysts in the electrocatalysis processes: challenges and future perspectives, Mol. Catal. 538 (2023). 10.1016/j.mcat.2023.113001 [3] S.H. Li M.Y. Qi Z.R. Tang Y.J. Xu Nanostructured metal phosphides: from controllable synthesis to sustainable catalysis Chem. Soc. Rev. 50 2021 7539 7586 10.1039/d1cs00323b S.H. Li, M.Y. Qi, Z.R. Tang, Y.J. Xu, Nanostructured metal phosphides: from controllable synthesis to sustainable catalysis, Chem. Soc. Rev. 50 (2021) 7539–7586. 10.1039/d1cs00323b [4] M.Y. Qi M. Conte M. Anpo Z.R. Tang Y.J. Xu Cooperative coupling of oxidative organic synthesis and hydrogen production over semiconductor-based photocatalysts Chem. Rev. 121 2021 13051 13085 10.1021/acs.chemrev.1c00197 M.Y. Qi, M. Conte, M. Anpo, Z.R. Tang, Y.J. Xu, Cooperative coupling of oxidative organic synthesis and hydrogen production over semiconductor-based photocatalysts, Chem. Rev. 121 (2021) 13051–13085. 10.1021/acs.chemrev.1c00197 [5] S.H. Li N. Zhang X. Xie R. Luque Y.J. Xu Stress-transfer-induced in situ formation of ultrathin nickel phosphide nanosheets for efficient hydrogen evolution Angew. Chem. Int. Ed. 57 2018 13082 13085 10.1002/anie.201806221 S.H. Li, N. Zhang, X. Xie, R. Luque, Y.J. Xu, Stress-transfer-induced in situ formation of ultrathin nickel phosphide nanosheets for efficient hydrogen evolution, Angew. Chem. Int. Ed. 57 (2018) 13082–13085. 10.1002/anie.201806221 [6] H. Zhao Z. Du D. Liu Y. Lai T. Yang M. Wang Y. Ning F. Yin B. Zhao Preparation of self-supported Ni-based ternary alloy catalysts for superior electrocatalytic hydrogen evolution Mol. Catal. 2022 520 10.1016/j.mcat.2022.112163 H. Zhao, Z. Du, D. Liu, Y. Lai, T. Yang, M. Wang, Y. Ning, F. Yin, B. Zhao, Preparation of self-supported Ni-based ternary alloy catalysts for superior electrocatalytic hydrogen evolution, Mol. Catal. 520 (2022). 10.1016/j.mcat.2022.112163 [7] H. Liu C. Xi J. Xin G. Zhang S. Zhang Z. Zhang Q. Huang J. Li H. Liu J. Kang Free-standing nanoporous NiMnFeMo alloy: an efficient non-precious metal electrocatalyst for water splitting Chem. Eng. J. 2021 404 10.1016/j.cej.2020.126530 H. Liu, C. Xi, J. Xin, G. Zhang, S. Zhang, Z. Zhang, Q. Huang, J. Li, H. Liu, J. Kang, Free-standing nanoporous NiMnFeMo alloy: an efficient non-precious metal electrocatalyst for water splitting, Chem. Eng. J. 404 (2021). 10.1016/j.cej.2020.126530 [8] M. Zhong L. Li K. Zhao F. He B. Su D. Wang PdCo alloys@N-doped porous carbon supported on reduced graphene oxide as a highly efficient electrocatalyst for hydrogen evolution reaction J. Mater. Sci. 56 2021 14222 14233 10.1007/s10853-021-06212-6 M. Zhong, L. Li, K. Zhao, F. He, B. Su, D. Wang, PdCo alloys@N-doped porous carbon supported on reduced graphene oxide as a highly efficient electrocatalyst for hydrogen evolution reaction, J. Mater. Sci. 56 (2021) 14222–14233. 10.1007/s10853-021-06212-6 [9] S. Mahadik S. Surendran J.Y. Kim G. Janani D.K. Lee T.H. Kim J.K. Kim U. Sim Syntheses and electronic structure engineering of transition metal nitrides for supercapacitor applications J. Mater. Chem. A 10 2022 14655 14673 10.1039/d2ta02584a S. Mahadik, S. Surendran, J.Y. Kim, G. Janani, D.K. Lee, T.H. Kim, J.K. Kim, U. Sim, Syntheses and electronic structure engineering of transition metal nitrides for supercapacitor applications, J. Mater. Chem. A 10 (2022) 14655–14673. 10.1039/d2ta02584a [10] S. Wang F. Gong Q. Zhou Y. Xie H. Li M. Li E. Fu P. Yang Y. Jing R. Xiao Transition metal enhanced chromium nitride as composite nitrogen carrier for sustainable chemical looping ammonia synthesis Appl. Catal. B Environ. 2023 339 10.1016/j.apcatb.2023.123134 S. Wang, F. Gong, Q. Zhou, Y. Xie, H. Li, M. Li, E. Fu, P. Yang, Y. Jing, R. Xiao, Transition metal enhanced chromium nitride as composite nitrogen carrier for sustainable chemical looping ammonia synthesis, Appl. Catal. B Environ. 339 (2023). 10.1016/j.apcatb.2023.123134 [11] A.V. Mohammadi J. Rosen Y. Gogotsi The world of two-dimensional carbides and nitrides (MXenes) Science 372 2021 1165 10.1126/science.abf1581 A.V. Mohammadi, J. Rosen, Y. Gogotsi, The world of two-dimensional carbides and nitrides (MXenes), Science 372 (2021) 1165-+. 10.1126/science.abf1581 [12] N. Wang A. Xu P. Ou S.F. Hung A. Ozden Y.R. Lu J. Abed Z. Wang Y. Yan M.J. Sun Y. Xia M. Han J. Han K. Yao F.Y. Wu P.H. Chen A. Vomiero A. Seifitokaldani X. Sun D. Sinton Y. Liu E.H. Sargent H. Liang Boride-derived oxygen-evolution catalysts Nat. Commun. 2021 12 10.1038/s41467-021-26307-7 N. Wang, A. Xu, P. Ou, S.F. Hung, A. Ozden, Y.R. Lu, J. Abed, Z. Wang, Y. Yan, M.J. Sun, Y. Xia, M. Han, J. Han, K. Yao, F.Y. Wu, P.H. Chen, A. Vomiero, A. Seifitokaldani, X. Sun, D. Sinton, Y. Liu, E.H. Sargent, H. Liang, Boride-derived oxygen-evolution catalysts, Nat. Commun. 12 (2021). 10.1038/s41467-021-26307-7 [13] A. Kumar J. Muhommad S.K. Purkayastha A.K. Guha M.R. Das S. Deka Robust and promising electrocatalytic oxygen evolution reaction by activated Cu-Co-B amorphous nanosheets ACS Sustain. Chem. Eng. 2023 10.1021/acssuschemeng.2c06708 A. Kumar, J. Muhommad, S.K. Purkayastha, A.K. Guha, M.R. Das, S. Deka, Robust and promising electrocatalytic oxygen evolution reaction by activated Cu-Co-B amorphous nanosheets, ACS Sustain. Chem. Eng. (2023). 10.1021/acssuschemeng.2c06708 [14] X. Zou W. Zhang X. Zhou K. Song X. Ge W. Zheng The surface of metal boride tinted by oxygen evolution reaction for enhanced water electrolysis J. Energy Chem. 72 2022 509 515 10.1016/j.jechem.2022.05.039 X. Zou, W. Zhang, X. Zhou, K. Song, X. Ge, W. Zheng, The surface of metal boride tinted by oxygen evolution reaction for enhanced water electrolysis, J. Energy Chem. 72 (2022) 509–515. 10.1016/j.jechem.2022.05.039 [15] P. Guo M. Wang Y. Zhang Y. Wang X. Xin R. Wang W. Huang X. Li Phase-dependent intermediate adsorption regulation on molybdenum carbides for efficient pH-universal hydrogen evolution Appl. Surf. Sci. 2023 625 10.1016/j.apsusc.2023.157169 P. Guo, M. Wang, Y. Zhang, Y. Wang, X. Xin, R. Wang, W. Huang, X. Li, Phase-dependent intermediate adsorption regulation on molybdenum carbides for efficient pH-universal hydrogen evolution, Appl. Surf. Sci. 625 (2023). 10.1016/j.apsusc.2023.157169 [16] S. Caliskan A. Wang F. Qin S.D. House J.K. Lee Molybdenum carbide-reduced graphene oxide composites as electrocatalysts for hydrogen evolution ACS Appl. Nano Mater. 5 2022 3790 3798 10.1021/acsanm.1c04253 S. Caliskan, A. Wang, F. Qin, S.D. House, J.K. Lee, Molybdenum carbide-reduced graphene oxide composites as electrocatalysts for hydrogen evolution, ACS Appl. Nano Mater. 5 (2022) 3790–3798. 10.1021/acsanm.1c04253 [17] J. Wu J. Su T. Wu L. Huang Q. Li Y. Luo H. Jin J. Zhou T. Zhai D. Wang Y. Gogotsi Y. Li Scalable synthesis of 2D Mo2C and thickness-dependent hydrogen evolution on its basal plane and edges Adv. Mater. 2023 35 10.1002/adma.202209954 J. Wu, J. Su, T. Wu, L. Huang, Q. Li, Y. Luo, H. Jin, J. Zhou, T. Zhai, D. Wang, Y. Gogotsi, Y. Li, Scalable synthesis of 2D Mo2C and thickness-dependent hydrogen evolution on its basal plane and edges, Adv. Mater. 35 (2023). 10.1002/adma.202209954 [18] H. Li C. Tsai A.L. Koh L. Cai A.W. Contryman A.H. Fragapane J. Zhao H.S. Han H.C. Manoharan F. Abild-Pedersen J.K. Norskov X. Zheng Activating and optimizing MoS2 basal planes for hydrogen evolution through the formation of strained sulphur vacancies Nat. Mater. 15 2016 48 10.1038/nmat4465 H. Li, C. Tsai, A.L. Koh, L. Cai, A.W. Contryman, A.H. Fragapane, J. Zhao, H.S. Han, H.C. Manoharan, F. Abild-Pedersen, J.K. Norskov, X. Zheng, Activating and optimizing MoS2 basal planes for hydrogen evolution through the formation of strained sulphur vacancies, Nat. Mater. 15 (2016) 48-+. 10.1038/nmat4465 [19] Y. Yang W. Zhang Y. Xiao Z. Shi X. Cao Y. Tang Q. Gao CoNiSe2 heteronanorods decorated with layered-double-hydroxides for efficient hydrogen evolution Appl. Catal. B Environ. 242 2019 132 139 10.1016/j.apcatb.2018.09.082 Y. Yang, W. Zhang, Y. Xiao, Z. Shi, X. Cao, Y. Tang, Q. Gao, CoNiSe2 heteronanorods decorated with layered-double-hydroxides for efficient hydrogen evolution, Appl. Catal. B Environ. 242 (2019) 132–139. 10.1016/j.apcatb.2018.09.082 [20] Y.Y. Ren W. Xia B.Y. Deng J. Liu F. Wang Host-guest assemblies of anchoring molecular catalysts of CO2 reduction onto CuInS2/ZnS quantum dots for robust photocatalytic syngas production in water Mol. Catal. 520 2022 10.1016/j.mcat.2022.112168 Y.Y. Ren, W. Xia, B.Y. Deng, J. Liu, F. Wang, Host-guest assemblies of anchoring molecular catalysts of CO2 reduction onto CuInS2/ZnS quantum dots for robust photocatalytic syngas production in water, Mol. Catal. 520 (2022). 10.1016/j.mcat.2022.112168 [21] L. Yuan C. Han M.Q. Yang Y.J. Xu Photocatalytic water splitting for solar hydrogen generation: fundamentals and recent advancements Int. Rev. Phys. Chem. 35 2016 1 36 10.1080/0144235x.2015.1127027 L. Yuan, C. Han, M.Q. Yang, Y.J. Xu, Photocatalytic water splitting for solar hydrogen generation: fundamentals and recent advancements, Int. Rev. Phys. Chem. 35 (2016) 1–36. 10.1080/0144235x.2015.1127027 [22] Y. Zhu T.R. Kuo Y.H. Li M.Y. Qi G. Chen J. Wang Y.J. Xu H.M. Chen Emerging dynamic structure of electrocatalysts unveiled by in situ X-ray diffraction/absorption spectroscopy Energy Environ. Sci. 14 2021 1928 1958 10.1039/d0ee03903a Y. Zhu, T.R. Kuo, Y.H. Li, M.Y. Qi, G. Chen, J. Wang, Y.J. Xu, H.M. Chen, Emerging dynamic structure of electrocatalysts unveiled by in situ X-ray diffraction/absorption spectroscopy, Energy Environ. Sci. 14 (2021) 1928–1958. 10.1039/d0ee03903a [23] Y.H. Li M.Y. Yi J.Y. Li Z.R. Tang Y.J. Xu Noble metal free CdS@CuS-NixP hybrid with modulated charge transfer for enhanced photocatalytic performance Appl. Catal. B Environ. 257 2019 10.1016/j.apcatb.2019.117934 Y.H. Li, M.Y. Yi, J.Y. Li, Z.R. Tang, Y.J. Xu, Noble metal free CdS@CuS-NixP hybrid with modulated charge transfer for enhanced photocatalytic performance, Appl. Catal. B Environ. 257 (2019). 10.1016/j.apcatb.2019.117934 [24] F. Song X. Hu Exfoliation of layered double hydroxides for enhanced oxygen evolution catalysis Nat. Commun. 5 2014 10.1038/ncomms5477 F. Song, X. Hu, Exfoliation of layered double hydroxides for enhanced oxygen evolution catalysis, Nat. Commun. 5 (2014). 10.1038/ncomms5477 [25] F. Hu D. Yu M. Ye H. Wang Y. Hao L. Wang L. Li X. Han S. Peng Lattice-matching formed mesoporous transition metal oxide heterostructures advance water splitting by active Fe-O-Cu bridges Adv. Energy Mater. 12 2022 10.1002/aenm.202200067 F. Hu, D. Yu, M. Ye, H. Wang, Y. Hao, L. Wang, L. Li, X. Han, S. Peng, Lattice-matching formed mesoporous transition metal oxide heterostructures advance water splitting by active Fe-O-Cu bridges, Adv. Energy Mater. 12 (2022). 10.1002/aenm.202200067 [26] T. Wang P. Wang Y. Pang Y. Wu J. Yang H. Chen X. Gao S. Mu Z. Kou Vertically mounting molybdenum disulfide nanosheets on dimolybdenum carbide nanomeshes enables efficient hydrogen evolution Nano Res. 15 2022 3946 3951 10.1007/s12274-022-4072-5 T. Wang, P. Wang, Y. Pang, Y. Wu, J. Yang, H. Chen, X. Gao, S. Mu, Z. Kou, Vertically mounting molybdenum disulfide nanosheets on dimolybdenum carbide nanomeshes enables efficient hydrogen evolution, Nano Res. 15 (2022) 3946–3951. 10.1007/s12274-022-4072-5 [27] Y. Yan P. Wang J. Lin J. Cao J. Qi Modification strategies on transition metal-based electrocatalysts for efficient water splitting J. Energy Chem. 58 2021 446 462 10.1016/j.jechem.2020.10.0102095-4956/ Y. Yan, P. Wang, J. Lin, J. Cao, J. Qi, Modification strategies on transition metal-based electrocatalysts for efficient water splitting, J. Energy Chem. 58 (2021) 446–462. 10.1016/j.jechem.2020.10.0102095-4956/ [28] Y. Pan K.A. Sun Y. Lin X. Cao Y.S. Cheng S.J. Liu L.Y. Zeng W.C. Cheong D. Zhao K.L. Wu Z. Liu Y.Q. Liu D.S. Wang Q. Peng C. Chen Y.D. Li Electronic structure and d-band center control engineering over M-doped CoP (M = Ni, Mn, Fe) hollow polyhedron frames for boosting hydrogen production Nano Energy 56 2019 411 419 10.1016/j.nanoen.2018.11.034 Y. Pan, K.A. Sun, Y. Lin, X. Cao, Y.S. Cheng, S.J. Liu, L.Y. Zeng, W.C. Cheong, D. Zhao, K.L. Wu, Z. Liu, Y.Q. Liu, D.S. Wang, Q. Peng, C. Chen, Y.D. Li, Electronic structure and d-band center control engineering over M-doped CoP (M = Ni, Mn, Fe) hollow polyhedron frames for boosting hydrogen production, Nano Energy 56 (2019) 411–419. 10.1016/j.nanoen.2018.11.034 [29] Y. Li Z. Dong L. Jiao Multifunctional transition metal-based phosphides in energy-related electrocatalysis Adv. Energy Mater. 10 2020 10.1002/aenm.201902104 Y. Li, Z. Dong, L. Jiao, Multifunctional transition metal-based phosphides in energy-related electrocatalysis, Adv. Energy Mater. 10 (2020). 10.1002/aenm.201902104 [30] Y.M. Shi B. Zhang Recent advances in transition metal phosphide nanomaterials: synthesis and applications in hydrogen evolution reaction Chem. Soc. Rev. 45 2016 1529 1541 10.1039/c5cs00434a Y.M. Shi, B. Zhang, Recent advances in transition metal phosphide nanomaterials: synthesis and applications in hydrogen evolution reaction, Chem. Soc. Rev. 45 (2016) 1529–1541. 10.1039/c5cs00434a [31] T. Zhang J. Du P. Xi C. Xu Hybrids of cobalt/iron phosphides derived from bimetal-organic frameworks as highly efficient electrocatalysts for oxygen evolution reaction ACS Appl. Mater. Interfaces 9 2017 362 370 10.1021/acsami.6b12189 T. Zhang, J. Du, P. Xi, C. Xu, Hybrids of cobalt/iron phosphides derived from bimetal-organic frameworks as highly efficient electrocatalysts for oxygen evolution reaction, ACS Appl. Mater. Interfaces 9 (2017) 362–370. 10.1021/acsami.6b12189 [32] L. Yan L. Cao P. Dai X. Gu D. Liu L. Li Y. Wang X. Zhao Metal-organic frameworks derived nanotube of nickel-cobalt bimetal phosphides as highly efficient electrocatalysts for overall water splitting Adv. Funct. Mater. 2017 27 10.1002/adfm.201703455 L. Yan, L. Cao, P. Dai, X. Gu, D. Liu, L. Li, Y. Wang, X. Zhao, Metal-organic frameworks derived nanotube of nickel-cobalt bimetal phosphides as highly efficient electrocatalysts for overall water splitting, Adv. Funct. Mater. 27 (2017). 10.1002/adfm.201703455 [33] J. Kibsgaard T.F. Jaramillo F. Besenbacher Building an appropriate active-site motif into a hydrogen-evolution catalyst with thiomolybdate [Mo3S13]2− clusters Nat. Chem. 6 2014 248 253 10.1038/nchem.1853 J. Kibsgaard, T.F. Jaramillo, F. Besenbacher, Building an appropriate active-site motif into a hydrogen-evolution catalyst with thiomolybdate [Mo3S13]2− clusters, Nat. Chem. 6 (2014) 248–253. 10.1038/nchem.1853 [34] Z.Y. Yu Y. Duan X.Y. Feng X. Yu M.R. Gao S.H. Yu Clean and affordable hydrogen fuel from alkaline water splitting: past, recent progress, and future prospects Adv. Mater. 2021 33 10.1002/adma.202007100 Z.Y. Yu, Y. Duan, X.Y. Feng, X. Yu, M.R. Gao, S.H. Yu, Clean and affordable hydrogen fuel from alkaline water splitting: past, recent progress, and future prospects, Adv. Mater. 33 (2021). 10.1002/adma.202007100 [35] Y. Shi Z. Lyu M. Zhao R. Chen Q.N. Nguyen Y. Xia Noble-metal nanocrystals with controlled shapes for catalytic and electrocatalytic applications Chem. Rev. 121 2021 649 735 10.1021/acs.chemrev.0c00454 Y. Shi, Z. Lyu, M. Zhao, R. Chen, Q.N. Nguyen, Y. Xia, Noble-metal nanocrystals with controlled shapes for catalytic and electrocatalytic applications, Chem. Rev. 121 (2021) 649–735. 10.1021/acs.chemrev.0c00454 [36] X. Zhang A. Chen L. Chen Z. Zhou 2D materials bridging experiments and computations for electro/photocatalysis Adv. Energy Mater. 12 2022 10.1002/aenm.202003841 X. Zhang, A. Chen, L. Chen, Z. Zhou, 2D materials bridging experiments and computations for electro/photocatalysis, Adv. Energy Mater. 12 (2022). 10.1002/aenm.202003841 [37] F. Yang Y. Chen G. Cheng S. Chen W. Luo Ultrathin nitrogen-doped carbon coated with CoP for efficient hydrogen evolution ACS Catal. 7 2017 3824 3831 10.1021/acscatal.7b00587 F. Yang, Y. Chen, G. Cheng, S. Chen, W. Luo, Ultrathin nitrogen-doped carbon coated with CoP for efficient hydrogen evolution, ACS Catal. 7 (2017) 3824–3831. 10.1021/acscatal.7b00587 [38] Y. Sun L. Hang Q. Shen T. Zhang H. Li X. Zhang X. Lyu Y. Li Mo doped Ni2P nanowire arrays: an efficient electrocatalyst for the hydrogen evolution reaction with enhanced activity at all pH values Nanoscale 9 2017 16674 16679 10.1039/c7nr03515b Y. Sun, L. Hang, Q. Shen, T. Zhang, H. Li, X. Zhang, X. Lyu, Y. Li, Mo doped Ni2P nanowire arrays: an efficient electrocatalyst for the hydrogen evolution reaction with enhanced activity at all pH values, Nanoscale 9 (2017) 16674–16679. 10.1039/c7nr03515b [39] R. Subbaraman D. Tripkovic D. Strmcnik K.C. Chang M. Uchimura A.P. Paulikas V. Stamenkovic N.M. Markovic Enhancing hydrogen evolution activity in water splitting by tailoring Li+-Ni(OH)2-Pt interfaces Science 334 2011 1256 1260 10.1126/science.1211934 R. Subbaraman, D. Tripkovic, D. Strmcnik, K.C. Chang, M. Uchimura, A.P. Paulikas, V. Stamenkovic, N.M. Markovic, Enhancing hydrogen evolution activity in water splitting by tailoring Li+-Ni(OH)2-Pt interfaces, Science 334 (2011) 1256–1260. 10.1126/science.1211934 [40] S. Xue R.W. Haid R.M. Kluge X. Ding B. Garlyyev J. Fichtner S. Watzele S. Hou A.S. Bandarenka Enhancing the hydrogen evolution reaction activity of platinum electrodes in alkaline media using nickel-iron clusters Angew. Chem. Int. Ed. 59 2020 10934 10938 10.1002/anie.202000383 S. Xue, R.W. Haid, R.M. Kluge, X. Ding, B. Garlyyev, J. Fichtner, S. Watzele, S. Hou, A.S. Bandarenka, Enhancing the hydrogen evolution reaction activity of platinum electrodes in alkaline media using nickel-iron clusters, Angew. Chem. Int. Ed. 59 (2020) 10934–10938. 10.1002/anie.202000383 [41] X.X. Wang D.A. Cullen Y.T. Pan S. Hwang M. Wang Z. Feng J. Wang M.H. Engelhard H. Zhang Y. He Y. Shao D. Su K.L. More J.S. Spendelow G. Wu Nitrogen-coordinated single cobalt atom catalysts for oxygen reduction in proton exchange membrane fuel cells Adv. Mater. 2018 30 10.1002/adma.201706758 X.X. Wang, D.A. Cullen, Y.T. Pan, S. Hwang, M. Wang, Z. Feng, J. Wang, M.H. Engelhard, H. Zhang, Y. He, Y. Shao, D. Su, K.L. More, J.S. Spendelow, G. Wu, Nitrogen-coordinated single cobalt atom catalysts for oxygen reduction in proton exchange membrane fuel cells, Adv. Mater. 30 (2018). 10.1002/adma.201706758 [42] J. Wang F. Xu H. Jin Y. Chen Y. Wang Non-noble metal-based carbon composites in hydrogen evolution reaction: fundamentals to applications Adv. Mater. 2017 29 10.1002/adma.201605838 J. Wang, F. Xu, H. Jin, Y. Chen, Y. Wang, Non-noble metal-based carbon composites in hydrogen evolution reaction: fundamentals to applications, Adv. Mater. 29 (2017). 10.1002/adma.201605838 [43] Z. Li H. Feng M. Song C. He W. Zhuang L. Tian Advances in CoP electrocatalysts for water splitting Mater. Today Energy 20 2021 10.1016/j.mtener.2021.100698 Z. Li, H. Feng, M. Song, C. He, W. Zhuang, L. Tian, Advances in CoP electrocatalysts for water splitting, Mater. Today Energy 20 (2021). 10.1016/j.mtener.2021.100698 [44] Y. Park H. Kang Y.k. Hong G. Cho M. Choi J. Cho D.H. Ha Influence of the phosphorus source on iron phosphide nanoparticle synthesis for hydrogen evolution reaction catalysis Int. J. Hydrog. Energy 45 2020 32780 32788 10.1016/j.ijhydene.2020.03.051 Y. Park, H. Kang, Y.k. Hong, G. Cho, M. Choi, J. Cho, D.H. Ha, Influence of the phosphorus source on iron phosphide nanoparticle synthesis for hydrogen evolution reaction catalysis, Int. J. Hydrog. Energy 45 (2020) 32780–32788. 10.1016/j.ijhydene.2020.03.051 [45] Q. Liu M. Wang Y. He X. Wang W. Su Photochemical route for synthesizing Co-P alloy decorated ZnIn2S4 with enhanced photocatalytic H2 production activity under visible light irradiation Nanoscale 10 2018 19100 19106 10.1039/c8nr05934a Q. Liu, M. Wang, Y. He, X. Wang, W. Su, Photochemical route for synthesizing Co-P alloy decorated ZnIn2S4 with enhanced photocatalytic H2 production activity under visible light irradiation, Nanoscale 10 (2018) 19100–19106. 10.1039/c8nr05934a [46] C. Cai Y. Teng J.H. Wu J.Y. Li H.Y. Chen J.H. Chen D.B. Kuang In situ photosynthesis of an MAPbI3/CoP hybrid heterojunction for efficient photocatalytic hydrogen evolution Adv. Funct. Mater. 2020 30 10.1002/adfm.202001478 C. Cai, Y. Teng, J.H. Wu, J.Y. Li, H.Y. Chen, J.H. Chen, D.B. Kuang, In situ photosynthesis of an MAPbI3/CoP hybrid heterojunction for efficient photocatalytic hydrogen evolution, Adv. Funct. Mater. 30 (2020). 10.1002/adfm.202001478 [47] K. Xiong Y. Gao J. Chen Y. Shen H. Zhang Ordered porous Ni in situ decorated by thin-layer amorphous nickel-phosphorus via mild electrochemical-phosphorization for enhancing the hydrogen evolution performance Chem. Commun. 56 2020 611 614 10.1039/c9cc08698f K. Xiong, Y. Gao, J. Chen, Y. Shen, H. Zhang, Ordered porous Ni in situ decorated by thin-layer amorphous nickel-phosphorus via mild electrochemical-phosphorization for enhancing the hydrogen evolution performance, Chem. Commun. 56 (2020) 611–614. 10.1039/c9cc08698f [48] D. Guo H. Chen H. Tian S. Ouyang J. Wang J. Lv Modulation of an intermediate layer between NiCoP and Ni foam substrate in a microwire array electrode for enhancing the hydrogen-evolution reaction Chem. Commun. 56 2020 4990 4993 10.1039/d0cc01488e D. Guo, H. Chen, H. Tian, S. Ouyang, J. Wang, J. Lv, Modulation of an intermediate layer between NiCoP and Ni foam substrate in a microwire array electrode for enhancing the hydrogen-evolution reaction, Chem. Commun. 56 (2020) 4990–4993. 10.1039/d0cc01488e [49] Z.P. Lu L. Sepunaru Electrodeposition of iron phosphide film for hydrogen evolution reaction Electrochim. Acta 363 2020 10.1016/j.electacta.2020.137167 Z.P. Lu, L. Sepunaru, Electrodeposition of iron phosphide film for hydrogen evolution reaction, Electrochim. Acta 363 (2020). 10.1016/j.electacta.2020.137167 [50] K. Wang K. Sun T. Yu X. Liu G. Wang L. Jiang G. Xie Facile synthesis of nanoporous Ni-Fe-P bifunctional catalysts with high performance for overall water splitting J. Mater. Chem. A 7 2019 2518 2523 10.1039/c8ta10856k K. Wang, K. Sun, T. Yu, X. Liu, G. Wang, L. Jiang, G. Xie, Facile synthesis of nanoporous Ni-Fe-P bifunctional catalysts with high performance for overall water splitting, J. Mater. Chem. A 7 (2019) 2518–2523. 10.1039/c8ta10856k [51] H. Sun X. Xu Z. Yan X. Chen L. Jiao F. Cheng J. Chen Superhydrophilic amorphous Co-B-P nanosheet electrocatalysts with Pt-like activity and durability for the hydrogen evolution reaction J. Mater. Chem. A 6 2018 22062 22069 10.1039/c8ta02999g H. Sun, X. Xu, Z. Yan, X. Chen, L. Jiao, F. Cheng, J. Chen, Superhydrophilic amorphous Co-B-P nanosheet electrocatalysts with Pt-like activity and durability for the hydrogen evolution reaction, J. Mater. Chem. A 6 (2018) 22062–22069. 10.1039/c8ta02999g [52] D. Sun H. Zhang X. Zhang J. Yang Robust metallic microcapsules: a direct path to new multifunctional materials ACS Appl. Mater. Interfaces 11 2019 9621 9628 10.1021/acsami.9b00827 D. Sun, H. Zhang, X. Zhang, J. Yang, Robust metallic microcapsules: a direct path to new multifunctional materials, ACS Appl. Mater. Interfaces 11 (2019) 9621–9628. 10.1021/acsami.9b00827 [53] F. Bu W. Chen M.F.A. Aboud I. Shakir J. Gu Y. Xu Microwave-assisted ultrafast synthesis of adjustable bimetal phosphide/graphene heterostructures from MOFs for efficient electrochemical water splitting J. Mater. Chem. A 7 2019 14526 14535 10.1039/c9ta03146d F. Bu, W. Chen, M.F.A. Aboud, I. Shakir, J. Gu, Y. Xu, Microwave-assisted ultrafast synthesis of adjustable bimetal phosphide/graphene heterostructures from MOFs for efficient electrochemical water splitting, J. Mater. Chem. A 7 (2019) 14526–14535. 10.1039/c9ta03146d [54] H. Huang X. Huang Z. Zhu J. Dai Hydrothermal synthesis of cobalt phosphide nanoparticles Ceram. Int. 38 2012 1713 1715 10.1016/j.ceramint.2011.09.001 H. Huang, X. Huang, Z. Zhu, J. Dai, Hydrothermal synthesis of cobalt phosphide nanoparticles, Ceram. Int. 38 (2012) 1713–1715. 10.1016/j.ceramint.2011.09.001 [55] Q. Zhao Y. Han X. Huang J. Dai J. Tian Z. Zhu L. Yue Hydrothermal synthesis of Ni2P nanoparticle and its hydrodesulfurization of dibenzothiophene J. Nanopart. Res. 2017 19 10.1007/s11051-017-3781-2 Q. Zhao, Y. Han, X. Huang, J. Dai, J. Tian, Z. Zhu, L. Yue, Hydrothermal synthesis of Ni2P nanoparticle and its hydrodesulfurization of dibenzothiophene, J. Nanopart. Res. 19 (2017). 10.1007/s11051-017-3781-2 [56] W. Li X. Li J. Liao B. Zhao L. Zhang L. Huang G. Liu Z. Guo M. Liu A new family of cation-disordered Zn(Cu)-Si-P compounds as high-performance anodes for next-generation Li-ion batteries Energy Environ. Sci. 12 2019 2286 2297 10.1039/c9ee00953a W. Li, X. Li, J. Liao, B. Zhao, L. Zhang, L. Huang, G. Liu, Z. Guo, M. Liu, A new family of cation-disordered Zn(Cu)-Si-P compounds as high-performance anodes for next-generation Li-ion batteries, Energy Environ. Sci. 12 (2019) 2286–2297. 10.1039/c9ee00953a [57] W. Li J. Liao X. Li L. Zhang B. Zhao Y. Chen Y. Zhou Z. Cuo M. Liu Zn(Cu)Si2+xP3 solid solution anodes for high-performance Li-Ion batteries with tunable working potentials Adv. Funct. Mater. 2019 29 10.1002/adfm.201903638 W. Li, J. Liao, X. Li, L. Zhang, B. Zhao, Y. Chen, Y. Zhou, Z. Cuo, M. Liu, Zn(Cu)Si2+xP3 solid solution anodes for high-performance Li-Ion batteries with tunable working potentials, Adv. Funct. Mater. 29 (2019). 10.1002/adfm.201903638 [58] K.H. Kim W.S. Kim S.H. Hong Solid solution phosphide (Mn1-xFexP) as a tunable conversion/alloying hybrid anode for lithium-ion batteries Nanoscale 11 2019 13494 13501 10.1039/c9nr02016k K.H. Kim, W.S. Kim, S.H. Hong, Solid solution phosphide (Mn1-xFexP) as a tunable conversion/alloying hybrid anode for lithium-ion batteries, Nanoscale 11 (2019) 13494–13501. 10.1039/c9nr02016k [59] Y. Tan H. Wang P. Liu C. Cheng F. Zhu A. Hirata M. Chen 3D nanoporous metal phosphides toward high-efficiency electrochemical hydrogen production Adv. Mater 28 2016 2951 2955 10.1002/adma.201505875 Y. Tan, H. Wang, P. Liu, C. Cheng, F. Zhu, A. Hirata, M. Chen, 3D nanoporous metal phosphides toward high-efficiency electrochemical hydrogen production, Adv. Mater. 28 (2016) 2951–2955. 10.1002/adma.201505875 [60] Y. Jiang M. Peng J. Lan Y. Zhao Y.R. Lu T.S. Chan J. Liu Y. Tan A self-reconstructed (oxy)hydroxide@nanoporous metal phosphide electrode for high-performance rechargeable zinc batteries J. Mater. Chem. A 7 2019 21069 21078 10.1039/c9ta07910f Y. Jiang, M. Peng, J. Lan, Y. Zhao, Y.R. Lu, T.S. Chan, J. Liu, Y. Tan, A self-reconstructed (oxy)hydroxide@nanoporous metal phosphide electrode for high-performance rechargeable zinc batteries, J. Mater. Chem. A 7 (2019) 21069–21078. 10.1039/c9ta07910f [61] W. Xu S. Zhu Y. Liang Z. Cui X. Yang A. Inoue A nanoporous metal phosphide catalyst for bifunctional water splitting J. Mater. Chem. A 6 2018 5574 5579 10.1039/c8ta00622a W. Xu, S. Zhu, Y. Liang, Z. Cui, X. Yang, A. Inoue, A nanoporous metal phosphide catalyst for bifunctional water splitting, J. Mater. Chem. A 6 (2018) 5574–5579. 10.1039/c8ta00622a [62] H. Yan X. Xiao C. Hu X. Liu Y. Song Construction of wool-shaped heterostructure structure CoNi/NF-P electrocatalyst for efficient hydrogen evolution reaction Mol. Catal. 2023 547 10.1016/j.mcat.2023.113327 H. Yan, X. Xiao, C. Hu, X. Liu, Y. Song, Construction of wool-shaped heterostructure structure CoNi/NF-P electrocatalyst for efficient hydrogen evolution reaction, Mol. Catal. 547 (2023). 10.1016/j.mcat.2023.113327 [63] H. Song J. Yu Z. Tang B. Yang S. Lu Halogen-doped carbon dots on amorphous cobalt phosphide as robust electrocatalysts for overall water splitting Adv. Energy Mater. 12 2022 10.1002/aenm.202102573 H. Song, J. Yu, Z. Tang, B. Yang, S. Lu, Halogen-doped carbon dots on amorphous cobalt phosphide as robust electrocatalysts for overall water splitting, Adv. Energy Mater. 12 (2022). 10.1002/aenm.202102573 [64] S. Li L. Wang H. Su A.N. Hong Y. Wang H. Yang L. Ge W. Song J. Liu T. Ma X. Bu P. Feng Electron redistributed S-doped nickel iron phosphides derived from one-step phosphatization of MOFs for significantly boosting electrochemical water splitting Adv. Funct. Mater. 2022 32 10.1002/adfm.202200733 S. Li, L. Wang, H. Su, A.N. Hong, Y. Wang, H. Yang, L. Ge, W. Song, J. Liu, T. Ma, X. Bu, P. Feng, Electron redistributed S-doped nickel iron phosphides derived from one-step phosphatization of MOFs for significantly boosting electrochemical water splitting, Adv. Funct. Mater. 32 (2022). 10.1002/adfm.202200733 [65] B. Seo D.S. Baek Y.J. Sa S.H. Joo Shape effects of nickel phosphide nanocrystals on hydrogen evolution reaction Crystengcomm 18 2016 6083 6089 10.1039/c6ce00985a B. Seo, D.S. Baek, Y.J. Sa, S.H. Joo, Shape effects of nickel phosphide nanocrystals on hydrogen evolution reaction, Crystengcomm 18 (2016) 6083–6089. 10.1039/c6ce00985a [66] H. Li S. Lu J. Sun J. Pei D. Liu Y. Xue J. Mao W. Zhu Z. Zhuang Phase-controlled synthesis of nickel phosphide nanocrystals and their electrocatalytic performance for the hydrogen evolution reaction Chem. Eur. J. 24 2018 11748 11754 10.1002/chem.201801964 H. Li, S. Lu, J. Sun, J. Pei, D. Liu, Y. Xue, J. Mao, W. Zhu, Z. Zhuang, Phase-controlled synthesis of nickel phosphide nanocrystals and their electrocatalytic performance for the hydrogen evolution reaction, Chem. Eur. J. 24 (2018) 11748–11754. 10.1002/chem.201801964 [67] S. Ghosh S.R. Kadam L. Houben R. Bar-Ziv M. Bar-Sadan Nickel phosphide catalysts for hydrogen generation through water reduction, ammonia-borane and borohydride hydrolysis Appl. Mater. Today 20 2020 10.1016/j.apmt.2020.100693 S. Ghosh, S.R. Kadam, L. Houben, R. Bar-Ziv, M. Bar-Sadan, Nickel phosphide catalysts for hydrogen generation through water reduction, ammonia-borane and borohydride hydrolysis, Appl. Mater. Today 20 (2020). 10.1016/j.apmt.2020.100693 [68] J. Li J. Li X. Zhou Z. Xia W. Gao Y. Ma Y. Qu Highly efficient and robust nickel phosphides as bifunctional electrocatalysts for overall water-splitting ACS Appl. Mater. Interfaces 8 2016 10826 10834 10.1021/acsami.6b00731 J. Li, J. Li, X. Zhou, Z. Xia, W. Gao, Y. Ma, Y. Qu, Highly efficient and robust nickel phosphides as bifunctional electrocatalysts for overall water-splitting, ACS Appl. Mater. Interfaces 8 (2016) 10826–10834. 10.1021/acsami.6b00731 [69] J. Cai J. Ding D. Wei X. Xie B. Li S. Lu J. Zhang Y. Liu Q. Cai S. Zang Coupling of Ru and O-vacancy on 2D Mo-based electrocatalyst via a solid-phase interface reaction strategy for hydrogen evolution reaction Adv. Energy Mater. 11 2021 10.1002/aenm.202100141 J. Cai, J. Ding, D. Wei, X. Xie, B. Li, S. Lu, J. Zhang, Y. Liu, Q. Cai, S. Zang, Coupling of Ru and O-vacancy on 2D Mo-based electrocatalyst via a solid-phase interface reaction strategy for hydrogen evolution reaction, Adv. Energy Mater. 11 (2021). 10.1002/aenm.202100141 [70] A. Han X. Zhou X. Wang S. Liu Q. Xiong Q. Zhang L. Gu Z. Zhuang W. Zhang F. Li D. Wang L.J. Li Y. Li One-step synthesis of single-site vanadium substitution in 1T-WS2 monolayers for enhanced hydrogen evolution catalysis Nat. Commun. 2021 12 10.1038/s41467-021-20951-9 A. Han, X. Zhou, X. Wang, S. Liu, Q. Xiong, Q. Zhang, L. Gu, Z. Zhuang, W. Zhang, F. Li, D. Wang, L.J. Li, Y. Li, One-step synthesis of single-site vanadium substitution in 1T-WS2 monolayers for enhanced hydrogen evolution catalysis, Nat. Commun. 12 (2021). 10.1038/s41467-021-20951-9 [71] K. Chen Y. Li G. Wu Q. Wang C. Fan L. Zhang J. Song S. Han Electrodeposited Ni-Co-P triple-layered structure as a robust and durable electrocatalyst for hydrogen evolution J. Electrochem. Soc. 2023 170 10.1149/1945-7111/aceeb9 K. Chen, Y. Li, G. Wu, Q. Wang, C. Fan, L. Zhang, J. Song, S. Han, Electrodeposited Ni-Co-P triple-layered structure as a robust and durable electrocatalyst for hydrogen evolution, J. Electrochem. Soc. 170 (2023). 10.1149/1945-7111/aceeb9 [72] X. He J. Cai J. Zhou Q. Chen Q. Zhong J. Liu Z. Sun D. Qu Y. Li Facile electrochemical synthesis of bifunctional needle-like Co-P nanoarray for efficient overall water splitting Molecules 28 2023 10.3390/molecules28166101 X. He, J. Cai, J. Zhou, Q. Chen, Q. Zhong, J. Liu, Z. Sun, D. Qu, Y. Li, Facile electrochemical synthesis of bifunctional needle-like Co-P nanoarray for efficient overall water splitting, Molecules 28 (2023). 10.3390/molecules28166101 [73] Y. Shajirati M.M. Momeni M. Tayebi B.K. Lee Facile synthesis of interlaced flower-like layered double hydroxides grown on porous CoMoP as a highly efficient electrocatalyst for hydrogen evolution reaction Energy 2023 278 10.1016/j.energy.2023.127840 Y. Shajirati, M.M. Momeni, M. Tayebi, B.K. Lee, Facile synthesis of interlaced flower-like layered double hydroxides grown on porous CoMoP as a highly efficient electrocatalyst for hydrogen evolution reaction, Energy 278 (2023). 10.1016/j.energy.2023.127840 [74] V. Tallapally R.J.A. Esteves L. Nahar I.U. Arachchige Multivariate synthesis of tin phosphide nanoparticles: temperature, time, and ligand control of size, shape, and crystal structure Chem. Mater. 28 2016 5406 5414 10.1021/acs.chemmater.6b01749 V. Tallapally, R.J.A. Esteves, L. Nahar, I.U. Arachchige, Multivariate synthesis of tin phosphide nanoparticles: temperature, time, and ligand control of size, shape, and crystal structure, Chem. Mater. 28 (2016) 5406–5414. 10.1021/acs.chemmater.6b01749 [75] J.F. Callejas J.M. McEnaney C.G. Read J.C. Crompton A.J. Biacchi E.J. Popczun T.R. Gordon N.S. Lewis R.E. Schaak Electrocatalytic and photocatalytic hydrogen production from acidic and neutral-pH aqueous solutions using iron phosphide nanoparticles Acs Nano 8 2014 11101 11107 10.1021/nn5048553 J.F. Callejas, J.M. McEnaney, C.G. Read, J.C. Crompton, A.J. Biacchi, E.J. Popczun, T.R. Gordon, N.S. Lewis, R.E. Schaak, Electrocatalytic and photocatalytic hydrogen production from acidic and neutral-pH aqueous solutions using iron phosphide nanoparticles, Acs Nano 8 (2014) 11101–11107. 10.1021/nn5048553 [76] E.J. Popczun C.G. Read C.W. Roske N.S. Lewis R.E. Schaak Highly active electrocatalysis of the hydrogen evolution reaction by cobalt phosphide nanoparticles** Angew. Chem. Int. Ed. 53 2014 5427 5430 10.1002/anie.201402646 E.J. Popczun, C.G. Read, C.W. Roske, N.S. Lewis, R.E. Schaak, Highly active electrocatalysis of the hydrogen evolution reaction by cobalt phosphide nanoparticles**, Angew. Chem. Int. Ed. 53 (2014) 5427–5430. 10.1002/anie.201402646 [77] E.J. Popczun J.R. McKone C.G. Read A.J. Biacchi A.M. Wiltrout N.S. Lewis R.E. Schaak Nanostructured nickel phosphide as an electrocatalyst for the hydrogen evolution reaction J. Am. Chem. Soc. 135 2013 9267 9270 10.1021/ja403440e E.J. Popczun, J.R. McKone, C.G. Read, A.J. Biacchi, A.M. Wiltrout, N.S. Lewis, R.E. Schaak, Nanostructured nickel phosphide as an electrocatalyst for the hydrogen evolution reaction, J. Am. Chem. Soc. 135 (2013) 9267–9270. 10.1021/ja403440e [78] H. Du R.M. Kong X. Guo F. Qu J. Li Recent progress in transition metal phosphides with enhanced electrocatalysis for hydrogen evolution Nanoscale 10 2018 21617 21624 10.1039/c8nr07891b H. Du, R.M. Kong, X. Guo, F. Qu, J. Li, Recent progress in transition metal phosphides with enhanced electrocatalysis for hydrogen evolution, Nanoscale 10 (2018) 21617–21624. 10.1039/c8nr07891b [79] X.G. Wang Y.V. Kolen'ko L.F. Liu Direct solvothermal phosphorization of nickel foam to fabricate integrated Ni2P-nanorods/Ni electrodes for efficient electrocatalytic hydrogen evolution Chem. Commun. 51 2015 6738 6741 10.1039/c5cc00370a X.G. Wang, Y.V. Kolen'ko, L.F. Liu, Direct solvothermal phosphorization of nickel foam to fabricate integrated Ni2P-nanorods/Ni electrodes for efficient electrocatalytic hydrogen evolution, Chem. Commun. 51 (2015) 6738–6741. 10.1039/c5cc00370a [80] T. Fu X. Tong Y. Zhou D. Wu D. Xiong S. Xu L. Wang P.K. Chu One-step hydrothermal synthesis of CoNi bimetallic phosphide nanoflowers for high-performance quasi-solid-state zinc-ion batteries J. Alloys Compd. 918 2022 10.1016/j.jallcom.2022.165734 T. Fu, X. Tong, Y. Zhou, D. Wu, D. Xiong, S. Xu, L. Wang, P.K. Chu, One-step hydrothermal synthesis of CoNi bimetallic phosphide nanoflowers for high-performance quasi-solid-state zinc-ion batteries, J. Alloys Compd. 918 (2022). 10.1016/j.jallcom.2022.165734 [81] X. Huang Q. Dong H. Huang L. Yue Z. Zhu J. Dai Facile synthesis of iron phosphide Fe2P nanoparticle and its catalytic performance in thiophene hydrodesulfurization J. Nanopart. Res. 2014 16 10.1007/s11051-014-2785-4 X. Huang, Q. Dong, H. Huang, L. Yue, Z. Zhu, J. Dai, Facile synthesis of iron phosphide Fe2P nanoparticle and its catalytic performance in thiophene hydrodesulfurization, J. Nanopart. Res. 16 (2014). 10.1007/s11051-014-2785-4 [82] D. Wang X. Zhang D. Zhang Y. Shen Z. Wu Influence of Mo/P Ratio on CoMoP nanoparticles as highly efficient HER catalysts Appl. Catal. A Gen. 511 2016 11 15 10.1016/j.apcata.2015.11.029 D. Wang, X. Zhang, D. Zhang, Y. Shen, Z. Wu, Influence of Mo/P Ratio on CoMoP nanoparticles as highly efficient HER catalysts, Appl. Catal. A Gen. 511 (2016) 11–15. 10.1016/j.apcata.2015.11.029 [83] T. Wu S. Chen D. Zhang J. Hou Facile preparation of semimetallic MoP2 as a novel visible light driven photocatalyst with high photocatalytic activity J. Mater. Chem. A 3 2015 10360 10367 10.1039/c5ta00870k T. Wu, S. Chen, D. Zhang, J. Hou, Facile preparation of semimetallic MoP2 as a novel visible light driven photocatalyst with high photocatalytic activity, J. Mater. Chem. A 3 (2015) 10360–10367. 10.1039/c5ta00870k [84] N. Jiang B. You M. Sheng Y. Sun Electrodeposited cobalt-phosphorous-derived films as competent bifunctional catalysts for overall water splitting Angew. Chem. Int. Ed. 54 2015 6251 6254 10.1002/anie.201501616 N. Jiang, B. You, M. Sheng, Y. Sun, Electrodeposited cobalt-phosphorous-derived films as competent bifunctional catalysts for overall water splitting, Angew. Chem. Int. Ed. 54 (2015) 6251–6254. 10.1002/anie.201501616 [85] P. Zhao N. Wang M. Yao H. Ren W. Hu Hydrothermal electrodeposition incorporated with CVD-polymerisation to tune PPy@MnO2 interlinked core-shell nanowires on carbon fabric for flexible solid-state asymmetric supercapacitors Chem. Eng. J. 2020 380 10.1016/j.cej.2019.122488 P. Zhao, N. Wang, M. Yao, H. Ren, W. Hu, Hydrothermal electrodeposition incorporated with CVD-polymerisation to tune PPy@MnO2 interlinked core-shell nanowires on carbon fabric for flexible solid-state asymmetric supercapacitors, Chem. Eng. J. 380 (2020). 10.1016/j.cej.2019.122488 [86] C. Yu F. Xu L. Luo H.S. Abbo S.J.J. Titinchi P.K. Shen P. Tsiakaras S. Yin Bimetallic Ni-Co phosphide nanosheets self-supported on nickel foam as high-performance electrocatalyst for hydrogen evolution reaction Electrochim. Acta 317 2019 191 198 10.1016/j.electacta.2019.05.150 C. Yu, F. Xu, L. Luo, H.S. Abbo, S.J.J. Titinchi, P.K. Shen, P. Tsiakaras, S. Yin, Bimetallic Ni-Co phosphide nanosheets self-supported on nickel foam as high-performance electrocatalyst for hydrogen evolution reaction, Electrochim. Acta 317 (2019) 191–198. 10.1016/j.electacta.2019.05.150 [87] Z. Ge B. Fu J. Zhao X. Li B. Ma Y. Chen A review of the electrocatalysts on hydrogen evolution reaction with an emphasis on Fe, Co and Ni-based phosphides J. Mater. Sci. 55 2020 14081 14104 10.1007/s10853-020-05010-w Z. Ge, B. Fu, J. Zhao, X. Li, B. Ma, Y. Chen, A review of the electrocatalysts on hydrogen evolution reaction with an emphasis on Fe, Co and Ni-based phosphides, J. Mater. Sci. 55 (2020) 14081–14104. 10.1007/s10853-020-05010-w [88] C. Meng Z. Wang L. Zhang X. Ji X. Chen R. Yu Tuning the Mn dopant to boost the hydrogen evolution performance of CoP nanowire arrays Inorg. Chem. 61 2022 9832 9839 10.1021/acs.inorgchem.2c01436 C. Meng, Z. Wang, L. Zhang, X. Ji, X. Chen, R. Yu, Tuning the Mn dopant to boost the hydrogen evolution performance of CoP nanowire arrays, Inorg. Chem. 61 (2022) 9832–9839. 10.1021/acs.inorgchem.2c01436 [89] T. Liu X. Ma D. Liu S. Hao G. Du Y. Ma A.M. Asiri X. Sun L. Chen Mn doping of CoP nanosheets array: an efficient electrocatalyst for hydrogen evolution reaction with enhanced activity at all pH values ACS Catal. 7 2017 98 102 10.1021/acscatal.6b02849 T. Liu, X. Ma, D. Liu, S. Hao, G. Du, Y. Ma, A.M. Asiri, X. Sun, L. Chen, Mn doping of CoP nanosheets array: an efficient electrocatalyst for hydrogen evolution reaction with enhanced activity at all pH values, ACS Catal. 7 (2017) 98–102. 10.1021/acscatal.6b02849 [90] J. Kibsgaard C. Tsai K. Chan J.D. Benck J.K. Norskov F. Abild-Pedersen T.F. Jaramillo Designing an improved transition metal phosphide catalyst for hydrogen evolution using experimental and theoretical trends Energy Environ. Sci. 8 2015 3022 3029 10.1039/c5ee02179k J. Kibsgaard, C. Tsai, K. Chan, J.D. Benck, J.K. Norskov, F. Abild-Pedersen, T.F. Jaramillo, Designing an improved transition metal phosphide catalyst for hydrogen evolution using experimental and theoretical trends, Energy Environ. Sci. 8 (2015) 3022–3029. 10.1039/c5ee02179k [91] D. Li H. Baydoun C.N. Verani S.L. Brock Efficient water oxidation using CoMnP nanoparticles J. Am. Chem. Soc. 138 2016 4006 4009 10.1021/jacs.6b01543 D. Li, H. Baydoun, C.N. Verani, S.L. Brock, Efficient water oxidation using CoMnP nanoparticles, J. Am. Chem. Soc. 138 (2016) 4006–4009. 10.1021/jacs.6b01543 [92] X. Li Q. Hu H. Wang M. Chen X. Hao Y. Ma J. Liu K. Tang A. Abudula G. Guan Charge induced crystal distortion and morphology remodeling: formation of Mn-CoP nanowire @ Mn-CoOOH nanosheet electrocatalyst with rich edge dislocation defects Appl. Catal. B Environ. 292 2021 10.1016/j.apcatb.2021.120172 X. Li, Q. Hu, H. Wang, M. Chen, X. Hao, Y. Ma, J. Liu, K. Tang, A. Abudula, G. Guan, Charge induced crystal distortion and morphology remodeling: formation of Mn-CoP nanowire @ Mn-CoOOH nanosheet electrocatalyst with rich edge dislocation defects, Appl. Catal. B Environ. 292 (2021). 10.1016/j.apcatb.2021.120172 [93] X. Zhou H. Gao Y. Wang Z. Liu J. Lin Y. Ding P vacancies-enriched 3D hierarchical reduced cobalt phosphide as a precursor template for defect engineering for efficient water oxidation J. Mater. Chem. A 6 2018 14939 14948 10.1039/c8ta03784a X. Zhou, H. Gao, Y. Wang, Z. Liu, J. Lin, Y. Ding, P vacancies-enriched 3D hierarchical reduced cobalt phosphide as a precursor template for defect engineering for efficient water oxidation, J. Mater. Chem. A 6 (2018) 14939–14948. 10.1039/c8ta03784a [94] J. Huang Q. Shang Y. Huang F. Tang Q. Zhang Q. Liu S. Jiang F. Hu W. Liu Y. Luo T. Yao Y. Jiang Z. Pan Z. Sun S. Wei Oxyhydroxide nanosheets with highly efficient electron-hole pair separation for hydrogen evolution Angew. Chem. Int. Ed. 55 2016 2137 2141 10.1002/anie.201510642 J. Huang, Q. Shang, Y. Huang, F. Tang, Q. Zhang, Q. Liu, S. Jiang, F. Hu, W. Liu, Y. Luo, T. Yao, Y. Jiang, Z. Pan, Z. Sun, S. Wei, Oxyhydroxide nanosheets with highly efficient electron-hole pair separation for hydrogen evolution, Angew. Chem. Int. Ed. 55 (2016) 2137–2141. 10.1002/anie.201510642 [95] D. Zhou Z. Wang X. Long Y. An H. Lin Z. Xing M. Ma S. Yang One-pot synthesis of manganese oxides and cobalt phosphides nanohybrids with abundant heterointerfaces in an amorphous matrix for efficient hydrogen evolution in alkaline solution J. Mater. Chem. A 7 2019 22530 22538 10.1039/c9ta07601h D. Zhou, Z. Wang, X. Long, Y. An, H. Lin, Z. Xing, M. Ma, S. Yang, One-pot synthesis of manganese oxides and cobalt phosphides nanohybrids with abundant heterointerfaces in an amorphous matrix for efficient hydrogen evolution in alkaline solution, J. Mater. Chem. A 7 (2019) 22530–22538. 10.1039/c9ta07601h [96] X. Wang H. Zhou D. Zhang M. Pi J. Feng S. Chen Mn-doped NiP2 nanosheets as an efficient electrocatalyst for enhanced hydrogen evolution reaction at all pH values J. Power Sources 387 2018 1 8 10.1016/j.jpowsour.2018.03.053 X. Wang, H. Zhou, D. Zhang, M. Pi, J. Feng, S. Chen, Mn-doped NiP2 nanosheets as an efficient electrocatalyst for enhanced hydrogen evolution reaction at all pH values, J. Power Sources 387 (2018) 1–8. 10.1016/j.jpowsour.2018.03.053 [97] J. Wang X. Ma F. Qu A.M. Asiri X. Sun Fe-doped Ni2P nanosheet array for high-efficiency electrochemical water oxidation Inorg. Chem. 56 2017 1041 1044 10.1021/acs.inorgchem.6b02808 J. Wang, X. Ma, F. Qu, A.M. Asiri, X. Sun, Fe-doped Ni2P nanosheet array for high-efficiency electrochemical water oxidation, Inorg. Chem. 56 (2017) 1041–1044. 10.1021/acs.inorgchem.6b02808 [98] P. Jiang Q. Liu X. Sun NiP2 nanosheet arrays supported on carbon cloth: an efficient 3D hydrogen evolution cathode in both acidic and alkaline solutions Nanoscale 6 2014 13440 13445 10.1039/c4nr04866k P. Jiang, Q. Liu, X. Sun, NiP2 nanosheet arrays supported on carbon cloth: an efficient 3D hydrogen evolution cathode in both acidic and alkaline solutions, Nanoscale 6 (2014) 13440–13445. 10.1039/c4nr04866k [99] M. Wang Y. Tuo X. Li Q. Hua F. Du L. Jiang Mesoporous Mn-doped FeP: facile synthesis and enhanced electrocatalytic activity for hydrogen evolution in a wide pH range ACS Sustain. Chem. Eng. 7 2019 12419 12427 10.1021/acssuschemeng.9b01952 M. Wang, Y. Tuo, X. Li, Q. Hua, F. Du, L. Jiang, Mesoporous Mn-doped FeP: facile synthesis and enhanced electrocatalytic activity for hydrogen evolution in a wide pH range, ACS Sustain. Chem. Eng. 7 (2019) 12419–12427. 10.1021/acssuschemeng.9b01952 [100] Z. Mu T. Guo H. Fei Y. Mao Z. Wu D. Wang Mn-doped porous interconnected MoP nanosheets for enhanced hydrogen evolution Appl. Surf. Sci. 2021 551 10.1016/j.apsusc.2021.149321 Z. Mu, T. Guo, H. Fei, Y. Mao, Z. Wu, D. Wang, Mn-doped porous interconnected MoP nanosheets for enhanced hydrogen evolution, Appl. Surf. Sci. 551 (2021). 10.1016/j.apsusc.2021.149321 [101] Y. Liu X. Liang L. Gu Y. Zhang G.D. Li X. Zou J.S. Chen Corrosion engineering towards efficient oxygen evolution electrodes with stable catalytic activity for over 6000 hours Nat. Commun. 9 2018 10.1038/s41467-018-05019-5 Y. Liu, X. Liang, L. Gu, Y. Zhang, G.D. Li, X. Zou, J.S. Chen, Corrosion engineering towards efficient oxygen evolution electrodes with stable catalytic activity for over 6000 hours, Nat. Commun. 9 (2018). 10.1038/s41467-018-05019-5 [102] Y. Li F. Li Y. Zhao S.N. Li J.H. Zeng H.C. Yao Y. Chen Iron doped cobalt phosphide ultrathin nanosheets on nickel foam for overall water splitting J. Mater. Chem. A 7 2019 20658 20666 10.1039/c9ta07289f Y. Li, F. Li, Y. Zhao, S.N. Li, J.H. Zeng, H.C. Yao, Y. Chen, Iron doped cobalt phosphide ultrathin nanosheets on nickel foam for overall water splitting, J. Mater. Chem. A 7 (2019) 20658–20666. 10.1039/c9ta07289f [103] F. Li Y. Bu Z. Lv J. Mahmood G.F. Han I. Ahmad G. Kim Q. Zhong J.B. Baek Porous cobalt phosphide polyhedrons with iron doping as an efficient bifunctional electrocatalyst Small 2017 13 10.1002/smll.201701167 F. Li, Y. Bu, Z. Lv, J. Mahmood, G.F. Han, I. Ahmad, G. Kim, Q. Zhong, J.B. Baek, Porous cobalt phosphide polyhedrons with iron doping as an efficient bifunctional electrocatalyst, Small 13 (2017). 10.1002/smll.201701167 [104] B. You N. Jiang M. Sheng S. Gul J. Yano Y. Sun High-performance overall water splitting electrocatalysts derived from cobalt-based metal-organic frameworks Chem. Mater. 27 2015 7636 7642 10.1021/acs.chemmater.5b02877 B. You, N. Jiang, M. Sheng, S. Gul, J. Yano, Y. Sun, High-performance overall water splitting electrocatalysts derived from cobalt-based metal-organic frameworks, Chem. Mater. 27 (2015) 7636–7642. 10.1021/acs.chemmater.5b02877 [105] Y.Y. Ma C.X. Wu X.J. Feng H.Q. Tan L.K. Yan Y. Liu Z.H. Kang E.B. Wang Y.G. Li Highly efficient hydrogen evolution from seawater by a low-cost and stable CoMoP@C electrocatalyst superior to Pt/C Energy Environ. Sci. 10 2017 788 798 10.1039/c6ee03768b Y.Y. Ma, C.X. Wu, X.J. Feng, H.Q. Tan, L.K. Yan, Y. Liu, Z.H. Kang, E.B. Wang, Y.G. Li, Highly efficient hydrogen evolution from seawater by a low-cost and stable CoMoP@C electrocatalyst superior to Pt/C, Energy Environ. Sci. 10 (2017) 788–798. 10.1039/c6ee03768b [106] L. Yu Q. Zhu S. Song B. McElhenny D. Wang C. Wu Z. Qin J. Bao Y. Yu S. Chen Z. Ren Non-noble metal-nitride based electrocatalysts for high-performance alkaline seawater electrolysis Nat. Commun. 2019 10 10.1038/s41467-019-13092-7 L. Yu, Q. Zhu, S. Song, B. McElhenny, D. Wang, C. Wu, Z. Qin, J. Bao, Y. Yu, S. Chen, Z. Ren, Non-noble metal-nitride based electrocatalysts for high-performance alkaline seawater electrolysis, Nat. Commun. 10 (2019). 10.1038/s41467-019-13092-7 [107] Y. Lin K. Sun X. Chen C. Chen Y. Pan X. Li J. Zhang High-precision regulation synthesis of Fe-doped Co2P nanorod bundles as efficient electrocatalysts for hydrogen evolution in all-pH range and seawater J. Energy Chem. 55 2021 92 101 10.1016/j.jechem.2020.06.073 Y. Lin, K. Sun, X. Chen, C. Chen, Y. Pan, X. Li, J. Zhang, High-precision regulation synthesis of Fe-doped Co2P nanorod bundles as efficient electrocatalysts for hydrogen evolution in all-pH range and seawater, J. Energy Chem. 55 (2021) 92–101. 10.1016/j.jechem.2020.06.073 [108] N. Suo X. Han C. Chen X. He Z. Dou Z. Lin L. Cui J. Xiang Engineering vanadium phosphide by iron doping as bifunctional electrocatalyst for overall water splitting Electrochim. Acta 333 2020 10.1016/j.electacta.2019.135531 N. Suo, X. Han, C. Chen, X. He, Z. Dou, Z. Lin, L. Cui, J. Xiang, Engineering vanadium phosphide by iron doping as bifunctional electrocatalyst for overall water splitting, Electrochim. Acta 333 (2020). 10.1016/j.electacta.2019.135531 [109] H. Sun Y. Min W. Yang Y. Lian L. Lin K. Feng Z. Deng M. Chen J. Zhong L. Xu Y. Peng Morphological and electronic tuning of Ni2P through iron doping toward highly efficient water splitting ACS Catal. 9 2019 8882 10.1021/acscatal.9b02264 H. Sun, Y. Min, W. Yang, Y. Lian, L. Lin, K. Feng, Z. Deng, M. Chen, J. Zhong, L. Xu, Y. Peng, Morphological and electronic tuning of Ni2P through iron doping toward highly efficient water splitting, ACS Catal. 9 (2019) 8882-+. 10.1021/acscatal.9b02264 [110] Y. Zhao J. Zhang Y. Xie B. Sun J. Jiang W.J. Jiang S. Xi H.Y. Yang K. Yan S. Wang X. Guo P. Li Z. Han X. Lu H. Liu G. Wang Constructing atomic heterometallic sites in ultrathin nickel-incorporated cobalt phosphide nanosheets via a boron-assisted strategy for highly efficient water splitting Nano Lett. 21 2021 823 832 10.1021/acs.nanolett.0c04569 Y. Zhao, J. Zhang, Y. Xie, B. Sun, J. Jiang, W.J. Jiang, S. Xi, H.Y. Yang, K. Yan, S. Wang, X. Guo, P. Li, Z. Han, X. Lu, H. Liu, G. Wang, Constructing atomic heterometallic sites in ultrathin nickel-incorporated cobalt phosphide nanosheets via a boron-assisted strategy for highly efficient water splitting, Nano Lett. 21 (2021) 823–832. 10.1021/acs.nanolett.0c04569 [111] H. Fan X. Huang L. Shang Y. Cao Y. Zhao L.Z. Wu C.H. Tung Y. Yin T. Zhang Controllable synthesis of ultrathin transition-metal hydroxide nanosheets and their extended composite nanostructures for enhanced catalytic activity in the heck reaction Angew. Chem. Int. Ed. 55 2016 2167 2170 10.1002/anie.201508939 H. Fan, X. Huang, L. Shang, Y. Cao, Y. Zhao, L.Z. Wu, C.H. Tung, Y. Yin, T. Zhang, Controllable synthesis of ultrathin transition-metal hydroxide nanosheets and their extended composite nanostructures for enhanced catalytic activity in the heck reaction, Angew. Chem. Int. Ed. 55 (2016) 2167–2170. 10.1002/anie.201508939 [112] Y. Pei Y. Yang F. Zhang P. Dong R. Baines Y. Ge H. Chu P.M. Ajayan J. Shen M. Ye Controlled electrodeposition synthesis of Co-Ni-P film as a flexible and inexpensive electrode for efficient overall water splitting ACS Appl. Mater. Interfaces 9 2017 31887 31896 10.1021/acsami.7b09282 Y. Pei, Y. Yang, F. Zhang, P. Dong, R. Baines, Y. Ge, H. Chu, P.M. Ajayan, J. Shen, M. Ye, Controlled electrodeposition synthesis of Co-Ni-P film as a flexible and inexpensive electrode for efficient overall water splitting, ACS Appl. Mater. Interfaces 9 (2017) 31887–31896. 10.1021/acsami.7b09282 [113] X.F. Lu L. Yu X.W. Lou Highly crystalline Ni-doped FeP/carbon hollow nanorods as all-pH efficient and durable hydrogen evolving electrocatalysts Sci. Adv. 5 2019 10.1126/sciadv.aav6009 X.F. Lu, L. Yu, X.W. Lou, Highly crystalline Ni-doped FeP/carbon hollow nanorods as all-pH efficient and durable hydrogen evolving electrocatalysts, Sci. Adv. 5 (2019). 10.1126/sciadv.aav6009 [114] Q. Han S. Cui N. Pu J. Chen K. Liu X. Wei A study on pulse plating amorphous Ni-Mo alloy coating used as HER cathode in alkaline medium Int. J. Hydrog. Energy 35 2010 5194 5201 10.1016/j.ijhydene.2010.03.093 Q. Han, S. Cui, N. Pu, J. Chen, K. Liu, X. Wei, A study on pulse plating amorphous Ni-Mo alloy coating used as HER cathode in alkaline medium, Int. J. Hydrog. Energy 35 (2010) 5194–5201. 10.1016/j.ijhydene.2010.03.093 [115] J.M. McEnaney J.C. Crompton J.F. Callejas E.J. Popczun C.G. Read N.S. Lewis R.E. Schaak Electrocatalytic hydrogen evolution using amorphous tungsten phosphide nanoparticles Chem. Commun. 50 2014 11026 11028 10.1039/c4cc04709e J.M. McEnaney, J.C. Crompton, J.F. Callejas, E.J. Popczun, C.G. Read, N.S. Lewis, R.E. Schaak, Electrocatalytic hydrogen evolution using amorphous tungsten phosphide nanoparticles, Chem. Commun. 50 (2014) 11026–11028. 10.1039/c4cc04709e [116] C.G. Morales-Guio X.L. Hu Amorphous molybdenum sulfides as hydrogen evolution catalysts Acc. Chem. Res. 47 2014 2671 2681 10.1021/ar5002022 C.G. Morales-Guio, X.L. Hu, Amorphous molybdenum sulfides as hydrogen evolution catalysts, Acc. Chem. Res. 47 (2014) 2671–2681. 10.1021/ar5002022 [117] X. Peng A.M. Qasim W. Jin L. Wang L. Hu Y. Miao W. Li Y. Li Z. Liu K. Huo K.y. Wong P.K. Chu Ni-doped amorphous iron phosphide nanoparticles on TiN nanowire arrays: an advanced alkaline hydrogen evolution electrocatalyst Nano Energy 53 2018 66 73 10.1016/j.nanoen.2018.08.028 X. Peng, A.M. Qasim, W. Jin, L. Wang, L. Hu, Y. Miao, W. Li, Y. Li, Z. Liu, K. Huo, K.y. Wong, P.K. Chu, Ni-doped amorphous iron phosphide nanoparticles on TiN nanowire arrays: an advanced alkaline hydrogen evolution electrocatalyst, Nano Energy 53 (2018) 66–73. 10.1016/j.nanoen.2018.08.028 [118] J. Chen J. Liu J.Q. Xie H. Ye X.Z. Fu R. Sun C.P. Wong Co-Fe-P nanotubes electrocatalysts derived from metal-organic frameworks for efficient hydrogen evolution reaction under wide pH range Nano Energy 56 2019 225 233 10.1016/j.nanoen.2018.11.051 J. Chen, J. Liu, J.Q. Xie, H. Ye, X.Z. Fu, R. Sun, C.P. Wong, Co-Fe-P nanotubes electrocatalysts derived from metal-organic frameworks for efficient hydrogen evolution reaction under wide pH range, Nano Energy 56 (2019) 225–233. 10.1016/j.nanoen.2018.11.051 [119] J. Li M. Yan X. Zhou Z.Q. Huang Z. Xia C.R. Chang Y. Ma Y. Qu Mechanistic insights on ternary Ni2-xCoxP for hydrogen evolution and their hybrids with graphene as highly efficient and robust catalysts for overall water splitting Adv. Funct. Mater. 26 2016 6785 6796 10.1002/adfm.201601420 J. Li, M. Yan, X. Zhou, Z.Q. Huang, Z. Xia, C.R. Chang, Y. Ma, Y. Qu, Mechanistic insights on ternary Ni2-xCoxP for hydrogen evolution and their hybrids with graphene as highly efficient and robust catalysts for overall water splitting, Adv. Funct. Mater. 26 (2016) 6785–6796. 10.1002/adfm.201601420 [120] Y. Rong Y. Ma F. Guo J. Qian H. Li M. Zhou Z. Xu Y.Q. Zheng T.T. Li Paintbrush-like Co doped Cu3P grown on Cu foam as an efficient Janus electrode for overall water splitting Int. J. Hydrog. Energy 44 2019 28833 28840 10.1016/j.ijhydene.2019.09.042 Y. Rong, Y. Ma, F. Guo, J. Qian, H. Li, M. Zhou, Z. Xu, Y.Q. Zheng, T.T. Li, Paintbrush-like Co doped Cu3P grown on Cu foam as an efficient Janus electrode for overall water splitting, Int. J. Hydrog. Energy 44 (2019) 28833–28840. 10.1016/j.ijhydene.2019.09.042 [121] G. Cho Y. Park H. Kang Y.k. Hong T. Lee D.H. Ha Transition metal-doped FeP nanoparticles for hydrogen evolution reaction catalysis Appl. Surf. Sci. 2020 510 10.1016/j.apsusc.2020.145427 G. Cho, Y. Park, H. Kang, Y.k. Hong, T. Lee, D.H. Ha, Transition metal-doped FeP nanoparticles for hydrogen evolution reaction catalysis, Appl. Surf. Sci. 510 (2020). 10.1016/j.apsusc.2020.145427 [122] V.N. Rai P. Rajput S.N. Jha D. Bhattacharyya B.N.R. Shekhar U.P. Deshpande T. Shripathi Effect of gamma irradiation on X-ray absorption andphotoelectron spectroscopy of Nd-doped phosphate glass J. Synchrot. Radiat. 23 2016 1424 1432 10.1107/s1600577516014399 V.N. Rai, P. Rajput, S.N. Jha, D. Bhattacharyya, B.N.R. Shekhar, U.P. Deshpande, T. Shripathi, Effect of gamma irradiation on X-ray absorption andphotoelectron spectroscopy of Nd-doped phosphate glass, J. Synchrot. Radiat. 23 (2016) 1424–1432. 10.1107/s1600577516014399 [123] Y. Han P. Li Z. Tian C. Zhang Y. Ye X. Zhu C. Liang Molybdenum-doped porous cobalt phosphide nanosheets for efficient alkaline hydrogen evolution ACS Appl. Energy Mater. 2 2019 6302 6310 10.1021/acsaem.9b00924 Y. Han, P. Li, Z. Tian, C. Zhang, Y. Ye, X. Zhu, C. Liang, Molybdenum-doped porous cobalt phosphide nanosheets for efficient alkaline hydrogen evolution, ACS Appl. Energy Mater. 2 (2019) 6302–6310. 10.1021/acsaem.9b00924 [124] R. Zhang C. Tang R. Kong G. Du A.M. Asiri L. Chen X. Sun Al-doped CoP nanoarray: a durable water-splitting electrocatalyst with superhigh activity Nanoscale 9 2017 4793 4800 10.1039/c7nr00740j R. Zhang, C. Tang, R. Kong, G. Du, A.M. Asiri, L. Chen, X. Sun, Al-doped CoP nanoarray: a durable water-splitting electrocatalyst with superhigh activity, Nanoscale 9 (2017) 4793–4800. 10.1039/c7nr00740j [125] J. Tian Q. Liu A.M. Asiri X. Sun Self-supported nanoporous cobalt phosphide nanowire arrays: an efficient 3D hydrogen-evolving cathode over the wide range of pH 0-14 J. Am. Chem. Soc. 136 2014 7587 7590 10.1021/ja503372r J. Tian, Q. Liu, A.M. Asiri, X. Sun, Self-supported nanoporous cobalt phosphide nanowire arrays: an efficient 3D hydrogen-evolving cathode over the wide range of pH 0-14, J. Am. Chem. Soc. 136 (2014) 7587–7590. 10.1021/ja503372r [126] Q. Liu J. Tian W. Cui P. Jiang N. Cheng A.M. Asiri X. Sun Carbon nanotubes decorated with CoP nanocrystals: a highly active non-noble-metal nanohybrid electrocatalyst for hydrogen evolution Angew. Chem. Int. Ed. 53 2014 6710 6714 10.1002/anie.201404161 Q. Liu, J. Tian, W. Cui, P. Jiang, N. Cheng, A.M. Asiri, X. Sun, Carbon nanotubes decorated with CoP nanocrystals: a highly active non-noble-metal nanohybrid electrocatalyst for hydrogen evolution, Angew. Chem. Int. Ed. 53 (2014) 6710–6714. 10.1002/anie.201404161 [127] X. Long G. Li Z. Wang H. Zhu T. Zhang S. Xiao W. Guo S. Yang Metallic Iron-nickel sulfide ultrathin nanosheets as a highly active electrocatalyst for hydrogen evolution reaction in acidic media J. Am. Chem. Soc. 137 2015 11900 11903 10.1021/jacs.5b07728 X. Long, G. Li, Z. Wang, H. Zhu, T. Zhang, S. Xiao, W. Guo, S. Yang, Metallic Iron-nickel sulfide ultrathin nanosheets as a highly active electrocatalyst for hydrogen evolution reaction in acidic media, J. Am. Chem. Soc. 137 (2015) 11900–11903. 10.1021/jacs.5b07728 [128] J.K. Norskov T. Bligaard A. Logadottir S. Bahn L.B. Hansen M. Bollinger H. Bengaard B. Hammer Z. Sljivancanin M. Mavrikakis Y. Xu S. Dahl C.J.H. Jacobsen Universality in heterogeneous catalysis J. Catal. 209 2002 275 278 10.1006/jcat.2002.3615 J.K. Norskov, T. Bligaard, A. Logadottir, S. Bahn, L.B. Hansen, M. Bollinger, H. Bengaard, B. Hammer, Z. Sljivancanin, M. Mavrikakis, Y. Xu, S. Dahl, C.J.H. Jacobsen, Universality in heterogeneous catalysis, J. Catal. 209 (2002) 275–278. 10.1006/jcat.2002.3615 [129] X. Dong X. Li H. Tan J. Zhu G. Wang S. Wang W. Xie T. Zhan V. Polshettiwar The d band center dependent catalytic activity of n-doped carbon nanospheres with wrinkled cages supported PdPt alloy catalysts in transfer hydrogenation of bicarbonate with glycerol Mol. Catal. 2023 547 10.1016/j.mcat.2023.113369 X. Dong, X. Li, H. Tan, J. Zhu, G. Wang, S. Wang, W. Xie, T. Zhan, V. Polshettiwar, The d band center dependent catalytic activity of n-doped carbon nanospheres with wrinkled cages supported PdPt alloy catalysts in transfer hydrogenation of bicarbonate with glycerol, Mol. Catal. 547 (2023). 10.1016/j.mcat.2023.113369 [130] D. Chen R. Lu Z. Pu J. Zhu H.W. Li F. Liu S. Hu X. Luo J. Wu Y. Zhao S. Mu Ru-doped 3D flower-like bimetallic phosphide with a climbing effect on overall water splitting Appl. Catal. B Environ. 2020 279 10.1016/j.apcatb.2020.119396 D. Chen, R. Lu, Z. Pu, J. Zhu, H.W. Li, F. Liu, S. Hu, X. Luo, J. Wu, Y. Zhao, S. Mu, Ru-doped 3D flower-like bimetallic phosphide with a climbing effect on overall water splitting, Appl. Catal. B Environ. 279 (2020). 10.1016/j.apcatb.2020.119396 [131] L. Xiong B. Wang H. Cai H. Hao J. Li T. Yang S. Yang Understanding the doping effect on hydrogen evolution activity of transition-metal phosphides: Modeled with Ni2P Appl. Catal. B Environ. 2021 295 10.1016/j.apcatb.2021.120283 L. Xiong, B. Wang, H. Cai, H. Hao, J. Li, T. Yang, S. Yang, Understanding the doping effect on hydrogen evolution activity of transition-metal phosphides: Modeled with Ni2P, Appl. Catal. B Environ. 295 (2021). 10.1016/j.apcatb.2021.120283 [132] J. Greeley T.F. Jaramillo J. Bonde I.B. Chorkendorff J.K. Norskov Computational high-throughput screening of electrocatalytic materials for hydrogen evolution Nat. Mater. 5 2006 909 913 10.1038/nmat1752 J. Greeley, T.F. Jaramillo, J. Bonde, I.B. Chorkendorff, J.K. Norskov, Computational high-throughput screening of electrocatalytic materials for hydrogen evolution, Nat. Mater. 5 (2006) 909–913. 10.1038/nmat1752",
      "scopus-id": "85183201968",
      "coredata": {
        "eid": "1-s2.0-S2468823124000154",
        "dc:description": "With the soaring price of traditional energy and environmental pollution, it is important to find reliable and environmentally friendly clean energy. Transition Metal Phosphides (TMPs) have been shown to perform well compared to other non-precious metal catalysts for hydrogen evolution reaction (HER) electrocatalysts. The modifications of transition metal phosphides can obtain better catalytic performance. Among that, metal doping has become a commonly used method for modifying transition metal phosphides, because it can control the amount of doping and the synthesis method is simple. Metal atom doping greatly changes the intrinsic properties of transition metal phosphides, such as adding Electrochemical Active Surface Area (ESCA), adjusting the electronic structure, etc. Transition metal phosphides can also improve catalytic activity by constructing composite materials such as NiCoP/rGO. Polymetallic doping can also improve the catalytic performance of TMPs, such as CoMo(Al)-P. Through the synergy between polymetals, the catalytic activity of the catalyst is greatly improved. Therefore, it can be developed in the direction of high-entropy alloys to produce catalysts with excellent performance. And TMPs also have good catalytic activity in seawater, such as Fe–Co2P BNRs. A series of modification methods such as metal doping will greatly tap the hydrogen evolution reaction potential of transition metal phosphides, and are expected to be applied in industry.",
        "openArchiveArticle": "false",
        "prism:coverDate": "2024-02-01",
        "openaccessUserLicense": null,
        "prism:aggregationType": "Journal",
        "prism:url": "https://api.elsevier.com/content/article/pii/S2468823124000154",
        "dc:creator": [
          {
            "@_fa": "true",
            "$": "Jing, Changdi"
          },
          {
            "@_fa": "true",
            "$": "Hong, Lumin"
          },
          {
            "@_fa": "true",
            "$": "Li, Bo"
          },
          {
            "@_fa": "true",
            "$": "Wang, Yao"
          },
          {
            "@_fa": "true",
            "$": "Zhang, Fengming"
          },
          {
            "@_fa": "true",
            "$": "bo Huang, Hua"
          },
          {
            "@_fa": "true",
            "$": "Jiang, Qianqian"
          },
          {
            "@_fa": "true",
            "$": "Tang, Jianguo"
          }
        ],
        "link": [
          {
            "@_fa": "true",
            "@rel": "self",
            "@href": "https://api.elsevier.com/content/article/pii/S2468823124000154"
          },
          {
            "@_fa": "true",
            "@rel": "scidir",
            "@href": "https://www.sciencedirect.com/science/article/pii/S2468823124000154"
          }
        ],
        "dc:format": "application/json",
        "openaccessType": null,
        "pii": "S2468-8231(24)00015-4",
        "prism:volume": "554",
        "articleNumber": "113832",
        "prism:publisher": "Elsevier B.V.",
        "dc:title": "A review with transition-metal phosphide electrocatalysts in hydrogen evolution reaction: Doping perspective",
        "prism:copyright": "© 2024 Elsevier B.V. All rights reserved.",
        "openaccess": "0",
        "prism:issn": "24688231",
        "dcterms:subject": [
          {
            "@_fa": "true",
            "$": "Modification"
          },
          {
            "@_fa": "true",
            "$": "Doping"
          },
          {
            "@_fa": "true",
            "$": "Metal atoms"
          },
          {
            "@_fa": "true",
            "$": "TMPs"
          },
          {
            "@_fa": "true",
            "$": "HER"
          }
        ],
        "openaccessArticle": "false",
        "prism:publicationName": "Molecular Catalysis",
        "openaccessSponsorType": null,
        "prism:pageRange": "113832",
        "pubType": "rev",
        "prism:coverDisplayDate": "1 February 2024",
        "prism:doi": "10.1016/j.mcat.2024.113832",
        "prism:startingPage": "113832",
        "dc:identifier": "doi:10.1016/j.mcat.2024.113832",
        "openaccessSponsorName": null
      },
      "objects": {
        "object": [
          {
            "@category": "standard",
            "@height": "373",
            "@width": "565",
            "@_fa": "true",
            "$": "https://api.elsevier.com/content/object/eid/1-s2.0-S2468823124000154-gr9.jpg?httpAccept=%2A%2F%2A",
            "@multimediatype": "JPEG image file",
            "@type": "IMAGE-DOWNSAMPLED",
            "@size": "57010",
            "@ref": "gr9",
            "@mimetype": "image/jpeg"
          },
          {
            "@category": "standard",
            "@height": "431",
            "@width": "565",
            "@_fa": "true",
            "$": "https://api.elsevier.com/content/object/eid/1-s2.0-S2468823124000154-gr8.jpg?httpAccept=%2A%2F%2A",
            "@multimediatype": "JPEG image file",
            "@type": "IMAGE-DOWNSAMPLED",
            "@size": "62946",
            "@ref": "gr8",
            "@mimetype": "image/jpeg"
          },
          {
            "@category": "standard",
            "@height": "423",
            "@width": "565",
            "@_fa": "true",
            "$": "https://api.elsevier.com/content/object/eid/1-s2.0-S2468823124000154-gr5.jpg?httpAccept=%2A%2F%2A",
            "@multimediatype": "JPEG image file",
            "@type": "IMAGE-DOWNSAMPLED",
            "@size": "76605",
            "@ref": "gr5",
            "@mimetype": "image/jpeg"
          },
          {
            "@category": "standard",
            "@height": "383",
            "@width": "565",
            "@_fa": "true",
            "$": "https://api.elsevier.com/content/object/eid/1-s2.0-S2468823124000154-gr10.jpg?httpAccept=%2A%2F%2A",
            "@multimediatype": "JPEG image file",
            "@type": "IMAGE-DOWNSAMPLED",
            "@size": "86587",
            "@ref": "gr10",
            "@mimetype": "image/jpeg"
          },
          {
            "@category": "standard",
            "@height": "214",
            "@width": "565",
            "@_fa": "true",
            "$": "https://api.elsevier.com/content/object/eid/1-s2.0-S2468823124000154-gr4.jpg?httpAccept=%2A%2F%2A",
            "@multimediatype": "JPEG image file",
            "@type": "IMAGE-DOWNSAMPLED",
            "@size": "34076",
            "@ref": "gr4",
            "@mimetype": "image/jpeg"
          },
          {
            "@category": "standard",
            "@height": "301",
            "@width": "565",
            "@_fa": "true",
            "$": "https://api.elsevier.com/content/object/eid/1-s2.0-S2468823124000154-gr7.jpg?httpAccept=%2A%2F%2A",
            "@multimediatype": "JPEG image file",
            "@type": "IMAGE-DOWNSAMPLED",
            "@size": "60898",
            "@ref": "gr7",
            "@mimetype": "image/jpeg"
          },
          {
            "@category": "standard",
            "@height": "361",
            "@width": "565",
            "@_fa": "true",
            "$": "https://api.elsevier.com/content/object/eid/1-s2.0-S2468823124000154-gr6.jpg?httpAccept=%2A%2F%2A",
            "@multimediatype": "JPEG image file",
            "@type": "IMAGE-DOWNSAMPLED",
            "@size": "68545",
            "@ref": "gr6",
            "@mimetype": "image/jpeg"
          },
          {
            "@category": "standard",
            "@height": "279",
            "@width": "565",
            "@_fa": "true",
            "$": "https://api.elsevier.com/content/object/eid/1-s2.0-S2468823124000154-gr1.jpg?httpAccept=%2A%2F%2A",
            "@multimediatype": "JPEG image file",
            "@type": "IMAGE-DOWNSAMPLED",
            "@size": "46890",
            "@ref": "gr1",
            "@mimetype": "image/jpeg"
          },
          {
            "@category": "standard",
            "@height": "421",
            "@width": "565",
            "@_fa": "true",
            "$": "https://api.elsevier.com/content/object/eid/1-s2.0-S2468823124000154-gr3.jpg?httpAccept=%2A%2F%2A",
            "@multimediatype": "JPEG image file",
            "@type": "IMAGE-DOWNSAMPLED",
            "@size": "87333",
            "@ref": "gr3",
            "@mimetype": "image/jpeg"
          },
          {
            "@category": "standard",
            "@height": "450",
            "@width": "565",
            "@_fa": "true",
            "$": "https://api.elsevier.com/content/object/eid/1-s2.0-S2468823124000154-gr2.jpg?httpAccept=%2A%2F%2A",
            "@multimediatype": "JPEG image file",
            "@type": "IMAGE-DOWNSAMPLED",
            "@size": "76029",
            "@ref": "gr2",
            "@mimetype": "image/jpeg"
          },
          {
            "@category": "standard",
            "@height": "200",
            "@width": "258",
            "@_fa": "true",
            "$": "https://api.elsevier.com/content/object/eid/1-s2.0-S2468823124000154-ga1.jpg?httpAccept=%2A%2F%2A",
            "@multimediatype": "JPEG image file",
            "@type": "IMAGE-DOWNSAMPLED",
            "@size": "32334",
            "@ref": "ga1",
            "@mimetype": "image/jpeg"
          },
          {
            "@category": "standard",
            "@height": "391",
            "@width": "386",
            "@_fa": "true",
            "$": "https://api.elsevier.com/content/object/eid/1-s2.0-S2468823124000154-sc1.jpg?httpAccept=%2A%2F%2A",
            "@multimediatype": "JPEG image file",
            "@type": "IMAGE-DOWNSAMPLED",
            "@size": "45296",
            "@ref": "sc1",
            "@mimetype": "image/jpeg"
          },
          {
            "@category": "thumbnail",
            "@height": "145",
            "@width": "219",
            "@_fa": "true",
            "$": "https://api.elsevier.com/content/object/eid/1-s2.0-S2468823124000154-gr9.sml?httpAccept=%2A%2F%2A",
            "@multimediatype": "GIF image file",
            "@type": "IMAGE-THUMBNAIL",
            "@size": "13826",
            "@ref": "gr9",
            "@mimetype": "image/gif"
          },
          {
            "@category": "thumbnail",
            "@height": "164",
            "@width": "215",
            "@_fa": "true",
            "$": "https://api.elsevier.com/content/object/eid/1-s2.0-S2468823124000154-gr8.sml?httpAccept=%2A%2F%2A",
            "@multimediatype": "GIF image file",
            "@type": "IMAGE-THUMBNAIL",
            "@size": "17077",
            "@ref": "gr8",
            "@mimetype": "image/gif"
          },
          {
            "@category": "thumbnail",
            "@height": "164",
            "@width": "219",
            "@_fa": "true",
            "$": "https://api.elsevier.com/content/object/eid/1-s2.0-S2468823124000154-gr5.sml?httpAccept=%2A%2F%2A",
            "@multimediatype": "GIF image file",
            "@type": "IMAGE-THUMBNAIL",
            "@size": "20132",
            "@ref": "gr5",
            "@mimetype": "image/gif"
          },
          {
            "@category": "thumbnail",
            "@height": "148",
            "@width": "219",
            "@_fa": "true",
            "$": "https://api.elsevier.com/content/object/eid/1-s2.0-S2468823124000154-gr10.sml?httpAccept=%2A%2F%2A",
            "@multimediatype": "GIF image file",
            "@type": "IMAGE-THUMBNAIL",
            "@size": "26123",
            "@ref": "gr10",
            "@mimetype": "image/gif"
          },
          {
            "@category": "thumbnail",
            "@height": "83",
            "@width": "219",
            "@_fa": "true",
            "$": "https://api.elsevier.com/content/object/eid/1-s2.0-S2468823124000154-gr4.sml?httpAccept=%2A%2F%2A",
            "@multimediatype": "GIF image file",
            "@type": "IMAGE-THUMBNAIL",
            "@size": "11929",
            "@ref": "gr4",
            "@mimetype": "image/gif"
          },
          {
            "@category": "thumbnail",
            "@height": "117",
            "@width": "219",
            "@_fa": "true",
            "$": "https://api.elsevier.com/content/object/eid/1-s2.0-S2468823124000154-gr7.sml?httpAccept=%2A%2F%2A",
            "@multimediatype": "GIF image file",
            "@type": "IMAGE-THUMBNAIL",
            "@size": "14808",
            "@ref": "gr7",
            "@mimetype": "image/gif"
          },
          {
            "@category": "thumbnail",
            "@height": "140",
            "@width": "219",
            "@_fa": "true",
            "$": "https://api.elsevier.com/content/object/eid/1-s2.0-S2468823124000154-gr6.sml?httpAccept=%2A%2F%2A",
            "@multimediatype": "GIF image file",
            "@type": "IMAGE-THUMBNAIL",
            "@size": "16531",
            "@ref": "gr6",
            "@mimetype": "image/gif"
          },
          {
            "@category": "thumbnail",
            "@height": "108",
            "@width": "219",
            "@_fa": "true",
            "$": "https://api.elsevier.com/content/object/eid/1-s2.0-S2468823124000154-gr1.sml?httpAccept=%2A%2F%2A",
            "@multimediatype": "GIF image file",
            "@type": "IMAGE-THUMBNAIL",
            "@size": "14164",
            "@ref": "gr1",
            "@mimetype": "image/gif"
          },
          {
            "@category": "thumbnail",
            "@height": "163",
            "@width": "219",
            "@_fa": "true",
            "$": "https://api.elsevier.com/content/object/eid/1-s2.0-S2468823124000154-gr3.sml?httpAccept=%2A%2F%2A",
            "@multimediatype": "GIF image file",
            "@type": "IMAGE-THUMBNAIL",
            "@size": "23625",
            "@ref": "gr3",
            "@mimetype": "image/gif"
          },
          {
            "@category": "thumbnail",
            "@height": "164",
            "@width": "206",
            "@_fa": "true",
            "$": "https://api.elsevier.com/content/object/eid/1-s2.0-S2468823124000154-gr2.sml?httpAccept=%2A%2F%2A",
            "@multimediatype": "GIF image file",
            "@type": "IMAGE-THUMBNAIL",
            "@size": "17931",
            "@ref": "gr2",
            "@mimetype": "image/gif"
          },
          {
            "@category": "thumbnail",
            "@height": "164",
            "@width": "211",
            "@_fa": "true",
            "$": "https://api.elsevier.com/content/object/eid/1-s2.0-S2468823124000154-ga1.sml?httpAccept=%2A%2F%2A",
            "@multimediatype": "GIF image file",
            "@type": "IMAGE-THUMBNAIL",
            "@size": "24240",
            "@ref": "ga1",
            "@mimetype": "image/gif"
          },
          {
            "@category": "thumbnail",
            "@height": "164",
            "@width": "162",
            "@_fa": "true",
            "$": "https://api.elsevier.com/content/object/eid/1-s2.0-S2468823124000154-sc1.sml?httpAccept=%2A%2F%2A",
            "@multimediatype": "GIF image file",
            "@type": "IMAGE-THUMBNAIL",
            "@size": "11877",
            "@ref": "sc1",
            "@mimetype": "image/gif"
          },
          {
            "@category": "high",
            "@height": "1651",
            "@width": "2500",
            "@_fa": "true",
            "$": "https://api.elsevier.com/content/object/eid/1-s2.0-S2468823124000154-gr9_lrg.jpg?httpAccept=%2A%2F%2A",
            "@multimediatype": "JPEG image file",
            "@type": "IMAGE-HIGH-RES",
            "@size": "393208",
            "@ref": "gr9",
            "@mimetype": "image/jpeg"
          },
          {
            "@category": "high",
            "@height": "1909",
            "@width": "2500",
            "@_fa": "true",
            "$": "https://api.elsevier.com/content/object/eid/1-s2.0-S2468823124000154-gr8_lrg.jpg?httpAccept=%2A%2F%2A",
            "@multimediatype": "JPEG image file",
            "@type": "IMAGE-HIGH-RES",
            "@size": "487598",
            "@ref": "gr8",
            "@mimetype": "image/jpeg"
          },
          {
            "@category": "high",
            "@height": "1871",
            "@width": "2500",
            "@_fa": "true",
            "$": "https://api.elsevier.com/content/object/eid/1-s2.0-S2468823124000154-gr5_lrg.jpg?httpAccept=%2A%2F%2A",
            "@multimediatype": "JPEG image file",
            "@type": "IMAGE-HIGH-RES",
            "@size": "589719",
            "@ref": "gr5",
            "@mimetype": "image/jpeg"
          },
          {
            "@category": "high",
            "@height": "1694",
            "@width": "2500",
            "@_fa": "true",
            "$": "https://api.elsevier.com/content/object/eid/1-s2.0-S2468823124000154-gr10_lrg.jpg?httpAccept=%2A%2F%2A",
            "@multimediatype": "JPEG image file",
            "@type": "IMAGE-HIGH-RES",
            "@size": "726324",
            "@ref": "gr10",
            "@mimetype": "image/jpeg"
          },
          {
            "@category": "high",
            "@height": "946",
            "@width": "2500",
            "@_fa": "true",
            "$": "https://api.elsevier.com/content/object/eid/1-s2.0-S2468823124000154-gr4_lrg.jpg?httpAccept=%2A%2F%2A",
            "@multimediatype": "JPEG image file",
            "@type": "IMAGE-HIGH-RES",
            "@size": "245293",
            "@ref": "gr4",
            "@mimetype": "image/jpeg"
          },
          {
            "@category": "high",
            "@height": "1330",
            "@width": "2500",
            "@_fa": "true",
            "$": "https://api.elsevier.com/content/object/eid/1-s2.0-S2468823124000154-gr7_lrg.jpg?httpAccept=%2A%2F%2A",
            "@multimediatype": "JPEG image file",
            "@type": "IMAGE-HIGH-RES",
            "@size": "472639",
            "@ref": "gr7",
            "@mimetype": "image/jpeg"
          },
          {
            "@category": "high",
            "@height": "1599",
            "@width": "2500",
            "@_fa": "true",
            "$": "https://api.elsevier.com/content/object/eid/1-s2.0-S2468823124000154-gr6_lrg.jpg?httpAccept=%2A%2F%2A",
            "@multimediatype": "JPEG image file",
            "@type": "IMAGE-HIGH-RES",
            "@size": "494169",
            "@ref": "gr6",
            "@mimetype": "image/jpeg"
          },
          {
            "@category": "high",
            "@height": "1234",
            "@width": "2500",
            "@_fa": "true",
            "$": "https://api.elsevier.com/content/object/eid/1-s2.0-S2468823124000154-gr1_lrg.jpg?httpAccept=%2A%2F%2A",
            "@multimediatype": "JPEG image file",
            "@type": "IMAGE-HIGH-RES",
            "@size": "350631",
            "@ref": "gr1",
            "@mimetype": "image/jpeg"
          },
          {
            "@category": "high",
            "@height": "1863",
            "@width": "2500",
            "@_fa": "true",
            "$": "https://api.elsevier.com/content/object/eid/1-s2.0-S2468823124000154-gr3_lrg.jpg?httpAccept=%2A%2F%2A",
            "@multimediatype": "JPEG image file",
            "@type": "IMAGE-HIGH-RES",
            "@size": "802705",
            "@ref": "gr3",
            "@mimetype": "image/jpeg"
          },
          {
            "@category": "high",
            "@height": "1989",
            "@width": "2500",
            "@_fa": "true",
            "$": "https://api.elsevier.com/content/object/eid/1-s2.0-S2468823124000154-gr2_lrg.jpg?httpAccept=%2A%2F%2A",
            "@multimediatype": "JPEG image file",
            "@type": "IMAGE-HIGH-RES",
            "@size": "576601",
            "@ref": "gr2",
            "@mimetype": "image/jpeg"
          },
          {
            "@category": "high",
            "@height": "886",
            "@width": "1142",
            "@_fa": "true",
            "$": "https://api.elsevier.com/content/object/eid/1-s2.0-S2468823124000154-ga1_lrg.jpg?httpAccept=%2A%2F%2A",
            "@multimediatype": "JPEG image file",
            "@type": "IMAGE-HIGH-RES",
            "@size": "261874",
            "@ref": "ga1",
            "@mimetype": "image/jpeg"
          },
          {
            "@category": "high",
            "@height": "1729",
            "@width": "1708",
            "@_fa": "true",
            "$": "https://api.elsevier.com/content/object/eid/1-s2.0-S2468823124000154-sc1_lrg.jpg?httpAccept=%2A%2F%2A",
            "@multimediatype": "JPEG image file",
            "@type": "IMAGE-HIGH-RES",
            "@size": "360436",
            "@ref": "sc1",
            "@mimetype": "image/jpeg"
          },
          {
            "@category": "standard",
            "@_fa": "true",
            "$": "https://api.elsevier.com/content/object/eid/1-s2.0-S2468823124000154-am.pdf?httpAccept=%2A%2F%2A",
            "@multimediatype": "Acrobat PDF file",
            "@type": "AAM-PDF",
            "@size": "2305176",
            "@ref": "am",
            "@mimetype": "application/pdf"
          }
        ]
      },
      "link": {
        "@rel": "abstract",
        "@href": "https://api.elsevier.com/content/abstract/scopus_id/85183201968"
      }
    }
  }
}