{
  "metadata": {
    "title": "Hydrogen-free deoxygenation of industrial vegetable oil waste using Ce, Zr-NiAl catalysts for second-generation biofuels production",
    "authors": "; ; ",
    "journal": "Molecular Catalysis",
    "date": "2022-08-31",
    "doi": "10.1016/j.mcat.2022.112554",
    "abstract": "",
    "uri": "https://api.elsevier.com/content/article/pii/S2468823122004400",
    "pii": "S2468823122004400"
  },
  "fulltext": {
    "full-text-retrieval-response": {
      "scopus-eid": "2-s2.0-85135157503",
      "originalText": "serial JL 315758 291210 291744 291790 291809 31 Molecular Catalysis MOLECULARCATALYSIS 2022-07-30 2022-07-30 2022-07-30 2022-07-30 2023-04-07T15:56:21 1-s2.0-S2468823122004400 S2468-8231(22)00440-0 S2468823122004400 10.1016/j.mcat.2022.112554 S300 S300.1 FULL-TEXT 1-s2.0-S2468823122X00126 2024-06-26T17:47:42.395391Z 0 0 20220801 20220831 2022 2022-07-30T11:03:19.901193Z absattachment articleinfo articlenumber articletitlenorm authfirstinitialnorm authfirstsurnamenorm cid cids contenttype copyright crossmark dateloaded dateloadedtxt datesearch datesort dateupdated dco docsubtype doctype doi eid ewtransactionid hubeid indexeddate issn issnnorm itemstage itemtransactionid itemweight openaccess openarchive pg pgfirst pii piinorm pubdateend pubdatestart pubdatetxt pubyr sectiontitle sortorder srctitle srctitlenorm srctype ssids alllist content subj subheadings suppl tomb volfirst volissue volumelist webpdf webpdfpagecount yearnav figure table e-component body mmlmath acknowledge affil appendices articletitle auth authfirstini authfull authkeywords authlast grantnumber grantsponsor grantsponsorid highlightsabst orcid otherkwds primabst ref specialabst 2468-8231 24688231 true 529 529 C Volume 529 20 112554 112554 112554 202208 August 2022 2022-08-01 2022-08-31 2022 Regular Papers article fla © 2022 Elsevier B.V. All rights reserved. HYDROGENFREEDEOXYGENATIONINDUSTRIALVEGETABLEOILWASTEUSINGCEZRNIALCATALYSTSFORSECONDGENERATIONBIOFUELSPRODUCTION ARIAS S 1 Introduction 2 Experimental 2.1 Preparation of materials 2.2 Pyrolysis experiments 2.3 Characterization of materials and oily feedstock 2.4 Principal component analysis (PCA) 3 Results 3.1 Precursors and catalysts characterization 3.2 Thermal and thermo-catalytic pyrolysis of oily waste 4 Conclusions CRediT authorship contribution statement Acknowledgments Appendix Supplementary materials References ZHANG 2021 111438 M KOIZUMI 2015 829 841 T SOUZA 2019 707 722 T MALINS 2021 125306 K DEOLIVEIRA 2017 56 64 A DEALMEIDA 2021 124477 R FARIAS 2020 5788 5799 A MOONSRIKAEW 2021 111712 W DONASCIMENTO 2021 L CHANSIRIWAT 2022 133516 W WANG 2021 119170 Y ALMEIDA 2016 126 143 H DAI 2017 356 362 L KHODADADI 2020 111128 M ALMEIDA 2017 337 354 H WANG 2020 112860 Y FERREIRA 2020 105707 M DACOSTA 2022 112052 A MAYER 2018 87 95 F BRUCE 2017 280 288 E SANTOS 2020 234 239 M FRETY 2014 2433 2443 R SANTOS 2015 1875 1885 M ARIAS 2018 137 145 S ARIAS 2021 181 S HONGLOI 2021 111696 N MASUDA 2001 897 904 T PANG 2020 134 143 Y AMAYA 2020 271 283 J FU 2021 118258 L STROUD 2018 125 135 T 1989 CA5A40OFFICIALMETHODSRECOMMENDEDPRACTICESAOCS ALMEIDACOUTO 2022 105432 J NIU 2022 114979 Q NI 2021 121527 Z CAVANI 1991 173 301 F NEWMAN 1998 6710 6719 S SHEN 2011 179 183 Y AGUILERA 2019 29 37 L JITIANU 2000 75 86 M COELHO 2015 87 94 T THOMMES 2015 M DAZA 2008 357 366 C LI 2012 2940 2949 S BANERJEE 2019 109218 S ARSLAN 2019 355 370 F MAHER 2008 5328 5336 M KUBATOVA 2012 672 685 A GUISNET 2001 83 96 M PADILHA 2022 185 194 J PATIL 2017 11918 11925 S JEON 2019 116179 K PHUNG 2015 119 124 T ARIASX2022X112554 ARIASX2022X112554XS 2024-07-30T00:00:00.000Z 2024-07-30T00:00:00.000Z http://creativecommons.org/licenses/by-nc-nd/4.0/ © 2022 Elsevier B.V. All rights reserved. 2022-08-04T04:24:55.227Z http://vtw.elsevier.com/data/voc/AddOnTypes/50.7/aggregated-refined National Council for Scientific and Technological Development 430921/2016-0 CNPq Conselho Nacional de Desenvolvimento Científico e Tecnológico http://data.elsevier.com/vocabulary/SciValFunders/501100003593 http://sws.geonames.org/3469034/ 0050.0078506.12.9 Petrobras http://data.elsevier.com/vocabulary/SciValFunders/501100004225 http://sws.geonames.org/3469034 INCT-EMA 573667/2008-0 610032/2009-7 FACEPE BCT-0378-3.06/17 IBPG-0395-3.06/19 FACEPE Fundação de Amparo à Ciência e Tecnologia do Estado de Pernambuco http://data.elsevier.com/vocabulary/SciValFunders/501100006162 http://sws.geonames.org/3469034/ PNPD 88882.306335/2018-01 CAPES CAPES Coordenação de Aperfeiçoamento de Pessoal de Nível Superior http://data.elsevier.com/vocabulary/SciValFunders/501100002322 http://sws.geonames.org/3469034/ Universal Universal http://data.elsevier.com/vocabulary/SciValFunders/100016549 http://sws.geonames.org/6252001/ We gratefully acknowledge financial support from CAPES /PNPD ( 88882.306335/2018-01 ), FACEPE ( BCT-0378-3.06/17 ) ( IBPG-0395-3.06/19 ), FINEP-ANP-PRH30.1, RECAT, National Council for Scientific and Technological Development, CNPq/Universal project 430921/2016-0, CNPq/INCT-EMA project 573667/2008-0, 610032/2009-7, PETROBRAS-ANP-LITPEG contract 0050.0078506.12.9. https://doi.org/10.15223/policy-017 https://doi.org/10.15223/policy-037 https://doi.org/10.15223/policy-012 https://doi.org/10.15223/policy-029 https://doi.org/10.15223/policy-004 item S2468-8231(22)00440-0 S2468823122004400 1-s2.0-S2468823122004400 10.1016/j.mcat.2022.112554 315758 2023-04-07T15:11:53.207972Z 2022-08-01 2022-08-31 1-s2.0-S2468823122004400-main.pdf https://s3-eu-west-1.amazonaws.com/prod-ucs-content-store-eu-west/content/pii:S2468823122004400/MAIN/application/pdf/77c0258252e844bdef596b8ba6be6f82/main.pdf main.pdf pdf true 3024609 MAIN 10 1-s2.0-S2468823122004400-main_1.png https://s3-eu-west-1.amazonaws.com/prod-ucs-content-store-eu-west/content/pii:S2468823122004400/PREVIEW/image/png/d2bc0fb7a76cbbee24c92806f772664a/main_1.png main_1.png png 57338 849 656 IMAGE-WEB-PDF 1 1-s2.0-S2468823122004400-gr9.jpg https://s3-eu-west-1.amazonaws.com/prod-ucs-content-store-eu-west/content/pii:S2468823122004400/gr9/DOWNSAMPLED/image/jpeg/843e14dd44a0a211b202693a5a7f2f5c/gr9.jpg gr9 gr9.jpg jpg 28241 299 391 IMAGE-DOWNSAMPLED 1-s2.0-S2468823122004400-gr8.jpg https://s3-eu-west-1.amazonaws.com/prod-ucs-content-store-eu-west/content/pii:S2468823122004400/gr8/DOWNSAMPLED/image/jpeg/a8475ef358e7e5945add3c6399f7e56f/gr8.jpg gr8 gr8.jpg jpg 28379 291 391 IMAGE-DOWNSAMPLED 1-s2.0-S2468823122004400-gr7.jpg https://s3-eu-west-1.amazonaws.com/prod-ucs-content-store-eu-west/content/pii:S2468823122004400/gr7/DOWNSAMPLED/image/jpeg/e000cb62fd0023d90077a76326059bc7/gr7.jpg gr7 gr7.jpg jpg 28373 290 391 IMAGE-DOWNSAMPLED 1-s2.0-S2468823122004400-gr6.jpg https://s3-eu-west-1.amazonaws.com/prod-ucs-content-store-eu-west/content/pii:S2468823122004400/gr6/DOWNSAMPLED/image/jpeg/94c6446443bb5c9ddd69f13255136f88/gr6.jpg gr6 gr6.jpg jpg 41737 307 391 IMAGE-DOWNSAMPLED 1-s2.0-S2468823122004400-gr10.jpg https://s3-eu-west-1.amazonaws.com/prod-ucs-content-store-eu-west/content/pii:S2468823122004400/gr10/DOWNSAMPLED/image/jpeg/5e10f78711d7aa9691ed3347dcef668f/gr10.jpg gr10 gr10.jpg jpg 27167 293 391 IMAGE-DOWNSAMPLED 1-s2.0-S2468823122004400-gr1.jpg https://s3-eu-west-1.amazonaws.com/prod-ucs-content-store-eu-west/content/pii:S2468823122004400/gr1/DOWNSAMPLED/image/jpeg/0df84e02c4e9e004cae051e83f99ec54/gr1.jpg gr1 gr1.jpg jpg 36071 325 391 IMAGE-DOWNSAMPLED 1-s2.0-S2468823122004400-gr5.jpg https://s3-eu-west-1.amazonaws.com/prod-ucs-content-store-eu-west/content/pii:S2468823122004400/gr5/DOWNSAMPLED/image/jpeg/8a8aa0623c517f7366787b79ae738630/gr5.jpg gr5 gr5.jpg jpg 37592 310 391 IMAGE-DOWNSAMPLED 1-s2.0-S2468823122004400-gr4.jpg https://s3-eu-west-1.amazonaws.com/prod-ucs-content-store-eu-west/content/pii:S2468823122004400/gr4/DOWNSAMPLED/image/jpeg/31d5a7499b820b7fc47214d21b5f18e7/gr4.jpg gr4 gr4.jpg jpg 72948 342 489 IMAGE-DOWNSAMPLED 1-s2.0-S2468823122004400-gr3.jpg https://s3-eu-west-1.amazonaws.com/prod-ucs-content-store-eu-west/content/pii:S2468823122004400/gr3/DOWNSAMPLED/image/jpeg/bf76ff10ccac301723f46af5d1fb4ca4/gr3.jpg gr3 gr3.jpg jpg 53600 298 602 IMAGE-DOWNSAMPLED 1-s2.0-S2468823122004400-gr2.jpg https://s3-eu-west-1.amazonaws.com/prod-ucs-content-store-eu-west/content/pii:S2468823122004400/gr2/DOWNSAMPLED/image/jpeg/c0c3eaef6024d61fbc2d7d6121d6dc0e/gr2.jpg gr2 gr2.jpg jpg 36558 315 391 IMAGE-DOWNSAMPLED 1-s2.0-S2468823122004400-ga1.jpg https://s3-eu-west-1.amazonaws.com/prod-ucs-content-store-eu-west/content/pii:S2468823122004400/ga1/DOWNSAMPLED/image/jpeg/2a600a213e000ecd6eb23c28a5ce9059/ga1.jpg ga1 true ga1.jpg jpg 15580 115 301 IMAGE-DOWNSAMPLED 1-s2.0-S2468823122004400-gr9.sml https://s3-eu-west-1.amazonaws.com/prod-ucs-content-store-eu-west/content/pii:S2468823122004400/gr9/THUMBNAIL/image/gif/8e4c9ac5a91e67f719bf3c3cd4d16064/gr9.sml gr9 gr9.sml sml 9985 163 214 IMAGE-THUMBNAIL 1-s2.0-S2468823122004400-gr8.sml https://s3-eu-west-1.amazonaws.com/prod-ucs-content-store-eu-west/content/pii:S2468823122004400/gr8/THUMBNAIL/image/gif/d4d5178169af81ecc1273b262d74fa56/gr8.sml gr8 gr8.sml sml 10185 163 219 IMAGE-THUMBNAIL 1-s2.0-S2468823122004400-gr7.sml https://s3-eu-west-1.amazonaws.com/prod-ucs-content-store-eu-west/content/pii:S2468823122004400/gr7/THUMBNAIL/image/gif/ff4996795e91616716bd916f651bb9d0/gr7.sml gr7 gr7.sml sml 9861 162 219 IMAGE-THUMBNAIL 1-s2.0-S2468823122004400-gr6.sml https://s3-eu-west-1.amazonaws.com/prod-ucs-content-store-eu-west/content/pii:S2468823122004400/gr6/THUMBNAIL/image/gif/0a3ed5e092220ce21cc823e25700863c/gr6.sml gr6 gr6.sml sml 10370 164 209 IMAGE-THUMBNAIL 1-s2.0-S2468823122004400-gr10.sml https://s3-eu-west-1.amazonaws.com/prod-ucs-content-store-eu-west/content/pii:S2468823122004400/gr10/THUMBNAIL/image/gif/da3685482c70025d498f0b2325349007/gr10.sml gr10 gr10.sml sml 9736 164 219 IMAGE-THUMBNAIL 1-s2.0-S2468823122004400-gr1.sml https://s3-eu-west-1.amazonaws.com/prod-ucs-content-store-eu-west/content/pii:S2468823122004400/gr1/THUMBNAIL/image/gif/41482a43b5d83ba875b2a4128295aa45/gr1.sml gr1 gr1.sml sml 9904 164 197 IMAGE-THUMBNAIL 1-s2.0-S2468823122004400-gr5.sml https://s3-eu-west-1.amazonaws.com/prod-ucs-content-store-eu-west/content/pii:S2468823122004400/gr5/THUMBNAIL/image/gif/137e3a099bf175ba01a5179b985e8256/gr5.sml gr5 gr5.sml sml 9323 164 207 IMAGE-THUMBNAIL 1-s2.0-S2468823122004400-gr4.sml https://s3-eu-west-1.amazonaws.com/prod-ucs-content-store-eu-west/content/pii:S2468823122004400/gr4/THUMBNAIL/image/gif/4d43a41babc9cdb9bbdbfeaa320bea31/gr4.sml gr4 gr4.sml sml 17546 153 219 IMAGE-THUMBNAIL 1-s2.0-S2468823122004400-gr3.sml https://s3-eu-west-1.amazonaws.com/prod-ucs-content-store-eu-west/content/pii:S2468823122004400/gr3/THUMBNAIL/image/gif/5b191b7eabf73000cb6858f815288fe3/gr3.sml gr3 gr3.sml sml 9263 108 219 IMAGE-THUMBNAIL 1-s2.0-S2468823122004400-gr2.sml https://s3-eu-west-1.amazonaws.com/prod-ucs-content-store-eu-west/content/pii:S2468823122004400/gr2/THUMBNAIL/image/gif/5de611e3b46aa72a9f675b1776547b48/gr2.sml gr2 gr2.sml sml 9560 164 203 IMAGE-THUMBNAIL 1-s2.0-S2468823122004400-ga1.sml https://s3-eu-west-1.amazonaws.com/prod-ucs-content-store-eu-west/content/pii:S2468823122004400/ga1/THUMBNAIL/image/gif/be43f6dc24f8a0dd668ff41a8cad1d4d/ga1.sml ga1 true ga1.sml sml 8801 84 219 IMAGE-THUMBNAIL 1-s2.0-S2468823122004400-gr9_lrg.jpg https://s3-eu-west-1.amazonaws.com/prod-ucs-content-store-eu-west/content/pii:S2468823122004400/gr9/HIGHRES/image/jpeg/1835fcb71f71120566bf27ee63e44bd1/gr9_lrg.jpg gr9 gr9_lrg.jpg jpg 221356 1324 1733 IMAGE-HIGH-RES 1-s2.0-S2468823122004400-gr8_lrg.jpg https://s3-eu-west-1.amazonaws.com/prod-ucs-content-store-eu-west/content/pii:S2468823122004400/gr8/HIGHRES/image/jpeg/debe955e8b6b596f6e5268b54d17a23d/gr8_lrg.jpg gr8 gr8_lrg.jpg jpg 215794 1289 1733 IMAGE-HIGH-RES 1-s2.0-S2468823122004400-gr7_lrg.jpg https://s3-eu-west-1.amazonaws.com/prod-ucs-content-store-eu-west/content/pii:S2468823122004400/gr7/HIGHRES/image/jpeg/78592c2da012a5a896727b1c472ef9de/gr7_lrg.jpg gr7 gr7_lrg.jpg jpg 209098 1284 1733 IMAGE-HIGH-RES 1-s2.0-S2468823122004400-gr6_lrg.jpg https://s3-eu-west-1.amazonaws.com/prod-ucs-content-store-eu-west/content/pii:S2468823122004400/gr6/HIGHRES/image/jpeg/5047f7b820e21586eba2bb322c3b082a/gr6_lrg.jpg gr6 gr6_lrg.jpg jpg 360358 1360 1733 IMAGE-HIGH-RES 1-s2.0-S2468823122004400-gr10_lrg.jpg https://s3-eu-west-1.amazonaws.com/prod-ucs-content-store-eu-west/content/pii:S2468823122004400/gr10/HIGHRES/image/jpeg/9edfcf62ca1aaa393389b8e8b12c4b59/gr10_lrg.jpg gr10 gr10_lrg.jpg jpg 216075 1299 1733 IMAGE-HIGH-RES 1-s2.0-S2468823122004400-gr1_lrg.jpg https://s3-eu-west-1.amazonaws.com/prod-ucs-content-store-eu-west/content/pii:S2468823122004400/gr1/HIGHRES/image/jpeg/9bd53f9f92e80fec30e110bb40cf64ce/gr1_lrg.jpg gr1 gr1_lrg.jpg jpg 296412 1440 1733 IMAGE-HIGH-RES 1-s2.0-S2468823122004400-gr5_lrg.jpg https://s3-eu-west-1.amazonaws.com/prod-ucs-content-store-eu-west/content/pii:S2468823122004400/gr5/HIGHRES/image/jpeg/c964711872f463be125867357766cbf7/gr5_lrg.jpg gr5 gr5_lrg.jpg jpg 309560 1373 1733 IMAGE-HIGH-RES 1-s2.0-S2468823122004400-gr4_lrg.jpg https://s3-eu-west-1.amazonaws.com/prod-ucs-content-store-eu-west/content/pii:S2468823122004400/gr4/HIGHRES/image/jpeg/7e79ac0c9d875cb4d4f8132751787ed0/gr4_lrg.jpg gr4 gr4_lrg.jpg jpg 1080472 1516 2167 IMAGE-HIGH-RES 1-s2.0-S2468823122004400-gr3_lrg.jpg https://s3-eu-west-1.amazonaws.com/prod-ucs-content-store-eu-west/content/pii:S2468823122004400/gr3/HIGHRES/image/jpeg/89ee9a6cc7b37a1153c915d44ad82c7a/gr3_lrg.jpg gr3 gr3_lrg.jpg jpg 411027 1319 2667 IMAGE-HIGH-RES 1-s2.0-S2468823122004400-gr2_lrg.jpg https://s3-eu-west-1.amazonaws.com/prod-ucs-content-store-eu-west/content/pii:S2468823122004400/gr2/HIGHRES/image/jpeg/3b0630e16b26b8710c1040e64075bf32/gr2_lrg.jpg gr2 gr2_lrg.jpg jpg 320575 1396 1733 IMAGE-HIGH-RES 1-s2.0-S2468823122004400-ga1_lrg.jpg https://s3-eu-west-1.amazonaws.com/prod-ucs-content-store-eu-west/content/pii:S2468823122004400/ga1/HIGHRES/image/jpeg/e5ac5bedd2af6735a3481d7b6df4c3a1/ga1_lrg.jpg ga1 true ga1_lrg.jpg jpg 95681 511 1333 IMAGE-HIGH-RES 1-s2.0-S2468823122004400-mmc1.docx https://s3-eu-west-1.amazonaws.com/prod-ucs-content-store-eu-west/content/pii:S2468823122004400/mmc1/MAIN/application/vnd.openxmlformats-officedocument.wordprocessingml.document/829ded88686e7f634e2ab8d350084464/mmc1.docx mmc1 mmc1.docx docx 449860 APPLICATION 1-s2.0-S2468823122004400-si1.svg https://s3-eu-west-1.amazonaws.com/prod-ucs-content-store-eu-west/content/pii:S2468823122004400/STRIPIN/image/svg+xml/7a691a0ee1a3bfeff2fb88a29857225e/si1.svg si1 si1.svg svg 10121 ALTIMG 1-s2.0-S2468823122004400-si2.svg https://s3-eu-west-1.amazonaws.com/prod-ucs-content-store-eu-west/content/pii:S2468823122004400/STRIPIN/image/svg+xml/9ce96145627eaaa98be35f6a096af87c/si2.svg si2 si2.svg svg 13238 ALTIMG 1-s2.0-S2468823122004400-si3.svg https://s3-eu-west-1.amazonaws.com/prod-ucs-content-store-eu-west/content/pii:S2468823122004400/STRIPIN/image/svg+xml/055c6d00e3363b95c89970a9b58be57f/si3.svg si3 si3.svg svg 9474 ALTIMG 1-s2.0-S2468823122004400-am.pdf https://s3-eu-west-1.amazonaws.com/prod-ucs-content-store-eu-west/content/egi:10CD35Q71L2/MAIN/application/pdf/1bc0f945c0d3d7dec12108ee3702ef3c/am.pdf am am.pdf pdf false 2343292 AAM-PDF MCAT 112554 112554 S2468-8231(22)00440-0 10.1016/j.mcat.2022.112554 Elsevier B.V. Fig. 1 XRD patterns of LDH precursor materials. Fig. 1 Fig. 2 X-ray diffraction patterns of the mixed oxide catalysts. Fig. 2 Fig. 3 N2 sorption isotherms and pore size distribution of mixed oxide catalysts. Fig. 3 Fig. 4 TIC Chromatogram of the fast pyrolysis of oily waste (OW) pure or adsorbed on mixed oxide catalysts at 600 °C. Fig. 4 Fig. 5 Biplot graph (scores + loadings) of the principal component analysis of the pyrolysis of oily waste, correlating product families and catalyst types NiAl, NiAlCe or NiAlZr mixed oxides. Fig. 5 Fig. 6 Biplot graph (scores + loadings) of the principal component analysis of the pyrolysis of oily waste (OW), correlating the main products obtained and catalyst types NiAl, NiAlCe or NiAlZr mixed oxides. Fig. 6 Fig. 7 Product family yields (area) from the fast pyrolysis of oily waste (OW) pure or adsorbed on mixed oxide catalysts at 600 °C. Fig. 7 Fig. 8 Hydrocarbon family yields (area) from the fast pyrolysis of oily waste (OW) pure or adsorbed on mixed oxide catalysts at 600 °C. Fig. 8 Fig. 9 Carbon chain length distribution in the produced hydrocarbons from the fast pyrolysis of oily waste (OW) pure or adsorbed on mixed oxide catalysts at 600 °C. Fig. 9 Fig. 10 Oxygenated compound yields from the fast pyrolysis of oily waste (OW) pure or adsorbed on mixed oxide catalysts at 600 °C. Fig. 10 Table 1 Metal composition (wt. %), main interplanar distances, and full width at half maximum (°2θ) (FWHM) for the (003) reflection of LDH precursors. Table 1 Material Ni (%) Al (%) Ce (%) Zr (%) x a d(003) (Å) d(110) (Å) FWHM (°2θ) (003) b NiAl-LDH 70.4 29.6 - - 0.47 13.75 1.469 1.014 NiAlCe-LDH 32.8 10.1 57.1 - 0.58 13.88 1.495 2.070 NiAlZr-LDH 37.3 7.6 - 55.1 0.58 13.94 1.491 1.416 a Molar ratio (Al+M(IV))/(Al+M(IV)+Ni) b FWHM: full width at half maximum (°2θ) for the (003) reflection Table 2 Textural and acidic properties of the mixed oxide catalysts. Table 2 Catalyst S.A. a (m2 g−1) Pore volume (cm3 g−1) Average pore diameter b (Å) Acid site density (µmol g−1) Weak and Medium Strong Total NiAl 254 0.24 37 1.160 0.315 1.475 NiAlCe 117 0.35 119 0.564 0.127 0.691 NiAlZr 162 0.38 94 0.704 0.116 0.820 a BET Surface Area b 4V/S.A Hydrogen-free deoxygenation of industrial vegetable oil waste using Ce, Zr-NiAl catalysts for second-generation biofuels production Santiago Arias Conceptualization Writing – original draft Methodology a Danilo Pontes Vascocelos Methodology a Denisson de Oliveira Libório Writing – review & editing a Juan Felipe Gonzalez Methodology a Alan G. Câmara Methodology a Celmy M.B.M. Barbosa Writing – review & editing a Roger Fréty Writing – original draft Writing – review & editing b Jose Geraldo A. Pacheco Funding acquisition Project administration Resources Supervision Writing – original draft Writing – review & editing a ⁎ a Department of Chemical Engineering, Center of Technology and Geosciences, Institute for Petroleum and Energy Research (LITPEG), Laboratory of Refining and Cleaner Technology (LabRefino/Lateclim), Federal University of Pernambuco, Recife, PE, Brazil Department of Chemical Engineering Center of Technology and Geosciences Institute for Petroleum and Energy Research (LITPEG) Laboratory of Refining and Cleaner Technology (LabRefino/Lateclim) Federal University of Pernambuco Recife PE Brazil aDepartment of Chemical Engineering, Center of Technology and Geosciences, Institute for Petroleum and Energy Research (LITPEG), Laboratory of Refining and Cleaner Technology (LabRefino/Lateclim), Federal University of Pernambuco, Recife, PE, Brazil b Chemistry Institute, Physical Chemistry Department, Federal University of Bahia, Salvador, BA, Brazil Chemistry Institute Physical Chemistry Department Federal University of Bahia Salvador BA Brazil bChemistry Institute, Physical Chemistry Department, Federal University of Bahia, Salvador, BA, Brazil ⁎ Corresponding author. High acidic vegetable oil feedstocks and wastes are not suitable for conventional biodiesel production. These wastes could be used to produce cheap hydrocarbon-rich biofuels without affecting food production. In this work, we studied the hydrogen-free fast pyrolysis and deoxygenation of an acidic industrial vegetable oil waste for biofuels and chemicals production, assessing the effect of Ce or Zr on NiAl mixed oxides obtained from layered double hydroxides. Oily waste (OW) was pre-adsorbed on the catalysts using a Catalyst:OW mass ratio of 5:1. Without a catalyst, pyrolysis of OW, containing triglycerides and a high percentage of free fatty acids, produced mainly 1-alkenes, lower carbon chain fatty acids, and fatty acid esters. Catalytic pyrolysis increased hydrocarbons favoring 1-alkenes between propene and 1-heptadecene, as well as alkyl-benzenes. Linear alkylbenzenes are feedstock for the production of biodegradable surfactants. NiAlCe was most selective to polyenes, alkanes and ketones, while NiAl and NiAlZr catalysts were efficient in producing aromatics, alkenes and light hydrocarbons in the GLP and gasoline range (C3-C10). The combination of acidic and metallic properties on high surface area unsupported bulk mixed oxide catalysts can be used to maximize the production of specific-range hydrocarbons for second-generation drop-in biofuels and bio-based surfactant precursors, towards the decarbonization of industry. Graphical abstract Image, graphical abstract Keywords Cracking Oil residue Layered double hydroxides Pyrolysis Unsupported catalysts Abbreviations FFA free fatty acid HDO hydrodeoxygenation LDH layered double hydroxide OW oily waste PC principal component PCA principal component analysis S.A surface area TA terephthalate Data availability Data will be made available on request. 1 Introduction The use of fossil fuels as energy sources leads to a number of consequences, including the emission of a wide variety of air pollutants, such as carbon dioxide, nitrogen oxides, sulfur oxides, carbon monoxide and particulates, contributing to increasing extreme climate events [1]. The UN report on climate change of August 2021 stated the imperative need to reach net-zero carbon emissions to mitigate the negative effects of the excessive greenhouse effect by promoting the use of cleaner renewable energy sources [2]. Biodiesel and ethanol are two renewable sources of energy produced on a large scale, but they use raw materials such as soybean and sugarcane that compete directly with food purposes [3,4]. The industrial production of edible soybean and other vegetable oils usually generates hundreds of tons a year of triglyceride residues containing high content of free fatty acids [5]. However, high acidic fatty compounds are not proper for the conventional biodiesel process because they could form a high amount of soaps [6]. In this case, heterogeneous catalysts can be used to avoid the production of undesirable compounds during biodiesel production [7,8]. Among various types of biomasses used to obtain bio-oil rich in hydrocarbons, vegetable oil-derived triglycerides are extensively recognized as excellent raw materials. To be used as a drop-in conventional fuel, fatty compounds require total deoxygenation [9]. Hydrodeoxygenation (HDO) using precious or transition metal catalysts can be used to produce hydrocarbons in the jet fuel and diesel range. But this process consumes a large amount of hydrogen with excessive cost [10]. Hydrogen-free catalytic cracking and pyrolysis are alternative ways to produce hydrocarbons [11]. Pyrolysis consists of promoting the thermal degradation of potential feeds at a temperature between 400 and 700 °C under an inert atmosphere [12]. Pyrolysis of different types of fatty wastes has been reported, such as fat, oils and grease [13], vegetable oil refining by-product [14], used frying oil [15,16] and soybean oil soapstock [17]. However, the bio-oil obtained from the thermal pyrolysis of biomass has a high content of oxygenated compounds leading to low stability and limited calorific value of the bio-oil [18]. An alternative is the use of catalytic conversion to obtain hydrocarbon-rich products [19,20]. Acid and metallic catalysts have been widely developed and applied in deoxygenation, hydrodeoxygenation and pyrolysis reactions using triglycerides, fatty acid esters and fatty acids as model compounds of vegetable oil and oily waste for a better understanding of reaction mechanisms and to improve hydrocarbon selectivity [19]. In previous works, we have reported the pyrolysis and deoxygenation of fatty compounds using catalysts with different acidities, such as Al2O3, SiO2, [21]. The use of alumina in oleic acid pyrolysis favored the production of hydrocarbons in the gasoline range, while palmitic acid pyrolysis favored hydrocarbons in both jet fuel and gasoline range [22]. The combination of metal sites with an acidic site can favor selectivity to deoxygenated products and simultaneous cracking. The use of nickel supported on alumina, prepared by impregnation, increased deoxygenation in the pyrolysis of fatty acids, producing high content of alkene isomers and aromatics [23,24]. However, nickel can be combined with alumina in the form of mixed oxides with a high specific area, coming from layered double hydroxides (LDH) [25]. The pyrolysis of myristic acid on mixed oxides NiAl produced from LDH showed modulated acidity that can favor the production of hydrocarbons in the range of gasoline or jet fuel, or even aromatics, depending on Ni/Al ratio [26]. However, Ni-based catalysts can suffer deactivation during pyrolysis by carbon deposition and metal sintering. To limit this problem, the design of composition and structure of bifunctional catalysts has been studied, considering the type of support, interaction metal-support and nanosize particles [27]. The use of zirconium as a catalyst promoter can change the interaction between metals and reactants. Masuda et al. [28] have studied the influence of ZrO2/FeOOH on the conversion of palm oil, showing an oxygen transfer from H2O that increased the activity and selectivity to hydrocarbons and butanones. This result was justified because ZrO2 has the ability to generate active hydrogen and oxygen species from H2O. Arias et al. [25] observed that the introduction of zirconium in NiAlOx mixed oxide catalysts, prepared from layered double hydroxides, caused a reduction in the acidity of the NiAlOx oxides, reducing the interaction of Ni and Al and favoring the dehydrogenation of cyclohexane. Another interesting promoter of Ni-based catalysts is cerium, which can significantly enhance catalyst efficiencies. During biomass pyrolysis, Pang et al. [29] observed that the Ce4+ of the CeO2 oxide supported on the Al2O3 surface was reduced to Ce3+ in a reducing atmosphere and high temperature, removing oxygen atoms to form oxygen vacancies, thus increasing the redox performance of the catalyst. At the same time, biomass pyrolysis produced H2O through dehydration and deoxygenation reactions, increasing the interaction with cerium species and favoring the degree of deoxygenation of the products. Amaya et al. [30] studied the influence of vermiculite with acidity modulated by Al-Zr or Al-Ce on the performance of Ni and NiMo for the hydroconversion of decane. Fu et al. [31], studied the role of ceria in Ni/CeO-Al2O3 catalysts in the deoxygenation of bio-lipids. The authors observed that the oxygen vacancies formed by cerium doping on Al2O3 support weakened the strong Ni-Al interaction, favoring the dispersion of nickel sites. The addition of cerium to the NiCeAl catalyst also increased the weak and medium acidity and decreased the strong acidity, limiting the cleavage of the C-C single bond of hydrocarbons and therefore the coke formation. Another important effect due to cerium addition is the increase in the dispersion of Ni particles in the Ni/Al2O3 catalyst, which increases the activity and reduces deactivation [32]. The studies of NiZrAl and NiCeAl catalysts have usually been carried out in a Ni-supported system prepared by impregnation on Al2O3, CeO2 and ZrO2. Studies on unsupported catalyst systems based on mixed oxides obtained from layered double hydroxides are rare. Therefore, this article aims to evaluate the effect of Ce and Zr on NiAl mixed oxides obtained from layered double hydroxides in a hydrogen-free pyrolysis and deoxygenation of industrial vegetable oil waste to produce second-generation biofuels and petrochemicals. 2 Experimental 2.1 Preparation of materials The precursor materials, NiAl-LDH, NiAlCe-LDH and NiAlZr-LDH, were prepared by the coprecipitation method as previously described [25]. Essentially, two solutions (100 mL each) at pH 6.5 ± 0.3 were added dropwise simultaneously into a round-bottom flask containing 100 mL of deionized water previously boiled at 105 °C to remove dissolved CO2 and avoid carbonate formation during LDH synthesis. The addition of solutions was performed slowly under agitation at 55 °C over 45 min. One of the solutions contained the metallic sources (0.5 mol L−1): aluminum nitrate, Al(NO3)3.9H2O (Dinâmica, 98.5%) and nickel nitrate, Ni(NO3)2.6H2O (Sigma-Aldrich, 99%) for NiAl-LDH. In addition to these salts, the following were added: ammonium cerium (IV) nitrate, (NH4)2Ce(NO3)6 (Vetec, 99%), or zirconium (IV) oxychloride, ZrOCl2.8H2O (Sigma-Aldrich, 99.5%), for NiAlCe-LDH and NiAlZr-LDH synthesis, respectively. The other solution contained sodium hydroxide (1.0 mol L−1), NaOH (Merck, 99%) and terephthalic acid (0.19 mol L−1), C8H6O4 (Aldrich, 98 %) as a source of terephthalate anion [TA2−]. All reagents were added in stoichiometric amounts according to LDH general formula Ni0.3(Al+M(IV))0.7(OH)2[TA2−]0.35.mH2O, with M(IV) = Ce(IV) or Zr(IV) and Al:M(IV) molar ratio 1:1. The only exception was the terephthalic acid that was added in an excess of 10 mol% more than the stoichiometric amounts, to favor its incorporation as the compensation anion in the layered double hydroxides. The precipitates were aged under stirring for 20 h with the first four hours at 55 °C and the remaining time at room temperature. The solid phases were recovered by vacuum filtration, washing with deionized boiled water until reaching neutral pH. Next, the materials were dried in an oven at 80 °C for 36 h. Mixed oxide catalysts NiAl, NiAlCe and NiAlZr were obtained after calcination of the precursor materials at 600 °C for 3 h at a heating rate of 10 °C min−1 under static air. The addition of oily waste (OW) to catalysts, that had been pre-dried at 110 °C, was achieved at room temperature by manual grinding in a ceramic crucible at a 5:1 catalyst:OW mass ratio. At the end of this process, the materials were always completely powdered. The mixtures were identified as OW/catalyst: OW/NiAl, OW/NiAlCe and OW/NiAlZr. 2.2 Pyrolysis experiments The pyrolysis feedstock was an acidic oily waste from a soybean vegetable oil processing industry located in Cabo de Santo Agostinho, Pernambuco State, Brazil. Fast pyrolyses of oily waste and oily waste adsorbed on catalysts, were conducted in a Frontier Tandem Rx-3050TR µ-reactor interfaced to a Shimadzu GC/MS QP2020 gas chromatograph. The sample mass amount was around 250 µg for OW and 1500 µg for the OW/catalyst, ensuring that the amount of material available for pyrolysis was always the same in all experiments [26]. The sample was first weighed in a steel cup; then quartz wool was added above the sample to avoid any loss of the solid during the descent of the cup within the pyrolysis set-up. The cup with the sample was dropped into the first reactor module preheated to 600 °C and was maintained at this temperature for 18 s; the pyrolysis vapors passed through an empty tube in the second reactor module that worked as an interface at 300 °C to prevent premature condensation of pyrolysis products evolved. Helium was used as the carrier gas to transfer the volatile products to CG/MS system. The products were analyzed with a SH-Rtx-5 column (60 m x 0.25 mm x 0.25 µm); the thermal program used began at 45 °C for 5 min, followed by a heating ramp (5 °C min−1) up to 280 °C, maintaining this temperature for 10 min. The temperatures of the ion source and the injector were kept at 250 °C; the GC–MS interface was set at 290 °C. Mass spectrum was run in scan mode in the range of 40–400 m/z. Peak identification by GC/MS analysis was based on comparison with data from the NIST library and only compounds with a similarity higher than 85% were processed as identified ones. All the pyrolysis experiments were carried out in duplicate. 2.3 Characterization of materials and oily feedstock The elemental chemical composition of the samples was obtained by Energy Dispersive X-Ray Analysis (EDX) using a Rigaku NEX DE VS spectrometer, 10 mm analysis spot size, irradiation time for 100 s under a helium atmosphere. For these analyses, three K lines were used: Y-Gd at 60 kV tube voltage and 200 µA for cerium and zirconium detection, K-Sr at 35 kV and 47 µA for nickel measurement and Na-Cl K lines at 6.5 kV and 320 µA for aluminum quantification. X-ray diffraction patterns were obtained on a Rigaku diffractometer Smartlab SE model in the 3–70° 2θ range using CuKα radiation (λ = 1.54056 Å). The analysis parameters were 40 kV voltage, 40 mA current, a step of 0.02° and a speed of 2° min−1. FTIR (Fourier Transform Infrared) spectra between 4000 and 850 cm−1 were obtained in a Bruker Tensor II spectrometer coupled with ATR module (Attenuated Total Reflectance); 30 scans were made for each sample and 30 scans for the background. Thermogravimetric analysis (TGA) was carried out in a NETZSCH ST A449 F3 Jupiter instrument. About 10 mg of sample was placed in an alumina sample pan and heated from 25 to 900 °C at a rate of 10 °C min−1 under 50 mL min−1 of synthetic air flow. Nitrogen adsorption/desorption isotherms were taken at -196 °C in a Micromeritics ASAP 2020 analyzer. The surface area of the catalysts was calculated using the BET (Brunauer, Emmett, Teller) method. The BJH (Barret, Joyner and Halenda) method was utilized to calculate the pore size distribution and the total pore volume was calculated based on the amount of nitrogen adsorbed at P/P0 = 0.99. The amount and strength of the acid sites present in the oxides were estimated by pyridine desorption. 0.1 g of catalyst was placed in a tubular reactor and heated to 400 °C for 2 h under an argon atmosphere with a gas flow of 100 mL.min−1, for cleaning the surface of the materials. Then, the temperature was lowered to 95 °C and a stream of inert gas saturated with pyridine vapor was passed through the reactor over a period of 40 min. After this exposure time and still at the same temperature, a flow of pure argon was used for 40 min to remove the weakly or physically adsorbed pyridine. Finally, 20–30 mg of the samples containing the remaining pyridine were subjected to TGA analysis on heating up to 900 °C (heating rate = 10 °C.min−1) under a nitrogen flow rate of 50 mL.min−1 [21]. Every mass loss event due to pyridine desorption (i event) was used as a parameter to calculate the number of acid sites, using the following equations: (1) n p y r i d i n e = m p y r i d i n e M M p y r i d i n e (2) N i = n p y r i d i n e m c a t a l y s t (3) T o t a l a c i d i t y = ∑ N i Where npyridine, mpyridine and MMpyridine are respectively the number of mols, mass and molar mass of pyridine; mcatalyst is the catalyst mass; Ni is the acidity in mols of pyridine per gram of catalyst. The acidic sites were classified as weak and medium strength (30 °C–280 °C temperature range, Lewis acids), and strong strength (280 °C–620 °C temperature range, strong Lewis acid and Bronsted acid sites). The medium and strong acidic sites are related to chemisorbed pyridine. The quantification of the percentage of free fatty acids (FFA), that is the number of grams of fatty acid as oleic acid in 100 g of oily waste, was estimated according to the AOCS Ca 5a-40 method [33]: about 1.0 g of oily waste was placed in a flask containing 12.5 ml of ethanol and two drops of phenolphthalein as an indicator. The sample was titrated by drop-wise addition of a standard NaOH 0.25 mol L−1 solution. This procedure was performed in triplicate. 2.4 Principal component analysis (PCA) PCA is a technique widely used in pyrolysis studies, enabling the reduction of the dimensionality of correlated data, transforming them into another set of uncorrelated data, called principal components (PC) [34–36]. Each PC is obtained through the linear combination of the original data. In this study, a PCA was performed on the peak area data of the compounds from the thermal and catalytic pyrolysis of the oily waste, to analyze the correlations between the products obtained. 3 Results 3.1 Precursors and catalysts characterization Precursor materials EDX elemental analysis results are shown in Table 1 . It was assumed that during precursor calcination no metallic sublimation or lixiviation could happen: then the percentages of Ni, Al, Ce and Zr would be the same in both oxides and layered double hydroxide precursors. The 0.7 x theoretical molar ratios were not reached with precision (x = (Al+M(IV))/(Ni+Al+M(IV))); but the three different metallic compositions (NiAl, NiAlCe and NiAlZr) enabled a study of the effect of the metallic nature on the properties of the materials and on the pyrolysis of oily waste. The materials NiAlCe-LDH and NiAlZr-LDH presented higher x values than NiAl-LDH, so there was greater incorporation of trivalent Al3+ and tetravalent Ce4+ and Zr4+. In the case of NiAl-LDH, when presenting a smaller x value, a higher content of nickel was observed (see Table 1), due to the lower incorporation of Al3+ in the material, as a result of metal leaching. Additionally, the percentage of nickel decreased with the addition of higher atomic mass metals Ce4+ and Zr4+. The X-ray diffraction (XRD) patterns of precursor materials NiAl-LDH, NiAlCe-LDH and NiAlZr-LDH are displayed in Fig. 1 . The diffraction reflections close to 2θ = 6.4°, 12.7°, 19.0°, 25.6° and 63.0° and their relative intensities are typical of layered double hydroxides [37]. No available standard patterns were found for LDH-terephthalate: then the Miller indexes were assigned to the main reflections in the diffractograms, as has been reported in previous studies [25]. For LDHs, the intense and regularly spaced basal reflections [00l] at low 2θ values correspond to successive orders of basal spacing c’. The basal spacing can be calculated from the (003) interplanar distance by Bragg´s Law with the value corresponding to the thickness of one layer plus the interlayer space. For all the materials, the d(003) distances are close to 13.9 Å (Table 1), similar to values reported for LDH-terephthalate intercalated with high water content. The layer thickness in LDH was 4.8 Å, the interlayer spacing was 9.1 Å, which is close to the size of the terephthalate anion in the vertical orientation with respect to the layers that is 9 Å [38]. Terephtalate provides a larger interlayer space when compared with common anions frequently used such as carbonate, hydroxide, chloride or nitrate. This minimizes the electrostatic repulsion between adjacent layers, stabilizes the LDH structure and allows the inclusion of a higher ratio of (III) and (IV) cations in the layers (high x values in the general formula of LDH) [10,25]. Table 1 shows the calculated “full width at half maximum” (°2θ) (FWHM) for the (003) XRD reflection, to have a measurement of the degree of crystallinity. The smaller FWHM value the more crystalline is the material. The NiAl-LDH presented the smallest FWHM value (see Table 1), indicating that this material was the most crystalline. The incorporation of Ce(IV) and Zr(IV) on the layer structure increased the FWHM values, indicating that a decrease in the crystallinity for NiAlCe-LDH and NiAlZr-LDH precursors, probably due to the introduction of significant distortions in the layers as a result of the substitution of Al (III) (ion radius 0.53 Å) by larger cations: Ce(IV) (ion radius 0.87 Å) and Zr(IV) (ion radius 0.72 Å) [39]. The material containing cerium presented the highest FWHM value, indicating that the distortion was more visible due to its higher cation size compared to Zr4+. An additional reason for NiAlCe-LDH being the least crystalline precursor is the presence of one additional phase to the LDH identified by the small diffraction peaks at 2θ = 8.7° and 14° (see asterisks in Fig. 1). These reflections have already been observed under similar synthesis conditions with high cerium contents, there being a limiting amount of Ce (IV) that can be incorporated into the layered structure of the LDH [10]. Additional evidence that suggests the incorporation of cerium and zirconium in the LDH layer structure are provided by the shift of the reflection (110) towards smaller angle values (see black arrow in Fig. 1). The reflection around 2θ = 62° corresponds to the crystallographic (110) plane, which is influenced by the layer compositions and the cationic radius. This reflection is independent of the layer stacking sequence and defines the lattice parameter a which can be calculated according to the formula a = 2 d(110). The lattice parameter a corresponds to the cation-cation distance in the brucite-like layers [37]. The a values calculated were 2.94, 2.98 and 2.99 Å for NiAl-LDH, NiAlZr-LDH and NiAlCe-LDH, respectively, showing that the a parameter tends to increase as the aluminum is substituted by cations with a larger ionic radius such as cerium and zirconium cations. Fig. S1 shows the infrared spectra of precursor materials. The bands at ca. 1550 and 1380 cm−1, are related, respectively, to the antisymmetric and symmetric stretching vibration modes of the carboxylate group in the terephthalate anion [40], being more intense for the NiAlCe-LDH material. The broad absorption band in the region 3000–3600 cm−1 refers to the OH stretching vibrations, ν(OH) correspondent with hydroxyl groups in the layers and interlayer water. At 1700 cm−1 the band of angular deformation δ(H–O–H) in interlayer water molecules was observed. The bands close to 1020 cm−1 can be assigned to Al–O stretching vibrations in octahedral AlO6 units [41]. Thermogravimetric curves of the precursor materials and derivative mass loss curves are displayed in Fig. S2. All materials presented a similar tendency in their thermal evolution and three typical mass loss ranges were identified, in agreement with [42]: dehydration from 30 to 200 °C, dehydroxylation between 200 and 370 °C and terephthalate combustion at 370–600 °C. Above this temperature, the materials reach thermal equilibrium and no further mass loss was observed. For this reason, 600 °C was the chosen calcination temperature retained for catalyst synthesis. The total mass losses were 56.2%, 45.5% and 43.4 % for NiAl-LDH, NiAlCe-LDH and NiAlZr-LDH, respectively. It is important to note that the NiAlCe-LDH material presented an additional mass loss simultaneous with the dehydroxylation (DTG curve showed the peculiarities of this sample more clearly). This step, between 200 and 370 °C, could be related to the decomposition of the cerium segregated phase observed in the XRD diffractogram (see Fig. 1). Fig. 2 shows the X-ray diffraction patterns of the mixed oxides obtained from the calcination of the LDHs precursors. Poorly crystallized phases were observed. In the case of NiAl, a mixture of nickel oxide NiO (ICSD collection code 87108) with possible NiAl2O4 nickel aluminate spinel phase (ICSD collection code 72067) or poorly structured transition alumina were observed. In the case of NiAlZr, tetragonal ZrO2 (ICSD collection code 68589) was suggested together with NiO. In the NiAlCe material, ceria CeO2 (ICSD collection code 88752) was well characterized, together with traces of NiO. A definite crystallization of Al2O3 was never observed, indicating that either the Al (III) ions inserted into the NiO network, forming a solid solution, or the potential aluminum oxide phase is quite amorphous. The textural properties of mixed oxides were evaluated by N2 sorption experiments. Specific surface areas, calculated by the BET method, BJH-desorption pore volume and pore average diameter are shown in Table 2 . The adsorption-desorption isotherms and pore size distribution are displayed in Fig. 3 . All materials showed type IV isotherms according to the IUPAC classification, indicating that the materials are mesoporous [43]. According to the same classification, the hysteresis loops for NiAlCe and NiAlZr are of H3 type, characteristic of materials containing macropores not filled by nitrogen condensate; while NiAl oxide has an H2(a) hysteresis loop, suggesting the presence of well-ordered mesopores. These observations are confirmed through the pore size distribution graph (Fig. 3) where the NiAl presented a narrow and unimodal pore size distribution curve in the mesoporous range with a maximum close to 38 Å whereas NiAlCe and NiAlZr showed the presence of mesopores and large meso/macropores through a bimodal pore size distribution. The NiAl oxide has a higher surface area than NiAlCe and NiAlZr catalysts. Thus, with the cerium and zirconium addition there was a decrease in the surface area, probably associated with the formation of some CeO2 and ZrO2 segregated phases, which are less-porous materials and may promote substantial blocking of pores in the catalyst surface [44]. However, the surface area of NiAlZr area was not as small as that of NiAlCe. Such a fact is attributed to the presence of the tetragonal zirconia phase, as identified by XRD results. This tetragonal phase has a higher specific surface area than monoclinic zirconia. [45]. Thermogravimetric desorption of pyridine previously adsorbed on NiAl, NiAlZr and NiAlCe materials (Fig. S3) showed two principal mass losses. The first, in the range from 30 to 280 °C, may be related to the desorption of pyridine chemisorbed at Lewis acid sites present in alumina and NiO. Due to pyridine desorption in a low-temperature range, the corresponding acid sites are considered to show weak to medium strength. The second mass loss is observed in the range from 280 to 620 °C and is probably related to the desorption of chemically adsorbed pyridine in Bronsted strong acidic sites. Table 2 shows the quantification of acid sites in the two temperature ranges, based on the assumption that a single pyridine molecule is adsorbed on a single acid site. Values in Table 2 show that the order of decreasing acidity is NiAl>NiAlZr>NiAlCe. The acidity of NiAl can be assigned to Lewis acid sites from Ni2+ and Al3+ oxides and Brønsted acid sites associated with bridging OH groups on the catalyst surface [26]. The NiAlZr and NiAlCe catalysts presented the lowest weak and medium acidity, given the low aluminum content in these materials (Table 1), mainly responsible for the weak Lewis acidity in NiAl oxide. In addition, strong acidity sites also decreased with the inclusion of promoters such as cerium and zirconium, diminishing the strong interaction between nickel and aluminum that is responsible for the formation of NiAl2O4 spinel phase [31]. In fact, this spinel phase was not detected by the XRD diffractograms in the NiAlCe and NiAlZr catalysts. 3.2 Thermal and thermo-catalytic pyrolysis of oily waste Following the AOCS Ca 5a-40 official titration method [33], the FFA quantity found in the OW sample was 37.5%, confirming high residual acidity. FTIR spectroscopy (Fig. S4) enabled identification of the main functional groups present in the oily residue, either pure or after adsorption on the oxide catalysts. The band at 3010 cm−1 is assigned to C-H axial deformation in the olefinic double bonds and is less evident for OW/catalysts. The bands in the 1400–1200 cm−1 region, 2930 and 2842 cm−1 are attributed to aliphatic CH2 and CH3 groups present in FFA and triglycerides. The band at 1285 cm−1 corresponds to the C-O stretch. The bands close to 1750 cm−1 correspond to C-O in ester. Thus, the presence of these peaks is clearly related to triglycerides and derived products [46,47]. The intense band at 1710 cm−1 for OW is attributed to stretching of the asymmetric -C=O carbonyl groups [48]. This band, strongly related to FFA presence, was not detected in all OW/catalysts. This indicates the strong interaction between the oily waste and the surface sites of the catalysts induced by the adsorption process used in the present study, mainly through the carboxylic group of the FFA. The pyrograms of oily waste pure and adsorbed on catalysts are shown in Fig. 4 . The pyrogram of pure OW was much simpler than that obtained after pyrolysis of OW/oxides: the increment in the peaks quantity and their relative intensities is evidence of the positive effect of the catalysts on the transformation of oily waste in many products. Close to 115 compounds were identified. In all pyrograms, a series of homologous peaks was identified (dotted gray lines in Fig. 4), corresponding to 1-alkenes from 1-pentene (1-C5) to 1-heptadecene (1-C17) suggesting that decarboxylation, decarbonylation (de-COx reactions) and cracking have an important role in the pyrolysis mechanisms improved by the presence of NiAl-M catalysts. The 1-C17 was the alkene with the highest carbon number chain obtained: this alkene is generally found in important quantities during the decarboxylation of C18 stearic acid [22,48]. In the catalytic pyrolysis process, the formation of aromatics was observed (dotted red lines in Fig. 4) with toluene, benzene and ethyl-benzene as the most representative compounds. An alkyl-benzene homolog series was identified, from C1 (Toluene) up to C12 (dodecyl-benzene), the alkyl chain being of linear type. These observations agree with previous results reported for the pyrolysis of myristic acid adsorbed on NiAl oxides also issued from LDH precursors [26]. Fig. 5 shows the biplot graph (score + loading) of the principal component analysis (PCA) that presents the correlation between the catalyst types and the main product families obtained from pyrolysis of OW residues. Principal components 1 and 2 together explain 94% variance of the data. PC1 is directly linked to the nature of pyrolysis: catalytic or non-catalytic; PC2 is related to selectivity to oxygenated compounds or hydrocarbons. Thermal pyrolysis differs from catalytic because of the presence of fatty acids and fatty acid esters. Catalytic pyrolysis favored the degradation of the oily residue, transforming it into hydrocarbons and mono-oxygenated products. Among the catalysts, the NiAlCe favored the production of ketones, aldehydes and hydrocarbons, especially polyenes and alkanes. NiAl and NiAlZr catalysts favored the production of aromatic hydrocarbons, alkenes and alcohols. The PCA correlations between the main products individually and the catalyst type from the pyrolysis of OW residue are shown in Fig. 6 . The principal components 1 and 2 together explain the variance of 88% of the data. PC2 is related to the degree of deoxygenation. It is observed that the pyrolysis of the pure OW residue differs from the catalytic pyrolysis mainly by the formation of the compound 14-methyl-8-Hexadecenal. NiAl and NiAlZr catalysts, the most acidic, favored the production of light hydrocarbons such as propene, 2-Butene and aromatics such as benzene and toluene. In contrast, NiAlCe favored the production of ketones especially undecanone, dodecanone, tridecanone, and also some hydrocarbons. Thermal and catalytic pyrolysis are similar in terms of obtaining alkenes and 10-Pentadecene-1-ol and 1-hexadecanol, alcohol products that are grouped in the center of the biplot graph. Fig. 7 displays the results of product yields, estimated from the values of the areas of the peaks, from the fast pyrolysis of OW and OW/catalysts. The compounds were grouped into four main categories: CO2, hydrocarbons, oxygenated compounds and unidentified products. The CO2 yield increased with catalyst use, especially with the NiAlCe, indicating the occurrence of decarboxylation reactions. The number of unidentified products increased due to greater conversion and therefore greater presence of compounds derived from consecutive cracking reactions in presence of the catalysts. The yield of oxygenated compounds was lower in the OW/NiAl catalyst mixture pyrolysis. The deoxygenation efficiency can be linked to the strong adsorption of the oily waste on the catalyst surface, favored by both the higher Ni content and the higher specific surface area of this particular catalyst [24,26]. NiAlZr and NiAlCe catalysts showed a higher yield of oxygenated compounds, mainly due to the presence of ketones, aldehydes and alcohols, possibly associated to the presence of oxygen vacancies introduced by the oxides ZrO2 and CeO2 [28,31]. The main information arising from Fig. 7 is the increase in hydrocarbon formation, i.e. the better deoxygenation of the feed when catalysts are used. A second observation can be made when looking at Fig. 7: with the exception of CO2, where quantification variation may reach some 20% in a duplicate run, the relative standard deviation in the quantity of oxygenated and deoxygenated compounds is always smaller than 5%, indicating that the present experimental conditions are well controlled. Fig. 8 details the distribution of hydrocarbon families from the fast pyrolysis of OW, classified as alkanes, alkenes, polyenes and aromatics. In the presence of mixed oxide catalysts, the production of aromatics and monoalkenes was clearly increased, whereas the polyenes and saturated products increased less, compared to pyrolysis without a catalyst. The NiAl catalyst was the material with the highest selectivity to aromatics, especially toluene, benzene, ethyl-benzene, pentyl-benzene and styrene. The high production of aromatics, in this case, can be correlated to the higher acidity of the NiAl catalyst. NiAl is therefore not only responsible for the cracking of the molecules, but also for hydrogen transfer reactions associated with aromatization [49,50]. The NiAl catalyst also produced polycyclic aromatics, such as methyl-naphthalene, which are precursors of coke formation [51]. These polyaromatics were not observed with NiAlCe and NiAlZr, showing that the introduction of zirconium and cerium can inhibit catalyst deactivation by coke production. This result agrees with previous data reported in the literature about the pyrolysis of fatty compounds using Ni, Ce, Zr supported catalysts [31,32]. More alkenes were produced when using the NiAlZr catalyst. Among these, propene, 2-butene, and 1-alkenes such as 1-pentene, 1-hexene, 1-pentadecene, 1-heptene and 1-nonene were the products presenting the higher yields. In the case of OW/NiAlCe pyrolysis, the production of polyenes and alkanes was superior compared to the other cases. Patil and Vaidya [52] observed that CeO2 acts as a weak Lewis base and tends to donate electrons to a metal, improving its reduction capacity. In the present case, the catalyst NiAlCe could promote the cracking of unsaturated hydrocarbons, producing polyunsaturated compounds and alkanes. Also, the improvement of the hydrogenating capacity of Ni in the presence of Ce promoted the formation of alkanes [31]. Another important result was the production of linear alkylbenzenes homolog series (from octyl- to dodecyl-benzene) in similar amounts in all catalysts. Long-chain linear alkylbenzenes are value-added petrochemical feedstocks for the production of biodegradable surfactants. Classification of the obtained hydrocarbons through the number of carbon chain ranges is shown in Fig. 9 . The light hydrocarbons range (C3-C4) was favored by the Zr-containing catalyst, whereas the C5-C9 hydrocarbons range (gasoline) was promoted in the presence of NiAl catalyst. The three catalysts showed the same C10-C13 hydrocarbon range (kerosene-type fuel) and a non-negligible amount of alkyl-benzenes C14+. Higher amounts of C14+ hydrocarbons range, compatible with diesel-like fuels, were observed with both NiAlCe and NiAlZr, implying an inhibition of secondary cracking reactions during pyrolysis, the result of a decrease in acidity strength of these catalysts compared with NiAl. Studying the pyrolysis of palmitic acid adsorbed on pure alumina, Santos et al. [22] also observed a preferential formation of C5–C9 hydrocarbons, suggesting that Al-Lewis sites favored hydrocarbons in the gasoline range. Jeon et al. [53] observed that in Ni-CeZrO2, the catalyst with higher acidity enhanced the selectivity toward light hydrocarbons. Fig. 10 displays the oxygenated compound yields for the fast cracking of OW, separated into the main groups: alcohols, aldehydes, ketones, carboxylic acids and fatty acid esters. Linoleic acid (carboxylic acid) was only detected in the non-catalytic cracking. The content of fatty acid esters such as dodecanoic acid methyl ester and decanoic acid 2-propenyl ester was reduced considerably for pyrolysis in the presence of catalysts, indicating a better conversion of the raw material by both the high temperature of cracking and the catalytic effect of the materials. Ketones such as undecanone, dodecanone, tridecanone and 4-cyclohexyl-2-butanone were identified with the NiAlCe catalyst; their volume was greater with NiAlCe than with NiAlZr (dotted blue lines in Fig. 4). Phung et al. [54] observed that the pyrolysis of vegetable oil over a catalyst with basic properties derived from HDL favored the production of ketones. Aldehydes such as dodecanal, tridecanal, tetradecanal, tetradecenal, pentadecenal and hexadecanal were produced in significant amounts when using NiAlCe and in lower amounts when the pyrolysis occurred with NiAlZr. Dodecanol, tridecanol, tetradecanol, tetradecenol, pentadecenol and hexadecanol were the main alcohols found as pyrolysis products, in the case of OW pyrolysis in presence of NiAlCe. The formation of alcohols as intermediates may come from a hydrogenation pathway of carboxylic acids [31]. In this case, hydrogen may be produced from dehydrocyclization and aromatization reactions in the presence of aluminum-containing catalysts [49]. It is striking that C12 to C16 alcohols, C12 to C16 aldehydes, C11 to C13 ketones, have many similarities in terms of chain length and structure and are always produced in better amounts when using NiAlCe than with the other catalysts. Such a fact suggests that aldehydes and alcohols have a common mechanism of formation and that an oxy-reductor solid promotor such as Ce(IV) and to a lower extent Zr(IV) participate directly in the initial decomposition mechanism of OW, but limiting further transformation of these oxygenated species. It can be recalled that alcohols and ketones, together with oxygenated products of thermal pyrolysis such as carboxylic acids and fatty acid esters can be further deoxygenated, for example, by recycling a fraction of the products into the pyrolysis reactor, in order to increase the global deoxygenation degree of the OW residue. 4 Conclusions Layered double hydroxides of NiAl, NiAlZr and NiAlCe were successively prepared as precursors of unsupported bulk mixed oxide catalysts with high specific surface area. Fast pyrolysis at 600 °C of oily waste (OW) from the vegetable oil industry, containing triglycerides and a high amount of free fatty acids was performed, producing mainly 1-alkenes, lower carbon chain fatty acids, and fatty acid esters. Pyrolysis in the presence of NiAl-M catalysts produced 1-alkenes from C3 to C17 and linear alkylbenzenes that are petrochemical precursors of biodegradable surfactants production. The NiAlCe catalyst favored the production of polyenes and alkanes as hydrocarbons and ketones as oxygenates. The NiAl and NiAlZr catalysts favored the production of aromatics and alkenes. NiAlZr was selective to alcohols and ketones in a smaller amount than NiAlCe. These results show that the use of an unsupported mixed oxide catalyst, combining Ni as hydrogenating metal with Al2O3 as acid material can modulate the production of specific hydrocarbon product families. The addition of Ce and Zr to NiAl reduced acidity and produce fewer polyaromatics that are precursors of coke. These materials proved to be useful for the conversion of vegetable oil residues to produce precursors of hydrocarbons for second-generation drop-in biofuels and bio-based surfactants, contributing to the decarbonization of industry without competing with food crops. CRediT authorship contribution statement Santiago Arias: Conceptualization, Writing – original draft, Methodology. Danilo Pontes Vascocelos: Methodology. Denisson de Oliveira Libório: Writing – review & editing. Juan Felipe Gonzalez: Methodology. Alan G. Câmara: Methodology. Celmy M.B.M. Barbosa: Writing – review & editing. Roger Fréty: Writing – original draft, Writing – review & editing. Jose Geraldo A. Pacheco: Funding acquisition, Project administration, Resources, Supervision, Writing – original draft, Writing – review & editing. Declaration of Competing Interest The authors declare that they have no known competing financial interests or personal relationships that could have appeared to influence the work reported in this paper. Acknowledgments We gratefully acknowledge financial support from CAPES/PNPD (88882.306335/2018-01), FACEPE (BCT-0378-3.06/17) (IBPG-0395-3.06/19), FINEP-ANP-PRH30.1, RECAT, National Council for Scientific and Technological Development, CNPq/Universal project 430921/2016-0, CNPq/INCT-EMA project 573667/2008-0, 610032/2009-7, PETROBRAS-ANP-LITPEG contract 0050.0078506.12.9. Supplementary materials Supplementary material associated with this article can be found, in the online version, at doi:10.1016/j.mcat.2022.112554. Appendix Supplementary materials Image, application 1 References [1] M. Zhang Y. Hu H. Wang H. Li X. Han Y. Zeng C.C. Xu A review of bio-oil upgrading by catalytic hydrotreatment: advances, challenges, and prospects J. Mol. Catal. 504 2021 111438 10.1016/j.mcat.2021.111438 M. Zhang, Y. Hu, H. Wang, H. Li, X. Han, Y. Zeng, C. C. Xu, A review of bio-oil upgrading by catalytic hydrotreatment: advances, challenges, and prospects, J. Mol. Catal.504 (2021) 111438. 10.1016/j.mcat.2021.111438. [2] IPCC, Climate Change 2021: The Physical Science Basis. Contribution of working group I to the sixth assessment report of the intergovernmental panel on climate change, in: V. Masson-Delmotte, P. Zhai, A. Pirani, S.L. Connors, C. Péan, S. Berger, N. Caud, Y. Chen, L. Goldfarb, M.I. Gomis, M. Huang, K. Leitzell, E. Lonnoy, J.B.R. Matthews, T.K. Maycock, T. Waterfield, O. Yelekçi, R. Yu, and B. Zhou (Eds.), Cambridge University Press, 2021, In Press. [3] T. Koizumi Biofuels and food security Renew. Sustain. Energy Rev. 52 2015 829 841 10.1016/j.rser.2015.06.041 T. Koizumi, Biofuels and food security, Renew. Sustain. Energy Rev.52 (2015) 829-841. 10.1016/j.rser.2015.06.041 [4] T.P. Souza R.J. Silva J.C. Melo I.C. Tschoeke J.P. Silva J.G.A. Pacheco J.M. Silva Kinetic modeling of cottonseed oil transesterification with ethanol React. Kinet. Mech. Catal. 128 2019 707 722 10.1007/s11144-019-01661-2 T.P. Souza, R.J. Silva, J.C. Melo, I.C. Tschoeke, J.P. Silva, J.G.A. Pacheco, J.M. Silva, Kinetic modeling of cottonseed oil transesterification with ethanol. React. Kinet. Mech. Catal.128 (2019) 707-722. 10.1007/s11144-019-01661-2. [5] K. Malins Production of renewable hydrocarbons from vegetable oil refining by-product/waste soapstock over selective sulfur-free high metal loading SiO2–Al2O3 supported Ni catalyst via hydrotreatment J. Clean. Prod. 283 2021 125306 10.1016/j.jclepro.2020.125306 K. Malins, Production of renewable hydrocarbons from vegetable oil refining by-product/waste soapstock over selective sulfur-free high metal loading SiO2–Al2O3 supported Ni catalyst via hydrotreatment, J. Clean. Prod.283 (2021) 125306. 10.1016/j.jclepro.2020.125306 [6] A.D. de Oliveira A.F. de Sá M.F. Pimentel J.G.A. Pacheco C.F. Pereira M.S. Larrechi Comprehensive near infrared study of Jatropha oil esterification with ethanol for biodiesel production Spectrochim. Acta A Mol. Biomol. Spectrosc. 170 2017 56 64 10.1016/j.saa.2016.07.006 A.D. de Oliveira, A.F. de Sá, M.F. Pimentel, J.G.A. Pacheco, C.F. Pereira, M.S. Larrechi, Comprehensive near infrared study of Jatropha oil esterification with ethanol for biodiesel production, Spectrochim. Acta A Mol. Biomol. Spectrosc.170 (2017) 56-64. 10.1016/j.saa.2016.07.006. [7] R.P. de Almeida R.C.G. Aciole A. Infantes-Molina E. Rodríguez-Castellón J.G.A. Pacheco I.C.L. Barros Residue-based activated carbon from passion fruit seed as support to H3PW12O40 for the esterification of oleic acid J. Clean. Prod. 282 2021 124477 10.1016/j.jclepro.2020.124477 R.P. de Almeida, R.C.G. Aciole, A. Infantes-Molina, E. Rodríguez-Castellón, J.G.A. Pacheco, I.C.L. Barros, Residue-based activated carbon from passion fruit seed as support to H3PW12O40 for the esterification of oleic acid, J. Clean. Prod.282 (2021) 124477. 10.1016/j.jclepro.2020.124477. [8] A.F.F. Farias D.T. de Araújo A.L. da Silva E. Leal J.G.A. Pacheco M.R. Silva R.H.G.A. Kiminami A.C.F.M. Costa Evaluation of the catalytic effect of ZnO as a secondary phase in the Ni0.5Zn0.5Fe2O4 system and of the stirring mechanism on biodiesel production reaction Arab. J. Chem. 13 2020 5788 5799 10.1016/j.arabjc.2020.04.016 A.F.F. Farias, D.T. de Araújo, A.L. da Silva, E. Leal, J.G.A. Pacheco, M.R. Silva, R.H.G.A. Kiminami, A.C.F.M. Costa, Evaluation of the catalytic effect of ZnO as a secondary phase in the Ni0.5Zn0.5Fe2O4 system and of the stirring mechanism on biodiesel production reaction, Arab. J. Chem.13 (2020) 5788-5799. 10.1016/j.arabjc.2020.04.016. [9] W. Moonsrikaew A. Duangchan Deoxygenation of pyrolysis vapor from palm fruit cake over NiMo/γ-Al2O3 catalyst: effect of CeO2, TiO2 and ZrO2 additives J. Mol. Catal. 2021 111712 10.1016/j.mcat.2021.111712 W. Moonsrikaew, A. Duangchan, Deoxygenation of pyrolysis vapor from palm fruit cake over NiMo/γ-Al2O3 catalyst: effect of CeO2, TiO2 and ZrO2 additives, J. Mol. Catal. (2021) 111712. 10.1016/j.mcat.2021.111712. [10] L.A. do Nascimento l. Barroso-Martín S.R.S. Peçanha S. Arias B.S. Santos J.G.A. Pacheco A. Infantes-Molina E. Rodríguez-Castellón I.C.L. Barros NiAlCe mixed oxides obtained from layered double hydroxides applied to anisole hydrodeoxygenation Catal. Today 2021 10.1016/j.cattod.2021.08.026 L.A. do Nascimento, l. Barroso-Martín, S.R.S. Peçanha, S. Arias, B.S. Santos, J.G.A. Pacheco, A. Infantes-Molina, E. Rodríguez-Castellón, I.C.L. Barros, NiAlCe mixed oxides obtained from layered double hydroxides applied to anisole hydrodeoxygenation, Catal. Today (2021). 10.1016/j.cattod.2021.08.026. [11] W. Chansiriwat K. Wantala R. Khunphonoi P. Khemthong T. Suwannaruang S.C. Rood Enhancing the catalytic performance of calcium-based catalyst derived from gypsum waste for renewable light fuel production through a pyrolysis process: a study on the effect of magnesium content Chemosphere 292 2022 133516 10.1016/j.chemosphere.2022.133516 W. Chansiriwat, K. Wantala, R. Khunphonoi, P. Khemthong, T. Suwannaruang, S.C. Rood, Enhancing the catalytic performance of calcium-based catalyst derived from gypsum waste for renewable light fuel production through a pyrolysis process: a study on the effect of magnesium content, Chemosphere292 (2022) 133516. 10.1016/j.chemosphere.2022.133516. [12] Y. Wang Q. Yang L. Ke Y. Peng Y. Liu Q. Wu X. Tian L. Dai R. Ruan Li Jiang Review on the catalytic pyrolysis of waste oil for the production of renewable hydrocarbon fuels Fuel 283 2021 119170 10.1016/j.fuel.2020.119170 Y. Wang, Q. Yang, L. Ke, Y. Peng, Y. Liu, Q. Wu, X. Tian, L. Dai, R. Ruan, Li Jiang, Review on the catalytic pyrolysis of waste oil for the production of renewable hydrocarbon fuels, Fuel283 (2021) 119170. 10.1016/j.fuel.2020.119170. [13] H.S. Almeida O.A. Corrêa J.G. Eid H.J. Ribeiro D.A.R. de Castro M.S. Pereira L.M. Pereira A.A. Aâncio M.C. Santos S.A.P da Mota J.A. da Silva Souza Luiz E.P. Borges N.M. Mendonça N.T. Machado Performance of thermochemical conversion of fat, oils, and grease into kerosene-like hydrocarbons in different production scales J. Anal. Appl. Pyrolysis 120 2016 126 143 10.1016/j.jaap.2016.04.017 H.S. Almeida, O.A. Corrêa, J.G. Eid, H.J. Ribeiro, D.A.R. de Castro, M.S. Pereira, L.M. Pereira, A.A. Aâncio, M.C. Santos, S.A.P da Mota, J.A. da Silva Souza, Luiz E.P. Borges, N.M. Mendonça, N.T. Machado, Performance of thermochemical conversion of fat, oils, and grease into kerosene-like hydrocarbons in different production scales, J. Anal. Appl. Pyrolysis120 (2016) 126-143. 10.1016/j.jaap.2016.04.017. [14] L. Dai L. Fan D. Duan R. Ruan Y. Wang Y. Liu Y. Zhou Z. Yu Y. Liu L. Jiang Production of hydrocarbon-rich bio-oil from soapstock via fast microwave-assisted catalytic pyrolysis J. Anal. Appl. Pyrolysis 125 2017 356 362 10.1016/j.jaap.2017.03.003 L. Dai, L. Fan, D. Duan, R. Ruan, Y. Wang, Y. Liu, Y. Zhou, Z. Yu, Y. Liu, L. Jiang, Production of hydrocarbon-rich bio-oil from soapstock via fast microwave-assisted catalytic pyrolysis, J. Anal. Appl. Pyrolysis125 (2017) 356-362. 10.1016/j.jaap.2017.03.003. [15] M.R. Khodadadi I. Malpartida C.W Tsang C.S.K. Lin C. Len Recent advances on the catalytic conversion of waste cooking oil J. Mol. Catal. 494 2020 111128 10.1016/j.mcat.2020.111128 M.R. Khodadadi, I. Malpartida, C.W Tsang, C.S.K. Lin, C. Len, Recent advances on the catalytic conversion of waste cooking oil, J. Mol. Catal.494 (2020) 111128. 10.1016/j.mcat.2020.111128. [16] H.S. Almeida O.A. Correa C.C. Ferreira H.J. Ribeiro D.A.R. de Castro M.S. Pereira A.A. Mâncio M.C. Santos S.A.P. da Mota J.A.S. Souza L.E.P. Borges N.M. Mendonça N.T. Machado Diesel-like hydrocarbon fuels by catalytic cracking of fat, oils, and grease (FOG) from grease traps J. Energy Inst. 90 2017 337 354 10.1016/j.joei.2016.04.008 H.S. Almeida, O.A. Correa, C.C. Ferreira, H.J. Ribeiro, D.A.R. de Castro, M.S. Pereira, A.A. Mâncio, M.C. Santos, S.A.P. da Mota, J.A.S. Souza, L.E.P. Borges, N.M. Mendonça, N.T. Machado, Diesel-like hydrocarbon fuels by catalytic cracking of fat, oils, and grease (FOG) from grease traps, J. Energy Inst.90 (2017) 337-354. 10.1016/j.joei.2016.04.008. [17] Y. Wang L. Ke Y. Peng Q. Yang Z. Du L. Dai N. Zhou Y. Liu G. Fu R. Ruan D. Xia L. Jiang Characteristics of the catalytic fast pyrolysis of vegetable oil soapstock for hydrocarbon-rich fuel Energy Convers. Manag. 213 2020 112860 10.1016/j.enconman.2020.112860 Y. Wang, L. Ke, Y. Peng, Q. Yang, Z. Du, L. Dai, N. Zhou, Y. Liu, G. Fu, R. Ruan, D. Xia, L. Jiang, Characteristics of the catalytic fast pyrolysis of vegetable oil soapstock for hydrocarbon-rich fuel, Energy Convers. Manag.213 (2020) 112860. 10.1016/j.enconman.2020.112860. [18] M.F.P. Ferreira B.F.H. Oliveira W.B.S. Pinheiro N.F. Correa L.F. França N.F.P. Ribeiro Generation of biofuels by slow pyrolysis of palm empty fruit bunches: optimization of process variables and characterization of physical-chemical products Biomass Bioenergy 140 2020 105707 10.1016/j.biombioe.2020.105707 M.F.P. Ferreira, B.F.H. Oliveira, W.B.S. Pinheiro, N.F. Correa, L.F. França, N.F.P. Ribeiro, Generation of biofuels by slow pyrolysis of palm empty fruit bunches: Optimization of process variables and characterization of physical-chemical products. Biomass Bioenergy140 (2020) 105707. doi.org/10.1016/j.biombioe.2020.105707 [19] A.A.F. da Costa L.H.O Pires D. Rodríguez-Padrón A.M. Balu G.N. da Rocha R. Luque L.A.S. do Nascimento Recent advances on catalytic deoxygenation of residues for bio-oil production: an overview J. Mol. Catal. 518 2022 112052 10.1016/j.mcat.2021.112052 A.A.F. da Costa, L.H.O Pires, D. Rodríguez-Padrón, A.M. Balu, G.N. da Rocha, R. Luque, L.A.S. do Nascimento, Recent advances on catalytic deoxygenation of residues for bio-oil production: an overview, J. Mol. Catal.518 (2022) 112052. 10.1016/j.mcat.2021.112052. [20] F.M. Mayer C.M. Teixeira J.G.A. Pacheco C.T.de Souza D.V. Bauer E.B. Caramão J.S. Espíndola J.O. Trierweiler O.W.P. Lopez C.A. Zini Characterization of analytical fast pyrolysis vapors of medium-density fiberboard (mdf) using metal-modified HZSM-5 J. Anal. Appl. Pyrolysis 136 2018 87 95 10.1016/j.jaap.2018.10.019 F.M. Mayer, C.M. Teixeira, J.G.A. Pacheco, C.T.de Souza, D.V. Bauer, E.B. Caramão, J.S. Espíndola, J.O. Trierweiler, O.W.P. Lopez, C.A. Zini, Characterization of analytical fast pyrolysis vapors of medium-density fiberboard (mdf) using metal-modified HZSM-5, J. Anal. Appl. Pyrolysis136 (2018) 87-95. 10.1016/j.jaap.2018.10.019. [21] E.D. Bruce R. Frety C.M. Teixeira C.B.M. Barbosa J.G.A. Pacheco Thermocatalytic cracking kinetics of myristic acid adsorbed on catalysts with different acidity Catal. Today 289 2017 280 288 10.1016/j.cattod.2016.08.026 E.D. Bruce, R. Frety, C.M. Teixeira, C.B.M. Barbosa, J.G.A. Pacheco, Thermocatalytic cracking kinetics of myristic acid adsorbed on catalysts with different acidity, Catal. Today289 (2017) 280-288. 10.1016/j.cattod.2016.08.026. [22] M.R. Santos S. Arias J.F. Padilha M.C.N. Carneiro E.A. Sales J.G.A. Pacheco R. Fréty Catalytic cracking of palmitic and oleic acids pre-adsorbed on γ-alumina Catal. Today 344 2020 234 239 10.1016/j.cattod.2019.04.005 M.R. Santos, S. Arias, J.F. Padilha, M.C.N. Carneiro, E.A. Sales, J.G.A. Pacheco, R. Fréty, Catalytic cracking of palmitic and oleic acids pre-adsorbed on γ-alumina, Catal. Today344 (2020) 234-239. 10.1016/j.cattod.2019.04.005. [23] R. Fréty M.R. Santos R.F. Sales A.O.S. Silva C.B.M. Barbosa J.G.A Pacheco Flash pyrolysis of oleic acid as a model compound adsorbed on supported nickel catalysts for biofuel production J. Braz. Chem. Soc. 25 2014 2433 2443 10.5935/0103-5053.20140270 R. Fréty, M.R. Santos, R.F. Sales, A.O.S. Silva, C.B.M. Barbosa, J.G.A Pacheco, Flash pyrolysis of oleic acid as a model compound adsorbed on supported nickel catalysts for biofuel production, J. Braz. Chem. Soc.25 (2014) 2433-2443. 10.5935/0103-5053.20140270. [24] M.R. Santos R.F. Sales A.O.S. Silva C.M. Teixeira J.G.A. Pacheco R. Fréty Flash pyrolysis of myristic acid adsorbed on supported nickel catalysts for biofuel production J. Therm. Anal. Calorim. 119 2015 1875 1885 10.1007/s10973-014-4375-1 M.R. Santos, R.F. Sales, A.O.S. Silva, C.M. Teixeira, J.G.A. Pacheco, R. Fréty, Flash pyrolysis of myristic acid adsorbed on supported nickel catalysts for biofuel production, J. Therm. Anal. Calorim.119 (2015) 1875–1885. 10.1007/s10973-014-4375-1. [25] S. Arias L.V. Sousa C.B.M. Barbosa A.O.S. Silva R. Fréty J.G.A. Pacheco Preparation of NiAlZr-terephthalate LDHs with high Al and Zr content and their mixed oxides for cyclohexane dehydrogenation Appl. Clay Sci. 166 2018 137 145 10.1016/j.clay.2018.09.020 S. Arias, L.V. Sousa, C.B.M. Barbosa, A.O.S. Silva, R. Fréty, J.G.A. Pacheco, Preparation of NiAlZr-terephthalate LDHs with high Al and Zr content and their mixed oxides for cyclohexane dehydrogenation, Appl. Clay Sci.166 (2018) 137-145. 10.1016/j.clay.2018.09.020. [26] S. Arias J.F. González L.V. Sousa C.B.M. Barbosa A.O.S. Silva R. Fréty J.G.A. Pacheco Influence of Ni/Al ratio on the fast pyrolysis of myristic acid when adsorbed on unsupported mixed oxides derived from layered double hydroxides Catal. Today 381 2021 181 10.1016/j.cattod.2020.07.028 -19 S. Arias, J.F. González, L.V. Sousa, C.B.M. Barbosa, A.O.S. Silva, R. Fréty, J.G.A. Pacheco, Influence of Ni/Al ratio on the fast pyrolysis of myristic acid when adsorbed on unsupported mixed oxides derived from layered double hydroxides, Catal. Today381 (2021) 181-19. 10.1016/j.cattod.2020.07.028. [27] N. Hongloi P. Prapainainar C. Prapainainar Review of green diesel production from fatty acid deoxygenation over Ni-based catalysts J. Mol. Catal. 2021 111696 10.1016/j.mcat.2021.111696 N. Hongloi, P. Prapainainar, C. Prapainainar, Review of green diesel production from fatty acid deoxygenation over Ni-based catalysts, J. Mol. Catal. (2021) 111696. 10.1016/j.mcat.2021.111696. [28] T. Masuda Y. Kondo M. Miwa T. Shimotori S.R. Mukai K. Hashimoto M. Takano S. Kawasaki S. Yoshida Recovery of useful hydrocarbons from oil palm waste using ZrO2 supporting FeOOH catalyst Chem. Eng. Sci. 56 2001 897 904 10.1016/S0009-2509(00)00303-1 T. Masuda, Y. Kondo, M. Miwa, T. Shimotori, S.R. Mukai, K. Hashimoto, M. Takano, S. Kawasaki, S. Yoshida, Recovery of useful hydrocarbons from oil palm waste using ZrO2 supporting FeOOH catalyst, Chem. Eng. Sci.56 (2001) 897-904. 10.1016/S0009-2509(00)00303-1. [29] Y. Pang Y. Wu Y. Chen F. Luo J. Chen Degradation effect of Ce/Al2O3 catalyst on pyrolysis volatility of pine Renew. Energy 162 2020 134 143 10.1016/j.renene.2020.07.125 Y. Pang, Y. Wu, Y. Chen, F. Luo, J. Chen, Degradation effect of Ce/Al2O3 catalyst on pyrolysis volatility of pine, Renew. Energy162 (2020) 134-143. 10.1016/j.renene.2020.07.125. [30] J. Amaya N. Suarez A. Moreno S. Moreno R. Molina Bifunctional catalysts supported on modified vermiculite for the hydroconversion of decane. Effect of the metal phase (Mo or W) and promoters (Ni or Co) Catal. Today 356 2020 271 283 10.1016/j.cattod.2019.11.023 J. Amaya, N. Suarez, A. Moreno, S. Moreno, R. Molina, Bifunctional catalysts supported on modified vermiculite for the hydroconversion of decane. Effect of the metal phase (Mo or W) and promoters (Ni or Co). Catal Today356 (2020) 271-283. 10.1016/j.cattod.2019.11.023 [31] L. Fu Y. Li H. Cui W. Ba Y. Liu Highly stable and selective catalytic deoxygenation of renewable bio-lipids over Ni/CeO2-Al2O3 for N-alkanes Appl. Catal. A Gen. 623 2021 118258 10.1016/j.apcata.2021.118258 L. Fu, Y. Li, H. Cui, W. Ba, Y. Liu, Highly stable and selective catalytic deoxygenation of renewable bio-lipids over Ni/CeO2-Al2O3 for N-alkanes, Appl. Catal. A: Gen.623 (2021) 118258. 10.1016/j.apcata.2021.118258. [32] T. Stroud T.J. Smith E.Le Saché J.L. Santos M.A. Centeno H. Arellano-Garcia J.A. Odriozola T.R. Reina Chemical CO2 recycling via dry and bi reforming of methane using Ni-Sn/Al2O3 and Ni-Sn/CeO2-Al2O3 catalysts Appl. Catal. B 224 2018 125 135 10.1016/j.apcatb.2017.10.047 T. Stroud, T.J. Smith, E. Le Saché, J.L. Santos, M.A. Centeno, H. Arellano-Garcia, J.A. Odriozola, T.R. Reina, Chemical CO2 recycling via dry and bi reforming of methane using Ni-Sn/Al2O3 and Ni-Sn/CeO2-Al2O3 catalysts, Appl. Catal. B224 (2018) 125-135. 10.1016/j.apcatb.2017.10.047. [33] AOCS Ca 5a-40, Official Methods and Recommended Practices of the AOCS 1989 American Oil Chemists' Society Champaign AOCS, Ca 5a-40, Official Methods and Recommended Practices of the AOCS, American Oil Chemists' Society, Champaign, 1989. [34] J.M.F. Almeida-Couto K.K.B. Abrantes N. Stevanato W.R. da Silva A. Wisniewski C. da Silva V.F. Cabral L. Cardozo-Filho Oil recovery from defective coffee beans using pressurized fluid extraction followed by pyrolysis of the residual biomass: sustainable process with zero waste J. Supercrit. Fluids 180 2022 105432 10.1016/j.supflu.2021.105432 J.M.F. Almeida-Couto, K.K.B. Abrantes, N. Stevanato, W.R. da Silva, A. Wisniewski, C. da Silva, V.F. Cabral, L. Cardozo-Filho, Oil recovery from defective coffee beans using pressurized fluid extraction followed by pyrolysis of the residual biomass: Sustainable process with zero waste, J. Supercrit. Fluids180 (2022) 105432. 10.1016/j.supflu.2021.105432. [35] Q. Niu S. Ghysels N. Wu D.P.L. Rousseau J. Pieters W. Prins F. Ronsse Effects of demineralization on the composition of microalgae pyrolysis volatiles in py-GC–MS Energy Convers. Manag. 251 2022 114979 10.1016/j.enconman.2021.114979 Q. Niu, S. Ghysels, N. Wu, D.P.L. Rousseau, J. Pieters, W. Prins, F. Ronsse, Effects of demineralization on the composition of microalgae pyrolysis volatiles in py-GC–MS, Energy Convers. Manag.251 (2022) 114979. 10.1016/j.enconman.2021.114979. [36] Z. Ni H. Bi C. Jiang C. Wang J. Tian W. Zhou H. Sun Q. Lin Investigation of the co-pyrolysis of coal slime and coffee industry residue based on machine learning methods and TG-FTIR: synergistic effect, kinetics and thermodynamic Fuel 305 2021 121527 10.1016/j.fuel.2021.121527 Z. Ni, H. Bi, C. Jiang, C. Wang, J. Tian, W. Zhou, H. Sun, Q. Lin, Investigation of the co-pyrolysis of coal slime and coffee industry residue based on machine learning methods and TG-FTIR: Synergistic effect, kinetics and thermodynamic, Fuel305 (2021) 121527. 10.1016/j.fuel.2021.121527. [37] F. Cavani F. Trifirò A. Vaccari Hydrotalcite-type anionic clays: preparation, properties and applications Catal. Today 11 1991 173 301 10.1016/0920-5861(91)80068-K F. Cavani, F. Trifirò, A. Vaccari, Hydrotalcite-type anionic clays: preparation, properties and applications, Catal. Today11 (1991) 173-301. 10.1016/0920-5861(91)80068-K. [38] S.P. Newman S.J. Williams P.V. Coveney W. Jones Interlayer arrangement of hydrated MgAl layered double hydroxides containing guest terephthalate anions: comparison of simulation and measurement J. Phys. Chem. B 102 1998 6710 6719 10.1021/jp981426r S.P. Newman, S.J. Williams, P.V. Coveney, W. Jones, Interlayer arrangement of hydrated MgAl layered double hydroxides containing guest terephthalate anions: comparison of simulation and measurement, J. Phys. Chem. B102 (1998) 6710–6719. 10.1021/jp981426r [39] Y. Shen D. Liu L. Fan S. Li L. Gao Simultaneous incorporation of palladium and zirconium ions in Mg–Al layered double hydroxides by co-precipitation Appl. Clay Sci. 54 2011 179 183 10.1016/j.clay.2011.08.007 Y. Shen, D. Liu, L. Fan, S. Li, L. Gao, Simultaneous incorporation of palladium and zirconium ions in Mg–Al layered double hydroxides by co-precipitation, Appl. Clay Sci.54, (2011) 179-183. 10.1016/j.clay.2011.08.007. [40] L.J. Aguilera L.A. Palacio A.C. Faro Synthesis of NiAl layered double hydroxides intercalated with aliphatic dibasic anions and their exchange with heptamolybdate Appl. Clay Sci. 176 2019 29 37 10.1016/j.clay.2019.04.021 L.J. Aguilera, L.A. Palacio, A.C. Faro, Synthesis of NiAl layered double hydroxides intercalated with aliphatic dibasic anions and their exchange with heptamolybdate, Appl. Clay Sci.176 (2019) 29-37. 10.1016/j.clay.2019.04.021. [41] M. Jitianu A. Jitianu M. Zaharescu D. Crisan R. Marchidan IR structural evidence of hydrotalcites derived oxidic forms Vib. Spectrosc. 22 2000 75 86 10.1016/S0924-2031(99)00067-3 M. Jitianu, A. Jitianu, M. Zaharescu, D. Crisan, R. Marchidan, IR structural evidence of hydrotalcites derived oxidic forms, Vib. Spectrosc.22 (2000) 75-86. 10.1016/S0924-2031(99)00067-3. [42] T. Coelho R. Micha S. Arias Y.E. Licea L.A. Palacio A.C. Faro Influence of the Mg2+ or Mn2+ contents on the structure of NiMnAl and CoMgAl hydrotalcite materials with high aluminum contents Catal. Today 250 2015 87 94 10.1016/j.cattod.2014.07.015 T. Coelho, R. Micha, S. Arias, Y.E. Licea, L.A. Palacio, A.C. Faro, Influence of the Mg2+ or Mn2+ contents on the structure of NiMnAl and CoMgAl hydrotalcite materials with high aluminum contents, Catal. Today250 (2015) 87–94. 10.1016/j.cattod.2014.07.015. [43] M. Thommes K. Kaneko A.V. Neimark J.P. Olivier F. Rodriguez-Reinoso J. Rouquerol K.S.W. Sing Physisorption of gases, with special reference to the evaluation of surface area and pore size distribution (IUPAC Technical Report) Pure Appl. Chem. 2015 10.1515/pac-2014-1117 M. Thommes, K. Kaneko, A.V. Neimark, J.P. Olivier, F. Rodriguez-Reinoso, J. Rouquerol, K.S.W. Sing, Physisorption of gases, with special reference to the evaluation of surface area and pore size distribution (IUPAC Technical Report), Pure Appl. Chem. (2015). 10.1515/pac-2014-1117 [44] C.E. Daza J. Gallego J.A. Moreno F. Mondragón S. Moreno R. Molina CO2 reforming of methane over Ni/Mg/Al/Ce mixed oxides Catal. Today 133–135 2008 357 366 10.1016/j.cattod.2007.12.081 C.E. Daza, J. Gallego, J.A. Moreno, F. Mondragón, S. Moreno, R. Molina, CO2 reforming of methane over Ni/Mg/Al/Ce mixed oxides, Catal. Today133–135 (2008) 357–366. 10.1016/j.cattod.2007.12.081. [45] S. Li M. Li C. Zhang S. Wang X. Ma J. Gong Steam reforming of ethanol over Ni/ZrO2 catalysts: effect of support on product distribution Int. J. Hydrog. Energy 37 2012 2940 2949 10.1016/j.ijhydene.2011.01.009 S. Li, M. Li, C. Zhang, S. Wang, X. Ma, J. Gong, Steam reforming of ethanol over Ni/ZrO2 catalysts: effect of support on product distribution, Int. J. Hydrog. Energy37 (2012) 2940-2949. 10.1016/j.ijhydene.2011.01.009. [46] S. Banerjee S. Sahani Y.C. Sharma Process dynamic investigations and emission analyses of biodiesel produced using Sr–Ce mixed metal oxide heterogeneous catalyst J. Environ. Manag. 248 2019 109218 10.1016/j.jenvman.2019.06.119 S. Banerjee, S. Sahani, Y. C. Sharma, Process dynamic investigations and emission analyses of biodiesel produced using Sr–Ce mixed metal oxide heterogeneous catalyst, J. Environ. Manag.248 (2019) 109218. 10.1016/j.jenvman.2019.06.119. [47] F.N. Arslan F. Çağlar Attenuated total reflectance–fourier transform infrared (ATR–FTIR) spectroscopy combined with chemometrics for rapid determination of cold-pressed wheat germ oil adulteration Food Anal. Methods 12 2019 355 370 10.1007/s12161-018-1368-x F.N. Arslan, F. Çağlar, Attenuated total reflectance–fourier transform infrared (ATR–FTIR) spectroscopy combined with chemometrics for rapid determination of cold-pressed wheat germ oil adulteration. Food Anal. Methods12 (2019) 355–370. 10.1007/s12161-018-1368-x [48] M.K. Maher K.M. Kirkwood M.R. Gray D.C. Bressler Pyrolytic decarboxylation and cracking of stearic acid Ind. Eng. Chem. Res. 47 2008 5328 5336 10.1021/ie0714551 M.K. Maher, K.M. Kirkwood, M.R. Gray, D.C. Bressler, Pyrolytic decarboxylation and cracking of stearic acid. Ind. Eng. Chem. Res.47 (2008) 5328–5336. 10.1021/ie0714551 [49] A. Kubátová J. Št’ávová W.S. Seames Y. Luo S.M. Sadrameli M.J. Linnen G.V. Baglayeva I.P. Smoliakova E.I. Kozliak Triacylglyceride thermal cracking: pathways to cyclic hydrocarbons Energy Fuels 26 2012 672 685 10.1021/ef200953d A. Kubátová, J. Št’ávová, W.S. Seames, Y. Luo, S.M. Sadrameli, M.J. Linnen, G.V. Baglayeva, I.P. Smoliakova, E.I. Kozliak, Triacylglyceride thermal cracking: pathways to cyclic hydrocarbons, Energy Fuels26 (2012) 672–685. 10.1021/ef200953d [50] M. Guisnet P. Magnoux Organic chemistry of coke formation Appl. Catal. A 212 2001 83 96 10.1016/S0926-860X(00)00845-0 M. Guisnet, P. Magnoux, Organic chemistry of coke formation. Appl. Catal. A212 (2001) 83–96. 10.1016/S0926-860X(00)00845-0. [51] J.F. Padilha R. Frety A.P. Santos L.A.M. Pontes M.R. Santos S. Arias J.G.A. Pacheco Deoxygenation of oleic acid methyl ester in FCC process conditions over protonated and sodium exchanged Y and ZSM-5 zeolites Waste Biomass Valor 13 2022 185 194 10.1007/s12649-021-01505-y J.F. Padilha, R. Frety, A.P. Santos, L.A.M. Pontes, M.R. Santos, S. Arias, J.G.A. Pacheco, Deoxygenation of oleic acid methyl ester in FCC process conditions over protonated and sodium exchanged Y and ZSM-5 zeolites. Waste Biomass Valor13 (2022) 185–194. 10.1007/s12649-021-01505-y [52] S.J. Patil P.D. Vaidya Catalytic hydrotreatment of jatropha oil over lanthanum hydroxide supported noble metals: effect of promotion with cerium ChemistrySelect 35 2017 11918 11925 10.1002/slct.201702258 S.J. Patil, P.D. Vaidya, Catalytic hydrotreatment of jatropha oil over lanthanum hydroxide supported noble metals: effect of promotion with cerium, ChemistrySelect35 (2017) 11918-11925. 10.1002/slct.201702258 [53] K.W. Jeon H.S. Na Y.L. Lee S.Y. Ahn K.J. Kim J.O. Shim W.J. Jang D.W. Jeong I.W. Nah H.S. Roh Catalytic deoxygenation of oleic acid over a Ni-CeZrO2 catalyst Fuel 258 2019 116179 10.1016/j.fuel.2019.116179 K.W. Jeon, H.S. Na, Y.L. Lee, S.Y. Ahn, K.J. Kim, J.O. Shim, W.J. Jang, D.W. Jeong, I.W. Nah, H.S. Roh, Catalytic deoxygenation of oleic acid over a Ni-CeZrO2 catalyst, Fuel258 (2019) 116179. 10.1016/j.fuel.2019.116179. [54] T.K. Phung A.A. Casazza P. Perego P. Capranica G. Busca Catalytic pyrolysis of vegetable oils to biofuels: catalyst functionalities and the role of ketonization on the oxygenate paths Fuel Process. Technol. 140 2015 119 124 10.1016/j.fuproc.2015.08.042 T.K. Phung, A.A. Casazza, P. Perego, P. Capranica, G. Busca, Catalytic pyrolysis of vegetable oils to biofuels: catalyst functionalities and the role of ketonization on the oxygenate paths, Fuel Process. Technol.140 (2015) 119-124. 10.1016/j.fuproc.2015.08.042",
      "scopus-id": "85135157503",
      "coredata": {
        "eid": "1-s2.0-S2468823122004400",
        "dc:description": "High acidic vegetable oil feedstocks and wastes are not suitable for conventional biodiesel production. These wastes could be used to produce cheap hydrocarbon-rich biofuels without affecting food production. In this work, we studied the hydrogen-free fast pyrolysis and deoxygenation of an acidic industrial vegetable oil waste for biofuels and chemicals production, assessing the effect of Ce or Zr on NiAl mixed oxides obtained from layered double hydroxides. Oily waste (OW) was pre-adsorbed on the catalysts using a Catalyst:OW mass ratio of 5:1. Without a catalyst, pyrolysis of OW, containing triglycerides and a high percentage of free fatty acids, produced mainly 1-alkenes, lower carbon chain fatty acids, and fatty acid esters. Catalytic pyrolysis increased hydrocarbons favoring 1-alkenes between propene and 1-heptadecene, as well as alkyl-benzenes. Linear alkylbenzenes are feedstock for the production of biodegradable surfactants. NiAlCe was most selective to polyenes, alkanes and ketones, while NiAl and NiAlZr catalysts were efficient in producing aromatics, alkenes and light hydrocarbons in the GLP and gasoline range (C3-C10). The combination of acidic and metallic properties on high surface area unsupported bulk mixed oxide catalysts can be used to maximize the production of specific-range hydrocarbons for second-generation drop-in biofuels and bio-based surfactant precursors, towards the decarbonization of industry.",
        "openArchiveArticle": "false",
        "prism:coverDate": "2022-08-31",
        "openaccessUserLicense": null,
        "prism:aggregationType": "Journal",
        "prism:url": "https://api.elsevier.com/content/article/pii/S2468823122004400",
        "dc:creator": [
          {
            "@_fa": "true",
            "$": "Arias, Santiago"
          },
          {
            "@_fa": "true",
            "$": "Vascocelos, Danilo Pontes"
          },
          {
            "@_fa": "true",
            "$": "Libório, Denisson de Oliveira"
          },
          {
            "@_fa": "true",
            "$": "Gonzalez, Juan Felipe"
          },
          {
            "@_fa": "true",
            "$": "Câmara, Alan G."
          },
          {
            "@_fa": "true",
            "$": "Barbosa, Celmy M.B.M."
          },
          {
            "@_fa": "true",
            "$": "Fréty, Roger"
          },
          {
            "@_fa": "true",
            "$": "Pacheco, Jose Geraldo A."
          }
        ],
        "link": [
          {
            "@_fa": "true",
            "@rel": "self",
            "@href": "https://api.elsevier.com/content/article/pii/S2468823122004400"
          },
          {
            "@_fa": "true",
            "@rel": "scidir",
            "@href": "https://www.sciencedirect.com/science/article/pii/S2468823122004400"
          }
        ],
        "dc:format": "application/json",
        "openaccessType": null,
        "pii": "S2468-8231(22)00440-0",
        "prism:volume": "529",
        "articleNumber": "112554",
        "prism:publisher": "Elsevier B.V.",
        "dc:title": "Hydrogen-free deoxygenation of industrial vegetable oil waste using Ce, Zr-NiAl catalysts for second-generation biofuels production",
        "prism:copyright": "© 2022 Elsevier B.V. All rights reserved.",
        "openaccess": "0",
        "prism:issn": "24688231",
        "dcterms:subject": [
          {
            "@_fa": "true",
            "$": "Cracking"
          },
          {
            "@_fa": "true",
            "$": "Oil residue"
          },
          {
            "@_fa": "true",
            "$": "Layered double hydroxides"
          },
          {
            "@_fa": "true",
            "$": "Pyrolysis"
          },
          {
            "@_fa": "true",
            "$": "Unsupported catalysts"
          }
        ],
        "openaccessArticle": "false",
        "prism:publicationName": "Molecular Catalysis",
        "openaccessSponsorType": null,
        "prism:pageRange": "112554",
        "pubType": "fla",
        "prism:coverDisplayDate": "August 2022",
        "prism:doi": "10.1016/j.mcat.2022.112554",
        "prism:startingPage": "112554",
        "dc:identifier": "doi:10.1016/j.mcat.2022.112554",
        "openaccessSponsorName": null
      },
      "objects": {
        "object": [
          {
            "@category": "standard",
            "@height": "299",
            "@width": "391",
            "@_fa": "true",
            "$": "https://api.elsevier.com/content/object/eid/1-s2.0-S2468823122004400-gr9.jpg?httpAccept=%2A%2F%2A",
            "@multimediatype": "JPEG image file",
            "@type": "IMAGE-DOWNSAMPLED",
            "@size": "28241",
            "@ref": "gr9",
            "@mimetype": "image/jpeg"
          },
          {
            "@category": "standard",
            "@height": "291",
            "@width": "391",
            "@_fa": "true",
            "$": "https://api.elsevier.com/content/object/eid/1-s2.0-S2468823122004400-gr8.jpg?httpAccept=%2A%2F%2A",
            "@multimediatype": "JPEG image file",
            "@type": "IMAGE-DOWNSAMPLED",
            "@size": "28379",
            "@ref": "gr8",
            "@mimetype": "image/jpeg"
          },
          {
            "@category": "standard",
            "@height": "290",
            "@width": "391",
            "@_fa": "true",
            "$": "https://api.elsevier.com/content/object/eid/1-s2.0-S2468823122004400-gr7.jpg?httpAccept=%2A%2F%2A",
            "@multimediatype": "JPEG image file",
            "@type": "IMAGE-DOWNSAMPLED",
            "@size": "28373",
            "@ref": "gr7",
            "@mimetype": "image/jpeg"
          },
          {
            "@category": "standard",
            "@height": "307",
            "@width": "391",
            "@_fa": "true",
            "$": "https://api.elsevier.com/content/object/eid/1-s2.0-S2468823122004400-gr6.jpg?httpAccept=%2A%2F%2A",
            "@multimediatype": "JPEG image file",
            "@type": "IMAGE-DOWNSAMPLED",
            "@size": "41737",
            "@ref": "gr6",
            "@mimetype": "image/jpeg"
          },
          {
            "@category": "standard",
            "@height": "293",
            "@width": "391",
            "@_fa": "true",
            "$": "https://api.elsevier.com/content/object/eid/1-s2.0-S2468823122004400-gr10.jpg?httpAccept=%2A%2F%2A",
            "@multimediatype": "JPEG image file",
            "@type": "IMAGE-DOWNSAMPLED",
            "@size": "27167",
            "@ref": "gr10",
            "@mimetype": "image/jpeg"
          },
          {
            "@category": "standard",
            "@height": "325",
            "@width": "391",
            "@_fa": "true",
            "$": "https://api.elsevier.com/content/object/eid/1-s2.0-S2468823122004400-gr1.jpg?httpAccept=%2A%2F%2A",
            "@multimediatype": "JPEG image file",
            "@type": "IMAGE-DOWNSAMPLED",
            "@size": "36071",
            "@ref": "gr1",
            "@mimetype": "image/jpeg"
          },
          {
            "@category": "standard",
            "@height": "310",
            "@width": "391",
            "@_fa": "true",
            "$": "https://api.elsevier.com/content/object/eid/1-s2.0-S2468823122004400-gr5.jpg?httpAccept=%2A%2F%2A",
            "@multimediatype": "JPEG image file",
            "@type": "IMAGE-DOWNSAMPLED",
            "@size": "37592",
            "@ref": "gr5",
            "@mimetype": "image/jpeg"
          },
          {
            "@category": "standard",
            "@height": "342",
            "@width": "489",
            "@_fa": "true",
            "$": "https://api.elsevier.com/content/object/eid/1-s2.0-S2468823122004400-gr4.jpg?httpAccept=%2A%2F%2A",
            "@multimediatype": "JPEG image file",
            "@type": "IMAGE-DOWNSAMPLED",
            "@size": "72948",
            "@ref": "gr4",
            "@mimetype": "image/jpeg"
          },
          {
            "@category": "standard",
            "@height": "298",
            "@width": "602",
            "@_fa": "true",
            "$": "https://api.elsevier.com/content/object/eid/1-s2.0-S2468823122004400-gr3.jpg?httpAccept=%2A%2F%2A",
            "@multimediatype": "JPEG image file",
            "@type": "IMAGE-DOWNSAMPLED",
            "@size": "53600",
            "@ref": "gr3",
            "@mimetype": "image/jpeg"
          },
          {
            "@category": "standard",
            "@height": "315",
            "@width": "391",
            "@_fa": "true",
            "$": "https://api.elsevier.com/content/object/eid/1-s2.0-S2468823122004400-gr2.jpg?httpAccept=%2A%2F%2A",
            "@multimediatype": "JPEG image file",
            "@type": "IMAGE-DOWNSAMPLED",
            "@size": "36558",
            "@ref": "gr2",
            "@mimetype": "image/jpeg"
          },
          {
            "@category": "standard",
            "@height": "115",
            "@width": "301",
            "@_fa": "true",
            "$": "https://api.elsevier.com/content/object/eid/1-s2.0-S2468823122004400-ga1.jpg?httpAccept=%2A%2F%2A",
            "@multimediatype": "JPEG image file",
            "@type": "IMAGE-DOWNSAMPLED",
            "@size": "15580",
            "@ref": "ga1",
            "@mimetype": "image/jpeg"
          },
          {
            "@category": "thumbnail",
            "@height": "163",
            "@width": "214",
            "@_fa": "true",
            "$": "https://api.elsevier.com/content/object/eid/1-s2.0-S2468823122004400-gr9.sml?httpAccept=%2A%2F%2A",
            "@multimediatype": "GIF image file",
            "@type": "IMAGE-THUMBNAIL",
            "@size": "9985",
            "@ref": "gr9",
            "@mimetype": "image/gif"
          },
          {
            "@category": "thumbnail",
            "@height": "163",
            "@width": "219",
            "@_fa": "true",
            "$": "https://api.elsevier.com/content/object/eid/1-s2.0-S2468823122004400-gr8.sml?httpAccept=%2A%2F%2A",
            "@multimediatype": "GIF image file",
            "@type": "IMAGE-THUMBNAIL",
            "@size": "10185",
            "@ref": "gr8",
            "@mimetype": "image/gif"
          },
          {
            "@category": "thumbnail",
            "@height": "162",
            "@width": "219",
            "@_fa": "true",
            "$": "https://api.elsevier.com/content/object/eid/1-s2.0-S2468823122004400-gr7.sml?httpAccept=%2A%2F%2A",
            "@multimediatype": "GIF image file",
            "@type": "IMAGE-THUMBNAIL",
            "@size": "9861",
            "@ref": "gr7",
            "@mimetype": "image/gif"
          },
          {
            "@category": "thumbnail",
            "@height": "164",
            "@width": "209",
            "@_fa": "true",
            "$": "https://api.elsevier.com/content/object/eid/1-s2.0-S2468823122004400-gr6.sml?httpAccept=%2A%2F%2A",
            "@multimediatype": "GIF image file",
            "@type": "IMAGE-THUMBNAIL",
            "@size": "10370",
            "@ref": "gr6",
            "@mimetype": "image/gif"
          },
          {
            "@category": "thumbnail",
            "@height": "164",
            "@width": "219",
            "@_fa": "true",
            "$": "https://api.elsevier.com/content/object/eid/1-s2.0-S2468823122004400-gr10.sml?httpAccept=%2A%2F%2A",
            "@multimediatype": "GIF image file",
            "@type": "IMAGE-THUMBNAIL",
            "@size": "9736",
            "@ref": "gr10",
            "@mimetype": "image/gif"
          },
          {
            "@category": "thumbnail",
            "@height": "164",
            "@width": "197",
            "@_fa": "true",
            "$": "https://api.elsevier.com/content/object/eid/1-s2.0-S2468823122004400-gr1.sml?httpAccept=%2A%2F%2A",
            "@multimediatype": "GIF image file",
            "@type": "IMAGE-THUMBNAIL",
            "@size": "9904",
            "@ref": "gr1",
            "@mimetype": "image/gif"
          },
          {
            "@category": "thumbnail",
            "@height": "164",
            "@width": "207",
            "@_fa": "true",
            "$": "https://api.elsevier.com/content/object/eid/1-s2.0-S2468823122004400-gr5.sml?httpAccept=%2A%2F%2A",
            "@multimediatype": "GIF image file",
            "@type": "IMAGE-THUMBNAIL",
            "@size": "9323",
            "@ref": "gr5",
            "@mimetype": "image/gif"
          },
          {
            "@category": "thumbnail",
            "@height": "153",
            "@width": "219",
            "@_fa": "true",
            "$": "https://api.elsevier.com/content/object/eid/1-s2.0-S2468823122004400-gr4.sml?httpAccept=%2A%2F%2A",
            "@multimediatype": "GIF image file",
            "@type": "IMAGE-THUMBNAIL",
            "@size": "17546",
            "@ref": "gr4",
            "@mimetype": "image/gif"
          },
          {
            "@category": "thumbnail",
            "@height": "108",
            "@width": "219",
            "@_fa": "true",
            "$": "https://api.elsevier.com/content/object/eid/1-s2.0-S2468823122004400-gr3.sml?httpAccept=%2A%2F%2A",
            "@multimediatype": "GIF image file",
            "@type": "IMAGE-THUMBNAIL",
            "@size": "9263",
            "@ref": "gr3",
            "@mimetype": "image/gif"
          },
          {
            "@category": "thumbnail",
            "@height": "164",
            "@width": "203",
            "@_fa": "true",
            "$": "https://api.elsevier.com/content/object/eid/1-s2.0-S2468823122004400-gr2.sml?httpAccept=%2A%2F%2A",
            "@multimediatype": "GIF image file",
            "@type": "IMAGE-THUMBNAIL",
            "@size": "9560",
            "@ref": "gr2",
            "@mimetype": "image/gif"
          },
          {
            "@category": "thumbnail",
            "@height": "84",
            "@width": "219",
            "@_fa": "true",
            "$": "https://api.elsevier.com/content/object/eid/1-s2.0-S2468823122004400-ga1.sml?httpAccept=%2A%2F%2A",
            "@multimediatype": "GIF image file",
            "@type": "IMAGE-THUMBNAIL",
            "@size": "8801",
            "@ref": "ga1",
            "@mimetype": "image/gif"
          },
          {
            "@category": "high",
            "@height": "1324",
            "@width": "1733",
            "@_fa": "true",
            "$": "https://api.elsevier.com/content/object/eid/1-s2.0-S2468823122004400-gr9_lrg.jpg?httpAccept=%2A%2F%2A",
            "@multimediatype": "JPEG image file",
            "@type": "IMAGE-HIGH-RES",
            "@size": "221356",
            "@ref": "gr9",
            "@mimetype": "image/jpeg"
          },
          {
            "@category": "high",
            "@height": "1289",
            "@width": "1733",
            "@_fa": "true",
            "$": "https://api.elsevier.com/content/object/eid/1-s2.0-S2468823122004400-gr8_lrg.jpg?httpAccept=%2A%2F%2A",
            "@multimediatype": "JPEG image file",
            "@type": "IMAGE-HIGH-RES",
            "@size": "215794",
            "@ref": "gr8",
            "@mimetype": "image/jpeg"
          },
          {
            "@category": "high",
            "@height": "1284",
            "@width": "1733",
            "@_fa": "true",
            "$": "https://api.elsevier.com/content/object/eid/1-s2.0-S2468823122004400-gr7_lrg.jpg?httpAccept=%2A%2F%2A",
            "@multimediatype": "JPEG image file",
            "@type": "IMAGE-HIGH-RES",
            "@size": "209098",
            "@ref": "gr7",
            "@mimetype": "image/jpeg"
          },
          {
            "@category": "high",
            "@height": "1360",
            "@width": "1733",
            "@_fa": "true",
            "$": "https://api.elsevier.com/content/object/eid/1-s2.0-S2468823122004400-gr6_lrg.jpg?httpAccept=%2A%2F%2A",
            "@multimediatype": "JPEG image file",
            "@type": "IMAGE-HIGH-RES",
            "@size": "360358",
            "@ref": "gr6",
            "@mimetype": "image/jpeg"
          },
          {
            "@category": "high",
            "@height": "1299",
            "@width": "1733",
            "@_fa": "true",
            "$": "https://api.elsevier.com/content/object/eid/1-s2.0-S2468823122004400-gr10_lrg.jpg?httpAccept=%2A%2F%2A",
            "@multimediatype": "JPEG image file",
            "@type": "IMAGE-HIGH-RES",
            "@size": "216075",
            "@ref": "gr10",
            "@mimetype": "image/jpeg"
          },
          {
            "@category": "high",
            "@height": "1440",
            "@width": "1733",
            "@_fa": "true",
            "$": "https://api.elsevier.com/content/object/eid/1-s2.0-S2468823122004400-gr1_lrg.jpg?httpAccept=%2A%2F%2A",
            "@multimediatype": "JPEG image file",
            "@type": "IMAGE-HIGH-RES",
            "@size": "296412",
            "@ref": "gr1",
            "@mimetype": "image/jpeg"
          },
          {
            "@category": "high",
            "@height": "1373",
            "@width": "1733",
            "@_fa": "true",
            "$": "https://api.elsevier.com/content/object/eid/1-s2.0-S2468823122004400-gr5_lrg.jpg?httpAccept=%2A%2F%2A",
            "@multimediatype": "JPEG image file",
            "@type": "IMAGE-HIGH-RES",
            "@size": "309560",
            "@ref": "gr5",
            "@mimetype": "image/jpeg"
          },
          {
            "@category": "high",
            "@height": "1516",
            "@width": "2167",
            "@_fa": "true",
            "$": "https://api.elsevier.com/content/object/eid/1-s2.0-S2468823122004400-gr4_lrg.jpg?httpAccept=%2A%2F%2A",
            "@multimediatype": "JPEG image file",
            "@type": "IMAGE-HIGH-RES",
            "@size": "1080472",
            "@ref": "gr4",
            "@mimetype": "image/jpeg"
          },
          {
            "@category": "high",
            "@height": "1319",
            "@width": "2667",
            "@_fa": "true",
            "$": "https://api.elsevier.com/content/object/eid/1-s2.0-S2468823122004400-gr3_lrg.jpg?httpAccept=%2A%2F%2A",
            "@multimediatype": "JPEG image file",
            "@type": "IMAGE-HIGH-RES",
            "@size": "411027",
            "@ref": "gr3",
            "@mimetype": "image/jpeg"
          },
          {
            "@category": "high",
            "@height": "1396",
            "@width": "1733",
            "@_fa": "true",
            "$": "https://api.elsevier.com/content/object/eid/1-s2.0-S2468823122004400-gr2_lrg.jpg?httpAccept=%2A%2F%2A",
            "@multimediatype": "JPEG image file",
            "@type": "IMAGE-HIGH-RES",
            "@size": "320575",
            "@ref": "gr2",
            "@mimetype": "image/jpeg"
          },
          {
            "@category": "high",
            "@height": "511",
            "@width": "1333",
            "@_fa": "true",
            "$": "https://api.elsevier.com/content/object/eid/1-s2.0-S2468823122004400-ga1_lrg.jpg?httpAccept=%2A%2F%2A",
            "@multimediatype": "JPEG image file",
            "@type": "IMAGE-HIGH-RES",
            "@size": "95681",
            "@ref": "ga1",
            "@mimetype": "image/jpeg"
          },
          {
            "@category": "standard",
            "@_fa": "true",
            "$": "https://api.elsevier.com/content/object/eid/1-s2.0-S2468823122004400-mmc1.docx?httpAccept=%2A%2F%2A",
            "@multimediatype": "Microsoft Word file",
            "@type": "APPLICATION",
            "@size": "449860",
            "@ref": "mmc1",
            "@mimetype": "application/word"
          },
          {
            "@category": "thumbnail",
            "@_fa": "true",
            "$": "https://api.elsevier.com/content/object/eid/1-s2.0-S2468823122004400-si1.svg?httpAccept=%2A%2F%2A",
            "@multimediatype": "Scalable Vector Graphics file",
            "@type": "ALTIMG",
            "@size": "10121",
            "@ref": "si1",
            "@mimetype": "image/svg+xml"
          },
          {
            "@category": "thumbnail",
            "@_fa": "true",
            "$": "https://api.elsevier.com/content/object/eid/1-s2.0-S2468823122004400-si2.svg?httpAccept=%2A%2F%2A",
            "@multimediatype": "Scalable Vector Graphics file",
            "@type": "ALTIMG",
            "@size": "13238",
            "@ref": "si2",
            "@mimetype": "image/svg+xml"
          },
          {
            "@category": "thumbnail",
            "@_fa": "true",
            "$": "https://api.elsevier.com/content/object/eid/1-s2.0-S2468823122004400-si3.svg?httpAccept=%2A%2F%2A",
            "@multimediatype": "Scalable Vector Graphics file",
            "@type": "ALTIMG",
            "@size": "9474",
            "@ref": "si3",
            "@mimetype": "image/svg+xml"
          },
          {
            "@category": "standard",
            "@_fa": "true",
            "$": "https://api.elsevier.com/content/object/eid/1-s2.0-S2468823122004400-am.pdf?httpAccept=%2A%2F%2A",
            "@multimediatype": "Acrobat PDF file",
            "@type": "AAM-PDF",
            "@size": "2343292",
            "@ref": "am",
            "@mimetype": "application/pdf"
          }
        ]
      },
      "link": {
        "@rel": "abstract",
        "@href": "https://api.elsevier.com/content/abstract/scopus_id/85135157503"
      }
    }
  }
}