{
  "metadata": {
    "title": "Towards sustainable catalysts in hydrodeoxygenation of algae-derived oils: A critical review",
    "authors": "; ; ",
    "journal": "Molecular Catalysis",
    "date": "2022-05-31",
    "doi": "10.1016/j.mcat.2022.112131",
    "abstract": "",
    "uri": "https://api.elsevier.com/content/article/pii/S2468823122000190",
    "pii": "S2468823122000190"
  },
  "fulltext": {
    "full-text-retrieval-response": {
      "scopus-eid": "2-s2.0-85123160297",
      "originalText": "serial JL 315758 291210 291744 291790 291809 31 Molecular Catalysis MOLECULARCATALYSIS 2022-01-20 2022-01-20 2022-04-25 2022-04-25 2022-04-25T12:00:19 1-s2.0-S2468823122000190 S2468-8231(22)00019-0 S2468823122000190 10.1016/j.mcat.2022.112131 S300 S300.1 FULL-TEXT 1-s2.0-S2468823122X00060 2022-12-12T23:36:31.133437Z 0 0 20220501 20220531 2022 2022-01-20T22:39:48.828725Z absattachment articleinfo articlenumber articletitlenorm authfirstinitialnorm authfirstsurnamenorm cid cids contenttype copyright crossmark dateloaded dateloadedtxt datesearch datesort dateupdated dco docsubtype doctype doi eid ewtransactionid hubeid indexeddate issn issnnorm itemstage itemtransactionid itemweight openaccess openarchive pg pgfirst pii piinorm pubdateend pubdatestart pubdatetxt pubyr sortorder srctitle srctitlenorm srctype ssids alllist content subj subheadings suppl tomb volfirst volissue volumelist webpdf webpdfpagecount yearnav figure table body mmlmath acknowledge affil articletitle auth authfirstini authfull authkeywords authlast highlightsabst primabst ref specialabst 2468-8231 24688231 true 523 523 C Volume 523 5 112131 112131 112131 202205 May 2022 2022-05-01 2022-05-31 2022 article fla © 2022 Elsevier B.V. All rights reserved. TOWARDSSUSTAINABLECATALYSTSINHYDRODEOXYGENATIONALGAEDERIVEDOILSACRITICALREVIEW GALADIMA A 1 Introduction 2 Algae-derived oils production 2.1 Direct extraction methods 2.2 Reaction methods 3 Hydrodeoxygenation (HDO) of algae-derived oils 3.1 HDO of model compounds in algae oils 3.2 HDO of real algae-derived oil feeds 4 The role of sulfidation on HDO catalysts 5 Peculiarities of phosphorous modification 6 Stability of catalysts in water/steam: hydrothermal HDO 7 Conclusions and outlook CRediT authorship contribution statement Acknowledgment References YAN 2019 115620 C HENRIQUES 2018 30 44 I KIBRIA 2019 253 264 A HALCOUSSIS 2019 669 674 D MARTINS 2018 107 111 F MURAZA 2015 219 231 O TYMOSZUK 2019 116 126 M SAFARIAN 2019 378 391 S YANG 2019 926 945 J DAVE 2019 101606 N PRADHAN 2018 215 232 P AHMAD 2018 108 124 F MALLADI 2018 587 599 K HU 2019 109 143 X DHYANI 2018 695 716 V AZEVEDO 2019 1107 1125 S MURAZA 2015 1196 1216 O GALADIMA 2015 303 316 A SANCHEZARREOLA 2019 100220 E TABATABAEI 2019 239 303 M LEE 2019 100248 J GALADIMA 2015 338 354 A GALADIMA 2015 12 23 A GALADIMA 2015 7181 7194 A CHAN 2019 105 123 Y GALADIMA 2015 4891 4905 A GALADIMA 2014 72 83 A ZHANG 2019 101434 B SLEGERS 2015 314 322 P BECHET 2017 505 525 Q MICROALGAEBASEDBIOFUELSBIOPRODUCTS 21ENVIRONMENTALIMPACTSFULLSCALEALGAECULTIVATION GALADIMA 2014 72 83 A ZHANG 2019 403 407 M MA 2019 855 860 Z HAN 2019 106140 Y DAVID 2019 104638 E GARY 2007 J PETROLEUMREFININGTECHNOLOGYECONOMICS PAPAVINASAM 2014 41 131 S CORROSIONCONTROLINOILGASINDUSTRY CHAPTER2OILGASINDUSTRYNETWORK PERNALETE 2015 359 364 C COMPUTERAIDEDCHEMICALENGINEERING AMOLECULARRECONSTRUCTIONFEEDCHARACTERIZATIONCAPEOPENIMPLEMENTATIONSTRATEGYDEVELOPATOOLFORMODELINGHDTREACTORSFORLIGHTPETROLEUMCUTS LI 2020 1991 2007 Z ZHAO 2020 194 208 N SHAFAGHAT 2019 159 166 H YANG 2019 65 72 T BROWN 2019 R THERMOCHEMICALPROCESSINGBIOMASSCONVERSIONFUELSCHEMICALSPOWER ADAMS 2018 107 139 P GREENHOUSEGASBALANCESBIOENERGYSYSTEMS CHAPTER8BIOMASSCONVERSIONTECHNOLOGIES BROWN 2010 3639 3646 T JOCZ 2021 171 178 J BARREREMANGOTE 2021 1494 C LEE 2016 28765 H TYMCHYSHYN 2019 115664 M DWIATMOKO 2017 10 16 A KWAK 2019 115666 M DESHMUKH 2019 232 247 S SHI 2019 248 259 R ORTIZMARTINEZ 2019 211 222 V GALLEGO 2019 198 213 R SOVOVA 2019 93 103 H SAHNI 2019 221 231 P HAO 2019 15779 15786 X KUMARI 2019 196 204 N YADAV 2018 1699 1704 G COMPUTERAIDEDCHEMICALENGINEERING PROCESSINTENSIFICATIONALGAEOILEXTRACTIONBIODIESEL MAKAREVICIENE 2019 89 97 V KHOO 2019 121964 C BASKAR 2019 187 210 G ADVANCESINECOFUELSFORASUSTAINABLEENVIRONMENT 7ADVANCESINBIOOILEXTRACTIONNONEDIBLEOILSEEDSALGALBIOMASS VEERANAN 2018 64 73 T PRADANA 2017 277 282 Y GONG 2020 2134 2141 Z LI 2020 643 650 L LI 2020 1761 1771 J GHORBANNEZHAD 2020 663 670 P MUELAS 2019 106149 A ANAND 2016 298 307 V DEBIAGI 2017 423 436 P MAKKAWI 2019 719 730 Y POURKARIMI 2019 104599 S BRIGLJEVIC 2019 1244 1254 B LY 2019 11 22 H DABROS 2018 268 309 T ZHANG 2016 311 317 R CASONI 2016 302 307 A DUAN 2019 121637 X CHOI 2019 153 158 S SHARIFZADEH 2019 1 80 M ZHANG 2021 111438 M KISHIMOTO 1994 479 482 M TOOR 2011 2328 2342 S SAWAYAMA 1995 729 731 S SAWAYAMA 1999 33 39 S XU 2018 103 118 D GUO 2015 242 247 Y ZHOU 2010 4054 4061 D DOTE 1998 157 160 Y GALADIMA 2018 1037 1048 A YU 2011 239 246 G AKHTAR 2011 1615 1624 J BILLER 2011 215 225 P JENA 2012 368 375 U YU 2014 1317 1328 G CHEN 2015 1118 1128 Y XU 2019 165 174 D SHAKYA 2017 1112 1120 R BISWAS 2017 344 350 B YAN 2019 121286 L LIU 2018 156 164 C DING 2021 111492 S TOOR 2013 413 419 S XU 2018 683 689 D HAN 2020 104704 F BIOENERGY 2019 I DIRECTTHERMOCHEMMICALLIQUEFACTION ZHANG 2018 129 137 B PETERSON 2008 32 65 A LEVINE 2013 962 975 R WATSON 2019 189 197 J LI 2018 133 140 H PENG 2017 510 518 X SHI 2012 80 84 N ZHAROVA 2019 18 25 P ZHANG 2014 415 422 H PATTANAIK 2017 545 557 B SONTHALIA 2019 1 17 A ARORA 2018 240 251 P GOMEZ 2019 122 127 J VASQUEZ 2017 197 206 M PEREZCISNEROS 2017 105 122 E OJAGH 2019 85 94 H SZARVAS 2015 245 252 T AREND 2011 198 204 M JENISTOVA 2017 401 409 K BESSE 2016 139 148 X HUANG 2017 25780 25788 Y WANG 2013 1 9 L WANG 2009 242 250 L TIAN 2016 7291 7297 Q HOLLAK 2013 2837 2844 S COUMANS 2017 290 301 A VALENCIA 2019 226 229 D HUANG 2017 8356 8362 Y SHETTY 2015 86 97 M PRASOMSRI 2014 2660 2669 T KUBICKA 2010 199 208 D PALANISAMY 2014 435 440 S SENOL 2007 1 8 O PRIECEL 2011 127 137 P DEBRIMONT 2012 153 164 M SIMAKOVA 2009 100 108 I ARUN 2021 111526 N RUANGUDOMSAKUL 2021 111422 M HACHEMI 2018 2201 2207 I DONNIS 2009 229 240 B SIMACEK 2009 456 460 P HACHEMI 2017 205 221 I JEON 2019 928 933 K SHIM 2015 16 20 J KORDULIS 2016 156 196 C KOCHAPUTI 2021 111425 N MOLCATAL ROLESSUPPORTSREDUCIBILITYACTIVITIESCU3PCATALYSTSFORDEOXYGENATIONOLEICACIDINSITUXRDXASSTUDIES JIANG 2018 343 351 X ZHANG 2018 73 79 X YANG 2021 111681 S XU 2020 111224 Q XIANG 2021 76 88 L SHU 2019 1083 1090 R FELICZAKGUZIK 2019 61 67 A GUAN 2019 61 69 W LEE 2015 33 40 H WU 2019 X FUNKENBUSCH 2019 441 448 L HAN 2019 343 357 G SHU 2019 12 18 R HE 2018 136 145 Z HAIDER 2018 3360 M BAGNATO 2019 199 213 G XIE 2019 65 74 L MARRONE 2018 329 342 P CHEN 2017 8 15 L DUAN 2010 52 61 P ROSS 2010 2234 2243 A BILLER 2015 197 205 P HUBER 2007 7184 7201 G HONGLOI 2021 111696 N BAI 2014 141 149 X DUAN 2015 58 66 P ELLIOTT 2013 445 454 D GUO 2019 168 180 B ELLIOTT 2009 441 449 D SCHMITT 2018 1769 1782 C SANGNIKUL 2019 151 160 P COSTANZO 2016 53 68 W JENSEN 2016 536 543 C LENG 2013 34 37 S XU 2018 D LI 2013 154 163 Z COLLINS 2020 109667 F HIKICHI 2019 82 89 N FU 2019 856 866 W QIAN 2019 192 200 J YOLDI 2019 183 191 M TERNEROHIDALGO 2019 73 79 J WU 2019 163 168 Q HANE 2019 109580 J YITSIEWNG 2019 1935 1941 T SILVA 2019 109684 A ARVINDNARAYAN 2017 260 272 S DARDA 2019 575 588 S DUAN 2016 105 112 P COLE 2016 1828 1840 A VANHAANDEL 2016 27 39 L LELIAS 2009 14 23 M KLIMOV 2010 196 206 O COULIER 2001 26 33 L KISHAN 2000 180 189 G WU 2014 203 210 H GOCHI 2005 531 536 Y MAZOYER 2008 75 79 P CATTANEO 2000 225 236 R VILLARREAL 2015 60 65 A TOPSOE 2005 12 22 H WU 2009 198 206 D THOMAS 1982 241 253 R VANHAANDEL 2017 67 73 L CASTILLOVILLALON 2014 127 136 P HIDALGOHERRADOR 2020 110973 J VO 2018 92 102 T POPOV 2013 176 186 A HE 2012 28 52 Z YANG 2009 242 249 Y HONG 2010 1038 1040 D MORTENSEN 2016 159 170 P GOLUBEVA 2020 1109 1128 M LI 2019 S GUNTLIN 2019 C HUO 2019 J OYAMA 2009 94 107 S ARONSSON 1965 B BORIDESSILICIDESPHOSPHIDESACRITICALREVIEWPREPARATIONPROPERTIESCRYSTALCHEMISTRY BAUDLER 1987 419 441 M OYAMA 2008 14 S ZHANG 2020 71 76 M FEITOSA 2016 154 165 L ZHAO 2011 305 310 H GUAN 2016 467 473 Q BUI 2012 184 198 P KOIKE 2016 115 126 N LY 2017 302 308 H LE 2014 157 163 T LY 2016 545 553 H WHIFFEN 2012 981 990 V CHENG 2007 160 168 R YUN 2017 141 151 G ZHAO 2015 204 216 H GUO 2015 776 790 Y ADENIYI 2018 316 335 O VATUTINA 2019 13 23 Y WU 2014 878 889 S JAIN 2018 4083 4096 V TAN 2020 370 381 Q GALADIMA 2017 42 54 A SABER 2016 918 930 M BWAPWA 2017 1345 1354 J LI 2019 481 497 F RAVENELLE 2010 19582 19595 R BAKARE 2016 93 101 I RYOO 1997 317 320 R CHEN 1993 17 26 C CHEN 1993 27 34 C KIM 1995 16742 16747 J KIM 1996 66 68 J RASLAVICIUS 2014 133 142 L MUNIR 2019 321 332 M SIRAJUNNISA 2016 248 267 A RAVENELLE 2011 R INCREASINGHYDROTHERMALSTABILITYALUMINABASEDCATALYSTS XIONG 2014 4627 4643 H PHAM 2012 13163 13167 H ZAHIR 2006 2874 2880 M JUN 2018 108 114 J LI 2010 48 59 N ESCALONA 2007 218 229 N ARDIYANTI 2011 56 66 A GARCIASANCHO 2015 139 149 C MAO 2017 47 50 J YANG 2019 65 72 T LI 2016 1 11 S LI 2015 68 76 S OUDET 1988 112 120 F HOSSAIN 2009 179 186 M ZHAO 2013 161 169 J SUAREZ 2019 296 303 N WANG 2019 149 154 Y CALABRESE 2014 1341 1350 L GALADIMA 2017 42 54 A DIAZCABANAS 2002 249 257 M BLASCO 1996 2367 2368 T JON 2006 88 95 H ZAPATA 2013 82 97 P KHALIL 2016 1304 1309 U LIU 2017 144 151 X GALADIMAX2022X112131 GALADIMAX2022X112131XA 2024-04-25T00:00:00.000Z 2024-04-25T00:00:00.000Z http://creativecommons.org/licenses/by-nc-nd/4.0/ © 2022 Elsevier B.V. All rights reserved. 0 2022-05-28T06:41:53.971Z http://vtw.elsevier.com/data/voc/AddOnTypes/50.7/aggregated-refined King Fahd University of Petroleum and Minerals KFUPM King Fahd University of Petroleum and Minerals http://data.elsevier.com/vocabulary/SciValFunders/501100004055 http://sws.geonames.org/102358/ Saudi Aramco Saudi Aramco http://data.elsevier.com/vocabulary/SciValFunders/501100007809 http://sws.geonames.org/102358/ Saudi Aramco on Oil Upgrading The authors would like to appreciate the provision of funds by Saudi Aramco for supporting this work as part of the Oil Upgrading theme at King Fahd University of Petroleum and Minerals. O.M. would like to acknowledge a prestigious grant from Saudi Aramco on Oil Upgrading. https://doi.org/10.15223/policy-017 https://doi.org/10.15223/policy-037 https://doi.org/10.15223/policy-012 https://doi.org/10.15223/policy-029 https://doi.org/10.15223/policy-004 item S2468-8231(22)00019-0 S2468823122000190 1-s2.0-S2468823122000190 10.1016/j.mcat.2022.112131 315758 2022-08-08T14:41:28.741125Z 2022-05-01 2022-05-31 1-s2.0-S2468823122000190-main.pdf https://s3-eu-west-1.amazonaws.com/prod-ucs-content-store-eu-west/content/pii:S2468823122000190/MAIN/application/pdf/4d6a5c7a5c5799d1819918aa842e0787/main.pdf main.pdf pdf true 4972933 MAIN 19 1-s2.0-S2468823122000190-main_1.png https://s3-eu-west-1.amazonaws.com/prod-ucs-content-store-eu-west/content/pii:S2468823122000190/PREVIEW/image/png/e56d599c17414b84b2f360ba78183cd9/main_1.png main_1.png png 59635 849 656 IMAGE-WEB-PDF 1 1-s2.0-S2468823122000190-gr9.jpg https://s3-eu-west-1.amazonaws.com/prod-ucs-content-store-eu-west/content/pii:S2468823122000190/gr9/DOWNSAMPLED/image/jpeg/2a8ffb99061d226eb76555f043f9ee6c/gr9.jpg gr9 gr9.jpg jpg 35321 292 565 IMAGE-DOWNSAMPLED 1-s2.0-S2468823122000190-gr8.jpg https://s3-eu-west-1.amazonaws.com/prod-ucs-content-store-eu-west/content/pii:S2468823122000190/gr8/DOWNSAMPLED/image/jpeg/8658ba3d9a9b2d9a3ae92db0784457a0/gr8.jpg gr8 gr8.jpg jpg 11973 195 339 IMAGE-DOWNSAMPLED 1-s2.0-S2468823122000190-gr7.jpg https://s3-eu-west-1.amazonaws.com/prod-ucs-content-store-eu-west/content/pii:S2468823122000190/gr7/DOWNSAMPLED/image/jpeg/3cb4780ae2854ad0be8f44244da05e6a/gr7.jpg gr7 gr7.jpg jpg 39340 384 678 IMAGE-DOWNSAMPLED 1-s2.0-S2468823122000190-gr6.jpg https://s3-eu-west-1.amazonaws.com/prod-ucs-content-store-eu-west/content/pii:S2468823122000190/gr6/DOWNSAMPLED/image/jpeg/93ecf824edfe45e0018614af049584a7/gr6.jpg gr6 gr6.jpg jpg 37063 343 489 IMAGE-DOWNSAMPLED 1-s2.0-S2468823122000190-gr10.jpg https://s3-eu-west-1.amazonaws.com/prod-ucs-content-store-eu-west/content/pii:S2468823122000190/gr10/DOWNSAMPLED/image/jpeg/17023fcea3289d8591fe643f8f0a6067/gr10.jpg gr10 gr10.jpg jpg 84906 457 565 IMAGE-DOWNSAMPLED 1-s2.0-S2468823122000190-gr11.jpg https://s3-eu-west-1.amazonaws.com/prod-ucs-content-store-eu-west/content/pii:S2468823122000190/gr11/DOWNSAMPLED/image/jpeg/1589f454d88044c19acf584dd8539e44/gr11.jpg gr11 gr11.jpg jpg 35850 436 565 IMAGE-DOWNSAMPLED 1-s2.0-S2468823122000190-gr1.jpg https://s3-eu-west-1.amazonaws.com/prod-ucs-content-store-eu-west/content/pii:S2468823122000190/gr1/DOWNSAMPLED/image/jpeg/aee9b35b0fb0ed6ea3e2ec628f9fa34c/gr1.jpg gr1 gr1.jpg jpg 29120 213 376 IMAGE-DOWNSAMPLED 1-s2.0-S2468823122000190-gr5.jpg https://s3-eu-west-1.amazonaws.com/prod-ucs-content-store-eu-west/content/pii:S2468823122000190/gr5/DOWNSAMPLED/image/jpeg/d6810f0ae55fdee6bd7c743c617d86a2/gr5.jpg gr5 gr5.jpg jpg 32728 313 489 IMAGE-DOWNSAMPLED 1-s2.0-S2468823122000190-gr4.jpg https://s3-eu-west-1.amazonaws.com/prod-ucs-content-store-eu-west/content/pii:S2468823122000190/gr4/DOWNSAMPLED/image/jpeg/656a7ab606da4d74e00ebedd93a66c2f/gr4.jpg gr4 gr4.jpg jpg 33439 292 489 IMAGE-DOWNSAMPLED 1-s2.0-S2468823122000190-gr3.jpg https://s3-eu-west-1.amazonaws.com/prod-ucs-content-store-eu-west/content/pii:S2468823122000190/gr3/DOWNSAMPLED/image/jpeg/ae8bac40886b4c6e551ac8f5c9cf1d4d/gr3.jpg gr3 gr3.jpg jpg 33505 352 565 IMAGE-DOWNSAMPLED 1-s2.0-S2468823122000190-gr2.jpg https://s3-eu-west-1.amazonaws.com/prod-ucs-content-store-eu-west/content/pii:S2468823122000190/gr2/DOWNSAMPLED/image/jpeg/89eefe53a7ad461cee0202c1205fe8bd/gr2.jpg gr2 gr2.jpg jpg 18673 252 386 IMAGE-DOWNSAMPLED 1-s2.0-S2468823122000190-ga1.jpg https://s3-eu-west-1.amazonaws.com/prod-ucs-content-store-eu-west/content/pii:S2468823122000190/ga1/DOWNSAMPLED/image/jpeg/7b8d7a1385704d64be23ae673d55d48f/ga1.jpg ga1 true ga1.jpg jpg 27545 185 301 IMAGE-DOWNSAMPLED 1-s2.0-S2468823122000190-gr9.sml https://s3-eu-west-1.amazonaws.com/prod-ucs-content-store-eu-west/content/pii:S2468823122000190/gr9/THUMBNAIL/image/gif/2107f5224220c99d6cec59a2be0529e0/gr9.sml gr9 gr9.sml sml 6932 113 219 IMAGE-THUMBNAIL 1-s2.0-S2468823122000190-gr8.sml https://s3-eu-west-1.amazonaws.com/prod-ucs-content-store-eu-west/content/pii:S2468823122000190/gr8/THUMBNAIL/image/gif/5d14d77660e9d2fdbb1bb78f0327a979/gr8.sml gr8 gr8.sml sml 4453 126 219 IMAGE-THUMBNAIL 1-s2.0-S2468823122000190-gr7.sml https://s3-eu-west-1.amazonaws.com/prod-ucs-content-store-eu-west/content/pii:S2468823122000190/gr7/THUMBNAIL/image/gif/0a222d3eef4a3c219b36f353a80432e5/gr7.sml gr7 gr7.sml sml 5236 124 219 IMAGE-THUMBNAIL 1-s2.0-S2468823122000190-gr6.sml https://s3-eu-west-1.amazonaws.com/prod-ucs-content-store-eu-west/content/pii:S2468823122000190/gr6/THUMBNAIL/image/gif/88da45f00e931debd0ce3de90ad0a685/gr6.sml gr6 gr6.sml sml 10295 154 219 IMAGE-THUMBNAIL 1-s2.0-S2468823122000190-gr10.sml https://s3-eu-west-1.amazonaws.com/prod-ucs-content-store-eu-west/content/pii:S2468823122000190/gr10/THUMBNAIL/image/gif/08dfaa183b636eda4264cc9242d1533e/gr10.sml gr10 gr10.sml sml 17327 164 202 IMAGE-THUMBNAIL 1-s2.0-S2468823122000190-gr11.sml https://s3-eu-west-1.amazonaws.com/prod-ucs-content-store-eu-west/content/pii:S2468823122000190/gr11/THUMBNAIL/image/gif/eecac5763923df17e8d11c08fbf6a24c/gr11.sml gr11 gr11.sml sml 7590 164 213 IMAGE-THUMBNAIL 1-s2.0-S2468823122000190-gr1.sml https://s3-eu-west-1.amazonaws.com/prod-ucs-content-store-eu-west/content/pii:S2468823122000190/gr1/THUMBNAIL/image/gif/40b7caf036a9413902c2fbc48b303bc5/gr1.sml gr1 gr1.sml sml 12383 124 219 IMAGE-THUMBNAIL 1-s2.0-S2468823122000190-gr5.sml https://s3-eu-west-1.amazonaws.com/prod-ucs-content-store-eu-west/content/pii:S2468823122000190/gr5/THUMBNAIL/image/gif/c16a1664264b825402850802883ba08f/gr5.sml gr5 gr5.sml sml 9749 140 219 IMAGE-THUMBNAIL 1-s2.0-S2468823122000190-gr4.sml https://s3-eu-west-1.amazonaws.com/prod-ucs-content-store-eu-west/content/pii:S2468823122000190/gr4/THUMBNAIL/image/gif/4af36ad0e07945a74eb907efc145e89b/gr4.sml gr4 gr4.sml sml 10068 131 219 IMAGE-THUMBNAIL 1-s2.0-S2468823122000190-gr3.sml https://s3-eu-west-1.amazonaws.com/prod-ucs-content-store-eu-west/content/pii:S2468823122000190/gr3/THUMBNAIL/image/gif/8b7317daa6cd0741dc350536efeb4514/gr3.sml gr3 gr3.sml sml 5768 137 219 IMAGE-THUMBNAIL 1-s2.0-S2468823122000190-gr2.sml https://s3-eu-west-1.amazonaws.com/prod-ucs-content-store-eu-west/content/pii:S2468823122000190/gr2/THUMBNAIL/image/gif/75899fdb5657919bea768504a93d259e/gr2.sml gr2 gr2.sml sml 7172 143 219 IMAGE-THUMBNAIL 1-s2.0-S2468823122000190-ga1.sml https://s3-eu-west-1.amazonaws.com/prod-ucs-content-store-eu-west/content/pii:S2468823122000190/ga1/THUMBNAIL/image/gif/1d54e1a74ead3ea6f33f22545fd02e4d/ga1.sml ga1 true ga1.sml sml 11254 135 219 IMAGE-THUMBNAIL 1-s2.0-S2468823122000190-gr9_lrg.jpg https://s3-eu-west-1.amazonaws.com/prod-ucs-content-store-eu-west/content/pii:S2468823122000190/gr9/HIGHRES/image/jpeg/ac39e5766978e33bc1691307b0a18ce9/gr9_lrg.jpg gr9 gr9_lrg.jpg jpg 328337 1290 2500 IMAGE-HIGH-RES 1-s2.0-S2468823122000190-gr8_lrg.jpg https://s3-eu-west-1.amazonaws.com/prod-ucs-content-store-eu-west/content/pii:S2468823122000190/gr8/HIGHRES/image/jpeg/b9f14baa55191185441fa4fa103bbdba/gr8_lrg.jpg gr8 gr8_lrg.jpg jpg 97446 864 1500 IMAGE-HIGH-RES 1-s2.0-S2468823122000190-gr7_lrg.jpg https://s3-eu-west-1.amazonaws.com/prod-ucs-content-store-eu-west/content/pii:S2468823122000190/gr7/HIGHRES/image/jpeg/567761836eadcf896402143a05d9dc8e/gr7_lrg.jpg gr7 gr7_lrg.jpg jpg 306103 1701 3000 IMAGE-HIGH-RES 1-s2.0-S2468823122000190-gr6_lrg.jpg https://s3-eu-west-1.amazonaws.com/prod-ucs-content-store-eu-west/content/pii:S2468823122000190/gr6/HIGHRES/image/jpeg/b4d2ba843a1006401eb944bbc2ecc918/gr6_lrg.jpg gr6 gr6_lrg.jpg jpg 284463 1519 2167 IMAGE-HIGH-RES 1-s2.0-S2468823122000190-gr10_lrg.jpg https://s3-eu-west-1.amazonaws.com/prod-ucs-content-store-eu-west/content/pii:S2468823122000190/gr10/HIGHRES/image/jpeg/5d9faa9137bd889e20c57429be465aab/gr10_lrg.jpg gr10 gr10_lrg.jpg jpg 729411 2024 2500 IMAGE-HIGH-RES 1-s2.0-S2468823122000190-gr11_lrg.jpg https://s3-eu-west-1.amazonaws.com/prod-ucs-content-store-eu-west/content/pii:S2468823122000190/gr11/HIGHRES/image/jpeg/fa871f2014f4a89fbf261697f72a09da/gr11_lrg.jpg gr11 gr11_lrg.jpg jpg 272011 1927 2500 IMAGE-HIGH-RES 1-s2.0-S2468823122000190-gr1_lrg.jpg https://s3-eu-west-1.amazonaws.com/prod-ucs-content-store-eu-west/content/pii:S2468823122000190/gr1/HIGHRES/image/jpeg/2b1af4c2faa90a60d23489bbbf02a4f5/gr1_lrg.jpg gr1 gr1_lrg.jpg jpg 237967 944 1667 IMAGE-HIGH-RES 1-s2.0-S2468823122000190-gr5_lrg.jpg https://s3-eu-west-1.amazonaws.com/prod-ucs-content-store-eu-west/content/pii:S2468823122000190/gr5/HIGHRES/image/jpeg/d78fb0a540ba74777f3fec1f9e081ae8/gr5_lrg.jpg gr5 gr5_lrg.jpg jpg 256612 1387 2167 IMAGE-HIGH-RES 1-s2.0-S2468823122000190-gr4_lrg.jpg https://s3-eu-west-1.amazonaws.com/prod-ucs-content-store-eu-west/content/pii:S2468823122000190/gr4/HIGHRES/image/jpeg/221dcc466a99daddc049dbc855390aed/gr4_lrg.jpg gr4 gr4_lrg.jpg jpg 255626 1294 2167 IMAGE-HIGH-RES 1-s2.0-S2468823122000190-gr3_lrg.jpg https://s3-eu-west-1.amazonaws.com/prod-ucs-content-store-eu-west/content/pii:S2468823122000190/gr3/HIGHRES/image/jpeg/c6484a0450758aa569e0471dc6b0bad1/gr3_lrg.jpg gr3 gr3_lrg.jpg jpg 255548 1559 2500 IMAGE-HIGH-RES 1-s2.0-S2468823122000190-gr2_lrg.jpg https://s3-eu-west-1.amazonaws.com/prod-ucs-content-store-eu-west/content/pii:S2468823122000190/gr2/HIGHRES/image/jpeg/00aa79f09437cffdd7a9a8e9b07e5b5f/gr2_lrg.jpg gr2 gr2_lrg.jpg jpg 131138 1116 1709 IMAGE-HIGH-RES 1-s2.0-S2468823122000190-ga1_lrg.jpg https://s3-eu-west-1.amazonaws.com/prod-ucs-content-store-eu-west/content/pii:S2468823122000190/ga1/HIGHRES/image/jpeg/6cc91de1c24eedda0370de3c043dd466/ga1_lrg.jpg ga1 true ga1_lrg.jpg jpg 195582 820 1333 IMAGE-HIGH-RES 1-s2.0-S2468823122000190-si1.svg https://s3-eu-west-1.amazonaws.com/prod-ucs-content-store-eu-west/content/pii:S2468823122000190/STRIPIN/image/svg+xml/1c0a35df85c5153e1e72ee309e693264/si1.svg si1 si1.svg svg 791 ALTIMG 1-s2.0-S2468823122000190-si2.svg https://s3-eu-west-1.amazonaws.com/prod-ucs-content-store-eu-west/content/pii:S2468823122000190/STRIPIN/image/svg+xml/5e9636683ffa2bb6da9836d473cbe452/si2.svg si2 si2.svg svg 7255 ALTIMG 1-s2.0-S2468823122000190-si3.svg https://s3-eu-west-1.amazonaws.com/prod-ucs-content-store-eu-west/content/pii:S2468823122000190/STRIPIN/image/svg+xml/bce9be3bb6528685564da913cb96e5b6/si3.svg si3 si3.svg svg 1366 ALTIMG 1-s2.0-S2468823122000190-am.pdf am am.pdf pdf 1689681 AAM-PDF https://s3-eu-west-1.amazonaws.com/prod-ucs-content-store-eu-west/content/egi:10GMWZKD8CS/MAIN/application/pdf/163acad013033c8ac58e2922a05fed60/am.pdf MCAT 112131 112131 S2468-8231(22)00019-0 10.1016/j.mcat.2022.112131 Fig. 1 Algae market growth perspective for the period 2018–2025. Fig 1 Fig. 2 Comparative yield of liquid fuels per acre for algae and other agricultural crops. Fig 2 Fig. 3 A proposal of the reaction routes for HDO of a model algae and biomass oils derived compound (i.e. guaiacol; 2-methoxyphenol). Fig 3 Fig. 4 Fig. 4. A scheme of reaction methods applicable for oil extraction from algae biomass. Fig 4 Fig. 5 Typical reactions route in HDO of algae bio-crude oil. Fig 5 Fig. 6 Typical composition from of algae-derived oil produced via HTL at 260–300 °C. Fig 6 Fig. 7 Typical reaction pathways for abietic acid (a model algae oil compound) HDO process at 320 °C over NiMo/Al2O3 catalyst. Fig 7 Fig. 8 Reaction pathways for phenol HDO transformation into hydrocarbon fuels. Fig 8 Fig. 9 Results of catalytic and non-catalytic HDO of oil derived from some algae feeds at 250 and 400 °C for 4 h. (a) for chlorella algae oil (b) for nannochloropsis oil. Fig 9 Fig. 10 Typical elucidated structures of transition metal phosphides found applicable in HDO and other hydrotreating reactions. Fig 10 Fig. 11 Catalysis mapping for HDO (2017–2021) (Extracted from Web of Science). Fig 11 Table 1 Recent updates on the HTL oil potential of some algae biomass reported in the literature. Table 1 Algae specie Catalyst T ( ∘ C) Time (min) Oil yield, wt.% Refs. Nannochloropsis – 280–320 30 66 [102] Scenedesmus – 280–320 30 50–60 [102] Spirulina platensis – 300–350 60 23 [94] Spirulina platensis Na2CO3 300–350 60 52 [94] Spirulina platensis NiO 300–350 60 38 [94] Pavlova and isochrysis Na2CO3 300–350 60 50–60 [94] Sargassum tenerrimum – 260–280 60 11.5–16.3 [103] Sargassum tenerrimum – 280 60 23.8 [103] Sargassum tenerrimum – 280 60 22.8 [103] U.prolifera microalgae – 270–310 30 5–12 [104] U.prolifera microalgae KOH 290 30 27 [104] U.prolifera microalgae NaOH 290 30 25 [104] U.prolifera microalgae Na2CO3 290 30 23 [104] Spirulina platensis Pd/HZSM-5@meso‑SiO2 380 120 37 [105] Table 2 Role of some metal catalysts in HDO reactions recently reported in the literature. Table 2 Catalysts Experimental Conditions Catalytic Activity Refs. NiMo/Al2O3 300 °C, 6 h, 10 bar H2 pressure 63% conversion [187] Cu-modified NiMo/Al2O3 300 °C, 6 h, 10 bar H2 pressure 43% conversion [187] Ce-modified NiMo/Al2O3 300 °C, 6 h, 10 bar H2 pressure 57% conversion [187] Ru/C 225 °C, 15 min 57% HDO/HDN (products = 20,30 and 50% kerosene, distillate and gas oil) [188] NiMo/Al2O3 300–350 °C, H2/Oil = 846–966 Up to 100% conversion, 99% yield of hydrocarbons [189] NiFe/Al2O3 400 °C, 1 atm 47.59% reduction in oxygenates [190] Ni/H-Y-80 300–400 °C, 20 bar 96% conversion, stable for 6 h. [190] Pd/C 300–400 °C, 20 bar 95% conversion, stable for 2 h [152] Ni/CeO2 HTL-derived oil, 450 °C, 1 h, hydrogen 72% yield of hydrocarbons [191] Ni-Ru/CeO2 HTL-derived oil, 450 °C, 1 h, hydrogen 80% yield of hydrocarbons. [191] Table 3 Role of sulfidation on the activity-stability properties of some HDO catalytic materials. Table 3 Catalyst System Reaction parameters Activity-Stability Properties Refs. Mo/Al2O3 HDO reaction with 0.1 g catalyst, 280 °C and 4 MPa hydrogen pressure 60% conversion that declined due to non-sulfidation. [223] Mo/90 wt.%Al2O3–10 wt.%TiO2 HDO reaction with 0.1 g catalyst, 280 °C and 4 MPa hydrogen pressure 72% conversion that declined due to non-sulfidation. [223] Mo/80 wt.%Al2O3–20 wt.%TiO2 HDO reaction with 0.1 g catalyst, 280 °C and 4 MPa hydrogen pressure 100% conversion that declined due to non-sulfidation. [223] Mo/TiO2 HDO reaction with 0.1 g catalyst, 280 °C and 4 MPa hydrogen pressure 86% conversion that declined due to non-sulfidation. [223] CoMo/Al2O3 (non-sulfided) 350 °C, 20 MPa, 15 min, hydrogen sulfide as sulfiding agent 74% conversion that decayed [224] CoMo/Al2O3 (sulfided) 350 °C, 20 MPa, 15 min, hydrogen sulfide as sulfiding agent 100% stable conversion [224] CoMo/Al2O3 and NiMo/Al2O3 (non-sulfided) Reported HDO reactions with different oil grades, 250–350 °C, 3–6 MPa hydrogen, 2 h 50–60% conversion that decayed [225] CoMo/Al2O3 and NiMo/Al2O3 (sulfided) Reported HDO reactions with different oil grades, 250–350 °C, 3–6 MPa hydrogen, 2 h 80–100% stable conversions [225] CoMo/MgO (sulfided) 300–450 °C, supercritical hexane, 5.0 MPa hydrogen, 1 h. Suilfidation with H2S at 400 °C for 4 h. 60–80% conversion, stable [226] CoMo-P/MgO (treated with phospides) 300–450 °C, supercritical hexane, 5.0 MPa hydrogen, 1 h. Phosphided with phosphoric acid Activity enhanced to 80–100%, stable [226] Pt/H-BEA; Pt/H-Y; Pt/Al2O3 and Pt/SiO2 systems 0.1 g catalyst, 4.0 MPa hydrogen, 200–250 °C 97–100% stable conversion [227] CoMo/Al2O3 (sulfided) 0.1 g catalyst, 4.0 MPa hydrogen, 200–250 °C 100% stable conversion [227] Towards sustainable catalysts in hydrodeoxygenation of algae-derived oils: A critical review Ahmad Galadima Writing – original draft a Ahmad Masudi Conceptualization Writing – review & editing a Oki Muraza Supervision ⁎ a b a Interdisciplinary Research Center for Hydrogen and Energy Storage and Chemical Engineering Department King Fahd University of Petroleum & Minerals, Dhahran 31261, Saudi Arabia Interdisciplinary Research Center for Hydrogen and Energy Storage and Chemical Engineering Department King Fahd University of Petroleum & Minerals Dhahran 31261 Saudi Arabia aInterdisciplinary Research Center for Hydrogen and Energy Storage and Chemical Engineering Department King Fahd University of Petroleum & Minerals, Dhahran 31261, Saudi Arabia b Research & Technology Innovation Pertamina, Jl. Merdeka Timur 1A, Jakarta 10110, Indonesia Research & Technology Innovation Pertamina Jl. Merdeka Timur 1A Jakarta 10110 Indonesia bResearch & Technology Innovation Pertamina, Jl. Merdeka Timur 1A, Jakarta 10110, Indonesia ⁎ Corresponding author at: Interdisciplinary Research Center for Hydrogen and Energy Storage and Chemical Engineering Department King Fahd University of Petroleum & Minerals, Dhahran 31261, Saudi Arabia. Interdisciplinary Research Center for Hydrogen and Energy Storage and Chemical Engineering Department King Fahd University of Petroleum & Minerals Dhahran 31261 Saudi Arabia Sequel to the future challenges identified in the energy indicators, the exploration of algae-biomass resources increasingly becoming an issue of interest. Algae-derived oils are accordingly considered as alternative fuels with great future prospects. However, their direct utilization is scientifically difficult due to associated complex compositions. So far, hydrodeoxygenation (HDO) of the oils is increasingly viewed as the reliable upgrading process for deriving high quality fuels. The paper therefore explored and critically examined substantial literature on the updates related to catalyst design and testing for HDO, the influence of oil production techniques on its susceptibility to HDO, effects of parameters such as catalyst sulfidation, modification to phosphides, nature of support systems and preparation versus reaction conditions. In addition to highlights on reaction mechanisms, the paper also discussed the effect of hydrothermal treatment on HDO catalyst stability and provided insights into areas for further investigations. Graphical abstract Image, graphical abstract Keywords Algae-derived oils Hydrodeoxygenation Metal phosphides sulfidation 1 Introduction Sequel to the numerous challenges attributed to the fossil fuels that include increasing global consumption, price instability, serious environmental degradation and overall reserves declination [1–6], the exploration of abundant biomass resources for energy consumption is necessary [7–11]. Unlike fossil fuels and their energy derivatives, biomass represents a collection of plant and/or animal resources that could be valorized for energy applications or other industrial uses. Specifically, the biomass resources can include agricultural-based outputs and residues (covering woods, crops and allied wastes) as well as animal products [12–16]. The biomass resources could be upgraded by different scientific and engineering processes such as gasification for synthesis gas production [17,18], transesterification for biodiesel synthesis [19–21], pyrolysis and Fischer Tropsch for liquid hydrocarbons generation [22,23], and a range of many other valorization methodologies of industrial relevance [24–26]. Among biomass resources, algae feedstock has attracted wide global acceptance as energy resources [27]. Scientifically, the algae represent a wide group of both aquatic and non-aquatic organisms with substantial capabilities to produce oxygen via photosynthesis like the green plants. While the seaweeds were generally common algae species to most researchers, records have established numerous other species of global economic importance [28–30]. One major interesting factor considered by the industry was the market analysis of the algae feedstock and algae products. There are clear statistical evidences that the global market for algae will grow at the overall rate of 4.2% between 2018 and 2025 [31]. This can account for at least 3451 USD in generated funds, which is a huge growth compared to 2017 and previous years. Several factors can be attributed to this increment. The projected rise in global human population accounted to rise in food consumption and consequently increased the associated algae products. Persistent increase in the demands for consumables energy and allied additives cannot be neglected in this perspective. Production costs and technological compatibilities were additional positive factors of industrial interest that account for algae market growth. Owing to these factors, as illustrated in Fig. 1 , food products and hydrocolloids will be responsible for 4.1 and 3.8% cumulative growth, respectively [31]. Accordingly, the green algae products and fuels will experience a speedy growth of 6.0% within the forecast period (i.e. 2018–2025). Among the global regions, countries in the Asia-Pacific would achieve the highest market growth of 6.2% within the period [31,32]. Different research groups have demonstrated the production of biofuels (including liquid hydrocarbons) from algae as very prospective compared to the other biomass-based oil crops. Algae species are numerously abundant and can practically be grown in almost all global environments with limited inconsistencies and without resource to the food-land. The level of oil content that can be extracted had been assigned at 100 times higher than other regular energy crops under similar factors. Statistically, more than 20,000 gallons of oil could be derived per acre of farmland cultivated [33]. This amount was really courageous and attractive to the developers. Fig. 2 provides a typical comparative analysis of the yield of liquid fuel from algae compared to some common agricultural crops. While most of these crops can produce a maximum of 1000 gallons per acre, algae species can produce up to 5000 gallons, which is economically very attractive [33]. Despite these advantages, the fundamental procedures for oil extraction from algae have been established and proved to be environmentally sustainable. Certainly, oils derived from algae were associated with a range of O-bearing compounds that include the triglyceride esters, fatty acids, traces of alcohols (including phenols) and the lipids [34–37]. Therefore, to upgrade these compounds into corresponding liquid hydrocarbon fuels or other derivatives, the O-species must be appropriately removed. Hydrodeoxygenation (HDO) was a long technology that adopted from petroleum refineries to remove O-species during petroleum refining and/or upgrading [38–40]. It usually proceeds with incorporation of a suitable catalyst (e.g. sulfur-modified NiMo) at high H2-pressure of 20 MPa and temperatures in the range of 250–400 °C [41–44]. At the end of the HDO reaction, oxygen species was rejected as water vapor and naphtha hydrocarbons generated as the main products (see Eq. (1)). Recent interest in algae valorization has witnessed the extension of the HDO process in algae and other biomass-derived oils upgrading. In fact, the yield of liquid hydrocarbons from HDO of biomass could be up to 60% depending on the choice of reaction conditions, reactor design and the quality of oil to be hydrodeoxygenated [45,46]. In addition to oxygen, bio-crude oil of algae also contained other heteroatoms such as nitrogen and sulfur (total heteroatoms of 10–20 wt.%) which would lead to formation of SOx and NOx after combustion [47,48]. Moreover, some metal impurities such as magnesium, sodium, calcium, iron and etc. were also existed in the algae crude oil [49]. (1) R 2 O ( l ) + 2 H 2 ( g ) → H 2 O ( g ) + 2 RH ( 1 ) Although there are other oxygen removal options applicable to the algae derived oils, the HDO process has been given good attention in the recent times due to a number of advantages [50]. The high H2-pressure in the reaction has the advantage of insitu coke hydrogenation and therefore hinders catalyst deactivation by carbonaceous deposits. Similarly, hydrocarbon products with comparable quality to the conventional tranportation fuels could be achieved. The heterogeneous nature of the reaction system accordingly infer that environmental and economic difficulties can be appreciably handled. Although the application of sulfur-modified NiMo, CoMo, NiCo and other supported catalysts had been prioritised, recent investigations include the incorporation of Pt, Rh and Re-based systems were also reported [51,52]. However, the expensive nature of these precious metals may limit their economic sustainability. Consequent to the great shift in the exploration of algae-biomass for fuels application and the projected market growth, the current review targets a critical analysis of key issues in the hydrodeoxygenation (i.e. HDO) of algae-derived oils. The specific area of interest includes an analysis of the procedures for algae oils production, the role of HDO catalysts, attributes of the sulfidation process and the derivable benefits of phosphorous additives (i.e. modification). In addition to the critical analysis of any update on the HDO mechanisms, the review will also discuss stability of the catalysts under steam/water conditions. Areas for further research consideration will accordingly be highlighted. 2 Algae-derived oils production One of the major important issue to be considered before designing the HDO reaction is the chemical composition of the algae oil. This composition was in turn dependent on the procedure adopted for deriving the oil. Generally, the techniques for algae oils extraction can be grouped into two; (1) the direct extraction from algae biomass and (2) the reaction methods. 2.1 Direct extraction methods Direct extraction of oils from algae species could be achieved in many ways ranging from pressing to ultrasonic-assisted extraction (see Fig. 4) [53–55]. The pressing method was conducted by the application of external pressures to break cells and extract oils from Algae. Alternatively, the milling process, which involved the application of grinding media and agitation to destruct the cells could be employed. Both pressing and milling technologies were applied together with solvent extraction in order to achieve high oil yield. Specifically, the solvent extraction method proceeded with sequential percolation of reduced-to-size algae feedstock in organic solvents such as hexane or alcohols to achieve high oil yield. A part from these physical extraction methods, supercritical fluid technique has been developed and proved to be efficient. In this regard, supercritical water or CO2 generated at certain temperatures and pressure conditions could be employed as solvent to extract large quantities of oil from algae biomass [56–58]. Other developed extraction procedures under evaluation include enzymatic, ultrasonic and osmotic shock methods [55,59,60]. The enzymatic process involved the use of enzymes to activate a rapid hydrolysis of algae cell walls in order to produce oil in a given solvent of interest. The ultrasonic process on the other hand, requires the introduction of ultrasonic waves to rupture algae cells and produce oil into a solvent [61,62]. In the case of osmotic shock method, the breakage of algae cell walls was accomplished by the application of osmotic pressure and the method was the most partly resolved so far. Generally, the direct extraction method was potential to extract around 99% of all the oil content in the algae biomass. They also have the advantages of non-energy intensiveness and the production of high-grade non-reduced oils [63–67]. The oils obtained via these methods have been characterized by possession of fatty esters, free fatty acids, proteins and partly decomposed carbohydrates. Because of the high purity, HDO processing of the oils derived via extraction could be achieved with less interference. 2.2 Reaction methods The second approach to algae-derived oils production was referred as “reaction methods” (see Fig. 4). These methods involved the reaction of algae biomass under catalytic or non-catalytic conditions to produce oil and other reaction products like biogas and biochar. Pyrolysis and hydrothermal liquefaction were the common reaction methods prioritized in the literature so far. Pyrolysis proceeded through chemical decomposition of algae biomass at high temperature and without the incorporation of air or oxygen [68,69]. Although atmospheric pressure (1 atm) could be sufficient, most pyrolysis reactions were accomplished at temperatures exceeding 400 °C. The irreversible process substantially changed the physical and chemical compositions of the algae feeds. The pyrolysis process could be classified into slow and fast methods. The slow pyrolysis method required several hours to complete and under low temperature (250–450 °C) [70–72]. This type of pyrolysis was not so useful for algae-derived oils production because the main reaction product was biochar and for this reason the process was otherwise called “carbonization”. The fast pyrolysis is accomplished in seconds and had been defined to produce up to 60% of algae-derived oils. It could be achieved at temperatures exceeding 500 °C and 1 atm pressure. In our earlier publication [22], we have substantially discussed the process of fast pyrolysis, catalytic systems involved and the influence of reaction parameters in producing desired fuel products. Therefore, this review will only cover key recent relevant updates. According to Anand et al. [73], and several other research groups [14,74–78], fast pyrolysis of algae biomass in the temperature range of 500–800 °C can produce oils with esters, alcohols, carboxylic acids and carbonyl compounds content in the range of 70–85%. Accordingly, traces of alkanes, alkenes and monoaromatics could be produced to less than 10%. However, the application of catalysts such as H-BEA and H-ZSM-5 zeolites or the modified acid oxides of ZrO2, CeO2 and TiO2 reduced the composition of the oxygenates in the algae oils significantly and increased the overall amount of hydrocarbon derivatives [79–82]. The non-catalytic process only required the introduction of heat to trigger bond ruptures in the algae biomass. On the other hand, the introduction of catalysts, activated several reactions such as decarboxylation, decarbonylation, isomerization and catalytic cracking (see Figs. 5 and 6). This way, long chain organic acids and alkanols in the generated algae oil were further cracked into lower molecular weight derivatives. Typically, the composition of heavier oxygenates could be reduced by more than 50% depend on the catalyst acidity-structure properties. For the zeolite catalysts, moderate acidity and development of hierarchical and nanoscale materials were important parameters to produce hydrocarbons in the algae oil. This has been attributed to the enhanced diffusion properties of the reaction products and the prevention of facile cracking. Algae oils produced via catalytic fast pyrolysis could be rich in BTEX compounds (i.e. benzene, toluene, ethylbenzenes and xylenes), which are very important components of a high-grade gasoline fuel [83,84]. Accordingly, the HDO of these oils could be achieved under mild reaction conditions, specifically due to low concentration of oxygenates. Hydrothermal liquefaction (HTL) of algae biomass was another low-to-moderate temperature conversion process for oils production [85]. The method had been attributed with high efficiency compared to the fast pyrolysis option. However, in a similar manner to pyrolysis, the HTL can be achieved under both catalytic and non-catalytic conditions. In most literature, HTL was viewed as the technology to upgrade algae or other biomass resources into liquid oils through the application of variable reaction conditions. Reaction temperatures in the range of 250–400 °C and pressures exceeding 10 MPa have so far been documented [86–89]. Unlike the pyrolysis which can be achieved in seconds, HTL reactions could normally be accomplished between 5 and 120 min [90,91]. Although the yield of reaction products can vary with the nature of algae species and the HTL conditions employed, the derivable products generally comprised of oil in the range of 20–65 wt.%. Other reaction products were C-, N- and O-bearing gases, the aqueous phase and solid residues [92,93]. All of these four phases can successfully be separated and analyzed and the end of the process. In Xu et al. [90], and our earlier publication [94], the benefits of algae HTL over other reaction methods such as pyrolysis had been documented. These include feasibility in the conversion of wet algae thereby eliminating additional energy requirements. Additionally, this production route produced at least 5% additional oil yield compared to pyrolysis and the removal of N- and P-bearing impurity compounds into the aqueous phase. This certainly reduced impurities in the desired algae oil phase as well as promoted the separation of water soluble inorganic salts and carboxylic acids. There are unanimous literature agreement that the choice of catalytic material was crucial in achieving yield and purity of oil from the algae biomass HTL [90,95,96]. Similarly, the process mechanism was dependent on whether the reaction was conducted using homogeneous or heterogeneous catalysts. Water soluble catalysts based on carbonates (i.e. K2CO3 and Na2CO3), hydroxides such as KOH and NaOH and simple organic acids like formic and acetic acids have been reported to yield between 20 and 42 wt.% of algae oils [97,98]. On the other hand, the heterogeneous systems based on metals-modified oxides and zeolites could produce up to 65 wt.% of oils and regarded as thermodynamically and kinetically more feasible [99,100]. They were similarly very efficient in eliminating the anticipated environmental dangers of catalyst disposal at the end of the reaction cycle. Noble metals were identified to activate hydrogen at mild temperature, then open possibility for HDO at lower temperature. The work of Xu et al. [101], substantially explored the role of precious metals-based catalysts supported with C (i.e. Pd/C and Ru/C) on the net properties and composition of HTL-produced algae oils. The protein-rich (60.1%) chlorella sp. was subjected to HTL by incorporating ∼2.70 ml of water and 0.1 g catalyst at 350 °C. They found that the catalyst was effective in decreasing the concentration of water-soluble organic compounds from the algae oil due to associated cracking reactions. Specifically, the Pd/C catalyst degraded heavier amines and O-bearing compounds like alcohols into lighter derivatives. Table 1 provides a collection of literature updates on the application of various catalysts during algae liquefaction under hydrothermal conditions (i.e. the HTL). The results demonstrated that in addition to nature of the algae species, the choice of catalyst and reaction conditions were very important. Apparently, oil yields up to 66 wt.% could be derived at the optimal temperature range of 280–320 °C and reaction time exceeding 30 min. Generally, the catalytic reactions produced more yields of oil than the non-catalytic counterparts performed under the same conditions [102–105]. Multifunctional catalyst received growing interest recently as the possibility for one-pot HDO reaction under milder condition with easier tuning to the desired chemical product [106]. This multifunctional catalyst generally comprised of noble metals, promoter and acid support like zeolite. Researchers in this area are still on debate whether the reaction mechanism occurred via two-step reduction or multi-step cascade processes. These two pathways were derived as the zeolite facilitate dehydration of alcohol to alkenes in two step reduction, and the multifunctional active sites of noble metal, promoter and zeolite that can work simultaneously in HDO reaction through multi-step cascade process. This multifunctional catalyst could become an alternative to perform HDO reaction at low temperature, but the price of noble metals must be anticipated for further commercialization. Sub- and supercritical water were classified as green solvent and also hold potential for bio-oil upgrading. Sub- and supercritical water referred to condition at below and above water critical points (water critical points: T: 374 and P: 22.1 MPa), respectively. Toor et al. investigated bio-oil extraction from two types of algae at super- and sub-critical conditions [107]. The maximum bio-oil yield (34 and 46%) depended on the algae species, pressure and temperature. But, they confirmed that sub-critical water was more effective than supercritical water with rich protein in oil composition. In another study, supercritical water was confirmed to increase water soluble fraction in biocrude of algae and decreased heteroatoms content by 15% [108]. The supercritical condition also applicable for other organic solvent such as methanol, ethanol, acetone, etc. The utilization of supercritical methanol in extraction of bio-oil from algae was reported by Han et al. [109]. They compared non-catalytic and catalytic process with several metal oxides catalyst such as ZrO2, MnO2, ZnO2 and Zr(WO4)2. All of the catalyst exhibited higher oil yield compared to non-catalytic process indicating high activity of the catalyst. The algae cell was easier to destroyed at supercritical condition, then segregated to polar and non-polar phase. The separation to these two phases was originated from heteroatom and aliphatic bond cracking as confirmed by elemental analysis that nitrogen and oxygen content reduced after treated with supercritical methanol. The catalyst role in this reaction was perceived to increase cracking of O- and N- compounds, thus increase the oil yield. 3 Hydrodeoxygenation (HDO) of algae-derived oils Algae–derived oils were associated with a wide range of chemical compounds and therefore must be upgraded to obtain high quality oils that are either rich of hydrocarbons or directly suitable for the applications in internal combustion engines [110]. Sequel to the complex composition characteristics, algae-derived oils were widely recognized as “biocrude oils” in the literature. Therefore, the term biocrude oil was applicable to describe complex composition of O-bearing compounds (i.e. the oxygenates) with different molecular weights. A part from the oxygenate compounds, N-derivatives such as amines (aliphatic and heterocyclic) and amides could be detected with reasonable concentration. Zhang et al. [111], has reported a typical composition of biocrude oil derived from algae feedstock via HTL with some homogeneous catalysts at 260–300 °C (see Fig. 6). Clearly, the detected compounds could be subdivided into different functionalities and distribution that was catalyst-dependent. The composition changed at various reaction temperatures. It could be observed that non-catalytic reaction produced mainly fatty acids and their derivatives. However, the introduction of catalysts (KOH and acetic acid) triggered a noticeable reduction in the concentration of fatty acids and alcohols. On the other hand, the composition of N-bearing compounds (including the heterocycles) increased with temperature changes from 260 to 300 °C. These specific observations on the compositions of algae-derived oils were also documented by many other research groups [112–116]. In general terms, non-refined algae oils were black, thickened liquids that has the potentials to exist as solids at room temperature and highly susceptible to separation from the aqueous phase after production [110]. GC-MS analyses showed that the elemental compositions of most oils were similar to those parent algae biomass. Hydrotreatment was a necessary step to upgrade the oils into more useful feeds that suitable for fuel applications. The hydrotreating process involved the use of certain temperature and pressure conditions to eliminate N-, O- and S-compounds from a given feed. The incorporation of H2 was necessary to improve the process efficiency. The common hydrotreating processes was hydrodeoxygenation (HDO), hydrodenitrogenation (HDN) and hydrodesulfurization (HDS) for the removal of O-, N- and S-derivatives, respectively, from the fuel fraction. The HDO, as the main topic of this paper, was widely employed for biomass-based upgrading because most oils derived from biomass were rich in O-derivatives. Originally, the process was utilized for the conversion of vegetable oils and biodiesel into gasoline and diesel fuels [117,118]. The original feeds were associated with poor fuel characteristics including limited energy efficiency, poor stability properties and miscibility that different to the conventional fuel feeds. The most widely employed catalytic systems for the HDO reaction were Pd and Pt metals (even though Rh and Ru were also considered) doped over oxide supports like SiO2 and TiO2 or the composite oxides [117]. However, the scope was extended to cover other cheap transition metal catalysts based on Ni, Co and Mo with similar support systems [119–122]. Considering the wide exploitation of ZSM-5 and MOR zeolites as hydrotreating materials in petroleum refining, these catalysts were evaluated to the algae-based oils HDO application [123]. Irrespective to the selected catalyst, the introduction of sulfur was usually carried out to ensure activity and stability properties of the catalysts on stream [124,125]. For the purpose of this paper, the HDO of algae-derived oils would be covered initially for model compounds and later for real oil feeds. 3.1 HDO of model compounds in algae oils Proper understanding of the process chemistry occur during the HDO reaction, could better be achieved when specific model compounds were fundamentally considered. It is a known fact that the fatty acids represent a greater chemical composition of the algae-derived oils. Therefore, catalysts that suitable for HDO of fatty acids could potentially be good candidates for the real oil feeds. The HDO of fatty acid compounds proceeded with removal of water vapor (i.e. H2O(g)) and also CO and CO2 gases when hydrodecarboxylation and hydrodecarbonylation take place simultaneously with the HDO reaction [126]. The derivable products were mostly long chain hydrocarbons in the diesel and jet fuels range. Fatty acids commonly found in the algae oils include oleic, stearic, abietic and linoleic acids [127–130]. All of these compounds were long chain carbon derivatives with compatibilities to produce diesel range products following the HDO process. Recently, Ojagh and co-workers [126], performed the HDO of two fatty acid compounds (i.e. oleic and abietic) using a NiMo catalyst supported with alumina. The catalyst was developed via sequential impregnation technique that involved the incorporation of 5 and 15 wt.% of Ni and Mo, respectively. Their reaction results demonstrated that abietic acid could be converted 100% within 1 h at 320 °C, and similar results were earlier obtained by Bernas and co-investigators. The results further provided an insight into the HDO mechanism for abietic acid upgrading. Disproportionation reactions that initiated with hydrogenation and subsequent isomerization and dehydrogenation were substantially confirmed due to the detection of di- and de-hydroabietic acids as primary intermediates. Substituted trienes were therefore detected as the final reaction products in consistency with earlier results [131–133]. Ojagh et al. [126], further showed that the evaluation with oleic acid produced a complete conversion after 3 h under constant conditions. Therefore, the catalytic activity was also fatty acid dependent. However, in a similar trend to abietic acid conversion, reaction intermediates such as stearic acid that were products of dehydrogenation and isomerization, were initially detected before their final conversion into C17 C18 alkanes of the diesel range as presented in Fig. 7. Consistent with previous results [134–136], co-feeding of the two fatty acids (i.e. abietic and oleic) produced competitive reactions and consequently lowered the catalyst stability over reaction period. The main role of Mo species during the HDO reaction was investigated by Valencia and co-workers [137]. They prepared 12 wt.% Mo/SiO2 aided by impregnation with either citric or malonic acid in water. Fatty acid conversion was performed at 280 °C by the application of ∼5 MPa hydrogen pressure. It was established that the Mo species mainly catalyzed CO and COH ruptures over time following an initial hydrogenation of unsaturated bonds in the fatty acid. Accordingly, the catalyst that prepared via citric acid impregnation was more active by virtue to achieve higher Mo dispersion and the retention of catalytic structure. The participation of multi-valence Mo species (i.e. Mo4+, Mo5+and Mo6+) during the reaction was also substantiated in agreement with some earlier publications [138–140]. Arora et al. [122], studied the role of Fe species during HDO of fatty acids with NiMo/Al2O3 and Mo/Al2O3 materials. The catalytic investigations were carried out at 325 °C and 6 MPa pressure of hydrogen. Fe species were co-fed to both catalysts to identify their roles as either promoters or poisons to the active catalysts. The reaction data revealed that, irrespective of the catalyst nature, raising the concentrations of Fe species drastically reduced the formation of C17 and C18 hydrocarbons from oleic acid. The characterization data further showed that the deposition of Fe particles blocked the active sites of Ni and Mo species to be accessed by reaction feeds and intermediates. With both catalysts, the development of Fe-Mo and Fe-Ni hybrids accounted for substantial reduction in the catalytic performance over time. Therefore, it could be inferred that the choice of a co-metal for HDO catalyst design must be carried out with textural and metal-metal interaction feasibility considerations [141–143]. Apparently, reaction with NiMo/Al2O3 completed within the first 40 min. However, the addition of 2000 ppm Fe species produced only 7% for > 5 h. It also favored the formation of Fe-oleate instead of catalyzing the selectivity to the C17 and C18 hydrocarbon species. In addition to this fact, Arora et al. [122], further produced characterization results that confirmed the pore-blockage and concomitant reduction in active surface areas of both NiMo/Al2O3 and Mo/Al2O3 materials by at least 50% following the addition of 2000 ppm of Fe particles. Although the reaction mechanism was consistent to that of stearic acid intermediate formation and the decarboxylation of –COOH groups, C17 and C18 were the main reaction products detected in the absent of Fe species [144–146]. Overall, the competitive Fe-oleate formation drastically reduced the activities by 36 and 44% for NiMo/Al2O3 and Mo/Al2O3 materials, respectively. Arun et al. recently explored some catalysts support including γ -Al2O3, SBA-15 and hexagonal mesoporous silica (HMS) to NiMo catalysts [147]. Although SBA-15 exhibited the largest surface area, but the optimum removal of oxygen from oleic acid (77%) was obtained by γ -Al2O3 inferring the crucial role of acid sites. The higher acidity of the support, the higher HDO activity of the catalyst. In another research, Ruangudomsakul et al. studied the incorporation of some metals such as Ni, Co and Cu to phosphide to produce green diesel from palm oil [148]. The catalysts were synthesized with precipitation method and became metal-phosphide after calcination and reduction with H2. The catalytic evaluation at 300, 350 and 400 ∘ C confirmed that Ni resulted to optimum green diesel yield (70%) at 350 °C after 6 h of reaction test. The reaction pathway was proposed via hydrogenation of double bonds by metal sites, then the CO bond was cracked by hydrogenolysis. Thus, the different affinity of metals for hydrogenation activity, differentiated the HDO result. Recently, Hachemi and Murzin [149], compared the activities of Pd/C and Ni/H-Y-80 materials for HDO reaction. They found that the two catalysts exhibit different roles. Although both materials produced similar conversions over time, the Ni/H-Y-80 was more selective to HDO reaction, while Pd/C mainly catalyzed decarboxylation and decarbonylation of the R-COOH and R-COOR compounds. Previously, some investigators found that supported Pd and Pt catalysts as more active to the formation of decarboxylation products over a range of temperature and pressure conditions [150–152]. Recently, Joen et al. [153], evaluated a range of Pt, Pd and Ru systems for oleic acid upgrading. The active particles were generally supported with Ce0.6Zr0.4O2. They found that the application of low hydrogen pressure as susceptible to the degrade the CC chains in oleic acid and the eliminate CO2 and CO gases via decarboxylation and decarbonylation reactions in consistency with earlier works [154,155]. However, when the catalysts were modified with Ni species, HDO reaction was also simultaneously observed. Among all the catalysts, Pt-Ni system exhibited the best catalytic activity with 99% conversion at 300 °C in < 1 h. It similarly produced the highest yield of C9 C17 hydrocarbons of 54%. Incorporation of the Ni particles created a synergic interaction with Pd, Pt and Ru species thereby elevating accessibility to reacting oleic acid molecules and the generated intermediates. Recently, Kochaputi et al. used Cu3P as a catalyst for deoxygenation of oleic acid at 340 ∘ C for 6 h [156]. This catalyst was prepared by reduction of metallic Cu (at 350 °C), then reacted with phosphorous precursor ((NH4)2HPO4) (at 600 °C). The in-situ XRD and in-situ XAS confirmed that CuP2 and Cu(OH)2 were intermediate compound before fully converted to Cu3P on the USY support. The oleic conversion reached 99% with the highest selectivity to aromatic compound (46%). A part from fatty acids, compounds such as carbonyls (i.e. aldehydes and ketones), simple organic acids and phenolic derivatives were appreciably found in algae-derived oils. Recently, studies have been conducted on the HDO of these compounds as model investigations. Dwiatmoko and co-workers [52], evaluated the role of Ru/W-Zr systems for guaiacol HDO. They found the best HDO activity of 97% with a catalyst containing 10 wt.% of W. Accordingly, Jiang et al. [157], conducted similar reaction using H-ZSM-5 catalysts having varied Si/Al ratios at the temperature range of 500–800 °C. They established zeolite-acidity as a key influential factor during the guaiacol HDO. The catalyst H-ZSM-5; Si/Al = 200) produced the highest selectivity to benzene and toluene (i.e. 2–3% higher than for all other catalysts). In addition to the effect of zeolite-acidity, raising the reaction temperature promoted guaiacol conversion, but increased the chances of catalyst deactivation by coking. The overall reaction pathway was consistent to that depicted in Fig. 3 . However, significant amount of BTEX was detected than cyclic alkanes. In their investigations, Zhang et al. [158], employed phenols as model compounds and Ni/SiO2 and Ni/Al2O3 as catalytic materials. They found that phenolic compounds could be upgraded yielding up to 90% of gasoline range hydrocarbons. The mechanism of the reaction involved an initial hydrogenation followed by CO cleavages, isomerization, dehydrogenation and protonic rearrangement. Recently, Yang et al. also used phenol as a model of bio-oil for HDO reaction with amphipathic catalyst consisted of Pd and carbon-silica alumina [159]. The reaction was conducted at 200 °C and 5 MPa H2 which yielded 88% selectivity to cyclohexane indicating good activity for HDO. From their studies, they revealed that the optimum distribution of oil/water interface of the catalyst contributed significantly to high activity for HDO. Li and co-workers [41], utilized M-modified Ni-based catalysts (M = Al, La and Ga) supported with H-ZSM-5 and H-BEA systems for HDO of different oxygenates. Reactions were conducted between 140 and 300 °C and 1.6 MPa of hydrogen. Among the alcohols, guaiacol produced 71% of fuel grade hydrocarbons with M-modified catalysts. Among these, aromatics were the dominant species due to the difficulty in ring ruptures. On the other hand, Ni/H-ZSM-5 modified with Al exhibited the best activity during acetic acid HDO, producing 89% of hydrocarbons. The same catalyst was also produced an optimal hydrocarbon content of 80% when the acetic acid was replaced with hydroxyacetone. Mechanistically, both acetic acid and hydroxyacetone were transformed via similar reaction pathways. The three key intermediary reactions involved include self-condensation, de-methylation and aldol condensation with subsequent production of long chain hydrocarbons. In another research, Xu et al., employed carbon-supported small content of noble metal (Ru) that coated to Co [160]. Guaiacol was also used as a model for HDO and the reaction was carried out at 200 °C and 1 MPa that produced 94% yield of cyclohexane. This study confirmed that Co in the catalyst formed more oxygen vacancies, while Ru decorated Co favored to hydrogenolysis reaction which then promoted excellent removal of oxygen. This result was similar to a research reported by Xiang et al. where Ru and Co work synergy to improve HDO activity [161]. DFT calculation revealed that good dispersion of Ru-Co in hexagonal structure and highly porous facilitated better hydrogen adsorption that led to easier hydrogen spillover. Shu and co-researchers [162], explored the effect of preparation option on the HDO performance of Pt/TiO2 systems for phenolic compounds conversion. Irrespective of the employed technique, the loading of Pt was adjusted to 2 wt.% and the catalytic evaluations was conducted at 280 °C for 4 h using 1 MPa hydrogen pressure. The order of the catalytic activity followed the trend Pt/TiO2 (SG) < Pt/TiO2 (S) < Pt/TiO2 (CO) < Pt/TiO2 (PC) (where SG = sol-gel, S = supported, CO = co-precipitated and PC = photochemical method of synthesis). Accordingly, catalyst developed via the photochemical method was more active and selective. It produced 99.9% conversion of guaiacol and 95% selectivity to cyclohexane. On the other hand, the sol-gel-prepared catalyst exhibited the least activity of 23 and 31% for conversion and selectivity, respectively. The catalytic trend was appreciably similar for seven other phenolic compounds evaluated under the same conditions. The exceptional activity of the Pt/TiO2 (PC) catalyst had been attributed to its highest dispersion characteristics than other designed catalysts. The same catalyst was also employed for repeated cycles of reaction with negligible deactivation, but also produced fuel range hydrocarbons with C6 C13 phenols. Feliczak et al. [163], used SBA-16 as the support material and compared the catalytic activity of Pt with other metals such as Ru, Nb and Pd during phenol upgrading at 90 to 130 °C and various H2 pressures in the range of 2.5 to 6 MPa. All the metal species were incorporated onto the SBA-16 support via incipient wetness impregnation method. The characterization results showed that the Nb-modified SBA-16 catalyst displayed the highest surface area and pore volume properties of 920 m2/g and 0.6 mL/g, respectively. However, as illustrated in Fig. 8 , the reaction pathway was the same for all the catalytic systems. Initial dehydrogenation of phenol ring produced cyclohexanol, which via dehydration became cyclohexane. Alternatively, a different route leading to 2,4-dimethylhexane formation could be followed. From the studied catalysts, Pt/SBA-16 showed the best catalytic activity due to better dispersion of Pt particles over the SBA-16 than other metals. This catalyst produced 100% phenol conversion with at least 75% yield of fuel bearing hydrocarbon (i.e. 2,4-dimethylhexane) under all the tested reaction conditions. Generally, metals supported with oxides, carbon and zeolite systems were currently considered for the upgrading of model compounds algae-derived oils via the HDO reaction. While the role of co-metalization, effects of catalyst preparation methods susceptible deactivation parameters and the mechanisms of disproportionation of specific model compounds have been established, there are several other issues that are still debatable in the literature [164–170]. Reliable details on the incorporation of noble metals such as Pt and Pd supported with carbon as HDO catalysts instead of hydrodecarboxylation and hydrodecarbonylation were still sketchy. Although the dispersion of Pt particles played important role during ketones and phenols HDO, the most appropriate support materials (i.e. zeolites or oxides) have not been fully identified. The specific role of support structure-acidity properties has also not been resolved yet. Other issues for consideration include the effect of co-presence of water and N-bearing compounds in the feed on catalytic performance and the choice of most appropriate reactor system. 3.2 HDO of real algae-derived oil feeds Clearly, the algae-derived oils are combination of several organic and organo-metallic compounds and are therefore more difficult to be hydrotreated than the model compounds. Typical oil can contain up to 15 wt.% of heteroatom-bearing derivatives [171]. Therefore, any catalyst design for HDO must take into cognizance specific parameters such as possibility of side reaction interference, complex composition of the feed and the nature of the final reaction products desired [172–175]. However, even with these concerns, the HDO process remained the most promising technology for upgrading the oils into fuel grade hydrocarbon compounds. At some instances hydrodenitrogenation (HDN), hydrodesulfurization (HDS) and demetalization processes are conducted simultaneously with the HDO such that metals, N- and S-compounds are eliminated together with the oxygenates [176–179]. Many studies have been documented so far in this in this direction, but this paper will focus on those that fit the designed objectives. Biller and co-researchers [178], conducted the HDO of oils derived from chlorella microalgae at the temperatures of 350–405 °C for 2 h in the presence of hydrogen (60–66 bar). The HDO products yield was generally dependent on the reaction conditions. At 405 °C, the concentration of hydrocarbons product reached 69% [180]. Accordingly, the two catalytic systems (i.e. NiMo and CoMo) produced optimal oxygenates reduction of 86 and 91%, respectively. Owing to the rich concentration of N-derivatives in the initial oil feed, HDN reaction occurred simultaneously with overall activity of 55–60% for the two catalysts. One unique feature of interest was that both catalytic materials exhibited appreciable stability for 2 h and were less-susceptible to the production of C1 C4 cracked hydrocarbons. In their own investigation, Bai and his co-researchers [181], evaluated several catalytic materials (i.e. more than 10) for HDO at higher than 200 °C using a batch-type reactor system. Ru/C and Raney-Ni proved as the most effective and produced gasoline and diesel range hydrocarbons in the range of 60–77%. Other catalysts however deactivated with time due to the effect of metals and active sites poisoning by the produced H2O and NH3 gases. Later Duan et al. [182], compared the hydrotreating efficiency of the Ru/C with that of Mo/C under constant conditions. Both catalysts were evaluated at 400 °C using 5 MPa hydrogen pressure for 4 h. While the separate catalysts produced ∼70% oxygenates removal, the mixture produced 90% of hydrocarbons in addition to the 59% of deoxygenated products. Their characterization data revealed a synergy between Ru and Mo particles as effective active sites poisoning and retarding carbonaceous deposition. Apparently, reactions with Mo/C alone decayed more rapidly due to poisoning effect than the Ru/C catalyst. These results could be compared to the findings of Elliot et al. [183], who employed Al2O3 supported CoMo for HDO reaction of a varieties of macroalgae-derived oils at 405 °C and 136 bar. However, the incorporation of Co species in the latter catalyst triggered a resistance of Mo particles to rapid deactivation. Haider et al. [171], investigated the effect of some reaction parameters (i.e. temperature, initial hydrogen pressure and time) during the HDO of oils derived from spirulina feedstock. The catalyst was NiMo supported with alumina. They revealed that increasing temperature from 250 to 350 °C, favored complete deoxygenation of oil with total selectivity to hydrocarbons. However, increasing hydrogen pressure shifted the reaction towards HDN than HDO. For instance, at 40 bar, the yield of HDN products was 47%, but reached 80% when the pressure was raised to 80 bar. However, irrespective of the reaction condition applied the hydrocarbons obtained were within the diesel and gasoline range. Guo et al. [184], screened a range of N-based catalysts for the hydrotreating of oils derived from chlorella and nannochloropsis. The reactions were conducted at two different temperatures (i.e. 250 and 400 °C) for 4 h. Their results as illustrated in Fig. 9 showed the reaction temperature and the presence of catalyst to exhibit an influential role during the process. For instance, at 250 °C, the conversion of oil was 10% because 90 wt.% of the oil remained for the non-catalytic process. However, the incorporation of catalyst triggered 46% conversion at 400 °C with a concomitant increased in the production of hydrocarbon products. The results similarly agreed to those of previous investigations [185,186]. Accordingly, when the temperature was elevated from 250 to 400 °C, HDN reaction occurred simultaneously with HDO. In their studies, CO and CO2 were main products at 250 °C, while C1 C4 were mainly observed at 400 °C. Therefore, while low temperature was mainly susceptible to hydrodecarbonylation and hydrodecarboxylation reactions, the 400 °C employed facilitated hydrogenation and hydrocracking processes. A summary of the roles of some metals supported oxides and carbon recently reported in the literature were documented in Table 2 . Sangnikul et al. [187], found that the incorporation of Cu and Ce particles to have a negative effect on the catalytic activity of a NiMo/Al2O3 catalyst. The conversion with unmodified catalyst reached up to 63% at 300 °C, but declined to 57 and 43% when Ce and Cu species were introduced, respectively. The consequential effects of metal modified catalyst was the blockage of the active NiMo surfaces and thereby reducing the accessibility to the reaction species in the algae-derived oil. According to Costanzo et al. [188], a Ru/C system catalyzed both HDO and HDN reactions at 225 °C that produced hydrocarbons with a range of gasoline, kerosene and gas oil. Jensen et al. [189], however showed that at very high H2/oil ratios of 846–966, hydrocarbon products could be derived over a wide range of reaction temperatures. According to Leng et al. [190], modification of a Ni/Al2O3 with Fe particles reduced the oxygenates content in algae-oil by 47.59%. This reduction can be described as low compared the details reported in other studies above. It can be attributed to the negative effect of the Fe particles. Xu and co-researchers [191], modified a Ni/CeO2 catalyst with Ru and evaluated the activity in HTL-derived oil valorization at 450 °C for 1 h. In this regard, the modification appeared positive because the yield of hydrocarbons was shifted from 72 to 80%. While many investigators concentrated on the application of metals and modified metal catalysts, recent interest was also shifted to the evaluation of zeolitic materials for the HDO reaction. For instance, Li and Savage [192], investigated protonic H-ZSM-5 at 400–500 °C and 5 MPa. In this case, increasing reaction temperature posed reduction in the yield of liquid hydrocarbons from 75 to 42%. It was confirmed that high temperatures have negative effect to trigger facile hydrocracking of the developed reaction products, thereby producing gaseous C1 C4 hydrocarbons. The zeolite materials were widely explored for biomass upgrading processes due to their special characteristics that differentiated them from other supports of the metal-based systems. They were well classified minerals attributed with susceptibility for ion-exchange as well as reversible dehydration phenomena [193–196]. Zeolites possessed framework structures associated with series of interconnected features that capable of accommodating significant number of cationic metal species. Owing to these unique structural features, zeolites can be designed to different grades and applied in the reaction of interest [197–200]. A part from the chances for structural modifications, zeolites could be synthesized with different acidity scales by incorporating metals, changing the Si/Al ratio or ion-exchange [201,202]. While abundant natural zeolites were easily obtained globally, their commercial production remained attractive by virtue of their diverse applications. Regarding the algae-derived oils hydrotreating by HDO, zeolites were explored to mainly ascertain how the structural-acidity properties proffered selectivity to fuel range hydrocarbons with hindering deactivation [203,204]. Duan and co-workers [205], evaluated a range of zeolite catalysts including H-BEA, H-ZSM-5 and H-Y systems in comparison to a SAPO-11 material for the upgrading of algae-derived oils. Although the catalysts were active to HDO, HDN and HDS reactions, the H-Y and H-ZSM-5 catalysts of comparable acidity produced similar conversions and selectivity to hydrocarbon products. However, the H-SAPO-11 deactivated faster due to its low carbonaceous deposits tolerance. According to the characterization results, micropores were higher in H-Y and H-ZSM-5 catalyst compared to H-SAPO-11. On the other hand, H-MCM-41 composed mainly of mesopores that substantially surpassed the chance of deactivation by coking and increased the possibility of yielding heavier hydrocarbon products in the diesel range. The H-SAPO-11 catalyst that exhibited the least pore sizes experienced a pronounced pore-blockage because the in situ generated carbon deposits became difficult to diffuse through the pores. The work of Cole et al. [206], involved the hydrotreating of oil derived from fresh water feedstock (i.e. oedogonium algae) using SAPO-11 catalysts. The results were compared with those NiMo and Ru/C catalysts. At low temperature and pressure, these catalysts were less-active despite the low concentration of oxygenates and N-compounds in the oil feed. On the other hand, although a Pt/SAPO-11 catalyst deactivated over time, it produced 96% of liquid hydrocarbon products at 360 °C. While the production of C1 C4 hydrocarbons was limited due to low catalyst acidity, the amounts of oxygenates and aromatics in the initial oil feed reduced considerably. 4 The role of sulfidation on HDO catalysts The literature documented above indicated some metallic catalysts especially those of Ni, Co and Mo to deactivate over time or exert low activities under certain reaction conditions. The activity evolution over time occurred due to crystal changes during reaction period. The introduction of sulfur could maintain the catalyst structure, but the HDO activity reduced as a result of competitive adsorption and increasing possibility for sulfur contamination to the extracted bio-crude oil. The sulfidation approach proceeded with the introduction of sulfur species into the catalyst precursor with the aid of appropriate sulfiding agent under controlled temperature and pressure conditions [207–209]. It has been established that heating a sulfiding agent with hydrogen gas caused its decomposition and consequently generates H2S that is necessary for the overall sulfidation of the catalyst. Although several other sulfiding agents are available today, compounds such as dimethylsulfide and t-butylpoly sulfide were regularly utilized by industries as sulfiding agents [210–214]. However, in common laboratory applications, hydrogen sulfide gas can directly be introduced into the prepared catalyst bed. The choice of a suitable sulfiding agent was also dependent on its specific properties. Dimethylsulfide has attracted much research attention owing to the fact that it could be produced cheaply and generated high sulfur content. Its ability to undergo a two-steps decomposition was beneficial in inhibiting exothermic reaction that commonly occur during sulfidation process. On the other hand, the application of t-butylpoly sulfide was considered, especially at low temperature decomposition. Proper sulfidation of any metal-supported catalyst was a vital factor in obtaining excellent catalytic performance. Certainly, the sulfidation procedure varies according to the industry, laboratory or catalyst system and hydrotreatment reaction under consideration. However, the generally accepted fact was that the textural, morphological and activity properties of the sulfided catalysts were generally more promising than of the non-sulfided catalysts. An EXAFS investigation by Cattaneoet al. [215], showed that when MoO3/SiO2 was sulfided the transient stage involved the formation of oxysulfide species which later transformed into MoS2/SiO2 species. Similarly, the formation of MoS3-like products could be detected. On the other hand, the results further showed that NiO was first converted into Ni species and later the sulfide particles. They also found the utilization of chelating agents such as ethylenediamine and ethylenediaminetetraacetic acid during initial catalyst precursor preparation as very beneficial in facilitating the sulfidation process and consequently the net hydrotreating activity. Villarreal and co-researchers [216], studied the effect of heating rate on the extent of sulfide formation with a composite catalyst (i.e. NiMo supported with SiO2-Al2O3). They found a chelating agent (i.e. citric acid) as a good candidate to increase the formation of MoS2 species of low crystalline sizes at moderate to high temperatures of sulfidation. Accordingly, the hydrotreating activity was enhanced. Studies by a number of other investigators [217–221], showed complete sulfidation as a mandatory factor for designing an active and stable catalyst. Clearly, all sulfidation procedures that proceed with metal oxides transformation into the sulfide phase were more promising techniques. They also demonstrated that although high temperature conditions were important in triggering Mo-O-Mo breakages and the net formation of MoS2 species, sintering of active particles with consequential activity-decay could be very prominent. These observations suggested a gradual heating rate application to be the most accepted procedure considered today. Meanwhile, Hidalgo-herrador et al. substituted formic acid with oxalic acid to produce hydrogen using commercial HDO catalyst and showed high yield of deoxygenated oil from waste cooking oil [222]. During algae-derived oils HDO with Ni and Mo-based catalysts, sulfidation was usually employed to retard the possibility of catalyst deactivation by coking as well as to increase activity to an optimum grade. Several works have compared the performance of both sulfided and non-sulfided catalytic systems. Table 3 provides a documentation on the role of sulfidation on the catalytic performance of some HDO catalysts reported in the literature. Vo et al. [223], performed a range of HDO reactions with non-sulfided catalysts based on Mo modified with Al2O3 and TiO2 support systems. Although the catalytic activity reached up to 100%, it showed rapid deactivation due to non-sulfidation. The sulfide species were required to prevent coking and side reaction interferences. Popov and co-workers [224], found a sulfided CoMo supported with silica-alumina as more active and stable than the non-sulfided counterpart. It produced a well-stabilized 100% conversion for 1 h period compared to 74% conversion for the non-sulfided catalyst that deactivated with time. According to He and Wang [225], both CoMo/Al2O3 and NiMo/Al2O3 were more active, stable and selective for 2 h when sulfided. These materials produced >90% yields of hydrocarbons in addition to complete conversion of oil. Yang et al. [226], reported the sulfidation of CoMo/MgO catalyst at 400 °C for 4 h to have a beneficial effect on its overall catalytic stability, but further demonstrated a P-modified CoMo/MgO catalyst as more active and stable. Hong et al. [227], compared the activities of a range of Pt-doped catalysts with that of CoMo/Al2O3 (sulfided). All catalysts produced closely similar conversions of 100% with selectivity to hydrocarbon products and stable throughout the reaction period. Mortensen et al. investigated the effect of impurities such as Cl, S, and K to Ni-MoS2 activity in hydrodeoxygenation of mixture of 1-octanol and phenol [228]. Although the catalyst stability was maintained with exposure of impurities, but the obtained bio-oil contained sulfur compound such as thiol, especially under low residence time. The amount of sulfur flow need to be enhanced at high water content due to removal of sulfur edge by oxygen from water. They revealed that chlorine have higher tendency to bind with active sites of MoS2, thus destructed the catalytic activity, but restored after removing chlorine from the feed. On contrary, potassium (K) deactivated the catalytic performance permanently until only less than 5% degree of deoxygenation due to penetration of K to vacancy sites of MoS2, thus blockade the active sites. From all of these studied sulfide catalyst, it was confirmed that the catalyst required sulfur feed, thus make the process unfavorable from economic and environment perspective. 5 Peculiarities of phosphorous modification Phosphorous modification is another alternative to improve HDO performance. Metal that modified with phosphide improved proton transfer ability and created new active sites that increased feedstock dispersion to the catalyst. This catalyst form promoted decarboxylation and dehydrogenation with similar activity to noble metals. However, too high phosphorous contents tend to agglomerate and decreased the catalytic activity [229]. The introduction of transition metal-phosphide catalyst for the hydrotreating of the derived oils and corresponding model compounds. It is a common science that phosphorous compounds can react with metals to yield phosphides of wide range of structures, activity and stability properties in different catalysis processes [230–232]. Although almost all the metals known today interacted with phosphorous to form the phosphide compounds, those transition metals (i.e. MP and M2P; M = metal) and the supported derivatives were more recognized for HDO and other hydrotreating applications. It has been widely acknowledged in the literature that the activities of the metal phosphide systems were connected to their structures illustrated in Fig. 10 [233]. Accordingly, the chemistry of the preparations, structural elucidations and their link with other compounds such as carbides and nitrides have been substantially documented by a good number of publications [234–237]. Therefore, the current review laid emphasis on their role during HDO reaction of oils derived from algae and the associated model compounds. Their activities were dependent to the nature of the feed, catalyst synthesis procedures as well as the reaction conditions [238–242]. Recently, Ly and co-researchers [243], conducted HDO reactions with two hybrid phosphides (i.e. Fe2P and Ni2P) doped over alumina particles. The catalysts were evaluated in the hydrotreating of substituted furan and oil derived from saccharina algae. The loadings of phosphide particles were varied between 5 and 15 wt.% and the resulted catalysts calcined at temperatures in the range of 500–800 °C. The catalysts were found to exhibit pore volume and pore sizes in the ranges of 0.26–0.48 mL/g and 4.21–5.75 nm, respectively. For the test reactions performed with Fe2P/Al2O3 catalyst calcined at 500 °C, the catalytic activity and selectivity to fuel hydrocarbon products were dependent on the Fe2P loadings. For instance, increasing P loading from 5 to 15 wt.%, reduced conversion from 85% to 58%. Accordingly, the 5 wt.% Fe2P/Al2O3 produced the highest yield of fuel range hydrocarbons (i.e. > 84%). While the low Fe2P loadings were beneficial in achieving high dispersion of particles over the alumina support, higher loadings formed agglomerates of particles that deactivated quickly. On the other hand, catalysts calcined at 600 °C produced the best activity of 93% conversion and >86% yield of hydrocarbon product, respectively. A similar trend was observed with the Ni2P catalyst. Accordingly, the overall results agreed with some previous findings [244–247]. Yun et al. [248], studied the HDO using NiMo phosphides. The selected model compound was ɣ-valerolactone (a ketone common in most oil feeds). The active Ni-Mo-P phase was doped over H-MCM-41 as support and evaluated at temperatures of 200 to 350 °C in the presence of 0.5 MPa hydrogen. The reactions were also repeated with doped Ni2P and MoP catalysts at the same conditions. Generally, conversion increased with increasing temperature. For instance, at 250 °C, the conversion was 14% for the Ni-Mo-P/H-MCM-41 catalyst but increased to 99% at 350 °C and also stable. On the other hand, the yield of hydrocarbon products was nearly constant between 96 and 100% for all the studied catalysts and temperatures. The excellent activity-stability properties were attributed to low loadings of the active phases onto the H-MCM-41 support. Zhao et al. [249], developed several NiFeP/SiO2 materials in order to establish the main active sites in the Ni2P/SiO2 hydrotreating material. The Fe/Ni ratios were varied between 0 and 3. According to their results, all the catalysts showed excellent activity and selectivity at 3.1 MPa and 340 °C. Accordingly, the Fe and Ni particles homogenously interacted to form Fe-Ni-P species with enhanced activities. The active Ni(II) sites could be replaced by Fe(II) species and participate substantially at the hydrogenation stages of the reaction. Similarly, the Ni(II) sites was not replaced by Fe(II) particles and therefore performed other intermediary reactions during the hydrotreating reaction [250,251]. According to Vatituna et al. [252], the best way to incorporate the P particles into NiMo, CoMo or the NiFe catalyst was by the introduction of the P particles into the impregnation solution at the early stage of catalyst synthesis. This way, highly active phosphide particles with resistance to deactivation would be generated. Wu and co-workers [253], explored the role of P compositions in Ni2P catalytic systems by changing the Ni/P ratios during guaiacol upgrading via HDO. The Ni/P compositions were varied between 1 and 3, and SiO2 particles were incorporated as the support. While the dispersion of the Ni2P particles increased with reduction in the Ni/P ratio, the active surface area and particle sizes declined. For instance, when the Ni/P ratio was 3, the dispersion was 5.3% but increased to 9.4% when the Ni/P ratio was reduced to 1. On the other hand, the particle size reduced from 18.9 to 10.6 nm when the Ni/P ratio was reduced from 3 to 1. According to the reaction data, guaiacol conversion increased with increased in the Ni/P ratio. When Ni/P ratio was 1, the conversion was 93%, then increased to 94 and 99.8% at ratio of 2 and 3, respectively. However, reverse was the case for the yield of hydrocarbon products such as benzene and its derivatives. In terms of catalyst deactivation by coking, the amount of carbonaceous materials increased at high Ni/P ratios thereby reducing the catalytic stability. The mechanistic reaction over phosphorous modification to several transition metals was reported by Jain et al. using DFT calculation [254]. They studied three types of catalysts namely FeMoP, RuMoP and NiMoP using phenol as a model compound. The partial charge of metal and phosphorous contributed to CO elongation that can be used as a descriptor to activation energy. They revealed that FeMoP preferred to cleavage the CO bond, while RuMoP and NiMoP favored to ring hydrogenation which are the same with experimental selectivity result. Multifunctional catalyst was also explored for HDO reaction with phosphide modification. Tan et al. used Ni2P/Zr-SBA-15 as a catalyst to convert Jatropha oil directly to jet fuel range [255]. Zr was loaded simultaneously with SBA-15 synthesis and followed by impregnation with Ni and P precursor. These mixtures were then formed ZrP and Ni2P, thus improve the catalytic activity. The HDO evaluation at 45 Bar of hydrogen and 330 °C, produced 80% aliphatic compound in the range of C8 C16. From the product distribution, it was confirmed that the catalyst favored deoxidation, aromatization and cracking. This result would open plethora of interest for one step hydrodeoxygenation of fatty acids paraffin with low cost transition metals. 6 Stability of catalysts in water/steam: hydrothermal HDO The application of hydrothermal conditions can be very attractive in algae-derived oils HDO and allied biomass valorization [256–259]. However, appropriate control of the catalyst stability under these conditions was critical to handling negative reaction results. In zeolite catalyst, the rupture of Si-O-Al species via facile hydrolysis in water or steam was a serious issue that affect the zeolite stability. According to Ravenelle et al. [260], who explored the stability features of some synthetic zeolite frameworks (H-ZSM-5 and H-Y), the structural features could be degraded under hydrothermal conditions thereby limiting the overall catalytic activity. Their research employed steam generated between 150 and 200 °C for zeolites treatment for a period of 6 h. Both catalysts exhibited Si-O-Si bonds rupture that was also framework dependent. Specifically, the H-Y zeolite exhibited more degradation characteristics that increased with increasing zeolite acidity. Reduction of catalyst crystallinity was observed over time of hydrothermal treatment. They concluded that zeolites with low Si/Al ratios (i.e. high acidity) was more susceptible to hydrolysis under hydrothermal conditions. Another study by Bakare and his co-researchers [261], showed a pronounced degradation of Si-O-Al species with MTT frameworks when hydrothermally treated at 200 °C for 72 h. In addition to the reduction in zeolitic acidity by more than 0.1 mmol/g, the active surface area experienced a concomitant declination with time of treatment due to Si-Al species leaching. Several other investigators [262–266], reported variable degrees of instability with zeolite-based catalysts under hydrothermal conditions. A part from the zeolite-based catalysts, hydrothermal instability of selected systems based on transition metals (i.e. Ni, Co, Mo, Pd, Ru, Pt, etc.) supported with oxides have also been documented [267–269]. Ravenelle et al. [270], showed Al2O3-based catalysts to deactivate as a result of conversion to boehmite phase, which in turn caused Lewis acidity reduction and surface area collapse. They, however demonstrated that the destruction to these properties could significantly be inhibited when appropriate loadings of the metals (like Pt, Ni, etc.) were employed. This way, the metals provide protection to the surface –OH groups of the Al2O3 while catalyzing the reaction on interest. The findings were also in agreement with those later and earlier reported [271–273]. Jun et al. [274], developed several Pd/Nb2O5 catalysts and evaluated their hydrothermal features during hexanediol HDO at 250 °C and 5.5 MPa of hydrogen. They found good metal-support interactions to be responsible for the retention of physico-chemical properties of the catalysts. The HDO results showed hexanediol conversions between 88.5 and 97.5% with corresponding hexane selectivities between 18.6 and 38.9%. In agreement with earlier results [239,275–278], catalysts for hydrothermal HDO must be modified with acidic supports to ensure retention of structural integrity and achieve optimal conversion. Accordingly, the bifunctionality allowed the process to take place through three reaction modes that include CO ruptures through dehydration on the acidic functions, hydrogenation of CC and CO bonds on the metallic surfaces and CC ruptures were aided by sequential dehydration-decarbonylation processes. Generally, hydrothermal HDO of oils could be achieved with stability control when the catalyst design procedures and experimental conditions were carefully selected. One unique feature adopted recently in the literature was the in situ synthesis of hydrogen for the hydrothermal HDO process. During the normal HDO reaction, H2 was commonly employed at elevated pressures to facilitate oil conversion, which necessitate the requirement of advanced facilities and serious safety considerations. These factors attributed to the in situ option for the hydrothermal HDO process. Appropriate water-solvent ratios could be employed during the process to attain maximum catalytic efficiency. Solvents such as simple alcohols and organic acids (e.g. HCOOH, MeOH, EtOH, etc.) could be used in this regard. In their work, Mao et al. [279], conducted hydrothermal HDO of triglyceride ester derived from algae using Pd/C catalyst containing 5 wt.% Pd. The reaction was conducted by incorporating different solvent/water ratios in the range of 0:100 to 90:10 at 250 °C for 12 h. The results indicated that a competitive reaction could be observed depending on the solvent used. Although dodecane produced 100% conversion at all the solvent/water ratios, the selectivity was shifted towards oleic and steric acids formation rather than hydrocarbons because hydrolysis of esters was faster than HDO at low solvent/water ratios, but the yield of diesel-range hydrocarbon products increased reaching 52% at high ratios like 70/10 (dodecanal to water). Among the solvents utilized, decalin produced the highest hydrocarbons yield of 71.91% at the decalin to water ratio of 90/10. While the influence of in situ generated hydrogen was considered positive in terms of catalytic activity, the Pd/C catalyst was stable at all water/solvent ratios due to appropriate loading (i.e. 5 wt.%) of Pd particles. Yang et al. [280], conducted the reaction using zero-valent Al for oil upgrading under variable conditions. Specifically, aqueous phase was varied between 1:25 to 2:25 gmL−1 for the metal to phase ratio. This way, in situ hydrogen required for HDO was produced. The oil conversion was 100% and 76.38% optimum yield of hydrocarbons. Despite the extreme temperature of 500 °C employed, the catalyst was stable for the 2 h reaction period. Accordingly, the characterization results showed a retention of physico-chemical properties of the catalyst. Li et al. [281], developed a series of Ni-based catalysts via sequential precipitation techniques. The catalysts containing 60 wt.% of Ni in each case included Ni/LaO, Ni/AlSiO and a range of Ni/LaAlSiO systems possessing variable loadings of La/Si ratios. For the hydrothermal treatment, the developed catalysts were subjected to 8 h heating at 150 °C and the HDO reactions conducted using 4 MPa H2 pressure at variable temperatures and space velocities. The results of hydrothermal treatment showed only a slight reduction in the Ni content due to the incorporation of La and Si species which provided stabilization effects. In agreement with these results, Li et al. [282], previously demonstrated a Ni/AlSiO system to be more appreciably stable than Ni/Al2O3 when hydrothermally treated at 90 °C. The latter catalyst was rapidly hydrated into Al(OH)3 species. In addition to retention of Ni loadings, Li et al. [281], further showed that the acidity-basicity properties of the various Ni/AlSiO and Ni/LaAlSiO systems were retained following the hydrothermal treatment. Among all catalysts, Ni/LaAlSiO systems exhibited 95–99% HDO conversions with equivalent yields of hydrocarbon products. Therefore, the incorporation of La and Si together was not only positive towards catalyst stabilization, but also contributed to acidity-basicity retention and activity enhancement. According to some previous publications [283–285], modification of SiO2 and Al2O3 supports with La stabilized the surface by hindering structural collapse/transition and/or diffusion of active particles. This approach was then improved the catalyst hydrothermal stability. In addition to the incorporation of metals such as La, Si, Al, Ce, Nd, Eu, etc., structural and acidity stabilization during hydrothermal HDO, there were other potential approaches that have yielded promising results in related biomass-based and hydrotreating reactions. These include fluoride synthesis and silane treatment and more applicable to the zeolite-based catalysts [286–289]. These category of catalysts (i.e. the zeolites) could be prepared using the fluoride media by changing the ratio of fluoride and silica species. The introduction of fluoride ions provided an appropriate replacement of the OH− derivatives in the zeolites and consequently favor stability under water/steam (i.e. hydrothermal) conditions [290,291]. This way, the ruptures of Si-O-Si and Si-O-Al functions in the zeolite-frameworks could be substantially inhibited. In this regard, Jon et al. [292], developed a range of H-BEA systems possessing variable Si/Al ratios and upgraded them using NH4F media to generate the fluorided-catalysts. Hydrothermal stability tests conducted up to 1000 °C revealed a retention of the structure-acidity properties for the F−-modified catalysts, but a rapid degradation of the F−-free H-BEA zeolite. In terms of silane treatment, Zapata and co-researchers [293], examined some selected silane derivatives as synthetic modifiers for H-USY (Si/Al = 30). These materials ensured retention of pore volume, acidity and surface areas after hot water treatment at 200 °C for 24 h. In a related development, Khalil et al. [294], found that the silylation treatment contributed to stable conversion-selectivity properties during heavy oil hydrotreating at 470 °C for 4 h. Therefore, shifting the trend towards hydrothermal HDO application will escalate the process feasibility. The potential catalyst that can go to industrial scale was Ni2P supported on α-Al2O3 modified by SiO2 [295]. This catalyst was prepared by impregnation of Ni to α-Al2O3, then mixed to hydrothermal gel composition of SiO2. In this study, SiO2 acted as a spacer to inhibit phosphorous loss due to interaction between water and Ni2P. This catalyst exhibited 99% conversion of soybean oil to C15–18 paraffin and stable until 144 h which is three times higher than in absence of SiO2. 7 Conclusions and outlook Hydrothermal liquefaction is a potential method for extraction of oil from algae. This bio-crude oil has high oxygen content that unfavorable in fuel characteristic. Thus, hydrodeoxygenation (HDO) reaction is increasingly becoming a major alternative for the elimination of oxygenates from algae-derived oils in a way to improve the fuel quality of the oils in compatible to conventional fuels. The literature documented in this paper indicated that a lot of research has been executed in the area with greater emphasis to catalyst design, selection of reaction conditions and the influence of oil-composition in deriving gasoline or diesel grade hydrocarbons. So far, there are certain parameters that have been fully resolved. The HDO catalysis mapping during last five years as presented in Fig. 11 revealed that Pd and Ni as the main catalyst. Ni based catalyst with sulfide and phosphide modification using zeolite and metal oxide as support compete with Pd based catalyst. The role of H2 pressure and the influence of zeolite textural-acidity properties on products yield. Ni based catalysts were more susceptible to HDO, while noble metal such as Pd systems were prominent in catalyzing hydrodecaronylation and hydrodecarboxylation. In all cases, the main reactions involved were those leading to CO, COH and CC cleavages depending on the catalyst composition and applied reaction conditions. On the other hand, high H2 pressure was required to favor HDO than catalytic cracking and in situ H2 production has a greater positive effect on the hydrocarbons yield than when external H2 source was considered. Zeolite catalysts were good candidates for not only HDO, but also catalyzing isomerization and mild hydrocracking thereby enhancing the production of light gasoline hydrocarbons. However, acidity control remained a key issue to be considered. The role of sulfidation in handling Ni-based catalysts deactivation by coking or impurities in the feed has also been resolved. In addition to active sites modification, the sulfide systems protected the catalyst surface from destructive effects of coke precursors or N- and S-compounds that can be found in the oil feed. Transition metal phosphides have been explored in this direction with Ni2P, MoP and Fe2P supported with oxides exhibiting the best catalytic activities so far. They were more active than commercial NiMo-catalysts and could be more stable than the sulfided catalysts. Other issues resolved include the effect of hydrothermal HDO conditions on catalyst stability, the influence of catalyst preparation procedure on the HDO of model compounds and the effect of low-to-high pressure on the overall activity-selectivity properties of sulfided NiMo and CoMo catalysts. Despite the above progress achieved in algae-derived oils HDO, there are key issues that should be explored in order to raise the prospects of HDO as an industrial process. In the production of diesel-range hydrocarbons, cracking remained a challenge because it shifts the reaction towards lighter products (including gases). Therefore, considering zeolite catalysts design in the hierarchical and/or nanoscale will be very important. These zeolite design was beneficial in reducing unwanted facile cracking and the elimination of diffusion problems in related reactions. Although sulfidation and phosphide synthesis were favorable, the literature has not fully establish the most appropriate sulfiding and phosphiding agents. Similarly, the concentration of sulfur or phosphorous required to attain optimal activity. In terms of hydrothermal HDO, zeolites design in the fluoride media and the consideration of organic silanes during synthesis are other areas for exploration. In addition to possibility of enhancing catalyst-hydrothermal stability, the overall HDO activity could be escalated. The reaction mechanisms developed so far were mainly applicable to the specific model compounds. Therefore, new investigations that can identify competing reactions occur in the real oil feeds were crucial toward escalating the understanding of process chemistry. Another issue of interest is the reactor design. Different reactor configurations should be evaluated to establish the most suitable design under specific reaction conditions. When these parameters are fully investigated and challenges resolved, the HDO process will greatly contribute in handling the lingering energy challenges. CRediT authorship contribution statement Ahmad Galadima: . Ahmad Masudi: Conceptualization, Writing – review & editing. Oki Muraza: . Declaration of Competing Interest The authors declare that they have no known competing financial interests or personal relationships that could have appeared to influence the work reported in this paper. Acknowledgment The authors would like to appreciate the provision of funds by Saudi Aramco for supporting this work as part of the Oil Upgrading theme at King Fahd University of Petroleum and Minerals. O.M. would like to acknowledge a prestigious grant from Saudi Aramco on Oil Upgrading. References [1] C. Yan M. Zheng G. Shen Y. Cheng S. Ma J. Sun M. Cui F. Zhang Y. Han Y. Chen Characterization of carbon fractions in carbonaceous aerosols from typical fossil fuel combustion sources Fuel 254 2019 115620 C. Yan, M. Zheng, G. Shen, Y. Cheng, S. Ma, J. Sun, M. Cui, F. Zhang, Y. Han, Y. Chen, Characterization of carbon fractions in carbonaceous aerosols from typical fossil fuel combustion sources, Fuel, 254 (2019) 115620. [2] I. Henriques P. Sadorsky Investor implications of divesting from fossil fuels Glob. Financ. J. 38 2018 30 44 I. Henriques, P. Sadorsky, Investor implications of divesting from fossil fuels, Glob. Financ. J., 38 (2018) 30–44. [3] A. Kibria S.B. Akhundjanov R. Oladi Fossil fuel share in the energy mix and economic growth Int. Rev. Econ. Financ. 59 2019 253 264 A. Kibria, S.B. Akhundjanov, R. Oladi, Fossil fuel share in the energy mix and economic growth, Int. Rev. Econ. Financ., 59 (2019) 253–264. [4] D. Halcoussis A.D. Lowenberg The effects of the fossil fuel divestment campaign on stock returns North Am. J. Econ. Financ. 47 2019 669 674 D. Halcoussis, A.D. Lowenberg, The effects of the fossil fuel divestment campaign on stock returns, North Am. J. Econ. Financ., 47 (2019) 669–674. [5] F. Martins C. Felgueiras M. Smitková Fossil fuel energy consumption in European countries Energy Procedia, 153 2018 107 111 F. Martins, C. Felgueiras, M. Smitková, Fossil fuel energy consumption in European countries, Energy Procedia,153 (2018) 107–111. [6] O. Muraza A. Galadima Aquathermolysis of heavy oil: a review and perspective on catalyst development Fuel 157 2015 219 231 O. Muraza, A. Galadima, Aquathermolysis of heavy oil: a review and perspective on catalyst development, Fuel, 157 (2015) 219–231. [7] M. Tymoszuk K. Mroczek S. Kalisz H. Kubiczek An investigation of biomass grindability Energy 183 2019 116 126 M. Tymoszuk, K. Mroczek, S. Kalisz, H. Kubiczek, An investigation of biomass grindability, Energy, 183 (2019) 116–126. [8] S. Safarian R. Unnþórsson C. Richter A review of biomass gasification modelling Renew. Sustain. Energy Rev. 110 2019 378 391 S. Safarian, R. Unnþórsson, C. Richter, A review of biomass gasification modelling, Renew. Sustain. Energy Rev., 110 (2019) 378–391. [9] J. Yang Q. He L. Yang A review on hydrothermal co-liquefaction of biomass Appl. Energy 250 2019 926 945 J. Yang, Q. He, L. Yang, A review on hydrothermal co-liquefaction of biomass, Appl. Energy, 250 (2019) 926–945. [10] N. Dave R. Selvaraj T. Varadavenkatesan R. Vinayagam A critical review on production of bioethanol from macroalgal biomass Algal Res. 42 2019 101606 N. Dave, R. Selvaraj, T. Varadavenkatesan, R. Vinayagam, A critical review on production of bioethanol from macroalgal biomass, Algal Res., 42 (2019) 101606. [11] P. Pradhan S.M. Mahajani A. Arora Production and utilization of fuel pellets from biomass: a review Fuel Process. Technol. 181 2018 215 232 P. Pradhan, S.M. Mahajani, A. Arora, Production and utilization of fuel pellets from biomass: a review, Fuel Process. Technol., 181 (2018) 215–232. [12] F. Ahmad E.L. Silva M.B.A. Varesche Hydrothermal processing of biomass for anaerobic digestion-a review Renew. Sustain. Energy Rev. 98 2018 108 124 F. Ahmad, E.L. Silva, M.B.A. Varesche, Hydrothermal processing of biomass for anaerobic digestion-a review, Renew. Sustain. Energy Rev., 98 (2018) 108–124. [13] K.T. Malladi T. Sowlati Biomass logistics: a review of important features, optimization modeling and the new trends Renew. Sustain. Energy Rev. 94 2018 587 599 K.T. Malladi, T. Sowlati, Biomass logistics: a review of important features, optimization modeling and the new trends, Renew. Sustain. Energy Rev., 94 (2018) 587–599. [14] X. Hu M. Gholizadeh Biomass pyrolysis: a review of the process development and challenges from initial researches up to the commercialisation stage J. Energy Chem. 39 2019 109 143 X. Hu, M. Gholizadeh, Biomass pyrolysis: a review of the process development and challenges from initial researches up to the commercialisation stage, J. Energy Chem., 39 (2019) 109–143. [15] V. Dhyani T. Bhaskar A comprehensive review on the pyrolysis of lignocellulosic biomass Renew. Energy 129 2018 695 716 V. Dhyani, T. Bhaskar, A comprehensive review on the pyrolysis of lignocellulosic biomass, Renew. Energy, 129 (2018) 695–716. [16] S.G. Azevedo T. Sequeira M. Santos L. Mendes Biomass-related sustainability: a review of the literature and interpretive structural modeling Energy 171 2019 1107 1125 S.G. Azevedo, T. Sequeira, M. Santos, L. Mendes, Biomass-related sustainability: a review of the literature and interpretive structural modeling, Energy, 171 (2019) 1107–1125. [17] O. Muraza A. Galadima A review on coke management during dry reforming of methane Int. J. Energy Res. 39 2015 1196 1216 O. Muraza, A. Galadima, A review on coke management during dry reforming of methane, Int. J. Energy Res., 39 (2015) 1196–1216. [18] A. Galadima O. Muraza From synthesis gas production to methanol synthesis and potential upgrade to gasoline range hydrocarbons: a review J. Nat. Gas Sci. Eng. 25 2015 303 316 A. Galadima, O. Muraza, From synthesis gas production to methanol synthesis and potential upgrade to gasoline range hydrocarbons: a review, J. Nat. Gas Sci. Eng., 25 (2015) 303–316. [19] E. Sánchez-Arreola H. Bach L.R. Hernández Biodiesel production from Cascabela ovata seed oil Bioresour. Technol. Rep. 7 2019 100220 E. Sánchez-Arreola, H. Bach, L.R. Hernández, Biodiesel production from Cascabela ovata seed oil, Bioresour. Technol. Rep., 7 (2019) 100220. [20] M. Tabatabaei M. Aghbashlo M. Dehhaghi H.K.S. Panahi A. Mollahosseini M. Hosseini M.M. Soufiyan Reactor technologies for biodiesel production and processing: a review Prog. Energy Combust. Sci. 74 2019 239 303 M. Tabatabaei, M. Aghbashlo, M. Dehhaghi, H.K.S. Panahi, A. Mollahosseini, M. Hosseini, M.M. Soufiyan, Reactor technologies for biodiesel production and processing: a review, Prog. Energy Combust. Sci., 74 (2019) 239–303. [21] J.H. Lee J.H. Lee D.S. Kim H.Y. Yoo C. Park S.W. Kim Biodiesel production by lipases co-immobilized on the functionalized activated carbon Bioresour. Technol. Rep. 7 2019 100248 J.H. Lee, J.H. Lee, D.S. Kim, H.Y. Yoo, C. Park, S.W. Kim, Biodiesel production by lipases co-immobilized on the functionalized activated carbon, Bioresour. Technol. Rep., 7 (2019) 100248. [22] A. Galadima O. Muraza In situ fast pyrolysis of biomass with zeolite catalysts for bioaromatics/gasoline production: a review Energy Convers. Manag. 105 2015 338 354 A. Galadima, O. Muraza, In situ fast pyrolysis of biomass with zeolite catalysts for bioaromatics/gasoline production: a review, Energy Convers. Manag., 105 (2015) 338–354. [23] A. Galadima O. Muraza Catalytic upgrading of vegetable oils into jet fuels range hydrocarbons using heterogeneous catalysts: a review J. Ind. Eng. Chem. 29 2015 12 23 A. Galadima, O. Muraza, Catalytic upgrading of vegetable oils into jet fuels range hydrocarbons using heterogeneous catalysts: a review, J. Ind. Eng. Chem., 29 (2015) 12–23. [24] A. Galadima O. Muraza Catalytic upgrading of bioethanol to fuel grade biobutanol: a review Ind. Eng. Chem. Res. 54 2015 7181 7194 A. Galadima, O. Muraza, Catalytic upgrading of bioethanol to fuel grade biobutanol: a review, Ind. Eng. Chem. Res., 54 (2015) 7181–7194. [25] Y.H. Chan K.W. Cheah B.S. How A.C.M. Loy M. Shahbaz H.K.G. Singh N.a.R. Yusuf A.F.A. Shuhaili S. Yusup W.A.W.A.K. Ghani J. Rambli Y. Kansha H.L. Lam B.H. Hong S.L. Ngan An overview of biomass thermochemical conversion technologies in Malaysia Sci. Total Environ. 680 2019 105 123 Y.H. Chan, K.W. Cheah, B.S. How, A.C.M. Loy, M. Shahbaz, H.K.G. Singh, N.a.R. Yusuf, A.F.A. Shuhaili, S. Yusup, W.A.W.A.K. Ghani, J. Rambli, Y. Kansha, H.L. Lam, B.H. Hong, S.L. Ngan, An overview of biomass thermochemical conversion technologies in Malaysia, Sci. Total Environ., 680 (2019) 105–123. [26] A. Galadima O. Muraza Recent developments on silicoaluminates and silicoaluminophosphates in the methanol-to-propylene reaction: a mini review Ind. Eng. Chem. Res. 54 2015 4891 4905 A. Galadima, O. Muraza, Recent developments on silicoaluminates and silicoaluminophosphates in the methanol-to-propylene reaction: a mini review, Ind. Eng. Chem. Res., 54 (2015) 4891–4905. [27] A. Galadima O. Muraza Biodiesel production from algae by using heterogeneous catalysts: a critical review Energy 78 2014 72 83 A. Galadima, O. Muraza, Biodiesel production from algae by using heterogeneous catalysts: a critical review, Energy, 78 (2014) 72–83. [28] B. Zhang K. Ogden Nitrogen balances and impacts on the algae cultivation-extraction-digestion-cultivation process Algal Res. 39 2019 101434 B. Zhang, K. Ogden, Nitrogen balances and impacts on the algae cultivation-extraction-digestion-cultivation process, Algal Res., 39 (2019) 101434. [29] P.M. Slegers S. Leduc R.H. Wijffels G. van Straten A.J.B. van Boxtel Logistic analysis of algae cultivation Bioresour. Technol. 179 2015 314 322 P.M. Slegers, S. Leduc, R.H. Wijffels, G. van Straten, A.J.B. van Boxtel, Logistic analysis of algae cultivation, Bioresour. Technol., 179 (2015) 314–322. [30] Q. Béchet M. Plouviez P. Chambonnière B. Guieysse C. Gonzalez-Fernandez R. Muñoz 21 - Environmental impacts of full-scale algae cultivation Microalgae-Based Biofuels and Bioproducts 2017 Woodhead Publishing 505 525 Place Published Q. Béchet, M. Plouviez, P. Chambonnière, B. Guieysse, 21 - Environmental impacts of full-scale algae cultivation, in: C. Gonzalez-Fernandez, R. Muñoz (Eds.) Microalgae-Based Biofuels and Bioproducts, Woodhead Publishing, Place Published, 2017, pp. 505–525. [31] S. Bhandalkar, (2019). Algae products market to reach $3,451 Million, Globally, by 2025. Allied market research. Accessed: 19 August 2021. https://www.alliedmarketresearch.com/press-release/algae-products-market.html. [32] L. Wood, (2019). Global algae market analysis report, 2019-2025 - promising pre-commercial success of biofuel production from algae signals robust opportunities - RESEARCHANDMARKEts.com. Business wire:A breakshire hataway company. Acessed: 17 August 2021, https://www.businesswire.com/news/home/20190814005389/en/Global-Algae-Market-Analysis-Report-2019-2025–. [33] A. Galadima O. Muraza Biodiesel production from algae by using heterogeneous catalysts: a critical review Energy 78 2014 72 83 A. Galadima, O. Muraza, Biodiesel production from algae by using heterogeneous catalysts: a critical review, Energy, 78 (2014) 72–83. [34] M. Zhang M. Li H. Wu Ageing of bio-oil and its fractions in presence of surfactants Fuel 252 2019 403 407 M. Zhang, M. Li, H. Wu, Ageing of bio-oil and its fractions in presence of surfactants, Fuel, 252 (2019) 403–407. [35] Z. Ma L. Wei W. Zhou L. Jia B. Hou D. Li Y. Zhao Upgrading of fast pyrolysis bio-oil to drop-in fuel over Ru catalysts J. Energy Inst. 92 2019 855 860 Z. Ma, L. Wei, W. Zhou, L. Jia, B. Hou, D. Li, Y. Zhao, Upgrading of fast pyrolysis bio-oil to drop-in fuel over Ru catalysts, J. Energy Inst., 92 (2019) 855–860. [36] Y. Han M. Gholizadeh C.C. Tran S. Kaliaguine C.Z. Li M. Olarte M. Garcia-Perez Hydrotreatment of pyrolysis bio-oil: a review Fuel Process. Technol. 195 2019 106140 Y. Han, M. Gholizadeh, C.C. Tran, S. Kaliaguine, C.Z. Li, M. Olarte, M. Garcia-Perez, Hydrotreatment of pyrolysis bio-oil: a review, Fuel Process. Technol., 195 (2019) 106140. [37] E. David J. Kopač Upgrading the characteristics of the bio-oil obtained from rapeseed oil cake pyrolysis through the catalytic treatment of its vapors J. Anal. Appl. Pyrolysis 141 2019 104638 E. David, J. Kopač, Upgrading the characteristics of the bio-oil obtained from rapeseed oil cake pyrolysis through the catalytic treatment of its vapors, J. Anal. Appl. Pyrolysis, 141 (2019) 104638. [38] J.H. Gary G.E. Handwerk M.J. Kaiser Petroleum Refining: Technology and Economics 2007 CRC PressPlace Published J.H. Gary, G.E. Handwerk, M.J. Kaiser, Petroleum Refining: Technology and Economics, CRC Press, Place Published, 2007. [39] S. Papavinasam S. Papavinasam Chapter 2 - oil and gas industry network Corrosion Control in the Oil and Gas Industry 2014 Gulf Professional Publishing 41 131 Place Published S. Papavinasam, Chapter 2 - oil and gas industry network, in: S. Papavinasam (Ed.) Corrosion Control in the Oil and Gas Industry, Gulf Professional Publishing, Place Published, 2014, pp. 41–131. [40] C.G. Pernalete J. van Baten J.C. Urbina J.F. Arévalo K.V. Gernaey J.K. Huusom R. Gani A molecular reconstruction feed characterization and CAPE OPEN implementation strategy to develop a tool for modeling HDT reactors for light petroleum cuts Computer Aided Chemical Engineering 2015 Elsevier 359 364 Place Published C.G. Pernalete, J. van Baten, J.C. Urbina, J.F. Arévalo, A molecular reconstruction feed characterization and CAPE OPEN implementation strategy to develop a tool for modeling HDT reactors for light petroleum cuts, in: K.V. Gernaey, J.K. Huusom, R. Gani (Eds.) Computer Aided Chemical Engineering, Elsevier, Place Published, 2015, pp. 359–364. [41] Z. Li E. Jiang X. Xu Y. Sun R. Tu Hydrodeoxygenation of phenols, acids, and ketones as model bio-oil for hydrocarbon fuel over Ni-based catalysts modified by Al, La and Ga Renew. Energy 146 2020 1991 2007 Z. Li, E. Jiang, X. Xu, Y. Sun, R. Tu, Hydrodeoxygenation of phenols, acids, and ketones as model bio-oil for hydrocarbon fuel over Ni-based catalysts modified by Al, La and Ga, Renew. Energy, 146 (2020) 1991–2007. [42] N. Zhao Y. Zheng J. Chen Remarkably reducing carbon loss and H2 consumption on Ni-Ga intermetallic compounds in deoxygenation of methyl esters to hydrocarbons J. Energy Chem. 41 2020 194 208 N. Zhao, Y. Zheng, J. Chen, Remarkably reducing carbon loss and H2 consumption on Ni-Ga intermetallic compounds in deoxygenation of methyl esters to hydrocarbons, J. Energy Chem., 41 (2020) 194–208. [43] H. Shafaghat J.M. Kim I.G. Lee J. Jae S.C. Jung Y.K. Park Catalytic hydrodeoxygenation of crude bio-oil in supercritical methanol using supported nickel catalysts Renew. Energy 2019 159 166 H. Shafaghat, J.M. Kim, I.G. Lee, J. Jae, S.C. Jung, Y.K. Park, Catalytic hydrodeoxygenation of crude bio-oil in supercritical methanol using supported nickel catalysts, Renew. Energy, (2019) 159–166. [44] T. Yang L. Shi R. Li B. Li X. Kai Hydrodeoxygenation of crude bio-oil in situ in the bio-oil aqueous phase with addition of zero-valent aluminum Fuel Process. Technol. 184 2019 65 72 T. Yang, L. Shi, R. Li, B. Li, X. Kai, Hydrodeoxygenation of crude bio-oil in situ in the bio-oil aqueous phase with addition of zero-valent aluminum, Fuel Process. Technol., (2019) 65–72. [45] R.C. Brown Thermochemical Processing of Biomass: Conversion Into Fuels, Chemicals and Power 2019 John Wiley & Sons Place Published R.C. Brown, Thermochemical Processing of Biomass: Conversion Into Fuels, Chemicals and Power, John Wiley & Sons, Place Published, 2019. [46] P. Adams T. Bridgwater A. Lea-Langton A. Ross I. Watson P. Thornley P. Adams Chapter 8 - Biomass Conversion Technologies Greenhouse Gas Balances of Bioenergy Systems 2018 Academic Press 107 139 Place Published P. Adams, T. Bridgwater, A. Lea-Langton, A. Ross, I. Watson, Chapter 8 - Biomass Conversion Technologies, in: P. Thornley, P. Adams (Eds.) Greenhouse Gas Balances of Bioenergy Systems, Academic Press, Place Published, 2018, pp. 107–139. [47] T.M. Brown P. Duan P.E. Savage Hydrothermal liquefaction and gasification of nannochloropsis sp Energy Fuels 24 2010 3639 3646 T.M. Brown, P. Duan, P.E. Savage, Hydrothermal liquefaction and gasification of nannochloropsis sp, Energy Fuels, 24 (2010) 3639–3646. [48] J.N. Jocz P.E. Savage L.T. Thompson Heterogeneous catalyst stability during hydrodenitrogenation in supercritical water Catal. Today 371 2021 171 178 J.N. Jocz, P.E. Savage, L.T. Thompson, Heterogeneous catalyst stability during hydrodenitrogenation in supercritical water, Catal. Today, 371 (2021) 171–178. [49] C. Barrère-Mangote A. Roubaud B. Bouyssiere J. Maillard J. Hertzog J.L. Maître M. Hubert-Roux J.F. Sassi C. Afonso P. Giusti Study of biocrudes obtained via hydrothermal liquefaction (HTL) of wild alga consortium under different conditions Processes 9 2021 1494 C. Barrère-Mangote, A. Roubaud, B. Bouyssiere, J. Maillard, J. Hertzog, J.L. Maître, M. Hubert-Roux, J.F. Sassi, C. Afonso, P. Giusti, Study of biocrudes obtained via hydrothermal liquefaction (HTL) of wild alga consortium under different conditions, Processes, 9 (2021). [50] H. Lee H. Kim M.J. Yu C.H. Ko J.K. Jeon J. Jae S.H. Park S.C. Jung Y.K. Park Catalytic hydrodeoxygenation of bio-oil model compounds over Pt/HY catalyst Sci. Rep. 6 2016 28765 H. Lee, H. Kim, M.J. Yu, C.H. Ko, J.K. Jeon, J. Jae, S.H. Park, S.C. Jung, Y.K. Park, Catalytic hydrodeoxygenation of bio-oil model compounds over Pt/HY catalyst, Sci. Rep., 6 (2016) 28765. [51] M. Tymchyshyn Z. Yuan Y. Zhang C.C. Xu Catalytic hydrodeoxygenation of guaiacol for organosolv lignin depolymerization-catalyst screening and experimental validation Fuel 254 2019 115664 M. Tymchyshyn, Z. Yuan, Y. Zhang, C.C. Xu, Catalytic hydrodeoxygenation of guaiacol for organosolv lignin depolymerization-catalyst screening and experimental validation, Fuel, 254 (2019) 115664. [52] A.A. Dwiatmoko I. Kim L. Zhou J.W. Choi D.J. Suh J. Jae J.M. Ha Hydrodeoxygenation of guaiacol on tungstated zirconia supported Ru catalysts Appl. Catal. A 543 2017 10 16 A.A. Dwiatmoko, I. Kim, L. Zhou, J.W. Choi, D.J. Suh, J. Jae, J.M. Ha, Hydrodeoxygenation of guaiacol on tungstated zirconia supported Ru catalysts, Appl. Catal. A, 543 (2017) 10–16. [53] M. Kwak S. Roh A. Yang H. Lee Y.K. Chang High shear-assisted solvent extraction of lipid from wet biomass of aurantiochytrium sp. KRS101 Sep. Purif. Technol. 227 2019 115666 M. Kwak, S. Roh, A. Yang, H. Lee, Y.K. Chang, High shear-assisted solvent extraction of lipid from wet biomass of aurantiochytrium sp. KRS101, Sep. Purif. Technol., 227 (2019). [54] S. Deshmukh R. Kumar K. Bala Microalgae biodiesel: a review on oil extraction, fatty acid composition, properties and effect on engine performance and emissions Fuel Process. Technol. 191 2019 232 247 S. Deshmukh, R. Kumar, K. Bala, Microalgae biodiesel: a review on oil extraction, fatty acid composition, properties and effect on engine performance and emissions, Fuel Process. Technol., 191 (2019) 232–247. [55] R. Shi R.M. Handler D.R. Shonnard Life cycle assessment of novel technologies for algae harvesting and oil extraction in the renewable diesel pathway Algal Res. 37 2019 248 259 R. Shi, R.M. Handler, D.R. Shonnard, Life cycle assessment of novel technologies for algae harvesting and oil extraction in the renewable diesel pathway, Algal Res., 37 (2019) 248–259. [56] V.M. Ortiz-Martínez P. Andreo-Martínez N. García-Martínez A. Pérez de los Ríos F.J. Hernández-Fernández J. Quesada-Medina Approach to biodiesel production from microalgae under supercritical conditions by the PRISMA method Fuel Process. Technol. 2019 211 222 V.M. Ortiz-Martínez, P. Andreo-Martínez, N. García-Martínez, A. Pérez de los Ríos, F.J. Hernández-Fernández, J. Quesada-Medina, Approach to biodiesel production from microalgae under supercritical conditions by the PRISMA method, Fuel Process. Technol., (2019) 211–222. [57] R. Gallego M. Bueno M. Herrero Sub- and supercritical fluid extraction of bioactive compounds from plants, food-by-products, seaweeds and microalgae-An update TrAC Trends Anal. Chem. 116 2019 198 213 R. Gallego, M. Bueno, M. Herrero, Sub- and supercritical fluid extraction of bioactive compounds from plants, food-by-products, seaweeds and microalgae-An update, TrAC Trends Anal. Chem., 116 (2019) 198–213. [58] H. Sovová R.P. Stateva New developments in the modelling of carotenoids extraction from microalgae with supercritical CO2 J. Supercrit. Fluids 148 2019 93 103 H. Sovová, R.P. Stateva, New developments in the modelling of carotenoids extraction from microalgae with supercritical CO2, J. Supercrit. Fluids, (2019) 93–103. [59] P. Sahni S. Sharma B. Singh Evaluation and quality assessment of defatted microalgae meal of Chlorella as an alternative food ingredient in cookies Nutr. Food Sci. 49 2019 221 231 P. Sahni, S. Sharma, B. Singh, Evaluation and quality assessment of defatted microalgae meal of Chlorella as an alternative food ingredient in cookies, Nutr. Food Sci., 49 (2019) 221–231. [60] X. Hao H. Peng P. Xu M. He B. Dou Production of H2 by steam reforming in schizochytrium algae oil of cell disruption and extraction via ultrasound method Int. J. Hydrog. Energy 44 2019 15779 15786 X. Hao, H. Peng, P. Xu, M. He, B. Dou, Production of H2 by steam reforming in schizochytrium algae oil of cell disruption and extraction via ultrasound method, Int. J. Hydrog. Energy, 44 (2019) 15779–15786. [61] N. Kumari R.K. Singh Biofuel and co-products from algae solvent extraction J. Environ. Manag. 247 2019 196 204 N. Kumari, R.K. Singh, Biofuel and co-products from algae solvent extraction, J. Environ. Manag., 247 (2019) 196–204. [62] G. Yadav W.D. Seider L. Soh J. Zimmerman M.R. Eden M.G. Ierapetritou G.P. Towler Process Intensification of Algae Oil Extraction to Biodiesel Computer Aided Chemical Engineering 2018 Elsevier 1699 1704 Place Published G. Yadav, W.D. Seider, L. Soh, J. Zimmerman, Process Intensification of Algae Oil Extraction to Biodiesel, in: M.R. Eden, M.G. Ierapetritou, G.P. Towler (Eds.) Computer Aided Chemical Engineering, Elsevier, Place Published, 2018, pp. 1699–1704. [63] V. Makareviciene M. Gumbyte E. Sendzikiene Simultaneous extraction of microalgae Ankistrodesmus sp. oil and enzymatic transesterification with ethanol in the mineral diesel medium Food Bioprod. Process. 116 2019 89 97 V. Makareviciene, M. Gumbyte, E. Sendzikiene, Simultaneous extraction of microalgae Ankistrodesmus sp. oil and enzymatic transesterification with ethanol in the mineral diesel medium, Food Bioprod. Process., 116 (2019) 89–97. [64] C.G. Khoo Y.K. Dasan M.K. Lam K.T. Lee Algae biorefinery: review on a broad spectrum of downstream processes and products Bioresour. Technol. 2019 121964 C.G. Khoo, Y.K. Dasan, M.K. Lam, K.T. Lee, Algae biorefinery: review on a broad spectrum of downstream processes and products, Bioresour. Technol., (2019) 121964. [65] G. Baskar G. Kalavathy R. Aiswarya I. Abarnaebenezer Selvakumari K. Azad 7 - Advances in bio-oil extraction from nonedible oil seeds and algal biomass Advances in Eco-Fuels for a Sustainable Environment 2019 Woodhead Publishing 187 210 Place Published G. Baskar, G. Kalavathy, R. Aiswarya, I. Abarnaebenezer Selvakumari, 7 - Advances in bio-oil extraction from nonedible oil seeds and algal biomass, in: K. Azad (Ed.) Advances in Eco-Fuels for a Sustainable Environment, Woodhead Publishing, Place Published, 2019, pp. 187–210. [66] T. Veeranan R. Kasirajaan B. Gurunathan R. Sahadevan A novel approach for extraction of algal oil from marine macroalgae Ulva fasciata Renew. Energy 127 2018 64 73 T. Veeranan, R. Kasirajaan, B. Gurunathan, R. Sahadevan, A novel approach for extraction of algal oil from marine macroalgae Ulva fasciata, Renew. Energy, 127 (2018) 64–73. [67] Y.S. Pradana H. Sudibyo E.A. Suyono A.Budiman Indarto Oil algae extraction of selected microalgae species grown in monoculture and mixed cultures for biodiesel production Energy Procedia 105 2017 277 282 Y.S. Pradana, H. Sudibyo, E.A. Suyono, Indarto, A.Budiman, Oil algae extraction of selected microalgae species grown in monoculture and mixed cultures for biodiesel production, Energy Procedia, 105 (2017) 277–282. [68] Z. Gong P. Fang Z. Wang X. Li Z. Wang F. Meng Pyrolysis characteristics and products distribution of haematococcus pluvialis microalgae and its extraction residue Renew. Energy 146 2020 2134 2141 Z. Gong, P. Fang, Z. Wang, X. Li, Z. Wang, F. Meng, Pyrolysis characteristics and products distribution of haematococcus pluvialis microalgae and its extraction residue, Renew. Energy, 146 (2020) 2134–2141. [69] L. Li B. Yan H. Li S. Yu X. Ge Decreasing the acid value of pyrolysis oil via esterification using ZrO2/SBA-15 as a solid acid catalyst Renew. Energy 146 2020 643 650 L. Li, B. Yan, H. Li, S. Yu, X. Ge, Decreasing the acid value of pyrolysis oil via esterification using ZrO2/SBA-15 as a solid acid catalyst, Renew. Energy, 146 (2020) 643–650. [70] J. Li Y. Tian P. Zong Y. Qiao S. Qin Thermal cracking behavior, products distribution and char/steam gasification kinetics of seawater spirulina by TG-FTIR and Py-GC/MS Renew. Energy 2020 1761 1771 J. Li, Y. Tian, P. Zong, Y. Qiao, S. Qin, Thermal cracking behavior, products distribution and char/steam gasification kinetics of seawater spirulina by TG-FTIR and Py-GC/MS,Renew. Energy, (2020) 1761–1771. [71] P. Ghorbannezhad F. Kool H. Rudi S. Ceylan Sustainable production of value-added products from fast pyrolysis of palm shell residue in tandem micro-reactor and pilot plant Renew. Energy 2020 663 670 P. Ghorbannezhad, F. Kool, H. Rudi, S. Ceylan, Sustainable production of value-added products from fast pyrolysis of palm shell residue in tandem micro-reactor and pilot plant, Renew. Energy, (2020) 663–670. [72] Á. Muelas M.S. Callén R. Murillo J. Ballester Production and droplet combustion characteristics of waste tire pyrolysis oil Fuel Process. Technol. 196 2019 106149 Á. Muelas, M.S. Callén, R. Murillo, J. Ballester, Production and droplet combustion characteristics of waste tire pyrolysis oil, Fuel Process. Technol., 196 (2019). [73] V. Anand V. Sunjeev R. Vinu Catalytic fast pyrolysis of Arthrospira platensis (spirulina) algae using zeolites J. Anal. Appl. Pyrolysis 118 2016 298 307 V. Anand, V. Sunjeev, R. Vinu, Catalytic fast pyrolysis of Arthrospira platensis (spirulina) algae using zeolites, J. Anal. Appl. Pyrolysis, 118 (2016) 298–307. [74] P.E.A. Debiagi M. Trinchera A. Frassoldati T. Faravelli R. Vinu E. Ranzi Algae characterization and multistep pyrolysis mechanism J. Anal. Appl. Pyrolysis 128 2017 423 436 P.E.A. Debiagi, M. Trinchera, A. Frassoldati, T. Faravelli, R. Vinu, E. Ranzi, Algae characterization and multistep pyrolysis mechanism, J. Anal. Appl. Pyrolysis, 128 (2017) 423–436. [75] Y. Makkawi Y. El Sayed M. Salih P. Nancarrow S. Banks T. Bridgwater Fast pyrolysis of date palm (Phoenix dactylifera) waste in a bubbling fluidized bed reactor Renew. Energy 143 2019 719 730 Y. Makkawi, Y. El Sayed, M. Salih, P. Nancarrow, S. Banks, T. Bridgwater, Fast pyrolysis of date palm (Phoenix dactylifera) waste in a bubbling fluidized bed reactor, Renew. Energy, 143 (2019) 719–730. [76] S. Pourkarimi A. Hallajisani A. Alizadehdakhel A. Nouralishahi Biofuel production through micro- and macroalgae pyrolysis-a review of pyrolysis methods and process parameters J. Anal. Appl. Pyrolysis 142 2019 104599 S. Pourkarimi, A. Hallajisani, A. Alizadehdakhel, A. Nouralishahi, Biofuel production through micro- and macroalgae pyrolysis-a review of pyrolysis methods and process parameters, J. Anal. Appl. Pyrolysis, (2019) 104599. [77] B. Brigljević J. Liu H. Lim Green energy from brown seaweed: sustainable polygeneration industrial process via fast pyrolysis of S. Jpnica combined with the Brayton cycle Energy Convers. Manag. 195 2019 1244 1254 B. Brigljević, J. Liu, H. Lim, Green energy from brown seaweed: sustainable polygeneration industrial process via fast pyrolysis of S. Jpnica combined with the Brayton cycle, Energy Convers. Manag., 195 (2019) 1244–1254. [78] H.V. Ly J.H. Choi H.C. Woo S.S. Kim J. Kim Upgrading bio-oil by catalytic fast pyrolysis of acid-washed Saccharina japonica alga in a fluidized-bed reactor Renew. Energy 133 2019 11 22 H.V. Ly, J.H. Choi, H.C. Woo, S.S. Kim, J. Kim, Upgrading bio-oil by catalytic fast pyrolysis of acid-washed Saccharina japonica alga in a fluidized-bed reactor, Renew. Energy, 133 (2019) 11–22. [79] T.M.H. Dabros M.Z. Stummann M. Høj P.A. Jensen J.D. Grunwaldt J. Gabrielsen P.M. Mortensen A.D. Jensen Transportation fuels from biomass fast pyrolysis, catalytic hydrodeoxygenation, and catalytic fast hydropyrolysis Prog. Energy Combust. Sci. 68 2018 268 309 T.M.H. Dabros, M.Z. Stummann, M. Høj, P.A. Jensen, J.D. Grunwaldt, J. Gabrielsen, P.M. Mortensen, A.D. Jensen, Transportation fuels from biomass fast pyrolysis, catalytic hydrodeoxygenation, and catalytic fast hydropyrolysis, Prog. Energy Combust. Sci., 68 (2018) 268–309. [80] R. Zhang L. Li D. Tong C. Hu Microwave-enhanced pyrolysis of natural algae from water blooms Bioresour. Technol. 212 2016 311 317 R. Zhang, L. Li, D. Tong, C. Hu, Microwave-enhanced pyrolysis of natural algae from water blooms, Bioresour. Technol., 212 (2016) 311–317. [81] A.I. Casoni J. Zunino M.C. Piccolo M.A. Volpe Valorization of Rhizoclonium sp. algae via pyrolysis and catalytic pyrolysis Bioresour. Technol. 216 2016 302 307 A.I. Casoni, J. Zunino, M.C. Piccolo, M.A. Volpe, Valorization of Rhizoclonium sp. algae via pyrolysis and catalytic pyrolysis, Bioresour. Technol., 216 (2016) 302–307. [82] X. Duan Y. Chen Y. Yan L. Feng Y. Chen Q. Zhou New method for algae comprehensive utilization: algae-derived biochar enhances algae anaerobic fermentation for short-chain fatty acids production Bioresour. Technol. 289 2019 121637 X. Duan, Y. Chen, Y. Yan, L. Feng, Y. Chen, Q. Zhou, New method for algae comprehensive utilization: algae-derived biochar enhances algae anaerobic fermentation for short-chain fatty acids production, Bioresour. Technol., 289 (2019) 121637. [83] S.K. Choi Y.S. Choi S.Y. Han S.J. Kim T. Rahman Y.W. Jeong Q. Van Nguyen Y.R. Cha Bio-crude oil production from a new genotype of miscanthus sacchariflorus geodae-uksae 1 Renew. Energy 144 2019 153 158 S.K. Choi, Y.S. Choi, S.Y. Han, S.J. Kim, T. Rahman, Y.W. Jeong, Q. Van Nguyen, Y.R. Cha, Bio-crude oil production from a new genotype of miscanthus sacchariflorus geodae-uksae 1, Renew. Energy, (2019) 153–158. [84] M. Sharifzadeh M. Sadeqzadeh M. Guo T.N. Borhani N.V.S.N. Murthy Konda M.C. Garcia L. Wang J. Hallett N. Shah The multi-scale challenges of biomass fast pyrolysis and bio-oil upgrading: review of the state of art and future research directions Prog. Energy Combust. Sci. 71 2019 1 80 M. Sharifzadeh, M. Sadeqzadeh, M. Guo, T.N. Borhani, N.V.S.N. Murthy Konda, M.C. Garcia, L. Wang, J. Hallett, N. Shah, The multi-scale challenges of biomass fast pyrolysis and bio-oil upgrading: review of the state of art and future research directions, Prog. Energy Combust. Sci., 71 (2019) 1–80. [85] M. Zhang Y. Hu H. Wang H. Li X. Han Y. Zeng C.C. Xu A review of bio-oil upgrading by catalytic hydrotreatment: advances, challenges, and prospects Mol. Catal. 504 2021 111438 M. Zhang, Y. Hu, H. Wang, H. Li, X. Han, Y. Zeng, C.C. Xu, A review of bio-oil upgrading by catalytic hydrotreatment: advances, challenges, and prospects, Mol. Catal., 504 (2021) 111438. [86] M. Kishimoto T. Okakura H. Nagashima T. Minowa S.Y. Yokoyama K. Yamaberi CO2 fixation and oil production using micro-algae J. Ferment. Bioeng. 78 1994 479 482 M. Kishimoto, T. Okakura, H. Nagashima, T. Minowa, S.Y. Yokoyama, K. Yamaberi, CO2 fixation and oil production using micro-algae, J. Ferment. Bioeng., 78 (1994) 479–482. [87] S.S. Toor L. Rosendahl A. Rudolf Hydrothermal liquefaction of biomass: a review of subcritical water technologies Energy 36 2011 2328 2342 S.S. Toor, L. Rosendahl, A. Rudolf, Hydrothermal liquefaction of biomass: a review of subcritical water technologies, Energy, 36 (2011) 2328–2342. [88] S. Sawayama S. Inoue Y. Dote S.Y. Yokoyama CO2 fixation and oil production through microalga Energy Convers. Manag. 36 1995 729 731 S. Sawayama, S. Inoue, Y. Dote, S.Y. Yokoyama, CO2 fixation and oil production through microalga, Energy Convers. Manag., 36 (1995) 729–731. [89] S. Sawayama T. Minowa S.Y. Yokoyama Possibility of renewable energy production and CO2 mitigation by thermochemical liquefaction of microalgae Biomass Bioenergy 17 1999 33 39 S. Sawayama, T. Minowa, S.Y. Yokoyama, Possibility of renewable energy production and CO2 mitigation by thermochemical liquefaction of microalgae, Biomass Bioenergy, 17 (1999) 33–39. [90] D. Xu G. Lin S. Guo S. Wang Y. Guo Z. Jing Catalytic hydrothermal liquefaction of algae and upgrading of biocrude: a critical review Renew. Sustain. Energy Rev. 97 2018 103 118 D. Xu, G. Lin, S. Guo, S. Wang, Y. Guo, Z. Jing, Catalytic hydrothermal liquefaction of algae and upgrading of biocrude: a critical review, Renew. Sustain. Energy Rev., 97 (2018) 103–118. [91] Y. Guo W. Song J. Lu Q. Ma D. Xu S. Wang Hydrothermal liquefaction of Cyanophyta: evaluation of potential bio-crude oil production and component analysis Algal Res. 11 2015 242 247 Y. Guo, W. Song, J. Lu, Q. Ma, D. Xu, S. Wang, Hydrothermal liquefaction of Cyanophyta: evaluation of potential bio-crude oil production and component analysis, Algal Res., 11 (2015) 242–247. [92] D. Zhou L. Zhang S. Zhang H. Fu J. Chen Hydrothermal liquefaction of macroalgae enteromorpha prolifera to bio-oil Energy Fuels 24 2010 4054 4061 D. Zhou, L. Zhang, S. Zhang, H. Fu, J. Chen, Hydrothermal liquefaction of macroalgae enteromorpha prolifera to bio-oil, Energy Fuels, 24 (2010) 4054–4061. [93] Y. Dote S. Inoue T. Ogi S.Y. Yokoyama Distribution of nitrogen to oil products from liquefaction of amino acids Bioresour. Technol. 64 1998 157 160 Y. Dote, S. Inoue, T. Ogi, S.Y. Yokoyama, Distribution of nitrogen to oil products from liquefaction of amino acids, Bioresour. Technol., 64 (1998) 157–160. [94] A. Galadima O. Muraza Hydrothermal liquefaction of algae and bio-oil upgrading into liquid fuels: role of heterogeneous catalysts Renew. Sustain. Energy Rev. 81 2018 1037 1048 A. Galadima, O. Muraza, Hydrothermal liquefaction of algae and bio-oil upgrading into liquid fuels: role of heterogeneous catalysts, Renew. Sustain. Energy Rev., 81 (2018) 1037–1048. [95] G. Yu Y. Zhang L. Schideman T.L. Funk Z. Wang Hydrothermal liquefaction of low lipid content microalgae into bio-crude oil Trans. ASABE 54 2011 239 246 G. Yu, Y. Zhang, L. Schideman, T.L. Funk, Z. Wang, Hydrothermal liquefaction of low lipid content microalgae into bio-crude oil, Trans. ASABE, 54 (2011) 239–246. [96] J. Akhtar N.A.S. Amin A review on process conditions for optimum bio-oil yield in hydrothermal liquefaction of biomass Renew. Sustain. Energy Rev. 15 2011 1615 1624 J. Akhtar, N.A.S. Amin, A review on process conditions for optimum bio-oil yield in hydrothermal liquefaction of biomass, Renew. Sustain. Energy Rev., 15 (2011) 1615–1624. [97] P. Biller A.B. Ross Potential yields and properties of oil from the hydrothermal liquefaction of microalgae with different biochemical content Bioresour. Technol. 102 2011 215 225 P. Biller, A.B. Ross, Potential yields and properties of oil from the hydrothermal liquefaction of microalgae with different biochemical content, Bioresour. Technol., 102 (2011) 215–225. [98] U. Jena K.C. Das J.R. Kastner Comparison of the effects of Na2CO3, Ca3(PO4)2, and NiO catalysts on the thermochemical liquefaction of microalga spirulina platensis Appl. Energy 98 2012 368 375 U. Jena, K.C. Das, J.R. Kastner, Comparison of the effects of Na2CO3, Ca3(PO4)2, and NiO catalysts on the thermochemical liquefaction of microalga spirulina platensis, Appl. Energy, 98 (2012) 368–375. [99] G. Yu Y. Zhang B. Guo T. Funk L. Schideman Nutrient flows and quality of bio-crude oil produced via catalytic hydrothermal liquefaction of low-lipid microalgae Bioenergy Res. 7 2014 1317 1328 G. Yu, Y. Zhang, B. Guo, T. Funk, L. Schideman, Nutrient flows and quality of bio-crude oil produced via catalytic hydrothermal liquefaction of low-lipid microalgae, Bioenergy Res., 7 (2014) 1317–1328. [100] Y. Chen Y. Wu R. Ding P. Zhang J. Liu M. Yang Catalytic hydrothermal liquefaction of D. tertiolecta for the production of bio-oil over different acid/base catalysts AlChE J. 61 2015 1118 1128 Y. Chen, Y. Wu, R. Ding, P. Zhang, J. Liu, M. Yang, Catalytic hydrothermal liquefaction of D. tertiolecta for the production of bio-oil over different acid/base catalysts, AlChE J., 61 (2015) 1118–1128. [101] D. Xu S. Guo L. Liu G. Lin Z. Wu Y. Guo S. Wang Heterogeneous catalytic effects on the characteristics of water-soluble and water-insoluble biocrudes in chlorella hydrothermal liquefaction Appl. Energy 243 2019 165 174 D. Xu, S. Guo, L. Liu, G. Lin, Z. Wu, Y. Guo, S. Wang, Heterogeneous catalytic effects on the characteristics of water-soluble and water-insoluble biocrudes in chlorella hydrothermal liquefaction, Appl. Energy, 243 (2019) 165–174. [102] R. Shakya S. Adhikari R. Mahadevan S.R. Shanmugam H. Nam E.B. Hassan T.A. Dempster Influence of biochemical composition during hydrothermal liquefaction of algae on product yields and fuel properties Bioresour. Technol. 243 2017 1112 1120 R. Shakya, S. Adhikari, R. Mahadevan, S.R. Shanmugam, H. Nam, E.B. Hassan, T.A. Dempster, Influence of biochemical composition during hydrothermal liquefaction of algae on product yields and fuel properties, Bioresour. Technol., 243 (2017) 1112–1120. [103] B. Biswas A. Arun Kumar Y. Bisht R. Singh J. Kumar T. Bhaskar Effects of temperature and solvent on hydrothermal liquefaction of sargassum tenerrimum algae Bioresour. Technol. 242 2017 344 350 B. Biswas, A. Arun Kumar, Y. Bisht, R. Singh, J. Kumar, T. Bhaskar, Effects of temperature and solvent on hydrothermal liquefaction of sargassum tenerrimum algae, Bioresour. Technol., 242 (2017) 344–350. [104] L. Yan Y. Wang J. Li Y. Zhang L. Ma F. Fu B. Chen H. Liu Hydrothermal liquefaction of Ulva prolifera macroalgae and the influence of base catalysts on products Bioresour. Technol. 292 2019 121286 L. Yan, Y. Wang, J. Li, Y. Zhang, L. Ma, F. Fu, B. Chen, H. Liu, Hydrothermal liquefaction of Ulva prolifera macroalgae and the influence of base catalysts on products, Bioresour. Technol., 292 (2019) 121286. [105] C. Liu L. Kong Y. Wang L. Dai Catalytic hydrothermal liquefaction of spirulina to bio-oil in the presence of formic acid over palladium-based catalysts Algal Res 33 2018 156 164 C. Liu, L. Kong, Y. Wang, L. Dai, Catalytic hydrothermal liquefaction of spirulina to bio-oil in the presence of formic acid over palladium-based catalysts, Algal Res, 33 (2018) 156–164. [106] S. Ding C.M.A. Parlett X. Fan Recent developments in multifunctional catalysts for fatty acid hydrodeoxygenation as a route towards biofuels Molecular Catalysis 2021 111492 S. Ding, C.M.A. Parlett, X. Fan, Recent developments in multifunctional catalysts for fatty acid hydrodeoxygenation as a route towards biofuels, Molecular Catalysis, (2021) 111492. [107] S.S. Toor H. Reddy S. Deng J. Hoffmann D. Spangsmark L.B. Madsen J.B. Holm-Nielsen L.A. Rosendahl Hydrothermal liquefaction of spirulina and Nannochloropsis salina under subcritical and supercritical water conditions Bioresour. Technol. 131 2013 413 419 S.S. Toor, H. Reddy, S. Deng, J. Hoffmann, D. Spangsmark, L.B. Madsen, J.B. Holm-Nielsen, L.A. Rosendahl, Hydrothermal liquefaction of spirulina and Nannochloropsis salina under subcritical and supercritical water conditions, Bioresour. Technol., 131 (2013) 413–419. [108] D. Xu P.E. Savage Supercritical water upgrading of water-insoluble and water-soluble biocrudes from hydrothermal liquefaction of Nannochloropsis microalgae J. Supercrit. Fluids 133 2018 683 689 D. Xu, P.E. Savage, Supercritical water upgrading of water-insoluble and water-soluble biocrudes from hydrothermal liquefaction of Nannochloropsis microalgae, J. Supercrit. Fluids, 133 (2018) 683–689. [109] F.Y. Han M. Komiyama Y. Uemura N.E. Rabat Catalytic alcohothermal liquefaction of wet microalgae with supercritical methanol J. Supercrit. Fluids 157 2020 104704 F.Y. Han, M. Komiyama, Y. Uemura, N.E. Rabat, Catalytic alcohothermal liquefaction of wet microalgae with supercritical methanol, J. Supercrit. Fluids, 157 (2020) 104704. [110] I. Bioenergy Direct Thermochemmical Liquefaction 34 2019 Task http://task34.ieabioenergy.com/bio-crude/ I. Bioenergy, Direct Thermochemmical Liquefaction. Task34, http://task34.ieabioenergy.com/bio-crude/, (2019). [111] B. Zhang Z. He H. Chen S. Kandasamy Z. Xu X. Hu H. Guo Effect of acidic, neutral and alkaline conditions on product distribution and biocrude oil chemistry from hydrothermal liquefaction of microalgae Bioresour. Technol. 270 2018 129 137 B. Zhang, Z. He, H. Chen, S. Kandasamy, Z. Xu, X. Hu, H. Guo, Effect of acidic, neutral and alkaline conditions on product distribution and biocrude oil chemistry from hydrothermal liquefaction of microalgae, Bioresour. Technol., 270 (2018) 129–137. [112] A.A. Peterson F. Vogel R.P. Lachance M. Fröling M.J. Antal Jr J.W. Tester Thermochemical biofuel production in hydrothermal media: a review of sub- and supercritical water technologies Energy Environ. Sci. 1 2008 32 65 A.A. Peterson, F. Vogel, R.P. Lachance, M. Fröling, M.J. Antal Jr, J.W. Tester, Thermochemical biofuel production in hydrothermal media: a review of sub- and supercritical water technologies, Energy Environ. Sci., 1 (2008) 32–65. [113] R.B. Levine C.O.S. Sierra R. Hockstad W. Obeid P.G. Hatcher P.E. Savage The use of hydrothermal carbonization to recycle nutrients in algal biofuel production Environ. Prog. Sustain. Energy 32 2013 962 975 R.B. Levine, C.O.S. Sierra, R. Hockstad, W. Obeid, P.G. Hatcher, P.E. Savage, The use of hydrothermal carbonization to recycle nutrients in algal biofuel production, Environ. Prog. Sustain. Energy, 32 (2013) 962–975. [114] J. Watson J. Lu R. de Souza B. Si Y. Zhang Z. Liu Effects of the extraction solvents in hydrothermal liquefaction processes: biocrude oil quality and energy conversion efficiency Energy 167 2019 189 197 J. Watson, J. Lu, R. de Souza, B. Si, Y. Zhang, Z. Liu, Effects of the extraction solvents in hydrothermal liquefaction processes: biocrude oil quality and energy conversion efficiency, Energy, 167 (2019) 189–197. [115] H. Li J. Lu Y. Zhang Z. Liu Hydrothermal liquefaction of typical livestock manures in China: biocrude oil production and migration of heavy metals J. Anal. Appl. Pyrolysis 135 2018 133 140 H. Li, J. Lu, Y. Zhang, Z. Liu, Hydrothermal liquefaction of typical livestock manures in China: biocrude oil production and migration of heavy metals, J. Anal. Appl. Pyrolysis, 135 (2018) 133–140. [116] X. Peng X. Ma Y. Lin J. Wang X. Wei X. Chen Combustion performance of biocrude oil from solvolysis liquefaction of Chlorella pyrenoidosa by thermogravimetry-Fourier transform infrared spectroscopy Bioresour. Technol. 238 2017 510 518 X. Peng, X. Ma, Y. Lin, J. Wang, X. Wei, X. Chen, Combustion performance of biocrude oil from solvolysis liquefaction of Chlorella pyrenoidosa by thermogravimetry-Fourier transform infrared spectroscopy, Bioresour. Technol., 238 (2017) 510–518. [117] N. Shi Q.Y. Liu T. Jiang T.J. Wang L.L. Ma Q. Zhang X.H. Zhang Hydrodeoxygenation of vegetable oils to liquid alkane fuels over Ni/HZSM-5 catalysts: methyl hexadecanoate as the model compound Catal. Commun. 20 2012 80 84 N. Shi, Q.Y. Liu, T. Jiang, T.J. Wang, L.L. Ma, Q. Zhang, X.H. Zhang, Hydrodeoxygenation of vegetable oils to liquid alkane fuels over Ni/HZSM-5 catalysts: methyl hexadecanoate as the model compound, Catal. Commun., 20 (2012) 80–84. [118] P.A. Zharova A.V. Chistyakov S.S. Shapovalov A.A. Pasynskii M.V. Tsodikov Original Pt-Sn/Al2O3 catalyst for selective hydrodeoxygenation of vegetable oils Energy 172 2019 18 25 P.A. Zharova, A.V. Chistyakov, S.S. Shapovalov, A.A. Pasynskii, M.V. Tsodikov, Original Pt-Sn/Al2O3 catalyst for selective hydrodeoxygenation of vegetable oils, Energy, 172 (2019) 18–25. [119] H. Zhang H. Lin Y. Zheng The role of cobalt and nickel in deoxygenation of vegetable oils Appl. Catal. B 160-161 2014 415 422 H. Zhang, H. Lin, Y. Zheng, The role of cobalt and nickel in deoxygenation of vegetable oils, Appl. Catal. B, 160-161 (2014) 415–422. [120] B.P. Pattanaik R.D. Misra Effect of reaction pathway and operating parameters on the deoxygenation of vegetable oils to produce diesel range hydrocarbon fuels: a review Renew. Sustain. Energy Rev. 73 2017 545 557 B.P. Pattanaik, R.D. Misra, Effect of reaction pathway and operating parameters on the deoxygenation of vegetable oils to produce diesel range hydrocarbon fuels: a review, Renew. Sustain. Energy Rev., 73 (2017) 545–557. [121] A. Sonthalia N. Kumar Hydroprocessed vegetable oil as a fuel for transportation sector: a review J. Energy Inst. 92 2019 1 17 A. Sonthalia, N. Kumar, Hydroprocessed vegetable oil as a fuel for transportation sector: a review, J. Energy Inst., 92 (2019) 1–17. [122] P. Arora H. Ojagh J. Woo E.Lind Grennfelt L. Olsson D. Creaser Investigating the effect of Fe as a poison for catalytic HDO over sulfided NiMo alumina catalysts Appl. Catal. B 227 2018 240 251 P. Arora, H. Ojagh, J. Woo, E.Lind Grennfelt, L. Olsson, D. Creaser, Investigating the effect of Fe as a poison for catalytic HDO over sulfided NiMo alumina catalysts, Appl. Catal. B, 227 (2018) 240–251. [123] J.M. Gómez E. Díez A. Rodríguez R. Palanca Thermocatalytic deoxygenation of methyl laurate over potassium FAU zeolites Microporous Mesoporous Mater. 284 2019 122 127 J.M. Gómez, E. Díez, A. Rodríguez, R. Palanca, Thermocatalytic deoxygenation of methyl laurate over potassium FAU zeolites, Microporous Mesoporous Mater., 284 (2019) 122–127. [124] M.C. Vásquez E.E. Silva E.F. Castillo Hydrotreatment of vegetable oils: a review of the technologies and its developments for jet biofuel production Biomass Bioenergy 105 2017 197 206 M.C. Vásquez, E.E. Silva, E.F. Castillo, Hydrotreatment of vegetable oils: a review of the technologies and its developments for jet biofuel production, Biomass Bioenergy, 105 (2017) 197–206. [125] E.S. Perez-Cisneros M. Sales-Cruz R. Lobo-Oehmichen T. Viveros-García A reactive distillation process for co-hydrotreating of non-edible vegetable oils and petro-diesel blends to produce green diesel fuel Comput. Chem. Eng. 105 2017 105 122 E.S. Perez-Cisneros, M. Sales-Cruz, R. Lobo-Oehmichen, T. Viveros-García, A reactive distillation process for co-hydrotreating of non-edible vegetable oils and petro-diesel blends to produce green diesel fuel, Comput. Chem. Eng., 105 (2017) 105–122. [126] H. Ojagh D. Creaser M.A. Salam E.L. Grennfelt L. Olsson The effect of rosin acid on hydrodeoxygenation of fatty acid J. Energy Chem. 28 2019 85 94 H. Ojagh, D. Creaser, M.A. Salam, E.L. Grennfelt, L. Olsson, The effect of rosin acid on hydrodeoxygenation of fatty acid, J. Energy Chem., 28 (2019) 85–94. [127] T. Szarvas Z. Eller T. Kasza T. Ollár P. Tétényi J. Hancsók Radioisotopic investigation of the oleic acid-1-14C HDO reaction pathways on sulfided Mo/P/Al2O3 and NiW/Al2O3 catalysts Appl. Catal. B 165 2015 245 252 T. Szarvas, Z. Eller, T. Kasza, T. Ollár, P. Tétényi, J. Hancsók, Radioisotopic investigation of the oleic acid-1-14C HDO reaction pathways on sulfided Mo/P/Al2O3 and NiW/Al2O3 catalysts, Appl. Catal. B, 165 (2015) 245–252. [128] M. Arend T. Nonnen W.F. Hoelderich J. Fischer J. Groos Catalytic deoxygenation of oleic acid in continuous gas flow for the production of diesel-like hydrocarbons Appl. Catal. A 399 2011 198 204 M. Arend, T. Nonnen, W.F. Hoelderich, J. Fischer, J. Groos, Catalytic deoxygenation of oleic acid in continuous gas flow for the production of diesel-like hydrocarbons, Appl. Catal. A, 399 (2011) 198–204. [129] K. Jeništová I. Hachemi P. Mäki-Arvela N. Kumar M. Peurla L. Čapek J. Wärnå D.Y. Murzin Hydrodeoxygenation of stearic acid and tall oil fatty acids over Ni-alumina catalysts: influence of reaction parameters and kinetic modelling Chem. Eng. J. 316 2017 401 409 K. Jeništová, I. Hachemi, P. Mäki-Arvela, N. Kumar, M. Peurla, L. Čapek, J. Wärnå, D.Y. Murzin, Hydrodeoxygenation of stearic acid and tall oil fatty acids over Ni-alumina catalysts: influence of reaction parameters and kinetic modelling, Chem. Eng. J., 316 (2017) 401–409. [130] X. Besse Y. Schuurman N. Guilhaume Hydrothermal conversion of linoleic acid and ethanol for biofuel production Appl. Catal. A 524 2016 139 148 X. Besse, Y. Schuurman, N. Guilhaume, Hydrothermal conversion of linoleic acid and ethanol for biofuel production, Appl. Catal. A, 524 (2016) 139–148. [131] Y. Huang L. Wang X. Chen X. Wei J. Liang W. Li Intrinsic kinetics study of rosin hydrogenation on a nickel catalyst supported on spent equilibrium catalyst RSC Adv. 7 2017 25780 25788 Y. Huang, L. Wang, X. Chen, X. Wei, J. Liang, W. Li, Intrinsic kinetics study of rosin hydrogenation on a nickel catalyst supported on spent equilibrium catalyst, RSC Adv., 7 (2017) 25780–25788. [132] L. Wang Z. Zheng Y. Zhang J. Chao Y. Gao X. Luo J. Zhang Biostabilization enhancement of heavy metals during the vermiremediation of sewage sludge with passivant J. Hazard. Mater. 244-245 2013 1 9 L. Wang, Z. Zheng, Y. Zhang, J. Chao, Y. Gao, X. Luo, J. Zhang, Biostabilization enhancement of heavy metals during the vermiremediation of sewage sludge with passivant, J. Hazard. Mater., 244-245 (2013) 1–9. [133] L. Wang X. Chen J. Liang Y. Chen X. Pu Z. Tong Kinetics of the catalytic isomerization and disproportionation of rosin over carbon-supported palladium Chem. Eng. J. 152 2009 242 250 L. Wang, X. Chen, J. Liang, Y. Chen, X. Pu, Z. Tong, Kinetics of the catalytic isomerization and disproportionation of rosin over carbon-supported palladium, Chem. Eng. J., 152 (2009) 242–250. [134] Q. Tian K. Qiao F. Zhou K. Chen T. Wang J. Fu X. Lu P. Ouyang Direct production of aviation fuel range hydrocarbons and aromatics from oleic acid without an added hydrogen donor Energy Fuels 30 2016 7291 7297 Q. Tian, K. Qiao, F. Zhou, K. Chen, T. Wang, J. Fu, X. Lu, P. Ouyang, Direct production of aviation fuel range hydrocarbons and aromatics from oleic acid without an added hydrogen donor, Energy Fuels, 30 (2016) 7291–7297. [135] S.A.W. Hollak R.W. Gosselink D.S. Van Es J.H. Bitter Comparison of tungsten and molybdenum carbide catalysts for the hydrodeoxygenation of oleic acid ACS Catal. 3 2013 2837 2844 S.A.W. Hollak, R.W. Gosselink, D.S. Van Es, J.H. Bitter, Comparison of tungsten and molybdenum carbide catalysts for the hydrodeoxygenation of oleic acid, ACS Catal., 3 (2013) 2837–2844. [136] A.E. Coumans E.J.M. Hensen A model compound (methyl oleate, oleic acid, triolein) study of triglycerides hydrodeoxygenation over alumina-supported NiMo sulfide Appl. Catal. B 201 2017 290 301 A.E. Coumans, E.J.M. Hensen, A model compound (methyl oleate, oleic acid, triolein) study of triglycerides hydrodeoxygenation over alumina-supported NiMo sulfide, Appl. Catal. B, 201 (2017) 290–301. [137] D. Valencia L. Díaz L.F. Ramírez-Verduzco M.A. Amezcua-Allieri J. Aburto MoO3-based catalysts supported on SiO2 and their performance in hydrodeoxygenation Mater. Lett. 251 2019 226 229 D. Valencia, L. Díaz, L.F. Ramírez-Verduzco, M.A. Amezcua-Allieri, J. Aburto, MoO3-based catalysts supported on SiO2 and their performance in hydrodeoxygenation, Mater. Lett., 251 (2019) 226–229. [138] Y. Huang Y. Hu F. Ye Y. Fang Lignin pyrolysis and in situ hydrodeoxygenation over MoO3: interaction between MoO3 and lignin Energy Fuels 31 2017 8356 8362 Y. Huang, Y. Hu, F. Ye, Y. Fang, Lignin pyrolysis and in situ hydrodeoxygenation over MoO3: interaction between MoO3 and lignin, Energy Fuels, 31 (2017) 8356–8362. [139] M. Shetty K. Murugappan T. Prasomsri W.H. Green Y. Román-Leshkov Reactivity and stability investigation of supported molybdenum oxide catalysts for the hydrodeoxygenation (HDO) of m-cresol J. Catal. 331 2015 86 97 M. Shetty, K. Murugappan, T. Prasomsri, W.H. Green, Y. Román-Leshkov, Reactivity and stability investigation of supported molybdenum oxide catalysts for the hydrodeoxygenation (HDO) of m-cresol, J. Catal., 331 (2015) 86–97. [140] T. Prasomsri M. Shetty K. Murugappan Y. Román-Leshkov Insights into the catalytic activity and surface modification of MoO3 during the hydrodeoxygenation of lignin-derived model compounds into aromatic hydrocarbons under low hydrogen pressures Energy Environ. Sci. 7 2014 2660 2669 T. Prasomsri, M. Shetty, K. Murugappan, Y. Román-Leshkov, Insights into the catalytic activity and surface modification of MoO3 during the hydrodeoxygenation of lignin-derived model compounds into aromatic hydrocarbons under low hydrogen pressures, Energy Environ. Sci., 7 (2014) 2660–2669. [141] D. Kubička L. Kaluža Deoxygenation of vegetable oils over sulfided Ni, Mo and NiMo catalysts Appl. Catal. A 372 2010 199 208 D. Kubička, L. Kaluža, Deoxygenation of vegetable oils over sulfided Ni, Mo and NiMo catalysts, Appl. Catal. A, 372 (2010) 199–208. [142] S. Palanisamy B.S. Gevert Hydroprocessing of fatty acid methyl ester containing resin acids blended with gas oil Fuel Process. Technol. 126 2014 435 440 S. Palanisamy, B.S. Gevert, Hydroprocessing of fatty acid methyl ester containing resin acids blended with gas oil, Fuel Process. Technol., 126 (2014) 435–440. [143] O.I. Şenol E.M. Ryymin T.R. Viljava A.O.I. Krause Reactions of methyl heptanoate hydrodeoxygenation on sulphided catalysts J. Mol. Catal. A Chem. 268 2007 1 8 O.I. Şenol, E.M. Ryymin, T.R. Viljava, A.O.I. Krause, Reactions of methyl heptanoate hydrodeoxygenation on sulphided catalysts, J. Mol. Catal. A Chem., 268 (2007) 1–8. [144] P. Priecel D. Kubička L. Čapek Z. Bastl P. Ryšánek The role of Ni species in the deoxygenation of rapeseed oil over NiMo-alumina catalysts Appl. Catal. A 397 2011 127 137 P. Priecel, D. Kubička, L. Čapek, Z. Bastl, P. Ryšánek, The role of Ni species in the deoxygenation of rapeseed oil over NiMo-alumina catalysts, Appl. Catal. A, 397 (2011) 127–137. [145] M.R. De Brimont C. Dupont A. Daudin C. Geantet P. Raybaud Deoxygenation mechanisms on Ni-promoted MoS2 bulk catalysts: a combined experimental and theoretical study J. Catal. 286 2012 153 164 M.R. De Brimont, C. Dupont, A. Daudin, C. Geantet, P. Raybaud, Deoxygenation mechanisms on Ni-promoted MoS2 bulk catalysts: a combined experimental and theoretical study, J. Catal., 286 (2012) 153–164. [146] I. Simakova O. Simakova P. Mäki-Arvela A. Simakov M. Estrada D.Y. Murzin Deoxygenation of palmitic and stearic acid over supported Pd catalysts: effect of metal dispersion Appl. Catal. A 355 2009 100 108 I. Simakova, O. Simakova, P. Mäki-Arvela, A. Simakov, M. Estrada, D.Y. Murzin, Deoxygenation of palmitic and stearic acid over supported Pd catalysts: effect of metal dispersion, Appl. Catal. A, 355 (2009) 100–108. [147] N. Arun S. Nanda Y. Hu A.K. Dalai Hydrodeoxygenation of oleic acid using γ-Al2O3 supported transition metallic catalyst systems: insight into the development of novel FeCu/γ-Al2O3 catalyst Mol. Catal. 2021 111526 N. Arun, S. Nanda, Y. Hu, A.K. Dalai, Hydrodeoxygenation of oleic acid using γ-Al2O3 supported transition metallic catalyst systems: insight into the development of novel FeCu/γ-Al2O3 catalyst, Mol. Catal., (2021) 111526. [148] M. Ruangudomsakul N. Osakoo J. Wittayakun C. Keawkumay T. Butburee S. Youngjan K. Faungnawakij Y. Poo-arporn P. Kidkhunthod P. Khemthong Hydrodeoxygenation of palm oil to green diesel products on mixed-phase nickel phosphides Mol. Catal. 2021 111422 In press M. Ruangudomsakul, N. Osakoo, J. Wittayakun, C. Keawkumay, T. Butburee, S. Youngjan, K. Faungnawakij, Y. Poo-arporn, P. Kidkhunthod, P. Khemthong, Hydrodeoxygenation of palm oil to green diesel products on mixed-phase nickel phosphides, Mol. Catal., (2021) 111422. [149] I. Hachemi D.Y. Murzin Kinetic modeling of fatty acid methyl esters and triglycerides hydrodeoxygenation over nickel and palladium catalysts Chem. Eng. J. 334 2018 2201 2207 I. Hachemi, D.Y. Murzin, Kinetic modeling of fatty acid methyl esters and triglycerides hydrodeoxygenation over nickel and palladium catalysts, Chem. Eng. J., 334 (2018) 2201–2207. [150] B. Donnis R.G. Egeberg P. Blom K.G. Knudsen Hydroprocessing of bio-oils and oxygenates to hydrocarbons. Understanding the reaction routes Top. Catal. 52 2009 229 240 B. Donnis, R.G. Egeberg, P. Blom, K.G. Knudsen, Hydroprocessing of bio-oils and oxygenates to hydrocarbons. Understanding the reaction routes, Top. Catal., 52 (2009) 229–240. [151] P. Šimáček D. Kubička G. Šebor M. Pospíšil Hydroprocessed rapeseed oil as a source of hydrocarbon-based biodiesel Fuel 88 2009 456 460 P. Šimáček, D. Kubička, G. Šebor, M. Pospíšil, Hydroprocessed rapeseed oil as a source of hydrocarbon-based biodiesel, Fuel, 88 (2009) 456–460. [152] I. Hachemi N. Kumar P. Mäki-Arvela J. Roine M. Peurla J. Hemming J. Salonen D.Y. Murzin Sulfur-free Ni catalyst for production of green diesel by hydrodeoxygenation J. Catal. 347 2017 205 221 I. Hachemi, N. Kumar, P. Mäki-Arvela, J. Roine, M. Peurla, J. Hemming, J. Salonen, D.Y. Murzin, Sulfur-free Ni catalyst for production of green diesel by hydrodeoxygenation, J. Catal., 347 (2017) 205–221. [153] K.W. Jeon J.O. Shim J.W. Cho W.J. Jang H.S. Na H.M. Kim Y.L. Lee B.H. Jeon J.W. Bae H.S. Roh Synthesis and characterization of Pt-, Pd-, and Ru-promoted Ni–Ce0.6Zr0.4O2 catalysts for efficient biodiesel production by deoxygenation of oleic acid Fuel 236 2019 928 933 K.W. Jeon, J.O. Shim, J.W. Cho, W.J. Jang, H.S. Na, H.M. Kim, Y.L. Lee, B.H. Jeon, J.W. Bae, H.S. Roh, Synthesis and characterization of Pt-, Pd-, and Ru-promoted Ni–Ce0.6Zr0.4O2 catalysts for efficient biodiesel production by deoxygenation of oleic acid, Fuel, 236 (2019) 928–933. [154] J.O. Shim D.W. Jeong W.J. Jang K.W. Jeon S.H. Kim B.H. Jeon H.S. Roh J.G. Na Y.K. Oh S.S. Han Optimization of unsupported CoMo catalysts for decarboxylation of oleic acid Catal. Commun. 67 2015 16 20 J.O. Shim, D.W. Jeong, W.J. Jang, K.W. Jeon, S.H. Kim, B.H. Jeon, H.S. Roh, J.G. Na, Y.K. Oh, S.S. Han, Optimization of unsupported CoMo catalysts for decarboxylation of oleic acid, Catal. Commun., 67 (2015) 16–20. [155] C. Kordulis K. Bourikas M. Gousi E. Kordouli A. Lycourghiotis Development of nickel based catalysts for the transformation of natural triglycerides and related compounds into green diesel: a critical review Appl. Catal. B 181 2016 156 196 C. Kordulis, K. Bourikas, M. Gousi, E. Kordouli, A. Lycourghiotis, Development of nickel based catalysts for the transformation of natural triglycerides and related compounds into green diesel: a critical review, Appl. Catal. B, 181 (2016) 156–196. [156] N. Kochaputi P. Khemthong P. Kasamechonchung T. Butburee W. Limphirat Y. Poo-arporn S. Kuboon K. Faungnawakij C. Kongmark Roles of supports on reducibility and activities of Cu3P catalysts for deoxygenation of oleic acid: in situ XRD and XAS studies Mol. Catal. 2021 Elselvier 111425 In press N. Kochaputi, P. Khemthong, P. Kasamechonchung, T. Butburee, W. Limphirat, Y. Poo-arporn, S. Kuboon, K. Faungnawakij, C. Kongmark, Roles of supports on reducibility and activities of Cu3P catalysts for deoxygenation of oleic acid: in situ XRD and XAS studies, Mol. Catal., (2021) 111425. [157] X. Jiang J. Zhou J. Zhao D. Shen Catalytic conversion of guaiacol as a model compound for aromatic hydrocarbon production Biomass Bioenergy 111 2018 343 351 X. Jiang, J. Zhou, J. Zhao, D. Shen, Catalytic conversion of guaiacol as a model compound for aromatic hydrocarbon production, Biomass Bioenergy, 111 (2018) 343–351. [158] X. Zhang W. Tang Q. Zhang T. Wang L. Ma Hydrodeoxygenation of lignin-derived phenoic compounds to hydrocarbon fuel over supported Ni-based catalysts Appl. Energy 227 2018 73 79 X. Zhang, W. Tang, Q. Zhang, T. Wang, L. Ma, Hydrodeoxygenation of lignin-derived phenoic compounds to hydrocarbon fuel over supported Ni-based catalysts, Appl. Energy, 227 (2018) 73–79. [159] S. Yang G. Chen Q. Guan H. Xu Z. Wang B. Liu S. Yang T. Lei X. Zeng L. Lin An efficient Pd/carbon-silica-alumina catalyst for the hydrodeoxygenation of bio-oil model compound phenol Mol. Catal. 510 2021 111681 S. Yang, G. Chen, Q. Guan, H. Xu, Z. Wang, B. Liu, S. Yang, T. Lei, X. Zeng, L. Lin, An efficient Pd/carbon-silica-alumina catalyst for the hydrodeoxygenation of bio-oil model compound phenol, Mol. Catal., 510 (2021) 111681. [160] Q. Xu Y. Shi L. Yang G. Fan F. Li The promotional effect of surface Ru decoration on the catalytic performance of Co-based nanocatalysts for guaiacol hydrodeoxygenation Mol. Catal. 497 2020 111224 Q. Xu, Y. Shi, L. Yang, G. Fan, F. Li, The promotional effect of surface Ru decoration on the catalytic performance of Co-based nanocatalysts for guaiacol hydrodeoxygenation, Mol. Catal., 497 (2020) 111224. [161] L. Xiang G. Fan L. Yang L. Zheng F. Li Structure-tunable pompon-like RuCo catalysts: insight into the roles of atomically dispersed Ru-Co sites and crystallographic structures for guaiacol hydrodeoxygenation J. Catal. 398 2021 76 88 L. Xiang, G. Fan, L. Yang, L. Zheng, F. Li, Structure-tunable pompon-like RuCo catalysts: insight into the roles of atomically dispersed Ru-Co sites and crystallographic structures for guaiacol hydrodeoxygenation, J. Catal., 398 (2021) 76–88. [162] R. Shu B. Lin C. Wang J. Zhang Z. Cheng Y. Chen Upgrading phenolic compounds and bio-oil through hydrodeoxygenation using highly dispersed Pt/TiO2 catalyst Fuel 239 2019 1083 1090 R. Shu, B. Lin, C. Wang, J. Zhang, Z. Cheng, Y. Chen, Upgrading phenolic compounds and bio-oil through hydrodeoxygenation using highly dispersed Pt/TiO2 catalyst, Fuel, 239 (2019) 1083–1090. [163] A. Feliczak-Guzik P. Szczyglewska I. Nowak The effect of metal (Nb, Ru, Pd, Pt) supported on SBA-16 on the hydrodeoxygenation reaction of phenol Catal. Today 325 2019 61 67 A. Feliczak-Guzik, P. Szczyglewska, I. Nowak, The effect of metal (Nb, Ru, Pd, Pt) supported on SBA-16 on the hydrodeoxygenation reaction of phenol, Catal. Today, 325 (2019) 61–67. [164] W. Guan X. Chen C. Li J. Zhang C.W. Tsang H. Hu S. Li C. Liang Nb(Ta)-based solid acid modified Pt/CNTs catalysts for hydrodeoxygenation of lignin-derived compounds Mol. Catal. 467 2019 61 69 W. Guan, X. Chen, C. Li, J. Zhang, C.W. Tsang, H. Hu, S. Li, C. Liang, Nb(Ta)-based solid acid modified Pt/CNTs catalysts for hydrodeoxygenation of lignin-derived compounds, Mol. Catal., 467 (2019) 61–69. [165] H.W. Lee B.R. Jun H. Kim D.H. Kim J.K. Jeon S.H. Park C.H. Ko T.W. Kim Y.K. Park Catalytic hydrodeoxygenation of 2-methoxy phenol and dibenzofuran over Pt/mesoporous zeolites Energy 81 2015 33 40 H.W. Lee, B.R. Jun, H. Kim, D.H. Kim, J.K. Jeon, S.H. Park, C.H. Ko, T.W. Kim, Y.K. Park, Catalytic hydrodeoxygenation of 2-methoxy phenol and dibenzofuran over Pt/mesoporous zeolites, Energy, 81 (2015) 33–40. [166] X. Wu Q. Sun H. Wang J. Han Q. Ge X. Zhu Effect of acid-metal balance of bifunctional Pt/Beta catalysts on vapor phase hydrodeoxygenation of m-cresol Catal. Today 2019 X. Wu, Q. Sun, H. Wang, J. Han, Q. Ge, X. Zhu, Effect of acid-metal balance of bifunctional Pt/Beta catalysts on vapor phase hydrodeoxygenation of m-cresol, Catal. Today, (2019). [167] L.T. Funkenbusch M.E. Mullins M.A. Salam D. Creaser L. Olsson Catalytic hydrotreatment of pyrolysis oil phenolic compounds over Pt/Al2O3 and Pd/C Fuel 243 2019 441 448 L.T. Funkenbusch, M.E. Mullins, M.A. Salam, D. Creaser, L. Olsson, Catalytic hydrotreatment of pyrolysis oil phenolic compounds over Pt/Al2O3 and Pd/C, Fuel, 243 (2019) 441–448. [168] G.H. Han M.W. Lee S. Park H.J. Kim J.P. Ahn M.-g. Seo K.Y. Lee Revealing the factors determining the selectivity of guaiacol HDO reaction pathways using ZrP-supported Co and Ni catalysts J. Catal. 377 2019 343 357 G.H. Han, M.W. Lee, S. Park, H.J. Kim, J.P. Ahn, M.-g. Seo, K.Y. Lee, Revealing the factors determining the selectivity of guaiacol HDO reaction pathways using ZrP-supported Co and Ni catalysts, J. Catal., 377 (2019) 343–357. [169] R. Shu B. Lin J. Zhang C. Wang Z. Yang Y. Chen Efficient catalytic hydrodeoxygenation of phenolic compounds and bio-oil over highly dispersed Ru/TiO2 Fuel Process. Technol. 184 2019 12 18 R. Shu, B. Lin, J. Zhang, C. Wang, Z. Yang, Y. Chen, Efficient catalytic hydrodeoxygenation of phenolic compounds and bio-oil over highly dispersed Ru/TiO2, Fuel Process. Technol., 184 (2019) 12–18. [170] Z. He M. Hu X. Wang Highly effective hydrodeoxygenation of guaiacol on Pt/TiO2: promoter effects Catal. Today 302 2018 136 145 Z. He, M. Hu, X. Wang, Highly effective hydrodeoxygenation of guaiacol on Pt/TiO2: promoter effects, Catal. Today, 302 (2018) 136–145. [171] M. Haider D. Castello K. Michalski T. Pedersen L. Rosendahl Catalytic hydrotreatment of microalgae biocrude from continuous hydrothermal liquefaction: heteroatom removal and their distribution in distillation cuts Energies 11 2018 3360 M. Haider, D. Castello, K. Michalski, T. Pedersen, L. Rosendahl, Catalytic hydrotreatment of microalgae biocrude from continuous hydrothermal liquefaction: heteroatom removal and their distribution in distillation cuts, Energies, 11 (2018) 3360. [172] G. Bagnato F. Boulet A. Sanna Effect of Li-LSX zeolite, NiCe/Al2O3 and NiCe/ZrO2 on the production of drop-in bio-fuels by pyrolysis and hydrotreating of Nannochloropsis and isochrysis microalgae Energy 179 2019 199 213 G. Bagnato, F. Boulet, A. Sanna, Effect of Li-LSX zeolite, NiCe/Al2O3 and NiCe/ZrO2 on the production of drop-in bio-fuels by pyrolysis and hydrotreating of Nannochloropsis and isochrysis microalgae, Energy, 179 (2019) 199–213. [173] L.F. Xie Y.P. Xu X.L. Shi F. Wang P.G. Duan S.C. Li Hydrotreating the distillate fraction of algal biocrude with used engine oil over Pt/C for production of liquid fuel Catal. Today 355 2019 65 74 L.F. Xie, Y.P. Xu, X.L. Shi, F. Wang, P.G. Duan, S.C. Li, Hydrotreating the distillate fraction of algal biocrude with used engine oil over Pt/C for production of liquid fuel, Catal. Today, (2019). [174] P.A. Marrone D.C. Elliott J.M. Billing R.T. Hallen T.R. Hart P. Kadota J.C. Moeller M.A. Randel A.J. Schmidt Bench-scale evaluation of hydrothermal processing technology for conversion of wastewater solids to fuels Water Environ. Res. 90 2018 329 342 P.A. Marrone, D.C. Elliott, J.M. Billing, R.T. Hallen, T.R. Hart, P. Kadota, J.C. Moeller, M.A. Randel, A.J. Schmidt, Bench-scale evaluation of hydrothermal processing technology for conversion of wastewater solids to fuels, Water Environ. Res., 90 (2018) 329–342. [175] L. Chen C. Zhao Q. Zhang X. Li Y. Li X. Zhang C. Wang Q. Zhang L. Ma Progress of liquid biofuel development and demonstration facilities in foreign countries and its inspiration for China Nongye Gongcheng Xuebao/ Trans. Chin. Soc. Agric. Eng. 33 2017 8 15 L. Chen, C. Zhao, Q. Zhang, X. Li, Y. Li, X. Zhang, C. Wang, Q. Zhang, L. Ma, Progress of liquid biofuel development and demonstration facilities in foreign countries and its inspiration for China, Nongye Gongcheng Xuebao/Trans. Chin. Soc. Agric. Eng., 33 (2017) 8–15. [176] P. Duan P.E. Savage Hydrothermal liquefaction of a microalga with heterogeneous catalysts Ind. Eng. Chem. Res. 50 2010 52 61 P. Duan, P.E. Savage, Hydrothermal liquefaction of a microalga with heterogeneous catalysts, Ind. Eng. Chem. Res., 50 (2010) 52–61. [177] A. Ross P. Biller M. Kubacki H. Li A. Lea-Langton J. Jones Hydrothermal processing of microalgae using alkali and organic acids Fuel 89 2010 2234 2243 A. Ross, P. Biller, M. Kubacki, H. Li, A. Lea-Langton, J. Jones, Hydrothermal processing of microalgae using alkali and organic acids, Fuel, 89 (2010) 2234–2243. [178] P. Biller B.K. Sharma B. Kunwar A.B. Ross Hydroprocessing of bio-crude from continuous hydrothermal liquefaction of microalgae Fuel 159 2015 197 205 P. Biller, B.K. Sharma, B. Kunwar, A.B. Ross, Hydroprocessing of bio-crude from continuous hydrothermal liquefaction of microalgae, Fuel, 159 (2015) 197–205. [179] G.W. Huber A. Corma Synergies between bio-and oil refineries for the production of fuels from biomass Angew. Chem. Int. Ed. 46 2007 7184 7201 G.W. Huber, A. Corma, Synergies between bio-and oil refineries for the production of fuels from biomass, Angew. Chem. Int. Ed., 46 (2007) 7184–7201. [180] N. Hongloi P. Prapainainar C. Prapainainar Review of green diesel production from fatty acid deoxygenation over Ni-based catalysts Mol. Catal. 2021 111696 N. Hongloi, P. Prapainainar, C. Prapainainar, Review of green diesel production from fatty acid deoxygenation over Ni-based catalysts, Mol. Catal., (2021) 111696. [181] X. Bai P. Duan Y. Xu A. Zhang P.E. Savage Hydrothermal catalytic processing of pretreated algal oil: a catalyst screening study Fuel 120 2014 141 149 X. Bai, P. Duan, Y. Xu, A. Zhang, P.E. Savage, Hydrothermal catalytic processing of pretreated algal oil: a catalyst screening study, Fuel, 120 (2014) 141–149. [182] P. Duan B. Wang Y. Xu Catalytic hydrothermal upgrading of crude bio-oils produced from different thermo-chemical conversion routes of microalgae Bioresour. Technol. 186 2015 58 66 P. Duan, B. Wang, Y. Xu, Catalytic hydrothermal upgrading of crude bio-oils produced from different thermo-chemical conversion routes of microalgae, Bioresour. Technol., 186 (2015) 58–66. [183] D.C. Elliott T.R. Hart A.J. Schmidt G.G. Neuenschwander L.J. Rotness M.V. Olarte A.H. Zacher K.O. Albrecht R.T. Hallen J.E. Holladay Process development for hydrothermal liquefaction of algae feedstocks in a continuous-flow reactor Algal Res. 2 2013 445 454 D.C. Elliott, T.R. Hart, A.J. Schmidt, G.G. Neuenschwander, L.J. Rotness, M.V. Olarte, A.H. Zacher, K.O. Albrecht, R.T. Hallen, J.E. Holladay, Process development for hydrothermal liquefaction of algae feedstocks in a continuous-flow reactor, Algal Res., 2 (2013) 445–454. [184] B. Guo V. Walter U. Hornung N. Dahmen Hydrothermal liquefaction of Chlorella vulgaris and Nannochloropsis gaditana in a continuous stirred tank reactor and hydrotreating of biocrude by nickel catalysts Fuel Process. Technol. 191 2019 168 180 B. Guo, V. Walter, U. Hornung, N. Dahmen, Hydrothermal liquefaction of Chlorella vulgaris and Nannochloropsis gaditana in a continuous stirred tank reactor and hydrotreating of biocrude by nickel catalysts, Fuel Process. Technol., 191 (2019) 168–180. [185] D.C. Elliott T.R. Hart G.G. Neuenschwander L.J. Rotness A.H. Zacher Catalytic hydroprocessing of biomass fast pyrolysis bio-oil to produce hydrocarbon products Environ. Prog. Sustain. Energy 28 2009 441 449 D.C. Elliott, T.R. Hart, G.G. Neuenschwander, L.J. Rotness, A.H. Zacher, Catalytic hydroprocessing of biomass fast pyrolysis bio-oil to produce hydrocarbon products, Environ. Prog. Sustain. Energy, 28 (2009) 441–449. [186] C.C. Schmitt K. Raffelt A. Zimina B. Krause T. Otto M. Rapp J.D. Grunwaldt N. Dahmen Hydrotreatment of fast pyrolysis bio-oil fractions over nickel-based catalyst Top. Catal. 61 2018 1769 1782 C.C. Schmitt, K. Raffelt, A. Zimina, B. Krause, T. Otto, M. Rapp, J.D. Grunwaldt, N. Dahmen, Hydrotreatment of fast pyrolysis bio-oil fractions over nickel-based catalyst, Top. Catal., 61 (2018) 1769–1782. [187] P. Sangnikul C. Phanpa R. Xiao H. Zhang P. Reubroycharoen P. Kuchonthara T. Vitidsant A. Pattiya N. Hinchiranan Role of copper- or cerium-promoters on NiMo/γ-Al2O3 catalysts in hydrodeoxygenation of guaiacol and bio-oil Appl. Catal. A 574 2019 151 160 P. Sangnikul, C. Phanpa, R. Xiao, H. Zhang, P. Reubroycharoen, P. Kuchonthara, T. Vitidsant, A. Pattiya, N. Hinchiranan, Role of copper- or cerium-promoters on NiMo/γ-Al2O3 catalysts in hydrodeoxygenation of guaiacol and bio-oil, Appl. Catal. A, 574 (2019) 151–160. [188] W. Costanzo R. Hilten U. Jena K.C. Das J.R. Kastner Effect of low temperature hydrothermal liquefaction on catalytic hydrodenitrogenation of algae biocrude and model macromolecules Algal Res. 13 2016 53 68 W. Costanzo, R. Hilten, U. Jena, K.C. Das, J.R. Kastner, Effect of low temperature hydrothermal liquefaction on catalytic hydrodenitrogenation of algae biocrude and model macromolecules, Algal Res., 13 (2016) 53–68. [189] C.U. Jensen J. Hoffmann L.A. Rosendahl Co-processing potential of HTL bio-crude at petroleum refineries. Part 2: a parametric hydrotreating study Fuel 165 2016 536 543 C.U. Jensen, J. Hoffmann, L.A. Rosendahl, Co-processing potential of HTL bio-crude at petroleum refineries. Part 2: a parametric hydrotreating study, Fuel, 165 (2016) 536–543. [190] S. Leng X. Wang X. He L. Liu Y.e. Liu X. Zhong G. Zhuang J.-g. Wang NiFe/γ-Al2O3: a universal catalyst for the hydrodeoxygenation of bio-oil and its model compounds Catal. Commun. 41 2013 34 37 S. Leng, X. Wang, X. He, L. Liu, Y.e. Liu, X. Zhong, G. Zhuang, J.-g. Wang, NiFe/γ-Al2O3: a universal catalyst for the hydrodeoxygenation of bio-oil and its model compounds, Catal. Commun., 41 (2013) 34–37. [191] D. Xu S. Guo L. Liu H. Hua Y. Guo S. Wang Z. Jing Ni-Ru/CeO2 catalytic hydrothermal upgrading of water-insoluble biocrude from algae hydrothermal liquefaction Biomed. Res. Int. 2018 2018 D. Xu, S. Guo, L. Liu, H. Hua, Y. Guo, S. Wang, Z. Jing, Ni-Ru/CeO2 catalytic hydrothermal upgrading of water-insoluble biocrude from algae hydrothermal liquefaction, Biomed. Res. Int., 2018 (2018). [192] Z. Li P.E. Savage Feedstocks for fuels and chemicals from algae: treatment of crude bio-oil over HZSM-5 Algal Res. 2 2013 154 163 Z. Li, P.E. Savage, Feedstocks for fuels and chemicals from algae: treatment of crude bio-oil over HZSM-5, Algal Res., 2 (2013) 154–163. [193] F. Collins A. Rozhkovskaya J.G. Outram G.J. Millar A critical review of waste resources, synthesis, and applications for Zeolite LTA Microporous Mesoporous Mater. 291 2020 109667 F. Collins, A. Rozhkovskaya, J.G. Outram, G.J. Millar, A critical review of waste resources, synthesis, and applications for Zeolite LTA, Microporous Mesoporous Mater., 291 (2020) 109667. [194] N. Hikichi K. Iyoki Y. Naraki Y. Yanaba K. Ohara T. Okubo T. Wakihara Role of sodium cation during aging process in the synthesis of LEV-type zeolite Microporous Mesoporous Mater. 284 2019 82 89 N. Hikichi, K. Iyoki, Y. Naraki, Y. Yanaba, K. Ohara, T. Okubo, T. Wakihara, Role of sodium cation during aging process in the synthesis of LEV-type zeolite, Microporous Mesoporous Mater., 284 (2019) 82–89. [195] W. Fu Z. Yuan S. Jin W. Liu Z. Wang C. Wang Y. Wang W. Yang M.Y. He Cooperative structure-directing effect of choline cation and *BEA zeolite in the synthesis of aluminogermanosilicate IWR zeolite Chin. J. Catal. 40 2019 856 866 W. Fu, Z. Yuan, S. Jin, W. Liu, Z. Wang, C. Wang, Y. Wang, W. Yang, M.Y. He, Cooperative structure-directing effect of choline cation and *BEA zeolite in the synthesis of aluminogermanosilicate IWR zeolite, Chin. J. Catal., 40 (2019) 856–866. [196] J. Qian G. Xiong J. Liu C. Liu H. Guo Hydrothermal synthesis of MCM-49 zeolite with cyclohexylamine template Microporous Mesoporous Mater. 276 2019 192 200 J. Qian, G. Xiong, J. Liu, C. Liu, H. Guo, Hydrothermal synthesis of MCM-49 zeolite with cyclohexylamine template, Microporous Mesoporous Mater., 276 (2019) 192–200. [197] M. Yoldi E.G. Fuentes-Ordoñez S.A. Korili A. Gil Zeolite synthesis from industrial wastes Microporous Mesoporous Mater. 287 2019 183 191 M. Yoldi, E.G. Fuentes-Ordoñez, S.A. Korili, A. Gil, Zeolite synthesis from industrial wastes, Microporous Mesoporous Mater., 287 (2019) 183–191. [198] J.J. Ternero-Hidalgo F.F. Budihardjo K.L. Yeung Rapid synthesis of zeolite film coating on stainless steel Catal. Today 356 2019 73 79 J.J. Ternero-Hidalgo, F.F. Budihardjo, K.L. Yeung, Rapid synthesis of zeolite film coating on stainless steel, Catal. Today, (2019). [199] Q. Wu X. Hong L. Zhu X. Meng S. Han J. Zhang X. Liu C. Jin F.S. Xiao Generalized ionothermal synthesis of silica-based zeolites Microporous Mesoporous Mater. 286 2019 163 168 Q. Wu, X. Hong, L. Zhu, X. Meng, S. Han, J. Zhang, X. Liu, C. Jin, F.S. Xiao, Generalized ionothermal synthesis of silica-based zeolites, Microporous Mesoporous Mater., 286 (2019) 163–168. [200] J. Häne D. Brühwiler A. Ecker R. Hass Real-time inline monitoring of zeolite synthesis by photon density wave spectroscopy Microporous Mesoporous Mater. 288 2019 109580 J. Häne, D. Brühwiler, A. Ecker, R. Hass, Real-time inline monitoring of zeolite synthesis by photon density wave spectroscopy, Microporous Mesoporous Mater., 288 (2019) 109580. [201] T. Yit Siew Ng T. Leng Chew Y. Fong Yeong Synthesis of small pore zeolite via ultrasonic-assisted hydrothermal synthesis Mater. Today Proc. 16 2019 1935 1941 T. Yit Siew Ng, T. Leng Chew, Y. Fong Yeong, Synthesis of small pore zeolite via ultrasonic-assisted hydrothermal synthesis, Mater. Today Proc., 16 (2019) 1935–1941. [202] A.d.S.da Silva Z.N.da Rocha M.L. Mignoni J.H.Z. dos Santos Solvent-free synthesis of modified zeolites using hybrid silicas as raw material Microporous Mesoporous Mater. 2019 109684 A.d.S.da Silva, Z.N.da Rocha, M.L. Mignoni, J.H.Z. dos Santos, Solvent-free synthesis of modified zeolites using hybrid silicas as raw material, Microporous Mesoporous Mater., (2019) 109684. [203] S. Arvindnarayan K.K. Sivagnana Prabhu S. Shobana G. Kumar J. Dharmaraja Upgrading of micro algal derived bio-fuels in thermochemical liquefaction path and its perspectives: a review Int. Biodeterior. Biodegrad. 119 2017 260 272 S. Arvindnarayan, K.K. Sivagnana Prabhu, S. Shobana, G. Kumar, J. Dharmaraja, Upgrading of micro algal derived bio-fuels in thermochemical liquefaction path and its perspectives: a review, Int. Biodeterior. Biodegrad., 119 (2017) 260–272. [204] S. Darda T. Papalas A. Zabaniotou Biofuels journey in Europe: currently the way to low carbon economy sustainability is still a challenge J. Clean. Prod. 208 2019 575 588 S. Darda, T. Papalas, A. Zabaniotou, Biofuels journey in Europe: currently the way to low carbon economy sustainability is still a challenge, J. Clean. Prod., 208 (2019) 575–588. [205] P. Duan Y. Xu F. Wang B. Wang W. Yan Catalytic upgrading of pretreated algal bio-oil over zeolite catalysts in supercritical water Biochem. Eng. J. 116 2016 105 112 P. Duan, Y. Xu, F. Wang, B. Wang, W. Yan, Catalytic upgrading of pretreated algal bio-oil over zeolite catalysts in supercritical water, Biochem. Eng. J., 116 (2016) 105–112. [206] A. Cole Y. Dinburg B.S. Haynes Y. He M. Herskowitz C. Jazrawi M. Landau X. Liang M. Magnusson T. Maschmeyer From macroalgae to liquid fuel via waste-water remediation, hydrothermal upgrading, carbon dioxide hydrogenation and hydrotreating Energy Environ. Sci. 9 2016 1828 1840 A. Cole, Y. Dinburg, B.S. Haynes, Y. He, M. Herskowitz, C. Jazrawi, M. Landau, X. Liang, M. Magnusson, T. Maschmeyer, From macroalgae to liquid fuel via waste-water remediation, hydrothermal upgrading, carbon dioxide hydrogenation and hydrotreating, Energy Environ. Sci., 9 (2016) 1828–1840. [207] L. van Haandel G.M. Bremmer E.J.M. Hensen T. Weber Influence of sulfiding agent and pressure on structure and performance of CoMo/Al2O3 hydrodesulfurization catalysts J. Catal. 342 2016 27 39 L. van Haandel, G.M. Bremmer, E.J.M. Hensen, T. Weber, Influence of sulfiding agent and pressure on structure and performance of CoMo/Al2O3 hydrodesulfurization catalysts, J. Catal., 342 (2016) 27–39. [208] M.A. Lélias P.J. Kooyman L. Mariey L. Oliviero A. Travert J. van Gestel J.A.R. van Veen F. Maugé Effect of NTA addition on the structure and activity of the active phase of cobalt-molybdenum sulfide hydrotreating catalysts J. Catal. 267 2009 14 23 M.A. Lélias, P.J. Kooyman, L. Mariey, L. Oliviero, A. Travert, J. van Gestel, J.A.R. van Veen, F. Maugé, Effect of NTA addition on the structure and activity of the active phase of cobalt-molybdenum sulfide hydrotreating catalysts, J. Catal., 267 (2009) 14–23. [209] O.V. Klimov A.V. Pashigreva G.A. Bukhtiyarova S.V. Budukva M.A. Fedotov D.I. Kochubey Y.A. Chesalov V.I. Zaikovskii A.S. Noskov Bimetallic Co-Mo complexes: a starting material for high active hydrodesulfurization catalysts Catal. Today 150 2010 196 206 O.V. Klimov, A.V. Pashigreva, G.A. Bukhtiyarova, S.V. Budukva, M.A. Fedotov, D.I. Kochubey, Y.A. Chesalov, V.I. Zaikovskii, A.S. Noskov, Bimetallic Co-Mo complexes: a starting material for high active hydrodesulfurization catalysts, Catal. Today, 150 (2010) 196–206. [210] L. Coulier V. De Beer J. Van Veen J. Niemantsverdriet Correlation between hydrodesulfurization activity and order of Ni and Mo sulfidation in planar silica-supported NiMo catalysts: the influence of chelating agents J. Catal. 197 2001 26 33 L. Coulier, V. De Beer, J. Van Veen, J. Niemantsverdriet, Correlation between hydrodesulfurization activity and order of Ni and Mo sulfidation in planar silica-supported NiMo catalysts: the influence of chelating agents, J. Catal., 197 (2001) 26–33. [211] G. Kishan L. Coulier V. De Beer J. Van Veen J. Niemantsverdriet Sulfidation and thiophene hydrodesulfurization activity of nickel tungsten sulfide model catalysts, prepared without and with chelating agents J. Catal. 196 2000 180 189 G. Kishan, L. Coulier, V. De Beer, J. Van Veen, J. Niemantsverdriet, Sulfidation and thiophene hydrodesulfurization activity of nickel tungsten sulfide model catalysts, prepared without and with chelating agents, J. Catal., 196 (2000) 180–189. [212] H. Wu A. Duan Z. Zhao D. Qi J. Li B. Liu G. Jiang J. Liu Y. Wei X. Zhang Preparation of NiMo/KIT-6 hydrodesulfurization catalysts with tunable sulfidation and dispersion degrees of active phase by addition of citric acid as chelating agent Fuel 130 2014 203 210 H. Wu, A. Duan, Z. Zhao, D. Qi, J. Li, B. Liu, G. Jiang, J. Liu, Y. Wei, X. Zhang, Preparation of NiMo/KIT-6 hydrodesulfurization catalysts with tunable sulfidation and dispersion degrees of active phase by addition of citric acid as chelating agent, Fuel, 130 (2014) 203–210. [213] Y. Gochi C. Ornelas F. Paraguay S. Fuentes L. Alvarez J. Rico G. Alonso-Núñez Effect of sulfidation on Mo-W-Ni trimetallic catalysts in the HDS of DBT Catal. Today 107 2005 531 536 Y. Gochi, C. Ornelas, F. Paraguay, S. Fuentes, L. Alvarez, J. Rico, G. Alonso-Núñez, Effect of sulfidation on Mo-W-Ni trimetallic catalysts in the HDS of DBT, Catal. Today, 107 (2005) 531–536. [214] P. Mazoyer C. Geantet F. Diehl S. Loridant M. Lacroix Role of chelating agent on the oxidic state of hydrotreating catalysts Catal. Today 130 2008 75 79 P. Mazoyer, C. Geantet, F. Diehl, S. Loridant, M. Lacroix, Role of chelating agent on the oxidic state of hydrotreating catalysts, Catal. Today, 130 (2008) 75–79. [215] R. Cattaneo T. Weber T. Shido R. Prins A quick EXAFS study of the sulfidation of NiMo/SiO2 hydrotreating catalysts prepared with chelating ligands J. Catal. 191 2000 225 236 R. Cattaneo, T. Weber, T. Shido, R. Prins, A quick EXAFS study of the sulfidation of NiMo/SiO2 hydrotreating catalysts prepared with chelating ligands, J. Catal., 191 (2000) 225–236. [216] A. Villarreal J. Ramírez L.C. Caero P.C. Villalón A. Gutiérrez-Alejandre Importance of the sulfidation step in the preparation of highly active NiMo/SiO2/Al2O3 hydrodesulfurization catalysts Catal. Today 250 2015 60 65 A. Villarreal, J. Ramírez, L.C. Caero, P.C. Villalón, A. Gutiérrez-Alejandre, Importance of the sulfidation step in the preparation of highly active NiMo/SiO2/Al2O3 hydrodesulfurization catalysts, Catal. Today, 250 (2015) 60–65. [217] H. Topsøe B. Hinnemann J.K. Nørskov J.V. Lauritsen F. Besenbacher P.L. Hansen G. Hytoft R.G. Egeberg K.G. Knudsen The role of reaction pathways and support interactions in the development of high activity hydrotreating catalysts Catal. Today 107-108 2005 12 22 H. Topsøe, B. Hinnemann, J.K. Nørskov, J.V. Lauritsen, F. Besenbacher, P.L. Hansen, G. Hytoft, R.G. Egeberg, K.G. Knudsen, The role of reaction pathways and support interactions in the development of high activity hydrotreating catalysts, Catal. Today, 107-108 (2005) 12–22. [218] D. Wu J. Zhou Y. Li Effect of the sulfidation process on the mechanical properties of a CoMoP/Al2O3 hydrotreating catalyst Chem. Eng. Sci. 64 2009 198 206 D. Wu, J. Zhou, Y. Li, Effect of the sulfidation process on the mechanical properties of a CoMoP/Al2O3 hydrotreating catalyst, Chem. Eng. Sci., 64 (2009) 198–206. [219] R. Thomas E.M. van Oers V.H.J. de Beer J. Medema J.A. Moulijn Characterization of γ-alumina-supported Molybdenum oxide and tungsten oxide; reducibility of the oxidic state versus hydrodesulfurization activity of the sulfided state J. Catal. 76 1982 241 253 R. Thomas, E.M. van Oers, V.H.J. de Beer, J. Medema, J.A. Moulijn, Characterization of γ-alumina-supported Molybdenum oxide and tungsten oxide; reducibility of the oxidic state versus hydrodesulfurization activity of the sulfided state, J. Catal., 76 (1982) 241–253. [220] L. van Haandel E.J.M. Hensen T. Weber FT-IR study of NO adsorption on MoS2/Al2O3 hydrodesulfurization catalysts: effect of catalyst preparation Catal. Today 292 2017 67 73 L. van Haandel, E.J.M. Hensen, T. Weber, FT-IR study of NO adsorption on MoS2/Al2O3 hydrodesulfurization catalysts: effect of catalyst preparation, Catal. Today, 292 (2017) 67–73. [221] P. Castillo-Villalón J. Ramirez J.A. Vargas-Luciano Analysis of the role of citric acid in the preparation of highly active HDS catalysts J. Catal. 320 2014 127 136 P. Castillo-Villalón, J. Ramirez, J.A. Vargas-Luciano, Analysis of the role of citric acid in the preparation of highly active HDS catalysts, J. Catal., 320 (2014) 127–136. [222] J.M. Hidalgo-Herrador J. Frątczak R. Velvarská H. de P. Carmona Oxalic acid-mediated catalytic transfer hydrodeoxygenation of waste cooking oil Mol. Catal. 491 2020 110973 J.M. Hidalgo-Herrador, J. Frątczak, R. Velvarská, H. de P. Carmona, Oxalic acid-mediated catalytic transfer hydrodeoxygenation of waste cooking oil, Mol. Catal., 491 (2020) 110973. [223] T.K. Vo W.S. Kim S.S. Kim K.S. Yoo J. Kim Facile synthesis of Mo/Al2O3–TiO2 catalysts using spray pyrolysis and their catalytic activity for hydrodeoxygenation Energy Convers. Manag. 158 2018 92 102 T.K. Vo, W.S. Kim, S.S. Kim, K.S. Yoo, J. Kim, Facile synthesis of Mo/Al2O3–TiO2 catalysts using spray pyrolysis and their catalytic activity for hydrodeoxygenation, Energy Convers. Manag., 158 (2018) 92–102. [224] A. Popov E. Kondratieva L. Mariey J.M. Goupil J. El Fallah J.P. Gilson A. Travert F. Maugé Bio-oil hydrodeoxygenation: adsorption of phenolic compounds on sulfided (Co)Mo catalysts J. Catal. 297 2013 176 186 A. Popov, E. Kondratieva, L. Mariey, J.M. Goupil, J. El Fallah, J.P. Gilson, A. Travert, F. Maugé, Bio-oil hydrodeoxygenation: adsorption of phenolic compounds on sulfided (Co)Mo catalysts, J. Catal., 297 (2013) 176–186. [225] Z. He X. Wang Hydrodeoxygenation of model compounds and catalytic systems for pyrolysis bio-oils upgrading Catal. Sustain. Energy 1 2012 28 52 Z. He, X. Wang, Hydrodeoxygenation of model compounds and catalytic systems for pyrolysis bio-oils upgrading, Catal. Sustain. Energy, 1 (2012) 28–52. [226] Y. Yang A. Gilbert C.C. Xu Hydrodeoxygenation of bio-crude in supercritical hexane with sulfided CoMo and CoMoP catalysts supported on MgO: a model compound study using phenol Appl. Catal. A 360 2009 242 249 Y. Yang, A. Gilbert, C.C. Xu, Hydrodeoxygenation of bio-crude in supercritical hexane with sulfided CoMo and CoMoP catalysts supported on MgO: a model compound study using phenol, Appl. Catal. A, 360 (2009) 242–249. [227] D.Y. Hong S.J. Miller P.K. Agrawal C.W. Jones Hydrodeoxygenation and coupling of aqueous phenolics over bifunctional zeolite-supported metal catalysts Chem. Commun. 46 2010 1038 1040 D.Y. Hong, S.J. Miller, P.K. Agrawal, C.W. Jones, Hydrodeoxygenation and coupling of aqueous phenolics over bifunctional zeolite-supported metal catalysts, Chem. Commun., 46 (2010) 1038–1040. [228] P.M. Mortensen D. Gardini C.D. Damsgaard J.D. Grunwaldt P.A. Jensen J.B. Wagner A.D. Jensen Deactivation of Ni-MoS2 by bio-oil impurities during hydrodeoxygenation of phenol and octanol Appl. Catal. A 523 2016 159 170 P.M. Mortensen, D. Gardini, C.D. Damsgaard, J.D. Grunwaldt, P.A. Jensen, J.B. Wagner, A.D. Jensen, Deactivation of Ni-MoS2 by bio-oil impurities during hydrodeoxygenation of phenol and octanol, Appl. Catal. A, 523 (2016) 159–170. [229] M.A. Golubeva E.M. Zakharyan A.L. Maximov Transition Metal Phosphides (Ni, Co, Mo, W) for Hydrodeoxygenation of Biorefinery Products (a Review) Pet. Chem. 60 2020 1109 1128 M.A. Golubeva, E.M. Zakharyan, A.L. Maximov, Transition Metal Phosphides (Ni, Co, Mo, W) for Hydrodeoxygenation of Biorefinery Products (a Review), Pet. Chem., 60 (2020) 1109–1128. [230] S. Li L. Wang N. Xiao A. Wang X. Li Y. Gao N. Li W. Song L. Ge J. Liu In-situ synthesis of ternary metal phosphides NixCo1−xP decorated Zn0.5Cd0.5S nanorods with significantly enhanced photocatalytic hydrogen production activity Chem. Eng. J. 378 2019 S. Li, L. Wang, N. Xiao, A. Wang, X. Li, Y. Gao, N. Li, W. Song, L. Ge, J. Liu, In-situ synthesis of ternary metal phosphides NixCo1−xP decorated Zn0.5Cd0.5S nanorods with significantly enhanced photocatalytic hydrogen production activity, Chem. Eng. J., 378 (2019). [231] C.P. Guntlin K.V. Kravchyk R. Erni M.V. Kovalenko Transition metal trifluoroacetates (M = Fe, Co, Mn) as precursors for uniform colloidal metal difluoride and phosphide nanoparticles Sci. Rep. 9 2019 C.P. Guntlin, K.V. Kravchyk, R. Erni, M.V. Kovalenko, Transition metal trifluoroacetates (M = Fe, Co, Mn) as precursors for uniform colloidal metal difluoride and phosphide nanoparticles, Sci. Rep., 9 (2019). [232] J. Huo Y. Chen Y. Liu J. Guo L. Lu W. Li Y. Wang H. Liu Bifunctional iron nickel phosphide nanocatalysts supported on porous carbon for highly efficient overall water splitting Sustain. Mater. Technol. 22 2019 J. Huo, Y. Chen, Y. Liu, J. Guo, L. Lu, W. Li, Y. Wang, H. Liu, Bifunctional iron nickel phosphide nanocatalysts supported on porous carbon for highly efficient overall water splitting, Sustain. Mater. Technol., 22 (2019). [233] S.T. Oyama T. Gott H. Zhao Y.K. Lee Transition metal phosphide hydroprocessing catalysts: a review Catal. Today 143 2009 94 107 S.T. Oyama, T. Gott, H. Zhao, Y.K. Lee, Transition metal phosphide hydroprocessing catalysts: a review, Catal. Today, 143 (2009) 94–107. [234] B. Aronsson T. Lundström S. Rundqvist Borides, silicides, and phosphides: a Critical Review of Their preparation, Properties and Crystal Chemistry 1965 Place Published Taylor & Francis B. Aronsson, T. Lundström, S. Rundqvist, Borides, silicides, and phosphides: a Critical Review of Their preparation, Properties and Crystal Chemistry, Taylor & Francis, Place Published, 1965. [235] M. Baudler Polyphosphorus compounds-new results and perspectives Angew. Chem. Int. Ed. Engl. 26 1987 419 441 M. Baudler, Polyphosphorus compounds-new results and perspectives, Angew. Chem. Int. Ed. Engl., 26 (1987) 419–441. [236] S.T. Oyama Transition metal carbides, nitrides, and phosphides Transition 2 2008 14 S.T. Oyama, Transition metal carbides, nitrides, and phosphides, Transition, 2 (2008) 14. [237] M. Zhang T. Wang H. Cao S. Cui P. Du Self-supported Ni2P nanosheets on low-cost three-dimensional Fe foam as a novel electrocatalyst for efficient water oxidation J. Energy Chem. 42 2020 71 76 M. Zhang, T. Wang, H. Cao, S. Cui, P. Du, Self-supported Ni2P nanosheets on low-cost three-dimensional Fe foam as a novel electrocatalyst for efficient water oxidation, J. Energy Chem., 42 (2020) 71–76. [238] L.F. Feitosa G. Berhault D. Laurenti T.E. Davies V.T. da Silva Synthesis and hydrodeoxygenation activity of Ni2P/C-Effect of the palladium salt on lowering the nickel phosphide synthesis temperature J. Catal. 340 2016 154 165 L.F. Feitosa, G. Berhault, D. Laurenti, T.E. Davies, V.T. da Silva, Synthesis and hydrodeoxygenation activity of Ni2P/C-Effect of the palladium salt on lowering the nickel phosphide synthesis temperature, J. Catal., 340 (2016) 154–165. [239] H. Zhao D. Li P. Bui S. Oyama Hydrodeoxygenation of guaiacol as model compound for pyrolysis oil on transition metal phosphide hydroprocessing catalysts Appl. Catal. A 391 2011 305 310 H. Zhao, D. Li, P. Bui, S. Oyama, Hydrodeoxygenation of guaiacol as model compound for pyrolysis oil on transition metal phosphide hydroprocessing catalysts, Appl. Catal. A, 391 (2011) 305–310. [240] Q. Guan F. Wan F. Han Z. Liu W. Li Hydrodeoxygenation of methyl palmitate over MCM-41 supported nickel phosphide catalysts Catal. Today 259 2016 467 473 Q. Guan, F. Wan, F. Han, Z. Liu, W. Li, Hydrodeoxygenation of methyl palmitate over MCM-41 supported nickel phosphide catalysts, Catal. Today, 259 (2016) 467–473. [241] P. Bui J.A. Cecilia S.T. Oyama A. Takagaki A. Infantes-Molina H. Zhao D. Li E. Rodríguez-Castellón A.J. López Studies of the synthesis of transition metal phosphides and their activity in the hydrodeoxygenation of a biofuel model compound J. Catal. 294 2012 184 198 P. Bui, J.A. Cecilia, S.T. Oyama, A. Takagaki, A. Infantes-Molina, H. Zhao, D. Li, E. Rodríguez-Castellón, A.J. López, Studies of the synthesis of transition metal phosphides and their activity in the hydrodeoxygenation of a biofuel model compound, J. Catal., 294 (2012) 184–198. [242] N. Koike S. Hosokai A. Takagaki S. Nishimura R. Kikuchi K. Ebitani Y. Suzuki S.T. Oyama Upgrading of pyrolysis bio-oil using nickel phosphide catalysts J. Catal. 333 2016 115 126 N. Koike, S. Hosokai, A. Takagaki, S. Nishimura, R. Kikuchi, K. Ebitani, Y. Suzuki, S.T. Oyama, Upgrading of pyrolysis bio-oil using nickel phosphide catalysts, J. Catal., 333 (2016) 115–126. [243] H.V. Ly E. Galiwango S.S. Kim J. Kim J.H. Choi H.C. Woo M.R. Othman Hydrodeoxygenation of 2-furyl methyl ketone as a model compound of algal Saccharina Japonica bio-oil using iron phosphide catalyst Chem. Eng. J. 317 2017 302 308 H.V. Ly, E. Galiwango, S.S. Kim, J. Kim, J.H. Choi, H.C. Woo, M.R. Othman, Hydrodeoxygenation of 2-furyl methyl ketone as a model compound of algal Saccharina Japonica bio-oil using iron phosphide catalyst, Chem. Eng. J., 317 (2017) 302–308. [244] T.A. Le H.V. Ly J. Kim S.S. Kim J.H. Choi H.C. Woo M.R. Othman Hydrodeoxygenation of 2-furyl methyl ketone as a model compound in bio-oil from pyrolysis of Saccharina Japonica Alga in fixed-bed reactor Chem. Eng. J. 250 2014 157 163 T.A. Le, H.V. Ly, J. Kim, S.S. Kim, J.H. Choi, H.C. Woo, M.R. Othman, Hydrodeoxygenation of 2-furyl methyl ketone as a model compound in bio-oil from pyrolysis of Saccharina Japonica Alga in fixed-bed reactor, Chem. Eng. J., 250 (2014) 157–163. [245] H.V. Ly K. Im Y. Go E. Galiwango S.S. Kim J. Kim J.H. Choi H.C. Woo Spray pyrolysis synthesis of γ-Al2O3 supported metal and metal phosphide catalysts and their activity in the hydrodeoxygenation of a bio-oil model compound Energy Convers. Manag. 127 2016 545 553 H.V. Ly, K. Im, Y. Go, E. Galiwango, S.S. Kim, J. Kim, J.H. Choi, H.C. Woo, Spray pyrolysis synthesis of γ-Al2O3 supported metal and metal phosphide catalysts and their activity in the hydrodeoxygenation of a bio-oil model compound, Energy Convers. Manag., 127 (2016) 545–553. [246] V.M.L. Whiffen K.J. Smith A comparative study of 4-methylphenol hydrodeoxygenation over high surface area MoP and Ni 2P Top. Catal. 55 2012 981 990 V.M.L. Whiffen, K.J. Smith, A comparative study of 4-methylphenol hydrodeoxygenation over high surface area MoP and Ni 2P, Top. Catal., 55 (2012) 981–990. [247] R. Cheng Y. Shu L. Li M. Zheng X. Wang A. Wang T. Zhang Synthesis and characterization of high surface area molybdenum phosphide Appl. Catal. A 316 2007 160 168 R. Cheng, Y. Shu, L. Li, M. Zheng, X. Wang, A. Wang, T. Zhang, Synthesis and characterization of high surface area molybdenum phosphide, Appl. Catal. A, 316 (2007) 160–168. [248] G.N. Yun S.J. Ahn A. Takagaki R. Kikuchi S.T. Oyama Hydrodeoxygenation of γ-valerolactone on bimetallic NiMo phosphide catalysts J. Catal. 353 2017 141 151 G.N. Yun, S.J. Ahn, A. Takagaki, R. Kikuchi, S.T. Oyama, Hydrodeoxygenation of γ-valerolactone on bimetallic NiMo phosphide catalysts, J. Catal., 353 (2017) 141–151. [249] H. Zhao S.T. Oyama H.J. Freund R. Włodarczyk M. Sierka Nature of active sites in Ni2P hydrotreating catalysts as probed by iron substitution Appl. Catal. B 164 2015 204 216 H. Zhao, S.T. Oyama, H.J. Freund, R. Włodarczyk, M. Sierka, Nature of active sites in Ni2P hydrotreating catalysts as probed by iron substitution, Appl. Catal. B, 164 (2015) 204–216. [250] Y. Guo T. Yeh W. Song D. Xu S. Wang A review of bio-oil production from hydrothermal liquefaction of algae Renew. Sustain. Energy Rev. 48 2015 776 790 Y. Guo, T. Yeh, W. Song, D. Xu, S. Wang, A review of bio-oil production from hydrothermal liquefaction of algae, Renew. Sustain. Energy Rev., 48 (2015) 776–790. [251] O.M. Adeniyi U. Azimov A. Burluka Algae biofuel: current status and future applications Renew. Sustain. Energy Rev. 90 2018 316 335 O.M. Adeniyi, U. Azimov, A. Burluka, Algae biofuel: current status and future applications, Renew. Sustain. Energy Rev., 90 (2018) 316–335. [252] Y.V. Vatutina O.V. Klimov E.A. Stolyarova K.A. Nadeina I.G. Danilova Y.A. Chesalov Е.Y. Gerasimov I.P. Prosvirin A.S. Noskov Influence of the phosphorus addition ways on properties of CoMo-catalysts of hydrotreating Catal. Today 329 2019 13 23 Y.V. Vatutina, O.V. Klimov, E.A. Stolyarova, K.A. Nadeina, I.G. Danilova, Y.A. Chesalov, Е.Y. Gerasimov, I.P. Prosvirin, A.S. Noskov, Influence of the phosphorus addition ways on properties of CoMo-catalysts of hydrotreating, Catal. Today, 329 (2019) 13–23. [253] S.K. Wu P.C. Lai Y.C. Lin Atmospheric hydrodeoxygenation of guaiacol over nickel phosphide catalysts: effect of phosphorus composition Catal Lett. 144 2014 878 889 S.K. Wu, P.C. Lai, Y.C. Lin, Atmospheric hydrodeoxygenation of guaiacol over nickel phosphide catalysts: effect of phosphorus composition, Catal Lett., 144 (2014) 878–889. [254] V. Jain Y. Bonita A. Brown A. Taconi J.C. Hicks N. Rai Mechanistic insights into hydrodeoxygenation of phenol on bimetallic phosphide catalysts Catal. Sci. Technol. 8 2018 4083 4096 V. Jain, Y. Bonita, A. Brown, A. Taconi, J.C. Hicks, N. Rai, Mechanistic insights into hydrodeoxygenation of phenol on bimetallic phosphide catalysts, Catal. Sci. Technol., 8 (2018) 4083–4096. [255] Q. Tan Y. Cao J. Li Prepared multifunctional catalyst Ni2P/Zr-SBA-15 and catalyzed Jatropha oil to produce bio-aviation fuel Renew. Energy 150 2020 370 381 Q. Tan, Y. Cao, J. Li, Prepared multifunctional catalyst Ni2P/Zr-SBA-15 and catalyzed Jatropha oil to produce bio-aviation fuel, Renew. Energy, 150 (2020) 370–381. [256] A. Galadima O. Muraza Stability improvement of zeolite catalysts under hydrothermal conditions for their potential applications in biomass valorization and crude oil upgrading Microporous Mesoporous Mater. 249 2017 42 54 A. Galadima, O. Muraza, Stability improvement of zeolite catalysts under hydrothermal conditions for their potential applications in biomass valorization and crude oil upgrading, Microporous Mesoporous Mater., 249 (2017) 42–54. [257] M. Saber B. Nakhshiniev K. Yoshikawa A review of production and upgrading of algal bio-oil Renew. Sustain. Energy Rev. 58 2016 918 930 M. Saber, B. Nakhshiniev, K. Yoshikawa, A review of production and upgrading of algal bio-oil, Renew. Sustain. Energy Rev., 58 (2016) 918–930. [258] J.K. Bwapwa A. Anandraj C. Trois Possibilities for conversion of microalgae oil into aviation fuel: a review Renew. Sustain. Energy Rev. 80 2017 1345 1354 J.K. Bwapwa, A. Anandraj, C. Trois, Possibilities for conversion of microalgae oil into aviation fuel: a review, Renew. Sustain. Energy Rev., 80 (2017) 1345–1354. [259] F. Li S.C. Srivatsa S. Bhattacharya A review on catalytic pyrolysis of microalgae to high-quality bio-oil with low oxygeneous and nitrogenous compounds Renew. Sustain. Energy Rev. 108 2019 481 497 F. Li, S.C. Srivatsa, S. Bhattacharya, A review on catalytic pyrolysis of microalgae to high-quality bio-oil with low oxygeneous and nitrogenous compounds, Renew. Sustain. Energy Rev., 108 (2019) 481–497. [260] R.M. Ravenelle F. Schüβler A. D'Amico N. Danilina J.A. Van Bokhoven J.A. Lercher C.W. Jones C. Sievers Stability of zeolites in hot liquid water J. Phys. Chem. C 114 2010 19582 19595 R.M. Ravenelle, F. Schüβler, A. D'Amico, N. Danilina, J.A. Van Bokhoven, J.A. Lercher, C.W. Jones, C. Sievers, Stability of zeolites in hot liquid water, J. Phys. Chem. C, 114 (2010) 19582–19595. [261] I.A. Bakare O. Muraza T. Kurniawan Z.H. Yamani E.N. Shafei A.K. Punetha K.H. Choi T. Yokoi Hydrothermal stability of MTT zeolite in hot water: the role of La and Ce Microporous Mesoporous Mater. 233 2016 93 101 I.A. Bakare, O. Muraza, T. Kurniawan, Z.H. Yamani, E.N. Shafei, A.K. Punetha, K.H. Choi, T. Yokoi, Hydrothermal stability of MTT zeolite in hot water: the role of La and Ce, Microporous Mesoporous Mater., 233 (2016) 93–101. [262] R. Ryoo S. Jun Improvement of hydrothermal stability of MCM-41 using salt effects during the crystallization process J. Phys. Chem. B 101 1997 317 320 R. Ryoo, S. Jun, Improvement of hydrothermal stability of MCM-41 using salt effects during the crystallization process, J. Phys. Chem. B, 101 (1997) 317–320. [263] C.Y. Chen H.X. Li M.E. Davis Studies on mesoporous materials: I. Synthesis and characterization of MCM-41 Microporous Mater. 2 1993 17 26 C.Y. Chen, H.X. Li, M.E. Davis, Studies on mesoporous materials: I. Synthesis and characterization of MCM-41, Microporous Mater., 2 (1993) 17–26. [264] C.Y. Chen S.L. Burkett H.X. Li M.E. Davis Studies on mesoporous materials II. Synthesis mechanism of MCM-41 Microporous Mater. 2 1993 27 34 C.Y. Chen, S.L. Burkett, H.X. Li, M.E. Davis, Studies on mesoporous materials II. Synthesis mechanism of MCM-41, Microporous Mater., 2 (1993) 27–34. [265] J.M. Kim J.H. Kwak S. Jun R. Ryoo Ion exchange and thermal stability of MCM-41 J. Phys. Chem. 99 1995 16742 16747 J.M. Kim, J.H. Kwak, S. Jun, R. Ryoo, Ion exchange and thermal stability of MCM-41, J. Phys. Chem., 99 (1995) 16742–16747. [266] J.M. Kim R. Ryoo Disintegration of mesoporous structures of MCM-41 and MCM-48 in water Bull. Korean Chem. Soc. 17 1996 66 68 J.M. Kim, R. Ryoo, Disintegration of mesoporous structures of MCM-41 and MCM-48 in water, Bull. Korean Chem. Soc., 17 (1996) 66–68. [267] L. Raslavičius V.G. Semenov N.I. Chernova A. Keršys A.K. Kopeyka Producing transportation fuels from algae: in search of synergy Renew. Sustain. Energy Rev. 40 2014 133 142 L. Raslavičius, V.G. Semenov, N.I. Chernova, A. Keršys, A.K. Kopeyka, Producing transportation fuels from algae: in search of synergy, Renew. Sustain. Energy Rev., 40 (2014) 133–142. [268] M. Munir M. Ahmad M. Saeed A. Waseem M. Rehan A.S. Nizami M. Zafar M. Arshad S. Sultana Sustainable production of bioenergy from novel non-edible seed oil (Prunus cerasoides) using bimetallic impregnated montmorillonite clay catalyst Renew. Sustain. Energy Rev. 109 2019 321 332 M. Munir, M. Ahmad, M. Saeed, A. Waseem, M. Rehan, A.S. Nizami, M. Zafar, M. Arshad, S. Sultana, Sustainable production of bioenergy from novel non-edible seed oil (Prunus cerasoides) using bimetallic impregnated montmorillonite clay catalyst, Renew. Sustain. Energy Rev., 109 (2019) 321–332. [269] A.R. Sirajunnisa D. Surendhiran Algae – A quintessential and positive resource of bioethanol production: a comprehensive review Renew. Sustain. Energy Rev. 66 2016 248 267 A.R. Sirajunnisa, D. Surendhiran, Algae – A quintessential and positive resource of bioethanol production: a comprehensive review, Renew. Sustain. Energy Rev., 66 (2016) 248–267. [270] R. Ravenelle M. Hahn J.R. Copeland A. Van Pelt C. Sievers Increasing the Hydrothermal Stability of Alumina Based Catalysts 2011 Place Published R. Ravenelle, M. Hahn, J.R. Copeland, A. Van Pelt, C. Sievers, Increasing the Hydrothermal Stability of Alumina Based Catalysts, Place Published, 2011. [271] H. Xiong H.N. Pham A.K. Datye Hydrothermally stable heterogeneous catalysts for conversion of biorenewables Green Chem. 16 2014 4627 4643 H. Xiong, H.N. Pham, A.K. Datye, Hydrothermally stable heterogeneous catalysts for conversion of biorenewables, Green Chem., 16 (2014) 4627–4643. [272] H.N. Pham A.E. Anderson R.L. Johnson K. Schmidt-Rohr A.K. Datye Improved hydrothermal stability of mesoporous oxides for reactions in the aqueous phase Angew. Chem. Int. Ed. 51 2012 13163 13167 H.N. Pham, A.E. Anderson, R.L. Johnson, K. Schmidt-Rohr, A.K. Datye, Improved hydrothermal stability of mesoporous oxides for reactions in the aqueous phase, Angew. Chem. Int. Ed., 51 (2012) 13163–13167. [273] M.H. Zahir K. Sato H. Mori Y. Iwamoto M. Nomura S.i. Nakao Preparation and properties of hydrothermally stable γ-alumina-based composite mesoporous membranes J. Am. Ceram. Soc. 89 2006 2874 2880 M.H. Zahir, K. Sato, H. Mori, Y. Iwamoto, M. Nomura, S.i. Nakao, Preparation and properties of hydrothermally stable γ-alumina-based composite mesoporous membranes, J. Am. Ceram. Soc., 89 (2006) 2874–2880. [274] J.W. Jun Y.W. Suh D.J. Suh Y.K. Lee Strong metal-support interaction effect of Pt/Nb2O5 catalysts on aqueous phase hydrodeoxygenation of 1,6-hexanediol Catal. Today 302 2018 108 114 J.W. Jun, Y.W. Suh, D.J. Suh, Y.K. Lee, Strong metal-support interaction effect of Pt/Nb2O5 catalysts on aqueous phase hydrodeoxygenation of 1,6-hexanediol, Catal. Today, 302 (2018) 108–114. [275] N. Li G.W. Huber Aqueous-phase hydrodeoxygenation of sorbitol with Pt/SiO2-Al2O3: identification of reaction intermediates J. Catal. 270 2010 48 59 N. Li, G.W. Huber, Aqueous-phase hydrodeoxygenation of sorbitol with Pt/SiO2-Al2O3: identification of reaction intermediates, J. Catal., 270 (2010) 48–59. [276] N. Escalona J. Ojeda J. Palacios M. Yates J. Fierro A.L. Agudo F. Gil-Llambías Promotion of Re/Al2O3 and Re/C catalysts by Ni sulfide in the HDS and HDN of gas oil: effects of Ni loading and support Appl. Catal. A 319 2007 218 229 N. Escalona, J. Ojeda, J. Palacios, M. Yates, J. Fierro, A.L. Agudo, F. Gil-Llambías, Promotion of Re/Al2O3 and Re/C catalysts by Ni sulfide in the HDS and HDN of gas oil: effects of Ni loading and support, Appl. Catal. A, 319 (2007) 218–229. [277] A. Ardiyanti A. Gutierrez M. Honkela A. Krause H. Heeres Hydrotreatment of wood-based pyrolysis oil using zirconia-supported mono-and bimetallic (Pt, Pd, Rh) catalysts Appl. Catal. A 407 2011 56 66 A. Ardiyanti, A. Gutierrez, M. Honkela, A. Krause, H. Heeres, Hydrotreatment of wood-based pyrolysis oil using zirconia-supported mono-and bimetallic (Pt, Pd, Rh) catalysts, Appl. Catal. A, 407 (2011) 56–66. [278] C. García-Sancho J. Cecilia A. Moreno-Ruiz J. Mérida-Robles J. Santamaría-González R. Moreno-Tost P. Maireles-Torres Influence of the niobium supported species on the catalytic dehydration of glycerol to acrolein Appl. Catal. B 179 2015 139 149 C. García-Sancho, J. Cecilia, A. Moreno-Ruiz, J. Mérida-Robles, J. Santamaría-González, R. Moreno-Tost, P. Maireles-Torres, Influence of the niobium supported species on the catalytic dehydration of glycerol to acrolein, Appl. Catal. B, 179 (2015) 139–149. [279] J. Mao D. Jiang Z. Fang X. Wu J. Ni X. Li Efficient hydrothermal hydrodeoxygenation of triglycerides with in situ generated hydrogen for production of diesel-like hydrocarbons Catal. Commun. 90 2017 47 50 J. Mao, D. Jiang, Z. Fang, X. Wu, J. Ni, X. Li, Efficient hydrothermal hydrodeoxygenation of triglycerides with in situ generated hydrogen for production of diesel-like hydrocarbons, Catal. Commun., 90 (2017) 47–50. [280] T. Yang L. Shi R. Li B. Li X. Kai Hydrodeoxygenation of crude bio-oil in situ in the bio-oil aqueous phase with addition of zero-valent aluminum Fuel Process. Technol. 184 2019 65 72 T. Yang, L. Shi, R. Li, B. Li, X. Kai, Hydrodeoxygenation of crude bio-oil in situ in the bio-oil aqueous phase with addition of zero-valent aluminum, Fuel Process. Technol., 184 (2019) 65–72. [281] S. Li H. Chen M. Wen J. Shen Preparation of hydrothermally stable, basic, and highly active nano nickel catalysts for the hydrodeoxygenation of N,N-dimethylformamide J. Catal. 338 2016 1 11 S. Li, H. Chen, M. Wen, J. Shen, Preparation of hydrothermally stable, basic, and highly active nano nickel catalysts for the hydrodeoxygenation of N,N-dimethylformamide, J. Catal., 338 (2016) 1–11. [282] S. Li H. Chen J. Shen Preparation of highly active and hydrothermally stable nickel catalysts J. Colloid Interface Sci. 447 2015 68 76 S. Li, H. Chen, J. Shen, Preparation of highly active and hydrothermally stable nickel catalysts, J. Colloid Interface Sci., 447 (2015) 68–76. [283] F. Oudet P. Courtine A. Vejux Thermal stabilization of transition alumina by structural coherence with LnAlO3 (Ln = La, Pr, Nd) J. Catal. 114 1988 112 120 F. Oudet, P. Courtine, A. Vejux, Thermal stabilization of transition alumina by structural coherence with LnAlO3 (Ln = La, Pr, Nd), J. Catal., 114 (1988) 112–120. [284] M.M. Hossain D. Lopez J. Herrera H.I. de Lasa Nickel on lanthanum-modified γ-Al2O3 oxygen carrier for CLC: reactivity and stability Catal. Today 143 2009 179 186 M.M. Hossain, D. Lopez, J. Herrera, H.I. de Lasa, Nickel on lanthanum-modified γ-Al2O3 oxygen carrier for CLC: reactivity and stability, Catal. Today, 143 (2009) 179–186. [285] J. Zhao H. Chen X. Tian H. Zang Y. Fu J. Shen Microcalorimetric adsorption and infrared spectroscopic studies of KNi/MgAlO catalysts for the hydrogenation of acetonitrile J. Catal. 298 2013 161 169 J. Zhao, H. Chen, X. Tian, H. Zang, Y. Fu, J. Shen, Microcalorimetric adsorption and infrared spectroscopic studies of KNi/MgAlO catalysts for the hydrogenation of acetonitrile, J. Catal., 298 (2013) 161–169. [286] N. Suárez J. Pérez-Pariente C. Márquez-Álvarez M.G. Casas A. Mayoral A. Moreno Preparation of mesoporous Beta zeolite by fluoride treatment in liquid phase. Textural, acid and catalytic properties Microporous Mesoporous Mater. 284 2019 296 303 N. Suárez, J. Pérez-Pariente, C. Márquez-Álvarez, M.G. Casas, A. Mayoral, A. Moreno, Preparation of mesoporous Beta zeolite by fluoride treatment in liquid phase. Textural, acid and catalytic properties, Microporous Mesoporous Mater., 284 (2019) 296–303. [287] Y. Wang Y. Shao G. Li T. Li H. Wang J.G. Wang Synthesis of high-micropore-volume pure-silica zeolites from a polymer near-neutral medium free of fluoride ions for VOCs capture Microporous Mesoporous Mater. 286 2019 149 154 Y. Wang, Y. Shao, G. Li, T. Li, H. Wang, J.G. Wang, Synthesis of high-micropore-volume pure-silica zeolites from a polymer near-neutral medium free of fluoride ions for VOCs capture, Microporous Mesoporous Mater., 286 (2019) 149–154. [288] L. Calabrese L. Bonaccorsi A. Caprì E. Proverbio Adhesion aspects of hydrophobic silane zeolite coatings for corrosion protection of aluminium substrate Prog. Org. Coat. 77 2014 1341 1350 L. Calabrese, L. Bonaccorsi, A. Caprì, E. Proverbio, Adhesion aspects of hydrophobic silane zeolite coatings for corrosion protection of aluminium substrate, Prog. Org. Coat., 77 (2014) 1341–1350. [289] A. Galadima O. Muraza Stability improvement of zeolite catalysts under hydrothermal conditions for their potential applications in biomass valorization and heavy oil upgrading Microporous Mesoporous Mater. 249 2017 42 54 A. Galadima, O. Muraza, Stability improvement of zeolite catalysts under hydrothermal conditions for their potential applications in biomass valorization and heavy oil upgrading, Microporous Mesoporous Mater., (2017). [290] M. Diaz-Cabanas M. Camblor Z. Liu T. Ohsuna O. Terasaki Zeolite syntheses using linear diquats of varying length in fluoride media. The synthesis of ITQ-8, ITQ-10, ITQ-14 and high silica Nu-87 J. Mater. Chem. 12 2002 249 257 M. Diaz-Cabanas, M. Camblor, Z. Liu, T. Ohsuna, O. Terasaki, Zeolite syntheses using linear diquats of varying length in fluoride media. The synthesis of ITQ-8, ITQ-10, ITQ-14 and high silica Nu-87, J. Mater. Chem., 12 (2002) 249–257. [291] T. Blasco M.A. Camblor A. Corma P. Esteve A. Martínez C. Prieto S. Valencia Unseeded synthesis of Al-free Ti-β zeolite in fluoride medium: a hydrophobic selective oxidation catalyst Chem. Commun. 1996 2367 2368 T. Blasco, M.A. Camblor, A. Corma, P. Esteve, A. Martínez, C. Prieto, S. Valencia, Unseeded synthesis of Al-free Ti-β zeolite in fluoride medium: a hydrophobic selective oxidation catalyst, Chem. Commun., (1996) 2367–2368. [292] H. Jon B. Lu Y. Oumi K. Itabashi T. Sano Synthesis and thermal stability of beta zeolite using ammonium fluoride Microporous Mesoporous Mater. 89 2006 88 95 H. Jon, B. Lu, Y. Oumi, K. Itabashi, T. Sano, Synthesis and thermal stability of beta zeolite using ammonium fluoride, Microporous Mesoporous Mater., 89 (2006) 88–95. [293] P.A. Zapata Y. Huang M.A. Gonzalez-Borja D.E. Resasco Silylated hydrophobic zeolites with enhanced tolerance to hot liquid water J. Catal. 308 2013 82 97 P.A. Zapata, Y. Huang, M.A. Gonzalez-Borja, D.E. Resasco, Silylated hydrophobic zeolites with enhanced tolerance to hot liquid water, J. Catal., 308 (2013) 82–97. [294] U. Khalil O. Muraza H. Kondoh G. Watanabe Y. Nakasaka A. Al-Amer T. Masuda Production of lighter hydrocarbons by steam-assisted catalytic cracking of heavy oil over silane-treated Beta zeolite Energy Fuels 30 2016 1304 1309 U. Khalil, O. Muraza, H. Kondoh, G. Watanabe, Y. Nakasaka, A. Al-Amer, T. Masuda, Production of lighter hydrocarbons by steam-assisted catalytic cracking of heavy oil over silane-treated Beta zeolite, Energy Fuels, 30 (2016) 1304–1309. [295] X. Liu Z. Li B. Zhang M. Hu Improvement of hydrodeoxygenation stability of nickel phosphide based catalysts by silica modification as structural promoter Fuel 204 2017 144 151 X. Liu, Z. Li, B. Zhang, M. Hu, Improvement of hydrodeoxygenation stability of nickel phosphide based catalysts by silica modification as structural promoter, Fuel, 204 (2017) 144–151.",
      "scopus-id": "85123160297",
      "coredata": {
        "eid": "1-s2.0-S2468823122000190",
        "dc:description": "Sequel to the future challenges identified in the energy indicators, the exploration of algae-biomass resources increasingly becoming an issue of interest. Algae-derived oils are accordingly considered as alternative fuels with great future prospects. However, their direct utilization is scientifically difficult due to associated complex compositions. So far, hydrodeoxygenation (HDO) of the oils is increasingly viewed as the reliable upgrading process for deriving high quality fuels. The paper therefore explored and critically examined substantial literature on the updates related to catalyst design and testing for HDO, the influence of oil production techniques on its susceptibility to HDO, effects of parameters such as catalyst sulfidation, modification to phosphides, nature of support systems and preparation versus reaction conditions. In addition to highlights on reaction mechanisms, the paper also discussed the effect of hydrothermal treatment on HDO catalyst stability and provided insights into areas for further investigations.",
        "openArchiveArticle": "false",
        "prism:coverDate": "2022-05-31",
        "openaccessUserLicense": null,
        "prism:aggregationType": "Journal",
        "prism:url": "https://api.elsevier.com/content/article/pii/S2468823122000190",
        "dc:creator": [
          {
            "@_fa": "true",
            "$": "Galadima, Ahmad"
          },
          {
            "@_fa": "true",
            "$": "Masudi, Ahmad"
          },
          {
            "@_fa": "true",
            "$": "Muraza, Oki"
          }
        ],
        "link": [
          {
            "@_fa": "true",
            "@rel": "self",
            "@href": "https://api.elsevier.com/content/article/pii/S2468823122000190"
          },
          {
            "@_fa": "true",
            "@rel": "scidir",
            "@href": "https://www.sciencedirect.com/science/article/pii/S2468823122000190"
          }
        ],
        "dc:format": "application/json",
        "openaccessType": null,
        "pii": "S2468-8231(22)00019-0",
        "prism:volume": "523",
        "articleNumber": "112131",
        "prism:publisher": "Elsevier B.V.",
        "dc:title": "Towards sustainable catalysts in hydrodeoxygenation of algae-derived oils: A critical review",
        "prism:copyright": "© 2022 Elsevier B.V. All rights reserved.",
        "openaccess": "0",
        "prism:issn": "24688231",
        "dcterms:subject": [
          {
            "@_fa": "true",
            "$": "Algae-derived oils"
          },
          {
            "@_fa": "true",
            "$": "Hydrodeoxygenation"
          },
          {
            "@_fa": "true",
            "$": "Metal phosphides"
          },
          {
            "@_fa": "true",
            "$": "sulfidation"
          }
        ],
        "openaccessArticle": "false",
        "prism:publicationName": "Molecular Catalysis",
        "openaccessSponsorType": null,
        "prism:pageRange": "112131",
        "pubType": "fla",
        "prism:coverDisplayDate": "May 2022",
        "prism:doi": "10.1016/j.mcat.2022.112131",
        "prism:startingPage": "112131",
        "dc:identifier": "doi:10.1016/j.mcat.2022.112131",
        "openaccessSponsorName": null
      },
      "objects": {
        "object": [
          {
            "@category": "standard",
            "@height": "292",
            "@width": "565",
            "@_fa": "true",
            "$": "https://api.elsevier.com/content/object/eid/1-s2.0-S2468823122000190-gr9.jpg?httpAccept=%2A%2F%2A",
            "@multimediatype": "JPEG image file",
            "@type": "IMAGE-DOWNSAMPLED",
            "@size": "35321",
            "@ref": "gr9",
            "@mimetype": "image/jpeg"
          },
          {
            "@category": "standard",
            "@height": "195",
            "@width": "339",
            "@_fa": "true",
            "$": "https://api.elsevier.com/content/object/eid/1-s2.0-S2468823122000190-gr8.jpg?httpAccept=%2A%2F%2A",
            "@multimediatype": "JPEG image file",
            "@type": "IMAGE-DOWNSAMPLED",
            "@size": "11973",
            "@ref": "gr8",
            "@mimetype": "image/jpeg"
          },
          {
            "@category": "standard",
            "@height": "384",
            "@width": "678",
            "@_fa": "true",
            "$": "https://api.elsevier.com/content/object/eid/1-s2.0-S2468823122000190-gr7.jpg?httpAccept=%2A%2F%2A",
            "@multimediatype": "JPEG image file",
            "@type": "IMAGE-DOWNSAMPLED",
            "@size": "39340",
            "@ref": "gr7",
            "@mimetype": "image/jpeg"
          },
          {
            "@category": "standard",
            "@height": "343",
            "@width": "489",
            "@_fa": "true",
            "$": "https://api.elsevier.com/content/object/eid/1-s2.0-S2468823122000190-gr6.jpg?httpAccept=%2A%2F%2A",
            "@multimediatype": "JPEG image file",
            "@type": "IMAGE-DOWNSAMPLED",
            "@size": "37063",
            "@ref": "gr6",
            "@mimetype": "image/jpeg"
          },
          {
            "@category": "standard",
            "@height": "457",
            "@width": "565",
            "@_fa": "true",
            "$": "https://api.elsevier.com/content/object/eid/1-s2.0-S2468823122000190-gr10.jpg?httpAccept=%2A%2F%2A",
            "@multimediatype": "JPEG image file",
            "@type": "IMAGE-DOWNSAMPLED",
            "@size": "84906",
            "@ref": "gr10",
            "@mimetype": "image/jpeg"
          },
          {
            "@category": "standard",
            "@height": "436",
            "@width": "565",
            "@_fa": "true",
            "$": "https://api.elsevier.com/content/object/eid/1-s2.0-S2468823122000190-gr11.jpg?httpAccept=%2A%2F%2A",
            "@multimediatype": "JPEG image file",
            "@type": "IMAGE-DOWNSAMPLED",
            "@size": "35850",
            "@ref": "gr11",
            "@mimetype": "image/jpeg"
          },
          {
            "@category": "standard",
            "@height": "213",
            "@width": "376",
            "@_fa": "true",
            "$": "https://api.elsevier.com/content/object/eid/1-s2.0-S2468823122000190-gr1.jpg?httpAccept=%2A%2F%2A",
            "@multimediatype": "JPEG image file",
            "@type": "IMAGE-DOWNSAMPLED",
            "@size": "29120",
            "@ref": "gr1",
            "@mimetype": "image/jpeg"
          },
          {
            "@category": "standard",
            "@height": "313",
            "@width": "489",
            "@_fa": "true",
            "$": "https://api.elsevier.com/content/object/eid/1-s2.0-S2468823122000190-gr5.jpg?httpAccept=%2A%2F%2A",
            "@multimediatype": "JPEG image file",
            "@type": "IMAGE-DOWNSAMPLED",
            "@size": "32728",
            "@ref": "gr5",
            "@mimetype": "image/jpeg"
          },
          {
            "@category": "standard",
            "@height": "292",
            "@width": "489",
            "@_fa": "true",
            "$": "https://api.elsevier.com/content/object/eid/1-s2.0-S2468823122000190-gr4.jpg?httpAccept=%2A%2F%2A",
            "@multimediatype": "JPEG image file",
            "@type": "IMAGE-DOWNSAMPLED",
            "@size": "33439",
            "@ref": "gr4",
            "@mimetype": "image/jpeg"
          },
          {
            "@category": "standard",
            "@height": "352",
            "@width": "565",
            "@_fa": "true",
            "$": "https://api.elsevier.com/content/object/eid/1-s2.0-S2468823122000190-gr3.jpg?httpAccept=%2A%2F%2A",
            "@multimediatype": "JPEG image file",
            "@type": "IMAGE-DOWNSAMPLED",
            "@size": "33505",
            "@ref": "gr3",
            "@mimetype": "image/jpeg"
          },
          {
            "@category": "standard",
            "@height": "252",
            "@width": "386",
            "@_fa": "true",
            "$": "https://api.elsevier.com/content/object/eid/1-s2.0-S2468823122000190-gr2.jpg?httpAccept=%2A%2F%2A",
            "@multimediatype": "JPEG image file",
            "@type": "IMAGE-DOWNSAMPLED",
            "@size": "18673",
            "@ref": "gr2",
            "@mimetype": "image/jpeg"
          },
          {
            "@category": "standard",
            "@height": "185",
            "@width": "301",
            "@_fa": "true",
            "$": "https://api.elsevier.com/content/object/eid/1-s2.0-S2468823122000190-ga1.jpg?httpAccept=%2A%2F%2A",
            "@multimediatype": "JPEG image file",
            "@type": "IMAGE-DOWNSAMPLED",
            "@size": "27545",
            "@ref": "ga1",
            "@mimetype": "image/jpeg"
          },
          {
            "@category": "thumbnail",
            "@height": "113",
            "@width": "219",
            "@_fa": "true",
            "$": "https://api.elsevier.com/content/object/eid/1-s2.0-S2468823122000190-gr9.sml?httpAccept=%2A%2F%2A",
            "@multimediatype": "GIF image file",
            "@type": "IMAGE-THUMBNAIL",
            "@size": "6932",
            "@ref": "gr9",
            "@mimetype": "image/gif"
          },
          {
            "@category": "thumbnail",
            "@height": "126",
            "@width": "219",
            "@_fa": "true",
            "$": "https://api.elsevier.com/content/object/eid/1-s2.0-S2468823122000190-gr8.sml?httpAccept=%2A%2F%2A",
            "@multimediatype": "GIF image file",
            "@type": "IMAGE-THUMBNAIL",
            "@size": "4453",
            "@ref": "gr8",
            "@mimetype": "image/gif"
          },
          {
            "@category": "thumbnail",
            "@height": "124",
            "@width": "219",
            "@_fa": "true",
            "$": "https://api.elsevier.com/content/object/eid/1-s2.0-S2468823122000190-gr7.sml?httpAccept=%2A%2F%2A",
            "@multimediatype": "GIF image file",
            "@type": "IMAGE-THUMBNAIL",
            "@size": "5236",
            "@ref": "gr7",
            "@mimetype": "image/gif"
          },
          {
            "@category": "thumbnail",
            "@height": "154",
            "@width": "219",
            "@_fa": "true",
            "$": "https://api.elsevier.com/content/object/eid/1-s2.0-S2468823122000190-gr6.sml?httpAccept=%2A%2F%2A",
            "@multimediatype": "GIF image file",
            "@type": "IMAGE-THUMBNAIL",
            "@size": "10295",
            "@ref": "gr6",
            "@mimetype": "image/gif"
          },
          {
            "@category": "thumbnail",
            "@height": "164",
            "@width": "202",
            "@_fa": "true",
            "$": "https://api.elsevier.com/content/object/eid/1-s2.0-S2468823122000190-gr10.sml?httpAccept=%2A%2F%2A",
            "@multimediatype": "GIF image file",
            "@type": "IMAGE-THUMBNAIL",
            "@size": "17327",
            "@ref": "gr10",
            "@mimetype": "image/gif"
          },
          {
            "@category": "thumbnail",
            "@height": "164",
            "@width": "213",
            "@_fa": "true",
            "$": "https://api.elsevier.com/content/object/eid/1-s2.0-S2468823122000190-gr11.sml?httpAccept=%2A%2F%2A",
            "@multimediatype": "GIF image file",
            "@type": "IMAGE-THUMBNAIL",
            "@size": "7590",
            "@ref": "gr11",
            "@mimetype": "image/gif"
          },
          {
            "@category": "thumbnail",
            "@height": "124",
            "@width": "219",
            "@_fa": "true",
            "$": "https://api.elsevier.com/content/object/eid/1-s2.0-S2468823122000190-gr1.sml?httpAccept=%2A%2F%2A",
            "@multimediatype": "GIF image file",
            "@type": "IMAGE-THUMBNAIL",
            "@size": "12383",
            "@ref": "gr1",
            "@mimetype": "image/gif"
          },
          {
            "@category": "thumbnail",
            "@height": "140",
            "@width": "219",
            "@_fa": "true",
            "$": "https://api.elsevier.com/content/object/eid/1-s2.0-S2468823122000190-gr5.sml?httpAccept=%2A%2F%2A",
            "@multimediatype": "GIF image file",
            "@type": "IMAGE-THUMBNAIL",
            "@size": "9749",
            "@ref": "gr5",
            "@mimetype": "image/gif"
          },
          {
            "@category": "thumbnail",
            "@height": "131",
            "@width": "219",
            "@_fa": "true",
            "$": "https://api.elsevier.com/content/object/eid/1-s2.0-S2468823122000190-gr4.sml?httpAccept=%2A%2F%2A",
            "@multimediatype": "GIF image file",
            "@type": "IMAGE-THUMBNAIL",
            "@size": "10068",
            "@ref": "gr4",
            "@mimetype": "image/gif"
          },
          {
            "@category": "thumbnail",
            "@height": "137",
            "@width": "219",
            "@_fa": "true",
            "$": "https://api.elsevier.com/content/object/eid/1-s2.0-S2468823122000190-gr3.sml?httpAccept=%2A%2F%2A",
            "@multimediatype": "GIF image file",
            "@type": "IMAGE-THUMBNAIL",
            "@size": "5768",
            "@ref": "gr3",
            "@mimetype": "image/gif"
          },
          {
            "@category": "thumbnail",
            "@height": "143",
            "@width": "219",
            "@_fa": "true",
            "$": "https://api.elsevier.com/content/object/eid/1-s2.0-S2468823122000190-gr2.sml?httpAccept=%2A%2F%2A",
            "@multimediatype": "GIF image file",
            "@type": "IMAGE-THUMBNAIL",
            "@size": "7172",
            "@ref": "gr2",
            "@mimetype": "image/gif"
          },
          {
            "@category": "thumbnail",
            "@height": "135",
            "@width": "219",
            "@_fa": "true",
            "$": "https://api.elsevier.com/content/object/eid/1-s2.0-S2468823122000190-ga1.sml?httpAccept=%2A%2F%2A",
            "@multimediatype": "GIF image file",
            "@type": "IMAGE-THUMBNAIL",
            "@size": "11254",
            "@ref": "ga1",
            "@mimetype": "image/gif"
          },
          {
            "@category": "high",
            "@height": "1290",
            "@width": "2500",
            "@_fa": "true",
            "$": "https://api.elsevier.com/content/object/eid/1-s2.0-S2468823122000190-gr9_lrg.jpg?httpAccept=%2A%2F%2A",
            "@multimediatype": "JPEG image file",
            "@type": "IMAGE-HIGH-RES",
            "@size": "328337",
            "@ref": "gr9",
            "@mimetype": "image/jpeg"
          },
          {
            "@category": "high",
            "@height": "864",
            "@width": "1500",
            "@_fa": "true",
            "$": "https://api.elsevier.com/content/object/eid/1-s2.0-S2468823122000190-gr8_lrg.jpg?httpAccept=%2A%2F%2A",
            "@multimediatype": "JPEG image file",
            "@type": "IMAGE-HIGH-RES",
            "@size": "97446",
            "@ref": "gr8",
            "@mimetype": "image/jpeg"
          },
          {
            "@category": "high",
            "@height": "1701",
            "@width": "3000",
            "@_fa": "true",
            "$": "https://api.elsevier.com/content/object/eid/1-s2.0-S2468823122000190-gr7_lrg.jpg?httpAccept=%2A%2F%2A",
            "@multimediatype": "JPEG image file",
            "@type": "IMAGE-HIGH-RES",
            "@size": "306103",
            "@ref": "gr7",
            "@mimetype": "image/jpeg"
          },
          {
            "@category": "high",
            "@height": "1519",
            "@width": "2167",
            "@_fa": "true",
            "$": "https://api.elsevier.com/content/object/eid/1-s2.0-S2468823122000190-gr6_lrg.jpg?httpAccept=%2A%2F%2A",
            "@multimediatype": "JPEG image file",
            "@type": "IMAGE-HIGH-RES",
            "@size": "284463",
            "@ref": "gr6",
            "@mimetype": "image/jpeg"
          },
          {
            "@category": "high",
            "@height": "2024",
            "@width": "2500",
            "@_fa": "true",
            "$": "https://api.elsevier.com/content/object/eid/1-s2.0-S2468823122000190-gr10_lrg.jpg?httpAccept=%2A%2F%2A",
            "@multimediatype": "JPEG image file",
            "@type": "IMAGE-HIGH-RES",
            "@size": "729411",
            "@ref": "gr10",
            "@mimetype": "image/jpeg"
          },
          {
            "@category": "high",
            "@height": "1927",
            "@width": "2500",
            "@_fa": "true",
            "$": "https://api.elsevier.com/content/object/eid/1-s2.0-S2468823122000190-gr11_lrg.jpg?httpAccept=%2A%2F%2A",
            "@multimediatype": "JPEG image file",
            "@type": "IMAGE-HIGH-RES",
            "@size": "272011",
            "@ref": "gr11",
            "@mimetype": "image/jpeg"
          },
          {
            "@category": "high",
            "@height": "944",
            "@width": "1667",
            "@_fa": "true",
            "$": "https://api.elsevier.com/content/object/eid/1-s2.0-S2468823122000190-gr1_lrg.jpg?httpAccept=%2A%2F%2A",
            "@multimediatype": "JPEG image file",
            "@type": "IMAGE-HIGH-RES",
            "@size": "237967",
            "@ref": "gr1",
            "@mimetype": "image/jpeg"
          },
          {
            "@category": "high",
            "@height": "1387",
            "@width": "2167",
            "@_fa": "true",
            "$": "https://api.elsevier.com/content/object/eid/1-s2.0-S2468823122000190-gr5_lrg.jpg?httpAccept=%2A%2F%2A",
            "@multimediatype": "JPEG image file",
            "@type": "IMAGE-HIGH-RES",
            "@size": "256612",
            "@ref": "gr5",
            "@mimetype": "image/jpeg"
          },
          {
            "@category": "high",
            "@height": "1294",
            "@width": "2167",
            "@_fa": "true",
            "$": "https://api.elsevier.com/content/object/eid/1-s2.0-S2468823122000190-gr4_lrg.jpg?httpAccept=%2A%2F%2A",
            "@multimediatype": "JPEG image file",
            "@type": "IMAGE-HIGH-RES",
            "@size": "255626",
            "@ref": "gr4",
            "@mimetype": "image/jpeg"
          },
          {
            "@category": "high",
            "@height": "1559",
            "@width": "2500",
            "@_fa": "true",
            "$": "https://api.elsevier.com/content/object/eid/1-s2.0-S2468823122000190-gr3_lrg.jpg?httpAccept=%2A%2F%2A",
            "@multimediatype": "JPEG image file",
            "@type": "IMAGE-HIGH-RES",
            "@size": "255548",
            "@ref": "gr3",
            "@mimetype": "image/jpeg"
          },
          {
            "@category": "high",
            "@height": "1116",
            "@width": "1709",
            "@_fa": "true",
            "$": "https://api.elsevier.com/content/object/eid/1-s2.0-S2468823122000190-gr2_lrg.jpg?httpAccept=%2A%2F%2A",
            "@multimediatype": "JPEG image file",
            "@type": "IMAGE-HIGH-RES",
            "@size": "131138",
            "@ref": "gr2",
            "@mimetype": "image/jpeg"
          },
          {
            "@category": "high",
            "@height": "820",
            "@width": "1333",
            "@_fa": "true",
            "$": "https://api.elsevier.com/content/object/eid/1-s2.0-S2468823122000190-ga1_lrg.jpg?httpAccept=%2A%2F%2A",
            "@multimediatype": "JPEG image file",
            "@type": "IMAGE-HIGH-RES",
            "@size": "195582",
            "@ref": "ga1",
            "@mimetype": "image/jpeg"
          },
          {
            "@category": "thumbnail",
            "@_fa": "true",
            "$": "https://api.elsevier.com/content/object/eid/1-s2.0-S2468823122000190-si1.svg?httpAccept=%2A%2F%2A",
            "@multimediatype": "Scalable Vector Graphics file",
            "@type": "ALTIMG",
            "@size": "791",
            "@ref": "si1",
            "@mimetype": "image/svg+xml"
          },
          {
            "@category": "thumbnail",
            "@_fa": "true",
            "$": "https://api.elsevier.com/content/object/eid/1-s2.0-S2468823122000190-si2.svg?httpAccept=%2A%2F%2A",
            "@multimediatype": "Scalable Vector Graphics file",
            "@type": "ALTIMG",
            "@size": "7255",
            "@ref": "si2",
            "@mimetype": "image/svg+xml"
          },
          {
            "@category": "thumbnail",
            "@_fa": "true",
            "$": "https://api.elsevier.com/content/object/eid/1-s2.0-S2468823122000190-si3.svg?httpAccept=%2A%2F%2A",
            "@multimediatype": "Scalable Vector Graphics file",
            "@type": "ALTIMG",
            "@size": "1366",
            "@ref": "si3",
            "@mimetype": "image/svg+xml"
          },
          {
            "@category": "standard",
            "@_fa": "true",
            "$": "https://api.elsevier.com/content/object/eid/1-s2.0-S2468823122000190-am.pdf?httpAccept=%2A%2F%2A",
            "@multimediatype": "Acrobat PDF file",
            "@type": "AAM-PDF",
            "@size": "1689681",
            "@ref": "am",
            "@mimetype": "application/pdf"
          }
        ]
      },
      "link": {
        "@rel": "abstract",
        "@href": "https://api.elsevier.com/content/abstract/scopus_id/85123160297"
      }
    }
  }
}