{
  "metadata": {
    "title": "Design of Mo<ce:inf loc=post>2</ce:inf>C-MoP heterostructure hydrogen and oxygen evolution bifunctional catalyst based on first principles",
    "authors": "; ; ",
    "journal": "Molecular Catalysis",
    "date": "2024-01-31",
    "doi": "10.1016/j.mcat.2023.113672",
    "abstract": "",
    "uri": "https://api.elsevier.com/content/article/pii/S2468823123007551",
    "pii": "S2468823123007551"
  },
  "fulltext": {
    "full-text-retrieval-response": {
      "scopus-eid": "2-s2.0-85181742964",
      "originalText": "serial JL 315758 291210 291744 291790 291809 31 Molecular Catalysis MOLECULARCATALYSIS 2023-11-15 2023-11-15 2023-11-15 2023-11-15 2024-01-24T03:57:22 1-s2.0-S2468823123007551 S2468-8231(23)00755-1 S2468823123007551 10.1016/j.mcat.2023.113672 S300 S300.1 FULL-TEXT 1-s2.0-S2468823123X00182 2024-01-24T06:59:51.235883Z 0 0 20240101 20240131 2024 2023-11-15T20:47:01.457502Z absattachment articleinfo articlenumber articletitlenorm authfirstinitialnorm authfirstsurnamenorm cid cids contenttype copyright crossmark dateloaded dateloadedtxt datesearch datesort dateupdated dco docsubtype doctype doi eid ewtransactionid hubeid indexeddate issn issnnorm itemstage itemtransactionid itemweight openaccess openarchive pg pgfirst pii piinorm pubdateend pubdatestart pubdatetxt pubyr sectiontitle sortorder srctitle srctitlenorm srctype ssids alllist content subj subheadings suppl tomb volfirst volissue volumelist webpdf webpdfpagecount yearnav figure table e-component body acknowledge affil appendices articletitle auth authfirstini authfull authkeywords authlast grantnumber grantsponsor highlightsabst orcid primabst ref specialabst 2468-8231 24688231 true 552 552 C Volume 552 18 113672 113672 113672 202401 January 2024 2024-01-01 2024-01-31 2024 Regular Papers article fla © 2023 Elsevier B.V. All rights reserved. DESIGNMO2CMOPHETEROSTRUCTUREHYDROGENOXYGENEVOLUTIONBIFUNCTIONALCATALYSTBASEDFIRSTPRINCIPLES LIU Z 1 Introduction 2 Calculation method 3 Results and discussion 3.1 A description of the MoP-Mo2C heterostructure's stability 3.2 MoP-Mo2C heterogeneous structure HER analysis 3.3 OER analysis of the MoP-Mo2C heterostructure 4 Conclusion CRediT authorship contribution statement Acknowledgements Appendix Supplementary materials References BUYANOV 2011 38 55 V LIU 2015 1258832 J SHI 2023 76 82 J MOSNIER 2023 335 345 A YURKO 2023 Y LI 2021 559 566 J TAHIR 2023 1631 1647 A LIU 2023 2208358 D BHUNIA 2023 214956 K ZHANG 2023 494 501 Z XU 2023 223 232 D ZENG 2020 1249 1269 H ZHOU 2023 S HAN 2019 5950 5955 M WANG 2022 120933 X LI 2022 30683 30691 C WANG 2022 138191 X JIANG 2023 157482 J WANG 2022 135544 X WU 2018 353 363 A WU 2019 25986 25995 A LIU 2023 157508 Z DU 2017 15940 15949 C ZHANG 2021 100792 L WANG 2019 227 230 D GU 2021 6673 6681 Y SONG 2022 165611 H JIANG 2022 133719 E WU 2023 2209954 J PERDEW 1996 3865 J MA 2023 H HAN 2023 2208965 H DENG 2022 262 B MONKHORST 1976 5188 H GRIMME 2010 154104 S TODOROVA 2008 1013 1017 T TUCKERMAN 1995 150 161 M MCMILLAN 1965 108 W WEN 2018 1802427 G GAO 2018 833∼836 M YANG 2022 7225 Y CHEN 2022 162508 X GUO 2020 5709 5721 X LIANG 2020 20453 20462 Z NORSKOV 2005 J23 J HU 2021 1360 1365 S SANLESSOBRIDO 2012 3943 3948 M LAMOUREUX 2019 6194 6201 P NORSKOV 2005 J23 J HU 2022 3958 Q LIU 2020 938 S ZHANG 2021 433 441 T YU 2020 2000570 Y ZHAO 2023 Y RAN 2022 2071 2083 N TAN 2022 11821 11829 Y LIUX2024X113672 LIUX2024X113672XZ 2025-11-15T00:00:00.000Z 2025-11-15T00:00:00.000Z http://creativecommons.org/licenses/by-nc-nd/4.0/ © 2023 Elsevier B.V. All rights reserved. 2024-01-13T16:29:05.717Z http://vtw.elsevier.com/data/voc/AddOnTypes/50.7/aggregated-refined China Postdoctoral Science Foundation 2023M732392 China Postdoctoral Science Foundation http://data.elsevier.com/vocabulary/SciValFunders/501100002858 http://sws.geonames.org/1814991/ Key Laboratory of Mineral High Value Conversion and Energy Storage Materials of Liaoning Province Shiyanjia Lab National Natural Science Foundation 52102360 NSFC National Natural Science Foundation of China http://data.elsevier.com/vocabulary/SciValFunders/501100001809 http://sws.geonames.org/1814991/ This article is supported by the National Natural Science Foundation ( 52102360 ) and the China Postdoctoral Science Foundation (Grant No. 2023M732392 ). The authors would like to thank Shiyanjia Lab( www.shiyanjia.com ) for the support of test resource. Besides, the authors would like to thank Key Laboratory of Mineral High Value Conversion and Energy Storage Materials of Liaoning Province for the support of computing resource. This article is supported by the National Natural Science Foundation (52102360) and the China Postdoctoral Science Foundation (Grant No. 2023M732392). The authors would like to thank Shiyanjia Lab(www.shiyanjia.com) for the support of test resource. Besides, the authors would like to thank Key Laboratory of Mineral High Value Conversion and Energy Storage Materials of Liaoning Province for the support of computing resource. https://doi.org/10.15223/policy-017 https://doi.org/10.15223/policy-037 https://doi.org/10.15223/policy-012 https://doi.org/10.15223/policy-029 https://doi.org/10.15223/policy-004 item S2468-8231(23)00755-1 S2468823123007551 1-s2.0-S2468823123007551 10.1016/j.mcat.2023.113672 315758 2024-01-24T06:59:51.235883Z 2024-01-01 2024-01-31 1-s2.0-S2468823123007551-main.pdf https://s3-eu-west-1.amazonaws.com/prod-ucs-content-store-eu-west/content/pii:S2468823123007551/MAIN/application/pdf/af87e68c51c74da54a9e0a401c02c52e/main.pdf main.pdf pdf true 6512376 MAIN 8 1-s2.0-S2468823123007551-main_1.png https://s3-eu-west-1.amazonaws.com/prod-ucs-content-store-eu-west/content/pii:S2468823123007551/PREVIEW/image/png/4f4beb62502e1bbb766c114da29ad6eb/main_1.png main_1.png png 59290 849 656 IMAGE-WEB-PDF 1 1-s2.0-S2468823123007551-gr2.jpg https://s3-eu-west-1.amazonaws.com/prod-ucs-content-store-eu-west/content/pii:S2468823123007551/gr2/DOWNSAMPLED/image/jpeg/ae10f8222e018a0b1c5f46ff565924e5/gr2.jpg gr2 gr2.jpg jpg 113061 453 659 IMAGE-DOWNSAMPLED 1-s2.0-S2468823123007551-ga1.jpg https://s3-eu-west-1.amazonaws.com/prod-ucs-content-store-eu-west/content/pii:S2468823123007551/ga1/DOWNSAMPLED/image/jpeg/6a04a7871e7eb3f9374bba91ed9d15c3/ga1.jpg ga1 true ga1.jpg jpg 42901 200 486 IMAGE-DOWNSAMPLED 1-s2.0-S2468823123007551-gr6.jpg https://s3-eu-west-1.amazonaws.com/prod-ucs-content-store-eu-west/content/pii:S2468823123007551/gr6/DOWNSAMPLED/image/jpeg/9deef777b65abf4b48a5c35973ac4380/gr6.jpg gr6 gr6.jpg jpg 100042 284 734 IMAGE-DOWNSAMPLED 1-s2.0-S2468823123007551-gr5.jpg https://s3-eu-west-1.amazonaws.com/prod-ucs-content-store-eu-west/content/pii:S2468823123007551/gr5/DOWNSAMPLED/image/jpeg/fcc7f4f27be544ba93c8fb3b7f223e03/gr5.jpg gr5 gr5.jpg jpg 96685 358 734 IMAGE-DOWNSAMPLED 1-s2.0-S2468823123007551-gr4.jpg https://s3-eu-west-1.amazonaws.com/prod-ucs-content-store-eu-west/content/pii:S2468823123007551/gr4/DOWNSAMPLED/image/jpeg/8cdb3cccf6a8f14b6eae99dcddacc5d2/gr4.jpg gr4 gr4.jpg jpg 92933 378 715 IMAGE-DOWNSAMPLED 1-s2.0-S2468823123007551-gr7.jpg https://s3-eu-west-1.amazonaws.com/prod-ucs-content-store-eu-west/content/pii:S2468823123007551/gr7/DOWNSAMPLED/image/jpeg/fa62fc5a1ac16d4e4deae88867a82509/gr7.jpg gr7 gr7.jpg jpg 40178 284 663 IMAGE-DOWNSAMPLED 1-s2.0-S2468823123007551-gr3.jpg https://s3-eu-west-1.amazonaws.com/prod-ucs-content-store-eu-west/content/pii:S2468823123007551/gr3/DOWNSAMPLED/image/jpeg/6785a7f7e45d4c0245be1ea0a165e4d4/gr3.jpg gr3 gr3.jpg jpg 70173 279 753 IMAGE-DOWNSAMPLED 1-s2.0-S2468823123007551-gr1.jpg https://s3-eu-west-1.amazonaws.com/prod-ucs-content-store-eu-west/content/pii:S2468823123007551/gr1/DOWNSAMPLED/image/jpeg/8abe9a28c5a5438a89898b6163936327/gr1.jpg gr1 gr1.jpg jpg 68692 239 716 IMAGE-DOWNSAMPLED 1-s2.0-S2468823123007551-gr2.sml https://s3-eu-west-1.amazonaws.com/prod-ucs-content-store-eu-west/content/pii:S2468823123007551/gr2/THUMBNAIL/image/gif/2ca5905a3b727c523eb4d25d0e425121/gr2.sml gr2 gr2.sml sml 16821 150 219 IMAGE-THUMBNAIL 1-s2.0-S2468823123007551-ga1.sml https://s3-eu-west-1.amazonaws.com/prod-ucs-content-store-eu-west/content/pii:S2468823123007551/ga1/THUMBNAIL/image/gif/dcb80c155ade4461341c4f7a47213cca/ga1.sml ga1 true ga1.sml sml 15245 90 219 IMAGE-THUMBNAIL 1-s2.0-S2468823123007551-gr6.sml https://s3-eu-west-1.amazonaws.com/prod-ucs-content-store-eu-west/content/pii:S2468823123007551/gr6/THUMBNAIL/image/gif/d7a78a88788b9619eb5365a85d1fb625/gr6.sml gr6 gr6.sml sml 12158 85 219 IMAGE-THUMBNAIL 1-s2.0-S2468823123007551-gr5.sml https://s3-eu-west-1.amazonaws.com/prod-ucs-content-store-eu-west/content/pii:S2468823123007551/gr5/THUMBNAIL/image/gif/686e912992efc6dd9730ccb12c99d10f/gr5.sml gr5 gr5.sml sml 12630 107 219 IMAGE-THUMBNAIL 1-s2.0-S2468823123007551-gr4.sml https://s3-eu-west-1.amazonaws.com/prod-ucs-content-store-eu-west/content/pii:S2468823123007551/gr4/THUMBNAIL/image/gif/f3d7f39b82852856e62a977b14d306dc/gr4.sml gr4 gr4.sml sml 12664 116 219 IMAGE-THUMBNAIL 1-s2.0-S2468823123007551-gr7.sml https://s3-eu-west-1.amazonaws.com/prod-ucs-content-store-eu-west/content/pii:S2468823123007551/gr7/THUMBNAIL/image/gif/e0e1fa6667566adda4fae95d2a60224b/gr7.sml gr7 gr7.sml sml 7662 94 219 IMAGE-THUMBNAIL 1-s2.0-S2468823123007551-gr3.sml https://s3-eu-west-1.amazonaws.com/prod-ucs-content-store-eu-west/content/pii:S2468823123007551/gr3/THUMBNAIL/image/gif/25f2577a663e8de768a324e32af12738/gr3.sml gr3 gr3.sml sml 11738 81 219 IMAGE-THUMBNAIL 1-s2.0-S2468823123007551-gr1.sml https://s3-eu-west-1.amazonaws.com/prod-ucs-content-store-eu-west/content/pii:S2468823123007551/gr1/THUMBNAIL/image/gif/0c429b4fe85593275b777c51ac7bd37a/gr1.sml gr1 gr1.sml sml 10860 73 219 IMAGE-THUMBNAIL 1-s2.0-S2468823123007551-gr2_lrg.jpg https://s3-eu-west-1.amazonaws.com/prod-ucs-content-store-eu-west/content/pii:S2468823123007551/HIGHRES/image/jpeg/3acbdbc482a7d6afff7c9004e6201a15/gr2_lrg.jpg gr2 gr2_lrg.jpg jpg 886117 2004 2917 IMAGE-HIGH-RES 1-s2.0-S2468823123007551-ga1_lrg.jpg https://s3-eu-west-1.amazonaws.com/prod-ucs-content-store-eu-west/content/pii:S2468823123007551/HIGHRES/image/jpeg/a68f420ddede960a08297b74fa793178/ga1_lrg.jpg ga1 true ga1_lrg.jpg jpg 294700 886 2151 IMAGE-HIGH-RES 1-s2.0-S2468823123007551-gr6_lrg.jpg https://s3-eu-west-1.amazonaws.com/prod-ucs-content-store-eu-west/content/pii:S2468823123007551/HIGHRES/image/jpeg/4bf46c9836e4988e377dbd7964e61376/gr6_lrg.jpg gr6 gr6_lrg.jpg jpg 732573 1259 3250 IMAGE-HIGH-RES 1-s2.0-S2468823123007551-gr5_lrg.jpg https://s3-eu-west-1.amazonaws.com/prod-ucs-content-store-eu-west/content/pii:S2468823123007551/HIGHRES/image/jpeg/bc05081a2dd59369a68ceb86dbeb5dfa/gr5_lrg.jpg gr5 gr5_lrg.jpg jpg 718144 1586 3250 IMAGE-HIGH-RES 1-s2.0-S2468823123007551-gr4_lrg.jpg https://s3-eu-west-1.amazonaws.com/prod-ucs-content-store-eu-west/content/pii:S2468823123007551/HIGHRES/image/jpeg/9b730ed1b4511505e2c49f346862c1b2/gr4_lrg.jpg gr4 gr4_lrg.jpg jpg 638115 1676 3167 IMAGE-HIGH-RES 1-s2.0-S2468823123007551-gr7_lrg.jpg https://s3-eu-west-1.amazonaws.com/prod-ucs-content-store-eu-west/content/pii:S2468823123007551/HIGHRES/image/jpeg/3f03a772d59a01e277f429cbd7d8eac2/gr7_lrg.jpg gr7 gr7_lrg.jpg jpg 281395 1256 2934 IMAGE-HIGH-RES 1-s2.0-S2468823123007551-gr3_lrg.jpg https://s3-eu-west-1.amazonaws.com/prod-ucs-content-store-eu-west/content/pii:S2468823123007551/HIGHRES/image/jpeg/9432f43cb85a13d8c369660d491a402e/gr3_lrg.jpg gr3 gr3_lrg.jpg jpg 650349 1236 3332 IMAGE-HIGH-RES 1-s2.0-S2468823123007551-gr1_lrg.jpg https://s3-eu-west-1.amazonaws.com/prod-ucs-content-store-eu-west/content/pii:S2468823123007551/HIGHRES/image/jpeg/94c3f0fed2fee4a9136f29cfc6f60537/gr1_lrg.jpg gr1 gr1_lrg.jpg jpg 588625 1057 3172 IMAGE-HIGH-RES 1-s2.0-S2468823123007551-mmc1.docx https://s3-eu-west-1.amazonaws.com/prod-ucs-content-store-eu-west/content/pii:S2468823123007551/mmc1/MAIN/application/vnd.openxmlformats-officedocument.wordprocessingml.document/8519d5e0349cb2ed9bac13607e136b9e/mmc1.docx mmc1 mmc1.docx docx 3192115 APPLICATION 1-s2.0-S2468823123007551-am.pdf https://s3-eu-west-1.amazonaws.com/prod-ucs-content-store-eu-west/content/egi:101SHN8P2ZT/MAIN/application/pdf/37aa82b69d1240f4d86585d4a37b86dd/am.pdf am am.pdf pdf false 1081300 AAM-PDF MCAT 113672 113672 S2468-8231(23)00755-1 10.1016/j.mcat.2023.113672 Elsevier B.V. Fig. 1 Catalyst structure and stability. (a) Mo2C-MoP(P1) model; (b) Mo2C-MoP(P2); (c) orbital changes of the heterojunction in HER and OER; (d) catalyst formation ability. Fig 1 Fig. 2 Catalyst stability test. (a) Stability test of Mo2C-MoP(P1) structure; (b) Phonon spectrum test of Mo2C-MoP(P1) structure;(c) Stability test of Mo2C-MoP(P2) structure; (d) Phonon spectrum test of Mo2C-MoP(P2) structure. Fig 2 Fig. 3 Hydrogen evolution performance of catalysts. (a) Schematic diagram of adsorption sites ((Ha) represents the end position of Mo, (Hb) represents the top of P, (Hc) represents the top position of Mo, (Hd) represents the bridge position of Mo, and (He) represents the end position of C); (b) free energy of hydrogen evolution at different sites. Fig 3 Fig. 4 Catalyst activity measures. (a) Catalyst acidic HER step diagram; (b) volcano curve of free energy versus current density; (c) original structure of Mo2C -MoP(P1) and Mo2C-MoP(P2) with d-band center after hydrogen evolution; (d) scalar relationship between d-band center and ΔGH; (e) p-band center of Mo2C-MoP(P1) with ΔGH; (f) p-band center of Mo2C-MoP(P2) with ΔGH; (g) p-band center of Mo2C-MoP(P2) with ΔGH. band center and ΔGH; (f) the scalar relationship between the p-band center of Mo2C -MoP(P2) and ΔGH. Fig 4 Fig. 5 OER reaction free energy. (a) MoP; (b) Mo2C -MoP(P1) (c) Mo2C -MoP(P2); (d) Schematic diagram of the OER reaction. Fig 5 Fig. 6 Variation of d-band center and p-band center of Mo2C -MoP(P2) adsorption intermediates. (a) Mo-4d(MoP); (b) Mo-4d(Mo2C); (c) P-2p; (d) C-2p. S1∼S4 are the four steps of OER occurrence respectively. Fig 6 Fig. 7 Scalar relationship of catalysts. (a) Scalar relationship of ΔG OH* with ΔG O* and ΔG OOH*; (b) Scalar relationship of work function with ΔG M*. Fig 7 Table 1 Catalyst lattice constants and electronic properties. Table 1 a(Å) b(Å) γ c(Å) Binding energy(eV) Work function (eV) Fermi energy(eV) Active mass (m0 ) mh me Mo2C 3.06 3.06 120° – – 3.96 −6.63 1.25 0.99 MoP 3.23 3.23 120° – – 3.84 −6.31 0.88 0.62 Mo2C-MoP(Mo1) 3.16 3.14 120° 3.37 −1.49 4.39 −9.67 0.48 1.96 Mo2C-MoP(Mo2) 3.17 3.18 120° 3.34 −0.91 4.49 −8.86 0.63 2.85 Mo2C-MoP(P1) 3.16 3.15 120° 3.27 −3.21 3.39 −8.87 0.45 0.54 Mo2C-MoP(P2) 3.14 3.16 120° 3.20 −4.16 3.33 −9.76 0.84 0.51 Design of Mo2C-MoP heterostructure hydrogen and oxygen evolution bifunctional catalyst based on first principles Zhiyu Liu Formal analysis a Hongbo Xie Formal analysis a Zeliang Wang Investigation Data curation Writing – original draft a Chun Wu Visualization a Yanshuai Li Formal analysis Validation Project administration a Hewei Zhao Supervision Writing – review & editing b Shizhi Dong Funding acquisition Conceptualization Supervision Writing – review & editing a b ⁎ a College of Materials Science and Engineering, Liaoning Technical University, Fuxin 123000, China College of Materials Science and Engineering Liaoning Technical University Fuxin 123000 China aCollege of Materials Science and Engineering, Liaoning Technical University, Fuxin 123000, China b School of Chemistry and Environment, Beihang University, Beijing 100191, China School of Chemistry and Environment Beihang University Beijing 100191 China bSchool of Chemistry and Environment, Beihang University, Beijing 100191, China ⁎ Corresponding author at: College of Materials Science and Engineering, Liaoning Technical University, Fuxin 123000, China. College of Materials Science and Engineering Liaoning Technical University Fuxin 123000 China A crucial step in resolving the energy crisis and achieving carbon neutrality is the design of bifunctional allolytic water catalysts with good hydrogen evolution reaction (HER) and oxygen evolution reaction (OER) capabilities because fuel cells are one of the crucial elements of future power systems and require good hydrogen and oxygen ends as fuel internally. In order to investigate the catalytic performance of Mo2C-MoP heterojunction bifunctional catalysts throughout the entire hydrolysis reaction, first-principles construction methods were used. It was discovered that Mo2C-MoP heterojunction catalysts have excellent hydrogen evolution effect under acidic environment through analysis and discussion of electronic properties, adsorption energy, and active sites, especially Mo2C-MoP(P1) and Mo2C-MoP(P2) models effectively adsorb hydrogen atoms near Mo2C with the best Gibbs free energy of 0.02 eV. After that, the Mo2C-MoP(P1) This paper demonstrates that the construction of heterostructured catalysts with different stacking methods has a broad research prospect in the field of fuel cells and provides new ideas for the design of new catalysts and green energy in the future. It provides new ideas for the future design of new catalysts and green energy sources. Graphical abstract Image, graphical abstract Keywords First principles Heterogeneous structure catalysts Hydrogen evolution reaction Oxygen evolution reaction DFT Data availability Data will be made available on request. 1 Introduction Today, non-renewable energy sources like oil, gas, coal, chemicals, liquefied petroleum gas, and others barely sustain the nation's economic growth and play a fundamental role in the reorganization of our country's energy system [1–3]. Hydrogen energy can be used anywhere in time or space and has the capacity to store energy for immediate use. The use of fossil fuels and environmental pollutants can be significantly reduced by the development of clean energy [4]. In the future, hydrogen and oxygen will play a significant energy role in the development and design of new energy vehicles and new energy mechanical devices. It is also one of the key energy carriers for fuel cells [5,6]. In other words, it is crucial for science that bifunctional electrocatalysts that can catalyze both hydrogen and oxygen evolution reactions are developed. Because platinum and palladium, which are currently used as catalysts in fuel cells, are pricey precious metals, creating inexpensive metal electrocatalysts is a crucial step toward the future energy transformation of the world [7]. Due to their comparatively low cost, plentiful supply, superior performance, and great stability in diverse electrolytes, transition metal compounds have drawn a lot of interest in the field of electrolytic hydrogen evolution. The activity and stability of catalysts are improved by the unique electrical structures and chemical characteristics of transition metal phosphides (TMPs) [8,9]. Molybdenum, cobalt, and nickel phosphides are often used phosphides with strong electrochemical activity for hydrogen evolution [10–13]. Researchers have improved the bulk phase materials of molybdenum phosphide (MoP), a highly conductive non-precious metal catalyst, in a variety of ways [14,15]. Common methods of modification include doping MoP with heteroatoms to change its internal electronic structure, altering the phase structure, and building MoP heterostructures to significantly increase its surface area, which will be useful in enhancing the catalytic activity of single-phase TMPs and exposing more active sites. Other common methods of modification include adding carbon substrates to MoP catalysts to increase electrical conductivity [16–19]. The good internal electric field-limited catalysis and intricate effects of the heterostructure design in this case make it of tremendous scientific interest. The heterostructure can increase the accessibility of the active sites, improve the compatibility of the electrolytes, and speed up the interfacial charge transfer, which will change the adsorption/desorption energies of the reactive species and favor changing the behavior of the electrocatalytic process [20]. The prepared catalysts not only displayed low overpotentials (71 mV and 125 V for 1.0 M KOH and 0.5 M H2SO4, respectively) at a current density of 10 mA cm−2, but also displayed excellent stability in the HER process. These results were obtained by Yiting Xu et al. [19] using a one-step hollow-limited pyrolysis strategy. Excellent electrocatalytic heterostructures have also been created, serving as powerful examples of how heterostructures can improve the electrocatalytic process, including MoP-MoS2 [21], MoP@MoSe2/SnP2O7 [22], MoP/Ni2P [23], and MoP/graphene [24]. Additionally, the near co-lattice of crystals and similar lattice constants make it easier to synthesize biphasic Mo-based transition chemicals [18,19,22]. In addition to the MoP-MoS2 heterostructure electrocatalysts mentioned above, research has also been done on MoP-MoO2 [25], MoP-Mo2N [26], Mo2C-Mo2N [27], MoP-Mo2C [28], and other heterostructures, which offer promising catalytic potential. Using polymer cleavage, Honggang Fu et al. [26] created porous MoP/Mo2N heterojunction nanosheets with good hydrogen evolution activity. In order to demonstrate how chelation and synergistic effects greatly improve the performance of electrolytic water, Jinliang Zhu [28] created a heterogeneous structure of MoP-Mo2C quantum dots that were uniformly distributed on a three-dimensional layered porous carbon fabric. Because the d-band of molybdenum carbide is widened by the overlap of the molybdenum 4d orbital with the carbon 2p orbital in Mo2C, it may be inferred that Mo2C has a d-band electronic structure similar to that of the precious metal platinum (Pt) [29].Although many molybdenum-based structures are being investigated for their HER performance, there is little research on the use of OER, and the research on molybdenum-based compound electrocatalysts is still in the preliminary stages without ideal preparation pathways and theoretical guidance. Based on this, we report a MoP-Mo2C heterojunction electrocatalyst, which achieves bifocal catalytic effect beyond Pt-like precious metals with the help of Mo2C in MoP structure. Through the growth of heterostructures, the heterogeneous electrocatalysts with different stacking methods are described in detail at the atomic level through theoretical calculation. The relationship between orbital state density, reaction free energy and catalytic scale was analyzed to clarify the catalytic effect of HER and OER, and the structural basis of the existing experimental synthesis was pointed out, and then the synthesis method was simplified, hoping to provide design ideas and basis for the design of molybdenum based electrocatalysts. 2 Calculation method In this study, the CASTEP module of the Materials Studio quantum computing program is used to calculate the pertinent electronic characteristics. The truncation energy is assumed to be 450 eV [30] when calculating the exchange correlation energy using the Perdew-Burke-Ernzerhof (PBE) generalization function under the generalized gradient approximation (GGA). We found that MoP (001) and Mo2C (001) surfaces have strong catalytic activity and can be well manufactured experimentally based on literature investigations, these two crystal faces are used for subsequent stacking and are shortened as MoP [31,32] and Mo2C [33]. The Brillouin zone K-point grid is selected as 7 × 7 × 1 for the structural optimization of the built catalyst model. The grid of K points in the Brillouin zone is chosen as 9 × 9 × 1 for the energy band computation. The K-point of type MonkhorstPack used for the density of states computation is 12 × 12 × 1 [34]. by using the DFT-D approach for weak van der Waals force correction and taking into consideration the strong Coulomb exchange contact between the electrons in the d-energy level of the transition metal [35]. In order to prevent mutual interference of the periodic arrangement and eliminate the interaction forces of the atoms between the layers, the thickness of the vacuum layer is selected to be 20 Å. This allows for the calculation of the electronic structure analysis using the OTFG ultra-soft pseudopotential. After the force and energy criteria exceed 0.1 eV/ and 10−6 eV criterion, respectively, and the maximum displacement tolerance is reached, the geometric structure's optimization is stopped. When the maximum allowed tolerance for displacement is 0.01 Å, the calculation is terminated. At this point, the system's overall energy is also at its lowest, ensuring that the constructed model is more closely related to the crystal's true structure. The dielectric constant is set at 78.54 [36] for the H2O solvent. The NVT system synthesis with a total step size of 5 Ps and a total number of 1500 steps [37] is used to test the computational stability. Other performance calculation methods and guidelines are presented in the accompanying data, and the phonon spectrum of the structure is also calculated to make sure that no spurious frequencies exist in the structure [38]. 3 Results and discussion 3.1 A description of the MoP-Mo2C heterostructure's stability Based on their structural characteristics, MoP and Mo2C are divided into four different types of heterostructures, which are referred to as Mo2C-MoP(Mo1), Mo2C-MoP(Mo2), Mo2C-MoP(P1), and Mo2C-MoP(P2), respectively. The layer spacing of heterojunctions is tested, as shown in Fig. S8, and it is found that the layer spacing of the four models is stable at about 2.81 Å, which belongs to the vdws heterojunctions [39,40]. These heterostructures form when molybdenum phosphide P end faces and Mo end faces are exposed on the surface when heterostructures are formed. The adsorption of water on the surface is investigated, and the dissociation process is employed to improve the HER and OER processes with heterostructural synergy, as shown in Fig. 1 (c) [41]. This is accomplished by the C and P 2p orbitals synergistically encouraging d-band modifications. In Table 1 , the lattice parameters of the original Mo2C and MoP structures as well as the heterostructures under various stacks are listed. The overall fitness is within 5 %, indicating that the heterostructures were successfully constructed, that little to no lattice distortion resulted from optimization, and that the catalysts exhibit good structural activity. The system is more stable when molybdenum carbide is coupled with the P-terminus of the layer because all of the catalysts' binding energies are negative. The catalysts' predicted formation energy, cohesion energy, and solubility potential are displayed in Fig. 1(c) and are taken from the supporting data [42–44]. The triangle in the figure indicates that the catalyst can exist steadily and that the metal is not easily dissolved, and the closer it is to the boundary, the more strongly it expresses this according to the various performance rules. As can be shown in Table S1, the built-in catalyst system still has potential stability from a thermodynamic perspective. Once more, it is clear that the Mo2C-MoP(P1) and Mo2C-MoP(P2) models have the best potential for stability. For the aforementioned stable Mo2C-MoP(P1) and Mo2C-MoP(P2) models, the results of kinetic stability tests, molecular dynamics, and phonon spectroscopy are shown in Fig. 2 . The temperature and energy iterations of the system vary and converge clearly in the ab initio molecular dynamics tests (Fig. 2(a) and 2(c)), with the energy iterations convergent at −66,525.257 eV and −66,525.260 eV, respectively. The energy swings are all within 0.002 eV, demonstrating the stability of the system. Furthermore, its dynamics stays stable, and the phonon spectra in Fig. 2(b) and (d) reveal good atomic vibrational frequencies without spurious frequencies. In Table 1, it is examined how the intrinsic transport properties of electrons vary in heterogeneous structures while taking into account their work function and effective mass of carriers. In order to effectively excite surface electrons at lower external energies, where the magnitude of the work function reflects this performance, catalysts have a special aptitude for electron excitation. the Mo2C-MoP(P1) and the Mo2C-MoP(P2) A higher quality of electron leap qualities, which can help with the HER reaction, are reflected in the catalyst's work function, which is lower than that of MoP (3.84 eV). The heterostructures Mo2C-MoP(P1) and Mo2C-MoP(P2) have effective electron and hole masses that are lower than those of MoP, falling from 0.88mh to 0.45me and from 0.62mh to −0.51me , respectively.These findings show that the insertion of Mo2C structures significantly lowers the effective electron and hole masses. Especially with the increased contribution of the effective mass of electrons, this will aid in enhancing carrier mobility. 3.2 MoP-Mo2C heterogeneous structure HER analysis HER activity of several catalyst models was examined once the stability was established, and the hydrogen evolution Gibbs free energy (ΔGH) was frequently utilized as a criterion to investigate the catalyst activity [45]. The \"Sabatier\" theory states that the adsorbed intermediates' adsorption energy shouldn't be either too strong or too weak because doing so will weaken or strengthen the bonding of the outer electrons, which is bad for the development of good electron interactions and directional transport of the adsorbent on the catalyst surface [46]. The heterostructure's layers contain an area of domain-limited catalysis that is crucial for boosting the catalytic activity [47]. To investigate the practical proton H adsorption sites, five adsorption sites between the layers of the developed heterostructure catalysts were designed. The schematic diagram of the hydrogen evolution sites is shown in Fig. 3 (a). The results of hydrogen evolution free energy are shown in Fig. 3(b) and Table S2, and the two black lines reflect, respectively, ΔGH of 0.2 and −0.2 eV in the area of this location, showing substantial HER activity. First, it is discovered that H adsorption on Mo2C-MoP(P1) and Mo2C-MoP(P2) heterostructures has a Pt-like adsorption capability [48]. It is demonstrated that the P will effectively increase the interlayer electron activity and accelerate the effective migration of electrons into holes in the heterostructure layer. Additionally, the greater HER activity of the adsorbed proton H at the Hd and He positions indicates that the inner surface of Mo2C, particularly at the bridge position (Hd) of Mo atoms, is a favorable location for hydrogen evolution. We are aware that the hydrogen free energy (ΔGH) of Mo2C alone is 1.13 eV, and that after heterojunction has formed, the synergy of MoP activates the active basal plane of Mo2C, which is quite useful for maximizing the reaction activity of Mo-based catalysts. The HER step diagrams of the Mo2C-MoP(P1) and Mo2C-MoP(P2) heterostructures at the Hd and He points are shown in Fig. 4 (a), which follows the investigation of the HER correlation. Fig. 4(b) shows that the catalysts fit the current density-ΔGH volcano curve relationship well, and the catalysts at the top of the volcano curve have outstanding catalytic effect [49]. Due to its excellent electrical conductivity, it has promise for a variety of electrocatalysis applications. The electron orbitals of all Mo2C-MoP catalyst configurations span the Fermi energy level, He is subject to H + adsorption, and all of the catalysts are metalloid following Hd (Figs. S2–S4). The interfacial transport electrons seem to be polarized after the addition of Mo2C, which improves the charge-hole transport separation and significantly boosts the catalytic action. The P-2p and Mo-4d orbital electrons jointly contribute to H-1 s orbitals close to the Fermi energy level, and the HER is made possible by the high electron concentration and ΔGH. Off-domain behavior results from the simultaneous hybridization of the C atom's electronic states with the occupied and unoccupied states of the Mo and P atoms. It is generally known that the d-band center can be utilized to describe the intensity of the interactions between catalysts and adsorbates on various surfaces. While d-band centers that are too distant from the Fermi energy level do not allow for the participation of d-orbital electrons in the reaction, they do promote the adsorption of small molecules on the surface and are more prone to catalyst poisoning [50]. The catalyst's altered d-band center is depicted in Fig. 4(c) following the initial state and hydrogen evolution. The d-band center of Mo changes in the He site of the Mo2C-MoP(P1) structure from −5.22 eV to −4.09 eV. The d-band center of Mo moves from −4.82 eV to −3.99 eV in the He site of the Mo2C-MoP(P2) structure, typically rising. Although the Hd site also has a comparable pattern, the d-band center is considerably closer to the Fermi energy level, which raises questions about the metal's stability and adsorption-dissociation efficiency. This further highlights the superior H + capture and reduction capabilities of the Hd, He sites. The efficient acceleration of the electron transport, the lowering of the catalytic energy barrier, and the increase in catalytic activity caused by the strong contact between MoP and Mo2C were all validated. Additionally, following the development of the heterostructure, there is a notable increase in orbital dispersion towards the Fermi energy level, an indication that the catalytic activity has been improved. With coefficients of determination (R2) of 0.91 and 0.84, it is clear from Fig. 4(d) that there is a considerable linear relationship between the Gibbs free energies of Mo2C-MoP(P1) and Mo2C-MoP(P2) and the molybdenum d-band center. The ΔGH of Mo2C-MoP(P1) and Mo2C-MoP(P2) has a stronger linear connection with the P-band center of P, C, as shown in Fig. 4(e), (f). The scalar relationship between catalyst ΔGH and d-band center and p-band center illustrates, to some extent, the prediction of catalyst ΔGH by transition metal element d-band center and non-metallic element p-band centers, thereby predicting catalyst hydrogen evolution performance and providing recommendations for future catalyst design. When heterostructured catalysts are built, the surface electronic states change, which causes the outer orbitals eg and t2g to reorganize and realign with the orbital center positions and active adsorption energy. This has research implications, and in order to better understand fundamental catalysis, more work and more precise calculation techniques should be put into developing the normative system of heterostructure-electron structure-catalytic activity. The combination of differential charge density and Mulliken charge analysis is the most logical technique to monitor the migration of electrons in electrocatalysts; the specifics are illustrated in Figs. S5–S6, where blue denotes a high electron concentration and red, a low electron concentration. In catalysts with the heterostructure Mo2C-MoP(P1), electrons move from Mo atoms to P atoms. First off, it can make the Mo-P chemical bonding more stable. Secondly, the superior electron transport properties offer a strong foundation for the development of HER. A buildup of electrons near the Mo atom at the Mo2C-MoP interface is visible in the Mo2C-MoP(P2) heterostructured catalyst (Fig.S6), and the resulting electric dipole moment results in improved interfacial bonding. After hydrogenolysis, there was a redistribution of charge, with electrons traveling between the HC and H-Mo chemical bonds in turn, enhancing the HER activity. 3.3 OER analysis of the MoP-Mo2C heterostructure The development of a bifunctional heterogeneous structured allolytic water catalyst is strongly supported by the discovery that the performance pattern of the heterogeneous structured acidic OER primarily occurs in the interlayer don't favor the P-atom side in the adsorption conformation of different intermediates (Fig.S7) and the adsorption site is different from the HER active site without competition [51]. The OH* desorption to O* step, which has the highest free energy change (1.67 eV), is the MoP-controlled reaction rate step, as demonstrated by the specific OER reaction step free energy in Fig. 5 . It is noteworthy that the free energy of the Mo2C /MoP system falls to 2.31 eV vs. 2.34 eV when the reaction reaches this stage (see Fig. 5(c), (d)), it is closer to the theoretical potential of 2.46 eV, indicating that the electronic characteristics of Mo2C, similar to Pt, can adjust the adsorption energy of H2O to facilitate the formation of OOH*, making the steps more balanced and the energy barrier shared by each step more average, so that the high energy barrier value is not only divided into one step, resulting in this step is difficult to occur. Combined with the change of state density in Fig. 6 , it is found that before and after H2O, p-d orbital overlap first increases and then decreases, indicating that the aggregation and dispersion of electron transformation states before and after adsorption affect the change of chemical bond before and after adsorption, and the optimal η value obtained is 0.36 eV, which is also easy to occur for secondary H2O.High ΔG intermediates invariably adsorb to the substrate, reducing the substrate's catalytic activity and making future reactions more challenging. This shows that the Mo2C/MoP heterostructure is dramatically stabilized and the overpotential is significantly reduced by the critical speed step in the desorption of OH* to O* on Mo2C /MoP. Additionally, it confirms the earlier finding from OER experiments that Mo2C plays a role in preventing Mo2+ from oxidizing and stabilizing the O* radical by forming a heterostructure on MoP. The bifunctional catalyst we created has stronger electrocatalytic benefits when compared to the OER activity of previous molybdenum-based borides and carbides [52,53]. The adverse effects of producing hydrogen peroxide were taken into account in addition to OER [54]. However, we discovered that the desire to produce hydrogen peroxide from O* with H2O in an acidic environment requires considerable energy to overcome, which is considerably more than the desire to produce OOH* with H, which shows that the hydrogen peroxide side reaction is difficult to occur. As a result, this chemical route for producing hydrogen peroxide was disregarded. The Mo2C-MoP(P2) bifunctional catalyst with excellent OER activity's orbital modifications during the reaction were examined (Fig. 6). While the Mo and C carrier contributions in Mo2C are primarily present in the conduction band region, the Mo and P carrier contributions in MoP are primarily present in the valence band region. This denotes the separation of electrons and holes on the catalyst's active surface, generating carrier-directed transport, which improves the catalyst's capacity for charge transfer and speeds up the reaction. The bond-breaking dissociation of H2O adsorbed on the surface into OH* and H + as well as deprotonation into O*, on the other hand, are aided by the first and second steps of Mo with large d and the downward shift of the antibond energy level. Combined with Fig. 5, it can also be seen that although the free energy of P2 adsorbed H2O to form OH− is slightly larger, it ensures the balance of the overall reaction, and εd changes significantly in the reaction, reflecting a good charge redistribution between the intermediate state and the catalyst surface, without excessive adsorption and dissociation. After then, the antibond energy band moves northward and the molecular weight of Mo falls noticeably, which makes it easier to trap water on the catalyst surface to produce OOH*. And once more, the drop in d makes O2 easily detach from the catalyst surface. Additionally, the d and p orbits are significantly lower in comparison to Mo2C, demonstrating that the active site of the reaction is mostly on the Mo of MoP, whereas Mo2C primarily functions to stabilize the structure and transport charge. This offers a solid argument in favor of designing bifunctional catalysts. Further discussion is provided on the scalar link between catalyst free energy and characteristic characteristics(Fig. 7 ). We used information from earlier research to create a linear relationship with our created electrocatalysts in order to confirm that Mo-based electrocatalysts had similar OER activity laws [52,53,55]. With a coefficient of determination (R2) of 0.95, GOOH* is represented as ΔG OOH* = 1.52ΔG OH*+2, whereas ΔGO* is represented as ΔG O* = −0.77ΔG OH* + 3.69, with R2 of 0.81. According to the slopes of OOH* and OH* and O* and OH*, which are 1.52 and 0.77, respectively, O* forms double bonds with metal atoms whereas OH* and OOH* create single bonds with them. These high R2 values imply that catalysts with strong OH* binding may also have strong OOH* and O* binding as well as substantial correlation. The scalar relationship between the free energy of adsorption of MoP, Mo2C-MoP(P1), and Mo2C-MoP(P2) intermediates with an applied voltage of 1.23 V and their work function was plotted, with an R2 of 0.91, while the work function can be expressed as W F=−0.15ΔG M*+3.45. As can be seen, the work function and free energy have a strong correlation, and the adsorption intermediate's work function, which is typically around 3.45 eV, is more likely to have a smaller energy change and increase the likelihood of OER steps, which is a good confirmation of Jun Hu's work correlating the work function with HER [56]. The aforementioned linear relationship not only supports the similarity of molybdenum-based catalysts, but it can also be used to efficiently direct catalyst design. 4 Conclusion Few electrocatalysts are able to attain high activity of both HER and OER in the same media due to weak conductivity and severe circumstances in strongly acidic media, which causes excessive overpotential in electrocatalysis to lead to corrosion, agglomeration, or oxidation. Here, using the first-nature principle, we constructed Mo2C/MoP heterojunction catalysts with four stacking orientations and computed their bifunctional catalytic performance for HER and OER. With a maximal overpotential for OER of 0.36 eV and a hydrogen evolution free energy of 0.02 eV, respectively, Mo2C-MoP(P2) is capable of quick HER and OER processes on the Mo2C and MoP surfaces. Additionally, the scalar relationship between the work function and reaction free energy can better direct the creation of superior transition metal electrocatalysts. The creation of heterostructured catalysts using various stacking techniques is shown to have a wide range of research prospects in the field of PEMFC and offers fresh concepts for the design of novel catalysts and green energy in the future. CRediT authorship contribution statement Zhiyu Liu: Formal analysis. Hongbo Xie: Formal analysis. Zeliang Wang: Investigation, Data curation, Writing – original draft. Chun Wu: Visualization. Yanshuai Li: Formal analysis, Validation, Project administration. Hewei Zhao: Supervision, Writing – review & editing. Shizhi Dong: Funding acquisition, Conceptualization, Supervision, Writing – review & editing. Declaration of Competing Interest The authors declare that No conflict of interest exists in the submission of this manuscript, and manuscript is approved by all authors for publication. Acknowledgements This article is supported by the National Natural Science Foundation (52102360) and the China Postdoctoral Science Foundation (Grant No. 2023M732392). The authors would like to thank Shiyanjia Lab(www.shiyanjia.com) for the support of test resource. Besides, the authors would like to thank Key Laboratory of Mineral High Value Conversion and Energy Storage Materials of Liaoning Province for the support of computing resource. Supplementary materials Supplementary material associated with this article can be found, in the online version, at doi:10.1016/j.mcat.2023.113672. Appendix Supplementary materials Image, application 1 References [1] V. Buyanov BP: statistical review of world energy 2011 Econ. Policy 4 2011 38 55 Buyanov, V. (2011). BP: statistical review of world energy 2011. Econ. Policy, 4, 38–55. [2] J. Liu H. Mooney V. Hull S.J. Davis J. Gaskell T. Hertel S. Li Systems integration for global sustainability Science 347 6225 2015 1258832 Liu, J., Mooney, H., Hull, V., Davis, S.J., Gaskell, J., Hertel, T., & Li, S. (2015). Systems integration for global sustainability. Science, 347(6225), 1258832. [3] J. Shi H. He Y. Guo F. Ji J. Li Y. Zhang W. Cai Enabling high-efficiency ethanol oxidation on NiFe-LDH via deprotonation promotion and absorption inhibition J. Energy Chem. 85 2023 76 82 Shi, J., He, H., Guo, Y., Ji, F., Li, J., Zhang, Y., & Cai, W. (2023). Enabling high-efficiency ethanol oxidation on NiFe-LDH via deprotonation promotion and absorption inhibition. J. Energy Chem., 85, 76–82. [4] A. Mosnier G. Schmidt-Traub M. Obersteiner S. Jones V. Javalera-Rincon F. DeClerck X. Wang How can diverse national food and land-use priorities be reconciled with global sustainability targets? Lessons from the FABLE initiative Sustain. Sci. 18 1 2023 335 345 Mosnier, A., Schmidt-Traub, G., Obersteiner, M., Jones, S., Javalera-Rincon, V., DeClerck, F., & Wang, X. (2023). How can diverse national food and land-use priorities be reconciled with global sustainability targets? Lessons from the FABLE initiative. Sustain. Sci., 18(1), 335–345. [5] Y. Yurko L. Elbaz Direct quinone fuel cells J. Am. Chem. Soc. 2023 Yurko, Y., & Elbaz, L. (2023). Direct quinone fuel cells. J. Am. Chem. Soc.. [6] J. Li Z. Guo W. Zhang J. Guo K. Qu W. Cai Stable NiPt-Mo2C active site pairs enable boosted water splitting and direct methanol fuel cell Green Energy Environ. 8 2 2021 559 566 2021 Li, J., Guo, Z., Zhang, W., Guo, J., Qu, K., & Cai, W. (2021). Stable NiPt-Mo2C active site pairs enable boosted water splitting and direct methanol fuel cell. Green Energy Environ., 2021, 8(2): 559–566. [7] A. Tahir F. Arshad T.U. Haq I. Hussain S.Z. Hussain H.U. Rehman Roles of metal oxide nanostructure-based substrates in sustainable electrochemical water splitting: recent development and future perspective ACS Appl. Nano Mater. 6 3 2023 1631 1647 Tahir, A., Arshad, F., Haq, T.U., Hussain, I., Hussain, S.Z., & Rehman, H.U. (2023). Roles of metal oxide nanostructure-based substrates in sustainable electrochemical water splitting: recent development and future perspective. ACS Appl. Nano Mater., 6(3), 1631–1647. [8] D. Liu G. Xu H. Yang H. Wang B.Y. Xia Rational design of transition metal phosphide-based electrocatalysts for hydrogen evolution Adv. Funct. Mater. 33 7 2023 2208358 Liu, D., Xu, G., Yang, H., Wang, H., & Xia, B.Y. (2023). Rational design of transition metal phosphide-based electrocatalysts for hydrogen evolution. Adv. Funct. Mater., 33(7), 2208358. [9] K. Bhunia M. Chandra S.K. Sharma D. Pradhan S.J. Kim A critical review on transition metal phosphide based catalyst for electrochemical hydrogen evolution reaction: gibbs free energy, composition, stability, and true identity of active site Coord. Chem. Rev. 478 2023 214956 Bhunia, K., Chandra, M., Sharma, S.K., Pradhan, D., & Kim, S.J. (2023). A critical review on transition metal phosphide based catalyst for electrochemical hydrogen evolution reaction: gibbs free energy, composition, stability, and true identity of active site. Coord. Chem. Rev., 478, 214956. [10] Z. Zhang X. Lin S. Tang H. Xie Q. Huang Self-supported system of MoO2@Ni2P heterostructures as an efficient electrocatalyst for hydrogen evolution reactions in alkaline media J. Colloid Interface Sci. 630 2023 494 501 Zhang, Z., Lin, X., Tang, S., Xie, H., & Huang, Q. (2023). Self-supported system of MoO2@Ni2P heterostructures as an efficient electrocatalyst for hydrogen evolution reactions in alkaline media. J. Colloid Interface Sci., 630, 494–501. [11] D. Xu Z. Kang H. Zhao Y. Ji W. Yao D. Ye J. Zhang Coupling heterostructured CoP-NiCoP nanopin arrays with MXene (Ti3C2Tx) as an efficient bifunctional electrocatalyst for overall water splitting J. Colloid Interface Sci. 639 2023 223 232 Xu, D., Kang, Z., Zhao, H., Ji, Y., Yao, W., Ye, D., & Zhang, J. (2023). Coupling heterostructured CoP-NiCoP nanopin arrays with MXene (Ti3C2Tx) as an efficient bifunctional electrocatalyst for overall water splitting. J. Colloid Interface Sci., 639, 223–232. [12] H. Zeng L. Stewart-Yates L.M. Casey N. Bampos D.A. Roberts Covalent post-assembly modification: a synthetic multipurpose tool in supramolecular chemistry Chempluschem 85 6 2020 1249 1269 Zeng, H., Stewart-Yates, L., Casey, L.M., Bampos, N., & Roberts, D.A. (2020). Covalent post-assembly modification: a synthetic multipurpose tool in supramolecular chemistry. Chempluschem, 85(6), 1249–1269. [13] S. Zhou Y. Liu J. Li J. Shi L. Fan W. Cai Surface-neutralization engineered NiCo-LDH/phosphate hetero-SHEETS toward robust oxygen evolution reaction Green Energy Environ. 2023 Zhou, S., Liu, Y., Li, J., Shi, J., Fan, L., & Cai, W. (2023). Surface-neutralization engineered NiCo-LDH/phosphate hetero-SHEETS toward robust oxygen evolution reaction. Green Energy Environ.. [14] M. Han G. Wang H. Zhang H. Zhao Theoretical study of single transition metal atom modified MoP as a nitrogen reduction electrocatalyst Phys. Chem. Chem. Phys. 21 11 2019 5950 5955 Han, M., Wang, G., Zhang, H., & Zhao, H. (2019). Theoretical study of single transition metal atom modified MoP as a nitrogen reduction electrocatalyst. Phys. Chem. Chem. Phys., 21(11), 5950–5955. [15] X. Wang X. Wang W. Tian A. Meng Z. Li S. Li G. Li High-energy ball-milling constructing P-doped g-C3N4/MoP heterojunction with MoN bond bridged interface and Schottky barrier for enhanced photocatalytic H2 evolution Appl. Catal. B 303 2022 120933 Wang, X., Wang, X., Tian, W., Meng, A., Li, Z., Li, S., & Li, G. (2022). High-energy ball-milling constructing P-doped g-C3N4/MoP heterojunction with MoN bond bridged interface and Schottky barrier for enhanced photocatalytic H2 evolution. Appl. Catal. B, 303, 120933. [16] C. Li W. Hong Q. Cai C. Jian Directional construction of a 1T0.63-MoSe2@MoP multiphase-interface catalyst for highly efficient alkaline hydrogen evolution ACS Appl. Mater. Interfaces 14 27 2022 30683 30691 Li, C., Hong, W., Cai, Q., & Jian, C. (2022). Directional construction of a 1T0.63-MoSe2@MoP multiphase-interface catalyst for highly efficient alkaline hydrogen evolution. ACS Appl. Mater. Interfaces, 14(27), 30683–30691. [17] X. Wang N. Deng Y. Liu L. Wei H. Wang Y. Li W. Kang Porous and heterostructured molybdenum-based phosphide and oxide nanobelts assisted by the structural engineering to enhance polysulfide anchoring and conversion for lithium–sulfur batteries Chem. Eng. J. 450 2022 138191 Wang, X., Deng, N., Liu, Y., Wei, L., Wang, H., Li, Y., & Kang, W. (2022). Porous and heterostructured molybdenum-based phosphide and oxide nanobelts assisted by the structural engineering to enhance polysulfide anchoring and conversion for lithium–sulfur batteries. Chem. Eng. J., 450, 138191. [18] J. Jiang X. Wang X. Liang J. Zhang L. Ai Superwetting molybdenum-based sulfide/phosphide heterostructures for efficient water electrolysis and solar thermoelectricity self-powered hydrogen production Appl. Surf. Sci. 2023 157482 Jiang, J., Wang, X., Liang, X., Zhang, J., & Ai, L. (2023). Superwetting molybdenum-based sulfide/phosphide heterostructures for efficient water electrolysis and solar thermoelectricity self-powered hydrogen production. Appl. Surf. Sci., 157482. [19] X. Wang J. Dai H. Xie C. Yang L. He T. Wu L. Dai In-situ construction of ultrathin MoP-MoS2 heterostructure on N, P and S co-doped hollow carbon spheres as nanoreactor for efficient hydrogen evolution Chem. Eng. J. 438 2022 135544 Wang, X., Dai, J., Xie, H., Yang, C., He, L., Wu, T., & Dai, L. (2022). In-situ construction of ultrathin MoP-MoS2 heterostructure on N, P and S co-doped hollow carbon spheres as nanoreactor for efficient hydrogen evolution. Chem. Eng. J., 438, 135544. [20] A. Wu Y. Xie H. Ma C. Tian Y. Gu H. Yan H. Fu Integrating the active OER and HER components as the heterostructures for the efficient overall water splitting Nano Energy 44 2018 353 363 Wu, A., Xie, Y., Ma, H., Tian, C., Gu, Y., Yan, H., & Fu, H. (2018). Integrating the active OER and HER components as the heterostructures for the efficient overall water splitting. Nano Energy, 44, 353–363. [21] A. Wu Y. Gu Y. Xie C. Tian H. Yan D. Wang H. Fu Effective electrocatalytic hydrogen evolution in neutral medium based on 2D MoP/MoS2 heterostructure nanosheets ACS Appl. Mater. Interfaces 11 29 2019 25986 25995 Wu, A., Gu, Y., Xie, Y., Tian, C., Yan, H., Wang, D., & Fu, H. (2019). Effective electrocatalytic hydrogen evolution in neutral medium based on 2D MoP/MoS2 heterostructure nanosheets. ACS Appl. Mater. Interfaces, 11(29), 25986–25995. [22] Z. Liu H. Zhang S. Zhang S. Li H. Shao Z. Li Precise surface selenizing modulation for amorphous MoP@MoSe2/SnP2O7 hierarchical nanofibers as sodium ion battery anode Appl. Surf. Sci. 2023 157508 Liu, Z., Zhang, H., Zhang, S., Li, S., Shao, H., & Li, Z. (2023). Precise surface selenizing modulation for amorphous MoP@MoSe2/SnP2O7 hierarchical nanofibers as sodium ion battery anode. Appl. Surf. Sci., 157508. [23] C. Du M. Shang J. Mao W. Song Hierarchical MoP/Ni2P heterostructures on nickel foam for efficient water splitting J. Mater. Chem. A 5 30 2017 15940 15949 Du, C., Shang, M., Mao, J., & Song, W. (2017). Hierarchical MoP/Ni2P heterostructures on nickel foam for efficient water splitting. J. Mater. Chem. A, 5(30), 15940–15949. [24] L. Zhang W. Xiao Y. Zhang F. Han X. Yang Nanocarbon encapsulating Ni-doped MoP/graphene composites for highly improved electrocatalytic hydrogen evolution reaction Compos. Commun. 26 2021 100792 Zhang, L., Xiao, W., Zhang, Y., Han, F., & Yang, X. (2021). Nanocarbon encapsulating Ni-doped MoP/graphene composites for highly improved electrocatalytic hydrogen evolution reaction. Compos. Commun., 26, 100792. [25] D. Wang Q. Duan Z. Wu Facile synthesis of MoP/MoO2 heterostructures for efficient hydrogen generation Mater. Lett. 241 2019 227 230 Wang, D., Duan, Q., & Wu, Z. (2019). Facile synthesis of MoP/MoO2 heterostructures for efficient hydrogen generation. Mater. Lett., 241, 227–230. [26] Y. Gu A. Wu Y. Jiao H. Zheng X. Wang Y. Xie H. Fu Two-dimensional porous molybdenum phosphide/nitride heterojunction nanosheets for pH-universal hydrogen evolution reaction Angew. Chem. Int. Ed. 60 12 2021 6673 6681 Gu, Y., Wu, A., Jiao, Y., Zheng, H., Wang, X., Xie, Y., & Fu, H. (2021). Two-dimensional porous molybdenum phosphide/nitride heterojunction nanosheets for pH-universal hydrogen evolution reaction. Angew. Chem. Int. Ed., 60(12), 6673–6681. [27] H. Song S. Guo X. Zhang Y. Yang B. Gao Y. Pi K. Huo In-Situ and controllable construction of Mo2N embedded Mo2C nanobelts as robust electrocatalyst for superior pH-universal hydrogen evolution reaction J. Alloys Compd. 918 2022 165611 Song, H., Guo, S., Zhang, X., Yang, Y., Gao, B., Pi, Y., & Huo, K. (2022). In-Situ and controllable construction of Mo2N embedded Mo2C nanobelts as robust electrocatalyst for superior pH-universal hydrogen evolution reaction. J. Alloys Compd., 918, 165611. [28] E. Jiang J. Li X. Li A. Ali G. Wang S. Ma J. Zhu MoP-Mo2C quantum dot heterostructures uniformly hosted on a heteroatom-doped 3D porous carbon sheet network as an efficient bifunctional electrocatalyst for overall water splitting Chem. Eng. J. 431 2022 133719 Jiang, E., Li, J., Li, X., Ali, A., Wang, G., Ma, S., & Zhu, J. (2022). MoP-Mo2C quantum dot heterostructures uniformly hosted on a heteroatom-doped 3D porous carbon sheet network as an efficient bifunctional electrocatalyst for overall water splitting. Chem. Eng. J., 431, 133719. [29] J. Wu J. Su T. Wu L. Huang Q. Li Y. Luo Y. Li Scalable synthesis of 2D Mo2C and thickness-dependent hydrogen evolution on its basal plane and edges Adv. Mater. 2023 2209954 Wu, J., Su, J., Wu, T., Huang, L., Li, Q., Luo, Y., & Li, Y. (2023). Scalable synthesis of 2D Mo2C and thickness-dependent hydrogen evolution on its basal plane and edges. Adv. Mater., 2209954. [30] J.P. Perdew K. Burke M. Ernzerhof Generalized gradient approximation made simple Phys. Rev. Lett. 77 18 1996 3865 Perdew, J.P., Burke, K., & Ernzerhof, M. (1996). Generalized gradient approximation made simple. Phys. Rev. Lett., 77(18), 3865. [31] H. Ma W. Yan Y. Yu L. Deng Z. Hong L. Song L. Li Phosphorus vacancies improve the hydrogen evolution of MoP electrocatalysts Nanoscale 2023 Ma, H., Yan, W., Yu, Y., Deng, L., Hong, Z., Song, L., & Li, L. (2023). Phosphorus vacancies improve the hydrogen evolution of MoP electrocatalysts. Nanoscale. [32] H.J. Han S. Kumar G. Jin X. Ji J.L. Hart D.J. Hynek J.J. Cha Topological metal MoP nanowire for interconnect Adv. Mater. 35 13 2023 2208965 Han, H.J., Kumar, S., Jin, G., Ji, X., Hart, J.L., Hynek, D.J., & Cha, J.J. (2023). Topological metal MoP nanowire for interconnect. Adv. Mater., 35(13), 2208965. [33] B. Deng Z. Wang W. Chen J.T. Li D.X. Luong R.A. Carter J.M. Tour Phase controlled synthesis of transition metal carbide nanocrystals by ultrafast flash Joule heating Nat. Commun. 13 1 2022 262 Deng, B., Wang, Z., Chen, W., Li, J.T., Luong, D.X., Carter, R.A., & Tour, J.M. (2022). Phase controlled synthesis of transition metal carbide nanocrystals by ultrafast flash Joule heating. Nat. Commun., 13(1), 262. [34] H.J. Monkhorst J.D. Pack Special points for brillouin-zone integrations Phys. Rev. B 13 12 1976 5188 Monkhorst, H.J., & Pack, J.D. (1976). Special points for brillouin-zone integrations. Phys. Rev. B, 13(12), 5188. [35] S. Grimme J. Antony S. Ehrlich H. Krieg A consistent and accurate ab initio parametrization of density functional dispersion correction (DFT-D) for the 94 elements H-Pu J. Chem. Phys. 132 15 2010 154104 Grimme, S., Antony, J., Ehrlich, S., & Krieg, H. (2010). A consistent and accurate ab initio parametrization of density functional dispersion correction (DFT-D) for the 94 elements H-Pu. J. Chem. Phys., 132(15), 154104. [36] T. Todorova B. Delley Wetting of paracetamol surfaces studied by DMol3-COSMO calculations Mol. Simul. 34 10–15 2008 1013 1017 Todorova, T., & Delley, B. (2008). Wetting of paracetamol surfaces studied by DMol3-COSMO calculations. Mol. Simul., 34(10–15), 1013–1017. [37] M. Tuckerman K. Laasonen M. Sprik M. Parrinello Ab initio molecular dynamics simulation of the solvation and transport of hydronium and hydroxyl ions in water J. Chem. Phys. 103 1 1995 150 161 Tuckerman, M., Laasonen, K., Sprik, M., & Parrinello, M. (1995). Ab initio molecular dynamics simulation of the solvation and transport of hydronium and hydroxyl ions in water. J. Chem. Phys., 103(1), 150–161. [38] W.L. McMillan J.M. Rowell Lead phonon spectrum calculated from superconducting density of states Phys. Rev. Lett. 14 4 1965 108 McMillan, W.L., & Rowell, J.M. (1965). Lead phonon spectrum calculated from superconducting density of states. Phys. Rev. Lett., 14(4), 108. [39] G. Wen D.U. Lee B. Ren Orbital interactions in Bi-Sn bimetallic electrocatalysts for highly selective electrochemical CO2 reduction toward formate production Adv. Energy Mater. 8 31 2018 1802427 Wen G., Lee D.U., Ren B., et al. Orbital interactions in Bi-Sn bimetallic electrocatalysts for highly selective electrochemical CO2 reduction toward formate production. Adv. Energy Mater., 2018, 8(31): 1802427. [40] M. Gao L. Chen Z. Zhang Interface engineering of the Ni(OH)2-Ni3N nanoarray heterostructure for the alkaline hydrogen evolution reaction J. Mater. Chem. A 6 3 2018 833∼836 Gao M., Chen L., Zhang Z., et al. Interface engineering of the Ni(OH)2-Ni3N nanoarray heterostructure for the alkaline hydrogen evolution reaction. J. Mater. Chem. A, 2018, 6(3): 833∼836. [41] Y. Yang Y. Qian Z. Luo H. Li L. Chen X. Cao X. Fan Water induced ultrathin Mo2C nanosheets with high-density grain boundaries for enhanced hydrogen evolution Nat. Commun. 13 1 2022 7225 Yang, Y., Qian, Y., Luo, Z., Li, H., Chen, L., Cao, X., & Fan, X. (2022). Water induced ultrathin Mo2C nanosheets with high-density grain boundaries for enhanced hydrogen evolution. Nat. Commun., 13(1), 7225. [42] X. Chen S. Huang H. Zhang Bimetallic alloys encapsulated in fullerenes as efficient oxygen reduction or oxygen evolution reaction catalysts: a density functional theory study J. Alloys Compd. 894 2022 162508 Chen X., Huang S., Zhang H. Bimetallic alloys encapsulated in fullerenes as efficient oxygen reduction or oxygen evolution reaction catalysts: a density functional theory study. J. Alloys Compd., 2022, 894: 162508. [43] X. Guo J. Gu S. Lin S. Zhang Z. Chen S. Huang Tackling the activity and selectivity challenges of electrocatalysts toward the nitrogen reduction reaction via atomically dispersed biatom catalysts J. Am. Chem. Soc. 142 12 2020 5709 5721 Guo, X., Gu, J., Lin, S., Zhang, S., Chen, Z., & Huang, S. (2020). Tackling the activity and selectivity challenges of electrocatalysts toward the nitrogen reduction reaction via atomically dispersed biatom catalysts. J. Am. Chem. Soc., 142(12), 5709–5721. [44] Z. Liang M. Luo M. Chen X. Qi J. Liu C. Liu T. Liang Exploring the oxygen electrode bi-functional activity of Ni–N–C-doped graphene systems with N, C co-ordination and OH ligand effects J. Mater. Chem. A 8 39 2020 20453 20462 Liang, Z., Luo, M., Chen, M., Qi, X., Liu, J., Liu, C., & Liang, T. (2020). Exploring the oxygen electrode bi-functional activity of Ni–N–C-doped graphene systems with N, C co-ordination and OH ligand effects. J. Mater. Chem. A, 8(39), 20453–20462. [45] J.K. Nørskov T. Bligaard A. Logadottir Trends in the exchange current for hydrogen evolution J. Electrochem. Soc. 152 3 2005 J23 Nørskov J.K., Bligaard T., Logadottir A., et al. Trends in the exchange current for hydrogen evolution. J. Electrochem. Soc., 2005, 152(3): J23. [46] S. Hu W.X. Li Sabatier principle of metal-support interaction for design of ultrastable metal nanocatalysts Science 374 6573 2021 1360 1365 Hu, S., & Li, W.X. (2021). Sabatier principle of metal-support interaction for design of ultrastable metal nanocatalysts. Science, 374(6573), 1360–1365. [47] M. Sanlés-Sobrido M. Pérez-Lorenzo B. Rodríguez-González V. Salgueiriño M.A. Correa-Duarte Highly active nanoreactors: nanomaterial encapsulation based on confined catalysis Angew. Chem. 124 16 2012 3943 3948 Sanlés-Sobrido, M., Pérez-Lorenzo, M., Rodríguez-González, B., Salgueiriño, V., & Correa-Duarte, M.A. (2012). Highly active nanoreactors: nanomaterial encapsulation based on confined catalysis. Angew. Chem., 124(16), 3943–3948. [48] P.S. Lamoureux A.R. Singh K. Chan pH effects on hydrogen evolution and oxidation over Pt (111): insights from first-principles ACS Catal. 9 7 2019 6194 6201 Lamoureux, P.S., Singh, A.R., & Chan, K. (2019). pH effects on hydrogen evolution and oxidation over Pt (111): insights from first-principles. ACS Catal., 9(7), 6194–6201. [49] J.K. Nørskov T. Bligaard A. Logadottir J.R. Kitchin J.G. Chen S. Pandelov U. Stimming Trends in the exchange current for hydrogen evolution J. Electrochem. Soc. 152 3 2005 J23 Nørskov, J.K., Bligaard, T., Logadottir, A., Kitchin, J.R., Chen, J.G., Pandelov, S., & Stimming, U. (2005). Trends in the exchange current for hydrogen evolution. J. Electrochem. Soc., 152(3), J23. [50] Q. Hu K. Gao X. Wang H. Zheng J. Cao L. Mi C. He Subnanometric Ru clusters with upshifted D band center improve performance for alkaline hydrogen evolution reaction Nat. Commun. 13 1 2022 3958 Hu, Q., Gao, K., Wang, X., Zheng, H., Cao, J., Mi, L., & He, C. (2022). Subnanometric Ru clusters with upshifted D band center improve performance for alkaline hydrogen evolution reaction. Nat. Commun., 13(1), 3958. [51] S. Liu Z. Li C. Wang W. Tao M. Huang M. Zuo Q. Chen Turning main-group element magnesium into a highly active electrocatalyst for oxygen reduction reaction Nat. Commun. 11 1 2020 938 Liu, S., Li, Z., Wang, C., Tao, W., Huang, M., Zuo, M., & Chen, Q. (2020). Turning main-group element magnesium into a highly active electrocatalyst for oxygen reduction reaction. Nat. Commun., 11(1), 938. [52] T. Zhang B. Zhang Q. Peng J. Zhou Z. Sun Mo2B2 MBene-supported single-atom catalysts as bifunctional HER/OER and OER/ORR electrocatalysts J. Mater. Chem. A 9 1 2021 433 441 Zhang, T., Zhang, B., Peng, Q., Zhou, J., & Sun, Z. (2021). Mo2B2 MBene-supported single-atom catalysts as bifunctional HER/OER and OER/ORR electrocatalysts. J. Mater. Chem. A, 9(1), 433–441. [53] Y. Yu J. Zhou Z. Sun Novel 2D transition-metal carbides: ultrahigh performance electrocatalysts for overall water splitting and oxygen reduction Adv. Funct. Mater. 30 47 2020 2000570 Yu, Y., Zhou, J., & Sun, Z. (2020). Novel 2D transition-metal carbides: ultrahigh performance electrocatalysts for overall water splitting and oxygen reduction. Adv. Funct. Mater., 30(47), 2000570. [54] Y. Zhao D.P. Adiyeri Saseendran C. Huang C.A. Triana W.R. Marks H. Chen G.R. Patzke Oxygen evolution/reduction reaction catalysts: from in situ monitoring and reaction mechanisms to rational design Chem. Rev. 2023 Zhao, Y., Adiyeri Saseendran, D.P., Huang, C., Triana, C.A., Marks, W.R., Chen, H., & Patzke, G.R. (2023). Oxygen evolution/reduction reaction catalysts: from in situ monitoring and reaction mechanisms to rational design. Chem. Rev.. [55] N. Ran E. Song Y. Wang Y. Zhou J. Liu Dynamic coordination transformation of active sites in single-atom MoS2 catalysts for boosted oxygen evolution catalysis Energy Environ. Sci. 15 5 2022 2071 2083 Ran, N., Song, E., Wang, Y., Zhou, Y., & Liu, J. (2022). Dynamic coordination transformation of active sites in single-atom MoS2 catalysts for boosted oxygen evolution catalysis. Energy Environ. Sci., 15(5), 2071–2083. [56] Y. Tan Y. Zhu X. Cao Y. Liu J. Li Z. Chen J. Hu Discovery of hydrogen spillover-based binary electrocatalysts for hydrogen evolution: from theory to experiment ACS Catal. 12 19 2022 11821 11829 Tan, Y., Zhu, Y., Cao, X., Liu, Y., Li, J., Chen, Z., & Hu, J. (2022). Discovery of hydrogen spillover-based binary electrocatalysts for hydrogen evolution: from theory to experiment. ACS Catal., 12(19), 11821–11829.",
      "scopus-id": "85181742964",
      "coredata": {
        "eid": "1-s2.0-S2468823123007551",
        "dc:description": "A crucial step in resolving the energy crisis and achieving carbon neutrality is the design of bifunctional allolytic water catalysts with good hydrogen evolution reaction (HER) and oxygen evolution reaction (OER) capabilities because fuel cells are one of the crucial elements of future power systems and require good hydrogen and oxygen ends as fuel internally. In order to investigate the catalytic performance of Mo2C-MoP heterojunction bifunctional catalysts throughout the entire hydrolysis reaction, first-principles construction methods were used. It was discovered that Mo2C-MoP heterojunction catalysts have excellent hydrogen evolution effect under acidic environment through analysis and discussion of electronic properties, adsorption energy, and active sites, especially Mo2C-MoP(P1) and Mo2C-MoP(P2) models effectively adsorb hydrogen atoms near Mo2C with the best Gibbs free energy of 0.02 eV. After that, the Mo2C-MoP(P1) This paper demonstrates that the construction of heterostructured catalysts with different stacking methods has a broad research prospect in the field of fuel cells and provides new ideas for the design of new catalysts and green energy in the future. It provides new ideas for the future design of new catalysts and green energy sources.",
        "openArchiveArticle": "false",
        "prism:coverDate": "2024-01-31",
        "openaccessUserLicense": null,
        "prism:aggregationType": "Journal",
        "prism:url": "https://api.elsevier.com/content/article/pii/S2468823123007551",
        "dc:creator": [
          {
            "@_fa": "true",
            "$": "Liu, Zhiyu"
          },
          {
            "@_fa": "true",
            "$": "Xie, Hongbo"
          },
          {
            "@_fa": "true",
            "$": "Wang, Zeliang"
          },
          {
            "@_fa": "true",
            "$": "Wu, Chun"
          },
          {
            "@_fa": "true",
            "$": "Li, Yanshuai"
          },
          {
            "@_fa": "true",
            "$": "Zhao, Hewei"
          },
          {
            "@_fa": "true",
            "$": "Dong, Shizhi"
          }
        ],
        "link": [
          {
            "@_fa": "true",
            "@rel": "self",
            "@href": "https://api.elsevier.com/content/article/pii/S2468823123007551"
          },
          {
            "@_fa": "true",
            "@rel": "scidir",
            "@href": "https://www.sciencedirect.com/science/article/pii/S2468823123007551"
          }
        ],
        "dc:format": "application/json",
        "openaccessType": null,
        "pii": "S2468-8231(23)00755-1",
        "prism:volume": "552",
        "articleNumber": "113672",
        "prism:publisher": "Elsevier B.V.",
        "dc:title": "Design of Mo2C-MoP heterostructure hydrogen and oxygen evolution bifunctional catalyst based on first principles",
        "prism:copyright": "© 2023 Elsevier B.V. All rights reserved.",
        "openaccess": "0",
        "prism:issn": "24688231",
        "dcterms:subject": [
          {
            "@_fa": "true",
            "$": "First principles"
          },
          {
            "@_fa": "true",
            "$": "Heterogeneous structure catalysts"
          },
          {
            "@_fa": "true",
            "$": "Hydrogen evolution reaction"
          },
          {
            "@_fa": "true",
            "$": "Oxygen evolution reaction"
          },
          {
            "@_fa": "true",
            "$": "DFT"
          }
        ],
        "openaccessArticle": "false",
        "prism:publicationName": "Molecular Catalysis",
        "openaccessSponsorType": null,
        "prism:pageRange": "113672",
        "pubType": "fla",
        "prism:coverDisplayDate": "January 2024",
        "prism:doi": "10.1016/j.mcat.2023.113672",
        "prism:startingPage": "113672",
        "dc:identifier": "doi:10.1016/j.mcat.2023.113672",
        "openaccessSponsorName": null
      },
      "objects": {
        "object": [
          {
            "@category": "standard",
            "@height": "453",
            "@width": "659",
            "@_fa": "true",
            "$": "https://api.elsevier.com/content/object/eid/1-s2.0-S2468823123007551-gr2.jpg?httpAccept=%2A%2F%2A",
            "@multimediatype": "JPEG image file",
            "@type": "IMAGE-DOWNSAMPLED",
            "@size": "113061",
            "@ref": "gr2",
            "@mimetype": "image/jpeg"
          },
          {
            "@category": "standard",
            "@height": "200",
            "@width": "486",
            "@_fa": "true",
            "$": "https://api.elsevier.com/content/object/eid/1-s2.0-S2468823123007551-ga1.jpg?httpAccept=%2A%2F%2A",
            "@multimediatype": "JPEG image file",
            "@type": "IMAGE-DOWNSAMPLED",
            "@size": "42901",
            "@ref": "ga1",
            "@mimetype": "image/jpeg"
          },
          {
            "@category": "standard",
            "@height": "284",
            "@width": "734",
            "@_fa": "true",
            "$": "https://api.elsevier.com/content/object/eid/1-s2.0-S2468823123007551-gr6.jpg?httpAccept=%2A%2F%2A",
            "@multimediatype": "JPEG image file",
            "@type": "IMAGE-DOWNSAMPLED",
            "@size": "100042",
            "@ref": "gr6",
            "@mimetype": "image/jpeg"
          },
          {
            "@category": "standard",
            "@height": "358",
            "@width": "734",
            "@_fa": "true",
            "$": "https://api.elsevier.com/content/object/eid/1-s2.0-S2468823123007551-gr5.jpg?httpAccept=%2A%2F%2A",
            "@multimediatype": "JPEG image file",
            "@type": "IMAGE-DOWNSAMPLED",
            "@size": "96685",
            "@ref": "gr5",
            "@mimetype": "image/jpeg"
          },
          {
            "@category": "standard",
            "@height": "378",
            "@width": "715",
            "@_fa": "true",
            "$": "https://api.elsevier.com/content/object/eid/1-s2.0-S2468823123007551-gr4.jpg?httpAccept=%2A%2F%2A",
            "@multimediatype": "JPEG image file",
            "@type": "IMAGE-DOWNSAMPLED",
            "@size": "92933",
            "@ref": "gr4",
            "@mimetype": "image/jpeg"
          },
          {
            "@category": "standard",
            "@height": "284",
            "@width": "663",
            "@_fa": "true",
            "$": "https://api.elsevier.com/content/object/eid/1-s2.0-S2468823123007551-gr7.jpg?httpAccept=%2A%2F%2A",
            "@multimediatype": "JPEG image file",
            "@type": "IMAGE-DOWNSAMPLED",
            "@size": "40178",
            "@ref": "gr7",
            "@mimetype": "image/jpeg"
          },
          {
            "@category": "standard",
            "@height": "279",
            "@width": "753",
            "@_fa": "true",
            "$": "https://api.elsevier.com/content/object/eid/1-s2.0-S2468823123007551-gr3.jpg?httpAccept=%2A%2F%2A",
            "@multimediatype": "JPEG image file",
            "@type": "IMAGE-DOWNSAMPLED",
            "@size": "70173",
            "@ref": "gr3",
            "@mimetype": "image/jpeg"
          },
          {
            "@category": "standard",
            "@height": "239",
            "@width": "716",
            "@_fa": "true",
            "$": "https://api.elsevier.com/content/object/eid/1-s2.0-S2468823123007551-gr1.jpg?httpAccept=%2A%2F%2A",
            "@multimediatype": "JPEG image file",
            "@type": "IMAGE-DOWNSAMPLED",
            "@size": "68692",
            "@ref": "gr1",
            "@mimetype": "image/jpeg"
          },
          {
            "@category": "thumbnail",
            "@height": "150",
            "@width": "219",
            "@_fa": "true",
            "$": "https://api.elsevier.com/content/object/eid/1-s2.0-S2468823123007551-gr2.sml?httpAccept=%2A%2F%2A",
            "@multimediatype": "GIF image file",
            "@type": "IMAGE-THUMBNAIL",
            "@size": "16821",
            "@ref": "gr2",
            "@mimetype": "image/gif"
          },
          {
            "@category": "thumbnail",
            "@height": "90",
            "@width": "219",
            "@_fa": "true",
            "$": "https://api.elsevier.com/content/object/eid/1-s2.0-S2468823123007551-ga1.sml?httpAccept=%2A%2F%2A",
            "@multimediatype": "GIF image file",
            "@type": "IMAGE-THUMBNAIL",
            "@size": "15245",
            "@ref": "ga1",
            "@mimetype": "image/gif"
          },
          {
            "@category": "thumbnail",
            "@height": "85",
            "@width": "219",
            "@_fa": "true",
            "$": "https://api.elsevier.com/content/object/eid/1-s2.0-S2468823123007551-gr6.sml?httpAccept=%2A%2F%2A",
            "@multimediatype": "GIF image file",
            "@type": "IMAGE-THUMBNAIL",
            "@size": "12158",
            "@ref": "gr6",
            "@mimetype": "image/gif"
          },
          {
            "@category": "thumbnail",
            "@height": "107",
            "@width": "219",
            "@_fa": "true",
            "$": "https://api.elsevier.com/content/object/eid/1-s2.0-S2468823123007551-gr5.sml?httpAccept=%2A%2F%2A",
            "@multimediatype": "GIF image file",
            "@type": "IMAGE-THUMBNAIL",
            "@size": "12630",
            "@ref": "gr5",
            "@mimetype": "image/gif"
          },
          {
            "@category": "thumbnail",
            "@height": "116",
            "@width": "219",
            "@_fa": "true",
            "$": "https://api.elsevier.com/content/object/eid/1-s2.0-S2468823123007551-gr4.sml?httpAccept=%2A%2F%2A",
            "@multimediatype": "GIF image file",
            "@type": "IMAGE-THUMBNAIL",
            "@size": "12664",
            "@ref": "gr4",
            "@mimetype": "image/gif"
          },
          {
            "@category": "thumbnail",
            "@height": "94",
            "@width": "219",
            "@_fa": "true",
            "$": "https://api.elsevier.com/content/object/eid/1-s2.0-S2468823123007551-gr7.sml?httpAccept=%2A%2F%2A",
            "@multimediatype": "GIF image file",
            "@type": "IMAGE-THUMBNAIL",
            "@size": "7662",
            "@ref": "gr7",
            "@mimetype": "image/gif"
          },
          {
            "@category": "thumbnail",
            "@height": "81",
            "@width": "219",
            "@_fa": "true",
            "$": "https://api.elsevier.com/content/object/eid/1-s2.0-S2468823123007551-gr3.sml?httpAccept=%2A%2F%2A",
            "@multimediatype": "GIF image file",
            "@type": "IMAGE-THUMBNAIL",
            "@size": "11738",
            "@ref": "gr3",
            "@mimetype": "image/gif"
          },
          {
            "@category": "thumbnail",
            "@height": "73",
            "@width": "219",
            "@_fa": "true",
            "$": "https://api.elsevier.com/content/object/eid/1-s2.0-S2468823123007551-gr1.sml?httpAccept=%2A%2F%2A",
            "@multimediatype": "GIF image file",
            "@type": "IMAGE-THUMBNAIL",
            "@size": "10860",
            "@ref": "gr1",
            "@mimetype": "image/gif"
          },
          {
            "@category": "high",
            "@height": "2004",
            "@width": "2917",
            "@_fa": "true",
            "$": "https://api.elsevier.com/content/object/eid/1-s2.0-S2468823123007551-gr2_lrg.jpg?httpAccept=%2A%2F%2A",
            "@multimediatype": "JPEG image file",
            "@type": "IMAGE-HIGH-RES",
            "@size": "886117",
            "@ref": "gr2",
            "@mimetype": "image/jpeg"
          },
          {
            "@category": "high",
            "@height": "886",
            "@width": "2151",
            "@_fa": "true",
            "$": "https://api.elsevier.com/content/object/eid/1-s2.0-S2468823123007551-ga1_lrg.jpg?httpAccept=%2A%2F%2A",
            "@multimediatype": "JPEG image file",
            "@type": "IMAGE-HIGH-RES",
            "@size": "294700",
            "@ref": "ga1",
            "@mimetype": "image/jpeg"
          },
          {
            "@category": "high",
            "@height": "1259",
            "@width": "3250",
            "@_fa": "true",
            "$": "https://api.elsevier.com/content/object/eid/1-s2.0-S2468823123007551-gr6_lrg.jpg?httpAccept=%2A%2F%2A",
            "@multimediatype": "JPEG image file",
            "@type": "IMAGE-HIGH-RES",
            "@size": "732573",
            "@ref": "gr6",
            "@mimetype": "image/jpeg"
          },
          {
            "@category": "high",
            "@height": "1586",
            "@width": "3250",
            "@_fa": "true",
            "$": "https://api.elsevier.com/content/object/eid/1-s2.0-S2468823123007551-gr5_lrg.jpg?httpAccept=%2A%2F%2A",
            "@multimediatype": "JPEG image file",
            "@type": "IMAGE-HIGH-RES",
            "@size": "718144",
            "@ref": "gr5",
            "@mimetype": "image/jpeg"
          },
          {
            "@category": "high",
            "@height": "1676",
            "@width": "3167",
            "@_fa": "true",
            "$": "https://api.elsevier.com/content/object/eid/1-s2.0-S2468823123007551-gr4_lrg.jpg?httpAccept=%2A%2F%2A",
            "@multimediatype": "JPEG image file",
            "@type": "IMAGE-HIGH-RES",
            "@size": "638115",
            "@ref": "gr4",
            "@mimetype": "image/jpeg"
          },
          {
            "@category": "high",
            "@height": "1256",
            "@width": "2934",
            "@_fa": "true",
            "$": "https://api.elsevier.com/content/object/eid/1-s2.0-S2468823123007551-gr7_lrg.jpg?httpAccept=%2A%2F%2A",
            "@multimediatype": "JPEG image file",
            "@type": "IMAGE-HIGH-RES",
            "@size": "281395",
            "@ref": "gr7",
            "@mimetype": "image/jpeg"
          },
          {
            "@category": "high",
            "@height": "1236",
            "@width": "3332",
            "@_fa": "true",
            "$": "https://api.elsevier.com/content/object/eid/1-s2.0-S2468823123007551-gr3_lrg.jpg?httpAccept=%2A%2F%2A",
            "@multimediatype": "JPEG image file",
            "@type": "IMAGE-HIGH-RES",
            "@size": "650349",
            "@ref": "gr3",
            "@mimetype": "image/jpeg"
          },
          {
            "@category": "high",
            "@height": "1057",
            "@width": "3172",
            "@_fa": "true",
            "$": "https://api.elsevier.com/content/object/eid/1-s2.0-S2468823123007551-gr1_lrg.jpg?httpAccept=%2A%2F%2A",
            "@multimediatype": "JPEG image file",
            "@type": "IMAGE-HIGH-RES",
            "@size": "588625",
            "@ref": "gr1",
            "@mimetype": "image/jpeg"
          },
          {
            "@category": "standard",
            "@_fa": "true",
            "$": "https://api.elsevier.com/content/object/eid/1-s2.0-S2468823123007551-mmc1.docx?httpAccept=%2A%2F%2A",
            "@multimediatype": "Microsoft Word file",
            "@type": "APPLICATION",
            "@size": "3192115",
            "@ref": "mmc1",
            "@mimetype": "application/word"
          },
          {
            "@category": "standard",
            "@_fa": "true",
            "$": "https://api.elsevier.com/content/object/eid/1-s2.0-S2468823123007551-am.pdf?httpAccept=%2A%2F%2A",
            "@multimediatype": "Acrobat PDF file",
            "@type": "AAM-PDF",
            "@size": "1081300",
            "@ref": "am",
            "@mimetype": "application/pdf"
          }
        ]
      },
      "link": {
        "@rel": "abstract",
        "@href": "https://api.elsevier.com/content/abstract/scopus_id/85181742964"
      }
    }
  }
}