{
  "metadata": {
    "title": "Palladium supported ionic liquid phase catalyst (Pd@SILP-PS) for room temperature Suzuki-Miyaura cross-coupling reaction",
    "authors": "; ; ",
    "journal": "Molecular Catalysis",
    "date": "2017-12-31",
    "doi": "10.1016/j.mcat.2017.08.023",
    "abstract": "",
    "uri": "https://api.elsevier.com/content/article/pii/S2468823117304789",
    "pii": "S2468823117304789"
  },
  "fulltext": {
    "full-text-retrieval-response": {
      "scopus-eid": "2-s2.0-85029621479",
      "originalText": "serial JL 315758 291210 291744 291790 291809 31 Molecular Catalysis MOLECULARCATALYSIS 2017-09-18 2017-09-18 2017-09-18 2017-09-18 2018-10-31T12:01:59 1-s2.0-S2468823117304789 S2468-8231(17)30478-9 S2468823117304789 10.1016/j.mcat.2017.08.023 S300 S300.2 FULL-TEXT 1-s2.0-S2468823117X00163 2025-07-16T18:54:01.246284Z 0 0 20171201 20171231 2017 2017-09-18T04:34:40.722852Z absattachment articleinfo articletitlenorm authfirstinitialnorm authfirstsurnamenorm cid cids contenttype copyright crossmark dateloaded dateloadedtxt datesearch datesort dateupdated dco docsubtype doctype doi eid ewtransactionid hubeid indexeddate issn issnnorm itemstage itemtransactionid itemweight openaccess openarchive pg pgfirst pglast pii piinorm pubdateend pubdatestart pubdatetxt pubyr sectiontitle sortorder srctitle srctitlenorm srctype ssids alllist content subj subheadings suppl tomb volfirst volissue volumelist webpdf webpdfpagecount yearnav figure table e-component body acknowledge affil appendices articletitle auth authfirstini authfull authkeywords authlast highlightsabst primabst pubtype ref specialabst 2468-8231 24688231 true 442 442 C Volume 442 16 126 132 126 132 201712 December 2017 2017-12-01 2017-12-31 2017 Regular Papers article fla © 2017 Elsevier B.V. All rights reserved. PALLADIUMSUPPORTEDIONICLIQUIDPHASECATALYSTPDSILPPSFORROOMTEMPERATURESUZUKIMIYAURACROSSCOUPLINGREACTION MORE S 1 Introduction 2 Results and discussion 2.1 Preparation of Pd@SILP-PS catalyst 2.2 Characterization of Pd@SILP-PS catalyst 2.3 Suzuki–Miyaura cross-coupling reaction by Pd@SILP-PS catalyst 3 Conclusion Acknowledgements Appendix A Supplementary data References DEMEIJERE 2004 A METALCROSSCOUPLING BELLER 2004 M TRANSITIONMETALSFORORGANICSYNTHESIS FIHRI 2011 5181 5203 A MIYAURA 1995 2457 2483 N BUDAVARI 1996 S MERKINDEXENCYCLOPEDIACHEMICALSDRUGSBIOLOGICALS SEECHURN 2012 5062 5085 C JADHAV 2016 1898 1911 S KUMBHAR 2015 2075 2121 A MOLNAR 2011 2251 2320 POLSHETTIWAR 2009 2599 2626 C KUMBHAR 2017 2 A WASSERSCHEID 2002 P IONICLIQUIDSINSYNTHESIS ZHANG 2011 2619 2637 Q FORTMAN 2011 5151 5169 G MEHNERT 2005 50 56 C SKODAFOLDES 2014 8840 8884 R RIISAGER 2005 815 819 A JADHAV 2015 2333 2341 S GADGE 2015 170 178 S GHOSH 2014 1767 1771 S HAGIWARA 2011 1133 1137 H MA 2008 59 66 X MIKKOLA 2006 197 205 J HUANG 2004 1397 1399 J BREITENLECHNER 2004 175 179 S GRUTTADAURIA 2011 2119 2130 M KUMBHAR 2017 22 88 A KUMBHAR 2012 1388 1396 A KUMBHAR 2013 1331 1337 A RASHINKAR 2011 1442 1447 G CHO 2011 1459 1461 H DESHAYES 2005 4552 4556 G CARRETTIN 2005 2242 2245 S MOREX2017X126 MOREX2017X126X132 MOREX2017X126XS MOREX2017X126X132XS 2019-09-18T00:00:00Z http://creativecommons.org/licenses/by-nc-nd/4.0/ © 2017 Elsevier B.V. All rights reserved. item S2468-8231(17)30478-9 S2468823117304789 1-s2.0-S2468823117304789 10.1016/j.mcat.2017.08.023 315758 2018-10-31T12:13:44.04057Z 2017-12-01 2017-12-31 1-s2.0-S2468823117304789-main.pdf https://s3-eu-west-1.amazonaws.com/prod-ucs-content-store-eu-west/content/pii:S2468823117304789/MAIN/application/pdf/56b8eab94950f5fa8d94341a208b09e1/main.pdf https://s3.amazonaws.com/prod-ucs-content-store-us-east/content/pii:S2468823117304789/MAIN/application/pdf/56b8eab94950f5fa8d94341a208b09e1/main.pdf main.pdf pdf true 3071086 MAIN 7 1-s2.0-S2468823117304789-main_1.png https://s3-eu-west-1.amazonaws.com/prod-ucs-content-store-eu-west/content/pii:S2468823117304789/PREVIEW/image/png/c1167f8a4421fb69bc7134ff7a509e52/main_1.png https://s3.amazonaws.com/prod-ucs-content-store-us-east/content/pii:S2468823117304789/PREVIEW/image/png/c1167f8a4421fb69bc7134ff7a509e52/main_1.png main_1.png png 58465 849 656 IMAGE-WEB-PDF 1 1-s2.0-S2468823117304789-fx1.sml https://s3-eu-west-1.amazonaws.com/prod-ucs-content-store-eu-west/content/pii:S2468823117304789/fx1/THUMBNAIL/image/gif/8791ca176d0039b1396508f38fd9dd32/fx1.sml https://s3.amazonaws.com/prod-ucs-content-store-us-east/content/pii:S2468823117304789/fx1/THUMBNAIL/image/gif/8791ca176d0039b1396508f38fd9dd32/fx1.sml fx1 true fx1.sml sml 4998 164 201 IMAGE-THUMBNAIL 1-s2.0-S2468823117304789-gr1.sml https://s3-eu-west-1.amazonaws.com/prod-ucs-content-store-eu-west/content/pii:S2468823117304789/gr1/THUMBNAIL/image/gif/885f83e5e41663b2d80026ce52ffa21c/gr1.sml https://s3.amazonaws.com/prod-ucs-content-store-us-east/content/pii:S2468823117304789/gr1/THUMBNAIL/image/gif/885f83e5e41663b2d80026ce52ffa21c/gr1.sml gr1 gr1.sml sml 8845 114 219 IMAGE-THUMBNAIL 1-s2.0-S2468823117304789-gr2.sml https://s3-eu-west-1.amazonaws.com/prod-ucs-content-store-eu-west/content/pii:S2468823117304789/gr2/THUMBNAIL/image/gif/260fb0fb8500a58ad6476c01bfc0de17/gr2.sml https://s3.amazonaws.com/prod-ucs-content-store-us-east/content/pii:S2468823117304789/gr2/THUMBNAIL/image/gif/260fb0fb8500a58ad6476c01bfc0de17/gr2.sml gr2 gr2.sml sml 9094 68 219 IMAGE-THUMBNAIL 1-s2.0-S2468823117304789-gr3.sml https://s3-eu-west-1.amazonaws.com/prod-ucs-content-store-eu-west/content/pii:S2468823117304789/gr3/THUMBNAIL/image/gif/8b0e5ab2b574669b698612bab4f7b4e1/gr3.sml https://s3.amazonaws.com/prod-ucs-content-store-us-east/content/pii:S2468823117304789/gr3/THUMBNAIL/image/gif/8b0e5ab2b574669b698612bab4f7b4e1/gr3.sml gr3 gr3.sml sml 6182 141 219 IMAGE-THUMBNAIL 1-s2.0-S2468823117304789-gr4.sml https://s3-eu-west-1.amazonaws.com/prod-ucs-content-store-eu-west/content/pii:S2468823117304789/gr4/THUMBNAIL/image/gif/c57ec5e0c4d8181b772967704523c6f2/gr4.sml https://s3.amazonaws.com/prod-ucs-content-store-us-east/content/pii:S2468823117304789/gr4/THUMBNAIL/image/gif/c57ec5e0c4d8181b772967704523c6f2/gr4.sml gr4 gr4.sml sml 14462 164 148 IMAGE-THUMBNAIL 1-s2.0-S2468823117304789-gr5.sml https://s3-eu-west-1.amazonaws.com/prod-ucs-content-store-eu-west/content/pii:S2468823117304789/gr5/THUMBNAIL/image/gif/0c0d79a8be74f1ff5fcbbec307ac098d/gr5.sml https://s3.amazonaws.com/prod-ucs-content-store-us-east/content/pii:S2468823117304789/gr5/THUMBNAIL/image/gif/0c0d79a8be74f1ff5fcbbec307ac098d/gr5.sml gr5 gr5.sml sml 5587 164 202 IMAGE-THUMBNAIL 1-s2.0-S2468823117304789-gr6.sml https://s3-eu-west-1.amazonaws.com/prod-ucs-content-store-eu-west/content/pii:S2468823117304789/gr6/THUMBNAIL/image/gif/0638fe64871395e5e28d5139721c29de/gr6.sml https://s3.amazonaws.com/prod-ucs-content-store-us-east/content/pii:S2468823117304789/gr6/THUMBNAIL/image/gif/0638fe64871395e5e28d5139721c29de/gr6.sml gr6 gr6.sml sml 6153 147 219 IMAGE-THUMBNAIL 1-s2.0-S2468823117304789-gr7.sml https://s3-eu-west-1.amazonaws.com/prod-ucs-content-store-eu-west/content/pii:S2468823117304789/gr7/THUMBNAIL/image/gif/2adee2255d6241bdd458207196d4bfd6/gr7.sml https://s3.amazonaws.com/prod-ucs-content-store-us-east/content/pii:S2468823117304789/gr7/THUMBNAIL/image/gif/2adee2255d6241bdd458207196d4bfd6/gr7.sml gr7 gr7.sml sml 16376 163 202 IMAGE-THUMBNAIL 1-s2.0-S2468823117304789-pl1.sml https://s3-eu-west-1.amazonaws.com/prod-ucs-content-store-eu-west/content/pii:S2468823117304789/pl1/THUMBNAIL/image/gif/40d5dd32d4d9b3413e755fef422d7c85/pl1.sml https://s3.amazonaws.com/prod-ucs-content-store-us-east/content/pii:S2468823117304789/pl1/THUMBNAIL/image/gif/40d5dd32d4d9b3413e755fef422d7c85/pl1.sml pl1 pl1.sml sml 3633 163 94 IMAGE-THUMBNAIL 1-s2.0-S2468823117304789-sc1.sml https://s3-eu-west-1.amazonaws.com/prod-ucs-content-store-eu-west/content/pii:S2468823117304789/sc1/THUMBNAIL/image/gif/98439f34c835f2a8137de0de0ef8c948/sc1.sml https://s3.amazonaws.com/prod-ucs-content-store-us-east/content/pii:S2468823117304789/sc1/THUMBNAIL/image/gif/98439f34c835f2a8137de0de0ef8c948/sc1.sml sc1 sc1.sml sml 2507 62 219 IMAGE-THUMBNAIL 1-s2.0-S2468823117304789-sc2.sml https://s3-eu-west-1.amazonaws.com/prod-ucs-content-store-eu-west/content/pii:S2468823117304789/sc2/THUMBNAIL/image/gif/f45e3821e9ec45c31da1d97c646bda12/sc2.sml https://s3.amazonaws.com/prod-ucs-content-store-us-east/content/pii:S2468823117304789/sc2/THUMBNAIL/image/gif/f45e3821e9ec45c31da1d97c646bda12/sc2.sml sc2 sc2.sml sml 1610 37 219 IMAGE-THUMBNAIL 1-s2.0-S2468823117304789-fx1.jpg https://s3-eu-west-1.amazonaws.com/prod-ucs-content-store-eu-west/content/pii:S2468823117304789/fx1/DOWNSAMPLED/image/jpeg/b71d629be3e4ae1c48f325300fda11d9/fx1.jpg https://s3.amazonaws.com/prod-ucs-content-store-us-east/content/pii:S2468823117304789/fx1/DOWNSAMPLED/image/jpeg/b71d629be3e4ae1c48f325300fda11d9/fx1.jpg fx1 true fx1.jpg jpg 10825 245 301 IMAGE-DOWNSAMPLED 1-s2.0-S2468823117304789-gr1.jpg https://s3-eu-west-1.amazonaws.com/prod-ucs-content-store-eu-west/content/pii:S2468823117304789/gr1/DOWNSAMPLED/image/jpeg/067b1c3c30d1011d905fdef872c254a1/gr1.jpg https://s3.amazonaws.com/prod-ucs-content-store-us-east/content/pii:S2468823117304789/gr1/DOWNSAMPLED/image/jpeg/067b1c3c30d1011d905fdef872c254a1/gr1.jpg gr1 gr1.jpg jpg 40257 295 565 IMAGE-DOWNSAMPLED 1-s2.0-S2468823117304789-gr2.jpg https://s3-eu-west-1.amazonaws.com/prod-ucs-content-store-eu-west/content/pii:S2468823117304789/gr2/DOWNSAMPLED/image/jpeg/cada62c719be07d55e439128dc815c09/gr2.jpg https://s3.amazonaws.com/prod-ucs-content-store-us-east/content/pii:S2468823117304789/gr2/DOWNSAMPLED/image/jpeg/cada62c719be07d55e439128dc815c09/gr2.jpg gr2 gr2.jpg jpg 30213 224 715 IMAGE-DOWNSAMPLED 1-s2.0-S2468823117304789-gr3.jpg https://s3-eu-west-1.amazonaws.com/prod-ucs-content-store-eu-west/content/pii:S2468823117304789/gr3/DOWNSAMPLED/image/jpeg/060dfa1184bdbeefa1a91c9cc76ecce7/gr3.jpg https://s3.amazonaws.com/prod-ucs-content-store-us-east/content/pii:S2468823117304789/gr3/DOWNSAMPLED/image/jpeg/060dfa1184bdbeefa1a91c9cc76ecce7/gr3.jpg gr3 gr3.jpg jpg 26977 485 753 IMAGE-DOWNSAMPLED 1-s2.0-S2468823117304789-gr4.jpg https://s3-eu-west-1.amazonaws.com/prod-ucs-content-store-eu-west/content/pii:S2468823117304789/gr4/DOWNSAMPLED/image/jpeg/0fb4b36ecd4e1b329dcfc88a0a14f015/gr4.jpg https://s3.amazonaws.com/prod-ucs-content-store-us-east/content/pii:S2468823117304789/gr4/DOWNSAMPLED/image/jpeg/0fb4b36ecd4e1b329dcfc88a0a14f015/gr4.jpg gr4 gr4.jpg jpg 56124 519 470 IMAGE-DOWNSAMPLED 1-s2.0-S2468823117304789-gr5.jpg https://s3-eu-west-1.amazonaws.com/prod-ucs-content-store-eu-west/content/pii:S2468823117304789/gr5/DOWNSAMPLED/image/jpeg/66ad7f449a20ef4468073ee62904ec10/gr5.jpg https://s3.amazonaws.com/prod-ucs-content-store-us-east/content/pii:S2468823117304789/gr5/DOWNSAMPLED/image/jpeg/66ad7f449a20ef4468073ee62904ec10/gr5.jpg gr5 gr5.jpg jpg 18917 306 376 IMAGE-DOWNSAMPLED 1-s2.0-S2468823117304789-gr6.jpg https://s3-eu-west-1.amazonaws.com/prod-ucs-content-store-eu-west/content/pii:S2468823117304789/gr6/DOWNSAMPLED/image/jpeg/3e58dd375e1319e25de260328a028d14/gr6.jpg https://s3.amazonaws.com/prod-ucs-content-store-us-east/content/pii:S2468823117304789/gr6/DOWNSAMPLED/image/jpeg/3e58dd375e1319e25de260328a028d14/gr6.jpg gr6 gr6.jpg jpg 42237 479 715 IMAGE-DOWNSAMPLED 1-s2.0-S2468823117304789-gr7.jpg https://s3-eu-west-1.amazonaws.com/prod-ucs-content-store-eu-west/content/pii:S2468823117304789/gr7/DOWNSAMPLED/image/jpeg/5e0398839405f9a7706f40730bdf51b9/gr7.jpg https://s3.amazonaws.com/prod-ucs-content-store-us-east/content/pii:S2468823117304789/gr7/DOWNSAMPLED/image/jpeg/5e0398839405f9a7706f40730bdf51b9/gr7.jpg gr7 gr7.jpg jpg 50840 304 376 IMAGE-DOWNSAMPLED 1-s2.0-S2468823117304789-pl1.jpg https://s3-eu-west-1.amazonaws.com/prod-ucs-content-store-eu-west/content/pii:S2468823117304789/pl1/DOWNSAMPLED/image/jpeg/838e5676fe197a24cafa3b8eb5b6c5b9/pl1.jpg https://s3.amazonaws.com/prod-ucs-content-store-us-east/content/pii:S2468823117304789/pl1/DOWNSAMPLED/image/jpeg/838e5676fe197a24cafa3b8eb5b6c5b9/pl1.jpg pl1 pl1.jpg jpg 111425 978 565 IMAGE-DOWNSAMPLED 1-s2.0-S2468823117304789-sc1.jpg https://s3-eu-west-1.amazonaws.com/prod-ucs-content-store-eu-west/content/pii:S2468823117304789/sc1/DOWNSAMPLED/image/jpeg/2ea2813eac8f0eb8733fbbb3b2fe849a/sc1.jpg https://s3.amazonaws.com/prod-ucs-content-store-us-east/content/pii:S2468823117304789/sc1/DOWNSAMPLED/image/jpeg/2ea2813eac8f0eb8733fbbb3b2fe849a/sc1.jpg sc1 sc1.jpg jpg 24944 203 715 IMAGE-DOWNSAMPLED 1-s2.0-S2468823117304789-sc2.jpg https://s3-eu-west-1.amazonaws.com/prod-ucs-content-store-eu-west/content/pii:S2468823117304789/sc2/DOWNSAMPLED/image/jpeg/ef3ad21e7e739c7c66a18a2a3edd0957/sc2.jpg https://s3.amazonaws.com/prod-ucs-content-store-us-east/content/pii:S2468823117304789/sc2/DOWNSAMPLED/image/jpeg/ef3ad21e7e739c7c66a18a2a3edd0957/sc2.jpg sc2 sc2.jpg jpg 14432 112 659 IMAGE-DOWNSAMPLED 1-s2.0-S2468823117304789-mmc1.docx https://s3-eu-west-1.amazonaws.com/prod-ucs-content-store-eu-west/content/pii:S2468823117304789/mmc1/MAIN/application/vnd.openxmlformats-officedocument.wordprocessingml.document/095c2a2436da57a1f3edc78bb76abae4/mmc1.docx https://s3.amazonaws.com/prod-ucs-content-store-us-east/content/pii:S2468823117304789/mmc1/MAIN/application/vnd.openxmlformats-officedocument.wordprocessingml.document/095c2a2436da57a1f3edc78bb76abae4/mmc1.docx mmc1 mmc1.docx docx 1755545 APPLICATION MCAT 292 S2468-8231(17)30478-9 10.1016/j.mcat.2017.08.023 Elsevier B.V. Scheme 1 Preparation of Pd@SILP-PS catalyst. Scheme 1 Scheme 2 Pd@SILP-PS catalyzed Suzuki–Miyaura cross-coupling reaction. Scheme 2 Fig. 1 Conceptual picture of Palladium Supported Ionic Liquid Phase (Pd@SILP-PS) catalyst. Fig. 1 Fig. 2 SEM images of (a) PS, (b) Imd-PS, (c) Pd@SILP-PS catalyst. Fig. 2 Fig. 3 EDS graph of the Pd@SILP-PS catalyst. Fig. 3 Fig. 4 TEM micrographs of the fresh and reused Pd@SILP-PS catalyst (magnification of the border of the polymer particle containing PdNPs). Fig. 4 Fig. 5 XPS analysis of Pd@SILP-PS catalyst. Fig. 5 Fig. 6 TGA graph of Pd@SILP-PS catalyst. Fig. 6 Fig. 7 Recyclability of Pd@SILP-PS in Suzuki-Miyaura cross-coupling reaction. Fig. 7 Chart 1 Evaluation of aryl halides with aryl boronic acids in the Suzuki-Miyaura cross-coupling reactiona. Chart 1 Table 1 Effect of base on Pd@SILP-PS catalyzed Suzuki–Miyaura cross-coupling reaction. a Table 1 Entry Base Amount (mmol) Time Yield b (%) 1 K2CO3 2.0 10min 95 2 K3PO4H2O 2.0 2h 50 3 K3PO4 2.0 2h 55 4 NaOAc 2.0 25min 95 5 Base free – 1h NR 6 K2CO3 1.0 10min 95 a Reaction conditions: 4-bromobenzophenone (1.0mmol), arylboronic acid (1.1mmol), catalyst (1 mol%), base (1.0-2.0mmol), ethanol (5mL) at room temperature, under nitrogen. b Isolated yields. Table 2 Effect of various solvents on Pd@SILP-PS catalyzed Suzuki–Miyaura cross-coupling reaction. a Table 2 Entry Solvent Time Temperature (°C) Yield b (%) 1 THF 4h RT 60 c 2 Toluene 12h4h RT70 NR80 c 3 DMF 1.30h RT 80 c 4 CH3CN 12h RT NR 5 Water 12h RT/70 NR 6 EtOH 10min RT 95 a Reaction conditions: 4-bromobenzophenone (1.0mmol), phenylboronic acid (1.1mmol), catalyst (1mol%), K2CO3 (1.0-2.0mmol), solvent (5mL) at room temperature. b Isolated yields. c Homocoupling products. Research Paper Palladium supported ionic liquid phase catalyst (Pd@SILP-PS) for room temperature Suzuki-Miyaura cross-coupling reaction Sagar More a Sanjay Jadhav c Rajashri Salunkhe b Arjun Kumbhar a ⁎ a Department of Chemistry, P.D.V.P. College, Tasgaon, Sangli, Maharashtra, India Department of Chemistry P.D.V.P. College Tasgaon Sangli Maharashtra India b Department of Chemistry, Shivaji University, Kolhapur, Maharashtra, India Department of Chemistry Shivaji University Kolhapur Maharashtra India c CSIR-National Chemical Laboratory, Pune, Maharashtra, India CSIR-National Chemical Laboratory Pune Maharashtra India ⁎ Corresponding author. Graphical abstract A new Pd-SILP based on amino functionalized imidazolium ionic liquid immobilized on Merrifield resin (Pd@SILP-PS) has been synthesized. The catalyst was characterized by different techniques like FT-IR, SEM-EDS, TEM, TGA-DTA and XPS. The catalyst has shown to be highly active in Suzuki-Miyaura cross-coupling reaction of various aryl halides and aryl boronic acids in ethanol at room temperature. The activity of catalyst and the nature of product were highly dependent on the type of the solvent used, as well as the substituents present on the aryl halides. The protic polar solvent ethanol gave desired cross-coupling product in good to excellent yields at room temperature. However the aprotic polar solvent THF gave homocoupling product. The catalyst showed at least five times recyclability without a decrease in product yield. Keyword Palladium Ionic liquid SILP Immobilization Suzuki-Miyaura reaction 1 Introduction The past few decades have seen rapid development in the area of Pd catalyzed cross-coupling reactions [1,2]. Especially Suzuki-Miyaura cross-coupling reaction [3,4] has been studied more widely owing to the importance of this reaction in the synthesis of many natural products, pharmaceutical intermediates and organic-polymers [5]. As compared to analogous cross-coupling reactions, the Suzuki-Miyaura reaction can be carried out under mild reaction conditions. This reaction has been widely catalyzed by homogeneous catalysts as these catalysts are highly active [6]. However, the high price of Pd metal and its possible contamination in the final product still overwhelm its use in large-scale applications. To avoid these problems, air-stable, recyclable heterogeneous catalysts based on suitable solid supports like carbon, biopolymer, silica, zeolites, organic polymers have been developed [7–11]. In recent years, ionic liquids (ILs) have been engrossed considerable interest in transition metal catalysis as a green, non-volatile, recoverable and recyclable reaction media for biphasic reactions, because of the ease of product and catalyst separation [12,13]. There are many reports cited in literature in which IL itself acts as a ligand in the form of ‘N-Heterocyclic Carbene’ (NHC) complexes [14]. Nevertheless, due to the substantial amount of ILs are required for biphasic separation and its high preparation cost, many of these ILs are used in very small amounts, in the form of ‘Supported Ionic Liquid Phase’ (SILP).. Though the ‘Supported Liquid Phase Catalysts (SLPC)’ have been reported previously [15], in recent years there is an upsurge in the application of SILP catalysts in many catalytic reactions [16,17]. The concept of SILP involves a formation of thin films of ILs containing metal catalysts, on the surface of a suitable solid support. This system leads to a significant decrease in the amount of IL as well as it increases the contact area between the two phases that enhances efficiency of the catalysts. The SILP concept also allows ease of catalyst separation and recycling. This ability of SILP catalysts can permit its potential use mainly in fixed-bed reactors [18]. In recent years only few numbers of Pd-SILP catalysts based on organic polymers and silica have been reported for various cross-coupling reactions [19–26]. While only one report mentioned by Gruttadauria et al. [27] for Pd supported on multi-layered, covalently supported ionic liquid phase (mlc-SILP) catalyst for the Suzuki-Miyaura cross-coupling reaction in aqueous medium. Recently we reported applications of amine functionalized ligands [28] supported on silica [29] as well as alumina-cellulose composite [30] for phosphine-free Suzuki-Miyaura cross-coupling reaction. In this link, we proposed to design highly efficient Pd supported on amine functioned SILP based on Merrifield resin. The conceptual picture of catalyst is represented in Fig. 1 . We speculated that the use of weakly binding amine would permit the facile ligand exchange and allows a much wider scope of σ-donation. Based on the precedent for using a SILP in the organic synthesis [31], we selected Pd@SILP-PS for the fast Suzuki-Miyaura cross-coupling reaction in ethanol at room temperature. 2 Results and discussion 2.1 Preparation of Pd@SILP-PS catalyst The procedure for preparing the Pd@SILP-PS catalyst is based on the modified method as described by Lee et al. [32] and schematically described in Scheme 1 . Initially, our synthesis began from the reaction of imidazole with Merrifield resin (4mmolg−1) to form imidazole functionalized resin (Imd-PS, 3.6mmolg−1). In a succeeding step, we geared up to support ethyllamine functioned imidazolium IL (IL-PS) on polymer by treating bromoethylamine·HBr with Imd-PS in the presence of K2CO3 in THF. The resulting IL-PS on treatment with Pd(OAc)2 at room temperature in ethanol gave Pd@SILP-PS catalyst. The content of anchored Pd on SILP was found to be 0.072mmolg−1 as determined by ICP-AES analysis. 2.2 Characterization of Pd@SILP-PS catalyst The prepared catalyst was then characterized by different characterization techniques like FT-IR, SEM-EDS, TEM, TG-DTA, and XPS. FT–IR analysis of materials is rather inconclusive, mainly due to relatively minor changes that reflect the lower amounts of the anchored ionic functionalities. However, in comparison with pure PS, FT-IR of Pd@SILP-PS gives a signal of quaternary imidazolium at 1101cm−1. The doublet at 3118 and 3228cm−1 indicate the presence of primary amine (NH2). SEM micrographs (Fig. 2 ) of (a) PS, (b) Imd-PS and (c) Pd@SILP-PS clearly reveal morphological changes in three materials. The uneven surface of the carrier beads of Imd-PS clearly indicates the modification in PS. As observed in the SEM image of Pd@SILP-PS, the immobilization of IL as well as Pd in the PS creates stress, which causes the breakdown of PS beads [33]. The deposition of palladium on Pd@SILP-PS catalyst was confirmed by detecting Pd species on polymer beads using energy dispersive X-ray spectroscopy (EDS) that was taken at random points on the surface (Fig. 3 ). Attempts to directly observe the PdNPs on SILP were done by using TEM analysis, which is shown in Fig. 4 . The catalyst consists of narrowly dispersed microspheres of about 1μm in diameter. As the thickness of the polymer sphere does not leave a clear observation of PdNPs. But at the edges a few extremely small PdNPs are visible. Most of PdNPs distributed homogeneously with the diameters bellow 10nm. The XPS data of Pd@SILP-PS catalyst (Fig. 5 ) shows two peaks at binding energy 340.44eV and 335.80eV for electron transitions of Pd 3d5/2 and 3d3/2, which clearly indicate that Pd is present in Pd (0) state. TGA analysis was carried out to investigate the thermal behavior of catalysts. TGA profile of Pd@SILP-PS shows that the catalyst is stable up to 345°C (Fig. 6 ). The high weight loss in two steps of around 84% at a temperature between 300 and 600°C was due to the oxidative decomposition of the IL and polymeric material. 2.3 Suzuki–Miyaura cross-coupling reaction by Pd@SILP-PS catalyst The catalytic activity of the prepared Pd@SILP-PS catalyst was evaluated for the Suzuki-Miyaura cross-coupling reaction at room temperature. At the beginning, to evaluate the influence of base and solvent, we selected 4-bromobenzophenone and phenylboronic acid as a model reaction companions (Scheme 2 ). The reaction was initially performed using 1mol% catalyst and 2mmolK2CO3 as a base in ethanol. A very good conversion was obtained in 10min at room temperature (Table 1 , entry 1). It was apparent that carbonate base was more effective in activating the substrates as compared to the K3PO4 (Table 1 , entry 2 and 3). Though, NaOAc work best in terms of reaction yield, the reaction was slightly sluggish (Table 1 , entry 4). We then studied the effect of the amount of base by performing the model reaction with decreasing amount of K2CO3. When the reaction was carried out under base-free conditions no product was formed (Table 1 , entry 5). The use of 1mmolK2CO3 work best indicating that the base is not needed for activation of phenylboronic acid, but its role is to neutralize the boric acid [34] as one equivalent base showed good conversion (95% yield) in 10min (Table 1 , entry 6). Next, the influence of nature, of solvent on catalytic activity was studied for model reaction, and it was observed that solvent play a very important role in determining the activity of the catalyst as well as the nature of the product. When the reaction was carried out in THF at room temperature, the only homocoupling product was observed product (Table 2 , entry 1). In toluene, no reaction was taking place at room temperature, but at 70°C temperature extensive homocoupling occurred (Table 2, entry 2), similarly DMF also gave the homocoupling product (Table 2, entry 3). No reaction was observed in acetonitrile at room temperature at a prolonged reaction time (Table 2 , entry 4). Unfortunately water is totally failed to convert reactants into a desired coupling product (Table 2, entry 5) even at elevated temperature. Thus, only ethanol was found to be best solvent for getting the desired product (Table 2 , entry 6). Thus the use of ethanol renders this protocol quite useful and amenable as it is easily available, cheap and environmental friendly. To show the applicability of catalyst for the Suzuki-Miyaura cross-coupling reaction, various aryl iodides, and bromides were reacted with different arylboronic acids under optimized reaction condition, and the consequences are demonstrated in Chart 1 . It was noted that the activity of Pd@SILP-PS was highly dependent on the nature of the group present on aryl halides as well arylboronic acids. Though the catalyst showed excellent activity for coupling aryl iodides with aryl boronic acids, aryl bromides were also found to be the best substrates giving good coupling yields. It is clear that the cross-coupling is efficient over a wide range of ortho- meta- and para-substituted aryl halides as well as variations in the electronic nature of the substituents. The catalysts also allowed smooth coupling of bromo- and iodo-anisole which are generally less active under room temperature. Again steric hindrance of aryl halides is not a major factor for the formation of biphenyls, as the cross-coupling reaction of ortho-substituted aryl halides are smoothly converted into a desired product in good-excellent yields. The coupling of heteroaryl bromides also occurs efficiently with moderate yield. For practical applications of heterogeneous catalysts, the lifetime of the catalyst and its level of reusability are very important for the industrial point of view. Hence, recyclability test of the catalyst was examined in the case of the model reaction under optimized reaction condition. After first use, the catalyst was recovered by simple filtration and extensively washed with aqueous ethanol, dichloromethane, and acetone. The catalyst was dried under vacuum and reused for the next reaction cycle and the consequences are described in Fig. 7 . It was noted that the yield of the product decreased slightly in the subsequent uses (95–91%) indicating that the catalyst remain in SILP. The TEM image of recycled catalyst showed that very slight agglomeration of Pd was observed (Fig. 4), indicating that SILP decreases the aggregation of PdNPs. 3 Conclusion In summary, we have described a synthesis of new Pd-SILP based on amino functionalized imidazolium ionic liquid based on Merrifield resin. This SILP catalyst was acting as an efficient, stable and recyclable catalyst for the Suzuki-Miyaura cross-coupling reactions involving various aryl halides and aryl boronic acids in ethanol at room temperature. The activity of the catalyst and the nature of the product were extremely dependent on the nature of the solvent used as well as the substituents present on the aryl halides. The prepared catalyst showed good recyclability, over five catalytic cycles with a slight decrease in product yield and no substantial Pd aggregation occurred. Acknowledgements We like to show our appreciation to the University Grants Commission, Government of India, New Delhi, for enduring this work under the scheme of Major Research Project [F.No.41-182/2014 (SR)]. Appendix A Supplementary data Supplementary data associated with this article can be found, in the online version, at http://dx.doi.org/10.1016/j.mcat.2017.08.023. Appendix A Supplementary data The following is Supplementary data to this article: References [1] A. de Meijere F. Diederich Metal Cross-Coupling 2004 Wiley-VCH Reactions Weinheim [2] M. Beller C. Bolm Transition Metals for Organic Synthesis 2nd ed. 2004 Wiley-VCH Weinheim [3] A. Fihri M. Bouhrara B. Nekoueishahraki J.M. Basset V. Polshettiwar Chem. Soc. Rev. 2011 5181 5203 [4] N. Miyaura A. Suzuki Chem. Rev. 95 1995 2457 2483 [5] S. Budavari M.J. ONeil A. Smith The Merk Index: An Encyclopedia of Chemicals, Drugs and Biologicals twelfth ed. 1996 Merk & Co USA [6] C. Seechurn M. Kitching T. Colacot V. Snieckus Angew. Chem. Int. Ed. 51 2012 5062 5085 [7] S. Jadhav A. Kumbhar C. Rode R. Salunkhe Green Chem. 18 2016 1898 1911 [8] A. Kumbhar R. Salunkhe Curr. Org. Chem. 19 2015 2075 2121 [9] Molnar Chem. Rev 111 2011 2251 2320 [10] C. Polshettiwar A. Len Fihri Coord Chem. Rev 253 2009 2599 2626 [11] A. Kumbhar Top. Curr. Chem. 375 2017 2 10.1007/s41061-016-0084-5 (Z) [12] P. Wasserscheid T. Welton Ionic Liquids in Synthesis 2002 Wiley-VCH Weinheim [13] Q. Zhang S. Zhang Y. Deng Green Chem. 13 2011 2619 2637 [14] G.C. Fortman S.P. Nolan Chem. Soc. Rev. 40 2011 5151 5169 [15] P.R. Rony, J.F. Roth US Patent 3855307 (1974). [16] C.P. Mehnert Chem. Eur. J. 11 2005 50 56 [17] R. Skoda-Földes Molecules 19 2014 8840 8884 [18] A. Riisager R. Fehrmann S. Flicker R. Hal M. Haumann P. Wasserscheid Angew. Chem. Int. Ed. 44 2005 815 819 [19] S. Jadhav A. Kumbhar S. Mali C.K. Hong R. Salunkhe New J. Chem. 39 2015 2333 2341 [20] S.T. Gadge E.N. Kusumawati K. Harada T. Sasaki D. Nishio-Hamaned B.M. Bhanage J. Mol. Catal. A: Chem. 400 2015 170 178 [21] S. Ghosh R. Dey S. Ahammed B.C. Ranu Clean Technol. Environ. Policy 16 2014 1767 1771 [22] H. Hagiwara T. Nakamura T. Hoshi T. Suzuki Green Chem. 13 2011 1133 1137 [23] X. Ma Y. Zhou J. Zhang A. Zhu T. Jiang B. Han Green Chem. 10 2008 59 66 [24] J.-P. Mikkola P. Virtanen H. Karhu T. Salmi D.Y. Murzin Green Chem. 8 2006 197 205 [25] J. Huang T. Jiang H. Gao B. Han Z. Liu W. Wu Y. Chang G. Zhao Angew. Chem. Int. Ed. 43 2004 1397 1399 [26] S. Breitenlechner M. Fleck T.E. Müller A. Suppan J. Mol. Catal. A: Chem. 214 2004 175 179 [27] M. Gruttadauria L.F. Liotta A.M.P. Salvo F. Giacalone V.L. Parola C. Aprile R. Noto Adv. Synth. Catal. 353 2011 2119 2130 [28] A. Kumbhar J. Organomet. Chem. 848 2017 22 88 [29] A. Kumbhar S. Kamble S. Jadhav G. Rashinkar R. Salunkhe Catal. Lett. 142 2012 1388 1396 [30] A. Kumbhar S. Jadhav S. Kamble G. Rashinkar R. Salunkhe Tetrahedron Lett. 54 2013 1331 1337 [31] G. Rashinkar S. Kamble A. Kumbhar R. Salunkhe Catal. Commun. 12 2011 1442 1447 [32] H.-J. Cho S.-M. Lee S. Jung T.-K. Lee H.-J. Yoon Y.-S. Lee Tetrahedron Lett. 52 2011 1459 1461 [33] G. Deshayes K. Poelmans I. Verbruggen C. Camacho P. Degee V. Pinoie J. Martins M. Piotto M. Biesemans R. Willem P. Dubois Chem. Eur. J. 11 2005 4552 4556 [34] S. Carrettin J. Guzman A. Corma Angew. Chem. 44 2005 2242 2245",
      "scopus-id": "85029621479",
      "coredata": {
        "eid": "1-s2.0-S2468823117304789",
        "dc:description": "A new Pd-SILP based on amino functionalized imidazolium ionic liquid immobilized on Merrifield resin (Pd@SILP-PS) has been synthesized. The catalyst was characterized by different techniques like FT-IR, SEM-EDS, TEM, TGA-DTA and XPS. The catalyst has shown to be highly active in Suzuki-Miyaura cross-coupling reaction of various aryl halides and aryl boronic acids in ethanol at room temperature. The activity of catalyst and the nature of product were highly dependent on the type of the solvent used, as well as the substituents present on the aryl halides. The protic polar solvent ethanol gave desired cross-coupling product in good to excellent yields at room temperature. However the aprotic polar solvent THF gave homocoupling product. The catalyst showed at least five times recyclability without a decrease in product yield.",
        "openArchiveArticle": "false",
        "prism:coverDate": "2017-12-31",
        "openaccessUserLicense": null,
        "prism:aggregationType": "Journal",
        "prism:url": "https://api.elsevier.com/content/article/pii/S2468823117304789",
        "dc:creator": [
          {
            "@_fa": "true",
            "$": "More, Sagar"
          },
          {
            "@_fa": "true",
            "$": "Jadhav, Sanjay"
          },
          {
            "@_fa": "true",
            "$": "Salunkhe, Rajashri"
          },
          {
            "@_fa": "true",
            "$": "Kumbhar, Arjun"
          }
        ],
        "link": [
          {
            "@_fa": "true",
            "@rel": "self",
            "@href": "https://api.elsevier.com/content/article/pii/S2468823117304789"
          },
          {
            "@_fa": "true",
            "@rel": "scidir",
            "@href": "https://www.sciencedirect.com/science/article/pii/S2468823117304789"
          }
        ],
        "dc:format": "application/json",
        "openaccessType": null,
        "pii": "S2468-8231(17)30478-9",
        "prism:volume": "442",
        "prism:publisher": "Elsevier B.V.",
        "dc:title": "Palladium supported ionic liquid phase catalyst (Pd@SILP-PS) for room temperature Suzuki-Miyaura cross-coupling reaction",
        "prism:copyright": "© 2017 Elsevier B.V. All rights reserved.",
        "openaccess": "0",
        "prism:issn": "24688231",
        "dcterms:subject": [
          {
            "@_fa": "true",
            "$": "Palladium"
          },
          {
            "@_fa": "true",
            "$": "Ionic liquid"
          },
          {
            "@_fa": "true",
            "$": "SILP"
          },
          {
            "@_fa": "true",
            "$": "Immobilization"
          },
          {
            "@_fa": "true",
            "$": "Suzuki-Miyaura reaction"
          }
        ],
        "openaccessArticle": "false",
        "prism:publicationName": "Molecular Catalysis",
        "openaccessSponsorType": null,
        "prism:pageRange": "126-132",
        "prism:endingPage": "132",
        "pubType": "fla",
        "prism:coverDisplayDate": "December 2017",
        "prism:doi": "10.1016/j.mcat.2017.08.023",
        "prism:startingPage": "126",
        "dc:identifier": "doi:10.1016/j.mcat.2017.08.023",
        "openaccessSponsorName": null
      },
      "objects": {
        "object": [
          {
            "@category": "thumbnail",
            "@height": "164",
            "@width": "201",
            "@_fa": "true",
            "$": "https://api.elsevier.com/content/object/eid/1-s2.0-S2468823117304789-fx1.sml?httpAccept=%2A%2F%2A",
            "@multimediatype": "GIF image file",
            "@type": "IMAGE-THUMBNAIL",
            "@size": "4998",
            "@ref": "fx1",
            "@mimetype": "image/gif"
          },
          {
            "@category": "thumbnail",
            "@height": "114",
            "@width": "219",
            "@_fa": "true",
            "$": "https://api.elsevier.com/content/object/eid/1-s2.0-S2468823117304789-gr1.sml?httpAccept=%2A%2F%2A",
            "@multimediatype": "GIF image file",
            "@type": "IMAGE-THUMBNAIL",
            "@size": "8845",
            "@ref": "gr1",
            "@mimetype": "image/gif"
          },
          {
            "@category": "thumbnail",
            "@height": "68",
            "@width": "219",
            "@_fa": "true",
            "$": "https://api.elsevier.com/content/object/eid/1-s2.0-S2468823117304789-gr2.sml?httpAccept=%2A%2F%2A",
            "@multimediatype": "GIF image file",
            "@type": "IMAGE-THUMBNAIL",
            "@size": "9094",
            "@ref": "gr2",
            "@mimetype": "image/gif"
          },
          {
            "@category": "thumbnail",
            "@height": "141",
            "@width": "219",
            "@_fa": "true",
            "$": "https://api.elsevier.com/content/object/eid/1-s2.0-S2468823117304789-gr3.sml?httpAccept=%2A%2F%2A",
            "@multimediatype": "GIF image file",
            "@type": "IMAGE-THUMBNAIL",
            "@size": "6182",
            "@ref": "gr3",
            "@mimetype": "image/gif"
          },
          {
            "@category": "thumbnail",
            "@height": "164",
            "@width": "148",
            "@_fa": "true",
            "$": "https://api.elsevier.com/content/object/eid/1-s2.0-S2468823117304789-gr4.sml?httpAccept=%2A%2F%2A",
            "@multimediatype": "GIF image file",
            "@type": "IMAGE-THUMBNAIL",
            "@size": "14462",
            "@ref": "gr4",
            "@mimetype": "image/gif"
          },
          {
            "@category": "thumbnail",
            "@height": "164",
            "@width": "202",
            "@_fa": "true",
            "$": "https://api.elsevier.com/content/object/eid/1-s2.0-S2468823117304789-gr5.sml?httpAccept=%2A%2F%2A",
            "@multimediatype": "GIF image file",
            "@type": "IMAGE-THUMBNAIL",
            "@size": "5587",
            "@ref": "gr5",
            "@mimetype": "image/gif"
          },
          {
            "@category": "thumbnail",
            "@height": "147",
            "@width": "219",
            "@_fa": "true",
            "$": "https://api.elsevier.com/content/object/eid/1-s2.0-S2468823117304789-gr6.sml?httpAccept=%2A%2F%2A",
            "@multimediatype": "GIF image file",
            "@type": "IMAGE-THUMBNAIL",
            "@size": "6153",
            "@ref": "gr6",
            "@mimetype": "image/gif"
          },
          {
            "@category": "thumbnail",
            "@height": "163",
            "@width": "202",
            "@_fa": "true",
            "$": "https://api.elsevier.com/content/object/eid/1-s2.0-S2468823117304789-gr7.sml?httpAccept=%2A%2F%2A",
            "@multimediatype": "GIF image file",
            "@type": "IMAGE-THUMBNAIL",
            "@size": "16376",
            "@ref": "gr7",
            "@mimetype": "image/gif"
          },
          {
            "@category": "thumbnail",
            "@height": "163",
            "@width": "94",
            "@_fa": "true",
            "$": "https://api.elsevier.com/content/object/eid/1-s2.0-S2468823117304789-pl1.sml?httpAccept=%2A%2F%2A",
            "@multimediatype": "GIF image file",
            "@type": "IMAGE-THUMBNAIL",
            "@size": "3633",
            "@ref": "pl1",
            "@mimetype": "image/gif"
          },
          {
            "@category": "thumbnail",
            "@height": "62",
            "@width": "219",
            "@_fa": "true",
            "$": "https://api.elsevier.com/content/object/eid/1-s2.0-S2468823117304789-sc1.sml?httpAccept=%2A%2F%2A",
            "@multimediatype": "GIF image file",
            "@type": "IMAGE-THUMBNAIL",
            "@size": "2507",
            "@ref": "sc1",
            "@mimetype": "image/gif"
          },
          {
            "@category": "thumbnail",
            "@height": "37",
            "@width": "219",
            "@_fa": "true",
            "$": "https://api.elsevier.com/content/object/eid/1-s2.0-S2468823117304789-sc2.sml?httpAccept=%2A%2F%2A",
            "@multimediatype": "GIF image file",
            "@type": "IMAGE-THUMBNAIL",
            "@size": "1610",
            "@ref": "sc2",
            "@mimetype": "image/gif"
          },
          {
            "@category": "standard",
            "@height": "245",
            "@width": "301",
            "@_fa": "true",
            "$": "https://api.elsevier.com/content/object/eid/1-s2.0-S2468823117304789-fx1.jpg?httpAccept=%2A%2F%2A",
            "@multimediatype": "JPEG image file",
            "@type": "IMAGE-DOWNSAMPLED",
            "@size": "10825",
            "@ref": "fx1",
            "@mimetype": "image/jpeg"
          },
          {
            "@category": "standard",
            "@height": "295",
            "@width": "565",
            "@_fa": "true",
            "$": "https://api.elsevier.com/content/object/eid/1-s2.0-S2468823117304789-gr1.jpg?httpAccept=%2A%2F%2A",
            "@multimediatype": "JPEG image file",
            "@type": "IMAGE-DOWNSAMPLED",
            "@size": "40257",
            "@ref": "gr1",
            "@mimetype": "image/jpeg"
          },
          {
            "@category": "standard",
            "@height": "224",
            "@width": "715",
            "@_fa": "true",
            "$": "https://api.elsevier.com/content/object/eid/1-s2.0-S2468823117304789-gr2.jpg?httpAccept=%2A%2F%2A",
            "@multimediatype": "JPEG image file",
            "@type": "IMAGE-DOWNSAMPLED",
            "@size": "30213",
            "@ref": "gr2",
            "@mimetype": "image/jpeg"
          },
          {
            "@category": "standard",
            "@height": "485",
            "@width": "753",
            "@_fa": "true",
            "$": "https://api.elsevier.com/content/object/eid/1-s2.0-S2468823117304789-gr3.jpg?httpAccept=%2A%2F%2A",
            "@multimediatype": "JPEG image file",
            "@type": "IMAGE-DOWNSAMPLED",
            "@size": "26977",
            "@ref": "gr3",
            "@mimetype": "image/jpeg"
          },
          {
            "@category": "standard",
            "@height": "519",
            "@width": "470",
            "@_fa": "true",
            "$": "https://api.elsevier.com/content/object/eid/1-s2.0-S2468823117304789-gr4.jpg?httpAccept=%2A%2F%2A",
            "@multimediatype": "JPEG image file",
            "@type": "IMAGE-DOWNSAMPLED",
            "@size": "56124",
            "@ref": "gr4",
            "@mimetype": "image/jpeg"
          },
          {
            "@category": "standard",
            "@height": "306",
            "@width": "376",
            "@_fa": "true",
            "$": "https://api.elsevier.com/content/object/eid/1-s2.0-S2468823117304789-gr5.jpg?httpAccept=%2A%2F%2A",
            "@multimediatype": "JPEG image file",
            "@type": "IMAGE-DOWNSAMPLED",
            "@size": "18917",
            "@ref": "gr5",
            "@mimetype": "image/jpeg"
          },
          {
            "@category": "standard",
            "@height": "479",
            "@width": "715",
            "@_fa": "true",
            "$": "https://api.elsevier.com/content/object/eid/1-s2.0-S2468823117304789-gr6.jpg?httpAccept=%2A%2F%2A",
            "@multimediatype": "JPEG image file",
            "@type": "IMAGE-DOWNSAMPLED",
            "@size": "42237",
            "@ref": "gr6",
            "@mimetype": "image/jpeg"
          },
          {
            "@category": "standard",
            "@height": "304",
            "@width": "376",
            "@_fa": "true",
            "$": "https://api.elsevier.com/content/object/eid/1-s2.0-S2468823117304789-gr7.jpg?httpAccept=%2A%2F%2A",
            "@multimediatype": "JPEG image file",
            "@type": "IMAGE-DOWNSAMPLED",
            "@size": "50840",
            "@ref": "gr7",
            "@mimetype": "image/jpeg"
          },
          {
            "@category": "standard",
            "@height": "978",
            "@width": "565",
            "@_fa": "true",
            "$": "https://api.elsevier.com/content/object/eid/1-s2.0-S2468823117304789-pl1.jpg?httpAccept=%2A%2F%2A",
            "@multimediatype": "JPEG image file",
            "@type": "IMAGE-DOWNSAMPLED",
            "@size": "111425",
            "@ref": "pl1",
            "@mimetype": "image/jpeg"
          },
          {
            "@category": "standard",
            "@height": "203",
            "@width": "715",
            "@_fa": "true",
            "$": "https://api.elsevier.com/content/object/eid/1-s2.0-S2468823117304789-sc1.jpg?httpAccept=%2A%2F%2A",
            "@multimediatype": "JPEG image file",
            "@type": "IMAGE-DOWNSAMPLED",
            "@size": "24944",
            "@ref": "sc1",
            "@mimetype": "image/jpeg"
          },
          {
            "@category": "standard",
            "@height": "112",
            "@width": "659",
            "@_fa": "true",
            "$": "https://api.elsevier.com/content/object/eid/1-s2.0-S2468823117304789-sc2.jpg?httpAccept=%2A%2F%2A",
            "@multimediatype": "JPEG image file",
            "@type": "IMAGE-DOWNSAMPLED",
            "@size": "14432",
            "@ref": "sc2",
            "@mimetype": "image/jpeg"
          },
          {
            "@category": "standard",
            "@_fa": "true",
            "$": "https://api.elsevier.com/content/object/eid/1-s2.0-S2468823117304789-mmc1.docx?httpAccept=%2A%2F%2A",
            "@multimediatype": "Microsoft Word file",
            "@type": "APPLICATION",
            "@size": "1755545",
            "@ref": "mmc1",
            "@mimetype": "application/word"
          }
        ]
      },
      "link": {
        "@rel": "abstract",
        "@href": "https://api.elsevier.com/content/abstract/scopus_id/85029621479"
      }
    }
  }
}