{
  "metadata": {
    "title": "Enhanced CO<ce:inf loc=post>2</ce:inf> methanation activity of Ni-Rutile-based catalyst by tuning the metal−support interaction with Fe doping",
    "authors": "; ; ",
    "journal": "Molecular Catalysis",
    "date": "2024-05-01",
    "doi": "10.1016/j.mcat.2024.114132",
    "abstract": "",
    "uri": "https://api.elsevier.com/content/article/pii/S2468823124003158",
    "pii": "S2468823124003158"
  },
  "fulltext": {
    "full-text-retrieval-response": {
      "scopus-eid": "2-s2.0-85189860360",
      "originalText": "serial JL 315758 291210 291744 291790 291809 31 Molecular Catalysis MOLECULARCATALYSIS 2024-04-11 2024-04-11 2024-04-11 2024-04-11 2024-04-25T19:58:46 1-s2.0-S2468823124003158 S2468-8231(24)00315-8 S2468823124003158 10.1016/j.mcat.2024.114132 S300 S300.1 FULL-TEXT 1-s2.0-S2468823124X00061 2024-05-29T22:20:55.075092Z 0 0 20240501 2024 2024-04-12T00:04:52.812775Z absattachment articleinfo articlenumber articletitlenorm authfirstinitialnorm authfirstsurnamenorm cid cids contenttype copyright crossmark dateloaded dateloadedtxt datesearch datesort dateupdated dco docsubtype doctype doi eid ewtransactionid hubeid indexeddate issn issnnorm itemstage itemtransactionid itemweight openaccess openarchive pg pgfirst pii piinorm pubdatestart pubdatetxt pubyr sectiontitle sortorder srctitle srctitlenorm srctype ssids alllist content subj subheadings suppl tomb volfirst volissue volumelist webpdf webpdfpagecount yearnav figure table e-component body mmlmath acknowledge affil appendices articletitle auth authfirstini authfull authkeywords authlast footnotes grantnumber grantsponsor grantsponsorid highlightsabst orcid primabst ref specialabst 2468-8231 24688231 true 560 560 C Volume 560 15 114132 114132 114132 20240501 1 May 2024 2024-05-01 2024 Regular Papers article fla © 2024 Elsevier B.V. All rights reserved. ENHANCEDCO2METHANATIONACTIVITYNIRUTILEBASEDCATALYSTBYTUNINGMETALSUPPORTINTERACTIONFEDOPING ZHOU N 1 Introduction 2 Experimental 2.1 Materials 2.2 Support synthesis 2.3 Catalyst preparation 2.4 Catalyst characterization 2.5 Activity test 3 Results and discussion 4 Conclusion Declaration of generative AI and AI-assisted technologies in the writing process CRediT authorship contribution statement Acknowledgements Appendix Supplementary materials References PARK 2020 2628 2642 C SHEVCHENKO 2023 855 858 E SULLIVAN 2021 952 958 I WANG 2023 9 Z STERNBERG 2016 4156 4165 A VOGT 2019 188 197 C LEE 2021 2 19 W LV 2020 C TSIOTSIAS 2021 28 A RIDZUAN 2022 N RAY 2017 525 537 K MILLET 2019 2451 2461 M WU 2015 4154 4163 H TAN 2019 1538 1548 J ZHAO 2021 B BAI 2021 J DEPIANO 2024 1007 1019 G TSIOTSIAS 2022 1121836 A MUTZ 2017 6802 6814 B ZHAO 2020 119307 B DEPIANO 2022 118540 G ZHANG 2023 T SPATARU 2024 468 481 D VANDEELEN 2019 955 970 T LIU 2022 154466 D WANG 2023 7132 7138 D YE 2024 R CISNEROS 2021 S MAKDEE 2022 A LI 2019 6342 6348 J ONI 2024 113774 B WANG 2004 14789 14792 W LI 2022 465 478 D LIU 2017 241 248 Y ZNAD 2018 218 227 H WANG 2020 1422 1444 H LI 2020 623 682 Z HO 1998 34 48 S XU 2017 7600 7609 M WIERZBICKI 2020 10423 10432 D EWALD 2019 71 80 S TANG 2021 111602 R PAN 2014 74 78 Q LI 2018 641 648 M DENG 2021 120033 G TAUSTER 1978 29 35 S TAUSTER 1978 170 175 S TAUSTER 1981 1121 1125 S PK 1987 33 46 R LI 2022 1268 1287 Y LIU 2012 10251 10258 X ZHANG 2016 4528 4534 S MATSUBU 2017 120 127 J XU 2016 227 237 J WU 2019 18449 18453 T YANG 2017 36 44 C CHEN 2021 118318 S PANAGIOTOPOULOU 2006 114 125 P ALBELADI 2023 1104 N MONAI 2023 644 651 M HUANG 2021 16381 16390 X LU 2014 18894 18907 H OWGI 2022 42250 42265 A ZHOUX2024X114132 ZHOUX2024X114132XN 2026-04-11T00:00:00.000Z 2026-04-11T00:00:00.000Z http://creativecommons.org/licenses/by-nc-nd/4.0/ © 2024 Elsevier B.V. All rights reserved. 2024-04-26T16:25:56.061Z http://vtw.elsevier.com/data/voc/AddOnTypes/50.7/aggregated-refined National Natural Science Foundation of China 21902040 NSFC National Natural Science Foundation of China http://data.elsevier.com/vocabulary/SciValFunders/501100001809 http://sws.geonames.org/1814991 Natural Science Foundation of Hebei Province B2019201158 Natural Science Foundation of Hebei Province http://data.elsevier.com/vocabulary/SciValFunders/501100003787 http://sws.geonames.org/1814991/ This work was supported by the National Natural Science Foundation of China (21902040), and the Natural Science Foundation of Hebei Province (B2019201158). https://doi.org/10.15223/policy-017 https://doi.org/10.15223/policy-037 https://doi.org/10.15223/policy-012 https://doi.org/10.15223/policy-029 https://doi.org/10.15223/policy-004 item S2468-8231(24)00315-8 S2468823124003158 1-s2.0-S2468823124003158 10.1016/j.mcat.2024.114132 315758 2024-05-29T22:20:55.075092Z 2024-05-01 1-s2.0-S2468823124003158-main.pdf https://s3-eu-west-1.amazonaws.com/prod-ucs-content-store-eu-west/content/pii:S2468823124003158/MAIN/application/pdf/df6a68044f19749930569476116df07b/main.pdf main.pdf pdf true 11046300 MAIN 9 1-s2.0-S2468823124003158-main_1.png https://s3-eu-west-1.amazonaws.com/prod-ucs-content-store-eu-west/content/pii:S2468823124003158/PREVIEW/image/png/f58fd7d2b09b350d060b03542aed8d47/main_1.png main_1.png png 58141 849 656 IMAGE-WEB-PDF 1 1-s2.0-S2468823124003158-gr1.jpg https://s3-eu-west-1.amazonaws.com/prod-ucs-content-store-eu-west/content/pii:S2468823124003158/gr1/DOWNSAMPLED/image/jpeg/cf1877945a9ba24721b5044ec4113db4/gr1.jpg gr1 gr1.jpg jpg 64150 338 621 IMAGE-DOWNSAMPLED 1-s2.0-S2468823124003158-gr2.jpg https://s3-eu-west-1.amazonaws.com/prod-ucs-content-store-eu-west/content/pii:S2468823124003158/gr2/DOWNSAMPLED/image/jpeg/19c08da1ebd308fc1c4798a03d087276/gr2.jpg gr2 gr2.jpg jpg 130087 386 753 IMAGE-DOWNSAMPLED 1-s2.0-S2468823124003158-ga1.jpg https://s3-eu-west-1.amazonaws.com/prod-ucs-content-store-eu-west/content/pii:S2468823124003158/ga1/DOWNSAMPLED/image/jpeg/652e2d02f17718872d975681b0bac7dc/ga1.jpg ga1 true ga1.jpg jpg 21130 192 500 IMAGE-DOWNSAMPLED 1-s2.0-S2468823124003158-gr5.jpg https://s3-eu-west-1.amazonaws.com/prod-ucs-content-store-eu-west/content/pii:S2468823124003158/gr5/DOWNSAMPLED/image/jpeg/19391ea91cda250a25b2998cf255325e/gr5.jpg gr5 gr5.jpg jpg 61918 292 696 IMAGE-DOWNSAMPLED 1-s2.0-S2468823124003158-gr6.jpg https://s3-eu-west-1.amazonaws.com/prod-ucs-content-store-eu-west/content/pii:S2468823124003158/gr6/DOWNSAMPLED/image/jpeg/3c94eaffb68bc67e935cd16b718f6143/gr6.jpg gr6 gr6.jpg jpg 107924 386 753 IMAGE-DOWNSAMPLED 1-s2.0-S2468823124003158-gr3.jpg https://s3-eu-west-1.amazonaws.com/prod-ucs-content-store-eu-west/content/pii:S2468823124003158/gr3/DOWNSAMPLED/image/jpeg/3b2d0e515d84ebcf13b9001ee626a011/gr3.jpg gr3 gr3.jpg jpg 38228 239 640 IMAGE-DOWNSAMPLED 1-s2.0-S2468823124003158-gr4.jpg https://s3-eu-west-1.amazonaws.com/prod-ucs-content-store-eu-west/content/pii:S2468823124003158/gr4/DOWNSAMPLED/image/jpeg/a58c4eb2b0a46855434aad417a7301b8/gr4.jpg gr4 gr4.jpg jpg 43277 296 489 IMAGE-DOWNSAMPLED 1-s2.0-S2468823124003158-gr7.jpg https://s3-eu-west-1.amazonaws.com/prod-ucs-content-store-eu-west/content/pii:S2468823124003158/gr7/DOWNSAMPLED/image/jpeg/efe1b5cf3185358e627395090496310d/gr7.jpg gr7 gr7.jpg jpg 46764 256 621 IMAGE-DOWNSAMPLED 1-s2.0-S2468823124003158-gr1.sml https://s3-eu-west-1.amazonaws.com/prod-ucs-content-store-eu-west/content/pii:S2468823124003158/gr1/THUMBNAIL/image/gif/75e58877b59ed7a6ba74f0b3cf03d055/gr1.sml gr1 gr1.sml sml 17469 119 219 IMAGE-THUMBNAIL 1-s2.0-S2468823124003158-gr2.sml https://s3-eu-west-1.amazonaws.com/prod-ucs-content-store-eu-west/content/pii:S2468823124003158/gr2/THUMBNAIL/image/gif/3b78d668918c4e45ed2026c1de656bd0/gr2.sml gr2 gr2.sml sml 23020 112 219 IMAGE-THUMBNAIL 1-s2.0-S2468823124003158-ga1.sml https://s3-eu-west-1.amazonaws.com/prod-ucs-content-store-eu-west/content/pii:S2468823124003158/ga1/THUMBNAIL/image/gif/814ad6e072496f39cd64ab0c4532522e/ga1.sml ga1 true ga1.sml sml 9741 84 219 IMAGE-THUMBNAIL 1-s2.0-S2468823124003158-gr5.sml https://s3-eu-west-1.amazonaws.com/prod-ucs-content-store-eu-west/content/pii:S2468823124003158/gr5/THUMBNAIL/image/gif/b3904e0518ff8dd8e01f9e0bcd235aca/gr5.sml gr5 gr5.sml sml 14223 92 219 IMAGE-THUMBNAIL 1-s2.0-S2468823124003158-gr6.sml https://s3-eu-west-1.amazonaws.com/prod-ucs-content-store-eu-west/content/pii:S2468823124003158/gr6/THUMBNAIL/image/gif/87217781fe64246b518eac3e26171ba1/gr6.sml gr6 gr6.sml sml 19755 112 219 IMAGE-THUMBNAIL 1-s2.0-S2468823124003158-gr3.sml https://s3-eu-west-1.amazonaws.com/prod-ucs-content-store-eu-west/content/pii:S2468823124003158/gr3/THUMBNAIL/image/gif/57e3972590891776571114172e36fc73/gr3.sml gr3 gr3.sml sml 9643 82 219 IMAGE-THUMBNAIL 1-s2.0-S2468823124003158-gr4.sml https://s3-eu-west-1.amazonaws.com/prod-ucs-content-store-eu-west/content/pii:S2468823124003158/gr4/THUMBNAIL/image/gif/3cc121d1b95906fc22a1ad193b71273a/gr4.sml gr4 gr4.sml sml 16361 132 219 IMAGE-THUMBNAIL 1-s2.0-S2468823124003158-gr7.sml https://s3-eu-west-1.amazonaws.com/prod-ucs-content-store-eu-west/content/pii:S2468823124003158/gr7/THUMBNAIL/image/gif/8bd0185a0cc4946cb57575c706f7ab40/gr7.sml gr7 gr7.sml sml 12289 90 219 IMAGE-THUMBNAIL 1-s2.0-S2468823124003158-gr1_lrg.jpg https://s3-eu-west-1.amazonaws.com/prod-ucs-content-store-eu-west/content/pii:S2468823124003158/HIGHRES/image/jpeg/c574488ea75187243d318217715c8484/gr1_lrg.jpg gr1 gr1_lrg.jpg jpg 480894 1495 2750 IMAGE-HIGH-RES 1-s2.0-S2468823124003158-gr2_lrg.jpg https://s3-eu-west-1.amazonaws.com/prod-ucs-content-store-eu-west/content/pii:S2468823124003158/HIGHRES/image/jpeg/67fe31e2513daf29e74b424522ea312a/gr2_lrg.jpg gr2 gr2_lrg.jpg jpg 1018064 1708 3333 IMAGE-HIGH-RES 1-s2.0-S2468823124003158-ga1_lrg.jpg https://s3-eu-west-1.amazonaws.com/prod-ucs-content-store-eu-west/content/pii:S2468823124003158/HIGHRES/image/jpeg/2b00a6f8ce68bb60df3a539addc26b0b/ga1_lrg.jpg ga1 true ga1_lrg.jpg jpg 146838 848 2213 IMAGE-HIGH-RES 1-s2.0-S2468823124003158-gr5_lrg.jpg https://s3-eu-west-1.amazonaws.com/prod-ucs-content-store-eu-west/content/pii:S2468823124003158/HIGHRES/image/jpeg/e1476f6494e46416a280c635e6397e1c/gr5_lrg.jpg gr5 gr5_lrg.jpg jpg 465568 1295 3083 IMAGE-HIGH-RES 1-s2.0-S2468823124003158-gr6_lrg.jpg https://s3-eu-west-1.amazonaws.com/prod-ucs-content-store-eu-west/content/pii:S2468823124003158/HIGHRES/image/jpeg/f55479285f8b59f64d4534fc92a26eaa/gr6_lrg.jpg gr6 gr6_lrg.jpg jpg 879360 1709 3333 IMAGE-HIGH-RES 1-s2.0-S2468823124003158-gr3_lrg.jpg https://s3-eu-west-1.amazonaws.com/prod-ucs-content-store-eu-west/content/pii:S2468823124003158/HIGHRES/image/jpeg/e0e818f4230793095dfe514cb1a902db/gr3_lrg.jpg gr3 gr3_lrg.jpg jpg 264400 1059 2833 IMAGE-HIGH-RES 1-s2.0-S2468823124003158-gr4_lrg.jpg https://s3-eu-west-1.amazonaws.com/prod-ucs-content-store-eu-west/content/pii:S2468823124003158/HIGHRES/image/jpeg/fde706b33aa7d91b1d14a93afdf8dd44/gr4_lrg.jpg gr4 gr4_lrg.jpg jpg 314029 1310 2167 IMAGE-HIGH-RES 1-s2.0-S2468823124003158-gr7_lrg.jpg https://s3-eu-west-1.amazonaws.com/prod-ucs-content-store-eu-west/content/pii:S2468823124003158/HIGHRES/image/jpeg/42b63909050206855d09bd8fff683446/gr7_lrg.jpg gr7 gr7_lrg.jpg jpg 345236 1132 2750 IMAGE-HIGH-RES 1-s2.0-S2468823124003158-mmc1.docx https://s3-eu-west-1.amazonaws.com/prod-ucs-content-store-eu-west/content/pii:S2468823124003158/mmc1/MAIN/application/vnd.openxmlformats-officedocument.wordprocessingml.document/5e9ee274eae829c609c0afe5862baec1/mmc1.docx mmc1 mmc1.docx docx 7654681 APPLICATION 1-s2.0-S2468823124003158-si1.svg https://s3-eu-west-1.amazonaws.com/prod-ucs-content-store-eu-west/content/pii:S2468823124003158/image/svg+xml/524c3b5b8e7f1e25361c31f089f1ffc4/si1.svg si1 si1.svg svg 15145 ALTIMG 1-s2.0-S2468823124003158-si2.svg https://s3-eu-west-1.amazonaws.com/prod-ucs-content-store-eu-west/content/pii:S2468823124003158/image/svg+xml/4b74e9c37961616b11387139e4f2cce4/si2.svg si2 si2.svg svg 15514 ALTIMG 1-s2.0-S2468823124003158-si3.svg https://s3-eu-west-1.amazonaws.com/prod-ucs-content-store-eu-west/content/pii:S2468823124003158/image/svg+xml/5ac816b32a98268c061b4a02b9994a26/si3.svg si3 si3.svg svg 13015 ALTIMG 1-s2.0-S2468823124003158-si4.svg https://s3-eu-west-1.amazonaws.com/prod-ucs-content-store-eu-west/content/pii:S2468823124003158/image/svg+xml/7d4d0f8393c37aaf4ddda8819682037a/si4.svg si4 si4.svg svg 4251 ALTIMG 1-s2.0-S2468823124003158-si5.svg https://s3-eu-west-1.amazonaws.com/prod-ucs-content-store-eu-west/content/pii:S2468823124003158/image/svg+xml/f772eb2156e3cdda30944d2b9543cc29/si5.svg si5 si5.svg svg 4666 ALTIMG 1-s2.0-S2468823124003158-si6.svg https://s3-eu-west-1.amazonaws.com/prod-ucs-content-store-eu-west/content/pii:S2468823124003158/image/svg+xml/241329548a737432499aafca2bcbde7a/si6.svg si6 si6.svg svg 4527 ALTIMG 1-s2.0-S2468823124003158-si7.svg https://s3-eu-west-1.amazonaws.com/prod-ucs-content-store-eu-west/content/pii:S2468823124003158/image/svg+xml/3136d6e5d4117cf4a7a12e0c765388f0/si7.svg si7 si7.svg svg 4101 ALTIMG 1-s2.0-S2468823124003158-am.pdf am am.pdf pdf 2742700 AAM-PDF https://s3-eu-west-1.amazonaws.com/prod-ucs-content-store-eu-west/content/egi:101RPJ5QHWZ/MAIN/application/pdf/aa7d75c084087f48f2ba5b2e17012d1f/am.pdf MCAT 114132 114132 S2468-8231(24)00315-8 10.1016/j.mcat.2024.114132 Elsevier B.V. Fig. 1 (a) XRD patterns of the series freshly reduced Ni/Support samples; (b) The enlargement of the range 42º ∼ 48º; (c) Fitting results of the XRD patterns in the range of 43–47° in Fig. a. Fig 1 Fig. 2 STEM images and STEM-EDX elemental maps for the freshly reduced Ni/Support samples: (a) Ni/Rutile; (b) Ni/grind-FeR and (c) Ni/Fe-Rutile. Fig 2 Fig. 3 (a) Catalytic performance of the Ni/Support samples and the Fe-Rutile-H (the Fe-Rutile support reduced at 500 °C) for CO2 methanation tested at 360 °C. Reaction conditions: 0.1 MPa, feed flow: 4 vol% H2 + 1 vol% CO2 balanced with Ar, 50 mL/min; 40 mg catalyst (diluted with an equal amount of SiO2 powder), WHSV = 75,000 ml gcat −1 h−1; (b) The CO2 conversion curves as a function of reaction time on the series Ni samples tested at 360 °C. Reaction conditions: 0.1 MPa, feed flow: 4 vol% H2 + 1 vol% CO2 balanced with Ar, 50 mL/min; X mg of catalyst (diluted with an equal amount of SiO2 powder, where X = 40, 80 and 100 mg for the Ni/Fe-Rutile, Ni/grind-FeR and Ni/Rutile, respectively). Fig 3 Fig. 4 (a) H2-TPR profiles of NiO/Rutile, NiO/grind-FeR and NiO/Fe-Rutile. (b) CO2-TPD profiles of the Ni/Rutile, Ni/grind-FeR and Ni/Fe-Rutile. Fig 4 Fig. 5 (a) XPS Ni 2p3/2 spectra of the freshly reduced Ni/Support catalysts; (b) XPS Ti 2p spectra of the freshly reduced Ni/Support catalysts; (c) Actual and theoretical XPS Ni 2p3/2 area ratio of the freshly reduced Ni/Support samples. Fig 5 Fig. 6 STEM images and STEM-EDX elemental maps for the freshly reduced Ni/Support samples: (a) Ni/Rutile; (b) Ni/grind-FeR and (c) Ni/Fe-Rutile. Fig 6 Fig. 7 TG-DTG profiles of the spent catalysts: (a) TG profiles and (b) DTG profiles. Fig 7 Table 1 Physicochemical properties and catalytic performance of series Ni/Support samples. Table 1 Samples Ni a (wt%) Fe a (wt%) DNi b (nm) SSA c (m2 g-1) Pore volume d (cm3 g-1) XPS Catalytic performance f Ni 2p3/2 area ratio e Ni0/Nitotal Ti3+/Titotal Conv. CO2 g (%) TOF h (s-1) Ni/Rutile 10.4 – 47 12.4 0.08 0.33 81 6.9 4.0 0.01 Ni/grind-FeR 10.8 0.1 44 19.2 0.08 0.45 84 9.8 15.4 0.03 Ni/Fe-Rutile 10.4 0.1 31 12.6 0.06 1.00 82 0 34.6 0.06 i a Measured by ICP-OES; b Measured by TEM; c Obtained from BET method. d Obtained from BJH desorption branch of the N2 physisorption isotherms. e The ratio of Ni 2p3/2 area of each sample to the Ni 2p3/2 area of the Ni/Fe-Rutile; f Tested at 360 °C with a feed gas composition of 4 vol% H2 + 1 vol% CO2 + 95 vol% Ar; g Feed gas flow rate is 50 mL/min, 40 mg catalyst (diluted with 40 mg of SiO2); h The Ni dispersion was calculated according to D = 0.9/dNi , where d means diameter; i Feed gas flow rate is 100 mL/min, 20 mg catalyst (diluted with 20 mg of SiO2). Enhanced CO2 methanation activity of Ni-Rutile-based catalyst by tuning the metal−support interaction with Fe doping Nan Zhou Writing – original draft Visualization Data curation a c 1 Xiaoqing Jia Visualization Data curation a 1 Siyuan Chen Writing – review & editing a c Huafan Li Methodology Data curation a Feifei Li Methodology Formal analysis a Botao Qiao Writing – review & editing c Hailian Tang Writing – review & editing Supervision Project administration a ⁎ Guoyi Bai Writing – review & editing Supervision Project administration b ⁎ a Key Laboratory of Medicinal Chemistry and Molecular Diagnosis of Ministry of Education, College of Chemistry and Materials Science, Hebei University, Baoding 071002, China Key Laboratory of Medicinal Chemistry and Molecular Diagnosis of Ministry of Education College of Chemistry and Materials Science Hebei University Baoding 071002 China aKey Laboratory of Medicinal Chemistry and Molecular Diagnosis of Ministry of Education, College of Chemistry and Materials Science, Hebei University, Baoding 071002, China b Key Laboratory of Chemical Biology of Hebei Province, College of Chemistry and Environmental Science, Hebei University, Baoding 071002, China Key Laboratory of Chemical Biology of Hebei Province College of Chemistry and Environmental Science Hebei University Baoding 071002 China bKey Laboratory of Chemical Biology of Hebei Province, College of Chemistry and Environmental Science, Hebei University, Baoding 071002, China c CAS Key Laboratory of Science and Technology on Applied Catalysis, Dalian Institute of Chemical Physics, Chinese Academy of Sciences, Dalian 116023, China CAS Key Laboratory of Science and Technology on Applied Catalysis Dalian Institute of Chemical Physics Chinese Academy of Sciences Dalian 116023 China cCAS Key Laboratory of Science and Technology on Applied Catalysis, Dalian Institute of Chemical Physics, Chinese Academy of Sciences, Dalian 116023, China ⁎ Corresponding authors. 1 These authors contribute equally to this work. CO2 methanation is an effective way for CO2 recycling, and nickel-based catalysts have attracted much attention in this field due to their excellent CH4 selectivity and cost-effectiveness; however, their applications are limited by their suboptimal catalytic activity. In this work, the catalytic activity of Ni-rutile-based catalysts was increased by almost an order of magnitude simply by doping the rutile with Fe. Series characterizations show that three factors that mainly contributed to the improved catalytic performance of the Ni/Fe-Rutile, which are the reduction of the Ni size, the increase of the basic sites, and the inhibition of the encapsulation of the Ni particles by the support. With Fe doping, the OH and oxygen vacancies on the rutile surface were reduced, which made the support difficult to reduce and thus suppressed the encapsulation of Ni by the support. As a result, the number of exposed active sites on the Ni/Fe-Rutile which with a smaller Ni size was further successfully increased, and the catalytic activity was significantly improved. This study provides new ideas for the design of activity-enhanced supported catalysts from the perspective of tuning the metal-support interaction and may be applicable to other reducible oxide-supported metal catalysts. Graphical abstract Image, graphical abstract Keywords Fe doping Nickel catalyst CO2 methanation Metal−support interaction Catalytic activity Data availability The authors do not have permission to share data. 1 Introduction The rapid economic development is accompanied by the large-scale consumption of fossil fuels and the massive emission of greenhouse gasses, mainly CO2, which will inevitably cause a more serious greenhouse effect and further aggravate the global warming phenomenon. Therefore, the promotion of large-scale CO2 capture and conversion has become one of the current research hotspots [1–4]. As an important basic carbon source, CO2 can be hydrogenated to produce a more valuable clean fuel CH4, a process known as methanation (i.e. Sabatier reaction), which is now a promising approach to mitigate CO2 emissions [5,6]. However, as CO2 methanation is an exothermic process, the catalyst used typically exhibits poor CH4 selectivity at high temperatures due to the thermodynamics and tends to produce by-product of CO, while at low temperatures it generally exhibits an unsatisfactory CO2 conversion due to the poor catalytic activity for kinetic reasons [7,8]. The development of highly efficient catalysts with excellent methane selectivity is therefore of great importance and has already become one of the main research goals in this field. Ni-based catalysts have attracted a great deal of attention in the context of CO2 methanation due to their exceptional methane selectivity and affordability [9,10]. However, the limited reactivity of conventional Ni-based catalysts, particularly under low-temperature reaction conditions, restricts their application. As such, it is imperative to enhance the catalytic activity of Ni-based catalysts. Considerable efforts are currently being made to achieve this goal, and the strategies can roughly be divided into two categories according to their direct-action target. One is the method that acts directly on the nickel species, which improves the catalytic performance of the catalysts by optimizing the preparation method of the catalysts or by introducing a second active metal to reduce the Ni particle size or to adjust the chemical state of the nickel species [11–16]. For instance, Gennari et al. studied on the Al2O3 supported Ni-CeO2-based catalysts and found that for the CO2 hydrogenation, the catalyst synthesized by simultaneous impregnation of NiO and CeO2 was more active than the catalyst synthesized by successive impregnation. They associated this result with the contribution of both oxygen vacancies and Ni-O-Ce solid solution at the surface, inducing a superior reducibility and more labile moderate basic sites [17]. Moreover, the importance of the Ni-O-Ce on the basicity of the catalyst was also highlighted in the work of Goula et al., which compared the varies sol-gel preparation methods of the Pr-doped CeO2 supported Ni catalyst [18]. The effect of alloying has been investigated by series reports [9,19–22], for example, in the work of Bacariza et al. the catalytic activity of Ni15/USY was effectively improved after Fe introduction. This improvement was attributed to the establishment of stronger Ni-support interactions and the formation of smaller and better dispersed Ni0 particles owning to the presence of Fe-Ni alloys [23]. The other category starts from the support, as numerous studies show that metal-support interactions have a significant influence on the catalytic activity of the nanocatalysts [24–27]. This category is mainly based on doping, compounding, or gas pretreatment of the support to achieve a tuning of the interaction strength between the metal and the support, thus modifying or increasing the exposed active sites on the nickel particles to ultimately improve the catalytic activity of the catalyst [28–30]. For example, in the work of Oni et al., investigated the importance of the synergistic effects between the Ni active sites, the promoter (Pr2O3 and MgO) and the support (MCM-41) on the methanation of CO2. It was found that the inclusion of MgO-Pr2O3 has a positive effect on the catalyst, such as the better Ni dispersion and the increased CO2 adsorption sites, which all benefit the catalytic activities of the catalysts [31]. Another typical example is that in the work of the Bao's group [30], the strength of the strong metal-support interaction (SMSI) between Ni species and anatase TiO2 was successfully tuned by pretreating the anatase with ammonia or hydrogen, achieving an order of magnitude increase in catalyst activity and the product shift from all-CO to CH4 dominated. In this work, the catalytic activity of the Ni-rutile based catalyst for CO2 hydrogenation was significantly enhanced by almost an order of magnitude by simply doping the rutile support with Fe. Further studies show that this method of Fe doping has considerably enhanced the Ni-rutile interaction while reducing the content of hydroxyl and oxygen vacancies on the support surface compared to the method of adding Fe by physical grinding, where the former allows the catalyst to maintain a small Ni particle size, while the latter makes the support difficult to reduce, thus inhibiting the encapsulation of Ni by the support to some extent. Finally, the number of active sites exposed on the Ni/Fe-Rutile catalyst increased significantly due to the aforementioned factors, resulting in a marked improvement in the catalytic activity of the catalyst. 2 Experimental 2.1 Materials All chemicals were of analytical grade and were used as purchased without further purification unless otherwise specified. Titanium tetrachloride (TiCl4, 99.9 % metal basis), hydrochloric acid (HCl, ACS reagent, 37 %), nickel nitrate hexahydrate (Ni(NO3)2·6H2O, 99.99 % metal basis) and ferric oxide (γ-Fe2O3, 10 nm,98 % metal basis) were purchased from Aladdin Biochemical Technology Co., Ltd. 2.2 Support synthesis Rutile TiO2 was synthesized by a hydrolysis method [32]. Typically, under ice-water bath conditions, 5 mL of TiCl4 was added into 13 mL of HCl solution (∼37 wt%). Then, the solution volume was increased to 150 mL by adding ultrapure water. After adding a certain mass of γ-Fe2O3, the resulting solution was heated to 60 °C and stirred for 4 h, and then aged for 1 h at room temperature. The precipitates were then filtered, washed several times with ultrapure water to remove Cl− ions and dried in an oven at 80 °C overnight. After further calcination of the powder sample at 500 °C under air flow for 4 h, Fe-doped rutile was obtained and denoted Fe-Rutile. The iron-free rutile (i.e. rutile) was synthesized by the same method as that of the Fe-Rutile, except that no γ-Fe2O3 was added in the process. In addition, for comparison, some rutile was mixed with γ-Fe2O3 and ground in an agate mortar for 15 min. The mixed powder was further calcined at 500 °C for 4 h under air flow and labeled as grind-FeR. The actual Fe content of Fe-Rutile and grind-FeR is the same, with a value of 0.1 wt%. In some cases, Fe-Rutile and grind-FeR were further reduced at 500 °C for 2 h under 10 vol% H2-Ar flow and labelled as Fe-Rutile-H and grind-FeR-H, respectively. 2.3 Catalyst preparation Ni species were introduced onto the support by a wet-impregnation method with a target loading of 10 wt% [33]. Typically, Ni(NO3)2·6H2O (0.55 g) was dissolved in 30 mL of ultrapure water, and then 1.0 g of support was added to this solution. After stirring for 1 h at room temperature, the suspension was transferred to a 60 °C water bath and stirred continuously until the water was completely evaporated. The obtained sample was further calcined under air flow at 500 °C for 4 h and denoted NiO/Support (Support = Rutile, Fe-Rutile and grind-FeR). The NiO/Support was further reduced at 500 °C for 2 h under H2 flow and the resulting catalysts were denoted as Ni/Support. 2.4 Catalyst characterization Actual content of Ni and Fe were determined by an inductively coupled plasma-optical emission spectrometer (ICP-OES) using an IRIS Intrepid II XSP instrument (Thermo Electron Corporation). X-ray diffraction (XRD) was carried out on a Bruker D8 ADVANCE X-ray diffractometer with a Cu Kα (λ = 1.5418 Å) monochromatic radiation source from 10° to 80° at a scan rate of 10°/min. High resolution transmission electron microscopy (HRTEM), scanning transmission electron microscopy (STEM) and energy dispersive X-ray spectroscopy (EDX) analyses were performed with a JEOL JEM-2100F microscope. Before microscopy examination, the catalysts were ultrasonically dispersed in ethanol and then a drop of the solution was put onto microgrid carbon polymer supported on copper grid. The N2 adsorption/desorption isotherm was performed on a Micromeritics TriStar II 3020 at −196 °C. Prior to the experiments, freshly reduced Ni/support samples (∼100 mg) were degassed under vacuum at 350 °C for 4 h to completely clean the surface. The Brunauer-Emmett-Teller method and the Barrett-Joynerr-Halenda desorption isotherm model were used to determine the specific surface area and pore volume respectively. Hydrogen temperature-programmed reduction (H2-TPR) was performed on a chemisorption instrument (Micromeritics AutoChem II 2920). 50 mg of calcined NiO/Support sample was pre-treated at 200 °C under a flow of Ar (30 mL/min) for 1 h in a quartz tube reactor. After the sample was cooled to room temperature, a gas flow of 5 vol% H2/Ar (30 mL/min) was introduced, and the sample was heated up to 700 °C on a ramp of 10 °C/min, with the effluents monitored by an on-line mass spectrometer. CO2 temperature-programmed desorption (CO2-TPD) characterizations were also performed out on the chemisorption instrument (Micromeritics AutoChem II 2920). First, NiO/Support samples were treated under an Ar atmosphere at 200 °C for 1 h to obtain the clean surfaces. They were then reduced at 500 °C for 2 h under 10 vol% H2-Ar flow. After reduction, the gas was switched to Ar and maintained for 1 h. Then the system was cooled to ∼50 °C and a CO2 flow was introduced for 30 min for adsorption, which followed by a He treatment for 30 min to remove the physically adsorbed gas. Finally, the temperature was continuously increased to 700 °C on a ramp of 10 °C/min and the desorbed CO2 was monitored by a thermal conductivity detector (TCD). X-ray photoelectron spectroscopy (XPS) analysis was conducted on a Thermo ESCALAB 250Xi system with monochromatic Al Kα radiation (1486.68 eV). The binding energy was calibrated by contamination carbon C 1 s peak (284.6 eV) as a reference. For the spectra of the three Ni samples, before the test, the samples of NiO/Support (Support = Fe-Rutile, Rutile and grind-FeR) were reduced at 500 °C in H2 atmosphere for 2 h in a microquartz tube reactor and were stored in the same tube until the XPS measurements were performed. Thermogravimetric-Differential Thermal Analysis (TG-DTG) was performed on a NETZSCH STA 449F5 (Germany) operated under 20 vol% O2/80 vol% N2 flow with a heating rate of 10 °C/min. 2.5 Activity test The catalytic performance of the catalysts was evaluated on a fixed bed reactor operating at atmospheric pressure. The system is also equipped with a water trap, which is located between the fixed bed reactor and the gas chromatography (Panna A91 Plus), is used to remove water vapor (generated by the reaction) from the gas stream. The catalyst which diluted with an equal amount of SiO2 powder (40–60 mesh) was loaded in the quartz reactor and reduced in situ at 500 °C under a flow of 10 vol% H2-Ar (30 mL/min) for 2 h at atmospheric pressure prior to reaction. A pre-mixed stream of CO2, H2, and Ar (4 vol% H2 + 1 vol% CO2 + 95 vol% Ar; 50 mL/min, with a weight hourly space velocity of 75,000 ml gcat −1 h−1) was used as the feed gas, and Ar was used as the carrier gas for online gas chromatograph analysis. Hayesep Q and 5A molecular sieve-packed columns connected to the TCD were used for the quantification CO, CO2, and CH4. CO2 conversion was calculated on a carbon atom basis, i.e. C O 2 conversion ( % ) = [ C O 2 ] in − [ C O 2 ] out [ C O 2 ] in × 100 % CH4 selectivity and CO selectivity were calculated as the following: C H 4 selectivity ( % ) = [ C H 4 ] out [ C H 4 ] out + [ CO ] out × 100 % CO selectivity ( % ) = 100 − C H 4 selectivity ( % ) Where, [ C O 2 ] in and [ C O 2 ] out represent the moles of CO2 in the feed and effluent, respectively, and [ C H 4 ] out and [ CO ] out represent the moles of CH4 and CO in the effluent, respectively. 3 Results and discussion The XRD patterns of the series catalysts after reduction are presented in Fig. 1 . All the XRD patterns of the three freshly reduced Ni samples mainly show the characteristic diffraction peaks of rutile (Fig. 1a), indicating that the rutile form of TiO2 has been successfully prepared, and the introduction of Fe species has not affected the crystalline structure of the support. For the Ni/Fe-Rutile and Ni/grind-FeR, no diffraction peaks assigned to Fe species are detected as the content of Fe species is too low (0.1 wt%, Table 1 ) to reach the detection limit of the XRD. In addition to the rutile patterns, diffraction peaks of Ni (111) located at 2θ = 44.5° are observed in all samples, indicating that all the Ni species have been reduced to metallic Ni. It is noticeable that the full width at half maximum (FWHM) of the samples are different and the Ni/Fe-Rutile has the widest FWHM. According to the Scherrer equation, the widest FWHM demonstrates the smallest calculated particle size. Therefore, the above results indicate that the Ni/Fe-Rutile sample has the smallest Ni particle size. This was further confirmed by the electron microscopy results as shown in Fig. 2 and Fig. S1. The Ni/Fe-Rutile sample has the smallest Ni particle size, with a mean diameter of 31 nm, much smaller than the 44 and 47 nm of the Ni/grind-FeR and Ni/Rutile samples, respectively. We also note that for the two samples with added Fe, Ni/Fe-Rutile and Ni/grind-FeR, although the Fe species are highly dispersed in both samples and with the same content, there is a large difference in their Ni particle sizes (31 vs. 44 nm), suggesting that the method of Fe introduction has an important effect on the dispersion of nickel species, although it does not affect the dispersion of Fe species. The effect of Fe addition on the specific surface area (SSA) and porosity of the samples was also studied and the results are shown in Fig. S2 and Table 1. All the three freshly reduced Ni catalysts exhibit the same type IV isotherm with H3 hysteresis loops, which indicating wedge/slit shaped pores [17,34,35]. There is no obvious effect of Fe inclusion on the pore structure of the Ni-TiO2, and this result was entirely predictable, since the rutile-TiO2 we prepared is not a porous material (as further shown by the pore volume in the Table 1). The BET SSA of Ni/Fe-Rutile is almost the same as that of Ni/Rutile (12.6 vs. 12.4 m2 g−1), suggesting that the Fe doping did not affect the rutile crystallinity, which is consistent with the results of the XRD patterns where the diffraction peaks of rutile (110) at 2θ = 27.4° of the three Ni/Support are almost the same (Fig. 1a). For the Ni/grind-FeR sample, the SSA is slightly higher than for the other two (19.2 vs. ∼12 m2 g−1). This may be due to the grinding process which has further broken up the rutile particles. Overall, there is no obvious difference between the three Ni/Support samples in terms of the BET parameters (SSA, pore volume and type, etc.), so these factors have little influence on the Ni species size/distribution and further on the catalytic performance. For supported catalysts, the size of the metal particles is generally one of the most important factors in determining the catalytic performance, since the active sites of the catalysts are usually located on the surface of the metal particles [36,37]. In our case, the catalytic performance of the series Ni/Support catalysts for CO2 methanation is shown in Fig. 3 and Fig. S3. All three catalysts exhibited excellent reaction stability, and as expected, their catalytic activities differed significantly. Specifically, at a test temperature of 360 °C, the Ni/Rutile sample with the largest Ni size exhibited the lowest catalytic activity with a CO2 conversion of only 4 % and a CH4 selectivity of 100 %. In contrast, the Ni/Fe-Rutile with the smallest Ni size showed a CO2 conversion of 34.6 % with 100 % CH4 selectivity, almost achieved an order of magnitude increase in CO2 conversion compared to that of the Ni/Rutile. For a more accurate comparison, all CO2 conversions at 360 °C of the catalysts were controlled below 20 % by adjusting the catalyst weight and feed gas flow rate, and the corresponding TOF values were calculated, Table 1. The TOF value of the Ni/Fe-Rutile is 0.06 s−1, which is six times higher than the 0.01 s−1 of the Ni/Rutile, indicating a significantly improved catalytic activity of the Ni/Fe-Rutile. It should be noted that although Fe is generally an active metal for the CO2 methanation, in our experiments, the newly reduced Fe-Rutile-H support is inactive under this reaction condition due to its very low Fe content (0.1 wt%, Table 1), suggesting that the enhanced activity of Fe introduction on Ni-based catalysts is not simply in the form of Fe as a second active metal. It is worth noting that after introducing Fe into the Ni catalyst by a physical grinding, the Ni/grind-FeR catalyst which with a mean Ni size of 44 nm shows a CO2 conversion of 15.4 % at 360 °C (100 % CH4 selectivity), which is about six times higher than that of the Ni/Rutile which with a similar Ni size (47 nm). This suggests that there are factors other than particle size that strongly influence the catalytic performance of the catalysts. In order to explore these factors and to further investigate the causes of the difference in Ni particle size of the catalysts, a series of characterization of the samples was carried out. To investigate the reducibility of Ni species on the three NiO/Support, hydrogen temperature-programmed reduction (H2-TPR) measurement was performed. As shown in Fig. 4a , for each of the Ni samples, there are three peaks falling in the range of 300∼500 °C, which are attributed to the reduction of NiO species with different interaction strengths with the support [38,39]. For the NiO/grind-FeR, the overall peak shape is similar to that of the NiO/Rutile sample, but the peak positions are slightly shifted towards higher temperatures, indicating that the Ni species are more difficult to reduce after the addition of Fe species to the sample [39]. For the NiO/Fe-Rutile sample, the same peak positions are observed as for the NiO/grind-FeR sample, accompanied by an increase in the proportion of the high temperature peak (peak III, located at 451 °C), indicating that this sample has the strongest Ni-support interaction among the three samples. This may be one of the main reasons that this sample has the smallest Ni particle size after the 500 °C reduction. In conclusion, after the high temperature reduction at 500 °C, the nickel species on all three samples were basically reduced to metallic nickel, while the addition of Fe species and the addition method affected the interaction strength between Ni and the support, ultimately leading to the differences in the Ni particle sizes of each catalyst. CO2-TPD was used to assess the strength of the active centres for CO2 adsorption, and the influence of Fe addition on the CO2 activation in the reaction. The CO2-TPD profiles of the freshly reduced Ni samples are shown in Fig. 4b. The basicity calculated from the obtained profiles is presented in Table S1. All the CO2-TPD profiles can be classified into weak basic sites (< 200 °C), moderate strong basic sites (200∼300 °C) and strong basic sites (> 300 °C), depending on the observed CO2 desorption temperature, and corresponding to the surface hydroxyl group, Lewis acid-base pairs, and low coordination surface O2−, respectively [40–42]. The samples of Ni/Fe-Rutile and Ni/grind-FeR showed a significant increase in CO2 desorption peak intensity compared to the Ni/Rutile in all three intervals, specifically, the total basicity of Ni/Fe-Rutile and Ni/grind-FeR is 2.4 and 3.8 times of that of the Ni/Rutile, respectively. The increase in total basicity should be attributed to the addition of Fe, similar effect has been observed in previous reports [23,40]. The greater increase in Ni/grind-FeR compared to Ni/Fe-Rutile is attributed to the higher Fe content on the surface of Ni/grind-FeR, although the Fe content is the same in the two samples: in the former, where Fe is added by physical milling, all of the Fe is present on the surface of the supports, whereas in the latter, where Fe is added by doping, some of the Fe is buried within the bulk rutile. Although the mechanism of CO2 conversion to methane is still controversial, it is generally accepted that the increase in basic sites, especially those of moderate strength, facilitates CO2 conversion [42,43]. Thus, in our case, the increase in activity of Ni/Fe-Rutile and Ni/grind-FeR was also related to the increase in basic sites induced by the addition of Fe. For example, this effect of Fe is likely to be one of the main reasons for the significant increase in activity of Ni/grind-FeR catalysts with the largest Ni particle size compared to Ni/Rutile catalysts. To further characterize the valence state of the nickel species of each sample, XPS measurements were performed on the Ni/Support samples. As shown in Fig. 5a , the XPS Ni 2p3/2 spectra of all three samples are dominated by the metallic Ni (Ni0) signal located at ∼852.5 eV, while a weak signal of Ni2+ at ∼853.7 eV is also detected, which should be attributed to the interfacial Ni species [44,45]. The percentage of Ni0 is almost identical in all three spectra, ranging from 81 % to 84 % (Table 1). Therefore, the influence of the Ni valence variation on the different activities of each catalyst can be largely eliminated. However, it is noteworthy that there is a significant difference in the XPS Ni 2p3/2 area between the catalysts, with the Ni/Fe-Rutile sample exhibiting the largest Ni 2p3/2 area and Ni/Ti ratio. This indicates a larger number of exposed nickel species on the Ni/Fe-Rutile sample. The discrepancy in the Ni 2p3/2 areas observed here cannot solely be attributed to the difference in Ni particle size between the samples. This is evidenced by the fact that the theoretical values of the Ni 2p3/2 areas for Ni/grind-FeR and Ni/Rutile, calculated based on their respective particle sizes, far exceed their actual measured values (Fig. 5c and Table S2, details can be found in Supplementary Information). Particularly for the Ni/Rutile, the measured value is only 50 % of the theoretical value (0.33 vs. 0.66, both normalized to the value of Ni/Fe-Rutile). In view of this, the possibility that strong metal-support interaction (SMSI) has occurred in the samples is considered, since the metal encapsulation by the support accompanying SMSI would lead to a decrease in the content of metal species detectable by XPS, and the TiO2-supported Ni-based catalyst after reduction at 500 °C is a typical SMSI catalyst [46–50]. To verify this speculation, the Ni particles located at the edge of the supports in the three samples were characterized by TEM to ascertain whether the surface of the Ni particles was encapsulated by the supports or not [51]. As shown in Fig. S4 and Fig. 6 , high-resolution transmission electron microscopy (HRTEM) images show that thin encapsulation layers are visible on the surface of the Ni particles in all samples, while STEM-EDX elemental maps show that Ti and O signals can be detected on the surface of the Ni particles, and Fe signals are also seen in the samples containing Fe. These results indicate that after reduction at 500 °C, a support encapsulation layer is present on the Ni surface over the three samples. However, it should be noted that there are no results showing that the chemisorption capacity of the catalysts for CO or H2 was dramatically decreased, which is the essential feature of SMSI. Therefore, we consider that there is a metal-support strong interaction (MSSI) on the catalyst system and, of course, it is most likely to be the SMSI effect. The degree of difference between the theoretical Ni 2p3/2 area and the actual Ni 2p3/2 area varies between the samples, suggesting that the three samples differ in the degree of encapsulation of the Ni particles by the support: the greater the difference, the more pronounced the encapsulation. What causes the difference in encapsulation? It is generally accepted that the coating layers on the metal particles, which with a reducible transition metal oxide as support, are formed from the partially reduced support [52,53], i.e. the reduction of the support is one of the prerequisites for the onset of encapsulation. In our samples, however, the degree of support reduction is clearly different, as evidenced by the fact that in the Ti 2p3/2 spectra of Ni/grind-FeR and Ni/Rutile, in addition to the Ti4+ peak at 458.8 eV, a weak Ti3+ peak at 457 eV is detected [54], whereas, in the spectrum of the Ni/Fe-Rutile, although the binding energy (B.E.) of Ti 2p3/2 was shifted to 458.1 eV, no Ti3+ signal was detected (Fig. 5b). In short, the support in the Ni/grind-FeR and Ni/Rutile samples was partially reduced, whereas no significant support reduction occurred in the Ni/Fe-Rutile sample, leading to the difference in the encapsulation degree of the samples. What then accounts for the differences in support reduction between the samples, especially for the samples Ni/Fe-Rutile and Ni/grind-FeR, which are identical regardless of element type and element content? This was explained by the XPS results of the calcined grind-FeR and Fe-Rutile. The Ti 2p and Fe 2p spectra of the two supports are basically the same (Fig. S5a-b), but their O 1 s spectra are significantly different (Fig. S5c and Table S3). The grind-FeR spectrum shows that there is a large amount of hydroxyl groups (-OH, 530.7 eV, 21 %) and surface oxygen vacancies (Ov, 532.1 eV, 5 %) in addition to the lattice O (Olatt, 529.6 eV) [55,56]. However, for the Fe-Rutile spectrum, not only contains less -OH (9 %), but also no Ov are detected. Generally, the surface Ov and -OH on the surface of metal oxides facilitate the reduction of metal oxides [57,58]. Therefore, for the Ni/Fe-Rutile, the lower Ov and -OH content resulted in the support being more difficult to reduce, and the catalyst ultimately exhibited a lower encapsulation degree of the Ni particles, with more Ni sites exposed on the surface, which further enhanced the catalytic performance of the catalysts. Finally, we carried out a series of characterizations on the spent catalysts after CO2 methanation, as there is a risk that the catalysts may undergo sintering [59], SMSI fading (i.e. encapsulation retreat) [60] and other changes during the reaction process that can seriously affect the catalytic performance. As shown in Figs. S6 and S7, the Ni particles on the three catalysts are still encapsulated by the support, so under the stabilizing effect of this encapsulation, the Ni particles did not undergo significant sintering during the reaction (Fig. S8 shows that the Ni particle size of the catalysts did not change significantly compared to those before the reaction). These results are consistent with the excellent stability performance of the three catalysts during the reaction (Fig. 3b). We also investigated the possible presence of carbon deposition, as it is an important factor affecting the catalytic stability of the catalysts. As shown in the Fig. 7 , the TG-DTG profiles of all samples showed the same tendency of variation: First a slightly decreasing trend before 200 °C and then an increasing trend at around 300 °C, after which the profiles decrease again from a temperature of 600 °C. The first decrease is due to the desorption of the adsorbed H2O. The mass increase in the range of 300 to 600 °C is caused by the oxidation of metallic Ni (from Ni to NiO, and finally to Ni2O3) in the catalyst at high temperatures in air [61,62]. The second decrease can be attributed to the formation of CO2 by oxidation of the carbon species deposited on the catalysts, and the peak temperatures of the weight loss rate of the deposited carbon are around 700–750 °C, indicating the formation of graphitic carbon deposited on the catalyst surface [61,63]. Overall, the TG-DTG profiles of the spent catalysts are basically the same, and the weight loss for them was insignificant and did not differ much from each other (0.7 %∼1.8 %), i.e. the effect of carbon deposition on the difference in activity of each catalyst can be negligible. 4 Conclusion In summary, Ni/Fe-Rutile catalyst was prepared by doping Fe into the rutile support, and its catalytic activity for CO2 methanation was significantly improved compared to other Ni catalysts which supported on an iron-free rutile support and a physical grinded Fe-Rutile support. It was found that the addition of Fe species during the rutile support preparation effectively improved the content of basic sites and enhanced the Ni/support interaction, resulting in a Ni/Fe-rutile catalyst with smaller Ni size and increased basic sites, all of which are beneficial to the catalytic activity. On the other hand, the addition of Fe has reduced the content of -OH and Ov on the support surface, thus inhibiting the reduction of the support, so that the catalyst is in a weak MSSI state and with a lower degree of encapsulation of the Ni particle. Under these effects of the Fe addition, the active sites of the Ni/Fe-Rutile catalyst were significantly increased, resulting in a significantly improved catalytic activity of the catalyst. In this study, it was found that a simple Fe doping method could be used to adjust the metal-support interaction of the catalyst system and consequently enhance the catalytic activity, which may provide a new idea for the design and preparation of new highly active supported catalysts. Declaration of generative AI and AI-assisted technologies in the writing process During the preparation of this work the author(s) used Deepl Pro-in order to improve the English grammar. After using this tool/service, the author(s) reviewed and edited the content as needed and take(s) full responsibility for the content of the publication. CRediT authorship contribution statement Nan Zhou: Writing – original draft, Visualization, Data curation. Xiaoqing Jia: Visualization, Data curation. Siyuan Chen: Writing – review & editing. Huafan Li: Methodology, Data curation. Feifei Li: Methodology, Formal analysis. Botao Qiao: Writing – review & editing. Hailian Tang: Writing – review & editing, Supervision, Project administration. Guoyi Bai: Writing – review & editing, Supervision, Project administration. Declaration of competing interest The authors declare that they have no known competing financial interests or personal relationships that could have appeared to influence the work reported in this paper. Acknowledgements This work was supported by the National Natural Science Foundation of China (21902040), and the Natural Science Foundation of Hebei Province (B2019201158). Supplementary materials Supplementary material associated with this article can be found, in the online version, at doi:10.1016/j.mcat.2024.114132. Appendix Supplementary materials Image, application 1 References [1] C. Park J. Lee Recent achievements in CO2-assisted and CO2-catalyzed biomass conversion reactions Green Chem. 22 2020 2628 2642 C. Park, J. Lee, Recent achievements in CO2-assisted and CO2-catalyzed biomass conversion reactions, Green Chem.., 22 (2020) 2628–2642. [2] E. Shevchenko A.-H.A. Park S. Sun T. Zhang Introduction to CO2 capture and conversion Nanoscale 15 2023 855 858 E. Shevchenko, A.-H.A. Park, S. Sun, T. Zhang, Introduction to CO2 capture and conversion, Nanoscale, 15 (2023) 855–858. [3] I. Sullivan A. Goryachev I.A. Digdaya X. Li H.A. Atwater D.A. Vermaas C. Xiang Coupling electrochemical CO2 conversion with CO2 capture Nat. Catal. 4 2021 952 958 I. Sullivan, A. Goryachev, I.A. Digdaya, X. Li, H.A. Atwater, D.A. Vermaas, C. Xiang, Coupling electrochemical CO2 conversion with CO2 capture, Nat. Catal., 4 (2021) 952–958. [4] Z. Wang Z. Zhang Interfacial catalysis of metal-oxide nanocatalysts in CO2 hydrogenation to value-added C1 chemicals J. Surf. Sci. Technol. 1 2023 9 Z. Wang, Z. Zhang, Interfacial catalysis of metal-oxide nanocatalysts in CO2 hydrogenation to value-added C1 chemicals, J. Surf. Sci. Technol., 1 (2023) 9. [5] A. Sternberg A. Bardow Life cycle assessment of power-to-gas: syngas vs methane ACS Sustain. Chem. Eng. 4 2016 4156 4165 A. Sternberg, A. Bardow, Life cycle assessment of power-to-gas: syngas vs methane, ACS Sustain. Chem. Eng., 4 (2016) 4156–4165. [6] C. Vogt M. Monai G.J. Kramer B.M. Weckhuysen The renaissance of the Sabatier reaction and its applications on Earth and in space Nat. Catal. 2 2019 188 197 C. Vogt, M. Monai, G.J. Kramer, B.M. Weckhuysen, The renaissance of the Sabatier reaction and its applications on Earth and in space, Nat. Catal., 2 (2019) 188–197. [7] W.J. Lee C.E. Li H. Prajitno J. Yoo J. Patel Y.X. Yang S. Lim Recent trend in thermal catalytic low temperature CO2 methanation: a critical review Catal. Today 368 2021 2 19 W.J. Lee, C.E. Li, H. Prajitno, J. Yoo, J. Patel, Y.X. Yang, S. Lim, Recent trend in thermal catalytic low temperature CO2 methanation: a critical review, Catal. Today, 368 (2021) 2–19. [8] C.F. Lv L.L. Xu M.D. Chen Y. Cui X.Y. Wen Y.P. Li C.E. Wu B. Yang Z.C. Miao X. Hu Q.H. Shou Recent progresses in constructing the highly efficient Ni based catalysts with advanced Low-temperature activity toward CO2 methanation Front. Chem. 8 2020 C.F. Lv, L.L. Xu, M.D. Chen, Y. Cui, X.Y. Wen, Y.P. Li, C.E. Wu, B. Yang, Z.C. Miao, X. Hu, Q.H. Shou, Recent progresses in constructing the highly efficient Ni based catalysts with advanced Low-temperature activity toward CO2 methanation, Front. Chem., 8 (2020). [9] A.I. Tsiotsias N.D. Charisiou I.V. Yentekakis M.A. Goula Bimetallic Ni-based catalysts for CO2 methanation: a review Nanomaterials 11 2021 28 A.I. Tsiotsias, N.D. Charisiou, I.V. Yentekakis, M.A. Goula, Bimetallic Ni-based catalysts for CO2 methanation: a review, Nanomaterials, 11 (2021) 28. [10] N.D.M. Ridzuan M.S. Shaharun M.A. Anawar I. Ud-Din Ni-based catalyst for carbon dioxide methanation: a review on performance and progress Catalysts 12 2022 N.D.M. Ridzuan, M.S. Shaharun, M.A. Anawar, I. Ud-Din, Ni-based catalyst for carbon dioxide methanation: a review on performance and progress, Catalysts, 12 (2022). [11] K. Ray G. Deo A potential descriptor for the CO2 hydrogenation to CH4 over Al2O3 supported Ni and Ni-based alloy catalysts Appl. Catal. B 218 2017 525 537 K. Ray, G. Deo, A potential descriptor for the CO2 hydrogenation to CH4 over Al2O3 supported Ni and Ni-based alloy catalysts, Appl. Catal. B, 218 (2017) 525–537. [12] M.M. Millet G. Algara-Siller S. Wrabetz A. Mazheika F. Girgsdies D. Teschner F. Seitz A. Tarasov S.V. Leychenko R. Schloegl E. Frei Ni single atom catalysts for CO2 activation J. Am. Chem. Soc. 141 2019 2451 2461 M.M. Millet, G. Algara-Siller, S. Wrabetz, A. Mazheika, F. Girgsdies, D. Teschner, F. Seitz, A. Tarasov, S.V. Leychenko, R. Schloegl, E. Frei, Ni single atom catalysts for CO2 activation, J. Am. Chem. Soc., 141 (2019) 2451–2461. [13] H.C. Wu Y.C. Chang J.H. Wu J.H. Lin I.K. Lin C.S. Chen Methanation of CO2 and reverse water gas shift reactions on Ni/SiO2 catalysts: the influence of particle size on selectivity and reaction pathway Catal. Sci. Technol. 5 2015 4154 4163 H.C. Wu, Y.C. Chang, J.H. Wu, J.H. Lin, I.K. Lin, C.S. Chen, Methanation of CO2 and reverse water gas shift reactions on Ni/SiO2 catalysts: the influence of particle size on selectivity and reaction pathway, Catal. Sci. Technol., 5 (2015) 4154–4163. [14] J. Tan J. Wang Z. Zhang Z. Ma L. Wang Y. Liu Highly dispersed and stable Ni nanoparticles confined by MgO on ZrO2 for CO2 methanation Appl. Surf. Sci. 481 2019 1538 1548 J. Tan, J. Wang, Z. Zhang, Z. Ma, L. Wang, Y. Liu, Highly dispersed and stable Ni nanoparticles confined by MgO on ZrO2 for CO2 methanation, Appl. Surf. Sci., 481 (2019) 1538–1548. [15] B. Zhao Q. Yang L. Qin W. Shan Q. Zhang W. Chen J. Han Nanoscale Ni enveloped in hydrochar prepared by one-step hydrothermal method for dry reforming of CH4 with CO2 Mol. Catal. 514 2021 B. Zhao, Q. Yang, L. Qin, W. Shan, Q. Zhang, W. Chen, J. Han, Nanoscale Ni enveloped in hydrochar prepared by one-step hydrothermal method for dry reforming of CH4 with CO2, Mol. Catal., 514 (2021). [16] J. Bai C. Cheng Y. Liu C. Wang Y. Liao L. Chen L. Ma Selective hydrogenation of levulinic acid to γ-valerolactone on Ni-based catalysts Mol. Catal. 516 2021 J. Bai, C. Cheng, Y. Liu, C. Wang, Y. Liao, L. Chen, L. Ma, Selective hydrogenation of levulinic acid to γ-valerolactone on Ni-based catalysts, Mol. Catal., 516 (2021). [17] G. De Piano J.J.A. Gamboa A.M. Condó F.C. Gennari CO2 methanation over nickel-CeO2 catalyst supported on Al2O3: different impregnation strategies and Ni-Ce ratios Int. J. Hydrog. Energy 56 2024 1007 1019 G. De Piano, J.J.A. Gamboa, A.M. Condó, F.C. Gennari, CO2 methanation over nickel-CeO2 catalyst supported on Al2O3: different impregnation strategies and Ni-Ce ratios, Int. J. Hydrog. Energy, 56 (2024) 1007–1019. [18] A.I. Tsiotsias N.D. Charisiou E. Harkou S. Hafeez G. Manos A. Constantinou A.G.S. Hussien A.A. Dabbawala V. Sebastian S.J. Hinder M.A. Baker K. Polychronopoulou M.A. Goula Enhancing CO2 methanation over Ni catalysts supported on sol-gel derived Pr2O3-CeO2: an experimental and theoretical investigation Appl. Catal. B-Environ. 318 2022 1121836 A.I. Tsiotsias, N.D. Charisiou, E. Harkou, S. Hafeez, G. Manos, A. Constantinou, A.G.S. Hussien, A.A. Dabbawala, V. Sebastian, S.J. Hinder, M.A. Baker, K. Polychronopoulou, M.A. Goula, Enhancing CO2 methanation over Ni catalysts supported on sol-gel derived Pr2O3-CeO2: an experimental and theoretical investigation, Appl. Catal. B-Environ., 318 (2022) 1121836. [19] B. Mutz M. Belimov W. Wang P. Sprenger M.A. Serrer D. Wang P. Pfeifer W. Kleist J.D. Grunwaldt Potential of an alumina-supported N3Fe Catalyst in the methanation of CO2: impact of alloy formation on activity and stability ACS Catal 7 2017 6802 6814 B. Mutz, M. Belimov, W. Wang, P. Sprenger, M.A. Serrer, D. Wang, P. Pfeifer, W. Kleist, J.D. Grunwaldt, Potential of an alumina-supported N3Fe Catalyst in the methanation of CO2: impact of alloy formation on activity and stability, ACS Catal., 7 (2017) 6802–6814. [20] B.R. Zhao P. Liu S. Li H.F. Shi X.Z. Jia Q.Q. Wang F. Yang Z.W. Song C. Guo J. Hu Z. Chen X.L. Yan X.X. Ma Bimetallic Ni-Co nanoparticles on SiO2 as robust catalyst for CO methanation: effect of homogeneity of Ni-Co alloy Appl. Catal. B-Environ. 278 2020 119307 B.R. Zhao, P. Liu, S. Li, H.F. Shi, X.Z. Jia, Q.Q. Wang, F. Yang, Z.W. Song, C. Guo, J. Hu, Z. Chen, X.L. Yan, X.X. Ma, Bimetallic Ni-Co nanoparticles on SiO2 as robust catalyst for CO methanation: effect of homogeneity of Ni-Co alloy, Appl. Catal. B-Environ., 278 (2020) 119307. [21] G. De Piano J.J.A. Gamboa A.M. Condó S. Bengió F.C. Gennari Bimetallic Ni-Fe catalysts for methanation of CO2: effect of the support nature and reducibility Appl. Catal. A-Gen. 634 2022 118540 G. De Piano, J.J.A. Gamboa, A.M. Condó, S. Bengió, F.C. Gennari, Bimetallic Ni-Fe catalysts for methanation of CO2: effect of the support nature and reducibility, Appl. Catal. A-Gen., 634 (2022) 118540. [22] T.F. Zhang P. Zheng J.J. Gao Z.N. Han F.N. Gu W.Q. Xu L.A. Li T.Y. Zhu Z.Y. Zhong G.W. Xu F.B. Su Single-Atom Ru Alloyed with Ni nanoparticles boosts CO2 Methanation Small 2023 T.F. Zhang, P. Zheng, J.J. Gao, Z.N. Han, F.N. Gu, W.Q. Xu, L.A. Li, T.Y. Zhu, Z.Y. Zhong, G.W. Xu, F.B. Su, Single-Atom Ru Alloyed with Ni nanoparticles boosts CO2 Methanation, Small, (2023). [23] D. Spataru D. Canastreiro K.S.D. Costa A. Quindimil J.M. Lopes P. Da Costa C. Henriques C. Bacariza Doping Ni/USY zeolite catalysts with transition metals for CO2 methanation Int. J. Hydrog. Energy 53 2024 468 481 D. Spataru, D. Canastreiro, K.S.D. Costa, A. Quindimil, J.M. Lopes, P. Da Costa, C. Henriques, C. Bacariza, Doping Ni/USY zeolite catalysts with transition metals for CO2 methanation, Int. J. Hydrog. Energy, 53 (2024) 468–481. [24] T.W. van Deelen C.H. Mejia K.P. de Jong Control of metal-support interactions in heterogeneous catalysts to enhance activity and selectivity Nat. Catal. 2 2019 955 970 T.W. van Deelen, C.H. Mejia, K.P. de Jong, Control of metal-support interactions in heterogeneous catalysts to enhance activity and selectivity, Nat. Catal., 2 (2019) 955–970. [25] D. Liu S. Gao J. Xu X. Zhang Z. Yang T. Yang B. Wang S. Yang C. Liang C. Kong Boron induced strong metal-support interaction for high sintering resistance of Pt-based catalysts toward oxygen reduction reaction Appl. Surf. Sci. 604 2022 154466 D. Liu, S. Gao, J. Xu, X. Zhang, Z. Yang, T. Yang, B. Wang, S. Yang, C. Liang, C. Kong, Boron induced strong metal-support interaction for high sintering resistance of Pt-based catalysts toward oxygen reduction reaction, Appl. Surf. Sci., 604 (2022) 154466. [26] D. Wang Z. Yuan X. Wu W. Xiong J. Ding Z. Zhang W. Huang Ni single atoms confined in nitrogen-doped carbon nanotubes for active and selective hydrogenation of CO2 to CO ACS Catal 13 2023 7132 7138 D. Wang, Z. Yuan, X. Wu, W. Xiong, J. Ding, Z. Zhang, W. Huang, Ni single atoms confined in nitrogen-doped carbon nanotubes for active and selective hydrogenation of CO2 to CO, ACS Catal., 13 (2023) 7132–7138. [27] R.P. Ye L.X. Ma X.L. Hong T.R. Reina W.H. Luo L.Q. Kang G. Feng R.B. Zhang M.H. Fan R.G. Zhang J. Liu Boosting low-temperature CO2 hydrogenation over Ni-based catalysts by tuning strong metal-support interactions Angew. Chem. Int. Ed. 63 2024 R.P. Ye, L.X. Ma, X.L. Hong, T.R. Reina, W.H. Luo, L.Q. Kang, G. Feng, R.B. Zhang, M.H. Fan, R.G. Zhang, J. Liu, Boosting low-temperature CO2 hydrogenation over Ni-based catalysts by tuning strong metal-support interactions, Angew. Chem. Int. Ed., 63 (2024). [28] S. Cisneros S.L. Chen T. Diemant J. Bansmann A.M. Abdel-Mageed M. Goepel S.E. Olesen E.S. Welter M. Parlinska-Wojtan R. Glaser I. Chorkendorff R.J. Behm Effects of SiO2-doping on high-surface-area Ru/TiO2 catalysts for the selective CO methanation Appl. Catal. B 282 2021 S. Cisneros, S.L. Chen, T. Diemant, J. Bansmann, A.M. Abdel-Mageed, M. Goepel, S.E. Olesen, E.S. Welter, M. Parlinska-Wojtan, R. Glaser, I. Chorkendorff, R.J. Behm, Effects of SiO2-doping on high-surface-area Ru/TiO2 catalysts for the selective CO methanation, Appl. Catal. B, 282 (2021). [29] A. Makdee P. Kidkhunthod Y. Poo-arporn K.C. Chanapattharapol Enhanced CH4 selectivity for CO2 methanation over Ni-TiO2 by addition of Zr promoter J. Environ. Chem. Eng. 10 2022 A. Makdee, P. Kidkhunthod, Y. Poo-arporn, K.C. Chanapattharapol, Enhanced CH4 selectivity for CO2 methanation over Ni-TiO2 by addition of Zr promoter, J. Environ. Chem. Eng., 10 (2022). [30] J. Li Y. Lin X. Pan D. Miao D. Ding Y. Cui J. Dong X. Bao Enhanced CO2 methanation activity of Ni/Anatase catalyst by tuning strong metal–support interactions ACS Catal. 9 2019 6342 6348 J. Li, Y. Lin, X. Pan, D. Miao, D. Ding, Y. Cui, J. Dong, X. Bao, Enhanced CO2 methanation activity of Ni/Anatase catalyst by tuning strong metal–support interactions, ACS Catal., 9 (2019) 6342–6348. [31] B.A. Oni O.S. Tomomewo S.E. Sanni A.J. Ibegbu R. Joseph Ni catalysts modified with mesoporous silica support: the role of Pr2O3 and MgO on the methanation of CO2 Mol. Catal. 553 2024 113774 B.A. Oni, O.S. Tomomewo, S.E. Sanni, A.J. Ibegbu, R. Joseph, Ni catalysts modified with mesoporous silica support: the role of Pr2O3 and MgO on the methanation of CO2, Mol. Catal., 553 (2024) 113774. [32] W. Wang B. Gu L. Liang W.A. Hamilton D.J. Wesolowski Synthesis of rutile (α-TiO2) manocrystals with controlled size and shape by low-temperature hydrolysis: effects of solvent composition J. Phys. Chem. B 108 2004 14789 14792 W. Wang, B. Gu, L. Liang, W.A. Hamilton, D.J. Wesolowski, Synthesis of rutile (α-TiO2) manocrystals with controlled size and shape by low-temperature hydrolysis: effects of solvent composition, J. Phys. Chem. B, 108 (2004) 14789–14792. [33] D.Y. Li R.D. Xu R.J. Wong X. Zhu D. Tian L. Jiang Q.J. Guo H.C. Bai L.A. Huang W. Liu H. Wang K.Z. Li Suppressing byproduct formation for high selective CO2 reduction over optimized Ni/TiO2 based catalysts J. Energy Chem. 72 2022 465 478 D.Y. Li, R.D. Xu, R.J. Wong, X. Zhu, D. Tian, L. Jiang, Q.J. Guo, H.C. Bai, L.A. Huang, W. Liu, H. Wang, K.Z. Li, Suppressing byproduct formation for high selective CO2 reduction over optimized Ni/TiO2 based catalysts, J. Energy Chem., 72 (2022) 465–478. [34] Y.Q. Liu H.L. Ran J.J. Fan X.L. Zhang J. Mao G.S. Shao Fabrication and photovoltaic performance of niobium doped TiO2 hierarchical microspheres with exposed {001} facets and high specific surface area Appl. Surf. Sci. 410 2017 241 248 Y.Q. Liu, H.L. Ran, J.J. Fan, X.L. Zhang, J. Mao, G.S. Shao, Fabrication and photovoltaic performance of niobium doped TiO2 hierarchical microspheres with exposed {001} facets and high specific surface area, Appl. Surf. Sci., 410 (2017) 241–248. [35] H. Znad K. Abbas S. Hena M.R. Awual Synthesis a novel multilamellar mesoporous TiO2/ZSM-5 for photo-catalytic degradation of methyl orange dye in aqueous media J. Environ. Chem. Eng. 6 2018 218 227 H. Znad, K. Abbas, S. Hena, M.R. Awual, Synthesis a novel multilamellar mesoporous TiO2/ZSM-5 for photo-catalytic degradation of methyl orange dye in aqueous media, J. Environ. Chem. Eng., 6 (2018) 218–227. [36] H.W. Wang J.L. Lu A review on particle size effect in metal-catalyzed heterogeneous reactions Chin. J. Chem. 38 2020 1422 1444 H.W. Wang, J.L. Lu, A review on particle size effect in metal-catalyzed heterogeneous reactions, Chin. J. Chem., 38 (2020) 1422–1444. [37] Z. Li S.F. Ji Y.W. Liu X. Cao S.B. Tian Y.J. Chen Z.G. Niu Y.D. Li Well-defined materials for heterogeneous catalysis: from nanoparticles to isolated single-atom sites Chem. Rev. 120 2020 623 682 Z. Li, S.F. Ji, Y.W. Liu, X. Cao, S.B. Tian, Y.J. Chen, Z.G. Niu, Y.D. Li, Well-defined materials for heterogeneous catalysis: from nanoparticles to isolated single-atom sites, Chem. Rev., 120 (2020) 623–682. [38] S.W. Ho C.Y. Chu S.G. Chen Effect of thermal treatment on the nickel state and CO hydrogenation activity of titania-supported nickel catalysts J. Catal. 178 1998 34 48 S.W. Ho, C.Y. Chu, S.G. Chen, Effect of thermal treatment on the nickel state and CO hydrogenation activity of titania-supported nickel catalysts, J. Catal., 178 (1998) 34–48. [39] M. Xu S. He H. Chen G. Cui L. Zheng B. Wang M. Wei TiO2-x-Modified Ni nanocatalyst with tunable metal-support interaction for water-gas shift reaction ACS Catal. 7 2017 7600 7609 M. Xu, S. He, H. Chen, G. Cui, L. Zheng, B. Wang, M. Wei, TiO2-x-Modified Ni nanocatalyst with tunable metal-support interaction for water-gas shift reaction, ACS Catal., 7 (2017) 7600–7609. [40] D. Wierzbicki M.V. Moreno S. Ognier M. Motak T. Grzybek P. Da Costa M.E. Gálvez Ni-Fe layered double hydroxide derived catalysts for non-plasma and DBD plasma-assisted CO2 methanation Int. J. Hydrog. Energy 45 2020 10423 10432 D. Wierzbicki, M.V. Moreno, S. Ognier, M. Motak, T. Grzybek, P. Da Costa, M.E. Gálvez, Ni-Fe layered double hydroxide derived catalysts for non-plasma and DBD plasma-assisted CO2 methanation, Int. J. Hydrog. Energy, 45 (2020) 10423–10432. [41] S. Ewald O. Hinrichsen On the interaction of CO2 with Ni-Al catalysts Appl. Catal. A-Gen. 580 2019 71 80 S. Ewald, O. Hinrichsen, On the interaction of CO2 with Ni-Al catalysts, Appl. Catal. A-Gen., 580 (2019) 71–80. [42] R. Tang N. Ullah Y.J. Hui X. Li Z.H. Li Enhanced CO2 methanation activity over Ni/CeO2 catalyst by one-pot method Mol. Catal. 508 2021 111602 R. Tang, N. Ullah, Y.J. Hui, X. Li, Z.H. Li, Enhanced CO2 methanation activity over Ni/CeO2 catalyst by one-pot method, Mol. Catal., 508 (2021) 111602. [43] Q.S. Pan J.X. Peng T.J. Sun S. Wang S.D. Wang Insight into the reaction route of CO2 methanation: promotion effect of medium basic sites Catal. Commun. 45 2014 74 78 Q.S. Pan, J.X. Peng, T.J. Sun, S. Wang, S.D. Wang, Insight into the reaction route of CO2 methanation: promotion effect of medium basic sites, Catal. Commun., 45 (2014) 74–78. [44] M. Li A.C. van Veen Tuning the catalytic performance of Ni-catalysed dry reforming of methane and carbon deposition via Ni-CeO2-x interaction Appl. Catal. B 237 2018 641 648 M. Li, A.C. van Veen, Tuning the catalytic performance of Ni-catalysed dry reforming of methane and carbon deposition via Ni-CeO2-x interaction, Appl. Catal. B, 237 (2018) 641–648. [45] G. Deng G. Zhang X. Zhu Q. Guo X. Liao X. Chen K. Li Optimized Ni-based catalysts for methane reforming with O2-containing CO2 Appl. Catal. B 289 2021 120033 G. Deng, G. Zhang, X. Zhu, Q. Guo, X. Liao, X. Chen, K. Li, Optimized Ni-based catalysts for methane reforming with O2-containing CO2, Appl. Catal. B, 289 (2021) 120033. [46] S.J. Tauster S.C. Fung Strong metal-support interactions: occurrence among the binary oxides of groups IIA–VB J. Catal. 55 1978 29 35 S.J. Tauster, S.C. Fung, Strong metal-support interactions: occurrence among the binary oxides of groups IIA–VB, J. Catal., 55 (1978) 29–35. [47] S.J. Tauster S.C. Fung R.L. Garten Strong metal-support interactions. Group 8 noble metals supported on titanium dioxide J. Am. Chem. Soc. 100 1978 170 175 S.J. Tauster, S.C. Fung, R.L. Garten, Strong metal-support interactions. Group 8 noble metals supported on titanium dioxide, J. Am. Chem. Soc., 100 (1978) 170–175. [48] S.J. Tauster S.C. Fung R.T. Baker J.A. Horsley Strong interactions in supported-metal catalysts Science 211 1981 1121 1125 S.J. Tauster, S.C. Fung, R.T. Baker, J.A. Horsley, Strong interactions in supported-metal catalysts, Science, 211 (1981) 1121–1125. [49] R.L.C.Bonne P.K J.W. Geus Strong metal-support interaction in Ni/TiO2 catalysts: the origin of TiOx moieties on the surface of nickel particles Appl. Catal. 30 1987 33 46 P.K, R.L.C.Bonne, J.W. Geus, Strong metal-support interaction in Ni/TiO2 catalysts: the origin of TiOx moieties on the surface of nickel particles, Appl. Catal., 30 (1987) 33–46. [50] Y. Li Y. Zhang K. Qian W. Huang Metal–Support interactions in metal/oxide catalysts and oxide–metal interactions in oxide/metal inverse catalysts ACS Catal 12 2022 1268 1287 Y. Li, Y. Zhang, K. Qian, W. Huang, Metal–Support interactions in metal/oxide catalysts and oxide–metal interactions in oxide/metal inverse catalysts, ACS Catal., 12 (2022) 1268–1287. [51] X. Liu M.H. Liu Y.C. Luo C.Y. Mou S.D. Lin H. Cheng J.M. Chen J.F. Lee T.S. Lin Strong Metal-Support Interactions between Gold Nanoparticles and ZnO Nanorods in CO Oxidation J. Am. Chem. Soc. 134 2012 10251 10258 X. Liu, M.H. Liu, Y.C. Luo, C.Y. Mou, S.D. Lin, H. Cheng, J.M. Chen, J.F. Lee, T.S. Lin, Strong Metal-Support Interactions between Gold Nanoparticles and ZnO Nanorods in CO Oxidation, J. Am. Chem. Soc., 134 (2012) 10251–10258. [52] S. Zhang P.N. Plessow J.J. Willis S. Dai M. Xu G.W. Graham M. Cargnello F. Abild-Pedersen X. Pan Dynamical observation and detailed description of catalysts under strong metal-support interaction Nano Lett. 16 2016 4528 4534 S. Zhang, P.N. Plessow, J.J. Willis, S. Dai, M. Xu, G.W. Graham, M. Cargnello, F. Abild-Pedersen, X. Pan, Dynamical observation and detailed description of catalysts under strong metal-support interaction, Nano Lett., 16 (2016) 4528–4534. [53] J.C. Matsubu S. Zhang L. DeRita N.S. Marinkovic J.G. Chen G.W. Graham X. Pan P. Christophe Adsorbate-mediated strong metal-support interactions in oxide-supported Rh catalysts Nat. Chem. 9 2017 120 127 J.C. Matsubu, S. Zhang, L. DeRita, N.S. Marinkovic, J.G. Chen, G.W. Graham, X. Pan, P. Christophe, Adsorbate-mediated strong metal-support interactions in oxide-supported Rh catalysts, Nat. Chem., 9 (2017) 120–127. [54] J. Xu X. Su H. Duan B. Hou Q. Lin X. Liu X. Pan G. Pei H. Geng Y. Huang T. Zhang Influence of pretreatment temperature on catalytic performance of rutile TiO2-supported ruthenium catalyst in CO2 methanation J. Catal. 333 2016 227 237 J. Xu, X. Su, H. Duan, B. Hou, Q. Lin, X. Liu, X. Pan, G. Pei, H. Geng, Y. Huang, T. Zhang, Influence of pretreatment temperature on catalytic performance of rutile TiO2-supported ruthenium catalyst in CO2 methanation, J. Catal., 333 (2016) 227–237. [55] T.W. Wu X.J. Zhu Z. Xing S.Y. Mou C.B. Li Y.X. Qiao Q. Liu Y.L. Luo X.F. Shi Y.N. Zhang X.P. Sun Greatly improving electrochemical N2 reduction over TiO2 nanoparticles by iron doping Angew. Chem. Int. Ed. 58 2019 18449 18453 T.W. Wu, X.J. Zhu, Z. Xing, S.Y. Mou, C.B. Li, Y.X. Qiao, Q. Liu, Y.L. Luo, X.F. Shi, Y.N. Zhang, X.P. Sun, Greatly improving electrochemical N2 reduction over TiO2 nanoparticles by iron doping, Angew. Chem. Int. Ed., 58 (2019) 18449–18453. [56] C. Yang X. Zhang J. Qin X. Shen R. Yu M. Ma R. Liu Porous carbon-doped TiO2 on TiC nanostructures for enhanced photocatalytic hydrogen production under visible light J. Catal. 347 2017 36 44 C. Yang, X. Zhang, J. Qin, X. Shen, R. Yu, M. Ma, R. Liu, Porous carbon-doped TiO2 on TiC nanostructures for enhanced photocatalytic hydrogen production under visible light, J. Catal., 347 (2017) 36–44. [57] S. Chen A.M. Abdel-Mageed A. Hauble T. Ishida T. Murayama M. Parlinska-Wojtan R.J. Behm Performance of Au/ZnO catalysts in CO2 reduction to methanol: varying the Au loading/Au particle size Appl. Catal. A 624 2021 118318 S. Chen, A.M. Abdel-Mageed, A. Hauble, T. Ishida, T. Murayama, M. Parlinska-Wojtan, R.J. Behm, Performance of Au/ZnO catalysts in CO2 reduction to methanol: varying the Au loading/Au particle size, Appl. Catal. A, 624 (2021) 118318. [58] P. Panagiotopoulou A. Christodoulakis D.I. Kondarides S. Boghosian Particle size effects on the reducibility of titanium dioxide and its relation to the water–gas shift activity of Pt/TiO2 catalysts J. Catal. 240 2006 114 125 P. Panagiotopoulou, A. Christodoulakis, D.I. Kondarides, S. Boghosian, Particle size effects on the reducibility of titanium dioxide and its relation to the water–gas shift activity of Pt/TiO2 catalysts, J. Catal., 240 (2006) 114–125. [59] N. Albeladi Q.A. Alsulami K. Narasimharao Recent progress in nickel and silica containing catalysts for CO2 hydrogenation to CH4 Catalysts 13 2023 1104 N. Albeladi, Q.A. Alsulami, K. Narasimharao, Recent progress in nickel and silica containing catalysts for CO2 hydrogenation to CH4, Catalysts, 13 (2023) 1104. [60] M. Monai K. Jenkinson A.E.M. Melcherts J.N. Louwen E.A. Irmak S. Van Aert T. Altantzis C. Vogt W. van der Stam T. Duchon B. Smíd E. Groeneveld P. Berben S. Bals B.M. Weckhuysen Restructuring of titanium oxide overlayers over nickel nanoparticles during catalysis Science 380 2023 644 651 M. Monai, K. Jenkinson, A.E.M. Melcherts, J.N. Louwen, E.A. Irmak, S. Van Aert, T. Altantzis, C. Vogt, W. van der Stam, T. Duchon, B. Smíd, E. Groeneveld, P. Berben, S. Bals, B.M. Weckhuysen, Restructuring of titanium oxide overlayers over nickel nanoparticles during catalysis, Science, 380 (2023) 644–651. [61] X.J. Huang W.L. Mo X.Q. He X. Fan F.Y. Ma D. Tax Effects of promoters on the structure, performance, and carbon deposition of Ni-Al2O3 catalysts for CO2-CH4 reforming Acs Omega 6 2021 16381 16390 X.J. Huang, W.L. Mo, X.Q. He, X. Fan, F.Y. Ma, D. Tax, Effects of promoters on the structure, performance, and carbon deposition of Ni-Al2O3 catalysts for CO2-CH4 reforming, Acs Omega, 6 (2021) 16381–16390. [62] H.L. Lu X.Z. Yang G.J. Gao K.B. Wang Q.Q. Shi J. Wang C.H. Han J. Liu M. Tong X.Y. Liang C.F. Li Mesoporous zirconia-modified clays supported nickel catalysts for CO and CO2 methanation Int. J. Hydrog. Energy 39 2014 18894 18907 H.L. Lu, X.Z. Yang, G.J. Gao, K.B. Wang, Q.Q. Shi, J. Wang, C.H. Han, J. Liu, M. Tong, X.Y. Liang, C.F. Li, Mesoporous zirconia-modified clays supported nickel catalysts for CO and CO2 methanation, Int. J. Hydrog. Energy, 39 (2014) 18894–18907. [63] A.H.K. Owgi A.A. Jalil I. Hussain H.U. Hambali W. Nabgan Enhancing resistance of carbon deposition and reaction stability over nickel loaded fibrous silica-alumina (Ni/FSA) for dry reforming of methane Int. J. Hydrog. Energy 47 2022 42250 42265 A.H.K. Owgi, A.A. Jalil, I. Hussain, H.U. Hambali, W. Nabgan, Enhancing resistance of carbon deposition and reaction stability over nickel loaded fibrous silica-alumina (Ni/FSA) for dry reforming of methane, Int. J. Hydrog. Energy, 47 (2022) 42250–42265.",
      "scopus-id": "85189860360",
      "coredata": {
        "eid": "1-s2.0-S2468823124003158",
        "dc:description": "CO2 methanation is an effective way for CO2 recycling, and nickel-based catalysts have attracted much attention in this field due to their excellent CH4 selectivity and cost-effectiveness; however, their applications are limited by their suboptimal catalytic activity. In this work, the catalytic activity of Ni-rutile-based catalysts was increased by almost an order of magnitude simply by doping the rutile with Fe. Series characterizations show that three factors that mainly contributed to the improved catalytic performance of the Ni/Fe-Rutile, which are the reduction of the Ni size, the increase of the basic sites, and the inhibition of the encapsulation of the Ni particles by the support. With Fe doping, the OH and oxygen vacancies on the rutile surface were reduced, which made the support difficult to reduce and thus suppressed the encapsulation of Ni by the support. As a result, the number of exposed active sites on the Ni/Fe-Rutile which with a smaller Ni size was further successfully increased, and the catalytic activity was significantly improved. This study provides new ideas for the design of activity-enhanced supported catalysts from the perspective of tuning the metal-support interaction and may be applicable to other reducible oxide-supported metal catalysts.",
        "openArchiveArticle": "false",
        "prism:coverDate": "2024-05-01",
        "openaccessUserLicense": null,
        "prism:aggregationType": "Journal",
        "prism:url": "https://api.elsevier.com/content/article/pii/S2468823124003158",
        "dc:creator": [
          {
            "@_fa": "true",
            "$": "Zhou, Nan"
          },
          {
            "@_fa": "true",
            "$": "Jia, Xiaoqing"
          },
          {
            "@_fa": "true",
            "$": "Chen, Siyuan"
          },
          {
            "@_fa": "true",
            "$": "Li, Huafan"
          },
          {
            "@_fa": "true",
            "$": "Li, Feifei"
          },
          {
            "@_fa": "true",
            "$": "Qiao, Botao"
          },
          {
            "@_fa": "true",
            "$": "Tang, Hailian"
          },
          {
            "@_fa": "true",
            "$": "Bai, Guoyi"
          }
        ],
        "link": [
          {
            "@_fa": "true",
            "@rel": "self",
            "@href": "https://api.elsevier.com/content/article/pii/S2468823124003158"
          },
          {
            "@_fa": "true",
            "@rel": "scidir",
            "@href": "https://www.sciencedirect.com/science/article/pii/S2468823124003158"
          }
        ],
        "dc:format": "application/json",
        "openaccessType": null,
        "pii": "S2468-8231(24)00315-8",
        "prism:volume": "560",
        "articleNumber": "114132",
        "prism:publisher": "Elsevier B.V.",
        "dc:title": "Enhanced CO2 methanation activity of Ni-Rutile-based catalyst by tuning the metal−support interaction with Fe doping",
        "prism:copyright": "© 2024 Elsevier B.V. All rights reserved.",
        "openaccess": "0",
        "prism:issn": "24688231",
        "dcterms:subject": [
          {
            "@_fa": "true",
            "$": "Fe doping"
          },
          {
            "@_fa": "true",
            "$": "Nickel catalyst"
          },
          {
            "@_fa": "true",
            "$": "CO2 methanation"
          },
          {
            "@_fa": "true",
            "$": "Metal−support interaction"
          },
          {
            "@_fa": "true",
            "$": "Catalytic activity"
          }
        ],
        "openaccessArticle": "false",
        "prism:publicationName": "Molecular Catalysis",
        "openaccessSponsorType": null,
        "prism:pageRange": "114132",
        "pubType": "fla",
        "prism:coverDisplayDate": "1 May 2024",
        "prism:doi": "10.1016/j.mcat.2024.114132",
        "prism:startingPage": "114132",
        "dc:identifier": "doi:10.1016/j.mcat.2024.114132",
        "openaccessSponsorName": null
      },
      "objects": {
        "object": [
          {
            "@category": "standard",
            "@height": "338",
            "@width": "621",
            "@_fa": "true",
            "$": "https://api.elsevier.com/content/object/eid/1-s2.0-S2468823124003158-gr1.jpg?httpAccept=%2A%2F%2A",
            "@multimediatype": "JPEG image file",
            "@type": "IMAGE-DOWNSAMPLED",
            "@size": "64150",
            "@ref": "gr1",
            "@mimetype": "image/jpeg"
          },
          {
            "@category": "standard",
            "@height": "386",
            "@width": "753",
            "@_fa": "true",
            "$": "https://api.elsevier.com/content/object/eid/1-s2.0-S2468823124003158-gr2.jpg?httpAccept=%2A%2F%2A",
            "@multimediatype": "JPEG image file",
            "@type": "IMAGE-DOWNSAMPLED",
            "@size": "130087",
            "@ref": "gr2",
            "@mimetype": "image/jpeg"
          },
          {
            "@category": "standard",
            "@height": "192",
            "@width": "500",
            "@_fa": "true",
            "$": "https://api.elsevier.com/content/object/eid/1-s2.0-S2468823124003158-ga1.jpg?httpAccept=%2A%2F%2A",
            "@multimediatype": "JPEG image file",
            "@type": "IMAGE-DOWNSAMPLED",
            "@size": "21130",
            "@ref": "ga1",
            "@mimetype": "image/jpeg"
          },
          {
            "@category": "standard",
            "@height": "292",
            "@width": "696",
            "@_fa": "true",
            "$": "https://api.elsevier.com/content/object/eid/1-s2.0-S2468823124003158-gr5.jpg?httpAccept=%2A%2F%2A",
            "@multimediatype": "JPEG image file",
            "@type": "IMAGE-DOWNSAMPLED",
            "@size": "61918",
            "@ref": "gr5",
            "@mimetype": "image/jpeg"
          },
          {
            "@category": "standard",
            "@height": "386",
            "@width": "753",
            "@_fa": "true",
            "$": "https://api.elsevier.com/content/object/eid/1-s2.0-S2468823124003158-gr6.jpg?httpAccept=%2A%2F%2A",
            "@multimediatype": "JPEG image file",
            "@type": "IMAGE-DOWNSAMPLED",
            "@size": "107924",
            "@ref": "gr6",
            "@mimetype": "image/jpeg"
          },
          {
            "@category": "standard",
            "@height": "239",
            "@width": "640",
            "@_fa": "true",
            "$": "https://api.elsevier.com/content/object/eid/1-s2.0-S2468823124003158-gr3.jpg?httpAccept=%2A%2F%2A",
            "@multimediatype": "JPEG image file",
            "@type": "IMAGE-DOWNSAMPLED",
            "@size": "38228",
            "@ref": "gr3",
            "@mimetype": "image/jpeg"
          },
          {
            "@category": "standard",
            "@height": "296",
            "@width": "489",
            "@_fa": "true",
            "$": "https://api.elsevier.com/content/object/eid/1-s2.0-S2468823124003158-gr4.jpg?httpAccept=%2A%2F%2A",
            "@multimediatype": "JPEG image file",
            "@type": "IMAGE-DOWNSAMPLED",
            "@size": "43277",
            "@ref": "gr4",
            "@mimetype": "image/jpeg"
          },
          {
            "@category": "standard",
            "@height": "256",
            "@width": "621",
            "@_fa": "true",
            "$": "https://api.elsevier.com/content/object/eid/1-s2.0-S2468823124003158-gr7.jpg?httpAccept=%2A%2F%2A",
            "@multimediatype": "JPEG image file",
            "@type": "IMAGE-DOWNSAMPLED",
            "@size": "46764",
            "@ref": "gr7",
            "@mimetype": "image/jpeg"
          },
          {
            "@category": "thumbnail",
            "@height": "119",
            "@width": "219",
            "@_fa": "true",
            "$": "https://api.elsevier.com/content/object/eid/1-s2.0-S2468823124003158-gr1.sml?httpAccept=%2A%2F%2A",
            "@multimediatype": "GIF image file",
            "@type": "IMAGE-THUMBNAIL",
            "@size": "17469",
            "@ref": "gr1",
            "@mimetype": "image/gif"
          },
          {
            "@category": "thumbnail",
            "@height": "112",
            "@width": "219",
            "@_fa": "true",
            "$": "https://api.elsevier.com/content/object/eid/1-s2.0-S2468823124003158-gr2.sml?httpAccept=%2A%2F%2A",
            "@multimediatype": "GIF image file",
            "@type": "IMAGE-THUMBNAIL",
            "@size": "23020",
            "@ref": "gr2",
            "@mimetype": "image/gif"
          },
          {
            "@category": "thumbnail",
            "@height": "84",
            "@width": "219",
            "@_fa": "true",
            "$": "https://api.elsevier.com/content/object/eid/1-s2.0-S2468823124003158-ga1.sml?httpAccept=%2A%2F%2A",
            "@multimediatype": "GIF image file",
            "@type": "IMAGE-THUMBNAIL",
            "@size": "9741",
            "@ref": "ga1",
            "@mimetype": "image/gif"
          },
          {
            "@category": "thumbnail",
            "@height": "92",
            "@width": "219",
            "@_fa": "true",
            "$": "https://api.elsevier.com/content/object/eid/1-s2.0-S2468823124003158-gr5.sml?httpAccept=%2A%2F%2A",
            "@multimediatype": "GIF image file",
            "@type": "IMAGE-THUMBNAIL",
            "@size": "14223",
            "@ref": "gr5",
            "@mimetype": "image/gif"
          },
          {
            "@category": "thumbnail",
            "@height": "112",
            "@width": "219",
            "@_fa": "true",
            "$": "https://api.elsevier.com/content/object/eid/1-s2.0-S2468823124003158-gr6.sml?httpAccept=%2A%2F%2A",
            "@multimediatype": "GIF image file",
            "@type": "IMAGE-THUMBNAIL",
            "@size": "19755",
            "@ref": "gr6",
            "@mimetype": "image/gif"
          },
          {
            "@category": "thumbnail",
            "@height": "82",
            "@width": "219",
            "@_fa": "true",
            "$": "https://api.elsevier.com/content/object/eid/1-s2.0-S2468823124003158-gr3.sml?httpAccept=%2A%2F%2A",
            "@multimediatype": "GIF image file",
            "@type": "IMAGE-THUMBNAIL",
            "@size": "9643",
            "@ref": "gr3",
            "@mimetype": "image/gif"
          },
          {
            "@category": "thumbnail",
            "@height": "132",
            "@width": "219",
            "@_fa": "true",
            "$": "https://api.elsevier.com/content/object/eid/1-s2.0-S2468823124003158-gr4.sml?httpAccept=%2A%2F%2A",
            "@multimediatype": "GIF image file",
            "@type": "IMAGE-THUMBNAIL",
            "@size": "16361",
            "@ref": "gr4",
            "@mimetype": "image/gif"
          },
          {
            "@category": "thumbnail",
            "@height": "90",
            "@width": "219",
            "@_fa": "true",
            "$": "https://api.elsevier.com/content/object/eid/1-s2.0-S2468823124003158-gr7.sml?httpAccept=%2A%2F%2A",
            "@multimediatype": "GIF image file",
            "@type": "IMAGE-THUMBNAIL",
            "@size": "12289",
            "@ref": "gr7",
            "@mimetype": "image/gif"
          },
          {
            "@category": "high",
            "@height": "1495",
            "@width": "2750",
            "@_fa": "true",
            "$": "https://api.elsevier.com/content/object/eid/1-s2.0-S2468823124003158-gr1_lrg.jpg?httpAccept=%2A%2F%2A",
            "@multimediatype": "JPEG image file",
            "@type": "IMAGE-HIGH-RES",
            "@size": "480894",
            "@ref": "gr1",
            "@mimetype": "image/jpeg"
          },
          {
            "@category": "high",
            "@height": "1708",
            "@width": "3333",
            "@_fa": "true",
            "$": "https://api.elsevier.com/content/object/eid/1-s2.0-S2468823124003158-gr2_lrg.jpg?httpAccept=%2A%2F%2A",
            "@multimediatype": "JPEG image file",
            "@type": "IMAGE-HIGH-RES",
            "@size": "1018064",
            "@ref": "gr2",
            "@mimetype": "image/jpeg"
          },
          {
            "@category": "high",
            "@height": "848",
            "@width": "2213",
            "@_fa": "true",
            "$": "https://api.elsevier.com/content/object/eid/1-s2.0-S2468823124003158-ga1_lrg.jpg?httpAccept=%2A%2F%2A",
            "@multimediatype": "JPEG image file",
            "@type": "IMAGE-HIGH-RES",
            "@size": "146838",
            "@ref": "ga1",
            "@mimetype": "image/jpeg"
          },
          {
            "@category": "high",
            "@height": "1295",
            "@width": "3083",
            "@_fa": "true",
            "$": "https://api.elsevier.com/content/object/eid/1-s2.0-S2468823124003158-gr5_lrg.jpg?httpAccept=%2A%2F%2A",
            "@multimediatype": "JPEG image file",
            "@type": "IMAGE-HIGH-RES",
            "@size": "465568",
            "@ref": "gr5",
            "@mimetype": "image/jpeg"
          },
          {
            "@category": "high",
            "@height": "1709",
            "@width": "3333",
            "@_fa": "true",
            "$": "https://api.elsevier.com/content/object/eid/1-s2.0-S2468823124003158-gr6_lrg.jpg?httpAccept=%2A%2F%2A",
            "@multimediatype": "JPEG image file",
            "@type": "IMAGE-HIGH-RES",
            "@size": "879360",
            "@ref": "gr6",
            "@mimetype": "image/jpeg"
          },
          {
            "@category": "high",
            "@height": "1059",
            "@width": "2833",
            "@_fa": "true",
            "$": "https://api.elsevier.com/content/object/eid/1-s2.0-S2468823124003158-gr3_lrg.jpg?httpAccept=%2A%2F%2A",
            "@multimediatype": "JPEG image file",
            "@type": "IMAGE-HIGH-RES",
            "@size": "264400",
            "@ref": "gr3",
            "@mimetype": "image/jpeg"
          },
          {
            "@category": "high",
            "@height": "1310",
            "@width": "2167",
            "@_fa": "true",
            "$": "https://api.elsevier.com/content/object/eid/1-s2.0-S2468823124003158-gr4_lrg.jpg?httpAccept=%2A%2F%2A",
            "@multimediatype": "JPEG image file",
            "@type": "IMAGE-HIGH-RES",
            "@size": "314029",
            "@ref": "gr4",
            "@mimetype": "image/jpeg"
          },
          {
            "@category": "high",
            "@height": "1132",
            "@width": "2750",
            "@_fa": "true",
            "$": "https://api.elsevier.com/content/object/eid/1-s2.0-S2468823124003158-gr7_lrg.jpg?httpAccept=%2A%2F%2A",
            "@multimediatype": "JPEG image file",
            "@type": "IMAGE-HIGH-RES",
            "@size": "345236",
            "@ref": "gr7",
            "@mimetype": "image/jpeg"
          },
          {
            "@category": "standard",
            "@_fa": "true",
            "$": "https://api.elsevier.com/content/object/eid/1-s2.0-S2468823124003158-mmc1.docx?httpAccept=%2A%2F%2A",
            "@multimediatype": "Microsoft Word file",
            "@type": "APPLICATION",
            "@size": "7654681",
            "@ref": "mmc1",
            "@mimetype": "application/word"
          },
          {
            "@category": "thumbnail",
            "@_fa": "true",
            "$": "https://api.elsevier.com/content/object/eid/1-s2.0-S2468823124003158-si1.svg?httpAccept=%2A%2F%2A",
            "@multimediatype": "Scalable Vector Graphics file",
            "@type": "ALTIMG",
            "@size": "15145",
            "@ref": "si1",
            "@mimetype": "image/svg+xml"
          },
          {
            "@category": "thumbnail",
            "@_fa": "true",
            "$": "https://api.elsevier.com/content/object/eid/1-s2.0-S2468823124003158-si2.svg?httpAccept=%2A%2F%2A",
            "@multimediatype": "Scalable Vector Graphics file",
            "@type": "ALTIMG",
            "@size": "15514",
            "@ref": "si2",
            "@mimetype": "image/svg+xml"
          },
          {
            "@category": "thumbnail",
            "@_fa": "true",
            "$": "https://api.elsevier.com/content/object/eid/1-s2.0-S2468823124003158-si3.svg?httpAccept=%2A%2F%2A",
            "@multimediatype": "Scalable Vector Graphics file",
            "@type": "ALTIMG",
            "@size": "13015",
            "@ref": "si3",
            "@mimetype": "image/svg+xml"
          },
          {
            "@category": "thumbnail",
            "@_fa": "true",
            "$": "https://api.elsevier.com/content/object/eid/1-s2.0-S2468823124003158-si4.svg?httpAccept=%2A%2F%2A",
            "@multimediatype": "Scalable Vector Graphics file",
            "@type": "ALTIMG",
            "@size": "4251",
            "@ref": "si4",
            "@mimetype": "image/svg+xml"
          },
          {
            "@category": "thumbnail",
            "@_fa": "true",
            "$": "https://api.elsevier.com/content/object/eid/1-s2.0-S2468823124003158-si5.svg?httpAccept=%2A%2F%2A",
            "@multimediatype": "Scalable Vector Graphics file",
            "@type": "ALTIMG",
            "@size": "4666",
            "@ref": "si5",
            "@mimetype": "image/svg+xml"
          },
          {
            "@category": "thumbnail",
            "@_fa": "true",
            "$": "https://api.elsevier.com/content/object/eid/1-s2.0-S2468823124003158-si6.svg?httpAccept=%2A%2F%2A",
            "@multimediatype": "Scalable Vector Graphics file",
            "@type": "ALTIMG",
            "@size": "4527",
            "@ref": "si6",
            "@mimetype": "image/svg+xml"
          },
          {
            "@category": "thumbnail",
            "@_fa": "true",
            "$": "https://api.elsevier.com/content/object/eid/1-s2.0-S2468823124003158-si7.svg?httpAccept=%2A%2F%2A",
            "@multimediatype": "Scalable Vector Graphics file",
            "@type": "ALTIMG",
            "@size": "4101",
            "@ref": "si7",
            "@mimetype": "image/svg+xml"
          },
          {
            "@category": "standard",
            "@_fa": "true",
            "$": "https://api.elsevier.com/content/object/eid/1-s2.0-S2468823124003158-am.pdf?httpAccept=%2A%2F%2A",
            "@multimediatype": "Acrobat PDF file",
            "@type": "AAM-PDF",
            "@size": "2742700",
            "@ref": "am",
            "@mimetype": "application/pdf"
          }
        ]
      },
      "link": {
        "@rel": "abstract",
        "@href": "https://api.elsevier.com/content/abstract/scopus_id/85189860360"
      }
    }
  }
}