{
  "metadata": {
    "title": "Sintering resistance of Pt-based oxidation catalyst via constructing Pt/MnO<ce:inf loc=post>x</ce:inf> interface",
    "authors": "; ; ",
    "journal": "Molecular Catalysis",
    "date": "2023-08-31",
    "doi": "10.1016/j.mcat.2023.113380",
    "abstract": "",
    "uri": "https://api.elsevier.com/content/article/pii/S2468823123004649",
    "pii": "S2468823123004649"
  },
  "fulltext": {
    "full-text-retrieval-response": {
      "scopus-eid": "2-s2.0-85165301947",
      "originalText": "serial JL 315758 291210 291744 291790 291809 31 Molecular Catalysis MOLECULARCATALYSIS 2023-07-18 2023-07-18 2023-07-18 2023-07-18 2023-11-16T15:56:12 1-s2.0-S2468823123004649 S2468-8231(23)00464-9 S2468823123004649 10.1016/j.mcat.2023.113380 S300 S300.1 FULL-TEXT 1-s2.0-S2468823123X00133 2023-11-16T16:10:46.878106Z 0 0 20230801 20230831 2023 2023-07-18T12:06:01.059595Z absattachment articleinfo articlenumber articletitlenorm authfirstinitialnorm authfirstsurnamenorm cid cids contenttype copyright crossmark dateloaded dateloadedtxt datesearch datesort dateupdated dco docsubtype doctype doi eid ewtransactionid hubeid indexeddate issn issnnorm itemstage itemtransactionid itemweight openaccess openarchive pg pgfirst pii piinorm pubdateend pubdatestart pubdatetxt pubyr sectiontitle sortorder srctitle srctitlenorm srctype ssids alllist content subj subheadings suppl tomb volfirst volissue volumelist webpdf webpdfpagecount yearnav figure table e-component body acknowledge affil appendices articletitle auth authfirstini authfull authkeywords authlast grantnumber grantsponsor grantsponsorid highlightsabst primabst ref specialabst 2468-8231 24688231 true 547 547 C Volume 547 90 113380 113380 113380 202308 August 2023 2023-08-01 2023-08-31 2023 Regular Papers article fla © 2023 Elsevier B.V. All rights reserved. SINTERINGRESISTANCEPTBASEDOXIDATIONCATALYSTVIACONSTRUCTINGPTMNOXINTERFACE LIANG Y Introduction Experimental section Catalyst preparation Catalytic evaluation Catalyst characterizations Results and discussions Catalytic performance and heat stability Structural properties Platinum chemical state NOx adsorption and desorption behavior by in situ DRIFTs Conclusions CRediT authorship contribution statement Acknowledgments Appendix Supplementary materials References KIM 2011 C ANGUITA 2019 329 338 P JOHNSON 2013 699 715 T JOHNSON 2015 1152 1167 T FUJIWARA 2017 2076 2092 K NAGAI 2006 103 109 Y WANG 2019 327 339 H LI 2013 2481 W LIANG 2019 64 72 Y LIANG 2022 30722 30731 Y KATTEL 2017 9739 9754 S LIANG 2022 112198 Y ALHARBI 2012 1527 1538 M IRANI 2009 422 428 K ARVAJOVA 2016 644 650 A ARVAJOVA 2017 181 187 A HULSEY 2022 3296 3308 M DING 2021 119471 S SONG 2019 6177 6187 S RO 2018 7368 7387 I DEELEN 2019 955 970 V DUAN 2020 144161 X WU 2019 628 640 Q TAKENAKA 2018 52 59 S XU 2018 984 990 X LIANG 2017 359 368 Y LIANG 2020 41824 41838 Y RUIZPUIGDOLLERS 2017 6493 6513 A BLYHOLDER 1964 2772 2777 G PACCHIONI 2013 1737 1757 G LIANG 2018 336 344 Y MATTHEW 2016 5599 5609 J KIM 2016 17996 18004 G LIANG 2018 3887 3897 Y LIANGX2023X113380 LIANGX2023X113380XY 2025-07-18T00:00:00.000Z 2025-07-18T00:00:00.000Z http://creativecommons.org/licenses/by-nc-nd/4.0/ © 2023 Elsevier B.V. All rights reserved. 2023-07-25T12:11:42.390Z http://vtw.elsevier.com/data/voc/AddOnTypes/50.7/aggregated-refined Vanadium and Titanium Resource Comprehensive Utilization Key Laboratory of Sichuan Province 2022FTSZ16 National Natural Science Foundation of China 22172106 NSFC National Natural Science Foundation of China http://data.elsevier.com/vocabulary/SciValFunders/501100001809 http://sws.geonames.org/1814991/ We gratefully acknowledge National Natural Science Foundation of China ( 22172106 ) and Vanadium and Titanium Resource Comprehensive Utilization Key Laboratory of Sichuan Province (2022FTSZ16) for the generous financial support to our research. The authors gratefully acknowledge Shanling Wang of the Analytical & Testing Center (ATC) of Sichuan University for performing TEM characterization. https://doi.org/10.15223/policy-017 https://doi.org/10.15223/policy-037 https://doi.org/10.15223/policy-012 https://doi.org/10.15223/policy-029 https://doi.org/10.15223/policy-004 item S2468-8231(23)00464-9 S2468823123004649 1-s2.0-S2468823123004649 10.1016/j.mcat.2023.113380 315758 2023-11-16T16:10:46.878106Z 2023-08-01 2023-08-31 1-s2.0-S2468823123004649-main.pdf https://s3-eu-west-1.amazonaws.com/prod-ucs-content-store-eu-west/content/pii:S2468823123004649/MAIN/application/pdf/873d75a41d5956e3e34a435656694517/main.pdf main.pdf pdf true 6783702 MAIN 9 1-s2.0-S2468823123004649-main_1.png https://s3-eu-west-1.amazonaws.com/prod-ucs-content-store-eu-west/content/pii:S2468823123004649/PREVIEW/image/png/e7e73ad1f2ddaf1dbe3be47aec7f4489/main_1.png main_1.png png 58660 849 656 IMAGE-WEB-PDF 1 1-s2.0-S2468823123004649-sc1.jpg https://s3-eu-west-1.amazonaws.com/prod-ucs-content-store-eu-west/content/pii:S2468823123004649/sc1/DOWNSAMPLED/image/jpeg/e29f82289b9e3159eea4521c5b2eefed/sc1.jpg sc1 sc1.jpg jpg 20250 89 643 IMAGE-DOWNSAMPLED 1-s2.0-S2468823123004649-gr6.jpg https://s3-eu-west-1.amazonaws.com/prod-ucs-content-store-eu-west/content/pii:S2468823123004649/gr6/DOWNSAMPLED/image/jpeg/aaa47c47db0e16a77069ba88be506ae9/gr6.jpg gr6 gr6.jpg jpg 36622 309 433 IMAGE-DOWNSAMPLED 1-s2.0-S2468823123004649-gr7.jpg https://s3-eu-west-1.amazonaws.com/prod-ucs-content-store-eu-west/content/pii:S2468823123004649/gr7/DOWNSAMPLED/image/jpeg/4a5e6517c51acfe8336d3307c34a3714/gr7.jpg gr7 gr7.jpg jpg 87889 462 621 IMAGE-DOWNSAMPLED 1-s2.0-S2468823123004649-gr8.jpg https://s3-eu-west-1.amazonaws.com/prod-ucs-content-store-eu-west/content/pii:S2468823123004649/gr8/DOWNSAMPLED/image/jpeg/933c9d4408a0830e18aca79ee19a3828/gr8.jpg gr8 gr8.jpg jpg 76874 457 640 IMAGE-DOWNSAMPLED 1-s2.0-S2468823123004649-gr2.jpg https://s3-eu-west-1.amazonaws.com/prod-ucs-content-store-eu-west/content/pii:S2468823123004649/gr2/DOWNSAMPLED/image/jpeg/d220e044c7b28a21ca3b983c0d5e4281/gr2.jpg gr2 gr2.jpg jpg 60579 337 433 IMAGE-DOWNSAMPLED 1-s2.0-S2468823123004649-ga1.jpg https://s3-eu-west-1.amazonaws.com/prod-ucs-content-store-eu-west/content/pii:S2468823123004649/ga1/DOWNSAMPLED/image/jpeg/67574e15bed451aa06c0587de87dc912/ga1.jpg ga1 true ga1.jpg jpg 32494 200 409 IMAGE-DOWNSAMPLED 1-s2.0-S2468823123004649-gr3.jpg https://s3-eu-west-1.amazonaws.com/prod-ucs-content-store-eu-west/content/pii:S2468823123004649/gr3/DOWNSAMPLED/image/jpeg/2d0cb82787457e226623815a26b84523/gr3.jpg gr3 gr3.jpg jpg 71261 456 621 IMAGE-DOWNSAMPLED 1-s2.0-S2468823123004649-gr4.jpg https://s3-eu-west-1.amazonaws.com/prod-ucs-content-store-eu-west/content/pii:S2468823123004649/gr4/DOWNSAMPLED/image/jpeg/dbddf49a6cc9132204da39367ae913f1/gr4.jpg gr4 gr4.jpg jpg 131678 350 753 IMAGE-DOWNSAMPLED 1-s2.0-S2468823123004649-gr5.jpg https://s3-eu-west-1.amazonaws.com/prod-ucs-content-store-eu-west/content/pii:S2468823123004649/gr5/DOWNSAMPLED/image/jpeg/1448bf4381190522f0320038dfb8b9cc/gr5.jpg gr5 gr5.jpg jpg 49568 409 433 IMAGE-DOWNSAMPLED 1-s2.0-S2468823123004649-gr1.jpg https://s3-eu-west-1.amazonaws.com/prod-ucs-content-store-eu-west/content/pii:S2468823123004649/gr1/DOWNSAMPLED/image/jpeg/87e9a3de911c481f537f11235a5c7563/gr1.jpg gr1 gr1.jpg jpg 74200 221 753 IMAGE-DOWNSAMPLED 1-s2.0-S2468823123004649-sc1.sml https://s3-eu-west-1.amazonaws.com/prod-ucs-content-store-eu-west/content/pii:S2468823123004649/sc1/THUMBNAIL/image/gif/204dd6817aec6f494382c53855ab1502/sc1.sml sc1 sc1.sml sml 5527 30 219 IMAGE-THUMBNAIL 1-s2.0-S2468823123004649-gr6.sml https://s3-eu-west-1.amazonaws.com/prod-ucs-content-store-eu-west/content/pii:S2468823123004649/gr6/THUMBNAIL/image/gif/60d28f39ef31672248b8e5d426225c13/gr6.sml gr6 gr6.sml sml 9875 156 219 IMAGE-THUMBNAIL 1-s2.0-S2468823123004649-gr7.sml https://s3-eu-west-1.amazonaws.com/prod-ucs-content-store-eu-west/content/pii:S2468823123004649/gr7/THUMBNAIL/image/gif/546f9c365b85e8e05277ad1f43b3873a/gr7.sml gr7 gr7.sml sml 14259 163 219 IMAGE-THUMBNAIL 1-s2.0-S2468823123004649-gr8.sml https://s3-eu-west-1.amazonaws.com/prod-ucs-content-store-eu-west/content/pii:S2468823123004649/gr8/THUMBNAIL/image/gif/1d75a6ed165e8e4e32a0151e5af13d24/gr8.sml gr8 gr8.sml sml 13759 157 219 IMAGE-THUMBNAIL 1-s2.0-S2468823123004649-gr2.sml https://s3-eu-west-1.amazonaws.com/prod-ucs-content-store-eu-west/content/pii:S2468823123004649/gr2/THUMBNAIL/image/gif/de40506937a25b9bdb85c81802a309d5/gr2.sml gr2 gr2.sml sml 12536 164 211 IMAGE-THUMBNAIL 1-s2.0-S2468823123004649-ga1.sml https://s3-eu-west-1.amazonaws.com/prod-ucs-content-store-eu-west/content/pii:S2468823123004649/ga1/THUMBNAIL/image/gif/e597fd12b5f9fb3777d14f3e2c9b73b1/ga1.sml ga1 true ga1.sml sml 14627 107 219 IMAGE-THUMBNAIL 1-s2.0-S2468823123004649-gr3.sml https://s3-eu-west-1.amazonaws.com/prod-ucs-content-store-eu-west/content/pii:S2468823123004649/gr3/THUMBNAIL/image/gif/f05f82c6c24ab47de3fd1eb0bc2f7cbc/gr3.sml gr3 gr3.sml sml 10806 161 219 IMAGE-THUMBNAIL 1-s2.0-S2468823123004649-gr4.sml https://s3-eu-west-1.amazonaws.com/prod-ucs-content-store-eu-west/content/pii:S2468823123004649/gr4/THUMBNAIL/image/gif/cdfd9cde8f57bcef373cdb0e9957c58c/gr4.sml gr4 gr4.sml sml 21473 102 219 IMAGE-THUMBNAIL 1-s2.0-S2468823123004649-gr5.sml https://s3-eu-west-1.amazonaws.com/prod-ucs-content-store-eu-west/content/pii:S2468823123004649/gr5/THUMBNAIL/image/gif/4084265da43f44255f3fbef56369195e/gr5.sml gr5 gr5.sml sml 9810 163 173 IMAGE-THUMBNAIL 1-s2.0-S2468823123004649-gr1.sml https://s3-eu-west-1.amazonaws.com/prod-ucs-content-store-eu-west/content/pii:S2468823123004649/gr1/THUMBNAIL/image/gif/3214f1b0df1805ce0818f39f02786fe3/gr1.sml gr1 gr1.sml sml 8497 64 219 IMAGE-THUMBNAIL 1-s2.0-S2468823123004649-sc1_lrg.jpg https://s3-eu-west-1.amazonaws.com/prod-ucs-content-store-eu-west/content/pii:S2468823123004649/HIGHRES/image/jpeg/970ec3c313ef51626bfd80a8a1e2bb46/sc1_lrg.jpg sc1 sc1_lrg.jpg jpg 126533 392 2847 IMAGE-HIGH-RES 1-s2.0-S2468823123004649-gr6_lrg.jpg https://s3-eu-west-1.amazonaws.com/prod-ucs-content-store-eu-west/content/pii:S2468823123004649/HIGHRES/image/jpeg/c8942dd1175501e815aabff84f7e8cbd/gr6_lrg.jpg gr6 gr6_lrg.jpg jpg 258477 1366 1917 IMAGE-HIGH-RES 1-s2.0-S2468823123004649-gr7_lrg.jpg https://s3-eu-west-1.amazonaws.com/prod-ucs-content-store-eu-west/content/pii:S2468823123004649/HIGHRES/image/jpeg/82a89362ad484360120c9d9344390494/gr7_lrg.jpg gr7 gr7_lrg.jpg jpg 679976 2048 2750 IMAGE-HIGH-RES 1-s2.0-S2468823123004649-gr8_lrg.jpg https://s3-eu-west-1.amazonaws.com/prod-ucs-content-store-eu-west/content/pii:S2468823123004649/HIGHRES/image/jpeg/f8345bb363401890b91c3856a385cfc9/gr8_lrg.jpg gr8 gr8_lrg.jpg jpg 588593 2025 2833 IMAGE-HIGH-RES 1-s2.0-S2468823123004649-gr2_lrg.jpg https://s3-eu-west-1.amazonaws.com/prod-ucs-content-store-eu-west/content/pii:S2468823123004649/HIGHRES/image/jpeg/5838f92044e553b9a825d00f5c9cf4c0/gr2_lrg.jpg gr2 gr2_lrg.jpg jpg 449313 1490 1917 IMAGE-HIGH-RES 1-s2.0-S2468823123004649-ga1_lrg.jpg https://s3-eu-west-1.amazonaws.com/prod-ucs-content-store-eu-west/content/pii:S2468823123004649/HIGHRES/image/jpeg/d382e486843b73fac45200d99dd818e3/ga1_lrg.jpg ga1 true ga1_lrg.jpg jpg 224133 886 1811 IMAGE-HIGH-RES 1-s2.0-S2468823123004649-gr3_lrg.jpg https://s3-eu-west-1.amazonaws.com/prod-ucs-content-store-eu-west/content/pii:S2468823123004649/HIGHRES/image/jpeg/e5ab1cad8a7145c8203589ba09fcb023/gr3_lrg.jpg gr3 gr3_lrg.jpg jpg 471967 2019 2750 IMAGE-HIGH-RES 1-s2.0-S2468823123004649-gr4_lrg.jpg https://s3-eu-west-1.amazonaws.com/prod-ucs-content-store-eu-west/content/pii:S2468823123004649/HIGHRES/image/jpeg/7647416e8456db5b6ed81fc94bc8f149/gr4_lrg.jpg gr4 gr4_lrg.jpg jpg 2028989 1549 3334 IMAGE-HIGH-RES 1-s2.0-S2468823123004649-gr5_lrg.jpg https://s3-eu-west-1.amazonaws.com/prod-ucs-content-store-eu-west/content/pii:S2468823123004649/HIGHRES/image/jpeg/fe464a824e8a499fa79dde3e3118b668/gr5_lrg.jpg gr5 gr5_lrg.jpg jpg 385538 1810 1917 IMAGE-HIGH-RES 1-s2.0-S2468823123004649-gr1_lrg.jpg https://s3-eu-west-1.amazonaws.com/prod-ucs-content-store-eu-west/content/pii:S2468823123004649/HIGHRES/image/jpeg/f91052ed075a82e05171966931224900/gr1_lrg.jpg gr1 gr1_lrg.jpg jpg 509582 979 3333 IMAGE-HIGH-RES 1-s2.0-S2468823123004649-mmc1.docx https://s3-eu-west-1.amazonaws.com/prod-ucs-content-store-eu-west/content/pii:S2468823123004649/mmc1/MAIN/application/vnd.openxmlformats-officedocument.wordprocessingml.document/11929cea6fdaf6f4837002c006ac7261/mmc1.docx mmc1 mmc1.docx docx 107476 APPLICATION 1-s2.0-S2468823123004649-am.pdf https://s3-eu-west-1.amazonaws.com/prod-ucs-content-store-eu-west/content/egi:10MDNL2BJ3Z/MAIN/application/pdf/497f31bfeb568d6acb25849492eb6ab3/am.pdf am am.pdf pdf false 995147 AAM-PDF MCAT 113380 113380 S2468-8231(23)00464-9 10.1016/j.mcat.2023.113380 Elsevier B.V. Fig. 1 (a) CO, (b) HC and (c) NO conversion on fresh catalysts (OD-f and IM-f) and aged catalysts (OD-a and IM-a). Fig 1 Fig. 2 Arrhenius plots of the turnover frequency (TOF) for (a) CO and (b) C3H6 oxidation on fresh catalysts (OD-f and IM-f) and aged catalysts (OD-a and IM-a). Fig 2 Fig. 3 (a) XRD patterns and (b) histogram about the related diffraction intensity of Pt (111) of fresh and aged catalysts; CO-DRIFTS spectra of (c) fresh catalysts and (d) aged catalysts after the reduction pretreatment collected at room temperature under 2 vol.% CO/N2 flow. Fig 3 Fig. 4 TEM images and particle size distribution (inset) of fresh and aged catalysts: (a) OD-f, 50 nm; (b) IM-f, 50 nm; (d) OD-a, 50 nm; (e) IM-a, 50 nm; HR-TEM images as well as the amplified image about normalized image intensities in different directions from the 2D particle: (c) OD-f, 2 nm (f) IM-f, 2 nm. Fig 4 Fig. 5 Pt 4f (Al 2p) curves of fresh catalysts: (a) OD-f; (b) IM-f;. Fig 5 Fig. 6 (a) H2-TPR curves of fresh catalysts; (b) CO-TPD curves of fresh catalysts with the reduction treatment of 2% CO/N2. Fig 6 Fig. 7 In situ DRIFT spectra of fresh and aged catalysts at 50 °C in 1000 ppm NO + 5 vol.% O2/N2 flow at different reaction time: (a) OD-f; (b) IM-f; (c) OD-a; (d) IM-a. Fig 7 Fig. 8 In situ DRIFT spectra of fresh and aged catalysts in 1000 ppm NO + 5 vol.% O2/N2 flow at a function temperature from 50 to 350 °C: (a) OD-f; (b) IM-f; (c) OD-a; (d) IM-a. Fig 8 Scheme 1 Schematic illustration of synthetic process of OD. Scheme 1 Table 1 The dispersion and average grain size of fresh and aged samples. Table 1 Sample Average grain size (nm) Pt Dispersion (%) a TEM XRD OD-f 3.9 9.5 30.2 IM-f 7.2 20.8 14.2 OD-a 8.0 14.2 14.1 IM-a 10.3 24.6 10.3 a The dispersion calculated from the TEM results [34,35]. Sintering resistance of Pt-based oxidation catalyst via constructing Pt/MnOx interface Yanli Liang Conceptualization Data curation Investigation Formal analysis Writing – original draft Writing – review & editing a ⁎ Jianli Wang Funding acquisition Supervision b ⁎ Ming Zhao Funding acquisition Supervision b Yaoqiang Chen Supervision b a School of Chemistry Engineering, Sichuan University of Science and Engineering, Zigong, 643000, PR China School of Chemistry Engineering Sichuan University of Science and Engineering Zigong 643000 PR China aSchool of Chemistry Engineering, Sichuan University of Science and Engineering, Zigong, 643000, PR China b Sichuan Provincial Environmental Protection Environmental Catalytic Materials, Engineering Technology Center, College of Chemistry, Sichuan University, Chengdu, Sichuan 610064, PR China Sichuan Provincial Environmental Protection Environmental Catalytic Materials Engineering Technology Center College of Chemistry Sichuan University Chengdu Sichuan 610064 PR China bSichuan Provincial Environmental Protection Environmental Catalytic Materials, Engineering Technology Center, College of Chemistry, Sichuan University, Chengdu, Sichuan 610064, PR China ⁎ Corresponding authors. It is a challenge to improve the catalytic activity and hydrothermal stability of platinum-based catalyst in concurrently oxidizing CO/C3H6/NO. The construction of Pt/MnOx interface over Pt-based diesel oxidation catalyst via overlayer deposition to form partial-embedded structure, inhibiting the aggregation of platinum nanoparticles in Ostwald Ripening process. Even after hydrothermal aging, the average platinum particle size is equal to that of the fresh catalyst via traditional impregnation method. The electronic-transferring from platinum to manganese results in a weaker CO adsorption ability on Pt species and an improved oxygen activation ability with the help of the redox cycle of Pt and MnOx, as well as the formation of more active nitrate species via in situ DRIFTs. Measurement on the activity shows the lower apparent activation energy, so that the light-off temperature of CO/C3H6/NO on the partial-embedded catalyst via overlayer deposition method decreases by around 20 °C and 40% NO maximum conversion still keeps after severely aging comparing with the traditional catalyst. The work enlightens us the importance of interface sites in stabilizing platinum atoms and creating oxidize active sites. Graphical abstract In comparing to impregnation method (IM), overlayer deposition method (OD) creates more Pt/MnOx interface, arresting the aggregation of platinum nanoparticles and enhancing the oxidation catalytic performance. Image, graphical abstract Keywords Interface structure Overlayer deposition Platinum Stability Data availability The authors do not have permission to share data. Introduction Diesel oxidation catalysts (DOCs) is critical component in diesel aftertreatment system combined with diesel particulate filter (DPF), selective catalytic reduction (SCR) and ammonia slip catalyst (ASC) [1]. To meet the increasingly stringent emission limits, DOCs are required to address the key challenge of improved low-temperature performance for a high efficiency on SCR [2]. Beside, the stability of DOC is also considered when DOC is exposed at the temperature higher than 600 °C for the active regeneration of adjacent DPF [3]. These two questions propel that a novel DOC would be designed in improving the low temperature and stability. Pt-based diesel oxidation catalysts are most common in commercial application for its high efficiency [4,5]. While, the easily aggregation of platinum could degrade the catalytic oxidation performance, which is the main disadvantage of Pt-based catalysts in the diesel oxidation. Generally, the enhancement of Pt stability mainly focuses on the research about metal-support interfaces [6,7] Li group [8] reported an active and stable catalyst for the active Pt1(II)-Ox- species specifically stabilized by Ba-Ox- species. After 650 °C hydrothermal aging, the atomically dispersed Pt retains the original full dispersion and similar CO TOF. Peden group [9] developed a well-defined cub octahedral MgAl2O4 spinel that could stabilize Pt particles in 1–3 nm after aging at 800 °C in air for 1 week. Previous works have found that the interface of Pt and CeO2 or MnOx is beneficial to improve the hydrothermal stability of catalysts [10,11]. Beside, metal/oxide interface creates the electronic effect and this region is chemically active, affecting the activation of reaction molecule and its subsequent transformation [12,13]. In simulated diesel emission exhaust gases, there exists a competitive oxidation of CO, hydrocarbon and NO in lean burn on DOC, in which CO is more preferentially adsorbed on active sites than C3H6, resulting in that the CO oxidation is prior to the C3H6 oxidation [14–17]. For CO oxidation, it is activity-structure correlations, especially on atomically dispersed metals [18,19]. Here, attention should be paid to weaken the CO adsorption via the promotion strategies. Recently, Guo et al. [20] reported the Pt-based catalyst modified by transition metal oxides for CO oxidation at ambient temperature, based on the strong interaction between Pt and promoters, which inhibits the CO adsorption. The similar idea has been adopted by BASF Company, [21] manganese oxides were introduced to improve the HC conversion and NO oxidation to NO2 in New European Driving Cycle (NEDC) testing. Thus, the addition of cheap 3d transition metal like MnOx to modify Pt-based DOC in particles size of platinum species turns to be more feasible in practical application. The interfacial formation is to tune the strong metal-support interaction (SMSI) of metals with reducible supports, including thermal treatment, reducing agent, reduction-oxidation cycles, and overlayer deposition so on [22,23]. Covering with an oxide overlayer is not only the basic function of stabilizing the metal nanoparticles, but also further applied to create specific interaction sites. Duan et al. [24] prepared Pt/MnO2@Mn3O4-I via synchronous reduction of segmental MnO2 and Pt precursor. Partial MnO2 are reduced to Mn3O4 and both have the strong interaction with Pt, thus forming the unique three-phase interfacial structure of Pt and MnO2@ Mn3O4. Wu et al. [25] developed the core-shell structure Pt @transition metal oxides(TMOs) supported on 3DOM-Al2O3 via mixing the obtained Pt/3DOM-Al2O3 and TM nitrates under precipitation agent(NH3·H2O). Sakae et al. [26] covered Pt metal nanoparticles supported on graphene oxide with metal oxide(TiO2 or ZrO2) nanosheets whose thicknesses of several nanometers to preferentially form of Pt/ metal oxide interfaces. This example emphasizes the importance of thin overlayer oxide, avoiding the coverage of the metal sites. Thus, herein we synthesize the partial-embedded MnOx overlayer on Pt-based catalyst with the aid of carbon layer from polymer to form the described interface-confined effect [27]. The method could preferentially utilize the interface for catalytic performance, while the catalyst prepared with conventional impregnation method has the exposed nano-platinum surfaces and some interfaces. The impact of interface on electronic transport and structure transformation in Pt-based catalyst via transmission electron microscope (TEM) and Diffuse Reflectance Infrared Fourier Transform (DRIFTs) studies will be discussed, providing a potential strategy for constructing interface in the preparation of highly efficient and stable oxidation catalysts. Experimental section Catalyst preparation (1) Traditional impregnation method: The Pt(NO3)2 solution and Mn(NO3)2 solution were impregnated on SiO2-Al2O3 powder (150 m2/g, Solway), containing 1 mass% Pt and a moral ratio of Pt/Mn=1:1. Then the catalyst is obtained after dried and calcined with the total wash-coated loading amount of each sample was about 140 g/L, as the previous method [28], which is labeled as IM-f. (2) Designed overlayer deposition method: Firstly, the Pt(NO3)2 solution and small amount polyvinyl alcohol were impregnated on SiO2-Al2O3 powder (150 m2/g, Solway), and the carbonized Pt/SiO2-Al2O3 is prepared from the previous work [29]. The obtained powder was impregnated by Mn(NO3)2 solution with the equal molar ratio of Pt with the loading amount of 1 wt%. Dried at 60 °C and calcined at 800 °C for 2 h under N2, and then calcined at 550 °C for 3 h (Scheme 1 ). The powder was wash-coated onto cylindrical cordierite monoliths with loading amount of each sample was about 140 g/L. The obtained monolithic catalysts were then calcined at 550 °C for 3 h in air and labeled as OD-f. Similar method have applied to the transitional metals (Co, Fe), as shown in Supporting information. The fresh catalysts OD-f and IM-f were aged at 700 °C for 10 h under the mixed simulated diesel react gasses: 200 ppm NO, 600 ppm C3H6, 1500 ppm CO, 5% O2, 8% H2O, and 4% CO2, using N2 as balance (800 mL/min). The final aged catalysts were labeled as OD-a and IM-a, respectively. Catalytic evaluation The catalytic performance of catalysts is evaluated according to the previous work [11]. The reactant conversion was defined by the following Eqs. (1)–(3): (1) CO conversion (%) = ([CO]inlet -[CO]outlet)/[CO]inlet*100% (2) HC conversion (%) = ([HC]inlet -[HC]outlet)/[HC]inlet*100% (3) NO conversion (%) = [NO2]outlet /([NO]outlet +[NO2]outlet)*100% Where[CO]inlet, [HC]inlet, [CO]outlet, [HC]outlet, [NO2]outlet and [NO]outlet were was the volumetric concentration of the corresponding species in the inlet and outlet gas mixture respectively. Catalyst characterizations X-ray diffraction (XRD) patterns of powdered samples were recorded with a Rigaku Ultima IV diffractometer with Cu Kα radiation (λ = 1.5406 Å). CO- diffuse reflectance infrared Fourier transform spectroscopy (DRIFTs) was adopted on Thermo Nicolet 6700 to obtain the spectra of CO adsorption on Pt species. High Resolution-Transmission electron microscopy (HR-TEM) measurement was performed by using Bruker Nano GmbH with an acceleration voltage of 200 kV. X-ray photoelectron spectroscopic (XPS) data were performed with an electron spectrometer (XSAM-800, Kratos Co.) equipped with an Al Kα radiation as a primary excitation. Binding energies were calculated on the basis of C 1s at 284.6 eV.H2-temperature programmed reduction (H2-TPR) experiments were used to measure the redox properties. CO-temperature programmed desorption (CO-TPD) experiments were adopted on the similar measurement to TPR. In situ DRIFTs spectra were obtained on the FTIR instruments (FTIR, Thermo Nicolet 6700). The detailed information is presented in Supporting information. Results and discussions Catalytic performance and heat stability Fig. 1 shows the DOC catalytic performance of fresh and aged Pt-based catalysts containing manganese prepared with different methods. The OD-f catalyst is significantly more active than the IM-f. For example, the temperature values required for 50% CO/C3H6 and 30% NO conversion are at 187 °C, 200 °C and 224 °C on OD-f, respectively, while that on IM-f are at 213 °C, 226 °C and 267 °C, respectively. And the maximum conversion (57%) of NO for OD-f is higher than that (which is about 37%) for IM-f. Fig. S1 shows the reproducibility on OD-f after three rounds of activity tests. No distinct difference could be presented on OD-f, indicating its great repeatability. After aging at 700 °C for 10 h in the mixed reaction gases including 8 vol.% H2O, the catalytic activity of both Pt-based catalysts in CO/C3H6/NO oxidation for the serious platinum aggregation in Ostwald Ripening process. Similar trends in light-off temperature and NO maximum conversion are presented on the aged catalysts OD-a and IM-a. For all conversions as shown in Fig. 1, a lower light-off temperature (around 10 °C) and higher NO maximum (around 5%) conversion on OD-a could be found when comparing on IM-f, indicating the excellent stability of the OD-a. The big difference in performance could be contributed to the preferential utilization of metal/oxide interface. In oxidation process, O2 adsorbs on the interface where the bond of O2 could be weakened, and then easily be activated to react [30]. Related apparent activation energy (Ea) is calculated from Arrhenius plots of turnover frequency (TOF) for CO and C3H6 oxidation reactions. In the case of CO oxidation reaction (Fig. 2 (a)), apparent activation energy on OD-f is about 66.1 kJ/mol, which is slightly smaller than that on IM-f (around 74.4 kJ/mol), indicating a better CO catalytic activity on OD-f. While for C3H6 oxidation reaction in Fig. 2(b), there is a remarkable difference in apparent activation energy between fresh and aged catalysts. Ea(C3H6) on OD-f and IM-f are around 193.9 kJ/mol and 207.5 kJ/mol, respectively. The results identify the better oxidation activity on OD-f. Likewise on aged catalysts, Ea(C3H6) on OD-a catalyst decreases by 115 kJ/mol than on IM-a catalyst. The kinetic behavior on all catalysts further explains the superior catalytic oxidation on OD catalysts not only on fresh one but also on aged one. Reaction condition: CO 1000 ppm, C3H6 330 ppm, NO 200 ppm, O2 10 vol.%, H2O 7 vol.%, CO2 8 vol.%, N2 balance, GHSV 60 kh−1; Aging condition: 600 ppm C3H6, 1500 ppm CO, 200 ppm NO, H2O 8 vol.%, 5 vol.% O2, 4 vol.% CO2, and N2 balance, at 700 °C for 10 h. The designed impregnation method has been extended to Fe/Co elements, and the detailed preparation process have been recorded in supporting information. Fig. S2 shows their CO/C3H6 total conversion temperature below at 200 °C and 210 °C, respectively; 30% NO conversion temperature around at 225 °C and NO maximum conversion up to around 60%. The results suggest the applicability of designed impregnation method in transitional metals (Fe/Co/Mn), thus providing the potential ability in application for eliminating emission. Structural properties X-ray diffraction patterns are presented to present the Pt crystallinity. And standard Mn2O3 and Pt cards are also presented in Fig. 3 (a). All catalysts containing fresh state and aged state have the weak Mn2O3 phase and the obvious platinum and support (γ-Al2O3) [28] phase. Paying attention to the characteristic (111) reflections of platinum at 39.8°, an obvious difference in diffraction intensity between fresh and aged catalysts is observed, as shown in Fig. 3(b). OD-f has the lowest diffraction intensity of Pt phase, indicating a higher platinum dispersion on OD-f than on IM-f. After hydrothermal aging, the degree of Pt crystallinity on both catalysts has a serve increase, reflecting a degraded Pt dispersion on aged catalysts. In Fig. 3(b), the diffraction intensity of Pt (111) on OD-a is about three times of that on OD-f, being equivalent to that on IM-f. The interesting results clearly reveal the higher catalytic oxidation performance on OD-f and OD-a than on IM-f, which are mainly contributed to the lower platinum crystallinity. To further investigate the exposed platinum sites, the probe molecule (CO) was introduced on the reduced catalysts at room temperature. In Fig. 3(c), there appears the vibration of gas CO (2100–2200 cm−1) and CO linear adsorption on Pt0 (2000–2100 cm−1). It is generally thought that higher CO adsorption intensity indicate the more exposed platinum sites. A strange result is observed that OD-f with a smaller aggregated degree has a weaker CO adsorption intensity than IM-f. Meanwhile, an intensive CO adsorption on Pt0 at 2072 cm−1 appears on IM-f with a shoulder peak at 2086 cm−1, while the peak of CO-Pt0 shifts to a higher wavenumber (2080 cm−1) on OD-f. Bonding occurs on the metal surface should obey the matches of energy level and the orbital direction from Blyholder model [31]. The 5σ orbital of CO and the unoccupied d-orbital of Pt atom could occur hybridization, forming platinum-carbon-oxygen bond. A large formal negative charge is given to Pt atoms, resulting in the back-donation from Pt d-orbital to 2π* orbital of CO in order to remove excess negative charge and make the bond stable. Thus, if the reduction of platinum atom in d electrons could weaken the bond of Pt-CO. In the interfacial region of oxides with high electron affinity and metals with low work function via deposition could induce the reduction of the oxide by direct electron transfer, leading to electron rich of oxide surface [32]. The blue shift on OD-f is contributed to the electron transfer from Pt to Mn, which is greatly speculated as the original reasons for its weaker CO-Pt0 peak. The weaker back-donation from d orbital (Pt) to π* orbital (adsorbed CO) could decrease the CO adsorbed intensity on OD-f. The phenomenon is similar as the report from a patent [21]. The less impact of CO poisoning on Pt is thereby beneficial to CO oxidation reaction especially at low temperature. Meanwhile for the aged catalysts, severe aggregation of platinum particles would greatly decrease in the exposed platinum species. According to our previous work [33], the particle size not valence state of platinum on the aged catalysts is crucial in improving catalytic performance. Here, the interaction of nano-MnOx and nano-Pt could inhibit the sintering in the Ostwald ripening, resulting in its relatively more platinum species exposed on OD-a compared to IM-a catalyst. As shown in Fig. 3(d), OD-a shows a stronger adsorption intensity of Pt0-CO than IM-a, verifying that the OD-a has more active platinum sites and great stability. In Fig. 4 , the distribution and growth of Pt after annealing on support is confirmed by the TEM and HRTEM images where Pt active phases are clearly resolved. In the fresh state (Fig. 4(a, b)), black Pt particles of OD-f catalyst become smaller and more homogeneously dispersed than that of IM-f. During hydrothermal aging, Pt nanoparticles on both catalysts grow up, as shown in Fig. 4(d, e). The initially large average platinum particles on IM-f grow even larger on IM-a, while a minor aggregation is displayed in OD-a compared with IM-a. Associating with the distribution of platinum inserted in Fig. 4(d-e), the frequency of small particles (d<4 nm) on OD-a is around 10%, yet less than 5% on IM-a, indicating the less aggregation appearing on OD-a. Further to the lattice fringe of Pt nanoparticles, Fig. 4(c) and (f) show the interplanar distances of 0.23 nm, corresponding to the (111) plane of platinum phases on both fresh catalysts. In particular, partial region with the lattice fringe of 0.27 nm is detected for OD-f on the surface of platinum particle, assigning to the Mn2O3 (222) phase. While no Mn2O3 is detected in the vicinity of nano-Pt on IM-f, indicating the weak interaction between platinum and manganese via traditional impregnation in the situation. The partial-embedded Mn2O3 on Pt nanoparticle verifies that Mn2O3 overlayers deposition on the surface of Pt-based catalyst. The formed interface region on OD-f exists the strong interaction of Pt with manganese and inhibits the aggregation of platinum nanoparticles. After statistical calculation from TEM results in Table 1 , the average platinum particle size of OD-f is 3.9 nm, which is the smallest measurement obtained, and its Pt dispersion is 30.2%. While in the case of the IM-f catalyst, the average Pt particle size is around twice than of OD-f. This trend is accordance to the XRD results. After hydrothermal aging, Pt particle agglomeration resulted in a sharply decrease of Pt dispersion on OD-a (14.1%) and IM-a (10.3%). The obvious inhibit effect of dispersion on aged catalyst might be contributed to the formation of partial-embedded structure on OD-f, which greatly promotes the anti-sintering of platinum. The lattice fringe in HR-TEM patterns could verify the construction of partial-embedded structure on OD-f, creating the interface-confined effect which inhibits the aggregation of platinum nanoparticles in Ostwald Ripening. The improved Pt dispersion on OD-f is beneficial to its better catalytic performance, comparing to IM-f. Beside, the formation of interface could affect the electronic state of platinum. Platinum chemical state Fig. 5 shows the Pt 4f (Al 2p) curves of surface platinum (Al) element on the fresh catalysts. The Pt 4f7/2 peak and the 4f5/2 peak from spin-orbit splitting are divided in assigning Pt0 (70.6 eV [36] and 74.0 eV), PtO (73.4 and 76.8 eV) and PtO2 (74.8 and 78.2 eV). By calculating the proportion of Pt0, OD-f and IM-f have the ratio of Pt0/Ptn+(n = 2, 4) as 28.5% and 32.3%, respectively, indicating that a slightly more oxidation state of platinum exists in surficial layer. Due to the overlapped Pt 4f with Al 2p, the difference in element portion is not obvious. To further investigate the variation in chemical state of platinum, the redox properties of catalysts were also investigated by the H2-TPR experiment. In Fig. 6 (a), the reduction temperature of platinum oxides on both catalysts is similar at around 94 °C. Total H2 consumption area on OD-f is a slightly higher of 22.9% than that on IM-f, which is line with the blue shift on CO-Pt0 in Section 3.2. Previous studies about the chemical state of platinum have been investigated on the aged catalysts, and it is found that the particle size of platinum is mainly important for catalytic oxidation performance [33]. After reduction treatment of CO, partial reduced platinum species adsorb CO at room temperature and then desorb at elevated temperature, as shown in Fig. 6(b). After reduction, the formation of semi-embed structure on OD-f could induce the oxygen from MnOx transformation to oxidize the reduced Pt species. According to the action mode of CO adsorption on Pt, the more formation of PtOx would be more easily to desorb CO, so that OD-f has a higher CO desorption amount of 10.4% than IM-f. The construction of interface on OD-f would promote the formation of platinum oxides for the electron transfer from Mn to Pt. The decreased electronic density of Pt could weaken CO adsorption ability appearing on OD-f. According to the characteristic sequence of oxidation reaction (CO, C3H6 and NO), the better CO catalytic performance could promote the following NO oxidation reaction. NOx adsorption and desorption behavior by in situ DRIFTs Detecting the reaction process is beneficial to investigate the original discrepancy of catalysts. Before reaction, the initial adsorption behaviors of reaction molecules are crucial for the following temperature rising. Fig. 7 presents the co-adsorption curves of NO and O2 at 50 °C as a function of time using in situ DRIFTs [37]. At 1 min, the band at 1630 cm−1 firstly appears on the surface of OD-f, assigning to the bridged nitrates. With the increased time to 5 min, bridged nitrates become saturated adsorption. At 10 min, a new band assigned to the chelating nitrates at 1601 cm−1 appears. Further to 20 min, ionic nitrates (1370 and 1396 cm−1) gradually form. Increasing with the adsorption time to 40 min, all nitrates present an increased adsorption intensity in Fig. 7(a), and the intensity of bridged/chelating nitrates is stronger than that of ionic nitrates. Similar adsorption experiments were adopted on IM-f in Fig. 7(b). However, there has a big difference in surficial adsorption species, compared to Fig. 7(a). Expect for the bridged nitrates, ionic nitrates with same intensity have also appeared at 1 min. Along with the appearance of chelating nitrates at 10 min, the intensity of ionic nitrates is stronger. The rising tendency continue to the adsorption saturation at 40 min, resulting in the more formation of ionic nitrates than chelating/bridged nitrates. Stable ionic nitrates are uneasy to decompose, which might affect the form rate of final product. Fig. 7(c) and (d) show the co-adsorption spectra of NO and O2 on the aged catalysts as the parallel comparison. Obviously, more ionic nitrates and less bridged nitrates form on the aged catalysts, comparing to the adsorption species on fresh catalysts. In detail, ionic nitrates quickly form on OD-a at 1 min and continually increases up to 30 min, along with the relatively weaker bridged nitrates appearing from 1 min to 30 min and chelating nitrates appearing from 15 min to 30 min. Meanwhile for IM-a, the similar weak intensity of ionic nitrates and bridged nitrates emerge at 1 min. With an accelerating time, then intensity of ionic nitrates gradually increases, yet no variation in bridged nitrates. Finally, OD-a has a lower intensity of ionic nitrates than IM-a. After the saturated adsorption at 50 °C, then the spectra were recorded as a function of temperature up to 350 °C as an interval of 100 °C. In Fig. 8 (a), a portion of bridged nitrites appearing at around 1326 cm−1 forms on OD-f catalyst at 150 °C and then decreases at 350 °C. Similar variation in the formation and reduction of nitrites occurs on the IM-f catalyst (Fig. 8(b)). And ionic/bridged/ chelating nitrates present the decreased trend with an elevated temperature. Especially at 350 °C, most of ionic nitrates have decomposed to form the micro molecule, resulting in a sharply decreases. For the aged catalysts, monodentate nitrates (1553 cm−1, 1534 cm−1) forms at 150 °C and gradually decreases to 350 °C. It could be found that the ionic nitrates have an obvious decreased tendency on OD-a from 150 to 350 °C, yet no change appears on IM-a indicating its more difficult decomposition and less NO2 formation. Based on the above-mentioned experimental results, advanced Pt-based diesel oxidation catalyst via deposition method reveal the great catalytic performance and stability, where are some following reasons: (i) the higher dispersion of Pt before and after aging exist on OD, which could maintain the more exposed platinum sites for oxidizing process; (ii) the strong electronic transferring from manganese to platinum induce the positive electron on platinum atoms, weakening the CO strong-adsorption ability and facilitating the first-step CO oxidation process; (iii) In addition, the detected partial-embedded MnOx on platinum particle contribute to the first two, which promote the formation of nitrates in NO oxidation process and finally contribute to the superior catalytic activity and stability. Conclusions A designed overlayer deposition method was adopted to prepare the Pt/oxide interface via the formation of partial-embed structure over Pt-based catalysts, which greatly improved the catalytic performance and hydrothermal stability on CO/C3H6/NO oxidation. Their light-off temperature decreased by around 20 °C and 40% NO maximum conversion is still kept after severely aging, comparing to the catalyst prepared by traditional impregnation method. The formation of interface between Pt and MnOx results in a decrease in the apparent activity energy of CO/C3H6 and then a weaken in CO adsorption on platinum due to the electron transferring from Pt to manganese. The electron transferring from Pt to manganese further promotes the redox property, enhancing the oxygen activation ability. The partial-embed structure causing the interface-confinement could arrest the aggregation of platinum nanoparticles, improving the platinum dispersion before and after aging. And it results in the more active surficial nitrate species. Comparing with the patent [38] that CO T50 of only-Pt catalyst (1 mass% Pt) via colloidal method was 208 °C, our reported catalyst has a better low-temperature activity under a higher GHSV. In summary, the construction of interface-confinement is available for enhancing the platinum dispersion and oxygen activation, extending noble-metal oxidation catalysis to the realm of industrial applications. CRediT authorship contribution statement Yanli Liang: Conceptualization, Data curation, Investigation, Formal analysis, Writing – original draft, Writing – review & editing. Jianli Wang: Funding acquisition, Supervision. Ming Zhao: Funding acquisition, Supervision. Yaoqiang Chen: Supervision. Declaration of Competing Interest The authors declare that they have no known competing financial interests or personal relationships that could have appeared to influence the work reported in this paper. Acknowledgments We gratefully acknowledge National Natural Science Foundation of China (22172106) and Vanadium and Titanium Resource Comprehensive Utilization Key Laboratory of Sichuan Province (2022FTSZ16) for the generous financial support to our research. The authors gratefully acknowledge Shanling Wang of the Analytical & Testing Center (ATC) of Sichuan University for performing TEM characterization. Supplementary materials Supplementary material associated with this article can be found, in the online version, at doi:10.1016/j.mcat.2023.113380. Appendix Supplementary materials Image, application 1 References [1] C.H. Kim M. Schmid S.J. Schmieg J. Tan W. Li The effect of Pt-Pd ratio on oxidation catalysts under simulated diesel exhaust SAE Tech. Pap. 2011 2011-2001-1134 C.H. Kim, M. Schmid, S.J. Schmieg, J. Tan, W. Li, The effect of Pt-Pd ratio on oxidation catalysts under simulated diesel exhaust, SAE Tech. Pap., (2011) 2011-2001-1134. [2] A. Joshi, Review of vehicle engine efficiency and emissions, SAE Tech. Pap., 2019-01-0314 (2019). [3] P. Anguita F. Gaillard E. Iojoiu S. Gil A. Giroir-Fendler Study of hydrothermal aging impact on Na- and P-modified diesel oxidation catalyst (DOC) J. Catal. 375 2019 329 338 P. Anguita, F. Gaillard, E. Iojoiu, S. Gil, A. Giroir-Fendler, Study of hydrothermal aging impact on Na- and P-modified diesel oxidation catalyst (DOC), J. Catal., 375 (2019) 329–338. [4] T. Johnson Vehicular emissions in review SAE Int. J. Engines 6 2013 699 715 T. Johnson, Vehicular emissions in review, SAE Int. J. Engines, 6 (2013) 699–715. [5] T.V. Johnson Review of vehicular emissions trends SAE Int. J. Engines 8 2015 1152 1167 T.V. Johnson, Review of vehicular emissions trends, SAE Int. J. Engines, 8 (2015) 1152–1167. [6] K. Fujiwara K. Okuyama S.E. Pratsinis Metal-support interactions in catalysts for environmental remediation Environ. Sci. Nano 4 2017 2076 2092 K. Fujiwara, K. Okuyama, S.E. Pratsinis, Metal-support interactions in catalysts for environmental remediation, Environ. Sci. Nano, 4 (2017) 2076–2092. [7] Y. Nagai T. Hirabayashi K. Dohmae N. Takagi T. Minami H. Shinjoh S.i. Matsumoto Sintering inhibition mechanism of platinum supported on ceria-based oxide and Pt-oxide-support interaction J. Catal. 242 2006 103 109 Y. Nagai, T. Hirabayashi, K. Dohmae, N. Takagi, T. Minami, H. Shinjoh, S.i. Matsumoto, Sintering inhibition mechanism of platinum supported on ceria-based oxide and Pt-oxide-support interaction, J. Catal., 242 (2006) 103–109. [8] H. Wang J. Dong L.F. Allard S. Lee S. Oh J. Wang W. Li M. Shen M. Yang Single-site Pt/La-Al2O3 stabilized by barium as an active and stable catalyst in purifying CO and C3H6 emissions Appl. Catal. B Environ. 244 2019 327 339 H. Wang, J. Dong, L.F. Allard, S. Lee, S. Oh, J. Wang, W. Li, M. Shen, M. Yang, Single-site Pt/La-Al2O3 stabilized by barium as an active and stable catalyst in purifying CO and C3H6 emissions, Appl. Catal. B Environ., 244 (2019) 327–339. [9] W.Z. Li L. Kovarik D. Mei J. Liu Y. Wang C.H. Peden Stable platinum nanoparticles on specific MgAl2O4 spinel facets at high temperatures in oxidizing atmospheres Nat. Commun. 4 2013 2481 W.Z. Li, L. Kovarik, D. Mei, J. Liu, Y. Wang, C.H. Peden, Stable platinum nanoparticles on specific MgAl2O4 spinel facets at high temperatures in oxidizing atmospheres, Nat. Commun.., 4 (2013) 2481. [10] Y. Liang X. Ding J. Dai M. Zhao L. Zhong J. Wang Y. Chen Active oxygen-promoted NO catalytic on monolithic Pt-based diesel oxidation catalyst modified with Ce Catal. Today 327 2019 64 72 Y. Liang, X. Ding, J. Dai, M. Zhao, L. Zhong, J. Wang, Y. Chen, Active oxygen-promoted NO catalytic on monolithic Pt-based diesel oxidation catalyst modified with Ce, Catal. Today, 327 (2019) 64–72. [11] Y. Liang D. He X. Ding J. Wang M. Zhao Y. Chen Effect of MnOx phase on Pt-based catalyst for enhancing CO/C3H6/NO oxidation performance Int. J. Hydrog. Energy 47 2022 30722 30731 Y. Liang, D. He, X. Ding, J. Wang, M. Zhao, Y. Chen, Effect of MnOx phase on Pt-based catalyst for enhancing CO/C3H6/NO oxidation performance, Int. J. Hydrog. Energy, 47 (2022) 30722–30731. [12] S. Kattel P. Liu J.G. Chen Tuning selectivity of CO2 hydrogenation reactions at the metal/oxide interface J. Am. Chem. Soc. 139 2017 9739 9754 S. Kattel, P. Liu, J.G. Chen, Tuning selectivity of CO2 hydrogenation reactions at the metal/oxide interface, J. Am. Chem. Soc., 139 (2017) 9739–9754. [13] Y.L. Liang J.L. Wang M. Zhao Y.Q. Chen Enhanced performance of Pt-based diesel oxidation catalyst via defective MnOx: the role of Pt/MnOx interface Mol. Catal. 521 2022 112198 Y.L. Liang, J.L. Wang, M. Zhao, Y.Q. Chen, Enhanced performance of Pt-based diesel oxidation catalyst via defective MnOx: the role of Pt/MnOx interface, Mol. Catal., 521 (2022) 112198. [14] M.H. Al-Harbi Robert Martin Votsmeier W.S. Epling Competitive NO, CO and hydrocarbon oxidation reactions over a diesel oxidation catalyst Can. J. Chem. Eng. 90 2012 1527 1538 M.H. Al-Harbi, Robert; Votsmeier, Martin; Epling, W.S., Competitive NO, CO and hydrocarbon oxidation reactions over a diesel oxidation catalyst, Can. J. Chem. Eng., 90 (2012) 1527–1538. [15] K. Irani W.S. Empling R. Blint Effect of hydrocarbon species on no oxidation over diesel oxidation catalysts Appl. Catal. B Environ. 92 2009 422 428 K. Irani, W.S. Empling, R. Blint, Effect of hydrocarbon species on no oxidation over diesel oxidation catalysts, Appl. Catal. B Environ., 92 (2009) 422–428. [16] A. Arvajová P. Kočí V. Schmeißer M. Weibel The impact of CO and C3H6 pulses on PtOx reduction and NO oxidation in a diesel oxidation catalyst Appl. Catal. B Environ. 181 2016 644 650 A. Arvajová, P. Kočí, V. Schmeißer, M. Weibel, The impact of CO and C3H6 pulses on PtOx reduction and NO oxidation in a diesel oxidation catalyst, Appl. Catal. B Environ., 181 (2016) 644–650. [17] A. Arvajová P. Kočí Impact of PtOx formation in diesel oxidation catalyst on NO2 yield during driving cycles Chem. Eng. Sci. 158 2017 181 187 A. Arvajová, P. Kočí, Impact of PtOx formation in diesel oxidation catalyst on NO2 yield during driving cycles, Chem. Eng. Sci., 158 (2017) 181–187. [18] M.J. Hülsey S. Baskaran S. Ding S. Wang H. Asakura S. Furukawa S. Xi Q. Yu C.Q. Xu J. Li N. Yan Identifying key descriptors for the single-atom catalyzed CO oxidation CCS Chem. 4 2022 3296 3308 M.J. Hülsey, S. Baskaran, S. Ding, S. Wang, H. Asakura, S. Furukawa, S. Xi, Q. Yu, C.Q. Xu, J. Li, N. Yan, Identifying key descriptors for the single-atom catalyzed CO oxidation, CCS Chem., 4 (2022) 3296–3308. [19] S. Ding H.A. Chen O. Mekasuwandumrong M.J. Hülsey X. Fu Q. He J. Panpranot C.M. Yang N. Yan High-temperature flame spray pyrolysis induced stabilization of Pt single-atom catalysts Appl. Catal. B Environ. 281 2021 119471 S. Ding, H.A. Chen, O. Mekasuwandumrong, M.J. Hülsey, X. Fu, Q. He, J. Panpranot, C.M. Yang, N. Yan, High-temperature flame spray pyrolysis induced stabilization of Pt single-atom catalysts, Appl. Catal. B Environ., 281 (2021) 119471. [20] S. Song Y. Wu S. Ge L. Wang Y. Wang Y. Guo W. Zhan Y. Guo A facile way to improve Pt atom efficiency for CO oxidation at low temperature: modification by transition metal oxides ACS Catal. 9 2019 6177 6187 S. Song, Y. Wu, S. Ge, L. Wang, Y. Wang, Y. Guo, W. Zhan, Y. Guo, A facile way to improve Pt atom efficiency for CO oxidation at low temperature: modification by transition metal oxides, ACS Catal.., 9 (2019) 6177–6187. [21] S. Sung, S.A. Roth, C. Zabel, S. Stiebels, A. Sundermann, O. Gerlach, Manganese-containing diesel oxidation catalyst, US patent, (2019) 10335776. [22] I. Ro J. Resasco P. Christopher Approaches for understanding and controlling interfacial effects in oxide-supported metal catalysts ACS Catal. 8 2018 7368 7387 I. Ro, J. Resasco, P. Christopher, Approaches for understanding and controlling interfacial effects in oxide-supported metal catalysts, ACS Catal.., 8 (2018) 7368–7387. [23] V. Deelen W. Tom M. Hernández C. de Jong P. Krijin Control of metal-support interactions in heterogeneous catalysts to enhance activity and selectivity Nat. Catal. 2 2019 955 970 V. Deelen, W. Tom, M. Hernández, C. de Jong, P. Krijin, Control of metal-support interactions in heterogeneous catalysts to enhance activity and selectivity, Nat. Catal.., 2 (2019) 955–970. [24] X. Duan Z. Qu C. Dong Y. Qin Enhancement of toluene oxidation performance over Pt/MnO2@Mn3O4 catalyst with unique interfacial structure Appl. Surf. Sci. 503 2020 144161 X. Duan, Z. Qu, C. Dong, Y. Qin, Enhancement of toluene oxidation performance over Pt/MnO2@Mn3O4 catalyst with unique interfacial structure, Appl. Surf. Sci., 503 (2020) 144161. [25] Q. Wu M. Jing Y. Wei Z. Zhao X. Zhang J. Xiong J. Liu W. Song J. Li High-efficient catalysts of core-shell structured Pt@transition metal oxides (TMOs) supported on 3DOM-Al2O3 for soot oxidation: the effect of strong Pt-TMO interaction Appl. Catal. B Environ. 224 2019 628 640 Q. Wu, M. Jing, Y. Wei, Z. Zhao, X. Zhang, J. Xiong, J. Liu, W. Song, J. Li, High-efficient catalysts of core-shell structured Pt@transition metal oxides (TMOs) supported on 3DOM-Al2O3 for soot oxidation: the effect of strong Pt-TMO interaction, Appl. Catal. B Environ., 224 (2019) 628–640. [26] S. Takenaka R. Kaji K. Sugiyama R. Ida Preparation of composite catalysts composed of Pt nanoparticles and metal oxide nanosheets: preferential formation of Pt/metal oxide interfaces Appl. Catal. A Gen. 566 2018 52 59 S. Takenaka, R. Kaji, K. Sugiyama, R. Ida, Preparation of composite catalysts composed of Pt nanoparticles and metal oxide nanosheets: preferential formation of Pt/metal oxide interfaces, Appl. Catal. A Gen., 566 (2018) 52–59. [27] X. Xu Q. Fu L. Gan J. Zhu X. Bao Interface-confined FeOx adlayers induced by metal support interaction in Pt/FeOx catalysts J. Phys. Chem. B 122 2018 984 990 X. Xu, Q. Fu, L. Gan, J. Zhu, X. Bao, Interface-confined FeOx adlayers induced by metal support interaction in Pt/FeOx catalysts, J. Phys. Chem. B, 122 (2018) 984–990. [28] Y. Liang M. Zhao J. Wang M. Sun S. Li Y. Huang L. Zhong M. Gong Y. Chen Enhanced activity and stability of the monolithic Pt/SiO2-Al2O3 diesel oxidation catalyst promoted by suitable tungsten additive amount J. Ind. Eng. Chem. 54 2017 359 368 Y. Liang, M. Zhao, J. Wang, M. Sun, S. Li, Y. Huang, L. Zhong, M. Gong, Y. Chen, Enhanced activity and stability of the monolithic Pt/SiO2-Al2O3 diesel oxidation catalyst promoted by suitable tungsten additive amount, J. Ind. Eng. Chem., 54 (2017) 359–368. [29] Y. Liang X. Ding J. Wang M. Zhao Y. Dan L. Jiang Y. Chen Catalytic performance promoted on Pt-based diesel oxidation catalyst assisted by polyvinyl alcohol Environ. Sci. Pollut. Res. 27 2020 41824 41838 Y. Liang, X. Ding, J. Wang, M. Zhao, Y. Dan, L. Jiang, Y. Chen, Catalytic performance promoted on Pt-based diesel oxidation catalyst assisted by polyvinyl alcohol, Environ. Sci. Pollut. Res., 27 (2020) 41824–41838. [30] A. Ruiz Puigdollers P. Schlexer S. Tosoni G. Pacchioni Increasing oxide reducibility: the role of metal/oxide interfaces in the formation of oxygen vacancies ACS Catal 7 2017 6493 6513 A. Ruiz Puigdollers, P. Schlexer, S. Tosoni, G. Pacchioni, Increasing oxide reducibility: the role of metal/oxide interfaces in the formation of oxygen vacancies, ACS Catal., 7 (2017) 6493–6513. [31] G. Blyholder Molecular orbital view of chemisorbed carbon monoxide J. Phys. Chem. 68 1964 2772 2777 G. Blyholder, Molecular orbital view of chemisorbed carbon monoxide, J. Phys. Chem., 68 (1964) 2772–2777. [32] G. Pacchioni Electronic interactions and charge transfers of metal atoms and clusters on oxide surfaces Phys. Chem. Chem. Phys. 15 2013 1737 1757 G. Pacchioni, Electronic interactions and charge transfers of metal atoms and clusters on oxide surfaces, Phys. Chem. Chem. Phys., 15 (2013) 1737–1757. [33] Y. Liang X. Ding M. Zhao J. Wang Y. Chen Effect of valence state and particle size on NO oxidation in fresh and aged Pt-based diesel oxidation catalysts Appl. Surf. Sci. 443 2018 336 344 Y. Liang, X. Ding, M. Zhao, J. Wang, Y. Chen, Effect of valence state and particle size on NO oxidation in fresh and aged Pt-based diesel oxidation catalysts, Appl. Surf. Sci., 443 (2018) 336–344. [34] J.K. Matthew C. Phillip Utilizing quantitative in-situ FTIR spectroscopy to identify well-coordinated Pt atoms as the active site for CO oxidation on Al2O3 supported Pt catalysts ACS Catal. 6 2016 5599 5609 J.K. Matthew, C. Phillip, Utilizing quantitative in-situ FTIR spectroscopy to identify well-coordinated Pt atoms as the active site for CO oxidation on Al2O3 supported Pt catalysts, ACS Catal.., 6 (2016) 5599–5609. [35] M.I. Larsson, Dispersion and metal particle size characterization of nanocatalysts, US patent, (2010) 7813523. [36] G.J. Kim D.W. Kwon S.C. Hong Effect of Pt particle size and valence state on the performance of Pt/TiO2 catalysts for CO oxidation at room temperature J. Phys. Chem. C 120 2016 17996 18004 G.J. Kim, D.W. Kwon, S.C. Hong, Effect of Pt particle size and valence state on the performance of Pt/TiO2 catalysts for CO oxidation at room temperature, J. Phys. Chem. C, 120 (2016) 17996–18004. [37] Y. Liang C. Ou Z. Hao X. Ding Z. Ming J. Wang Y. Chen Advanced insight into the size effect of PtPd nanoparticles on NO oxidation by in situ FTIR spectra Ind. Eng. Chem. Res. 57 2018 3887 3897 Y. Liang, C. Ou, Z. Hao, X. Ding, Z. Ming, J. Wang, Y. Chen, Advanced insight into the size effect of PtPd nanoparticles on NO oxidation by in situ FTIR spectra, Ind. Eng. Chem. Res., 57 (2018) 3887–3897. [38] A. Siani, T. Muller-Stach, T. Neubauer, X.Y. Wei, Preparation of diesel oxidation catalyst via deposition of colloidal nanoparticles, US patent, (2017) 9687818.",
      "scopus-id": "85165301947",
      "coredata": {
        "eid": "1-s2.0-S2468823123004649",
        "dc:description": "It is a challenge to improve the catalytic activity and hydrothermal stability of platinum-based catalyst in concurrently oxidizing CO/C3H6/NO. The construction of Pt/MnOx interface over Pt-based diesel oxidation catalyst via overlayer deposition to form partial-embedded structure, inhibiting the aggregation of platinum nanoparticles in Ostwald Ripening process. Even after hydrothermal aging, the average platinum particle size is equal to that of the fresh catalyst via traditional impregnation method. The electronic-transferring from platinum to manganese results in a weaker CO adsorption ability on Pt species and an improved oxygen activation ability with the help of the redox cycle of Pt and MnOx, as well as the formation of more active nitrate species via in situ DRIFTs. Measurement on the activity shows the lower apparent activation energy, so that the light-off temperature of CO/C3H6/NO on the partial-embedded catalyst via overlayer deposition method decreases by around 20 °C and 40% NO maximum conversion still keeps after severely aging comparing with the traditional catalyst. The work enlightens us the importance of interface sites in stabilizing platinum atoms and creating oxidize active sites.",
        "openArchiveArticle": "false",
        "prism:coverDate": "2023-08-31",
        "openaccessUserLicense": null,
        "prism:aggregationType": "Journal",
        "prism:url": "https://api.elsevier.com/content/article/pii/S2468823123004649",
        "dc:creator": [
          {
            "@_fa": "true",
            "$": "Liang, Yanli"
          },
          {
            "@_fa": "true",
            "$": "Wang, Jianli"
          },
          {
            "@_fa": "true",
            "$": "Zhao, Ming"
          },
          {
            "@_fa": "true",
            "$": "Chen, Yaoqiang"
          }
        ],
        "link": [
          {
            "@_fa": "true",
            "@rel": "self",
            "@href": "https://api.elsevier.com/content/article/pii/S2468823123004649"
          },
          {
            "@_fa": "true",
            "@rel": "scidir",
            "@href": "https://www.sciencedirect.com/science/article/pii/S2468823123004649"
          }
        ],
        "dc:format": "application/json",
        "openaccessType": null,
        "pii": "S2468-8231(23)00464-9",
        "prism:volume": "547",
        "articleNumber": "113380",
        "prism:publisher": "Elsevier B.V.",
        "dc:title": "Sintering resistance of Pt-based oxidation catalyst via constructing Pt/MnOx interface",
        "prism:copyright": "© 2023 Elsevier B.V. All rights reserved.",
        "openaccess": "0",
        "prism:issn": "24688231",
        "dcterms:subject": [
          {
            "@_fa": "true",
            "$": "Interface structure"
          },
          {
            "@_fa": "true",
            "$": "Overlayer deposition"
          },
          {
            "@_fa": "true",
            "$": "Platinum"
          },
          {
            "@_fa": "true",
            "$": "Stability"
          }
        ],
        "openaccessArticle": "false",
        "prism:publicationName": "Molecular Catalysis",
        "openaccessSponsorType": null,
        "prism:pageRange": "113380",
        "pubType": "fla",
        "prism:coverDisplayDate": "August 2023",
        "prism:doi": "10.1016/j.mcat.2023.113380",
        "prism:startingPage": "113380",
        "dc:identifier": "doi:10.1016/j.mcat.2023.113380",
        "openaccessSponsorName": null
      },
      "objects": {
        "object": [
          {
            "@category": "standard",
            "@height": "89",
            "@width": "643",
            "@_fa": "true",
            "$": "https://api.elsevier.com/content/object/eid/1-s2.0-S2468823123004649-sc1.jpg?httpAccept=%2A%2F%2A",
            "@multimediatype": "JPEG image file",
            "@type": "IMAGE-DOWNSAMPLED",
            "@size": "20250",
            "@ref": "sc1",
            "@mimetype": "image/jpeg"
          },
          {
            "@category": "standard",
            "@height": "309",
            "@width": "433",
            "@_fa": "true",
            "$": "https://api.elsevier.com/content/object/eid/1-s2.0-S2468823123004649-gr6.jpg?httpAccept=%2A%2F%2A",
            "@multimediatype": "JPEG image file",
            "@type": "IMAGE-DOWNSAMPLED",
            "@size": "36622",
            "@ref": "gr6",
            "@mimetype": "image/jpeg"
          },
          {
            "@category": "standard",
            "@height": "462",
            "@width": "621",
            "@_fa": "true",
            "$": "https://api.elsevier.com/content/object/eid/1-s2.0-S2468823123004649-gr7.jpg?httpAccept=%2A%2F%2A",
            "@multimediatype": "JPEG image file",
            "@type": "IMAGE-DOWNSAMPLED",
            "@size": "87889",
            "@ref": "gr7",
            "@mimetype": "image/jpeg"
          },
          {
            "@category": "standard",
            "@height": "457",
            "@width": "640",
            "@_fa": "true",
            "$": "https://api.elsevier.com/content/object/eid/1-s2.0-S2468823123004649-gr8.jpg?httpAccept=%2A%2F%2A",
            "@multimediatype": "JPEG image file",
            "@type": "IMAGE-DOWNSAMPLED",
            "@size": "76874",
            "@ref": "gr8",
            "@mimetype": "image/jpeg"
          },
          {
            "@category": "standard",
            "@height": "337",
            "@width": "433",
            "@_fa": "true",
            "$": "https://api.elsevier.com/content/object/eid/1-s2.0-S2468823123004649-gr2.jpg?httpAccept=%2A%2F%2A",
            "@multimediatype": "JPEG image file",
            "@type": "IMAGE-DOWNSAMPLED",
            "@size": "60579",
            "@ref": "gr2",
            "@mimetype": "image/jpeg"
          },
          {
            "@category": "standard",
            "@height": "200",
            "@width": "409",
            "@_fa": "true",
            "$": "https://api.elsevier.com/content/object/eid/1-s2.0-S2468823123004649-ga1.jpg?httpAccept=%2A%2F%2A",
            "@multimediatype": "JPEG image file",
            "@type": "IMAGE-DOWNSAMPLED",
            "@size": "32494",
            "@ref": "ga1",
            "@mimetype": "image/jpeg"
          },
          {
            "@category": "standard",
            "@height": "456",
            "@width": "621",
            "@_fa": "true",
            "$": "https://api.elsevier.com/content/object/eid/1-s2.0-S2468823123004649-gr3.jpg?httpAccept=%2A%2F%2A",
            "@multimediatype": "JPEG image file",
            "@type": "IMAGE-DOWNSAMPLED",
            "@size": "71261",
            "@ref": "gr3",
            "@mimetype": "image/jpeg"
          },
          {
            "@category": "standard",
            "@height": "350",
            "@width": "753",
            "@_fa": "true",
            "$": "https://api.elsevier.com/content/object/eid/1-s2.0-S2468823123004649-gr4.jpg?httpAccept=%2A%2F%2A",
            "@multimediatype": "JPEG image file",
            "@type": "IMAGE-DOWNSAMPLED",
            "@size": "131678",
            "@ref": "gr4",
            "@mimetype": "image/jpeg"
          },
          {
            "@category": "standard",
            "@height": "409",
            "@width": "433",
            "@_fa": "true",
            "$": "https://api.elsevier.com/content/object/eid/1-s2.0-S2468823123004649-gr5.jpg?httpAccept=%2A%2F%2A",
            "@multimediatype": "JPEG image file",
            "@type": "IMAGE-DOWNSAMPLED",
            "@size": "49568",
            "@ref": "gr5",
            "@mimetype": "image/jpeg"
          },
          {
            "@category": "standard",
            "@height": "221",
            "@width": "753",
            "@_fa": "true",
            "$": "https://api.elsevier.com/content/object/eid/1-s2.0-S2468823123004649-gr1.jpg?httpAccept=%2A%2F%2A",
            "@multimediatype": "JPEG image file",
            "@type": "IMAGE-DOWNSAMPLED",
            "@size": "74200",
            "@ref": "gr1",
            "@mimetype": "image/jpeg"
          },
          {
            "@category": "thumbnail",
            "@height": "30",
            "@width": "219",
            "@_fa": "true",
            "$": "https://api.elsevier.com/content/object/eid/1-s2.0-S2468823123004649-sc1.sml?httpAccept=%2A%2F%2A",
            "@multimediatype": "GIF image file",
            "@type": "IMAGE-THUMBNAIL",
            "@size": "5527",
            "@ref": "sc1",
            "@mimetype": "image/gif"
          },
          {
            "@category": "thumbnail",
            "@height": "156",
            "@width": "219",
            "@_fa": "true",
            "$": "https://api.elsevier.com/content/object/eid/1-s2.0-S2468823123004649-gr6.sml?httpAccept=%2A%2F%2A",
            "@multimediatype": "GIF image file",
            "@type": "IMAGE-THUMBNAIL",
            "@size": "9875",
            "@ref": "gr6",
            "@mimetype": "image/gif"
          },
          {
            "@category": "thumbnail",
            "@height": "163",
            "@width": "219",
            "@_fa": "true",
            "$": "https://api.elsevier.com/content/object/eid/1-s2.0-S2468823123004649-gr7.sml?httpAccept=%2A%2F%2A",
            "@multimediatype": "GIF image file",
            "@type": "IMAGE-THUMBNAIL",
            "@size": "14259",
            "@ref": "gr7",
            "@mimetype": "image/gif"
          },
          {
            "@category": "thumbnail",
            "@height": "157",
            "@width": "219",
            "@_fa": "true",
            "$": "https://api.elsevier.com/content/object/eid/1-s2.0-S2468823123004649-gr8.sml?httpAccept=%2A%2F%2A",
            "@multimediatype": "GIF image file",
            "@type": "IMAGE-THUMBNAIL",
            "@size": "13759",
            "@ref": "gr8",
            "@mimetype": "image/gif"
          },
          {
            "@category": "thumbnail",
            "@height": "164",
            "@width": "211",
            "@_fa": "true",
            "$": "https://api.elsevier.com/content/object/eid/1-s2.0-S2468823123004649-gr2.sml?httpAccept=%2A%2F%2A",
            "@multimediatype": "GIF image file",
            "@type": "IMAGE-THUMBNAIL",
            "@size": "12536",
            "@ref": "gr2",
            "@mimetype": "image/gif"
          },
          {
            "@category": "thumbnail",
            "@height": "107",
            "@width": "219",
            "@_fa": "true",
            "$": "https://api.elsevier.com/content/object/eid/1-s2.0-S2468823123004649-ga1.sml?httpAccept=%2A%2F%2A",
            "@multimediatype": "GIF image file",
            "@type": "IMAGE-THUMBNAIL",
            "@size": "14627",
            "@ref": "ga1",
            "@mimetype": "image/gif"
          },
          {
            "@category": "thumbnail",
            "@height": "161",
            "@width": "219",
            "@_fa": "true",
            "$": "https://api.elsevier.com/content/object/eid/1-s2.0-S2468823123004649-gr3.sml?httpAccept=%2A%2F%2A",
            "@multimediatype": "GIF image file",
            "@type": "IMAGE-THUMBNAIL",
            "@size": "10806",
            "@ref": "gr3",
            "@mimetype": "image/gif"
          },
          {
            "@category": "thumbnail",
            "@height": "102",
            "@width": "219",
            "@_fa": "true",
            "$": "https://api.elsevier.com/content/object/eid/1-s2.0-S2468823123004649-gr4.sml?httpAccept=%2A%2F%2A",
            "@multimediatype": "GIF image file",
            "@type": "IMAGE-THUMBNAIL",
            "@size": "21473",
            "@ref": "gr4",
            "@mimetype": "image/gif"
          },
          {
            "@category": "thumbnail",
            "@height": "163",
            "@width": "173",
            "@_fa": "true",
            "$": "https://api.elsevier.com/content/object/eid/1-s2.0-S2468823123004649-gr5.sml?httpAccept=%2A%2F%2A",
            "@multimediatype": "GIF image file",
            "@type": "IMAGE-THUMBNAIL",
            "@size": "9810",
            "@ref": "gr5",
            "@mimetype": "image/gif"
          },
          {
            "@category": "thumbnail",
            "@height": "64",
            "@width": "219",
            "@_fa": "true",
            "$": "https://api.elsevier.com/content/object/eid/1-s2.0-S2468823123004649-gr1.sml?httpAccept=%2A%2F%2A",
            "@multimediatype": "GIF image file",
            "@type": "IMAGE-THUMBNAIL",
            "@size": "8497",
            "@ref": "gr1",
            "@mimetype": "image/gif"
          },
          {
            "@category": "high",
            "@height": "392",
            "@width": "2847",
            "@_fa": "true",
            "$": "https://api.elsevier.com/content/object/eid/1-s2.0-S2468823123004649-sc1_lrg.jpg?httpAccept=%2A%2F%2A",
            "@multimediatype": "JPEG image file",
            "@type": "IMAGE-HIGH-RES",
            "@size": "126533",
            "@ref": "sc1",
            "@mimetype": "image/jpeg"
          },
          {
            "@category": "high",
            "@height": "1366",
            "@width": "1917",
            "@_fa": "true",
            "$": "https://api.elsevier.com/content/object/eid/1-s2.0-S2468823123004649-gr6_lrg.jpg?httpAccept=%2A%2F%2A",
            "@multimediatype": "JPEG image file",
            "@type": "IMAGE-HIGH-RES",
            "@size": "258477",
            "@ref": "gr6",
            "@mimetype": "image/jpeg"
          },
          {
            "@category": "high",
            "@height": "2048",
            "@width": "2750",
            "@_fa": "true",
            "$": "https://api.elsevier.com/content/object/eid/1-s2.0-S2468823123004649-gr7_lrg.jpg?httpAccept=%2A%2F%2A",
            "@multimediatype": "JPEG image file",
            "@type": "IMAGE-HIGH-RES",
            "@size": "679976",
            "@ref": "gr7",
            "@mimetype": "image/jpeg"
          },
          {
            "@category": "high",
            "@height": "2025",
            "@width": "2833",
            "@_fa": "true",
            "$": "https://api.elsevier.com/content/object/eid/1-s2.0-S2468823123004649-gr8_lrg.jpg?httpAccept=%2A%2F%2A",
            "@multimediatype": "JPEG image file",
            "@type": "IMAGE-HIGH-RES",
            "@size": "588593",
            "@ref": "gr8",
            "@mimetype": "image/jpeg"
          },
          {
            "@category": "high",
            "@height": "1490",
            "@width": "1917",
            "@_fa": "true",
            "$": "https://api.elsevier.com/content/object/eid/1-s2.0-S2468823123004649-gr2_lrg.jpg?httpAccept=%2A%2F%2A",
            "@multimediatype": "JPEG image file",
            "@type": "IMAGE-HIGH-RES",
            "@size": "449313",
            "@ref": "gr2",
            "@mimetype": "image/jpeg"
          },
          {
            "@category": "high",
            "@height": "886",
            "@width": "1811",
            "@_fa": "true",
            "$": "https://api.elsevier.com/content/object/eid/1-s2.0-S2468823123004649-ga1_lrg.jpg?httpAccept=%2A%2F%2A",
            "@multimediatype": "JPEG image file",
            "@type": "IMAGE-HIGH-RES",
            "@size": "224133",
            "@ref": "ga1",
            "@mimetype": "image/jpeg"
          },
          {
            "@category": "high",
            "@height": "2019",
            "@width": "2750",
            "@_fa": "true",
            "$": "https://api.elsevier.com/content/object/eid/1-s2.0-S2468823123004649-gr3_lrg.jpg?httpAccept=%2A%2F%2A",
            "@multimediatype": "JPEG image file",
            "@type": "IMAGE-HIGH-RES",
            "@size": "471967",
            "@ref": "gr3",
            "@mimetype": "image/jpeg"
          },
          {
            "@category": "high",
            "@height": "1549",
            "@width": "3334",
            "@_fa": "true",
            "$": "https://api.elsevier.com/content/object/eid/1-s2.0-S2468823123004649-gr4_lrg.jpg?httpAccept=%2A%2F%2A",
            "@multimediatype": "JPEG image file",
            "@type": "IMAGE-HIGH-RES",
            "@size": "2028989",
            "@ref": "gr4",
            "@mimetype": "image/jpeg"
          },
          {
            "@category": "high",
            "@height": "1810",
            "@width": "1917",
            "@_fa": "true",
            "$": "https://api.elsevier.com/content/object/eid/1-s2.0-S2468823123004649-gr5_lrg.jpg?httpAccept=%2A%2F%2A",
            "@multimediatype": "JPEG image file",
            "@type": "IMAGE-HIGH-RES",
            "@size": "385538",
            "@ref": "gr5",
            "@mimetype": "image/jpeg"
          },
          {
            "@category": "high",
            "@height": "979",
            "@width": "3333",
            "@_fa": "true",
            "$": "https://api.elsevier.com/content/object/eid/1-s2.0-S2468823123004649-gr1_lrg.jpg?httpAccept=%2A%2F%2A",
            "@multimediatype": "JPEG image file",
            "@type": "IMAGE-HIGH-RES",
            "@size": "509582",
            "@ref": "gr1",
            "@mimetype": "image/jpeg"
          },
          {
            "@category": "standard",
            "@_fa": "true",
            "$": "https://api.elsevier.com/content/object/eid/1-s2.0-S2468823123004649-mmc1.docx?httpAccept=%2A%2F%2A",
            "@multimediatype": "Microsoft Word file",
            "@type": "APPLICATION",
            "@size": "107476",
            "@ref": "mmc1",
            "@mimetype": "application/word"
          },
          {
            "@category": "standard",
            "@_fa": "true",
            "$": "https://api.elsevier.com/content/object/eid/1-s2.0-S2468823123004649-am.pdf?httpAccept=%2A%2F%2A",
            "@multimediatype": "Acrobat PDF file",
            "@type": "AAM-PDF",
            "@size": "995147",
            "@ref": "am",
            "@mimetype": "application/pdf"
          }
        ]
      },
      "link": {
        "@rel": "abstract",
        "@href": "https://api.elsevier.com/content/abstract/scopus_id/85165301947"
      }
    }
  }
}