{
  "metadata": {
    "title": "Brønsted acidic cellulose-PO<ce:inf loc=post>3</ce:inf>H: An efficient catalyst for the chemoselective synthesis of fructones and <ce:italic>trans</ce:italic>-esterification via condensation of acetoacetic esters with alcohols and diols",
    "authors": "; ; ",
    "journal": "Molecular Catalysis",
    "date": "2021-10-31",
    "doi": "10.1016/j.mcat.2021.111912",
    "abstract": "",
    "uri": "https://api.elsevier.com/content/article/pii/S2468823121005290",
    "pii": "S2468823121005290"
  },
  "fulltext": {
    "full-text-retrieval-response": {
      "scopus-eid": "2-s2.0-85115928064",
      "originalText": "serial JL 315758 291210 291744 291790 291809 31 Molecular Catalysis MOLECULARCATALYSIS 2021-10-01 2021-10-01 2021-10-01 2021-10-01 2021-12-01T07:56:01 1-s2.0-S2468823121005290 S2468-8231(21)00529-0 S2468823121005290 10.1016/j.mcat.2021.111912 S300 S300.1 FULL-TEXT 1-s2.0-S2468823121X00156 2022-12-12T23:36:21.627889Z 0 0 20211001 20211031 2021 2021-10-01T23:33:34.09667Z absattachment articleinfo articlenumber articletitlenorm authfirstinitialnorm authfirstsurnamenorm cid cids contenttype copyright crossmark dateloaded dateloadedtxt datesearch datesort dateupdated dco docsubtype doctype doi eid ewtransactionid hubeid indexeddate issn issnnorm itemstage itemtransactionid itemweight openaccess openarchive pg pgfirst pii piinorm pubdateend pubdatestart pubdatetxt pubyr sectiontitle sortorder srctitle srctitlenorm srctype ssids alllist content subj subheadings suppl tomb volfirst volissue volumelist webpdf webpdfpagecount yearnav figure table e-component body mmlmath acknowledge affil appendices articletitle auth authfirstini authfull authkeywords authlast grantnumber grantsponsor highlightsabst orcid primabst ref specialabst 2468-8231 24688231 true 515 515 C Volume 515 34 111912 111912 111912 202110 October 2021 2021-10-01 2021-10-31 2021 Regular Papers article fla © 2021 Elsevier B.V. All rights reserved. BRONSTEDACIDICCELLULOSEPO3HEFFICIENTCATALYSTFORCHEMOSELECTIVESYNTHESISFRUCTONESTRANSESTERIFICATIONVIACONDENSATIONACETOACETICESTERSALCOHOLSDIOLS NAIKWADI D 1 Introduction 2 Experimental 2.1 Materials 2.2 Synthesis of phosphoric acid-functionalized cellulose 2.3 Catalytic activity: chemoselective protection reaction of AAE and diols 2.4 Trans-esterification reaction of AAE and n-alcohols 3 Results and discussion 4 Catalyst Characterisation 5 Catalytic Activity 5.1 Synthesis of Fructone from Diol and AAE 5.2 Solvent variation 6 Substrate scope 7 Conclusion Credit Author Statement Acknowledgments Appendix Supplementary materials References PETER 2011 69 P FINECHEMICALSINDUSTRYBUSINESS JOSHI 2016 S INDUSTRIALCATALYTICPROCESSESFORFINESPECIALTYCHEMICALS STAHL 1908 956 960 A ABELSHAUSERWHIPPEL 2003 W GERMANINDUSTRYGLOBALENTERPRISEBASFHISTORYACOMPANY COLONNA 2011 2543 2548 M MOLAANTONIA 2012 2290 2301 D DUANJIAN 2018 56 63 T ZHIJUN 2018 6654 6663 C WEI 2019 49 55 H NAIKWADI 2020 14291 14296 D LINDMARKHENRIKSSON 2003 M BIOTRANSFORMATIONSTURPENTINECONSTITUENTSOXYGENATIONESTERIFICATION MAKIARVELA 2007 197 340 P NIE 2014 271 277 G EDWARD 2018 15482 15491 D GAO 2008 646 650 S LIU 2014 22520 22525 Y YUAN 2005 721 724 C TRUONG 2019 110571 110576 T CLIMENT 2000 345 351 M WANG 2007 24 26 Y TRAN 2020 1745 1754 Q HU 2010 5369 5377 B ADVANI 2020 10431 10440 J DOKE 2019 3018 3026 D LONG 2018 8991 8994 Z OSANLOU 2017 2159 2174 F KADAM 2020 1 12 K MAGGI 2005 182 184 R HAYES 2012 115 128 M ADVANI 2020 118456 118460 J BABAEI 2020 121055 121060 E XU 2019 123 131 X DANESHFAR 2015 104695 104707 Z MORENOFERNANDEZ 2020 136985 136995 G OSANLOU 2017 2159 2174 F MA 2011 6015 6017 T MA 2010 2325 2327 T WU 2012 641 647 B SINGH 2020 7210 7217 A XU 2017 5818 5830 G XIE 2020 100 108 X KRISHNAMACHARI 2011 751 761 P XU 2019 37630 37641 G AGARWAL 2019 1659 1677 U AGARWAL 2014 490 498 U BELLOQUE 2000 529 553 J RAJA 2015 4268 4278 S 2008 FINECHEMICALSTHROUGHHETEROGENEOUSCATALYSIS ZHAO 2017 133 138 R DELGADOGOMEZ 2017 101 109 F LI 2018 148 187 H NAIKWADI 2021 3691 3703 D LHOKAYEM 2020 1629 1647 A BAKSHI 2021 8222 8231 S SON 2012 185 192 P CADENAS 2011 998 1008 M JAE 2011 257 268 J BOREAVE 1997 275 291 A RUSSELLDRAGO 1997 7702 7710 S SAFARI 2011 46 50 J SATYENDRA 2019 373 383 M NAIKWADIX2021X111912 NAIKWADIX2021X111912XD 2023-10-01T00:00:00.000Z 2023-10-01T00:00:00.000Z http://creativecommons.org/licenses/by-nc-nd/4.0/ © 2021 Elsevier B.V. All rights reserved. 2021-10-02T21:59:32.794Z http://vtw.elsevier.com/data/voc/AddOnTypes/50.7/aggregated-refined Science & Engineering Research Board SERB/F/2139/2017-2018 SERB Science and Engineering Research Board http://data.elsevier.com/vocabulary/SciValFunders/501100001843 http://sws.geonames.org/1269750/ CSIR-Central Salt and Marine Chemicals and Research Institute CSMCRI communication No. 64/2021. Analytical and Environmental Science Division and Centralized Instrument Facility are acknowledged for providing instrumental analysis. AVB acknowledges to Science & Engineering Research Board (SERB/F/2139/2017-2018), India, for financial support. The Analytical and Environmental Science Division and Centralized Instrumentation Facility of CSIR-Central Salt and Marine Chemicals and Research Institute, Bhavnagar, is highly acknowledged for providing all requisite instrumental analysis. CSMCRI communication No. 64/2021 . Analytical and Environmental Science Division and Centralized Instrument Facility are acknowledged for providing instrumental analysis. AVB acknowledges to Science & Engineering Research Board ( SERB/F/2139/2017-2018 ), India, for financial support. The Analytical and Environmental Science Division and Centralized Instrumentation Facility of CSIR-Central Salt and Marine Chemicals and Research Institute, Bhavnagar, is highly acknowledged for providing all requisite instrumental analysis. 0 https://doi.org/10.15223/policy-017 https://doi.org/10.15223/policy-037 https://doi.org/10.15223/policy-012 https://doi.org/10.15223/policy-029 https://doi.org/10.15223/policy-004 item S2468-8231(21)00529-0 S2468823121005290 1-s2.0-S2468823121005290 10.1016/j.mcat.2021.111912 315758 2021-12-01T08:33:46.171398Z 2021-10-01 2021-10-31 1-s2.0-S2468823121005290-main.pdf https://s3-eu-west-1.amazonaws.com/prod-ucs-content-store-eu-west/content/pii:S2468823121005290/MAIN/application/pdf/bac95cdc47ae50d5b915941a61e17168/main.pdf main.pdf pdf true 8332717 MAIN 11 1-s2.0-S2468823121005290-main_1.png https://s3-eu-west-1.amazonaws.com/prod-ucs-content-store-eu-west/content/pii:S2468823121005290/PREVIEW/image/png/14409fcb459d82ccf214a94e11159647/main_1.png main_1.png png 57054 849 656 IMAGE-WEB-PDF 1 1-s2.0-S2468823121005290-sc3.jpg https://s3-eu-west-1.amazonaws.com/prod-ucs-content-store-eu-west/content/pii:S2468823121005290/sc3/DOWNSAMPLED/image/jpeg/d152eb7b57c972b332916bad5e653939/sc3.jpg sc3 sc3.jpg jpg 33187 154 622 IMAGE-DOWNSAMPLED 1-s2.0-S2468823121005290-fx5.jpg https://s3-eu-west-1.amazonaws.com/prod-ucs-content-store-eu-west/content/pii:S2468823121005290/fx5/DOWNSAMPLED/image/jpeg/7d08f5dabfab951df721e8d760128811/fx5.jpg fx5 fx5.jpg jpg 4935 56 68 IMAGE-DOWNSAMPLED 1-s2.0-S2468823121005290-sc2.jpg https://s3-eu-west-1.amazonaws.com/prod-ucs-content-store-eu-west/content/pii:S2468823121005290/sc2/DOWNSAMPLED/image/jpeg/154d4d15dd4df0e91d5cbc930c9468b0/sc2.jpg sc2 sc2.jpg jpg 39469 228 659 IMAGE-DOWNSAMPLED 1-s2.0-S2468823121005290-fx4.jpg https://s3-eu-west-1.amazonaws.com/prod-ucs-content-store-eu-west/content/pii:S2468823121005290/fx4/DOWNSAMPLED/image/jpeg/328b34a858000be56e1ebdc49f0a35d9/fx4.jpg fx4 fx4.jpg jpg 5795 68 101 IMAGE-DOWNSAMPLED 1-s2.0-S2468823121005290-sc1.jpg https://s3-eu-west-1.amazonaws.com/prod-ucs-content-store-eu-west/content/pii:S2468823121005290/sc1/DOWNSAMPLED/image/jpeg/dcbc84e57875d6575093cc00a6751bab/sc1.jpg sc1 sc1.jpg jpg 47039 217 659 IMAGE-DOWNSAMPLED 1-s2.0-S2468823121005290-fx3.jpg https://s3-eu-west-1.amazonaws.com/prod-ucs-content-store-eu-west/content/pii:S2468823121005290/fx3/DOWNSAMPLED/image/jpeg/4f6342a74e320d4f9d10748899b4d51f/fx3.jpg fx3 fx3.jpg jpg 5021 44 78 IMAGE-DOWNSAMPLED 1-s2.0-S2468823121005290-fx21.jpg https://s3-eu-west-1.amazonaws.com/prod-ucs-content-store-eu-west/content/pii:S2468823121005290/fx21/DOWNSAMPLED/image/jpeg/ecb133ce49c436604f7aaf36ef80e579/fx21.jpg fx21 fx21.jpg jpg 4538 34 78 IMAGE-DOWNSAMPLED 1-s2.0-S2468823121005290-fx2.jpg https://s3-eu-west-1.amazonaws.com/prod-ucs-content-store-eu-west/content/pii:S2468823121005290/fx2/DOWNSAMPLED/image/jpeg/ff950f9269a2258af3ce0da6692d5fe1/fx2.jpg fx2 fx2.jpg jpg 4603 34 78 IMAGE-DOWNSAMPLED 1-s2.0-S2468823121005290-fx20.jpg https://s3-eu-west-1.amazonaws.com/prod-ucs-content-store-eu-west/content/pii:S2468823121005290/fx20/DOWNSAMPLED/image/jpeg/351c52b474e0fd4821b0f85926d8d335/fx20.jpg fx20 fx20.jpg jpg 4662 34 101 IMAGE-DOWNSAMPLED 1-s2.0-S2468823121005290-gr2.jpg https://s3-eu-west-1.amazonaws.com/prod-ucs-content-store-eu-west/content/pii:S2468823121005290/gr2/DOWNSAMPLED/image/jpeg/17f491ec8b5bee68d224c4488aa0282c/gr2.jpg gr2 gr2.jpg jpg 86884 276 715 IMAGE-DOWNSAMPLED 1-s2.0-S2468823121005290-fx9.jpg https://s3-eu-west-1.amazonaws.com/prod-ucs-content-store-eu-west/content/pii:S2468823121005290/fx9/DOWNSAMPLED/image/jpeg/b60e5a650f8869dbf312ae8b72e23677/fx9.jpg fx9 fx9.jpg jpg 5139 68 90 IMAGE-DOWNSAMPLED 1-s2.0-S2468823121005290-gr1.jpg https://s3-eu-west-1.amazonaws.com/prod-ucs-content-store-eu-west/content/pii:S2468823121005290/gr1/DOWNSAMPLED/image/jpeg/c58139667068f59216542da30521d21f/gr1.jpg gr1 gr1.jpg jpg 58996 204 715 IMAGE-DOWNSAMPLED 1-s2.0-S2468823121005290-fx8.jpg https://s3-eu-west-1.amazonaws.com/prod-ucs-content-store-eu-west/content/pii:S2468823121005290/fx8/DOWNSAMPLED/image/jpeg/0c539304138d8b8b9537ff1234fbb6d1/fx8.jpg fx8 fx8.jpg jpg 5337 68 90 IMAGE-DOWNSAMPLED 1-s2.0-S2468823121005290-sc5.jpg https://s3-eu-west-1.amazonaws.com/prod-ucs-content-store-eu-west/content/pii:S2468823121005290/sc5/DOWNSAMPLED/image/jpeg/2156702dfa4e3ac82033347ab54e5cd4/sc5.jpg sc5 sc5.jpg jpg 79617 497 621 IMAGE-DOWNSAMPLED 1-s2.0-S2468823121005290-fx7.jpg https://s3-eu-west-1.amazonaws.com/prod-ucs-content-store-eu-west/content/pii:S2468823121005290/fx7/DOWNSAMPLED/image/jpeg/eb4cf745028b16ee587b77fa56dd510b/fx7.jpg fx7 fx7.jpg jpg 4750 39 89 IMAGE-DOWNSAMPLED 1-s2.0-S2468823121005290-sc4.jpg https://s3-eu-west-1.amazonaws.com/prod-ucs-content-store-eu-west/content/pii:S2468823121005290/sc4/DOWNSAMPLED/image/jpeg/d1f11077d22e427de86703ef0a747aea/sc4.jpg sc4 sc4.jpg jpg 38415 225 622 IMAGE-DOWNSAMPLED 1-s2.0-S2468823121005290-fx6.jpg https://s3-eu-west-1.amazonaws.com/prod-ucs-content-store-eu-west/content/pii:S2468823121005290/fx6/DOWNSAMPLED/image/jpeg/b2994259dec045b0a1618cf426d4b8ba/fx6.jpg fx6 fx6.jpg jpg 4759 43 104 IMAGE-DOWNSAMPLED 1-s2.0-S2468823121005290-ga1.jpg https://s3-eu-west-1.amazonaws.com/prod-ucs-content-store-eu-west/content/pii:S2468823121005290/ga1/DOWNSAMPLED/image/jpeg/18d8a5d3a07f3acc82597f674621a8d7/ga1.jpg ga1 true ga1.jpg jpg 26172 128 301 IMAGE-DOWNSAMPLED 1-s2.0-S2468823121005290-fx19.jpg https://s3-eu-west-1.amazonaws.com/prod-ucs-content-store-eu-west/content/pii:S2468823121005290/fx19/DOWNSAMPLED/image/jpeg/de645402c8237fc7c4cb268a6600b0c8/fx19.jpg fx19 fx19.jpg jpg 4567 34 90 IMAGE-DOWNSAMPLED 1-s2.0-S2468823121005290-fx18.jpg https://s3-eu-west-1.amazonaws.com/prod-ucs-content-store-eu-west/content/pii:S2468823121005290/fx18/DOWNSAMPLED/image/jpeg/473036f634fc7ab2415161ecb9e803c7/fx18.jpg fx18 fx18.jpg jpg 4479 22 90 IMAGE-DOWNSAMPLED 1-s2.0-S2468823121005290-fx17.jpg https://s3-eu-west-1.amazonaws.com/prod-ucs-content-store-eu-west/content/pii:S2468823121005290/fx17/DOWNSAMPLED/image/jpeg/424e4939f9640983dbde635e91db1fb8/fx17.jpg fx17 fx17.jpg jpg 4626 44 90 IMAGE-DOWNSAMPLED 1-s2.0-S2468823121005290-fx12.jpg https://s3-eu-west-1.amazonaws.com/prod-ucs-content-store-eu-west/content/pii:S2468823121005290/fx12/DOWNSAMPLED/image/jpeg/679c632adc242fb32a83217d2a6b0b7d/fx12.jpg fx12 fx12.jpg jpg 5139 45 101 IMAGE-DOWNSAMPLED 1-s2.0-S2468823121005290-fx11.jpg https://s3-eu-west-1.amazonaws.com/prod-ucs-content-store-eu-west/content/pii:S2468823121005290/fx11/DOWNSAMPLED/image/jpeg/501c35723271298bcf3a9031e7619985/fx11.jpg fx11 fx11.jpg jpg 5115 45 101 IMAGE-DOWNSAMPLED 1-s2.0-S2468823121005290-fx10.jpg https://s3-eu-west-1.amazonaws.com/prod-ucs-content-store-eu-west/content/pii:S2468823121005290/fx10/DOWNSAMPLED/image/jpeg/ad3109c04a3b0167ab88443911e9403d/fx10.jpg fx10 fx10.jpg jpg 5158 45 113 IMAGE-DOWNSAMPLED 1-s2.0-S2468823121005290-fx16.jpg https://s3-eu-west-1.amazonaws.com/prod-ucs-content-store-eu-west/content/pii:S2468823121005290/fx16/DOWNSAMPLED/image/jpeg/53d4b88b52cf7b203ddb85b147cc2e97/fx16.jpg fx16 fx16.jpg jpg 4947 45 101 IMAGE-DOWNSAMPLED 1-s2.0-S2468823121005290-fx15.jpg https://s3-eu-west-1.amazonaws.com/prod-ucs-content-store-eu-west/content/pii:S2468823121005290/fx15/DOWNSAMPLED/image/jpeg/ac88a5c2803f4e475322d5561dda3b7f/fx15.jpg fx15 fx15.jpg jpg 5270 45 101 IMAGE-DOWNSAMPLED 1-s2.0-S2468823121005290-fx14.jpg https://s3-eu-west-1.amazonaws.com/prod-ucs-content-store-eu-west/content/pii:S2468823121005290/fx14/DOWNSAMPLED/image/jpeg/e57aa7f86f539533bd4bb2372ed77d10/fx14.jpg fx14 fx14.jpg jpg 5816 68 90 IMAGE-DOWNSAMPLED 1-s2.0-S2468823121005290-fx13.jpg https://s3-eu-west-1.amazonaws.com/prod-ucs-content-store-eu-west/content/pii:S2468823121005290/fx13/DOWNSAMPLED/image/jpeg/49ec1bf4d951e748b237867ebcfd1bc5/fx13.jpg fx13 fx13.jpg jpg 5605 78 78 IMAGE-DOWNSAMPLED 1-s2.0-S2468823121005290-gr5.jpg https://s3-eu-west-1.amazonaws.com/prod-ucs-content-store-eu-west/content/pii:S2468823121005290/gr5/DOWNSAMPLED/image/jpeg/26bccd9830194c27797a23b26753f25b/gr5.jpg gr5 gr5.jpg jpg 47656 401 527 IMAGE-DOWNSAMPLED 1-s2.0-S2468823121005290-gr4.jpg https://s3-eu-west-1.amazonaws.com/prod-ucs-content-store-eu-west/content/pii:S2468823121005290/gr4/DOWNSAMPLED/image/jpeg/7f1c161ae53ea320de0c624e83463b27/gr4.jpg gr4 gr4.jpg jpg 168890 545 659 IMAGE-DOWNSAMPLED 1-s2.0-S2468823121005290-gr3.jpg https://s3-eu-west-1.amazonaws.com/prod-ucs-content-store-eu-west/content/pii:S2468823121005290/gr3/DOWNSAMPLED/image/jpeg/dbdcf6409dc266fb2b80237bf6ad700d/gr3.jpg gr3 gr3.jpg jpg 83727 553 659 IMAGE-DOWNSAMPLED 1-s2.0-S2468823121005290-sc3.sml https://s3-eu-west-1.amazonaws.com/prod-ucs-content-store-eu-west/content/pii:S2468823121005290/sc3/THUMBNAIL/image/gif/7d7780fe0431de2325bf1adc2bdb6ab2/sc3.sml sc3 sc3.sml sml 5255 54 219 IMAGE-THUMBNAIL 1-s2.0-S2468823121005290-fx5.sml https://s3-eu-west-1.amazonaws.com/prod-ucs-content-store-eu-west/content/pii:S2468823121005290/fx5/THUMBNAIL/image/gif/2c756e68a8df46125c56dc79403c79aa/fx5.sml fx5 fx5.sml sml 7656 164 198 IMAGE-THUMBNAIL 1-s2.0-S2468823121005290-sc2.sml https://s3-eu-west-1.amazonaws.com/prod-ucs-content-store-eu-west/content/pii:S2468823121005290/sc2/THUMBNAIL/image/gif/734d8f17863857fa408623826061e71c/sc2.sml sc2 sc2.sml sml 5551 76 219 IMAGE-THUMBNAIL 1-s2.0-S2468823121005290-fx4.sml https://s3-eu-west-1.amazonaws.com/prod-ucs-content-store-eu-west/content/pii:S2468823121005290/fx4/THUMBNAIL/image/gif/c799b8dfb8ee84aab555227270006e95/fx4.sml fx4 fx4.sml sml 6566 148 219 IMAGE-THUMBNAIL 1-s2.0-S2468823121005290-sc1.sml https://s3-eu-west-1.amazonaws.com/prod-ucs-content-store-eu-west/content/pii:S2468823121005290/sc1/THUMBNAIL/image/gif/537fb171345cf5e8ecfc7121624220c3/sc1.sml sc1 sc1.sml sml 10336 72 219 IMAGE-THUMBNAIL 1-s2.0-S2468823121005290-fx3.sml https://s3-eu-west-1.amazonaws.com/prod-ucs-content-store-eu-west/content/pii:S2468823121005290/fx3/THUMBNAIL/image/gif/d07ccc0b99381ba91da444492a6048ad/fx3.sml fx3 fx3.sml sml 7317 125 219 IMAGE-THUMBNAIL 1-s2.0-S2468823121005290-fx21.sml https://s3-eu-west-1.amazonaws.com/prod-ucs-content-store-eu-west/content/pii:S2468823121005290/fx21/THUMBNAIL/image/gif/77d3da09f78d36ccd0bd1b66840686ce/fx21.sml fx21 fx21.sml sml 6257 95 219 IMAGE-THUMBNAIL 1-s2.0-S2468823121005290-fx2.sml https://s3-eu-west-1.amazonaws.com/prod-ucs-content-store-eu-west/content/pii:S2468823121005290/fx2/THUMBNAIL/image/gif/79379b3138636b69fa67b84e86862f8b/fx2.sml fx2 fx2.sml sml 6814 95 219 IMAGE-THUMBNAIL 1-s2.0-S2468823121005290-fx20.sml https://s3-eu-west-1.amazonaws.com/prod-ucs-content-store-eu-west/content/pii:S2468823121005290/fx20/THUMBNAIL/image/gif/e9c0c3e74b9b114787a28ed4def7dc89/fx20.sml fx20 fx20.sml sml 4973 74 219 IMAGE-THUMBNAIL 1-s2.0-S2468823121005290-gr2.sml https://s3-eu-west-1.amazonaws.com/prod-ucs-content-store-eu-west/content/pii:S2468823121005290/gr2/THUMBNAIL/image/gif/b4b2d1d0db786685ea5de583b274fb2d/gr2.sml gr2 gr2.sml sml 15114 85 219 IMAGE-THUMBNAIL 1-s2.0-S2468823121005290-fx9.sml https://s3-eu-west-1.amazonaws.com/prod-ucs-content-store-eu-west/content/pii:S2468823121005290/fx9/THUMBNAIL/image/gif/9f02c94bb342d664621be1c13a23c86a/fx9.sml fx9 fx9.sml sml 6678 164 218 IMAGE-THUMBNAIL 1-s2.0-S2468823121005290-gr1.sml https://s3-eu-west-1.amazonaws.com/prod-ucs-content-store-eu-west/content/pii:S2468823121005290/gr1/THUMBNAIL/image/gif/b59a28505a6d33a20e9c307e35831d72/gr1.sml gr1 gr1.sml sml 8160 63 219 IMAGE-THUMBNAIL 1-s2.0-S2468823121005290-fx8.sml https://s3-eu-west-1.amazonaws.com/prod-ucs-content-store-eu-west/content/pii:S2468823121005290/fx8/THUMBNAIL/image/gif/b6d60c1be8c2fce1bd9d30249a194775/fx8.sml fx8 fx8.sml sml 6799 164 218 IMAGE-THUMBNAIL 1-s2.0-S2468823121005290-sc5.sml https://s3-eu-west-1.amazonaws.com/prod-ucs-content-store-eu-west/content/pii:S2468823121005290/sc5/THUMBNAIL/image/gif/a499214db8cff353b343a355b7a1903b/sc5.sml sc5 sc5.sml sml 12516 164 205 IMAGE-THUMBNAIL 1-s2.0-S2468823121005290-fx7.sml https://s3-eu-west-1.amazonaws.com/prod-ucs-content-store-eu-west/content/pii:S2468823121005290/fx7/THUMBNAIL/image/gif/b7e3973ada1d20240557772f8c7f78a2/fx7.sml fx7 fx7.sml sml 6394 96 219 IMAGE-THUMBNAIL 1-s2.0-S2468823121005290-sc4.sml https://s3-eu-west-1.amazonaws.com/prod-ucs-content-store-eu-west/content/pii:S2468823121005290/sc4/THUMBNAIL/image/gif/5e055b05a54003195bd1289c601b2f45/sc4.sml sc4 sc4.sml sml 6406 79 219 IMAGE-THUMBNAIL 1-s2.0-S2468823121005290-fx6.sml https://s3-eu-west-1.amazonaws.com/prod-ucs-content-store-eu-west/content/pii:S2468823121005290/fx6/THUMBNAIL/image/gif/39a78dfc6164280c4afc209a33d33d9f/fx6.sml fx6 fx6.sml sml 5654 91 219 IMAGE-THUMBNAIL 1-s2.0-S2468823121005290-ga1.sml https://s3-eu-west-1.amazonaws.com/prod-ucs-content-store-eu-west/content/pii:S2468823121005290/ga1/THUMBNAIL/image/gif/bfc79c26b8a383391a1c85b161af2bf7/ga1.sml ga1 true ga1.sml sml 14998 93 219 IMAGE-THUMBNAIL 1-s2.0-S2468823121005290-fx19.sml https://s3-eu-west-1.amazonaws.com/prod-ucs-content-store-eu-west/content/pii:S2468823121005290/fx19/THUMBNAIL/image/gif/b2627c178f70f7b3ed26f6a3bcb51067/fx19.sml fx19 fx19.sml sml 5303 82 219 IMAGE-THUMBNAIL 1-s2.0-S2468823121005290-fx18.sml https://s3-eu-west-1.amazonaws.com/prod-ucs-content-store-eu-west/content/pii:S2468823121005290/fx18/THUMBNAIL/image/gif/5c3b53372f2100ddb5f29b0173b4bffb/fx18.sml fx18 fx18.sml sml 5132 54 219 IMAGE-THUMBNAIL 1-s2.0-S2468823121005290-fx17.sml https://s3-eu-west-1.amazonaws.com/prod-ucs-content-store-eu-west/content/pii:S2468823121005290/fx17/THUMBNAIL/image/gif/fd38fe79418dd97b9afd6748944e2077/fx17.sml fx17 fx17.sml sml 5914 108 219 IMAGE-THUMBNAIL 1-s2.0-S2468823121005290-fx12.sml https://s3-eu-west-1.amazonaws.com/prod-ucs-content-store-eu-west/content/pii:S2468823121005290/fx12/THUMBNAIL/image/gif/98c25658d5323c9b5c6c9d1ceb23e5fc/fx12.sml fx12 fx12.sml sml 5349 97 219 IMAGE-THUMBNAIL 1-s2.0-S2468823121005290-fx11.sml https://s3-eu-west-1.amazonaws.com/prod-ucs-content-store-eu-west/content/pii:S2468823121005290/fx11/THUMBNAIL/image/gif/0f3d35099cd7cd5efb4ce2e1a73dc823/fx11.sml fx11 fx11.sml sml 5684 97 219 IMAGE-THUMBNAIL 1-s2.0-S2468823121005290-fx10.sml https://s3-eu-west-1.amazonaws.com/prod-ucs-content-store-eu-west/content/pii:S2468823121005290/fx10/THUMBNAIL/image/gif/05ad8c7d9200bd299702d636461ea6c4/fx10.sml fx10 fx10.sml sml 5355 87 219 IMAGE-THUMBNAIL 1-s2.0-S2468823121005290-fx16.sml https://s3-eu-west-1.amazonaws.com/prod-ucs-content-store-eu-west/content/pii:S2468823121005290/fx16/THUMBNAIL/image/gif/a91d47a8a1e1b7d7c4e4026ef5410e96/fx16.sml fx16 fx16.sml sml 5651 97 219 IMAGE-THUMBNAIL 1-s2.0-S2468823121005290-fx15.sml https://s3-eu-west-1.amazonaws.com/prod-ucs-content-store-eu-west/content/pii:S2468823121005290/fx15/THUMBNAIL/image/gif/27608ca58d430949eb059cab8e25032d/fx15.sml fx15 fx15.sml sml 5874 97 219 IMAGE-THUMBNAIL 1-s2.0-S2468823121005290-fx14.sml https://s3-eu-west-1.amazonaws.com/prod-ucs-content-store-eu-west/content/pii:S2468823121005290/fx14/THUMBNAIL/image/gif/362baf871f8c53494b017a082ca6b721/fx14.sml fx14 fx14.sml sml 7985 164 217 IMAGE-THUMBNAIL 1-s2.0-S2468823121005290-fx13.sml https://s3-eu-west-1.amazonaws.com/prod-ucs-content-store-eu-west/content/pii:S2468823121005290/fx13/THUMBNAIL/image/gif/e384619a900bfae64fe74718f30860a3/fx13.sml fx13 fx13.sml sml 6554 164 164 IMAGE-THUMBNAIL 1-s2.0-S2468823121005290-gr5.sml https://s3-eu-west-1.amazonaws.com/prod-ucs-content-store-eu-west/content/pii:S2468823121005290/gr5/THUMBNAIL/image/gif/d4e77bfd7755815d9fdf5118ab7b5b87/gr5.sml gr5 gr5.sml sml 15956 164 216 IMAGE-THUMBNAIL 1-s2.0-S2468823121005290-gr4.sml https://s3-eu-west-1.amazonaws.com/prod-ucs-content-store-eu-west/content/pii:S2468823121005290/gr4/THUMBNAIL/image/gif/7460775451cfe350ee95a7553f0fc68f/gr4.sml gr4 gr4.sml sml 20530 164 198 IMAGE-THUMBNAIL 1-s2.0-S2468823121005290-gr3.sml https://s3-eu-west-1.amazonaws.com/prod-ucs-content-store-eu-west/content/pii:S2468823121005290/gr3/THUMBNAIL/image/gif/03d080a30faf348ae9aa0e62dae6f26c/gr3.sml gr3 gr3.sml sml 11700 164 195 IMAGE-THUMBNAIL 1-s2.0-S2468823121005290-sc3_lrg.jpg https://s3-eu-west-1.amazonaws.com/prod-ucs-content-store-eu-west/content/pii:S2468823121005290/sc3/HIGHRES/image/jpeg/733f9be41afc4cad1232abd858dc6ede/sc3_lrg.jpg sc3 sc3_lrg.jpg jpg 220743 682 2754 IMAGE-HIGH-RES 1-s2.0-S2468823121005290-fx5_lrg.jpg https://s3-eu-west-1.amazonaws.com/prod-ucs-content-store-eu-west/content/pii:S2468823121005290/fx5/HIGHRES/image/jpeg/6467f0dc9d8a67bd2d51ebde79a5e7ef/fx5_lrg.jpg fx5 fx5_lrg.jpg jpg 16125 250 302 IMAGE-HIGH-RES 1-s2.0-S2468823121005290-sc2_lrg.jpg https://s3-eu-west-1.amazonaws.com/prod-ucs-content-store-eu-west/content/pii:S2468823121005290/sc2/HIGHRES/image/jpeg/4819543451888f90726a767a0c38fe41/sc2_lrg.jpg sc2 sc2_lrg.jpg jpg 282199 1010 2920 IMAGE-HIGH-RES 1-s2.0-S2468823121005290-fx4_lrg.jpg https://s3-eu-west-1.amazonaws.com/prod-ucs-content-store-eu-west/content/pii:S2468823121005290/fx4/HIGHRES/image/jpeg/1c7b9c8ec0d7fd7d40a57e20648ceab1/fx4_lrg.jpg fx4 fx4_lrg.jpg jpg 22364 303 448 IMAGE-HIGH-RES 1-s2.0-S2468823121005290-sc1_lrg.jpg https://s3-eu-west-1.amazonaws.com/prod-ucs-content-store-eu-west/content/pii:S2468823121005290/sc1/HIGHRES/image/jpeg/0c34e2bde233ff9ef2a52495230918d8/sc1_lrg.jpg sc1 sc1_lrg.jpg jpg 395149 961 2917 IMAGE-HIGH-RES 1-s2.0-S2468823121005290-fx3_lrg.jpg https://s3-eu-west-1.amazonaws.com/prod-ucs-content-store-eu-west/content/pii:S2468823121005290/fx3/HIGHRES/image/jpeg/0d7cf47ad474e607453b75a0ebf7a062/fx3_lrg.jpg fx3 fx3_lrg.jpg jpg 16479 199 349 IMAGE-HIGH-RES 1-s2.0-S2468823121005290-fx21_lrg.jpg https://s3-eu-west-1.amazonaws.com/prod-ucs-content-store-eu-west/content/pii:S2468823121005290/fx21/HIGHRES/image/jpeg/b3aa6c8d867d03400f99dfd5f4729a33/fx21_lrg.jpg fx21 fx21_lrg.jpg jpg 12561 151 348 IMAGE-HIGH-RES 1-s2.0-S2468823121005290-fx2_lrg.jpg https://s3-eu-west-1.amazonaws.com/prod-ucs-content-store-eu-west/content/pii:S2468823121005290/fx2/HIGHRES/image/jpeg/d1ee78a83e851f89ea516fefec7a1667/fx2_lrg.jpg fx2 fx2_lrg.jpg jpg 14445 151 349 IMAGE-HIGH-RES 1-s2.0-S2468823121005290-fx20_lrg.jpg https://s3-eu-west-1.amazonaws.com/prod-ucs-content-store-eu-west/content/pii:S2468823121005290/fx20/HIGHRES/image/jpeg/dfd0aa8d369198ef90d68ec28f5eaef6/fx20_lrg.jpg fx20 fx20_lrg.jpg jpg 13629 151 448 IMAGE-HIGH-RES 1-s2.0-S2468823121005290-gr2_lrg.jpg https://s3-eu-west-1.amazonaws.com/prod-ucs-content-store-eu-west/content/pii:S2468823121005290/gr2/HIGHRES/image/jpeg/0296357df73080c008e0c34491705152/gr2_lrg.jpg gr2 gr2_lrg.jpg jpg 952830 1223 3167 IMAGE-HIGH-RES 1-s2.0-S2468823121005290-fx9_lrg.jpg https://s3-eu-west-1.amazonaws.com/prod-ucs-content-store-eu-west/content/pii:S2468823121005290/fx9/HIGHRES/image/jpeg/a292a01963184324a78859e16309a86d/fx9_lrg.jpg fx9 fx9_lrg.jpg jpg 19016 302 401 IMAGE-HIGH-RES 1-s2.0-S2468823121005290-gr1_lrg.jpg https://s3-eu-west-1.amazonaws.com/prod-ucs-content-store-eu-west/content/pii:S2468823121005290/gr1/HIGHRES/image/jpeg/9d11ab5865d60127c39c6b6dba9f21e1/gr1_lrg.jpg gr1 gr1_lrg.jpg jpg 389160 904 3166 IMAGE-HIGH-RES 1-s2.0-S2468823121005290-fx8_lrg.jpg https://s3-eu-west-1.amazonaws.com/prod-ucs-content-store-eu-west/content/pii:S2468823121005290/fx8/HIGHRES/image/jpeg/47af509255c832a3c9baf4190caa02f8/fx8_lrg.jpg fx8 fx8_lrg.jpg jpg 19299 302 402 IMAGE-HIGH-RES 1-s2.0-S2468823121005290-sc5_lrg.jpg https://s3-eu-west-1.amazonaws.com/prod-ucs-content-store-eu-west/content/pii:S2468823121005290/sc5/HIGHRES/image/jpeg/5a7c75a51acd578efdf04018c121fce8/sc5_lrg.jpg sc5 sc5_lrg.jpg jpg 571478 2201 2750 IMAGE-HIGH-RES 1-s2.0-S2468823121005290-fx7_lrg.jpg https://s3-eu-west-1.amazonaws.com/prod-ucs-content-store-eu-west/content/pii:S2468823121005290/fx7/HIGHRES/image/jpeg/47bf403891daa7634aaa282e851a26e0/fx7_lrg.jpg fx7 fx7_lrg.jpg jpg 15654 174 395 IMAGE-HIGH-RES 1-s2.0-S2468823121005290-sc4_lrg.jpg https://s3-eu-west-1.amazonaws.com/prod-ucs-content-store-eu-west/content/pii:S2468823121005290/sc4/HIGHRES/image/jpeg/9c90ed5b4bd2ff0f83e62a11e18cf057/sc4_lrg.jpg sc4 sc4_lrg.jpg jpg 269009 997 2753 IMAGE-HIGH-RES 1-s2.0-S2468823121005290-fx6_lrg.jpg https://s3-eu-west-1.amazonaws.com/prod-ucs-content-store-eu-west/content/pii:S2468823121005290/fx6/HIGHRES/image/jpeg/7946b7f578938591876440ac6b25ecfa/fx6_lrg.jpg fx6 fx6_lrg.jpg jpg 18193 191 462 IMAGE-HIGH-RES 1-s2.0-S2468823121005290-ga1_lrg.jpg https://s3-eu-west-1.amazonaws.com/prod-ucs-content-store-eu-west/content/pii:S2468823121005290/ga1/HIGHRES/image/jpeg/818580fa5b3196ba371756d341974720/ga1_lrg.jpg ga1 true ga1_lrg.jpg jpg 248729 568 1333 IMAGE-HIGH-RES 1-s2.0-S2468823121005290-fx19_lrg.jpg https://s3-eu-west-1.amazonaws.com/prod-ucs-content-store-eu-west/content/pii:S2468823121005290/fx19/HIGHRES/image/jpeg/3f51e826c99077cb6992bf46232f09d4/fx19_lrg.jpg fx19 fx19_lrg.jpg jpg 13145 151 401 IMAGE-HIGH-RES 1-s2.0-S2468823121005290-fx18_lrg.jpg https://s3-eu-west-1.amazonaws.com/prod-ucs-content-store-eu-west/content/pii:S2468823121005290/fx18/HIGHRES/image/jpeg/139fbb7b906f8894c7dd28d33e000655/fx18_lrg.jpg fx18 fx18_lrg.jpg jpg 12320 99 401 IMAGE-HIGH-RES 1-s2.0-S2468823121005290-fx17_lrg.jpg https://s3-eu-west-1.amazonaws.com/prod-ucs-content-store-eu-west/content/pii:S2468823121005290/fx17/HIGHRES/image/jpeg/2582a8646a8c6dd300c61d7cfcf61abd/fx17_lrg.jpg fx17 fx17_lrg.jpg jpg 15347 197 401 IMAGE-HIGH-RES 1-s2.0-S2468823121005290-fx12_lrg.jpg https://s3-eu-west-1.amazonaws.com/prod-ucs-content-store-eu-west/content/pii:S2468823121005290/fx12/HIGHRES/image/jpeg/df68480d1b7ac4e060ba311d36312363/fx12_lrg.jpg fx12 fx12_lrg.jpg jpg 15922 198 448 IMAGE-HIGH-RES 1-s2.0-S2468823121005290-fx11_lrg.jpg https://s3-eu-west-1.amazonaws.com/prod-ucs-content-store-eu-west/content/pii:S2468823121005290/fx11/HIGHRES/image/jpeg/ac640931364ef6c7babd74ef4c4df6f2/fx11_lrg.jpg fx11 fx11_lrg.jpg jpg 17185 198 448 IMAGE-HIGH-RES 1-s2.0-S2468823121005290-fx10_lrg.jpg https://s3-eu-west-1.amazonaws.com/prod-ucs-content-store-eu-west/content/pii:S2468823121005290/fx10/HIGHRES/image/jpeg/46dcb5a6a9999fdfc3e0aa28384b14ef/fx10_lrg.jpg fx10 fx10_lrg.jpg jpg 18550 198 500 IMAGE-HIGH-RES 1-s2.0-S2468823121005290-fx16_lrg.jpg https://s3-eu-west-1.amazonaws.com/prod-ucs-content-store-eu-west/content/pii:S2468823121005290/fx16/HIGHRES/image/jpeg/13d32b5d0a99c1d0aaa54fb2373707f5/fx16_lrg.jpg fx16 fx16_lrg.jpg jpg 16810 198 448 IMAGE-HIGH-RES 1-s2.0-S2468823121005290-fx15_lrg.jpg https://s3-eu-west-1.amazonaws.com/prod-ucs-content-store-eu-west/content/pii:S2468823121005290/fx15/HIGHRES/image/jpeg/2fa20780faa1d8a0606b2e048b2f6401/fx15_lrg.jpg fx15 fx15_lrg.jpg jpg 17947 198 448 IMAGE-HIGH-RES 1-s2.0-S2468823121005290-fx14_lrg.jpg https://s3-eu-west-1.amazonaws.com/prod-ucs-content-store-eu-west/content/pii:S2468823121005290/fx14/HIGHRES/image/jpeg/1f45339ab70243a8ea48741ded62e784/fx14_lrg.jpg fx14 fx14_lrg.jpg jpg 23179 303 402 IMAGE-HIGH-RES 1-s2.0-S2468823121005290-fx13_lrg.jpg https://s3-eu-west-1.amazonaws.com/prod-ucs-content-store-eu-west/content/pii:S2468823121005290/fx13/HIGHRES/image/jpeg/d203325694f24ad2bff44e703e2526cf/fx13_lrg.jpg fx13 fx13_lrg.jpg jpg 22757 349 349 IMAGE-HIGH-RES 1-s2.0-S2468823121005290-gr5_lrg.jpg https://s3-eu-west-1.amazonaws.com/prod-ucs-content-store-eu-west/content/pii:S2468823121005290/gr5/HIGHRES/image/jpeg/584ef09b4761643f5e4e706d99c87592/gr5_lrg.jpg gr5 gr5_lrg.jpg jpg 310832 1773 2333 IMAGE-HIGH-RES 1-s2.0-S2468823121005290-gr4_lrg.jpg https://s3-eu-west-1.amazonaws.com/prod-ucs-content-store-eu-west/content/pii:S2468823121005290/gr4/HIGHRES/image/jpeg/aa7eb0e0d9c0438c0fac35c5df623de1/gr4_lrg.jpg gr4 gr4_lrg.jpg jpg 1549363 2411 2917 IMAGE-HIGH-RES 1-s2.0-S2468823121005290-gr3_lrg.jpg https://s3-eu-west-1.amazonaws.com/prod-ucs-content-store-eu-west/content/pii:S2468823121005290/gr3/HIGHRES/image/jpeg/9990d01e5c429e7b4fcb29715242f0e0/gr3_lrg.jpg gr3 gr3_lrg.jpg jpg 609505 2449 2917 IMAGE-HIGH-RES 1-s2.0-S2468823121005290-mmc1.docx https://s3-eu-west-1.amazonaws.com/prod-ucs-content-store-eu-west/content/pii:S2468823121005290/mmc1/MAIN/application/vnd.openxmlformats-officedocument.wordprocessingml.document/a78e6e415c011851151a069b9f401cfd/mmc1.docx mmc1 mmc1.docx docx 5655837 APPLICATION 1-s2.0-S2468823121005290-si1.svg https://s3-eu-west-1.amazonaws.com/prod-ucs-content-store-eu-west/content/pii:S2468823121005290/STRIPIN/image/svg+xml/ccc643f24fc59050ca8102447dde7c7d/si1.svg si1 si1.svg svg 1236 ALTIMG 1-s2.0-S2468823121005290-si2.svg https://s3-eu-west-1.amazonaws.com/prod-ucs-content-store-eu-west/content/pii:S2468823121005290/STRIPIN/image/svg+xml/463af5d6e3fb9b27c5bbdebbbd069d51/si2.svg si2 si2.svg svg 1025 ALTIMG 1-s2.0-S2468823121005290-am.pdf https://s3-eu-west-1.amazonaws.com/prod-ucs-content-store-eu-west/content/egi:10NL0502CNK/MAIN/application/pdf/17eb0c5ccf02c72c54c5c0ef655c5eee/am.pdf am am.pdf pdf false 2546971 AAM-PDF MCAT 111912 111912 S2468-8231(21)00529-0 10.1016/j.mcat.2021.111912 Scheme 1 : The synthetic route for Cellulose-PO3H catalyst. Scheme 1 Scheme 2 Synthesis of fructone by the protection of chemo-selective keto group. Scheme 2: Scheme 3 : Scope of protection of keto group of AAE catalyzed by Cellulose-PO3H catalyst. Scheme 3 Scheme 4 Substrate scope of trans-esterification of AAEs and n-alcohols. Scheme 4: Scheme 5 The possible mechanism pathway. Scheme 5: Fig. 1 (A) PXRD pattern of cellulose-PO3H, (B) Pyridine adsorption FT-IR study (CPyrt- pyridine added at room temp. on C-PO3H pallet), (C) FT-IR spectrum of Cellulose, Cellulose-PO3H (C-PO3H). Fig 1: Fig. 2 (A & B) FE-SEM image of C-PO3H, (C-F) Elemental mapping of C-PO3H, (C) Mix, (D) Carbon, (E) Oxygen and (F) Phosphorous (G) EDX spectrum of the C-PO3H (H) SEM-EDAX; Atomic and weight percentages of elements Fig 2: Fig. 3 (A) XPS spectrum of the C-PO3H, (B) C1s spectrum of carbon, (C) O1s spectrum of oxygen. (D) P 2p spectrum of phosphorus. Fig 3: Fig. 4 X-ray photoelectron spectroscopy (XPS) elemental mapping of the C-PO3H (C1s, O1s, P 2p). Fig 4: Fig. 5 Recycling studies of –Cellulose-PO3H catalyst(Reaction conditions: 7.6 mmol Ethyl acetoacetate, 8 mmol 1,2 diol and 80 mg Cellulose-PO3H were stirred in 50 mL round bottom flask for 6 h.) Fig 5: Table 1 Result of catalyst variation for Fructone synthesis. a Table 1: Entry Catalyst Acidity mmol/gm Conv. EAA (%) Sel. A (%) Others 1. Blank - 10 60 40 2. H2SO4 - 99 60 40 3. p-Toluenesulphonic acid 1.0-2.0 90 65 35 4. Phenyl Sulfamic acid - 90 50 50 5. Indion-190 60 70 30 6. Amberlite-IR-120 1.9 65 71 29 7. Amberlyst-15 4.57 80 70 30 8. HY-Zeolite 2.6 70 30 70 9. H3PO3 1.5 99 20 80 10. H3PW12O40 0.5-1.07 99 40 60 11. Ag-Phospotungstic acid 0.5-0.9 80 45 55 12. Cellulose-PO3H 0.32(ICP) 100 99 1 13. Cellulose-SO3H[ 62 ] 1.5 100 71 29 14. P-Doped carbon[ 40 ] 0.42(ICP) 60 65 35 a Reaction conditions: EAA (3.84 mmol), 1,2 Ethylene Diol (4.2 mmol), catalyst; 80 mg, temperature-120°C, time 6 h. [57-61] P= Phosphorus Table 4 Substrate scope of the protection of 1,3 di-carbonyl with AAE a Table 4: Entry Substrate Products Conv. (%) Sel. (%) 1. Ethyl acetoacetate+ ethylene glycol Image, table 4 100 99 2. Methyl acetoacetate +ethylene glycol Image, table 4 95 99 3. Ethyl 2-methyl-3-oxobutanoate+ethylene glycol Image, table 4 80 99 4. 1-phenylbutane-1,3-dione+ethylene glycol Image, table 4 99 85 5. Ethyl acetoacetate+ 1,2 propane diol Image, table 4 90 88 6. Methyl acetoacetate+ 1,2 propane diol Image, table 4 90 84 7. Ethyl 2-methyl-3-oxobutanoate+1,2 propane diol Image, table 4 70 99 8. 1-phenylbutane-1,3-dione+1,2 propane diol Image, table 4 99 80 9. Ethyl acetoacetate+ 1,3 butane diol Image, table 4 55 60 10. Methyl acetoacetate+ 1,3 butane diol Image, table 4 50 65 11. Ethyl 2-methyl-3-oxobutanoate+1,3 butane diol Image, table 4 40 75 12. 1-phenylbutane-1,3-dione+ethylene glycol Image, table 4 55 99 13b. 1-phenylbutane-1,3-dione+ethylene glycol Image, table 4 99 45 a Reaction conditions: Substrate: AAE (3.84 mmol), Diol (4.2 mmol), 80 mg catalyst, 120 οC, 6 h. (Selectivity calculated by GC). Table 5 the reaction on bifunctional groups a Table 5: Entry Substrates Products Con.% Sel. (%) Other 1. EAA+1,2 ethylene diol Image, table 5 90 70 30 2 SEAA+1,2 ethylene diol Image, table 5 85 70 30 3 EAA+1,2 propanediol Image, table 5 90 71 29 4 EAA+1,3 butanediol Image, table 5 90 75 25 5b EAA+propanol Image, table 5 99 75 25 6b EAA+butanol Image, table 5 99 70 30 7b EAA+IPA Image, table 5 99 65 35 a Reaction conditions: AAE (3.84 mmol), diol (7.6 mmol), 120 mg catalyst, 120 οC, 8 h. bAAE (3.84 mmol), n-alcohol (4.2 mmol) 80 mg catalyst, 6 h. (Selectivity calculated by GC). Brønsted acidic cellulose-PO3H: An efficient catalyst for the chemoselective synthesis of fructones and trans-esterification via condensation of acetoacetic esters with alcohols and diols Dhanaji R. Naikwadi a b Amravati S. Singh a b Ankush V. Biradar a b ⁎ a Inorganic Materials and Catalysis Division, CSIR-Central Salt and Marine Chemicals Research Institute (CSIR-CSMCRI), G. B. Marg, Bhavnagar 364002, Gujarat, India Inorganic Materials and Catalysis Division, CSIR-Central Salt and Marine Chemicals Research Institute (CSIR-CSMCRI) G. B. Marg Bhavnagar Gujarat 364002 India aInorganic Materials and Catalysis Division, CSIR-Central Salt and Marine Chemicals Research Institute (CSIR-CSMCRI), G. B. Marg, Bhavnagar 364002, Gujarat, India b Academy of Scientific and Innovative Research (AcSIR), Ghaziabad 201002, India Academy of Scientific and Innovative Research (AcSIR) Ghaziabad 201002 India bAcademy of Scientific and Innovative Research (AcSIR), Ghaziabad 201002, India ⁎ Corresponding author at: CSIR-Central Salt and Marine Chemicals Research Institute (CSIR-CSMCRI), Inorganic Materials and Catalysis Division, CSIR-CSMCRI G. B. Marg, Gujarat, Bhavnagar 364002, India. CSIR-Central Salt and Marine Chemicals Research Institute (CSIR-CSMCRI) Inorganic Materials and Catalysis Division, CSIR-CSMCRI G. B. Marg Bhavnagar Gujarat 364002 India Cellulose is the most abundant organic source and has expedient a great deal of interest as renewable and emerged as sustainable feedstock. The functionalization of cellulose as designed catalytic system intriguing furnished to the production of fine chemicals. Herein, we synthesized an environmental friendly solid acid catalyst by functionalizing cellulose with phosphoric acid (PO3H). The successful functionalization of cellulose with PO3H was confirmed by 31P NMR, ICP-OES, FE-SEM, and XPS analysis. ICP-OES revealed the presence of phosphorus content of ∼1.0 wt. % on the catalyst's surface while elemental mapping by FESEM and XPS shows a uniform distribution of phosphorus over the material. The synthesized solid acid catalyst was utilized for condensation of diols with acetoacetic esters in solvent-free conditions to synthesize fine chemicals. The present approach not only circumvented the one-step protection and other products but more fascinatingly provided trans-esterification of acetoacetic esters with diols and n-alcohols. The catalyst was successfully used for chemoselective protection on ethyl acetoacetate with 1, 2 diols to essential fructone molecule with ∼100% conversion and 99% selectivity. The results suggested that the catalyst has the advantage over commercial solid acid heterogeneous and homogeneous catalysts. Graphical abstract Image, graphical abstract Keywords Cellulose Acetoacetic ester Protection Trans-esterification Fine chemicals 1 Introduction The utilization of renewable biomass to synthesize carbonaceous feedstock such as supports and functionalized catalysts for the synthesis of fuels and organic transformation into fine chemicals. Increasingly, the utilization of this agro-waste energy source has been targeted as a cleaner and more efficient alternative to thermal energy [1]. Subsequently, fine chemicals are widely used over the decades for the synthesis of many pharmaceuticals and agrochemicals [2]. Due to the requirement of high purity, technology intensiveness, and low cost, fine chemicals are always among the most active and strategic areas of research in the chemical industries [3]. Also, the demand and the global market exponentially increasing day by day for fine chemicals [3-5]. With the recent governmental strict regulatory requirements, the manufacturing processes of fine chemicals need to be substantially improved. Many researchers are trying to improve the existing processes by using different catalysts or finding alternative routes using different cost-effective reagents [6]. As an alternative, active methylene compounds (AMCs) have captured our intensive attention because of their multi-coupling activity and low-energy process to convert into high-value compounds. Therefore, the sustainable and efficient catalytic process to organic transformation of AMCs in fine chemicals has been furnished as a new significant approach [7-15]. For instance, our group reported more challenging one-pot synthesis of flavouring molecules via alkylation-decarboxylation of sub-benzylic alcohols and active methylene compounds [11]. Surprisingly, very few reports demonstrated these reactions of AMCs to value-added molecules, it seems sustainable and new life in fine chemistry. The active methylene compound widely attracts as a reagent to the scientific community to explore more productive methodologies. The use of AMCs towards the various fine chemicals appears as a promising option and greener route to fulfil the growing needs towards the fine chemical [7, 11, 15]. Notably, AMCs are multi-coupling reagents having electrophilic and nucleophilic sites and have successfully used in nucleophilic and electrophilic reactions. From the various AMCs the β-keto-ester is widely used to synthesize fine chemicals using a viable solid-acid catalytic system. Among them, the use of solid Brønsted-acid (BA) catalysts and AMCs have been reported to synthesize value-added chemicals like AMCs, fructone (ethyl 3, 3-ethylendioxybutyrate) is widely used in fragrance industries, cosmetics, food, beverages, and pharmaceuticals detergents, and lacquer industries, and it is used in perfumery industries due to the apple-like smell [16]. The flavoring material is synthesized via ethyl acetoacetate (EAA) acetalization with ethylene glycol using various BA catalysts [17,18]. Industrially, fructone was synthesized using sulphuric acid, p-toluenesulfonic acid, [17] hydrochloric acid. The utilization of acids possesses several issues, including product separation, corrosion of equipments, to name a few. In this regard, more focus is applied on the use of catalysts that can yield fructone without using acids as reagents. More recently, heterogeneous solid acid catalysts like resin-based solid-acid catalyst [19], zeolites [20], ionic liquids [21], heteropoly acids [22], and SO3H functionalized carbon materials [23] have attracted more attention in the fine chemical industries. For example, Liu et al. reported the acetalization of EAA with ethylene glycol using ionic liquid [BSEt3N] [HSO4] with 61% conversion of EAA and 50-65% isolated yields [17]. In 2010, Hu and coworkers reported fructone synthesis by SO3H functionalized carbon catalysts, with the efficiency of 99% conversion and 99% selectivity [23]. Recently, cesium exchanged Al-SBA-15 catalyst has been used in the synthesis of fructone [22]. However, these catalysts suffer various drawbacks: low activity, economically unfavourable, by-products formation, excess solvent utilization, and limited substrate scope. Additionally, reported literature reports suggest that to achieve facile protection and conventional trans-esterification reaction pose a tough challenge and demand specially designed substrates or catalysts to defeat these undesired trails. Biomass is accepted as the most auspicious renewable source of organic carbon available is the perfect equivalent of carbon-based materials. Therefore, exploring an effective approach to transforming biomass resources into catalysts is useful for catalyzing chemicals and fuels. Thus, such an approach has becomes so widespread that it attracts much attention from scientific research. Additionally, triggering these highly functionalized feeds selectively on “strongly and weakly acidic” ingredients. Designing new solid-acid catalysts efficient process could stand for these alternative feedstocks [24-27]. Thus, the use of agro-waste derived, naturally occurring molecules and post-functionalization by different acidic group processes can be a solution to the drawbacks further these catalytic materials remain underdeveloped and need to be focussed. Considering all the above-mentioned factors, the area of interest by chemists has been shifted towards the development of sustainable protocols for the synthesis of fine chemicals. In earlier reports, various metals and acidic functional groups were used to synthesize cellulose-based catalysts [26]. Among them, a cellulose-based magnetic nano-composite supported SO3H group was used as a catalyst for facile synthesis of functionalized pyrimido [4, 5-b] quinolines and indeno fused pyrido [2, 3-d] pyrimidines in water [27]. Kadam et al. had synthesized carbon-sulfur bond formation by exploring the cellulose sulfonic acid (CSA). The utilization of this cellulose sulfonic acid can function as a single source for both carbon and sulfonic groups to dithioacetal protection of carbonyl compounds [28]. Considering the greener and sustainable aspects, bio-derived polymers such as cellulose, chitin, chitosan, and dextrin have gained significant attention in the organic transformation [29-32]. Remarkably, cellulose is cheap and abundantly available all over the earth. The annual production of cellulose is 75 to 100 billion tonnes and can be considered as a raw material for the synthesis of catalysts, chemicals, and fuels [33]. For instance, cellulose-supported various metal nanoparticles are widly utilized in alkylation, thiol protection, and isomerization reactions [28, 34, 36]. Hence, in the present work, the synthesis of a highly sustainable and cost-effective cellulose-PO3H functionalized catalyst has been tried for the first time to the best of our knowledge. The as-synthesized C-PO3H catalyst was used to protect acetoacetic ester (AAE) and trans-esterification reactions to fine chemical synthesis. 2 Experimental 2.1 Materials Cellulose, Ethyl acetoacetate (EAA, >99%), Methyl acetoacetate (MAA 99%), Ethyl 2-methyl-3-oxobutanoate (SMA, 98%). 1, 2, 1, 3 and 1, 4 diols from and triethylamine (99%) TCI Chemicals (India) Pvt. Ltd. 1-phenylbutane-1, 3-dione and 1-diphenylbutane-1, 3-dione (98%) (Sigma-Aldrich Chemicals company) were purchased and used without further purification. Concentrated Phosphorous trichloride (98% purity) was purchased from S. D. Fine Chemicals. The n-propanol and butanol were purchased from (Spectrochem) and used without further purification. 2.2 Synthesis of phosphoric acid-functionalized cellulose The phosphoric acid-functionalized solid catalyst was synthesized using cellulose as the renewable organic carbon. Typically, in a 100 mL two-neck round bottom flask (RBF), 5 g of cellulose was dispersed in 20 mL toluene and 5 mL Et3N and stirred at 400 rpm for 30 min. Then 10 mL of PCl3 was added dropwise through the syringe, and the reaction mixture was heated at 80°C for 7 h. After completing the reaction, the reaction mixture was cooled to room temperature, and the excess amount of PCl3 was evaporated. The collected solid was washed three times with 25 mL isopropanol (IPA). The in-situ functionalization on cellulose gave a light brownish material, dried in a hot air oven at 100°C for 24 h. The final weight of the obtained brownish phosphoric acid-functionalized catalyst was 3.3 g and was labelled as C-PO3H. The structural characterization and content of phosphorous studies of the catalyst were carried out by different physicochemical methods shown below in detail and ESI page S2. 2.3 Catalytic activity: chemoselective protection reaction of AAE and diols In a typical reaction, a 50 mL round bottom flask (RBF) was charged with 7.6 mmol EAA, 8 mmol 1, 2 diol, and 80 mg C-PO3H. Further, the reaction mixture was stirred at 120°C for 6 h. The progress of the reaction was monitored by withdrawing the samples periodically and analyzing them by gas chromatography (GC) and calculated conversion, selectivity. After completion of the reaction, the solution was cooled to room temperature (30°C), the catalyst was separated by normal filtration and washed with iso-propyl alcohol and activated in oven at 100°C, 4 h for further reuse. The crude obtained was filtered, extracted using ethyl acetate and characterized by GC-MS techniques. The reaction was monitored by taking aliquots at different time intervals. These aliquots were analyzed by gas chromatography (Agilent GC 7890B) equipped with HP-5 capillary column of 30 m x 0.250 mm x 0.25 μm dimension and a FID detector and GC-MS (Shimadzu, GC-MS QP 2010, Japan). The products of the reaction were identified by comparing their retention time and/or by comparing the MS spectra with the reference standards when available. The reproducibility of the results was ensured by repeated experiments under identical conditions and was found to be consistent within ± 5% variation. 2.4 Trans-esterification reaction of AAE and n-alcohols In a typical reaction protocol, 7.6 mmol EAA, 8 mmol n-alcohol and 80 mg C-PO3H were heated at 120°C in 50 mL RBF for 6 h. The reaction mixture was heated at 120°C and the progress of the reaction was monitored by GC. After completion of the reaction, the catalyst was separated by normal filtration washed with IPA and activated in the oven at 100°C, 4 h for further reuse. The solution was extracted and successfully characterized by GC-MS as mentioned in section 2.3. 3 Results and discussion The use of cellulose to functionalize the acidic and basic group is an attractive topic of research. Also, it is believed that the phosphoric group shows excellent catalytic activity towards the synthesis/development of valuable products. The synthesis of the acidic (PO3H) functionalized material was carried out by reaction of cellulose with PCl3. It is well known that phosphorous has a high affinity towards oxygen. Hence, when the cellulose is treated with highly reactive PCl3, oxygen moiety interacts with phosphorous to form O-P and P=O stable bonds which can be depicted from Scheme 1 . The high reactivity of PCl3 enhances various applications for phosphate, phosphine, phosphite, and acidic PO3H group functionalization. The functionalized material of cellulose has occurred as polymeric form. The surface area of the Cellulose-PO3H was measured using a N2 adsorption–desorption study at 77 K. The BET surface area of the catalyst was 28.65 m²/g and pore volume 0.02 while pore diameter is ∼27 Å. The less surface area was observed due to functionalized material of cellulose was metal-free and in polymeric form. [37-42]. However, for further structural information of the catalyst is explained in detail via different physico chemical techniques. 4 Catalyst Characterisation PXRD was used for the study of the phase purity of C-PO3H materials. The characteristic diffraction peaks of the synthesized catalysts were depicted in (Fig. 1A.). The characteristic peaks observed at 2 θ = 15.4°, 22.4°, 34.2° corresponded to cellulose corroborated with to literature reports [22-24]. Interestingly, after functionalization of cellulose with acidic PO3H group, the XRD data were significantly different, and there was the shifting of peaks corresponding to 2 θ value from 15.4-15.8°, 22.4-23.1°, to 2 θ = 25.5°, 27.9°, 33.4°, 35°, 43.4° and 47.2° observed. From these data, it was confirmed that the functionalization of the cellulose with phosphoric acidic group occurred respectively [36]. As seen in the XRD pattern of C-PO3H, the position and the relative intensities of observed peaks are different due to the phosphoric group [37-39]. Further, the functional hybrid framework of C-PO3H was confirmed by FT-IR and 31P NMR [40]. In the FTIR spectrum, the stronger band appears at 998 cm− 1 were corresponds to P-O-H bending vibrations, while the band at 960 cm−1 can be assigned to the stretching vibrations of the acidic P-OH group. Correspondingly, the intensity of basic hydroxyl groups at 3448 cm−1 was reduced due to the replacement of the O-H to O-P bond. Additionally, the weak band appeared at 1174 cm−1 related to P=O stretching vibrations, and the new band appeared at 2674 and 2486 cm−1 stretching vibrations of the P-O bond, was observed in Fig. 1C. [36-40]. additionally, the Brønsted acidic nature of the catalyst was confirmed by the pyridine adsorption FT-IR spectroscopy. From the spectrum (Fig. 1 B.), it was observed that Brønsted acidic sites are present on the surface of the catalyst. The studies were carried out at room temperature, 100°C, 120°C, and 140°C for 2 h. All pyridine adsorbed spectrum shows two characteristic bands assigned to pyridine's chemisorption on to the surface band position at 1636 -1646, and at 1472-1484 cm−1 it indicates the vibrational mode of pyridine adsorbed on the catalyst assigned to weak Brønsted acidic sites. This indicated a stronger bonding force between pyridine and –OH group from C-PO3H. However, the bonding interaction between phosphorous and pyridine-nitrogen implies as Lewis acidic sites. The disappearance absorbance peak (Pyridine and C-PO3H) of peaks due to the decrease in the amount on the surface of the pellet at 140°C temperature. Moreover, the presence of phosphorous was confirmed by the ICP analysis and it was found 1.0% phosphorous was loaded. Based on these results, the calculated total acidity, turned to be 0.32 mmol/g (ESI page no S4); simultaneously comparative study of the total acidity of various catalysts is shown in ESI Table S4. Furthermore, the presence of phosphorous in the C-PO3H catalyst moiety was confirmed by31P NMR. From the 31P NMR spectrum, it can be observed that a strong signal at δ 3.84-2.98 indicating the presence of the phosphoric acid (See ESI Fig S4) [44] The surface morphology of the synthesized C-PO3H was determined by Field-Emission Scanning Electron Microscopy (FE-SEM) and the respective images are displayed in Fig. 2. The synthesized C-PO3H showed an irregular network structure. The morphology of C-PO3H shows an irregular structure and particles images appear like a cotton ball kind. The elemental mapping of the functionalized cellulose showed a uniform distribution of the C, P, and O atoms over the complete solid catalyst (Fig. 2D–F). Also, elemental analysis using SEM-EDAX showed 8.07 wt. % phosphorus (Fig. 2H) in C-PO3H. Furthermore, Fig. 2, F shows a uniform distribution of P atoms over the catalyst surface. Transmission electron microscopy (TEM) images show the irregularly dispersed element on the surface of C-PO3H (See ESI Fig. S1) [35]. The X-ray Photoelectron Spectroscopy (XPS) was used to understand the chemical state of the material and also elemental composition of the surface of a material (C-PO3H). The XPS survey mode (Fig. 3A) range of 0-1350 eV demonstrated the characteristic signals of C, P, and O elements in the catalyst [36-40]. The high-resolution spectrum of C1s are depicted in Fig. 3B. shows a significant peak at 284.6 eV, a characteristic of the sp2 hybridized carbon. The peaks at 286.4 and 287.9 eV suggest the presence of secondary carbons and P-containing groups (C-P, C-P-O and C-O) on the carbon surface. The high-resolution deconvoluted XPS spectrum for O1s displayed three peaks in Fig. 3C. The peak at 531.3 eV is the characteristic peak for the P=O (sp2 ), while the peaks at 532.4 and 533.7 eV are for C=O (sp2 ) and C-OH (sp3 ), respectively. The deconvolution of the P2p spectrum is shown in Fig. 3D. The peaks at the binding energy of 132.5 ± 0.1 eV are associated with the -C-O-P-O- skeleton structure [41–45]. The range of 130−133 eV (C-O-P, P=O and O-P) is characteristic of P5+ in phosphonate groups In addition, the XPS elemental mapping of the Cellulose-PO3H catalyst to observe the uniform distribution of elements present on the surface of catalyst. The sample analysis was recorded with the help of snapmap technique, where the stage of scanning with respect to the 100 µm X-ray spot. An area of size (2 × 2 mm) on the surface of Cellulose-PO3H was chosen for mapping. Fig. 4 D shows the attendance of different element in terms of diffrenet colors i.e. C1s (green), O1s (blue), P 2p (red), and intersection image shows the uniform distribution of all the elements. Principal Component Analysis (PCA): applied to both the survey and high resolution C 1s, O1s, and P 2p spectral data sets shows that there are two components present in both data sets shown in ESI figure S52 fig C [63]. 5 Catalytic Activity 5.1 Synthesis of Fructone from Diol and AAE The addition of the diol with AAE results in the formation of various cyclic ketals, which are widely used in the fine and fragrance chemical industries. Mainly fructone is commonly used in the perfumery industry [46-61]. The formation of fructone can be observed in scheme 2 . We began our studies using ethylene glycol with EAA as a model substrate and using different homogeneous and heterogeneous catalysts. Our initial investigation into this proposed condensation reaction of EAA and 1, 2-diol began with the catalyst variation studies is shown in (Table 1 ). When the reaction was tested in the absence of the catalyst, only a 10% conversion of the EAA was observed (Table 1, entry 1). However, H2SO4 and PTSA was shown the complete conversion of EAA with 60% and 65% selectivity towards fructone (Table 1, entries 2 and 3). The sulfamic acid gives almost 90% conversion of EAA with 50% selectivity of desired cyclic ketal (Table 1, entry 4). The low selectivity can be attributed to the strong acidity of H2SO4 and PTSA and intact the side reactions. However, the homogeneous nature of those catalysts makes the catalyst non-recyclable. Instead of homogeneous catalysts, various heterogeneous catalysts were tested for regioselective protection of EAA. The commercial Indion-190 gave 60% conversion of EAA with 70% selectivity of fructone (Table 1, entry 5). Amberlyite-IR-120H and Amberlyst-15 as Brønsted acid catalyst gave 71 and 70% selectivity of fructone (Table 1, entries 6 and 7). After investigating SO3H functionalized groups, we explored some PO3H functionalized catalysts under optimized conditions to protect the carbonyl functionality of EAA. The H3PO3 resulted in complete conversion of EAA with 20% selectivity of fructone, whereas using Phospotungstic acid, only 40% selectivity of fructone was observed. The heterogenized Silver-Phospotungstic acid gives an 80% conversion of EAA with 45% selectivity of fructone (Table 1, entries 9, 10 &11). Remarkably, the more amount and strong acidity of catalysts gave by-products like self-Aldol of EAA (EAA, 1, 2 diol, 120mg catalyst) and unwanted cyclization shown in ESI. Thus, the need for mild acidic conditions for this transformation is the need of the hour, which can easily help in selective synthesis of fructone. Herein, In-situ functionalized C-PO3H catalyst is used for further investigations. The C-PO3H catalyst gives promising results with 100% conversion of EAA with 99% selectivity of fructone. Similarly, previously reported Cellulose-SO3H (CSA) was prepared according to the literature procedure [62]. However, as compared to our catalyst, the CSA has given complete conversion but intercept in the selectivity of fructone (Table 1, entry 13). Notably, the strong acidity hurdle to conversion in the selectively desired product. Similarly, phosphorous doped carbon was used as catalyst, but there was no significant change in conversion and selectivity to fructone as the desired product. Overall, sulfonated functional group/carbon catalysts usually afforded a higher conversion with a low selectivity. The results in the characterization sections was supply us more information about the structure-activity relationship of these –Cellulose-PO3H catalysts in the chemoselctive protection reaction. It can therefore be speculated that condensation of EAA and diols takes place at external acidic sites of C-PO3H. However, from the catalyst the -PO3H group creates acidic sites for the condensation and trans-esterification reaction. However, the functionalised group –PO3H can be used to convert reactant into product. Notably, the remaining hydroxyl groups on surface of catalyst can be creates acidity of the C-PO3H. However, the easily protonation occurred in the case of -PO3H group. The active acidic species easily protonate to carbonyl group and activated in enhanced electrophilic carbonyl group. Thus, to motif on selectivity and the high activity of C-PO3H, the C-PO3H is selected for further optimization of reaction parameters of protection and trans-esterification shown in Schemes 3 and 4 (Table 1, entry 12). The effect of catalyst amount on the regioselective protection of EAA with diols was explored by varying the catalyst amount from 20 to 120 mg, and the results are shown in Table S1 (Supporting information ESI). The 20 mg loading of catalyst was gave only 50% conversion of EAA. However, the conversion of EAA increased with the increase in the catalytic amount 80 mg showed 100% conversion and 99% selectivity of desired products, whereas the selectivity of fructone remained the same upon increasing the catalytic amount from 20 to 80 mg (Table S1 entry 3). Furthermore, increasing the catalyst amount to 120 mg, a complete conversion of EAA was observed with low selectivity (Table S1 entry 4). It was observed that the highest amount of catalytic sites present on the catalyst initiates the unwanted side reactions due to an increase in the acidity of the catalyst. The formed fructone was further undergoing the trans-esterification reactions to form the fructone esters. Thus, 80 mg of catalyst amount is considered as the optimum loading to get a maximum conversion of EAA (100%) with maximum selectivity of fructone (> 99%). 5.2 Solvent variation After optimizing catalyst variation and concentration of catalyst studies, we have further explored the effect of solvents in the condensation reaction. Herein we examined the high boiling point solvents for reported reaction. As per previous reports, ionic liquids as a solvent favour the formation of the fructone as the product, and non-polar solvents like toluene favour the formation of both products. For example, the reaction between EAA and ethylene glycol using C-PO3H in the presence of toluene and xylene gave complete conversion of EAA with 70-71% selectivity of fructone (Table S2, entries 1 and 2). The non-polar solvent does not hurdle to form the desired product. On the other hand, highly polar solvents like DMSO, DMF, and DMA yielded 40-45% conversion of EAA with 50-52% selectivity of fructone may attribute due to unwanted side reaction (Table S2, entries 3, 4, and 5). Therefore, from the solvent variation study, it can be inferred that non-polar solvents play an important role in protecting EAA. Thus, we compete with the extraction of non-polar solvent, and from our knowledge, sol-free reaction conditions may ease the isolation and result in eco-friendly conditions. The recyclability of catalyst studies under the optimized conditions was performed to check the variation in the activity of the catalyst for the subsequent cycles. The catalyst was separated after the reaction by a simple filtration technique. As a result, the catalyst was recycled 5 times (Shown in Fig. 5 ) and the catalyst was characterized by FT-IR and FE-SEM after the recyclability studies. (See ESI Fig S2 and S3). 6 Substrate scope To our delight, given the challenges in previous literature were to obtain the different types of chemoselective protected ketone with different diols and limited substrate scope. The expanded substrate scope, with a particular focus on the AAEs functional group tolerance towards the novel C-PO3H-catalyzed condensation was determined. We began with 1, 2 diols through the various AAEs, the experimental results apparent of fructone gave complete conversion with excellent selectivity 99% (Table 4 , entry 1). Similar results were obtained, using MAA with 95% conversion and 99% selectivity, whereas using Ethyl 2-methyl-3-oxobutanoate, the decreased conversion by 80% (Table 4, entries 2 and 3). In further studies, instead of 1, 2 ethane diols, the 1, 2 propanediol was used for the same reaction condition. It was observed that the selectivity and conversion did not affect the selectivity of the desired product (Table 4, entries 5-7). However, using benzylic carbonyl and acetyl carbonyl, the reaction was regioselectively taking place over the acetyl carbonyl (Table 4, entry 4). The 80-85% selectivity observed in 1-phenylbutane-1, 3-dione on chemoselective carbonyl, however increasing equivalence of diol, the diol selectively attacks on benzylic carbonyl (Table 4, entries 4 and 8). Furthermore, in the case of 1, 3 butane diol and AAE, 40-55% conversion and moderate to excellent selectivity towards the desired products was observed (Table 4, entries 9-11). Correspondingly, we finally applied these optimized reaction conditions on an increasing chain length of diol i.e., 1, 4 diols and 1, 5 diol. To our surprise, trans-esterification product was observed instead of the expected fructone. This may be attributed to the steric hindrance and ring stability. We next tested this protocol's applicability with 1, 4 diols and n-alcohols under optimum conditions (Table 5 ). The catalyst amount and time are the keys towards regioselectivity and chemoselectivity. Herein, when the high amount of catalyst is used, it resulted in the trans-esterification reaction instead of condensation. The trans-esterification reaction has also occurred with condensation when the equivalence amount of diol and the equivalent amount of catalyst increased is used (Table 5, entries 1-4). The identity of these products was further confirmed by GC-MS techniques with their standards. Furthermore, we tested few linear alcohols under the optimized conditions. It was observed that the catalyst showed excellent activity and selectivity towards the trans-esterification reaction. In this regard, we began the reaction of n-propyl alcohol and EAA under optimised reaction conditions, it resulted in almost complete conversion of EAA with 75% selectivity (Table 5, entry 5). The same result was observed with n-butyl alcohol and IPA showing 99% conversion and 70-65 respectively selectivity (Table 5, entries 6 and 7). On considering all these facts, we described the best reaction conditions for 1, 2 diols, and AEE with five/six-membered stable ring formation. Also, the model reaction was conducted at a 10 gm scale with an optimized reaction condition; it was observed that there was no change with respect to selectivity and conversion. This indicates the developed method is favourable as well as sustainable for scale-up at the industrial level. This is the beginning and the concept of justifiable development forms the basis of the environmental rules and strategies for moving towards a more sustainable pattern of economic development. Leaching and recycling studies: After the reaction completion catalyst was separated, the sample was taken from the reaction mixture and subjected to ICP acid digestion (Nitric and hydrochloric acid at a 1:3 ratio). The leaching studies were performed using ICP-AES analysis and it was found that negligible leaching occurred; as the phosphorous content remained intact and confirms its existence in the catalyst moiety. However, also, to check the leaching of –PO3H acidic sites, a hot filtration experiment was carried out by filtering the catalyst after 20 min and the filtrate was further allowed to react. No significant change in the conversion of EAA was found and data perfectly matched with ICP. To determine the pathway towards the catalytic synthesis of fructone, and to enable the readers as to how the reaction occurs, we have tried to present our data in the form of a plausible mechanism. The plausible mechanism is depicted in Scheme 5 . The catalyst initially protonates the carbonyl group in the EAA to give respective oxonium ion Scheme 5. This oxonium ion stabilizes hydroxyl groups of 1, 2 diols to give hemiacetal. After the formation of hemiacetal, the hydroxyl groups again get protonated by the catalyst and form an intermediate along with water moiety. Later the other side of the hydroxyl group present in 1, 2 diols are attacked and depart the water molecule resulting in the cyclization and to form the stable five-membered ring shown in scheme 5. The formation of cyclized product is detected by MS analysis Base peak at m/z = 87(100), 159 (the detailed information is presented in the ESI: S10). Furthermore, trans-ester products could also be detected through mass spectrometry peaks at m/z = Base peak: 43(100), 103(For detailed ESI: S23). This shows that the catalyst is not only active towards the synthesis of fructone from EAA and diols but is also recyclable and can be used for the gram-scale process. 7 Conclusion In summary, a green, efficient and heterogeneous acid catalyst, Cellulose-PO3H, was prepared and thoroughly characterized. The presence of phosphoric acid group (PO3H) was confirmed by 31P-NMR, FT-IR, CHNS and XPS analysis. The synthesized material was used as the catalyst for fine chemical syntheses like protected ester, fructone, and trans-esterification products with ∼100% conversion and 99% selectivity. The cellulose-PO3H catalyst can be considered as the green and recoverable catalyst for organic transformations. The catalyst was applicable for the regio and chemoselective organic transformation. Also, the catalyst showed efficient recyclability as the catalyst depicted similar activity for five consecutive cycles. The additional application of a further reaction step and selectivity control towards protected ester, and trans-esterification seems promising and will be part of ongoing industrial research. Credit Author Statement DRN performed experiment, analysed data, wrote manuscript, ASS analysed data, wrote manuscript, AVB, conceptualization of idea, monitor overall project, wrote manuscript. Declaration of competing interest The authors declare that they have no known competing financial interests or personal relationships that could have appeared to influence the work reported in this paper. Acknowledgments CSMCRI communication No. 64/2021. Analytical and Environmental Science Division and Centralized Instrument Facility are acknowledged for providing instrumental analysis. AVB acknowledges to Science & Engineering Research Board (SERB/F/2139/2017-2018), India, for financial support. The Analytical and Environmental Science Division and Centralized Instrumentation Facility of CSIR-Central Salt and Marine Chemicals and Research Institute, Bhavnagar, is highly acknowledged for providing all requisite instrumental analysis. Supplementary materials Supplementary material associated with this article can be found, in the online version, at doi:10.1016/j.mcat.2021.111912. Appendix Supplementary materials Image, application 1 References [1] P. Peter Fine Chemicals – The Industry and the Business 2nd. rev. Ed. 2011 Wiley & Sons 69 P. Peter, Fine Chemicals – The Industry and the Business (2nd. rev. Ed.). Wiley & Sons69 (2011). [2] S. Joshi V. Ranade Industrial Catalytic Processes for Fine and Specialty Chemicals 2016 Elsevier Amsterdam S. Joshi, V. Ranade, Industrial Catalytic Processes for Fine and Specialty Chemicals. Amsterdam: Elsevier (2016). [3] A. Stahl Fine chemicals, alkaloids, essential oils, & extracts J. Soc. Chem. Ind 27 1908 956 960 A. Stahl, Fine chemicals, alkaloids, essential oils, & extracts. J. Soc. Chem. Ind27 (1908) 956-960. [4] Fine Chemicals Market, Top Leading Countries, Companies, Size, Drivers, Trends, Forces Analysis, Revenue, Challenges and Global Forecast (2020). [5] W. Abelshauser W. Hippel J. Johnson R. Stokes German Industry and Global Enterprise: BASF: The History of a Company 2003 Cambridge University Press W. Abelshauser W. Hippel, J. Johnson, R. Stokes, German Industry and Global Enterprise: BASF: The History of a Company. Cambridge University Press (2003). [6] M. Colonna C. Berti M. Fiorini E. Binassi M. Mazzacurati M. Vannini S. Karanam Synthesis and radiocarbon evidence of terephthalate polyesters completely prepared from renewable resources Green Chem. 13 2011 2543 2548 M. Colonna, C. Berti, M. Fiorini, E. Binassi, M. Mazzacurati, M. Vannini, S. Karanam, Synthesis and radiocarbon evidence of terephthalate polyesters completely prepared from renewable resources. Green Chem.13 (2011) 2543-2548. [7] D. Mola Antonia A. Massa The aldol reactions of active methylene compounds Curr. Org. Chem. 19 2012 2290 2301 D. Mola Antonia, A. Massa, The aldol reactions of active methylene compounds. Curr. Org. Chem.19 (2012) 2290-2301 [8] T. Duan-Jian L. Fujian L. Wang L. Jiang A green and efficient hydration of alkynes catalyzed by hierarchically porous poly (ionic liquid) s solid strong acids Appl. Catal. A: Gen. 564 2018 56 63 T. Duan-Jian, L. Fujian, L. Wang, and L. Jiang. A green and efficient hydration of alkynes catalyzed by hierarchically porous poly (ionic liquid) s solid strong acids. Appl. Catal. A: Gen.564 (2018) 56-63. [9] C. Zhi-Jun X. Zhao H. Fei-Qiang Y. Zhou K. Huang Z. An-Min T. Duan-Jian Highly efficient indirect hydration of olefins to alcohols using superacidic polyoxometalate-based ionic hybrids catalysts Ind. Eng. Chem. Res. 57 2018 6654 6663 C. Zhi-Jun, X. Zhao, H. Fei-Qiang, Y. Zhou, K. Huang, Z. An-Min, and T. Duan-Jian, Highly efficient indirect hydration of olefins to alcohols using superacidic polyoxometalate-based ionic hybrids catalysts. Ind. Eng. Chem. Res.57 (2018) 6654-6663. [10] H. Wei Y. Zhou Y. Dong C. Zhi-Jun H. Fei-Qiang C. Min-Zhong T. Duan-Jian Efficient hydrolysis of hemicellulose to furfural by novel superacid SO4H-functionalized ionic liquids Green Energy Environ 4 2019 49 55 H. Wei, Y. Zhou, Y. Dong, C. Zhi-Jun, H. Fei-Qiang, C. Min-Zhong, and T. Duan-Jian. Efficient hydrolysis of hemicellulose to furfural by novel superacid SO4H-functionalized ionic liquids. Green Energy Environ. 4 (2019) 49-55. [11] D.R. Naikwadi K. Ravi A.S. Singh J.H. Advani A.V. Biradar Gram-scale synthesis of flavoring ketones in one Pot via alkylation–decarboxylation on benzylic carbon using a commercial solid acid catalyst ACS Omega 24 2020 14291 14296 D. R.Naikwadi, K. Ravi, A. S. Singh, J. H. Advani, A. V. Biradar, Gram-scale synthesis of flavoring ketones in one Pot via alkylation–decarboxylation on benzylic carbon using a commercial solid acid catalyst, ACS Omega24 (2020) 14291–14296. [12] M. Lindmark-Henriksson Biotransformations of Turpentine Constituents: Oxygenation and Esterification 2003 Royal Institute of Technology (KTH) Stockholm, Sweden M. Lindmark-Henriksson, Biotransformations of Turpentine Constituents: Oxygenation and Esterification, Royal Institute of Technology (KTH), Stockholm, Sweden (2003). [13] P. Mäki-Arvela B. Holmbom T Salmi D.Y. Murzin Recent progress in synthesis of fine and specialty chemicals from wood and other biomass by heterogeneous catalytic processes Catal. Rev. 49 2007 197 340 P. Mäki-Arvela, B. Holmbom, T Salmi, D.Y. Murzin, Recent progress in synthesis of fine and specialty chemicals from wood and other biomass by heterogeneous catalytic processes, Catal. Rev.49 (2007) 197-340. [14] G. Nie J. Zou R. Feng X. Zhang L. Wang HPW/MCM-41 catalyzed isomerization and dimerization of pure pinene and crude turpentine Catal. Today 234 2014 271 277 G. Nie, J. Zou, R. Feng, X. Zhang, L. WangHPW/MCM-41 catalyzed isomerization and dimerization of pure pinene and crude turpentine, Catal. Today234 (2014) 271-277. [15] D.T. Edward S.H. Taylor A.E. Graham Nanoporous aluminosilicate-catalyzed telescoped acetalization-direct aldol reactions of acetals with 1, 3-dicarbonyl compounds ACS Omega 3 2018 15482 15491 D. T. Edward, S.H. Taylor, A. E. Graham, Nanoporous aluminosilicate-catalyzed telescoped acetalization-direct aldol reactions of acetals with 1, 3-dicarbonyl compounds, ACS Omega3 (2018) 15482-15491. [16] S. Gao X. Liang J. Yang M. He Sci, Highly efficient heterogeneous procedure for the synthesis of fructone fragrancy China Ser. B: Chem. 51 2008 646 650 S. Gao, X. Liang, J. Yang, & M. He, Sci, Highly efficient heterogeneous procedure for the synthesis of fructone fragrancy, China Ser. B: Chem.51 (2008) 646-650. [17] Y. Liu Y. Wang T. Liu D. Tao Facile synthesis of fructone from ethyl acetoacetate and ethylene glycol catalyzed by SO3H-functionalized Brønsted acidic ionic liquids RSC Adv. 4 2014 22520 22525 Y. Liu, Y. Wang, T. Liu, & D. Tao, Facile synthesis of fructone from ethyl acetoacetate and ethylene glycol catalyzed by SO3H-functionalized Brønsted acidic ionic liquids, RSC Adv.4 (2014) 22520-22525. [18] C. Yuan F. Zhang J. Wang X. Ren 12-Phosphotungstic acid and its Cs salt supported on various porous carriers as catalysts for the synthesis of fructone Catal Commun. 6 2005 721 724 C. Yuan, F. Zhang, J. Wang and X. Ren12-Phosphotungstic acid and its Cs salt supported on various porous carriers as catalysts for the synthesis of fructone, Catal Commun.6 (2005) 721–724. [19] T. Truong N. Do T. Hung V. Doan T. Nguyen Q. Doan Study on the HPA immobilisation on Al-SBA-15 support over Brønsted groups Mol. Catal. 478 2019 110571 110576 T. Truong, N. Do, T. Hung, V. Doan, T. Nguyen, Q. Doan, Study on the HPA immobilisation on Al-SBA-15 support over Brønsted groups, Mol. Catal.478 (2019) 110571-76. [20] M.J. Climent A. Corma A. Velty M. Susarte Zeolites for the production of fine chemicals: synthesis of the fructone fragrancy J. Catal. 196 2000 345 351 M. J. Climent, A. Corma, A. Velty, and M. Susarte, Zeolites for the production of fine chemicals: synthesis of the fructone fragrancy, J. Catal.196 (2000) 345–351 [21] Y. Wang R. Wang L. Wu Y. Dai Preparation of fructone catalyzed by water-soluble Brønsted acid ionic liquids Chin. Chem. Lett. 18 2007 24 26 Y. Wang, R. Wang, L. Wu & Y. Dai, Preparation of fructone catalyzed by water-soluble Brønsted acid ionic liquids. Chin. Chem. Lett.18 (2007) 24-26 [22] Q.V. Tran T.H. Truong T.Q. Hung H.V. Doan X.N. Pham NTH Le Bach LG Preparation and testing of ceasium Brønsted ion-exchanged Al-SBA-15 supported heteropoly acid as heterogeneous catalyst in the fructone fragrancy synthesis J. Porous Mat. 27 2020 1745 1754 Q.V. Tran, T. H. Truong, T.Q. Hung, H.V. Doan, X. N. Pham, Le NTH, Bach LG Preparation and testing of ceasium Brønsted ion-exchanged Al-SBA-15 supported heteropoly acid as heterogeneous catalyst in the fructone fragrancy synthesis, J. Porous Mat., 27 (2020) 1745-1754. [23] B. Hu C. Li S. Zhao L. Rong S. Lv X. Liang C. Qi Highly efficient procedure for the synthesis of fructone fragrance using a novel carbon based acid Molecules 15 2010 5369 5377 B. Hu, C. Li, S. Zhao, L. Rong, S. Lv, X. Liang, & C. Qi, Highly efficient procedure for the synthesis of fructone fragrance using a novel carbon based acid, Molecules15 (2010) 5369-5377. [24] J.H. Advani K. Ravi D.R. Naikwadi H.C. Bajaj M.B. Gawande A.V Biradar Dalton Trans. 49 2020 10431 10440 J. H. Advani, K. Ravi, D. R. Naikwadi, H. C. Bajaj, M. B. Gawande, A. V Biradar, Dalton Trans.49 (2020) 10431-10440. [25] D.S. Doke J.H. Advani D.R. Naikwadi M.B. Gawande P. Walke S.B. Umbarkar A.V. Biradar Utilization of waste biomass for the synthesis of functionalizable support for covalent anchoring of active organo catalyst ACS Sustain. Chem. Eng. 7 2019 3018 3026 D. S. Doke, J. H. Advani, D. R. Naikwadi, M. B. Gawande, P. Walke, S. B. Umbarkar, A. V. Biradar, Utilization of waste biomass for the synthesis of functionalizable support for covalent anchoring of active organo catalyst, ACS Sustain. Chem. Eng.7 (2019) 3018-26. [26] Z. Long L. Sun W. Zhu G. Chen X. Wang W. Sun P-Doped carbons derived from cellulose as highly efficient metal-free catalysts for aerobic oxidation of benzyl alcohol in water under an air atmosphere Chem. Commun. 54 2018 8991 8994 Z. Long, L. Sun, W. Zhu, G. Chen, X. Wang, & W. Sun, P-Doped carbons derived from cellulose as highly efficient metal-free catalysts for aerobic oxidation of benzyl alcohol in water under an air atmosphere, Chem. Commun.54 (2018) 8991-8994. [27] F. Osanlou F. Nemati S. Sabaqian An eco-friendly and magnetized biopolymer cellulose-based heterogeneous acid catalyst for facile synthesis of functionalized pyrimido [4, 5-b] quinolines and indeno fused pyrido [2, 3-d] pyrimidines in water Res. Chem. Intermed. 43 2017 2159 2174 F. Osanlou, F. Nemati, & S. Sabaqian, An eco-friendly and magnetized biopolymer cellulose-based heterogeneous acid catalyst for facile synthesis of functionalized pyrimido [4, 5-b] quinolines and indeno fused pyrido [2, 3-d] pyrimidines in water, Res. Chem. Intermed.43 (2017) 2159-2174. [28] K. Kadam An expedient carbon–sulfur bond formation explored through the cellulose sulfonic acid (CSA) catalyzed dithioacetal protection of carbonyl compounds J. Sulphur. Chem. 1 2020 1 12 K. Kadam, An expedient carbon–sulfur bond formation explored through the cellulose sulfonic acid (CSA) catalyzed dithioacetal protection of carbonyl compounds, J. Sulphur. Chem.1 (2020) 1-12. [29] R. Maggi G. Bosica S. Gherardi C. Oro G. Sartori ZnNaY zeolite catalysed reaction of β-dicarbonyl compounds with ethyl cyanoformate under solventless conditions Green Chem. 7 2005 182 184 R. Maggi, G. Bosica, S. Gherardi, C. Oro, & G. Sartori, ZnNaY zeolite catalysed reaction of β-dicarbonyl compounds with ethyl cyanoformate under solventless conditions, Green Chem.7 (2005) 182-184. [30] M. Hayes Chitin, chitosan and their derivatives from marine rest raw materials: potential food and pharmaceutical applications Marine Bioactive Compounds 1 2012 115 128 M. Hayes, Chitin, chitosan and their derivatives from marine rest raw materials: potential food and pharmaceutical applications, Marine Bioactive Compounds1 (2012) 115-128. [31] J.H. Advani A.S. Singh N.H. Khan H.C. Bajaj A.V. Biradar Black yet green: Sulfonic acid functionalized carbon as an efficent catalyst for highly selective isomerization of α-pinene oxide to trans-carveol Appl. Catal. B 268 2020 118456 118460 J. H. Advani, A. S. Singh, N.H. Khan, H. C. Bajaj, A. V. Biradar, Black yet green: Sulfonic acid functionalized carbon as an efficent catalyst for highly selective isomerization of α-pinene oxide to trans-carveol. Appl. Catal. B268 (2020) 118456-60. [32] E. Babaei B. Mirjalili Fe3O4@ nano-dextrin/Ti (IV): A unique and recyclable catalyst for aqueous pseudo-four-component reaction J. Organomet. Chem. 906 2020 121055 121060 E. Babaei, & B. Mirjalili, Fe3O4@ nano-dextrin/Ti (IV): A unique and recyclable catalyst for aqueous pseudo-four-component reaction, J. Organomet. Chem.906 (2020) 121055-60. [33] X. Xu G. Zhao H. Wang X. Li X. Feng B. Cheng Y. Yin Bio-inspired amino-acid-functionalized cellulose whiskers incorporated into sulfonated polysulfone for proton exchange membrane J. Power Sources 409 2019 123 131 X. Xu, G. Zhao, H. Wang, X. Li, X. Feng, B. Cheng, & Y. Yin, Bio-inspired amino-acid-functionalized cellulose whiskers incorporated into sulfonated polysulfone for proton exchange membrane, J. Power Sources409 (2019) 123-131. [34] Zahra Daneshfar A. Rostami Cellulose sulfonic acid as a green, efficient, and reusable catalyst for Nazarov cyclization of unactivated dienones and pyrazoline synthesis RSC Adv. 127 2015 104695 104707 Daneshfar, Zahra, and A. Rostami. Cellulose sulfonic acid as a green, efficient, and reusable catalyst for Nazarov cyclization of unactivated dienones and pyrazoline synthesis. RSC Adv.127 (2015) 104695-104707. [35] Gelines Moreno-Fernández J. Luis Gómez-Urbano M. Enterría R. Cid Juan M.López d. Amo R. Mysyk D. Carriazo Understanding enhanced charge storage of phosphorus-functionalized graphene in aqueous acidic electrolytes Electrochimica Acta 361 2020 136985 136995 Moreno-Fernández, Gelines, J. Luis Gómez-Urbano, M. Enterría, R. Cid, Juan M. López d. Amo, R. Mysyk, and D. Carriazo. Understanding enhanced charge storage of phosphorus-functionalized graphene in aqueous acidic electrolytes. Electrochimica Acta361 (2020) 136985-95. [36] Fatemeh Osanlou F. Nemati S. Sabaqian An eco-friendly and magnetized biopolymer cellulose-based heterogeneous acid catalyst for facile synthesis of functionalized pyrimido [4, 5-b] quinolines and indeno fused pyrido [2, 3-d] pyrimidines in water Res. Chem. Intermed 43 2017 2159 2174 Osanlou, Fatemeh, F. Nemati, and S. Sabaqian. An eco-friendly and magnetized biopolymer cellulose-based heterogeneous acid catalyst for facile synthesis of functionalized pyrimido [4, 5-b] quinolines and indeno fused pyrido [2, 3-d] pyrimidines in water. Res. Chem. Intermed43 (2017) 2159-2174. [37] T. Ma L. Liu Q. Deng X. Lin Z. Yuan Increasing the H+ exchange capacity of porous titanium phosphonate materials by protecting defective P–OH groups Chem. Commun. 47 2011 6015 6017 T. Ma, L. Liu, Q. Deng, X. Lin, Z. Yuan, Increasing the H+ exchange capacity of porous titanium phosphonate materials by protecting defective P–OH groups, Chem. Commun.47 (2011) 6015-6017. [38] T. Ma Z. Yuan Functionalized periodic mesoporous titanium phosphonate monoliths with large ion exchange capacity Chem. Commun. 46 2010 2325 2327 T. Ma, Z. Yuan, Functionalized periodic mesoporous titanium phosphonate monoliths with large ion exchange capacity, Chem. Commun.46 (2010) 2325-2327 [39] B. Wu Z. Tong X. Yuan Synthesis, characterization and catalytic application of mesoporous molecular sieves SBA-15 functionalized with phosphoric acid J. Porous Mater. 19 2012 641 647 B. Wu, Z. Tong, X. Yuan, Synthesis, characterization and catalytic application of mesoporous molecular sieves SBA-15 functionalized with phosphoric acid, J. Porous Mater.19 (2012) 641–647. [40] A.S. Singh J.H. Advani A.V. Biradar Phosphonate functionalized carbon spheres as Brønsted acid catalysts for the valorization of bio-renewable α-pinene oxide to trans-carveol Dalton Trans. 49 2020 7210 7217 A.S. Singh, J.H. Advani, A.V. Biradar, Phosphonate functionalized carbon spheres as Brønsted acid catalysts for the valorization of bio-renewable α-pinene oxide to trans-carveol. Dalton Trans.49 (2020) 7210-7217. [41] G. Xu L. Wang M. Tao W. Zhang Phosphorous acid functionalized polyacrylonitrile fibers with a polarity tunable surface micro-environment for one-pot C–C and C–N bond formation reactions Green Chem. 19 2017 5818 5830 G. Xu, L. Wang, M. Tao, & W. Zhang, Phosphorous acid functionalized polyacrylonitrile fibers with a polarity tunable surface micro-environment for one-pot C–C and C–N bond formation reactions. Green Chem.19 (2017) 5818–5830. [42] X. Xie J. Shi Y. Pu Z. Wang L. Zhang J. Wang D. Wang Cellulose derived nitrogen and phosphorus co-doped carbon-based catalysts for catalytic reduction of p-nitrophenol J. Colloid Interface Sci. 571 2020 100 108 X. Xie, J. Shi, Y. Pu, Z. Wang, L. Zhang, J. Wang, & D. Wang, Cellulose derived nitrogen and phosphorus co-doped carbon-based catalysts for catalytic reduction of p-nitrophenol. J. Colloid Interface Sci.571 (2020) 100-108. [43] P. Krishnamachari R. Hashaikeh M. Tiner Modified cellulose morphologies and its composites; SEM and TEM analysis Micron 42 2011 751 761 P. Krishnamachari, R. Hashaikeh, & M. TinerModified cellulose morphologies and its composites; SEM and TEM analysis, Micron42 (2011) 751-761. [44] G. Xu M. Jin F. Wang Y. Kalkhajeh Q. Xiong L. Zhang Construction of a phosphate-rich polyacrylonitrile fiber surface microenvironment for efficient purification of crystal violet wastewater RSC Adv. 9 2019 37630 37641 G. Xu, M. Jin, F. Wang, Y. Kalkhajeh, Q. Xiong, L. Zhang, Construction of a phosphate-rich polyacrylonitrile fiber surface microenvironment for efficient purification of crystal violet wastewater. RSC Adv.9 (2019) 37630-37641. [45] U.P. Agarwal Analysis of cellulose and lignocellulose materials by Raman spectroscopy: a review of the current status Molecules 24 2019 1659 1677 U.P. Agarwal, Analysis of cellulose and lignocellulose materials by Raman spectroscopy: a review of the current status. Molecules24 (2019) 1659-1677. [46] U.P. Agarwal FT-Raman spectroscopy for investigations of plant cell walls and other biomass materials Front. Plant Sci. 5 2014 490 498 U.P. Agarwal, FT-Raman spectroscopy for investigations of plant cell walls and other biomass materials, Front. Plant Sci., 5 (2014) 490-498. [47] J. Belloque M. Fuente M. Ramos Qualitative and quantitative analysis of phosphorylated compounds in milk by means of 31P-NMR J. Dairy Sci. 67 2000 529 553 J. Belloque, M. Fuente, M. Ramos, Qualitative and quantitative analysis of phosphorylated compounds in milk by means of 31P-NMR, J. Dairy Sci.67 (2000) 529-53. [48] S. Raja P. Lin W. Liu J. Zhan X. Fu C. Lin Multidimensional (0D to 3D) alkaline-earth metal diphosphonates: Synthesis, structural diversity, and luminescence properties Inorg. Chem. 54 2015 4268 4278 S. Raja, P. Lin, W. Liu, J. Zhan, X. Fu, & C. Lin, Multidimensional (0D to 3D) alkaline-earth metal diphosphonates: Synthesis, structural diversity, and luminescence properties, Inorg. Chem.54 (2015) 4268-4278. [49] R.A. Sheldon H. Van Bekkum Fine Chemicals Through Heterogeneous Catalysis 2008 John Wiley & Sons R.A. Sheldon, H. Van Bekkum (Eds). Fine Chemicals Through Heterogeneous Catalysis, John Wiley & Sons (2008). [50] R. Zhao P Rupper S. Gaan Recent development in phosphonic acid-based organic coatings on aluminium Coatings 7 2017 133 138 R. Zhao, Rupper P, & Gaan S. (2017). Recent development in phosphonic acid-based organic coatings on aluminium, Coatings7:133-38. [51] F.José Delgado-Gómez V. Calvino-Casilda Cerpa-Naranjo Arisbel M.L. Rojas-Cervantes Alkaline-doped multiwall carbon nanotubes as efficient catalysts for the Knoevenagel condensation Mol. Catal. 443 2017 101 109 Delgado-Gómez, F. José, V. Calvino-Casilda, Arisbel, Cerpa-Naranjo, and M. L. Rojas-Cervantes, Alkaline-doped multiwall carbon nanotubes as efficient catalysts for the Knoevenagel condensation, Mol. Catal.443 (2017) 101-109. [52] Hu Li A. Riisager S Saravanamurugan A. Pandey R.S. Sangwan S. Yang R. Luque Carbon-increasing catalytic strategies for upgrading biomass into energy-intensive fuels and chemicals Acs Catal. 1 2018 148 187 Li, Hu, A. Riisager, S Saravanamurugan, A. Pandey, R. S. Sangwan, S. Yang, and R. Luque, Carbon-increasing catalytic strategies for upgrading biomass into energy-intensive fuels and chemicals, Acs Catal.1 (2018) 148-187. [53] R. Luque, D. Sudipta, and M. Alina Balu, Catalytic Conversion of Biomass, (2016) 148. [54] D.R. Naikwadi B.D. Bankar K. Ravi A.V. Biradar Efficient and recyclable solid acid-catalyzed alkylation of active methylene compound via oxonium intermediate for atom economical synthesis of organic compounds Res. Chem. Intermed. 47 2021 3691 3703 D. R.Naikwadi, B. D. Bankar, K. Ravi, A.V. Biradar, Efficient and recyclable solid acid-catalyzed alkylation of active methylene compound via oxonium intermediate for atom economical synthesis of organic compounds, Res. Chem. Intermed. (2021). inpresshttps://doi.org/10.1007/s11164-021-04499-3. [55] A. l. Hokayem El.R.Hage Karen L. Svecova B. Otazaghine N.L. Moigne R. Sonnier Flame retardant-functionalized cotton cellulose using phosphonate-based ionic liquids Molecules 25 2020 1629 1647 A. l. Hokayem, Karen, El. R. Hage, L. Svecova, B. Otazaghine, N. L. Moigne, and R. Sonnier. Flame retardant-functionalized cotton cellulose using phosphonate-based ionic liquids.\" Molecules25 (2020) 1629-47. [56] S. Bakshi C. Banik DA Laird R Smith R.C. Brown Enhancing biochar as scaffolding for slow release of Nitrogen Fertilizer ACS Sustain. Chem. Eng. 9 2021 8222 8231 S. Bakshi, C. Banik, DA Laird, R Smith, R. C. Brown. Enhancing biochar as scaffolding for slow release of Nitrogen Fertilizer.\" ACS Sustain. Chem. Eng.9 (2021) 8222-8231. [57] P.A. Son S. Nishimura K. Ebitani Reaction Kinetics Mechanisms and Catalysis 1 2012 185 192 P.A. Son, S. Nishimura, K. Ebitani, Reaction Kinetics, Mechanisms and Catalysis1 (2012) 185-192. [58] M. Cadenas R. Bringu´e C. Fit´e E. Ram´ırez F. Cunill Liquid-phase oligomerization of 1-hexene catalyzed by macroporous ion-exchange resins Top. Catal. 54 2011 998 1008 M. Cadenas, R. Bringu´e, C. Fit´e, E. Ram´ırez and F. Cunill, Liquid-phase oligomerization of 1-hexene catalyzed by macroporous ion-exchange resins, Top. Catal.54 (2011) 998–1008. [59] J. Jae G.A. Tompsett A.J. Foster K.D. Hammond S.M. Auerbach R.F. Lobo G.W. Huber Investigation into the shape selectivity of zeolite catalysts for biomass conversion J. Catal. 279 2011 257 268 J. Jae, G. A. Tompsett, A. J. Foster, K. D. Hammond,S. M. Auerbach, R. F. Lobo and G. W. Huber, Investigation into the shape selectivity of zeolite catalysts for biomass conversion, J. Catal.279 (2011) 257–268. [60] A. Boréave A. Auroux C. Guimon Nature and strength of acid sites in HY zeolites: a multitechnical approach Microporous Mater. 11 1997 275 291 A. Boréave, A. Auroux, C. Guimon, Nature and strength of acid sites in HY zeolites: a multitechnical approach, Microporous Mater.11 (1997) 275-291. [61] S. Russell Drago A. Jose´ Dias O. Thomas Maier An acidity scale for Brönsted acids including J. Am. Chem. Soc. 119 1997 7702 7710 S. Russell Drago, A. Jose´ Dias, O. Thomas Maier, An acidity scale for Brönsted acids including, J. Am. Chem. Soc.119, (1997) 7702-7710. [62] J. Safari S.H. Banitaba S.D. Khalili Cellulose sulfuric acid catalyzed multicomponent reaction for efficient synthesis of 1,4-dihydropyridines via unsymmetrical Hantzsch reaction in aqueous media J. Mol Catal A: Chem 335 2011 46 50 J. Safari, S. H. Banitaba, S.D. Khalili, Cellulose sulfuric acid catalyzed multicomponent reaction for efficient synthesis of 1,4-dihydropyridines via unsymmetrical Hantzsch reaction in aqueous media. J. Mol Catal A: Chem, 335 (2011) 46–50. [63] M. Satyendra A. Kumar J. Jaiswal G. Malik B. Kumar R. Chandra Development of Pd-Pt functionalized high performance H2 gas sensor based on silicon carbide coated porous silicon for extreme environment applications Sens. Actuators B Chem. 283 2019 373 383 M. Satyendra, A. Kumar, J. Jaiswal, G. Malik, B. Kumar, and R. Chandra. Development of Pd-Pt functionalized high performance H2 gas sensor based on silicon carbide coated porous silicon for extreme environment applications. Sens. Actuators B Chem.283 (2019) 373-383.",
      "scopus-id": "85115928064",
      "coredata": {
        "eid": "1-s2.0-S2468823121005290",
        "dc:description": "Cellulose is the most abundant organic source and has expedient a great deal of interest as renewable and emerged as sustainable feedstock. The functionalization of cellulose as designed catalytic system intriguing furnished to the production of fine chemicals. Herein, we synthesized an environmental friendly solid acid catalyst by functionalizing cellulose with phosphoric acid (PO3H). The successful functionalization of cellulose with PO3H was confirmed by 31P NMR, ICP-OES, FE-SEM, and XPS analysis. ICP-OES revealed the presence of phosphorus content of ∼1.0 wt. % on the catalyst's surface while elemental mapping by FESEM and XPS shows a uniform distribution of phosphorus over the material. The synthesized solid acid catalyst was utilized for condensation of diols with acetoacetic esters in solvent-free conditions to synthesize fine chemicals. The present approach not only circumvented the one-step protection and other products but more fascinatingly provided trans-esterification of acetoacetic esters with diols and n-alcohols. The catalyst was successfully used for chemoselective protection on ethyl acetoacetate with 1, 2 diols to essential fructone molecule with ∼100% conversion and 99% selectivity. The results suggested that the catalyst has the advantage over commercial solid acid heterogeneous and homogeneous catalysts.",
        "openArchiveArticle": "false",
        "prism:coverDate": "2021-10-31",
        "openaccessUserLicense": null,
        "prism:aggregationType": "Journal",
        "prism:url": "https://api.elsevier.com/content/article/pii/S2468823121005290",
        "dc:creator": [
          {
            "@_fa": "true",
            "$": "Naikwadi, Dhanaji R."
          },
          {
            "@_fa": "true",
            "$": "Singh, Amravati S."
          },
          {
            "@_fa": "true",
            "$": "Biradar, Ankush V."
          }
        ],
        "link": [
          {
            "@_fa": "true",
            "@rel": "self",
            "@href": "https://api.elsevier.com/content/article/pii/S2468823121005290"
          },
          {
            "@_fa": "true",
            "@rel": "scidir",
            "@href": "https://www.sciencedirect.com/science/article/pii/S2468823121005290"
          }
        ],
        "dc:format": "application/json",
        "openaccessType": null,
        "pii": "S2468-8231(21)00529-0",
        "prism:volume": "515",
        "articleNumber": "111912",
        "prism:publisher": "Elsevier B.V.",
        "dc:title": "Brønsted acidic cellulose-PO3H: An efficient catalyst for the chemoselective synthesis of fructones and trans-esterification via condensation of acetoacetic esters with alcohols and diols",
        "prism:copyright": "© 2021 Elsevier B.V. All rights reserved.",
        "openaccess": "0",
        "prism:issn": "24688231",
        "dcterms:subject": [
          {
            "@_fa": "true",
            "$": "Cellulose"
          },
          {
            "@_fa": "true",
            "$": "Acetoacetic ester"
          },
          {
            "@_fa": "true",
            "$": "Protection"
          },
          {
            "@_fa": "true",
            "$": "Trans-esterification"
          },
          {
            "@_fa": "true",
            "$": "Fine chemicals"
          }
        ],
        "openaccessArticle": "false",
        "prism:publicationName": "Molecular Catalysis",
        "openaccessSponsorType": null,
        "prism:pageRange": "111912",
        "pubType": "fla",
        "prism:coverDisplayDate": "October 2021",
        "prism:doi": "10.1016/j.mcat.2021.111912",
        "prism:startingPage": "111912",
        "dc:identifier": "doi:10.1016/j.mcat.2021.111912",
        "openaccessSponsorName": null
      },
      "objects": {
        "object": [
          {
            "@category": "standard",
            "@height": "154",
            "@width": "622",
            "@_fa": "true",
            "$": "https://api.elsevier.com/content/object/eid/1-s2.0-S2468823121005290-sc3.jpg?httpAccept=%2A%2F%2A",
            "@multimediatype": "JPEG image file",
            "@type": "IMAGE-DOWNSAMPLED",
            "@size": "33187",
            "@ref": "sc3",
            "@mimetype": "image/jpeg"
          },
          {
            "@category": "standard",
            "@height": "56",
            "@width": "68",
            "@_fa": "true",
            "$": "https://api.elsevier.com/content/object/eid/1-s2.0-S2468823121005290-fx5.jpg?httpAccept=%2A%2F%2A",
            "@multimediatype": "JPEG image file",
            "@type": "IMAGE-DOWNSAMPLED",
            "@size": "4935",
            "@ref": "fx5",
            "@mimetype": "image/jpeg"
          },
          {
            "@category": "standard",
            "@height": "228",
            "@width": "659",
            "@_fa": "true",
            "$": "https://api.elsevier.com/content/object/eid/1-s2.0-S2468823121005290-sc2.jpg?httpAccept=%2A%2F%2A",
            "@multimediatype": "JPEG image file",
            "@type": "IMAGE-DOWNSAMPLED",
            "@size": "39469",
            "@ref": "sc2",
            "@mimetype": "image/jpeg"
          },
          {
            "@category": "standard",
            "@height": "68",
            "@width": "101",
            "@_fa": "true",
            "$": "https://api.elsevier.com/content/object/eid/1-s2.0-S2468823121005290-fx4.jpg?httpAccept=%2A%2F%2A",
            "@multimediatype": "JPEG image file",
            "@type": "IMAGE-DOWNSAMPLED",
            "@size": "5795",
            "@ref": "fx4",
            "@mimetype": "image/jpeg"
          },
          {
            "@category": "standard",
            "@height": "217",
            "@width": "659",
            "@_fa": "true",
            "$": "https://api.elsevier.com/content/object/eid/1-s2.0-S2468823121005290-sc1.jpg?httpAccept=%2A%2F%2A",
            "@multimediatype": "JPEG image file",
            "@type": "IMAGE-DOWNSAMPLED",
            "@size": "47039",
            "@ref": "sc1",
            "@mimetype": "image/jpeg"
          },
          {
            "@category": "standard",
            "@height": "44",
            "@width": "78",
            "@_fa": "true",
            "$": "https://api.elsevier.com/content/object/eid/1-s2.0-S2468823121005290-fx3.jpg?httpAccept=%2A%2F%2A",
            "@multimediatype": "JPEG image file",
            "@type": "IMAGE-DOWNSAMPLED",
            "@size": "5021",
            "@ref": "fx3",
            "@mimetype": "image/jpeg"
          },
          {
            "@category": "standard",
            "@height": "34",
            "@width": "78",
            "@_fa": "true",
            "$": "https://api.elsevier.com/content/object/eid/1-s2.0-S2468823121005290-fx21.jpg?httpAccept=%2A%2F%2A",
            "@multimediatype": "JPEG image file",
            "@type": "IMAGE-DOWNSAMPLED",
            "@size": "4538",
            "@ref": "fx21",
            "@mimetype": "image/jpeg"
          },
          {
            "@category": "standard",
            "@height": "34",
            "@width": "78",
            "@_fa": "true",
            "$": "https://api.elsevier.com/content/object/eid/1-s2.0-S2468823121005290-fx2.jpg?httpAccept=%2A%2F%2A",
            "@multimediatype": "JPEG image file",
            "@type": "IMAGE-DOWNSAMPLED",
            "@size": "4603",
            "@ref": "fx2",
            "@mimetype": "image/jpeg"
          },
          {
            "@category": "standard",
            "@height": "34",
            "@width": "101",
            "@_fa": "true",
            "$": "https://api.elsevier.com/content/object/eid/1-s2.0-S2468823121005290-fx20.jpg?httpAccept=%2A%2F%2A",
            "@multimediatype": "JPEG image file",
            "@type": "IMAGE-DOWNSAMPLED",
            "@size": "4662",
            "@ref": "fx20",
            "@mimetype": "image/jpeg"
          },
          {
            "@category": "standard",
            "@height": "276",
            "@width": "715",
            "@_fa": "true",
            "$": "https://api.elsevier.com/content/object/eid/1-s2.0-S2468823121005290-gr2.jpg?httpAccept=%2A%2F%2A",
            "@multimediatype": "JPEG image file",
            "@type": "IMAGE-DOWNSAMPLED",
            "@size": "86884",
            "@ref": "gr2",
            "@mimetype": "image/jpeg"
          },
          {
            "@category": "standard",
            "@height": "68",
            "@width": "90",
            "@_fa": "true",
            "$": "https://api.elsevier.com/content/object/eid/1-s2.0-S2468823121005290-fx9.jpg?httpAccept=%2A%2F%2A",
            "@multimediatype": "JPEG image file",
            "@type": "IMAGE-DOWNSAMPLED",
            "@size": "5139",
            "@ref": "fx9",
            "@mimetype": "image/jpeg"
          },
          {
            "@category": "standard",
            "@height": "204",
            "@width": "715",
            "@_fa": "true",
            "$": "https://api.elsevier.com/content/object/eid/1-s2.0-S2468823121005290-gr1.jpg?httpAccept=%2A%2F%2A",
            "@multimediatype": "JPEG image file",
            "@type": "IMAGE-DOWNSAMPLED",
            "@size": "58996",
            "@ref": "gr1",
            "@mimetype": "image/jpeg"
          },
          {
            "@category": "standard",
            "@height": "68",
            "@width": "90",
            "@_fa": "true",
            "$": "https://api.elsevier.com/content/object/eid/1-s2.0-S2468823121005290-fx8.jpg?httpAccept=%2A%2F%2A",
            "@multimediatype": "JPEG image file",
            "@type": "IMAGE-DOWNSAMPLED",
            "@size": "5337",
            "@ref": "fx8",
            "@mimetype": "image/jpeg"
          },
          {
            "@category": "standard",
            "@height": "497",
            "@width": "621",
            "@_fa": "true",
            "$": "https://api.elsevier.com/content/object/eid/1-s2.0-S2468823121005290-sc5.jpg?httpAccept=%2A%2F%2A",
            "@multimediatype": "JPEG image file",
            "@type": "IMAGE-DOWNSAMPLED",
            "@size": "79617",
            "@ref": "sc5",
            "@mimetype": "image/jpeg"
          },
          {
            "@category": "standard",
            "@height": "39",
            "@width": "89",
            "@_fa": "true",
            "$": "https://api.elsevier.com/content/object/eid/1-s2.0-S2468823121005290-fx7.jpg?httpAccept=%2A%2F%2A",
            "@multimediatype": "JPEG image file",
            "@type": "IMAGE-DOWNSAMPLED",
            "@size": "4750",
            "@ref": "fx7",
            "@mimetype": "image/jpeg"
          },
          {
            "@category": "standard",
            "@height": "225",
            "@width": "622",
            "@_fa": "true",
            "$": "https://api.elsevier.com/content/object/eid/1-s2.0-S2468823121005290-sc4.jpg?httpAccept=%2A%2F%2A",
            "@multimediatype": "JPEG image file",
            "@type": "IMAGE-DOWNSAMPLED",
            "@size": "38415",
            "@ref": "sc4",
            "@mimetype": "image/jpeg"
          },
          {
            "@category": "standard",
            "@height": "43",
            "@width": "104",
            "@_fa": "true",
            "$": "https://api.elsevier.com/content/object/eid/1-s2.0-S2468823121005290-fx6.jpg?httpAccept=%2A%2F%2A",
            "@multimediatype": "JPEG image file",
            "@type": "IMAGE-DOWNSAMPLED",
            "@size": "4759",
            "@ref": "fx6",
            "@mimetype": "image/jpeg"
          },
          {
            "@category": "standard",
            "@height": "128",
            "@width": "301",
            "@_fa": "true",
            "$": "https://api.elsevier.com/content/object/eid/1-s2.0-S2468823121005290-ga1.jpg?httpAccept=%2A%2F%2A",
            "@multimediatype": "JPEG image file",
            "@type": "IMAGE-DOWNSAMPLED",
            "@size": "26172",
            "@ref": "ga1",
            "@mimetype": "image/jpeg"
          },
          {
            "@category": "standard",
            "@height": "34",
            "@width": "90",
            "@_fa": "true",
            "$": "https://api.elsevier.com/content/object/eid/1-s2.0-S2468823121005290-fx19.jpg?httpAccept=%2A%2F%2A",
            "@multimediatype": "JPEG image file",
            "@type": "IMAGE-DOWNSAMPLED",
            "@size": "4567",
            "@ref": "fx19",
            "@mimetype": "image/jpeg"
          },
          {
            "@category": "standard",
            "@height": "22",
            "@width": "90",
            "@_fa": "true",
            "$": "https://api.elsevier.com/content/object/eid/1-s2.0-S2468823121005290-fx18.jpg?httpAccept=%2A%2F%2A",
            "@multimediatype": "JPEG image file",
            "@type": "IMAGE-DOWNSAMPLED",
            "@size": "4479",
            "@ref": "fx18",
            "@mimetype": "image/jpeg"
          },
          {
            "@category": "standard",
            "@height": "44",
            "@width": "90",
            "@_fa": "true",
            "$": "https://api.elsevier.com/content/object/eid/1-s2.0-S2468823121005290-fx17.jpg?httpAccept=%2A%2F%2A",
            "@multimediatype": "JPEG image file",
            "@type": "IMAGE-DOWNSAMPLED",
            "@size": "4626",
            "@ref": "fx17",
            "@mimetype": "image/jpeg"
          },
          {
            "@category": "standard",
            "@height": "45",
            "@width": "101",
            "@_fa": "true",
            "$": "https://api.elsevier.com/content/object/eid/1-s2.0-S2468823121005290-fx12.jpg?httpAccept=%2A%2F%2A",
            "@multimediatype": "JPEG image file",
            "@type": "IMAGE-DOWNSAMPLED",
            "@size": "5139",
            "@ref": "fx12",
            "@mimetype": "image/jpeg"
          },
          {
            "@category": "standard",
            "@height": "45",
            "@width": "101",
            "@_fa": "true",
            "$": "https://api.elsevier.com/content/object/eid/1-s2.0-S2468823121005290-fx11.jpg?httpAccept=%2A%2F%2A",
            "@multimediatype": "JPEG image file",
            "@type": "IMAGE-DOWNSAMPLED",
            "@size": "5115",
            "@ref": "fx11",
            "@mimetype": "image/jpeg"
          },
          {
            "@category": "standard",
            "@height": "45",
            "@width": "113",
            "@_fa": "true",
            "$": "https://api.elsevier.com/content/object/eid/1-s2.0-S2468823121005290-fx10.jpg?httpAccept=%2A%2F%2A",
            "@multimediatype": "JPEG image file",
            "@type": "IMAGE-DOWNSAMPLED",
            "@size": "5158",
            "@ref": "fx10",
            "@mimetype": "image/jpeg"
          },
          {
            "@category": "standard",
            "@height": "45",
            "@width": "101",
            "@_fa": "true",
            "$": "https://api.elsevier.com/content/object/eid/1-s2.0-S2468823121005290-fx16.jpg?httpAccept=%2A%2F%2A",
            "@multimediatype": "JPEG image file",
            "@type": "IMAGE-DOWNSAMPLED",
            "@size": "4947",
            "@ref": "fx16",
            "@mimetype": "image/jpeg"
          },
          {
            "@category": "standard",
            "@height": "45",
            "@width": "101",
            "@_fa": "true",
            "$": "https://api.elsevier.com/content/object/eid/1-s2.0-S2468823121005290-fx15.jpg?httpAccept=%2A%2F%2A",
            "@multimediatype": "JPEG image file",
            "@type": "IMAGE-DOWNSAMPLED",
            "@size": "5270",
            "@ref": "fx15",
            "@mimetype": "image/jpeg"
          },
          {
            "@category": "standard",
            "@height": "68",
            "@width": "90",
            "@_fa": "true",
            "$": "https://api.elsevier.com/content/object/eid/1-s2.0-S2468823121005290-fx14.jpg?httpAccept=%2A%2F%2A",
            "@multimediatype": "JPEG image file",
            "@type": "IMAGE-DOWNSAMPLED",
            "@size": "5816",
            "@ref": "fx14",
            "@mimetype": "image/jpeg"
          },
          {
            "@category": "standard",
            "@height": "78",
            "@width": "78",
            "@_fa": "true",
            "$": "https://api.elsevier.com/content/object/eid/1-s2.0-S2468823121005290-fx13.jpg?httpAccept=%2A%2F%2A",
            "@multimediatype": "JPEG image file",
            "@type": "IMAGE-DOWNSAMPLED",
            "@size": "5605",
            "@ref": "fx13",
            "@mimetype": "image/jpeg"
          },
          {
            "@category": "standard",
            "@height": "401",
            "@width": "527",
            "@_fa": "true",
            "$": "https://api.elsevier.com/content/object/eid/1-s2.0-S2468823121005290-gr5.jpg?httpAccept=%2A%2F%2A",
            "@multimediatype": "JPEG image file",
            "@type": "IMAGE-DOWNSAMPLED",
            "@size": "47656",
            "@ref": "gr5",
            "@mimetype": "image/jpeg"
          },
          {
            "@category": "standard",
            "@height": "545",
            "@width": "659",
            "@_fa": "true",
            "$": "https://api.elsevier.com/content/object/eid/1-s2.0-S2468823121005290-gr4.jpg?httpAccept=%2A%2F%2A",
            "@multimediatype": "JPEG image file",
            "@type": "IMAGE-DOWNSAMPLED",
            "@size": "168890",
            "@ref": "gr4",
            "@mimetype": "image/jpeg"
          },
          {
            "@category": "standard",
            "@height": "553",
            "@width": "659",
            "@_fa": "true",
            "$": "https://api.elsevier.com/content/object/eid/1-s2.0-S2468823121005290-gr3.jpg?httpAccept=%2A%2F%2A",
            "@multimediatype": "JPEG image file",
            "@type": "IMAGE-DOWNSAMPLED",
            "@size": "83727",
            "@ref": "gr3",
            "@mimetype": "image/jpeg"
          },
          {
            "@category": "thumbnail",
            "@height": "54",
            "@width": "219",
            "@_fa": "true",
            "$": "https://api.elsevier.com/content/object/eid/1-s2.0-S2468823121005290-sc3.sml?httpAccept=%2A%2F%2A",
            "@multimediatype": "GIF image file",
            "@type": "IMAGE-THUMBNAIL",
            "@size": "5255",
            "@ref": "sc3",
            "@mimetype": "image/gif"
          },
          {
            "@category": "thumbnail",
            "@height": "164",
            "@width": "198",
            "@_fa": "true",
            "$": "https://api.elsevier.com/content/object/eid/1-s2.0-S2468823121005290-fx5.sml?httpAccept=%2A%2F%2A",
            "@multimediatype": "GIF image file",
            "@type": "IMAGE-THUMBNAIL",
            "@size": "7656",
            "@ref": "fx5",
            "@mimetype": "image/gif"
          },
          {
            "@category": "thumbnail",
            "@height": "76",
            "@width": "219",
            "@_fa": "true",
            "$": "https://api.elsevier.com/content/object/eid/1-s2.0-S2468823121005290-sc2.sml?httpAccept=%2A%2F%2A",
            "@multimediatype": "GIF image file",
            "@type": "IMAGE-THUMBNAIL",
            "@size": "5551",
            "@ref": "sc2",
            "@mimetype": "image/gif"
          },
          {
            "@category": "thumbnail",
            "@height": "148",
            "@width": "219",
            "@_fa": "true",
            "$": "https://api.elsevier.com/content/object/eid/1-s2.0-S2468823121005290-fx4.sml?httpAccept=%2A%2F%2A",
            "@multimediatype": "GIF image file",
            "@type": "IMAGE-THUMBNAIL",
            "@size": "6566",
            "@ref": "fx4",
            "@mimetype": "image/gif"
          },
          {
            "@category": "thumbnail",
            "@height": "72",
            "@width": "219",
            "@_fa": "true",
            "$": "https://api.elsevier.com/content/object/eid/1-s2.0-S2468823121005290-sc1.sml?httpAccept=%2A%2F%2A",
            "@multimediatype": "GIF image file",
            "@type": "IMAGE-THUMBNAIL",
            "@size": "10336",
            "@ref": "sc1",
            "@mimetype": "image/gif"
          },
          {
            "@category": "thumbnail",
            "@height": "125",
            "@width": "219",
            "@_fa": "true",
            "$": "https://api.elsevier.com/content/object/eid/1-s2.0-S2468823121005290-fx3.sml?httpAccept=%2A%2F%2A",
            "@multimediatype": "GIF image file",
            "@type": "IMAGE-THUMBNAIL",
            "@size": "7317",
            "@ref": "fx3",
            "@mimetype": "image/gif"
          },
          {
            "@category": "thumbnail",
            "@height": "95",
            "@width": "219",
            "@_fa": "true",
            "$": "https://api.elsevier.com/content/object/eid/1-s2.0-S2468823121005290-fx21.sml?httpAccept=%2A%2F%2A",
            "@multimediatype": "GIF image file",
            "@type": "IMAGE-THUMBNAIL",
            "@size": "6257",
            "@ref": "fx21",
            "@mimetype": "image/gif"
          },
          {
            "@category": "thumbnail",
            "@height": "95",
            "@width": "219",
            "@_fa": "true",
            "$": "https://api.elsevier.com/content/object/eid/1-s2.0-S2468823121005290-fx2.sml?httpAccept=%2A%2F%2A",
            "@multimediatype": "GIF image file",
            "@type": "IMAGE-THUMBNAIL",
            "@size": "6814",
            "@ref": "fx2",
            "@mimetype": "image/gif"
          },
          {
            "@category": "thumbnail",
            "@height": "74",
            "@width": "219",
            "@_fa": "true",
            "$": "https://api.elsevier.com/content/object/eid/1-s2.0-S2468823121005290-fx20.sml?httpAccept=%2A%2F%2A",
            "@multimediatype": "GIF image file",
            "@type": "IMAGE-THUMBNAIL",
            "@size": "4973",
            "@ref": "fx20",
            "@mimetype": "image/gif"
          },
          {
            "@category": "thumbnail",
            "@height": "85",
            "@width": "219",
            "@_fa": "true",
            "$": "https://api.elsevier.com/content/object/eid/1-s2.0-S2468823121005290-gr2.sml?httpAccept=%2A%2F%2A",
            "@multimediatype": "GIF image file",
            "@type": "IMAGE-THUMBNAIL",
            "@size": "15114",
            "@ref": "gr2",
            "@mimetype": "image/gif"
          },
          {
            "@category": "thumbnail",
            "@height": "164",
            "@width": "218",
            "@_fa": "true",
            "$": "https://api.elsevier.com/content/object/eid/1-s2.0-S2468823121005290-fx9.sml?httpAccept=%2A%2F%2A",
            "@multimediatype": "GIF image file",
            "@type": "IMAGE-THUMBNAIL",
            "@size": "6678",
            "@ref": "fx9",
            "@mimetype": "image/gif"
          },
          {
            "@category": "thumbnail",
            "@height": "63",
            "@width": "219",
            "@_fa": "true",
            "$": "https://api.elsevier.com/content/object/eid/1-s2.0-S2468823121005290-gr1.sml?httpAccept=%2A%2F%2A",
            "@multimediatype": "GIF image file",
            "@type": "IMAGE-THUMBNAIL",
            "@size": "8160",
            "@ref": "gr1",
            "@mimetype": "image/gif"
          },
          {
            "@category": "thumbnail",
            "@height": "164",
            "@width": "218",
            "@_fa": "true",
            "$": "https://api.elsevier.com/content/object/eid/1-s2.0-S2468823121005290-fx8.sml?httpAccept=%2A%2F%2A",
            "@multimediatype": "GIF image file",
            "@type": "IMAGE-THUMBNAIL",
            "@size": "6799",
            "@ref": "fx8",
            "@mimetype": "image/gif"
          },
          {
            "@category": "thumbnail",
            "@height": "164",
            "@width": "205",
            "@_fa": "true",
            "$": "https://api.elsevier.com/content/object/eid/1-s2.0-S2468823121005290-sc5.sml?httpAccept=%2A%2F%2A",
            "@multimediatype": "GIF image file",
            "@type": "IMAGE-THUMBNAIL",
            "@size": "12516",
            "@ref": "sc5",
            "@mimetype": "image/gif"
          },
          {
            "@category": "thumbnail",
            "@height": "96",
            "@width": "219",
            "@_fa": "true",
            "$": "https://api.elsevier.com/content/object/eid/1-s2.0-S2468823121005290-fx7.sml?httpAccept=%2A%2F%2A",
            "@multimediatype": "GIF image file",
            "@type": "IMAGE-THUMBNAIL",
            "@size": "6394",
            "@ref": "fx7",
            "@mimetype": "image/gif"
          },
          {
            "@category": "thumbnail",
            "@height": "79",
            "@width": "219",
            "@_fa": "true",
            "$": "https://api.elsevier.com/content/object/eid/1-s2.0-S2468823121005290-sc4.sml?httpAccept=%2A%2F%2A",
            "@multimediatype": "GIF image file",
            "@type": "IMAGE-THUMBNAIL",
            "@size": "6406",
            "@ref": "sc4",
            "@mimetype": "image/gif"
          },
          {
            "@category": "thumbnail",
            "@height": "91",
            "@width": "219",
            "@_fa": "true",
            "$": "https://api.elsevier.com/content/object/eid/1-s2.0-S2468823121005290-fx6.sml?httpAccept=%2A%2F%2A",
            "@multimediatype": "GIF image file",
            "@type": "IMAGE-THUMBNAIL",
            "@size": "5654",
            "@ref": "fx6",
            "@mimetype": "image/gif"
          },
          {
            "@category": "thumbnail",
            "@height": "93",
            "@width": "219",
            "@_fa": "true",
            "$": "https://api.elsevier.com/content/object/eid/1-s2.0-S2468823121005290-ga1.sml?httpAccept=%2A%2F%2A",
            "@multimediatype": "GIF image file",
            "@type": "IMAGE-THUMBNAIL",
            "@size": "14998",
            "@ref": "ga1",
            "@mimetype": "image/gif"
          },
          {
            "@category": "thumbnail",
            "@height": "82",
            "@width": "219",
            "@_fa": "true",
            "$": "https://api.elsevier.com/content/object/eid/1-s2.0-S2468823121005290-fx19.sml?httpAccept=%2A%2F%2A",
            "@multimediatype": "GIF image file",
            "@type": "IMAGE-THUMBNAIL",
            "@size": "5303",
            "@ref": "fx19",
            "@mimetype": "image/gif"
          },
          {
            "@category": "thumbnail",
            "@height": "54",
            "@width": "219",
            "@_fa": "true",
            "$": "https://api.elsevier.com/content/object/eid/1-s2.0-S2468823121005290-fx18.sml?httpAccept=%2A%2F%2A",
            "@multimediatype": "GIF image file",
            "@type": "IMAGE-THUMBNAIL",
            "@size": "5132",
            "@ref": "fx18",
            "@mimetype": "image/gif"
          },
          {
            "@category": "thumbnail",
            "@height": "108",
            "@width": "219",
            "@_fa": "true",
            "$": "https://api.elsevier.com/content/object/eid/1-s2.0-S2468823121005290-fx17.sml?httpAccept=%2A%2F%2A",
            "@multimediatype": "GIF image file",
            "@type": "IMAGE-THUMBNAIL",
            "@size": "5914",
            "@ref": "fx17",
            "@mimetype": "image/gif"
          },
          {
            "@category": "thumbnail",
            "@height": "97",
            "@width": "219",
            "@_fa": "true",
            "$": "https://api.elsevier.com/content/object/eid/1-s2.0-S2468823121005290-fx12.sml?httpAccept=%2A%2F%2A",
            "@multimediatype": "GIF image file",
            "@type": "IMAGE-THUMBNAIL",
            "@size": "5349",
            "@ref": "fx12",
            "@mimetype": "image/gif"
          },
          {
            "@category": "thumbnail",
            "@height": "97",
            "@width": "219",
            "@_fa": "true",
            "$": "https://api.elsevier.com/content/object/eid/1-s2.0-S2468823121005290-fx11.sml?httpAccept=%2A%2F%2A",
            "@multimediatype": "GIF image file",
            "@type": "IMAGE-THUMBNAIL",
            "@size": "5684",
            "@ref": "fx11",
            "@mimetype": "image/gif"
          },
          {
            "@category": "thumbnail",
            "@height": "87",
            "@width": "219",
            "@_fa": "true",
            "$": "https://api.elsevier.com/content/object/eid/1-s2.0-S2468823121005290-fx10.sml?httpAccept=%2A%2F%2A",
            "@multimediatype": "GIF image file",
            "@type": "IMAGE-THUMBNAIL",
            "@size": "5355",
            "@ref": "fx10",
            "@mimetype": "image/gif"
          },
          {
            "@category": "thumbnail",
            "@height": "97",
            "@width": "219",
            "@_fa": "true",
            "$": "https://api.elsevier.com/content/object/eid/1-s2.0-S2468823121005290-fx16.sml?httpAccept=%2A%2F%2A",
            "@multimediatype": "GIF image file",
            "@type": "IMAGE-THUMBNAIL",
            "@size": "5651",
            "@ref": "fx16",
            "@mimetype": "image/gif"
          },
          {
            "@category": "thumbnail",
            "@height": "97",
            "@width": "219",
            "@_fa": "true",
            "$": "https://api.elsevier.com/content/object/eid/1-s2.0-S2468823121005290-fx15.sml?httpAccept=%2A%2F%2A",
            "@multimediatype": "GIF image file",
            "@type": "IMAGE-THUMBNAIL",
            "@size": "5874",
            "@ref": "fx15",
            "@mimetype": "image/gif"
          },
          {
            "@category": "thumbnail",
            "@height": "164",
            "@width": "217",
            "@_fa": "true",
            "$": "https://api.elsevier.com/content/object/eid/1-s2.0-S2468823121005290-fx14.sml?httpAccept=%2A%2F%2A",
            "@multimediatype": "GIF image file",
            "@type": "IMAGE-THUMBNAIL",
            "@size": "7985",
            "@ref": "fx14",
            "@mimetype": "image/gif"
          },
          {
            "@category": "thumbnail",
            "@height": "164",
            "@width": "164",
            "@_fa": "true",
            "$": "https://api.elsevier.com/content/object/eid/1-s2.0-S2468823121005290-fx13.sml?httpAccept=%2A%2F%2A",
            "@multimediatype": "GIF image file",
            "@type": "IMAGE-THUMBNAIL",
            "@size": "6554",
            "@ref": "fx13",
            "@mimetype": "image/gif"
          },
          {
            "@category": "thumbnail",
            "@height": "164",
            "@width": "216",
            "@_fa": "true",
            "$": "https://api.elsevier.com/content/object/eid/1-s2.0-S2468823121005290-gr5.sml?httpAccept=%2A%2F%2A",
            "@multimediatype": "GIF image file",
            "@type": "IMAGE-THUMBNAIL",
            "@size": "15956",
            "@ref": "gr5",
            "@mimetype": "image/gif"
          },
          {
            "@category": "thumbnail",
            "@height": "164",
            "@width": "198",
            "@_fa": "true",
            "$": "https://api.elsevier.com/content/object/eid/1-s2.0-S2468823121005290-gr4.sml?httpAccept=%2A%2F%2A",
            "@multimediatype": "GIF image file",
            "@type": "IMAGE-THUMBNAIL",
            "@size": "20530",
            "@ref": "gr4",
            "@mimetype": "image/gif"
          },
          {
            "@category": "thumbnail",
            "@height": "164",
            "@width": "195",
            "@_fa": "true",
            "$": "https://api.elsevier.com/content/object/eid/1-s2.0-S2468823121005290-gr3.sml?httpAccept=%2A%2F%2A",
            "@multimediatype": "GIF image file",
            "@type": "IMAGE-THUMBNAIL",
            "@size": "11700",
            "@ref": "gr3",
            "@mimetype": "image/gif"
          },
          {
            "@category": "high",
            "@height": "682",
            "@width": "2754",
            "@_fa": "true",
            "$": "https://api.elsevier.com/content/object/eid/1-s2.0-S2468823121005290-sc3_lrg.jpg?httpAccept=%2A%2F%2A",
            "@multimediatype": "JPEG image file",
            "@type": "IMAGE-HIGH-RES",
            "@size": "220743",
            "@ref": "sc3",
            "@mimetype": "image/jpeg"
          },
          {
            "@category": "high",
            "@height": "250",
            "@width": "302",
            "@_fa": "true",
            "$": "https://api.elsevier.com/content/object/eid/1-s2.0-S2468823121005290-fx5_lrg.jpg?httpAccept=%2A%2F%2A",
            "@multimediatype": "JPEG image file",
            "@type": "IMAGE-HIGH-RES",
            "@size": "16125",
            "@ref": "fx5",
            "@mimetype": "image/jpeg"
          },
          {
            "@category": "high",
            "@height": "1010",
            "@width": "2920",
            "@_fa": "true",
            "$": "https://api.elsevier.com/content/object/eid/1-s2.0-S2468823121005290-sc2_lrg.jpg?httpAccept=%2A%2F%2A",
            "@multimediatype": "JPEG image file",
            "@type": "IMAGE-HIGH-RES",
            "@size": "282199",
            "@ref": "sc2",
            "@mimetype": "image/jpeg"
          },
          {
            "@category": "high",
            "@height": "303",
            "@width": "448",
            "@_fa": "true",
            "$": "https://api.elsevier.com/content/object/eid/1-s2.0-S2468823121005290-fx4_lrg.jpg?httpAccept=%2A%2F%2A",
            "@multimediatype": "JPEG image file",
            "@type": "IMAGE-HIGH-RES",
            "@size": "22364",
            "@ref": "fx4",
            "@mimetype": "image/jpeg"
          },
          {
            "@category": "high",
            "@height": "961",
            "@width": "2917",
            "@_fa": "true",
            "$": "https://api.elsevier.com/content/object/eid/1-s2.0-S2468823121005290-sc1_lrg.jpg?httpAccept=%2A%2F%2A",
            "@multimediatype": "JPEG image file",
            "@type": "IMAGE-HIGH-RES",
            "@size": "395149",
            "@ref": "sc1",
            "@mimetype": "image/jpeg"
          },
          {
            "@category": "high",
            "@height": "199",
            "@width": "349",
            "@_fa": "true",
            "$": "https://api.elsevier.com/content/object/eid/1-s2.0-S2468823121005290-fx3_lrg.jpg?httpAccept=%2A%2F%2A",
            "@multimediatype": "JPEG image file",
            "@type": "IMAGE-HIGH-RES",
            "@size": "16479",
            "@ref": "fx3",
            "@mimetype": "image/jpeg"
          },
          {
            "@category": "high",
            "@height": "151",
            "@width": "348",
            "@_fa": "true",
            "$": "https://api.elsevier.com/content/object/eid/1-s2.0-S2468823121005290-fx21_lrg.jpg?httpAccept=%2A%2F%2A",
            "@multimediatype": "JPEG image file",
            "@type": "IMAGE-HIGH-RES",
            "@size": "12561",
            "@ref": "fx21",
            "@mimetype": "image/jpeg"
          },
          {
            "@category": "high",
            "@height": "151",
            "@width": "349",
            "@_fa": "true",
            "$": "https://api.elsevier.com/content/object/eid/1-s2.0-S2468823121005290-fx2_lrg.jpg?httpAccept=%2A%2F%2A",
            "@multimediatype": "JPEG image file",
            "@type": "IMAGE-HIGH-RES",
            "@size": "14445",
            "@ref": "fx2",
            "@mimetype": "image/jpeg"
          },
          {
            "@category": "high",
            "@height": "151",
            "@width": "448",
            "@_fa": "true",
            "$": "https://api.elsevier.com/content/object/eid/1-s2.0-S2468823121005290-fx20_lrg.jpg?httpAccept=%2A%2F%2A",
            "@multimediatype": "JPEG image file",
            "@type": "IMAGE-HIGH-RES",
            "@size": "13629",
            "@ref": "fx20",
            "@mimetype": "image/jpeg"
          },
          {
            "@category": "high",
            "@height": "1223",
            "@width": "3167",
            "@_fa": "true",
            "$": "https://api.elsevier.com/content/object/eid/1-s2.0-S2468823121005290-gr2_lrg.jpg?httpAccept=%2A%2F%2A",
            "@multimediatype": "JPEG image file",
            "@type": "IMAGE-HIGH-RES",
            "@size": "952830",
            "@ref": "gr2",
            "@mimetype": "image/jpeg"
          },
          {
            "@category": "high",
            "@height": "302",
            "@width": "401",
            "@_fa": "true",
            "$": "https://api.elsevier.com/content/object/eid/1-s2.0-S2468823121005290-fx9_lrg.jpg?httpAccept=%2A%2F%2A",
            "@multimediatype": "JPEG image file",
            "@type": "IMAGE-HIGH-RES",
            "@size": "19016",
            "@ref": "fx9",
            "@mimetype": "image/jpeg"
          },
          {
            "@category": "high",
            "@height": "904",
            "@width": "3166",
            "@_fa": "true",
            "$": "https://api.elsevier.com/content/object/eid/1-s2.0-S2468823121005290-gr1_lrg.jpg?httpAccept=%2A%2F%2A",
            "@multimediatype": "JPEG image file",
            "@type": "IMAGE-HIGH-RES",
            "@size": "389160",
            "@ref": "gr1",
            "@mimetype": "image/jpeg"
          },
          {
            "@category": "high",
            "@height": "302",
            "@width": "402",
            "@_fa": "true",
            "$": "https://api.elsevier.com/content/object/eid/1-s2.0-S2468823121005290-fx8_lrg.jpg?httpAccept=%2A%2F%2A",
            "@multimediatype": "JPEG image file",
            "@type": "IMAGE-HIGH-RES",
            "@size": "19299",
            "@ref": "fx8",
            "@mimetype": "image/jpeg"
          },
          {
            "@category": "high",
            "@height": "2201",
            "@width": "2750",
            "@_fa": "true",
            "$": "https://api.elsevier.com/content/object/eid/1-s2.0-S2468823121005290-sc5_lrg.jpg?httpAccept=%2A%2F%2A",
            "@multimediatype": "JPEG image file",
            "@type": "IMAGE-HIGH-RES",
            "@size": "571478",
            "@ref": "sc5",
            "@mimetype": "image/jpeg"
          },
          {
            "@category": "high",
            "@height": "174",
            "@width": "395",
            "@_fa": "true",
            "$": "https://api.elsevier.com/content/object/eid/1-s2.0-S2468823121005290-fx7_lrg.jpg?httpAccept=%2A%2F%2A",
            "@multimediatype": "JPEG image file",
            "@type": "IMAGE-HIGH-RES",
            "@size": "15654",
            "@ref": "fx7",
            "@mimetype": "image/jpeg"
          },
          {
            "@category": "high",
            "@height": "997",
            "@width": "2753",
            "@_fa": "true",
            "$": "https://api.elsevier.com/content/object/eid/1-s2.0-S2468823121005290-sc4_lrg.jpg?httpAccept=%2A%2F%2A",
            "@multimediatype": "JPEG image file",
            "@type": "IMAGE-HIGH-RES",
            "@size": "269009",
            "@ref": "sc4",
            "@mimetype": "image/jpeg"
          },
          {
            "@category": "high",
            "@height": "191",
            "@width": "462",
            "@_fa": "true",
            "$": "https://api.elsevier.com/content/object/eid/1-s2.0-S2468823121005290-fx6_lrg.jpg?httpAccept=%2A%2F%2A",
            "@multimediatype": "JPEG image file",
            "@type": "IMAGE-HIGH-RES",
            "@size": "18193",
            "@ref": "fx6",
            "@mimetype": "image/jpeg"
          },
          {
            "@category": "high",
            "@height": "568",
            "@width": "1333",
            "@_fa": "true",
            "$": "https://api.elsevier.com/content/object/eid/1-s2.0-S2468823121005290-ga1_lrg.jpg?httpAccept=%2A%2F%2A",
            "@multimediatype": "JPEG image file",
            "@type": "IMAGE-HIGH-RES",
            "@size": "248729",
            "@ref": "ga1",
            "@mimetype": "image/jpeg"
          },
          {
            "@category": "high",
            "@height": "151",
            "@width": "401",
            "@_fa": "true",
            "$": "https://api.elsevier.com/content/object/eid/1-s2.0-S2468823121005290-fx19_lrg.jpg?httpAccept=%2A%2F%2A",
            "@multimediatype": "JPEG image file",
            "@type": "IMAGE-HIGH-RES",
            "@size": "13145",
            "@ref": "fx19",
            "@mimetype": "image/jpeg"
          },
          {
            "@category": "high",
            "@height": "99",
            "@width": "401",
            "@_fa": "true",
            "$": "https://api.elsevier.com/content/object/eid/1-s2.0-S2468823121005290-fx18_lrg.jpg?httpAccept=%2A%2F%2A",
            "@multimediatype": "JPEG image file",
            "@type": "IMAGE-HIGH-RES",
            "@size": "12320",
            "@ref": "fx18",
            "@mimetype": "image/jpeg"
          },
          {
            "@category": "high",
            "@height": "197",
            "@width": "401",
            "@_fa": "true",
            "$": "https://api.elsevier.com/content/object/eid/1-s2.0-S2468823121005290-fx17_lrg.jpg?httpAccept=%2A%2F%2A",
            "@multimediatype": "JPEG image file",
            "@type": "IMAGE-HIGH-RES",
            "@size": "15347",
            "@ref": "fx17",
            "@mimetype": "image/jpeg"
          },
          {
            "@category": "high",
            "@height": "198",
            "@width": "448",
            "@_fa": "true",
            "$": "https://api.elsevier.com/content/object/eid/1-s2.0-S2468823121005290-fx12_lrg.jpg?httpAccept=%2A%2F%2A",
            "@multimediatype": "JPEG image file",
            "@type": "IMAGE-HIGH-RES",
            "@size": "15922",
            "@ref": "fx12",
            "@mimetype": "image/jpeg"
          },
          {
            "@category": "high",
            "@height": "198",
            "@width": "448",
            "@_fa": "true",
            "$": "https://api.elsevier.com/content/object/eid/1-s2.0-S2468823121005290-fx11_lrg.jpg?httpAccept=%2A%2F%2A",
            "@multimediatype": "JPEG image file",
            "@type": "IMAGE-HIGH-RES",
            "@size": "17185",
            "@ref": "fx11",
            "@mimetype": "image/jpeg"
          },
          {
            "@category": "high",
            "@height": "198",
            "@width": "500",
            "@_fa": "true",
            "$": "https://api.elsevier.com/content/object/eid/1-s2.0-S2468823121005290-fx10_lrg.jpg?httpAccept=%2A%2F%2A",
            "@multimediatype": "JPEG image file",
            "@type": "IMAGE-HIGH-RES",
            "@size": "18550",
            "@ref": "fx10",
            "@mimetype": "image/jpeg"
          },
          {
            "@category": "high",
            "@height": "198",
            "@width": "448",
            "@_fa": "true",
            "$": "https://api.elsevier.com/content/object/eid/1-s2.0-S2468823121005290-fx16_lrg.jpg?httpAccept=%2A%2F%2A",
            "@multimediatype": "JPEG image file",
            "@type": "IMAGE-HIGH-RES",
            "@size": "16810",
            "@ref": "fx16",
            "@mimetype": "image/jpeg"
          },
          {
            "@category": "high",
            "@height": "198",
            "@width": "448",
            "@_fa": "true",
            "$": "https://api.elsevier.com/content/object/eid/1-s2.0-S2468823121005290-fx15_lrg.jpg?httpAccept=%2A%2F%2A",
            "@multimediatype": "JPEG image file",
            "@type": "IMAGE-HIGH-RES",
            "@size": "17947",
            "@ref": "fx15",
            "@mimetype": "image/jpeg"
          },
          {
            "@category": "high",
            "@height": "303",
            "@width": "402",
            "@_fa": "true",
            "$": "https://api.elsevier.com/content/object/eid/1-s2.0-S2468823121005290-fx14_lrg.jpg?httpAccept=%2A%2F%2A",
            "@multimediatype": "JPEG image file",
            "@type": "IMAGE-HIGH-RES",
            "@size": "23179",
            "@ref": "fx14",
            "@mimetype": "image/jpeg"
          },
          {
            "@category": "high",
            "@height": "349",
            "@width": "349",
            "@_fa": "true",
            "$": "https://api.elsevier.com/content/object/eid/1-s2.0-S2468823121005290-fx13_lrg.jpg?httpAccept=%2A%2F%2A",
            "@multimediatype": "JPEG image file",
            "@type": "IMAGE-HIGH-RES",
            "@size": "22757",
            "@ref": "fx13",
            "@mimetype": "image/jpeg"
          },
          {
            "@category": "high",
            "@height": "1773",
            "@width": "2333",
            "@_fa": "true",
            "$": "https://api.elsevier.com/content/object/eid/1-s2.0-S2468823121005290-gr5_lrg.jpg?httpAccept=%2A%2F%2A",
            "@multimediatype": "JPEG image file",
            "@type": "IMAGE-HIGH-RES",
            "@size": "310832",
            "@ref": "gr5",
            "@mimetype": "image/jpeg"
          },
          {
            "@category": "high",
            "@height": "2411",
            "@width": "2917",
            "@_fa": "true",
            "$": "https://api.elsevier.com/content/object/eid/1-s2.0-S2468823121005290-gr4_lrg.jpg?httpAccept=%2A%2F%2A",
            "@multimediatype": "JPEG image file",
            "@type": "IMAGE-HIGH-RES",
            "@size": "1549363",
            "@ref": "gr4",
            "@mimetype": "image/jpeg"
          },
          {
            "@category": "high",
            "@height": "2449",
            "@width": "2917",
            "@_fa": "true",
            "$": "https://api.elsevier.com/content/object/eid/1-s2.0-S2468823121005290-gr3_lrg.jpg?httpAccept=%2A%2F%2A",
            "@multimediatype": "JPEG image file",
            "@type": "IMAGE-HIGH-RES",
            "@size": "609505",
            "@ref": "gr3",
            "@mimetype": "image/jpeg"
          },
          {
            "@category": "standard",
            "@_fa": "true",
            "$": "https://api.elsevier.com/content/object/eid/1-s2.0-S2468823121005290-mmc1.docx?httpAccept=%2A%2F%2A",
            "@multimediatype": "Microsoft Word file",
            "@type": "APPLICATION",
            "@size": "5655837",
            "@ref": "mmc1",
            "@mimetype": "application/word"
          },
          {
            "@category": "thumbnail",
            "@_fa": "true",
            "$": "https://api.elsevier.com/content/object/eid/1-s2.0-S2468823121005290-si1.svg?httpAccept=%2A%2F%2A",
            "@multimediatype": "Scalable Vector Graphics file",
            "@type": "ALTIMG",
            "@size": "1236",
            "@ref": "si1",
            "@mimetype": "image/svg+xml"
          },
          {
            "@category": "thumbnail",
            "@_fa": "true",
            "$": "https://api.elsevier.com/content/object/eid/1-s2.0-S2468823121005290-si2.svg?httpAccept=%2A%2F%2A",
            "@multimediatype": "Scalable Vector Graphics file",
            "@type": "ALTIMG",
            "@size": "1025",
            "@ref": "si2",
            "@mimetype": "image/svg+xml"
          },
          {
            "@category": "standard",
            "@_fa": "true",
            "$": "https://api.elsevier.com/content/object/eid/1-s2.0-S2468823121005290-am.pdf?httpAccept=%2A%2F%2A",
            "@multimediatype": "Acrobat PDF file",
            "@type": "AAM-PDF",
            "@size": "2546971",
            "@ref": "am",
            "@mimetype": "application/pdf"
          }
        ]
      },
      "link": {
        "@rel": "abstract",
        "@href": "https://api.elsevier.com/content/abstract/scopus_id/85115928064"
      }
    }
  }
}