{
  "metadata": {
    "title": "Reversibly interconverted Cu<ce:sup loc=post>+</ce:sup>/Cu<ce:sup loc=post>+</ce:sup>-H species as active sites for selective hydrogenation of fatty acid methyl esters to fatty alcohol over layered double hydroxide derived CuMgAlO<ce:italic><ce:inf loc=post>x</ce:inf></ce:italic> catalysts",
    "authors": "; ; ",
    "journal": "Molecular Catalysis",
    "date": "2025-03-15",
    "doi": "10.1016/j.mcat.2025.114898",
    "abstract": "",
    "uri": "https://api.elsevier.com/content/article/pii/S2468823125000847",
    "pii": "S2468823125000847"
  },
  "fulltext": {
    "full-text-retrieval-response": {
      "scopus-eid": "2-s2.0-85217421603",
      "originalText": "serial JL 315758 291210 291744 291790 291809 31 Molecular Catalysis MOLECULARCATALYSIS 2025-02-12 2025-02-12 2025-02-12 2025-02-12 2025-02-24T11:55:43 1-s2.0-S2468823125000847 S2468-8231(25)00084-7 S2468823125000847 10.1016/j.mcat.2025.114898 S300 S300.1 FULL-TEXT 1-s2.0-S2468823125X0002X 2025-02-25T11:29:18.216967Z 0 0 20250315 2025 2025-02-12T16:41:23.724389Z absattachment articleinfo articlenumber articletitlenorm authfirstinitialnorm authfirstsurnamenorm cid cids contenttype copyright crossmark dateloaded dateloadedtxt datesearch datesort dateupdated dco docsubtype doctype doi eid ewtransactionid hubeid indexeddate issn issnnorm itemstage itemtransactionid itemweight openaccess openarchive pg pgfirst pii piinorm pubdatestart pubdatetxt pubyr sectiontitle sortorder srctitle srctitlenorm srctype ssids alllist content subj subheadings suppl tomb volfirst volissue volumelist webpdf webpdfpagecount yearnav figure table e-component body mmlmath acknowledge affil appendices articletitle auth authfirstini authfull authkeywords authlast grantsponsor highlightsabst orcid primabst ref specialabst 2468-8231 24688231 true 575 575 C Volume 575 10 114898 114898 114898 20250315 15 March 2025 2025-03-15 2025 Regular Papers article fla © 2025 Elsevier B.V. All rights are reserved, including those for text and data mining, AI training, and similar technologies. REVERSIBLYINTERCONVERTEDCUCUHSPECIESACTIVESITESFORSELECTIVEHYDROGENATIONFATTYACIDMETHYLESTERSFATTYALCOHOLOVERLAYEREDDOUBLEHYDROXIDEDERIVEDCUMGALOXCATALYSTS NOOTO C 1 Introduction 2 Experimental section 2.1 Materials 2.2 Sample preparation 2.3 Material characterization 2.4 Catalytic testing 3 Results and discussion 3.1 Characterizations 3.2 Selective hydrogenation of methyl palmitate 4 Conclusions CRediT authorship contribution statement Acknowledgments Appendix Supplementary materials References KOBAYASHI 1993 1753 1769 J KUMAR 2022 122231 R LIU 2020 183 193 L ZHANG 2024 3706 3711 Y BOATENG 2016 189 196 L ITTHIBENCHAPONG 2017 231 254 V NANOTECHNOLOGYFORBIOENERGYBIOFUELPRODUCTION HETEROGENEOUSCATALYSTSFORADVANCEDBIOFUELPRODUCTION BESHKAR 2015 5043 5051 F RAO 1997 406 419 R KHASIN 2008 2203 2213 A SNARE 2006 5708 5715 M WANG 2020 119293 L DONG 2020 455 Z KRISHNAPRIYA 2020 3308 3317 R PHICHITSURATHAWORN 2020 117644 P LIU 2013 336 345 D ZHANG 2022 284 296 C LIU 2012 7904 7912 L CHEN 2019 334 341 A SRIPADA 2020 415 426 P WANG 2020 18050 18063 Y LIN 2019 Y PRASANSEANG 2022 118555 W PRASANSEANG 2023 115115 W KUMAR 2023 122547 R LI 2023 157774 J YIN 2009 11003 11013 A SHI 2021 318 326 J LIU 2022 118444 Y CUI 2019 394 404 G AUSAVASUKHI 2008 89 96 A PRAKOBTHAM 2022 118625 K CHETTY 2018 7911 7924 T ZENG 2016 207 214 Y DOU 2016 18990 19002 L CUI 2016 G BASAG 2016 122 130 S TANASOI 2009 135 142 S CHEN 2018 11023 11117 S ZHANG 2023 9576 9584 Z BEHR 2005 213 219 A RIEKE 1997 333 339 R HUANG 2012 60 65 C LIU 2021 10354 10363 W MAKMEESUB 2020 17671 17679 N NOOTOX2025X114898 NOOTOX2025X114898XC 2027-02-12T00:00:00.000Z 2027-02-12T00:00:00.000Z http://creativecommons.org/licenses/by-nc-nd/4.0/ © 2025 Elsevier B.V. All rights are reserved, including those for text and data mining, AI training, and similar technologies. 2025-02-25T11:28:14.407Z http://vtw.elsevier.com/data/voc/AddOnTypes/50.7/aggregated-refined N42A660796 http://sws.geonames.org/1605651 National Research Council of Thailand NRCT National Research Council of Thailand http://data.elsevier.com/vocabulary/SciValFunders/501100004704 http://sws.geonames.org/1605651/ King Mongkut&apos;s Institute of Technology Ladkrabang KMITL King Mongkut&apos;s Institute of Technology Ladkrabang http://data.elsevier.com/vocabulary/SciValFunders/501100007120 http://sws.geonames.org/1605651/ Synchrotron Light Research Institute SLRI Synchrotron Light Research Institute http://data.elsevier.com/vocabulary/SciValFunders/501100011752 http://sws.geonames.org/1605651/ We would like to thank King Mongkut&apos;s Institute of Technology Ladkrabang (KMITL), In addition, this project is funded by the National Research Council of Thailand (NRCT) and King Mongkut&apos;s Institute of Technology Ladkrabang (KMITL): (N42A660796). Moreover, this work is supported by Synchrotron Light Research Institute (Public Organization), Thailand, for the in situ TR-XANES experiments (Beamline 2.2) and the Scientific Instruments Center, School of Science, KMITL for the characterizations. https://doi.org/10.15223/policy-017 https://doi.org/10.15223/policy-037 https://doi.org/10.15223/policy-012 https://doi.org/10.15223/policy-029 https://doi.org/10.15223/policy-004 item S2468-8231(25)00084-7 S2468823125000847 1-s2.0-S2468823125000847 10.1016/j.mcat.2025.114898 315758 2025-02-24T12:08:20.159008Z 2025-03-15 1-s2.0-S2468823125000847-main.pdf https://s3-eu-west-1.amazonaws.com/prod-ucs-content-store-eu-west/content/pii:S2468823125000847/MAIN/application/pdf/ce3f43cfaf78495a57b137b4c1938045/main.pdf main.pdf pdf true 11822694 MAIN 13 1-s2.0-S2468823125000847-main_1.png https://s3-eu-west-1.amazonaws.com/prod-ucs-content-store-eu-west/content/pii:S2468823125000847/PREVIEW/image/png/afa07f0dba6e48910097b42cae9b1805/main_1.png main_1.png png 59955 849 656 IMAGE-WEB-PDF 1 1-s2.0-S2468823125000847-gr1.jpg https://s3-eu-west-1.amazonaws.com/prod-ucs-content-store-eu-west/content/pii:S2468823125000847/gr1/DOWNSAMPLED/image/jpeg/117bdb3c0c9b3b4e3aeb3f0a452478d8/gr1.jpg gr1 gr1.jpg jpg 35639 330 376 IMAGE-DOWNSAMPLED 1-s2.0-S2468823125000847-gr2.jpg https://s3-eu-west-1.amazonaws.com/prod-ucs-content-store-eu-west/content/pii:S2468823125000847/gr2/DOWNSAMPLED/image/jpeg/d339d04c20155d84f210abe9a86aa545/gr2.jpg gr2 gr2.jpg jpg 77367 357 715 IMAGE-DOWNSAMPLED 1-s2.0-S2468823125000847-gr3.jpg https://s3-eu-west-1.amazonaws.com/prod-ucs-content-store-eu-west/content/pii:S2468823125000847/gr3/DOWNSAMPLED/image/jpeg/0df51ef1c326f286a7b69e05f6e13cd4/gr3.jpg gr3 gr3.jpg jpg 26858 282 376 IMAGE-DOWNSAMPLED 1-s2.0-S2468823125000847-gr4.jpg https://s3-eu-west-1.amazonaws.com/prod-ucs-content-store-eu-west/content/pii:S2468823125000847/gr4/DOWNSAMPLED/image/jpeg/93033ea6150efcc0abd9a54218d885f0/gr4.jpg gr4 gr4.jpg jpg 275690 831 621 IMAGE-DOWNSAMPLED 1-s2.0-S2468823125000847-gr5.jpg https://s3-eu-west-1.amazonaws.com/prod-ucs-content-store-eu-west/content/pii:S2468823125000847/gr5/DOWNSAMPLED/image/jpeg/52432802ac26bf13228dee4fcb8a7dca/gr5.jpg gr5 gr5.jpg jpg 38545 336 376 IMAGE-DOWNSAMPLED 1-s2.0-S2468823125000847-gr6.jpg https://s3-eu-west-1.amazonaws.com/prod-ucs-content-store-eu-west/content/pii:S2468823125000847/gr6/DOWNSAMPLED/image/jpeg/d9e19df810a96df4e2cb35c21c179a08/gr6.jpg gr6 gr6.jpg jpg 34088 322 376 IMAGE-DOWNSAMPLED 1-s2.0-S2468823125000847-gr7.jpg https://s3-eu-west-1.amazonaws.com/prod-ucs-content-store-eu-west/content/pii:S2468823125000847/gr7/DOWNSAMPLED/image/jpeg/106df7c9a2be8ee08e796a41dd657310/gr7.jpg gr7 gr7.jpg jpg 40636 334 376 IMAGE-DOWNSAMPLED 1-s2.0-S2468823125000847-fx1.jpg https://s3-eu-west-1.amazonaws.com/prod-ucs-content-store-eu-west/content/pii:S2468823125000847/fx1/DOWNSAMPLED/image/jpeg/0e888664d84906c759b6940e7722a185/fx1.jpg fx1 fx1.jpg jpg 2938 11 11 IMAGE-DOWNSAMPLED 1-s2.0-S2468823125000847-fx2.jpg https://s3-eu-west-1.amazonaws.com/prod-ucs-content-store-eu-west/content/pii:S2468823125000847/fx2/DOWNSAMPLED/image/jpeg/52234a13bf24d69280d468f75dbfcb25/fx2.jpg fx2 fx2.jpg jpg 3127 15 13 IMAGE-DOWNSAMPLED 1-s2.0-S2468823125000847-sc2.jpg https://s3-eu-west-1.amazonaws.com/prod-ucs-content-store-eu-west/content/pii:S2468823125000847/sc2/DOWNSAMPLED/image/jpeg/496dbe340ce820851615d19f47f50659/sc2.jpg sc2 sc2.jpg jpg 82046 388 678 IMAGE-DOWNSAMPLED 1-s2.0-S2468823125000847-fx3.jpg https://s3-eu-west-1.amazonaws.com/prod-ucs-content-store-eu-west/content/pii:S2468823125000847/fx3/DOWNSAMPLED/image/jpeg/857a75bbd7c90fbae572eaed06ae6058/fx3.jpg fx3 fx3.jpg jpg 3102 13 13 IMAGE-DOWNSAMPLED 1-s2.0-S2468823125000847-sc1.jpg https://s3-eu-west-1.amazonaws.com/prod-ucs-content-store-eu-west/content/pii:S2468823125000847/sc1/DOWNSAMPLED/image/jpeg/140612967b3c329fd717726f8cc33cc5/sc1.jpg sc1 sc1.jpg jpg 104849 555 565 IMAGE-DOWNSAMPLED 1-s2.0-S2468823125000847-fx4.jpg https://s3-eu-west-1.amazonaws.com/prod-ucs-content-store-eu-west/content/pii:S2468823125000847/fx4/DOWNSAMPLED/image/jpeg/e7ab38b3fc4fe63c34438b1b169306fd/fx4.jpg fx4 fx4.jpg jpg 3149 13 13 IMAGE-DOWNSAMPLED 1-s2.0-S2468823125000847-fx5.jpg https://s3-eu-west-1.amazonaws.com/prod-ucs-content-store-eu-west/content/pii:S2468823125000847/fx5/DOWNSAMPLED/image/jpeg/862500614f9fe14bfe1890f18a1633b7/fx5.jpg fx5 fx5.jpg jpg 3144 15 13 IMAGE-DOWNSAMPLED 1-s2.0-S2468823125000847-sc3.jpg https://s3-eu-west-1.amazonaws.com/prod-ucs-content-store-eu-west/content/pii:S2468823125000847/sc3/DOWNSAMPLED/image/jpeg/7e5e645b6ab718ebb5978b5acba4dffd/sc3.jpg sc3 sc3.jpg jpg 14774 168 678 IMAGE-DOWNSAMPLED 1-s2.0-S2468823125000847-fx6.jpg https://s3-eu-west-1.amazonaws.com/prod-ucs-content-store-eu-west/content/pii:S2468823125000847/fx6/DOWNSAMPLED/image/jpeg/57aacf24b3c7ac0bc500e25cce9f1c67/fx6.jpg fx6 fx6.jpg jpg 2957 8 8 IMAGE-DOWNSAMPLED 1-s2.0-S2468823125000847-gr10.jpg https://s3-eu-west-1.amazonaws.com/prod-ucs-content-store-eu-west/content/pii:S2468823125000847/gr10/DOWNSAMPLED/image/jpeg/d86f91735708e7f26e390144c5299a5c/gr10.jpg gr10 gr10.jpg jpg 59333 365 753 IMAGE-DOWNSAMPLED 1-s2.0-S2468823125000847-ga1.jpg https://s3-eu-west-1.amazonaws.com/prod-ucs-content-store-eu-west/content/pii:S2468823125000847/ga1/DOWNSAMPLED/image/jpeg/e13b85e87ce7ba6e470aa133b4a326b6/ga1.jpg ga1 true ga1.jpg jpg 37982 200 415 IMAGE-DOWNSAMPLED 1-s2.0-S2468823125000847-gr8.jpg https://s3-eu-west-1.amazonaws.com/prod-ucs-content-store-eu-west/content/pii:S2468823125000847/gr8/DOWNSAMPLED/image/jpeg/24ae1fb3e06fb5601a73ffddbc66a244/gr8.jpg gr8 gr8.jpg jpg 39999 391 527 IMAGE-DOWNSAMPLED 1-s2.0-S2468823125000847-gr9.jpg https://s3-eu-west-1.amazonaws.com/prod-ucs-content-store-eu-west/content/pii:S2468823125000847/gr9/DOWNSAMPLED/image/jpeg/fc2b22a5d69b61d6fdeb7d43d16f42c0/gr9.jpg gr9 gr9.jpg jpg 20141 316 376 IMAGE-DOWNSAMPLED 1-s2.0-S2468823125000847-gr11.jpg https://s3-eu-west-1.amazonaws.com/prod-ucs-content-store-eu-west/content/pii:S2468823125000847/gr11/DOWNSAMPLED/image/jpeg/b563ae149f44027902be562eb06f0c91/gr11.jpg gr11 gr11.jpg jpg 41704 428 621 IMAGE-DOWNSAMPLED 1-s2.0-S2468823125000847-gr1.sml https://s3-eu-west-1.amazonaws.com/prod-ucs-content-store-eu-west/content/pii:S2468823125000847/gr1/THUMBNAIL/image/gif/e8b8cf799a7f9c34a573676db9fc6123/gr1.sml gr1 gr1.sml sml 9319 164 187 IMAGE-THUMBNAIL 1-s2.0-S2468823125000847-gr2.sml https://s3-eu-west-1.amazonaws.com/prod-ucs-content-store-eu-west/content/pii:S2468823125000847/gr2/THUMBNAIL/image/gif/c47ed9a119a94cd8bacc95f11890011b/gr2.sml gr2 gr2.sml sml 9680 109 219 IMAGE-THUMBNAIL 1-s2.0-S2468823125000847-gr3.sml https://s3-eu-west-1.amazonaws.com/prod-ucs-content-store-eu-west/content/pii:S2468823125000847/gr3/THUMBNAIL/image/gif/9f56c60cb53ef8b7be991c94b793f1c5/gr3.sml gr3 gr3.sml sml 8986 164 219 IMAGE-THUMBNAIL 1-s2.0-S2468823125000847-gr4.sml https://s3-eu-west-1.amazonaws.com/prod-ucs-content-store-eu-west/content/pii:S2468823125000847/gr4/THUMBNAIL/image/gif/3f909f0aaea571da4c9484e483bed848/gr4.sml gr4 gr4.sml sml 16793 163 122 IMAGE-THUMBNAIL 1-s2.0-S2468823125000847-gr5.sml https://s3-eu-west-1.amazonaws.com/prod-ucs-content-store-eu-west/content/pii:S2468823125000847/gr5/THUMBNAIL/image/gif/f9bdb792da1d977675a94f1273bb6608/gr5.sml gr5 gr5.sml sml 10181 164 184 IMAGE-THUMBNAIL 1-s2.0-S2468823125000847-gr6.sml https://s3-eu-west-1.amazonaws.com/prod-ucs-content-store-eu-west/content/pii:S2468823125000847/gr6/THUMBNAIL/image/gif/a313b6333f247c645a4a2b6986956f91/gr6.sml gr6 gr6.sml sml 9355 164 191 IMAGE-THUMBNAIL 1-s2.0-S2468823125000847-gr7.sml https://s3-eu-west-1.amazonaws.com/prod-ucs-content-store-eu-west/content/pii:S2468823125000847/gr7/THUMBNAIL/image/gif/fcc647e597ab6e1407ac9c4cb3f46673/gr7.sml gr7 gr7.sml sml 10703 164 184 IMAGE-THUMBNAIL 1-s2.0-S2468823125000847-fx1.sml https://s3-eu-west-1.amazonaws.com/prod-ucs-content-store-eu-west/content/pii:S2468823125000847/fx1/THUMBNAIL/image/gif/93302f67801116f9b177a5c34aebaeb9/fx1.sml fx1 fx1.sml sml 3428 49 49 IMAGE-THUMBNAIL 1-s2.0-S2468823125000847-fx2.sml https://s3-eu-west-1.amazonaws.com/prod-ucs-content-store-eu-west/content/pii:S2468823125000847/fx2/THUMBNAIL/image/gif/97112fef2a837342640af5340cf15d3d/fx2.sml fx2 fx2.sml sml 4143 65 58 IMAGE-THUMBNAIL 1-s2.0-S2468823125000847-sc2.sml https://s3-eu-west-1.amazonaws.com/prod-ucs-content-store-eu-west/content/pii:S2468823125000847/sc2/THUMBNAIL/image/gif/ca1579938abbf66e58c22aec97a5c478/sc2.sml sc2 sc2.sml sml 12491 125 219 IMAGE-THUMBNAIL 1-s2.0-S2468823125000847-fx3.sml https://s3-eu-west-1.amazonaws.com/prod-ucs-content-store-eu-west/content/pii:S2468823125000847/fx3/THUMBNAIL/image/gif/57958ac4039acb5c1ec6273f6fadfe37/fx3.sml fx3 fx3.sml sml 4177 58 58 IMAGE-THUMBNAIL 1-s2.0-S2468823125000847-sc1.sml https://s3-eu-west-1.amazonaws.com/prod-ucs-content-store-eu-west/content/pii:S2468823125000847/sc1/THUMBNAIL/image/gif/87b783a761f6039a5fccbc73075bc861/sc1.sml sc1 sc1.sml sml 17904 164 167 IMAGE-THUMBNAIL 1-s2.0-S2468823125000847-fx4.sml https://s3-eu-west-1.amazonaws.com/prod-ucs-content-store-eu-west/content/pii:S2468823125000847/fx4/THUMBNAIL/image/gif/631db39f04731dec43353c198abe9bf4/fx4.sml fx4 fx4.sml sml 3772 58 58 IMAGE-THUMBNAIL 1-s2.0-S2468823125000847-fx5.sml https://s3-eu-west-1.amazonaws.com/prod-ucs-content-store-eu-west/content/pii:S2468823125000847/fx5/THUMBNAIL/image/gif/19e2370d9aa2f439ab52602ccd0918ce/fx5.sml fx5 fx5.sml sml 4628 65 58 IMAGE-THUMBNAIL 1-s2.0-S2468823125000847-sc3.sml https://s3-eu-west-1.amazonaws.com/prod-ucs-content-store-eu-west/content/pii:S2468823125000847/sc3/THUMBNAIL/image/gif/934bed1b084f52a21ef9104341966b9b/sc3.sml sc3 sc3.sml sml 2274 54 219 IMAGE-THUMBNAIL 1-s2.0-S2468823125000847-fx6.sml https://s3-eu-west-1.amazonaws.com/prod-ucs-content-store-eu-west/content/pii:S2468823125000847/fx6/THUMBNAIL/image/gif/5b219ee22a31d69b72ac358ae0908db0/fx6.sml fx6 fx6.sml sml 3514 36 36 IMAGE-THUMBNAIL 1-s2.0-S2468823125000847-gr10.sml https://s3-eu-west-1.amazonaws.com/prod-ucs-content-store-eu-west/content/pii:S2468823125000847/gr10/THUMBNAIL/image/gif/d008a704a35b7f92941c31b27c7675b0/gr10.sml gr10 gr10.sml sml 8672 106 219 IMAGE-THUMBNAIL 1-s2.0-S2468823125000847-ga1.sml https://s3-eu-west-1.amazonaws.com/prod-ucs-content-store-eu-west/content/pii:S2468823125000847/ga1/THUMBNAIL/image/gif/92227b77eaa8bf69f105f18028996944/ga1.sml ga1 true ga1.sml sml 14368 105 219 IMAGE-THUMBNAIL 1-s2.0-S2468823125000847-gr8.sml https://s3-eu-west-1.amazonaws.com/prod-ucs-content-store-eu-west/content/pii:S2468823125000847/gr8/THUMBNAIL/image/gif/988efb752efbced38f1b5464e4fe8faf/gr8.sml gr8 gr8.sml sml 10059 163 219 IMAGE-THUMBNAIL 1-s2.0-S2468823125000847-gr9.sml https://s3-eu-west-1.amazonaws.com/prod-ucs-content-store-eu-west/content/pii:S2468823125000847/gr9/THUMBNAIL/image/gif/691f7f8ed5488ce275e89b466ee0184e/gr9.sml gr9 gr9.sml sml 7148 164 195 IMAGE-THUMBNAIL 1-s2.0-S2468823125000847-gr11.sml https://s3-eu-west-1.amazonaws.com/prod-ucs-content-store-eu-west/content/pii:S2468823125000987/gr11/THUMBNAIL/image/gif/e2c31b9a4d53cef88f831b993c585807/gr11.sml gr11 gr11.sml sml 8752 151 219 IMAGE-THUMBNAIL 1-s2.0-S2468823125000847-gr1_lrg.jpg https://s3-eu-west-1.amazonaws.com/prod-ucs-content-store-eu-west/content/pii:S2468823125000847/HIGHRES/image/jpeg/f669d4eee63457c3e732cdae5eb81751/gr1_lrg.jpg gr1 gr1_lrg.jpg jpg 259826 1463 1667 IMAGE-HIGH-RES 1-s2.0-S2468823125000847-gr2_lrg.jpg https://s3-eu-west-1.amazonaws.com/prod-ucs-content-store-eu-west/content/pii:S2468823125000847/HIGHRES/image/jpeg/46c0758e53c073e19570a780b1df85b1/gr2_lrg.jpg gr2 gr2_lrg.jpg jpg 612253 1580 3167 IMAGE-HIGH-RES 1-s2.0-S2468823125000847-gr3_lrg.jpg https://s3-eu-west-1.amazonaws.com/prod-ucs-content-store-eu-west/content/pii:S2468823125000847/HIGHRES/image/jpeg/006b51f50e67c6c843c7970c844e6c09/gr3_lrg.jpg gr3 gr3_lrg.jpg jpg 186819 1250 1667 IMAGE-HIGH-RES 1-s2.0-S2468823125000847-gr4_lrg.jpg https://s3-eu-west-1.amazonaws.com/prod-ucs-content-store-eu-west/content/pii:S2468823125000847/HIGHRES/image/jpeg/31263a40e7e9f564979bf74114dd19a2/gr4_lrg.jpg gr4 gr4_lrg.jpg jpg 3232492 3680 2750 IMAGE-HIGH-RES 1-s2.0-S2468823125000847-gr5_lrg.jpg https://s3-eu-west-1.amazonaws.com/prod-ucs-content-store-eu-west/content/pii:S2468823125000847/HIGHRES/image/jpeg/335c794f4b2a5fdec4696630110b9dc8/gr5_lrg.jpg gr5 gr5_lrg.jpg jpg 274017 1488 1667 IMAGE-HIGH-RES 1-s2.0-S2468823125000847-gr6_lrg.jpg https://s3-eu-west-1.amazonaws.com/prod-ucs-content-store-eu-west/content/pii:S2468823125000847/HIGHRES/image/jpeg/cfbbb26a2483f71d35063a55603d9b68/gr6_lrg.jpg gr6 gr6_lrg.jpg jpg 249675 1429 1667 IMAGE-HIGH-RES 1-s2.0-S2468823125000847-gr7_lrg.jpg https://s3-eu-west-1.amazonaws.com/prod-ucs-content-store-eu-west/content/pii:S2468823125000847/HIGHRES/image/jpeg/8e2eac9f3f198b3a56443f4472b1b892/gr7_lrg.jpg gr7 gr7_lrg.jpg jpg 290413 1483 1667 IMAGE-HIGH-RES 1-s2.0-S2468823125000847-fx1_lrg.jpg https://s3-eu-west-1.amazonaws.com/prod-ucs-content-store-eu-west/content/pii:S2468823125000847/HIGHRES/image/jpeg/4a89f6c2af05b6f1d9ad4b5ac4419d22/fx1_lrg.jpg fx1 fx1_lrg.jpg jpg 3079 49 49 IMAGE-HIGH-RES 1-s2.0-S2468823125000847-fx2_lrg.jpg https://s3-eu-west-1.amazonaws.com/prod-ucs-content-store-eu-west/content/pii:S2468823125000847/HIGHRES/image/jpeg/ce4bc928437f1142682733171bf76b7b/fx2_lrg.jpg fx2 fx2_lrg.jpg jpg 4122 65 58 IMAGE-HIGH-RES 1-s2.0-S2468823125000847-sc2_lrg.jpg https://s3-eu-west-1.amazonaws.com/prod-ucs-content-store-eu-west/content/pii:S2468823125000847/HIGHRES/image/jpeg/2ae6cd2820212c69852615a0fcbb381c/sc2_lrg.jpg sc2 sc2_lrg.jpg jpg 577240 1717 3000 IMAGE-HIGH-RES 1-s2.0-S2468823125000847-fx3_lrg.jpg https://s3-eu-west-1.amazonaws.com/prod-ucs-content-store-eu-west/content/pii:S2468823125000847/HIGHRES/image/jpeg/cdddf34083d297edb0a8027c91f5df37/fx3_lrg.jpg fx3 fx3_lrg.jpg jpg 4092 58 58 IMAGE-HIGH-RES 1-s2.0-S2468823125000847-sc1_lrg.jpg https://s3-eu-west-1.amazonaws.com/prod-ucs-content-store-eu-west/content/pii:S2468823125000847/HIGHRES/image/jpeg/72225cb04be7553f79709a0dffc51322/sc1_lrg.jpg sc1 sc1_lrg.jpg jpg 890834 2455 2500 IMAGE-HIGH-RES 1-s2.0-S2468823125000847-fx4_lrg.jpg https://s3-eu-west-1.amazonaws.com/prod-ucs-content-store-eu-west/content/pii:S2468823125000847/HIGHRES/image/jpeg/43041b0d2ef754ed444810b86f0b6df5/fx4_lrg.jpg fx4 fx4_lrg.jpg jpg 4157 58 58 IMAGE-HIGH-RES 1-s2.0-S2468823125000847-fx5_lrg.jpg https://s3-eu-west-1.amazonaws.com/prod-ucs-content-store-eu-west/content/pii:S2468823125000847/HIGHRES/image/jpeg/2994c910753a4df79c0f422332330f2a/fx5_lrg.jpg fx5 fx5_lrg.jpg jpg 4193 65 58 IMAGE-HIGH-RES 1-s2.0-S2468823125000847-sc3_lrg.jpg https://s3-eu-west-1.amazonaws.com/prod-ucs-content-store-eu-west/content/pii:S2468823125000847/HIGHRES/image/jpeg/024dbe0d2346fc13d9400610f5488594/sc3_lrg.jpg sc3 sc3_lrg.jpg jpg 118142 745 3000 IMAGE-HIGH-RES 1-s2.0-S2468823125000847-fx6_lrg.jpg https://s3-eu-west-1.amazonaws.com/prod-ucs-content-store-eu-west/content/pii:S2468823125000847/HIGHRES/image/jpeg/fbc15289fd1832f1ac8d90fdf0e1a4bb/fx6_lrg.jpg fx6 fx6_lrg.jpg jpg 4084 36 36 IMAGE-HIGH-RES 1-s2.0-S2468823125000847-gr10_lrg.jpg https://s3-eu-west-1.amazonaws.com/prod-ucs-content-store-eu-west/content/pii:S2468823125000847/HIGHRES/image/jpeg/97baf56644e6f73fd72b99c7cfaec4b7/gr10_lrg.jpg gr10 gr10_lrg.jpg jpg 373411 1616 3333 IMAGE-HIGH-RES 1-s2.0-S2468823125000847-ga1_lrg.jpg https://s3-eu-west-1.amazonaws.com/prod-ucs-content-store-eu-west/content/pii:S2468823125000847/HIGHRES/image/jpeg/2ca2b6b6827564b5215fe04c21dc6e52/ga1_lrg.jpg ga1 true ga1_lrg.jpg jpg 294482 886 1840 IMAGE-HIGH-RES 1-s2.0-S2468823125000847-gr8_lrg.jpg https://s3-eu-west-1.amazonaws.com/prod-ucs-content-store-eu-west/content/pii:S2468823125000847/HIGHRES/image/jpeg/890397ce477cfbbf95b4f250f45e0cca/gr8_lrg.jpg gr8 gr8_lrg.jpg jpg 297246 1733 2333 IMAGE-HIGH-RES 1-s2.0-S2468823125000847-gr9_lrg.jpg https://s3-eu-west-1.amazonaws.com/prod-ucs-content-store-eu-west/content/pii:S2468823125000847/HIGHRES/image/jpeg/5fdde9351902af24d0f8f3d0648e3726/gr9_lrg.jpg gr9 gr9_lrg.jpg jpg 141144 1401 1667 IMAGE-HIGH-RES 1-s2.0-S2468823125000847-gr11_lrg.jpg https://s3-eu-west-1.amazonaws.com/prod-ucs-content-store-eu-west/content/pii:S2468823125000987/HIGHRES/image/jpeg/8bdecf5a86b2452197b24bdc65245ee6/gr11_lrg.jpg gr11 gr11_lrg.jpg jpg 282917 1896 2750 IMAGE-HIGH-RES 1-s2.0-S2468823125000847-mmc1.pptx https://s3-eu-west-1.amazonaws.com/prod-ucs-content-store-eu-west/content/pii:S2468823125000847/mmc1/MAIN/application/vnd.openxmlformats-officedocument.presentationml.presentation/cc82c00c37453cf73d747d95237f33c6/mmc1.pptx mmc1 mmc1.pptx pptx 11204987 APPLICATION 1-s2.0-S2468823125000847-si1.svg https://s3-eu-west-1.amazonaws.com/prod-ucs-content-store-eu-west/content/pii:S2468823125000847/image/svg+xml/397c465415ef10168f101926b9de0992/si1.svg si1 si1.svg svg 6368 ALTIMG 1-s2.0-S2468823125000847-si10.svg https://s3-eu-west-1.amazonaws.com/prod-ucs-content-store-eu-west/content/pii:S2468823125000847/image/svg+xml/7827c7ee95a6bbf9cf9ca6d68d089884/si10.svg si10 si10.svg svg 5638 ALTIMG 1-s2.0-S2468823125000847-si11.svg https://s3-eu-west-1.amazonaws.com/prod-ucs-content-store-eu-west/content/pii:S2468823125000847/image/svg+xml/13ef2ed807faf2a955b2dc226a576556/si11.svg si11 si11.svg svg 7908 ALTIMG 1-s2.0-S2468823125000847-si12.svg https://s3-eu-west-1.amazonaws.com/prod-ucs-content-store-eu-west/content/pii:S2468823125000847/image/svg+xml/92cdad985a10d2a63aa599f79a427a6f/si12.svg si12 si12.svg svg 3589 ALTIMG 1-s2.0-S2468823125000847-si13.svg https://s3-eu-west-1.amazonaws.com/prod-ucs-content-store-eu-west/content/pii:S2468823125000847/image/svg+xml/30f0714c67394a3dcc76373350370ddf/si13.svg si13 si13.svg svg 16212 ALTIMG 1-s2.0-S2468823125000847-si14.svg https://s3-eu-west-1.amazonaws.com/prod-ucs-content-store-eu-west/content/pii:S2468823125000847/image/svg+xml/804f46d0ac0779e1d16b2b2620cd1e67/si14.svg si14 si14.svg svg 12489 ALTIMG 1-s2.0-S2468823125000847-si15.svg https://s3-eu-west-1.amazonaws.com/prod-ucs-content-store-eu-west/content/pii:S2468823125000847/image/svg+xml/66c035a3f942933f70c27e9efcb955fd/si15.svg si15 si15.svg svg 3652 ALTIMG 1-s2.0-S2468823125000847-si16.svg https://s3-eu-west-1.amazonaws.com/prod-ucs-content-store-eu-west/content/pii:S2468823125000847/image/svg+xml/2b1d8bd216b72693bdc3326becfd6a70/si16.svg si16 si16.svg svg 4945 ALTIMG 1-s2.0-S2468823125000847-si17.svg https://s3-eu-west-1.amazonaws.com/prod-ucs-content-store-eu-west/content/pii:S2468823125000847/image/svg+xml/f84278c31785e2005e4f39c4d39c6125/si17.svg si17 si17.svg svg 1385 ALTIMG 1-s2.0-S2468823125000847-si2.svg https://s3-eu-west-1.amazonaws.com/prod-ucs-content-store-eu-west/content/pii:S2468823125000847/image/svg+xml/e0a13e21d0d2f7d1072c5618d7111f85/si2.svg si2 si2.svg svg 6364 ALTIMG 1-s2.0-S2468823125000847-si3.svg https://s3-eu-west-1.amazonaws.com/prod-ucs-content-store-eu-west/content/pii:S2468823125000847/image/svg+xml/a5a7d19bf22a1540d9bb30362b0ee8fa/si3.svg si3 si3.svg svg 3007 ALTIMG 1-s2.0-S2468823125000847-si4.svg https://s3-eu-west-1.amazonaws.com/prod-ucs-content-store-eu-west/content/pii:S2468823125000847/image/svg+xml/bcb25dc8fb7ce6e309ef513513d3b267/si4.svg si4 si4.svg svg 15798 ALTIMG 1-s2.0-S2468823125000847-si5.svg https://s3-eu-west-1.amazonaws.com/prod-ucs-content-store-eu-west/content/pii:S2468823125000847/image/svg+xml/11536be9dfedcba8363d875050eebe05/si5.svg si5 si5.svg svg 16801 ALTIMG 1-s2.0-S2468823125000847-si6.svg https://s3-eu-west-1.amazonaws.com/prod-ucs-content-store-eu-west/content/pii:S2468823125000847/image/svg+xml/5278f099c6ebb7e0af8d2fd495130a5f/si6.svg si6 si6.svg svg 18857 ALTIMG 1-s2.0-S2468823125000847-si7.svg https://s3-eu-west-1.amazonaws.com/prod-ucs-content-store-eu-west/content/pii:S2468823125000847/image/svg+xml/3318fbb90b8b803e85e0f7954ac63fec/si7.svg si7 si7.svg svg 20740 ALTIMG 1-s2.0-S2468823125000847-si8.svg https://s3-eu-west-1.amazonaws.com/prod-ucs-content-store-eu-west/content/pii:S2468823125000847/image/svg+xml/9605bed9882d4b1d6b31b770dcd98d85/si8.svg si8 si8.svg svg 20435 ALTIMG 1-s2.0-S2468823125000847-si9.svg https://s3-eu-west-1.amazonaws.com/prod-ucs-content-store-eu-west/content/pii:S2468823125000847/image/svg+xml/2e7d55e34eb6f3cdda0af217c998a04b/si9.svg si9 si9.svg svg 16200 ALTIMG MCAT 114898 114898 S2468-8231(25)00084-7 10.1016/j.mcat.2025.114898 Elsevier B.V. Fig. 1 XRD patterns of CuLDHs, the mixed metal oxide catalyst precursors. Fig. 1 Scheme 1 Copper containing layered double hydroxide structure (CuLDHs). Scheme 1 Fig. 2 XRD patterns of a) calcined and b) reduced mixed metal oxide catalysts. Fig. 2 Fig. 3 H2-TPR profiles of i) CuMg60Al40O x , ii) CuMg70Al30O x , iii) CuMg75Al25O x , and iv) CuMg80Al20O x . Fig. 3 Fig. 4 TEM images of i) CuMg60Al40O x , ii) CuMg70Al30O x , iii) CuMg75Al25O x , and iv) CuMg80Al20O x . Fig. 4 Fig. 5 The N2O-dissociative reaction profiles of i) CuMg60Al40O x , ii) CuMg70Al30O x , iii) CuMg75Al25O x , and iv) CuMg80Al20O x (first H2-TPR (solid line) and second H2-TPR (from 80 to 350 °C) after dissociative N2O adsorption). Fig. 5 Fig. 6 In situ TR-XANES spectra of reduced CuMg75Al25O x catalyst and Cu standards (Cu foil (8979.0 eV), Cu2O (8980.5 eV), CuO (8990.2 eV, square planar geometry, Cu2+(Sq)), and CuSO4 (8992.3 eV, octahedral geometry, Cu2+(Oh). Fig. 6 Scheme 2 Reduction of the interlayered Cu2+ to Cu+ species and reversible interconversion between the Cu+ and Cu+-H in the presence/absence of H2. Scheme 2 Fig. 7 Consecutive H2-TPR profiles of i) CuO-Bulk, ii) CuMg60Al40O x , iii) CuMg70Al30O x , iv) CuMg75Al25O x , and v) CuMg80Al20O x . Fig. 7 Fig. 8 The consecutive H2-TPR profiles of CuMg70Al30O x . Fig. 8 Scheme 3 Reaction pathway of methyl palmitate conversion over Cu-based catalysts. Scheme 3 Fig. 9 Effect of the ratio between active Cu surface (Cusurface) and cationic Cu(I) species (Cu+/Cu+-H species) in CuMgAlO x catalysts on selective hydrogenation of methyl palmitate. (Reaction condition: 0.25 g of catalyst, 10 wt.% methyl palmitate in dodecane, reaction temperature at 250 °C, calcination temperature at 550 °C, reduction temperature at 250 °C, H2 1 atm (180 mL/min). The activity is at 1 h on stream). Fig. 9 Fig. 10 Time-on-stream of selective hydrogenation of methyl palmitate using i) CuMg60Al40O x , ii) CuMg70Al30O x , iii) CuMg75Al25O x , and iv) CuMg80Al20O x ( Conversion Hexadecanol iso-Hexadecene 1-Hexadecane C16-nal C15). (Reaction condition: 0.25 g of catalyst, 10 wt.% methyl palmitate in dodecane, reaction temperature at 250 °C, calcination temperature at 550 °C, reduction temperature at 250 °C, H2 1 atm (180 mL/min). The activity is at 1 h on stream.). Fig. 10 Fig. 11 Selective hydrogenation of methyl palmitate using CuMg75Al25O x over 100 h. ( Conversion Hexadecanol iso-Hexadecene 1-Hexadecane C16-nal C15). Reaction condition: 0.25 g of catalyst, 10 wt.% methyl palmitate in dodecane, reaction temperature at 250 °C, calcination temperature at 550 °C, reduction temperature at 250 °C, H21 atm (180 mL/min). Fig. 11 Table 1 Physical and chemical properties of Cu-containing double layered hydroxide samples. Table 1 Entry Catalysts MCu a (%) MMg a (%) MAl a (%) % M Mg % ( M Mg + M Al ) % M Al % ( M Mg + M Al ) CuMg/Al molar ratio N2-adsorption H2 consumption (mmol/g) d Cu content (wt.%) d DCu e (%) SBET b (m2/g) Dp c (nm) Vp c (cm3/g) 1 CuMg60Al40O x 0.27 0.64 0.41 61.16 38.34 2.2 121 35.78 0.69 2.72 17.3 72 2 CuMg70Al30O x 0.27 0.73 0.36 67.30 32.70 2.8 113 37.88 0.59 2.72 17.3 81 3 CuMg75Al25O x 0.29 0.80 0.26 75.30 24.70 4.1 153 31.56 0.63 2.75 17.5 85 4 CuMg80Al20O x 0.27 0.94 0.26 78.87 21.13 4.8 115 36.86 0.92 2.72 17.3 93 a Mole of Cu, Mg, and Al calculated from ICP-OES in Table S1. b Determined by N2 adsorption-desorption analysis (BET). c Determined by the BJH method (Fig. S2). d Estimated by H2-TPR. e Calculated by conventional dissociative N2O adsorption. Table 2 Crystallite size and thermogravimetric analysis. Table 2 Entry Catalysts precursor Crystallite size a (nm) wt.% loss determined by TGA 50–200 °C 200–500 °C 500–700 °C 1 CuMg60Al40O x -pre 8.3 16.0 17.4 3.2 2 CuMg70Al30O x -pre 11.6 13.5 18.7 3.8 3 CuMg75Al25O x -pre 12.3 12.1 18.6 6.3 4 CuMg80Al20O x -pre 11.1 8.1 17.6 3.5 a Determined from XRD using Scherrer method at 2 θ = 11 ∘ . Table 3 Cu species and corrected Cu metal dispersion of CuMgAlO x catalysts. Table 3 Entry Catalysts Cu+ (%) Metallic Cu (%) Total Cusurface 1 CuMg60Al40O x 54 46 18 2 CuMg70Al30O x 66 33 14 3 CuMg75Al25O x 68 32 17 4 CuMg80Al20O x 86 13 7 Table 4 Catalytic activity, product yields, and selectivity in hydrogenation of methyl palmitate over CuMgAlO x catalysts. Table 4 Entry Catalysts Conversion (%) Hydrogenation rate (mmol/h gcat) Alcohol production rate (h−1) Yield (%) Mass balance (%) Selectivity (%) C16-OH C16-al C16-1-ene iso-C16-ene C16-OH C16-al C16-1-ene iso-C16-ene 1 CuMg60Al40O x 53.7 1.43 41.9 42.0 5.7 2.6 2.9 99 78.1 10.6 4.8 5.3 2 CuMg70Al30O x 52.8 1.41 42.6 42.2 4.6 2.3 2.7 98 79.9 8.8 4.4 5.1 3 CuMg75Al25O x 57.1 1.52 49.3 51.5 2.9 – 1.1 98 90.2 5.2 – 2.0 4 CuMg80Al20O x 30.6 0.81 27.5 27.7 2.0 0.3 0.4 99 90.4 6.7 0.9 1.3 Reaction condition: 0.25 g of catalyst, 10 wt.% methyl palmitate in dodecane, reaction temperature at 250 °C, calcination temperature at 550 °C, reduction temperature at 250 °C, H2 1 atm (180 mL/min), The activity is at 1 h on stream. Table 5 Comparison of selective hydrogenation of methyl palmitate to hexadecanol using various Cu-based catalysts. Table 5 Entry Catalysts Reaction types Pressure (bar) Reaction temperature (°C) Conversion (%) Alcohol selectivity (%) Alcohol production rate (h−1) Ref. 1 CuMg75Al25O x Fixed-bed 1 250 57.1 90.12 49.3 This work 2 20Cu/SiO2 Fixed-bed 1 250 13.0 60.1 6.9 [30] 3 20CuPS Fixed-bed 1 250 73.2 19.2 10.9 [30] 4 0.05K-rCuPS Fixed-bed 1 250 54.9 60.1 31.1 [31] 5 Cu/m-ZrO2 Batch 75 300 94.6 93.3 167.5 [49] 6 CuO Batch 75 300 2.6 80.8 0.3 [49] 7 1 %Pd–Cu(3:1)/ diatomite Batch 55 250 67.5 85.9 185.7 [51] 8 CuCr2O4 Batch 138 280 98.0 95.0 1.1 [50] Reversibly interconverted Cu+/Cu+-H species as active sites for selective hydrogenation of fatty acid methyl esters to fatty alcohol over layered double hydroxide derived CuMgAlO x catalysts Chanisara Nooto Validation Methodology Formal analysis Data curation a Panalee Chuaykaew Formal analysis Data curation a Pawanrat Singthuen Formal analysis Data curation a Thanasak Solos Formal analysis a Yardthip Preedawichitkun Data curation a Kanyanat Khosukwiwat Data curation a Kanokwan Wengwirat Data curation a Pratya Promchana Formal analysis Data curation a Raju Kumar Validation c Po-Wen Chung Validation Conceptualization c d Yingyot Poo-arporn Validation e Wanwisa Limphirat Validation e Kittisak Choojun Writing – review & editing Writing – original draft Validation Supervision Methodology Investigation Funding acquisition Formal analysis Conceptualization a ⁎ Tawan Sooknoi Writing – review & editing Writing – original draft Supervision Funding acquisition Conceptualization b ⁎ a Department of Chemistry, School of Science, King Mongkut's Institute of Technology Ladkrabang, Chalongkrung Road, Ladkrabang, Bangkok 10520, Thailand Department of Chemistry School of Science, King Mongkut's Institute of Technology Ladkrabang Chalongkrung Road, Ladkrabang Bangkok 10520 Thailand aDepartment of Chemistry, School of Science, King Mongkut's Institute of Technology Ladkrabang, Chalongkrung Road, Ladkrabang, Bangkok 10520, Thailand b Catalytic Chemistry Research Unit, School of Science, King Mongkut's Institute of Technology Ladkrabang, Chalongkrung Road, Ladkrabang, Bangkok 10520, Thailand Catalytic Chemistry Research Unit, School of Science King Mongkut's Institute of Technology Ladkrabang Chalongkrung Road, Ladkrabang Bangkok 10520 Thailand bCatalytic Chemistry Research Unit, School of Science, King Mongkut's Institute of Technology Ladkrabang, Chalongkrung Road, Ladkrabang, Bangkok 10520, Thailand c Institute of Chemistry, Academia Sinica, 128 Academia Road, Section 2, Nankang, Taipei 11529, Taiwan Institute of Chemistry Academia Sinica 128 Academia Road, Section 2, Nankang Taipei 11529 Taiwan cInstitute of Chemistry, Academia Sinica, 128 Academia Road, Section 2, Nankang, Taipei 11529, Taiwan d Department of Chemistry, National Sun Yat-sen University, Kaohsiung 80424, Taiwan Department of Chemistry National Sun Yat-sen University Kaohsiung 80424 Taiwan dDepartment of Chemistry, National Sun Yat-sen University, Kaohsiung 80424, Taiwan e Synchrotron Light Research Institute (Public Organization), 111 University Avenue, Muang District, Nakhon Ratchasima 30000, Thailand Synchrotron Light Research Institute (Public Organization) 111 University Avenue, Muang District Nakhon Ratchasima 30000 Thailand eSynchrotron Light Research Institute (Public Organization), 111 University Avenue, Muang District, Nakhon Ratchasima 30000, Thailand ⁎ Corresponding authors. High fatty alcohol production (>90 % selectivity) can be achieved though the selective hydrogenation of fatty acid methyl esters over layered double hydroxide derived CuMgAlO x catalysts in a fixed-bed reactor at 250 °C under atmospheric H2. ∼17 wt.% Cu loading CuLDHs with different Mg2+/Al3+ ratios (CuMg60Al40O x , CuMg70Al30O x , CuMg75Al25O x , and CuMg80Al20O x ) were prepared by co-precipitation-hydrothermal method. The Cu dispersion and species were determined by H2-TPR, consecutive H2-TPR, N2O-dissociative reaction, and in situ TR-XANES. Highly dispersed Cu metal along with cationic Cu(I) species were obtained for all CuMgAlO x . The cationic Cu(I) species (Cu+/Cu+-H) content increased with Mg2+ content. In the presence of H2, the cationic Cu(I) species undergo reversible interconversion between Cu+ and Cu+-H species, facilitating hydrogen dissociation/evolution. The hydrogenation activity was governed by the balance of the metallic Cu surface and the cationic Cu(I) species. The Cu+ species allow preferential adsorption of CO ester for selective hydrogenation of FAMEs to fatty alcohol (>90 % selectivity). With Cusurface/Cu(I) ratio at 0.25 (CuMg75Al25O x ), the fatty alcohol production rate of 49.3 h−1 was obtained with high stability due to the reversible interconversion of Cu+/Cu+-H that prevented product re-adsorption and side reactions. Graphical abstract Image, graphical abstract Keywords Cationic Cu(I) species Reversible interconversion Cu+/Cu+-H species CuLDHs Fatty alcohol FAMEs Selective hydrogenation Data availability No data was used for the research described in the article. 1 Introduction Fatty alcohols, also known as long-chain alcohols (C12–C18), are essential chemicals widely utilized across various industries. Their applications include serving as surfactants, plasticizers, solvents, flavorings, detergents, foam stabilizers, and ingredients in cosmetics, plastic intermediates, paints, and coatings [1,2]. In fact, ∼5500 tons of fatty alcohols are consumed (∼ $ 8.5 billion market) [3,4]. Petroleum-based fatty alcohols are typically through hydroformylation and subsequently selective hydrogenation, involving the combination of CO, H2, and paraffins [5–8]. Though these processes are neither sustainable nor and environmentally friendly. Alternatively, bio-based fatty alcohols can be produced by the selective hydrogenation of fatty acid methyl esters (FAMEs), which are derived from triglycerides present in renewable sources, such as vegetable oils (palm and soybean), waste cooking oils, and animal fats. With the drive toward carbon neutrality, the price of bio-based fatty alcohols ($2500 to $6000 per metric ton) is twice of the petroleum based long-chain alcohols ($1500 to $3000 per metric ton) [9–12]. This leads to a higher margin for the bio-based fatty alcohols. Hence, the hydrogenation of FAMEs to fatty alcohols is a key sustainable approach to converting renewable feedstocks, which contributes to carbon neutrality [13,14]. Copper-chromite (CuO/CuCr2O4) catalysts are commercially used for the selective hydrogenation of FAMEs to fatty alcohols under high temperatures (200–400 °C) and pressure (200–300 bar of H₂) [15–17]. However, the toxicity related to chromium leaching under harsh reaction conditions leads to complicated waste management and environmental concerns. While, non-noble metal catalysts with less toxicity, such as Ni/SiO₂ [18,19], Ni-Fe/Al₂O₃ [20], Co/SiO₂-Al₂O3 [21], and Co/SiO₂ [22], tend to promote decarbonylation to olefinic products with one carbon shorter chain length, leading to a lower alcohol selectivity. In addition, these catalysts are prone to deactivation due to CO poisoning and coke formation which further limits their long-term efficiency. Despite a poor metal dispersion observed in the impregnated Cu catalysts, the copper-based catalysts exhibit significantly low decarbonylation and decarboxylation activities and are highly selective for alcohol production [23,24]. To obtain highly dispersed and stabilized Cu nanoparticles, a strong metal support interaction or sophisticated preparation is required. However, supported Cu over typical reducible metal oxides, such as TiO2 and CeO2, shows a dramatically low activity due to the electron deficiency of the Cu surface induced by those reducible metal oxides [24–29]. Alternatively, copper phyllosilicate offers high Cu dispersion (>65 %) over non-reactive support. This could be attributed to the strong interaction between Cu-SiO2 in the octahedral sites of chrysocolla structures, which leads to the formation of Cu+ species retained in the catalysts [30–32]. In fact, the presence of Cu+ species enhanced the Cu dispersion, presumably preventing the Cu agglomeration, which further increase the activity [30–34]. The Cu+ species also promote η1-adsorption of CO, preventing the decarbonylation and decarboxylation. Moreover, Cu+ species can promote the produced alcohol desorption and prevent alcohol re-adsorption, leading to a high alcohol selectivity [30,31]. Nevertheless, Brønsted acid sites (BAS) derived from the interaction of silanols at the Cu perimeters promote the dehydration of alcohol to olefins as side products and also cause deactivation [30]. The attempt to improve alcohol selectivity with alkali metal doping to neutralize those BAS can only increase the alcohol selectivity up to 60 % [31]. Alternatively, copper layered double hydroxides (CuLDHs) feature positively charged brucite-like layers (brucite-like M(OH)6-octahedral, M = Cu2+, Mg2+, and Al3+) and interlayer anions. The Mg2+/Al3+ ratio within these octahedral layered structures governs not only the basicity of the CuLDHs but also the interaction between Cu and support (Cu-MgO and Cu-Al2O3) [35]. This strong interaction of copper within confined metal oxide sheets would readily affect the Cu reducibility, Cu0/Cu+ generation, and Cu dispersion after the reduction [33,36]. Accordingly, the basic catalysts with highly dispersed Cu0/Cu+ species could be obtained from LDHs derived CuMgAlO x catalysts for high selectivity of fatty alcohols from FAMEs hydrogenation. In a supportive manner, Cui G., et al. showed that the LDHs derived CuMgAlO x (Mg2+/Al3+ = 1.0) showed >99 % ethylene glycol from selective hydrogenation of dimethyl oxalate [37]. Accordingly, the ultra-fine Cu nanoparticles with Cu0/Cu+ in the confined mixed oxide sheets could show distinct hydrogen dissociation, adsorption, and evolution, as typically observed for those M0/M+ species. For example, AgHZSM-5 showed the reversible interconversion between Ag0 and Ag+ [38]. Under H2, the exchangeable Ag+ was reduced forming Ag0 with nearby acid sites (BAS). The dissociated H over Ag° could reversibly react with BAS back to exchangeable Ag+, evolving H2 under inert. The dimeric extra-framework gallium species ([Ga2O2]2+) can dissociate hydrogen forming Ga+-H that reversibly evolves hydrogen under an inert atmosphere [39]. In addition, the heterolytic dissociation of hydrogen over atomically dispersed Cu derived from Cu containing LDHs, presumably forming Cuδ+-H, has been mentioned [32]. The reversible interconversion in LDHs derived CuMgAlO x , especially Cu+-H species, could promote selective hydrogenation of the carbonyl compounds (aldehydes and esters) in a manner similar to typical hydride species. Furthermore, the simultaneous hydrogen dissociation/evolution over the active catalyst surface could prevent carbon deposition, prolonging the catalyst's lifetime. With this regard, the selective hydrogenation of methyl palmitate (MP) to long-chain alcohol (hexadecanol) over LDHs derived CuMgAlO x catalysts, was investigated in a continuous fixed-bed reactor under atmospheric H2 pressure. 17 wt.% CuLDHs with various Mg2+/Al3+ ratios were tested for structural stability, reducibility, and Cu dispersion. The Cu+/Cu0 species and their reversible interconversion were characterized by consecutive H2-TPR, N2O-dissociative reaction, and in situ TR-XANES, from which the corrected Cu dispersion could be determined. The effect of Mg2+/Al3+ on Cu+/Cu0 species and selective hydrogenation activity was explored. In addition, the role of cationic Cu(I) species in LDHs derived CuMgAlO x on the alcohol selectivity and stability was evaluated. The balance between metallic Cu surface and cationic Cu(I) species for the production of long-chain alcohol was also highlighted. 2 Experimental section 2.1 Materials Copper(II) nitrate trihydrate (Cu(NO3)2•3H2O, QREC, 99.50 %), magnesium nitrate hexahydrate (Mg(NO3)2•6H2O, PANREAC APPLICHEM, 98.00 %), aluminium nitrate nonahydrate (Al(NO3)3•9H2O, PANREAC APPLICHEM, 98.00 %), sodium hydroxide anhydrous pellets (NaOH, CARLO ERBA, 98.00 %), sodium carbonate anhydrous (Na2CO3, CARLO ERBA, 99.50 %), methanol (CH3OH, CARLO ERBA, 99.9 %), methyl palmitate (C17H32O2, SIGMA-ALDRICH, 97.00 %), n-dodecane (C12H26, CARLO ERBA, 99.90 %), n-octane (C8H18, CARLO ERBA, 99.00 %), and n-heptane (C7H16, CARLO ERBA, 99.00 %), were purchased and used without further purification. Hydrogen (99.99 %), nitrogen (99.99 %), air (zero grade, 99.99 %), 10 % hydrogen in argon (99.98 %), and helium (99.999 %) were ordered from UIG company. 1 % hydrogen in argon (99.98 %), and 1 % ammonia in helium (99.99 %) were ordered from Linde. 2.2 Sample preparation Cu containing layered double hydroxides (CuLDHs, ∼17 wt.%) was prepared from co-precipitation and hydrothermal methods, as previously reported [32], with the different Mg2+/Al3+ ratios. A fixed amount of copper(II) nitrate trihydrate (Cu(NO3)2•3H2O) (2.20 g) was used for all samples. The mass of magnesium nitrate hexahydrate (Mg(NO3)2•6H2O) and aluminum nitrate nonahydrate ((Al(NO3)3•9H2O) employed for the respective samples were 6.32:9.25, 7.12:8.33, 7.83:7.50, and 8.77:6.42 for CuMg60Al40O x , CuMg70Al30O x , CuMg75Al25O x , and CuMg80Al20O x , respectively. The mixture of metal precursors was dissolved in 200 mL of methanolic solution (50 %v/v, MeOH in H2O), referred to as solution A. Meanwhile, 0.0142 g/mL of sodium carbonate (Na2CO3) and 0.0177 g/mL of sodium hydroxide (NaOH) were mixed thoroughly in 200 mL of methanolic solution (solution B) to control the pH during the CuLDHs formation. Subsequently, solutions A and B were added dropwise (2 mL/min) into 200 mL methanolic solution under vigorous stirring. The pH of the mixture solution was maintained at 10±0.3. The suspension was stirred at the same pH for an additional 10 min. The slurry was then transferred into an HDPE bottle (1 L) and aged at 65 °C for 24 h without stirring. The solid underwent aging, filtration, and washing with DI water until neutral pH. The resulting CuLDHs solid was dried at 90 °C for 24 h and denoted as CuMgAlO x -pre. To obtain mixed metal oxide catalysts, the CuMgAlO x -pre were calcined under air (60 mL/min) at 550 °C (2 °C /min) for 12 h, denoted as CuMgAlO x . Prior to catalytic testing, all CuMgAlO x catalysts were reduced at 250 °C under H2 gas flow (60 mL/min) for 2 h. 2.3 Material characterization The surface area was determined using an N2 adsorption-desorption analyzer (TOP200, Altermira instruments), following the Brunauer–Emmett–Teller (BET) method. Briefly, ∼50 mg of samples was evacuated at 100 °C for 12 h, and then nitrogen was introduced at −196 °C for the N2 adsorption-desorption experiment. Copper (Cu), magnesium (Mg), and aluminum (Al) contents were determined using inductively coupled plasma-optical emission spectrometry (ICP-OES, Avio 500 Max, PerkinElmer). The sample (∼0.05 g) was digested in a solution mixture of 30 mL sulfuric acid (H2SO4) and 15 mL nitric acid (HNO3). The mixture was then heated at 210 °C for 12 h with a heating rate of 2 °C/min. After digestion, the solution was filtered and diluted with deionized water. The weight loss of the samples was evaluated using a thermogravimetric analyzer (TGA/DSC1, Mettler Toledo). Roughly, ∼30 mg of a sample was placed in a micro crucible and heated under N2 from 50 to 900 °C at a rate of 10 °C/min. The structural identity and crystallite sizes of all samples were measured by X-ray powder diffraction (XRD, SmartLab, Rigaku), using Cu K α 1.54441 Å, Kβ filter 1D for Cu (0.4970) with a step width of 0.0100°, and a speed of 50°/min. The acquisition time was set to 2 min. Transmission electron microscopy (TEM) using a TECNAI G2 20 (FEI) and energy-dispersive X-ray spectroscopy (EDX) mapping images was employed to investigate the topology of the catalyst. ∼10 mg of the sample was dispersed in ethanol and sonicated for 1 min. Following sonication, 50 µL of the solution was deposited onto a nickel grid supported by a carbon film and then allowed to dry under ambient conditions. The NH3 temperature programmed desorption (NH3-TPD) was conducted using a custom-made instrument to assess the acid strength and acidity of the samples with 1 % NH3/Ar, which was equipped with a thermal conductivity detector (VICI, Valco instrument). Prior to the experiment, ∼50 mg of the CuMgAlO x catalyst was reduced at 250 °C for 2 h (10 °C/min) under H2. After cooling down to room temperature, it was exposed to 1 % NH3/Ar for 1 h (60 mL/min) and flushed with He gas (1 h) to remove excess NH3. Finally, the desorption of NH3 (NH3-TPD) was detected from 50 to 900 °C. The TCD signal was recorded in both the heating and cooling steps and calibrated using HZSM-5 as a standard. The reducibility of samples was determined by the temperature program reduction (H2-TPR) using a custom-made instrument equipped with a thermal conductivity detector (VICI, Valco instrument). First, CuMgAlO x sample (∼50 mg) was calcined in air (60 mL/min) at 550 °C (2 °C/min) for 12 h, then cooled down to room temperature under N2. Subsequently, it was heated under 10 % H2/Ar from 80 to 900 °C (10 °C/min). The TCD signal was recorded in both the heating and cooling steps and calibrated using CuO as a standard. Additionally, a standard pulse containing 1 % H2/Ar gas was injected after each H2-TPR analysis. The dissociated N2O adsorption technique was employed to estimate Cu dispersion [40]. This method is analogous to H2-TPR. After calcination at 550 °C (2 °C/min), the first H2-TPR was performed from 80 °C to 350 °C (10 °C/min) under 10 % H2/Ar (60 mL/min) and held at 350 °C for 2 h, obtaining the first H2-consumption. At this step, all copper species were reduced. Then, the sample was cooled down to 60 °C under N2, and the catalyst surfaces were oxidized using N2O (60 mL/min) at 60 °C for 1 h. After that, an excess N2O was subsequently flushed out with N2 gas at 100 °C for 1 h. The sample was then cooled down to room temperature. A secondary H2-TPR was conducted, similarly to the first H2-TPR. The hydrogen consumption of the primary and secondary H2-TPR could be used to calculate the dispersion of copper on the surface. The dispersion of Cu was determined using the equation presented in Fig. S1 [40]. The consecutive H2-TPR measurements were performed using a custom-made instrument equipped with a thermal conductivity detector (VICI, Valco instrument) to determine the reversible interconversion of Cu+/Cu+-H species in the samples. First, approximately 50 mg of the CuMgAlO x sample was ground to a 20-mesh particle size, packed into a quartz tube, and placed in the reactor's heating zone. The sample was then recalcined under an air flow of 60 mL/min at 550 °C, with a heating rate of 2 °C/min, for 12 h. After calcination, the sample was cooled to room temperature under a nitrogen atmosphere. Next, the sample was heated under a 10 % H2/Ar flow, increasing the temperature from 80 °C to 350 °C at a rate of 10 °C/min and held at 350 °C for 2 h to obtain the first H2 consumption. The system was then purged with nitrogen at 60 mL/min and left at room temperature for 24 h without exposure to air. After this, the heating process was repeated under the same conditions, again using a flow of 10 % H2/Ar from 80 °C to 350 °C, holding at 350 °C for 2 h to obtain the second H2 consumption. This process was repeated for the third and fourth measurements. In situ H2 evolution experiment was performed to confirm the reversible interconversion. Approximately 5–6 mg of the catalyst was subjected to pretreatment under a mixed O2/N2 flow (12 mL/min O2 and 48 mL/min N2) at 400 °C for 2 h. Following this, the sample was cooled to room temperature under N2 (48 mL/min). After that, the sample was reduced under 10 % H2 in N2 (60 mL/min) 250 °C for 2 h with the heating rate of 10 °C/min. Then, the sample was cooled to room temperature under N2 (48 mL/min). Post-reduction, residual hydrogen in the gas phase was purged by flowing N2 at 60 mL/min until hydrogen was no longer detected in the effluent. Temperature-programmed desorption (TPD) experiments were conducted by heating the catalyst from room temperature to 400 °C at a rate of 10 °C/min under an N2 flow of 60 mL/min. The system was held at 400 °C for 30 min. Throughout the process, concentrations of hydrogen (mass 2), nitrogen (mass 28), and water (mass 18) were continuously monitored using a quadrupole mass spectrometer (PFEIFFER VACUUM - PrismaPlus® QMG 220 F with Faraday detector), calibrated against standard mixtures. In situ time-resolved X-ray absorption near edge spectroscopy (in situ TR-XANES) was performed at BL2.2: TRXAS, Synchrotron Light Research Institute (SLRI), Thailand to determine the Cu species (Cu0/Cu+). An energy-dispersive monochromator and position-sensitive detector were employed to perform XANES measurement. The Cu K-edge XANES spectra were collected using the integration time of 2000 ms with an average of 10 scans. The composition of Cu species on the catalysts was estimated by Linear Combination Fitting (LCF) over Athena software using Cu foil, Cu2O, CuO, and CuSO4 as a standard. The LCF was fit in the range of 8962–9042 eV, while E0 was not allowed to float. The fitting was forced to obtain the sum of total composition to one within R factor <0.05, using the Athena software of XANES spectra. 2.4 Catalytic testing The selective hydrogenation of methyl palmitate was carried out in a fixed-bed reactor under the atmospheric pressure of H2. Prior to performing the reaction, the catalyst precursor (CuMgAlO x -pre) was first calcined at 550 °C under air (60 mL/min). Then, 0.25 g of the CuMgAlO x catalyst was packed in the reactor and recalcined under air (60 mL/min) at 550 °C for 12 h. It was subsequently treated under H2 with a flow rate of 60 mL/ min at 250 °C for 2 h. After that, 10 % w/w methyl palmitate (MP) in n-dodecane was introduced at a feed rate of 2.4 mL/h at 250 °C under H2 (180 mL/min). The reactor outlet was heated at 70 °C to prevent product solidification and collected to analyze by gas chromatography (GC-FID) using a DB-1 capillary column. Conversion, yield, selectivity, hydrogenation activity, and alcohol production rate were calculated by the following equation: MP conversion ( % ) = mol of M P 0 − mol of M P t mol of M P 0 × 100 Yield ( % ) = mol of product A t mol of M P 0 × 100 Selectivity ( % ) = Yield of product A ( % ) MP conversion ( % ) × 100 Hydrogenation rate ( mmolfeed / h · gcat ) = mmol of converted MP ( mmol / h ) weight of catalyst ( g ) Alcohol production rate ( h − 1 ) = weight of hexadecanol production ( g / h ) weight of catalyst ( g ) Mass balance ( % ) = Total yield Conversion × 100 3 Results and discussion 3.1 Characterizations XRD patterns of Cu containing layered double hydroxides samples, CuMgAlO x -pre (Fig. 1 ) with the various M2+/M3+ molar ratios from 2.2 to 4.8 (Table 1 ) showed the LDHs characteristic diffraction peaks similar to those reported in the literature [41]. The 2θ values at 11°, 24°, 35°, 38°, 46°, 60°, and 62° corresponded to Mg-Al LDHs phases (Fig. S2) at 003, 006, 009, 105, 108, 110 and 113, respectively. Since no crystalline phases of MgO, CuO, or Al2O3 were observed, the incorporated Cu2+ likely substituted Mg2+ in the cationic octahedral layers, which were sandwiched by anionic layers (CO3 2− and water), as shown in Scheme 1 . Moreover, a slightly broader peak indicating the lower and smaller crystallite size, was obtained (Fig. 1) when the Al content increases (in other words Mg content decreases) from CuMg80Al20O x to CuMg60Al40O x (Table S1). In fact, Table 2 shows that CuMg60Al40O x has a crystallite size of ∼8 nm, while CuMg70Al30O x , CuMg75Al25O x , and CuMg80Al20O x for whitin the range of ∼11–12 nm. This is presumably because a lower M2+/M3+ molar ratio of CuMg60Al40O x (2.23, Table 1) contains fewer M2+ species than conventional LDHs (Mg6Al2(OH)16CO3, M2+/M3+ = 3). Hence, the octahedral sheets would contain relatively more Al3+, resulting in cationic layers with a higher positive charge. Accordingly, more exchangeable anionic species must be counterbalanced, and higher water content would be retained in the interlayers. Thus, a more labile structure would be obtained for CuLDHs with high Al content. In line with this view, the initial weight loss (50–200 °C), presumably from the absorbed water (Table 2 and Fig. S3) increases with the Al contents (CuMg80Al20O x < CuMg75Al25O x < CuMg70Al30O x < CuMg60Al40O x ). The carbonate content was derived from TGA at 200–500 °C, decomposition of interlayered carbonates and 500–700 °C for decomposition of highly stable carbonates, Table 2. It is noted that all samples were similar range (∼24–28 wt.%), suggesting that the hydroxides (OH−) would be increased to counterbalance the cationic layers with higher Al contents. Accordingly, the higher water content would be obtained, presumably due to the higher hydrogen bonding within highly polarized interlayers. Thus, the water content is inversely proportional to the (Cu2++Mg2+)/Al3+ molar ratio. After calcination at 550 °C, the collapse of the LDHs structure was observed for all samples (Fig. 2 a). The surface area is in the range of 100–150 m2/g with the interparticle void of 32–36 nm was observed for typical CuMgAlO x catalysts (Table 1, Fig. S4) [35,42–45]. Only the periclase (MgO) peaks were detected in the XRD at 2θ = 35°, 43°, and 64°. The peak intensity increases with the increase in M2+/M3+ molar ratio (CuMg60Al40O x < CuMg70Al30O x < CuMg75Al25O x < CuMg80Al20O x ) due to the increase in Mg2+ content (Table 1). Interestingly, neither crystalline peaks of CuO nor Al2O3 were observed despite the high Cu and Al content (∼17 wt.%, 7–11 wt.%, respectively). This indicates that the Cu2+ and Al3+ species could be highly dispersed over MgO crystallites. Since the Cu2+ and Al3+ species in CuLDHs are discretely located in the octahedral sites, the strong Cu interaction of Cu2+-MgO or Cu2+-Al2O3 would be expected, preventing CuO agglomeration after the calcination, as also mentioned in the literature [35]. A higher Al3+ content not only decreases the crystallinity of the CuMgAlO x but also suppresses the reducibility of Cu2+ species, as seen from H2-TPR in Fig. 3 . At high Al3+ content, the broad reduction peak of Cu2+ to Cu0 was observed at ∼253 °C for CuMg60Al40O x and CuMg70Al30O x (Fig. 3i and ii). On the other hand, a lower reduction temperature (∼222–225 °C, Fig. 3iii and iv) was detected for MgO-rich samples (CuMg75Al25O x and CuMg80Al20O x ). This could be attributed to the stronger interaction between Cu2+ and Al3+ (presumably Cu2+-Al2O3) than Cu2+ and Mg2+ (Cu2+-MgO) [46]. In a supportive manner, a high reduction temperature (249 °C) was reported for Cu-impregnated Al2O3 (Cu/Al2O3) [47], while Cu doped on MgO (Cu/MgO) showed a reduction temperature at ∼215 °C as in Fig. S5. Despite the higher Cu2+ reduction temperatures of CuMgAlO x samples with lower M2+/M3+ molar ratios, the highly dispersed Cu particles were obtained for all samples. None of the metallic Cu phases were detected in the XRD even at this high Cu loading (∼17 wt.%, Fig. 2b). TEM analysis showed the ultrafine Cu nanoparticles highly dispersed on the folded sheet structures of mixed oxides, as depicted in Fig. 4 . This could indicate that, after the calcination, the lamellar structure of Cu2+ oxide may well be disintegrated within the collapsed LDH layers, due to the strong interaction between Cu and Al2O3. Then, the ruptured Cu2+ oxide sheets would be reduced to Cu nanoparticles within the confined mixed oxide matrix. In line with this view, the exceptionally high Cu dispersion (>70 %, determined by the N2O-dissociative reaction in Fig. 5 ) was obtained from all samples. Moreover, the Cu dispersion (72 % to 93 %, Table 1) was increased with Mg2+ content (CuMg60Al40O x to CuMg80Al20O x ). The amount of H2 consumption in H2-TPR is equivalent to the Cu loadings assuming that all Cu2+ species are completely reduced to Cu0 (Table 1). However, the in situ time-resolved X-ray absorption near-edge spectroscopy (in situ TR-XANES) of CuMg75Al25O x evidences the large fraction of Cu+ species (Fig. 6 ). It can be seen that the Cu K-edge energy of the reduced sample appears at 8983.2 eV with a pre-edge feature of 8980.6 eV, which is relatively close to the value of the Cu2O standard. The linear combination fitting (LCF) indicated that the in situ reduced CuMg75Al25O x still contained 70 % of Cu+ species with only 30 % of metallic Cu species despite the reduction at 250 °C for 2 h. One could expect that the samples with 70 % Cu+ species would consume much lower H2. The inconsistency between the H2 consumption and the presence of remaining Cu+ species in the reduced sample implied that the formed Cu+ species could further dissociate H2 to form copper(I) hydride (Cu+-H) species upon the reduction (Scheme 2 ). Accordingly, the reduction of Cu2+ to form Cu+-H would consume 1 equivalence mole of H2. Nevertheless, the produced Cu+-H species are relatively unstable and could reversibly decompose into Cu+ and H2 under an inert atmosphere so-called “reversible interconversion” [38,39]. To prove the reversible interconversion of Cu+/Cu+-H species, the samples were subjected to H2-TPR at 350 °C for 2 h, then purged under N2 at room temperature for 24 h. Without exposing the sample to air, the consecutive H2-TPR was performed. As expected, none of the secondary H2 consumption was observed for the typical CuO since the metallic Cu was completely formed during the 1st H2-TPR (Fig. 7 i). In sharp contrast, all CuMgAlO x samples showed a secondary H2 consumption at a relatively lower temperature (150–160 °C, Fig. 7ii–v) than the first reduction temperature (220–250 °C). The secondary reduction is in the same range for reducing surface Cu2O (∼150 °C) as observed in the N2O-dissociative reaction profiles (Fig. 5). The observed secondary H2 consumption without exposing the sample to air suggested that the lamellar structure of Cu2+ oxide could be reduced to the metallic Cu and Cu+-H species during the 1st H2-TPR (Scheme 2). After purging under N2, the Cu+-H (species III) could decompose into Cu+ (species IV) and H2. Accordingly, the secondary H2 consumption for Cu+ was evidenced to regenerate Cu+-H species at a lower temperature. This process can be repeated for at least three consecutive cycles with the same H2 consumption (0.91 mmol/g in Fig. 8 ), emphasizing the reversible interconversion of Cu+/Cu+-H of all CuMgAlO x samples. In addition, the evolution of H2 from the Cu+-H species was detected using a quadrupole mass spectrometer (Q-MS) on the reduced CuMg75Al25O x during heating. This observation is illustrated in Fig. S6. The amount of Cu+/Cu+-H can be quantified from the secondary H2 consumption (A2) obtained during the reversible interconversion as represented in Eq. (1). (1) x 2 H 2 + x C u + → x C u + − H The first H2 consumption (A1) is the reduction of Cu2+ to metallic Cu and Cu+-H as shown in Eq. (2), where x is the fraction of Cu+ in the sample. (2) ( x ) H 2 + ( 1 − x ) H 2 + C u 2 + → x C u + − H + ( 1 − x ) C u 0 Since, half equivalent of H2 is consumed for Cu2+ to Cu+, and another half equivalent of H2 was used for Cu+ to Cu+-H. The fraction of Cu+ in the sample (x) can be calculated from 2 mol of H2 consumed for Cu+ to Cu+-H in Eq. (1) divided by the total mol of H2 consumed for reduction of Cu2+ in Eq. (2). x = 2 A 2 / A 1 It is noted that the fraction of metallic Cu in the sample can be calculated from 1−x. During the N2O-dissociative reaction, not only the surface metallic Cu would be oxidized to Cu+ surface (s), but also the Cu+-H (x) would be decomposed to Cu+ as shown in Eq. (4) (4) x CuH + ( 1 − x ) C u 0 → x C u + + s C u + surface + ( 1 − x − s ) C u 0 b u l k Therefore, the observed secondary H2 consumption in Fig. 5 is not solely derived from the reduction of the partially oxidized Cu surface (Cu+ surface) because it would include the additional H2 dissociation on remaining Cu+ to form Cu+-H species. Accordingly, the hydrogen consumption after N2O dissociative adsorption (A 3) would be a combination of the hydrogen consumption for the Cu+-H (A 2) and Cu+ surface as shown in Eq. (5). (5) x 2 H 2 + s 2 H 2 + x C u + + s C u + surface → x CuH + s C u 0 surface Hence, the hydrogen consumption of Cu+ surface (A s) can be deduced from the H2 consumed in Eq. (5) (A 3) subtracted with the hydrogen consumption of Cu+ (A 2) as below. A s = A 3 − A 2 Accordingly, the fraction of metallic Cusurface (s) could be derived from the Cu+ surface, which can be calculated from 2 mol of As, over the total hydrogen consumption of Cu2+ in the first H2-TPR (A1). s = 2 ( A 3 − A 2 ) / A 1 The amount of Cu+, metallic Cu, and Cusurface of all samples can be calculated and summarized in Table 3 , the fraction of Cu+ and metallic Cu obtained from this calculation is also in line with the result from in situ TR-XANES (70 % Cu+ and 30 % Cu0 in Fig. 6). Therefore, the Cu species remaining in CuMgAlO x can be determined from the combination of H2-TPR, N2O-TPR, and consecutive H2-TPR with the calculation described above. From Table 3, all CuMgAlO x samples contain relatively high amounts of Cu+/Cu+-H species (50–86 %). The higher the Mg2+ content the higher the amount of Cu+/Cu+-H species and the lower the metallic Cu species. This could indicate that the importance of Cu2+-MgO interaction in CuMgAlO x that allows Cu2+ species to disperse and share the same lattice parameter as MgO, evidenced by the XRD. This prevents the formation of the bulk CuO and Cu-Al2O3 (copper aluminate) after the calcination. Even though the metallic Cu content decreased, the Cu metal dispersion increased with the increase in Mg2+ content. This again suggested that the strong interaction Cu2+-MgO at a high Mg2+ content led to the smaller metallic Cu particle (presumably Cu clusters), as evidenced by the lower reduction temperature in the H2-TPR (Fig. 5). 3.2 Selective hydrogenation of methyl palmitate The similar hydrogenation activity of CuMg60Al40O x and CuMg70Al30O x was observed (∼53–54 % conversion, Table 4 , entry 1–2), due to the similar Cu dispersion (∼40 %, Table 3). Hexadecanol (C16-OH, ∼42 % yield) was obtained as a main product (∼80 % selectivity). While only ∼6 % yield of hexadecanal (C16-al), ∼6 % yield of hexadecene (C16-1-ene) and iso-hexadecene (iso-C16-ene) was obtained. This clearly showed that CuMg60Al40O x and CuMg70Al30O x provided high selective hydrogenation of fatty acid methyl esters to alcohols. This could be attributed to the relatively high Cu+ content in these two samples which particularly promotes η 1-adsorption of CO that could undergo hydrogenation to an alcohol (Scheme 2). Furthermore, the weak interaction between the produced alcohol and Cu+ facilitates alcohol desorption. The Cu+ species also prevents alcohol re-adsorption and suppresses dehydration/isomerization to form hydrocarbon by-products. Only trace hexadecanal, the primary product (Scheme 3 ), was obtained over CuMg60Al40O x and CuMg70Al30O x . This could indicate that the hydrogenation rate of aldehydes would be faster than the esters, as mentioned in the literature [48]. Nevertheless, the observed hexadecene and iso-hexadecene suggested the dehydration-isomerization of hexadecanol, promoted by the acid sites, presumably the surface AlOH. In a supportive manner, a trace amount of acid sites (<10 µmol/g) in CuMg60Al40O x and CuMg70Al30O x were detected by NH3-TPD (Fig. S7). As the Mg2+/Al3+ ratio increased, a higher hydrogenation activity of CuMg75Al25O x (57 % conversion, Table 4 entry 3) was observed, as compared to those of CuMg60Al40O x and CuMg70Al30O x (∼53–54 % conversion). This could be attributed to the Cu dispersion of CuMg75Al25O x (85 %, Table 3, entry 3) than that of CuMg60Al40O x and CuMg70Al30O x (72–81 %). In line with this view, a lower C16-al (from ∼7 % to ∼3 %) was obtained, presumably due to a higher CO hydrogenation activity. The higher yield of C16-OH (∼10 %) was obtained with only a trace amount of C16-ene. This could be attributed to the higher Cu+/Cu+-H species in CuMg75Al25O x to desorb the alcohol and prevent its re-adsorption. However, the excess Cu+/Cu+-H species in CuMg80Al20O x led to a lower activity due to the relatively less metallic Cu (∼7 %). Accordingly, the lower C16-OH yield (28 %) was observed with only trace amount of C16-ene. Accordingly, a balance of active Cu surface (Cusurface) and cationic Cu(I) species (Cu+/Cu+-H species) appears to play an important role in the selective hydrogenation of methyl palmitate to hexadecanol. As the reducibility of the CuMgAlO x can be regulated by the Mg2+/Al3+ ratio (Fig. 3), the fraction of Cu surface and Cu+ species retained in each sample can be modulated (Table 3). The ratio between Cusurface and cationic Cu(I) species (Cu+/Cu+-H) would affect the selective hydrogenation activity, as shown in Fig. 9 . Even though cationic Cu(I) species govern the feed adsorption/activation and alcohol desorption, metallic Cu species are still required. The more metallic the Cu surface, the higher conversion, up to the Cusurface/Cu(I) ratio of 0.25. This can be attributed to the hydrogen dissociation ability of the available metallic Cu surface, in addition to Cu+/Cu+-H species that facilitate the feed adsorption/activation, as discussed earlier. However, the Cusurface/Cu(I) ratio above 0.25 leads to a decline in overall hydrogenation activity. This is presumably due to the limited cationic Cu(I) species to interact with the methyl palmitate, despite the sufficient metallic Cu surface. Comparing the hydrogenation in a flow reactor, the CuMg75Al25O x catalysts provide a much higher alcohol selectivity (∼90 %, Table 5 ) than other Cu-based catalysts (<60 %). Despite that competitive adsorption of alcohols can be generally facilitated in a flow system, the presence of the Cu+/Cu+-H species in CuMgAlO x can prevent the alcohol re-adsorption that leads to side reactions, i.e., dehydration, and isomerization. Moreover, the alcohol selectivity obtained in this study (∼90 %, Table 5) is comparable to those operated in the batch reactor (>80 %). This is because the alcohol re-adsorption is inhibited in a manner similar to the reaction in the liquid phase, where the alcohol re-adsorption is inhibited by much stronger adsorption of an ester-feed. This emphasizes the key role of cationic Cu(I) species (Cu+/Cu+-H) in the selective hydrogenation of esters to alcohols. In addition to the high alcohol selectivity, the CuMgAlO x catalysts provide relatively high stability (Figs. 10 and 11 ), as compared to other Cu-based catalysts, i.e., CuO [49], CuCr2O4 [50], Cu/SiO2 [30], 20CuPS [30], 0.05KCuPS [31], 1 %Pd–Cu(3:1)/diatomite [51], and Cu/m-ZrO2 [49], that generally suffer from deactivation. Especially, CuMg75Al25O x showed the steady conversion and yields over 100 h, as depicted in Fig. 11. This could be attributed to the high content of Cu+ species in these catalysts (>50 %, Table 3) that is reversibly interconverted to Cu+-H species under hydrogen. The reversible interconversion between Cu+ and Cu+-H allows the simultaneous hydrogen dissociation/evolution on the catalyst surface in a manner similar to that observed over Pd-based catalysts [52,53]. This phenomenon could prevent the hydrogen transfer from any carbon source (esters, alcohols, alkenes, etc.) that leads to the formation of carbonaceous deposits. Thus, the surface remains always available for feed adsorption/activation. 4 Conclusions Layered double hydroxides derived CuMgAlO x catalysts provide highly selective hydrogenation of fatty acid methyl esters (FAMEs) to fatty alcohol (up to 92 % selectivity) in a fixed-bed reactor under atmospheric H2. The lamellar structure of Cu2+ oxide in all CuLDHs samples was well disintegrated over the collapsed LDH layers after calcination, due to a strong interaction of Cu2+ with the confined mixed oxides. The ruptured Cu2+ oxide sheets were partially reduced to a mixture of cationic Cu(I) species and highly dispersed Cu nanoparticles. Cationic Cu(I) species show reversible interconversion of Cu+ and Cu+-H species under H2 due to the strong interaction with the confined mixed oxide sheets. The combination of H2-TPR, consecutive H2-TPR, and N2O-dissociative reaction allows the new approach to quantitatively determine the Cu species, including cationic Cu(I) species (Cu+/Cu+-H), metallic Cu, and Cusurface, which can be validated by the in situ TR-XANES. The higher the Mg2+ content (CuMg60Al40O x < CuMg70Al30O x < CuMg75Al25O x < CuMg80Al20O x ), the higher the amount of cationic Cu(I) species (54 % <66 % < 68 % < 86 %), and the higher Cu dispersion (72 % < 81 % < 85 %, ∼93 %). The cationic Cu(I) species in CuMgAlO x catalysts promote η 1-adsorption and hydrogenation of CO esters. They also prevent alcohol re-adsorption, leading to high fatty alcohol selectivity. Nevertheless, the hydrogenation activity depends on the balance between the Cusurface and cationic Cu(I) species. The optimal Cusurface/Cu(I) ratio of 0.25 (CuMg75Al25O x ) results in a hydrogenation rate of 1.53 mmol/h⋅gcat and an alcohol production rate of 49.3 h−1. The excessive cationic Cu(I) species (Cusurface/Cu(I) ratio < 0.25) lead to lower hydrogenation activity due to the limited Cu surface for hydrogen dissociation. The reversible interconversion between Cu+ and Cu+-H allows simultaneous hydrogen dissociation/evolution for high catalyst stability. CRediT authorship contribution statement Chanisara Nooto: Validation, Methodology, Formal analysis, Data curation. Panalee Chuaykaew: Formal analysis, Data curation. Pawanrat Singthuen: Formal analysis, Data curation. Thanasak Solos: Formal analysis. Yardthip Preedawichitkun: Data curation. Kanyanat Khosukwiwat: Data curation. Kanokwan Wengwirat: Data curation. Pratya Promchana: Formal analysis, Data curation. Raju Kumar: Validation. Po-Wen Chung: Validation, Conceptualization. Yingyot Poo-arporn: Validation. Wanwisa Limphirat: Validation. Kittisak Choojun: Writing – review & editing, Writing – original draft, Validation, Supervision, Methodology, Investigation, Funding acquisition, Formal analysis, Conceptualization. Tawan Sooknoi: Writing – review & editing, Writing – original draft, Supervision, Funding acquisition, Conceptualization. Declaration of competing interest The authors declare that they have no known competing financial interests or personal relationships that could have appeared to influence the work reported in this paper. Acknowledgments We would like to thank King Mongkut's Institute of Technology Ladkrabang (KMITL), In addition, this project is funded by the National Research Council of Thailand (NRCT) and King Mongkut's Institute of Technology Ladkrabang (KMITL): (N42A660796). Moreover, this work is supported by Synchrotron Light Research Institute (Public Organization), Thailand, for the in situ TR-XANES experiments (Beamline 2.2) and the Scientific Instruments Center, School of Science, KMITL for the characterizations. Supplementary materials Supplementary material associated with this article can be found, in the online version, at doi:10.1016/j.mcat.2025.114898. Appendix Supplementary materials Image, application 1 References [1] Fatty alcohol. https://www.ggcplc.com/en/businesses/fatty-alcohol (accessed March 28, 2024). [2] Fatty alcohol (CHEBI:24026). https://www.ebi.ac.uk/chebi/searchId.do?chebiId=24026 (accessed March 18, 2024). [3] Fatty alcohol market size, growth | analysis report, 2030. https://www.chemanalyst.com/industry-report/fatty-alcohol-market-634 (accessed September 27, 2024). [4] Fatty alcohols market size, industry key players, & scenario by 2029. https://www.databridgemarketresearch.com/reports/global-fatty-alcohol-market (accessed September 27, 2024). [5] J. Kobayashi M. Ishibashi Bioactive metabolites of symbiotic marine microorganisms Chem. Rev. 93 1993 1753 1769 10.1021/cr00021a005 J. Kobayashi, M. Ishibashi, Bioactive metabolites of symbiotic marine microorganisms, Chem. Rev. 93 (1993) 1753–1769. https://doi.org/10.1021/cr00021a005. [6] R. Kumar S.H. Chikkali Hydroformylation of olefins by metals other than rhodium J. Organomet. Chem. 960 2022 122231 10.1016/j.jorganchem.2021.122231 R. Kumar, S.H. Chikkali, Hydroformylation of olefins by metals other than rhodium, J. Organomet. Chem. 960 (2022) 122231. https://doi.org/10.1016/j.jorganchem.2021.122231. [7] L. Liu H. Gao S.-Q. Yang X.-C. Chen Y. Lu Y. Liu F. Xia Ir-catalyzed tandem hydroformylation-transfer hydrogenation of olefins with (trans-/cis-)formic acid as hydrogen source in presence of 1,10-phenanthroline J. Catal. 385 2020 183 193 10.1016/j.jcat.2020.03.008 L. Liu, H. Gao, S.-Q. Yang, X.-C. Chen, Y. Lu, Y. Liu, F. Xia, Ir-catalyzed tandem hydroformylation-transfer hydrogenation of olefins with (trans-/cis-)formic acid as hydrogen source in presence of 1,10-phenanthroline, J. Catal. 385 (2020) 183–193. https://doi.org/10.1016/j.jcat.2020.03.008. [8] Y. Zhang L. Liu Z. Wang X. Zhang X. He H. Ji Tandem hydroformylation/hydrogenation of olefins to alcohols using atomically dispersed bifunctional catalysts Sci. China Chem. 67 2024 3706 3711 10.1007/s11426-024-2135-y Y. Zhang, L. Liu, Z. Wang, X. Zhang, X. He, H. Ji, Tandem hydroformylation/hydrogenation of olefins to alcohols using atomically dispersed bifunctional catalysts, Sci. China Chem. 67 (2024) 3706–3711. https://doi.org/10.1007/s11426-024-2135-y. [9] Home, ICIS Explore. https://www.icis.com/explore/(accessed January 11, 2025). [10] Market Research Reports & Consulting | Grand View Research, Inc. https://www.grandviewresearch.com/(accessed January 11, 2025). [11] S&P Global Commodity Insights, S&P Global Commodity Insights. https://www.spglobal.com/commodity-insights/en (accessed January 11, 2025). [12] C. Team, ChemLinked | Global regulatory & market intelligence expertise, ChemLinked. http://www.chemlinked.com/(accessed January 11, 2025). [13] L. Boateng R. Ansong W.B. Owusu M. Steiner-Asiedu Coconut oil and palm oil's role in nutrition, health and national development: a review Ghana Med. J. 50 2016 189 196 L. Boateng, R. Ansong, W.B. Owusu, M. Steiner-Asiedu, Coconut oil and palm oil's role in nutrition, health and national development: a review, Ghana Med. J. 50 (2016) 189–196. [14] V. Itthibenchapong A. Srifa K. Faungnawakij Heterogeneous catalysts for advanced biofuel production M. Rai S.S. da Silva Nanotechnology for Bioenergy and Biofuel Production 2017 Springer International Publishing Cham 231 254 10.1007/978-3-319-45459-7_11 V. Itthibenchapong, A. Srifa, K. Faungnawakij, Heterogeneous catalysts for advanced biofuel production, in: M. Rai, S.S. da Silva (Eds.), Nanotechnology for Bioenergy and Biofuel Production, Springer International Publishing, Cham, 2017: pp. 231–254. https://doi.org/10.1007/978-3-319-45459-7_11. [15] F. Beshkar S. Zinatloo-Ajabshir M. Salavati-Niasari Preparation and characterization of the CuCr2O4 nanostructures via a new simple route J. Mater. Sci. 26 2015 5043 5051 10.1007/s10854-015-3024-1 F. Beshkar, S. Zinatloo-Ajabshir, M. Salavati-Niasari, Preparation and characterization of the CuCr2O4 nanostructures via a new simple route, J. Mater. Sci. 26 (2015) 5043–5051. https://doi.org/10.1007/s10854-015-3024-1. [16] R. Rao A. Dandekar R.T.K. Baker M.A. Vannice Properties of copper chromite catalysts in hydrogenation reactions J. Catal. 171 1997 406 419 10.1006/jcat.1997.1832 R. Rao, A. Dandekar, R.T.K. Baker, M.A. Vannice, Properties of copper chromite catalysts in hydrogenation reactions, J. Catal. 171 (1997) 406–419. https://doi.org/10.1006/jcat.1997.1832. [17] A.A. Khasin T.M. Yur'eva L.M. Plyasova G.N. Kustova H. Jobic A. Ivanov Y.A. Chesalov V.I. Zaikovskii A.V. Khasin L.P. Davydova V.N. Parmon Mechanistic features of reduction of copper chromite and state of absorbed hydrogen in the structure of reduced copper chromite Russ. J. Gen. Chem. 78 2008 2203 2213 10.1134/S1070363208110418 A.A. Khasin, T.M. Yur'eva, L.M. Plyasova, G.N. Kustova, H. Jobic, A. Ivanov, Y.A. Chesalov, V.I. Zaikovskii, A.V. Khasin, L.P. Davydova, V.N. Parmon, Mechanistic features of reduction of copper chromite and state of absorbed hydrogen in the structure of reduced copper chromite, Russ. J. Gen. Chem. 78 (2008) 2203–2213. https://doi.org/10.1134/S1070363208110418. [18] M. Snåre I. Kubičková P. Mäki-Arvela K. Eränen D.Y. Murzin Heterogeneous catalytic deoxygenation of stearic acid for production of biodiesel Ind. Eng. Chem. Res. 45 2006 5708 5715 10.1021/ie060334i M. Snåre, I. Kubičková, P. Mäki-Arvela, K. Eränen, D.Y. Murzin, Heterogeneous catalytic deoxygenation of stearic acid for production of biodiesel, Ind. Eng. Chem. Res. 45 (2006) 5708–5715. https://doi.org/10.1021/ie060334i. [19] L. Wang X. Niu J. Chen SiO2 supported Ni-In intermetallic compounds: efficient for selective hydrogenation of fatty acid methyl esters to fatty alcohols Appl. Catal. B 278 2020 119293 10.1016/j.apcatb.2020.119293 L. Wang, X. Niu, J. Chen, SiO2 supported Ni-In intermetallic compounds: efficient for selective hydrogenation of fatty acid methyl esters to fatty alcohols, Appl. Catal. B 278 (2020) 119293. https://doi.org/10.1016/j.apcatb.2020.119293. [20] Z. Dong J. Zhao Y. Tian B. Zhang Y. Wu Preparation and performances of ZIF-67-derived FeCo bimetallic catalysts for CO2 hydrogenation to light olefins Catalysts 10 2020 455 10.3390/catal10040455 Z. Dong, J. Zhao, Y. Tian, B. Zhang, Y. Wu, Preparation and performances of ZIF-67-derived FeCo bimetallic catalysts for CO2 hydrogenation to light olefins, Catalysts 10 (2020) 455. https://doi.org/10.3390/catal10040455. [21] R. Krishnapriya U. Gupta V.K. Soni R.K. Sharma Catalytic conversion of methyl oleate to hydrocarbons: impact of cobalt oxide species integration in SiO2–Al2O3 Sustain. Energy Fuels 4 2020 3308 3317 10.1039/C9SE01221D R. Krishnapriya, U. Gupta, V.K. Soni, R.K. Sharma, Catalytic conversion of methyl oleate to hydrocarbons: impact of cobalt oxide species integration in SiO2–Al2O3, Sustain. Energy Fuels 4 (2020) 3308–3317. https://doi.org/10.1039/C9SE01221D. [22] P. Phichitsurathaworn K. Choojun Y. Poo-arporn T. Sooknoi Deoxygenation of heptanoic acid to hexene over cobalt-based catalysts: a model study for α-olefin production from renewable fatty acid Appl. Catal. A 602 2020 117644 10.1016/j.apcata.2020.117644 P. Phichitsurathaworn, K. Choojun, Y. Poo-arporn, T. Sooknoi, Deoxygenation of heptanoic acid to hexene over cobalt-based catalysts: a model study for α-olefin production from renewable fatty acid, Appl. Catal. A 602 (2020) 117644. https://doi.org/10.1016/j.apcata.2020.117644. [23] D. Liu D. Zemlyanov T. Wu R.J. Lobo-Lapidus J.A. Dumesic J.T. Miller C.L. Marshall Deactivation mechanistic studies of copper chromite catalyst for selective hydrogenation of 2-furfuraldehyde J. Catal. 299 2013 336 345 10.1016/j.jcat.2012.10.026 D. Liu, D. Zemlyanov, T. Wu, R.J. Lobo-Lapidus, J.A. Dumesic, J.T. Miller, C.L. Marshall, Deactivation mechanistic studies of copper chromite catalyst for selective hydrogenation of 2-furfuraldehyde, J. Catal. 299 (2013) 336–345. https://doi.org/10.1016/j.jcat.2012.10.026. [24] C. Zhang L. Wang U.J. Etim Y. Song O.M. Gazit Z. Zhong Oxygen vacancies in Cu/TiO2 boost strong metal-support interaction and CO2 hydrogenation to methanol J. Catal. 413 2022 284 296 10.1016/j.jcat.2022.06.026 C. Zhang, L. Wang, U.J. Etim, Y. Song, O.M. Gazit, Z. Zhong, Oxygen vacancies in Cu/TiO2 boost strong metal-support interaction and CO2 hydrogenation to methanol, J. Catal. 413 (2022) 284–296. https://doi.org/10.1016/j.jcat.2022.06.026. [25] L. Liu C. Zhao Y. Li Spontaneous dissociation of CO2 to CO on defective surface of Cu(I)/TiO2− x nanoparticles at room temperature J. Phys. Chem. C 116 2012 7904 7912 10.1021/jp300932b L. Liu, C. Zhao, Y. Li, Spontaneous dissociation of CO2 to CO on defective surface of Cu(I)/TiO2−x nanoparticles at room temperature, J. Phys. Chem. C 116 (2012) 7904–7912. https://doi.org/10.1021/jp300932b. [26] A. Chen X. Yu Y. Zhou S. Miao Y. Li S. Kuld J. Sehested J. Liu T. Aoki S. Hong M.F. Camellone S. Fabris J. Ning C. Jin C. Yang A. Nefedov C. Wöll Y. Wang W. Shen Structure of the catalytically active copper–ceria interfacial perimeter Nat. Catal. 2 2019 334 341 10.1038/s41929-019-0226-6 A. Chen, X. Yu, Y. Zhou, S. Miao, Y. Li, S. Kuld, J. Sehested, J. Liu, T. Aoki, S. Hong, M.F. Camellone, S. Fabris, J. Ning, C. Jin, C. Yang, A. Nefedov, C. Wöll, Y. Wang, W. Shen, Structure of the catalytically active copper–ceria interfacial perimeter, Nat. Catal. 2 (2019) 334–341. https://doi.org/10.1038/s41929-019-0226-6. [27] P. Sripada J. Kimpton A. Barlow T. Williams S. Kandasamy S. Bhattacharya Investigating the dynamic structural changes on Cu/CeO2 catalysts observed during CO2 hydrogenation J. Catal. 381 2020 415 426 10.1016/j.jcat.2019.11.017 P. Sripada, J. Kimpton, A. Barlow, T. Williams, S. Kandasamy, S. Bhattacharya, Investigating the dynamic structural changes on Cu/CeO2 catalysts observed during CO2 hydrogenation, J. Catal. 381 (2020) 415–426. https://doi.org/10.1016/j.jcat.2019.11.017. [28] Y. Wang S. Deng B. Liu Y. Jin Mechanistic understanding on the role of Cu species over the CuO x /TiO2 catalyst for CO2 photoreduction ACS Omega 5 2020 18050 18063 10.1021/acsomega.0c01533 Y. Wang, S. Deng, B. Liu, Y. Jin, Mechanistic understanding on the role of Cu species over the CuOx/TiO2 catalyst for CO2 photoreduction, ACS Omega 5 (2020) 18050–18063. https://doi.org/10.1021/acsomega.0c01533. [29] Y. Lin S.-N. Zhang Z.-H. Xue J. Zhang H. Su T.-J. Zhao G. Zhai X.-H. Li M. Antonietti J. Chen Boosting selective nitrogen reduction to ammonia on electron-deficient copper nanoparticles Nat. Commun. 10 2019 10.1038/s41467-019-12312-4 Y. Lin, S.-N. Zhang, Z.-H. Xue, J. Zhang, H. Su, T.-J. Zhao, G. Zhai, X.-H. Li, M. Antonietti, J. Chen, Boosting selective nitrogen reduction to ammonia on electron-deficient copper nanoparticles, Nat. Commun. 10 (2019). https://doi.org/10.1038/s41467-019-12312-4. [30] W. Prasanseang K. Choojun Y. Poo-arporn A.-L. Huang Y.-C. Lin T. Sooknoi Linear long-chain α-olefins from hydrodeoxygenation of methyl palmitate over copper phyllosilicate catalysts Appl. Catal. A 635 2022 118555 10.1016/j.apcata.2022.118555 W. Prasanseang, K. Choojun, Y. Poo-arporn, A.-L. Huang, Y.-C. Lin, T. Sooknoi, Linear long-chain α-olefins from hydrodeoxygenation of methyl palmitate over copper phyllosilicate catalysts, Appl. Catal. A 635 (2022) 118555. https://doi.org/10.1016/j.apcata.2022.118555. [31] W. Prasanseang K. Choojun Y. Poo-arporn A.-L. Huang Y.-C. Lin E. Chen H.-H. Lee P.-W. Chung T. Sooknoi Tuning Cu+ species/brønsted acids of copper phyllosilicate by K+ doping for selective hydrogenation of methyl palmitate to hexadecanol J. Catal. 428 2023 115115 10.1016/j.jcat.2023.115115 W. Prasanseang, K. Choojun, Y. Poo-arporn, A.-L. Huang, Y.-C. Lin, E. Chen, H.-H. Lee, P.-W. Chung, T. Sooknoi, Tuning Cu+ species/brønsted acids of copper phyllosilicate by K+ doping for selective hydrogenation of methyl palmitate to hexadecanol, J. Catal. 428 (2023) 115115. https://doi.org/10.1016/j.jcat.2023.115115. [32] R. Kumar H.-H. Lee E. Chen Y.-P. Du C.-Y. Lin W. Prasanseang T. Solos K. Choojun T. Sooknoi R.-K. Xie J.-F. Lee P.-W. Chung Facile synthesis of the atomically dispersed hydrotalcite oxide supported copper catalysts for the selective hydrogenation of 5-hydroxymethylfurfural into 2,5-bis(hydroxymethyl)furan Appl. Catal. B 329 2023 122547 10.1016/j.apcatb.2023.122547 R. Kumar, H.-H. Lee, E. Chen, Y.-P. Du, C.-Y. Lin, W. Prasanseang, T. Solos, K. Choojun, T. Sooknoi, R.-K. Xie, J.-F. Lee, P.-W. Chung, Facile synthesis of the atomically dispersed hydrotalcite oxide supported copper catalysts for the selective hydrogenation of 5-hydroxymethylfurfural into 2,5-bis(hydroxymethyl)furan, Appl. Catal. B 329 (2023) 122547. https://doi.org/10.1016/j.apcatb.2023.122547. [33] J. Li X. Niu Y. Zhu Synergistic effect of surface Cu0 and Cu+ species on improved selective hydrogenation of furfural to furfuryl alcohol over hydrotalcite-derived Cu x Mg3Al oxides Appl. Surf. Sci. 635 2023 157774 10.1016/j.apsusc.2023.157774 J. Li, X. Niu, Y. Zhu, Synergistic effect of surface Cu0 and Cu+ species on improved selective hydrogenation of furfural to furfuryl alcohol over hydrotalcite-derived CuxMg3Al oxides, Appl. Surf. Sci. 635 (2023) 157774. https://doi.org/10.1016/j.apsusc.2023.157774. [34] A. Yin X. Guo W.-L. Dai K. Fan The nature of active copper species in Cu-HMS catalyst for hydrogenation of dimethyl oxalate to ethylene glycol: new insights on the synergetic effect between Cu0 and Cu+ J. Phys. Chem. C 113 2009 11003 11013 10.1021/jp902688b A. Yin, X. Guo, W.-L. Dai, K. Fan, The nature of active copper species in Cu-HMS catalyst for hydrogenation of dimethyl oxalate to ethylene glycol: new insights on the synergetic effect between Cu0 and Cu+, J. Phys. Chem. C 113 (2009) 11003–11013. https://doi.org/10.1021/jp902688b. [35] J. Shi Y. He K. Ma S. Tang C. Liu H. Yue B. Liang Cu active sites confined in MgAl layered double hydroxide for hydrogenation of dimethyl oxalate to ethanol Catal. Today 365 2021 318 326 10.1016/j.cattod.2020.04.042 J. Shi, Y. He, K. Ma, S. Tang, C. Liu, H. Yue, B. Liang, Cu active sites confined in MgAl layered double hydroxide for hydrogenation of dimethyl oxalate to ethanol, Catal. Today 365 (2021) 318–326. https://doi.org/10.1016/j.cattod.2020.04.042. [36] Y. Liu R. Zhou J. Qu F. Han S. Zhang X. Xu Cu nanoparticles-dispersed Mg-Al layered double hydroxides as efficient catalysts for CO2 conversion with propargyl alcohols Appl. Catal. A 630 2022 118444 10.1016/j.apcata.2021.118444 Y. Liu, R. Zhou, J. Qu, F. Han, S. Zhang, X. Xu, Cu nanoparticles-dispersed Mg-Al layered double hydroxides as efficient catalysts for CO2 conversion with propargyl alcohols, Appl. Catal. A 630 (2022) 118444. https://doi.org/10.1016/j.apcata.2021.118444. [37] G. Cui X. Meng X. Zhang W. Wang S. Xu Y. Ye K. Tang W. Wang J. Zhu M. Wei D.G. Evans X. Duan Low-temperature hydrogenation of dimethyl oxalate to ethylene glycol via ternary synergistic catalysis of Cu and acid–base sites Appl. Catal. B 248 2019 394 404 10.1016/j.apcatb.2019.02.042 G. Cui, X. Meng, X. Zhang, W. Wang, S. Xu, Y. Ye, K. Tang, W. Wang, J. Zhu, M. Wei, D.G. Evans, X. Duan, Low-temperature hydrogenation of dimethyl oxalate to ethylene glycol via ternary synergistic catalysis of Cu and acid–base sites, Appl. Catal. B 248 (2019) 394–404. https://doi.org/10.1016/j.apcatb.2019.02.042. [38] A. Ausavasukhi S. Suwannaran J. Limtrakul T. Sooknoi Reversible interconversion behavior of Ag species in AgHZSM-5: XRD, 1H MAS NMR, TPR, TPHE, and catalytic studies Appl. Catal. A 345 2008 89 96 10.1016/j.apcata.2008.04.026 A. Ausavasukhi, S. Suwannaran, J. Limtrakul, T. Sooknoi, Reversible interconversion behavior of Ag species in AgHZSM-5: XRD, 1H MAS NMR, TPR, TPHE, and catalytic studies, Appl. Catal. A 345 (2008) 89–96. https://doi.org/10.1016/j.apcata.2008.04.026. [39] K. Prakobtham K. Choojun P. Promchana S. Sattayaporn T. Sooknoi Role of surface silanols and confinements of siliceous MFI supports on stability of active Ga species for ethane dehydrogenation Appl. Catal. A 638 2022 118625 10.1016/j.apcata.2022.118625 K. Prakobtham, K. Choojun, P. Promchana, S. Sattayaporn, T. Sooknoi, Role of surface silanols and confinements of siliceous MFI supports on stability of active Ga species for ethane dehydrogenation, Appl. Catal. A 638 (2022) 118625. https://doi.org/10.1016/j.apcata.2022.118625. [40] T. Chetty V.D.B.C. Dasireddy L.H. Callanan H.B. Friedrich Continuous flow preferential hydrogenation of an octanal/octene mixture using Cu/Al2O3 catalysts ACS Omega 3 2018 7911 7924 10.1021/acsomega.7b01993 T. Chetty, V.D.B.C. Dasireddy, L.H. Callanan, H.B. Friedrich, Continuous flow preferential hydrogenation of an octanal/octene mixture using Cu/Al2O3 catalysts, ACS Omega 3 (2018) 7911–7924. https://doi.org/10.1021/acsomega.7b01993. [41] Y. Zeng T. Zhang Y. Xu T. Ye R. Wang Z. Yang Z. Jia S. Ju Cu/Mg/Al hydrotalcite-like hydroxide catalysts for o-phenylphenol synthesis Appl. Clay Sci. 126 2016 207 214 10.1016/j.clay.2016.03.017 Y. Zeng, T. Zhang, Y. Xu, T. Ye, R. Wang, Z. Yang, Z. Jia, S. Ju, Cu/Mg/Al hydrotalcite-like hydroxide catalysts for o-phenylphenol synthesis, Appl. Clay Sci. 126 (2016) 207–214. https://doi.org/10.1016/j.clay.2016.03.017. [42] L. Dou H. Zhang Facile assembly of nanosheet array-like CuMgAl-layered double hydroxide/rGO nanohybrids for highly efficient reduction of 4-nitrophenol J. Mater. Chem. A 4 2016 18990 19002 10.1039/C6TA08313G L. Dou, H. Zhang, Facile assembly of nanosheet array-like CuMgAl-layered double hydroxide/rGO nanohybrids for highly efficient reduction of 4-nitrophenol, J. Mater. Chem. A 4 (2016) 18990–19002. https://doi.org/10.1039/C6TA08313G. [43] G. Cui F. Wang S. He M. Wei Catalytic performance of layered double hydroxide nanosheets toward phenol hydroxylation RSC Adv. 6 2016 10.1039/C6RA18917B G. Cui, F. Wang, S. He, M. Wei, Catalytic performance of layered double hydroxide nanosheets toward phenol hydroxylation, RSC Adv.. 6 (2016). https://doi.org/10.1039/C6RA18917B. [44] S. Basąg Z. Piwowarska A. Kowalczyk A. Węgrzyn R. Baran B. Gil M. Michalik L. Chmielarz Cu-Mg-Al hydrotalcite-like materials as precursors of effective catalysts for selective oxidation of ammonia to dinitrogen—The influence of Mg/Al ratio and calcination temperature Appl. Clay. Sci. 129 2016 122 130 10.1016/j.clay.2016.05.019 S. Basąg, Z. Piwowarska, A. Kowalczyk, A. Węgrzyn, R. Baran, B. Gil, M. Michalik, L. Chmielarz, Cu-Mg-Al hydrotalcite-like materials as precursors of effective catalysts for selective oxidation of ammonia to dinitrogen—The influence of Mg/Al ratio and calcination temperature, Appl. Clay. Sci. 129 (2016) 122–130. https://doi.org/10.1016/j.clay.2016.05.019. [45] S. Tanasoi N. Tanchoux A. Urdă D. Tichit I. Săndulescu F. Fajula I.-C. Marcu New Cu-based mixed oxides obtained from LDH precursors, catalysts for methane total oxidation Appl. Catal. A 363 2009 135 142 10.1016/j.apcata.2009.05.007 S. Tanasoi, N. Tanchoux, A. Urdă, D. Tichit, I. Săndulescu, F. Fajula, I.-C. Marcu, New Cu-based mixed oxides obtained from LDH precursors, catalysts for methane total oxidation, Appl. Catal. A 363 (2009) 135–142. https://doi.org/10.1016/j.apcata.2009.05.007. [46] S. Chen R. Wojcieszak F. Dumeignil E. Marceau S. Royer How catalysts and experimental conditions determine the selective hydroconversion of furfural and 5-hydroxymethylfurfural Chem. Rev. 118 2018 11023 11117 10.1021/acs.chemrev.8b00134 S. Chen, R. Wojcieszak, F. Dumeignil, E. Marceau, S. Royer, How catalysts and experimental conditions determine the selective hydroconversion of furfural and 5-hydroxymethylfurfural, Chem. Rev. 118 (2018) 11023–11117. https://doi.org/10.1021/acs.chemrev.8b00134. [47] Z. Zhang‡ X. Chen‡ B. Wang L. Wang Y. Li X. Yan L. Chen Continuous synthesis of 2,2,6,6-tetramethyl-4-piperidinol over CuCrSr/Al2O3: effect of Sr promoter RSC Adv. 13 2023 9576 9584 10.1039/D2RA08306J Z. Zhang‡, X. Chen‡, B. Wang, L. Wang, Y. Li, X. Yan, L. Chen, Continuous synthesis of 2,2,6,6-tetramethyl-4-piperidinol over CuCrSr/Al2O3: effect of Sr promoter, RSC Adv. 13 (2023) 9576–9584. https://doi.org/10.1039/D2RA08306J. [48] A. Behr D. Obst A. Westfechtel Isomerizing hydroformylation of fatty acid esters: formation of ω-aldehydes Eur. J. Lipid Sci. Technol. 107 2005 213 219 10.1002/ejlt.200401123 A. Behr, D. Obst, A. Westfechtel, Isomerizing hydroformylation of fatty acid esters: formation of ω-aldehydes, Eur. J. Lipid Sci. Technol. 107 (2005) 213–219. https://doi.org/10.1002/ejlt.200401123. [49] Efficient hydrogenation of methyl palmitate to hexadecanol over Cu/m-ZrO2 catalysts: synergistic effect of Cu species and oxygen vacancies | ACS Catalysis. https://pubs.acs.org/doi/10.1021/acscatal.2c06151 (accessed September 5, 2024). [50] R.D. Rieke D.S. Thakur B.D. Roberts G.T. White Fatty methyl ester hydrogenation to fatty alcohol part I: correlation between catalyst properties and activity/selectivity J. Am. Oil Chem. Soc. 74 1997 333 339 10.1007/s11746-997-0088-y R.D. Rieke, D.S. Thakur, B.D. Roberts, G.T. White, Fatty methyl ester hydrogenation to fatty alcohol part I: correlation between catalyst properties and activity/selectivity, J. Am. Oil Chem. Soc. 74 (1997) 333–339. https://doi.org/10.1007/s11746-997-0088-y. [51] C. Huang H. Zhang Y. Zhao S. Chen Z. Liu Diatomite-supported Pd–M (M = Cu, Co, Ni) bimetal nanocatalysts for selective hydrogenation of long-chain aliphatic esters J. Colloid Interface Sci. 386 2012 60 65 10.1016/j.jcis.2012.07.032 C. Huang, H. Zhang, Y. Zhao, S. Chen, Z. Liu, Diatomite-supported Pd–M (M = Cu, Co, Ni) bimetal nanocatalysts for selective hydrogenation of long-chain aliphatic esters, J. Colloid Interface Sci. 386 (2012) 60–65. https://doi.org/10.1016/j.jcis.2012.07.032. [52] W. Liu Y. Magnin D. Förster J. Bourgon T. Len F. Morfin L. Piccolo H. Amara C. Zlotea Size-dependent hydrogen trapping in palladium nanoparticles J. Mater. Chem. A 9 2021 10354 10363 10.1039/D0TA12174F W. Liu, Y. Magnin, D. Förster, J. Bourgon, T. Len, F. Morfin, L. Piccolo, H. Amara, C. Zlotea, Size-dependent hydrogen trapping in palladium nanoparticles, J. Mater. Chem. A 9 (2021) 10354–10363. https://doi.org/10.1039/D0TA12174F. [53] N. Makmeesub C. Ritvirulh K. Choojun T.-H. Chen Y. Poo-arporn D.E. Resasco T. Sooknoi Reversible hydrogenation–dehydrogenation of acetylpyridine-Pd-MIL-101(Cr) for chemical hydrogen storage Ind. Eng. Chem. Res. 59 2020 17671 17679 10.1021/acs.iecr.0c02764 N. Makmeesub, C. Ritvirulh, K. Choojun, T.-H. Chen, Y. Poo-arporn, D.E. Resasco, T. Sooknoi, Reversible hydrogenation–dehydrogenation of acetylpyridine-Pd-MIL-101(Cr) for chemical hydrogen storage, Ind. Eng. Chem. Res. 59 (2020) 17671–17679. https://doi.org/10.1021/acs.iecr.0c02764.",
      "scopus-id": "85217421603",
      "coredata": {
        "eid": "1-s2.0-S2468823125000847",
        "dc:description": "High fatty alcohol production (>90 % selectivity) can be achieved though the selective hydrogenation of fatty acid methyl esters over layered double hydroxide derived CuMgAlO x catalysts in a fixed-bed reactor at 250 °C under atmospheric H2. ∼17 wt.% Cu loading CuLDHs with different Mg2+/Al3+ ratios (CuMg60Al40O x , CuMg70Al30O x , CuMg75Al25O x , and CuMg80Al20O x ) were prepared by co-precipitation-hydrothermal method. The Cu dispersion and species were determined by H2-TPR, consecutive H2-TPR, N2O-dissociative reaction, and in situ TR-XANES. Highly dispersed Cu metal along with cationic Cu(I) species were obtained for all CuMgAlO x . The cationic Cu(I) species (Cu+/Cu+-H) content increased with Mg2+ content. In the presence of H2, the cationic Cu(I) species undergo reversible interconversion between Cu+ and Cu+-H species, facilitating hydrogen dissociation/evolution. The hydrogenation activity was governed by the balance of the metallic Cu surface and the cationic Cu(I) species. The Cu+ species allow preferential adsorption of CO ester for selective hydrogenation of FAMEs to fatty alcohol (>90 % selectivity). With Cusurface/Cu(I) ratio at 0.25 (CuMg75Al25O x ), the fatty alcohol production rate of 49.3 h−1 was obtained with high stability due to the reversible interconversion of Cu+/Cu+-H that prevented product re-adsorption and side reactions.",
        "openArchiveArticle": "false",
        "prism:coverDate": "2025-03-15",
        "openaccessUserLicense": null,
        "prism:aggregationType": "Journal",
        "prism:url": "https://api.elsevier.com/content/article/pii/S2468823125000847",
        "dc:creator": [
          {
            "@_fa": "true",
            "$": "Nooto, Chanisara"
          },
          {
            "@_fa": "true",
            "$": "Chuaykaew, Panalee"
          },
          {
            "@_fa": "true",
            "$": "Singthuen, Pawanrat"
          },
          {
            "@_fa": "true",
            "$": "Solos, Thanasak"
          },
          {
            "@_fa": "true",
            "$": "Preedawichitkun, Yardthip"
          },
          {
            "@_fa": "true",
            "$": "Khosukwiwat, Kanyanat"
          },
          {
            "@_fa": "true",
            "$": "Wengwirat, Kanokwan"
          },
          {
            "@_fa": "true",
            "$": "Promchana, Pratya"
          },
          {
            "@_fa": "true",
            "$": "Kumar, Raju"
          },
          {
            "@_fa": "true",
            "$": "Chung, Po-Wen"
          },
          {
            "@_fa": "true",
            "$": "Poo-arporn, Yingyot"
          },
          {
            "@_fa": "true",
            "$": "Limphirat, Wanwisa"
          },
          {
            "@_fa": "true",
            "$": "Choojun, Kittisak"
          },
          {
            "@_fa": "true",
            "$": "Sooknoi, Tawan"
          }
        ],
        "link": [
          {
            "@_fa": "true",
            "@rel": "self",
            "@href": "https://api.elsevier.com/content/article/pii/S2468823125000847"
          },
          {
            "@_fa": "true",
            "@rel": "scidir",
            "@href": "https://www.sciencedirect.com/science/article/pii/S2468823125000847"
          }
        ],
        "dc:format": "application/json",
        "openaccessType": null,
        "pii": "S2468-8231(25)00084-7",
        "prism:volume": "575",
        "articleNumber": "114898",
        "prism:publisher": "Elsevier B.V. All rights are reserved, including those for text and data mining, AI training, and similar technologies.",
        "dc:title": "Reversibly interconverted Cu+/Cu+-H species as active sites for selective hydrogenation of fatty acid methyl esters to fatty alcohol over layered double hydroxide derived CuMgAlO x catalysts",
        "prism:copyright": "© 2025 Elsevier B.V. All rights are reserved, including those for text and data mining, AI training, and similar technologies.",
        "openaccess": "0",
        "prism:issn": "24688231",
        "dcterms:subject": [
          {
            "@_fa": "true",
            "$": "Cationic Cu(I) species"
          },
          {
            "@_fa": "true",
            "$": "Reversible interconversion"
          },
          {
            "@_fa": "true",
            "$": "Cu+/Cu+-H species"
          },
          {
            "@_fa": "true",
            "$": "CuLDHs"
          },
          {
            "@_fa": "true",
            "$": "Fatty alcohol"
          },
          {
            "@_fa": "true",
            "$": "FAMEs"
          },
          {
            "@_fa": "true",
            "$": "Selective hydrogenation"
          }
        ],
        "openaccessArticle": "false",
        "prism:publicationName": "Molecular Catalysis",
        "openaccessSponsorType": null,
        "prism:pageRange": "114898",
        "pubType": "fla",
        "prism:coverDisplayDate": "15 March 2025",
        "prism:doi": "10.1016/j.mcat.2025.114898",
        "prism:startingPage": "114898",
        "dc:identifier": "doi:10.1016/j.mcat.2025.114898",
        "openaccessSponsorName": null
      },
      "objects": {
        "object": [
          {
            "@category": "standard",
            "@height": "330",
            "@width": "376",
            "@_fa": "true",
            "$": "https://api.elsevier.com/content/object/eid/1-s2.0-S2468823125000847-gr1.jpg?httpAccept=%2A%2F%2A",
            "@multimediatype": "JPEG image file",
            "@type": "IMAGE-DOWNSAMPLED",
            "@size": "35639",
            "@ref": "gr1",
            "@mimetype": "image/jpeg"
          },
          {
            "@category": "standard",
            "@height": "357",
            "@width": "715",
            "@_fa": "true",
            "$": "https://api.elsevier.com/content/object/eid/1-s2.0-S2468823125000847-gr2.jpg?httpAccept=%2A%2F%2A",
            "@multimediatype": "JPEG image file",
            "@type": "IMAGE-DOWNSAMPLED",
            "@size": "77367",
            "@ref": "gr2",
            "@mimetype": "image/jpeg"
          },
          {
            "@category": "standard",
            "@height": "282",
            "@width": "376",
            "@_fa": "true",
            "$": "https://api.elsevier.com/content/object/eid/1-s2.0-S2468823125000847-gr3.jpg?httpAccept=%2A%2F%2A",
            "@multimediatype": "JPEG image file",
            "@type": "IMAGE-DOWNSAMPLED",
            "@size": "26858",
            "@ref": "gr3",
            "@mimetype": "image/jpeg"
          },
          {
            "@category": "standard",
            "@height": "831",
            "@width": "621",
            "@_fa": "true",
            "$": "https://api.elsevier.com/content/object/eid/1-s2.0-S2468823125000847-gr4.jpg?httpAccept=%2A%2F%2A",
            "@multimediatype": "JPEG image file",
            "@type": "IMAGE-DOWNSAMPLED",
            "@size": "275690",
            "@ref": "gr4",
            "@mimetype": "image/jpeg"
          },
          {
            "@category": "standard",
            "@height": "336",
            "@width": "376",
            "@_fa": "true",
            "$": "https://api.elsevier.com/content/object/eid/1-s2.0-S2468823125000847-gr5.jpg?httpAccept=%2A%2F%2A",
            "@multimediatype": "JPEG image file",
            "@type": "IMAGE-DOWNSAMPLED",
            "@size": "38545",
            "@ref": "gr5",
            "@mimetype": "image/jpeg"
          },
          {
            "@category": "standard",
            "@height": "322",
            "@width": "376",
            "@_fa": "true",
            "$": "https://api.elsevier.com/content/object/eid/1-s2.0-S2468823125000847-gr6.jpg?httpAccept=%2A%2F%2A",
            "@multimediatype": "JPEG image file",
            "@type": "IMAGE-DOWNSAMPLED",
            "@size": "34088",
            "@ref": "gr6",
            "@mimetype": "image/jpeg"
          },
          {
            "@category": "standard",
            "@height": "334",
            "@width": "376",
            "@_fa": "true",
            "$": "https://api.elsevier.com/content/object/eid/1-s2.0-S2468823125000847-gr7.jpg?httpAccept=%2A%2F%2A",
            "@multimediatype": "JPEG image file",
            "@type": "IMAGE-DOWNSAMPLED",
            "@size": "40636",
            "@ref": "gr7",
            "@mimetype": "image/jpeg"
          },
          {
            "@category": "standard",
            "@height": "11",
            "@width": "11",
            "@_fa": "true",
            "$": "https://api.elsevier.com/content/object/eid/1-s2.0-S2468823125000847-fx1.jpg?httpAccept=%2A%2F%2A",
            "@multimediatype": "JPEG image file",
            "@type": "IMAGE-DOWNSAMPLED",
            "@size": "2938",
            "@ref": "fx1",
            "@mimetype": "image/jpeg"
          },
          {
            "@category": "standard",
            "@height": "15",
            "@width": "13",
            "@_fa": "true",
            "$": "https://api.elsevier.com/content/object/eid/1-s2.0-S2468823125000847-fx2.jpg?httpAccept=%2A%2F%2A",
            "@multimediatype": "JPEG image file",
            "@type": "IMAGE-DOWNSAMPLED",
            "@size": "3127",
            "@ref": "fx2",
            "@mimetype": "image/jpeg"
          },
          {
            "@category": "standard",
            "@height": "388",
            "@width": "678",
            "@_fa": "true",
            "$": "https://api.elsevier.com/content/object/eid/1-s2.0-S2468823125000847-sc2.jpg?httpAccept=%2A%2F%2A",
            "@multimediatype": "JPEG image file",
            "@type": "IMAGE-DOWNSAMPLED",
            "@size": "82046",
            "@ref": "sc2",
            "@mimetype": "image/jpeg"
          },
          {
            "@category": "standard",
            "@height": "13",
            "@width": "13",
            "@_fa": "true",
            "$": "https://api.elsevier.com/content/object/eid/1-s2.0-S2468823125000847-fx3.jpg?httpAccept=%2A%2F%2A",
            "@multimediatype": "JPEG image file",
            "@type": "IMAGE-DOWNSAMPLED",
            "@size": "3102",
            "@ref": "fx3",
            "@mimetype": "image/jpeg"
          },
          {
            "@category": "standard",
            "@height": "555",
            "@width": "565",
            "@_fa": "true",
            "$": "https://api.elsevier.com/content/object/eid/1-s2.0-S2468823125000847-sc1.jpg?httpAccept=%2A%2F%2A",
            "@multimediatype": "JPEG image file",
            "@type": "IMAGE-DOWNSAMPLED",
            "@size": "104849",
            "@ref": "sc1",
            "@mimetype": "image/jpeg"
          },
          {
            "@category": "standard",
            "@height": "13",
            "@width": "13",
            "@_fa": "true",
            "$": "https://api.elsevier.com/content/object/eid/1-s2.0-S2468823125000847-fx4.jpg?httpAccept=%2A%2F%2A",
            "@multimediatype": "JPEG image file",
            "@type": "IMAGE-DOWNSAMPLED",
            "@size": "3149",
            "@ref": "fx4",
            "@mimetype": "image/jpeg"
          },
          {
            "@category": "standard",
            "@height": "15",
            "@width": "13",
            "@_fa": "true",
            "$": "https://api.elsevier.com/content/object/eid/1-s2.0-S2468823125000847-fx5.jpg?httpAccept=%2A%2F%2A",
            "@multimediatype": "JPEG image file",
            "@type": "IMAGE-DOWNSAMPLED",
            "@size": "3144",
            "@ref": "fx5",
            "@mimetype": "image/jpeg"
          },
          {
            "@category": "standard",
            "@height": "168",
            "@width": "678",
            "@_fa": "true",
            "$": "https://api.elsevier.com/content/object/eid/1-s2.0-S2468823125000847-sc3.jpg?httpAccept=%2A%2F%2A",
            "@multimediatype": "JPEG image file",
            "@type": "IMAGE-DOWNSAMPLED",
            "@size": "14774",
            "@ref": "sc3",
            "@mimetype": "image/jpeg"
          },
          {
            "@category": "standard",
            "@height": "8",
            "@width": "8",
            "@_fa": "true",
            "$": "https://api.elsevier.com/content/object/eid/1-s2.0-S2468823125000847-fx6.jpg?httpAccept=%2A%2F%2A",
            "@multimediatype": "JPEG image file",
            "@type": "IMAGE-DOWNSAMPLED",
            "@size": "2957",
            "@ref": "fx6",
            "@mimetype": "image/jpeg"
          },
          {
            "@category": "standard",
            "@height": "365",
            "@width": "753",
            "@_fa": "true",
            "$": "https://api.elsevier.com/content/object/eid/1-s2.0-S2468823125000847-gr10.jpg?httpAccept=%2A%2F%2A",
            "@multimediatype": "JPEG image file",
            "@type": "IMAGE-DOWNSAMPLED",
            "@size": "59333",
            "@ref": "gr10",
            "@mimetype": "image/jpeg"
          },
          {
            "@category": "standard",
            "@height": "200",
            "@width": "415",
            "@_fa": "true",
            "$": "https://api.elsevier.com/content/object/eid/1-s2.0-S2468823125000847-ga1.jpg?httpAccept=%2A%2F%2A",
            "@multimediatype": "JPEG image file",
            "@type": "IMAGE-DOWNSAMPLED",
            "@size": "37982",
            "@ref": "ga1",
            "@mimetype": "image/jpeg"
          },
          {
            "@category": "standard",
            "@height": "391",
            "@width": "527",
            "@_fa": "true",
            "$": "https://api.elsevier.com/content/object/eid/1-s2.0-S2468823125000847-gr8.jpg?httpAccept=%2A%2F%2A",
            "@multimediatype": "JPEG image file",
            "@type": "IMAGE-DOWNSAMPLED",
            "@size": "39999",
            "@ref": "gr8",
            "@mimetype": "image/jpeg"
          },
          {
            "@category": "standard",
            "@height": "316",
            "@width": "376",
            "@_fa": "true",
            "$": "https://api.elsevier.com/content/object/eid/1-s2.0-S2468823125000847-gr9.jpg?httpAccept=%2A%2F%2A",
            "@multimediatype": "JPEG image file",
            "@type": "IMAGE-DOWNSAMPLED",
            "@size": "20141",
            "@ref": "gr9",
            "@mimetype": "image/jpeg"
          },
          {
            "@category": "standard",
            "@height": "428",
            "@width": "621",
            "@_fa": "true",
            "$": "https://api.elsevier.com/content/object/eid/1-s2.0-S2468823125000847-gr11.jpg?httpAccept=%2A%2F%2A",
            "@multimediatype": "JPEG image file",
            "@type": "IMAGE-DOWNSAMPLED",
            "@size": "41704",
            "@ref": "gr11",
            "@mimetype": "image/jpeg"
          },
          {
            "@category": "thumbnail",
            "@height": "164",
            "@width": "187",
            "@_fa": "true",
            "$": "https://api.elsevier.com/content/object/eid/1-s2.0-S2468823125000847-gr1.sml?httpAccept=%2A%2F%2A",
            "@multimediatype": "GIF image file",
            "@type": "IMAGE-THUMBNAIL",
            "@size": "9319",
            "@ref": "gr1",
            "@mimetype": "image/gif"
          },
          {
            "@category": "thumbnail",
            "@height": "109",
            "@width": "219",
            "@_fa": "true",
            "$": "https://api.elsevier.com/content/object/eid/1-s2.0-S2468823125000847-gr2.sml?httpAccept=%2A%2F%2A",
            "@multimediatype": "GIF image file",
            "@type": "IMAGE-THUMBNAIL",
            "@size": "9680",
            "@ref": "gr2",
            "@mimetype": "image/gif"
          },
          {
            "@category": "thumbnail",
            "@height": "164",
            "@width": "219",
            "@_fa": "true",
            "$": "https://api.elsevier.com/content/object/eid/1-s2.0-S2468823125000847-gr3.sml?httpAccept=%2A%2F%2A",
            "@multimediatype": "GIF image file",
            "@type": "IMAGE-THUMBNAIL",
            "@size": "8986",
            "@ref": "gr3",
            "@mimetype": "image/gif"
          },
          {
            "@category": "thumbnail",
            "@height": "163",
            "@width": "122",
            "@_fa": "true",
            "$": "https://api.elsevier.com/content/object/eid/1-s2.0-S2468823125000847-gr4.sml?httpAccept=%2A%2F%2A",
            "@multimediatype": "GIF image file",
            "@type": "IMAGE-THUMBNAIL",
            "@size": "16793",
            "@ref": "gr4",
            "@mimetype": "image/gif"
          },
          {
            "@category": "thumbnail",
            "@height": "164",
            "@width": "184",
            "@_fa": "true",
            "$": "https://api.elsevier.com/content/object/eid/1-s2.0-S2468823125000847-gr5.sml?httpAccept=%2A%2F%2A",
            "@multimediatype": "GIF image file",
            "@type": "IMAGE-THUMBNAIL",
            "@size": "10181",
            "@ref": "gr5",
            "@mimetype": "image/gif"
          },
          {
            "@category": "thumbnail",
            "@height": "164",
            "@width": "191",
            "@_fa": "true",
            "$": "https://api.elsevier.com/content/object/eid/1-s2.0-S2468823125000847-gr6.sml?httpAccept=%2A%2F%2A",
            "@multimediatype": "GIF image file",
            "@type": "IMAGE-THUMBNAIL",
            "@size": "9355",
            "@ref": "gr6",
            "@mimetype": "image/gif"
          },
          {
            "@category": "thumbnail",
            "@height": "164",
            "@width": "184",
            "@_fa": "true",
            "$": "https://api.elsevier.com/content/object/eid/1-s2.0-S2468823125000847-gr7.sml?httpAccept=%2A%2F%2A",
            "@multimediatype": "GIF image file",
            "@type": "IMAGE-THUMBNAIL",
            "@size": "10703",
            "@ref": "gr7",
            "@mimetype": "image/gif"
          },
          {
            "@category": "thumbnail",
            "@height": "49",
            "@width": "49",
            "@_fa": "true",
            "$": "https://api.elsevier.com/content/object/eid/1-s2.0-S2468823125000847-fx1.sml?httpAccept=%2A%2F%2A",
            "@multimediatype": "GIF image file",
            "@type": "IMAGE-THUMBNAIL",
            "@size": "3428",
            "@ref": "fx1",
            "@mimetype": "image/gif"
          },
          {
            "@category": "thumbnail",
            "@height": "65",
            "@width": "58",
            "@_fa": "true",
            "$": "https://api.elsevier.com/content/object/eid/1-s2.0-S2468823125000847-fx2.sml?httpAccept=%2A%2F%2A",
            "@multimediatype": "GIF image file",
            "@type": "IMAGE-THUMBNAIL",
            "@size": "4143",
            "@ref": "fx2",
            "@mimetype": "image/gif"
          },
          {
            "@category": "thumbnail",
            "@height": "125",
            "@width": "219",
            "@_fa": "true",
            "$": "https://api.elsevier.com/content/object/eid/1-s2.0-S2468823125000847-sc2.sml?httpAccept=%2A%2F%2A",
            "@multimediatype": "GIF image file",
            "@type": "IMAGE-THUMBNAIL",
            "@size": "12491",
            "@ref": "sc2",
            "@mimetype": "image/gif"
          },
          {
            "@category": "thumbnail",
            "@height": "58",
            "@width": "58",
            "@_fa": "true",
            "$": "https://api.elsevier.com/content/object/eid/1-s2.0-S2468823125000847-fx3.sml?httpAccept=%2A%2F%2A",
            "@multimediatype": "GIF image file",
            "@type": "IMAGE-THUMBNAIL",
            "@size": "4177",
            "@ref": "fx3",
            "@mimetype": "image/gif"
          },
          {
            "@category": "thumbnail",
            "@height": "164",
            "@width": "167",
            "@_fa": "true",
            "$": "https://api.elsevier.com/content/object/eid/1-s2.0-S2468823125000847-sc1.sml?httpAccept=%2A%2F%2A",
            "@multimediatype": "GIF image file",
            "@type": "IMAGE-THUMBNAIL",
            "@size": "17904",
            "@ref": "sc1",
            "@mimetype": "image/gif"
          },
          {
            "@category": "thumbnail",
            "@height": "58",
            "@width": "58",
            "@_fa": "true",
            "$": "https://api.elsevier.com/content/object/eid/1-s2.0-S2468823125000847-fx4.sml?httpAccept=%2A%2F%2A",
            "@multimediatype": "GIF image file",
            "@type": "IMAGE-THUMBNAIL",
            "@size": "3772",
            "@ref": "fx4",
            "@mimetype": "image/gif"
          },
          {
            "@category": "thumbnail",
            "@height": "65",
            "@width": "58",
            "@_fa": "true",
            "$": "https://api.elsevier.com/content/object/eid/1-s2.0-S2468823125000847-fx5.sml?httpAccept=%2A%2F%2A",
            "@multimediatype": "GIF image file",
            "@type": "IMAGE-THUMBNAIL",
            "@size": "4628",
            "@ref": "fx5",
            "@mimetype": "image/gif"
          },
          {
            "@category": "thumbnail",
            "@height": "54",
            "@width": "219",
            "@_fa": "true",
            "$": "https://api.elsevier.com/content/object/eid/1-s2.0-S2468823125000847-sc3.sml?httpAccept=%2A%2F%2A",
            "@multimediatype": "GIF image file",
            "@type": "IMAGE-THUMBNAIL",
            "@size": "2274",
            "@ref": "sc3",
            "@mimetype": "image/gif"
          },
          {
            "@category": "thumbnail",
            "@height": "36",
            "@width": "36",
            "@_fa": "true",
            "$": "https://api.elsevier.com/content/object/eid/1-s2.0-S2468823125000847-fx6.sml?httpAccept=%2A%2F%2A",
            "@multimediatype": "GIF image file",
            "@type": "IMAGE-THUMBNAIL",
            "@size": "3514",
            "@ref": "fx6",
            "@mimetype": "image/gif"
          },
          {
            "@category": "thumbnail",
            "@height": "106",
            "@width": "219",
            "@_fa": "true",
            "$": "https://api.elsevier.com/content/object/eid/1-s2.0-S2468823125000847-gr10.sml?httpAccept=%2A%2F%2A",
            "@multimediatype": "GIF image file",
            "@type": "IMAGE-THUMBNAIL",
            "@size": "8672",
            "@ref": "gr10",
            "@mimetype": "image/gif"
          },
          {
            "@category": "thumbnail",
            "@height": "105",
            "@width": "219",
            "@_fa": "true",
            "$": "https://api.elsevier.com/content/object/eid/1-s2.0-S2468823125000847-ga1.sml?httpAccept=%2A%2F%2A",
            "@multimediatype": "GIF image file",
            "@type": "IMAGE-THUMBNAIL",
            "@size": "14368",
            "@ref": "ga1",
            "@mimetype": "image/gif"
          },
          {
            "@category": "thumbnail",
            "@height": "163",
            "@width": "219",
            "@_fa": "true",
            "$": "https://api.elsevier.com/content/object/eid/1-s2.0-S2468823125000847-gr8.sml?httpAccept=%2A%2F%2A",
            "@multimediatype": "GIF image file",
            "@type": "IMAGE-THUMBNAIL",
            "@size": "10059",
            "@ref": "gr8",
            "@mimetype": "image/gif"
          },
          {
            "@category": "thumbnail",
            "@height": "164",
            "@width": "195",
            "@_fa": "true",
            "$": "https://api.elsevier.com/content/object/eid/1-s2.0-S2468823125000847-gr9.sml?httpAccept=%2A%2F%2A",
            "@multimediatype": "GIF image file",
            "@type": "IMAGE-THUMBNAIL",
            "@size": "7148",
            "@ref": "gr9",
            "@mimetype": "image/gif"
          },
          {
            "@category": "thumbnail",
            "@height": "151",
            "@width": "219",
            "@_fa": "true",
            "$": "https://api.elsevier.com/content/object/eid/1-s2.0-S2468823125000847-gr11.sml?httpAccept=%2A%2F%2A",
            "@multimediatype": "GIF image file",
            "@type": "IMAGE-THUMBNAIL",
            "@size": "8752",
            "@ref": "gr11",
            "@mimetype": "image/gif"
          },
          {
            "@category": "high",
            "@height": "1463",
            "@width": "1667",
            "@_fa": "true",
            "$": "https://api.elsevier.com/content/object/eid/1-s2.0-S2468823125000847-gr1_lrg.jpg?httpAccept=%2A%2F%2A",
            "@multimediatype": "JPEG image file",
            "@type": "IMAGE-HIGH-RES",
            "@size": "259826",
            "@ref": "gr1",
            "@mimetype": "image/jpeg"
          },
          {
            "@category": "high",
            "@height": "1580",
            "@width": "3167",
            "@_fa": "true",
            "$": "https://api.elsevier.com/content/object/eid/1-s2.0-S2468823125000847-gr2_lrg.jpg?httpAccept=%2A%2F%2A",
            "@multimediatype": "JPEG image file",
            "@type": "IMAGE-HIGH-RES",
            "@size": "612253",
            "@ref": "gr2",
            "@mimetype": "image/jpeg"
          },
          {
            "@category": "high",
            "@height": "1250",
            "@width": "1667",
            "@_fa": "true",
            "$": "https://api.elsevier.com/content/object/eid/1-s2.0-S2468823125000847-gr3_lrg.jpg?httpAccept=%2A%2F%2A",
            "@multimediatype": "JPEG image file",
            "@type": "IMAGE-HIGH-RES",
            "@size": "186819",
            "@ref": "gr3",
            "@mimetype": "image/jpeg"
          },
          {
            "@category": "high",
            "@height": "3680",
            "@width": "2750",
            "@_fa": "true",
            "$": "https://api.elsevier.com/content/object/eid/1-s2.0-S2468823125000847-gr4_lrg.jpg?httpAccept=%2A%2F%2A",
            "@multimediatype": "JPEG image file",
            "@type": "IMAGE-HIGH-RES",
            "@size": "3232492",
            "@ref": "gr4",
            "@mimetype": "image/jpeg"
          },
          {
            "@category": "high",
            "@height": "1488",
            "@width": "1667",
            "@_fa": "true",
            "$": "https://api.elsevier.com/content/object/eid/1-s2.0-S2468823125000847-gr5_lrg.jpg?httpAccept=%2A%2F%2A",
            "@multimediatype": "JPEG image file",
            "@type": "IMAGE-HIGH-RES",
            "@size": "274017",
            "@ref": "gr5",
            "@mimetype": "image/jpeg"
          },
          {
            "@category": "high",
            "@height": "1429",
            "@width": "1667",
            "@_fa": "true",
            "$": "https://api.elsevier.com/content/object/eid/1-s2.0-S2468823125000847-gr6_lrg.jpg?httpAccept=%2A%2F%2A",
            "@multimediatype": "JPEG image file",
            "@type": "IMAGE-HIGH-RES",
            "@size": "249675",
            "@ref": "gr6",
            "@mimetype": "image/jpeg"
          },
          {
            "@category": "high",
            "@height": "1483",
            "@width": "1667",
            "@_fa": "true",
            "$": "https://api.elsevier.com/content/object/eid/1-s2.0-S2468823125000847-gr7_lrg.jpg?httpAccept=%2A%2F%2A",
            "@multimediatype": "JPEG image file",
            "@type": "IMAGE-HIGH-RES",
            "@size": "290413",
            "@ref": "gr7",
            "@mimetype": "image/jpeg"
          },
          {
            "@category": "high",
            "@height": "49",
            "@width": "49",
            "@_fa": "true",
            "$": "https://api.elsevier.com/content/object/eid/1-s2.0-S2468823125000847-fx1_lrg.jpg?httpAccept=%2A%2F%2A",
            "@multimediatype": "JPEG image file",
            "@type": "IMAGE-HIGH-RES",
            "@size": "3079",
            "@ref": "fx1",
            "@mimetype": "image/jpeg"
          },
          {
            "@category": "high",
            "@height": "65",
            "@width": "58",
            "@_fa": "true",
            "$": "https://api.elsevier.com/content/object/eid/1-s2.0-S2468823125000847-fx2_lrg.jpg?httpAccept=%2A%2F%2A",
            "@multimediatype": "JPEG image file",
            "@type": "IMAGE-HIGH-RES",
            "@size": "4122",
            "@ref": "fx2",
            "@mimetype": "image/jpeg"
          },
          {
            "@category": "high",
            "@height": "1717",
            "@width": "3000",
            "@_fa": "true",
            "$": "https://api.elsevier.com/content/object/eid/1-s2.0-S2468823125000847-sc2_lrg.jpg?httpAccept=%2A%2F%2A",
            "@multimediatype": "JPEG image file",
            "@type": "IMAGE-HIGH-RES",
            "@size": "577240",
            "@ref": "sc2",
            "@mimetype": "image/jpeg"
          },
          {
            "@category": "high",
            "@height": "58",
            "@width": "58",
            "@_fa": "true",
            "$": "https://api.elsevier.com/content/object/eid/1-s2.0-S2468823125000847-fx3_lrg.jpg?httpAccept=%2A%2F%2A",
            "@multimediatype": "JPEG image file",
            "@type": "IMAGE-HIGH-RES",
            "@size": "4092",
            "@ref": "fx3",
            "@mimetype": "image/jpeg"
          },
          {
            "@category": "high",
            "@height": "2455",
            "@width": "2500",
            "@_fa": "true",
            "$": "https://api.elsevier.com/content/object/eid/1-s2.0-S2468823125000847-sc1_lrg.jpg?httpAccept=%2A%2F%2A",
            "@multimediatype": "JPEG image file",
            "@type": "IMAGE-HIGH-RES",
            "@size": "890834",
            "@ref": "sc1",
            "@mimetype": "image/jpeg"
          },
          {
            "@category": "high",
            "@height": "58",
            "@width": "58",
            "@_fa": "true",
            "$": "https://api.elsevier.com/content/object/eid/1-s2.0-S2468823125000847-fx4_lrg.jpg?httpAccept=%2A%2F%2A",
            "@multimediatype": "JPEG image file",
            "@type": "IMAGE-HIGH-RES",
            "@size": "4157",
            "@ref": "fx4",
            "@mimetype": "image/jpeg"
          },
          {
            "@category": "high",
            "@height": "65",
            "@width": "58",
            "@_fa": "true",
            "$": "https://api.elsevier.com/content/object/eid/1-s2.0-S2468823125000847-fx5_lrg.jpg?httpAccept=%2A%2F%2A",
            "@multimediatype": "JPEG image file",
            "@type": "IMAGE-HIGH-RES",
            "@size": "4193",
            "@ref": "fx5",
            "@mimetype": "image/jpeg"
          },
          {
            "@category": "high",
            "@height": "745",
            "@width": "3000",
            "@_fa": "true",
            "$": "https://api.elsevier.com/content/object/eid/1-s2.0-S2468823125000847-sc3_lrg.jpg?httpAccept=%2A%2F%2A",
            "@multimediatype": "JPEG image file",
            "@type": "IMAGE-HIGH-RES",
            "@size": "118142",
            "@ref": "sc3",
            "@mimetype": "image/jpeg"
          },
          {
            "@category": "high",
            "@height": "36",
            "@width": "36",
            "@_fa": "true",
            "$": "https://api.elsevier.com/content/object/eid/1-s2.0-S2468823125000847-fx6_lrg.jpg?httpAccept=%2A%2F%2A",
            "@multimediatype": "JPEG image file",
            "@type": "IMAGE-HIGH-RES",
            "@size": "4084",
            "@ref": "fx6",
            "@mimetype": "image/jpeg"
          },
          {
            "@category": "high",
            "@height": "1616",
            "@width": "3333",
            "@_fa": "true",
            "$": "https://api.elsevier.com/content/object/eid/1-s2.0-S2468823125000847-gr10_lrg.jpg?httpAccept=%2A%2F%2A",
            "@multimediatype": "JPEG image file",
            "@type": "IMAGE-HIGH-RES",
            "@size": "373411",
            "@ref": "gr10",
            "@mimetype": "image/jpeg"
          },
          {
            "@category": "high",
            "@height": "886",
            "@width": "1840",
            "@_fa": "true",
            "$": "https://api.elsevier.com/content/object/eid/1-s2.0-S2468823125000847-ga1_lrg.jpg?httpAccept=%2A%2F%2A",
            "@multimediatype": "JPEG image file",
            "@type": "IMAGE-HIGH-RES",
            "@size": "294482",
            "@ref": "ga1",
            "@mimetype": "image/jpeg"
          },
          {
            "@category": "high",
            "@height": "1733",
            "@width": "2333",
            "@_fa": "true",
            "$": "https://api.elsevier.com/content/object/eid/1-s2.0-S2468823125000847-gr8_lrg.jpg?httpAccept=%2A%2F%2A",
            "@multimediatype": "JPEG image file",
            "@type": "IMAGE-HIGH-RES",
            "@size": "297246",
            "@ref": "gr8",
            "@mimetype": "image/jpeg"
          },
          {
            "@category": "high",
            "@height": "1401",
            "@width": "1667",
            "@_fa": "true",
            "$": "https://api.elsevier.com/content/object/eid/1-s2.0-S2468823125000847-gr9_lrg.jpg?httpAccept=%2A%2F%2A",
            "@multimediatype": "JPEG image file",
            "@type": "IMAGE-HIGH-RES",
            "@size": "141144",
            "@ref": "gr9",
            "@mimetype": "image/jpeg"
          },
          {
            "@category": "high",
            "@height": "1896",
            "@width": "2750",
            "@_fa": "true",
            "$": "https://api.elsevier.com/content/object/eid/1-s2.0-S2468823125000847-gr11_lrg.jpg?httpAccept=%2A%2F%2A",
            "@multimediatype": "JPEG image file",
            "@type": "IMAGE-HIGH-RES",
            "@size": "282917",
            "@ref": "gr11",
            "@mimetype": "image/jpeg"
          },
          {
            "@category": "standard",
            "@_fa": "true",
            "$": "https://api.elsevier.com/content/object/eid/1-s2.0-S2468823125000847-mmc1.pptx?httpAccept=%2A%2F%2A",
            "@multimediatype": "Microsoft Powerpoint file",
            "@type": "APPLICATION",
            "@size": "11204987",
            "@ref": "mmc1",
            "@mimetype": "application/ppt"
          },
          {
            "@category": "thumbnail",
            "@_fa": "true",
            "$": "https://api.elsevier.com/content/object/eid/1-s2.0-S2468823125000847-si1.svg?httpAccept=%2A%2F%2A",
            "@multimediatype": "Scalable Vector Graphics file",
            "@type": "ALTIMG",
            "@size": "6368",
            "@ref": "si1",
            "@mimetype": "image/svg+xml"
          },
          {
            "@category": "thumbnail",
            "@_fa": "true",
            "$": "https://api.elsevier.com/content/object/eid/1-s2.0-S2468823125000847-si10.svg?httpAccept=%2A%2F%2A",
            "@multimediatype": "Scalable Vector Graphics file",
            "@type": "ALTIMG",
            "@size": "5638",
            "@ref": "si10",
            "@mimetype": "image/svg+xml"
          },
          {
            "@category": "thumbnail",
            "@_fa": "true",
            "$": "https://api.elsevier.com/content/object/eid/1-s2.0-S2468823125000847-si11.svg?httpAccept=%2A%2F%2A",
            "@multimediatype": "Scalable Vector Graphics file",
            "@type": "ALTIMG",
            "@size": "7908",
            "@ref": "si11",
            "@mimetype": "image/svg+xml"
          },
          {
            "@category": "thumbnail",
            "@_fa": "true",
            "$": "https://api.elsevier.com/content/object/eid/1-s2.0-S2468823125000847-si12.svg?httpAccept=%2A%2F%2A",
            "@multimediatype": "Scalable Vector Graphics file",
            "@type": "ALTIMG",
            "@size": "3589",
            "@ref": "si12",
            "@mimetype": "image/svg+xml"
          },
          {
            "@category": "thumbnail",
            "@_fa": "true",
            "$": "https://api.elsevier.com/content/object/eid/1-s2.0-S2468823125000847-si13.svg?httpAccept=%2A%2F%2A",
            "@multimediatype": "Scalable Vector Graphics file",
            "@type": "ALTIMG",
            "@size": "16212",
            "@ref": "si13",
            "@mimetype": "image/svg+xml"
          },
          {
            "@category": "thumbnail",
            "@_fa": "true",
            "$": "https://api.elsevier.com/content/object/eid/1-s2.0-S2468823125000847-si14.svg?httpAccept=%2A%2F%2A",
            "@multimediatype": "Scalable Vector Graphics file",
            "@type": "ALTIMG",
            "@size": "12489",
            "@ref": "si14",
            "@mimetype": "image/svg+xml"
          },
          {
            "@category": "thumbnail",
            "@_fa": "true",
            "$": "https://api.elsevier.com/content/object/eid/1-s2.0-S2468823125000847-si15.svg?httpAccept=%2A%2F%2A",
            "@multimediatype": "Scalable Vector Graphics file",
            "@type": "ALTIMG",
            "@size": "3652",
            "@ref": "si15",
            "@mimetype": "image/svg+xml"
          },
          {
            "@category": "thumbnail",
            "@_fa": "true",
            "$": "https://api.elsevier.com/content/object/eid/1-s2.0-S2468823125000847-si16.svg?httpAccept=%2A%2F%2A",
            "@multimediatype": "Scalable Vector Graphics file",
            "@type": "ALTIMG",
            "@size": "4945",
            "@ref": "si16",
            "@mimetype": "image/svg+xml"
          },
          {
            "@category": "thumbnail",
            "@_fa": "true",
            "$": "https://api.elsevier.com/content/object/eid/1-s2.0-S2468823125000847-si17.svg?httpAccept=%2A%2F%2A",
            "@multimediatype": "Scalable Vector Graphics file",
            "@type": "ALTIMG",
            "@size": "1385",
            "@ref": "si17",
            "@mimetype": "image/svg+xml"
          },
          {
            "@category": "thumbnail",
            "@_fa": "true",
            "$": "https://api.elsevier.com/content/object/eid/1-s2.0-S2468823125000847-si2.svg?httpAccept=%2A%2F%2A",
            "@multimediatype": "Scalable Vector Graphics file",
            "@type": "ALTIMG",
            "@size": "6364",
            "@ref": "si2",
            "@mimetype": "image/svg+xml"
          },
          {
            "@category": "thumbnail",
            "@_fa": "true",
            "$": "https://api.elsevier.com/content/object/eid/1-s2.0-S2468823125000847-si3.svg?httpAccept=%2A%2F%2A",
            "@multimediatype": "Scalable Vector Graphics file",
            "@type": "ALTIMG",
            "@size": "3007",
            "@ref": "si3",
            "@mimetype": "image/svg+xml"
          },
          {
            "@category": "thumbnail",
            "@_fa": "true",
            "$": "https://api.elsevier.com/content/object/eid/1-s2.0-S2468823125000847-si4.svg?httpAccept=%2A%2F%2A",
            "@multimediatype": "Scalable Vector Graphics file",
            "@type": "ALTIMG",
            "@size": "15798",
            "@ref": "si4",
            "@mimetype": "image/svg+xml"
          },
          {
            "@category": "thumbnail",
            "@_fa": "true",
            "$": "https://api.elsevier.com/content/object/eid/1-s2.0-S2468823125000847-si5.svg?httpAccept=%2A%2F%2A",
            "@multimediatype": "Scalable Vector Graphics file",
            "@type": "ALTIMG",
            "@size": "16801",
            "@ref": "si5",
            "@mimetype": "image/svg+xml"
          },
          {
            "@category": "thumbnail",
            "@_fa": "true",
            "$": "https://api.elsevier.com/content/object/eid/1-s2.0-S2468823125000847-si6.svg?httpAccept=%2A%2F%2A",
            "@multimediatype": "Scalable Vector Graphics file",
            "@type": "ALTIMG",
            "@size": "18857",
            "@ref": "si6",
            "@mimetype": "image/svg+xml"
          },
          {
            "@category": "thumbnail",
            "@_fa": "true",
            "$": "https://api.elsevier.com/content/object/eid/1-s2.0-S2468823125000847-si7.svg?httpAccept=%2A%2F%2A",
            "@multimediatype": "Scalable Vector Graphics file",
            "@type": "ALTIMG",
            "@size": "20740",
            "@ref": "si7",
            "@mimetype": "image/svg+xml"
          },
          {
            "@category": "thumbnail",
            "@_fa": "true",
            "$": "https://api.elsevier.com/content/object/eid/1-s2.0-S2468823125000847-si8.svg?httpAccept=%2A%2F%2A",
            "@multimediatype": "Scalable Vector Graphics file",
            "@type": "ALTIMG",
            "@size": "20435",
            "@ref": "si8",
            "@mimetype": "image/svg+xml"
          },
          {
            "@category": "thumbnail",
            "@_fa": "true",
            "$": "https://api.elsevier.com/content/object/eid/1-s2.0-S2468823125000847-si9.svg?httpAccept=%2A%2F%2A",
            "@multimediatype": "Scalable Vector Graphics file",
            "@type": "ALTIMG",
            "@size": "16200",
            "@ref": "si9",
            "@mimetype": "image/svg+xml"
          }
        ]
      },
      "link": {
        "@rel": "abstract",
        "@href": "https://api.elsevier.com/content/abstract/scopus_id/85217421603"
      }
    }
  }
}