{
  "metadata": {
    "title": "Metal-organic frameworks derived bimetallic Cu-Co catalyst for efficient and selective hydrogenation of biomass-derived furfural to furfuryl alcohol",
    "authors": "; ; ",
    "journal": "Molecular Catalysis",
    "date": "2017-07-31",
    "doi": "10.1016/j.mcat.2017.04.018",
    "abstract": "",
    "uri": "https://api.elsevier.com/content/article/pii/S2468823117302250",
    "pii": "S2468823117302250"
  },
  "fulltext": {
    "full-text-retrieval-response": {
      "scopus-eid": "2-s2.0-85025452684",
      "originalText": "serial JL 315758 291210 291744 291790 291809 31 Molecular Catalysis MOLECULARCATALYSIS 2017-04-25 2017-04-25 2017-04-25 2017-04-25 2017-05-22T19:23:15 1-s2.0-S2468823117302250 S2468-8231(17)30225-0 S2468823117302250 10.1016/j.mcat.2017.04.018 S300 S300.1 FULL-TEXT 1-s2.0-S2468823117X00102 2021-10-25T08:48:04.452531Z 0 0 20170701 20170731 2017 2017-04-25T17:54:53.850312Z absattachment articleinfo articletitlenorm authfirstinitialnorm authfirstsurnamenorm cid cids contenttype copyright crossmark dateloaded dateloadedtxt datesearch datesort dateupdated dco docsubtype doctype doi eid ewtransactionid hubeid indexeddate issn issnnorm itemstage itemtransactionid itemweight openaccess openarchive pg pgfirst pglast pii piinorm pubdateend pubdatestart pubdatetxt pubyr sectiontitle sortorder srctitle srctitlenorm srctype ssids alllist content subj subheadings suppl tomb volfirst volissue volumelist webpdf webpdfpagecount yearnav figure table e-component body mmlmath acknowledge affil appendices articletitle auth authfirstini authfull authkeywords authlast grantnumber grantsponsor grantsponsorid highlightsabst primabst pubtype ref specialabst 2468-8231 24688231 true 436 436 C Volume 436 16 128 137 128 137 201707 July 2017 2017-07-01 2017-07-31 2017 Regular Papers article fla © 2017 Elsevier B.V. All rights reserved. METALORGANICFRAMEWORKSDERIVEDBIMETALLICCUCOCATALYSTFOREFFICIENTSELECTIVEHYDROGENATIONBIOMASSDERIVEDFURFURALFURFURYLALCOHOL WANG Y 1 Introduction 2 Experimental section 2.1 Catalysts preparation 2.2 Characterization of catalysts 2.3 Evaluation of catalytic performances 3 Results and discussion 3.1 Synthesis and characterization 3.2 Hydrogenation of furfural with various CuCo/C catalysts 3.3 Hydrogenation of furfural over catalyst CuCo0.4/C-873 4 Conclusion Acknowledgements Appendix A Supplementary data References PATEL 2016 836 855 A MARISCAL 2016 1144 1189 R RAMOS 2016 1829 1841 R ODRISCOLL 2016 194 201 A HALILU 2016 2216 2226 A LIU 2014 2535 2549 S LU 2015 1767 1778 B CORMA 2007 2411 2502 A VILLAVERDE 2013 87 92 M SITTHISA 2011 784 791 S CHOUDHARY 2011 1724 1728 V CHOUDHARY 2012 2022 2028 V VILLAVERDE 2015 6 10 M LI 2016 1339 1347 J PANAGIOTOPOULOU 2015 2046 2054 P HALILU 2016 2216 2226 A BIRADAR 2014 1434 1442 N FULAJTAROVA 2015 78 85 K KHROMOVA 2016 1413 1423 S SHARMA 2013 127 136 R HUANG 2016 14104 14108 S SRIVASTAVA 2015 816 823 S DAS 2012 591 599 R SONG 2015 7267 7279 Y ZHANG 2012 25 29 F TAN 2014 16377 16383 H WU 2013 11126 11129 R WANG 2016 104 111 Y ZHANG 2016 447 456 Y JIANG 2013 11770 11775 Z LEE 2014 10435 10443 J XIANG 2014 2792 2800 Y COLLINGE 2016 74 83 G CHEN 2017 192 199 B SHU 2015 88 94 Y JEONG 2016 609 615 H RUBIOCABALLERO 2014 233 236 J VARGASHERNANDEZ 2014 106 113 D SIDIK 2016 1 10 S NAKAGAWA 2014 2718 2726 Y NAGARAJA 2007 29 37 B HRONEC 2012 100 104 M MERLO 2009 1665 1669 A GUISNET 2001 83 96 M WANGX2017X128 WANGX2017X128X137 WANGX2017X128XY WANGX2017X128X137XY 2019-04-25T00:00:00Z http://creativecommons.org/licenses/by-nc-nd/4.0/ © 2017 Elsevier B.V. All rights reserved. 0 item S2468-8231(17)30225-0 S2468823117302250 1-s2.0-S2468823117302250 10.1016/j.mcat.2017.04.018 315758 2017-05-22T14:51:53.419135-04:00 2017-07-01 2017-07-31 1-s2.0-S2468823117302250-main.pdf https://s3-eu-west-1.amazonaws.com/prod-ucs-content-store-eu-west/content/pii:S2468823117302250/MAIN/application/pdf/253e608115bede83c2eadf44c7c61028/main.pdf https://s3.amazonaws.com/prod-ucs-content-store-us-east/content/pii:S2468823117302250/MAIN/application/pdf/253e608115bede83c2eadf44c7c61028/main.pdf main.pdf pdf true 4082099 MAIN 10 1-s2.0-S2468823117302250-main_1.png https://s3-eu-west-1.amazonaws.com/prod-ucs-content-store-eu-west/content/pii:S2468823117302250/PREVIEW/image/png/cc1bf8a2fd168801781b295950d4cd36/main_1.png https://s3.amazonaws.com/prod-ucs-content-store-us-east/content/pii:S2468823117302250/PREVIEW/image/png/cc1bf8a2fd168801781b295950d4cd36/main_1.png main_1.png png 56710 849 656 IMAGE-WEB-PDF 1 1-s2.0-S2468823117302250-fx1.sml https://s3-eu-west-1.amazonaws.com/prod-ucs-content-store-eu-west/content/pii:S2468823117302250/fx1/THUMBNAIL/image/gif/e3e5e42125dfde2ba8faa25e68468ae8/fx1.sml https://s3.amazonaws.com/prod-ucs-content-store-us-east/content/pii:S2468823117302250/fx1/THUMBNAIL/image/gif/e3e5e42125dfde2ba8faa25e68468ae8/fx1.sml fx1 true fx1.sml sml 6807 164 201 IMAGE-THUMBNAIL 1-s2.0-S2468823117302250-gr1.sml https://s3-eu-west-1.amazonaws.com/prod-ucs-content-store-eu-west/content/pii:S2468823117302250/gr1/THUMBNAIL/image/gif/996e75d4d9cab148eb2fb998572c8d98/gr1.sml https://s3.amazonaws.com/prod-ucs-content-store-us-east/content/pii:S2468823117302250/gr1/THUMBNAIL/image/gif/996e75d4d9cab148eb2fb998572c8d98/gr1.sml gr1 gr1.sml sml 6232 72 219 IMAGE-THUMBNAIL 1-s2.0-S2468823117302250-gr2.sml https://s3-eu-west-1.amazonaws.com/prod-ucs-content-store-eu-west/content/pii:S2468823117302250/gr2/THUMBNAIL/image/gif/7309d2600f3a10f7b75d7c8d1a473d24/gr2.sml https://s3.amazonaws.com/prod-ucs-content-store-us-east/content/pii:S2468823117302250/gr2/THUMBNAIL/image/gif/7309d2600f3a10f7b75d7c8d1a473d24/gr2.sml gr2 gr2.sml sml 5791 163 104 IMAGE-THUMBNAIL 1-s2.0-S2468823117302250-gr3.sml https://s3-eu-west-1.amazonaws.com/prod-ucs-content-store-eu-west/content/pii:S2468823117302250/gr3/THUMBNAIL/image/gif/fec52523bf9641d4a7286594aa731d74/gr3.sml https://s3.amazonaws.com/prod-ucs-content-store-us-east/content/pii:S2468823117302250/gr3/THUMBNAIL/image/gif/fec52523bf9641d4a7286594aa731d74/gr3.sml gr3 gr3.sml sml 13973 164 204 IMAGE-THUMBNAIL 1-s2.0-S2468823117302250-gr4.sml https://s3-eu-west-1.amazonaws.com/prod-ucs-content-store-eu-west/content/pii:S2468823117302250/gr4/THUMBNAIL/image/gif/a517445305df125652d5762edb1d2e49/gr4.sml https://s3.amazonaws.com/prod-ucs-content-store-us-east/content/pii:S2468823117302250/gr4/THUMBNAIL/image/gif/a517445305df125652d5762edb1d2e49/gr4.sml gr4 gr4.sml sml 12486 82 219 IMAGE-THUMBNAIL 1-s2.0-S2468823117302250-gr5.sml https://s3-eu-west-1.amazonaws.com/prod-ucs-content-store-eu-west/content/pii:S2468823117302250/gr5/THUMBNAIL/image/gif/609c0beec27f40cc7b96fbb1500d8052/gr5.sml https://s3.amazonaws.com/prod-ucs-content-store-us-east/content/pii:S2468823117302250/gr5/THUMBNAIL/image/gif/609c0beec27f40cc7b96fbb1500d8052/gr5.sml gr5 gr5.sml sml 13171 164 180 IMAGE-THUMBNAIL 1-s2.0-S2468823117302250-gr6.sml https://s3-eu-west-1.amazonaws.com/prod-ucs-content-store-eu-west/content/pii:S2468823117302250/gr6/THUMBNAIL/image/gif/862d0daa967e26def985085c73b7ee45/gr6.sml https://s3.amazonaws.com/prod-ucs-content-store-us-east/content/pii:S2468823117302250/gr6/THUMBNAIL/image/gif/862d0daa967e26def985085c73b7ee45/gr6.sml gr6 gr6.sml sml 4630 120 219 IMAGE-THUMBNAIL 1-s2.0-S2468823117302250-gr7.sml https://s3-eu-west-1.amazonaws.com/prod-ucs-content-store-eu-west/content/pii:S2468823117302250/gr7/THUMBNAIL/image/gif/e195fb7832f570c60b66d22696a01539/gr7.sml https://s3.amazonaws.com/prod-ucs-content-store-us-east/content/pii:S2468823117302250/gr7/THUMBNAIL/image/gif/e195fb7832f570c60b66d22696a01539/gr7.sml gr7 gr7.sml sml 11576 164 204 IMAGE-THUMBNAIL 1-s2.0-S2468823117302250-gr8.sml https://s3-eu-west-1.amazonaws.com/prod-ucs-content-store-eu-west/content/pii:S2468823117302250/gr8/THUMBNAIL/image/gif/4cb1f83cd6b3a9c4d85b338563aa4f07/gr8.sml https://s3.amazonaws.com/prod-ucs-content-store-us-east/content/pii:S2468823117302250/gr8/THUMBNAIL/image/gif/4cb1f83cd6b3a9c4d85b338563aa4f07/gr8.sml gr8 gr8.sml sml 6042 156 219 IMAGE-THUMBNAIL 1-s2.0-S2468823117302250-gr9.sml https://s3-eu-west-1.amazonaws.com/prod-ucs-content-store-eu-west/content/pii:S2468823117302250/gr9/THUMBNAIL/image/gif/f1fc0fcae403f37158cf50a8c3292ad6/gr9.sml https://s3.amazonaws.com/prod-ucs-content-store-us-east/content/pii:S2468823117302250/gr9/THUMBNAIL/image/gif/f1fc0fcae403f37158cf50a8c3292ad6/gr9.sml gr9 gr9.sml sml 4608 86 219 IMAGE-THUMBNAIL 1-s2.0-S2468823117302250-fx1.jpg https://s3-eu-west-1.amazonaws.com/prod-ucs-content-store-eu-west/content/pii:S2468823117302250/fx1/DOWNSAMPLED/image/jpeg/0be931a03d9139619fd21c71fe2ccc81/fx1.jpg https://s3.amazonaws.com/prod-ucs-content-store-us-east/content/pii:S2468823117302250/fx1/DOWNSAMPLED/image/jpeg/0be931a03d9139619fd21c71fe2ccc81/fx1.jpg fx1 true fx1.jpg jpg 11097 245 301 IMAGE-DOWNSAMPLED 1-s2.0-S2468823117302250-gr1.jpg https://s3-eu-west-1.amazonaws.com/prod-ucs-content-store-eu-west/content/pii:S2468823117302250/gr1/DOWNSAMPLED/image/jpeg/3e8b01d70b09d37a3f594bca660c644d/gr1.jpg https://s3.amazonaws.com/prod-ucs-content-store-us-east/content/pii:S2468823117302250/gr1/DOWNSAMPLED/image/jpeg/3e8b01d70b09d37a3f594bca660c644d/gr1.jpg gr1 gr1.jpg jpg 28603 187 565 IMAGE-DOWNSAMPLED 1-s2.0-S2468823117302250-gr2.jpg https://s3-eu-west-1.amazonaws.com/prod-ucs-content-store-eu-west/content/pii:S2468823117302250/gr2/DOWNSAMPLED/image/jpeg/2047e2cce350972fb3b8bdf27a171871/gr2.jpg https://s3.amazonaws.com/prod-ucs-content-store-us-east/content/pii:S2468823117302250/gr2/DOWNSAMPLED/image/jpeg/2047e2cce350972fb3b8bdf27a171871/gr2.jpg gr2 gr2.jpg jpg 51658 589 376 IMAGE-DOWNSAMPLED 1-s2.0-S2468823117302250-gr3.jpg https://s3-eu-west-1.amazonaws.com/prod-ucs-content-store-eu-west/content/pii:S2468823117302250/gr3/DOWNSAMPLED/image/jpeg/c1576c1bbeaa2a0dd18e9c9a3f3b2d65/gr3.jpg https://s3.amazonaws.com/prod-ucs-content-store-us-east/content/pii:S2468823117302250/gr3/DOWNSAMPLED/image/jpeg/c1576c1bbeaa2a0dd18e9c9a3f3b2d65/gr3.jpg gr3 gr3.jpg jpg 111358 575 715 IMAGE-DOWNSAMPLED 1-s2.0-S2468823117302250-gr4.jpg https://s3-eu-west-1.amazonaws.com/prod-ucs-content-store-eu-west/content/pii:S2468823117302250/gr4/DOWNSAMPLED/image/jpeg/b087d96b673c74c00e9341528351c41b/gr4.jpg https://s3.amazonaws.com/prod-ucs-content-store-us-east/content/pii:S2468823117302250/gr4/DOWNSAMPLED/image/jpeg/b087d96b673c74c00e9341528351c41b/gr4.jpg gr4 gr4.jpg jpg 112225 282 753 IMAGE-DOWNSAMPLED 1-s2.0-S2468823117302250-gr5.jpg https://s3-eu-west-1.amazonaws.com/prod-ucs-content-store-eu-west/content/pii:S2468823117302250/gr5/DOWNSAMPLED/image/jpeg/a8e40600d447cf5ef95efd83d9f150d7/gr5.jpg https://s3.amazonaws.com/prod-ucs-content-store-us-east/content/pii:S2468823117302250/gr5/DOWNSAMPLED/image/jpeg/a8e40600d447cf5ef95efd83d9f150d7/gr5.jpg gr5 gr5.jpg jpg 104150 684 753 IMAGE-DOWNSAMPLED 1-s2.0-S2468823117302250-gr6.jpg https://s3-eu-west-1.amazonaws.com/prod-ucs-content-store-eu-west/content/pii:S2468823117302250/gr6/DOWNSAMPLED/image/jpeg/d1112376f8dcc696b3cbeb1d5009b6ee/gr6.jpg https://s3.amazonaws.com/prod-ucs-content-store-us-east/content/pii:S2468823117302250/gr6/DOWNSAMPLED/image/jpeg/d1112376f8dcc696b3cbeb1d5009b6ee/gr6.jpg gr6 gr6.jpg jpg 28800 309 565 IMAGE-DOWNSAMPLED 1-s2.0-S2468823117302250-gr7.jpg https://s3-eu-west-1.amazonaws.com/prod-ucs-content-store-eu-west/content/pii:S2468823117302250/gr7/DOWNSAMPLED/image/jpeg/fcf593df728d6b748e87de46faccfa55/gr7.jpg https://s3.amazonaws.com/prod-ucs-content-store-us-east/content/pii:S2468823117302250/gr7/DOWNSAMPLED/image/jpeg/fcf593df728d6b748e87de46faccfa55/gr7.jpg gr7 gr7.jpg jpg 132986 575 715 IMAGE-DOWNSAMPLED 1-s2.0-S2468823117302250-gr8.jpg https://s3-eu-west-1.amazonaws.com/prod-ucs-content-store-eu-west/content/pii:S2468823117302250/gr8/DOWNSAMPLED/image/jpeg/771b04036ce6f1ea2daa98ae70bb47ae/gr8.jpg https://s3.amazonaws.com/prod-ucs-content-store-us-east/content/pii:S2468823117302250/gr8/DOWNSAMPLED/image/jpeg/771b04036ce6f1ea2daa98ae70bb47ae/gr8.jpg gr8 gr8.jpg jpg 14044 268 376 IMAGE-DOWNSAMPLED 1-s2.0-S2468823117302250-gr9.jpg https://s3-eu-west-1.amazonaws.com/prod-ucs-content-store-eu-west/content/pii:S2468823117302250/gr9/DOWNSAMPLED/image/jpeg/e26bef99a791f334a706796fdda04a15/gr9.jpg https://s3.amazonaws.com/prod-ucs-content-store-us-east/content/pii:S2468823117302250/gr9/DOWNSAMPLED/image/jpeg/e26bef99a791f334a706796fdda04a15/gr9.jpg gr9 gr9.jpg jpg 36533 281 715 IMAGE-DOWNSAMPLED 1-s2.0-S2468823117302250-mmc1.docx https://s3-eu-west-1.amazonaws.com/prod-ucs-content-store-eu-west/content/pii:S2468823117302250/mmc1/MAIN/application/msword/ac23968d0940b889091f35b6dd9d2d34/mmc1.docx https://s3.amazonaws.com/prod-ucs-content-store-us-east/content/pii:S2468823117302250/mmc1/MAIN/application/msword/ac23968d0940b889091f35b6dd9d2d34/mmc1.docx mmc1 mmc1.docx docx 10098330 APPLICATION 1-s2.0-S2468823117302250-si1.gif https://s3-eu-west-1.amazonaws.com/prod-ucs-content-store-eu-west/content/pii:S2468823117302250/STRIPIN/image/gif/ea8f2405e3a185df5ac1937db9f9b817/si1.gif https://s3.amazonaws.com/prod-ucs-content-store-us-east/content/pii:S2468823117302250/STRIPIN/image/gif/ea8f2405e3a185df5ac1937db9f9b817/si1.gif si1 si1.gif gif 1555 30 356 ALTIMG 1-s2.0-S2468823117302250-si2.gif https://s3-eu-west-1.amazonaws.com/prod-ucs-content-store-eu-west/content/pii:S2468823117302250/STRIPIN/image/gif/4b8dd6dd96b6b560bf750f1bb74b3f46/si2.gif https://s3.amazonaws.com/prod-ucs-content-store-us-east/content/pii:S2468823117302250/STRIPIN/image/gif/4b8dd6dd96b6b560bf750f1bb74b3f46/si2.gif si2 si2.gif gif 1430 30 326 ALTIMG MCAT 154 S2468-8231(17)30225-0 10.1016/j.mcat.2017.04.018 Elsevier B.V. Fig. 1 Schematic illustration of the synthetic strategy of CuCo/C catalyst. Fig. 1 Fig. 2 XRD patterns of CuCo/C catalysts with different Co to Cu molar ratio (A) and different calcination temperature (B). Fig. 2 Fig. 3 XPS spectra for catalysts CuCo0.4/C-773, CuCo0.4/C-873 and CuCo0.5/C-873: full range XPS spectrums (A), Cu 2p3/2 spectra (B), Cu LMM spectra (C) and Co 2p3/2 spectra (D). Fig. 3 Fig. 4 SEM images of CuCo0.4/C-773 (A-B), CuCo0.4/C-873 (C-D), CuCo0.4/C-973 (E-F) and CuCo0.4/C-1073 (G-H). Fig. 4 Fig. 5 TEM images of Cu/C-873 (A-B), CuCo0.4/C-873 (D-E) and CuCo0.4/C-1073 (G-H) and Particle size distributions of Cu/C-873 (C) and CuCo0.4/C-873 (F). Fig. 5 Fig. 6 Possible products during furfural hydrogenation. Fig. 6 Fig. 7 (A) Effect of catalyst amount (15wt% furfural in solution; 413K; 3MPa), (B) furfural concentration (0.7g catalyst; 413K; 3MPa), (C) initial hydrogenation pressure (0.7g catalyst; 15wt% furfural in solution; 413K), and (D) reaction temperature (0.7g catalyst; 15wt% furfural in solution; 3MPa) on conversion of furfural and selectivity toward furfuryl alcohol. Fig. 7 Fig. 8 Recycling study of catalyst CuCo0.4/C-873 in furfural hydrogenation (reaction conditions: 0.7g catalyst; 15wt% furfural in ethanol solution; 413K; 3MPa). Fig. 8 Fig. 9 XRD patterns (A) and TG curves (B) of fresh CuCo0.4/C-873 catalyst (a) and CuCo0.4/C-873 used for four times (b). Fig. 9 Table 1 Physicochemical characterization of prepared CuCo/C catalysts. Table 1 Catalyst SBET (cm2/g) Vp (cm3/g) dp (nm) dM (nm) dCu dCo Cu/C-873 93.6 0.168 10.13 28.2 – CuCo0.1/C-873 74.3 0.188 9.63 10.5 – CuCo0.2/C-873 72.6 0.185 9.54 10.8 8.9 CuCo0.3/C-873 70.3 0.183 9.26 9.9 10.2 CuCo0.4/C-873 68.8 0.182 8.98 10.4 10.1 CuCo0.5/C-873 66.9 0.179 8.75 10.6 9.7 CuCo0.4/C-773 91.5 0.176 8.29 9.3 8.5 CuCo0.4/C-973 23.1 0.074 11.64 39.8 37.7 CuCo0.4/C-1073 17.4 0.061 14.39 54.6 51.3 Table 2 Catalytic performance of CuCo/C catalysts for the hydrogenation of FFA. a Table 2 Entry Catalyst Conversion (%) Selectivity (%) FOL 2-FA b 1 Cu/C-873 46.6 81.3 16.3 2 CuCo0.1/C-873 55.9 95.2 2.5 3 CuCo0.2/C-873 71.6 97.2 1.8 4 CuCo0.3/C-873 89.6 97.2 1.7 5 CuCo0.4/C-873 98.7 97.7 1.3 6 CuCo0.5/C-873 99.0 97.3 1.5 7 CuCo0.4/C-773 91.8 96.4 1.8 8 CuCo0.4/C-973 73.4 92.5 5.2 9 CuCo0.4/C-1073 22.9 1.3 97.3 a Reaction conditions: 0.7g catalyst; 15wt% furfural in ethanol solution; 413K; 3MPa. b FFA: furfural; FOL: furfuryl alcohol; 2-FA: 2-furaldehyde diethyl acetal. Table 3 Effect of solvent on furfural hydrogenation over CuCo0.4/C-873. a Table 3 Entry Solvent Solvent Polarity FFA Conversion (%) FOL Selectivity (%) 1 Water 10.2 40.6 62.3 2 Ethanol 4.3 98.7 97.7 3 Methanol 6.6 99.6 97.0 4 Toluene 2.4 80.7 98.6 5 Hexane 0.06 47.5 93.9 a Reaction conditions: 0.7g catalyst; 15wt% furfural in solution; 413K; 3MPa. Editor’s choice paper Metal-organic frameworks derived bimetallic Cu-Co catalyst for efficient and selective hydrogenation of biomass-derived furfural to furfuryl alcohol Yuan Wang Yanan Miao Shuai Li Lijing Gao Guomin Xiao ⁎ School of Chemistry and Chemical Engineering, Southeast University, Nanjing 211189, PR China School of Chemistry and Chemical Engineering Southeast University Nanjing 211189 PR China ⁎ Corresponding author. Graphical abstract In this study we report an efficient CuCo bimetallic catalyst with highly dispersed CuCo-based mixed metal/metal oxide on porous carbon matrix for the hydrogenation of furfural to furfuryl alcohol. The catalyst is derived from Co-doped Cu-BTC metal-organic frameworks (MOFs) by thermolysis in nitrogen atmosphere at temperatures ranging from 773K to 1073K. The best catalytic performance is achieved when cobalt to copper molar ratio is 0.4 and the precursor is calcined at 873K. The characterization of prepared catalytic materials is done by multi-techniques including XRD, XPD, SEM, TEM, TG and BET analysis. The sum of their results reveal that the doping of cobalt helps the dispersion of nanoparticles of copper and cobalt and thermolysis temperature has an impact on both the particle size and the chemical states. The resulting catalyst CuCo0.4/C-873 shows 98.7% furfural conversion and 97.7% furfuryl alcohol selectivity in ethanol solvent with good stability which is better than most reported catalysts. Keywords Metal organic frameworks CuCo/C catalyst Furfural Furfuryl alcohol Hydrogenation 1 Introduction Biomass is an ideal alternative to fossil fuels as a feedstock of fine chemicals and fuels due to its abundance and sustainability [1]. The application of biomass-derived chemicals and energy can alleviate the energy crisis efficiently. Furfural, as one of major biomass platform chemicals, can be primarily produced from acid-catalyzed hydrolysis of hemicellulose and then converted into diverse chemicals and fuels [2,3]. And about 60% of the furfural produced all around the world is converted to furfuryl alcohol every year [4]. Furfuryl alcohol is an important industrial chemical and has a wide range of applications in polymer industries and fine chemical. It is widely used in the production of thermostatic resins, fiber glass, polymer concrete and liquid resins for galvanic bath tub [5,6]. Besides, it is also employed as a chemical intermediate for the synthesis of lysine, vitamin C, lubricants, dispersing agents, binders and adhesives [7]. In industry, copper chromite catalysts have been used in hydrogenation of furfural to furfuryl alcohol for decades [8]. The main drawbacks of copper chromite catalysts are the toxic nature of chromium oxides and their moderate activity in conversion of furfural [9]. Thus, many research interests have been drawn to design environmentally friendly catalysts for conversion of furfural to furfuryl alcohol with high activity and selectivity. For example, S. Sitthisa et al. [10] reported that furfuryl alcohol is the main product over Cu/SiO2 and furan is the dominant product with catalyst Pd/SiO2. In addition, ring opening products (butanal, butanol and butane) are dominating over catalyst Ni/SiO2. Hydrogenation of furfural to furfuryl alcohol can take place both in the liquid and gas phase. In comparison with the liquid phase process, a high reaction temperature is always employed to vaporize the furfural in gas phase hydrogenation, which means a higher consumption of energy. Thus, liquid phase process is preferable in consideration of safety and energy efficiency. Besides, liquid phase chemistry is possibly preferred for compatibility with the upstream production [11,12]. In addition, some researchers [13–15] have reported the liquid phase hydrogenation of furfural through catalytic transfer hydrogenation by using secondary alcohols as hydrogen donors. In the catalytic transfer hydrogenation, furfural concentration in reaction solvent is pretty low such as 1wt% [15], 2wt% [14] and 2.5wt% [13], because adequate hydrogen donor should be provided to ensure high furfural conversion. While the furfural concentration can reach 34wt% in process that molecular H2 as hydrogen source [16]. Thus, the catalytic transfer hydrogenation always suffers from low production efficiency. Another advantage of using H2 molecular as hydrogen source is the cheap price of hydrogen due to the increased production of shale gas. The liquid phase furfural hydrogenation with H2 molecular as hydrogen source has been studied using various metal-based catalysts including Pt, Pd, Co, Cu and Ni [17–20]. Among all tested catalysts, Cu has been the most frequently employed metal, because it can selectively hydrogenate the CO bond while leaving the furan ring untouched [9]. Besides, a second metal is often added to improve the selectivity and/or the activity of monometallic catalysts because the catalytic performance can be modified by structure and electronic effects. K. Fulajtarova et al. [18] reported 98.7% furfuryl alcohol selectivity and total furfural conversion over catalyst 5% Pd-5% Cu/MgO but only 59.6% furfuryl alcohol selectivity and 92.1% conversion over 5% Pd/MgO in aqueous hydrogenation of furfural to furfuryl alcohol, illustrating the promoting effect of copper. S. Huang et al. [21] even achieved 100% yield of furfuryl alcohol over hollow-core Pt-Cu catalyst at 423K, 2MPa H2 and 10h. From the consideration of high price of precious metal, some non-noble metal modified Cu-based catalysts also have been explored. S. A. Khromova et al. [19] reported bimetallic Ni-Cu catalysts for the liquid phase selective hydrogenation of furfural to furfuryl alcohol with selectivity of 90% at high reaction temperature (523K). S. Srivastava et al. [22] optimized different operating parameters on the conversion of furfural to furfuryl alcohol over Cu-Co/SBA-15 and 96.7% yield of furfuryl alcohol was achieved at optimized conditions (403K, 3MPa H2, 3h, 1g catalyst and furfural to solvent ratio 1:7). Although many active catalysts have been developed for liquid phase hydrogenation of furfural to furfuryl alcohol, there is no catalyst that can replace copper chromite catalysts for industrial application due to either severe deactivation or less activity/selectivity. Within the present work, CuCo/C nanocomposites are fabricated by one-step thermal decomposition of Co-doped copper-containing metal-organic frameworks (MOFs) (Cu-BTC, BTC=1,3,5-benzene tricarboxylate) and applied in hydrogenation of furfural to furfuryl alcohol in liquid phase. As a new class of porous materials, MOFs have recently been considered as ideal sacrificial templates for the preparation of various carbon-based metal and metal oxides nanoparticles because of their excellent properties such as ordered structures, high surface area and tunable functionality [23,24]. The ordered porous structure and long Cu-Cu dimer distance in Cu-BTC enable the uniform dispersion of cobalt ions in the channel of Cu-BTC [25]. While the confinement effect of MOFs ensures high dispersion of the metal/metal oxides nanoparticles throughout porous carbon which derives from the organic ligands of MOFs and the carbon matrix can stabilize the metal/metal oxide particles and prevent them from aggregation [26]. The prepared CuCo/C catalysts show excellent catalytic performance in selective hydrogenation of furfural to furfuryl alcohol with good stability. The characterization and catalytic behavior of CuCo/C were investigated in detail. To the best of our knowledge, these novel CuCo/C hybrid nanocomposites used as the catalysts for hydrogenation of furfural to furfuryl alcohol have not been reported so far. 2 Experimental section 2.1 Catalysts preparation All of the chemicals used were of analytical grade and used without further purification. Cu-BTC MOFs were synthesized by the method according to the literature with some minor revision [27]. In a typical synthesis, the methanol solution of copper nitrate was prepared by dissolving 5.46g cupric nitrate trihydrate in 1000ml methanol, and the methanol solution of benzene-1,3,5-tricarboxylic acid was prepared by dissolving 3.492g benzene-1,3,5-tricarboxylic acid in 1000ml methanol. Then, the obtained two solutions were mixed by pouring the copper nitrate solution into the tricarboxylic acid solution and kept at room temperature for 2h until MOFs precipitated finished. The precipitation was retrieved by filtration and washed with methanol to remove the possible residues, dried under vacuum and kept for further use. The successful synthesis of octahedral Cu-BTC was confirmed by scanning electron microscopy (SEM), FT-IR spectrum and Powder X-ray diffraction (XRD) (Fig. S1). CuCo/C bimetallic catalysts were obtained by thermal decomposition of the Cu-BTC precursor impregnated with Co2+ ions. Typically, a predetermined amount of cobalt nitrate hexahydrate was dissolved in 50mL ethanol. Then, 5g Cu-BTC was added to the cobalt nitrate solution. The mixture was stirred for 24h and then dried by rotary evaporator at 323K for 0.5h. The precursor was labeled as Cu-BTC/CN-m, where m represents the molar ratio of Co to Cu (m=0.1, 0.2, 0.3, 0.4 and 0.5). The resulting solid was calcined at varying temperatures for 2h under N2 flow (80mL/min). The as-synthesized catalysts were denoted as CuCox/C-y, where x denotes the molar ratio of Co to Cu (x=0.1, 0.2, 0.3, 0.4 and 0.5) and y denotes the calcination temperature (y=773K, 873K, 973K and 1073K). 2.2 Characterization of catalysts Powder X-ray diffraction (XRD) was analyzed on an Ultima IV X-ray diffractometer with Cu Kα radiation, operating at 40kV and 30mA. The average crystallite size of metallic copper and cobalt was calculated by Scherrer equation: D=Kλ/(Bcosθ). Fourier transformed infrared (FT-IR) patterns were collected on a TENSOR27 PMA 50 spectrophotometer using KBr disks. Thermal gravimetric analysis (TG) was measured with a TA SDT-Q600 thermo gravimetric analyzer. The samples were heated from 323K to 1073K at a heating rate of 20K/min under N2 atmosphere. N2 adsorption-desorption isotherm of the samples was performed at 77K, using a Beishide 3H-2000PS1 instrument. Samples degassing was carried out at 473K prior to acquisition of the adsorption isotherm. The surface area was calculated using the multipoint Brunauer-Emmett-Teller (BET) method. The pore volume and pore size were calculated from desorption branches of the isotherms with the Barrett-Joyner-Halenda (BJH) method. The morphology of the catalysts was investigated with an S-4800II FESEM scanning electron microscopy (SEM) with an accelerating voltage of 15.0kV. Transmission electron microscopy (TEM) images were obtained on a Tecnai G2 20 high resolution transmission electron microscopy operated at 200.0kV. X-ray photoelectron spectroscopy (XPS) was performed on an ESCALAB-250 spectrometer with a monochromatic Al Kα (1486.6eV) source. The obtained binding energies were calibrated using the C1s peak (284.6eV) as the reference. 2.3 Evaluation of catalytic performances Catalytic tests were performed in a 100mL stainless steel autoclave equipped with an electromagnetic driven stirrer at a stirring speed of 900rpm. The calculated quantities of furfural, catalyst and solvent were charged into the autoclave which was purged with H2 three times and then pressurized with H2 to the desired pressure. The reaction temperature was raised to the desired value and agitation was started. Reaction time zero was defined when the reaction temperature reached the desired one. The experiment was rapidly stopped with an ice-bath after reaction for 1h and the liquid phase was separated from the catalyst by centrifugation. The total mass of the reaction solution was 60g, while the weight percentage of furfural was 5wt%, 10wt%, 15wt%, 20wt% and 25wt%. The catalyst dosage ranged from 0.1g to 0.9g. The solvents were deionized water, ethanol (AR,≥95%), methanol (AR,≥99.5%), toluene (AR,≥99.5%) and hexane (AR,≥97.0%). They were obtained from commercial supplier and used as provided. The initial hydrogen pressure ranged from 1MPa to 5MPa and the reaction temperature ranged from 383K to 423K. The reaction products were analyzed by an Ouhua GC 9160 gas chromatograph (GC) equipped with a flame ionization detector (FID) and a capillary column (SE-54, 30m×0.32mm×0.5μm). The chromatographic conditions were as follows: the vaporization temperature was 573K and the detector temperature was 553K. The column temperature was kept at 323K for 2min firstly. Then the temperature was raised to 453K with a ramp rate of 5K/min and finally kept at 453K for 5 min. The reproducibility of the results was examined, and the error in all experiments was <2 %. The mass balance of carbon which was all about 96% if not specified was calculated by the sum of unreacted furfural and reaction products in comparison with fed furfural. Furfural conversion and product selectivity were calculated and defined as follows: C o n v e n t i o n o f f u r f u r a l = ( 1 − mole of furfural ⁣ after reaction mole of furfural introduced ) × 100 % , S e l e c t i v i t y o f p r o d u c t s = ( mole of each product mole of furfural consumed ) × 100 % . 3 Results and discussion 3.1 Synthesis and characterization As shown in Fig. 1 , Cu-BTC crystal with smooth surface and uniform octahedral structure (Fig. S1D) was first synthesized and employed as a precursor to obtain Cu-BTC/CN. The molar ratio of Co to Cu was controlled between 0.1 and 0.5, because in this range the octahedral structure could be well preserved after pyrolysis which is the key to the porous and high metallic dispersion of the obtained samples [28]. After impregnated with cobalt nitrate, the Co-doped Cu-BTC still keeps the octahedron morphology as illustrated by SEM pictures (Fig. S2). The XRD patterns of Cu-BTC/CN precursors with different Co to Cu molar ratio (Fig. S3) have the same characteristic peaks as Cu-BTC, which also indicates the well preserved structure of the obtained Cu-BTC/CN precursors. However, the peak intensity diminishes with the increase amount of cobalt nitrate which might be caused by the coverage of Cu hydroxide on the surface of Cu-BTC. During the impregnation process, protons generated from the hydrolysis of Co2+ ions can gradually etch Cu-BTC templates and releases Cu2+ ions. Then the Cu2+ ions coordinate with OH− firstly on the surface of Cu-BTC due to the different solubility of products of Co2+ and Cu2+. The hydrolysis of Co2+ ions may result from the insolubility property of Co hydroxide in ethanol and water introduced by the addition of cobalt nitrate hexahydrate. However, the amount of hydrolyzed Co2+ ions is pretty small due to the low content of water, thus the structure of Cu-BTC can be well preserved during the process. A similar process has been reported by Y. Zhang et al. and Z. Jiang et al. [29,30]. This phenomenon is also evidenced by the slightly wrinkled surface of Cu-BTC/CN as shown in Fig. S2D. The as-prepared Cu-BTC/CN was further transformed into CuCo/C by thermolysis in N2. As displayed in Fig. S4, the TG curve of Cu-BTC clearly has three apparent stages of mass loss. The initial weight loss of 28% below 473K is due to the loss of solvent molecules in Cu-BTC. Another obvious weight loss of 30% at 573–673K is due to the decomposition of Cu-BTC. During this transformation, the organic part of Cu-BTC was converted into amorphous carbon because of the carbonization reaction in inert atmosphere. Meanwhile, the metal ions can be reduced into metal by carbon under high temperature conditions. Thus, a great deal of weight has lost in this progress. When the temperature reaches 773K, the change of the TG curve is accompanied by the evaporation of CO2 and CO. Meanwhile, the addition of Co(NO3)2·6H2O leads to an additional weight loss at about 553K which is the decomposition temperature of cobalt nitrate. Besides that, the total mass loss for Cu-BTC/CN-0.4 is higher than Cu-BTC as shown in TG patterns. The main reason is that cobalt nitrate has a higher mass loss Than Cu-BTC in the process. Another reason is that more carbon has been consumed to reduce the added cobalt ions into cobalt metal. In the selected-area electron diffraction (SAED) pattern of CuCo0.4/C-873 (Fig. S5), only the diffraction rings of Cu and Co can be found, indicating that the carbon obtained is amorphous and lacks long-range order. Though almost complete decomposition of Cu-BTC/CN could be achieved at around 773K, we have studied the impact of thermolysis temperature in the range from 773K to 1073K because the oxidation states of metal ions in MOFs may vary with the decomposition temperature [31], which would influence their catalytic performance. The nature of the products is firstly investigated by powder XRD. Fig. 2 shows the XRD patterns of synthesized samples with different Co to Cu molar ratio and calcination temperature. All samples display characteristic peaks (2θ=43.5°, 50.6° and 74.2°) ascribed to cubic Cu phase (JCPDS no.04-0836) derived from the regular arranged metal nodes. With the doping of cobalt, the characteristic peaks located at 2θ=44.5° and 51.8° corresponding to cubic cobalt phase (JCPDS no.15-0806) are also observed in Cu-BTC/CN derived samples, suggesting a separate Cu and Co phase without the formation of a notable degree of solid solution. The width of peaks ascribed to Cu increases obviously in CuCo/C-873 samples compared to that of Cu/C-673, which indicates that the addition of cobalt ions helps the dispersion of Cu in the final product. In other words, Cu has better dispersion and smaller particle size with the doping of cobalt. This may be due to the partial substitution of cobalt for copper on the framework of Cu-BTC and/or the cobalt ions in the channel of Cu-BTC could prevent aggregation of copper ions in thermolysis process. As the percentage of cobalt increases, the peak intensity of Co increases gradually and that of Cu decreases steadily (Fig. 2A), which is in accordance with the change of metal content in the samples. In addition, with the increased thermolysis temperature, both diffraction peaks of Cu and Co become sharp gradually (Fig. 2B) and only a weak peak of Co (111) plane can be detected for CuCo0.4/C-773. This indicates that the aggregation of metal ions during the thermolysis process is inevitable even with the prevention effect of organic ligands. The crystallite size of metallic copper and cobalt calculated by Scherrer equation (Table 1 , column 5, 6) confirms the dispersed effect of Co and the aggregation of metal ions at high calcination temperature. It can also be found that the crystallite size of metallic copper and cobalt for all CuCo/C-873 samples is almost the same (about 10nm), which indicates that the dispersed effect of Co has no relationship with the amount of Co. The chemical composition of CuCo0.4/C-873 which has relatively better catalytic performance (this will be discussed later) was studied by XPS measurement. XPS spectrum (Fig. 3 A) reveals the presence of copper, cobalt, carbon and oxygen. Cu 2p3/2 (Fig. 3B) peak is at the binding energy of 932.3eV with no satellite. This result combined with the Cu LMM spectrum (Fig. 3C) indicates that copper species are in the zero-valent state. [32] Co 2p3/2 peak shows complex patterns (Fig. 3D) and the deconvolution of it leads to the identification of three patterns: zero-valent metal cobalt signal (778eV), cobalt oxides signals (779.1eV, 781.2eV) and the shakeup satellite signal (786.3eV) [33] which indicates the existence of cobalt oxides. CuCo0.5/C-873 was tested to investigate the impact of Cu to Co molar ratios on chemical states. The results show that copper exists in zero-valent and cobalt species display two states in CuCo0.5/C-873: metallic cobalt and cobalt oxides. The only difference is that zero-valent cobalt species have a lower atomic concentration compared to that of CuCo0.4/C-873. The chemical composition of CuCo0.4/C-773 was also tested to study the effect of thermolysis temperature (Fig. 3). The XPS spectrum of it reveals that copper species have zero-valent and divalent states, while oxidation state (bivalent cobalt and trivalent cobalt) is the dominated state in the cobalt species. It can be seen that total reduction of copper ions in Cu-BTC/CN precursors could only be achieved at temperatures above 873K in an inert atmosphere, while the percentage of metallic cobalt increases with thermolysis temperature. B. Chen et al. have reported that complete reduction of cobalt ions cannot be achieved even at a high temperature of 1073K [34]. The morphology of CuCo0.4/C at different thermolysis temperatures was characterized by SEM. As shown in Fig. 4 , the octahedral structure is not kept very well during the thermolysis process due to shrinkage. At low thermolysis temperatures (773K and 873K), three-dimensional structure can still be observed and the surface of obtained samples wrinkle obviously. What is more, on the surface of CuCo0.4/C-873 lamellar structure was formed, suggesting the slight collapse of the template. Further increase in thermolysis temperature (973K) leads to evident collapse into small particles (Fig. 4E–F). With the increase of calcination temperature to 1073K, the aggregation of collapsed particles is apparent and the sample has a more rounded appearance (Fig. 4G–H). The TEM experiments were also performed to characterize the micro-structure of CuCo/C. TEM images of Cu/C-873 (Fig. 5 A–B) and CuCo0.4/C-873 (Fig. 5D–E) show uniform dispersion of copper and cobalt particles which are embedded in the carbon matrix. The particle size distribution pictures of them (Fig. 5C, F) show that CuCo0.4/C-873 has a smaller mean particle size (9nm) compared with CuCo0.4/C-873 (46nm). The particle sizes are consistent well with the data calculated from XRD patterns. While at high thermolysis temperature (1073K), no metal/metal oxide particles can be found and they have sintered into pieces as indicated by the dark part in Fig. 5H. These findings are in accordance with the result of XRD that Cu has better dispersion with the doping of cobalt ions in Cu-BTC/CN precursors and high thermolysis temperature leads to increased copper and cobalt particle size. The BET surface area, pore volume and average pore diameter of these prepared samples are listed in Table 1 (column 2–4). The surface area of the catalyst decreases obviously from 93.6m2/g for Cu/C-873 to 74.3m2/g for CuCo0.1/C-873 accompanied by the decrease of average pore diameter, indicating that doped cobalt species exist in the channel of Cu-BTC precursor [35]. By further increasing the amount of Co, the surface area, pore volume and average diameter suffer from a little decrease. On the other side, the impact of thermolysis temperature on the structure of samples is huge. CuCo0.4/C-773 has a relatively high surface area compared to that of CuCo0.4/C-873, which also indicates the slight destruction of the structure as revealed by SEM. At the same time, CuCo0.4/C-973 and CuCo0.4/C-1073 undergo a sharp decrease in surface area (23.1m2/g and 17.4m2/g, respectively) and an increase in average pore diameter (11.61nm and 14.39nm, respectively), which demonstrates the collapse of the structure at high calcination temperature. N2 adsorption isotherms (Fig. S6) of all CuCo/C-873 materials exhibit type-IV shape, which is the characteristic type for mesoporous materials implying easy transport of furfural and products in the pores. 3.2 Hydrogenation of furfural with various CuCo/C catalysts The prepared CuCo/C catalysts were investigated for the reaction of furfural (FFA) to furfuryl alcohol (FOL) in ethanol. The catalytic activity and selectivity for FFA hydrogenation on different catalysts are listed in Table 2 . For all tested catalysts except CuCo0.4/C-1073, the predominant product is FOL and the main by-product is 2-furaldehyde diethyl acetal (2-FA) which is a product between furfural and alcohol solvent. The acetalization between furfural and ethanol can proceed in the absence of catalyst [36,37], thus high selectivity to 2-FA would be obtained when the catalyst is less active. The reaction pathway for the formation of 2-FA is shown in Fig. S7. The first step is the formation of a protonated intermediate (1) via protonation of the carbonyl group of furfural by H+ ion sourced from ethanol. Then, ethanol reacts with this intermediate forming the hemiacetal (2). A proton is removed from the hemiacetal which subsequently re-protonates and dehydrates to form another intermediate (3). Afterwards, this intermediate reacts with another ethanol molecule forming another intermediate (4) which is deprotonated to form 2-FA. Some minor components such as 2-methylfuran and tetrahydrofurfuryl alcohol are also identified for all catalysts except CuCo0.4/C-1073, as shown in Fig. 6 . It can be seen from Table 2 (Entry 1–6) that FOL selectivity improves a lot with the addition of cobalt (81.3% for Cu/C-873 and 95.1% for CuCo0.1/C-873, respectively) and the main by-product for Cu/C-873 is 2-FA accounting for 16% of the total product. At the same time, the selectivity of FOL keeps at a high level around 96% in all CuCo/C-873 catalysts. By further increasing the molar ratio of cobalt to copper from 0.1 to 0.4, the conversion of FFA increases steadily from 55.9% to 98.7%. Both CuCo0.4/C-873 and CuCo0.5/C-873 show high FOL yield. The increased furfuryl alcohol selectivity may result from the better dispersion of metal particles and tuned structure of active sites by the doping of cobalt. The hydrogenation of furfural to furfuryl alcohol requires the selective activation of CO bond of FFA and the dissociation of hydrogen. For catalyst Cu/C-873, metal copper acts as an active site for both the activation of CO bond and the dissociation of hydrogen molecule. And the relatively large copper particle size is less active in hydrogen activation [13,38]. With the doping of cobalt, a better dispersion and smaller particle size of copper and cobalt particles can be achieved in the bimetallic CuCo/C-873 catalysts which will contribute to more active sites for the reaction to take place as revealed by XRD and TEM characterization [39]. Besides, the cobalt oxide (CoOx) can interact with the CO group strongly due to the presence of cationic species [40]. Thus, more activated CO group can be prepared for hydrogenation as more CoOx sites are available in catalysts with high content of cobalt. In addition, metallic cobalt is more active in hydrogen dissociation than copper. Though single metallic cobalt may active both the CO bond and the furan ring, the synergistic effect of copper and cobalt may prevent the activation of furan ring. Therefore, bimetal CuCo/C-873 catalysts have a better catalytic performance than Cu/C-873. As for different calcination temperatures from 773K to 1073K with the same copper to cobalt molar ratio (Table 2, Entry 5, 7–9), CuCo0.4/C-873 has the best catalytic performance regarding conversion and FOL yield. The existence of CuO in catalyst CuCo0.4/C-773 may be responsible for its relatively low conversion. The inactive role of CuO in hydrogenation of furfural to furfuryl alcohol has been found over catalysts Cu/SBA-15 and Cu-MgO-Cr2O3 [38,41]. At higher thermolysis temperatures, the conversion of FFA drops dramatically which is most likely due to the increased particle size. And the high degree of aggregation of copper and cobalt particles in CuCo0.4/C-1073 has caused a severe drop in hydrogenation activity as only trace amounts of FOL could be detected in CuCo0.4/C-1073 reaction system. Based on the above experimental results, a possible reaction mechanism of the chemoselective hydrogenation process catalyzed by CuCo/C catalyst in ethanol is proposed. The reduction of furfural to furfuryl alcohol would proceed in several consecutive steps. Firstly, the furfural substrate is adsorbed on the surface of CuCo/C catalyst and interacts with Cu and CoOx via the CO bond. Meanwhile, hydrogen molecule is adsorbed and decomposed into hydrogen atoms on Cu and Co surfaces. In the second, the CO bond would be hydrogenated selectively to form COH by the attack of the activated hydrogen atoms. 3.3 Hydrogenation of furfural over catalyst CuCo0.4/C-873 The effect of catalyst amount, furfural concentration, initial hydrogen pressure and reaction temperature on the conversion of furfural (FFA) and selectivity toward furfuryl alcohol (FOL) was studied using ethanol as a solvent over catalyst CuCo0.4/C-873, and the results are shown in Fig. 7 A–D, respectively. The conversion of FFA increases from 24.9% to 98.7% as the catalyst amount increases from 0.1 to 0.7g (Fig. 7A), which is due to a proportional increase in the active site of the catalyst. However, about 98% FOL selectivity is obtained at all catalyst loadings. Highest conversion of furfural to furfural alcohol is observed with 0.7 and 0.9g of CuCo0.4/C-873 loading. The reaction in the case of 0.9g catalyst loading is found to be faster compared to a loading of 0.7g; though, no much difference in the total conversion of furfural to furfuryl alcohol is observed. In contrast, the conversion of furfural decreases from 98.7% to 61% as the weight percentage of FFA in ethanol increases from 15wt% to 30wt% without affecting selectivity of furfuryl alcohol (about 98%) (Fig. 7B). And the reaction is very fast at 10wt%. This is justified by the fact that the available active sites for FFA hydrogenation gradually decrease with the increase of FFA concentration. And the decrease in FFA conversion can be attributed to the fact that there are no additional active sites to active the carbonyl functionality in FFA at higher FFA concentration. As shown in Fig. 7C, the conversion of FFA increases when the hydrogen pressure increases from 1MPa to 3MPa, and then keeps around 99% with the further increase of hydrogen pressure. However, the selectivity of FOL suffers from a slight decrease at high hydrogen pressure (4MPa and 5MPa). The increased solubility of hydrogen in the reaction solution at high hydrogen pressure should be responsible for the increased conversion. However, higher hydrogen pressure also promotes side reactions, which leads to a decreased FOL selectivity. The effect of reaction temperature is studied in the range of 383K to 423K. It can be seen from Fig. 7D that the increase of activity by higher reaction temperature is quite obvious while FOL selectivity is not affected by reaction temperature. Catalytic properties of CuCo0.4/C-873 catalyst for hydrogenation of furfural to furfuryl alcohol were also investigated in solvents other than ethanol (Table 3 ). Solvent properties such as polarity can affect solvent-reactant interactions and consequently, hydrogenation activity [18]. As can be seen from Table 3, the catalytic activity is strongly influenced by solvent. The best catalytic activity is obtained in less polar solvents, ethanol and methanol. In the most polar solvent, water, a low FFA conversion and FOL selectivity is observed (40.6% and 62.3%, respectively) and cyclopentanone is detected as a by-product with selectivity of 23.4%. The low solubility of furfural in water may be responsible for the low conversion. Besides, water also acts as a nucleophile to facilitate the furan ring rearrangement to cyclopentanone [42]. When the reaction takes place in weakly polar solvents, toluene and hexane, it exhibits poor FFA conversion (80.7% and 47.5%, respectively). Similar observations are also reported by A. B. Merlo et al. [43] that hydrogenation of furfural in n-heptane and toluene suffers from decreased activity compared with other alcoholic solvents. The strong adsorption of furfural in the solvent might account for the loss of activity. The different solvent-furfural interactions may also be responsible for varied selectivity to furfuryl alcohol. The selective hydrogen of furfural to furfuryl alcohol requires the preferred activation of CO bond on furfural by the active sites. Whereas the interaction between solvent and reactant may impact the activation of CO bond, which would further effect the hydrogenation of CO bond and lead to different selectivity to furfuryl alcohol with different solvents. However, this theory needs to be further investigated. These results indicate that hydrogenation of furfural to furfuryl alcohol with CuCo0.4/C-873 catalyst take place more easily in medium polar solvent. To better compare with previous works from literature, the catalytic performance of CuCo0.4/C-873 in the hydrogenation of furfural to furfuryl alcohol in this work has been compared with the representative results of the recently reported works as shown in Table S1. In comparison, to the best of our knowledge, our results are excellent, which are even better than some noble metal catalysts. It is important to investigate the reusability of the catalyst in heterogeneous reactions from the cost point of view. Therefore, stability tests were performed using 0.5g CuCo0.4/C-873 catalyst, 15wt% furfural in ethanol solution at 413K, 3MPa. After each reaction, the catalyst was recovered by centrifugation, followed by washing with ethanol several times and drying at 323K. Then, the catalyst was used again, completing four cycles of reaction. It can be seen from Fig. 8 that the conversion of furfural keeps around 78% while the selectivity to FOL undergoes a slight decrease from 98% to 90% after these four recycling runs, indicating the relatively good stability of prepared catalyst. Then, the used CuCo0.4/C-873 catalyst was characterized to verify the reasons for the little loss of FOL yield. As shown in Fig. 9 A, the used catalyst CuCo0.4/C-873 has the same characteristic peaks ascribed to metallic copper and cobalt as the fresh one. However, the surface of spent catalyst may be covered by coke after the consecutive runs, which is indicated by the additional 6% weight loss in the range of 523K to 773K of used catalyst (Fig. 9B). The formed coke on catalyst surface should be responsible for the selectivity loss as it may cover some particular active sites [44]. 4 Conclusion In summary, CuCo bimetal catalysts embedded in carbon matrix with highly dispersed metal/metal oxide sites can be obtained via the controlled calcination of Co-doped Cu-BTC precursor. By varying the molar ratio of cobalt to copper and calcination temperature, CuCo0.4/C-873 shows best catalytic performance with 98.7% furfural conversion and 97.7% furfuryl alcohol selectivity in medium polar solvent at 413K and 3MPa hydrogen pressure, which is among the top catalytic activity based on reported ones. Its good catalytic performance mainly ascribes to the small particle size (about 9nm) and the synergistic effect of copper and cobalt. The relatively high surface area and porosity also make a contribution to the high conversion and selectivity. CuCo0.4/C-873 also shows good stability in recycling test. The present study proposed a novel idea to prepared carbon embedded metal catalysts with high dispersion and stability. Acknowledgements This work was financially supported by the National Natural Science Foundation of China (No. 21276050, 21676054 and 21406034), Fundamental Research Funds for the central Universities (No. 3207045414) and Natural Science Foundation of Jiangsu (No. BK20161415). Appendix A Supplementary data Supplementary data associated with this article can be found, in the online version, at http://dx.doi.org/10.1016/j.mcat.2017.04.018. Appendix A Supplementary data The following is Supplementary data to this article: References [1] A. Patel N. Arora K. Sartaj V. Pruthi P.A. Pruthi Renewable Sustaina. Energy Rev. 62 2016 836 855 [2] R. Mariscal P. Maireles-Torres M. Ojeda I. Sadaba M. Lopez Granados Energy Environ. Sci. 9 2016 1144 1189 [3] R. Ramos Z. Tisler O. Kikhtyanin D. Kubicka Catal. Sci. Technol. 6 2016 1829 1841 [4] A. O'Driscoll J.J. Leahy T. Curtin Catal. Today 279 2016 194 201 [5] A. Halilu T.H. Ali A.Y. Atta P. Sudarsanam S.K. Bhargava S.B. Abd Hamid Energy Fuels 30 2016 2216 2226 [6] S. Liu Y. Amada M. Tamura Y. Nakagawa K. Tomishige Catal. Sci. Technol. 4 2014 2535 2549 [7] B. Lu S. An D. Song F. Su X. Yang Y. Guo Green Chem. 17 2015 1767 1778 [8] A. Corma S. Iborra A. Velty Chem. Rev. 107 2007 2411 2502 [9] M.M. Villaverde N.M. Bertero T.F. Garetto A.J. Marchi Catal. Today 213 2013 87 92 [10] S. Sitthisa D.E. Resasco Catal. Lett. 141 2011 784 791 [11] V. Choudhary A.B. Pinar S.I. Sandler D.G. Vlachos R.F. Lobo ACS Catal. 1 2011 1724 1728 [12] V. Choudhary S.I. Sandler D.G. Vlachos ACS Catal. 2 2012 2022 2028 [13] M.M. Villaverde T.F. Garetto A.J. Marchi Catal. Commun. 58 2015 6 10 [14] J. Li J.L. Liu H.J. Zhou Y. Fu ChemSusChem 9 2016 1339 1347 [15] P. Panagiotopoulou N. Martin D.G. Vlachos ChemSusChem 8 2015 2046 2054 [16] A. Halilu T.H. Ali A.Y. Atta P. Sudarsanam S.K. Bhargava S.B. Abd Hamid Energy Fuels 30 2016 2216 2226 [17] N.S. Biradar A.A. Hengne S.N. Birajdar R. Swami C.V. Rode Org. Process Res. Dev. 18 2014 1434 1442 [18] K. Fulajtarova T. Sotak M. Hronec I. Vavra E. Dobrocka M. Omastova Appl. Catal. A 502 2015 78 85 [19] S.A. Khromova M.V. Bykova O.A. Bulavchenko D.Y. Ermakov A.A. Saraev V.V. Kaichev R.H. Venderbosch V.A. Yakovlev Top. Catal. 59 2016 1413 1423 [20] R.V. Sharma U. Das R. Sammynaiken A.K. Dalai Appl. Catal. A 454 2013 127 136 [21] S. Huang N. Yang S. Wang Y. Sun Y. Zhu Nanoscale 8 2016 14104 14108 [22] S. Srivastava N. Solanki P. Mohanty K.A. Shah J.K. Parikh A.K. Dalai Catal. Lett. 145 2015 816 823 [23] R. Das P. Pachfule R. Banerjee P. Poddar Nanoscale 4 2012 591 599 [24] Y. Song X. Li L. Sun L. Wang RSC Adv. 5 2015 7267 7279 [25] F. Zhang C. Chen W.M. Xiao L. Xu N. Zhang Catal. Commun. 26 2012 25 29 [26] H. Tan C. Ma L. Gao Q. Li Y. Song F. Xu T. Wang L. Wang Chem. Eur. J. 20 2014 16377 16383 [27] R. Wu X. Qian F. Yu H. Liu K. Zhou J. Wei Y. Huang J. Mater. Chem. A 1 2013 11126 11129 [28] Y. Wang S. Sang W. Zhu L. Gao G. Xiao J. Chem Eng 299 2016 104 111 [29] Y. Zhang J. Huang Y. Ding Appl. Catal. B 198 2016 447 456 [30] Z. Jiang Z. Li Z. Qin H. Sun X. Jiao D. Chen Nanoscale 5 2013 11770 11775 [31] J.H. Lee Y.J. Sa T.K. Kim H.R. Moon S.H. Joo J. Mater. Chem. A 2 2014 10435 10443 [32] Y.Z. Xiang R. Barbosa N. Kruse ACS Catal. 4 2014 2792 2800 [33] G. Collinge Y.Z. Xiang R. Barbosa J.S. McEwen N. Kruse Surf. Sci. 648 2016 74 83 [34] B. Chen F. Li Z. Huang G. Yuan Appl. Catal. B 200 2017 192 199 [35] Y. Shu Y. Shao X. Wei X. Wang Q. Sun Q. Zhang L. Li Micropor Mesopor Mater. 214 2015 88 94 [36] H. Jeong C. Kim S. Yang H. Lee J. Catal. 344 2016 609 615 [37] J.M. Rubio-Caballero S. Saravanamurugan P. Maireles-Torres A. Riisager Catal. Today 234 2014 233 236 [38] D. Vargas-Hernandez J.M. Rubio-Caballero J. Santamaria-Gonzalez R. Moreno-Tost J.M. Merida-Robles M.A. Perez-Cruz A. Jimenez-Lopez R. Hernandez-Huesca P. Maireles-Torres J. Mol. Catal. A: Chem. 383–384 2014 106 113 [39] S.M. Sidik S. Triwahyono A.A. Jalil Z.A. Majid N. Salamun N.B. Talib T.A.T. Abdullah Chem. Eng. J. 295 2016 1 10 [40] Y. Nakagawa K. Takada M. Tamura K. Tomishige ACS Catal. 4 2014 2718 2726 [41] B.M. Nagaraja A.H. Padmasri P. Seetharamulu K. Hari Prasad Reddy B. David Raju K.S. Rama Rao J. Mol. Catal. A: Chem. 278 2007 29 37 [42] M. Hronec K. Fulajtarová Catal. Commun. 24 2012 100 104 [43] A.B. Merlo V. Vetere J.F. Ruggera M.L. Casella Catal. Commun. 10 2009 1665 1669 [44] M. Guisnet P. Magnoux Appl. Catal. A 212 2001 83 96",
      "scopus-id": "85025452684",
      "coredata": {
        "eid": "1-s2.0-S2468823117302250",
        "dc:description": "In this study we report an efficient CuCo bimetallic catalyst with highly dispersed CuCo-based mixed metal/metal oxide on porous carbon matrix for the hydrogenation of furfural to furfuryl alcohol. The catalyst is derived from Co-doped Cu-BTC metal-organic frameworks (MOFs) by thermolysis in nitrogen atmosphere at temperatures ranging from 773K to 1073K. The best catalytic performance is achieved when cobalt to copper molar ratio is 0.4 and the precursor is calcined at 873K. The characterization of prepared catalytic materials is done by multi-techniques including XRD, XPD, SEM, TEM, TG and BET analysis. The sum of their results reveal that the doping of cobalt helps the dispersion of nanoparticles of copper and cobalt and thermolysis temperature has an impact on both the particle size and the chemical states. The resulting catalyst CuCo0.4/C-873 shows 98.7% furfural conversion and 97.7% furfuryl alcohol selectivity in ethanol solvent with good stability which is better than most reported catalysts.",
        "openArchiveArticle": "false",
        "prism:coverDate": "2017-07-31",
        "openaccessUserLicense": null,
        "prism:aggregationType": "Journal",
        "prism:url": "https://api.elsevier.com/content/article/pii/S2468823117302250",
        "dc:creator": [
          {
            "@_fa": "true",
            "$": "Wang, Yuan"
          },
          {
            "@_fa": "true",
            "$": "Miao, Yanan"
          },
          {
            "@_fa": "true",
            "$": "Li, Shuai"
          },
          {
            "@_fa": "true",
            "$": "Gao, Lijing"
          },
          {
            "@_fa": "true",
            "$": "Xiao, Guomin"
          }
        ],
        "link": [
          {
            "@_fa": "true",
            "@rel": "self",
            "@href": "https://api.elsevier.com/content/article/pii/S2468823117302250"
          },
          {
            "@_fa": "true",
            "@rel": "scidir",
            "@href": "https://www.sciencedirect.com/science/article/pii/S2468823117302250"
          }
        ],
        "dc:format": "application/json",
        "openaccessType": null,
        "pii": "S2468-8231(17)30225-0",
        "prism:volume": "436",
        "prism:publisher": "Elsevier B.V.",
        "dc:title": "Metal-organic frameworks derived bimetallic Cu-Co catalyst for efficient and selective hydrogenation of biomass-derived furfural to furfuryl alcohol",
        "prism:copyright": "© 2017 Elsevier B.V. All rights reserved.",
        "openaccess": "0",
        "prism:issn": "24688231",
        "dcterms:subject": [
          {
            "@_fa": "true",
            "$": "Metal organic frameworks"
          },
          {
            "@_fa": "true",
            "$": "CuCo/C catalyst"
          },
          {
            "@_fa": "true",
            "$": "Furfural"
          },
          {
            "@_fa": "true",
            "$": "Furfuryl alcohol"
          },
          {
            "@_fa": "true",
            "$": "Hydrogenation"
          }
        ],
        "openaccessArticle": "false",
        "prism:publicationName": "Molecular Catalysis",
        "openaccessSponsorType": null,
        "prism:pageRange": "128-137",
        "prism:endingPage": "137",
        "pubType": "fla",
        "prism:coverDisplayDate": "July 2017",
        "prism:doi": "10.1016/j.mcat.2017.04.018",
        "prism:startingPage": "128",
        "dc:identifier": "doi:10.1016/j.mcat.2017.04.018",
        "openaccessSponsorName": null
      },
      "objects": {
        "object": [
          {
            "@category": "thumbnail",
            "@height": "164",
            "@width": "201",
            "@_fa": "true",
            "$": "https://api.elsevier.com/content/object/eid/1-s2.0-S2468823117302250-fx1.sml?httpAccept=%2A%2F%2A",
            "@multimediatype": "GIF image file",
            "@type": "IMAGE-THUMBNAIL",
            "@size": "6807",
            "@ref": "fx1",
            "@mimetype": "image/gif"
          },
          {
            "@category": "thumbnail",
            "@height": "72",
            "@width": "219",
            "@_fa": "true",
            "$": "https://api.elsevier.com/content/object/eid/1-s2.0-S2468823117302250-gr1.sml?httpAccept=%2A%2F%2A",
            "@multimediatype": "GIF image file",
            "@type": "IMAGE-THUMBNAIL",
            "@size": "6232",
            "@ref": "gr1",
            "@mimetype": "image/gif"
          },
          {
            "@category": "thumbnail",
            "@height": "163",
            "@width": "104",
            "@_fa": "true",
            "$": "https://api.elsevier.com/content/object/eid/1-s2.0-S2468823117302250-gr2.sml?httpAccept=%2A%2F%2A",
            "@multimediatype": "GIF image file",
            "@type": "IMAGE-THUMBNAIL",
            "@size": "5791",
            "@ref": "gr2",
            "@mimetype": "image/gif"
          },
          {
            "@category": "thumbnail",
            "@height": "164",
            "@width": "204",
            "@_fa": "true",
            "$": "https://api.elsevier.com/content/object/eid/1-s2.0-S2468823117302250-gr3.sml?httpAccept=%2A%2F%2A",
            "@multimediatype": "GIF image file",
            "@type": "IMAGE-THUMBNAIL",
            "@size": "13973",
            "@ref": "gr3",
            "@mimetype": "image/gif"
          },
          {
            "@category": "thumbnail",
            "@height": "82",
            "@width": "219",
            "@_fa": "true",
            "$": "https://api.elsevier.com/content/object/eid/1-s2.0-S2468823117302250-gr4.sml?httpAccept=%2A%2F%2A",
            "@multimediatype": "GIF image file",
            "@type": "IMAGE-THUMBNAIL",
            "@size": "12486",
            "@ref": "gr4",
            "@mimetype": "image/gif"
          },
          {
            "@category": "thumbnail",
            "@height": "164",
            "@width": "180",
            "@_fa": "true",
            "$": "https://api.elsevier.com/content/object/eid/1-s2.0-S2468823117302250-gr5.sml?httpAccept=%2A%2F%2A",
            "@multimediatype": "GIF image file",
            "@type": "IMAGE-THUMBNAIL",
            "@size": "13171",
            "@ref": "gr5",
            "@mimetype": "image/gif"
          },
          {
            "@category": "thumbnail",
            "@height": "120",
            "@width": "219",
            "@_fa": "true",
            "$": "https://api.elsevier.com/content/object/eid/1-s2.0-S2468823117302250-gr6.sml?httpAccept=%2A%2F%2A",
            "@multimediatype": "GIF image file",
            "@type": "IMAGE-THUMBNAIL",
            "@size": "4630",
            "@ref": "gr6",
            "@mimetype": "image/gif"
          },
          {
            "@category": "thumbnail",
            "@height": "164",
            "@width": "204",
            "@_fa": "true",
            "$": "https://api.elsevier.com/content/object/eid/1-s2.0-S2468823117302250-gr7.sml?httpAccept=%2A%2F%2A",
            "@multimediatype": "GIF image file",
            "@type": "IMAGE-THUMBNAIL",
            "@size": "11576",
            "@ref": "gr7",
            "@mimetype": "image/gif"
          },
          {
            "@category": "thumbnail",
            "@height": "156",
            "@width": "219",
            "@_fa": "true",
            "$": "https://api.elsevier.com/content/object/eid/1-s2.0-S2468823117302250-gr8.sml?httpAccept=%2A%2F%2A",
            "@multimediatype": "GIF image file",
            "@type": "IMAGE-THUMBNAIL",
            "@size": "6042",
            "@ref": "gr8",
            "@mimetype": "image/gif"
          },
          {
            "@category": "thumbnail",
            "@height": "86",
            "@width": "219",
            "@_fa": "true",
            "$": "https://api.elsevier.com/content/object/eid/1-s2.0-S2468823117302250-gr9.sml?httpAccept=%2A%2F%2A",
            "@multimediatype": "GIF image file",
            "@type": "IMAGE-THUMBNAIL",
            "@size": "4608",
            "@ref": "gr9",
            "@mimetype": "image/gif"
          },
          {
            "@category": "standard",
            "@height": "245",
            "@width": "301",
            "@_fa": "true",
            "$": "https://api.elsevier.com/content/object/eid/1-s2.0-S2468823117302250-fx1.jpg?httpAccept=%2A%2F%2A",
            "@multimediatype": "JPEG image file",
            "@type": "IMAGE-DOWNSAMPLED",
            "@size": "11097",
            "@ref": "fx1",
            "@mimetype": "image/jpeg"
          },
          {
            "@category": "standard",
            "@height": "187",
            "@width": "565",
            "@_fa": "true",
            "$": "https://api.elsevier.com/content/object/eid/1-s2.0-S2468823117302250-gr1.jpg?httpAccept=%2A%2F%2A",
            "@multimediatype": "JPEG image file",
            "@type": "IMAGE-DOWNSAMPLED",
            "@size": "28603",
            "@ref": "gr1",
            "@mimetype": "image/jpeg"
          },
          {
            "@category": "standard",
            "@height": "589",
            "@width": "376",
            "@_fa": "true",
            "$": "https://api.elsevier.com/content/object/eid/1-s2.0-S2468823117302250-gr2.jpg?httpAccept=%2A%2F%2A",
            "@multimediatype": "JPEG image file",
            "@type": "IMAGE-DOWNSAMPLED",
            "@size": "51658",
            "@ref": "gr2",
            "@mimetype": "image/jpeg"
          },
          {
            "@category": "standard",
            "@height": "575",
            "@width": "715",
            "@_fa": "true",
            "$": "https://api.elsevier.com/content/object/eid/1-s2.0-S2468823117302250-gr3.jpg?httpAccept=%2A%2F%2A",
            "@multimediatype": "JPEG image file",
            "@type": "IMAGE-DOWNSAMPLED",
            "@size": "111358",
            "@ref": "gr3",
            "@mimetype": "image/jpeg"
          },
          {
            "@category": "standard",
            "@height": "282",
            "@width": "753",
            "@_fa": "true",
            "$": "https://api.elsevier.com/content/object/eid/1-s2.0-S2468823117302250-gr4.jpg?httpAccept=%2A%2F%2A",
            "@multimediatype": "JPEG image file",
            "@type": "IMAGE-DOWNSAMPLED",
            "@size": "112225",
            "@ref": "gr4",
            "@mimetype": "image/jpeg"
          },
          {
            "@category": "standard",
            "@height": "684",
            "@width": "753",
            "@_fa": "true",
            "$": "https://api.elsevier.com/content/object/eid/1-s2.0-S2468823117302250-gr5.jpg?httpAccept=%2A%2F%2A",
            "@multimediatype": "JPEG image file",
            "@type": "IMAGE-DOWNSAMPLED",
            "@size": "104150",
            "@ref": "gr5",
            "@mimetype": "image/jpeg"
          },
          {
            "@category": "standard",
            "@height": "309",
            "@width": "565",
            "@_fa": "true",
            "$": "https://api.elsevier.com/content/object/eid/1-s2.0-S2468823117302250-gr6.jpg?httpAccept=%2A%2F%2A",
            "@multimediatype": "JPEG image file",
            "@type": "IMAGE-DOWNSAMPLED",
            "@size": "28800",
            "@ref": "gr6",
            "@mimetype": "image/jpeg"
          },
          {
            "@category": "standard",
            "@height": "575",
            "@width": "715",
            "@_fa": "true",
            "$": "https://api.elsevier.com/content/object/eid/1-s2.0-S2468823117302250-gr7.jpg?httpAccept=%2A%2F%2A",
            "@multimediatype": "JPEG image file",
            "@type": "IMAGE-DOWNSAMPLED",
            "@size": "132986",
            "@ref": "gr7",
            "@mimetype": "image/jpeg"
          },
          {
            "@category": "standard",
            "@height": "268",
            "@width": "376",
            "@_fa": "true",
            "$": "https://api.elsevier.com/content/object/eid/1-s2.0-S2468823117302250-gr8.jpg?httpAccept=%2A%2F%2A",
            "@multimediatype": "JPEG image file",
            "@type": "IMAGE-DOWNSAMPLED",
            "@size": "14044",
            "@ref": "gr8",
            "@mimetype": "image/jpeg"
          },
          {
            "@category": "standard",
            "@height": "281",
            "@width": "715",
            "@_fa": "true",
            "$": "https://api.elsevier.com/content/object/eid/1-s2.0-S2468823117302250-gr9.jpg?httpAccept=%2A%2F%2A",
            "@multimediatype": "JPEG image file",
            "@type": "IMAGE-DOWNSAMPLED",
            "@size": "36533",
            "@ref": "gr9",
            "@mimetype": "image/jpeg"
          },
          {
            "@category": "standard",
            "@_fa": "true",
            "$": "https://api.elsevier.com/content/object/eid/1-s2.0-S2468823117302250-mmc1.docx?httpAccept=%2A%2F%2A",
            "@multimediatype": "Microsoft Word file",
            "@type": "APPLICATION",
            "@size": "10098330",
            "@ref": "mmc1",
            "@mimetype": "application/word"
          },
          {
            "@category": "thumbnail",
            "@height": "30",
            "@width": "356",
            "@_fa": "true",
            "$": "https://api.elsevier.com/content/object/eid/1-s2.0-S2468823117302250-si1.gif?httpAccept=%2A%2F%2A",
            "@multimediatype": "GIF image file",
            "@type": "ALTIMG",
            "@size": "1555",
            "@ref": "si1",
            "@mimetype": "image/gif"
          },
          {
            "@category": "thumbnail",
            "@height": "30",
            "@width": "326",
            "@_fa": "true",
            "$": "https://api.elsevier.com/content/object/eid/1-s2.0-S2468823117302250-si2.gif?httpAccept=%2A%2F%2A",
            "@multimediatype": "GIF image file",
            "@type": "ALTIMG",
            "@size": "1430",
            "@ref": "si2",
            "@mimetype": "image/gif"
          }
        ]
      },
      "link": {
        "@rel": "abstract",
        "@href": "https://api.elsevier.com/content/abstract/scopus_id/85025452684"
      }
    }
  }
}