{
  "metadata": {
    "title": "Synthesis and characterization of Rh/MnO<ce:inf loc=post>2</ce:inf>-CeO<ce:inf loc=post>2</ce:inf>/Al<ce:inf loc=post>2</ce:inf>O<ce:inf loc=post>3</ce:inf> catalysts for CO-PrOx reaction",
    "authors": "; ; ",
    "journal": "Molecular Catalysis",
    "date": "2017-10-31",
    "doi": "10.1016/j.mcat.2017.06.018",
    "abstract": "",
    "uri": "https://api.elsevier.com/content/article/pii/S2468823117303255",
    "pii": "S2468823117303255"
  },
  "fulltext": {
    "full-text-retrieval-response": {
      "scopus-eid": "2-s2.0-85029573123",
      "originalText": "serial JL 315758 291210 291744 291790 291809 31 Molecular Catalysis MOLECULARCATALYSIS 2017-07-21 2017-07-21 2017-07-21 2017-07-21 2018-07-09T20:04:52 1-s2.0-S2468823117303255 S2468-8231(17)30325-5 S2468823117303255 10.1016/j.mcat.2017.06.018 S300 S300.2 FULL-TEXT 1-s2.0-S2468823117X0014X 2018-07-09T21:52:14.092726Z 0 0 20171001 20171031 2017 2017-07-21T16:42:05.875086Z absattachment articleinfo articletitlenorm authfirstinitialnorm authfirstsurnamenorm cid cids contenttype copyright crossmark dateloaded dateloadedtxt datesearch datesort dateupdated dco docsubtype doctype doi eid ewtransactionid hubeid indexeddate issn issnnorm itemstage itemtransactionid itemweight openaccess openarchive pg pgfirst pglast pii piinorm pubdateend pubdatestart pubdatetxt pubyr sectiontitle sortorder srctitle srctitlenorm srctype ssids alllist content subj subheadings suppl tomb volfirst volissue volumelist webpdf webpdfpagecount yearnav figure table body acknowledge affil articletitle auth authfirstini authfull authkeywords authlast grantnumber grantsponsor highlightsabst primabst ref specialabst 2468-8231 24688231 true 440 440 C Volume 440 4 9 18 9 18 201710 October 2017 2017-10-01 2017-10-31 2017 Regular Papers article fla © 2017 Elsevier B.V. All rights reserved. SYNTHESISCHARACTERIZATIONRHMNO2CEO2AL2O3CATALYSTSFORCOPROXREACTION MARTINEZT L 1 Introduction 2 Experimental 2.1 Catalysts synthesis 2.2 Characterization 2.3 Catalytic activity 3 Results and discussion 3.1 XRD 3.2 Raman spectroscopy 3.3 Specific surface area and porosity measurements 3.4 Redox properties: H2-TPR analysis 3.5 HRTEM microscopy of reduced samples 3.6 Thermogravimetric analysis 3.7 Catalytic test: preferential oxidation of CO in presence of H2 (PROX) 4 Conclusions Acknowledgments References KRUMPELT 2002 3 16 M HULTEBERG 2005 1235 1242 P HOLLADAY 2009 244 260 J MARINO 2008 1345 1353 F KRUMPELT 2002 3 16 M ECHIGO 2003 209 215 M ABUZIED 2008 91 97 B CHEN 2012 1 9 L WORNER 2003 1 14 A MISHRA 2011 1 14 A BARBATO 2016 13039 13048 P REINA 2016 62 72 T LAGUNA 2014 176 185 O GAMARRA 2007 110 116 D REINA 2014 554 563 T WANG 2015 12478 12488 J ZHOU 2005 141 145 G SPRINGER 2001 11 23 T OH 1993 254 262 S DUDFIELD 2001 763 775 C GALLETTI 2007 15 19 C TANAKA 2003 255 263 H ITO 2004 295 302 S CAMILLA 2008 5304 5312 G NAKAJIMA 1994 13297 13307 A RANGASWAMY 2015 1162 1169 A HE 2016 959 967 D ETSELL 1970 339 376 T HE 2017 559 565 D HERNANDEZ 2010 10857 10865 W ROMEROSARRIA 2007 14469 14475 F MARTINEZARIAS 2005 32 42 A WANG 2017 437 445 J MARTINEZT 2013 499 510 L SOLSONA 2004 708 711 B JONES 2009 121 124 C ARENA 2007 2269 2276 F TIAN 1997 926 930 Z FRIAS 2007 205 212 D DOMINGUEZ 2009 3837 3842 M WANG 2009 145 L HERNANDEZ 2010 160 165 W JOTHIRAMALINGAM 2005 41 45 R DELIMARIS 2008 303 312 D TANG 2006 265 273 X LI 2011 54 61 H VENKATASWAMY 2015 299 309 P AVGOUROPOULOS 2006 62 69 G ARENA 2008 40 47 F BARRIO 2005 151 157 I MACHIDA 2000 3158 3264 M SI 2012 68 80 R GUODOMG 2007 42 47 F LAGUNA 2010 360 370 O ZHANG 2002 127 F HERNANDEZ 2009 5629 5635 W GRAHAM 1991 310 313 G SHYU 1988 4964 4970 J MCBRIDE 1994 2435 2441 J LIN 2001 236 240 X SPANIER 2001 245401 245408 J HERNANDEZ 2009 5629 5635 W DOW 1996 171 182 W KIM 2004 17019 17926 H GAO 2008 13134 13140 T JULIEN 2004 689 700 C POLVEREJAN 2004 7774 7775 M PASTORPEREZ 2014 17589 17599 L VENKATASWAMY 2015 299 309 P OJEDA 2004 47 55 M FORNASIERO 2000 326 338 P TREVINO 1997 236 H TSUJI 1993 611 M RAMANA 2016 113 121 S SULTANA 2012 284 289 A BERMAN 2005 73 83 A VENKATASWAMY 2014 122 132 P GIOVANOLI 1994 303 313 R LI 2011 207 213 L AZIM 1972 291 302 A DOSE 2011 1169 1177 W SAPUTRA 2013 729 735 E KOROTKIKH 2000 249 254 O GALETTI 2008 5304 5312 C GALETTI 2007 15 19 C RODRIGUEZ 2010 9557 9565 J WANG 2013 253 259 Z MARTINEZTX2017X9 MARTINEZTX2017X9X18 MARTINEZTX2017X9XL MARTINEZTX2017X9X18XL 2019-07-21T00:00:00Z Open http://creativecommons.org/licenses/by-nc-nd/4.0/ © 2017 Elsevier B.V. All rights reserved. item S2468-8231(17)30325-5 S2468823117303255 1-s2.0-S2468823117303255 10.1016/j.mcat.2017.06.018 315758 2018-07-09T21:52:14.092726Z 2017-10-01 2017-10-31 1-s2.0-S2468823117303255-main.pdf https://s3-eu-west-1.amazonaws.com/prod-ucs-content-store-eu-west/content/pii:S2468823117303255/MAIN/application/pdf/ffbb2ca601a1897c457c7c61024bab4b/main.pdf https://s3.amazonaws.com/prod-ucs-content-store-us-east/content/pii:S2468823117303255/MAIN/application/pdf/ffbb2ca601a1897c457c7c61024bab4b/main.pdf main.pdf pdf true 2457665 MAIN 10 1-s2.0-S2468823117303255-main_1.png https://s3-eu-west-1.amazonaws.com/prod-ucs-content-store-eu-west/content/pii:S2468823117303255/PREVIEW/image/png/eb20d93df872e0edfd6578da6d5195f7/main_1.png https://s3.amazonaws.com/prod-ucs-content-store-us-east/content/pii:S2468823117303255/PREVIEW/image/png/eb20d93df872e0edfd6578da6d5195f7/main_1.png main_1.png png 56335 849 656 IMAGE-WEB-PDF 1 1-s2.0-S2468823117303255-fx1.sml https://s3-eu-west-1.amazonaws.com/prod-ucs-content-store-eu-west/content/pii:S2468823117303255/fx1/THUMBNAIL/image/gif/6adadd334b3f7b4c2b2323ceb9a14603/fx1.sml https://s3.amazonaws.com/prod-ucs-content-store-us-east/content/pii:S2468823117303255/fx1/THUMBNAIL/image/gif/6adadd334b3f7b4c2b2323ceb9a14603/fx1.sml fx1 true fx1.sml sml 6752 88 219 IMAGE-THUMBNAIL 1-s2.0-S2468823117303255-gr1.sml https://s3-eu-west-1.amazonaws.com/prod-ucs-content-store-eu-west/content/pii:S2468823117303255/gr1/THUMBNAIL/image/gif/f47612a53d1b8c8f56870faac1113bc2/gr1.sml https://s3.amazonaws.com/prod-ucs-content-store-us-east/content/pii:S2468823117303255/gr1/THUMBNAIL/image/gif/f47612a53d1b8c8f56870faac1113bc2/gr1.sml gr1 gr1.sml sml 11142 164 212 IMAGE-THUMBNAIL 1-s2.0-S2468823117303255-gr2.sml https://s3-eu-west-1.amazonaws.com/prod-ucs-content-store-eu-west/content/pii:S2468823117303255/gr2/THUMBNAIL/image/gif/8f661afd13c8bd63c7b43d7a9a040f68/gr2.sml https://s3.amazonaws.com/prod-ucs-content-store-us-east/content/pii:S2468823117303255/gr2/THUMBNAIL/image/gif/8f661afd13c8bd63c7b43d7a9a040f68/gr2.sml gr2 gr2.sml sml 5047 164 198 IMAGE-THUMBNAIL 1-s2.0-S2468823117303255-gr3.sml https://s3-eu-west-1.amazonaws.com/prod-ucs-content-store-eu-west/content/pii:S2468823117303255/gr3/THUMBNAIL/image/gif/01a3aa7e1757b56bf845a5e3a35dd638/gr3.sml https://s3.amazonaws.com/prod-ucs-content-store-us-east/content/pii:S2468823117303255/gr3/THUMBNAIL/image/gif/01a3aa7e1757b56bf845a5e3a35dd638/gr3.sml gr3 gr3.sml sml 8883 164 199 IMAGE-THUMBNAIL 1-s2.0-S2468823117303255-gr4.sml https://s3-eu-west-1.amazonaws.com/prod-ucs-content-store-eu-west/content/pii:S2468823117303255/gr4/THUMBNAIL/image/gif/9173c2c7c49e7283ca069635dcdf4c32/gr4.sml https://s3.amazonaws.com/prod-ucs-content-store-us-east/content/pii:S2468823117303255/gr4/THUMBNAIL/image/gif/9173c2c7c49e7283ca069635dcdf4c32/gr4.sml gr4 gr4.sml sml 7584 156 219 IMAGE-THUMBNAIL 1-s2.0-S2468823117303255-gr5.sml https://s3-eu-west-1.amazonaws.com/prod-ucs-content-store-eu-west/content/pii:S2468823117303255/gr5/THUMBNAIL/image/gif/6966e29534c94baea47a76f4628eeba3/gr5.sml https://s3.amazonaws.com/prod-ucs-content-store-us-east/content/pii:S2468823117303255/gr5/THUMBNAIL/image/gif/6966e29534c94baea47a76f4628eeba3/gr5.sml gr5 gr5.sml sml 7040 164 213 IMAGE-THUMBNAIL 1-s2.0-S2468823117303255-gr6.sml https://s3-eu-west-1.amazonaws.com/prod-ucs-content-store-eu-west/content/pii:S2468823117303255/gr6/THUMBNAIL/image/gif/8a0e41bbbf3133078c95cbd215c39b52/gr6.sml https://s3.amazonaws.com/prod-ucs-content-store-us-east/content/pii:S2468823117303255/gr6/THUMBNAIL/image/gif/8a0e41bbbf3133078c95cbd215c39b52/gr6.sml gr6 gr6.sml sml 16048 122 219 IMAGE-THUMBNAIL 1-s2.0-S2468823117303255-gr7.sml https://s3-eu-west-1.amazonaws.com/prod-ucs-content-store-eu-west/content/pii:S2468823117303255/gr7/THUMBNAIL/image/gif/284d2fe9801911c60e3957905e0513ef/gr7.sml https://s3.amazonaws.com/prod-ucs-content-store-us-east/content/pii:S2468823117303255/gr7/THUMBNAIL/image/gif/284d2fe9801911c60e3957905e0513ef/gr7.sml gr7 gr7.sml sml 17085 163 171 IMAGE-THUMBNAIL 1-s2.0-S2468823117303255-gr8.sml https://s3-eu-west-1.amazonaws.com/prod-ucs-content-store-eu-west/content/pii:S2468823117303255/gr8/THUMBNAIL/image/gif/e9be1c7cc3791140f54e20025b7e169c/gr8.sml https://s3.amazonaws.com/prod-ucs-content-store-us-east/content/pii:S2468823117303255/gr8/THUMBNAIL/image/gif/e9be1c7cc3791140f54e20025b7e169c/gr8.sml gr8 gr8.sml sml 5101 89 219 IMAGE-THUMBNAIL 1-s2.0-S2468823117303255-gr9.sml https://s3-eu-west-1.amazonaws.com/prod-ucs-content-store-eu-west/content/pii:S2468823117303255/gr9/THUMBNAIL/image/gif/a3e4142af7f0d2bfafa55df69adfc574/gr9.sml https://s3.amazonaws.com/prod-ucs-content-store-us-east/content/pii:S2468823117303255/gr9/THUMBNAIL/image/gif/a3e4142af7f0d2bfafa55df69adfc574/gr9.sml gr9 gr9.sml sml 7696 164 187 IMAGE-THUMBNAIL 1-s2.0-S2468823117303255-fx1.jpg https://s3-eu-west-1.amazonaws.com/prod-ucs-content-store-eu-west/content/pii:S2468823117303255/fx1/DOWNSAMPLED/image/jpeg/c65c38d5468914c0a45b2f5825aa3208/fx1.jpg https://s3.amazonaws.com/prod-ucs-content-store-us-east/content/pii:S2468823117303255/fx1/DOWNSAMPLED/image/jpeg/c65c38d5468914c0a45b2f5825aa3208/fx1.jpg fx1 true fx1.jpg jpg 27733 200 500 IMAGE-DOWNSAMPLED 1-s2.0-S2468823117303255-gr1.jpg https://s3-eu-west-1.amazonaws.com/prod-ucs-content-store-eu-west/content/pii:S2468823117303255/gr1/DOWNSAMPLED/image/jpeg/1cde0a331ccbab61f5093e00ba11285d/gr1.jpg https://s3.amazonaws.com/prod-ucs-content-store-us-east/content/pii:S2468823117303255/gr1/DOWNSAMPLED/image/jpeg/1cde0a331ccbab61f5093e00ba11285d/gr1.jpg gr1 gr1.jpg jpg 25917 248 320 IMAGE-DOWNSAMPLED 1-s2.0-S2468823117303255-gr2.jpg https://s3-eu-west-1.amazonaws.com/prod-ucs-content-store-eu-west/content/pii:S2468823117303255/gr2/DOWNSAMPLED/image/jpeg/5cc86065e00b5dbdd44ab2baffc8bf35/gr2.jpg https://s3.amazonaws.com/prod-ucs-content-store-us-east/content/pii:S2468823117303255/gr2/DOWNSAMPLED/image/jpeg/5cc86065e00b5dbdd44ab2baffc8bf35/gr2.jpg gr2 gr2.jpg jpg 12739 249 301 IMAGE-DOWNSAMPLED 1-s2.0-S2468823117303255-gr3.jpg https://s3-eu-west-1.amazonaws.com/prod-ucs-content-store-eu-west/content/pii:S2468823117303255/gr3/DOWNSAMPLED/image/jpeg/7dc9807a74042b7590bd57420e4f7bd1/gr3.jpg https://s3.amazonaws.com/prod-ucs-content-store-us-east/content/pii:S2468823117303255/gr3/DOWNSAMPLED/image/jpeg/7dc9807a74042b7590bd57420e4f7bd1/gr3.jpg gr3 gr3.jpg jpg 24173 248 301 IMAGE-DOWNSAMPLED 1-s2.0-S2468823117303255-gr4.jpg https://s3-eu-west-1.amazonaws.com/prod-ucs-content-store-eu-west/content/pii:S2468823117303255/gr4/DOWNSAMPLED/image/jpeg/5db2c3b6de536ce21c997d2e64dd27b5/gr4.jpg https://s3.amazonaws.com/prod-ucs-content-store-us-east/content/pii:S2468823117303255/gr4/DOWNSAMPLED/image/jpeg/5db2c3b6de536ce21c997d2e64dd27b5/gr4.jpg gr4 gr4.jpg jpg 17570 214 301 IMAGE-DOWNSAMPLED 1-s2.0-S2468823117303255-gr5.jpg https://s3-eu-west-1.amazonaws.com/prod-ucs-content-store-eu-west/content/pii:S2468823117303255/gr5/DOWNSAMPLED/image/jpeg/29cbfd82837f981010d8b1c8d0df654e/gr5.jpg https://s3.amazonaws.com/prod-ucs-content-store-us-east/content/pii:S2468823117303255/gr5/DOWNSAMPLED/image/jpeg/29cbfd82837f981010d8b1c8d0df654e/gr5.jpg gr5 gr5.jpg jpg 17266 232 301 IMAGE-DOWNSAMPLED 1-s2.0-S2468823117303255-gr6.jpg https://s3-eu-west-1.amazonaws.com/prod-ucs-content-store-eu-west/content/pii:S2468823117303255/gr6/DOWNSAMPLED/image/jpeg/bed0d089dc4052c4a969faa196ac123e/gr6.jpg https://s3.amazonaws.com/prod-ucs-content-store-us-east/content/pii:S2468823117303255/gr6/DOWNSAMPLED/image/jpeg/bed0d089dc4052c4a969faa196ac123e/gr6.jpg gr6 gr6.jpg jpg 38081 336 602 IMAGE-DOWNSAMPLED 1-s2.0-S2468823117303255-gr7.jpg https://s3-eu-west-1.amazonaws.com/prod-ucs-content-store-eu-west/content/pii:S2468823117303255/gr7/DOWNSAMPLED/image/jpeg/74412a940735ed00deec9af77c258180/gr7.jpg https://s3.amazonaws.com/prod-ucs-content-store-us-east/content/pii:S2468823117303255/gr7/DOWNSAMPLED/image/jpeg/74412a940735ed00deec9af77c258180/gr7.jpg gr7 gr7.jpg jpg 68206 575 602 IMAGE-DOWNSAMPLED 1-s2.0-S2468823117303255-gr8.jpg https://s3-eu-west-1.amazonaws.com/prod-ucs-content-store-eu-west/content/pii:S2468823117303255/gr8/DOWNSAMPLED/image/jpeg/5bacee47cf15648ac48c78b590c5ceec/gr8.jpg https://s3.amazonaws.com/prod-ucs-content-store-us-east/content/pii:S2468823117303255/gr8/DOWNSAMPLED/image/jpeg/5bacee47cf15648ac48c78b590c5ceec/gr8.jpg gr8 gr8.jpg jpg 31536 246 602 IMAGE-DOWNSAMPLED 1-s2.0-S2468823117303255-gr9.jpg https://s3-eu-west-1.amazonaws.com/prod-ucs-content-store-eu-west/content/pii:S2468823117303255/gr9/DOWNSAMPLED/image/jpeg/d218bb5341c40ef24c2c5a42a651437b/gr9.jpg https://s3.amazonaws.com/prod-ucs-content-store-us-east/content/pii:S2468823117303255/gr9/DOWNSAMPLED/image/jpeg/d218bb5341c40ef24c2c5a42a651437b/gr9.jpg gr9 gr9.jpg jpg 62949 529 602 IMAGE-DOWNSAMPLED MCAT 224 S2468-8231(17)30325-5 10.1016/j.mcat.2017.06.018 Elsevier B.V. Fig. 1 XRD patterns for the synthesized materials. ω: CeO2, β: MnO2, ε: K2Mn4O8,α: Mn2O3, X: γ-Al2O3, ■KNO3. Fig. 2 Lattice cubic parameters as a function of the concentration of CeO2. Fig. 3 Raman spectra for the synthesized materials. ω: CeO2, β: MnO2. Fig. 4 N2 absorption/desorption isothermal plot for the synthesized materials. Fig. 5 H2-TPR profiles for the synthesized materials. Fig. 6 HRTEM images and electron diffraction pattern for RhMn50Al. Fig. 7 HRTEM images and electron diffraction pattern for RhCe20Mn30Al. Fig. 8 (A) TGA, (B) DTG curves for the synthesized materials in synthetic air. Fig. 9 (A) CO conversion, (B) O2 conversion and (C) CO2 selectivity with the reaction temperature for the preferential oxidation of CO in presence of hydrogen over the powder synthesized materials. Table 1 CeO2 crystallite size, lattice parameter and Ov/F2g area ratio. Code a Crystalline domain size of CeO2 (nm) b Lattice parameter(Å) c Ov/F2g area ratio CeO2 – 5.414 – RhCe50Al 7.7 5.401 – RhCe40Mn10Al 5.7 5.381 0.26 RhCe20Mn30Al 5.5 5.362 0.36 a Calculated from XRD data, with Scherrer’s equation and (111) crystallographic plane. b Calculated from XRD data, with Bragg’s equation for a cubic cell. c Calculated from Raman spectra (zoom). Table 2 Textural properties for the synthesized materials. Code SBET (m2 g−1) Pore volume (cm3 g−1) Pore size (nm) RhCe50Al 90 0.21 8.5 RhCe40Mn10Al 87 0.14 7.2 RhCe20Mn30Al 45 0.10 5.8 RhCe10Mn40Al 46 0.10 5.9 RhMn50Al 41 0.08 5.1 Table 3 H2-TPR results: Experimental hydrogen consumption and Reducibility percentage (RP) of the samples. Code H2 consumption (mm/g) RP (%) RhCe50Al 5.046 85.1 RhCe40Mn10Al 5.095 86.1 RhCe20Mn30Al 5.883 99.9 RhCe10Mn40Al 5.542 94.3 RhMn50Al 5.319 90.7 Table 4 Temperature (in °C) and weight loss (in parenthesis, %) of the different processes from TGA-DTG experiments. Code Physisorbed Water Structural Water MnO2 →Mn2O3 Mn2O3 →Mn3O4 RhCe50Al 61 (1.30%) – – – RhCe40Mn10Al 61 (1.68%) – 561 (0.55%) – RhCe20Mn30Al 61 (1.52%) 181 (3.35%) 659 (4.89%) 994 (3.06%) RhCe10Mn40Al 61 (1.79%) 134 (3.19%)206 (1.31%) 665 (5.82%) 974 (4.22%) RhMn50Al 61 (2.88%) 130 (5.21%) 688 (4.85%) 990 (1.86%) 277 (4.28%) 300 (2.00) Synthesis and characterization of Rh/MnO2-CeO2/Al2O3 catalysts for CO-PrOx reaction L.M. Martínez T ⁎ O.H. Laguna C. López-Cartes M.A. Centeno Departamento de Química Inorgánica e Instituto de Ciencia de Materiales de Sevilla, Universidad de Sevilla – CSIC, Avda. Américo Vespucio 49, 41092 Sevilla, Spain Departamento de Química Inorgánica e Instituto de Ciencia de Materiales de Sevilla Universidad de Sevilla – CSIC Avda. Américo Vespucio 49 Sevilla 41092 Spain ⁎ Corresponding author. Graphical abstract Rh/MnO2-CeO2/Al2O3 catalysts with different manganese-to-ceria ratios have been synthesized, characterized and tested in CO-PrOx reaction. The physicochemical properties of the solids were studied by XRD, Raman spectroscopy, BET surface area, H2-TPR, TGA-DTG and TEM. The differences observed in the textural, structural and redox properties were related to the Mn-to-ceria ratio of the samples. The segregation of Mn species was observed at high Mn-to-Ce ratios. In opposite way, MnO2-CeO2 solid solutions were obtained at low Mn to Ce ones. In this last case, the physicochemical properties of the solids were favored by the intimate Rh-Ce-Mn contact. The effect of the Mn-Ce presence on Rh catalysts which promotes the catalytic behavior towards selective CO oxidation was observed to be better at low temperatures. At higher temperatures, Mn species promote the Reverse Water Gas Shift reaction, whilst ceria promotes the H2 oxidation in the whole range of working temperatures. Keywords Manganese oxide Cerium oxide MnO2-CeO2 CO-PrOx 1 Introduction During the last decade, there have been important advances in the fuel cells technology for applications in electrical energy generation and co-generation systems (coupled heat and power) in both stationary and mobile systems [1]. Proton exchange membrane fuel cell technology (PEMFC) demands a free-CO hydrogen stream for operation. Since CO is adsorbed on the catalyst surface causing catalyst poisoning, it is necessary to reach CO concentrations of less than 10ppm for preventing irreversible damage and to facilitate the electrochemical reaction on the Pt electrode. One of the most economical and popular way to produce hydrogen is the reforming of methane or other hydrocarbons or biomass molecules. However, the high proportion of CO contained in the hydrogen flow produced forces to use clean up reactions to abate the CO levels till less than 10ppm. In that sense, Water-gas-shift reaction (WGS) in which CO reacts with water to produce CO2 and H2 allows achieving an outlet gas composition with a typical CO composition of 0.5–2% (v/v). Afterwards, a final CO abatement is needed. Physical methods (pressure swing adsorption (PSA)) and catalytic methods (methanation and preferential oxidation) have been studied for selective CO removal from a hydrogen-rich stream. Among these, the CO preferential oxidation (CO-PrOx reaction) is preferred for small-scale reforming systems because of its relative simple implementation for portable and on-board applications and auxiliary power units, lower operating costs and minimal hydrogen loss [2,3]. Additionally, CO-PrOx reaction can be performed at atmospheric pressure and the range of working temperatures matches the one at which the fuel cells work [4]. In this reaction, a competition between CO and H2 molecules for the O2 ones occurs. A good CO-PrOx catalyst should favor the CO oxidation against H2 oxidation, in such a way that both high CO conversion and selectivity to CO2 are desired. In addition, the temperature must be as low as possible, ideally around 150°C, the working temperature of fuel cells, in order to save energy in the full integration process. At higher temperatures, the Reverse Water Gas Shift reaction can be promoted decreasing the CO activity. The reported promising catalysts for CO-PrOx reaction could be grouped into three classes: (i) Supported noble metal catalysts other than gold, such as Pt, Pd, Ir, Ru and Rh [5–9], (ii) Nano-gold catalysts [10] and (iii) Metal oxides catalysts, mainly bulk [11–15] or supported CuO-CeO2 catalysts [12,16], and Co-Ni oxides [17]. Zhou et al. [17] investigated the catalytic properties of Ni, Co and Co-Ni supported on activated carbon for CO-PrOx reaction. They reported the bimetallic system as the most active at lower temperatures. Nowadays highly effective catalysts are required for both the water gas shift (WGS) and the preferential CO oxidation (CO-PrOx) reactions which are considered as purification processes for the production of clean hydrogen. This is normally carried out in fuel processors where WGS and CO-PrOx reactions are coupled as integrated stages. Herein, CuO-CeO2 systems have demonstrated outstanding activity for both mentioned reactions and therefore they are intimately linked to the development of the last generation of hydrogen alimented fuel cells [12,15]. Barbato et al. [11] reported very active catalyst for oxidation reactions based on CuO-CeO2 catalysts prepared by solution combustion synthesis with respect to the typically ones synthesized by impregnation method [12–15]. Reina et al. [12,15] reported that the catalytic system CuO-CeO2 is very active and selective for CO oxidation and WGS reaction in the presence of a large amount of H2 and that the selectivity increases when gold is also incorporated. Despite the benefits of the inclusion of gold in the formulation of CuO-CeO2 catalysts, the addition of a noble metal (even in low quantities) would increase the cost of the final catalyst. As a way to partially compensate this expense, the amount of copper and ceria can be largely reduced by dispersing the mixed oxide on a high surface carrier as alumina [15]. However only at temperatures above 200°C some of the alumina based materials reached a better activity/selectivity in comparison with bulk CuO-CeO2 who reached almost full conversion and selectivity at 130°C. Concerning to noble metal catalysts, Pt/Al2O3 was proposed by Los Alamos National Laboratory in 1963 as an effective catalyst for preferential oxidation of CO in the H2-rich gas mixture [18]. Later on, Oh and Sinkevitch [19] carried out CO-PrOx tests with synthetic reformate gases (0.85% H2, 900ppmv CO, and 800ppmv O2) from room temperature to 300°C with Al2O3-supported noble metals (Rh, Ru, Pt and Pd). They found that Rh/Al2O3 and Ru/Al2O3 catalysts had a superior activity for CO oxidation and reached a complete CO conversion at temperatures lower than those for Pd/Al2O3 and the most widely used Pt/Al2O3 catalysts. In addition, Rh/Al2O3 catalyst was the most selective among all the catalysts tested. Many other Rh-based catalysts have been studied extensively for CO-PrOx [20–24] because of their good performance at lower temperatures compared with other noble metals based catalysts. These systems are claimed to facilitate the elimination of CO in a single step under realistic space velocities (120,000mL/gh) and O2 concentrations (O2/CO=1) without compromising the CO2 selectivity, and to operate in a wider temperature window which yield CO outlet concentration of less than 30ppm even in the presence of H2O and CO2 (180–200°C) in comparison with Pd and Pt/Al2O3 systems. The key role played by the support composition and properties in a CO-PrOx catalyst is well known. A large variety of supports (for instance, CeO2, Ce x Zr(1− x )O2, SiO2-Al2O3, Al2O3, SiO2, La2O3 and MgO), with different redox, acidic and basic properties have been usually used in oxidation reactions. Among them, γ-alumina is commonly used as a support due to its high thermal and chemical stability, and high surface area. However, to increase the catalytic conversion, the support must supply oxygen to the CO oxidation process. For some practical applications dopants such as transition and non-transition metal ions may be introduced in the lattice of support like CeO2, increasing its temperature stability and ability to store and release oxygen [25–27]. Metallic cations with ionic radius and electronegativity close to those of cerium are thought to be the most appropriate modifiers of structural and chemical properties of ceria [28]. The similarity in the ionic radii is one of the criteria to predict the formation of a solid solution. Thus rare earth elements (Gd, La, Y, Eu, Pr, Sm, Nd) are a good choice for this [26,27]. In fact oxide of rare earth elements have been widely used as structural or electronic promoters to improve the activity, selectivity and thermal stability of CeO2 through the formation of solid solution [26,27,29]. When doping with lanthanide cations an increase in the concentration of oxygen vacancies in the ceria structure is expected. This feature promotes the migration of oxygen ions through the lattice oxide and provides material whit high oxygen ion conductivity. In addition the presence of oxygen vacancies have been correlated with an increase in the catalytic performances of the solids attributed to the direct interaction of the surface defects with the reactive gas phase [25,30]. These oxygen vacancies act as oxygen activation sites, able to produce very active oxygen species, such as peroxide and superoxide ones, generating very active oxidation catalysts [15]. For metal supported catalysts on CeO2 (i.e Au, Pt, Rh) the presence of punctual defects on the metal oxide facilitates the interaction of the metallic phase with the support surface allowing a high dispersion and special dynamic interaction (electronic enrichment, redispersion process etc) [31]. Additionally modifying the chemical composition of CeO2 with other oxides (i.e ZrO2, MnOx) also greatly improves the catalyst activity [32,33]. It is known that the introduction of zirconium enhances oxygen mobility even further by the formation of solid solution improving the redox properties and the oxygen buffering action observed for the Ce oxides [34]. Ceria-zirconia mixed oxides are also thermally stable and the oxygen storage capacity is retained even after many consecutive cycles of reduction at high temperature followed by re-oxidation. These properties improve even more the catalytic activity in oxidation, reforming and WGS reactions. On the other hand, MnO2-CeO2 mixed oxides could exhibit much better redox properties than ceria alone due to multi-valence state and strong interaction between ceria and manganese [35,36]. Manganese is believed to favor greatly the oxygen storage capacity of CeO2 and the oxygen mobility on the surface of the ceria by forming MnO2-CeO2 solid solution [37]. MnO2-CeO2 oxides have been found to be highly actives for oxidation of light oxygenates compounds [38–46]. Venkataswamy et al. [47] compared the CO oxidation performance of MnO2-CeO2 supported on alumina prepared by deposition-coprecipitacion method with respect to CeO2/Al2O3 and MnOx/Al2O3. The enhanced activity of mixed oxide was mainly attributed to high surface area, large amount of oxygen vacancies and excellent redox behavior. This quite promising activity compares favorably with other catalysts based on noble metals in oxidation reactions [48,49]. Additionally, it is indispensable to enhance the desired properties of Ce-Mn oxides by dispersing them over a thermally stable and high surface area support material. In this case alumina is a good carrier, especially for the industrial applications because of its ideal cost-efficiency and stability. Therefore, MnO2-CeO2 oxides supported in alumina could increase the catalyst surface area, thus maximize the oxygen vacancies concentration, which are very useful for catalytic oxidation reaction. However, to our knowledge, MnO2-CeO2/Al2O3 support effect on the physicochemical properties of the Rh-based catalysts and additionally their catalytic response on CO-PrOx reaction have not been reported. With this background the aim of this work was to study the physicochemical properties of the catalysts Rh/MnO2-CeO2/Al2O3 as a function of Mn/Ce ratio fixing the Rh and Al2O3 loading. Thus, the high surface area supplied by alumina support simultaneously with the enhanced redox, textural and structural properties of the ceria by the formation of MnO2-CeO2 solid solution were discussed and related with the catalytic activity behavior in a CO-PrOx reaction as catalytic test. 2 Experimental 2.1 Catalysts synthesis Rh/MnO2-CeO2/Al2O3 samples with 1wt% of Rh were prepared by wet impregnation method using KMnO4 (Panreac), Ce(NO3)·6H2O (Alfa Aesar) and Rh(NO3)3 (Alfa Aesar) as precursors. Commercial alumina (SASOL) was impregnated with a solution of Ce(NO3)·6H2O dissolved in methanol under stirring 24h. The solvent was removed on rotavapor at 65°C. Then the solid was impregnated with a solution of KMnO4 dissolved in technical grade acetone (Carlo Erba RPE). Additionally, high purity grade ethanol was added as reducing agent [50]. After mixing under vigorous stirring for 60min, the solvent was removed on rotavapor at 80°C. Finally the impregnation of Rh(NO3)3 was done following a similar procedure that was described for ceria precursor. The obtained mixed oxide catalysts were dried overnight at 120°C and calcined at 450°C (2°C/min) for 2h. The catalysts were synthesized with different CeO2/MnO2 weight ratios (10/40, 20/30, 40/10wt.%). Always, the total (CeO2 +MnO2) content in the samples was 50wt.%. The another 50wt.% was constituted by Al2O3. The final catalysts were named RhCexMnyAl, where Y was CeO2 wt.% and Z was MnO2 wt.%. For comparative purposes, catalysts without CeO2 or MnO2 (RhMn50Al and RhCe50Al respectively) were also prepared. 2.2 Characterization X-ray diffraction (XRD) analyses were performed on a Siemens D 500 diffractometer. Diffraction patterns were recorded with Cu Kα radiation (40mA, 40kV) over a 2θ-range 20–80° using a position sensitive detector with a step size of 0.05° and a scan rate of 1°min−1. For the determination of crystalline domain size of CeO2, the Scherrer equation was applied over the most intense XRD peak around 28.5° corresponding to the (111) plane, by using the software X’pert High Score Plus. Raman spectra were recorded in a dispersive Horiva Jobin Yvon LabRam HR800 microscope with a He-Ne green laser (532.14nm) working at 5mW, and with a 600gmm−1 grating (0.87μm spot laser). The microscope used a 50X objective and a confocal pinhole of 1000μm. The Raman spectrometer was calibrated using a silicon wafer. The conditions were selected to avoid sample photo decomposition or denaturation since higher laser powers or longer time of acquisition may result in an increase in sample temperature and the transformation of the initial manganese species. BET specific surface areas were measured through nitrogen adsorption-desorption isotherms at liquid nitrogen temperature in a Micromeritics ASAP 2010 apparatus between 0.1 and 0.995mmHg. Before analysis, the samples were outgassed for 2h at 150°C in vacuum. The Barrett–Joyner–Halenda (BJH) method was used for determining the pore size distributions. Always desorption data were used. HRTEM analysis was performed in a Philips CM 200 working at 200kV with EDS analysis and CCD camera. Thermogravimetric analyses were performed in a TA Instruments SOTQ600 thermo-balance using a 50mLmin−1 flow of synthetic air. The temperature was increased linearly at a rate of 10°Cmin−1 up to 1000°C. A Microactivity Reference unit (PID Eng & Tech Company) that allowed the control of temperature and the composition of the feed streams connected to a thermal conductivity detector (TCD) was used for obtaining the H2-TPR measurements. The reactive gas stream (5vol.% H2 in Ar) was flowed at 50mLmin−1 over 50mg of sample and the temperature raised at 15°Cmin−1 from room temperature to 900°C. A molecular sieve 13X was used to retain the reduction products, mostly H2O and CO2 that would be desorbed on the surface of the solid. Semi-quantitative analysis was carried out by integration of the reduction signal and comparison with hydrogen consumption of a CuO reference. 2.3 Catalytic activity Preferential oxidation of CO-PrOx in presence of hydrogen was carried out at atmospheric pressure in a stainless steel fixed bed reactor (9mm inner diameter) at 60,000cm3 gcat −1 h−1. A reaction mixture composed by 1% CO, 1% O2, 50% H2 and N2 as balance at 100mLmin−1 total flow was used. The catalyst (100mg, 100<ϕ<200μm) was diluted in the adequate amount of crushed glass with the same particle size to obtain a bed height of 5mm. Prior to all catalytic measurements the samples were treated in 100vol.% H2 at 400°C for 2h. Products and reactants were separated and quantified by on-line gas chromatography (Agilent®6890) equipped with HP PLOT Q and HP-5 columns and a TCD detector. The catalytic behavior study was performed between 130°C and 260°C. The CO and O2 conversions were calculated according to Eqs. (1) and (2) where COin and O2in are the inlet CO and O2 concentration and COout and O2out are the outlet ones. (1) CO conversion (%)=([CO]in −[CO]out/[CO]in)×100 (2) O2 conversion (%)=([O2]in −[O2]out/[O2]in)×100 The selectivity towards CO2 formation was calculated using Eq. (3) (3) CO2 selectivity (%)=([CO]in −[CO]out/(2x[O2]in −[O2]out))×100 3 Results and discussion 3.1 XRD Fig. 1 shows the XRD patterns of the synthetized catalysts. Besides the typical diffractions of the primary support (γ-Al2O3, JCPDS 74-2206), in the samples with CeO2 contents higher than 20wt.% the diffraction peaks of the cubic antifluorite structure of cerium oxide (cerianite, JCPDS 34-0394) are also observed. Regarding the presence of manganese peaks, no manganese crystalline species are detected at low Mn contents (RhCe40Mn10Al and RhCe20Mn30Al samples). Therefore, the inclusion of Mn into the ceria lattice forming solid solution could not be completely discarded. In this sense, it has been reported that the solubility of manganese in the ceria network strongly depends on the preparation method, the calcination conditions and the MnO2/CeO2 molar ratio used. MnO2 segregation is normally observed for MnO2/CeO2 molar ratios above 3.0 [51]. Below this value the solid solution is expected. From here, the presence of MnO2-CeO2 solid solution for RhCe40Mn10Al and RhCe20Mn30Al samples could be suggested, at least partially, since these catalysts have MnO2/CeO2 molar ratios of 0.5 and 3.0, respectively. According to Li et al. [46] the incorporation of Mn into the CeO2 network must result in a decrease of the ceria lattice parameter, exposing preferentially the (111) crystal plane of ceria. The lattice contraction is due to the lower ionic radius of Mnn+ (0.053nm for Mn4+ and 0.0645nm for Mn3+) compared to that of Ce4+ (0.094nm). These authors also report that in the MnO2-CeO2 mixed oxides there are at least three types of MnO2 species with different structural locations: in ceria-lattice defect sites, in framework Ce4+ locations, and in interstitial locations. The lattice cubic parameters of ceria in these two samples were estimated and the values are presented in Table 1 . RhCe40Mn10Al and RhCe20Mn30Al solids exhibit a certain degree of ceria lattice contraction, showing an a parameter lower than those of the bare cubic ceria (5.414Å) [52] and RhCe50Al sample (5.401Å). In addition, the cubic lattice parameter of these samples decreases linearly with the concentration of MnO2 (Fig. 2 ). Thus, the formation of the solid solution in both samples can be claimed. For the samples with higher manganese contents (40wt.%, RhCe10Mn40Al and 50wt.%, RhMn50Al), reflections of crystalline MnOx were detected rather than those of ceria, Fig. 1. β-MnO2 (Mn4+ pyrolusite, JCPDS 24-0735) and K2Mn4O8 (Mn3.8+, JCPDS 16-0205) phases are noticeable. The (Mn4O8) structure results from the presence of mainly Mn4+ and only small amounts of Mn3+ [44]. In addition, diffraction peaks of α-Mn2O3 (Mn3+ bixbyite, JCPDS 41-1442) are also observed. Simultaneously some diffraction peaks of potassium nitrate (JCPDS 01-0493) are also observed for RhMn50Al sample. For RhCe10Mn40Al solid the segregation of MnOx species is expected since the MnO2/CeO2 molar ratio is 7.9. Additionally no XRD peaks that could be assigned to any Rh crystalline phases are observed in the samples pointing out the lower crystalline domain or the lower amount of such species. This could indicate a high Rh dispersion in the samples. Interesting information can also be extracted from XRD concerning the CeO2 crystalline domain size. As shown in Table 1, a generalized decrease is produced by the introduction of Mn. From here, it can be suggested that the incorporation of manganese into ceria lattice greatly inhibits the crystalline growth. This observation has been already reported for CeO2 doped with Men+ (Me=metal) cations and correlated with a retarding or stabilizing effect of the dopant element on the growth of the crystal oxide [53,54]. Smaller ceria particles drive to a greater MeOx/CeO2 interface which is crucial for an enhanced activity in catalytic processes. 3.2 Raman spectroscopy Raman spectra of fluorite type oxide structures are dominated by bands due to oxygen lattice vibrations, which are sensitive to the crystal symmetry. Fig. 3 shows the Raman spectra obtained for the synthesized materials. RhCe50Al exhibit a main band centered at about 462cm−1, which is assigned to Ce F2g mode due to symmetrical stretching of CeO vibrational unit in octahedral coordination [34]. It is well known that the position and width of this band depends on several factors, such as phonon confinement, strain, inhomogeneity of the sizes distribution, presence of defects and dopants and variation in phono relaxation with the particles size. In particular, when the ceria particle size decreases, the band shifts to lower energies, broadens and becomes asymmetric [55–57]. In our case, we observed a blue shift of the F2g mode for the RhCe40Mn10Al and RhCe20Mn30Al catalysts dispersed on alumina compared to the RhCe50Al sample. This blue shift could be ascribed to a decrease on the average ceria particle size in good concordance with the XRD data discussed above. Besides this, the inclusion on manganese ions into the ceria lattice forming the MnO2-CeO2 solid solution, also evidenced by XRD, could contribute to the observed displacement of the band. In addition, a weak band ca. 260cm−1 and another pronounced band at approximately 600cm−1 were detected. These phonons have been previously attributed to the normal Raman inactive (IR active) transverse and longitudinal optical phonon modes at the Brillouin zone center respectively [58]. The band centered at 600cm−1 is especially relevant to discern the defect chemistry of ceria. Normally, this mode should not be observed by Raman Spectroscopy; however, the presence of some defects can involve relaxation of the selection rules. In particular, this band has been indexed to oxygen vacancies (Ov) in the CeO2 lattice [59] and, in ceria-doped systems, could be considered as an evidence for the solid solution formation [49]. Indeed if Mnn+ substitutes Ce4+, oxygen defects should be created to balance the charges. Thus, Raman spectra could confirm the preliminary conclusions extracted from XRD data about the possible existence of MnO2-CeO2 solid solution. It is interesting to compare the intensity of the band centered at 600cm−1 for RhCe40Mn10Al and RhCe20Mn30Al samples. Despite the interference of the MnO2 band, the intensity of the Ov band seems to be higher for RhCe20Mn30Al than for RhCe40Mn10Al (zoom in Fig. 3). This could suggest either greater concentration of oxygen vacancies for RhCe20Mn30Al. This Ov band is also influenced by the ceria particle size and generally its intensity grows up when ceria size decreases [60] which correlates fairly well with the Scherrer calculations. Also this increase could be related with the higher concentration of Ce3+ ions [56]. The calculation of the area ratio of the oxygen vacancies band and the F2g signal (Ov/F2g) is well accepted as approach to evaluate ceria oxygen vacancies concentration [61,62]. However, as said before, for RhCe20Mn30Al and RhCe40Mn10Al samples the Ov Raman band overlaps with the MnO2 one. After a deconvolution process the Ov/F2g area ratio was obtained (Table 1). RhCe20Mn30Al seems to exhibit larger concentration of oxygen vacancies than the RhCe40Mn10Al catalysts, which is an advantageous feature given the role played by these defects in oxidation reactions [33,63]. The Raman spectra profiles are different for RhCe10Mn40Al and RhMn50Al catalysts (Fig. 3). The characteristics Raman bands of CeO2 disappear and those of manganese oxides become evident. Such phenomenon has been previously observed and attributed to the segregation of Mn oxides [64]. Because Mn atoms in the Mn dioxides are always 6-fold coordinated, the Raman bands of MnO2 materials depend on the MnO6 octahedral environment (e.g edge/corner-sharing) interaction with water/cations in the tunnels or layers of MnO2 materials. The Raman spectra for RhCe10Mn40Al and RhMn50Al solids are in good agreement with both the number and the positions of the bands of MnOx species reported for other authors [65]. The observed Raman shifts in the 500–700cm−1 and 200–500cm−1 regions have been assigned to the MO stretching of MnO6 octahedral and the MnOMn bending vibration in the MnO2 octahedral lattice, respectively [66]. In the MnO stretching range, the two sharp bands at high wavenumbers (581cm−1 and 631cm−1) are indicative of a well-developed tetragonal structure with an interstitial space consisting of 2×2 tunnels, and are assigned to the Ag mode [67]. The other Raman bands at 297, 392, 470 and 509cm−1 for RhCe10Mn40Al and RhMn50Al are related to MnO2 structure. Somehow this MnO2 segregation correlates well with the manganese oxide crystalline phases detected trough out the XRD in the samples with the highest MnO2/CeO2 ratio. 3.3 Specific surface area and porosity measurements The nitrogen adsorption-desorption isotherms for all the samples are quite similar (Fig. 4 ). They indicate the presence of a mesoporous structure (IV type isotherm with H2 hysteresis loop) with complex and heterogeneous size pores. The loop closes at P/P0 circa 0.4 indicating mesoporosity but probably due to pores that are generated by the spaces between the particles [42]. Table 2 summarizes the textural properties of powder catalysts obtained from the N2 adsorption–desorption isotherms. A decrease in surface area and pore volume are observed simultaneously with the increase in the MnO2/CeO2 weight ratio. The collapse of the textural properties of the primary Al2O3 support (with specific surface area of circa 200m2/g) is more evident for manganese contents higher than 30wt.%. This can be related to the segregation of Mnn+ oxides (MnO2 and/or Mn2O3) blocking the support porosity. 3.4 Redox properties: H2-TPR analysis Fig. 5 shows the H2-TPR profiles obtained for the synthesized solids. RhCe50Al catalyst presents three main reduction peaks centered at 140°C, 174°C and 277°C. These peaks must be assigned to the reduction of rhodium and cerium species, since alumina support does not show any hydrogen consumption until 1000°C. Usually, ceria presents two broad reduction processes, one due to surface Ce4+ species at about 400°C [68], and the other one to bulk CeO2 to Ce2O3 reduction at temperatures higher than 700°C [69]. Moreover rhodium reduction proceeds at much lower temperatures. Ojeda et al. [70] reported that Rh/Al2O3 catalysts present a broad reduction peak at around 142°C due to the reduction of Rh2O3 to metallic Rh. This temperature agrees with the one of the first reduction process of our sample. From here, and taking into account the well-known ability of noble metal oxides to easy the reduction of other surface metal oxide species in intimate contact by hydrogen spill-over processes [71], we can ascribe the three observed reduction peaks to the reduction of both Rh2O3 and surface Ce4+ in different interaction degree, ranging from free Rh2O3 species (140°C), Rh2O3-Ce+4 in close contact (174°C), and free surface ceria (277°C). For RhMn50Al a narrow reduction process centered at around 254°C is detected. Several small maxima are discernible which probably indicates the overlapping of different reduction processes. The existence of different maxima could be related with the reduction processes of the different manganese oxides detected by XRD (Fig. 1). Besides this, the reduction of rhodium and manganese species overlaps, which imply that rhodium reduction is in fact, shifted to higher temperatures with respect to isolated Rh2O3 in RhCe50Al. It has been described that the reduction of manganese supported alumina samples are generally described to proceed by two step reduction profiles in the 320–350°C and 400–500°C temperature ranges, due to the sequential MnO2/Mn2O3 →Mn3O4 →MnO reduction [72,73]. The deeper reduction from MnO to Mn(0) is not produced even in contact with rhodium [73]. The observation in the RhMn50Al sample of a unique reduction process at 254°C suggests a close and different contact between rhodium and manganese species with respect to the obtained for rhodium and cerium species in RhCe50Al. Similarly that in the case of the reduction of surface ceria in the RhCe50Al catalyst, rhodium oxide favors the reduction of manganese oxides by spill-over resulting in a one-step reduction process but at higher temperatures. The TPR profiles of the catalysts containing Rh, Mn and Ce can be explained on the basis of that explained for RhCe50Al and RhMn50Al. When increasing the Mn-to-Ce ratio, the individual reduction processes of free Rh2O3 and free surface Ceria shift to higher temperatures and diminish in intensity until they become undistinguishable, being observable an only broad peak due to the combined reduction of manganese, cerium and rhodium species. A similar behavior have been described early for Rh doped manganese alumina [73] and Ce-Mn mixed oxides [72,74,75]. The TPRs shown in Fig. 5 suggest that manganese presence changes the interaction among all reducible species (Mn, Rh and Ce), inducing a unique reduction process displaced at higher temperatures with the increase of manganese concentration. The Mn species segregation observed by XRD could promote this displacement at higher temperatures. In opposite way, the formation of a Mn-Ce solid solution at low manganese-to-ceria ratio facilitates the reducibility of the species at lower temperature. The experimental hydrogen consumption per gram of sample and the reducibility percentage (RP) of the samples obtained by comparing the experimentally consumption with the theoretical one are presented in Table 3 . For the RP calculation we have assumed that all cerium, rhodium and manganese species are in the form of Ce4, Rh4+ and Mn4+ ones, and they are reduced to Ce3+, Rh0 and Mn2+, respectively. High RP values are obtained in all cases, which evidences that the presence of rhodium favors the reducibility of the samples. Besides this, RP increases with the manganese addition to the ceria, obtaining a maximum value for the RhCe20Mn30Al sample, very close to the total reduction one. Again, this can be related with the Mn-Ce solid formation and the better Rh-Mn-Ce contact that increase the oxygen vacancies (Ov), which favors the reducibility of the sample. The decrease in the RP values observed for the samples with higher manganese-to-cerium ratio is probably due to the segregation of manganese oxides with manganese oxidation state lower than 4+ (K2Mn4O8 and α-Mn2O3) detected in such samples, which underestimates the calculated RP. 3.5 HRTEM microscopy of reduced samples Fig. 6 shows several HRTEM images of RhMn50Al sample after reduction at 400°C. The reduction protocol was similar to the one used to activate the catalysts before reaction. Simultaneously, a characteristic electron diffraction pattern is also shown in Fig. 6b. In this case the rings observed are due to the typical reflection of MnO. The presence of this oxide reinforces the idea of the Mn4+ to Mn2+ reduction postulated by TPR analysis. However the analysis of HRTEM images (Fig. 6c) also reveals d-interplanar spacing of 0.5nm which is consistent with Mn3O4 phase. Therefore both MnO and Mn3O4 phases coexist after reduction of RhMn50Al. The spherical nanoparticles observed of MnOx have an average size of circa 50nm. Simultaneously, small particles of Rh (1.5–2nm in size), Fig. 6d, are also detected. In good agreement, it has been described that MnO2 inhibits the migration of noble metal atoms, decreasing that way the rate of growth of metallic particles [76] and favoring their surface distribution. Similar HRTEM images were observed for the reduced RhCe40Mn10Al and RhCe20Mn30Al samples. For comparative purpose only the HRTEM micrographs for RhCe20Mn30Al are shown in Fig. 7 . The characteristic electron diffraction pattern is also included in Fig. 7b. In this case the rings observed are characteristic of the cubic fluorite structure of mixed oxide Ce-Mn-O. Also some minority reflections of MnO are also detected. The HRTEM images clearly display nanoparticles with the average particle sizes of 5–6nm, which are in close agreement with the XRD result. The observed lower particle size of RhCe20Mn30Al sample than that of RhMn50Al is due to the highly dispersion of Ce-Mn-O nanoparticles over the alumina surface probably motivated by the solid solution formation. Further the images clearly show the well-crystallized (111) lattice plane with a d-spacing of 0.3nm (Fig. 7c), which confirms the fluorite type of the CeO2 crystal [77]. Similar d-spacing were observed for reduced RhCe50Al sample. Therefore the HRTEM analysis for RhCe20Mn30Al confirms the existence of a surface layer of CeO2 (as Ce-M-O solid solution) on the alumina support, which is strongly supported by XRD results. Additionally smaller Rh particles are observed in Fig. 6c. These particles are better observed as dark spots in the white areas of the image. Its size is less than 2nm. These results confirm the high Rh dispersion and the lower crystalline domain of Rh particles suggested by XRD results. In this case the metal support interaction seems to play a decisive role in the stabilizing the metallic dispersion. 3.6 Thermogravimetric analysis The TGA-DTG curves in synthetic air of the studied catalysts are shown in Fig. 8 , the results being summarized in Table 4 . The sample without manganese (RhCe50Al) presents an only process of weight loss (1.3%) at 61°C due to desorption of adsorbed water. For the samples with manganese in their composition, several additional weight loss processes are detected at higher temperatures. According to the described thermal behavior of manganese oxides in the literature [78–80] and the well-known ability of these materials to adsorb water [81], the first weight loss observed below 100°C is due to the removal of physisorbed water, meanwhile those observed in the 100–400°C range are produced from the desorption of chemisorbed water, namely, interlayer water and OH-water [81]. The number of processes in this temperature range, the maximum in temperature of the process, and the total amount of water released increase with the amount of manganese in the sample. These processes are then related with the desorption of “structural water” from the catalyst (Table 4), and must be associated with the presence of protons connected to cation vacancies; and Mn(III) ions in the structure. This observation matches with the XRD and TPR results, and reinforces the idea of the segregation of different manganese oxides at high manganese-to-cerium ratios. In fact, for RhCe40Mn10Al sample, any chemisorbed water desorption process is detected, probably confirming the formation of a Ce-Mn solid solution. At higher temperatures, two weight loss processes occur, one in the 550–800°C range and the second at temperatures higher than 950°C. These processes are well described in the literature and are due to the oxygen loss associated to the MnO2 to Mn2O3 and Mn2O3 to Mn3O4 phase transformations, respectively [82]. As in the case of chemically bound water released processes, the temperature at which these phase transformation proceed shifts to high values with the increase in the amount of manganese in the material, indicating a higher thermal stability of the manganese oxide (Table 4). 3.7 Catalytic test: preferential oxidation of CO in presence of H2 (PROX) The catalytic activity of the synthesized materials for CO oxidation, their selectivity to CO2 and conversion of O2 as a function of the reaction temperature are shown in Fig. 9 . Methane was not detected in any case, a clear indication that undesirable CO or CO2 methanation reactions are absent. Accordingly, the CO conversion in the low temperature window (130–200°C) increases with the ceria content. The best CO conversion is shown by the manganese-free solid, RhCe50Al (around 60% at 150°C). However, this solid is poorly selective to CO2 formation (less than 40% at 150°C). In fact, a full oxygen conversion is achieved in all the temperature range studied, indicating that it is very active in H2 oxidation reaction. This can be understood taking into account the lower enthalpy of the hydrogen oxidation reaction with respect to CO one (−242 versus −283KJmol−1 respectively [83]). In any case, due to the use of an O2 concentration above the stoichiometric for the CO oxidation, the selectivity values are not very high, since an excess of O2 molecules able to react with H2 exits [84]. The catalytic behavior of the catalysts is clearly dependent on the MnO2/CeO2 ratio. The increment of the MnO2/CeO2 ratio dramatically decreases the oxidation capabilities of the catalyst at low temperature, decreasing the CO, O2 and H2 conversions, but resulting in a more selective CO oxidation solid. These results are in agreement with the characterization results, in particular with the reducibility of the samples, in such a way that lower the temperature of reduction, higher the total oxidation capabilities of the solid at lower temperatures. The increment in the selectivity of the CO oxidation with the increase in manganese concentration must be related with the intimate contact of ruthenium with the reducible species of the support, promoted by the manganese presence. It is also observed that high RP values are obtained in all cases, which evidences that the presence of rhodium and manganese favors the reducibility of the samples. Besides this, RP values increase with the manganese addition to the ceria. Therefore, in Rh/MnO2-CeO2/Al2O3 catalysts the enhanced catalytic behavior observed at lower temperatures is related to a better redox and also to the better structural and textural properties of the solids, promoted by the formation of the MnO2-CeO2 solid solution. Conversely, at high manganese-to-ceria ratios, the detected MnOx phase segregation decreases the catalytic behavior towards CO oxidation in the low temperature window. The increment in temperature drives to an increment in the CO conversion, reaching a maximum in the 200–240°C range, where full oxygen conversion is also reached. Again, the support nature determines the maximum CO conversion achieved. All catalysts arrive to the thermodynamic CO conversion except RhCe40Mn10Al one which only converts around 70% of the initial CO introduced. Conversely, at lower temperature the high activity and selectivity towards CO oxidation can be achieved when manganese and ceria forms a solid solution. At temperatures higher than 220°C, a decrease in the CO conversion is detected in all manganese-contained samples. This decrease is due to the concurrence of the R-WGS which is favored at these temperatures [85] increasing the concentration of CO at expenses of CO2 and H2. The loss in CO conversion is different for all catalyst, being maximum for RhCe40Mn10Al and almost inexistent for the one without manganese, RhCe50Al. This behavior suggests that the R-WGS occurrence seems to be promoted by the manganese presence at higher temperatures. In fact the decrease in CO2 selectivity is more pronounced in these solids (Fig. 9c) at temperature range of 130–200°C, reaching the same constant value (circa 50%) for all catalysts in the 200–240°C region, except RhCe40Mn10Al, once full oxygen conversion is achieved and then decreases at higher temperatures, where R-WGS takes place. For RhCe50Al the CO2 selectivity remains always in lower values in the whole range of temperature. This lower CO2 selectivity has been also related to that the rate of hydrogen oxidation exceeds that of carbon monoxide oxidation at higher temperatures [12]. In this case the hydrogen oxidation is seems to be more promoted by the Ce presence than Mn since for RhCe50Al the O2 conversion is always 100%. Similar behavior has been described for cryptomelane-type MnO2 catalysts [44]. In that case, the decrease of selectivity with temperature was explained because of the higher activation energy of the H2 oxidation compared to that of CO. The constant value attained in the 200–240°C interval is due to the arrival to the thermodynamic CO conversion, and the total consumption of oxygen. In fact, taken into account the λ value used in our experiments (λ=2x[O2]in/[CO]in =2, that means that the amount of oxygen in stream is twice the stoichiometric amount needed to oxidize all the CO supplied [CO]in =[O2]in), and Eqs. (1)–(3), when oxygen conversion is 100%, the calculated CO2 selectivity must be half of the measured CO conversion, having the fixed maximum observed of 50% for all catalysts. Therefore the synergic effect of Mn and Ce presence promoting the catalytic behavior is better observed at lower temperatures when selectivity towards CO oxidation is enhanced. In opposite way at higher temperatures the presence of Mn favored the Reverse Water Gas Shift reaction and the catalyst supported only on Ce promoted the H2 oxidation in all range of studied temperatures. The synergistic effect between cations in a mixed-oxide has been extensively discussed in many publications [86,87]. It is well known that they can work in a cooperative way catalysing different steps of a chemical process. Also the mixed-oxide can terminate with multiple surface functionalities and expose cations in multiple oxidation states. Thanks to these interesting features the Mn-Ce oxides have been used as catalysts in different interesting reaction as catalytic oxidation and reaction of NOx among others [87]. The cooperative work between Mn and Ce is promoted when a solid solution is obtained. In other way when the segregation of Mn species appears this synergetic effect decreased. In fact the catalytic behavior was different in samples RhCe10Mn40Al and RhMn50Al in comparison with RhCe40Mn10Al and RhCe20Mn30Al probably due to the presence of Rh-Mn-Ce species and most precisely Mn-Ce forming a solid solution. 4 Conclusions In this work the preparation of Rh/MnO2-CeO2/Al2O3 catalysts was carried out by using wet impregnation method. The prepared solid were tested in CO-PrOx reaction. The results obtained from characterization data demonstrated that the formation of MnO2-CeO2 solid solution can be achieved at low MnO2/CeO2 ratios. In this case, the intimate Rh-Mn-Ce contact promoted the redox, structural and textural properties of the samples. On the other hand, the segregation of Mn species was observed at high ratios. In opposite way at higher temperatures the presence of Mn favored the Reverse Water Gas Shift reaction and the catalyst supported only on Ce promoted the H2 oxidation in all range of studied temperatures. Although these catalysts do not show an optimal performance for CO-PrOx reaction, the enhanced physicochemical properties promoted by the simultaneous presence of Rh, Mn and Ce favored the catalytic activity and selectivity of the catalysts at lower temperatures, producing interesting catalysts for this reaction. The synthesis method employed promoted the Mn-Ce solid solutions formation at low MnO2/CeO2 molar ratios, avoiding the Mn oxides segregation. This study can be taken as a starting point to obtain different active catalysts supported on MnO2-CeO2/Al2O3 through the optimization of the metal-support interaction and the decrease of the Mn segregation. Acknowledgments Financial support for this work has been obtained from the Spanish Ministry of Economy and Competitiveness (ENE2012-37431-C03-03) co-financed by FEDER funds from the European Union and from Junta de Andalucía (TEP-8196). References [1] M. Krumpelt T.R. Krause J.D. Carter J.P. Kopasz S. Ahmed Catal. Today 77 2002 3 16 [2] P.C. Hulteberg J.G.M. Brandin F.A. Silversand M. Lundberg Int. J. Hydrogen Energy 30 2005 1235 1242 [3] J.D. Holladay J. Hu D.L. King Y. Wang Catal. Today 139 2009 244 260 [4] F. Marino G. Baronetti M. Laborde N. Bion A. Le Valant F. Epron D. Duprez Int. J. Hydrogen Energy 33 2008 1345 1353 [5] M. Krumpelt T.R. Krause J.D. Carter J.P. Kopasz S. Ahmed Catal. Today 77 2002 3 16 [6] M. Echigo N. Shinke S. Takami S. Higashiguchi K. Hirai T. Tabata Catal. Today 84 2003 209 215 [7] B.M. Abu-Zied S.A. Soliman Thermochim. Acta 470 2008 91 97 [8] L. Chen D. Ma Z. Zhang Y. Guo D. Ye B. Huang Catal. Lett. 142 2012 1 9 [9] A. Worner C. Friedrich R. Tamme Appl. Catal A: Gen. 245 2003 1 14 [10] A. Mishra R. Prasad Bull. Chem. React. Eng. Catal. 6 1 2011 1 14 [11] P.S. Barbato S. Colussi A. Di Benedetto G. Landi L. Lisi J. Llorca A. Trovarelli J. Phys. Chem. C 120 2016 13039 13048 [12] T.R. Reina S. Ivanova O.H. Laguna M.A. Centeno J.A. Odriozola Appl. Catal. B 197 2016 62 72 [13] O.H. Laguna W.Y. Hernández G. Arzamendi L.M. Gandía M.A. Centeno J.A. Odriozola Fuel 118 2014 176 185 [14] D. Gamarra A. Hornes Z. Koppany Z. Schay G. Munuera J. Soria A. Martínez-Arias J. Power Sources 169 2007 110 116 [15] T.R. Reina E. Papadopoulou S. Palma S. Ivanova M.A. Centeno T. Ioannides J.A. Odriozola Appl. Catal. B 150–151 2014 554 563 [16] J. Wang Lian Deng Dedong He Jichang Lu Suyun He Sufang He Yongming Luo Int. J. Hydrogen Energy 40 2015 12478 12488 [17] G. Zhou Y. Jiang H. Xie F. Qiu Chem. Eng. J. 109 2005 141 145 [18] T.E. Springer T. Rockward T.A. ZawodzInski S. Gottesfeld J. Electrochem. Soc. 148 2001 11 23 [19] S.H. Oh R.M. Sinkevich J. Catal. 142 1993 254 262 [20] C.D. Dudfield R. Chen P.L. Adcock Int. J. Hydrogen Energy 26 2001 763 775 [21] C. Galletti S. Fiorot S. Specchia G. Saracco V. Specchia Top. Catal. 45 2007 15 19 [22] H. Tanaka S. Ito S. Kameoka K. Tomishige K. Kunimori Appl. Catal. A 250 2003 255 263 [23] S. Ito H. Tanaka Y. Minemura S. Kameoka K. Tomishige K. Kunimori Appl. Catal. A 273 2004 295 302 [24] G. Camilla S. Specchia G. Saracco V. Specchi Ind. Eng. Chem. Res. 47 2008 5304 5312 [25] A. Nakajima A. Yoshihara M. Ishigame Phys. Rev. B 50 1994 13297 13307 [26] A. Rangaswamy1 P. Sudarsanam B.M. Reddy1 J. Rare Earth 33 2015 1162 1169 [27] D. He D. Chena H. Haoa J. Yua J. Liua J. Lua F. Liua G. Wana S. He Y. Luoa Appl. Surf. Sci. 390 2016 959 967 [28] T.H. Etsell S.N. Flengas Chem. Rev. 70 1970 339 376 [29] D. He H. Hao D. Chen J. Liu J. Yu J. Lu F. Liu G. Wan S. He Y. Luo Catal. Today 281 2017 559 565 [30] W.Y. Hernandez F. Romero-Sarria M.A. Centeno J.A. Odriozola J. Phys. Chem. C 114 2010 10857 10865 [31] F. Romero-Sarria L.M. Martinez T M.A. Centeno J.A. Odriozola J. Phys. Chem. C 111 2007 14469 14475 [32] A. Martinez-Arías A.B. Hungría M. Fernández-García J. Power Sources 151 2005 32 42 [33] J. Wang C. Han X. Gao J. Lu G. Wan D. He R. Chen K. Chen S. He Y. Luo J. Power Sources 343 2017 437 445 [34] L.M. Martínez T M. Araque J.C. Vargas A.C. Roger Appl. Catal. B 132–133 2013 499 510 [35] B. Solsona G.J. Hutchigns T. García S.H. Taylor New J. Chem. 28 2004 708 711 [36] C. Jones K.J. Cole S.H. Taylor M.J. Crudace G.J. Hutchigns J. Mol. Catal A 305 2009 121 124 [37] F. Arena G. Trunfio J. Negro B. Fazio L. Spadaro Chem. Mater. 19 2007 2269 2276 [38] Z.R. Tian W. Tong J.Y. Wang N.G. Duan V.K. Krishnan S.L. Suib Science 276 1997 926 930 [39] D.M. Frías S. Nousir I. Barrio M. Montes L.M. Martínez T M.A. Centeno J.A. Odriozola Appl. Catal A 325 2007 205 212 [40] M.I. Domínguez P. Navarro F. Romero-Sarria D. Frías S.A. Cruz J.J. Delgado M.A. Centeno M. Montes J.A. Odriozola J. Nanotechnol. 9 2009 3837 3842 [41] L.C. Wang L. He Y.M. Liu Y. Cao H.Y. He K.N. Fan J.H. Zhuang J. Catal. 264 2009 145 [42] W.Y. Hernández M.A. Centeno F. Romero-Sarria S. Ivanova M. Montes J.A. Odriozola Catal. Today 157 2010 160 165 [43] R. Jothiramalingam B. Viswanathan T.K. Varadarajan Catal. Commun. 6 2005 41 45 [44] D. Delimaris T. Ioannides Appl. Catal. B 84 2008 303 312 [45] X. Tang Y. Li X. Huang Y. Xu H. Zhu J. Wang W. Shen Appl. Catal. B 62 2006 265 273 [46] H. Li G. Qib Tanaa X. Zhanga X. Huanga W. Li W. Shena Appl. Catal. B: Environ. 103 2011 54 61 [47] P. Venkataswamy D. Jampaiah F. Lin I. Alxneit B.M. Reddy Appl. Surf. Science 349 2015 299 309 [48] G. Avgouropoulos E.D. Oikonomopoulos Kanistras T. Ioannides Appl. Catal. B: Environ. 65 2006 62 69 [49] F. Arena G. Trunfio J. Negro L. Spadaro Appl. Catal. B: Environ. 85 2008 40 47 [50] I. Barrio I. Legórburu M. Montesa M.I. Domínguez M.A. Centeno J.A. Odriozola Catal. Lett. 101 2005 151 157 [51] M. Machida M. Uto D. Kurogi T. Kijima Chem. Mater. 12 2000 3158 3264 [52] R. Si J. Raitano N. Yi L. Zhang S.W. Chan M. Flytzani-Stephanopoulos Catal. Today 180 2012 68 80 [53] F. Guodomg F. Changgen Z. Zhao J. Rare Earths 25 2007 42 47 [54] O.H. Laguna R. Romero-Sarria M.A. Centeno J.A. Odriozola J. Catal. 276 2010 360 370 [55] F. Zhang S.W. Chan J.E. Spanier E. Apak Q. Jin Q.R.D. Robinson I.P. Herman Appl. Phys. Lett. 80 2002 127 [56] W.Y. Hernández M.A. Centeno F. Romero-Sarria J.A. Odriozola J. Phys. Chem. C 113 2009 5629 5635 [57] G.W. Graham W.H. Weber C.R. Peters R. Usmen J. Catal. 130 1991 310 313 [58] J.Z. Shyu W.H. Weber H. Gandhi J. Phys. Chem. 92 1988 4964 4970 [59] J.R. McBride K.C. Hass B.D. Poindexter W.H. Weber J. Appl. Phys. 76 1994 2435 2441 [60] X.M. Lin L.P. Li G.S. Li W.H. Su Mater. Chem. Phys. 69 2001 236 240 [61] J.E. Spanier R.D. Robinson F. Zheng S.W. Chan I.P. Herman Phys. Rev. B 64 2001 245401 245408 [62] W.Y. Hernandez M.A. Centeno F. Romero-Sarria J.A. Odriozola J. Phys. Chem.C 113 2009 5629 5635 [63] W.P. Dow T.J. Huang J. Catal. 160 1996 171 182 [64] H.S. Kim P. Stair J. Phys. Chem. B 108 2004 17019 17926 [65] T. Gao M. Glerup F. Krumeich R. Nesper H. Fjellvag P. Norby J. Phys. Chem. C 112 2008 13134 13140 [66] C.M. Julien M. Massot C. Poinsignon Spectrochim. Acta Part A 60 2004 689 700 [67] M. Polverejan J.C. Villegas S.L. Suib J. Am. Chem. Soc. 126 2004 7774 7775 [68] L. Pastor-Pérez R. Buitrago-Sierra A. Sepúlveda-Escribano Int. J. Hydrogen Energy 39 2014 17589 17599 [69] P. Venkataswamy D. Jampaiah F. Lin I. Alxneit Appl. Surf. Sci. 349 2015 299 309 [70] M. Ojeda M. López-Granados S. Rojas P. Terreros F.J. García-García J.L.G. Fierro Appl. Catal. A 261 2004 47 55 [71] P. Fornasiero N. Hickey J. Kaspar C. Dossi D. Gava M. Graziani J. Catal. 189 2000 326 338 [72] H. Treviño T. Hyeon W.M.H. Sachtler J. Catal. 170 1997 236 [73] M. Tsuji S. Komarneni J. Mater. Res. 8 1993 611 [74] S. Ramana B. Govinda P. Venkataswamy A. Rangaswamy B.M. Reddy J. Mol. Catal. A 415 2016 113 121 [75] A. Sultana M. Sasaki H. Hamada Catal. Today 185 2012 284 289 [76] A. Berman R.K. Karn M. Epstein App. Catal. A: Gen. 282 2005 73 83 [77] P. Venkataswamy K.N. Rao D. Jampaiah B.M. Reddy Appl. Catal. B 162 2014 122 132 [78] R. Giovanoli Thermochim. Acta 234 1994 303 313 [79] L. Li M. He A. Zhang J. Zhou Themochim. Acta 523 2011 207 213 [80] A.A.A. Azim G.A. Kolta M.H. Askar Electrochim. Acta 17 1972 291 302 [81] W.M. Dose S.W. Donne Mater. Sci. Eng. B 176 2011 1169 1177 [82] E. Saputra S. Muhammad H. Sun H.M. Ang M.O. Tadé S. Wang Appl. Catal. B 142–143 2013 729 735 [83] O. Korotkikh R. Farrauto Catal. Today 62 2000 249 254 [84] C. Galetti S. Specchia G. Saracco V. Specchia Ind. Eng. Chem. Res. 47 2008 5304 5312 [85] C. Galetti S. Fiorot S. Specchia G. Saracco V. Specchia Top. Catal. 45 2007 15 19 [86] J.A. Rodríguez D. Stacchiola Phys. Chem. Chem. Phys. 12 2010 9557 9565 [87] Z. Wang G. Shen J. Li Q. Wanga Y. Chen Appl. Catal. B 138–139 2013 253 259",
      "scopus-id": "85029573123",
      "coredata": {
        "eid": "1-s2.0-S2468823117303255",
        "dc:description": "Rh/MnO2-CeO2/Al2O3 catalysts with different manganese-to-ceria ratios have been synthesized, characterized and tested in CO-PrOx reaction. The physicochemical properties of the solids were studied by XRD, Raman spectroscopy, BET surface area, H2-TPR, TGA-DTG and TEM. The differences observed in the textural, structural and redox properties were related to the Mn-to-ceria ratio of the samples. The segregation of Mn species was observed at high Mn-to-Ce ratios. In opposite way, MnO2-CeO2 solid solutions were obtained at low Mn to Ce ones. In this last case, the physicochemical properties of the solids were favored by the intimate Rh-Ce-Mn contact. The effect of the Mn-Ce presence on Rh catalysts which promotes the catalytic behavior towards selective CO oxidation was observed to be better at low temperatures. At higher temperatures, Mn species promote the Reverse Water Gas Shift reaction, whilst ceria promotes the H2 oxidation in the whole range of working temperatures.",
        "openArchiveArticle": "false",
        "prism:coverDate": "2017-10-31",
        "openaccessUserLicense": null,
        "prism:aggregationType": "Journal",
        "prism:url": "https://api.elsevier.com/content/article/pii/S2468823117303255",
        "dc:creator": [
          {
            "@_fa": "true",
            "$": "Martínez T, L.M."
          },
          {
            "@_fa": "true",
            "$": "Laguna, O.H."
          },
          {
            "@_fa": "true",
            "$": "López-Cartes, C."
          },
          {
            "@_fa": "true",
            "$": "Centeno, M.A."
          }
        ],
        "link": [
          {
            "@_fa": "true",
            "@rel": "self",
            "@href": "https://api.elsevier.com/content/article/pii/S2468823117303255"
          },
          {
            "@_fa": "true",
            "@rel": "scidir",
            "@href": "https://www.sciencedirect.com/science/article/pii/S2468823117303255"
          }
        ],
        "dc:format": "application/json",
        "openaccessType": null,
        "pii": "S2468-8231(17)30325-5",
        "prism:volume": "440",
        "prism:publisher": "Elsevier B.V.",
        "dc:title": "Synthesis and characterization of Rh/MnO2-CeO2/Al2O3 catalysts for CO-PrOx reaction",
        "prism:copyright": "© 2017 Elsevier B.V. All rights reserved.",
        "openaccess": "0",
        "prism:issn": "24688231",
        "dcterms:subject": [
          {
            "@_fa": "true",
            "$": "Manganese oxide"
          },
          {
            "@_fa": "true",
            "$": "Cerium oxide"
          },
          {
            "@_fa": "true",
            "$": "MnO2-CeO2"
          },
          {
            "@_fa": "true",
            "$": "CO-PrOx"
          }
        ],
        "openaccessArticle": "false",
        "prism:publicationName": "Molecular Catalysis",
        "openaccessSponsorType": null,
        "prism:pageRange": "9-18",
        "prism:endingPage": "18",
        "pubType": "fla",
        "prism:coverDisplayDate": "October 2017",
        "prism:doi": "10.1016/j.mcat.2017.06.018",
        "prism:startingPage": "9",
        "dc:identifier": "doi:10.1016/j.mcat.2017.06.018",
        "openaccessSponsorName": null
      },
      "objects": {
        "object": [
          {
            "@category": "thumbnail",
            "@height": "88",
            "@width": "219",
            "@_fa": "true",
            "$": "https://api.elsevier.com/content/object/eid/1-s2.0-S2468823117303255-fx1.sml?httpAccept=%2A%2F%2A",
            "@multimediatype": "GIF image file",
            "@type": "IMAGE-THUMBNAIL",
            "@size": "6752",
            "@ref": "fx1",
            "@mimetype": "image/gif"
          },
          {
            "@category": "thumbnail",
            "@height": "164",
            "@width": "212",
            "@_fa": "true",
            "$": "https://api.elsevier.com/content/object/eid/1-s2.0-S2468823117303255-gr1.sml?httpAccept=%2A%2F%2A",
            "@multimediatype": "GIF image file",
            "@type": "IMAGE-THUMBNAIL",
            "@size": "11142",
            "@ref": "gr1",
            "@mimetype": "image/gif"
          },
          {
            "@category": "thumbnail",
            "@height": "164",
            "@width": "198",
            "@_fa": "true",
            "$": "https://api.elsevier.com/content/object/eid/1-s2.0-S2468823117303255-gr2.sml?httpAccept=%2A%2F%2A",
            "@multimediatype": "GIF image file",
            "@type": "IMAGE-THUMBNAIL",
            "@size": "5047",
            "@ref": "gr2",
            "@mimetype": "image/gif"
          },
          {
            "@category": "thumbnail",
            "@height": "164",
            "@width": "199",
            "@_fa": "true",
            "$": "https://api.elsevier.com/content/object/eid/1-s2.0-S2468823117303255-gr3.sml?httpAccept=%2A%2F%2A",
            "@multimediatype": "GIF image file",
            "@type": "IMAGE-THUMBNAIL",
            "@size": "8883",
            "@ref": "gr3",
            "@mimetype": "image/gif"
          },
          {
            "@category": "thumbnail",
            "@height": "156",
            "@width": "219",
            "@_fa": "true",
            "$": "https://api.elsevier.com/content/object/eid/1-s2.0-S2468823117303255-gr4.sml?httpAccept=%2A%2F%2A",
            "@multimediatype": "GIF image file",
            "@type": "IMAGE-THUMBNAIL",
            "@size": "7584",
            "@ref": "gr4",
            "@mimetype": "image/gif"
          },
          {
            "@category": "thumbnail",
            "@height": "164",
            "@width": "213",
            "@_fa": "true",
            "$": "https://api.elsevier.com/content/object/eid/1-s2.0-S2468823117303255-gr5.sml?httpAccept=%2A%2F%2A",
            "@multimediatype": "GIF image file",
            "@type": "IMAGE-THUMBNAIL",
            "@size": "7040",
            "@ref": "gr5",
            "@mimetype": "image/gif"
          },
          {
            "@category": "thumbnail",
            "@height": "122",
            "@width": "219",
            "@_fa": "true",
            "$": "https://api.elsevier.com/content/object/eid/1-s2.0-S2468823117303255-gr6.sml?httpAccept=%2A%2F%2A",
            "@multimediatype": "GIF image file",
            "@type": "IMAGE-THUMBNAIL",
            "@size": "16048",
            "@ref": "gr6",
            "@mimetype": "image/gif"
          },
          {
            "@category": "thumbnail",
            "@height": "163",
            "@width": "171",
            "@_fa": "true",
            "$": "https://api.elsevier.com/content/object/eid/1-s2.0-S2468823117303255-gr7.sml?httpAccept=%2A%2F%2A",
            "@multimediatype": "GIF image file",
            "@type": "IMAGE-THUMBNAIL",
            "@size": "17085",
            "@ref": "gr7",
            "@mimetype": "image/gif"
          },
          {
            "@category": "thumbnail",
            "@height": "89",
            "@width": "219",
            "@_fa": "true",
            "$": "https://api.elsevier.com/content/object/eid/1-s2.0-S2468823117303255-gr8.sml?httpAccept=%2A%2F%2A",
            "@multimediatype": "GIF image file",
            "@type": "IMAGE-THUMBNAIL",
            "@size": "5101",
            "@ref": "gr8",
            "@mimetype": "image/gif"
          },
          {
            "@category": "thumbnail",
            "@height": "164",
            "@width": "187",
            "@_fa": "true",
            "$": "https://api.elsevier.com/content/object/eid/1-s2.0-S2468823117303255-gr9.sml?httpAccept=%2A%2F%2A",
            "@multimediatype": "GIF image file",
            "@type": "IMAGE-THUMBNAIL",
            "@size": "7696",
            "@ref": "gr9",
            "@mimetype": "image/gif"
          },
          {
            "@category": "standard",
            "@height": "200",
            "@width": "500",
            "@_fa": "true",
            "$": "https://api.elsevier.com/content/object/eid/1-s2.0-S2468823117303255-fx1.jpg?httpAccept=%2A%2F%2A",
            "@multimediatype": "JPEG image file",
            "@type": "IMAGE-DOWNSAMPLED",
            "@size": "27733",
            "@ref": "fx1",
            "@mimetype": "image/jpeg"
          },
          {
            "@category": "standard",
            "@height": "248",
            "@width": "320",
            "@_fa": "true",
            "$": "https://api.elsevier.com/content/object/eid/1-s2.0-S2468823117303255-gr1.jpg?httpAccept=%2A%2F%2A",
            "@multimediatype": "JPEG image file",
            "@type": "IMAGE-DOWNSAMPLED",
            "@size": "25917",
            "@ref": "gr1",
            "@mimetype": "image/jpeg"
          },
          {
            "@category": "standard",
            "@height": "249",
            "@width": "301",
            "@_fa": "true",
            "$": "https://api.elsevier.com/content/object/eid/1-s2.0-S2468823117303255-gr2.jpg?httpAccept=%2A%2F%2A",
            "@multimediatype": "JPEG image file",
            "@type": "IMAGE-DOWNSAMPLED",
            "@size": "12739",
            "@ref": "gr2",
            "@mimetype": "image/jpeg"
          },
          {
            "@category": "standard",
            "@height": "248",
            "@width": "301",
            "@_fa": "true",
            "$": "https://api.elsevier.com/content/object/eid/1-s2.0-S2468823117303255-gr3.jpg?httpAccept=%2A%2F%2A",
            "@multimediatype": "JPEG image file",
            "@type": "IMAGE-DOWNSAMPLED",
            "@size": "24173",
            "@ref": "gr3",
            "@mimetype": "image/jpeg"
          },
          {
            "@category": "standard",
            "@height": "214",
            "@width": "301",
            "@_fa": "true",
            "$": "https://api.elsevier.com/content/object/eid/1-s2.0-S2468823117303255-gr4.jpg?httpAccept=%2A%2F%2A",
            "@multimediatype": "JPEG image file",
            "@type": "IMAGE-DOWNSAMPLED",
            "@size": "17570",
            "@ref": "gr4",
            "@mimetype": "image/jpeg"
          },
          {
            "@category": "standard",
            "@height": "232",
            "@width": "301",
            "@_fa": "true",
            "$": "https://api.elsevier.com/content/object/eid/1-s2.0-S2468823117303255-gr5.jpg?httpAccept=%2A%2F%2A",
            "@multimediatype": "JPEG image file",
            "@type": "IMAGE-DOWNSAMPLED",
            "@size": "17266",
            "@ref": "gr5",
            "@mimetype": "image/jpeg"
          },
          {
            "@category": "standard",
            "@height": "336",
            "@width": "602",
            "@_fa": "true",
            "$": "https://api.elsevier.com/content/object/eid/1-s2.0-S2468823117303255-gr6.jpg?httpAccept=%2A%2F%2A",
            "@multimediatype": "JPEG image file",
            "@type": "IMAGE-DOWNSAMPLED",
            "@size": "38081",
            "@ref": "gr6",
            "@mimetype": "image/jpeg"
          },
          {
            "@category": "standard",
            "@height": "575",
            "@width": "602",
            "@_fa": "true",
            "$": "https://api.elsevier.com/content/object/eid/1-s2.0-S2468823117303255-gr7.jpg?httpAccept=%2A%2F%2A",
            "@multimediatype": "JPEG image file",
            "@type": "IMAGE-DOWNSAMPLED",
            "@size": "68206",
            "@ref": "gr7",
            "@mimetype": "image/jpeg"
          },
          {
            "@category": "standard",
            "@height": "246",
            "@width": "602",
            "@_fa": "true",
            "$": "https://api.elsevier.com/content/object/eid/1-s2.0-S2468823117303255-gr8.jpg?httpAccept=%2A%2F%2A",
            "@multimediatype": "JPEG image file",
            "@type": "IMAGE-DOWNSAMPLED",
            "@size": "31536",
            "@ref": "gr8",
            "@mimetype": "image/jpeg"
          },
          {
            "@category": "standard",
            "@height": "529",
            "@width": "602",
            "@_fa": "true",
            "$": "https://api.elsevier.com/content/object/eid/1-s2.0-S2468823117303255-gr9.jpg?httpAccept=%2A%2F%2A",
            "@multimediatype": "JPEG image file",
            "@type": "IMAGE-DOWNSAMPLED",
            "@size": "62949",
            "@ref": "gr9",
            "@mimetype": "image/jpeg"
          }
        ]
      },
      "link": {
        "@rel": "abstract",
        "@href": "https://api.elsevier.com/content/abstract/scopus_id/85029573123"
      }
    }
  }
}