{
  "metadata": {
    "title": "Theoretical study on the reaction kinetics of CO oxidation by nitrogen-doped graphene catalysts with different ligand structures",
    "authors": "; ; ",
    "journal": "Molecular Catalysis",
    "date": "2023-04-15",
    "doi": "10.1016/j.mcat.2023.113103",
    "abstract": "",
    "uri": "https://api.elsevier.com/content/article/pii/S246882312300189X",
    "pii": "S246882312300189X"
  },
  "fulltext": {
    "full-text-retrieval-response": {
      "scopus-eid": "2-s2.0-85150856997",
      "originalText": "serial JL 315758 291210 291744 291790 291809 31 Molecular Catalysis MOLECULARCATALYSIS 2023-03-23 2023-03-23 2023-03-23 2023-03-23 2023-04-14T11:57:02 1-s2.0-S246882312300189X S2468-8231(23)00189-X S246882312300189X 10.1016/j.mcat.2023.113103 S300 S300.1 FULL-TEXT 1-s2.0-S2468823123X00078 2024-06-26T17:47:58.02126Z 0 0 20230415 2023 2023-03-23T06:08:10.001669Z absattachment articleinfo articlenumber articletitlenorm authfirstinitialnorm authfirstsurnamenorm cid cids contenttype copyright crossmark dateloaded dateloadedtxt datesearch datesort dateupdated dco docsubtype doctype doi eid ewtransactionid hubeid indexeddate issn issnnorm itemstage itemtransactionid itemweight openaccess openarchive pg pgfirst pii piinorm pubdatestart pubdatetxt pubyr sectiontitle sortorder srctitle srctitlenorm srctype ssids alllist content subj subheadings suppl tomb volfirst volissue volumelist webpdf webpdfpagecount yearnav figure table e-component body mmlmath acknowledge affil appendices articletitle auth authfirstini authfull authkeywords authlast grantnumber grantsponsor grantsponsorid highlightsabst primabst ref specialabst 2468-8231 24688231 true 541 541 C Volume 541 19 113103 113103 113103 20230415 15 April 2023 2023-04-15 2023 Regular Papers article fla © 2023 Elsevier B.V. All rights reserved. THEORETICALSTUDYREACTIONKINETICSCOOXIDATIONBYNITROGENDOPEDGRAPHENECATALYSTSDIFFERENTLIGANDSTRUCTURES QIN C 1 Introduction 2 Theoretical methods 3 Results and discussion 3.1 Structural properties of single Fe atoms loaded on graphene 3.2 Adsorption of O2, CO, O and CO2 on Fe-CxNy 3.3 Mechanism of CO oxidation on Fe-CxNy 3.3.1 ER1 mechanism 3.3.2 ER2 mechanism 3.3.3 LH mechanism 3.3.4 TER mechanism 3.4 Activity comparison 4 Reaction kinetics on Fe-CxNy 5 Conclusion Supporting material CRediT authorship contribution statement Acknowledgments Appendix Supplementary materials References ALSOUBAIHI 2018 660 R SLAVINSKAYA 2020 119275 E GE 2022 1211 1218 C ZOU 2006 2893 2898 H SOLIMAN 2019 2395 2407 N KAMPA 2008 362 367 M SCHMIDT 2019 404 W YANG 2021 121041 W NAGARAJAN 2018 193 200 V ABBASI 2022 390 402 K XU 2020 147181 L XU 2021 149207 L LI 2021 3355 3358 Q HUANG 2021 151207 X LUO 2021 093002 X XU 2018 98 L JOSHI 2020 2479 2507 A BENIYA 2019 590 602 A GONG 2004 8 9 X CUI 2021 147881 H MAO 2014 5441 K LOU 2020 6094 6101 Y NIE 2019 1419 1423 L CHEN 2020 8815 8824 Y HUANG 2013 5 10 C SARMA 2020 14890 14902 B CUI 2019 772 780 H HAN 2019 1847 1853 B JUDAI 2004 2732 2737 K WANG 2020 364 371 S JI 2020 11900 11955 S CHUNG 2017 479 483 H MEIER 2022 eabn4580 M SONG 2011 3678 3683 E LIANG 2017 598 Z LIGTHART 2011 5306 5310 D GUO 2017 26107 26117 C KRISHNAN 2017 465 472 R TRIPATHI 2021 142 150 A LIN 2013 17319 17326 S MA 2015 71 77 D WANG 2012 1596 1606 X ZHANG 2015 6280 6288 H ZHANG 2016 10682 10690 K CUI 2017 10682 10690 W LUAN 2018 2510 2516 P JIANG 2014 20290 20296 Q LU 2009 20156 20160 Y LI 2010 6250 6254 Y ESRAFILI 2019 526 534 M KROPP 2019 6864 6868 T PAN 2019 4290 Y WANG 2021 18854 18858 L KRISHNAN 2018 257 262 R DELLEY 2000 7756 7764 B DELLEY 1990 508 517 B KRESSE 1996 11169 11186 G PERDEW 1997 1396 J BASIUK 2014 1609 1615 V KRESSE 1999 1758 1775 G HUANG 2021 1868 1873 J LIU 2022 111536 M LUO 2020 27856 27863 M LUO 2020 15724 15732 M FERNANDEZ 2005 179 187 L LIU 2021 111624 M GAO 2019 19838 19845 L BAI 2017 23812 23819 X SHI 2022 129962 Y TANG 2016 93985 93996 Y JIANG 2020 287 295 Q XU 2017 35 42 G RAO 2019 25743 25748 Y BAI 2014 14650 14653 Y LI 2020 8706 8715 L XU 2018 23481 23492 G KOZUCH 2011 101 110 S QINX2023X113103 QINX2023X113103XC 2025-03-23T00:00:00.000Z 2025-03-23T00:00:00.000Z http://creativecommons.org/licenses/by-nc-nd/4.0/ © 2023 Elsevier B.V. All rights reserved. 2023-04-03T15:58:07.619Z http://vtw.elsevier.com/data/voc/AddOnTypes/50.7/aggregated-refined National Natural Science Foundation of China 51976207 NSFC National Natural Science Foundation of China http://data.elsevier.com/vocabulary/SciValFunders/501100001809 http://sws.geonames.org/1814991/ University of Science and Technology of China USTC University of Science and Technology of China http://data.elsevier.com/vocabulary/SciValFunders/501100009076 http://sws.geonames.org/1814991/ Hefei Advanced Computing Center This work was supported by the National Natural Science Foundation of China (No. 51976207 ) and the theoretical calculations were done at the supercomputing system of the University of Science and Technology of China and the Hefei Advanced Computing Center. https://doi.org/10.15223/policy-017 https://doi.org/10.15223/policy-037 https://doi.org/10.15223/policy-012 https://doi.org/10.15223/policy-029 https://doi.org/10.15223/policy-004 item S2468-8231(23)00189-X S246882312300189X 1-s2.0-S246882312300189X 10.1016/j.mcat.2023.113103 315758 2023-04-14T11:15:23.17386Z 2023-04-15 1-s2.0-S246882312300189X-main.pdf https://s3-eu-west-1.amazonaws.com/prod-ucs-content-store-eu-west/content/pii:S246882312300189X/MAIN/application/pdf/daeef90b22a581ed475367e056519891/main.pdf main.pdf pdf true 8144894 MAIN 12 1-s2.0-S246882312300189X-main_1.png https://s3-eu-west-1.amazonaws.com/prod-ucs-content-store-eu-west/content/pii:S246882312300189X/PREVIEW/image/png/f644ae46ee9aa7549de65d0af17945ca/main_1.png main_1.png png 58826 849 656 IMAGE-WEB-PDF 1 1-s2.0-S246882312300189X-gr8.jpg https://s3-eu-west-1.amazonaws.com/prod-ucs-content-store-eu-west/content/pii:S246882312300189X/gr8/DOWNSAMPLED/image/jpeg/09bbe973a49299792dc7e81af97a1a16/gr8.jpg gr8 gr8.jpg jpg 85015 479 565 IMAGE-DOWNSAMPLED 1-s2.0-S246882312300189X-gr7.jpg https://s3-eu-west-1.amazonaws.com/prod-ucs-content-store-eu-west/content/pii:S246882312300189X/gr7/DOWNSAMPLED/image/jpeg/d43f86c4db9df7086f4d39cc69e1517a/gr7.jpg gr7 gr7.jpg jpg 95388 536 565 IMAGE-DOWNSAMPLED 1-s2.0-S246882312300189X-gr6.jpg https://s3-eu-west-1.amazonaws.com/prod-ucs-content-store-eu-west/content/pii:S246882312300189X/gr6/DOWNSAMPLED/image/jpeg/5d24f4502d0de40e5187f1802961bc3c/gr6.jpg gr6 gr6.jpg jpg 81771 530 566 IMAGE-DOWNSAMPLED 1-s2.0-S246882312300189X-gr5.jpg https://s3-eu-west-1.amazonaws.com/prod-ucs-content-store-eu-west/content/pii:S246882312300189X/gr5/DOWNSAMPLED/image/jpeg/c65de7ae1b4666bcb9cd797d4465a310/gr5.jpg gr5 gr5.jpg jpg 135133 759 565 IMAGE-DOWNSAMPLED 1-s2.0-S246882312300189X-gr4.jpg https://s3-eu-west-1.amazonaws.com/prod-ucs-content-store-eu-west/content/pii:S246882312300189X/gr4/DOWNSAMPLED/image/jpeg/4f87844054eebdf216962c4ca91bb2d3/gr4.jpg gr4 gr4.jpg jpg 108192 478 565 IMAGE-DOWNSAMPLED 1-s2.0-S246882312300189X-gr3.jpg https://s3-eu-west-1.amazonaws.com/prod-ucs-content-store-eu-west/content/pii:S246882312300189X/gr3/DOWNSAMPLED/image/jpeg/e07666fa436edada6e6cbea8a3ec24b4/gr3.jpg gr3 gr3.jpg jpg 128936 842 565 IMAGE-DOWNSAMPLED 1-s2.0-S246882312300189X-gr2.jpg https://s3-eu-west-1.amazonaws.com/prod-ucs-content-store-eu-west/content/pii:S246882312300189X/gr2/DOWNSAMPLED/image/jpeg/120c2b096ac7d12bf57fbd8dff80ea3e/gr2.jpg gr2 gr2.jpg jpg 77771 477 489 IMAGE-DOWNSAMPLED 1-s2.0-S246882312300189X-ga1.jpg https://s3-eu-west-1.amazonaws.com/prod-ucs-content-store-eu-west/content/pii:S246882312300189X/ga1/DOWNSAMPLED/image/jpeg/57cb9d78d1d82306199407267b1a45ff/ga1.jpg ga1 true ga1.jpg jpg 44780 198 500 IMAGE-DOWNSAMPLED 1-s2.0-S246882312300189X-gr1.jpg https://s3-eu-west-1.amazonaws.com/prod-ucs-content-store-eu-west/content/pii:S246882312300189X/gr1/DOWNSAMPLED/image/jpeg/982f9b43867d58c16093cc3a04c414c9/gr1.jpg gr1 gr1.jpg jpg 43519 203 489 IMAGE-DOWNSAMPLED 1-s2.0-S246882312300189X-gr8.sml https://s3-eu-west-1.amazonaws.com/prod-ucs-content-store-eu-west/content/pii:S246882312300189X/gr8/THUMBNAIL/image/gif/202221c59134938b9962ddd6797e4f72/gr8.sml gr8 gr8.sml sml 12931 164 193 IMAGE-THUMBNAIL 1-s2.0-S246882312300189X-gr7.sml https://s3-eu-west-1.amazonaws.com/prod-ucs-content-store-eu-west/content/pii:S246882312300189X/gr7/THUMBNAIL/image/gif/b5fe263733299129ef76ff0b4f7fde1d/gr7.sml gr7 gr7.sml sml 12763 164 173 IMAGE-THUMBNAIL 1-s2.0-S246882312300189X-gr6.sml https://s3-eu-west-1.amazonaws.com/prod-ucs-content-store-eu-west/content/pii:S246882312300189X/gr6/THUMBNAIL/image/gif/555607e8f80ba50e71e2f93c5c526d2b/gr6.sml gr6 gr6.sml sml 11947 164 175 IMAGE-THUMBNAIL 1-s2.0-S246882312300189X-gr5.sml https://s3-eu-west-1.amazonaws.com/prod-ucs-content-store-eu-west/content/pii:S246882312300189X/gr5/THUMBNAIL/image/gif/2df6eb413f61e6bdcd16d66cfc9fee2e/gr5.sml gr5 gr5.sml sml 11363 164 122 IMAGE-THUMBNAIL 1-s2.0-S246882312300189X-gr4.sml https://s3-eu-west-1.amazonaws.com/prod-ucs-content-store-eu-west/content/pii:S246882312300189X/gr4/THUMBNAIL/image/gif/f21bd6bd5ef4cdad94d72c013c2fd251/gr4.sml gr4 gr4.sml sml 15026 164 194 IMAGE-THUMBNAIL 1-s2.0-S246882312300189X-gr3.sml https://s3-eu-west-1.amazonaws.com/prod-ucs-content-store-eu-west/content/pii:S246882312300189X/gr3/THUMBNAIL/image/gif/ea83e28f4c585d77d8353a9e9c03508d/gr3.sml gr3 gr3.sml sml 11187 164 110 IMAGE-THUMBNAIL 1-s2.0-S246882312300189X-gr2.sml https://s3-eu-west-1.amazonaws.com/prod-ucs-content-store-eu-west/content/pii:S246882312300189X/gr2/THUMBNAIL/image/gif/db3c1b079f01e93b53655c392186cd16/gr2.sml gr2 gr2.sml sml 11736 164 168 IMAGE-THUMBNAIL 1-s2.0-S246882312300189X-ga1.sml https://s3-eu-west-1.amazonaws.com/prod-ucs-content-store-eu-west/content/pii:S246882312300189X/ga1/THUMBNAIL/image/gif/c51ca9dbcef550172bc256eb0e8350a3/ga1.sml ga1 true ga1.sml sml 12359 87 219 IMAGE-THUMBNAIL 1-s2.0-S246882312300189X-gr1.sml https://s3-eu-west-1.amazonaws.com/prod-ucs-content-store-eu-west/content/pii:S246882312300189X/gr1/THUMBNAIL/image/gif/5789612024c92787eb9c185aee8f6085/gr1.sml gr1 gr1.sml sml 11905 91 219 IMAGE-THUMBNAIL 1-s2.0-S246882312300189X-gr8_lrg.jpg https://s3-eu-west-1.amazonaws.com/prod-ucs-content-store-eu-west/content/pii:S246882312300189X/HIGHRES/image/jpeg/792cae9bf61ad961827d3d07a26d5adc/gr8_lrg.jpg gr8 gr8_lrg.jpg jpg 520769 2121 2500 IMAGE-HIGH-RES 1-s2.0-S246882312300189X-gr7_lrg.jpg https://s3-eu-west-1.amazonaws.com/prod-ucs-content-store-eu-west/content/pii:S246882312300189X/HIGHRES/image/jpeg/5745474229155083646b39d789b06f71/gr7_lrg.jpg gr7 gr7_lrg.jpg jpg 726461 2372 2500 IMAGE-HIGH-RES 1-s2.0-S246882312300189X-gr6_lrg.jpg https://s3-eu-west-1.amazonaws.com/prod-ucs-content-store-eu-west/content/pii:S246882312300189X/HIGHRES/image/jpeg/97222ddb76ef3770ea76029aa4ebc530/gr6_lrg.jpg gr6 gr6_lrg.jpg jpg 603399 2349 2508 IMAGE-HIGH-RES 1-s2.0-S246882312300189X-gr5_lrg.jpg https://s3-eu-west-1.amazonaws.com/prod-ucs-content-store-eu-west/content/pii:S246882312300189X/HIGHRES/image/jpeg/4f70182f0ed31f4980e4d9d2050adc6f/gr5_lrg.jpg gr5 gr5_lrg.jpg jpg 1043554 3357 2500 IMAGE-HIGH-RES 1-s2.0-S246882312300189X-gr4_lrg.jpg https://s3-eu-west-1.amazonaws.com/prod-ucs-content-store-eu-west/content/pii:S246882312300189X/HIGHRES/image/jpeg/03ed8d195a626151de30bef93c36f32f/gr4_lrg.jpg gr4 gr4_lrg.jpg jpg 736397 2116 2500 IMAGE-HIGH-RES 1-s2.0-S246882312300189X-gr3_lrg.jpg https://s3-eu-west-1.amazonaws.com/prod-ucs-content-store-eu-west/content/pii:S246882312300189X/HIGHRES/image/jpeg/211f2daef27670268d59787692b71b5e/gr3_lrg.jpg gr3 gr3_lrg.jpg jpg 978212 3726 2500 IMAGE-HIGH-RES 1-s2.0-S246882312300189X-gr2_lrg.jpg https://s3-eu-west-1.amazonaws.com/prod-ucs-content-store-eu-west/content/pii:S246882312300189X/HIGHRES/image/jpeg/462885b4d45f9a4b6d2c1ff116b363c8/gr2_lrg.jpg gr2 gr2_lrg.jpg jpg 504844 2116 2167 IMAGE-HIGH-RES 1-s2.0-S246882312300189X-ga1_lrg.jpg https://s3-eu-west-1.amazonaws.com/prod-ucs-content-store-eu-west/content/pii:S246882312300189X/HIGHRES/image/jpeg/e74b99281747241c2057cf089832d200/ga1_lrg.jpg ga1 true ga1_lrg.jpg jpg 325579 875 2213 IMAGE-HIGH-RES 1-s2.0-S246882312300189X-gr1_lrg.jpg https://s3-eu-west-1.amazonaws.com/prod-ucs-content-store-eu-west/content/pii:S246882312300189X/HIGHRES/image/jpeg/9c3ebf8fd62ac2e93d79551036eb7814/gr1_lrg.jpg gr1 gr1_lrg.jpg jpg 327195 901 2167 IMAGE-HIGH-RES 1-s2.0-S246882312300189X-mmc1.docx https://s3-eu-west-1.amazonaws.com/prod-ucs-content-store-eu-west/content/pii:S246882312300189X/mmc1/MAIN/application/vnd.openxmlformats-officedocument.wordprocessingml.document/bfb83e06c45f0a64600df734d73f7960/mmc1.docx mmc1 mmc1.docx docx 5114358 APPLICATION 1-s2.0-S246882312300189X-si1.svg https://s3-eu-west-1.amazonaws.com/prod-ucs-content-store-eu-west/content/pii:S246882312300189X/image/svg+xml/996637914b95406f4a4a25812fae7a88/si1.svg si1 si1.svg svg 9188 ALTIMG 1-s2.0-S246882312300189X-si2.svg https://s3-eu-west-1.amazonaws.com/prod-ucs-content-store-eu-west/content/pii:S246882312300189X/image/svg+xml/2d4d4119536e8c852892e9205f3a6443/si2.svg si2 si2.svg svg 4271 ALTIMG 1-s2.0-S246882312300189X-si3.svg https://s3-eu-west-1.amazonaws.com/prod-ucs-content-store-eu-west/content/pii:S246882312300189X/image/svg+xml/8094d6410c4c6578c490fb9f73714b0f/si3.svg si3 si3.svg svg 4711 ALTIMG 1-s2.0-S246882312300189X-si4.svg https://s3-eu-west-1.amazonaws.com/prod-ucs-content-store-eu-west/content/pii:S246882312300189X/image/svg+xml/91f0eecc834c0014f199875cf5d27fc8/si4.svg si4 si4.svg svg 12669 ALTIMG 1-s2.0-S246882312300189X-si5.svg https://s3-eu-west-1.amazonaws.com/prod-ucs-content-store-eu-west/content/pii:S246882312300189X/image/svg+xml/77eb2ac89cec9ade205edc5ae338c70a/si5.svg si5 si5.svg svg 18301 ALTIMG 1-s2.0-S246882312300189X-si6.svg https://s3-eu-west-1.amazonaws.com/prod-ucs-content-store-eu-west/content/pii:S246882312300189X/image/svg+xml/734c11c8055f3ef6e4a84cd69cceafe2/si6.svg si6 si6.svg svg 11187 ALTIMG 1-s2.0-S246882312300189X-am.pdf https://s3-eu-west-1.amazonaws.com/prod-ucs-content-store-eu-west/content/egi:10RWZZPTCR3/MAIN/application/pdf/bb7758d435d9639c4aea9ad823d28d7c/am.pdf am am.pdf pdf false 2375535 AAM-PDF MCAT 113103 113103 S2468-8231(23)00189-X 10.1016/j.mcat.2023.113103 Elsevier B.V. Fig. 1 Charge differential density map (a) and corresponding density of states (b) for Fe-CN3. The D-band center (ɛd) is shown by the solid red line and the Fermi energy level is shown by the dashed red line. Fig 1 Fig. 2 Energy changes of (a) Fe-C3N, (b) Fe-C2N2, (c) Fe-CN3 and (d) Fe-N4 catalysts at 1000 K and a time interval of 1 fs in AIMD simulations. Fig 2 Fig. 3 Top and side views of O2 on Fe-CN3 (a), Fe-N4(c), and with PDOS on the left. Top and side views of CO on Fe-CN3 (b), Fe-N4(d), and with PDOS on the left. Brown, gold, white and red represent C, Fe, N, and O respectively. Fig 3 Fig. 4 ER1 mechanism reaction pathways and energy distribution of CO on (a) Fe-C3N, (b) Fe-C2N2, (c) Fe-CN3 and (d) Fe-N4. Fig 4 Fig. 5 Energy distribution (a) and reaction pathways of CO through the ER2 mechanism on (b) Fe-C2N2 and (c) Fe-CN3. Fig 5 Fig. 6 (a) Energy distribution in Fe-CN3, Fe-C2N2 and Fe-CN3 and (b) reaction pathways of CO via the LH mechanism in Fe-CN3. Fig 6 Fig. 7 (a) Reaction pathways of CO via the TER mechanism in Fe-CN3 and (b) energy distribution in Fe-CxNy. Fig 7 Fig. 8 Rate constants for CO oxidation by different mechanisms on Fe-C3N (a), Fe-C2N2 (b), Fe-CN3 (c), and Fe-N4 (d). The rate constant for the primary reaction is in units of s−1 and the rate constant for the secondary reaction is cm3 molecule−1 s−1. Fig 8 Table 1 Electron transfer (``−'' Denotes gaining electrons; q, | e |) of Fe, A1, A2, A3 and A4 on Fe-CxNy catalysts. Table 1 Models q(Fe) q(A1) q(A2) q(A3) q(A4) Fe-C3N 1.09 −1.24 −0.20 −0.10 −0.10 Fe-C2N2 1.15 −1.22 −1.22 −0.13 −0.12 Fe-CN3 1.08 −1.20 −1.24 −1.11 −0.27 Fe-N4 1.10 −1.22 −1.13 −1.13 −1.24 Literature q(Fe) q(N3) q(C-total) FeN3 [69] 0.96 −3.59 2.45 NiN3 [70] 0.87 −1.21 −1.16 −1.27 −0.32 Table 2 RDS energy barriers of CO over different catalysts by the most suitable mechanism. Table 2 Catalyst Energy barriers of RDS (eV) Au-graphene [49] 0.66 Pd-graphene [73] 0.29 Pd/Pt@CN [74] 0.48(0.68) Ag-CuO [75] 0.24 Fe43Pt12 nanoparticle [76] 0.55 Ir-GDY [77] 0.37 FeN-DV [67] 0.66 NiNx-Gr [70] 1.71 This work 0.20 Theoretical study on the reaction kinetics of CO oxidation by nitrogen-doped graphene catalysts with different ligand structures Chunlan Qin Conceptualization Methodology Software Writing – original draft a Shanshan Ruan Resources a Kangwei Xu Writing – review & editing b Chenliang He Supervision a Ying Shi Data curation a Beibei Feng Investigation a Lidong Zhang a c ⁎ a National Synchrotron Radiation Laboratory, University of Science and Technology of China, Hefei, Anhui 230029, PR China National Synchrotron Radiation Laboratory University of Science and Technology of China Hefei Anhui 230029 PR China aNational Synchrotron Radiation Laboratory, University of Science and Technology of China, Hefei, Anhui 230029, PR China b School of Energy Science and Engineering, University of Science and Technology of China, PR China School of Energy Science and Engineering University of Science and Technology of China PR China cSchool of Energy Science and Engineering, University of Science and Technology of China, PR China c State Key Laboratory of Fire Science, University of Science and Technology of China, Hefei, Anhui 230026, PR China State Key Laboratory of Fire Science University of Science and Technology of China Hefei Anhui 230026 PR China bState Key Laboratory of Fire Science, University of Science and Technology of China, Hefei, Anhui 230026, PR China ⁎ Corresponding author: National Synchrotron Radiation Laboratory, University of Science and Technology of China, Hefei, Anhui 230029, PR China. National Synchrotron Radiation Laboratory University of Science and Technology of China Hefei Anhui 230029 PR China Harmful carbon monoxide (CO) gas from vehicle exhaust and fossil fuel combustion seriously affects the ecological environment and human health, although this issue can be effectively solved by low-temperature catalytic combustion. Herein, an Fe and N codoped double vacancy graphene catalyst (Fe-CxNy) for the low-temperature catalytic combustion of CO is proposed, and the mechanism of the CO catalytic combustion reaction over the catalyst is systematically investigated by using density function theory (DFT). Four oxidation mechanisms, including Eley–Rideal (ER1 and ER2), Langmuir-Hinshelwood (LH) and Termolecular Eley–Rideal (TER), were compared in terms of oxidation pathways and energy distribution. All the results indicate that Fe-CxNy catalysts have efficient catalytic activity. The Fe-CN3 catalyst with the predominant LH reaction mechanism showed the best performance for the catalytic combustion of CO with only 0.20 eV, which was comparable to that of noble metals. The rate constant calculations further demonstrate that Fe-CN3 exhibits excellent catalytic performance at low temperatures. This work not only provides a theoretical basis for the design and development of low-temperature catalytic combustion CO catalysts, but also provides data support for the kinetic model of CO combustion reaction. Graphical abstract Image, graphical abstract Keywords CO oxidation Nitrogen coordination Graphene Catalytic combustion Single-atom catalyst Data availability Data will be made available on request. 1 Introduction Carbon monoxide gas comes from automobile exhaust, industrial exhaust, household gas stoves, hydrocarbon fuel combustion, etc. [1–4]. CO pollutes the ecological environment that human beings depend on, and threatens people's health. The colorless and odorless nature of CO means that it is often undetectable and that the leakage of CO easily cause poisoning [5,6]. It has been reported in the literature that the survival time of organisms will not exceed 3 min when the concentration of CO exceeds 12,800 ppm [7]. CO can react photochemically with nitrogen oxides and volatile organic compounds to form atmospheric pollutants and damage the environment [8,9]. Understanding the carbon monoxide (CO) oxidation mechanism is beneficial for the development of catalysts for the synergistic control of NOx and CO. There are two solutions to CO pollutants. The first is to solve the emergence of CO at the source. Incomplete combustion of fossil energy is widely believed to be the main pathway for the production of CO. Demand for fossil energy (80% of total energy [10]) is still strong today, with its consumption inevitably generating large amounts of CO. Therefore, people have been trying to use clean energy, such as hydrogen energy, solar energy, and biomass energy, to replace fossil energy sources [11–15]. The second solution to CO pollutants is to eliminate. Both physical and chemical methods are commonly used to eliminate CO. Physical methods utilizese porous materials to achieve physical adsorption, which has the disadvantages of low efficiency and high cost, and can cause secondary pollution to the environment. In contrast, the chemical method involves oxidizing CO to CO2 by a catalyst, an application most widely used in industrial production and automotive exhaust [16,17]. Recently, although car manufacturers have been encouraged to shift from fuel to new energy vehicles, it is expected that vehicles on the road will still be predominantly driven by internal combustion engines by approximately 2050 [18]. Improvements in technologies related to internal combustion engines are necessary to reduce pollutants such as soot and dust. With increasing attention to the ecological environment, all countries have formulated corresponding carbon emission regulations, striving to seek development in green ecology and protect the ecological environment in development. Therefore, catalytic combustion of CO is of great significance [19]. Catalysts commonly mentioned for the combustion of CO are mainly conventional catalysts based on precious metals, such as Pd [20,21], Au [22,23], Pt [24,25], Ru [26,27], and Rh [28,29]. The fact that these catalysts are scarce limits their application even more [30], which has led to a wide interest in transition metals, including metal oxides and SACs [19,31]. Due to their low energy barrier, high stability and high atomic utilization [32], SACs exhibit excellent catalytic performance in various important reactions, such as water electrolysis [33], CO2 electroreduction and CO oxidation [34]. The concept of monatomic catalysts first appeared in 2011 and was proposed by Zhang and his colleagues [35]. SAC supports mainly include metal oxides (Al2O3 [36], ZrO2 [37], CeO2 [38], etc.) and two-dimensional materials (graphene [39,40], boron nitride [41], MoS2 [42], etc.). Two-dimensional materials have attracted much attention because of their high thermal stability, large specific surface area and low preparation cost. Graphene is a typical two-dimensional material, that has excellent thermal conductivity, large current density and good ductility, and has been widely used in the field of material catalysis [43–47]. Graphene doped with single atoms is reported to have good CO-catalytic properties. Jiang and colleagues found that the CO oxidation barrier of Al-doped graphene is only 0.32 eV, which is larger than that of Au-doped graphene (0.31 eV) [48,49]. Li and his coworkers [50] calculated the barrier of Fe-doped mono-defect graphene for CO (0.58 eV). This system has a higher energy barrier, which is not favorable for CO combustion, and the catalyst activity needs to be improved. Previous studies have shown that the catalytic ability of the catalyst can be effectively improved by adding heteroatoms (N, P, S). The reaction energy barrier of a single N-doped Pd atom loaded on graphene is only 0.25 eV [51]. Fe atoms are the most active catalysts for CO oxidation among the 14 transition metals studied in the N-doped graphene system [52]. More interestingly, many studies have reported the preparation of Fe-N-C series catalysts, which have been applied in benzene oxidation [53]. However, previous studies have focused on mono-vacancy graphene more than divacancy graphene. There are few reports exploring the effects of coordination environments on CO by controlling different concentrations of nitrogen-doped graphene [53–55]. In this work, an efficient nonprecious metal catalyst for CO catalytic combustion is proposed. We systematically investigate the CO combustion reaction mechanism of double-defective Fe-CxNy in different coordination environments by ab initio calculations and select the optimal reaction path. Moreover, the rate constant study and ab initio molecular dynamics (AIMD) simulations are helpful for the simulation of real CO catalytic combustion. This work demonstrates that the catalytic performance of the catalyst can be effectively improved by reasonable adjustment of the coordination environment, which provides a theoretical basis for the design and development of advanced CO catalysts. 2 Theoretical methods All calculations in this work were performed by the Vienna Ab-initio Simulation Package (VASP version 5.4.4) [56–58]. In the generalized gradient approximation formulation, Perdew-Burke-Ernzerhof (PBE) [59] is used to exchange correlation functionals for structural relaxation and energy minimization. The DFT-D3 [60] method of Grimme's scheme was used to correct for van der Waals interactions present between the reactants and the support. Meanwhile, the projector augmented wave (PAW) [61] method was used for interactions between valence electrons and the core. The Kohn-Sham valence states expand in the plane-wave basis set with a kinetic energy cutoff of 500 eV [62]. The model taken in this work is a 4 × 4 × 1 graphene supercell with a total of 32 atoms. The double-defect graphene structure is obtained by hollowing out two adjacent carbons, which then carry Fe atoms and connect with 4 adjacent C or N atoms. Fe-CxNy means Fe is coordinated with x C atoms and y N atoms. In this article, we selected four coordination structures of Fe-C3N, Fe-C2N2, Fe-CN3 and Fe-N4, and the corresponding structure is shown in Fig. S1. FeC2N2 has three configurations, FeN2C2-pen, FeN2C2-opp and FeN2C2‑hex [63–65]. Configurations that have been successfully synthesized and applied to the oxidation mechanism are mostly Fe-C2N2-opp [53]. The vacuum layer thickness in the Z direction is 15 Å to avoid layer-to-layer interactions. The Brillouin zone was sampled at 3 × 3 × 1 and 6 × 6 × 1 for structural optimization and density of states calculations, respectively. In all relaxations, the maximum residual force for structure optimization is set to 0.01 eV/Å, and the energy convergence is 10−5 eV per atom. The transition state (TS) is calculated by dimer methods [66]. A negative frequency is formed during bond breaking or formation. The geometry of the transition state will be determined by the virtual vibrational frequency. We calculated the energy barriers of the four models under different ER, LH and TER mechanisms and plotted the reaction paths from the initial state (IS) to the TS and finally to the final state (FS). The adsorption energy can be calculated by the following formula: (1) E ads = E adsorb − sub − ( E adsorb + E sub ) where Eads represents the adsorption energy, Eadsorb-sub represents the energy of the substrate and the adsorbate, Esub represents the energy of the substrate, and Eadsorb represents the energy of the adsorbed gas. The larger the value of Eads, the stronger the adsorption capacity of the substrate to the adsorbate. Through energy-barrier calculations, the most suitable reaction mechanism of CO over the Fe-CxNy catalyst was found. The energy barrier and heat of reaction can be calculated by: (2) E a = E TS − E IS (3) Δ E a = E FS − E IS where ETS represents the total energy of the transition state and EIS represents the energy of the initial state. A lower energy barrier indicates that the reaction needs to cross fewer obstacles and is more likely to occur. The Gibbs free energy at a specific temperature is calculated from ΔG = ΔEa + ΔGcorr , where ΔG corr is the free energy dependence at zero point energy, obtained by vibration frequency analysis. The reaction rate constant k is calculated from the harmonic transition state and is obtained by the following equation: (4) k = k B T h Q TS Q R exp [ − E a k B T ] where kB, h and T represent the Boltzmann constant, Planck constant and thermodynamic temperature, respectively. QTS and QR are the partition functions, which represent the transition state and reactants, respectively. The partition functions can be calculated by the following definition. (5) Q = 1 ∏ i = 1 vibration [ 1 − exp ( − h ν i k BT ) ] where νi is the frequency and the imaginary frequency of the transition state is not considered. 3 Results and discussion 3.1 Structural properties of single Fe atoms loaded on graphene The binding energy is closely related to the stability of double-defective iron atoms loaded on graphene. The smaller the binding energy, the more stable it is. According to the literature we know that the binding energy of double-defective Fe loading on graphene is −8.29 eV, which is much smaller than the experimental and calculated value of Fe atoms [67,68]. This indicates that the structure of the catalyst of this system is stable. The electronegativity between Fe, C and N atoms is different. In Table 1 , the Fe-N structure causes charge transfer between Fe and N-modified graphene, thus improving the electron transfer capacity between the active site and the carbon carrier during CO oxidation. It should be feasible to get a model of this work from the table. The yellow color in the charge density diagram in Fig. 1 (a) represents an increase in charge and the blue color represents a decrease in charge. Many charges are gathered by Fec and Fen bonds, and Fe provides electrons, indicating that it can be used as the active center. According to the Bader charge analysis, the charge of the N atom increases significantly as the number of N coordination sites increases, which is a greater electronegativity of the N atom than the C atom. In addition, the density of states is important for understanding the electronic structure of the catalyst. Fig. 1(b) shows the partial density of states plots for the four structures with Fermi energy level of 0. As seen from the figure, the d orbitals of Fe and the p orbitals of C or N appear to overlap in the energy range of −10 to 6 eV, which proves the existence of strong interactions between Fe atoms and C or N atoms. Notably, the intensity of the hybridization peaks appearing near the Fermi energy level becomes stronger as the number of N coordinations increases. We also calculated the D-band centers for different structures. D-band center theory suggests that the adsorption capacity is stronger as ɛd gets closer to the Fermi energy level. This is in general agreement with our adsorption energy results. The charge difference and density of states of the other three N-coordination catalysts are shown in Fig. S2. Ab initio molecular dynamics (AIMD) simulations can further verify the structural stability of the Fe-CxNy catalyst. The structural and energy changes of the catalyst at 1000 K for the initial state, 200 fs, 400 fs, 600 fs, 800 fs, and 1000 fs are illustrated in Fig. 2 . Fe-CN3 has the smallest energy fluctuation range with increasing temperature and slight deformation of the atomic structure, indicating that the Fe-CN3 catalyst has a more stable structure. 3.2 Adsorption of O2, CO, O and CO2 on Fe-CxNy Before studying the mechanism of the CO combustion reaction, we first investigated the adsorption properties of different gases on Fe-CxNy, including O2, CO, O and CO2. All the adsorption energies and electron transfers are summarized in Table S1. In Fig. 3 (a), (b), the adsorption configuration of Fe-CN3 on the gas is similar to that of Fe-C3N and Fe-C2N2. Adsorbed O2 molecules tended to be parallel to the substrate and the OO bond was extended from 1.23 Å to 1.36 Å. Fe interacts with O to form two new FeO bonds, with lengths of 1.99 Å and 1.79 Å. O2 (0.59 |e|) and CO (0.18 |e|) transfer electrons to Fe-CN3. The p-orbital of the adsorbate and the d-orbital of Fe have overlapping peaks in the range of −10∼6 eV, indicating that the adsorbate can be activated on Fe atoms. Adsorption of O2 and CO by Fe-CN3 was chemisorbed with adsorption energies of −1.19 eV and −1.64 eV, respectively. We found that the adsorption energies of O2 and CO on Fe-N4 were −0.80 eV and −1.58 eV, respectively (Fig. 3(c), (d)), which means that the adsorption capacity of O2 in the Fe-CxNy system gradually decreases with increasing the N coordination number. Therefore, the adsorption configuration of O2 on Fe-N4 is different from that before. It will interact with Fe at a larger tilt angle, resulting in FeO bonds. The different selectivity and adsorption configuration of the catalyst to the adsorbate will inevitably affect its catalytic activity and oxidation mechanism. For complete recovery of the catalyst, the properties of carbon dioxide adsorption on the catalyst were also investigated. The most stable adsorption conformation is shown in Fig. S4. We found that the adsorption energies of CO2 in Fe-CxNy are −0.18, −0.18, −0.19 and −0.18 eV, respectively, with constant shape and CO bond length. In Fe-CxNy, the distances from Fe atoms to O atoms are 2.85, 2.79, 2.86 and 2.96 Å, respectively, indicating that there is a weak interaction between CO2 and the carrier. CO2 has a rather small adsorption energy and is physically adsorbed. Theoretically, when the adsorption energy is less than −0.50 eV, the formed CO2 material will be automatically released at room temperature, which is favorable for the oxidation of CO on Fe-CxNy. Meanwhile, we calculated the adsorption conformation of O atoms on Fe-CxNy (as shown in Fig. S5). O atoms tend to adsorb vertically on Fe-Top. Weak adsorption of single-atom O on Fe-CxNy with increasing N coordination number, makes the FeO bond length longer. This provides a basis for the design of the CO oxidation pathway. In this work, the adsorption energy of CO is slightly stronger than that of O2. When both gases are coinjected, CO is preferentially adsorbed on the catalyst, which in turn promotes the oxidation process of CO, affecting the adsorption behavior and reaction path of the second molecule (O2 or CO). Fig. S6 shows the coadsorption configuration of CO and O2 on Fe-CxNy with a larger coadsorption energy than when O2 or CO is adsorbed alone, suggesting a possible LH mechanism for the catalyst in an environment with relatively flat CO and O2 concentrations. With a much higher CO adsorption energy of Fe-N4 (−1.58 eV) than its O2 adsorption energy (−0.80 eV), the Fe-N4 system prefers to adsorb two CO molecules rather than O2 and CO coadsorption, which is consistent with the theoretical calculations. As shown in Fig. S7, the adsorption energy of two CO at Fe-CxNy is stronger than that of O2 and CO and forms the intermediate structure of OCOOCO on Fe-CxNy with adsorption energies of −2.52, −2.74, −1.77 and −1.0 eV. The larger adsorption energies indicate that the catalyst is more desirable for the TER mechanism in environments with high CO concentrations. 3.3 Mechanism of CO oxidation on Fe-CxNy The oxidation reaction of CO with O2 is usually carried out by ER, LH and MvK, and the recently proposed TER has also been widely studied. 3.3.1 ER1 mechanism Based on the above analysis, although the interaction of the catalyst with CO is stronger than that with O2, the active center of the catalyst can be presorbed by O2 in an O2 rich environment. Therefore, we investigated the ER mechanism on Fe-CxNy. The ER1 mechanism can be expressed by the following two equations: (6) CO+O2*→CO2+O* (7) O*+CO→CO2 By overcoming a certain energy barrier during ER1, the free CO attacks the O2 preadsorbed on Fe-CxNy to form free CO2 and the adsorbed O atom. Then the second CO molecule approaches O* to form a second CO2, which completes the catalyst cycle. Conformations of physisorbed CO around the preadsorbed O2 are considered to be IS, while physisorbed CO2 and chemisorbed O atoms are considered to be FS (see Fig. 4 (a)). The total potential barrier for the reaction of CO with preadsorbed O2 to form the transition state (TS) is 0.79 eV. An energy of 3.50 eV is released by this reaction process, indicating that the ER1 mechanism of Fe-C3N is feasible. With the remaining one O atom being adsorbed on the Fe atom, the attack of the second CO molecule is awaited (Fig. S8(a)). This step of the reaction has an energy barrier of 0.70 eV and releases 1.46 eV of energy, which is comparable to the energy barrier of the first step of the reaction. Noticeably, however, the heat released from the first reaction step can overcome the energy barrier required for the second reaction step, which in turn can overcome the energy barrier of the first reaction and provide conditions for the CO catalytic oxidation cycle. In Fig. 4(b), the activated O2 on Fe-C2N2 is bonded to CO and the OO bond length is extended from 1.37 Å to 1.53 Å. After overcoming a potential barrier of 0.78 eV the OO bond breaks and then the C atom of CO combines with the dangling O atom to form CO2. The remaining adsorbed O atom reacts with the subsequent CO and the energy barrier from IS to FS is 0.70 eV. The adsorbed O atom reaction pathway is shown in Fig. S8(b). A similar bond length change to Fe-C2N2 is shown in Fig. 4(c) for the ER1 reaction path of Fe-CN3. The CO oxidation process only needs to overcome a potential barrier of 0.69 eV, releasing a reaction energy of 3.37 eV, which is smaller compared to Fe-C3N and Fe-C2N2. The second CO2 is finally obtained by crossing a small energy barrier of 0.42 eV (see Fig. S8(c)). Having a distance of 2.86 Å from the Fe atom, CO2 has a small adsorption energy (−0.19 eV) and can be desorbed at room temperature. In Fig. 4(d), IS differs from the above in that O2 is bonded to the Fe-atom of Fe-N4 at an inclined angle and CO is physically adsorbed above the side of the dangling O atom. As CO approaches O2, the OO bond is elongated. The first CO2 is formed by overcoming the potential barrier of 0.75 eV and releasing the reaction energy of 3.54 eV. Then the second CO2 is formed in Fe-N4 and more reaction energy is released (see Fig. S8(d)). At the same time, we also calculated the ER1 mechanism of Fe-C4 (Tang et al. studied the most favorable mechanism for CO catalysis by undoped Fe-C4 catalyst is ER1 [71]), and the reaction energy barrier is as high as 0.86 eV (Fig. S9), which is higher than that of the previous catalysts. In summary, the rate-determining step (RDS) of Fe-CxNy in the ER1 reaction mechanism differs depending on the N coordination number and is superior to that of the undoped Fe-C4 catalyst. A single-atom Fe catalyst with three coordinated N atoms only needs to overcome an energy barrier of 0.69 eV to carry out the CO oxidation reaction. 3.3.2 ER2 mechanism The reaction mechanism of ER2 is expressed by the following equations: (8) CO+O2*→CO3* (9) CO3*→CO2+O* (10) O*+CO→CO2 After a comprehensive transition state search and geometry optimization, we found that CO cannot react with the active O2 molecules on Fe-C3N to form CO3 intermediates, which is consistent with literature reports. The high selectivity of Fe-N4 for CO suggests that it is more difficult to generate CO3 intermediates on Fe atoms, which also agrees with our calculations. Hence, only the ER2 mechanism of Fe-C2N2 and Fe-CN3 catalysts for the catalytic combustion of CO is discussed in this paper. The energy distribution of CO and the corresponding reaction paths in the ER2 mechanism of Fe-C2N2 and FeCN3 are shown in Fig. 5 . Fe-CN2 has a higher affinity for O2 than Fe-CN3. In Fig. 5(b), CO physisorption above preadsorbed O2 is designated IS. O2 is fully activated and the OO bond is broken with the proximity of CO. The bond length of Fe-O is shortened from 1.85 Å to 1.65 Å. Then a carbonate-like intermediate (CO3) is generated through a potential barrier of 0.79 eV, and the bond length between the C-terminus of CO and the broken O atom is 1.35 Å. At the same time, the bond length of CO was extended by 0.07 Å compared with that of free CO. The process is an exothermic reaction, releasing a reaction energy of 3.38 eV. Interestingly, decomposition of carbonate-like (CO3) into chemisorbed O atoms and free CO2 requires overcoming an energy barrier of up to 0.93 eV, which implies that the rate-limiting step of the Fe-C2N2 single-atom catalyst on the ER2 mechanism is the decomposition of CO3. Compared to Fe-CN3, only 0.09 eV is required for CO and preadsorbed O2 to generate CO3 via the ER2 mechanism, and the dissociation energy barrier for CO3 is 0.8 eV (see Fig. 5(c)). Although Fe-CN3 is more prone to the ER2 mechanism than Fe-C2N2, the energy barrier for the rate-limiting step is still relatively high overall. 3.3.3 LH mechanism The energy distribution of the LH mechanism of Fe-CxNy is shown in Fig. 6 (a). The LH mechanism can be expressed as: (11) CO*+O2*→OCOO* (12) OCOO*→CO2+O* (13) O*+CO→CO2 Both CO and O2 are adsorbed on the catalyst and then the reaction between the adsorbed CO and O2 occurs through certain energy barriers to form intermediates (OCOO). The dissociation of OCOO to CO2 and the chemisorption of O atoms also require overcoming energy barriers. The adsorption energy of the tetra-N-coordinated monatomic Fe catalyst for CO is almost twice that of O2, which means that the possibility of Fe-N4 coadsorption of CO and O2 is extremely small and thus the reaction through the LH mechanism is difficult. This is comparable to theoretical studies in the literature [72]. We have also found that O2 cannot be coadsorbed on Fe atoms when the geometry of CO and O2 coadsorption is fully optimized. For this reason, we did not investigate the LH mechanism of Fe-N4 in the present work. Taking Fe-CN3 as an example (the reaction path is shown in Fig. 6(b)), CO and O2 coadsorbed on Fe atoms are considered IS, where CO adsorbs at a tilted angle and O2 is parallel to the graphene substrate. During the reaction of CO with O2, O2 is activated, and the longest FeO bond breaks and rotates, bringing it close to the C atom of CO to form the OCOO intermediate, which is considered MS. The process of forming the OCOO intermediate is exothermic and does not require crossing of the potential barrier. An energy of 0.97 eV is exerted from IS through TS1 to MS, and the length of the OO bond extends from 1.35 Å to 1.51 Å. Subsequently, the OO bond breaks and the Fe-C bond length is further elongated to provide the conditions for the dissociation of CO2. Then, by overcoming the free energy barrier of only 0.20 eV, the reaction readily passes from MS to FS via TS2. Residual O* reacts with the approaching CO to form CO2 with an energy barrier of only 0.42 eV. The reaction paths of Fe-C3N and Fe-C2N2 are shown in Figs. S10 and S11. An N-doped single-atom Fe catalyst catalyzing the CO oxidation reaction through the LH mechanism needs to overcome 0.70 eV, which may be related to the similar adsorption energies of Fe-C3N for CO and O2, corresponding to −1.52 eV and −1.50 eV, respectively. Intriguingly, with a low energy barrier (0.02 eV) in the second half of the reaction, the resulting OCOO intermediate dissociates into CO2 and adsorbs O atoms with almost no external force. It generates a reaction energy of 3.27 eV, which is very favorable for the reaction. The RDS of 0.35 eV for the reaction of CO with O2 catalyzed by Fe-C2N2 is superior to that of single-atom catalysts with a single N ligand. More surprisingly, the energy barrier for the dissociation of the intermediate to CO2 and adsorbed O is only 0.11 eV, which is a tiny energy barrier for the catalytic reaction. Based on the above analysis, the LH mechanism is friendly for Fe-CxNy catalysts, and the energy barriers of the reaction RDS are all reasonable. For Fe-C3N and Fe-C2N2, the RDS is the formation of OCOO at 0.70 eV and 0.35 eV, respectively, while for Fe-CN3 with three coordinated N atoms, the RDS is the dissociation of OCOO with a reaction barrier of 0.20 eV. This indicates that different Fe-N and Fe-C coordination environments affect the catalytic performance. The more the number of N coordinations increases, the easier the intermediate formation. 3.3.4 TER mechanism Based on the above analysis, the TER mechanism of the CO oxidation reaction is feasible on Fe-CxNy. Two CO molecules are first presorbed onto the catalyst and O2 from the air attacks the CO, overcoming the potential barrier to combine with the C atoms of the two COs to form a five-membered ring intermediate (OCOOCO). Then OCOOCO dissociates synchronously into two CO2 molecules. This mechanism was first proposed in the h-BN catalyzed oxidation of CO by Mao et al. and can be expressed by the following equation [22]: (14) 2CO*+O2→OCOOCO* (15) OCOOCO*→2CO2 Here, we still take Fe-CN3 as an example. In Fig. 7 (a), IS is two preadsorbed CO molecules and an O2 molecule physically adsorbed on top of CO. MS is a cyclic OCOOCO intermediate adsorbed on Fe atoms. As O2 gradually approaches CO, the OO bond length is elongated from 1.24 Å to 1.27 Å. Two O atoms and two C atoms of CO form two CO bonds, resulting in the OCOOCO intermediate. The CO bond lengths in MS are 1.38 Å, and the OO bond length was extended to 1.47 Å. Forming two CFe bonds with the combination of O2 and CO, the bond lengths extend from 1.82 Å and 1.75 Å to 2.04 Å and 2.02 Å, respectively. The reaction energy barrier in this step is 0.67 eV. Subsequently, in the process from MS to FS, the OO bond breaks to form two OCO*, which dissociate into two CO2 simultaneously after 0.29 eV. The distances between carbon dioxide and iron atoms are 4.03 Å and 4.00 Å, respectively. Having an average adsorption energy of −0.19 eV, CO2 is weakly adsorbed and can be dissociated automatically at room temperature. Compared to the Fe catalyst with three N coordination numbers, the activity of Fe monoatomic catalysts for CO oxidation decreases when the number of N coordinations decreases to 1 or 2. From Fig. 7(b), the energy barrier of the monatomic catalyst with single-ligand N reaching MS after TS1 is 0.80 eV. When the N coordination number increases to 2, the first reaction energy barrier is as high as 1.22 eV. Notably, when the coordination number is 4, the energy barrier of the catalyst for CO oxidation is higher than that of the triple-ligand N and single-ligand N, which is 0.91 eV. This is actually related to the high selectivity of Fe-N4 for CO, and when the CO adsorption energy is high, the activation of two CO molecules by O2 to form a five-membered ring intermediate requires high energy, and the calculated results are complementary to theory. Obviously, the Fe-CxNy catalyst has a volcano peak shape oxidation activity law. Reasonable adjustment of the N coordination number can improve the oxidation activity of the catalyst. In an environment rich in CO, Fe-CN3 has a better catalytic oxidation activity for CO. Reaction pathways for Fe-C3N, Fe-C2N2 and Fe-N4 catalyzed CO oxidation are shown in Figs. S12–S14, respectively. 3.4 Activity comparison From the above analysis, it is clear that CO has the best oxidation activity on Fe-CN3, and the RDS through the LH mechanism is the dissociation of OCOO* with a Gibbs barrier of 0.20 eV, which is lower than that of the noble metal and other metal-doped catalysts (as shown in Table 2 ). Evidence of Fe-CN3 catalysts with ultrahigh catalytic activity and promising applications in CO catalytic combustion reactions. 4 Reaction kinetics on Fe-CxNy To investigate the effect of different temperatures on Fe-CxNy, we calculated the reaction rate constants of Fe-CxNy for CO oxidation by different mechanisms. The reaction rate constants for all Fe-based catalysts with different N coordination at 100–1000 K are shown in Fig. 8 . We found that the reaction rate constants increase with increasing temperature. This indicates that the increase in temperature can promote the catalytic ability of the Fe-CxNy catalyst for CO oxidation. In addition, at temperatures below room temperature, almost all reactions are strongly inhibited and unfavorable. It is noteworthy that Fe-C2N2 and Fe-CN3 can also react below room temperature via the LH mechanism. At 298 K, the reaction rate constants of Fe-C2N2 and Fe-CN3 are 1.26 × 107 cm3 molecule−1 s−1 (9.74 × 106 cm3 molecule−1 s−1) and 4.32 × 1012 cm3 molecule−1 s−1 (3.34 × 1012 cm3 molecule−1 s−1), respectively. This result is consistent with the previous calculation of the transition state energy barrier. Moreover, the Arrhenius Equation k=ATnexp(-E/RT) can be derived from Eq. (4). The values of A, n, and E for each basic reaction step are written in Table S2. These reaction constants will help to construct a complex reaction model on the catalyst surface. Turnover frequency (TOF) is an important criterion to judge the catalyst activity which can be further investigated for the intrinsic activity of the catalyst. According to Sebastian Kozuch [78], for exothermic reactions, the turnover frequency can be calculated by the following equation: (16) TOF = k B T h exp [ − Δ E / ( RT ) ] where kB is the Boltzmann constant and h represents the Planck constant. ΔE denotes the amount of standard state Gibbs free energy change between the transition state and the initial state. Table S3 shows that for Fe-CxNy catalysts at 298 K, the TOFs are 2.47 × 10−3, 2.06 × 103, 7.12 × 105 and 3.52 × 10−4 h−1, respectively. Obviously, the catalyst with three nitrogen ligands has the best turnover frequency. 5 Conclusion In this work, the oxidation activity and mechanism of the low-temperature catalytic combustion of CO over double -defective graphene Fe monoatomic catalysts under different coordination environments are systematically investigated using DFT calculations. Among all possible reaction mechanisms of Fe-CxNy catalysts, Fe-C3N tends to achieve LH mechanisms at an energy barrier of 0.70 eV. Fe-C2N2, similar to Fe-CN3, tends to undergo the LH mechanism with an energy barrier of 0.35 eV. Tetra-coordinated N atom Fe based catalysts tend to undergo ER1 and LH mechanisms and need to overcome a potential barrier of 0.91 eV. In all coordination environments, Fe-CxNy immobilized by three coordination nitrogen atoms shows the highest CO oxidation performance with only a barrier of 0.20 eV. It is necessary to select different catalysts according to different environments to achieve efficient oxidation. Fe-CN3 exhibits superior catalytic performance in both O2-rich and CO-rich environments, as well as in environments with comparable concentrations of both. Furthermore, we found that the increase in temperature favors the reaction proven by the rate constant calculation, and for the FeCN3 catalyst, the reaction rate constant is still large at low temperature, which means that this catalyst is expected to be an efficient nonprecious metal catalyst for low temperature catalytic combustion of CO. By combining the rate constant with the Arrhenius formula, some data of the kinetic model of the catalytic combustion reaction were obtained. In conclusion, the present work shows that Fe-CxNy can be used as an efficient and promising catalyst for the catalytic oxidation of CO with nonprecious metals. Supporting material The supporting data mentioned in this paper can be found in the Supporting Information. CRediT authorship contribution statement Chunlan Qin: Conceptualization, Methodology, Software, Writing – original draft. Shanshan Ruan: Resources. Kangwei Xu: Writing – review & editing. Chenliang He: Supervision. Ying Shi: Data curation. Beibei Feng: Investigation. Lidong Zhang: . Declaration of Competing Interest The authors declare that they have no known competing financial interests or personal relationships that could have appeared to influence the work reported in this paper. Acknowledgments This work was supported by the National Natural Science Foundation of China (No. 51976207) and the theoretical calculations were done at the supercomputing system of the University of Science and Technology of China and the Hefei Advanced Computing Center. Supplementary materials Supplementary material associated with this article can be found, in the online version, at doi:10.1016/j.mcat.2023.113103. Appendix Supplementary materials Image, application 1 References [1] R.M. Al Soubaihi K.M. Saoud J. Dutta Critical review of low-temperature CO oxidation and hysteresis phenomenon on heterogeneous catalysts Catalysts 8 12 2018 660 10.3390/catal8120660 R.M. Al Soubaihi, K.M. Saoud, J. Dutta, Critical review of low-temperature CO oxidation and hysteresis phenomenon on heterogeneous catalysts, Catalysts 8(12) (2018) 660, doi: 10.3390/catal8120660. [2] E.M. Slavinskaya A.V. Zadesenets O.A. Stonkus A.I. Stadnichenko A.V. Shchukarev Y.V. Shubin S.V. Korenev A.I. Boronin Thermal activation of Pd/CeO2-SnO2 catalysts for low-temperature CO oxidation Appl. Catal., B 277 2020 119275 10.1016/j.apcatb.2020.119275 E.M. Slavinskaya, A.V. Zadesenets, O.A. Stonkus, A.I. Stadnichenko, A.V. Shchukarev, Y.V. Shubin, S.V. Korenev, A.I. Boronin, Thermal activation of Pd/CeO2-SnO2 catalysts for low-temperature CO oxidation, Appl. Catal., B 277 (2020) 119275, doi: 10.1016/j.apcatb.2020.119275. [3] C. Ge J. Sun Q. Tong W. Zou L. Li L. Dong Synergistic effects of CeO2/Cu2O on CO catalytic oxidation: electronic interaction and oxygen defect J. Rare Earths 40 8 2022 1211 1218 10.1016/j.jre.2021.08.014 C. Ge, J. Sun, Q. Tong, W. Zou, L. Li, L. Dong, Synergistic effects of CeO2/Cu2O on CO catalytic oxidation: electronic interaction and oxygen defect, J. Rare Earths 40(8) (2022) 1211–1218, doi: 10.1016/j.jre.2021.08.014. [4] H. Zou X. Dong W. Lin Selective CO oxidation in hydrogen-rich gas over CuO/CeO2 catalysts Appl. Surf. Sci. 253 5 2006 2893 2898 10.1016/j.apsusc.2006.06.028 H. Zou, X. Dong, W. Lin, Selective CO oxidation in hydrogen-rich gas over CuO/CeO2 catalysts, Appl. Surf. Sci. 253(5) (2006) 2893–2898, doi: 10.1016/j.apsusc.2006.06.028. [5] N.K. Soliman Factors affecting CO oxidation reaction over nanosized materials: a review J. Mater. Res. Technol. 8 2 2019 2395 2407 10.1016/j.jmrt.2018.12.012 N.K. Soliman, Factors affecting CO oxidation reaction over nanosized materials: a review, J. Mater. Res. Technol. 8(2) (2019) 2395–2407, doi: 10.1016/j.jmrt.2018.12.012. [6] M. Kampa E. Castanas Human health effects of air pollution Environ. Pollut. 151 2 2008 362 367 10.1016/j.envpol.2007.06.012 M. Kampa, E. Castanas, Human health effects of air pollution, Environ. Pollut. 151(2) (2008) 362–7, doi: 10.1016/j.envpol.2007.06.012. [7] W.F.J. Schmidt T. Hoffmeister S. Haupt N. Wachsmuth D. Schwenke W.C. Byrnes Effects of chronic continuous exposure to low dose carbon monoxide on hemoglobin mass and performance Med. Sci. Sports Exercise 51 6 2019 404 10.1249/01.mss.0000561711.03419.81 W.F.J. Schmidt, T. Hoffmeister, S. Haupt, N. Wachsmuth, D. Schwenke, W.C. Byrnes, Effects of chronic continuous exposure to low dose carbon monoxide on hemoglobin mass and performance, Med. Sci. Sports Exercise 51(6) (2019) 404, doi: 10.1249/01.mss.0000561711.03419.81. [8] W. Yang J. Ren H. Zhang J. Li C. Wu I.D. Gates Z. Gao Single-atom iron as a promising low-temperature catalyst for selective catalytic reduction of NOx with NH3: a theoretical prediction Fuel 302 2021 121041 10.1016/j.fuel.2021.121041 W. Yang, J. Ren, H. Zhang, J. Li, C. Wu, I.D. Gates, Z. Gao, Single-atom iron as a promising low-temperature catalyst for selective catalytic reduction of NOx with NH3: a theoretical prediction, Fuel 302 (2021) 121041, doi: 10.1016/j.fuel.2021.121041. [9] V. Nagarajan R. Chandiramouli Investigation on adsorption properties of CO and NO gas molecules on aluminene nanosheet: a density functional application Mater. Sci. Eng., B 229 2018 193 200 10.1016/j.mseb.2017.12.015 V. Nagarajan, R. Chandiramouli, Investigation on adsorption properties of CO and NO gas molecules on aluminene nanosheet: a density functional application, Mater. Sci. Eng., B 229 (2018) 193–200, doi: 10.1016/j.mseb.2017.12.015. [10] K.R. Abbasi M. Shahbaz J. Zhang M. Irfan R. Alvarado Analyze the environmental sustainability factors of China: the role of fossil fuel energy and renewable energy Renew. Energy 187 2022 390 402 10.1016/j.renene.2022.01.066 K.R. Abbasi, M. Shahbaz, J. Zhang, M. Irfan, R. Alvarado, Analyze the environmental sustainability factors of China: the role of fossil fuel energy and renewable energy, Renew. Energy 187 (2022) 390–402, doi: 10.1016/j.renene.2022.01.066. [11] L. Xu J. Zeng Q. Li T. Chen K.-W. Luo X. Luo B. Peng Z. Ma L.-L. Wang X. Zhu S. Huang D. Liu S.X. Xiong C. Shuai Insight into enhanced visible-light photocatalytic activity of SWCNTs/g-C3N4 nanocomposites from first principles Appl. Surf. Sci. 530 2020 147181 10.1016/j.apsusc.2020.147181 L. Xu, J. Zeng, Q. Li, T. Chen, K.-W. Luo, X. Luo, B. Peng, Z. Ma, L.-L. Wang, X. Zhu, S. Huang, D. Liu, S.X. Xiong, C. Shuai, Insight into enhanced visible-light photocatalytic activity of SWCNTs/g-C3N4 nanocomposites from first principles, Appl. Surf. Sci. 530 (2020) 147181, doi: 10.1016/j.apsusc.2020.147181. [12] L. Xu J. Zeng Q. Li L. Xia X. Luo Z. Ma B. Peng S.X. Xiong Z. Li L.-L. Wang Y. Lei Defect-engineered 2D/2D hBN/g-C3N4 Z-scheme heterojunctions with full visible-light absorption: efficient metal-free photocatalysts for hydrogen evolution Appl. Surf. Sci. 547 2021 149207 10.1016/j.apsusc.2021.149207 L. Xu, J. Zeng, Q. Li, L. Xia, X. Luo, Z. Ma, B. Peng, S.X. Xiong, Z. Li, L.-L. Wang, Y. Lei, Defect-engineered 2D/2D hBN/g-C3N4 Z-scheme heterojunctions with full visible-light absorption: efficient metal-free photocatalysts for hydrogen evolution, Appl. Surf. Sci. 547 (2021) 149207, doi: 10.1016/j.apsusc.2021.149207. [13] Q. Li Y. Wang J. Zeng Q. Wu Q. Wang L. Sun L. Xu T. Ye X. Zhao L. Chen Z. Chen L. Chen Y. Lei Phosphating-induced charge transfer on CoO/CoP interface for alkaline H2 evolution Chin. Chem. Lett. 32 11 2021 3355 3358 10.1016/j.cclet.2021.03.063 Q. Li, Y. Wang, J. Zeng, Q. Wu, Q. Wang, L. Sun, L. Xu, T. Ye, X. Zhao, L. Chen, Z. Chen, L. Chen, Y. Lei, Phosphating-induced charge transfer on CoO/CoP interface for alkaline H2 evolution, Chin. Chem. Lett. 32(11) (2021) 3355–3358, doi: 10.1016/j.cclet.2021.03.063. [14] X. Huang L. Xu H. Li S. Tang Z. Ma J. Zeng F. Xiong Z. Li L.-L. Wang Two-dimensional PtSe2/hBN vdW heterojunction as photoelectrocatalyst for the solar-driven oxygen evolution reaction: a first principles study Appl. Surf. Sci. 570 2021 151207 10.1016/j.apsusc.2021.151207 X. Huang, L. Xu, H. Li, S. Tang, Z. Ma, J. Zeng, F. Xiong, Z. Li, L.-L. Wang, Two-dimensional PtSe2/hBN vdW heterojunction as photoelectrocatalyst for the solar-driven oxygen evolution reaction: a first principles study, Appl. Surf. Sci. 570 (2021) 151207, doi: 10.1016/j.apsusc.2021.151207. [15] X. Luo Y. Zhou Y. Cai Z. Cheng Z. Liu W. Wan A review of perfect absorbers based on the two dimensional materials in the visible and near-infrared regimes J. Phys. D 55 9 2021 093002 10.1088/1361-6463/ac3034 X. Luo, Y. Zhou, Y. Cai, Z. Cheng, Z. Liu, W. Wan, A review of perfect absorbers based on the two dimensional materials in the visible and near-infrared regimes, J. Phys. D 55(9) (2021) 093002, doi: 10.1088/1361-6463/ac3034. [16] L. Xu L.-M. Yang E. Ganz Mn–graphene single-atom catalyst evaluated for CO oxidation by computational screening Theor. Chem. Acc. 137 7 2018 98 10.1007/s00214-018-2270-8 L. Xu, L.-M. Yang, E. Ganz, Mn–graphene single-atom catalyst evaluated for CO oxidation by computational screening, Theor. Chem. Acc. 137(7) (2018) 98, doi: 10.1007/s00214-018-2270-8. [17] A. Joshi Review of vehicle engine efficiency and emissions SAE Int. J. Adv. Curr. Prac. Mobil. 2 5 2020 2479 2507 10.4271/2020-01-0352 A. Joshi, Review of vehicle engine efficiency and emissions, SAE Int. J. Adv. Curr. Prac. Mobil. 2(5) (2020) 2479–2507, doi: 10.4271/2020-01-0352. [18] 2017 Outlook for Energy: a View to 2040 (Exxon Mobil Corporation, 2017). [19] A. Beniya S. Higashi Towards dense single-atom catalysts for future automotive applications Nat. Catal. 2 7 2019 590 602 10.1038/s41929-019-0282-y A. Beniya, S. Higashi, Towards dense single-atom catalysts for future automotive applications, Nat. Catal. 2(7) (2019) 590–602, doi: 10.1038/s41929-019-0282-y. [20] X.-Q. Gong Z.-P. Liu R. Raval P. Hu A systematic study of CO oxidation on metals and metal oxides: Density functional theory calculations J. Am. Chem. Soc. 126 1 2004 8 9 10.1021/ja030392k X.-Q. Gong, Z.-P. Liu, R. Raval, P. Hu, A systematic study of CO oxidation on metals and metal oxides: Density functional theory calculations, J. Am. Chem. Soc. 126(1) (2004) 8–9, doi: 10.1021/ja030392k. [21] H. Cui Z. Liu P. Jia Pd-doped C3N monolayer: a promising low-temperature and high-activity single-atom catalyst for CO oxidation Appl. Surf. Sci. 537 2021 147881 10.1016/j.apsusc.2020.147881 H. Cui, Z. Liu, P. Jia, Pd-doped C3N monolayer: a promising low-temperature and high-activity single-atom catalyst for CO oxidation, Appl. Surf. Sci. 537 (2021) 147881, doi: 10.1016/j.apsusc.2020.147881. [22] K. Mao L. Li W. Zhang Y. Pei X.C. Zeng X. Wu J. Yang A theoretical study of single-atom catalysis of CO oxidation using Au embedded 2D h-BN monolayer: a CO-promoted O2 activation Sci. Rep. 4 1 2014 5441 10.1038/srep05441 K. Mao, L. Li, W. Zhang, Y. Pei, X.C. Zeng, X. Wu, J. Yang, A theoretical study of single-atom catalysis of CO oxidation using Au embedded 2D h-BN monolayer: a CO-promoted O2 activation, Sci. Rep. 4(1) (2014) 5441, doi: 10.1038/srep05441. [23] Y. Lou Y. Cai W. Hu L. Wang Q. Dai W. Zhan Y. Guo P. Hu X.-M. Cao J. Liu Y. Guo Identification of active area as active center for CO oxidation over single Au atom catalyst ACS Catal 10 11 2020 6094 6101 10.1021/acscatal.0c01303 Y. Lou, Y. Cai, W. Hu, L. Wang, Q. Dai, W. Zhan, Y. Guo, P. Hu, X.-M. Cao, J. Liu, Y. Guo, Identification of active area as active center for CO oxidation over single Au atom catalyst, ACS Catal. 10(11) (2020) 6094–6101, doi: 10.1021/acscatal.0c01303. [24] L. Nie D. Mei H. Xiong B. Peng Z. Ren X.I.P. Hernandez A. DeLaRiva M. Wang M.H. Engelhard L. Kovarik A.K. Datye Y. Wang Activation of surface lattice oxygen in single-atom Pt/CeO2 for low-temperature CO oxidation (vol 363, eaaw5872, 2019) Science 363 6425 2019 1419 1423 10.1126/science.aaw5872 L. Nie, D. Mei, H. Xiong, B. Peng, Z. Ren, X.I.P. Hernandez, A. DeLaRiva, M. Wang, M.H. Engelhard, L. Kovarik, A.K. Datye, Y. Wang, Activation of surface lattice oxygen in single-atom Pt/CeO2 for low-temperature CO oxidation (vol 363, eaaw5872, 2019), Science 363(6425) (2019) 1419–1423, doi: 10.1126/science.aaw5872. [25] Y. Chen Y. Feng L. Li J. Liu X. Pan W. Liu F. Wei Y. Cui B. Qiao X. Sun X. Li J. Lin S. Lin X. Wang T. Zhang Identification of active sites on high-performance Pt/Al2O3 catalyst for cryogenic CO oxidation ACS Catal. 10 15 2020 8815 8824 10.1021/acscatal.0c02253 Y. Chen, Y. Feng, L. Li, J. Liu, X. Pan, W. Liu, F. Wei, Y. Cui, B. Qiao, X. Sun, X. Li, J. Lin, S. Lin, X. Wang, T. Zhang, Identification of active sites on high-performance Pt/Al2O3 catalyst for cryogenic CO oxidation, ACS Catal.. 10(15) (2020) 8815–8824, doi: 10.1021/acscatal.0c02253. [26] C. Huang X. Ye C. Chen S. Lin D. Xie A computational investigation of CO oxidation on ruthenium-embedded hexagonal boron nitride nanosheet Comput. Theor. Chem. 1011 2013 5 10 10.1016/j.comptc.2013.02.004 C. Huang, X. Ye, C. Chen, S. Lin, D. Xie, A computational investigation of CO oxidation on ruthenium-embedded hexagonal boron nitride nanosheet, Comput. Theor. Chem. 1011 (2013) 5–10, doi: 10.1016/j.comptc.2013.02.004. [27] B.B. Sarma P.N. Plessow G. Agostini P. Concepción N. Pfänder L. Kang F.R. Wang F. Studt G. Prieto Metal-specific reactivity in single-atom catalysts: CO oxidation on 4d and 5d transition metals atomically dispersed on MgO J. Am. Chem. Soc. 142 35 2020 14890 14902 10.1021/jacs.0c03627 B.B. Sarma, P.N. Plessow, G. Agostini, P. Concepción, N. Pfänder, L. Kang, F.R. Wang, F. Studt, G. Prieto, Metal-specific reactivity in single-atom catalysts: CO oxidation on 4d and 5d transition metals atomically dispersed on MgO, J. Am. Chem. Soc. 142(35) (2020) 14890–14902, doi: 10.1021/jacs.0c03627. [28] H. Cui G. Zhang X. Zhang J. Tang Rh-doped MoSe2 as a toxic gas scavenger: a first-principles study Nanoscale Adv 1 2 2019 772 780 10.1039/C8NA00233A H. Cui, G. Zhang, X. Zhang, J. Tang, Rh-doped MoSe2 as a toxic gas scavenger: a first-principles study, Nanoscale Adv. 1(2) (2019) 772–780, doi: 10.1039/C8NA00233A. [29] B. Han R. Lang H. Tang J. Xu X.-K. Gu B. Qiao J. Liu Superior activity of Rh1/ZnO single-atom catalyst for CO oxidation Chin. J. Catal. 40 12 2019 1847 1853 10.1016/S1872-2067(19)63411-X B. Han, R. Lang, H. Tang, J. Xu, X.-K. Gu, B. Qiao, J. Liu, Superior activity of Rh1/ZnO single-atom catalyst for CO oxidation, Chin. J. Catal. 40(12) (2019) 1847–1853, doi: 10.1016/S1872-2067(19)63411-X. [30] K. Judai S. Abbet A.S. Worz U. Heiz C.R. Henry Low-temperature cluster catalysis J. Am. Chem. Soc. 126 9 2004 2732 2737 10.1021/ja039037k K. Judai, S. Abbet, A.S. Worz, U. Heiz, C.R. Henry, Low-temperature cluster catalysis, J. Am. Chem. Soc. 126(9) (2004) 2732–2737, doi: 10.1021/ja039037k. [31] S. Wang J. Li Q. Li X. Bai J. Wang Metal single-atom coordinated graphitic carbon nitride as an efficient catalyst for CO oxidation Nanoscale 12 1 2020 364 371 10.1039/C9NR07726J S. Wang, J. Li, Q. Li, X. Bai, J. Wang, Metal single-atom coordinated graphitic carbon nitride as an efficient catalyst for CO oxidation, Nanoscale 12(1) (2020) 364–371, doi: 10.1039/C9NR07726J. [32] S. Ji Y. Chen X. Wang Z. Zhang D. Wang Y. Li Chemical synthesis of single atomic site catalysts Chem. Rev. 120 21 2020 11900 11955 10.1021/acs.chemrev.9b00818 S. Ji, Y. Chen, X. Wang, Z. Zhang, D. Wang, Y. Li, Chemical synthesis of single atomic site catalysts, Chem. Rev. 120(21) (2020) 11900–11955, doi: 10.1021/acs.chemrev.9b00818. [33] H.T. Chung D.A. Cullen D. Higgins B.T. Sneed E.F. Holby K.L. More P. Zelenay Direct atomic-level insight into the active sites of a high-performance PGM-free ORR catalyst Science 357 6350 2017 479 483 10.1126/science.aan2255 H.T. Chung, D.A. Cullen, D. Higgins, B.T. Sneed, E.F. Holby, K.L. More, P. Zelenay, Direct atomic-level insight into the active sites of a high-performance PGM-free ORR catalyst, Science 357(6350) (2017) 479–483, doi: 10.1126/science.aan2255. [34] M. Meier J. Hulva Z. Jakub F. Kraushofer M. Bobic R. Bliem M. Setvin M. Schmid U. Diebold C. Franchini G.S. Parkinson CO oxidation by Pt-2/Fe3O4: metastable dimer and support configurations facilitate lattice oxygen extraction Sci. Adv. 8 13 2022 eabn4580 10.1126/sciadv.abn4580 M. Meier, J. Hulva, Z. Jakub, F. Kraushofer, M. Bobic, R. Bliem, M. Setvin, M. Schmid, U. Diebold, C. Franchini, G.S. Parkinson, CO oxidation by Pt-2/Fe3O4: metastable dimer and support configurations facilitate lattice oxygen extraction, Sci. Adv. 8(13) (2022) eabn4580, doi: 10.1126/sciadv.abn4580. [35] E.H. Song Z. Wen Q. Jiang CO catalytic oxidation on copper-embedded graphene J. Phys. Chem. C 115 9 2011 3678 3683 10.1021/jp108978c E.H. Song, Z. Wen, Q. Jiang, CO catalytic oxidation on copper-embedded graphene, J. Phys. Chem. C 115(9) (2011) 3678–3683, doi: 10.1021/jp108978c. [36] Z. Liang W. Qin C. Dong Experimental and theoretical study of the interactions between Fe2O3/Al2O3 and CO Energies 10 5 2017 598 10.3390/en10050598 Z. Liang, W. Qin, C. Dong, Experimental and theoretical study of the interactions between Fe2O3/Al2O3 and CO, Energies 10(5) (2017) 598, doi: 10.3390/en10050598. [37] D.A. Ligthart R.A. van Santen E.J. Hensen Supported rhodium oxide nanoparticles as highly active CO oxidation catalysts Angew. Chem. Int. Ed. 50 23 2011 5306 5310 10.1002/anie.201100190 D.A. Ligthart, R.A. van Santen, E.J. Hensen, Supported rhodium oxide nanoparticles as highly active CO oxidation catalysts, Angew. Chem. Int. Ed. 50(23) (2011) 5306–10, doi: 10.1002/anie.201100190. [38] C. Guo S. Wei S. Zhou T. Zhang Z. Wang S.-P. Ng X. Lu C.-M.L. Wu W. Guo Initial reduction of CO2 on Pd-, Ru-, and Cu-doped CeO2(111) surfaces: effects of surface modification on catalytic activity and selectivity ACS Appl. Mater. Interfaces 9 31 2017 26107 26117 10.1021/acsami.7b07945 C. Guo, S. Wei, S. Zhou, T. Zhang, Z. Wang, S.-P. Ng, X. Lu, C.-M.L. Wu, W. Guo, Initial reduction of CO2 on Pd-, Ru-, and Cu-doped CeO2(111) surfaces: effects of surface modification on catalytic activity and selectivity, ACS Appl. Mater. Interfaces 9(31) (2017) 26107–26117, doi: 10.1021/acsami.7b07945. [39] R. Krishnan W.-S. Su H.-T. Chen A new carbon allotrope: penta-graphene as a metal-free catalyst for CO oxidation Carbon 114 2017 465 472 10.1016/j.carbon.2016.12.054 R. Krishnan, W.-S. Su, H.-T. Chen, A new carbon allotrope: penta-graphene as a metal-free catalyst for CO oxidation, Carbon 114 (2017) 465–472, doi: 10.1016/j.carbon.2016.12.054. [40] A. Tripathi R. Thapa Promoting reactivity of graphene based catalysts to achieve LH mechanism for CO oxidation Catal. Today 370 2021 142 150 10.1016/j.cattod.2020.12.019 A. Tripathi, R. Thapa, Promoting reactivity of graphene based catalysts to achieve LH mechanism for CO oxidation, Catal. Today 370 (2021) 142–150, doi: 10.1016/j.cattod.2020.12.019. [41] S. Lin X. Ye R.S. Johnson H. Guo First-principles investigations of metal (Cu, Ag, Au, Pt, Rh, Pd, Fe, Co, and Ir) doped hexagonal boron nitride nanosheets: stability and catalysis of CO oxidation J. Phys. Chem. C 117 33 2013 17319 17326 10.1021/jp4055445 S. Lin, X. Ye, R.S. Johnson, H. Guo, First-principles investigations of metal (Cu, Ag, Au, Pt, Rh, Pd, Fe, Co, and Ir) doped hexagonal boron nitride nanosheets: stability and catalysis of CO oxidation, J. Phys. Chem. C 117(33) (2013) 17319–17326, doi: 10.1021/jp4055445. [42] D. Ma Y. Tang G. Yang J. Zeng C. He Z. Lu CO catalytic oxidation on iron-embedded monolayer MoS2 Appl. Surf. Sci. 328 2015 71 77 10.1016/j.apsusc.2014.12.024 D. Ma, Y. Tang, G. Yang, J. Zeng, C. He, Z. Lu, CO catalytic oxidation on iron-embedded monolayer MoS2, Appl. Surf. Sci. 328 (2015) 71–77, doi: 10.1016/j.apsusc.2014.12.024. [43] X. Wang S. Blechert M. Antonietti Polymeric graphitic carbon nitride for heterogeneous photocatalysis ACS Catal 2 8 2012 1596 1606 10.1021/cs300240x X. Wang, S. Blechert, M. Antonietti, Polymeric graphitic carbon nitride for heterogeneous photocatalysis, ACS Catal. 2(8) (2012) 1596–1606, doi: 10.1021/cs300240x. [44] H. Zhang X. Zuo H. Tang G. Li Z. Zhou Origin of photoactivity in graphitic carbon nitride and strategies for enhancement of photocatalytic efficiency: insights from first-principles computations Phys. Chem. Chem. Phys. 17 9 2015 6280 6288 10.1039/C4CP05288A H. Zhang, X. Zuo, H. Tang, G. Li, Z. Zhou, Origin of photoactivity in graphitic carbon nitride and strategies for enhancement of photocatalytic efficiency: insights from first-principles computations, Phys. Chem. Chem. Phys. 17(9) (2015) 6280–6288, doi: 10.1039/C4CP05288A. [45] K. Zhang L. Wang X. Sheng M. Ma M.S. Jung W. Kim H. Lee J.H. Park Tunable bandgap energy and promotion of H2O2 oxidation for overall water splitting from carbon nitride nanowire bundles Adv. Energy Mater. 6 11 2016 10682 10690 10.1002/aenm.201502352 K. Zhang, L. Wang, X. Sheng, M. Ma, M.S. Jung, W. Kim, H. Lee, J.H. Park, Tunable bandgap energy and promotion of H2O2 oxidation for overall water splitting from carbon nitride nanowire bundles, Adv. Energy Mater. 6(11) (2016) 10682–10690, doi: 10.1002/aenm.201502352. [46] W. Cui J. Li F. Dong Y. Sun G. Jiang W. Cen S.C. Lee Z. Wu Highly efficient performance and conversion pathway of photocatalytic NO oxidation on SrO-clusters@amorphous carbon nitride Environ. Sci. Technol. 51 18 2017 10682 10690 10.1021/acs.est.7b00974 W. Cui, J. Li, F. Dong, Y. Sun, G. Jiang, W. Cen, S.C. Lee, Z. Wu, Highly efficient performance and conversion pathway of photocatalytic NO oxidation on SrO-clusters@amorphous carbon nitride, Environ. Sci. Technol. 51(18) (2017) 10682–10690, doi: 10.1021/acs.est.7b00974. [47] P. Luan Y. Zhang X. Zhang Z. Li R. Prathapan U. Bach J. Zhang Bismuth vanadate with electrostatically anchored 3D carbon nitride nano-networks as efficient photoanodes for water oxidation ChemSusChem 11 15 2018 2510 2516 10.1002/cssc.201801119 P. Luan, Y. Zhang, X. Zhang, Z. Li, R. Prathapan, U. Bach, J. Zhang, Bismuth vanadate with electrostatically anchored 3D carbon nitride nano-networks as efficient photoanodes for water oxidation, ChemSusChem 11(15) (2018) 2510–2516, doi: 10.1002/cssc.201801119. [48] Q.G. Jiang Z.M. Ao S. Li Z. Wen Density functional theory calculations on the CO catalytic oxidation on Al-embedded graphene RSC Adv. 4 39 2014 20290 20296 10.1039/c4ra01908c Q.G. Jiang, Z.M. Ao, S. Li, Z. Wen, Density functional theory calculations on the CO catalytic oxidation on Al-embedded graphene, RSC Adv. 4(39) (2014) 20290–20296, doi: 10.1039/c4ra01908c. [49] Y.-H. Lu M. Zhou C. Zhang Y.-P. Feng Metal-embedded graphene: a possible catalyst with high activity J. Phys. Chem. C 113 47 2009 20156 20160 10.1021/jp908829m Y.-H. Lu, M. Zhou, C. Zhang, Y.-P. Feng, Metal-embedded graphene: a possible catalyst with high activity, J. Phys. Chem. C 113(47) (2009) 20156–20160, doi: 10.1021/jp908829m. [50] Y. Li Z. Zhou G. Yu W. Chen Z. Chen CO catalytic oxidation on iron-embedded graphene: computational quest for low-cost nanocatalysts J. Phys. Chem. C 114 14 2010 6250 6254 10.1021/jp911535v Y. Li, Z. Zhou, G. Yu, W. Chen, Z. Chen, CO catalytic oxidation on iron-embedded graphene: computational quest for low-cost nanocatalysts, J. Phys. Chem. C 114(14) (2010) 6250–6254, doi: 10.1021/jp911535v. [51] M.D. Esrafili S. Asadollahi Exploring different reaction mechanisms for oxidation of CO over a single Pd atom incorporated nitrogen-doped graphene: a DFT study Appl. Surf. Sci. 463 2019 526 534 10.1016/j.apsusc.2018.08.249 M.D. Esrafili, S. Asadollahi, Exploring different reaction mechanisms for oxidation of CO over a single Pd atom incorporated nitrogen-doped graphene: a DFT study, Appl. Surf. Sci. 463 (2019) 526–534, doi: 10.1016/j.apsusc.2018.08.249. [52] T. Kropp M. Mavrikakis Transition metal atoms embedded in graphene: how nitrogen doping increases CO oxidation activity ACS Catal. 9 8 2019 6864 6868 10.1021/acscatal.9b01944 T. Kropp, M. Mavrikakis, Transition metal atoms embedded in graphene: how nitrogen doping increases CO oxidation activity, ACS Catal. 9(8) (2019) 6864–6868, doi: 10.1021/acscatal.9b01944. [53] Y. Pan Y. Chen K. Wu Z. Chen S. Liu X. Cao W.-C. Cheong T. Meng J. Luo L. Zheng C. Liu D. Wang Q. Peng J. Li C. Chen Regulating the coordination structure of single-atom Fe-NxCy catalytic sites for benzene oxidation Nat. Commun. 10 1 2019 4290 10.1038/s41467-019-12362-8 Y. Pan, Y. Chen, K. Wu, Z. Chen, S. Liu, X. Cao, W.-C. Cheong, T. Meng, J. Luo, L. Zheng, C. Liu, D. Wang, Q. Peng, J. Li, C. Chen, Regulating the coordination structure of single-atom Fe-NxCy catalytic sites for benzene oxidation, Nat. Commun. 10(1) (2019) 4290, doi: 10.1038/s41467-019-12362-8. [54] L. Wang C. Zhu M. Xu C. Zhao J. Gu L. Cao X. Zhang Z. Sun S. Wei W. Zhou W.-X. Li J. Lu Boosting activity and stability of metal single-atom catalysts via regulation of coordination number and local composition J. Am. Chem. Soc. 143 45 2021 18854 18858 10.1021/jacs.1c09498 L. Wang, C. Zhu, M. Xu, C. Zhao, J. Gu, L. Cao, X. Zhang, Z. Sun, S. Wei, W. Zhou, W.-X. Li, J. Lu, Boosting activity and stability of metal single-atom catalysts via regulation of coordination number and local composition, J. Am. Chem. Soc. 143(45) (2021) 18854–18858, doi: 10.1021/jacs.1c09498. [55] R. Krishnan S.-Y. Wu H.-T. Chen Nitrogen-doped penta-graphene as a superior catalytic activity for CO oxidation Carbon 132 2018 257 262 10.1016/j.carbon.2018.02.064 R. Krishnan, S.-Y. Wu, H.-T. Chen, Nitrogen-doped penta-graphene as a superior catalytic activity for CO oxidation, Carbon 132 (2018) 257–262, doi: 10.1016/j.carbon.2018.02.064. [56] B. Delley From molecules to solids with the DMol(3) approach J. Chem. Phys. 113 18 2000 7756 7764 10.1063/1.1316015 B. Delley, From molecules to solids with the DMol(3) approach, J. Chem. Phys. 113(18) (2000) 7756–7764, doi: 10.1063/1.1316015. [57] B. Delley An all-electron numerical-method for solving the local density functional for polyatomic-molecules J. Chem. Phys. 92 1 1990 508 517 10.1063/1.458452 B. Delley, An all-electron numerical-method for solving the local density functional for polyatomic-molecules, J. Chem. Phys. 92(1) (1990) 508–517, doi: 10.1063/1.458452. [58] G. Kresse J. Furthmuller Efficient iterative schemes for ab initio total-energy calculations using a plane-wave basis set Phys. Rev. B 54 16 1996 11169 11186 10.1103/PhysRevB.54.11169 G. Kresse, J. Furthmuller, Efficient iterative schemes for ab initio total-energy calculations using a plane-wave basis set, Phys. Rev. B 54(16) (1996) 11169–11186, doi: 10.1103/PhysRevB.54.11169. [59] J.P. Perdew K. Burke M. Ernzerhof Generalized gradient approximation made simple (vol 77, pg 3865, 1996) Phys. Rev. Lett. 78 7 1997 1396 10.1103/PhysRevLett.78.1396 J.P. Perdew, K. Burke, M. Ernzerhof, Generalized gradient approximation made simple (vol 77, pg 3865, 1996), Phys. Rev. Lett. 78(7) (1997) 1396, doi: 10.1103/PhysRevLett.78.1396. [60] V.A. Basiuk L.V. Henao-Holguin Dispersion-corrected density functional theory calculations of meso-tetraphenylporphine-C-60 complex by using DMol3 module J. Comput. Theor. Nanosci. 11 7 2014 1609 1615 10.1166/jctn.2014.3539 V.A. Basiuk, L.V. Henao-Holguin, Dispersion-corrected density functional theory calculations of meso-tetraphenylporphine-C-60 complex by using DMol3 module, J. Comput. Theor. Nanosci. 11(7) (2014) 1609–1615, doi: 10.1166/jctn.2014.3539. [61] G. Kresse D. Joubert From ultrasoft pseudopotentials to the projector augmented-wave method Phys. Rev. B 59 3 1999 1758 1775 10.1103/PhysRevB.59.1758 G. Kresse, D. Joubert, From ultrasoft pseudopotentials to the projector augmented-wave method, Phys. Rev. B 59(3) (1999) 1758–1775, doi: 10.1103/PhysRevB.59.1758. [62] J. Huang C. Zhou Z. Chu X. Liu X. Duan Single transition metal anchored C(9)N(4) sheets as an efficient catalyst for CO oxidation: a first-principles study Phys. Chem. Chem. Phys. 23 3 2021 1868 1873 10.1039/d0cp05306f J. Huang, C. Zhou, Z. Chu, X. Liu, X. Duan, Single transition metal anchored C(9)N(4) sheets as an efficient catalyst for CO oxidation: a first-principles study, Phys. Chem. Chem. Phys. 23(3) (2021) 1868–1873, doi: 10.1039/d0cp05306f. [63] M. Liu C. Liu S. Gouse Peera T. Liang Catalytic oxidation mechanism of CO on FeN2-doped graphene Chem. Phys. 559 2022 111536 10.1016/j.chemphys.2022.111536 M. Liu, C. Liu, S. Gouse Peera, T. Liang, Catalytic oxidation mechanism of CO on FeN2-doped graphene, Chem. Phys. 559 (2022) 111536, doi: 10.1016/j.chemphys.2022.111536. [64] M. Luo Z. Liang C. Liu X. Qi M. Chen H. Yang T. Liang Density functional study on the CO oxidation reaction mechanism on MnN2-doped graphene RSC Adv. 10 46 2020 27856 27863 10.1039/D0RA05287F M. Luo, Z. Liang, C. Liu, X. Qi, M. Chen, H. Yang, T. Liang, Density functional study on the CO oxidation reaction mechanism on MnN2-doped graphene, RSC Adv.. 10(46) (2020) 27856–27863, doi: 10.1039/D0RA05287F. [65] M. Luo Z. Liang M. Chen C. Liu X. Qi S.G. Peera J. Liu T. Liang Theoretical investigation on catalytic mechanisms of oxygen reduction and carbon monoxide oxidation on the MnNx system New J. Chem. 44 36 2020 15724 15732 10.1039/D0NJ03756G M. Luo, Z. Liang, M. Chen, C. Liu, X. Qi, S.G. Peera, J. Liu, T. Liang, Theoretical investigation on catalytic mechanisms of oxygen reduction and carbon monoxide oxidation on the MnNx system, New J. Chem. 44(36) (2020) 15724–15732, doi: 10.1039/D0NJ03756G. [66] L.E. Fernández A.C.G. Marigliano E.L. Varetti The vibrational properties of formic acid as monomer and dimer: a DFT study Vib. Spectrosc. 37 2 2005 179 187 10.1016/j.vibspec.2004.09.001 L.E. Fernández, A.C.G. Marigliano, E.L. Varetti, The vibrational properties of formic acid as monomer and dimer: a DFT study, Vib. Spectrosc. 37(2) (2005) 179–187, doi: 10.1016/j.vibspec.2004.09.001. [67] M. Liu C. Liu M. Luo S.G. Peera T. Liang Theoretical study on iron and nitrogen co-doped graphene catalyzes CO oxidation Mol. Catal. 509 2021 111624 10.1016/j.mcat.2021.111624 M. Liu, C. Liu, M. Luo, S.G. Peera, T. Liang, Theoretical study on iron and nitrogen co-doped graphene catalyzes CO oxidation, Mol. Catal. 509 (2021) 111624, doi: 10.1016/j.mcat.2021.111624. [68] L. Gao F. Wang M.-a. Yu F. Wei J. Qi S. Lin D. Xie A novel phosphotungstic acid-supported single metal atom catalyst with high activity and selectivity for the synthesis of NH3 from electrochemical N2 reduction: a DFT prediction J. Mater. Chem. A 7 34 2019 19838 19845 10.1039/c9ta06470b L. Gao, F. Wang, M.-a. Yu, F. Wei, J. Qi, S. Lin, D. Xie, A novel phosphotungstic acid-supported single metal atom catalyst with high activity and selectivity for the synthesis of NH3 from electrochemical N2 reduction: a DFT prediction, J. Mater. Chem. A 7(34) (2019) 19838–19845, doi: 10.1039/c9ta06470b. [69] X. Bai E. Zhao W. Wang Y. Wang K. Li L. Lin J. Yang H. Sun Z. Wu A direct four-electron process on Fe–N3 doped graphene for the oxygen reduction reaction: a theoretical perspective RSC Adv. 7 38 2017 23812 23819 10.1039/c7ra03157b X. Bai, E. Zhao, W. Wang, Y. Wang, K. Li, L. Lin, J. Yang, H. Sun, Z. Wu, A direct four-electron process on Fe–N3 doped graphene for the oxygen reduction reaction: a theoretical perspective, RSC Adv. 7(38) (2017) 23812–23819, doi: 10.1039/c7ra03157b. [70] Y. Shi S. Ruan K. Xu C. He C. Qin L. Zhang Theoretical investigation of chemical reaction kinetics of CO catalytic combustion over NiNx-Gr Colloids Surf., A 653 2022 129962 10.1016/j.colsurfa.2022.129962 Y. Shi, S. Ruan, K. Xu, C. He, C. Qin, L. Zhang, Theoretical investigation of chemical reaction kinetics of CO catalytic combustion over NiNx-Gr, Colloids Surf., A 653 (2022) 129962, doi: 10.1016/j.colsurfa.2022.129962. [71] Y. Tang J. Zhou Z. Shen W. Chen C. Li X. Dai High catalytic activity for CO oxidation on single Fe atom stabilized in graphene vacancies RSC Adv. 6 96 2016 93985 93996 10.1039/c6ra14476d Y. Tang, J. Zhou, Z. Shen, W. Chen, C. Li, X. Dai, High catalytic activity for CO oxidation on single Fe atom stabilized in graphene vacancies, RSC Adv. 6(96) (2016) 93985–93996, doi: 10.1039/c6ra14476d. [72] Q. Jiang J. Zhang H. Huang Y. Wu Z. Ao A novel single-atom catalyst for CO oxidation in humid environmental conditions: ni-embedded divacancy graphene J. Mater. Chem. A 8 1 2020 287 295 10.1039/C9TA08525D Q. Jiang, J. Zhang, H. Huang, Y. Wu, Z. Ao, A novel single-atom catalyst for CO oxidation in humid environmental conditions: ni-embedded divacancy graphene, J. Mater. Chem. A 8(1) (2020) 287–295, doi: 10.1039/C9TA08525D. [73] G. Xu R. Wang F. Yang D. Ma Z. Yang Z. Lu CO oxidation on single Pd atom embedded defect-graphene via a new termolecular Eley–Rideal mechanism Carbon 118 2017 35 42 10.1016/j.carbon.2017.03.034 G. Xu, R. Wang, F. Yang, D. Ma, Z. Yang, Z. Lu, CO oxidation on single Pd atom embedded defect-graphene via a new termolecular Eley–Rideal mechanism, Carbon 118 (2017) 35–42, doi: 10.1016/j.carbon.2017.03.034. [74] Y.-C. Rao X.-M. Duan Pd/Pt embedded CN monolayers as efficient catalysts for CO oxidation Phys. Chem. Chem. Phys. 21 46 2019 25743 25748 10.1039/C9CP04636D Y.-C. Rao, X.-M. Duan, Pd/Pt embedded CN monolayers as efficient catalysts for CO oxidation, Phys. Chem. Chem. Phys. 21(46) (2019) 25743–25748, doi: 10.1039/C9CP04636D. [75] Y. Bai W. Zhang Z. Zhang J. Zhou X. Wang C. Wang W. Huang J. Jiang Y. Xiong Controllably interfacing with metal: a strategy for enhancing CO oxidation on oxide catalysts by surface polarization J. Am. Chem. Soc. 136 42 2014 14650 14653 10.1021/ja506269y Y. Bai, W. Zhang, Z. Zhang, J. Zhou, X. Wang, C. Wang, W. Huang, J. Jiang, Y. Xiong, Controllably interfacing with metal: a strategy for enhancing CO oxidation on oxide catalysts by surface polarization, J. Am. Chem. Soc. 136(42) (2014) 14650–3, doi: 10.1021/ja506269y. [76] L. Li Y.-Z. Wang X.-X. Wang K.-K. Song X.-D. Jian P. Qian Y. Bai Y.-J. Su Size and Stoichiometry Effect of FePt Bimetal Nanoparticle Catalyst for CO Oxidation: a DFT Study J. Phys. Chem. C 124 16 2020 8706 8715 10.1021/acs.jpcc.9b11344 L. Li, Y.-Z. Wang, X.-X. Wang, K.-K. Song, X.-D. Jian, P. Qian, Y. Bai, Y.-J. Su, Size and Stoichiometry Effect of FePt Bimetal Nanoparticle Catalyst for CO Oxidation: a DFT Study, J. Phys. Chem. C 124(16) (2020) 8706–8715, doi: 10.1021/acs.jpcc.9b11344. [77] G. Xu R. Wang Y. Ding Z. Lu D. Ma Z. Yang First-principles study on the single Ir atom embedded graphdiyne: an efficient catalyst for CO oxidation J. Phys. Chem. C 122 41 2018 23481 23492 10.1021/acs.jpcc.8b06739 G. Xu, R. Wang, Y. Ding, Z. Lu, D. Ma, Z. Yang, First-principles study on the single Ir atom embedded graphdiyne: an efficient catalyst for CO oxidation, J. Phys. Chem. C 122(41) (2018) 23481–23492, doi: 10.1021/acs.jpcc.8b06739. [78] S. Kozuch S. Shaik How to conceptualize catalytic cycles? The energetic span model Acc. Chem. Res. 44 2 2011 101 110 10.1021/ar1000956 S. Kozuch, S. Shaik, How to conceptualize catalytic cycles? The energetic span model, Acc. Chem. Res. 44(2) (2011) 101–110, doi: 10.1021/ar1000956.",
      "scopus-id": "85150856997",
      "coredata": {
        "eid": "1-s2.0-S246882312300189X",
        "dc:description": "Harmful carbon monoxide (CO) gas from vehicle exhaust and fossil fuel combustion seriously affects the ecological environment and human health, although this issue can be effectively solved by low-temperature catalytic combustion. Herein, an Fe and N codoped double vacancy graphene catalyst (Fe-CxNy) for the low-temperature catalytic combustion of CO is proposed, and the mechanism of the CO catalytic combustion reaction over the catalyst is systematically investigated by using density function theory (DFT). Four oxidation mechanisms, including Eley–Rideal (ER1 and ER2), Langmuir-Hinshelwood (LH) and Termolecular Eley–Rideal (TER), were compared in terms of oxidation pathways and energy distribution. All the results indicate that Fe-CxNy catalysts have efficient catalytic activity. The Fe-CN3 catalyst with the predominant LH reaction mechanism showed the best performance for the catalytic combustion of CO with only 0.20 eV, which was comparable to that of noble metals. The rate constant calculations further demonstrate that Fe-CN3 exhibits excellent catalytic performance at low temperatures. This work not only provides a theoretical basis for the design and development of low-temperature catalytic combustion CO catalysts, but also provides data support for the kinetic model of CO combustion reaction.",
        "openArchiveArticle": "false",
        "prism:coverDate": "2023-04-15",
        "openaccessUserLicense": null,
        "prism:aggregationType": "Journal",
        "prism:url": "https://api.elsevier.com/content/article/pii/S246882312300189X",
        "dc:creator": [
          {
            "@_fa": "true",
            "$": "Qin, Chunlan"
          },
          {
            "@_fa": "true",
            "$": "Ruan, Shanshan"
          },
          {
            "@_fa": "true",
            "$": "Xu, Kangwei"
          },
          {
            "@_fa": "true",
            "$": "He, Chenliang"
          },
          {
            "@_fa": "true",
            "$": "Shi, Ying"
          },
          {
            "@_fa": "true",
            "$": "Feng, Beibei"
          },
          {
            "@_fa": "true",
            "$": "Zhang, Lidong"
          }
        ],
        "link": [
          {
            "@_fa": "true",
            "@rel": "self",
            "@href": "https://api.elsevier.com/content/article/pii/S246882312300189X"
          },
          {
            "@_fa": "true",
            "@rel": "scidir",
            "@href": "https://www.sciencedirect.com/science/article/pii/S246882312300189X"
          }
        ],
        "dc:format": "application/json",
        "openaccessType": null,
        "pii": "S2468-8231(23)00189-X",
        "prism:volume": "541",
        "articleNumber": "113103",
        "prism:publisher": "Elsevier B.V.",
        "dc:title": "Theoretical study on the reaction kinetics of CO oxidation by nitrogen-doped graphene catalysts with different ligand structures",
        "prism:copyright": "© 2023 Elsevier B.V. All rights reserved.",
        "openaccess": "0",
        "prism:issn": "24688231",
        "dcterms:subject": [
          {
            "@_fa": "true",
            "$": "CO oxidation"
          },
          {
            "@_fa": "true",
            "$": "Nitrogen coordination"
          },
          {
            "@_fa": "true",
            "$": "Graphene"
          },
          {
            "@_fa": "true",
            "$": "Catalytic combustion"
          },
          {
            "@_fa": "true",
            "$": "Single-atom catalyst"
          }
        ],
        "openaccessArticle": "false",
        "prism:publicationName": "Molecular Catalysis",
        "openaccessSponsorType": null,
        "prism:pageRange": "113103",
        "pubType": "fla",
        "prism:coverDisplayDate": "15 April 2023",
        "prism:doi": "10.1016/j.mcat.2023.113103",
        "prism:startingPage": "113103",
        "dc:identifier": "doi:10.1016/j.mcat.2023.113103",
        "openaccessSponsorName": null
      },
      "objects": {
        "object": [
          {
            "@category": "standard",
            "@height": "479",
            "@width": "565",
            "@_fa": "true",
            "$": "https://api.elsevier.com/content/object/eid/1-s2.0-S246882312300189X-gr8.jpg?httpAccept=%2A%2F%2A",
            "@multimediatype": "JPEG image file",
            "@type": "IMAGE-DOWNSAMPLED",
            "@size": "85015",
            "@ref": "gr8",
            "@mimetype": "image/jpeg"
          },
          {
            "@category": "standard",
            "@height": "536",
            "@width": "565",
            "@_fa": "true",
            "$": "https://api.elsevier.com/content/object/eid/1-s2.0-S246882312300189X-gr7.jpg?httpAccept=%2A%2F%2A",
            "@multimediatype": "JPEG image file",
            "@type": "IMAGE-DOWNSAMPLED",
            "@size": "95388",
            "@ref": "gr7",
            "@mimetype": "image/jpeg"
          },
          {
            "@category": "standard",
            "@height": "530",
            "@width": "566",
            "@_fa": "true",
            "$": "https://api.elsevier.com/content/object/eid/1-s2.0-S246882312300189X-gr6.jpg?httpAccept=%2A%2F%2A",
            "@multimediatype": "JPEG image file",
            "@type": "IMAGE-DOWNSAMPLED",
            "@size": "81771",
            "@ref": "gr6",
            "@mimetype": "image/jpeg"
          },
          {
            "@category": "standard",
            "@height": "759",
            "@width": "565",
            "@_fa": "true",
            "$": "https://api.elsevier.com/content/object/eid/1-s2.0-S246882312300189X-gr5.jpg?httpAccept=%2A%2F%2A",
            "@multimediatype": "JPEG image file",
            "@type": "IMAGE-DOWNSAMPLED",
            "@size": "135133",
            "@ref": "gr5",
            "@mimetype": "image/jpeg"
          },
          {
            "@category": "standard",
            "@height": "478",
            "@width": "565",
            "@_fa": "true",
            "$": "https://api.elsevier.com/content/object/eid/1-s2.0-S246882312300189X-gr4.jpg?httpAccept=%2A%2F%2A",
            "@multimediatype": "JPEG image file",
            "@type": "IMAGE-DOWNSAMPLED",
            "@size": "108192",
            "@ref": "gr4",
            "@mimetype": "image/jpeg"
          },
          {
            "@category": "standard",
            "@height": "842",
            "@width": "565",
            "@_fa": "true",
            "$": "https://api.elsevier.com/content/object/eid/1-s2.0-S246882312300189X-gr3.jpg?httpAccept=%2A%2F%2A",
            "@multimediatype": "JPEG image file",
            "@type": "IMAGE-DOWNSAMPLED",
            "@size": "128936",
            "@ref": "gr3",
            "@mimetype": "image/jpeg"
          },
          {
            "@category": "standard",
            "@height": "477",
            "@width": "489",
            "@_fa": "true",
            "$": "https://api.elsevier.com/content/object/eid/1-s2.0-S246882312300189X-gr2.jpg?httpAccept=%2A%2F%2A",
            "@multimediatype": "JPEG image file",
            "@type": "IMAGE-DOWNSAMPLED",
            "@size": "77771",
            "@ref": "gr2",
            "@mimetype": "image/jpeg"
          },
          {
            "@category": "standard",
            "@height": "198",
            "@width": "500",
            "@_fa": "true",
            "$": "https://api.elsevier.com/content/object/eid/1-s2.0-S246882312300189X-ga1.jpg?httpAccept=%2A%2F%2A",
            "@multimediatype": "JPEG image file",
            "@type": "IMAGE-DOWNSAMPLED",
            "@size": "44780",
            "@ref": "ga1",
            "@mimetype": "image/jpeg"
          },
          {
            "@category": "standard",
            "@height": "203",
            "@width": "489",
            "@_fa": "true",
            "$": "https://api.elsevier.com/content/object/eid/1-s2.0-S246882312300189X-gr1.jpg?httpAccept=%2A%2F%2A",
            "@multimediatype": "JPEG image file",
            "@type": "IMAGE-DOWNSAMPLED",
            "@size": "43519",
            "@ref": "gr1",
            "@mimetype": "image/jpeg"
          },
          {
            "@category": "thumbnail",
            "@height": "164",
            "@width": "193",
            "@_fa": "true",
            "$": "https://api.elsevier.com/content/object/eid/1-s2.0-S246882312300189X-gr8.sml?httpAccept=%2A%2F%2A",
            "@multimediatype": "GIF image file",
            "@type": "IMAGE-THUMBNAIL",
            "@size": "12931",
            "@ref": "gr8",
            "@mimetype": "image/gif"
          },
          {
            "@category": "thumbnail",
            "@height": "164",
            "@width": "173",
            "@_fa": "true",
            "$": "https://api.elsevier.com/content/object/eid/1-s2.0-S246882312300189X-gr7.sml?httpAccept=%2A%2F%2A",
            "@multimediatype": "GIF image file",
            "@type": "IMAGE-THUMBNAIL",
            "@size": "12763",
            "@ref": "gr7",
            "@mimetype": "image/gif"
          },
          {
            "@category": "thumbnail",
            "@height": "164",
            "@width": "175",
            "@_fa": "true",
            "$": "https://api.elsevier.com/content/object/eid/1-s2.0-S246882312300189X-gr6.sml?httpAccept=%2A%2F%2A",
            "@multimediatype": "GIF image file",
            "@type": "IMAGE-THUMBNAIL",
            "@size": "11947",
            "@ref": "gr6",
            "@mimetype": "image/gif"
          },
          {
            "@category": "thumbnail",
            "@height": "164",
            "@width": "122",
            "@_fa": "true",
            "$": "https://api.elsevier.com/content/object/eid/1-s2.0-S246882312300189X-gr5.sml?httpAccept=%2A%2F%2A",
            "@multimediatype": "GIF image file",
            "@type": "IMAGE-THUMBNAIL",
            "@size": "11363",
            "@ref": "gr5",
            "@mimetype": "image/gif"
          },
          {
            "@category": "thumbnail",
            "@height": "164",
            "@width": "194",
            "@_fa": "true",
            "$": "https://api.elsevier.com/content/object/eid/1-s2.0-S246882312300189X-gr4.sml?httpAccept=%2A%2F%2A",
            "@multimediatype": "GIF image file",
            "@type": "IMAGE-THUMBNAIL",
            "@size": "15026",
            "@ref": "gr4",
            "@mimetype": "image/gif"
          },
          {
            "@category": "thumbnail",
            "@height": "164",
            "@width": "110",
            "@_fa": "true",
            "$": "https://api.elsevier.com/content/object/eid/1-s2.0-S246882312300189X-gr3.sml?httpAccept=%2A%2F%2A",
            "@multimediatype": "GIF image file",
            "@type": "IMAGE-THUMBNAIL",
            "@size": "11187",
            "@ref": "gr3",
            "@mimetype": "image/gif"
          },
          {
            "@category": "thumbnail",
            "@height": "164",
            "@width": "168",
            "@_fa": "true",
            "$": "https://api.elsevier.com/content/object/eid/1-s2.0-S246882312300189X-gr2.sml?httpAccept=%2A%2F%2A",
            "@multimediatype": "GIF image file",
            "@type": "IMAGE-THUMBNAIL",
            "@size": "11736",
            "@ref": "gr2",
            "@mimetype": "image/gif"
          },
          {
            "@category": "thumbnail",
            "@height": "87",
            "@width": "219",
            "@_fa": "true",
            "$": "https://api.elsevier.com/content/object/eid/1-s2.0-S246882312300189X-ga1.sml?httpAccept=%2A%2F%2A",
            "@multimediatype": "GIF image file",
            "@type": "IMAGE-THUMBNAIL",
            "@size": "12359",
            "@ref": "ga1",
            "@mimetype": "image/gif"
          },
          {
            "@category": "thumbnail",
            "@height": "91",
            "@width": "219",
            "@_fa": "true",
            "$": "https://api.elsevier.com/content/object/eid/1-s2.0-S246882312300189X-gr1.sml?httpAccept=%2A%2F%2A",
            "@multimediatype": "GIF image file",
            "@type": "IMAGE-THUMBNAIL",
            "@size": "11905",
            "@ref": "gr1",
            "@mimetype": "image/gif"
          },
          {
            "@category": "high",
            "@height": "2121",
            "@width": "2500",
            "@_fa": "true",
            "$": "https://api.elsevier.com/content/object/eid/1-s2.0-S246882312300189X-gr8_lrg.jpg?httpAccept=%2A%2F%2A",
            "@multimediatype": "JPEG image file",
            "@type": "IMAGE-HIGH-RES",
            "@size": "520769",
            "@ref": "gr8",
            "@mimetype": "image/jpeg"
          },
          {
            "@category": "high",
            "@height": "2372",
            "@width": "2500",
            "@_fa": "true",
            "$": "https://api.elsevier.com/content/object/eid/1-s2.0-S246882312300189X-gr7_lrg.jpg?httpAccept=%2A%2F%2A",
            "@multimediatype": "JPEG image file",
            "@type": "IMAGE-HIGH-RES",
            "@size": "726461",
            "@ref": "gr7",
            "@mimetype": "image/jpeg"
          },
          {
            "@category": "high",
            "@height": "2349",
            "@width": "2508",
            "@_fa": "true",
            "$": "https://api.elsevier.com/content/object/eid/1-s2.0-S246882312300189X-gr6_lrg.jpg?httpAccept=%2A%2F%2A",
            "@multimediatype": "JPEG image file",
            "@type": "IMAGE-HIGH-RES",
            "@size": "603399",
            "@ref": "gr6",
            "@mimetype": "image/jpeg"
          },
          {
            "@category": "high",
            "@height": "3357",
            "@width": "2500",
            "@_fa": "true",
            "$": "https://api.elsevier.com/content/object/eid/1-s2.0-S246882312300189X-gr5_lrg.jpg?httpAccept=%2A%2F%2A",
            "@multimediatype": "JPEG image file",
            "@type": "IMAGE-HIGH-RES",
            "@size": "1043554",
            "@ref": "gr5",
            "@mimetype": "image/jpeg"
          },
          {
            "@category": "high",
            "@height": "2116",
            "@width": "2500",
            "@_fa": "true",
            "$": "https://api.elsevier.com/content/object/eid/1-s2.0-S246882312300189X-gr4_lrg.jpg?httpAccept=%2A%2F%2A",
            "@multimediatype": "JPEG image file",
            "@type": "IMAGE-HIGH-RES",
            "@size": "736397",
            "@ref": "gr4",
            "@mimetype": "image/jpeg"
          },
          {
            "@category": "high",
            "@height": "3726",
            "@width": "2500",
            "@_fa": "true",
            "$": "https://api.elsevier.com/content/object/eid/1-s2.0-S246882312300189X-gr3_lrg.jpg?httpAccept=%2A%2F%2A",
            "@multimediatype": "JPEG image file",
            "@type": "IMAGE-HIGH-RES",
            "@size": "978212",
            "@ref": "gr3",
            "@mimetype": "image/jpeg"
          },
          {
            "@category": "high",
            "@height": "2116",
            "@width": "2167",
            "@_fa": "true",
            "$": "https://api.elsevier.com/content/object/eid/1-s2.0-S246882312300189X-gr2_lrg.jpg?httpAccept=%2A%2F%2A",
            "@multimediatype": "JPEG image file",
            "@type": "IMAGE-HIGH-RES",
            "@size": "504844",
            "@ref": "gr2",
            "@mimetype": "image/jpeg"
          },
          {
            "@category": "high",
            "@height": "875",
            "@width": "2213",
            "@_fa": "true",
            "$": "https://api.elsevier.com/content/object/eid/1-s2.0-S246882312300189X-ga1_lrg.jpg?httpAccept=%2A%2F%2A",
            "@multimediatype": "JPEG image file",
            "@type": "IMAGE-HIGH-RES",
            "@size": "325579",
            "@ref": "ga1",
            "@mimetype": "image/jpeg"
          },
          {
            "@category": "high",
            "@height": "901",
            "@width": "2167",
            "@_fa": "true",
            "$": "https://api.elsevier.com/content/object/eid/1-s2.0-S246882312300189X-gr1_lrg.jpg?httpAccept=%2A%2F%2A",
            "@multimediatype": "JPEG image file",
            "@type": "IMAGE-HIGH-RES",
            "@size": "327195",
            "@ref": "gr1",
            "@mimetype": "image/jpeg"
          },
          {
            "@category": "standard",
            "@_fa": "true",
            "$": "https://api.elsevier.com/content/object/eid/1-s2.0-S246882312300189X-mmc1.docx?httpAccept=%2A%2F%2A",
            "@multimediatype": "Microsoft Word file",
            "@type": "APPLICATION",
            "@size": "5114358",
            "@ref": "mmc1",
            "@mimetype": "application/word"
          },
          {
            "@category": "thumbnail",
            "@_fa": "true",
            "$": "https://api.elsevier.com/content/object/eid/1-s2.0-S246882312300189X-si1.svg?httpAccept=%2A%2F%2A",
            "@multimediatype": "Scalable Vector Graphics file",
            "@type": "ALTIMG",
            "@size": "9188",
            "@ref": "si1",
            "@mimetype": "image/svg+xml"
          },
          {
            "@category": "thumbnail",
            "@_fa": "true",
            "$": "https://api.elsevier.com/content/object/eid/1-s2.0-S246882312300189X-si2.svg?httpAccept=%2A%2F%2A",
            "@multimediatype": "Scalable Vector Graphics file",
            "@type": "ALTIMG",
            "@size": "4271",
            "@ref": "si2",
            "@mimetype": "image/svg+xml"
          },
          {
            "@category": "thumbnail",
            "@_fa": "true",
            "$": "https://api.elsevier.com/content/object/eid/1-s2.0-S246882312300189X-si3.svg?httpAccept=%2A%2F%2A",
            "@multimediatype": "Scalable Vector Graphics file",
            "@type": "ALTIMG",
            "@size": "4711",
            "@ref": "si3",
            "@mimetype": "image/svg+xml"
          },
          {
            "@category": "thumbnail",
            "@_fa": "true",
            "$": "https://api.elsevier.com/content/object/eid/1-s2.0-S246882312300189X-si4.svg?httpAccept=%2A%2F%2A",
            "@multimediatype": "Scalable Vector Graphics file",
            "@type": "ALTIMG",
            "@size": "12669",
            "@ref": "si4",
            "@mimetype": "image/svg+xml"
          },
          {
            "@category": "thumbnail",
            "@_fa": "true",
            "$": "https://api.elsevier.com/content/object/eid/1-s2.0-S246882312300189X-si5.svg?httpAccept=%2A%2F%2A",
            "@multimediatype": "Scalable Vector Graphics file",
            "@type": "ALTIMG",
            "@size": "18301",
            "@ref": "si5",
            "@mimetype": "image/svg+xml"
          },
          {
            "@category": "thumbnail",
            "@_fa": "true",
            "$": "https://api.elsevier.com/content/object/eid/1-s2.0-S246882312300189X-si6.svg?httpAccept=%2A%2F%2A",
            "@multimediatype": "Scalable Vector Graphics file",
            "@type": "ALTIMG",
            "@size": "11187",
            "@ref": "si6",
            "@mimetype": "image/svg+xml"
          },
          {
            "@category": "standard",
            "@_fa": "true",
            "$": "https://api.elsevier.com/content/object/eid/1-s2.0-S246882312300189X-am.pdf?httpAccept=%2A%2F%2A",
            "@multimediatype": "Acrobat PDF file",
            "@type": "AAM-PDF",
            "@size": "2375535",
            "@ref": "am",
            "@mimetype": "application/pdf"
          }
        ]
      },
      "link": {
        "@rel": "abstract",
        "@href": "https://api.elsevier.com/content/abstract/scopus_id/85150856997"
      }
    }
  }
}