{
  "metadata": {
    "title": "Mo<ce:inf loc=post>4/3</ce:inf>B<ce:inf loc=post>2</ce:inf>O<ce:inf loc=post>2</ce:inf>-supported single-atom catalysts for oxygen reduction reaction",
    "authors": "; ; ",
    "journal": "Molecular Catalysis",
    "date": "2024-05-01",
    "doi": "10.1016/j.mcat.2024.114152",
    "abstract": "",
    "uri": "https://api.elsevier.com/content/article/pii/S2468823124003353",
    "pii": "S2468823124003353"
  },
  "fulltext": {
    "full-text-retrieval-response": {
      "scopus-eid": "2-s2.0-85190525315",
      "originalText": "serial JL 315758 291210 291744 291790 291809 31 Molecular Catalysis MOLECULARCATALYSIS 2024-04-18 2024-04-18 2024-04-18 2024-04-18 2024-04-25T19:58:46 1-s2.0-S2468823124003353 S2468-8231(24)00335-3 S2468823124003353 10.1016/j.mcat.2024.114152 S300 S300.1 FULL-TEXT 1-s2.0-S2468823124X00061 2024-06-07T00:24:54.604759Z 0 0 20240501 2024 2024-04-18T22:14:04.6751Z absattachment articleinfo articlenumber articletitlenorm authfirstinitialnorm authfirstsurnamenorm cid cids contenttype copyright crossmark dateloaded dateloadedtxt datesearch datesort dateupdated dco docsubtype doctype doi eid ewtransactionid hubeid indexeddate issn issnnorm itemstage itemtransactionid itemweight openaccess openarchive pg pgfirst pii piinorm pubdatestart pubdatetxt pubyr sectiontitle sortorder srctitle srctitlenorm srctype ssids alllist content subj subheadings suppl tomb volfirst volissue volumelist webpdf webpdfpagecount yearnav figure e-component body mmlmath acknowledge affil appendices articletitle auth authfirstini authfull authkeywords authlast footnotes grantnumber grantsponsor grantsponsorid highlightsabst orcid primabst pubtype ref specialabst 2468-8231 24688231 true 560 560 C Volume 560 32 114152 114152 114152 20240501 1 May 2024 2024-05-01 2024 Regular Papers article fla © 2024 Elsevier B.V. All rights reserved. MO43B2O2SUPPORTEDSINGLEATOMCATALYSTSFOROXYGENREDUCTIONREACTION WANG Y Introduction Computational methodology Results and discussion Conclusion CRediT authorship contribution statement Acknowledgements Appendix Supplementary materials References YU 2020 2000570 Y PENG 2019 26062 26070 Q YANG 2020 1106 1115 X YANG 2018 691 698 L BAI 2023 113175 J DEBE 2012 43 51 M YANG 2018 6626 6631 L FU 2020 7801 7807 Z KAN 2020 17065 17077 D WEI 2021 2102595 B HUANG 2022 121737 X LI 2021 463 468 H HUANG 2019 1801430 K ANDO 2021 9317 9332 F YUE 2023 112942 Y YU 2023 25352 25356 S ZHANG 2018 112 119 X SAHOO 2022 246 254 L XUE 2021 129760 Q HUANG 2023 113102 K HUANG 2023 113030 B ZHU 2017 1603793 Y BEALL 2021 3094 3114 C WEI 2023 15663 15672 X WANG 2022 13005 13012 A GUO 2017 23530 23535 Z QI 2021 147742 S ZHANG 2020 144248 B LI 2018 2263 2269 F YANG 2013 1740 1748 X WU 2019 1900149 J ZHONG 2020 4313 4318 L FEI 2018 63 72 H LING 2017 5133 5139 C LUO 2021 1218 L ZHANG 2021 433 441 T WANG 2022 154522 E GAO 2023 0039 Y ZHENG 2017 3336 3339 Y KRESSE 1996 11169 11186 G PERDEW 1996 3865 3868 J PERDEW 1992 13244 13249 J MOELLMANN 2014 7615 7621 J NORSKOV 2004 17886 17892 J ZHOU 2021 801 805 J WU 2022 154374 H WAN 2018 1705369 J NIE 2015 2168 2201 Y SIAHROSTAMI 2013 1137 1143 S JIAO 2015 2060 2086 Y CHEN 2022 151357 Y WANGX2024X114152 WANGX2024X114152XY 2026-04-18T00:00:00.000Z 2026-04-18T00:00:00.000Z http://creativecommons.org/licenses/by-nc-nd/4.0/ © 2024 Elsevier B.V. All rights reserved. 2024-05-03T12:37:49.284Z http://vtw.elsevier.com/data/voc/AddOnTypes/50.7/aggregated-refined 2022YFB3807200 National Key Research and Development Program of China Stem Cell and Translational Research http://data.elsevier.com/vocabulary/SciValFunders/501100013290 http://sws.geonames.org/1814991 National Key Research and Development Program of China NKRDPC National Key Research and Development Program of China http://data.elsevier.com/vocabulary/SciValFunders/501100012166 http://sws.geonames.org/1814991/ High-Performance Computing Beihang University BUAA Beihang University http://data.elsevier.com/vocabulary/SciValFunders/501100002358 http://sws.geonames.org/1814991/ This work was supported by the National Key Research and Development Program of China (2022YFB3807200). We are very grateful for the support of the High-Performance Computing (HPC) resource platform of Beihang University. https://doi.org/10.15223/policy-017 https://doi.org/10.15223/policy-037 https://doi.org/10.15223/policy-012 https://doi.org/10.15223/policy-029 https://doi.org/10.15223/policy-004 item S2468-8231(24)00335-3 S2468823124003353 1-s2.0-S2468823124003353 10.1016/j.mcat.2024.114152 315758 2024-06-07T00:24:54.604759Z 2024-05-01 1-s2.0-S2468823124003353-main.pdf https://s3-eu-west-1.amazonaws.com/prod-ucs-content-store-eu-west/content/pii:S2468823124003353/MAIN/application/pdf/b2e23aeae928854084f1f446e4ed49c5/main.pdf main.pdf pdf true 5181928 MAIN 8 1-s2.0-S2468823124003353-main_1.png https://s3-eu-west-1.amazonaws.com/prod-ucs-content-store-eu-west/content/pii:S2468823124003353/PREVIEW/image/png/33eee58a0fbbf2c46ff6396735c1303c/main_1.png main_1.png png 60975 849 656 IMAGE-WEB-PDF 1 1-s2.0-S2468823124003353-gr10.jpg https://s3-eu-west-1.amazonaws.com/prod-ucs-content-store-eu-west/content/pii:S2468823124003353/gr10/DOWNSAMPLED/image/jpeg/7e271ea642ab05e3be06b58f6b3a5c68/gr10.jpg gr10 gr10.jpg jpg 41430 205 585 IMAGE-DOWNSAMPLED 1-s2.0-S2468823124003353-gr6.jpg https://s3-eu-west-1.amazonaws.com/prod-ucs-content-store-eu-west/content/pii:S2468823124003353/gr6/DOWNSAMPLED/image/jpeg/79aab02c7667d27c74ce064bd6459a8a/gr6.jpg gr6 gr6.jpg jpg 50036 208 529 IMAGE-DOWNSAMPLED 1-s2.0-S2468823124003353-gr7.jpg https://s3-eu-west-1.amazonaws.com/prod-ucs-content-store-eu-west/content/pii:S2468823124003353/gr7/DOWNSAMPLED/image/jpeg/056cf8e844a7e6adbf47c4b2c7e4573d/gr7.jpg gr7 gr7.jpg jpg 51346 220 529 IMAGE-DOWNSAMPLED 1-s2.0-S2468823124003353-gr8.jpg https://s3-eu-west-1.amazonaws.com/prod-ucs-content-store-eu-west/content/pii:S2468823124003353/gr8/DOWNSAMPLED/image/jpeg/ebe2ebea9a9b9b51f05b83bde9a49ec5/gr8.jpg gr8 gr8.jpg jpg 55146 213 604 IMAGE-DOWNSAMPLED 1-s2.0-S2468823124003353-gr9.jpg https://s3-eu-west-1.amazonaws.com/prod-ucs-content-store-eu-west/content/pii:S2468823124003353/gr9/DOWNSAMPLED/image/jpeg/5ed20868d8c330988b69889306a1ecb0/gr9.jpg gr9 gr9.jpg jpg 27318 183 585 IMAGE-DOWNSAMPLED 1-s2.0-S2468823124003353-gr2.jpg https://s3-eu-west-1.amazonaws.com/prod-ucs-content-store-eu-west/content/pii:S2468823124003353/gr2/DOWNSAMPLED/image/jpeg/891f580376039d95dc309d26b254e20c/gr2.jpg gr2 gr2.jpg jpg 72933 247 604 IMAGE-DOWNSAMPLED 1-s2.0-S2468823124003353-ga1.jpg https://s3-eu-west-1.amazonaws.com/prod-ucs-content-store-eu-west/content/pii:S2468823124003353/ga1/DOWNSAMPLED/image/jpeg/51cc7d1d2683a79e5e62d1f4e1dc723c/ga1.jpg ga1 true ga1.jpg jpg 32783 174 500 IMAGE-DOWNSAMPLED 1-s2.0-S2468823124003353-gr3.jpg https://s3-eu-west-1.amazonaws.com/prod-ucs-content-store-eu-west/content/pii:S2468823124003353/gr3/DOWNSAMPLED/image/jpeg/1dfb7944832e61366ff0301142c4f64c/gr3.jpg gr3 gr3.jpg jpg 59244 349 393 IMAGE-DOWNSAMPLED 1-s2.0-S2468823124003353-gr4.jpg https://s3-eu-west-1.amazonaws.com/prod-ucs-content-store-eu-west/content/pii:S2468823124003353/gr4/DOWNSAMPLED/image/jpeg/eb134bd43bd4f4338c3391819d27bbbb/gr4.jpg gr4 gr4.jpg jpg 54648 208 529 IMAGE-DOWNSAMPLED 1-s2.0-S2468823124003353-gr5.jpg https://s3-eu-west-1.amazonaws.com/prod-ucs-content-store-eu-west/content/pii:S2468823124003353/gr5/DOWNSAMPLED/image/jpeg/b4773f8a17f4d64bdc240b6bf5828361/gr5.jpg gr5 gr5.jpg jpg 51354 228 529 IMAGE-DOWNSAMPLED 1-s2.0-S2468823124003353-gr1.jpg https://s3-eu-west-1.amazonaws.com/prod-ucs-content-store-eu-west/content/pii:S2468823124003353/gr1/DOWNSAMPLED/image/jpeg/63b888c421741ba385d723e4e3f6c4a6/gr1.jpg gr1 gr1.jpg jpg 46277 206 679 IMAGE-DOWNSAMPLED 1-s2.0-S2468823124003353-gr10.sml https://s3-eu-west-1.amazonaws.com/prod-ucs-content-store-eu-west/content/pii:S2468823124003353/gr10/THUMBNAIL/image/gif/e9fdde1d5b63d62d0fa627159a53ece3/gr10.sml gr10 gr10.sml sml 7957 77 219 IMAGE-THUMBNAIL 1-s2.0-S2468823124003353-gr6.sml https://s3-eu-west-1.amazonaws.com/prod-ucs-content-store-eu-west/content/pii:S2468823124003353/gr6/THUMBNAIL/image/gif/231ec6a64d9fe7dcd546f094181ae3cc/gr6.sml gr6 gr6.sml sml 11221 86 219 IMAGE-THUMBNAIL 1-s2.0-S2468823124003353-gr7.sml https://s3-eu-west-1.amazonaws.com/prod-ucs-content-store-eu-west/content/pii:S2468823124003353/gr7/THUMBNAIL/image/gif/436ad0527bb62a32eee07bfb679092ce/gr7.sml gr7 gr7.sml sml 11566 91 219 IMAGE-THUMBNAIL 1-s2.0-S2468823124003353-gr8.sml https://s3-eu-west-1.amazonaws.com/prod-ucs-content-store-eu-west/content/pii:S2468823124003353/gr8/THUMBNAIL/image/gif/e4b5cfd4d1f367225a9ba0a451bc62b0/gr8.sml gr8 gr8.sml sml 10294 77 219 IMAGE-THUMBNAIL 1-s2.0-S2468823124003353-gr9.sml https://s3-eu-west-1.amazonaws.com/prod-ucs-content-store-eu-west/content/pii:S2468823124003353/gr9/THUMBNAIL/image/gif/cee23d7ba775f93ba5171d69487dc512/gr9.sml gr9 gr9.sml sml 5938 68 219 IMAGE-THUMBNAIL 1-s2.0-S2468823124003353-gr2.sml https://s3-eu-west-1.amazonaws.com/prod-ucs-content-store-eu-west/content/pii:S2468823124003353/gr2/THUMBNAIL/image/gif/f3a2afc6a86ff7fb8de88bfe5f0bf619/gr2.sml gr2 gr2.sml sml 13534 90 219 IMAGE-THUMBNAIL 1-s2.0-S2468823124003353-ga1.sml https://s3-eu-west-1.amazonaws.com/prod-ucs-content-store-eu-west/content/pii:S2468823124003353/ga1/THUMBNAIL/image/gif/c98c5ee4416d39f1908e65fa977db1c2/ga1.sml ga1 true ga1.sml sml 7919 76 219 IMAGE-THUMBNAIL 1-s2.0-S2468823124003353-gr3.sml https://s3-eu-west-1.amazonaws.com/prod-ucs-content-store-eu-west/content/pii:S2468823124003353/gr3/THUMBNAIL/image/gif/d6ad4070b56736c78d8eba3369afde62/gr3.sml gr3 gr3.sml sml 13393 164 185 IMAGE-THUMBNAIL 1-s2.0-S2468823124003353-gr4.sml https://s3-eu-west-1.amazonaws.com/prod-ucs-content-store-eu-west/content/pii:S2468823124003353/gr4/THUMBNAIL/image/gif/4705a32c74f0987b7bc4356b68d07c4e/gr4.sml gr4 gr4.sml sml 11898 86 219 IMAGE-THUMBNAIL 1-s2.0-S2468823124003353-gr5.sml https://s3-eu-west-1.amazonaws.com/prod-ucs-content-store-eu-west/content/pii:S2468823124003353/gr5/THUMBNAIL/image/gif/f78d10075f917beff51d01ce51935b33/gr5.sml gr5 gr5.sml sml 11733 94 219 IMAGE-THUMBNAIL 1-s2.0-S2468823124003353-gr1.sml https://s3-eu-west-1.amazonaws.com/prod-ucs-content-store-eu-west/content/pii:S2468823124003353/gr1/THUMBNAIL/image/gif/947a3c8874f37c5b9217c73d3f408f41/gr1.sml gr1 gr1.sml sml 8228 66 219 IMAGE-THUMBNAIL 1-s2.0-S2468823124003353-gr10_lrg.jpg https://s3-eu-west-1.amazonaws.com/prod-ucs-content-store-eu-west/content/pii:S2468823124003353/HIGHRES/image/jpeg/137e13a2eb02914173c62d4db964be2c/gr10_lrg.jpg gr10 gr10_lrg.jpg jpg 328926 908 2592 IMAGE-HIGH-RES 1-s2.0-S2468823124003353-gr6_lrg.jpg https://s3-eu-west-1.amazonaws.com/prod-ucs-content-store-eu-west/content/pii:S2468823124003353/HIGHRES/image/jpeg/0b7e96cb13451774c1aededc20285573/gr6_lrg.jpg gr6 gr6_lrg.jpg jpg 438026 920 2342 IMAGE-HIGH-RES 1-s2.0-S2468823124003353-gr7_lrg.jpg https://s3-eu-west-1.amazonaws.com/prod-ucs-content-store-eu-west/content/pii:S2468823124003353/HIGHRES/image/jpeg/2d871f529047f9bdd4fd3a495d24a3e2/gr7_lrg.jpg gr7 gr7_lrg.jpg jpg 448874 974 2342 IMAGE-HIGH-RES 1-s2.0-S2468823124003353-gr8_lrg.jpg https://s3-eu-west-1.amazonaws.com/prod-ucs-content-store-eu-west/content/pii:S2468823124003353/HIGHRES/image/jpeg/f12d6f9ce3443cbbcaa59509ca2b5ba2/gr8_lrg.jpg gr8 gr8_lrg.jpg jpg 466288 943 2675 IMAGE-HIGH-RES 1-s2.0-S2468823124003353-gr9_lrg.jpg https://s3-eu-west-1.amazonaws.com/prod-ucs-content-store-eu-west/content/pii:S2468823124003353/HIGHRES/image/jpeg/abaec4479cbcd6fcec141fb8d2c96c4f/gr9_lrg.jpg gr9 gr9_lrg.jpg jpg 212161 810 2592 IMAGE-HIGH-RES 1-s2.0-S2468823124003353-gr2_lrg.jpg https://s3-eu-west-1.amazonaws.com/prod-ucs-content-store-eu-west/content/pii:S2468823124003353/HIGHRES/image/jpeg/55dfe4a19e63fb7b3206aa501db9f65b/gr2_lrg.jpg gr2 gr2_lrg.jpg jpg 677539 1094 2675 IMAGE-HIGH-RES 1-s2.0-S2468823124003353-ga1_lrg.jpg https://s3-eu-west-1.amazonaws.com/prod-ucs-content-store-eu-west/content/pii:S2468823124003353/HIGHRES/image/jpeg/94ca779ae9ec69ec553542e1e971af46/ga1_lrg.jpg ga1 true ga1_lrg.jpg jpg 212265 771 2213 IMAGE-HIGH-RES 1-s2.0-S2468823124003353-gr3_lrg.jpg https://s3-eu-west-1.amazonaws.com/prod-ucs-content-store-eu-west/content/pii:S2468823124003353/HIGHRES/image/jpeg/bd970fe56c514e0e4f058c29aa9d1034/gr3_lrg.jpg gr3 gr3_lrg.jpg jpg 466926 1545 1742 IMAGE-HIGH-RES 1-s2.0-S2468823124003353-gr4_lrg.jpg https://s3-eu-west-1.amazonaws.com/prod-ucs-content-store-eu-west/content/pii:S2468823124003353/HIGHRES/image/jpeg/b648d944caabc188e4e786a01926e1d3/gr4_lrg.jpg gr4 gr4_lrg.jpg jpg 486311 920 2342 IMAGE-HIGH-RES 1-s2.0-S2468823124003353-gr5_lrg.jpg https://s3-eu-west-1.amazonaws.com/prod-ucs-content-store-eu-west/content/pii:S2468823124003353/HIGHRES/image/jpeg/b176f17c03025b602a3d2b24ce522d93/gr5_lrg.jpg gr5 gr5_lrg.jpg jpg 393577 1010 2342 IMAGE-HIGH-RES 1-s2.0-S2468823124003353-gr1_lrg.jpg https://s3-eu-west-1.amazonaws.com/prod-ucs-content-store-eu-west/content/pii:S2468823124003353/HIGHRES/image/jpeg/ebfcfeb281ebfe915e57920d97eb69c0/gr1_lrg.jpg gr1 gr1_lrg.jpg jpg 402874 913 3008 IMAGE-HIGH-RES 1-s2.0-S2468823124003353-mmc1.docx https://s3-eu-west-1.amazonaws.com/prod-ucs-content-store-eu-west/content/pii:S2468823124003353/mmc1/MAIN/application/vnd.openxmlformats-officedocument.wordprocessingml.document/6f782daa45d776fdcb08a2c4a5faac9a/mmc1.docx mmc1 mmc1.docx docx 7030884 APPLICATION 1-s2.0-S2468823124003353-si1.svg https://s3-eu-west-1.amazonaws.com/prod-ucs-content-store-eu-west/content/pii:S2468823124003353/image/svg+xml/c2b183870131b12ff2ae05a4db59172a/si1.svg si1 si1.svg svg 4405 ALTIMG 1-s2.0-S2468823124003353-si10.svg https://s3-eu-west-1.amazonaws.com/prod-ucs-content-store-eu-west/content/pii:S2468823124003353/image/svg+xml/4f4484ea90f10e0308665a513990d622/si10.svg si10 si10.svg svg 9992 ALTIMG 1-s2.0-S2468823124003353-si11.svg https://s3-eu-west-1.amazonaws.com/prod-ucs-content-store-eu-west/content/pii:S2468823124003353/image/svg+xml/7b5008f66e11650ff9c69ac42c116c48/si11.svg si11 si11.svg svg 11807 ALTIMG 1-s2.0-S2468823124003353-si12.svg https://s3-eu-west-1.amazonaws.com/prod-ucs-content-store-eu-west/content/pii:S2468823124003353/image/svg+xml/2b4e360a7119b760343e2689f964233d/si12.svg si12 si12.svg svg 6162 ALTIMG 1-s2.0-S2468823124003353-si13.svg https://s3-eu-west-1.amazonaws.com/prod-ucs-content-store-eu-west/content/pii:S2468823124003353/image/svg+xml/1fc54473827f5ae4047d32b1554291e2/si13.svg si13 si13.svg svg 6824 ALTIMG 1-s2.0-S2468823124003353-si2.svg https://s3-eu-west-1.amazonaws.com/prod-ucs-content-store-eu-west/content/pii:S2468823124003353/image/svg+xml/1ca85bb842419de7346ab2e5519952a3/si2.svg si2 si2.svg svg 6730 ALTIMG 1-s2.0-S2468823124003353-si3.svg https://s3-eu-west-1.amazonaws.com/prod-ucs-content-store-eu-west/content/pii:S2468823124003353/image/svg+xml/e1b37ed2b2043bcf6ade227e39e75878/si3.svg si3 si3.svg svg 7712 ALTIMG 1-s2.0-S2468823124003353-si4.svg https://s3-eu-west-1.amazonaws.com/prod-ucs-content-store-eu-west/content/pii:S2468823124003353/image/svg+xml/d48698e877a1067fb112c12931efb843/si4.svg si4 si4.svg svg 6820 ALTIMG 1-s2.0-S2468823124003353-si5.svg https://s3-eu-west-1.amazonaws.com/prod-ucs-content-store-eu-west/content/pii:S2468823124003353/image/svg+xml/fcd18a9713c399671d1f10853c87d9f4/si5.svg si5 si5.svg svg 4749 ALTIMG 1-s2.0-S2468823124003353-si6.svg https://s3-eu-west-1.amazonaws.com/prod-ucs-content-store-eu-west/content/pii:S2468823124003353/image/svg+xml/9b72d8c860a2d3b273f21b1eb69aeda6/si6.svg si6 si6.svg svg 6666 ALTIMG 1-s2.0-S2468823124003353-si7.svg https://s3-eu-west-1.amazonaws.com/prod-ucs-content-store-eu-west/content/pii:S2468823124003353/image/svg+xml/fce8a21632c4bec130ee872afad0eb59/si7.svg si7 si7.svg svg 8046 ALTIMG 1-s2.0-S2468823124003353-si8.svg https://s3-eu-west-1.amazonaws.com/prod-ucs-content-store-eu-west/content/pii:S2468823124003353/image/svg+xml/22ac1a8a4d6c43192b38feba0dd368c0/si8.svg si8 si8.svg svg 12982 ALTIMG 1-s2.0-S2468823124003353-si9.svg https://s3-eu-west-1.amazonaws.com/prod-ucs-content-store-eu-west/content/pii:S2468823124003353/image/svg+xml/654a5eb86d5e5f70ee8b697c9bd59cdb/si9.svg si9 si9.svg svg 4808 ALTIMG 1-s2.0-S2468823124003353-am.pdf am am.pdf pdf 3379616 AAM-PDF https://s3-eu-west-1.amazonaws.com/prod-ucs-content-store-eu-west/content/egi:10V3GKX5M10/MAIN/application/pdf/3756ae2896695b3a82d2a9eda293ab63/am.pdf MCAT 114152 114152 S2468-8231(24)00335-3 10.1016/j.mcat.2024.114152 Fig. 1 (a) The most stable atomic structure of TM@Mo4/3B2O2. (b) The formation energy diagram of different TM@Mo4/3B2O2. Fig 1 Fig. 2 The four most stable different O2 adsorption structures of (a) Ta@Mo4/3B2O2 (side-on); (b) Co@Mo4/3B2O2 (end-on); (c) Mo@Mo4/3B2O2 (dissociation); and (d) Pd@Mo4/3B2O2 (physical adsorption). Fig 2 Fig. 3 (a) Bond lengths and polarized charges of O2 adsorbed on TM@Mo4/3B2O2. (b) Summary of adsorption structures of 25 elements. Fig 3 Fig. 4 (a) The first ORR reaction pathway (Normal ORR reaction). (b) Structural diagram of reaction process with Ni@Mo4/3B2O2 as an example. Fig 4 Fig. 5 (a) The second ORR reaction pathway (O2 dissociation). (b) Structural diagram of reaction process with Nb@Mo4/3B2O2 and Mo@Mo4/3B2O2. Fig 5 Fig. 6 (a) The third ORR reaction pathway (OOH dissociation). (b) Structural diagram of reaction process with Ta@Mo4/3B2O2 as an example. Fig 6 Fig. 7 (a) The fourth ORR reaction pathway (OHOH dissociation). (b) Structural diagram of reaction process with Mn@Mo4/3B2O2 as an example. Fig 7 Fig. 8 (a) Taking Zn@Mo4/3B2O2 as an example, the fifth ORR reaction path (produce H2O2) and the structure diagram of the reaction process. (b) Summary of 6 ORR reaction paths on 25 SACs. Fig 8 Fig. 9 Gibbs free energy diagram of the ORR pathway for (a) Co@Mo4/3B2O2 and (b) Ru@Mo4/3B2O2, where the red line represents the most energy-consuming step in the ORR. Fig 9 Fig. 10 (a) Volcano plot of ηORR versus ICOHP. (b) Linear relationship between ηORR and descriptor. Fig 10 Research Paper Mo4/3B2O2-supported single-atom catalysts for oxygen reduction reaction Yuxiang Wang Writing – review & editing Writing – original draft Visualization Methodology Investigation Data curation Conceptualization 1 Erpeng Wang Writing – review & editing Data curation 1 Ya Gao Writing – review & editing Data curation Jian Zhou Writing – review & editing Supervision Resources Project administration Data curation ⁎ Zhimei Sun Supervision Resources Project administration Funding acquisition ⁎ School of Materials Science and Engineering, Beihang University, Beijing 100191, China School of Materials Science and Engineering Beihang University Beijing 100191 China School of Materials Science and Engineering, Beihang University, Beijing 100191, China ⁎ Corresponding authors. 1 These authors contributed equally: Yuxiang Wang and Erpeng Wang. Exploring earth-abundant and inexpensive electrocatalysts to realize efficient oxygen reduction reaction (ORR) is urgently desired. In this work, through first-principles calculations, we have strategically designed a series of single-atom catalysts (SACs) for ORR by immobilizing single atoms on the surface of Mo4/3B2O2, denoted as TM@Mo4/3B2O2 (TM representing 3d, 4d, and 5d transition metal atoms, excluding Tc and Hg). Significantly, for 4e− ORR, the best catalyst was Co@Mo4/3B2O2 and Ru@Mo4/3B2O2, with an overpotential of 0.61 V and 0.63 V, close to the commonly used Pt catalyst (0.45 V). In 2e− ORR, Zn@Mo4/3B2O2 had the best catalytic activity, with a ΔG*OOH of -2.47 eV, close to the commonly used Pd catalyst (ΔG*OOH = -3.17 eV). By calculating the electronic properties of SACs, it was found that the number of electrons gained by the intermediate *O2 and *OOH from the SACs determines the O2 adsorption structures and ORR reaction pathways. In addition, there are two descriptors: ICOHP and a composition descriptor which provides atomic-level insights, that were found to summarize the ORR activity rules. Our work enriches the applications of the MBenes family in catalysis, and provides feasible guidance for the design of low-cost and high-effect ORR catalysts. Graphical abstract Image, graphical abstract Keywords Single-atom catalyst Oxygen reduction reaction First-principles Electrocatalysis Data availability Data will be made available on request. Introduction With the escalating demand for energy and the increasingly prominent environmental issues, the pursuit of sustainable and environmentally friendly energy technologies has attracted widespread attention in recent years [1–5]. Proton exchange membrane fuel cells (PEMFCs) have become promising competitors for various portable power applications due to their excellent energy conversion efficiency, simple structural design and rapid start-up capability at room temperature. The oxygen reduction reaction (ORR) serves as a crucial half-reaction in PEMFCs, with its efficiency largely determining the catalytic performance [6]. To date, the most effective commercial catalyst for ORR remains the Pt/C metal. However, the scarcity and high cost of precious Pt metal have seriously hindered its widespread practical application [7]. Therefore, seeking non-precious metal alternatives is an urgent and arduous challenge. To overcome this issue, substantial theoretical and experimental efforts have focused on the design and exploration of novel electrocatalytic materials, including transition metal carbides/nitrides [8–11], metal oxides [12–15], graphene [16,17], nanowires [18,19], nanoparticles [20], nanoclusters [21], perovskites [22,23], and two-dimensional (2D) metal-organic frameworks [24,25]. In 2017, Sun et al. [26] first reported a novel two-dimensional transition metal boride, termed MBenes, which have a structure similar to that of two-dimensional transition metal carbonitrides (MXenes). Similarly, MBenes have excellent conductivity, fast charge transfer, tunable chemical surface area, and large specific surface area, making them highly promising for applications in energy storage and conversion [27,28]. Furthermore, a unique design strategy that single metal atoms are immobilized on supports to form single-atom catalysts (SACs) has achieved remarkable success in seeking low cost and high efficiency 2D electrocatalytic materials [29,30]. SACs, characterized by metal active sites that are atomically dispersed on suitable substrates, exhibit extremely high atom-utilization efficiency, thereby reducing the usage of precious metals. Additionally, the unique electronic structure and unsaturated coordination environments of the active center in SACs are beneficial for enhancing the adsorption ability of the reaction intermediates, thereby improving the catalytic activity [31–35]. Specifically, it has been demonstrated that MBenes possess superb physical and chemical characteristics, which are highly desired as substrates for SACs. Up till now, MBenes have been widely studied as catalysts or substrates of various reactions, including hydrogen evolution reaction (HER) [26], oxygen reduction/evolution reaction (ORR/OER) [1,2,36,37] and nitrogen reduction reaction (NRR) [3,38]. In the mechanism of ORR, individual diverse materials typically display distinct O2 adsorption structures and different ORR reaction pathways. However, there is little research explaining these variations from the perspective of electron transfer. In addition, accelerating the discovery of materials with excellent catalytic activity is of paramount importance and requires faster and more effective methods than traditional trial-and-error methods. In ORR research, the Gibbs free energy of the intermediate *O (ΔG*O) is commonly used as a descriptor to measure catalytic activity [32,39]. However, when extended to different matrix materials, its accuracy and universality are compromised. Therefore, it is urgent to explore an intrinsic descriptor that can accurately characterize the catalytic activity of different materials. Inspired by the SACs, through first-principles calculations, we have strategically designed a series of SACs for ORR by immobilizing single atoms on the surface of Mo4/3B2O2, denoted as TM@Mo4/3B2O2 (TM representing 3d, 4d, and 5d transition metal atoms, excluding Tc and Hg). Our research indicated that these 25 SACs exhibit four different types of O2 adsorption structures and six unique ORR reaction pathways. Especially Co@Mo4/3B2O2 exhibited the optimal activity in 4e− ORR and Zn@Mo4/3B2O2 exhibited the most superior activity in 2e− ORR. In addition, the exploration of electron transfer indicated that the amount of electron transfer from SACs to intermediates *O2 determines the adsorption structure of O2, while the amount of electron transfer from SACs to intermediates *OOH determines the ORR reaction pathway. Importantly, there are two key indicators that can summarize the rules controlling ORR activity. Our research contributes to a deeper understanding of the catalytic activity of the MBenes and provides valuable insights for designing economically efficient and sustainable ORR catalysts. Computational methodology The spin-polarized first-principles DFT calculations for all the SACs were performed through the projector augmented wave (PAW) method as implemented in the VASP code [40]. The generalized gradient approximation (GGA) [41] of Perdew-Burke-Ernzerhof (PBE) [42] functional was applied to describe the electron exchange-correlation interactions. The cutoff energy was set to 500 eV and the k-points grid was sampled using a 3 × 3 × 1 Monkhorst-Pack mesh for structural optimization and a denser 7 × 7 × 1 Monkhorst-Pack mesh for electronic structure and static self-consistent calculations. In all calculations, a 25 Å vacuum distance in the z-direction was set to avoid interlayer interactions, and the van der Waals interaction was considered by using the empirical correction DFT-D3 approach [43]. The convergence tolerance for force and energy on each atom during the structure optimization was set to 1.0 × 10−5 eV/atom and 0.02 eV/Å, respectively. The thermal stability of SACs structures were evaluated by performing ab initio molecular dynamics (AIMD) simulations, which lasted for 5 ps with a time step of 1.0 fs at 300 K. The formation energy (Ef) of transition metals (TM) embedded in the Mo4/3B2O2 hollow can be calculated by the following formula: (1) E f = E TM + S − E S − E TM In this formula, ETM+S and ES represent the total energies of TM@Mo4/3B2O2 and Mo4/3B2O2, respectively, and ETM represents the energy of per TM atom in the metal bulk with the most stable crystal structures. In acidic solution environments, the overall ORR occurring at the cathode can be summarized as O 2 ( g ) + 4 H + + 4 e − → 2 H 2 O , consisting of the following four-step elementary reaction: (2) O 2 ( g ) + H + + e − + * → * OOH (3) * OOH + H + + e − → * O + H 2 O ( l ) (4) * O + H + + e − → * OH (5) * OH + H + + e − → H 2 O ( 1 ) + * where * represents the active site on the catalyst surface. g and l represent the corresponding gas phase and liquid phase, respectively. For ORR, the chemical potential of (H+ + e−) is regarded as that of 1/2 H2 by setting the standard potential as the reference potential, that is, μH+ + μe- = 0.5μH2, at U = 0 V and PH2 = 1 bar, according to the method proposed by Nørskov et al. [44] The free energy change from the initial state to the final state of each elementary reaction involving electron transfer can be calculated by: (6) Δ G = Δ E + Δ ZPE − T Δ S + Δ G pH + Δ G U ΔE is the total energy change of the reaction obtained from DFT calculations. ΔZPE and ΔS are the changes in zero-point energy and entropy, respectively. T is the temperature and was set to 298.15 K (room temperature) in this work. ΔGU = -neU is employed to represent the impact of electrical potential on free energy, where U is the applied electrode potential, e is the elementary charge and n is the number of transferred proton-electron pairs. ΔGpH = -kBTln[H+] = pH × kBTln10, represents the influence of the pH value of the electrolyte, where kB is the Boltzmann constant. In this work, pH and U were assumed to be zero. The overpotential used to evaluate the catalytic activity of ORR catalysts can be obtained from the equation below: (7) η ORR = max { Δ G 1 , Δ G 2 , Δ G 3 , Δ G 4 } e + 1 . 23 ηORR is the overpotential of the ORR catalyst. ΔG1, ΔG2, ΔG3, ΔG4 represent the Gibbs free energy of each elementary reaction. Results and discussion The Mo4/3B2O2 structure modeled in this study was consistent with previous literature [45,46]. To accommodate the varying volume sizes of transition metal atoms across different periods, we introduced three O vacancies by dissociating three O atoms, as depicted in Fig. S1 [47]. The subsequent optimization of the geometric structure confirmed that all transition metal atoms were successfully embedded into these vacancies. Then, we studied the adsorption structure and active sites of O2 on the surface of TM@Mo4/3B2O2. Taking Ni@Mo4/3B2O2 as an example, two O2 molecules undergo spontaneous and continuous adsorption and dissociation processes, accompanied by negative ΔG, as illustrated in Fig. S2. This process ultimately resulted in the formation of Ni@Mo4/3B2O2–3H. Based on this reaction pathway, the TM@Mo4/3B2O2–3H structure is used as a substrate for subsequent ORR. The most stable structure is presented in Fig. 1 a. To simplify the explanation, we would use TM@Mo4/3B2O2 to replace TM@Mo4/3B2O2–3H. To verify the stability of TM@Mo4/3B2O2, we calculated the formation energies of all SACs, as depicted in Fig. 1b. It is worth noting that the formation energies of most SACs were negative, while some were positive. However, they were still lower than the formation energies of Fe-N-C (1.19 eV) and Cu-N-C (1.95 eV) SACs synthesized in the experiment, which showed good thermodynamic stability [2]. Subsequently, the thermodynamic stability of the SACs was further evaluated through ab initio molecular dynamics simulation. As shown in Fig. S3, Co@Mo4/3B2O2 and Zn@Mo4/3B2O2 were selected as representatives for AIMD due to their superior catalytic activity observed in subsequent investigations. The simulations illustrated that both catalysts exhibit remarkable stability after 5 ps at 300 K, indicating their robust thermodynamic properties. In addition, we evaluated the electronic conductivity of Co@Mo4/3B2O2 and Zn@Mo4/3B2O2, as depicted in Fig. S4. The total density of states (TDOS) and the projected density of states (PDOS) diagrams revealed that the energy levels of two SACs are continuously distributed at the Fermi level, affirming their metallic properties. During the ORR, the adsorption of O2 in the initial step is a critical stage that influences the entire reaction process. Typically, O2 can adsorb onto the catalyst surface through physical adsorption or two chemical modes, end-on adsorption and side-on adsorption. Geometric structure optimization showed that most SACs exhibit two distinct O2 adsorption structures. A lower energy implies a more stable structure, and a smaller ΔG indicates that the reaction is more thermodynamically favorable. Thus, we chose the structure with the lowest energy for subsequent ORR, as detailed in Table S1. Through the study of 25 SACs, we classified four types of O2 adsorption structures, including end-on adsorption, side-on adsorption, dissociation adsorption, and physical adsorption. These four adsorption structures are visually represented in Fig. 2 . In addition, we performed charge density difference calculations for the initial three adsorption structure types, as shown in Fig. S5. There was no electron transfer between O2 and SACs in physical adsorption. The charge density difference diagram showed that the transfer of charges is bidirectional, which represented the interaction between TM single atom and O2. In the figure, yellow and cyan represent charge increases and decreases, respectively. It was worth noting that both end-on adsorption and side-on adsorption of O2 lead to an extension of the OO bond length (1.23 Å). Furthermore, it was observed that the OO bond length increases with the increase of O2 transfer charge, as illustrated in Fig. 3 a, indicating that O2 is being activated. Finally, we summarized the characteristics of the O2 adsorption structure types observed in the 25 SACs as presented in Fig. 3b. Subsequently, we conducted the ORR catalytic performance of all SACs. In acidic conditions, the ORR typically occurs through the O2 association mechanism [48], which is characterized by the following sequence: O 2 → * O 2 → * OOH → * O → * OH → H 2 O It was worth noting that these SACs, including V, Cr, Fe, Co, Ni, Re, Rh, Cd, Os, Ir, and Pt@Mo4/3B2O2, all followed this reaction pathway, as shown in Fig. 4 a. The structural schematic diagram of the reaction steps is shown in Fig. 4b. This common reaction pathway can be simply described as O2 hydrogenation to generate *OOH, followed by hydrogenation dehydration to generate *O, further hydrogenation to generate *OH, and finally hydrogenation dehydration to restore the catalyst to its initial structure. It was worth noting that this pathway does not involve an intermediate dissociation step and remains the 4e− ORR reaction process. For Nb@Mo4/3B2O2 and Mo@Mo4/3B2O2, these two SACs would facilitate the adsorption of O2 on the surface and further dissociate into *O+*O. As depicted in Fig. 5 a, it could be seen that on the surface of Nb@Mo4/3B2O2, *O+*OH preferentially generated *OH+OH, while on the surface of Mo@Mo4/3B2O2, *O+*OH preferentially dehydrated to generate *O. The structural schematic diagram of different reaction processes of Nb@Mo4/3B2O2 and Mo@Mo4/3B2O2 is shown in Fig. 5b. As depicted in Fig. S6a, on the surface of Nb@Mo4/3B2O2, the reaction of dehydrating *O+*OH to generate *O exhibits a more positive ΔG than generating *OH+*OH. While, for Mo@Mo4/3B2O2, the situation is reversed. Here, the unique reaction pathways of these two SACs were referred to as the O2 dissociation pathway. As shown in Fig. 6 a, for Re@Mo4/3B2O2, W@Mo4/3B2O2, and Ta@Mo4/3B2O2, it can be observed that they exhibit other reaction pathways different from the two mentioned above. After optimizing the geometric structure, it was observed that the associated O2 molecules undergo dissociation into *O+*OH with the progression of the initial hydrogenation reaction. The Structural schematic diagram of reaction processes is shown in Fig. 6b. The dissimilarity between this step and the previous O2 dissociation process is attributed to the initial association of O2, but after the first reaction, it was found that the OO bond breaks and dissociates to yield *O+*OH on the surface of the substrate, as shown in Fig. S7. For Re@Mo4/3B2O2 and Ta@Mo4/3B2O2, their ORR reaction pathways are similar to that of W@Mo4/3B2O2. The dehydration reaction of *O+*OH to generate *O has a more negative ΔG compared to the generation of *OH+*OH in Fig. S6b. Here, the ORR pathways of these three SACs are named as the OOH dissociation pathway. In Fig. 7 a, it was found that for the four SACs Ti@Mo4/3B2O2, Mn@Mo4/3B2O2, Zr@Mo4/3B2O2, and Hf@Mo4/3B2O2, no dissociation of O2 was observed during the adsorption process of O2, and *OOH did not dissociate after the first hydrogenation. However, after the second hydrogenation, it was found that *OOH would dissociate into *OH+OH, indicating that these four SACs exhibit a unique reaction type. As shown in Fig. S6c, taking Zr@Mo4/3B2O2 as an example, it is also found that after hydrogenation of *OOH, the ΔG of the formation of *OH+*OH is much more negative compared to the dehydration reaction, which is opposite to the situation of the OOH dissociation pathway. Here, this pathway is named the OHOH dissociation pathway. The Structural schematic diagram of reaction processes is shown in Fig. 7b. Unlike the 4e− ORR SACs mentioned above, Zn@Mo4/3B2O2, Cu@Mo4/3B2O2, and Au@Mo4/3B2O2 exhibit a 2e− ORR process for generating H2O2, as depicted in Fig. 8 a. Taking Au@Mo4/3B2O2 as an example, it can be seen there are two ways for *OOH to undergo further hydrogenation reactions, as shown in Fig. 6d. However, the ΔG of generating *OHOH is more negative compared to the formation of *O, indicating that the dehydration process on the surface of Au@Mo4/3B2O2 is not facile. Instead, the reaction predominantly proceeds through the 2e− ORR pathway, ultimately leading to the formation of H2O2. This reaction pathway is referred to as the generation of H2O2. In addition, combined with the analysis of the adsorption structure of O2, the two SACs of Pd@Mo4/3B2O2 and Ag@Mo4/3B2O2 cannot undergo the ORR reaction. In summary, we have identified a total of six reaction pathways through geometric structure analysis and screening based on thermodynamic criteria, as summarized in Fig. 8b. During the ORR reaction, the overpotential of the electrocatalyst is the most important indicator to measure the catalytic performance of the catalyst. For better catalysts, an important criterion is a lower ORR overpotential, which is related to the most energy-consuming step in the reaction. In Tables S2 and S3, the Gibbs free energy of each step of the 23 SACs was listed, and the most energy-consuming step was marked in red. The most energy-consuming steps for 4e− ORR catalysts were summarized in Fig. S8. As shown in Fig. 9 , Co@Mo4/3B2O2 and Ru@Mo4/3B2O2 exhibit the best 4e− ORR activity, with overpotentials of 0.61 V and 0.63 V, respectively, close to the commonly used Pt catalyst (0.45 V) [44]. The adsorption-free energy of the intermediate *OOH (ΔG*OOH) was an important descriptor of 2e− ORR. In this work, Zn@Mo4/3B2O2 had the best 2e− ORR activity, with ΔG*OOH of −2.47 eV, close to the commonly used Pd catalyst (ΔG*OOH = −3.17 eV) [49]. This indicated that the three SACs studied in this project had the potential to replace traditional anode materials in PEMFCs. Based on the above analysis of adsorption and reaction path, we found that catalysts exhibiting an end-on O2 adsorption structure and following a standard ORR reaction pathway demonstrate the highest ORR activity. To further investigate the different adsorption structures of O2, diverse ORR reaction pathways, and the variation of ORR activity of 25 SACs, we calculated the electron transfer amount from the SACs to the intermediate *O2 and *OOH. The data were shown in Tables S4 and S5. Fig. S9a summarized the relationship between the electron transfer amount (Qe1) from the SACs to the intermediate *O2 and the adsorption structure. It was found that when 0.17 < Qe1 < 0.37, the adsorption structure of O2 was end-on adsorption. When 0.574 < Qe1 < 1.033, the adsorption structure changed to side-on structure, while when 1.464 < Qe1 < 1.899, it became a dissociation structure. It could be seen that the dissociation adsorption structure has the highest electron transfer number and the strongest adsorption of O2, followed by the side-on adsorption structure, and finally the end-on adsorption structure. Similarly, Fig. S9b summarized the relationship between the electron transfer amount (Qe2) from the 25 SACs to the intermediate *OOH and the ORR reaction pathway. It was found that when 0.144 < Qe2 < 0.41, the SACs follow the OOH dissociation pathway. When 0.45 < Qe2 < 0.37, the reaction mechanism changed to an OHOH dissociation mechanism, except for the Mn@Mo4/3B2O2, which follows the OHOH dissociation mechanism even though its electron transfer amount is only 0.331. In addition, when 1.13 < Qe2 < 1.475, the SACs began to follow the OOH dissociation mechanism. It could be seen that the fundamental reason for the different ORR reaction pathways is the different number of electrons obtained by intermediate *OOH from the SACs. According to the Sabatier principle, in the process of chemical reaction, the adsorption strength between the reaction intermediate and the substrate is too strong, which could lead to difficulties in desorbing the product [50]. Conversely, if the adsorption strength between the reaction intermediate and the substrate is too weak, it would hinder the substrate's ability to effectively immobilize the reactants. Therefore, effective catalytic reactions required a relatively moderate adsorption strength. So we calculated the integrated crystal orbital Hamilton population (ICOHP), which directly quantifies the bond strength between SACs and O*. By definition, a more negative ICOHP value represents a strong bonding strength. The volcanic plot with ICOHP and 4e− ORR overpotential as variables is plotted in Fig. 10 a. Co@Mo4/3B2O2 and Ru@Mo4/3B2O2 were located near the volcano peak, which was consistent with the previously calculated overpotential. The SACs with better activity can be screened according to the ICOHP value within the range of [−7.9, −5.4]. From the volcanic plot, it could be concluded that for the ORR reaction of the TM@Mo4/3B2O2 system, the essence of ORR activity lies in the ICOHP value between the SACs and the intermediate *O, which reflects the bond strength between the TM and the O atom in the intermediate *O. The stronger the bond strength, the more difficult it was for the subsequent intermediate *O to dehydrate, resulting in a decrease in ORR activity. The weaker the bond strength, the more difficult it was to adsorb O2, which also led to a decrease in ORR activity. In addition, we attempted to find and design a simple descriptor to provide atomic-scale insights into the relationship between the structure of SACs and ORR activity, aiming to summarize the rules of variation in 4e− ORR activity. As shown in Fig. S10, we investigated the relationship between the amount of electron transfer obtained by various intermediates such as *O2, *OOH, and *OH from SACs and the ORR overpotential. However, the fitting degree of all the models was not good. In previous reports, a series of descriptors involving various intrinsic properties of the catalyst, such as valence electrons (θTM) and electronegativity (λTM), have been the key factors affecting the ORR overpotential [51]. This phenomenon is attributed to the cooperative effect between the metal single atom (TM) and the Mo atoms in the substrate, resulting in the redistribution of the valence electrons of the loaded metal atoms. Additionally, electronegativity, which quantifies the electronic affinity of different atoms in forming chemical bonds, plays a significant role. Based on previous research, we propose a new descriptor as follows, (8) φ = Q OH * λ TM + λ MBene θ TM where QOH is the number of electrons obtained by the intermediate *OH from TM@Mo4/3B2O2. θTM represents the number of valence electrons of the TM. λTM and λMBene represents the electronegativity of the metal monatomic TM and MBene matrix, respectively. λMBene can be obtained through the following calculation. (9) λ MBene = n M MBene * λ M MBene + n B MBene * λ B MBene + n O MBene * λ O MBene + n H MBene * λ H MBene n M MBene + n B MBene + n O MBene + n H MBene here, n M MBene , n B MBene , n O MBene , n H MBene represent the number of atoms of the metal Mo element, B element, O element and H element in the MBene substrate, respectively. λ M MBene , λ B MBene , λ O MBene , λ H MBene represent the electronegativity of the corresponding metal Mo element, B element, O element and H element in the MBene matrix, respectively. These parameters can be easily obtained from the periodic table. As shown in Fig. 10b, the descriptor we proposed shows a good linear relationship with the 4e− ORR overpotential, with a fitting coefficient R2 of 0.9238. Therefore, our descriptors can provide guidance for the faster discovery of highly active ORR catalysts. Conclusion In summary, based on first-principles calculations, we investigated the ORR catalytic performance and reaction mechanism of TM@Mo4/3B2O2 composed of 3d, 4d, and 5d transition metal monatomic doping Mo4/3B2O2 with vacancy. Our research showed that there are four types of O2 adsorption structures and six ORR reaction pathways for 25 SACs. The number of electrons obtained from TM@Mo4/3B2O2 by the intermediates *O2 and *OOH determined the different O2 adsorption structures and reaction pathways of SACs. We found two descriptors ICOHP and φ to accurately describe the ORR catalytic activity. When the ICOHP value falls within the range of [−7.9, −5.4], the ORR activity is optimal. In addition, the lower the value of the descriptor φ, the lower the ORR overpotential. The 4e− ORR activity was found to be the best for Co@Mo4/3B2O2 (0.61 V) and Ru@Mo4/3B2O2 (0.63 V). The 2e− ORR activity was optimal for Zn@Mo4/3B2O2 (ΔG*OOH is −2.47 eV). These three SACs have the potential to serve as electrode materials for PEMFCs. Our research results not only highlight three feasible and cost-effective ORR SACs but also provide valuable guidance for finding efficient and economically feasible ORR electrocatalysts. CRediT authorship contribution statement Yuxiang Wang: Writing – review & editing, Writing – original draft, Visualization, Methodology, Investigation, Data curation, Conceptualization. Erpeng Wang: Writing – review & editing, Data curation. Ya Gao: Writing – review & editing, Data curation. Jian Zhou: Writing – review & editing, Supervision, Resources, Project administration, Data curation. Zhimei Sun: Supervision, Resources, Project administration, Funding acquisition. Declaration of competing interest The authors declare that they have no known competing financial interests or personal relationships that could have appeared to influence the work reported in this paper. Acknowledgements This work was supported by the National Key Research and Development Program of China (2022YFB3807200). We are very grateful for the support of the High-Performance Computing (HPC) resource platform of Beihang University. Supplementary materials Supplementary material associated with this article can be found, in the online version, at doi:10.1016/j.mcat.2024.114152. Appendix Supplementary materials Image, application 1 References [1] Y. Yu J. Zhou Z. Sun Novel 2d transition-metal carbides: ultrahigh performance electrocatalysts for overall water splitting and oxygen reduction Adv. Funct. Mater. 30 2020 2000570 Y. Yu, J. Zhou, Z. Sun, Novel 2d transition-metal carbides: ultrahigh performance electrocatalysts for overall water splitting and oxygen reduction, Adv. Funct. Mater. 30 (2020), 2000570. [2] Q. Peng J. Zhou J. Chen T. Zhang Z. Sun Cu single atoms on Ti2CO2 as a highly efficient oxygen reduction catalyst in a proton exchange membrane fuel cell J. Mater. Chem. A 7 45 2019 26062 26070 Q. Peng, J. Zhou, J. Chen, T. Zhang, Z. Sun, Cu single atoms on Ti2CO2 as a highly efficient oxygen reduction catalyst in a proton exchange membrane fuel cell, J. Mater. Chem. A 7 (45) (2019), 26062–26070. [3] X. Yang C. Shang S. Zhou J. Zhao MBenes: emerging 2d materials as efficient electrocatalysts for the nitrogen reduction reaction Nanoscale Horiz 5 2020 1106 1115 X. Yang, C. Shang, S. Zhou, J. Zhao, MBenes: emerging 2d materials as efficient electrocatalysts for the nitrogen reduction reaction, Nanoscale Horiz. 5 (2020) 1106–1115. [4] L. Yang L. Shi D. Wang Y. Lv D. Cao Single-atom cobalt electrocatalysts for foldable solid-state Zn-Air battery Nano Energy 50 2018 691 698 L. Yang, L. Shi, D. Wang, Y. Lv, D. Cao, Single-atom cobalt electrocatalysts for foldable solid-state Zn-Air battery, Nano Energy 50 (2018) 691–698. [5] J. Bai Y. Gao X. Jiang J. Li Z. Luo W. Ge Q. Zhou H. Xu Y. Deng Constructed surface-enriched atomically dispersed Co-N4 active sites via stepwise pyrolysis strategy for oxygen reduction Mol. Catal. 544 2023 113175 J. Bai, Y. Gao, X. Jiang, J. Li, Z. Luo, W. Ge, Q. Zhou, H. Xu, Y. Deng, Constructed surface-enriched atomically dispersed Co-N4 active sites via stepwise pyrolysis strategy for oxygen reduction, Mol. Catal. 544 (2023) 113175. [6] M.K. Debe Electrocatalyst approaches and challenges for automotive fuel cells Nature 486 7401 2012 43 51 M.K. Debe, Electrocatalyst approaches and challenges for automotive fuel cells, Nature 486 (7401) (2012) 43–51. [7] L. Yang D. Cheng H. Xu X. Zeng X. Wan J. Shui Z. Xiang D. Cao Unveiling the high-activity origin of single-atom iron catalysts for oxygen reduction reaction Proc. Natl. Acad. Sci. U. S. A. 115 26 2018 6626 6631 L. Yang, D. Cheng, H. Xu, X. Zeng, X. Wan, J. Shui, Z. Xiang, D. Cao, Unveiling the high-activity origin of single-atom iron catalysts for oxygen reduction reaction, Proc. Natl. Acad. Sci. U. S. A. 115 (26) (2018) 6626–6631. [8] Z. Fu C. Ling J. Wang A Ti3C2O2 supported single atom, trifunctional catalyst for electrochemical reactions J. Mater. Chem. A 8 16 2020 7801 7807 Z. Fu, C. Ling, J. Wang, A Ti3C2O2 supported single atom, trifunctional catalyst for electrochemical reactions, J. Mater. Chem. A 8 (16) (2020) 7801–7807. [9] D. Kan R. Lian D. Wang X. Zhang J. Xu X. Gao Y. Yu G. Chen Yi. Wei Screening effective single-atom ORR and OER electrocatalysts from Pt decorated MXenes by first-principles calculations J. Mater. Chem. A 8 33 2020 17065 17077 D. Kan, R. Lian, D. Wang, X. Zhang, J. Xu, X. Gao, Y. Yu, G. Chen, Yi. Wei, Screening effective single-atom ORR and OER electrocatalysts from Pt decorated MXenes by first-principles calculations, J. Mater. Chem. A 8 (33) (2020) 17065–17077. [10] B. Wei Z. Fu D. Legut T.C. Germann S. Du H. Zhang J.S. Francisco R. Zhang Rational design of highly stable and active MXene-based bifunctional ORR/OER double-atom catalysts Adv. Mater. 33 40 2021 2102595 B. Wei, Z. Fu, D. Legut, T.C. Germann, S. Du, H. Zhang, J.S. Francisco, R. Zhang, Rational design of highly stable and active MXene-based bifunctional ORR/OER double-atom catalysts, Adv. Mater. 33 (40) (2021) 2102595. [11] X. Huang W. Zhang W. Liu J. Zhang M. Song C. Zhang J. Zhang D. Wang Nb2CTX MXenes functionalized Co-NC enhancing electrochemical H2O2 production for organics degradation Appl. Catal. B-Environ. 317 2022 121737 X. Huang, W. Zhang, W. Liu, J. Zhang, M. Song, C. Zhang, J. Zhang, D. Wang, Nb2CTX MXenes functionalized Co-NC enhancing electrochemical H2O2 production for organics degradation, Appl. Catal. B-Environ. 317 (2022) 121737. [12] H. Li S. Kelly D. Guevarra Z. Wang Y. Wang J.A. Haber M. Anand G.T. Kasun K. Gunasooriya C.S. Abraham S. Vijay J.M. Gregoire J.K. Nørskov Analysis of the limitations in the oxygen reduction activity of transition metal oxide surfaces Nat. Catal. 4 6 2021 463 468 H. Li, S. Kelly, D. Guevarra, Z. Wang, Y. Wang, J.A. Haber, M. Anand, G.T. Kasun, K. Gunasooriya, C.S. Abraham, S. Vijay, J.M. Gregoire, J.K. Nørskov, Analysis of the limitations in the oxygen reduction activity of transition metal oxide surfaces, Nat. Catal. 4 (6) (2021) 463–468. [13] K. Huang Y. Sun Y. Zhang X. Wang W. Zhang S. Feng Hollow-structured metal oxides as oxygen-related catalysts Adv. Mater. 31 38 2019 1801430 K. Huang, Y. Sun, Y. Zhang, X. Wang, W. Zhang, S. Feng, Hollow-structured metal oxides as oxygen-related catalysts, Adv. Mater. 31 (38) (2019) 1801430. [14] F. Ando T. Gunji T. Tanabe I. Fukano H.D. Abruña J. Wu T. Ohsaka F. Matsumoto Enhancement of the oxygen reduction reaction activity of Pt by tuning its d-band center via transition metal oxide support interactions ACS Catal 11 15 2021 9317 9332 F. Ando, T. Gunji, T. Tanabe, I. Fukano, H.D. Abruña, J. Wu, T. Ohsaka, F. Matsumoto, Enhancement of the oxygen reduction reaction activity of Pt by tuning its d-band center via transition metal oxide support interactions, ACS Catal. 11 (15) (2021) 9317–9332. [15] Y. Yue J. Niu C. Yang J. Qin X. Zhang R. Liu The OER/ORR activities of copper oxyhydroxide series electrocatalysts Mol. Catal. 537 2023 112942 Y. Yue, J. Niu, C. Yang, J. Qin, X. Zhang, R. Liu, The OER/ORR activities of copper oxyhydroxide series electrocatalysts, Mol. Catal. 537 (2023) 112942. [16] S. Yu Z. Levell Z. Jiang X. Zhao Y. Liu What is the rate-limiting step of oxygen reduction reaction on Fe-N-C catalysts? J. Am. Chem. Soc. 145 46 2023 25352 25356 S. Yu, Z. Levell, Z. Jiang, X. Zhao, Y. Liu, What is the rate-limiting step of oxygen reduction reaction on Fe-N-C catalysts?, J. Am. Chem. Soc. 145 (46) (2023) 25352–25356. [17] X. Zhang Z. Yang Z. Lu W. Wang Bifunctional CoNx embedded graphene electrocatalysts for OER and ORR: a theoretical evaluation Carbon N Y 130 2018 112 119 X. Zhang, Z. Yang, Z. Lu, W. Wang, Bifunctional CoNx embedded graphene electrocatalysts for OER and ORR: a theoretical evaluation, Carbon N Y 130 (2018) 112–119. [18] L. Sahoo R. Garg K. Kaur C.P. Vinod U.K. Gautam Ultrathin twisty PdNi alloy nanowires as highly active ORR electrocatalysts exhibiting morphology-induced durability over 200 K cycles Nano Lett. 22 1 2022 246 254 L. Sahoo, R. Garg, K. Kaur, C.P. Vinod, U.K. Gautam, Ultrathin twisty PdNi alloy nanowires as highly active ORR electrocatalysts exhibiting morphology-induced durability over 200 K cycles, Nano Lett.. 22 (1) (2022) 246–254. [19] Q. Xue H. Sun Y. Li M. Zhon F. Li X. Tian P. Chen S. Yin Y. Chen Au@Ir core-shell nanowires towards oxygen reduction reaction Chem. Eng. J. 421 2021 129760 Q. Xue, H. Sun, Y. Li, M. Zhon, F. Li, X. Tian, P. Chen, S. Yin, Y. Chen, Au@Ir core-shell nanowires towards oxygen reduction reaction, Chem. Eng. J. 421 (2021) 129760. [20] K. Huang Y. Hui Z. Yang M. Waqas F. Fan L. Wang X. Liu Q. Huang D. Huang D. Chen Y. Fan W. Chen N, S co-doped carbon film wrapped Co nanoparticles for boosting oxygen reduction reaction Mol. Catal. 541 2023 113102 K. Huang, Y. Hui, Z. Yang, M. Waqas, F. Fan, L. Wang, X. Liu, Q. Huang, D. Huang, D. Chen, Y. Fan, W. Chen, N, S co-doped carbon film wrapped Co nanoparticles for boosting oxygen reduction reaction, Mol. Catal. 541 (2023) 113102. [21] B. Huang X. Zhao Y. Pei First principles calculation study of single transition metal atom grafted Au25 as efficient electrocatalysts for OER and ORR Mol. Catal. 540 2023 113030 B. Huang, X. Zhao, Y. Pei, First principles calculation study of single transition metal atom grafted Au25 as efficient electrocatalysts for OER and ORR, Mol. Catal. 540 (2023) 113030. [22] Y. Zhu W. Zhou Z. Shao Perovskite/Carbon Composites: applications in Oxygen Electrocatalysis Small 13 12 2017 1603793 Y. Zhu, W. Zhou, Z. Shao, Perovskite/Carbon Composites: applications in Oxygen Electrocatalysis, Small 13 (12) (2017) 1603793. [23] C.E. Beall E. Fabbri T.J. Schmidt Perovskite oxide based electrodes for the oxygen reduction and evolution reactions: the underlying mechanism ACS Catal 11 5 2021 3094 3114 C.E. Beall, E. Fabbri, T.J. Schmidt, Perovskite oxide based electrodes for the oxygen reduction and evolution reactions: the underlying mechanism, ACS Catal. 11 (5) (2021) 3094–3114. [24] X. Wei C. Jiang H. Xu Y. Ouyang Z. Wang C. Lu X. Lu J. Pang F. Dai X. Bu Synergistic effect of organic ligands on metal site spin states in 2D metal-organic frameworks for enhanced ORR performance ACS Catal 13 24 2023 15663 15672 X. Wei, C. Jiang, H. Xu, Y. Ouyang, Z. Wang, C. Lu, X. Lu, J. Pang, F. Dai, X. Bu, Synergistic effect of organic ligands on metal site spin states in 2D metal-organic frameworks for enhanced ORR performance, ACS Catal. 13 (24) (2023) 15663–15672. [25] A. Wang H. Niu X. Wang X. Wan L. Xie Z. Zhang J. Wang Y. Guo Two-dimensional metal-organic frameworks as efficient electrocatalysts for bifunctional oxygen evolution/reduction reactions J. Mater. Chem. A 10 24 2022 13005 13012 A. Wang, H. Niu, X. Wang, X. Wan, L. Xie, Z. Zhang, J. Wang, Y. Guo, Two-dimensional metal-organic frameworks as efficient electrocatalysts for bifunctional oxygen evolution/reduction reactions, J. Mater. Chem. A 10 (24) (2022) 13005–13012. [26] Z. Guo J. Zhou Z. Sun New two-dimensional transition metal borides for Li ion batteries and electrocatalysis J. Mater. Chem. A 5 45 2017 23530 23535 Z. Guo, J. Zhou, Z. Sun, New two-dimensional transition metal borides for Li ion batteries and electrocatalysis, J. Mater. Chem. A 5 (45) (2017) 23530–23535. [27] S. Qi Y. Fan L. Zhao W. Li M. Zhao Two-dimensional transition metal borides as highly efficient N2 fixation catalysts Appl. Surf. Sci. 536 2021 147742 S. Qi, Y. Fan, L. Zhao, W. Li, M. Zhao, Two-dimensional transition metal borides as highly efficient N2 fixation catalysts, Appl. Surf. Sci. 536 (2021), 147742. [28] B. Zhang J. Zhou Z. Guo Q. Peng Z. Sun Two-dimensional chromium boride MBenes with high HER catalytic activity Appl. Surf. Sci. 500 2020 144248 B. Zhang, J. Zhou, Z. Guo, Q. Peng, Z. Sun, Two-dimensional chromium boride MBenes with high HER catalytic activity, Appl. Surf. Sci. 500 (2020), 144248. [29] F. Li G. Han H. Noh S. Kim Y. Lu H. Jeong Z. Fu J. Baek Boosting oxygen reduction catalysis with abundant copper single atom active sites Energy Environ. Sci. 11 8 2018 2263 2269 F. Li, G. Han, H. Noh, S. Kim, Y. Lu, H. Jeong, Z. Fu, J. Baek, Boosting oxygen reduction catalysis with abundant copper single atom active sites, Energy Environ. Sci. 11 (8) (2018) 2263–2269. [30] X. Yang A. Wang B. Qiao J. Li J. Liu. T. Zhang Single-atom catalysts: a new frontier in heterogeneous catalysis Acc. Chem. Res. 46 8 2013 1740 1748 X. Yang, A. Wang, B. Qiao, J. Li, J. Liu. T. Zhang, Single-atom catalysts: a new frontier in heterogeneous catalysis, Acc. Chem. Res. 46 (8) (2013) 1740–1748. [31] J. Wu H. Zhou Q. Li M. Chen J. Wan N. Zhang K. Xiong S. Li B.Y. Xia G. Feng M. Liu L. Huang Densely populated isolated single Co-N site for efficient oxygen electrocatalysis Adv. Energy Mater. 9 22 2019 1900149 J. Wu, H. Zhou, Q. Li, M. Chen, J. Wan, N. Zhang, K. Xiong, S. Li, B.Y. Xia, G. Feng, M. Liu, L. Huang, Densely populated isolated single Co-N site for efficient oxygen electrocatalysis, Adv. Energy Mater. 9 (22) (2019), 1900149. [32] L. Zhong S. Li Unconventional oxygen reduction reaction mechanism and scaling relation on single-atom catalysts ACS Catal 10 7 2020 4313 4318 L. Zhong, S. Li, Unconventional oxygen reduction reaction mechanism and scaling relation on single-atom catalysts, ACS Catal. 10 (7) (2020) 4313–4318. [33] H. Fei J. Dong Y. Feng C.S. Allen C. Wan B. Volosskiy M. Li Z. Zhao Y. Wang H. Sun P. An W. Chen Z. Guo C. Lee D. Chen I. Shakir M. Liu T. Hu Y. Li A. Kirkland X. Duan Y. Huang General synthesis and definitive structural identification of Mn4C4 single-atom catalysts with tunable electrocatalytic activities Nat. Catal. 1 1 2018 63 72 H. Fei, J. Dong, Y. Feng, C.S. Allen, C. Wan, B. Volosskiy, M. Li, Z. Zhao, Y. Wang, H. Sun, P. An, W. Chen, Z. Guo, C. Lee, D. Chen, I. Shakir, M. Liu, T. Hu, Y. Li, A. Kirkland, X. Duan, Y. Huang, General synthesis and definitive structural identification of Mn4C4 single-atom catalysts with tunable electrocatalytic activities, Nat. Catal. 1 (1) (2018) 63–72. [34] C. Ling L. Shi Y. Ouyang X. Zeng J. Wang Nanosheet supported single-metal atom bifunctional catalyst for overall water splitting Nano Lett 17 8 2017 5133 5139 C. Ling, L. Shi, Y. Ouyang, X. Zeng, J. Wang, Nanosheet supported single-metal atom bifunctional catalyst for overall water splitting, Nano Lett. 17 (8) (2017) 5133–5139. [35] L. Luo J. Luo H. Li F. Ren Y. Zhang A. Liu W. Li J. Zeng Water enables mild oxidation of methane to methanol on gold single-atom catalysts Nat. Commun. 12 1 2021 1218 L. Luo, J. Luo, H. Li, F. Ren, Y. Zhang, A. Liu, W. Li, J. Zeng, Water enables mild oxidation of methane to methanol on gold single-atom catalysts, Nat. Commun. 12 (1) (2021) 1218. [36] T. Zhang B. Zhang Q. Peng J. Zhou Z. Sun Mo2B2 MBene-supported single-atom catalysts as bifunctional HER/OER and OER/ORR electrocatalysts J. Mater. Chem. A 9 1 2021 433 441 T. Zhang, B. Zhang, Q. Peng, J. Zhou, Z. Sun, Mo2B2 MBene-supported single-atom catalysts as bifunctional HER/OER and OER/ORR electrocatalysts, J. Mater. Chem. A 9 (1) (2021) 433–441. [37] E. Wang B. Zhang J. Zhou Z. Sun High catalytic activity of MBenes-supported single atom catalysts for oxygen reduction and oxygen evolution reaction Appl. Surf. Sci. 604 2022 154522 E. Wang, B. Zhang, J. Zhou, Z. Sun, High catalytic activity of MBenes-supported single atom catalysts for oxygen reduction and oxygen evolution reaction, Appl. Surf. Sci. 604 (2022) 154522. [38] Y. Gao E. Wang Y. Zheng J. Zhou Z. Sun Hexagonal MBenes-supported single atom as electrocatalysts for the nitrogen reduction reaction Energy Mater. Adv. 4 2023 0039 Y. Gao, E. Wang, Y. Zheng, J. Zhou, Z. Sun, Hexagonal MBenes-supported single atom as electrocatalysts for the nitrogen reduction reaction, Energy Mater. Adv. 4 (2023) 0039. [39] Y. Zheng Y. Jiao Y. Zhu Q. Cai A. Vasileff L. Li Y. Han Y. Chen S. Qiao Molecule-level g-C3N4 coordinated transition metals as a new class of electrocatalysts for oxygen electrode reactions J. Am. Chem. Soc. 139 9 2017 3336 3339 Y. Zheng, Y. Jiao, Y. Zhu, Q. Cai, A. Vasileff, L. Li, Y. Han, Y. Chen, S. Qiao, Molecule-level g-C3N4 coordinated transition metals as a new class of electrocatalysts for oxygen electrode reactions, J. Am. Chem. Soc. 139 (9) (2017) 3336–3339. [40] G. Kresse J. Furthmüller Efficient iterative schemes for ab initio total-energy calculations using a plane-wave basis set Phys. Rev. B 54 16 1996 11169 11186 G. Kresse, J. Furthmüller, Efficient iterative schemes for ab initio total-energy calculations using a plane-wave basis set, Phys. Rev. B 54 (16) (1996) 11169–11186. [41] J.P. Perdew K. Burke M. Ernzerhof Generalized gradient approximation made simple Phys. Rev. Lett. 77 18 1996 3865 3868 J.P. Perdew, K. Burke, M. Ernzerhof, Generalized gradient approximation made simple, Phys. Rev. Lett. 77 (18) (1996) 3865–3868. [42] J.P. Perdew Y. Wang Accurate and simple analytic representation of the electron- gas correlation energy Phys. Rev. B 45 23 1992 13244 13249 J.P. Perdew, Y. Wang, Accurate and simple analytic representation of the electron- gas correlation energy, Phys. Rev. B 45 (23) (1992) 13244–13249. [43] J. Moellmann S. Grimme DFT-D3 study of some molecular crystals J. Phys. Chem. C 118 14 2014 7615 7621 J. Moellmann, S. Grimme, DFT-D3 study of some molecular crystals, J. Phys. Chem. C 118 (14) (2014) 7615–7621. [44] J.K. Nørskov J. Rossmeisl A. Logadottir L. Lindqvist J.R. Kitchin T. Bligaard H. Jónsson Origin of the overpotential for oxygen reduction at a fuel-cell cathode J. Phys. Chem. B 108 46 2004 17886 17892 J.K. Nørskov, J. Rossmeisl, A. Logadottir, L. Lindqvist, J.R. Kitchin, T. Bligaard, H. Jónsson, Origin of the overpotential for oxygen reduction at a fuel-cell cathode, J. Phys. Chem. B 108 (46) (2004) 17886–17892. [45] J. Zhou J. Palisaitis J. Halim M. Dahlqvist Q. Tao I. Persson L. Hultman P. Persson J. Rosen Boridene: two-dimensional Mo4/3B2-x with ordered metal vacancies obtained by chemical exfoliation Science 373 6556 2021 801 805 J. Zhou, J. Palisaitis, J. Halim, M. Dahlqvist, Q. Tao, I. Persson, L. Hultman, P. Persson, J. Rosen, Boridene: two-dimensional Mo4/3B2-x with ordered metal vacancies obtained by chemical exfoliation, Science 373 (6556) (2021) 801–805. [46] H. Wu Z. Ga F. Ma Z. Tian Y. Liu Y. Jiao A. Du Surface functionalization of two-dimensional boridene family: enhanced stability, tunable electronic property, and high catalytic activity Appl. Surf. Sci. 602 2022 154374 H. Wu, Z. Ga, F. Ma, Z. Tian, Y. Liu, Y. Jiao, A. Du, Surface functionalization of two-dimensional boridene family: enhanced stability, tunable electronic property, and high catalytic activity, Appl. Surf. Sci. 602 (2022) 154374. [47] J. Wan W. Chen C. Jia L. Zheng J. Dong X. Zheng Y. Wang W. Yan C. Chen Q. Peng D. Wang Y. Li Defect effects on TiO2 nanosheets: stabilizing single atomic site Au and promoting catalytic properties Adv. Mater. 30 11 2018 1705369 J. Wan, W. Chen, C. Jia, L. Zheng, J. Dong, X. Zheng, Y. Wang, W. Yan, C. Chen, Q. Peng, D. Wang, Y. Li, Defect effects on TiO2 nanosheets: stabilizing single atomic site Au and promoting catalytic properties, Adv. Mater. 30 (11) (2018) 1705369. [48] Y. Nie L. Li Z. Wei Recent advancements in Pt and Pt-free catalysts for oxygen reduction reaction Chem. Soc. Rev. 44 8 2015 2168 2201 Y. Nie, L. Li, Z. Wei, Recent advancements in Pt and Pt-free catalysts for oxygen reduction reaction, Chem. Soc. Rev. 44 (8) (2015) 2168–2201. [49] S. Siahrostami A. Verdaguer-Casadevall M. Karamad D. Deiana P. Malacrida B. Wickman M. Escudero-Escribano E. Paoli R. Frydendal T. Hansen I. Chorkendorff I. Stephens J. Rossmeisl Enabling direct H2O2 production through rational electrocatalyst design Nat. Mater. 12 12 2013 1137 1143 S. Siahrostami, A. Verdaguer-Casadevall, M. Karamad, D. Deiana, P. Malacrida, B. Wickman, M. Escudero-Escribano, E. Paoli, R. Frydendal, T. Hansen, I. Chorkendorff, I. Stephens, J. Rossmeisl, Enabling direct H2O2 production through rational electrocatalyst design, Nat. Mater. 12 (12) (2013) 1137–1143. [50] Y. Jiao Y. Zheng M. Jaroniec S. Qiao Design of electrocatalysts for oxygen-and hydrogen-involving energy conversion reactions Chem. Soc. Rev. 44 8 2015 2060 2086 Y. Jiao, Y. Zheng, M. Jaroniec, S. Qiao, Design of electrocatalysts for oxygen-and hydrogen-involving energy conversion reactions, Chem. Soc. Rev. 44 (8) (2015) 2060–2086. [51] Y. Chen X. Zhang J. Qin R. Liu Taming the challenges of activity and selectivity in catalysts for electrochemical N2 fixation via single metal atom supported on WS2 Appl. Surf. Sci. 571 2022 151357 Y. Chen, X. Zhang, J. Qin, R. Liu. Taming the challenges of activity and selectivity in catalysts for electrochemical N2 fixation via single metal atom supported on WS2, Appl. Surf. Sci. 571 (2022) 151357.",
      "scopus-id": "85190525315",
      "coredata": {
        "eid": "1-s2.0-S2468823124003353",
        "dc:description": "Exploring earth-abundant and inexpensive electrocatalysts to realize efficient oxygen reduction reaction (ORR) is urgently desired. In this work, through first-principles calculations, we have strategically designed a series of single-atom catalysts (SACs) for ORR by immobilizing single atoms on the surface of Mo4/3B2O2, denoted as TM@Mo4/3B2O2 (TM representing 3d, 4d, and 5d transition metal atoms, excluding Tc and Hg). Significantly, for 4e− ORR, the best catalyst was Co@Mo4/3B2O2 and Ru@Mo4/3B2O2, with an overpotential of 0.61 V and 0.63 V, close to the commonly used Pt catalyst (0.45 V). In 2e− ORR, Zn@Mo4/3B2O2 had the best catalytic activity, with a ΔG*OOH of -2.47 eV, close to the commonly used Pd catalyst (ΔG*OOH = -3.17 eV). By calculating the electronic properties of SACs, it was found that the number of electrons gained by the intermediate *O2 and *OOH from the SACs determines the O2 adsorption structures and ORR reaction pathways. In addition, there are two descriptors: ICOHP and a composition descriptor which provides atomic-level insights, that were found to summarize the ORR activity rules. Our work enriches the applications of the MBenes family in catalysis, and provides feasible guidance for the design of low-cost and high-effect ORR catalysts.",
        "openArchiveArticle": "false",
        "prism:coverDate": "2024-05-01",
        "openaccessUserLicense": null,
        "prism:aggregationType": "Journal",
        "prism:url": "https://api.elsevier.com/content/article/pii/S2468823124003353",
        "dc:creator": [
          {
            "@_fa": "true",
            "$": "Wang, Yuxiang"
          },
          {
            "@_fa": "true",
            "$": "Wang, Erpeng"
          },
          {
            "@_fa": "true",
            "$": "Gao, Ya"
          },
          {
            "@_fa": "true",
            "$": "Zhou, Jian"
          },
          {
            "@_fa": "true",
            "$": "Sun, Zhimei"
          }
        ],
        "link": [
          {
            "@_fa": "true",
            "@rel": "self",
            "@href": "https://api.elsevier.com/content/article/pii/S2468823124003353"
          },
          {
            "@_fa": "true",
            "@rel": "scidir",
            "@href": "https://www.sciencedirect.com/science/article/pii/S2468823124003353"
          }
        ],
        "dc:format": "application/json",
        "openaccessType": null,
        "pii": "S2468-8231(24)00335-3",
        "prism:volume": "560",
        "articleNumber": "114152",
        "prism:publisher": "Elsevier B.V.",
        "dc:title": "Mo4/3B2O2-supported single-atom catalysts for oxygen reduction reaction",
        "prism:copyright": "© 2024 Elsevier B.V. All rights reserved.",
        "openaccess": "0",
        "prism:issn": "24688231",
        "dcterms:subject": [
          {
            "@_fa": "true",
            "$": "Single-atom catalyst"
          },
          {
            "@_fa": "true",
            "$": "Oxygen reduction reaction"
          },
          {
            "@_fa": "true",
            "$": "First-principles"
          },
          {
            "@_fa": "true",
            "$": "Electrocatalysis"
          }
        ],
        "openaccessArticle": "false",
        "prism:publicationName": "Molecular Catalysis",
        "openaccessSponsorType": null,
        "prism:pageRange": "114152",
        "pubType": "fla",
        "prism:coverDisplayDate": "1 May 2024",
        "prism:doi": "10.1016/j.mcat.2024.114152",
        "prism:startingPage": "114152",
        "dc:identifier": "doi:10.1016/j.mcat.2024.114152",
        "openaccessSponsorName": null
      },
      "objects": {
        "object": [
          {
            "@category": "standard",
            "@height": "205",
            "@width": "585",
            "@_fa": "true",
            "$": "https://api.elsevier.com/content/object/eid/1-s2.0-S2468823124003353-gr10.jpg?httpAccept=%2A%2F%2A",
            "@multimediatype": "JPEG image file",
            "@type": "IMAGE-DOWNSAMPLED",
            "@size": "41430",
            "@ref": "gr10",
            "@mimetype": "image/jpeg"
          },
          {
            "@category": "standard",
            "@height": "208",
            "@width": "529",
            "@_fa": "true",
            "$": "https://api.elsevier.com/content/object/eid/1-s2.0-S2468823124003353-gr6.jpg?httpAccept=%2A%2F%2A",
            "@multimediatype": "JPEG image file",
            "@type": "IMAGE-DOWNSAMPLED",
            "@size": "50036",
            "@ref": "gr6",
            "@mimetype": "image/jpeg"
          },
          {
            "@category": "standard",
            "@height": "220",
            "@width": "529",
            "@_fa": "true",
            "$": "https://api.elsevier.com/content/object/eid/1-s2.0-S2468823124003353-gr7.jpg?httpAccept=%2A%2F%2A",
            "@multimediatype": "JPEG image file",
            "@type": "IMAGE-DOWNSAMPLED",
            "@size": "51346",
            "@ref": "gr7",
            "@mimetype": "image/jpeg"
          },
          {
            "@category": "standard",
            "@height": "213",
            "@width": "604",
            "@_fa": "true",
            "$": "https://api.elsevier.com/content/object/eid/1-s2.0-S2468823124003353-gr8.jpg?httpAccept=%2A%2F%2A",
            "@multimediatype": "JPEG image file",
            "@type": "IMAGE-DOWNSAMPLED",
            "@size": "55146",
            "@ref": "gr8",
            "@mimetype": "image/jpeg"
          },
          {
            "@category": "standard",
            "@height": "183",
            "@width": "585",
            "@_fa": "true",
            "$": "https://api.elsevier.com/content/object/eid/1-s2.0-S2468823124003353-gr9.jpg?httpAccept=%2A%2F%2A",
            "@multimediatype": "JPEG image file",
            "@type": "IMAGE-DOWNSAMPLED",
            "@size": "27318",
            "@ref": "gr9",
            "@mimetype": "image/jpeg"
          },
          {
            "@category": "standard",
            "@height": "247",
            "@width": "604",
            "@_fa": "true",
            "$": "https://api.elsevier.com/content/object/eid/1-s2.0-S2468823124003353-gr2.jpg?httpAccept=%2A%2F%2A",
            "@multimediatype": "JPEG image file",
            "@type": "IMAGE-DOWNSAMPLED",
            "@size": "72933",
            "@ref": "gr2",
            "@mimetype": "image/jpeg"
          },
          {
            "@category": "standard",
            "@height": "174",
            "@width": "500",
            "@_fa": "true",
            "$": "https://api.elsevier.com/content/object/eid/1-s2.0-S2468823124003353-ga1.jpg?httpAccept=%2A%2F%2A",
            "@multimediatype": "JPEG image file",
            "@type": "IMAGE-DOWNSAMPLED",
            "@size": "32783",
            "@ref": "ga1",
            "@mimetype": "image/jpeg"
          },
          {
            "@category": "standard",
            "@height": "349",
            "@width": "393",
            "@_fa": "true",
            "$": "https://api.elsevier.com/content/object/eid/1-s2.0-S2468823124003353-gr3.jpg?httpAccept=%2A%2F%2A",
            "@multimediatype": "JPEG image file",
            "@type": "IMAGE-DOWNSAMPLED",
            "@size": "59244",
            "@ref": "gr3",
            "@mimetype": "image/jpeg"
          },
          {
            "@category": "standard",
            "@height": "208",
            "@width": "529",
            "@_fa": "true",
            "$": "https://api.elsevier.com/content/object/eid/1-s2.0-S2468823124003353-gr4.jpg?httpAccept=%2A%2F%2A",
            "@multimediatype": "JPEG image file",
            "@type": "IMAGE-DOWNSAMPLED",
            "@size": "54648",
            "@ref": "gr4",
            "@mimetype": "image/jpeg"
          },
          {
            "@category": "standard",
            "@height": "228",
            "@width": "529",
            "@_fa": "true",
            "$": "https://api.elsevier.com/content/object/eid/1-s2.0-S2468823124003353-gr5.jpg?httpAccept=%2A%2F%2A",
            "@multimediatype": "JPEG image file",
            "@type": "IMAGE-DOWNSAMPLED",
            "@size": "51354",
            "@ref": "gr5",
            "@mimetype": "image/jpeg"
          },
          {
            "@category": "standard",
            "@height": "206",
            "@width": "679",
            "@_fa": "true",
            "$": "https://api.elsevier.com/content/object/eid/1-s2.0-S2468823124003353-gr1.jpg?httpAccept=%2A%2F%2A",
            "@multimediatype": "JPEG image file",
            "@type": "IMAGE-DOWNSAMPLED",
            "@size": "46277",
            "@ref": "gr1",
            "@mimetype": "image/jpeg"
          },
          {
            "@category": "thumbnail",
            "@height": "77",
            "@width": "219",
            "@_fa": "true",
            "$": "https://api.elsevier.com/content/object/eid/1-s2.0-S2468823124003353-gr10.sml?httpAccept=%2A%2F%2A",
            "@multimediatype": "GIF image file",
            "@type": "IMAGE-THUMBNAIL",
            "@size": "7957",
            "@ref": "gr10",
            "@mimetype": "image/gif"
          },
          {
            "@category": "thumbnail",
            "@height": "86",
            "@width": "219",
            "@_fa": "true",
            "$": "https://api.elsevier.com/content/object/eid/1-s2.0-S2468823124003353-gr6.sml?httpAccept=%2A%2F%2A",
            "@multimediatype": "GIF image file",
            "@type": "IMAGE-THUMBNAIL",
            "@size": "11221",
            "@ref": "gr6",
            "@mimetype": "image/gif"
          },
          {
            "@category": "thumbnail",
            "@height": "91",
            "@width": "219",
            "@_fa": "true",
            "$": "https://api.elsevier.com/content/object/eid/1-s2.0-S2468823124003353-gr7.sml?httpAccept=%2A%2F%2A",
            "@multimediatype": "GIF image file",
            "@type": "IMAGE-THUMBNAIL",
            "@size": "11566",
            "@ref": "gr7",
            "@mimetype": "image/gif"
          },
          {
            "@category": "thumbnail",
            "@height": "77",
            "@width": "219",
            "@_fa": "true",
            "$": "https://api.elsevier.com/content/object/eid/1-s2.0-S2468823124003353-gr8.sml?httpAccept=%2A%2F%2A",
            "@multimediatype": "GIF image file",
            "@type": "IMAGE-THUMBNAIL",
            "@size": "10294",
            "@ref": "gr8",
            "@mimetype": "image/gif"
          },
          {
            "@category": "thumbnail",
            "@height": "68",
            "@width": "219",
            "@_fa": "true",
            "$": "https://api.elsevier.com/content/object/eid/1-s2.0-S2468823124003353-gr9.sml?httpAccept=%2A%2F%2A",
            "@multimediatype": "GIF image file",
            "@type": "IMAGE-THUMBNAIL",
            "@size": "5938",
            "@ref": "gr9",
            "@mimetype": "image/gif"
          },
          {
            "@category": "thumbnail",
            "@height": "90",
            "@width": "219",
            "@_fa": "true",
            "$": "https://api.elsevier.com/content/object/eid/1-s2.0-S2468823124003353-gr2.sml?httpAccept=%2A%2F%2A",
            "@multimediatype": "GIF image file",
            "@type": "IMAGE-THUMBNAIL",
            "@size": "13534",
            "@ref": "gr2",
            "@mimetype": "image/gif"
          },
          {
            "@category": "thumbnail",
            "@height": "76",
            "@width": "219",
            "@_fa": "true",
            "$": "https://api.elsevier.com/content/object/eid/1-s2.0-S2468823124003353-ga1.sml?httpAccept=%2A%2F%2A",
            "@multimediatype": "GIF image file",
            "@type": "IMAGE-THUMBNAIL",
            "@size": "7919",
            "@ref": "ga1",
            "@mimetype": "image/gif"
          },
          {
            "@category": "thumbnail",
            "@height": "164",
            "@width": "185",
            "@_fa": "true",
            "$": "https://api.elsevier.com/content/object/eid/1-s2.0-S2468823124003353-gr3.sml?httpAccept=%2A%2F%2A",
            "@multimediatype": "GIF image file",
            "@type": "IMAGE-THUMBNAIL",
            "@size": "13393",
            "@ref": "gr3",
            "@mimetype": "image/gif"
          },
          {
            "@category": "thumbnail",
            "@height": "86",
            "@width": "219",
            "@_fa": "true",
            "$": "https://api.elsevier.com/content/object/eid/1-s2.0-S2468823124003353-gr4.sml?httpAccept=%2A%2F%2A",
            "@multimediatype": "GIF image file",
            "@type": "IMAGE-THUMBNAIL",
            "@size": "11898",
            "@ref": "gr4",
            "@mimetype": "image/gif"
          },
          {
            "@category": "thumbnail",
            "@height": "94",
            "@width": "219",
            "@_fa": "true",
            "$": "https://api.elsevier.com/content/object/eid/1-s2.0-S2468823124003353-gr5.sml?httpAccept=%2A%2F%2A",
            "@multimediatype": "GIF image file",
            "@type": "IMAGE-THUMBNAIL",
            "@size": "11733",
            "@ref": "gr5",
            "@mimetype": "image/gif"
          },
          {
            "@category": "thumbnail",
            "@height": "66",
            "@width": "219",
            "@_fa": "true",
            "$": "https://api.elsevier.com/content/object/eid/1-s2.0-S2468823124003353-gr1.sml?httpAccept=%2A%2F%2A",
            "@multimediatype": "GIF image file",
            "@type": "IMAGE-THUMBNAIL",
            "@size": "8228",
            "@ref": "gr1",
            "@mimetype": "image/gif"
          },
          {
            "@category": "high",
            "@height": "908",
            "@width": "2592",
            "@_fa": "true",
            "$": "https://api.elsevier.com/content/object/eid/1-s2.0-S2468823124003353-gr10_lrg.jpg?httpAccept=%2A%2F%2A",
            "@multimediatype": "JPEG image file",
            "@type": "IMAGE-HIGH-RES",
            "@size": "328926",
            "@ref": "gr10",
            "@mimetype": "image/jpeg"
          },
          {
            "@category": "high",
            "@height": "920",
            "@width": "2342",
            "@_fa": "true",
            "$": "https://api.elsevier.com/content/object/eid/1-s2.0-S2468823124003353-gr6_lrg.jpg?httpAccept=%2A%2F%2A",
            "@multimediatype": "JPEG image file",
            "@type": "IMAGE-HIGH-RES",
            "@size": "438026",
            "@ref": "gr6",
            "@mimetype": "image/jpeg"
          },
          {
            "@category": "high",
            "@height": "974",
            "@width": "2342",
            "@_fa": "true",
            "$": "https://api.elsevier.com/content/object/eid/1-s2.0-S2468823124003353-gr7_lrg.jpg?httpAccept=%2A%2F%2A",
            "@multimediatype": "JPEG image file",
            "@type": "IMAGE-HIGH-RES",
            "@size": "448874",
            "@ref": "gr7",
            "@mimetype": "image/jpeg"
          },
          {
            "@category": "high",
            "@height": "943",
            "@width": "2675",
            "@_fa": "true",
            "$": "https://api.elsevier.com/content/object/eid/1-s2.0-S2468823124003353-gr8_lrg.jpg?httpAccept=%2A%2F%2A",
            "@multimediatype": "JPEG image file",
            "@type": "IMAGE-HIGH-RES",
            "@size": "466288",
            "@ref": "gr8",
            "@mimetype": "image/jpeg"
          },
          {
            "@category": "high",
            "@height": "810",
            "@width": "2592",
            "@_fa": "true",
            "$": "https://api.elsevier.com/content/object/eid/1-s2.0-S2468823124003353-gr9_lrg.jpg?httpAccept=%2A%2F%2A",
            "@multimediatype": "JPEG image file",
            "@type": "IMAGE-HIGH-RES",
            "@size": "212161",
            "@ref": "gr9",
            "@mimetype": "image/jpeg"
          },
          {
            "@category": "high",
            "@height": "1094",
            "@width": "2675",
            "@_fa": "true",
            "$": "https://api.elsevier.com/content/object/eid/1-s2.0-S2468823124003353-gr2_lrg.jpg?httpAccept=%2A%2F%2A",
            "@multimediatype": "JPEG image file",
            "@type": "IMAGE-HIGH-RES",
            "@size": "677539",
            "@ref": "gr2",
            "@mimetype": "image/jpeg"
          },
          {
            "@category": "high",
            "@height": "771",
            "@width": "2213",
            "@_fa": "true",
            "$": "https://api.elsevier.com/content/object/eid/1-s2.0-S2468823124003353-ga1_lrg.jpg?httpAccept=%2A%2F%2A",
            "@multimediatype": "JPEG image file",
            "@type": "IMAGE-HIGH-RES",
            "@size": "212265",
            "@ref": "ga1",
            "@mimetype": "image/jpeg"
          },
          {
            "@category": "high",
            "@height": "1545",
            "@width": "1742",
            "@_fa": "true",
            "$": "https://api.elsevier.com/content/object/eid/1-s2.0-S2468823124003353-gr3_lrg.jpg?httpAccept=%2A%2F%2A",
            "@multimediatype": "JPEG image file",
            "@type": "IMAGE-HIGH-RES",
            "@size": "466926",
            "@ref": "gr3",
            "@mimetype": "image/jpeg"
          },
          {
            "@category": "high",
            "@height": "920",
            "@width": "2342",
            "@_fa": "true",
            "$": "https://api.elsevier.com/content/object/eid/1-s2.0-S2468823124003353-gr4_lrg.jpg?httpAccept=%2A%2F%2A",
            "@multimediatype": "JPEG image file",
            "@type": "IMAGE-HIGH-RES",
            "@size": "486311",
            "@ref": "gr4",
            "@mimetype": "image/jpeg"
          },
          {
            "@category": "high",
            "@height": "1010",
            "@width": "2342",
            "@_fa": "true",
            "$": "https://api.elsevier.com/content/object/eid/1-s2.0-S2468823124003353-gr5_lrg.jpg?httpAccept=%2A%2F%2A",
            "@multimediatype": "JPEG image file",
            "@type": "IMAGE-HIGH-RES",
            "@size": "393577",
            "@ref": "gr5",
            "@mimetype": "image/jpeg"
          },
          {
            "@category": "high",
            "@height": "913",
            "@width": "3008",
            "@_fa": "true",
            "$": "https://api.elsevier.com/content/object/eid/1-s2.0-S2468823124003353-gr1_lrg.jpg?httpAccept=%2A%2F%2A",
            "@multimediatype": "JPEG image file",
            "@type": "IMAGE-HIGH-RES",
            "@size": "402874",
            "@ref": "gr1",
            "@mimetype": "image/jpeg"
          },
          {
            "@category": "standard",
            "@_fa": "true",
            "$": "https://api.elsevier.com/content/object/eid/1-s2.0-S2468823124003353-mmc1.docx?httpAccept=%2A%2F%2A",
            "@multimediatype": "Microsoft Word file",
            "@type": "APPLICATION",
            "@size": "7030884",
            "@ref": "mmc1",
            "@mimetype": "application/word"
          },
          {
            "@category": "thumbnail",
            "@_fa": "true",
            "$": "https://api.elsevier.com/content/object/eid/1-s2.0-S2468823124003353-si1.svg?httpAccept=%2A%2F%2A",
            "@multimediatype": "Scalable Vector Graphics file",
            "@type": "ALTIMG",
            "@size": "4405",
            "@ref": "si1",
            "@mimetype": "image/svg+xml"
          },
          {
            "@category": "thumbnail",
            "@_fa": "true",
            "$": "https://api.elsevier.com/content/object/eid/1-s2.0-S2468823124003353-si10.svg?httpAccept=%2A%2F%2A",
            "@multimediatype": "Scalable Vector Graphics file",
            "@type": "ALTIMG",
            "@size": "9992",
            "@ref": "si10",
            "@mimetype": "image/svg+xml"
          },
          {
            "@category": "thumbnail",
            "@_fa": "true",
            "$": "https://api.elsevier.com/content/object/eid/1-s2.0-S2468823124003353-si11.svg?httpAccept=%2A%2F%2A",
            "@multimediatype": "Scalable Vector Graphics file",
            "@type": "ALTIMG",
            "@size": "11807",
            "@ref": "si11",
            "@mimetype": "image/svg+xml"
          },
          {
            "@category": "thumbnail",
            "@_fa": "true",
            "$": "https://api.elsevier.com/content/object/eid/1-s2.0-S2468823124003353-si12.svg?httpAccept=%2A%2F%2A",
            "@multimediatype": "Scalable Vector Graphics file",
            "@type": "ALTIMG",
            "@size": "6162",
            "@ref": "si12",
            "@mimetype": "image/svg+xml"
          },
          {
            "@category": "thumbnail",
            "@_fa": "true",
            "$": "https://api.elsevier.com/content/object/eid/1-s2.0-S2468823124003353-si13.svg?httpAccept=%2A%2F%2A",
            "@multimediatype": "Scalable Vector Graphics file",
            "@type": "ALTIMG",
            "@size": "6824",
            "@ref": "si13",
            "@mimetype": "image/svg+xml"
          },
          {
            "@category": "thumbnail",
            "@_fa": "true",
            "$": "https://api.elsevier.com/content/object/eid/1-s2.0-S2468823124003353-si2.svg?httpAccept=%2A%2F%2A",
            "@multimediatype": "Scalable Vector Graphics file",
            "@type": "ALTIMG",
            "@size": "6730",
            "@ref": "si2",
            "@mimetype": "image/svg+xml"
          },
          {
            "@category": "thumbnail",
            "@_fa": "true",
            "$": "https://api.elsevier.com/content/object/eid/1-s2.0-S2468823124003353-si3.svg?httpAccept=%2A%2F%2A",
            "@multimediatype": "Scalable Vector Graphics file",
            "@type": "ALTIMG",
            "@size": "7712",
            "@ref": "si3",
            "@mimetype": "image/svg+xml"
          },
          {
            "@category": "thumbnail",
            "@_fa": "true",
            "$": "https://api.elsevier.com/content/object/eid/1-s2.0-S2468823124003353-si4.svg?httpAccept=%2A%2F%2A",
            "@multimediatype": "Scalable Vector Graphics file",
            "@type": "ALTIMG",
            "@size": "6820",
            "@ref": "si4",
            "@mimetype": "image/svg+xml"
          },
          {
            "@category": "thumbnail",
            "@_fa": "true",
            "$": "https://api.elsevier.com/content/object/eid/1-s2.0-S2468823124003353-si5.svg?httpAccept=%2A%2F%2A",
            "@multimediatype": "Scalable Vector Graphics file",
            "@type": "ALTIMG",
            "@size": "4749",
            "@ref": "si5",
            "@mimetype": "image/svg+xml"
          },
          {
            "@category": "thumbnail",
            "@_fa": "true",
            "$": "https://api.elsevier.com/content/object/eid/1-s2.0-S2468823124003353-si6.svg?httpAccept=%2A%2F%2A",
            "@multimediatype": "Scalable Vector Graphics file",
            "@type": "ALTIMG",
            "@size": "6666",
            "@ref": "si6",
            "@mimetype": "image/svg+xml"
          },
          {
            "@category": "thumbnail",
            "@_fa": "true",
            "$": "https://api.elsevier.com/content/object/eid/1-s2.0-S2468823124003353-si7.svg?httpAccept=%2A%2F%2A",
            "@multimediatype": "Scalable Vector Graphics file",
            "@type": "ALTIMG",
            "@size": "8046",
            "@ref": "si7",
            "@mimetype": "image/svg+xml"
          },
          {
            "@category": "thumbnail",
            "@_fa": "true",
            "$": "https://api.elsevier.com/content/object/eid/1-s2.0-S2468823124003353-si8.svg?httpAccept=%2A%2F%2A",
            "@multimediatype": "Scalable Vector Graphics file",
            "@type": "ALTIMG",
            "@size": "12982",
            "@ref": "si8",
            "@mimetype": "image/svg+xml"
          },
          {
            "@category": "thumbnail",
            "@_fa": "true",
            "$": "https://api.elsevier.com/content/object/eid/1-s2.0-S2468823124003353-si9.svg?httpAccept=%2A%2F%2A",
            "@multimediatype": "Scalable Vector Graphics file",
            "@type": "ALTIMG",
            "@size": "4808",
            "@ref": "si9",
            "@mimetype": "image/svg+xml"
          },
          {
            "@category": "standard",
            "@_fa": "true",
            "$": "https://api.elsevier.com/content/object/eid/1-s2.0-S2468823124003353-am.pdf?httpAccept=%2A%2F%2A",
            "@multimediatype": "Acrobat PDF file",
            "@type": "AAM-PDF",
            "@size": "3379616",
            "@ref": "am",
            "@mimetype": "application/pdf"
          }
        ]
      },
      "link": {
        "@rel": "abstract",
        "@href": "https://api.elsevier.com/content/abstract/scopus_id/85190525315"
      }
    }
  }
}