{
  "metadata": {
    "title": "Bimetallic metal organic framework-templated synthesis of a Cu-ZnO/Al<ce:inf loc=post>2</ce:inf>O<ce:inf loc=post>3</ce:inf> catalyst with superior methanol selectivity for CO<ce:inf loc=post>2</ce:inf> hydrogenation",
    "authors": "; ; ",
    "journal": "Molecular Catalysis",
    "date": "2021-09-30",
    "doi": "10.1016/j.mcat.2021.111870",
    "abstract": "",
    "uri": "https://api.elsevier.com/content/article/pii/S2468823121004879",
    "pii": "S2468823121004879"
  },
  "fulltext": {
    "full-text-retrieval-response": {
      "scopus-eid": "2-s2.0-85114732575",
      "originalText": "serial JL 315758 291210 291744 291790 291809 31 Molecular Catalysis MOLECULARCATALYSIS 2021-09-11 2021-09-11 2021-09-11 2021-09-11 2021-09-28T07:55:37 1-s2.0-S2468823121004879 S2468-8231(21)00487-9 S2468823121004879 10.1016/j.mcat.2021.111870 S300 S300.1 FULL-TEXT 1-s2.0-S2468823121X00144 2022-12-12T23:36:21.627889Z 0 0 20210901 20210930 2021 2021-09-11T22:31:04.352664Z absattachment articleinfo articlenumber articletitlenorm authfirstinitialnorm authfirstsurnamenorm cid cids contenttype copyright crossmark dateloaded dateloadedtxt datesearch datesort dateupdated dco docsubtype doctype doi eid ewtransactionid hubeid indexeddate issn issnnorm itemstage itemtransactionid itemweight openaccess openarchive pg pgfirst pii piinorm pubdateend pubdatestart pubdatetxt pubyr sectiontitle sortorder srctitle srctitlenorm srctype ssids alllist content subj subheadings suppl tomb volfirst volissue volumelist webpdf webpdfpagecount yearnav figure table e-component body mmlmath acknowledge affil appendices articletitle auth authfirstini authfull authkeywords authlast grantnumber grantsponsor grantsponsorid highlightsabst orcid primabst ref specialabst 2468-8231 24688231 true 514 514 C Volume 514 37 111870 111870 111870 202109 September 2021 2021-09-01 2021-09-30 2021 Regular Papers article fla © 2021 Elsevier B.V. All rights reserved. BIMETALLICMETALORGANICFRAMEWORKTEMPLATEDSYNTHESISACUZNOAL2O3CATALYSTSUPERIORMETHANOLSELECTIVITYFORCO2HYDROGENATION QI T 1 Introduction 2 Experimental section 2.1 Catalyst preparation 2.2 Characterization 2.3 Catalytic performance measurement 3 Results and discussion 3.1 Synthesis and characterizations of Cu-Zn@MOF precursor 3.2 Catalytic performance for methanol synthesis 3.3 The structural and morphological properties 3.4 The reducibility and the synergetic effect of Cu-ZnO 3.5 The CO2 and H2 adsorption 3.6 In-situ DRIFTS measurements 3.7 Comparative performance of catalysts with time on stream 4 Conclusion CRediT authorship contribution statement Acknowledgments Appendix Supplementary materials References JIANG 2020 7984 8034 X ZHONG 2020 1385 1413 J OLAH 2011 12881 12898 G VU 2021 118119 T ARTZ 2018 434 504 J JIANG 2020 118804 Q MORI 2018 8902 8909 K OLAH 2013 104 107 G GAO 2017 1019 1024 P RAMIREZ 2018 9174 9182 A LI 2017 8544 8548 Z NGUYEN 2019 1 11 T TING 2019 3685 3693 K TADA 2018 7809 7819 S LIU 2020 93 102 T SHARMA 2021 118239 S TARASOV 2019 5537 5544 A BEHRENS 2013 6061 6068 M ZHANG 2021 119700 X KATTEL 2017 9739 9754 S DIN 2019 20 33 I DEERATTRAKUL 2019 46 52 V SCHOTT 2013 11925 11929 V LUNKENBEIN 2015 4544 4548 T KOITAYA 2019 4539 4550 T REN 2020 82 95 S VANDEN 2016 13057 R BONURA 2014 152 161 G NATESAKHAWAT 2012 1667 1676 S DASIREDDY 2019 452 460 V GUO 2010 178 185 X SCHUMANN 2016 117 126 J AN 2017 3834 3840 B YIN 2018 143 152 Y STOLAR 2021 3070 3077 T CHEN 2019 1885 Y LI 2019 115044 X WANG 2019 106 118 J LI 2019 23878 23885 X SHE 2018 14698 14707 W CAI 2017 563 567 G HU 2019 2673 2681 B CHEN 2020 5369 5403 L ZHU 2016 22696 22704 H EVANS 2014 5933 5951 J FRACAROLI 2016 8352 8355 A SHULTZ 2011 13252 13255 A CARSON 2012 15322 15328 C TEHRANI 2015 41 45 A FELDBLYUM 2011 18257 18263 J YANG 2014 10649 10653 J ZHANG 2018 211 220 C ZHANG 2017 146 153 L SANTOS 2017 310 317 J ZHANG 2017 233 245 Y ALARCONLLADO 2007 165202 E SINGH 2009 3409 3418 D TANG 2017 5987 5991 N BEHRENS 2013 1374 1381 M AVADHUT 2012 11610 Y MIAO 2009 910 921 S WANG 2019 1166 Y WANG 2017 e1701290 J WITOON 2016 21 31 T ZHAO 2017 3772 3778 F DONG 2016 8 17 X ALVAREZGALVAN 2016 104 111 C GUO 2019 4916 4926 Y ZHANG 2015 5567 5573 B SCHUMANN 2015 3260 3270 J GAO 2015 4365 4377 P ZHANG 2010 1348 1352 X ZHU 2015 551 559 Y JIANG 2018 642 651 Y MARCOS 2020 101215 F JIMENEZGOMEZ 2016 107 115 C YANG 2017 5625 5634 X GAO 2013 51 60 P ZHANG 2016 72 82 Y WANG 2017 1875 1932 Y SMYRNIOTI 2020 495 502 M NOEI 2011 908 914 H GAO 2013 442 452 P NATESAKHAWAT 2013 1752 1763 S WAUGH 2004 327 342 K ARENA 2009 80 85 F ARENA 2008 16 23 F JIANG 2018 62 70 X XU 2020 5250 5260 D NOEI 2008 7092 7097 H WANG 2006 1521 1524 Y WANG 2020 419 430 Y YAO 2019 74 85 L QIX2021X111870 QIX2021X111870XT 2023-09-11T00:00:00.000Z 2023-09-11T00:00:00.000Z http://creativecommons.org/licenses/by-nc-nd/4.0/ © 2021 Elsevier B.V. All rights reserved. 2021-09-15T22:09:31.654Z http://vtw.elsevier.com/data/voc/AddOnTypes/50.7/aggregated-refined National Key Research and Development Program of China 2017YFB0603301 NKRDPC National Key Research and Development Program of China http://data.elsevier.com/vocabulary/SciValFunders/501100012166 http://sws.geonames.org/1814991/ Xinjiang Dunhua Petroleum Technology Co., Ltd. MOST Ministry of Science and Technology of the People's Republic of China http://data.elsevier.com/vocabulary/SciValFunders/501100002855 http://sws.geonames.org/1814991 Xinjiang Dunhua Petroleum Technology Co. Ltd DUT DUT Dalian University of Technology http://data.elsevier.com/vocabulary/SciValFunders/501100002980 http://sws.geonames.org/1814991/ This work was financially supported by the National Key Research and Development Program of China (No. 2017YFB0603301), and the authors are thankful for the funding support from Xinjiang Dunhua Petroleum Technology Co. Ltd. Many thanks to Dr. Jing Wang, Dr. Xuewei Li and Dr. Wei She for their help in the experiment and the Analysis and Testing Center of DUT for analytical support. This work was financially supported by the National Key Research and Development Program of China (No. 2017YFB0603301 ), and the authors are thankful for the funding support from Xinjiang Dunhua Petroleum Technology Co., Ltd. Many thanks to Dr. Jing Wang, Dr. Xuewei Li and Dr. Wei She for their help in the experiment and the Analysis and Testing Center of DUT for analytical support. 0 https://doi.org/10.15223/policy-017 https://doi.org/10.15223/policy-037 https://doi.org/10.15223/policy-012 https://doi.org/10.15223/policy-029 https://doi.org/10.15223/policy-004 item S2468-8231(21)00487-9 S2468823121004879 1-s2.0-S2468823121004879 10.1016/j.mcat.2021.111870 315758 2021-09-28T08:07:31.085723Z 2021-09-01 2021-09-30 1-s2.0-S2468823121004879-main.pdf https://s3-eu-west-1.amazonaws.com/prod-ucs-content-store-eu-west/content/pii:S2468823121004879/MAIN/application/pdf/bc7b2299f6515b1bf96c6068821ba15c/main.pdf main.pdf pdf true 13499312 MAIN 14 1-s2.0-S2468823121004879-main_1.png https://s3-eu-west-1.amazonaws.com/prod-ucs-content-store-eu-west/content/pii:S2468823121004879/PREVIEW/image/png/7a6b34706b397cabe2611a773e55725e/main_1.png main_1.png png 58875 849 656 IMAGE-WEB-PDF 1 1-s2.0-S2468823121004879-ga1.jpg https://s3-eu-west-1.amazonaws.com/prod-ucs-content-store-eu-west/content/pii:S2468823121004879/ga1/DOWNSAMPLED/image/jpeg/ad5ba690f5b95c811d6a8c0fe6a23c2b/ga1.jpg ga1 true ga1.jpg jpg 28209 200 261 IMAGE-DOWNSAMPLED 1-s2.0-S2468823121004879-sc1.jpg https://s3-eu-west-1.amazonaws.com/prod-ucs-content-store-eu-west/content/pii:S2468823121004879/sc1/DOWNSAMPLED/image/jpeg/dd8cf5bf88556291276d5c04f822b3d7/sc1.jpg sc1 sc1.jpg jpg 92443 394 659 IMAGE-DOWNSAMPLED 1-s2.0-S2468823121004879-gr3.jpg https://s3-eu-west-1.amazonaws.com/prod-ucs-content-store-eu-west/content/pii:S2468823121004879/gr3/DOWNSAMPLED/image/jpeg/516c11e218b0c8ca21a4115818a9d756/gr3.jpg gr3 gr3.jpg jpg 82771 274 715 IMAGE-DOWNSAMPLED 1-s2.0-S2468823121004879-gr11.jpg https://s3-eu-west-1.amazonaws.com/prod-ucs-content-store-eu-west/content/pii:S2468823121004879/gr11/DOWNSAMPLED/image/jpeg/d75f952701e677d81e6b598c64b5a498/gr11.jpg gr11 gr11.jpg jpg 62114 245 659 IMAGE-DOWNSAMPLED 1-s2.0-S2468823121004879-gr4.jpg https://s3-eu-west-1.amazonaws.com/prod-ucs-content-store-eu-west/content/pii:S2468823121004879/gr4/DOWNSAMPLED/image/jpeg/113749d518b156e4eb374a068e73a55c/gr4.jpg gr4 gr4.jpg jpg 205291 698 659 IMAGE-DOWNSAMPLED 1-s2.0-S2468823121004879-gr10.jpg https://s3-eu-west-1.amazonaws.com/prod-ucs-content-store-eu-west/content/pii:S2468823121004879/gr10/DOWNSAMPLED/image/jpeg/eb59d6f1c543365fb95a7a0badaa1198/gr10.jpg gr10 gr10.jpg jpg 224913 576 753 IMAGE-DOWNSAMPLED 1-s2.0-S2468823121004879-gr1.jpg https://s3-eu-west-1.amazonaws.com/prod-ucs-content-store-eu-west/content/pii:S2468823121004879/gr1/DOWNSAMPLED/image/jpeg/5563899419d6ad4f9c22d28e86f3b19f/gr1.jpg gr1 gr1.jpg jpg 63978 254 734 IMAGE-DOWNSAMPLED 1-s2.0-S2468823121004879-gr2.jpg https://s3-eu-west-1.amazonaws.com/prod-ucs-content-store-eu-west/content/pii:S2468823121004879/gr2/DOWNSAMPLED/image/jpeg/5dd9a065405806684b2db13b1cac0f37/gr2.jpg gr2 gr2.jpg jpg 48813 245 640 IMAGE-DOWNSAMPLED 1-s2.0-S2468823121004879-gr7.jpg https://s3-eu-west-1.amazonaws.com/prod-ucs-content-store-eu-west/content/pii:S2468823121004879/gr7/DOWNSAMPLED/image/jpeg/c895efa18c0d60e26eeebd341b5be114/gr7.jpg gr7 gr7.jpg jpg 31101 306 376 IMAGE-DOWNSAMPLED 1-s2.0-S2468823121004879-gr8.jpg https://s3-eu-west-1.amazonaws.com/prod-ucs-content-store-eu-west/content/pii:S2468823121004879/gr8/DOWNSAMPLED/image/jpeg/9112f5494db920fadc51ac8b7355c851/gr8.jpg gr8 gr8.jpg jpg 98296 526 659 IMAGE-DOWNSAMPLED 1-s2.0-S2468823121004879-gr5.jpg https://s3-eu-west-1.amazonaws.com/prod-ucs-content-store-eu-west/content/pii:S2468823121004879/gr5/DOWNSAMPLED/image/jpeg/4e03faedfd15f4f57814f0fb5d7d6768/gr5.jpg gr5 gr5.jpg jpg 150802 515 602 IMAGE-DOWNSAMPLED 1-s2.0-S2468823121004879-gr6.jpg https://s3-eu-west-1.amazonaws.com/prod-ucs-content-store-eu-west/content/pii:S2468823121004879/gr6/DOWNSAMPLED/image/jpeg/2320aa186a837d8a40b483ee859b208a/gr6.jpg gr6 gr6.jpg jpg 77039 376 565 IMAGE-DOWNSAMPLED 1-s2.0-S2468823121004879-gr9.jpg https://s3-eu-west-1.amazonaws.com/prod-ucs-content-store-eu-west/content/pii:S2468823121004879/gr9/DOWNSAMPLED/image/jpeg/79c66ae80315b574b3f9365f881c459d/gr9.jpg gr9 gr9.jpg jpg 62104 247 659 IMAGE-DOWNSAMPLED 1-s2.0-S2468823121004879-ga1.sml https://s3-eu-west-1.amazonaws.com/prod-ucs-content-store-eu-west/content/pii:S2468823121004879/ga1/THUMBNAIL/image/gif/431af50755a021173582bc3da53c9da3/ga1.sml ga1 true ga1.sml sml 22035 164 214 IMAGE-THUMBNAIL 1-s2.0-S2468823121004879-sc1.sml https://s3-eu-west-1.amazonaws.com/prod-ucs-content-store-eu-west/content/pii:S2468823121004879/sc1/THUMBNAIL/image/gif/b9e33aef44d8d3eaafcbcc4c56b3db92/sc1.sml sc1 sc1.sml sml 15099 131 219 IMAGE-THUMBNAIL 1-s2.0-S2468823121004879-gr3.sml https://s3-eu-west-1.amazonaws.com/prod-ucs-content-store-eu-west/content/pii:S2468823121004879/gr3/THUMBNAIL/image/gif/bb4f7b6d5ae357df21608654a81c7f32/gr3.sml gr3 gr3.sml sml 10800 84 219 IMAGE-THUMBNAIL 1-s2.0-S2468823121004879-gr11.sml https://s3-eu-west-1.amazonaws.com/prod-ucs-content-store-eu-west/content/pii:S2468823121004879/gr11/THUMBNAIL/image/gif/13eb1748981d2f2c1361f6755289bf9f/gr11.sml gr11 gr11.sml sml 8994 82 219 IMAGE-THUMBNAIL 1-s2.0-S2468823121004879-gr4.sml https://s3-eu-west-1.amazonaws.com/prod-ucs-content-store-eu-west/content/pii:S2468823121004879/gr4/THUMBNAIL/image/gif/ff193735b5ec007d24dc0ea65755d33d/gr4.sml gr4 gr4.sml sml 21939 164 155 IMAGE-THUMBNAIL 1-s2.0-S2468823121004879-gr10.sml https://s3-eu-west-1.amazonaws.com/prod-ucs-content-store-eu-west/content/pii:S2468823121004879/gr10/THUMBNAIL/image/gif/cd97c8c7cdae65e736dec8f787486c71/gr10.sml gr10 gr10.sml sml 21266 164 214 IMAGE-THUMBNAIL 1-s2.0-S2468823121004879-gr1.sml https://s3-eu-west-1.amazonaws.com/prod-ucs-content-store-eu-west/content/pii:S2468823121004879/gr1/THUMBNAIL/image/gif/5039f238f167892675edf47a6c49feca/gr1.sml gr1 gr1.sml sml 9005 76 219 IMAGE-THUMBNAIL 1-s2.0-S2468823121004879-gr2.sml https://s3-eu-west-1.amazonaws.com/prod-ucs-content-store-eu-west/content/pii:S2468823121004879/gr2/THUMBNAIL/image/gif/b960f31982f4e4fe11838b1e6fd70a30/gr2.sml gr2 gr2.sml sml 8305 84 219 IMAGE-THUMBNAIL 1-s2.0-S2468823121004879-gr7.sml https://s3-eu-west-1.amazonaws.com/prod-ucs-content-store-eu-west/content/pii:S2468823121004879/gr7/THUMBNAIL/image/gif/544d1d2067525041b02c323d611b265f/gr7.sml gr7 gr7.sml sml 9564 164 201 IMAGE-THUMBNAIL 1-s2.0-S2468823121004879-gr8.sml https://s3-eu-west-1.amazonaws.com/prod-ucs-content-store-eu-west/content/pii:S2468823121004879/gr8/THUMBNAIL/image/gif/c3e514d75abbf3536e0b14e813ebac4a/gr8.sml gr8 gr8.sml sml 13643 164 205 IMAGE-THUMBNAIL 1-s2.0-S2468823121004879-gr5.sml https://s3-eu-west-1.amazonaws.com/prod-ucs-content-store-eu-west/content/pii:S2468823121004879/gr5/THUMBNAIL/image/gif/1bd9245a10bcee7f72bcc6517b4a1bac/gr5.sml gr5 gr5.sml sml 27528 164 192 IMAGE-THUMBNAIL 1-s2.0-S2468823121004879-gr6.sml https://s3-eu-west-1.amazonaws.com/prod-ucs-content-store-eu-west/content/pii:S2468823121004879/gr6/THUMBNAIL/image/gif/d53fa75445e7fa5cd0399b7163b3774d/gr6.sml gr6 gr6.sml sml 24125 146 219 IMAGE-THUMBNAIL 1-s2.0-S2468823121004879-gr9.sml https://s3-eu-west-1.amazonaws.com/prod-ucs-content-store-eu-west/content/pii:S2468823121004879/gr9/THUMBNAIL/image/gif/b7b994ac55e247c7bc47dd27670e9316/gr9.sml gr9 gr9.sml sml 9078 82 219 IMAGE-THUMBNAIL 1-s2.0-S2468823121004879-ga1_lrg.jpg https://s3-eu-west-1.amazonaws.com/prod-ucs-content-store-eu-west/content/pii:S2468823121004879/ga1/HIGHRES/image/jpeg/95f94d9e7d0ff99b28434b1982cb60dc/ga1_lrg.jpg ga1 true ga1_lrg.jpg jpg 185286 886 1155 IMAGE-HIGH-RES 1-s2.0-S2468823121004879-sc1_lrg.jpg https://s3-eu-west-1.amazonaws.com/prod-ucs-content-store-eu-west/content/pii:S2468823121004879/sc1/HIGHRES/image/jpeg/9c0f6835b21dd08c0bbf7d4be8b50fe4/sc1_lrg.jpg sc1 sc1_lrg.jpg jpg 616841 1743 2917 IMAGE-HIGH-RES 1-s2.0-S2468823121004879-gr3_lrg.jpg https://s3-eu-west-1.amazonaws.com/prod-ucs-content-store-eu-west/content/pii:S2468823121004879/gr3/HIGHRES/image/jpeg/376c2789e98d521c81747cefb3b2aa33/gr3_lrg.jpg gr3 gr3_lrg.jpg jpg 547208 1213 3167 IMAGE-HIGH-RES 1-s2.0-S2468823121004879-gr11_lrg.jpg https://s3-eu-west-1.amazonaws.com/prod-ucs-content-store-eu-west/content/pii:S2468823121004879/gr11/HIGHRES/image/jpeg/925de306cf0fd30f44438f0643456815/gr11_lrg.jpg gr11 gr11_lrg.jpg jpg 402669 1086 2917 IMAGE-HIGH-RES 1-s2.0-S2468823121004879-gr4_lrg.jpg https://s3-eu-west-1.amazonaws.com/prod-ucs-content-store-eu-west/content/pii:S2468823121004879/gr4/HIGHRES/image/jpeg/814a0c8a75f9d006d988b712c3f74d62/gr4_lrg.jpg gr4 gr4_lrg.jpg jpg 1866629 3089 2917 IMAGE-HIGH-RES 1-s2.0-S2468823121004879-gr10_lrg.jpg https://s3-eu-west-1.amazonaws.com/prod-ucs-content-store-eu-west/content/pii:S2468823121004879/gr10/HIGHRES/image/jpeg/d863a004b1ed5f9060fea2cffe9503dc/gr10_lrg.jpg gr10 gr10_lrg.jpg jpg 1505041 2549 3333 IMAGE-HIGH-RES 1-s2.0-S2468823121004879-gr1_lrg.jpg https://s3-eu-west-1.amazonaws.com/prod-ucs-content-store-eu-west/content/pii:S2468823121004879/gr1/HIGHRES/image/jpeg/4a59349359110c05f8ebd033eccf501e/gr1_lrg.jpg gr1 gr1_lrg.jpg jpg 479217 1126 3250 IMAGE-HIGH-RES 1-s2.0-S2468823121004879-gr2_lrg.jpg https://s3-eu-west-1.amazonaws.com/prod-ucs-content-store-eu-west/content/pii:S2468823121004879/gr2/HIGHRES/image/jpeg/6b0ad38e937979065c2c7a19773f0bd7/gr2_lrg.jpg gr2 gr2_lrg.jpg jpg 318801 1086 2833 IMAGE-HIGH-RES 1-s2.0-S2468823121004879-gr7_lrg.jpg https://s3-eu-west-1.amazonaws.com/prod-ucs-content-store-eu-west/content/pii:S2468823121004879/gr7/HIGHRES/image/jpeg/904f8081580b02f4ee05ff532bdaf803/gr7_lrg.jpg gr7 gr7_lrg.jpg jpg 198599 1357 1667 IMAGE-HIGH-RES 1-s2.0-S2468823121004879-gr8_lrg.jpg https://s3-eu-west-1.amazonaws.com/prod-ucs-content-store-eu-west/content/pii:S2468823121004879/gr8/HIGHRES/image/jpeg/d63a6413412c03f5e036efd110e6cd13/gr8_lrg.jpg gr8 gr8_lrg.jpg jpg 715761 2327 2917 IMAGE-HIGH-RES 1-s2.0-S2468823121004879-gr5_lrg.jpg https://s3-eu-west-1.amazonaws.com/prod-ucs-content-store-eu-west/content/pii:S2468823121004879/gr5/HIGHRES/image/jpeg/87e9521e63a2cfc44c4bf71400a4ff7c/gr5_lrg.jpg gr5 gr5_lrg.jpg jpg 1435186 2281 2667 IMAGE-HIGH-RES 1-s2.0-S2468823121004879-gr6_lrg.jpg https://s3-eu-west-1.amazonaws.com/prod-ucs-content-store-eu-west/content/pii:S2468823121004879/gr6/HIGHRES/image/jpeg/20311153e0cc9dec701792d4d878a757/gr6_lrg.jpg gr6 gr6_lrg.jpg jpg 574250 1662 2500 IMAGE-HIGH-RES 1-s2.0-S2468823121004879-gr9_lrg.jpg https://s3-eu-west-1.amazonaws.com/prod-ucs-content-store-eu-west/content/pii:S2468823121004879/gr9/HIGHRES/image/jpeg/d73f77110130af56ac73365d175edd87/gr9_lrg.jpg gr9 gr9_lrg.jpg jpg 392939 1094 2917 IMAGE-HIGH-RES 1-s2.0-S2468823121004879-mmc1.docx https://s3-eu-west-1.amazonaws.com/prod-ucs-content-store-eu-west/content/pii:S2468823121004879/mmc1/MAIN/application/vnd.openxmlformats-officedocument.wordprocessingml.document/ac0058f7c1a856757817abf51ea05ceb/mmc1.docx mmc1 mmc1.docx docx 2210945 APPLICATION 1-s2.0-S2468823121004879-si1.svg https://s3-eu-west-1.amazonaws.com/prod-ucs-content-store-eu-west/content/pii:S2468823121004879/STRIPIN/image/svg+xml/0befb3dbe6d876e220a3815d1d999dae/si1.svg si1 si1.svg svg 8592 ALTIMG 1-s2.0-S2468823121004879-si10.svg https://s3-eu-west-1.amazonaws.com/prod-ucs-content-store-eu-west/content/pii:S2468823121004879/STRIPIN/image/svg+xml/098c87ddd9ceccf0d4d89819f437cae5/si10.svg si10 si10.svg svg 4622 ALTIMG 1-s2.0-S2468823121004879-si11.svg https://s3-eu-west-1.amazonaws.com/prod-ucs-content-store-eu-west/content/pii:S2468823121004879/STRIPIN/image/svg+xml/610fb51dcee0e1ffd370ac0195f902d3/si11.svg si11 si11.svg svg 2289 ALTIMG 1-s2.0-S2468823121004879-si12.svg https://s3-eu-west-1.amazonaws.com/prod-ucs-content-store-eu-west/content/pii:S2468823121004879/STRIPIN/image/svg+xml/c43016a28bd2f1a67f7f46d8fe4bfdfc/si12.svg si12 si12.svg svg 5740 ALTIMG 1-s2.0-S2468823121004879-si13.svg https://s3-eu-west-1.amazonaws.com/prod-ucs-content-store-eu-west/content/pii:S2468823121004879/STRIPIN/image/svg+xml/49420a92d59b41d277031741e9656aea/si13.svg si13 si13.svg svg 1986 ALTIMG 1-s2.0-S2468823121004879-si14.svg https://s3-eu-west-1.amazonaws.com/prod-ucs-content-store-eu-west/content/pii:S2468823121004879/STRIPIN/image/svg+xml/0311fbb4e3ba9dabf04081766e9d1e3f/si14.svg si14 si14.svg svg 3515 ALTIMG 1-s2.0-S2468823121004879-si2.svg https://s3-eu-west-1.amazonaws.com/prod-ucs-content-store-eu-west/content/pii:S2468823121004879/STRIPIN/image/svg+xml/d58a3482fbba5cd711d135db2403e98e/si2.svg si2 si2.svg svg 14614 ALTIMG 1-s2.0-S2468823121004879-si3.svg https://s3-eu-west-1.amazonaws.com/prod-ucs-content-store-eu-west/content/pii:S2468823121004879/STRIPIN/image/svg+xml/adb48918a057552bde196e825ef34b6a/si3.svg si3 si3.svg svg 7855 ALTIMG 1-s2.0-S2468823121004879-si4.svg https://s3-eu-west-1.amazonaws.com/prod-ucs-content-store-eu-west/content/pii:S2468823121004879/STRIPIN/image/svg+xml/d9c3d8edb4315bcc58281bf84467a193/si4.svg si4 si4.svg svg 11908 ALTIMG 1-s2.0-S2468823121004879-si5.svg https://s3-eu-west-1.amazonaws.com/prod-ucs-content-store-eu-west/content/pii:S2468823121004879/STRIPIN/image/svg+xml/ff5988ffc52ce6e248d8bcc178203580/si5.svg si5 si5.svg svg 13864 ALTIMG 1-s2.0-S2468823121004879-si6.svg https://s3-eu-west-1.amazonaws.com/prod-ucs-content-store-eu-west/content/pii:S2468823121004879/STRIPIN/image/svg+xml/81b28927d2c329cc2b0fc16db9f14ac5/si6.svg si6 si6.svg svg 21493 ALTIMG 1-s2.0-S2468823121004879-si7.svg https://s3-eu-west-1.amazonaws.com/prod-ucs-content-store-eu-west/content/pii:S2468823121004879/STRIPIN/image/svg+xml/e3afcf7d8ecccd8bc4bf4e9c6178c554/si7.svg si7 si7.svg svg 5725 ALTIMG 1-s2.0-S2468823121004879-si8.svg https://s3-eu-west-1.amazonaws.com/prod-ucs-content-store-eu-west/content/pii:S2468823121004879/STRIPIN/image/svg+xml/10985f8c74d27154f76885028f46dc26/si8.svg si8 si8.svg svg 5822 ALTIMG 1-s2.0-S2468823121004879-si9.svg https://s3-eu-west-1.amazonaws.com/prod-ucs-content-store-eu-west/content/pii:S2468823121004879/STRIPIN/image/svg+xml/818852baa22b6511fd630ed13cedde8c/si9.svg si9 si9.svg svg 1798 ALTIMG 1-s2.0-S2468823121004879-am.pdf am am.pdf pdf 1945990 AAM-PDF https://s3-eu-west-1.amazonaws.com/prod-ucs-content-store-eu-west/content/egi:1088L8GHZ76/MAIN/application/pdf/95756ef477af9fb904a7add273662ff1/am.pdf MCAT 111870 111870 S2468-8231(21)00487-9 10.1016/j.mcat.2021.111870 Elsevier B.V. Scheme 1 Schematic illustration of synthesis of Cu-ZnOMOF⊂Al2O3 catalyst for CO2 hydrogenation to methanol. Scheme 1 Fig. 1 The catalytic performance on Cu-ZnOMOF⊂Al2O3 and Cu-ZnONO3/Al2O3 catalysts (a) at 240 °C and (b) as a function of the reaction temperature. Reaction conditions: V H2/CO2 = 3/1, GHSV = 14400 h−1, P = 3.0 MPa. Fig 1 Fig. 2 Raman spectra (a) and 27Al MAS NMR spectra (b) on Cu-ZnOMOF⊂Al2O3 and Cu-ZnONO3/Al2O3 catalysts. Fig 2 Fig. 3 XRD patterns (a) and N2 adsorption-desorption isotherms (b) of the Cu-ZnOMOF⊂Al2O3 and Cu-ZnONO3/Al2O3 catalysts (Insets in Fig. 3b are the results of pore volume and BET special surface area, as well pore size distribution, respectively). Fig 3 Fig. 4 The SEM images (a, b) and corresponding line scan (c) and EDS (d) results, as well as the HRTEM images (e, f) of the newly developed Cu-ZnOMOF⊂Al2O3 catalyst. Fig 4 Fig. 5 SEM image (a) and their corresponding SEM-EDS mappings (a-1 to a-5) as well as the HRTEM images (b, c) of conventional Cu-ZnONO3/Al2O3 catalyst. Fig 5 Fig. 6 HAADF-STEM images and elemental mappings coupled with their EDS spectra of Cu-ZnOMOF⊂Al2O3 (a-c) and Cu-ZnO NO3/Al2O3 (d-f) catalysts. Fig 6 Fig. 7 H2-TPR profiles of Cu-ZnOMOF⊂Al2O3 and Cu-ZnONO3/Al2O3 catalysts. Fig 7 Fig. 8 Cu 2p and Zn 2p XPS spectra of calcinated (a, b) as well as Cu 2p (c) and O 1s (d) of reduced CuO-ZnOMOF⊂Al2O3 and CuO-ZnONO3/Al2O3 catalysts. Fig 8 Fig. 9 CO2-TPD profiles (a), and H2-TPD profiles (b) of Cu-ZnOMOF⊂Al2O3 and Cu-ZnONO3/Al2O3 catalysts. Fig 9 Fig. 10 In-situ DRIFT spectra of hydrogenation of CO2 reaction on reduced Cu-ZnOMOF⊂Al2O3 (a) and Cu-ZnONO3/Al2O3 catalysts (b) as well as their enlarged section (c) 3400–3800 cm−1, (d) 1000–1100 cm−1 on Cu-ZnOMOF⊂Al2O3, (e) 1000–1100 cm−1 on Cu-ZnONO3/Al2O3 and (f) DRIFT spectra on both catalysts from 6 - 24 min at 240 °C. Reaction conditions: gas flow rate = 40 mL∙min−1, H2/CO2 = 3/1, P = 0.1 MPa. Fig 10 Fig. 11 Methanol selectivity (a), CO2 conversion (b), and space-time yield of methanol (c) with reaction time over Cu-ZnOMOF⊂Al2O3 and Cu-ZnONO3/Al2O3 catalysts. Reaction condition: V H2/CO2 = 3/1, GHSV = 14400 h−1, T = 240 °C, P = 3 MPa. Fig 11 Table 1 The textural properties of the as-synthesized Cu-ZnOMOF⊂Al2O3 and Cu-ZnONO3/Al2O3 catalysts. Table 1 Catalyst d Cu a (nm) S BET(m2⋅g −1) V pore (cm3⋅g−1) Element content b D Cu c (%) S Cu c (m2•g−1) Cu Zn Al O Cu-ZnOMOF⊂Al2O3 16.2 13.2 0.078 54.1 25.8 7.3 12.8 20.2 2.1 Cu-ZnONO3/Al2O3 21.2 18.9 0.073 57.2 26.0 5.5 11.3 15.4 1.9 a d Cu calculated by the Scherrer equation based on Cu (111) reflection (Fig. 3a). b Elemental content measured by ICP analysis. c D Cu and S Cu measured by the dissociative N2O chemisorption. Table 2 The analyzed CO2-TPD and H2-TPD results of Cu-ZnOMOF⊂Al2O3 and Cu-ZnONO3/Al2O3 catalysts. Table 2 Catalyst CO2 desorption a (umol⋅g−1) H2 desorption b (umol⋅g−1) P LO c (%) CZn d (%) α β γ α β γ Cu-ZnOMOF⊂Al2O3 51.4 41.8 41.8 214 141 215 71.6 30.0 Cu-ZnONO3/Al2O3 32.9 27.1 22.1 167 161 182 64.0 27.2 a Amount of CO2 desorption measured based on the CO2-TPD profiles (Fig. 9a). b Amount of H2 consumption measured based on the H2-TPD profiles (Fig. 9b). c The “P LO” is denoted as percent of lattice oxygen, calculated based on the O 1s XPS spectra (Fig. 8d). d The “Czn ” is denoted as concentration of surface Zn element, obtained from the Zn 2p XPS result (Fig. 8b). Bimetallic metal organic framework-templated synthesis of a Cu-ZnO/Al2O3 catalyst with superior methanol selectivity for CO2 hydrogenation Tianqinji Qi Investigation Methodology Writing – original draft Visualization a Yiming Zhao Methodology Visualization a Shaoyun Chen Resources Funding acquisition a Weizuo Li Conceptualization Supervision Writing – review & editing b ⁎ Xinwen Guo Conceptualization Supervision Writing – review & editing a Yongchun Zhang Conceptualization Supervision Writing – review & editing Funding acquisition a ⁎ Chunshan Song Formal analysis Conceptualization Supervision Writing – review & editing c d ⁎ a State Key Laboratory of Fine Chemicals, Department of Catalysis Chemistry and Engineering, School of Chemical Engineering, Dalian University of Technology, Dalian, Liaoning 116024, China State Key Laboratory of Fine Chemicals Department of Catalysis Chemistry and Engineering School of Chemical Engineering Dalian University of Technology Dalian Liaoning 116024 China aState Key Laboratory of Fine Chemicals, Department of Catalysis Chemistry and Engineering, School of Chemical Engineering, Dalian University of Technology, Dalian, Liaoning 116024, China b School of Petrochemical Engineering, Changzhou University, Changzhou, Jiangsu 213000, China School of Petrochemical Engineering Changzhou University Changzhou Jiangsu 213000 China bSchool of Petrochemical Engineering, Changzhou University, Changzhou, Jiangsu 213000, China c EMS Energy Institute, PSU-DUT Joint Center for Energy Research, Departments of Energy and Mineral Engineering and of Chemical Engineering, the Pennsylvania State University, University Park, PA 16802, United States EMS Energy Institute PSU-DUT Joint Center for Energy Research Departments of Energy and Mineral Engineering and of Chemical Engineering the Pennsylvania State University University Park PA 16802 United States cEMS Energy Institute, PSU-DUT Joint Center for Energy Research, Departments of Energy and Mineral Engineering and of Chemical Engineering, the Pennsylvania State University, University Park, PA 16802, United States d Department of Chemistry, Faculty of Science, the Chinese University of Hong Kong, Shatin, NT, Hong Kong, China Department of Chemistry Faculty of Science the Chinese University of Hong Kong Shatin NT Hong Kong, China dDepartment of Chemistry, Faculty of Science, the Chinese University of Hong Kong, Shatin, NT, Hong Kong, China ⁎ Corresponding authors. It is highly desirable to develop inexpensive and highly selective catalyst for CO2 hydrogenation to methanol and Cu/ZnO/Al2O3 is a promising formulation. Herein, we report the design and synthesis of a Cu-ZnO/Al2O3 catalyst via a bimetallic metal organic framework (MOF)-templated strategy (termed Cu-ZnOMOF⊂Al2O3) and shed light on the role of the Cu-Zn@MOF precursor in this system for methanol synthesis. The developed Cu-ZnOMOF⊂Al2O3 exhibited high methanol selectivity (86.9%) and methanol space-time yield (407.2 gMeOH•kgcat −1•h−1) at higher CO2 conversion (9.1%) in comparison with the conventional Cu-ZnONO3/Al2O3 catalyst (79.6% and 209.0 gMeOH•kgcat −1•h−1, and 5.1%, respectively) at 240 ºC under 3.0 MPa. Spectroscopic characterization (TEM, XPS, EDX, in-situ DRIFTS) coupled with N2O chemisorption and temperature-programmed desorption of CO2 and H2 revealed that the surface of the new Cu-ZnOMOF⊂Al2O3 catalyst possesses higher Cu dispersion, surface-enriched ZnO and more Cu-ZnO interfacial sites, which leads to higher capability for CO2 and H2 adsorption and activation. These are considered to be the origin of higher methanol selectivity and enhanced activity of the catalyst prepared by the MOF-templated strategy for CO2 hydrogenation. This work offers a novel approach to optimizing Cu-ZnO/Al2O3 catalyst for CO2 hydrogenation to methanol. Graphical abstract Image, graphical abstract Keywords Metal organic frameworks Templated strategy Cu/ZnO/Al2O3 catalyst CO2 hydrogenation Methanol 1 Introduction Recently, catalytic conversion of carbon dioxide (CO2) into useful chemicals (e.g., methanol, formic acid) has attracted considerable attention due to its contribution to utilization of the CO2 and alleviating its detrimental effect on global warming [1–7]. Methanol is one of the products from CO2 hydrogenation process, which is a vital intermediate to produce olefins and other organic chemicals [8–13]. However, for the CO2 hydrogenation to methanol, a competitive reaction, i.e., reverse water gas shift (RWGS) reaction, occurs at elevated reaction temperatures [14]. This side reaction leads to lower methanol selectivity at the relatively high CO2 conversion [15]. The Cu/ZnO/Al2O3 catalyst has been used as an industrial catalyst for methanol synthesis [16–21]. Extensive studies have proved that the Cu species stabilized by ZnO nanoparticles within the Cu-rich molar ratio of Cu/ZnO/Al2O3 catalyst could induce a synergistic effect, and which further increases the amounts of Cu-ZnO x interfacial sites [22–28]. As a structure-sensitive reaction, CO2-to-methanol reaction of which the catalytic performance was strongly associated with metal Cu grain size and metal Cu special surface [29]. It was widely reported that high content of Cu+ species or high Cu+/Cu0 ratio was conductive to methanol production [30]. In addition to the status of Cu species, it also was come under observation that Cu-ZnO synergetic [29,31] existed indeed, and of which the mechanism was still under controversy, appeared to be superior to the former for the catalytic performance of Cu/ZnO-based catalyst. Therefore, it is rationalized that high concentration of Cu+ species or Cu+/Cu0 ratio, abundant Cu-ZnO interfaces or metal Cu special area contributes to enhancing catalytic performance. Unfortunately, for the traditional Cu/ZnO/Al2O3 the supply of high Cu surface often ended in failure [32]. Therefore, from the viewpoint of the efficiency and practical application, it is highly desired to develop efficient Cu-based catalysts with abundant Cu-ZnO x interfacial sites for hydrogenation of CO2 to methanol at high CO2 conversion and methanol selectivity. Recently, self-supported transition metal-organic frameworks (MOFs), a class of porous material consisting of metal nodes and ligands by covalent action and featured with a regular three-dimensional topology, have attracted the considerable attention in the synthesis of heterogeneous catalyst for CO2 hydrogenation to methanol [33–36] since it not only greatly improves active interface and also strengthens strong metal-support interaction (SMSI) [37,38]. Although MOF-derived catalysts exhibit high catalytic performance, low stability towards MOF materials still restricts its application in CO2 hydrogenation to methanol. Recently, MOF-templated strategy not only can make nanoparticles inherit the morphology of their precursor and thereby strengthen the system stability, but also integrate the multiple functionalities in one step [39–42]. Especially, using bimetallic MOFs as templates was advantageous for interfacing with catalytically active metal, as well as strengthening synergetic effect and stability by constructing “solid solution” or “core-shell” structure [43]. Presently, the synthesis of bimetallic MOF involves one-step method [44] and post-synthetic modification method [45–47]. In spite of number attempts, there are still few successful cases of synthesis of bimetallic Cu-Zn MOF, in which the structure of bimetallic MOF synthesized by one-pot method proved to be a core-shell structure rather than a solid solution one [48,49]. In addition, only shell-core structured bimetallic Cu-Zn MOF was prepared by the post-synthetic exchange strategy [50,51]. Note that solid solution Cu-Zn bimetallic MOFs were considered to be suitable templates for the synthesis of Cu-ZnO-based catalyst since it contains both Cu2+ and Zn2+ cations uniformly distributed in its secondary building units (SBUs) [52]. Hence, developing efficient strategy for preparation of solid solution bimetallic Cu-Zn MOFs was the key to solve the uniform distribution of Cu and Zn elements in the structure of bimetallic Cu-Zn MOFs. In the present work, we propose and explore a MOF-templated strategy to synthesize a Cu-ZnO@Al2O3 catalyst for CO2 hydrogenation to methanol. Various characterization techniques including inductively coupled plasma-atomic emission spectroscopy (ICP-AES), scanning electron microscopy coupled with an element energy-dispersive X-ray spectrometer (SEM/EDX), high-resolution transmission electron microscopy (HRTEM), in situ diffuse-reflectance infrared Fourier transform spectroscopy (DRIFTS), 27Al MAS-NMR, Powder X-ray diffraction (PXRD), H2 temperature-programmed desorption (H2-TPD), X-ray photoelectron spectroscopy (XPS), CO2 temperature-programmed desorption (CO2-TPD) were conducted to reveal the origin of the enhanced catalytic activity and methanol selectivity of the newly developed Cu-ZnOMOF⊂Al2O3 catalyst in comparison with those of conventional Cu-ZnONO3/Al2O3 catalyst. Our work provides a new and versatile strategy for designing and preparing bimetallic catalysts for various heterogeneous catalytic reactions. 2 Experimental section 2.1 Catalyst preparation All chemicals of reagents grade (Aladdin Reagent English Co., Ltd) were used without further purification. Bimetallic CuZn-BTC was synthesized via a modified one-pot solvothermal method [53]. For preparing Cu-ZnOMOF⊂Al2O3 catalyst, benzene-1,3,5-tricarboxylic acid (BTC, organic linker) (7.47 mmol, 1.57 g) was dissolved in 38 mL ethanol with vigorous stirring at room temperature (RT) to obtain a clear solution. Then, the pseudo-boehmite powder (0.98 mmol, 0.07 g) was added into the above clear solution. After that, the ethanol solution (56 mL) of Cu(NO3)2∙3H2O (7.86 mmol, 1.9 g) and Zn(NO3)2∙6H2O (5.51 mmol, 1.64 g) was added into the above mixture. After being stirred at RT for 1 h, the resulted blue mixture was transformed into a Teflon-lined autoclave (100 mL), followed by a hydrothermal treatment at 125 °C for 12 h. The product was filtered and washed with ethanol several times, and then dried at 105 °C overnight. After that, the precursor was calcined at 550 °C for 6 h. The preparation procedure for the reference Cu-ZnONO3/Al2O3 catalyst using nitrates and the composition of Cu(NO3)2∙3H2O and Zn(NO3)2∙6H2O precursors were similar to that of Cu-ZnOMOF⊂Al2O3 except that BTC organic linker was not used. 2.2 Characterization XRD patterns were recorded on a D/max-2400 diffractometer (Rigaku Corp.). The average crystalline size of metallic Cu was calculated using the Scherrer formula based on the Cu (111) planes of reduced catalysts. The elemental compositions of fresh catalysts were determined on an AVIO 500 ICP-OES instrument (PerkinElmer, Inc.). N2 adsorption/desorption isotherms were performed on an Autosorb-1-MP instrument at −196 ºC (Quantachrome, Corp.). Raman spectra were collected from 50–4000 cm−1 on a Raman spectrometer using a 532 nm laser (DXR Microscope, Thermo Fisher Scientific Inc.). 27Al MAS-NMR spectra were measured on a Bruker Avance-400 spectrometer with a 4 nm zirconia rotor. The morphological characterization was conducted on a JSM-5600LV SEM/EDX instrument (JEOL Ltd.). XPS measurement was performed on an ESCALAB XI+ instrument (Thermo Fisher Scientific Inc.) equipped with an Al Kα source (1486.6 eV). H2-TPR experiment was carried out on a chemisorption instrument (FINESORB-3010H). After purged under flowing Ar (30 mL•min−1) at 300 ºC for 1 h, 20 mg of catalyst was reduced in a flow of H2/Ar (10% vol/90% vol, 15 mL∙min−1) at a ramp rate of 10 ºC∙min−1 from RT to 450 ºC. The dispersion of Cu (D Cu) and the exposed Cu surface area (S Cu) were determined by the dissociative N2O chemisorption experiment. The catalyst (100 mg) was reduced under flowing 10% H2/Ar (30 mL•min−1) at 300 ºC for 2 h, and hydrogen consumption amount was monitored with a thermal conductivity detector (TCD) and denoted as X. The reduced catalyst was flushed in flowing He (30 mL∙min−1) until the temperature dropped to 60 ºC, followed by a procedure to expose the sample to a 1% N2O/He flow (30 mL∙min−1) for 1 h. Subsequently, the catalyst was purged in flowing He (30 mL•min−1) at RT, followed by the second TPR run under the same condition as the first TPR, and H2 consumption amount was denoted as Y. The metallic Cu surface area and the Cu dispersion of the catalyst were calculated by the following equations: (1) D C u ( % ) = 100 × 2 Y X (2) S C u ( m 2 · g − 1 ) = N A × n C u S D C u × m c a t (3) n C u ( m o l ) = 2 Y Where D Cu is defined as the ratio of the amount of surface copper metal to the total amount of copper, S Cu represents the exposed copper surface area per gram catalyst, N A is the Avogadro's number (6.02 × 1023 atoms∙mol−1), n Cu in the Eq. (3) is molar number of metallic Cu, SD Cu denotes the number of copper atoms per square meter (1.47 × 1019 atoms∙m−2), m cat is the catalyst mass (g). CO2-TPD experiment was carried out on the above-mentioned chemisorption instrument. The sample (100 mg) was first pre-reduced with a flow of 10% H2/Ar (30 mL∙min−1) at 300 ºC for 2 h, then cooled down to 50 ºC under flowing He (30 mL∙min−1). After that, the sample was saturated with a pure CO2 flow (30 mL•min−1) for 1 h, then purged in flowing He (50 mL∙min−1) to remove physically adsorbed CO2. Subsequently, the temperature was elevated in flowing He (30 mL•min−1) until up to 600 ºC at a ramp rate of 10 ºC∙min−1. CO2 desorption amount was quantitatively measured based on CO2 single-pulse experiment. H2-TPD experiment was carried out on the same chemisorption apparatus with the similar method as that employed in CO2-TPD. The sample (100 mg) was first pre-reduced in a flow of 10% H2/Ar mixture (30 mL•min−1) at 300 ºC for 2 h, and then purged in Ar flow (30 mL•min−1) and cooled down to 50 ºC. After that, the sample was saturated in pure H2 for 1 h at 50 ºC. Subsequently, pure H2 was switched to pure Ar and kept at 50 ºC for 1 h to remove physisorbed H2, and then the temperature was increased up to 600 ºC at a ramp of 10 ºC•min−1. The desorbed H2 signal was monitored by a TCD detector with a relative error of ±2.5%, and H2 desorption amount was quantitatively calculated by H2 single-pulse experiment. In situ diffuse reflection infrared Fourier transform spectroscopy (DRIFTS) measurements were performed on a Bruker EQUINOX55 FTIR spectrometer with a Mercury-Cadmium-Telluride (MCT) detector. The spectra were collected from 4000 to 400 cm−1 with a resolution of 4 cm−1. Before the characterization, the catalyst was first reduced in a 10% H2/N2 flow (50 mL∙min−1) at 300 °C for 2 h, then cooled to the reaction temperature under flowing N2 (45 mL∙min−1). The background spectrum was acquired by 64 scans, then the gas flow was changed to a flowing H2/CO2 mixture (40 mL∙min−1, H2/CO2 = 3/1), and the DRIFT spectra were recorded with time at ambient pressure. 2.3 Catalytic performance measurement The catalytic activity was tested in a continuous-flow fixed-bed reactor in which a strain-steel tubular reactor (10 mm o.d.) was placed. The catalyst (100 mg) diluted with inert quartz sand was loaded between two quartz sand beds where two thermocouples were placed to monitor the catalyst bed temperature. The catalyst was first reduced in a 10% H2/N2 stream (50 mL∙min−1) at 300 ºC for 2 h under atmospheric pressure, then cooled down to the desired temperature under N2 flow. Subsequently, pure N2 was switched to a pressurized reactant gas (F total = 24 mL∙min−1, H2/CO2 = 3/1) at 3.0 MPa. The activity tests were carried out under prescribed temperatures (220, 230, 240, 250, and 260 ºC, respectively) and held with time on stream (TOS) of at least 24 h. The outlet products were on-line analyzed by a gas chromatograph (FULI GC-9790). The outlet H2O was separated by a condenser, while, CO, CO2 and CH3OH were separated by a Porapak Q column and monitored by a TCD detector using H2 as the carrier gas. CO2 conversion (X CO2) and methanol selectivity (S CH3OH) were calculated by an internal normalization method based on mass balance law, which were defined as the following Eqs. (4) and (5). (4) X C O 2 ( % ) = 100 × n C O 2 i n − n C O 2 o u t n C O 2 i n (5) S C H 3 O H ( % ) = 100 × n C H 3 O H o u t n C O 2 i n − n C O 2 o u t Where n CO2 in and n CO2 out represent the mole amount of CO2 in the inlet and outlet, respectively. The n CH3OH out stands for the mole amount of outgoing CH3OH product. The space-time yield (STY) of methanol represents the mass of methanol produced per gram catalyst per hour as defined in Eq. (6): (6) S T Y C H 3 O H ( g C H 3 O H · k g c a t − 1 · h − 1 ) = F C O 2 × X C O 2 × S C H 3 O H × M C H 3 O H 22400 × m c a t Where F CO2 is the flow rate of the inlet CO2 (mL∙min−1), M CH3OH is the methanol molecule mass (g∙mol−1), m cat is the catalyst mass (g). 3 Results and discussion 3.1 Synthesis and characterizations of Cu-Zn@MOF precursor Considering the advantages of the metal-organic framework (MOF) as precursor material (e.g., distinct crystalline, tailorable composition) for nanostructured catalyst, we proposed a MOF-templated strategy to synthesize a high-performance Cu-ZnO/Al2O3 catalyst, designated as Cu-ZnOMOF⊂Al2O3, for hydrogenation of CO2 to methanol (Scheme 1 ). Briefly, the ethanol solution of Cu(NO3)2∙3H2O and Zn(NO3)2∙6H2O, as well as BTC organic linker was mixed with the pseudo-boehmite powder under vigorous stirring to produce a uniform mixture (a). Subsequently, the self-assembly reaction under solvothermal treatments afforded the composite of bimetallic Cu-Zn@MOFs mixed with pseudo-boehmite (Cu-Zn@MOFs⊂Al2O3) (b). The Cu-Zn@MOFs⊂Al2O3 precursor was calcined in air, and then reduced with H2/N2 (10% vol/90% vol) to obtain the final octahedral like Cu-ZnOMOF⊂Al2O3 (Fig. S1) for CO2 hydrogenation (c). The bimetallic Cu-Zn@MOF was synthesized from the self-assembly reaction between Cu2+, Zn2+ ions, and BTC organic linker under hydrothermal treatment, and the Cu-Zn@MOF precursor possesses the octahedral like microstructure (Fig. S2a) that is similar to that of Cu-HKUST-1, implying that Cu substitution with Zn in Cu-HKUST-1 could not change the octahedral like structure. In addition, it can be observed in Fig. S2b that the precursor featured with octahedral microstructure consisted of a large number of spheres with a few nanometers. XRD pattern of Cu-Zn@MOF exhibited a high crystallinity, and all diffraction peaks slightly shifted to lower 2θ positions compared with those in simulated and as-prepared Cu-HKUST-1 (Fig. S3), which is because the partial smaller ionic radius of Cu2+ ions (0.73 Å) were replaced by the slightly larger ionic radius of Zn2+ (0.74 Å) ions in the bimetallic Cu-Zn@MOF. More importantly, the results of HAADF-STEM image and elemental mappings demonstrated uniform distributions of elements (Cu, Zn, Al and O) (Fig. S4), indicating the homogenous dispersion of Zn in Cu-Zn@MOF⊂Al2O3 precursor. Therefore, bimetallic Cu-Zn@MOF integrated with pseudo-boehmite as the catalyst precursor could be successfully synthesized by the above-mentioned one-step hydrothermal method. 3.2 Catalytic performance for methanol synthesis To interpret the nature of the active sites derived from the Cu-Zn@MOF, the as-prepared Cu-ZnOMOF⊂Al2O3 and Cu-ZnONO3/Al2O3 catalysts were tested for CO2 hydrogenation to methanol. CO and CH3OH are the carbon-containing products under the reaction conditions employed (T = 240 ºC, H2/CO 2 = 3/1, GHSV = 14400 h−1, P = 3 MPa). As depicted in Fig. 1 a, at 240 ºC reaction temperature, the Cu-ZnOMOF⊂Al2O3 exhibits higher methanol selectivity (86.9%) and also higher CO2 conversion (9.1%) than those with the conventional Cu-ZnONO3/Al2O3 catalyst (79.6% methanol selectivity, 5.1% CO2 conversion), which indicates that the bimetallic Cu-Zn@MOF precursor leads to a higher catalytic performance. Besides, the influences of reaction temperature on the catalytic activity and selectivity of as-prepared Cu-ZnOMOF⊂Al2O3 and Cu-ZnONO3/Al2O3 catalysts were also investigated. Similarly, only CO and methanol, as well as no methane was observed on all catalysts at the whole temperature range. As shown in Fig. 1b, CO2 conversion goes up but methanol selectivity drops down on both catalysts with elevated reaction temperature (from 220 to 260 ºC). That might be explained by the intrinsic nature of exothermic reaction towards methanol synthesis reaction ( Δ r H ( 298 K ) = −49.5 kJ•mol−1) in contrast to RWGS reaction ( Δ r H ( 298 K ) = 41.2 kJ•mol−1) [15]. As a result, decreasing reaction temperature was used as an available alternative to enhance methanol selectivity at the expense of low CO2 conversions. It is worth noting that the Cu-ZnOMOF⊂Al2O3 catalyst prepared by a MOF-templated strategy exhibits consistently higher catalytic activity with superior methanol selectivity than the conventional Cu-ZnONO3/Al2O3 catalyst under the whole range of conditions tested (from 220 to 260 ºC). The STY results of prepared Cu-ZnOMOF⊂Al2O3 catalyst was compared with those catalysts derived from MOFs (Table S1). As shown in Table S1, it can be observed that the as-synthesized Cu-ZnOMOF⊂Al2O3 catalyst exhibited excellent STY of methanol (407.2 gMeOH kgcat −1 h−1), which greatly exceeds most of catalysts (e.g., Cu-ZnO@UiO-bpy, Cu/Zr-UiO-66-COOH, Cu/Hf-UiO-66) derived from MOFs. From above, the developed Cu-ZnOMOF⊂Al2O3 catalyst demonstrated much higher STY of methanol than most of the previously reported MOFs derived catalysts, which allows the Cu-ZnOMOF⊂Al2O3 catalyst to become a promising candidate for methanol synthesis. Various characterization techniques were employed to investigate the origin of the superior catalytic performance on Cu-ZnOMOF⊂Al2O3 catalyst for CO2 hydrogenation to methanol. 3.3 The structural and morphological properties The Raman spectra were examined to identify the structural differences between Cu-ZnOMOF⊂Al2O3 and Cu-ZnONO3/Al2O3 catalysts. As depicted in Fig. 2 a, there is no Raman band corresponding to the Al2O3 due to its amorphous nature, which is consistent with XRD results. For the Raman spectra of two catalysts, the characteristic peaks located at ∼280, ∼330 and ∼610 cm−1 are assigned to the Ag, B1g, and B2g one-phonon scattering bands of CuOx species, respectively [54,55]. The broad band centered at 589 cm−1 on Cu-ZnONO3/Al2O3 is attributed to the E1 (LO) mode of ZnO [56]. In addition to these bands, the broad bands located at ∼1100 cm−1 on two catalysts are assigned to multi-phonon band of CuO x species, whose intensity is related to electronic movement along x2 − y2 plane [57]. It is worth noting that the Ag and Bg modes on Cu-ZnOMOF⊂Al2O3 (275 and 330 cm−1) shifted to lower Raman shifts and became broader than those of Cu-ZnONO3/Al2O3 (293 and 341 cm−1), indicating the presence of the greater octahedral distortion in CuO structure of the former. Moreover, the greater octahedral distortion brings about the incremental lattice strains [54], resulting in poor crystallinity of metallic Cu, which is in agreement with the above XRD analysis. In order to shed light on the effect of different precursors on the Al2O3 supports, the Cu-ZnOMOF⊂Al2O3 and Cu-ZnONO3/Al2O3 catalysts were analyzed by the 27Al solid-state MAS NMR experiments. As depicted in Fig. 2b, two characteristic peaks located at ∼81 and ∼67 ppm (chemical shift) observed for the two catalysts were assigned to 4-coordinate AlO4 sites, and the peak at ∼8 ppm was assigned to the 6-coordinate AlO6 sites [58,59]. For the NMR spectrum of Cu-ZnOMOF⊂Al2O3 catalyst, higher intensity and narrower full width at half maximum (FWHM) of characteristic peaks of 4-coordinate AlO4 sites in comparison with those of Cu-ZnONO3/Al2O3 indicates that the partial 4-coordinated AlO4 species were located in a well-defined coordination environment. Based on the previous studies [60,61], the difference in signals (located at ∼81 and ∼67 ppm chemical shifts), is ascribed to the Zn2+ sites (contained in ZnO lattice) replaced by the partial 4-coordinated Al3+ ions. The doping of 4-coordinated Al3+ ions into the ZnO lattice has a significant effect on the defect modification of ZnO surface, which can make for anchoring the Cuδ+ species and strengthen the synergetic effect of Cu-ZnO x [18]. Fig. 3 a exhibits the XRD patterns of Cu-ZnOMOF⊂Al2O3 and Cu-ZnONO3/Al2O3 catalysts prepared with different methods. The main diffraction peaks of the two catalysts located at 43.38o and 50.46° were indexed as (111) and (200) planes of metallic Cu (JCPDS-04-0836) [62]. The weak diffraction peaks for the two catalysts centered at 2θ of 36.47°, 42.32°, 61.40°, and 73.50° were indexed as (111), (200), (220) and (311) planes, respectively, of ZnO phase (JCPDS 36-1451) [63]. No characteristic Al2O3 diffraction peak was observed on the two catalysts, which can be explained by the fact that Al2O3 species existed as amorphous phase. The enlarged section (Fig. 3a, inset) displays weaker and broader metallic Cu diffraction peak in Cu-ZnOMOF⊂Al2O3 in comparison with Cu-ZnONO3/Al2O3, although two catalysts possess similar Cu loadings (Table 1 , 54 wt% and 57 wt%, respectively). Moreover, an obvious decrease in the crystalline size of metallic Cu from 21.3 nm (in Cu-ZnONO3/Al2O3) to 16.2 nm (in Cu-ZnOMOF⊂Al2O3) was observed, as shown in Table 1. The results indicate that using Cu-Zn@MOF as the precursor can effectively reduce the crystalline size of Cu particles. Similarly, the weakened and broadened ZnO diffraction peak observed in Cu-ZnOMOF⊂Al2O3 in contrast to Cu-ZnONO3/Al2O3 also indicates that the use of MOF precursor Cu-Zn@MOF led to the reduction in the crystalline size of ZnO. The N2 adsorption-desorption isotherms, BJH pore size distributions (D pore), surface specific areas (S BET) and pore volumes (V pore) of the Cu-ZnOMOF⊂Al2O3 and Cu-ZnONO3/Al2O3 catalysts were displayed in Fig. 3b and Table 1. The N2 adsorption-desorption isotherms at −196 °C of Cu-ZnOMOF⊂Al2O3 and Cu-ZnONO3/Al2O3 catalysts were of type IV with an H3-type hysteresis loop (according to the IUPAC classification) at the relative pressure range of 0.5 to 0.9 (Fig. 3b), suggesting that the existence of narrow slit-shaped mesopores [64,65]. The BJH pore size distributions (D pore) of Cu-ZnOMOF⊂Al2O3 in comparison with Cu-ZnONO3/Al2O3 as presented in Fig. 3b (insets) resulted from the stacked nanosheets. Besides, from the results of pore volumes (V pore) (Fig. 3b and Table 1) towards the Cu-ZnOMOF⊂Al2O3 (0.078 cm3⋅g−1) and Cu-ZnONO3/Al2O3 (0.073 cm3⋅g−1) catalysts, it can be speculated that the structure of precursors has no obvious effect on their pore volumes. However, the lower S BET (13.2 m2•g−1) of Cu-ZnOMOF⊂Al2O3 than that of the Cu-ZnONO3/Al2O3 (18.9 m2•g−1) was observed (inset in Fig. 3b and Table 1), which might be resulted from collapse of MOF precursor structure caused by high temperature calcination and formation of the tightly packed oxide nanoparticles (Fig. 4 a). Meanwhile, it is also suggested that the specific surface area is not the main factor for differentiating the catalytic performances of two catalysts. The metallic Cu dispersion (D Cu) and exposed Cu surface area (S Cu) determined by the N2O chemisorption experiments are important parameters for the activity of Cu-based catalysts for hydrogenation of CO2 to methanol. As shown in Table 1, the Cu-ZnOMOF⊂Al2O3 catalyst displays a higher metal Cu dispersion (20.2%) than that of Cu-ZnONO3/Al2O3 (15.4%). It can be rationalized that the use of bimetallic Cu-Zn@MOF as the precursor can improve the Cu dispersion [33,39]. Besides, it is evident that the change in CO2 conversion was in accordance with that of the D Cu, indicating that the enhanced catalytic activity of Cu-ZnOMOF⊂Al2O3 is closely related to the highly dispersed CuO species, which is also consistent with previous reports [66]. As is well known, the exposed Cu surface area (S Cu) plays an important role in the activity on Cu-based catalysts [67]. Moreover, the difference in CO2 conversion (Fig. 1) between two catalysts was in accordance with that of the S Cu values (Table 1). The larger S Cu (2.1 m2∙g−1) may result in more atomic H derived from dissociative adsorption of H2 molecules on surface Cu sites in Cu-ZnOMOF⊂Al2O3 catalyst in comparison with that in Cu-ZnONO3/Al2O3 (1.9 m2∙g−1) catalyst (Table 1), which rationalizes at least in part why the Cu-ZnOMOF⊂Al2O3 exhibited higher CO2 conversion in the hydrogenation process. The FESEM/EDX line scan, HRTEM, HADDF-STEM, H2-TPR, XPS, CO2-TPD, H2-TPD and in-situ DRIFTS characterizations were conducted to further reveal the differences in structural characteristics between the developed Cu-ZnOMOF⊂Al2O3 and conventional Cu-ZnONO3/Al2O3 catalysts. The morphology and microstructure of Cu-ZnOMOF⊂Al2O3 catalyst was examined by FESEM (Fig. 4a,b). The distribution of the elements (Cu, Zn, Al, and O) in Cu-ZnOMOF⊂Al2O3 catalyst was further confirmed by the EDX line-scan analysis (Fig. 4c,d). FESEM images revealed the presence of numerous nano-spheres of ∼40 nm size containing Cu-ZnO interacting with Al2O3 species on the surface of larger spherical particles in the microstructure. The quantitative EDX line scan results gave the surface contents of Cu, Zn, and Al elements at 29.3 wt%, 41.3 wt%, and 2.6 wt%, respectively. It is worth noting that the surface content of Zn species of Cu-ZnOMOF⊂Al2O3 (41.3 wt%) is remarkably higher than the bulk content (25.8 wt%, Table 1). It can be speculated that surface enrichment of Zn species in Cu-ZnOMOF⊂Al2O3 catalyst resulted from the MOF-templated preparation leading to migration of Zn species to metallic Cu surface. More importantly, this surface-enriched Zn species in Cu-ZnOMOF⊂Al2O3 is of great importance for the formation of more Cu-ZnO interfaces, which are of great benefit for methanol synthesis [68]. The nanostructure of the Cu-ZnOMOF⊂Al2O3 catalyst was revealed by HRTEM images, showing an intimate contact of Cu and ZnO. Fig. 4e,f display different interplanar crystal spacing of Cu-ZnOMOF⊂Al2O3 measured in different regions. Two clear lattice fringes of 0.205 and 0.280 nm were ascribed to the characteristic (111) plane of Cu and (100) plane of ZnO, respectively [69]. Several sheet-like morphologies in Cu-ZnOMOF⊂Al2O3 ranging from several ten to hundreds of nanometers of Cu exhibited a close contact with ZnO sheets, which enhances the Cu-ZnO interactions (further confirmed by the following H2-TPR analysis). Fig. 5 exhibits the SEM-EDX mappings and HRTEM images of the conventional Cu-ZnONO3/Al2O3 catalyst. From the mapping results (Fig. 5a and a1–a5), it can be observed that the elements of Cu and Zn presented apparent concentration gradient, suggesting that the type of catalyst precursors has a significant influence on the dispersion of element. Furthermore, the nanostructure and the affinity between metallic Cu and ZnO particles of the conventional Cu-ZnONO3/Al2O3 catalyst were also investigated by HRTEM images (Fig. 5b,c). As shown in Fig. 5b, the nanostructure of Cu-ZnONO3/Al2O3 catalyst is composed of stacked nanosheets with several sizes classes. Fig. 5c displays two clear interplanar crystal spacing (0.205 and 0.280 nm, respectively) measured in different regions, which correspond to the characteristic (111) plane of Cu and (100) plane of ZnO, respectively. Moreover, it can be seen that the slightly larger size of metallic Cu particle has no obvious contact with the edge of ZnO particle, which is undesired for forming the Cu-ZnO x interfaces and does not facilitate the SMSI interaction. Furthermore, the HAADF-STEM-EDS mapping was also conducted to investigate the distributions of Cu, Zn, and Al elements in Cu-ZnOMOF⊂Al2O3 and Cu-ZnONO3/Al2O3 catalysts. By comparison of HAADF-STEM images and corresponding EDS elemental mappings of Cu-ZnOMOF⊂Al2O3 and Cu-ZnONO3/Al2O3 catalysts, it can be observed that no agglomeration of Cu, Zn, and Al species occurs in Cu-ZnOMOF⊂Al2O3 catalyst. In sharp contrast, the concentrated distribution especially for Cu species as well as the distinct separation between Cu and Zn species were observed in Cu-ZnONO3/Al2O3 catalyst. It is explicitly illustrated that using Cu-Zn@MOF precursor can efficiently improve the affinity between Cu and Zn species, which is consistent with the above TEM and SEM results. Moreover, from the EDS spectra (Fig. 6 c), a significant decrease in the intensity of Cu element characteristic peak of Cu-ZnOMOF⊂Al2O3 can be found in comparison wth those on the conventional Cu-ZnONO3/Al2O3 (Fig. 6f), further revealing that Cu element is homogenously dispersed on the surface. 3.4 The reducibility and the synergetic effect of Cu-ZnO The H2-TPR experiments were conducted on Cu-ZnOMOF⊂Al2O3 and Cu-ZnONO3/Al2O3 catalysts to explore their redox behaviors. As shown in Fig. 7 , for Cu-ZnOMOF⊂Al2O3 catalyst, a broad reduction peak (in the range of 100–350 ºC) featured a main peak around 260 °C accompanied by two obvious shoulder peaks (243 and 224 °C), suggesting that a complicated reduction process for CuO species (Generally, the pure bulk ZnO is reduced at a temperature above 427 °C, and Al2O3 is hardly reduced by H2) [70]. The peaks located at 224 °C might be attributed to the reduction in the dispersed CuO x species [71,72], whereas the peak (243 and 257 ºC) located at higher reduction temperature were ascribed to the reduction of CuO x species strongly interacting with ZnO/Al2O3 matrix [73,74]. Notably, the reduction peak for CuO species in Cu-ZnOMOF⊂Al2O3 shifted to lower temperature (243 ºC) compared with that in Cu-ZnONO3/Al2O3 (247 ºC), which was attributed to the intensified Cu-ZnO x interaction. For the reduction peak located at 257 ºC in Cu-ZnOMOF⊂Al2O3 catalyst, which may be ascribed to the reduction of CuO species strongly interacting with ZnO promoted by the formation of ZnO overlayer [70], which is also consistent with above TEM result. The surface state of catalyst has a major impact on its catalytic behavior, the elemental chemical state and surface composition of the calcined and reduced Cu-ZnOMOF⊂Al2O3 and Cu-ZnONO3/Al2O3 catalysts were further evaluated by X-ray photoelectron spectroscopy (XPS) analysis. Cu 2p spectra on the two calcined catalysts (Fig. 8 a) exhibited distinct satellite peaks in the ranges of 950–965 eV and 940–945 eV, which is characteristic of Cu2+ species. As compared to Cu-ZnONO3/Al2O3 catalyst, the peaks corresponding to Cu 2p1/2 and Cu 2p3/2 spectra on Cu-ZnOMOF⊂Al2O3 shifted to lower binding energies, suggesting that electron densities increase in d band and decrease in sp band [55]. It is also revealed that the copper species derived from the Cu-Zn@MOFs significantly differs from the copper species derived from the Cu(NO3)2 precursor. However, opposite peak shifts occurred on Zn 2p spectra (Fig. 8b) compared with Cu 2p spectra. It can be observed that the binding energies of Zn 2p (2p3/2 and 2p1/2) peaks are in agreement with values of bulk ZnO [75]. In comparison with conventional Cu-ZnONO3/Al2O3 catalyst, the characteristic peak of Zn2+ species on Cu-ZnOMOF⊂Al2O3 slightly shifts to higher binding energies, implying that Cu-Zn@MOFs as the ZnO precursor affects the electronic structure and decreases electron densities in Zn nucleus. From these results, there appears to be strong interaction between CuO and ZnO (the detailed explanations were provided in the supporting information), which is also consistent with above H2-TPR analysis for Cu-ZnOMOF⊂Al2O3 (Fig. 7). Moreover, the surface compositions in Table 2 show that the surface concentration of Zn species on Cu-ZnOMOF⊂Al2O3 (30.0%) is higher than that on Cu-ZnONO3/Al2O3 (27.2%), indicating the enriched Zn species were generated on the surface of Cu-ZnOMOF⊂Al2O3 catalyst. Furthermore, the XPS analysis of the two reduced catalysts was performed to explore the shed light on the interaction between Cu and ZnO at the interface. As depicted in Fig. 8c, the absence of “satellites” peaks in Cu 2p spectra of reduced Cu-ZnOMOF⊂Al2O3 and Cu-ZnONO3/Al2O3 suggests that the Cu2+ is completely reduced into Cu0 and/or Cu1+ [76]. The similar chemical-shift trends of Cu 2p core level for Cu-ZnOMOF⊂Al2O3 and Cu-ZnONO3/Al2O3 catalysts, reveal the increased electron density of metallic Cu in Cu-ZnOMOF⊂Al2O3 catalyst (charge transfer from ZnO) due to strengthened Cu-ZnO interaction and reduced average nanoparticle size of metallic Cu, which is consistent with above H2-TPR (Fig. 7) and XRD (Fig. 3a) experimental results. Meanwhile, from the O 1s XPS analysis (Fig. 8d), the main peak (∼530 eV) and the weak shoulder peak (∼531 and ∼532 eV) are assigned to the lattice oxygen in ZnO (OL) and hydroxyl groups (OOH) on the ZnO surface and surface adsorbed oxygen species (Oads) (e.g., O2 and H2O species), respectively [77]. As compared to Cu-ZnONO3/Al2O3, the characteristic peak assigned to the lattice oxygen of Cu-ZnOMOF⊂Al2O3 catalyst shifted to higher binding energy, further supporting that charge transfer from ZnO to metallic Cu occurred at Cu-ZnO interfaces. Moreover, the O 1s XPS spectra confirms that the Cu-ZnOMOF⊂Al2O3 catalyst exhibits a larger percentage content of lattice oxygen (71.6%) in the total oxygen species than Cu-ZnONO3/Al2O3 (64.0%) (Table 2). The more abundant lattice oxygen content may facilitate forming Cu-ZnO x interfaces in Cu-ZnOMOF⊂Al2O3 catalyst beneficial to its high methanol STY [15,69]. 3.5 The CO2 and H2 adsorption In order to explore the CO2 adsorption/desorption property of Cu-ZnOMOF⊂Al2O3 and Cu-ZnONO3/Al2O3 catalysts, the CO2-TPD experiments were performed. As depicted in Fig. 9 a, both catalysts exhibited broad overlapping curves in the range of 30–400 ºC. To distinguish the different basic sites on the surface of the two catalysts, the curves were deconvoluted into three peaks, which are denoted as ɑ, β, and γ peak, respectively. The low temperature (ɑ peak) was assigned to the weakly basic sites originated from surface hydroxyl groups [78]. The β and γ peaks were attributed to moderately and strongly basic sites, respectively [79]. The moderately basic sites are considered to be metal-oxygen pairs (such as Zn-O, Al-O), and the strongly basic sites are related with coordinatively unsaturated O2- ions. According to the previous reports [80–82], the adsorbed surface species corresponding to the low temperature (ɑ peak) was attributed to bicarbonate species derived from CO2 adsorbed on surface hydroxyl groups, and the adsorbed species, located at β and γ peaks, were assigned to the bidentate and unidentate, and/or monodentate carbonates species formed by CO2 activated on defects and oxygen vacancies. The Cu-ZnOMOF⊂Al2O3 exhibited a little higher desorption temperature (87, 137, and 213 ºC, respectively) than those on the conventional Cu-ZnONO3/Al2O3 catalyst (85, 131, and 211 ºC, respectively), suggesting that the Cu-ZnOMOF⊂Al2O3 has slightly stronger basicity than those of Cu-ZnONO3/Al2O3. Meanwhile, the amounts of CO2 desorbed from three different basic sites (ɑ, β, and γ peaks, respectively) on the two catalysts were quantitatively calculated and summarized in Table 2. The amounts of CO2 desorbed from ɑ (51.4 umol•g−1), β (41.8 umol•g−1), and γ (41.9 umol•g−1) basic sites in Cu-ZnOMOF⊂Al2O3 are much larger than those in Cu-ZnONO3/Al2O3 (32.9, 27.1, and 22.1 umol•g−1, respectively), which indicates that the catalyst prepared using Cu-Zn@MOF as the precursor has more basic sites that adsorb more CO2. Moreover, the total CO2 desorption of Cu-ZnOMOF⊂Al2O3 catalyst (135.1 umol•g−1) is significantly higher than that of Cu-ZnONO3/Al2O3 (82.1 umol•g−1). As compared to conventional Cu-ZnONO3/Al2O3 catalyst, the percentage increments in the number of different basic sites on the newly developed Cu-ZnOMOF⊂Al2O3 catalyst, which was calculated based on CO2 adsorption amounts towards three desorption peaks of two catalysts, corresponded to 56.2% (weakly basic sites), 54.2% (moderately basic sites), 89.1% (strongly basic sites), respectively. In other words, the increase in total basic sites is mainly ascribed to the formation of more coordinatively unsaturated O2- ions on the surface, which could be generated from calcination of MOFs in air and substitution of Zn2+ with Al3+ (confirmed by above 27Al NMR analysis).Meanwhile, strongly basic sites are regarded as superior adsorption site on which the intermediates (e.g., formates, carbonates, etc.) adsorbed on surface can be more readily hydrogenated to methanol in comparison with those adsorbed on weakly and moderately basic sites. Moreover, methanol selectivity towards CO2 hydrogenation reaction seems to have a linear relationship with the proportion of strongly basic sites occupied in the total basic sites number [83]. It can be speculated that using Cu-Zn@MOFs precursor can endow the newly developed Cu-ZnOMOF⊂Al2O3 catalyst with the stronger ability to transform the intermediates to methanol, thereby resulting in the enhanced methanol selectivity. That is a reason why the Cu-ZnOMOF⊂Al2O3 catalyst shows superior methanol selectivity with high CO2 conversion compared to Cu-ZnONO3/Al2O3 catalyst. In order to examine the interaction of hydrogen with the catalyst surfaces, the H2-TPD was carried out on the reduced catalysts. Fig. 9b displays two broad and overlapped curves separately for Cu-ZnOMOF⊂Al2O3 and Cu-ZnONO3⊂Al2O3 catalysts between 30 and 500 °C. To gain insight into the desorption process, the profile was deconvoluted into three Gaussian peaks, denoted as α, β and γ peak, respectively. The α peak located at ∼85 °C on both catalysts was assigned to associated H2 desorption from surface dispersed Cu sites [84]. While the β peak centered ∼140 °C was ascribe to desorbed H2 evolving from subsurface atomic H in Cu [85]. The γ peaks (located at ∼250 ºC) might be ascribed to the desorption of Hδ+-Hδ- species (heterolytic split of H2) arised from the “p-type” semiconductor behavior of ZnO, and the spillover phenomena driven by SMSI (Cu-ZnO x ) significantly affects the H2 adsorption on the surface of ZnO [86,87]. As depicted in Fig. 9b, the desorption peak intensities with Cu-ZnOMOF⊂Al2O3 (90, 153, and 240 ºC) are higher than those with Cu-ZnONO3/Al2O3 catalyst (83, 135, and 238 ºC), indicating that the catalyst derived from Cu-Zn@MOF precursor adsorbed more hydrogen on the catalyst surface. The amounts of H2 desorption were also quantitatively calculated based on the TPD profiles and summarized in Table 2. From the data of ɑ peak, the amount of H2 desorbed from the Cu sites on Cu-ZnOMOF⊂Al2O3 (214 umol•g−1) is much more than that on Cu-ZnONO3/Al2O3 (167 umol•g−1), implying more dispersed Cu nanoparticles exposed on the surface. It is also in agreement with the results of metallic Cu surface area (Table 1). Besides, the β peak for H2 consumption with Cu-ZnOMOF⊂Al2O3 is slightly inferior to that of Cu-ZnONO3/Al2O3 due to less bulk Cu. On the other hand, distinctly higher amount of H2 desorbed corresponding to γ peak for Cu-ZnOMOF⊂Al2O3 (215 umol•g−1) than that in Cu-ZnONO3/Al2O3 (182 umol•g−1) can be seen, which indicates larger number of ZnO sites interacting with Cu on surface, which may also reflect on the hydrogen spillover effect derived by the synergy between Cu and ZnO in the former. In comparison with that in Cu-ZnONO3/Al2O3, higher H2 desorption amount for Cu-ZnOMOF⊂Al2O3 represents higher ability to activate H2, which facilitates hydrogenation of intermediates to methanol. 3.6 In-situ DRIFTS measurements To further identify the intermediates during CO2 hydrogenation, in-situ DRIFTS experiments were performed on the reduced Cu-ZnOMOF⊂Al2O3 and Cu-ZnONO3/Al2O3 catalysts. As shown in in-situ DRIFTS spectra (Fig. 10 a), some combinational bands appeared in the region of 3500–3800 cm−1. The combinational bands at 3730 and 3703 cm−1 were attributed to the vibrations of υ 1 (1388 cm−1, symmetric stretching vibration [ υ s ( C = O ) ]) + υ 3 (2349 cm−1, asymmetric stretching vibration [ υ as ( C = O ) ]), and the other combinational bands at 3631 and 3596 cm−1 were ascribed to the vibrations of 2 υ 2 (667 cm−1, bending vibration [ β ( C = O ) ]) + υ 3 (2349 cm−1, asymmetric stretching vibration [ υ as ( C = O ) ]), respectively [88]. Moreover, the bands at 2179 and 2114 cm−1 were assigned to adsorbed gaseous CO [62], which was originated from the desorption of *CO species adsorbed on catalyst surface [89]. As depicted in Fig. 10a,b, for two spectra of catalysts, the bands at 2179 and 2112 cm−1 are characteristic of gaseous CO, indicating the occurrence of the reverse water-gas shift (RWGS) reaction. Moreover, the peak intensity of CO gas phase towards Cu-ZnOMOF⊂Al2O3 gradually increased (from 18 to 40 min) and reached the steady state after 40 min. However, for Cu-ZnONO3/Al2O3 catalyst, the peak intensity of CO gas phase rapidly increased (within 6 min) and reached the steady state at 12 min. All of which suggested that RWGS side reaction was more easily to happen on Cu-ZnONO3/Al2O3 over Cu-ZnOMOF⊂Al2O3, which is consistent with above catalytic results. As depicted in Fig. 10c, there are three bands located at 3650, 3677 and 3568 cm−1 corresponded to different types of hydroxyl groups (-OH) [90]. The band at 3650 cm−1 was assigned to OH groups derived from the interaction between H with surface O atoms. The other bands located at 3677 and 3568 cm−1 were related to the surface -OH species derived from the partial dissociation of chemisorbed H2O molecules during the hydrogenation process [91]. The broad bands centered at 3257 cm−1 are characteristic of the stretching mode of strong H-bonded OH groups resulting from the two neighboring water molecules. As shown in Fig. 10b, the “teeth-like” bands in the range of 1600–1800 cm−1 were ascribed to the presence of water produced from the reverse gas-water-shift (RWGS, CO2+H2 → CO+H2O) reaction as well as methanol synthesis main reaction [92,93]. In order to show the varying tendencies of the H2O molecules during the CO2 hydrogenation with different time on stream (from 6 to 24 min), the enlarged section is displayed in Fig. 10f. For the Cu-ZnOMOF⊂Al2O3, the broad bands intensity of surface H2O molecules (3257 cm−1) reached a steady state after the reaction for 24 min, whereas for spectra of Cu-ZnONO3/Al2O3 catalyst, the sharp bands of surface H2O molecules reached its steady state immediately within the initial 6 min reaction time. Moreover, the conventional Cu-ZnONO3/Al2O3 exhibited more intensive bands of surface H2O molecules in comparison with the Cu-ZnOMOF⊂Al2O3 catalyst in the range of 1600–1800 cm−1. In addition, as depicted in enlarged section (Fig. 10d,e), for Cu-ZnOMOF⊂Al2O3, the intensities from the band of gaseous methanol molecule (1030 cm−1) [92,93] are higher than that on Cu-ZnONO3/Al2O3 catalyst during all the 60 min time on stream. It can be seen that All of these results suggested that MOF-templated strategy led to Cu-ZnOMOF⊂Al2O3 catalyst effective for promoting selective production of methanol molecule on the surface, and could efficiently suppress the occurrence of RWGS side reaction during the CO2 hydrogenation to methanol. 3.7 Comparative performance of catalysts with time on stream CO2 conversion, methanol selectivity and STYs of methanol with Cu-ZnOMOF⊂Al2O3 and Cu-ZnONO3/Al2O3 catalysts were comparatively examined with time on stream for 30 h. As shown in Fig. 11 a, the methanol selectivity of Cu-ZnOMOF⊂Al2O3 and Cu-ZnONO3/Al2O3 catalysts maintained consistently for the whole period. An apparent decrease in CO2 conversion was observed on Cu-ZnONO3/Al2O3 with time on stream for 30 h. However, CO2 conversion of Cu-ZnOMOF⊂Al2O3 only manifested a slight reduction and remained stable at a higher conversion level, indicating little deactivation for Cu-ZnOMOF⊂Al2O3 catalyst (Fig. 11b). Fig. 11c shows the STYs of methanol over both catalysts for 30 h on stream. Likewise, the STY of methanol on Cu-ZnOMOF⊂Al2O3 decreased from 404.9 to 366.7 gMeOH∙kgcat −1∙h−1 for 30 h, which represents a decrease by 9.4%. In sharp contrast, a major reduction in STY of methanol occurred on Cu-ZnONO3/Al2O3 from 210.3 to 155.7 gMeOH∙kgcat −1∙h−1 for the same time on stream, with 25.9% reduction. It is remarkable that Cu-ZnOMOF⊂Al2O3 catalyst synthesized by a MOF-templated strategy exhibits a more stable catalytic activity with very high methanol selectivity for 30 h on stream. 4 Conclusion A novel Cu-ZnO/Al2O3 catalyst (Cu-ZnOMOF⊂Al2O3) was synthesized using a bimetallic MOF-templated strategy for CO2 hydrogenation to methanol. The newly developed Cu-ZnOMOF⊂Al2O3 catalyst shows outstanding methanol selectivity and higher activity and stability in CO2 hydrogenation to methanol compared with a conventional Cu-ZnONO3/Al2O3Catalyst. In-situ DRIFTS experiments confirm that the Cu-ZnOMOF⊂Al2O3 catalyst can efficiently suppress RWGS reaction and improve the selective CO2 hydrogenation to methanol. Various characterization results have revealed that the remarkably improved catalytic selectivity to methanol and activity for CO2 hydrogenation over the newly developed Cu-ZnOMOF⊂Al2O3 catalyst can be attributed to highly dispersed copper nanoparticles, surface-enriched ZnO species, and more abundant Cu-ZnO x interfaces. From CO2-TPD and H2-TPD, more medium-strength metal-oxygen basic sites facilitated CO2 adsorption, and the enhanced H2 dissociation resulted from the strengthened Cu-ZnO synergetic effect promoted by using the Cu-Zn@MOF precursor. We hope this work will provide a new strategy to optimize the activity and selectivity of industrial Cu/ZnO/Al2O3 catalyst for CO2 hydrogenation for methanol production. CRediT authorship contribution statement Tianqinji Qi: Investigation, Methodology, Writing – original draft, Visualization. Yiming Zhao: Methodology, Visualization. Shaoyun Chen: Resources, Funding acquisition. Weizuo Li: Conceptualization, Supervision, Writing – review & editing. Xinwen Guo: Conceptualization, Supervision, Writing – review & editing. Yongchun Zhang: Conceptualization, Supervision, Writing – review & editing, Funding acquisition. Chunshan Song: Formal analysis, Conceptualization, Supervision, Writing – review & editing. Declaration of Competing Interest The authors declare that they have no known competing financial interests or personal relationships that could have appeared to influence the work reported in this paper. Acknowledgments This work was financially supported by the National Key Research and Development Program of China (No. 2017YFB0603301), and the authors are thankful for the funding support from Xinjiang Dunhua Petroleum Technology Co., Ltd. Many thanks to Dr. Jing Wang, Dr. Xuewei Li and Dr. Wei She for their help in the experiment and the Analysis and Testing Center of DUT for analytical support. Supplementary materials Supplementary material associated with this article can be found, in the online version, at doi:10.1016/j.mcat.2021.111870. Appendix Supplementary materials Image, application 1 References [1] X. Jiang X. Nie X. Guo C. Song J.G. Chen Recent advances in carbon dioxide hydrogenation to methanol via heterogeneous catalysis Chem. Rev. 120 2020 7984 8034 X. Jiang, X. Nie, X. Guo, C. Song, J.G. Chen, Recent advances in carbon dioxide hydrogenation to methanol via heterogeneous catalysis, Chem. Rev.120 (2020) 7984-8034. [2] J. Zhong X. Yang Z. Wu B. Liang Y. Huang T. Zhang State of the art and perspectives in heterogeneous catalysis of CO2 hydrogenation to methanol Chem. Soc. Rev. 49 2020 1385 1413 J. Zhong, X. Yang, Z. Wu, B. Liang, Y. Huang, T. Zhang, State of the art and perspectives in heterogeneous catalysis of CO2 hydrogenation to methanol, Chem. Soc. Rev.49 (2020) 1385-1413. [3] G.A. Olah G.K.S. Prakash A. Goeppert Anthropogenic chemical carbon cycle for a sustainable future J. Am. Chem. Soc. 133 2011 12881 12898 G.A. Olah, G.K.S. Prakash, A. Goeppert, Anthropogenic chemical carbon cycle for a sustainable future, J. Am. Chem. Soc.133 (2011) 12881-12898. [4] T.T.N. Vu A. Desgagnés M.C. Iliuta Efficient approaches to overcome challenges in material development for conventional and intensified CO2 catalytic hydrogenation to CO, methanol, and DME Appl. Catal. A Gen. 617 2021 118119 T.T.N. Vu, A. Desgagnés, M.C. Iliuta, Efficient approaches to overcome challenges in material development for conventional and intensified CO2 catalytic hydrogenation to CO, methanol, and DME, Appl. Catal. A Gen.617 (2021) 118119. [5] J. Artz T.E. Müller K. Thenert J. Kleinekorte R. Meys A. Sternberg A. Bardow W. Leitner Sustainable conversion of carbon dioxide: an integrated review of catalysis and life cycle assessment Chem. Rev. 118 2018 434 504 J. Artz, T.E. Müller, K. Thenert, J. Kleinekorte, R. Meys, A. Sternberg, A. Bardow, W. Leitner, Sustainable conversion of carbon dioxide: an integrated review of catalysis and life cycle assessment, Chem. Rev.118 (2018) 434-504. [6] Q. Jiang Y. Liu T. Dintzer J. Luo K. Parkhomenko A. Roger Tuning the highly dispersed metallic Cu species via manipulating Brønsted acid sites of mesoporous aluminosilicate support for CO2 hydrogenation reactions Appl. Catal. B Environ. 269 2020 118804 Q. Jiang, Y. Liu, T. Dintzer, J. Luo, K. Parkhomenko, A. Roger, Tuning the highly dispersed metallic Cu species via manipulating Brønsted acid sites of mesoporous aluminosilicate support for CO2 hydrogenation reactions, Appl. Catal. B Environ.269 (2020) 118804. [7] K. Mori T. Sano H. Kobayashi H. Yamashita Surface engineering of a supported PdAg catalyst for hydrogenation of CO2 to formic acid: elucidating the active Pd atoms in alloy nanoparticles J. Am. Chem. Soc. 140 2018 8902 8909 K. Mori, T. Sano, H. Kobayashi, H. Yamashita, Surface engineering of a supported PdAg catalyst for hydrogenation of CO2 to formic acid: elucidating the active Pd atoms in alloy nanoparticles, J. Am. Chem. Soc.140 (2018) 8902-8909. [8] G.A. Olah Towards oil independence through renewable methanol chemistry Angew. Chem. Int. Ed. 52 2013 104 107 G.A. Olah, Towards oil independence through renewable methanol chemistry, Angew. Chem. Int. Ed.52 (2013) 104-107. [9] P. Gao S. Li X. Bu S. Dang Z. Liu H. Wang L. Zhong M. Qiu C. Yang J. Cai W. Wei Y. Sun Direct conversion of CO2 into liquid fuels with high selectivity over a bifunctional catalyst Nat. Chem. 9 2017 1019 1024 P. Gao, S. Li, X. Bu, S. Dang, Z. Liu, H. Wang, L. Zhong, M. Qiu, C. Yang, J. Cai, W. Wei, Y. Sun, Direct conversion of CO2 into liquid fuels with high selectivity over a bifunctional catalyst, Nat. Chem.9 (2017) 1019-1024. [10] A. Ramirez L. Gevers A. Bavykina S. Ould-Chikh J. Gascon Metal organic framework-derived iron catalysts for the direct hydrogenation of CO2 to short chain olefins ACS Catal 8 2018 9174 9182 A. Ramirez, L. Gevers, A. Bavykina, S. Ould-Chikh, J. Gascon, Metal organic framework-derived iron catalysts for the direct hydrogenation of CO2 to short chain olefins, ACS Catal. 8 (2018) 9174-9182. [11] Z. Li J. Wang Y. Qu H. Liu C. Tang S. Miao Z. Feng H. An C. Li Highly selective conversion of carbon dioxide to lower olefins ACS Catal 7 2017 8544 8548 Z. Li, J. Wang, Y. Qu, H. Liu, C. Tang, S. Miao, Z. Feng, H. An, C. Li, Highly selective conversion of carbon dioxide to lower olefins, ACS Catal. 7 (2017) 8544-8548. [12] T.B.H. Nguyen E. Zondervan Methanol production from captured CO2 using hydrogenation and reforming technologies environmental and economic evaluation J. CO2 Util. 34 2019 1 11 T.B.H. Nguyen, E. Zondervan, Methanol production from captured CO2 using hydrogenation and reforming technologies environmental and economic evaluation, J. CO2 Util.34 (2019) 1-11. [13] K.W. Ting T. Toyao S.M.A.H. Siddiki K. Shimizu Low-temperature hydrogenation of CO2 to methanol over heterogeneous TiO2-supported Re catalysts ACS Catal 9 2019 3685 3693 K.W. Ting, T. Toyao, S.M.A.H. Siddiki, K. Shimizu, Low-temperature hydrogenation of CO2 to methanol over heterogeneous TiO2-supported Re catalysts, ACS Catal. 9 (2019) 3685-3693. [14] S. Tada S. Kayamori T. Honma H. Kamei A. Nariyuki K. Kon T. Toyao K. Shimizu S. Satokawa Design of interfacial sites between Cu and amorphous ZrO2 dedicated to CO2-to-methanol hydrogenation ACS Catal 8 2018 7809 7819 S. Tada, S. Kayamori, T. Honma, H. Kamei, A. Nariyuki, K. Kon, T. Toyao, K. Shimizu, S. Satokawa, Design of interfacial sites between Cu and amorphous ZrO2 dedicated to CO2-to-methanol hydrogenation, ACS Catal. 8 (2018) 7809-7819. [15] T. Liu X. Hong G. Liu In situ generation of the Cu@3D-ZrOx framework catalyst for selective methanol synthesis from CO2/H2 ACS Catal 10 2020 93 102 T. Liu, X. Hong, G. Liu, In situ generation of the Cu@3D-ZrOx framework catalyst for selective methanol synthesis from CO2/H2, ACS Catal. 10 (2020) 93-102. [16] S.K. Sharma T.S. Khan R.K. Singha B. Paul M.K. Poddar T. Sasaki A. Bordoloi C. Samanta S. Gupta R. Bal Design of highly stable MgO promoted Cu/ZnO catalyst for clean methanol production through selective hydrogenation of CO2 Appl. Catal. A Gen. 623 2021 118239 S.K. Sharma, T.S. Khan, R.K. Singha, B. Paul, M.K. Poddar, T. Sasaki, A. Bordoloi, C. Samanta, S. Gupta, R. Bal, Design of highly stable MgO promoted Cu/ZnO catalyst for clean methanol production through selective hydrogenation of CO2, Appl. Catal. A Gen.623 (2021) 118239. [17] A.V. Tarasov F. Seitz R. Schlögl E. Frei In situ quantification of reaction adsorbates in low-temperature methanol synthesis on a high-performance Cu/ZnO:Al catalyst ACS Catal 9 2019 5537 5544 A.V. Tarasov, F. Seitz, R. Schlögl, E. Frei, In situ quantification of reaction adsorbates in low-temperature methanol synthesis on a high-performance Cu/ZnO:Al catalyst, ACS Catal. 9 (2019) 5537-5544. [18] M. Behrens S. Zander P. Kurr N. Jacobsen J. Senker G. Koch T. Ressler R.W. Fischer R. Schlögl Performance improvement of nanocatalysts by promoter-induced defects in the support material: methanol synthesis over Cu/ZnO:Al J. Am. Chem. Soc. 135 2013 6061 6068 M. Behrens, S. Zander, P. Kurr, N. Jacobsen, J. Senker, G. Koch, T. Ressler, R.W. Fischer, R. Schlögl, Performance improvement of nanocatalysts by promoter-induced defects in the support material: methanol synthesis over Cu/ZnO:Al, J. Am. Chem. Soc.135 (2013) 6061-6068. [19] X. Zhang G. Zhang W. Liu F. Yuan J. Wang J. Zhu X. Jiang A. Zhang F. Ding C. Song X. Guo Reaction-driven surface reconstruction of ZnAl2O4 boosts the methanol selectivity in CO2 catalytic hydrogenation Appl. Catal. B Environ. 284 2021 119700 X. Zhang, G. Zhang, W. Liu, F. Yuan, J. Wang, J. Zhu, X. Jiang, A. Zhang, F. Ding, C. Song, X. Guo, Reaction-driven surface reconstruction of ZnAl2O4 boosts the methanol selectivity in CO2 catalytic hydrogenation, Appl. Catal. B Environ.284 (2021) 119700. [20] S. Kattel P. Liu J.G. Chen Tuning selectivity of CO2 hydrogenation reactions at the metal/oxide interface J. Am. Chem. Soc. 139 2017 9739 9754 S. Kattel, P. Liu, J.G. Chen, Tuning selectivity of CO2 hydrogenation reactions at the metal/oxide interface, J. Am. Chem. Soc.139 (2017) 9739-9754. [21] I.U. Din M.S. Shaharun M.A. Alotaibi A.I. Alharthi A. Naeem Recent developments on heterogeneous catalytic CO2 reduction to methanol J. CO2 Util. 34 2019 20 33 I.U. Din, M.S. Shaharun, M.A. Alotaibi, A.I. Alharthi, A. Naeem, Recent developments on heterogeneous catalytic CO2 reduction to methanol, J. CO2 Util.34 (2019) 20-33. [22] V. Deerattrakul N. Yigit G. Rupprechter P. Kongkachuichay The roles of nitrogen species on graphene aerogel supported Cu-Zn as efficient catalysts for CO2 hydrogenation to methanol Appl. Catal. A Gen. 580 2019 46 52 V. Deerattrakul, N. Yigit, G. Rupprechter, P. Kongkachuichay, The roles of nitrogen species on graphene aerogel supported Cu-Zn as efficient catalysts for CO2 hydrogenation to methanol, Appl. Catal. A Gen.580 (2019) 46-52. [23] V. Schott H. Oberhofer A. Birkner M. Xu Y. Wang M. Muhler K. Reuter C. Wöll Chemical activity of thin oxide layers: strong interactions with the support yield a new thin-film phase of ZnO Angew. Chem. Int. Ed. 52 2013 11925 11929 V. Schott, H. Oberhofer, A. Birkner, M. Xu, Y. Wang, M. Muhler, K. Reuter, C. Wöll, Chemical activity of thin oxide layers: strong interactions with the support yield a new thin-film phase of ZnO, Angew. Chem. Int. Ed.52 (2013) 11925-11929. [24] T. Lunkenbein J. Schumann M. Behrens R. Schlögl M.G. Willinger Formation of a ZnO overlayer in industrial Cu/ZnO/Al2O3 catalysts induced by strong metal-support interactions Angew. Chem. Int. Ed. 54 2015 4544 4548 T. Lunkenbein, J. Schumann, M. Behrens, R. Schlögl, M.G. Willinger, Formation of a ZnO overlayer in industrial Cu/ZnO/Al2O3 catalysts induced by strong metal-support interactions, Angew. Chem. Int. Ed.54 (2015) 4544-4548. [25] T. Koitaya S. Yamamoto Y. Shiozawa Y. Yoshikura M. Hasegawa J. Tang K. Takeuchi K. Mukai S. Yoshimoto I. Matsuda J. Yoshinobu CO2 activation and reaction on Zn-deposited Cu surfaces studied by ambient-pressure X-ray photoelectron spectroscopy ACS Catal 9 2019 4539 4550 T. Koitaya, S. Yamamoto, Y. Shiozawa, Y. Yoshikura, M. Hasegawa, J. Tang, K. Takeuchi, K. Mukai, S. Yoshimoto, I. Matsuda, J. Yoshinobu, CO2 activation and reaction on Zn-deposited Cu surfaces studied by ambient-pressure X-ray photoelectron spectroscopy, ACS Catal. 9 (2019) 4539-4550. [26] S. Ren X. Fan Z. Shang W.R. Shoemaker L. Ma T. Wu S. Li N.B. Klinghoffer M. Yu X. Liang Enhanced catalytic performance of Zr modified CuO/ZnO/Al2O3 catalyst for methanol and DME synthesis via CO2 hydrogenation J. CO2 Util. 36 2020 82 95 S. Ren, X. Fan, Z. Shang, W.R. Shoemaker, L. Ma, T. Wu, S. Li, N.B. Klinghoffer, M. Yu, X. Liang, Enhanced catalytic performance of Zr modified CuO/ZnO/Al2O3 catalyst for methanol and DME synthesis via CO2 hydrogenation, J. CO2 Util.36 (2020) 82-95. [27] R. van den G. Berg G. Prieto L.I. Korpershoek A.J. van der Wal S. van Bunningen P.E. Lægsgaard-Jørgensen K.P. de Jongh Jong de Structure sensitivity of Cu and CuZn catalysts relevant to industrial methanol synthesis Nat. Commun. 7 2016 13057 R. van den Berg, G. Prieto, G. Korpershoek, L.I. van der Wal, A.J. van Bunningen, S. Lægsgaard-Jørgensen, P.E. de Jongh, K.P. de Jong, Structure sensitivity of Cu and CuZn catalysts relevant to industrial methanol synthesis, Nat. Commun.7 (2016) 13057. [28] G. Bonura M. Cordaro C. Cannilla F. Arena F. Frusteri The changing nature of the active site of Cu-Zn-Zr catalysts for the CO2 hydrogenation reaction to methanol Appl. Catal. B Environ. 152-153 2014 152 161 G. Bonura, M. Cordaro, C. Cannilla, F. Arena, F. Frusteri, The changing nature of the active site of Cu-Zn-Zr catalysts for the CO2 hydrogenation reaction to methanol, Appl. Catal. B Environ.152-153 (2014) 152-161. [29] S. Natesakhawat J.W. Lekse J.P. Baltrus P.R. Ohodnicki B.H. Howard X. Deng C. Matranga Active Sites and Structure–Activity Relationships of Copper-Based Catalysts for Carbon Dioxide Hydrogenation to Methanol ACS Catal 2 2012 1667 1676 S. Natesakhawat, J.W. Lekse, J.P. Baltrus, P.R. Ohodnicki, B.H. Howard, X. Deng, C. Matranga, Active Sites and Structure–Activity Relationships of Copper-Based Catalysts for Carbon Dioxide Hydrogenation to Methanol, ACS Catal. 2 (2012) 1667-1676. [30] V.D. Dasireddy B. Likozar The role of copper oxidation state in Cu/ZnO/Al2O3 catalysts in CO2 hydrogenation and methanol productivity Renew. Energy 140 2019 452 460 V.D. Dasireddy, B. Likozar, The role of copper oxidation state in Cu/ZnO/Al2O3 catalysts in CO2 hydrogenation and methanol productivity, Renew. Energy140 (2019) 452-460. [31] X. Guo D. Mao G. Lu S. Wang G. Wu Glycine–nitrate combustion synthesis of CuO–ZnO–ZrO2 catalysts for methanol synthesis from CO2 hydrogenation J. Catal. 271 2010 178 185 X. Guo, D. Mao, G. Lu, S. Wang, G. Wu, Glycine–nitrate combustion synthesis of CuO–ZnO–ZrO2 catalysts for methanol synthesis from CO2 hydrogenation, J. Catal.271 (2010) 178-185. [32] J. Schumann A. Tarasov N. Thomas R. Schlögl M. Behrens Cu,Zn-based catalysts for methanol synthesis: On the effect of calcination conditions and the part of residual carbonates Appl. Catal. A Gen. 516 2016 117 126 J. Schumann, A. Tarasov, N. Thomas, R. Schlögl, M. Behrens, Cu,Zn-based catalysts for methanol synthesis: On the effect of calcination conditions and the part of residual carbonates, Appl. Catal. A Gen.516 (2016) 117-126. [33] B. An J. Zhang K. Cheng P. Ji C. Wang W. Lin Confinement of ultrasmall Cu/ZnOx nanoparticles in metal-organic frameworks for selective methanol synthesis from catalytic hydrogenation of CO2 J. Am. Chem. Soc. 139 2017 3834 3840 B. An, J. Zhang, K. Cheng, P. Ji, C. Wang, W. Lin, Confinement of ultrasmall Cu/ZnOx nanoparticles in metal-organic frameworks for selective methanol synthesis from catalytic hydrogenation of CO2, J. Am. Chem. Soc.139 (2017) 3834-3840. [34] Y. Yin B. Hu X. Li X. Zhou X. Hong G. Liu Pd@zeolitic imidazolate framework-8 derived PdZn alloy catalysts for efficient hydrogenation of CO2 to methanol Appl. Catal. B Environ. 234 2018 143 152 Y. Yin, B. Hu, X. Li, X. Zhou, X. Hong, G. Liu, Pd@zeolitic imidazolate framework-8 derived PdZn alloy catalysts for efficient hydrogenation of CO2 to methanol, Appl. Catal. B Environ.234 (2018) 143-152. [35] T. Stolar A. Praŝnikar V. Martinez B. Karadeniz A. Bjelić G. Mali T. Friščić B. Likozar K. Užarević Scalable Mechanochemical Amorphization of Bimetallic Cu−Zn MOF-74 Catalyst for Selective CO2 Reduction Reaction to Methanol ACS Appl. Mater. Interfaces 13 2021 3070 3077 T. Stolar, A. Praŝnikar, V. Martinez, B. Karadeniz, A. Bjelić, G. Mali, T. Friščić, B. Likozar, K. Užarević, Scalable Mechanochemical Amorphization of Bimetallic Cu−Zn MOF-74 Catalyst for Selective CO2 Reduction Reaction to Methanol, ACS Appl. Mater. Interfaces13 (2021) 3070-3077. [36] Y. Chen H. Li W. Zhao W. Zhang J. Li W. Li X. Zheng W. Yan W. Zhang J. Zhu R. Si J. Zeng Optimizing reaction paths for methanol synthesis from CO2 hydrogenation via metal-ligand cooperativity Nat. Commun. 10 2019 1885 Y. Chen, H. Li, W. Zhao, W. Zhang, J. Li, W. Li, X. Zheng, W. Yan, W. Zhang, J. Zhu, R. Si, J. Zeng, Optimizing reaction paths for methanol synthesis from CO2 hydrogenation via metal-ligand cooperativity, Nat. Commun.10 (2019) 1885. [37] X. Li T. Qi J. Wang W. She G. Mao P. Yan W. Li G. Li Enhanced catalytic performance of nitrogen-doped carbon supported FeOx-based catalyst derived from electrospun nanofiber crosslinked N, Fe-containing MOFs for efficient hydrogenation of nitroarenes Mol. Catal. 477 2019 115044 X. Li, T. Qi, J. Wang, W. She, G. Mao, P. Yan, W. Li, G. Li, Enhanced catalytic performance of nitrogen-doped carbon supported FeOx-based catalyst derived from electrospun nanofiber crosslinked N, Fe-containing MOFs for efficient hydrogenation of nitroarenes, Mol. Catal.477 (2019) 115044. [38] J. Wang T. Qi Z. Li W. She X. Li J. Li P. Yan W. Li G. Li A strategy of two-step tandem catalysis towards direct N-alkylation of nitroarenes with ethanol via facile fabricated novel Co-based catalysts derived from coordination polymers J. Catal. 376 2019 106 118 J. Wang, T. Qi, Z. Li, W. She, X. Li, J. Li, P. Yan, W. Li, G. Li, A strategy of two-step tandem catalysis towards direct N-alkylation of nitroarenes with ethanol via facile fabricated novel Co-based catalysts derived from coordination polymers, J. Catal.376 (2019) 106-118. [39] X. Li G. Liu D. Xu X. Hong S.C. Edman Tsang Confinement of subnanometric PdZn at a defect enriched ZnO/ZIF-8 interface for efficient and selective CO2 hydrogenation to methanol J. Mater. Chem. A 7 2019 23878 23885 X. Li, G. Liu, D. Xu, X. Hong, S.C. Edman Tsang, Confinement of subnanometric PdZn at a defect enriched ZnO/ZIF-8 interface for efficient and selective CO2 hydrogenation to methanol, J. Mater. Chem. A7 (2019) 23878-23885. [40] W. She T. Qi M. Cui P. Yan S. Ng W. Li High Catalytic Performance of a CeO2‑Supported Ni Catalyst for Hydrogenation of Nitroarenes, Fabricated via Coordination-Assisted Strategy ACS Appl. Mater. Interfaces 10 2018 14698 14707 W. She, T. Qi, M. Cui, P. Yan, S. Ng, W. Li, High Catalytic Performance of a CeO2‑Supported Ni Catalyst for Hydrogenation of Nitroarenes, Fabricated via Coordination-Assisted Strategy, ACS Appl. Mater. Interfaces10 (2018) 14698-14707. [41] G. Cai H. Jiang A modulator-induced defect-formation strategy to hierarchically porous metal-organic frameworks with high stability Angew. Chem. Int. Ed. 56 2017 563 567 G. Cai, H. Jiang, A modulator-induced defect-formation strategy to hierarchically porous metal-organic frameworks with high stability, Angew. Chem. Int. Ed.56 (2017) 563-567. [42] B. Hu Y. Yin Z. Zhong D. Wu G. Liu X. Hong Cu@ZIF-8 derived inverse ZnO/Cu catalyst with sub-5 nm ZnO for efficient CO2 hydrogenation to methanol Catal. Sci. Technol. 9 2019 2673 2681 B. Hu, Y. Yin, Z. Zhong, D. Wu, G. Liu, X. Hong, Cu@ZIF-8 derived inverse ZnO/Cu catalyst with sub-5 nm ZnO for efficient CO2 hydrogenation to methanol, Catal. Sci. Technol.9 (2019) 2673-2681. [43] L. Chen H. Wang C. Li Q. Xu Bimetallic metal–organic frameworks and their derivatives Chem. Sci. 11 2020 5369 5403 L. Chen, H. Wang, C. Li, Q. Xu, Bimetallic metal–organic frameworks and their derivatives, Chem. Sci.11 (2020) 5369-5403. [44] H. Zhu L. Wang X. Jie D. Li Y. Cao Improved interfacial affinity and CO2 separation performance of asymmetric mixed matrix membranes by incorporating postmodified MIL-53(Al) ACS Appl. Mater. Interfaces 8 2016 22696 22704 H. Zhu, L. Wang, X. Jie, D. Li, Y. Cao, Improved interfacial affinity and CO2 separation performance of asymmetric mixed matrix membranes by incorporating postmodified MIL-53(Al), ACS Appl. Mater. Interfaces8 (2016) 22696–22704. [45] J.D. Evans C.J. Sumby C.J. Doonan Post-synthetic metalation of metal–organic frameworks Chem. Soc. Rev. 43 2014 5933 5951 J.D. Evans, C.J. Sumby, C.J. Doonan, Post-synthetic metalation of metal–organic frameworks, Chem. Soc. Rev.43 (2014) 5933–5951. [46] A.M. Fracaroli P. Siman Seven post-synthetic covalent reactions in tandem leading to enzyme-like complexity within metal–organic framework crystals J. Am. Chem. Soc. 138 2016 8352 8355 A.M. Fracaroli, P. Siman, Seven post-synthetic covalent reactions in tandem leading to enzyme-like complexity within metal–organic framework crystals, J. Am. Chem. Soc.138 (2016) 8352–8355. [47] A.M. Shultz A.A. Sarjeant O.K. Farha J.T. Hupp S.T. Nguyen Post-synthesis modification of a metal–organic framework to form metallosalen-containing MOF materials J. Am. Chem. Soc. 133 2011 13252 13255 A.M. Shultz, A.A. Sarjeant, O.K. Farha, J.T. Hupp, S.T. Nguyen, Post-synthesis modification of a metal–organic framework to form metallosalen-containing MOF materials, J. Am. Chem. Soc.133 (2011) 13252–13255. [48] C.G. Carson J. Ward X.T. Liu J. Schwartz R.A. Gerhardt R. Tannenbaum Dopant-controlled crystallization in metal–organic frameworks: the role of copper(II) in zinc 1,4-benzenedicarboxylate J. Phys. Chem. C 116 2012 15322 15328 C.G. Carson, J. Ward, X.T. Liu, J. Schwartz, R.A. Gerhardt, R. Tannenbaum, Dopant-controlled crystallization in metal–organic frameworks: the role of copper(II) in zinc 1,4-benzenedicarboxylate, J. Phys. Chem. C116 (2012) 15322–15328. [49] A.A. Tehrani V. Safarifard A. Morsali G. Bruno H. Rudbari Ultrasound-assisted synthesis of metal–organic framework nanorods of Zn-HKUST-1 and their templating effects for facile fabrication of zinc oxide nanorods via solid-state transformation Inorg. Chem. Commun. 59 2015 41 45 A.A. Tehrani, V. Safarifard, A. Morsali, G. Bruno, H. Rudbari, Ultrasound-assisted synthesis of metal–organic framework nanorods of Zn-HKUST-1 and their templating effects for facile fabrication of zinc oxide nanorods via solid-state transformation, Inorg. Chem. Commun.59 (2015) 41–45. [50] J.I. Feldblyum M. Liu D.W. Gidley A.J. Matzger Reconciling the discrepancies between crystallographic porosity and guest access as exemplified by Zn-HKUST-1 J. Am. Chem. Soc. 133 2011 18257 18263 J.I. Feldblyum, M. Liu, D.W. Gidley, A.J. Matzger, Reconciling the discrepancies between crystallographic porosity and guest access as exemplified by Zn-HKUST-1, J. Am. Chem. Soc.133 (2011) 18257–18263. [51] J. Yang X. Wang F. Dai L. Zhang R. Wang D. Sun Improving the porosity and catalytic capacity of a zinc paddlewheel metal-organic framework (MOF) through metal-ion metathesis in a single-crystal-to-single-crystal fashion Inorg. Chem. 53 2014 10649 10653 J. Yang, X. Wang, F. Dai, L. Zhang, R. Wang, D. Sun, Improving the porosity and catalytic capacity of a zinc paddlewheel metal-organic framework (MOF) through metal-ion metathesis in a single-crystal-to-single-crystal fashion, Inorg. Chem.53 (2014) 10649–10653. [52] C. Zhang P. Liao H. Wang J. Sun P. Gao Preparation of novel bimetallic CuZn-BTC coordination polymer nanorod for methanol synthesis from CO 2 hydrogenation Mater. Chem. Phys. 215 2018 211 220 C. Zhang, P. Liao, H. Wang, J. Sun, P. Gao, Preparation of novel bimetallic CuZn-BTC coordination polymer nanorod for methanol synthesis from CO 2 hydrogenation, Mater. Chem. Phys.215 (2018) 211-220. [53] L. Zhang X. Li W. Du D. Shi W. Ning X. Lu Z. Hou Metal-organic framework derived Cu/ZnO catalysts for continuous hydrogenolysis of glycerol Appl. Catal. B Environ. 203 2017 146 153 L. Zhang, X. Li, W. Du, D. Shi, W. Ning, X. Lu, Z. Hou, Metal-organic framework derived Cu/ZnO catalysts for continuous hydrogenolysis of glycerol, Appl. Catal. B Environ.203 (2017) 146-153. [54] J.L. Santos T.R. Reina S. Ivanova M.A. Centeno J.A. Odriozola Gold promoted Cu/ZnO/Al2O3 catalysts prepared from hydrotalcite precursors: Advanced materials for the WGS reaction Appl. Catal. B Environ. 201 2017 310 317 J.L. Santos, T.R. Reina, S. Ivanova, M.A. Centeno, J.A. Odriozola, Gold promoted Cu/ZnO/Al2O3 catalysts prepared from hydrotalcite precursors: Advanced materials for the WGS reaction, Appl. Catal. B Environ.201 (2017) 310-317. [55] Y. Zhang Y. Ji J. Li H. Liu Z. Zhong F. Su Hierarchical zinc-copper oxide hollow microspheres as active Rochow reaction catalysts: the formation and effect of charge transferable interfaces J. Catal. 348 2017 233 245 Y. Zhang, Y. Ji, J. Li, H. Liu, Z. Zhong, F. Su, Hierarchical zinc-copper oxide hollow microspheres as active Rochow reaction catalysts: the formation and effect of charge transferable interfaces, J. Catal.348 (2017) 233-245. [56] E. Alarcón-Lladó J. Ibáñez L. Artús J. Jiménez B. Wang M.J. Callahan R. Cuscó Temperature dependence of Raman scattering in ZnO Phys. Rev. B 75 2007 165202 E. Alarcón-Lladó, J. Ibáñez, L. Artús, J. Jiménez, B. Wang, M.J. Callahan, R. Cuscó, Temperature dependence of Raman scattering in ZnO, Phys. Rev. B75 (2007) 165202. [57] D.P. Singh A.K. Ojha O.N. Srivastava Synthesis of Different Cu(OH)2 and CuO (nanowires, rectangles, seed-, belt-, and sheetlike) nanostructures by simple wet chemical route J. Phys. Chem. C 113 2009 3409 3418 D.P. Singh, A.K. Ojha, O.N. Srivastava, Synthesis of Different Cu(OH)2 and CuO (nanowires, rectangles, seed-, belt-, and sheetlike) nanostructures by simple wet chemical route, J. Phys. Chem. C113 (2009) 3409-3418. [58] N. Tang Y. Cong Q. Shang C. Wu G. Xu X. Wang Coordinatively unsaturated Al3+ sites anchored subnanometric ruthenium catalyst for hydrogenation of aromatics ACS Catal 7 2017 5987 5991 N. Tang, Y. Cong, Q. Shang, C. Wu, G. Xu, X. Wang, Coordinatively unsaturated Al3+ sites anchored subnanometric ruthenium catalyst for hydrogenation of aromatics, ACS Catal. 7 (2017) 5987-5991. [59] M. Behrens G. Lolli N. Muratova I. Kasatkin M. Havecker R.N. D'Alnoncourt O. Storcheva K. Kohler M. Muhler R. Schlogl The effect of Al-doping on ZnO nanoparticles applied as catalyst support Phys. Chem. Chem. Phys. 15 2013 1374 1381 M. Behrens, G. Lolli, N. Muratova, I. Kasatkin, M. Havecker, R.N. D'Alnoncourt, O. Storcheva, K. Kohler, M. Muhler, R. Schlogl, The effect of Al-doping on ZnO nanoparticles applied as catalyst support, Phys. Chem. Chem. Phys.15 (2013) 1374-1381. [60] Y.S. Avadhut J. Weber E. Hammarberg C. Feldmann J. Schmedt Auf Der Günne Structural investigation of aluminium doped ZnO nanoparticles by solid-state NMR spectroscopy Phys. Chem. Chem. Phys. 14 2012 11610 Y.S. Avadhut, J. Weber, E. Hammarberg, C. Feldmann, J. Schmedt Auf Der Günne, Structural investigation of aluminium doped ZnO nanoparticles by solid-state NMR spectroscopy, Phys. Chem. Chem. Phys.14 (2012) 11610. [61] S. Miao R.N. D'Alnoncourt T. Reinecke I. Kasatkin M. Behrens R. Schlögl M. Muhler A study of the influence of composition on the microstructural properties of ZnO/Al2O3 mixed oxides Eur. J. Inorg. Chem. 2009 2009 910 921 S. Miao, R.N. D'Alnoncourt, T. Reinecke, I. Kasatkin, M. Behrens, R. Schlögl, M. Muhler, A study of the influence of composition on the microstructural properties of ZnO/Al2O3 mixed oxides, Eur. J. Inorg. Chem.2009 (2009) 910-921. [62] Y. Wang S. Kattel W. Gao K. Li P. Liu J.G. Chen H. Wang Exploring the ternary interactions in Cu-ZnO-ZrO2 catalysts for efficient CO2 hydrogenation to methanol Nat. Commun. 10 2019 1166 Y. Wang, S. Kattel, W. Gao, K. Li, P. Liu, J.G. Chen, H. Wang, Exploring the ternary interactions in Cu-ZnO-ZrO2 catalysts for efficient CO2 hydrogenation to methanol, Nat. Commun.10 (2019) 1166. [63] J. Wang G. Li Z. Li C. Tang Z. Feng H. An H. Liu T. Liu C. Li A highly selective and stable ZnO-ZrO2 solid solution catalyst for CO2 hydrogenation to methanol Sci. Adv. 3 2017 e1701290 J. Wang, G. Li, Z. Li, C. Tang, Z. Feng, H. An, H. Liu, T. Liu, C. Li, A highly selective and stable ZnO-ZrO2 solid solution catalyst for CO2 hydrogenation to methanol, Sci. Adv.3 (2017) e1701290. [64] T. Witoon N. Kachaban W. Donphai P. Kidkhunthod K. Faungnawakij M. Chareonpanich J. Limtrakul Tuning of catalytic CO2 hydrogenation by changing composition of CuO-ZnO-ZrO2 catalysts Energy Convers. Manag. 118 2016 21 31 T. Witoon, N. Kachaban, W. Donphai, P. Kidkhunthod, K. Faungnawakij, M. Chareonpanich, J. Limtrakul, Tuning of catalytic CO2 hydrogenation by changing composition of CuO-ZnO-ZrO2 catalysts, Energy Convers. Manag.118 (2016) 21-31. [65] F. Zhao M. Gong K. Cao Y. Zhang J. Li R. Chen Atomic layer deposition of Ni on Cu nanoparticles for methanol synthesis from CO2 hydrogenation ChemCatChem 9 2017 3772 3778 F. Zhao, M. Gong, K. Cao, Y. Zhang, J. Li, R. Chen, Atomic layer deposition of Ni on Cu nanoparticles for methanol synthesis from CO2 hydrogenation, ChemCatChem9 (2017) 3772-3778. [66] X. Dong F. Li N. Zhao F. Xiao J. Wang Y. Tan CO2 hydrogenation to methanol over Cu/ZnO/ZrO2 catalysts prepared by precipitation-reduction method Appl. Catal. B Environ. 191 2016 8 17 X. Dong, F. Li, N. Zhao, F. Xiao, J. Wang, Y. Tan, CO2 hydrogenation to methanol over Cu/ZnO/ZrO2 catalysts prepared by precipitation-reduction method, Appl. Catal. B Environ.191 (2016) 8-17. [67] C. Álvarez Galván J. Schumann M. Behrens J.L.G. Fierro R. Schlögl E. Frei Reverse water-gas shift reaction at the Cu/ZnO interface: influence of the Cu/Zn ratio on structure-activity correlations Appl. Catal. B Environ. 195 2016 104 111 C. Álvarez Galván, J. Schumann, M. Behrens, J.L.G. Fierro, R. Schlögl, E. Frei, Reverse water-gas shift reaction at the Cu/ZnO interface: influence of the Cu/Zn ratio on structure-activity correlations, Appl. Catal. B Environ.195 (2016) 104-111. [68] Y. Guo X. Guo C. Song X. Han H. Liu Z. Zhao Capsule-structured copper-zinc catalyst for highly efficient hydrogenation of carbon dioxide to methanol ChemSusChem 12 2019 4916 4926 Y. Guo, X. Guo, C. Song, X. Han, H. Liu, Z. Zhao, Capsule-structured copper-zinc catalyst for highly efficient hydrogenation of carbon dioxide to methanol, ChemSusChem12 (2019) 4916-4926. [69] B. Zhang Y. Chen J. Li E. Pippel H. Yang Z. Gao Y. Qin High efficiency Cu-ZnO hydrogenation catalyst: the tailoring of Cu-ZnO interface sites by molecular layer deposition ACS Catal 5 2015 5567 5573 B. Zhang, Y. Chen, J. Li, E. Pippel, H. Yang, Z. Gao, Y. Qin, High efficiency Cu-ZnO hydrogenation catalyst: the tailoring of Cu-ZnO interface sites by molecular layer deposition, ACS Catal. 5 (2015) 5567-5573. [70] J. Schumann M. Eichelbaum T. Lunkenbein N. Thomas M.C. Álvarez Galván R. Schlögl M. Behrens Promoting strong metal support interaction: doping ZnO for enhanced activity of Cu/ZnO:M (M = Al, Ga, Mg) catalysts ACS Catal. 5 2015 3260 3270 J. Schumann, M. Eichelbaum, T. Lunkenbein, N. Thomas, M.C. Álvarez Galván, R. Schlögl, M. Behrens, Promoting strong metal support interaction: doping ZnO for enhanced activity of Cu/ZnO:M (M = Al, Ga, Mg) catalysts, ACS Catal.5 (2015) 3260-3270. [71] P. Gao L. Zhong L. Zhang H. Wang N. Zhao W. Wei Y. Sun Yttrium oxide modified Cu/ZnO/Al2O3 catalysts via hydrotalcite-like precursors for CO2 hydrogenation to methanol Catal. Sci. Technol. 5 2015 4365 4377 P. Gao, L. Zhong, L. Zhang, H. Wang, N. Zhao, W. Wei, Y. Sun, Yttrium oxide modified Cu/ZnO/Al2O3 catalysts via hydrotalcite-like precursors for CO2 hydrogenation to methanol, Catal. Sci. Technol.5 (2015) 4365-4377. [72] X. Zhang L. Zhong Q. Guo H. Fan H. Zheng K. Xie Influence of the calcination on the activity and stability of the Cu/ZnO/Al2O3 catalyst in liquid phase methanol synthesis Fuel 89 2010 1348 1352 X. Zhang, L. Zhong, Q. Guo, H. Fan, H. Zheng, K. Xie, Influence of the calcination on the activity and stability of the Cu/ZnO/Al2O3 catalyst in liquid phase methanol synthesis, Fuel89 (2010) 1348-1352. [73] Y. Zhu X. Kong S. Zhu F. Dong H. Zheng Y. Zhu Y. Li Construction of Cu/ZrO2/Al2O3 composites for ethanol synthesis: synergies of ternary sites for cascade reaction Appl. Catal. B Environ. 166-167 2015 551 559 Y. Zhu, X. Kong, S. Zhu, F. Dong, H. Zheng, Y. Zhu, Y. Li, Construction of Cu/ZrO2/Al2O3 composites for ethanol synthesis: synergies of ternary sites for cascade reaction, Appl. Catal. B Environ.166-167 (2015) 551-559. [74] Y. Jiang H. Yang P. Gao X. Li J. Zhang H. Liu H. Wang W. Wei Y. Sun Slurry methanol synthesis from CO2 hydrogenation over micro-spherical SiO2 support Cu/ZnO catalysts J. CO2 Util. 26 2018 642 651 Y. Jiang, H. Yang, P. Gao, X. Li, J. Zhang, H. Liu, H. Wang, W. Wei, Y. Sun, Slurry methanol synthesis from CO2 hydrogenation over micro-spherical SiO2 support Cu/ZnO catalysts, J. CO2 Util.26 (2018) 642-651. [75] F.C.F. Marcos L. Lin L.E. Betancourt S.D. Senanayake J.A. Rodriguez J.M. Assaf R. Giudici E.M. Assaf Insights into the methanol synthesis mechanism via CO2 hydrogenation over Cu-ZnO-ZrO2 catalysts: effects of surfactant/Cu-Zn-Zr molar ratio J. CO2 Util. 41 2020 101215 F.C.F. Marcos, L. Lin, L.E. Betancourt, S.D. Senanayake, J.A. Rodriguez, J.M. Assaf, R. Giudici, E.M. Assaf, Insights into the methanol synthesis mechanism via CO2 hydrogenation over Cu-ZnO-ZrO2 catalysts: effects of surfactant/Cu-Zn-Zr molar ratio, J. CO2 Util.41 (2020) 101215. [76] C.P. Jiménez-Gómez J.A. Cecilia D. Durán-Martín R. Moreno-Tost J. Santamaría-González J. Mérida-Robles R. Mariscal P. Maireles-Torres Gas-phase hydrogenation of furfural to furfuryl alcohol over Cu/ZnO catalysts J. Catal. 336 2016 107 115 C.P. Jiménez-Gómez, J.A. Cecilia, D. Durán-Martín, R. Moreno-Tost, J. Santamaría-González, J. Mérida-Robles, R. Mariscal, P. Maireles-Torres, Gas-phase hydrogenation of furfural to furfuryl alcohol over Cu/ZnO catalysts, J. Catal.336 (2016) 107-115 [77] X. Yang H. Chen Q. Meng H. Zheng Y. Zhu Y.W. Li Construction of novel Cu/ZnO-Al2O3 composites for furfural hydrogenation: The role of Al components Catal. Sci. Technol. 7 2017 5625 5634 X. Yang, H. Chen, Q. Meng, H. Zheng, Y. Zhu, Y.W. Li, Construction of novel Cu/ZnO-Al2O3 composites for furfural hydrogenation: The role of Al components, Catal. Sci. Technol.7 (2017) 5625-5634. [78] P. Gao F. Li H. Zhan N. Zhao F. Xiao W. Wei L. Zhong H. Wang Y. Sun Influence of Zr on the performance of Cu/Zn/Al/Zr catalysts via hydrotalcite-like precursors for CO2 hydrogenation to methanol J. Catal. 298 2013 51 60 P. Gao, F. Li, H. Zhan, N. Zhao, F. Xiao, W. Wei, L. Zhong, H. Wang, Y. Sun, Influence of Zr on the performance of Cu/Zn/Al/Zr catalysts via hydrotalcite-like precursors for CO2 hydrogenation to methanol, J. Catal.298 (2013) 51-60. [79] Y. Zhang L. Zhong H. Wang P. Gao X. Li S. Xiao G. Ding W. Wei Y. Sun Catalytic performance of spray-dried Cu/ZnO/Al2O3/ZrO2 catalysts for slurry methanol synthesis from CO2 hydrogenation J. CO2 Util. 15 2016 72 82 Y. Zhang, L. Zhong, H. Wang, P. Gao, X. Li, S. Xiao, G. Ding, W. Wei, Y. Sun, Catalytic performance of spray-dried Cu/ZnO/Al2O3/ZrO2 catalysts for slurry methanol synthesis from CO2 hydrogenation, J. CO2 Util.15 (2016) 72-82. [80] Y. Wang C. Wöll IR spectroscopic investigations of chemical and photochemical reactions on metal oxides: bridging the materials gap Chem. Soc. Rev. 46 2017 1875 1932 Y. Wang, C. Wöll, IR spectroscopic investigations of chemical and photochemical reactions on metal oxides: bridging the materials gap, Chem. Soc. Rev.46 (2017) 1875-1932. [81] M. Smyrnioti C. Tampaxis T. Steriotis T. Ioannides Study of CO2 adsorption on a commercial CuO/ZnO/Al2O3 catalyst Catal. Today 357 2020 495 502 M. Smyrnioti, C. Tampaxis, T. Steriotis, T. Ioannides, Study of CO2 adsorption on a commercial CuO/ZnO/Al2O3 catalyst, Catal. Today357 (2020) 495-502. [82] H. Noei C. Wöll M. Muhler Y. Wang Activation of Carbon Dioxide on ZnO Nanoparticles Studied by Vibrational Spectroscopy J. Phys. Chem. C 115 2011 908 914 H. Noei, C. Wöll, M. Muhler, Y. Wang, Activation of Carbon Dioxide on ZnO Nanoparticles Studied by Vibrational Spectroscopy, J. Phys. Chem. C115 (2011) 908-914. [83] P. Gao F. Li N. Zhao F. Xiao W. Wei L. Zhong Y. Sun Influence of modifier (Mn, La, Ce, Zr and Y) on the performance of Cu/Zn/Al catalysts via hydrotalcite-like precursors for CO2 hydrogenation to methanol Appl. Catal. A Gen. 468 2013 442 452 P. Gao, F. Li, N. Zhao, F. Xiao, W. Wei, L. Zhong, Y. Sun, Influence of modifier (Mn, La, Ce, Zr and Y) on the performance of Cu/Zn/Al catalysts via hydrotalcite-like precursors for CO2 hydrogenation to methanol, Appl. Catal. A Gen.468 (2013) 442-452. [84] S. Natesakhawat P.R. Ohodnicki B.H. Howard J.W. Lekse J.P. Baltrus C. Matranga Adsorption and Deactivation Characteristics of Cu/ZnO-Based Catalysts for Methanol Synthesis from Carbon Dioxide Top. Catal. 56 2013 1752 1763 S. Natesakhawat, P.R. Ohodnicki, B.H. Howard, J.W. Lekse, J.P. Baltrus, C. Matranga, Adsorption and Deactivation Characteristics of Cu/ZnO-Based Catalysts for Methanol Synthesis from Carbon Dioxide, Top. Catal.56 (2013) 1752-1763. [85] K.C. Waugh The absorption and locking-in of hydrogen in copper Solid State Ion 168 2004 327 342 K.C. Waugh, The absorption and locking-in of hydrogen in copper, Solid State Ion. 168 (2004) 327-342. [86] F. Arena G. Italiano K. Barbera G. Bonura L. Spadaro F. Frusteri Basic evidences for methanol-synthesis catalyst design Catal. Today 143 2009 80 85 F. Arena, G. Italiano, K. Barbera, G. Bonura, L. Spadaro, F. Frusteri, Basic evidences for methanol-synthesis catalyst design, Catal. Today143 (2009) 80-85. [87] F. Arena G. Italiano K. Barbera S. Bordiga G. Bonura L. Spadaro F. Frusteri Solid-state interactions, adsorption sites and functionality of Cu-ZnO/ZrO2 catalysts in the CO2 hydrogenation to CH3OH Appl. Catal. A Gen. 350 2008 16 23 F. Arena, G. Italiano, K. Barbera, S. Bordiga, G. Bonura, L. Spadaro, F. Frusteri, Solid-state interactions, adsorption sites and functionality of Cu-ZnO/ZrO2 catalysts in the CO2 hydrogenation to CH3OH, Appl. Catal. A Gen.350 (2008) 16-23. [88] X. Jiang X. Wang X. Nie N. Koizumi X. Guo C. Song CO2 hydrogenation to methanol on Pd-Cu bimetallic catalysts: H2/CO2 ratio dependence and surface species Catal. Today 316 2018 62 70 X. Jiang, X. Wang, X. Nie, N. Koizumi, X. Guo, C. Song, CO2 hydrogenation to methanol on Pd-Cu bimetallic catalysts: H2/CO2 ratio dependence and surface species, Catal. Today316 (2018) 62-70. [89] D. Xu M. Ding X. Hong G. Liu S.C. Edman Tsang Selective C2+ Alcohol Synthesis from Direct CO2 Hydrogenation over a Cs-Promoted Cu-Fe-Zn Catalyst ACS Catal 10 2020 5250 5260 D. Xu, M. Ding, X. Hong, G. Liu, S.C. Edman Tsang, Selective C2+ Alcohol Synthesis from Direct CO2 Hydrogenation over a Cs-Promoted Cu-Fe-Zn Catalyst, ACS Catal. 10 (2020) 5250-5260. [90] H. Noei H. Qiu Y. Wang E. Löffler C. Wöll M. Muhler The identification of hydroxyl groups on ZnO nanoparticles by infrared spectroscopy Phys. Chem. Chem. Phys. 10 2008 7092 7097 H. Noei, H. Qiu, Y. Wang, E. Löffler, C. Wöll, M. Muhler, The identification of hydroxyl groups on ZnO nanoparticles by infrared spectroscopy, Phys. Chem. Chem. Phys.10 (2008) 7092-7097. [91] Y. Wang M. Muhler Ch. Wöll Spectroscopic evidence for the partial dissociation of H2O on ZnO(1010) Phys. Chem. Chem. Phys. 8 2006 1521 1524 Y. Wang, M. Muhler, Ch. Wöll, Spectroscopic evidence for the partial dissociation of H2O on ZnO(1010), Phys. Chem. Chem. Phys.8 (2006) 1521-1524. [92] Y. Wang W. Gao K. Li Y. Zheng Z. Xie W. Na J.G. Chen H. Wang Strong Evidence of the Role of H2O in Affecting Methanol Selectivity from CO2 Hydrogenation over Cu-ZnO-ZrO2 Chem 6 2020 419 430 Y. Wang, W. Gao, K. Li, Y. Zheng, Z. Xie, W. Na, J.G. Chen, H. Wang, Strong Evidence of the Role of H2O in Affecting Methanol Selectivity from CO2 Hydrogenation over Cu-ZnO-ZrO2, Chem6 (2020) 419-430. [93] L. Yao X. Shen Y. Pan Z. Peng Synergy between active sites of Cu-In-Zr-O catalyst in CO2 hydrogenation to methanol J. Catal. 372 2019 74 85 L. Yao, X. Shen, Y. Pan, Z. Peng, Synergy between active sites of Cu-In-Zr-O catalyst in CO2 hydrogenation to methanol, J. Catal.372 (2019) 74-85.",
      "scopus-id": "85114732575",
      "coredata": {
        "eid": "1-s2.0-S2468823121004879",
        "dc:description": "It is highly desirable to develop inexpensive and highly selective catalyst for CO2 hydrogenation to methanol and Cu/ZnO/Al2O3 is a promising formulation. Herein, we report the design and synthesis of a Cu-ZnO/Al2O3 catalyst via a bimetallic metal organic framework (MOF)-templated strategy (termed Cu-ZnOMOF⊂Al2O3) and shed light on the role of the Cu-Zn@MOF precursor in this system for methanol synthesis. The developed Cu-ZnOMOF⊂Al2O3 exhibited high methanol selectivity (86.9%) and methanol space-time yield (407.2 gMeOH•kgcat −1•h−1) at higher CO2 conversion (9.1%) in comparison with the conventional Cu-ZnONO3/Al2O3 catalyst (79.6% and 209.0 gMeOH•kgcat −1•h−1, and 5.1%, respectively) at 240 ºC under 3.0 MPa. Spectroscopic characterization (TEM, XPS, EDX, in-situ DRIFTS) coupled with N2O chemisorption and temperature-programmed desorption of CO2 and H2 revealed that the surface of the new Cu-ZnOMOF⊂Al2O3 catalyst possesses higher Cu dispersion, surface-enriched ZnO and more Cu-ZnO interfacial sites, which leads to higher capability for CO2 and H2 adsorption and activation. These are considered to be the origin of higher methanol selectivity and enhanced activity of the catalyst prepared by the MOF-templated strategy for CO2 hydrogenation. This work offers a novel approach to optimizing Cu-ZnO/Al2O3 catalyst for CO2 hydrogenation to methanol.",
        "openArchiveArticle": "false",
        "prism:coverDate": "2021-09-30",
        "openaccessUserLicense": null,
        "prism:aggregationType": "Journal",
        "prism:url": "https://api.elsevier.com/content/article/pii/S2468823121004879",
        "dc:creator": [
          {
            "@_fa": "true",
            "$": "Qi, Tianqinji"
          },
          {
            "@_fa": "true",
            "$": "Zhao, Yiming"
          },
          {
            "@_fa": "true",
            "$": "Chen, Shaoyun"
          },
          {
            "@_fa": "true",
            "$": "Li, Weizuo"
          },
          {
            "@_fa": "true",
            "$": "Guo, Xinwen"
          },
          {
            "@_fa": "true",
            "$": "Zhang, Yongchun"
          },
          {
            "@_fa": "true",
            "$": "Song, Chunshan"
          }
        ],
        "link": [
          {
            "@_fa": "true",
            "@rel": "self",
            "@href": "https://api.elsevier.com/content/article/pii/S2468823121004879"
          },
          {
            "@_fa": "true",
            "@rel": "scidir",
            "@href": "https://www.sciencedirect.com/science/article/pii/S2468823121004879"
          }
        ],
        "dc:format": "application/json",
        "openaccessType": null,
        "pii": "S2468-8231(21)00487-9",
        "prism:volume": "514",
        "articleNumber": "111870",
        "prism:publisher": "Elsevier B.V.",
        "dc:title": "Bimetallic metal organic framework-templated synthesis of a Cu-ZnO/Al2O3 catalyst with superior methanol selectivity for CO2 hydrogenation",
        "prism:copyright": "© 2021 Elsevier B.V. All rights reserved.",
        "openaccess": "0",
        "prism:issn": "24688231",
        "dcterms:subject": [
          {
            "@_fa": "true",
            "$": "Metal organic frameworks"
          },
          {
            "@_fa": "true",
            "$": "Templated strategy"
          },
          {
            "@_fa": "true",
            "$": "Cu/ZnO/Al2O3 catalyst"
          },
          {
            "@_fa": "true",
            "$": "CO2 hydrogenation"
          },
          {
            "@_fa": "true",
            "$": "Methanol"
          }
        ],
        "openaccessArticle": "false",
        "prism:publicationName": "Molecular Catalysis",
        "openaccessSponsorType": null,
        "prism:pageRange": "111870",
        "pubType": "fla",
        "prism:coverDisplayDate": "September 2021",
        "prism:doi": "10.1016/j.mcat.2021.111870",
        "prism:startingPage": "111870",
        "dc:identifier": "doi:10.1016/j.mcat.2021.111870",
        "openaccessSponsorName": null
      },
      "objects": {
        "object": [
          {
            "@category": "standard",
            "@height": "200",
            "@width": "261",
            "@_fa": "true",
            "$": "https://api.elsevier.com/content/object/eid/1-s2.0-S2468823121004879-ga1.jpg?httpAccept=%2A%2F%2A",
            "@multimediatype": "JPEG image file",
            "@type": "IMAGE-DOWNSAMPLED",
            "@size": "28209",
            "@ref": "ga1",
            "@mimetype": "image/jpeg"
          },
          {
            "@category": "standard",
            "@height": "394",
            "@width": "659",
            "@_fa": "true",
            "$": "https://api.elsevier.com/content/object/eid/1-s2.0-S2468823121004879-sc1.jpg?httpAccept=%2A%2F%2A",
            "@multimediatype": "JPEG image file",
            "@type": "IMAGE-DOWNSAMPLED",
            "@size": "92443",
            "@ref": "sc1",
            "@mimetype": "image/jpeg"
          },
          {
            "@category": "standard",
            "@height": "274",
            "@width": "715",
            "@_fa": "true",
            "$": "https://api.elsevier.com/content/object/eid/1-s2.0-S2468823121004879-gr3.jpg?httpAccept=%2A%2F%2A",
            "@multimediatype": "JPEG image file",
            "@type": "IMAGE-DOWNSAMPLED",
            "@size": "82771",
            "@ref": "gr3",
            "@mimetype": "image/jpeg"
          },
          {
            "@category": "standard",
            "@height": "245",
            "@width": "659",
            "@_fa": "true",
            "$": "https://api.elsevier.com/content/object/eid/1-s2.0-S2468823121004879-gr11.jpg?httpAccept=%2A%2F%2A",
            "@multimediatype": "JPEG image file",
            "@type": "IMAGE-DOWNSAMPLED",
            "@size": "62114",
            "@ref": "gr11",
            "@mimetype": "image/jpeg"
          },
          {
            "@category": "standard",
            "@height": "698",
            "@width": "659",
            "@_fa": "true",
            "$": "https://api.elsevier.com/content/object/eid/1-s2.0-S2468823121004879-gr4.jpg?httpAccept=%2A%2F%2A",
            "@multimediatype": "JPEG image file",
            "@type": "IMAGE-DOWNSAMPLED",
            "@size": "205291",
            "@ref": "gr4",
            "@mimetype": "image/jpeg"
          },
          {
            "@category": "standard",
            "@height": "576",
            "@width": "753",
            "@_fa": "true",
            "$": "https://api.elsevier.com/content/object/eid/1-s2.0-S2468823121004879-gr10.jpg?httpAccept=%2A%2F%2A",
            "@multimediatype": "JPEG image file",
            "@type": "IMAGE-DOWNSAMPLED",
            "@size": "224913",
            "@ref": "gr10",
            "@mimetype": "image/jpeg"
          },
          {
            "@category": "standard",
            "@height": "254",
            "@width": "734",
            "@_fa": "true",
            "$": "https://api.elsevier.com/content/object/eid/1-s2.0-S2468823121004879-gr1.jpg?httpAccept=%2A%2F%2A",
            "@multimediatype": "JPEG image file",
            "@type": "IMAGE-DOWNSAMPLED",
            "@size": "63978",
            "@ref": "gr1",
            "@mimetype": "image/jpeg"
          },
          {
            "@category": "standard",
            "@height": "245",
            "@width": "640",
            "@_fa": "true",
            "$": "https://api.elsevier.com/content/object/eid/1-s2.0-S2468823121004879-gr2.jpg?httpAccept=%2A%2F%2A",
            "@multimediatype": "JPEG image file",
            "@type": "IMAGE-DOWNSAMPLED",
            "@size": "48813",
            "@ref": "gr2",
            "@mimetype": "image/jpeg"
          },
          {
            "@category": "standard",
            "@height": "306",
            "@width": "376",
            "@_fa": "true",
            "$": "https://api.elsevier.com/content/object/eid/1-s2.0-S2468823121004879-gr7.jpg?httpAccept=%2A%2F%2A",
            "@multimediatype": "JPEG image file",
            "@type": "IMAGE-DOWNSAMPLED",
            "@size": "31101",
            "@ref": "gr7",
            "@mimetype": "image/jpeg"
          },
          {
            "@category": "standard",
            "@height": "526",
            "@width": "659",
            "@_fa": "true",
            "$": "https://api.elsevier.com/content/object/eid/1-s2.0-S2468823121004879-gr8.jpg?httpAccept=%2A%2F%2A",
            "@multimediatype": "JPEG image file",
            "@type": "IMAGE-DOWNSAMPLED",
            "@size": "98296",
            "@ref": "gr8",
            "@mimetype": "image/jpeg"
          },
          {
            "@category": "standard",
            "@height": "515",
            "@width": "602",
            "@_fa": "true",
            "$": "https://api.elsevier.com/content/object/eid/1-s2.0-S2468823121004879-gr5.jpg?httpAccept=%2A%2F%2A",
            "@multimediatype": "JPEG image file",
            "@type": "IMAGE-DOWNSAMPLED",
            "@size": "150802",
            "@ref": "gr5",
            "@mimetype": "image/jpeg"
          },
          {
            "@category": "standard",
            "@height": "376",
            "@width": "565",
            "@_fa": "true",
            "$": "https://api.elsevier.com/content/object/eid/1-s2.0-S2468823121004879-gr6.jpg?httpAccept=%2A%2F%2A",
            "@multimediatype": "JPEG image file",
            "@type": "IMAGE-DOWNSAMPLED",
            "@size": "77039",
            "@ref": "gr6",
            "@mimetype": "image/jpeg"
          },
          {
            "@category": "standard",
            "@height": "247",
            "@width": "659",
            "@_fa": "true",
            "$": "https://api.elsevier.com/content/object/eid/1-s2.0-S2468823121004879-gr9.jpg?httpAccept=%2A%2F%2A",
            "@multimediatype": "JPEG image file",
            "@type": "IMAGE-DOWNSAMPLED",
            "@size": "62104",
            "@ref": "gr9",
            "@mimetype": "image/jpeg"
          },
          {
            "@category": "thumbnail",
            "@height": "164",
            "@width": "214",
            "@_fa": "true",
            "$": "https://api.elsevier.com/content/object/eid/1-s2.0-S2468823121004879-ga1.sml?httpAccept=%2A%2F%2A",
            "@multimediatype": "GIF image file",
            "@type": "IMAGE-THUMBNAIL",
            "@size": "22035",
            "@ref": "ga1",
            "@mimetype": "image/gif"
          },
          {
            "@category": "thumbnail",
            "@height": "131",
            "@width": "219",
            "@_fa": "true",
            "$": "https://api.elsevier.com/content/object/eid/1-s2.0-S2468823121004879-sc1.sml?httpAccept=%2A%2F%2A",
            "@multimediatype": "GIF image file",
            "@type": "IMAGE-THUMBNAIL",
            "@size": "15099",
            "@ref": "sc1",
            "@mimetype": "image/gif"
          },
          {
            "@category": "thumbnail",
            "@height": "84",
            "@width": "219",
            "@_fa": "true",
            "$": "https://api.elsevier.com/content/object/eid/1-s2.0-S2468823121004879-gr3.sml?httpAccept=%2A%2F%2A",
            "@multimediatype": "GIF image file",
            "@type": "IMAGE-THUMBNAIL",
            "@size": "10800",
            "@ref": "gr3",
            "@mimetype": "image/gif"
          },
          {
            "@category": "thumbnail",
            "@height": "82",
            "@width": "219",
            "@_fa": "true",
            "$": "https://api.elsevier.com/content/object/eid/1-s2.0-S2468823121004879-gr11.sml?httpAccept=%2A%2F%2A",
            "@multimediatype": "GIF image file",
            "@type": "IMAGE-THUMBNAIL",
            "@size": "8994",
            "@ref": "gr11",
            "@mimetype": "image/gif"
          },
          {
            "@category": "thumbnail",
            "@height": "164",
            "@width": "155",
            "@_fa": "true",
            "$": "https://api.elsevier.com/content/object/eid/1-s2.0-S2468823121004879-gr4.sml?httpAccept=%2A%2F%2A",
            "@multimediatype": "GIF image file",
            "@type": "IMAGE-THUMBNAIL",
            "@size": "21939",
            "@ref": "gr4",
            "@mimetype": "image/gif"
          },
          {
            "@category": "thumbnail",
            "@height": "164",
            "@width": "214",
            "@_fa": "true",
            "$": "https://api.elsevier.com/content/object/eid/1-s2.0-S2468823121004879-gr10.sml?httpAccept=%2A%2F%2A",
            "@multimediatype": "GIF image file",
            "@type": "IMAGE-THUMBNAIL",
            "@size": "21266",
            "@ref": "gr10",
            "@mimetype": "image/gif"
          },
          {
            "@category": "thumbnail",
            "@height": "76",
            "@width": "219",
            "@_fa": "true",
            "$": "https://api.elsevier.com/content/object/eid/1-s2.0-S2468823121004879-gr1.sml?httpAccept=%2A%2F%2A",
            "@multimediatype": "GIF image file",
            "@type": "IMAGE-THUMBNAIL",
            "@size": "9005",
            "@ref": "gr1",
            "@mimetype": "image/gif"
          },
          {
            "@category": "thumbnail",
            "@height": "84",
            "@width": "219",
            "@_fa": "true",
            "$": "https://api.elsevier.com/content/object/eid/1-s2.0-S2468823121004879-gr2.sml?httpAccept=%2A%2F%2A",
            "@multimediatype": "GIF image file",
            "@type": "IMAGE-THUMBNAIL",
            "@size": "8305",
            "@ref": "gr2",
            "@mimetype": "image/gif"
          },
          {
            "@category": "thumbnail",
            "@height": "164",
            "@width": "201",
            "@_fa": "true",
            "$": "https://api.elsevier.com/content/object/eid/1-s2.0-S2468823121004879-gr7.sml?httpAccept=%2A%2F%2A",
            "@multimediatype": "GIF image file",
            "@type": "IMAGE-THUMBNAIL",
            "@size": "9564",
            "@ref": "gr7",
            "@mimetype": "image/gif"
          },
          {
            "@category": "thumbnail",
            "@height": "164",
            "@width": "205",
            "@_fa": "true",
            "$": "https://api.elsevier.com/content/object/eid/1-s2.0-S2468823121004879-gr8.sml?httpAccept=%2A%2F%2A",
            "@multimediatype": "GIF image file",
            "@type": "IMAGE-THUMBNAIL",
            "@size": "13643",
            "@ref": "gr8",
            "@mimetype": "image/gif"
          },
          {
            "@category": "thumbnail",
            "@height": "164",
            "@width": "192",
            "@_fa": "true",
            "$": "https://api.elsevier.com/content/object/eid/1-s2.0-S2468823121004879-gr5.sml?httpAccept=%2A%2F%2A",
            "@multimediatype": "GIF image file",
            "@type": "IMAGE-THUMBNAIL",
            "@size": "27528",
            "@ref": "gr5",
            "@mimetype": "image/gif"
          },
          {
            "@category": "thumbnail",
            "@height": "146",
            "@width": "219",
            "@_fa": "true",
            "$": "https://api.elsevier.com/content/object/eid/1-s2.0-S2468823121004879-gr6.sml?httpAccept=%2A%2F%2A",
            "@multimediatype": "GIF image file",
            "@type": "IMAGE-THUMBNAIL",
            "@size": "24125",
            "@ref": "gr6",
            "@mimetype": "image/gif"
          },
          {
            "@category": "thumbnail",
            "@height": "82",
            "@width": "219",
            "@_fa": "true",
            "$": "https://api.elsevier.com/content/object/eid/1-s2.0-S2468823121004879-gr9.sml?httpAccept=%2A%2F%2A",
            "@multimediatype": "GIF image file",
            "@type": "IMAGE-THUMBNAIL",
            "@size": "9078",
            "@ref": "gr9",
            "@mimetype": "image/gif"
          },
          {
            "@category": "high",
            "@height": "886",
            "@width": "1155",
            "@_fa": "true",
            "$": "https://api.elsevier.com/content/object/eid/1-s2.0-S2468823121004879-ga1_lrg.jpg?httpAccept=%2A%2F%2A",
            "@multimediatype": "JPEG image file",
            "@type": "IMAGE-HIGH-RES",
            "@size": "185286",
            "@ref": "ga1",
            "@mimetype": "image/jpeg"
          },
          {
            "@category": "high",
            "@height": "1743",
            "@width": "2917",
            "@_fa": "true",
            "$": "https://api.elsevier.com/content/object/eid/1-s2.0-S2468823121004879-sc1_lrg.jpg?httpAccept=%2A%2F%2A",
            "@multimediatype": "JPEG image file",
            "@type": "IMAGE-HIGH-RES",
            "@size": "616841",
            "@ref": "sc1",
            "@mimetype": "image/jpeg"
          },
          {
            "@category": "high",
            "@height": "1213",
            "@width": "3167",
            "@_fa": "true",
            "$": "https://api.elsevier.com/content/object/eid/1-s2.0-S2468823121004879-gr3_lrg.jpg?httpAccept=%2A%2F%2A",
            "@multimediatype": "JPEG image file",
            "@type": "IMAGE-HIGH-RES",
            "@size": "547208",
            "@ref": "gr3",
            "@mimetype": "image/jpeg"
          },
          {
            "@category": "high",
            "@height": "1086",
            "@width": "2917",
            "@_fa": "true",
            "$": "https://api.elsevier.com/content/object/eid/1-s2.0-S2468823121004879-gr11_lrg.jpg?httpAccept=%2A%2F%2A",
            "@multimediatype": "JPEG image file",
            "@type": "IMAGE-HIGH-RES",
            "@size": "402669",
            "@ref": "gr11",
            "@mimetype": "image/jpeg"
          },
          {
            "@category": "high",
            "@height": "3089",
            "@width": "2917",
            "@_fa": "true",
            "$": "https://api.elsevier.com/content/object/eid/1-s2.0-S2468823121004879-gr4_lrg.jpg?httpAccept=%2A%2F%2A",
            "@multimediatype": "JPEG image file",
            "@type": "IMAGE-HIGH-RES",
            "@size": "1866629",
            "@ref": "gr4",
            "@mimetype": "image/jpeg"
          },
          {
            "@category": "high",
            "@height": "2549",
            "@width": "3333",
            "@_fa": "true",
            "$": "https://api.elsevier.com/content/object/eid/1-s2.0-S2468823121004879-gr10_lrg.jpg?httpAccept=%2A%2F%2A",
            "@multimediatype": "JPEG image file",
            "@type": "IMAGE-HIGH-RES",
            "@size": "1505041",
            "@ref": "gr10",
            "@mimetype": "image/jpeg"
          },
          {
            "@category": "high",
            "@height": "1126",
            "@width": "3250",
            "@_fa": "true",
            "$": "https://api.elsevier.com/content/object/eid/1-s2.0-S2468823121004879-gr1_lrg.jpg?httpAccept=%2A%2F%2A",
            "@multimediatype": "JPEG image file",
            "@type": "IMAGE-HIGH-RES",
            "@size": "479217",
            "@ref": "gr1",
            "@mimetype": "image/jpeg"
          },
          {
            "@category": "high",
            "@height": "1086",
            "@width": "2833",
            "@_fa": "true",
            "$": "https://api.elsevier.com/content/object/eid/1-s2.0-S2468823121004879-gr2_lrg.jpg?httpAccept=%2A%2F%2A",
            "@multimediatype": "JPEG image file",
            "@type": "IMAGE-HIGH-RES",
            "@size": "318801",
            "@ref": "gr2",
            "@mimetype": "image/jpeg"
          },
          {
            "@category": "high",
            "@height": "1357",
            "@width": "1667",
            "@_fa": "true",
            "$": "https://api.elsevier.com/content/object/eid/1-s2.0-S2468823121004879-gr7_lrg.jpg?httpAccept=%2A%2F%2A",
            "@multimediatype": "JPEG image file",
            "@type": "IMAGE-HIGH-RES",
            "@size": "198599",
            "@ref": "gr7",
            "@mimetype": "image/jpeg"
          },
          {
            "@category": "high",
            "@height": "2327",
            "@width": "2917",
            "@_fa": "true",
            "$": "https://api.elsevier.com/content/object/eid/1-s2.0-S2468823121004879-gr8_lrg.jpg?httpAccept=%2A%2F%2A",
            "@multimediatype": "JPEG image file",
            "@type": "IMAGE-HIGH-RES",
            "@size": "715761",
            "@ref": "gr8",
            "@mimetype": "image/jpeg"
          },
          {
            "@category": "high",
            "@height": "2281",
            "@width": "2667",
            "@_fa": "true",
            "$": "https://api.elsevier.com/content/object/eid/1-s2.0-S2468823121004879-gr5_lrg.jpg?httpAccept=%2A%2F%2A",
            "@multimediatype": "JPEG image file",
            "@type": "IMAGE-HIGH-RES",
            "@size": "1435186",
            "@ref": "gr5",
            "@mimetype": "image/jpeg"
          },
          {
            "@category": "high",
            "@height": "1662",
            "@width": "2500",
            "@_fa": "true",
            "$": "https://api.elsevier.com/content/object/eid/1-s2.0-S2468823121004879-gr6_lrg.jpg?httpAccept=%2A%2F%2A",
            "@multimediatype": "JPEG image file",
            "@type": "IMAGE-HIGH-RES",
            "@size": "574250",
            "@ref": "gr6",
            "@mimetype": "image/jpeg"
          },
          {
            "@category": "high",
            "@height": "1094",
            "@width": "2917",
            "@_fa": "true",
            "$": "https://api.elsevier.com/content/object/eid/1-s2.0-S2468823121004879-gr9_lrg.jpg?httpAccept=%2A%2F%2A",
            "@multimediatype": "JPEG image file",
            "@type": "IMAGE-HIGH-RES",
            "@size": "392939",
            "@ref": "gr9",
            "@mimetype": "image/jpeg"
          },
          {
            "@category": "standard",
            "@_fa": "true",
            "$": "https://api.elsevier.com/content/object/eid/1-s2.0-S2468823121004879-mmc1.docx?httpAccept=%2A%2F%2A",
            "@multimediatype": "Microsoft Word file",
            "@type": "APPLICATION",
            "@size": "2210945",
            "@ref": "mmc1",
            "@mimetype": "application/word"
          },
          {
            "@category": "thumbnail",
            "@_fa": "true",
            "$": "https://api.elsevier.com/content/object/eid/1-s2.0-S2468823121004879-si1.svg?httpAccept=%2A%2F%2A",
            "@multimediatype": "Scalable Vector Graphics file",
            "@type": "ALTIMG",
            "@size": "8592",
            "@ref": "si1",
            "@mimetype": "image/svg+xml"
          },
          {
            "@category": "thumbnail",
            "@_fa": "true",
            "$": "https://api.elsevier.com/content/object/eid/1-s2.0-S2468823121004879-si10.svg?httpAccept=%2A%2F%2A",
            "@multimediatype": "Scalable Vector Graphics file",
            "@type": "ALTIMG",
            "@size": "4622",
            "@ref": "si10",
            "@mimetype": "image/svg+xml"
          },
          {
            "@category": "thumbnail",
            "@_fa": "true",
            "$": "https://api.elsevier.com/content/object/eid/1-s2.0-S2468823121004879-si11.svg?httpAccept=%2A%2F%2A",
            "@multimediatype": "Scalable Vector Graphics file",
            "@type": "ALTIMG",
            "@size": "2289",
            "@ref": "si11",
            "@mimetype": "image/svg+xml"
          },
          {
            "@category": "thumbnail",
            "@_fa": "true",
            "$": "https://api.elsevier.com/content/object/eid/1-s2.0-S2468823121004879-si12.svg?httpAccept=%2A%2F%2A",
            "@multimediatype": "Scalable Vector Graphics file",
            "@type": "ALTIMG",
            "@size": "5740",
            "@ref": "si12",
            "@mimetype": "image/svg+xml"
          },
          {
            "@category": "thumbnail",
            "@_fa": "true",
            "$": "https://api.elsevier.com/content/object/eid/1-s2.0-S2468823121004879-si13.svg?httpAccept=%2A%2F%2A",
            "@multimediatype": "Scalable Vector Graphics file",
            "@type": "ALTIMG",
            "@size": "1986",
            "@ref": "si13",
            "@mimetype": "image/svg+xml"
          },
          {
            "@category": "thumbnail",
            "@_fa": "true",
            "$": "https://api.elsevier.com/content/object/eid/1-s2.0-S2468823121004879-si14.svg?httpAccept=%2A%2F%2A",
            "@multimediatype": "Scalable Vector Graphics file",
            "@type": "ALTIMG",
            "@size": "3515",
            "@ref": "si14",
            "@mimetype": "image/svg+xml"
          },
          {
            "@category": "thumbnail",
            "@_fa": "true",
            "$": "https://api.elsevier.com/content/object/eid/1-s2.0-S2468823121004879-si2.svg?httpAccept=%2A%2F%2A",
            "@multimediatype": "Scalable Vector Graphics file",
            "@type": "ALTIMG",
            "@size": "14614",
            "@ref": "si2",
            "@mimetype": "image/svg+xml"
          },
          {
            "@category": "thumbnail",
            "@_fa": "true",
            "$": "https://api.elsevier.com/content/object/eid/1-s2.0-S2468823121004879-si3.svg?httpAccept=%2A%2F%2A",
            "@multimediatype": "Scalable Vector Graphics file",
            "@type": "ALTIMG",
            "@size": "7855",
            "@ref": "si3",
            "@mimetype": "image/svg+xml"
          },
          {
            "@category": "thumbnail",
            "@_fa": "true",
            "$": "https://api.elsevier.com/content/object/eid/1-s2.0-S2468823121004879-si4.svg?httpAccept=%2A%2F%2A",
            "@multimediatype": "Scalable Vector Graphics file",
            "@type": "ALTIMG",
            "@size": "11908",
            "@ref": "si4",
            "@mimetype": "image/svg+xml"
          },
          {
            "@category": "thumbnail",
            "@_fa": "true",
            "$": "https://api.elsevier.com/content/object/eid/1-s2.0-S2468823121004879-si5.svg?httpAccept=%2A%2F%2A",
            "@multimediatype": "Scalable Vector Graphics file",
            "@type": "ALTIMG",
            "@size": "13864",
            "@ref": "si5",
            "@mimetype": "image/svg+xml"
          },
          {
            "@category": "thumbnail",
            "@_fa": "true",
            "$": "https://api.elsevier.com/content/object/eid/1-s2.0-S2468823121004879-si6.svg?httpAccept=%2A%2F%2A",
            "@multimediatype": "Scalable Vector Graphics file",
            "@type": "ALTIMG",
            "@size": "21493",
            "@ref": "si6",
            "@mimetype": "image/svg+xml"
          },
          {
            "@category": "thumbnail",
            "@_fa": "true",
            "$": "https://api.elsevier.com/content/object/eid/1-s2.0-S2468823121004879-si7.svg?httpAccept=%2A%2F%2A",
            "@multimediatype": "Scalable Vector Graphics file",
            "@type": "ALTIMG",
            "@size": "5725",
            "@ref": "si7",
            "@mimetype": "image/svg+xml"
          },
          {
            "@category": "thumbnail",
            "@_fa": "true",
            "$": "https://api.elsevier.com/content/object/eid/1-s2.0-S2468823121004879-si8.svg?httpAccept=%2A%2F%2A",
            "@multimediatype": "Scalable Vector Graphics file",
            "@type": "ALTIMG",
            "@size": "5822",
            "@ref": "si8",
            "@mimetype": "image/svg+xml"
          },
          {
            "@category": "thumbnail",
            "@_fa": "true",
            "$": "https://api.elsevier.com/content/object/eid/1-s2.0-S2468823121004879-si9.svg?httpAccept=%2A%2F%2A",
            "@multimediatype": "Scalable Vector Graphics file",
            "@type": "ALTIMG",
            "@size": "1798",
            "@ref": "si9",
            "@mimetype": "image/svg+xml"
          },
          {
            "@category": "standard",
            "@_fa": "true",
            "$": "https://api.elsevier.com/content/object/eid/1-s2.0-S2468823121004879-am.pdf?httpAccept=%2A%2F%2A",
            "@multimediatype": "Acrobat PDF file",
            "@type": "AAM-PDF",
            "@size": "1945990",
            "@ref": "am",
            "@mimetype": "application/pdf"
          }
        ]
      },
      "link": {
        "@rel": "abstract",
        "@href": "https://api.elsevier.com/content/abstract/scopus_id/85114732575"
      }
    }
  }
}